python/models/bert/kernel_configs/bert_attn_split_1_128_12_64_0.log
{"i": [["[\"bert_split\", 1, 128, 12, 64, 0]", "cuda -keys=cuda,gpu -max_num_threads=1024 -model=unknown -thread_warp_size=32", [-1, 16, 64, 49152, 2147483647, 1024, 8, 32], "", 0, []], [[], [["FU", 1, [0, 1, 2]], ["SP", 1, 0, 294912, [18], 1], ["AN", 1, 0, 5], ["AN", 1, 1, 6]]]], "r": [[1.47815e-05, 1.47814e-05, 1.47814e-05, 1.47815e-05, 1.47817e-05, 1.47818e-05, 1.47813e-05, 1.47812e-05, 1.4781e-05, 1.47812e-05], 0, 14.203, 1657358721], "v": "v0.6"}
{"i": [["[\"bert_split\", 1, 128, 12, 64, 0]", "cuda -keys=cuda,gpu -max_num_threads=1024 -model=unknown -thread_warp_size=32", [-1, 16, 64, 49152, 2147483647, 1024, 8, 32], "", 0, []], [[], [["FU", 1, [0, 1, 2]], ["SP", 1, 0, 294912, [1], 1], ["AN", 1, 0, 5], ["AN", 1, 1, 6]]]], "r": [[0.000221279, 0.000221275, 0.000221274, 0.000221283, 0.000221277, 0.000221274, 0.000221276, 0.000221275, 0.000221274, 0.000221281], 0, 43.4505, 1657358750], "v": "v0.6"}
{"i": [["[\"bert_split\", 1, 128, 12, 64, 0]", "cuda -keys=cuda,gpu -max_num_threads=1024 -model=unknown -thread_warp_size=32", [-1, 16, 64, 49152, 2147483647, 1024, 8, 32], "", 0, []], [[], [["FU", 1, [0, 1, 2]], ["SP", 1, 0, 294912, [48], 1], ["AN", 1, 0, 5], ["AN", 1, 1, 6]]]], "r": [[7.15926e-06, 7.15966e-06, 7.1596e-06, 7.15996e-06, 7.15962e-06, 7.15983e-06, 7.15988e-06, 7.15938e-06, 7.1595e-06, 7.15953e-06], 0, 4.51523, 1657358711], "v": "v0.6"}
{"i": [["[\"bert_split\", 1, 128, 12, 64, 0]", "cuda -keys=cuda,gpu -max_num_threads=1024 -model=unknown -thread_warp_size=32", [-1, 16, 64, 49152, 2147483647, 1024, 8, 32], "", 0, []], [[], [["FU", 1, [0, 1, 2]], ["SP", 1, 0, 294912, [8], 1], ["AN", 1, 0, 5], ["AN", 1, 1, 6]]]], "r": [[3.01435e-05, 3.0144e-05, 3.0144e-05, 3.01437e-05, 3.01439e-05, 3.01433e-05, 3.01439e-05, 3.01434e-05, 3.01435e-05, 3.01436e-05], 0, 23.5513, 1657358730], "v": "v0.6"}
{"i": [["[\"bert_split\", 1, 128, 12, 64, 0]", "cuda -keys=cuda,gpu -max_num_threads=1024 -model=unknown -thread_warp_size=32", [-1, 16, 64, 49152, 2147483647, 1024, 8, 32], "", 0, []], [[], [["FU", 1, [0, 1, 2]], ["SP", 1, 0, 294912, [64], 1], ["AN", 1, 0, 5], ["AN", 1, 1, 6]]]], "r": [[5.93709e-06, 5.9372e-06, 5.9374e-06, 5.9371e-06, 5.93735e-06, 5.93712e-06, 5.93708e-06, 5.93751e-06, 5.93666e-06, 5.93719e-06], 0, 18.3465, 1657358725], "v": "v0.6"}
{"i": [["[\"bert_split\", 1, 128, 12, 64, 0]", "cuda -keys=cuda,gpu -max_num_threads=1024 -model=unknown -thread_warp_size=32", [-1, 16, 64, 49152, 2147483647, 1024, 8, 32], "", 0, []], [[], [["FU", 1, [0, 1, 2]], ["SP", 1, 0, 294912, [32], 1], ["AN", 1, 0, 5], ["AN", 1, 1, 6]]]], "r": [[9.56806e-06, 9.56992e-06, 9.56998e-06, 9.56979e-06, 9.57041e-06, 9.56954e-06, 9.56921e-06, 9.57016e-06, 9.56984e-06, 9.5695e-06], 0, 28.1656, 1657358735], "v": "v0.6"}
{"i": [["[\"bert_split\", 1, 128, 12, 64, 0]", "cuda -keys=cuda,gpu -max_num_threads=1024 -model=unknown -thread_warp_size=32", [-1, 16, 64, 49152, 2147483647, 1024, 8, 32], "", 0, []], [[], [["FU", 1, [0, 1, 2]], ["SP", 1, 0, 294912, [24], 1], ["AN", 1, 0, 5], ["AN", 1, 1, 6]]]], "r": [[1.19439e-05, 1.19464e-05, 1.19453e-05, 1.19467e-05, 1.1942e-05, 1.19452e-05, 1.19463e-05, 1.19457e-05, 1.19469e-05, 1.19439e-05], 0, 9.27048, 1657358716], "v": "v0.6"}
{"i": [["[\"bert_split\", 1, 128, 12, 64, 0]", "cuda -keys=cuda,gpu -max_num_threads=1024 -model=unknown -thread_warp_size=32", [-1, 16, 64, 49152, 2147483647, 1024, 8, 32], "", 0, []], [[], [["FU", 1, [0, 1, 2]], ["SP", 1, 0, 294912, [4], 1], ["AN", 1, 0, 5], ["AN", 1, 1, 6]]]], "r": [[5.72972e-05, 5.72874e-05, 5.72879e-05, 5.72879e-05, 5.72866e-05, 5.72893e-05, 5.72859e-05, 5.72884e-05, 5.72859e-05, 5.72886e-05], 0, 37.9601, 1657358744], "v": "v0.6"}
{"i": [["[\"bert_split\", 1, 128, 12, 64, 0]", "cuda -keys=cuda,gpu -max_num_threads=1024 -model=unknown -thread_warp_size=32", [-1, 16, 64, 49152, 2147483647, 1024, 8, 32], "", 0, []], [[], [["FU", 1, [0, 1, 2]], ["SP", 1, 0, 294912, [36], 1], ["AN", 1, 0, 5], ["AN", 1, 1, 6]]]], "r": [[8.5849e-06, 8.5848e-06, 8.58512e-06, 8.58509e-06, 8.58488e-06, 8.58441e-06, 8.58413e-06, 8.58516e-06, 8.58495e-06, 8.58499e-06], 0, 32.6322, 1657358739], "v": "v0.6"}
{"i": [["[\"bert_split\", 1, 128, 12, 64, 0]", "cuda -keys=cuda,gpu -max_num_threads=1024 -model=unknown -thread_warp_size=32", [-1, 16, 64, 49152, 2147483647, 1024, 8, 32], "", 0, []], [[], [["FU", 1, [0, 1, 2]], ["SP", 1, 0, 294912, [12], 1], ["AN", 1, 0, 5], ["AN", 1, 1, 6]]]], "r": [[2.10001e-05, 2.09972e-05, 2.09959e-05, 2.09969e-05, 2.09974e-05, 2.09965e-05, 2.09978e-05, 2.09982e-05, 2.09948e-05, 2.09941e-05], 0, 48.5242, 1657358755], "v": "v0.6"}
{"i": [["[\"bert_split\", 1, 128, 12, 64, 0]", "cuda -keys=cuda,gpu -max_num_threads=1024 -model=unknown -thread_warp_size=32", [-1, 16, 64, 49152, 2147483647, 1024, 8, 32], "", 0, []], [[], [["FU", 1, [0, 1, 2]], ["SP", 1, 0, 294912, [9], 1], ["AN", 1, 0, 5], ["AN", 1, 1, 6]]]], "r": [[2.70842e-05, 2.7083e-05, 2.70822e-05, 2.7083e-05, 2.70833e-05, 2.70823e-05, 2.7083e-05, 2.70827e-05, 2.70819e-05, 2.70835e-05], 0, 53.6993, 1657358760], "v": "v0.6"}
{"i": [["[\"bert_split\", 1, 128, 12, 64, 0]", "cuda -keys=cuda,gpu -max_num_threads=1024 -model=unknown -thread_warp_size=32", [-1, 16, 64, 49152, 2147483647, 1024, 8, 32], "", 0, []], [[], [["FU", 1, [0, 1, 2]], ["SP", 1, 0, 294912, [6], 1], ["AN", 1, 0, 5], ["AN", 1, 1, 6]]]], "r": [[3.91362e-05, 3.91395e-05, 3.91403e-05, 3.91397e-05, 3.91402e-05, 3.91304e-05, 3.91312e-05, 3.91376e-05, 3.91392e-05, 3.91336e-05], 0, 58.977, 1657358766], "v": "v0.6"}
{"i": [["[\"bert_split\", 1, 128, 12, 64, 0]", "cuda -keys=cuda,gpu -max_num_threads=1024 -model=unknown -thread_warp_size=32", [-1, 16, 64, 49152, 2147483647, 1024, 8, 32], "", 0, []], [[], [["FU", 1, [0, 1, 2]], ["SP", 1, 0, 294912, [2], 1], ["AN", 1, 0, 5], ["AN", 1, 1, 6]]]], "r": [[0.000111921, 0.000111918, 0.00011192, 0.000111921, 0.000111919, 0.00011192, 0.000111921, 0.000111921, 0.000111921, 0.000111921], 0, 64.3929, 1657358771], "v": "v0.6"}
{"i": [["[\"bert_split\", 1, 128, 12, 64, 0]", "cuda -keys=cuda,gpu -max_num_threads=1024 -model=unknown -thread_warp_size=32", [-1, 16, 64, 49152, 2147483647, 1024, 8, 32], "", 0, []], [[], [["FU", 1, [0, 1, 2]], ["SP", 1, 0, 294912, [3], 1], ["AN", 1, 0, 5], ["AN", 1, 1, 6]]]], "r": [[7.55148e-05, 7.55141e-05, 7.55147e-05, 7.55153e-05, 7.55096e-05, 7.55122e-05, 7.55124e-05, 7.55113e-05, 7.55092e-05, 7.55098e-05], 0, 69.7474, 1657358776], "v": "v0.6"}
{"i": [["[\"bert_split\", 1, 128, 12, 64, 0]", "cuda -keys=cuda,gpu -max_num_threads=1024 -model=unknown -thread_warp_size=32", [-1, 16, 64, 49152, 2147483647, 1024, 8, 32], "", 0, []], [[], [["FU", 1, [0, 1, 2]], ["SP", 1, 0, 294912, [16], 1], ["AN", 1, 0, 5], ["AN", 1, 1, 6]]]], "r": [[1.63047e-05, 1.63058e-05, 1.63032e-05, 1.63026e-05, 1.63008e-05, 1.63015e-05, 1.63006e-05, 1.63016e-05, 1.62996e-05, 1.63013e-05], 0, 74.7105, 1657358781], "v": "v0.6"}
