python/models/bert/kernel_configs/bert_bert_fused_v_reshape_transpose_1_128_12_64.log
{"i": [["[\"bert_fused_v_reshape_transpose\", 1, 128, 12, 64]", "cuda -keys=cuda,gpu -max_num_threads=1024 -model=unknown -thread_warp_size=32", [-1, 16, 64, 49152, 2147483647, 1024, 8, 32], "", 0, []], [[], [["FU", 1, [0, 1, 2]], ["SP", 1, 0, 98304, [12], 1], ["AN", 1, 0, 5], ["AN", 1, 1, 6]]]], "r": [[8.82879e-06, 8.82318e-06, 1.43523e-05, 9.15315e-06, 8.82404e-06, 8.82378e-06, 8.82349e-06, 8.82755e-06, 8.82499e-06, 9.14763e-06], 0, 14.7905, 1657297375], "v": "v0.6"}
{"i": [["[\"bert_fused_v_reshape_transpose\", 1, 128, 12, 64]", "cuda -keys=cuda,gpu -max_num_threads=1024 -model=unknown -thread_warp_size=32", [-1, 16, 64, 49152, 2147483647, 1024, 8, 32], "", 0, []], [[], [["FU", 1, [0, 1, 2]], ["SP", 1, 0, 98304, [32], 1], ["AN", 1, 0, 5], ["AN", 1, 1, 6]]]], "r": [[5.051e-06, 5.0441e-06, 5.047e-06, 8.47352e-06, 5.2326e-06, 5.07006e-06, 5.04388e-06, 5.04392e-06, 5.04375e-06, 5.05181e-06], 0, 23.6657, 1657297384], "v": "v0.6"}
{"i": [["[\"bert_fused_v_reshape_transpose\", 1, 128, 12, 64]", "cuda -keys=cuda,gpu -max_num_threads=1024 -model=unknown -thread_warp_size=32", [-1, 16, 64, 49152, 2147483647, 1024, 8, 32], "", 0, []], [[], [["FU", 1, [0, 1, 2]], ["SP", 1, 0, 98304, [16], 1], ["AN", 1, 0, 5], ["AN", 1, 1, 6]]]], "r": [[7.27835e-06, 7.19852e-06, 7.19808e-06, 7.19809e-06, 7.20303e-06, 7.19745e-06, 1.1675e-05, 7.74197e-06, 7.21647e-06, 7.19819e-06], 0, 19.4859, 1657297380], "v": "v0.6"}
{"i": [["[\"bert_fused_v_reshape_transpose\", 1, 128, 12, 64]", "cuda -keys=cuda,gpu -max_num_threads=1024 -model=unknown -thread_warp_size=32", [-1, 16, 64, 49152, 2147483647, 1024, 8, 32], "", 0, []], [[], [["FU", 1, [0, 1, 2]], ["SP", 1, 0, 98304, [64], 1], ["AN", 1, 0, 5], ["AN", 1, 1, 6]]]], "r": [[4.7193e-06, 4.72053e-06, 4.71983e-06, 4.70898e-06, 4.71937e-06, 4.71618e-06, 8.05547e-06, 4.90511e-06, 4.72015e-06, 4.71999e-06], 0, 9.95601, 1657297370], "v": "v0.6"}
{"i": [["[\"bert_fused_v_reshape_transpose\", 1, 128, 12, 64]", "cuda -keys=cuda,gpu -max_num_threads=1024 -model=unknown -thread_warp_size=32", [-1, 16, 64, 49152, 2147483647, 1024, 8, 32], "", 0, []], [[], [["FU", 1, [0, 1, 2]], ["SP", 1, 0, 98304, [6], 1], ["AN", 1, 0, 5], ["AN", 1, 1, 6]]]], "r": [[1.50237e-05, 1.50262e-05, 2.0195e-05, 1.81981e-05, 1.50589e-05, 1.50267e-05, 1.50263e-05, 1.50239e-05, 1.50272e-05, 2.37105e-05], 0, 5.57943, 1657297366], "v": "v0.6"}
{"i": [["[\"bert_fused_v_reshape_transpose\", 1, 128, 12, 64]", "cuda -keys=cuda,gpu -max_num_threads=1024 -model=unknown -thread_warp_size=32", [-1, 16, 64, 49152, 2147483647, 1024, 8, 32], "", 0, []], [[], [["FU", 1, [0, 1, 2]], ["SP", 1, 0, 98304, [24], 1], ["AN", 1, 0, 5], ["AN", 1, 1, 6]]]], "r": [[6.11198e-06, 6.11157e-06, 6.1074e-06, 6.11102e-06, 1.02197e-05, 6.35184e-06, 6.11246e-06, 6.1132e-06, 6.11319e-06, 6.10951e-06], 0, 39.5993, 1657297400], "v": "v0.6"}
{"i": [["[\"bert_fused_v_reshape_transpose\", 1, 128, 12, 64]", "cuda -keys=cuda,gpu -max_num_threads=1024 -model=unknown -thread_warp_size=32", [-1, 16, 64, 49152, 2147483647, 1024, 8, 32], "", 0, []], [[], [["FU", 1, [0, 1, 2]], ["SP", 1, 0, 98304, [3], 1], ["AN", 1, 0, 5], ["AN", 1, 1, 6]]]], "r": [[4.14936e-05, 2.78856e-05, 2.69904e-05, 2.69912e-05, 2.69896e-05, 2.69916e-05, 3.74897e-05, 3.18291e-05, 2.69915e-05, 2.6992e-05], 0, 29.3791, 1657297390], "v": "v0.6"}
{"i": [["[\"bert_fused_v_reshape_transpose\", 1, 128, 12, 64]", "cuda -keys=cuda,gpu -max_num_threads=1024 -model=unknown -thread_warp_size=32", [-1, 16, 64, 49152, 2147483647, 1024, 8, 32], "", 0, []], [[], [["FU", 1, [0, 1, 2]], ["SP", 1, 0, 98304, [2], 1], ["AN", 1, 0, 5], ["AN", 1, 1, 6]]]], "r": [[3.90243e-05, 4.50514e-05, 5.28822e-05, 3.93872e-05, 3.90231e-05, 3.90236e-05, 3.90238e-05, 3.90241e-05, 5.84448e-05, 4.02688e-05], 0, 35.0824, 1657297395], "v": "v0.6"}
{"i": [["[\"bert_fused_v_reshape_transpose\", 1, 128, 12, 64]", "cuda -keys=cuda,gpu -max_num_threads=1024 -model=unknown -thread_warp_size=32", [-1, 16, 64, 49152, 2147483647, 1024, 8, 32], "", 0, []], [[], [["FU", 1, [0, 1, 2]], ["SP", 1, 0, 98304, [1], 1], ["AN", 1, 0, 5], ["AN", 1, 1, 6]]]], "r": [[0.000116083, 7.79414e-05, 7.56231e-05, 7.56215e-05, 7.56228e-05, 7.56252e-05, 0.000118142, 7.79277e-05, 7.56248e-05, 7.56284e-05], 0, 45.5636, 1657297406], "v": "v0.6"}
{"i": [["[\"bert_fused_v_reshape_transpose\", 1, 128, 12, 64]", "cuda -keys=cuda,gpu -max_num_threads=1024 -model=unknown -thread_warp_size=32", [-1, 16, 64, 49152, 2147483647, 1024, 8, 32], "", 0, []], [[], [["FU", 1, [0, 1, 2]], ["SP", 1, 0, 98304, [48], 1], ["AN", 1, 0, 5], ["AN", 1, 1, 6]]]], "r": [[4.5904e-06, 4.59067e-06, 8.87724e-06, 4.77917e-06, 4.5863e-06, 4.58569e-06, 4.58563e-06, 4.58622e-06, 4.59163e-06, 4.58633e-06], 0, 49.811, 1657297410], "v": "v0.6"}
{"i": [["[\"bert_fused_v_reshape_transpose\", 1, 128, 12, 64]", "cuda -keys=cuda,gpu -max_num_threads=1024 -model=unknown -thread_warp_size=32", [-1, 16, 64, 49152, 2147483647, 1024, 8, 32], "", 0, []], [[], [["FU", 1, [0, 1, 2]], ["SP", 1, 0, 98304, [8], 1], ["AN", 1, 0, 5], ["AN", 1, 1, 6]]]], "r": [[2.28579e-05, 1.23717e-05, 1.18369e-05, 1.18378e-05, 1.18433e-05, 1.18455e-05, 1.18411e-05, 1.18345e-05, 1.18363e-05, 1.18378e-05], 0, 55.4795, 1657297416], "v": "v0.6"}
{"i": [["[\"bert_fused_v_reshape_transpose\", 1, 128, 12, 64]", "cuda -keys=cuda,gpu -max_num_threads=1024 -model=unknown -thread_warp_size=32", [-1, 16, 64, 49152, 2147483647, 1024, 8, 32], "", 0, []], [[], [["FU", 1, [0, 1, 2]], ["SP", 1, 0, 98304, [4], 1], ["AN", 1, 0, 5], ["AN", 1, 1, 6]]]], "r": [[2.10417e-05, 2.09459e-05, 2.09464e-05, 2.10005e-05, 2.09467e-05, 2.09459e-05, 2.13477e-05, 2.09455e-05, 2.0946e-05, 2.12881e-05], 0, 60.5846, 1657297421], "v": "v0.6"}
{"i": [["[\"bert_fused_v_reshape_transpose\", 1, 128, 12, 64]", "cuda -keys=cuda,gpu -max_num_threads=1024 -model=unknown -thread_warp_size=32", [-1, 16, 64, 49152, 2147483647, 1024, 8, 32], "", 0, []], [[], [["FU", 1, [0, 1, 2]], ["SP", 1, 0, 98304, [8], 1], ["AN", 1, 0, 5], ["AN", 1, 1, 6]]]], "r": [[2.60558e-05, 2.60974e-05, 2.60783e-05, 2.60962e-05, 2.60439e-05, 2.60775e-05, 2.6016e-05, 2.60564e-05, 2.60821e-05, 2.60246e-05], 0, 39.8279, 1657299639], "v": "v0.6"}
{"i": [["[\"bert_fused_v_reshape_transpose\", 1, 128, 12, 64]", "cuda -keys=cuda,gpu -max_num_threads=1024 -model=unknown -thread_warp_size=32", [-1, 16, 64, 49152, 2147483647, 1024, 8, 32], "", 0, []], [[], [["FU", 1, [0, 1, 2]], ["SP", 1, 0, 98304, [64], 1], ["AN", 1, 0, 5], ["AN", 1, 1, 6]]]], "r": [[1.03806e-05, 1.03702e-05, 1.03704e-05, 1.03687e-05, 1.03656e-05, 1.03597e-05, 1.03621e-05, 1.03197e-05, 1.03674e-05, 1.03687e-05], 0, 19.5599, 1657299619], "v": "v0.6"}
{"i": [["[\"bert_fused_v_reshape_transpose\", 1, 128, 12, 64]", "cuda -keys=cuda,gpu -max_num_threads=1024 -model=unknown -thread_warp_size=32", [-1, 16, 64, 49152, 2147483647, 1024, 8, 32], "", 0, []], [[], [["FU", 1, [0, 1, 2]], ["SP", 1, 0, 98304, [4], 1], ["AN", 1, 0, 5], ["AN", 1, 1, 6]]]], "r": [[4.63892e-05, 4.64046e-05, 2.17023e-05, 2.12291e-05, 2.09647e-05, 2.09585e-05, 2.09571e-05, 2.09597e-05, 2.09573e-05, 2.38814e-05], 0, 24.2592, 1657299623], "v": "v0.6"}
{"i": [["[\"bert_fused_v_reshape_transpose\", 1, 128, 12, 64]", "cuda -keys=cuda,gpu -max_num_threads=1024 -model=unknown -thread_warp_size=32", [-1, 16, 64, 49152, 2147483647, 1024, 8, 32], "", 0, []], [[], [["FU", 1, [0, 1, 2]], ["SP", 1, 0, 98304, [3], 1], ["AN", 1, 0, 5], ["AN", 1, 1, 6]]]], "r": [[6.01744e-05, 6.01615e-05, 6.01816e-05, 6.01499e-05, 6.01615e-05, 6.01416e-05, 6.0154e-05, 6.01439e-05, 6.01913e-05, 6.01352e-05], 0, 29.6818, 1657299629], "v": "v0.6"}
{"i": [["[\"bert_fused_v_reshape_transpose\", 1, 128, 12, 64]", "cuda -keys=cuda,gpu -max_num_threads=1024 -model=unknown -thread_warp_size=32", [-1, 16, 64, 49152, 2147483647, 1024, 8, 32], "", 0, []], [[], [["FU", 1, [0, 1, 2]], ["SP", 1, 0, 98304, [12], 1], ["AN", 1, 0, 5], ["AN", 1, 1, 6]]]], "r": [[8.74966e-06, 8.75069e-06, 8.75055e-06, 8.75151e-06, 8.75201e-06, 8.75005e-06, 8.75044e-06, 8.75068e-06, 8.75156e-06, 8.75175e-06], 0, 4.73444, 1657299604], "v": "v0.6"}
{"i": [["[\"bert_fused_v_reshape_transpose\", 1, 128, 12, 64]", "cuda -keys=cuda,gpu -max_num_threads=1024 -model=unknown -thread_warp_size=32", [-1, 16, 64, 49152, 2147483647, 1024, 8, 32], "", 0, []], [[], [["FU", 1, [0, 1, 2]], ["SP", 1, 0, 98304, [1], 1], ["AN", 1, 0, 5], ["AN", 1, 1, 6]]]], "r": [[7.55827e-05, 7.55837e-05, 7.5583e-05, 7.55834e-05, 7.81126e-05, 7.55841e-05, 7.55854e-05, 7.55833e-05, 7.55839e-05, 0.000129199], 0, 14.4809, 1657299614], "v": "v0.6"}
{"i": [["[\"bert_fused_v_reshape_transpose\", 1, 128, 12, 64]", "cuda -keys=cuda,gpu -max_num_threads=1024 -model=unknown -thread_warp_size=32", [-1, 16, 64, 49152, 2147483647, 1024, 8, 32], "", 0, []], [[], [["FU", 1, [0, 1, 2]], ["SP", 1, 0, 98304, [32], 1], ["AN", 1, 0, 5], ["AN", 1, 1, 6]]]], "r": [[5.25975e-06, 5.25941e-06, 5.25834e-06, 5.25838e-06, 5.259e-06, 5.25817e-06, 5.25873e-06, 5.25868e-06, 5.25839e-06, 5.25873e-06], 0, 8.80227, 1657299608], "v": "v0.6"}
{"i": [["[\"bert_fused_v_reshape_transpose\", 1, 128, 12, 64]", "cuda -keys=cuda,gpu -max_num_threads=1024 -model=unknown -thread_warp_size=32", [-1, 16, 64, 49152, 2147483647, 1024, 8, 32], "", 0, []], [[], [["FU", 1, [0, 1, 2]], ["SP", 1, 0, 98304, [24], 1], ["AN", 1, 0, 5], ["AN", 1, 1, 6]]]], "r": [[1.2766e-05, 1.27725e-05, 1.27547e-05, 1.27793e-05, 5.77024e-06, 5.77012e-06, 5.76931e-06, 5.76945e-06, 5.76918e-06, 1.26222e-05], 0, 35.1962, 1657299634], "v": "v0.6"}
{"i": [["[\"bert_fused_v_reshape_transpose\", 1, 128, 12, 64]", "cuda -keys=cuda,gpu -max_num_threads=1024 -model=unknown -thread_warp_size=32", [-1, 16, 64, 49152, 2147483647, 1024, 8, 32], "", 0, []], [[], [["FU", 1, [0, 1, 2]], ["SP", 1, 0, 98304, [48], 1], ["AN", 1, 0, 5], ["AN", 1, 1, 6]]]], "r": [[1.00749e-05, 1.0087e-05, 8.42883e-06, 4.67199e-06, 4.61711e-06, 4.61706e-06, 4.61739e-06, 4.61335e-06, 4.61307e-06, 4.61624e-06], 0, 44.1531, 1657299643], "v": "v0.6"}
{"i": [["[\"bert_fused_v_reshape_transpose\", 1, 128, 12, 64]", "cuda -keys=cuda,gpu -max_num_threads=1024 -model=unknown -thread_warp_size=32", [-1, 16, 64, 49152, 2147483647, 1024, 8, 32], "", 0, []], [[], [["FU", 1, [0, 1, 2]], ["SP", 1, 0, 98304, [2], 1], ["AN", 1, 0, 5], ["AN", 1, 1, 6]]]], "r": [[6.47136e-05, 8.64426e-05, 8.64091e-05, 8.64144e-05, 8.6419e-05, 8.63541e-05, 8.64428e-05, 7.37982e-05, 4.05013e-05, 3.91621e-05], 0, 62.8095, 1657299662], "v": "v0.6"}
{"i": [["[\"bert_fused_v_reshape_transpose\", 1, 128, 12, 64]", "cuda -keys=cuda,gpu -max_num_threads=1024 -model=unknown -thread_warp_size=32", [-1, 16, 64, 49152, 2147483647, 1024, 8, 32], "", 0, []], [[], [["FU", 1, [0, 1, 2]], ["SP", 1, 0, 98304, [16], 1], ["AN", 1, 0, 5], ["AN", 1, 1, 6]]]], "r": [[1.62067e-05, 1.62002e-05, 1.62282e-05, 1.62078e-05, 1.6206e-05, 1.62236e-05, 1.62273e-05, 1.62301e-05, 1.61912e-05, 1.62198e-05], 0, 48.573, 1657299648], "v": "v0.6"}
{"i": [["[\"bert_fused_v_reshape_transpose\", 1, 128, 12, 64]", "cuda -keys=cuda,gpu -max_num_threads=1024 -model=unknown -thread_warp_size=32", [-1, 16, 64, 49152, 2147483647, 1024, 8, 32], "", 0, []], [[], [["FU", 1, [0, 1, 2]], ["SP", 1, 0, 98304, [6], 1], ["AN", 1, 0, 5], ["AN", 1, 1, 6]]]], "r": [[3.29409e-05, 3.29697e-05, 3.29237e-05, 3.29193e-05, 3.294e-05, 1.56375e-05, 1.49293e-05, 1.4928e-05, 1.49292e-05, 1.49285e-05], 0, 53.5097, 1657299653], "v": "v0.6"}
