python/models/bert/kernel_configs/bert_auto_tvm_tune_batch_matmul_tensorcore_12_128_128_64.log
{"input": ["cuda -keys=cuda,gpu -max_num_threads=1024 -thread_warp_size=32", "batch_matmul_tensorcore.cuda", [["TENSOR", [12, 128, 64], "float16"], ["TENSOR", [12, 128, 64], "float16"], null, "float16"], {}], "config": {"index": 12106, "code_hash": null, "entity": [["block_row_warps", "ot", 2], ["block_col_warps", "ot", 1], ["warp_row_tiles", "ot", 2], ["warp_col_tiles", "ot", 2], ["chunk", "ot", 2], ["offset", "ot", 8], ["offsetCS", "ot", 0], ["vec", "ot", 2], ["wmma_m", "ot", 8]]}, "result": [[3.5492714999999994e-05], 0, 1.1411247253417969, 1655303627.9731812], "version": 0.2, "tvm_version": "0.8.0"}
{"input": ["cuda -keys=cuda,gpu -max_num_threads=1024 -thread_warp_size=32", "batch_matmul_tensorcore.cuda", [["TENSOR", [12, 128, 64], "float16"], ["TENSOR", [12, 128, 64], "float16"], null, "float16"], {}], "config": {"index": 12651, "code_hash": null, "entity": [["block_row_warps", "ot", 1], ["block_col_warps", "ot", 4], ["warp_row_tiles", "ot", 2], ["warp_col_tiles", "ot", 1], ["chunk", "ot", 1], ["offset", "ot", 8], ["offsetCS", "ot", 8], ["vec", "ot", 2], ["wmma_m", "ot", 8]]}, "result": [[5.7747548e-05], 0, 1.1875333786010742, 1655303628.6694], "version": 0.2, "tvm_version": "0.8.0"}
{"input": ["cuda -keys=cuda,gpu -max_num_threads=1024 -thread_warp_size=32", "batch_matmul_tensorcore.cuda", [["TENSOR", [12, 128, 64], "float16"], ["TENSOR", [12, 128, 64], "float16"], null, "float16"], {}], "config": {"index": 978, "code_hash": null, "entity": [["block_row_warps", "ot", 1], ["block_col_warps", "ot", 4], ["warp_row_tiles", "ot", 1], ["warp_col_tiles", "ot", 1], ["chunk", "ot", 1], ["offset", "ot", 8], ["offsetCS", "ot", 8], ["vec", "ot", 1], ["wmma_m", "ot", 32]]}, "result": [[5.7162799e-05], 0, 0.9391884803771973, 1655303629.7042322], "version": 0.2, "tvm_version": "0.8.0"}
{"input": ["cuda -keys=cuda,gpu -max_num_threads=1024 -thread_warp_size=32", "batch_matmul_tensorcore.cuda", [["TENSOR", [12, 128, 64], "float16"], ["TENSOR", [12, 128, 64], "float16"], null, "float16"], {}], "config": {"index": 13371, "code_hash": null, "entity": [["block_row_warps", "ot", 1], ["block_col_warps", "ot", 4], ["warp_row_tiles", "ot", 1], ["warp_col_tiles", "ot", 1], ["chunk", "ot", 2], ["offset", "ot", 8], ["offsetCS", "ot", 0], ["vec", "ot", 4], ["wmma_m", "ot", 8]]}, "result": [[3.7599334e-05], 0, 1.069397211074829, 1655303630.300857], "version": 0.2, "tvm_version": "0.8.0"}
{"input": ["cuda -keys=cuda,gpu -max_num_threads=1024 -thread_warp_size=32", "batch_matmul_tensorcore.cuda", [["TENSOR", [12, 128, 64], "float16"], ["TENSOR", [12, 128, 64], "float16"], null, "float16"], {}], "config": {"index": 2596, "code_hash": null, "entity": [["block_row_warps", "ot", 2], ["block_col_warps", "ot", 2], ["warp_row_tiles", "ot", 1], ["warp_col_tiles", "ot", 1], ["chunk", "ot", 1], ["offset", "ot", 0], ["offsetCS", "ot", 0], ["vec", "ot", 4], ["wmma_m", "ot", 32]]}, "result": [[4.7028222999999994e-05], 0, 1.1219861507415771, 1655303631.302424], "version": 0.2, "tvm_version": "0.8.0"}
{"input": ["cuda -keys=cuda,gpu -max_num_threads=1024 -thread_warp_size=32", "batch_matmul_tensorcore.cuda", [["TENSOR", [12, 128, 64], "float16"], ["TENSOR", [12, 128, 64], "float16"], null, "float16"], {}], "config": {"index": 2812, "code_hash": null, "entity": [["block_row_warps", "ot", 2], ["block_col_warps", "ot", 2], ["warp_row_tiles", "ot", 1], ["warp_col_tiles", "ot", 4], ["chunk", "ot", 4], ["offset", "ot", 0], ["offsetCS", "ot", 0], ["vec", "ot", 4], ["wmma_m", "ot", 32]]}, "result": [[3.7735111e-05], 0, 1.1546525955200195, 1655303632.372718], "version": 0.2, "tvm_version": "0.8.0"}
{"input": ["cuda -keys=cuda,gpu -max_num_threads=1024 -thread_warp_size=32", "batch_matmul_tensorcore.cuda", [["TENSOR", [12, 128, 64], "float16"], ["TENSOR", [12, 128, 64], "float16"], null, "float16"], {}], "config": {"index": 2704, "code_hash": null, "entity": [["block_row_warps", "ot", 2], ["block_col_warps", "ot", 2], ["warp_row_tiles", "ot", 1], ["warp_col_tiles", "ot", 2], ["chunk", "ot", 2], ["offset", "ot", 0], ["offsetCS", "ot", 0], ["vec", "ot", 4], ["wmma_m", "ot", 32]]}, "result": [[3.4346779000000004e-05], 0, 1.1392085552215576, 1655303632.9688816], "version": 0.2, "tvm_version": "0.8.0"}
{"input": ["cuda -keys=cuda,gpu -max_num_threads=1024 -thread_warp_size=32", "batch_matmul_tensorcore.cuda", [["TENSOR", [12, 128, 64], "float16"], ["TENSOR", [12, 128, 64], "float16"], null, "float16"], {}], "config": {"index": 3371, "code_hash": null, "entity": [["block_row_warps", "ot", 4], ["block_col_warps", "ot", 2], ["warp_row_tiles", "ot", 4], ["warp_col_tiles", "ot", 2], ["chunk", "ot", 2], ["offset", "ot", 0], ["offsetCS", "ot", 8], ["vec", "ot", 4], ["wmma_m", "ot", 32]]}, "result": [[4.7921911e-05], 0, 1.236149549484253, 1655303634.0009885], "version": 0.2, "tvm_version": "0.8.0"}
{"input": ["cuda -keys=cuda,gpu -max_num_threads=1024 -thread_warp_size=32", "batch_matmul_tensorcore.cuda", [["TENSOR", [12, 128, 64], "float16"], ["TENSOR", [12, 128, 64], "float16"], null, "float16"], {}], "config": {"index": 6646, "code_hash": null, "entity": [["block_row_warps", "ot", 2], ["block_col_warps", "ot", 2], ["warp_row_tiles", "ot", 1], ["warp_col_tiles", "ot", 1], ["chunk", "ot", 4], ["offset", "ot", 0], ["offsetCS", "ot", 0], ["vec", "ot", 2], ["wmma_m", "ot", 16]]}, "result": [[4.5738706000000006e-05], 0, 1.145920753479004, 1655303635.9868853], "version": 0.2, "tvm_version": "0.8.0"}
{"input": ["cuda -keys=cuda,gpu -max_num_threads=1024 -thread_warp_size=32", "batch_matmul_tensorcore.cuda", [["TENSOR", [12, 128, 64], "float16"], ["TENSOR", [12, 128, 64], "float16"], null, "float16"], {}], "config": {"index": 9249, "code_hash": null, "entity": [["block_row_warps", "ot", 1], ["block_col_warps", "ot", 4], ["warp_row_tiles", "ot", 2], ["warp_col_tiles", "ot", 1], ["chunk", "ot", 4], ["offset", "ot", 0], ["offsetCS", "ot", 0], ["vec", "ot", 8], ["wmma_m", "ot", 16]]}, "result": [[4.4674029e-05], 0, 1.0217444896697998, 1655303637.017121], "version": 0.2, "tvm_version": "0.8.0"}
{"input": ["cuda -keys=cuda,gpu -max_num_threads=1024 -thread_warp_size=32", "batch_matmul_tensorcore.cuda", [["TENSOR", [12, 128, 64], "float16"], ["TENSOR", [12, 128, 64], "float16"], null, "float16"], {}], "config": {"index": 1198, "code_hash": null, "entity": [["block_row_warps", "ot", 2], ["block_col_warps", "ot", 1], ["warp_row_tiles", "ot", 2], ["warp_col_tiles", "ot", 4], ["chunk", "ot", 4], ["offset", "ot", 8], ["offsetCS", "ot", 8], ["vec", "ot", 1], ["wmma_m", "ot", 32]]}, "result": [[3.9955790999999997e-05], 0, 1.2386934757232666, 1655303638.0551019], "version": 0.2, "tvm_version": "0.8.0"}
{"input": ["cuda -keys=cuda,gpu -max_num_threads=1024 -thread_warp_size=32", "batch_matmul_tensorcore.cuda", [["TENSOR", [12, 128, 64], "float16"], ["TENSOR", [12, 128, 64], "float16"], null, "float16"], {}], "config": {"index": 11163, "code_hash": null, "entity": [["block_row_warps", "ot", 1], ["block_col_warps", "ot", 2], ["warp_row_tiles", "ot", 2], ["warp_col_tiles", "ot", 4], ["chunk", "ot", 2], ["offset", "ot", 0], ["offsetCS", "ot", 8], ["vec", "ot", 1], ["wmma_m", "ot", 8]]}, "result": [[3.7191773e-05], 0, 1.1962432861328125, 1655303638.690575], "version": 0.2, "tvm_version": "0.8.0"}
{"input": ["cuda -keys=cuda,gpu -max_num_threads=1024 -thread_warp_size=32", "batch_matmul_tensorcore.cuda", [["TENSOR", [12, 128, 64], "float16"], ["TENSOR", [12, 128, 64], "float16"], null, "float16"], {}], "config": {"index": 3824, "code_hash": null, "entity": [["block_row_warps", "ot", 4], ["block_col_warps", "ot", 4], ["warp_row_tiles", "ot", 2], ["warp_col_tiles", "ot", 1], ["chunk", "ot", 8], ["offset", "ot", 8], ["offsetCS", "ot", 8], ["vec", "ot", 4], ["wmma_m", "ot", 32]]}, "result": [[3.6359587e-05], 0, 1.1185622215270996, 1655303639.7041435], "version": 0.2, "tvm_version": "0.8.0"}
{"input": ["cuda -keys=cuda,gpu -max_num_threads=1024 -thread_warp_size=32", "batch_matmul_tensorcore.cuda", [["TENSOR", [12, 128, 64], "float16"], ["TENSOR", [12, 128, 64], "float16"], null, "float16"], {}], "config": {"index": 11235, "code_hash": null, "entity": [["block_row_warps", "ot", 1], ["block_col_warps", "ot", 2], ["warp_row_tiles", "ot", 1], ["warp_col_tiles", "ot", 4], ["chunk", "ot", 4], ["offset", "ot", 0], ["offsetCS", "ot", 8], ["vec", "ot", 1], ["wmma_m", "ot", 8]]}, "result": [[2.9790261000000002e-05], 0, 0.97719407081604, 1655303640.717578], "version": 0.2, "tvm_version": "0.8.0"}
{"input": ["cuda -keys=cuda,gpu -max_num_threads=1024 -thread_warp_size=32", "batch_matmul_tensorcore.cuda", [["TENSOR", [12, 128, 64], "float16"], ["TENSOR", [12, 128, 64], "float16"], null, "float16"], {}], "config": {"index": 11804, "code_hash": null, "entity": [["block_row_warps", "ot", 4], ["block_col_warps", "ot", 2], ["warp_row_tiles", "ot", 1], ["warp_col_tiles", "ot", 4], ["chunk", "ot", 2], ["offset", "ot", 0], ["offsetCS", "ot", 0], ["vec", "ot", 2], ["wmma_m", "ot", 8]]}, "result": [[3.6890368e-05], 0, 1.215728998184204, 1655303641.3415875], "version": 0.2, "tvm_version": "0.8.0"}
{"input": ["cuda -keys=cuda,gpu -max_num_threads=1024 -thread_warp_size=32", "batch_matmul_tensorcore.cuda", [["TENSOR", [12, 128, 64], "float16"], ["TENSOR", [12, 128, 64], "float16"], null, "float16"], {}], "config": {"index": 5955, "code_hash": null, "entity": [["block_row_warps", "ot", 1], ["block_col_warps", "ot", 4], ["warp_row_tiles", "ot", 2], ["warp_col_tiles", "ot", 2], ["chunk", "ot", 2], ["offset", "ot", 0], ["offsetCS", "ot", 8], ["vec", "ot", 1], ["wmma_m", "ot", 16]]}, "result": [[3.2640635e-05], 0, 1.1282002925872803, 1655303641.9245512], "version": 0.2, "tvm_version": "0.8.0"}
{"input": ["cuda -keys=cuda,gpu -max_num_threads=1024 -thread_warp_size=32", "batch_matmul_tensorcore.cuda", [["TENSOR", [12, 128, 64], "float16"], ["TENSOR", [12, 128, 64], "float16"], null, "float16"], {}], "config": {"index": 1275, "code_hash": null, "entity": [["block_row_warps", "ot", 1], ["block_col_warps", "ot", 4], ["warp_row_tiles", "ot", 1], ["warp_col_tiles", "ot", 4], ["chunk", "ot", 8], ["offset", "ot", 8], ["offsetCS", "ot", 8], ["vec", "ot", 1], ["wmma_m", "ot", 32]]}, "result": [[1.0293993999999999e-05], 0, 1.148813009262085, 1655303685.7722151], "version": 0.2, "tvm_version": "0.8.0"}
{"input": ["cuda -keys=cuda,gpu -max_num_threads=1024 -thread_warp_size=32", "batch_matmul_tensorcore.cuda", [["TENSOR", [12, 128, 64], "float16"], ["TENSOR", [12, 128, 64], "float16"], null, "float16"], {}], "config": {"index": 5757, "code_hash": null, "entity": [["block_row_warps", "ot", 1], ["block_col_warps", "ot", 4], ["warp_row_tiles", "ot", 1], ["warp_col_tiles", "ot", 1], ["chunk", "ot", 8], ["offset", "ot", 8], ["offsetCS", "ot", 0], ["vec", "ot", 1], ["wmma_m", "ot", 16]]}, "result": [[1.0088228000000001e-05], 0, 1.3163948059082031, 1655303686.6943288], "version": 0.2, "tvm_version": "0.8.0"}
{"input": ["cuda -keys=cuda,gpu -max_num_threads=1024 -thread_warp_size=32", "batch_matmul_tensorcore.cuda", [["TENSOR", [12, 128, 64], "float16"], ["TENSOR", [12, 128, 64], "float16"], null, "float16"], {}], "config": {"index": 12154, "code_hash": null, "entity": [["block_row_warps", "ot", 2], ["block_col_warps", "ot", 2], ["warp_row_tiles", "ot", 1], ["warp_col_tiles", "ot", 1], ["chunk", "ot", 4], ["offset", "ot", 8], ["offsetCS", "ot", 0], ["vec", "ot", 2], ["wmma_m", "ot", 8]]}, "result": [[9.929779975278122e-06], 0, 1.1584696769714355, 1655303688.0884845], "version": 0.2, "tvm_version": "0.8.0"}
{"input": ["cuda -keys=cuda,gpu -max_num_threads=1024 -thread_warp_size=32", "batch_matmul_tensorcore.cuda", [["TENSOR", [12, 128, 64], "float16"], ["TENSOR", [12, 128, 64], "float16"], null, "float16"], {}], "config": {"index": 10067, "code_hash": null, "entity": [["block_row_warps", "ot", 4], ["block_col_warps", "ot", 2], ["warp_row_tiles", "ot", 4], ["warp_col_tiles", "ot", 1], ["chunk", "ot", 1], ["offset", "ot", 8], ["offsetCS", "ot", 8], ["vec", "ot", 8], ["wmma_m", "ot", 16]]}, "result": [[3.8430513999999996e-05], 0, 1.6033520698547363, 1655303689.2108755], "version": 0.2, "tvm_version": "0.8.0"}
{"input": ["cuda -keys=cuda,gpu -max_num_threads=1024 -thread_warp_size=32", "batch_matmul_tensorcore.cuda", [["TENSOR", [12, 128, 64], "float16"], ["TENSOR", [12, 128, 64], "float16"], null, "float16"], {}], "config": {"index": 13115, "code_hash": null, "entity": [["block_row_warps", "ot", 4], ["block_col_warps", "ot", 1], ["warp_row_tiles", "ot", 4], ["warp_col_tiles", "ot", 4], ["chunk", "ot", 2], ["offset", "ot", 0], ["offsetCS", "ot", 0], ["vec", "ot", 4], ["wmma_m", "ot", 8]]}, "result": [[3.5617189e-05], 0, 1.3435273170471191, 1655303690.6938257], "version": 0.2, "tvm_version": "0.8.0"}
{"input": ["cuda -keys=cuda,gpu -max_num_threads=1024 -thread_warp_size=32", "batch_matmul_tensorcore.cuda", [["TENSOR", [12, 128, 64], "float16"], ["TENSOR", [12, 128, 64], "float16"], null, "float16"], {}], "config": {"index": 8571, "code_hash": null, "entity": [["block_row_warps", "ot", 1], ["block_col_warps", "ot", 2], ["warp_row_tiles", "ot", 2], ["warp_col_tiles", "ot", 4], ["chunk", "ot", 2], ["offset", "ot", 0], ["offsetCS", "ot", 8], ["vec", "ot", 4], ["wmma_m", "ot", 16]]}, "result": [[1.0165575e-05], 0, 1.2073936462402344, 1655303692.0779064], "version": 0.2, "tvm_version": "0.8.0"}
{"input": ["cuda -keys=cuda,gpu -max_num_threads=1024 -thread_warp_size=32", "batch_matmul_tensorcore.cuda", [["TENSOR", [12, 128, 64], "float16"], ["TENSOR", [12, 128, 64], "float16"], null, "float16"], {}], "config": {"index": 1061, "code_hash": null, "entity": [["block_row_warps", "ot", 4], ["block_col_warps", "ot", 4], ["warp_row_tiles", "ot", 1], ["warp_col_tiles", "ot", 1], ["chunk", "ot", 2], ["offset", "ot", 8], ["offsetCS", "ot", 8], ["vec", "ot", 1], ["wmma_m", "ot", 32]]}, "result": [[2.6386254000000003e-05], 0, 1.160038709640503, 1655303693.4768882], "version": 0.2, "tvm_version": "0.8.0"}
{"input": ["cuda -keys=cuda,gpu -max_num_threads=1024 -thread_warp_size=32", "batch_matmul_tensorcore.cuda", [["TENSOR", [12, 128, 64], "float16"], ["TENSOR", [12, 128, 64], "float16"], null, "float16"], {}], "config": {"index": 11805, "code_hash": null, "entity": [["block_row_warps", "ot", 1], ["block_col_warps", "ot", 4], ["warp_row_tiles", "ot", 1], ["warp_col_tiles", "ot", 4], ["chunk", "ot", 2], ["offset", "ot", 0], ["offsetCS", "ot", 0], ["vec", "ot", 2], ["wmma_m", "ot", 8]]}, "result": [[1.5782856e-05], 0, 1.2946739196777344, 1655303694.8624732], "version": 0.2, "tvm_version": "0.8.0"}
{"input": ["cuda -keys=cuda,gpu -max_num_threads=1024 -thread_warp_size=32", "batch_matmul_tensorcore.cuda", [["TENSOR", [12, 128, 64], "float16"], ["TENSOR", [12, 128, 64], "float16"], null, "float16"], {}], "config": {"index": 3667, "code_hash": null, "entity": [["block_row_warps", "ot", 2], ["block_col_warps", "ot", 2], ["warp_row_tiles", "ot", 4], ["warp_col_tiles", "ot", 1], ["chunk", "ot", 2], ["offset", "ot", 8], ["offsetCS", "ot", 8], ["vec", "ot", 4], ["wmma_m", "ot", 32]]}, "result": [[1.1507749999999998e-05], 0, 1.2585837841033936, 1655303696.252141], "version": 0.2, "tvm_version": "0.8.0"}
{"input": ["cuda -keys=cuda,gpu -max_num_threads=1024 -thread_warp_size=32", "batch_matmul_tensorcore.cuda", [["TENSOR", [12, 128, 64], "float16"], ["TENSOR", [12, 128, 64], "float16"], null, "float16"], {}], "config": {"index": 8216, "code_hash": null, "entity": [["block_row_warps", "ot", 4], ["block_col_warps", "ot", 4], ["warp_row_tiles", "ot", 1], ["warp_col_tiles", "ot", 2], ["chunk", "ot", 2], ["offset", "ot", 8], ["offsetCS", "ot", 0], ["vec", "ot", 4], ["wmma_m", "ot", 16]]}, "result": [[6.665841499999999e-05], 0, 1.655470609664917, 1655303697.435321], "version": 0.2, "tvm_version": "0.8.0"}
{"input": ["cuda -keys=cuda,gpu -max_num_threads=1024 -thread_warp_size=32", "batch_matmul_tensorcore.cuda", [["TENSOR", [12, 128, 64], "float16"], ["TENSOR", [12, 128, 64], "float16"], null, "float16"], {}], "config": {"index": 3958, "code_hash": null, "entity": [["block_row_warps", "ot", 2], ["block_col_warps", "ot", 4], ["warp_row_tiles", "ot", 2], ["warp_col_tiles", "ot", 4], ["chunk", "ot", 1], ["offset", "ot", 0], ["offsetCS", "ot", 0], ["vec", "ot", 8], ["wmma_m", "ot", 32]]}, "result": [[9.7324779e-05], 0, 1.6865308284759521, 1655303698.684169], "version": 0.2, "tvm_version": "0.8.0"}
{"input": ["cuda -keys=cuda,gpu -max_num_threads=1024 -thread_warp_size=32", "batch_matmul_tensorcore.cuda", [["TENSOR", [12, 128, 64], "float16"], ["TENSOR", [12, 128, 64], "float16"], null, "float16"], {}], "config": {"index": 5422, "code_hash": null, "entity": [["block_row_warps", "ot", 2], ["block_col_warps", "ot", 2], ["warp_row_tiles", "ot", 4], ["warp_col_tiles", "ot", 4], ["chunk", "ot", 4], ["offset", "ot", 0], ["offsetCS", "ot", 0], ["vec", "ot", 1], ["wmma_m", "ot", 16]]}, "result": [[4.2229790999999995e-05], 0, 1.7948319911956787, 1655303699.9236968], "version": 0.2, "tvm_version": "0.8.0"}
{"input": ["cuda -keys=cuda,gpu -max_num_threads=1024 -thread_warp_size=32", "batch_matmul_tensorcore.cuda", [["TENSOR", [12, 128, 64], "float16"], ["TENSOR", [12, 128, 64], "float16"], null, "float16"], {}], "config": {"index": 2027, "code_hash": null, "entity": [["block_row_warps", "ot", 4], ["block_col_warps", "ot", 1], ["warp_row_tiles", "ot", 1], ["warp_col_tiles", "ot", 1], ["chunk", "ot", 2], ["offset", "ot", 0], ["offsetCS", "ot", 8], ["vec", "ot", 2], ["wmma_m", "ot", 32]]}, "result": [[1.5573804e-05], 0, 1.1633632183074951, 1655303701.2949545], "version": 0.2, "tvm_version": "0.8.0"}
{"input": ["cuda -keys=cuda,gpu -max_num_threads=1024 -thread_warp_size=32", "batch_matmul_tensorcore.cuda", [["TENSOR", [12, 128, 64], "float16"], ["TENSOR", [12, 128, 64], "float16"], null, "float16"], {}], "config": {"index": 14270, "code_hash": null, "entity": [["block_row_warps", "ot", 4], ["block_col_warps", "ot", 2], ["warp_row_tiles", "ot", 2], ["warp_col_tiles", "ot", 1], ["chunk", "ot", 1], ["offset", "ot", 0], ["offsetCS", "ot", 0], ["vec", "ot", 8], ["wmma_m", "ot", 8]]}, "result": [[8.2830363e-05], 0, 1.6220371723175049, 1655303702.526388], "version": 0.2, "tvm_version": "0.8.0"}
{"input": ["cuda -keys=cuda,gpu -max_num_threads=1024 -thread_warp_size=32", "batch_matmul_tensorcore.cuda", [["TENSOR", [12, 128, 64], "float16"], ["TENSOR", [12, 128, 64], "float16"], null, "float16"], {}], "config": {"index": 5652, "code_hash": null, "entity": [["block_row_warps", "ot", 1], ["block_col_warps", "ot", 1], ["warp_row_tiles", "ot", 2], ["warp_col_tiles", "ot", 4], ["chunk", "ot", 2], ["offset", "ot", 8], ["offsetCS", "ot", 0], ["vec", "ot", 1], ["wmma_m", "ot", 16]]}, "result": [[1.1848736e-05], 0, 1.5459837913513184, 1655303703.5757365], "version": 0.2, "tvm_version": "0.8.0"}
{"input": ["cuda -keys=cuda,gpu -max_num_threads=1024 -thread_warp_size=32", "batch_matmul_tensorcore.cuda", [["TENSOR", [12, 128, 64], "float16"], ["TENSOR", [12, 128, 64], "float16"], null, "float16"], {}], "config": {"index": 9898, "code_hash": null, "entity": [["block_row_warps", "ot", 2], ["block_col_warps", "ot", 4], ["warp_row_tiles", "ot", 2], ["warp_col_tiles", "ot", 1], ["chunk", "ot", 4], ["offset", "ot", 0], ["offsetCS", "ot", 8], ["vec", "ot", 8], ["wmma_m", "ot", 16]]}, "result": [[4.3124023000000005e-05], 0, 1.4906866550445557, 1655303704.6233091], "version": 0.2, "tvm_version": "0.8.0"}
{"input": ["cuda -keys=cuda,gpu -max_num_threads=1024 -thread_warp_size=32", "batch_matmul_tensorcore.cuda", [["TENSOR", [12, 128, 64], "float16"], ["TENSOR", [12, 128, 64], "float16"], null, "float16"], {}], "config": {"index": 7510, "code_hash": null, "entity": [["block_row_warps", "ot", 2], ["block_col_warps", "ot", 2], ["warp_row_tiles", "ot", 1], ["warp_col_tiles", "ot", 4], ["chunk", "ot", 1], ["offset", "ot", 8], ["offsetCS", "ot", 8], ["vec", "ot", 2], ["wmma_m", "ot", 16]]}, "result": [[1.0797941000000001e-05], 0, 1.1521987915039062, 1655303705.9997952], "version": 0.2, "tvm_version": "0.8.0"}
{"input": ["cuda -keys=cuda,gpu -max_num_threads=1024 -thread_warp_size=32", "batch_matmul_tensorcore.cuda", [["TENSOR", [12, 128, 64], "float16"], ["TENSOR", [12, 128, 64], "float16"], null, "float16"], {}], "config": {"index": 7662, "code_hash": null, "entity": [["block_row_warps", "ot", 1], ["block_col_warps", "ot", 2], ["warp_row_tiles", "ot", 4], ["warp_col_tiles", "ot", 2], ["chunk", "ot", 4], ["offset", "ot", 8], ["offsetCS", "ot", 8], ["vec", "ot", 2], ["wmma_m", "ot", 16]]}, "result": [[8.34824042027194e-06], 0, 1.2622160911560059, 1655303707.4030752], "version": 0.2, "tvm_version": "0.8.0"}
{"input": ["cuda -keys=cuda,gpu -max_num_threads=1024 -thread_warp_size=32", "batch_matmul_tensorcore.cuda", [["TENSOR", [12, 128, 64], "float16"], ["TENSOR", [12, 128, 64], "float16"], null, "float16"], {}], "config": {"index": 2757, "code_hash": null, "entity": [["block_row_warps", "ot", 1], ["block_col_warps", "ot", 2], ["warp_row_tiles", "ot", 1], ["warp_col_tiles", "ot", 1], ["chunk", "ot", 4], ["offset", "ot", 0], ["offsetCS", "ot", 0], ["vec", "ot", 4], ["wmma_m", "ot", 32]]}, "result": [[1.4198245e-05], 0, 1.3309674263000488, 1655303708.3783715], "version": 0.2, "tvm_version": "0.8.0"}
{"input": ["cuda -keys=cuda,gpu -max_num_threads=1024 -thread_warp_size=32", "batch_matmul_tensorcore.cuda", [["TENSOR", [12, 128, 64], "float16"], ["TENSOR", [12, 128, 64], "float16"], null, "float16"], {}], "config": {"index": 8365, "code_hash": null, "entity": [["block_row_warps", "ot", 2], ["block_col_warps", "ot", 2], ["warp_row_tiles", "ot", 4], ["warp_col_tiles", "ot", 1], ["chunk", "ot", 8], ["offset", "ot", 8], ["offsetCS", "ot", 0], ["vec", "ot", 4], ["wmma_m", "ot", 16]]}, "result": [[1.0044628e-05], 0, 1.5191364288330078, 1655303768.7467864], "version": 0.2, "tvm_version": "0.8.0"}
{"input": ["cuda -keys=cuda,gpu -max_num_threads=1024 -thread_warp_size=32", "batch_matmul_tensorcore.cuda", [["TENSOR", [12, 128, 64], "float16"], ["TENSOR", [12, 128, 64], "float16"], null, "float16"], {}], "config": {"index": 11753, "code_hash": null, "entity": [["block_row_warps", "ot", 4], ["block_col_warps", "ot", 4], ["warp_row_tiles", "ot", 1], ["warp_col_tiles", "ot", 1], ["chunk", "ot", 2], ["offset", "ot", 0], ["offsetCS", "ot", 0], ["vec", "ot", 2], ["wmma_m", "ot", 8]]}, "result": [[7.991146300000001e-05], 0, 2.490304470062256, 1655303770.8557293], "version": 0.2, "tvm_version": "0.8.0"}
{"input": ["cuda -keys=cuda,gpu -max_num_threads=1024 -thread_warp_size=32", "batch_matmul_tensorcore.cuda", [["TENSOR", [12, 128, 64], "float16"], ["TENSOR", [12, 128, 64], "float16"], null, "float16"], {}], "config": {"index": 4619, "code_hash": null, "entity": [["block_row_warps", "ot", 4], ["block_col_warps", "ot", 1], ["warp_row_tiles", "ot", 1], ["warp_col_tiles", "ot", 1], ["chunk", "ot", 2], ["offset", "ot", 0], ["offsetCS", "ot", 8], ["vec", "ot", 8], ["wmma_m", "ot", 32]]}, "result": [[1.6949939000000002e-05], 0, 1.9891877174377441, 1655303772.7871912], "version": 0.2, "tvm_version": "0.8.0"}
{"input": ["cuda -keys=cuda,gpu -max_num_threads=1024 -thread_warp_size=32", "batch_matmul_tensorcore.cuda", [["TENSOR", [12, 128, 64], "float16"], ["TENSOR", [12, 128, 64], "float16"], null, "float16"], {}], "config": {"index": 1339, "code_hash": null, "entity": [["block_row_warps", "ot", 2], ["block_col_warps", "ot", 4], ["warp_row_tiles", "ot", 2], ["warp_col_tiles", "ot", 2], ["chunk", "ot", 1], ["offset", "ot", 0], ["offsetCS", "ot", 0], ["vec", "ot", 2], ["wmma_m", "ot", 32]]}, "result": [[3.5479971999999996e-05], 0, 1.8737201690673828, 1655303773.927868], "version": 0.2, "tvm_version": "0.8.0"}
{"input": ["cuda -keys=cuda,gpu -max_num_threads=1024 -thread_warp_size=32", "batch_matmul_tensorcore.cuda", [["TENSOR", [12, 128, 64], "float16"], ["TENSOR", [12, 128, 64], "float16"], null, "float16"], {}], "config": {"index": 12888, "code_hash": null, "entity": [["block_row_warps", "ot", 1], ["block_col_warps", "ot", 1], ["warp_row_tiles", "ot", 2], ["warp_col_tiles", "ot", 1], ["chunk", "ot", 8], ["offset", "ot", 8], ["offsetCS", "ot", 8], ["vec", "ot", 2], ["wmma_m", "ot", 8]]}, "result": [[7.142440667490729e-06], 0, 1.415177822113037, 1655303775.2935348], "version": 0.2, "tvm_version": "0.8.0"}
{"input": ["cuda -keys=cuda,gpu -max_num_threads=1024 -thread_warp_size=32", "batch_matmul_tensorcore.cuda", [["TENSOR", [12, 128, 64], "float16"], ["TENSOR", [12, 128, 64], "float16"], null, "float16"], {}], "config": {"index": 6578, "code_hash": null, "entity": [["block_row_warps", "ot", 4], ["block_col_warps", "ot", 4], ["warp_row_tiles", "ot", 2], ["warp_col_tiles", "ot", 1], ["chunk", "ot", 2], ["offset", "ot", 0], ["offsetCS", "ot", 0], ["vec", "ot", 2], ["wmma_m", "ot", 16]]}, "result": [[9.870391900000001e-05], 0, 1.6560442447662354, 1655303776.9205184], "version": 0.2, "tvm_version": "0.8.0"}
{"input": ["cuda -keys=cuda,gpu -max_num_threads=1024 -thread_warp_size=32", "batch_matmul_tensorcore.cuda", [["TENSOR", [12, 128, 64], "float16"], ["TENSOR", [12, 128, 64], "float16"], null, "float16"], {}], "config": {"index": 13851, "code_hash": null, "entity": [["block_row_warps", "ot", 1], ["block_col_warps", "ot", 1], ["warp_row_tiles", "ot", 1], ["warp_col_tiles", "ot", 1], ["chunk", "ot", 8], ["offset", "ot", 0], ["offsetCS", "ot", 8], ["vec", "ot", 4], ["wmma_m", "ot", 8]]}, "result": [[1.1716529e-05], 0, 1.400805950164795, 1655303778.2790463], "version": 0.2, "tvm_version": "0.8.0"}
{"input": ["cuda -keys=cuda,gpu -max_num_threads=1024 -thread_warp_size=32", "batch_matmul_tensorcore.cuda", [["TENSOR", [12, 128, 64], "float16"], ["TENSOR", [12, 128, 64], "float16"], null, "float16"], {}], "config": {"index": 10496, "code_hash": null, "entity": [["block_row_warps", "ot", 4], ["block_col_warps", "ot", 1], ["warp_row_tiles", "ot", 4], ["warp_col_tiles", "ot", 2], ["chunk", "ot", 2], ["offset", "ot", 0], ["offsetCS", "ot", 0], ["vec", "ot", 1], ["wmma_m", "ot", 8]]}, "result": [[2.5542571e-05], 0, 1.8064849376678467, 1655303779.3156102], "version": 0.2, "tvm_version": "0.8.0"}
{"input": ["cuda -keys=cuda,gpu -max_num_threads=1024 -thread_warp_size=32", "batch_matmul_tensorcore.cuda", [["TENSOR", [12, 128, 64], "float16"], ["TENSOR", [12, 128, 64], "float16"], null, "float16"], {}], "config": {"index": 3641, "code_hash": null, "entity": [["block_row_warps", "ot", 4], ["block_col_warps", "ot", 2], ["warp_row_tiles", "ot", 4], ["warp_col_tiles", "ot", 4], ["chunk", "ot", 1], ["offset", "ot", 8], ["offsetCS", "ot", 8], ["vec", "ot", 4], ["wmma_m", "ot", 32]]}, "result": [[2.099058e-05], 0, 1.5542998313903809, 1655303780.7542784], "version": 0.2, "tvm_version": "0.8.0"}
{"input": ["cuda -keys=cuda,gpu -max_num_threads=1024 -thread_warp_size=32", "batch_matmul_tensorcore.cuda", [["TENSOR", [12, 128, 64], "float16"], ["TENSOR", [12, 128, 64], "float16"], null, "float16"], {}], "config": {"index": 13406, "code_hash": null, "entity": [["block_row_warps", "ot", 4], ["block_col_warps", "ot", 2], ["warp_row_tiles", "ot", 2], ["warp_col_tiles", "ot", 2], ["chunk", "ot", 2], ["offset", "ot", 8], ["offsetCS", "ot", 0], ["vec", "ot", 4], ["wmma_m", "ot", 8]]}, "result": [[3.1645112000000006e-05], 0, 1.7773230075836182, 1655303781.8332384], "version": 0.2, "tvm_version": "0.8.0"}
{"input": ["cuda -keys=cuda,gpu -max_num_threads=1024 -thread_warp_size=32", "batch_matmul_tensorcore.cuda", [["TENSOR", [12, 128, 64], "float16"], ["TENSOR", [12, 128, 64], "float16"], null, "float16"], {}], "config": {"index": 11911, "code_hash": null, "entity": [["block_row_warps", "ot", 2], ["block_col_warps", "ot", 2], ["warp_row_tiles", "ot", 1], ["warp_col_tiles", "ot", 1], ["chunk", "ot", 8], ["offset", "ot", 0], ["offsetCS", "ot", 0], ["vec", "ot", 2], ["wmma_m", "ot", 8]]}, "result": [[2.1818859e-05], 0, 1.7781486511230469, 1655303782.937131], "version": 0.2, "tvm_version": "0.8.0"}
{"input": ["cuda -keys=cuda,gpu -max_num_threads=1024 -thread_warp_size=32", "batch_matmul_tensorcore.cuda", [["TENSOR", [12, 128, 64], "float16"], ["TENSOR", [12, 128, 64], "float16"], null, "float16"], {}], "config": {"index": 13689, "code_hash": null, "entity": [["block_row_warps", "ot", 1], ["block_col_warps", "ot", 1], ["warp_row_tiles", "ot", 1], ["warp_col_tiles", "ot", 1], ["chunk", "ot", 2], ["offset", "ot", 0], ["offsetCS", "ot", 8], ["vec", "ot", 4], ["wmma_m", "ot", 8]]}, "result": [[1.0073664000000001e-05], 0, 1.649717092514038, 1655303783.8947475], "version": 0.2, "tvm_version": "0.8.0"}
{"input": ["cuda -keys=cuda,gpu -max_num_threads=1024 -thread_warp_size=32", "batch_matmul_tensorcore.cuda", [["TENSOR", [12, 128, 64], "float16"], ["TENSOR", [12, 128, 64], "float16"], null, "float16"], {}], "config": {"index": 9622, "code_hash": null, "entity": [["block_row_warps", "ot", 2], ["block_col_warps", "ot", 1], ["warp_row_tiles", "ot", 2], ["warp_col_tiles", "ot", 4], ["chunk", "ot", 4], ["offset", "ot", 8], ["offsetCS", "ot", 0], ["vec", "ot", 8], ["wmma_m", "ot", 16]]}, "result": [[9.043569221260816e-06], 0, 1.4781672954559326, 1655303785.3042407], "version": 0.2, "tvm_version": "0.8.0"}
{"input": ["cuda -keys=cuda,gpu -max_num_threads=1024 -thread_warp_size=32", "batch_matmul_tensorcore.cuda", [["TENSOR", [12, 128, 64], "float16"], ["TENSOR", [12, 128, 64], "float16"], null, "float16"], {}], "config": {"index": 194, "code_hash": null, "entity": [["block_row_warps", "ot", 4], ["block_col_warps", "ot", 2], ["warp_row_tiles", "ot", 1], ["warp_col_tiles", "ot", 2], ["chunk", "ot", 4], ["offset", "ot", 0], ["offsetCS", "ot", 0], ["vec", "ot", 1], ["wmma_m", "ot", 32]]}, "result": [[4.295913e-05], 0, 1.8247230052947998, 1655303786.417937], "version": 0.2, "tvm_version": "0.8.0"}
{"input": ["cuda -keys=cuda,gpu -max_num_threads=1024 -thread_warp_size=32", "batch_matmul_tensorcore.cuda", [["TENSOR", [12, 128, 64], "float16"], ["TENSOR", [12, 128, 64], "float16"], null, "float16"], {}], "config": {"index": 11349, "code_hash": null, "entity": [["block_row_warps", "ot", 1], ["block_col_warps", "ot", 1], ["warp_row_tiles", "ot", 2], ["warp_col_tiles", "ot", 1], ["chunk", "ot", 1], ["offset", "ot", 8], ["offsetCS", "ot", 8], ["vec", "ot", 1], ["wmma_m", "ot", 8]]}, "result": [[8.488263906056861e-06], 0, 1.4066147804260254, 1655303787.7816534], "version": 0.2, "tvm_version": "0.8.0"}
{"input": ["cuda -keys=cuda,gpu -max_num_threads=1024 -thread_warp_size=32", "batch_matmul_tensorcore.cuda", [["TENSOR", [12, 128, 64], "float16"], ["TENSOR", [12, 128, 64], "float16"], null, "float16"], {}], "config": {"index": 8173, "code_hash": null, "entity": [["block_row_warps", "ot", 2], ["block_col_warps", "ot", 1], ["warp_row_tiles", "ot", 4], ["warp_col_tiles", "ot", 4], ["chunk", "ot", 1], ["offset", "ot", 8], ["offsetCS", "ot", 0], ["vec", "ot", 4], ["wmma_m", "ot", 16]]}, "result": [[1.2835726e-05], 0, 1.8596570491790771, 1655303788.8327074], "version": 0.2, "tvm_version": "0.8.0"}
{"input": ["cuda -keys=cuda,gpu -max_num_threads=1024 -thread_warp_size=32", "batch_matmul_tensorcore.cuda", [["TENSOR", [12, 128, 64], "float16"], ["TENSOR", [12, 128, 64], "float16"], null, "float16"], {}], "config": {"index": 6593, "code_hash": null, "entity": [["block_row_warps", "ot", 4], ["block_col_warps", "ot", 2], ["warp_row_tiles", "ot", 1], ["warp_col_tiles", "ot", 2], ["chunk", "ot", 2], ["offset", "ot", 0], ["offsetCS", "ot", 0], ["vec", "ot", 2], ["wmma_m", "ot", 16]]}, "result": [[2.9189060999999998e-05], 0, 1.5236663818359375, 1655303790.2344248], "version": 0.2, "tvm_version": "0.8.0"}
{"input": ["cuda -keys=cuda,gpu -max_num_threads=1024 -thread_warp_size=32", "batch_matmul_tensorcore.cuda", [["TENSOR", [12, 128, 64], "float16"], ["TENSOR", [12, 128, 64], "float16"], null, "float16"], {}], "config": {"index": 14862, "code_hash": null, "entity": [["block_row_warps", "ot", 1], ["block_col_warps", "ot", 2], ["warp_row_tiles", "ot", 2], ["warp_col_tiles", "ot", 2], ["chunk", "ot", 8], ["offset", "ot", 8], ["offsetCS", "ot", 0], ["vec", "ot", 8], ["wmma_m", "ot", 8]]}, "result": [[7.769894313967861e-06], 0, 1.7203006744384766, 1655303791.2314596], "version": 0.2, "tvm_version": "0.8.0"}
{"input": ["cuda -keys=cuda,gpu -max_num_threads=1024 -thread_warp_size=32", "batch_matmul_tensorcore.cuda", [["TENSOR", [12, 128, 64], "float16"], ["TENSOR", [12, 128, 64], "float16"], null, "float16"], {}], "config": {"index": 5125, "code_hash": null, "entity": [["block_row_warps", "ot", 2], ["block_col_warps", "ot", 2], ["warp_row_tiles", "ot", 4], ["warp_col_tiles", "ot", 1], ["chunk", "ot", 8], ["offset", "ot", 8], ["offsetCS", "ot", 8], ["vec", "ot", 8], ["wmma_m", "ot", 32]]}, "result": [[1.4009562000000002e-05], 0, 1.5148508548736572, 1655303792.6457944], "version": 0.2, "tvm_version": "0.8.0"}
{"input": ["cuda -keys=cuda,gpu -max_num_threads=1024 -thread_warp_size=32", "batch_matmul_tensorcore.cuda", [["TENSOR", [12, 128, 64], "float16"], ["TENSOR", [12, 128, 64], "float16"], null, "float16"], {}], "config": {"index": 9723, "code_hash": null, "entity": [["block_row_warps", "ot", 1], ["block_col_warps", "ot", 2], ["warp_row_tiles", "ot", 1], ["warp_col_tiles", "ot", 1], ["chunk", "ot", 1], ["offset", "ot", 0], ["offsetCS", "ot", 8], ["vec", "ot", 8], ["wmma_m", "ot", 16]]}, "result": [[2.3365652999999997e-05], 0, 1.4253339767456055, 1655303794.039321], "version": 0.2, "tvm_version": "0.8.0"}
{"input": ["cuda -keys=cuda,gpu -max_num_threads=1024 -thread_warp_size=32", "batch_matmul_tensorcore.cuda", [["TENSOR", [12, 128, 64], "float16"], ["TENSOR", [12, 128, 64], "float16"], null, "float16"], {}], "config": {"index": 4284, "code_hash": null, "entity": [["block_row_warps", "ot", 1], ["block_col_warps", "ot", 1], ["warp_row_tiles", "ot", 4], ["warp_col_tiles", "ot", 4], ["chunk", "ot", 1], ["offset", "ot", 8], ["offsetCS", "ot", 0], ["vec", "ot", 8], ["wmma_m", "ot", 32]]}, "result": [[1.0777293e-05], 0, 1.432988166809082, 1655303795.4260302], "version": 0.2, "tvm_version": "0.8.0"}
{"input": ["cuda -keys=cuda,gpu -max_num_threads=1024 -thread_warp_size=32", "batch_matmul_tensorcore.cuda", [["TENSOR", [12, 128, 64], "float16"], ["TENSOR", [12, 128, 64], "float16"], null, "float16"], {}], "config": {"index": 2004, "code_hash": null, "entity": [["block_row_warps", "ot", 1], ["block_col_warps", "ot", 4], ["warp_row_tiles", "ot", 1], ["warp_col_tiles", "ot", 4], ["chunk", "ot", 1], ["offset", "ot", 0], ["offsetCS", "ot", 8], ["vec", "ot", 2], ["wmma_m", "ot", 32]]}, "result": [[1.1755922e-05], 0, 1.3852465152740479, 1655303796.7895806], "version": 0.2, "tvm_version": "0.8.0"}
{"input": ["cuda -keys=cuda,gpu -max_num_threads=1024 -thread_warp_size=32", "batch_matmul_tensorcore.cuda", [["TENSOR", [12, 128, 64], "float16"], ["TENSOR", [12, 128, 64], "float16"], null, "float16"], {}], "config": {"index": 13658, "code_hash": null, "entity": [["block_row_warps", "ot", 4], ["block_col_warps", "ot", 2], ["warp_row_tiles", "ot", 4], ["warp_col_tiles", "ot", 2], ["chunk", "ot", 1], ["offset", "ot", 0], ["offsetCS", "ot", 8], ["vec", "ot", 4], ["wmma_m", "ot", 8]]}, "result": [[4.233587e-05], 0, 1.65305757522583, 1655303798.283046], "version": 0.2, "tvm_version": "0.8.0"}
{"input": ["cuda -keys=cuda,gpu -max_num_threads=1024 -thread_warp_size=32", "batch_matmul_tensorcore.cuda", [["TENSOR", [12, 128, 64], "float16"], ["TENSOR", [12, 128, 64], "float16"], null, "float16"], {}], "config": {"index": 7554, "code_hash": null, "entity": [["block_row_warps", "ot", 1], ["block_col_warps", "ot", 2], ["warp_row_tiles", "ot", 4], ["warp_col_tiles", "ot", 1], ["chunk", "ot", 2], ["offset", "ot", 8], ["offsetCS", "ot", 8], ["vec", "ot", 2], ["wmma_m", "ot", 16]]}, "result": [[7.643228677379481e-06], 0, 1.6995599269866943, 1655303799.25371], "version": 0.2, "tvm_version": "0.8.0"}
{"input": ["cuda -keys=cuda,gpu -max_num_threads=1024 -thread_warp_size=32", "batch_matmul_tensorcore.cuda", [["TENSOR", [12, 128, 64], "float16"], ["TENSOR", [12, 128, 64], "float16"], null, "float16"], {}], "config": {"index": 4326, "code_hash": null, "entity": [["block_row_warps", "ot", 1], ["block_col_warps", "ot", 4], ["warp_row_tiles", "ot", 1], ["warp_col_tiles", "ot", 2], ["chunk", "ot", 2], ["offset", "ot", 8], ["offsetCS", "ot", 0], ["vec", "ot", 8], ["wmma_m", "ot", 32]]}, "result": [[1.261712e-05], 0, 1.451232671737671, 1655303800.6123319], "version": 0.2, "tvm_version": "0.8.0"}
{"input": ["cuda -keys=cuda,gpu -max_num_threads=1024 -thread_warp_size=32", "batch_matmul_tensorcore.cuda", [["TENSOR", [12, 128, 64], "float16"], ["TENSOR", [12, 128, 64], "float16"], null, "float16"], {}], "config": {"index": 1159, "code_hash": null, "entity": [["block_row_warps", "ot", 2], ["block_col_warps", "ot", 4], ["warp_row_tiles", "ot", 4], ["warp_col_tiles", "ot", 1], ["chunk", "ot", 4], ["offset", "ot", 8], ["offsetCS", "ot", 8], ["vec", "ot", 1], ["wmma_m", "ot", 32]]}, "result": [[1.4972642999999999e-05], 0, 1.7495505809783936, 1655303801.649175], "version": 0.2, "tvm_version": "0.8.0"}
{"input": ["cuda -keys=cuda,gpu -max_num_threads=1024 -thread_warp_size=32", "batch_matmul_tensorcore.cuda", [["TENSOR", [12, 128, 64], "float16"], ["TENSOR", [12, 128, 64], "float16"], null, "float16"], {}], "config": {"index": 12287, "code_hash": null, "entity": [["block_row_warps", "ot", 4], ["block_col_warps", "ot", 1], ["warp_row_tiles", "ot", 1], ["warp_col_tiles", "ot", 4], ["chunk", "ot", 8], ["offset", "ot", 8], ["offsetCS", "ot", 0], ["vec", "ot", 2], ["wmma_m", "ot", 8]]}, "result": [[1.316904e-05], 0, 1.3809359073638916, 1655303803.0193398], "version": 0.2, "tvm_version": "0.8.0"}
{"input": ["cuda -keys=cuda,gpu -max_num_threads=1024 -thread_warp_size=32", "batch_matmul_tensorcore.cuda", [["TENSOR", [12, 128, 64], "float16"], ["TENSOR", [12, 128, 64], "float16"], null, "float16"], {}], "config": {"index": 6983, "code_hash": null, "entity": [["block_row_warps", "ot", 4], ["block_col_warps", "ot", 4], ["warp_row_tiles", "ot", 2], ["warp_col_tiles", "ot", 1], ["chunk", "ot", 4], ["offset", "ot", 8], ["offsetCS", "ot", 0], ["vec", "ot", 2], ["wmma_m", "ot", 16]]}, "result": [[4.6072204999999996e-05], 0, 1.7542414665222168, 1655303804.0939708], "version": 0.2, "tvm_version": "0.8.0"}
{"input": ["cuda -keys=cuda,gpu -max_num_threads=1024 -thread_warp_size=32", "batch_matmul_tensorcore.cuda", [["TENSOR", [12, 128, 64], "float16"], ["TENSOR", [12, 128, 64], "float16"], null, "float16"], {}], "config": {"index": 9862, "code_hash": null, "entity": [["block_row_warps", "ot", 2], ["block_col_warps", "ot", 4], ["warp_row_tiles", "ot", 1], ["warp_col_tiles", "ot", 4], ["chunk", "ot", 2], ["offset", "ot", 0], ["offsetCS", "ot", 8], ["vec", "ot", 8], ["wmma_m", "ot", 16]]}, "result": [[2.7312892000000002e-05], 0, 1.483377456665039, 1655303805.5110335], "version": 0.2, "tvm_version": "0.8.0"}
{"input": ["cuda -keys=cuda,gpu -max_num_threads=1024 -thread_warp_size=32", "batch_matmul_tensorcore.cuda", [["TENSOR", [12, 128, 64], "float16"], ["TENSOR", [12, 128, 64], "float16"], null, "float16"], {}], "config": {"index": 4228, "code_hash": null, "entity": [["block_row_warps", "ot", 2], ["block_col_warps", "ot", 4], ["warp_row_tiles", "ot", 2], ["warp_col_tiles", "ot", 1], ["chunk", "ot", 1], ["offset", "ot", 8], ["offsetCS", "ot", 0], ["vec", "ot", 8], ["wmma_m", "ot", 32]]}, "result": [[0.000113074808], 0, 2.0237374305725098, 1655303806.8596408], "version": 0.2, "tvm_version": "0.8.0"}
{"input": ["cuda -keys=cuda,gpu -max_num_threads=1024 -thread_warp_size=32", "batch_matmul_tensorcore.cuda", [["TENSOR", [12, 128, 64], "float16"], ["TENSOR", [12, 128, 64], "float16"], null, "float16"], {}], "config": {"index": 2053, "code_hash": null, "entity": [["block_row_warps", "ot", 2], ["block_col_warps", "ot", 1], ["warp_row_tiles", "ot", 1], ["warp_col_tiles", "ot", 2], ["chunk", "ot", 2], ["offset", "ot", 0], ["offsetCS", "ot", 8], ["vec", "ot", 2], ["wmma_m", "ot", 32]]}, "result": [[9.798909147095179e-06], 0, 1.3838956356048584, 1655303808.238408], "version": 0.2, "tvm_version": "0.8.0"}
{"input": ["cuda -keys=cuda,gpu -max_num_threads=1024 -thread_warp_size=32", "batch_matmul_tensorcore.cuda", [["TENSOR", [12, 128, 64], "float16"], ["TENSOR", [12, 128, 64], "float16"], null, "float16"], {}], "config": {"index": 9290, "code_hash": null, "entity": [["block_row_warps", "ot", 4], ["block_col_warps", "ot", 1], ["warp_row_tiles", "ot", 1], ["warp_col_tiles", "ot", 4], ["chunk", "ot", 4], ["offset", "ot", 0], ["offsetCS", "ot", 0], ["vec", "ot", 8], ["wmma_m", "ot", 16]]}, "result": [[2.2101938e-05], 0, 1.5231997966766357, 1655303809.6973662], "version": 0.2, "tvm_version": "0.8.0"}
{"input": ["cuda -keys=cuda,gpu -max_num_threads=1024 -thread_warp_size=32", "batch_matmul_tensorcore.cuda", [["TENSOR", [12, 128, 64], "float16"], ["TENSOR", [12, 128, 64], "float16"], null, "float16"], {}], "config": {"index": 2061, "code_hash": null, "entity": [["block_row_warps", "ot", 1], ["block_col_warps", "ot", 1], ["warp_row_tiles", "ot", 2], ["warp_col_tiles", "ot", 2], ["chunk", "ot", 2], ["offset", "ot", 0], ["offsetCS", "ot", 8], ["vec", "ot", 2], ["wmma_m", "ot", 32]]}, "result": [[8.66033807169345e-06], 0, 1.518653154373169, 1655303811.0830472], "version": 0.2, "tvm_version": "0.8.0"}
{"input": ["cuda -keys=cuda,gpu -max_num_threads=1024 -thread_warp_size=32", "batch_matmul_tensorcore.cuda", [["TENSOR", [12, 128, 64], "float16"], ["TENSOR", [12, 128, 64], "float16"], null, "float16"], {}], "config": {"index": 12340, "code_hash": null, "entity": [["block_row_warps", "ot", 2], ["block_col_warps", "ot", 1], ["warp_row_tiles", "ot", 1], ["warp_col_tiles", "ot", 2], ["chunk", "ot", 1], ["offset", "ot", 0], ["offsetCS", "ot", 8], ["vec", "ot", 2], ["wmma_m", "ot", 8]]}, "result": [[9.63487021013597e-06], 0, 1.6906988620758057, 1655303812.057468], "version": 0.2, "tvm_version": "0.8.0"}
{"input": ["cuda -keys=cuda,gpu -max_num_threads=1024 -thread_warp_size=32", "batch_matmul_tensorcore.cuda", [["TENSOR", [12, 128, 64], "float16"], ["TENSOR", [12, 128, 64], "float16"], null, "float16"], {}], "config": {"index": 14717, "code_hash": null, "entity": [["block_row_warps", "ot", 4], ["block_col_warps", "ot", 1], ["warp_row_tiles", "ot", 1], ["warp_col_tiles", "ot", 4], ["chunk", "ot", 2], ["offset", "ot", 8], ["offsetCS", "ot", 0], ["vec", "ot", 8], ["wmma_m", "ot", 8]]}, "result": [[1.8049067000000003e-05], 0, 1.3945000171661377, 1655303813.45617], "version": 0.2, "tvm_version": "0.8.0"}
{"input": ["cuda -keys=cuda,gpu -max_num_threads=1024 -thread_warp_size=32", "batch_matmul_tensorcore.cuda", [["TENSOR", [12, 128, 64], "float16"], ["TENSOR", [12, 128, 64], "float16"], null, "float16"], {}], "config": {"index": 8448, "code_hash": null, "entity": [["block_row_warps", "ot", 1], ["block_col_warps", "ot", 4], ["warp_row_tiles", "ot", 4], ["warp_col_tiles", "ot", 1], ["chunk", "ot", 1], ["offset", "ot", 0], ["offsetCS", "ot", 8], ["vec", "ot", 4], ["wmma_m", "ot", 16]]}, "result": [[1.4956413e-05], 0, 1.425102949142456, 1655303814.8241441], "version": 0.2, "tvm_version": "0.8.0"}
{"input": ["cuda -keys=cuda,gpu -max_num_threads=1024 -thread_warp_size=32", "batch_matmul_tensorcore.cuda", [["TENSOR", [12, 128, 64], "float16"], ["TENSOR", [12, 128, 64], "float16"], null, "float16"], {}], "config": {"index": 6572, "code_hash": null, "entity": [["block_row_warps", "ot", 4], ["block_col_warps", "ot", 1], ["warp_row_tiles", "ot", 2], ["warp_col_tiles", "ot", 1], ["chunk", "ot", 2], ["offset", "ot", 0], ["offsetCS", "ot", 0], ["vec", "ot", 2], ["wmma_m", "ot", 16]]}, "result": [[1.2934277e-05], 0, 1.390005111694336, 1655303816.176955], "version": 0.2, "tvm_version": "0.8.0"}
{"input": ["cuda -keys=cuda,gpu -max_num_threads=1024 -thread_warp_size=32", "batch_matmul_tensorcore.cuda", [["TENSOR", [12, 128, 64], "float16"], ["TENSOR", [12, 128, 64], "float16"], null, "float16"], {}], "config": {"index": 13752, "code_hash": null, "entity": [["block_row_warps", "ot", 1], ["block_col_warps", "ot", 1], ["warp_row_tiles", "ot", 2], ["warp_col_tiles", "ot", 4], ["chunk", "ot", 2], ["offset", "ot", 0], ["offsetCS", "ot", 8], ["vec", "ot", 4], ["wmma_m", "ot", 8]]}, "result": [[9.883710754017305e-06], 0, 1.7685720920562744, 1655303817.2154818], "version": 0.2, "tvm_version": "0.8.0"}
{"input": ["cuda -keys=cuda,gpu -max_num_threads=1024 -thread_warp_size=32", "batch_matmul_tensorcore.cuda", [["TENSOR", [12, 128, 64], "float16"], ["TENSOR", [12, 128, 64], "float16"], null, "float16"], {}], "config": {"index": 4880, "code_hash": null, "entity": [["block_row_warps", "ot", 4], ["block_col_warps", "ot", 1], ["warp_row_tiles", "ot", 4], ["warp_col_tiles", "ot", 1], ["chunk", "ot", 1], ["offset", "ot", 8], ["offsetCS", "ot", 8], ["vec", "ot", 8], ["wmma_m", "ot", 32]]}, "result": [[1.3571077000000002e-05], 0, 1.6431267261505127, 1655303818.150018], "version": 0.2, "tvm_version": "0.8.0"}
{"input": ["cuda -keys=cuda,gpu -max_num_threads=1024 -thread_warp_size=32", "batch_matmul_tensorcore.cuda", [["TENSOR", [12, 128, 64], "float16"], ["TENSOR", [12, 128, 64], "float16"], null, "float16"], {}], "config": {"index": 7473, "code_hash": null, "entity": [["block_row_warps", "ot", 1], ["block_col_warps", "ot", 2], ["warp_row_tiles", "ot", 4], ["warp_col_tiles", "ot", 1], ["chunk", "ot", 1], ["offset", "ot", 8], ["offsetCS", "ot", 8], ["vec", "ot", 2], ["wmma_m", "ot", 16]]}, "result": [[8.367007416563658e-06], 0, 1.4428799152374268, 1655303820.64934], "version": 0.2, "tvm_version": "0.8.0"}
{"input": ["cuda -keys=cuda,gpu -max_num_threads=1024 -thread_warp_size=32", "batch_matmul_tensorcore.cuda", [["TENSOR", [12, 128, 64], "float16"], ["TENSOR", [12, 128, 64], "float16"], null, "float16"], {}], "config": {"index": 768, "code_hash": null, "entity": [["block_row_warps", "ot", 1], ["block_col_warps", "ot", 2], ["warp_row_tiles", "ot", 2], ["warp_col_tiles", "ot", 2], ["chunk", "ot", 2], ["offset", "ot", 0], ["offsetCS", "ot", 8], ["vec", "ot", 1], ["wmma_m", "ot", 32]]}, "result": [[9.31285784919654e-06], 0, 1.6893267631530762, 1655303821.7586327], "version": 0.2, "tvm_version": "0.8.0"}
{"input": ["cuda -keys=cuda,gpu -max_num_threads=1024 -thread_warp_size=32", "batch_matmul_tensorcore.cuda", [["TENSOR", [12, 128, 64], "float16"], ["TENSOR", [12, 128, 64], "float16"], null, "float16"], {}], "config": {"index": 6522, "code_hash": null, "entity": [["block_row_warps", "ot", 1], ["block_col_warps", "ot", 4], ["warp_row_tiles", "ot", 2], ["warp_col_tiles", "ot", 2], ["chunk", "ot", 1], ["offset", "ot", 0], ["offsetCS", "ot", 0], ["vec", "ot", 2], ["wmma_m", "ot", 16]]}, "result": [[1.4015134e-05], 0, 1.6759426593780518, 1655303822.759118], "version": 0.2, "tvm_version": "0.8.0"}
{"input": ["cuda -keys=cuda,gpu -max_num_threads=1024 -thread_warp_size=32", "batch_matmul_tensorcore.cuda", [["TENSOR", [12, 128, 64], "float16"], ["TENSOR", [12, 128, 64], "float16"], null, "float16"], {}], "config": {"index": 1530, "code_hash": null, "entity": [["block_row_warps", "ot", 1], ["block_col_warps", "ot", 1], ["warp_row_tiles", "ot", 4], ["warp_col_tiles", "ot", 4], ["chunk", "ot", 4], ["offset", "ot", 0], ["offsetCS", "ot", 0], ["vec", "ot", 2], ["wmma_m", "ot", 32]]}, "result": [[1.1998471999999999e-05], 0, 1.9318122863769531, 1655303823.8291984], "version": 0.2, "tvm_version": "0.8.0"}
{"input": ["cuda -keys=cuda,gpu -max_num_threads=1024 -thread_warp_size=32", "batch_matmul_tensorcore.cuda", [["TENSOR", [12, 128, 64], "float16"], ["TENSOR", [12, 128, 64], "float16"], null, "float16"], {}], "config": {"index": 4355, "code_hash": null, "entity": [["block_row_warps", "ot", 4], ["block_col_warps", "ot", 4], ["warp_row_tiles", "ot", 1], ["warp_col_tiles", "ot", 4], ["chunk", "ot", 2], ["offset", "ot", 8], ["offsetCS", "ot", 0], ["vec", "ot", 8], ["wmma_m", "ot", 32]]}, "result": [[0.000129977773], 0, 1.8141860961914062, 1655303825.5431283], "version": 0.2, "tvm_version": "0.8.0"}
{"input": ["cuda -keys=cuda,gpu -max_num_threads=1024 -thread_warp_size=32", "batch_matmul_tensorcore.cuda", [["TENSOR", [12, 128, 64], "float16"], ["TENSOR", [12, 128, 64], "float16"], null, "float16"], {}], "config": {"index": 7194, "code_hash": null, "entity": [["block_row_warps", "ot", 1], ["block_col_warps", "ot", 2], ["warp_row_tiles", "ot", 2], ["warp_col_tiles", "ot", 4], ["chunk", "ot", 1], ["offset", "ot", 0], ["offsetCS", "ot", 8], ["vec", "ot", 2], ["wmma_m", "ot", 16]]}, "result": [[1.1010112e-05], 0, 1.7760131359100342, 1655303826.5459423], "version": 0.2, "tvm_version": "0.8.0"}
{"input": ["cuda -keys=cuda,gpu -max_num_threads=1024 -thread_warp_size=32", "batch_matmul_tensorcore.cuda", [["TENSOR", [12, 128, 64], "float16"], ["TENSOR", [12, 128, 64], "float16"], null, "float16"], {}], "config": {"index": 2607, "code_hash": null, "entity": [["block_row_warps", "ot", 1], ["block_col_warps", "ot", 4], ["warp_row_tiles", "ot", 2], ["warp_col_tiles", "ot", 1], ["chunk", "ot", 1], ["offset", "ot", 0], ["offsetCS", "ot", 0], ["vec", "ot", 4], ["wmma_m", "ot", 32]]}, "result": [[1.4380931999999999e-05], 0, 1.4615817070007324, 1655303827.9165316], "version": 0.2, "tvm_version": "0.8.0"}
{"input": ["cuda -keys=cuda,gpu -max_num_threads=1024 -thread_warp_size=32", "batch_matmul_tensorcore.cuda", [["TENSOR", [12, 128, 64], "float16"], ["TENSOR", [12, 128, 64], "float16"], null, "float16"], {}], "config": {"index": 8650, "code_hash": null, "entity": [["block_row_warps", "ot", 2], ["block_col_warps", "ot", 1], ["warp_row_tiles", "ot", 2], ["warp_col_tiles", "ot", 4], ["chunk", "ot", 4], ["offset", "ot", 0], ["offsetCS", "ot", 8], ["vec", "ot", 4], ["wmma_m", "ot", 16]]}, "result": [[1.1002304e-05], 0, 1.7722876071929932, 1655303828.9874032], "version": 0.2, "tvm_version": "0.8.0"}
{"input": ["cuda -keys=cuda,gpu -max_num_threads=1024 -thread_warp_size=32", "batch_matmul_tensorcore.cuda", [["TENSOR", [12, 128, 64], "float16"], ["TENSOR", [12, 128, 64], "float16"], null, "float16"], {}], "config": {"index": 6949, "code_hash": null, "entity": [["block_row_warps", "ot", 2], ["block_col_warps", "ot", 1], ["warp_row_tiles", "ot", 2], ["warp_col_tiles", "ot", 4], ["chunk", "ot", 2], ["offset", "ot", 8], ["offsetCS", "ot", 0], ["vec", "ot", 2], ["wmma_m", "ot", 16]]}, "result": [[9.53234301606922e-06], 0, 1.520751714706421, 1655303830.396473], "version": 0.2, "tvm_version": "0.8.0"}
{"input": ["cuda -keys=cuda,gpu -max_num_threads=1024 -thread_warp_size=32", "batch_matmul_tensorcore.cuda", [["TENSOR", [12, 128, 64], "float16"], ["TENSOR", [12, 128, 64], "float16"], null, "float16"], {}], "config": {"index": 7412, "code_hash": null, "entity": [["block_row_warps", "ot", 4], ["block_col_warps", "ot", 2], ["warp_row_tiles", "ot", 2], ["warp_col_tiles", "ot", 2], ["chunk", "ot", 8], ["offset", "ot", 0], ["offsetCS", "ot", 8], ["vec", "ot", 2], ["wmma_m", "ot", 16]]}, "result": [[5.2921498e-05], 0, 1.8875775337219238, 1655303831.5713046], "version": 0.2, "tvm_version": "0.8.0"}
{"input": ["cuda -keys=cuda,gpu -max_num_threads=1024 -thread_warp_size=32", "batch_matmul_tensorcore.cuda", [["TENSOR", [12, 128, 64], "float16"], ["TENSOR", [12, 128, 64], "float16"], null, "float16"], {}], "config": {"index": 10, "code_hash": null, "entity": [["block_row_warps", "ot", 2], ["block_col_warps", "ot", 1], ["warp_row_tiles", "ot", 2], ["warp_col_tiles", "ot", 1], ["chunk", "ot", 1], ["offset", "ot", 0], ["offsetCS", "ot", 0], ["vec", "ot", 1], ["wmma_m", "ot", 32]]}, "result": [[1.2748030000000001e-05], 0, 1.4725706577301025, 1655303832.957221], "version": 0.2, "tvm_version": "0.8.0"}
{"input": ["cuda -keys=cuda,gpu -max_num_threads=1024 -thread_warp_size=32", "batch_matmul_tensorcore.cuda", [["TENSOR", [12, 128, 64], "float16"], ["TENSOR", [12, 128, 64], "float16"], null, "float16"], {}], "config": {"index": 1474, "code_hash": null, "entity": [["block_row_warps", "ot", 2], ["block_col_warps", "ot", 4], ["warp_row_tiles", "ot", 2], ["warp_col_tiles", "ot", 1], ["chunk", "ot", 4], ["offset", "ot", 0], ["offsetCS", "ot", 0], ["vec", "ot", 2], ["wmma_m", "ot", 32]]}, "result": [[5.8539612e-05], 0, 1.756190299987793, 1655303834.0584273], "version": 0.2, "tvm_version": "0.8.0"}
{"input": ["cuda -keys=cuda,gpu -max_num_threads=1024 -thread_warp_size=32", "batch_matmul_tensorcore.cuda", [["TENSOR", [12, 128, 64], "float16"], ["TENSOR", [12, 128, 64], "float16"], null, "float16"], {}], "config": {"index": 7225, "code_hash": null, "entity": [["block_row_warps", "ot", 2], ["block_col_warps", "ot", 4], ["warp_row_tiles", "ot", 2], ["warp_col_tiles", "ot", 1], ["chunk", "ot", 2], ["offset", "ot", 0], ["offsetCS", "ot", 8], ["vec", "ot", 2], ["wmma_m", "ot", 16]]}, "result": [[2.5408574999999998e-05], 0, 1.4297754764556885, 1655303835.4833677], "version": 0.2, "tvm_version": "0.8.0"}
{"input": ["cuda -keys=cuda,gpu -max_num_threads=1024 -thread_warp_size=32", "batch_matmul_tensorcore.cuda", [["TENSOR", [12, 128, 64], "float16"], ["TENSOR", [12, 128, 64], "float16"], null, "float16"], {}], "config": {"index": 5584, "code_hash": null, "entity": [["block_row_warps", "ot", 2], ["block_col_warps", "ot", 2], ["warp_row_tiles", "ot", 4], ["warp_col_tiles", "ot", 4], ["chunk", "ot", 1], ["offset", "ot", 8], ["offsetCS", "ot", 0], ["vec", "ot", 1], ["wmma_m", "ot", 16]]}, "result": [[2.597059e-05], 0, 1.559410810470581, 1655303836.975588], "version": 0.2, "tvm_version": "0.8.0"}
{"input": ["cuda -keys=cuda,gpu -max_num_threads=1024 -thread_warp_size=32", "batch_matmul_tensorcore.cuda", [["TENSOR", [12, 128, 64], "float16"], ["TENSOR", [12, 128, 64], "float16"], null, "float16"], {}], "config": {"index": 4625, "code_hash": null, "entity": [["block_row_warps", "ot", 4], ["block_col_warps", "ot", 4], ["warp_row_tiles", "ot", 1], ["warp_col_tiles", "ot", 1], ["chunk", "ot", 2], ["offset", "ot", 0], ["offsetCS", "ot", 8], ["vec", "ot", 8], ["wmma_m", "ot", 32]]}, "result": [[0.000112022435], 0, 1.8451967239379883, 1655303838.289452], "version": 0.2, "tvm_version": "0.8.0"}
{"input": ["cuda -keys=cuda,gpu -max_num_threads=1024 -thread_warp_size=32", "batch_matmul_tensorcore.cuda", [["TENSOR", [12, 128, 64], "float16"], ["TENSOR", [12, 128, 64], "float16"], null, "float16"], {}], "config": {"index": 12804, "code_hash": null, "entity": [["block_row_warps", "ot", 1], ["block_col_warps", "ot", 4], ["warp_row_tiles", "ot", 1], ["warp_col_tiles", "ot", 1], ["chunk", "ot", 4], ["offset", "ot", 8], ["offsetCS", "ot", 8], ["vec", "ot", 2], ["wmma_m", "ot", 8]]}, "result": [[9.671395550061805e-06], 0, 1.4298436641693115, 1655303839.6917143], "version": 0.2, "tvm_version": "0.8.0"}
{"input": ["cuda -keys=cuda,gpu -max_num_threads=1024 -thread_warp_size=32", "batch_matmul_tensorcore.cuda", [["TENSOR", [12, 128, 64], "float16"], ["TENSOR", [12, 128, 64], "float16"], null, "float16"], {}], "config": {"index": 10622, "code_hash": null, "entity": [["block_row_warps", "ot", 4], ["block_col_warps", "ot", 1], ["warp_row_tiles", "ot", 2], ["warp_col_tiles", "ot", 1], ["chunk", "ot", 8], ["offset", "ot", 0], ["offsetCS", "ot", 0], ["vec", "ot", 1], ["wmma_m", "ot", 8]]}, "result": [[1.5914018000000003e-05], 0, 1.6559388637542725, 1655303840.7315023], "version": 0.2, "tvm_version": "0.8.0"}
{"input": ["cuda -keys=cuda,gpu -max_num_threads=1024 -thread_warp_size=32", "batch_matmul_tensorcore.cuda", [["TENSOR", [12, 128, 64], "float16"], ["TENSOR", [12, 128, 64], "float16"], null, "float16"], {}], "config": {"index": 9816, "code_hash": null, "entity": [["block_row_warps", "ot", 1], ["block_col_warps", "ot", 4], ["warp_row_tiles", "ot", 2], ["warp_col_tiles", "ot", 1], ["chunk", "ot", 2], ["offset", "ot", 0], ["offsetCS", "ot", 8], ["vec", "ot", 8], ["wmma_m", "ot", 16]]}, "result": [[1.4218302000000001e-05], 0, 1.343677282333374, 1655303842.0903103], "version": 0.2, "tvm_version": "0.8.0"}
{"input": ["cuda -keys=cuda,gpu -max_num_threads=1024 -thread_warp_size=32", "batch_matmul_tensorcore.cuda", [["TENSOR", [12, 128, 64], "float16"], ["TENSOR", [12, 128, 64], "float16"], null, "float16"], {}], "config": {"index": 12100, "code_hash": null, "entity": [["block_row_warps", "ot", 2], ["block_col_warps", "ot", 2], ["warp_row_tiles", "ot", 1], ["warp_col_tiles", "ot", 2], ["chunk", "ot", 2], ["offset", "ot", 8], ["offsetCS", "ot", 0], ["vec", "ot", 2], ["wmma_m", "ot", 8]]}, "result": [[1.0634967e-05], 0, 1.3042821884155273, 1655303843.461969], "version": 0.2, "tvm_version": "0.8.0"}
{"input": ["cuda -keys=cuda,gpu -max_num_threads=1024 -thread_warp_size=32", "batch_matmul_tensorcore.cuda", [["TENSOR", [12, 128, 64], "float16"], ["TENSOR", [12, 128, 64], "float16"], null, "float16"], {}], "config": {"index": 13254, "code_hash": null, "entity": [["block_row_warps", "ot", 1], ["block_col_warps", "ot", 4], ["warp_row_tiles", "ot", 4], ["warp_col_tiles", "ot", 2], ["chunk", "ot", 8], ["offset", "ot", 0], ["offsetCS", "ot", 0], ["vec", "ot", 4], ["wmma_m", "ot", 8]]}, "result": [[1.8747016e-05], 0, 1.8443777561187744, 1655303844.551681], "version": 0.2, "tvm_version": "0.8.0"}
{"input": ["cuda -keys=cuda,gpu -max_num_threads=1024 -thread_warp_size=32", "batch_matmul_tensorcore.cuda", [["TENSOR", [12, 128, 64], "float16"], ["TENSOR", [12, 128, 64], "float16"], null, "float16"], {}], "config": {"index": 954, "code_hash": null, "entity": [["block_row_warps", "ot", 1], ["block_col_warps", "ot", 1], ["warp_row_tiles", "ot", 2], ["warp_col_tiles", "ot", 4], ["chunk", "ot", 8], ["offset", "ot", 0], ["offsetCS", "ot", 8], ["vec", "ot", 1], ["wmma_m", "ot", 32]]}, "result": [[1.2405545e-05], 0, 1.7112529277801514, 1655303845.528109], "version": 0.2, "tvm_version": "0.8.0"}
{"input": ["cuda -keys=cuda,gpu -max_num_threads=1024 -thread_warp_size=32", "batch_matmul_tensorcore.cuda", [["TENSOR", [12, 128, 64], "float16"], ["TENSOR", [12, 128, 64], "float16"], null, "float16"], {}], "config": {"index": 2666, "code_hash": null, "entity": [["block_row_warps", "ot", 4], ["block_col_warps", "ot", 1], ["warp_row_tiles", "ot", 4], ["warp_col_tiles", "ot", 4], ["chunk", "ot", 1], ["offset", "ot", 0], ["offsetCS", "ot", 0], ["vec", "ot", 4], ["wmma_m", "ot", 32]]}, "result": [[1.3481327e-05], 0, 1.689098596572876, 1655303846.5107698], "version": 0.2, "tvm_version": "0.8.0"}
{"input": ["cuda -keys=cuda,gpu -max_num_threads=1024 -thread_warp_size=32", "batch_matmul_tensorcore.cuda", [["TENSOR", [12, 128, 64], "float16"], ["TENSOR", [12, 128, 64], "float16"], null, "float16"], {}], "config": {"index": 492, "code_hash": null, "entity": [["block_row_warps", "ot", 1], ["block_col_warps", "ot", 4], ["warp_row_tiles", "ot", 1], ["warp_col_tiles", "ot", 1], ["chunk", "ot", 4], ["offset", "ot", 8], ["offsetCS", "ot", 0], ["vec", "ot", 1], ["wmma_m", "ot", 32]]}, "result": [[9.854357231149568e-06], 0, 1.3573222160339355, 1655303847.8822515], "version": 0.2, "tvm_version": "0.8.0"}
{"input": ["cuda -keys=cuda,gpu -max_num_threads=1024 -thread_warp_size=32", "batch_matmul_tensorcore.cuda", [["TENSOR", [12, 128, 64], "float16"], ["TENSOR", [12, 128, 64], "float16"], null, "float16"], {}], "config": {"index": 4089, "code_hash": null, "entity": [["block_row_warps", "ot", 1], ["block_col_warps", "ot", 2], ["warp_row_tiles", "ot", 2], ["warp_col_tiles", "ot", 2], ["chunk", "ot", 4], ["offset", "ot", 0], ["offsetCS", "ot", 0], ["vec", "ot", 8], ["wmma_m", "ot", 32]]}, "result": [[9.897970333745364e-06], 0, 1.682734727859497, 1655303848.886692], "version": 0.2, "tvm_version": "0.8.0"}
{"input": ["cuda -keys=cuda,gpu -max_num_threads=1024 -thread_warp_size=32", "batch_matmul_tensorcore.cuda", [["TENSOR", [12, 128, 64], "float16"], ["TENSOR", [12, 128, 64], "float16"], null, "float16"], {}], "config": {"index": 12242, "code_hash": null, "entity": [["block_row_warps", "ot", 4], ["block_col_warps", "ot", 1], ["warp_row_tiles", "ot", 2], ["warp_col_tiles", "ot", 1], ["chunk", "ot", 8], ["offset", "ot", 8], ["offsetCS", "ot", 0], ["vec", "ot", 2], ["wmma_m", "ot", 8]]}, "result": [[8.690038318912238e-06], 0, 1.3637762069702148, 1655303850.2482767], "version": 0.2, "tvm_version": "0.8.0"}
{"input": ["cuda -keys=cuda,gpu -max_num_threads=1024 -thread_warp_size=32", "batch_matmul_tensorcore.cuda", [["TENSOR", [12, 128, 64], "float16"], ["TENSOR", [12, 128, 64], "float16"], null, "float16"], {}], "config": {"index": 14736, "code_hash": null, "entity": [["block_row_warps", "ot", 1], ["block_col_warps", "ot", 2], ["warp_row_tiles", "ot", 4], ["warp_col_tiles", "ot", 4], ["chunk", "ot", 2], ["offset", "ot", 8], ["offsetCS", "ot", 0], ["vec", "ot", 8], ["wmma_m", "ot", 8]]}, "result": [[1.1252349999999999e-05], 0, 1.837935447692871, 1655303851.349425], "version": 0.2, "tvm_version": "0.8.0"}
{"input": ["cuda -keys=cuda,gpu -max_num_threads=1024 -thread_warp_size=32", "batch_matmul_tensorcore.cuda", [["TENSOR", [12, 128, 64], "float16"], ["TENSOR", [12, 128, 64], "float16"], null, "float16"], {}], "config": {"index": 3321, "code_hash": null, "entity": [["block_row_warps", "ot", 1], ["block_col_warps", "ot", 1], ["warp_row_tiles", "ot", 1], ["warp_col_tiles", "ot", 1], ["chunk", "ot", 2], ["offset", "ot", 0], ["offsetCS", "ot", 8], ["vec", "ot", 4], ["wmma_m", "ot", 32]]}, "result": [[1.0117415e-05], 0, 1.2331962585449219, 1655303852.6902556], "version": 0.2, "tvm_version": "0.8.0"}
{"input": ["cuda -keys=cuda,gpu -max_num_threads=1024 -thread_warp_size=32", "batch_matmul_tensorcore.cuda", [["TENSOR", [12, 128, 64], "float16"], ["TENSOR", [12, 128, 64], "float16"], null, "float16"], {}], "config": {"index": 2737, "code_hash": null, "entity": [["block_row_warps", "ot", 2], ["block_col_warps", "ot", 1], ["warp_row_tiles", "ot", 2], ["warp_col_tiles", "ot", 4], ["chunk", "ot", 2], ["offset", "ot", 0], ["offsetCS", "ot", 0], ["vec", "ot", 4], ["wmma_m", "ot", 32]]}, "result": [[1.060355e-05], 0, 1.6550195217132568, 1655303853.6624904], "version": 0.2, "tvm_version": "0.8.0"}
{"input": ["cuda -keys=cuda,gpu -max_num_threads=1024 -thread_warp_size=32", "batch_matmul_tensorcore.cuda", [["TENSOR", [12, 128, 64], "float16"], ["TENSOR", [12, 128, 64], "float16"], null, "float16"], {}], "config": {"index": 10495, "code_hash": null, "entity": [["block_row_warps", "ot", 2], ["block_col_warps", "ot", 1], ["warp_row_tiles", "ot", 4], ["warp_col_tiles", "ot", 2], ["chunk", "ot", 2], ["offset", "ot", 0], ["offsetCS", "ot", 0], ["vec", "ot", 1], ["wmma_m", "ot", 8]]}, "result": [[1.3305362e-05], 0, 1.598912239074707, 1655303855.0448256], "version": 0.2, "tvm_version": "0.8.0"}
{"input": ["cuda -keys=cuda,gpu -max_num_threads=1024 -thread_warp_size=32", "batch_matmul_tensorcore.cuda", [["TENSOR", [12, 128, 64], "float16"], ["TENSOR", [12, 128, 64], "float16"], null, "float16"], {}], "config": {"index": 7136, "code_hash": null, "entity": [["block_row_warps", "ot", 4], ["block_col_warps", "ot", 4], ["warp_row_tiles", "ot", 1], ["warp_col_tiles", "ot", 1], ["chunk", "ot", 1], ["offset", "ot", 0], ["offsetCS", "ot", 8], ["vec", "ot", 2], ["wmma_m", "ot", 16]]}, "result": [[4.7214967000000004e-05], 0, 1.763044834136963, 1655303856.1312218], "version": 0.2, "tvm_version": "0.8.0"}
{"input": ["cuda -keys=cuda,gpu -max_num_threads=1024 -thread_warp_size=32", "batch_matmul_tensorcore.cuda", [["TENSOR", [12, 128, 64], "float16"], ["TENSOR", [12, 128, 64], "float16"], null, "float16"], {}], "config": {"index": 11191, "code_hash": null, "entity": [["block_row_warps", "ot", 2], ["block_col_warps", "ot", 2], ["warp_row_tiles", "ot", 2], ["warp_col_tiles", "ot", 1], ["chunk", "ot", 4], ["offset", "ot", 0], ["offsetCS", "ot", 8], ["vec", "ot", 1], ["wmma_m", "ot", 8]]}, "result": [[1.5845647e-05], 0, 1.394171953201294, 1655303857.5064688], "version": 0.2, "tvm_version": "0.8.0"}
