python/models/bert/kernel_configs/bert_cuda_core_te_softmax_norm_12_384.log
{"i": [["[\"te_softmax_norm\", 12, 384]", "cuda -keys=cuda,gpu -max_num_threads=1024 -model=unknown -thread_warp_size=32", [-1, 16, 64, 49152, 2147483647, 1024, 8, 32], "", 0, []], [[], [["FU", 2, [0, 1, 2]], ["SP", 2, 0, 1769472, [6], 1], ["AN", 2, 0, 5], ["AN", 2, 1, 6]]]], "r": [[0.000221249, 0.000221244, 0.000221245], 0, 4.25011, 1662155982], "v": "v0.6"}
{"i": [["[\"te_softmax_norm\", 12, 384]", "cuda -keys=cuda,gpu -max_num_threads=1024 -model=unknown -thread_warp_size=32", [-1, 16, 64, 49152, 2147483647, 1024, 8, 32], "", 0, []], [[], [["FU", 2, [0, 1, 2]], ["SP", 2, 0, 1769472, [8], 1], ["AN", 2, 0, 5], ["AN", 2, 1, 6]]]], "r": [[0.000166673, 0.00016668, 0.000166668], 0, 2.3072, 1662155980], "v": "v0.6"}
{"i": [["[\"te_softmax_norm\", 12, 384]", "cuda -keys=cuda,gpu -max_num_threads=1024 -model=unknown -thread_warp_size=32", [-1, 16, 64, 49152, 2147483647, 1024, 8, 32], "", 0, []], [[], [["FU", 2, [0, 1, 2]], ["SP", 2, 0, 1769472, [64], 1], ["AN", 2, 0, 5], ["AN", 2, 1, 6]]]], "r": [[2.28414e-05, 2.28473e-05, 2.28486e-05], 0, 1.64111, 1662155980], "v": "v0.6"}
{"i": [["[\"te_softmax_norm\", 12, 384]", "cuda -keys=cuda,gpu -max_num_threads=1024 -model=unknown -thread_warp_size=32", [-1, 16, 64, 49152, 2147483647, 1024, 8, 32], "", 0, []], [[], [["FU", 2, [0, 1, 2]], ["SP", 2, 0, 1769472, [3], 1], ["AN", 2, 0, 5], ["AN", 2, 1, 6]]]], "r": [[0.000439727, 0.000439721, 0.000439753], 0, 1.01105, 1662155979], "v": "v0.6"}
{"i": [["[\"te_softmax_norm\", 12, 384]", "cuda -keys=cuda,gpu -max_num_threads=1024 -model=unknown -thread_warp_size=32", [-1, 16, 64, 49152, 2147483647, 1024, 8, 32], "", 0, []], [[], [["FU", 2, [0, 1, 2]], ["SP", 2, 0, 1769472, [36], 1], ["AN", 2, 0, 5], ["AN", 2, 1, 6]]]], "r": [[3.87872e-05, 3.87926e-05, 3.87879e-05], 0, 3.00963, 1662155981], "v": "v0.6"}
{"i": [["[\"te_softmax_norm\", 12, 384]", "cuda -keys=cuda,gpu -max_num_threads=1024 -model=unknown -thread_warp_size=32", [-1, 16, 64, 49152, 2147483647, 1024, 8, 32], "", 0, []], [[], [["FU", 2, [0, 1, 2]], ["SP", 2, 0, 1769472, [1], 1], ["AN", 2, 0, 5], ["AN", 2, 1, 6]]]], "r": [[0.00131397, 0.00131391, 0.0013139], 0, 3.56073, 1662155982], "v": "v0.6"}
{"i": [["[\"te_softmax_norm\", 12, 384]", "cuda -keys=cuda,gpu -max_num_threads=1024 -model=unknown -thread_warp_size=32", [-1, 16, 64, 49152, 2147483647, 1024, 8, 32], "", 0, []], [[], [["FU", 2, [0, 1, 2]], ["SP", 2, 0, 1769472, [32], 1], ["AN", 2, 0, 5], ["AN", 2, 1, 6]]]], "r": [[4.38863e-05, 4.38848e-05, 4.38881e-05], 0, 5.46217, 1662155984], "v": "v0.6"}
{"i": [["[\"te_softmax_norm\", 12, 384]", "cuda -keys=cuda,gpu -max_num_threads=1024 -model=unknown -thread_warp_size=32", [-1, 16, 64, 49152, 2147483647, 1024, 8, 32], "", 0, []], [[], [["FU", 2, [0, 1, 2]], ["SP", 2, 0, 1769472, [27], 1], ["AN", 2, 0, 5], ["AN", 2, 1, 6]]]], "r": [[5.14082e-05, 5.14089e-05, 5.14121e-05], 0, 7.50697, 1662155986], "v": "v0.6"}
{"i": [["[\"te_softmax_norm\", 12, 384]", "cuda -keys=cuda,gpu -max_num_threads=1024 -model=unknown -thread_warp_size=32", [-1, 16, 64, 49152, 2147483647, 1024, 8, 32], "", 0, []], [[], [["FU", 2, [0, 1, 2]], ["SP", 2, 0, 1769472, [2], 1], ["AN", 2, 0, 5], ["AN", 2, 1, 6]]]], "r": [[0.000658287, 0.000658294, 0.000658323], 0, 8.79168, 1662155987], "v": "v0.6"}
{"i": [["[\"te_softmax_norm\", 12, 384]", "cuda -keys=cuda,gpu -max_num_threads=1024 -model=unknown -thread_warp_size=32", [-1, 16, 64, 49152, 2147483647, 1024, 8, 32], "", 0, []], [[], [["FU", 2, [0, 1, 2]], ["SP", 2, 0, 1769472, [18], 1], ["AN", 2, 0, 5], ["AN", 2, 1, 6]]]], "r": [[7.55537e-05, 7.55495e-05, 7.55486e-05], 0, 9.44651, 1662155988], "v": "v0.6"}
{"i": [["[\"te_softmax_norm\", 12, 384]", "cuda -keys=cuda,gpu -max_num_threads=1024 -model=unknown -thread_warp_size=32", [-1, 16, 64, 49152, 2147483647, 1024, 8, 32], "", 0, []], [[], [["FU", 2, [0, 1, 2]], ["SP", 2, 0, 1769472, [54], 1], ["AN", 2, 0, 5], ["AN", 2, 1, 6]]]], "r": [[2.66665e-05, 2.66823e-05, 2.66808e-05], 0, 6.15665, 1662155984], "v": "v0.6"}
{"i": [["[\"te_softmax_norm\", 12, 384]", "cuda -keys=cuda,gpu -max_num_threads=1024 -model=unknown -thread_warp_size=32", [-1, 16, 64, 49152, 2147483647, 1024, 8, 32], "", 0, []], [[], [["FU", 2, [0, 1, 2]], ["SP", 2, 0, 1769472, [12], 1], ["AN", 2, 0, 5], ["AN", 2, 1, 6]]]], "r": [[0.000112003, 0.000112008, 0.000111997], 0, 6.85391, 1662155985], "v": "v0.6"}
{"i": [["[\"te_softmax_norm\", 12, 384]", "cuda -keys=cuda,gpu -max_num_threads=1024 -model=unknown -thread_warp_size=32", [-1, 16, 64, 49152, 2147483647, 1024, 8, 32], "", 0, []], [[], [["FU", 2, [0, 1, 2]], ["SP", 2, 0, 1769472, [24], 1], ["AN", 2, 0, 5], ["AN", 2, 1, 6]]]], "r": [[5.75263e-05, 5.75248e-05, 5.7528e-05], 0, 10.0964, 1662155988], "v": "v0.6"}
{"i": [["[\"te_softmax_norm\", 12, 384]", "cuda -keys=cuda,gpu -max_num_threads=1024 -model=unknown -thread_warp_size=32", [-1, 16, 64, 49152, 2147483647, 1024, 8, 32], "", 0, []], [[], [["FU", 2, [0, 1, 2]], ["SP", 2, 0, 1769472, [48], 1], ["AN", 2, 0, 5], ["AN", 2, 1, 6]]]], "r": [[2.96703e-05, 2.96697e-05, 2.96814e-05], 0, 4.84079, 1662155983], "v": "v0.6"}
{"i": [["[\"te_softmax_norm\", 12, 384]", "cuda -keys=cuda,gpu -max_num_threads=1024 -model=unknown -thread_warp_size=32", [-1, 16, 64, 49152, 2147483647, 1024, 8, 32], "", 0, []], [[], [["FU", 2, [0, 1, 2]], ["SP", 2, 0, 1769472, [16], 1], ["AN", 2, 0, 5], ["AN", 2, 1, 6]]]], "r": [[8.48091e-05, 8.48105e-05, 8.48016e-05], 0, 10.8046, 1662155989], "v": "v0.6"}
{"i": [["[\"te_softmax_norm\", 12, 384]", "cuda -keys=cuda,gpu -max_num_threads=1024 -model=unknown -thread_warp_size=32", [-1, 16, 64, 49152, 2147483647, 1024, 8, 32], "", 0, []], [[], [["FU", 2, [0, 1, 2]], ["SP", 2, 0, 1769472, [4], 1], ["AN", 2, 0, 5], ["AN", 2, 1, 6]]]], "r": [[0.000330593, 0.00033059, 0.000330573], 0, 8.18161, 1662155986], "v": "v0.6"}
{"i": [["[\"te_softmax_norm\", 12, 384]", "cuda -keys=cuda,gpu -max_num_threads=1024 -model=unknown -thread_warp_size=32", [-1, 16, 64, 49152, 2147483647, 1024, 8, 32], "", 0, []], [[], [["FU", 2, [0, 1, 2]], ["SP", 2, 0, 1769472, [9], 1], ["AN", 2, 0, 5], ["AN", 2, 1, 6]]]], "r": [[0.000148558, 0.000148565, 0.000148563], 0, 11.4402, 1662155990], "v": "v0.6"}
{"i": [["[\"te_softmax_norm\", 12, 384]", "cuda -keys=cuda,gpu -max_num_threads=1024 -model=unknown -thread_warp_size=32", [-1, 16, 64, 49152, 2147483647, 1024, 8, 32], "", 0, []], [[], [["FU", 2, [0, 1, 2]], ["SP", 2, 0, 1769472, [18], 1], ["AN", 2, 0, 5], ["AN", 2, 1, 6]]]], "r": [[7.57772e-05, 7.57801e-05, 7.57757e-05], 0, 4.7616, 1662156217], "v": "v0.6"}
{"i": [["[\"te_softmax_norm\", 12, 384]", "cuda -keys=cuda,gpu -max_num_threads=1024 -model=unknown -thread_warp_size=32", [-1, 16, 64, 49152, 2147483647, 1024, 8, 32], "", 0, []], [[], [["FU", 2, [0, 1, 2]], ["SP", 2, 0, 1769472, [64], 1], ["AN", 2, 0, 5], ["AN", 2, 1, 6]]]], "r": [[2.28852e-05, 2.28904e-05, 2.28845e-05], 0, 6.65841, 1662156219], "v": "v0.6"}
{"i": [["[\"te_softmax_norm\", 12, 384]", "cuda -keys=cuda,gpu -max_num_threads=1024 -model=unknown -thread_warp_size=32", [-1, 16, 64, 49152, 2147483647, 1024, 8, 32], "", 0, []], [[], [["FU", 2, [0, 1, 2]], ["SP", 2, 0, 1769472, [4], 1], ["AN", 2, 0, 5], ["AN", 2, 1, 6]]]], "r": [[0.000330538, 0.000330505, 0.000330518], 0, 2.11306, 1662156214], "v": "v0.6"}
{"i": [["[\"te_softmax_norm\", 12, 384]", "cuda -keys=cuda,gpu -max_num_threads=1024 -model=unknown -thread_warp_size=32", [-1, 16, 64, 49152, 2147483647, 1024, 8, 32], "", 0, []], [[], [["FU", 2, [0, 1, 2]], ["SP", 2, 0, 1769472, [12], 1], ["AN", 2, 0, 5], ["AN", 2, 1, 6]]]], "r": [[0.000111981, 0.000111984, 0.000111985], 0, 0.956327, 1662156213], "v": "v0.6"}
{"i": [["[\"te_softmax_norm\", 12, 384]", "cuda -keys=cuda,gpu -max_num_threads=1024 -model=unknown -thread_warp_size=32", [-1, 16, 64, 49152, 2147483647, 1024, 8, 32], "", 0, []], [[], [["FU", 2, [0, 1, 2]], ["SP", 2, 0, 1769472, [9], 1], ["AN", 2, 0, 5], ["AN", 2, 1, 6]]]], "r": [[0.0001484, 0.000148399, 0.000148392], 0, 4.05511, 1662156216], "v": "v0.6"}
{"i": [["[\"te_softmax_norm\", 12, 384]", "cuda -keys=cuda,gpu -max_num_threads=1024 -model=unknown -thread_warp_size=32", [-1, 16, 64, 49152, 2147483647, 1024, 8, 32], "", 0, []], [[], [["FU", 2, [0, 1, 2]], ["SP", 2, 0, 1769472, [54], 1], ["AN", 2, 0, 5], ["AN", 2, 1, 6]]]], "r": [[2.67268e-05, 2.67248e-05, 2.67317e-05], 0, 1.55806, 1662156214], "v": "v0.6"}
{"i": [["[\"te_softmax_norm\", 12, 384]", "cuda -keys=cuda,gpu -max_num_threads=1024 -model=unknown -thread_warp_size=32", [-1, 16, 64, 49152, 2147483647, 1024, 8, 32], "", 0, []], [[], [["FU", 2, [0, 1, 2]], ["SP", 2, 0, 1769472, [8], 1], ["AN", 2, 0, 5], ["AN", 2, 1, 6]]]], "r": [[0.000166658, 0.000166673, 0.000166675], 0, 7.31517, 1662156220], "v": "v0.6"}
{"i": [["[\"te_softmax_norm\", 12, 384]", "cuda -keys=cuda,gpu -max_num_threads=1024 -model=unknown -thread_warp_size=32", [-1, 16, 64, 49152, 2147483647, 1024, 8, 32], "", 0, []], [[], [["FU", 2, [0, 1, 2]], ["SP", 2, 0, 1769472, [3], 1], ["AN", 2, 0, 5], ["AN", 2, 1, 6]]]], "r": [[0.000439775, 0.000439782, 0.000439808], 0, 8.69695, 1662156221], "v": "v0.6"}
{"i": [["[\"te_softmax_norm\", 12, 384]", "cuda -keys=cuda,gpu -max_num_threads=1024 -model=unknown -thread_warp_size=32", [-1, 16, 64, 49152, 2147483647, 1024, 8, 32], "", 0, []], [[], [["FU", 2, [0, 1, 2]], ["SP", 2, 0, 1769472, [48], 1], ["AN", 2, 0, 5], ["AN", 2, 1, 6]]]], "r": [[2.96099e-05, 2.96065e-05, 2.9617e-05], 0, 2.79094, 1662156215], "v": "v0.6"}
{"i": [["[\"te_softmax_norm\", 12, 384]", "cuda -keys=cuda,gpu -max_num_threads=1024 -model=unknown -thread_warp_size=32", [-1, 16, 64, 49152, 2147483647, 1024, 8, 32], "", 0, []], [[], [["FU", 2, [0, 1, 2]], ["SP", 2, 0, 1769472, [36], 1], ["AN", 2, 0, 5], ["AN", 2, 1, 6]]]], "r": [[3.8784e-05, 3.87908e-05, 3.87887e-05], 0, 3.4315, 1662156216], "v": "v0.6"}
{"i": [["[\"te_softmax_norm\", 12, 384]", "cuda -keys=cuda,gpu -max_num_threads=1024 -model=unknown -thread_warp_size=32", [-1, 16, 64, 49152, 2147483647, 1024, 8, 32], "", 0, []], [[], [["FU", 2, [0, 1, 2]], ["SP", 2, 0, 1769472, [1], 1], ["AN", 2, 0, 5], ["AN", 2, 1, 6]]]], "r": [[0.00131511, 0.00131481, 0.00131481], 0, 7.89068, 1662156220], "v": "v0.6"}
{"i": [["[\"te_softmax_norm\", 12, 384]", "cuda -keys=cuda,gpu -max_num_threads=1024 -model=unknown -thread_warp_size=32", [-1, 16, 64, 49152, 2147483647, 1024, 8, 32], "", 0, []], [[], [["FU", 2, [0, 1, 2]], ["SP", 2, 0, 1769472, [24], 1], ["AN", 2, 0, 5], ["AN", 2, 1, 6]]]], "r": [[5.76193e-05, 5.76159e-05, 5.76207e-05], 0, 5.99111, 1662156218], "v": "v0.6"}
{"i": [["[\"te_softmax_norm\", 12, 384]", "cuda -keys=cuda,gpu -max_num_threads=1024 -model=unknown -thread_warp_size=32", [-1, 16, 64, 49152, 2147483647, 1024, 8, 32], "", 0, []], [[], [["FU", 2, [0, 1, 2]], ["SP", 2, 0, 1769472, [6], 1], ["AN", 2, 0, 5], ["AN", 2, 1, 6]]]], "r": [[0.000221236, 0.000221231, 0.000221215], 0, 11.4456, 1662156224], "v": "v0.6"}
{"i": [["[\"te_softmax_norm\", 12, 384]", "cuda -keys=cuda,gpu -max_num_threads=1024 -model=unknown -thread_warp_size=32", [-1, 16, 64, 49152, 2147483647, 1024, 8, 32], "", 0, []], [[], [["FU", 2, [0, 1, 2]], ["SP", 2, 0, 1769472, [16], 1], ["AN", 2, 0, 5], ["AN", 2, 1, 6]]]], "r": [[8.46816e-05, 8.46754e-05, 8.46772e-05], 0, 9.51301, 1662156222], "v": "v0.6"}
{"i": [["[\"te_softmax_norm\", 12, 384]", "cuda -keys=cuda,gpu -max_num_threads=1024 -model=unknown -thread_warp_size=32", [-1, 16, 64, 49152, 2147483647, 1024, 8, 32], "", 0, []], [[], [["FU", 2, [0, 1, 2]], ["SP", 2, 0, 1769472, [27], 1], ["AN", 2, 0, 5], ["AN", 2, 1, 6]]]], "r": [[5.13546e-05, 5.13562e-05, 5.13495e-05], 0, 5.38791, 1662156218], "v": "v0.6"}
{"i": [["[\"te_softmax_norm\", 12, 384]", "cuda -keys=cuda,gpu -max_num_threads=1024 -model=unknown -thread_warp_size=32", [-1, 16, 64, 49152, 2147483647, 1024, 8, 32], "", 0, []], [[], [["FU", 2, [0, 1, 2]], ["SP", 2, 0, 1769472, [2], 1], ["AN", 2, 0, 5], ["AN", 2, 1, 6]]]], "r": [[0.000658293, 0.000658342, 0.000658326], 0, 10.8225, 1662156223], "v": "v0.6"}
{"i": [["[\"te_softmax_norm\", 12, 384]", "cuda -keys=cuda,gpu -max_num_threads=1024 -model=unknown -thread_warp_size=32", [-1, 16, 64, 49152, 2147483647, 1024, 8, 32], "", 0, []], [[], [["FU", 2, [0, 1, 2]], ["SP", 2, 0, 1769472, [32], 1], ["AN", 2, 0, 5], ["AN", 2, 1, 6]]]], "r": [[4.37716e-05, 4.37794e-05, 4.37813e-05], 0, 10.219, 1662156223], "v": "v0.6"}
