python/models/bert/kernel_configs/bert_attn_split_1_128_12_64_1.log
{"i": [["[\"bert_split\", 1, 128, 12, 64, 1]", "cuda -keys=cuda,gpu -max_num_threads=1024 -model=unknown -thread_warp_size=32", [-1, 16, 64, 49152, 2147483647, 1024, 8, 32], "", 0, []], [[], [["FU", 1, [0, 1, 2]], ["SP", 1, 0, 294912, [6], 1], ["AN", 1, 0, 5], ["AN", 1, 1, 6]]]], "r": [[3.90419e-05, 3.90402e-05, 3.90406e-05, 3.90425e-05, 3.90442e-05, 3.90431e-05, 3.9043e-05, 3.90405e-05, 3.90416e-05, 3.90401e-05], 0, 5.49825, 1657358798], "v": "v0.6"}
{"i": [["[\"bert_split\", 1, 128, 12, 64, 1]", "cuda -keys=cuda,gpu -max_num_threads=1024 -model=unknown -thread_warp_size=32", [-1, 16, 64, 49152, 2147483647, 1024, 8, 32], "", 0, []], [[], [["FU", 1, [0, 1, 2]], ["SP", 1, 0, 294912, [24], 1], ["AN", 1, 0, 5], ["AN", 1, 1, 6]]]], "r": [[1.19131e-05, 1.19136e-05, 1.19125e-05, 1.19144e-05, 1.19141e-05, 1.19136e-05, 1.19142e-05, 1.1914e-05, 1.19139e-05, 1.19142e-05], 0, 14.7236, 1657358807], "v": "v0.6"}
{"i": [["[\"bert_split\", 1, 128, 12, 64, 1]", "cuda -keys=cuda,gpu -max_num_threads=1024 -model=unknown -thread_warp_size=32", [-1, 16, 64, 49152, 2147483647, 1024, 8, 32], "", 0, []], [[], [["FU", 1, [0, 1, 2]], ["SP", 1, 0, 294912, [48], 1], ["AN", 1, 0, 5], ["AN", 1, 1, 6]]]], "r": [[7.16893e-06, 7.16928e-06, 7.16866e-06, 7.16906e-06, 7.17104e-06, 7.17036e-06, 7.16844e-06, 7.16852e-06, 7.16843e-06, 7.16837e-06], 0, 9.90686, 1657358802], "v": "v0.6"}
{"i": [["[\"bert_split\", 1, 128, 12, 64, 1]", "cuda -keys=cuda,gpu -max_num_threads=1024 -model=unknown -thread_warp_size=32", [-1, 16, 64, 49152, 2147483647, 1024, 8, 32], "", 0, []], [[], [["FU", 1, [0, 1, 2]], ["SP", 1, 0, 294912, [4], 1], ["AN", 1, 0, 5], ["AN", 1, 1, 6]]]], "r": [[5.74317e-05, 5.74352e-05, 5.74336e-05, 5.74343e-05, 5.74362e-05, 5.7435e-05, 5.74362e-05, 5.74341e-05, 5.74352e-05, 5.74347e-05], 0, 20.0551, 1657358812], "v": "v0.6"}
{"i": [["[\"bert_split\", 1, 128, 12, 64, 1]", "cuda -keys=cuda,gpu -max_num_threads=1024 -model=unknown -thread_warp_size=32", [-1, 16, 64, 49152, 2147483647, 1024, 8, 32], "", 0, []], [[], [["FU", 1, [0, 1, 2]], ["SP", 1, 0, 294912, [32], 1], ["AN", 1, 0, 5], ["AN", 1, 1, 6]]]], "r": [[9.4592e-06, 9.46133e-06, 9.46223e-06, 9.46271e-06, 9.46138e-06, 9.46135e-06, 9.46252e-06, 9.46248e-06, 9.46027e-06, 9.46158e-06], 0, 29.5449, 1657358822], "v": "v0.6"}
{"i": [["[\"bert_split\", 1, 128, 12, 64, 1]", "cuda -keys=cuda,gpu -max_num_threads=1024 -model=unknown -thread_warp_size=32", [-1, 16, 64, 49152, 2147483647, 1024, 8, 32], "", 0, []], [[], [["FU", 1, [0, 1, 2]], ["SP", 1, 0, 294912, [18], 1], ["AN", 1, 0, 5], ["AN", 1, 1, 6]]]], "r": [[1.49608e-05, 1.49611e-05, 1.49608e-05, 1.49609e-05, 1.49608e-05, 1.49607e-05, 1.49608e-05, 1.49625e-05, 1.49602e-05, 1.49602e-05], 0, 24.9206, 1657358817], "v": "v0.6"}
{"i": [["[\"bert_split\", 1, 128, 12, 64, 1]", "cuda -keys=cuda,gpu -max_num_threads=1024 -model=unknown -thread_warp_size=32", [-1, 16, 64, 49152, 2147483647, 1024, 8, 32], "", 0, []], [[], [["FU", 1, [0, 1, 2]], ["SP", 1, 0, 294912, [16], 1], ["AN", 1, 0, 5], ["AN", 1, 1, 6]]]], "r": [[1.65615e-05, 1.65599e-05, 1.65608e-05, 1.65599e-05, 1.656e-05, 1.65601e-05, 1.65606e-05, 1.65601e-05, 1.65603e-05, 1.65596e-05], 0, 43.2597, 1657358836], "v": "v0.6"}
{"i": [["[\"bert_split\", 1, 128, 12, 64, 1]", "cuda -keys=cuda,gpu -max_num_threads=1024 -model=unknown -thread_warp_size=32", [-1, 16, 64, 49152, 2147483647, 1024, 8, 32], "", 0, []], [[], [["FU", 1, [0, 1, 2]], ["SP", 1, 0, 294912, [64], 1], ["AN", 1, 0, 5], ["AN", 1, 1, 6]]]], "r": [[6.14901e-06, 6.14906e-06, 6.14957e-06, 6.14934e-06, 6.14921e-06, 6.1491e-06, 6.14904e-06, 6.14925e-06, 6.14905e-06, 6.14931e-06], 0, 33.782, 1657358826], "v": "v0.6"}
{"i": [["[\"bert_split\", 1, 128, 12, 64, 1]", "cuda -keys=cuda,gpu -max_num_threads=1024 -model=unknown -thread_warp_size=32", [-1, 16, 64, 49152, 2147483647, 1024, 8, 32], "", 0, []], [[], [["FU", 1, [0, 1, 2]], ["SP", 1, 0, 294912, [12], 1], ["AN", 1, 0, 5], ["AN", 1, 1, 6]]]], "r": [[2.11292e-05, 2.11288e-05, 2.11272e-05, 2.113e-05, 2.11292e-05, 2.11289e-05, 2.11294e-05, 2.11283e-05, 2.11287e-05, 2.11287e-05], 0, 48.3493, 1657358841], "v": "v0.6"}
{"i": [["[\"bert_split\", 1, 128, 12, 64, 1]", "cuda -keys=cuda,gpu -max_num_threads=1024 -model=unknown -thread_warp_size=32", [-1, 16, 64, 49152, 2147483647, 1024, 8, 32], "", 0, []], [[], [["FU", 1, [0, 1, 2]], ["SP", 1, 0, 294912, [2], 1], ["AN", 1, 0, 5], ["AN", 1, 1, 6]]]], "r": [[0.000111857, 0.000111857, 0.000111857, 0.000111858, 0.000111857, 0.000111857, 0.000111857, 0.000111858, 0.000111858, 0.000111857], 0, 59.2543, 1657358852], "v": "v0.6"}
{"i": [["[\"bert_split\", 1, 128, 12, 64, 1]", "cuda -keys=cuda,gpu -max_num_threads=1024 -model=unknown -thread_warp_size=32", [-1, 16, 64, 49152, 2147483647, 1024, 8, 32], "", 0, []], [[], [["FU", 1, [0, 1, 2]], ["SP", 1, 0, 294912, [36], 1], ["AN", 1, 0, 5], ["AN", 1, 1, 6]]]], "r": [[8.77882e-06, 8.77897e-06, 8.7793e-06, 8.77926e-06, 8.77947e-06, 8.77891e-06, 8.77891e-06, 8.77827e-06, 8.77932e-06, 8.77926e-06], 0, 38.301, 1657358831], "v": "v0.6"}
{"i": [["[\"bert_split\", 1, 128, 12, 64, 1]", "cuda -keys=cuda,gpu -max_num_threads=1024 -model=unknown -thread_warp_size=32", [-1, 16, 64, 49152, 2147483647, 1024, 8, 32], "", 0, []], [[], [["FU", 1, [0, 1, 2]], ["SP", 1, 0, 294912, [8], 1], ["AN", 1, 0, 5], ["AN", 1, 1, 6]]]], "r": [[3.00107e-05, 3.00092e-05, 3.00098e-05, 3.00103e-05, 3.00094e-05, 3.00102e-05, 3.00103e-05, 3.00102e-05, 3.00105e-05, 3.00103e-05], 0, 69.5851, 1657358862], "v": "v0.6"}
{"i": [["[\"bert_split\", 1, 128, 12, 64, 1]", "cuda -keys=cuda,gpu -max_num_threads=1024 -model=unknown -thread_warp_size=32", [-1, 16, 64, 49152, 2147483647, 1024, 8, 32], "", 0, []], [[], [["FU", 1, [0, 1, 2]], ["SP", 1, 0, 294912, [1], 1], ["AN", 1, 0, 5], ["AN", 1, 1, 6]]]], "r": [[0.000221133, 0.000221132, 0.00022113, 0.000221134, 0.000221131, 0.000221133, 0.000221131, 0.000221128, 0.000221129, 0.000221135], 0, 53.8096, 1657358846], "v": "v0.6"}
{"i": [["[\"bert_split\", 1, 128, 12, 64, 1]", "cuda -keys=cuda,gpu -max_num_threads=1024 -model=unknown -thread_warp_size=32", [-1, 16, 64, 49152, 2147483647, 1024, 8, 32], "", 0, []], [[], [["FU", 1, [0, 1, 2]], ["SP", 1, 0, 294912, [9], 1], ["AN", 1, 0, 5], ["AN", 1, 1, 6]]]], "r": [[2.70668e-05, 2.70668e-05, 2.70683e-05, 2.70658e-05, 2.70664e-05, 2.70649e-05, 2.70667e-05, 2.70665e-05, 2.70648e-05, 2.70648e-05], 0, 64.4019, 1657358857], "v": "v0.6"}
{"i": [["[\"bert_split\", 1, 128, 12, 64, 1]", "cuda -keys=cuda,gpu -max_num_threads=1024 -model=unknown -thread_warp_size=32", [-1, 16, 64, 49152, 2147483647, 1024, 8, 32], "", 0, []], [[], [["FU", 1, [0, 1, 2]], ["SP", 1, 0, 294912, [3], 1], ["AN", 1, 0, 5], ["AN", 1, 1, 6]]]], "r": [[7.55575e-05, 7.55605e-05, 7.5564e-05, 7.55633e-05, 7.55629e-05, 7.55611e-05, 7.55631e-05, 7.55626e-05, 7.55611e-05, 7.55619e-05], 0, 75.0114, 1657358867], "v": "v0.6"}
