python/models/bert/kernel_configs/bert_softmax_reduce_sum_1_128_12_64.log
{"i": [["[\"bert_softmax_reduce_sum\", 1, 128, 12, 64]", "cuda -keys=cuda,gpu -max_num_threads=1024 -model=unknown -thread_warp_size=32", [-1, 16, 64, 49152, 2147483647, 1024, 8, 32], "", 0, []], [[], [["CI", 1], ["FU", 2, [0, 1]], ["SP", 2, 0, 1536, [24], 1], ["AN", 2, 0, 5], ["AN", 2, 1, 6], ["PR", 2, 0, "auto_unroll_max_step$0"]]]], "r": [[1.04221e-05, 1.04222e-05, 1.04229e-05, 1.04208e-05, 1.04204e-05, 1.04205e-05, 1.04227e-05, 1.04232e-05, 1.04255e-05, 1.04319e-05], 0, 13.3897, 1657365524], "v": "v0.6"}
{"i": [["[\"bert_softmax_reduce_sum\", 1, 128, 12, 64]", "cuda -keys=cuda,gpu -max_num_threads=1024 -model=unknown -thread_warp_size=32", [-1, 16, 64, 49152, 2147483647, 1024, 8, 32], "", 0, []], [[], [["CI", 1], ["FU", 2, [0, 1]], ["SP", 2, 0, 1536, [64], 1], ["AN", 2, 0, 5], ["AN", 2, 1, 6], ["PR", 2, 0, "auto_unroll_max_step$512"]]]], "r": [[1.20593e-05, 1.20595e-05, 1.20592e-05, 1.20591e-05, 1.20593e-05, 1.20591e-05, 1.20592e-05, 1.20591e-05, 1.20593e-05, 1.20592e-05], 0, 27.5693, 1657365538], "v": "v0.6"}
{"i": [["[\"bert_softmax_reduce_sum\", 1, 128, 12, 64]", "cuda -keys=cuda,gpu -max_num_threads=1024 -model=unknown -thread_warp_size=32", [-1, 16, 64, 49152, 2147483647, 1024, 8, 32], "", 0, []], [[], [["CI", 1], ["FU", 2, [0, 1]], ["SP", 2, 0, 1536, [3], 1], ["AN", 2, 0, 5], ["AN", 2, 1, 6], ["PR", 2, 0, "auto_unroll_max_step$16"]]]], "r": [[1.19511e-05, 1.19532e-05, 1.19527e-05, 1.19518e-05, 1.19518e-05, 1.1953e-05, 1.1952e-05, 1.1954e-05, 1.19525e-05, 1.19538e-05], 0, 50.4615, 1657365561], "v": "v0.6"}
{"i": [["[\"bert_softmax_reduce_sum\", 1, 128, 12, 64]", "cuda -keys=cuda,gpu -max_num_threads=1024 -model=unknown -thread_warp_size=32", [-1, 16, 64, 49152, 2147483647, 1024, 8, 32], "", 0, []], [[], [["CI", 1], ["FU", 2, [0, 1]], ["SP", 2, 0, 1536, [6], 1], ["AN", 2, 0, 5], ["AN", 2, 1, 6], ["PR", 2, 0, "auto_unroll_max_step$0"]]]], "r": [[8.85637e-06, 8.85052e-06, 8.85199e-06, 8.84189e-06, 8.84948e-06, 8.84853e-06, 8.84353e-06, 8.84676e-06, 8.85328e-06, 8.84889e-06], 0, 45.9779, 1657365556], "v": "v0.6"}
{"i": [["[\"bert_softmax_reduce_sum\", 1, 128, 12, 64]", "cuda -keys=cuda,gpu -max_num_threads=1024 -model=unknown -thread_warp_size=32", [-1, 16, 64, 49152, 2147483647, 1024, 8, 32], "", 0, []], [[], [["CI", 1], ["FU", 2, [0, 1]], ["SP", 2, 0, 1536, [16], 1], ["AN", 2, 0, 5], ["AN", 2, 1, 6], ["PR", 2, 0, "auto_unroll_max_step$64"]]]], "r": [[8.99434e-06, 8.9943e-06, 8.99439e-06, 8.9945e-06, 8.9943e-06, 8.99443e-06, 8.99434e-06, 8.99446e-06, 8.99441e-06, 8.99443e-06], 0, 31.9965, 1657365542], "v": "v0.6"}
{"i": [["[\"bert_softmax_reduce_sum\", 1, 128, 12, 64]", "cuda -keys=cuda,gpu -max_num_threads=1024 -model=unknown -thread_warp_size=32", [-1, 16, 64, 49152, 2147483647, 1024, 8, 32], "", 0, []], [[], [["CI", 1], ["FU", 2, [0, 1]], ["SP", 2, 0, 1536, [1], 1], ["AN", 2, 0, 5], ["AN", 2, 1, 6], ["PR", 2, 0, "auto_unroll_max_step$0"]]]], "r": [[2.20218e-05, 2.20163e-05, 2.20231e-05, 2.20212e-05, 2.20223e-05, 2.20208e-05, 2.20203e-05, 2.20198e-05, 2.20187e-05, 2.2017e-05], 0, 59.5947, 1657365570], "v": "v0.6"}
{"i": [["[\"bert_softmax_reduce_sum\", 1, 128, 12, 64]", "cuda -keys=cuda,gpu -max_num_threads=1024 -model=unknown -thread_warp_size=32", [-1, 16, 64, 49152, 2147483647, 1024, 8, 32], "", 0, []], [[], [["CI", 1], ["FU", 2, [0, 1]], ["SP", 2, 0, 1536, [1], 1], ["AN", 2, 0, 5], ["AN", 2, 1, 6], ["PR", 2, 0, "auto_unroll_max_step$16"]]]], "r": [[2.19952e-05, 2.19927e-05, 2.19927e-05, 2.19953e-05, 2.19973e-05, 2.19936e-05, 2.19976e-05, 2.19928e-05, 2.1993e-05, 2.1994e-05], 0, 37.1699, 1657365547], "v": "v0.6"}
{"i": [["[\"bert_softmax_reduce_sum\", 1, 128, 12, 64]", "cuda -keys=cuda,gpu -max_num_threads=1024 -model=unknown -thread_warp_size=32", [-1, 16, 64, 49152, 2147483647, 1024, 8, 32], "", 0, []], [[], [["SP", 2, 2, 128, [8], 1], ["AN", 2, 3, 6], ["CI", 1], ["FU", 2, [0, 1]], ["AN", 2, 0, 5], ["PR", 2, 0, "auto_unroll_max_step$16"]]]], "r": [[4.51934e-06, 4.51928e-06, 4.5193e-06, 4.51948e-06, 4.51932e-06, 4.51939e-06, 4.51949e-06, 4.5193e-06, 4.5192e-06, 4.51934e-06], 0, 8.88508, 1657365519], "v": "v0.6"}
{"i": [["[\"bert_softmax_reduce_sum\", 1, 128, 12, 64]", "cuda -keys=cuda,gpu -max_num_threads=1024 -model=unknown -thread_warp_size=32", [-1, 16, 64, 49152, 2147483647, 1024, 8, 32], "", 0, []], [[], [["CI", 1], ["FU", 2, [0, 1]], ["SP", 2, 0, 1536, [24], 1], ["AN", 2, 0, 5], ["AN", 2, 1, 6], ["PR", 2, 0, "auto_unroll_max_step$64"]]]], "r": [[1.04079e-05, 1.04071e-05, 1.04076e-05, 1.04082e-05, 1.04084e-05, 1.04084e-05, 1.04083e-05, 1.04084e-05, 1.04084e-05, 1.04082e-05], 0, 18.2182, 1657365528], "v": "v0.6"}
{"i": [["[\"bert_softmax_reduce_sum\", 1, 128, 12, 64]", "cuda -keys=cuda,gpu -max_num_threads=1024 -model=unknown -thread_warp_size=32", [-1, 16, 64, 49152, 2147483647, 1024, 8, 32], "", 0, []], [[], [["SP", 2, 2, 128, [2], 1], ["AN", 2, 3, 6], ["CI", 1], ["FU", 2, [0, 1]], ["AN", 2, 0, 5], ["PR", 2, 0, "auto_unroll_max_step$0"]]]], "r": [[7.61624e-06, 7.61662e-06, 7.61613e-06, 7.6169e-06, 7.61732e-06, 7.61523e-06, 7.61716e-06, 7.61756e-06, 7.6183e-06, 7.61716e-06], 0, 5.26834, 1657365515], "v": "v0.6"}
{"i": [["[\"bert_softmax_reduce_sum\", 1, 128, 12, 64]", "cuda -keys=cuda,gpu -max_num_threads=1024 -model=unknown -thread_warp_size=32", [-1, 16, 64, 49152, 2147483647, 1024, 8, 32], "", 0, []], [[], [["SP", 2, 2, 128, [4], 1], ["AN", 2, 3, 6], ["CI", 1], ["FU", 2, [0, 1]], ["AN", 2, 0, 5], ["PR", 2, 0, "auto_unroll_max_step$512"]]]], "r": [[6.09418e-06, 6.09498e-06, 6.09406e-06, 6.09579e-06, 6.09473e-06, 6.09445e-06, 6.09427e-06, 6.09528e-06, 6.09566e-06, 6.09385e-06], 0, 41.2086, 1657365551], "v": "v0.6"}
{"i": [["[\"bert_softmax_reduce_sum\", 1, 128, 12, 64]", "cuda -keys=cuda,gpu -max_num_threads=1024 -model=unknown -thread_warp_size=32", [-1, 16, 64, 49152, 2147483647, 1024, 8, 32], "", 0, []], [[], [["CI", 1], ["FU", 2, [0, 1]], ["SP", 2, 0, 1536, [2], 1], ["AN", 2, 0, 5], ["AN", 2, 1, 6], ["PR", 2, 0, "auto_unroll_max_step$16"]]]], "r": [[1.34258e-05, 1.34243e-05, 1.34239e-05, 1.34247e-05, 1.34273e-05, 1.3425e-05, 1.3424e-05, 1.3425e-05, 1.34259e-05, 1.3423e-05], 0, 111.167, 1657365621], "v": "v0.6"}
{"i": [["[\"bert_softmax_reduce_sum\", 1, 128, 12, 64]", "cuda -keys=cuda,gpu -max_num_threads=1024 -model=unknown -thread_warp_size=32", [-1, 16, 64, 49152, 2147483647, 1024, 8, 32], "", 0, []], [[], [["CI", 1], ["FU", 2, [0, 1]], ["SP", 2, 0, 1536, [6], 1], ["AN", 2, 0, 5], ["AN", 2, 1, 6], ["PR", 2, 0, "auto_unroll_max_step$512"]]]], "r": [[8.76579e-06, 8.76419e-06, 8.7602e-06, 8.75303e-06, 8.75698e-06, 8.76075e-06, 8.75878e-06, 8.76456e-06, 8.75157e-06, 8.75046e-06], 0, 127.492, 1657365638], "v": "v0.6"}
{"i": [["[\"bert_softmax_reduce_sum\", 1, 128, 12, 64]", "cuda -keys=cuda,gpu -max_num_threads=1024 -model=unknown -thread_warp_size=32", [-1, 16, 64, 49152, 2147483647, 1024, 8, 32], "", 0, []], [[], [["SP", 2, 2, 128, [32], 1], ["AN", 2, 3, 6], ["CI", 1], ["FU", 2, [0, 1]], ["AN", 2, 0, 5], ["PR", 2, 0, "auto_unroll_max_step$0"]]]], "r": [[4.16553e-06, 4.16558e-06, 4.16581e-06, 4.16569e-06, 4.16544e-06, 4.16582e-06, 4.16593e-06, 4.16615e-06, 4.16599e-06, 4.16598e-06], 0, 93.7043, 1657365604], "v": "v0.6"}
{"i": [["[\"bert_softmax_reduce_sum\", 1, 128, 12, 64]", "cuda -keys=cuda,gpu -max_num_threads=1024 -model=unknown -thread_warp_size=32", [-1, 16, 64, 49152, 2147483647, 1024, 8, 32], "", 0, []], [[], [["CI", 1], ["FU", 2, [0, 1]], ["SP", 2, 0, 1536, [6], 1], ["AN", 2, 0, 5], ["AN", 2, 1, 6], ["PR", 2, 0, "auto_unroll_max_step$1024"]]]], "r": [[8.85206e-06, 8.85183e-06, 8.85845e-06, 8.85364e-06, 8.86236e-06, 8.843e-06, 8.85939e-06, 8.84716e-06, 8.85131e-06, 8.83704e-06], 0, 106.181, 1657365616], "v": "v0.6"}
{"i": [["[\"bert_softmax_reduce_sum\", 1, 128, 12, 64]", "cuda -keys=cuda,gpu -max_num_threads=1024 -model=unknown -thread_warp_size=32", [-1, 16, 64, 49152, 2147483647, 1024, 8, 32], "", 0, []], [[], [["SP", 2, 2, 128, [32], 1], ["AN", 2, 3, 6], ["CI", 1], ["FU", 2, [0, 1]], ["AN", 2, 0, 5], ["PR", 2, 0, "auto_unroll_max_step$64"]]]], "r": [[4.01468e-06, 4.01477e-06, 4.01465e-06, 4.01472e-06, 4.01474e-06, 4.01486e-06, 4.01476e-06, 4.01476e-06, 4.01475e-06, 4.01478e-06], 0, 114.612, 1657365625], "v": "v0.6"}
{"i": [["[\"bert_softmax_reduce_sum\", 1, 128, 12, 64]", "cuda -keys=cuda,gpu -max_num_threads=1024 -model=unknown -thread_warp_size=32", [-1, 16, 64, 49152, 2147483647, 1024, 8, 32], "", 0, []], [[], [["SP", 2, 2, 128, [64], 1], ["AN", 2, 3, 6], ["CI", 1], ["FU", 2, [0, 1]], ["AN", 2, 0, 5], ["PR", 2, 0, "auto_unroll_max_step$1024"]]]], "r": [[4.18899e-06, 4.18877e-06, 4.18864e-06, 4.1888e-06, 4.18867e-06, 4.18865e-06, 4.1887e-06, 4.18887e-06, 4.1893e-06, 4.18924e-06], 0, 97.3366, 1657365608], "v": "v0.6"}
{"i": [["[\"bert_softmax_reduce_sum\", 1, 128, 12, 64]", "cuda -keys=cuda,gpu -max_num_threads=1024 -model=unknown -thread_warp_size=32", [-1, 16, 64, 49152, 2147483647, 1024, 8, 32], "", 0, []], [[], [["SP", 2, 2, 128, [32], 1], ["AN", 2, 3, 6], ["CI", 1], ["FU", 2, [0, 1]], ["AN", 2, 0, 5], ["PR", 2, 0, "auto_unroll_max_step$512"]]]], "r": [[4.15439e-06, 4.15422e-06, 4.15464e-06, 4.15457e-06, 4.15469e-06, 4.15468e-06, 4.15437e-06, 4.1544e-06, 4.1546e-06, 4.15485e-06], 0, 54.438, 1657365565], "v": "v0.6"}
{"i": [["[\"bert_softmax_reduce_sum\", 1, 128, 12, 64]", "cuda -keys=cuda,gpu -max_num_threads=1024 -model=unknown -thread_warp_size=32", [-1, 16, 64, 49152, 2147483647, 1024, 8, 32], "", 0, []], [[], [["CI", 1], ["FU", 2, [0, 1]], ["SP", 2, 0, 1536, [12], 1], ["AN", 2, 0, 5], ["AN", 2, 1, 6], ["PR", 2, 0, "auto_unroll_max_step$512"]]]], "r": [[8.56584e-06, 8.56595e-06, 8.56609e-06, 8.56614e-06, 8.56617e-06, 8.56612e-06, 8.56613e-06, 8.56611e-06, 8.56608e-06, 8.56611e-06], 0, 145.371, 1657365656], "v": "v0.6"}
{"i": [["[\"bert_softmax_reduce_sum\", 1, 128, 12, 64]", "cuda -keys=cuda,gpu -max_num_threads=1024 -model=unknown -thread_warp_size=32", [-1, 16, 64, 49152, 2147483647, 1024, 8, 32], "", 0, []], [[], [["CI", 1], ["FU", 2, [0, 1]], ["SP", 2, 0, 1536, [4], 1], ["AN", 2, 0, 5], ["AN", 2, 1, 6], ["PR", 2, 0, "auto_unroll_max_step$16"]]]], "r": [[1.06359e-05, 1.06396e-05, 1.06343e-05, 1.0629e-05, 1.0639e-05, 1.06369e-05, 1.0626e-05, 1.06273e-05, 1.06397e-05, 1.06251e-05], 0, 149.996, 1657365660], "v": "v0.6"}
{"i": [["[\"bert_softmax_reduce_sum\", 1, 128, 12, 64]", "cuda -keys=cuda,gpu -max_num_threads=1024 -model=unknown -thread_warp_size=32", [-1, 16, 64, 49152, 2147483647, 1024, 8, 32], "", 0, []], [[], [["SP", 2, 2, 128, [8], 1], ["AN", 2, 3, 6], ["CI", 1], ["FU", 2, [0, 1]], ["AN", 2, 0, 5], ["PR", 2, 0, "auto_unroll_max_step$64"]]]], "r": [[4.29671e-06, 4.29719e-06, 4.29619e-06, 4.29732e-06, 4.2962e-06, 4.2962e-06, 4.29562e-06, 4.29442e-06, 4.29303e-06, 4.29259e-06], 0, 118.442, 1657365629], "v": "v0.6"}
{"i": [["[\"bert_softmax_reduce_sum\", 1, 128, 12, 64]", "cuda -keys=cuda,gpu -max_num_threads=1024 -model=unknown -thread_warp_size=32", [-1, 16, 64, 49152, 2147483647, 1024, 8, 32], "", 0, []], [[], [["SP", 2, 2, 128, [2], 1], ["AN", 2, 3, 6], ["CI", 1], ["FU", 2, [0, 1]], ["AN", 2, 0, 5], ["PR", 2, 0, "auto_unroll_max_step$16"]]]], "r": [[7.59747e-06, 7.59683e-06, 7.597e-06, 7.59625e-06, 7.59692e-06, 7.59473e-06, 7.59656e-06, 7.59621e-06, 7.59435e-06, 7.59685e-06], 0, 67.9505, 1657365578], "v": "v0.6"}
{"i": [["[\"bert_softmax_reduce_sum\", 1, 128, 12, 64]", "cuda -keys=cuda,gpu -max_num_threads=1024 -model=unknown -thread_warp_size=32", [-1, 16, 64, 49152, 2147483647, 1024, 8, 32], "", 0, []], [[], [["SP", 2, 2, 128, [4], 1], ["AN", 2, 3, 6], ["CI", 1], ["FU", 2, [0, 1]], ["AN", 2, 0, 5], ["PR", 2, 0, "auto_unroll_max_step$1024"]]]], "r": [[5.94212e-06, 5.94326e-06, 5.94264e-06, 5.94192e-06, 5.94257e-06, 5.94312e-06, 5.94047e-06, 5.94275e-06, 5.94155e-06, 5.94163e-06], 0, 63.5386, 1657365574], "v": "v0.6"}
{"i": [["[\"bert_softmax_reduce_sum\", 1, 128, 12, 64]", "cuda -keys=cuda,gpu -max_num_threads=1024 -model=unknown -thread_warp_size=32", [-1, 16, 64, 49152, 2147483647, 1024, 8, 32], "", 0, []], [[], [["SP", 2, 2, 128, [4], 1], ["AN", 2, 3, 6], ["CI", 1], ["FU", 2, [0, 1]], ["AN", 2, 0, 5], ["PR", 2, 0, "auto_unroll_max_step$0"]]]], "r": [[6.08654e-06, 6.08609e-06, 6.086e-06, 6.08672e-06, 6.08641e-06, 6.08713e-06, 6.08676e-06, 6.08702e-06, 6.08624e-06, 6.08678e-06], 0, 101.569, 1657365612], "v": "v0.6"}
{"i": [["[\"bert_softmax_reduce_sum\", 1, 128, 12, 64]", "cuda -keys=cuda,gpu -max_num_threads=1024 -model=unknown -thread_warp_size=32", [-1, 16, 64, 49152, 2147483647, 1024, 8, 32], "", 0, []], [[], [["CI", 1], ["FU", 2, [0, 1]], ["SP", 2, 0, 1536, [2], 1], ["AN", 2, 0, 5], ["AN", 2, 1, 6], ["PR", 2, 0, "auto_unroll_max_step$0"]]]], "r": [[1.34493e-05, 1.34481e-05, 1.34502e-05, 1.34542e-05, 1.34487e-05, 1.34471e-05, 1.34461e-05, 1.34466e-05, 1.34481e-05, 1.34449e-05], 0, 80.7851, 1657365591], "v": "v0.6"}
{"i": [["[\"bert_softmax_reduce_sum\", 1, 128, 12, 64]", "cuda -keys=cuda,gpu -max_num_threads=1024 -model=unknown -thread_warp_size=32", [-1, 16, 64, 49152, 2147483647, 1024, 8, 32], "", 0, []], [[], [["CI", 1], ["FU", 2, [0, 1]], ["SP", 2, 0, 1536, [1], 1], ["AN", 2, 0, 5], ["AN", 2, 1, 6], ["PR", 2, 0, "auto_unroll_max_step$512"]]]], "r": [[2.19136e-05, 2.19158e-05, 2.1918e-05, 2.19182e-05, 2.19136e-05, 2.19156e-05, 2.19146e-05, 2.1918e-05, 2.19172e-05, 2.19234e-05], 0, 132.146, 1657365643], "v": "v0.6"}
{"i": [["[\"bert_softmax_reduce_sum\", 1, 128, 12, 64]", "cuda -keys=cuda,gpu -max_num_threads=1024 -model=unknown -thread_warp_size=32", [-1, 16, 64, 49152, 2147483647, 1024, 8, 32], "", 0, []], [[], [["SP", 2, 2, 128, [8], 1], ["AN", 2, 3, 6], ["CI", 1], ["FU", 2, [0, 1]], ["AN", 2, 0, 5], ["PR", 2, 0, "auto_unroll_max_step$1024"]]]], "r": [[4.22119e-06, 4.22112e-06, 4.22108e-06, 4.22126e-06, 4.2213e-06, 4.22115e-06, 4.22102e-06, 4.22099e-06, 4.22101e-06, 4.22107e-06], 0, 136.126, 1657365646], "v": "v0.6"}
{"i": [["[\"bert_softmax_reduce_sum\", 1, 128, 12, 64]", "cuda -keys=cuda,gpu -max_num_threads=1024 -model=unknown -thread_warp_size=32", [-1, 16, 64, 49152, 2147483647, 1024, 8, 32], "", 0, []], [[], [["SP", 2, 2, 128, [8], 1], ["AN", 2, 3, 6], ["CI", 1], ["FU", 2, [0, 1]], ["AN", 2, 0, 5], ["PR", 2, 0, "auto_unroll_max_step$0"]]]], "r": [[4.27967e-06, 4.27962e-06, 4.27948e-06, 4.27977e-06, 4.27978e-06, 4.27961e-06, 4.27986e-06, 4.27994e-06, 4.27985e-06, 4.27971e-06], 0, 71.4996, 1657365582], "v": "v0.6"}
{"i": [["[\"bert_softmax_reduce_sum\", 1, 128, 12, 64]", "cuda -keys=cuda,gpu -max_num_threads=1024 -model=unknown -thread_warp_size=32", [-1, 16, 64, 49152, 2147483647, 1024, 8, 32], "", 0, []], [[], [["CI", 1], ["FU", 2, [0, 1]], ["SP", 2, 0, 1536, [4], 1], ["AN", 2, 0, 5], ["AN", 2, 1, 6], ["PR", 2, 0, "auto_unroll_max_step$1024"]]]], "r": [[1.05416e-05, 1.05445e-05, 1.05475e-05, 1.05384e-05, 1.05374e-05, 1.05377e-05, 1.0525e-05, 1.05407e-05, 1.05363e-05, 1.05399e-05], 0, 140.726, 1657365651], "v": "v0.6"}
{"i": [["[\"bert_softmax_reduce_sum\", 1, 128, 12, 64]", "cuda -keys=cuda,gpu -max_num_threads=1024 -model=unknown -thread_warp_size=32", [-1, 16, 64, 49152, 2147483647, 1024, 8, 32], "", 0, []], [[], [["CI", 1], ["FU", 2, [0, 1]], ["SP", 2, 0, 1536, [32], 1], ["AN", 2, 0, 5], ["AN", 2, 1, 6], ["PR", 2, 0, "auto_unroll_max_step$16"]]]], "r": [[1.16015e-05, 1.16049e-05, 1.16029e-05, 1.16068e-05, 1.16024e-05, 1.16008e-05, 1.16112e-05, 1.1612e-05, 1.16063e-05, 1.16007e-05], 0, 154.715, 1657365665], "v": "v0.6"}
{"i": [["[\"bert_softmax_reduce_sum\", 1, 128, 12, 64]", "cuda -keys=cuda,gpu -max_num_threads=1024 -model=unknown -thread_warp_size=32", [-1, 16, 64, 49152, 2147483647, 1024, 8, 32], "", 0, []], [[], [["CI", 1], ["FU", 2, [0, 1]], ["SP", 2, 0, 1536, [48], 1], ["AN", 2, 0, 5], ["AN", 2, 1, 6], ["PR", 2, 0, "auto_unroll_max_step$512"]]]], "r": [[1.19666e-05, 1.1966e-05, 1.19592e-05, 1.19502e-05, 1.19459e-05, 1.19607e-05, 1.19536e-05, 1.19324e-05, 1.1939e-05, 1.19278e-05], 0, 89.7198, 1657365600], "v": "v0.6"}
{"i": [["[\"bert_softmax_reduce_sum\", 1, 128, 12, 64]", "cuda -keys=cuda,gpu -max_num_threads=1024 -model=unknown -thread_warp_size=32", [-1, 16, 64, 49152, 2147483647, 1024, 8, 32], "", 0, []], [[], [["SP", 2, 2, 128, [1], 1], ["AN", 2, 3, 6], ["CI", 1], ["FU", 2, [0, 1]], ["AN", 2, 0, 5], ["PR", 2, 0, "auto_unroll_max_step$64"]]]], "r": [[1.11127e-05, 1.11118e-05, 1.11133e-05, 1.11137e-05, 1.11133e-05, 1.11131e-05, 1.1114e-05, 1.11145e-05, 1.11138e-05, 1.1113e-05], 0, 167.552, 1657365678], "v": "v0.6"}
{"i": [["[\"bert_softmax_reduce_sum\", 1, 128, 12, 64]", "cuda -keys=cuda,gpu -max_num_threads=1024 -model=unknown -thread_warp_size=32", [-1, 16, 64, 49152, 2147483647, 1024, 8, 32], "", 0, []], [[], [["CI", 1], ["FU", 2, [0, 1]], ["SP", 2, 0, 1536, [12], 1], ["AN", 2, 0, 5], ["AN", 2, 1, 6], ["PR", 2, 0, "auto_unroll_max_step$16"]]]], "r": [[8.56892e-06, 8.56897e-06, 8.56892e-06, 8.56911e-06, 8.56978e-06, 8.56892e-06, 8.56893e-06, 8.56894e-06, 8.569e-06, 8.569e-06], 0, 75.9251, 1657365586], "v": "v0.6"}
{"i": [["[\"bert_softmax_reduce_sum\", 1, 128, 12, 64]", "cuda -keys=cuda,gpu -max_num_threads=1024 -model=unknown -thread_warp_size=32", [-1, 16, 64, 49152, 2147483647, 1024, 8, 32], "", 0, []], [[], [["SP", 2, 2, 128, [2], 1], ["AN", 2, 3, 6], ["CI", 1], ["FU", 2, [0, 1]], ["AN", 2, 0, 5], ["PR", 2, 0, "auto_unroll_max_step$512"]]]], "r": [[7.63318e-06, 7.63331e-06, 7.63274e-06, 7.63312e-06, 7.63286e-06, 7.63309e-06, 7.63375e-06, 7.63307e-06, 7.63369e-06, 7.63351e-06], 0, 84.9893, 1657365595], "v": "v0.6"}
{"i": [["[\"bert_softmax_reduce_sum\", 1, 128, 12, 64]", "cuda -keys=cuda,gpu -max_num_threads=1024 -model=unknown -thread_warp_size=32", [-1, 16, 64, 49152, 2147483647, 1024, 8, 32], "", 0, []], [[], [["CI", 1], ["FU", 2, [0, 1]], ["SP", 2, 0, 1536, [16], 1], ["AN", 2, 0, 5], ["AN", 2, 1, 6], ["PR", 2, 0, "auto_unroll_max_step$512"]]]], "r": [[9.1159e-06, 9.11093e-06, 9.10948e-06, 9.1168e-06, 9.10393e-06, 9.10471e-06, 9.10547e-06, 9.11028e-06, 9.11075e-06, 9.10996e-06], 0, 123.091, 1657365633], "v": "v0.6"}
{"i": [["[\"bert_softmax_reduce_sum\", 1, 128, 12, 64]", "cuda -keys=cuda,gpu -max_num_threads=1024 -model=unknown -thread_warp_size=32", [-1, 16, 64, 49152, 2147483647, 1024, 8, 32], "", 0, []], [[], [["SP", 2, 2, 128, [32], 1], ["AN", 2, 3, 6], ["CI", 1], ["FU", 2, [0, 1]], ["AN", 2, 0, 5], ["PR", 2, 0, "auto_unroll_max_step$16"]]]], "r": [[4.14925e-06, 4.14919e-06, 4.14852e-06, 4.14991e-06, 4.15007e-06, 4.1497e-06, 4.14933e-06, 4.14957e-06, 4.14983e-06, 4.14933e-06], 0, 171.614, 1657365682], "v": "v0.6"}
{"i": [["[\"bert_softmax_reduce_sum\", 1, 128, 12, 64]", "cuda -keys=cuda,gpu -max_num_threads=1024 -model=unknown -thread_warp_size=32", [-1, 16, 64, 49152, 2147483647, 1024, 8, 32], "", 0, []], [[], [["CI", 1], ["FU", 2, [0, 1]], ["SP", 2, 0, 1536, [4], 1], ["AN", 2, 0, 5], ["AN", 2, 1, 6], ["PR", 2, 0, "auto_unroll_max_step$64"]]]], "r": [[1.05255e-05, 1.0526e-05, 1.05308e-05, 1.05319e-05, 1.05278e-05, 1.05312e-05, 1.05264e-05, 1.05283e-05, 1.05323e-05, 1.05326e-05], 0, 22.7319, 1657365533], "v": "v0.6"}
{"i": [["[\"bert_softmax_reduce_sum\", 1, 128, 12, 64]", "cuda -keys=cuda,gpu -max_num_threads=1024 -model=unknown -thread_warp_size=32", [-1, 16, 64, 49152, 2147483647, 1024, 8, 32], "", 0, []], [[], [["CI", 1], ["FU", 2, [0, 1]], ["SP", 2, 0, 1536, [2], 1], ["AN", 2, 0, 5], ["AN", 2, 1, 6], ["PR", 2, 0, "auto_unroll_max_step$1024"]]]], "r": [[1.33399e-05, 1.33374e-05, 1.33332e-05, 1.33343e-05, 1.33384e-05, 1.33297e-05, 1.33326e-05, 1.33355e-05, 1.33333e-05, 1.33345e-05], 0, 176.389, 1657365687], "v": "v0.6"}
{"i": [["[\"bert_softmax_reduce_sum\", 1, 128, 12, 64]", "cuda -keys=cuda,gpu -max_num_threads=1024 -model=unknown -thread_warp_size=32", [-1, 16, 64, 49152, 2147483647, 1024, 8, 32], "", 0, []], [[], [["CI", 1], ["FU", 2, [0, 1]], ["SP", 2, 0, 1536, [24], 1], ["AN", 2, 0, 5], ["AN", 2, 1, 6], ["PR", 2, 0, "auto_unroll_max_step$16"]]]], "r": [[1.04129e-05, 1.03828e-05, 1.03834e-05, 1.03809e-05, 1.04468e-05, 1.04347e-05, 1.04867e-05, 1.04944e-05, 1.04938e-05, 1.0494e-05], 0, 159.312, 1657365670], "v": "v0.6"}
{"i": [["[\"bert_softmax_reduce_sum\", 1, 128, 12, 64]", "cuda -keys=cuda,gpu -max_num_threads=1024 -model=unknown -thread_warp_size=32", [-1, 16, 64, 49152, 2147483647, 1024, 8, 32], "", 0, []], [[], [["SP", 2, 2, 128, [64], 1], ["AN", 2, 3, 6], ["CI", 1], ["FU", 2, [0, 1]], ["AN", 2, 0, 5], ["PR", 2, 0, "auto_unroll_max_step$16"]]]], "r": [[4.17746e-06, 4.17689e-06, 4.17634e-06, 4.17696e-06, 4.17638e-06, 4.17673e-06, 4.17693e-06, 4.17728e-06, 4.17684e-06, 4.17744e-06], 0, 162.984, 1657365673], "v": "v0.6"}
{"i": [["[\"bert_softmax_reduce_sum\", 1, 128, 12, 64]", "cuda -keys=cuda,gpu -max_num_threads=1024 -model=unknown -thread_warp_size=32", [-1, 16, 64, 49152, 2147483647, 1024, 8, 32], "", 0, []], [[], [["SP", 2, 2, 128, [64], 1], ["AN", 2, 3, 6], ["CI", 1], ["FU", 2, [0, 1]], ["AN", 2, 0, 5], ["PR", 2, 0, "auto_unroll_max_step$64"]]]], "r": [[4.31069e-06, 4.31076e-06, 4.31066e-06, 4.31082e-06, 4.31072e-06, 4.31059e-06, 4.31055e-06, 4.31073e-06, 4.31039e-06, 4.31022e-06], 0, 176.28, 1657365691], "v": "v0.6"}
{"i": [["[\"bert_softmax_reduce_sum\", 1, 128, 12, 64]", "cuda -keys=cuda,gpu -max_num_threads=1024 -model=unknown -thread_warp_size=32", [-1, 16, 64, 49152, 2147483647, 1024, 8, 32], "", 0, []], [[], [["SP", 2, 2, 128, [1], 1], ["AN", 2, 3, 6], ["CI", 1], ["FU", 2, [0, 1]], ["AN", 2, 0, 5], ["PR", 2, 0, "auto_unroll_max_step$0"]]]], "r": [[1.11262e-05, 1.11256e-05, 1.11302e-05, 1.11279e-05, 1.11298e-05, 1.11304e-05, 1.11307e-05, 1.11313e-05, 1.11305e-05, 1.11326e-05], 0, 176.911, 1657365695], "v": "v0.6"}
{"i": [["[\"bert_softmax_reduce_sum\", 1, 128, 12, 64]", "cuda -keys=cuda,gpu -max_num_threads=1024 -model=unknown -thread_warp_size=32", [-1, 16, 64, 49152, 2147483647, 1024, 8, 32], "", 0, []], [[], [["SP", 2, 2, 128, [1], 1], ["AN", 2, 3, 6], ["CI", 1], ["FU", 2, [0, 1]], ["AN", 2, 0, 5], ["PR", 2, 0, "auto_unroll_max_step$16"]]]], "r": [[1.11701e-05, 1.11707e-05, 1.11704e-05, 1.1172e-05, 1.11695e-05, 1.11729e-05, 1.11724e-05, 1.11735e-05, 1.11734e-05, 1.11736e-05], 0, 176.862, 1657365700], "v": "v0.6"}
{"i": [["[\"bert_softmax_reduce_sum\", 1, 128, 12, 64]", "cuda -keys=cuda,gpu -max_num_threads=1024 -model=unknown -thread_warp_size=32", [-1, 16, 64, 49152, 2147483647, 1024, 8, 32], "", 0, []], [[], [["SP", 2, 2, 128, [2], 1], ["AN", 2, 3, 6], ["CI", 1], ["FU", 2, [0, 1]], ["AN", 2, 0, 5], ["PR", 2, 0, "auto_unroll_max_step$1024"]]]], "r": [[7.7187e-06, 7.7188e-06, 7.71915e-06, 7.719e-06, 7.71922e-06, 7.71942e-06, 7.71935e-06, 7.7192e-06, 7.71913e-06, 7.71936e-06], 0, 176.475, 1657365704], "v": "v0.6"}
{"i": [["[\"bert_softmax_reduce_sum\", 1, 128, 12, 64]", "cuda -keys=cuda,gpu -max_num_threads=1024 -model=unknown -thread_warp_size=32", [-1, 16, 64, 49152, 2147483647, 1024, 8, 32], "", 0, []], [[], [["CI", 1], ["FU", 2, [0, 1]], ["SP", 2, 0, 1536, [32], 1], ["AN", 2, 0, 5], ["AN", 2, 1, 6], ["PR", 2, 0, "auto_unroll_max_step$1024"]]]], "r": [[1.17225e-05, 1.17227e-05, 1.17227e-05, 1.17228e-05, 1.17228e-05, 1.17228e-05, 1.17227e-05, 1.17228e-05, 1.17228e-05, 1.17228e-05], 0, 176.556, 1657365709], "v": "v0.6"}
{"i": [["[\"bert_softmax_reduce_sum\", 1, 128, 12, 64]", "cuda -keys=cuda,gpu -max_num_threads=1024 -model=unknown -thread_warp_size=32", [-1, 16, 64, 49152, 2147483647, 1024, 8, 32], "", 0, []], [[], [["CI", 1], ["FU", 2, [0, 1]], ["SP", 2, 0, 1536, [12], 1], ["AN", 2, 0, 5], ["AN", 2, 1, 6], ["PR", 2, 0, "auto_unroll_max_step$64"]]]], "r": [[8.47747e-06, 8.4774e-06, 8.47803e-06, 8.47792e-06, 8.47789e-06, 8.47799e-06, 8.478e-06, 8.47809e-06, 8.47822e-06, 8.47817e-06], 0, 176.198, 1657365713], "v": "v0.6"}
{"i": [["[\"bert_softmax_reduce_sum\", 1, 128, 12, 64]", "cuda -keys=cuda,gpu -max_num_threads=1024 -model=unknown -thread_warp_size=32", [-1, 16, 64, 49152, 2147483647, 1024, 8, 32], "", 0, []], [[], [["SP", 2, 2, 128, [8], 1], ["AN", 2, 3, 6], ["CI", 1], ["FU", 2, [0, 1]], ["AN", 2, 0, 5], ["PR", 2, 0, "auto_unroll_max_step$512"]]]], "r": [[4.26218e-06, 4.26218e-06, 4.26224e-06, 4.26216e-06, 4.26225e-06, 4.26243e-06, 4.26249e-06, 4.26229e-06, 4.26232e-06, 4.26237e-06], 0, 175.439, 1657365717], "v": "v0.6"}
{"i": [["[\"bert_softmax_reduce_sum\", 1, 128, 12, 64]", "cuda -keys=cuda,gpu -max_num_threads=1024 -model=unknown -thread_warp_size=32", [-1, 16, 64, 49152, 2147483647, 1024, 8, 32], "", 0, []], [[], [["SP", 2, 2, 128, [16], 1], ["AN", 2, 3, 6], ["CI", 1], ["FU", 2, [0, 1]], ["AN", 2, 0, 5], ["PR", 2, 0, "auto_unroll_max_step$1024"]]]], "r": [[4.1842e-06, 4.18435e-06, 4.1843e-06, 4.1844e-06, 4.18445e-06, 4.18423e-06, 4.18418e-06, 4.18436e-06, 4.18428e-06, 4.18422e-06], 0, 174.182, 1657365721], "v": "v0.6"}
{"i": [["[\"bert_softmax_reduce_sum\", 1, 128, 12, 64]", "cuda -keys=cuda,gpu -max_num_threads=1024 -model=unknown -thread_warp_size=32", [-1, 16, 64, 49152, 2147483647, 1024, 8, 32], "", 0, []], [[], [["CI", 1], ["FU", 2, [0, 1]], ["SP", 2, 0, 1536, [6], 1], ["AN", 2, 0, 5], ["AN", 2, 1, 6], ["PR", 2, 0, "auto_unroll_max_step$64"]]]], "r": [[8.80598e-06, 8.813e-06, 8.81096e-06, 8.80653e-06, 8.83578e-06, 8.82779e-06, 8.8126e-06, 8.80852e-06, 8.80954e-06, 8.80253e-06], 0, 174.439, 1657365725], "v": "v0.6"}
{"i": [["[\"bert_softmax_reduce_sum\", 1, 128, 12, 64]", "cuda -keys=cuda,gpu -max_num_threads=1024 -model=unknown -thread_warp_size=32", [-1, 16, 64, 49152, 2147483647, 1024, 8, 32], "", 0, []], [[], [["SP", 2, 2, 128, [64], 1], ["AN", 2, 3, 6], ["CI", 1], ["FU", 2, [0, 1]], ["AN", 2, 0, 5], ["PR", 2, 0, "auto_unroll_max_step$512"]]]], "r": [[4.31246e-06, 4.31348e-06, 4.31172e-06, 4.31279e-06, 4.31207e-06, 4.31215e-06, 4.31108e-06, 4.31245e-06, 4.31349e-06, 4.31303e-06], 0, 173.783, 1657365729], "v": "v0.6"}
{"i": [["[\"bert_softmax_reduce_sum\", 1, 128, 12, 64]", "cuda -keys=cuda,gpu -max_num_threads=1024 -model=unknown -thread_warp_size=32", [-1, 16, 64, 49152, 2147483647, 1024, 8, 32], "", 0, []], [[], [["CI", 1], ["FU", 2, [0, 1]], ["SP", 2, 0, 1536, [16], 1], ["AN", 2, 0, 5], ["AN", 2, 1, 6], ["PR", 2, 0, "auto_unroll_max_step$1024"]]]], "r": [[9.31932e-06, 9.32e-06, 9.32025e-06, 9.32006e-06, 9.31955e-06, 9.31948e-06, 9.31936e-06, 9.31931e-06, 9.31913e-06, 9.31906e-06], 0, 173.588, 1657365734], "v": "v0.6"}
{"i": [["[\"bert_softmax_reduce_sum\", 1, 128, 12, 64]", "cuda -keys=cuda,gpu -max_num_threads=1024 -model=unknown -thread_warp_size=32", [-1, 16, 64, 49152, 2147483647, 1024, 8, 32], "", 0, []], [[], [["CI", 1], ["FU", 2, [0, 1]], ["SP", 2, 0, 1536, [64], 1], ["AN", 2, 0, 5], ["AN", 2, 1, 6], ["PR", 2, 0, "auto_unroll_max_step$1024"]]]], "r": [[1.20088e-05, 1.20088e-05, 1.20088e-05, 1.20087e-05, 1.20088e-05, 1.20088e-05, 1.20087e-05, 1.20088e-05, 1.20089e-05, 1.20088e-05], 0, 174.379, 1657365739], "v": "v0.6"}
{"i": [["[\"bert_softmax_reduce_sum\", 1, 128, 12, 64]", "cuda -keys=cuda,gpu -max_num_threads=1024 -model=unknown -thread_warp_size=32", [-1, 16, 64, 49152, 2147483647, 1024, 8, 32], "", 0, []], [[], [["CI", 1], ["FU", 2, [0, 1]], ["SP", 2, 0, 1536, [24], 1], ["AN", 2, 0, 5], ["AN", 2, 1, 6], ["PR", 2, 0, "auto_unroll_max_step$1024"]]]], "r": [[1.06731e-05, 1.06734e-05, 1.06735e-05, 1.06736e-05, 1.06735e-05, 1.06735e-05, 1.06737e-05, 1.06735e-05, 1.06732e-05, 1.06732e-05], 0, 174.004, 1657365743], "v": "v0.6"}
{"i": [["[\"bert_softmax_reduce_sum\", 1, 128, 12, 64]", "cuda -keys=cuda,gpu -max_num_threads=1024 -model=unknown -thread_warp_size=32", [-1, 16, 64, 49152, 2147483647, 1024, 8, 32], "", 0, []], [[], [["SP", 2, 2, 128, [16], 1], ["AN", 2, 3, 6], ["CI", 1], ["FU", 2, [0, 1]], ["AN", 2, 0, 5], ["PR", 2, 0, "auto_unroll_max_step$512"]]]], "r": [[4.25368e-06, 4.25272e-06, 4.2543e-06, 4.25312e-06, 4.25457e-06, 4.25429e-06, 4.25378e-06, 4.2518e-06, 4.2532e-06, 4.25307e-06], 0, 173.805, 1657365747], "v": "v0.6"}
{"i": [["[\"bert_softmax_reduce_sum\", 1, 128, 12, 64]", "cuda -keys=cuda,gpu -max_num_threads=1024 -model=unknown -thread_warp_size=32", [-1, 16, 64, 49152, 2147483647, 1024, 8, 32], "", 0, []], [[], [["CI", 1], ["FU", 2, [0, 1]], ["SP", 2, 0, 1536, [12], 1], ["AN", 2, 0, 5], ["AN", 2, 1, 6], ["PR", 2, 0, "auto_unroll_max_step$1024"]]]], "r": [[8.75452e-06, 8.75542e-06, 8.757e-06, 8.75563e-06, 8.75533e-06, 8.75501e-06, 8.75552e-06, 8.75597e-06, 8.75607e-06, 8.75573e-06], 0, 173.947, 1657365752], "v": "v0.6"}
{"i": [["[\"bert_softmax_reduce_sum\", 1, 128, 12, 64]", "cuda -keys=cuda,gpu -max_num_threads=1024 -model=unknown -thread_warp_size=32", [-1, 16, 64, 49152, 2147483647, 1024, 8, 32], "", 0, []], [[], [["CI", 1], ["FU", 2, [0, 1]], ["SP", 2, 0, 1536, [8], 1], ["AN", 2, 0, 5], ["AN", 2, 1, 6], ["PR", 2, 0, "auto_unroll_max_step$16"]]]], "r": [[8.02511e-06, 8.02685e-06, 8.02806e-06, 8.02958e-06, 8.02836e-06, 8.02693e-06, 8.02705e-06, 8.02746e-06, 8.02778e-06, 8.02619e-06], 0, 174.614, 1657365756], "v": "v0.6"}
{"i": [["[\"bert_softmax_reduce_sum\", 1, 128, 12, 64]", "cuda -keys=cuda,gpu -max_num_threads=1024 -model=unknown -thread_warp_size=32", [-1, 16, 64, 49152, 2147483647, 1024, 8, 32], "", 0, []], [[], [["CI", 1], ["FU", 2, [0, 1]], ["SP", 2, 0, 1536, [12], 1], ["AN", 2, 0, 5], ["AN", 2, 1, 6], ["PR", 2, 0, "auto_unroll_max_step$0"]]]], "r": [[8.53572e-06, 8.53588e-06, 8.53602e-06, 8.53613e-06, 8.53663e-06, 8.53609e-06, 8.53606e-06, 8.53605e-06, 8.53606e-06, 8.5362e-06], 0, 174.79, 1657365761], "v": "v0.6"}
{"i": [["[\"bert_softmax_reduce_sum\", 1, 128, 12, 64]", "cuda -keys=cuda,gpu -max_num_threads=1024 -model=unknown -thread_warp_size=32", [-1, 16, 64, 49152, 2147483647, 1024, 8, 32], "", 0, []], [[], [["CI", 1], ["FU", 2, [0, 1]], ["SP", 2, 0, 1536, [24], 1], ["AN", 2, 0, 5], ["AN", 2, 1, 6], ["PR", 2, 0, "auto_unroll_max_step$512"]]]], "r": [[1.0433e-05, 1.04324e-05, 1.04325e-05, 1.04332e-05, 1.04334e-05, 1.04328e-05, 1.04326e-05, 1.04326e-05, 1.04332e-05, 1.04334e-05], 0, 174.552, 1657365765], "v": "v0.6"}
{"i": [["[\"bert_softmax_reduce_sum\", 1, 128, 12, 64]", "cuda -keys=cuda,gpu -max_num_threads=1024 -model=unknown -thread_warp_size=32", [-1, 16, 64, 49152, 2147483647, 1024, 8, 32], "", 0, []], [[], [["CI", 1], ["FU", 2, [0, 1]], ["SP", 2, 0, 1536, [8], 1], ["AN", 2, 0, 5], ["AN", 2, 1, 6], ["PR", 2, 0, "auto_unroll_max_step$1024"]]]], "r": [[8.17344e-06, 8.17344e-06, 8.1746e-06, 8.1752e-06, 8.17241e-06, 8.17315e-06, 8.17483e-06, 8.17443e-06, 8.17308e-06, 8.1748e-06], 0, 174.698, 1657365770], "v": "v0.6"}
{"i": [["[\"bert_softmax_reduce_sum\", 1, 128, 12, 64]", "cuda -keys=cuda,gpu -max_num_threads=1024 -model=unknown -thread_warp_size=32", [-1, 16, 64, 49152, 2147483647, 1024, 8, 32], "", 0, []], [[], [["CI", 1], ["FU", 2, [0, 1]], ["SP", 2, 0, 1536, [2], 1], ["AN", 2, 0, 5], ["AN", 2, 1, 6], ["PR", 2, 0, "auto_unroll_max_step$64"]]]], "r": [[1.33563e-05, 1.33533e-05, 1.3357e-05, 1.3353e-05, 1.33501e-05, 1.33512e-05, 1.33523e-05, 1.33529e-05, 1.33552e-05, 1.33534e-05], 0, 174.794, 1657365775], "v": "v0.6"}
{"i": [["[\"bert_softmax_reduce_sum\", 1, 128, 12, 64]", "cuda -keys=cuda,gpu -max_num_threads=1024 -model=unknown -thread_warp_size=32", [-1, 16, 64, 49152, 2147483647, 1024, 8, 32], "", 0, []], [[], [["SP", 2, 2, 128, [4], 1], ["AN", 2, 3, 6], ["CI", 1], ["FU", 2, [0, 1]], ["AN", 2, 0, 5], ["PR", 2, 0, "auto_unroll_max_step$64"]]]], "r": [[5.97922e-06, 5.98095e-06, 5.97933e-06, 5.97818e-06, 5.98109e-06, 5.98044e-06, 5.97946e-06, 5.98053e-06, 5.97907e-06, 5.97933e-06], 0, 175.082, 1657365779], "v": "v0.6"}
{"i": [["[\"bert_softmax_reduce_sum\", 1, 128, 12, 64]", "cuda -keys=cuda,gpu -max_num_threads=1024 -model=unknown -thread_warp_size=32", [-1, 16, 64, 49152, 2147483647, 1024, 8, 32], "", 0, []], [[], [["CI", 1], ["FU", 2, [0, 1]], ["SP", 2, 0, 1536, [32], 1], ["AN", 2, 0, 5], ["AN", 2, 1, 6], ["PR", 2, 0, "auto_unroll_max_step$64"]]]], "r": [[1.17028e-05, 1.17029e-05, 1.17028e-05, 1.17028e-05, 1.17028e-05, 1.17029e-05, 1.1703e-05, 1.17028e-05, 1.17029e-05, 1.17028e-05], 0, 175.994, 1657365783], "v": "v0.6"}
{"i": [["[\"bert_softmax_reduce_sum\", 1, 128, 12, 64]", "cuda -keys=cuda,gpu -max_num_threads=1024 -model=unknown -thread_warp_size=32", [-1, 16, 64, 49152, 2147483647, 1024, 8, 32], "", 0, []], [[], [["CI", 1], ["FU", 2, [0, 1]], ["SP", 2, 0, 1536, [32], 1], ["AN", 2, 0, 5], ["AN", 2, 1, 6], ["PR", 2, 0, "auto_unroll_max_step$0"]]]], "r": [[1.17034e-05, 1.17284e-05, 1.17349e-05, 1.17382e-05, 1.17382e-05, 1.17402e-05, 1.17259e-05, 1.17382e-05, 1.17387e-05, 1.17397e-05], 0, 176.667, 1657365788], "v": "v0.6"}
{"i": [["[\"bert_softmax_reduce_sum\", 1, 128, 12, 64]", "cuda -keys=cuda,gpu -max_num_threads=1024 -model=unknown -thread_warp_size=32", [-1, 16, 64, 49152, 2147483647, 1024, 8, 32], "", 0, []], [[], [["CI", 1], ["FU", 2, [0, 1]], ["SP", 2, 0, 1536, [6], 1], ["AN", 2, 0, 5], ["AN", 2, 1, 6], ["PR", 2, 0, "auto_unroll_max_step$16"]]]], "r": [[8.71644e-06, 8.7149e-06, 8.71549e-06, 8.71986e-06, 8.72189e-06, 8.73577e-06, 8.71973e-06, 8.73586e-06, 8.71542e-06, 8.72196e-06], 0, 176.587, 1657365793], "v": "v0.6"}
{"i": [["[\"bert_softmax_reduce_sum\", 1, 128, 12, 64]", "cuda -keys=cuda,gpu -max_num_threads=1024 -model=unknown -thread_warp_size=32", [-1, 16, 64, 49152, 2147483647, 1024, 8, 32], "", 0, []], [[], [["CI", 1], ["FU", 2, [0, 1]], ["SP", 2, 0, 1536, [32], 1], ["AN", 2, 0, 5], ["AN", 2, 1, 6], ["PR", 2, 0, "auto_unroll_max_step$512"]]]], "r": [[1.19004e-05, 1.19011e-05, 1.19005e-05, 1.19012e-05, 1.19006e-05, 1.19003e-05, 1.19001e-05, 1.18995e-05, 1.19004e-05, 1.19001e-05], 0, 37.5819, 1657365835], "v": "v0.6"}
{"i": [["[\"bert_softmax_reduce_sum\", 1, 128, 12, 64]", "cuda -keys=cuda,gpu -max_num_threads=1024 -model=unknown -thread_warp_size=32", [-1, 16, 64, 49152, 2147483647, 1024, 8, 32], "", 0, []], [[], [["CI", 1], ["FU", 2, [0, 1]], ["SP", 2, 0, 1536, [16], 1], ["AN", 2, 0, 5], ["AN", 2, 1, 6], ["PR", 2, 0, "auto_unroll_max_step$16"]]]], "r": [[9.29006e-06, 9.28978e-06, 9.29008e-06, 9.29001e-06, 9.28998e-06, 9.29009e-06, 9.28998e-06, 9.29055e-06, 9.29016e-06, 9.29006e-06], 0, 28.1817, 1657365825], "v": "v0.6"}
{"i": [["[\"bert_softmax_reduce_sum\", 1, 128, 12, 64]", "cuda -keys=cuda,gpu -max_num_threads=1024 -model=unknown -thread_warp_size=32", [-1, 16, 64, 49152, 2147483647, 1024, 8, 32], "", 0, []], [[], [["CI", 1], ["FU", 2, [0, 1]], ["SP", 2, 0, 1536, [48], 1], ["AN", 2, 0, 5], ["AN", 2, 1, 6], ["PR", 2, 0, "auto_unroll_max_step$1024"]]]], "r": [[1.20714e-05, 1.20714e-05, 1.20714e-05, 1.20714e-05, 1.20717e-05, 1.20718e-05, 1.20712e-05, 1.20714e-05, 1.20712e-05, 1.20714e-05], 0, 23.6087, 1657365820], "v": "v0.6"}
{"i": [["[\"bert_softmax_reduce_sum\", 1, 128, 12, 64]", "cuda -keys=cuda,gpu -max_num_threads=1024 -model=unknown -thread_warp_size=32", [-1, 16, 64, 49152, 2147483647, 1024, 8, 32], "", 0, []], [[], [["CI", 1], ["FU", 2, [0, 1]], ["SP", 2, 0, 1536, [1], 1], ["AN", 2, 0, 5], ["AN", 2, 1, 6], ["PR", 2, 0, "auto_unroll_max_step$1024"]]]], "r": [[2.19817e-05, 2.19876e-05, 2.1984e-05, 2.19872e-05, 2.19879e-05, 2.19884e-05, 2.19852e-05, 2.19888e-05, 2.19887e-05, 2.19866e-05], 0, 9.40149, 1657365806], "v": "v0.6"}
{"i": [["[\"bert_softmax_reduce_sum\", 1, 128, 12, 64]", "cuda -keys=cuda,gpu -max_num_threads=1024 -model=unknown -thread_warp_size=32", [-1, 16, 64, 49152, 2147483647, 1024, 8, 32], "", 0, []], [[], [["SP", 2, 2, 128, [1], 1], ["AN", 2, 3, 6], ["CI", 1], ["FU", 2, [0, 1]], ["AN", 2, 0, 5], ["PR", 2, 0, "auto_unroll_max_step$512"]]]], "r": [[1.12689e-05, 1.12731e-05, 1.12655e-05, 1.12662e-05, 1.12642e-05, 1.1264e-05, 1.12656e-05, 1.12661e-05, 1.12676e-05, 1.12666e-05], 0, 18.8763, 1657365816], "v": "v0.6"}
{"i": [["[\"bert_softmax_reduce_sum\", 1, 128, 12, 64]", "cuda -keys=cuda,gpu -max_num_threads=1024 -model=unknown -thread_warp_size=32", [-1, 16, 64, 49152, 2147483647, 1024, 8, 32], "", 0, []], [[], [["CI", 1], ["FU", 2, [0, 1]], ["SP", 2, 0, 1536, [48], 1], ["AN", 2, 0, 5], ["AN", 2, 1, 6], ["PR", 2, 0, "auto_unroll_max_step$0"]]]], "r": [[1.20772e-05, 1.20767e-05, 1.20749e-05, 1.20756e-05, 1.2075e-05, 1.20848e-05, 1.20841e-05, 1.20843e-05, 1.20795e-05, 1.20789e-05], 0, 32.9002, 1657365830], "v": "v0.6"}
{"i": [["[\"bert_softmax_reduce_sum\", 1, 128, 12, 64]", "cuda -keys=cuda,gpu -max_num_threads=1024 -model=unknown -thread_warp_size=32", [-1, 16, 64, 49152, 2147483647, 1024, 8, 32], "", 0, []], [[], [["CI", 1], ["FU", 2, [0, 1]], ["SP", 2, 0, 1536, [48], 1], ["AN", 2, 0, 5], ["AN", 2, 1, 6], ["PR", 2, 0, "auto_unroll_max_step$16"]]]], "r": [[1.2128e-05, 1.21319e-05, 1.21322e-05, 1.21304e-05, 1.21313e-05, 1.21262e-05, 1.21311e-05, 1.21292e-05, 1.21316e-05, 1.21333e-05], 0, 14.2711, 1657365811], "v": "v0.6"}
{"i": [["[\"bert_softmax_reduce_sum\", 1, 128, 12, 64]", "cuda -keys=cuda,gpu -max_num_threads=1024 -model=unknown -thread_warp_size=32", [-1, 16, 64, 49152, 2147483647, 1024, 8, 32], "", 0, []], [[], [["SP", 2, 2, 128, [16], 1], ["AN", 2, 3, 6], ["CI", 1], ["FU", 2, [0, 1]], ["AN", 2, 0, 5], ["PR", 2, 0, "auto_unroll_max_step$0"]]]], "r": [[4.20488e-06, 4.20544e-06, 4.20555e-06, 4.20496e-06, 4.2049e-06, 4.20493e-06, 4.20479e-06, 4.20441e-06, 4.20468e-06, 4.20463e-06], 0, 4.65753, 1657365801], "v": "v0.6"}
{"i": [["[\"bert_softmax_reduce_sum\", 1, 128, 12, 64]", "cuda -keys=cuda,gpu -max_num_threads=1024 -model=unknown -thread_warp_size=32", [-1, 16, 64, 49152, 2147483647, 1024, 8, 32], "", 0, []], [[], [["CI", 1], ["FU", 2, [0, 1]], ["SP", 2, 0, 1536, [3], 1], ["AN", 2, 0, 5], ["AN", 2, 1, 6], ["PR", 2, 0, "auto_unroll_max_step$64"]]]], "r": [[1.19788e-05, 1.19807e-05, 1.19815e-05, 1.19787e-05, 1.19805e-05, 1.19801e-05, 1.19824e-05, 1.19794e-05, 1.19787e-05, 1.19799e-05], 0, 42.426, 1657365839], "v": "v0.6"}
{"i": [["[\"bert_softmax_reduce_sum\", 1, 128, 12, 64]", "cuda -keys=cuda,gpu -max_num_threads=1024 -model=unknown -thread_warp_size=32", [-1, 16, 64, 49152, 2147483647, 1024, 8, 32], "", 0, []], [[], [["CI", 1], ["FU", 2, [0, 1]], ["SP", 2, 0, 1536, [3], 1], ["AN", 2, 0, 5], ["AN", 2, 1, 6], ["PR", 2, 0, "auto_unroll_max_step$1024"]]]], "r": [[1.20506e-05, 1.20508e-05, 1.20515e-05, 1.20468e-05, 1.20515e-05, 1.20506e-05, 1.20512e-05, 1.20517e-05, 1.20532e-05, 1.20548e-05], 0, 60.1496, 1657365857], "v": "v0.6"}
{"i": [["[\"bert_softmax_reduce_sum\", 1, 128, 12, 64]", "cuda -keys=cuda,gpu -max_num_threads=1024 -model=unknown -thread_warp_size=32", [-1, 16, 64, 49152, 2147483647, 1024, 8, 32], "", 0, []], [[], [["CI", 1], ["FU", 2, [0, 1]], ["SP", 2, 0, 1536, [64], 1], ["AN", 2, 0, 5], ["AN", 2, 1, 6], ["PR", 2, 0, "auto_unroll_max_step$64"]]]], "r": [[1.21858e-05, 1.21842e-05, 1.21845e-05, 1.21841e-05, 1.21844e-05, 1.21847e-05, 1.21844e-05, 1.21843e-05, 1.21844e-05, 1.21844e-05], 0, 47.1755, 1657365844], "v": "v0.6"}
{"i": [["[\"bert_softmax_reduce_sum\", 1, 128, 12, 64]", "cuda -keys=cuda,gpu -max_num_threads=1024 -model=unknown -thread_warp_size=32", [-1, 16, 64, 49152, 2147483647, 1024, 8, 32], "", 0, []], [[], [["SP", 2, 2, 128, [32], 1], ["AN", 2, 3, 6], ["CI", 1], ["FU", 2, [0, 1]], ["AN", 2, 0, 5], ["PR", 2, 0, "auto_unroll_max_step$1024"]]]], "r": [[3.95919e-06, 3.95914e-06, 3.9591e-06, 3.95931e-06, 3.95928e-06, 3.95928e-06, 3.95928e-06, 3.95934e-06, 3.9594e-06, 3.9593e-06], 0, 50.783, 1657365848], "v": "v0.6"}
{"i": [["[\"bert_softmax_reduce_sum\", 1, 128, 12, 64]", "cuda -keys=cuda,gpu -max_num_threads=1024 -model=unknown -thread_warp_size=32", [-1, 16, 64, 49152, 2147483647, 1024, 8, 32], "", 0, []], [[], [["CI", 1], ["FU", 2, [0, 1]], ["SP", 2, 0, 1536, [4], 1], ["AN", 2, 0, 5], ["AN", 2, 1, 6], ["PR", 2, 0, "auto_unroll_max_step$0"]]]], "r": [[1.06514e-05, 1.0647e-05, 1.06442e-05, 1.06493e-05, 1.06562e-05, 1.06581e-05, 1.06535e-05, 1.06431e-05, 1.06483e-05, 1.06483e-05], 0, 55.4298, 1657365852], "v": "v0.6"}
{"i": [["[\"bert_softmax_reduce_sum\", 1, 128, 12, 64]", "cuda -keys=cuda,gpu -max_num_threads=1024 -model=unknown -thread_warp_size=32", [-1, 16, 64, 49152, 2147483647, 1024, 8, 32], "", 0, []], [[], [["SP", 2, 2, 128, [1], 1], ["AN", 2, 3, 6], ["CI", 1], ["FU", 2, [0, 1]], ["AN", 2, 0, 5], ["PR", 2, 0, "auto_unroll_max_step$1024"]]]], "r": [[1.11316e-05, 1.1129e-05, 1.11303e-05, 1.11326e-05, 1.1132e-05, 1.11286e-05, 1.11288e-05, 1.11294e-05, 1.11322e-05, 1.11298e-05], 0, 86.9265, 1657365884], "v": "v0.6"}
{"i": [["[\"bert_softmax_reduce_sum\", 1, 128, 12, 64]", "cuda -keys=cuda,gpu -max_num_threads=1024 -model=unknown -thread_warp_size=32", [-1, 16, 64, 49152, 2147483647, 1024, 8, 32], "", 0, []], [[], [["CI", 1], ["FU", 2, [0, 1]], ["SP", 2, 0, 1536, [1], 1], ["AN", 2, 0, 5], ["AN", 2, 1, 6], ["PR", 2, 0, "auto_unroll_max_step$64"]]]], "r": [[2.18951e-05, 2.18943e-05, 2.18969e-05, 2.18993e-05, 2.18945e-05, 2.18941e-05, 2.18982e-05, 2.1899e-05, 2.19005e-05, 2.18993e-05], 0, 105.541, 1657365903], "v": "v0.6"}
{"i": [["[\"bert_softmax_reduce_sum\", 1, 128, 12, 64]", "cuda -keys=cuda,gpu -max_num_threads=1024 -model=unknown -thread_warp_size=32", [-1, 16, 64, 49152, 2147483647, 1024, 8, 32], "", 0, []], [[], [["CI", 1], ["FU", 2, [0, 1]], ["SP", 2, 0, 1536, [8], 1], ["AN", 2, 0, 5], ["AN", 2, 1, 6], ["PR", 2, 0, "auto_unroll_max_step$512"]]]], "r": [[8.03496e-06, 8.03437e-06, 8.03625e-06, 8.03876e-06, 8.03491e-06, 8.03351e-06, 8.0339e-06, 8.03301e-06, 8.03886e-06, 8.04463e-06], 0, 100.527, 1657365898], "v": "v0.6"}
{"i": [["[\"bert_softmax_reduce_sum\", 1, 128, 12, 64]", "cuda -keys=cuda,gpu -max_num_threads=1024 -model=unknown -thread_warp_size=32", [-1, 16, 64, 49152, 2147483647, 1024, 8, 32], "", 0, []], [[], [["SP", 2, 2, 128, [2], 1], ["AN", 2, 3, 6], ["CI", 1], ["FU", 2, [0, 1]], ["AN", 2, 0, 5], ["PR", 2, 0, "auto_unroll_max_step$64"]]]], "r": [[7.7181e-06, 7.71852e-06, 7.7171e-06, 7.71831e-06, 7.71731e-06, 7.71671e-06, 7.71721e-06, 7.71612e-06, 7.71692e-06, 7.71639e-06], 0, 119.164, 1657365916], "v": "v0.6"}
{"i": [["[\"bert_softmax_reduce_sum\", 1, 128, 12, 64]", "cuda -keys=cuda,gpu -max_num_threads=1024 -model=unknown -thread_warp_size=32", [-1, 16, 64, 49152, 2147483647, 1024, 8, 32], "", 0, []], [[], [["CI", 1], ["FU", 2, [0, 1]], ["SP", 2, 0, 1536, [8], 1], ["AN", 2, 0, 5], ["AN", 2, 1, 6], ["PR", 2, 0, "auto_unroll_max_step$0"]]]], "r": [[7.979e-06, 7.97615e-06, 7.97754e-06, 7.98034e-06, 7.98192e-06, 7.97835e-06, 7.97864e-06, 7.98073e-06, 7.97926e-06, 7.97793e-06], 0, 96.0681, 1657365893], "v": "v0.6"}
{"i": [["[\"bert_softmax_reduce_sum\", 1, 128, 12, 64]", "cuda -keys=cuda,gpu -max_num_threads=1024 -model=unknown -thread_warp_size=32", [-1, 16, 64, 49152, 2147483647, 1024, 8, 32], "", 0, []], [[], [["SP", 2, 2, 128, [16], 1], ["AN", 2, 3, 6], ["CI", 1], ["FU", 2, [0, 1]], ["AN", 2, 0, 5], ["PR", 2, 0, "auto_unroll_max_step$64"]]]], "r": [[4.40587e-06, 4.40581e-06, 4.40583e-06, 4.40609e-06, 4.40616e-06, 4.40617e-06, 4.40622e-06, 4.40607e-06, 4.40591e-06, 4.40587e-06], 0, 78.0307, 1657365875], "v": "v0.6"}
{"i": [["[\"bert_softmax_reduce_sum\", 1, 128, 12, 64]", "cuda -keys=cuda,gpu -max_num_threads=1024 -model=unknown -thread_warp_size=32", [-1, 16, 64, 49152, 2147483647, 1024, 8, 32], "", 0, []], [[], [["CI", 1], ["FU", 2, [0, 1]], ["SP", 2, 0, 1536, [2], 1], ["AN", 2, 0, 5], ["AN", 2, 1, 6], ["PR", 2, 0, "auto_unroll_max_step$512"]]]], "r": [[1.34443e-05, 1.34434e-05, 1.34437e-05, 1.34442e-05, 1.34421e-05, 1.34465e-05, 1.34414e-05, 1.34481e-05, 1.34416e-05, 1.34455e-05], 0, 127.709, 1657365925], "v": "v0.6"}
{"i": [["[\"bert_softmax_reduce_sum\", 1, 128, 12, 64]", "cuda -keys=cuda,gpu -max_num_threads=1024 -model=unknown -thread_warp_size=32", [-1, 16, 64, 49152, 2147483647, 1024, 8, 32], "", 0, []], [[], [["SP", 2, 2, 128, [4], 1], ["AN", 2, 3, 6], ["CI", 1], ["FU", 2, [0, 1]], ["AN", 2, 0, 5], ["PR", 2, 0, "auto_unroll_max_step$16"]]]], "r": [[5.98388e-06, 5.98285e-06, 5.98203e-06, 5.9824e-06, 5.98238e-06, 5.98216e-06, 5.98432e-06, 5.98367e-06, 5.98319e-06, 5.98295e-06], 0, 82.2428, 1657365879], "v": "v0.6"}
{"i": [["[\"bert_softmax_reduce_sum\", 1, 128, 12, 64]", "cuda -keys=cuda,gpu -max_num_threads=1024 -model=unknown -thread_warp_size=32", [-1, 16, 64, 49152, 2147483647, 1024, 8, 32], "", 0, []], [[], [["CI", 1], ["FU", 2, [0, 1]], ["SP", 2, 0, 1536, [16], 1], ["AN", 2, 0, 5], ["AN", 2, 1, 6], ["PR", 2, 0, "auto_unroll_max_step$0"]]]], "r": [[9.09482e-06, 9.09509e-06, 9.09512e-06, 9.09514e-06, 9.09523e-06, 9.09506e-06, 9.09505e-06, 9.09506e-06, 9.09518e-06, 9.0952e-06], 0, 110.046, 1657365907], "v": "v0.6"}
{"i": [["[\"bert_softmax_reduce_sum\", 1, 128, 12, 64]", "cuda -keys=cuda,gpu -max_num_threads=1024 -model=unknown -thread_warp_size=32", [-1, 16, 64, 49152, 2147483647, 1024, 8, 32], "", 0, []], [[], [["CI", 1], ["FU", 2, [0, 1]], ["SP", 2, 0, 1536, [3], 1], ["AN", 2, 0, 5], ["AN", 2, 1, 6], ["PR", 2, 0, "auto_unroll_max_step$512"]]]], "r": [[1.20687e-05, 1.20719e-05, 1.20698e-05, 1.20678e-05, 1.20684e-05, 1.20699e-05, 1.20659e-05, 1.20682e-05, 1.2069e-05, 1.20689e-05], 0, 64.8218, 1657365862], "v": "v0.6"}
{"i": [["[\"bert_softmax_reduce_sum\", 1, 128, 12, 64]", "cuda -keys=cuda,gpu -max_num_threads=1024 -model=unknown -thread_warp_size=32", [-1, 16, 64, 49152, 2147483647, 1024, 8, 32], "", 0, []], [[], [["CI", 1], ["FU", 2, [0, 1]], ["SP", 2, 0, 1536, [64], 1], ["AN", 2, 0, 5], ["AN", 2, 1, 6], ["PR", 2, 0, "auto_unroll_max_step$0"]]]], "r": [[1.20341e-05, 1.20342e-05, 1.20341e-05, 1.20341e-05, 1.20343e-05, 1.20342e-05, 1.2034e-05, 1.20343e-05, 1.20344e-05, 1.20342e-05], 0, 69.6643, 1657365867], "v": "v0.6"}
{"i": [["[\"bert_softmax_reduce_sum\", 1, 128, 12, 64]", "cuda -keys=cuda,gpu -max_num_threads=1024 -model=unknown -thread_warp_size=32", [-1, 16, 64, 49152, 2147483647, 1024, 8, 32], "", 0, []], [[], [["CI", 1], ["FU", 2, [0, 1]], ["SP", 2, 0, 1536, [3], 1], ["AN", 2, 0, 5], ["AN", 2, 1, 6], ["PR", 2, 0, "auto_unroll_max_step$0"]]]], "r": [[1.19663e-05, 1.19634e-05, 1.1966e-05, 1.19657e-05, 1.19674e-05, 1.19658e-05, 1.19688e-05, 1.19667e-05, 1.19669e-05, 1.19654e-05], 0, 91.5584, 1657365889], "v": "v0.6"}
{"i": [["[\"bert_softmax_reduce_sum\", 1, 128, 12, 64]", "cuda -keys=cuda,gpu -max_num_threads=1024 -model=unknown -thread_warp_size=32", [-1, 16, 64, 49152, 2147483647, 1024, 8, 32], "", 0, []], [[], [["SP", 2, 2, 128, [16], 1], ["AN", 2, 3, 6], ["CI", 1], ["FU", 2, [0, 1]], ["AN", 2, 0, 5], ["PR", 2, 0, "auto_unroll_max_step$16"]]]], "r": [[4.19368e-06, 4.19468e-06, 4.19358e-06, 4.19427e-06, 4.19389e-06, 4.19298e-06, 4.19297e-06, 4.19348e-06, 4.19336e-06, 4.19433e-06], 0, 122.912, 1657365920], "v": "v0.6"}
{"i": [["[\"bert_softmax_reduce_sum\", 1, 128, 12, 64]", "cuda -keys=cuda,gpu -max_num_threads=1024 -model=unknown -thread_warp_size=32", [-1, 16, 64, 49152, 2147483647, 1024, 8, 32], "", 0, []], [[], [["CI", 1], ["FU", 2, [0, 1]], ["SP", 2, 0, 1536, [48], 1], ["AN", 2, 0, 5], ["AN", 2, 1, 6], ["PR", 2, 0, "auto_unroll_max_step$64"]]]], "r": [[1.22685e-05, 1.22578e-05, 1.22553e-05, 1.22499e-05, 1.22645e-05, 1.22604e-05, 1.2264e-05, 1.22644e-05, 1.22612e-05, 1.22568e-05], 0, 114.824, 1657365912], "v": "v0.6"}
{"i": [["[\"bert_softmax_reduce_sum\", 1, 128, 12, 64]", "cuda -keys=cuda,gpu -max_num_threads=1024 -model=unknown -thread_warp_size=32", [-1, 16, 64, 49152, 2147483647, 1024, 8, 32], "", 0, []], [[], [["CI", 1], ["FU", 2, [0, 1]], ["SP", 2, 0, 1536, [4], 1], ["AN", 2, 0, 5], ["AN", 2, 1, 6], ["PR", 2, 0, "auto_unroll_max_step$512"]]]], "r": [[1.04952e-05, 1.04858e-05, 1.04944e-05, 1.0501e-05, 1.05035e-05, 1.05056e-05, 1.05083e-05, 1.04928e-05, 1.05093e-05, 1.05156e-05], 0, 136.175, 1657365933], "v": "v0.6"}
{"i": [["[\"bert_softmax_reduce_sum\", 1, 128, 12, 64]", "cuda -keys=cuda,gpu -max_num_threads=1024 -model=unknown -thread_warp_size=32", [-1, 16, 64, 49152, 2147483647, 1024, 8, 32], "", 0, []], [[], [["SP", 2, 2, 128, [64], 1], ["AN", 2, 3, 6], ["CI", 1], ["FU", 2, [0, 1]], ["AN", 2, 0, 5], ["PR", 2, 0, "auto_unroll_max_step$0"]]]], "r": [[4.21968e-06, 4.21996e-06, 4.22001e-06, 4.22001e-06, 4.21996e-06, 4.21992e-06, 4.22011e-06, 4.21988e-06, 4.2199e-06, 4.22006e-06], 0, 131.52, 1657365929], "v": "v0.6"}
{"i": [["[\"bert_softmax_reduce_sum\", 1, 128, 12, 64]", "cuda -keys=cuda,gpu -max_num_threads=1024 -model=unknown -thread_warp_size=32", [-1, 16, 64, 49152, 2147483647, 1024, 8, 32], "", 0, []], [[], [["CI", 1], ["FU", 2, [0, 1]], ["SP", 2, 0, 1536, [8], 1], ["AN", 2, 0, 5], ["AN", 2, 1, 6], ["PR", 2, 0, "auto_unroll_max_step$64"]]]], "r": [[8.02588e-06, 8.03428e-06, 8.037e-06, 8.03781e-06, 8.03699e-06, 8.02992e-06, 8.03367e-06, 8.02435e-06, 8.03516e-06, 8.03362e-06], 0, 74.0841, 1657365871], "v": "v0.6"}
{"i": [["[\"bert_softmax_reduce_sum\", 1, 128, 12, 64]", "cuda -keys=cuda,gpu -max_num_threads=1024 -model=unknown -thread_warp_size=32", [-1, 16, 64, 49152, 2147483647, 1024, 8, 32], "", 0, []], [[], [["CI", 1], ["FU", 2, [0, 1]], ["SP", 2, 0, 1536, [64], 1], ["AN", 2, 0, 5], ["AN", 2, 1, 6], ["PR", 2, 0, "auto_unroll_max_step$16"]]]], "r": [[1.226e-05, 1.22604e-05, 1.22489e-05, 1.22635e-05, 1.22613e-05, 1.22531e-05, 1.22595e-05, 1.2256e-05, 1.22666e-05, 1.2268e-05], 0, 140.869, 1657365938], "v": "v0.6"}
