python/models/bert/kernel_configs/bert_cuda_core_te_transpose_tune_12_384_64.log
{"i": [["[\"te_transpose\", 12, 384, 64]", "cuda -keys=cuda,gpu -max_num_threads=1024 -model=unknown -thread_warp_size=32", [-1, 16, 64, 49152, 2147483647, 1024, 8, 32], "", 0, []], [[], [["FU", 1, [0, 1, 2]], ["SP", 1, 0, 294912, [3], 1], ["AN", 1, 0, 5], ["AN", 1, 1, 6]]]], "r": [[7.55012e-05, 7.55132e-05, 7.55162e-05], 0, 0.924038, 1662156007], "v": "v0.6"}
{"i": [["[\"te_transpose\", 12, 384, 64]", "cuda -keys=cuda,gpu -max_num_threads=1024 -model=unknown -thread_warp_size=32", [-1, 16, 64, 49152, 2147483647, 1024, 8, 32], "", 0, []], [[], [["FU", 1, [0, 1, 2]], ["SP", 1, 0, 294912, [1], 1], ["AN", 1, 0, 5], ["AN", 1, 1, 6]]]], "r": [[0.000221305, 0.000221324, 0.000221309], 0, 2.17423, 1662156008], "v": "v0.6"}
{"i": [["[\"te_transpose\", 12, 384, 64]", "cuda -keys=cuda,gpu -max_num_threads=1024 -model=unknown -thread_warp_size=32", [-1, 16, 64, 49152, 2147483647, 1024, 8, 32], "", 0, []], [[], [["FU", 1, [0, 1, 2]], ["SP", 1, 0, 294912, [36], 1], ["AN", 1, 0, 5], ["AN", 1, 1, 6]]]], "r": [[8.6293e-06, 8.62905e-06, 8.63204e-06], 0, 7.30179, 1662156013], "v": "v0.6"}
{"i": [["[\"te_transpose\", 12, 384, 64]", "cuda -keys=cuda,gpu -max_num_threads=1024 -model=unknown -thread_warp_size=32", [-1, 16, 64, 49152, 2147483647, 1024, 8, 32], "", 0, []], [[], [["FU", 1, [0, 1, 2]], ["SP", 1, 0, 294912, [2], 1], ["AN", 1, 0, 5], ["AN", 1, 1, 6]]]], "r": [[0.000111917, 0.000111937, 0.000111925], 0, 4.72938, 1662156011], "v": "v0.6"}
{"i": [["[\"te_transpose\", 12, 384, 64]", "cuda -keys=cuda,gpu -max_num_threads=1024 -model=unknown -thread_warp_size=32", [-1, 16, 64, 49152, 2147483647, 1024, 8, 32], "", 0, []], [[], [["FU", 1, [0, 1, 2]], ["SP", 1, 0, 294912, [18], 1], ["AN", 1, 0, 5], ["AN", 1, 1, 6]]]], "r": [[1.48831e-05, 1.48979e-05, 1.48926e-05], 0, 5.44757, 1662156011], "v": "v0.6"}
{"i": [["[\"te_transpose\", 12, 384, 64]", "cuda -keys=cuda,gpu -max_num_threads=1024 -model=unknown -thread_warp_size=32", [-1, 16, 64, 49152, 2147483647, 1024, 8, 32], "", 0, []], [[], [["FU", 1, [0, 1, 2]], ["SP", 1, 0, 294912, [32], 1], ["AN", 1, 0, 5], ["AN", 1, 1, 6]]]], "r": [[9.55309e-06, 9.54946e-06, 9.55305e-06], 0, 2.83339, 1662156009], "v": "v0.6"}
{"i": [["[\"te_transpose\", 12, 384, 64]", "cuda -keys=cuda,gpu -max_num_threads=1024 -model=unknown -thread_warp_size=32", [-1, 16, 64, 49152, 2147483647, 1024, 8, 32], "", 0, []], [[], [["FU", 1, [0, 1, 2]], ["SP", 1, 0, 294912, [6], 1], ["AN", 1, 0, 5], ["AN", 1, 1, 6]]]], "r": [[3.91155e-05, 3.91361e-05, 3.91399e-05], 0, 1.55482, 1662156007], "v": "v0.6"}
{"i": [["[\"te_transpose\", 12, 384, 64]", "cuda -keys=cuda,gpu -max_num_threads=1024 -model=unknown -thread_warp_size=32", [-1, 16, 64, 49152, 2147483647, 1024, 8, 32], "", 0, []], [[], [["FU", 1, [0, 1, 2]], ["SP", 1, 0, 294912, [16], 1], ["AN", 1, 0, 5], ["AN", 1, 1, 6]]]], "r": [[1.642e-05, 1.6427e-05, 1.64277e-05], 0, 3.46723, 1662156009], "v": "v0.6"}
{"i": [["[\"te_transpose\", 12, 384, 64]", "cuda -keys=cuda,gpu -max_num_threads=1024 -model=unknown -thread_warp_size=32", [-1, 16, 64, 49152, 2147483647, 1024, 8, 32], "", 0, []], [[], [["FU", 1, [0, 1, 2]], ["SP", 1, 0, 294912, [48], 1], ["AN", 1, 0, 5], ["AN", 1, 1, 6]]]], "r": [[7.16168e-06, 7.1618e-06, 7.15927e-06], 0, 7.82229, 1662156014], "v": "v0.6"}
{"i": [["[\"te_transpose\", 12, 384, 64]", "cuda -keys=cuda,gpu -max_num_threads=1024 -model=unknown -thread_warp_size=32", [-1, 16, 64, 49152, 2147483647, 1024, 8, 32], "", 0, []], [[], [["FU", 1, [0, 1, 2]], ["SP", 1, 0, 294912, [4], 1], ["AN", 1, 0, 5], ["AN", 1, 1, 6]]]], "r": [[5.7514e-05, 5.7522e-05, 5.75341e-05], 0, 4.01449, 1662156010], "v": "v0.6"}
{"i": [["[\"te_transpose\", 12, 384, 64]", "cuda -keys=cuda,gpu -max_num_threads=1024 -model=unknown -thread_warp_size=32", [-1, 16, 64, 49152, 2147483647, 1024, 8, 32], "", 0, []], [[], [["FU", 1, [0, 1, 2]], ["SP", 1, 0, 294912, [9], 1], ["AN", 1, 0, 5], ["AN", 1, 1, 6]]]], "r": [[2.71917e-05, 2.72042e-05, 2.72019e-05], 0, 6.65711, 1662156013], "v": "v0.6"}
{"i": [["[\"te_transpose\", 12, 384, 64]", "cuda -keys=cuda,gpu -max_num_threads=1024 -model=unknown -thread_warp_size=32", [-1, 16, 64, 49152, 2147483647, 1024, 8, 32], "", 0, []], [[], [["FU", 1, [0, 1, 2]], ["SP", 1, 0, 294912, [8], 1], ["AN", 1, 0, 5], ["AN", 1, 1, 6]]]], "r": [[3.00292e-05, 3.00363e-05, 3.00369e-05], 0, 8.45876, 1662156014], "v": "v0.6"}
{"i": [["[\"te_transpose\", 12, 384, 64]", "cuda -keys=cuda,gpu -max_num_threads=1024 -model=unknown -thread_warp_size=32", [-1, 16, 64, 49152, 2147483647, 1024, 8, 32], "", 0, []], [[], [["FU", 1, [0, 1, 2]], ["SP", 1, 0, 294912, [64], 1], ["AN", 1, 0, 5], ["AN", 1, 1, 6]]]], "r": [[5.84797e-06, 5.84728e-06, 5.84821e-06], 0, 9.01538, 1662156015], "v": "v0.6"}
{"i": [["[\"te_transpose\", 12, 384, 64]", "cuda -keys=cuda,gpu -max_num_threads=1024 -model=unknown -thread_warp_size=32", [-1, 16, 64, 49152, 2147483647, 1024, 8, 32], "", 0, []], [[], [["FU", 1, [0, 1, 2]], ["SP", 1, 0, 294912, [24], 1], ["AN", 1, 0, 5], ["AN", 1, 1, 6]]]], "r": [[1.19666e-05, 1.19665e-05, 1.1968e-05], 0, 6.02085, 1662156012], "v": "v0.6"}
{"i": [["[\"te_transpose\", 12, 384, 64]", "cuda -keys=cuda,gpu -max_num_threads=1024 -model=unknown -thread_warp_size=32", [-1, 16, 64, 49152, 2147483647, 1024, 8, 32], "", 0, []], [[], [["FU", 1, [0, 1, 2]], ["SP", 1, 0, 294912, [12], 1], ["AN", 1, 0, 5], ["AN", 1, 1, 6]]]], "r": [[2.0947e-05, 2.09616e-05, 2.09642e-05], 0, 9.64133, 1662156016], "v": "v0.6"}
{"i": [["[\"te_transpose\", 12, 384, 64]", "cuda -keys=cuda,gpu -max_num_threads=1024 -model=unknown -thread_warp_size=32", [-1, 16, 64, 49152, 2147483647, 1024, 8, 32], "", 0, []], [[], [["FU", 1, [0, 1, 2]], ["SP", 1, 0, 294912, [1], 1], ["AN", 1, 0, 5], ["AN", 1, 1, 6]]]], "r": [[0.00022131, 0.000221318, 0.000221318], 0, 0.880248, 1662156241], "v": "v0.6"}
{"i": [["[\"te_transpose\", 12, 384, 64]", "cuda -keys=cuda,gpu -max_num_threads=1024 -model=unknown -thread_warp_size=32", [-1, 16, 64, 49152, 2147483647, 1024, 8, 32], "", 0, []], [[], [["FU", 1, [0, 1, 2]], ["SP", 1, 0, 294912, [24], 1], ["AN", 1, 0, 5], ["AN", 1, 1, 6]]]], "r": [[1.18147e-05, 1.18175e-05, 1.18171e-05], 0, 1.43269, 1662156241], "v": "v0.6"}
{"i": [["[\"te_transpose\", 12, 384, 64]", "cuda -keys=cuda,gpu -max_num_threads=1024 -model=unknown -thread_warp_size=32", [-1, 16, 64, 49152, 2147483647, 1024, 8, 32], "", 0, []], [[], [["FU", 1, [0, 1, 2]], ["SP", 1, 0, 294912, [32], 1], ["AN", 1, 0, 5], ["AN", 1, 1, 6]]]], "r": [[9.51596e-06, 9.51815e-06, 9.51677e-06], 0, 6.09301, 1662156246], "v": "v0.6"}
{"i": [["[\"te_transpose\", 12, 384, 64]", "cuda -keys=cuda,gpu -max_num_threads=1024 -model=unknown -thread_warp_size=32", [-1, 16, 64, 49152, 2147483647, 1024, 8, 32], "", 0, []], [[], [["FU", 1, [0, 1, 2]], ["SP", 1, 0, 294912, [2], 1], ["AN", 1, 0, 5], ["AN", 1, 1, 6]]]], "r": [[0.000111899, 0.000111908, 0.000111906], 0, 5.49492, 1662156245], "v": "v0.6"}
{"i": [["[\"te_transpose\", 12, 384, 64]", "cuda -keys=cuda,gpu -max_num_threads=1024 -model=unknown -thread_warp_size=32", [-1, 16, 64, 49152, 2147483647, 1024, 8, 32], "", 0, []], [[], [["FU", 1, [0, 1, 2]], ["SP", 1, 0, 294912, [18], 1], ["AN", 1, 0, 5], ["AN", 1, 1, 6]]]], "r": [[1.4931e-05, 1.49447e-05, 1.49433e-05], 0, 2.00266, 1662156242], "v": "v0.6"}
{"i": [["[\"te_transpose\", 12, 384, 64]", "cuda -keys=cuda,gpu -max_num_threads=1024 -model=unknown -thread_warp_size=32", [-1, 16, 64, 49152, 2147483647, 1024, 8, 32], "", 0, []], [[], [["FU", 1, [0, 1, 2]], ["SP", 1, 0, 294912, [16], 1], ["AN", 1, 0, 5], ["AN", 1, 1, 6]]]], "r": [[1.64032e-05, 1.64116e-05, 1.64158e-05], 0, 3.16303, 1662156243], "v": "v0.6"}
{"i": [["[\"te_transpose\", 12, 384, 64]", "cuda -keys=cuda,gpu -max_num_threads=1024 -model=unknown -thread_warp_size=32", [-1, 16, 64, 49152, 2147483647, 1024, 8, 32], "", 0, []], [[], [["FU", 1, [0, 1, 2]], ["SP", 1, 0, 294912, [12], 1], ["AN", 1, 0, 5], ["AN", 1, 1, 6]]]], "r": [[2.11082e-05, 2.11352e-05, 2.11342e-05], 0, 4.93535, 1662156245], "v": "v0.6"}
{"i": [["[\"te_transpose\", 12, 384, 64]", "cuda -keys=cuda,gpu -max_num_threads=1024 -model=unknown -thread_warp_size=32", [-1, 16, 64, 49152, 2147483647, 1024, 8, 32], "", 0, []], [[], [["FU", 1, [0, 1, 2]], ["SP", 1, 0, 294912, [48], 1], ["AN", 1, 0, 5], ["AN", 1, 1, 6]]]], "r": [[7.11122e-06, 7.10947e-06, 7.11201e-06], 0, 4.26643, 1662156244], "v": "v0.6"}
{"i": [["[\"te_transpose\", 12, 384, 64]", "cuda -keys=cuda,gpu -max_num_threads=1024 -model=unknown -thread_warp_size=32", [-1, 16, 64, 49152, 2147483647, 1024, 8, 32], "", 0, []], [[], [["FU", 1, [0, 1, 2]], ["SP", 1, 0, 294912, [6], 1], ["AN", 1, 0, 5], ["AN", 1, 1, 6]]]], "r": [[3.90655e-05, 3.90842e-05, 3.90831e-05], 0, 7.83279, 1662156248], "v": "v0.6"}
{"i": [["[\"te_transpose\", 12, 384, 64]", "cuda -keys=cuda,gpu -max_num_threads=1024 -model=unknown -thread_warp_size=32", [-1, 16, 64, 49152, 2147483647, 1024, 8, 32], "", 0, []], [[], [["FU", 1, [0, 1, 2]], ["SP", 1, 0, 294912, [36], 1], ["AN", 1, 0, 5], ["AN", 1, 1, 6]]]], "r": [[8.62943e-06, 8.62986e-06, 8.62932e-06], 0, 2.62597, 1662156242], "v": "v0.6"}
{"i": [["[\"te_transpose\", 12, 384, 64]", "cuda -keys=cuda,gpu -max_num_threads=1024 -model=unknown -thread_warp_size=32", [-1, 16, 64, 49152, 2147483647, 1024, 8, 32], "", 0, []], [[], [["FU", 1, [0, 1, 2]], ["SP", 1, 0, 294912, [64], 1], ["AN", 1, 0, 5], ["AN", 1, 1, 6]]]], "r": [[5.86932e-06, 5.86947e-06, 5.86766e-06], 0, 3.67575, 1662156244], "v": "v0.6"}
{"i": [["[\"te_transpose\", 12, 384, 64]", "cuda -keys=cuda,gpu -max_num_threads=1024 -model=unknown -thread_warp_size=32", [-1, 16, 64, 49152, 2147483647, 1024, 8, 32], "", 0, []], [[], [["FU", 1, [0, 1, 2]], ["SP", 1, 0, 294912, [4], 1], ["AN", 1, 0, 5], ["AN", 1, 1, 6]]]], "r": [[5.73626e-05, 5.73689e-05, 5.73754e-05], 0, 7.21137, 1662156247], "v": "v0.6"}
{"i": [["[\"te_transpose\", 12, 384, 64]", "cuda -keys=cuda,gpu -max_num_threads=1024 -model=unknown -thread_warp_size=32", [-1, 16, 64, 49152, 2147483647, 1024, 8, 32], "", 0, []], [[], [["FU", 1, [0, 1, 2]], ["SP", 1, 0, 294912, [8], 1], ["AN", 1, 0, 5], ["AN", 1, 1, 6]]]], "r": [[3.01636e-05, 3.01704e-05, 3.01731e-05], 0, 6.69895, 1662156247], "v": "v0.6"}
{"i": [["[\"te_transpose\", 12, 384, 64]", "cuda -keys=cuda,gpu -max_num_threads=1024 -model=unknown -thread_warp_size=32", [-1, 16, 64, 49152, 2147483647, 1024, 8, 32], "", 0, []], [[], [["FU", 1, [0, 1, 2]], ["SP", 1, 0, 294912, [3], 1], ["AN", 1, 0, 5], ["AN", 1, 1, 6]]]], "r": [[7.55264e-05, 7.55408e-05, 7.55394e-05], 0, 8.38502, 1662156248], "v": "v0.6"}
{"i": [["[\"te_transpose\", 12, 384, 64]", "cuda -keys=cuda,gpu -max_num_threads=1024 -model=unknown -thread_warp_size=32", [-1, 16, 64, 49152, 2147483647, 1024, 8, 32], "", 0, []], [[], [["FU", 1, [0, 1, 2]], ["SP", 1, 0, 294912, [9], 1], ["AN", 1, 0, 5], ["AN", 1, 1, 6]]]], "r": [[2.70002e-05, 2.70146e-05, 2.70166e-05], 0, 9.00989, 1662156249], "v": "v0.6"}
