python/models/bert/kernel_configs/fused_bert_add_layer_norm_norm_1_128_12_64.log
{"i": [["[\"fused_bert_add_layer_norm_norm\", 1, 128, 12, 64]", "cuda -keys=cuda,gpu -max_num_threads=1024 -model=unknown -thread_warp_size=32", [-1, 16, 64, 49152, 2147483647, 1024, 8, 32], "", 0, []], [[], [["CHW", 3, "local"], ["CI", 3], ["FU", 4, [0, 1]], ["SP", 4, 0, 98304, [1], 1], ["AN", 4, 0, 5], ["AN", 4, 1, 6]]]], "r": [[7.57538e-05, 7.57557e-05, 7.57522e-05, 7.57491e-05, 7.5753e-05, 7.5752e-05, 7.57534e-05, 7.57546e-05, 7.57583e-05, 7.57573e-05], 0, 5.60645, 1657301289], "v": "v0.6"}
{"i": [["[\"fused_bert_add_layer_norm_norm\", 1, 128, 12, 64]", "cuda -keys=cuda,gpu -max_num_threads=1024 -model=unknown -thread_warp_size=32", [-1, 16, 64, 49152, 2147483647, 1024, 8, 32], "", 0, []], [[], [["CHW", 3, "local"], ["CI", 3], ["FU", 4, [0, 1]], ["SP", 4, 0, 98304, [6], 1], ["AN", 4, 0, 5], ["AN", 4, 1, 6]]]], "r": [[1.5117e-05, 1.51165e-05, 1.51174e-05, 1.51155e-05, 1.51151e-05, 1.51162e-05, 1.51157e-05, 1.51161e-05, 1.5116e-05, 1.51174e-05], 0, 10.454, 1657301294], "v": "v0.6"}
{"i": [["[\"fused_bert_add_layer_norm_norm\", 1, 128, 12, 64]", "cuda -keys=cuda,gpu -max_num_threads=1024 -model=unknown -thread_warp_size=32", [-1, 16, 64, 49152, 2147483647, 1024, 8, 32], "", 0, []], [[], [["CHW", 3, "local"], ["CI", 3], ["FU", 4, [0, 1]], ["SP", 4, 0, 98304, [4], 1], ["AN", 4, 0, 5], ["AN", 4, 1, 6]]]], "r": [[2.12301e-05, 2.12295e-05, 2.12299e-05, 2.12296e-05, 2.12293e-05, 2.12299e-05, 2.12299e-05, 2.12288e-05, 2.12295e-05, 2.12292e-05], 0, 25.3838, 1657301309], "v": "v0.6"}
{"i": [["[\"fused_bert_add_layer_norm_norm\", 1, 128, 12, 64]", "cuda -keys=cuda,gpu -max_num_threads=1024 -model=unknown -thread_warp_size=32", [-1, 16, 64, 49152, 2147483647, 1024, 8, 32], "", 0, []], [[], [["CHW", 3, "local"], ["CI", 3], ["FU", 4, [0, 1]], ["SP", 4, 0, 98304, [8], 1], ["AN", 4, 0, 5], ["AN", 4, 1, 6]]]], "r": [[1.21081e-05, 1.21088e-05, 1.21087e-05, 1.21093e-05, 1.21089e-05, 1.21092e-05, 1.21089e-05, 1.21092e-05, 1.21086e-05, 1.21091e-05], 0, 15.2201, 1657301299], "v": "v0.6"}
{"i": [["[\"fused_bert_add_layer_norm_norm\", 1, 128, 12, 64]", "cuda -keys=cuda,gpu -max_num_threads=1024 -model=unknown -thread_warp_size=32", [-1, 16, 64, 49152, 2147483647, 1024, 8, 32], "", 0, []], [[], [["CHW", 3, "local"], ["CI", 3], ["FU", 4, [0, 1]], ["SP", 4, 0, 98304, [2], 1], ["AN", 4, 0, 5], ["AN", 4, 1, 6]]]], "r": [[3.93989e-05, 3.94e-05, 3.94014e-05, 3.94006e-05, 3.9401e-05, 3.94018e-05, 3.94004e-05, 3.94003e-05, 3.94007e-05, 3.94011e-05], 0, 30.6448, 1657301314], "v": "v0.6"}
{"i": [["[\"fused_bert_add_layer_norm_norm\", 1, 128, 12, 64]", "cuda -keys=cuda,gpu -max_num_threads=1024 -model=unknown -thread_warp_size=32", [-1, 16, 64, 49152, 2147483647, 1024, 8, 32], "", 0, []], [[], [["CHW", 3, "local"], ["CI", 3], ["FU", 4, [0, 1]], ["SP", 4, 0, 98304, [3], 1], ["AN", 4, 0, 5], ["AN", 4, 1, 6]]]], "r": [[2.72496e-05, 2.72482e-05, 2.7248e-05, 2.72494e-05, 2.72476e-05, 2.72472e-05, 2.72486e-05, 2.7249e-05, 2.72504e-05, 2.72494e-05], 0, 20.3659, 1657301304], "v": "v0.6"}
{"i": [["[\"fused_bert_add_layer_norm_norm\", 1, 128, 12, 64]", "cuda -keys=cuda,gpu -max_num_threads=1024 -model=unknown -thread_warp_size=32", [-1, 16, 64, 49152, 2147483647, 1024, 8, 32], "", 0, []], [[], [["CHW", 3, "local"], ["CI", 3], ["FU", 4, [0, 1]], ["SP", 4, 0, 98304, [24], 1], ["AN", 4, 0, 5], ["AN", 4, 1, 6]]]], "r": [[5.8755e-06, 5.87613e-06, 5.87614e-06, 5.87652e-06, 5.87683e-06, 5.87616e-06, 5.87575e-06, 5.87643e-06, 5.87624e-06, 5.87504e-06], 0, 39.0249, 1657301323], "v": "v0.6"}
{"i": [["[\"fused_bert_add_layer_norm_norm\", 1, 128, 12, 64]", "cuda -keys=cuda,gpu -max_num_threads=1024 -model=unknown -thread_warp_size=32", [-1, 16, 64, 49152, 2147483647, 1024, 8, 32], "", 0, []], [[], [["CHW", 3, "local"], ["CI", 3], ["FU", 4, [0, 1]], ["SP", 4, 0, 98304, [32], 1], ["AN", 4, 0, 5], ["AN", 4, 1, 6]]]], "r": [[5.24704e-06, 5.24764e-06, 5.24744e-06, 5.24718e-06, 5.24691e-06, 5.24752e-06, 5.24685e-06, 5.24688e-06, 5.24795e-06, 5.24795e-06], 0, 43.078, 1657301327], "v": "v0.6"}
{"i": [["[\"fused_bert_add_layer_norm_norm\", 1, 128, 12, 64]", "cuda -keys=cuda,gpu -max_num_threads=1024 -model=unknown -thread_warp_size=32", [-1, 16, 64, 49152, 2147483647, 1024, 8, 32], "", 0, []], [[], [["CHW", 3, "local"], ["CI", 3], ["FU", 4, [0, 1]], ["SP", 4, 0, 98304, [16], 1], ["AN", 4, 0, 5], ["AN", 4, 1, 6]]]], "r": [[7.38501e-06, 7.38493e-06, 7.38442e-06, 7.38381e-06, 7.38494e-06, 7.38473e-06, 7.38478e-06, 7.38432e-06, 7.38404e-06, 7.38519e-06], 0, 34.9844, 1657301319], "v": "v0.6"}
{"i": [["[\"fused_bert_add_layer_norm_norm\", 1, 128, 12, 64]", "cuda -keys=cuda,gpu -max_num_threads=1024 -model=unknown -thread_warp_size=32", [-1, 16, 64, 49152, 2147483647, 1024, 8, 32], "", 0, []], [[], [["CHW", 3, "local"], ["CI", 3], ["FU", 4, [0, 1]], ["SP", 4, 0, 98304, [12], 1], ["AN", 4, 0, 5], ["AN", 4, 1, 6]]]], "r": [[8.92514e-06, 8.92419e-06, 8.92338e-06, 8.92356e-06, 8.92237e-06, 8.92463e-06, 8.92316e-06, 8.92342e-06, 8.92336e-06, 8.92308e-06], 0, 55.1729, 1657301339], "v": "v0.6"}
{"i": [["[\"fused_bert_add_layer_norm_norm\", 1, 128, 12, 64]", "cuda -keys=cuda,gpu -max_num_threads=1024 -model=unknown -thread_warp_size=32", [-1, 16, 64, 49152, 2147483647, 1024, 8, 32], "", 0, []], [[], [["CHW", 3, "local"], ["CI", 3], ["FU", 4, [0, 1]], ["SP", 4, 0, 98304, [48], 1], ["AN", 4, 0, 5], ["AN", 4, 1, 6]]]], "r": [[4.41194e-06, 4.41063e-06, 4.41079e-06, 4.41028e-06, 4.40981e-06, 4.41015e-06, 4.41048e-06, 4.41101e-06, 4.41069e-06, 4.40973e-06], 0, 46.8899, 1657301331], "v": "v0.6"}
{"i": [["[\"fused_bert_add_layer_norm_norm\", 1, 128, 12, 64]", "cuda -keys=cuda,gpu -max_num_threads=1024 -model=unknown -thread_warp_size=32", [-1, 16, 64, 49152, 2147483647, 1024, 8, 32], "", 0, []], [[], [["CHW", 3, "local"], ["CI", 3], ["FU", 4, [0, 1]], ["SP", 4, 0, 98304, [64], 1], ["AN", 4, 0, 5], ["AN", 4, 1, 6]]]], "r": [[4.1334e-06, 4.1327e-06, 4.13293e-06, 4.13304e-06, 4.13277e-06, 4.13262e-06, 4.13257e-06, 4.13315e-06, 4.13269e-06, 4.13247e-06], 0, 50.612, 1657301334], "v": "v0.6"}
