python/models/bert/kernel_configs/fused_bert_add_layer_norm_variance_1_128_12_64.log
{"i": [["[\"fused_bert_add_layer_norm_variance\", 1, 128, 12, 64]", "cuda -keys=cuda,gpu -max_num_threads=1024 -model=unknown -thread_warp_size=32", [-1, 16, 64, 49152, 2147483647, 1024, 8, 32], "", 0, []], [[], [["SP", 2, 1, 768, [16], 1], ["AN", 2, 2, 6], ["AN", 2, 0, 5], ["PR", 2, 0, "auto_unroll_max_step$16"]]]], "r": [[2.23713e-05, 2.23725e-05, 2.87634e-05, 3.00815e-05, 2.25901e-05, 2.23774e-05, 2.23742e-05, 2.23701e-05, 2.23772e-05, 3.53209e-05], 0, 18.086, 1657300784], "v": "v0.6"}
{"i": [["[\"fused_bert_add_layer_norm_variance\", 1, 128, 12, 64]", "cuda -keys=cuda,gpu -max_num_threads=1024 -model=unknown -thread_warp_size=32", [-1, 16, 64, 49152, 2147483647, 1024, 8, 32], "", 0, []], [[], [["SP", 2, 0, 128, [1], 1], ["AN", 2, 0, 5], ["AN", 2, 1, 6], ["PR", 2, 0, "auto_unroll_max_step$0"]]]], "r": [[0.000536212, 0.000358371, 0.000348579, 0.000348554, 0.000348596, 0.00034864, 0.000475054, 0.000492497, 0.000353363, 0.00034863], 0, 30.2609, 1657300796], "v": "v0.6"}
{"i": [["[\"fused_bert_add_layer_norm_variance\", 1, 128, 12, 64]", "cuda -keys=cuda,gpu -max_num_threads=1024 -model=unknown -thread_warp_size=32", [-1, 16, 64, 49152, 2147483647, 1024, 8, 32], "", 0, []], [[], [["SP", 2, 1, 768, [1], 1], ["AN", 2, 2, 6], ["AN", 2, 0, 5], ["PR", 2, 0, "auto_unroll_max_step$64"]]]], "r": [[0.000200297, 0.000200331, 0.000200297, 0.000200314, 0.00023022, 0.00027632, 0.000202091, 0.000200317, 0.00020031, 0.000200302], 0, 23.9013, 1657300790], "v": "v0.6"}
{"i": [["[\"fused_bert_add_layer_norm_variance\", 1, 128, 12, 64]", "cuda -keys=cuda,gpu -max_num_threads=1024 -model=unknown -thread_warp_size=32", [-1, 16, 64, 49152, 2147483647, 1024, 8, 32], "", 0, []], [[], [["SP", 2, 1, 768, [32], 1], ["AN", 2, 2, 6], ["AN", 2, 0, 5], ["PR", 2, 0, "auto_unroll_max_step$64"]]]], "r": [[2.13061e-05, 1.26742e-05, 1.2334e-05, 1.23342e-05, 1.2341e-05, 1.23368e-05, 1.85018e-05, 1.26622e-05, 1.23346e-05, 1.23346e-05], 0, 6.70725, 1657300772], "v": "v0.6"}
{"i": [["[\"fused_bert_add_layer_norm_variance\", 1, 128, 12, 64]", "cuda -keys=cuda,gpu -max_num_threads=1024 -model=unknown -thread_warp_size=32", [-1, 16, 64, 49152, 2147483647, 1024, 8, 32], "", 0, []], [[], [["SP", 2, 1, 768, [64], 1], ["AN", 2, 2, 6], ["AN", 2, 0, 5], ["PR", 2, 0, "auto_unroll_max_step$64"]]]], "r": [[1.08741e-05, 7.83519e-06, 7.83489e-06, 7.83551e-06, 7.83496e-06, 7.84497e-06, 7.83561e-06, 7.84569e-06, 7.83983e-06, 8.13456e-06], 0, 45.7331, 1657300811], "v": "v0.6"}
{"i": [["[\"fused_bert_add_layer_norm_variance\", 1, 128, 12, 64]", "cuda -keys=cuda,gpu -max_num_threads=1024 -model=unknown -thread_warp_size=32", [-1, 16, 64, 49152, 2147483647, 1024, 8, 32], "", 0, []], [[], [["SP", 2, 1, 768, [24], 1], ["AN", 2, 2, 6], ["AN", 2, 0, 5], ["PR", 2, 0, "auto_unroll_max_step$16"]]]], "r": [[1.58509e-05, 1.58356e-05, 1.5843e-05, 1.58408e-05, 1.58402e-05, 1.58409e-05, 1.58492e-05, 1.58447e-05, 1.58445e-05, 1.58573e-05], 0, 68.2464, 1657300834], "v": "v0.6"}
{"i": [["[\"fused_bert_add_layer_norm_variance\", 1, 128, 12, 64]", "cuda -keys=cuda,gpu -max_num_threads=1024 -model=unknown -thread_warp_size=32", [-1, 16, 64, 49152, 2147483647, 1024, 8, 32], "", 0, []], [[], [["SP", 2, 0, 128, [2], 1], ["AN", 2, 0, 5], ["AN", 2, 1, 6], ["PR", 2, 0, "auto_unroll_max_step$1024"]]]], "r": [[0.000211421, 0.00020973, 0.000210615, 0.000211202, 0.000210963, 0.000210118, 0.000210005, 0.000209913, 0.000210351, 0.000211195], 0, 63.6517, 1657300829], "v": "v0.6"}
{"i": [["[\"fused_bert_add_layer_norm_variance\", 1, 128, 12, 64]", "cuda -keys=cuda,gpu -max_num_threads=1024 -model=unknown -thread_warp_size=32", [-1, 16, 64, 49152, 2147483647, 1024, 8, 32], "", 0, []], [[], [["SP", 2, 1, 768, [24], 1], ["AN", 2, 2, 6], ["AN", 2, 0, 5], ["PR", 2, 0, "auto_unroll_max_step$1024"]]]], "r": [[1.57496e-05, 1.75412e-05, 2.29299e-05, 1.60229e-05, 1.57357e-05, 1.57361e-05, 1.57366e-05, 1.57416e-05, 1.61166e-05, 2.4664e-05], 0, 35.3545, 1657300801], "v": "v0.6"}
{"i": [["[\"fused_bert_add_layer_norm_variance\", 1, 128, 12, 64]", "cuda -keys=cuda,gpu -max_num_threads=1024 -model=unknown -thread_warp_size=32", [-1, 16, 64, 49152, 2147483647, 1024, 8, 32], "", 0, []], [[], [["SP", 2, 1, 768, [4], 1], ["AN", 2, 2, 6], ["AN", 2, 0, 5], ["PR", 2, 0, "auto_unroll_max_step$16"]]]], "r": [[5.91831e-05, 5.91861e-05, 5.91831e-05, 0.000118822, 0.000132322, 9.48651e-05, 6.09049e-05, 5.91832e-05, 5.91907e-05, 5.91919e-05], 0, 52.2405, 1657300818], "v": "v0.6"}
{"i": [["[\"fused_bert_add_layer_norm_variance\", 1, 128, 12, 64]", "cuda -keys=cuda,gpu -max_num_threads=1024 -model=unknown -thread_warp_size=32", [-1, 16, 64, 49152, 2147483647, 1024, 8, 32], "", 0, []], [[], [["SP", 2, 1, 768, [3], 1], ["AN", 2, 2, 6], ["AN", 2, 0, 5], ["PR", 2, 0, "auto_unroll_max_step$512"]]]], "r": [[7.58636e-05, 0.000122608, 7.80473e-05, 7.58779e-05, 7.58935e-05, 7.58883e-05, 7.58876e-05, 0.000116158, 7.94716e-05, 7.59051e-05], 0, 12.6903, 1657300778], "v": "v0.6"}
{"i": [["[\"fused_bert_add_layer_norm_variance\", 1, 128, 12, 64]", "cuda -keys=cuda,gpu -max_num_threads=1024 -model=unknown -thread_warp_size=32", [-1, 16, 64, 49152, 2147483647, 1024, 8, 32], "", 0, []], [[], [["SP", 2, 1, 768, [1], 1], ["AN", 2, 2, 6], ["AN", 2, 0, 5], ["PR", 2, 0, "auto_unroll_max_step$1024"]]]], "r": [[0.00020024, 0.000200234, 0.000200254, 0.00020024, 0.000280078, 0.000211501, 0.000200248, 0.000200246, 0.000200249, 0.000200269], 0, 41.0385, 1657300807], "v": "v0.6"}
{"i": [["[\"fused_bert_add_layer_norm_variance\", 1, 128, 12, 64]", "cuda -keys=cuda,gpu -max_num_threads=1024 -model=unknown -thread_warp_size=32", [-1, 16, 64, 49152, 2147483647, 1024, 8, 32], "", 0, []], [[], [["SP", 2, 0, 128, [32], 1], ["AN", 2, 0, 5], ["AN", 2, 1, 6], ["PR", 2, 0, "auto_unroll_max_step$512"]]]], "r": [[0.000243649, 0.000243639, 0.00024363, 0.000243643, 0.000243648, 0.000243649, 0.000243648, 0.000243648, 0.000243646, 0.00024365], 0, 83.2886, 1657300849], "v": "v0.6"}
{"i": [["[\"fused_bert_add_layer_norm_variance\", 1, 128, 12, 64]", "cuda -keys=cuda,gpu -max_num_threads=1024 -model=unknown -thread_warp_size=32", [-1, 16, 64, 49152, 2147483647, 1024, 8, 32], "", 0, []], [[], [["SP", 2, 1, 768, [8], 1], ["AN", 2, 2, 6], ["AN", 2, 0, 5], ["PR", 2, 0, "auto_unroll_max_step$1024"]]]], "r": [[3.45984e-05, 3.45883e-05, 3.45793e-05, 3.45681e-05, 3.4565e-05, 3.45923e-05, 3.4588e-05, 3.45626e-05, 3.45749e-05, 3.45548e-05], 0, 109.123, 1657300875], "v": "v0.6"}
{"i": [["[\"fused_bert_add_layer_norm_variance\", 1, 128, 12, 64]", "cuda -keys=cuda,gpu -max_num_threads=1024 -model=unknown -thread_warp_size=32", [-1, 16, 64, 49152, 2147483647, 1024, 8, 32], "", 0, []], [[], [["SP", 2, 0, 128, [64], 1], ["AN", 2, 0, 5], ["AN", 2, 1, 6], ["PR", 2, 0, "auto_unroll_max_step$16"]]]], "r": [[0.000245823, 0.000245825, 0.000245815, 0.000245833, 0.000245798, 0.000245814, 0.000245811, 0.000245826, 0.000245819, 0.00024583], 0, 94.0787, 1657300860], "v": "v0.6"}
{"i": [["[\"fused_bert_add_layer_norm_variance\", 1, 128, 12, 64]", "cuda -keys=cuda,gpu -max_num_threads=1024 -model=unknown -thread_warp_size=32", [-1, 16, 64, 49152, 2147483647, 1024, 8, 32], "", 0, []], [[], [["SP", 2, 1, 768, [32], 1], ["AN", 2, 2, 6], ["AN", 2, 0, 5], ["PR", 2, 0, "auto_unroll_max_step$0"]]]], "r": [[1.24703e-05, 1.24703e-05, 1.24698e-05, 1.24705e-05, 1.247e-05, 1.24697e-05, 1.24708e-05, 1.24705e-05, 1.24712e-05, 1.24707e-05], 0, 166.805, 1657300932], "v": "v0.6"}
{"i": [["[\"fused_bert_add_layer_norm_variance\", 1, 128, 12, 64]", "cuda -keys=cuda,gpu -max_num_threads=1024 -model=unknown -thread_warp_size=32", [-1, 16, 64, 49152, 2147483647, 1024, 8, 32], "", 0, []], [[], [["SP", 2, 1, 768, [6], 1], ["AN", 2, 2, 6], ["AN", 2, 0, 5], ["PR", 2, 0, "auto_unroll_max_step$512"]]]], "r": [[4.28227e-05, 4.28256e-05, 4.28251e-05, 4.28259e-05, 4.28303e-05, 4.2825e-05, 4.28236e-05, 4.28244e-05, 4.28225e-05, 4.28229e-05], 0, 103.87, 1657300870], "v": "v0.6"}
{"i": [["[\"fused_bert_add_layer_norm_variance\", 1, 128, 12, 64]", "cuda -keys=cuda,gpu -max_num_threads=1024 -model=unknown -thread_warp_size=32", [-1, 16, 64, 49152, 2147483647, 1024, 8, 32], "", 0, []], [[], [["SP", 2, 1, 768, [4], 1], ["AN", 2, 2, 6], ["AN", 2, 0, 5], ["PR", 2, 0, "auto_unroll_max_step$0"]]]], "r": [[5.93965e-05, 5.93984e-05, 5.93996e-05, 5.93998e-05, 5.93999e-05, 5.9403e-05, 5.94004e-05, 5.94012e-05, 5.94041e-05, 5.94047e-05], 0, 88.6527, 1657300854], "v": "v0.6"}
{"i": [["[\"fused_bert_add_layer_norm_variance\", 1, 128, 12, 64]", "cuda -keys=cuda,gpu -max_num_threads=1024 -model=unknown -thread_warp_size=32", [-1, 16, 64, 49152, 2147483647, 1024, 8, 32], "", 0, []], [[], [["SP", 2, 1, 768, [8], 1], ["AN", 2, 2, 6], ["AN", 2, 0, 5], ["PR", 2, 0, "auto_unroll_max_step$64"]]]], "r": [[3.47768e-05, 3.47744e-05, 3.47749e-05, 3.47756e-05, 3.47735e-05, 3.47741e-05, 3.47754e-05, 3.47766e-05, 3.47738e-05, 3.4775e-05], 0, 157.121, 1657300923], "v": "v0.6"}
{"i": [["[\"fused_bert_add_layer_norm_variance\", 1, 128, 12, 64]", "cuda -keys=cuda,gpu -max_num_threads=1024 -model=unknown -thread_warp_size=32", [-1, 16, 64, 49152, 2147483647, 1024, 8, 32], "", 0, []], [[], [["SP", 2, 1, 768, [32], 1], ["AN", 2, 2, 6], ["AN", 2, 0, 5], ["PR", 2, 0, "auto_unroll_max_step$1024"]]]], "r": [[1.26794e-05, 1.26771e-05, 1.26776e-05, 1.26763e-05, 1.26752e-05, 1.26744e-05, 1.26774e-05, 1.26781e-05, 1.26782e-05, 1.26805e-05], 0, 73.3194, 1657300839], "v": "v0.6"}
{"i": [["[\"fused_bert_add_layer_norm_variance\", 1, 128, 12, 64]", "cuda -keys=cuda,gpu -max_num_threads=1024 -model=unknown -thread_warp_size=32", [-1, 16, 64, 49152, 2147483647, 1024, 8, 32], "", 0, []], [[], [["SP", 2, 1, 768, [2], 1], ["AN", 2, 2, 6], ["AN", 2, 0, 5], ["PR", 2, 0, "auto_unroll_max_step$0"]]]], "r": [[0.000128995, 0.000238262, 0.00023935, 0.000239215, 0.000239378, 0.000213442, 0.000108792, 0.000108792, 0.000108786, 0.000108788], 0, 58.3647, 1657300824], "v": "v0.6"}
{"i": [["[\"fused_bert_add_layer_norm_variance\", 1, 128, 12, 64]", "cuda -keys=cuda,gpu -max_num_threads=1024 -model=unknown -thread_warp_size=32", [-1, 16, 64, 49152, 2147483647, 1024, 8, 32], "", 0, []], [[], [["SP", 2, 1, 768, [8], 1], ["AN", 2, 2, 6], ["AN", 2, 0, 5], ["PR", 2, 0, "auto_unroll_max_step$512"]]]], "r": [[3.45849e-05, 3.45852e-05, 3.45853e-05, 3.45857e-05, 3.4585e-05, 3.45854e-05, 3.45856e-05, 3.45856e-05, 3.45854e-05, 3.45851e-05], 0, 125.095, 1657300891], "v": "v0.6"}
{"i": [["[\"fused_bert_add_layer_norm_variance\", 1, 128, 12, 64]", "cuda -keys=cuda,gpu -max_num_threads=1024 -model=unknown -thread_warp_size=32", [-1, 16, 64, 49152, 2147483647, 1024, 8, 32], "", 0, []], [[], [["SP", 2, 1, 768, [1], 1], ["AN", 2, 2, 6], ["AN", 2, 0, 5], ["PR", 2, 0, "auto_unroll_max_step$16"]]]], "r": [[0.000200442, 0.00020046, 0.00020047, 0.000200413, 0.000200406, 0.000200418, 0.000200418, 0.000200424, 0.000200415, 0.000200419], 0, 130.584, 1657300896], "v": "v0.6"}
{"i": [["[\"fused_bert_add_layer_norm_variance\", 1, 128, 12, 64]", "cuda -keys=cuda,gpu -max_num_threads=1024 -model=unknown -thread_warp_size=32", [-1, 16, 64, 49152, 2147483647, 1024, 8, 32], "", 0, []], [[], [["SP", 2, 1, 768, [12], 1], ["AN", 2, 2, 6], ["AN", 2, 0, 5], ["PR", 2, 0, "auto_unroll_max_step$64"]]]], "r": [[2.63026e-05, 2.63032e-05, 2.63035e-05, 2.63038e-05, 2.63033e-05, 2.63034e-05, 2.63036e-05, 2.63037e-05, 2.63039e-05, 2.63039e-05], 0, 135.705, 1657300901], "v": "v0.6"}
{"i": [["[\"fused_bert_add_layer_norm_variance\", 1, 128, 12, 64]", "cuda -keys=cuda,gpu -max_num_threads=1024 -model=unknown -thread_warp_size=32", [-1, 16, 64, 49152, 2147483647, 1024, 8, 32], "", 0, []], [[], [["SP", 2, 1, 768, [48], 1], ["AN", 2, 2, 6], ["AN", 2, 0, 5], ["PR", 2, 0, "auto_unroll_max_step$0"]]]], "r": [[9.62646e-06, 9.6256e-06, 9.62576e-06, 9.62597e-06, 9.62602e-06, 9.62645e-06, 9.62627e-06, 9.62589e-06, 9.62646e-06, 9.62623e-06], 0, 77.7015, 1657300843], "v": "v0.6"}
{"i": [["[\"fused_bert_add_layer_norm_variance\", 1, 128, 12, 64]", "cuda -keys=cuda,gpu -max_num_threads=1024 -model=unknown -thread_warp_size=32", [-1, 16, 64, 49152, 2147483647, 1024, 8, 32], "", 0, []], [[], [["SP", 2, 1, 768, [8], 1], ["AN", 2, 2, 6], ["AN", 2, 0, 5], ["PR", 2, 0, "auto_unroll_max_step$16"]]]], "r": [[3.45775e-05, 3.45781e-05, 3.45772e-05, 3.45778e-05, 3.45783e-05, 3.45788e-05, 3.45785e-05, 3.45793e-05, 3.4579e-05, 3.45789e-05], 0, 192.061, 1657300958], "v": "v0.6"}
{"i": [["[\"fused_bert_add_layer_norm_variance\", 1, 128, 12, 64]", "cuda -keys=cuda,gpu -max_num_threads=1024 -model=unknown -thread_warp_size=32", [-1, 16, 64, 49152, 2147483647, 1024, 8, 32], "", 0, []], [[], [["SP", 2, 0, 128, [8], 1], ["AN", 2, 0, 5], ["AN", 2, 1, 6], ["PR", 2, 0, "auto_unroll_max_step$0"]]]], "r": [[0.000214276, 0.000214265, 0.000214253, 0.000214269, 0.000214255, 0.000214265, 0.000214241, 0.000214271, 0.00021425, 0.000214273], 0, 197.605, 1657300963], "v": "v0.6"}
{"i": [["[\"fused_bert_add_layer_norm_variance\", 1, 128, 12, 64]", "cuda -keys=cuda,gpu -max_num_threads=1024 -model=unknown -thread_warp_size=32", [-1, 16, 64, 49152, 2147483647, 1024, 8, 32], "", 0, []], [[], [["SP", 2, 0, 128, [2], 1], ["AN", 2, 0, 5], ["AN", 2, 1, 6], ["PR", 2, 0, "auto_unroll_max_step$64"]]]], "r": [[0.000213366, 0.000213741, 0.000213979, 0.00021407, 0.000213913, 0.000214204, 0.000213468, 0.000213778, 0.00021239, 0.000213522], 0, 119.961, 1657300886], "v": "v0.6"}
{"i": [["[\"fused_bert_add_layer_norm_variance\", 1, 128, 12, 64]", "cuda -keys=cuda,gpu -max_num_threads=1024 -model=unknown -thread_warp_size=32", [-1, 16, 64, 49152, 2147483647, 1024, 8, 32], "", 0, []], [[], [["SP", 2, 0, 128, [1], 1], ["AN", 2, 0, 5], ["AN", 2, 1, 6], ["PR", 2, 0, "auto_unroll_max_step$64"]]]], "r": [[0.000368473, 0.000368294, 0.000368508, 0.000368645, 0.000368907, 0.000368942, 0.000368894, 0.000368845, 0.000368952, 0.000369052], 0, 114.502, 1657300880], "v": "v0.6"}
{"i": [["[\"fused_bert_add_layer_norm_variance\", 1, 128, 12, 64]", "cuda -keys=cuda,gpu -max_num_threads=1024 -model=unknown -thread_warp_size=32", [-1, 16, 64, 49152, 2147483647, 1024, 8, 32], "", 0, []], [[], [["SP", 2, 1, 768, [48], 1], ["AN", 2, 2, 6], ["AN", 2, 0, 5], ["PR", 2, 0, "auto_unroll_max_step$64"]]]], "r": [[9.50522e-06, 9.51662e-06, 9.50526e-06, 9.50153e-06, 9.50624e-06, 9.50919e-06, 9.51716e-06, 9.51321e-06, 9.5179e-06, 9.5175e-06], 0, 98.6214, 1657300864], "v": "v0.6"}
{"i": [["[\"fused_bert_add_layer_norm_variance\", 1, 128, 12, 64]", "cuda -keys=cuda,gpu -max_num_threads=1024 -model=unknown -thread_warp_size=32", [-1, 16, 64, 49152, 2147483647, 1024, 8, 32], "", 0, []], [[], [["SP", 2, 0, 128, [4], 1], ["AN", 2, 0, 5], ["AN", 2, 1, 6], ["PR", 2, 0, "auto_unroll_max_step$512"]]]], "r": [[0.000209782, 0.000209781, 0.000209777, 0.000209782, 0.000209781, 0.000209785, 0.000209787, 0.000209786, 0.00020979, 0.000209783], 0, 151.97, 1657300918], "v": "v0.6"}
{"i": [["[\"fused_bert_add_layer_norm_variance\", 1, 128, 12, 64]", "cuda -keys=cuda,gpu -max_num_threads=1024 -model=unknown -thread_warp_size=32", [-1, 16, 64, 49152, 2147483647, 1024, 8, 32], "", 0, []], [[], [["SP", 2, 0, 128, [32], 1], ["AN", 2, 0, 5], ["AN", 2, 1, 6], ["PR", 2, 0, "auto_unroll_max_step$64"]]]], "r": [[0.00024376, 0.000243755, 0.000243752, 0.000243757, 0.00024376, 0.000243757, 0.000243755, 0.000243758, 0.000243756, 0.00024376], 0, 141.02, 1657300907], "v": "v0.6"}
{"i": [["[\"fused_bert_add_layer_norm_variance\", 1, 128, 12, 64]", "cuda -keys=cuda,gpu -max_num_threads=1024 -model=unknown -thread_warp_size=32", [-1, 16, 64, 49152, 2147483647, 1024, 8, 32], "", 0, []], [[], [["SP", 2, 1, 768, [32], 1], ["AN", 2, 2, 6], ["AN", 2, 0, 5], ["PR", 2, 0, "auto_unroll_max_step$512"]]]], "r": [[1.27032e-05, 1.2703e-05, 1.2703e-05, 1.27031e-05, 1.2703e-05, 1.27029e-05, 1.27029e-05, 1.27027e-05, 1.27028e-05, 1.27028e-05], 0, 176.98, 1657300943], "v": "v0.6"}
{"i": [["[\"fused_bert_add_layer_norm_variance\", 1, 128, 12, 64]", "cuda -keys=cuda,gpu -max_num_threads=1024 -model=unknown -thread_warp_size=32", [-1, 16, 64, 49152, 2147483647, 1024, 8, 32], "", 0, []], [[], [["SP", 2, 0, 128, [8], 1], ["AN", 2, 0, 5], ["AN", 2, 1, 6], ["PR", 2, 0, "auto_unroll_max_step$1024"]]]], "r": [[0.000214327, 0.000214359, 0.000214358, 0.000214357, 0.000214358, 0.000214353, 0.00021436, 0.000214355, 0.000214351, 0.000214356], 0, 146.428, 1657300912], "v": "v0.6"}
{"i": [["[\"fused_bert_add_layer_norm_variance\", 1, 128, 12, 64]", "cuda -keys=cuda,gpu -max_num_threads=1024 -model=unknown -thread_warp_size=32", [-1, 16, 64, 49152, 2147483647, 1024, 8, 32], "", 0, []], [[], [["SP", 2, 0, 128, [4], 1], ["AN", 2, 0, 5], ["AN", 2, 1, 6], ["PR", 2, 0, "auto_unroll_max_step$1024"]]]], "r": [[0.0002096, 0.000209594, 0.0002096, 0.000209605, 0.000209598, 0.0002096, 0.0002096, 0.00020961, 0.000209619, 0.0002096], 0, 186.898, 1657300953], "v": "v0.6"}
{"i": [["[\"fused_bert_add_layer_norm_variance\", 1, 128, 12, 64]", "cuda -keys=cuda,gpu -max_num_threads=1024 -model=unknown -thread_warp_size=32", [-1, 16, 64, 49152, 2147483647, 1024, 8, 32], "", 0, []], [[], [["SP", 2, 0, 128, [32], 1], ["AN", 2, 0, 5], ["AN", 2, 1, 6], ["PR", 2, 0, "auto_unroll_max_step$1024"]]]], "r": [[0.000243666, 0.00024367, 0.000243672, 0.000243719, 0.000243724, 0.00024371, 0.000243778, 0.000243793, 0.000243799, 0.000243797], 0, 202.868, 1657300969], "v": "v0.6"}
{"i": [["[\"fused_bert_add_layer_norm_variance\", 1, 128, 12, 64]", "cuda -keys=cuda,gpu -max_num_threads=1024 -model=unknown -thread_warp_size=32", [-1, 16, 64, 49152, 2147483647, 1024, 8, 32], "", 0, []], [[], [["SP", 2, 1, 768, [24], 1], ["AN", 2, 2, 6], ["AN", 2, 0, 5], ["PR", 2, 0, "auto_unroll_max_step$0"]]]], "r": [[1.57652e-05, 1.576e-05, 1.57606e-05, 1.57631e-05, 1.57525e-05, 1.57518e-05, 1.57415e-05, 1.57665e-05, 1.57588e-05, 1.57502e-05], 0, 162, 1657300928], "v": "v0.6"}
{"i": [["[\"fused_bert_add_layer_norm_variance\", 1, 128, 12, 64]", "cuda -keys=cuda,gpu -max_num_threads=1024 -model=unknown -thread_warp_size=32", [-1, 16, 64, 49152, 2147483647, 1024, 8, 32], "", 0, []], [[], [["SP", 2, 1, 768, [3], 1], ["AN", 2, 2, 6], ["AN", 2, 0, 5], ["PR", 2, 0, "auto_unroll_max_step$64"]]]], "r": [[7.58652e-05, 7.58741e-05, 7.58676e-05, 7.58764e-05, 7.58692e-05, 7.58678e-05, 7.587e-05, 7.58736e-05, 7.58714e-05, 7.58683e-05], 0, 172.155, 1657300938], "v": "v0.6"}
{"i": [["[\"fused_bert_add_layer_norm_variance\", 1, 128, 12, 64]", "cuda -keys=cuda,gpu -max_num_threads=1024 -model=unknown -thread_warp_size=32", [-1, 16, 64, 49152, 2147483647, 1024, 8, 32], "", 0, []], [[], [["SP", 2, 1, 768, [16], 1], ["AN", 2, 2, 6], ["AN", 2, 0, 5], ["PR", 2, 0, "auto_unroll_max_step$1024"]]]], "r": [[2.21874e-05, 2.21872e-05, 2.21875e-05, 2.21869e-05, 2.21859e-05, 2.21861e-05, 2.21861e-05, 2.21862e-05, 2.2186e-05, 2.21861e-05], 0, 207.991, 1657300974], "v": "v0.6"}
{"i": [["[\"fused_bert_add_layer_norm_variance\", 1, 128, 12, 64]", "cuda -keys=cuda,gpu -max_num_threads=1024 -model=unknown -thread_warp_size=32", [-1, 16, 64, 49152, 2147483647, 1024, 8, 32], "", 0, []], [[], [["SP", 2, 1, 768, [48], 1], ["AN", 2, 2, 6], ["AN", 2, 0, 5], ["PR", 2, 0, "auto_unroll_max_step$16"]]]], "r": [[9.3277e-06, 9.32158e-06, 9.32085e-06, 9.3226e-06, 9.32332e-06, 9.32611e-06, 9.32299e-06, 9.3227e-06, 9.31903e-06, 9.32064e-06], 0, 181.384, 1657300947], "v": "v0.6"}
{"i": [["[\"fused_bert_add_layer_norm_variance\", 1, 128, 12, 64]", "cuda -keys=cuda,gpu -max_num_threads=1024 -model=unknown -thread_warp_size=32", [-1, 16, 64, 49152, 2147483647, 1024, 8, 32], "", 0, []], [[], [["SP", 2, 1, 768, [16], 1], ["AN", 2, 2, 6], ["AN", 2, 0, 5], ["PR", 2, 0, "auto_unroll_max_step$512"]]]], "r": [[2.23089e-05, 2.23098e-05, 2.23101e-05, 2.23108e-05, 2.23104e-05, 2.23115e-05, 2.23116e-05, 2.23106e-05, 2.23107e-05, 2.23106e-05], 0, 212.95, 1657300979], "v": "v0.6"}
{"i": [["[\"fused_bert_add_layer_norm_variance\", 1, 128, 12, 64]", "cuda -keys=cuda,gpu -max_num_threads=1024 -model=unknown -thread_warp_size=32", [-1, 16, 64, 49152, 2147483647, 1024, 8, 32], "", 0, []], [[], [["SP", 2, 1, 768, [1], 1], ["AN", 2, 2, 6], ["AN", 2, 0, 5], ["PR", 2, 0, "auto_unroll_max_step$512"]]]], "r": [[0.000200204, 0.000200206, 0.000200203, 0.000200215, 0.000200213, 0.000200213, 0.000200212, 0.000200214, 0.000200211, 0.000200213], 0, 212.729, 1657300984], "v": "v0.6"}
{"i": [["[\"fused_bert_add_layer_norm_variance\", 1, 128, 12, 64]", "cuda -keys=cuda,gpu -max_num_threads=1024 -model=unknown -thread_warp_size=32", [-1, 16, 64, 49152, 2147483647, 1024, 8, 32], "", 0, []], [[], [["SP", 2, 0, 128, [32], 1], ["AN", 2, 0, 5], ["AN", 2, 1, 6], ["PR", 2, 0, "auto_unroll_max_step$0"]]]], "r": [[0.000243593, 0.000243589, 0.000243592, 0.000243593, 0.000243596, 0.00024359, 0.000243592, 0.00024359, 0.000243592, 0.000243589], 0, 212.321, 1657300990], "v": "v0.6"}
{"i": [["[\"fused_bert_add_layer_norm_variance\", 1, 128, 12, 64]", "cuda -keys=cuda,gpu -max_num_threads=1024 -model=unknown -thread_warp_size=32", [-1, 16, 64, 49152, 2147483647, 1024, 8, 32], "", 0, []], [[], [["SP", 2, 0, 128, [2], 1], ["AN", 2, 0, 5], ["AN", 2, 1, 6], ["PR", 2, 0, "auto_unroll_max_step$16"]]]], "r": [[0.000212981, 0.000213502, 0.00021365, 0.000212942, 0.000212673, 0.000212214, 0.000213704, 0.000213592, 0.000213393, 0.000212909], 0, 212.093, 1657300995], "v": "v0.6"}
{"i": [["[\"fused_bert_add_layer_norm_variance\", 1, 128, 12, 64]", "cuda -keys=cuda,gpu -max_num_threads=1024 -model=unknown -thread_warp_size=32", [-1, 16, 64, 49152, 2147483647, 1024, 8, 32], "", 0, []], [[], [["SP", 2, 1, 768, [48], 1], ["AN", 2, 2, 6], ["AN", 2, 0, 5], ["PR", 2, 0, "auto_unroll_max_step$512"]]]], "r": [[9.40784e-06, 9.40799e-06, 9.40805e-06, 9.40799e-06, 9.40803e-06, 9.40802e-06, 9.40812e-06, 9.40818e-06, 9.40808e-06, 9.40817e-06], 0, 210.708, 1657301000], "v": "v0.6"}
{"i": [["[\"fused_bert_add_layer_norm_variance\", 1, 128, 12, 64]", "cuda -keys=cuda,gpu -max_num_threads=1024 -model=unknown -thread_warp_size=32", [-1, 16, 64, 49152, 2147483647, 1024, 8, 32], "", 0, []], [[], [["SP", 2, 0, 128, [64], 1], ["AN", 2, 0, 5], ["AN", 2, 1, 6], ["PR", 2, 0, "auto_unroll_max_step$64"]]]], "r": [[0.000245801, 0.000245804, 0.000245773, 0.000245767, 0.000245769, 0.000245766, 0.000245771, 0.000245765, 0.000245769, 0.000245768], 0, 210.056, 1657301005], "v": "v0.6"}
{"i": [["[\"fused_bert_add_layer_norm_variance\", 1, 128, 12, 64]", "cuda -keys=cuda,gpu -max_num_threads=1024 -model=unknown -thread_warp_size=32", [-1, 16, 64, 49152, 2147483647, 1024, 8, 32], "", 0, []], [[], [["SP", 2, 0, 128, [16], 1], ["AN", 2, 0, 5], ["AN", 2, 1, 6], ["PR", 2, 0, "auto_unroll_max_step$64"]]]], "r": [[0.000223972, 0.000223961, 0.00022399, 0.000223988, 0.000224003, 0.000224013, 0.000223982, 0.00022398, 0.000223981, 0.000223977], 0, 210.016, 1657301011], "v": "v0.6"}
{"i": [["[\"fused_bert_add_layer_norm_variance\", 1, 128, 12, 64]", "cuda -keys=cuda,gpu -max_num_threads=1024 -model=unknown -thread_warp_size=32", [-1, 16, 64, 49152, 2147483647, 1024, 8, 32], "", 0, []], [[], [["SP", 2, 1, 768, [6], 1], ["AN", 2, 2, 6], ["AN", 2, 0, 5], ["PR", 2, 0, "auto_unroll_max_step$16"]]]], "r": [[4.27883e-05, 4.27881e-05, 4.27887e-05, 4.27892e-05, 4.27888e-05, 4.27894e-05, 4.27891e-05, 4.27884e-05, 4.2789e-05, 4.27887e-05], 0, 209.544, 1657301016], "v": "v0.6"}
{"i": [["[\"fused_bert_add_layer_norm_variance\", 1, 128, 12, 64]", "cuda -keys=cuda,gpu -max_num_threads=1024 -model=unknown -thread_warp_size=32", [-1, 16, 64, 49152, 2147483647, 1024, 8, 32], "", 0, []], [[], [["SP", 2, 0, 128, [1], 1], ["AN", 2, 0, 5], ["AN", 2, 1, 6], ["PR", 2, 0, "auto_unroll_max_step$1024"]]]], "r": [[0.00036886, 0.000368933, 0.00036872, 0.000368777, 0.000368701, 0.00036876, 0.000368834, 0.000369072, 0.000369274, 0.000369306], 0, 210.611, 1657301021], "v": "v0.6"}
{"i": [["[\"fused_bert_add_layer_norm_variance\", 1, 128, 12, 64]", "cuda -keys=cuda,gpu -max_num_threads=1024 -model=unknown -thread_warp_size=32", [-1, 16, 64, 49152, 2147483647, 1024, 8, 32], "", 0, []], [[], [["SP", 2, 1, 768, [6], 1], ["AN", 2, 2, 6], ["AN", 2, 0, 5], ["PR", 2, 0, "auto_unroll_max_step$64"]]]], "r": [[4.27917e-05, 4.27916e-05, 4.27934e-05, 4.27907e-05, 4.27908e-05, 4.27906e-05, 4.279e-05, 4.27919e-05, 4.27911e-05, 4.27901e-05], 0, 209.158, 1657301026], "v": "v0.6"}
{"i": [["[\"fused_bert_add_layer_norm_variance\", 1, 128, 12, 64]", "cuda -keys=cuda,gpu -max_num_threads=1024 -model=unknown -thread_warp_size=32", [-1, 16, 64, 49152, 2147483647, 1024, 8, 32], "", 0, []], [[], [["SP", 2, 0, 128, [8], 1], ["AN", 2, 0, 5], ["AN", 2, 1, 6], ["PR", 2, 0, "auto_unroll_max_step$16"]]]], "r": [[0.000214208, 0.000214222, 0.000214216, 0.000214209, 0.000214216, 0.000214215, 0.000214223, 0.000214214, 0.000214208, 0.000214212], 0, 208.442, 1657301032], "v": "v0.6"}
{"i": [["[\"fused_bert_add_layer_norm_variance\", 1, 128, 12, 64]", "cuda -keys=cuda,gpu -max_num_threads=1024 -model=unknown -thread_warp_size=32", [-1, 16, 64, 49152, 2147483647, 1024, 8, 32], "", 0, []], [[], [["SP", 2, 0, 128, [4], 1], ["AN", 2, 0, 5], ["AN", 2, 1, 6], ["PR", 2, 0, "auto_unroll_max_step$0"]]]], "r": [[0.00020967, 0.000209674, 0.000209669, 0.000209674, 0.00020968, 0.000209679, 0.000209678, 0.000209671, 0.000209676, 0.00020967], 0, 208.593, 1657301037], "v": "v0.6"}
{"i": [["[\"fused_bert_add_layer_norm_variance\", 1, 128, 12, 64]", "cuda -keys=cuda,gpu -max_num_threads=1024 -model=unknown -thread_warp_size=32", [-1, 16, 64, 49152, 2147483647, 1024, 8, 32], "", 0, []], [[], [["SP", 2, 0, 128, [16], 1], ["AN", 2, 0, 5], ["AN", 2, 1, 6], ["PR", 2, 0, "auto_unroll_max_step$1024"]]]], "r": [[0.000223996, 0.000224021, 0.000224041, 0.000224038, 0.000224027, 0.000224022, 0.000224011, 0.000223997, 0.000224027, 0.000224039], 0, 209.08, 1657301043], "v": "v0.6"}
{"i": [["[\"fused_bert_add_layer_norm_variance\", 1, 128, 12, 64]", "cuda -keys=cuda,gpu -max_num_threads=1024 -model=unknown -thread_warp_size=32", [-1, 16, 64, 49152, 2147483647, 1024, 8, 32], "", 0, []], [[], [["SP", 2, 0, 128, [64], 1], ["AN", 2, 0, 5], ["AN", 2, 1, 6], ["PR", 2, 0, "auto_unroll_max_step$0"]]]], "r": [[0.000245795, 0.000245787, 0.000245783, 0.00024579, 0.000245789, 0.000245787, 0.000245784, 0.000245783, 0.000245785, 0.000245786], 0, 209.741, 1657301048], "v": "v0.6"}
{"i": [["[\"fused_bert_add_layer_norm_variance\", 1, 128, 12, 64]", "cuda -keys=cuda,gpu -max_num_threads=1024 -model=unknown -thread_warp_size=32", [-1, 16, 64, 49152, 2147483647, 1024, 8, 32], "", 0, []], [[], [["SP", 2, 0, 128, [64], 1], ["AN", 2, 0, 5], ["AN", 2, 1, 6], ["PR", 2, 0, "auto_unroll_max_step$512"]]]], "r": [[0.000245875, 0.000245873, 0.000245874, 0.000245873, 0.000245876, 0.000245869, 0.000245875, 0.000245876, 0.000245871, 0.000245876], 0, 210.598, 1657301054], "v": "v0.6"}
{"i": [["[\"fused_bert_add_layer_norm_variance\", 1, 128, 12, 64]", "cuda -keys=cuda,gpu -max_num_threads=1024 -model=unknown -thread_warp_size=32", [-1, 16, 64, 49152, 2147483647, 1024, 8, 32], "", 0, []], [[], [["SP", 2, 1, 768, [4], 1], ["AN", 2, 2, 6], ["AN", 2, 0, 5], ["PR", 2, 0, "auto_unroll_max_step$512"]]]], "r": [[5.93126e-05, 5.93122e-05, 5.9314e-05, 5.93158e-05, 5.93193e-05, 5.93148e-05, 5.93149e-05, 5.9318e-05, 5.93179e-05, 5.93118e-05], 0, 210.449, 1657301059], "v": "v0.6"}
{"i": [["[\"fused_bert_add_layer_norm_variance\", 1, 128, 12, 64]", "cuda -keys=cuda,gpu -max_num_threads=1024 -model=unknown -thread_warp_size=32", [-1, 16, 64, 49152, 2147483647, 1024, 8, 32], "", 0, []], [[], [["SP", 2, 1, 768, [2], 1], ["AN", 2, 2, 6], ["AN", 2, 0, 5], ["PR", 2, 0, "auto_unroll_max_step$16"]]]], "r": [[0.0001089, 0.000108907, 0.000108908, 0.000108912, 0.000108913, 0.00010891, 0.000108908, 0.00010891, 0.000108911, 0.000108912], 0, 210.509, 1657301064], "v": "v0.6"}
{"i": [["[\"fused_bert_add_layer_norm_variance\", 1, 128, 12, 64]", "cuda -keys=cuda,gpu -max_num_threads=1024 -model=unknown -thread_warp_size=32", [-1, 16, 64, 49152, 2147483647, 1024, 8, 32], "", 0, []], [[], [["SP", 2, 1, 768, [32], 1], ["AN", 2, 2, 6], ["AN", 2, 0, 5], ["PR", 2, 0, "auto_unroll_max_step$16"]]]], "r": [[1.24116e-05, 1.24116e-05, 1.24109e-05, 1.24116e-05, 1.24112e-05, 1.24113e-05, 1.24111e-05, 1.24119e-05, 1.24112e-05, 1.24117e-05], 0, 209.845, 1657301069], "v": "v0.6"}
{"i": [["[\"fused_bert_add_layer_norm_variance\", 1, 128, 12, 64]", "cuda -keys=cuda,gpu -max_num_threads=1024 -model=unknown -thread_warp_size=32", [-1, 16, 64, 49152, 2147483647, 1024, 8, 32], "", 0, []], [[], [["SP", 2, 1, 768, [6], 1], ["AN", 2, 2, 6], ["AN", 2, 0, 5], ["PR", 2, 0, "auto_unroll_max_step$1024"]]]], "r": [[4.29978e-05, 4.29888e-05, 4.29664e-05, 4.29807e-05, 4.29862e-05, 4.29943e-05, 4.30027e-05, 4.30195e-05, 4.30289e-05, 4.3027e-05], 0, 210.397, 1657301074], "v": "v0.6"}
{"i": [["[\"fused_bert_add_layer_norm_variance\", 1, 128, 12, 64]", "cuda -keys=cuda,gpu -max_num_threads=1024 -model=unknown -thread_warp_size=32", [-1, 16, 64, 49152, 2147483647, 1024, 8, 32], "", 0, []], [[], [["SP", 2, 1, 768, [2], 1], ["AN", 2, 2, 6], ["AN", 2, 0, 5], ["PR", 2, 0, "auto_unroll_max_step$1024"]]]], "r": [[0.00010881, 0.00010881, 0.00010881, 0.000108811, 0.00010881, 0.00010881, 0.00010881, 0.00010881, 0.00010881, 0.00010881], 0, 210.453, 1657301080], "v": "v0.6"}
{"i": [["[\"fused_bert_add_layer_norm_variance\", 1, 128, 12, 64]", "cuda -keys=cuda,gpu -max_num_threads=1024 -model=unknown -thread_warp_size=32", [-1, 16, 64, 49152, 2147483647, 1024, 8, 32], "", 0, []], [[], [["SP", 2, 0, 128, [8], 1], ["AN", 2, 0, 5], ["AN", 2, 1, 6], ["PR", 2, 0, "auto_unroll_max_step$64"]]]], "r": [[0.000214273, 0.000214313, 0.000214318, 0.000214323, 0.000214318, 0.000214324, 0.000214322, 0.000214325, 0.000214325, 0.000214323], 0, 210.757, 1657301085], "v": "v0.6"}
{"i": [["[\"fused_bert_add_layer_norm_variance\", 1, 128, 12, 64]", "cuda -keys=cuda,gpu -max_num_threads=1024 -model=unknown -thread_warp_size=32", [-1, 16, 64, 49152, 2147483647, 1024, 8, 32], "", 0, []], [[], [["SP", 2, 1, 768, [12], 1], ["AN", 2, 2, 6], ["AN", 2, 0, 5], ["PR", 2, 0, "auto_unroll_max_step$1024"]]]], "r": [[2.63143e-05, 2.63136e-05, 2.6314e-05, 2.63138e-05, 2.6314e-05, 2.63136e-05, 2.63139e-05, 2.63156e-05, 2.63151e-05, 2.63153e-05], 0, 210.471, 1657301090], "v": "v0.6"}
{"i": [["[\"fused_bert_add_layer_norm_variance\", 1, 128, 12, 64]", "cuda -keys=cuda,gpu -max_num_threads=1024 -model=unknown -thread_warp_size=32", [-1, 16, 64, 49152, 2147483647, 1024, 8, 32], "", 0, []], [[], [["SP", 2, 0, 128, [32], 1], ["AN", 2, 0, 5], ["AN", 2, 1, 6], ["PR", 2, 0, "auto_unroll_max_step$16"]]]], "r": [[0.000243623, 0.000243609, 0.0002436, 0.000243599, 0.000243601, 0.000243601, 0.000243606, 0.000243609, 0.000243609, 0.000243608], 0, 210.388, 1657301096], "v": "v0.6"}
{"i": [["[\"fused_bert_add_layer_norm_variance\", 1, 128, 12, 64]", "cuda -keys=cuda,gpu -max_num_threads=1024 -model=unknown -thread_warp_size=32", [-1, 16, 64, 49152, 2147483647, 1024, 8, 32], "", 0, []], [[], [["SP", 2, 0, 128, [1], 1], ["AN", 2, 0, 5], ["AN", 2, 1, 6], ["PR", 2, 0, "auto_unroll_max_step$512"]]]], "r": [[0.000369085, 0.000368999, 0.000368967, 0.000368848, 0.000368792, 0.000369064, 0.000369119, 0.000369151, 0.000368889, 0.000368916], 0, 210.768, 1657301101], "v": "v0.6"}
{"i": [["[\"fused_bert_add_layer_norm_variance\", 1, 128, 12, 64]", "cuda -keys=cuda,gpu -max_num_threads=1024 -model=unknown -thread_warp_size=32", [-1, 16, 64, 49152, 2147483647, 1024, 8, 32], "", 0, []], [[], [["SP", 2, 1, 768, [4], 1], ["AN", 2, 2, 6], ["AN", 2, 0, 5], ["PR", 2, 0, "auto_unroll_max_step$1024"]]]], "r": [[5.9426e-05, 5.94327e-05, 5.94329e-05, 5.943e-05, 5.94293e-05, 5.9427e-05, 5.94304e-05, 5.94247e-05, 5.94308e-05, 5.94302e-05], 0, 210.589, 1657301106], "v": "v0.6"}
{"i": [["[\"fused_bert_add_layer_norm_variance\", 1, 128, 12, 64]", "cuda -keys=cuda,gpu -max_num_threads=1024 -model=unknown -thread_warp_size=32", [-1, 16, 64, 49152, 2147483647, 1024, 8, 32], "", 0, []], [[], [["SP", 2, 1, 768, [64], 1], ["AN", 2, 2, 6], ["AN", 2, 0, 5], ["PR", 2, 0, "auto_unroll_max_step$0"]]]], "r": [[8.03757e-06, 8.03749e-06, 8.03711e-06, 8.03715e-06, 8.03816e-06, 8.03772e-06, 8.0376e-06, 8.03741e-06, 8.03728e-06, 8.03759e-06], 0, 45.5386, 1657301156], "v": "v0.6"}
{"i": [["[\"fused_bert_add_layer_norm_variance\", 1, 128, 12, 64]", "cuda -keys=cuda,gpu -max_num_threads=1024 -model=unknown -thread_warp_size=32", [-1, 16, 64, 49152, 2147483647, 1024, 8, 32], "", 0, []], [[], [["SP", 2, 0, 128, [2], 1], ["AN", 2, 0, 5], ["AN", 2, 1, 6], ["PR", 2, 0, "auto_unroll_max_step$0"]]]], "r": [[0.000212152, 0.000212483, 0.000212046, 0.000213332, 0.000213815, 0.000213999, 0.000212291, 0.00021211, 0.000211825, 0.000213299], 0, 102.244, 1657301213], "v": "v0.6"}
{"i": [["[\"fused_bert_add_layer_norm_variance\", 1, 128, 12, 64]", "cuda -keys=cuda,gpu -max_num_threads=1024 -model=unknown -thread_warp_size=32", [-1, 16, 64, 49152, 2147483647, 1024, 8, 32], "", 0, []], [[], [["SP", 2, 0, 128, [64], 1], ["AN", 2, 0, 5], ["AN", 2, 1, 6], ["PR", 2, 0, "auto_unroll_max_step$1024"]]]], "r": [[0.000245789, 0.000245788, 0.000245789, 0.000245788, 0.000245788, 0.000245787, 0.000245789, 0.000245787, 0.000245787, 0.000245786], 0, 11.1709, 1657301122], "v": "v0.6"}
{"i": [["[\"fused_bert_add_layer_norm_variance\", 1, 128, 12, 64]", "cuda -keys=cuda,gpu -max_num_threads=1024 -model=unknown -thread_warp_size=32", [-1, 16, 64, 49152, 2147483647, 1024, 8, 32], "", 0, []], [[], [["SP", 2, 1, 768, [64], 1], ["AN", 2, 2, 6], ["AN", 2, 0, 5], ["PR", 2, 0, "auto_unroll_max_step$16"]]]], "r": [[7.91212e-06, 7.90767e-06, 7.9081e-06, 7.90825e-06, 7.90905e-06, 7.90618e-06, 7.90852e-06, 7.90607e-06, 7.90741e-06, 7.91136e-06], 0, 20.9073, 1657301131], "v": "v0.6"}
{"i": [["[\"fused_bert_add_layer_norm_variance\", 1, 128, 12, 64]", "cuda -keys=cuda,gpu -max_num_threads=1024 -model=unknown -thread_warp_size=32", [-1, 16, 64, 49152, 2147483647, 1024, 8, 32], "", 0, []], [[], [["SP", 2, 0, 128, [8], 1], ["AN", 2, 0, 5], ["AN", 2, 1, 6], ["PR", 2, 0, "auto_unroll_max_step$512"]]]], "r": [[0.000214281, 0.000214281, 0.000214283, 0.000214282, 0.000214281, 0.00021428, 0.00021429, 0.000214295, 0.000214295, 0.000214294], 0, 71.0725, 1657301182], "v": "v0.6"}
{"i": [["[\"fused_bert_add_layer_norm_variance\", 1, 128, 12, 64]", "cuda -keys=cuda,gpu -max_num_threads=1024 -model=unknown -thread_warp_size=32", [-1, 16, 64, 49152, 2147483647, 1024, 8, 32], "", 0, []], [[], [["SP", 2, 1, 768, [2], 1], ["AN", 2, 2, 6], ["AN", 2, 0, 5], ["PR", 2, 0, "auto_unroll_max_step$64"]]]], "r": [[0.000108845, 0.000108851, 0.000108848, 0.000108848, 0.000108847, 0.000108846, 0.000108842, 0.000108843, 0.000108856, 0.000108856], 0, 31.4552, 1657301142], "v": "v0.6"}
{"i": [["[\"fused_bert_add_layer_norm_variance\", 1, 128, 12, 64]", "cuda -keys=cuda,gpu -max_num_threads=1024 -model=unknown -thread_warp_size=32", [-1, 16, 64, 49152, 2147483647, 1024, 8, 32], "", 0, []], [[], [["SP", 2, 1, 768, [3], 1], ["AN", 2, 2, 6], ["AN", 2, 0, 5], ["PR", 2, 0, "auto_unroll_max_step$1024"]]]], "r": [[7.57893e-05, 7.57904e-05, 7.57911e-05, 7.57908e-05, 7.57908e-05, 7.57906e-05, 7.57908e-05, 7.57908e-05, 7.57911e-05, 7.57903e-05], 0, 5.873, 1657301116], "v": "v0.6"}
{"i": [["[\"fused_bert_add_layer_norm_variance\", 1, 128, 12, 64]", "cuda -keys=cuda,gpu -max_num_threads=1024 -model=unknown -thread_warp_size=32", [-1, 16, 64, 49152, 2147483647, 1024, 8, 32], "", 0, []], [[], [["SP", 2, 1, 768, [12], 1], ["AN", 2, 2, 6], ["AN", 2, 0, 5], ["PR", 2, 0, "auto_unroll_max_step$0"]]]], "r": [[2.65059e-05, 2.6498e-05, 2.64957e-05, 2.65015e-05, 2.6504e-05, 2.65015e-05, 2.65085e-05, 2.65103e-05, 2.65091e-05, 2.65099e-05], 0, 16.4097, 1657301127], "v": "v0.6"}
{"i": [["[\"fused_bert_add_layer_norm_variance\", 1, 128, 12, 64]", "cuda -keys=cuda,gpu -max_num_threads=1024 -model=unknown -thread_warp_size=32", [-1, 16, 64, 49152, 2147483647, 1024, 8, 32], "", 0, []], [[], [["SP", 2, 1, 768, [6], 1], ["AN", 2, 2, 6], ["AN", 2, 0, 5], ["PR", 2, 0, "auto_unroll_max_step$0"]]]], "r": [[4.28027e-05, 4.28041e-05, 4.28028e-05, 4.28015e-05, 4.28011e-05, 4.28e-05, 4.28016e-05, 4.28021e-05, 4.28014e-05, 4.27991e-05], 0, 26.0221, 1657301136], "v": "v0.6"}
{"i": [["[\"fused_bert_add_layer_norm_variance\", 1, 128, 12, 64]", "cuda -keys=cuda,gpu -max_num_threads=1024 -model=unknown -thread_warp_size=32", [-1, 16, 64, 49152, 2147483647, 1024, 8, 32], "", 0, []], [[], [["SP", 2, 1, 768, [16], 1], ["AN", 2, 2, 6], ["AN", 2, 0, 5], ["PR", 2, 0, "auto_unroll_max_step$64"]]]], "r": [[2.23109e-05, 2.2311e-05, 2.23094e-05, 2.23114e-05, 2.23131e-05, 2.23135e-05, 2.2311e-05, 2.23106e-05, 2.23112e-05, 2.23117e-05], 0, 36.5497, 1657301147], "v": "v0.6"}
{"i": [["[\"fused_bert_add_layer_norm_variance\", 1, 128, 12, 64]", "cuda -keys=cuda,gpu -max_num_threads=1024 -model=unknown -thread_warp_size=32", [-1, 16, 64, 49152, 2147483647, 1024, 8, 32], "", 0, []], [[], [["SP", 2, 1, 768, [48], 1], ["AN", 2, 2, 6], ["AN", 2, 0, 5], ["PR", 2, 0, "auto_unroll_max_step$1024"]]]], "r": [[9.44875e-06, 9.44899e-06, 9.44887e-06, 9.449e-06, 9.44896e-06, 9.44908e-06, 9.449e-06, 9.44892e-06, 9.44891e-06, 9.44892e-06], 0, 40.9742, 1657301151], "v": "v0.6"}
{"i": [["[\"fused_bert_add_layer_norm_variance\", 1, 128, 12, 64]", "cuda -keys=cuda,gpu -max_num_threads=1024 -model=unknown -thread_warp_size=32", [-1, 16, 64, 49152, 2147483647, 1024, 8, 32], "", 0, []], [[], [["SP", 2, 1, 768, [4], 1], ["AN", 2, 2, 6], ["AN", 2, 0, 5], ["PR", 2, 0, "auto_unroll_max_step$64"]]]], "r": [[5.95224e-05, 5.95226e-05, 5.95222e-05, 5.95239e-05, 5.95241e-05, 5.95229e-05, 5.95226e-05, 5.95225e-05, 5.95223e-05, 5.95232e-05], 0, 55.5536, 1657301166], "v": "v0.6"}
{"i": [["[\"fused_bert_add_layer_norm_variance\", 1, 128, 12, 64]", "cuda -keys=cuda,gpu -max_num_threads=1024 -model=unknown -thread_warp_size=32", [-1, 16, 64, 49152, 2147483647, 1024, 8, 32], "", 0, []], [[], [["SP", 2, 0, 128, [16], 1], ["AN", 2, 0, 5], ["AN", 2, 1, 6], ["PR", 2, 0, "auto_unroll_max_step$0"]]]], "r": [[0.000224136, 0.000224126, 0.000224147, 0.000224171, 0.000224174, 0.000224159, 0.00022417, 0.000224175, 0.000224174, 0.000224173], 0, 81.6582, 1657301192], "v": "v0.6"}
{"i": [["[\"fused_bert_add_layer_norm_variance\", 1, 128, 12, 64]", "cuda -keys=cuda,gpu -max_num_threads=1024 -model=unknown -thread_warp_size=32", [-1, 16, 64, 49152, 2147483647, 1024, 8, 32], "", 0, []], [[], [["SP", 2, 1, 768, [24], 1], ["AN", 2, 2, 6], ["AN", 2, 0, 5], ["PR", 2, 0, "auto_unroll_max_step$64"]]]], "r": [[1.58088e-05, 1.58091e-05, 1.58088e-05, 1.58091e-05, 1.58089e-05, 1.58089e-05, 1.58089e-05, 1.58088e-05, 1.5809e-05, 1.58087e-05], 0, 60.5724, 1657301171], "v": "v0.6"}
{"i": [["[\"fused_bert_add_layer_norm_variance\", 1, 128, 12, 64]", "cuda -keys=cuda,gpu -max_num_threads=1024 -model=unknown -thread_warp_size=32", [-1, 16, 64, 49152, 2147483647, 1024, 8, 32], "", 0, []], [[], [["SP", 2, 0, 128, [16], 1], ["AN", 2, 0, 5], ["AN", 2, 1, 6], ["PR", 2, 0, "auto_unroll_max_step$512"]]]], "r": [[0.000224121, 0.000224151, 0.000224184, 0.00022418, 0.000224191, 0.000224182, 0.000224194, 0.000224181, 0.000224195, 0.000224179], 0, 138.391, 1657301249], "v": "v0.6"}
{"i": [["[\"fused_bert_add_layer_norm_variance\", 1, 128, 12, 64]", "cuda -keys=cuda,gpu -max_num_threads=1024 -model=unknown -thread_warp_size=32", [-1, 16, 64, 49152, 2147483647, 1024, 8, 32], "", 0, []], [[], [["SP", 2, 1, 768, [16], 1], ["AN", 2, 2, 6], ["AN", 2, 0, 5], ["PR", 2, 0, "auto_unroll_max_step$0"]]]], "r": [[2.23245e-05, 2.23206e-05, 2.2322e-05, 2.23241e-05, 2.23252e-05, 2.23242e-05, 2.23246e-05, 2.23234e-05, 2.23235e-05, 2.2321e-05], 0, 111.967, 1657301222], "v": "v0.6"}
{"i": [["[\"fused_bert_add_layer_norm_variance\", 1, 128, 12, 64]", "cuda -keys=cuda,gpu -max_num_threads=1024 -model=unknown -thread_warp_size=32", [-1, 16, 64, 49152, 2147483647, 1024, 8, 32], "", 0, []], [[], [["SP", 2, 1, 768, [3], 1], ["AN", 2, 2, 6], ["AN", 2, 0, 5], ["PR", 2, 0, "auto_unroll_max_step$0"]]]], "r": [[7.58925e-05, 7.58927e-05, 7.58895e-05, 7.58907e-05, 7.58901e-05, 7.58914e-05, 7.58885e-05, 7.58859e-05, 7.58901e-05, 7.5886e-05], 0, 122.404, 1657301233], "v": "v0.6"}
{"i": [["[\"fused_bert_add_layer_norm_variance\", 1, 128, 12, 64]", "cuda -keys=cuda,gpu -max_num_threads=1024 -model=unknown -thread_warp_size=32", [-1, 16, 64, 49152, 2147483647, 1024, 8, 32], "", 0, []], [[], [["SP", 2, 0, 128, [1], 1], ["AN", 2, 0, 5], ["AN", 2, 1, 6], ["PR", 2, 0, "auto_unroll_max_step$16"]]]], "r": [[0.000369242, 0.000369238, 0.000369247, 0.000369139, 0.000369191, 0.00036908, 0.000369117, 0.000369094, 0.000369047, 0.000369024], 0, 154.531, 1657301265], "v": "v0.6"}
{"i": [["[\"fused_bert_add_layer_norm_variance\", 1, 128, 12, 64]", "cuda -keys=cuda,gpu -max_num_threads=1024 -model=unknown -thread_warp_size=32", [-1, 16, 64, 49152, 2147483647, 1024, 8, 32], "", 0, []], [[], [["SP", 2, 1, 768, [12], 1], ["AN", 2, 2, 6], ["AN", 2, 0, 5], ["PR", 2, 0, "auto_unroll_max_step$16"]]]], "r": [[2.65912e-05, 2.65895e-05, 2.65892e-05, 2.6589e-05, 2.65895e-05, 2.65888e-05, 2.65893e-05, 2.65888e-05, 2.65893e-05, 2.65888e-05], 0, 76.2756, 1657301187], "v": "v0.6"}
{"i": [["[\"fused_bert_add_layer_norm_variance\", 1, 128, 12, 64]", "cuda -keys=cuda,gpu -max_num_threads=1024 -model=unknown -thread_warp_size=32", [-1, 16, 64, 49152, 2147483647, 1024, 8, 32], "", 0, []], [[], [["SP", 2, 1, 768, [64], 1], ["AN", 2, 2, 6], ["AN", 2, 0, 5], ["PR", 2, 0, "auto_unroll_max_step$512"]]]], "r": [[7.85542e-06, 7.85266e-06, 7.85634e-06, 7.85306e-06, 7.85328e-06, 7.84829e-06, 7.84944e-06, 7.85054e-06, 7.85029e-06, 7.8478e-06], 0, 106.79, 1657301217], "v": "v0.6"}
{"i": [["[\"fused_bert_add_layer_norm_variance\", 1, 128, 12, 64]", "cuda -keys=cuda,gpu -max_num_threads=1024 -model=unknown -thread_warp_size=32", [-1, 16, 64, 49152, 2147483647, 1024, 8, 32], "", 0, []], [[], [["SP", 2, 1, 768, [12], 1], ["AN", 2, 2, 6], ["AN", 2, 0, 5], ["PR", 2, 0, "auto_unroll_max_step$512"]]]], "r": [[2.66129e-05, 2.66117e-05, 2.66119e-05, 2.66122e-05, 2.66127e-05, 2.66129e-05, 2.66114e-05, 2.66118e-05, 2.66119e-05, 2.66116e-05], 0, 133.015, 1657301244], "v": "v0.6"}
{"i": [["[\"fused_bert_add_layer_norm_variance\", 1, 128, 12, 64]", "cuda -keys=cuda,gpu -max_num_threads=1024 -model=unknown -thread_warp_size=32", [-1, 16, 64, 49152, 2147483647, 1024, 8, 32], "", 0, []], [[], [["SP", 2, 1, 768, [64], 1], ["AN", 2, 2, 6], ["AN", 2, 0, 5], ["PR", 2, 0, "auto_unroll_max_step$1024"]]]], "r": [[7.98917e-06, 7.98546e-06, 7.98699e-06, 7.98557e-06, 7.98502e-06, 7.98703e-06, 7.9889e-06, 7.98796e-06, 7.98705e-06, 7.98568e-06], 0, 96.9669, 1657301207], "v": "v0.6"}
{"i": [["[\"fused_bert_add_layer_norm_variance\", 1, 128, 12, 64]", "cuda -keys=cuda,gpu -max_num_threads=1024 -model=unknown -thread_warp_size=32", [-1, 16, 64, 49152, 2147483647, 1024, 8, 32], "", 0, []], [[], [["SP", 2, 0, 128, [16], 1], ["AN", 2, 0, 5], ["AN", 2, 1, 6], ["PR", 2, 0, "auto_unroll_max_step$16"]]]], "r": [[0.000224128, 0.000224126, 0.000224129, 0.000224128, 0.000224127, 0.000224124, 0.000224127, 0.000224124, 0.000224125, 0.000224124], 0, 160.04, 1657301271], "v": "v0.6"}
{"i": [["[\"fused_bert_add_layer_norm_variance\", 1, 128, 12, 64]", "cuda -keys=cuda,gpu -max_num_threads=1024 -model=unknown -thread_warp_size=32", [-1, 16, 64, 49152, 2147483647, 1024, 8, 32], "", 0, []], [[], [["SP", 2, 1, 768, [1], 1], ["AN", 2, 2, 6], ["AN", 2, 0, 5], ["PR", 2, 0, "auto_unroll_max_step$0"]]]], "r": [[0.000200298, 0.000200294, 0.000200295, 0.000200294, 0.000200294, 0.000200293, 0.000200293, 0.000200295, 0.000200294, 0.000200292], 0, 127.782, 1657301238], "v": "v0.6"}
{"i": [["[\"fused_bert_add_layer_norm_variance\", 1, 128, 12, 64]", "cuda -keys=cuda,gpu -max_num_threads=1024 -model=unknown -thread_warp_size=32", [-1, 16, 64, 49152, 2147483647, 1024, 8, 32], "", 0, []], [[], [["SP", 2, 1, 768, [8], 1], ["AN", 2, 2, 6], ["AN", 2, 0, 5], ["PR", 2, 0, "auto_unroll_max_step$0"]]]], "r": [[3.47271e-05, 3.47224e-05, 3.47296e-05, 3.47296e-05, 3.47286e-05, 3.47275e-05, 3.47279e-05, 3.47278e-05, 3.47301e-05, 3.47296e-05], 0, 65.6327, 1657301176], "v": "v0.6"}
{"i": [["[\"fused_bert_add_layer_norm_variance\", 1, 128, 12, 64]", "cuda -keys=cuda,gpu -max_num_threads=1024 -model=unknown -thread_warp_size=32", [-1, 16, 64, 49152, 2147483647, 1024, 8, 32], "", 0, []], [[], [["SP", 2, 1, 768, [24], 1], ["AN", 2, 2, 6], ["AN", 2, 0, 5], ["PR", 2, 0, "auto_unroll_max_step$512"]]]], "r": [[1.57571e-05, 1.57575e-05, 1.57574e-05, 1.57574e-05, 1.57577e-05, 1.57575e-05, 1.57577e-05, 1.57573e-05, 1.57579e-05, 1.57578e-05], 0, 50.3128, 1657301161], "v": "v0.6"}
{"i": [["[\"fused_bert_add_layer_norm_variance\", 1, 128, 12, 64]", "cuda -keys=cuda,gpu -max_num_threads=1024 -model=unknown -thread_warp_size=32", [-1, 16, 64, 49152, 2147483647, 1024, 8, 32], "", 0, []], [[], [["SP", 2, 1, 768, [3], 1], ["AN", 2, 2, 6], ["AN", 2, 0, 5], ["PR", 2, 0, "auto_unroll_max_step$16"]]]], "r": [[7.60388e-05, 7.60395e-05, 7.60381e-05, 7.60396e-05, 7.60388e-05, 7.60367e-05, 7.60395e-05, 7.60378e-05, 7.60383e-05, 7.60388e-05], 0, 116.992, 1657301228], "v": "v0.6"}
{"i": [["[\"fused_bert_add_layer_norm_variance\", 1, 128, 12, 64]", "cuda -keys=cuda,gpu -max_num_threads=1024 -model=unknown -thread_warp_size=32", [-1, 16, 64, 49152, 2147483647, 1024, 8, 32], "", 0, []], [[], [["SP", 2, 0, 128, [4], 1], ["AN", 2, 0, 5], ["AN", 2, 1, 6], ["PR", 2, 0, "auto_unroll_max_step$16"]]]], "r": [[0.000209846, 0.00020985, 0.00020985, 0.000209851, 0.000209851, 0.000209851, 0.000209851, 0.000209852, 0.00020985, 0.00020985], 0, 143.742, 1657301254], "v": "v0.6"}
{"i": [["[\"fused_bert_add_layer_norm_variance\", 1, 128, 12, 64]", "cuda -keys=cuda,gpu -max_num_threads=1024 -model=unknown -thread_warp_size=32", [-1, 16, 64, 49152, 2147483647, 1024, 8, 32], "", 0, []], [[], [["SP", 2, 0, 128, [4], 1], ["AN", 2, 0, 5], ["AN", 2, 1, 6], ["PR", 2, 0, "auto_unroll_max_step$64"]]]], "r": [[0.000209628, 0.000209621, 0.000209626, 0.000209628, 0.000209629, 0.000209629, 0.000209631, 0.000209628, 0.000209629, 0.000209629], 0, 92.4833, 1657301203], "v": "v0.6"}
{"i": [["[\"fused_bert_add_layer_norm_variance\", 1, 128, 12, 64]", "cuda -keys=cuda,gpu -max_num_threads=1024 -model=unknown -thread_warp_size=32", [-1, 16, 64, 49152, 2147483647, 1024, 8, 32], "", 0, []], [[], [["SP", 2, 1, 768, [2], 1], ["AN", 2, 2, 6], ["AN", 2, 0, 5], ["PR", 2, 0, "auto_unroll_max_step$512"]]]], "r": [[0.000108848, 0.000108847, 0.000108845, 0.000108849, 0.000108848, 0.000108847, 0.000108846, 0.000108844, 0.000108847, 0.000108848], 0, 149.135, 1657301260], "v": "v0.6"}
{"i": [["[\"fused_bert_add_layer_norm_variance\", 1, 128, 12, 64]", "cuda -keys=cuda,gpu -max_num_threads=1024 -model=unknown -thread_warp_size=32", [-1, 16, 64, 49152, 2147483647, 1024, 8, 32], "", 0, []], [[], [["SP", 2, 0, 128, [2], 1], ["AN", 2, 0, 5], ["AN", 2, 1, 6], ["PR", 2, 0, "auto_unroll_max_step$512"]]]], "r": [[0.000212711, 0.0002135, 0.000214984, 0.000212457, 0.000213183, 0.000214238, 0.000214998, 0.000216032, 0.000214258, 0.0002143], 0, 87.0467, 1657301198], "v": "v0.6"}
