python/models/efficientnet/VertiFusionEfficientNet_kernel_configs/efficient_mul_1_1_1_144.log
{"i": [["[\"mul\", 1, 1, 1, 144]", "cuda -keys=cuda,gpu -max_num_threads=1024 -model=unknown -thread_warp_size=32", [-1, 16, 64, 49152, 2147483647, 1024, 8, 32], "", 0, []], [[], [["FU", 2, [0, 1, 2, 3]], ["SP", 2, 0, 144, [36], 1], ["AN", 2, 0, 5], ["AN", 2, 1, 6]]]], "r": [[2.59522e-06, 2.59086e-06, 2.6121e-06], 0, 0.56862, 1667925736], "v": "v0.6"}
{"i": [["[\"mul\", 1, 1, 1, 144]", "cuda -keys=cuda,gpu -max_num_threads=1024 -model=unknown -thread_warp_size=32", [-1, 16, 64, 49152, 2147483647, 1024, 8, 32], "", 0, []], [[], [["FU", 2, [0, 1, 2, 3]], ["SP", 2, 0, 144, [9], 1], ["AN", 2, 0, 5], ["AN", 2, 1, 6]]]], "r": [[2.45852e-06, 2.45418e-06, 2.46056e-06], 0, 1.12468, 1667925737], "v": "v0.6"}
{"i": [["[\"mul\", 1, 1, 1, 144]", "cuda -keys=cuda,gpu -max_num_threads=1024 -model=unknown -thread_warp_size=32", [-1, 16, 64, 49152, 2147483647, 1024, 8, 32], "", 0, []], [[], [["FU", 2, [0, 1, 2, 3]], ["SP", 2, 0, 144, [18], 1], ["AN", 2, 0, 5], ["AN", 2, 1, 6]]]], "r": [[2.43359e-06, 2.43779e-06, 2.43523e-06], 0, 1.36312, 1667925737], "v": "v0.6"}
{"i": [["[\"mul\", 1, 1, 1, 144]", "cuda -keys=cuda,gpu -max_num_threads=1024 -model=unknown -thread_warp_size=32", [-1, 16, 64, 49152, 2147483647, 1024, 8, 32], "", 0, []], [[], [["FU", 2, [0, 1, 2, 3]], ["SP", 2, 0, 144, [3], 1], ["AN", 2, 0, 5], ["AN", 2, 1, 6]]]], "r": [[2.60932e-06, 2.60355e-06, 2.60199e-06], 0, 0.843818, 1667925737], "v": "v0.6"}
{"i": [["[\"mul\", 1, 1, 1, 144]", "cuda -keys=cuda,gpu -max_num_threads=1024 -model=unknown -thread_warp_size=32", [-1, 16, 64, 49152, 2147483647, 1024, 8, 32], "", 0, []], [[], [["FU", 2, [0, 1, 2, 3]], ["SP", 2, 0, 144, [48], 1], ["AN", 2, 0, 5], ["AN", 2, 1, 6]]]], "r": [[2.40608e-06, 2.4188e-06, 2.41523e-06], 0, 2.02417, 1667925738], "v": "v0.6"}
{"i": [["[\"mul\", 1, 1, 1, 144]", "cuda -keys=cuda,gpu -max_num_threads=1024 -model=unknown -thread_warp_size=32", [-1, 16, 64, 49152, 2147483647, 1024, 8, 32], "", 0, []], [[], [["FU", 2, [0, 1, 2, 3]], ["SP", 2, 0, 144, [6], 1], ["AN", 2, 0, 5], ["AN", 2, 1, 6]]]], "r": [[2.59109e-06, 2.59729e-06, 2.61181e-06], 0, 2.20688, 1667925738], "v": "v0.6"}
{"i": [["[\"mul\", 1, 1, 1, 144]", "cuda -keys=cuda,gpu -max_num_threads=1024 -model=unknown -thread_warp_size=32", [-1, 16, 64, 49152, 2147483647, 1024, 8, 32], "", 0, []], [[], [["FU", 2, [0, 1, 2, 3]], ["SP", 2, 0, 144, [24], 1], ["AN", 2, 0, 5], ["AN", 2, 1, 6]]]], "r": [[2.48281e-06, 2.45808e-06, 2.46145e-06], 0, 1.72156, 1667925738], "v": "v0.6"}
{"i": [["[\"mul\", 1, 1, 1, 144]", "cuda -keys=cuda,gpu -max_num_threads=1024 -model=unknown -thread_warp_size=32", [-1, 16, 64, 49152, 2147483647, 1024, 8, 32], "", 0, []], [[], [["FU", 2, [0, 1, 2, 3]], ["SP", 2, 0, 144, [4], 1], ["AN", 2, 0, 5], ["AN", 2, 1, 6]]]], "r": [[2.48374e-06, 2.48174e-06, 2.47812e-06], 0, 2.52749, 1667925739], "v": "v0.6"}
{"i": [["[\"mul\", 1, 1, 1, 144]", "cuda -keys=cuda,gpu -max_num_threads=1024 -model=unknown -thread_warp_size=32", [-1, 16, 64, 49152, 2147483647, 1024, 8, 32], "", 0, []], [[], [["FU", 2, [0, 1, 2, 3]], ["SP", 2, 0, 144, [32], 1], ["AN", 2, 0, 5], ["AN", 2, 1, 6]]]], "r": [[2.44658e-06, 2.4503e-06, 2.44732e-06], 0, 2.83449, 1667925739], "v": "v0.6"}
{"i": [["[\"mul\", 1, 1, 1, 144]", "cuda -keys=cuda,gpu -max_num_threads=1024 -model=unknown -thread_warp_size=32", [-1, 16, 64, 49152, 2147483647, 1024, 8, 32], "", 0, []], [[], [["FU", 2, [0, 1, 2, 3]], ["SP", 2, 0, 144, [1], 1], ["AN", 2, 0, 5], ["AN", 2, 1, 6]]]], "r": [[2.55266e-06, 2.54744e-06, 2.54985e-06], 0, 3.0965, 1667925739], "v": "v0.6"}
{"i": [["[\"mul\", 1, 1, 1, 144]", "cuda -keys=cuda,gpu -max_num_threads=1024 -model=unknown -thread_warp_size=32", [-1, 16, 64, 49152, 2147483647, 1024, 8, 32], "", 0, []], [[], [["FU", 2, [0, 1, 2, 3]], ["SP", 2, 0, 144, [12], 1], ["AN", 2, 0, 5], ["AN", 2, 1, 6]]]], "r": [[2.42352e-06, 2.39992e-06, 2.40255e-06], 0, 3.38478, 1667925740], "v": "v0.6"}
{"i": [["[\"mul\", 1, 1, 1, 144]", "cuda -keys=cuda,gpu -max_num_threads=1024 -model=unknown -thread_warp_size=32", [-1, 16, 64, 49152, 2147483647, 1024, 8, 32], "", 0, []], [[], [["FU", 2, [0, 1, 2, 3]], ["SP", 2, 0, 144, [64], 1], ["AN", 2, 0, 5], ["AN", 2, 1, 6]]]], "r": [[2.61187e-06, 2.63189e-06, 2.62594e-06], 0, 3.65108, 1667925740], "v": "v0.6"}
{"i": [["[\"mul\", 1, 1, 1, 144]", "cuda -keys=cuda,gpu -max_num_threads=1024 -model=unknown -thread_warp_size=32", [-1, 16, 64, 49152, 2147483647, 1024, 8, 32], "", 0, []], [[], [["FU", 2, [0, 1, 2, 3]], ["SP", 2, 0, 144, [8], 1], ["AN", 2, 0, 5], ["AN", 2, 1, 6]]]], "r": [[2.56377e-06, 2.5851e-06, 2.58836e-06], 0, 3.88784, 1667925740], "v": "v0.6"}
{"i": [["[\"mul\", 1, 1, 1, 144]", "cuda -keys=cuda,gpu -max_num_threads=1024 -model=unknown -thread_warp_size=32", [-1, 16, 64, 49152, 2147483647, 1024, 8, 32], "", 0, []], [[], [["FU", 2, [0, 1, 2, 3]], ["SP", 2, 0, 144, [16], 1], ["AN", 2, 0, 5], ["AN", 2, 1, 6]]]], "r": [[2.43514e-06, 2.42725e-06, 2.43107e-06], 0, 4.22072, 1667925741], "v": "v0.6"}
{"i": [["[\"mul\", 1, 1, 1, 144]", "cuda -keys=cuda,gpu -max_num_threads=1024 -model=unknown -thread_warp_size=32", [-1, 16, 64, 49152, 2147483647, 1024, 8, 32], "", 0, []], [[], [["FU", 2, [0, 1, 2, 3]], ["SP", 2, 0, 144, [2], 1], ["AN", 2, 0, 5], ["AN", 2, 1, 6]]]], "r": [[2.61543e-06, 2.61692e-06, 2.61874e-06], 0, 4.48576, 1667925741], "v": "v0.6"}
{"i": [["[\"mul\", 1, 1, 1, 144]", "cuda -keys=cuda,gpu -max_num_threads=1024 -model=unknown -thread_warp_size=32", [-1, 16, 64, 49152, 2147483647, 1024, 8, 32], "", 0, []], [[], [["FU", 2, [0, 1, 2, 3]], ["SP", 2, 0, 144, [8], 1], ["AN", 2, 0, 5], ["AN", 2, 1, 6]]]], "r": [[2.62154e-06, 2.61428e-06, 2.62527e-06], 0, 0.898668, 1667926082], "v": "v0.6"}
{"i": [["[\"mul\", 1, 1, 1, 144]", "cuda -keys=cuda,gpu -max_num_threads=1024 -model=unknown -thread_warp_size=32", [-1, 16, 64, 49152, 2147483647, 1024, 8, 32], "", 0, []], [[], [["FU", 2, [0, 1, 2, 3]], ["SP", 2, 0, 144, [2], 1], ["AN", 2, 0, 5], ["AN", 2, 1, 6]]]], "r": [[2.54336e-06, 2.54588e-06, 2.54577e-06], 0, 0.616124, 1667926082], "v": "v0.6"}
{"i": [["[\"mul\", 1, 1, 1, 144]", "cuda -keys=cuda,gpu -max_num_threads=1024 -model=unknown -thread_warp_size=32", [-1, 16, 64, 49152, 2147483647, 1024, 8, 32], "", 0, []], [[], [["FU", 2, [0, 1, 2, 3]], ["SP", 2, 0, 144, [32], 1], ["AN", 2, 0, 5], ["AN", 2, 1, 6]]]], "r": [[2.47505e-06, 2.47353e-06, 2.47157e-06], 0, 1.76052, 1667926083], "v": "v0.6"}
{"i": [["[\"mul\", 1, 1, 1, 144]", "cuda -keys=cuda,gpu -max_num_threads=1024 -model=unknown -thread_warp_size=32", [-1, 16, 64, 49152, 2147483647, 1024, 8, 32], "", 0, []], [[], [["FU", 2, [0, 1, 2, 3]], ["SP", 2, 0, 144, [48], 1], ["AN", 2, 0, 5], ["AN", 2, 1, 6]]]], "r": [[2.41887e-06, 2.46803e-06, 2.45271e-06], 0, 1.99387, 1667926083], "v": "v0.6"}
{"i": [["[\"mul\", 1, 1, 1, 144]", "cuda -keys=cuda,gpu -max_num_threads=1024 -model=unknown -thread_warp_size=32", [-1, 16, 64, 49152, 2147483647, 1024, 8, 32], "", 0, []], [[], [["FU", 2, [0, 1, 2, 3]], ["SP", 2, 0, 144, [1], 1], ["AN", 2, 0, 5], ["AN", 2, 1, 6]]]], "r": [[2.70549e-06, 2.69537e-06, 2.72078e-06], 0, 1.42206, 1667926083], "v": "v0.6"}
{"i": [["[\"mul\", 1, 1, 1, 144]", "cuda -keys=cuda,gpu -max_num_threads=1024 -model=unknown -thread_warp_size=32", [-1, 16, 64, 49152, 2147483647, 1024, 8, 32], "", 0, []], [[], [["FU", 2, [0, 1, 2, 3]], ["SP", 2, 0, 144, [12], 1], ["AN", 2, 0, 5], ["AN", 2, 1, 6]]]], "r": [[2.60537e-06, 2.60501e-06, 2.62332e-06], 0, 1.21038, 1667926082], "v": "v0.6"}
{"i": [["[\"mul\", 1, 1, 1, 144]", "cuda -keys=cuda,gpu -max_num_threads=1024 -model=unknown -thread_warp_size=32", [-1, 16, 64, 49152, 2147483647, 1024, 8, 32], "", 0, []], [[], [["FU", 2, [0, 1, 2, 3]], ["SP", 2, 0, 144, [9], 1], ["AN", 2, 0, 5], ["AN", 2, 1, 6]]]], "r": [[2.61519e-06, 2.62658e-06, 2.64373e-06], 0, 2.1903, 1667926084], "v": "v0.6"}
{"i": [["[\"mul\", 1, 1, 1, 144]", "cuda -keys=cuda,gpu -max_num_threads=1024 -model=unknown -thread_warp_size=32", [-1, 16, 64, 49152, 2147483647, 1024, 8, 32], "", 0, []], [[], [["FU", 2, [0, 1, 2, 3]], ["SP", 2, 0, 144, [64], 1], ["AN", 2, 0, 5], ["AN", 2, 1, 6]]]], "r": [[2.42099e-06, 2.40489e-06, 2.40731e-06], 0, 2.78283, 1667926084], "v": "v0.6"}
{"i": [["[\"mul\", 1, 1, 1, 144]", "cuda -keys=cuda,gpu -max_num_threads=1024 -model=unknown -thread_warp_size=32", [-1, 16, 64, 49152, 2147483647, 1024, 8, 32], "", 0, []], [[], [["FU", 2, [0, 1, 2, 3]], ["SP", 2, 0, 144, [4], 1], ["AN", 2, 0, 5], ["AN", 2, 1, 6]]]], "r": [[2.47231e-06, 2.47136e-06, 2.44719e-06], 0, 2.4717, 1667926084], "v": "v0.6"}
{"i": [["[\"mul\", 1, 1, 1, 144]", "cuda -keys=cuda,gpu -max_num_threads=1024 -model=unknown -thread_warp_size=32", [-1, 16, 64, 49152, 2147483647, 1024, 8, 32], "", 0, []], [[], [["FU", 2, [0, 1, 2, 3]], ["SP", 2, 0, 144, [6], 1], ["AN", 2, 0, 5], ["AN", 2, 1, 6]]]], "r": [[2.48264e-06, 2.48423e-06, 2.47821e-06], 0, 3.02115, 1667926085], "v": "v0.6"}
{"i": [["[\"mul\", 1, 1, 1, 144]", "cuda -keys=cuda,gpu -max_num_threads=1024 -model=unknown -thread_warp_size=32", [-1, 16, 64, 49152, 2147483647, 1024, 8, 32], "", 0, []], [[], [["FU", 2, [0, 1, 2, 3]], ["SP", 2, 0, 144, [36], 1], ["AN", 2, 0, 5], ["AN", 2, 1, 6]]]], "r": [[2.50997e-06, 2.51092e-06, 2.55087e-06], 0, 3.32925, 1667926085], "v": "v0.6"}
{"i": [["[\"mul\", 1, 1, 1, 144]", "cuda -keys=cuda,gpu -max_num_threads=1024 -model=unknown -thread_warp_size=32", [-1, 16, 64, 49152, 2147483647, 1024, 8, 32], "", 0, []], [[], [["FU", 2, [0, 1, 2, 3]], ["SP", 2, 0, 144, [16], 1], ["AN", 2, 0, 5], ["AN", 2, 1, 6]]]], "r": [[2.62443e-06, 2.63079e-06, 2.65303e-06], 0, 3.54384, 1667926085], "v": "v0.6"}
{"i": [["[\"mul\", 1, 1, 1, 144]", "cuda -keys=cuda,gpu -max_num_threads=1024 -model=unknown -thread_warp_size=32", [-1, 16, 64, 49152, 2147483647, 1024, 8, 32], "", 0, []], [[], [["FU", 2, [0, 1, 2, 3]], ["SP", 2, 0, 144, [3], 1], ["AN", 2, 0, 5], ["AN", 2, 1, 6]]]], "r": [[2.47701e-06, 2.47511e-06, 2.4678e-06], 0, 3.79998, 1667926086], "v": "v0.6"}
{"i": [["[\"mul\", 1, 1, 1, 144]", "cuda -keys=cuda,gpu -max_num_threads=1024 -model=unknown -thread_warp_size=32", [-1, 16, 64, 49152, 2147483647, 1024, 8, 32], "", 0, []], [[], [["FU", 2, [0, 1, 2, 3]], ["SP", 2, 0, 144, [24], 1], ["AN", 2, 0, 5], ["AN", 2, 1, 6]]]], "r": [[2.56664e-06, 2.56394e-06, 2.57787e-06], 0, 4.10441, 1667926086], "v": "v0.6"}
{"i": [["[\"mul\", 1, 1, 1, 144]", "cuda -keys=cuda,gpu -max_num_threads=1024 -model=unknown -thread_warp_size=32", [-1, 16, 64, 49152, 2147483647, 1024, 8, 32], "", 0, []], [[], [["FU", 2, [0, 1, 2, 3]], ["SP", 2, 0, 144, [18], 1], ["AN", 2, 0, 5], ["AN", 2, 1, 6]]]], "r": [[2.45546e-06, 2.45233e-06, 2.45683e-06], 0, 4.36447, 1667926086], "v": "v0.6"}
{"i": [["[\"mul\", 1, 1, 1, 144]", "cuda -keys=cuda,gpu -max_num_threads=1024 -model=unknown -thread_warp_size=32", [-1, 16, 64, 49152, 2147483647, 1024, 8, 32], "", 0, []], [[], [["FU", 2, [0, 1, 2, 3]], ["SP", 2, 0, 144, [12], 1], ["AN", 2, 0, 5], ["AN", 2, 1, 6]]]], "r": [[2.61133e-06, 2.61593e-06, 2.63263e-06], 0, 0.89442, 1667935589], "v": "v0.6"}
{"i": [["[\"mul\", 1, 1, 1, 144]", "cuda -keys=cuda,gpu -max_num_threads=1024 -model=unknown -thread_warp_size=32", [-1, 16, 64, 49152, 2147483647, 1024, 8, 32], "", 0, []], [[], [["FU", 2, [0, 1, 2, 3]], ["SP", 2, 0, 144, [8], 1], ["AN", 2, 0, 5], ["AN", 2, 1, 6]]]], "r": [[2.43246e-06, 2.4147e-06, 2.41413e-06], 0, 0.619648, 1667935589], "v": "v0.6"}
{"i": [["[\"mul\", 1, 1, 1, 144]", "cuda -keys=cuda,gpu -max_num_threads=1024 -model=unknown -thread_warp_size=32", [-1, 16, 64, 49152, 2147483647, 1024, 8, 32], "", 0, []], [[], [["FU", 2, [0, 1, 2, 3]], ["SP", 2, 0, 144, [24], 1], ["AN", 2, 0, 5], ["AN", 2, 1, 6]]]], "r": [[2.43945e-06, 2.44186e-06, 2.44323e-06], 0, 2.13407, 1667935590], "v": "v0.6"}
{"i": [["[\"mul\", 1, 1, 1, 144]", "cuda -keys=cuda,gpu -max_num_threads=1024 -model=unknown -thread_warp_size=32", [-1, 16, 64, 49152, 2147483647, 1024, 8, 32], "", 0, []], [[], [["FU", 2, [0, 1, 2, 3]], ["SP", 2, 0, 144, [9], 1], ["AN", 2, 0, 5], ["AN", 2, 1, 6]]]], "r": [[2.45828e-06, 2.45796e-06, 2.45865e-06], 0, 2.7398, 1667935591], "v": "v0.6"}
{"i": [["[\"mul\", 1, 1, 1, 144]", "cuda -keys=cuda,gpu -max_num_threads=1024 -model=unknown -thread_warp_size=32", [-1, 16, 64, 49152, 2147483647, 1024, 8, 32], "", 0, []], [[], [["FU", 2, [0, 1, 2, 3]], ["SP", 2, 0, 144, [1], 1], ["AN", 2, 0, 5], ["AN", 2, 1, 6]]]], "r": [[2.65179e-06, 2.64725e-06, 2.65022e-06], 0, 1.81433, 1667935590], "v": "v0.6"}
{"i": [["[\"mul\", 1, 1, 1, 144]", "cuda -keys=cuda,gpu -max_num_threads=1024 -model=unknown -thread_warp_size=32", [-1, 16, 64, 49152, 2147483647, 1024, 8, 32], "", 0, []], [[], [["FU", 2, [0, 1, 2, 3]], ["SP", 2, 0, 144, [2], 1], ["AN", 2, 0, 5], ["AN", 2, 1, 6]]]], "r": [[2.61658e-06, 2.61997e-06, 2.61874e-06], 0, 1.15605, 1667935589], "v": "v0.6"}
{"i": [["[\"mul\", 1, 1, 1, 144]", "cuda -keys=cuda,gpu -max_num_threads=1024 -model=unknown -thread_warp_size=32", [-1, 16, 64, 49152, 2147483647, 1024, 8, 32], "", 0, []], [[], [["FU", 2, [0, 1, 2, 3]], ["SP", 2, 0, 144, [3], 1], ["AN", 2, 0, 5], ["AN", 2, 1, 6]]]], "r": [[2.4988e-06, 2.50102e-06, 2.50202e-06], 0, 1.442, 1667935590], "v": "v0.6"}
{"i": [["[\"mul\", 1, 1, 1, 144]", "cuda -keys=cuda,gpu -max_num_threads=1024 -model=unknown -thread_warp_size=32", [-1, 16, 64, 49152, 2147483647, 1024, 8, 32], "", 0, []], [[], [["FU", 2, [0, 1, 2, 3]], ["SP", 2, 0, 144, [32], 1], ["AN", 2, 0, 5], ["AN", 2, 1, 6]]]], "r": [[2.63055e-06, 2.63152e-06, 2.6546e-06], 0, 2.9659, 1667935591], "v": "v0.6"}
{"i": [["[\"mul\", 1, 1, 1, 144]", "cuda -keys=cuda,gpu -max_num_threads=1024 -model=unknown -thread_warp_size=32", [-1, 16, 64, 49152, 2147483647, 1024, 8, 32], "", 0, []], [[], [["FU", 2, [0, 1, 2, 3]], ["SP", 2, 0, 144, [16], 1], ["AN", 2, 0, 5], ["AN", 2, 1, 6]]]], "r": [[2.5861e-06, 2.59411e-06, 2.6134e-06], 0, 2.34399, 1667935591], "v": "v0.6"}
{"i": [["[\"mul\", 1, 1, 1, 144]", "cuda -keys=cuda,gpu -max_num_threads=1024 -model=unknown -thread_warp_size=32", [-1, 16, 64, 49152, 2147483647, 1024, 8, 32], "", 0, []], [[], [["FU", 2, [0, 1, 2, 3]], ["SP", 2, 0, 144, [48], 1], ["AN", 2, 0, 5], ["AN", 2, 1, 6]]]], "r": [[2.42747e-06, 2.41045e-06, 2.40857e-06], 0, 3.21051, 1667935592], "v": "v0.6"}
{"i": [["[\"mul\", 1, 1, 1, 144]", "cuda -keys=cuda,gpu -max_num_threads=1024 -model=unknown -thread_warp_size=32", [-1, 16, 64, 49152, 2147483647, 1024, 8, 32], "", 0, []], [[], [["FU", 2, [0, 1, 2, 3]], ["SP", 2, 0, 144, [6], 1], ["AN", 2, 0, 5], ["AN", 2, 1, 6]]]], "r": [[2.48613e-06, 2.4864e-06, 2.48314e-06], 0, 3.53642, 1667935592], "v": "v0.6"}
{"i": [["[\"mul\", 1, 1, 1, 144]", "cuda -keys=cuda,gpu -max_num_threads=1024 -model=unknown -thread_warp_size=32", [-1, 16, 64, 49152, 2147483647, 1024, 8, 32], "", 0, []], [[], [["FU", 2, [0, 1, 2, 3]], ["SP", 2, 0, 144, [64], 1], ["AN", 2, 0, 5], ["AN", 2, 1, 6]]]], "r": [[2.45254e-06, 2.45586e-06, 2.45499e-06], 0, 3.78905, 1667935592], "v": "v0.6"}
{"i": [["[\"mul\", 1, 1, 1, 144]", "cuda -keys=cuda,gpu -max_num_threads=1024 -model=unknown -thread_warp_size=32", [-1, 16, 64, 49152, 2147483647, 1024, 8, 32], "", 0, []], [[], [["FU", 2, [0, 1, 2, 3]], ["SP", 2, 0, 144, [36], 1], ["AN", 2, 0, 5], ["AN", 2, 1, 6]]]], "r": [[2.614e-06, 2.61906e-06, 2.64412e-06], 0, 4.04203, 1667935593], "v": "v0.6"}
{"i": [["[\"mul\", 1, 1, 1, 144]", "cuda -keys=cuda,gpu -max_num_threads=1024 -model=unknown -thread_warp_size=32", [-1, 16, 64, 49152, 2147483647, 1024, 8, 32], "", 0, []], [[], [["FU", 2, [0, 1, 2, 3]], ["SP", 2, 0, 144, [4], 1], ["AN", 2, 0, 5], ["AN", 2, 1, 6]]]], "r": [[2.49346e-06, 2.50163e-06, 2.50013e-06], 0, 4.35934, 1667935593], "v": "v0.6"}
{"i": [["[\"mul\", 1, 1, 1, 144]", "cuda -keys=cuda,gpu -max_num_threads=1024 -model=unknown -thread_warp_size=32", [-1, 16, 64, 49152, 2147483647, 1024, 8, 32], "", 0, []], [[], [["FU", 2, [0, 1, 2, 3]], ["SP", 2, 0, 144, [18], 1], ["AN", 2, 0, 5], ["AN", 2, 1, 6]]]], "r": [[2.61403e-06, 2.61228e-06, 2.63656e-06], 0, 4.55811, 1667935593], "v": "v0.6"}
{"i": [["[\"mul\", 1, 1, 1, 144]", "cuda -keys=cuda,gpu -max_num_threads=1024 -model=unknown -thread_warp_size=32", [-1, 16, 64, 49152, 2147483647, 1024, 8, 32], "", 0, []], [[], [["FU", 2, [0, 1, 2, 3]], ["SP", 2, 0, 144, [8], 1], ["AN", 2, 0, 5], ["AN", 2, 1, 6]]]], "r": [[2.62857e-06, 2.62373e-06, 2.64868e-06], 0, 2.39167, 1667936486], "v": "v0.6"}
{"i": [["[\"mul\", 1, 1, 1, 144]", "cuda -keys=cuda,gpu -max_num_threads=1024 -model=unknown -thread_warp_size=32", [-1, 16, 64, 49152, 2147483647, 1024, 8, 32], "", 0, []], [[], [["FU", 2, [0, 1, 2, 3]], ["SP", 2, 0, 144, [36], 1], ["AN", 2, 0, 5], ["AN", 2, 1, 6]]]], "r": [[2.43696e-06, 2.44237e-06, 2.44225e-06], 0, 1.50113, 1667936485], "v": "v0.6"}
{"i": [["[\"mul\", 1, 1, 1, 144]", "cuda -keys=cuda,gpu -max_num_threads=1024 -model=unknown -thread_warp_size=32", [-1, 16, 64, 49152, 2147483647, 1024, 8, 32], "", 0, []], [[], [["FU", 2, [0, 1, 2, 3]], ["SP", 2, 0, 144, [16], 1], ["AN", 2, 0, 5], ["AN", 2, 1, 6]]]], "r": [[2.59817e-06, 2.60007e-06, 2.62116e-06], 0, 1.22425, 1667936485], "v": "v0.6"}
{"i": [["[\"mul\", 1, 1, 1, 144]", "cuda -keys=cuda,gpu -max_num_threads=1024 -model=unknown -thread_warp_size=32", [-1, 16, 64, 49152, 2147483647, 1024, 8, 32], "", 0, []], [[], [["FU", 2, [0, 1, 2, 3]], ["SP", 2, 0, 144, [32], 1], ["AN", 2, 0, 5], ["AN", 2, 1, 6]]]], "r": [[2.47553e-06, 2.47921e-06, 2.47595e-06], 0, 1.84226, 1667936486], "v": "v0.6"}
{"i": [["[\"mul\", 1, 1, 1, 144]", "cuda -keys=cuda,gpu -max_num_threads=1024 -model=unknown -thread_warp_size=32", [-1, 16, 64, 49152, 2147483647, 1024, 8, 32], "", 0, []], [[], [["FU", 2, [0, 1, 2, 3]], ["SP", 2, 0, 144, [24], 1], ["AN", 2, 0, 5], ["AN", 2, 1, 6]]]], "r": [[2.61183e-06, 2.61016e-06, 2.64324e-06], 0, 0.562657, 1667936485], "v": "v0.6"}
{"i": [["[\"mul\", 1, 1, 1, 144]", "cuda -keys=cuda,gpu -max_num_threads=1024 -model=unknown -thread_warp_size=32", [-1, 16, 64, 49152, 2147483647, 1024, 8, 32], "", 0, []], [[], [["FU", 2, [0, 1, 2, 3]], ["SP", 2, 0, 144, [4], 1], ["AN", 2, 0, 5], ["AN", 2, 1, 6]]]], "r": [[2.62867e-06, 2.62935e-06, 2.65023e-06], 0, 0.884211, 1667936485], "v": "v0.6"}
{"i": [["[\"mul\", 1, 1, 1, 144]", "cuda -keys=cuda,gpu -max_num_threads=1024 -model=unknown -thread_warp_size=32", [-1, 16, 64, 49152, 2147483647, 1024, 8, 32], "", 0, []], [[], [["FU", 2, [0, 1, 2, 3]], ["SP", 2, 0, 144, [9], 1], ["AN", 2, 0, 5], ["AN", 2, 1, 6]]]], "r": [[2.43531e-06, 2.42002e-06, 2.42064e-06], 0, 2.02928, 1667936486], "v": "v0.6"}
{"i": [["[\"mul\", 1, 1, 1, 144]", "cuda -keys=cuda,gpu -max_num_threads=1024 -model=unknown -thread_warp_size=32", [-1, 16, 64, 49152, 2147483647, 1024, 8, 32], "", 0, []], [[], [["FU", 2, [0, 1, 2, 3]], ["SP", 2, 0, 144, [12], 1], ["AN", 2, 0, 5], ["AN", 2, 1, 6]]]], "r": [[2.46875e-06, 2.45949e-06, 2.45916e-06], 0, 2.60387, 1667936487], "v": "v0.6"}
{"i": [["[\"mul\", 1, 1, 1, 144]", "cuda -keys=cuda,gpu -max_num_threads=1024 -model=unknown -thread_warp_size=32", [-1, 16, 64, 49152, 2147483647, 1024, 8, 32], "", 0, []], [[], [["FU", 2, [0, 1, 2, 3]], ["SP", 2, 0, 144, [18], 1], ["AN", 2, 0, 5], ["AN", 2, 1, 6]]]], "r": [[2.5879e-06, 2.58953e-06, 2.61052e-06], 0, 2.84625, 1667936487], "v": "v0.6"}
{"i": [["[\"mul\", 1, 1, 1, 144]", "cuda -keys=cuda,gpu -max_num_threads=1024 -model=unknown -thread_warp_size=32", [-1, 16, 64, 49152, 2147483647, 1024, 8, 32], "", 0, []], [[], [["FU", 2, [0, 1, 2, 3]], ["SP", 2, 0, 144, [2], 1], ["AN", 2, 0, 5], ["AN", 2, 1, 6]]]], "r": [[2.47663e-06, 2.47231e-06, 2.47065e-06], 0, 3.05328, 1667936487], "v": "v0.6"}
{"i": [["[\"mul\", 1, 1, 1, 144]", "cuda -keys=cuda,gpu -max_num_threads=1024 -model=unknown -thread_warp_size=32", [-1, 16, 64, 49152, 2147483647, 1024, 8, 32], "", 0, []], [[], [["FU", 2, [0, 1, 2, 3]], ["SP", 2, 0, 144, [64], 1], ["AN", 2, 0, 5], ["AN", 2, 1, 6]]]], "r": [[2.57561e-06, 2.57281e-06, 2.58292e-06], 0, 3.38343, 1667936488], "v": "v0.6"}
{"i": [["[\"mul\", 1, 1, 1, 144]", "cuda -keys=cuda,gpu -max_num_threads=1024 -model=unknown -thread_warp_size=32", [-1, 16, 64, 49152, 2147483647, 1024, 8, 32], "", 0, []], [[], [["FU", 2, [0, 1, 2, 3]], ["SP", 2, 0, 144, [48], 1], ["AN", 2, 0, 5], ["AN", 2, 1, 6]]]], "r": [[2.52232e-06, 2.55255e-06, 2.54625e-06], 0, 3.66041, 1667936488], "v": "v0.6"}
{"i": [["[\"mul\", 1, 1, 1, 144]", "cuda -keys=cuda,gpu -max_num_threads=1024 -model=unknown -thread_warp_size=32", [-1, 16, 64, 49152, 2147483647, 1024, 8, 32], "", 0, []], [[], [["FU", 2, [0, 1, 2, 3]], ["SP", 2, 0, 144, [6], 1], ["AN", 2, 0, 5], ["AN", 2, 1, 6]]]], "r": [[2.51704e-06, 2.5173e-06, 2.52526e-06], 0, 3.86524, 1667936488], "v": "v0.6"}
{"i": [["[\"mul\", 1, 1, 1, 144]", "cuda -keys=cuda,gpu -max_num_threads=1024 -model=unknown -thread_warp_size=32", [-1, 16, 64, 49152, 2147483647, 1024, 8, 32], "", 0, []], [[], [["FU", 2, [0, 1, 2, 3]], ["SP", 2, 0, 144, [3], 1], ["AN", 2, 0, 5], ["AN", 2, 1, 6]]]], "r": [[2.50451e-06, 2.51061e-06, 2.5082e-06], 0, 4.13954, 1667936489], "v": "v0.6"}
{"i": [["[\"mul\", 1, 1, 1, 144]", "cuda -keys=cuda,gpu -max_num_threads=1024 -model=unknown -thread_warp_size=32", [-1, 16, 64, 49152, 2147483647, 1024, 8, 32], "", 0, []], [[], [["FU", 2, [0, 1, 2, 3]], ["SP", 2, 0, 144, [1], 1], ["AN", 2, 0, 5], ["AN", 2, 1, 6]]]], "r": [[2.71065e-06, 2.70688e-06, 2.72578e-06], 0, 4.42147, 1667936489], "v": "v0.6"}
