python/models/efficientnet/VertiFusionEfficientNet_kernel_configs/efficient_mul_1_7_7_672.log
{"i": [["[\"mul\", 1, 7, 7, 672]", "cuda -keys=cuda,gpu -max_num_threads=1024 -model=unknown -thread_warp_size=32", [-1, 16, 64, 49152, 2147483647, 1024, 8, 32], "", 0, []], [[], [["FU", 2, [0, 1, 2, 3]], ["SP", 2, 0, 32928, [42], 1], ["AN", 2, 0, 5], ["AN", 2, 1, 6]]]], "r": [[3.09291e-06, 3.0975e-06, 3.09695e-06], 0, 1.94425, 1667927559], "v": "v0.6"}
{"i": [["[\"mul\", 1, 7, 7, 672]", "cuda -keys=cuda,gpu -max_num_threads=1024 -model=unknown -thread_warp_size=32", [-1, 16, 64, 49152, 2147483647, 1024, 8, 32], "", 0, []], [[], [["FU", 2, [0, 1, 2, 3]], ["SP", 2, 0, 32928, [8], 1], ["AN", 2, 0, 5], ["AN", 2, 1, 6]]]], "r": [[5.65787e-06, 5.65682e-06, 5.65897e-06], 0, 0.586922, 1667927557], "v": "v0.6"}
{"i": [["[\"mul\", 1, 7, 7, 672]", "cuda -keys=cuda,gpu -max_num_threads=1024 -model=unknown -thread_warp_size=32", [-1, 16, 64, 49152, 2147483647, 1024, 8, 32], "", 0, []], [[], [["FU", 2, [0, 1, 2, 3]], ["SP", 2, 0, 32928, [24], 1], ["AN", 2, 0, 5], ["AN", 2, 1, 6]]]], "r": [[3.51935e-06, 3.52006e-06, 3.51845e-06], 0, 1.42711, 1667927558], "v": "v0.6"}
{"i": [["[\"mul\", 1, 7, 7, 672]", "cuda -keys=cuda,gpu -max_num_threads=1024 -model=unknown -thread_warp_size=32", [-1, 16, 64, 49152, 2147483647, 1024, 8, 32], "", 0, []], [[], [["FU", 2, [0, 1, 2, 3]], ["SP", 2, 0, 32928, [48], 1], ["AN", 2, 0, 5], ["AN", 2, 1, 6]]]], "r": [[3.12472e-06, 3.12293e-06, 3.12736e-06], 0, 2.548, 1667927560], "v": "v0.6"}
{"i": [["[\"mul\", 1, 7, 7, 672]", "cuda -keys=cuda,gpu -max_num_threads=1024 -model=unknown -thread_warp_size=32", [-1, 16, 64, 49152, 2147483647, 1024, 8, 32], "", 0, []], [[], [["FU", 2, [0, 1, 2, 3]], ["SP", 2, 0, 32928, [1], 1], ["AN", 2, 0, 5], ["AN", 2, 1, 6]]]], "r": [[2.70693e-05, 2.70737e-05, 2.70684e-05], 0, 1.126, 1667927558], "v": "v0.6"}
{"i": [["[\"mul\", 1, 7, 7, 672]", "cuda -keys=cuda,gpu -max_num_threads=1024 -model=unknown -thread_warp_size=32", [-1, 16, 64, 49152, 2147483647, 1024, 8, 32], "", 0, []], [[], [["FU", 2, [0, 1, 2, 3]], ["SP", 2, 0, 32928, [6], 1], ["AN", 2, 0, 5], ["AN", 2, 1, 6]]]], "r": [[6.72263e-06, 6.72092e-06, 6.72352e-06], 0, 2.81857, 1667927560], "v": "v0.6"}
{"i": [["[\"mul\", 1, 7, 7, 672]", "cuda -keys=cuda,gpu -max_num_threads=1024 -model=unknown -thread_warp_size=32", [-1, 16, 64, 49152, 2147483647, 1024, 8, 32], "", 0, []], [[], [["FU", 2, [0, 1, 2, 3]], ["SP", 2, 0, 32928, [28], 1], ["AN", 2, 0, 5], ["AN", 2, 1, 6]]]], "r": [[3.58463e-06, 3.58614e-06, 3.58838e-06], 0, 0.79647, 1667927558], "v": "v0.6"}
{"i": [["[\"mul\", 1, 7, 7, 672]", "cuda -keys=cuda,gpu -max_num_threads=1024 -model=unknown -thread_warp_size=32", [-1, 16, 64, 49152, 2147483647, 1024, 8, 32], "", 0, []], [[], [["FU", 2, [0, 1, 2, 3]], ["SP", 2, 0, 32928, [4], 1], ["AN", 2, 0, 5], ["AN", 2, 1, 6]]]], "r": [[8.70321e-06, 8.708e-06, 8.70909e-06], 0, 1.63924, 1667927559], "v": "v0.6"}
{"i": [["[\"mul\", 1, 7, 7, 672]", "cuda -keys=cuda,gpu -max_num_threads=1024 -model=unknown -thread_warp_size=32", [-1, 16, 64, 49152, 2147483647, 1024, 8, 32], "", 0, []], [[], [["FU", 2, [0, 1, 2, 3]], ["SP", 2, 0, 32928, [32], 1], ["AN", 2, 0, 5], ["AN", 2, 1, 6]]]], "r": [[3.17827e-06, 3.18347e-06, 3.18209e-06], 0, 2.25541, 1667927559], "v": "v0.6"}
{"i": [["[\"mul\", 1, 7, 7, 672]", "cuda -keys=cuda,gpu -max_num_threads=1024 -model=unknown -thread_warp_size=32", [-1, 16, 64, 49152, 2147483647, 1024, 8, 32], "", 0, []], [[], [["FU", 2, [0, 1, 2, 3]], ["SP", 2, 0, 32928, [7], 1], ["AN", 2, 0, 5], ["AN", 2, 1, 6]]]], "r": [[6.11749e-06, 6.12088e-06, 6.12085e-06], 0, 3.29989, 1667927560], "v": "v0.6"}
{"i": [["[\"mul\", 1, 7, 7, 672]", "cuda -keys=cuda,gpu -max_num_threads=1024 -model=unknown -thread_warp_size=32", [-1, 16, 64, 49152, 2147483647, 1024, 8, 32], "", 0, []], [[], [["FU", 2, [0, 1, 2, 3]], ["SP", 2, 0, 32928, [21], 1], ["AN", 2, 0, 5], ["AN", 2, 1, 6]]]], "r": [[3.63443e-06, 3.64141e-06, 3.63891e-06], 0, 3.02482, 1667927560], "v": "v0.6"}
{"i": [["[\"mul\", 1, 7, 7, 672]", "cuda -keys=cuda,gpu -max_num_threads=1024 -model=unknown -thread_warp_size=32", [-1, 16, 64, 49152, 2147483647, 1024, 8, 32], "", 0, []], [[], [["FU", 2, [0, 1, 2, 3]], ["SP", 2, 0, 32928, [14], 1], ["AN", 2, 0, 5], ["AN", 2, 1, 6]]]], "r": [[4.36441e-06, 4.36685e-06, 4.36702e-06], 0, 3.54283, 1667927561], "v": "v0.6"}
{"i": [["[\"mul\", 1, 7, 7, 672]", "cuda -keys=cuda,gpu -max_num_threads=1024 -model=unknown -thread_warp_size=32", [-1, 16, 64, 49152, 2147483647, 1024, 8, 32], "", 0, []], [[], [["FU", 2, [0, 1, 2, 3]], ["SP", 2, 0, 32928, [16], 1], ["AN", 2, 0, 5], ["AN", 2, 1, 6]]]], "r": [[4.05261e-06, 4.05201e-06, 4.05111e-06], 0, 4.03205, 1667927561], "v": "v0.6"}
{"i": [["[\"mul\", 1, 7, 7, 672]", "cuda -keys=cuda,gpu -max_num_threads=1024 -model=unknown -thread_warp_size=32", [-1, 16, 64, 49152, 2147483647, 1024, 8, 32], "", 0, []], [[], [["FU", 2, [0, 1, 2, 3]], ["SP", 2, 0, 32928, [3], 1], ["AN", 2, 0, 5], ["AN", 2, 1, 6]]]], "r": [[1.09094e-05, 1.09188e-05, 1.09137e-05], 0, 3.77442, 1667927561], "v": "v0.6"}
{"i": [["[\"mul\", 1, 7, 7, 672]", "cuda -keys=cuda,gpu -max_num_threads=1024 -model=unknown -thread_warp_size=32", [-1, 16, 64, 49152, 2147483647, 1024, 8, 32], "", 0, []], [[], [["FU", 2, [0, 1, 2, 3]], ["SP", 2, 0, 32928, [56], 1], ["AN", 2, 0, 5], ["AN", 2, 1, 6]]]], "r": [[2.93885e-06, 2.94328e-06, 2.9434e-06], 0, 4.31126, 1667927562], "v": "v0.6"}
{"i": [["[\"mul\", 1, 7, 7, 672]", "cuda -keys=cuda,gpu -max_num_threads=1024 -model=unknown -thread_warp_size=32", [-1, 16, 64, 49152, 2147483647, 1024, 8, 32], "", 0, []], [[], [["FU", 2, [0, 1, 2, 3]], ["SP", 2, 0, 32928, [49], 1], ["AN", 2, 0, 5], ["AN", 2, 1, 6]]]], "r": [[3.18448e-06, 3.1885e-06, 3.18907e-06], 0, 4.54981, 1667927562], "v": "v0.6"}
{"i": [["[\"mul\", 1, 7, 7, 672]", "cuda -keys=cuda,gpu -max_num_threads=1024 -model=unknown -thread_warp_size=32", [-1, 16, 64, 49152, 2147483647, 1024, 8, 32], "", 0, []], [[], [["FU", 2, [0, 1, 2, 3]], ["SP", 2, 0, 32928, [2], 1], ["AN", 2, 0, 5], ["AN", 2, 1, 6]]]], "r": [[1.49911e-05, 1.49881e-05, 1.4984e-05], 0, 4.79563, 1667927562], "v": "v0.6"}
{"i": [["[\"mul\", 1, 7, 7, 672]", "cuda -keys=cuda,gpu -max_num_threads=1024 -model=unknown -thread_warp_size=32", [-1, 16, 64, 49152, 2147483647, 1024, 8, 32], "", 0, []], [[], [["FU", 2, [0, 1, 2, 3]], ["SP", 2, 0, 32928, [12], 1], ["AN", 2, 0, 5], ["AN", 2, 1, 6]]]], "r": [[4.60601e-06, 4.60306e-06, 4.60817e-06], 0, 5.06194, 1667927563], "v": "v0.6"}
{"i": [["[\"mul\", 1, 7, 7, 672]", "cuda -keys=cuda,gpu -max_num_threads=1024 -model=unknown -thread_warp_size=32", [-1, 16, 64, 49152, 2147483647, 1024, 8, 32], "", 0, []], [[], [["FU", 2, [0, 1, 2, 3]], ["SP", 2, 0, 32928, [1], 1], ["AN", 2, 0, 5], ["AN", 2, 1, 6]]]], "r": [[2.70833e-05, 2.7083e-05, 2.70684e-05], 0, 0.908172, 1667945124], "v": "v0.6"}
{"i": [["[\"mul\", 1, 7, 7, 672]", "cuda -keys=cuda,gpu -max_num_threads=1024 -model=unknown -thread_warp_size=32", [-1, 16, 64, 49152, 2147483647, 1024, 8, 32], "", 0, []], [[], [["FU", 2, [0, 1, 2, 3]], ["SP", 2, 0, 32928, [3], 1], ["AN", 2, 0, 5], ["AN", 2, 1, 6]]]], "r": [[1.09564e-05, 1.09522e-05, 1.09498e-05], 0, 1.2057, 1667945124], "v": "v0.6"}
{"i": [["[\"mul\", 1, 7, 7, 672]", "cuda -keys=cuda,gpu -max_num_threads=1024 -model=unknown -thread_warp_size=32", [-1, 16, 64, 49152, 2147483647, 1024, 8, 32], "", 0, []], [[], [["FU", 2, [0, 1, 2, 3]], ["SP", 2, 0, 32928, [8], 1], ["AN", 2, 0, 5], ["AN", 2, 1, 6]]]], "r": [[5.80144e-06, 5.80144e-06, 5.80305e-06], 0, 0.571692, 1667945123], "v": "v0.6"}
{"i": [["[\"mul\", 1, 7, 7, 672]", "cuda -keys=cuda,gpu -max_num_threads=1024 -model=unknown -thread_warp_size=32", [-1, 16, 64, 49152, 2147483647, 1024, 8, 32], "", 0, []], [[], [["FU", 2, [0, 1, 2, 3]], ["SP", 2, 0, 32928, [4], 1], ["AN", 2, 0, 5], ["AN", 2, 1, 6]]]], "r": [[8.71154e-06, 8.71267e-06, 8.7108e-06], 0, 1.53396, 1667945124], "v": "v0.6"}
{"i": [["[\"mul\", 1, 7, 7, 672]", "cuda -keys=cuda,gpu -max_num_threads=1024 -model=unknown -thread_warp_size=32", [-1, 16, 64, 49152, 2147483647, 1024, 8, 32], "", 0, []], [[], [["FU", 2, [0, 1, 2, 3]], ["SP", 2, 0, 32928, [32], 1], ["AN", 2, 0, 5], ["AN", 2, 1, 6]]]], "r": [[3.42533e-06, 3.42741e-06, 3.43032e-06], 0, 2.11067, 1667945125], "v": "v0.6"}
{"i": [["[\"mul\", 1, 7, 7, 672]", "cuda -keys=cuda,gpu -max_num_threads=1024 -model=unknown -thread_warp_size=32", [-1, 16, 64, 49152, 2147483647, 1024, 8, 32], "", 0, []], [[], [["FU", 2, [0, 1, 2, 3]], ["SP", 2, 0, 32928, [28], 1], ["AN", 2, 0, 5], ["AN", 2, 1, 6]]]], "r": [[3.37102e-06, 3.37013e-06, 3.37287e-06], 0, 1.82818, 1667945125], "v": "v0.6"}
{"i": [["[\"mul\", 1, 7, 7, 672]", "cuda -keys=cuda,gpu -max_num_threads=1024 -model=unknown -thread_warp_size=32", [-1, 16, 64, 49152, 2147483647, 1024, 8, 32], "", 0, []], [[], [["FU", 2, [0, 1, 2, 3]], ["SP", 2, 0, 32928, [7], 1], ["AN", 2, 0, 5], ["AN", 2, 1, 6]]]], "r": [[6.22901e-06, 6.22534e-06, 6.22889e-06], 0, 2.4114, 1667945125], "v": "v0.6"}
{"i": [["[\"mul\", 1, 7, 7, 672]", "cuda -keys=cuda,gpu -max_num_threads=1024 -model=unknown -thread_warp_size=32", [-1, 16, 64, 49152, 2147483647, 1024, 8, 32], "", 0, []], [[], [["FU", 2, [0, 1, 2, 3]], ["SP", 2, 0, 32928, [14], 1], ["AN", 2, 0, 5], ["AN", 2, 1, 6]]]], "r": [[4.35329e-06, 4.35595e-06, 4.35887e-06], 0, 2.68733, 1667945126], "v": "v0.6"}
{"i": [["[\"mul\", 1, 7, 7, 672]", "cuda -keys=cuda,gpu -max_num_threads=1024 -model=unknown -thread_warp_size=32", [-1, 16, 64, 49152, 2147483647, 1024, 8, 32], "", 0, []], [[], [["FU", 2, [0, 1, 2, 3]], ["SP", 2, 0, 32928, [49], 1], ["AN", 2, 0, 5], ["AN", 2, 1, 6]]]], "r": [[2.98007e-06, 2.98325e-06, 2.98279e-06], 0, 2.909, 1667945126], "v": "v0.6"}
{"i": [["[\"mul\", 1, 7, 7, 672]", "cuda -keys=cuda,gpu -max_num_threads=1024 -model=unknown -thread_warp_size=32", [-1, 16, 64, 49152, 2147483647, 1024, 8, 32], "", 0, []], [[], [["FU", 2, [0, 1, 2, 3]], ["SP", 2, 0, 32928, [42], 1], ["AN", 2, 0, 5], ["AN", 2, 1, 6]]]], "r": [[3.03899e-06, 3.04223e-06, 3.04002e-06], 0, 3.19306, 1667945126], "v": "v0.6"}
{"i": [["[\"mul\", 1, 7, 7, 672]", "cuda -keys=cuda,gpu -max_num_threads=1024 -model=unknown -thread_warp_size=32", [-1, 16, 64, 49152, 2147483647, 1024, 8, 32], "", 0, []], [[], [["FU", 2, [0, 1, 2, 3]], ["SP", 2, 0, 32928, [21], 1], ["AN", 2, 0, 5], ["AN", 2, 1, 6]]]], "r": [[3.62483e-06, 3.62623e-06, 3.6265e-06], 0, 3.41608, 1667945127], "v": "v0.6"}
{"i": [["[\"mul\", 1, 7, 7, 672]", "cuda -keys=cuda,gpu -max_num_threads=1024 -model=unknown -thread_warp_size=32", [-1, 16, 64, 49152, 2147483647, 1024, 8, 32], "", 0, []], [[], [["FU", 2, [0, 1, 2, 3]], ["SP", 2, 0, 32928, [24], 1], ["AN", 2, 0, 5], ["AN", 2, 1, 6]]]], "r": [[3.47315e-06, 3.47662e-06, 3.47731e-06], 0, 3.69553, 1667945127], "v": "v0.6"}
{"i": [["[\"mul\", 1, 7, 7, 672]", "cuda -keys=cuda,gpu -max_num_threads=1024 -model=unknown -thread_warp_size=32", [-1, 16, 64, 49152, 2147483647, 1024, 8, 32], "", 0, []], [[], [["FU", 2, [0, 1, 2, 3]], ["SP", 2, 0, 32928, [12], 1], ["AN", 2, 0, 5], ["AN", 2, 1, 6]]]], "r": [[4.57853e-06, 4.57959e-06, 4.57997e-06], 0, 3.98454, 1667945127], "v": "v0.6"}
{"i": [["[\"mul\", 1, 7, 7, 672]", "cuda -keys=cuda,gpu -max_num_threads=1024 -model=unknown -thread_warp_size=32", [-1, 16, 64, 49152, 2147483647, 1024, 8, 32], "", 0, []], [[], [["FU", 2, [0, 1, 2, 3]], ["SP", 2, 0, 32928, [48], 1], ["AN", 2, 0, 5], ["AN", 2, 1, 6]]]], "r": [[3.02646e-06, 3.03051e-06, 3.02984e-06], 0, 4.23824, 1667945128], "v": "v0.6"}
{"i": [["[\"mul\", 1, 7, 7, 672]", "cuda -keys=cuda,gpu -max_num_threads=1024 -model=unknown -thread_warp_size=32", [-1, 16, 64, 49152, 2147483647, 1024, 8, 32], "", 0, []], [[], [["FU", 2, [0, 1, 2, 3]], ["SP", 2, 0, 32928, [56], 1], ["AN", 2, 0, 5], ["AN", 2, 1, 6]]]], "r": [[3.16335e-06, 3.15955e-06, 3.16823e-06], 0, 4.49189, 1667945128], "v": "v0.6"}
{"i": [["[\"mul\", 1, 7, 7, 672]", "cuda -keys=cuda,gpu -max_num_threads=1024 -model=unknown -thread_warp_size=32", [-1, 16, 64, 49152, 2147483647, 1024, 8, 32], "", 0, []], [[], [["FU", 2, [0, 1, 2, 3]], ["SP", 2, 0, 32928, [2], 1], ["AN", 2, 0, 5], ["AN", 2, 1, 6]]]], "r": [[1.5026e-05, 1.50186e-05, 1.50212e-05], 0, 4.78697, 1667945128], "v": "v0.6"}
{"i": [["[\"mul\", 1, 7, 7, 672]", "cuda -keys=cuda,gpu -max_num_threads=1024 -model=unknown -thread_warp_size=32", [-1, 16, 64, 49152, 2147483647, 1024, 8, 32], "", 0, []], [[], [["FU", 2, [0, 1, 2, 3]], ["SP", 2, 0, 32928, [16], 1], ["AN", 2, 0, 5], ["AN", 2, 1, 6]]]], "r": [[3.96293e-06, 3.96332e-06, 3.96143e-06], 0, 5.02015, 1667945128], "v": "v0.6"}
{"i": [["[\"mul\", 1, 7, 7, 672]", "cuda -keys=cuda,gpu -max_num_threads=1024 -model=unknown -thread_warp_size=32", [-1, 16, 64, 49152, 2147483647, 1024, 8, 32], "", 0, []], [[], [["FU", 2, [0, 1, 2, 3]], ["SP", 2, 0, 32928, [6], 1], ["AN", 2, 0, 5], ["AN", 2, 1, 6]]]], "r": [[6.71364e-06, 6.7085e-06, 6.70654e-06], 0, 5.3043, 1667945129], "v": "v0.6"}
