python/models/efficientnet/VertiFusionEfficientNet_kernel_configs/efficient_mul_1_112_112_96.log
{"i": [["[\"mul\", 1, 112, 112, 96]", "cuda -keys=cuda,gpu -max_num_threads=1024 -model=unknown -thread_warp_size=32", [-1, 16, 64, 49152, 2147483647, 1024, 8, 32], "", 0, []], [[], [["FU", 2, [0, 1, 2, 3]], ["SP", 2, 0, 1204224, [4], 1], ["AN", 2, 0, 5], ["AN", 2, 1, 6]]]], "r": [[0.00022586, 0.000225834, 0.000225877], 0, 2.24754, 1667925305], "v": "v0.6"}
{"i": [["[\"mul\", 1, 112, 112, 96]", "cuda -keys=cuda,gpu -max_num_threads=1024 -model=unknown -thread_warp_size=32", [-1, 16, 64, 49152, 2147483647, 1024, 8, 32], "", 0, []], [[], [["FU", 2, [0, 1, 2, 3]], ["SP", 2, 0, 1204224, [48], 1], ["AN", 2, 0, 5], ["AN", 2, 1, 6]]]], "r": [[2.10288e-05, 2.10276e-05, 2.10166e-05], 0, 0.712892, 1667925303], "v": "v0.6"}
{"i": [["[\"mul\", 1, 112, 112, 96]", "cuda -keys=cuda,gpu -max_num_threads=1024 -model=unknown -thread_warp_size=32", [-1, 16, 64, 49152, 2147483647, 1024, 8, 32], "", 0, []], [[], [["FU", 2, [0, 1, 2, 3]], ["SP", 2, 0, 1204224, [28], 1], ["AN", 2, 0, 5], ["AN", 2, 1, 6]]]], "r": [[3.45059e-05, 3.45019e-05, 3.45237e-05], 0, 1.14741, 1667925303], "v": "v0.6"}
{"i": [["[\"mul\", 1, 112, 112, 96]", "cuda -keys=cuda,gpu -max_num_threads=1024 -model=unknown -thread_warp_size=32", [-1, 16, 64, 49152, 2147483647, 1024, 8, 32], "", 0, []], [[], [["FU", 2, [0, 1, 2, 3]], ["SP", 2, 0, 1204224, [7], 1], ["AN", 2, 0, 5], ["AN", 2, 1, 6]]]], "r": [[0.000130184, 0.000130184, 0.000130179], 0, 2.59303, 1667925305], "v": "v0.6"}
{"i": [["[\"mul\", 1, 112, 112, 96]", "cuda -keys=cuda,gpu -max_num_threads=1024 -model=unknown -thread_warp_size=32", [-1, 16, 64, 49152, 2147483647, 1024, 8, 32], "", 0, []], [[], [["FU", 2, [0, 1, 2, 3]], ["SP", 2, 0, 1204224, [21], 1], ["AN", 2, 0, 5], ["AN", 2, 1, 6]]]], "r": [[4.51339e-05, 4.51299e-05, 4.51389e-05], 0, 1.95856, 1667925304], "v": "v0.6"}
{"i": [["[\"mul\", 1, 112, 112, 96]", "cuda -keys=cuda,gpu -max_num_threads=1024 -model=unknown -thread_warp_size=32", [-1, 16, 64, 49152, 2147483647, 1024, 8, 32], "", 0, []], [[], [["FU", 2, [0, 1, 2, 3]], ["SP", 2, 0, 1204224, [1], 1], ["AN", 2, 0, 5], ["AN", 2, 1, 6]]]], "r": [[0.000895711, 0.00089562, 0.000895633], 0, 3.3047, 1667925306], "v": "v0.6"}
{"i": [["[\"mul\", 1, 112, 112, 96]", "cuda -keys=cuda,gpu -max_num_threads=1024 -model=unknown -thread_warp_size=32", [-1, 16, 64, 49152, 2147483647, 1024, 8, 32], "", 0, []], [[], [["FU", 2, [0, 1, 2, 3]], ["SP", 2, 0, 1204224, [6], 1], ["AN", 2, 0, 5], ["AN", 2, 1, 6]]]], "r": [[0.000151577, 0.000151553, 0.000151537], 0, 1.48884, 1667925304], "v": "v0.6"}
{"i": [["[\"mul\", 1, 112, 112, 96]", "cuda -keys=cuda,gpu -max_num_threads=1024 -model=unknown -thread_warp_size=32", [-1, 16, 64, 49152, 2147483647, 1024, 8, 32], "", 0, []], [[], [["FU", 2, [0, 1, 2, 3]], ["SP", 2, 0, 1204224, [3], 1], ["AN", 2, 0, 5], ["AN", 2, 1, 6]]]], "r": [[0.000300312, 0.000300379, 0.000300373], 0, 2.97079, 1667925305], "v": "v0.6"}
{"i": [["[\"mul\", 1, 112, 112, 96]", "cuda -keys=cuda,gpu -max_num_threads=1024 -model=unknown -thread_warp_size=32", [-1, 16, 64, 49152, 2147483647, 1024, 8, 32], "", 0, []], [[], [["FU", 2, [0, 1, 2, 3]], ["SP", 2, 0, 1204224, [14], 1], ["AN", 2, 0, 5], ["AN", 2, 1, 6]]]], "r": [[6.65006e-05, 6.64959e-05, 6.64909e-05], 0, 4.05401, 1667925307], "v": "v0.6"}
{"i": [["[\"mul\", 1, 112, 112, 96]", "cuda -keys=cuda,gpu -max_num_threads=1024 -model=unknown -thread_warp_size=32", [-1, 16, 64, 49152, 2147483647, 1024, 8, 32], "", 0, []], [[], [["FU", 2, [0, 1, 2, 3]], ["SP", 2, 0, 1204224, [42], 1], ["AN", 2, 0, 5], ["AN", 2, 1, 6]]]], "r": [[2.367e-05, 2.36746e-05, 2.36714e-05], 0, 3.63993, 1667925306], "v": "v0.6"}
{"i": [["[\"mul\", 1, 112, 112, 96]", "cuda -keys=cuda,gpu -max_num_threads=1024 -model=unknown -thread_warp_size=32", [-1, 16, 64, 49152, 2147483647, 1024, 8, 32], "", 0, []], [[], [["FU", 2, [0, 1, 2, 3]], ["SP", 2, 0, 1204224, [2], 1], ["AN", 2, 0, 5], ["AN", 2, 1, 6]]]], "r": [[0.000449318, 0.000449267, 0.000449187], 0, 4.68563, 1667925307], "v": "v0.6"}
{"i": [["[\"mul\", 1, 112, 112, 96]", "cuda -keys=cuda,gpu -max_num_threads=1024 -model=unknown -thread_warp_size=32", [-1, 16, 64, 49152, 2147483647, 1024, 8, 32], "", 0, []], [[], [["FU", 2, [0, 1, 2, 3]], ["SP", 2, 0, 1204224, [49], 1], ["AN", 2, 0, 5], ["AN", 2, 1, 6]]]], "r": [[2.06673e-05, 2.06657e-05, 2.06674e-05], 0, 4.31473, 1667925307], "v": "v0.6"}
{"i": [["[\"mul\", 1, 112, 112, 96]", "cuda -keys=cuda,gpu -max_num_threads=1024 -model=unknown -thread_warp_size=32", [-1, 16, 64, 49152, 2147483647, 1024, 8, 32], "", 0, []], [[], [["FU", 2, [0, 1, 2, 3]], ["SP", 2, 0, 1204224, [24], 1], ["AN", 2, 0, 5], ["AN", 2, 1, 6]]]], "r": [[3.99776e-05, 3.9991e-05, 3.99878e-05], 0, 5.06026, 1667925308], "v": "v0.6"}
{"i": [["[\"mul\", 1, 112, 112, 96]", "cuda -keys=cuda,gpu -max_num_threads=1024 -model=unknown -thread_warp_size=32", [-1, 16, 64, 49152, 2147483647, 1024, 8, 32], "", 0, []], [[], [["FU", 2, [0, 1, 2, 3]], ["SP", 2, 0, 1204224, [8], 1], ["AN", 2, 0, 5], ["AN", 2, 1, 6]]]], "r": [[0.000114309, 0.000114287, 0.000114256], 0, 5.37333, 1667925308], "v": "v0.6"}
{"i": [["[\"mul\", 1, 112, 112, 96]", "cuda -keys=cuda,gpu -max_num_threads=1024 -model=unknown -thread_warp_size=32", [-1, 16, 64, 49152, 2147483647, 1024, 8, 32], "", 0, []], [[], [["FU", 2, [0, 1, 2, 3]], ["SP", 2, 0, 1204224, [64], 1], ["AN", 2, 0, 5], ["AN", 2, 1, 6]]]], "r": [[1.66043e-05, 1.65979e-05, 1.65936e-05], 0, 5.7209, 1667925309], "v": "v0.6"}
{"i": [["[\"mul\", 1, 112, 112, 96]", "cuda -keys=cuda,gpu -max_num_threads=1024 -model=unknown -thread_warp_size=32", [-1, 16, 64, 49152, 2147483647, 1024, 8, 32], "", 0, []], [[], [["FU", 2, [0, 1, 2, 3]], ["SP", 2, 0, 1204224, [12], 1], ["AN", 2, 0, 5], ["AN", 2, 1, 6]]]], "r": [[7.7111e-05, 7.71077e-05, 7.71161e-05], 0, 6.12682, 1667925309], "v": "v0.6"}
{"i": [["[\"mul\", 1, 112, 112, 96]", "cuda -keys=cuda,gpu -max_num_threads=1024 -model=unknown -thread_warp_size=32", [-1, 16, 64, 49152, 2147483647, 1024, 8, 32], "", 0, []], [[], [["FU", 2, [0, 1, 2, 3]], ["SP", 2, 0, 1204224, [16], 1], ["AN", 2, 0, 5], ["AN", 2, 1, 6]]]], "r": [[5.85939e-05, 5.85968e-05, 5.86017e-05], 0, 6.43848, 1667925310], "v": "v0.6"}
{"i": [["[\"mul\", 1, 112, 112, 96]", "cuda -keys=cuda,gpu -max_num_threads=1024 -model=unknown -thread_warp_size=32", [-1, 16, 64, 49152, 2147483647, 1024, 8, 32], "", 0, []], [[], [["FU", 2, [0, 1, 2, 3]], ["SP", 2, 0, 1204224, [32], 1], ["AN", 2, 0, 5], ["AN", 2, 1, 6]]]], "r": [[3.0683e-05, 3.06848e-05, 3.07033e-05], 0, 6.80059, 1667925310], "v": "v0.6"}
{"i": [["[\"mul\", 1, 112, 112, 96]", "cuda -keys=cuda,gpu -max_num_threads=1024 -model=unknown -thread_warp_size=32", [-1, 16, 64, 49152, 2147483647, 1024, 8, 32], "", 0, []], [[], [["FU", 2, [0, 1, 2, 3]], ["SP", 2, 0, 1204224, [56], 1], ["AN", 2, 0, 5], ["AN", 2, 1, 6]]]], "r": [[1.84435e-05, 1.84373e-05, 1.84346e-05], 0, 7.1684, 1667925310], "v": "v0.6"}
{"i": [["[\"mul\", 1, 112, 112, 96]", "cuda -keys=cuda,gpu -max_num_threads=1024 -model=unknown -thread_warp_size=32", [-1, 16, 64, 49152, 2147483647, 1024, 8, 32], "", 0, []], [[], [["FU", 2, [0, 1, 2, 3]], ["SP", 2, 0, 1204224, [64], 1], ["AN", 2, 0, 5], ["AN", 2, 1, 6]]]], "r": [[1.64748e-05, 1.64814e-05, 1.64818e-05], 0, 1.01332, 1667925924], "v": "v0.6"}
{"i": [["[\"mul\", 1, 112, 112, 96]", "cuda -keys=cuda,gpu -max_num_threads=1024 -model=unknown -thread_warp_size=32", [-1, 16, 64, 49152, 2147483647, 1024, 8, 32], "", 0, []], [[], [["FU", 2, [0, 1, 2, 3]], ["SP", 2, 0, 1204224, [7], 1], ["AN", 2, 0, 5], ["AN", 2, 1, 6]]]], "r": [[0.000130255, 0.00013027, 0.000130261], 0, 2.8758, 1667925926], "v": "v0.6"}
{"i": [["[\"mul\", 1, 112, 112, 96]", "cuda -keys=cuda,gpu -max_num_threads=1024 -model=unknown -thread_warp_size=32", [-1, 16, 64, 49152, 2147483647, 1024, 8, 32], "", 0, []], [[], [["FU", 2, [0, 1, 2, 3]], ["SP", 2, 0, 1204224, [3], 1], ["AN", 2, 0, 5], ["AN", 2, 1, 6]]]], "r": [[0.000300449, 0.000300419, 0.000300424], 0, 1.42733, 1667925924], "v": "v0.6"}
{"i": [["[\"mul\", 1, 112, 112, 96]", "cuda -keys=cuda,gpu -max_num_threads=1024 -model=unknown -thread_warp_size=32", [-1, 16, 64, 49152, 2147483647, 1024, 8, 32], "", 0, []], [[], [["FU", 2, [0, 1, 2, 3]], ["SP", 2, 0, 1204224, [32], 1], ["AN", 2, 0, 5], ["AN", 2, 1, 6]]]], "r": [[3.05743e-05, 3.05811e-05, 3.05775e-05], 0, 0.686003, 1667925924], "v": "v0.6"}
{"i": [["[\"mul\", 1, 112, 112, 96]", "cuda -keys=cuda,gpu -max_num_threads=1024 -model=unknown -thread_warp_size=32", [-1, 16, 64, 49152, 2147483647, 1024, 8, 32], "", 0, []], [[], [["FU", 2, [0, 1, 2, 3]], ["SP", 2, 0, 1204224, [21], 1], ["AN", 2, 0, 5], ["AN", 2, 1, 6]]]], "r": [[4.52653e-05, 4.52784e-05, 4.52674e-05], 0, 2.0582, 1667925925], "v": "v0.6"}
{"i": [["[\"mul\", 1, 112, 112, 96]", "cuda -keys=cuda,gpu -max_num_threads=1024 -model=unknown -thread_warp_size=32", [-1, 16, 64, 49152, 2147483647, 1024, 8, 32], "", 0, []], [[], [["FU", 2, [0, 1, 2, 3]], ["SP", 2, 0, 1204224, [14], 1], ["AN", 2, 0, 5], ["AN", 2, 1, 6]]]], "r": [[6.64608e-05, 6.64667e-05, 6.64788e-05], 0, 3.25977, 1667925926], "v": "v0.6"}
{"i": [["[\"mul\", 1, 112, 112, 96]", "cuda -keys=cuda,gpu -max_num_threads=1024 -model=unknown -thread_warp_size=32", [-1, 16, 64, 49152, 2147483647, 1024, 8, 32], "", 0, []], [[], [["FU", 2, [0, 1, 2, 3]], ["SP", 2, 0, 1204224, [12], 1], ["AN", 2, 0, 5], ["AN", 2, 1, 6]]]], "r": [[7.7157e-05, 7.71435e-05, 7.7135e-05], 0, 1.77033, 1667925925], "v": "v0.6"}
{"i": [["[\"mul\", 1, 112, 112, 96]", "cuda -keys=cuda,gpu -max_num_threads=1024 -model=unknown -thread_warp_size=32", [-1, 16, 64, 49152, 2147483647, 1024, 8, 32], "", 0, []], [[], [["FU", 2, [0, 1, 2, 3]], ["SP", 2, 0, 1204224, [42], 1], ["AN", 2, 0, 5], ["AN", 2, 1, 6]]]], "r": [[2.36143e-05, 2.36022e-05, 2.3596e-05], 0, 2.45177, 1667925926], "v": "v0.6"}
{"i": [["[\"mul\", 1, 112, 112, 96]", "cuda -keys=cuda,gpu -max_num_threads=1024 -model=unknown -thread_warp_size=32", [-1, 16, 64, 49152, 2147483647, 1024, 8, 32], "", 0, []], [[], [["FU", 2, [0, 1, 2, 3]], ["SP", 2, 0, 1204224, [28], 1], ["AN", 2, 0, 5], ["AN", 2, 1, 6]]]], "r": [[3.47059e-05, 3.47159e-05, 3.46878e-05], 0, 3.90501, 1667925927], "v": "v0.6"}
{"i": [["[\"mul\", 1, 112, 112, 96]", "cuda -keys=cuda,gpu -max_num_threads=1024 -model=unknown -thread_warp_size=32", [-1, 16, 64, 49152, 2147483647, 1024, 8, 32], "", 0, []], [[], [["FU", 2, [0, 1, 2, 3]], ["SP", 2, 0, 1204224, [2], 1], ["AN", 2, 0, 5], ["AN", 2, 1, 6]]]], "r": [[0.00044926, 0.00044913, 0.000449236], 0, 3.46509, 1667925927], "v": "v0.6"}
{"i": [["[\"mul\", 1, 112, 112, 96]", "cuda -keys=cuda,gpu -max_num_threads=1024 -model=unknown -thread_warp_size=32", [-1, 16, 64, 49152, 2147483647, 1024, 8, 32], "", 0, []], [[], [["FU", 2, [0, 1, 2, 3]], ["SP", 2, 0, 1204224, [49], 1], ["AN", 2, 0, 5], ["AN", 2, 1, 6]]]], "r": [[2.07609e-05, 2.0754e-05, 2.0755e-05], 0, 4.17147, 1667925928], "v": "v0.6"}
{"i": [["[\"mul\", 1, 112, 112, 96]", "cuda -keys=cuda,gpu -max_num_threads=1024 -model=unknown -thread_warp_size=32", [-1, 16, 64, 49152, 2147483647, 1024, 8, 32], "", 0, []], [[], [["FU", 2, [0, 1, 2, 3]], ["SP", 2, 0, 1204224, [4], 1], ["AN", 2, 0, 5], ["AN", 2, 1, 6]]]], "r": [[0.000225902, 0.000225869, 0.00022587], 0, 4.9416, 1667925928], "v": "v0.6"}
{"i": [["[\"mul\", 1, 112, 112, 96]", "cuda -keys=cuda,gpu -max_num_threads=1024 -model=unknown -thread_warp_size=32", [-1, 16, 64, 49152, 2147483647, 1024, 8, 32], "", 0, []], [[], [["FU", 2, [0, 1, 2, 3]], ["SP", 2, 0, 1204224, [48], 1], ["AN", 2, 0, 5], ["AN", 2, 1, 6]]]], "r": [[2.11075e-05, 2.11072e-05, 2.10919e-05], 0, 4.54948, 1667925928], "v": "v0.6"}
{"i": [["[\"mul\", 1, 112, 112, 96]", "cuda -keys=cuda,gpu -max_num_threads=1024 -model=unknown -thread_warp_size=32", [-1, 16, 64, 49152, 2147483647, 1024, 8, 32], "", 0, []], [[], [["FU", 2, [0, 1, 2, 3]], ["SP", 2, 0, 1204224, [24], 1], ["AN", 2, 0, 5], ["AN", 2, 1, 6]]]], "r": [[3.98541e-05, 3.98447e-05, 3.98726e-05], 0, 5.23115, 1667925929], "v": "v0.6"}
{"i": [["[\"mul\", 1, 112, 112, 96]", "cuda -keys=cuda,gpu -max_num_threads=1024 -model=unknown -thread_warp_size=32", [-1, 16, 64, 49152, 2147483647, 1024, 8, 32], "", 0, []], [[], [["FU", 2, [0, 1, 2, 3]], ["SP", 2, 0, 1204224, [56], 1], ["AN", 2, 0, 5], ["AN", 2, 1, 6]]]], "r": [[1.85108e-05, 1.85099e-05, 1.85065e-05], 0, 5.58522, 1667925929], "v": "v0.6"}
{"i": [["[\"mul\", 1, 112, 112, 96]", "cuda -keys=cuda,gpu -max_num_threads=1024 -model=unknown -thread_warp_size=32", [-1, 16, 64, 49152, 2147483647, 1024, 8, 32], "", 0, []], [[], [["FU", 2, [0, 1, 2, 3]], ["SP", 2, 0, 1204224, [16], 1], ["AN", 2, 0, 5], ["AN", 2, 1, 6]]]], "r": [[5.85205e-05, 5.85126e-05, 5.85205e-05], 0, 5.95148, 1667925930], "v": "v0.6"}
{"i": [["[\"mul\", 1, 112, 112, 96]", "cuda -keys=cuda,gpu -max_num_threads=1024 -model=unknown -thread_warp_size=32", [-1, 16, 64, 49152, 2147483647, 1024, 8, 32], "", 0, []], [[], [["FU", 2, [0, 1, 2, 3]], ["SP", 2, 0, 1204224, [8], 1], ["AN", 2, 0, 5], ["AN", 2, 1, 6]]]], "r": [[0.000114358, 0.000114333, 0.000114361], 0, 6.27322, 1667925930], "v": "v0.6"}
{"i": [["[\"mul\", 1, 112, 112, 96]", "cuda -keys=cuda,gpu -max_num_threads=1024 -model=unknown -thread_warp_size=32", [-1, 16, 64, 49152, 2147483647, 1024, 8, 32], "", 0, []], [[], [["FU", 2, [0, 1, 2, 3]], ["SP", 2, 0, 1204224, [6], 1], ["AN", 2, 0, 5], ["AN", 2, 1, 6]]]], "r": [[0.000151543, 0.000151517, 0.000151517], 0, 6.59498, 1667925930], "v": "v0.6"}
{"i": [["[\"mul\", 1, 112, 112, 96]", "cuda -keys=cuda,gpu -max_num_threads=1024 -model=unknown -thread_warp_size=32", [-1, 16, 64, 49152, 2147483647, 1024, 8, 32], "", 0, []], [[], [["FU", 2, [0, 1, 2, 3]], ["SP", 2, 0, 1204224, [1], 1], ["AN", 2, 0, 5], ["AN", 2, 1, 6]]]], "r": [[0.000895673, 0.000895742, 0.000895621], 0, 7.04576, 1667925931], "v": "v0.6"}
{"i": [["[\"mul\", 1, 112, 112, 96]", "cuda -keys=cuda,gpu -max_num_threads=1024 -model=unknown -thread_warp_size=32", [-1, 16, 64, 49152, 2147483647, 1024, 8, 32], "", 0, []], [[], [["FU", 2, [0, 1, 2, 3]], ["SP", 2, 0, 1204224, [64], 1], ["AN", 2, 0, 5], ["AN", 2, 1, 6]]]], "r": [[1.65125e-05, 1.6487e-05, 1.64894e-05], 0, 1.80291, 1667932507], "v": "v0.6"}
{"i": [["[\"mul\", 1, 112, 112, 96]", "cuda -keys=cuda,gpu -max_num_threads=1024 -model=unknown -thread_warp_size=32", [-1, 16, 64, 49152, 2147483647, 1024, 8, 32], "", 0, []], [[], [["FU", 2, [0, 1, 2, 3]], ["SP", 2, 0, 1204224, [3], 1], ["AN", 2, 0, 5], ["AN", 2, 1, 6]]]], "r": [[0.000300444, 0.000300468, 0.000300456], 0, 0.72462, 1667932506], "v": "v0.6"}
{"i": [["[\"mul\", 1, 112, 112, 96]", "cuda -keys=cuda,gpu -max_num_threads=1024 -model=unknown -thread_warp_size=32", [-1, 16, 64, 49152, 2147483647, 1024, 8, 32], "", 0, []], [[], [["FU", 2, [0, 1, 2, 3]], ["SP", 2, 0, 1204224, [4], 1], ["AN", 2, 0, 5], ["AN", 2, 1, 6]]]], "r": [[0.000225857, 0.000225838, 0.000225867], 0, 2.19164, 1667932507], "v": "v0.6"}
{"i": [["[\"mul\", 1, 112, 112, 96]", "cuda -keys=cuda,gpu -max_num_threads=1024 -model=unknown -thread_warp_size=32", [-1, 16, 64, 49152, 2147483647, 1024, 8, 32], "", 0, []], [[], [["FU", 2, [0, 1, 2, 3]], ["SP", 2, 0, 1204224, [56], 1], ["AN", 2, 0, 5], ["AN", 2, 1, 6]]]], "r": [[1.85355e-05, 1.85473e-05, 1.85467e-05], 0, 1.55384, 1667932507], "v": "v0.6"}
{"i": [["[\"mul\", 1, 112, 112, 96]", "cuda -keys=cuda,gpu -max_num_threads=1024 -model=unknown -thread_warp_size=32", [-1, 16, 64, 49152, 2147483647, 1024, 8, 32], "", 0, []], [[], [["FU", 2, [0, 1, 2, 3]], ["SP", 2, 0, 1204224, [12], 1], ["AN", 2, 0, 5], ["AN", 2, 1, 6]]]], "r": [[7.71939e-05, 7.71949e-05, 7.71878e-05], 0, 1.0383, 1667932506], "v": "v0.6"}
{"i": [["[\"mul\", 1, 112, 112, 96]", "cuda -keys=cuda,gpu -max_num_threads=1024 -model=unknown -thread_warp_size=32", [-1, 16, 64, 49152, 2147483647, 1024, 8, 32], "", 0, []], [[], [["FU", 2, [0, 1, 2, 3]], ["SP", 2, 0, 1204224, [14], 1], ["AN", 2, 0, 5], ["AN", 2, 1, 6]]]], "r": [[6.65718e-05, 6.65749e-05, 6.65746e-05], 0, 2.56174, 1667932508], "v": "v0.6"}
{"i": [["[\"mul\", 1, 112, 112, 96]", "cuda -keys=cuda,gpu -max_num_threads=1024 -model=unknown -thread_warp_size=32", [-1, 16, 64, 49152, 2147483647, 1024, 8, 32], "", 0, []], [[], [["FU", 2, [0, 1, 2, 3]], ["SP", 2, 0, 1204224, [42], 1], ["AN", 2, 0, 5], ["AN", 2, 1, 6]]]], "r": [[2.36168e-05, 2.36076e-05, 2.36125e-05], 0, 3.78903, 1667932509], "v": "v0.6"}
{"i": [["[\"mul\", 1, 112, 112, 96]", "cuda -keys=cuda,gpu -max_num_threads=1024 -model=unknown -thread_warp_size=32", [-1, 16, 64, 49152, 2147483647, 1024, 8, 32], "", 0, []], [[], [["FU", 2, [0, 1, 2, 3]], ["SP", 2, 0, 1204224, [48], 1], ["AN", 2, 0, 5], ["AN", 2, 1, 6]]]], "r": [[2.10144e-05, 2.10224e-05, 2.10205e-05], 0, 2.94544, 1667932508], "v": "v0.6"}
{"i": [["[\"mul\", 1, 112, 112, 96]", "cuda -keys=cuda,gpu -max_num_threads=1024 -model=unknown -thread_warp_size=32", [-1, 16, 64, 49152, 2147483647, 1024, 8, 32], "", 0, []], [[], [["FU", 2, [0, 1, 2, 3]], ["SP", 2, 0, 1204224, [16], 1], ["AN", 2, 0, 5], ["AN", 2, 1, 6]]]], "r": [[5.85957e-05, 5.85797e-05, 5.86036e-05], 0, 3.33942, 1667932509], "v": "v0.6"}
{"i": [["[\"mul\", 1, 112, 112, 96]", "cuda -keys=cuda,gpu -max_num_threads=1024 -model=unknown -thread_warp_size=32", [-1, 16, 64, 49152, 2147483647, 1024, 8, 32], "", 0, []], [[], [["FU", 2, [0, 1, 2, 3]], ["SP", 2, 0, 1204224, [28], 1], ["AN", 2, 0, 5], ["AN", 2, 1, 6]]]], "r": [[3.46137e-05, 3.46104e-05, 3.46118e-05], 0, 4.07227, 1667932509], "v": "v0.6"}
{"i": [["[\"mul\", 1, 112, 112, 96]", "cuda -keys=cuda,gpu -max_num_threads=1024 -model=unknown -thread_warp_size=32", [-1, 16, 64, 49152, 2147483647, 1024, 8, 32], "", 0, []], [[], [["FU", 2, [0, 1, 2, 3]], ["SP", 2, 0, 1204224, [8], 1], ["AN", 2, 0, 5], ["AN", 2, 1, 6]]]], "r": [[0.000114237, 0.000114253, 0.000114235], 0, 4.41164, 1667932510], "v": "v0.6"}
{"i": [["[\"mul\", 1, 112, 112, 96]", "cuda -keys=cuda,gpu -max_num_threads=1024 -model=unknown -thread_warp_size=32", [-1, 16, 64, 49152, 2147483647, 1024, 8, 32], "", 0, []], [[], [["FU", 2, [0, 1, 2, 3]], ["SP", 2, 0, 1204224, [21], 1], ["AN", 2, 0, 5], ["AN", 2, 1, 6]]]], "r": [[4.51639e-05, 4.51988e-05, 4.51648e-05], 0, 4.74546, 1667932510], "v": "v0.6"}
{"i": [["[\"mul\", 1, 112, 112, 96]", "cuda -keys=cuda,gpu -max_num_threads=1024 -model=unknown -thread_warp_size=32", [-1, 16, 64, 49152, 2147483647, 1024, 8, 32], "", 0, []], [[], [["FU", 2, [0, 1, 2, 3]], ["SP", 2, 0, 1204224, [32], 1], ["AN", 2, 0, 5], ["AN", 2, 1, 6]]]], "r": [[3.07091e-05, 3.07267e-05, 3.07249e-05], 0, 5.46311, 1667932511], "v": "v0.6"}
{"i": [["[\"mul\", 1, 112, 112, 96]", "cuda -keys=cuda,gpu -max_num_threads=1024 -model=unknown -thread_warp_size=32", [-1, 16, 64, 49152, 2147483647, 1024, 8, 32], "", 0, []], [[], [["FU", 2, [0, 1, 2, 3]], ["SP", 2, 0, 1204224, [2], 1], ["AN", 2, 0, 5], ["AN", 2, 1, 6]]]], "r": [[0.000449234, 0.000449203, 0.000449108], 0, 5.11436, 1667932511], "v": "v0.6"}
{"i": [["[\"mul\", 1, 112, 112, 96]", "cuda -keys=cuda,gpu -max_num_threads=1024 -model=unknown -thread_warp_size=32", [-1, 16, 64, 49152, 2147483647, 1024, 8, 32], "", 0, []], [[], [["FU", 2, [0, 1, 2, 3]], ["SP", 2, 0, 1204224, [7], 1], ["AN", 2, 0, 5], ["AN", 2, 1, 6]]]], "r": [[0.000130256, 0.000130242, 0.000130246], 0, 5.79396, 1667932511], "v": "v0.6"}
{"i": [["[\"mul\", 1, 112, 112, 96]", "cuda -keys=cuda,gpu -max_num_threads=1024 -model=unknown -thread_warp_size=32", [-1, 16, 64, 49152, 2147483647, 1024, 8, 32], "", 0, []], [[], [["FU", 2, [0, 1, 2, 3]], ["SP", 2, 0, 1204224, [1], 1], ["AN", 2, 0, 5], ["AN", 2, 1, 6]]]], "r": [[0.000895639, 0.000895571, 0.000895599], 0, 6.17658, 1667932512], "v": "v0.6"}
{"i": [["[\"mul\", 1, 112, 112, 96]", "cuda -keys=cuda,gpu -max_num_threads=1024 -model=unknown -thread_warp_size=32", [-1, 16, 64, 49152, 2147483647, 1024, 8, 32], "", 0, []], [[], [["FU", 2, [0, 1, 2, 3]], ["SP", 2, 0, 1204224, [24], 1], ["AN", 2, 0, 5], ["AN", 2, 1, 6]]]], "r": [[4.00768e-05, 4.00655e-05, 4.00694e-05], 0, 6.50617, 1667932512], "v": "v0.6"}
{"i": [["[\"mul\", 1, 112, 112, 96]", "cuda -keys=cuda,gpu -max_num_threads=1024 -model=unknown -thread_warp_size=32", [-1, 16, 64, 49152, 2147483647, 1024, 8, 32], "", 0, []], [[], [["FU", 2, [0, 1, 2, 3]], ["SP", 2, 0, 1204224, [6], 1], ["AN", 2, 0, 5], ["AN", 2, 1, 6]]]], "r": [[0.00015154, 0.000151531, 0.000151568], 0, 6.83324, 1667932513], "v": "v0.6"}
{"i": [["[\"mul\", 1, 112, 112, 96]", "cuda -keys=cuda,gpu -max_num_threads=1024 -model=unknown -thread_warp_size=32", [-1, 16, 64, 49152, 2147483647, 1024, 8, 32], "", 0, []], [[], [["FU", 2, [0, 1, 2, 3]], ["SP", 2, 0, 1204224, [49], 1], ["AN", 2, 0, 5], ["AN", 2, 1, 6]]]], "r": [[2.06709e-05, 2.06722e-05, 2.0669e-05], 0, 7.22761, 1667932513], "v": "v0.6"}
