python/models/efficientnet/VertiFusionEfficientNet_kernel_configs/efficient_batch_norm_1_7_7_672.log
{"i": [["[\"batch_norm\", 1, 7, 7, 672]", "cuda -keys=cuda,gpu -max_num_threads=1024 -model=unknown -thread_warp_size=32", [-1, 16, 64, 49152, 2147483647, 1024, 8, 32], "", 0, []], [[], [["CI", 2], ["FU", 4, [0, 1, 2, 3]], ["SP", 4, 0, 32928, [8], 1], ["AN", 4, 0, 5], ["AN", 4, 1, 6]]]], "r": [[5.7764e-06, 5.78486e-06, 5.7841e-06], 0, 1.65423, 1667927519], "v": "v0.6"}
{"i": [["[\"batch_norm\", 1, 7, 7, 672]", "cuda -keys=cuda,gpu -max_num_threads=1024 -model=unknown -thread_warp_size=32", [-1, 16, 64, 49152, 2147483647, 1024, 8, 32], "", 0, []], [[], [["CI", 2], ["FU", 4, [0, 1, 2, 3]], ["SP", 4, 0, 32928, [21], 1], ["AN", 4, 0, 5], ["AN", 4, 1, 6]]]], "r": [[3.8521e-06, 3.85306e-06, 3.85218e-06], 0, 2.57097, 1667927520], "v": "v0.6"}
{"i": [["[\"batch_norm\", 1, 7, 7, 672]", "cuda -keys=cuda,gpu -max_num_threads=1024 -model=unknown -thread_warp_size=32", [-1, 16, 64, 49152, 2147483647, 1024, 8, 32], "", 0, []], [[], [["CI", 2], ["FU", 4, [0, 1, 2, 3]], ["SP", 4, 0, 32928, [6], 1], ["AN", 4, 0, 5], ["AN", 4, 1, 6]]]], "r": [[6.9113e-06, 6.91042e-06, 6.9077e-06], 0, 0.664159, 1667927517], "v": "v0.6"}
{"i": [["[\"batch_norm\", 1, 7, 7, 672]", "cuda -keys=cuda,gpu -max_num_threads=1024 -model=unknown -thread_warp_size=32", [-1, 16, 64, 49152, 2147483647, 1024, 8, 32], "", 0, []], [[], [["CI", 2], ["FU", 4, [0, 1, 2, 3]], ["SP", 4, 0, 32928, [42], 1], ["AN", 4, 0, 5], ["AN", 4, 1, 6]]]], "r": [[3.34186e-06, 3.34969e-06, 3.34547e-06], 0, 2.33461, 1667927519], "v": "v0.6"}
{"i": [["[\"batch_norm\", 1, 7, 7, 672]", "cuda -keys=cuda,gpu -max_num_threads=1024 -model=unknown -thread_warp_size=32", [-1, 16, 64, 49152, 2147483647, 1024, 8, 32], "", 0, []], [[], [["CI", 2], ["FU", 4, [0, 1, 2, 3]], ["SP", 4, 0, 32928, [2], 1], ["AN", 4, 0, 5], ["AN", 4, 1, 6]]]], "r": [[1.49683e-05, 1.49695e-05, 1.49697e-05], 0, 0.811112, 1667927518], "v": "v0.6"}
{"i": [["[\"batch_norm\", 1, 7, 7, 672]", "cuda -keys=cuda,gpu -max_num_threads=1024 -model=unknown -thread_warp_size=32", [-1, 16, 64, 49152, 2147483647, 1024, 8, 32], "", 0, []], [[], [["CI", 2], ["FU", 4, [0, 1, 2, 3]], ["SP", 4, 0, 32928, [56], 1], ["AN", 4, 0, 5], ["AN", 4, 1, 6]]]], "r": [[3.0904e-06, 3.09311e-06, 3.09275e-06], 0, 1.06565, 1667927518], "v": "v0.6"}
{"i": [["[\"batch_norm\", 1, 7, 7, 672]", "cuda -keys=cuda,gpu -max_num_threads=1024 -model=unknown -thread_warp_size=32", [-1, 16, 64, 49152, 2147483647, 1024, 8, 32], "", 0, []], [[], [["CI", 2], ["FU", 4, [0, 1, 2, 3]], ["SP", 4, 0, 32928, [1], 1], ["AN", 4, 0, 5], ["AN", 4, 1, 6]]]], "r": [[2.71035e-05, 2.71106e-05, 2.7101e-05], 0, 1.44932, 1667927518], "v": "v0.6"}
{"i": [["[\"batch_norm\", 1, 7, 7, 672]", "cuda -keys=cuda,gpu -max_num_threads=1024 -model=unknown -thread_warp_size=32", [-1, 16, 64, 49152, 2147483647, 1024, 8, 32], "", 0, []], [[], [["CI", 2], ["FU", 4, [0, 1, 2, 3]], ["SP", 4, 0, 32928, [14], 1], ["AN", 4, 0, 5], ["AN", 4, 1, 6]]]], "r": [[4.46952e-06, 4.46742e-06, 4.46676e-06], 0, 1.97242, 1667927519], "v": "v0.6"}
{"i": [["[\"batch_norm\", 1, 7, 7, 672]", "cuda -keys=cuda,gpu -max_num_threads=1024 -model=unknown -thread_warp_size=32", [-1, 16, 64, 49152, 2147483647, 1024, 8, 32], "", 0, []], [[], [["CI", 2], ["FU", 4, [0, 1, 2, 3]], ["SP", 4, 0, 32928, [7], 1], ["AN", 4, 0, 5], ["AN", 4, 1, 6]]]], "r": [[6.25602e-06, 6.25089e-06, 6.24991e-06], 0, 2.7351, 1667927520], "v": "v0.6"}
{"i": [["[\"batch_norm\", 1, 7, 7, 672]", "cuda -keys=cuda,gpu -max_num_threads=1024 -model=unknown -thread_warp_size=32", [-1, 16, 64, 49152, 2147483647, 1024, 8, 32], "", 0, []], [[], [["CI", 2], ["FU", 4, [0, 1, 2, 3]], ["SP", 4, 0, 32928, [24], 1], ["AN", 4, 0, 5], ["AN", 4, 1, 6]]]], "r": [[3.70415e-06, 3.70657e-06, 3.70753e-06], 0, 3.94061, 1667927521], "v": "v0.6"}
{"i": [["[\"batch_norm\", 1, 7, 7, 672]", "cuda -keys=cuda,gpu -max_num_threads=1024 -model=unknown -thread_warp_size=32", [-1, 16, 64, 49152, 2147483647, 1024, 8, 32], "", 0, []], [[], [["CI", 2], ["FU", 4, [0, 1, 2, 3]], ["SP", 4, 0, 32928, [32], 1], ["AN", 4, 0, 5], ["AN", 4, 1, 6]]]], "r": [[3.35527e-06, 3.35975e-06, 3.3604e-06], 0, 3.29372, 1667927521], "v": "v0.6"}
{"i": [["[\"batch_norm\", 1, 7, 7, 672]", "cuda -keys=cuda,gpu -max_num_threads=1024 -model=unknown -thread_warp_size=32", [-1, 16, 64, 49152, 2147483647, 1024, 8, 32], "", 0, []], [[], [["CI", 2], ["FU", 4, [0, 1, 2, 3]], ["SP", 4, 0, 32928, [4], 1], ["AN", 4, 0, 5], ["AN", 4, 1, 6]]]], "r": [[8.72687e-06, 8.73118e-06, 8.73159e-06], 0, 3.02429, 1667927520], "v": "v0.6"}
{"i": [["[\"batch_norm\", 1, 7, 7, 672]", "cuda -keys=cuda,gpu -max_num_threads=1024 -model=unknown -thread_warp_size=32", [-1, 16, 64, 49152, 2147483647, 1024, 8, 32], "", 0, []], [[], [["CI", 2], ["FU", 4, [0, 1, 2, 3]], ["SP", 4, 0, 32928, [28], 1], ["AN", 4, 0, 5], ["AN", 4, 1, 6]]]], "r": [[3.65046e-06, 3.6551e-06, 3.65749e-06], 0, 3.57736, 1667927521], "v": "v0.6"}
{"i": [["[\"batch_norm\", 1, 7, 7, 672]", "cuda -keys=cuda,gpu -max_num_threads=1024 -model=unknown -thread_warp_size=32", [-1, 16, 64, 49152, 2147483647, 1024, 8, 32], "", 0, []], [[], [["CI", 2], ["FU", 4, [0, 1, 2, 3]], ["SP", 4, 0, 32928, [16], 1], ["AN", 4, 0, 5], ["AN", 4, 1, 6]]]], "r": [[4.01665e-06, 4.01795e-06, 4.0197e-06], 0, 4.1496, 1667927521], "v": "v0.6"}
{"i": [["[\"batch_norm\", 1, 7, 7, 672]", "cuda -keys=cuda,gpu -max_num_threads=1024 -model=unknown -thread_warp_size=32", [-1, 16, 64, 49152, 2147483647, 1024, 8, 32], "", 0, []], [[], [["CI", 2], ["FU", 4, [0, 1, 2, 3]], ["SP", 4, 0, 32928, [49], 1], ["AN", 4, 0, 5], ["AN", 4, 1, 6]]]], "r": [[3.45773e-06, 3.46076e-06, 3.45835e-06], 0, 4.36439, 1667927522], "v": "v0.6"}
{"i": [["[\"batch_norm\", 1, 7, 7, 672]", "cuda -keys=cuda,gpu -max_num_threads=1024 -model=unknown -thread_warp_size=32", [-1, 16, 64, 49152, 2147483647, 1024, 8, 32], "", 0, []], [[], [["CI", 2], ["FU", 4, [0, 1, 2, 3]], ["SP", 4, 0, 32928, [12], 1], ["AN", 4, 0, 5], ["AN", 4, 1, 6]]]], "r": [[4.69536e-06, 4.69965e-06, 4.69028e-06], 0, 4.91303, 1667927522], "v": "v0.6"}
{"i": [["[\"batch_norm\", 1, 7, 7, 672]", "cuda -keys=cuda,gpu -max_num_threads=1024 -model=unknown -thread_warp_size=32", [-1, 16, 64, 49152, 2147483647, 1024, 8, 32], "", 0, []], [[], [["CI", 2], ["FU", 4, [0, 1, 2, 3]], ["SP", 4, 0, 32928, [3], 1], ["AN", 4, 0, 5], ["AN", 4, 1, 6]]]], "r": [[1.08397e-05, 1.08564e-05, 1.08554e-05], 0, 4.68476, 1667927522], "v": "v0.6"}
{"i": [["[\"batch_norm\", 1, 7, 7, 672]", "cuda -keys=cuda,gpu -max_num_threads=1024 -model=unknown -thread_warp_size=32", [-1, 16, 64, 49152, 2147483647, 1024, 8, 32], "", 0, []], [[], [["CI", 2], ["FU", 4, [0, 1, 2, 3]], ["SP", 4, 0, 32928, [48], 1], ["AN", 4, 0, 5], ["AN", 4, 1, 6]]]], "r": [[3.18312e-06, 3.18715e-06, 3.18612e-06], 0, 5.1749, 1667927523], "v": "v0.6"}
{"i": [["[\"batch_norm\", 1, 7, 7, 672]", "cuda -keys=cuda,gpu -max_num_threads=1024 -model=unknown -thread_warp_size=32", [-1, 16, 64, 49152, 2147483647, 1024, 8, 32], "", 0, []], [[], [["CI", 2], ["FU", 4, [0, 1, 2, 3]], ["SP", 4, 0, 32928, [8], 1], ["AN", 4, 0, 5], ["AN", 4, 1, 6]]]], "r": [[5.72002e-06, 5.72602e-06, 5.72102e-06], 0, 1.42265, 1667927634], "v": "v0.6"}
{"i": [["[\"batch_norm\", 1, 7, 7, 672]", "cuda -keys=cuda,gpu -max_num_threads=1024 -model=unknown -thread_warp_size=32", [-1, 16, 64, 49152, 2147483647, 1024, 8, 32], "", 0, []], [[], [["CI", 2], ["FU", 4, [0, 1, 2, 3]], ["SP", 4, 0, 32928, [28], 1], ["AN", 4, 0, 5], ["AN", 4, 1, 6]]]], "r": [[3.49963e-06, 3.49933e-06, 3.50325e-06], 0, 1.13322, 1667927633], "v": "v0.6"}
{"i": [["[\"batch_norm\", 1, 7, 7, 672]", "cuda -keys=cuda,gpu -max_num_threads=1024 -model=unknown -thread_warp_size=32", [-1, 16, 64, 49152, 2147483647, 1024, 8, 32], "", 0, []], [[], [["CI", 2], ["FU", 4, [0, 1, 2, 3]], ["SP", 4, 0, 32928, [48], 1], ["AN", 4, 0, 5], ["AN", 4, 1, 6]]]], "r": [[3.44571e-06, 3.4471e-06, 3.44915e-06], 0, 0.570077, 1667927633], "v": "v0.6"}
{"i": [["[\"batch_norm\", 1, 7, 7, 672]", "cuda -keys=cuda,gpu -max_num_threads=1024 -model=unknown -thread_warp_size=32", [-1, 16, 64, 49152, 2147483647, 1024, 8, 32], "", 0, []], [[], [["CI", 2], ["FU", 4, [0, 1, 2, 3]], ["SP", 4, 0, 32928, [56], 1], ["AN", 4, 0, 5], ["AN", 4, 1, 6]]]], "r": [[3.09384e-06, 3.09667e-06, 3.09675e-06], 0, 0.91316, 1667927633], "v": "v0.6"}
{"i": [["[\"batch_norm\", 1, 7, 7, 672]", "cuda -keys=cuda,gpu -max_num_threads=1024 -model=unknown -thread_warp_size=32", [-1, 16, 64, 49152, 2147483647, 1024, 8, 32], "", 0, []], [[], [["CI", 2], ["FU", 4, [0, 1, 2, 3]], ["SP", 4, 0, 32928, [7], 1], ["AN", 4, 0, 5], ["AN", 4, 1, 6]]]], "r": [[6.10554e-06, 6.10308e-06, 6.10518e-06], 0, 1.73119, 1667927634], "v": "v0.6"}
{"i": [["[\"batch_norm\", 1, 7, 7, 672]", "cuda -keys=cuda,gpu -max_num_threads=1024 -model=unknown -thread_warp_size=32", [-1, 16, 64, 49152, 2147483647, 1024, 8, 32], "", 0, []], [[], [["CI", 2], ["FU", 4, [0, 1, 2, 3]], ["SP", 4, 0, 32928, [12], 1], ["AN", 4, 0, 5], ["AN", 4, 1, 6]]]], "r": [[4.63754e-06, 4.63906e-06, 4.63839e-06], 0, 2.02154, 1667927634], "v": "v0.6"}
{"i": [["[\"batch_norm\", 1, 7, 7, 672]", "cuda -keys=cuda,gpu -max_num_threads=1024 -model=unknown -thread_warp_size=32", [-1, 16, 64, 49152, 2147483647, 1024, 8, 32], "", 0, []], [[], [["CI", 2], ["FU", 4, [0, 1, 2, 3]], ["SP", 4, 0, 32928, [2], 1], ["AN", 4, 0, 5], ["AN", 4, 1, 6]]]], "r": [[1.50508e-05, 1.50449e-05, 1.50467e-05], 0, 2.73073, 1667927635], "v": "v0.6"}
{"i": [["[\"batch_norm\", 1, 7, 7, 672]", "cuda -keys=cuda,gpu -max_num_threads=1024 -model=unknown -thread_warp_size=32", [-1, 16, 64, 49152, 2147483647, 1024, 8, 32], "", 0, []], [[], [["CI", 2], ["FU", 4, [0, 1, 2, 3]], ["SP", 4, 0, 32928, [21], 1], ["AN", 4, 0, 5], ["AN", 4, 1, 6]]]], "r": [[3.74177e-06, 3.73904e-06, 3.7417e-06], 0, 2.27051, 1667927635], "v": "v0.6"}
{"i": [["[\"batch_norm\", 1, 7, 7, 672]", "cuda -keys=cuda,gpu -max_num_threads=1024 -model=unknown -thread_warp_size=32", [-1, 16, 64, 49152, 2147483647, 1024, 8, 32], "", 0, []], [[], [["CI", 2], ["FU", 4, [0, 1, 2, 3]], ["SP", 4, 0, 32928, [6], 1], ["AN", 4, 0, 5], ["AN", 4, 1, 6]]]], "r": [[6.95347e-06, 6.95627e-06, 6.94977e-06], 0, 3.2052, 1667927636], "v": "v0.6"}
{"i": [["[\"batch_norm\", 1, 7, 7, 672]", "cuda -keys=cuda,gpu -max_num_threads=1024 -model=unknown -thread_warp_size=32", [-1, 16, 64, 49152, 2147483647, 1024, 8, 32], "", 0, []], [[], [["CI", 2], ["FU", 4, [0, 1, 2, 3]], ["SP", 4, 0, 32928, [1], 1], ["AN", 4, 0, 5], ["AN", 4, 1, 6]]]], "r": [[2.73071e-05, 2.73011e-05, 2.73012e-05], 0, 2.43428, 1667927635], "v": "v0.6"}
{"i": [["[\"batch_norm\", 1, 7, 7, 672]", "cuda -keys=cuda,gpu -max_num_threads=1024 -model=unknown -thread_warp_size=32", [-1, 16, 64, 49152, 2147483647, 1024, 8, 32], "", 0, []], [[], [["CI", 2], ["FU", 4, [0, 1, 2, 3]], ["SP", 4, 0, 32928, [42], 1], ["AN", 4, 0, 5], ["AN", 4, 1, 6]]]], "r": [[3.44415e-06, 3.44265e-06, 3.4485e-06], 0, 3.50064, 1667927636], "v": "v0.6"}
{"i": [["[\"batch_norm\", 1, 7, 7, 672]", "cuda -keys=cuda,gpu -max_num_threads=1024 -model=unknown -thread_warp_size=32", [-1, 16, 64, 49152, 2147483647, 1024, 8, 32], "", 0, []], [[], [["CI", 2], ["FU", 4, [0, 1, 2, 3]], ["SP", 4, 0, 32928, [49], 1], ["AN", 4, 0, 5], ["AN", 4, 1, 6]]]], "r": [[3.36191e-06, 3.35419e-06, 3.3638e-06], 0, 2.89975, 1667927636], "v": "v0.6"}
{"i": [["[\"batch_norm\", 1, 7, 7, 672]", "cuda -keys=cuda,gpu -max_num_threads=1024 -model=unknown -thread_warp_size=32", [-1, 16, 64, 49152, 2147483647, 1024, 8, 32], "", 0, []], [[], [["CI", 2], ["FU", 4, [0, 1, 2, 3]], ["SP", 4, 0, 32928, [32], 1], ["AN", 4, 0, 5], ["AN", 4, 1, 6]]]], "r": [[3.57462e-06, 3.57875e-06, 3.57569e-06], 0, 4.30846, 1667927637], "v": "v0.6"}
{"i": [["[\"batch_norm\", 1, 7, 7, 672]", "cuda -keys=cuda,gpu -max_num_threads=1024 -model=unknown -thread_warp_size=32", [-1, 16, 64, 49152, 2147483647, 1024, 8, 32], "", 0, []], [[], [["CI", 2], ["FU", 4, [0, 1, 2, 3]], ["SP", 4, 0, 32928, [4], 1], ["AN", 4, 0, 5], ["AN", 4, 1, 6]]]], "r": [[8.79723e-06, 8.80144e-06, 8.7967e-06], 0, 3.78857, 1667927637], "v": "v0.6"}
{"i": [["[\"batch_norm\", 1, 7, 7, 672]", "cuda -keys=cuda,gpu -max_num_threads=1024 -model=unknown -thread_warp_size=32", [-1, 16, 64, 49152, 2147483647, 1024, 8, 32], "", 0, []], [[], [["CI", 2], ["FU", 4, [0, 1, 2, 3]], ["SP", 4, 0, 32928, [14], 1], ["AN", 4, 0, 5], ["AN", 4, 1, 6]]]], "r": [[4.44982e-06, 4.4487e-06, 4.43724e-06], 0, 4.01979, 1667927637], "v": "v0.6"}
{"i": [["[\"batch_norm\", 1, 7, 7, 672]", "cuda -keys=cuda,gpu -max_num_threads=1024 -model=unknown -thread_warp_size=32", [-1, 16, 64, 49152, 2147483647, 1024, 8, 32], "", 0, []], [[], [["CI", 2], ["FU", 4, [0, 1, 2, 3]], ["SP", 4, 0, 32928, [3], 1], ["AN", 4, 0, 5], ["AN", 4, 1, 6]]]], "r": [[1.08764e-05, 1.0869e-05, 1.08674e-05], 0, 4.57915, 1667927637], "v": "v0.6"}
{"i": [["[\"batch_norm\", 1, 7, 7, 672]", "cuda -keys=cuda,gpu -max_num_threads=1024 -model=unknown -thread_warp_size=32", [-1, 16, 64, 49152, 2147483647, 1024, 8, 32], "", 0, []], [[], [["CI", 2], ["FU", 4, [0, 1, 2, 3]], ["SP", 4, 0, 32928, [16], 1], ["AN", 4, 0, 5], ["AN", 4, 1, 6]]]], "r": [[4.01758e-06, 4.01706e-06, 4.01699e-06], 0, 4.79921, 1667927638], "v": "v0.6"}
{"i": [["[\"batch_norm\", 1, 7, 7, 672]", "cuda -keys=cuda,gpu -max_num_threads=1024 -model=unknown -thread_warp_size=32", [-1, 16, 64, 49152, 2147483647, 1024, 8, 32], "", 0, []], [[], [["CI", 2], ["FU", 4, [0, 1, 2, 3]], ["SP", 4, 0, 32928, [24], 1], ["AN", 4, 0, 5], ["AN", 4, 1, 6]]]], "r": [[3.66705e-06, 3.66195e-06, 3.66495e-06], 0, 5.04704, 1667927638], "v": "v0.6"}
{"i": [["[\"batch_norm\", 1, 7, 7, 672]", "cuda -keys=cuda,gpu -max_num_threads=1024 -model=unknown -thread_warp_size=32", [-1, 16, 64, 49152, 2147483647, 1024, 8, 32], "", 0, []], [[], [["CI", 2], ["FU", 4, [0, 1, 2, 3]], ["SP", 4, 0, 32928, [21], 1], ["AN", 4, 0, 5], ["AN", 4, 1, 6]]]], "r": [[3.767e-06, 3.76838e-06, 3.76993e-06], 0, 1.48308, 1667945079], "v": "v0.6"}
{"i": [["[\"batch_norm\", 1, 7, 7, 672]", "cuda -keys=cuda,gpu -max_num_threads=1024 -model=unknown -thread_warp_size=32", [-1, 16, 64, 49152, 2147483647, 1024, 8, 32], "", 0, []], [[], [["CI", 2], ["FU", 4, [0, 1, 2, 3]], ["SP", 4, 0, 32928, [42], 1], ["AN", 4, 0, 5], ["AN", 4, 1, 6]]]], "r": [[3.34763e-06, 3.34289e-06, 3.34793e-06], 0, 2.6242, 1667945080], "v": "v0.6"}
{"i": [["[\"batch_norm\", 1, 7, 7, 672]", "cuda -keys=cuda,gpu -max_num_threads=1024 -model=unknown -thread_warp_size=32", [-1, 16, 64, 49152, 2147483647, 1024, 8, 32], "", 0, []], [[], [["CI", 2], ["FU", 4, [0, 1, 2, 3]], ["SP", 4, 0, 32928, [14], 1], ["AN", 4, 0, 5], ["AN", 4, 1, 6]]]], "r": [[4.51818e-06, 4.51944e-06, 4.51522e-06], 0, 2.03151, 1667945079], "v": "v0.6"}
{"i": [["[\"batch_norm\", 1, 7, 7, 672]", "cuda -keys=cuda,gpu -max_num_threads=1024 -model=unknown -thread_warp_size=32", [-1, 16, 64, 49152, 2147483647, 1024, 8, 32], "", 0, []], [[], [["CI", 2], ["FU", 4, [0, 1, 2, 3]], ["SP", 4, 0, 32928, [1], 1], ["AN", 4, 0, 5], ["AN", 4, 1, 6]]]], "r": [[2.72017e-05, 2.71846e-05, 2.71971e-05], 0, 0.909493, 1667945078], "v": "v0.6"}
{"i": [["[\"batch_norm\", 1, 7, 7, 672]", "cuda -keys=cuda,gpu -max_num_threads=1024 -model=unknown -thread_warp_size=32", [-1, 16, 64, 49152, 2147483647, 1024, 8, 32], "", 0, []], [[], [["CI", 2], ["FU", 4, [0, 1, 2, 3]], ["SP", 4, 0, 32928, [49], 1], ["AN", 4, 0, 5], ["AN", 4, 1, 6]]]], "r": [[3.35331e-06, 3.35601e-06, 3.36111e-06], 0, 2.32935, 1667945080], "v": "v0.6"}
{"i": [["[\"batch_norm\", 1, 7, 7, 672]", "cuda -keys=cuda,gpu -max_num_threads=1024 -model=unknown -thread_warp_size=32", [-1, 16, 64, 49152, 2147483647, 1024, 8, 32], "", 0, []], [[], [["CI", 2], ["FU", 4, [0, 1, 2, 3]], ["SP", 4, 0, 32928, [48], 1], ["AN", 4, 0, 5], ["AN", 4, 1, 6]]]], "r": [[4.57032e-06, 5.42888e-06, 3.20139e-06], 0, 0.618262, 1667945078], "v": "v0.6"}
{"i": [["[\"batch_norm\", 1, 7, 7, 672]", "cuda -keys=cuda,gpu -max_num_threads=1024 -model=unknown -thread_warp_size=32", [-1, 16, 64, 49152, 2147483647, 1024, 8, 32], "", 0, []], [[], [["CI", 2], ["FU", 4, [0, 1, 2, 3]], ["SP", 4, 0, 32928, [2], 1], ["AN", 4, 0, 5], ["AN", 4, 1, 6]]]], "r": [[1.49201e-05, 1.4918e-05, 1.49184e-05], 0, 1.77552, 1667945079], "v": "v0.6"}
{"i": [["[\"batch_norm\", 1, 7, 7, 672]", "cuda -keys=cuda,gpu -max_num_threads=1024 -model=unknown -thread_warp_size=32", [-1, 16, 64, 49152, 2147483647, 1024, 8, 32], "", 0, []], [[], [["CI", 2], ["FU", 4, [0, 1, 2, 3]], ["SP", 4, 0, 32928, [8], 1], ["AN", 4, 0, 5], ["AN", 4, 1, 6]]]], "r": [[5.80476e-06, 5.80447e-06, 5.80947e-06], 0, 1.1844, 1667945078], "v": "v0.6"}
{"i": [["[\"batch_norm\", 1, 7, 7, 672]", "cuda -keys=cuda,gpu -max_num_threads=1024 -model=unknown -thread_warp_size=32", [-1, 16, 64, 49152, 2147483647, 1024, 8, 32], "", 0, []], [[], [["CI", 2], ["FU", 4, [0, 1, 2, 3]], ["SP", 4, 0, 32928, [32], 1], ["AN", 4, 0, 5], ["AN", 4, 1, 6]]]], "r": [[3.42281e-06, 3.42113e-06, 3.42726e-06], 0, 2.79712, 1667945080], "v": "v0.6"}
{"i": [["[\"batch_norm\", 1, 7, 7, 672]", "cuda -keys=cuda,gpu -max_num_threads=1024 -model=unknown -thread_warp_size=32", [-1, 16, 64, 49152, 2147483647, 1024, 8, 32], "", 0, []], [[], [["CI", 2], ["FU", 4, [0, 1, 2, 3]], ["SP", 4, 0, 32928, [56], 1], ["AN", 4, 0, 5], ["AN", 4, 1, 6]]]], "r": [[3.15494e-06, 3.15849e-06, 3.15891e-06], 0, 3.13656, 1667945081], "v": "v0.6"}
{"i": [["[\"batch_norm\", 1, 7, 7, 672]", "cuda -keys=cuda,gpu -max_num_threads=1024 -model=unknown -thread_warp_size=32", [-1, 16, 64, 49152, 2147483647, 1024, 8, 32], "", 0, []], [[], [["CI", 2], ["FU", 4, [0, 1, 2, 3]], ["SP", 4, 0, 32928, [24], 1], ["AN", 4, 0, 5], ["AN", 4, 1, 6]]]], "r": [[3.70946e-06, 3.70853e-06, 3.70926e-06], 0, 3.31873, 1667945081], "v": "v0.6"}
{"i": [["[\"batch_norm\", 1, 7, 7, 672]", "cuda -keys=cuda,gpu -max_num_threads=1024 -model=unknown -thread_warp_size=32", [-1, 16, 64, 49152, 2147483647, 1024, 8, 32], "", 0, []], [[], [["CI", 2], ["FU", 4, [0, 1, 2, 3]], ["SP", 4, 0, 32928, [4], 1], ["AN", 4, 0, 5], ["AN", 4, 1, 6]]]], "r": [[8.91323e-06, 8.91118e-06, 8.91707e-06], 0, 3.55276, 1667945081], "v": "v0.6"}
{"i": [["[\"batch_norm\", 1, 7, 7, 672]", "cuda -keys=cuda,gpu -max_num_threads=1024 -model=unknown -thread_warp_size=32", [-1, 16, 64, 49152, 2147483647, 1024, 8, 32], "", 0, []], [[], [["CI", 2], ["FU", 4, [0, 1, 2, 3]], ["SP", 4, 0, 32928, [6], 1], ["AN", 4, 0, 5], ["AN", 4, 1, 6]]]], "r": [[6.77259e-06, 6.77151e-06, 6.77134e-06], 0, 3.87199, 1667945082], "v": "v0.6"}
{"i": [["[\"batch_norm\", 1, 7, 7, 672]", "cuda -keys=cuda,gpu -max_num_threads=1024 -model=unknown -thread_warp_size=32", [-1, 16, 64, 49152, 2147483647, 1024, 8, 32], "", 0, []], [[], [["CI", 2], ["FU", 4, [0, 1, 2, 3]], ["SP", 4, 0, 32928, [7], 1], ["AN", 4, 0, 5], ["AN", 4, 1, 6]]]], "r": [[6.17419e-06, 6.17543e-06, 6.17345e-06], 0, 4.13287, 1667945082], "v": "v0.6"}
{"i": [["[\"batch_norm\", 1, 7, 7, 672]", "cuda -keys=cuda,gpu -max_num_threads=1024 -model=unknown -thread_warp_size=32", [-1, 16, 64, 49152, 2147483647, 1024, 8, 32], "", 0, []], [[], [["CI", 2], ["FU", 4, [0, 1, 2, 3]], ["SP", 4, 0, 32928, [12], 1], ["AN", 4, 0, 5], ["AN", 4, 1, 6]]]], "r": [[4.79673e-06, 4.79362e-06, 4.79563e-06], 0, 4.37749, 1667945082], "v": "v0.6"}
{"i": [["[\"batch_norm\", 1, 7, 7, 672]", "cuda -keys=cuda,gpu -max_num_threads=1024 -model=unknown -thread_warp_size=32", [-1, 16, 64, 49152, 2147483647, 1024, 8, 32], "", 0, []], [[], [["CI", 2], ["FU", 4, [0, 1, 2, 3]], ["SP", 4, 0, 32928, [28], 1], ["AN", 4, 0, 5], ["AN", 4, 1, 6]]]], "r": [[3.49609e-06, 3.49478e-06, 3.50078e-06], 0, 4.65387, 1667945083], "v": "v0.6"}
{"i": [["[\"batch_norm\", 1, 7, 7, 672]", "cuda -keys=cuda,gpu -max_num_threads=1024 -model=unknown -thread_warp_size=32", [-1, 16, 64, 49152, 2147483647, 1024, 8, 32], "", 0, []], [[], [["CI", 2], ["FU", 4, [0, 1, 2, 3]], ["SP", 4, 0, 32928, [3], 1], ["AN", 4, 0, 5], ["AN", 4, 1, 6]]]], "r": [[1.08721e-05, 1.08695e-05, 1.08667e-05], 0, 4.93625, 1667945083], "v": "v0.6"}
{"i": [["[\"batch_norm\", 1, 7, 7, 672]", "cuda -keys=cuda,gpu -max_num_threads=1024 -model=unknown -thread_warp_size=32", [-1, 16, 64, 49152, 2147483647, 1024, 8, 32], "", 0, []], [[], [["CI", 2], ["FU", 4, [0, 1, 2, 3]], ["SP", 4, 0, 32928, [16], 1], ["AN", 4, 0, 5], ["AN", 4, 1, 6]]]], "r": [[4.12651e-06, 4.12487e-06, 4.13178e-06], 0, 5.25273, 1667945083], "v": "v0.6"}
{"i": [["[\"batch_norm\", 1, 7, 7, 672]", "cuda -keys=cuda,gpu -max_num_threads=1024 -model=unknown -thread_warp_size=32", [-1, 16, 64, 49152, 2147483647, 1024, 8, 32], "", 0, []], [[], [["CI", 2], ["FU", 4, [0, 1, 2, 3]], ["SP", 4, 0, 32928, [2], 1], ["AN", 4, 0, 5], ["AN", 4, 1, 6]]]], "r": [[1.49027e-05, 1.49027e-05, 1.49011e-05], 0, 1.13364, 1667945487], "v": "v0.6"}
{"i": [["[\"batch_norm\", 1, 7, 7, 672]", "cuda -keys=cuda,gpu -max_num_threads=1024 -model=unknown -thread_warp_size=32", [-1, 16, 64, 49152, 2147483647, 1024, 8, 32], "", 0, []], [[], [["CI", 2], ["FU", 4, [0, 1, 2, 3]], ["SP", 4, 0, 32928, [49], 1], ["AN", 4, 0, 5], ["AN", 4, 1, 6]]]], "r": [[3.17394e-06, 3.17506e-06, 3.17673e-06], 0, 3.27271, 1667945490], "v": "v0.6"}
{"i": [["[\"batch_norm\", 1, 7, 7, 672]", "cuda -keys=cuda,gpu -max_num_threads=1024 -model=unknown -thread_warp_size=32", [-1, 16, 64, 49152, 2147483647, 1024, 8, 32], "", 0, []], [[], [["CI", 2], ["FU", 4, [0, 1, 2, 3]], ["SP", 4, 0, 32928, [3], 1], ["AN", 4, 0, 5], ["AN", 4, 1, 6]]]], "r": [[1.09579e-05, 1.0977e-05, 1.09707e-05], 0, 0.65274, 1667945487], "v": "v0.6"}
{"i": [["[\"batch_norm\", 1, 7, 7, 672]", "cuda -keys=cuda,gpu -max_num_threads=1024 -model=unknown -thread_warp_size=32", [-1, 16, 64, 49152, 2147483647, 1024, 8, 32], "", 0, []], [[], [["CI", 2], ["FU", 4, [0, 1, 2, 3]], ["SP", 4, 0, 32928, [7], 1], ["AN", 4, 0, 5], ["AN", 4, 1, 6]]]], "r": [[6.17243e-06, 6.17627e-06, 6.17245e-06], 0, 1.52315, 1667945488], "v": "v0.6"}
{"i": [["[\"batch_norm\", 1, 7, 7, 672]", "cuda -keys=cuda,gpu -max_num_threads=1024 -model=unknown -thread_warp_size=32", [-1, 16, 64, 49152, 2147483647, 1024, 8, 32], "", 0, []], [[], [["CI", 2], ["FU", 4, [0, 1, 2, 3]], ["SP", 4, 0, 32928, [8], 1], ["AN", 4, 0, 5], ["AN", 4, 1, 6]]]], "r": [[5.67953e-06, 5.67667e-06, 5.66967e-06], 0, 2.60666, 1667945489], "v": "v0.6"}
{"i": [["[\"batch_norm\", 1, 7, 7, 672]", "cuda -keys=cuda,gpu -max_num_threads=1024 -model=unknown -thread_warp_size=32", [-1, 16, 64, 49152, 2147483647, 1024, 8, 32], "", 0, []], [[], [["CI", 2], ["FU", 4, [0, 1, 2, 3]], ["SP", 4, 0, 32928, [6], 1], ["AN", 4, 0, 5], ["AN", 4, 1, 6]]]], "r": [[6.78536e-06, 6.78381e-06, 6.78354e-06], 0, 0.86454, 1667945487], "v": "v0.6"}
{"i": [["[\"batch_norm\", 1, 7, 7, 672]", "cuda -keys=cuda,gpu -max_num_threads=1024 -model=unknown -thread_warp_size=32", [-1, 16, 64, 49152, 2147483647, 1024, 8, 32], "", 0, []], [[], [["CI", 2], ["FU", 4, [0, 1, 2, 3]], ["SP", 4, 0, 32928, [14], 1], ["AN", 4, 0, 5], ["AN", 4, 1, 6]]]], "r": [[4.4337e-06, 4.43482e-06, 4.43868e-06], 0, 2.04273, 1667945488], "v": "v0.6"}
{"i": [["[\"batch_norm\", 1, 7, 7, 672]", "cuda -keys=cuda,gpu -max_num_threads=1024 -model=unknown -thread_warp_size=32", [-1, 16, 64, 49152, 2147483647, 1024, 8, 32], "", 0, []], [[], [["CI", 2], ["FU", 4, [0, 1, 2, 3]], ["SP", 4, 0, 32928, [28], 1], ["AN", 4, 0, 5], ["AN", 4, 1, 6]]]], "r": [[3.40037e-06, 3.40309e-06, 3.40747e-06], 0, 1.77843, 1667945488], "v": "v0.6"}
{"i": [["[\"batch_norm\", 1, 7, 7, 672]", "cuda -keys=cuda,gpu -max_num_threads=1024 -model=unknown -thread_warp_size=32", [-1, 16, 64, 49152, 2147483647, 1024, 8, 32], "", 0, []], [[], [["CI", 2], ["FU", 4, [0, 1, 2, 3]], ["SP", 4, 0, 32928, [32], 1], ["AN", 4, 0, 5], ["AN", 4, 1, 6]]]], "r": [[3.42506e-06, 3.42736e-06, 3.42585e-06], 0, 3.46952, 1667945490], "v": "v0.6"}
{"i": [["[\"batch_norm\", 1, 7, 7, 672]", "cuda -keys=cuda,gpu -max_num_threads=1024 -model=unknown -thread_warp_size=32", [-1, 16, 64, 49152, 2147483647, 1024, 8, 32], "", 0, []], [[], [["CI", 2], ["FU", 4, [0, 1, 2, 3]], ["SP", 4, 0, 32928, [16], 1], ["AN", 4, 0, 5], ["AN", 4, 1, 6]]]], "r": [[4.01786e-06, 4.01699e-06, 4.01781e-06], 0, 2.26976, 1667945489], "v": "v0.6"}
{"i": [["[\"batch_norm\", 1, 7, 7, 672]", "cuda -keys=cuda,gpu -max_num_threads=1024 -model=unknown -thread_warp_size=32", [-1, 16, 64, 49152, 2147483647, 1024, 8, 32], "", 0, []], [[], [["CI", 2], ["FU", 4, [0, 1, 2, 3]], ["SP", 4, 0, 32928, [56], 1], ["AN", 4, 0, 5], ["AN", 4, 1, 6]]]], "r": [[3.24157e-06, 3.24082e-06, 3.24685e-06], 0, 2.84077, 1667945489], "v": "v0.6"}
{"i": [["[\"batch_norm\", 1, 7, 7, 672]", "cuda -keys=cuda,gpu -max_num_threads=1024 -model=unknown -thread_warp_size=32", [-1, 16, 64, 49152, 2147483647, 1024, 8, 32], "", 0, []], [[], [["CI", 2], ["FU", 4, [0, 1, 2, 3]], ["SP", 4, 0, 32928, [24], 1], ["AN", 4, 0, 5], ["AN", 4, 1, 6]]]], "r": [[3.57604e-06, 3.57707e-06, 3.57704e-06], 0, 3.67752, 1667945490], "v": "v0.6"}
{"i": [["[\"batch_norm\", 1, 7, 7, 672]", "cuda -keys=cuda,gpu -max_num_threads=1024 -model=unknown -thread_warp_size=32", [-1, 16, 64, 49152, 2147483647, 1024, 8, 32], "", 0, []], [[], [["CI", 2], ["FU", 4, [0, 1, 2, 3]], ["SP", 4, 0, 32928, [4], 1], ["AN", 4, 0, 5], ["AN", 4, 1, 6]]]], "r": [[8.78108e-06, 8.77827e-06, 8.78094e-06], 0, 3.91972, 1667945491], "v": "v0.6"}
{"i": [["[\"batch_norm\", 1, 7, 7, 672]", "cuda -keys=cuda,gpu -max_num_threads=1024 -model=unknown -thread_warp_size=32", [-1, 16, 64, 49152, 2147483647, 1024, 8, 32], "", 0, []], [[], [["CI", 2], ["FU", 4, [0, 1, 2, 3]], ["SP", 4, 0, 32928, [12], 1], ["AN", 4, 0, 5], ["AN", 4, 1, 6]]]], "r": [[4.60704e-06, 4.60654e-06, 4.6064e-06], 0, 4.17537, 1667945491], "v": "v0.6"}
{"i": [["[\"batch_norm\", 1, 7, 7, 672]", "cuda -keys=cuda,gpu -max_num_threads=1024 -model=unknown -thread_warp_size=32", [-1, 16, 64, 49152, 2147483647, 1024, 8, 32], "", 0, []], [[], [["CI", 2], ["FU", 4, [0, 1, 2, 3]], ["SP", 4, 0, 32928, [42], 1], ["AN", 4, 0, 5], ["AN", 4, 1, 6]]]], "r": [[3.44665e-06, 3.44496e-06, 3.44561e-06], 0, 4.71293, 1667945492], "v": "v0.6"}
{"i": [["[\"batch_norm\", 1, 7, 7, 672]", "cuda -keys=cuda,gpu -max_num_threads=1024 -model=unknown -thread_warp_size=32", [-1, 16, 64, 49152, 2147483647, 1024, 8, 32], "", 0, []], [[], [["CI", 2], ["FU", 4, [0, 1, 2, 3]], ["SP", 4, 0, 32928, [1], 1], ["AN", 4, 0, 5], ["AN", 4, 1, 6]]]], "r": [[2.71259e-05, 2.71296e-05, 2.7127e-05], 0, 4.4506, 1667945491], "v": "v0.6"}
{"i": [["[\"batch_norm\", 1, 7, 7, 672]", "cuda -keys=cuda,gpu -max_num_threads=1024 -model=unknown -thread_warp_size=32", [-1, 16, 64, 49152, 2147483647, 1024, 8, 32], "", 0, []], [[], [["CI", 2], ["FU", 4, [0, 1, 2, 3]], ["SP", 4, 0, 32928, [48], 1], ["AN", 4, 0, 5], ["AN", 4, 1, 6]]]], "r": [[3.20047e-06, 3.20515e-06, 3.20473e-06], 0, 4.9565, 1667945492], "v": "v0.6"}
{"i": [["[\"batch_norm\", 1, 7, 7, 672]", "cuda -keys=cuda,gpu -max_num_threads=1024 -model=unknown -thread_warp_size=32", [-1, 16, 64, 49152, 2147483647, 1024, 8, 32], "", 0, []], [[], [["CI", 2], ["FU", 4, [0, 1, 2, 3]], ["SP", 4, 0, 32928, [21], 1], ["AN", 4, 0, 5], ["AN", 4, 1, 6]]]], "r": [[3.90233e-06, 3.90251e-06, 3.9023e-06], 0, 5.29005, 1667945492], "v": "v0.6"}
