python/models/efficientnet/VertiFusionEfficientNet_kernel_configs/efficient_mul_1_56_56_144.log
{"i": [["[\"mul\", 1, 56, 56, 144]", "cuda -keys=cuda,gpu -max_num_threads=1024 -model=unknown -thread_warp_size=32", [-1, 16, 64, 49152, 2147483647, 1024, 8, 32], "", 0, []], [[], [["FU", 2, [0, 1, 2, 3]], ["SP", 2, 0, 451584, [4], 1], ["AN", 2, 0, 5], ["AN", 2, 1, 6]]]], "r": [[8.6324e-05, 8.63312e-05, 8.63434e-05], 0, 1.6185, 1667925613], "v": "v0.6"}
{"i": [["[\"mul\", 1, 56, 56, 144]", "cuda -keys=cuda,gpu -max_num_threads=1024 -model=unknown -thread_warp_size=32", [-1, 16, 64, 49152, 2147483647, 1024, 8, 32], "", 0, []], [[], [["FU", 2, [0, 1, 2, 3]], ["SP", 2, 0, 451584, [9], 1], ["AN", 2, 0, 5], ["AN", 2, 1, 6]]]], "r": [[3.98279e-05, 3.98522e-05, 3.98275e-05], 0, 0.915977, 1667925613], "v": "v0.6"}
{"i": [["[\"mul\", 1, 56, 56, 144]", "cuda -keys=cuda,gpu -max_num_threads=1024 -model=unknown -thread_warp_size=32", [-1, 16, 64, 49152, 2147483647, 1024, 8, 32], "", 0, []], [[], [["FU", 2, [0, 1, 2, 3]], ["SP", 2, 0, 451584, [14], 1], ["AN", 2, 0, 5], ["AN", 2, 1, 6]]]], "r": [[2.66494e-05, 2.66546e-05, 5.01828e-05], 0, 0.68586, 1667925612], "v": "v0.6"}
{"i": [["[\"mul\", 1, 56, 56, 144]", "cuda -keys=cuda,gpu -max_num_threads=1024 -model=unknown -thread_warp_size=32", [-1, 16, 64, 49152, 2147483647, 1024, 8, 32], "", 0, []], [[], [["FU", 2, [0, 1, 2, 3]], ["SP", 2, 0, 451584, [32], 1], ["AN", 2, 0, 5], ["AN", 2, 1, 6]]]], "r": [[1.32889e-05, 1.32916e-05, 1.32846e-05], 0, 1.27439, 1667925613], "v": "v0.6"}
{"i": [["[\"mul\", 1, 56, 56, 144]", "cuda -keys=cuda,gpu -max_num_threads=1024 -model=unknown -thread_warp_size=32", [-1, 16, 64, 49152, 2147483647, 1024, 8, 32], "", 0, []], [[], [["FU", 2, [0, 1, 2, 3]], ["SP", 2, 0, 451584, [2], 1], ["AN", 2, 0, 5], ["AN", 2, 1, 6]]]], "r": [[0.000170211, 0.000170158, 0.000170189], 0, 1.95004, 1667925614], "v": "v0.6"}
{"i": [["[\"mul\", 1, 56, 56, 144]", "cuda -keys=cuda,gpu -max_num_threads=1024 -model=unknown -thread_warp_size=32", [-1, 16, 64, 49152, 2147483647, 1024, 8, 32], "", 0, []], [[], [["FU", 2, [0, 1, 2, 3]], ["SP", 2, 0, 451584, [63], 1], ["AN", 2, 0, 5], ["AN", 2, 1, 6]]]], "r": [[7.9325e-06, 7.93654e-06, 7.93543e-06], 0, 2.28558, 1667925614], "v": "v0.6"}
{"i": [["[\"mul\", 1, 56, 56, 144]", "cuda -keys=cuda,gpu -max_num_threads=1024 -model=unknown -thread_warp_size=32", [-1, 16, 64, 49152, 2147483647, 1024, 8, 32], "", 0, []], [[], [["FU", 2, [0, 1, 2, 3]], ["SP", 2, 0, 451584, [1], 1], ["AN", 2, 0, 5], ["AN", 2, 1, 6]]]], "r": [[0.000337588, 0.00033763, 0.000337621], 0, 2.54504, 1667925614], "v": "v0.6"}
{"i": [["[\"mul\", 1, 56, 56, 144]", "cuda -keys=cuda,gpu -max_num_threads=1024 -model=unknown -thread_warp_size=32", [-1, 16, 64, 49152, 2147483647, 1024, 8, 32], "", 0, []], [[], [["FU", 2, [0, 1, 2, 3]], ["SP", 2, 0, 451584, [24], 1], ["AN", 2, 0, 5], ["AN", 2, 1, 6]]]], "r": [[1.6695e-05, 1.66973e-05, 1.66965e-05], 0, 3.09586, 1667925615], "v": "v0.6"}
{"i": [["[\"mul\", 1, 56, 56, 144]", "cuda -keys=cuda,gpu -max_num_threads=1024 -model=unknown -thread_warp_size=32", [-1, 16, 64, 49152, 2147483647, 1024, 8, 32], "", 0, []], [[], [["FU", 2, [0, 1, 2, 3]], ["SP", 2, 0, 451584, [49], 1], ["AN", 2, 0, 5], ["AN", 2, 1, 6]]]], "r": [[9.45971e-06, 9.45656e-06, 9.4534e-06], 0, 2.82499, 1667925615], "v": "v0.6"}
{"i": [["[\"mul\", 1, 56, 56, 144]", "cuda -keys=cuda,gpu -max_num_threads=1024 -model=unknown -thread_warp_size=32", [-1, 16, 64, 49152, 2147483647, 1024, 8, 32], "", 0, []], [[], [["FU", 2, [0, 1, 2, 3]], ["SP", 2, 0, 451584, [18], 1], ["AN", 2, 0, 5], ["AN", 2, 1, 6]]]], "r": [[2.14844e-05, 2.14766e-05, 2.14784e-05], 0, 3.44691, 1667925615], "v": "v0.6"}
{"i": [["[\"mul\", 1, 56, 56, 144]", "cuda -keys=cuda,gpu -max_num_threads=1024 -model=unknown -thread_warp_size=32", [-1, 16, 64, 49152, 2147483647, 1024, 8, 32], "", 0, []], [[], [["FU", 2, [0, 1, 2, 3]], ["SP", 2, 0, 451584, [12], 1], ["AN", 2, 0, 5], ["AN", 2, 1, 6]]]], "r": [[3.05967e-05, 3.06048e-05, 3.06126e-05], 0, 3.66932, 1667925616], "v": "v0.6"}
{"i": [["[\"mul\", 1, 56, 56, 144]", "cuda -keys=cuda,gpu -max_num_threads=1024 -model=unknown -thread_warp_size=32", [-1, 16, 64, 49152, 2147483647, 1024, 8, 32], "", 0, []], [[], [["FU", 2, [0, 1, 2, 3]], ["SP", 2, 0, 451584, [7], 1], ["AN", 2, 0, 5], ["AN", 2, 1, 6]]]], "r": [[5.0482e-05, 5.04736e-05, 5.0472e-05], 0, 3.97334, 1667925616], "v": "v0.6"}
{"i": [["[\"mul\", 1, 56, 56, 144]", "cuda -keys=cuda,gpu -max_num_threads=1024 -model=unknown -thread_warp_size=32", [-1, 16, 64, 49152, 2147483647, 1024, 8, 32], "", 0, []], [[], [["FU", 2, [0, 1, 2, 3]], ["SP", 2, 0, 451584, [6], 1], ["AN", 2, 0, 5], ["AN", 2, 1, 6]]]], "r": [[5.85234e-05, 5.85102e-05, 5.85107e-05], 0, 4.29639, 1667925616], "v": "v0.6"}
{"i": [["[\"mul\", 1, 56, 56, 144]", "cuda -keys=cuda,gpu -max_num_threads=1024 -model=unknown -thread_warp_size=32", [-1, 16, 64, 49152, 2147483647, 1024, 8, 32], "", 0, []], [[], [["FU", 2, [0, 1, 2, 3]], ["SP", 2, 0, 451584, [28], 1], ["AN", 2, 0, 5], ["AN", 2, 1, 6]]]], "r": [[1.47739e-05, 1.47714e-05, 1.47722e-05], 0, 4.58811, 1667925617], "v": "v0.6"}
{"i": [["[\"mul\", 1, 56, 56, 144]", "cuda -keys=cuda,gpu -max_num_threads=1024 -model=unknown -thread_warp_size=32", [-1, 16, 64, 49152, 2147483647, 1024, 8, 32], "", 0, []], [[], [["FU", 2, [0, 1, 2, 3]], ["SP", 2, 0, 451584, [36], 1], ["AN", 2, 0, 5], ["AN", 2, 1, 6]]]], "r": [[1.19742e-05, 1.19732e-05, 1.19696e-05], 0, 4.87455, 1667925617], "v": "v0.6"}
{"i": [["[\"mul\", 1, 56, 56, 144]", "cuda -keys=cuda,gpu -max_num_threads=1024 -model=unknown -thread_warp_size=32", [-1, 16, 64, 49152, 2147483647, 1024, 8, 32], "", 0, []], [[], [["FU", 2, [0, 1, 2, 3]], ["SP", 2, 0, 451584, [8], 1], ["AN", 2, 0, 5], ["AN", 2, 1, 6]]]], "r": [[4.45974e-05, 4.46202e-05, 4.4606e-05], 0, 5.21249, 1667925618], "v": "v0.6"}
{"i": [["[\"mul\", 1, 56, 56, 144]", "cuda -keys=cuda,gpu -max_num_threads=1024 -model=unknown -thread_warp_size=32", [-1, 16, 64, 49152, 2147483647, 1024, 8, 32], "", 0, []], [[], [["FU", 2, [0, 1, 2, 3]], ["SP", 2, 0, 451584, [16], 1], ["AN", 2, 0, 5], ["AN", 2, 1, 6]]]], "r": [[2.36416e-05, 2.36411e-05, 2.36409e-05], 0, 5.46342, 1667925618], "v": "v0.6"}
{"i": [["[\"mul\", 1, 56, 56, 144]", "cuda -keys=cuda,gpu -max_num_threads=1024 -model=unknown -thread_warp_size=32", [-1, 16, 64, 49152, 2147483647, 1024, 8, 32], "", 0, []], [[], [["FU", 2, [0, 1, 2, 3]], ["SP", 2, 0, 451584, [64], 1], ["AN", 2, 0, 5], ["AN", 2, 1, 6]]]], "r": [[7.87575e-06, 7.87382e-06, 7.87328e-06], 0, 5.78607, 1667925618], "v": "v0.6"}
{"i": [["[\"mul\", 1, 56, 56, 144]", "cuda -keys=cuda,gpu -max_num_threads=1024 -model=unknown -thread_warp_size=32", [-1, 16, 64, 49152, 2147483647, 1024, 8, 32], "", 0, []], [[], [["FU", 2, [0, 1, 2, 3]], ["SP", 2, 0, 451584, [21], 1], ["AN", 2, 0, 5], ["AN", 2, 1, 6]]]], "r": [[1.86184e-05, 1.8621e-05, 1.86244e-05], 0, 6.09713, 1667925619], "v": "v0.6"}
{"i": [["[\"mul\", 1, 56, 56, 144]", "cuda -keys=cuda,gpu -max_num_threads=1024 -model=unknown -thread_warp_size=32", [-1, 16, 64, 49152, 2147483647, 1024, 8, 32], "", 0, []], [[], [["FU", 2, [0, 1, 2, 3]], ["SP", 2, 0, 451584, [42], 1], ["AN", 2, 0, 5], ["AN", 2, 1, 6]]]], "r": [[1.06048e-05, 1.06006e-05, 1.06058e-05], 0, 6.40621, 1667925619], "v": "v0.6"}
{"i": [["[\"mul\", 1, 56, 56, 144]", "cuda -keys=cuda,gpu -max_num_threads=1024 -model=unknown -thread_warp_size=32", [-1, 16, 64, 49152, 2147483647, 1024, 8, 32], "", 0, []], [[], [["FU", 2, [0, 1, 2, 3]], ["SP", 2, 0, 451584, [16], 1], ["AN", 2, 0, 5], ["AN", 2, 1, 6]]]], "r": [[2.37468e-05, 2.37504e-05, 2.37444e-05], 0, 0.918179, 1667934401], "v": "v0.6"}
{"i": [["[\"mul\", 1, 56, 56, 144]", "cuda -keys=cuda,gpu -max_num_threads=1024 -model=unknown -thread_warp_size=32", [-1, 16, 64, 49152, 2147483647, 1024, 8, 32], "", 0, []], [[], [["FU", 2, [0, 1, 2, 3]], ["SP", 2, 0, 451584, [14], 1], ["AN", 2, 0, 5], ["AN", 2, 1, 6]]]], "r": [[2.66959e-05, 2.66948e-05, 2.67052e-05], 0, 4.0688, 1667934404], "v": "v0.6"}
{"i": [["[\"mul\", 1, 56, 56, 144]", "cuda -keys=cuda,gpu -max_num_threads=1024 -model=unknown -thread_warp_size=32", [-1, 16, 64, 49152, 2147483647, 1024, 8, 32], "", 0, []], [[], [["FU", 2, [0, 1, 2, 3]], ["SP", 2, 0, 451584, [42], 1], ["AN", 2, 0, 5], ["AN", 2, 1, 6]]]], "r": [[1.05856e-05, 1.05843e-05, 1.0581e-05], 0, 3.46286, 1667934404], "v": "v0.6"}
{"i": [["[\"mul\", 1, 56, 56, 144]", "cuda -keys=cuda,gpu -max_num_threads=1024 -model=unknown -thread_warp_size=32", [-1, 16, 64, 49152, 2147483647, 1024, 8, 32], "", 0, []], [[], [["FU", 2, [0, 1, 2, 3]], ["SP", 2, 0, 451584, [2], 1], ["AN", 2, 0, 5], ["AN", 2, 1, 6]]]], "r": [[0.000170146, 0.000170133, 0.000170182], 0, 2.22075, 1667934402], "v": "v0.6"}
{"i": [["[\"mul\", 1, 56, 56, 144]", "cuda -keys=cuda,gpu -max_num_threads=1024 -model=unknown -thread_warp_size=32", [-1, 16, 64, 49152, 2147483647, 1024, 8, 32], "", 0, []], [[], [["FU", 2, [0, 1, 2, 3]], ["SP", 2, 0, 451584, [7], 1], ["AN", 2, 0, 5], ["AN", 2, 1, 6]]]], "r": [[5.05345e-05, 5.05273e-05, 5.05342e-05], 0, 0.645426, 1667934401], "v": "v0.6"}
{"i": [["[\"mul\", 1, 56, 56, 144]", "cuda -keys=cuda,gpu -max_num_threads=1024 -model=unknown -thread_warp_size=32", [-1, 16, 64, 49152, 2147483647, 1024, 8, 32], "", 0, []], [[], [["FU", 2, [0, 1, 2, 3]], ["SP", 2, 0, 451584, [18], 1], ["AN", 2, 0, 5], ["AN", 2, 1, 6]]]], "r": [[2.13381e-05, 2.13397e-05, 2.13385e-05], 0, 1.21442, 1667934401], "v": "v0.6"}
{"i": [["[\"mul\", 1, 56, 56, 144]", "cuda -keys=cuda,gpu -max_num_threads=1024 -model=unknown -thread_warp_size=32", [-1, 16, 64, 49152, 2147483647, 1024, 8, 32], "", 0, []], [[], [["FU", 2, [0, 1, 2, 3]], ["SP", 2, 0, 451584, [21], 1], ["AN", 2, 0, 5], ["AN", 2, 1, 6]]]], "r": [[1.87691e-05, 1.87689e-05, 1.87651e-05], 0, 1.96011, 1667934402], "v": "v0.6"}
{"i": [["[\"mul\", 1, 56, 56, 144]", "cuda -keys=cuda,gpu -max_num_threads=1024 -model=unknown -thread_warp_size=32", [-1, 16, 64, 49152, 2147483647, 1024, 8, 32], "", 0, []], [[], [["FU", 2, [0, 1, 2, 3]], ["SP", 2, 0, 451584, [32], 1], ["AN", 2, 0, 5], ["AN", 2, 1, 6]]]], "r": [[1.31833e-05, 1.31839e-05, 1.31877e-05], 0, 1.61052, 1667934402], "v": "v0.6"}
{"i": [["[\"mul\", 1, 56, 56, 144]", "cuda -keys=cuda,gpu -max_num_threads=1024 -model=unknown -thread_warp_size=32", [-1, 16, 64, 49152, 2147483647, 1024, 8, 32], "", 0, []], [[], [["FU", 2, [0, 1, 2, 3]], ["SP", 2, 0, 451584, [48], 1], ["AN", 2, 0, 5], ["AN", 2, 1, 6]]]], "r": [[9.56485e-06, 9.56982e-06, 9.5695e-06], 0, 3.08872, 1667934403], "v": "v0.6"}
{"i": [["[\"mul\", 1, 56, 56, 144]", "cuda -keys=cuda,gpu -max_num_threads=1024 -model=unknown -thread_warp_size=32", [-1, 16, 64, 49152, 2147483647, 1024, 8, 32], "", 0, []], [[], [["FU", 2, [0, 1, 2, 3]], ["SP", 2, 0, 451584, [28], 1], ["AN", 2, 0, 5], ["AN", 2, 1, 6]]]], "r": [[1.47709e-05, 1.47765e-05, 1.47805e-05], 0, 2.49524, 1667934403], "v": "v0.6"}
{"i": [["[\"mul\", 1, 56, 56, 144]", "cuda -keys=cuda,gpu -max_num_threads=1024 -model=unknown -thread_warp_size=32", [-1, 16, 64, 49152, 2147483647, 1024, 8, 32], "", 0, []], [[], [["FU", 2, [0, 1, 2, 3]], ["SP", 2, 0, 451584, [64], 1], ["AN", 2, 0, 5], ["AN", 2, 1, 6]]]], "r": [[8.00161e-06, 8.00172e-06, 7.99834e-06], 0, 2.75465, 1667934403], "v": "v0.6"}
{"i": [["[\"mul\", 1, 56, 56, 144]", "cuda -keys=cuda,gpu -max_num_threads=1024 -model=unknown -thread_warp_size=32", [-1, 16, 64, 49152, 2147483647, 1024, 8, 32], "", 0, []], [[], [["FU", 2, [0, 1, 2, 3]], ["SP", 2, 0, 451584, [3], 1], ["AN", 2, 0, 5], ["AN", 2, 1, 6]]]], "r": [[0.000114338, 0.000114307, 0.000114323], 0, 3.68218, 1667934404], "v": "v0.6"}
{"i": [["[\"mul\", 1, 56, 56, 144]", "cuda -keys=cuda,gpu -max_num_threads=1024 -model=unknown -thread_warp_size=32", [-1, 16, 64, 49152, 2147483647, 1024, 8, 32], "", 0, []], [[], [["FU", 2, [0, 1, 2, 3]], ["SP", 2, 0, 451584, [1], 1], ["AN", 2, 0, 5], ["AN", 2, 1, 6]]]], "r": [[0.000337623, 0.000337552, 0.00033755], 0, 4.64182, 1667934405], "v": "v0.6"}
{"i": [["[\"mul\", 1, 56, 56, 144]", "cuda -keys=cuda,gpu -max_num_threads=1024 -model=unknown -thread_warp_size=32", [-1, 16, 64, 49152, 2147483647, 1024, 8, 32], "", 0, []], [[], [["FU", 2, [0, 1, 2, 3]], ["SP", 2, 0, 451584, [49], 1], ["AN", 2, 0, 5], ["AN", 2, 1, 6]]]], "r": [[9.49843e-06, 9.49569e-06, 9.49165e-06], 0, 4.31639, 1667934405], "v": "v0.6"}
{"i": [["[\"mul\", 1, 56, 56, 144]", "cuda -keys=cuda,gpu -max_num_threads=1024 -model=unknown -thread_warp_size=32", [-1, 16, 64, 49152, 2147483647, 1024, 8, 32], "", 0, []], [[], [["FU", 2, [0, 1, 2, 3]], ["SP", 2, 0, 451584, [63], 1], ["AN", 2, 0, 5], ["AN", 2, 1, 6]]]], "r": [[8.02004e-06, 8.02198e-06, 8.02905e-06], 0, 4.89576, 1667934406], "v": "v0.6"}
{"i": [["[\"mul\", 1, 56, 56, 144]", "cuda -keys=cuda,gpu -max_num_threads=1024 -model=unknown -thread_warp_size=32", [-1, 16, 64, 49152, 2147483647, 1024, 8, 32], "", 0, []], [[], [["FU", 2, [0, 1, 2, 3]], ["SP", 2, 0, 451584, [12], 1], ["AN", 2, 0, 5], ["AN", 2, 1, 6]]]], "r": [[3.05945e-05, 3.05863e-05, 3.05904e-05], 0, 5.50218, 1667934406], "v": "v0.6"}
{"i": [["[\"mul\", 1, 56, 56, 144]", "cuda -keys=cuda,gpu -max_num_threads=1024 -model=unknown -thread_warp_size=32", [-1, 16, 64, 49152, 2147483647, 1024, 8, 32], "", 0, []], [[], [["FU", 2, [0, 1, 2, 3]], ["SP", 2, 0, 451584, [56], 1], ["AN", 2, 0, 5], ["AN", 2, 1, 6]]]], "r": [[8.64664e-06, 8.64426e-06, 8.64659e-06], 0, 5.25272, 1667934406], "v": "v0.6"}
{"i": [["[\"mul\", 1, 56, 56, 144]", "cuda -keys=cuda,gpu -max_num_threads=1024 -model=unknown -thread_warp_size=32", [-1, 16, 64, 49152, 2147483647, 1024, 8, 32], "", 0, []], [[], [["FU", 2, [0, 1, 2, 3]], ["SP", 2, 0, 451584, [36], 1], ["AN", 2, 0, 5], ["AN", 2, 1, 6]]]], "r": [[1.18591e-05, 1.18585e-05, 1.18477e-05], 0, 5.81806, 1667934407], "v": "v0.6"}
{"i": [["[\"mul\", 1, 56, 56, 144]", "cuda -keys=cuda,gpu -max_num_threads=1024 -model=unknown -thread_warp_size=32", [-1, 16, 64, 49152, 2147483647, 1024, 8, 32], "", 0, []], [[], [["FU", 2, [0, 1, 2, 3]], ["SP", 2, 0, 451584, [24], 1], ["AN", 2, 0, 5], ["AN", 2, 1, 6]]]], "r": [[1.67272e-05, 1.67288e-05, 1.67277e-05], 0, 6.15968, 1667934407], "v": "v0.6"}
{"i": [["[\"mul\", 1, 56, 56, 144]", "cuda -keys=cuda,gpu -max_num_threads=1024 -model=unknown -thread_warp_size=32", [-1, 16, 64, 49152, 2147483647, 1024, 8, 32], "", 0, []], [[], [["FU", 2, [0, 1, 2, 3]], ["SP", 2, 0, 451584, [4], 1], ["AN", 2, 0, 5], ["AN", 2, 1, 6]]]], "r": [[8.63366e-05, 8.63625e-05, 8.63551e-05], 0, 6.44624, 1667934407], "v": "v0.6"}
{"i": [["[\"mul\", 1, 56, 56, 144]", "cuda -keys=cuda,gpu -max_num_threads=1024 -model=unknown -thread_warp_size=32", [-1, 16, 64, 49152, 2147483647, 1024, 8, 32], "", 0, []], [[], [["FU", 2, [0, 1, 2, 3]], ["SP", 2, 0, 451584, [6], 1], ["AN", 2, 0, 5], ["AN", 2, 1, 6]]]], "r": [[5.85223e-05, 5.8517e-05, 5.85213e-05], 0, 6.81276, 1667934408], "v": "v0.6"}
{"i": [["[\"mul\", 1, 56, 56, 144]", "cuda -keys=cuda,gpu -max_num_threads=1024 -model=unknown -thread_warp_size=32", [-1, 16, 64, 49152, 2147483647, 1024, 8, 32], "", 0, []], [[], [["FU", 2, [0, 1, 2, 3]], ["SP", 2, 0, 451584, [9], 1], ["AN", 2, 0, 5], ["AN", 2, 1, 6]]]], "r": [[3.98402e-05, 3.98352e-05, 3.98347e-05], 0, 7.14901, 1667934408], "v": "v0.6"}
{"i": [["[\"mul\", 1, 56, 56, 144]", "cuda -keys=cuda,gpu -max_num_threads=1024 -model=unknown -thread_warp_size=32", [-1, 16, 64, 49152, 2147483647, 1024, 8, 32], "", 0, []], [[], [["FU", 2, [0, 1, 2, 3]], ["SP", 2, 0, 451584, [8], 1], ["AN", 2, 0, 5], ["AN", 2, 1, 6]]]], "r": [[4.45081e-05, 4.45146e-05, 4.45114e-05], 0, 7.36601, 1667934408], "v": "v0.6"}
{"i": [["[\"mul\", 1, 56, 56, 144]", "cuda -keys=cuda,gpu -max_num_threads=1024 -model=unknown -thread_warp_size=32", [-1, 16, 64, 49152, 2147483647, 1024, 8, 32], "", 0, []], [[], [["FU", 2, [0, 1, 2, 3]], ["SP", 2, 0, 451584, [3], 1], ["AN", 2, 0, 5], ["AN", 2, 1, 6]]]], "r": [[0.000114285, 0.000114285, 0.000114239], 0, 2.91375, 1667934810], "v": "v0.6"}
{"i": [["[\"mul\", 1, 56, 56, 144]", "cuda -keys=cuda,gpu -max_num_threads=1024 -model=unknown -thread_warp_size=32", [-1, 16, 64, 49152, 2147483647, 1024, 8, 32], "", 0, []], [[], [["FU", 2, [0, 1, 2, 3]], ["SP", 2, 0, 451584, [6], 1], ["AN", 2, 0, 5], ["AN", 2, 1, 6]]]], "r": [[5.8501e-05, 5.84907e-05, 5.85295e-05], 0, 1.01786, 1667934808], "v": "v0.6"}
{"i": [["[\"mul\", 1, 56, 56, 144]", "cuda -keys=cuda,gpu -max_num_threads=1024 -model=unknown -thread_warp_size=32", [-1, 16, 64, 49152, 2147483647, 1024, 8, 32], "", 0, []], [[], [["FU", 2, [0, 1, 2, 3]], ["SP", 2, 0, 451584, [24], 1], ["AN", 2, 0, 5], ["AN", 2, 1, 6]]]], "r": [[1.68558e-05, 1.67288e-05, 1.67291e-05], 0, 0.62851, 1667934808], "v": "v0.6"}
{"i": [["[\"mul\", 1, 56, 56, 144]", "cuda -keys=cuda,gpu -max_num_threads=1024 -model=unknown -thread_warp_size=32", [-1, 16, 64, 49152, 2147483647, 1024, 8, 32], "", 0, []], [[], [["FU", 2, [0, 1, 2, 3]], ["SP", 2, 0, 451584, [28], 1], ["AN", 2, 0, 5], ["AN", 2, 1, 6]]]], "r": [[1.47348e-05, 1.47336e-05, 1.47331e-05], 0, 2.05854, 1667934809], "v": "v0.6"}
{"i": [["[\"mul\", 1, 56, 56, 144]", "cuda -keys=cuda,gpu -max_num_threads=1024 -model=unknown -thread_warp_size=32", [-1, 16, 64, 49152, 2147483647, 1024, 8, 32], "", 0, []], [[], [["FU", 2, [0, 1, 2, 3]], ["SP", 2, 0, 451584, [14], 1], ["AN", 2, 0, 5], ["AN", 2, 1, 6]]]], "r": [[2.66608e-05, 2.66496e-05, 2.66643e-05], 0, 1.3646, 1667934809], "v": "v0.6"}
{"i": [["[\"mul\", 1, 56, 56, 144]", "cuda -keys=cuda,gpu -max_num_threads=1024 -model=unknown -thread_warp_size=32", [-1, 16, 64, 49152, 2147483647, 1024, 8, 32], "", 0, []], [[], [["FU", 2, [0, 1, 2, 3]], ["SP", 2, 0, 451584, [21], 1], ["AN", 2, 0, 5], ["AN", 2, 1, 6]]]], "r": [[1.86753e-05, 1.86818e-05, 1.86739e-05], 0, 1.62747, 1667934809], "v": "v0.6"}
{"i": [["[\"mul\", 1, 56, 56, 144]", "cuda -keys=cuda,gpu -max_num_threads=1024 -model=unknown -thread_warp_size=32", [-1, 16, 64, 49152, 2147483647, 1024, 8, 32], "", 0, []], [[], [["FU", 2, [0, 1, 2, 3]], ["SP", 2, 0, 451584, [2], 1], ["AN", 2, 0, 5], ["AN", 2, 1, 6]]]], "r": [[0.00017013, 0.000170122, 0.000170123], 0, 2.58949, 1667934810], "v": "v0.6"}
{"i": [["[\"mul\", 1, 56, 56, 144]", "cuda -keys=cuda,gpu -max_num_threads=1024 -model=unknown -thread_warp_size=32", [-1, 16, 64, 49152, 2147483647, 1024, 8, 32], "", 0, []], [[], [["FU", 2, [0, 1, 2, 3]], ["SP", 2, 0, 451584, [48], 1], ["AN", 2, 0, 5], ["AN", 2, 1, 6]]]], "r": [[9.55599e-06, 9.55366e-06, 9.55426e-06], 0, 3.25259, 1667934811], "v": "v0.6"}
{"i": [["[\"mul\", 1, 56, 56, 144]", "cuda -keys=cuda,gpu -max_num_threads=1024 -model=unknown -thread_warp_size=32", [-1, 16, 64, 49152, 2147483647, 1024, 8, 32], "", 0, []], [[], [["FU", 2, [0, 1, 2, 3]], ["SP", 2, 0, 451584, [36], 1], ["AN", 2, 0, 5], ["AN", 2, 1, 6]]]], "r": [[1.19777e-05, 1.19794e-05, 1.19753e-05], 0, 2.27871, 1667934810], "v": "v0.6"}
{"i": [["[\"mul\", 1, 56, 56, 144]", "cuda -keys=cuda,gpu -max_num_threads=1024 -model=unknown -thread_warp_size=32", [-1, 16, 64, 49152, 2147483647, 1024, 8, 32], "", 0, []], [[], [["FU", 2, [0, 1, 2, 3]], ["SP", 2, 0, 451584, [64], 1], ["AN", 2, 0, 5], ["AN", 2, 1, 6]]]], "r": [[7.84601e-06, 7.83944e-06, 7.84293e-06], 0, 3.54094, 1667934811], "v": "v0.6"}
{"i": [["[\"mul\", 1, 56, 56, 144]", "cuda -keys=cuda,gpu -max_num_threads=1024 -model=unknown -thread_warp_size=32", [-1, 16, 64, 49152, 2147483647, 1024, 8, 32], "", 0, []], [[], [["FU", 2, [0, 1, 2, 3]], ["SP", 2, 0, 451584, [42], 1], ["AN", 2, 0, 5], ["AN", 2, 1, 6]]]], "r": [[1.05531e-05, 1.0554e-05, 1.0554e-05], 0, 3.77756, 1667934811], "v": "v0.6"}
{"i": [["[\"mul\", 1, 56, 56, 144]", "cuda -keys=cuda,gpu -max_num_threads=1024 -model=unknown -thread_warp_size=32", [-1, 16, 64, 49152, 2147483647, 1024, 8, 32], "", 0, []], [[], [["FU", 2, [0, 1, 2, 3]], ["SP", 2, 0, 451584, [8], 1], ["AN", 2, 0, 5], ["AN", 2, 1, 6]]]], "r": [[4.46497e-05, 4.46358e-05, 4.46417e-05], 0, 4.4611, 1667934812], "v": "v0.6"}
{"i": [["[\"mul\", 1, 56, 56, 144]", "cuda -keys=cuda,gpu -max_num_threads=1024 -model=unknown -thread_warp_size=32", [-1, 16, 64, 49152, 2147483647, 1024, 8, 32], "", 0, []], [[], [["FU", 2, [0, 1, 2, 3]], ["SP", 2, 0, 451584, [56], 1], ["AN", 2, 0, 5], ["AN", 2, 1, 6]]]], "r": [[8.60977e-06, 8.61272e-06, 8.60481e-06], 0, 4.72922, 1667934812], "v": "v0.6"}
{"i": [["[\"mul\", 1, 56, 56, 144]", "cuda -keys=cuda,gpu -max_num_threads=1024 -model=unknown -thread_warp_size=32", [-1, 16, 64, 49152, 2147483647, 1024, 8, 32], "", 0, []], [[], [["FU", 2, [0, 1, 2, 3]], ["SP", 2, 0, 451584, [12], 1], ["AN", 2, 0, 5], ["AN", 2, 1, 6]]]], "r": [[3.05196e-05, 3.05182e-05, 3.05154e-05], 0, 5.01367, 1667934813], "v": "v0.6"}
{"i": [["[\"mul\", 1, 56, 56, 144]", "cuda -keys=cuda,gpu -max_num_threads=1024 -model=unknown -thread_warp_size=32", [-1, 16, 64, 49152, 2147483647, 1024, 8, 32], "", 0, []], [[], [["FU", 2, [0, 1, 2, 3]], ["SP", 2, 0, 451584, [49], 1], ["AN", 2, 0, 5], ["AN", 2, 1, 6]]]], "r": [[9.40743e-06, 9.40976e-06, 9.40445e-06], 0, 5.30079, 1667934813], "v": "v0.6"}
{"i": [["[\"mul\", 1, 56, 56, 144]", "cuda -keys=cuda,gpu -max_num_threads=1024 -model=unknown -thread_warp_size=32", [-1, 16, 64, 49152, 2147483647, 1024, 8, 32], "", 0, []], [[], [["FU", 2, [0, 1, 2, 3]], ["SP", 2, 0, 451584, [63], 1], ["AN", 2, 0, 5], ["AN", 2, 1, 6]]]], "r": [[7.87571e-06, 7.88136e-06, 7.87674e-06], 0, 5.63352, 1667934813], "v": "v0.6"}
{"i": [["[\"mul\", 1, 56, 56, 144]", "cuda -keys=cuda,gpu -max_num_threads=1024 -model=unknown -thread_warp_size=32", [-1, 16, 64, 49152, 2147483647, 1024, 8, 32], "", 0, []], [[], [["FU", 2, [0, 1, 2, 3]], ["SP", 2, 0, 451584, [32], 1], ["AN", 2, 0, 5], ["AN", 2, 1, 6]]]], "r": [[1.31689e-05, 1.31659e-05, 1.31678e-05], 0, 5.90442, 1667934814], "v": "v0.6"}
{"i": [["[\"mul\", 1, 56, 56, 144]", "cuda -keys=cuda,gpu -max_num_threads=1024 -model=unknown -thread_warp_size=32", [-1, 16, 64, 49152, 2147483647, 1024, 8, 32], "", 0, []], [[], [["FU", 2, [0, 1, 2, 3]], ["SP", 2, 0, 451584, [1], 1], ["AN", 2, 0, 5], ["AN", 2, 1, 6]]]], "r": [[0.00033763, 0.000337643, 0.000337632], 0, 6.23049, 1667934814], "v": "v0.6"}
{"i": [["[\"mul\", 1, 56, 56, 144]", "cuda -keys=cuda,gpu -max_num_threads=1024 -model=unknown -thread_warp_size=32", [-1, 16, 64, 49152, 2147483647, 1024, 8, 32], "", 0, []], [[], [["FU", 2, [0, 1, 2, 3]], ["SP", 2, 0, 451584, [9], 1], ["AN", 2, 0, 5], ["AN", 2, 1, 6]]]], "r": [[3.98084e-05, 3.98022e-05, 3.98093e-05], 0, 6.5289, 1667934815], "v": "v0.6"}
{"i": [["[\"mul\", 1, 56, 56, 144]", "cuda -keys=cuda,gpu -max_num_threads=1024 -model=unknown -thread_warp_size=32", [-1, 16, 64, 49152, 2147483647, 1024, 8, 32], "", 0, []], [[], [["FU", 2, [0, 1, 2, 3]], ["SP", 2, 0, 451584, [18], 1], ["AN", 2, 0, 5], ["AN", 2, 1, 6]]]], "r": [[2.13686e-05, 2.13735e-05, 2.13782e-05], 0, 6.86367, 1667934815], "v": "v0.6"}
{"i": [["[\"mul\", 1, 56, 56, 144]", "cuda -keys=cuda,gpu -max_num_threads=1024 -model=unknown -thread_warp_size=32", [-1, 16, 64, 49152, 2147483647, 1024, 8, 32], "", 0, []], [[], [["FU", 2, [0, 1, 2, 3]], ["SP", 2, 0, 451584, [4], 1], ["AN", 2, 0, 5], ["AN", 2, 1, 6]]]], "r": [[8.62886e-05, 8.63004e-05, 8.63007e-05], 0, 7.12708, 1667934815], "v": "v0.6"}
{"i": [["[\"mul\", 1, 56, 56, 144]", "cuda -keys=cuda,gpu -max_num_threads=1024 -model=unknown -thread_warp_size=32", [-1, 16, 64, 49152, 2147483647, 1024, 8, 32], "", 0, []], [[], [["FU", 2, [0, 1, 2, 3]], ["SP", 2, 0, 451584, [16], 1], ["AN", 2, 0, 5], ["AN", 2, 1, 6]]]], "r": [[2.36945e-05, 2.36942e-05, 2.36851e-05], 0, 7.48331, 1667934816], "v": "v0.6"}
{"i": [["[\"mul\", 1, 56, 56, 144]", "cuda -keys=cuda,gpu -max_num_threads=1024 -model=unknown -thread_warp_size=32", [-1, 16, 64, 49152, 2147483647, 1024, 8, 32], "", 0, []], [[], [["FU", 2, [0, 1, 2, 3]], ["SP", 2, 0, 451584, [7], 1], ["AN", 2, 0, 5], ["AN", 2, 1, 6]]]], "r": [[5.05557e-05, 5.0553e-05, 5.05568e-05], 0, 4.06564, 1667934812], "v": "v0.6"}
{"i": [["[\"mul\", 1, 56, 56, 144]", "cuda -keys=cuda,gpu -max_num_threads=1024 -model=unknown -thread_warp_size=32", [-1, 16, 64, 49152, 2147483647, 1024, 8, 32], "", 0, []], [[], [["FU", 2, [0, 1, 2, 3]], ["SP", 2, 0, 451584, [63], 1], ["AN", 2, 0, 5], ["AN", 2, 1, 6]]]], "r": [[7.92956e-06, 7.92997e-06, 7.92896e-06], 0, 1.35895, 1667936016], "v": "v0.6"}
{"i": [["[\"mul\", 1, 56, 56, 144]", "cuda -keys=cuda,gpu -max_num_threads=1024 -model=unknown -thread_warp_size=32", [-1, 16, 64, 49152, 2147483647, 1024, 8, 32], "", 0, []], [[], [["FU", 2, [0, 1, 2, 3]], ["SP", 2, 0, 451584, [18], 1], ["AN", 2, 0, 5], ["AN", 2, 1, 6]]]], "r": [[2.1355e-05, 2.13543e-05, 2.13759e-05], 0, 0.671412, 1667936015], "v": "v0.6"}
{"i": [["[\"mul\", 1, 56, 56, 144]", "cuda -keys=cuda,gpu -max_num_threads=1024 -model=unknown -thread_warp_size=32", [-1, 16, 64, 49152, 2147483647, 1024, 8, 32], "", 0, []], [[], [["FU", 2, [0, 1, 2, 3]], ["SP", 2, 0, 451584, [28], 1], ["AN", 2, 0, 5], ["AN", 2, 1, 6]]]], "r": [[1.4692e-05, 1.46817e-05, 1.46897e-05], 0, 2.67807, 1667936017], "v": "v0.6"}
{"i": [["[\"mul\", 1, 56, 56, 144]", "cuda -keys=cuda,gpu -max_num_threads=1024 -model=unknown -thread_warp_size=32", [-1, 16, 64, 49152, 2147483647, 1024, 8, 32], "", 0, []], [[], [["FU", 2, [0, 1, 2, 3]], ["SP", 2, 0, 451584, [1], 1], ["AN", 2, 0, 5], ["AN", 2, 1, 6]]]], "r": [[0.000337642, 0.000337688, 0.000337613], 0, 2.27723, 1667936017], "v": "v0.6"}
{"i": [["[\"mul\", 1, 56, 56, 144]", "cuda -keys=cuda,gpu -max_num_threads=1024 -model=unknown -thread_warp_size=32", [-1, 16, 64, 49152, 2147483647, 1024, 8, 32], "", 0, []], [[], [["FU", 2, [0, 1, 2, 3]], ["SP", 2, 0, 451584, [36], 1], ["AN", 2, 0, 5], ["AN", 2, 1, 6]]]], "r": [[1.18647e-05, 1.18528e-05, 1.1861e-05], 0, 2.0022, 1667936017], "v": "v0.6"}
{"i": [["[\"mul\", 1, 56, 56, 144]", "cuda -keys=cuda,gpu -max_num_threads=1024 -model=unknown -thread_warp_size=32", [-1, 16, 64, 49152, 2147483647, 1024, 8, 32], "", 0, []], [[], [["FU", 2, [0, 1, 2, 3]], ["SP", 2, 0, 451584, [12], 1], ["AN", 2, 0, 5], ["AN", 2, 1, 6]]]], "r": [[3.06985e-05, 3.07e-05, 3.06942e-05], 0, 1.0923, 1667936016], "v": "v0.6"}
{"i": [["[\"mul\", 1, 56, 56, 144]", "cuda -keys=cuda,gpu -max_num_threads=1024 -model=unknown -thread_warp_size=32", [-1, 16, 64, 49152, 2147483647, 1024, 8, 32], "", 0, []], [[], [["FU", 2, [0, 1, 2, 3]], ["SP", 2, 0, 451584, [24], 1], ["AN", 2, 0, 5], ["AN", 2, 1, 6]]]], "r": [[1.67414e-05, 1.67254e-05, 1.67171e-05], 0, 1.71205, 1667936016], "v": "v0.6"}
{"i": [["[\"mul\", 1, 56, 56, 144]", "cuda -keys=cuda,gpu -max_num_threads=1024 -model=unknown -thread_warp_size=32", [-1, 16, 64, 49152, 2147483647, 1024, 8, 32], "", 0, []], [[], [["FU", 2, [0, 1, 2, 3]], ["SP", 2, 0, 451584, [2], 1], ["AN", 2, 0, 5], ["AN", 2, 1, 6]]]], "r": [[0.000170175, 0.000170166, 0.000170202], 0, 3.04004, 1667936018], "v": "v0.6"}
{"i": [["[\"mul\", 1, 56, 56, 144]", "cuda -keys=cuda,gpu -max_num_threads=1024 -model=unknown -thread_warp_size=32", [-1, 16, 64, 49152, 2147483647, 1024, 8, 32], "", 0, []], [[], [["FU", 2, [0, 1, 2, 3]], ["SP", 2, 0, 451584, [4], 1], ["AN", 2, 0, 5], ["AN", 2, 1, 6]]]], "r": [[8.63693e-05, 8.63686e-05, 8.63787e-05], 0, 3.2583, 1667936018], "v": "v0.6"}
{"i": [["[\"mul\", 1, 56, 56, 144]", "cuda -keys=cuda,gpu -max_num_threads=1024 -model=unknown -thread_warp_size=32", [-1, 16, 64, 49152, 2147483647, 1024, 8, 32], "", 0, []], [[], [["FU", 2, [0, 1, 2, 3]], ["SP", 2, 0, 451584, [32], 1], ["AN", 2, 0, 5], ["AN", 2, 1, 6]]]], "r": [[1.33297e-05, 1.33332e-05, 1.33298e-05], 0, 3.61723, 1667936018], "v": "v0.6"}
{"i": [["[\"mul\", 1, 56, 56, 144]", "cuda -keys=cuda,gpu -max_num_threads=1024 -model=unknown -thread_warp_size=32", [-1, 16, 64, 49152, 2147483647, 1024, 8, 32], "", 0, []], [[], [["FU", 2, [0, 1, 2, 3]], ["SP", 2, 0, 451584, [64], 1], ["AN", 2, 0, 5], ["AN", 2, 1, 6]]]], "r": [[7.76461e-06, 7.76747e-06, 7.76256e-06], 0, 3.77612, 1667936019], "v": "v0.6"}
{"i": [["[\"mul\", 1, 56, 56, 144]", "cuda -keys=cuda,gpu -max_num_threads=1024 -model=unknown -thread_warp_size=32", [-1, 16, 64, 49152, 2147483647, 1024, 8, 32], "", 0, []], [[], [["FU", 2, [0, 1, 2, 3]], ["SP", 2, 0, 451584, [14], 1], ["AN", 2, 0, 5], ["AN", 2, 1, 6]]]], "r": [[2.65908e-05, 2.65951e-05, 2.65956e-05], 0, 4.07482, 1667936019], "v": "v0.6"}
{"i": [["[\"mul\", 1, 56, 56, 144]", "cuda -keys=cuda,gpu -max_num_threads=1024 -model=unknown -thread_warp_size=32", [-1, 16, 64, 49152, 2147483647, 1024, 8, 32], "", 0, []], [[], [["FU", 2, [0, 1, 2, 3]], ["SP", 2, 0, 451584, [49], 1], ["AN", 2, 0, 5], ["AN", 2, 1, 6]]]], "r": [[9.49856e-06, 9.49795e-06, 9.49908e-06], 0, 4.38262, 1667936019], "v": "v0.6"}
{"i": [["[\"mul\", 1, 56, 56, 144]", "cuda -keys=cuda,gpu -max_num_threads=1024 -model=unknown -thread_warp_size=32", [-1, 16, 64, 49152, 2147483647, 1024, 8, 32], "", 0, []], [[], [["FU", 2, [0, 1, 2, 3]], ["SP", 2, 0, 451584, [56], 1], ["AN", 2, 0, 5], ["AN", 2, 1, 6]]]], "r": [[8.63493e-06, 8.64266e-06, 8.64067e-06], 0, 4.67984, 1667936020], "v": "v0.6"}
{"i": [["[\"mul\", 1, 56, 56, 144]", "cuda -keys=cuda,gpu -max_num_threads=1024 -model=unknown -thread_warp_size=32", [-1, 16, 64, 49152, 2147483647, 1024, 8, 32], "", 0, []], [[], [["FU", 2, [0, 1, 2, 3]], ["SP", 2, 0, 451584, [16], 1], ["AN", 2, 0, 5], ["AN", 2, 1, 6]]]], "r": [[2.36803e-05, 2.36805e-05, 2.3679e-05], 0, 4.96481, 1667936020], "v": "v0.6"}
{"i": [["[\"mul\", 1, 56, 56, 144]", "cuda -keys=cuda,gpu -max_num_threads=1024 -model=unknown -thread_warp_size=32", [-1, 16, 64, 49152, 2147483647, 1024, 8, 32], "", 0, []], [[], [["FU", 2, [0, 1, 2, 3]], ["SP", 2, 0, 451584, [9], 1], ["AN", 2, 0, 5], ["AN", 2, 1, 6]]]], "r": [[3.97773e-05, 3.9779e-05, 3.97822e-05], 0, 5.52742, 1667936021], "v": "v0.6"}
{"i": [["[\"mul\", 1, 56, 56, 144]", "cuda -keys=cuda,gpu -max_num_threads=1024 -model=unknown -thread_warp_size=32", [-1, 16, 64, 49152, 2147483647, 1024, 8, 32], "", 0, []], [[], [["FU", 2, [0, 1, 2, 3]], ["SP", 2, 0, 451584, [48], 1], ["AN", 2, 0, 5], ["AN", 2, 1, 6]]]], "r": [[9.5604e-06, 9.55477e-06, 9.55255e-06], 0, 5.20935, 1667936021], "v": "v0.6"}
{"i": [["[\"mul\", 1, 56, 56, 144]", "cuda -keys=cuda,gpu -max_num_threads=1024 -model=unknown -thread_warp_size=32", [-1, 16, 64, 49152, 2147483647, 1024, 8, 32], "", 0, []], [[], [["FU", 2, [0, 1, 2, 3]], ["SP", 2, 0, 451584, [6], 1], ["AN", 2, 0, 5], ["AN", 2, 1, 6]]]], "r": [[5.87424e-05, 5.87401e-05, 5.87471e-05], 0, 5.85803, 1667936021], "v": "v0.6"}
{"i": [["[\"mul\", 1, 56, 56, 144]", "cuda -keys=cuda,gpu -max_num_threads=1024 -model=unknown -thread_warp_size=32", [-1, 16, 64, 49152, 2147483647, 1024, 8, 32], "", 0, []], [[], [["FU", 2, [0, 1, 2, 3]], ["SP", 2, 0, 451584, [7], 1], ["AN", 2, 0, 5], ["AN", 2, 1, 6]]]], "r": [[5.04779e-05, 5.04731e-05, 5.0481e-05], 0, 6.25763, 1667936022], "v": "v0.6"}
{"i": [["[\"mul\", 1, 56, 56, 144]", "cuda -keys=cuda,gpu -max_num_threads=1024 -model=unknown -thread_warp_size=32", [-1, 16, 64, 49152, 2147483647, 1024, 8, 32], "", 0, []], [[], [["FU", 2, [0, 1, 2, 3]], ["SP", 2, 0, 451584, [3], 1], ["AN", 2, 0, 5], ["AN", 2, 1, 6]]]], "r": [[0.000114232, 0.000114219, 0.000114217], 0, 6.44667, 1667936022], "v": "v0.6"}
{"i": [["[\"mul\", 1, 56, 56, 144]", "cuda -keys=cuda,gpu -max_num_threads=1024 -model=unknown -thread_warp_size=32", [-1, 16, 64, 49152, 2147483647, 1024, 8, 32], "", 0, []], [[], [["FU", 2, [0, 1, 2, 3]], ["SP", 2, 0, 451584, [8], 1], ["AN", 2, 0, 5], ["AN", 2, 1, 6]]]], "r": [[4.44416e-05, 4.44508e-05, 4.44375e-05], 0, 6.81328, 1667936022], "v": "v0.6"}
{"i": [["[\"mul\", 1, 56, 56, 144]", "cuda -keys=cuda,gpu -max_num_threads=1024 -model=unknown -thread_warp_size=32", [-1, 16, 64, 49152, 2147483647, 1024, 8, 32], "", 0, []], [[], [["FU", 2, [0, 1, 2, 3]], ["SP", 2, 0, 451584, [21], 1], ["AN", 2, 0, 5], ["AN", 2, 1, 6]]]], "r": [[1.86537e-05, 1.86455e-05, 1.86531e-05], 0, 7.16871, 1667936023], "v": "v0.6"}
{"i": [["[\"mul\", 1, 56, 56, 144]", "cuda -keys=cuda,gpu -max_num_threads=1024 -model=unknown -thread_warp_size=32", [-1, 16, 64, 49152, 2147483647, 1024, 8, 32], "", 0, []], [[], [["FU", 2, [0, 1, 2, 3]], ["SP", 2, 0, 451584, [42], 1], ["AN", 2, 0, 5], ["AN", 2, 1, 6]]]], "r": [[1.06573e-05, 1.06577e-05, 1.06553e-05], 0, 7.36577, 1667936023], "v": "v0.6"}
