python/models/efficientnet/VertiFusionEfficientNet_kernel_configs/efficient_add_1_28_28_240.log
{"i": [["[\"add\", 1, 28, 28, 240]", "cuda -keys=cuda,gpu -max_num_threads=1024 -model=unknown -thread_warp_size=32", [-1, 16, 64, 49152, 2147483647, 1024, 8, 32], "", 0, []], [[], [["FU", 2, [0, 1, 2, 3]], ["SP", 2, 0, 188160, [6], 1], ["AN", 2, 0, 5], ["AN", 2, 1, 6]]]], "r": [[2.60843e-05, 2.6082e-05, 2.60835e-05], 0, 2.13908, 1667926494], "v": "v0.6"}
{"i": [["[\"add\", 1, 28, 28, 240]", "cuda -keys=cuda,gpu -max_num_threads=1024 -model=unknown -thread_warp_size=32", [-1, 16, 64, 49152, 2147483647, 1024, 8, 32], "", 0, []], [[], [["FU", 2, [0, 1, 2, 3]], ["SP", 2, 0, 188160, [28], 1], ["AN", 2, 0, 5], ["AN", 2, 1, 6]]]], "r": [[7.85049e-06, 7.84984e-06, 7.85027e-06], 0, 0.949379, 1667926493], "v": "v0.6"}
{"i": [["[\"add\", 1, 28, 28, 240]", "cuda -keys=cuda,gpu -max_num_threads=1024 -model=unknown -thread_warp_size=32", [-1, 16, 64, 49152, 2147483647, 1024, 8, 32], "", 0, []], [[], [["FU", 2, [0, 1, 2, 3]], ["SP", 2, 0, 188160, [7], 1], ["AN", 2, 0, 5], ["AN", 2, 1, 6]]]], "r": [[2.26339e-05, 2.26291e-05, 2.26295e-05], 0, 1.59276, 1667926494], "v": "v0.6"}
{"i": [["[\"add\", 1, 28, 28, 240]", "cuda -keys=cuda,gpu -max_num_threads=1024 -model=unknown -thread_warp_size=32", [-1, 16, 64, 49152, 2147483647, 1024, 8, 32], "", 0, []], [[], [["FU", 2, [0, 1, 2, 3]], ["SP", 2, 0, 188160, [1], 1], ["AN", 2, 0, 5], ["AN", 2, 1, 6]]]], "r": [[0.000142161, 0.00014219, 0.000142162], 0, 1.28393, 1667926493], "v": "v0.6"}
{"i": [["[\"add\", 1, 28, 28, 240]", "cuda -keys=cuda,gpu -max_num_threads=1024 -model=unknown -thread_warp_size=32", [-1, 16, 64, 49152, 2147483647, 1024, 8, 32], "", 0, []], [[], [["FU", 2, [0, 1, 2, 3]], ["SP", 2, 0, 188160, [56], 1], ["AN", 2, 0, 5], ["AN", 2, 1, 6]]]], "r": [[5.22313e-06, 5.22403e-06, 5.22254e-06], 0, 1.80775, 1667926494], "v": "v0.6"}
{"i": [["[\"add\", 1, 28, 28, 240]", "cuda -keys=cuda,gpu -max_num_threads=1024 -model=unknown -thread_warp_size=32", [-1, 16, 64, 49152, 2147483647, 1024, 8, 32], "", 0, []], [[], [["FU", 2, [0, 1, 2, 3]], ["SP", 2, 0, 188160, [15], 1], ["AN", 2, 0, 5], ["AN", 2, 1, 6]]]], "r": [[1.21415e-05, 1.21367e-05, 1.21345e-05], 0, 0.664066, 1667926493], "v": "v0.6"}
{"i": [["[\"add\", 1, 28, 28, 240]", "cuda -keys=cuda,gpu -max_num_threads=1024 -model=unknown -thread_warp_size=32", [-1, 16, 64, 49152, 2147483647, 1024, 8, 32], "", 0, []], [[], [["FU", 2, [0, 1, 2, 3]], ["SP", 2, 0, 188160, [64], 1], ["AN", 2, 0, 5], ["AN", 2, 1, 6]]]], "r": [[4.79591e-06, 4.79761e-06, 4.79213e-06], 0, 2.48873, 1667926495], "v": "v0.6"}
{"i": [["[\"add\", 1, 28, 28, 240]", "cuda -keys=cuda,gpu -max_num_threads=1024 -model=unknown -thread_warp_size=32", [-1, 16, 64, 49152, 2147483647, 1024, 8, 32], "", 0, []], [[], [["FU", 2, [0, 1, 2, 3]], ["SP", 2, 0, 188160, [60], 1], ["AN", 2, 0, 5], ["AN", 2, 1, 6]]]], "r": [[5.07982e-06, 5.07889e-06, 5.07698e-06], 0, 2.71394, 1667926495], "v": "v0.6"}
{"i": [["[\"add\", 1, 28, 28, 240]", "cuda -keys=cuda,gpu -max_num_threads=1024 -model=unknown -thread_warp_size=32", [-1, 16, 64, 49152, 2147483647, 1024, 8, 32], "", 0, []], [[], [["FU", 2, [0, 1, 2, 3]], ["SP", 2, 0, 188160, [35], 1], ["AN", 2, 0, 5], ["AN", 2, 1, 6]]]], "r": [[6.5889e-06, 6.58827e-06, 6.5857e-06], 0, 3.02465, 1667926496], "v": "v0.6"}
{"i": [["[\"add\", 1, 28, 28, 240]", "cuda -keys=cuda,gpu -max_num_threads=1024 -model=unknown -thread_warp_size=32", [-1, 16, 64, 49152, 2147483647, 1024, 8, 32], "", 0, []], [[], [["FU", 2, [0, 1, 2, 3]], ["SP", 2, 0, 188160, [30], 1], ["AN", 2, 0, 5], ["AN", 2, 1, 6]]]], "r": [[7.44386e-06, 7.44997e-06, 7.44428e-06], 0, 3.31946, 1667926496], "v": "v0.6"}
{"i": [["[\"add\", 1, 28, 28, 240]", "cuda -keys=cuda,gpu -max_num_threads=1024 -model=unknown -thread_warp_size=32", [-1, 16, 64, 49152, 2147483647, 1024, 8, 32], "", 0, []], [[], [["FU", 2, [0, 1, 2, 3]], ["SP", 2, 0, 188160, [21], 1], ["AN", 2, 0, 5], ["AN", 2, 1, 6]]]], "r": [[9.37807e-06, 9.37711e-06, 9.38578e-06], 0, 3.62479, 1667926496], "v": "v0.6"}
{"i": [["[\"add\", 1, 28, 28, 240]", "cuda -keys=cuda,gpu -max_num_threads=1024 -model=unknown -thread_warp_size=32", [-1, 16, 64, 49152, 2147483647, 1024, 8, 32], "", 0, []], [[], [["FU", 2, [0, 1, 2, 3]], ["SP", 2, 0, 188160, [8], 1], ["AN", 2, 0, 5], ["AN", 2, 1, 6]]]], "r": [[2.01404e-05, 2.01387e-05, 2.01362e-05], 0, 3.83231, 1667926497], "v": "v0.6"}
{"i": [["[\"add\", 1, 28, 28, 240]", "cuda -keys=cuda,gpu -max_num_threads=1024 -model=unknown -thread_warp_size=32", [-1, 16, 64, 49152, 2147483647, 1024, 8, 32], "", 0, []], [[], [["FU", 2, [0, 1, 2, 3]], ["SP", 2, 0, 188160, [16], 1], ["AN", 2, 0, 5], ["AN", 2, 1, 6]]]], "r": [[1.15478e-05, 1.15486e-05, 1.1548e-05], 0, 4.09198, 1667926497], "v": "v0.6"}
{"i": [["[\"add\", 1, 28, 28, 240]", "cuda -keys=cuda,gpu -max_num_threads=1024 -model=unknown -thread_warp_size=32", [-1, 16, 64, 49152, 2147483647, 1024, 8, 32], "", 0, []], [[], [["FU", 2, [0, 1, 2, 3]], ["SP", 2, 0, 188160, [20], 1], ["AN", 2, 0, 5], ["AN", 2, 1, 6]]]], "r": [[9.71878e-06, 9.72782e-06, 9.71765e-06], 0, 4.78202, 1667926498], "v": "v0.6"}
{"i": [["[\"add\", 1, 28, 28, 240]", "cuda -keys=cuda,gpu -max_num_threads=1024 -model=unknown -thread_warp_size=32", [-1, 16, 64, 49152, 2147483647, 1024, 8, 32], "", 0, []], [[], [["FU", 2, [0, 1, 2, 3]], ["SP", 2, 0, 188160, [2], 1], ["AN", 2, 0, 5], ["AN", 2, 1, 6]]]], "r": [[7.24522e-05, 7.24468e-05, 7.24364e-05], 0, 4.44075, 1667926497], "v": "v0.6"}
{"i": [["[\"add\", 1, 28, 28, 240]", "cuda -keys=cuda,gpu -max_num_threads=1024 -model=unknown -thread_warp_size=32", [-1, 16, 64, 49152, 2147483647, 1024, 8, 32], "", 0, []], [[], [["FU", 2, [0, 1, 2, 3]], ["SP", 2, 0, 188160, [49], 1], ["AN", 2, 0, 5], ["AN", 2, 1, 6]]]], "r": [[5.52536e-06, 5.52715e-06, 5.5237e-06], 0, 5.10675, 1667926498], "v": "v0.6"}
{"i": [["[\"add\", 1, 28, 28, 240]", "cuda -keys=cuda,gpu -max_num_threads=1024 -model=unknown -thread_warp_size=32", [-1, 16, 64, 49152, 2147483647, 1024, 8, 32], "", 0, []], [[], [["FU", 2, [0, 1, 2, 3]], ["SP", 2, 0, 188160, [40], 1], ["AN", 2, 0, 5], ["AN", 2, 1, 6]]]], "r": [[6.07021e-06, 6.07307e-06, 6.07278e-06], 0, 5.36591, 1667926498], "v": "v0.6"}
{"i": [["[\"add\", 1, 28, 28, 240]", "cuda -keys=cuda,gpu -max_num_threads=1024 -model=unknown -thread_warp_size=32", [-1, 16, 64, 49152, 2147483647, 1024, 8, 32], "", 0, []], [[], [["FU", 2, [0, 1, 2, 3]], ["SP", 2, 0, 188160, [5], 1], ["AN", 2, 0, 5], ["AN", 2, 1, 6]]]], "r": [[3.05925e-05, 3.05893e-05, 3.05904e-05], 0, 5.65921, 1667926499], "v": "v0.6"}
{"i": [["[\"add\", 1, 28, 28, 240]", "cuda -keys=cuda,gpu -max_num_threads=1024 -model=unknown -thread_warp_size=32", [-1, 16, 64, 49152, 2147483647, 1024, 8, 32], "", 0, []], [[], [["FU", 2, [0, 1, 2, 3]], ["SP", 2, 0, 188160, [12], 1], ["AN", 2, 0, 5], ["AN", 2, 1, 6]]]], "r": [[1.44766e-05, 1.4467e-05, 1.44573e-05], 0, 6.01009, 1667926499], "v": "v0.6"}
{"i": [["[\"add\", 1, 28, 28, 240]", "cuda -keys=cuda,gpu -max_num_threads=1024 -model=unknown -thread_warp_size=32", [-1, 16, 64, 49152, 2147483647, 1024, 8, 32], "", 0, []], [[], [["FU", 2, [0, 1, 2, 3]], ["SP", 2, 0, 188160, [32], 1], ["AN", 2, 0, 5], ["AN", 2, 1, 6]]]], "r": [[6.99826e-06, 6.99757e-06, 7.00233e-06], 0, 6.3008, 1667926499], "v": "v0.6"}
{"i": [["[\"add\", 1, 28, 28, 240]", "cuda -keys=cuda,gpu -max_num_threads=1024 -model=unknown -thread_warp_size=32", [-1, 16, 64, 49152, 2147483647, 1024, 8, 32], "", 0, []], [[], [["FU", 2, [0, 1, 2, 3]], ["SP", 2, 0, 188160, [15], 1], ["AN", 2, 0, 5], ["AN", 2, 1, 6]]]], "r": [[1.2109e-05, 1.21076e-05, 1.21063e-05], 0, 1.73049, 1667938710], "v": "v0.6"}
{"i": [["[\"add\", 1, 28, 28, 240]", "cuda -keys=cuda,gpu -max_num_threads=1024 -model=unknown -thread_warp_size=32", [-1, 16, 64, 49152, 2147483647, 1024, 8, 32], "", 0, []], [[], [["FU", 2, [0, 1, 2, 3]], ["SP", 2, 0, 188160, [24], 1], ["AN", 2, 0, 5], ["AN", 2, 1, 6]]]], "r": [[8.48992e-06, 8.49358e-06, 8.48927e-06], 0, 2.33343, 1667938711], "v": "v0.6"}
{"i": [["[\"add\", 1, 28, 28, 240]", "cuda -keys=cuda,gpu -max_num_threads=1024 -model=unknown -thread_warp_size=32", [-1, 16, 64, 49152, 2147483647, 1024, 8, 32], "", 0, []], [[], [["FU", 2, [0, 1, 2, 3]], ["SP", 2, 0, 188160, [16], 1], ["AN", 2, 0, 5], ["AN", 2, 1, 6]]]], "r": [[2.01919e-05, 1.14094e-05, 1.14177e-05], 0, 1.0258, 1667938709], "v": "v0.6"}
{"i": [["[\"add\", 1, 28, 28, 240]", "cuda -keys=cuda,gpu -max_num_threads=1024 -model=unknown -thread_warp_size=32", [-1, 16, 64, 49152, 2147483647, 1024, 8, 32], "", 0, []], [[], [["FU", 2, [0, 1, 2, 3]], ["SP", 2, 0, 188160, [10], 1], ["AN", 2, 0, 5], ["AN", 2, 1, 6]]]], "r": [[1.6735e-05, 1.67316e-05, 1.67324e-05], 0, 0.637541, 1667938709], "v": "v0.6"}
{"i": [["[\"add\", 1, 28, 28, 240]", "cuda -keys=cuda,gpu -max_num_threads=1024 -model=unknown -thread_warp_size=32", [-1, 16, 64, 49152, 2147483647, 1024, 8, 32], "", 0, []], [[], [["FU", 2, [0, 1, 2, 3]], ["SP", 2, 0, 188160, [12], 1], ["AN", 2, 0, 5], ["AN", 2, 1, 6]]]], "r": [[1.4299e-05, 1.42975e-05, 1.42902e-05], 0, 2.12452, 1667938710], "v": "v0.6"}
{"i": [["[\"add\", 1, 28, 28, 240]", "cuda -keys=cuda,gpu -max_num_threads=1024 -model=unknown -thread_warp_size=32", [-1, 16, 64, 49152, 2147483647, 1024, 8, 32], "", 0, []], [[], [["FU", 2, [0, 1, 2, 3]], ["SP", 2, 0, 188160, [35], 1], ["AN", 2, 0, 5], ["AN", 2, 1, 6]]]], "r": [[6.57589e-06, 6.57504e-06, 6.57531e-06], 0, 1.42814, 1667938710], "v": "v0.6"}
{"i": [["[\"add\", 1, 28, 28, 240]", "cuda -keys=cuda,gpu -max_num_threads=1024 -model=unknown -thread_warp_size=32", [-1, 16, 64, 49152, 2147483647, 1024, 8, 32], "", 0, []], [[], [["FU", 2, [0, 1, 2, 3]], ["SP", 2, 0, 188160, [56], 1], ["AN", 2, 0, 5], ["AN", 2, 1, 6]]]], "r": [[5.28233e-06, 5.28237e-06, 5.28019e-06], 0, 2.73061, 1667938711], "v": "v0.6"}
{"i": [["[\"add\", 1, 28, 28, 240]", "cuda -keys=cuda,gpu -max_num_threads=1024 -model=unknown -thread_warp_size=32", [-1, 16, 64, 49152, 2147483647, 1024, 8, 32], "", 0, []], [[], [["FU", 2, [0, 1, 2, 3]], ["SP", 2, 0, 188160, [21], 1], ["AN", 2, 0, 5], ["AN", 2, 1, 6]]]], "r": [[9.46445e-06, 9.47179e-06, 9.47049e-06], 0, 2.95422, 1667938711], "v": "v0.6"}
{"i": [["[\"add\", 1, 28, 28, 240]", "cuda -keys=cuda,gpu -max_num_threads=1024 -model=unknown -thread_warp_size=32", [-1, 16, 64, 49152, 2147483647, 1024, 8, 32], "", 0, []], [[], [["FU", 2, [0, 1, 2, 3]], ["SP", 2, 0, 188160, [3], 1], ["AN", 2, 0, 5], ["AN", 2, 1, 6]]]], "r": [[4.91735e-05, 4.91663e-05, 4.9181e-05], 0, 3.30221, 1667938712], "v": "v0.6"}
{"i": [["[\"add\", 1, 28, 28, 240]", "cuda -keys=cuda,gpu -max_num_threads=1024 -model=unknown -thread_warp_size=32", [-1, 16, 64, 49152, 2147483647, 1024, 8, 32], "", 0, []], [[], [["FU", 2, [0, 1, 2, 3]], ["SP", 2, 0, 188160, [20], 1], ["AN", 2, 0, 5], ["AN", 2, 1, 6]]]], "r": [[9.6713e-06, 9.67897e-06, 9.67733e-06], 0, 3.55974, 1667938712], "v": "v0.6"}
{"i": [["[\"add\", 1, 28, 28, 240]", "cuda -keys=cuda,gpu -max_num_threads=1024 -model=unknown -thread_warp_size=32", [-1, 16, 64, 49152, 2147483647, 1024, 8, 32], "", 0, []], [[], [["FU", 2, [0, 1, 2, 3]], ["SP", 2, 0, 188160, [5], 1], ["AN", 2, 0, 5], ["AN", 2, 1, 6]]]], "r": [[3.06596e-05, 3.06595e-05, 3.06663e-05], 0, 3.8163, 1667938712], "v": "v0.6"}
{"i": [["[\"add\", 1, 28, 28, 240]", "cuda -keys=cuda,gpu -max_num_threads=1024 -model=unknown -thread_warp_size=32", [-1, 16, 64, 49152, 2147483647, 1024, 8, 32], "", 0, []], [[], [["FU", 2, [0, 1, 2, 3]], ["SP", 2, 0, 188160, [1], 1], ["AN", 2, 0, 5], ["AN", 2, 1, 6]]]], "r": [[0.000142124, 0.000142109, 0.000142148], 0, 4.42253, 1667938713], "v": "v0.6"}
{"i": [["[\"add\", 1, 28, 28, 240]", "cuda -keys=cuda,gpu -max_num_threads=1024 -model=unknown -thread_warp_size=32", [-1, 16, 64, 49152, 2147483647, 1024, 8, 32], "", 0, []], [[], [["FU", 2, [0, 1, 2, 3]], ["SP", 2, 0, 188160, [64], 1], ["AN", 2, 0, 5], ["AN", 2, 1, 6]]]], "r": [[4.88776e-06, 4.88191e-06, 4.87996e-06], 0, 4.67357, 1667938713], "v": "v0.6"}
{"i": [["[\"add\", 1, 28, 28, 240]", "cuda -keys=cuda,gpu -max_num_threads=1024 -model=unknown -thread_warp_size=32", [-1, 16, 64, 49152, 2147483647, 1024, 8, 32], "", 0, []], [[], [["FU", 2, [0, 1, 2, 3]], ["SP", 2, 0, 188160, [32], 1], ["AN", 2, 0, 5], ["AN", 2, 1, 6]]]], "r": [[7.09838e-06, 7.10491e-06, 7.10517e-06], 0, 4.89059, 1667938714], "v": "v0.6"}
{"i": [["[\"add\", 1, 28, 28, 240]", "cuda -keys=cuda,gpu -max_num_threads=1024 -model=unknown -thread_warp_size=32", [-1, 16, 64, 49152, 2147483647, 1024, 8, 32], "", 0, []], [[], [["FU", 2, [0, 1, 2, 3]], ["SP", 2, 0, 188160, [40], 1], ["AN", 2, 0, 5], ["AN", 2, 1, 6]]]], "r": [[6.23769e-06, 6.22833e-06, 6.22647e-06], 0, 5.42103, 1667938714], "v": "v0.6"}
{"i": [["[\"add\", 1, 28, 28, 240]", "cuda -keys=cuda,gpu -max_num_threads=1024 -model=unknown -thread_warp_size=32", [-1, 16, 64, 49152, 2147483647, 1024, 8, 32], "", 0, []], [[], [["FU", 2, [0, 1, 2, 3]], ["SP", 2, 0, 188160, [42], 1], ["AN", 2, 0, 5], ["AN", 2, 1, 6]]]], "r": [[5.92496e-06, 5.92158e-06, 5.92347e-06], 0, 5.7238, 1667938715], "v": "v0.6"}
{"i": [["[\"add\", 1, 28, 28, 240]", "cuda -keys=cuda,gpu -max_num_threads=1024 -model=unknown -thread_warp_size=32", [-1, 16, 64, 49152, 2147483647, 1024, 8, 32], "", 0, []], [[], [["FU", 2, [0, 1, 2, 3]], ["SP", 2, 0, 188160, [14], 1], ["AN", 2, 0, 5], ["AN", 2, 1, 6]]]], "r": [[1.27059e-05, 1.27029e-05, 1.27032e-05], 0, 5.1034, 1667938714], "v": "v0.6"}
{"i": [["[\"add\", 1, 28, 28, 240]", "cuda -keys=cuda,gpu -max_num_threads=1024 -model=unknown -thread_warp_size=32", [-1, 16, 64, 49152, 2147483647, 1024, 8, 32], "", 0, []], [[], [["FU", 2, [0, 1, 2, 3]], ["SP", 2, 0, 188160, [4], 1], ["AN", 2, 0, 5], ["AN", 2, 1, 6]]]], "r": [[3.77021e-05, 3.76835e-05, 3.76745e-05], 0, 6.03261, 1667938715], "v": "v0.6"}
{"i": [["[\"add\", 1, 28, 28, 240]", "cuda -keys=cuda,gpu -max_num_threads=1024 -model=unknown -thread_warp_size=32", [-1, 16, 64, 49152, 2147483647, 1024, 8, 32], "", 0, []], [[], [["FU", 2, [0, 1, 2, 3]], ["SP", 2, 0, 188160, [49], 1], ["AN", 2, 0, 5], ["AN", 2, 1, 6]]]], "r": [[5.45431e-06, 5.45717e-06, 5.4587e-06], 0, 6.24458, 1667938715], "v": "v0.6"}
{"i": [["[\"add\", 1, 28, 28, 240]", "cuda -keys=cuda,gpu -max_num_threads=1024 -model=unknown -thread_warp_size=32", [-1, 16, 64, 49152, 2147483647, 1024, 8, 32], "", 0, []], [[], [["FU", 2, [0, 1, 2, 3]], ["SP", 2, 0, 188160, [6], 1], ["AN", 2, 0, 5], ["AN", 2, 1, 6]]]], "r": [[2.5889e-05, 2.589e-05, 2.58898e-05], 0, 6.59142, 1667938716], "v": "v0.6"}
{"i": [["[\"add\", 1, 28, 28, 240]", "cuda -keys=cuda,gpu -max_num_threads=1024 -model=unknown -thread_warp_size=32", [-1, 16, 64, 49152, 2147483647, 1024, 8, 32], "", 0, []], [[], [["FU", 2, [0, 1, 2, 3]], ["SP", 2, 0, 188160, [60], 1], ["AN", 2, 0, 5], ["AN", 2, 1, 6]]]], "r": [[4.8504e-06, 4.85098e-06, 4.84955e-06], 0, 6.91966, 1667938716], "v": "v0.6"}
{"i": [["[\"add\", 1, 28, 28, 240]", "cuda -keys=cuda,gpu -max_num_threads=1024 -model=unknown -thread_warp_size=32", [-1, 16, 64, 49152, 2147483647, 1024, 8, 32], "", 0, []], [[], [["FU", 2, [0, 1, 2, 3]], ["SP", 2, 0, 188160, [2], 1], ["AN", 2, 0, 5], ["AN", 2, 1, 6]]]], "r": [[7.24167e-05, 7.24266e-05, 7.24216e-05], 0, 7.1878, 1667938716], "v": "v0.6"}
{"i": [["[\"add\", 1, 28, 28, 240]", "cuda -keys=cuda,gpu -max_num_threads=1024 -model=unknown -thread_warp_size=32", [-1, 16, 64, 49152, 2147483647, 1024, 8, 32], "", 0, []], [[], [["FU", 2, [0, 1, 2, 3]], ["SP", 2, 0, 188160, [28], 1], ["AN", 2, 0, 5], ["AN", 2, 1, 6]]]], "r": [[7.68031e-06, 7.68065e-06, 7.68065e-06], 0, 4.02806, 1667938713], "v": "v0.6"}
{"i": [["[\"add\", 1, 28, 28, 240]", "cuda -keys=cuda,gpu -max_num_threads=1024 -model=unknown -thread_warp_size=32", [-1, 16, 64, 49152, 2147483647, 1024, 8, 32], "", 0, []], [[], [["FU", 2, [0, 1, 2, 3]], ["SP", 2, 0, 188160, [48], 1], ["AN", 2, 0, 5], ["AN", 2, 1, 6]]]], "r": [[5.49753e-06, 5.49768e-06, 5.5005e-06], 0, 7.37937, 1667938717], "v": "v0.6"}
{"i": [["[\"add\", 1, 28, 28, 240]", "cuda -keys=cuda,gpu -max_num_threads=1024 -model=unknown -thread_warp_size=32", [-1, 16, 64, 49152, 2147483647, 1024, 8, 32], "", 0, []], [[], [["FU", 2, [0, 1, 2, 3]], ["SP", 2, 0, 188160, [8], 1], ["AN", 2, 0, 5], ["AN", 2, 1, 6]]]], "r": [[2.01516e-05, 2.01488e-05, 2.01474e-05], 0, 7.65799, 1667938717], "v": "v0.6"}
{"i": [["[\"add\", 1, 28, 28, 240]", "cuda -keys=cuda,gpu -max_num_threads=1024 -model=unknown -thread_warp_size=32", [-1, 16, 64, 49152, 2147483647, 1024, 8, 32], "", 0, []], [[], [["FU", 2, [0, 1, 2, 3]], ["SP", 2, 0, 188160, [7], 1], ["AN", 2, 0, 5], ["AN", 2, 1, 6]]]], "r": [[2.26637e-05, 2.2663e-05, 2.2661e-05], 0, 7.99119, 1667938717], "v": "v0.6"}
{"i": [["[\"add\", 1, 28, 28, 240]", "cuda -keys=cuda,gpu -max_num_threads=1024 -model=unknown -thread_warp_size=32", [-1, 16, 64, 49152, 2147483647, 1024, 8, 32], "", 0, []], [[], [["FU", 2, [0, 1, 2, 3]], ["SP", 2, 0, 188160, [30], 1], ["AN", 2, 0, 5], ["AN", 2, 1, 6]]]], "r": [[7.35332e-06, 7.35547e-06, 7.34914e-06], 0, 8.26097, 1667938718], "v": "v0.6"}
