python/models/efficientnet/VertiFusionEfficientNet_kernel_configs/efficient_sigmoid_1_28_28_240.log
{"i": [["[\"sigmoid\", 1, 28, 28, 240]", "cuda -keys=cuda,gpu -max_num_threads=1024 -model=unknown -thread_warp_size=32", [-1, 16, 64, 49152, 2147483647, 1024, 8, 32], "", 0, []], [[], [["FU", 1, [0, 1, 2, 3]], ["SP", 1, 0, 188160, [30], 1], ["AN", 1, 0, 5], ["AN", 1, 1, 6]]]], "r": [[7.4332e-06, 7.45023e-06, 7.45125e-06], 0, 2.23803, 1667926304], "v": "v0.6"}
{"i": [["[\"sigmoid\", 1, 28, 28, 240]", "cuda -keys=cuda,gpu -max_num_threads=1024 -model=unknown -thread_warp_size=32", [-1, 16, 64, 49152, 2147483647, 1024, 8, 32], "", 0, []], [[], [["FU", 1, [0, 1, 2, 3]], ["SP", 1, 0, 188160, [10], 1], ["AN", 1, 0, 5], ["AN", 1, 1, 6]]]], "r": [[1.687e-05, 1.68783e-05, 1.68753e-05], 0, 2.36847, 1667926305], "v": "v0.6"}
{"i": [["[\"sigmoid\", 1, 28, 28, 240]", "cuda -keys=cuda,gpu -max_num_threads=1024 -model=unknown -thread_warp_size=32", [-1, 16, 64, 49152, 2147483647, 1024, 8, 32], "", 0, []], [[], [["FU", 1, [0, 1, 2, 3]], ["SP", 1, 0, 188160, [1], 1], ["AN", 1, 0, 5], ["AN", 1, 1, 6]]]], "r": [[0.000142385, 0.000142391, 0.000142385], 0, 1.29847, 1667926303], "v": "v0.6"}
{"i": [["[\"sigmoid\", 1, 28, 28, 240]", "cuda -keys=cuda,gpu -max_num_threads=1024 -model=unknown -thread_warp_size=32", [-1, 16, 64, 49152, 2147483647, 1024, 8, 32], "", 0, []], [[], [["FU", 1, [0, 1, 2, 3]], ["SP", 1, 0, 188160, [16], 1], ["AN", 1, 0, 5], ["AN", 1, 1, 6]]]], "r": [[1.16096e-05, 1.16197e-05, 1.16191e-05], 0, 2.01705, 1667926304], "v": "v0.6"}
{"i": [["[\"sigmoid\", 1, 28, 28, 240]", "cuda -keys=cuda,gpu -max_num_threads=1024 -model=unknown -thread_warp_size=32", [-1, 16, 64, 49152, 2147483647, 1024, 8, 32], "", 0, []], [[], [["FU", 1, [0, 1, 2, 3]], ["SP", 1, 0, 188160, [15], 1], ["AN", 1, 0, 5], ["AN", 1, 1, 6]]]], "r": [[1.23043e-05, 1.23308e-05, 1.23214e-05], 0, 1.65911, 1667926304], "v": "v0.6"}
{"i": [["[\"sigmoid\", 1, 28, 28, 240]", "cuda -keys=cuda,gpu -max_num_threads=1024 -model=unknown -thread_warp_size=32", [-1, 16, 64, 49152, 2147483647, 1024, 8, 32], "", 0, []], [[], [["FU", 1, [0, 1, 2, 3]], ["SP", 1, 0, 188160, [28], 1], ["AN", 1, 0, 5], ["AN", 1, 1, 6]]]], "r": [[7.8262e-06, 7.84591e-06, 7.84725e-06], 0, 0.622373, 1667926303], "v": "v0.6"}
{"i": [["[\"sigmoid\", 1, 28, 28, 240]", "cuda -keys=cuda,gpu -max_num_threads=1024 -model=unknown -thread_warp_size=32", [-1, 16, 64, 49152, 2147483647, 1024, 8, 32], "", 0, []], [[], [["FU", 1, [0, 1, 2, 3]], ["SP", 1, 0, 188160, [35], 1], ["AN", 1, 0, 5], ["AN", 1, 1, 6]]]], "r": [[6.64883e-06, 6.66175e-06, 6.66117e-06], 0, 0.959838, 1667926303], "v": "v0.6"}
{"i": [["[\"sigmoid\", 1, 28, 28, 240]", "cuda -keys=cuda,gpu -max_num_threads=1024 -model=unknown -thread_warp_size=32", [-1, 16, 64, 49152, 2147483647, 1024, 8, 32], "", 0, []], [[], [["FU", 1, [0, 1, 2, 3]], ["SP", 1, 0, 188160, [60], 1], ["AN", 1, 0, 5], ["AN", 1, 1, 6]]]], "r": [[5.07403e-06, 5.09455e-06, 5.08746e-06], 0, 3.98815, 1667926306], "v": "v0.6"}
{"i": [["[\"sigmoid\", 1, 28, 28, 240]", "cuda -keys=cuda,gpu -max_num_threads=1024 -model=unknown -thread_warp_size=32", [-1, 16, 64, 49152, 2147483647, 1024, 8, 32], "", 0, []], [[], [["FU", 1, [0, 1, 2, 3]], ["SP", 1, 0, 188160, [56], 1], ["AN", 1, 0, 5], ["AN", 1, 1, 6]]]], "r": [[5.19803e-06, 5.21545e-06, 5.21181e-06], 0, 4.58691, 1667926307], "v": "v0.6"}
{"i": [["[\"sigmoid\", 1, 28, 28, 240]", "cuda -keys=cuda,gpu -max_num_threads=1024 -model=unknown -thread_warp_size=32", [-1, 16, 64, 49152, 2147483647, 1024, 8, 32], "", 0, []], [[], [["FU", 1, [0, 1, 2, 3]], ["SP", 1, 0, 188160, [24], 1], ["AN", 1, 0, 5], ["AN", 1, 1, 6]]]], "r": [[8.67122e-06, 8.68349e-06, 8.68631e-06], 0, 2.95611, 1667926305], "v": "v0.6"}
{"i": [["[\"sigmoid\", 1, 28, 28, 240]", "cuda -keys=cuda,gpu -max_num_threads=1024 -model=unknown -thread_warp_size=32", [-1, 16, 64, 49152, 2147483647, 1024, 8, 32], "", 0, []], [[], [["FU", 1, [0, 1, 2, 3]], ["SP", 1, 0, 188160, [2], 1], ["AN", 1, 0, 5], ["AN", 1, 1, 6]]]], "r": [[7.2683e-05, 7.26869e-05, 7.26944e-05], 0, 2.64443, 1667926305], "v": "v0.6"}
{"i": [["[\"sigmoid\", 1, 28, 28, 240]", "cuda -keys=cuda,gpu -max_num_threads=1024 -model=unknown -thread_warp_size=32", [-1, 16, 64, 49152, 2147483647, 1024, 8, 32], "", 0, []], [[], [["FU", 1, [0, 1, 2, 3]], ["SP", 1, 0, 188160, [7], 1], ["AN", 1, 0, 5], ["AN", 1, 1, 6]]]], "r": [[2.2917e-05, 2.29552e-05, 2.29397e-05], 0, 3.24754, 1667926306], "v": "v0.6"}
{"i": [["[\"sigmoid\", 1, 28, 28, 240]", "cuda -keys=cuda,gpu -max_num_threads=1024 -model=unknown -thread_warp_size=32", [-1, 16, 64, 49152, 2147483647, 1024, 8, 32], "", 0, []], [[], [["FU", 1, [0, 1, 2, 3]], ["SP", 1, 0, 188160, [5], 1], ["AN", 1, 0, 5], ["AN", 1, 1, 6]]]], "r": [[3.08971e-05, 3.08965e-05, 3.08816e-05], 0, 3.62187, 1667926306], "v": "v0.6"}
{"i": [["[\"sigmoid\", 1, 28, 28, 240]", "cuda -keys=cuda,gpu -max_num_threads=1024 -model=unknown -thread_warp_size=32", [-1, 16, 64, 49152, 2147483647, 1024, 8, 32], "", 0, []], [[], [["FU", 1, [0, 1, 2, 3]], ["SP", 1, 0, 188160, [3], 1], ["AN", 1, 0, 5], ["AN", 1, 1, 6]]]], "r": [[4.93069e-05, 4.93115e-05, 4.93225e-05], 0, 4.79953, 1667926307], "v": "v0.6"}
{"i": [["[\"sigmoid\", 1, 28, 28, 240]", "cuda -keys=cuda,gpu -max_num_threads=1024 -model=unknown -thread_warp_size=32", [-1, 16, 64, 49152, 2147483647, 1024, 8, 32], "", 0, []], [[], [["FU", 1, [0, 1, 2, 3]], ["SP", 1, 0, 188160, [48], 1], ["AN", 1, 0, 5], ["AN", 1, 1, 6]]]], "r": [[5.55277e-06, 5.56529e-06, 5.56532e-06], 0, 4.18571, 1667926307], "v": "v0.6"}
{"i": [["[\"sigmoid\", 1, 28, 28, 240]", "cuda -keys=cuda,gpu -max_num_threads=1024 -model=unknown -thread_warp_size=32", [-1, 16, 64, 49152, 2147483647, 1024, 8, 32], "", 0, []], [[], [["FU", 1, [0, 1, 2, 3]], ["SP", 1, 0, 188160, [6], 1], ["AN", 1, 0, 5], ["AN", 1, 1, 6]]]], "r": [[2.63005e-05, 2.63139e-05, 2.63163e-05], 0, 5.04959, 1667926308], "v": "v0.6"}
{"i": [["[\"sigmoid\", 1, 28, 28, 240]", "cuda -keys=cuda,gpu -max_num_threads=1024 -model=unknown -thread_warp_size=32", [-1, 16, 64, 49152, 2147483647, 1024, 8, 32], "", 0, []], [[], [["FU", 1, [0, 1, 2, 3]], ["SP", 1, 0, 188160, [64], 1], ["AN", 1, 0, 5], ["AN", 1, 1, 6]]]], "r": [[4.99928e-06, 5.01753e-06, 5.01615e-06], 0, 5.39839, 1667926308], "v": "v0.6"}
{"i": [["[\"sigmoid\", 1, 28, 28, 240]", "cuda -keys=cuda,gpu -max_num_threads=1024 -model=unknown -thread_warp_size=32", [-1, 16, 64, 49152, 2147483647, 1024, 8, 32], "", 0, []], [[], [["FU", 1, [0, 1, 2, 3]], ["SP", 1, 0, 188160, [12], 1], ["AN", 1, 0, 5], ["AN", 1, 1, 6]]]], "r": [[1.45334e-05, 1.45471e-05, 1.45544e-05], 0, 5.61921, 1667926308], "v": "v0.6"}
{"i": [["[\"sigmoid\", 1, 28, 28, 240]", "cuda -keys=cuda,gpu -max_num_threads=1024 -model=unknown -thread_warp_size=32", [-1, 16, 64, 49152, 2147483647, 1024, 8, 32], "", 0, []], [[], [["FU", 1, [0, 1, 2, 3]], ["SP", 1, 0, 188160, [32], 1], ["AN", 1, 0, 5], ["AN", 1, 1, 6]]]], "r": [[7.2941e-06, 7.31212e-06, 7.31217e-06], 0, 5.93491, 1667926309], "v": "v0.6"}
{"i": [["[\"sigmoid\", 1, 28, 28, 240]", "cuda -keys=cuda,gpu -max_num_threads=1024 -model=unknown -thread_warp_size=32", [-1, 16, 64, 49152, 2147483647, 1024, 8, 32], "", 0, []], [[], [["FU", 1, [0, 1, 2, 3]], ["SP", 1, 0, 188160, [14], 1], ["AN", 1, 0, 5], ["AN", 1, 1, 6]]]], "r": [[1.30788e-05, 1.3094e-05, 1.31024e-05], 0, 6.2549, 1667926309], "v": "v0.6"}
{"i": [["[\"sigmoid\", 1, 28, 28, 240]", "cuda -keys=cuda,gpu -max_num_threads=1024 -model=unknown -thread_warp_size=32", [-1, 16, 64, 49152, 2147483647, 1024, 8, 32], "", 0, []], [[], [["FU", 1, [0, 1, 2, 3]], ["SP", 1, 0, 188160, [28], 1], ["AN", 1, 0, 5], ["AN", 1, 1, 6]]]], "r": [[7.81933e-06, 7.83046e-06, 7.8305e-06], 0, 2.06255, 1667937145], "v": "v0.6"}
{"i": [["[\"sigmoid\", 1, 28, 28, 240]", "cuda -keys=cuda,gpu -max_num_threads=1024 -model=unknown -thread_warp_size=32", [-1, 16, 64, 49152, 2147483647, 1024, 8, 32], "", 0, []], [[], [["FU", 1, [0, 1, 2, 3]], ["SP", 1, 0, 188160, [56], 1], ["AN", 1, 0, 5], ["AN", 1, 1, 6]]]], "r": [[5.31105e-06, 5.32754e-06, 5.3241e-06], 0, 2.88095, 1667937146], "v": "v0.6"}
{"i": [["[\"sigmoid\", 1, 28, 28, 240]", "cuda -keys=cuda,gpu -max_num_threads=1024 -model=unknown -thread_warp_size=32", [-1, 16, 64, 49152, 2147483647, 1024, 8, 32], "", 0, []], [[], [["FU", 1, [0, 1, 2, 3]], ["SP", 1, 0, 188160, [2], 1], ["AN", 1, 0, 5], ["AN", 1, 1, 6]]]], "r": [[0.000116873, 7.26731e-05, 7.26662e-05], 0, 1.09003, 1667937144], "v": "v0.6"}
{"i": [["[\"sigmoid\", 1, 28, 28, 240]", "cuda -keys=cuda,gpu -max_num_threads=1024 -model=unknown -thread_warp_size=32", [-1, 16, 64, 49152, 2147483647, 1024, 8, 32], "", 0, []], [[], [["FU", 1, [0, 1, 2, 3]], ["SP", 1, 0, 188160, [21], 1], ["AN", 1, 0, 5], ["AN", 1, 1, 6]]]], "r": [[9.46512e-06, 9.47577e-06, 9.47498e-06], 0, 2.31366, 1667937145], "v": "v0.6"}
{"i": [["[\"sigmoid\", 1, 28, 28, 240]", "cuda -keys=cuda,gpu -max_num_threads=1024 -model=unknown -thread_warp_size=32", [-1, 16, 64, 49152, 2147483647, 1024, 8, 32], "", 0, []], [[], [["FU", 1, [0, 1, 2, 3]], ["SP", 1, 0, 188160, [14], 1], ["AN", 1, 0, 5], ["AN", 1, 1, 6]]]], "r": [[1.29845e-05, 1.29966e-05, 1.29951e-05], 0, 1.73011, 1667937144], "v": "v0.6"}
{"i": [["[\"sigmoid\", 1, 28, 28, 240]", "cuda -keys=cuda,gpu -max_num_threads=1024 -model=unknown -thread_warp_size=32", [-1, 16, 64, 49152, 2147483647, 1024, 8, 32], "", 0, []], [[], [["FU", 1, [0, 1, 2, 3]], ["SP", 1, 0, 188160, [16], 1], ["AN", 1, 0, 5], ["AN", 1, 1, 6]]]], "r": [[1.1715e-05, 1.1731e-05, 1.17259e-05], 0, 0.654625, 1667937143], "v": "v0.6"}
{"i": [["[\"sigmoid\", 1, 28, 28, 240]", "cuda -keys=cuda,gpu -max_num_threads=1024 -model=unknown -thread_warp_size=32", [-1, 16, 64, 49152, 2147483647, 1024, 8, 32], "", 0, []], [[], [["FU", 1, [0, 1, 2, 3]], ["SP", 1, 0, 188160, [49], 1], ["AN", 1, 0, 5], ["AN", 1, 1, 6]]]], "r": [[5.49359e-06, 5.50821e-06, 5.50931e-06], 0, 1.43307, 1667937144], "v": "v0.6"}
{"i": [["[\"sigmoid\", 1, 28, 28, 240]", "cuda -keys=cuda,gpu -max_num_threads=1024 -model=unknown -thread_warp_size=32", [-1, 16, 64, 49152, 2147483647, 1024, 8, 32], "", 0, []], [[], [["FU", 1, [0, 1, 2, 3]], ["SP", 1, 0, 188160, [35], 1], ["AN", 1, 0, 5], ["AN", 1, 1, 6]]]], "r": [[6.64983e-06, 6.66212e-06, 6.66211e-06], 0, 2.57428, 1667937145], "v": "v0.6"}
{"i": [["[\"sigmoid\", 1, 28, 28, 240]", "cuda -keys=cuda,gpu -max_num_threads=1024 -model=unknown -thread_warp_size=32", [-1, 16, 64, 49152, 2147483647, 1024, 8, 32], "", 0, []], [[], [["FU", 1, [0, 1, 2, 3]], ["SP", 1, 0, 188160, [7], 1], ["AN", 1, 0, 5], ["AN", 1, 1, 6]]]], "r": [[2.28739e-05, 2.28899e-05, 2.2882e-05], 0, 3.43834, 1667937146], "v": "v0.6"}
{"i": [["[\"sigmoid\", 1, 28, 28, 240]", "cuda -keys=cuda,gpu -max_num_threads=1024 -model=unknown -thread_warp_size=32", [-1, 16, 64, 49152, 2147483647, 1024, 8, 32], "", 0, []], [[], [["FU", 1, [0, 1, 2, 3]], ["SP", 1, 0, 188160, [60], 1], ["AN", 1, 0, 5], ["AN", 1, 1, 6]]]], "r": [[4.95899e-06, 4.97331e-06, 4.97385e-06], 0, 3.16108, 1667937146], "v": "v0.6"}
{"i": [["[\"sigmoid\", 1, 28, 28, 240]", "cuda -keys=cuda,gpu -max_num_threads=1024 -model=unknown -thread_warp_size=32", [-1, 16, 64, 49152, 2147483647, 1024, 8, 32], "", 0, []], [[], [["FU", 1, [0, 1, 2, 3]], ["SP", 1, 0, 188160, [8], 1], ["AN", 1, 0, 5], ["AN", 1, 1, 6]]]], "r": [[2.04809e-05, 2.05017e-05, 2.05058e-05], 0, 3.73401, 1667937147], "v": "v0.6"}
{"i": [["[\"sigmoid\", 1, 28, 28, 240]", "cuda -keys=cuda,gpu -max_num_threads=1024 -model=unknown -thread_warp_size=32", [-1, 16, 64, 49152, 2147483647, 1024, 8, 32], "", 0, []], [[], [["FU", 1, [0, 1, 2, 3]], ["SP", 1, 0, 188160, [32], 1], ["AN", 1, 0, 5], ["AN", 1, 1, 6]]]], "r": [[7.1474e-06, 7.16286e-06, 7.16175e-06], 0, 4.27274, 1667937147], "v": "v0.6"}
{"i": [["[\"sigmoid\", 1, 28, 28, 240]", "cuda -keys=cuda,gpu -max_num_threads=1024 -model=unknown -thread_warp_size=32", [-1, 16, 64, 49152, 2147483647, 1024, 8, 32], "", 0, []], [[], [["FU", 1, [0, 1, 2, 3]], ["SP", 1, 0, 188160, [4], 1], ["AN", 1, 0, 5], ["AN", 1, 1, 6]]]], "r": [[3.79204e-05, 3.79323e-05, 3.79336e-05], 0, 4.86312, 1667937148], "v": "v0.6"}
{"i": [["[\"sigmoid\", 1, 28, 28, 240]", "cuda -keys=cuda,gpu -max_num_threads=1024 -model=unknown -thread_warp_size=32", [-1, 16, 64, 49152, 2147483647, 1024, 8, 32], "", 0, []], [[], [["FU", 1, [0, 1, 2, 3]], ["SP", 1, 0, 188160, [64], 1], ["AN", 1, 0, 5], ["AN", 1, 1, 6]]]], "r": [[4.78283e-06, 4.7925e-06, 4.7914e-06], 0, 4.54257, 1667937148], "v": "v0.6"}
{"i": [["[\"sigmoid\", 1, 28, 28, 240]", "cuda -keys=cuda,gpu -max_num_threads=1024 -model=unknown -thread_warp_size=32", [-1, 16, 64, 49152, 2147483647, 1024, 8, 32], "", 0, []], [[], [["FU", 1, [0, 1, 2, 3]], ["SP", 1, 0, 188160, [12], 1], ["AN", 1, 0, 5], ["AN", 1, 1, 6]]]], "r": [[1.45735e-05, 1.45849e-05, 1.45772e-05], 0, 4.9174, 1667937148], "v": "v0.6"}
{"i": [["[\"sigmoid\", 1, 28, 28, 240]", "cuda -keys=cuda,gpu -max_num_threads=1024 -model=unknown -thread_warp_size=32", [-1, 16, 64, 49152, 2147483647, 1024, 8, 32], "", 0, []], [[], [["FU", 1, [0, 1, 2, 3]], ["SP", 1, 0, 188160, [42], 1], ["AN", 1, 0, 5], ["AN", 1, 1, 6]]]], "r": [[6.0164e-06, 6.02463e-06, 6.02662e-06], 0, 5.5544, 1667937149], "v": "v0.6"}
{"i": [["[\"sigmoid\", 1, 28, 28, 240]", "cuda -keys=cuda,gpu -max_num_threads=1024 -model=unknown -thread_warp_size=32", [-1, 16, 64, 49152, 2147483647, 1024, 8, 32], "", 0, []], [[], [["FU", 1, [0, 1, 2, 3]], ["SP", 1, 0, 188160, [3], 1], ["AN", 1, 0, 5], ["AN", 1, 1, 6]]]], "r": [[4.93176e-05, 4.93332e-05, 4.93233e-05], 0, 5.84171, 1667937149], "v": "v0.6"}
{"i": [["[\"sigmoid\", 1, 28, 28, 240]", "cuda -keys=cuda,gpu -max_num_threads=1024 -model=unknown -thread_warp_size=32", [-1, 16, 64, 49152, 2147483647, 1024, 8, 32], "", 0, []], [[], [["FU", 1, [0, 1, 2, 3]], ["SP", 1, 0, 188160, [48], 1], ["AN", 1, 0, 5], ["AN", 1, 1, 6]]]], "r": [[5.57231e-06, 5.57515e-06, 5.57103e-06], 0, 5.23512, 1667937149], "v": "v0.6"}
{"i": [["[\"sigmoid\", 1, 28, 28, 240]", "cuda -keys=cuda,gpu -max_num_threads=1024 -model=unknown -thread_warp_size=32", [-1, 16, 64, 49152, 2147483647, 1024, 8, 32], "", 0, []], [[], [["FU", 1, [0, 1, 2, 3]], ["SP", 1, 0, 188160, [10], 1], ["AN", 1, 0, 5], ["AN", 1, 1, 6]]]], "r": [[1.6888e-05, 1.69018e-05, 1.6902e-05], 0, 6.15414, 1667937150], "v": "v0.6"}
{"i": [["[\"sigmoid\", 1, 28, 28, 240]", "cuda -keys=cuda,gpu -max_num_threads=1024 -model=unknown -thread_warp_size=32", [-1, 16, 64, 49152, 2147483647, 1024, 8, 32], "", 0, []], [[], [["FU", 1, [0, 1, 2, 3]], ["SP", 1, 0, 188160, [24], 1], ["AN", 1, 0, 5], ["AN", 1, 1, 6]]]], "r": [[8.6374e-06, 8.65187e-06, 8.64822e-06], 0, 6.46579, 1667937150], "v": "v0.6"}
{"i": [["[\"sigmoid\", 1, 28, 28, 240]", "cuda -keys=cuda,gpu -max_num_threads=1024 -model=unknown -thread_warp_size=32", [-1, 16, 64, 49152, 2147483647, 1024, 8, 32], "", 0, []], [[], [["FU", 1, [0, 1, 2, 3]], ["SP", 1, 0, 188160, [20], 1], ["AN", 1, 0, 5], ["AN", 1, 1, 6]]]], "r": [[9.80413e-06, 9.80589e-06, 9.81894e-06], 0, 7.0531, 1667937151], "v": "v0.6"}
{"i": [["[\"sigmoid\", 1, 28, 28, 240]", "cuda -keys=cuda,gpu -max_num_threads=1024 -model=unknown -thread_warp_size=32", [-1, 16, 64, 49152, 2147483647, 1024, 8, 32], "", 0, []], [[], [["FU", 1, [0, 1, 2, 3]], ["SP", 1, 0, 188160, [40], 1], ["AN", 1, 0, 5], ["AN", 1, 1, 6]]]], "r": [[6.23798e-06, 6.25192e-06, 6.25192e-06], 0, 6.6849, 1667937150], "v": "v0.6"}
{"i": [["[\"sigmoid\", 1, 28, 28, 240]", "cuda -keys=cuda,gpu -max_num_threads=1024 -model=unknown -thread_warp_size=32", [-1, 16, 64, 49152, 2147483647, 1024, 8, 32], "", 0, []], [[], [["FU", 1, [0, 1, 2, 3]], ["SP", 1, 0, 188160, [15], 1], ["AN", 1, 0, 5], ["AN", 1, 1, 6]]]], "r": [[1.22553e-05, 1.22631e-05, 1.22588e-05], 0, 3.99325, 1667937147], "v": "v0.6"}
{"i": [["[\"sigmoid\", 1, 28, 28, 240]", "cuda -keys=cuda,gpu -max_num_threads=1024 -model=unknown -thread_warp_size=32", [-1, 16, 64, 49152, 2147483647, 1024, 8, 32], "", 0, []], [[], [["FU", 1, [0, 1, 2, 3]], ["SP", 1, 0, 188160, [30], 1], ["AN", 1, 0, 5], ["AN", 1, 1, 6]]]], "r": [[7.56598e-06, 7.5677e-06, 7.5658e-06], 0, 7.31931, 1667937151], "v": "v0.6"}
{"i": [["[\"sigmoid\", 1, 28, 28, 240]", "cuda -keys=cuda,gpu -max_num_threads=1024 -model=unknown -thread_warp_size=32", [-1, 16, 64, 49152, 2147483647, 1024, 8, 32], "", 0, []], [[], [["FU", 1, [0, 1, 2, 3]], ["SP", 1, 0, 188160, [6], 1], ["AN", 1, 0, 5], ["AN", 1, 1, 6]]]], "r": [[2.6154e-05, 2.61679e-05, 2.61668e-05], 0, 7.46717, 1667937151], "v": "v0.6"}
{"i": [["[\"sigmoid\", 1, 28, 28, 240]", "cuda -keys=cuda,gpu -max_num_threads=1024 -model=unknown -thread_warp_size=32", [-1, 16, 64, 49152, 2147483647, 1024, 8, 32], "", 0, []], [[], [["FU", 1, [0, 1, 2, 3]], ["SP", 1, 0, 188160, [5], 1], ["AN", 1, 0, 5], ["AN", 1, 1, 6]]]], "r": [[3.08188e-05, 3.08429e-05, 3.08343e-05], 0, 7.78861, 1667937152], "v": "v0.6"}
{"i": [["[\"sigmoid\", 1, 28, 28, 240]", "cuda -keys=cuda,gpu -max_num_threads=1024 -model=unknown -thread_warp_size=32", [-1, 16, 64, 49152, 2147483647, 1024, 8, 32], "", 0, []], [[], [["FU", 1, [0, 1, 2, 3]], ["SP", 1, 0, 188160, [1], 1], ["AN", 1, 0, 5], ["AN", 1, 1, 6]]]], "r": [[0.000142385, 0.000142406, 0.000142394], 0, 8.05359, 1667937152], "v": "v0.6"}
{"i": [["[\"sigmoid\", 1, 28, 28, 240]", "cuda -keys=cuda,gpu -max_num_threads=1024 -model=unknown -thread_warp_size=32", [-1, 16, 64, 49152, 2147483647, 1024, 8, 32], "", 0, []], [[], [["FU", 1, [0, 1, 2, 3]], ["SP", 1, 0, 188160, [14], 1], ["AN", 1, 0, 5], ["AN", 1, 1, 6]]]], "r": [[1.30913e-05, 1.30939e-05, 1.31101e-05], 0, 1.35939, 1667937530], "v": "v0.6"}
{"i": [["[\"sigmoid\", 1, 28, 28, 240]", "cuda -keys=cuda,gpu -max_num_threads=1024 -model=unknown -thread_warp_size=32", [-1, 16, 64, 49152, 2147483647, 1024, 8, 32], "", 0, []], [[], [["FU", 1, [0, 1, 2, 3]], ["SP", 1, 0, 188160, [15], 1], ["AN", 1, 0, 5], ["AN", 1, 1, 6]]]], "r": [[1.21451e-05, 1.21592e-05, 1.21586e-05], 0, 0.581312, 1667937529], "v": "v0.6"}
{"i": [["[\"sigmoid\", 1, 28, 28, 240]", "cuda -keys=cuda,gpu -max_num_threads=1024 -model=unknown -thread_warp_size=32", [-1, 16, 64, 49152, 2147483647, 1024, 8, 32], "", 0, []], [[], [["FU", 1, [0, 1, 2, 3]], ["SP", 1, 0, 188160, [35], 1], ["AN", 1, 0, 5], ["AN", 1, 1, 6]]]], "r": [[6.70291e-06, 6.70626e-06, 6.70765e-06], 0, 1.05541, 1667937529], "v": "v0.6"}
{"i": [["[\"sigmoid\", 1, 28, 28, 240]", "cuda -keys=cuda,gpu -max_num_threads=1024 -model=unknown -thread_warp_size=32", [-1, 16, 64, 49152, 2147483647, 1024, 8, 32], "", 0, []], [[], [["FU", 1, [0, 1, 2, 3]], ["SP", 1, 0, 188160, [1], 1], ["AN", 1, 0, 5], ["AN", 1, 1, 6]]]], "r": [[0.000142455, 0.000142447, 0.000142476], 0, 2.072, 1667937530], "v": "v0.6"}
{"i": [["[\"sigmoid\", 1, 28, 28, 240]", "cuda -keys=cuda,gpu -max_num_threads=1024 -model=unknown -thread_warp_size=32", [-1, 16, 64, 49152, 2147483647, 1024, 8, 32], "", 0, []], [[], [["FU", 1, [0, 1, 2, 3]], ["SP", 1, 0, 188160, [24], 1], ["AN", 1, 0, 5], ["AN", 1, 1, 6]]]], "r": [[8.66174e-06, 8.67274e-06, 8.67196e-06], 0, 2.95954, 1667937531], "v": "v0.6"}
{"i": [["[\"sigmoid\", 1, 28, 28, 240]", "cuda -keys=cuda,gpu -max_num_threads=1024 -model=unknown -thread_warp_size=32", [-1, 16, 64, 49152, 2147483647, 1024, 8, 32], "", 0, []], [[], [["FU", 1, [0, 1, 2, 3]], ["SP", 1, 0, 188160, [20], 1], ["AN", 1, 0, 5], ["AN", 1, 1, 6]]]], "r": [[9.84257e-06, 9.85148e-06, 9.85314e-06], 0, 2.30522, 1667937531], "v": "v0.6"}
{"i": [["[\"sigmoid\", 1, 28, 28, 240]", "cuda -keys=cuda,gpu -max_num_threads=1024 -model=unknown -thread_warp_size=32", [-1, 16, 64, 49152, 2147483647, 1024, 8, 32], "", 0, []], [[], [["FU", 1, [0, 1, 2, 3]], ["SP", 1, 0, 188160, [8], 1], ["AN", 1, 0, 5], ["AN", 1, 1, 6]]]], "r": [[2.03291e-05, 2.03384e-05, 2.03343e-05], 0, 1.7292, 1667937530], "v": "v0.6"}
{"i": [["[\"sigmoid\", 1, 28, 28, 240]", "cuda -keys=cuda,gpu -max_num_threads=1024 -model=unknown -thread_warp_size=32", [-1, 16, 64, 49152, 2147483647, 1024, 8, 32], "", 0, []], [[], [["FU", 1, [0, 1, 2, 3]], ["SP", 1, 0, 188160, [42], 1], ["AN", 1, 0, 5], ["AN", 1, 1, 6]]]], "r": [[6.02018e-06, 6.02936e-06, 6.02837e-06], 0, 2.61146, 1667937531], "v": "v0.6"}
{"i": [["[\"sigmoid\", 1, 28, 28, 240]", "cuda -keys=cuda,gpu -max_num_threads=1024 -model=unknown -thread_warp_size=32", [-1, 16, 64, 49152, 2147483647, 1024, 8, 32], "", 0, []], [[], [["FU", 1, [0, 1, 2, 3]], ["SP", 1, 0, 188160, [30], 1], ["AN", 1, 0, 5], ["AN", 1, 1, 6]]]], "r": [[7.46467e-06, 7.47145e-06, 7.47036e-06], 0, 3.20623, 1667937532], "v": "v0.6"}
{"i": [["[\"sigmoid\", 1, 28, 28, 240]", "cuda -keys=cuda,gpu -max_num_threads=1024 -model=unknown -thread_warp_size=32", [-1, 16, 64, 49152, 2147483647, 1024, 8, 32], "", 0, []], [[], [["FU", 1, [0, 1, 2, 3]], ["SP", 1, 0, 188160, [6], 1], ["AN", 1, 0, 5], ["AN", 1, 1, 6]]]], "r": [[2.62735e-05, 2.62994e-05, 2.6286e-05], 0, 3.78912, 1667937532], "v": "v0.6"}
{"i": [["[\"sigmoid\", 1, 28, 28, 240]", "cuda -keys=cuda,gpu -max_num_threads=1024 -model=unknown -thread_warp_size=32", [-1, 16, 64, 49152, 2147483647, 1024, 8, 32], "", 0, []], [[], [["FU", 1, [0, 1, 2, 3]], ["SP", 1, 0, 188160, [28], 1], ["AN", 1, 0, 5], ["AN", 1, 1, 6]]]], "r": [[7.94707e-06, 7.95187e-06, 7.95599e-06], 0, 3.43454, 1667937532], "v": "v0.6"}
{"i": [["[\"sigmoid\", 1, 28, 28, 240]", "cuda -keys=cuda,gpu -max_num_threads=1024 -model=unknown -thread_warp_size=32", [-1, 16, 64, 49152, 2147483647, 1024, 8, 32], "", 0, []], [[], [["FU", 1, [0, 1, 2, 3]], ["SP", 1, 0, 188160, [7], 1], ["AN", 1, 0, 5], ["AN", 1, 1, 6]]]], "r": [[2.2967e-05, 2.2982e-05, 2.29753e-05], 0, 4.30923, 1667937533], "v": "v0.6"}
{"i": [["[\"sigmoid\", 1, 28, 28, 240]", "cuda -keys=cuda,gpu -max_num_threads=1024 -model=unknown -thread_warp_size=32", [-1, 16, 64, 49152, 2147483647, 1024, 8, 32], "", 0, []], [[], [["FU", 1, [0, 1, 2, 3]], ["SP", 1, 0, 188160, [49], 1], ["AN", 1, 0, 5], ["AN", 1, 1, 6]]]], "r": [[5.66762e-06, 5.67472e-06, 5.67395e-06], 0, 4.61519, 1667937533], "v": "v0.6"}
{"i": [["[\"sigmoid\", 1, 28, 28, 240]", "cuda -keys=cuda,gpu -max_num_threads=1024 -model=unknown -thread_warp_size=32", [-1, 16, 64, 49152, 2147483647, 1024, 8, 32], "", 0, []], [[], [["FU", 1, [0, 1, 2, 3]], ["SP", 1, 0, 188160, [64], 1], ["AN", 1, 0, 5], ["AN", 1, 1, 6]]]], "r": [[4.90749e-06, 4.91014e-06, 4.91044e-06], 0, 4.83729, 1667937534], "v": "v0.6"}
{"i": [["[\"sigmoid\", 1, 28, 28, 240]", "cuda -keys=cuda,gpu -max_num_threads=1024 -model=unknown -thread_warp_size=32", [-1, 16, 64, 49152, 2147483647, 1024, 8, 32], "", 0, []], [[], [["FU", 1, [0, 1, 2, 3]], ["SP", 1, 0, 188160, [60], 1], ["AN", 1, 0, 5], ["AN", 1, 1, 6]]]], "r": [[5.12272e-06, 5.13299e-06, 5.13266e-06], 0, 5.05889, 1667937534], "v": "v0.6"}
{"i": [["[\"sigmoid\", 1, 28, 28, 240]", "cuda -keys=cuda,gpu -max_num_threads=1024 -model=unknown -thread_warp_size=32", [-1, 16, 64, 49152, 2147483647, 1024, 8, 32], "", 0, []], [[], [["FU", 1, [0, 1, 2, 3]], ["SP", 1, 0, 188160, [16], 1], ["AN", 1, 0, 5], ["AN", 1, 1, 6]]]], "r": [[1.1602e-05, 1.16203e-05, 1.16218e-05], 0, 5.33123, 1667937534], "v": "v0.6"}
{"i": [["[\"sigmoid\", 1, 28, 28, 240]", "cuda -keys=cuda,gpu -max_num_threads=1024 -model=unknown -thread_warp_size=32", [-1, 16, 64, 49152, 2147483647, 1024, 8, 32], "", 0, []], [[], [["FU", 1, [0, 1, 2, 3]], ["SP", 1, 0, 188160, [3], 1], ["AN", 1, 0, 5], ["AN", 1, 1, 6]]]], "r": [[4.93363e-05, 4.93378e-05, 4.93406e-05], 0, 5.61487, 1667937535], "v": "v0.6"}
{"i": [["[\"sigmoid\", 1, 28, 28, 240]", "cuda -keys=cuda,gpu -max_num_threads=1024 -model=unknown -thread_warp_size=32", [-1, 16, 64, 49152, 2147483647, 1024, 8, 32], "", 0, []], [[], [["FU", 1, [0, 1, 2, 3]], ["SP", 1, 0, 188160, [56], 1], ["AN", 1, 0, 5], ["AN", 1, 1, 6]]]], "r": [[5.21695e-06, 5.2262e-06, 5.22163e-06], 0, 5.86798, 1667937535], "v": "v0.6"}
{"i": [["[\"sigmoid\", 1, 28, 28, 240]", "cuda -keys=cuda,gpu -max_num_threads=1024 -model=unknown -thread_warp_size=32", [-1, 16, 64, 49152, 2147483647, 1024, 8, 32], "", 0, []], [[], [["FU", 1, [0, 1, 2, 3]], ["SP", 1, 0, 188160, [2], 1], ["AN", 1, 0, 5], ["AN", 1, 1, 6]]]], "r": [[7.28037e-05, 7.28389e-05, 7.28282e-05], 0, 6.1868, 1667937535], "v": "v0.6"}
{"i": [["[\"sigmoid\", 1, 28, 28, 240]", "cuda -keys=cuda,gpu -max_num_threads=1024 -model=unknown -thread_warp_size=32", [-1, 16, 64, 49152, 2147483647, 1024, 8, 32], "", 0, []], [[], [["FU", 1, [0, 1, 2, 3]], ["SP", 1, 0, 188160, [48], 1], ["AN", 1, 0, 5], ["AN", 1, 1, 6]]]], "r": [[5.50148e-06, 5.50637e-06, 5.50616e-06], 0, 6.4382, 1667937536], "v": "v0.6"}
{"i": [["[\"sigmoid\", 1, 28, 28, 240]", "cuda -keys=cuda,gpu -max_num_threads=1024 -model=unknown -thread_warp_size=32", [-1, 16, 64, 49152, 2147483647, 1024, 8, 32], "", 0, []], [[], [["FU", 1, [0, 1, 2, 3]], ["SP", 1, 0, 188160, [40], 1], ["AN", 1, 0, 5], ["AN", 1, 1, 6]]]], "r": [[6.18024e-06, 6.19647e-06, 6.19445e-06], 0, 6.64895, 1667937536], "v": "v0.6"}
{"i": [["[\"sigmoid\", 1, 28, 28, 240]", "cuda -keys=cuda,gpu -max_num_threads=1024 -model=unknown -thread_warp_size=32", [-1, 16, 64, 49152, 2147483647, 1024, 8, 32], "", 0, []], [[], [["FU", 1, [0, 1, 2, 3]], ["SP", 1, 0, 188160, [10], 1], ["AN", 1, 0, 5], ["AN", 1, 1, 6]]]], "r": [[1.70655e-05, 1.70904e-05, 1.7082e-05], 0, 3.91063, 1667937533], "v": "v0.6"}
{"i": [["[\"sigmoid\", 1, 28, 28, 240]", "cuda -keys=cuda,gpu -max_num_threads=1024 -model=unknown -thread_warp_size=32", [-1, 16, 64, 49152, 2147483647, 1024, 8, 32], "", 0, []], [[], [["FU", 1, [0, 1, 2, 3]], ["SP", 1, 0, 188160, [4], 1], ["AN", 1, 0, 5], ["AN", 1, 1, 6]]]], "r": [[3.77532e-05, 3.77706e-05, 3.77547e-05], 0, 7.31815, 1667937537], "v": "v0.6"}
{"i": [["[\"sigmoid\", 1, 28, 28, 240]", "cuda -keys=cuda,gpu -max_num_threads=1024 -model=unknown -thread_warp_size=32", [-1, 16, 64, 49152, 2147483647, 1024, 8, 32], "", 0, []], [[], [["FU", 1, [0, 1, 2, 3]], ["SP", 1, 0, 188160, [32], 1], ["AN", 1, 0, 5], ["AN", 1, 1, 6]]]], "r": [[7.12828e-06, 7.14208e-06, 7.14148e-06], 0, 7.537, 1667937537], "v": "v0.6"}
{"i": [["[\"sigmoid\", 1, 28, 28, 240]", "cuda -keys=cuda,gpu -max_num_threads=1024 -model=unknown -thread_warp_size=32", [-1, 16, 64, 49152, 2147483647, 1024, 8, 32], "", 0, []], [[], [["FU", 1, [0, 1, 2, 3]], ["SP", 1, 0, 188160, [12], 1], ["AN", 1, 0, 5], ["AN", 1, 1, 6]]]], "r": [[1.45304e-05, 1.45552e-05, 1.45532e-05], 0, 6.99566, 1667937536], "v": "v0.6"}
{"i": [["[\"sigmoid\", 1, 28, 28, 240]", "cuda -keys=cuda,gpu -max_num_threads=1024 -model=unknown -thread_warp_size=32", [-1, 16, 64, 49152, 2147483647, 1024, 8, 32], "", 0, []], [[], [["FU", 1, [0, 1, 2, 3]], ["SP", 1, 0, 188160, [21], 1], ["AN", 1, 0, 5], ["AN", 1, 1, 6]]]], "r": [[9.41431e-06, 9.4227e-06, 9.41966e-06], 0, 7.76847, 1667937537], "v": "v0.6"}
{"i": [["[\"sigmoid\", 1, 28, 28, 240]", "cuda -keys=cuda,gpu -max_num_threads=1024 -model=unknown -thread_warp_size=32", [-1, 16, 64, 49152, 2147483647, 1024, 8, 32], "", 0, []], [[], [["FU", 1, [0, 1, 2, 3]], ["SP", 1, 0, 188160, [5], 1], ["AN", 1, 0, 5], ["AN", 1, 1, 6]]]], "r": [[3.09139e-05, 3.09223e-05, 3.09278e-05], 0, 8.07918, 1667937538], "v": "v0.6"}
{"i": [["[\"sigmoid\", 1, 28, 28, 240]", "cuda -keys=cuda,gpu -max_num_threads=1024 -model=unknown -thread_warp_size=32", [-1, 16, 64, 49152, 2147483647, 1024, 8, 32], "", 0, []], [[], [["FU", 1, [0, 1, 2, 3]], ["SP", 1, 0, 188160, [48], 1], ["AN", 1, 0, 5], ["AN", 1, 1, 6]]]], "r": [[5.71151e-06, 5.72944e-06, 5.7301e-06], 0, 0.986393, 1667938760], "v": "v0.6"}
{"i": [["[\"sigmoid\", 1, 28, 28, 240]", "cuda -keys=cuda,gpu -max_num_threads=1024 -model=unknown -thread_warp_size=32", [-1, 16, 64, 49152, 2147483647, 1024, 8, 32], "", 0, []], [[], [["FU", 1, [0, 1, 2, 3]], ["SP", 1, 0, 188160, [21], 1], ["AN", 1, 0, 5], ["AN", 1, 1, 6]]]], "r": [[9.46437e-06, 9.47402e-06, 9.47704e-06], 0, 2.22527, 1667938762], "v": "v0.6"}
{"i": [["[\"sigmoid\", 1, 28, 28, 240]", "cuda -keys=cuda,gpu -max_num_threads=1024 -model=unknown -thread_warp_size=32", [-1, 16, 64, 49152, 2147483647, 1024, 8, 32], "", 0, []], [[], [["FU", 1, [0, 1, 2, 3]], ["SP", 1, 0, 188160, [6], 1], ["AN", 1, 0, 5], ["AN", 1, 1, 6]]]], "r": [[2.6145e-05, 2.61395e-05, 2.61394e-05], 0, 1.2993, 1667938761], "v": "v0.6"}
{"i": [["[\"sigmoid\", 1, 28, 28, 240]", "cuda -keys=cuda,gpu -max_num_threads=1024 -model=unknown -thread_warp_size=32", [-1, 16, 64, 49152, 2147483647, 1024, 8, 32], "", 0, []], [[], [["FU", 1, [0, 1, 2, 3]], ["SP", 1, 0, 188160, [32], 1], ["AN", 1, 0, 5], ["AN", 1, 1, 6]]]], "r": [[7.08004e-06, 7.0903e-06, 7.09322e-06], 0, 2.77562, 1667938762], "v": "v0.6"}
{"i": [["[\"sigmoid\", 1, 28, 28, 240]", "cuda -keys=cuda,gpu -max_num_threads=1024 -model=unknown -thread_warp_size=32", [-1, 16, 64, 49152, 2147483647, 1024, 8, 32], "", 0, []], [[], [["FU", 1, [0, 1, 2, 3]], ["SP", 1, 0, 188160, [40], 1], ["AN", 1, 0, 5], ["AN", 1, 1, 6]]]], "r": [[6.1248e-06, 6.13521e-06, 6.12978e-06], 0, 0.700984, 1667938760], "v": "v0.6"}
{"i": [["[\"sigmoid\", 1, 28, 28, 240]", "cuda -keys=cuda,gpu -max_num_threads=1024 -model=unknown -thread_warp_size=32", [-1, 16, 64, 49152, 2147483647, 1024, 8, 32], "", 0, []], [[], [["FU", 1, [0, 1, 2, 3]], ["SP", 1, 0, 188160, [28], 1], ["AN", 1, 0, 5], ["AN", 1, 1, 6]]]], "r": [[7.85719e-06, 7.86347e-06, 7.86678e-06], 0, 1.9665, 1667938761], "v": "v0.6"}
{"i": [["[\"sigmoid\", 1, 28, 28, 240]", "cuda -keys=cuda,gpu -max_num_threads=1024 -model=unknown -thread_warp_size=32", [-1, 16, 64, 49152, 2147483647, 1024, 8, 32], "", 0, []], [[], [["FU", 1, [0, 1, 2, 3]], ["SP", 1, 0, 188160, [4], 1], ["AN", 1, 0, 5], ["AN", 1, 1, 6]]]], "r": [[3.77197e-05, 3.77257e-05, 3.77263e-05], 0, 1.58572, 1667938761], "v": "v0.6"}
{"i": [["[\"sigmoid\", 1, 28, 28, 240]", "cuda -keys=cuda,gpu -max_num_threads=1024 -model=unknown -thread_warp_size=32", [-1, 16, 64, 49152, 2147483647, 1024, 8, 32], "", 0, []], [[], [["FU", 1, [0, 1, 2, 3]], ["SP", 1, 0, 188160, [60], 1], ["AN", 1, 0, 5], ["AN", 1, 1, 6]]]], "r": [[5.18277e-06, 5.20049e-06, 5.19642e-06], 0, 2.48529, 1667938762], "v": "v0.6"}
{"i": [["[\"sigmoid\", 1, 28, 28, 240]", "cuda -keys=cuda,gpu -max_num_threads=1024 -model=unknown -thread_warp_size=32", [-1, 16, 64, 49152, 2147483647, 1024, 8, 32], "", 0, []], [[], [["FU", 1, [0, 1, 2, 3]], ["SP", 1, 0, 188160, [1], 1], ["AN", 1, 0, 5], ["AN", 1, 1, 6]]]], "r": [[0.000142434, 0.00014247, 0.000142447], 0, 3.09507, 1667938763], "v": "v0.6"}
{"i": [["[\"sigmoid\", 1, 28, 28, 240]", "cuda -keys=cuda,gpu -max_num_threads=1024 -model=unknown -thread_warp_size=32", [-1, 16, 64, 49152, 2147483647, 1024, 8, 32], "", 0, []], [[], [["FU", 1, [0, 1, 2, 3]], ["SP", 1, 0, 188160, [8], 1], ["AN", 1, 0, 5], ["AN", 1, 1, 6]]]], "r": [[2.05637e-05, 2.0568e-05, 2.05579e-05], 0, 3.68237, 1667938763], "v": "v0.6"}
{"i": [["[\"sigmoid\", 1, 28, 28, 240]", "cuda -keys=cuda,gpu -max_num_threads=1024 -model=unknown -thread_warp_size=32", [-1, 16, 64, 49152, 2147483647, 1024, 8, 32], "", 0, []], [[], [["FU", 1, [0, 1, 2, 3]], ["SP", 1, 0, 188160, [2], 1], ["AN", 1, 0, 5], ["AN", 1, 1, 6]]]], "r": [[7.27477e-05, 7.27572e-05, 7.27616e-05], 0, 3.97249, 1667938764], "v": "v0.6"}
{"i": [["[\"sigmoid\", 1, 28, 28, 240]", "cuda -keys=cuda,gpu -max_num_threads=1024 -model=unknown -thread_warp_size=32", [-1, 16, 64, 49152, 2147483647, 1024, 8, 32], "", 0, []], [[], [["FU", 1, [0, 1, 2, 3]], ["SP", 1, 0, 188160, [10], 1], ["AN", 1, 0, 5], ["AN", 1, 1, 6]]]], "r": [[1.69186e-05, 1.69341e-05, 1.69304e-05], 0, 4.23445, 1667938764], "v": "v0.6"}
{"i": [["[\"sigmoid\", 1, 28, 28, 240]", "cuda -keys=cuda,gpu -max_num_threads=1024 -model=unknown -thread_warp_size=32", [-1, 16, 64, 49152, 2147483647, 1024, 8, 32], "", 0, []], [[], [["FU", 1, [0, 1, 2, 3]], ["SP", 1, 0, 188160, [42], 1], ["AN", 1, 0, 5], ["AN", 1, 1, 6]]]], "r": [[6.01704e-06, 6.03187e-06, 6.02668e-06], 0, 4.51523, 1667938764], "v": "v0.6"}
{"i": [["[\"sigmoid\", 1, 28, 28, 240]", "cuda -keys=cuda,gpu -max_num_threads=1024 -model=unknown -thread_warp_size=32", [-1, 16, 64, 49152, 2147483647, 1024, 8, 32], "", 0, []], [[], [["FU", 1, [0, 1, 2, 3]], ["SP", 1, 0, 188160, [5], 1], ["AN", 1, 0, 5], ["AN", 1, 1, 6]]]], "r": [[3.07437e-05, 3.07497e-05, 3.07475e-05], 0, 4.75274, 1667938765], "v": "v0.6"}
{"i": [["[\"sigmoid\", 1, 28, 28, 240]", "cuda -keys=cuda,gpu -max_num_threads=1024 -model=unknown -thread_warp_size=32", [-1, 16, 64, 49152, 2147483647, 1024, 8, 32], "", 0, []], [[], [["FU", 1, [0, 1, 2, 3]], ["SP", 1, 0, 188160, [14], 1], ["AN", 1, 0, 5], ["AN", 1, 1, 6]]]], "r": [[1.2943e-05, 1.29535e-05, 1.29517e-05], 0, 4.94609, 1667938765], "v": "v0.6"}
{"i": [["[\"sigmoid\", 1, 28, 28, 240]", "cuda -keys=cuda,gpu -max_num_threads=1024 -model=unknown -thread_warp_size=32", [-1, 16, 64, 49152, 2147483647, 1024, 8, 32], "", 0, []], [[], [["FU", 1, [0, 1, 2, 3]], ["SP", 1, 0, 188160, [12], 1], ["AN", 1, 0, 5], ["AN", 1, 1, 6]]]], "r": [[1.4494e-05, 1.45043e-05, 1.45035e-05], 0, 5.25247, 1667938765], "v": "v0.6"}
{"i": [["[\"sigmoid\", 1, 28, 28, 240]", "cuda -keys=cuda,gpu -max_num_threads=1024 -model=unknown -thread_warp_size=32", [-1, 16, 64, 49152, 2147483647, 1024, 8, 32], "", 0, []], [[], [["FU", 1, [0, 1, 2, 3]], ["SP", 1, 0, 188160, [49], 1], ["AN", 1, 0, 5], ["AN", 1, 1, 6]]]], "r": [[5.6914e-06, 5.69914e-06, 5.69447e-06], 0, 5.50576, 1667938766], "v": "v0.6"}
{"i": [["[\"sigmoid\", 1, 28, 28, 240]", "cuda -keys=cuda,gpu -max_num_threads=1024 -model=unknown -thread_warp_size=32", [-1, 16, 64, 49152, 2147483647, 1024, 8, 32], "", 0, []], [[], [["FU", 1, [0, 1, 2, 3]], ["SP", 1, 0, 188160, [35], 1], ["AN", 1, 0, 5], ["AN", 1, 1, 6]]]], "r": [[6.65236e-06, 6.66496e-06, 6.66462e-06], 0, 5.74731, 1667938766], "v": "v0.6"}
{"i": [["[\"sigmoid\", 1, 28, 28, 240]", "cuda -keys=cuda,gpu -max_num_threads=1024 -model=unknown -thread_warp_size=32", [-1, 16, 64, 49152, 2147483647, 1024, 8, 32], "", 0, []], [[], [["FU", 1, [0, 1, 2, 3]], ["SP", 1, 0, 188160, [30], 1], ["AN", 1, 0, 5], ["AN", 1, 1, 6]]]], "r": [[7.51794e-06, 7.5255e-06, 7.52955e-06], 0, 6.07023, 1667938766], "v": "v0.6"}
{"i": [["[\"sigmoid\", 1, 28, 28, 240]", "cuda -keys=cuda,gpu -max_num_threads=1024 -model=unknown -thread_warp_size=32", [-1, 16, 64, 49152, 2147483647, 1024, 8, 32], "", 0, []], [[], [["FU", 1, [0, 1, 2, 3]], ["SP", 1, 0, 188160, [15], 1], ["AN", 1, 0, 5], ["AN", 1, 1, 6]]]], "r": [[1.21538e-05, 1.21679e-05, 1.21676e-05], 0, 3.27609, 1667938763], "v": "v0.6"}
{"i": [["[\"sigmoid\", 1, 28, 28, 240]", "cuda -keys=cuda,gpu -max_num_threads=1024 -model=unknown -thread_warp_size=32", [-1, 16, 64, 49152, 2147483647, 1024, 8, 32], "", 0, []], [[], [["FU", 1, [0, 1, 2, 3]], ["SP", 1, 0, 188160, [3], 1], ["AN", 1, 0, 5], ["AN", 1, 1, 6]]]], "r": [[4.93219e-05, 4.93086e-05, 4.93191e-05], 0, 6.28758, 1667938767], "v": "v0.6"}
{"i": [["[\"sigmoid\", 1, 28, 28, 240]", "cuda -keys=cuda,gpu -max_num_threads=1024 -model=unknown -thread_warp_size=32", [-1, 16, 64, 49152, 2147483647, 1024, 8, 32], "", 0, []], [[], [["FU", 1, [0, 1, 2, 3]], ["SP", 1, 0, 188160, [24], 1], ["AN", 1, 0, 5], ["AN", 1, 1, 6]]]], "r": [[8.7411e-06, 8.75546e-06, 8.7518e-06], 0, 6.60904, 1667938767], "v": "v0.6"}
{"i": [["[\"sigmoid\", 1, 28, 28, 240]", "cuda -keys=cuda,gpu -max_num_threads=1024 -model=unknown -thread_warp_size=32", [-1, 16, 64, 49152, 2147483647, 1024, 8, 32], "", 0, []], [[], [["FU", 1, [0, 1, 2, 3]], ["SP", 1, 0, 188160, [16], 1], ["AN", 1, 0, 5], ["AN", 1, 1, 6]]]], "r": [[1.16124e-05, 1.16266e-05, 1.16263e-05], 0, 6.89566, 1667938767], "v": "v0.6"}
{"i": [["[\"sigmoid\", 1, 28, 28, 240]", "cuda -keys=cuda,gpu -max_num_threads=1024 -model=unknown -thread_warp_size=32", [-1, 16, 64, 49152, 2147483647, 1024, 8, 32], "", 0, []], [[], [["FU", 1, [0, 1, 2, 3]], ["SP", 1, 0, 188160, [64], 1], ["AN", 1, 0, 5], ["AN", 1, 1, 6]]]], "r": [[4.87785e-06, 4.88522e-06, 4.87562e-06], 0, 7.1013, 1667938768], "v": "v0.6"}
{"i": [["[\"sigmoid\", 1, 28, 28, 240]", "cuda -keys=cuda,gpu -max_num_threads=1024 -model=unknown -thread_warp_size=32", [-1, 16, 64, 49152, 2147483647, 1024, 8, 32], "", 0, []], [[], [["FU", 1, [0, 1, 2, 3]], ["SP", 1, 0, 188160, [56], 1], ["AN", 1, 0, 5], ["AN", 1, 1, 6]]]], "r": [[5.33883e-06, 5.35317e-06, 5.34906e-06], 0, 7.41193, 1667938768], "v": "v0.6"}
{"i": [["[\"sigmoid\", 1, 28, 28, 240]", "cuda -keys=cuda,gpu -max_num_threads=1024 -model=unknown -thread_warp_size=32", [-1, 16, 64, 49152, 2147483647, 1024, 8, 32], "", 0, []], [[], [["FU", 1, [0, 1, 2, 3]], ["SP", 1, 0, 188160, [7], 1], ["AN", 1, 0, 5], ["AN", 1, 1, 6]]]], "r": [[2.30543e-05, 2.30678e-05, 2.308e-05], 0, 7.6747, 1667938768], "v": "v0.6"}
{"i": [["[\"sigmoid\", 1, 28, 28, 240]", "cuda -keys=cuda,gpu -max_num_threads=1024 -model=unknown -thread_warp_size=32", [-1, 16, 64, 49152, 2147483647, 1024, 8, 32], "", 0, []], [[], [["FU", 1, [0, 1, 2, 3]], ["SP", 1, 0, 188160, [20], 1], ["AN", 1, 0, 5], ["AN", 1, 1, 6]]]], "r": [[9.88415e-06, 9.90246e-06, 9.89924e-06], 0, 8.01191, 1667938769], "v": "v0.6"}
