python/models/efficientnet/VertiFusionEfficientNet_kernel_configs/efficient_sigmoid_1_112_112_32.log
{"i": [["[\"sigmoid\", 1, 112, 112, 32]", "cuda -keys=cuda,gpu -max_num_threads=1024 -model=unknown -thread_warp_size=32", [-1, 16, 64, 49152, 2147483647, 1024, 8, 32], "", 0, []], [[], [["FU", 1, [0, 1, 2, 3]], ["SP", 1, 0, 401408, [49], 1], ["AN", 1, 0, 5], ["AN", 1, 1, 6]]]], "r": [[8.87177e-06, 8.89571e-06, 8.89629e-06], 0, 2.32715, 1667924570], "v": "v0.6"}
{"i": [["[\"sigmoid\", 1, 112, 112, 32]", "cuda -keys=cuda,gpu -max_num_threads=1024 -model=unknown -thread_warp_size=32", [-1, 16, 64, 49152, 2147483647, 1024, 8, 32], "", 0, []], [[], [["FU", 1, [0, 1, 2, 3]], ["SP", 1, 0, 401408, [8], 1], ["AN", 1, 0, 5], ["AN", 1, 1, 6]]]], "r": [[4.03112e-05, 4.03226e-05, 4.03122e-05], 0, 1.5868, 1667924569], "v": "v0.6"}
{"i": [["[\"sigmoid\", 1, 112, 112, 32]", "cuda -keys=cuda,gpu -max_num_threads=1024 -model=unknown -thread_warp_size=32", [-1, 16, 64, 49152, 2147483647, 1024, 8, 32], "", 0, []], [[], [["FU", 1, [0, 1, 2, 3]], ["SP", 1, 0, 401408, [28], 1], ["AN", 1, 0, 5], ["AN", 1, 1, 6]]]], "r": [[1.35612e-05, 1.35688e-05, 1.3564e-05], 0, 1.28928, 1667924568], "v": "v0.6"}
{"i": [["[\"sigmoid\", 1, 112, 112, 32]", "cuda -keys=cuda,gpu -max_num_threads=1024 -model=unknown -thread_warp_size=32", [-1, 16, 64, 49152, 2147483647, 1024, 8, 32], "", 0, []], [[], [["FU", 1, [0, 1, 2, 3]], ["SP", 1, 0, 401408, [4], 1], ["AN", 1, 0, 5], ["AN", 1, 1, 6]]]], "r": [[7.7382e-05, 7.74021e-05, 7.73914e-05], 0, 0.864796, 1667924568], "v": "v0.6"}
{"i": [["[\"sigmoid\", 1, 112, 112, 32]", "cuda -keys=cuda,gpu -max_num_threads=1024 -model=unknown -thread_warp_size=32", [-1, 16, 64, 49152, 2147483647, 1024, 8, 32], "", 0, []], [[], [["FU", 1, [0, 1, 2, 3]], ["SP", 1, 0, 401408, [14], 1], ["AN", 1, 0, 5], ["AN", 1, 1, 6]]]], "r": [[2.41833e-05, 2.41892e-05, 2.41925e-05], 0, 0.583887, 1667924568], "v": "v0.6"}
{"i": [["[\"sigmoid\", 1, 112, 112, 32]", "cuda -keys=cuda,gpu -max_num_threads=1024 -model=unknown -thread_warp_size=32", [-1, 16, 64, 49152, 2147483647, 1024, 8, 32], "", 0, []], [[], [["FU", 1, [0, 1, 2, 3]], ["SP", 1, 0, 401408, [56], 1], ["AN", 1, 0, 5], ["AN", 1, 1, 6]]]], "r": [[8.06327e-06, 8.08554e-06, 8.08569e-06], 0, 1.90785, 1667924569], "v": "v0.6"}
{"i": [["[\"sigmoid\", 1, 112, 112, 32]", "cuda -keys=cuda,gpu -max_num_threads=1024 -model=unknown -thread_warp_size=32", [-1, 16, 64, 49152, 2147483647, 1024, 8, 32], "", 0, []], [[], [["FU", 1, [0, 1, 2, 3]], ["SP", 1, 0, 401408, [16], 1], ["AN", 1, 0, 5], ["AN", 1, 1, 6]]]], "r": [[2.16035e-05, 2.162e-05, 2.16072e-05], 0, 2.61487, 1667924570], "v": "v0.6"}
{"i": [["[\"sigmoid\", 1, 112, 112, 32]", "cuda -keys=cuda,gpu -max_num_threads=1024 -model=unknown -thread_warp_size=32", [-1, 16, 64, 49152, 2147483647, 1024, 8, 32], "", 0, []], [[], [["FU", 1, [0, 1, 2, 3]], ["SP", 1, 0, 401408, [32], 1], ["AN", 1, 0, 5], ["AN", 1, 1, 6]]]], "r": [[1.22301e-05, 1.22373e-05, 1.22375e-05], 0, 2.90234, 1667924570], "v": "v0.6"}
{"i": [["[\"sigmoid\", 1, 112, 112, 32]", "cuda -keys=cuda,gpu -max_num_threads=1024 -model=unknown -thread_warp_size=32", [-1, 16, 64, 49152, 2147483647, 1024, 8, 32], "", 0, []], [[], [["FU", 1, [0, 1, 2, 3]], ["SP", 1, 0, 401408, [1], 1], ["AN", 1, 0, 5], ["AN", 1, 1, 6]]]], "r": [[0.000300626, 0.000300578, 0.000300617], 0, 3.55941, 1667924571], "v": "v0.6"}
{"i": [["[\"sigmoid\", 1, 112, 112, 32]", "cuda -keys=cuda,gpu -max_num_threads=1024 -model=unknown -thread_warp_size=32", [-1, 16, 64, 49152, 2147483647, 1024, 8, 32], "", 0, []], [[], [["FU", 1, [0, 1, 2, 3]], ["SP", 1, 0, 401408, [7], 1], ["AN", 1, 0, 5], ["AN", 1, 1, 6]]]], "r": [[4.53655e-05, 4.53674e-05, 4.5363e-05], 0, 3.21266, 1667924571], "v": "v0.6"}
{"i": [["[\"sigmoid\", 1, 112, 112, 32]", "cuda -keys=cuda,gpu -max_num_threads=1024 -model=unknown -thread_warp_size=32", [-1, 16, 64, 49152, 2147483647, 1024, 8, 32], "", 0, []], [[], [["FU", 1, [0, 1, 2, 3]], ["SP", 1, 0, 401408, [2], 1], ["AN", 1, 0, 5], ["AN", 1, 1, 6]]]], "r": [[0.00015192, 0.000151893, 0.000151894], 0, 3.84476, 1667924571], "v": "v0.6"}
{"i": [["[\"sigmoid\", 1, 112, 112, 32]", "cuda -keys=cuda,gpu -max_num_threads=1024 -model=unknown -thread_warp_size=32", [-1, 16, 64, 49152, 2147483647, 1024, 8, 32], "", 0, []], [[], [["FU", 1, [0, 1, 2, 3]], ["SP", 1, 0, 401408, [64], 1], ["AN", 1, 0, 5], ["AN", 1, 1, 6]]]], "r": [[7.26111e-06, 7.27562e-06, 7.27214e-06], 0, 4.1596, 1667924572], "v": "v0.6"}
{"i": [["[\"sigmoid\", 1, 112, 112, 32]", "cuda -keys=cuda,gpu -max_num_threads=1024 -model=unknown -thread_warp_size=32", [-1, 16, 64, 49152, 2147483647, 1024, 8, 32], "", 0, []], [[], [["FU", 1, [0, 1, 2, 3]], ["SP", 1, 0, 401408, [2], 1], ["AN", 1, 0, 5], ["AN", 1, 1, 6]]]], "r": [[0.000151797, 0.000151803, 0.000151837], 0, 0.850354, 1667924834], "v": "v0.6"}
{"i": [["[\"sigmoid\", 1, 112, 112, 32]", "cuda -keys=cuda,gpu -max_num_threads=1024 -model=unknown -thread_warp_size=32", [-1, 16, 64, 49152, 2147483647, 1024, 8, 32], "", 0, []], [[], [["FU", 1, [0, 1, 2, 3]], ["SP", 1, 0, 401408, [4], 1], ["AN", 1, 0, 5], ["AN", 1, 1, 6]]]], "r": [[7.73247e-05, 7.73537e-05, 7.73466e-05], 0, 2.12783, 1667924835], "v": "v0.6"}
{"i": [["[\"sigmoid\", 1, 112, 112, 32]", "cuda -keys=cuda,gpu -max_num_threads=1024 -model=unknown -thread_warp_size=32", [-1, 16, 64, 49152, 2147483647, 1024, 8, 32], "", 0, []], [[], [["FU", 1, [0, 1, 2, 3]], ["SP", 1, 0, 401408, [1], 1], ["AN", 1, 0, 5], ["AN", 1, 1, 6]]]], "r": [[0.000300661, 0.000300635, 0.000300679], 0, 2.43041, 1667924835], "v": "v0.6"}
{"i": [["[\"sigmoid\", 1, 112, 112, 32]", "cuda -keys=cuda,gpu -max_num_threads=1024 -model=unknown -thread_warp_size=32", [-1, 16, 64, 49152, 2147483647, 1024, 8, 32], "", 0, []], [[], [["FU", 1, [0, 1, 2, 3]], ["SP", 1, 0, 401408, [64], 1], ["AN", 1, 0, 5], ["AN", 1, 1, 6]]]], "r": [[7.33691e-06, 7.33374e-06, 7.33941e-06], 0, 0.516741, 1667924833], "v": "v0.6"}
{"i": [["[\"sigmoid\", 1, 112, 112, 32]", "cuda -keys=cuda,gpu -max_num_threads=1024 -model=unknown -thread_warp_size=32", [-1, 16, 64, 49152, 2147483647, 1024, 8, 32], "", 0, []], [[], [["FU", 1, [0, 1, 2, 3]], ["SP", 1, 0, 401408, [56], 1], ["AN", 1, 0, 5], ["AN", 1, 1, 6]]]], "r": [[8.07228e-06, 8.07605e-06, 8.06793e-06], 0, 1.14396, 1667924834], "v": "v0.6"}
{"i": [["[\"sigmoid\", 1, 112, 112, 32]", "cuda -keys=cuda,gpu -max_num_threads=1024 -model=unknown -thread_warp_size=32", [-1, 16, 64, 49152, 2147483647, 1024, 8, 32], "", 0, []], [[], [["FU", 1, [0, 1, 2, 3]], ["SP", 1, 0, 401408, [32], 1], ["AN", 1, 0, 5], ["AN", 1, 1, 6]]]], "r": [[1.2276e-05, 1.2275e-05, 1.22629e-05], 0, 1.47179, 1667924834], "v": "v0.6"}
{"i": [["[\"sigmoid\", 1, 112, 112, 32]", "cuda -keys=cuda,gpu -max_num_threads=1024 -model=unknown -thread_warp_size=32", [-1, 16, 64, 49152, 2147483647, 1024, 8, 32], "", 0, []], [[], [["FU", 1, [0, 1, 2, 3]], ["SP", 1, 0, 401408, [14], 1], ["AN", 1, 0, 5], ["AN", 1, 1, 6]]]], "r": [[2.42234e-05, 2.42218e-05, 2.42286e-05], 0, 2.72948, 1667924836], "v": "v0.6"}
{"i": [["[\"sigmoid\", 1, 112, 112, 32]", "cuda -keys=cuda,gpu -max_num_threads=1024 -model=unknown -thread_warp_size=32", [-1, 16, 64, 49152, 2147483647, 1024, 8, 32], "", 0, []], [[], [["FU", 1, [0, 1, 2, 3]], ["SP", 1, 0, 401408, [7], 1], ["AN", 1, 0, 5], ["AN", 1, 1, 6]]]], "r": [[4.54533e-05, 4.54685e-05, 4.54636e-05], 0, 1.79354, 1667924835], "v": "v0.6"}
{"i": [["[\"sigmoid\", 1, 112, 112, 32]", "cuda -keys=cuda,gpu -max_num_threads=1024 -model=unknown -thread_warp_size=32", [-1, 16, 64, 49152, 2147483647, 1024, 8, 32], "", 0, []], [[], [["FU", 1, [0, 1, 2, 3]], ["SP", 1, 0, 401408, [8], 1], ["AN", 1, 0, 5], ["AN", 1, 1, 6]]]], "r": [[4.02604e-05, 4.02435e-05, 4.02369e-05], 0, 3.01501, 1667924836], "v": "v0.6"}
{"i": [["[\"sigmoid\", 1, 112, 112, 32]", "cuda -keys=cuda,gpu -max_num_threads=1024 -model=unknown -thread_warp_size=32", [-1, 16, 64, 49152, 2147483647, 1024, 8, 32], "", 0, []], [[], [["FU", 1, [0, 1, 2, 3]], ["SP", 1, 0, 401408, [49], 1], ["AN", 1, 0, 5], ["AN", 1, 1, 6]]]], "r": [[8.88653e-06, 8.9055e-06, 8.9061e-06], 0, 3.26139, 1667924836], "v": "v0.6"}
{"i": [["[\"sigmoid\", 1, 112, 112, 32]", "cuda -keys=cuda,gpu -max_num_threads=1024 -model=unknown -thread_warp_size=32", [-1, 16, 64, 49152, 2147483647, 1024, 8, 32], "", 0, []], [[], [["FU", 1, [0, 1, 2, 3]], ["SP", 1, 0, 401408, [28], 1], ["AN", 1, 0, 5], ["AN", 1, 1, 6]]]], "r": [[1.35097e-05, 1.35232e-05, 1.35195e-05], 0, 3.80372, 1667924837], "v": "v0.6"}
{"i": [["[\"sigmoid\", 1, 112, 112, 32]", "cuda -keys=cuda,gpu -max_num_threads=1024 -model=unknown -thread_warp_size=32", [-1, 16, 64, 49152, 2147483647, 1024, 8, 32], "", 0, []], [[], [["FU", 1, [0, 1, 2, 3]], ["SP", 1, 0, 401408, [16], 1], ["AN", 1, 0, 5], ["AN", 1, 1, 6]]]], "r": [[2.16033e-05, 2.16053e-05, 2.15983e-05], 0, 3.58513, 1667924837], "v": "v0.6"}
{"i": [["[\"sigmoid\", 1, 112, 112, 32]", "cuda -keys=cuda,gpu -max_num_threads=1024 -model=unknown -thread_warp_size=32", [-1, 16, 64, 49152, 2147483647, 1024, 8, 32], "", 0, []], [[], [["FU", 1, [0, 1, 2, 3]], ["SP", 1, 0, 401408, [8], 1], ["AN", 1, 0, 5], ["AN", 1, 1, 6]]]], "r": [[4.00696e-05, 4.00795e-05, 4.00744e-05], 0, 1.5241, 1667931259], "v": "v0.6"}
{"i": [["[\"sigmoid\", 1, 112, 112, 32]", "cuda -keys=cuda,gpu -max_num_threads=1024 -model=unknown -thread_warp_size=32", [-1, 16, 64, 49152, 2147483647, 1024, 8, 32], "", 0, []], [[], [["FU", 1, [0, 1, 2, 3]], ["SP", 1, 0, 401408, [1], 1], ["AN", 1, 0, 5], ["AN", 1, 1, 6]]]], "r": [[0.000300547, 0.0003006, 0.00030059], 0, 2.00868, 1667931259], "v": "v0.6"}
{"i": [["[\"sigmoid\", 1, 112, 112, 32]", "cuda -keys=cuda,gpu -max_num_threads=1024 -model=unknown -thread_warp_size=32", [-1, 16, 64, 49152, 2147483647, 1024, 8, 32], "", 0, []], [[], [["FU", 1, [0, 1, 2, 3]], ["SP", 1, 0, 401408, [16], 1], ["AN", 1, 0, 5], ["AN", 1, 1, 6]]]], "r": [[2.16285e-05, 2.166e-05, 2.16502e-05], 0, 0.534692, 1667931258], "v": "v0.6"}
{"i": [["[\"sigmoid\", 1, 112, 112, 32]", "cuda -keys=cuda,gpu -max_num_threads=1024 -model=unknown -thread_warp_size=32", [-1, 16, 64, 49152, 2147483647, 1024, 8, 32], "", 0, []], [[], [["FU", 1, [0, 1, 2, 3]], ["SP", 1, 0, 401408, [49], 1], ["AN", 1, 0, 5], ["AN", 1, 1, 6]]]], "r": [[8.74341e-06, 8.75605e-06, 8.75311e-06], 0, 0.825229, 1667931258], "v": "v0.6"}
{"i": [["[\"sigmoid\", 1, 112, 112, 32]", "cuda -keys=cuda,gpu -max_num_threads=1024 -model=unknown -thread_warp_size=32", [-1, 16, 64, 49152, 2147483647, 1024, 8, 32], "", 0, []], [[], [["FU", 1, [0, 1, 2, 3]], ["SP", 1, 0, 401408, [32], 1], ["AN", 1, 0, 5], ["AN", 1, 1, 6]]]], "r": [[1.22651e-05, 1.22774e-05, 1.22826e-05], 0, 1.62801, 1667931259], "v": "v0.6"}
{"i": [["[\"sigmoid\", 1, 112, 112, 32]", "cuda -keys=cuda,gpu -max_num_threads=1024 -model=unknown -thread_warp_size=32", [-1, 16, 64, 49152, 2147483647, 1024, 8, 32], "", 0, []], [[], [["FU", 1, [0, 1, 2, 3]], ["SP", 1, 0, 401408, [4], 1], ["AN", 1, 0, 5], ["AN", 1, 1, 6]]]], "r": [[7.73677e-05, 7.73947e-05, 7.74059e-05], 0, 1.19187, 1667931258], "v": "v0.6"}
{"i": [["[\"sigmoid\", 1, 112, 112, 32]", "cuda -keys=cuda,gpu -max_num_threads=1024 -model=unknown -thread_warp_size=32", [-1, 16, 64, 49152, 2147483647, 1024, 8, 32], "", 0, []], [[], [["FU", 1, [0, 1, 2, 3]], ["SP", 1, 0, 401408, [14], 1], ["AN", 1, 0, 5], ["AN", 1, 1, 6]]]], "r": [[2.42173e-05, 2.42252e-05, 2.42248e-05], 0, 2.30055, 1667931260], "v": "v0.6"}
{"i": [["[\"sigmoid\", 1, 112, 112, 32]", "cuda -keys=cuda,gpu -max_num_threads=1024 -model=unknown -thread_warp_size=32", [-1, 16, 64, 49152, 2147483647, 1024, 8, 32], "", 0, []], [[], [["FU", 1, [0, 1, 2, 3]], ["SP", 1, 0, 401408, [56], 1], ["AN", 1, 0, 5], ["AN", 1, 1, 6]]]], "r": [[8.05224e-06, 8.06738e-06, 8.06636e-06], 0, 2.57802, 1667931260], "v": "v0.6"}
{"i": [["[\"sigmoid\", 1, 112, 112, 32]", "cuda -keys=cuda,gpu -max_num_threads=1024 -model=unknown -thread_warp_size=32", [-1, 16, 64, 49152, 2147483647, 1024, 8, 32], "", 0, []], [[], [["FU", 1, [0, 1, 2, 3]], ["SP", 1, 0, 401408, [7], 1], ["AN", 1, 0, 5], ["AN", 1, 1, 6]]]], "r": [[4.52669e-05, 4.52719e-05, 4.52747e-05], 0, 3.13475, 1667931261], "v": "v0.6"}
{"i": [["[\"sigmoid\", 1, 112, 112, 32]", "cuda -keys=cuda,gpu -max_num_threads=1024 -model=unknown -thread_warp_size=32", [-1, 16, 64, 49152, 2147483647, 1024, 8, 32], "", 0, []], [[], [["FU", 1, [0, 1, 2, 3]], ["SP", 1, 0, 401408, [64], 1], ["AN", 1, 0, 5], ["AN", 1, 1, 6]]]], "r": [[7.2723e-06, 7.28255e-06, 7.2769e-06], 0, 2.86234, 1667931260], "v": "v0.6"}
{"i": [["[\"sigmoid\", 1, 112, 112, 32]", "cuda -keys=cuda,gpu -max_num_threads=1024 -model=unknown -thread_warp_size=32", [-1, 16, 64, 49152, 2147483647, 1024, 8, 32], "", 0, []], [[], [["FU", 1, [0, 1, 2, 3]], ["SP", 1, 0, 401408, [28], 1], ["AN", 1, 0, 5], ["AN", 1, 1, 6]]]], "r": [[1.36579e-05, 1.36722e-05, 1.36744e-05], 0, 3.41552, 1667931261], "v": "v0.6"}
{"i": [["[\"sigmoid\", 1, 112, 112, 32]", "cuda -keys=cuda,gpu -max_num_threads=1024 -model=unknown -thread_warp_size=32", [-1, 16, 64, 49152, 2147483647, 1024, 8, 32], "", 0, []], [[], [["FU", 1, [0, 1, 2, 3]], ["SP", 1, 0, 401408, [2], 1], ["AN", 1, 0, 5], ["AN", 1, 1, 6]]]], "r": [[0.000151754, 0.000151755, 0.000151769], 0, 3.72086, 1667931261], "v": "v0.6"}
