python/models/efficientnet/VertiFusionEfficientNet_kernel_configs/efficient_sigmoid_1_1_1_144.log
{"i": [["[\"sigmoid\", 1, 1, 1, 144]", "cuda -keys=cuda,gpu -max_num_threads=1024 -model=unknown -thread_warp_size=32", [-1, 16, 64, 49152, 2147483647, 1024, 8, 32], "", 0, []], [[], [["FU", 1, [0, 1, 2, 3]], ["SP", 1, 0, 144, [4], 1], ["AN", 1, 0, 5], ["AN", 1, 1, 6]]]], "r": [[2.61959e-06, 2.6094e-06, 2.61097e-06], 0, 1.87133, 1667925719], "v": "v0.6"}
{"i": [["[\"sigmoid\", 1, 1, 1, 144]", "cuda -keys=cuda,gpu -max_num_threads=1024 -model=unknown -thread_warp_size=32", [-1, 16, 64, 49152, 2147483647, 1024, 8, 32], "", 0, []], [[], [["FU", 1, [0, 1, 2, 3]], ["SP", 1, 0, 144, [64], 1], ["AN", 1, 0, 5], ["AN", 1, 1, 6]]]], "r": [[2.4722e-06, 2.456e-06, 2.45782e-06], 0, 0.622034, 1667925718], "v": "v0.6"}
{"i": [["[\"sigmoid\", 1, 1, 1, 144]", "cuda -keys=cuda,gpu -max_num_threads=1024 -model=unknown -thread_warp_size=32", [-1, 16, 64, 49152, 2147483647, 1024, 8, 32], "", 0, []], [[], [["FU", 1, [0, 1, 2, 3]], ["SP", 1, 0, 144, [32], 1], ["AN", 1, 0, 5], ["AN", 1, 1, 6]]]], "r": [[2.70113e-06, 2.72472e-06, 2.72077e-06], 0, 1.56666, 1667925719], "v": "v0.6"}
{"i": [["[\"sigmoid\", 1, 1, 1, 144]", "cuda -keys=cuda,gpu -max_num_threads=1024 -model=unknown -thread_warp_size=32", [-1, 16, 64, 49152, 2147483647, 1024, 8, 32], "", 0, []], [[], [["FU", 1, [0, 1, 2, 3]], ["SP", 1, 0, 144, [6], 1], ["AN", 1, 0, 5], ["AN", 1, 1, 6]]]], "r": [[2.61116e-06, 2.60476e-06, 2.607e-06], 0, 0.913953, 1667925718], "v": "v0.6"}
{"i": [["[\"sigmoid\", 1, 1, 1, 144]", "cuda -keys=cuda,gpu -max_num_threads=1024 -model=unknown -thread_warp_size=32", [-1, 16, 64, 49152, 2147483647, 1024, 8, 32], "", 0, []], [[], [["FU", 1, [0, 1, 2, 3]], ["SP", 1, 0, 144, [9], 1], ["AN", 1, 0, 5], ["AN", 1, 1, 6]]]], "r": [[2.56013e-06, 2.55164e-06, 2.551e-06], 0, 1.24448, 1667925718], "v": "v0.6"}
{"i": [["[\"sigmoid\", 1, 1, 1, 144]", "cuda -keys=cuda,gpu -max_num_threads=1024 -model=unknown -thread_warp_size=32", [-1, 16, 64, 49152, 2147483647, 1024, 8, 32], "", 0, []], [[], [["FU", 1, [0, 1, 2, 3]], ["SP", 1, 0, 144, [1], 1], ["AN", 1, 0, 5], ["AN", 1, 1, 6]]]], "r": [[2.69316e-06, 2.69106e-06, 2.69176e-06], 0, 2.69189, 1667925720], "v": "v0.6"}
{"i": [["[\"sigmoid\", 1, 1, 1, 144]", "cuda -keys=cuda,gpu -max_num_threads=1024 -model=unknown -thread_warp_size=32", [-1, 16, 64, 49152, 2147483647, 1024, 8, 32], "", 0, []], [[], [["FU", 1, [0, 1, 2, 3]], ["SP", 1, 0, 144, [36], 1], ["AN", 1, 0, 5], ["AN", 1, 1, 6]]]], "r": [[2.67498e-06, 2.69441e-06, 2.70107e-06], 0, 2.15911, 1667925719], "v": "v0.6"}
{"i": [["[\"sigmoid\", 1, 1, 1, 144]", "cuda -keys=cuda,gpu -max_num_threads=1024 -model=unknown -thread_warp_size=32", [-1, 16, 64, 49152, 2147483647, 1024, 8, 32], "", 0, []], [[], [["FU", 1, [0, 1, 2, 3]], ["SP", 1, 0, 144, [2], 1], ["AN", 1, 0, 5], ["AN", 1, 1, 6]]]], "r": [[2.58738e-06, 2.59673e-06, 2.59489e-06], 0, 2.91724, 1667925720], "v": "v0.6"}
{"i": [["[\"sigmoid\", 1, 1, 1, 144]", "cuda -keys=cuda,gpu -max_num_threads=1024 -model=unknown -thread_warp_size=32", [-1, 16, 64, 49152, 2147483647, 1024, 8, 32], "", 0, []], [[], [["FU", 1, [0, 1, 2, 3]], ["SP", 1, 0, 144, [8], 1], ["AN", 1, 0, 5], ["AN", 1, 1, 6]]]], "r": [[2.62912e-06, 2.62792e-06, 2.62965e-06], 0, 2.33017, 1667925720], "v": "v0.6"}
{"i": [["[\"sigmoid\", 1, 1, 1, 144]", "cuda -keys=cuda,gpu -max_num_threads=1024 -model=unknown -thread_warp_size=32", [-1, 16, 64, 49152, 2147483647, 1024, 8, 32], "", 0, []], [[], [["FU", 1, [0, 1, 2, 3]], ["SP", 1, 0, 144, [24], 1], ["AN", 1, 0, 5], ["AN", 1, 1, 6]]]], "r": [[2.55273e-06, 2.54358e-06, 2.54544e-06], 0, 3.19959, 1667925720], "v": "v0.6"}
{"i": [["[\"sigmoid\", 1, 1, 1, 144]", "cuda -keys=cuda,gpu -max_num_threads=1024 -model=unknown -thread_warp_size=32", [-1, 16, 64, 49152, 2147483647, 1024, 8, 32], "", 0, []], [[], [["FU", 1, [0, 1, 2, 3]], ["SP", 1, 0, 144, [3], 1], ["AN", 1, 0, 5], ["AN", 1, 1, 6]]]], "r": [[2.50834e-06, 2.49602e-06, 2.49857e-06], 0, 3.4834, 1667925721], "v": "v0.6"}
{"i": [["[\"sigmoid\", 1, 1, 1, 144]", "cuda -keys=cuda,gpu -max_num_threads=1024 -model=unknown -thread_warp_size=32", [-1, 16, 64, 49152, 2147483647, 1024, 8, 32], "", 0, []], [[], [["FU", 1, [0, 1, 2, 3]], ["SP", 1, 0, 144, [16], 1], ["AN", 1, 0, 5], ["AN", 1, 1, 6]]]], "r": [[2.51843e-06, 2.51424e-06, 2.51453e-06], 0, 3.73444, 1667925721], "v": "v0.6"}
{"i": [["[\"sigmoid\", 1, 1, 1, 144]", "cuda -keys=cuda,gpu -max_num_threads=1024 -model=unknown -thread_warp_size=32", [-1, 16, 64, 49152, 2147483647, 1024, 8, 32], "", 0, []], [[], [["FU", 1, [0, 1, 2, 3]], ["SP", 1, 0, 144, [12], 1], ["AN", 1, 0, 5], ["AN", 1, 1, 6]]]], "r": [[2.4674e-06, 2.45384e-06, 2.4584e-06], 0, 3.97892, 1667925721], "v": "v0.6"}
{"i": [["[\"sigmoid\", 1, 1, 1, 144]", "cuda -keys=cuda,gpu -max_num_threads=1024 -model=unknown -thread_warp_size=32", [-1, 16, 64, 49152, 2147483647, 1024, 8, 32], "", 0, []], [[], [["FU", 1, [0, 1, 2, 3]], ["SP", 1, 0, 144, [18], 1], ["AN", 1, 0, 5], ["AN", 1, 1, 6]]]], "r": [[2.51115e-06, 2.50706e-06, 2.50689e-06], 0, 4.27753, 1667925722], "v": "v0.6"}
{"i": [["[\"sigmoid\", 1, 1, 1, 144]", "cuda -keys=cuda,gpu -max_num_threads=1024 -model=unknown -thread_warp_size=32", [-1, 16, 64, 49152, 2147483647, 1024, 8, 32], "", 0, []], [[], [["FU", 1, [0, 1, 2, 3]], ["SP", 1, 0, 144, [48], 1], ["AN", 1, 0, 5], ["AN", 1, 1, 6]]]], "r": [[2.5932e-06, 2.60979e-06, 2.60775e-06], 0, 4.52106, 1667925722], "v": "v0.6"}
{"i": [["[\"sigmoid\", 1, 1, 1, 144]", "cuda -keys=cuda,gpu -max_num_threads=1024 -model=unknown -thread_warp_size=32", [-1, 16, 64, 49152, 2147483647, 1024, 8, 32], "", 0, []], [[], [["FU", 1, [0, 1, 2, 3]], ["SP", 1, 0, 144, [9], 1], ["AN", 1, 0, 5], ["AN", 1, 1, 6]]]], "r": [[2.59263e-06, 2.5852e-06, 2.58657e-06], 0, 2.03775, 1667926065], "v": "v0.6"}
{"i": [["[\"sigmoid\", 1, 1, 1, 144]", "cuda -keys=cuda,gpu -max_num_threads=1024 -model=unknown -thread_warp_size=32", [-1, 16, 64, 49152, 2147483647, 1024, 8, 32], "", 0, []], [[], [["FU", 1, [0, 1, 2, 3]], ["SP", 1, 0, 144, [12], 1], ["AN", 1, 0, 5], ["AN", 1, 1, 6]]]], "r": [[2.47364e-06, 2.45618e-06, 2.459e-06], 0, 1.50281, 1667926064], "v": "v0.6"}
{"i": [["[\"sigmoid\", 1, 1, 1, 144]", "cuda -keys=cuda,gpu -max_num_threads=1024 -model=unknown -thread_warp_size=32", [-1, 16, 64, 49152, 2147483647, 1024, 8, 32], "", 0, []], [[], [["FU", 1, [0, 1, 2, 3]], ["SP", 1, 0, 144, [48], 1], ["AN", 1, 0, 5], ["AN", 1, 1, 6]]]], "r": [[2.67236e-06, 2.67897e-06, 2.69801e-06], 0, 0.605062, 1667926063], "v": "v0.6"}
{"i": [["[\"sigmoid\", 1, 1, 1, 144]", "cuda -keys=cuda,gpu -max_num_threads=1024 -model=unknown -thread_warp_size=32", [-1, 16, 64, 49152, 2147483647, 1024, 8, 32], "", 0, []], [[], [["FU", 1, [0, 1, 2, 3]], ["SP", 1, 0, 144, [36], 1], ["AN", 1, 0, 5], ["AN", 1, 1, 6]]]], "r": [[2.47858e-06, 2.46342e-06, 2.46065e-06], 0, 1.78075, 1667926064], "v": "v0.6"}
{"i": [["[\"sigmoid\", 1, 1, 1, 144]", "cuda -keys=cuda,gpu -max_num_threads=1024 -model=unknown -thread_warp_size=32", [-1, 16, 64, 49152, 2147483647, 1024, 8, 32], "", 0, []], [[], [["FU", 1, [0, 1, 2, 3]], ["SP", 1, 0, 144, [2], 1], ["AN", 1, 0, 5], ["AN", 1, 1, 6]]]], "r": [[2.60109e-06, 2.58887e-06, 2.59272e-06], 0, 1.19147, 1667926064], "v": "v0.6"}
{"i": [["[\"sigmoid\", 1, 1, 1, 144]", "cuda -keys=cuda,gpu -max_num_threads=1024 -model=unknown -thread_warp_size=32", [-1, 16, 64, 49152, 2147483647, 1024, 8, 32], "", 0, []], [[], [["FU", 1, [0, 1, 2, 3]], ["SP", 1, 0, 144, [16], 1], ["AN", 1, 0, 5], ["AN", 1, 1, 6]]]], "r": [[2.50386e-06, 2.48543e-06, 2.48726e-06], 0, 0.886317, 1667926063], "v": "v0.6"}
{"i": [["[\"sigmoid\", 1, 1, 1, 144]", "cuda -keys=cuda,gpu -max_num_threads=1024 -model=unknown -thread_warp_size=32", [-1, 16, 64, 49152, 2147483647, 1024, 8, 32], "", 0, []], [[], [["FU", 1, [0, 1, 2, 3]], ["SP", 1, 0, 144, [24], 1], ["AN", 1, 0, 5], ["AN", 1, 1, 6]]]], "r": [[2.69912e-06, 2.70283e-06, 2.71853e-06], 0, 2.21718, 1667926065], "v": "v0.6"}
{"i": [["[\"sigmoid\", 1, 1, 1, 144]", "cuda -keys=cuda,gpu -max_num_threads=1024 -model=unknown -thread_warp_size=32", [-1, 16, 64, 49152, 2147483647, 1024, 8, 32], "", 0, []], [[], [["FU", 1, [0, 1, 2, 3]], ["SP", 1, 0, 144, [4], 1], ["AN", 1, 0, 5], ["AN", 1, 1, 6]]]], "r": [[2.72372e-06, 2.74675e-06, 2.7377e-06], 0, 2.4536, 1667926065], "v": "v0.6"}
{"i": [["[\"sigmoid\", 1, 1, 1, 144]", "cuda -keys=cuda,gpu -max_num_threads=1024 -model=unknown -thread_warp_size=32", [-1, 16, 64, 49152, 2147483647, 1024, 8, 32], "", 0, []], [[], [["FU", 1, [0, 1, 2, 3]], ["SP", 1, 0, 144, [18], 1], ["AN", 1, 0, 5], ["AN", 1, 1, 6]]]], "r": [[2.68054e-06, 2.68634e-06, 2.69869e-06], 0, 2.69967, 1667926065], "v": "v0.6"}
{"i": [["[\"sigmoid\", 1, 1, 1, 144]", "cuda -keys=cuda,gpu -max_num_threads=1024 -model=unknown -thread_warp_size=32", [-1, 16, 64, 49152, 2147483647, 1024, 8, 32], "", 0, []], [[], [["FU", 1, [0, 1, 2, 3]], ["SP", 1, 0, 144, [1], 1], ["AN", 1, 0, 5], ["AN", 1, 1, 6]]]], "r": [[2.86189e-06, 2.87448e-06, 2.88083e-06], 0, 2.97944, 1667926066], "v": "v0.6"}
{"i": [["[\"sigmoid\", 1, 1, 1, 144]", "cuda -keys=cuda,gpu -max_num_threads=1024 -model=unknown -thread_warp_size=32", [-1, 16, 64, 49152, 2147483647, 1024, 8, 32], "", 0, []], [[], [["FU", 1, [0, 1, 2, 3]], ["SP", 1, 0, 144, [6], 1], ["AN", 1, 0, 5], ["AN", 1, 1, 6]]]], "r": [[2.6108e-06, 2.60443e-06, 2.60659e-06], 0, 3.2788, 1667926066], "v": "v0.6"}
{"i": [["[\"sigmoid\", 1, 1, 1, 144]", "cuda -keys=cuda,gpu -max_num_threads=1024 -model=unknown -thread_warp_size=32", [-1, 16, 64, 49152, 2147483647, 1024, 8, 32], "", 0, []], [[], [["FU", 1, [0, 1, 2, 3]], ["SP", 1, 0, 144, [3], 1], ["AN", 1, 0, 5], ["AN", 1, 1, 6]]]], "r": [[2.52287e-06, 2.51431e-06, 2.51453e-06], 0, 3.53438, 1667926066], "v": "v0.6"}
{"i": [["[\"sigmoid\", 1, 1, 1, 144]", "cuda -keys=cuda,gpu -max_num_threads=1024 -model=unknown -thread_warp_size=32", [-1, 16, 64, 49152, 2147483647, 1024, 8, 32], "", 0, []], [[], [["FU", 1, [0, 1, 2, 3]], ["SP", 1, 0, 144, [64], 1], ["AN", 1, 0, 5], ["AN", 1, 1, 6]]]], "r": [[2.56311e-06, 2.55286e-06, 2.55519e-06], 0, 3.79809, 1667926067], "v": "v0.6"}
{"i": [["[\"sigmoid\", 1, 1, 1, 144]", "cuda -keys=cuda,gpu -max_num_threads=1024 -model=unknown -thread_warp_size=32", [-1, 16, 64, 49152, 2147483647, 1024, 8, 32], "", 0, []], [[], [["FU", 1, [0, 1, 2, 3]], ["SP", 1, 0, 144, [32], 1], ["AN", 1, 0, 5], ["AN", 1, 1, 6]]]], "r": [[2.61285e-06, 2.60969e-06, 2.61056e-06], 0, 4.10654, 1667926067], "v": "v0.6"}
{"i": [["[\"sigmoid\", 1, 1, 1, 144]", "cuda -keys=cuda,gpu -max_num_threads=1024 -model=unknown -thread_warp_size=32", [-1, 16, 64, 49152, 2147483647, 1024, 8, 32], "", 0, []], [[], [["FU", 1, [0, 1, 2, 3]], ["SP", 1, 0, 144, [8], 1], ["AN", 1, 0, 5], ["AN", 1, 1, 6]]]], "r": [[2.59018e-06, 2.58625e-06, 2.58622e-06], 0, 4.36516, 1667926067], "v": "v0.6"}
{"i": [["[\"sigmoid\", 1, 1, 1, 144]", "cuda -keys=cuda,gpu -max_num_threads=1024 -model=unknown -thread_warp_size=32", [-1, 16, 64, 49152, 2147483647, 1024, 8, 32], "", 0, []], [[], [["FU", 1, [0, 1, 2, 3]], ["SP", 1, 0, 144, [48], 1], ["AN", 1, 0, 5], ["AN", 1, 1, 6]]]], "r": [[2.63852e-06, 2.65343e-06, 2.66093e-06], 0, 1.85718, 1667935570], "v": "v0.6"}
{"i": [["[\"sigmoid\", 1, 1, 1, 144]", "cuda -keys=cuda,gpu -max_num_threads=1024 -model=unknown -thread_warp_size=32", [-1, 16, 64, 49152, 2147483647, 1024, 8, 32], "", 0, []], [[], [["FU", 1, [0, 1, 2, 3]], ["SP", 1, 0, 144, [24], 1], ["AN", 1, 0, 5], ["AN", 1, 1, 6]]]], "r": [[2.53583e-06, 2.53165e-06, 2.53194e-06], 0, 1.28249, 1667935570], "v": "v0.6"}
{"i": [["[\"sigmoid\", 1, 1, 1, 144]", "cuda -keys=cuda,gpu -max_num_threads=1024 -model=unknown -thread_warp_size=32", [-1, 16, 64, 49152, 2147483647, 1024, 8, 32], "", 0, []], [[], [["FU", 1, [0, 1, 2, 3]], ["SP", 1, 0, 144, [16], 1], ["AN", 1, 0, 5], ["AN", 1, 1, 6]]]], "r": [[2.50543e-06, 2.4912e-06, 2.49626e-06], 0, 0.963912, 1667935569], "v": "v0.6"}
{"i": [["[\"sigmoid\", 1, 1, 1, 144]", "cuda -keys=cuda,gpu -max_num_threads=1024 -model=unknown -thread_warp_size=32", [-1, 16, 64, 49152, 2147483647, 1024, 8, 32], "", 0, []], [[], [["FU", 1, [0, 1, 2, 3]], ["SP", 1, 0, 144, [32], 1], ["AN", 1, 0, 5], ["AN", 1, 1, 6]]]], "r": [[2.53263e-06, 2.52798e-06, 2.52941e-06], 0, 1.55344, 1667935570], "v": "v0.6"}
{"i": [["[\"sigmoid\", 1, 1, 1, 144]", "cuda -keys=cuda,gpu -max_num_threads=1024 -model=unknown -thread_warp_size=32", [-1, 16, 64, 49152, 2147483647, 1024, 8, 32], "", 0, []], [[], [["FU", 1, [0, 1, 2, 3]], ["SP", 1, 0, 144, [1], 1], ["AN", 1, 0, 5], ["AN", 1, 1, 6]]]], "r": [[2.7165e-06, 2.71254e-06, 2.71068e-06], 0, 0.617949, 1667935569], "v": "v0.6"}
{"i": [["[\"sigmoid\", 1, 1, 1, 144]", "cuda -keys=cuda,gpu -max_num_threads=1024 -model=unknown -thread_warp_size=32", [-1, 16, 64, 49152, 2147483647, 1024, 8, 32], "", 0, []], [[], [["FU", 1, [0, 1, 2, 3]], ["SP", 1, 0, 144, [64], 1], ["AN", 1, 0, 5], ["AN", 1, 1, 6]]]], "r": [[2.65134e-06, 2.65925e-06, 2.67003e-06], 0, 2.10836, 1667935571], "v": "v0.6"}
{"i": [["[\"sigmoid\", 1, 1, 1, 144]", "cuda -keys=cuda,gpu -max_num_threads=1024 -model=unknown -thread_warp_size=32", [-1, 16, 64, 49152, 2147483647, 1024, 8, 32], "", 0, []], [[], [["FU", 1, [0, 1, 2, 3]], ["SP", 1, 0, 144, [4], 1], ["AN", 1, 0, 5], ["AN", 1, 1, 6]]]], "r": [[2.72362e-06, 2.73948e-06, 2.73591e-06], 0, 2.32132, 1667935571], "v": "v0.6"}
{"i": [["[\"sigmoid\", 1, 1, 1, 144]", "cuda -keys=cuda,gpu -max_num_threads=1024 -model=unknown -thread_warp_size=32", [-1, 16, 64, 49152, 2147483647, 1024, 8, 32], "", 0, []], [[], [["FU", 1, [0, 1, 2, 3]], ["SP", 1, 0, 144, [12], 1], ["AN", 1, 0, 5], ["AN", 1, 1, 6]]]], "r": [[2.55908e-06, 2.55393e-06, 2.55299e-06], 0, 2.582, 1667935571], "v": "v0.6"}
{"i": [["[\"sigmoid\", 1, 1, 1, 144]", "cuda -keys=cuda,gpu -max_num_threads=1024 -model=unknown -thread_warp_size=32", [-1, 16, 64, 49152, 2147483647, 1024, 8, 32], "", 0, []], [[], [["FU", 1, [0, 1, 2, 3]], ["SP", 1, 0, 144, [3], 1], ["AN", 1, 0, 5], ["AN", 1, 1, 6]]]], "r": [[2.66891e-06, 2.66536e-06, 2.66324e-06], 0, 2.86302, 1667935572], "v": "v0.6"}
{"i": [["[\"sigmoid\", 1, 1, 1, 144]", "cuda -keys=cuda,gpu -max_num_threads=1024 -model=unknown -thread_warp_size=32", [-1, 16, 64, 49152, 2147483647, 1024, 8, 32], "", 0, []], [[], [["FU", 1, [0, 1, 2, 3]], ["SP", 1, 0, 144, [6], 1], ["AN", 1, 0, 5], ["AN", 1, 1, 6]]]], "r": [[2.60928e-06, 2.60045e-06, 2.60163e-06], 0, 3.43004, 1667935572], "v": "v0.6"}
{"i": [["[\"sigmoid\", 1, 1, 1, 144]", "cuda -keys=cuda,gpu -max_num_threads=1024 -model=unknown -thread_warp_size=32", [-1, 16, 64, 49152, 2147483647, 1024, 8, 32], "", 0, []], [[], [["FU", 1, [0, 1, 2, 3]], ["SP", 1, 0, 144, [9], 1], ["AN", 1, 0, 5], ["AN", 1, 1, 6]]]], "r": [[2.67984e-06, 2.67948e-06, 2.69467e-06], 0, 3.10345, 1667935572], "v": "v0.6"}
{"i": [["[\"sigmoid\", 1, 1, 1, 144]", "cuda -keys=cuda,gpu -max_num_threads=1024 -model=unknown -thread_warp_size=32", [-1, 16, 64, 49152, 2147483647, 1024, 8, 32], "", 0, []], [[], [["FU", 1, [0, 1, 2, 3]], ["SP", 1, 0, 144, [2], 1], ["AN", 1, 0, 5], ["AN", 1, 1, 6]]]], "r": [[2.74152e-06, 2.74863e-06, 2.75109e-06], 0, 3.68589, 1667935573], "v": "v0.6"}
{"i": [["[\"sigmoid\", 1, 1, 1, 144]", "cuda -keys=cuda,gpu -max_num_threads=1024 -model=unknown -thread_warp_size=32", [-1, 16, 64, 49152, 2147483647, 1024, 8, 32], "", 0, []], [[], [["FU", 1, [0, 1, 2, 3]], ["SP", 1, 0, 144, [8], 1], ["AN", 1, 0, 5], ["AN", 1, 1, 6]]]], "r": [[2.48578e-06, 2.46655e-06, 2.47278e-06], 0, 3.91162, 1667935573], "v": "v0.6"}
{"i": [["[\"sigmoid\", 1, 1, 1, 144]", "cuda -keys=cuda,gpu -max_num_threads=1024 -model=unknown -thread_warp_size=32", [-1, 16, 64, 49152, 2147483647, 1024, 8, 32], "", 0, []], [[], [["FU", 1, [0, 1, 2, 3]], ["SP", 1, 0, 144, [36], 1], ["AN", 1, 0, 5], ["AN", 1, 1, 6]]]], "r": [[2.68312e-06, 2.69682e-06, 2.70728e-06], 0, 4.17964, 1667935573], "v": "v0.6"}
{"i": [["[\"sigmoid\", 1, 1, 1, 144]", "cuda -keys=cuda,gpu -max_num_threads=1024 -model=unknown -thread_warp_size=32", [-1, 16, 64, 49152, 2147483647, 1024, 8, 32], "", 0, []], [[], [["FU", 1, [0, 1, 2, 3]], ["SP", 1, 0, 144, [18], 1], ["AN", 1, 0, 5], ["AN", 1, 1, 6]]]], "r": [[2.49534e-06, 2.48779e-06, 2.4874e-06], 0, 4.49654, 1667935574], "v": "v0.6"}
{"i": [["[\"sigmoid\", 1, 1, 1, 144]", "cuda -keys=cuda,gpu -max_num_threads=1024 -model=unknown -thread_warp_size=32", [-1, 16, 64, 49152, 2147483647, 1024, 8, 32], "", 0, []], [[], [["FU", 1, [0, 1, 2, 3]], ["SP", 1, 0, 144, [9], 1], ["AN", 1, 0, 5], ["AN", 1, 1, 6]]]], "r": [[2.6436e-06, 2.65179e-06, 2.6524e-06], 0, 2.30435, 1667936467], "v": "v0.6"}
{"i": [["[\"sigmoid\", 1, 1, 1, 144]", "cuda -keys=cuda,gpu -max_num_threads=1024 -model=unknown -thread_warp_size=32", [-1, 16, 64, 49152, 2147483647, 1024, 8, 32], "", 0, []], [[], [["FU", 1, [0, 1, 2, 3]], ["SP", 1, 0, 144, [3], 1], ["AN", 1, 0, 5], ["AN", 1, 1, 6]]]], "r": [[2.68539e-06, 2.69223e-06, 2.69926e-06], 0, 0.554237, 1667936465], "v": "v0.6"}
{"i": [["[\"sigmoid\", 1, 1, 1, 144]", "cuda -keys=cuda,gpu -max_num_threads=1024 -model=unknown -thread_warp_size=32", [-1, 16, 64, 49152, 2147483647, 1024, 8, 32], "", 0, []], [[], [["FU", 1, [0, 1, 2, 3]], ["SP", 1, 0, 144, [2], 1], ["AN", 1, 0, 5], ["AN", 1, 1, 6]]]], "r": [[2.75882e-06, 2.75998e-06, 2.75727e-06], 0, 1.45449, 1667936466], "v": "v0.6"}
{"i": [["[\"sigmoid\", 1, 1, 1, 144]", "cuda -keys=cuda,gpu -max_num_threads=1024 -model=unknown -thread_warp_size=32", [-1, 16, 64, 49152, 2147483647, 1024, 8, 32], "", 0, []], [[], [["FU", 1, [0, 1, 2, 3]], ["SP", 1, 0, 144, [24], 1], ["AN", 1, 0, 5], ["AN", 1, 1, 6]]]], "r": [[2.67617e-06, 2.68241e-06, 2.69824e-06], 0, 2.00411, 1667936467], "v": "v0.6"}
{"i": [["[\"sigmoid\", 1, 1, 1, 144]", "cuda -keys=cuda,gpu -max_num_threads=1024 -model=unknown -thread_warp_size=32", [-1, 16, 64, 49152, 2147483647, 1024, 8, 32], "", 0, []], [[], [["FU", 1, [0, 1, 2, 3]], ["SP", 1, 0, 144, [8], 1], ["AN", 1, 0, 5], ["AN", 1, 1, 6]]]], "r": [[2.50573e-06, 2.5013e-06, 2.50236e-06], 0, 0.845042, 1667936466], "v": "v0.6"}
{"i": [["[\"sigmoid\", 1, 1, 1, 144]", "cuda -keys=cuda,gpu -max_num_threads=1024 -model=unknown -thread_warp_size=32", [-1, 16, 64, 49152, 2147483647, 1024, 8, 32], "", 0, []], [[], [["FU", 1, [0, 1, 2, 3]], ["SP", 1, 0, 144, [18], 1], ["AN", 1, 0, 5], ["AN", 1, 1, 6]]]], "r": [[2.46604e-06, 2.46007e-06, 2.46686e-06], 0, 1.10559, 1667936466], "v": "v0.6"}
{"i": [["[\"sigmoid\", 1, 1, 1, 144]", "cuda -keys=cuda,gpu -max_num_threads=1024 -model=unknown -thread_warp_size=32", [-1, 16, 64, 49152, 2147483647, 1024, 8, 32], "", 0, []], [[], [["FU", 1, [0, 1, 2, 3]], ["SP", 1, 0, 144, [48], 1], ["AN", 1, 0, 5], ["AN", 1, 1, 6]]]], "r": [[2.63574e-06, 2.6342e-06, 2.64774e-06], 0, 1.67525, 1667936467], "v": "v0.6"}
{"i": [["[\"sigmoid\", 1, 1, 1, 144]", "cuda -keys=cuda,gpu -max_num_threads=1024 -model=unknown -thread_warp_size=32", [-1, 16, 64, 49152, 2147483647, 1024, 8, 32], "", 0, []], [[], [["FU", 1, [0, 1, 2, 3]], ["SP", 1, 0, 144, [6], 1], ["AN", 1, 0, 5], ["AN", 1, 1, 6]]]], "r": [[2.49737e-06, 2.49143e-06, 2.49211e-06], 0, 2.57489, 1667936468], "v": "v0.6"}
{"i": [["[\"sigmoid\", 1, 1, 1, 144]", "cuda -keys=cuda,gpu -max_num_threads=1024 -model=unknown -thread_warp_size=32", [-1, 16, 64, 49152, 2147483647, 1024, 8, 32], "", 0, []], [[], [["FU", 1, [0, 1, 2, 3]], ["SP", 1, 0, 144, [4], 1], ["AN", 1, 0, 5], ["AN", 1, 1, 6]]]], "r": [[2.71043e-06, 2.72684e-06, 2.72663e-06], 0, 2.79908, 1667936468], "v": "v0.6"}
{"i": [["[\"sigmoid\", 1, 1, 1, 144]", "cuda -keys=cuda,gpu -max_num_threads=1024 -model=unknown -thread_warp_size=32", [-1, 16, 64, 49152, 2147483647, 1024, 8, 32], "", 0, []], [[], [["FU", 1, [0, 1, 2, 3]], ["SP", 1, 0, 144, [32], 1], ["AN", 1, 0, 5], ["AN", 1, 1, 6]]]], "r": [[2.50384e-06, 2.49305e-06, 2.49364e-06], 0, 3.43319, 1667936469], "v": "v0.6"}
{"i": [["[\"sigmoid\", 1, 1, 1, 144]", "cuda -keys=cuda,gpu -max_num_threads=1024 -model=unknown -thread_warp_size=32", [-1, 16, 64, 49152, 2147483647, 1024, 8, 32], "", 0, []], [[], [["FU", 1, [0, 1, 2, 3]], ["SP", 1, 0, 144, [1], 1], ["AN", 1, 0, 5], ["AN", 1, 1, 6]]]], "r": [[2.63375e-06, 2.62759e-06, 2.62744e-06], 0, 3.08226, 1667936468], "v": "v0.6"}
{"i": [["[\"sigmoid\", 1, 1, 1, 144]", "cuda -keys=cuda,gpu -max_num_threads=1024 -model=unknown -thread_warp_size=32", [-1, 16, 64, 49152, 2147483647, 1024, 8, 32], "", 0, []], [[], [["FU", 1, [0, 1, 2, 3]], ["SP", 1, 0, 144, [16], 1], ["AN", 1, 0, 5], ["AN", 1, 1, 6]]]], "r": [[2.50823e-06, 2.48906e-06, 2.49458e-06], 0, 3.6834, 1667936469], "v": "v0.6"}
{"i": [["[\"sigmoid\", 1, 1, 1, 144]", "cuda -keys=cuda,gpu -max_num_threads=1024 -model=unknown -thread_warp_size=32", [-1, 16, 64, 49152, 2147483647, 1024, 8, 32], "", 0, []], [[], [["FU", 1, [0, 1, 2, 3]], ["SP", 1, 0, 144, [64], 1], ["AN", 1, 0, 5], ["AN", 1, 1, 6]]]], "r": [[2.67465e-06, 2.68225e-06, 2.69983e-06], 0, 3.90719, 1667936469], "v": "v0.6"}
{"i": [["[\"sigmoid\", 1, 1, 1, 144]", "cuda -keys=cuda,gpu -max_num_threads=1024 -model=unknown -thread_warp_size=32", [-1, 16, 64, 49152, 2147483647, 1024, 8, 32], "", 0, []], [[], [["FU", 1, [0, 1, 2, 3]], ["SP", 1, 0, 144, [12], 1], ["AN", 1, 0, 5], ["AN", 1, 1, 6]]]], "r": [[2.64934e-06, 2.65366e-06, 2.65884e-06], 0, 4.19673, 1667936469], "v": "v0.6"}
{"i": [["[\"sigmoid\", 1, 1, 1, 144]", "cuda -keys=cuda,gpu -max_num_threads=1024 -model=unknown -thread_warp_size=32", [-1, 16, 64, 49152, 2147483647, 1024, 8, 32], "", 0, []], [[], [["FU", 1, [0, 1, 2, 3]], ["SP", 1, 0, 144, [36], 1], ["AN", 1, 0, 5], ["AN", 1, 1, 6]]]], "r": [[2.58973e-06, 2.58878e-06, 2.63025e-06], 0, 4.45505, 1667936470], "v": "v0.6"}
