python/models/efficientnet/VertiFusionEfficientNet_kernel_configs/efficient_batch_norm_1_7_7_1152.log
{"i": [["[\"batch_norm\", 1, 7, 7, 1152]", "cuda -keys=cuda,gpu -max_num_threads=1024 -model=unknown -thread_warp_size=32", [-1, 16, 64, 49152, 2147483647, 1024, 8, 32], "", 0, []], [[], [["CI", 2], ["FU", 4, [0, 1, 2, 3]], ["SP", 4, 0, 56448, [18], 1], ["AN", 4, 0, 5], ["AN", 4, 1, 6]]]], "r": [[5.01881e-06, 5.01631e-06, 5.01578e-06], 0, 1.58503, 1667927678], "v": "v0.6"}
{"i": [["[\"batch_norm\", 1, 7, 7, 1152]", "cuda -keys=cuda,gpu -max_num_threads=1024 -model=unknown -thread_warp_size=32", [-1, 16, 64, 49152, 2147483647, 1024, 8, 32], "", 0, []], [[], [["CI", 2], ["FU", 4, [0, 1, 2, 3]], ["SP", 4, 0, 56448, [16], 1], ["AN", 4, 0, 5], ["AN", 4, 1, 6]]]], "r": [[5.30635e-06, 5.31477e-06, 5.31234e-06], 0, 2.51055, 1667927679], "v": "v0.6"}
{"i": [["[\"batch_norm\", 1, 7, 7, 1152]", "cuda -keys=cuda,gpu -max_num_threads=1024 -model=unknown -thread_warp_size=32", [-1, 16, 64, 49152, 2147483647, 1024, 8, 32], "", 0, []], [[], [["CI", 2], ["FU", 4, [0, 1, 2, 3]], ["SP", 4, 0, 56448, [56], 1], ["AN", 4, 0, 5], ["AN", 4, 1, 6]]]], "r": [[3.36657e-06, 3.37233e-06, 3.37104e-06], 0, 1.31601, 1667927677], "v": "v0.6"}
{"i": [["[\"batch_norm\", 1, 7, 7, 1152]", "cuda -keys=cuda,gpu -max_num_threads=1024 -model=unknown -thread_warp_size=32", [-1, 16, 64, 49152, 2147483647, 1024, 8, 32], "", 0, []], [[], [["CI", 2], ["FU", 4, [0, 1, 2, 3]], ["SP", 4, 0, 56448, [24], 1], ["AN", 4, 0, 5], ["AN", 4, 1, 6]]]], "r": [[4.36174e-06, 4.36629e-06, 4.36738e-06], 0, 0.960076, 1667927677], "v": "v0.6"}
{"i": [["[\"batch_norm\", 1, 7, 7, 1152]", "cuda -keys=cuda,gpu -max_num_threads=1024 -model=unknown -thread_warp_size=32", [-1, 16, 64, 49152, 2147483647, 1024, 8, 32], "", 0, []], [[], [["CI", 2], ["FU", 4, [0, 1, 2, 3]], ["SP", 4, 0, 56448, [28], 1], ["AN", 4, 0, 5], ["AN", 4, 1, 6]]]], "r": [[4.11081e-06, 4.11403e-06, 4.11762e-06], 0, 1.88023, 1667927678], "v": "v0.6"}
{"i": [["[\"batch_norm\", 1, 7, 7, 1152]", "cuda -keys=cuda,gpu -max_num_threads=1024 -model=unknown -thread_warp_size=32", [-1, 16, 64, 49152, 2147483647, 1024, 8, 32], "", 0, []], [[], [["CI", 2], ["FU", 4, [0, 1, 2, 3]], ["SP", 4, 0, 56448, [48], 1], ["AN", 4, 0, 5], ["AN", 4, 1, 6]]]], "r": [[3.42894e-06, 3.43497e-06, 3.43531e-06], 0, 0.694019, 1667927677], "v": "v0.6"}
{"i": [["[\"batch_norm\", 1, 7, 7, 1152]", "cuda -keys=cuda,gpu -max_num_threads=1024 -model=unknown -thread_warp_size=32", [-1, 16, 64, 49152, 2147483647, 1024, 8, 32], "", 0, []], [[], [["CI", 2], ["FU", 4, [0, 1, 2, 3]], ["SP", 4, 0, 56448, [42], 1], ["AN", 4, 0, 5], ["AN", 4, 1, 6]]]], "r": [[3.69026e-06, 3.68792e-06, 3.68815e-06], 0, 2.2159, 1667927678], "v": "v0.6"}
{"i": [["[\"batch_norm\", 1, 7, 7, 1152]", "cuda -keys=cuda,gpu -max_num_threads=1024 -model=unknown -thread_warp_size=32", [-1, 16, 64, 49152, 2147483647, 1024, 8, 32], "", 0, []], [[], [["CI", 2], ["FU", 4, [0, 1, 2, 3]], ["SP", 4, 0, 56448, [9], 1], ["AN", 4, 0, 5], ["AN", 4, 1, 6]]]], "r": [[7.28153e-06, 7.28243e-06, 7.28126e-06], 0, 2.80704, 1667927679], "v": "v0.6"}
{"i": [["[\"batch_norm\", 1, 7, 7, 1152]", "cuda -keys=cuda,gpu -max_num_threads=1024 -model=unknown -thread_warp_size=32", [-1, 16, 64, 49152, 2147483647, 1024, 8, 32], "", 0, []], [[], [["CI", 2], ["FU", 4, [0, 1, 2, 3]], ["SP", 4, 0, 56448, [7], 1], ["AN", 4, 0, 5], ["AN", 4, 1, 6]]]], "r": [[8.6866e-06, 8.69008e-06, 8.6893e-06], 0, 3.12049, 1667927679], "v": "v0.6"}
{"i": [["[\"batch_norm\", 1, 7, 7, 1152]", "cuda -keys=cuda,gpu -max_num_threads=1024 -model=unknown -thread_warp_size=32", [-1, 16, 64, 49152, 2147483647, 1024, 8, 32], "", 0, []], [[], [["CI", 2], ["FU", 4, [0, 1, 2, 3]], ["SP", 4, 0, 56448, [2], 1], ["AN", 4, 0, 5], ["AN", 4, 1, 6]]]], "r": [[2.36264e-05, 2.36217e-05, 2.36239e-05], 0, 3.64401, 1667927680], "v": "v0.6"}
{"i": [["[\"batch_norm\", 1, 7, 7, 1152]", "cuda -keys=cuda,gpu -max_num_threads=1024 -model=unknown -thread_warp_size=32", [-1, 16, 64, 49152, 2147483647, 1024, 8, 32], "", 0, []], [[], [["CI", 2], ["FU", 4, [0, 1, 2, 3]], ["SP", 4, 0, 56448, [63], 1], ["AN", 4, 0, 5], ["AN", 4, 1, 6]]]], "r": [[3.45747e-06, 3.4577e-06, 3.459e-06], 0, 3.30978, 1667927680], "v": "v0.6"}
{"i": [["[\"batch_norm\", 1, 7, 7, 1152]", "cuda -keys=cuda,gpu -max_num_threads=1024 -model=unknown -thread_warp_size=32", [-1, 16, 64, 49152, 2147483647, 1024, 8, 32], "", 0, []], [[], [["CI", 2], ["FU", 4, [0, 1, 2, 3]], ["SP", 4, 0, 56448, [3], 1], ["AN", 4, 0, 5], ["AN", 4, 1, 6]]]], "r": [[1.67237e-05, 1.67148e-05, 1.67216e-05], 0, 3.89563, 1667927681], "v": "v0.6"}
{"i": [["[\"batch_norm\", 1, 7, 7, 1152]", "cuda -keys=cuda,gpu -max_num_threads=1024 -model=unknown -thread_warp_size=32", [-1, 16, 64, 49152, 2147483647, 1024, 8, 32], "", 0, []], [[], [["CI", 2], ["FU", 4, [0, 1, 2, 3]], ["SP", 4, 0, 56448, [4], 1], ["AN", 4, 0, 5], ["AN", 4, 1, 6]]]], "r": [[1.32587e-05, 1.32572e-05, 1.32497e-05], 0, 4.18806, 1667927681], "v": "v0.6"}
{"i": [["[\"batch_norm\", 1, 7, 7, 1152]", "cuda -keys=cuda,gpu -max_num_threads=1024 -model=unknown -thread_warp_size=32", [-1, 16, 64, 49152, 2147483647, 1024, 8, 32], "", 0, []], [[], [["CI", 2], ["FU", 4, [0, 1, 2, 3]], ["SP", 4, 0, 56448, [64], 1], ["AN", 4, 0, 5], ["AN", 4, 1, 6]]]], "r": [[3.46611e-06, 3.46619e-06, 3.4691e-06], 0, 4.40338, 1667927681], "v": "v0.6"}
{"i": [["[\"batch_norm\", 1, 7, 7, 1152]", "cuda -keys=cuda,gpu -max_num_threads=1024 -model=unknown -thread_warp_size=32", [-1, 16, 64, 49152, 2147483647, 1024, 8, 32], "", 0, []], [[], [["CI", 2], ["FU", 4, [0, 1, 2, 3]], ["SP", 4, 0, 56448, [36], 1], ["AN", 4, 0, 5], ["AN", 4, 1, 6]]]], "r": [[3.83897e-06, 3.83718e-06, 3.8416e-06], 0, 4.78148, 1667927682], "v": "v0.6"}
{"i": [["[\"batch_norm\", 1, 7, 7, 1152]", "cuda -keys=cuda,gpu -max_num_threads=1024 -model=unknown -thread_warp_size=32", [-1, 16, 64, 49152, 2147483647, 1024, 8, 32], "", 0, []], [[], [["CI", 2], ["FU", 4, [0, 1, 2, 3]], ["SP", 4, 0, 56448, [8], 1], ["AN", 4, 0, 5], ["AN", 4, 1, 6]]]], "r": [[8.07909e-06, 8.07257e-06, 8.07946e-06], 0, 5.03708, 1667927682], "v": "v0.6"}
{"i": [["[\"batch_norm\", 1, 7, 7, 1152]", "cuda -keys=cuda,gpu -max_num_threads=1024 -model=unknown -thread_warp_size=32", [-1, 16, 64, 49152, 2147483647, 1024, 8, 32], "", 0, []], [[], [["CI", 2], ["FU", 4, [0, 1, 2, 3]], ["SP", 4, 0, 56448, [12], 1], ["AN", 4, 0, 5], ["AN", 4, 1, 6]]]], "r": [[6.10071e-06, 6.10533e-06, 6.10474e-06], 0, 5.32425, 1667927682], "v": "v0.6"}
{"i": [["[\"batch_norm\", 1, 7, 7, 1152]", "cuda -keys=cuda,gpu -max_num_threads=1024 -model=unknown -thread_warp_size=32", [-1, 16, 64, 49152, 2147483647, 1024, 8, 32], "", 0, []], [[], [["CI", 2], ["FU", 4, [0, 1, 2, 3]], ["SP", 4, 0, 56448, [14], 1], ["AN", 4, 0, 5], ["AN", 4, 1, 6]]]], "r": [[5.58865e-06, 5.58785e-06, 5.587e-06], 0, 5.6404, 1667927683], "v": "v0.6"}
{"i": [["[\"batch_norm\", 1, 7, 7, 1152]", "cuda -keys=cuda,gpu -max_num_threads=1024 -model=unknown -thread_warp_size=32", [-1, 16, 64, 49152, 2147483647, 1024, 8, 32], "", 0, []], [[], [["CI", 2], ["FU", 4, [0, 1, 2, 3]], ["SP", 4, 0, 56448, [49], 1], ["AN", 4, 0, 5], ["AN", 4, 1, 6]]]], "r": [[3.57033e-06, 3.57132e-06, 3.57266e-06], 0, 5.91111, 1667927683], "v": "v0.6"}
{"i": [["[\"batch_norm\", 1, 7, 7, 1152]", "cuda -keys=cuda,gpu -max_num_threads=1024 -model=unknown -thread_warp_size=32", [-1, 16, 64, 49152, 2147483647, 1024, 8, 32], "", 0, []], [[], [["CI", 2], ["FU", 4, [0, 1, 2, 3]], ["SP", 4, 0, 56448, [32], 1], ["AN", 4, 0, 5], ["AN", 4, 1, 6]]]], "r": [[3.84381e-06, 3.84669e-06, 3.85417e-06], 0, 6.1672, 1667927683], "v": "v0.6"}
{"i": [["[\"batch_norm\", 1, 7, 7, 1152]", "cuda -keys=cuda,gpu -max_num_threads=1024 -model=unknown -thread_warp_size=32", [-1, 16, 64, 49152, 2147483647, 1024, 8, 32], "", 0, []], [[], [["CI", 2], ["FU", 4, [0, 1, 2, 3]], ["SP", 4, 0, 56448, [4], 1], ["AN", 4, 0, 5], ["AN", 4, 1, 6]]]], "r": [[1.31146e-05, 1.31151e-05, 1.3115e-05], 0, 1.00612, 1667945837], "v": "v0.6"}
{"i": [["[\"batch_norm\", 1, 7, 7, 1152]", "cuda -keys=cuda,gpu -max_num_threads=1024 -model=unknown -thread_warp_size=32", [-1, 16, 64, 49152, 2147483647, 1024, 8, 32], "", 0, []], [[], [["CI", 2], ["FU", 4, [0, 1, 2, 3]], ["SP", 4, 0, 56448, [3], 1], ["AN", 4, 0, 5], ["AN", 4, 1, 6]]]], "r": [[1.6647e-05, 1.66402e-05, 1.66474e-05], 0, 2.77067, 1667945839], "v": "v0.6"}
{"i": [["[\"batch_norm\", 1, 7, 7, 1152]", "cuda -keys=cuda,gpu -max_num_threads=1024 -model=unknown -thread_warp_size=32", [-1, 16, 64, 49152, 2147483647, 1024, 8, 32], "", 0, []], [[], [["CI", 2], ["FU", 4, [0, 1, 2, 3]], ["SP", 4, 0, 56448, [18], 1], ["AN", 4, 0, 5], ["AN", 4, 1, 6]]]], "r": [[5.22378e-06, 5.22809e-06, 5.22371e-06], 0, 2.2682, 1667945838], "v": "v0.6"}
{"i": [["[\"batch_norm\", 1, 7, 7, 1152]", "cuda -keys=cuda,gpu -max_num_threads=1024 -model=unknown -thread_warp_size=32", [-1, 16, 64, 49152, 2147483647, 1024, 8, 32], "", 0, []], [[], [["CI", 2], ["FU", 4, [0, 1, 2, 3]], ["SP", 4, 0, 56448, [2], 1], ["AN", 4, 0, 5], ["AN", 4, 1, 6]]]], "r": [[2.38144e-05, 2.38083e-05, 2.3809e-05], 0, 0.632056, 1667945836], "v": "v0.6"}
{"i": [["[\"batch_norm\", 1, 7, 7, 1152]", "cuda -keys=cuda,gpu -max_num_threads=1024 -model=unknown -thread_warp_size=32", [-1, 16, 64, 49152, 2147483647, 1024, 8, 32], "", 0, []], [[], [["CI", 2], ["FU", 4, [0, 1, 2, 3]], ["SP", 4, 0, 56448, [8], 1], ["AN", 4, 0, 5], ["AN", 4, 1, 6]]]], "r": [[8.0878e-06, 8.10196e-06, 8.09782e-06], 0, 2.00807, 1667945838], "v": "v0.6"}
{"i": [["[\"batch_norm\", 1, 7, 7, 1152]", "cuda -keys=cuda,gpu -max_num_threads=1024 -model=unknown -thread_warp_size=32", [-1, 16, 64, 49152, 2147483647, 1024, 8, 32], "", 0, []], [[], [["CI", 2], ["FU", 4, [0, 1, 2, 3]], ["SP", 4, 0, 56448, [32], 1], ["AN", 4, 0, 5], ["AN", 4, 1, 6]]]], "r": [[3.94186e-06, 3.9431e-06, 3.94471e-06], 0, 1.32279, 1667945837], "v": "v0.6"}
{"i": [["[\"batch_norm\", 1, 7, 7, 1152]", "cuda -keys=cuda,gpu -max_num_threads=1024 -model=unknown -thread_warp_size=32", [-1, 16, 64, 49152, 2147483647, 1024, 8, 32], "", 0, []], [[], [["CI", 2], ["FU", 4, [0, 1, 2, 3]], ["SP", 4, 0, 56448, [24], 1], ["AN", 4, 0, 5], ["AN", 4, 1, 6]]]], "r": [[4.36056e-06, 4.3614e-06, 4.36091e-06], 0, 1.68394, 1667945837], "v": "v0.6"}
{"i": [["[\"batch_norm\", 1, 7, 7, 1152]", "cuda -keys=cuda,gpu -max_num_threads=1024 -model=unknown -thread_warp_size=32", [-1, 16, 64, 49152, 2147483647, 1024, 8, 32], "", 0, []], [[], [["CI", 2], ["FU", 4, [0, 1, 2, 3]], ["SP", 4, 0, 56448, [63], 1], ["AN", 4, 0, 5], ["AN", 4, 1, 6]]]], "r": [[3.54417e-06, 3.55441e-06, 3.55602e-06], 0, 2.50372, 1667945838], "v": "v0.6"}
{"i": [["[\"batch_norm\", 1, 7, 7, 1152]", "cuda -keys=cuda,gpu -max_num_threads=1024 -model=unknown -thread_warp_size=32", [-1, 16, 64, 49152, 2147483647, 1024, 8, 32], "", 0, []], [[], [["CI", 2], ["FU", 4, [0, 1, 2, 3]], ["SP", 4, 0, 56448, [12], 1], ["AN", 4, 0, 5], ["AN", 4, 1, 6]]]], "r": [[6.28973e-06, 6.2922e-06, 6.29095e-06], 0, 2.9098, 1667945839], "v": "v0.6"}
{"i": [["[\"batch_norm\", 1, 7, 7, 1152]", "cuda -keys=cuda,gpu -max_num_threads=1024 -model=unknown -thread_warp_size=32", [-1, 16, 64, 49152, 2147483647, 1024, 8, 32], "", 0, []], [[], [["CI", 2], ["FU", 4, [0, 1, 2, 3]], ["SP", 4, 0, 56448, [21], 1], ["AN", 4, 0, 5], ["AN", 4, 1, 6]]]], "r": [[4.69997e-06, 4.69544e-06, 4.70092e-06], 0, 3.26564, 1667945839], "v": "v0.6"}
{"i": [["[\"batch_norm\", 1, 7, 7, 1152]", "cuda -keys=cuda,gpu -max_num_threads=1024 -model=unknown -thread_warp_size=32", [-1, 16, 64, 49152, 2147483647, 1024, 8, 32], "", 0, []], [[], [["CI", 2], ["FU", 4, [0, 1, 2, 3]], ["SP", 4, 0, 56448, [6], 1], ["AN", 4, 0, 5], ["AN", 4, 1, 6]]]], "r": [[9.62427e-06, 9.62218e-06, 9.62204e-06], 0, 3.5906, 1667945840], "v": "v0.6"}
{"i": [["[\"batch_norm\", 1, 7, 7, 1152]", "cuda -keys=cuda,gpu -max_num_threads=1024 -model=unknown -thread_warp_size=32", [-1, 16, 64, 49152, 2147483647, 1024, 8, 32], "", 0, []], [[], [["CI", 2], ["FU", 4, [0, 1, 2, 3]], ["SP", 4, 0, 56448, [7], 1], ["AN", 4, 0, 5], ["AN", 4, 1, 6]]]], "r": [[8.82795e-06, 8.82399e-06, 8.81743e-06], 0, 4.11001, 1667945840], "v": "v0.6"}
{"i": [["[\"batch_norm\", 1, 7, 7, 1152]", "cuda -keys=cuda,gpu -max_num_threads=1024 -model=unknown -thread_warp_size=32", [-1, 16, 64, 49152, 2147483647, 1024, 8, 32], "", 0, []], [[], [["CI", 2], ["FU", 4, [0, 1, 2, 3]], ["SP", 4, 0, 56448, [36], 1], ["AN", 4, 0, 5], ["AN", 4, 1, 6]]]], "r": [[3.88138e-06, 3.88059e-06, 3.88006e-06], 0, 4.89889, 1667945841], "v": "v0.6"}
{"i": [["[\"batch_norm\", 1, 7, 7, 1152]", "cuda -keys=cuda,gpu -max_num_threads=1024 -model=unknown -thread_warp_size=32", [-1, 16, 64, 49152, 2147483647, 1024, 8, 32], "", 0, []], [[], [["CI", 2], ["FU", 4, [0, 1, 2, 3]], ["SP", 4, 0, 56448, [42], 1], ["AN", 4, 0, 5], ["AN", 4, 1, 6]]]], "r": [[3.77245e-06, 3.77056e-06, 3.77179e-06], 0, 4.30613, 1667945841], "v": "v0.6"}
{"i": [["[\"batch_norm\", 1, 7, 7, 1152]", "cuda -keys=cuda,gpu -max_num_threads=1024 -model=unknown -thread_warp_size=32", [-1, 16, 64, 49152, 2147483647, 1024, 8, 32], "", 0, []], [[], [["CI", 2], ["FU", 4, [0, 1, 2, 3]], ["SP", 4, 0, 56448, [48], 1], ["AN", 4, 0, 5], ["AN", 4, 1, 6]]]], "r": [[3.42874e-06, 3.4338e-06, 3.43157e-06], 0, 4.53583, 1667945841], "v": "v0.6"}
{"i": [["[\"batch_norm\", 1, 7, 7, 1152]", "cuda -keys=cuda,gpu -max_num_threads=1024 -model=unknown -thread_warp_size=32", [-1, 16, 64, 49152, 2147483647, 1024, 8, 32], "", 0, []], [[], [["CI", 2], ["FU", 4, [0, 1, 2, 3]], ["SP", 4, 0, 56448, [16], 1], ["AN", 4, 0, 5], ["AN", 4, 1, 6]]]], "r": [[5.28366e-06, 5.28532e-06, 5.28433e-06], 0, 5.43038, 1667945842], "v": "v0.6"}
{"i": [["[\"batch_norm\", 1, 7, 7, 1152]", "cuda -keys=cuda,gpu -max_num_threads=1024 -model=unknown -thread_warp_size=32", [-1, 16, 64, 49152, 2147483647, 1024, 8, 32], "", 0, []], [[], [["CI", 2], ["FU", 4, [0, 1, 2, 3]], ["SP", 4, 0, 56448, [28], 1], ["AN", 4, 0, 5], ["AN", 4, 1, 6]]]], "r": [[4.06273e-06, 4.06424e-06, 4.06611e-06], 0, 5.20997, 1667945842], "v": "v0.6"}
{"i": [["[\"batch_norm\", 1, 7, 7, 1152]", "cuda -keys=cuda,gpu -max_num_threads=1024 -model=unknown -thread_warp_size=32", [-1, 16, 64, 49152, 2147483647, 1024, 8, 32], "", 0, []], [[], [["CI", 2], ["FU", 4, [0, 1, 2, 3]], ["SP", 4, 0, 56448, [64], 1], ["AN", 4, 0, 5], ["AN", 4, 1, 6]]]], "r": [[3.4684e-06, 3.46637e-06, 3.47266e-06], 0, 5.95351, 1667945843], "v": "v0.6"}
{"i": [["[\"batch_norm\", 1, 7, 7, 1152]", "cuda -keys=cuda,gpu -max_num_threads=1024 -model=unknown -thread_warp_size=32", [-1, 16, 64, 49152, 2147483647, 1024, 8, 32], "", 0, []], [[], [["CI", 2], ["FU", 4, [0, 1, 2, 3]], ["SP", 4, 0, 56448, [56], 1], ["AN", 4, 0, 5], ["AN", 4, 1, 6]]]], "r": [[3.63133e-06, 3.63308e-06, 3.63113e-06], 0, 5.80611, 1667945842], "v": "v0.6"}
{"i": [["[\"batch_norm\", 1, 7, 7, 1152]", "cuda -keys=cuda,gpu -max_num_threads=1024 -model=unknown -thread_warp_size=32", [-1, 16, 64, 49152, 2147483647, 1024, 8, 32], "", 0, []], [[], [["CI", 2], ["FU", 4, [0, 1, 2, 3]], ["SP", 4, 0, 56448, [14], 1], ["AN", 4, 0, 5], ["AN", 4, 1, 6]]]], "r": [[5.67062e-06, 5.67089e-06, 5.67021e-06], 0, 6.17529, 1667945843], "v": "v0.6"}
{"i": [["[\"batch_norm\", 1, 7, 7, 1152]", "cuda -keys=cuda,gpu -max_num_threads=1024 -model=unknown -thread_warp_size=32", [-1, 16, 64, 49152, 2147483647, 1024, 8, 32], "", 0, []], [[], [["CI", 2], ["FU", 4, [0, 1, 2, 3]], ["SP", 4, 0, 56448, [1], 1], ["AN", 4, 0, 5], ["AN", 4, 1, 6]]]], "r": [[4.44626e-05, 4.4474e-05, 4.44629e-05], 0, 3.83952, 1667945840], "v": "v0.6"}
{"i": [["[\"batch_norm\", 1, 7, 7, 1152]", "cuda -keys=cuda,gpu -max_num_threads=1024 -model=unknown -thread_warp_size=32", [-1, 16, 64, 49152, 2147483647, 1024, 8, 32], "", 0, []], [[], [["CI", 2], ["FU", 4, [0, 1, 2, 3]], ["SP", 4, 0, 56448, [49], 1], ["AN", 4, 0, 5], ["AN", 4, 1, 6]]]], "r": [[3.6696e-06, 3.66838e-06, 3.67024e-06], 0, 6.47648, 1667945843], "v": "v0.6"}
{"i": [["[\"batch_norm\", 1, 7, 7, 1152]", "cuda -keys=cuda,gpu -max_num_threads=1024 -model=unknown -thread_warp_size=32", [-1, 16, 64, 49152, 2147483647, 1024, 8, 32], "", 0, []], [[], [["CI", 2], ["FU", 4, [0, 1, 2, 3]], ["SP", 4, 0, 56448, [9], 1], ["AN", 4, 0, 5], ["AN", 4, 1, 6]]]], "r": [[7.32033e-06, 7.32185e-06, 7.32112e-06], 0, 6.73648, 1667945844], "v": "v0.6"}
{"i": [["[\"batch_norm\", 1, 7, 7, 1152]", "cuda -keys=cuda,gpu -max_num_threads=1024 -model=unknown -thread_warp_size=32", [-1, 16, 64, 49152, 2147483647, 1024, 8, 32], "", 0, []], [[], [["CI", 2], ["FU", 4, [0, 1, 2, 3]], ["SP", 4, 0, 56448, [12], 1], ["AN", 4, 0, 5], ["AN", 4, 1, 6]]]], "r": [[6.0998e-06, 6.09757e-06, 6.10116e-06], 0, 1.34819, 1667946206], "v": "v0.6"}
{"i": [["[\"batch_norm\", 1, 7, 7, 1152]", "cuda -keys=cuda,gpu -max_num_threads=1024 -model=unknown -thread_warp_size=32", [-1, 16, 64, 49152, 2147483647, 1024, 8, 32], "", 0, []], [[], [["CI", 2], ["FU", 4, [0, 1, 2, 3]], ["SP", 4, 0, 56448, [56], 1], ["AN", 4, 0, 5], ["AN", 4, 1, 6]]]], "r": [[3.46885e-06, 3.46871e-06, 3.47016e-06], 0, 1.0669, 1667946205], "v": "v0.6"}
{"i": [["[\"batch_norm\", 1, 7, 7, 1152]", "cuda -keys=cuda,gpu -max_num_threads=1024 -model=unknown -thread_warp_size=32", [-1, 16, 64, 49152, 2147483647, 1024, 8, 32], "", 0, []], [[], [["CI", 2], ["FU", 4, [0, 1, 2, 3]], ["SP", 4, 0, 56448, [42], 1], ["AN", 4, 0, 5], ["AN", 4, 1, 6]]]], "r": [[3.71667e-06, 3.7318e-06, 3.72331e-06], 0, 2.54338, 1667946207], "v": "v0.6"}
{"i": [["[\"batch_norm\", 1, 7, 7, 1152]", "cuda -keys=cuda,gpu -max_num_threads=1024 -model=unknown -thread_warp_size=32", [-1, 16, 64, 49152, 2147483647, 1024, 8, 32], "", 0, []], [[], [["CI", 2], ["FU", 4, [0, 1, 2, 3]], ["SP", 4, 0, 56448, [8], 1], ["AN", 4, 0, 5], ["AN", 4, 1, 6]]]], "r": [[7.9064e-06, 7.90541e-06, 7.90379e-06], 0, 2.84871, 1667946207], "v": "v0.6"}
{"i": [["[\"batch_norm\", 1, 7, 7, 1152]", "cuda -keys=cuda,gpu -max_num_threads=1024 -model=unknown -thread_warp_size=32", [-1, 16, 64, 49152, 2147483647, 1024, 8, 32], "", 0, []], [[], [["CI", 2], ["FU", 4, [0, 1, 2, 3]], ["SP", 4, 0, 56448, [1], 1], ["AN", 4, 0, 5], ["AN", 4, 1, 6]]]], "r": [[4.46043e-05, 4.46159e-05, 4.46161e-05], 0, 1.99716, 1667946206], "v": "v0.6"}
{"i": [["[\"batch_norm\", 1, 7, 7, 1152]", "cuda -keys=cuda,gpu -max_num_threads=1024 -model=unknown -thread_warp_size=32", [-1, 16, 64, 49152, 2147483647, 1024, 8, 32], "", 0, []], [[], [["CI", 2], ["FU", 4, [0, 1, 2, 3]], ["SP", 4, 0, 56448, [28], 1], ["AN", 4, 0, 5], ["AN", 4, 1, 6]]]], "r": [[4.1222e-06, 4.47003e-06, 4.12124e-06], 0, 0.584879, 1667946205], "v": "v0.6"}
{"i": [["[\"batch_norm\", 1, 7, 7, 1152]", "cuda -keys=cuda,gpu -max_num_threads=1024 -model=unknown -thread_warp_size=32", [-1, 16, 64, 49152, 2147483647, 1024, 8, 32], "", 0, []], [[], [["CI", 2], ["FU", 4, [0, 1, 2, 3]], ["SP", 4, 0, 56448, [36], 1], ["AN", 4, 0, 5], ["AN", 4, 1, 6]]]], "r": [[3.93306e-06, 3.93339e-06, 3.93343e-06], 0, 2.1613, 1667946207], "v": "v0.6"}
{"i": [["[\"batch_norm\", 1, 7, 7, 1152]", "cuda -keys=cuda,gpu -max_num_threads=1024 -model=unknown -thread_warp_size=32", [-1, 16, 64, 49152, 2147483647, 1024, 8, 32], "", 0, []], [[], [["CI", 2], ["FU", 4, [0, 1, 2, 3]], ["SP", 4, 0, 56448, [63], 1], ["AN", 4, 0, 5], ["AN", 4, 1, 6]]]], "r": [[3.67359e-06, 3.67129e-06, 3.67509e-06], 0, 1.68409, 1667946206], "v": "v0.6"}
{"i": [["[\"batch_norm\", 1, 7, 7, 1152]", "cuda -keys=cuda,gpu -max_num_threads=1024 -model=unknown -thread_warp_size=32", [-1, 16, 64, 49152, 2147483647, 1024, 8, 32], "", 0, []], [[], [["CI", 2], ["FU", 4, [0, 1, 2, 3]], ["SP", 4, 0, 56448, [49], 1], ["AN", 4, 0, 5], ["AN", 4, 1, 6]]]], "r": [[3.58629e-06, 3.58518e-06, 3.58434e-06], 0, 3.00416, 1667946208], "v": "v0.6"}
{"i": [["[\"batch_norm\", 1, 7, 7, 1152]", "cuda -keys=cuda,gpu -max_num_threads=1024 -model=unknown -thread_warp_size=32", [-1, 16, 64, 49152, 2147483647, 1024, 8, 32], "", 0, []], [[], [["CI", 2], ["FU", 4, [0, 1, 2, 3]], ["SP", 4, 0, 56448, [3], 1], ["AN", 4, 0, 5], ["AN", 4, 1, 6]]]], "r": [[1.66457e-05, 1.66493e-05, 1.6658e-05], 0, 3.25122, 1667946208], "v": "v0.6"}
{"i": [["[\"batch_norm\", 1, 7, 7, 1152]", "cuda -keys=cuda,gpu -max_num_threads=1024 -model=unknown -thread_warp_size=32", [-1, 16, 64, 49152, 2147483647, 1024, 8, 32], "", 0, []], [[], [["CI", 2], ["FU", 4, [0, 1, 2, 3]], ["SP", 4, 0, 56448, [18], 1], ["AN", 4, 0, 5], ["AN", 4, 1, 6]]]], "r": [[5.21539e-06, 5.2241e-06, 5.21332e-06], 0, 3.47231, 1667946208], "v": "v0.6"}
{"i": [["[\"batch_norm\", 1, 7, 7, 1152]", "cuda -keys=cuda,gpu -max_num_threads=1024 -model=unknown -thread_warp_size=32", [-1, 16, 64, 49152, 2147483647, 1024, 8, 32], "", 0, []], [[], [["CI", 2], ["FU", 4, [0, 1, 2, 3]], ["SP", 4, 0, 56448, [16], 1], ["AN", 4, 0, 5], ["AN", 4, 1, 6]]]], "r": [[5.24822e-06, 5.24601e-06, 5.24424e-06], 0, 3.71319, 1667946209], "v": "v0.6"}
{"i": [["[\"batch_norm\", 1, 7, 7, 1152]", "cuda -keys=cuda,gpu -max_num_threads=1024 -model=unknown -thread_warp_size=32", [-1, 16, 64, 49152, 2147483647, 1024, 8, 32], "", 0, []], [[], [["CI", 2], ["FU", 4, [0, 1, 2, 3]], ["SP", 4, 0, 56448, [64], 1], ["AN", 4, 0, 5], ["AN", 4, 1, 6]]]], "r": [[3.31754e-06, 3.30715e-06, 3.30958e-06], 0, 4.34288, 1667946209], "v": "v0.6"}
{"i": [["[\"batch_norm\", 1, 7, 7, 1152]", "cuda -keys=cuda,gpu -max_num_threads=1024 -model=unknown -thread_warp_size=32", [-1, 16, 64, 49152, 2147483647, 1024, 8, 32], "", 0, []], [[], [["CI", 2], ["FU", 4, [0, 1, 2, 3]], ["SP", 4, 0, 56448, [9], 1], ["AN", 4, 0, 5], ["AN", 4, 1, 6]]]], "r": [[7.3056e-06, 7.30319e-06, 7.30115e-06], 0, 4.57277, 1667946210], "v": "v0.6"}
{"i": [["[\"batch_norm\", 1, 7, 7, 1152]", "cuda -keys=cuda,gpu -max_num_threads=1024 -model=unknown -thread_warp_size=32", [-1, 16, 64, 49152, 2147483647, 1024, 8, 32], "", 0, []], [[], [["CI", 2], ["FU", 4, [0, 1, 2, 3]], ["SP", 4, 0, 56448, [6], 1], ["AN", 4, 0, 5], ["AN", 4, 1, 6]]]], "r": [[9.61608e-06, 9.61782e-06, 9.62201e-06], 0, 4.82268, 1667946210], "v": "v0.6"}
{"i": [["[\"batch_norm\", 1, 7, 7, 1152]", "cuda -keys=cuda,gpu -max_num_threads=1024 -model=unknown -thread_warp_size=32", [-1, 16, 64, 49152, 2147483647, 1024, 8, 32], "", 0, []], [[], [["CI", 2], ["FU", 4, [0, 1, 2, 3]], ["SP", 4, 0, 56448, [32], 1], ["AN", 4, 0, 5], ["AN", 4, 1, 6]]]], "r": [[3.82679e-06, 3.82565e-06, 3.82513e-06], 0, 5.10163, 1667946210], "v": "v0.6"}
{"i": [["[\"batch_norm\", 1, 7, 7, 1152]", "cuda -keys=cuda,gpu -max_num_threads=1024 -model=unknown -thread_warp_size=32", [-1, 16, 64, 49152, 2147483647, 1024, 8, 32], "", 0, []], [[], [["CI", 2], ["FU", 4, [0, 1, 2, 3]], ["SP", 4, 0, 56448, [48], 1], ["AN", 4, 0, 5], ["AN", 4, 1, 6]]]], "r": [[3.41254e-06, 3.41621e-06, 3.41507e-06], 0, 5.28867, 1667946211], "v": "v0.6"}
{"i": [["[\"batch_norm\", 1, 7, 7, 1152]", "cuda -keys=cuda,gpu -max_num_threads=1024 -model=unknown -thread_warp_size=32", [-1, 16, 64, 49152, 2147483647, 1024, 8, 32], "", 0, []], [[], [["CI", 2], ["FU", 4, [0, 1, 2, 3]], ["SP", 4, 0, 56448, [14], 1], ["AN", 4, 0, 5], ["AN", 4, 1, 6]]]], "r": [[5.66781e-06, 5.66531e-06, 5.66759e-06], 0, 5.71726, 1667946211], "v": "v0.6"}
{"i": [["[\"batch_norm\", 1, 7, 7, 1152]", "cuda -keys=cuda,gpu -max_num_threads=1024 -model=unknown -thread_warp_size=32", [-1, 16, 64, 49152, 2147483647, 1024, 8, 32], "", 0, []], [[], [["CI", 2], ["FU", 4, [0, 1, 2, 3]], ["SP", 4, 0, 56448, [24], 1], ["AN", 4, 0, 5], ["AN", 4, 1, 6]]]], "r": [[4.45472e-06, 4.45257e-06, 4.45585e-06], 0, 5.81203, 1667946211], "v": "v0.6"}
{"i": [["[\"batch_norm\", 1, 7, 7, 1152]", "cuda -keys=cuda,gpu -max_num_threads=1024 -model=unknown -thread_warp_size=32", [-1, 16, 64, 49152, 2147483647, 1024, 8, 32], "", 0, []], [[], [["CI", 2], ["FU", 4, [0, 1, 2, 3]], ["SP", 4, 0, 56448, [4], 1], ["AN", 4, 0, 5], ["AN", 4, 1, 6]]]], "r": [[1.31862e-05, 1.31775e-05, 1.31772e-05], 0, 4.08648, 1667946209], "v": "v0.6"}
{"i": [["[\"batch_norm\", 1, 7, 7, 1152]", "cuda -keys=cuda,gpu -max_num_threads=1024 -model=unknown -thread_warp_size=32", [-1, 16, 64, 49152, 2147483647, 1024, 8, 32], "", 0, []], [[], [["CI", 2], ["FU", 4, [0, 1, 2, 3]], ["SP", 4, 0, 56448, [7], 1], ["AN", 4, 0, 5], ["AN", 4, 1, 6]]]], "r": [[8.84357e-06, 8.83585e-06, 8.8452e-06], 0, 6.14156, 1667946212], "v": "v0.6"}
{"i": [["[\"batch_norm\", 1, 7, 7, 1152]", "cuda -keys=cuda,gpu -max_num_threads=1024 -model=unknown -thread_warp_size=32", [-1, 16, 64, 49152, 2147483647, 1024, 8, 32], "", 0, []], [[], [["CI", 2], ["FU", 4, [0, 1, 2, 3]], ["SP", 4, 0, 56448, [2], 1], ["AN", 4, 0, 5], ["AN", 4, 1, 6]]]], "r": [[2.37271e-05, 2.37284e-05, 2.37227e-05], 0, 6.39812, 1667946212], "v": "v0.6"}
{"i": [["[\"batch_norm\", 1, 7, 7, 1152]", "cuda -keys=cuda,gpu -max_num_threads=1024 -model=unknown -thread_warp_size=32", [-1, 16, 64, 49152, 2147483647, 1024, 8, 32], "", 0, []], [[], [["CI", 2], ["FU", 4, [0, 1, 2, 3]], ["SP", 4, 0, 56448, [21], 1], ["AN", 4, 0, 5], ["AN", 4, 1, 6]]]], "r": [[4.73029e-06, 4.7266e-06, 4.73161e-06], 0, 6.64757, 1667946212], "v": "v0.6"}
{"i": [["[\"batch_norm\", 1, 7, 7, 1152]", "cuda -keys=cuda,gpu -max_num_threads=1024 -model=unknown -thread_warp_size=32", [-1, 16, 64, 49152, 2147483647, 1024, 8, 32], "", 0, []], [[], [["CI", 2], ["FU", 4, [0, 1, 2, 3]], ["SP", 4, 0, 56448, [16], 1], ["AN", 4, 0, 5], ["AN", 4, 1, 6]]]], "r": [[5.29408e-06, 5.29501e-06, 5.29132e-06], 0, 0.549404, 1667947477], "v": "v0.6"}
{"i": [["[\"batch_norm\", 1, 7, 7, 1152]", "cuda -keys=cuda,gpu -max_num_threads=1024 -model=unknown -thread_warp_size=32", [-1, 16, 64, 49152, 2147483647, 1024, 8, 32], "", 0, []], [[], [["CI", 2], ["FU", 4, [0, 1, 2, 3]], ["SP", 4, 0, 56448, [1], 1], ["AN", 4, 0, 5], ["AN", 4, 1, 6]]]], "r": [[4.45203e-05, 4.45323e-05, 4.45171e-05], 0, 2.43348, 1667947479], "v": "v0.6"}
{"i": [["[\"batch_norm\", 1, 7, 7, 1152]", "cuda -keys=cuda,gpu -max_num_threads=1024 -model=unknown -thread_warp_size=32", [-1, 16, 64, 49152, 2147483647, 1024, 8, 32], "", 0, []], [[], [["CI", 2], ["FU", 4, [0, 1, 2, 3]], ["SP", 4, 0, 56448, [2], 1], ["AN", 4, 0, 5], ["AN", 4, 1, 6]]]], "r": [[2.38152e-05, 2.38106e-05, 2.38126e-05], 0, 1.15689, 1667947477], "v": "v0.6"}
{"i": [["[\"batch_norm\", 1, 7, 7, 1152]", "cuda -keys=cuda,gpu -max_num_threads=1024 -model=unknown -thread_warp_size=32", [-1, 16, 64, 49152, 2147483647, 1024, 8, 32], "", 0, []], [[], [["CI", 2], ["FU", 4, [0, 1, 2, 3]], ["SP", 4, 0, 56448, [6], 1], ["AN", 4, 0, 5], ["AN", 4, 1, 6]]]], "r": [[9.75214e-06, 9.74809e-06, 9.75148e-06], 0, 1.81124, 1667947478], "v": "v0.6"}
{"i": [["[\"batch_norm\", 1, 7, 7, 1152]", "cuda -keys=cuda,gpu -max_num_threads=1024 -model=unknown -thread_warp_size=32", [-1, 16, 64, 49152, 2147483647, 1024, 8, 32], "", 0, []], [[], [["CI", 2], ["FU", 4, [0, 1, 2, 3]], ["SP", 4, 0, 56448, [28], 1], ["AN", 4, 0, 5], ["AN", 4, 1, 6]]]], "r": [[4.11274e-06, 4.11814e-06, 4.12225e-06], 0, 2.71973, 1667947479], "v": "v0.6"}
{"i": [["[\"batch_norm\", 1, 7, 7, 1152]", "cuda -keys=cuda,gpu -max_num_threads=1024 -model=unknown -thread_warp_size=32", [-1, 16, 64, 49152, 2147483647, 1024, 8, 32], "", 0, []], [[], [["CI", 2], ["FU", 4, [0, 1, 2, 3]], ["SP", 4, 0, 56448, [7], 1], ["AN", 4, 0, 5], ["AN", 4, 1, 6]]]], "r": [[8.68302e-06, 8.68602e-06, 8.687e-06], 0, 3.02002, 1667947479], "v": "v0.6"}
{"i": [["[\"batch_norm\", 1, 7, 7, 1152]", "cuda -keys=cuda,gpu -max_num_threads=1024 -model=unknown -thread_warp_size=32", [-1, 16, 64, 49152, 2147483647, 1024, 8, 32], "", 0, []], [[], [["CI", 2], ["FU", 4, [0, 1, 2, 3]], ["SP", 4, 0, 56448, [8], 1], ["AN", 4, 0, 5], ["AN", 4, 1, 6]]]], "r": [[7.95507e-06, 7.95502e-06, 7.95724e-06], 0, 1.48435, 1667947478], "v": "v0.6"}
{"i": [["[\"batch_norm\", 1, 7, 7, 1152]", "cuda -keys=cuda,gpu -max_num_threads=1024 -model=unknown -thread_warp_size=32", [-1, 16, 64, 49152, 2147483647, 1024, 8, 32], "", 0, []], [[], [["CI", 2], ["FU", 4, [0, 1, 2, 3]], ["SP", 4, 0, 56448, [32], 1], ["AN", 4, 0, 5], ["AN", 4, 1, 6]]]], "r": [[3.80116e-06, 3.8019e-06, 3.80368e-06], 0, 0.935154, 1667947477], "v": "v0.6"}
{"i": [["[\"batch_norm\", 1, 7, 7, 1152]", "cuda -keys=cuda,gpu -max_num_threads=1024 -model=unknown -thread_warp_size=32", [-1, 16, 64, 49152, 2147483647, 1024, 8, 32], "", 0, []], [[], [["CI", 2], ["FU", 4, [0, 1, 2, 3]], ["SP", 4, 0, 56448, [14], 1], ["AN", 4, 0, 5], ["AN", 4, 1, 6]]]], "r": [[5.56559e-06, 5.56086e-06, 5.56177e-06], 0, 2.14213, 1667947478], "v": "v0.6"}
{"i": [["[\"batch_norm\", 1, 7, 7, 1152]", "cuda -keys=cuda,gpu -max_num_threads=1024 -model=unknown -thread_warp_size=32", [-1, 16, 64, 49152, 2147483647, 1024, 8, 32], "", 0, []], [[], [["CI", 2], ["FU", 4, [0, 1, 2, 3]], ["SP", 4, 0, 56448, [4], 1], ["AN", 4, 0, 5], ["AN", 4, 1, 6]]]], "r": [[1.32832e-05, 1.32759e-05, 1.32684e-05], 0, 3.32219, 1667947480], "v": "v0.6"}
{"i": [["[\"batch_norm\", 1, 7, 7, 1152]", "cuda -keys=cuda,gpu -max_num_threads=1024 -model=unknown -thread_warp_size=32", [-1, 16, 64, 49152, 2147483647, 1024, 8, 32], "", 0, []], [[], [["CI", 2], ["FU", 4, [0, 1, 2, 3]], ["SP", 4, 0, 56448, [48], 1], ["AN", 4, 0, 5], ["AN", 4, 1, 6]]]], "r": [[3.56488e-06, 3.55941e-06, 3.55846e-06], 0, 3.85756, 1667947480], "v": "v0.6"}
{"i": [["[\"batch_norm\", 1, 7, 7, 1152]", "cuda -keys=cuda,gpu -max_num_threads=1024 -model=unknown -thread_warp_size=32", [-1, 16, 64, 49152, 2147483647, 1024, 8, 32], "", 0, []], [[], [["CI", 2], ["FU", 4, [0, 1, 2, 3]], ["SP", 4, 0, 56448, [9], 1], ["AN", 4, 0, 5], ["AN", 4, 1, 6]]]], "r": [[7.30044e-06, 7.30944e-06, 7.30359e-06], 0, 4.08569, 1667947481], "v": "v0.6"}
{"i": [["[\"batch_norm\", 1, 7, 7, 1152]", "cuda -keys=cuda,gpu -max_num_threads=1024 -model=unknown -thread_warp_size=32", [-1, 16, 64, 49152, 2147483647, 1024, 8, 32], "", 0, []], [[], [["CI", 2], ["FU", 4, [0, 1, 2, 3]], ["SP", 4, 0, 56448, [18], 1], ["AN", 4, 0, 5], ["AN", 4, 1, 6]]]], "r": [[5.03744e-06, 5.03483e-06, 5.04199e-06], 0, 4.30583, 1667947481], "v": "v0.6"}
{"i": [["[\"batch_norm\", 1, 7, 7, 1152]", "cuda -keys=cuda,gpu -max_num_threads=1024 -model=unknown -thread_warp_size=32", [-1, 16, 64, 49152, 2147483647, 1024, 8, 32], "", 0, []], [[], [["CI", 2], ["FU", 4, [0, 1, 2, 3]], ["SP", 4, 0, 56448, [64], 1], ["AN", 4, 0, 5], ["AN", 4, 1, 6]]]], "r": [[3.4654e-06, 3.46664e-06, 3.47007e-06], 0, 4.56437, 1667947481], "v": "v0.6"}
{"i": [["[\"batch_norm\", 1, 7, 7, 1152]", "cuda -keys=cuda,gpu -max_num_threads=1024 -model=unknown -thread_warp_size=32", [-1, 16, 64, 49152, 2147483647, 1024, 8, 32], "", 0, []], [[], [["CI", 2], ["FU", 4, [0, 1, 2, 3]], ["SP", 4, 0, 56448, [63], 1], ["AN", 4, 0, 5], ["AN", 4, 1, 6]]]], "r": [[3.44058e-06, 3.4391e-06, 3.44098e-06], 0, 4.97098, 1667947482], "v": "v0.6"}
{"i": [["[\"batch_norm\", 1, 7, 7, 1152]", "cuda -keys=cuda,gpu -max_num_threads=1024 -model=unknown -thread_warp_size=32", [-1, 16, 64, 49152, 2147483647, 1024, 8, 32], "", 0, []], [[], [["CI", 2], ["FU", 4, [0, 1, 2, 3]], ["SP", 4, 0, 56448, [3], 1], ["AN", 4, 0, 5], ["AN", 4, 1, 6]]]], "r": [[1.66351e-05, 1.66581e-05, 1.66427e-05], 0, 4.8163, 1667947482], "v": "v0.6"}
{"i": [["[\"batch_norm\", 1, 7, 7, 1152]", "cuda -keys=cuda,gpu -max_num_threads=1024 -model=unknown -thread_warp_size=32", [-1, 16, 64, 49152, 2147483647, 1024, 8, 32], "", 0, []], [[], [["CI", 2], ["FU", 4, [0, 1, 2, 3]], ["SP", 4, 0, 56448, [21], 1], ["AN", 4, 0, 5], ["AN", 4, 1, 6]]]], "r": [[4.83532e-06, 4.83825e-06, 4.8334e-06], 0, 5.33087, 1667947482], "v": "v0.6"}
{"i": [["[\"batch_norm\", 1, 7, 7, 1152]", "cuda -keys=cuda,gpu -max_num_threads=1024 -model=unknown -thread_warp_size=32", [-1, 16, 64, 49152, 2147483647, 1024, 8, 32], "", 0, []], [[], [["CI", 2], ["FU", 4, [0, 1, 2, 3]], ["SP", 4, 0, 56448, [12], 1], ["AN", 4, 0, 5], ["AN", 4, 1, 6]]]], "r": [[6.11706e-06, 6.11372e-06, 6.11123e-06], 0, 5.58898, 1667947483], "v": "v0.6"}
{"i": [["[\"batch_norm\", 1, 7, 7, 1152]", "cuda -keys=cuda,gpu -max_num_threads=1024 -model=unknown -thread_warp_size=32", [-1, 16, 64, 49152, 2147483647, 1024, 8, 32], "", 0, []], [[], [["CI", 2], ["FU", 4, [0, 1, 2, 3]], ["SP", 4, 0, 56448, [36], 1], ["AN", 4, 0, 5], ["AN", 4, 1, 6]]]], "r": [[3.99573e-06, 3.99298e-06, 3.99697e-06], 0, 5.83261, 1667947483], "v": "v0.6"}
{"i": [["[\"batch_norm\", 1, 7, 7, 1152]", "cuda -keys=cuda,gpu -max_num_threads=1024 -model=unknown -thread_warp_size=32", [-1, 16, 64, 49152, 2147483647, 1024, 8, 32], "", 0, []], [[], [["CI", 2], ["FU", 4, [0, 1, 2, 3]], ["SP", 4, 0, 56448, [56], 1], ["AN", 4, 0, 5], ["AN", 4, 1, 6]]]], "r": [[3.47324e-06, 3.477e-06, 3.48169e-06], 0, 3.50612, 1667947480], "v": "v0.6"}
{"i": [["[\"batch_norm\", 1, 7, 7, 1152]", "cuda -keys=cuda,gpu -max_num_threads=1024 -model=unknown -thread_warp_size=32", [-1, 16, 64, 49152, 2147483647, 1024, 8, 32], "", 0, []], [[], [["CI", 2], ["FU", 4, [0, 1, 2, 3]], ["SP", 4, 0, 56448, [24], 1], ["AN", 4, 0, 5], ["AN", 4, 1, 6]]]], "r": [[4.32581e-06, 4.32932e-06, 4.32219e-06], 0, 6.19866, 1667947483], "v": "v0.6"}
{"i": [["[\"batch_norm\", 1, 7, 7, 1152]", "cuda -keys=cuda,gpu -max_num_threads=1024 -model=unknown -thread_warp_size=32", [-1, 16, 64, 49152, 2147483647, 1024, 8, 32], "", 0, []], [[], [["CI", 2], ["FU", 4, [0, 1, 2, 3]], ["SP", 4, 0, 56448, [49], 1], ["AN", 4, 0, 5], ["AN", 4, 1, 6]]]], "r": [[3.57258e-06, 3.56986e-06, 3.57403e-06], 0, 6.4253, 1667947483], "v": "v0.6"}
{"i": [["[\"batch_norm\", 1, 7, 7, 1152]", "cuda -keys=cuda,gpu -max_num_threads=1024 -model=unknown -thread_warp_size=32", [-1, 16, 64, 49152, 2147483647, 1024, 8, 32], "", 0, []], [[], [["CI", 2], ["FU", 4, [0, 1, 2, 3]], ["SP", 4, 0, 56448, [42], 1], ["AN", 4, 0, 5], ["AN", 4, 1, 6]]]], "r": [[3.72194e-06, 3.72084e-06, 3.71916e-06], 0, 6.68688, 1667947484], "v": "v0.6"}
{"i": [["[\"batch_norm\", 1, 7, 7, 1152]", "cuda -keys=cuda,gpu -max_num_threads=1024 -model=unknown -thread_warp_size=32", [-1, 16, 64, 49152, 2147483647, 1024, 8, 32], "", 0, []], [[], [["CI", 2], ["FU", 4, [0, 1, 2, 3]], ["SP", 4, 0, 56448, [12], 1], ["AN", 4, 0, 5], ["AN", 4, 1, 6]]]], "r": [[6.12018e-06, 6.11462e-06, 1.06699e-05], 0, 0.952809, 1667947527], "v": "v0.6"}
{"i": [["[\"batch_norm\", 1, 7, 7, 1152]", "cuda -keys=cuda,gpu -max_num_threads=1024 -model=unknown -thread_warp_size=32", [-1, 16, 64, 49152, 2147483647, 1024, 8, 32], "", 0, []], [[], [["CI", 2], ["FU", 4, [0, 1, 2, 3]], ["SP", 4, 0, 56448, [63], 1], ["AN", 4, 0, 5], ["AN", 4, 1, 6]]]], "r": [[3.46811e-06, 3.46756e-06, 3.47152e-06], 0, 1.8276, 1667947528], "v": "v0.6"}
{"i": [["[\"batch_norm\", 1, 7, 7, 1152]", "cuda -keys=cuda,gpu -max_num_threads=1024 -model=unknown -thread_warp_size=32", [-1, 16, 64, 49152, 2147483647, 1024, 8, 32], "", 0, []], [[], [["CI", 2], ["FU", 4, [0, 1, 2, 3]], ["SP", 4, 0, 56448, [48], 1], ["AN", 4, 0, 5], ["AN", 4, 1, 6]]]], "r": [[3.71332e-06, 3.72168e-06, 3.72198e-06], 0, 1.2556, 1667947527], "v": "v0.6"}
{"i": [["[\"batch_norm\", 1, 7, 7, 1152]", "cuda -keys=cuda,gpu -max_num_threads=1024 -model=unknown -thread_warp_size=32", [-1, 16, 64, 49152, 2147483647, 1024, 8, 32], "", 0, []], [[], [["CI", 2], ["FU", 4, [0, 1, 2, 3]], ["SP", 4, 0, 56448, [7], 1], ["AN", 4, 0, 5], ["AN", 4, 1, 6]]]], "r": [[8.62322e-06, 8.61963e-06, 8.62167e-06], 0, 2.38399, 1667947529], "v": "v0.6"}
{"i": [["[\"batch_norm\", 1, 7, 7, 1152]", "cuda -keys=cuda,gpu -max_num_threads=1024 -model=unknown -thread_warp_size=32", [-1, 16, 64, 49152, 2147483647, 1024, 8, 32], "", 0, []], [[], [["CI", 2], ["FU", 4, [0, 1, 2, 3]], ["SP", 4, 0, 56448, [21], 1], ["AN", 4, 0, 5], ["AN", 4, 1, 6]]]], "r": [[4.65836e-06, 4.66123e-06, 4.6532e-06], 0, 0.609411, 1667947527], "v": "v0.6"}
{"i": [["[\"batch_norm\", 1, 7, 7, 1152]", "cuda -keys=cuda,gpu -max_num_threads=1024 -model=unknown -thread_warp_size=32", [-1, 16, 64, 49152, 2147483647, 1024, 8, 32], "", 0, []], [[], [["CI", 2], ["FU", 4, [0, 1, 2, 3]], ["SP", 4, 0, 56448, [3], 1], ["AN", 4, 0, 5], ["AN", 4, 1, 6]]]], "r": [[1.67948e-05, 1.67843e-05, 1.67834e-05], 0, 2.04039, 1667947528], "v": "v0.6"}
{"i": [["[\"batch_norm\", 1, 7, 7, 1152]", "cuda -keys=cuda,gpu -max_num_threads=1024 -model=unknown -thread_warp_size=32", [-1, 16, 64, 49152, 2147483647, 1024, 8, 32], "", 0, []], [[], [["CI", 2], ["FU", 4, [0, 1, 2, 3]], ["SP", 4, 0, 56448, [6], 1], ["AN", 4, 0, 5], ["AN", 4, 1, 6]]]], "r": [[9.64599e-06, 9.64389e-06, 9.64359e-06], 0, 1.64422, 1667947528], "v": "v0.6"}
{"i": [["[\"batch_norm\", 1, 7, 7, 1152]", "cuda -keys=cuda,gpu -max_num_threads=1024 -model=unknown -thread_warp_size=32", [-1, 16, 64, 49152, 2147483647, 1024, 8, 32], "", 0, []], [[], [["CI", 2], ["FU", 4, [0, 1, 2, 3]], ["SP", 4, 0, 56448, [24], 1], ["AN", 4, 0, 5], ["AN", 4, 1, 6]]]], "r": [[4.45314e-06, 4.44206e-06, 4.44426e-06], 0, 2.71833, 1667947529], "v": "v0.6"}
{"i": [["[\"batch_norm\", 1, 7, 7, 1152]", "cuda -keys=cuda,gpu -max_num_threads=1024 -model=unknown -thread_warp_size=32", [-1, 16, 64, 49152, 2147483647, 1024, 8, 32], "", 0, []], [[], [["CI", 2], ["FU", 4, [0, 1, 2, 3]], ["SP", 4, 0, 56448, [42], 1], ["AN", 4, 0, 5], ["AN", 4, 1, 6]]]], "r": [[3.59301e-06, 3.58978e-06, 3.59297e-06], 0, 2.82153, 1667947529], "v": "v0.6"}
{"i": [["[\"batch_norm\", 1, 7, 7, 1152]", "cuda -keys=cuda,gpu -max_num_threads=1024 -model=unknown -thread_warp_size=32", [-1, 16, 64, 49152, 2147483647, 1024, 8, 32], "", 0, []], [[], [["CI", 2], ["FU", 4, [0, 1, 2, 3]], ["SP", 4, 0, 56448, [18], 1], ["AN", 4, 0, 5], ["AN", 4, 1, 6]]]], "r": [[5.1558e-06, 5.15144e-06, 5.15607e-06], 0, 3.10849, 1667947530], "v": "v0.6"}
{"i": [["[\"batch_norm\", 1, 7, 7, 1152]", "cuda -keys=cuda,gpu -max_num_threads=1024 -model=unknown -thread_warp_size=32", [-1, 16, 64, 49152, 2147483647, 1024, 8, 32], "", 0, []], [[], [["CI", 2], ["FU", 4, [0, 1, 2, 3]], ["SP", 4, 0, 56448, [9], 1], ["AN", 4, 0, 5], ["AN", 4, 1, 6]]]], "r": [[7.28754e-06, 7.28767e-06, 7.28423e-06], 0, 3.69641, 1667947530], "v": "v0.6"}
{"i": [["[\"batch_norm\", 1, 7, 7, 1152]", "cuda -keys=cuda,gpu -max_num_threads=1024 -model=unknown -thread_warp_size=32", [-1, 16, 64, 49152, 2147483647, 1024, 8, 32], "", 0, []], [[], [["CI", 2], ["FU", 4, [0, 1, 2, 3]], ["SP", 4, 0, 56448, [8], 1], ["AN", 4, 0, 5], ["AN", 4, 1, 6]]]], "r": [[7.93113e-06, 7.9296e-06, 7.92953e-06], 0, 3.90486, 1667947531], "v": "v0.6"}
{"i": [["[\"batch_norm\", 1, 7, 7, 1152]", "cuda -keys=cuda,gpu -max_num_threads=1024 -model=unknown -thread_warp_size=32", [-1, 16, 64, 49152, 2147483647, 1024, 8, 32], "", 0, []], [[], [["CI", 2], ["FU", 4, [0, 1, 2, 3]], ["SP", 4, 0, 56448, [56], 1], ["AN", 4, 0, 5], ["AN", 4, 1, 6]]]], "r": [[3.49238e-06, 3.49092e-06, 3.49587e-06], 0, 4.17037, 1667947531], "v": "v0.6"}
{"i": [["[\"batch_norm\", 1, 7, 7, 1152]", "cuda -keys=cuda,gpu -max_num_threads=1024 -model=unknown -thread_warp_size=32", [-1, 16, 64, 49152, 2147483647, 1024, 8, 32], "", 0, []], [[], [["CI", 2], ["FU", 4, [0, 1, 2, 3]], ["SP", 4, 0, 56448, [64], 1], ["AN", 4, 0, 5], ["AN", 4, 1, 6]]]], "r": [[3.34199e-06, 3.34355e-06, 3.3486e-06], 0, 4.43263, 1667947531], "v": "v0.6"}
{"i": [["[\"batch_norm\", 1, 7, 7, 1152]", "cuda -keys=cuda,gpu -max_num_threads=1024 -model=unknown -thread_warp_size=32", [-1, 16, 64, 49152, 2147483647, 1024, 8, 32], "", 0, []], [[], [["CI", 2], ["FU", 4, [0, 1, 2, 3]], ["SP", 4, 0, 56448, [32], 1], ["AN", 4, 0, 5], ["AN", 4, 1, 6]]]], "r": [[3.91934e-06, 3.92008e-06, 3.92143e-06], 0, 4.67582, 1667947532], "v": "v0.6"}
{"i": [["[\"batch_norm\", 1, 7, 7, 1152]", "cuda -keys=cuda,gpu -max_num_threads=1024 -model=unknown -thread_warp_size=32", [-1, 16, 64, 49152, 2147483647, 1024, 8, 32], "", 0, []], [[], [["CI", 2], ["FU", 4, [0, 1, 2, 3]], ["SP", 4, 0, 56448, [2], 1], ["AN", 4, 0, 5], ["AN", 4, 1, 6]]]], "r": [[2.36096e-05, 2.36103e-05, 2.36111e-05], 0, 4.91918, 1667947532], "v": "v0.6"}
{"i": [["[\"batch_norm\", 1, 7, 7, 1152]", "cuda -keys=cuda,gpu -max_num_threads=1024 -model=unknown -thread_warp_size=32", [-1, 16, 64, 49152, 2147483647, 1024, 8, 32], "", 0, []], [[], [["CI", 2], ["FU", 4, [0, 1, 2, 3]], ["SP", 4, 0, 56448, [28], 1], ["AN", 4, 0, 5], ["AN", 4, 1, 6]]]], "r": [[4.15696e-06, 4.15398e-06, 4.15749e-06], 0, 5.17263, 1667947532], "v": "v0.6"}
{"i": [["[\"batch_norm\", 1, 7, 7, 1152]", "cuda -keys=cuda,gpu -max_num_threads=1024 -model=unknown -thread_warp_size=32", [-1, 16, 64, 49152, 2147483647, 1024, 8, 32], "", 0, []], [[], [["CI", 2], ["FU", 4, [0, 1, 2, 3]], ["SP", 4, 0, 56448, [1], 1], ["AN", 4, 0, 5], ["AN", 4, 1, 6]]]], "r": [[4.46218e-05, 4.46212e-05, 4.46179e-05], 0, 5.56082, 1667947533], "v": "v0.6"}
{"i": [["[\"batch_norm\", 1, 7, 7, 1152]", "cuda -keys=cuda,gpu -max_num_threads=1024 -model=unknown -thread_warp_size=32", [-1, 16, 64, 49152, 2147483647, 1024, 8, 32], "", 0, []], [[], [["CI", 2], ["FU", 4, [0, 1, 2, 3]], ["SP", 4, 0, 56448, [49], 1], ["AN", 4, 0, 5], ["AN", 4, 1, 6]]]], "r": [[3.68985e-06, 3.69185e-06, 3.68841e-06], 0, 5.83487, 1667947533], "v": "v0.6"}
{"i": [["[\"batch_norm\", 1, 7, 7, 1152]", "cuda -keys=cuda,gpu -max_num_threads=1024 -model=unknown -thread_warp_size=32", [-1, 16, 64, 49152, 2147483647, 1024, 8, 32], "", 0, []], [[], [["CI", 2], ["FU", 4, [0, 1, 2, 3]], ["SP", 4, 0, 56448, [4], 1], ["AN", 4, 0, 5], ["AN", 4, 1, 6]]]], "r": [[1.32901e-05, 1.32899e-05, 1.32737e-05], 0, 3.44459, 1667947530], "v": "v0.6"}
{"i": [["[\"batch_norm\", 1, 7, 7, 1152]", "cuda -keys=cuda,gpu -max_num_threads=1024 -model=unknown -thread_warp_size=32", [-1, 16, 64, 49152, 2147483647, 1024, 8, 32], "", 0, []], [[], [["CI", 2], ["FU", 4, [0, 1, 2, 3]], ["SP", 4, 0, 56448, [14], 1], ["AN", 4, 0, 5], ["AN", 4, 1, 6]]]], "r": [[5.60747e-06, 5.6053e-06, 5.60602e-06], 0, 5.97203, 1667947533], "v": "v0.6"}
{"i": [["[\"batch_norm\", 1, 7, 7, 1152]", "cuda -keys=cuda,gpu -max_num_threads=1024 -model=unknown -thread_warp_size=32", [-1, 16, 64, 49152, 2147483647, 1024, 8, 32], "", 0, []], [[], [["CI", 2], ["FU", 4, [0, 1, 2, 3]], ["SP", 4, 0, 56448, [36], 1], ["AN", 4, 0, 5], ["AN", 4, 1, 6]]]], "r": [[3.76614e-06, 3.77076e-06, 3.77059e-06], 0, 6.25711, 1667947534], "v": "v0.6"}
{"i": [["[\"batch_norm\", 1, 7, 7, 1152]", "cuda -keys=cuda,gpu -max_num_threads=1024 -model=unknown -thread_warp_size=32", [-1, 16, 64, 49152, 2147483647, 1024, 8, 32], "", 0, []], [[], [["CI", 2], ["FU", 4, [0, 1, 2, 3]], ["SP", 4, 0, 56448, [16], 1], ["AN", 4, 0, 5], ["AN", 4, 1, 6]]]], "r": [[5.30524e-06, 5.30725e-06, 5.29883e-06], 0, 6.49203, 1667947534], "v": "v0.6"}
{"i": [["[\"batch_norm\", 1, 7, 7, 1152]", "cuda -keys=cuda,gpu -max_num_threads=1024 -model=unknown -thread_warp_size=32", [-1, 16, 64, 49152, 2147483647, 1024, 8, 32], "", 0, []], [[], [["CI", 2], ["FU", 4, [0, 1, 2, 3]], ["SP", 4, 0, 56448, [6], 1], ["AN", 4, 0, 5], ["AN", 4, 1, 6]]]], "r": [[9.88307e-06, 9.88529e-06, 9.87524e-06], 0, 1.83779, 1667947599], "v": "v0.6"}
{"i": [["[\"batch_norm\", 1, 7, 7, 1152]", "cuda -keys=cuda,gpu -max_num_threads=1024 -model=unknown -thread_warp_size=32", [-1, 16, 64, 49152, 2147483647, 1024, 8, 32], "", 0, []], [[], [["CI", 2], ["FU", 4, [0, 1, 2, 3]], ["SP", 4, 0, 56448, [16], 1], ["AN", 4, 0, 5], ["AN", 4, 1, 6]]]], "r": [[5.2913e-06, 5.29413e-06, 5.2853e-06], 0, 0.573324, 1667947598], "v": "v0.6"}
{"i": [["[\"batch_norm\", 1, 7, 7, 1152]", "cuda -keys=cuda,gpu -max_num_threads=1024 -model=unknown -thread_warp_size=32", [-1, 16, 64, 49152, 2147483647, 1024, 8, 32], "", 0, []], [[], [["CI", 2], ["FU", 4, [0, 1, 2, 3]], ["SP", 4, 0, 56448, [18], 1], ["AN", 4, 0, 5], ["AN", 4, 1, 6]]]], "r": [[4.97857e-06, 4.98411e-06, 4.97979e-06], 0, 1.52858, 1667947599], "v": "v0.6"}
{"i": [["[\"batch_norm\", 1, 7, 7, 1152]", "cuda -keys=cuda,gpu -max_num_threads=1024 -model=unknown -thread_warp_size=32", [-1, 16, 64, 49152, 2147483647, 1024, 8, 32], "", 0, []], [[], [["CI", 2], ["FU", 4, [0, 1, 2, 3]], ["SP", 4, 0, 56448, [28], 1], ["AN", 4, 0, 5], ["AN", 4, 1, 6]]]], "r": [[4.07522e-06, 4.07169e-06, 4.07733e-06], 0, 2.46004, 1667947600], "v": "v0.6"}
{"i": [["[\"batch_norm\", 1, 7, 7, 1152]", "cuda -keys=cuda,gpu -max_num_threads=1024 -model=unknown -thread_warp_size=32", [-1, 16, 64, 49152, 2147483647, 1024, 8, 32], "", 0, []], [[], [["CI", 2], ["FU", 4, [0, 1, 2, 3]], ["SP", 4, 0, 56448, [4], 1], ["AN", 4, 0, 5], ["AN", 4, 1, 6]]]], "r": [[1.3172e-05, 1.31708e-05, 1.31753e-05], 0, 2.11915, 1667947599], "v": "v0.6"}
{"i": [["[\"batch_norm\", 1, 7, 7, 1152]", "cuda -keys=cuda,gpu -max_num_threads=1024 -model=unknown -thread_warp_size=32", [-1, 16, 64, 49152, 2147483647, 1024, 8, 32], "", 0, []], [[], [["CI", 2], ["FU", 4, [0, 1, 2, 3]], ["SP", 4, 0, 56448, [14], 1], ["AN", 4, 0, 5], ["AN", 4, 1, 6]]]], "r": [[5.68025e-06, 5.67844e-06, 5.68038e-06], 0, 0.93989, 1667947598], "v": "v0.6"}
{"i": [["[\"batch_norm\", 1, 7, 7, 1152]", "cuda -keys=cuda,gpu -max_num_threads=1024 -model=unknown -thread_warp_size=32", [-1, 16, 64, 49152, 2147483647, 1024, 8, 32], "", 0, []], [[], [["CI", 2], ["FU", 4, [0, 1, 2, 3]], ["SP", 4, 0, 56448, [48], 1], ["AN", 4, 0, 5], ["AN", 4, 1, 6]]]], "r": [[3.68555e-06, 3.68395e-06, 3.68706e-06], 0, 1.207, 1667947598], "v": "v0.6"}
{"i": [["[\"batch_norm\", 1, 7, 7, 1152]", "cuda -keys=cuda,gpu -max_num_threads=1024 -model=unknown -thread_warp_size=32", [-1, 16, 64, 49152, 2147483647, 1024, 8, 32], "", 0, []], [[], [["CI", 2], ["FU", 4, [0, 1, 2, 3]], ["SP", 4, 0, 56448, [1], 1], ["AN", 4, 0, 5], ["AN", 4, 1, 6]]]], "r": [[4.45262e-05, 4.45369e-05, 4.45274e-05], 0, 2.69971, 1667947600], "v": "v0.6"}
{"i": [["[\"batch_norm\", 1, 7, 7, 1152]", "cuda -keys=cuda,gpu -max_num_threads=1024 -model=unknown -thread_warp_size=32", [-1, 16, 64, 49152, 2147483647, 1024, 8, 32], "", 0, []], [[], [["CI", 2], ["FU", 4, [0, 1, 2, 3]], ["SP", 4, 0, 56448, [32], 1], ["AN", 4, 0, 5], ["AN", 4, 1, 6]]]], "r": [[3.99997e-06, 3.99268e-06, 3.99368e-06], 0, 2.97925, 1667947600], "v": "v0.6"}
{"i": [["[\"batch_norm\", 1, 7, 7, 1152]", "cuda -keys=cuda,gpu -max_num_threads=1024 -model=unknown -thread_warp_size=32", [-1, 16, 64, 49152, 2147483647, 1024, 8, 32], "", 0, []], [[], [["CI", 2], ["FU", 4, [0, 1, 2, 3]], ["SP", 4, 0, 56448, [49], 1], ["AN", 4, 0, 5], ["AN", 4, 1, 6]]]], "r": [[3.72342e-06, 3.72481e-06, 3.72939e-06], 0, 3.51282, 1667947601], "v": "v0.6"}
{"i": [["[\"batch_norm\", 1, 7, 7, 1152]", "cuda -keys=cuda,gpu -max_num_threads=1024 -model=unknown -thread_warp_size=32", [-1, 16, 64, 49152, 2147483647, 1024, 8, 32], "", 0, []], [[], [["CI", 2], ["FU", 4, [0, 1, 2, 3]], ["SP", 4, 0, 56448, [24], 1], ["AN", 4, 0, 5], ["AN", 4, 1, 6]]]], "r": [[4.36915e-06, 4.36705e-06, 4.3647e-06], 0, 3.69589, 1667947601], "v": "v0.6"}
{"i": [["[\"batch_norm\", 1, 7, 7, 1152]", "cuda -keys=cuda,gpu -max_num_threads=1024 -model=unknown -thread_warp_size=32", [-1, 16, 64, 49152, 2147483647, 1024, 8, 32], "", 0, []], [[], [["CI", 2], ["FU", 4, [0, 1, 2, 3]], ["SP", 4, 0, 56448, [42], 1], ["AN", 4, 0, 5], ["AN", 4, 1, 6]]]], "r": [[3.74873e-06, 3.74922e-06, 3.74973e-06], 0, 4.00437, 1667947602], "v": "v0.6"}
{"i": [["[\"batch_norm\", 1, 7, 7, 1152]", "cuda -keys=cuda,gpu -max_num_threads=1024 -model=unknown -thread_warp_size=32", [-1, 16, 64, 49152, 2147483647, 1024, 8, 32], "", 0, []], [[], [["CI", 2], ["FU", 4, [0, 1, 2, 3]], ["SP", 4, 0, 56448, [9], 1], ["AN", 4, 0, 5], ["AN", 4, 1, 6]]]], "r": [[7.29055e-06, 7.2945e-06, 7.29384e-06], 0, 4.21874, 1667947602], "v": "v0.6"}
{"i": [["[\"batch_norm\", 1, 7, 7, 1152]", "cuda -keys=cuda,gpu -max_num_threads=1024 -model=unknown -thread_warp_size=32", [-1, 16, 64, 49152, 2147483647, 1024, 8, 32], "", 0, []], [[], [["CI", 2], ["FU", 4, [0, 1, 2, 3]], ["SP", 4, 0, 56448, [8], 1], ["AN", 4, 0, 5], ["AN", 4, 1, 6]]]], "r": [[7.93193e-06, 7.92975e-06, 7.92917e-06], 0, 4.47471, 1667947602], "v": "v0.6"}
{"i": [["[\"batch_norm\", 1, 7, 7, 1152]", "cuda -keys=cuda,gpu -max_num_threads=1024 -model=unknown -thread_warp_size=32", [-1, 16, 64, 49152, 2147483647, 1024, 8, 32], "", 0, []], [[], [["CI", 2], ["FU", 4, [0, 1, 2, 3]], ["SP", 4, 0, 56448, [3], 1], ["AN", 4, 0, 5], ["AN", 4, 1, 6]]]], "r": [[1.67852e-05, 1.67834e-05, 1.67819e-05], 0, 4.74201, 1667947603], "v": "v0.6"}
{"i": [["[\"batch_norm\", 1, 7, 7, 1152]", "cuda -keys=cuda,gpu -max_num_threads=1024 -model=unknown -thread_warp_size=32", [-1, 16, 64, 49152, 2147483647, 1024, 8, 32], "", 0, []], [[], [["CI", 2], ["FU", 4, [0, 1, 2, 3]], ["SP", 4, 0, 56448, [2], 1], ["AN", 4, 0, 5], ["AN", 4, 1, 6]]]], "r": [[2.3801e-05, 2.37871e-05, 2.37857e-05], 0, 4.99645, 1667947603], "v": "v0.6"}
{"i": [["[\"batch_norm\", 1, 7, 7, 1152]", "cuda -keys=cuda,gpu -max_num_threads=1024 -model=unknown -thread_warp_size=32", [-1, 16, 64, 49152, 2147483647, 1024, 8, 32], "", 0, []], [[], [["CI", 2], ["FU", 4, [0, 1, 2, 3]], ["SP", 4, 0, 56448, [56], 1], ["AN", 4, 0, 5], ["AN", 4, 1, 6]]]], "r": [[3.42929e-06, 3.43931e-06, 3.4443e-06], 0, 5.32674, 1667947603], "v": "v0.6"}
{"i": [["[\"batch_norm\", 1, 7, 7, 1152]", "cuda -keys=cuda,gpu -max_num_threads=1024 -model=unknown -thread_warp_size=32", [-1, 16, 64, 49152, 2147483647, 1024, 8, 32], "", 0, []], [[], [["CI", 2], ["FU", 4, [0, 1, 2, 3]], ["SP", 4, 0, 56448, [12], 1], ["AN", 4, 0, 5], ["AN", 4, 1, 6]]]], "r": [[6.09893e-06, 6.10197e-06, 6.09998e-06], 0, 5.54528, 1667947604], "v": "v0.6"}
{"i": [["[\"batch_norm\", 1, 7, 7, 1152]", "cuda -keys=cuda,gpu -max_num_threads=1024 -model=unknown -thread_warp_size=32", [-1, 16, 64, 49152, 2147483647, 1024, 8, 32], "", 0, []], [[], [["CI", 2], ["FU", 4, [0, 1, 2, 3]], ["SP", 4, 0, 56448, [21], 1], ["AN", 4, 0, 5], ["AN", 4, 1, 6]]]], "r": [[4.66314e-06, 4.66422e-06, 4.66201e-06], 0, 3.24116, 1667947601], "v": "v0.6"}
{"i": [["[\"batch_norm\", 1, 7, 7, 1152]", "cuda -keys=cuda,gpu -max_num_threads=1024 -model=unknown -thread_warp_size=32", [-1, 16, 64, 49152, 2147483647, 1024, 8, 32], "", 0, []], [[], [["CI", 2], ["FU", 4, [0, 1, 2, 3]], ["SP", 4, 0, 56448, [63], 1], ["AN", 4, 0, 5], ["AN", 4, 1, 6]]]], "r": [[3.45412e-06, 3.45756e-06, 3.45402e-06], 0, 5.7757, 1667947604], "v": "v0.6"}
{"i": [["[\"batch_norm\", 1, 7, 7, 1152]", "cuda -keys=cuda,gpu -max_num_threads=1024 -model=unknown -thread_warp_size=32", [-1, 16, 64, 49152, 2147483647, 1024, 8, 32], "", 0, []], [[], [["CI", 2], ["FU", 4, [0, 1, 2, 3]], ["SP", 4, 0, 56448, [64], 1], ["AN", 4, 0, 5], ["AN", 4, 1, 6]]]], "r": [[3.30705e-06, 3.31317e-06, 3.31234e-06], 0, 6.05053, 1667947604], "v": "v0.6"}
{"i": [["[\"batch_norm\", 1, 7, 7, 1152]", "cuda -keys=cuda,gpu -max_num_threads=1024 -model=unknown -thread_warp_size=32", [-1, 16, 64, 49152, 2147483647, 1024, 8, 32], "", 0, []], [[], [["CI", 2], ["FU", 4, [0, 1, 2, 3]], ["SP", 4, 0, 56448, [36], 1], ["AN", 4, 0, 5], ["AN", 4, 1, 6]]]], "r": [[3.80006e-06, 3.79697e-06, 3.79995e-06], 0, 6.34514, 1667947605], "v": "v0.6"}
{"i": [["[\"batch_norm\", 1, 7, 7, 1152]", "cuda -keys=cuda,gpu -max_num_threads=1024 -model=unknown -thread_warp_size=32", [-1, 16, 64, 49152, 2147483647, 1024, 8, 32], "", 0, []], [[], [["CI", 2], ["FU", 4, [0, 1, 2, 3]], ["SP", 4, 0, 56448, [7], 1], ["AN", 4, 0, 5], ["AN", 4, 1, 6]]]], "r": [[8.7559e-06, 8.74553e-06, 8.74581e-06], 0, 6.67145, 1667947605], "v": "v0.6"}
{"i": [["[\"batch_norm\", 1, 7, 7, 1152]", "cuda -keys=cuda,gpu -max_num_threads=1024 -model=unknown -thread_warp_size=32", [-1, 16, 64, 49152, 2147483647, 1024, 8, 32], "", 0, []], [[], [["CI", 2], ["FU", 4, [0, 1, 2, 3]], ["SP", 4, 0, 56448, [14], 1], ["AN", 4, 0, 5], ["AN", 4, 1, 6]]]], "r": [[5.57229e-06, 5.57213e-06, 5.5733e-06], 0, 1.88317, 1667947741], "v": "v0.6"}
{"i": [["[\"batch_norm\", 1, 7, 7, 1152]", "cuda -keys=cuda,gpu -max_num_threads=1024 -model=unknown -thread_warp_size=32", [-1, 16, 64, 49152, 2147483647, 1024, 8, 32], "", 0, []], [[], [["CI", 2], ["FU", 4, [0, 1, 2, 3]], ["SP", 4, 0, 56448, [21], 1], ["AN", 4, 0, 5], ["AN", 4, 1, 6]]]], "r": [[4.69144e-06, 4.69588e-06, 4.68889e-06], 0, 0.901872, 1667947740], "v": "v0.6"}
{"i": [["[\"batch_norm\", 1, 7, 7, 1152]", "cuda -keys=cuda,gpu -max_num_threads=1024 -model=unknown -thread_warp_size=32", [-1, 16, 64, 49152, 2147483647, 1024, 8, 32], "", 0, []], [[], [["CI", 2], ["FU", 4, [0, 1, 2, 3]], ["SP", 4, 0, 56448, [2], 1], ["AN", 4, 0, 5], ["AN", 4, 1, 6]]]], "r": [[2.3854e-05, 2.38372e-05, 2.38521e-05], 0, 1.24637, 1667947741], "v": "v0.6"}
{"i": [["[\"batch_norm\", 1, 7, 7, 1152]", "cuda -keys=cuda,gpu -max_num_threads=1024 -model=unknown -thread_warp_size=32", [-1, 16, 64, 49152, 2147483647, 1024, 8, 32], "", 0, []], [[], [["CI", 2], ["FU", 4, [0, 1, 2, 3]], ["SP", 4, 0, 56448, [16], 1], ["AN", 4, 0, 5], ["AN", 4, 1, 6]]]], "r": [[5.22864e-06, 5.23262e-06, 5.2306e-06], 0, 1.6459, 1667947741], "v": "v0.6"}
{"i": [["[\"batch_norm\", 1, 7, 7, 1152]", "cuda -keys=cuda,gpu -max_num_threads=1024 -model=unknown -thread_warp_size=32", [-1, 16, 64, 49152, 2147483647, 1024, 8, 32], "", 0, []], [[], [["CI", 2], ["FU", 4, [0, 1, 2, 3]], ["SP", 4, 0, 56448, [6], 1], ["AN", 4, 0, 5], ["AN", 4, 1, 6]]]], "r": [[9.84649e-06, 9.8502e-06, 9.8412e-06], 0, 0.621012, 1667947740], "v": "v0.6"}
{"i": [["[\"batch_norm\", 1, 7, 7, 1152]", "cuda -keys=cuda,gpu -max_num_threads=1024 -model=unknown -thread_warp_size=32", [-1, 16, 64, 49152, 2147483647, 1024, 8, 32], "", 0, []], [[], [["CI", 2], ["FU", 4, [0, 1, 2, 3]], ["SP", 4, 0, 56448, [24], 1], ["AN", 4, 0, 5], ["AN", 4, 1, 6]]]], "r": [[4.40899e-06, 4.40943e-06, 4.4068e-06], 0, 2.15785, 1667947742], "v": "v0.6"}
{"i": [["[\"batch_norm\", 1, 7, 7, 1152]", "cuda -keys=cuda,gpu -max_num_threads=1024 -model=unknown -thread_warp_size=32", [-1, 16, 64, 49152, 2147483647, 1024, 8, 32], "", 0, []], [[], [["CI", 2], ["FU", 4, [0, 1, 2, 3]], ["SP", 4, 0, 56448, [3], 1], ["AN", 4, 0, 5], ["AN", 4, 1, 6]]]], "r": [[1.68621e-05, 1.68687e-05, 1.6855e-05], 0, 2.38561, 1667947742], "v": "v0.6"}
{"i": [["[\"batch_norm\", 1, 7, 7, 1152]", "cuda -keys=cuda,gpu -max_num_threads=1024 -model=unknown -thread_warp_size=32", [-1, 16, 64, 49152, 2147483647, 1024, 8, 32], "", 0, []], [[], [["CI", 2], ["FU", 4, [0, 1, 2, 3]], ["SP", 4, 0, 56448, [18], 1], ["AN", 4, 0, 5], ["AN", 4, 1, 6]]]], "r": [[5.03587e-06, 5.03009e-06, 5.03423e-06], 0, 2.60019, 1667947742], "v": "v0.6"}
{"i": [["[\"batch_norm\", 1, 7, 7, 1152]", "cuda -keys=cuda,gpu -max_num_threads=1024 -model=unknown -thread_warp_size=32", [-1, 16, 64, 49152, 2147483647, 1024, 8, 32], "", 0, []], [[], [["CI", 2], ["FU", 4, [0, 1, 2, 3]], ["SP", 4, 0, 56448, [1], 1], ["AN", 4, 0, 5], ["AN", 4, 1, 6]]]], "r": [[4.45677e-05, 4.45861e-05, 4.45736e-05], 0, 2.87896, 1667947743], "v": "v0.6"}
{"i": [["[\"batch_norm\", 1, 7, 7, 1152]", "cuda -keys=cuda,gpu -max_num_threads=1024 -model=unknown -thread_warp_size=32", [-1, 16, 64, 49152, 2147483647, 1024, 8, 32], "", 0, []], [[], [["CI", 2], ["FU", 4, [0, 1, 2, 3]], ["SP", 4, 0, 56448, [28], 1], ["AN", 4, 0, 5], ["AN", 4, 1, 6]]]], "r": [[4.23148e-06, 4.23156e-06, 4.23147e-06], 0, 3.47808, 1667947743], "v": "v0.6"}
{"i": [["[\"batch_norm\", 1, 7, 7, 1152]", "cuda -keys=cuda,gpu -max_num_threads=1024 -model=unknown -thread_warp_size=32", [-1, 16, 64, 49152, 2147483647, 1024, 8, 32], "", 0, []], [[], [["CI", 2], ["FU", 4, [0, 1, 2, 3]], ["SP", 4, 0, 56448, [64], 1], ["AN", 4, 0, 5], ["AN", 4, 1, 6]]]], "r": [[3.35553e-06, 3.35532e-06, 3.35785e-06], 0, 3.70428, 1667947744], "v": "v0.6"}
{"i": [["[\"batch_norm\", 1, 7, 7, 1152]", "cuda -keys=cuda,gpu -max_num_threads=1024 -model=unknown -thread_warp_size=32", [-1, 16, 64, 49152, 2147483647, 1024, 8, 32], "", 0, []], [[], [["CI", 2], ["FU", 4, [0, 1, 2, 3]], ["SP", 4, 0, 56448, [49], 1], ["AN", 4, 0, 5], ["AN", 4, 1, 6]]]], "r": [[3.57973e-06, 3.58026e-06, 3.58359e-06], 0, 3.92822, 1667947744], "v": "v0.6"}
{"i": [["[\"batch_norm\", 1, 7, 7, 1152]", "cuda -keys=cuda,gpu -max_num_threads=1024 -model=unknown -thread_warp_size=32", [-1, 16, 64, 49152, 2147483647, 1024, 8, 32], "", 0, []], [[], [["CI", 2], ["FU", 4, [0, 1, 2, 3]], ["SP", 4, 0, 56448, [12], 1], ["AN", 4, 0, 5], ["AN", 4, 1, 6]]]], "r": [[6.28484e-06, 6.27919e-06, 6.28347e-06], 0, 4.40082, 1667947745], "v": "v0.6"}
{"i": [["[\"batch_norm\", 1, 7, 7, 1152]", "cuda -keys=cuda,gpu -max_num_threads=1024 -model=unknown -thread_warp_size=32", [-1, 16, 64, 49152, 2147483647, 1024, 8, 32], "", 0, []], [[], [["CI", 2], ["FU", 4, [0, 1, 2, 3]], ["SP", 4, 0, 56448, [8], 1], ["AN", 4, 0, 5], ["AN", 4, 1, 6]]]], "r": [[7.98291e-06, 7.97912e-06, 7.98173e-06], 0, 4.64946, 1667947745], "v": "v0.6"}
{"i": [["[\"batch_norm\", 1, 7, 7, 1152]", "cuda -keys=cuda,gpu -max_num_threads=1024 -model=unknown -thread_warp_size=32", [-1, 16, 64, 49152, 2147483647, 1024, 8, 32], "", 0, []], [[], [["CI", 2], ["FU", 4, [0, 1, 2, 3]], ["SP", 4, 0, 56448, [36], 1], ["AN", 4, 0, 5], ["AN", 4, 1, 6]]]], "r": [[3.73715e-06, 3.74189e-06, 3.74195e-06], 0, 4.1347, 1667947744], "v": "v0.6"}
{"i": [["[\"batch_norm\", 1, 7, 7, 1152]", "cuda -keys=cuda,gpu -max_num_threads=1024 -model=unknown -thread_warp_size=32", [-1, 16, 64, 49152, 2147483647, 1024, 8, 32], "", 0, []], [[], [["CI", 2], ["FU", 4, [0, 1, 2, 3]], ["SP", 4, 0, 56448, [42], 1], ["AN", 4, 0, 5], ["AN", 4, 1, 6]]]], "r": [[3.59937e-06, 3.59821e-06, 3.60059e-06], 0, 4.95453, 1667947745], "v": "v0.6"}
{"i": [["[\"batch_norm\", 1, 7, 7, 1152]", "cuda -keys=cuda,gpu -max_num_threads=1024 -model=unknown -thread_warp_size=32", [-1, 16, 64, 49152, 2147483647, 1024, 8, 32], "", 0, []], [[], [["CI", 2], ["FU", 4, [0, 1, 2, 3]], ["SP", 4, 0, 56448, [4], 1], ["AN", 4, 0, 5], ["AN", 4, 1, 6]]]], "r": [[1.31947e-05, 1.31964e-05, 1.31925e-05], 0, 5.2567, 1667947746], "v": "v0.6"}
{"i": [["[\"batch_norm\", 1, 7, 7, 1152]", "cuda -keys=cuda,gpu -max_num_threads=1024 -model=unknown -thread_warp_size=32", [-1, 16, 64, 49152, 2147483647, 1024, 8, 32], "", 0, []], [[], [["CI", 2], ["FU", 4, [0, 1, 2, 3]], ["SP", 4, 0, 56448, [9], 1], ["AN", 4, 0, 5], ["AN", 4, 1, 6]]]], "r": [[7.30004e-06, 7.29829e-06, 7.29714e-06], 0, 3.20256, 1667947743], "v": "v0.6"}
{"i": [["[\"batch_norm\", 1, 7, 7, 1152]", "cuda -keys=cuda,gpu -max_num_threads=1024 -model=unknown -thread_warp_size=32", [-1, 16, 64, 49152, 2147483647, 1024, 8, 32], "", 0, []], [[], [["CI", 2], ["FU", 4, [0, 1, 2, 3]], ["SP", 4, 0, 56448, [63], 1], ["AN", 4, 0, 5], ["AN", 4, 1, 6]]]], "r": [[3.49342e-06, 3.49525e-06, 3.49537e-06], 0, 5.46116, 1667947746], "v": "v0.6"}
{"i": [["[\"batch_norm\", 1, 7, 7, 1152]", "cuda -keys=cuda,gpu -max_num_threads=1024 -model=unknown -thread_warp_size=32", [-1, 16, 64, 49152, 2147483647, 1024, 8, 32], "", 0, []], [[], [["CI", 2], ["FU", 4, [0, 1, 2, 3]], ["SP", 4, 0, 56448, [7], 1], ["AN", 4, 0, 5], ["AN", 4, 1, 6]]]], "r": [[8.79331e-06, 8.78341e-06, 8.7848e-06], 0, 5.70859, 1667947746], "v": "v0.6"}
{"i": [["[\"batch_norm\", 1, 7, 7, 1152]", "cuda -keys=cuda,gpu -max_num_threads=1024 -model=unknown -thread_warp_size=32", [-1, 16, 64, 49152, 2147483647, 1024, 8, 32], "", 0, []], [[], [["CI", 2], ["FU", 4, [0, 1, 2, 3]], ["SP", 4, 0, 56448, [32], 1], ["AN", 4, 0, 5], ["AN", 4, 1, 6]]]], "r": [[3.93461e-06, 3.93662e-06, 3.93164e-06], 0, 5.97305, 1667947747], "v": "v0.6"}
{"i": [["[\"batch_norm\", 1, 7, 7, 1152]", "cuda -keys=cuda,gpu -max_num_threads=1024 -model=unknown -thread_warp_size=32", [-1, 16, 64, 49152, 2147483647, 1024, 8, 32], "", 0, []], [[], [["CI", 2], ["FU", 4, [0, 1, 2, 3]], ["SP", 4, 0, 56448, [56], 1], ["AN", 4, 0, 5], ["AN", 4, 1, 6]]]], "r": [[3.56487e-06, 3.57055e-06, 3.56887e-06], 0, 6.31653, 1667947747], "v": "v0.6"}
{"i": [["[\"batch_norm\", 1, 7, 7, 1152]", "cuda -keys=cuda,gpu -max_num_threads=1024 -model=unknown -thread_warp_size=32", [-1, 16, 64, 49152, 2147483647, 1024, 8, 32], "", 0, []], [[], [["CI", 2], ["FU", 4, [0, 1, 2, 3]], ["SP", 4, 0, 56448, [48], 1], ["AN", 4, 0, 5], ["AN", 4, 1, 6]]]], "r": [[3.70754e-06, 3.70712e-06, 3.70968e-06], 0, 6.49811, 1667947747], "v": "v0.6"}
{"i": [["[\"batch_norm\", 1, 7, 7, 1152]", "cuda -keys=cuda,gpu -max_num_threads=1024 -model=unknown -thread_warp_size=32", [-1, 16, 64, 49152, 2147483647, 1024, 8, 32], "", 0, []], [[], [["CI", 2], ["FU", 4, [0, 1, 2, 3]], ["SP", 4, 0, 56448, [12], 1], ["AN", 4, 0, 5], ["AN", 4, 1, 6]]]], "r": [[6.11895e-06, 6.11704e-06, 6.11543e-06], 0, 0.930781, 1667947791], "v": "v0.6"}
{"i": [["[\"batch_norm\", 1, 7, 7, 1152]", "cuda -keys=cuda,gpu -max_num_threads=1024 -model=unknown -thread_warp_size=32", [-1, 16, 64, 49152, 2147483647, 1024, 8, 32], "", 0, []], [[], [["CI", 2], ["FU", 4, [0, 1, 2, 3]], ["SP", 4, 0, 56448, [6], 1], ["AN", 4, 0, 5], ["AN", 4, 1, 6]]]], "r": [[9.68759e-06, 9.68768e-06, 9.68776e-06], 0, 1.90437, 1667947792], "v": "v0.6"}
{"i": [["[\"batch_norm\", 1, 7, 7, 1152]", "cuda -keys=cuda,gpu -max_num_threads=1024 -model=unknown -thread_warp_size=32", [-1, 16, 64, 49152, 2147483647, 1024, 8, 32], "", 0, []], [[], [["CI", 2], ["FU", 4, [0, 1, 2, 3]], ["SP", 4, 0, 56448, [4], 1], ["AN", 4, 0, 5], ["AN", 4, 1, 6]]]], "r": [[1.31842e-05, 1.31779e-05, 1.31753e-05], 0, 0.578738, 1667947790], "v": "v0.6"}
{"i": [["[\"batch_norm\", 1, 7, 7, 1152]", "cuda -keys=cuda,gpu -max_num_threads=1024 -model=unknown -thread_warp_size=32", [-1, 16, 64, 49152, 2147483647, 1024, 8, 32], "", 0, []], [[], [["CI", 2], ["FU", 4, [0, 1, 2, 3]], ["SP", 4, 0, 56448, [9], 1], ["AN", 4, 0, 5], ["AN", 4, 1, 6]]]], "r": [[7.31094e-06, 7.30674e-06, 7.29833e-06], 0, 1.25503, 1667947791], "v": "v0.6"}
{"i": [["[\"batch_norm\", 1, 7, 7, 1152]", "cuda -keys=cuda,gpu -max_num_threads=1024 -model=unknown -thread_warp_size=32", [-1, 16, 64, 49152, 2147483647, 1024, 8, 32], "", 0, []], [[], [["CI", 2], ["FU", 4, [0, 1, 2, 3]], ["SP", 4, 0, 56448, [21], 1], ["AN", 4, 0, 5], ["AN", 4, 1, 6]]]], "r": [[4.75075e-06, 4.74843e-06, 4.75812e-06], 0, 2.58912, 1667947792], "v": "v0.6"}
{"i": [["[\"batch_norm\", 1, 7, 7, 1152]", "cuda -keys=cuda,gpu -max_num_threads=1024 -model=unknown -thread_warp_size=32", [-1, 16, 64, 49152, 2147483647, 1024, 8, 32], "", 0, []], [[], [["CI", 2], ["FU", 4, [0, 1, 2, 3]], ["SP", 4, 0, 56448, [63], 1], ["AN", 4, 0, 5], ["AN", 4, 1, 6]]]], "r": [[3.4518e-06, 3.4503e-06, 3.45717e-06], 0, 2.20701, 1667947792], "v": "v0.6"}
{"i": [["[\"batch_norm\", 1, 7, 7, 1152]", "cuda -keys=cuda,gpu -max_num_threads=1024 -model=unknown -thread_warp_size=32", [-1, 16, 64, 49152, 2147483647, 1024, 8, 32], "", 0, []], [[], [["CI", 2], ["FU", 4, [0, 1, 2, 3]], ["SP", 4, 0, 56448, [16], 1], ["AN", 4, 0, 5], ["AN", 4, 1, 6]]]], "r": [[5.32299e-06, 5.32745e-06, 5.32849e-06], 0, 1.59834, 1667947791], "v": "v0.6"}
{"i": [["[\"batch_norm\", 1, 7, 7, 1152]", "cuda -keys=cuda,gpu -max_num_threads=1024 -model=unknown -thread_warp_size=32", [-1, 16, 64, 49152, 2147483647, 1024, 8, 32], "", 0, []], [[], [["CI", 2], ["FU", 4, [0, 1, 2, 3]], ["SP", 4, 0, 56448, [56], 1], ["AN", 4, 0, 5], ["AN", 4, 1, 6]]]], "r": [[3.47632e-06, 3.47692e-06, 3.4797e-06], 0, 2.85611, 1667947793], "v": "v0.6"}
{"i": [["[\"batch_norm\", 1, 7, 7, 1152]", "cuda -keys=cuda,gpu -max_num_threads=1024 -model=unknown -thread_warp_size=32", [-1, 16, 64, 49152, 2147483647, 1024, 8, 32], "", 0, []], [[], [["CI", 2], ["FU", 4, [0, 1, 2, 3]], ["SP", 4, 0, 56448, [8], 1], ["AN", 4, 0, 5], ["AN", 4, 1, 6]]]], "r": [[7.85808e-06, 7.85569e-06, 7.85687e-06], 0, 3.13099, 1667947793], "v": "v0.6"}
{"i": [["[\"batch_norm\", 1, 7, 7, 1152]", "cuda -keys=cuda,gpu -max_num_threads=1024 -model=unknown -thread_warp_size=32", [-1, 16, 64, 49152, 2147483647, 1024, 8, 32], "", 0, []], [[], [["CI", 2], ["FU", 4, [0, 1, 2, 3]], ["SP", 4, 0, 56448, [2], 1], ["AN", 4, 0, 5], ["AN", 4, 1, 6]]]], "r": [[2.37128e-05, 2.37025e-05, 2.37136e-05], 0, 4.3929, 1667947795], "v": "v0.6"}
{"i": [["[\"batch_norm\", 1, 7, 7, 1152]", "cuda -keys=cuda,gpu -max_num_threads=1024 -model=unknown -thread_warp_size=32", [-1, 16, 64, 49152, 2147483647, 1024, 8, 32], "", 0, []], [[], [["CI", 2], ["FU", 4, [0, 1, 2, 3]], ["SP", 4, 0, 56448, [64], 1], ["AN", 4, 0, 5], ["AN", 4, 1, 6]]]], "r": [[3.30991e-06, 3.31019e-06, 3.30957e-06], 0, 3.56444, 1667947794], "v": "v0.6"}
{"i": [["[\"batch_norm\", 1, 7, 7, 1152]", "cuda -keys=cuda,gpu -max_num_threads=1024 -model=unknown -thread_warp_size=32", [-1, 16, 64, 49152, 2147483647, 1024, 8, 32], "", 0, []], [[], [["CI", 2], ["FU", 4, [0, 1, 2, 3]], ["SP", 4, 0, 56448, [1], 1], ["AN", 4, 0, 5], ["AN", 4, 1, 6]]]], "r": [[4.4599e-05, 4.4609e-05, 4.46133e-05], 0, 3.25914, 1667947793], "v": "v0.6"}
