python/models/efficientnet/VertiFusionEfficientNet_kernel_configs/efficient_sigmoid_1_7_7_1152.log
{"i": [["[\"sigmoid\", 1, 7, 7, 1152]", "cuda -keys=cuda,gpu -max_num_threads=1024 -model=unknown -thread_warp_size=32", [-1, 16, 64, 49152, 2147483647, 1024, 8, 32], "", 0, []], [[], [["FU", 1, [0, 1, 2, 3]], ["SP", 1, 0, 56448, [28], 1], ["AN", 1, 0, 5], ["AN", 1, 1, 6]]]], "r": [[4.14304e-06, 4.15483e-06, 4.15532e-06], 0, 3.06667, 1667927699], "v": "v0.6"}
{"i": [["[\"sigmoid\", 1, 7, 7, 1152]", "cuda -keys=cuda,gpu -max_num_threads=1024 -model=unknown -thread_warp_size=32", [-1, 16, 64, 49152, 2147483647, 1024, 8, 32], "", 0, []], [[], [["FU", 1, [0, 1, 2, 3]], ["SP", 1, 0, 56448, [32], 1], ["AN", 1, 0, 5], ["AN", 1, 1, 6]]]], "r": [[3.84706e-06, 3.8567e-06, 3.85675e-06], 0, 2.0147, 1667927697], "v": "v0.6"}
{"i": [["[\"sigmoid\", 1, 7, 7, 1152]", "cuda -keys=cuda,gpu -max_num_threads=1024 -model=unknown -thread_warp_size=32", [-1, 16, 64, 49152, 2147483647, 1024, 8, 32], "", 0, []], [[], [["FU", 1, [0, 1, 2, 3]], ["SP", 1, 0, 56448, [18], 1], ["AN", 1, 0, 5], ["AN", 1, 1, 6]]]], "r": [[5.14329e-06, 5.15698e-06, 5.156e-06], 0, 1.37417, 1667927697], "v": "v0.6"}
{"i": [["[\"sigmoid\", 1, 7, 7, 1152]", "cuda -keys=cuda,gpu -max_num_threads=1024 -model=unknown -thread_warp_size=32", [-1, 16, 64, 49152, 2147483647, 1024, 8, 32], "", 0, []], [[], [["FU", 1, [0, 1, 2, 3]], ["SP", 1, 0, 56448, [1], 1], ["AN", 1, 0, 5], ["AN", 1, 1, 6]]]], "r": [[4.47279e-05, 4.47768e-05, 4.47555e-05], 0, 0.629786, 1667927696], "v": "v0.6"}
{"i": [["[\"sigmoid\", 1, 7, 7, 1152]", "cuda -keys=cuda,gpu -max_num_threads=1024 -model=unknown -thread_warp_size=32", [-1, 16, 64, 49152, 2147483647, 1024, 8, 32], "", 0, []], [[], [["FU", 1, [0, 1, 2, 3]], ["SP", 1, 0, 56448, [7], 1], ["AN", 1, 0, 5], ["AN", 1, 1, 6]]]], "r": [[8.96319e-06, 8.98255e-06, 8.98133e-06], 0, 1.73156, 1667927697], "v": "v0.6"}
{"i": [["[\"sigmoid\", 1, 7, 7, 1152]", "cuda -keys=cuda,gpu -max_num_threads=1024 -model=unknown -thread_warp_size=32", [-1, 16, 64, 49152, 2147483647, 1024, 8, 32], "", 0, []], [[], [["FU", 1, [0, 1, 2, 3]], ["SP", 1, 0, 56448, [49], 1], ["AN", 1, 0, 5], ["AN", 1, 1, 6]]]], "r": [[3.41014e-06, 3.418e-06, 3.41619e-06], 0, 1.0873, 1667927696], "v": "v0.6"}
{"i": [["[\"sigmoid\", 1, 7, 7, 1152]", "cuda -keys=cuda,gpu -max_num_threads=1024 -model=unknown -thread_warp_size=32", [-1, 16, 64, 49152, 2147483647, 1024, 8, 32], "", 0, []], [[], [["FU", 1, [0, 1, 2, 3]], ["SP", 1, 0, 56448, [16], 1], ["AN", 1, 0, 5], ["AN", 1, 1, 6]]]], "r": [[5.45966e-06, 5.45787e-06, 5.46431e-06], 0, 0.787848, 1667927696], "v": "v0.6"}
{"i": [["[\"sigmoid\", 1, 7, 7, 1152]", "cuda -keys=cuda,gpu -max_num_threads=1024 -model=unknown -thread_warp_size=32", [-1, 16, 64, 49152, 2147483647, 1024, 8, 32], "", 0, []], [[], [["FU", 1, [0, 1, 2, 3]], ["SP", 1, 0, 56448, [21], 1], ["AN", 1, 0, 5], ["AN", 1, 1, 6]]]], "r": [[4.61207e-06, 4.62426e-06, 4.6261e-06], 0, 2.20241, 1667927698], "v": "v0.6"}
{"i": [["[\"sigmoid\", 1, 7, 7, 1152]", "cuda -keys=cuda,gpu -max_num_threads=1024 -model=unknown -thread_warp_size=32", [-1, 16, 64, 49152, 2147483647, 1024, 8, 32], "", 0, []], [[], [["FU", 1, [0, 1, 2, 3]], ["SP", 1, 0, 56448, [14], 1], ["AN", 1, 0, 5], ["AN", 1, 1, 6]]]], "r": [[5.83569e-06, 5.85638e-06, 5.85314e-06], 0, 2.56243, 1667927698], "v": "v0.6"}
{"i": [["[\"sigmoid\", 1, 7, 7, 1152]", "cuda -keys=cuda,gpu -max_num_threads=1024 -model=unknown -thread_warp_size=32", [-1, 16, 64, 49152, 2147483647, 1024, 8, 32], "", 0, []], [[], [["FU", 1, [0, 1, 2, 3]], ["SP", 1, 0, 56448, [4], 1], ["AN", 1, 0, 5], ["AN", 1, 1, 6]]]], "r": [[1.33938e-05, 1.34074e-05, 1.34014e-05], 0, 2.74555, 1667927698], "v": "v0.6"}
{"i": [["[\"sigmoid\", 1, 7, 7, 1152]", "cuda -keys=cuda,gpu -max_num_threads=1024 -model=unknown -thread_warp_size=32", [-1, 16, 64, 49152, 2147483647, 1024, 8, 32], "", 0, []], [[], [["FU", 1, [0, 1, 2, 3]], ["SP", 1, 0, 56448, [42], 1], ["AN", 1, 0, 5], ["AN", 1, 1, 6]]]], "r": [[3.68751e-06, 3.69884e-06, 3.69671e-06], 0, 3.287, 1667927699], "v": "v0.6"}
{"i": [["[\"sigmoid\", 1, 7, 7, 1152]", "cuda -keys=cuda,gpu -max_num_threads=1024 -model=unknown -thread_warp_size=32", [-1, 16, 64, 49152, 2147483647, 1024, 8, 32], "", 0, []], [[], [["FU", 1, [0, 1, 2, 3]], ["SP", 1, 0, 56448, [63], 1], ["AN", 1, 0, 5], ["AN", 1, 1, 6]]]], "r": [[3.30427e-06, 3.30852e-06, 3.30505e-06], 0, 3.56806, 1667927699], "v": "v0.6"}
{"i": [["[\"sigmoid\", 1, 7, 7, 1152]", "cuda -keys=cuda,gpu -max_num_threads=1024 -model=unknown -thread_warp_size=32", [-1, 16, 64, 49152, 2147483647, 1024, 8, 32], "", 0, []], [[], [["FU", 1, [0, 1, 2, 3]], ["SP", 1, 0, 56448, [64], 1], ["AN", 1, 0, 5], ["AN", 1, 1, 6]]]], "r": [[3.2352e-06, 3.23911e-06, 3.24174e-06], 0, 4.06573, 1667927700], "v": "v0.6"}
{"i": [["[\"sigmoid\", 1, 7, 7, 1152]", "cuda -keys=cuda,gpu -max_num_threads=1024 -model=unknown -thread_warp_size=32", [-1, 16, 64, 49152, 2147483647, 1024, 8, 32], "", 0, []], [[], [["FU", 1, [0, 1, 2, 3]], ["SP", 1, 0, 56448, [2], 1], ["AN", 1, 0, 5], ["AN", 1, 1, 6]]]], "r": [[2.39128e-05, 2.39475e-05, 2.39473e-05], 0, 3.73749, 1667927700], "v": "v0.6"}
{"i": [["[\"sigmoid\", 1, 7, 7, 1152]", "cuda -keys=cuda,gpu -max_num_threads=1024 -model=unknown -thread_warp_size=32", [-1, 16, 64, 49152, 2147483647, 1024, 8, 32], "", 0, []], [[], [["FU", 1, [0, 1, 2, 3]], ["SP", 1, 0, 56448, [6], 1], ["AN", 1, 0, 5], ["AN", 1, 1, 6]]]], "r": [[1.00569e-05, 1.00704e-05, 1.00718e-05], 0, 4.30089, 1667927700], "v": "v0.6"}
{"i": [["[\"sigmoid\", 1, 7, 7, 1152]", "cuda -keys=cuda,gpu -max_num_threads=1024 -model=unknown -thread_warp_size=32", [-1, 16, 64, 49152, 2147483647, 1024, 8, 32], "", 0, []], [[], [["FU", 1, [0, 1, 2, 3]], ["SP", 1, 0, 56448, [56], 1], ["AN", 1, 0, 5], ["AN", 1, 1, 6]]]], "r": [[3.40488e-06, 3.41667e-06, 3.41515e-06], 0, 4.54014, 1667927700], "v": "v0.6"}
{"i": [["[\"sigmoid\", 1, 7, 7, 1152]", "cuda -keys=cuda,gpu -max_num_threads=1024 -model=unknown -thread_warp_size=32", [-1, 16, 64, 49152, 2147483647, 1024, 8, 32], "", 0, []], [[], [["FU", 1, [0, 1, 2, 3]], ["SP", 1, 0, 56448, [48], 1], ["AN", 1, 0, 5], ["AN", 1, 1, 6]]]], "r": [[3.64042e-06, 3.65754e-06, 3.66338e-06], 0, 4.85948, 1667927701], "v": "v0.6"}
{"i": [["[\"sigmoid\", 1, 7, 7, 1152]", "cuda -keys=cuda,gpu -max_num_threads=1024 -model=unknown -thread_warp_size=32", [-1, 16, 64, 49152, 2147483647, 1024, 8, 32], "", 0, []], [[], [["FU", 1, [0, 1, 2, 3]], ["SP", 1, 0, 56448, [24], 1], ["AN", 1, 0, 5], ["AN", 1, 1, 6]]]], "r": [[4.38116e-06, 4.39499e-06, 4.39311e-06], 0, 5.13151, 1667927701], "v": "v0.6"}
{"i": [["[\"sigmoid\", 1, 7, 7, 1152]", "cuda -keys=cuda,gpu -max_num_threads=1024 -model=unknown -thread_warp_size=32", [-1, 16, 64, 49152, 2147483647, 1024, 8, 32], "", 0, []], [[], [["FU", 1, [0, 1, 2, 3]], ["SP", 1, 0, 56448, [12], 1], ["AN", 1, 0, 5], ["AN", 1, 1, 6]]]], "r": [[6.33407e-06, 6.35477e-06, 6.3595e-06], 0, 5.42835, 1667927701], "v": "v0.6"}
{"i": [["[\"sigmoid\", 1, 7, 7, 1152]", "cuda -keys=cuda,gpu -max_num_threads=1024 -model=unknown -thread_warp_size=32", [-1, 16, 64, 49152, 2147483647, 1024, 8, 32], "", 0, []], [[], [["FU", 1, [0, 1, 2, 3]], ["SP", 1, 0, 56448, [36], 1], ["AN", 1, 0, 5], ["AN", 1, 1, 6]]]], "r": [[3.82778e-06, 3.84068e-06, 3.83928e-06], 0, 5.6453, 1667927702], "v": "v0.6"}
{"i": [["[\"sigmoid\", 1, 7, 7, 1152]", "cuda -keys=cuda,gpu -max_num_threads=1024 -model=unknown -thread_warp_size=32", [-1, 16, 64, 49152, 2147483647, 1024, 8, 32], "", 0, []], [[], [["FU", 1, [0, 1, 2, 3]], ["SP", 1, 0, 56448, [7], 1], ["AN", 1, 0, 5], ["AN", 1, 1, 6]]]], "r": [[8.74789e-06, 8.76522e-06, 8.75842e-06], 0, 0.617304, 1667945858], "v": "v0.6"}
{"i": [["[\"sigmoid\", 1, 7, 7, 1152]", "cuda -keys=cuda,gpu -max_num_threads=1024 -model=unknown -thread_warp_size=32", [-1, 16, 64, 49152, 2147483647, 1024, 8, 32], "", 0, []], [[], [["FU", 1, [0, 1, 2, 3]], ["SP", 1, 0, 56448, [1], 1], ["AN", 1, 0, 5], ["AN", 1, 1, 6]]]], "r": [[4.46581e-05, 4.46423e-05, 4.46606e-05], 0, 1.86506, 1667945860], "v": "v0.6"}
{"i": [["[\"sigmoid\", 1, 7, 7, 1152]", "cuda -keys=cuda,gpu -max_num_threads=1024 -model=unknown -thread_warp_size=32", [-1, 16, 64, 49152, 2147483647, 1024, 8, 32], "", 0, []], [[], [["FU", 1, [0, 1, 2, 3]], ["SP", 1, 0, 56448, [42], 1], ["AN", 1, 0, 5], ["AN", 1, 1, 6]]]], "r": [[3.62474e-06, 3.63657e-06, 3.63567e-06], 0, 0.95026, 1667945859], "v": "v0.6"}
{"i": [["[\"sigmoid\", 1, 7, 7, 1152]", "cuda -keys=cuda,gpu -max_num_threads=1024 -model=unknown -thread_warp_size=32", [-1, 16, 64, 49152, 2147483647, 1024, 8, 32], "", 0, []], [[], [["FU", 1, [0, 1, 2, 3]], ["SP", 1, 0, 56448, [2], 1], ["AN", 1, 0, 5], ["AN", 1, 1, 6]]]], "r": [[2.38027e-05, 2.38145e-05, 2.38147e-05], 0, 1.59191, 1667945859], "v": "v0.6"}
{"i": [["[\"sigmoid\", 1, 7, 7, 1152]", "cuda -keys=cuda,gpu -max_num_threads=1024 -model=unknown -thread_warp_size=32", [-1, 16, 64, 49152, 2147483647, 1024, 8, 32], "", 0, []], [[], [["FU", 1, [0, 1, 2, 3]], ["SP", 1, 0, 56448, [9], 1], ["AN", 1, 0, 5], ["AN", 1, 1, 6]]]], "r": [[7.5361e-06, 7.54603e-06, 7.54414e-06], 0, 2.39833, 1667945860], "v": "v0.6"}
{"i": [["[\"sigmoid\", 1, 7, 7, 1152]", "cuda -keys=cuda,gpu -max_num_threads=1024 -model=unknown -thread_warp_size=32", [-1, 16, 64, 49152, 2147483647, 1024, 8, 32], "", 0, []], [[], [["FU", 1, [0, 1, 2, 3]], ["SP", 1, 0, 56448, [3], 1], ["AN", 1, 0, 5], ["AN", 1, 1, 6]]]], "r": [[1.68553e-05, 1.68654e-05, 1.68635e-05], 0, 2.81252, 1667945861], "v": "v0.6"}
{"i": [["[\"sigmoid\", 1, 7, 7, 1152]", "cuda -keys=cuda,gpu -max_num_threads=1024 -model=unknown -thread_warp_size=32", [-1, 16, 64, 49152, 2147483647, 1024, 8, 32], "", 0, []], [[], [["FU", 1, [0, 1, 2, 3]], ["SP", 1, 0, 56448, [36], 1], ["AN", 1, 0, 5], ["AN", 1, 1, 6]]]], "r": [[3.85768e-06, 3.88243e-06, 3.88003e-06], 0, 2.17862, 1667945860], "v": "v0.6"}
{"i": [["[\"sigmoid\", 1, 7, 7, 1152]", "cuda -keys=cuda,gpu -max_num_threads=1024 -model=unknown -thread_warp_size=32", [-1, 16, 64, 49152, 2147483647, 1024, 8, 32], "", 0, []], [[], [["FU", 1, [0, 1, 2, 3]], ["SP", 1, 0, 56448, [21], 1], ["AN", 1, 0, 5], ["AN", 1, 1, 6]]]], "r": [[4.6696e-06, 4.67977e-06, 4.68044e-06], 0, 1.19323, 1667945859], "v": "v0.6"}
{"i": [["[\"sigmoid\", 1, 7, 7, 1152]", "cuda -keys=cuda,gpu -max_num_threads=1024 -model=unknown -thread_warp_size=32", [-1, 16, 64, 49152, 2147483647, 1024, 8, 32], "", 0, []], [[], [["FU", 1, [0, 1, 2, 3]], ["SP", 1, 0, 56448, [49], 1], ["AN", 1, 0, 5], ["AN", 1, 1, 6]]]], "r": [[3.5077e-06, 3.5129e-06, 3.51248e-06], 0, 3.00239, 1667945861], "v": "v0.6"}
{"i": [["[\"sigmoid\", 1, 7, 7, 1152]", "cuda -keys=cuda,gpu -max_num_threads=1024 -model=unknown -thread_warp_size=32", [-1, 16, 64, 49152, 2147483647, 1024, 8, 32], "", 0, []], [[], [["FU", 1, [0, 1, 2, 3]], ["SP", 1, 0, 56448, [8], 1], ["AN", 1, 0, 5], ["AN", 1, 1, 6]]]], "r": [[8.02292e-06, 8.02699e-06, 8.03092e-06], 0, 3.58055, 1667945862], "v": "v0.6"}
{"i": [["[\"sigmoid\", 1, 7, 7, 1152]", "cuda -keys=cuda,gpu -max_num_threads=1024 -model=unknown -thread_warp_size=32", [-1, 16, 64, 49152, 2147483647, 1024, 8, 32], "", 0, []], [[], [["FU", 1, [0, 1, 2, 3]], ["SP", 1, 0, 56448, [48], 1], ["AN", 1, 0, 5], ["AN", 1, 1, 6]]]], "r": [[3.45836e-06, 3.47369e-06, 3.47071e-06], 0, 3.3043, 1667945861], "v": "v0.6"}
{"i": [["[\"sigmoid\", 1, 7, 7, 1152]", "cuda -keys=cuda,gpu -max_num_threads=1024 -model=unknown -thread_warp_size=32", [-1, 16, 64, 49152, 2147483647, 1024, 8, 32], "", 0, []], [[], [["FU", 1, [0, 1, 2, 3]], ["SP", 1, 0, 56448, [32], 1], ["AN", 1, 0, 5], ["AN", 1, 1, 6]]]], "r": [[3.86806e-06, 3.88068e-06, 3.88038e-06], 0, 3.75078, 1667945862], "v": "v0.6"}
{"i": [["[\"sigmoid\", 1, 7, 7, 1152]", "cuda -keys=cuda,gpu -max_num_threads=1024 -model=unknown -thread_warp_size=32", [-1, 16, 64, 49152, 2147483647, 1024, 8, 32], "", 0, []], [[], [["FU", 1, [0, 1, 2, 3]], ["SP", 1, 0, 56448, [56], 1], ["AN", 1, 0, 5], ["AN", 1, 1, 6]]]], "r": [[3.41174e-06, 3.40832e-06, 3.40752e-06], 0, 3.99881, 1667945862], "v": "v0.6"}
{"i": [["[\"sigmoid\", 1, 7, 7, 1152]", "cuda -keys=cuda,gpu -max_num_threads=1024 -model=unknown -thread_warp_size=32", [-1, 16, 64, 49152, 2147483647, 1024, 8, 32], "", 0, []], [[], [["FU", 1, [0, 1, 2, 3]], ["SP", 1, 0, 56448, [18], 1], ["AN", 1, 0, 5], ["AN", 1, 1, 6]]]], "r": [[5.00388e-06, 5.01004e-06, 5.0144e-06], 0, 4.60796, 1667945863], "v": "v0.6"}
{"i": [["[\"sigmoid\", 1, 7, 7, 1152]", "cuda -keys=cuda,gpu -max_num_threads=1024 -model=unknown -thread_warp_size=32", [-1, 16, 64, 49152, 2147483647, 1024, 8, 32], "", 0, []], [[], [["FU", 1, [0, 1, 2, 3]], ["SP", 1, 0, 56448, [28], 1], ["AN", 1, 0, 5], ["AN", 1, 1, 6]]]], "r": [[4.16635e-06, 4.17089e-06, 4.16901e-06], 0, 4.79976, 1667945863], "v": "v0.6"}
{"i": [["[\"sigmoid\", 1, 7, 7, 1152]", "cuda -keys=cuda,gpu -max_num_threads=1024 -model=unknown -thread_warp_size=32", [-1, 16, 64, 49152, 2147483647, 1024, 8, 32], "", 0, []], [[], [["FU", 1, [0, 1, 2, 3]], ["SP", 1, 0, 56448, [63], 1], ["AN", 1, 0, 5], ["AN", 1, 1, 6]]]], "r": [[3.29038e-06, 3.30561e-06, 3.30218e-06], 0, 5.12607, 1667945864], "v": "v0.6"}
{"i": [["[\"sigmoid\", 1, 7, 7, 1152]", "cuda -keys=cuda,gpu -max_num_threads=1024 -model=unknown -thread_warp_size=32", [-1, 16, 64, 49152, 2147483647, 1024, 8, 32], "", 0, []], [[], [["FU", 1, [0, 1, 2, 3]], ["SP", 1, 0, 56448, [24], 1], ["AN", 1, 0, 5], ["AN", 1, 1, 6]]]], "r": [[4.56571e-06, 4.5836e-06, 4.58416e-06], 0, 5.37241, 1667945864], "v": "v0.6"}
{"i": [["[\"sigmoid\", 1, 7, 7, 1152]", "cuda -keys=cuda,gpu -max_num_threads=1024 -model=unknown -thread_warp_size=32", [-1, 16, 64, 49152, 2147483647, 1024, 8, 32], "", 0, []], [[], [["FU", 1, [0, 1, 2, 3]], ["SP", 1, 0, 56448, [4], 1], ["AN", 1, 0, 5], ["AN", 1, 1, 6]]]], "r": [[1.35308e-05, 1.35479e-05, 1.35554e-05], 0, 5.68001, 1667945864], "v": "v0.6"}
{"i": [["[\"sigmoid\", 1, 7, 7, 1152]", "cuda -keys=cuda,gpu -max_num_threads=1024 -model=unknown -thread_warp_size=32", [-1, 16, 64, 49152, 2147483647, 1024, 8, 32], "", 0, []], [[], [["FU", 1, [0, 1, 2, 3]], ["SP", 1, 0, 56448, [6], 1], ["AN", 1, 0, 5], ["AN", 1, 1, 6]]]], "r": [[9.9276e-06, 9.94191e-06, 9.93067e-06], 0, 5.91554, 1667945865], "v": "v0.6"}
{"i": [["[\"sigmoid\", 1, 7, 7, 1152]", "cuda -keys=cuda,gpu -max_num_threads=1024 -model=unknown -thread_warp_size=32", [-1, 16, 64, 49152, 2147483647, 1024, 8, 32], "", 0, []], [[], [["FU", 1, [0, 1, 2, 3]], ["SP", 1, 0, 56448, [12], 1], ["AN", 1, 0, 5], ["AN", 1, 1, 6]]]], "r": [[6.34861e-06, 6.36515e-06, 6.36591e-06], 0, 6.17457, 1667945865], "v": "v0.6"}
{"i": [["[\"sigmoid\", 1, 7, 7, 1152]", "cuda -keys=cuda,gpu -max_num_threads=1024 -model=unknown -thread_warp_size=32", [-1, 16, 64, 49152, 2147483647, 1024, 8, 32], "", 0, []], [[], [["FU", 1, [0, 1, 2, 3]], ["SP", 1, 0, 56448, [14], 1], ["AN", 1, 0, 5], ["AN", 1, 1, 6]]]], "r": [[5.75041e-06, 5.76199e-06, 5.75762e-06], 0, 6.43388, 1667945865], "v": "v0.6"}
{"i": [["[\"sigmoid\", 1, 7, 7, 1152]", "cuda -keys=cuda,gpu -max_num_threads=1024 -model=unknown -thread_warp_size=32", [-1, 16, 64, 49152, 2147483647, 1024, 8, 32], "", 0, []], [[], [["FU", 1, [0, 1, 2, 3]], ["SP", 1, 0, 56448, [64], 1], ["AN", 1, 0, 5], ["AN", 1, 1, 6]]]], "r": [[3.40951e-06, 3.42216e-06, 3.42326e-06], 0, 6.68391, 1667945866], "v": "v0.6"}
{"i": [["[\"sigmoid\", 1, 7, 7, 1152]", "cuda -keys=cuda,gpu -max_num_threads=1024 -model=unknown -thread_warp_size=32", [-1, 16, 64, 49152, 2147483647, 1024, 8, 32], "", 0, []], [[], [["FU", 1, [0, 1, 2, 3]], ["SP", 1, 0, 56448, [16], 1], ["AN", 1, 0, 5], ["AN", 1, 1, 6]]]], "r": [[5.30149e-06, 5.31143e-06, 5.31449e-06], 0, 4.34412, 1667945863], "v": "v0.6"}
{"i": [["[\"sigmoid\", 1, 7, 7, 1152]", "cuda -keys=cuda,gpu -max_num_threads=1024 -model=unknown -thread_warp_size=32", [-1, 16, 64, 49152, 2147483647, 1024, 8, 32], "", 0, []], [[], [["FU", 1, [0, 1, 2, 3]], ["SP", 1, 0, 56448, [12], 1], ["AN", 1, 0, 5], ["AN", 1, 1, 6]]]], "r": [[6.16847e-06, 6.17903e-06, 6.18264e-06], 0, 1.25923, 1667946228], "v": "v0.6"}
{"i": [["[\"sigmoid\", 1, 7, 7, 1152]", "cuda -keys=cuda,gpu -max_num_threads=1024 -model=unknown -thread_warp_size=32", [-1, 16, 64, 49152, 2147483647, 1024, 8, 32], "", 0, []], [[], [["FU", 1, [0, 1, 2, 3]], ["SP", 1, 0, 56448, [8], 1], ["AN", 1, 0, 5], ["AN", 1, 1, 6]]]], "r": [[7.95337e-06, 7.963e-06, 7.96484e-06], 0, 2.34897, 1667946229], "v": "v0.6"}
{"i": [["[\"sigmoid\", 1, 7, 7, 1152]", "cuda -keys=cuda,gpu -max_num_threads=1024 -model=unknown -thread_warp_size=32", [-1, 16, 64, 49152, 2147483647, 1024, 8, 32], "", 0, []], [[], [["FU", 1, [0, 1, 2, 3]], ["SP", 1, 0, 56448, [18], 1], ["AN", 1, 0, 5], ["AN", 1, 1, 6]]]], "r": [[5.07061e-06, 5.08249e-06, 5.08354e-06], 0, 2.85505, 1667946229], "v": "v0.6"}
{"i": [["[\"sigmoid\", 1, 7, 7, 1152]", "cuda -keys=cuda,gpu -max_num_threads=1024 -model=unknown -thread_warp_size=32", [-1, 16, 64, 49152, 2147483647, 1024, 8, 32], "", 0, []], [[], [["FU", 1, [0, 1, 2, 3]], ["SP", 1, 0, 56448, [4], 1], ["AN", 1, 0, 5], ["AN", 1, 1, 6]]]], "r": [[1.34951e-05, 1.35188e-05, 1.3507e-05], 0, 1.81487, 1667946228], "v": "v0.6"}
{"i": [["[\"sigmoid\", 1, 7, 7, 1152]", "cuda -keys=cuda,gpu -max_num_threads=1024 -model=unknown -thread_warp_size=32", [-1, 16, 64, 49152, 2147483647, 1024, 8, 32], "", 0, []], [[], [["FU", 1, [0, 1, 2, 3]], ["SP", 1, 0, 56448, [6], 1], ["AN", 1, 0, 5], ["AN", 1, 1, 6]]]], "r": [[9.94495e-06, 9.96422e-06, 9.96903e-06], 0, 2.07352, 1667946229], "v": "v0.6"}
{"i": [["[\"sigmoid\", 1, 7, 7, 1152]", "cuda -keys=cuda,gpu -max_num_threads=1024 -model=unknown -thread_warp_size=32", [-1, 16, 64, 49152, 2147483647, 1024, 8, 32], "", 0, []], [[], [["FU", 1, [0, 1, 2, 3]], ["SP", 1, 0, 56448, [21], 1], ["AN", 1, 0, 5], ["AN", 1, 1, 6]]]], "r": [[4.65092e-06, 4.661e-06, 4.6678e-06], 0, 0.617507, 1667946227], "v": "v0.6"}
{"i": [["[\"sigmoid\", 1, 7, 7, 1152]", "cuda -keys=cuda,gpu -max_num_threads=1024 -model=unknown -thread_warp_size=32", [-1, 16, 64, 49152, 2147483647, 1024, 8, 32], "", 0, []], [[], [["FU", 1, [0, 1, 2, 3]], ["SP", 1, 0, 56448, [48], 1], ["AN", 1, 0, 5], ["AN", 1, 1, 6]]]], "r": [[3.55524e-06, 3.5691e-06, 3.56918e-06], 0, 0.984045, 1667946227], "v": "v0.6"}
{"i": [["[\"sigmoid\", 1, 7, 7, 1152]", "cuda -keys=cuda,gpu -max_num_threads=1024 -model=unknown -thread_warp_size=32", [-1, 16, 64, 49152, 2147483647, 1024, 8, 32], "", 0, []], [[], [["FU", 1, [0, 1, 2, 3]], ["SP", 1, 0, 56448, [36], 1], ["AN", 1, 0, 5], ["AN", 1, 1, 6]]]], "r": [[3.76567e-06, 3.77721e-06, 3.77785e-06], 0, 1.46182, 1667946228], "v": "v0.6"}
{"i": [["[\"sigmoid\", 1, 7, 7, 1152]", "cuda -keys=cuda,gpu -max_num_threads=1024 -model=unknown -thread_warp_size=32", [-1, 16, 64, 49152, 2147483647, 1024, 8, 32], "", 0, []], [[], [["FU", 1, [0, 1, 2, 3]], ["SP", 1, 0, 56448, [42], 1], ["AN", 1, 0, 5], ["AN", 1, 1, 6]]]], "r": [[3.87235e-06, 3.87804e-06, 3.8734e-06], 0, 3.13339, 1667946230], "v": "v0.6"}
{"i": [["[\"sigmoid\", 1, 7, 7, 1152]", "cuda -keys=cuda,gpu -max_num_threads=1024 -model=unknown -thread_warp_size=32", [-1, 16, 64, 49152, 2147483647, 1024, 8, 32], "", 0, []], [[], [["FU", 1, [0, 1, 2, 3]], ["SP", 1, 0, 56448, [16], 1], ["AN", 1, 0, 5], ["AN", 1, 1, 6]]]], "r": [[5.31061e-06, 5.32075e-06, 5.3177e-06], 0, 3.38567, 1667946230], "v": "v0.6"}
{"i": [["[\"sigmoid\", 1, 7, 7, 1152]", "cuda -keys=cuda,gpu -max_num_threads=1024 -model=unknown -thread_warp_size=32", [-1, 16, 64, 49152, 2147483647, 1024, 8, 32], "", 0, []], [[], [["FU", 1, [0, 1, 2, 3]], ["SP", 1, 0, 56448, [56], 1], ["AN", 1, 0, 5], ["AN", 1, 1, 6]]]], "r": [[3.30895e-06, 3.30654e-06, 3.30771e-06], 0, 3.69969, 1667946230], "v": "v0.6"}
{"i": [["[\"sigmoid\", 1, 7, 7, 1152]", "cuda -keys=cuda,gpu -max_num_threads=1024 -model=unknown -thread_warp_size=32", [-1, 16, 64, 49152, 2147483647, 1024, 8, 32], "", 0, []], [[], [["FU", 1, [0, 1, 2, 3]], ["SP", 1, 0, 56448, [64], 1], ["AN", 1, 0, 5], ["AN", 1, 1, 6]]]], "r": [[3.31522e-06, 3.33052e-06, 3.31607e-06], 0, 3.84962, 1667946231], "v": "v0.6"}
{"i": [["[\"sigmoid\", 1, 7, 7, 1152]", "cuda -keys=cuda,gpu -max_num_threads=1024 -model=unknown -thread_warp_size=32", [-1, 16, 64, 49152, 2147483647, 1024, 8, 32], "", 0, []], [[], [["FU", 1, [0, 1, 2, 3]], ["SP", 1, 0, 56448, [2], 1], ["AN", 1, 0, 5], ["AN", 1, 1, 6]]]], "r": [[2.38406e-05, 2.38509e-05, 2.38464e-05], 0, 4.15766, 1667946231], "v": "v0.6"}
{"i": [["[\"sigmoid\", 1, 7, 7, 1152]", "cuda -keys=cuda,gpu -max_num_threads=1024 -model=unknown -thread_warp_size=32", [-1, 16, 64, 49152, 2147483647, 1024, 8, 32], "", 0, []], [[], [["FU", 1, [0, 1, 2, 3]], ["SP", 1, 0, 56448, [28], 1], ["AN", 1, 0, 5], ["AN", 1, 1, 6]]]], "r": [[4.13623e-06, 4.14951e-06, 4.14658e-06], 0, 4.40666, 1667946231], "v": "v0.6"}
{"i": [["[\"sigmoid\", 1, 7, 7, 1152]", "cuda -keys=cuda,gpu -max_num_threads=1024 -model=unknown -thread_warp_size=32", [-1, 16, 64, 49152, 2147483647, 1024, 8, 32], "", 0, []], [[], [["FU", 1, [0, 1, 2, 3]], ["SP", 1, 0, 56448, [24], 1], ["AN", 1, 0, 5], ["AN", 1, 1, 6]]]], "r": [[4.38175e-06, 4.40333e-06, 4.3981e-06], 0, 4.65075, 1667946232], "v": "v0.6"}
{"i": [["[\"sigmoid\", 1, 7, 7, 1152]", "cuda -keys=cuda,gpu -max_num_threads=1024 -model=unknown -thread_warp_size=32", [-1, 16, 64, 49152, 2147483647, 1024, 8, 32], "", 0, []], [[], [["FU", 1, [0, 1, 2, 3]], ["SP", 1, 0, 56448, [49], 1], ["AN", 1, 0, 5], ["AN", 1, 1, 6]]]], "r": [[3.66646e-06, 3.67796e-06, 3.67943e-06], 0, 4.96539, 1667946232], "v": "v0.6"}
{"i": [["[\"sigmoid\", 1, 7, 7, 1152]", "cuda -keys=cuda,gpu -max_num_threads=1024 -model=unknown -thread_warp_size=32", [-1, 16, 64, 49152, 2147483647, 1024, 8, 32], "", 0, []], [[], [["FU", 1, [0, 1, 2, 3]], ["SP", 1, 0, 56448, [3], 1], ["AN", 1, 0, 5], ["AN", 1, 1, 6]]]], "r": [[1.68863e-05, 1.68942e-05, 1.68943e-05], 0, 5.28656, 1667946232], "v": "v0.6"}
{"i": [["[\"sigmoid\", 1, 7, 7, 1152]", "cuda -keys=cuda,gpu -max_num_threads=1024 -model=unknown -thread_warp_size=32", [-1, 16, 64, 49152, 2147483647, 1024, 8, 32], "", 0, []], [[], [["FU", 1, [0, 1, 2, 3]], ["SP", 1, 0, 56448, [1], 1], ["AN", 1, 0, 5], ["AN", 1, 1, 6]]]], "r": [[4.47324e-05, 4.47496e-05, 4.47503e-05], 0, 5.43759, 1667946233], "v": "v0.6"}
{"i": [["[\"sigmoid\", 1, 7, 7, 1152]", "cuda -keys=cuda,gpu -max_num_threads=1024 -model=unknown -thread_warp_size=32", [-1, 16, 64, 49152, 2147483647, 1024, 8, 32], "", 0, []], [[], [["FU", 1, [0, 1, 2, 3]], ["SP", 1, 0, 56448, [14], 1], ["AN", 1, 0, 5], ["AN", 1, 1, 6]]]], "r": [[5.68727e-06, 5.70173e-06, 5.70321e-06], 0, 5.72472, 1667946233], "v": "v0.6"}
{"i": [["[\"sigmoid\", 1, 7, 7, 1152]", "cuda -keys=cuda,gpu -max_num_threads=1024 -model=unknown -thread_warp_size=32", [-1, 16, 64, 49152, 2147483647, 1024, 8, 32], "", 0, []], [[], [["FU", 1, [0, 1, 2, 3]], ["SP", 1, 0, 56448, [32], 1], ["AN", 1, 0, 5], ["AN", 1, 1, 6]]]], "r": [[3.89798e-06, 3.91004e-06, 3.90801e-06], 0, 2.49645, 1667946229], "v": "v0.6"}
{"i": [["[\"sigmoid\", 1, 7, 7, 1152]", "cuda -keys=cuda,gpu -max_num_threads=1024 -model=unknown -thread_warp_size=32", [-1, 16, 64, 49152, 2147483647, 1024, 8, 32], "", 0, []], [[], [["FU", 1, [0, 1, 2, 3]], ["SP", 1, 0, 56448, [7], 1], ["AN", 1, 0, 5], ["AN", 1, 1, 6]]]], "r": [[8.74465e-06, 8.76044e-06, 8.75731e-06], 0, 6.00075, 1667946233], "v": "v0.6"}
{"i": [["[\"sigmoid\", 1, 7, 7, 1152]", "cuda -keys=cuda,gpu -max_num_threads=1024 -model=unknown -thread_warp_size=32", [-1, 16, 64, 49152, 2147483647, 1024, 8, 32], "", 0, []], [[], [["FU", 1, [0, 1, 2, 3]], ["SP", 1, 0, 56448, [9], 1], ["AN", 1, 0, 5], ["AN", 1, 1, 6]]]], "r": [[7.41673e-06, 7.43779e-06, 7.42888e-06], 0, 6.25198, 1667946234], "v": "v0.6"}
{"i": [["[\"sigmoid\", 1, 7, 7, 1152]", "cuda -keys=cuda,gpu -max_num_threads=1024 -model=unknown -thread_warp_size=32", [-1, 16, 64, 49152, 2147483647, 1024, 8, 32], "", 0, []], [[], [["FU", 1, [0, 1, 2, 3]], ["SP", 1, 0, 56448, [63], 1], ["AN", 1, 0, 5], ["AN", 1, 1, 6]]]], "r": [[3.30685e-06, 3.31783e-06, 3.31693e-06], 0, 6.57511, 1667946234], "v": "v0.6"}
{"i": [["[\"sigmoid\", 1, 7, 7, 1152]", "cuda -keys=cuda,gpu -max_num_threads=1024 -model=unknown -thread_warp_size=32", [-1, 16, 64, 49152, 2147483647, 1024, 8, 32], "", 0, []], [[], [["FU", 1, [0, 1, 2, 3]], ["SP", 1, 0, 56448, [7], 1], ["AN", 1, 0, 5], ["AN", 1, 1, 6]]]], "r": [[8.75249e-06, 8.76547e-06, 8.77484e-06], 0, 1.91731, 1667947550], "v": "v0.6"}
{"i": [["[\"sigmoid\", 1, 7, 7, 1152]", "cuda -keys=cuda,gpu -max_num_threads=1024 -model=unknown -thread_warp_size=32", [-1, 16, 64, 49152, 2147483647, 1024, 8, 32], "", 0, []], [[], [["FU", 1, [0, 1, 2, 3]], ["SP", 1, 0, 56448, [6], 1], ["AN", 1, 0, 5], ["AN", 1, 1, 6]]]], "r": [[1.00117e-05, 1.00224e-05, 1.00252e-05], 0, 0.613582, 1667947549], "v": "v0.6"}
{"i": [["[\"sigmoid\", 1, 7, 7, 1152]", "cuda -keys=cuda,gpu -max_num_threads=1024 -model=unknown -thread_warp_size=32", [-1, 16, 64, 49152, 2147483647, 1024, 8, 32], "", 0, []], [[], [["FU", 1, [0, 1, 2, 3]], ["SP", 1, 0, 56448, [56], 1], ["AN", 1, 0, 5], ["AN", 1, 1, 6]]]], "r": [[3.35109e-06, 3.3761e-06, 3.37438e-06], 0, 1.63245, 1667947550], "v": "v0.6"}
{"i": [["[\"sigmoid\", 1, 7, 7, 1152]", "cuda -keys=cuda,gpu -max_num_threads=1024 -model=unknown -thread_warp_size=32", [-1, 16, 64, 49152, 2147483647, 1024, 8, 32], "", 0, []], [[], [["FU", 1, [0, 1, 2, 3]], ["SP", 1, 0, 56448, [36], 1], ["AN", 1, 0, 5], ["AN", 1, 1, 6]]]], "r": [[3.83973e-06, 3.85342e-06, 3.85378e-06], 0, 2.25702, 1667947550], "v": "v0.6"}
{"i": [["[\"sigmoid\", 1, 7, 7, 1152]", "cuda -keys=cuda,gpu -max_num_threads=1024 -model=unknown -thread_warp_size=32", [-1, 16, 64, 49152, 2147483647, 1024, 8, 32], "", 0, []], [[], [["FU", 1, [0, 1, 2, 3]], ["SP", 1, 0, 56448, [8], 1], ["AN", 1, 0, 5], ["AN", 1, 1, 6]]]], "r": [[7.9305e-06, 7.93439e-06, 7.94151e-06], 0, 2.51236, 1667947551], "v": "v0.6"}
{"i": [["[\"sigmoid\", 1, 7, 7, 1152]", "cuda -keys=cuda,gpu -max_num_threads=1024 -model=unknown -thread_warp_size=32", [-1, 16, 64, 49152, 2147483647, 1024, 8, 32], "", 0, []], [[], [["FU", 1, [0, 1, 2, 3]], ["SP", 1, 0, 56448, [2], 1], ["AN", 1, 0, 5], ["AN", 1, 1, 6]]]], "r": [[2.39018e-05, 2.39134e-05, 2.39074e-05], 0, 1.27077, 1667947549], "v": "v0.6"}
{"i": [["[\"sigmoid\", 1, 7, 7, 1152]", "cuda -keys=cuda,gpu -max_num_threads=1024 -model=unknown -thread_warp_size=32", [-1, 16, 64, 49152, 2147483647, 1024, 8, 32], "", 0, []], [[], [["FU", 1, [0, 1, 2, 3]], ["SP", 1, 0, 56448, [9], 1], ["AN", 1, 0, 5], ["AN", 1, 1, 6]]]], "r": [[7.52536e-06, 7.52523e-06, 7.52446e-06], 0, 0.961424, 1667947549], "v": "v0.6"}
{"i": [["[\"sigmoid\", 1, 7, 7, 1152]", "cuda -keys=cuda,gpu -max_num_threads=1024 -model=unknown -thread_warp_size=32", [-1, 16, 64, 49152, 2147483647, 1024, 8, 32], "", 0, []], [[], [["FU", 1, [0, 1, 2, 3]], ["SP", 1, 0, 56448, [4], 1], ["AN", 1, 0, 5], ["AN", 1, 1, 6]]]], "r": [[1.33964e-05, 1.3409e-05, 1.34135e-05], 0, 2.83578, 1667947551], "v": "v0.6"}
{"i": [["[\"sigmoid\", 1, 7, 7, 1152]", "cuda -keys=cuda,gpu -max_num_threads=1024 -model=unknown -thread_warp_size=32", [-1, 16, 64, 49152, 2147483647, 1024, 8, 32], "", 0, []], [[], [["FU", 1, [0, 1, 2, 3]], ["SP", 1, 0, 56448, [42], 1], ["AN", 1, 0, 5], ["AN", 1, 1, 6]]]], "r": [[3.80757e-06, 3.81421e-06, 3.81146e-06], 0, 3.08079, 1667947551], "v": "v0.6"}
{"i": [["[\"sigmoid\", 1, 7, 7, 1152]", "cuda -keys=cuda,gpu -max_num_threads=1024 -model=unknown -thread_warp_size=32", [-1, 16, 64, 49152, 2147483647, 1024, 8, 32], "", 0, []], [[], [["FU", 1, [0, 1, 2, 3]], ["SP", 1, 0, 56448, [18], 1], ["AN", 1, 0, 5], ["AN", 1, 1, 6]]]], "r": [[5.01478e-06, 5.03256e-06, 5.03252e-06], 0, 3.28374, 1667947552], "v": "v0.6"}
{"i": [["[\"sigmoid\", 1, 7, 7, 1152]", "cuda -keys=cuda,gpu -max_num_threads=1024 -model=unknown -thread_warp_size=32", [-1, 16, 64, 49152, 2147483647, 1024, 8, 32], "", 0, []], [[], [["FU", 1, [0, 1, 2, 3]], ["SP", 1, 0, 56448, [16], 1], ["AN", 1, 0, 5], ["AN", 1, 1, 6]]]], "r": [[5.29519e-06, 5.29698e-06, 5.29877e-06], 0, 3.57139, 1667947552], "v": "v0.6"}
{"i": [["[\"sigmoid\", 1, 7, 7, 1152]", "cuda -keys=cuda,gpu -max_num_threads=1024 -model=unknown -thread_warp_size=32", [-1, 16, 64, 49152, 2147483647, 1024, 8, 32], "", 0, []], [[], [["FU", 1, [0, 1, 2, 3]], ["SP", 1, 0, 56448, [63], 1], ["AN", 1, 0, 5], ["AN", 1, 1, 6]]]], "r": [[3.42621e-06, 3.43319e-06, 3.43164e-06], 0, 4.06707, 1667947553], "v": "v0.6"}
{"i": [["[\"sigmoid\", 1, 7, 7, 1152]", "cuda -keys=cuda,gpu -max_num_threads=1024 -model=unknown -thread_warp_size=32", [-1, 16, 64, 49152, 2147483647, 1024, 8, 32], "", 0, []], [[], [["FU", 1, [0, 1, 2, 3]], ["SP", 1, 0, 56448, [3], 1], ["AN", 1, 0, 5], ["AN", 1, 1, 6]]]], "r": [[1.69086e-05, 1.69103e-05, 1.69138e-05], 0, 4.38194, 1667947553], "v": "v0.6"}
{"i": [["[\"sigmoid\", 1, 7, 7, 1152]", "cuda -keys=cuda,gpu -max_num_threads=1024 -model=unknown -thread_warp_size=32", [-1, 16, 64, 49152, 2147483647, 1024, 8, 32], "", 0, []], [[], [["FU", 1, [0, 1, 2, 3]], ["SP", 1, 0, 56448, [64], 1], ["AN", 1, 0, 5], ["AN", 1, 1, 6]]]], "r": [[3.42837e-06, 3.41961e-06, 3.4257e-06], 0, 4.64278, 1667947553], "v": "v0.6"}
{"i": [["[\"sigmoid\", 1, 7, 7, 1152]", "cuda -keys=cuda,gpu -max_num_threads=1024 -model=unknown -thread_warp_size=32", [-1, 16, 64, 49152, 2147483647, 1024, 8, 32], "", 0, []], [[], [["FU", 1, [0, 1, 2, 3]], ["SP", 1, 0, 56448, [12], 1], ["AN", 1, 0, 5], ["AN", 1, 1, 6]]]], "r": [[6.26757e-06, 6.28388e-06, 6.28198e-06], 0, 4.84486, 1667947554], "v": "v0.6"}
{"i": [["[\"sigmoid\", 1, 7, 7, 1152]", "cuda -keys=cuda,gpu -max_num_threads=1024 -model=unknown -thread_warp_size=32", [-1, 16, 64, 49152, 2147483647, 1024, 8, 32], "", 0, []], [[], [["FU", 1, [0, 1, 2, 3]], ["SP", 1, 0, 56448, [14], 1], ["AN", 1, 0, 5], ["AN", 1, 1, 6]]]], "r": [[5.88323e-06, 5.90053e-06, 5.90148e-06], 0, 5.18332, 1667947554], "v": "v0.6"}
{"i": [["[\"sigmoid\", 1, 7, 7, 1152]", "cuda -keys=cuda,gpu -max_num_threads=1024 -model=unknown -thread_warp_size=32", [-1, 16, 64, 49152, 2147483647, 1024, 8, 32], "", 0, []], [[], [["FU", 1, [0, 1, 2, 3]], ["SP", 1, 0, 56448, [24], 1], ["AN", 1, 0, 5], ["AN", 1, 1, 6]]]], "r": [[4.38261e-06, 4.3976e-06, 4.39983e-06], 0, 5.39958, 1667947554], "v": "v0.6"}
{"i": [["[\"sigmoid\", 1, 7, 7, 1152]", "cuda -keys=cuda,gpu -max_num_threads=1024 -model=unknown -thread_warp_size=32", [-1, 16, 64, 49152, 2147483647, 1024, 8, 32], "", 0, []], [[], [["FU", 1, [0, 1, 2, 3]], ["SP", 1, 0, 56448, [1], 1], ["AN", 1, 0, 5], ["AN", 1, 1, 6]]]], "r": [[4.46427e-05, 4.46551e-05, 4.46564e-05], 0, 5.6444, 1667947555], "v": "v0.6"}
{"i": [["[\"sigmoid\", 1, 7, 7, 1152]", "cuda -keys=cuda,gpu -max_num_threads=1024 -model=unknown -thread_warp_size=32", [-1, 16, 64, 49152, 2147483647, 1024, 8, 32], "", 0, []], [[], [["FU", 1, [0, 1, 2, 3]], ["SP", 1, 0, 56448, [28], 1], ["AN", 1, 0, 5], ["AN", 1, 1, 6]]]], "r": [[4.27527e-06, 4.28535e-06, 4.28351e-06], 0, 5.91983, 1667947555], "v": "v0.6"}
{"i": [["[\"sigmoid\", 1, 7, 7, 1152]", "cuda -keys=cuda,gpu -max_num_threads=1024 -model=unknown -thread_warp_size=32", [-1, 16, 64, 49152, 2147483647, 1024, 8, 32], "", 0, []], [[], [["FU", 1, [0, 1, 2, 3]], ["SP", 1, 0, 56448, [49], 1], ["AN", 1, 0, 5], ["AN", 1, 1, 6]]]], "r": [[3.50178e-06, 3.49458e-06, 3.51601e-06], 0, 6.18883, 1667947555], "v": "v0.6"}
{"i": [["[\"sigmoid\", 1, 7, 7, 1152]", "cuda -keys=cuda,gpu -max_num_threads=1024 -model=unknown -thread_warp_size=32", [-1, 16, 64, 49152, 2147483647, 1024, 8, 32], "", 0, []], [[], [["FU", 1, [0, 1, 2, 3]], ["SP", 1, 0, 56448, [32], 1], ["AN", 1, 0, 5], ["AN", 1, 1, 6]]]], "r": [[3.92494e-06, 3.94019e-06, 3.93877e-06], 0, 3.79678, 1667947552], "v": "v0.6"}
{"i": [["[\"sigmoid\", 1, 7, 7, 1152]", "cuda -keys=cuda,gpu -max_num_threads=1024 -model=unknown -thread_warp_size=32", [-1, 16, 64, 49152, 2147483647, 1024, 8, 32], "", 0, []], [[], [["FU", 1, [0, 1, 2, 3]], ["SP", 1, 0, 56448, [48], 1], ["AN", 1, 0, 5], ["AN", 1, 1, 6]]]], "r": [[3.65577e-06, 3.668e-06, 3.66814e-06], 0, 6.46431, 1667947556], "v": "v0.6"}
{"i": [["[\"sigmoid\", 1, 7, 7, 1152]", "cuda -keys=cuda,gpu -max_num_threads=1024 -model=unknown -thread_warp_size=32", [-1, 16, 64, 49152, 2147483647, 1024, 8, 32], "", 0, []], [[], [["FU", 1, [0, 1, 2, 3]], ["SP", 1, 0, 56448, [21], 1], ["AN", 1, 0, 5], ["AN", 1, 1, 6]]]], "r": [[4.79948e-06, 4.81985e-06, 4.81553e-06], 0, 6.73692, 1667947556], "v": "v0.6"}
{"i": [["[\"sigmoid\", 1, 7, 7, 1152]", "cuda -keys=cuda,gpu -max_num_threads=1024 -model=unknown -thread_warp_size=32", [-1, 16, 64, 49152, 2147483647, 1024, 8, 32], "", 0, []], [[], [["FU", 1, [0, 1, 2, 3]], ["SP", 1, 0, 56448, [12], 1], ["AN", 1, 0, 5], ["AN", 1, 1, 6]]]], "r": [[6.17773e-06, 6.19564e-06, 6.19302e-06], 0, 1.44215, 1667947621], "v": "v0.6"}
{"i": [["[\"sigmoid\", 1, 7, 7, 1152]", "cuda -keys=cuda,gpu -max_num_threads=1024 -model=unknown -thread_warp_size=32", [-1, 16, 64, 49152, 2147483647, 1024, 8, 32], "", 0, []], [[], [["FU", 1, [0, 1, 2, 3]], ["SP", 1, 0, 56448, [8], 1], ["AN", 1, 0, 5], ["AN", 1, 1, 6]]]], "r": [[7.97086e-06, 7.98155e-06, 7.98265e-06], 0, 3.00472, 1667947622], "v": "v0.6"}
{"i": [["[\"sigmoid\", 1, 7, 7, 1152]", "cuda -keys=cuda,gpu -max_num_threads=1024 -model=unknown -thread_warp_size=32", [-1, 16, 64, 49152, 2147483647, 1024, 8, 32], "", 0, []], [[], [["FU", 1, [0, 1, 2, 3]], ["SP", 1, 0, 56448, [6], 1], ["AN", 1, 0, 5], ["AN", 1, 1, 6]]]], "r": [[9.89248e-06, 9.90846e-06, 9.89586e-06], 0, 0.580716, 1667947620], "v": "v0.6"}
{"i": [["[\"sigmoid\", 1, 7, 7, 1152]", "cuda -keys=cuda,gpu -max_num_threads=1024 -model=unknown -thread_warp_size=32", [-1, 16, 64, 49152, 2147483647, 1024, 8, 32], "", 0, []], [[], [["FU", 1, [0, 1, 2, 3]], ["SP", 1, 0, 56448, [24], 1], ["AN", 1, 0, 5], ["AN", 1, 1, 6]]]], "r": [[4.58962e-06, 4.60702e-06, 4.60609e-06], 0, 2.7153, 1667947622], "v": "v0.6"}
{"i": [["[\"sigmoid\", 1, 7, 7, 1152]", "cuda -keys=cuda,gpu -max_num_threads=1024 -model=unknown -thread_warp_size=32", [-1, 16, 64, 49152, 2147483647, 1024, 8, 32], "", 0, []], [[], [["FU", 1, [0, 1, 2, 3]], ["SP", 1, 0, 56448, [48], 1], ["AN", 1, 0, 5], ["AN", 1, 1, 6]]]], "r": [[3.54823e-06, 3.56279e-06, 3.56339e-06], 0, 1.81112, 1667947621], "v": "v0.6"}
{"i": [["[\"sigmoid\", 1, 7, 7, 1152]", "cuda -keys=cuda,gpu -max_num_threads=1024 -model=unknown -thread_warp_size=32", [-1, 16, 64, 49152, 2147483647, 1024, 8, 32], "", 0, []], [[], [["FU", 1, [0, 1, 2, 3]], ["SP", 1, 0, 56448, [3], 1], ["AN", 1, 0, 5], ["AN", 1, 1, 6]]]], "r": [[1.70484e-05, 1.70752e-05, 1.70621e-05], 0, 0.875585, 1667947620], "v": "v0.6"}
{"i": [["[\"sigmoid\", 1, 7, 7, 1152]", "cuda -keys=cuda,gpu -max_num_threads=1024 -model=unknown -thread_warp_size=32", [-1, 16, 64, 49152, 2147483647, 1024, 8, 32], "", 0, []], [[], [["FU", 1, [0, 1, 2, 3]], ["SP", 1, 0, 56448, [49], 1], ["AN", 1, 0, 5], ["AN", 1, 1, 6]]]], "r": [[3.69075e-06, 3.70029e-06, 3.70416e-06], 0, 1.19109, 1667947620], "v": "v0.6"}
{"i": [["[\"sigmoid\", 1, 7, 7, 1152]", "cuda -keys=cuda,gpu -max_num_threads=1024 -model=unknown -thread_warp_size=32", [-1, 16, 64, 49152, 2147483647, 1024, 8, 32], "", 0, []], [[], [["FU", 1, [0, 1, 2, 3]], ["SP", 1, 0, 56448, [2], 1], ["AN", 1, 0, 5], ["AN", 1, 1, 6]]]], "r": [[2.38433e-05, 2.38588e-05, 2.38601e-05], 0, 2.07917, 1667947621], "v": "v0.6"}
{"i": [["[\"sigmoid\", 1, 7, 7, 1152]", "cuda -keys=cuda,gpu -max_num_threads=1024 -model=unknown -thread_warp_size=32", [-1, 16, 64, 49152, 2147483647, 1024, 8, 32], "", 0, []], [[], [["FU", 1, [0, 1, 2, 3]], ["SP", 1, 0, 56448, [32], 1], ["AN", 1, 0, 5], ["AN", 1, 1, 6]]]], "r": [[3.91666e-06, 3.92686e-06, 3.92927e-06], 0, 4.33979, 1667947624], "v": "v0.6"}
{"i": [["[\"sigmoid\", 1, 7, 7, 1152]", "cuda -keys=cuda,gpu -max_num_threads=1024 -model=unknown -thread_warp_size=32", [-1, 16, 64, 49152, 2147483647, 1024, 8, 32], "", 0, []], [[], [["FU", 1, [0, 1, 2, 3]], ["SP", 1, 0, 56448, [36], 1], ["AN", 1, 0, 5], ["AN", 1, 1, 6]]]], "r": [[3.84846e-06, 3.85894e-06, 3.85306e-06], 0, 2.32629, 1667947622], "v": "v0.6"}
{"i": [["[\"sigmoid\", 1, 7, 7, 1152]", "cuda -keys=cuda,gpu -max_num_threads=1024 -model=unknown -thread_warp_size=32", [-1, 16, 64, 49152, 2147483647, 1024, 8, 32], "", 0, []], [[], [["FU", 1, [0, 1, 2, 3]], ["SP", 1, 0, 56448, [7], 1], ["AN", 1, 0, 5], ["AN", 1, 1, 6]]]], "r": [[8.75786e-06, 8.76781e-06, 8.76231e-06], 0, 3.73435, 1667947623], "v": "v0.6"}
{"i": [["[\"sigmoid\", 1, 7, 7, 1152]", "cuda -keys=cuda,gpu -max_num_threads=1024 -model=unknown -thread_warp_size=32", [-1, 16, 64, 49152, 2147483647, 1024, 8, 32], "", 0, []], [[], [["FU", 1, [0, 1, 2, 3]], ["SP", 1, 0, 56448, [21], 1], ["AN", 1, 0, 5], ["AN", 1, 1, 6]]]], "r": [[4.70098e-06, 4.71937e-06, 4.71855e-06], 0, 3.47827, 1667947623], "v": "v0.6"}
{"i": [["[\"sigmoid\", 1, 7, 7, 1152]", "cuda -keys=cuda,gpu -max_num_threads=1024 -model=unknown -thread_warp_size=32", [-1, 16, 64, 49152, 2147483647, 1024, 8, 32], "", 0, []], [[], [["FU", 1, [0, 1, 2, 3]], ["SP", 1, 0, 56448, [56], 1], ["AN", 1, 0, 5], ["AN", 1, 1, 6]]]], "r": [[3.37283e-06, 3.38482e-06, 3.38414e-06], 0, 3.97348, 1667947624], "v": "v0.6"}
{"i": [["[\"sigmoid\", 1, 7, 7, 1152]", "cuda -keys=cuda,gpu -max_num_threads=1024 -model=unknown -thread_warp_size=32", [-1, 16, 64, 49152, 2147483647, 1024, 8, 32], "", 0, []], [[], [["FU", 1, [0, 1, 2, 3]], ["SP", 1, 0, 56448, [16], 1], ["AN", 1, 0, 5], ["AN", 1, 1, 6]]]], "r": [[5.28224e-06, 5.2855e-06, 5.28908e-06], 0, 4.5266, 1667947624], "v": "v0.6"}
{"i": [["[\"sigmoid\", 1, 7, 7, 1152]", "cuda -keys=cuda,gpu -max_num_threads=1024 -model=unknown -thread_warp_size=32", [-1, 16, 64, 49152, 2147483647, 1024, 8, 32], "", 0, []], [[], [["FU", 1, [0, 1, 2, 3]], ["SP", 1, 0, 56448, [63], 1], ["AN", 1, 0, 5], ["AN", 1, 1, 6]]]], "r": [[3.23172e-06, 3.23678e-06, 3.23072e-06], 0, 4.81962, 1667947625], "v": "v0.6"}
{"i": [["[\"sigmoid\", 1, 7, 7, 1152]", "cuda -keys=cuda,gpu -max_num_threads=1024 -model=unknown -thread_warp_size=32", [-1, 16, 64, 49152, 2147483647, 1024, 8, 32], "", 0, []], [[], [["FU", 1, [0, 1, 2, 3]], ["SP", 1, 0, 56448, [14], 1], ["AN", 1, 0, 5], ["AN", 1, 1, 6]]]], "r": [[5.74095e-06, 5.75306e-06, 5.75181e-06], 0, 5.06696, 1667947625], "v": "v0.6"}
{"i": [["[\"sigmoid\", 1, 7, 7, 1152]", "cuda -keys=cuda,gpu -max_num_threads=1024 -model=unknown -thread_warp_size=32", [-1, 16, 64, 49152, 2147483647, 1024, 8, 32], "", 0, []], [[], [["FU", 1, [0, 1, 2, 3]], ["SP", 1, 0, 56448, [4], 1], ["AN", 1, 0, 5], ["AN", 1, 1, 6]]]], "r": [[1.34593e-05, 1.34671e-05, 1.34575e-05], 0, 5.65114, 1667947626], "v": "v0.6"}
{"i": [["[\"sigmoid\", 1, 7, 7, 1152]", "cuda -keys=cuda,gpu -max_num_threads=1024 -model=unknown -thread_warp_size=32", [-1, 16, 64, 49152, 2147483647, 1024, 8, 32], "", 0, []], [[], [["FU", 1, [0, 1, 2, 3]], ["SP", 1, 0, 56448, [28], 1], ["AN", 1, 0, 5], ["AN", 1, 1, 6]]]], "r": [[4.09017e-06, 4.10073e-06, 4.1005e-06], 0, 5.35693, 1667947625], "v": "v0.6"}
{"i": [["[\"sigmoid\", 1, 7, 7, 1152]", "cuda -keys=cuda,gpu -max_num_threads=1024 -model=unknown -thread_warp_size=32", [-1, 16, 64, 49152, 2147483647, 1024, 8, 32], "", 0, []], [[], [["FU", 1, [0, 1, 2, 3]], ["SP", 1, 0, 56448, [9], 1], ["AN", 1, 0, 5], ["AN", 1, 1, 6]]]], "r": [[7.42431e-06, 7.43088e-06, 7.43071e-06], 0, 5.92604, 1667947626], "v": "v0.6"}
{"i": [["[\"sigmoid\", 1, 7, 7, 1152]", "cuda -keys=cuda,gpu -max_num_threads=1024 -model=unknown -thread_warp_size=32", [-1, 16, 64, 49152, 2147483647, 1024, 8, 32], "", 0, []], [[], [["FU", 1, [0, 1, 2, 3]], ["SP", 1, 0, 56448, [64], 1], ["AN", 1, 0, 5], ["AN", 1, 1, 6]]]], "r": [[3.44923e-06, 3.46267e-06, 3.46231e-06], 0, 3.16083, 1667947623], "v": "v0.6"}
{"i": [["[\"sigmoid\", 1, 7, 7, 1152]", "cuda -keys=cuda,gpu -max_num_threads=1024 -model=unknown -thread_warp_size=32", [-1, 16, 64, 49152, 2147483647, 1024, 8, 32], "", 0, []], [[], [["FU", 1, [0, 1, 2, 3]], ["SP", 1, 0, 56448, [42], 1], ["AN", 1, 0, 5], ["AN", 1, 1, 6]]]], "r": [[3.87021e-06, 3.8821e-06, 3.88535e-06], 0, 6.07853, 1667947626], "v": "v0.6"}
{"i": [["[\"sigmoid\", 1, 7, 7, 1152]", "cuda -keys=cuda,gpu -max_num_threads=1024 -model=unknown -thread_warp_size=32", [-1, 16, 64, 49152, 2147483647, 1024, 8, 32], "", 0, []], [[], [["FU", 1, [0, 1, 2, 3]], ["SP", 1, 0, 56448, [18], 1], ["AN", 1, 0, 5], ["AN", 1, 1, 6]]]], "r": [[5.00427e-06, 5.02185e-06, 5.02541e-06], 0, 6.36985, 1667947627], "v": "v0.6"}
{"i": [["[\"sigmoid\", 1, 7, 7, 1152]", "cuda -keys=cuda,gpu -max_num_threads=1024 -model=unknown -thread_warp_size=32", [-1, 16, 64, 49152, 2147483647, 1024, 8, 32], "", 0, []], [[], [["FU", 1, [0, 1, 2, 3]], ["SP", 1, 0, 56448, [1], 1], ["AN", 1, 0, 5], ["AN", 1, 1, 6]]]], "r": [[4.4673e-05, 4.46974e-05, 4.46857e-05], 0, 6.62884, 1667947627], "v": "v0.6"}
{"i": [["[\"sigmoid\", 1, 7, 7, 1152]", "cuda -keys=cuda,gpu -max_num_threads=1024 -model=unknown -thread_warp_size=32", [-1, 16, 64, 49152, 2147483647, 1024, 8, 32], "", 0, []], [[], [["FU", 1, [0, 1, 2, 3]], ["SP", 1, 0, 56448, [49], 1], ["AN", 1, 0, 5], ["AN", 1, 1, 6]]]], "r": [[3.41607e-06, 3.4146e-06, 3.41464e-06], 0, 0.61204, 1667947812], "v": "v0.6"}
{"i": [["[\"sigmoid\", 1, 7, 7, 1152]", "cuda -keys=cuda,gpu -max_num_threads=1024 -model=unknown -thread_warp_size=32", [-1, 16, 64, 49152, 2147483647, 1024, 8, 32], "", 0, []], [[], [["FU", 1, [0, 1, 2, 3]], ["SP", 1, 0, 56448, [28], 1], ["AN", 1, 0, 5], ["AN", 1, 1, 6]]]], "r": [[4.31161e-06, 4.32336e-06, 4.32082e-06], 0, 2.38377, 1667947814], "v": "v0.6"}
{"i": [["[\"sigmoid\", 1, 7, 7, 1152]", "cuda -keys=cuda,gpu -max_num_threads=1024 -model=unknown -thread_warp_size=32", [-1, 16, 64, 49152, 2147483647, 1024, 8, 32], "", 0, []], [[], [["FU", 1, [0, 1, 2, 3]], ["SP", 1, 0, 56448, [36], 1], ["AN", 1, 0, 5], ["AN", 1, 1, 6]]]], "r": [[3.90564e-06, 3.92006e-06, 3.91912e-06], 0, 1.28047, 1667947813], "v": "v0.6"}
{"i": [["[\"sigmoid\", 1, 7, 7, 1152]", "cuda -keys=cuda,gpu -max_num_threads=1024 -model=unknown -thread_warp_size=32", [-1, 16, 64, 49152, 2147483647, 1024, 8, 32], "", 0, []], [[], [["FU", 1, [0, 1, 2, 3]], ["SP", 1, 0, 56448, [14], 1], ["AN", 1, 0, 5], ["AN", 1, 1, 6]]]], "r": [[5.8009e-06, 5.81517e-06, 5.81129e-06], 0, 1.86702, 1667947814], "v": "v0.6"}
{"i": [["[\"sigmoid\", 1, 7, 7, 1152]", "cuda -keys=cuda,gpu -max_num_threads=1024 -model=unknown -thread_warp_size=32", [-1, 16, 64, 49152, 2147483647, 1024, 8, 32], "", 0, []], [[], [["FU", 1, [0, 1, 2, 3]], ["SP", 1, 0, 56448, [1], 1], ["AN", 1, 0, 5], ["AN", 1, 1, 6]]]], "r": [[4.46825e-05, 4.46852e-05, 4.47054e-05], 0, 2.67548, 1667947815], "v": "v0.6"}
{"i": [["[\"sigmoid\", 1, 7, 7, 1152]", "cuda -keys=cuda,gpu -max_num_threads=1024 -model=unknown -thread_warp_size=32", [-1, 16, 64, 49152, 2147483647, 1024, 8, 32], "", 0, []], [[], [["FU", 1, [0, 1, 2, 3]], ["SP", 1, 0, 56448, [3], 1], ["AN", 1, 0, 5], ["AN", 1, 1, 6]]]], "r": [[1.68907e-05, 1.69052e-05, 1.68964e-05], 0, 1.53512, 1667947813], "v": "v0.6"}
{"i": [["[\"sigmoid\", 1, 7, 7, 1152]", "cuda -keys=cuda,gpu -max_num_threads=1024 -model=unknown -thread_warp_size=32", [-1, 16, 64, 49152, 2147483647, 1024, 8, 32], "", 0, []], [[], [["FU", 1, [0, 1, 2, 3]], ["SP", 1, 0, 56448, [56], 1], ["AN", 1, 0, 5], ["AN", 1, 1, 6]]]], "r": [[3.37256e-06, 3.38674e-06, 3.38941e-06], 0, 1.07498, 1667947813], "v": "v0.6"}
{"i": [["[\"sigmoid\", 1, 7, 7, 1152]", "cuda -keys=cuda,gpu -max_num_threads=1024 -model=unknown -thread_warp_size=32", [-1, 16, 64, 49152, 2147483647, 1024, 8, 32], "", 0, []], [[], [["FU", 1, [0, 1, 2, 3]], ["SP", 1, 0, 56448, [12], 1], ["AN", 1, 0, 5], ["AN", 1, 1, 6]]]], "r": [[6.39277e-06, 6.4044e-06, 6.40712e-06], 0, 2.94377, 1667947815], "v": "v0.6"}
{"i": [["[\"sigmoid\", 1, 7, 7, 1152]", "cuda -keys=cuda,gpu -max_num_threads=1024 -model=unknown -thread_warp_size=32", [-1, 16, 64, 49152, 2147483647, 1024, 8, 32], "", 0, []], [[], [["FU", 1, [0, 1, 2, 3]], ["SP", 1, 0, 56448, [64], 1], ["AN", 1, 0, 5], ["AN", 1, 1, 6]]]], "r": [[3.44415e-06, 3.45447e-06, 3.45571e-06], 0, 3.21654, 1667947815], "v": "v0.6"}
{"i": [["[\"sigmoid\", 1, 7, 7, 1152]", "cuda -keys=cuda,gpu -max_num_threads=1024 -model=unknown -thread_warp_size=32", [-1, 16, 64, 49152, 2147483647, 1024, 8, 32], "", 0, []], [[], [["FU", 1, [0, 1, 2, 3]], ["SP", 1, 0, 56448, [18], 1], ["AN", 1, 0, 5], ["AN", 1, 1, 6]]]], "r": [[5.19872e-06, 5.21523e-06, 5.21259e-06], 0, 2.07029, 1667947814], "v": "v0.6"}
{"i": [["[\"sigmoid\", 1, 7, 7, 1152]", "cuda -keys=cuda,gpu -max_num_threads=1024 -model=unknown -thread_warp_size=32", [-1, 16, 64, 49152, 2147483647, 1024, 8, 32], "", 0, []], [[], [["FU", 1, [0, 1, 2, 3]], ["SP", 1, 0, 56448, [4], 1], ["AN", 1, 0, 5], ["AN", 1, 1, 6]]]], "r": [[1.34492e-05, 1.34685e-05, 1.34582e-05], 0, 3.48807, 1667947816], "v": "v0.6"}
{"i": [["[\"sigmoid\", 1, 7, 7, 1152]", "cuda -keys=cuda,gpu -max_num_threads=1024 -model=unknown -thread_warp_size=32", [-1, 16, 64, 49152, 2147483647, 1024, 8, 32], "", 0, []], [[], [["FU", 1, [0, 1, 2, 3]], ["SP", 1, 0, 56448, [2], 1], ["AN", 1, 0, 5], ["AN", 1, 1, 6]]]], "r": [[2.38778e-05, 2.38888e-05, 2.38868e-05], 0, 3.7712, 1667947816], "v": "v0.6"}
{"i": [["[\"sigmoid\", 1, 7, 7, 1152]", "cuda -keys=cuda,gpu -max_num_threads=1024 -model=unknown -thread_warp_size=32", [-1, 16, 64, 49152, 2147483647, 1024, 8, 32], "", 0, []], [[], [["FU", 1, [0, 1, 2, 3]], ["SP", 1, 0, 56448, [21], 1], ["AN", 1, 0, 5], ["AN", 1, 1, 6]]]], "r": [[4.87136e-06, 4.88765e-06, 4.89221e-06], 0, 4.01795, 1667947816], "v": "v0.6"}
{"i": [["[\"sigmoid\", 1, 7, 7, 1152]", "cuda -keys=cuda,gpu -max_num_threads=1024 -model=unknown -thread_warp_size=32", [-1, 16, 64, 49152, 2147483647, 1024, 8, 32], "", 0, []], [[], [["FU", 1, [0, 1, 2, 3]], ["SP", 1, 0, 56448, [63], 1], ["AN", 1, 0, 5], ["AN", 1, 1, 6]]]], "r": [[3.32825e-06, 3.34184e-06, 3.34077e-06], 0, 4.28322, 1667947817], "v": "v0.6"}
{"i": [["[\"sigmoid\", 1, 7, 7, 1152]", "cuda -keys=cuda,gpu -max_num_threads=1024 -model=unknown -thread_warp_size=32", [-1, 16, 64, 49152, 2147483647, 1024, 8, 32], "", 0, []], [[], [["FU", 1, [0, 1, 2, 3]], ["SP", 1, 0, 56448, [48], 1], ["AN", 1, 0, 5], ["AN", 1, 1, 6]]]], "r": [[3.67188e-06, 3.68813e-06, 3.68587e-06], 0, 4.54936, 1667947817], "v": "v0.6"}
{"i": [["[\"sigmoid\", 1, 7, 7, 1152]", "cuda -keys=cuda,gpu -max_num_threads=1024 -model=unknown -thread_warp_size=32", [-1, 16, 64, 49152, 2147483647, 1024, 8, 32], "", 0, []], [[], [["FU", 1, [0, 1, 2, 3]], ["SP", 1, 0, 56448, [6], 1], ["AN", 1, 0, 5], ["AN", 1, 1, 6]]]], "r": [[1.00207e-05, 1.00322e-05, 1.00313e-05], 0, 4.68101, 1667947817], "v": "v0.6"}
{"i": [["[\"sigmoid\", 1, 7, 7, 1152]", "cuda -keys=cuda,gpu -max_num_threads=1024 -model=unknown -thread_warp_size=32", [-1, 16, 64, 49152, 2147483647, 1024, 8, 32], "", 0, []], [[], [["FU", 1, [0, 1, 2, 3]], ["SP", 1, 0, 56448, [24], 1], ["AN", 1, 0, 5], ["AN", 1, 1, 6]]]], "r": [[4.36316e-06, 4.37228e-06, 4.37162e-06], 0, 5.59052, 1667947818], "v": "v0.6"}
{"i": [["[\"sigmoid\", 1, 7, 7, 1152]", "cuda -keys=cuda,gpu -max_num_threads=1024 -model=unknown -thread_warp_size=32", [-1, 16, 64, 49152, 2147483647, 1024, 8, 32], "", 0, []], [[], [["FU", 1, [0, 1, 2, 3]], ["SP", 1, 0, 56448, [42], 1], ["AN", 1, 0, 5], ["AN", 1, 1, 6]]]], "r": [[3.62633e-06, 3.63964e-06, 3.64216e-06], 0, 5.27699, 1667947818], "v": "v0.6"}
{"i": [["[\"sigmoid\", 1, 7, 7, 1152]", "cuda -keys=cuda,gpu -max_num_threads=1024 -model=unknown -thread_warp_size=32", [-1, 16, 64, 49152, 2147483647, 1024, 8, 32], "", 0, []], [[], [["FU", 1, [0, 1, 2, 3]], ["SP", 1, 0, 56448, [16], 1], ["AN", 1, 0, 5], ["AN", 1, 1, 6]]]], "r": [[5.29278e-06, 5.31473e-06, 5.31147e-06], 0, 5.0378, 1667947818], "v": "v0.6"}
{"i": [["[\"sigmoid\", 1, 7, 7, 1152]", "cuda -keys=cuda,gpu -max_num_threads=1024 -model=unknown -thread_warp_size=32", [-1, 16, 64, 49152, 2147483647, 1024, 8, 32], "", 0, []], [[], [["FU", 1, [0, 1, 2, 3]], ["SP", 1, 0, 56448, [32], 1], ["AN", 1, 0, 5], ["AN", 1, 1, 6]]]], "r": [[3.92459e-06, 3.93985e-06, 3.94048e-06], 0, 6.42565, 1667947819], "v": "v0.6"}
{"i": [["[\"sigmoid\", 1, 7, 7, 1152]", "cuda -keys=cuda,gpu -max_num_threads=1024 -model=unknown -thread_warp_size=32", [-1, 16, 64, 49152, 2147483647, 1024, 8, 32], "", 0, []], [[], [["FU", 1, [0, 1, 2, 3]], ["SP", 1, 0, 56448, [7], 1], ["AN", 1, 0, 5], ["AN", 1, 1, 6]]]], "r": [[8.80358e-06, 8.81468e-06, 8.81062e-06], 0, 5.89161, 1667947819], "v": "v0.6"}
{"i": [["[\"sigmoid\", 1, 7, 7, 1152]", "cuda -keys=cuda,gpu -max_num_threads=1024 -model=unknown -thread_warp_size=32", [-1, 16, 64, 49152, 2147483647, 1024, 8, 32], "", 0, []], [[], [["FU", 1, [0, 1, 2, 3]], ["SP", 1, 0, 56448, [9], 1], ["AN", 1, 0, 5], ["AN", 1, 1, 6]]]], "r": [[7.49259e-06, 7.50498e-06, 7.50301e-06], 0, 6.12486, 1667947819], "v": "v0.6"}
{"i": [["[\"sigmoid\", 1, 7, 7, 1152]", "cuda -keys=cuda,gpu -max_num_threads=1024 -model=unknown -thread_warp_size=32", [-1, 16, 64, 49152, 2147483647, 1024, 8, 32], "", 0, []], [[], [["FU", 1, [0, 1, 2, 3]], ["SP", 1, 0, 56448, [8], 1], ["AN", 1, 0, 5], ["AN", 1, 1, 6]]]], "r": [[8.03479e-06, 8.03783e-06, 8.04298e-06], 0, 6.6633, 1667947820], "v": "v0.6"}
{"i": [["[\"sigmoid\", 1, 7, 7, 1152]", "cuda -keys=cuda,gpu -max_num_threads=1024 -model=unknown -thread_warp_size=32", [-1, 16, 64, 49152, 2147483647, 1024, 8, 32], "", 0, []], [[], [["FU", 1, [0, 1, 2, 3]], ["SP", 1, 0, 56448, [48], 1], ["AN", 1, 0, 5], ["AN", 1, 1, 6]]]], "r": [[3.53809e-06, 3.55485e-06, 3.55613e-06], 0, 0.965643, 1667947884], "v": "v0.6"}
{"i": [["[\"sigmoid\", 1, 7, 7, 1152]", "cuda -keys=cuda,gpu -max_num_threads=1024 -model=unknown -thread_warp_size=32", [-1, 16, 64, 49152, 2147483647, 1024, 8, 32], "", 0, []], [[], [["FU", 1, [0, 1, 2, 3]], ["SP", 1, 0, 56448, [12], 1], ["AN", 1, 0, 5], ["AN", 1, 1, 6]]]], "r": [[6.09921e-06, 6.11016e-06, 6.11026e-06], 0, 3.31809, 1667947886], "v": "v0.6"}
{"i": [["[\"sigmoid\", 1, 7, 7, 1152]", "cuda -keys=cuda,gpu -max_num_threads=1024 -model=unknown -thread_warp_size=32", [-1, 16, 64, 49152, 2147483647, 1024, 8, 32], "", 0, []], [[], [["FU", 1, [0, 1, 2, 3]], ["SP", 1, 0, 56448, [9], 1], ["AN", 1, 0, 5], ["AN", 1, 1, 6]]]], "r": [[7.40167e-06, 7.42115e-06, 7.41681e-06], 0, 1.28828, 1667947884], "v": "v0.6"}
{"i": [["[\"sigmoid\", 1, 7, 7, 1152]", "cuda -keys=cuda,gpu -max_num_threads=1024 -model=unknown -thread_warp_size=32", [-1, 16, 64, 49152, 2147483647, 1024, 8, 32], "", 0, []], [[], [["FU", 1, [0, 1, 2, 3]], ["SP", 1, 0, 56448, [56], 1], ["AN", 1, 0, 5], ["AN", 1, 1, 6]]]], "r": [[3.34621e-06, 3.35873e-06, 3.35807e-06], 0, 1.87578, 1667947885], "v": "v0.6"}
{"i": [["[\"sigmoid\", 1, 7, 7, 1152]", "cuda -keys=cuda,gpu -max_num_threads=1024 -model=unknown -thread_warp_size=32", [-1, 16, 64, 49152, 2147483647, 1024, 8, 32], "", 0, []], [[], [["FU", 1, [0, 1, 2, 3]], ["SP", 1, 0, 56448, [28], 1], ["AN", 1, 0, 5], ["AN", 1, 1, 6]]]], "r": [[4.13534e-06, 4.14661e-06, 4.1476e-06], 0, 1.57873, 1667947884], "v": "v0.6"}
{"i": [["[\"sigmoid\", 1, 7, 7, 1152]", "cuda -keys=cuda,gpu -max_num_threads=1024 -model=unknown -thread_warp_size=32", [-1, 16, 64, 49152, 2147483647, 1024, 8, 32], "", 0, []], [[], [["FU", 1, [0, 1, 2, 3]], ["SP", 1, 0, 56448, [24], 1], ["AN", 1, 0, 5], ["AN", 1, 1, 6]]]], "r": [[4.3223e-06, 4.33305e-06, 4.33252e-06], 0, 2.10701, 1667947885], "v": "v0.6"}
{"i": [["[\"sigmoid\", 1, 7, 7, 1152]", "cuda -keys=cuda,gpu -max_num_threads=1024 -model=unknown -thread_warp_size=32", [-1, 16, 64, 49152, 2147483647, 1024, 8, 32], "", 0, []], [[], [["FU", 1, [0, 1, 2, 3]], ["SP", 1, 0, 56448, [21], 1], ["AN", 1, 0, 5], ["AN", 1, 1, 6]]]], "r": [[4.69816e-06, 4.70425e-06, 4.70874e-06], 0, 0.642499, 1667947883], "v": "v0.6"}
{"i": [["[\"sigmoid\", 1, 7, 7, 1152]", "cuda -keys=cuda,gpu -max_num_threads=1024 -model=unknown -thread_warp_size=32", [-1, 16, 64, 49152, 2147483647, 1024, 8, 32], "", 0, []], [[], [["FU", 1, [0, 1, 2, 3]], ["SP", 1, 0, 56448, [42], 1], ["AN", 1, 0, 5], ["AN", 1, 1, 6]]]], "r": [[3.80035e-06, 3.81542e-06, 3.81078e-06], 0, 2.36807, 1667947885], "v": "v0.6"}
{"i": [["[\"sigmoid\", 1, 7, 7, 1152]", "cuda -keys=cuda,gpu -max_num_threads=1024 -model=unknown -thread_warp_size=32", [-1, 16, 64, 49152, 2147483647, 1024, 8, 32], "", 0, []], [[], [["FU", 1, [0, 1, 2, 3]], ["SP", 1, 0, 56448, [7], 1], ["AN", 1, 0, 5], ["AN", 1, 1, 6]]]], "r": [[8.96862e-06, 8.97801e-06, 8.98262e-06], 0, 2.69713, 1667947886], "v": "v0.6"}
{"i": [["[\"sigmoid\", 1, 7, 7, 1152]", "cuda -keys=cuda,gpu -max_num_threads=1024 -model=unknown -thread_warp_size=32", [-1, 16, 64, 49152, 2147483647, 1024, 8, 32], "", 0, []], [[], [["FU", 1, [0, 1, 2, 3]], ["SP", 1, 0, 56448, [14], 1], ["AN", 1, 0, 5], ["AN", 1, 1, 6]]]], "r": [[5.68635e-06, 5.69524e-06, 5.69509e-06], 0, 3.01624, 1667947886], "v": "v0.6"}
{"i": [["[\"sigmoid\", 1, 7, 7, 1152]", "cuda -keys=cuda,gpu -max_num_threads=1024 -model=unknown -thread_warp_size=32", [-1, 16, 64, 49152, 2147483647, 1024, 8, 32], "", 0, []], [[], [["FU", 1, [0, 1, 2, 3]], ["SP", 1, 0, 56448, [4], 1], ["AN", 1, 0, 5], ["AN", 1, 1, 6]]]], "r": [[1.33791e-05, 1.33916e-05, 1.33897e-05], 0, 3.64896, 1667947887], "v": "v0.6"}
{"i": [["[\"sigmoid\", 1, 7, 7, 1152]", "cuda -keys=cuda,gpu -max_num_threads=1024 -model=unknown -thread_warp_size=32", [-1, 16, 64, 49152, 2147483647, 1024, 8, 32], "", 0, []], [[], [["FU", 1, [0, 1, 2, 3]], ["SP", 1, 0, 56448, [18], 1], ["AN", 1, 0, 5], ["AN", 1, 1, 6]]]], "r": [[5.17442e-06, 5.1917e-06, 5.19554e-06], 0, 4.10634, 1667947887], "v": "v0.6"}
{"i": [["[\"sigmoid\", 1, 7, 7, 1152]", "cuda -keys=cuda,gpu -max_num_threads=1024 -model=unknown -thread_warp_size=32", [-1, 16, 64, 49152, 2147483647, 1024, 8, 32], "", 0, []], [[], [["FU", 1, [0, 1, 2, 3]], ["SP", 1, 0, 56448, [36], 1], ["AN", 1, 0, 5], ["AN", 1, 1, 6]]]], "r": [[3.98303e-06, 3.99111e-06, 3.99238e-06], 0, 4.37619, 1667947888], "v": "v0.6"}
{"i": [["[\"sigmoid\", 1, 7, 7, 1152]", "cuda -keys=cuda,gpu -max_num_threads=1024 -model=unknown -thread_warp_size=32", [-1, 16, 64, 49152, 2147483647, 1024, 8, 32], "", 0, []], [[], [["FU", 1, [0, 1, 2, 3]], ["SP", 1, 0, 56448, [1], 1], ["AN", 1, 0, 5], ["AN", 1, 1, 6]]]], "r": [[4.47359e-05, 4.47224e-05, 4.47198e-05], 0, 4.66149, 1667947888], "v": "v0.6"}
{"i": [["[\"sigmoid\", 1, 7, 7, 1152]", "cuda -keys=cuda,gpu -max_num_threads=1024 -model=unknown -thread_warp_size=32", [-1, 16, 64, 49152, 2147483647, 1024, 8, 32], "", 0, []], [[], [["FU", 1, [0, 1, 2, 3]], ["SP", 1, 0, 56448, [32], 1], ["AN", 1, 0, 5], ["AN", 1, 1, 6]]]], "r": [[3.98408e-06, 3.99758e-06, 3.99383e-06], 0, 4.87775, 1667947888], "v": "v0.6"}
{"i": [["[\"sigmoid\", 1, 7, 7, 1152]", "cuda -keys=cuda,gpu -max_num_threads=1024 -model=unknown -thread_warp_size=32", [-1, 16, 64, 49152, 2147483647, 1024, 8, 32], "", 0, []], [[], [["FU", 1, [0, 1, 2, 3]], ["SP", 1, 0, 56448, [3], 1], ["AN", 1, 0, 5], ["AN", 1, 1, 6]]]], "r": [[1.70083e-05, 1.70322e-05, 1.7031e-05], 0, 5.18175, 1667947889], "v": "v0.6"}
{"i": [["[\"sigmoid\", 1, 7, 7, 1152]", "cuda -keys=cuda,gpu -max_num_threads=1024 -model=unknown -thread_warp_size=32", [-1, 16, 64, 49152, 2147483647, 1024, 8, 32], "", 0, []], [[], [["FU", 1, [0, 1, 2, 3]], ["SP", 1, 0, 56448, [2], 1], ["AN", 1, 0, 5], ["AN", 1, 1, 6]]]], "r": [[2.39763e-05, 2.3995e-05, 2.3996e-05], 0, 5.4552, 1667947889], "v": "v0.6"}
{"i": [["[\"sigmoid\", 1, 7, 7, 1152]", "cuda -keys=cuda,gpu -max_num_threads=1024 -model=unknown -thread_warp_size=32", [-1, 16, 64, 49152, 2147483647, 1024, 8, 32], "", 0, []], [[], [["FU", 1, [0, 1, 2, 3]], ["SP", 1, 0, 56448, [8], 1], ["AN", 1, 0, 5], ["AN", 1, 1, 6]]]], "r": [[8.15807e-06, 8.17206e-06, 8.17393e-06], 0, 5.77878, 1667947889], "v": "v0.6"}
{"i": [["[\"sigmoid\", 1, 7, 7, 1152]", "cuda -keys=cuda,gpu -max_num_threads=1024 -model=unknown -thread_warp_size=32", [-1, 16, 64, 49152, 2147483647, 1024, 8, 32], "", 0, []], [[], [["FU", 1, [0, 1, 2, 3]], ["SP", 1, 0, 56448, [16], 1], ["AN", 1, 0, 5], ["AN", 1, 1, 6]]]], "r": [[5.38371e-06, 5.40382e-06, 5.41469e-06], 0, 5.98087, 1667947890], "v": "v0.6"}
{"i": [["[\"sigmoid\", 1, 7, 7, 1152]", "cuda -keys=cuda,gpu -max_num_threads=1024 -model=unknown -thread_warp_size=32", [-1, 16, 64, 49152, 2147483647, 1024, 8, 32], "", 0, []], [[], [["FU", 1, [0, 1, 2, 3]], ["SP", 1, 0, 56448, [64], 1], ["AN", 1, 0, 5], ["AN", 1, 1, 6]]]], "r": [[3.47939e-06, 3.49127e-06, 3.49285e-06], 0, 6.32123, 1667947890], "v": "v0.6"}
{"i": [["[\"sigmoid\", 1, 7, 7, 1152]", "cuda -keys=cuda,gpu -max_num_threads=1024 -model=unknown -thread_warp_size=32", [-1, 16, 64, 49152, 2147483647, 1024, 8, 32], "", 0, []], [[], [["FU", 1, [0, 1, 2, 3]], ["SP", 1, 0, 56448, [63], 1], ["AN", 1, 0, 5], ["AN", 1, 1, 6]]]], "r": [[3.42414e-06, 3.43086e-06, 3.43314e-06], 0, 6.49038, 1667947890], "v": "v0.6"}
{"i": [["[\"sigmoid\", 1, 7, 7, 1152]", "cuda -keys=cuda,gpu -max_num_threads=1024 -model=unknown -thread_warp_size=32", [-1, 16, 64, 49152, 2147483647, 1024, 8, 32], "", 0, []], [[], [["FU", 1, [0, 1, 2, 3]], ["SP", 1, 0, 56448, [6], 1], ["AN", 1, 0, 5], ["AN", 1, 1, 6]]]], "r": [[9.83766e-06, 9.84465e-06, 9.84613e-06], 0, 3.84927, 1667947887], "v": "v0.6"}
{"i": [["[\"sigmoid\", 1, 7, 7, 1152]", "cuda -keys=cuda,gpu -max_num_threads=1024 -model=unknown -thread_warp_size=32", [-1, 16, 64, 49152, 2147483647, 1024, 8, 32], "", 0, []], [[], [["FU", 1, [0, 1, 2, 3]], ["SP", 1, 0, 56448, [49], 1], ["AN", 1, 0, 5], ["AN", 1, 1, 6]]]], "r": [[3.68903e-06, 3.69876e-06, 3.70046e-06], 0, 6.75145, 1667947891], "v": "v0.6"}
{"i": [["[\"sigmoid\", 1, 7, 7, 1152]", "cuda -keys=cuda,gpu -max_num_threads=1024 -model=unknown -thread_warp_size=32", [-1, 16, 64, 49152, 2147483647, 1024, 8, 32], "", 0, []], [[], [["FU", 1, [0, 1, 2, 3]], ["SP", 1, 0, 56448, [16], 1], ["AN", 1, 0, 5], ["AN", 1, 1, 6]]]], "r": [[5.38252e-06, 5.38271e-06, 5.3777e-06], 0, 1.18275, 1667948078], "v": "v0.6"}
{"i": [["[\"sigmoid\", 1, 7, 7, 1152]", "cuda -keys=cuda,gpu -max_num_threads=1024 -model=unknown -thread_warp_size=32", [-1, 16, 64, 49152, 2147483647, 1024, 8, 32], "", 0, []], [[], [["FU", 1, [0, 1, 2, 3]], ["SP", 1, 0, 56448, [32], 1], ["AN", 1, 0, 5], ["AN", 1, 1, 6]]]], "r": [[4.05803e-06, 4.05348e-06, 4.0519e-06], 0, 1.50912, 1667948078], "v": "v0.6"}
{"i": [["[\"sigmoid\", 1, 7, 7, 1152]", "cuda -keys=cuda,gpu -max_num_threads=1024 -model=unknown -thread_warp_size=32", [-1, 16, 64, 49152, 2147483647, 1024, 8, 32], "", 0, []], [[], [["FU", 1, [0, 1, 2, 3]], ["SP", 1, 0, 56448, [9], 1], ["AN", 1, 0, 5], ["AN", 1, 1, 6]]]], "r": [[7.53259e-06, 7.54144e-06, 7.54788e-06], 0, 2.16807, 1667948079], "v": "v0.6"}
{"i": [["[\"sigmoid\", 1, 7, 7, 1152]", "cuda -keys=cuda,gpu -max_num_threads=1024 -model=unknown -thread_warp_size=32", [-1, 16, 64, 49152, 2147483647, 1024, 8, 32], "", 0, []], [[], [["FU", 1, [0, 1, 2, 3]], ["SP", 1, 0, 56448, [14], 1], ["AN", 1, 0, 5], ["AN", 1, 1, 6]]]], "r": [[5.7416e-06, 5.74946e-06, 5.7478e-06], 0, 1.87388, 1667948079], "v": "v0.6"}
{"i": [["[\"sigmoid\", 1, 7, 7, 1152]", "cuda -keys=cuda,gpu -max_num_threads=1024 -model=unknown -thread_warp_size=32", [-1, 16, 64, 49152, 2147483647, 1024, 8, 32], "", 0, []], [[], [["FU", 1, [0, 1, 2, 3]], ["SP", 1, 0, 56448, [28], 1], ["AN", 1, 0, 5], ["AN", 1, 1, 6]]]], "r": [[4.16729e-06, 4.17669e-06, 4.17661e-06], 0, 0.972813, 1667948078], "v": "v0.6"}
{"i": [["[\"sigmoid\", 1, 7, 7, 1152]", "cuda -keys=cuda,gpu -max_num_threads=1024 -model=unknown -thread_warp_size=32", [-1, 16, 64, 49152, 2147483647, 1024, 8, 32], "", 0, []], [[], [["FU", 1, [0, 1, 2, 3]], ["SP", 1, 0, 56448, [56], 1], ["AN", 1, 0, 5], ["AN", 1, 1, 6]]]], "r": [[3.37371e-06, 3.37587e-06, 3.98167e-06], 0, 0.606883, 1667948077], "v": "v0.6"}
{"i": [["[\"sigmoid\", 1, 7, 7, 1152]", "cuda -keys=cuda,gpu -max_num_threads=1024 -model=unknown -thread_warp_size=32", [-1, 16, 64, 49152, 2147483647, 1024, 8, 32], "", 0, []], [[], [["FU", 1, [0, 1, 2, 3]], ["SP", 1, 0, 56448, [42], 1], ["AN", 1, 0, 5], ["AN", 1, 1, 6]]]], "r": [[3.86674e-06, 3.879e-06, 3.88032e-06], 0, 2.3908, 1667948079], "v": "v0.6"}
{"i": [["[\"sigmoid\", 1, 7, 7, 1152]", "cuda -keys=cuda,gpu -max_num_threads=1024 -model=unknown -thread_warp_size=32", [-1, 16, 64, 49152, 2147483647, 1024, 8, 32], "", 0, []], [[], [["FU", 1, [0, 1, 2, 3]], ["SP", 1, 0, 56448, [1], 1], ["AN", 1, 0, 5], ["AN", 1, 1, 6]]]], "r": [[4.47169e-05, 4.47127e-05, 4.47218e-05], 0, 2.98371, 1667948080], "v": "v0.6"}
{"i": [["[\"sigmoid\", 1, 7, 7, 1152]", "cuda -keys=cuda,gpu -max_num_threads=1024 -model=unknown -thread_warp_size=32", [-1, 16, 64, 49152, 2147483647, 1024, 8, 32], "", 0, []], [[], [["FU", 1, [0, 1, 2, 3]], ["SP", 1, 0, 56448, [4], 1], ["AN", 1, 0, 5], ["AN", 1, 1, 6]]]], "r": [[1.33785e-05, 1.33936e-05, 1.33929e-05], 0, 2.68515, 1667948080], "v": "v0.6"}
{"i": [["[\"sigmoid\", 1, 7, 7, 1152]", "cuda -keys=cuda,gpu -max_num_threads=1024 -model=unknown -thread_warp_size=32", [-1, 16, 64, 49152, 2147483647, 1024, 8, 32], "", 0, []], [[], [["FU", 1, [0, 1, 2, 3]], ["SP", 1, 0, 56448, [63], 1], ["AN", 1, 0, 5], ["AN", 1, 1, 6]]]], "r": [[3.29824e-06, 3.31381e-06, 3.31426e-06], 0, 4.10622, 1667948082], "v": "v0.6"}
{"i": [["[\"sigmoid\", 1, 7, 7, 1152]", "cuda -keys=cuda,gpu -max_num_threads=1024 -model=unknown -thread_warp_size=32", [-1, 16, 64, 49152, 2147483647, 1024, 8, 32], "", 0, []], [[], [["FU", 1, [0, 1, 2, 3]], ["SP", 1, 0, 56448, [21], 1], ["AN", 1, 0, 5], ["AN", 1, 1, 6]]]], "r": [[4.79507e-06, 4.81426e-06, 4.80775e-06], 0, 3.4482, 1667948081], "v": "v0.6"}
{"i": [["[\"sigmoid\", 1, 7, 7, 1152]", "cuda -keys=cuda,gpu -max_num_threads=1024 -model=unknown -thread_warp_size=32", [-1, 16, 64, 49152, 2147483647, 1024, 8, 32], "", 0, []], [[], [["FU", 1, [0, 1, 2, 3]], ["SP", 1, 0, 56448, [36], 1], ["AN", 1, 0, 5], ["AN", 1, 1, 6]]]], "r": [[3.83974e-06, 3.85045e-06, 3.84739e-06], 0, 2.96713, 1667948080], "v": "v0.6"}
{"i": [["[\"sigmoid\", 1, 7, 7, 1152]", "cuda -keys=cuda,gpu -max_num_threads=1024 -model=unknown -thread_warp_size=32", [-1, 16, 64, 49152, 2147483647, 1024, 8, 32], "", 0, []], [[], [["FU", 1, [0, 1, 2, 3]], ["SP", 1, 0, 56448, [18], 1], ["AN", 1, 0, 5], ["AN", 1, 1, 6]]]], "r": [[5.03934e-06, 5.0504e-06, 5.04737e-06], 0, 4.36087, 1667948082], "v": "v0.6"}
{"i": [["[\"sigmoid\", 1, 7, 7, 1152]", "cuda -keys=cuda,gpu -max_num_threads=1024 -model=unknown -thread_warp_size=32", [-1, 16, 64, 49152, 2147483647, 1024, 8, 32], "", 0, []], [[], [["FU", 1, [0, 1, 2, 3]], ["SP", 1, 0, 56448, [2], 1], ["AN", 1, 0, 5], ["AN", 1, 1, 6]]]], "r": [[2.39398e-05, 2.39525e-05, 2.39459e-05], 0, 3.71188, 1667948081], "v": "v0.6"}
{"i": [["[\"sigmoid\", 1, 7, 7, 1152]", "cuda -keys=cuda,gpu -max_num_threads=1024 -model=unknown -thread_warp_size=32", [-1, 16, 64, 49152, 2147483647, 1024, 8, 32], "", 0, []], [[], [["FU", 1, [0, 1, 2, 3]], ["SP", 1, 0, 56448, [3], 1], ["AN", 1, 0, 5], ["AN", 1, 1, 6]]]], "r": [[1.69366e-05, 1.69417e-05, 1.69503e-05], 0, 4.58947, 1667948082], "v": "v0.6"}
{"i": [["[\"sigmoid\", 1, 7, 7, 1152]", "cuda -keys=cuda,gpu -max_num_threads=1024 -model=unknown -thread_warp_size=32", [-1, 16, 64, 49152, 2147483647, 1024, 8, 32], "", 0, []], [[], [["FU", 1, [0, 1, 2, 3]], ["SP", 1, 0, 56448, [6], 1], ["AN", 1, 0, 5], ["AN", 1, 1, 6]]]], "r": [[9.85079e-06, 9.85449e-06, 9.87964e-06], 0, 5.50423, 1667948083], "v": "v0.6"}
{"i": [["[\"sigmoid\", 1, 7, 7, 1152]", "cuda -keys=cuda,gpu -max_num_threads=1024 -model=unknown -thread_warp_size=32", [-1, 16, 64, 49152, 2147483647, 1024, 8, 32], "", 0, []], [[], [["FU", 1, [0, 1, 2, 3]], ["SP", 1, 0, 56448, [8], 1], ["AN", 1, 0, 5], ["AN", 1, 1, 6]]]], "r": [[7.94926e-06, 7.96284e-06, 7.96322e-06], 0, 4.99821, 1667948083], "v": "v0.6"}
{"i": [["[\"sigmoid\", 1, 7, 7, 1152]", "cuda -keys=cuda,gpu -max_num_threads=1024 -model=unknown -thread_warp_size=32", [-1, 16, 64, 49152, 2147483647, 1024, 8, 32], "", 0, []], [[], [["FU", 1, [0, 1, 2, 3]], ["SP", 1, 0, 56448, [64], 1], ["AN", 1, 0, 5], ["AN", 1, 1, 6]]]], "r": [[3.19226e-06, 3.1892e-06, 3.1888e-06], 0, 5.85105, 1667948084], "v": "v0.6"}
{"i": [["[\"sigmoid\", 1, 7, 7, 1152]", "cuda -keys=cuda,gpu -max_num_threads=1024 -model=unknown -thread_warp_size=32", [-1, 16, 64, 49152, 2147483647, 1024, 8, 32], "", 0, []], [[], [["FU", 1, [0, 1, 2, 3]], ["SP", 1, 0, 56448, [7], 1], ["AN", 1, 0, 5], ["AN", 1, 1, 6]]]], "r": [[8.79733e-06, 8.8054e-06, 8.80588e-06], 0, 5.19439, 1667948083], "v": "v0.6"}
