python/models/efficientnet/VertiFusionEfficientNet_kernel_configs/efficient_sigmoid_1_1_1_480.log
{"i": [["[\"sigmoid\", 1, 1, 1, 480]", "cuda -keys=cuda,gpu -max_num_threads=1024 -model=unknown -thread_warp_size=32", [-1, 16, 64, 49152, 2147483647, 1024, 8, 32], "", 0, []], [[], [["FU", 1, [0, 1, 2, 3]], ["SP", 1, 0, 480, [12], 1], ["AN", 1, 0, 5], ["AN", 1, 1, 6]]]], "r": [[2.4958e-06, 2.48828e-06, 2.49329e-06], 0, 1.25398, 1667926872], "v": "v0.6"}
{"i": [["[\"sigmoid\", 1, 1, 1, 480]", "cuda -keys=cuda,gpu -max_num_threads=1024 -model=unknown -thread_warp_size=32", [-1, 16, 64, 49152, 2147483647, 1024, 8, 32], "", 0, []], [[], [["FU", 1, [0, 1, 2, 3]], ["SP", 1, 0, 480, [30], 1], ["AN", 1, 0, 5], ["AN", 1, 1, 6]]]], "r": [[2.56921e-06, 2.56282e-06, 2.56465e-06], 0, 2.1574, 1667926873], "v": "v0.6"}
{"i": [["[\"sigmoid\", 1, 1, 1, 480]", "cuda -keys=cuda,gpu -max_num_threads=1024 -model=unknown -thread_warp_size=32", [-1, 16, 64, 49152, 2147483647, 1024, 8, 32], "", 0, []], [[], [["FU", 1, [0, 1, 2, 3]], ["SP", 1, 0, 480, [5], 1], ["AN", 1, 0, 5], ["AN", 1, 1, 6]]]], "r": [[2.53709e-06, 2.53022e-06, 2.53475e-06], 0, 2.44731, 1667926874], "v": "v0.6"}
{"i": [["[\"sigmoid\", 1, 1, 1, 480]", "cuda -keys=cuda,gpu -max_num_threads=1024 -model=unknown -thread_warp_size=32", [-1, 16, 64, 49152, 2147483647, 1024, 8, 32], "", 0, []], [[], [["FU", 1, [0, 1, 2, 3]], ["SP", 1, 0, 480, [24], 1], ["AN", 1, 0, 5], ["AN", 1, 1, 6]]]], "r": [[2.48393e-06, 2.47516e-06, 2.47482e-06], 0, 0.595647, 1667926872], "v": "v0.6"}
{"i": [["[\"sigmoid\", 1, 1, 1, 480]", "cuda -keys=cuda,gpu -max_num_threads=1024 -model=unknown -thread_warp_size=32", [-1, 16, 64, 49152, 2147483647, 1024, 8, 32], "", 0, []], [[], [["FU", 1, [0, 1, 2, 3]], ["SP", 1, 0, 480, [1], 1], ["AN", 1, 0, 5], ["AN", 1, 1, 6]]]], "r": [[2.87427e-06, 2.87196e-06, 2.87178e-06], 0, 0.868867, 1667926872], "v": "v0.6"}
{"i": [["[\"sigmoid\", 1, 1, 1, 480]", "cuda -keys=cuda,gpu -max_num_threads=1024 -model=unknown -thread_warp_size=32", [-1, 16, 64, 49152, 2147483647, 1024, 8, 32], "", 0, []], [[], [["FU", 1, [0, 1, 2, 3]], ["SP", 1, 0, 480, [32], 1], ["AN", 1, 0, 5], ["AN", 1, 1, 6]]]], "r": [[2.59343e-06, 2.59309e-06, 2.59043e-06], 0, 1.55107, 1667926873], "v": "v0.6"}
{"i": [["[\"sigmoid\", 1, 1, 1, 480]", "cuda -keys=cuda,gpu -max_num_threads=1024 -model=unknown -thread_warp_size=32", [-1, 16, 64, 49152, 2147483647, 1024, 8, 32], "", 0, []], [[], [["FU", 1, [0, 1, 2, 3]], ["SP", 1, 0, 480, [3], 1], ["AN", 1, 0, 5], ["AN", 1, 1, 6]]]], "r": [[2.77081e-06, 2.77953e-06, 2.78625e-06], 0, 3.26143, 1667926875], "v": "v0.6"}
{"i": [["[\"sigmoid\", 1, 1, 1, 480]", "cuda -keys=cuda,gpu -max_num_threads=1024 -model=unknown -thread_warp_size=32", [-1, 16, 64, 49152, 2147483647, 1024, 8, 32], "", 0, []], [[], [["FU", 1, [0, 1, 2, 3]], ["SP", 1, 0, 480, [60], 1], ["AN", 1, 0, 5], ["AN", 1, 1, 6]]]], "r": [[2.68557e-06, 2.69579e-06, 2.695e-06], 0, 2.97621, 1667926874], "v": "v0.6"}
{"i": [["[\"sigmoid\", 1, 1, 1, 480]", "cuda -keys=cuda,gpu -max_num_threads=1024 -model=unknown -thread_warp_size=32", [-1, 16, 64, 49152, 2147483647, 1024, 8, 32], "", 0, []], [[], [["FU", 1, [0, 1, 2, 3]], ["SP", 1, 0, 480, [4], 1], ["AN", 1, 0, 5], ["AN", 1, 1, 6]]]], "r": [[2.61471e-06, 2.60881e-06, 2.60917e-06], 0, 1.79383, 1667926873], "v": "v0.6"}
{"i": [["[\"sigmoid\", 1, 1, 1, 480]", "cuda -keys=cuda,gpu -max_num_threads=1024 -model=unknown -thread_warp_size=32", [-1, 16, 64, 49152, 2147483647, 1024, 8, 32], "", 0, []], [[], [["FU", 1, [0, 1, 2, 3]], ["SP", 1, 0, 480, [15], 1], ["AN", 1, 0, 5], ["AN", 1, 1, 6]]]], "r": [[2.60591e-06, 2.59824e-06, 2.59973e-06], 0, 3.42945, 1667926875], "v": "v0.6"}
{"i": [["[\"sigmoid\", 1, 1, 1, 480]", "cuda -keys=cuda,gpu -max_num_threads=1024 -model=unknown -thread_warp_size=32", [-1, 16, 64, 49152, 2147483647, 1024, 8, 32], "", 0, []], [[], [["FU", 1, [0, 1, 2, 3]], ["SP", 1, 0, 480, [48], 1], ["AN", 1, 0, 5], ["AN", 1, 1, 6]]]], "r": [[2.66044e-06, 2.66447e-06, 2.6756e-06], 0, 2.63668, 1667926874], "v": "v0.6"}
{"i": [["[\"sigmoid\", 1, 1, 1, 480]", "cuda -keys=cuda,gpu -max_num_threads=1024 -model=unknown -thread_warp_size=32", [-1, 16, 64, 49152, 2147483647, 1024, 8, 32], "", 0, []], [[], [["FU", 1, [0, 1, 2, 3]], ["SP", 1, 0, 480, [20], 1], ["AN", 1, 0, 5], ["AN", 1, 1, 6]]]], "r": [[2.56607e-06, 2.56454e-06, 2.56194e-06], 0, 3.73546, 1667926875], "v": "v0.6"}
{"i": [["[\"sigmoid\", 1, 1, 1, 480]", "cuda -keys=cuda,gpu -max_num_threads=1024 -model=unknown -thread_warp_size=32", [-1, 16, 64, 49152, 2147483647, 1024, 8, 32], "", 0, []], [[], [["FU", 1, [0, 1, 2, 3]], ["SP", 1, 0, 480, [40], 1], ["AN", 1, 0, 5], ["AN", 1, 1, 6]]]], "r": [[2.52023e-06, 2.51535e-06, 2.51668e-06], 0, 3.99641, 1667926876], "v": "v0.6"}
{"i": [["[\"sigmoid\", 1, 1, 1, 480]", "cuda -keys=cuda,gpu -max_num_threads=1024 -model=unknown -thread_warp_size=32", [-1, 16, 64, 49152, 2147483647, 1024, 8, 32], "", 0, []], [[], [["FU", 1, [0, 1, 2, 3]], ["SP", 1, 0, 480, [10], 1], ["AN", 1, 0, 5], ["AN", 1, 1, 6]]]], "r": [[2.52075e-06, 2.51755e-06, 2.51621e-06], 0, 4.23845, 1667926876], "v": "v0.6"}
{"i": [["[\"sigmoid\", 1, 1, 1, 480]", "cuda -keys=cuda,gpu -max_num_threads=1024 -model=unknown -thread_warp_size=32", [-1, 16, 64, 49152, 2147483647, 1024, 8, 32], "", 0, []], [[], [["FU", 1, [0, 1, 2, 3]], ["SP", 1, 0, 480, [6], 1], ["AN", 1, 0, 5], ["AN", 1, 1, 6]]]], "r": [[2.71856e-06, 2.71668e-06, 2.71538e-06], 0, 4.49931, 1667926876], "v": "v0.6"}
{"i": [["[\"sigmoid\", 1, 1, 1, 480]", "cuda -keys=cuda,gpu -max_num_threads=1024 -model=unknown -thread_warp_size=32", [-1, 16, 64, 49152, 2147483647, 1024, 8, 32], "", 0, []], [[], [["FU", 1, [0, 1, 2, 3]], ["SP", 1, 0, 480, [2], 1], ["AN", 1, 0, 5], ["AN", 1, 1, 6]]]], "r": [[2.92893e-06, 2.93645e-06, 2.93371e-06], 0, 4.74717, 1667926877], "v": "v0.6"}
{"i": [["[\"sigmoid\", 1, 1, 1, 480]", "cuda -keys=cuda,gpu -max_num_threads=1024 -model=unknown -thread_warp_size=32", [-1, 16, 64, 49152, 2147483647, 1024, 8, 32], "", 0, []], [[], [["FU", 1, [0, 1, 2, 3]], ["SP", 1, 0, 480, [16], 1], ["AN", 1, 0, 5], ["AN", 1, 1, 6]]]], "r": [[2.5982e-06, 2.59307e-06, 2.59415e-06], 0, 5.03917, 1667926877], "v": "v0.6"}
{"i": [["[\"sigmoid\", 1, 1, 1, 480]", "cuda -keys=cuda,gpu -max_num_threads=1024 -model=unknown -thread_warp_size=32", [-1, 16, 64, 49152, 2147483647, 1024, 8, 32], "", 0, []], [[], [["FU", 1, [0, 1, 2, 3]], ["SP", 1, 0, 480, [8], 1], ["AN", 1, 0, 5], ["AN", 1, 1, 6]]]], "r": [[2.57584e-06, 2.61146e-06, 2.6296e-06], 0, 5.36193, 1667926877], "v": "v0.6"}
{"i": [["[\"sigmoid\", 1, 1, 1, 480]", "cuda -keys=cuda,gpu -max_num_threads=1024 -model=unknown -thread_warp_size=32", [-1, 16, 64, 49152, 2147483647, 1024, 8, 32], "", 0, []], [[], [["FU", 1, [0, 1, 2, 3]], ["SP", 1, 0, 480, [32], 1], ["AN", 1, 0, 5], ["AN", 1, 1, 6]]]], "r": [[2.55795e-06, 2.55438e-06, 2.55556e-06], 0, 2.60535, 1667926976], "v": "v0.6"}
{"i": [["[\"sigmoid\", 1, 1, 1, 480]", "cuda -keys=cuda,gpu -max_num_threads=1024 -model=unknown -thread_warp_size=32", [-1, 16, 64, 49152, 2147483647, 1024, 8, 32], "", 0, []], [[], [["FU", 1, [0, 1, 2, 3]], ["SP", 1, 0, 480, [3], 1], ["AN", 1, 0, 5], ["AN", 1, 1, 6]]]], "r": [[2.65518e-06, 2.65131e-06, 2.64967e-06], 0, 2.13148, 1667926975], "v": "v0.6"}
{"i": [["[\"sigmoid\", 1, 1, 1, 480]", "cuda -keys=cuda,gpu -max_num_threads=1024 -model=unknown -thread_warp_size=32", [-1, 16, 64, 49152, 2147483647, 1024, 8, 32], "", 0, []], [[], [["FU", 1, [0, 1, 2, 3]], ["SP", 1, 0, 480, [16], 1], ["AN", 1, 0, 5], ["AN", 1, 1, 6]]]], "r": [[2.52737e-06, 2.519e-06, 2.51979e-06], 0, 1.44464, 1667926975], "v": "v0.6"}
{"i": [["[\"sigmoid\", 1, 1, 1, 480]", "cuda -keys=cuda,gpu -max_num_threads=1024 -model=unknown -thread_warp_size=32", [-1, 16, 64, 49152, 2147483647, 1024, 8, 32], "", 0, []], [[], [["FU", 1, [0, 1, 2, 3]], ["SP", 1, 0, 480, [1], 1], ["AN", 1, 0, 5], ["AN", 1, 1, 6]]]], "r": [[3.16434e-06, 3.17256e-06, 3.1777e-06], 0, 0.974185, 1667926974], "v": "v0.6"}
{"i": [["[\"sigmoid\", 1, 1, 1, 480]", "cuda -keys=cuda,gpu -max_num_threads=1024 -model=unknown -thread_warp_size=32", [-1, 16, 64, 49152, 2147483647, 1024, 8, 32], "", 0, []], [[], [["FU", 1, [0, 1, 2, 3]], ["SP", 1, 0, 480, [40], 1], ["AN", 1, 0, 5], ["AN", 1, 1, 6]]]], "r": [[2.49811e-06, 2.48037e-06, 2.48181e-06], 0, 0.600188, 1667926974], "v": "v0.6"}
{"i": [["[\"sigmoid\", 1, 1, 1, 480]", "cuda -keys=cuda,gpu -max_num_threads=1024 -model=unknown -thread_warp_size=32", [-1, 16, 64, 49152, 2147483647, 1024, 8, 32], "", 0, []], [[], [["FU", 1, [0, 1, 2, 3]], ["SP", 1, 0, 480, [2], 1], ["AN", 1, 0, 5], ["AN", 1, 1, 6]]]], "r": [[2.75694e-06, 2.75567e-06, 2.75495e-06], 0, 1.71472, 1667926975], "v": "v0.6"}
{"i": [["[\"sigmoid\", 1, 1, 1, 480]", "cuda -keys=cuda,gpu -max_num_threads=1024 -model=unknown -thread_warp_size=32", [-1, 16, 64, 49152, 2147483647, 1024, 8, 32], "", 0, []], [[], [["FU", 1, [0, 1, 2, 3]], ["SP", 1, 0, 480, [30], 1], ["AN", 1, 0, 5], ["AN", 1, 1, 6]]]], "r": [[2.64276e-06, 2.65843e-06, 2.65422e-06], 0, 1.1098, 1667926974], "v": "v0.6"}
{"i": [["[\"sigmoid\", 1, 1, 1, 480]", "cuda -keys=cuda,gpu -max_num_threads=1024 -model=unknown -thread_warp_size=32", [-1, 16, 64, 49152, 2147483647, 1024, 8, 32], "", 0, []], [[], [["FU", 1, [0, 1, 2, 3]], ["SP", 1, 0, 480, [6], 1], ["AN", 1, 0, 5], ["AN", 1, 1, 6]]]], "r": [[2.61531e-06, 2.60478e-06, 2.60564e-06], 0, 2.35792, 1667926976], "v": "v0.6"}
{"i": [["[\"sigmoid\", 1, 1, 1, 480]", "cuda -keys=cuda,gpu -max_num_threads=1024 -model=unknown -thread_warp_size=32", [-1, 16, 64, 49152, 2147483647, 1024, 8, 32], "", 0, []], [[], [["FU", 1, [0, 1, 2, 3]], ["SP", 1, 0, 480, [15], 1], ["AN", 1, 0, 5], ["AN", 1, 1, 6]]]], "r": [[2.53995e-06, 2.53155e-06, 2.5332e-06], 0, 2.91322, 1667926976], "v": "v0.6"}
{"i": [["[\"sigmoid\", 1, 1, 1, 480]", "cuda -keys=cuda,gpu -max_num_threads=1024 -model=unknown -thread_warp_size=32", [-1, 16, 64, 49152, 2147483647, 1024, 8, 32], "", 0, []], [[], [["FU", 1, [0, 1, 2, 3]], ["SP", 1, 0, 480, [10], 1], ["AN", 1, 0, 5], ["AN", 1, 1, 6]]]], "r": [[2.67641e-06, 2.68767e-06, 2.68703e-06], 0, 3.12826, 1667926977], "v": "v0.6"}
{"i": [["[\"sigmoid\", 1, 1, 1, 480]", "cuda -keys=cuda,gpu -max_num_threads=1024 -model=unknown -thread_warp_size=32", [-1, 16, 64, 49152, 2147483647, 1024, 8, 32], "", 0, []], [[], [["FU", 1, [0, 1, 2, 3]], ["SP", 1, 0, 480, [4], 1], ["AN", 1, 0, 5], ["AN", 1, 1, 6]]]], "r": [[2.65496e-06, 2.64887e-06, 2.6511e-06], 0, 3.2871, 1667926977], "v": "v0.6"}
{"i": [["[\"sigmoid\", 1, 1, 1, 480]", "cuda -keys=cuda,gpu -max_num_threads=1024 -model=unknown -thread_warp_size=32", [-1, 16, 64, 49152, 2147483647, 1024, 8, 32], "", 0, []], [[], [["FU", 1, [0, 1, 2, 3]], ["SP", 1, 0, 480, [48], 1], ["AN", 1, 0, 5], ["AN", 1, 1, 6]]]], "r": [[2.63866e-06, 2.63439e-06, 2.63286e-06], 0, 3.63557, 1667926977], "v": "v0.6"}
{"i": [["[\"sigmoid\", 1, 1, 1, 480]", "cuda -keys=cuda,gpu -max_num_threads=1024 -model=unknown -thread_warp_size=32", [-1, 16, 64, 49152, 2147483647, 1024, 8, 32], "", 0, []], [[], [["FU", 1, [0, 1, 2, 3]], ["SP", 1, 0, 480, [8], 1], ["AN", 1, 0, 5], ["AN", 1, 1, 6]]]], "r": [[2.52506e-06, 2.5135e-06, 2.51401e-06], 0, 3.92342, 1667926978], "v": "v0.6"}
{"i": [["[\"sigmoid\", 1, 1, 1, 480]", "cuda -keys=cuda,gpu -max_num_threads=1024 -model=unknown -thread_warp_size=32", [-1, 16, 64, 49152, 2147483647, 1024, 8, 32], "", 0, []], [[], [["FU", 1, [0, 1, 2, 3]], ["SP", 1, 0, 480, [24], 1], ["AN", 1, 0, 5], ["AN", 1, 1, 6]]]], "r": [[2.49238e-06, 2.48369e-06, 2.48606e-06], 0, 4.22426, 1667926978], "v": "v0.6"}
{"i": [["[\"sigmoid\", 1, 1, 1, 480]", "cuda -keys=cuda,gpu -max_num_threads=1024 -model=unknown -thread_warp_size=32", [-1, 16, 64, 49152, 2147483647, 1024, 8, 32], "", 0, []], [[], [["FU", 1, [0, 1, 2, 3]], ["SP", 1, 0, 480, [60], 1], ["AN", 1, 0, 5], ["AN", 1, 1, 6]]]], "r": [[2.51153e-06, 2.50621e-06, 2.50532e-06], 0, 4.50045, 1667926978], "v": "v0.6"}
{"i": [["[\"sigmoid\", 1, 1, 1, 480]", "cuda -keys=cuda,gpu -max_num_threads=1024 -model=unknown -thread_warp_size=32", [-1, 16, 64, 49152, 2147483647, 1024, 8, 32], "", 0, []], [[], [["FU", 1, [0, 1, 2, 3]], ["SP", 1, 0, 480, [12], 1], ["AN", 1, 0, 5], ["AN", 1, 1, 6]]]], "r": [[2.60872e-06, 2.61144e-06, 2.61125e-06], 0, 4.77464, 1667926979], "v": "v0.6"}
{"i": [["[\"sigmoid\", 1, 1, 1, 480]", "cuda -keys=cuda,gpu -max_num_threads=1024 -model=unknown -thread_warp_size=32", [-1, 16, 64, 49152, 2147483647, 1024, 8, 32], "", 0, []], [[], [["FU", 1, [0, 1, 2, 3]], ["SP", 1, 0, 480, [5], 1], ["AN", 1, 0, 5], ["AN", 1, 1, 6]]]], "r": [[2.73323e-06, 2.73093e-06, 2.73409e-06], 0, 4.99449, 1667926979], "v": "v0.6"}
{"i": [["[\"sigmoid\", 1, 1, 1, 480]", "cuda -keys=cuda,gpu -max_num_threads=1024 -model=unknown -thread_warp_size=32", [-1, 16, 64, 49152, 2147483647, 1024, 8, 32], "", 0, []], [[], [["FU", 1, [0, 1, 2, 3]], ["SP", 1, 0, 480, [20], 1], ["AN", 1, 0, 5], ["AN", 1, 1, 6]]]], "r": [[2.49053e-06, 2.47645e-06, 2.48498e-06], 0, 5.31107, 1667926979], "v": "v0.6"}
{"i": [["[\"sigmoid\", 1, 1, 1, 480]", "cuda -keys=cuda,gpu -max_num_threads=1024 -model=unknown -thread_warp_size=32", [-1, 16, 64, 49152, 2147483647, 1024, 8, 32], "", 0, []], [[], [["FU", 1, [0, 1, 2, 3]], ["SP", 1, 0, 480, [20], 1], ["AN", 1, 0, 5], ["AN", 1, 1, 6]]]], "r": [[2.71407e-06, 2.72907e-06, 2.72788e-06], 0, 1.73014, 1667941112], "v": "v0.6"}
{"i": [["[\"sigmoid\", 1, 1, 1, 480]", "cuda -keys=cuda,gpu -max_num_threads=1024 -model=unknown -thread_warp_size=32", [-1, 16, 64, 49152, 2147483647, 1024, 8, 32], "", 0, []], [[], [["FU", 1, [0, 1, 2, 3]], ["SP", 1, 0, 480, [60], 1], ["AN", 1, 0, 5], ["AN", 1, 1, 6]]]], "r": [[2.70567e-06, 2.72394e-06, 2.72274e-06], 0, 1.47317, 1667941112], "v": "v0.6"}
{"i": [["[\"sigmoid\", 1, 1, 1, 480]", "cuda -keys=cuda,gpu -max_num_threads=1024 -model=unknown -thread_warp_size=32", [-1, 16, 64, 49152, 2147483647, 1024, 8, 32], "", 0, []], [[], [["FU", 1, [0, 1, 2, 3]], ["SP", 1, 0, 480, [32], 1], ["AN", 1, 0, 5], ["AN", 1, 1, 6]]]], "r": [[2.55721e-06, 2.54886e-06, 2.54751e-06], 0, 2.05375, 1667941113], "v": "v0.6"}
{"i": [["[\"sigmoid\", 1, 1, 1, 480]", "cuda -keys=cuda,gpu -max_num_threads=1024 -model=unknown -thread_warp_size=32", [-1, 16, 64, 49152, 2147483647, 1024, 8, 32], "", 0, []], [[], [["FU", 1, [0, 1, 2, 3]], ["SP", 1, 0, 480, [5], 1], ["AN", 1, 0, 5], ["AN", 1, 1, 6]]]], "r": [[2.62683e-06, 2.52739e-06, 2.53127e-06], 0, 0.600877, 1667941111], "v": "v0.6"}
{"i": [["[\"sigmoid\", 1, 1, 1, 480]", "cuda -keys=cuda,gpu -max_num_threads=1024 -model=unknown -thread_warp_size=32", [-1, 16, 64, 49152, 2147483647, 1024, 8, 32], "", 0, []], [[], [["FU", 1, [0, 1, 2, 3]], ["SP", 1, 0, 480, [3], 1], ["AN", 1, 0, 5], ["AN", 1, 1, 6]]]], "r": [[2.81609e-06, 2.8235e-06, 2.82971e-06], 0, 0.884752, 1667941111], "v": "v0.6"}
{"i": [["[\"sigmoid\", 1, 1, 1, 480]", "cuda -keys=cuda,gpu -max_num_threads=1024 -model=unknown -thread_warp_size=32", [-1, 16, 64, 49152, 2147483647, 1024, 8, 32], "", 0, []], [[], [["FU", 1, [0, 1, 2, 3]], ["SP", 1, 0, 480, [48], 1], ["AN", 1, 0, 5], ["AN", 1, 1, 6]]]], "r": [[2.49029e-06, 2.47519e-06, 2.47842e-06], 0, 1.2121, 1667941112], "v": "v0.6"}
{"i": [["[\"sigmoid\", 1, 1, 1, 480]", "cuda -keys=cuda,gpu -max_num_threads=1024 -model=unknown -thread_warp_size=32", [-1, 16, 64, 49152, 2147483647, 1024, 8, 32], "", 0, []], [[], [["FU", 1, [0, 1, 2, 3]], ["SP", 1, 0, 480, [8], 1], ["AN", 1, 0, 5], ["AN", 1, 1, 6]]]], "r": [[2.56454e-06, 2.55419e-06, 2.55541e-06], 0, 2.32556, 1667941113], "v": "v0.6"}
{"i": [["[\"sigmoid\", 1, 1, 1, 480]", "cuda -keys=cuda,gpu -max_num_threads=1024 -model=unknown -thread_warp_size=32", [-1, 16, 64, 49152, 2147483647, 1024, 8, 32], "", 0, []], [[], [["FU", 1, [0, 1, 2, 3]], ["SP", 1, 0, 480, [6], 1], ["AN", 1, 0, 5], ["AN", 1, 1, 6]]]], "r": [[2.60278e-06, 2.60697e-06, 2.60017e-06], 0, 2.50988, 1667941113], "v": "v0.6"}
{"i": [["[\"sigmoid\", 1, 1, 1, 480]", "cuda -keys=cuda,gpu -max_num_threads=1024 -model=unknown -thread_warp_size=32", [-1, 16, 64, 49152, 2147483647, 1024, 8, 32], "", 0, []], [[], [["FU", 1, [0, 1, 2, 3]], ["SP", 1, 0, 480, [2], 1], ["AN", 1, 0, 5], ["AN", 1, 1, 6]]]], "r": [[2.75594e-06, 2.75204e-06, 2.75269e-06], 0, 2.83432, 1667941114], "v": "v0.6"}
{"i": [["[\"sigmoid\", 1, 1, 1, 480]", "cuda -keys=cuda,gpu -max_num_threads=1024 -model=unknown -thread_warp_size=32", [-1, 16, 64, 49152, 2147483647, 1024, 8, 32], "", 0, []], [[], [["FU", 1, [0, 1, 2, 3]], ["SP", 1, 0, 480, [10], 1], ["AN", 1, 0, 5], ["AN", 1, 1, 6]]]], "r": [[2.69228e-06, 2.68649e-06, 2.68852e-06], 0, 3.08041, 1667941114], "v": "v0.6"}
{"i": [["[\"sigmoid\", 1, 1, 1, 480]", "cuda -keys=cuda,gpu -max_num_threads=1024 -model=unknown -thread_warp_size=32", [-1, 16, 64, 49152, 2147483647, 1024, 8, 32], "", 0, []], [[], [["FU", 1, [0, 1, 2, 3]], ["SP", 1, 0, 480, [1], 1], ["AN", 1, 0, 5], ["AN", 1, 1, 6]]]], "r": [[2.969e-06, 2.96668e-06, 2.96625e-06], 0, 3.26669, 1667941114], "v": "v0.6"}
{"i": [["[\"sigmoid\", 1, 1, 1, 480]", "cuda -keys=cuda,gpu -max_num_threads=1024 -model=unknown -thread_warp_size=32", [-1, 16, 64, 49152, 2147483647, 1024, 8, 32], "", 0, []], [[], [["FU", 1, [0, 1, 2, 3]], ["SP", 1, 0, 480, [16], 1], ["AN", 1, 0, 5], ["AN", 1, 1, 6]]]], "r": [[2.60099e-06, 2.59059e-06, 2.59288e-06], 0, 3.61964, 1667941115], "v": "v0.6"}
{"i": [["[\"sigmoid\", 1, 1, 1, 480]", "cuda -keys=cuda,gpu -max_num_threads=1024 -model=unknown -thread_warp_size=32", [-1, 16, 64, 49152, 2147483647, 1024, 8, 32], "", 0, []], [[], [["FU", 1, [0, 1, 2, 3]], ["SP", 1, 0, 480, [30], 1], ["AN", 1, 0, 5], ["AN", 1, 1, 6]]]], "r": [[2.50022e-06, 2.49354e-06, 2.49425e-06], 0, 3.85695, 1667941115], "v": "v0.6"}
{"i": [["[\"sigmoid\", 1, 1, 1, 480]", "cuda -keys=cuda,gpu -max_num_threads=1024 -model=unknown -thread_warp_size=32", [-1, 16, 64, 49152, 2147483647, 1024, 8, 32], "", 0, []], [[], [["FU", 1, [0, 1, 2, 3]], ["SP", 1, 0, 480, [12], 1], ["AN", 1, 0, 5], ["AN", 1, 1, 6]]]], "r": [[2.70286e-06, 2.70904e-06, 2.70883e-06], 0, 4.10879, 1667941115], "v": "v0.6"}
{"i": [["[\"sigmoid\", 1, 1, 1, 480]", "cuda -keys=cuda,gpu -max_num_threads=1024 -model=unknown -thread_warp_size=32", [-1, 16, 64, 49152, 2147483647, 1024, 8, 32], "", 0, []], [[], [["FU", 1, [0, 1, 2, 3]], ["SP", 1, 0, 480, [24], 1], ["AN", 1, 0, 5], ["AN", 1, 1, 6]]]], "r": [[2.62174e-06, 2.61781e-06, 2.61742e-06], 0, 4.42169, 1667941116], "v": "v0.6"}
{"i": [["[\"sigmoid\", 1, 1, 1, 480]", "cuda -keys=cuda,gpu -max_num_threads=1024 -model=unknown -thread_warp_size=32", [-1, 16, 64, 49152, 2147483647, 1024, 8, 32], "", 0, []], [[], [["FU", 1, [0, 1, 2, 3]], ["SP", 1, 0, 480, [4], 1], ["AN", 1, 0, 5], ["AN", 1, 1, 6]]]], "r": [[2.61849e-06, 2.60875e-06, 2.60893e-06], 0, 4.65335, 1667941116], "v": "v0.6"}
{"i": [["[\"sigmoid\", 1, 1, 1, 480]", "cuda -keys=cuda,gpu -max_num_threads=1024 -model=unknown -thread_warp_size=32", [-1, 16, 64, 49152, 2147483647, 1024, 8, 32], "", 0, []], [[], [["FU", 1, [0, 1, 2, 3]], ["SP", 1, 0, 480, [40], 1], ["AN", 1, 0, 5], ["AN", 1, 1, 6]]]], "r": [[2.52384e-06, 2.51659e-06, 2.51649e-06], 0, 4.91225, 1667941116], "v": "v0.6"}
{"i": [["[\"sigmoid\", 1, 1, 1, 480]", "cuda -keys=cuda,gpu -max_num_threads=1024 -model=unknown -thread_warp_size=32", [-1, 16, 64, 49152, 2147483647, 1024, 8, 32], "", 0, []], [[], [["FU", 1, [0, 1, 2, 3]], ["SP", 1, 0, 480, [15], 1], ["AN", 1, 0, 5], ["AN", 1, 1, 6]]]], "r": [[2.56362e-06, 2.55255e-06, 2.55391e-06], 0, 5.24093, 1667941117], "v": "v0.6"}
{"i": [["[\"sigmoid\", 1, 1, 1, 480]", "cuda -keys=cuda,gpu -max_num_threads=1024 -model=unknown -thread_warp_size=32", [-1, 16, 64, 49152, 2147483647, 1024, 8, 32], "", 0, []], [[], [["FU", 1, [0, 1, 2, 3]], ["SP", 1, 0, 480, [3], 1], ["AN", 1, 0, 5], ["AN", 1, 1, 6]]]], "r": [[2.6633e-06, 2.66411e-06, 2.6643e-06], 0, 1.182, 1667941663], "v": "v0.6"}
{"i": [["[\"sigmoid\", 1, 1, 1, 480]", "cuda -keys=cuda,gpu -max_num_threads=1024 -model=unknown -thread_warp_size=32", [-1, 16, 64, 49152, 2147483647, 1024, 8, 32], "", 0, []], [[], [["FU", 1, [0, 1, 2, 3]], ["SP", 1, 0, 480, [15], 1], ["AN", 1, 0, 5], ["AN", 1, 1, 6]]]], "r": [[2.52157e-06, 2.52572e-06, 2.52108e-06], 0, 0.888507, 1667941663], "v": "v0.6"}
{"i": [["[\"sigmoid\", 1, 1, 1, 480]", "cuda -keys=cuda,gpu -max_num_threads=1024 -model=unknown -thread_warp_size=32", [-1, 16, 64, 49152, 2147483647, 1024, 8, 32], "", 0, []], [[], [["FU", 1, [0, 1, 2, 3]], ["SP", 1, 0, 480, [5], 1], ["AN", 1, 0, 5], ["AN", 1, 1, 6]]]], "r": [[2.58202e-06, 2.57415e-06, 2.5781e-06], 0, 1.51225, 1667941663], "v": "v0.6"}
{"i": [["[\"sigmoid\", 1, 1, 1, 480]", "cuda -keys=cuda,gpu -max_num_threads=1024 -model=unknown -thread_warp_size=32", [-1, 16, 64, 49152, 2147483647, 1024, 8, 32], "", 0, []], [[], [["FU", 1, [0, 1, 2, 3]], ["SP", 1, 0, 480, [48], 1], ["AN", 1, 0, 5], ["AN", 1, 1, 6]]]], "r": [[2.5749e-06, 2.58416e-06, 2.5947e-06], 0, 2.09326, 1667941664], "v": "v0.6"}
{"i": [["[\"sigmoid\", 1, 1, 1, 480]", "cuda -keys=cuda,gpu -max_num_threads=1024 -model=unknown -thread_warp_size=32", [-1, 16, 64, 49152, 2147483647, 1024, 8, 32], "", 0, []], [[], [["FU", 1, [0, 1, 2, 3]], ["SP", 1, 0, 480, [32], 1], ["AN", 1, 0, 5], ["AN", 1, 1, 6]]]], "r": [[2.56298e-06, 2.54865e-06, 2.54748e-06], 0, 0.590792, 1667941662], "v": "v0.6"}
{"i": [["[\"sigmoid\", 1, 1, 1, 480]", "cuda -keys=cuda,gpu -max_num_threads=1024 -model=unknown -thread_warp_size=32", [-1, 16, 64, 49152, 2147483647, 1024, 8, 32], "", 0, []], [[], [["FU", 1, [0, 1, 2, 3]], ["SP", 1, 0, 480, [4], 1], ["AN", 1, 0, 5], ["AN", 1, 1, 6]]]], "r": [[2.68338e-06, 2.67809e-06, 2.67719e-06], 0, 2.58409, 1667941665], "v": "v0.6"}
{"i": [["[\"sigmoid\", 1, 1, 1, 480]", "cuda -keys=cuda,gpu -max_num_threads=1024 -model=unknown -thread_warp_size=32", [-1, 16, 64, 49152, 2147483647, 1024, 8, 32], "", 0, []], [[], [["FU", 1, [0, 1, 2, 3]], ["SP", 1, 0, 480, [2], 1], ["AN", 1, 0, 5], ["AN", 1, 1, 6]]]], "r": [[2.90226e-06, 2.89712e-06, 2.90188e-06], 0, 1.74605, 1667941664], "v": "v0.6"}
{"i": [["[\"sigmoid\", 1, 1, 1, 480]", "cuda -keys=cuda,gpu -max_num_threads=1024 -model=unknown -thread_warp_size=32", [-1, 16, 64, 49152, 2147483647, 1024, 8, 32], "", 0, []], [[], [["FU", 1, [0, 1, 2, 3]], ["SP", 1, 0, 480, [6], 1], ["AN", 1, 0, 5], ["AN", 1, 1, 6]]]], "r": [[2.59899e-06, 2.59585e-06, 2.59532e-06], 0, 2.36056, 1667941664], "v": "v0.6"}
{"i": [["[\"sigmoid\", 1, 1, 1, 480]", "cuda -keys=cuda,gpu -max_num_threads=1024 -model=unknown -thread_warp_size=32", [-1, 16, 64, 49152, 2147483647, 1024, 8, 32], "", 0, []], [[], [["FU", 1, [0, 1, 2, 3]], ["SP", 1, 0, 480, [60], 1], ["AN", 1, 0, 5], ["AN", 1, 1, 6]]]], "r": [[2.50015e-06, 2.48667e-06, 2.4891e-06], 0, 2.90546, 1667941665], "v": "v0.6"}
{"i": [["[\"sigmoid\", 1, 1, 1, 480]", "cuda -keys=cuda,gpu -max_num_threads=1024 -model=unknown -thread_warp_size=32", [-1, 16, 64, 49152, 2147483647, 1024, 8, 32], "", 0, []], [[], [["FU", 1, [0, 1, 2, 3]], ["SP", 1, 0, 480, [16], 1], ["AN", 1, 0, 5], ["AN", 1, 1, 6]]]], "r": [[2.62825e-06, 2.62013e-06, 2.62398e-06], 0, 3.45004, 1667941666], "v": "v0.6"}
{"i": [["[\"sigmoid\", 1, 1, 1, 480]", "cuda -keys=cuda,gpu -max_num_threads=1024 -model=unknown -thread_warp_size=32", [-1, 16, 64, 49152, 2147483647, 1024, 8, 32], "", 0, []], [[], [["FU", 1, [0, 1, 2, 3]], ["SP", 1, 0, 480, [40], 1], ["AN", 1, 0, 5], ["AN", 1, 1, 6]]]], "r": [[2.50794e-06, 2.5051e-06, 2.50638e-06], 0, 3.14753, 1667941665], "v": "v0.6"}
{"i": [["[\"sigmoid\", 1, 1, 1, 480]", "cuda -keys=cuda,gpu -max_num_threads=1024 -model=unknown -thread_warp_size=32", [-1, 16, 64, 49152, 2147483647, 1024, 8, 32], "", 0, []], [[], [["FU", 1, [0, 1, 2, 3]], ["SP", 1, 0, 480, [10], 1], ["AN", 1, 0, 5], ["AN", 1, 1, 6]]]], "r": [[2.73818e-06, 2.74786e-06, 2.74436e-06], 0, 3.76127, 1667941666], "v": "v0.6"}
{"i": [["[\"sigmoid\", 1, 1, 1, 480]", "cuda -keys=cuda,gpu -max_num_threads=1024 -model=unknown -thread_warp_size=32", [-1, 16, 64, 49152, 2147483647, 1024, 8, 32], "", 0, []], [[], [["FU", 1, [0, 1, 2, 3]], ["SP", 1, 0, 480, [12], 1], ["AN", 1, 0, 5], ["AN", 1, 1, 6]]]], "r": [[2.58069e-06, 2.59571e-06, 2.60067e-06], 0, 4.00004, 1667941666], "v": "v0.6"}
{"i": [["[\"sigmoid\", 1, 1, 1, 480]", "cuda -keys=cuda,gpu -max_num_threads=1024 -model=unknown -thread_warp_size=32", [-1, 16, 64, 49152, 2147483647, 1024, 8, 32], "", 0, []], [[], [["FU", 1, [0, 1, 2, 3]], ["SP", 1, 0, 480, [1], 1], ["AN", 1, 0, 5], ["AN", 1, 1, 6]]]], "r": [[3.1098e-06, 3.11701e-06, 3.12038e-06], 0, 4.24825, 1667941666], "v": "v0.6"}
{"i": [["[\"sigmoid\", 1, 1, 1, 480]", "cuda -keys=cuda,gpu -max_num_threads=1024 -model=unknown -thread_warp_size=32", [-1, 16, 64, 49152, 2147483647, 1024, 8, 32], "", 0, []], [[], [["FU", 1, [0, 1, 2, 3]], ["SP", 1, 0, 480, [20], 1], ["AN", 1, 0, 5], ["AN", 1, 1, 6]]]], "r": [[2.57539e-06, 2.56784e-06, 2.57147e-06], 0, 4.52008, 1667941667], "v": "v0.6"}
{"i": [["[\"sigmoid\", 1, 1, 1, 480]", "cuda -keys=cuda,gpu -max_num_threads=1024 -model=unknown -thread_warp_size=32", [-1, 16, 64, 49152, 2147483647, 1024, 8, 32], "", 0, []], [[], [["FU", 1, [0, 1, 2, 3]], ["SP", 1, 0, 480, [30], 1], ["AN", 1, 0, 5], ["AN", 1, 1, 6]]]], "r": [[2.52886e-06, 2.52604e-06, 2.52304e-06], 0, 4.77582, 1667941667], "v": "v0.6"}
{"i": [["[\"sigmoid\", 1, 1, 1, 480]", "cuda -keys=cuda,gpu -max_num_threads=1024 -model=unknown -thread_warp_size=32", [-1, 16, 64, 49152, 2147483647, 1024, 8, 32], "", 0, []], [[], [["FU", 1, [0, 1, 2, 3]], ["SP", 1, 0, 480, [24], 1], ["AN", 1, 0, 5], ["AN", 1, 1, 6]]]], "r": [[2.49971e-06, 2.48934e-06, 2.4914e-06], 0, 5.03589, 1667941667], "v": "v0.6"}
{"i": [["[\"sigmoid\", 1, 1, 1, 480]", "cuda -keys=cuda,gpu -max_num_threads=1024 -model=unknown -thread_warp_size=32", [-1, 16, 64, 49152, 2147483647, 1024, 8, 32], "", 0, []], [[], [["FU", 1, [0, 1, 2, 3]], ["SP", 1, 0, 480, [8], 1], ["AN", 1, 0, 5], ["AN", 1, 1, 6]]]], "r": [[2.52828e-06, 2.51837e-06, 2.52168e-06], 0, 5.40849, 1667941668], "v": "v0.6"}
{"i": [["[\"sigmoid\", 1, 1, 1, 480]", "cuda -keys=cuda,gpu -max_num_threads=1024 -model=unknown -thread_warp_size=32", [-1, 16, 64, 49152, 2147483647, 1024, 8, 32], "", 0, []], [[], [["FU", 1, [0, 1, 2, 3]], ["SP", 1, 0, 480, [8], 1], ["AN", 1, 0, 5], ["AN", 1, 1, 6]]]], "r": [[2.68952e-06, 2.69127e-06, 2.69319e-06], 0, 1.84172, 1667942232], "v": "v0.6"}
{"i": [["[\"sigmoid\", 1, 1, 1, 480]", "cuda -keys=cuda,gpu -max_num_threads=1024 -model=unknown -thread_warp_size=32", [-1, 16, 64, 49152, 2147483647, 1024, 8, 32], "", 0, []], [[], [["FU", 1, [0, 1, 2, 3]], ["SP", 1, 0, 480, [2], 1], ["AN", 1, 0, 5], ["AN", 1, 1, 6]]]], "r": [[2.98958e-06, 2.99723e-06, 2.99871e-06], 0, 1.52095, 1667942231], "v": "v0.6"}
{"i": [["[\"sigmoid\", 1, 1, 1, 480]", "cuda -keys=cuda,gpu -max_num_threads=1024 -model=unknown -thread_warp_size=32", [-1, 16, 64, 49152, 2147483647, 1024, 8, 32], "", 0, []], [[], [["FU", 1, [0, 1, 2, 3]], ["SP", 1, 0, 480, [12], 1], ["AN", 1, 0, 5], ["AN", 1, 1, 6]]]], "r": [[2.50625e-06, 2.49463e-06, 2.49993e-06], 0, 2.14421, 1667942232], "v": "v0.6"}
{"i": [["[\"sigmoid\", 1, 1, 1, 480]", "cuda -keys=cuda,gpu -max_num_threads=1024 -model=unknown -thread_warp_size=32", [-1, 16, 64, 49152, 2147483647, 1024, 8, 32], "", 0, []], [[], [["FU", 1, [0, 1, 2, 3]], ["SP", 1, 0, 480, [16], 1], ["AN", 1, 0, 5], ["AN", 1, 1, 6]]]], "r": [[2.6123e-06, 2.57445e-06, 2.56342e-06], 0, 0.61616, 1667942230], "v": "v0.6"}
{"i": [["[\"sigmoid\", 1, 1, 1, 480]", "cuda -keys=cuda,gpu -max_num_threads=1024 -model=unknown -thread_warp_size=32", [-1, 16, 64, 49152, 2147483647, 1024, 8, 32], "", 0, []], [[], [["FU", 1, [0, 1, 2, 3]], ["SP", 1, 0, 480, [10], 1], ["AN", 1, 0, 5], ["AN", 1, 1, 6]]]], "r": [[2.67076e-06, 2.67386e-06, 2.67206e-06], 0, 2.38947, 1667942232], "v": "v0.6"}
{"i": [["[\"sigmoid\", 1, 1, 1, 480]", "cuda -keys=cuda,gpu -max_num_threads=1024 -model=unknown -thread_warp_size=32", [-1, 16, 64, 49152, 2147483647, 1024, 8, 32], "", 0, []], [[], [["FU", 1, [0, 1, 2, 3]], ["SP", 1, 0, 480, [3], 1], ["AN", 1, 0, 5], ["AN", 1, 1, 6]]]], "r": [[2.64168e-06, 2.63881e-06, 2.63826e-06], 0, 1.25761, 1667942231], "v": "v0.6"}
{"i": [["[\"sigmoid\", 1, 1, 1, 480]", "cuda -keys=cuda,gpu -max_num_threads=1024 -model=unknown -thread_warp_size=32", [-1, 16, 64, 49152, 2147483647, 1024, 8, 32], "", 0, []], [[], [["FU", 1, [0, 1, 2, 3]], ["SP", 1, 0, 480, [40], 1], ["AN", 1, 0, 5], ["AN", 1, 1, 6]]]], "r": [[2.58716e-06, 2.58109e-06, 2.57925e-06], 0, 0.880306, 1667942231], "v": "v0.6"}
{"i": [["[\"sigmoid\", 1, 1, 1, 480]", "cuda -keys=cuda,gpu -max_num_threads=1024 -model=unknown -thread_warp_size=32", [-1, 16, 64, 49152, 2147483647, 1024, 8, 32], "", 0, []], [[], [["FU", 1, [0, 1, 2, 3]], ["SP", 1, 0, 480, [5], 1], ["AN", 1, 0, 5], ["AN", 1, 1, 6]]]], "r": [[2.53807e-06, 2.52581e-06, 2.53113e-06], 0, 2.58338, 1667942233], "v": "v0.6"}
{"i": [["[\"sigmoid\", 1, 1, 1, 480]", "cuda -keys=cuda,gpu -max_num_threads=1024 -model=unknown -thread_warp_size=32", [-1, 16, 64, 49152, 2147483647, 1024, 8, 32], "", 0, []], [[], [["FU", 1, [0, 1, 2, 3]], ["SP", 1, 0, 480, [6], 1], ["AN", 1, 0, 5], ["AN", 1, 1, 6]]]], "r": [[2.62263e-06, 2.6136e-06, 2.61477e-06], 0, 2.87507, 1667942233], "v": "v0.6"}
{"i": [["[\"sigmoid\", 1, 1, 1, 480]", "cuda -keys=cuda,gpu -max_num_threads=1024 -model=unknown -thread_warp_size=32", [-1, 16, 64, 49152, 2147483647, 1024, 8, 32], "", 0, []], [[], [["FU", 1, [0, 1, 2, 3]], ["SP", 1, 0, 480, [1], 1], ["AN", 1, 0, 5], ["AN", 1, 1, 6]]]], "r": [[2.97171e-06, 2.97216e-06, 2.97256e-06], 0, 3.05155, 1667942233], "v": "v0.6"}
{"i": [["[\"sigmoid\", 1, 1, 1, 480]", "cuda -keys=cuda,gpu -max_num_threads=1024 -model=unknown -thread_warp_size=32", [-1, 16, 64, 49152, 2147483647, 1024, 8, 32], "", 0, []], [[], [["FU", 1, [0, 1, 2, 3]], ["SP", 1, 0, 480, [20], 1], ["AN", 1, 0, 5], ["AN", 1, 1, 6]]]], "r": [[2.58264e-06, 2.57663e-06, 2.57531e-06], 0, 3.35229, 1667942234], "v": "v0.6"}
{"i": [["[\"sigmoid\", 1, 1, 1, 480]", "cuda -keys=cuda,gpu -max_num_threads=1024 -model=unknown -thread_warp_size=32", [-1, 16, 64, 49152, 2147483647, 1024, 8, 32], "", 0, []], [[], [["FU", 1, [0, 1, 2, 3]], ["SP", 1, 0, 480, [32], 1], ["AN", 1, 0, 5], ["AN", 1, 1, 6]]]], "r": [[2.50949e-06, 2.50225e-06, 2.50278e-06], 0, 3.64778, 1667942234], "v": "v0.6"}
{"i": [["[\"sigmoid\", 1, 1, 1, 480]", "cuda -keys=cuda,gpu -max_num_threads=1024 -model=unknown -thread_warp_size=32", [-1, 16, 64, 49152, 2147483647, 1024, 8, 32], "", 0, []], [[], [["FU", 1, [0, 1, 2, 3]], ["SP", 1, 0, 480, [15], 1], ["AN", 1, 0, 5], ["AN", 1, 1, 6]]]], "r": [[2.55367e-06, 2.54939e-06, 2.54934e-06], 0, 3.9353, 1667942234], "v": "v0.6"}
{"i": [["[\"sigmoid\", 1, 1, 1, 480]", "cuda -keys=cuda,gpu -max_num_threads=1024 -model=unknown -thread_warp_size=32", [-1, 16, 64, 49152, 2147483647, 1024, 8, 32], "", 0, []], [[], [["FU", 1, [0, 1, 2, 3]], ["SP", 1, 0, 480, [4], 1], ["AN", 1, 0, 5], ["AN", 1, 1, 6]]]], "r": [[2.67856e-06, 2.67184e-06, 2.67443e-06], 0, 4.16191, 1667942235], "v": "v0.6"}
{"i": [["[\"sigmoid\", 1, 1, 1, 480]", "cuda -keys=cuda,gpu -max_num_threads=1024 -model=unknown -thread_warp_size=32", [-1, 16, 64, 49152, 2147483647, 1024, 8, 32], "", 0, []], [[], [["FU", 1, [0, 1, 2, 3]], ["SP", 1, 0, 480, [60], 1], ["AN", 1, 0, 5], ["AN", 1, 1, 6]]]], "r": [[2.60653e-06, 2.60226e-06, 2.60386e-06], 0, 4.76059, 1667942235], "v": "v0.6"}
{"i": [["[\"sigmoid\", 1, 1, 1, 480]", "cuda -keys=cuda,gpu -max_num_threads=1024 -model=unknown -thread_warp_size=32", [-1, 16, 64, 49152, 2147483647, 1024, 8, 32], "", 0, []], [[], [["FU", 1, [0, 1, 2, 3]], ["SP", 1, 0, 480, [48], 1], ["AN", 1, 0, 5], ["AN", 1, 1, 6]]]], "r": [[2.53549e-06, 2.53299e-06, 2.53078e-06], 0, 4.44667, 1667942235], "v": "v0.6"}
{"i": [["[\"sigmoid\", 1, 1, 1, 480]", "cuda -keys=cuda,gpu -max_num_threads=1024 -model=unknown -thread_warp_size=32", [-1, 16, 64, 49152, 2147483647, 1024, 8, 32], "", 0, []], [[], [["FU", 1, [0, 1, 2, 3]], ["SP", 1, 0, 480, [24], 1], ["AN", 1, 0, 5], ["AN", 1, 1, 6]]]], "r": [[2.4941e-06, 2.47985e-06, 2.4819e-06], 0, 5.00987, 1667942236], "v": "v0.6"}
{"i": [["[\"sigmoid\", 1, 1, 1, 480]", "cuda -keys=cuda,gpu -max_num_threads=1024 -model=unknown -thread_warp_size=32", [-1, 16, 64, 49152, 2147483647, 1024, 8, 32], "", 0, []], [[], [["FU", 1, [0, 1, 2, 3]], ["SP", 1, 0, 480, [30], 1], ["AN", 1, 0, 5], ["AN", 1, 1, 6]]]], "r": [[2.56869e-06, 2.56706e-06, 2.56297e-06], 0, 5.31608, 1667942236], "v": "v0.6"}
