python/models/efficientnet/VertiFusionEfficientNet_kernel_configs/efficient_sigmoid_1_56_56_96.log
{"i": [["[\"sigmoid\", 1, 56, 56, 96]", "cuda -keys=cuda,gpu -max_num_threads=1024 -model=unknown -thread_warp_size=32", [-1, 16, 64, 49152, 2147483647, 1024, 8, 32], "", 0, []], [[], [["FU", 1, [0, 1, 2, 3]], ["SP", 1, 0, 301056, [2], 1], ["AN", 1, 0, 5], ["AN", 1, 1, 6]]]], "r": [[0.00011465, 0.00011467, 0.000114671], 0, 2.49608, 1667925376], "v": "v0.6"}
{"i": [["[\"sigmoid\", 1, 56, 56, 96]", "cuda -keys=cuda,gpu -max_num_threads=1024 -model=unknown -thread_warp_size=32", [-1, 16, 64, 49152, 2147483647, 1024, 8, 32], "", 0, []], [[], [["FU", 1, [0, 1, 2, 3]], ["SP", 1, 0, 301056, [32], 1], ["AN", 1, 0, 5], ["AN", 1, 1, 6]]]], "r": [[1.0056e-05, 1.00701e-05, 1.00605e-05], 0, 1.22014, 1667925374], "v": "v0.6"}
{"i": [["[\"sigmoid\", 1, 56, 56, 96]", "cuda -keys=cuda,gpu -max_num_threads=1024 -model=unknown -thread_warp_size=32", [-1, 16, 64, 49152, 2147483647, 1024, 8, 32], "", 0, []], [[], [["FU", 1, [0, 1, 2, 3]], ["SP", 1, 0, 301056, [56], 1], ["AN", 1, 0, 5], ["AN", 1, 1, 6]]]], "r": [[6.76743e-06, 6.76731e-06, 6.76681e-06], 0, 2.24489, 1667925375], "v": "v0.6"}
{"i": [["[\"sigmoid\", 1, 56, 56, 96]", "cuda -keys=cuda,gpu -max_num_threads=1024 -model=unknown -thread_warp_size=32", [-1, 16, 64, 49152, 2147483647, 1024, 8, 32], "", 0, []], [[], [["FU", 1, [0, 1, 2, 3]], ["SP", 1, 0, 301056, [64], 1], ["AN", 1, 0, 5], ["AN", 1, 1, 6]]]], "r": [[6.15956e-06, 6.16495e-06, 6.15967e-06], 0, 0.649109, 1667925374], "v": "v0.6"}
{"i": [["[\"sigmoid\", 1, 56, 56, 96]", "cuda -keys=cuda,gpu -max_num_threads=1024 -model=unknown -thread_warp_size=32", [-1, 16, 64, 49152, 2147483647, 1024, 8, 32], "", 0, []], [[], [["FU", 1, [0, 1, 2, 3]], ["SP", 1, 0, 301056, [48], 1], ["AN", 1, 0, 5], ["AN", 1, 1, 6]]]], "r": [[7.42981e-06, 7.43368e-06, 7.43862e-06], 0, 0.969224, 1667925374], "v": "v0.6"}
{"i": [["[\"sigmoid\", 1, 56, 56, 96]", "cuda -keys=cuda,gpu -max_num_threads=1024 -model=unknown -thread_warp_size=32", [-1, 16, 64, 49152, 2147483647, 1024, 8, 32], "", 0, []], [[], [["FU", 1, [0, 1, 2, 3]], ["SP", 1, 0, 301056, [4], 1], ["AN", 1, 0, 5], ["AN", 1, 1, 6]]]], "r": [[5.87344e-05, 5.87464e-05, 5.87322e-05], 0, 1.98125, 1667925375], "v": "v0.6"}
{"i": [["[\"sigmoid\", 1, 56, 56, 96]", "cuda -keys=cuda,gpu -max_num_threads=1024 -model=unknown -thread_warp_size=32", [-1, 16, 64, 49152, 2147483647, 1024, 8, 32], "", 0, []], [[], [["FU", 1, [0, 1, 2, 3]], ["SP", 1, 0, 301056, [16], 1], ["AN", 1, 0, 5], ["AN", 1, 1, 6]]]], "r": [[1.70051e-05, 1.70113e-05, 1.70169e-05], 0, 1.55077, 1667925375], "v": "v0.6"}
{"i": [["[\"sigmoid\", 1, 56, 56, 96]", "cuda -keys=cuda,gpu -max_num_threads=1024 -model=unknown -thread_warp_size=32", [-1, 16, 64, 49152, 2147483647, 1024, 8, 32], "", 0, []], [[], [["FU", 1, [0, 1, 2, 3]], ["SP", 1, 0, 301056, [7], 1], ["AN", 1, 0, 5], ["AN", 1, 1, 6]]]], "r": [[3.48466e-05, 3.48334e-05, 3.48505e-05], 0, 2.79631, 1667925376], "v": "v0.6"}
{"i": [["[\"sigmoid\", 1, 56, 56, 96]", "cuda -keys=cuda,gpu -max_num_threads=1024 -model=unknown -thread_warp_size=32", [-1, 16, 64, 49152, 2147483647, 1024, 8, 32], "", 0, []], [[], [["FU", 1, [0, 1, 2, 3]], ["SP", 1, 0, 301056, [8], 1], ["AN", 1, 0, 5], ["AN", 1, 1, 6]]]], "r": [[3.10326e-05, 3.10451e-05, 3.10481e-05], 0, 3.06807, 1667925376], "v": "v0.6"}
{"i": [["[\"sigmoid\", 1, 56, 56, 96]", "cuda -keys=cuda,gpu -max_num_threads=1024 -model=unknown -thread_warp_size=32", [-1, 16, 64, 49152, 2147483647, 1024, 8, 32], "", 0, []], [[], [["FU", 1, [0, 1, 2, 3]], ["SP", 1, 0, 301056, [12], 1], ["AN", 1, 0, 5], ["AN", 1, 1, 6]]]], "r": [[2.15335e-05, 2.15511e-05, 2.15505e-05], 0, 3.35362, 1667925377], "v": "v0.6"}
{"i": [["[\"sigmoid\", 1, 56, 56, 96]", "cuda -keys=cuda,gpu -max_num_threads=1024 -model=unknown -thread_warp_size=32", [-1, 16, 64, 49152, 2147483647, 1024, 8, 32], "", 0, []], [[], [["FU", 1, [0, 1, 2, 3]], ["SP", 1, 0, 301056, [3], 1], ["AN", 1, 0, 5], ["AN", 1, 1, 6]]]], "r": [[7.74095e-05, 7.74204e-05, 7.73914e-05], 0, 3.6332, 1667925377], "v": "v0.6"}
{"i": [["[\"sigmoid\", 1, 56, 56, 96]", "cuda -keys=cuda,gpu -max_num_threads=1024 -model=unknown -thread_warp_size=32", [-1, 16, 64, 49152, 2147483647, 1024, 8, 32], "", 0, []], [[], [["FU", 1, [0, 1, 2, 3]], ["SP", 1, 0, 301056, [42], 1], ["AN", 1, 0, 5], ["AN", 1, 1, 6]]]], "r": [[7.95631e-06, 7.97394e-06, 7.96487e-06], 0, 3.89158, 1667925377], "v": "v0.6"}
{"i": [["[\"sigmoid\", 1, 56, 56, 96]", "cuda -keys=cuda,gpu -max_num_threads=1024 -model=unknown -thread_warp_size=32", [-1, 16, 64, 49152, 2147483647, 1024, 8, 32], "", 0, []], [[], [["FU", 1, [0, 1, 2, 3]], ["SP", 1, 0, 301056, [49], 1], ["AN", 1, 0, 5], ["AN", 1, 1, 6]]]], "r": [[7.3197e-06, 7.32011e-06, 7.32534e-06], 0, 4.09955, 1667925378], "v": "v0.6"}
{"i": [["[\"sigmoid\", 1, 56, 56, 96]", "cuda -keys=cuda,gpu -max_num_threads=1024 -model=unknown -thread_warp_size=32", [-1, 16, 64, 49152, 2147483647, 1024, 8, 32], "", 0, []], [[], [["FU", 1, [0, 1, 2, 3]], ["SP", 1, 0, 301056, [14], 1], ["AN", 1, 0, 5], ["AN", 1, 1, 6]]]], "r": [[1.8963e-05, 1.89754e-05, 1.89717e-05], 0, 4.43993, 1667925378], "v": "v0.6"}
{"i": [["[\"sigmoid\", 1, 56, 56, 96]", "cuda -keys=cuda,gpu -max_num_threads=1024 -model=unknown -thread_warp_size=32", [-1, 16, 64, 49152, 2147483647, 1024, 8, 32], "", 0, []], [[], [["FU", 1, [0, 1, 2, 3]], ["SP", 1, 0, 301056, [6], 1], ["AN", 1, 0, 5], ["AN", 1, 1, 6]]]], "r": [[4.0241e-05, 4.02579e-05, 4.02592e-05], 0, 4.71455, 1667925378], "v": "v0.6"}
{"i": [["[\"sigmoid\", 1, 56, 56, 96]", "cuda -keys=cuda,gpu -max_num_threads=1024 -model=unknown -thread_warp_size=32", [-1, 16, 64, 49152, 2147483647, 1024, 8, 32], "", 0, []], [[], [["FU", 1, [0, 1, 2, 3]], ["SP", 1, 0, 301056, [28], 1], ["AN", 1, 0, 5], ["AN", 1, 1, 6]]]], "r": [[1.09191e-05, 1.09297e-05, 1.0928e-05], 0, 4.94009, 1667925379], "v": "v0.6"}
{"i": [["[\"sigmoid\", 1, 56, 56, 96]", "cuda -keys=cuda,gpu -max_num_threads=1024 -model=unknown -thread_warp_size=32", [-1, 16, 64, 49152, 2147483647, 1024, 8, 32], "", 0, []], [[], [["FU", 1, [0, 1, 2, 3]], ["SP", 1, 0, 301056, [24], 1], ["AN", 1, 0, 5], ["AN", 1, 1, 6]]]], "r": [[1.22189e-05, 1.2228e-05, 1.22229e-05], 0, 5.25999, 1667925379], "v": "v0.6"}
{"i": [["[\"sigmoid\", 1, 56, 56, 96]", "cuda -keys=cuda,gpu -max_num_threads=1024 -model=unknown -thread_warp_size=32", [-1, 16, 64, 49152, 2147483647, 1024, 8, 32], "", 0, []], [[], [["FU", 1, [0, 1, 2, 3]], ["SP", 1, 0, 301056, [21], 1], ["AN", 1, 0, 5], ["AN", 1, 1, 6]]]], "r": [[1.35659e-05, 1.35761e-05, 1.3568e-05], 0, 5.56829, 1667925379], "v": "v0.6"}
{"i": [["[\"sigmoid\", 1, 56, 56, 96]", "cuda -keys=cuda,gpu -max_num_threads=1024 -model=unknown -thread_warp_size=32", [-1, 16, 64, 49152, 2147483647, 1024, 8, 32], "", 0, []], [[], [["FU", 1, [0, 1, 2, 3]], ["SP", 1, 0, 301056, [1], 1], ["AN", 1, 0, 5], ["AN", 1, 1, 6]]]], "r": [[0.000226141, 0.000226134, 0.000226155], 0, 5.81454, 1667925380], "v": "v0.6"}
{"i": [["[\"sigmoid\", 1, 56, 56, 96]", "cuda -keys=cuda,gpu -max_num_threads=1024 -model=unknown -thread_warp_size=32", [-1, 16, 64, 49152, 2147483647, 1024, 8, 32], "", 0, []], [[], [["FU", 1, [0, 1, 2, 3]], ["SP", 1, 0, 301056, [6], 1], ["AN", 1, 0, 5], ["AN", 1, 1, 6]]]], "r": [[4.00975e-05, 4.01016e-05, 4.01115e-05], 0, 0.600494, 1667925946], "v": "v0.6"}
{"i": [["[\"sigmoid\", 1, 56, 56, 96]", "cuda -keys=cuda,gpu -max_num_threads=1024 -model=unknown -thread_warp_size=32", [-1, 16, 64, 49152, 2147483647, 1024, 8, 32], "", 0, []], [[], [["FU", 1, [0, 1, 2, 3]], ["SP", 1, 0, 301056, [1], 1], ["AN", 1, 0, 5], ["AN", 1, 1, 6]]]], "r": [[0.000226065, 0.000226069, 0.000226077], 0, 1.84849, 1667925948], "v": "v0.6"}
{"i": [["[\"sigmoid\", 1, 56, 56, 96]", "cuda -keys=cuda,gpu -max_num_threads=1024 -model=unknown -thread_warp_size=32", [-1, 16, 64, 49152, 2147483647, 1024, 8, 32], "", 0, []], [[], [["FU", 1, [0, 1, 2, 3]], ["SP", 1, 0, 301056, [48], 1], ["AN", 1, 0, 5], ["AN", 1, 1, 6]]]], "r": [[7.47653e-06, 7.49576e-06, 7.48931e-06], 0, 2.48532, 1667925948], "v": "v0.6"}
{"i": [["[\"sigmoid\", 1, 56, 56, 96]", "cuda -keys=cuda,gpu -max_num_threads=1024 -model=unknown -thread_warp_size=32", [-1, 16, 64, 49152, 2147483647, 1024, 8, 32], "", 0, []], [[], [["FU", 1, [0, 1, 2, 3]], ["SP", 1, 0, 301056, [42], 1], ["AN", 1, 0, 5], ["AN", 1, 1, 6]]]], "r": [[7.95609e-06, 7.9704e-06, 7.97165e-06], 0, 2.81999, 1667925949], "v": "v0.6"}
{"i": [["[\"sigmoid\", 1, 56, 56, 96]", "cuda -keys=cuda,gpu -max_num_threads=1024 -model=unknown -thread_warp_size=32", [-1, 16, 64, 49152, 2147483647, 1024, 8, 32], "", 0, []], [[], [["FU", 1, [0, 1, 2, 3]], ["SP", 1, 0, 301056, [16], 1], ["AN", 1, 0, 5], ["AN", 1, 1, 6]]]], "r": [[1.69792e-05, 1.69963e-05, 1.70017e-05], 0, 2.19031, 1667925948], "v": "v0.6"}
{"i": [["[\"sigmoid\", 1, 56, 56, 96]", "cuda -keys=cuda,gpu -max_num_threads=1024 -model=unknown -thread_warp_size=32", [-1, 16, 64, 49152, 2147483647, 1024, 8, 32], "", 0, []], [[], [["FU", 1, [0, 1, 2, 3]], ["SP", 1, 0, 301056, [32], 1], ["AN", 1, 0, 5], ["AN", 1, 1, 6]]]], "r": [[9.79889e-06, 9.81761e-06, 9.81789e-06], 0, 0.963946, 1667925947], "v": "v0.6"}
{"i": [["[\"sigmoid\", 1, 56, 56, 96]", "cuda -keys=cuda,gpu -max_num_threads=1024 -model=unknown -thread_warp_size=32", [-1, 16, 64, 49152, 2147483647, 1024, 8, 32], "", 0, []], [[], [["FU", 1, [0, 1, 2, 3]], ["SP", 1, 0, 301056, [7], 1], ["AN", 1, 0, 5], ["AN", 1, 1, 6]]]], "r": [[3.47769e-05, 3.47847e-05, 3.47921e-05], 0, 1.21912, 1667925947], "v": "v0.6"}
{"i": [["[\"sigmoid\", 1, 56, 56, 96]", "cuda -keys=cuda,gpu -max_num_threads=1024 -model=unknown -thread_warp_size=32", [-1, 16, 64, 49152, 2147483647, 1024, 8, 32], "", 0, []], [[], [["FU", 1, [0, 1, 2, 3]], ["SP", 1, 0, 301056, [2], 1], ["AN", 1, 0, 5], ["AN", 1, 1, 6]]]], "r": [[0.000114623, 0.000114657, 0.000114639], 0, 1.55929, 1667925947], "v": "v0.6"}
{"i": [["[\"sigmoid\", 1, 56, 56, 96]", "cuda -keys=cuda,gpu -max_num_threads=1024 -model=unknown -thread_warp_size=32", [-1, 16, 64, 49152, 2147483647, 1024, 8, 32], "", 0, []], [[], [["FU", 1, [0, 1, 2, 3]], ["SP", 1, 0, 301056, [3], 1], ["AN", 1, 0, 5], ["AN", 1, 1, 6]]]], "r": [[7.7292e-05, 7.73248e-05, 7.72943e-05], 0, 3.01217, 1667925949], "v": "v0.6"}
{"i": [["[\"sigmoid\", 1, 56, 56, 96]", "cuda -keys=cuda,gpu -max_num_threads=1024 -model=unknown -thread_warp_size=32", [-1, 16, 64, 49152, 2147483647, 1024, 8, 32], "", 0, []], [[], [["FU", 1, [0, 1, 2, 3]], ["SP", 1, 0, 301056, [12], 1], ["AN", 1, 0, 5], ["AN", 1, 1, 6]]]], "r": [[2.15746e-05, 2.15804e-05, 2.15683e-05], 0, 3.65044, 1667925950], "v": "v0.6"}
{"i": [["[\"sigmoid\", 1, 56, 56, 96]", "cuda -keys=cuda,gpu -max_num_threads=1024 -model=unknown -thread_warp_size=32", [-1, 16, 64, 49152, 2147483647, 1024, 8, 32], "", 0, []], [[], [["FU", 1, [0, 1, 2, 3]], ["SP", 1, 0, 301056, [8], 1], ["AN", 1, 0, 5], ["AN", 1, 1, 6]]]], "r": [[3.09363e-05, 3.0919e-05, 3.09151e-05], 0, 3.32482, 1667925949], "v": "v0.6"}
{"i": [["[\"sigmoid\", 1, 56, 56, 96]", "cuda -keys=cuda,gpu -max_num_threads=1024 -model=unknown -thread_warp_size=32", [-1, 16, 64, 49152, 2147483647, 1024, 8, 32], "", 0, []], [[], [["FU", 1, [0, 1, 2, 3]], ["SP", 1, 0, 301056, [56], 1], ["AN", 1, 0, 5], ["AN", 1, 1, 6]]]], "r": [[6.61768e-06, 6.62715e-06, 6.63093e-06], 0, 3.85824, 1667925950], "v": "v0.6"}
{"i": [["[\"sigmoid\", 1, 56, 56, 96]", "cuda -keys=cuda,gpu -max_num_threads=1024 -model=unknown -thread_warp_size=32", [-1, 16, 64, 49152, 2147483647, 1024, 8, 32], "", 0, []], [[], [["FU", 1, [0, 1, 2, 3]], ["SP", 1, 0, 301056, [49], 1], ["AN", 1, 0, 5], ["AN", 1, 1, 6]]]], "r": [[7.27401e-06, 7.28439e-06, 7.28174e-06], 0, 4.1045, 1667925950], "v": "v0.6"}
{"i": [["[\"sigmoid\", 1, 56, 56, 96]", "cuda -keys=cuda,gpu -max_num_threads=1024 -model=unknown -thread_warp_size=32", [-1, 16, 64, 49152, 2147483647, 1024, 8, 32], "", 0, []], [[], [["FU", 1, [0, 1, 2, 3]], ["SP", 1, 0, 301056, [64], 1], ["AN", 1, 0, 5], ["AN", 1, 1, 6]]]], "r": [[6.08256e-06, 6.09836e-06, 6.09787e-06], 0, 4.46335, 1667925951], "v": "v0.6"}
{"i": [["[\"sigmoid\", 1, 56, 56, 96]", "cuda -keys=cuda,gpu -max_num_threads=1024 -model=unknown -thread_warp_size=32", [-1, 16, 64, 49152, 2147483647, 1024, 8, 32], "", 0, []], [[], [["FU", 1, [0, 1, 2, 3]], ["SP", 1, 0, 301056, [14], 1], ["AN", 1, 0, 5], ["AN", 1, 1, 6]]]], "r": [[1.89554e-05, 1.89631e-05, 1.89657e-05], 0, 4.72249, 1667925951], "v": "v0.6"}
{"i": [["[\"sigmoid\", 1, 56, 56, 96]", "cuda -keys=cuda,gpu -max_num_threads=1024 -model=unknown -thread_warp_size=32", [-1, 16, 64, 49152, 2147483647, 1024, 8, 32], "", 0, []], [[], [["FU", 1, [0, 1, 2, 3]], ["SP", 1, 0, 301056, [28], 1], ["AN", 1, 0, 5], ["AN", 1, 1, 6]]]], "r": [[1.09021e-05, 1.09104e-05, 1.09132e-05], 0, 5.00398, 1667925951], "v": "v0.6"}
{"i": [["[\"sigmoid\", 1, 56, 56, 96]", "cuda -keys=cuda,gpu -max_num_threads=1024 -model=unknown -thread_warp_size=32", [-1, 16, 64, 49152, 2147483647, 1024, 8, 32], "", 0, []], [[], [["FU", 1, [0, 1, 2, 3]], ["SP", 1, 0, 301056, [4], 1], ["AN", 1, 0, 5], ["AN", 1, 1, 6]]]], "r": [[5.86714e-05, 5.8684e-05, 5.87092e-05], 0, 5.33369, 1667925952], "v": "v0.6"}
{"i": [["[\"sigmoid\", 1, 56, 56, 96]", "cuda -keys=cuda,gpu -max_num_threads=1024 -model=unknown -thread_warp_size=32", [-1, 16, 64, 49152, 2147483647, 1024, 8, 32], "", 0, []], [[], [["FU", 1, [0, 1, 2, 3]], ["SP", 1, 0, 301056, [24], 1], ["AN", 1, 0, 5], ["AN", 1, 1, 6]]]], "r": [[1.21833e-05, 1.21965e-05, 1.21975e-05], 0, 5.58606, 1667925952], "v": "v0.6"}
{"i": [["[\"sigmoid\", 1, 56, 56, 96]", "cuda -keys=cuda,gpu -max_num_threads=1024 -model=unknown -thread_warp_size=32", [-1, 16, 64, 49152, 2147483647, 1024, 8, 32], "", 0, []], [[], [["FU", 1, [0, 1, 2, 3]], ["SP", 1, 0, 301056, [21], 1], ["AN", 1, 0, 5], ["AN", 1, 1, 6]]]], "r": [[1.35827e-05, 1.36025e-05, 1.3592e-05], 0, 5.8374, 1667925952], "v": "v0.6"}
{"i": [["[\"sigmoid\", 1, 56, 56, 96]", "cuda -keys=cuda,gpu -max_num_threads=1024 -model=unknown -thread_warp_size=32", [-1, 16, 64, 49152, 2147483647, 1024, 8, 32], "", 0, []], [[], [["FU", 1, [0, 1, 2, 3]], ["SP", 1, 0, 301056, [3], 1], ["AN", 1, 0, 5], ["AN", 1, 1, 6]]]], "r": [[7.73414e-05, 7.73657e-05, 7.73452e-05], 0, 1.31899, 1667932905], "v": "v0.6"}
{"i": [["[\"sigmoid\", 1, 56, 56, 96]", "cuda -keys=cuda,gpu -max_num_threads=1024 -model=unknown -thread_warp_size=32", [-1, 16, 64, 49152, 2147483647, 1024, 8, 32], "", 0, []], [[], [["FU", 1, [0, 1, 2, 3]], ["SP", 1, 0, 301056, [8], 1], ["AN", 1, 0, 5], ["AN", 1, 1, 6]]]], "r": [[3.08028e-05, 3.08118e-05, 3.07765e-05], 0, 0.663754, 1667932904], "v": "v0.6"}
{"i": [["[\"sigmoid\", 1, 56, 56, 96]", "cuda -keys=cuda,gpu -max_num_threads=1024 -model=unknown -thread_warp_size=32", [-1, 16, 64, 49152, 2147483647, 1024, 8, 32], "", 0, []], [[], [["FU", 1, [0, 1, 2, 3]], ["SP", 1, 0, 301056, [24], 1], ["AN", 1, 0, 5], ["AN", 1, 1, 6]]]], "r": [[1.23956e-05, 1.24206e-05, 1.24135e-05], 0, 2.27104, 1667932906], "v": "v0.6"}
{"i": [["[\"sigmoid\", 1, 56, 56, 96]", "cuda -keys=cuda,gpu -max_num_threads=1024 -model=unknown -thread_warp_size=32", [-1, 16, 64, 49152, 2147483647, 1024, 8, 32], "", 0, []], [[], [["FU", 1, [0, 1, 2, 3]], ["SP", 1, 0, 301056, [42], 1], ["AN", 1, 0, 5], ["AN", 1, 1, 6]]]], "r": [[8.10462e-06, 8.11753e-06, 8.11505e-06], 0, 1.64327, 1667932905], "v": "v0.6"}
{"i": [["[\"sigmoid\", 1, 56, 56, 96]", "cuda -keys=cuda,gpu -max_num_threads=1024 -model=unknown -thread_warp_size=32", [-1, 16, 64, 49152, 2147483647, 1024, 8, 32], "", 0, []], [[], [["FU", 1, [0, 1, 2, 3]], ["SP", 1, 0, 301056, [16], 1], ["AN", 1, 0, 5], ["AN", 1, 1, 6]]]], "r": [[1.69095e-05, 1.69078e-05, 1.68924e-05], 0, 1.05784, 1667932905], "v": "v0.6"}
{"i": [["[\"sigmoid\", 1, 56, 56, 96]", "cuda -keys=cuda,gpu -max_num_threads=1024 -model=unknown -thread_warp_size=32", [-1, 16, 64, 49152, 2147483647, 1024, 8, 32], "", 0, []], [[], [["FU", 1, [0, 1, 2, 3]], ["SP", 1, 0, 301056, [14], 1], ["AN", 1, 0, 5], ["AN", 1, 1, 6]]]], "r": [[1.91037e-05, 1.90949e-05, 1.91062e-05], 0, 2.90333, 1667932907], "v": "v0.6"}
{"i": [["[\"sigmoid\", 1, 56, 56, 96]", "cuda -keys=cuda,gpu -max_num_threads=1024 -model=unknown -thread_warp_size=32", [-1, 16, 64, 49152, 2147483647, 1024, 8, 32], "", 0, []], [[], [["FU", 1, [0, 1, 2, 3]], ["SP", 1, 0, 301056, [2], 1], ["AN", 1, 0, 5], ["AN", 1, 1, 6]]]], "r": [[0.000114553, 0.000114563, 0.000114534], 0, 2.03757, 1667932906], "v": "v0.6"}
{"i": [["[\"sigmoid\", 1, 56, 56, 96]", "cuda -keys=cuda,gpu -max_num_threads=1024 -model=unknown -thread_warp_size=32", [-1, 16, 64, 49152, 2147483647, 1024, 8, 32], "", 0, []], [[], [["FU", 1, [0, 1, 2, 3]], ["SP", 1, 0, 301056, [4], 1], ["AN", 1, 0, 5], ["AN", 1, 1, 6]]]], "r": [[5.86892e-05, 5.87053e-05, 5.87148e-05], 0, 3.4361, 1667932907], "v": "v0.6"}
{"i": [["[\"sigmoid\", 1, 56, 56, 96]", "cuda -keys=cuda,gpu -max_num_threads=1024 -model=unknown -thread_warp_size=32", [-1, 16, 64, 49152, 2147483647, 1024, 8, 32], "", 0, []], [[], [["FU", 1, [0, 1, 2, 3]], ["SP", 1, 0, 301056, [32], 1], ["AN", 1, 0, 5], ["AN", 1, 1, 6]]]], "r": [[9.7817e-06, 9.7955e-06, 9.79708e-06], 0, 2.56602, 1667932906], "v": "v0.6"}
{"i": [["[\"sigmoid\", 1, 56, 56, 96]", "cuda -keys=cuda,gpu -max_num_threads=1024 -model=unknown -thread_warp_size=32", [-1, 16, 64, 49152, 2147483647, 1024, 8, 32], "", 0, []], [[], [["FU", 1, [0, 1, 2, 3]], ["SP", 1, 0, 301056, [12], 1], ["AN", 1, 0, 5], ["AN", 1, 1, 6]]]], "r": [[2.153e-05, 2.1542e-05, 2.15406e-05], 0, 3.12997, 1667932907], "v": "v0.6"}
{"i": [["[\"sigmoid\", 1, 56, 56, 96]", "cuda -keys=cuda,gpu -max_num_threads=1024 -model=unknown -thread_warp_size=32", [-1, 16, 64, 49152, 2147483647, 1024, 8, 32], "", 0, []], [[], [["FU", 1, [0, 1, 2, 3]], ["SP", 1, 0, 301056, [7], 1], ["AN", 1, 0, 5], ["AN", 1, 1, 6]]]], "r": [[3.47275e-05, 3.47404e-05, 3.47395e-05], 0, 3.70708, 1667932908], "v": "v0.6"}
{"i": [["[\"sigmoid\", 1, 56, 56, 96]", "cuda -keys=cuda,gpu -max_num_threads=1024 -model=unknown -thread_warp_size=32", [-1, 16, 64, 49152, 2147483647, 1024, 8, 32], "", 0, []], [[], [["FU", 1, [0, 1, 2, 3]], ["SP", 1, 0, 301056, [56], 1], ["AN", 1, 0, 5], ["AN", 1, 1, 6]]]], "r": [[6.67406e-06, 6.68127e-06, 6.68078e-06], 0, 3.96031, 1667932908], "v": "v0.6"}
{"i": [["[\"sigmoid\", 1, 56, 56, 96]", "cuda -keys=cuda,gpu -max_num_threads=1024 -model=unknown -thread_warp_size=32", [-1, 16, 64, 49152, 2147483647, 1024, 8, 32], "", 0, []], [[], [["FU", 1, [0, 1, 2, 3]], ["SP", 1, 0, 301056, [28], 1], ["AN", 1, 0, 5], ["AN", 1, 1, 6]]]], "r": [[1.09573e-05, 1.09702e-05, 1.09682e-05], 0, 4.23546, 1667932908], "v": "v0.6"}
{"i": [["[\"sigmoid\", 1, 56, 56, 96]", "cuda -keys=cuda,gpu -max_num_threads=1024 -model=unknown -thread_warp_size=32", [-1, 16, 64, 49152, 2147483647, 1024, 8, 32], "", 0, []], [[], [["FU", 1, [0, 1, 2, 3]], ["SP", 1, 0, 301056, [21], 1], ["AN", 1, 0, 5], ["AN", 1, 1, 6]]]], "r": [[1.35249e-05, 1.35355e-05, 1.35445e-05], 0, 4.82992, 1667932909], "v": "v0.6"}
{"i": [["[\"sigmoid\", 1, 56, 56, 96]", "cuda -keys=cuda,gpu -max_num_threads=1024 -model=unknown -thread_warp_size=32", [-1, 16, 64, 49152, 2147483647, 1024, 8, 32], "", 0, []], [[], [["FU", 1, [0, 1, 2, 3]], ["SP", 1, 0, 301056, [48], 1], ["AN", 1, 0, 5], ["AN", 1, 1, 6]]]], "r": [[7.31714e-06, 7.32692e-06, 7.32862e-06], 0, 4.54283, 1667932909], "v": "v0.6"}
{"i": [["[\"sigmoid\", 1, 56, 56, 96]", "cuda -keys=cuda,gpu -max_num_threads=1024 -model=unknown -thread_warp_size=32", [-1, 16, 64, 49152, 2147483647, 1024, 8, 32], "", 0, []], [[], [["FU", 1, [0, 1, 2, 3]], ["SP", 1, 0, 301056, [49], 1], ["AN", 1, 0, 5], ["AN", 1, 1, 6]]]], "r": [[7.33972e-06, 7.35383e-06, 7.35284e-06], 0, 5.03872, 1667932909], "v": "v0.6"}
{"i": [["[\"sigmoid\", 1, 56, 56, 96]", "cuda -keys=cuda,gpu -max_num_threads=1024 -model=unknown -thread_warp_size=32", [-1, 16, 64, 49152, 2147483647, 1024, 8, 32], "", 0, []], [[], [["FU", 1, [0, 1, 2, 3]], ["SP", 1, 0, 301056, [1], 1], ["AN", 1, 0, 5], ["AN", 1, 1, 6]]]], "r": [[0.00022606, 0.000226042, 0.000226049], 0, 5.36787, 1667932910], "v": "v0.6"}
{"i": [["[\"sigmoid\", 1, 56, 56, 96]", "cuda -keys=cuda,gpu -max_num_threads=1024 -model=unknown -thread_warp_size=32", [-1, 16, 64, 49152, 2147483647, 1024, 8, 32], "", 0, []], [[], [["FU", 1, [0, 1, 2, 3]], ["SP", 1, 0, 301056, [64], 1], ["AN", 1, 0, 5], ["AN", 1, 1, 6]]]], "r": [[6.15977e-06, 6.1698e-06, 6.17277e-06], 0, 5.65714, 1667932910], "v": "v0.6"}
{"i": [["[\"sigmoid\", 1, 56, 56, 96]", "cuda -keys=cuda,gpu -max_num_threads=1024 -model=unknown -thread_warp_size=32", [-1, 16, 64, 49152, 2147483647, 1024, 8, 32], "", 0, []], [[], [["FU", 1, [0, 1, 2, 3]], ["SP", 1, 0, 301056, [6], 1], ["AN", 1, 0, 5], ["AN", 1, 1, 6]]]], "r": [[4.00179e-05, 4.00289e-05, 4.00362e-05], 0, 5.93945, 1667932910], "v": "v0.6"}
