python/models/efficientnet/VertiFusionEfficientNet_kernel_configs/efficient_sigmoid_1_28_28_144.log
{"i": [["[\"sigmoid\", 1, 28, 28, 144]", "cuda -keys=cuda,gpu -max_num_threads=1024 -model=unknown -thread_warp_size=32", [-1, 16, 64, 49152, 2147483647, 1024, 8, 32], "", 0, []], [[], [["FU", 1, [0, 1, 2, 3]], ["SP", 1, 0, 112896, [42], 1], ["AN", 1, 0, 5], ["AN", 1, 1, 6]]]], "r": [[4.66643e-06, 4.68221e-06, 4.68135e-06], 0, 0.952153, 1667926176], "v": "v0.6"}
{"i": [["[\"sigmoid\", 1, 28, 28, 144]", "cuda -keys=cuda,gpu -max_num_threads=1024 -model=unknown -thread_warp_size=32", [-1, 16, 64, 49152, 2147483647, 1024, 8, 32], "", 0, []], [[], [["FU", 1, [0, 1, 2, 3]], ["SP", 1, 0, 112896, [6], 1], ["AN", 1, 0, 5], ["AN", 1, 1, 6]]]], "r": [[1.69205e-05, 1.69261e-05, 1.69256e-05], 0, 2.10219, 1667926177], "v": "v0.6"}
{"i": [["[\"sigmoid\", 1, 28, 28, 144]", "cuda -keys=cuda,gpu -max_num_threads=1024 -model=unknown -thread_warp_size=32", [-1, 16, 64, 49152, 2147483647, 1024, 8, 32], "", 0, []], [[], [["FU", 1, [0, 1, 2, 3]], ["SP", 1, 0, 112896, [56], 1], ["AN", 1, 0, 5], ["AN", 1, 1, 6]]]], "r": [[4.30574e-06, 4.3186e-06, 4.31756e-06], 0, 0.554121, 1667926175], "v": "v0.6"}
{"i": [["[\"sigmoid\", 1, 28, 28, 144]", "cuda -keys=cuda,gpu -max_num_threads=1024 -model=unknown -thread_warp_size=32", [-1, 16, 64, 49152, 2147483647, 1024, 8, 32], "", 0, []], [[], [["FU", 1, [0, 1, 2, 3]], ["SP", 1, 0, 112896, [8], 1], ["AN", 1, 0, 5], ["AN", 1, 1, 6]]]], "r": [[1.34704e-05, 1.34832e-05, 1.34897e-05], 0, 3.0443, 1667926178], "v": "v0.6"}
{"i": [["[\"sigmoid\", 1, 28, 28, 144]", "cuda -keys=cuda,gpu -max_num_threads=1024 -model=unknown -thread_warp_size=32", [-1, 16, 64, 49152, 2147483647, 1024, 8, 32], "", 0, []], [[], [["FU", 1, [0, 1, 2, 3]], ["SP", 1, 0, 112896, [1], 1], ["AN", 1, 0, 5], ["AN", 1, 1, 6]]]], "r": [[8.65618e-05, 8.65891e-05, 8.65721e-05], 0, 1.57288, 1667926176], "v": "v0.6"}
{"i": [["[\"sigmoid\", 1, 28, 28, 144]", "cuda -keys=cuda,gpu -max_num_threads=1024 -model=unknown -thread_warp_size=32", [-1, 16, 64, 49152, 2147483647, 1024, 8, 32], "", 0, []], [[], [["FU", 1, [0, 1, 2, 3]], ["SP", 1, 0, 112896, [9], 1], ["AN", 1, 0, 5], ["AN", 1, 1, 6]]]], "r": [[1.22781e-05, 1.22838e-05, 1.22896e-05], 0, 1.24381, 1667926176], "v": "v0.6"}
{"i": [["[\"sigmoid\", 1, 28, 28, 144]", "cuda -keys=cuda,gpu -max_num_threads=1024 -model=unknown -thread_warp_size=32", [-1, 16, 64, 49152, 2147483647, 1024, 8, 32], "", 0, []], [[], [["FU", 1, [0, 1, 2, 3]], ["SP", 1, 0, 112896, [63], 1], ["AN", 1, 0, 5], ["AN", 1, 1, 6]]]], "r": [[3.99825e-06, 4.0096e-06, 4.00943e-06], 0, 1.83513, 1667926177], "v": "v0.6"}
{"i": [["[\"sigmoid\", 1, 28, 28, 144]", "cuda -keys=cuda,gpu -max_num_threads=1024 -model=unknown -thread_warp_size=32", [-1, 16, 64, 49152, 2147483647, 1024, 8, 32], "", 0, []], [[], [["FU", 1, [0, 1, 2, 3]], ["SP", 1, 0, 112896, [4], 1], ["AN", 1, 0, 5], ["AN", 1, 1, 6]]]], "r": [[2.39447e-05, 2.39419e-05, 2.3948e-05], 0, 2.67152, 1667926178], "v": "v0.6"}
{"i": [["[\"sigmoid\", 1, 28, 28, 144]", "cuda -keys=cuda,gpu -max_num_threads=1024 -model=unknown -thread_warp_size=32", [-1, 16, 64, 49152, 2147483647, 1024, 8, 32], "", 0, []], [[], [["FU", 1, [0, 1, 2, 3]], ["SP", 1, 0, 112896, [14], 1], ["AN", 1, 0, 5], ["AN", 1, 1, 6]]]], "r": [[9.01646e-06, 9.03094e-06, 9.03253e-06], 0, 2.37663, 1667926177], "v": "v0.6"}
{"i": [["[\"sigmoid\", 1, 28, 28, 144]", "cuda -keys=cuda,gpu -max_num_threads=1024 -model=unknown -thread_warp_size=32", [-1, 16, 64, 49152, 2147483647, 1024, 8, 32], "", 0, []], [[], [["FU", 1, [0, 1, 2, 3]], ["SP", 1, 0, 112896, [12], 1], ["AN", 1, 0, 5], ["AN", 1, 1, 6]]]], "r": [[1.00015e-05, 1.00188e-05, 1.00227e-05], 0, 3.26658, 1667926178], "v": "v0.6"}
{"i": [["[\"sigmoid\", 1, 28, 28, 144]", "cuda -keys=cuda,gpu -max_num_threads=1024 -model=unknown -thread_warp_size=32", [-1, 16, 64, 49152, 2147483647, 1024, 8, 32], "", 0, []], [[], [["FU", 1, [0, 1, 2, 3]], ["SP", 1, 0, 112896, [18], 1], ["AN", 1, 0, 5], ["AN", 1, 1, 6]]]], "r": [[7.44064e-06, 7.46175e-06, 7.45857e-06], 0, 3.57906, 1667926179], "v": "v0.6"}
{"i": [["[\"sigmoid\", 1, 28, 28, 144]", "cuda -keys=cuda,gpu -max_num_threads=1024 -model=unknown -thread_warp_size=32", [-1, 16, 64, 49152, 2147483647, 1024, 8, 32], "", 0, []], [[], [["FU", 1, [0, 1, 2, 3]], ["SP", 1, 0, 112896, [21], 1], ["AN", 1, 0, 5], ["AN", 1, 1, 6]]]], "r": [[6.96407e-06, 6.97681e-06, 6.97431e-06], 0, 3.78983, 1667926179], "v": "v0.6"}
{"i": [["[\"sigmoid\", 1, 28, 28, 144]", "cuda -keys=cuda,gpu -max_num_threads=1024 -model=unknown -thread_warp_size=32", [-1, 16, 64, 49152, 2147483647, 1024, 8, 32], "", 0, []], [[], [["FU", 1, [0, 1, 2, 3]], ["SP", 1, 0, 112896, [7], 1], ["AN", 1, 0, 5], ["AN", 1, 1, 6]]]], "r": [[1.49819e-05, 1.49762e-05, 1.49934e-05], 0, 4.04246, 1667926179], "v": "v0.6"}
{"i": [["[\"sigmoid\", 1, 28, 28, 144]", "cuda -keys=cuda,gpu -max_num_threads=1024 -model=unknown -thread_warp_size=32", [-1, 16, 64, 49152, 2147483647, 1024, 8, 32], "", 0, []], [[], [["FU", 1, [0, 1, 2, 3]], ["SP", 1, 0, 112896, [49], 1], ["AN", 1, 0, 5], ["AN", 1, 1, 6]]]], "r": [[4.30676e-06, 4.31691e-06, 4.31194e-06], 0, 4.31932, 1667926180], "v": "v0.6"}
{"i": [["[\"sigmoid\", 1, 28, 28, 144]", "cuda -keys=cuda,gpu -max_num_threads=1024 -model=unknown -thread_warp_size=32", [-1, 16, 64, 49152, 2147483647, 1024, 8, 32], "", 0, []], [[], [["FU", 1, [0, 1, 2, 3]], ["SP", 1, 0, 112896, [36], 1], ["AN", 1, 0, 5], ["AN", 1, 1, 6]]]], "r": [[5.16461e-06, 5.17435e-06, 5.17503e-06], 0, 4.57422, 1667926180], "v": "v0.6"}
{"i": [["[\"sigmoid\", 1, 28, 28, 144]", "cuda -keys=cuda,gpu -max_num_threads=1024 -model=unknown -thread_warp_size=32", [-1, 16, 64, 49152, 2147483647, 1024, 8, 32], "", 0, []], [[], [["FU", 1, [0, 1, 2, 3]], ["SP", 1, 0, 112896, [16], 1], ["AN", 1, 0, 5], ["AN", 1, 1, 6]]]], "r": [[7.98218e-06, 8.00231e-06, 8.00344e-06], 0, 4.82346, 1667926180], "v": "v0.6"}
{"i": [["[\"sigmoid\", 1, 28, 28, 144]", "cuda -keys=cuda,gpu -max_num_threads=1024 -model=unknown -thread_warp_size=32", [-1, 16, 64, 49152, 2147483647, 1024, 8, 32], "", 0, []], [[], [["FU", 1, [0, 1, 2, 3]], ["SP", 1, 0, 112896, [28], 1], ["AN", 1, 0, 5], ["AN", 1, 1, 6]]]], "r": [[5.76543e-06, 5.77435e-06, 5.77406e-06], 0, 5.1244, 1667926181], "v": "v0.6"}
{"i": [["[\"sigmoid\", 1, 28, 28, 144]", "cuda -keys=cuda,gpu -max_num_threads=1024 -model=unknown -thread_warp_size=32", [-1, 16, 64, 49152, 2147483647, 1024, 8, 32], "", 0, []], [[], [["FU", 1, [0, 1, 2, 3]], ["SP", 1, 0, 112896, [24], 1], ["AN", 1, 0, 5], ["AN", 1, 1, 6]]]], "r": [[6.17667e-06, 6.18443e-06, 6.17898e-06], 0, 5.38138, 1667926181], "v": "v0.6"}
{"i": [["[\"sigmoid\", 1, 28, 28, 144]", "cuda -keys=cuda,gpu -max_num_threads=1024 -model=unknown -thread_warp_size=32", [-1, 16, 64, 49152, 2147483647, 1024, 8, 32], "", 0, []], [[], [["FU", 1, [0, 1, 2, 3]], ["SP", 1, 0, 112896, [32], 1], ["AN", 1, 0, 5], ["AN", 1, 1, 6]]]], "r": [[5.42135e-06, 5.43408e-06, 5.43438e-06], 0, 5.62308, 1667926181], "v": "v0.6"}
{"i": [["[\"sigmoid\", 1, 28, 28, 144]", "cuda -keys=cuda,gpu -max_num_threads=1024 -model=unknown -thread_warp_size=32", [-1, 16, 64, 49152, 2147483647, 1024, 8, 32], "", 0, []], [[], [["FU", 1, [0, 1, 2, 3]], ["SP", 1, 0, 112896, [2], 1], ["AN", 1, 0, 5], ["AN", 1, 1, 6]]]], "r": [[4.47801e-05, 4.47567e-05, 4.4787e-05], 0, 5.92517, 1667926182], "v": "v0.6"}
{"i": [["[\"sigmoid\", 1, 28, 28, 144]", "cuda -keys=cuda,gpu -max_num_threads=1024 -model=unknown -thread_warp_size=32", [-1, 16, 64, 49152, 2147483647, 1024, 8, 32], "", 0, []], [[], [["FU", 1, [0, 1, 2, 3]], ["SP", 1, 0, 112896, [12], 1], ["AN", 1, 0, 5], ["AN", 1, 1, 6]]]], "r": [[9.86604e-06, 9.88091e-06, 9.88219e-06], 0, 3.00543, 1667936401], "v": "v0.6"}
{"i": [["[\"sigmoid\", 1, 28, 28, 144]", "cuda -keys=cuda,gpu -max_num_threads=1024 -model=unknown -thread_warp_size=32", [-1, 16, 64, 49152, 2147483647, 1024, 8, 32], "", 0, []], [[], [["FU", 1, [0, 1, 2, 3]], ["SP", 1, 0, 112896, [36], 1], ["AN", 1, 0, 5], ["AN", 1, 1, 6]]]], "r": [[5.16049e-06, 5.1674e-06, 5.17112e-06], 0, 1.8461, 1667936399], "v": "v0.6"}
{"i": [["[\"sigmoid\", 1, 28, 28, 144]", "cuda -keys=cuda,gpu -max_num_threads=1024 -model=unknown -thread_warp_size=32", [-1, 16, 64, 49152, 2147483647, 1024, 8, 32], "", 0, []], [[], [["FU", 1, [0, 1, 2, 3]], ["SP", 1, 0, 112896, [4], 1], ["AN", 1, 0, 5], ["AN", 1, 1, 6]]]], "r": [[2.38161e-05, 2.38282e-05, 2.38261e-05], 0, 0.898898, 1667936398], "v": "v0.6"}
{"i": [["[\"sigmoid\", 1, 28, 28, 144]", "cuda -keys=cuda,gpu -max_num_threads=1024 -model=unknown -thread_warp_size=32", [-1, 16, 64, 49152, 2147483647, 1024, 8, 32], "", 0, []], [[], [["FU", 1, [0, 1, 2, 3]], ["SP", 1, 0, 112896, [6], 1], ["AN", 1, 0, 5], ["AN", 1, 1, 6]]]], "r": [[1.69291e-05, 1.69369e-05, 2.48866e-05], 0, 0.630695, 1667936398], "v": "v0.6"}
{"i": [["[\"sigmoid\", 1, 28, 28, 144]", "cuda -keys=cuda,gpu -max_num_threads=1024 -model=unknown -thread_warp_size=32", [-1, 16, 64, 49152, 2147483647, 1024, 8, 32], "", 0, []], [[], [["FU", 1, [0, 1, 2, 3]], ["SP", 1, 0, 112896, [24], 1], ["AN", 1, 0, 5], ["AN", 1, 1, 6]]]], "r": [[6.15953e-06, 6.16871e-06, 6.17147e-06], 0, 1.20353, 1667936399], "v": "v0.6"}
{"i": [["[\"sigmoid\", 1, 28, 28, 144]", "cuda -keys=cuda,gpu -max_num_threads=1024 -model=unknown -thread_warp_size=32", [-1, 16, 64, 49152, 2147483647, 1024, 8, 32], "", 0, []], [[], [["FU", 1, [0, 1, 2, 3]], ["SP", 1, 0, 112896, [16], 1], ["AN", 1, 0, 5], ["AN", 1, 1, 6]]]], "r": [[7.97831e-06, 7.98855e-06, 7.9821e-06], 0, 1.52557, 1667936399], "v": "v0.6"}
{"i": [["[\"sigmoid\", 1, 28, 28, 144]", "cuda -keys=cuda,gpu -max_num_threads=1024 -model=unknown -thread_warp_size=32", [-1, 16, 64, 49152, 2147483647, 1024, 8, 32], "", 0, []], [[], [["FU", 1, [0, 1, 2, 3]], ["SP", 1, 0, 112896, [42], 1], ["AN", 1, 0, 5], ["AN", 1, 1, 6]]]], "r": [[4.64758e-06, 4.65793e-06, 4.65909e-06], 0, 2.72673, 1667936400], "v": "v0.6"}
{"i": [["[\"sigmoid\", 1, 28, 28, 144]", "cuda -keys=cuda,gpu -max_num_threads=1024 -model=unknown -thread_warp_size=32", [-1, 16, 64, 49152, 2147483647, 1024, 8, 32], "", 0, []], [[], [["FU", 1, [0, 1, 2, 3]], ["SP", 1, 0, 112896, [14], 1], ["AN", 1, 0, 5], ["AN", 1, 1, 6]]]], "r": [[8.90789e-06, 8.9252e-06, 8.92414e-06], 0, 2.14729, 1667936400], "v": "v0.6"}
{"i": [["[\"sigmoid\", 1, 28, 28, 144]", "cuda -keys=cuda,gpu -max_num_threads=1024 -model=unknown -thread_warp_size=32", [-1, 16, 64, 49152, 2147483647, 1024, 8, 32], "", 0, []], [[], [["FU", 1, [0, 1, 2, 3]], ["SP", 1, 0, 112896, [21], 1], ["AN", 1, 0, 5], ["AN", 1, 1, 6]]]], "r": [[6.76044e-06, 6.78018e-06, 6.78228e-06], 0, 2.39817, 1667936400], "v": "v0.6"}
{"i": [["[\"sigmoid\", 1, 28, 28, 144]", "cuda -keys=cuda,gpu -max_num_threads=1024 -model=unknown -thread_warp_size=32", [-1, 16, 64, 49152, 2147483647, 1024, 8, 32], "", 0, []], [[], [["FU", 1, [0, 1, 2, 3]], ["SP", 1, 0, 112896, [2], 1], ["AN", 1, 0, 5], ["AN", 1, 1, 6]]]], "r": [[4.47228e-05, 4.47303e-05, 4.47181e-05], 0, 3.52017, 1667936401], "v": "v0.6"}
{"i": [["[\"sigmoid\", 1, 28, 28, 144]", "cuda -keys=cuda,gpu -max_num_threads=1024 -model=unknown -thread_warp_size=32", [-1, 16, 64, 49152, 2147483647, 1024, 8, 32], "", 0, []], [[], [["FU", 1, [0, 1, 2, 3]], ["SP", 1, 0, 112896, [56], 1], ["AN", 1, 0, 5], ["AN", 1, 1, 6]]]], "r": [[4.14429e-06, 4.15748e-06, 4.15591e-06], 0, 3.19159, 1667936401], "v": "v0.6"}
{"i": [["[\"sigmoid\", 1, 28, 28, 144]", "cuda -keys=cuda,gpu -max_num_threads=1024 -model=unknown -thread_warp_size=32", [-1, 16, 64, 49152, 2147483647, 1024, 8, 32], "", 0, []], [[], [["FU", 1, [0, 1, 2, 3]], ["SP", 1, 0, 112896, [63], 1], ["AN", 1, 0, 5], ["AN", 1, 1, 6]]]], "r": [[4.00692e-06, 4.02889e-06, 4.03063e-06], 0, 3.78765, 1667936402], "v": "v0.6"}
{"i": [["[\"sigmoid\", 1, 28, 28, 144]", "cuda -keys=cuda,gpu -max_num_threads=1024 -model=unknown -thread_warp_size=32", [-1, 16, 64, 49152, 2147483647, 1024, 8, 32], "", 0, []], [[], [["FU", 1, [0, 1, 2, 3]], ["SP", 1, 0, 112896, [18], 1], ["AN", 1, 0, 5], ["AN", 1, 1, 6]]]], "r": [[7.52594e-06, 7.53694e-06, 7.53871e-06], 0, 4.38098, 1667936402], "v": "v0.6"}
{"i": [["[\"sigmoid\", 1, 28, 28, 144]", "cuda -keys=cuda,gpu -max_num_threads=1024 -model=unknown -thread_warp_size=32", [-1, 16, 64, 49152, 2147483647, 1024, 8, 32], "", 0, []], [[], [["FU", 1, [0, 1, 2, 3]], ["SP", 1, 0, 112896, [9], 1], ["AN", 1, 0, 5], ["AN", 1, 1, 6]]]], "r": [[1.22261e-05, 1.22334e-05, 1.22374e-05], 0, 4.59633, 1667936403], "v": "v0.6"}
{"i": [["[\"sigmoid\", 1, 28, 28, 144]", "cuda -keys=cuda,gpu -max_num_threads=1024 -model=unknown -thread_warp_size=32", [-1, 16, 64, 49152, 2147483647, 1024, 8, 32], "", 0, []], [[], [["FU", 1, [0, 1, 2, 3]], ["SP", 1, 0, 112896, [7], 1], ["AN", 1, 0, 5], ["AN", 1, 1, 6]]]], "r": [[1.49319e-05, 1.49429e-05, 1.49428e-05], 0, 4.85987, 1667936403], "v": "v0.6"}
{"i": [["[\"sigmoid\", 1, 28, 28, 144]", "cuda -keys=cuda,gpu -max_num_threads=1024 -model=unknown -thread_warp_size=32", [-1, 16, 64, 49152, 2147483647, 1024, 8, 32], "", 0, []], [[], [["FU", 1, [0, 1, 2, 3]], ["SP", 1, 0, 112896, [8], 1], ["AN", 1, 0, 5], ["AN", 1, 1, 6]]]], "r": [[1.3446e-05, 1.34697e-05, 1.34567e-05], 0, 5.14252, 1667936403], "v": "v0.6"}
{"i": [["[\"sigmoid\", 1, 28, 28, 144]", "cuda -keys=cuda,gpu -max_num_threads=1024 -model=unknown -thread_warp_size=32", [-1, 16, 64, 49152, 2147483647, 1024, 8, 32], "", 0, []], [[], [["FU", 1, [0, 1, 2, 3]], ["SP", 1, 0, 112896, [28], 1], ["AN", 1, 0, 5], ["AN", 1, 1, 6]]]], "r": [[5.79182e-06, 5.79928e-06, 5.80338e-06], 0, 5.96347, 1667936404], "v": "v0.6"}
{"i": [["[\"sigmoid\", 1, 28, 28, 144]", "cuda -keys=cuda,gpu -max_num_threads=1024 -model=unknown -thread_warp_size=32", [-1, 16, 64, 49152, 2147483647, 1024, 8, 32], "", 0, []], [[], [["FU", 1, [0, 1, 2, 3]], ["SP", 1, 0, 112896, [1], 1], ["AN", 1, 0, 5], ["AN", 1, 1, 6]]]], "r": [[8.6611e-05, 8.66327e-05, 8.66379e-05], 0, 5.42971, 1667936404], "v": "v0.6"}
{"i": [["[\"sigmoid\", 1, 28, 28, 144]", "cuda -keys=cuda,gpu -max_num_threads=1024 -model=unknown -thread_warp_size=32", [-1, 16, 64, 49152, 2147483647, 1024, 8, 32], "", 0, []], [[], [["FU", 1, [0, 1, 2, 3]], ["SP", 1, 0, 112896, [64], 1], ["AN", 1, 0, 5], ["AN", 1, 1, 6]]]], "r": [[3.97562e-06, 3.98963e-06, 3.98853e-06], 0, 5.6661, 1667936404], "v": "v0.6"}
{"i": [["[\"sigmoid\", 1, 28, 28, 144]", "cuda -keys=cuda,gpu -max_num_threads=1024 -model=unknown -thread_warp_size=32", [-1, 16, 64, 49152, 2147483647, 1024, 8, 32], "", 0, []], [[], [["FU", 1, [0, 1, 2, 3]], ["SP", 1, 0, 112896, [48], 1], ["AN", 1, 0, 5], ["AN", 1, 1, 6]]]], "r": [[4.36252e-06, 4.37704e-06, 4.3792e-06], 0, 6.29357, 1667936405], "v": "v0.6"}
{"i": [["[\"sigmoid\", 1, 28, 28, 144]", "cuda -keys=cuda,gpu -max_num_threads=1024 -model=unknown -thread_warp_size=32", [-1, 16, 64, 49152, 2147483647, 1024, 8, 32], "", 0, []], [[], [["FU", 1, [0, 1, 2, 3]], ["SP", 1, 0, 112896, [32], 1], ["AN", 1, 0, 5], ["AN", 1, 1, 6]]]], "r": [[5.32425e-06, 5.33871e-06, 5.32601e-06], 0, 6.44164, 1667936405], "v": "v0.6"}
{"i": [["[\"sigmoid\", 1, 28, 28, 144]", "cuda -keys=cuda,gpu -max_num_threads=1024 -model=unknown -thread_warp_size=32", [-1, 16, 64, 49152, 2147483647, 1024, 8, 32], "", 0, []], [[], [["FU", 1, [0, 1, 2, 3]], ["SP", 1, 0, 112896, [49], 1], ["AN", 1, 0, 5], ["AN", 1, 1, 6]]]], "r": [[4.3238e-06, 4.32859e-06, 4.32825e-06], 0, 6.73933, 1667936405], "v": "v0.6"}
{"i": [["[\"sigmoid\", 1, 28, 28, 144]", "cuda -keys=cuda,gpu -max_num_threads=1024 -model=unknown -thread_warp_size=32", [-1, 16, 64, 49152, 2147483647, 1024, 8, 32], "", 0, []], [[], [["FU", 1, [0, 1, 2, 3]], ["SP", 1, 0, 112896, [3], 1], ["AN", 1, 0, 5], ["AN", 1, 1, 6]]]], "r": [[3.07536e-05, 3.07657e-05, 3.07612e-05], 0, 4.10253, 1667936402], "v": "v0.6"}
