python/models/efficientnet/VertiFusionEfficientNet_kernel_configs/efficient_batch_norm_1_56_56_96.log
{"i": [["[\"batch_norm\", 1, 56, 56, 96]", "cuda -keys=cuda,gpu -max_num_threads=1024 -model=unknown -thread_warp_size=32", [-1, 16, 64, 49152, 2147483647, 1024, 8, 32], "", 0, []], [[], [["CI", 2], ["FU", 4, [0, 1, 2, 3]], ["SP", 4, 0, 301056, [49], 1], ["AN", 4, 0, 5], ["AN", 4, 1, 6]]]], "r": [[7.21551e-06, 7.21908e-06, 7.21239e-06], 0, 0.622253, 1667925354], "v": "v0.6"}
{"i": [["[\"batch_norm\", 1, 56, 56, 96]", "cuda -keys=cuda,gpu -max_num_threads=1024 -model=unknown -thread_warp_size=32", [-1, 16, 64, 49152, 2147483647, 1024, 8, 32], "", 0, []], [[], [["CI", 2], ["FU", 4, [0, 1, 2, 3]], ["SP", 4, 0, 301056, [28], 1], ["AN", 4, 0, 5], ["AN", 4, 1, 6]]]], "r": [[1.07164e-05, 1.07197e-05, 1.07222e-05], 0, 1.90243, 1667925355], "v": "v0.6"}
{"i": [["[\"batch_norm\", 1, 56, 56, 96]", "cuda -keys=cuda,gpu -max_num_threads=1024 -model=unknown -thread_warp_size=32", [-1, 16, 64, 49152, 2147483647, 1024, 8, 32], "", 0, []], [[], [["CI", 2], ["FU", 4, [0, 1, 2, 3]], ["SP", 4, 0, 301056, [16], 1], ["AN", 4, 0, 5], ["AN", 4, 1, 6]]]], "r": [[1.67215e-05, 1.67236e-05, 1.67199e-05], 0, 0.996479, 1667925354], "v": "v0.6"}
{"i": [["[\"batch_norm\", 1, 56, 56, 96]", "cuda -keys=cuda,gpu -max_num_threads=1024 -model=unknown -thread_warp_size=32", [-1, 16, 64, 49152, 2147483647, 1024, 8, 32], "", 0, []], [[], [["CI", 2], ["FU", 4, [0, 1, 2, 3]], ["SP", 4, 0, 301056, [21], 1], ["AN", 4, 0, 5], ["AN", 4, 1, 6]]]], "r": [[1.34147e-05, 1.34314e-05, 1.34233e-05], 0, 1.28565, 1667925355], "v": "v0.6"}
{"i": [["[\"batch_norm\", 1, 56, 56, 96]", "cuda -keys=cuda,gpu -max_num_threads=1024 -model=unknown -thread_warp_size=32", [-1, 16, 64, 49152, 2147483647, 1024, 8, 32], "", 0, []], [[], [["CI", 2], ["FU", 4, [0, 1, 2, 3]], ["SP", 4, 0, 301056, [12], 1], ["AN", 4, 0, 5], ["AN", 4, 1, 6]]]], "r": [[2.14889e-05, 2.14961e-05, 2.15122e-05], 0, 1.6773, 1667925355], "v": "v0.6"}
{"i": [["[\"batch_norm\", 1, 56, 56, 96]", "cuda -keys=cuda,gpu -max_num_threads=1024 -model=unknown -thread_warp_size=32", [-1, 16, 64, 49152, 2147483647, 1024, 8, 32], "", 0, []], [[], [["CI", 2], ["FU", 4, [0, 1, 2, 3]], ["SP", 4, 0, 301056, [2], 1], ["AN", 4, 0, 5], ["AN", 4, 1, 6]]]], "r": [[0.000114353, 0.000114385, 0.000114342], 0, 2.74924, 1667925356], "v": "v0.6"}
{"i": [["[\"batch_norm\", 1, 56, 56, 96]", "cuda -keys=cuda,gpu -max_num_threads=1024 -model=unknown -thread_warp_size=32", [-1, 16, 64, 49152, 2147483647, 1024, 8, 32], "", 0, []], [[], [["CI", 2], ["FU", 4, [0, 1, 2, 3]], ["SP", 4, 0, 301056, [64], 1], ["AN", 4, 0, 5], ["AN", 4, 1, 6]]]], "r": [[6.04908e-06, 6.05081e-06, 6.04938e-06], 0, 2.18503, 1667925356], "v": "v0.6"}
{"i": [["[\"batch_norm\", 1, 56, 56, 96]", "cuda -keys=cuda,gpu -max_num_threads=1024 -model=unknown -thread_warp_size=32", [-1, 16, 64, 49152, 2147483647, 1024, 8, 32], "", 0, []], [[], [["CI", 2], ["FU", 4, [0, 1, 2, 3]], ["SP", 4, 0, 301056, [6], 1], ["AN", 4, 0, 5], ["AN", 4, 1, 6]]]], "r": [[3.9829e-05, 3.98318e-05, 3.98299e-05], 0, 2.50047, 1667925356], "v": "v0.6"}
{"i": [["[\"batch_norm\", 1, 56, 56, 96]", "cuda -keys=cuda,gpu -max_num_threads=1024 -model=unknown -thread_warp_size=32", [-1, 16, 64, 49152, 2147483647, 1024, 8, 32], "", 0, []], [[], [["CI", 2], ["FU", 4, [0, 1, 2, 3]], ["SP", 4, 0, 301056, [42], 1], ["AN", 4, 0, 5], ["AN", 4, 1, 6]]]], "r": [[8.03981e-06, 8.04022e-06, 8.038e-06], 0, 3.26161, 1667925357], "v": "v0.6"}
{"i": [["[\"batch_norm\", 1, 56, 56, 96]", "cuda -keys=cuda,gpu -max_num_threads=1024 -model=unknown -thread_warp_size=32", [-1, 16, 64, 49152, 2147483647, 1024, 8, 32], "", 0, []], [[], [["CI", 2], ["FU", 4, [0, 1, 2, 3]], ["SP", 4, 0, 301056, [7], 1], ["AN", 4, 0, 5], ["AN", 4, 1, 6]]]], "r": [[3.45628e-05, 3.4578e-05, 3.45732e-05], 0, 2.99195, 1667925357], "v": "v0.6"}
{"i": [["[\"batch_norm\", 1, 56, 56, 96]", "cuda -keys=cuda,gpu -max_num_threads=1024 -model=unknown -thread_warp_size=32", [-1, 16, 64, 49152, 2147483647, 1024, 8, 32], "", 0, []], [[], [["CI", 2], ["FU", 4, [0, 1, 2, 3]], ["SP", 4, 0, 301056, [4], 1], ["AN", 4, 0, 5], ["AN", 4, 1, 6]]]], "r": [[5.85985e-05, 5.8591e-05, 5.85846e-05], 0, 3.45863, 1667925357], "v": "v0.6"}
{"i": [["[\"batch_norm\", 1, 56, 56, 96]", "cuda -keys=cuda,gpu -max_num_threads=1024 -model=unknown -thread_warp_size=32", [-1, 16, 64, 49152, 2147483647, 1024, 8, 32], "", 0, []], [[], [["CI", 2], ["FU", 4, [0, 1, 2, 3]], ["SP", 4, 0, 301056, [56], 1], ["AN", 4, 0, 5], ["AN", 4, 1, 6]]]], "r": [[6.81763e-06, 6.80874e-06, 6.81489e-06], 0, 3.76338, 1667925358], "v": "v0.6"}
{"i": [["[\"batch_norm\", 1, 56, 56, 96]", "cuda -keys=cuda,gpu -max_num_threads=1024 -model=unknown -thread_warp_size=32", [-1, 16, 64, 49152, 2147483647, 1024, 8, 32], "", 0, []], [[], [["CI", 2], ["FU", 4, [0, 1, 2, 3]], ["SP", 4, 0, 301056, [8], 1], ["AN", 4, 0, 5], ["AN", 4, 1, 6]]]], "r": [[3.06623e-05, 3.06534e-05, 3.0639e-05], 0, 4.04743, 1667925358], "v": "v0.6"}
{"i": [["[\"batch_norm\", 1, 56, 56, 96]", "cuda -keys=cuda,gpu -max_num_threads=1024 -model=unknown -thread_warp_size=32", [-1, 16, 64, 49152, 2147483647, 1024, 8, 32], "", 0, []], [[], [["CI", 2], ["FU", 4, [0, 1, 2, 3]], ["SP", 4, 0, 301056, [3], 1], ["AN", 4, 0, 5], ["AN", 4, 1, 6]]]], "r": [[7.70878e-05, 7.70742e-05, 7.70836e-05], 0, 4.30829, 1667925358], "v": "v0.6"}
{"i": [["[\"batch_norm\", 1, 56, 56, 96]", "cuda -keys=cuda,gpu -max_num_threads=1024 -model=unknown -thread_warp_size=32", [-1, 16, 64, 49152, 2147483647, 1024, 8, 32], "", 0, []], [[], [["CI", 2], ["FU", 4, [0, 1, 2, 3]], ["SP", 4, 0, 301056, [48], 1], ["AN", 4, 0, 5], ["AN", 4, 1, 6]]]], "r": [[7.26028e-06, 7.25693e-06, 7.25653e-06], 0, 4.59654, 1667925359], "v": "v0.6"}
{"i": [["[\"batch_norm\", 1, 56, 56, 96]", "cuda -keys=cuda,gpu -max_num_threads=1024 -model=unknown -thread_warp_size=32", [-1, 16, 64, 49152, 2147483647, 1024, 8, 32], "", 0, []], [[], [["CI", 2], ["FU", 4, [0, 1, 2, 3]], ["SP", 4, 0, 301056, [32], 1], ["AN", 4, 0, 5], ["AN", 4, 1, 6]]]], "r": [[9.67816e-06, 9.67894e-06, 9.67297e-06], 0, 4.89949, 1667925359], "v": "v0.6"}
{"i": [["[\"batch_norm\", 1, 56, 56, 96]", "cuda -keys=cuda,gpu -max_num_threads=1024 -model=unknown -thread_warp_size=32", [-1, 16, 64, 49152, 2147483647, 1024, 8, 32], "", 0, []], [[], [["CI", 2], ["FU", 4, [0, 1, 2, 3]], ["SP", 4, 0, 301056, [24], 1], ["AN", 4, 0, 5], ["AN", 4, 1, 6]]]], "r": [[1.20665e-05, 1.20637e-05, 1.20611e-05], 0, 5.1787, 1667925359], "v": "v0.6"}
{"i": [["[\"batch_norm\", 1, 56, 56, 96]", "cuda -keys=cuda,gpu -max_num_threads=1024 -model=unknown -thread_warp_size=32", [-1, 16, 64, 49152, 2147483647, 1024, 8, 32], "", 0, []], [[], [["CI", 2], ["FU", 4, [0, 1, 2, 3]], ["SP", 4, 0, 301056, [1], 1], ["AN", 4, 0, 5], ["AN", 4, 1, 6]]]], "r": [[0.000225932, 0.000225899, 0.000225899], 0, 5.42867, 1667925360], "v": "v0.6"}
{"i": [["[\"batch_norm\", 1, 56, 56, 96]", "cuda -keys=cuda,gpu -max_num_threads=1024 -model=unknown -thread_warp_size=32", [-1, 16, 64, 49152, 2147483647, 1024, 8, 32], "", 0, []], [[], [["CI", 2], ["FU", 4, [0, 1, 2, 3]], ["SP", 4, 0, 301056, [14], 1], ["AN", 4, 0, 5], ["AN", 4, 1, 6]]]], "r": [[1.86717e-05, 1.86776e-05, 1.86681e-05], 0, 5.74759, 1667925360], "v": "v0.6"}
{"i": [["[\"batch_norm\", 1, 56, 56, 96]", "cuda -keys=cuda,gpu -max_num_threads=1024 -model=unknown -thread_warp_size=32", [-1, 16, 64, 49152, 2147483647, 1024, 8, 32], "", 0, []], [[], [["CI", 2], ["FU", 4, [0, 1, 2, 3]], ["SP", 4, 0, 301056, [49], 1], ["AN", 4, 0, 5], ["AN", 4, 1, 6]]]], "r": [[7.20652e-06, 7.20602e-06, 7.20347e-06], 0, 0.881077, 1667925524], "v": "v0.6"}
{"i": [["[\"batch_norm\", 1, 56, 56, 96]", "cuda -keys=cuda,gpu -max_num_threads=1024 -model=unknown -thread_warp_size=32", [-1, 16, 64, 49152, 2147483647, 1024, 8, 32], "", 0, []], [[], [["CI", 2], ["FU", 4, [0, 1, 2, 3]], ["SP", 4, 0, 301056, [56], 1], ["AN", 4, 0, 5], ["AN", 4, 1, 6]]]], "r": [[6.71842e-06, 6.72251e-06, 6.7158e-06], 0, 0.633822, 1667925524], "v": "v0.6"}
{"i": [["[\"batch_norm\", 1, 56, 56, 96]", "cuda -keys=cuda,gpu -max_num_threads=1024 -model=unknown -thread_warp_size=32", [-1, 16, 64, 49152, 2147483647, 1024, 8, 32], "", 0, []], [[], [["CI", 2], ["FU", 4, [0, 1, 2, 3]], ["SP", 4, 0, 301056, [7], 1], ["AN", 4, 0, 5], ["AN", 4, 1, 6]]]], "r": [[3.46602e-05, 3.46551e-05, 3.46532e-05], 0, 2.19056, 1667925525], "v": "v0.6"}
{"i": [["[\"batch_norm\", 1, 56, 56, 96]", "cuda -keys=cuda,gpu -max_num_threads=1024 -model=unknown -thread_warp_size=32", [-1, 16, 64, 49152, 2147483647, 1024, 8, 32], "", 0, []], [[], [["CI", 2], ["FU", 4, [0, 1, 2, 3]], ["SP", 4, 0, 301056, [2], 1], ["AN", 4, 0, 5], ["AN", 4, 1, 6]]]], "r": [[0.000114352, 0.00011436, 0.000114319], 0, 1.20473, 1667925524], "v": "v0.6"}
{"i": [["[\"batch_norm\", 1, 56, 56, 96]", "cuda -keys=cuda,gpu -max_num_threads=1024 -model=unknown -thread_warp_size=32", [-1, 16, 64, 49152, 2147483647, 1024, 8, 32], "", 0, []], [[], [["CI", 2], ["FU", 4, [0, 1, 2, 3]], ["SP", 4, 0, 301056, [28], 1], ["AN", 4, 0, 5], ["AN", 4, 1, 6]]]], "r": [[1.07928e-05, 1.07894e-05, 1.0771e-05], 0, 1.89941, 1667925525], "v": "v0.6"}
{"i": [["[\"batch_norm\", 1, 56, 56, 96]", "cuda -keys=cuda,gpu -max_num_threads=1024 -model=unknown -thread_warp_size=32", [-1, 16, 64, 49152, 2147483647, 1024, 8, 32], "", 0, []], [[], [["CI", 2], ["FU", 4, [0, 1, 2, 3]], ["SP", 4, 0, 301056, [6], 1], ["AN", 4, 0, 5], ["AN", 4, 1, 6]]]], "r": [[3.98267e-05, 3.98282e-05, 3.98326e-05], 0, 1.56963, 1667925525], "v": "v0.6"}
{"i": [["[\"batch_norm\", 1, 56, 56, 96]", "cuda -keys=cuda,gpu -max_num_threads=1024 -model=unknown -thread_warp_size=32", [-1, 16, 64, 49152, 2147483647, 1024, 8, 32], "", 0, []], [[], [["CI", 2], ["FU", 4, [0, 1, 2, 3]], ["SP", 4, 0, 301056, [4], 1], ["AN", 4, 0, 5], ["AN", 4, 1, 6]]]], "r": [[5.86323e-05, 5.86162e-05, 5.86143e-05], 0, 2.50223, 1667925526], "v": "v0.6"}
{"i": [["[\"batch_norm\", 1, 56, 56, 96]", "cuda -keys=cuda,gpu -max_num_threads=1024 -model=unknown -thread_warp_size=32", [-1, 16, 64, 49152, 2147483647, 1024, 8, 32], "", 0, []], [[], [["CI", 2], ["FU", 4, [0, 1, 2, 3]], ["SP", 4, 0, 301056, [3], 1], ["AN", 4, 0, 5], ["AN", 4, 1, 6]]]], "r": [[7.70893e-05, 7.70869e-05, 7.70845e-05], 0, 2.79028, 1667925526], "v": "v0.6"}
{"i": [["[\"batch_norm\", 1, 56, 56, 96]", "cuda -keys=cuda,gpu -max_num_threads=1024 -model=unknown -thread_warp_size=32", [-1, 16, 64, 49152, 2147483647, 1024, 8, 32], "", 0, []], [[], [["CI", 2], ["FU", 4, [0, 1, 2, 3]], ["SP", 4, 0, 301056, [32], 1], ["AN", 4, 0, 5], ["AN", 4, 1, 6]]]], "r": [[9.8333e-06, 9.83564e-06, 9.83026e-06], 0, 3.27205, 1667925527], "v": "v0.6"}
{"i": [["[\"batch_norm\", 1, 56, 56, 96]", "cuda -keys=cuda,gpu -max_num_threads=1024 -model=unknown -thread_warp_size=32", [-1, 16, 64, 49152, 2147483647, 1024, 8, 32], "", 0, []], [[], [["CI", 2], ["FU", 4, [0, 1, 2, 3]], ["SP", 4, 0, 301056, [21], 1], ["AN", 4, 0, 5], ["AN", 4, 1, 6]]]], "r": [[1.33717e-05, 1.33757e-05, 1.3376e-05], 0, 2.97333, 1667925526], "v": "v0.6"}
{"i": [["[\"batch_norm\", 1, 56, 56, 96]", "cuda -keys=cuda,gpu -max_num_threads=1024 -model=unknown -thread_warp_size=32", [-1, 16, 64, 49152, 2147483647, 1024, 8, 32], "", 0, []], [[], [["CI", 2], ["FU", 4, [0, 1, 2, 3]], ["SP", 4, 0, 301056, [48], 1], ["AN", 4, 0, 5], ["AN", 4, 1, 6]]]], "r": [[7.25264e-06, 7.25038e-06, 7.24845e-06], 0, 3.55078, 1667925527], "v": "v0.6"}
{"i": [["[\"batch_norm\", 1, 56, 56, 96]", "cuda -keys=cuda,gpu -max_num_threads=1024 -model=unknown -thread_warp_size=32", [-1, 16, 64, 49152, 2147483647, 1024, 8, 32], "", 0, []], [[], [["CI", 2], ["FU", 4, [0, 1, 2, 3]], ["SP", 4, 0, 301056, [24], 1], ["AN", 4, 0, 5], ["AN", 4, 1, 6]]]], "r": [[1.21874e-05, 1.2192e-05, 1.21828e-05], 0, 3.86361, 1667925527], "v": "v0.6"}
{"i": [["[\"batch_norm\", 1, 56, 56, 96]", "cuda -keys=cuda,gpu -max_num_threads=1024 -model=unknown -thread_warp_size=32", [-1, 16, 64, 49152, 2147483647, 1024, 8, 32], "", 0, []], [[], [["CI", 2], ["FU", 4, [0, 1, 2, 3]], ["SP", 4, 0, 301056, [42], 1], ["AN", 4, 0, 5], ["AN", 4, 1, 6]]]], "r": [[7.98578e-06, 7.98512e-06, 7.98298e-06], 0, 4.17096, 1667925528], "v": "v0.6"}
{"i": [["[\"batch_norm\", 1, 56, 56, 96]", "cuda -keys=cuda,gpu -max_num_threads=1024 -model=unknown -thread_warp_size=32", [-1, 16, 64, 49152, 2147483647, 1024, 8, 32], "", 0, []], [[], [["CI", 2], ["FU", 4, [0, 1, 2, 3]], ["SP", 4, 0, 301056, [1], 1], ["AN", 4, 0, 5], ["AN", 4, 1, 6]]]], "r": [[0.000225864, 0.000225874, 0.000225826], 0, 4.39531, 1667925528], "v": "v0.6"}
{"i": [["[\"batch_norm\", 1, 56, 56, 96]", "cuda -keys=cuda,gpu -max_num_threads=1024 -model=unknown -thread_warp_size=32", [-1, 16, 64, 49152, 2147483647, 1024, 8, 32], "", 0, []], [[], [["CI", 2], ["FU", 4, [0, 1, 2, 3]], ["SP", 4, 0, 301056, [8], 1], ["AN", 4, 0, 5], ["AN", 4, 1, 6]]]], "r": [[3.08019e-05, 3.07881e-05, 3.07912e-05], 0, 4.66225, 1667925528], "v": "v0.6"}
{"i": [["[\"batch_norm\", 1, 56, 56, 96]", "cuda -keys=cuda,gpu -max_num_threads=1024 -model=unknown -thread_warp_size=32", [-1, 16, 64, 49152, 2147483647, 1024, 8, 32], "", 0, []], [[], [["CI", 2], ["FU", 4, [0, 1, 2, 3]], ["SP", 4, 0, 301056, [16], 1], ["AN", 4, 0, 5], ["AN", 4, 1, 6]]]], "r": [[1.68463e-05, 1.68282e-05, 1.6838e-05], 0, 4.98158, 1667925529], "v": "v0.6"}
{"i": [["[\"batch_norm\", 1, 56, 56, 96]", "cuda -keys=cuda,gpu -max_num_threads=1024 -model=unknown -thread_warp_size=32", [-1, 16, 64, 49152, 2147483647, 1024, 8, 32], "", 0, []], [[], [["CI", 2], ["FU", 4, [0, 1, 2, 3]], ["SP", 4, 0, 301056, [12], 1], ["AN", 4, 0, 5], ["AN", 4, 1, 6]]]], "r": [[2.13949e-05, 2.13936e-05, 2.13936e-05], 0, 5.25459, 1667925529], "v": "v0.6"}
{"i": [["[\"batch_norm\", 1, 56, 56, 96]", "cuda -keys=cuda,gpu -max_num_threads=1024 -model=unknown -thread_warp_size=32", [-1, 16, 64, 49152, 2147483647, 1024, 8, 32], "", 0, []], [[], [["CI", 2], ["FU", 4, [0, 1, 2, 3]], ["SP", 4, 0, 301056, [14], 1], ["AN", 4, 0, 5], ["AN", 4, 1, 6]]]], "r": [[1.87098e-05, 1.87106e-05, 1.8707e-05], 0, 5.49376, 1667925529], "v": "v0.6"}
{"i": [["[\"batch_norm\", 1, 56, 56, 96]", "cuda -keys=cuda,gpu -max_num_threads=1024 -model=unknown -thread_warp_size=32", [-1, 16, 64, 49152, 2147483647, 1024, 8, 32], "", 0, []], [[], [["CI", 2], ["FU", 4, [0, 1, 2, 3]], ["SP", 4, 0, 301056, [64], 1], ["AN", 4, 0, 5], ["AN", 4, 1, 6]]]], "r": [[6.11986e-06, 6.11863e-06, 6.11926e-06], 0, 5.82961, 1667925530], "v": "v0.6"}
{"i": [["[\"batch_norm\", 1, 56, 56, 96]", "cuda -keys=cuda,gpu -max_num_threads=1024 -model=unknown -thread_warp_size=32", [-1, 16, 64, 49152, 2147483647, 1024, 8, 32], "", 0, []], [[], [["CI", 2], ["FU", 4, [0, 1, 2, 3]], ["SP", 4, 0, 301056, [7], 1], ["AN", 4, 0, 5], ["AN", 4, 1, 6]]]], "r": [[3.45008e-05, 3.44987e-05, 3.45011e-05], 0, 2.1265, 1667932885], "v": "v0.6"}
{"i": [["[\"batch_norm\", 1, 56, 56, 96]", "cuda -keys=cuda,gpu -max_num_threads=1024 -model=unknown -thread_warp_size=32", [-1, 16, 64, 49152, 2147483647, 1024, 8, 32], "", 0, []], [[], [["CI", 2], ["FU", 4, [0, 1, 2, 3]], ["SP", 4, 0, 301056, [42], 1], ["AN", 4, 0, 5], ["AN", 4, 1, 6]]]], "r": [[8.02323e-06, 8.02185e-06, 8.02163e-06], 0, 2.48632, 1667932886], "v": "v0.6"}
{"i": [["[\"batch_norm\", 1, 56, 56, 96]", "cuda -keys=cuda,gpu -max_num_threads=1024 -model=unknown -thread_warp_size=32", [-1, 16, 64, 49152, 2147483647, 1024, 8, 32], "", 0, []], [[], [["CI", 2], ["FU", 4, [0, 1, 2, 3]], ["SP", 4, 0, 301056, [12], 1], ["AN", 4, 0, 5], ["AN", 4, 1, 6]]]], "r": [[2.1355e-05, 2.13572e-05, 2.1358e-05], 0, 1.77299, 1667932885], "v": "v0.6"}
{"i": [["[\"batch_norm\", 1, 56, 56, 96]", "cuda -keys=cuda,gpu -max_num_threads=1024 -model=unknown -thread_warp_size=32", [-1, 16, 64, 49152, 2147483647, 1024, 8, 32], "", 0, []], [[], [["CI", 2], ["FU", 4, [0, 1, 2, 3]], ["SP", 4, 0, 301056, [2], 1], ["AN", 4, 0, 5], ["AN", 4, 1, 6]]]], "r": [[0.000114344, 0.00011436, 0.00011433], 0, 0.722258, 1667932884], "v": "v0.6"}
{"i": [["[\"batch_norm\", 1, 56, 56, 96]", "cuda -keys=cuda,gpu -max_num_threads=1024 -model=unknown -thread_warp_size=32", [-1, 16, 64, 49152, 2147483647, 1024, 8, 32], "", 0, []], [[], [["CI", 2], ["FU", 4, [0, 1, 2, 3]], ["SP", 4, 0, 301056, [4], 1], ["AN", 4, 0, 5], ["AN", 4, 1, 6]]]], "r": [[5.85141e-05, 5.85107e-05, 5.85044e-05], 0, 1.0168, 1667932884], "v": "v0.6"}
{"i": [["[\"batch_norm\", 1, 56, 56, 96]", "cuda -keys=cuda,gpu -max_num_threads=1024 -model=unknown -thread_warp_size=32", [-1, 16, 64, 49152, 2147483647, 1024, 8, 32], "", 0, []], [[], [["CI", 2], ["FU", 4, [0, 1, 2, 3]], ["SP", 4, 0, 301056, [1], 1], ["AN", 4, 0, 5], ["AN", 4, 1, 6]]]], "r": [[0.000225891, 0.000225873, 0.000225878], 0, 2.78095, 1667932886], "v": "v0.6"}
{"i": [["[\"batch_norm\", 1, 56, 56, 96]", "cuda -keys=cuda,gpu -max_num_threads=1024 -model=unknown -thread_warp_size=32", [-1, 16, 64, 49152, 2147483647, 1024, 8, 32], "", 0, []], [[], [["CI", 2], ["FU", 4, [0, 1, 2, 3]], ["SP", 4, 0, 301056, [32], 1], ["AN", 4, 0, 5], ["AN", 4, 1, 6]]]], "r": [[9.82366e-06, 9.82544e-06, 9.82931e-06], 0, 1.46275, 1667932885], "v": "v0.6"}
{"i": [["[\"batch_norm\", 1, 56, 56, 96]", "cuda -keys=cuda,gpu -max_num_threads=1024 -model=unknown -thread_warp_size=32", [-1, 16, 64, 49152, 2147483647, 1024, 8, 32], "", 0, []], [[], [["CI", 2], ["FU", 4, [0, 1, 2, 3]], ["SP", 4, 0, 301056, [24], 1], ["AN", 4, 0, 5], ["AN", 4, 1, 6]]]], "r": [[1.20227e-05, 1.20327e-05, 1.20227e-05], 0, 3.0102, 1667932886], "v": "v0.6"}
{"i": [["[\"batch_norm\", 1, 56, 56, 96]", "cuda -keys=cuda,gpu -max_num_threads=1024 -model=unknown -thread_warp_size=32", [-1, 16, 64, 49152, 2147483647, 1024, 8, 32], "", 0, []], [[], [["CI", 2], ["FU", 4, [0, 1, 2, 3]], ["SP", 4, 0, 301056, [28], 1], ["AN", 4, 0, 5], ["AN", 4, 1, 6]]]], "r": [[1.07475e-05, 1.07499e-05, 1.07409e-05], 0, 1.08753, 1667932884], "v": "v0.6"}
{"i": [["[\"batch_norm\", 1, 56, 56, 96]", "cuda -keys=cuda,gpu -max_num_threads=1024 -model=unknown -thread_warp_size=32", [-1, 16, 64, 49152, 2147483647, 1024, 8, 32], "", 0, []], [[], [["CI", 2], ["FU", 4, [0, 1, 2, 3]], ["SP", 4, 0, 301056, [21], 1], ["AN", 4, 0, 5], ["AN", 4, 1, 6]]]], "r": [[1.33717e-05, 1.33716e-05, 1.33674e-05], 0, 3.35221, 1667932887], "v": "v0.6"}
{"i": [["[\"batch_norm\", 1, 56, 56, 96]", "cuda -keys=cuda,gpu -max_num_threads=1024 -model=unknown -thread_warp_size=32", [-1, 16, 64, 49152, 2147483647, 1024, 8, 32], "", 0, []], [[], [["CI", 2], ["FU", 4, [0, 1, 2, 3]], ["SP", 4, 0, 301056, [16], 1], ["AN", 4, 0, 5], ["AN", 4, 1, 6]]]], "r": [[1.68226e-05, 1.68133e-05, 1.68218e-05], 0, 3.87157, 1667932887], "v": "v0.6"}
{"i": [["[\"batch_norm\", 1, 56, 56, 96]", "cuda -keys=cuda,gpu -max_num_threads=1024 -model=unknown -thread_warp_size=32", [-1, 16, 64, 49152, 2147483647, 1024, 8, 32], "", 0, []], [[], [["CI", 2], ["FU", 4, [0, 1, 2, 3]], ["SP", 4, 0, 301056, [14], 1], ["AN", 4, 0, 5], ["AN", 4, 1, 6]]]], "r": [[1.87096e-05, 1.87166e-05, 1.87167e-05], 0, 3.59642, 1667932887], "v": "v0.6"}
{"i": [["[\"batch_norm\", 1, 56, 56, 96]", "cuda -keys=cuda,gpu -max_num_threads=1024 -model=unknown -thread_warp_size=32", [-1, 16, 64, 49152, 2147483647, 1024, 8, 32], "", 0, []], [[], [["CI", 2], ["FU", 4, [0, 1, 2, 3]], ["SP", 4, 0, 301056, [3], 1], ["AN", 4, 0, 5], ["AN", 4, 1, 6]]]], "r": [[7.70675e-05, 7.70666e-05, 7.7072e-05], 0, 4.22899, 1667932888], "v": "v0.6"}
{"i": [["[\"batch_norm\", 1, 56, 56, 96]", "cuda -keys=cuda,gpu -max_num_threads=1024 -model=unknown -thread_warp_size=32", [-1, 16, 64, 49152, 2147483647, 1024, 8, 32], "", 0, []], [[], [["CI", 2], ["FU", 4, [0, 1, 2, 3]], ["SP", 4, 0, 301056, [6], 1], ["AN", 4, 0, 5], ["AN", 4, 1, 6]]]], "r": [[3.98004e-05, 3.97922e-05, 3.97885e-05], 0, 4.5588, 1667932888], "v": "v0.6"}
{"i": [["[\"batch_norm\", 1, 56, 56, 96]", "cuda -keys=cuda,gpu -max_num_threads=1024 -model=unknown -thread_warp_size=32", [-1, 16, 64, 49152, 2147483647, 1024, 8, 32], "", 0, []], [[], [["CI", 2], ["FU", 4, [0, 1, 2, 3]], ["SP", 4, 0, 301056, [48], 1], ["AN", 4, 0, 5], ["AN", 4, 1, 6]]]], "r": [[7.53699e-06, 7.53688e-06, 7.5341e-06], 0, 4.76761, 1667932888], "v": "v0.6"}
{"i": [["[\"batch_norm\", 1, 56, 56, 96]", "cuda -keys=cuda,gpu -max_num_threads=1024 -model=unknown -thread_warp_size=32", [-1, 16, 64, 49152, 2147483647, 1024, 8, 32], "", 0, []], [[], [["CI", 2], ["FU", 4, [0, 1, 2, 3]], ["SP", 4, 0, 301056, [49], 1], ["AN", 4, 0, 5], ["AN", 4, 1, 6]]]], "r": [[7.34413e-06, 7.34181e-06, 7.34189e-06], 0, 5.08166, 1667932889], "v": "v0.6"}
{"i": [["[\"batch_norm\", 1, 56, 56, 96]", "cuda -keys=cuda,gpu -max_num_threads=1024 -model=unknown -thread_warp_size=32", [-1, 16, 64, 49152, 2147483647, 1024, 8, 32], "", 0, []], [[], [["CI", 2], ["FU", 4, [0, 1, 2, 3]], ["SP", 4, 0, 301056, [56], 1], ["AN", 4, 0, 5], ["AN", 4, 1, 6]]]], "r": [[6.67425e-06, 6.67854e-06, 6.67676e-06], 0, 5.39783, 1667932889], "v": "v0.6"}
{"i": [["[\"batch_norm\", 1, 56, 56, 96]", "cuda -keys=cuda,gpu -max_num_threads=1024 -model=unknown -thread_warp_size=32", [-1, 16, 64, 49152, 2147483647, 1024, 8, 32], "", 0, []], [[], [["CI", 2], ["FU", 4, [0, 1, 2, 3]], ["SP", 4, 0, 301056, [8], 1], ["AN", 4, 0, 5], ["AN", 4, 1, 6]]]], "r": [[3.07095e-05, 3.07151e-05, 3.07116e-05], 0, 5.64203, 1667932889], "v": "v0.6"}
{"i": [["[\"batch_norm\", 1, 56, 56, 96]", "cuda -keys=cuda,gpu -max_num_threads=1024 -model=unknown -thread_warp_size=32", [-1, 16, 64, 49152, 2147483647, 1024, 8, 32], "", 0, []], [[], [["CI", 2], ["FU", 4, [0, 1, 2, 3]], ["SP", 4, 0, 301056, [64], 1], ["AN", 4, 0, 5], ["AN", 4, 1, 6]]]], "r": [[6.24397e-06, 6.24966e-06, 6.25138e-06], 0, 5.95648, 1667932890], "v": "v0.6"}
{"i": [["[\"batch_norm\", 1, 56, 56, 96]", "cuda -keys=cuda,gpu -max_num_threads=1024 -model=unknown -thread_warp_size=32", [-1, 16, 64, 49152, 2147483647, 1024, 8, 32], "", 0, []], [[], [["CI", 2], ["FU", 4, [0, 1, 2, 3]], ["SP", 4, 0, 301056, [32], 1], ["AN", 4, 0, 5], ["AN", 4, 1, 6]]]], "r": [[9.78423e-06, 9.77501e-06, 9.78239e-06], 0, 0.680374, 1667934021], "v": "v0.6"}
{"i": [["[\"batch_norm\", 1, 56, 56, 96]", "cuda -keys=cuda,gpu -max_num_threads=1024 -model=unknown -thread_warp_size=32", [-1, 16, 64, 49152, 2147483647, 1024, 8, 32], "", 0, []], [[], [["CI", 2], ["FU", 4, [0, 1, 2, 3]], ["SP", 4, 0, 301056, [3], 1], ["AN", 4, 0, 5], ["AN", 4, 1, 6]]]], "r": [[7.70778e-05, 7.70756e-05, 7.70972e-05], 0, 2.52461, 1667934023], "v": "v0.6"}
{"i": [["[\"batch_norm\", 1, 56, 56, 96]", "cuda -keys=cuda,gpu -max_num_threads=1024 -model=unknown -thread_warp_size=32", [-1, 16, 64, 49152, 2147483647, 1024, 8, 32], "", 0, []], [[], [["CI", 2], ["FU", 4, [0, 1, 2, 3]], ["SP", 4, 0, 301056, [12], 1], ["AN", 4, 0, 5], ["AN", 4, 1, 6]]]], "r": [[2.13554e-05, 2.1346e-05, 2.13744e-05], 0, 1.04019, 1667934021], "v": "v0.6"}
{"i": [["[\"batch_norm\", 1, 56, 56, 96]", "cuda -keys=cuda,gpu -max_num_threads=1024 -model=unknown -thread_warp_size=32", [-1, 16, 64, 49152, 2147483647, 1024, 8, 32], "", 0, []], [[], [["CI", 2], ["FU", 4, [0, 1, 2, 3]], ["SP", 4, 0, 301056, [4], 1], ["AN", 4, 0, 5], ["AN", 4, 1, 6]]]], "r": [[5.85971e-05, 5.85835e-05, 5.859e-05], 0, 1.38078, 1667934021], "v": "v0.6"}
{"i": [["[\"batch_norm\", 1, 56, 56, 96]", "cuda -keys=cuda,gpu -max_num_threads=1024 -model=unknown -thread_warp_size=32", [-1, 16, 64, 49152, 2147483647, 1024, 8, 32], "", 0, []], [[], [["CI", 2], ["FU", 4, [0, 1, 2, 3]], ["SP", 4, 0, 301056, [42], 1], ["AN", 4, 0, 5], ["AN", 4, 1, 6]]]], "r": [[7.94024e-06, 7.9371e-06, 7.9395e-06], 0, 2.22576, 1667934022], "v": "v0.6"}
{"i": [["[\"batch_norm\", 1, 56, 56, 96]", "cuda -keys=cuda,gpu -max_num_threads=1024 -model=unknown -thread_warp_size=32", [-1, 16, 64, 49152, 2147483647, 1024, 8, 32], "", 0, []], [[], [["CI", 2], ["FU", 4, [0, 1, 2, 3]], ["SP", 4, 0, 301056, [21], 1], ["AN", 4, 0, 5], ["AN", 4, 1, 6]]]], "r": [[1.34618e-05, 1.34565e-05, 1.34639e-05], 0, 1.91353, 1667934022], "v": "v0.6"}
{"i": [["[\"batch_norm\", 1, 56, 56, 96]", "cuda -keys=cuda,gpu -max_num_threads=1024 -model=unknown -thread_warp_size=32", [-1, 16, 64, 49152, 2147483647, 1024, 8, 32], "", 0, []], [[], [["CI", 2], ["FU", 4, [0, 1, 2, 3]], ["SP", 4, 0, 301056, [49], 1], ["AN", 4, 0, 5], ["AN", 4, 1, 6]]]], "r": [[7.21704e-06, 7.21679e-06, 7.21351e-06], 0, 1.68534, 1667934022], "v": "v0.6"}
{"i": [["[\"batch_norm\", 1, 56, 56, 96]", "cuda -keys=cuda,gpu -max_num_threads=1024 -model=unknown -thread_warp_size=32", [-1, 16, 64, 49152, 2147483647, 1024, 8, 32], "", 0, []], [[], [["CI", 2], ["FU", 4, [0, 1, 2, 3]], ["SP", 4, 0, 301056, [6], 1], ["AN", 4, 0, 5], ["AN", 4, 1, 6]]]], "r": [[3.98374e-05, 3.98256e-05, 3.98232e-05], 0, 2.76207, 1667934023], "v": "v0.6"}
{"i": [["[\"batch_norm\", 1, 56, 56, 96]", "cuda -keys=cuda,gpu -max_num_threads=1024 -model=unknown -thread_warp_size=32", [-1, 16, 64, 49152, 2147483647, 1024, 8, 32], "", 0, []], [[], [["CI", 2], ["FU", 4, [0, 1, 2, 3]], ["SP", 4, 0, 301056, [16], 1], ["AN", 4, 0, 5], ["AN", 4, 1, 6]]]], "r": [[1.67219e-05, 1.67255e-05, 1.67138e-05], 0, 3.04647, 1667934023], "v": "v0.6"}
{"i": [["[\"batch_norm\", 1, 56, 56, 96]", "cuda -keys=cuda,gpu -max_num_threads=1024 -model=unknown -thread_warp_size=32", [-1, 16, 64, 49152, 2147483647, 1024, 8, 32], "", 0, []], [[], [["CI", 2], ["FU", 4, [0, 1, 2, 3]], ["SP", 4, 0, 301056, [7], 1], ["AN", 4, 0, 5], ["AN", 4, 1, 6]]]], "r": [[3.46559e-05, 3.46556e-05, 3.4663e-05], 0, 3.35741, 1667934024], "v": "v0.6"}
{"i": [["[\"batch_norm\", 1, 56, 56, 96]", "cuda -keys=cuda,gpu -max_num_threads=1024 -model=unknown -thread_warp_size=32", [-1, 16, 64, 49152, 2147483647, 1024, 8, 32], "", 0, []], [[], [["CI", 2], ["FU", 4, [0, 1, 2, 3]], ["SP", 4, 0, 301056, [1], 1], ["AN", 4, 0, 5], ["AN", 4, 1, 6]]]], "r": [[0.000225851, 0.000225835, 0.000225869], 0, 4.19135, 1667934025], "v": "v0.6"}
{"i": [["[\"batch_norm\", 1, 56, 56, 96]", "cuda -keys=cuda,gpu -max_num_threads=1024 -model=unknown -thread_warp_size=32", [-1, 16, 64, 49152, 2147483647, 1024, 8, 32], "", 0, []], [[], [["CI", 2], ["FU", 4, [0, 1, 2, 3]], ["SP", 4, 0, 301056, [8], 1], ["AN", 4, 0, 5], ["AN", 4, 1, 6]]]], "r": [[3.06603e-05, 3.06514e-05, 3.06542e-05], 0, 3.81483, 1667934024], "v": "v0.6"}
{"i": [["[\"batch_norm\", 1, 56, 56, 96]", "cuda -keys=cuda,gpu -max_num_threads=1024 -model=unknown -thread_warp_size=32", [-1, 16, 64, 49152, 2147483647, 1024, 8, 32], "", 0, []], [[], [["CI", 2], ["FU", 4, [0, 1, 2, 3]], ["SP", 4, 0, 301056, [64], 1], ["AN", 4, 0, 5], ["AN", 4, 1, 6]]]], "r": [[6.0952e-06, 6.09474e-06, 6.09374e-06], 0, 3.48967, 1667934024], "v": "v0.6"}
{"i": [["[\"batch_norm\", 1, 56, 56, 96]", "cuda -keys=cuda,gpu -max_num_threads=1024 -model=unknown -thread_warp_size=32", [-1, 16, 64, 49152, 2147483647, 1024, 8, 32], "", 0, []], [[], [["CI", 2], ["FU", 4, [0, 1, 2, 3]], ["SP", 4, 0, 301056, [24], 1], ["AN", 4, 0, 5], ["AN", 4, 1, 6]]]], "r": [[1.22183e-05, 1.221e-05, 1.2201e-05], 0, 4.4599, 1667934025], "v": "v0.6"}
{"i": [["[\"batch_norm\", 1, 56, 56, 96]", "cuda -keys=cuda,gpu -max_num_threads=1024 -model=unknown -thread_warp_size=32", [-1, 16, 64, 49152, 2147483647, 1024, 8, 32], "", 0, []], [[], [["CI", 2], ["FU", 4, [0, 1, 2, 3]], ["SP", 4, 0, 301056, [28], 1], ["AN", 4, 0, 5], ["AN", 4, 1, 6]]]], "r": [[1.06969e-05, 1.06947e-05, 1.06945e-05], 0, 4.67897, 1667934025], "v": "v0.6"}
{"i": [["[\"batch_norm\", 1, 56, 56, 96]", "cuda -keys=cuda,gpu -max_num_threads=1024 -model=unknown -thread_warp_size=32", [-1, 16, 64, 49152, 2147483647, 1024, 8, 32], "", 0, []], [[], [["CI", 2], ["FU", 4, [0, 1, 2, 3]], ["SP", 4, 0, 301056, [2], 1], ["AN", 4, 0, 5], ["AN", 4, 1, 6]]]], "r": [[0.000114411, 0.000114409, 0.000114402], 0, 5.0224, 1667934026], "v": "v0.6"}
{"i": [["[\"batch_norm\", 1, 56, 56, 96]", "cuda -keys=cuda,gpu -max_num_threads=1024 -model=unknown -thread_warp_size=32", [-1, 16, 64, 49152, 2147483647, 1024, 8, 32], "", 0, []], [[], [["CI", 2], ["FU", 4, [0, 1, 2, 3]], ["SP", 4, 0, 301056, [56], 1], ["AN", 4, 0, 5], ["AN", 4, 1, 6]]]], "r": [[6.58573e-06, 6.58425e-06, 6.58337e-06], 0, 5.25849, 1667934026], "v": "v0.6"}
{"i": [["[\"batch_norm\", 1, 56, 56, 96]", "cuda -keys=cuda,gpu -max_num_threads=1024 -model=unknown -thread_warp_size=32", [-1, 16, 64, 49152, 2147483647, 1024, 8, 32], "", 0, []], [[], [["CI", 2], ["FU", 4, [0, 1, 2, 3]], ["SP", 4, 0, 301056, [14], 1], ["AN", 4, 0, 5], ["AN", 4, 1, 6]]]], "r": [[1.86441e-05, 1.86325e-05, 1.86221e-05], 0, 5.56632, 1667934026], "v": "v0.6"}
{"i": [["[\"batch_norm\", 1, 56, 56, 96]", "cuda -keys=cuda,gpu -max_num_threads=1024 -model=unknown -thread_warp_size=32", [-1, 16, 64, 49152, 2147483647, 1024, 8, 32], "", 0, []], [[], [["CI", 2], ["FU", 4, [0, 1, 2, 3]], ["SP", 4, 0, 301056, [48], 1], ["AN", 4, 0, 5], ["AN", 4, 1, 6]]]], "r": [[7.31686e-06, 7.31437e-06, 7.31476e-06], 0, 5.87206, 1667934027], "v": "v0.6"}
