python/models/efficientnet/VertiFusionEfficientNet_kernel_configs/efficient_sigmoid_1_112_112_96.log
{"i": [["[\"sigmoid\", 1, 112, 112, 96]", "cuda -keys=cuda,gpu -max_num_threads=1024 -model=unknown -thread_warp_size=32", [-1, 16, 64, 49152, 2147483647, 1024, 8, 32], "", 0, []], [[], [["FU", 1, [0, 1, 2, 3]], ["SP", 1, 0, 1204224, [4], 1], ["AN", 1, 0, 5], ["AN", 1, 1, 6]]]], "r": [[0.000226164, 0.000226161, 0.000226142], 0, 2.34324, 1667925283], "v": "v0.6"}
{"i": [["[\"sigmoid\", 1, 112, 112, 96]", "cuda -keys=cuda,gpu -max_num_threads=1024 -model=unknown -thread_warp_size=32", [-1, 16, 64, 49152, 2147483647, 1024, 8, 32], "", 0, []], [[], [["FU", 1, [0, 1, 2, 3]], ["SP", 1, 0, 1204224, [14], 1], ["AN", 1, 0, 5], ["AN", 1, 1, 6]]]], "r": [[6.68636e-05, 6.68383e-05, 6.68308e-05], 0, 2.0571, 1667925282], "v": "v0.6"}
{"i": [["[\"sigmoid\", 1, 112, 112, 96]", "cuda -keys=cuda,gpu -max_num_threads=1024 -model=unknown -thread_warp_size=32", [-1, 16, 64, 49152, 2147483647, 1024, 8, 32], "", 0, []], [[], [["FU", 1, [0, 1, 2, 3]], ["SP", 1, 0, 1204224, [6], 1], ["AN", 1, 0, 5], ["AN", 1, 1, 6]]]], "r": [[0.000152006, 0.000152, 0.000151987], 0, 1.36818, 1667925281], "v": "v0.6"}
{"i": [["[\"sigmoid\", 1, 112, 112, 96]", "cuda -keys=cuda,gpu -max_num_threads=1024 -model=unknown -thread_warp_size=32", [-1, 16, 64, 49152, 2147483647, 1024, 8, 32], "", 0, []], [[], [["FU", 1, [0, 1, 2, 3]], ["SP", 1, 0, 1204224, [24], 1], ["AN", 1, 0, 5], ["AN", 1, 1, 6]]]], "r": [[4.00983e-05, 4.01096e-05, 4.01044e-05], 0, 1.76196, 1667925282], "v": "v0.6"}
{"i": [["[\"sigmoid\", 1, 112, 112, 96]", "cuda -keys=cuda,gpu -max_num_threads=1024 -model=unknown -thread_warp_size=32", [-1, 16, 64, 49152, 2147483647, 1024, 8, 32], "", 0, []], [[], [["FU", 1, [0, 1, 2, 3]], ["SP", 1, 0, 1204224, [8], 1], ["AN", 1, 0, 5], ["AN", 1, 1, 6]]]], "r": [[0.000114526, 0.000114557, 0.000114535], 0, 3.46235, 1667925284], "v": "v0.6"}
{"i": [["[\"sigmoid\", 1, 112, 112, 96]", "cuda -keys=cuda,gpu -max_num_threads=1024 -model=unknown -thread_warp_size=32", [-1, 16, 64, 49152, 2147483647, 1024, 8, 32], "", 0, []], [[], [["FU", 1, [0, 1, 2, 3]], ["SP", 1, 0, 1204224, [42], 1], ["AN", 1, 0, 5], ["AN", 1, 1, 6]]]], "r": [[2.37505e-05, 2.3749e-05, 2.37415e-05], 0, 3.16037, 1667925283], "v": "v0.6"}
{"i": [["[\"sigmoid\", 1, 112, 112, 96]", "cuda -keys=cuda,gpu -max_num_threads=1024 -model=unknown -thread_warp_size=32", [-1, 16, 64, 49152, 2147483647, 1024, 8, 32], "", 0, []], [[], [["FU", 1, [0, 1, 2, 3]], ["SP", 1, 0, 1204224, [7], 1], ["AN", 1, 0, 5], ["AN", 1, 1, 6]]]], "r": [[0.0001305, 0.00013051, 0.000130507], 0, 1.0211, 1667925281], "v": "v0.6"}
{"i": [["[\"sigmoid\", 1, 112, 112, 96]", "cuda -keys=cuda,gpu -max_num_threads=1024 -model=unknown -thread_warp_size=32", [-1, 16, 64, 49152, 2147483647, 1024, 8, 32], "", 0, []], [[], [["FU", 1, [0, 1, 2, 3]], ["SP", 1, 0, 1204224, [28], 1], ["AN", 1, 0, 5], ["AN", 1, 1, 6]]]], "r": [[3.48469e-05, 3.48755e-05, 3.48663e-05], 0, 0.653669, 1667925281], "v": "v0.6"}
{"i": [["[\"sigmoid\", 1, 112, 112, 96]", "cuda -keys=cuda,gpu -max_num_threads=1024 -model=unknown -thread_warp_size=32", [-1, 16, 64, 49152, 2147483647, 1024, 8, 32], "", 0, []], [[], [["FU", 1, [0, 1, 2, 3]], ["SP", 1, 0, 1204224, [56], 1], ["AN", 1, 0, 5], ["AN", 1, 1, 6]]]], "r": [[1.86383e-05, 1.86432e-05, 1.86535e-05], 0, 3.79869, 1667925284], "v": "v0.6"}
{"i": [["[\"sigmoid\", 1, 112, 112, 96]", "cuda -keys=cuda,gpu -max_num_threads=1024 -model=unknown -thread_warp_size=32", [-1, 16, 64, 49152, 2147483647, 1024, 8, 32], "", 0, []], [[], [["FU", 1, [0, 1, 2, 3]], ["SP", 1, 0, 1204224, [49], 1], ["AN", 1, 0, 5], ["AN", 1, 1, 6]]]], "r": [[2.08183e-05, 2.08293e-05, 2.08307e-05], 0, 2.68247, 1667925283], "v": "v0.6"}
{"i": [["[\"sigmoid\", 1, 112, 112, 96]", "cuda -keys=cuda,gpu -max_num_threads=1024 -model=unknown -thread_warp_size=32", [-1, 16, 64, 49152, 2147483647, 1024, 8, 32], "", 0, []], [[], [["FU", 1, [0, 1, 2, 3]], ["SP", 1, 0, 1204224, [48], 1], ["AN", 1, 0, 5], ["AN", 1, 1, 6]]]], "r": [[2.12215e-05, 2.12366e-05, 2.12237e-05], 0, 4.07329, 1667925284], "v": "v0.6"}
{"i": [["[\"sigmoid\", 1, 112, 112, 96]", "cuda -keys=cuda,gpu -max_num_threads=1024 -model=unknown -thread_warp_size=32", [-1, 16, 64, 49152, 2147483647, 1024, 8, 32], "", 0, []], [[], [["FU", 1, [0, 1, 2, 3]], ["SP", 1, 0, 1204224, [3], 1], ["AN", 1, 0, 5], ["AN", 1, 1, 6]]]], "r": [[0.000300718, 0.000300701, 0.000300688], 0, 4.45056, 1667925285], "v": "v0.6"}
{"i": [["[\"sigmoid\", 1, 112, 112, 96]", "cuda -keys=cuda,gpu -max_num_threads=1024 -model=unknown -thread_warp_size=32", [-1, 16, 64, 49152, 2147483647, 1024, 8, 32], "", 0, []], [[], [["FU", 1, [0, 1, 2, 3]], ["SP", 1, 0, 1204224, [1], 1], ["AN", 1, 0, 5], ["AN", 1, 1, 6]]]], "r": [[0.000896029, 0.000895928, 0.000895956], 0, 5.13444, 1667925286], "v": "v0.6"}
{"i": [["[\"sigmoid\", 1, 112, 112, 96]", "cuda -keys=cuda,gpu -max_num_threads=1024 -model=unknown -thread_warp_size=32", [-1, 16, 64, 49152, 2147483647, 1024, 8, 32], "", 0, []], [[], [["FU", 1, [0, 1, 2, 3]], ["SP", 1, 0, 1204224, [2], 1], ["AN", 1, 0, 5], ["AN", 1, 1, 6]]]], "r": [[0.000449567, 0.000449555, 0.000449514], 0, 4.78029, 1667925285], "v": "v0.6"}
{"i": [["[\"sigmoid\", 1, 112, 112, 96]", "cuda -keys=cuda,gpu -max_num_threads=1024 -model=unknown -thread_warp_size=32", [-1, 16, 64, 49152, 2147483647, 1024, 8, 32], "", 0, []], [[], [["FU", 1, [0, 1, 2, 3]], ["SP", 1, 0, 1204224, [16], 1], ["AN", 1, 0, 5], ["AN", 1, 1, 6]]]], "r": [[5.89109e-05, 5.89238e-05, 5.89009e-05], 0, 5.45608, 1667925286], "v": "v0.6"}
{"i": [["[\"sigmoid\", 1, 112, 112, 96]", "cuda -keys=cuda,gpu -max_num_threads=1024 -model=unknown -thread_warp_size=32", [-1, 16, 64, 49152, 2147483647, 1024, 8, 32], "", 0, []], [[], [["FU", 1, [0, 1, 2, 3]], ["SP", 1, 0, 1204224, [21], 1], ["AN", 1, 0, 5], ["AN", 1, 1, 6]]]], "r": [[4.54225e-05, 4.54275e-05, 4.54262e-05], 0, 5.75542, 1667925286], "v": "v0.6"}
{"i": [["[\"sigmoid\", 1, 112, 112, 96]", "cuda -keys=cuda,gpu -max_num_threads=1024 -model=unknown -thread_warp_size=32", [-1, 16, 64, 49152, 2147483647, 1024, 8, 32], "", 0, []], [[], [["FU", 1, [0, 1, 2, 3]], ["SP", 1, 0, 1204224, [12], 1], ["AN", 1, 0, 5], ["AN", 1, 1, 6]]]], "r": [[7.73571e-05, 7.73772e-05, 7.73627e-05], 0, 6.1494, 1667925287], "v": "v0.6"}
{"i": [["[\"sigmoid\", 1, 112, 112, 96]", "cuda -keys=cuda,gpu -max_num_threads=1024 -model=unknown -thread_warp_size=32", [-1, 16, 64, 49152, 2147483647, 1024, 8, 32], "", 0, []], [[], [["FU", 1, [0, 1, 2, 3]], ["SP", 1, 0, 1204224, [64], 1], ["AN", 1, 0, 5], ["AN", 1, 1, 6]]]], "r": [[1.66254e-05, 1.66334e-05, 1.66386e-05], 0, 6.47362, 1667925287], "v": "v0.6"}
{"i": [["[\"sigmoid\", 1, 112, 112, 96]", "cuda -keys=cuda,gpu -max_num_threads=1024 -model=unknown -thread_warp_size=32", [-1, 16, 64, 49152, 2147483647, 1024, 8, 32], "", 0, []], [[], [["FU", 1, [0, 1, 2, 3]], ["SP", 1, 0, 1204224, [32], 1], ["AN", 1, 0, 5], ["AN", 1, 1, 6]]]], "r": [[3.10171e-05, 3.10428e-05, 3.10526e-05], 0, 6.78009, 1667925288], "v": "v0.6"}
{"i": [["[\"sigmoid\", 1, 112, 112, 96]", "cuda -keys=cuda,gpu -max_num_threads=1024 -model=unknown -thread_warp_size=32", [-1, 16, 64, 49152, 2147483647, 1024, 8, 32], "", 0, []], [[], [["FU", 1, [0, 1, 2, 3]], ["SP", 1, 0, 1204224, [1], 1], ["AN", 1, 0, 5], ["AN", 1, 1, 6]]]], "r": [[0.000896025, 0.000896017, 0.000896025], 0, 1.51058, 1667925902], "v": "v0.6"}
{"i": [["[\"sigmoid\", 1, 112, 112, 96]", "cuda -keys=cuda,gpu -max_num_threads=1024 -model=unknown -thread_warp_size=32", [-1, 16, 64, 49152, 2147483647, 1024, 8, 32], "", 0, []], [[], [["FU", 1, [0, 1, 2, 3]], ["SP", 1, 0, 1204224, [56], 1], ["AN", 1, 0, 5], ["AN", 1, 1, 6]]]], "r": [[1.86196e-05, 1.86245e-05, 1.8643e-05], 0, 2.66866, 1667925903], "v": "v0.6"}
{"i": [["[\"sigmoid\", 1, 112, 112, 96]", "cuda -keys=cuda,gpu -max_num_threads=1024 -model=unknown -thread_warp_size=32", [-1, 16, 64, 49152, 2147483647, 1024, 8, 32], "", 0, []], [[], [["FU", 1, [0, 1, 2, 3]], ["SP", 1, 0, 1204224, [3], 1], ["AN", 1, 0, 5], ["AN", 1, 1, 6]]]], "r": [[0.000300752, 0.00030074, 0.000300774], 0, 1.33259, 1667925902], "v": "v0.6"}
{"i": [["[\"sigmoid\", 1, 112, 112, 96]", "cuda -keys=cuda,gpu -max_num_threads=1024 -model=unknown -thread_warp_size=32", [-1, 16, 64, 49152, 2147483647, 1024, 8, 32], "", 0, []], [[], [["FU", 1, [0, 1, 2, 3]], ["SP", 1, 0, 1204224, [64], 1], ["AN", 1, 0, 5], ["AN", 1, 1, 6]]]], "r": [[1.66977e-05, 1.6697e-05, 1.66972e-05], 0, 0.68332, 1667925901], "v": "v0.6"}
{"i": [["[\"sigmoid\", 1, 112, 112, 96]", "cuda -keys=cuda,gpu -max_num_threads=1024 -model=unknown -thread_warp_size=32", [-1, 16, 64, 49152, 2147483647, 1024, 8, 32], "", 0, []], [[], [["FU", 1, [0, 1, 2, 3]], ["SP", 1, 0, 1204224, [12], 1], ["AN", 1, 0, 5], ["AN", 1, 1, 6]]]], "r": [[7.73614e-05, 7.73947e-05, 7.73817e-05], 0, 2.32302, 1667925903], "v": "v0.6"}
{"i": [["[\"sigmoid\", 1, 112, 112, 96]", "cuda -keys=cuda,gpu -max_num_threads=1024 -model=unknown -thread_warp_size=32", [-1, 16, 64, 49152, 2147483647, 1024, 8, 32], "", 0, []], [[], [["FU", 1, [0, 1, 2, 3]], ["SP", 1, 0, 1204224, [16], 1], ["AN", 1, 0, 5], ["AN", 1, 1, 6]]]], "r": [[5.89141e-05, 5.8925e-05, 5.88975e-05], 0, 1.0213, 1667925902], "v": "v0.6"}
{"i": [["[\"sigmoid\", 1, 112, 112, 96]", "cuda -keys=cuda,gpu -max_num_threads=1024 -model=unknown -thread_warp_size=32", [-1, 16, 64, 49152, 2147483647, 1024, 8, 32], "", 0, []], [[], [["FU", 1, [0, 1, 2, 3]], ["SP", 1, 0, 1204224, [4], 1], ["AN", 1, 0, 5], ["AN", 1, 1, 6]]]], "r": [[0.000226285, 0.000226261, 0.000226262], 0, 1.90516, 1667925903], "v": "v0.6"}
{"i": [["[\"sigmoid\", 1, 112, 112, 96]", "cuda -keys=cuda,gpu -max_num_threads=1024 -model=unknown -thread_warp_size=32", [-1, 16, 64, 49152, 2147483647, 1024, 8, 32], "", 0, []], [[], [["FU", 1, [0, 1, 2, 3]], ["SP", 1, 0, 1204224, [24], 1], ["AN", 1, 0, 5], ["AN", 1, 1, 6]]]], "r": [[4.02537e-05, 4.02674e-05, 4.02614e-05], 0, 2.87707, 1667925904], "v": "v0.6"}
{"i": [["[\"sigmoid\", 1, 112, 112, 96]", "cuda -keys=cuda,gpu -max_num_threads=1024 -model=unknown -thread_warp_size=32", [-1, 16, 64, 49152, 2147483647, 1024, 8, 32], "", 0, []], [[], [["FU", 1, [0, 1, 2, 3]], ["SP", 1, 0, 1204224, [49], 1], ["AN", 1, 0, 5], ["AN", 1, 1, 6]]]], "r": [[2.08897e-05, 2.08905e-05, 2.09016e-05], 0, 3.2043, 1667925904], "v": "v0.6"}
{"i": [["[\"sigmoid\", 1, 112, 112, 96]", "cuda -keys=cuda,gpu -max_num_threads=1024 -model=unknown -thread_warp_size=32", [-1, 16, 64, 49152, 2147483647, 1024, 8, 32], "", 0, []], [[], [["FU", 1, [0, 1, 2, 3]], ["SP", 1, 0, 1204224, [6], 1], ["AN", 1, 0, 5], ["AN", 1, 1, 6]]]], "r": [[0.000151926, 0.000151924, 0.000151957], 0, 3.91906, 1667925905], "v": "v0.6"}
{"i": [["[\"sigmoid\", 1, 112, 112, 96]", "cuda -keys=cuda,gpu -max_num_threads=1024 -model=unknown -thread_warp_size=32", [-1, 16, 64, 49152, 2147483647, 1024, 8, 32], "", 0, []], [[], [["FU", 1, [0, 1, 2, 3]], ["SP", 1, 0, 1204224, [14], 1], ["AN", 1, 0, 5], ["AN", 1, 1, 6]]]], "r": [[6.69141e-05, 6.68898e-05, 6.68606e-05], 0, 3.52627, 1667925905], "v": "v0.6"}
{"i": [["[\"sigmoid\", 1, 112, 112, 96]", "cuda -keys=cuda,gpu -max_num_threads=1024 -model=unknown -thread_warp_size=32", [-1, 16, 64, 49152, 2147483647, 1024, 8, 32], "", 0, []], [[], [["FU", 1, [0, 1, 2, 3]], ["SP", 1, 0, 1204224, [28], 1], ["AN", 1, 0, 5], ["AN", 1, 1, 6]]]], "r": [[3.48541e-05, 3.4889e-05, 3.48828e-05], 0, 4.17306, 1667925905], "v": "v0.6"}
{"i": [["[\"sigmoid\", 1, 112, 112, 96]", "cuda -keys=cuda,gpu -max_num_threads=1024 -model=unknown -thread_warp_size=32", [-1, 16, 64, 49152, 2147483647, 1024, 8, 32], "", 0, []], [[], [["FU", 1, [0, 1, 2, 3]], ["SP", 1, 0, 1204224, [21], 1], ["AN", 1, 0, 5], ["AN", 1, 1, 6]]]], "r": [[4.54224e-05, 4.54535e-05, 4.54502e-05], 0, 4.45535, 1667925906], "v": "v0.6"}
{"i": [["[\"sigmoid\", 1, 112, 112, 96]", "cuda -keys=cuda,gpu -max_num_threads=1024 -model=unknown -thread_warp_size=32", [-1, 16, 64, 49152, 2147483647, 1024, 8, 32], "", 0, []], [[], [["FU", 1, [0, 1, 2, 3]], ["SP", 1, 0, 1204224, [48], 1], ["AN", 1, 0, 5], ["AN", 1, 1, 6]]]], "r": [[2.11622e-05, 2.11811e-05, 2.1179e-05], 0, 4.80582, 1667925906], "v": "v0.6"}
{"i": [["[\"sigmoid\", 1, 112, 112, 96]", "cuda -keys=cuda,gpu -max_num_threads=1024 -model=unknown -thread_warp_size=32", [-1, 16, 64, 49152, 2147483647, 1024, 8, 32], "", 0, []], [[], [["FU", 1, [0, 1, 2, 3]], ["SP", 1, 0, 1204224, [8], 1], ["AN", 1, 0, 5], ["AN", 1, 1, 6]]]], "r": [[0.000114505, 0.000114512, 0.000114531], 0, 5.11986, 1667925906], "v": "v0.6"}
{"i": [["[\"sigmoid\", 1, 112, 112, 96]", "cuda -keys=cuda,gpu -max_num_threads=1024 -model=unknown -thread_warp_size=32", [-1, 16, 64, 49152, 2147483647, 1024, 8, 32], "", 0, []], [[], [["FU", 1, [0, 1, 2, 3]], ["SP", 1, 0, 1204224, [32], 1], ["AN", 1, 0, 5], ["AN", 1, 1, 6]]]], "r": [[3.08972e-05, 3.09024e-05, 3.09029e-05], 0, 5.41991, 1667925907], "v": "v0.6"}
{"i": [["[\"sigmoid\", 1, 112, 112, 96]", "cuda -keys=cuda,gpu -max_num_threads=1024 -model=unknown -thread_warp_size=32", [-1, 16, 64, 49152, 2147483647, 1024, 8, 32], "", 0, []], [[], [["FU", 1, [0, 1, 2, 3]], ["SP", 1, 0, 1204224, [7], 1], ["AN", 1, 0, 5], ["AN", 1, 1, 6]]]], "r": [[0.000130549, 0.000130539, 0.000130548], 0, 5.76834, 1667925907], "v": "v0.6"}
{"i": [["[\"sigmoid\", 1, 112, 112, 96]", "cuda -keys=cuda,gpu -max_num_threads=1024 -model=unknown -thread_warp_size=32", [-1, 16, 64, 49152, 2147483647, 1024, 8, 32], "", 0, []], [[], [["FU", 1, [0, 1, 2, 3]], ["SP", 1, 0, 1204224, [42], 1], ["AN", 1, 0, 5], ["AN", 1, 1, 6]]]], "r": [[2.37812e-05, 2.37943e-05, 2.3808e-05], 0, 6.07029, 1667925908], "v": "v0.6"}
{"i": [["[\"sigmoid\", 1, 112, 112, 96]", "cuda -keys=cuda,gpu -max_num_threads=1024 -model=unknown -thread_warp_size=32", [-1, 16, 64, 49152, 2147483647, 1024, 8, 32], "", 0, []], [[], [["FU", 1, [0, 1, 2, 3]], ["SP", 1, 0, 1204224, [2], 1], ["AN", 1, 0, 5], ["AN", 1, 1, 6]]]], "r": [[0.00044945, 0.000449483, 0.000449433], 0, 6.36753, 1667925908], "v": "v0.6"}
{"i": [["[\"sigmoid\", 1, 112, 112, 96]", "cuda -keys=cuda,gpu -max_num_threads=1024 -model=unknown -thread_warp_size=32", [-1, 16, 64, 49152, 2147483647, 1024, 8, 32], "", 0, []], [[], [["FU", 1, [0, 1, 2, 3]], ["SP", 1, 0, 1204224, [12], 1], ["AN", 1, 0, 5], ["AN", 1, 1, 6]]]], "r": [[7.738e-05, 7.74119e-05, 7.74028e-05], 0, 1.53127, 1667932483], "v": "v0.6"}
{"i": [["[\"sigmoid\", 1, 112, 112, 96]", "cuda -keys=cuda,gpu -max_num_threads=1024 -model=unknown -thread_warp_size=32", [-1, 16, 64, 49152, 2147483647, 1024, 8, 32], "", 0, []], [[], [["FU", 1, [0, 1, 2, 3]], ["SP", 1, 0, 1204224, [56], 1], ["AN", 1, 0, 5], ["AN", 1, 1, 6]]]], "r": [[1.86453e-05, 1.86738e-05, 1.86525e-05], 0, 2.24014, 1667932484], "v": "v0.6"}
{"i": [["[\"sigmoid\", 1, 112, 112, 96]", "cuda -keys=cuda,gpu -max_num_threads=1024 -model=unknown -thread_warp_size=32", [-1, 16, 64, 49152, 2147483647, 1024, 8, 32], "", 0, []], [[], [["FU", 1, [0, 1, 2, 3]], ["SP", 1, 0, 1204224, [42], 1], ["AN", 1, 0, 5], ["AN", 1, 1, 6]]]], "r": [[2.37865e-05, 2.37968e-05, 2.37808e-05], 0, 3.55975, 1667932485], "v": "v0.6"}
{"i": [["[\"sigmoid\", 1, 112, 112, 96]", "cuda -keys=cuda,gpu -max_num_threads=1024 -model=unknown -thread_warp_size=32", [-1, 16, 64, 49152, 2147483647, 1024, 8, 32], "", 0, []], [[], [["FU", 1, [0, 1, 2, 3]], ["SP", 1, 0, 1204224, [49], 1], ["AN", 1, 0, 5], ["AN", 1, 1, 6]]]], "r": [[2.07884e-05, 2.07859e-05, 2.07949e-05], 0, 1.86276, 1667932484], "v": "v0.6"}
{"i": [["[\"sigmoid\", 1, 112, 112, 96]", "cuda -keys=cuda,gpu -max_num_threads=1024 -model=unknown -thread_warp_size=32", [-1, 16, 64, 49152, 2147483647, 1024, 8, 32], "", 0, []], [[], [["FU", 1, [0, 1, 2, 3]], ["SP", 1, 0, 1204224, [1], 1], ["AN", 1, 0, 5], ["AN", 1, 1, 6]]]], "r": [[0.000895932, 0.000895904, 0.000895933], 0, 2.56412, 1667932484], "v": "v0.6"}
{"i": [["[\"sigmoid\", 1, 112, 112, 96]", "cuda -keys=cuda,gpu -max_num_threads=1024 -model=unknown -thread_warp_size=32", [-1, 16, 64, 49152, 2147483647, 1024, 8, 32], "", 0, []], [[], [["FU", 1, [0, 1, 2, 3]], ["SP", 1, 0, 1204224, [28], 1], ["AN", 1, 0, 5], ["AN", 1, 1, 6]]]], "r": [[3.47693e-05, 3.47871e-05, 3.47783e-05], 0, 2.95147, 1667932485], "v": "v0.6"}
{"i": [["[\"sigmoid\", 1, 112, 112, 96]", "cuda -keys=cuda,gpu -max_num_threads=1024 -model=unknown -thread_warp_size=32", [-1, 16, 64, 49152, 2147483647, 1024, 8, 32], "", 0, []], [[], [["FU", 1, [0, 1, 2, 3]], ["SP", 1, 0, 1204224, [6], 1], ["AN", 1, 0, 5], ["AN", 1, 1, 6]]]], "r": [[0.000151793, 0.000151793, 0.00015183], 0, 1.15159, 1667932483], "v": "v0.6"}
{"i": [["[\"sigmoid\", 1, 112, 112, 96]", "cuda -keys=cuda,gpu -max_num_threads=1024 -model=unknown -thread_warp_size=32", [-1, 16, 64, 49152, 2147483647, 1024, 8, 32], "", 0, []], [[], [["FU", 1, [0, 1, 2, 3]], ["SP", 1, 0, 1204224, [14], 1], ["AN", 1, 0, 5], ["AN", 1, 1, 6]]]], "r": [[6.6749e-05, 6.67521e-05, 6.67504e-05], 0, 0.659928, 1667932482], "v": "v0.6"}
{"i": [["[\"sigmoid\", 1, 112, 112, 96]", "cuda -keys=cuda,gpu -max_num_threads=1024 -model=unknown -thread_warp_size=32", [-1, 16, 64, 49152, 2147483647, 1024, 8, 32], "", 0, []], [[], [["FU", 1, [0, 1, 2, 3]], ["SP", 1, 0, 1204224, [2], 1], ["AN", 1, 0, 5], ["AN", 1, 1, 6]]]], "r": [[0.00044944, 0.000449424, 0.000449409], 0, 3.20547, 1667932485], "v": "v0.6"}
{"i": [["[\"sigmoid\", 1, 112, 112, 96]", "cuda -keys=cuda,gpu -max_num_threads=1024 -model=unknown -thread_warp_size=32", [-1, 16, 64, 49152, 2147483647, 1024, 8, 32], "", 0, []], [[], [["FU", 1, [0, 1, 2, 3]], ["SP", 1, 0, 1204224, [64], 1], ["AN", 1, 0, 5], ["AN", 1, 1, 6]]]], "r": [[1.67101e-05, 1.67173e-05, 1.67204e-05], 0, 4.15684, 1667932486], "v": "v0.6"}
{"i": [["[\"sigmoid\", 1, 112, 112, 96]", "cuda -keys=cuda,gpu -max_num_threads=1024 -model=unknown -thread_warp_size=32", [-1, 16, 64, 49152, 2147483647, 1024, 8, 32], "", 0, []], [[], [["FU", 1, [0, 1, 2, 3]], ["SP", 1, 0, 1204224, [7], 1], ["AN", 1, 0, 5], ["AN", 1, 1, 6]]]], "r": [[0.000130606, 0.000130614, 0.000130651], 0, 3.84138, 1667932486], "v": "v0.6"}
{"i": [["[\"sigmoid\", 1, 112, 112, 96]", "cuda -keys=cuda,gpu -max_num_threads=1024 -model=unknown -thread_warp_size=32", [-1, 16, 64, 49152, 2147483647, 1024, 8, 32], "", 0, []], [[], [["FU", 1, [0, 1, 2, 3]], ["SP", 1, 0, 1204224, [21], 1], ["AN", 1, 0, 5], ["AN", 1, 1, 6]]]], "r": [[4.54794e-05, 4.55019e-05, 4.549e-05], 0, 4.49794, 1667932487], "v": "v0.6"}
{"i": [["[\"sigmoid\", 1, 112, 112, 96]", "cuda -keys=cuda,gpu -max_num_threads=1024 -model=unknown -thread_warp_size=32", [-1, 16, 64, 49152, 2147483647, 1024, 8, 32], "", 0, []], [[], [["FU", 1, [0, 1, 2, 3]], ["SP", 1, 0, 1204224, [3], 1], ["AN", 1, 0, 5], ["AN", 1, 1, 6]]]], "r": [[0.000300648, 0.000300589, 0.000300639], 0, 5.13457, 1667932487], "v": "v0.6"}
{"i": [["[\"sigmoid\", 1, 112, 112, 96]", "cuda -keys=cuda,gpu -max_num_threads=1024 -model=unknown -thread_warp_size=32", [-1, 16, 64, 49152, 2147483647, 1024, 8, 32], "", 0, []], [[], [["FU", 1, [0, 1, 2, 3]], ["SP", 1, 0, 1204224, [24], 1], ["AN", 1, 0, 5], ["AN", 1, 1, 6]]]], "r": [[4.0114e-05, 4.0116e-05, 4.01233e-05], 0, 4.8172, 1667932487], "v": "v0.6"}
{"i": [["[\"sigmoid\", 1, 112, 112, 96]", "cuda -keys=cuda,gpu -max_num_threads=1024 -model=unknown -thread_warp_size=32", [-1, 16, 64, 49152, 2147483647, 1024, 8, 32], "", 0, []], [[], [["FU", 1, [0, 1, 2, 3]], ["SP", 1, 0, 1204224, [4], 1], ["AN", 1, 0, 5], ["AN", 1, 1, 6]]]], "r": [[0.000226163, 0.000226128, 0.000226117], 0, 5.47687, 1667932488], "v": "v0.6"}
{"i": [["[\"sigmoid\", 1, 112, 112, 96]", "cuda -keys=cuda,gpu -max_num_threads=1024 -model=unknown -thread_warp_size=32", [-1, 16, 64, 49152, 2147483647, 1024, 8, 32], "", 0, []], [[], [["FU", 1, [0, 1, 2, 3]], ["SP", 1, 0, 1204224, [32], 1], ["AN", 1, 0, 5], ["AN", 1, 1, 6]]]], "r": [[3.0959e-05, 3.09799e-05, 3.09679e-05], 0, 5.77414, 1667932488], "v": "v0.6"}
{"i": [["[\"sigmoid\", 1, 112, 112, 96]", "cuda -keys=cuda,gpu -max_num_threads=1024 -model=unknown -thread_warp_size=32", [-1, 16, 64, 49152, 2147483647, 1024, 8, 32], "", 0, []], [[], [["FU", 1, [0, 1, 2, 3]], ["SP", 1, 0, 1204224, [16], 1], ["AN", 1, 0, 5], ["AN", 1, 1, 6]]]], "r": [[5.88652e-05, 5.88815e-05, 5.88751e-05], 0, 6.10754, 1667932488], "v": "v0.6"}
{"i": [["[\"sigmoid\", 1, 112, 112, 96]", "cuda -keys=cuda,gpu -max_num_threads=1024 -model=unknown -thread_warp_size=32", [-1, 16, 64, 49152, 2147483647, 1024, 8, 32], "", 0, []], [[], [["FU", 1, [0, 1, 2, 3]], ["SP", 1, 0, 1204224, [8], 1], ["AN", 1, 0, 5], ["AN", 1, 1, 6]]]], "r": [[0.000114573, 0.000114576, 0.000114569], 0, 6.46665, 1667932489], "v": "v0.6"}
{"i": [["[\"sigmoid\", 1, 112, 112, 96]", "cuda -keys=cuda,gpu -max_num_threads=1024 -model=unknown -thread_warp_size=32", [-1, 16, 64, 49152, 2147483647, 1024, 8, 32], "", 0, []], [[], [["FU", 1, [0, 1, 2, 3]], ["SP", 1, 0, 1204224, [48], 1], ["AN", 1, 0, 5], ["AN", 1, 1, 6]]]], "r": [[2.11025e-05, 2.11087e-05, 2.10991e-05], 0, 6.77548, 1667932489], "v": "v0.6"}
