python/models/efficientnet/VertiFusionEfficientNet_kernel_configs/efficient_sigmoid_1_1_1_1152.log
{"i": [["[\"sigmoid\", 1, 1, 1, 1152]", "cuda -keys=cuda,gpu -max_num_threads=1024 -model=unknown -thread_warp_size=32", [-1, 16, 64, 49152, 2147483647, 1024, 8, 32], "", 0, []], [[], [["FU", 1, [0, 1, 2, 3]], ["SP", 1, 0, 1152, [6], 1], ["AN", 1, 0, 5], ["AN", 1, 1, 6]]]], "r": [[2.70812e-06, 2.70816e-06, 2.70722e-06], 0, 0.618893, 1667927834], "v": "v0.6"}
{"i": [["[\"sigmoid\", 1, 1, 1, 1152]", "cuda -keys=cuda,gpu -max_num_threads=1024 -model=unknown -thread_warp_size=32", [-1, 16, 64, 49152, 2147483647, 1024, 8, 32], "", 0, []], [[], [["FU", 1, [0, 1, 2, 3]], ["SP", 1, 0, 1152, [64], 1], ["AN", 1, 0, 5], ["AN", 1, 1, 6]]]], "r": [[2.54634e-06, 2.5359e-06, 2.53825e-06], 0, 0.850015, 1667927834], "v": "v0.6"}
{"i": [["[\"sigmoid\", 1, 1, 1, 1152]", "cuda -keys=cuda,gpu -max_num_threads=1024 -model=unknown -thread_warp_size=32", [-1, 16, 64, 49152, 2147483647, 1024, 8, 32], "", 0, []], [[], [["FU", 1, [0, 1, 2, 3]], ["SP", 1, 0, 1152, [1], 1], ["AN", 1, 0, 5], ["AN", 1, 1, 6]]]], "r": [[3.3965e-06, 3.4077e-06, 3.40809e-06], 0, 1.43457, 1667927835], "v": "v0.6"}
{"i": [["[\"sigmoid\", 1, 1, 1, 1152]", "cuda -keys=cuda,gpu -max_num_threads=1024 -model=unknown -thread_warp_size=32", [-1, 16, 64, 49152, 2147483647, 1024, 8, 32], "", 0, []], [[], [["FU", 1, [0, 1, 2, 3]], ["SP", 1, 0, 1152, [3], 1], ["AN", 1, 0, 5], ["AN", 1, 1, 6]]]], "r": [[2.90663e-06, 2.90523e-06, 2.90534e-06], 0, 2.08146, 1667927835], "v": "v0.6"}
{"i": [["[\"sigmoid\", 1, 1, 1, 1152]", "cuda -keys=cuda,gpu -max_num_threads=1024 -model=unknown -thread_warp_size=32", [-1, 16, 64, 49152, 2147483647, 1024, 8, 32], "", 0, []], [[], [["FU", 1, [0, 1, 2, 3]], ["SP", 1, 0, 1152, [2], 1], ["AN", 1, 0, 5], ["AN", 1, 1, 6]]]], "r": [[3.07879e-06, 3.07565e-06, 3.07478e-06], 0, 1.74625, 1667927835], "v": "v0.6"}
{"i": [["[\"sigmoid\", 1, 1, 1, 1152]", "cuda -keys=cuda,gpu -max_num_threads=1024 -model=unknown -thread_warp_size=32", [-1, 16, 64, 49152, 2147483647, 1024, 8, 32], "", 0, []], [[], [["FU", 1, [0, 1, 2, 3]], ["SP", 1, 0, 1152, [9], 1], ["AN", 1, 0, 5], ["AN", 1, 1, 6]]]], "r": [[2.69916e-06, 2.69869e-06, 2.69827e-06], 0, 2.57047, 1667927836], "v": "v0.6"}
{"i": [["[\"sigmoid\", 1, 1, 1, 1152]", "cuda -keys=cuda,gpu -max_num_threads=1024 -model=unknown -thread_warp_size=32", [-1, 16, 64, 49152, 2147483647, 1024, 8, 32], "", 0, []], [[], [["FU", 1, [0, 1, 2, 3]], ["SP", 1, 0, 1152, [32], 1], ["AN", 1, 0, 5], ["AN", 1, 1, 6]]]], "r": [[2.59541e-06, 2.59189e-06, 2.59762e-06], 0, 1.16288, 1667927834], "v": "v0.6"}
{"i": [["[\"sigmoid\", 1, 1, 1, 1152]", "cuda -keys=cuda,gpu -max_num_threads=1024 -model=unknown -thread_warp_size=32", [-1, 16, 64, 49152, 2147483647, 1024, 8, 32], "", 0, []], [[], [["FU", 1, [0, 1, 2, 3]], ["SP", 1, 0, 1152, [4], 1], ["AN", 1, 0, 5], ["AN", 1, 1, 6]]]], "r": [[2.882e-06, 2.87931e-06, 2.88153e-06], 0, 2.34668, 1667927836], "v": "v0.6"}
{"i": [["[\"sigmoid\", 1, 1, 1, 1152]", "cuda -keys=cuda,gpu -max_num_threads=1024 -model=unknown -thread_warp_size=32", [-1, 16, 64, 49152, 2147483647, 1024, 8, 32], "", 0, []], [[], [["FU", 1, [0, 1, 2, 3]], ["SP", 1, 0, 1152, [36], 1], ["AN", 1, 0, 5], ["AN", 1, 1, 6]]]], "r": [[2.54436e-06, 2.53274e-06, 2.53819e-06], 0, 2.85329, 1667927836], "v": "v0.6"}
{"i": [["[\"sigmoid\", 1, 1, 1, 1152]", "cuda -keys=cuda,gpu -max_num_threads=1024 -model=unknown -thread_warp_size=32", [-1, 16, 64, 49152, 2147483647, 1024, 8, 32], "", 0, []], [[], [["FU", 1, [0, 1, 2, 3]], ["SP", 1, 0, 1152, [16], 1], ["AN", 1, 0, 5], ["AN", 1, 1, 6]]]], "r": [[2.7361e-06, 2.75656e-06, 2.76842e-06], 0, 3.09348, 1667927837], "v": "v0.6"}
{"i": [["[\"sigmoid\", 1, 1, 1, 1152]", "cuda -keys=cuda,gpu -max_num_threads=1024 -model=unknown -thread_warp_size=32", [-1, 16, 64, 49152, 2147483647, 1024, 8, 32], "", 0, []], [[], [["FU", 1, [0, 1, 2, 3]], ["SP", 1, 0, 1152, [24], 1], ["AN", 1, 0, 5], ["AN", 1, 1, 6]]]], "r": [[2.65771e-06, 2.49468e-06, 2.49493e-06], 0, 3.34705, 1667927837], "v": "v0.6"}
{"i": [["[\"sigmoid\", 1, 1, 1, 1152]", "cuda -keys=cuda,gpu -max_num_threads=1024 -model=unknown -thread_warp_size=32", [-1, 16, 64, 49152, 2147483647, 1024, 8, 32], "", 0, []], [[], [["FU", 1, [0, 1, 2, 3]], ["SP", 1, 0, 1152, [12], 1], ["AN", 1, 0, 5], ["AN", 1, 1, 6]]]], "r": [[2.63169e-06, 2.63188e-06, 2.63258e-06], 0, 3.62612, 1667927837], "v": "v0.6"}
{"i": [["[\"sigmoid\", 1, 1, 1, 1152]", "cuda -keys=cuda,gpu -max_num_threads=1024 -model=unknown -thread_warp_size=32", [-1, 16, 64, 49152, 2147483647, 1024, 8, 32], "", 0, []], [[], [["FU", 1, [0, 1, 2, 3]], ["SP", 1, 0, 1152, [48], 1], ["AN", 1, 0, 5], ["AN", 1, 1, 6]]]], "r": [[2.65119e-06, 2.64557e-06, 2.64603e-06], 0, 3.86922, 1667927838], "v": "v0.6"}
{"i": [["[\"sigmoid\", 1, 1, 1, 1152]", "cuda -keys=cuda,gpu -max_num_threads=1024 -model=unknown -thread_warp_size=32", [-1, 16, 64, 49152, 2147483647, 1024, 8, 32], "", 0, []], [[], [["FU", 1, [0, 1, 2, 3]], ["SP", 1, 0, 1152, [8], 1], ["AN", 1, 0, 5], ["AN", 1, 1, 6]]]], "r": [[2.88296e-06, 2.89181e-06, 2.90001e-06], 0, 4.12183, 1667927838], "v": "v0.6"}
{"i": [["[\"sigmoid\", 1, 1, 1, 1152]", "cuda -keys=cuda,gpu -max_num_threads=1024 -model=unknown -thread_warp_size=32", [-1, 16, 64, 49152, 2147483647, 1024, 8, 32], "", 0, []], [[], [["FU", 1, [0, 1, 2, 3]], ["SP", 1, 0, 1152, [18], 1], ["AN", 1, 0, 5], ["AN", 1, 1, 6]]]], "r": [[2.63713e-06, 2.65265e-06, 2.6518e-06], 0, 4.38267, 1667927838], "v": "v0.6"}
{"i": [["[\"sigmoid\", 1, 1, 1, 1152]", "cuda -keys=cuda,gpu -max_num_threads=1024 -model=unknown -thread_warp_size=32", [-1, 16, 64, 49152, 2147483647, 1024, 8, 32], "", 0, []], [[], [["FU", 1, [0, 1, 2, 3]], ["SP", 1, 0, 1152, [1], 1], ["AN", 1, 0, 5], ["AN", 1, 1, 6]]]], "r": [[3.60716e-06, 3.63643e-06, 3.63523e-06], 0, 0.911773, 1667927950], "v": "v0.6"}
{"i": [["[\"sigmoid\", 1, 1, 1, 1152]", "cuda -keys=cuda,gpu -max_num_threads=1024 -model=unknown -thread_warp_size=32", [-1, 16, 64, 49152, 2147483647, 1024, 8, 32], "", 0, []], [[], [["FU", 1, [0, 1, 2, 3]], ["SP", 1, 0, 1152, [8], 1], ["AN", 1, 0, 5], ["AN", 1, 1, 6]]]], "r": [[2.68586e-06, 2.68626e-06, 2.68605e-06], 0, 1.77377, 1667927951], "v": "v0.6"}
{"i": [["[\"sigmoid\", 1, 1, 1, 1152]", "cuda -keys=cuda,gpu -max_num_threads=1024 -model=unknown -thread_warp_size=32", [-1, 16, 64, 49152, 2147483647, 1024, 8, 32], "", 0, []], [[], [["FU", 1, [0, 1, 2, 3]], ["SP", 1, 0, 1152, [2], 1], ["AN", 1, 0, 5], ["AN", 1, 1, 6]]]], "r": [[3.20445e-06, 3.21305e-06, 3.20992e-06], 0, 2.22469, 1667927952], "v": "v0.6"}
{"i": [["[\"sigmoid\", 1, 1, 1, 1152]", "cuda -keys=cuda,gpu -max_num_threads=1024 -model=unknown -thread_warp_size=32", [-1, 16, 64, 49152, 2147483647, 1024, 8, 32], "", 0, []], [[], [["FU", 1, [0, 1, 2, 3]], ["SP", 1, 0, 1152, [9], 1], ["AN", 1, 0, 5], ["AN", 1, 1, 6]]]], "r": [[2.6857e-06, 2.68637e-06, 2.68568e-06], 0, 1.18529, 1667927951], "v": "v0.6"}
{"i": [["[\"sigmoid\", 1, 1, 1, 1152]", "cuda -keys=cuda,gpu -max_num_threads=1024 -model=unknown -thread_warp_size=32", [-1, 16, 64, 49152, 2147483647, 1024, 8, 32], "", 0, []], [[], [["FU", 1, [0, 1, 2, 3]], ["SP", 1, 0, 1152, [12], 1], ["AN", 1, 0, 5], ["AN", 1, 1, 6]]]], "r": [[2.62578e-06, 2.62166e-06, 2.62233e-06], 0, 0.567632, 1667927950], "v": "v0.6"}
{"i": [["[\"sigmoid\", 1, 1, 1, 1152]", "cuda -keys=cuda,gpu -max_num_threads=1024 -model=unknown -thread_warp_size=32", [-1, 16, 64, 49152, 2147483647, 1024, 8, 32], "", 0, []], [[], [["FU", 1, [0, 1, 2, 3]], ["SP", 1, 0, 1152, [24], 1], ["AN", 1, 0, 5], ["AN", 1, 1, 6]]]], "r": [[2.53307e-06, 2.519e-06, 2.52162e-06], 0, 1.4145, 1667927951], "v": "v0.6"}
{"i": [["[\"sigmoid\", 1, 1, 1, 1152]", "cuda -keys=cuda,gpu -max_num_threads=1024 -model=unknown -thread_warp_size=32", [-1, 16, 64, 49152, 2147483647, 1024, 8, 32], "", 0, []], [[], [["FU", 1, [0, 1, 2, 3]], ["SP", 1, 0, 1152, [36], 1], ["AN", 1, 0, 5], ["AN", 1, 1, 6]]]], "r": [[2.53119e-06, 2.51873e-06, 2.52273e-06], 0, 1.96926, 1667927952], "v": "v0.6"}
{"i": [["[\"sigmoid\", 1, 1, 1, 1152]", "cuda -keys=cuda,gpu -max_num_threads=1024 -model=unknown -thread_warp_size=32", [-1, 16, 64, 49152, 2147483647, 1024, 8, 32], "", 0, []], [[], [["FU", 1, [0, 1, 2, 3]], ["SP", 1, 0, 1152, [64], 1], ["AN", 1, 0, 5], ["AN", 1, 1, 6]]]], "r": [[2.59577e-06, 2.58295e-06, 2.5841e-06], 0, 2.52057, 1667927952], "v": "v0.6"}
{"i": [["[\"sigmoid\", 1, 1, 1, 1152]", "cuda -keys=cuda,gpu -max_num_threads=1024 -model=unknown -thread_warp_size=32", [-1, 16, 64, 49152, 2147483647, 1024, 8, 32], "", 0, []], [[], [["FU", 1, [0, 1, 2, 3]], ["SP", 1, 0, 1152, [6], 1], ["AN", 1, 0, 5], ["AN", 1, 1, 6]]]], "r": [[2.68271e-06, 2.68271e-06, 2.68382e-06], 0, 2.80112, 1667927953], "v": "v0.6"}
{"i": [["[\"sigmoid\", 1, 1, 1, 1152]", "cuda -keys=cuda,gpu -max_num_threads=1024 -model=unknown -thread_warp_size=32", [-1, 16, 64, 49152, 2147483647, 1024, 8, 32], "", 0, []], [[], [["FU", 1, [0, 1, 2, 3]], ["SP", 1, 0, 1152, [48], 1], ["AN", 1, 0, 5], ["AN", 1, 1, 6]]]], "r": [[2.61057e-06, 2.60331e-06, 2.60394e-06], 0, 3.0521, 1667927953], "v": "v0.6"}
{"i": [["[\"sigmoid\", 1, 1, 1, 1152]", "cuda -keys=cuda,gpu -max_num_threads=1024 -model=unknown -thread_warp_size=32", [-1, 16, 64, 49152, 2147483647, 1024, 8, 32], "", 0, []], [[], [["FU", 1, [0, 1, 2, 3]], ["SP", 1, 0, 1152, [18], 1], ["AN", 1, 0, 5], ["AN", 1, 1, 6]]]], "r": [[2.61503e-06, 2.61024e-06, 2.61302e-06], 0, 3.32649, 1667927953], "v": "v0.6"}
{"i": [["[\"sigmoid\", 1, 1, 1, 1152]", "cuda -keys=cuda,gpu -max_num_threads=1024 -model=unknown -thread_warp_size=32", [-1, 16, 64, 49152, 2147483647, 1024, 8, 32], "", 0, []], [[], [["FU", 1, [0, 1, 2, 3]], ["SP", 1, 0, 1152, [16], 1], ["AN", 1, 0, 5], ["AN", 1, 1, 6]]]], "r": [[2.65124e-06, 2.64318e-06, 2.64089e-06], 0, 3.56901, 1667927954], "v": "v0.6"}
{"i": [["[\"sigmoid\", 1, 1, 1, 1152]", "cuda -keys=cuda,gpu -max_num_threads=1024 -model=unknown -thread_warp_size=32", [-1, 16, 64, 49152, 2147483647, 1024, 8, 32], "", 0, []], [[], [["FU", 1, [0, 1, 2, 3]], ["SP", 1, 0, 1152, [4], 1], ["AN", 1, 0, 5], ["AN", 1, 1, 6]]]], "r": [[2.83861e-06, 2.83739e-06, 2.83631e-06], 0, 3.83163, 1667927954], "v": "v0.6"}
{"i": [["[\"sigmoid\", 1, 1, 1, 1152]", "cuda -keys=cuda,gpu -max_num_threads=1024 -model=unknown -thread_warp_size=32", [-1, 16, 64, 49152, 2147483647, 1024, 8, 32], "", 0, []], [[], [["FU", 1, [0, 1, 2, 3]], ["SP", 1, 0, 1152, [32], 1], ["AN", 1, 0, 5], ["AN", 1, 1, 6]]]], "r": [[2.60217e-06, 2.58931e-06, 2.59082e-06], 0, 4.08753, 1667927954], "v": "v0.6"}
{"i": [["[\"sigmoid\", 1, 1, 1, 1152]", "cuda -keys=cuda,gpu -max_num_threads=1024 -model=unknown -thread_warp_size=32", [-1, 16, 64, 49152, 2147483647, 1024, 8, 32], "", 0, []], [[], [["FU", 1, [0, 1, 2, 3]], ["SP", 1, 0, 1152, [3], 1], ["AN", 1, 0, 5], ["AN", 1, 1, 6]]]], "r": [[2.91502e-06, 2.91475e-06, 2.91431e-06], 0, 4.39052, 1667927955], "v": "v0.6"}
{"i": [["[\"sigmoid\", 1, 1, 1, 1152]", "cuda -keys=cuda,gpu -max_num_threads=1024 -model=unknown -thread_warp_size=32", [-1, 16, 64, 49152, 2147483647, 1024, 8, 32], "", 0, []], [[], [["FU", 1, [0, 1, 2, 3]], ["SP", 1, 0, 1152, [6], 1], ["AN", 1, 0, 5], ["AN", 1, 1, 6]]]], "r": [[2.67756e-06, 2.67481e-06, 2.67591e-06], 0, 0.612676, 1667947063], "v": "v0.6"}
{"i": [["[\"sigmoid\", 1, 1, 1, 1152]", "cuda -keys=cuda,gpu -max_num_threads=1024 -model=unknown -thread_warp_size=32", [-1, 16, 64, 49152, 2147483647, 1024, 8, 32], "", 0, []], [[], [["FU", 1, [0, 1, 2, 3]], ["SP", 1, 0, 1152, [12], 1], ["AN", 1, 0, 5], ["AN", 1, 1, 6]]]], "r": [[2.66643e-06, 2.6566e-06, 2.65534e-06], 0, 2.29523, 1667947065], "v": "v0.6"}
{"i": [["[\"sigmoid\", 1, 1, 1, 1152]", "cuda -keys=cuda,gpu -max_num_threads=1024 -model=unknown -thread_warp_size=32", [-1, 16, 64, 49152, 2147483647, 1024, 8, 32], "", 0, []], [[], [["FU", 1, [0, 1, 2, 3]], ["SP", 1, 0, 1152, [1], 1], ["AN", 1, 0, 5], ["AN", 1, 1, 6]]]], "r": [[3.39124e-06, 3.38635e-06, 3.387e-06], 0, 1.05815, 1667947064], "v": "v0.6"}
{"i": [["[\"sigmoid\", 1, 1, 1, 1152]", "cuda -keys=cuda,gpu -max_num_threads=1024 -model=unknown -thread_warp_size=32", [-1, 16, 64, 49152, 2147483647, 1024, 8, 32], "", 0, []], [[], [["FU", 1, [0, 1, 2, 3]], ["SP", 1, 0, 1152, [2], 1], ["AN", 1, 0, 5], ["AN", 1, 1, 6]]]], "r": [[3.06791e-06, 3.07469e-06, 3.07314e-06], 0, 1.6311, 1667947065], "v": "v0.6"}
{"i": [["[\"sigmoid\", 1, 1, 1, 1152]", "cuda -keys=cuda,gpu -max_num_threads=1024 -model=unknown -thread_warp_size=32", [-1, 16, 64, 49152, 2147483647, 1024, 8, 32], "", 0, []], [[], [["FU", 1, [0, 1, 2, 3]], ["SP", 1, 0, 1152, [32], 1], ["AN", 1, 0, 5], ["AN", 1, 1, 6]]]], "r": [[2.65991e-06, 2.65563e-06, 2.65503e-06], 0, 1.96191, 1667947065], "v": "v0.6"}
{"i": [["[\"sigmoid\", 1, 1, 1, 1152]", "cuda -keys=cuda,gpu -max_num_threads=1024 -model=unknown -thread_warp_size=32", [-1, 16, 64, 49152, 2147483647, 1024, 8, 32], "", 0, []], [[], [["FU", 1, [0, 1, 2, 3]], ["SP", 1, 0, 1152, [3], 1], ["AN", 1, 0, 5], ["AN", 1, 1, 6]]]], "r": [[3.0539e-06, 3.0612e-06, 3.05958e-06], 0, 0.753183, 1667947064], "v": "v0.6"}
{"i": [["[\"sigmoid\", 1, 1, 1, 1152]", "cuda -keys=cuda,gpu -max_num_threads=1024 -model=unknown -thread_warp_size=32", [-1, 16, 64, 49152, 2147483647, 1024, 8, 32], "", 0, []], [[], [["FU", 1, [0, 1, 2, 3]], ["SP", 1, 0, 1152, [16], 1], ["AN", 1, 0, 5], ["AN", 1, 1, 6]]]], "r": [[2.63266e-06, 2.6424e-06, 2.63881e-06], 0, 2.56666, 1667947066], "v": "v0.6"}
{"i": [["[\"sigmoid\", 1, 1, 1, 1152]", "cuda -keys=cuda,gpu -max_num_threads=1024 -model=unknown -thread_warp_size=32", [-1, 16, 64, 49152, 2147483647, 1024, 8, 32], "", 0, []], [[], [["FU", 1, [0, 1, 2, 3]], ["SP", 1, 0, 1152, [48], 1], ["AN", 1, 0, 5], ["AN", 1, 1, 6]]]], "r": [[2.6125e-06, 2.60227e-06, 2.60237e-06], 0, 1.32655, 1667947064], "v": "v0.6"}
{"i": [["[\"sigmoid\", 1, 1, 1, 1152]", "cuda -keys=cuda,gpu -max_num_threads=1024 -model=unknown -thread_warp_size=32", [-1, 16, 64, 49152, 2147483647, 1024, 8, 32], "", 0, []], [[], [["FU", 1, [0, 1, 2, 3]], ["SP", 1, 0, 1152, [18], 1], ["AN", 1, 0, 5], ["AN", 1, 1, 6]]]], "r": [[2.58549e-06, 2.57474e-06, 2.57433e-06], 0, 3.09241, 1667947066], "v": "v0.6"}
{"i": [["[\"sigmoid\", 1, 1, 1, 1152]", "cuda -keys=cuda,gpu -max_num_threads=1024 -model=unknown -thread_warp_size=32", [-1, 16, 64, 49152, 2147483647, 1024, 8, 32], "", 0, []], [[], [["FU", 1, [0, 1, 2, 3]], ["SP", 1, 0, 1152, [36], 1], ["AN", 1, 0, 5], ["AN", 1, 1, 6]]]], "r": [[2.74181e-06, 2.74438e-06, 2.74352e-06], 0, 2.84006, 1667947066], "v": "v0.6"}
{"i": [["[\"sigmoid\", 1, 1, 1, 1152]", "cuda -keys=cuda,gpu -max_num_threads=1024 -model=unknown -thread_warp_size=32", [-1, 16, 64, 49152, 2147483647, 1024, 8, 32], "", 0, []], [[], [["FU", 1, [0, 1, 2, 3]], ["SP", 1, 0, 1152, [9], 1], ["AN", 1, 0, 5], ["AN", 1, 1, 6]]]], "r": [[2.67646e-06, 2.67826e-06, 2.67678e-06], 0, 3.31211, 1667947067], "v": "v0.6"}
{"i": [["[\"sigmoid\", 1, 1, 1, 1152]", "cuda -keys=cuda,gpu -max_num_threads=1024 -model=unknown -thread_warp_size=32", [-1, 16, 64, 49152, 2147483647, 1024, 8, 32], "", 0, []], [[], [["FU", 1, [0, 1, 2, 3]], ["SP", 1, 0, 1152, [24], 1], ["AN", 1, 0, 5], ["AN", 1, 1, 6]]]], "r": [[2.72357e-06, 2.72936e-06, 2.74026e-06], 0, 3.58513, 1667947067], "v": "v0.6"}
{"i": [["[\"sigmoid\", 1, 1, 1, 1152]", "cuda -keys=cuda,gpu -max_num_threads=1024 -model=unknown -thread_warp_size=32", [-1, 16, 64, 49152, 2147483647, 1024, 8, 32], "", 0, []], [[], [["FU", 1, [0, 1, 2, 3]], ["SP", 1, 0, 1152, [64], 1], ["AN", 1, 0, 5], ["AN", 1, 1, 6]]]], "r": [[2.58287e-06, 2.57922e-06, 2.57647e-06], 0, 3.85595, 1667947067], "v": "v0.6"}
{"i": [["[\"sigmoid\", 1, 1, 1, 1152]", "cuda -keys=cuda,gpu -max_num_threads=1024 -model=unknown -thread_warp_size=32", [-1, 16, 64, 49152, 2147483647, 1024, 8, 32], "", 0, []], [[], [["FU", 1, [0, 1, 2, 3]], ["SP", 1, 0, 1152, [4], 1], ["AN", 1, 0, 5], ["AN", 1, 1, 6]]]], "r": [[2.83246e-06, 2.82883e-06, 2.8332e-06], 0, 4.13889, 1667947068], "v": "v0.6"}
{"i": [["[\"sigmoid\", 1, 1, 1, 1152]", "cuda -keys=cuda,gpu -max_num_threads=1024 -model=unknown -thread_warp_size=32", [-1, 16, 64, 49152, 2147483647, 1024, 8, 32], "", 0, []], [[], [["FU", 1, [0, 1, 2, 3]], ["SP", 1, 0, 1152, [8], 1], ["AN", 1, 0, 5], ["AN", 1, 1, 6]]]], "r": [[2.66708e-06, 2.66296e-06, 2.66439e-06], 0, 4.41917, 1667947068], "v": "v0.6"}
{"i": [["[\"sigmoid\", 1, 1, 1, 1152]", "cuda -keys=cuda,gpu -max_num_threads=1024 -model=unknown -thread_warp_size=32", [-1, 16, 64, 49152, 2147483647, 1024, 8, 32], "", 0, []], [[], [["FU", 1, [0, 1, 2, 3]], ["SP", 1, 0, 1152, [3], 1], ["AN", 1, 0, 5], ["AN", 1, 1, 6]]]], "r": [[3.09293e-06, 3.10439e-06, 3.10331e-06], 0, 1.74616, 1667947700], "v": "v0.6"}
{"i": [["[\"sigmoid\", 1, 1, 1, 1152]", "cuda -keys=cuda,gpu -max_num_threads=1024 -model=unknown -thread_warp_size=32", [-1, 16, 64, 49152, 2147483647, 1024, 8, 32], "", 0, []], [[], [["FU", 1, [0, 1, 2, 3]], ["SP", 1, 0, 1152, [36], 1], ["AN", 1, 0, 5], ["AN", 1, 1, 6]]]], "r": [[2.56464e-06, 2.56003e-06, 2.5582e-06], 0, 1.11964, 1667947700], "v": "v0.6"}
{"i": [["[\"sigmoid\", 1, 1, 1, 1152]", "cuda -keys=cuda,gpu -max_num_threads=1024 -model=unknown -thread_warp_size=32", [-1, 16, 64, 49152, 2147483647, 1024, 8, 32], "", 0, []], [[], [["FU", 1, [0, 1, 2, 3]], ["SP", 1, 0, 1152, [16], 1], ["AN", 1, 0, 5], ["AN", 1, 1, 6]]]], "r": [[6.29399e-06, 2.64864e-06, 2.64781e-06], 0, 0.567541, 1667947699], "v": "v0.6"}
{"i": [["[\"sigmoid\", 1, 1, 1, 1152]", "cuda -keys=cuda,gpu -max_num_threads=1024 -model=unknown -thread_warp_size=32", [-1, 16, 64, 49152, 2147483647, 1024, 8, 32], "", 0, []], [[], [["FU", 1, [0, 1, 2, 3]], ["SP", 1, 0, 1152, [18], 1], ["AN", 1, 0, 5], ["AN", 1, 1, 6]]]], "r": [[2.65901e-06, 2.65192e-06, 2.65186e-06], 0, 2.04213, 1667947701], "v": "v0.6"}
{"i": [["[\"sigmoid\", 1, 1, 1, 1152]", "cuda -keys=cuda,gpu -max_num_threads=1024 -model=unknown -thread_warp_size=32", [-1, 16, 64, 49152, 2147483647, 1024, 8, 32], "", 0, []], [[], [["FU", 1, [0, 1, 2, 3]], ["SP", 1, 0, 1152, [2], 1], ["AN", 1, 0, 5], ["AN", 1, 1, 6]]]], "r": [[3.26002e-06, 3.26938e-06, 3.27366e-06], 0, 1.42378, 1667947700], "v": "v0.6"}
{"i": [["[\"sigmoid\", 1, 1, 1, 1152]", "cuda -keys=cuda,gpu -max_num_threads=1024 -model=unknown -thread_warp_size=32", [-1, 16, 64, 49152, 2147483647, 1024, 8, 32], "", 0, []], [[], [["FU", 1, [0, 1, 2, 3]], ["SP", 1, 0, 1152, [64], 1], ["AN", 1, 0, 5], ["AN", 1, 1, 6]]]], "r": [[2.57962e-06, 2.56811e-06, 2.57872e-06], 0, 0.848585, 1667947699], "v": "v0.6"}
{"i": [["[\"sigmoid\", 1, 1, 1, 1152]", "cuda -keys=cuda,gpu -max_num_threads=1024 -model=unknown -thread_warp_size=32", [-1, 16, 64, 49152, 2147483647, 1024, 8, 32], "", 0, []], [[], [["FU", 1, [0, 1, 2, 3]], ["SP", 1, 0, 1152, [9], 1], ["AN", 1, 0, 5], ["AN", 1, 1, 6]]]], "r": [[2.68167e-06, 2.68163e-06, 2.67975e-06], 0, 2.34432, 1667947701], "v": "v0.6"}
{"i": [["[\"sigmoid\", 1, 1, 1, 1152]", "cuda -keys=cuda,gpu -max_num_threads=1024 -model=unknown -thread_warp_size=32", [-1, 16, 64, 49152, 2147483647, 1024, 8, 32], "", 0, []], [[], [["FU", 1, [0, 1, 2, 3]], ["SP", 1, 0, 1152, [8], 1], ["AN", 1, 0, 5], ["AN", 1, 1, 6]]]], "r": [[2.79082e-06, 2.80481e-06, 2.81555e-06], 0, 2.56208, 1667947701], "v": "v0.6"}
{"i": [["[\"sigmoid\", 1, 1, 1, 1152]", "cuda -keys=cuda,gpu -max_num_threads=1024 -model=unknown -thread_warp_size=32", [-1, 16, 64, 49152, 2147483647, 1024, 8, 32], "", 0, []], [[], [["FU", 1, [0, 1, 2, 3]], ["SP", 1, 0, 1152, [4], 1], ["AN", 1, 0, 5], ["AN", 1, 1, 6]]]], "r": [[2.94516e-06, 2.94796e-06, 2.94959e-06], 0, 2.78143, 1667947702], "v": "v0.6"}
{"i": [["[\"sigmoid\", 1, 1, 1, 1152]", "cuda -keys=cuda,gpu -max_num_threads=1024 -model=unknown -thread_warp_size=32", [-1, 16, 64, 49152, 2147483647, 1024, 8, 32], "", 0, []], [[], [["FU", 1, [0, 1, 2, 3]], ["SP", 1, 0, 1152, [6], 1], ["AN", 1, 0, 5], ["AN", 1, 1, 6]]]], "r": [[2.90431e-06, 2.91109e-06, 2.91683e-06], 0, 3.04917, 1667947702], "v": "v0.6"}
{"i": [["[\"sigmoid\", 1, 1, 1, 1152]", "cuda -keys=cuda,gpu -max_num_threads=1024 -model=unknown -thread_warp_size=32", [-1, 16, 64, 49152, 2147483647, 1024, 8, 32], "", 0, []], [[], [["FU", 1, [0, 1, 2, 3]], ["SP", 1, 0, 1152, [12], 1], ["AN", 1, 0, 5], ["AN", 1, 1, 6]]]], "r": [[2.69682e-06, 2.68952e-06, 2.69095e-06], 0, 3.22084, 1667947702], "v": "v0.6"}
{"i": [["[\"sigmoid\", 1, 1, 1, 1152]", "cuda -keys=cuda,gpu -max_num_threads=1024 -model=unknown -thread_warp_size=32", [-1, 16, 64, 49152, 2147483647, 1024, 8, 32], "", 0, []], [[], [["FU", 1, [0, 1, 2, 3]], ["SP", 1, 0, 1152, [48], 1], ["AN", 1, 0, 5], ["AN", 1, 1, 6]]]], "r": [[2.5417e-06, 2.53537e-06, 2.53085e-06], 0, 3.57492, 1667947703], "v": "v0.6"}
{"i": [["[\"sigmoid\", 1, 1, 1, 1152]", "cuda -keys=cuda,gpu -max_num_threads=1024 -model=unknown -thread_warp_size=32", [-1, 16, 64, 49152, 2147483647, 1024, 8, 32], "", 0, []], [[], [["FU", 1, [0, 1, 2, 3]], ["SP", 1, 0, 1152, [32], 1], ["AN", 1, 0, 5], ["AN", 1, 1, 6]]]], "r": [[2.5072e-06, 2.49612e-06, 2.49555e-06], 0, 3.85463, 1667947703], "v": "v0.6"}
{"i": [["[\"sigmoid\", 1, 1, 1, 1152]", "cuda -keys=cuda,gpu -max_num_threads=1024 -model=unknown -thread_warp_size=32", [-1, 16, 64, 49152, 2147483647, 1024, 8, 32], "", 0, []], [[], [["FU", 1, [0, 1, 2, 3]], ["SP", 1, 0, 1152, [24], 1], ["AN", 1, 0, 5], ["AN", 1, 1, 6]]]], "r": [[2.5126e-06, 2.49978e-06, 2.50283e-06], 0, 4.03116, 1667947703], "v": "v0.6"}
{"i": [["[\"sigmoid\", 1, 1, 1, 1152]", "cuda -keys=cuda,gpu -max_num_threads=1024 -model=unknown -thread_warp_size=32", [-1, 16, 64, 49152, 2147483647, 1024, 8, 32], "", 0, []], [[], [["FU", 1, [0, 1, 2, 3]], ["SP", 1, 0, 1152, [1], 1], ["AN", 1, 0, 5], ["AN", 1, 1, 6]]]], "r": [[3.50853e-06, 3.5089e-06, 3.51332e-06], 0, 4.3752, 1667947704], "v": "v0.6"}
{"i": [["[\"sigmoid\", 1, 1, 1, 1152]", "cuda -keys=cuda,gpu -max_num_threads=1024 -model=unknown -thread_warp_size=32", [-1, 16, 64, 49152, 2147483647, 1024, 8, 32], "", 0, []], [[], [["FU", 1, [0, 1, 2, 3]], ["SP", 1, 0, 1152, [64], 1], ["AN", 1, 0, 5], ["AN", 1, 1, 6]]]], "r": [[2.66737e-06, 2.67951e-06, 2.68087e-06], 0, 2.38577, 1667947965], "v": "v0.6"}
{"i": [["[\"sigmoid\", 1, 1, 1, 1152]", "cuda -keys=cuda,gpu -max_num_threads=1024 -model=unknown -thread_warp_size=32", [-1, 16, 64, 49152, 2147483647, 1024, 8, 32], "", 0, []], [[], [["FU", 1, [0, 1, 2, 3]], ["SP", 1, 0, 1152, [4], 1], ["AN", 1, 0, 5], ["AN", 1, 1, 6]]]], "r": [[2.83483e-06, 2.84954e-06, 2.84933e-06], 0, 1.50497, 1667947964], "v": "v0.6"}
{"i": [["[\"sigmoid\", 1, 1, 1, 1152]", "cuda -keys=cuda,gpu -max_num_threads=1024 -model=unknown -thread_warp_size=32", [-1, 16, 64, 49152, 2147483647, 1024, 8, 32], "", 0, []], [[], [["FU", 1, [0, 1, 2, 3]], ["SP", 1, 0, 1152, [8], 1], ["AN", 1, 0, 5], ["AN", 1, 1, 6]]]], "r": [[2.68156e-06, 2.68037e-06, 2.67927e-06], 0, 0.606266, 1667947963], "v": "v0.6"}
{"i": [["[\"sigmoid\", 1, 1, 1, 1152]", "cuda -keys=cuda,gpu -max_num_threads=1024 -model=unknown -thread_warp_size=32", [-1, 16, 64, 49152, 2147483647, 1024, 8, 32], "", 0, []], [[], [["FU", 1, [0, 1, 2, 3]], ["SP", 1, 0, 1152, [32], 1], ["AN", 1, 0, 5], ["AN", 1, 1, 6]]]], "r": [[2.53208e-06, 2.52533e-06, 2.52181e-06], 0, 2.07327, 1667947965], "v": "v0.6"}
{"i": [["[\"sigmoid\", 1, 1, 1, 1152]", "cuda -keys=cuda,gpu -max_num_threads=1024 -model=unknown -thread_warp_size=32", [-1, 16, 64, 49152, 2147483647, 1024, 8, 32], "", 0, []], [[], [["FU", 1, [0, 1, 2, 3]], ["SP", 1, 0, 1152, [24], 1], ["AN", 1, 0, 5], ["AN", 1, 1, 6]]]], "r": [[2.72942e-06, 2.74436e-06, 2.74407e-06], 0, 1.20631, 1667947964], "v": "v0.6"}
{"i": [["[\"sigmoid\", 1, 1, 1, 1152]", "cuda -keys=cuda,gpu -max_num_threads=1024 -model=unknown -thread_warp_size=32", [-1, 16, 64, 49152, 2147483647, 1024, 8, 32], "", 0, []], [[], [["FU", 1, [0, 1, 2, 3]], ["SP", 1, 0, 1152, [12], 1], ["AN", 1, 0, 5], ["AN", 1, 1, 6]]]], "r": [[2.69099e-06, 2.68799e-06, 2.68547e-06], 0, 0.871419, 1667947964], "v": "v0.6"}
{"i": [["[\"sigmoid\", 1, 1, 1, 1152]", "cuda -keys=cuda,gpu -max_num_threads=1024 -model=unknown -thread_warp_size=32", [-1, 16, 64, 49152, 2147483647, 1024, 8, 32], "", 0, []], [[], [["FU", 1, [0, 1, 2, 3]], ["SP", 1, 0, 1152, [9], 1], ["AN", 1, 0, 5], ["AN", 1, 1, 6]]]], "r": [[2.66388e-06, 2.66207e-06, 2.66228e-06], 0, 1.71928, 1667947965], "v": "v0.6"}
{"i": [["[\"sigmoid\", 1, 1, 1, 1152]", "cuda -keys=cuda,gpu -max_num_threads=1024 -model=unknown -thread_warp_size=32", [-1, 16, 64, 49152, 2147483647, 1024, 8, 32], "", 0, []], [[], [["FU", 1, [0, 1, 2, 3]], ["SP", 1, 0, 1152, [48], 1], ["AN", 1, 0, 5], ["AN", 1, 1, 6]]]], "r": [[2.5369e-06, 2.52592e-06, 2.52726e-06], 0, 2.55519, 1667947966], "v": "v0.6"}
{"i": [["[\"sigmoid\", 1, 1, 1, 1152]", "cuda -keys=cuda,gpu -max_num_threads=1024 -model=unknown -thread_warp_size=32", [-1, 16, 64, 49152, 2147483647, 1024, 8, 32], "", 0, []], [[], [["FU", 1, [0, 1, 2, 3]], ["SP", 1, 0, 1152, [6], 1], ["AN", 1, 0, 5], ["AN", 1, 1, 6]]]], "r": [[2.88618e-06, 2.88793e-06, 2.8967e-06], 0, 2.87593, 1667947966], "v": "v0.6"}
{"i": [["[\"sigmoid\", 1, 1, 1, 1152]", "cuda -keys=cuda,gpu -max_num_threads=1024 -model=unknown -thread_warp_size=32", [-1, 16, 64, 49152, 2147483647, 1024, 8, 32], "", 0, []], [[], [["FU", 1, [0, 1, 2, 3]], ["SP", 1, 0, 1152, [1], 1], ["AN", 1, 0, 5], ["AN", 1, 1, 6]]]], "r": [[3.6485e-06, 3.66143e-06, 3.6617e-06], 0, 3.06183, 1667947966], "v": "v0.6"}
{"i": [["[\"sigmoid\", 1, 1, 1, 1152]", "cuda -keys=cuda,gpu -max_num_threads=1024 -model=unknown -thread_warp_size=32", [-1, 16, 64, 49152, 2147483647, 1024, 8, 32], "", 0, []], [[], [["FU", 1, [0, 1, 2, 3]], ["SP", 1, 0, 1152, [36], 1], ["AN", 1, 0, 5], ["AN", 1, 1, 6]]]], "r": [[2.58483e-06, 2.61492e-06, 2.62098e-06], 0, 3.3369, 1667947967], "v": "v0.6"}
{"i": [["[\"sigmoid\", 1, 1, 1, 1152]", "cuda -keys=cuda,gpu -max_num_threads=1024 -model=unknown -thread_warp_size=32", [-1, 16, 64, 49152, 2147483647, 1024, 8, 32], "", 0, []], [[], [["FU", 1, [0, 1, 2, 3]], ["SP", 1, 0, 1152, [16], 1], ["AN", 1, 0, 5], ["AN", 1, 1, 6]]]], "r": [[2.71279e-06, 2.71189e-06, 2.72505e-06], 0, 3.63409, 1667947967], "v": "v0.6"}
{"i": [["[\"sigmoid\", 1, 1, 1, 1152]", "cuda -keys=cuda,gpu -max_num_threads=1024 -model=unknown -thread_warp_size=32", [-1, 16, 64, 49152, 2147483647, 1024, 8, 32], "", 0, []], [[], [["FU", 1, [0, 1, 2, 3]], ["SP", 1, 0, 1152, [18], 1], ["AN", 1, 0, 5], ["AN", 1, 1, 6]]]], "r": [[2.67207e-06, 2.66718e-06, 2.66615e-06], 0, 4.1623, 1667947968], "v": "v0.6"}
{"i": [["[\"sigmoid\", 1, 1, 1, 1152]", "cuda -keys=cuda,gpu -max_num_threads=1024 -model=unknown -thread_warp_size=32", [-1, 16, 64, 49152, 2147483647, 1024, 8, 32], "", 0, []], [[], [["FU", 1, [0, 1, 2, 3]], ["SP", 1, 0, 1152, [3], 1], ["AN", 1, 0, 5], ["AN", 1, 1, 6]]]], "r": [[2.9102e-06, 2.90397e-06, 2.90416e-06], 0, 3.8877, 1667947967], "v": "v0.6"}
{"i": [["[\"sigmoid\", 1, 1, 1, 1152]", "cuda -keys=cuda,gpu -max_num_threads=1024 -model=unknown -thread_warp_size=32", [-1, 16, 64, 49152, 2147483647, 1024, 8, 32], "", 0, []], [[], [["FU", 1, [0, 1, 2, 3]], ["SP", 1, 0, 1152, [2], 1], ["AN", 1, 0, 5], ["AN", 1, 1, 6]]]], "r": [[3.02714e-06, 3.02479e-06, 3.02622e-06], 0, 4.45378, 1667947968], "v": "v0.6"}
{"i": [["[\"sigmoid\", 1, 1, 1, 1152]", "cuda -keys=cuda,gpu -max_num_threads=1024 -model=unknown -thread_warp_size=32", [-1, 16, 64, 49152, 2147483647, 1024, 8, 32], "", 0, []], [[], [["FU", 1, [0, 1, 2, 3]], ["SP", 1, 0, 1152, [4], 1], ["AN", 1, 0, 5], ["AN", 1, 1, 6]]]], "r": [[2.87953e-06, 2.87783e-06, 2.8734e-06], 0, 1.17099, 1667948528], "v": "v0.6"}
{"i": [["[\"sigmoid\", 1, 1, 1, 1152]", "cuda -keys=cuda,gpu -max_num_threads=1024 -model=unknown -thread_warp_size=32", [-1, 16, 64, 49152, 2147483647, 1024, 8, 32], "", 0, []], [[], [["FU", 1, [0, 1, 2, 3]], ["SP", 1, 0, 1152, [1], 1], ["AN", 1, 0, 5], ["AN", 1, 1, 6]]]], "r": [[3.44808e-06, 3.45519e-06, 3.45173e-06], 0, 0.8611, 1667948528], "v": "v0.6"}
{"i": [["[\"sigmoid\", 1, 1, 1, 1152]", "cuda -keys=cuda,gpu -max_num_threads=1024 -model=unknown -thread_warp_size=32", [-1, 16, 64, 49152, 2147483647, 1024, 8, 32], "", 0, []], [[], [["FU", 1, [0, 1, 2, 3]], ["SP", 1, 0, 1152, [8], 1], ["AN", 1, 0, 5], ["AN", 1, 1, 6]]]], "r": [[2.79325e-06, 2.81505e-06, 2.81523e-06], 0, 0.580319, 1667948528], "v": "v0.6"}
{"i": [["[\"sigmoid\", 1, 1, 1, 1152]", "cuda -keys=cuda,gpu -max_num_threads=1024 -model=unknown -thread_warp_size=32", [-1, 16, 64, 49152, 2147483647, 1024, 8, 32], "", 0, []], [[], [["FU", 1, [0, 1, 2, 3]], ["SP", 1, 0, 1152, [3], 1], ["AN", 1, 0, 5], ["AN", 1, 1, 6]]]], "r": [[2.90624e-06, 2.90668e-06, 2.90647e-06], 0, 1.76956, 1667948529], "v": "v0.6"}
{"i": [["[\"sigmoid\", 1, 1, 1, 1152]", "cuda -keys=cuda,gpu -max_num_threads=1024 -model=unknown -thread_warp_size=32", [-1, 16, 64, 49152, 2147483647, 1024, 8, 32], "", 0, []], [[], [["FU", 1, [0, 1, 2, 3]], ["SP", 1, 0, 1152, [12], 1], ["AN", 1, 0, 5], ["AN", 1, 1, 6]]]], "r": [[2.7528e-06, 2.7466e-06, 2.74454e-06], 0, 2.08837, 1667948529], "v": "v0.6"}
{"i": [["[\"sigmoid\", 1, 1, 1, 1152]", "cuda -keys=cuda,gpu -max_num_threads=1024 -model=unknown -thread_warp_size=32", [-1, 16, 64, 49152, 2147483647, 1024, 8, 32], "", 0, []], [[], [["FU", 1, [0, 1, 2, 3]], ["SP", 1, 0, 1152, [24], 1], ["AN", 1, 0, 5], ["AN", 1, 1, 6]]]], "r": [[2.68384e-06, 2.67722e-06, 2.68018e-06], 0, 1.43829, 1667948529], "v": "v0.6"}
{"i": [["[\"sigmoid\", 1, 1, 1, 1152]", "cuda -keys=cuda,gpu -max_num_threads=1024 -model=unknown -thread_warp_size=32", [-1, 16, 64, 49152, 2147483647, 1024, 8, 32], "", 0, []], [[], [["FU", 1, [0, 1, 2, 3]], ["SP", 1, 0, 1152, [2], 1], ["AN", 1, 0, 5], ["AN", 1, 1, 6]]]], "r": [[3.26314e-06, 3.27396e-06, 3.27407e-06], 0, 2.29943, 1667948530], "v": "v0.6"}
{"i": [["[\"sigmoid\", 1, 1, 1, 1152]", "cuda -keys=cuda,gpu -max_num_threads=1024 -model=unknown -thread_warp_size=32", [-1, 16, 64, 49152, 2147483647, 1024, 8, 32], "", 0, []], [[], [["FU", 1, [0, 1, 2, 3]], ["SP", 1, 0, 1152, [9], 1], ["AN", 1, 0, 5], ["AN", 1, 1, 6]]]], "r": [[2.69872e-06, 2.69652e-06, 2.69494e-06], 0, 2.52115, 1667948530], "v": "v0.6"}
{"i": [["[\"sigmoid\", 1, 1, 1, 1152]", "cuda -keys=cuda,gpu -max_num_threads=1024 -model=unknown -thread_warp_size=32", [-1, 16, 64, 49152, 2147483647, 1024, 8, 32], "", 0, []], [[], [["FU", 1, [0, 1, 2, 3]], ["SP", 1, 0, 1152, [36], 1], ["AN", 1, 0, 5], ["AN", 1, 1, 6]]]], "r": [[2.65462e-06, 2.6459e-06, 2.65105e-06], 0, 2.82604, 1667948530], "v": "v0.6"}
{"i": [["[\"sigmoid\", 1, 1, 1, 1152]", "cuda -keys=cuda,gpu -max_num_threads=1024 -model=unknown -thread_warp_size=32", [-1, 16, 64, 49152, 2147483647, 1024, 8, 32], "", 0, []], [[], [["FU", 1, [0, 1, 2, 3]], ["SP", 1, 0, 1152, [18], 1], ["AN", 1, 0, 5], ["AN", 1, 1, 6]]]], "r": [[2.62465e-06, 2.62149e-06, 2.6214e-06], 0, 3.07472, 1667948531], "v": "v0.6"}
{"i": [["[\"sigmoid\", 1, 1, 1, 1152]", "cuda -keys=cuda,gpu -max_num_threads=1024 -model=unknown -thread_warp_size=32", [-1, 16, 64, 49152, 2147483647, 1024, 8, 32], "", 0, []], [[], [["FU", 1, [0, 1, 2, 3]], ["SP", 1, 0, 1152, [32], 1], ["AN", 1, 0, 5], ["AN", 1, 1, 6]]]], "r": [[2.59847e-06, 2.58922e-06, 2.59107e-06], 0, 3.34804, 1667948531], "v": "v0.6"}
{"i": [["[\"sigmoid\", 1, 1, 1, 1152]", "cuda -keys=cuda,gpu -max_num_threads=1024 -model=unknown -thread_warp_size=32", [-1, 16, 64, 49152, 2147483647, 1024, 8, 32], "", 0, []], [[], [["FU", 1, [0, 1, 2, 3]], ["SP", 1, 0, 1152, [64], 1], ["AN", 1, 0, 5], ["AN", 1, 1, 6]]]], "r": [[2.53464e-06, 2.52263e-06, 2.52797e-06], 0, 3.64684, 1667948531], "v": "v0.6"}
{"i": [["[\"sigmoid\", 1, 1, 1, 1152]", "cuda -keys=cuda,gpu -max_num_threads=1024 -model=unknown -thread_warp_size=32", [-1, 16, 64, 49152, 2147483647, 1024, 8, 32], "", 0, []], [[], [["FU", 1, [0, 1, 2, 3]], ["SP", 1, 0, 1152, [6], 1], ["AN", 1, 0, 5], ["AN", 1, 1, 6]]]], "r": [[2.88673e-06, 2.90283e-06, 2.90614e-06], 0, 3.89013, 1667948532], "v": "v0.6"}
{"i": [["[\"sigmoid\", 1, 1, 1, 1152]", "cuda -keys=cuda,gpu -max_num_threads=1024 -model=unknown -thread_warp_size=32", [-1, 16, 64, 49152, 2147483647, 1024, 8, 32], "", 0, []], [[], [["FU", 1, [0, 1, 2, 3]], ["SP", 1, 0, 1152, [48], 1], ["AN", 1, 0, 5], ["AN", 1, 1, 6]]]], "r": [[2.60014e-06, 2.59195e-06, 2.59165e-06], 0, 4.13728, 1667948532], "v": "v0.6"}
{"i": [["[\"sigmoid\", 1, 1, 1, 1152]", "cuda -keys=cuda,gpu -max_num_threads=1024 -model=unknown -thread_warp_size=32", [-1, 16, 64, 49152, 2147483647, 1024, 8, 32], "", 0, []], [[], [["FU", 1, [0, 1, 2, 3]], ["SP", 1, 0, 1152, [16], 1], ["AN", 1, 0, 5], ["AN", 1, 1, 6]]]], "r": [[2.65043e-06, 2.6468e-06, 2.6453e-06], 0, 4.42074, 1667948532], "v": "v0.6"}
