python/models/efficientnet/VertiFusionEfficientNet_kernel_configs/efficient_mul_1_14_14_672.log
{"i": [["[\"mul\", 1, 14, 14, 672]", "cuda -keys=cuda,gpu -max_num_threads=1024 -model=unknown -thread_warp_size=32", [-1, 16, 64, 49152, 2147483647, 1024, 8, 32], "", 0, []], [[], [["FU", 2, [0, 1, 2, 3]], ["SP", 2, 0, 131712, [32], 1], ["AN", 2, 0, 5], ["AN", 2, 1, 6]]]], "r": [[5.66481e-06, 5.664e-06, 5.66679e-06], 0, 2.14243, 1667927163], "v": "v0.6"}
{"i": [["[\"mul\", 1, 14, 14, 672]", "cuda -keys=cuda,gpu -max_num_threads=1024 -model=unknown -thread_warp_size=32", [-1, 16, 64, 49152, 2147483647, 1024, 8, 32], "", 0, []], [[], [["FU", 2, [0, 1, 2, 3]], ["SP", 2, 0, 131712, [48], 1], ["AN", 2, 0, 5], ["AN", 2, 1, 6]]]], "r": [[4.57965e-06, 4.58594e-06, 4.58657e-06], 0, 0.879719, 1667927161], "v": "v0.6"}
{"i": [["[\"mul\", 1, 14, 14, 672]", "cuda -keys=cuda,gpu -max_num_threads=1024 -model=unknown -thread_warp_size=32", [-1, 16, 64, 49152, 2147483647, 1024, 8, 32], "", 0, []], [[], [["FU", 2, [0, 1, 2, 3]], ["SP", 2, 0, 131712, [1], 1], ["AN", 2, 0, 5], ["AN", 2, 1, 6]]]], "r": [[0.000100379, 0.000100357, 0.000100367], 0, 1.80541, 1667927162], "v": "v0.6"}
{"i": [["[\"mul\", 1, 14, 14, 672]", "cuda -keys=cuda,gpu -max_num_threads=1024 -model=unknown -thread_warp_size=32", [-1, 16, 64, 49152, 2147483647, 1024, 8, 32], "", 0, []], [[], [["FU", 2, [0, 1, 2, 3]], ["SP", 2, 0, 131712, [16], 1], ["AN", 2, 0, 5], ["AN", 2, 1, 6]]]], "r": [[8.70955e-06, 8.71261e-06, 8.71076e-06], 0, 2.37185, 1667927163], "v": "v0.6"}
{"i": [["[\"mul\", 1, 14, 14, 672]", "cuda -keys=cuda,gpu -max_num_threads=1024 -model=unknown -thread_warp_size=32", [-1, 16, 64, 49152, 2147483647, 1024, 8, 32], "", 0, []], [[], [["FU", 2, [0, 1, 2, 3]], ["SP", 2, 0, 131712, [64], 1], ["AN", 2, 0, 5], ["AN", 2, 1, 6]]]], "r": [[4.25364e-06, 4.25076e-06, 4.25032e-06], 0, 1.1651, 1667927162], "v": "v0.6"}
{"i": [["[\"mul\", 1, 14, 14, 672]", "cuda -keys=cuda,gpu -max_num_threads=1024 -model=unknown -thread_warp_size=32", [-1, 16, 64, 49152, 2147483647, 1024, 8, 32], "", 0, []], [[], [["FU", 2, [0, 1, 2, 3]], ["SP", 2, 0, 131712, [42], 1], ["AN", 2, 0, 5], ["AN", 2, 1, 6]]]], "r": [[5.04339e-06, 5.04225e-06, 5.03275e-06], 0, 1.52527, 1667927162], "v": "v0.6"}
{"i": [["[\"mul\", 1, 14, 14, 672]", "cuda -keys=cuda,gpu -max_num_threads=1024 -model=unknown -thread_warp_size=32", [-1, 16, 64, 49152, 2147483647, 1024, 8, 32], "", 0, []], [[], [["FU", 2, [0, 1, 2, 3]], ["SP", 2, 0, 131712, [4], 1], ["AN", 2, 0, 5], ["AN", 2, 1, 6]]]], "r": [[2.73254e-05, 2.73239e-05, 2.73151e-05], 0, 0.634303, 1667927161], "v": "v0.6"}
{"i": [["[\"mul\", 1, 14, 14, 672]", "cuda -keys=cuda,gpu -max_num_threads=1024 -model=unknown -thread_warp_size=32", [-1, 16, 64, 49152, 2147483647, 1024, 8, 32], "", 0, []], [[], [["FU", 2, [0, 1, 2, 3]], ["SP", 2, 0, 131712, [28], 1], ["AN", 2, 0, 5], ["AN", 2, 1, 6]]]], "r": [[6.31543e-06, 6.32341e-06, 6.31914e-06], 0, 2.64565, 1667927163], "v": "v0.6"}
{"i": [["[\"mul\", 1, 14, 14, 672]", "cuda -keys=cuda,gpu -max_num_threads=1024 -model=unknown -thread_warp_size=32", [-1, 16, 64, 49152, 2147483647, 1024, 8, 32], "", 0, []], [[], [["FU", 2, [0, 1, 2, 3]], ["SP", 2, 0, 131712, [7], 1], ["AN", 2, 0, 5], ["AN", 2, 1, 6]]]], "r": [[1.67564e-05, 1.67491e-05, 1.6759e-05], 0, 3.16831, 1667927164], "v": "v0.6"}
{"i": [["[\"mul\", 1, 14, 14, 672]", "cuda -keys=cuda,gpu -max_num_threads=1024 -model=unknown -thread_warp_size=32", [-1, 16, 64, 49152, 2147483647, 1024, 8, 32], "", 0, []], [[], [["FU", 2, [0, 1, 2, 3]], ["SP", 2, 0, 131712, [6], 1], ["AN", 2, 0, 5], ["AN", 2, 1, 6]]]], "r": [[1.91313e-05, 1.91151e-05, 1.91112e-05], 0, 2.79874, 1667927164], "v": "v0.6"}
{"i": [["[\"mul\", 1, 14, 14, 672]", "cuda -keys=cuda,gpu -max_num_threads=1024 -model=unknown -thread_warp_size=32", [-1, 16, 64, 49152, 2147483647, 1024, 8, 32], "", 0, []], [[], [["FU", 2, [0, 1, 2, 3]], ["SP", 2, 0, 131712, [24], 1], ["AN", 2, 0, 5], ["AN", 2, 1, 6]]]], "r": [[6.93085e-06, 6.92686e-06, 6.92817e-06], 0, 3.42152, 1667927164], "v": "v0.6"}
{"i": [["[\"mul\", 1, 14, 14, 672]", "cuda -keys=cuda,gpu -max_num_threads=1024 -model=unknown -thread_warp_size=32", [-1, 16, 64, 49152, 2147483647, 1024, 8, 32], "", 0, []], [[], [["FU", 2, [0, 1, 2, 3]], ["SP", 2, 0, 131712, [2], 1], ["AN", 2, 0, 5], ["AN", 2, 1, 6]]]], "r": [[5.16348e-05, 5.1627e-05, 5.16362e-05], 0, 3.61517, 1667927165], "v": "v0.6"}
{"i": [["[\"mul\", 1, 14, 14, 672]", "cuda -keys=cuda,gpu -max_num_threads=1024 -model=unknown -thread_warp_size=32", [-1, 16, 64, 49152, 2147483647, 1024, 8, 32], "", 0, []], [[], [["FU", 2, [0, 1, 2, 3]], ["SP", 2, 0, 131712, [12], 1], ["AN", 2, 0, 5], ["AN", 2, 1, 6]]]], "r": [[1.08701e-05, 1.08669e-05, 1.08699e-05], 0, 4.17201, 1667927165], "v": "v0.6"}
{"i": [["[\"mul\", 1, 14, 14, 672]", "cuda -keys=cuda,gpu -max_num_threads=1024 -model=unknown -thread_warp_size=32", [-1, 16, 64, 49152, 2147483647, 1024, 8, 32], "", 0, []], [[], [["FU", 2, [0, 1, 2, 3]], ["SP", 2, 0, 131712, [3], 1], ["AN", 2, 0, 5], ["AN", 2, 1, 6]]]], "r": [[3.5266e-05, 3.5236e-05, 3.52275e-05], 0, 3.8806, 1667927165], "v": "v0.6"}
{"i": [["[\"mul\", 1, 14, 14, 672]", "cuda -keys=cuda,gpu -max_num_threads=1024 -model=unknown -thread_warp_size=32", [-1, 16, 64, 49152, 2147483647, 1024, 8, 32], "", 0, []], [[], [["FU", 2, [0, 1, 2, 3]], ["SP", 2, 0, 131712, [49], 1], ["AN", 2, 0, 5], ["AN", 2, 1, 6]]]], "r": [[4.59491e-06, 4.59052e-06, 4.585e-06], 0, 4.43759, 1667927166], "v": "v0.6"}
{"i": [["[\"mul\", 1, 14, 14, 672]", "cuda -keys=cuda,gpu -max_num_threads=1024 -model=unknown -thread_warp_size=32", [-1, 16, 64, 49152, 2147483647, 1024, 8, 32], "", 0, []], [[], [["FU", 2, [0, 1, 2, 3]], ["SP", 2, 0, 131712, [8], 1], ["AN", 2, 0, 5], ["AN", 2, 1, 6]]]], "r": [[1.4931e-05, 1.49281e-05, 1.49312e-05], 0, 4.70494, 1667927166], "v": "v0.6"}
{"i": [["[\"mul\", 1, 14, 14, 672]", "cuda -keys=cuda,gpu -max_num_threads=1024 -model=unknown -thread_warp_size=32", [-1, 16, 64, 49152, 2147483647, 1024, 8, 32], "", 0, []], [[], [["FU", 2, [0, 1, 2, 3]], ["SP", 2, 0, 131712, [56], 1], ["AN", 2, 0, 5], ["AN", 2, 1, 6]]]], "r": [[4.45553e-06, 4.45881e-06, 4.45625e-06], 0, 4.98435, 1667927166], "v": "v0.6"}
{"i": [["[\"mul\", 1, 14, 14, 672]", "cuda -keys=cuda,gpu -max_num_threads=1024 -model=unknown -thread_warp_size=32", [-1, 16, 64, 49152, 2147483647, 1024, 8, 32], "", 0, []], [[], [["FU", 2, [0, 1, 2, 3]], ["SP", 2, 0, 131712, [21], 1], ["AN", 2, 0, 5], ["AN", 2, 1, 6]]]], "r": [[7.4043e-06, 7.40101e-06, 7.40341e-06], 0, 5.23192, 1667927167], "v": "v0.6"}
{"i": [["[\"mul\", 1, 14, 14, 672]", "cuda -keys=cuda,gpu -max_num_threads=1024 -model=unknown -thread_warp_size=32", [-1, 16, 64, 49152, 2147483647, 1024, 8, 32], "", 0, []], [[], [["FU", 2, [0, 1, 2, 3]], ["SP", 2, 0, 131712, [14], 1], ["AN", 2, 0, 5], ["AN", 2, 1, 6]]]], "r": [[9.6849e-06, 9.67821e-06, 9.69398e-06], 0, 5.48638, 1667927167], "v": "v0.6"}
{"i": [["[\"mul\", 1, 14, 14, 672]", "cuda -keys=cuda,gpu -max_num_threads=1024 -model=unknown -thread_warp_size=32", [-1, 16, 64, 49152, 2147483647, 1024, 8, 32], "", 0, []], [[], [["FU", 2, [0, 1, 2, 3]], ["SP", 2, 0, 131712, [6], 1], ["AN", 2, 0, 5], ["AN", 2, 1, 6]]]], "r": [[1.92136e-05, 1.92099e-05, 1.92078e-05], 0, 1.56204, 1667927253], "v": "v0.6"}
{"i": [["[\"mul\", 1, 14, 14, 672]", "cuda -keys=cuda,gpu -max_num_threads=1024 -model=unknown -thread_warp_size=32", [-1, 16, 64, 49152, 2147483647, 1024, 8, 32], "", 0, []], [[], [["FU", 2, [0, 1, 2, 3]], ["SP", 2, 0, 131712, [3], 1], ["AN", 2, 0, 5], ["AN", 2, 1, 6]]]], "r": [[3.53449e-05, 3.53435e-05, 3.53416e-05], 0, 0.841386, 1667927252], "v": "v0.6"}
{"i": [["[\"mul\", 1, 14, 14, 672]", "cuda -keys=cuda,gpu -max_num_threads=1024 -model=unknown -thread_warp_size=32", [-1, 16, 64, 49152, 2147483647, 1024, 8, 32], "", 0, []], [[], [["FU", 2, [0, 1, 2, 3]], ["SP", 2, 0, 131712, [1], 1], ["AN", 2, 0, 5], ["AN", 2, 1, 6]]]], "r": [[0.000100316, 0.000100338, 0.000100328], 0, 2.12369, 1667927253], "v": "v0.6"}
{"i": [["[\"mul\", 1, 14, 14, 672]", "cuda -keys=cuda,gpu -max_num_threads=1024 -model=unknown -thread_warp_size=32", [-1, 16, 64, 49152, 2147483647, 1024, 8, 32], "", 0, []], [[], [["FU", 2, [0, 1, 2, 3]], ["SP", 2, 0, 131712, [64], 1], ["AN", 2, 0, 5], ["AN", 2, 1, 6]]]], "r": [[4.25153e-06, 4.25197e-06, 4.24826e-06], 0, 2.41874, 1667927254], "v": "v0.6"}
{"i": [["[\"mul\", 1, 14, 14, 672]", "cuda -keys=cuda,gpu -max_num_threads=1024 -model=unknown -thread_warp_size=32", [-1, 16, 64, 49152, 2147483647, 1024, 8, 32], "", 0, []], [[], [["FU", 2, [0, 1, 2, 3]], ["SP", 2, 0, 131712, [49], 1], ["AN", 2, 0, 5], ["AN", 2, 1, 6]]]], "r": [[4.62773e-06, 4.61753e-06, 4.62492e-06], 0, 1.20494, 1667927252], "v": "v0.6"}
{"i": [["[\"mul\", 1, 14, 14, 672]", "cuda -keys=cuda,gpu -max_num_threads=1024 -model=unknown -thread_warp_size=32", [-1, 16, 64, 49152, 2147483647, 1024, 8, 32], "", 0, []], [[], [["FU", 2, [0, 1, 2, 3]], ["SP", 2, 0, 131712, [4], 1], ["AN", 2, 0, 5], ["AN", 2, 1, 6]]]], "r": [[2.71236e-05, 2.71214e-05, 4.70602e-05], 0, 0.636976, 1667927252], "v": "v0.6"}
{"i": [["[\"mul\", 1, 14, 14, 672]", "cuda -keys=cuda,gpu -max_num_threads=1024 -model=unknown -thread_warp_size=32", [-1, 16, 64, 49152, 2147483647, 1024, 8, 32], "", 0, []], [[], [["FU", 2, [0, 1, 2, 3]], ["SP", 2, 0, 131712, [24], 1], ["AN", 2, 0, 5], ["AN", 2, 1, 6]]]], "r": [[6.63619e-06, 6.63734e-06, 6.64066e-06], 0, 1.79676, 1667927253], "v": "v0.6"}
{"i": [["[\"mul\", 1, 14, 14, 672]", "cuda -keys=cuda,gpu -max_num_threads=1024 -model=unknown -thread_warp_size=32", [-1, 16, 64, 49152, 2147483647, 1024, 8, 32], "", 0, []], [[], [["FU", 2, [0, 1, 2, 3]], ["SP", 2, 0, 131712, [7], 1], ["AN", 2, 0, 5], ["AN", 2, 1, 6]]]], "r": [[1.67032e-05, 1.67033e-05, 1.67063e-05], 0, 2.74753, 1667927254], "v": "v0.6"}
{"i": [["[\"mul\", 1, 14, 14, 672]", "cuda -keys=cuda,gpu -max_num_threads=1024 -model=unknown -thread_warp_size=32", [-1, 16, 64, 49152, 2147483647, 1024, 8, 32], "", 0, []], [[], [["FU", 2, [0, 1, 2, 3]], ["SP", 2, 0, 131712, [12], 1], ["AN", 2, 0, 5], ["AN", 2, 1, 6]]]], "r": [[1.10212e-05, 1.10292e-05, 1.10232e-05], 0, 2.97427, 1667927254], "v": "v0.6"}
{"i": [["[\"mul\", 1, 14, 14, 672]", "cuda -keys=cuda,gpu -max_num_threads=1024 -model=unknown -thread_warp_size=32", [-1, 16, 64, 49152, 2147483647, 1024, 8, 32], "", 0, []], [[], [["FU", 2, [0, 1, 2, 3]], ["SP", 2, 0, 131712, [56], 1], ["AN", 2, 0, 5], ["AN", 2, 1, 6]]]], "r": [[4.35826e-06, 4.35886e-06, 4.35517e-06], 0, 3.2536, 1667927255], "v": "v0.6"}
{"i": [["[\"mul\", 1, 14, 14, 672]", "cuda -keys=cuda,gpu -max_num_threads=1024 -model=unknown -thread_warp_size=32", [-1, 16, 64, 49152, 2147483647, 1024, 8, 32], "", 0, []], [[], [["FU", 2, [0, 1, 2, 3]], ["SP", 2, 0, 131712, [8], 1], ["AN", 2, 0, 5], ["AN", 2, 1, 6]]]], "r": [[1.50216e-05, 1.50211e-05, 1.50169e-05], 0, 3.76935, 1667927255], "v": "v0.6"}
{"i": [["[\"mul\", 1, 14, 14, 672]", "cuda -keys=cuda,gpu -max_num_threads=1024 -model=unknown -thread_warp_size=32", [-1, 16, 64, 49152, 2147483647, 1024, 8, 32], "", 0, []], [[], [["FU", 2, [0, 1, 2, 3]], ["SP", 2, 0, 131712, [2], 1], ["AN", 2, 0, 5], ["AN", 2, 1, 6]]]], "r": [[5.15629e-05, 5.15524e-05, 5.15721e-05], 0, 3.51194, 1667927255], "v": "v0.6"}
{"i": [["[\"mul\", 1, 14, 14, 672]", "cuda -keys=cuda,gpu -max_num_threads=1024 -model=unknown -thread_warp_size=32", [-1, 16, 64, 49152, 2147483647, 1024, 8, 32], "", 0, []], [[], [["FU", 2, [0, 1, 2, 3]], ["SP", 2, 0, 131712, [48], 1], ["AN", 2, 0, 5], ["AN", 2, 1, 6]]]], "r": [[4.63789e-06, 4.6353e-06, 4.63649e-06], 0, 4.05749, 1667927256], "v": "v0.6"}
{"i": [["[\"mul\", 1, 14, 14, 672]", "cuda -keys=cuda,gpu -max_num_threads=1024 -model=unknown -thread_warp_size=32", [-1, 16, 64, 49152, 2147483647, 1024, 8, 32], "", 0, []], [[], [["FU", 2, [0, 1, 2, 3]], ["SP", 2, 0, 131712, [14], 1], ["AN", 2, 0, 5], ["AN", 2, 1, 6]]]], "r": [[9.72628e-06, 9.72602e-06, 9.72501e-06], 0, 4.30064, 1667927256], "v": "v0.6"}
{"i": [["[\"mul\", 1, 14, 14, 672]", "cuda -keys=cuda,gpu -max_num_threads=1024 -model=unknown -thread_warp_size=32", [-1, 16, 64, 49152, 2147483647, 1024, 8, 32], "", 0, []], [[], [["FU", 2, [0, 1, 2, 3]], ["SP", 2, 0, 131712, [16], 1], ["AN", 2, 0, 5], ["AN", 2, 1, 6]]]], "r": [[8.78674e-06, 8.7891e-06, 8.7837e-06], 0, 4.53933, 1667927256], "v": "v0.6"}
{"i": [["[\"mul\", 1, 14, 14, 672]", "cuda -keys=cuda,gpu -max_num_threads=1024 -model=unknown -thread_warp_size=32", [-1, 16, 64, 49152, 2147483647, 1024, 8, 32], "", 0, []], [[], [["FU", 2, [0, 1, 2, 3]], ["SP", 2, 0, 131712, [28], 1], ["AN", 2, 0, 5], ["AN", 2, 1, 6]]]], "r": [[6.16184e-06, 6.15888e-06, 6.1601e-06], 0, 4.83908, 1667927257], "v": "v0.6"}
{"i": [["[\"mul\", 1, 14, 14, 672]", "cuda -keys=cuda,gpu -max_num_threads=1024 -model=unknown -thread_warp_size=32", [-1, 16, 64, 49152, 2147483647, 1024, 8, 32], "", 0, []], [[], [["FU", 2, [0, 1, 2, 3]], ["SP", 2, 0, 131712, [32], 1], ["AN", 2, 0, 5], ["AN", 2, 1, 6]]]], "r": [[5.76897e-06, 5.7721e-06, 5.76302e-06], 0, 5.07543, 1667927257], "v": "v0.6"}
{"i": [["[\"mul\", 1, 14, 14, 672]", "cuda -keys=cuda,gpu -max_num_threads=1024 -model=unknown -thread_warp_size=32", [-1, 16, 64, 49152, 2147483647, 1024, 8, 32], "", 0, []], [[], [["FU", 2, [0, 1, 2, 3]], ["SP", 2, 0, 131712, [21], 1], ["AN", 2, 0, 5], ["AN", 2, 1, 6]]]], "r": [[7.33675e-06, 7.32981e-06, 7.33031e-06], 0, 5.6349, 1667927258], "v": "v0.6"}
{"i": [["[\"mul\", 1, 14, 14, 672]", "cuda -keys=cuda,gpu -max_num_threads=1024 -model=unknown -thread_warp_size=32", [-1, 16, 64, 49152, 2147483647, 1024, 8, 32], "", 0, []], [[], [["FU", 2, [0, 1, 2, 3]], ["SP", 2, 0, 131712, [42], 1], ["AN", 2, 0, 5], ["AN", 2, 1, 6]]]], "r": [[5.06804e-06, 5.06858e-06, 5.06912e-06], 0, 5.28553, 1667927257], "v": "v0.6"}
{"i": [["[\"mul\", 1, 14, 14, 672]", "cuda -keys=cuda,gpu -max_num_threads=1024 -model=unknown -thread_warp_size=32", [-1, 16, 64, 49152, 2147483647, 1024, 8, 32], "", 0, []], [[], [["FU", 2, [0, 1, 2, 3]], ["SP", 2, 0, 131712, [3], 1], ["AN", 2, 0, 5], ["AN", 2, 1, 6]]]], "r": [[3.51875e-05, 3.51966e-05, 3.52036e-05], 0, 0.92798, 1667942924], "v": "v0.6"}
{"i": [["[\"mul\", 1, 14, 14, 672]", "cuda -keys=cuda,gpu -max_num_threads=1024 -model=unknown -thread_warp_size=32", [-1, 16, 64, 49152, 2147483647, 1024, 8, 32], "", 0, []], [[], [["FU", 2, [0, 1, 2, 3]], ["SP", 2, 0, 131712, [1], 1], ["AN", 2, 0, 5], ["AN", 2, 1, 6]]]], "r": [[0.000100359, 0.000100359, 0.000100359], 0, 2.12602, 1667942925], "v": "v0.6"}
{"i": [["[\"mul\", 1, 14, 14, 672]", "cuda -keys=cuda,gpu -max_num_threads=1024 -model=unknown -thread_warp_size=32", [-1, 16, 64, 49152, 2147483647, 1024, 8, 32], "", 0, []], [[], [["FU", 2, [0, 1, 2, 3]], ["SP", 2, 0, 131712, [48], 1], ["AN", 2, 0, 5], ["AN", 2, 1, 6]]]], "r": [[4.68981e-06, 4.68362e-06, 4.68639e-06], 0, 1.58515, 1667942924], "v": "v0.6"}
{"i": [["[\"mul\", 1, 14, 14, 672]", "cuda -keys=cuda,gpu -max_num_threads=1024 -model=unknown -thread_warp_size=32", [-1, 16, 64, 49152, 2147483647, 1024, 8, 32], "", 0, []], [[], [["FU", 2, [0, 1, 2, 3]], ["SP", 2, 0, 131712, [64], 1], ["AN", 2, 0, 5], ["AN", 2, 1, 6]]]], "r": [[4.05177e-06, 4.05124e-06, 4.05054e-06], 0, 0.576679, 1667942923], "v": "v0.6"}
{"i": [["[\"mul\", 1, 14, 14, 672]", "cuda -keys=cuda,gpu -max_num_threads=1024 -model=unknown -thread_warp_size=32", [-1, 16, 64, 49152, 2147483647, 1024, 8, 32], "", 0, []], [[], [["FU", 2, [0, 1, 2, 3]], ["SP", 2, 0, 131712, [14], 1], ["AN", 2, 0, 5], ["AN", 2, 1, 6]]]], "r": [[9.7206e-06, 9.72188e-06, 9.72274e-06], 0, 2.74402, 1667942926], "v": "v0.6"}
{"i": [["[\"mul\", 1, 14, 14, 672]", "cuda -keys=cuda,gpu -max_num_threads=1024 -model=unknown -thread_warp_size=32", [-1, 16, 64, 49152, 2147483647, 1024, 8, 32], "", 0, []], [[], [["FU", 2, [0, 1, 2, 3]], ["SP", 2, 0, 131712, [56], 1], ["AN", 2, 0, 5], ["AN", 2, 1, 6]]]], "r": [[4.26553e-06, 4.26724e-06, 4.26451e-06], 0, 1.22535, 1667942924], "v": "v0.6"}
{"i": [["[\"mul\", 1, 14, 14, 672]", "cuda -keys=cuda,gpu -max_num_threads=1024 -model=unknown -thread_warp_size=32", [-1, 16, 64, 49152, 2147483647, 1024, 8, 32], "", 0, []], [[], [["FU", 2, [0, 1, 2, 3]], ["SP", 2, 0, 131712, [49], 1], ["AN", 2, 0, 5], ["AN", 2, 1, 6]]]], "r": [[4.6316e-06, 4.63292e-06, 4.63432e-06], 0, 1.82402, 1667942925], "v": "v0.6"}
{"i": [["[\"mul\", 1, 14, 14, 672]", "cuda -keys=cuda,gpu -max_num_threads=1024 -model=unknown -thread_warp_size=32", [-1, 16, 64, 49152, 2147483647, 1024, 8, 32], "", 0, []], [[], [["FU", 2, [0, 1, 2, 3]], ["SP", 2, 0, 131712, [7], 1], ["AN", 2, 0, 5], ["AN", 2, 1, 6]]]], "r": [[1.66788e-05, 1.6673e-05, 1.66806e-05], 0, 2.45485, 1667942925], "v": "v0.6"}
{"i": [["[\"mul\", 1, 14, 14, 672]", "cuda -keys=cuda,gpu -max_num_threads=1024 -model=unknown -thread_warp_size=32", [-1, 16, 64, 49152, 2147483647, 1024, 8, 32], "", 0, []], [[], [["FU", 2, [0, 1, 2, 3]], ["SP", 2, 0, 131712, [2], 1], ["AN", 2, 0, 5], ["AN", 2, 1, 6]]]], "r": [[5.16155e-05, 5.16044e-05, 5.16071e-05], 0, 2.98109, 1667942926], "v": "v0.6"}
{"i": [["[\"mul\", 1, 14, 14, 672]", "cuda -keys=cuda,gpu -max_num_threads=1024 -model=unknown -thread_warp_size=32", [-1, 16, 64, 49152, 2147483647, 1024, 8, 32], "", 0, []], [[], [["FU", 2, [0, 1, 2, 3]], ["SP", 2, 0, 131712, [28], 1], ["AN", 2, 0, 5], ["AN", 2, 1, 6]]]], "r": [[6.3506e-06, 6.35066e-06, 6.34903e-06], 0, 3.21617, 1667942926], "v": "v0.6"}
{"i": [["[\"mul\", 1, 14, 14, 672]", "cuda -keys=cuda,gpu -max_num_threads=1024 -model=unknown -thread_warp_size=32", [-1, 16, 64, 49152, 2147483647, 1024, 8, 32], "", 0, []], [[], [["FU", 2, [0, 1, 2, 3]], ["SP", 2, 0, 131712, [42], 1], ["AN", 2, 0, 5], ["AN", 2, 1, 6]]]], "r": [[5.0848e-06, 5.08834e-06, 5.08464e-06], 0, 3.45751, 1667942927], "v": "v0.6"}
{"i": [["[\"mul\", 1, 14, 14, 672]", "cuda -keys=cuda,gpu -max_num_threads=1024 -model=unknown -thread_warp_size=32", [-1, 16, 64, 49152, 2147483647, 1024, 8, 32], "", 0, []], [[], [["FU", 2, [0, 1, 2, 3]], ["SP", 2, 0, 131712, [16], 1], ["AN", 2, 0, 5], ["AN", 2, 1, 6]]]], "r": [[8.84929e-06, 8.84659e-06, 8.84419e-06], 0, 3.72849, 1667942927], "v": "v0.6"}
{"i": [["[\"mul\", 1, 14, 14, 672]", "cuda -keys=cuda,gpu -max_num_threads=1024 -model=unknown -thread_warp_size=32", [-1, 16, 64, 49152, 2147483647, 1024, 8, 32], "", 0, []], [[], [["FU", 2, [0, 1, 2, 3]], ["SP", 2, 0, 131712, [6], 1], ["AN", 2, 0, 5], ["AN", 2, 1, 6]]]], "r": [[1.90457e-05, 1.90454e-05, 1.90437e-05], 0, 4.07821, 1667942927], "v": "v0.6"}
{"i": [["[\"mul\", 1, 14, 14, 672]", "cuda -keys=cuda,gpu -max_num_threads=1024 -model=unknown -thread_warp_size=32", [-1, 16, 64, 49152, 2147483647, 1024, 8, 32], "", 0, []], [[], [["FU", 2, [0, 1, 2, 3]], ["SP", 2, 0, 131712, [24], 1], ["AN", 2, 0, 5], ["AN", 2, 1, 6]]]], "r": [[6.73893e-06, 6.74379e-06, 6.73866e-06], 0, 4.31503, 1667942928], "v": "v0.6"}
{"i": [["[\"mul\", 1, 14, 14, 672]", "cuda -keys=cuda,gpu -max_num_threads=1024 -model=unknown -thread_warp_size=32", [-1, 16, 64, 49152, 2147483647, 1024, 8, 32], "", 0, []], [[], [["FU", 2, [0, 1, 2, 3]], ["SP", 2, 0, 131712, [8], 1], ["AN", 2, 0, 5], ["AN", 2, 1, 6]]]], "r": [[1.49489e-05, 1.49443e-05, 1.4945e-05], 0, 4.54048, 1667942928], "v": "v0.6"}
{"i": [["[\"mul\", 1, 14, 14, 672]", "cuda -keys=cuda,gpu -max_num_threads=1024 -model=unknown -thread_warp_size=32", [-1, 16, 64, 49152, 2147483647, 1024, 8, 32], "", 0, []], [[], [["FU", 2, [0, 1, 2, 3]], ["SP", 2, 0, 131712, [4], 1], ["AN", 2, 0, 5], ["AN", 2, 1, 6]]]], "r": [[2.73061e-05, 2.73075e-05, 2.73054e-05], 0, 4.8713, 1667942928], "v": "v0.6"}
{"i": [["[\"mul\", 1, 14, 14, 672]", "cuda -keys=cuda,gpu -max_num_threads=1024 -model=unknown -thread_warp_size=32", [-1, 16, 64, 49152, 2147483647, 1024, 8, 32], "", 0, []], [[], [["FU", 2, [0, 1, 2, 3]], ["SP", 2, 0, 131712, [21], 1], ["AN", 2, 0, 5], ["AN", 2, 1, 6]]]], "r": [[7.39368e-06, 7.39678e-06, 7.37824e-06], 0, 5.11818, 1667942929], "v": "v0.6"}
{"i": [["[\"mul\", 1, 14, 14, 672]", "cuda -keys=cuda,gpu -max_num_threads=1024 -model=unknown -thread_warp_size=32", [-1, 16, 64, 49152, 2147483647, 1024, 8, 32], "", 0, []], [[], [["FU", 2, [0, 1, 2, 3]], ["SP", 2, 0, 131712, [12], 1], ["AN", 2, 0, 5], ["AN", 2, 1, 6]]]], "r": [[1.09631e-05, 1.0971e-05, 1.09521e-05], 0, 5.33697, 1667942929], "v": "v0.6"}
{"i": [["[\"mul\", 1, 14, 14, 672]", "cuda -keys=cuda,gpu -max_num_threads=1024 -model=unknown -thread_warp_size=32", [-1, 16, 64, 49152, 2147483647, 1024, 8, 32], "", 0, []], [[], [["FU", 2, [0, 1, 2, 3]], ["SP", 2, 0, 131712, [32], 1], ["AN", 2, 0, 5], ["AN", 2, 1, 6]]]], "r": [[5.76449e-06, 5.77045e-06, 5.76721e-06], 0, 5.70281, 1667942929], "v": "v0.6"}
{"i": [["[\"mul\", 1, 14, 14, 672]", "cuda -keys=cuda,gpu -max_num_threads=1024 -model=unknown -thread_warp_size=32", [-1, 16, 64, 49152, 2147483647, 1024, 8, 32], "", 0, []], [[], [["FU", 2, [0, 1, 2, 3]], ["SP", 2, 0, 131712, [4], 1], ["AN", 2, 0, 5], ["AN", 2, 1, 6]]]], "r": [[4.44596e-05, 2.70948e-05, 2.7083e-05], 0, 0.599765, 1667943293], "v": "v0.6"}
{"i": [["[\"mul\", 1, 14, 14, 672]", "cuda -keys=cuda,gpu -max_num_threads=1024 -model=unknown -thread_warp_size=32", [-1, 16, 64, 49152, 2147483647, 1024, 8, 32], "", 0, []], [[], [["FU", 2, [0, 1, 2, 3]], ["SP", 2, 0, 131712, [24], 1], ["AN", 2, 0, 5], ["AN", 2, 1, 6]]]], "r": [[6.91361e-06, 6.91385e-06, 6.91298e-06], 0, 0.964767, 1667943294], "v": "v0.6"}
{"i": [["[\"mul\", 1, 14, 14, 672]", "cuda -keys=cuda,gpu -max_num_threads=1024 -model=unknown -thread_warp_size=32", [-1, 16, 64, 49152, 2147483647, 1024, 8, 32], "", 0, []], [[], [["FU", 2, [0, 1, 2, 3]], ["SP", 2, 0, 131712, [14], 1], ["AN", 2, 0, 5], ["AN", 2, 1, 6]]]], "r": [[9.68494e-06, 9.6876e-06, 9.68034e-06], 0, 2.07525, 1667943295], "v": "v0.6"}
{"i": [["[\"mul\", 1, 14, 14, 672]", "cuda -keys=cuda,gpu -max_num_threads=1024 -model=unknown -thread_warp_size=32", [-1, 16, 64, 49152, 2147483647, 1024, 8, 32], "", 0, []], [[], [["FU", 2, [0, 1, 2, 3]], ["SP", 2, 0, 131712, [16], 1], ["AN", 2, 0, 5], ["AN", 2, 1, 6]]]], "r": [[8.73454e-06, 8.73323e-06, 8.73527e-06], 0, 1.27688, 1667943294], "v": "v0.6"}
{"i": [["[\"mul\", 1, 14, 14, 672]", "cuda -keys=cuda,gpu -max_num_threads=1024 -model=unknown -thread_warp_size=32", [-1, 16, 64, 49152, 2147483647, 1024, 8, 32], "", 0, []], [[], [["FU", 2, [0, 1, 2, 3]], ["SP", 2, 0, 131712, [2], 1], ["AN", 2, 0, 5], ["AN", 2, 1, 6]]]], "r": [[5.1546e-05, 5.15632e-05, 5.15401e-05], 0, 1.57879, 1667943294], "v": "v0.6"}
{"i": [["[\"mul\", 1, 14, 14, 672]", "cuda -keys=cuda,gpu -max_num_threads=1024 -model=unknown -thread_warp_size=32", [-1, 16, 64, 49152, 2147483647, 1024, 8, 32], "", 0, []], [[], [["FU", 2, [0, 1, 2, 3]], ["SP", 2, 0, 131712, [21], 1], ["AN", 2, 0, 5], ["AN", 2, 1, 6]]]], "r": [[7.29865e-06, 7.30349e-06, 7.30166e-06], 0, 2.6512, 1667943296], "v": "v0.6"}
{"i": [["[\"mul\", 1, 14, 14, 672]", "cuda -keys=cuda,gpu -max_num_threads=1024 -model=unknown -thread_warp_size=32", [-1, 16, 64, 49152, 2147483647, 1024, 8, 32], "", 0, []], [[], [["FU", 2, [0, 1, 2, 3]], ["SP", 2, 0, 131712, [49], 1], ["AN", 2, 0, 5], ["AN", 2, 1, 6]]]], "r": [[4.76919e-06, 4.7738e-06, 4.77209e-06], 0, 1.68377, 1667943295], "v": "v0.6"}
{"i": [["[\"mul\", 1, 14, 14, 672]", "cuda -keys=cuda,gpu -max_num_threads=1024 -model=unknown -thread_warp_size=32", [-1, 16, 64, 49152, 2147483647, 1024, 8, 32], "", 0, []], [[], [["FU", 2, [0, 1, 2, 3]], ["SP", 2, 0, 131712, [48], 1], ["AN", 2, 0, 5], ["AN", 2, 1, 6]]]], "r": [[4.76568e-06, 4.76633e-06, 4.7663e-06], 0, 2.38987, 1667943295], "v": "v0.6"}
{"i": [["[\"mul\", 1, 14, 14, 672]", "cuda -keys=cuda,gpu -max_num_threads=1024 -model=unknown -thread_warp_size=32", [-1, 16, 64, 49152, 2147483647, 1024, 8, 32], "", 0, []], [[], [["FU", 2, [0, 1, 2, 3]], ["SP", 2, 0, 131712, [8], 1], ["AN", 2, 0, 5], ["AN", 2, 1, 6]]]], "r": [[1.49099e-05, 1.49089e-05, 1.49103e-05], 0, 2.98221, 1667943296], "v": "v0.6"}
{"i": [["[\"mul\", 1, 14, 14, 672]", "cuda -keys=cuda,gpu -max_num_threads=1024 -model=unknown -thread_warp_size=32", [-1, 16, 64, 49152, 2147483647, 1024, 8, 32], "", 0, []], [[], [["FU", 2, [0, 1, 2, 3]], ["SP", 2, 0, 131712, [28], 1], ["AN", 2, 0, 5], ["AN", 2, 1, 6]]]], "r": [[6.19047e-06, 6.18831e-06, 6.19446e-06], 0, 3.2041, 1667943296], "v": "v0.6"}
{"i": [["[\"mul\", 1, 14, 14, 672]", "cuda -keys=cuda,gpu -max_num_threads=1024 -model=unknown -thread_warp_size=32", [-1, 16, 64, 49152, 2147483647, 1024, 8, 32], "", 0, []], [[], [["FU", 2, [0, 1, 2, 3]], ["SP", 2, 0, 131712, [1], 1], ["AN", 2, 0, 5], ["AN", 2, 1, 6]]]], "r": [[0.000100304, 0.00010028, 0.00010029], 0, 3.51777, 1667943297], "v": "v0.6"}
{"i": [["[\"mul\", 1, 14, 14, 672]", "cuda -keys=cuda,gpu -max_num_threads=1024 -model=unknown -thread_warp_size=32", [-1, 16, 64, 49152, 2147483647, 1024, 8, 32], "", 0, []], [[], [["FU", 2, [0, 1, 2, 3]], ["SP", 2, 0, 131712, [3], 1], ["AN", 2, 0, 5], ["AN", 2, 1, 6]]]], "r": [[3.53121e-05, 3.53029e-05, 3.53109e-05], 0, 3.71494, 1667943297], "v": "v0.6"}
{"i": [["[\"mul\", 1, 14, 14, 672]", "cuda -keys=cuda,gpu -max_num_threads=1024 -model=unknown -thread_warp_size=32", [-1, 16, 64, 49152, 2147483647, 1024, 8, 32], "", 0, []], [[], [["FU", 2, [0, 1, 2, 3]], ["SP", 2, 0, 131712, [32], 1], ["AN", 2, 0, 5], ["AN", 2, 1, 6]]]], "r": [[5.85288e-06, 5.84473e-06, 5.84935e-06], 0, 4.05134, 1667943297], "v": "v0.6"}
{"i": [["[\"mul\", 1, 14, 14, 672]", "cuda -keys=cuda,gpu -max_num_threads=1024 -model=unknown -thread_warp_size=32", [-1, 16, 64, 49152, 2147483647, 1024, 8, 32], "", 0, []], [[], [["FU", 2, [0, 1, 2, 3]], ["SP", 2, 0, 131712, [64], 1], ["AN", 2, 0, 5], ["AN", 2, 1, 6]]]], "r": [[4.10604e-06, 4.10544e-06, 4.10897e-06], 0, 4.29974, 1667943298], "v": "v0.6"}
{"i": [["[\"mul\", 1, 14, 14, 672]", "cuda -keys=cuda,gpu -max_num_threads=1024 -model=unknown -thread_warp_size=32", [-1, 16, 64, 49152, 2147483647, 1024, 8, 32], "", 0, []], [[], [["FU", 2, [0, 1, 2, 3]], ["SP", 2, 0, 131712, [42], 1], ["AN", 2, 0, 5], ["AN", 2, 1, 6]]]], "r": [[4.91529e-06, 4.922e-06, 4.91832e-06], 0, 4.54451, 1667943298], "v": "v0.6"}
{"i": [["[\"mul\", 1, 14, 14, 672]", "cuda -keys=cuda,gpu -max_num_threads=1024 -model=unknown -thread_warp_size=32", [-1, 16, 64, 49152, 2147483647, 1024, 8, 32], "", 0, []], [[], [["FU", 2, [0, 1, 2, 3]], ["SP", 2, 0, 131712, [12], 1], ["AN", 2, 0, 5], ["AN", 2, 1, 6]]]], "r": [[1.08476e-05, 1.08479e-05, 1.08404e-05], 0, 4.90941, 1667943298], "v": "v0.6"}
{"i": [["[\"mul\", 1, 14, 14, 672]", "cuda -keys=cuda,gpu -max_num_threads=1024 -model=unknown -thread_warp_size=32", [-1, 16, 64, 49152, 2147483647, 1024, 8, 32], "", 0, []], [[], [["FU", 2, [0, 1, 2, 3]], ["SP", 2, 0, 131712, [6], 1], ["AN", 2, 0, 5], ["AN", 2, 1, 6]]]], "r": [[1.90162e-05, 1.90172e-05, 1.90173e-05], 0, 5.10641, 1667943299], "v": "v0.6"}
{"i": [["[\"mul\", 1, 14, 14, 672]", "cuda -keys=cuda,gpu -max_num_threads=1024 -model=unknown -thread_warp_size=32", [-1, 16, 64, 49152, 2147483647, 1024, 8, 32], "", 0, []], [[], [["FU", 2, [0, 1, 2, 3]], ["SP", 2, 0, 131712, [7], 1], ["AN", 2, 0, 5], ["AN", 2, 1, 6]]]], "r": [[1.67591e-05, 1.67576e-05, 1.6752e-05], 0, 5.38361, 1667943299], "v": "v0.6"}
{"i": [["[\"mul\", 1, 14, 14, 672]", "cuda -keys=cuda,gpu -max_num_threads=1024 -model=unknown -thread_warp_size=32", [-1, 16, 64, 49152, 2147483647, 1024, 8, 32], "", 0, []], [[], [["FU", 2, [0, 1, 2, 3]], ["SP", 2, 0, 131712, [56], 1], ["AN", 2, 0, 5], ["AN", 2, 1, 6]]]], "r": [[4.38248e-06, 4.38784e-06, 4.38792e-06], 0, 5.66466, 1667943299], "v": "v0.6"}
{"i": [["[\"mul\", 1, 14, 14, 672]", "cuda -keys=cuda,gpu -max_num_threads=1024 -model=unknown -thread_warp_size=32", [-1, 16, 64, 49152, 2147483647, 1024, 8, 32], "", 0, []], [[], [["FU", 2, [0, 1, 2, 3]], ["SP", 2, 0, 131712, [3], 1], ["AN", 2, 0, 5], ["AN", 2, 1, 6]]]], "r": [[6.05627e-05, 3.54097e-05, 3.53825e-05], 0, 0.636231, 1667944522], "v": "v0.6"}
{"i": [["[\"mul\", 1, 14, 14, 672]", "cuda -keys=cuda,gpu -max_num_threads=1024 -model=unknown -thread_warp_size=32", [-1, 16, 64, 49152, 2147483647, 1024, 8, 32], "", 0, []], [[], [["FU", 2, [0, 1, 2, 3]], ["SP", 2, 0, 131712, [2], 1], ["AN", 2, 0, 5], ["AN", 2, 1, 6]]]], "r": [[5.14976e-05, 5.15105e-05, 5.15202e-05], 0, 2.59977, 1667944525], "v": "v0.6"}
{"i": [["[\"mul\", 1, 14, 14, 672]", "cuda -keys=cuda,gpu -max_num_threads=1024 -model=unknown -thread_warp_size=32", [-1, 16, 64, 49152, 2147483647, 1024, 8, 32], "", 0, []], [[], [["FU", 2, [0, 1, 2, 3]], ["SP", 2, 0, 131712, [42], 1], ["AN", 2, 0, 5], ["AN", 2, 1, 6]]]], "r": [[5.00112e-06, 4.99252e-06, 4.99605e-06], 0, 1.15498, 1667944523], "v": "v0.6"}
{"i": [["[\"mul\", 1, 14, 14, 672]", "cuda -keys=cuda,gpu -max_num_threads=1024 -model=unknown -thread_warp_size=32", [-1, 16, 64, 49152, 2147483647, 1024, 8, 32], "", 0, []], [[], [["FU", 2, [0, 1, 2, 3]], ["SP", 2, 0, 131712, [6], 1], ["AN", 2, 0, 5], ["AN", 2, 1, 6]]]], "r": [[1.9188e-05, 1.91922e-05, 1.91877e-05], 0, 0.989096, 1667944523], "v": "v0.6"}
{"i": [["[\"mul\", 1, 14, 14, 672]", "cuda -keys=cuda,gpu -max_num_threads=1024 -model=unknown -thread_warp_size=32", [-1, 16, 64, 49152, 2147483647, 1024, 8, 32], "", 0, []], [[], [["FU", 2, [0, 1, 2, 3]], ["SP", 2, 0, 131712, [16], 1], ["AN", 2, 0, 5], ["AN", 2, 1, 6]]]], "r": [[8.71776e-06, 8.71883e-06, 8.71897e-06], 0, 3.26311, 1667944525], "v": "v0.6"}
{"i": [["[\"mul\", 1, 14, 14, 672]", "cuda -keys=cuda,gpu -max_num_threads=1024 -model=unknown -thread_warp_size=32", [-1, 16, 64, 49152, 2147483647, 1024, 8, 32], "", 0, []], [[], [["FU", 2, [0, 1, 2, 3]], ["SP", 2, 0, 131712, [21], 1], ["AN", 2, 0, 5], ["AN", 2, 1, 6]]]], "r": [[7.38069e-06, 7.38227e-06, 7.38332e-06], 0, 2.952, 1667944525], "v": "v0.6"}
{"i": [["[\"mul\", 1, 14, 14, 672]", "cuda -keys=cuda,gpu -max_num_threads=1024 -model=unknown -thread_warp_size=32", [-1, 16, 64, 49152, 2147483647, 1024, 8, 32], "", 0, []], [[], [["FU", 2, [0, 1, 2, 3]], ["SP", 2, 0, 131712, [64], 1], ["AN", 2, 0, 5], ["AN", 2, 1, 6]]]], "r": [[4.2757e-06, 4.27363e-06, 4.27444e-06], 0, 1.74301, 1667944524], "v": "v0.6"}
{"i": [["[\"mul\", 1, 14, 14, 672]", "cuda -keys=cuda,gpu -max_num_threads=1024 -model=unknown -thread_warp_size=32", [-1, 16, 64, 49152, 2147483647, 1024, 8, 32], "", 0, []], [[], [["FU", 2, [0, 1, 2, 3]], ["SP", 2, 0, 131712, [56], 1], ["AN", 2, 0, 5], ["AN", 2, 1, 6]]]], "r": [[4.25382e-06, 4.25429e-06, 4.25637e-06], 0, 1.48843, 1667944523], "v": "v0.6"}
{"i": [["[\"mul\", 1, 14, 14, 672]", "cuda -keys=cuda,gpu -max_num_threads=1024 -model=unknown -thread_warp_size=32", [-1, 16, 64, 49152, 2147483647, 1024, 8, 32], "", 0, []], [[], [["FU", 2, [0, 1, 2, 3]], ["SP", 2, 0, 131712, [28], 1], ["AN", 2, 0, 5], ["AN", 2, 1, 6]]]], "r": [[6.09432e-06, 6.09621e-06, 6.09482e-06], 0, 1.95001, 1667944524], "v": "v0.6"}
{"i": [["[\"mul\", 1, 14, 14, 672]", "cuda -keys=cuda,gpu -max_num_threads=1024 -model=unknown -thread_warp_size=32", [-1, 16, 64, 49152, 2147483647, 1024, 8, 32], "", 0, []], [[], [["FU", 2, [0, 1, 2, 3]], ["SP", 2, 0, 131712, [12], 1], ["AN", 2, 0, 5], ["AN", 2, 1, 6]]]], "r": [[1.09516e-05, 1.09542e-05, 1.09589e-05], 0, 3.80094, 1667944526], "v": "v0.6"}
{"i": [["[\"mul\", 1, 14, 14, 672]", "cuda -keys=cuda,gpu -max_num_threads=1024 -model=unknown -thread_warp_size=32", [-1, 16, 64, 49152, 2147483647, 1024, 8, 32], "", 0, []], [[], [["FU", 2, [0, 1, 2, 3]], ["SP", 2, 0, 131712, [32], 1], ["AN", 2, 0, 5], ["AN", 2, 1, 6]]]], "r": [[5.90891e-06, 5.90639e-06, 5.90075e-06], 0, 3.51613, 1667944526], "v": "v0.6"}
{"i": [["[\"mul\", 1, 14, 14, 672]", "cuda -keys=cuda,gpu -max_num_threads=1024 -model=unknown -thread_warp_size=32", [-1, 16, 64, 49152, 2147483647, 1024, 8, 32], "", 0, []], [[], [["FU", 2, [0, 1, 2, 3]], ["SP", 2, 0, 131712, [1], 1], ["AN", 2, 0, 5], ["AN", 2, 1, 6]]]], "r": [[0.000100368, 0.000100363, 0.000100355], 0, 4.0484, 1667944526], "v": "v0.6"}
{"i": [["[\"mul\", 1, 14, 14, 672]", "cuda -keys=cuda,gpu -max_num_threads=1024 -model=unknown -thread_warp_size=32", [-1, 16, 64, 49152, 2147483647, 1024, 8, 32], "", 0, []], [[], [["FU", 2, [0, 1, 2, 3]], ["SP", 2, 0, 131712, [8], 1], ["AN", 2, 0, 5], ["AN", 2, 1, 6]]]], "r": [[1.51394e-05, 1.51434e-05, 1.51387e-05], 0, 4.3519, 1667944527], "v": "v0.6"}
{"i": [["[\"mul\", 1, 14, 14, 672]", "cuda -keys=cuda,gpu -max_num_threads=1024 -model=unknown -thread_warp_size=32", [-1, 16, 64, 49152, 2147483647, 1024, 8, 32], "", 0, []], [[], [["FU", 2, [0, 1, 2, 3]], ["SP", 2, 0, 131712, [14], 1], ["AN", 2, 0, 5], ["AN", 2, 1, 6]]]], "r": [[9.58464e-06, 9.58501e-06, 9.58552e-06], 0, 4.58743, 1667944527], "v": "v0.6"}
{"i": [["[\"mul\", 1, 14, 14, 672]", "cuda -keys=cuda,gpu -max_num_threads=1024 -model=unknown -thread_warp_size=32", [-1, 16, 64, 49152, 2147483647, 1024, 8, 32], "", 0, []], [[], [["FU", 2, [0, 1, 2, 3]], ["SP", 2, 0, 131712, [48], 1], ["AN", 2, 0, 5], ["AN", 2, 1, 6]]]], "r": [[4.55351e-06, 4.55406e-06, 4.55307e-06], 0, 4.85826, 1667944527], "v": "v0.6"}
{"i": [["[\"mul\", 1, 14, 14, 672]", "cuda -keys=cuda,gpu -max_num_threads=1024 -model=unknown -thread_warp_size=32", [-1, 16, 64, 49152, 2147483647, 1024, 8, 32], "", 0, []], [[], [["FU", 2, [0, 1, 2, 3]], ["SP", 2, 0, 131712, [24], 1], ["AN", 2, 0, 5], ["AN", 2, 1, 6]]]], "r": [[6.66889e-06, 6.67126e-06, 6.67114e-06], 0, 5.11128, 1667944528], "v": "v0.6"}
{"i": [["[\"mul\", 1, 14, 14, 672]", "cuda -keys=cuda,gpu -max_num_threads=1024 -model=unknown -thread_warp_size=32", [-1, 16, 64, 49152, 2147483647, 1024, 8, 32], "", 0, []], [[], [["FU", 2, [0, 1, 2, 3]], ["SP", 2, 0, 131712, [49], 1], ["AN", 2, 0, 5], ["AN", 2, 1, 6]]]], "r": [[4.52423e-06, 4.5273e-06, 4.5287e-06], 0, 5.4181, 1667944528], "v": "v0.6"}
{"i": [["[\"mul\", 1, 14, 14, 672]", "cuda -keys=cuda,gpu -max_num_threads=1024 -model=unknown -thread_warp_size=32", [-1, 16, 64, 49152, 2147483647, 1024, 8, 32], "", 0, []], [[], [["FU", 2, [0, 1, 2, 3]], ["SP", 2, 0, 131712, [7], 1], ["AN", 2, 0, 5], ["AN", 2, 1, 6]]]], "r": [[1.67474e-05, 1.67557e-05, 1.6756e-05], 0, 5.68084, 1667944528], "v": "v0.6"}
{"i": [["[\"mul\", 1, 14, 14, 672]", "cuda -keys=cuda,gpu -max_num_threads=1024 -model=unknown -thread_warp_size=32", [-1, 16, 64, 49152, 2147483647, 1024, 8, 32], "", 0, []], [[], [["FU", 2, [0, 1, 2, 3]], ["SP", 2, 0, 131712, [4], 1], ["AN", 2, 0, 5], ["AN", 2, 1, 6]]]], "r": [[2.71588e-05, 2.71554e-05, 2.71582e-05], 0, 2.23002, 1667944524], "v": "v0.6"}
{"i": [["[\"mul\", 1, 14, 14, 672]", "cuda -keys=cuda,gpu -max_num_threads=1024 -model=unknown -thread_warp_size=32", [-1, 16, 64, 49152, 2147483647, 1024, 8, 32], "", 0, []], [[], [["FU", 2, [0, 1, 2, 3]], ["SP", 2, 0, 131712, [16], 1], ["AN", 2, 0, 5], ["AN", 2, 1, 6]]]], "r": [[8.68375e-06, 8.68258e-06, 8.67924e-06], 0, 1.91038, 1667944590], "v": "v0.6"}
{"i": [["[\"mul\", 1, 14, 14, 672]", "cuda -keys=cuda,gpu -max_num_threads=1024 -model=unknown -thread_warp_size=32", [-1, 16, 64, 49152, 2147483647, 1024, 8, 32], "", 0, []], [[], [["FU", 2, [0, 1, 2, 3]], ["SP", 2, 0, 131712, [48], 1], ["AN", 2, 0, 5], ["AN", 2, 1, 6]]]], "r": [[4.68583e-06, 4.68783e-06, 4.686e-06], 0, 0.951636, 1667944589], "v": "v0.6"}
{"i": [["[\"mul\", 1, 14, 14, 672]", "cuda -keys=cuda,gpu -max_num_threads=1024 -model=unknown -thread_warp_size=32", [-1, 16, 64, 49152, 2147483647, 1024, 8, 32], "", 0, []], [[], [["FU", 2, [0, 1, 2, 3]], ["SP", 2, 0, 131712, [8], 1], ["AN", 2, 0, 5], ["AN", 2, 1, 6]]]], "r": [[1.49882e-05, 1.49739e-05, 1.49739e-05], 0, 0.58669, 1667944589], "v": "v0.6"}
{"i": [["[\"mul\", 1, 14, 14, 672]", "cuda -keys=cuda,gpu -max_num_threads=1024 -model=unknown -thread_warp_size=32", [-1, 16, 64, 49152, 2147483647, 1024, 8, 32], "", 0, []], [[], [["FU", 2, [0, 1, 2, 3]], ["SP", 2, 0, 131712, [49], 1], ["AN", 2, 0, 5], ["AN", 2, 1, 6]]]], "r": [[4.59103e-06, 4.59644e-06, 4.59809e-06], 0, 2.26488, 1667944591], "v": "v0.6"}
{"i": [["[\"mul\", 1, 14, 14, 672]", "cuda -keys=cuda,gpu -max_num_threads=1024 -model=unknown -thread_warp_size=32", [-1, 16, 64, 49152, 2147483647, 1024, 8, 32], "", 0, []], [[], [["FU", 2, [0, 1, 2, 3]], ["SP", 2, 0, 131712, [1], 1], ["AN", 2, 0, 5], ["AN", 2, 1, 6]]]], "r": [[0.000100322, 0.000100373, 0.00010031], 0, 1.25915, 1667944590], "v": "v0.6"}
{"i": [["[\"mul\", 1, 14, 14, 672]", "cuda -keys=cuda,gpu -max_num_threads=1024 -model=unknown -thread_warp_size=32", [-1, 16, 64, 49152, 2147483647, 1024, 8, 32], "", 0, []], [[], [["FU", 2, [0, 1, 2, 3]], ["SP", 2, 0, 131712, [2], 1], ["AN", 2, 0, 5], ["AN", 2, 1, 6]]]], "r": [[5.16244e-05, 5.16276e-05, 5.16253e-05], 0, 1.6128, 1667944590], "v": "v0.6"}
{"i": [["[\"mul\", 1, 14, 14, 672]", "cuda -keys=cuda,gpu -max_num_threads=1024 -model=unknown -thread_warp_size=32", [-1, 16, 64, 49152, 2147483647, 1024, 8, 32], "", 0, []], [[], [["FU", 2, [0, 1, 2, 3]], ["SP", 2, 0, 131712, [21], 1], ["AN", 2, 0, 5], ["AN", 2, 1, 6]]]], "r": [[7.38245e-06, 7.38274e-06, 7.38795e-06], 0, 2.54384, 1667944591], "v": "v0.6"}
{"i": [["[\"mul\", 1, 14, 14, 672]", "cuda -keys=cuda,gpu -max_num_threads=1024 -model=unknown -thread_warp_size=32", [-1, 16, 64, 49152, 2147483647, 1024, 8, 32], "", 0, []], [[], [["FU", 2, [0, 1, 2, 3]], ["SP", 2, 0, 131712, [12], 1], ["AN", 2, 0, 5], ["AN", 2, 1, 6]]]], "r": [[1.08751e-05, 1.08741e-05, 1.08837e-05], 0, 2.69963, 1667944591], "v": "v0.6"}
{"i": [["[\"mul\", 1, 14, 14, 672]", "cuda -keys=cuda,gpu -max_num_threads=1024 -model=unknown -thread_warp_size=32", [-1, 16, 64, 49152, 2147483647, 1024, 8, 32], "", 0, []], [[], [["FU", 2, [0, 1, 2, 3]], ["SP", 2, 0, 131712, [4], 1], ["AN", 2, 0, 5], ["AN", 2, 1, 6]]]], "r": [[2.71117e-05, 2.71032e-05, 2.71123e-05], 0, 3.43347, 1667944592], "v": "v0.6"}
{"i": [["[\"mul\", 1, 14, 14, 672]", "cuda -keys=cuda,gpu -max_num_threads=1024 -model=unknown -thread_warp_size=32", [-1, 16, 64, 49152, 2147483647, 1024, 8, 32], "", 0, []], [[], [["FU", 2, [0, 1, 2, 3]], ["SP", 2, 0, 131712, [7], 1], ["AN", 2, 0, 5], ["AN", 2, 1, 6]]]], "r": [[1.6724e-05, 1.67194e-05, 1.6722e-05], 0, 2.91869, 1667944592], "v": "v0.6"}
{"i": [["[\"mul\", 1, 14, 14, 672]", "cuda -keys=cuda,gpu -max_num_threads=1024 -model=unknown -thread_warp_size=32", [-1, 16, 64, 49152, 2147483647, 1024, 8, 32], "", 0, []], [[], [["FU", 2, [0, 1, 2, 3]], ["SP", 2, 0, 131712, [24], 1], ["AN", 2, 0, 5], ["AN", 2, 1, 6]]]], "r": [[6.91462e-06, 6.90969e-06, 6.91128e-06], 0, 3.72585, 1667944593], "v": "v0.6"}
{"i": [["[\"mul\", 1, 14, 14, 672]", "cuda -keys=cuda,gpu -max_num_threads=1024 -model=unknown -thread_warp_size=32", [-1, 16, 64, 49152, 2147483647, 1024, 8, 32], "", 0, []], [[], [["FU", 2, [0, 1, 2, 3]], ["SP", 2, 0, 131712, [3], 1], ["AN", 2, 0, 5], ["AN", 2, 1, 6]]]], "r": [[3.51505e-05, 3.5152e-05, 3.51548e-05], 0, 4.04181, 1667944593], "v": "v0.6"}
{"i": [["[\"mul\", 1, 14, 14, 672]", "cuda -keys=cuda,gpu -max_num_threads=1024 -model=unknown -thread_warp_size=32", [-1, 16, 64, 49152, 2147483647, 1024, 8, 32], "", 0, []], [[], [["FU", 2, [0, 1, 2, 3]], ["SP", 2, 0, 131712, [32], 1], ["AN", 2, 0, 5], ["AN", 2, 1, 6]]]], "r": [[5.71677e-06, 5.72328e-06, 5.72134e-06], 0, 3.14046, 1667944592], "v": "v0.6"}
{"i": [["[\"mul\", 1, 14, 14, 672]", "cuda -keys=cuda,gpu -max_num_threads=1024 -model=unknown -thread_warp_size=32", [-1, 16, 64, 49152, 2147483647, 1024, 8, 32], "", 0, []], [[], [["FU", 2, [0, 1, 2, 3]], ["SP", 2, 0, 131712, [56], 1], ["AN", 2, 0, 5], ["AN", 2, 1, 6]]]], "r": [[4.36725e-06, 4.3652e-06, 4.36614e-06], 0, 4.28643, 1667944593], "v": "v0.6"}
{"i": [["[\"mul\", 1, 14, 14, 672]", "cuda -keys=cuda,gpu -max_num_threads=1024 -model=unknown -thread_warp_size=32", [-1, 16, 64, 49152, 2147483647, 1024, 8, 32], "", 0, []], [[], [["FU", 2, [0, 1, 2, 3]], ["SP", 2, 0, 131712, [14], 1], ["AN", 2, 0, 5], ["AN", 2, 1, 6]]]], "r": [[9.61562e-06, 9.61793e-06, 9.61735e-06], 0, 4.59851, 1667944594], "v": "v0.6"}
{"i": [["[\"mul\", 1, 14, 14, 672]", "cuda -keys=cuda,gpu -max_num_threads=1024 -model=unknown -thread_warp_size=32", [-1, 16, 64, 49152, 2147483647, 1024, 8, 32], "", 0, []], [[], [["FU", 2, [0, 1, 2, 3]], ["SP", 2, 0, 131712, [28], 1], ["AN", 2, 0, 5], ["AN", 2, 1, 6]]]], "r": [[6.28665e-06, 6.27951e-06, 6.28297e-06], 0, 4.85588, 1667944594], "v": "v0.6"}
{"i": [["[\"mul\", 1, 14, 14, 672]", "cuda -keys=cuda,gpu -max_num_threads=1024 -model=unknown -thread_warp_size=32", [-1, 16, 64, 49152, 2147483647, 1024, 8, 32], "", 0, []], [[], [["FU", 2, [0, 1, 2, 3]], ["SP", 2, 0, 131712, [6], 1], ["AN", 2, 0, 5], ["AN", 2, 1, 6]]]], "r": [[1.91273e-05, 1.91163e-05, 1.91251e-05], 0, 5.13359, 1667944594], "v": "v0.6"}
{"i": [["[\"mul\", 1, 14, 14, 672]", "cuda -keys=cuda,gpu -max_num_threads=1024 -model=unknown -thread_warp_size=32", [-1, 16, 64, 49152, 2147483647, 1024, 8, 32], "", 0, []], [[], [["FU", 2, [0, 1, 2, 3]], ["SP", 2, 0, 131712, [42], 1], ["AN", 2, 0, 5], ["AN", 2, 1, 6]]]], "r": [[4.89022e-06, 4.89327e-06, 4.89011e-06], 0, 5.42723, 1667944595], "v": "v0.6"}
{"i": [["[\"mul\", 1, 14, 14, 672]", "cuda -keys=cuda,gpu -max_num_threads=1024 -model=unknown -thread_warp_size=32", [-1, 16, 64, 49152, 2147483647, 1024, 8, 32], "", 0, []], [[], [["FU", 2, [0, 1, 2, 3]], ["SP", 2, 0, 131712, [64], 1], ["AN", 2, 0, 5], ["AN", 2, 1, 6]]]], "r": [[4.02944e-06, 4.03226e-06, 4.03281e-06], 0, 5.68483, 1667944595], "v": "v0.6"}
{"i": [["[\"mul\", 1, 14, 14, 672]", "cuda -keys=cuda,gpu -max_num_threads=1024 -model=unknown -thread_warp_size=32", [-1, 16, 64, 49152, 2147483647, 1024, 8, 32], "", 0, []], [[], [["FU", 2, [0, 1, 2, 3]], ["SP", 2, 0, 131712, [2], 1], ["AN", 2, 0, 5], ["AN", 2, 1, 6]]]], "r": [[5.1595e-05, 5.16301e-05, 5.16213e-05], 0, 1.60438, 1667944761], "v": "v0.6"}
{"i": [["[\"mul\", 1, 14, 14, 672]", "cuda -keys=cuda,gpu -max_num_threads=1024 -model=unknown -thread_warp_size=32", [-1, 16, 64, 49152, 2147483647, 1024, 8, 32], "", 0, []], [[], [["FU", 2, [0, 1, 2, 3]], ["SP", 2, 0, 131712, [14], 1], ["AN", 2, 0, 5], ["AN", 2, 1, 6]]]], "r": [[9.63322e-06, 9.63111e-06, 9.63335e-06], 0, 1.90354, 1667944761], "v": "v0.6"}
{"i": [["[\"mul\", 1, 14, 14, 672]", "cuda -keys=cuda,gpu -max_num_threads=1024 -model=unknown -thread_warp_size=32", [-1, 16, 64, 49152, 2147483647, 1024, 8, 32], "", 0, []], [[], [["FU", 2, [0, 1, 2, 3]], ["SP", 2, 0, 131712, [48], 1], ["AN", 2, 0, 5], ["AN", 2, 1, 6]]]], "r": [[4.5525e-06, 4.54887e-06, 4.55211e-06], 0, 1.2261, 1667944760], "v": "v0.6"}
{"i": [["[\"mul\", 1, 14, 14, 672]", "cuda -keys=cuda,gpu -max_num_threads=1024 -model=unknown -thread_warp_size=32", [-1, 16, 64, 49152, 2147483647, 1024, 8, 32], "", 0, []], [[], [["FU", 2, [0, 1, 2, 3]], ["SP", 2, 0, 131712, [8], 1], ["AN", 2, 0, 5], ["AN", 2, 1, 6]]]], "r": [[1.49775e-05, 1.49821e-05, 1.49795e-05], 0, 2.2294, 1667944761], "v": "v0.6"}
{"i": [["[\"mul\", 1, 14, 14, 672]", "cuda -keys=cuda,gpu -max_num_threads=1024 -model=unknown -thread_warp_size=32", [-1, 16, 64, 49152, 2147483647, 1024, 8, 32], "", 0, []], [[], [["FU", 2, [0, 1, 2, 3]], ["SP", 2, 0, 131712, [3], 1], ["AN", 2, 0, 5], ["AN", 2, 1, 6]]]], "r": [[3.51976e-05, 3.51993e-05, 3.51957e-05], 0, 0.920888, 1667944760], "v": "v0.6"}
{"i": [["[\"mul\", 1, 14, 14, 672]", "cuda -keys=cuda,gpu -max_num_threads=1024 -model=unknown -thread_warp_size=32", [-1, 16, 64, 49152, 2147483647, 1024, 8, 32], "", 0, []], [[], [["FU", 2, [0, 1, 2, 3]], ["SP", 2, 0, 131712, [6], 1], ["AN", 2, 0, 5], ["AN", 2, 1, 6]]]], "r": [[1.89476e-05, 1.89601e-05, 1.89544e-05], 0, 2.56398, 1667944762], "v": "v0.6"}
{"i": [["[\"mul\", 1, 14, 14, 672]", "cuda -keys=cuda,gpu -max_num_threads=1024 -model=unknown -thread_warp_size=32", [-1, 16, 64, 49152, 2147483647, 1024, 8, 32], "", 0, []], [[], [["FU", 2, [0, 1, 2, 3]], ["SP", 2, 0, 131712, [12], 1], ["AN", 2, 0, 5], ["AN", 2, 1, 6]]]], "r": [[1.08813e-05, 1.08796e-05, 1.08812e-05], 0, 0.610019, 1667944760], "v": "v0.6"}
{"i": [["[\"mul\", 1, 14, 14, 672]", "cuda -keys=cuda,gpu -max_num_threads=1024 -model=unknown -thread_warp_size=32", [-1, 16, 64, 49152, 2147483647, 1024, 8, 32], "", 0, []], [[], [["FU", 2, [0, 1, 2, 3]], ["SP", 2, 0, 131712, [16], 1], ["AN", 2, 0, 5], ["AN", 2, 1, 6]]]], "r": [[8.87211e-06, 8.86739e-06, 8.87002e-06], 0, 3.29004, 1667944763], "v": "v0.6"}
{"i": [["[\"mul\", 1, 14, 14, 672]", "cuda -keys=cuda,gpu -max_num_threads=1024 -model=unknown -thread_warp_size=32", [-1, 16, 64, 49152, 2147483647, 1024, 8, 32], "", 0, []], [[], [["FU", 2, [0, 1, 2, 3]], ["SP", 2, 0, 131712, [32], 1], ["AN", 2, 0, 5], ["AN", 2, 1, 6]]]], "r": [[5.84707e-06, 5.84484e-06, 5.84703e-06], 0, 2.93516, 1667944762], "v": "v0.6"}
{"i": [["[\"mul\", 1, 14, 14, 672]", "cuda -keys=cuda,gpu -max_num_threads=1024 -model=unknown -thread_warp_size=32", [-1, 16, 64, 49152, 2147483647, 1024, 8, 32], "", 0, []], [[], [["FU", 2, [0, 1, 2, 3]], ["SP", 2, 0, 131712, [7], 1], ["AN", 2, 0, 5], ["AN", 2, 1, 6]]]], "r": [[1.66532e-05, 1.66531e-05, 1.66534e-05], 0, 2.6283, 1667944762], "v": "v0.6"}
{"i": [["[\"mul\", 1, 14, 14, 672]", "cuda -keys=cuda,gpu -max_num_threads=1024 -model=unknown -thread_warp_size=32", [-1, 16, 64, 49152, 2147483647, 1024, 8, 32], "", 0, []], [[], [["FU", 2, [0, 1, 2, 3]], ["SP", 2, 0, 131712, [21], 1], ["AN", 2, 0, 5], ["AN", 2, 1, 6]]]], "r": [[7.4189e-06, 7.42295e-06, 7.41948e-06], 0, 3.53481, 1667944763], "v": "v0.6"}
{"i": [["[\"mul\", 1, 14, 14, 672]", "cuda -keys=cuda,gpu -max_num_threads=1024 -model=unknown -thread_warp_size=32", [-1, 16, 64, 49152, 2147483647, 1024, 8, 32], "", 0, []], [[], [["FU", 2, [0, 1, 2, 3]], ["SP", 2, 0, 131712, [4], 1], ["AN", 2, 0, 5], ["AN", 2, 1, 6]]]], "r": [[2.71188e-05, 2.71241e-05, 2.71241e-05], 0, 3.77481, 1667944763], "v": "v0.6"}
{"i": [["[\"mul\", 1, 14, 14, 672]", "cuda -keys=cuda,gpu -max_num_threads=1024 -model=unknown -thread_warp_size=32", [-1, 16, 64, 49152, 2147483647, 1024, 8, 32], "", 0, []], [[], [["FU", 2, [0, 1, 2, 3]], ["SP", 2, 0, 131712, [64], 1], ["AN", 2, 0, 5], ["AN", 2, 1, 6]]]], "r": [[4.07799e-06, 4.07837e-06, 4.07796e-06], 0, 4.05471, 1667944764], "v": "v0.6"}
{"i": [["[\"mul\", 1, 14, 14, 672]", "cuda -keys=cuda,gpu -max_num_threads=1024 -model=unknown -thread_warp_size=32", [-1, 16, 64, 49152, 2147483647, 1024, 8, 32], "", 0, []], [[], [["FU", 2, [0, 1, 2, 3]], ["SP", 2, 0, 131712, [42], 1], ["AN", 2, 0, 5], ["AN", 2, 1, 6]]]], "r": [[5.00914e-06, 5.01761e-06, 5.01418e-06], 0, 4.34662, 1667944764], "v": "v0.6"}
{"i": [["[\"mul\", 1, 14, 14, 672]", "cuda -keys=cuda,gpu -max_num_threads=1024 -model=unknown -thread_warp_size=32", [-1, 16, 64, 49152, 2147483647, 1024, 8, 32], "", 0, []], [[], [["FU", 2, [0, 1, 2, 3]], ["SP", 2, 0, 131712, [49], 1], ["AN", 2, 0, 5], ["AN", 2, 1, 6]]]], "r": [[4.58239e-06, 4.58178e-06, 4.58143e-06], 0, 4.58968, 1667944764], "v": "v0.6"}
{"i": [["[\"mul\", 1, 14, 14, 672]", "cuda -keys=cuda,gpu -max_num_threads=1024 -model=unknown -thread_warp_size=32", [-1, 16, 64, 49152, 2147483647, 1024, 8, 32], "", 0, []], [[], [["FU", 2, [0, 1, 2, 3]], ["SP", 2, 0, 131712, [1], 1], ["AN", 2, 0, 5], ["AN", 2, 1, 6]]]], "r": [[0.00010041, 0.00010039, 0.000100399], 0, 4.88203, 1667944765], "v": "v0.6"}
{"i": [["[\"mul\", 1, 14, 14, 672]", "cuda -keys=cuda,gpu -max_num_threads=1024 -model=unknown -thread_warp_size=32", [-1, 16, 64, 49152, 2147483647, 1024, 8, 32], "", 0, []], [[], [["FU", 2, [0, 1, 2, 3]], ["SP", 2, 0, 131712, [24], 1], ["AN", 2, 0, 5], ["AN", 2, 1, 6]]]], "r": [[6.74325e-06, 6.74637e-06, 6.7397e-06], 0, 5.15289, 1667944765], "v": "v0.6"}
{"i": [["[\"mul\", 1, 14, 14, 672]", "cuda -keys=cuda,gpu -max_num_threads=1024 -model=unknown -thread_warp_size=32", [-1, 16, 64, 49152, 2147483647, 1024, 8, 32], "", 0, []], [[], [["FU", 2, [0, 1, 2, 3]], ["SP", 2, 0, 131712, [28], 1], ["AN", 2, 0, 5], ["AN", 2, 1, 6]]]], "r": [[6.17736e-06, 6.17513e-06, 6.17795e-06], 0, 5.34532, 1667944765], "v": "v0.6"}
{"i": [["[\"mul\", 1, 14, 14, 672]", "cuda -keys=cuda,gpu -max_num_threads=1024 -model=unknown -thread_warp_size=32", [-1, 16, 64, 49152, 2147483647, 1024, 8, 32], "", 0, []], [[], [["FU", 2, [0, 1, 2, 3]], ["SP", 2, 0, 131712, [56], 1], ["AN", 2, 0, 5], ["AN", 2, 1, 6]]]], "r": [[4.45106e-06, 4.45465e-06, 4.4521e-06], 0, 5.76757, 1667944766], "v": "v0.6"}
