python/models/efficientnet/VertiFusionEfficientNet_kernel_configs/efficient_mul_1_1_1_10.log
{"i": [["[\"mul\", 1, 1, 1, 10]", "cuda -keys=cuda,gpu -max_num_threads=1024 -model=unknown -thread_warp_size=32", [-1, 16, 64, 49152, 2147483647, 1024, 8, 32], "", 0, []], [[], [["FU", 2, [0, 1, 2, 3]], ["AN", 2, 0, 6]]]], "r": [[2.40486e-06, 2.39533e-06, 2.39531e-06], 0, 0.534137, 1667926396], "v": "v0.6"}
{"i": [["[\"mul\", 1, 1, 1, 10]", "cuda -keys=cuda,gpu -max_num_threads=1024 -model=unknown -thread_warp_size=32", [-1, 16, 64, 49152, 2147483647, 1024, 8, 32], "", 0, []], [[], [["FU", 2, [0, 1, 2, 3]], ["AN", 2, 0, 6]]]], "r": [[2.43293e-06, 2.41967e-06, 2.41882e-06], 0, 0.503744, 1667926609], "v": "v0.6"}
{"i": [["[\"mul\", 1, 1, 1, 10]", "cuda -keys=cuda,gpu -max_num_threads=1024 -model=unknown -thread_warp_size=32", [-1, 16, 64, 49152, 2147483647, 1024, 8, 32], "", 0, []], [[], [["FU", 2, [0, 1, 2, 3]], ["AN", 2, 0, 6]]]], "r": [[2.43514e-06, 2.41524e-06, 2.42325e-06], 0, 0.511149, 1667938073], "v": "v0.6"}
{"i": [["[\"mul\", 1, 1, 1, 10]", "cuda -keys=cuda,gpu -max_num_threads=1024 -model=unknown -thread_warp_size=32", [-1, 16, 64, 49152, 2147483647, 1024, 8, 32], "", 0, []], [[], [["FU", 2, [0, 1, 2, 3]], ["AN", 2, 0, 6]]]], "r": [[2.55819e-06, 2.54458e-06, 2.58298e-06], 0, 0.498172, 1667939190], "v": "v0.6"}
