python/models/efficientnet/VertiFusionEfficientNet_kernel_configs/efficient_sigmoid_1_1_1_672.log
{"i": [["[\"sigmoid\", 1, 1, 1, 672]", "cuda -keys=cuda,gpu -max_num_threads=1024 -model=unknown -thread_warp_size=32", [-1, 16, 64, 49152, 2147483647, 1024, 8, 32], "", 0, []], [[], [["FU", 1, [0, 1, 2, 3]], ["SP", 1, 0, 672, [21], 1], ["AN", 1, 0, 5], ["AN", 1, 1, 6]]]], "r": [[2.61374e-06, 2.60422e-06, 2.60464e-06], 0, 1.50514, 1667927328], "v": "v0.6"}
{"i": [["[\"sigmoid\", 1, 1, 1, 672]", "cuda -keys=cuda,gpu -max_num_threads=1024 -model=unknown -thread_warp_size=32", [-1, 16, 64, 49152, 2147483647, 1024, 8, 32], "", 0, []], [[], [["FU", 1, [0, 1, 2, 3]], ["SP", 1, 0, 672, [32], 1], ["AN", 1, 0, 5], ["AN", 1, 1, 6]]]], "r": [[2.70026e-06, 2.72071e-06, 2.71518e-06], 0, 1.75816, 1667927328], "v": "v0.6"}
{"i": [["[\"sigmoid\", 1, 1, 1, 672]", "cuda -keys=cuda,gpu -max_num_threads=1024 -model=unknown -thread_warp_size=32", [-1, 16, 64, 49152, 2147483647, 1024, 8, 32], "", 0, []], [[], [["FU", 1, [0, 1, 2, 3]], ["SP", 1, 0, 672, [24], 1], ["AN", 1, 0, 5], ["AN", 1, 1, 6]]]], "r": [[2.71897e-06, 2.74197e-06, 2.7405e-06], 0, 0.603645, 1667927327], "v": "v0.6"}
{"i": [["[\"sigmoid\", 1, 1, 1, 672]", "cuda -keys=cuda,gpu -max_num_threads=1024 -model=unknown -thread_warp_size=32", [-1, 16, 64, 49152, 2147483647, 1024, 8, 32], "", 0, []], [[], [["FU", 1, [0, 1, 2, 3]], ["SP", 1, 0, 672, [7], 1], ["AN", 1, 0, 5], ["AN", 1, 1, 6]]]], "r": [[2.6022e-06, 2.59451e-06, 2.59444e-06], 0, 2.08223, 1667927329], "v": "v0.6"}
{"i": [["[\"sigmoid\", 1, 1, 1, 672]", "cuda -keys=cuda,gpu -max_num_threads=1024 -model=unknown -thread_warp_size=32", [-1, 16, 64, 49152, 2147483647, 1024, 8, 32], "", 0, []], [[], [["FU", 1, [0, 1, 2, 3]], ["SP", 1, 0, 672, [4], 1], ["AN", 1, 0, 5], ["AN", 1, 1, 6]]]], "r": [[2.87472e-06, 2.88717e-06, 2.89293e-06], 0, 1.19598, 1667927328], "v": "v0.6"}
{"i": [["[\"sigmoid\", 1, 1, 1, 672]", "cuda -keys=cuda,gpu -max_num_threads=1024 -model=unknown -thread_warp_size=32", [-1, 16, 64, 49152, 2147483647, 1024, 8, 32], "", 0, []], [[], [["FU", 1, [0, 1, 2, 3]], ["SP", 1, 0, 672, [6], 1], ["AN", 1, 0, 5], ["AN", 1, 1, 6]]]], "r": [[2.64223e-06, 2.63601e-06, 2.63644e-06], 0, 0.807251, 1667927327], "v": "v0.6"}
{"i": [["[\"sigmoid\", 1, 1, 1, 672]", "cuda -keys=cuda,gpu -max_num_threads=1024 -model=unknown -thread_warp_size=32", [-1, 16, 64, 49152, 2147483647, 1024, 8, 32], "", 0, []], [[], [["FU", 1, [0, 1, 2, 3]], ["SP", 1, 0, 672, [16], 1], ["AN", 1, 0, 5], ["AN", 1, 1, 6]]]], "r": [[2.57067e-06, 2.5685e-06, 2.56812e-06], 0, 2.11567, 1667927329], "v": "v0.6"}
{"i": [["[\"sigmoid\", 1, 1, 1, 672]", "cuda -keys=cuda,gpu -max_num_threads=1024 -model=unknown -thread_warp_size=32", [-1, 16, 64, 49152, 2147483647, 1024, 8, 32], "", 0, []], [[], [["FU", 1, [0, 1, 2, 3]], ["SP", 1, 0, 672, [48], 1], ["AN", 1, 0, 5], ["AN", 1, 1, 6]]]], "r": [[2.65398e-06, 2.66714e-06, 2.66714e-06], 0, 2.33588, 1667927329], "v": "v0.6"}
{"i": [["[\"sigmoid\", 1, 1, 1, 672]", "cuda -keys=cuda,gpu -max_num_threads=1024 -model=unknown -thread_warp_size=32", [-1, 16, 64, 49152, 2147483647, 1024, 8, 32], "", 0, []], [[], [["FU", 1, [0, 1, 2, 3]], ["SP", 1, 0, 672, [3], 1], ["AN", 1, 0, 5], ["AN", 1, 1, 6]]]], "r": [[2.78898e-06, 2.78911e-06, 2.7877e-06], 0, 3.2299, 1667927330], "v": "v0.6"}
{"i": [["[\"sigmoid\", 1, 1, 1, 672]", "cuda -keys=cuda,gpu -max_num_threads=1024 -model=unknown -thread_warp_size=32", [-1, 16, 64, 49152, 2147483647, 1024, 8, 32], "", 0, []], [[], [["FU", 1, [0, 1, 2, 3]], ["SP", 1, 0, 672, [2], 1], ["AN", 1, 0, 5], ["AN", 1, 1, 6]]]], "r": [[2.91068e-06, 2.90585e-06, 2.90692e-06], 0, 2.92606, 1667927330], "v": "v0.6"}
{"i": [["[\"sigmoid\", 1, 1, 1, 672]", "cuda -keys=cuda,gpu -max_num_threads=1024 -model=unknown -thread_warp_size=32", [-1, 16, 64, 49152, 2147483647, 1024, 8, 32], "", 0, []], [[], [["FU", 1, [0, 1, 2, 3]], ["SP", 1, 0, 672, [1], 1], ["AN", 1, 0, 5], ["AN", 1, 1, 6]]]], "r": [[3.09983e-06, 3.11684e-06, 3.11205e-06], 0, 2.61902, 1667927330], "v": "v0.6"}
{"i": [["[\"sigmoid\", 1, 1, 1, 672]", "cuda -keys=cuda,gpu -max_num_threads=1024 -model=unknown -thread_warp_size=32", [-1, 16, 64, 49152, 2147483647, 1024, 8, 32], "", 0, []], [[], [["FU", 1, [0, 1, 2, 3]], ["SP", 1, 0, 672, [14], 1], ["AN", 1, 0, 5], ["AN", 1, 1, 6]]]], "r": [[2.55624e-06, 2.55452e-06, 2.55302e-06], 0, 3.48795, 1667927330], "v": "v0.6"}
{"i": [["[\"sigmoid\", 1, 1, 1, 672]", "cuda -keys=cuda,gpu -max_num_threads=1024 -model=unknown -thread_warp_size=32", [-1, 16, 64, 49152, 2147483647, 1024, 8, 32], "", 0, []], [[], [["FU", 1, [0, 1, 2, 3]], ["SP", 1, 0, 672, [8], 1], ["AN", 1, 0, 5], ["AN", 1, 1, 6]]]], "r": [[2.61787e-06, 2.60535e-06, 2.60622e-06], 0, 3.76224, 1667927331], "v": "v0.6"}
{"i": [["[\"sigmoid\", 1, 1, 1, 672]", "cuda -keys=cuda,gpu -max_num_threads=1024 -model=unknown -thread_warp_size=32", [-1, 16, 64, 49152, 2147483647, 1024, 8, 32], "", 0, []], [[], [["FU", 1, [0, 1, 2, 3]], ["SP", 1, 0, 672, [42], 1], ["AN", 1, 0, 5], ["AN", 1, 1, 6]]]], "r": [[2.47455e-06, 2.45912e-06, 2.46296e-06], 0, 4.01548, 1667927331], "v": "v0.6"}
{"i": [["[\"sigmoid\", 1, 1, 1, 672]", "cuda -keys=cuda,gpu -max_num_threads=1024 -model=unknown -thread_warp_size=32", [-1, 16, 64, 49152, 2147483647, 1024, 8, 32], "", 0, []], [[], [["FU", 1, [0, 1, 2, 3]], ["SP", 1, 0, 672, [12], 1], ["AN", 1, 0, 5], ["AN", 1, 1, 6]]]], "r": [[2.6196e-06, 2.61129e-06, 2.61141e-06], 0, 4.2731, 1667927331], "v": "v0.6"}
{"i": [["[\"sigmoid\", 1, 1, 1, 672]", "cuda -keys=cuda,gpu -max_num_threads=1024 -model=unknown -thread_warp_size=32", [-1, 16, 64, 49152, 2147483647, 1024, 8, 32], "", 0, []], [[], [["FU", 1, [0, 1, 2, 3]], ["SP", 1, 0, 672, [56], 1], ["AN", 1, 0, 5], ["AN", 1, 1, 6]]]], "r": [[2.6997e-06, 2.71194e-06, 2.71783e-06], 0, 4.54824, 1667927332], "v": "v0.6"}
{"i": [["[\"sigmoid\", 1, 1, 1, 672]", "cuda -keys=cuda,gpu -max_num_threads=1024 -model=unknown -thread_warp_size=32", [-1, 16, 64, 49152, 2147483647, 1024, 8, 32], "", 0, []], [[], [["FU", 1, [0, 1, 2, 3]], ["SP", 1, 0, 672, [28], 1], ["AN", 1, 0, 5], ["AN", 1, 1, 6]]]], "r": [[2.48175e-06, 2.47146e-06, 2.47579e-06], 0, 4.79084, 1667927332], "v": "v0.6"}
{"i": [["[\"sigmoid\", 1, 1, 1, 672]", "cuda -keys=cuda,gpu -max_num_threads=1024 -model=unknown -thread_warp_size=32", [-1, 16, 64, 49152, 2147483647, 1024, 8, 32], "", 0, []], [[], [["FU", 1, [0, 1, 2, 3]], ["SP", 1, 0, 672, [8], 1], ["AN", 1, 0, 5], ["AN", 1, 1, 6]]]], "r": [[2.6246e-06, 2.62152e-06, 2.62248e-06], 0, 1.69655, 1667927431], "v": "v0.6"}
{"i": [["[\"sigmoid\", 1, 1, 1, 672]", "cuda -keys=cuda,gpu -max_num_threads=1024 -model=unknown -thread_warp_size=32", [-1, 16, 64, 49152, 2147483647, 1024, 8, 32], "", 0, []], [[], [["FU", 1, [0, 1, 2, 3]], ["SP", 1, 0, 672, [7], 1], ["AN", 1, 0, 5], ["AN", 1, 1, 6]]]], "r": [[2.60969e-06, 2.60685e-06, 2.60517e-06], 0, 1.40574, 1667927431], "v": "v0.6"}
{"i": [["[\"sigmoid\", 1, 1, 1, 672]", "cuda -keys=cuda,gpu -max_num_threads=1024 -model=unknown -thread_warp_size=32", [-1, 16, 64, 49152, 2147483647, 1024, 8, 32], "", 0, []], [[], [["FU", 1, [0, 1, 2, 3]], ["SP", 1, 0, 672, [56], 1], ["AN", 1, 0, 5], ["AN", 1, 1, 6]]]], "r": [[2.64849e-06, 2.66983e-06, 2.66422e-06], 0, 2.00612, 1667927431], "v": "v0.6"}
{"i": [["[\"sigmoid\", 1, 1, 1, 672]", "cuda -keys=cuda,gpu -max_num_threads=1024 -model=unknown -thread_warp_size=32", [-1, 16, 64, 49152, 2147483647, 1024, 8, 32], "", 0, []], [[], [["FU", 1, [0, 1, 2, 3]], ["SP", 1, 0, 672, [2], 1], ["AN", 1, 0, 5], ["AN", 1, 1, 6]]]], "r": [[2.95832e-06, 2.95892e-06, 2.95784e-06], 0, 1.16865, 1667927430], "v": "v0.6"}
{"i": [["[\"sigmoid\", 1, 1, 1, 672]", "cuda -keys=cuda,gpu -max_num_threads=1024 -model=unknown -thread_warp_size=32", [-1, 16, 64, 49152, 2147483647, 1024, 8, 32], "", 0, []], [[], [["FU", 1, [0, 1, 2, 3]], ["SP", 1, 0, 672, [24], 1], ["AN", 1, 0, 5], ["AN", 1, 1, 6]]]], "r": [[2.58242e-06, 2.57596e-06, 2.5799e-06], 0, 0.53839, 1667927430], "v": "v0.6"}
{"i": [["[\"sigmoid\", 1, 1, 1, 672]", "cuda -keys=cuda,gpu -max_num_threads=1024 -model=unknown -thread_warp_size=32", [-1, 16, 64, 49152, 2147483647, 1024, 8, 32], "", 0, []], [[], [["FU", 1, [0, 1, 2, 3]], ["SP", 1, 0, 672, [6], 1], ["AN", 1, 0, 5], ["AN", 1, 1, 6]]]], "r": [[2.60383e-06, 2.59913e-06, 2.60172e-06], 0, 0.814883, 1667927430], "v": "v0.6"}
{"i": [["[\"sigmoid\", 1, 1, 1, 672]", "cuda -keys=cuda,gpu -max_num_threads=1024 -model=unknown -thread_warp_size=32", [-1, 16, 64, 49152, 2147483647, 1024, 8, 32], "", 0, []], [[], [["FU", 1, [0, 1, 2, 3]], ["SP", 1, 0, 672, [1], 1], ["AN", 1, 0, 5], ["AN", 1, 1, 6]]]], "r": [[3.07122e-06, 3.06988e-06, 3.06866e-06], 0, 2.30207, 1667927432], "v": "v0.6"}
{"i": [["[\"sigmoid\", 1, 1, 1, 672]", "cuda -keys=cuda,gpu -max_num_threads=1024 -model=unknown -thread_warp_size=32", [-1, 16, 64, 49152, 2147483647, 1024, 8, 32], "", 0, []], [[], [["FU", 1, [0, 1, 2, 3]], ["SP", 1, 0, 672, [42], 1], ["AN", 1, 0, 5], ["AN", 1, 1, 6]]]], "r": [[2.48453e-06, 2.47234e-06, 2.47549e-06], 0, 2.83673, 1667927432], "v": "v0.6"}
{"i": [["[\"sigmoid\", 1, 1, 1, 672]", "cuda -keys=cuda,gpu -max_num_threads=1024 -model=unknown -thread_warp_size=32", [-1, 16, 64, 49152, 2147483647, 1024, 8, 32], "", 0, []], [[], [["FU", 1, [0, 1, 2, 3]], ["SP", 1, 0, 672, [32], 1], ["AN", 1, 0, 5], ["AN", 1, 1, 6]]]], "r": [[2.68887e-06, 2.70305e-06, 2.69743e-06], 0, 2.51872, 1667927432], "v": "v0.6"}
{"i": [["[\"sigmoid\", 1, 1, 1, 672]", "cuda -keys=cuda,gpu -max_num_threads=1024 -model=unknown -thread_warp_size=32", [-1, 16, 64, 49152, 2147483647, 1024, 8, 32], "", 0, []], [[], [["FU", 1, [0, 1, 2, 3]], ["SP", 1, 0, 672, [14], 1], ["AN", 1, 0, 5], ["AN", 1, 1, 6]]]], "r": [[2.58779e-06, 2.58168e-06, 2.58206e-06], 0, 3.05597, 1667927432], "v": "v0.6"}
{"i": [["[\"sigmoid\", 1, 1, 1, 672]", "cuda -keys=cuda,gpu -max_num_threads=1024 -model=unknown -thread_warp_size=32", [-1, 16, 64, 49152, 2147483647, 1024, 8, 32], "", 0, []], [[], [["FU", 1, [0, 1, 2, 3]], ["SP", 1, 0, 672, [3], 1], ["AN", 1, 0, 5], ["AN", 1, 1, 6]]]], "r": [[2.74198e-06, 2.74017e-06, 2.74146e-06], 0, 3.30913, 1667927433], "v": "v0.6"}
{"i": [["[\"sigmoid\", 1, 1, 1, 672]", "cuda -keys=cuda,gpu -max_num_threads=1024 -model=unknown -thread_warp_size=32", [-1, 16, 64, 49152, 2147483647, 1024, 8, 32], "", 0, []], [[], [["FU", 1, [0, 1, 2, 3]], ["SP", 1, 0, 672, [28], 1], ["AN", 1, 0, 5], ["AN", 1, 1, 6]]]], "r": [[2.49651e-06, 2.48716e-06, 2.49476e-06], 0, 3.60482, 1667927433], "v": "v0.6"}
{"i": [["[\"sigmoid\", 1, 1, 1, 672]", "cuda -keys=cuda,gpu -max_num_threads=1024 -model=unknown -thread_warp_size=32", [-1, 16, 64, 49152, 2147483647, 1024, 8, 32], "", 0, []], [[], [["FU", 1, [0, 1, 2, 3]], ["SP", 1, 0, 672, [4], 1], ["AN", 1, 0, 5], ["AN", 1, 1, 6]]]], "r": [[2.72916e-06, 2.72939e-06, 2.72866e-06], 0, 3.84901, 1667927433], "v": "v0.6"}
{"i": [["[\"sigmoid\", 1, 1, 1, 672]", "cuda -keys=cuda,gpu -max_num_threads=1024 -model=unknown -thread_warp_size=32", [-1, 16, 64, 49152, 2147483647, 1024, 8, 32], "", 0, []], [[], [["FU", 1, [0, 1, 2, 3]], ["SP", 1, 0, 672, [21], 1], ["AN", 1, 0, 5], ["AN", 1, 1, 6]]]], "r": [[2.49873e-06, 2.4898e-06, 2.49533e-06], 0, 4.0983, 1667927434], "v": "v0.6"}
{"i": [["[\"sigmoid\", 1, 1, 1, 672]", "cuda -keys=cuda,gpu -max_num_threads=1024 -model=unknown -thread_warp_size=32", [-1, 16, 64, 49152, 2147483647, 1024, 8, 32], "", 0, []], [[], [["FU", 1, [0, 1, 2, 3]], ["SP", 1, 0, 672, [16], 1], ["AN", 1, 0, 5], ["AN", 1, 1, 6]]]], "r": [[2.60201e-06, 2.59294e-06, 2.59802e-06], 0, 4.40503, 1667927434], "v": "v0.6"}
{"i": [["[\"sigmoid\", 1, 1, 1, 672]", "cuda -keys=cuda,gpu -max_num_threads=1024 -model=unknown -thread_warp_size=32", [-1, 16, 64, 49152, 2147483647, 1024, 8, 32], "", 0, []], [[], [["FU", 1, [0, 1, 2, 3]], ["SP", 1, 0, 672, [12], 1], ["AN", 1, 0, 5], ["AN", 1, 1, 6]]]], "r": [[2.53984e-06, 2.53224e-06, 2.53351e-06], 0, 4.66283, 1667927434], "v": "v0.6"}
{"i": [["[\"sigmoid\", 1, 1, 1, 672]", "cuda -keys=cuda,gpu -max_num_threads=1024 -model=unknown -thread_warp_size=32", [-1, 16, 64, 49152, 2147483647, 1024, 8, 32], "", 0, []], [[], [["FU", 1, [0, 1, 2, 3]], ["SP", 1, 0, 672, [48], 1], ["AN", 1, 0, 5], ["AN", 1, 1, 6]]]], "r": [[2.5175e-06, 2.5161e-06, 2.51585e-06], 0, 4.91794, 1667927435], "v": "v0.6"}
{"i": [["[\"sigmoid\", 1, 1, 1, 672]", "cuda -keys=cuda,gpu -max_num_threads=1024 -model=unknown -thread_warp_size=32", [-1, 16, 64, 49152, 2147483647, 1024, 8, 32], "", 0, []], [[], [["FU", 1, [0, 1, 2, 3]], ["SP", 1, 0, 672, [14], 1], ["AN", 1, 0, 5], ["AN", 1, 1, 6]]]], "r": [[2.61381e-06, 2.60608e-06, 2.60674e-06], 0, 1.25091, 1667944083], "v": "v0.6"}
{"i": [["[\"sigmoid\", 1, 1, 1, 672]", "cuda -keys=cuda,gpu -max_num_threads=1024 -model=unknown -thread_warp_size=32", [-1, 16, 64, 49152, 2147483647, 1024, 8, 32], "", 0, []], [[], [["FU", 1, [0, 1, 2, 3]], ["SP", 1, 0, 672, [16], 1], ["AN", 1, 0, 5], ["AN", 1, 1, 6]]]], "r": [[2.56496e-06, 2.55281e-06, 2.55293e-06], 0, 2.36865, 1667944084], "v": "v0.6"}
{"i": [["[\"sigmoid\", 1, 1, 1, 672]", "cuda -keys=cuda,gpu -max_num_threads=1024 -model=unknown -thread_warp_size=32", [-1, 16, 64, 49152, 2147483647, 1024, 8, 32], "", 0, []], [[], [["FU", 1, [0, 1, 2, 3]], ["SP", 1, 0, 672, [28], 1], ["AN", 1, 0, 5], ["AN", 1, 1, 6]]]], "r": [[2.54141e-06, 2.53629e-06, 2.53891e-06], 0, 1.8038, 1667944083], "v": "v0.6"}
{"i": [["[\"sigmoid\", 1, 1, 1, 672]", "cuda -keys=cuda,gpu -max_num_threads=1024 -model=unknown -thread_warp_size=32", [-1, 16, 64, 49152, 2147483647, 1024, 8, 32], "", 0, []], [[], [["FU", 1, [0, 1, 2, 3]], ["SP", 1, 0, 672, [3], 1], ["AN", 1, 0, 5], ["AN", 1, 1, 6]]]], "r": [[2.67483e-06, 2.66989e-06, 2.66976e-06], 0, 0.919825, 1667944082], "v": "v0.6"}
{"i": [["[\"sigmoid\", 1, 1, 1, 672]", "cuda -keys=cuda,gpu -max_num_threads=1024 -model=unknown -thread_warp_size=32", [-1, 16, 64, 49152, 2147483647, 1024, 8, 32], "", 0, []], [[], [["FU", 1, [0, 1, 2, 3]], ["SP", 1, 0, 672, [2], 1], ["AN", 1, 0, 5], ["AN", 1, 1, 6]]]], "r": [[2.83464e-06, 2.83065e-06, 2.83293e-06], 0, 1.49281, 1667944083], "v": "v0.6"}
{"i": [["[\"sigmoid\", 1, 1, 1, 672]", "cuda -keys=cuda,gpu -max_num_threads=1024 -model=unknown -thread_warp_size=32", [-1, 16, 64, 49152, 2147483647, 1024, 8, 32], "", 0, []], [[], [["FU", 1, [0, 1, 2, 3]], ["SP", 1, 0, 672, [4], 1], ["AN", 1, 0, 5], ["AN", 1, 1, 6]]]], "r": [[2.73643e-06, 4.21979e-06, 2.73481e-06], 0, 0.607867, 1667944082], "v": "v0.6"}
{"i": [["[\"sigmoid\", 1, 1, 1, 672]", "cuda -keys=cuda,gpu -max_num_threads=1024 -model=unknown -thread_warp_size=32", [-1, 16, 64, 49152, 2147483647, 1024, 8, 32], "", 0, []], [[], [["FU", 1, [0, 1, 2, 3]], ["SP", 1, 0, 672, [56], 1], ["AN", 1, 0, 5], ["AN", 1, 1, 6]]]], "r": [[2.66755e-06, 2.68109e-06, 2.68573e-06], 0, 2.08933, 1667944084], "v": "v0.6"}
{"i": [["[\"sigmoid\", 1, 1, 1, 672]", "cuda -keys=cuda,gpu -max_num_threads=1024 -model=unknown -thread_warp_size=32", [-1, 16, 64, 49152, 2147483647, 1024, 8, 32], "", 0, []], [[], [["FU", 1, [0, 1, 2, 3]], ["SP", 1, 0, 672, [42], 1], ["AN", 1, 0, 5], ["AN", 1, 1, 6]]]], "r": [[2.49968e-06, 2.48957e-06, 2.49315e-06], 0, 2.54852, 1667944084], "v": "v0.6"}
{"i": [["[\"sigmoid\", 1, 1, 1, 672]", "cuda -keys=cuda,gpu -max_num_threads=1024 -model=unknown -thread_warp_size=32", [-1, 16, 64, 49152, 2147483647, 1024, 8, 32], "", 0, []], [[], [["FU", 1, [0, 1, 2, 3]], ["SP", 1, 0, 672, [32], 1], ["AN", 1, 0, 5], ["AN", 1, 1, 6]]]], "r": [[2.53139e-06, 2.52377e-06, 2.52528e-06], 0, 2.80097, 1667944085], "v": "v0.6"}
{"i": [["[\"sigmoid\", 1, 1, 1, 672]", "cuda -keys=cuda,gpu -max_num_threads=1024 -model=unknown -thread_warp_size=32", [-1, 16, 64, 49152, 2147483647, 1024, 8, 32], "", 0, []], [[], [["FU", 1, [0, 1, 2, 3]], ["SP", 1, 0, 672, [12], 1], ["AN", 1, 0, 5], ["AN", 1, 1, 6]]]], "r": [[2.54171e-06, 2.5359e-06, 2.53723e-06], 0, 3.09325, 1667944085], "v": "v0.6"}
{"i": [["[\"sigmoid\", 1, 1, 1, 672]", "cuda -keys=cuda,gpu -max_num_threads=1024 -model=unknown -thread_warp_size=32", [-1, 16, 64, 49152, 2147483647, 1024, 8, 32], "", 0, []], [[], [["FU", 1, [0, 1, 2, 3]], ["SP", 1, 0, 672, [24], 1], ["AN", 1, 0, 5], ["AN", 1, 1, 6]]]], "r": [[2.61999e-06, 2.61144e-06, 2.6109e-06], 0, 3.3489, 1667944085], "v": "v0.6"}
{"i": [["[\"sigmoid\", 1, 1, 1, 672]", "cuda -keys=cuda,gpu -max_num_threads=1024 -model=unknown -thread_warp_size=32", [-1, 16, 64, 49152, 2147483647, 1024, 8, 32], "", 0, []], [[], [["FU", 1, [0, 1, 2, 3]], ["SP", 1, 0, 672, [48], 1], ["AN", 1, 0, 5], ["AN", 1, 1, 6]]]], "r": [[2.4918e-06, 2.47827e-06, 2.48631e-06], 0, 3.63174, 1667944086], "v": "v0.6"}
{"i": [["[\"sigmoid\", 1, 1, 1, 672]", "cuda -keys=cuda,gpu -max_num_threads=1024 -model=unknown -thread_warp_size=32", [-1, 16, 64, 49152, 2147483647, 1024, 8, 32], "", 0, []], [[], [["FU", 1, [0, 1, 2, 3]], ["SP", 1, 0, 672, [6], 1], ["AN", 1, 0, 5], ["AN", 1, 1, 6]]]], "r": [[2.68294e-06, 2.67743e-06, 2.67624e-06], 0, 3.87641, 1667944086], "v": "v0.6"}
{"i": [["[\"sigmoid\", 1, 1, 1, 672]", "cuda -keys=cuda,gpu -max_num_threads=1024 -model=unknown -thread_warp_size=32", [-1, 16, 64, 49152, 2147483647, 1024, 8, 32], "", 0, []], [[], [["FU", 1, [0, 1, 2, 3]], ["SP", 1, 0, 672, [1], 1], ["AN", 1, 0, 5], ["AN", 1, 1, 6]]]], "r": [[3.19178e-06, 3.20712e-06, 3.19642e-06], 0, 4.15951, 1667944086], "v": "v0.6"}
{"i": [["[\"sigmoid\", 1, 1, 1, 672]", "cuda -keys=cuda,gpu -max_num_threads=1024 -model=unknown -thread_warp_size=32", [-1, 16, 64, 49152, 2147483647, 1024, 8, 32], "", 0, []], [[], [["FU", 1, [0, 1, 2, 3]], ["SP", 1, 0, 672, [21], 1], ["AN", 1, 0, 5], ["AN", 1, 1, 6]]]], "r": [[2.51164e-06, 2.49981e-06, 2.50227e-06], 0, 4.45635, 1667944087], "v": "v0.6"}
{"i": [["[\"sigmoid\", 1, 1, 1, 672]", "cuda -keys=cuda,gpu -max_num_threads=1024 -model=unknown -thread_warp_size=32", [-1, 16, 64, 49152, 2147483647, 1024, 8, 32], "", 0, []], [[], [["FU", 1, [0, 1, 2, 3]], ["SP", 1, 0, 672, [8], 1], ["AN", 1, 0, 5], ["AN", 1, 1, 6]]]], "r": [[2.74097e-06, 2.74082e-06, 2.73822e-06], 0, 4.6837, 1667944087], "v": "v0.6"}
{"i": [["[\"sigmoid\", 1, 1, 1, 672]", "cuda -keys=cuda,gpu -max_num_threads=1024 -model=unknown -thread_warp_size=32", [-1, 16, 64, 49152, 2147483647, 1024, 8, 32], "", 0, []], [[], [["FU", 1, [0, 1, 2, 3]], ["SP", 1, 0, 672, [7], 1], ["AN", 1, 0, 5], ["AN", 1, 1, 6]]]], "r": [[2.65701e-06, 2.66495e-06, 2.67435e-06], 0, 4.93856, 1667944087], "v": "v0.6"}
{"i": [["[\"sigmoid\", 1, 1, 1, 672]", "cuda -keys=cuda,gpu -max_num_threads=1024 -model=unknown -thread_warp_size=32", [-1, 16, 64, 49152, 2147483647, 1024, 8, 32], "", 0, []], [[], [["FU", 1, [0, 1, 2, 3]], ["SP", 1, 0, 672, [4], 1], ["AN", 1, 0, 5], ["AN", 1, 1, 6]]]], "r": [[2.8863e-06, 2.8987e-06, 2.8988e-06], 0, 1.16897, 1667944629], "v": "v0.6"}
{"i": [["[\"sigmoid\", 1, 1, 1, 672]", "cuda -keys=cuda,gpu -max_num_threads=1024 -model=unknown -thread_warp_size=32", [-1, 16, 64, 49152, 2147483647, 1024, 8, 32], "", 0, []], [[], [["FU", 1, [0, 1, 2, 3]], ["SP", 1, 0, 672, [1], 1], ["AN", 1, 0, 5], ["AN", 1, 1, 6]]]], "r": [[3.09187e-06, 3.08572e-06, 3.08485e-06], 0, 0.885771, 1667944629], "v": "v0.6"}
{"i": [["[\"sigmoid\", 1, 1, 1, 672]", "cuda -keys=cuda,gpu -max_num_threads=1024 -model=unknown -thread_warp_size=32", [-1, 16, 64, 49152, 2147483647, 1024, 8, 32], "", 0, []], [[], [["FU", 1, [0, 1, 2, 3]], ["SP", 1, 0, 672, [7], 1], ["AN", 1, 0, 5], ["AN", 1, 1, 6]]]], "r": [[2.6339e-06, 2.62693e-06, 2.62908e-06], 0, 1.72482, 1667944630], "v": "v0.6"}
{"i": [["[\"sigmoid\", 1, 1, 1, 672]", "cuda -keys=cuda,gpu -max_num_threads=1024 -model=unknown -thread_warp_size=32", [-1, 16, 64, 49152, 2147483647, 1024, 8, 32], "", 0, []], [[], [["FU", 1, [0, 1, 2, 3]], ["SP", 1, 0, 672, [56], 1], ["AN", 1, 0, 5], ["AN", 1, 1, 6]]]], "r": [[2.46449e-06, 2.45469e-06, 2.45244e-06], 0, 1.44181, 1667944630], "v": "v0.6"}
{"i": [["[\"sigmoid\", 1, 1, 1, 672]", "cuda -keys=cuda,gpu -max_num_threads=1024 -model=unknown -thread_warp_size=32", [-1, 16, 64, 49152, 2147483647, 1024, 8, 32], "", 0, []], [[], [["FU", 1, [0, 1, 2, 3]], ["SP", 1, 0, 672, [2], 1], ["AN", 1, 0, 5], ["AN", 1, 1, 6]]]], "r": [[2.83946e-06, 2.83563e-06, 2.83514e-06], 0, 0.569611, 1667944629], "v": "v0.6"}
{"i": [["[\"sigmoid\", 1, 1, 1, 672]", "cuda -keys=cuda,gpu -max_num_threads=1024 -model=unknown -thread_warp_size=32", [-1, 16, 64, 49152, 2147483647, 1024, 8, 32], "", 0, []], [[], [["FU", 1, [0, 1, 2, 3]], ["SP", 1, 0, 672, [32], 1], ["AN", 1, 0, 5], ["AN", 1, 1, 6]]]], "r": [[2.60179e-06, 2.5916e-06, 2.59189e-06], 0, 2.3215, 1667944631], "v": "v0.6"}
{"i": [["[\"sigmoid\", 1, 1, 1, 672]", "cuda -keys=cuda,gpu -max_num_threads=1024 -model=unknown -thread_warp_size=32", [-1, 16, 64, 49152, 2147483647, 1024, 8, 32], "", 0, []], [[], [["FU", 1, [0, 1, 2, 3]], ["SP", 1, 0, 672, [12], 1], ["AN", 1, 0, 5], ["AN", 1, 1, 6]]]], "r": [[2.53394e-06, 2.52575e-06, 2.52868e-06], 0, 2.07218, 1667944630], "v": "v0.6"}
{"i": [["[\"sigmoid\", 1, 1, 1, 672]", "cuda -keys=cuda,gpu -max_num_threads=1024 -model=unknown -thread_warp_size=32", [-1, 16, 64, 49152, 2147483647, 1024, 8, 32], "", 0, []], [[], [["FU", 1, [0, 1, 2, 3]], ["SP", 1, 0, 672, [6], 1], ["AN", 1, 0, 5], ["AN", 1, 1, 6]]]], "r": [[2.64921e-06, 2.64183e-06, 2.64292e-06], 0, 2.53438, 1667944631], "v": "v0.6"}
{"i": [["[\"sigmoid\", 1, 1, 1, 672]", "cuda -keys=cuda,gpu -max_num_threads=1024 -model=unknown -thread_warp_size=32", [-1, 16, 64, 49152, 2147483647, 1024, 8, 32], "", 0, []], [[], [["FU", 1, [0, 1, 2, 3]], ["SP", 1, 0, 672, [21], 1], ["AN", 1, 0, 5], ["AN", 1, 1, 6]]]], "r": [[2.60245e-06, 2.59956e-06, 2.60122e-06], 0, 2.81737, 1667944631], "v": "v0.6"}
{"i": [["[\"sigmoid\", 1, 1, 1, 672]", "cuda -keys=cuda,gpu -max_num_threads=1024 -model=unknown -thread_warp_size=32", [-1, 16, 64, 49152, 2147483647, 1024, 8, 32], "", 0, []], [[], [["FU", 1, [0, 1, 2, 3]], ["SP", 1, 0, 672, [3], 1], ["AN", 1, 0, 5], ["AN", 1, 1, 6]]]], "r": [[2.78888e-06, 2.78787e-06, 2.78864e-06], 0, 3.08813, 1667944632], "v": "v0.6"}
{"i": [["[\"sigmoid\", 1, 1, 1, 672]", "cuda -keys=cuda,gpu -max_num_threads=1024 -model=unknown -thread_warp_size=32", [-1, 16, 64, 49152, 2147483647, 1024, 8, 32], "", 0, []], [[], [["FU", 1, [0, 1, 2, 3]], ["SP", 1, 0, 672, [28], 1], ["AN", 1, 0, 5], ["AN", 1, 1, 6]]]], "r": [[2.54094e-06, 2.53265e-06, 2.53267e-06], 0, 3.33572, 1667944632], "v": "v0.6"}
{"i": [["[\"sigmoid\", 1, 1, 1, 672]", "cuda -keys=cuda,gpu -max_num_threads=1024 -model=unknown -thread_warp_size=32", [-1, 16, 64, 49152, 2147483647, 1024, 8, 32], "", 0, []], [[], [["FU", 1, [0, 1, 2, 3]], ["SP", 1, 0, 672, [48], 1], ["AN", 1, 0, 5], ["AN", 1, 1, 6]]]], "r": [[2.4806e-06, 2.46449e-06, 2.46835e-06], 0, 3.59865, 1667944632], "v": "v0.6"}
{"i": [["[\"sigmoid\", 1, 1, 1, 672]", "cuda -keys=cuda,gpu -max_num_threads=1024 -model=unknown -thread_warp_size=32", [-1, 16, 64, 49152, 2147483647, 1024, 8, 32], "", 0, []], [[], [["FU", 1, [0, 1, 2, 3]], ["SP", 1, 0, 672, [24], 1], ["AN", 1, 0, 5], ["AN", 1, 1, 6]]]], "r": [[2.63223e-06, 2.62382e-06, 2.6249e-06], 0, 3.87295, 1667944633], "v": "v0.6"}
{"i": [["[\"sigmoid\", 1, 1, 1, 672]", "cuda -keys=cuda,gpu -max_num_threads=1024 -model=unknown -thread_warp_size=32", [-1, 16, 64, 49152, 2147483647, 1024, 8, 32], "", 0, []], [[], [["FU", 1, [0, 1, 2, 3]], ["SP", 1, 0, 672, [42], 1], ["AN", 1, 0, 5], ["AN", 1, 1, 6]]]], "r": [[2.50391e-06, 2.49241e-06, 2.49351e-06], 0, 4.16448, 1667944633], "v": "v0.6"}
{"i": [["[\"sigmoid\", 1, 1, 1, 672]", "cuda -keys=cuda,gpu -max_num_threads=1024 -model=unknown -thread_warp_size=32", [-1, 16, 64, 49152, 2147483647, 1024, 8, 32], "", 0, []], [[], [["FU", 1, [0, 1, 2, 3]], ["SP", 1, 0, 672, [16], 1], ["AN", 1, 0, 5], ["AN", 1, 1, 6]]]], "r": [[2.58594e-06, 2.57352e-06, 2.57597e-06], 0, 4.5034, 1667944633], "v": "v0.6"}
{"i": [["[\"sigmoid\", 1, 1, 1, 672]", "cuda -keys=cuda,gpu -max_num_threads=1024 -model=unknown -thread_warp_size=32", [-1, 16, 64, 49152, 2147483647, 1024, 8, 32], "", 0, []], [[], [["FU", 1, [0, 1, 2, 3]], ["SP", 1, 0, 672, [14], 1], ["AN", 1, 0, 5], ["AN", 1, 1, 6]]]], "r": [[2.72983e-06, 2.74834e-06, 2.7528e-06], 0, 4.69071, 1667944634], "v": "v0.6"}
{"i": [["[\"sigmoid\", 1, 1, 1, 672]", "cuda -keys=cuda,gpu -max_num_threads=1024 -model=unknown -thread_warp_size=32", [-1, 16, 64, 49152, 2147483647, 1024, 8, 32], "", 0, []], [[], [["FU", 1, [0, 1, 2, 3]], ["SP", 1, 0, 672, [8], 1], ["AN", 1, 0, 5], ["AN", 1, 1, 6]]]], "r": [[2.56223e-06, 2.5516e-06, 2.55577e-06], 0, 4.96735, 1667944634], "v": "v0.6"}
{"i": [["[\"sigmoid\", 1, 1, 1, 672]", "cuda -keys=cuda,gpu -max_num_threads=1024 -model=unknown -thread_warp_size=32", [-1, 16, 64, 49152, 2147483647, 1024, 8, 32], "", 0, []], [[], [["FU", 1, [0, 1, 2, 3]], ["SP", 1, 0, 672, [32], 1], ["AN", 1, 0, 5], ["AN", 1, 1, 6]]]], "r": [[2.69484e-06, 2.69205e-06, 2.69612e-06], 0, 0.965348, 1667945163], "v": "v0.6"}
{"i": [["[\"sigmoid\", 1, 1, 1, 672]", "cuda -keys=cuda,gpu -max_num_threads=1024 -model=unknown -thread_warp_size=32", [-1, 16, 64, 49152, 2147483647, 1024, 8, 32], "", 0, []], [[], [["FU", 1, [0, 1, 2, 3]], ["SP", 1, 0, 672, [3], 1], ["AN", 1, 0, 5], ["AN", 1, 1, 6]]]], "r": [[2.77164e-06, 2.77292e-06, 2.77262e-06], 0, 2.40783, 1667945165], "v": "v0.6"}
{"i": [["[\"sigmoid\", 1, 1, 1, 672]", "cuda -keys=cuda,gpu -max_num_threads=1024 -model=unknown -thread_warp_size=32", [-1, 16, 64, 49152, 2147483647, 1024, 8, 32], "", 0, []], [[], [["FU", 1, [0, 1, 2, 3]], ["SP", 1, 0, 672, [56], 1], ["AN", 1, 0, 5], ["AN", 1, 1, 6]]]], "r": [[2.52801e-06, 2.5204e-06, 2.52365e-06], 0, 1.84403, 1667945164], "v": "v0.6"}
{"i": [["[\"sigmoid\", 1, 1, 1, 672]", "cuda -keys=cuda,gpu -max_num_threads=1024 -model=unknown -thread_warp_size=32", [-1, 16, 64, 49152, 2147483647, 1024, 8, 32], "", 0, []], [[], [["FU", 1, [0, 1, 2, 3]], ["SP", 1, 0, 672, [7], 1], ["AN", 1, 0, 5], ["AN", 1, 1, 6]]]], "r": [[2.65427e-06, 2.66963e-06, 2.67862e-06], 0, 1.5574, 1667945164], "v": "v0.6"}
{"i": [["[\"sigmoid\", 1, 1, 1, 672]", "cuda -keys=cuda,gpu -max_num_threads=1024 -model=unknown -thread_warp_size=32", [-1, 16, 64, 49152, 2147483647, 1024, 8, 32], "", 0, []], [[], [["FU", 1, [0, 1, 2, 3]], ["SP", 1, 0, 672, [42], 1], ["AN", 1, 0, 5], ["AN", 1, 1, 6]]]], "r": [[2.51369e-06, 2.49973e-06, 2.50671e-06], 0, 1.29068, 1667945163], "v": "v0.6"}
{"i": [["[\"sigmoid\", 1, 1, 1, 672]", "cuda -keys=cuda,gpu -max_num_threads=1024 -model=unknown -thread_warp_size=32", [-1, 16, 64, 49152, 2147483647, 1024, 8, 32], "", 0, []], [[], [["FU", 1, [0, 1, 2, 3]], ["SP", 1, 0, 672, [4], 1], ["AN", 1, 0, 5], ["AN", 1, 1, 6]]]], "r": [[2.83469e-06, 2.83552e-06, 2.83975e-06], 0, 0.659388, 1667945163], "v": "v0.6"}
{"i": [["[\"sigmoid\", 1, 1, 1, 672]", "cuda -keys=cuda,gpu -max_num_threads=1024 -model=unknown -thread_warp_size=32", [-1, 16, 64, 49152, 2147483647, 1024, 8, 32], "", 0, []], [[], [["FU", 1, [0, 1, 2, 3]], ["SP", 1, 0, 672, [24], 1], ["AN", 1, 0, 5], ["AN", 1, 1, 6]]]], "r": [[2.56524e-06, 2.55152e-06, 2.55229e-06], 0, 2.1259, 1667945164], "v": "v0.6"}
{"i": [["[\"sigmoid\", 1, 1, 1, 672]", "cuda -keys=cuda,gpu -max_num_threads=1024 -model=unknown -thread_warp_size=32", [-1, 16, 64, 49152, 2147483647, 1024, 8, 32], "", 0, []], [[], [["FU", 1, [0, 1, 2, 3]], ["SP", 1, 0, 672, [8], 1], ["AN", 1, 0, 5], ["AN", 1, 1, 6]]]], "r": [[2.59575e-06, 2.58184e-06, 2.58557e-06], 0, 2.6136, 1667945165], "v": "v0.6"}
{"i": [["[\"sigmoid\", 1, 1, 1, 672]", "cuda -keys=cuda,gpu -max_num_threads=1024 -model=unknown -thread_warp_size=32", [-1, 16, 64, 49152, 2147483647, 1024, 8, 32], "", 0, []], [[], [["FU", 1, [0, 1, 2, 3]], ["SP", 1, 0, 672, [16], 1], ["AN", 1, 0, 5], ["AN", 1, 1, 6]]]], "r": [[2.60345e-06, 2.5948e-06, 2.59461e-06], 0, 2.89563, 1667945165], "v": "v0.6"}
{"i": [["[\"sigmoid\", 1, 1, 1, 672]", "cuda -keys=cuda,gpu -max_num_threads=1024 -model=unknown -thread_warp_size=32", [-1, 16, 64, 49152, 2147483647, 1024, 8, 32], "", 0, []], [[], [["FU", 1, [0, 1, 2, 3]], ["SP", 1, 0, 672, [1], 1], ["AN", 1, 0, 5], ["AN", 1, 1, 6]]]], "r": [[3.17069e-06, 3.16929e-06, 3.16913e-06], 0, 3.37442, 1667945166], "v": "v0.6"}
{"i": [["[\"sigmoid\", 1, 1, 1, 672]", "cuda -keys=cuda,gpu -max_num_threads=1024 -model=unknown -thread_warp_size=32", [-1, 16, 64, 49152, 2147483647, 1024, 8, 32], "", 0, []], [[], [["FU", 1, [0, 1, 2, 3]], ["SP", 1, 0, 672, [28], 1], ["AN", 1, 0, 5], ["AN", 1, 1, 6]]]], "r": [[2.51332e-06, 2.50261e-06, 2.50856e-06], 0, 3.08996, 1667945166], "v": "v0.6"}
{"i": [["[\"sigmoid\", 1, 1, 1, 672]", "cuda -keys=cuda,gpu -max_num_threads=1024 -model=unknown -thread_warp_size=32", [-1, 16, 64, 49152, 2147483647, 1024, 8, 32], "", 0, []], [[], [["FU", 1, [0, 1, 2, 3]], ["SP", 1, 0, 672, [6], 1], ["AN", 1, 0, 5], ["AN", 1, 1, 6]]]], "r": [[2.6288e-06, 2.63747e-06, 2.64285e-06], 0, 3.92386, 1667945167], "v": "v0.6"}
{"i": [["[\"sigmoid\", 1, 1, 1, 672]", "cuda -keys=cuda,gpu -max_num_threads=1024 -model=unknown -thread_warp_size=32", [-1, 16, 64, 49152, 2147483647, 1024, 8, 32], "", 0, []], [[], [["FU", 1, [0, 1, 2, 3]], ["SP", 1, 0, 672, [14], 1], ["AN", 1, 0, 5], ["AN", 1, 1, 6]]]], "r": [[2.50859e-06, 2.49405e-06, 2.49782e-06], 0, 3.62063, 1667945166], "v": "v0.6"}
{"i": [["[\"sigmoid\", 1, 1, 1, 672]", "cuda -keys=cuda,gpu -max_num_threads=1024 -model=unknown -thread_warp_size=32", [-1, 16, 64, 49152, 2147483647, 1024, 8, 32], "", 0, []], [[], [["FU", 1, [0, 1, 2, 3]], ["SP", 1, 0, 672, [21], 1], ["AN", 1, 0, 5], ["AN", 1, 1, 6]]]], "r": [[2.48788e-06, 2.49724e-06, 2.48796e-06], 0, 4.11836, 1667945167], "v": "v0.6"}
{"i": [["[\"sigmoid\", 1, 1, 1, 672]", "cuda -keys=cuda,gpu -max_num_threads=1024 -model=unknown -thread_warp_size=32", [-1, 16, 64, 49152, 2147483647, 1024, 8, 32], "", 0, []], [[], [["FU", 1, [0, 1, 2, 3]], ["SP", 1, 0, 672, [2], 1], ["AN", 1, 0, 5], ["AN", 1, 1, 6]]]], "r": [[2.99723e-06, 3.00781e-06, 3.00532e-06], 0, 4.44691, 1667945167], "v": "v0.6"}
{"i": [["[\"sigmoid\", 1, 1, 1, 672]", "cuda -keys=cuda,gpu -max_num_threads=1024 -model=unknown -thread_warp_size=32", [-1, 16, 64, 49152, 2147483647, 1024, 8, 32], "", 0, []], [[], [["FU", 1, [0, 1, 2, 3]], ["SP", 1, 0, 672, [12], 1], ["AN", 1, 0, 5], ["AN", 1, 1, 6]]]], "r": [[2.72061e-06, 2.74128e-06, 2.73826e-06], 0, 4.69416, 1667945168], "v": "v0.6"}
{"i": [["[\"sigmoid\", 1, 1, 1, 672]", "cuda -keys=cuda,gpu -max_num_threads=1024 -model=unknown -thread_warp_size=32", [-1, 16, 64, 49152, 2147483647, 1024, 8, 32], "", 0, []], [[], [["FU", 1, [0, 1, 2, 3]], ["SP", 1, 0, 672, [48], 1], ["AN", 1, 0, 5], ["AN", 1, 1, 6]]]], "r": [[2.48198e-06, 2.46583e-06, 2.47213e-06], 0, 4.92608, 1667945168], "v": "v0.6"}
