python/models/efficientnet/VertiFusionEfficientNet_kernel_configs/efficient_batch_norm_1_14_14_672.log
{"i": [["[\"batch_norm\", 1, 14, 14, 672]", "cuda -keys=cuda,gpu -max_num_threads=1024 -model=unknown -thread_warp_size=32", [-1, 16, 64, 49152, 2147483647, 1024, 8, 32], "", 0, []], [[], [["CI", 2], ["FU", 4, [0, 1, 2, 3]], ["SP", 4, 0, 131712, [24], 1], ["AN", 4, 0, 5], ["AN", 4, 1, 6]]]], "r": [[6.79023e-06, 6.79891e-06, 6.79153e-06], 0, 2.66784, 1667927122], "v": "v0.6"}
{"i": [["[\"batch_norm\", 1, 14, 14, 672]", "cuda -keys=cuda,gpu -max_num_threads=1024 -model=unknown -thread_warp_size=32", [-1, 16, 64, 49152, 2147483647, 1024, 8, 32], "", 0, []], [[], [["CI", 2], ["FU", 4, [0, 1, 2, 3]], ["SP", 4, 0, 131712, [56], 1], ["AN", 4, 0, 5], ["AN", 4, 1, 6]]]], "r": [[4.3297e-06, 4.32912e-06, 4.33091e-06], 0, 0.907645, 1667927120], "v": "v0.6"}
{"i": [["[\"batch_norm\", 1, 14, 14, 672]", "cuda -keys=cuda,gpu -max_num_threads=1024 -model=unknown -thread_warp_size=32", [-1, 16, 64, 49152, 2147483647, 1024, 8, 32], "", 0, []], [[], [["CI", 2], ["FU", 4, [0, 1, 2, 3]], ["SP", 4, 0, 131712, [8], 1], ["AN", 4, 0, 5], ["AN", 4, 1, 6]]]], "r": [[1.5084e-05, 1.50731e-05, 1.508e-05], 0, 1.27001, 1667927120], "v": "v0.6"}
{"i": [["[\"batch_norm\", 1, 14, 14, 672]", "cuda -keys=cuda,gpu -max_num_threads=1024 -model=unknown -thread_warp_size=32", [-1, 16, 64, 49152, 2147483647, 1024, 8, 32], "", 0, []], [[], [["CI", 2], ["FU", 4, [0, 1, 2, 3]], ["SP", 4, 0, 131712, [3], 1], ["AN", 4, 0, 5], ["AN", 4, 1, 6]]]], "r": [[3.53264e-05, 3.53464e-05, 3.53334e-05], 0, 1.67133, 1667927120], "v": "v0.6"}
{"i": [["[\"batch_norm\", 1, 14, 14, 672]", "cuda -keys=cuda,gpu -max_num_threads=1024 -model=unknown -thread_warp_size=32", [-1, 16, 64, 49152, 2147483647, 1024, 8, 32], "", 0, []], [[], [["CI", 2], ["FU", 4, [0, 1, 2, 3]], ["SP", 4, 0, 131712, [12], 1], ["AN", 4, 0, 5], ["AN", 4, 1, 6]]]], "r": [[1.07994e-05, 1.07985e-05, 1.08006e-05], 0, 2.37324, 1667927121], "v": "v0.6"}
{"i": [["[\"batch_norm\", 1, 14, 14, 672]", "cuda -keys=cuda,gpu -max_num_threads=1024 -model=unknown -thread_warp_size=32", [-1, 16, 64, 49152, 2147483647, 1024, 8, 32], "", 0, []], [[], [["CI", 2], ["FU", 4, [0, 1, 2, 3]], ["SP", 4, 0, 131712, [7], 1], ["AN", 4, 0, 5], ["AN", 4, 1, 6]]]], "r": [[1.67542e-05, 1.67775e-05, 1.67618e-05], 0, 0.696182, 1667927119], "v": "v0.6"}
{"i": [["[\"batch_norm\", 1, 14, 14, 672]", "cuda -keys=cuda,gpu -max_num_threads=1024 -model=unknown -thread_warp_size=32", [-1, 16, 64, 49152, 2147483647, 1024, 8, 32], "", 0, []], [[], [["CI", 2], ["FU", 4, [0, 1, 2, 3]], ["SP", 4, 0, 131712, [4], 1], ["AN", 4, 0, 5], ["AN", 4, 1, 6]]]], "r": [[2.70627e-05, 2.70631e-05, 2.70615e-05], 0, 1.97903, 1667927121], "v": "v0.6"}
{"i": [["[\"batch_norm\", 1, 14, 14, 672]", "cuda -keys=cuda,gpu -max_num_threads=1024 -model=unknown -thread_warp_size=32", [-1, 16, 64, 49152, 2147483647, 1024, 8, 32], "", 0, []], [[], [["CI", 2], ["FU", 4, [0, 1, 2, 3]], ["SP", 4, 0, 131712, [32], 1], ["AN", 4, 0, 5], ["AN", 4, 1, 6]]]], "r": [[5.78362e-06, 5.78318e-06, 5.78517e-06], 0, 4.11797, 1667927123], "v": "v0.6"}
{"i": [["[\"batch_norm\", 1, 14, 14, 672]", "cuda -keys=cuda,gpu -max_num_threads=1024 -model=unknown -thread_warp_size=32", [-1, 16, 64, 49152, 2147483647, 1024, 8, 32], "", 0, []], [[], [["CI", 2], ["FU", 4, [0, 1, 2, 3]], ["SP", 4, 0, 131712, [16], 1], ["AN", 4, 0, 5], ["AN", 4, 1, 6]]]], "r": [[8.76354e-06, 8.77172e-06, 8.76076e-06], 0, 3.26617, 1667927122], "v": "v0.6"}
{"i": [["[\"batch_norm\", 1, 14, 14, 672]", "cuda -keys=cuda,gpu -max_num_threads=1024 -model=unknown -thread_warp_size=32", [-1, 16, 64, 49152, 2147483647, 1024, 8, 32], "", 0, []], [[], [["CI", 2], ["FU", 4, [0, 1, 2, 3]], ["SP", 4, 0, 131712, [64], 1], ["AN", 4, 0, 5], ["AN", 4, 1, 6]]]], "r": [[4.20087e-06, 4.19986e-06, 4.20257e-06], 0, 2.88022, 1667927122], "v": "v0.6"}
{"i": [["[\"batch_norm\", 1, 14, 14, 672]", "cuda -keys=cuda,gpu -max_num_threads=1024 -model=unknown -thread_warp_size=32", [-1, 16, 64, 49152, 2147483647, 1024, 8, 32], "", 0, []], [[], [["CI", 2], ["FU", 4, [0, 1, 2, 3]], ["SP", 4, 0, 131712, [28], 1], ["AN", 4, 0, 5], ["AN", 4, 1, 6]]]], "r": [[6.0771e-06, 6.07678e-06, 6.07789e-06], 0, 3.56042, 1667927123], "v": "v0.6"}
{"i": [["[\"batch_norm\", 1, 14, 14, 672]", "cuda -keys=cuda,gpu -max_num_threads=1024 -model=unknown -thread_warp_size=32", [-1, 16, 64, 49152, 2147483647, 1024, 8, 32], "", 0, []], [[], [["CI", 2], ["FU", 4, [0, 1, 2, 3]], ["SP", 4, 0, 131712, [6], 1], ["AN", 4, 0, 5], ["AN", 4, 1, 6]]]], "r": [[1.91192e-05, 1.91334e-05, 1.91111e-05], 0, 3.73641, 1667927123], "v": "v0.6"}
{"i": [["[\"batch_norm\", 1, 14, 14, 672]", "cuda -keys=cuda,gpu -max_num_threads=1024 -model=unknown -thread_warp_size=32", [-1, 16, 64, 49152, 2147483647, 1024, 8, 32], "", 0, []], [[], [["CI", 2], ["FU", 4, [0, 1, 2, 3]], ["SP", 4, 0, 131712, [21], 1], ["AN", 4, 0, 5], ["AN", 4, 1, 6]]]], "r": [[7.21237e-06, 7.21423e-06, 7.21387e-06], 0, 4.41536, 1667927124], "v": "v0.6"}
{"i": [["[\"batch_norm\", 1, 14, 14, 672]", "cuda -keys=cuda,gpu -max_num_threads=1024 -model=unknown -thread_warp_size=32", [-1, 16, 64, 49152, 2147483647, 1024, 8, 32], "", 0, []], [[], [["CI", 2], ["FU", 4, [0, 1, 2, 3]], ["SP", 4, 0, 131712, [42], 1], ["AN", 4, 0, 5], ["AN", 4, 1, 6]]]], "r": [[4.90898e-06, 4.9123e-06, 4.90769e-06], 0, 4.68383, 1667927124], "v": "v0.6"}
{"i": [["[\"batch_norm\", 1, 14, 14, 672]", "cuda -keys=cuda,gpu -max_num_threads=1024 -model=unknown -thread_warp_size=32", [-1, 16, 64, 49152, 2147483647, 1024, 8, 32], "", 0, []], [[], [["CI", 2], ["FU", 4, [0, 1, 2, 3]], ["SP", 4, 0, 131712, [1], 1], ["AN", 4, 0, 5], ["AN", 4, 1, 6]]]], "r": [[0.000100284, 0.000100289, 0.000100278], 0, 5.04158, 1667927124], "v": "v0.6"}
{"i": [["[\"batch_norm\", 1, 14, 14, 672]", "cuda -keys=cuda,gpu -max_num_threads=1024 -model=unknown -thread_warp_size=32", [-1, 16, 64, 49152, 2147483647, 1024, 8, 32], "", 0, []], [[], [["CI", 2], ["FU", 4, [0, 1, 2, 3]], ["SP", 4, 0, 131712, [14], 1], ["AN", 4, 0, 5], ["AN", 4, 1, 6]]]], "r": [[9.71842e-06, 9.71321e-06, 9.71386e-06], 0, 5.56493, 1667927125], "v": "v0.6"}
{"i": [["[\"batch_norm\", 1, 14, 14, 672]", "cuda -keys=cuda,gpu -max_num_threads=1024 -model=unknown -thread_warp_size=32", [-1, 16, 64, 49152, 2147483647, 1024, 8, 32], "", 0, []], [[], [["CI", 2], ["FU", 4, [0, 1, 2, 3]], ["SP", 4, 0, 131712, [48], 1], ["AN", 4, 0, 5], ["AN", 4, 1, 6]]]], "r": [[4.7814e-06, 4.78068e-06, 4.76995e-06], 0, 5.23104, 1667927125], "v": "v0.6"}
{"i": [["[\"batch_norm\", 1, 14, 14, 672]", "cuda -keys=cuda,gpu -max_num_threads=1024 -model=unknown -thread_warp_size=32", [-1, 16, 64, 49152, 2147483647, 1024, 8, 32], "", 0, []], [[], [["CI", 2], ["FU", 4, [0, 1, 2, 3]], ["SP", 4, 0, 131712, [2], 1], ["AN", 4, 0, 5], ["AN", 4, 1, 6]]]], "r": [[5.16155e-05, 5.16101e-05, 5.16183e-05], 0, 5.89571, 1667927125], "v": "v0.6"}
{"i": [["[\"batch_norm\", 1, 14, 14, 672]", "cuda -keys=cuda,gpu -max_num_threads=1024 -model=unknown -thread_warp_size=32", [-1, 16, 64, 49152, 2147483647, 1024, 8, 32], "", 0, []], [[], [["CI", 2], ["FU", 4, [0, 1, 2, 3]], ["SP", 4, 0, 131712, [49], 1], ["AN", 4, 0, 5], ["AN", 4, 1, 6]]]], "r": [[4.60618e-06, 4.60466e-06, 4.60622e-06], 0, 6.16598, 1667927126], "v": "v0.6"}
{"i": [["[\"batch_norm\", 1, 14, 14, 672]", "cuda -keys=cuda,gpu -max_num_threads=1024 -model=unknown -thread_warp_size=32", [-1, 16, 64, 49152, 2147483647, 1024, 8, 32], "", 0, []], [[], [["CI", 2], ["FU", 4, [0, 1, 2, 3]], ["SP", 4, 0, 131712, [16], 1], ["AN", 4, 0, 5], ["AN", 4, 1, 6]]]], "r": [[8.73301e-06, 8.73504e-06, 8.73463e-06], 0, 1.51511, 1667927211], "v": "v0.6"}
{"i": [["[\"batch_norm\", 1, 14, 14, 672]", "cuda -keys=cuda,gpu -max_num_threads=1024 -model=unknown -thread_warp_size=32", [-1, 16, 64, 49152, 2147483647, 1024, 8, 32], "", 0, []], [[], [["CI", 2], ["FU", 4, [0, 1, 2, 3]], ["SP", 4, 0, 131712, [56], 1], ["AN", 4, 0, 5], ["AN", 4, 1, 6]]]], "r": [[4.3301e-06, 4.33171e-06, 4.33225e-06], 0, 1.80319, 1667927211], "v": "v0.6"}
{"i": [["[\"batch_norm\", 1, 14, 14, 672]", "cuda -keys=cuda,gpu -max_num_threads=1024 -model=unknown -thread_warp_size=32", [-1, 16, 64, 49152, 2147483647, 1024, 8, 32], "", 0, []], [[], [["CI", 2], ["FU", 4, [0, 1, 2, 3]], ["SP", 4, 0, 131712, [1], 1], ["AN", 4, 0, 5], ["AN", 4, 1, 6]]]], "r": [[0.000100366, 0.000100383, 0.000100352], 0, 0.633686, 1667927210], "v": "v0.6"}
{"i": [["[\"batch_norm\", 1, 14, 14, 672]", "cuda -keys=cuda,gpu -max_num_threads=1024 -model=unknown -thread_warp_size=32", [-1, 16, 64, 49152, 2147483647, 1024, 8, 32], "", 0, []], [[], [["CI", 2], ["FU", 4, [0, 1, 2, 3]], ["SP", 4, 0, 131712, [49], 1], ["AN", 4, 0, 5], ["AN", 4, 1, 6]]]], "r": [[4.65043e-06, 4.6533e-06, 4.64853e-06], 0, 1.17317, 1667927210], "v": "v0.6"}
{"i": [["[\"batch_norm\", 1, 14, 14, 672]", "cuda -keys=cuda,gpu -max_num_threads=1024 -model=unknown -thread_warp_size=32", [-1, 16, 64, 49152, 2147483647, 1024, 8, 32], "", 0, []], [[], [["CI", 2], ["FU", 4, [0, 1, 2, 3]], ["SP", 4, 0, 131712, [24], 1], ["AN", 4, 0, 5], ["AN", 4, 1, 6]]]], "r": [[6.78477e-06, 6.78195e-06, 6.78891e-06], 0, 0.957821, 1667927210], "v": "v0.6"}
{"i": [["[\"batch_norm\", 1, 14, 14, 672]", "cuda -keys=cuda,gpu -max_num_threads=1024 -model=unknown -thread_warp_size=32", [-1, 16, 64, 49152, 2147483647, 1024, 8, 32], "", 0, []], [[], [["CI", 2], ["FU", 4, [0, 1, 2, 3]], ["SP", 4, 0, 131712, [8], 1], ["AN", 4, 0, 5], ["AN", 4, 1, 6]]]], "r": [[1.49433e-05, 1.49364e-05, 1.49383e-05], 0, 2.41534, 1667927212], "v": "v0.6"}
{"i": [["[\"batch_norm\", 1, 14, 14, 672]", "cuda -keys=cuda,gpu -max_num_threads=1024 -model=unknown -thread_warp_size=32", [-1, 16, 64, 49152, 2147483647, 1024, 8, 32], "", 0, []], [[], [["CI", 2], ["FU", 4, [0, 1, 2, 3]], ["SP", 4, 0, 131712, [14], 1], ["AN", 4, 0, 5], ["AN", 4, 1, 6]]]], "r": [[9.68156e-06, 9.68032e-06, 9.67989e-06], 0, 2.13052, 1667927211], "v": "v0.6"}
{"i": [["[\"batch_norm\", 1, 14, 14, 672]", "cuda -keys=cuda,gpu -max_num_threads=1024 -model=unknown -thread_warp_size=32", [-1, 16, 64, 49152, 2147483647, 1024, 8, 32], "", 0, []], [[], [["CI", 2], ["FU", 4, [0, 1, 2, 3]], ["SP", 4, 0, 131712, [32], 1], ["AN", 4, 0, 5], ["AN", 4, 1, 6]]]], "r": [[5.65717e-06, 5.65298e-06, 5.65283e-06], 0, 2.60397, 1667927212], "v": "v0.6"}
{"i": [["[\"batch_norm\", 1, 14, 14, 672]", "cuda -keys=cuda,gpu -max_num_threads=1024 -model=unknown -thread_warp_size=32", [-1, 16, 64, 49152, 2147483647, 1024, 8, 32], "", 0, []], [[], [["CI", 2], ["FU", 4, [0, 1, 2, 3]], ["SP", 4, 0, 131712, [64], 1], ["AN", 4, 0, 5], ["AN", 4, 1, 6]]]], "r": [[4.4004e-06, 4.39838e-06, 4.40249e-06], 0, 2.92791, 1667927212], "v": "v0.6"}
{"i": [["[\"batch_norm\", 1, 14, 14, 672]", "cuda -keys=cuda,gpu -max_num_threads=1024 -model=unknown -thread_warp_size=32", [-1, 16, 64, 49152, 2147483647, 1024, 8, 32], "", 0, []], [[], [["CI", 2], ["FU", 4, [0, 1, 2, 3]], ["SP", 4, 0, 131712, [7], 1], ["AN", 4, 0, 5], ["AN", 4, 1, 6]]]], "r": [[1.6839e-05, 1.68451e-05, 1.68289e-05], 0, 3.38081, 1667927213], "v": "v0.6"}
{"i": [["[\"batch_norm\", 1, 14, 14, 672]", "cuda -keys=cuda,gpu -max_num_threads=1024 -model=unknown -thread_warp_size=32", [-1, 16, 64, 49152, 2147483647, 1024, 8, 32], "", 0, []], [[], [["CI", 2], ["FU", 4, [0, 1, 2, 3]], ["SP", 4, 0, 131712, [28], 1], ["AN", 4, 0, 5], ["AN", 4, 1, 6]]]], "r": [[6.08579e-06, 6.08868e-06, 6.08977e-06], 0, 3.0882, 1667927213], "v": "v0.6"}
{"i": [["[\"batch_norm\", 1, 14, 14, 672]", "cuda -keys=cuda,gpu -max_num_threads=1024 -model=unknown -thread_warp_size=32", [-1, 16, 64, 49152, 2147483647, 1024, 8, 32], "", 0, []], [[], [["CI", 2], ["FU", 4, [0, 1, 2, 3]], ["SP", 4, 0, 131712, [4], 1], ["AN", 4, 0, 5], ["AN", 4, 1, 6]]]], "r": [[2.71361e-05, 2.71327e-05, 2.71311e-05], 0, 3.91872, 1667927214], "v": "v0.6"}
{"i": [["[\"batch_norm\", 1, 14, 14, 672]", "cuda -keys=cuda,gpu -max_num_threads=1024 -model=unknown -thread_warp_size=32", [-1, 16, 64, 49152, 2147483647, 1024, 8, 32], "", 0, []], [[], [["CI", 2], ["FU", 4, [0, 1, 2, 3]], ["SP", 4, 0, 131712, [2], 1], ["AN", 4, 0, 5], ["AN", 4, 1, 6]]]], "r": [[5.16957e-05, 5.16863e-05, 5.16556e-05], 0, 3.57833, 1667927213], "v": "v0.6"}
{"i": [["[\"batch_norm\", 1, 14, 14, 672]", "cuda -keys=cuda,gpu -max_num_threads=1024 -model=unknown -thread_warp_size=32", [-1, 16, 64, 49152, 2147483647, 1024, 8, 32], "", 0, []], [[], [["CI", 2], ["FU", 4, [0, 1, 2, 3]], ["SP", 4, 0, 131712, [3], 1], ["AN", 4, 0, 5], ["AN", 4, 1, 6]]]], "r": [[3.51695e-05, 3.51595e-05, 3.51711e-05], 0, 4.19666, 1667927214], "v": "v0.6"}
{"i": [["[\"batch_norm\", 1, 14, 14, 672]", "cuda -keys=cuda,gpu -max_num_threads=1024 -model=unknown -thread_warp_size=32", [-1, 16, 64, 49152, 2147483647, 1024, 8, 32], "", 0, []], [[], [["CI", 2], ["FU", 4, [0, 1, 2, 3]], ["SP", 4, 0, 131712, [6], 1], ["AN", 4, 0, 5], ["AN", 4, 1, 6]]]], "r": [[1.90506e-05, 1.90498e-05, 1.90525e-05], 0, 4.43302, 1667927214], "v": "v0.6"}
{"i": [["[\"batch_norm\", 1, 14, 14, 672]", "cuda -keys=cuda,gpu -max_num_threads=1024 -model=unknown -thread_warp_size=32", [-1, 16, 64, 49152, 2147483647, 1024, 8, 32], "", 0, []], [[], [["CI", 2], ["FU", 4, [0, 1, 2, 3]], ["SP", 4, 0, 131712, [42], 1], ["AN", 4, 0, 5], ["AN", 4, 1, 6]]]], "r": [[5.12321e-06, 5.1245e-06, 5.11916e-06], 0, 4.7308, 1667927215], "v": "v0.6"}
{"i": [["[\"batch_norm\", 1, 14, 14, 672]", "cuda -keys=cuda,gpu -max_num_threads=1024 -model=unknown -thread_warp_size=32", [-1, 16, 64, 49152, 2147483647, 1024, 8, 32], "", 0, []], [[], [["CI", 2], ["FU", 4, [0, 1, 2, 3]], ["SP", 4, 0, 131712, [48], 1], ["AN", 4, 0, 5], ["AN", 4, 1, 6]]]], "r": [[4.66236e-06, 4.6615e-06, 4.65445e-06], 0, 4.98853, 1667927215], "v": "v0.6"}
{"i": [["[\"batch_norm\", 1, 14, 14, 672]", "cuda -keys=cuda,gpu -max_num_threads=1024 -model=unknown -thread_warp_size=32", [-1, 16, 64, 49152, 2147483647, 1024, 8, 32], "", 0, []], [[], [["CI", 2], ["FU", 4, [0, 1, 2, 3]], ["SP", 4, 0, 131712, [12], 1], ["AN", 4, 0, 5], ["AN", 4, 1, 6]]]], "r": [[1.08567e-05, 1.08748e-05, 1.08979e-05], 0, 5.23218, 1667927215], "v": "v0.6"}
{"i": [["[\"batch_norm\", 1, 14, 14, 672]", "cuda -keys=cuda,gpu -max_num_threads=1024 -model=unknown -thread_warp_size=32", [-1, 16, 64, 49152, 2147483647, 1024, 8, 32], "", 0, []], [[], [["CI", 2], ["FU", 4, [0, 1, 2, 3]], ["SP", 4, 0, 131712, [21], 1], ["AN", 4, 0, 5], ["AN", 4, 1, 6]]]], "r": [[7.26813e-06, 7.27132e-06, 7.26537e-06], 0, 5.50331, 1667927215], "v": "v0.6"}
{"i": [["[\"batch_norm\", 1, 14, 14, 672]", "cuda -keys=cuda,gpu -max_num_threads=1024 -model=unknown -thread_warp_size=32", [-1, 16, 64, 49152, 2147483647, 1024, 8, 32], "", 0, []], [[], [["CI", 2], ["FU", 4, [0, 1, 2, 3]], ["SP", 4, 0, 131712, [16], 1], ["AN", 4, 0, 5], ["AN", 4, 1, 6]]]], "r": [[8.92549e-06, 8.932e-06, 8.93017e-06], 0, 0.593691, 1667942881], "v": "v0.6"}
{"i": [["[\"batch_norm\", 1, 14, 14, 672]", "cuda -keys=cuda,gpu -max_num_threads=1024 -model=unknown -thread_warp_size=32", [-1, 16, 64, 49152, 2147483647, 1024, 8, 32], "", 0, []], [[], [["CI", 2], ["FU", 4, [0, 1, 2, 3]], ["SP", 4, 0, 131712, [8], 1], ["AN", 4, 0, 5], ["AN", 4, 1, 6]]]], "r": [[1.50228e-05, 1.50183e-05, 1.50303e-05], 0, 1.21999, 1667942881], "v": "v0.6"}
{"i": [["[\"batch_norm\", 1, 14, 14, 672]", "cuda -keys=cuda,gpu -max_num_threads=1024 -model=unknown -thread_warp_size=32", [-1, 16, 64, 49152, 2147483647, 1024, 8, 32], "", 0, []], [[], [["CI", 2], ["FU", 4, [0, 1, 2, 3]], ["SP", 4, 0, 131712, [49], 1], ["AN", 4, 0, 5], ["AN", 4, 1, 6]]]], "r": [[4.61899e-06, 4.61977e-06, 4.61959e-06], 0, 1.80689, 1667942882], "v": "v0.6"}
{"i": [["[\"batch_norm\", 1, 14, 14, 672]", "cuda -keys=cuda,gpu -max_num_threads=1024 -model=unknown -thread_warp_size=32", [-1, 16, 64, 49152, 2147483647, 1024, 8, 32], "", 0, []], [[], [["CI", 2], ["FU", 4, [0, 1, 2, 3]], ["SP", 4, 0, 131712, [6], 1], ["AN", 4, 0, 5], ["AN", 4, 1, 6]]]], "r": [[1.90904e-05, 1.90864e-05, 1.90813e-05], 0, 2.47444, 1667942883], "v": "v0.6"}
{"i": [["[\"batch_norm\", 1, 14, 14, 672]", "cuda -keys=cuda,gpu -max_num_threads=1024 -model=unknown -thread_warp_size=32", [-1, 16, 64, 49152, 2147483647, 1024, 8, 32], "", 0, []], [[], [["CI", 2], ["FU", 4, [0, 1, 2, 3]], ["SP", 4, 0, 131712, [3], 1], ["AN", 4, 0, 5], ["AN", 4, 1, 6]]]], "r": [[3.53704e-05, 3.53581e-05, 3.53764e-05], 0, 0.963595, 1667942881], "v": "v0.6"}
{"i": [["[\"batch_norm\", 1, 14, 14, 672]", "cuda -keys=cuda,gpu -max_num_threads=1024 -model=unknown -thread_warp_size=32", [-1, 16, 64, 49152, 2147483647, 1024, 8, 32], "", 0, []], [[], [["CI", 2], ["FU", 4, [0, 1, 2, 3]], ["SP", 4, 0, 131712, [32], 1], ["AN", 4, 0, 5], ["AN", 4, 1, 6]]]], "r": [[5.65999e-06, 5.66588e-06, 5.67292e-06], 0, 2.11733, 1667942882], "v": "v0.6"}
{"i": [["[\"batch_norm\", 1, 14, 14, 672]", "cuda -keys=cuda,gpu -max_num_threads=1024 -model=unknown -thread_warp_size=32", [-1, 16, 64, 49152, 2147483647, 1024, 8, 32], "", 0, []], [[], [["CI", 2], ["FU", 4, [0, 1, 2, 3]], ["SP", 4, 0, 131712, [48], 1], ["AN", 4, 0, 5], ["AN", 4, 1, 6]]]], "r": [[4.74198e-06, 4.73894e-06, 4.73964e-06], 0, 1.54226, 1667942882], "v": "v0.6"}
{"i": [["[\"batch_norm\", 1, 14, 14, 672]", "cuda -keys=cuda,gpu -max_num_threads=1024 -model=unknown -thread_warp_size=32", [-1, 16, 64, 49152, 2147483647, 1024, 8, 32], "", 0, []], [[], [["CI", 2], ["FU", 4, [0, 1, 2, 3]], ["SP", 4, 0, 131712, [12], 1], ["AN", 4, 0, 5], ["AN", 4, 1, 6]]]], "r": [[1.10354e-05, 1.10394e-05, 1.10341e-05], 0, 2.69339, 1667942883], "v": "v0.6"}
{"i": [["[\"batch_norm\", 1, 14, 14, 672]", "cuda -keys=cuda,gpu -max_num_threads=1024 -model=unknown -thread_warp_size=32", [-1, 16, 64, 49152, 2147483647, 1024, 8, 32], "", 0, []], [[], [["CI", 2], ["FU", 4, [0, 1, 2, 3]], ["SP", 4, 0, 131712, [21], 1], ["AN", 4, 0, 5], ["AN", 4, 1, 6]]]], "r": [[7.40752e-06, 7.40504e-06, 7.40999e-06], 0, 2.95876, 1667942883], "v": "v0.6"}
{"i": [["[\"batch_norm\", 1, 14, 14, 672]", "cuda -keys=cuda,gpu -max_num_threads=1024 -model=unknown -thread_warp_size=32", [-1, 16, 64, 49152, 2147483647, 1024, 8, 32], "", 0, []], [[], [["CI", 2], ["FU", 4, [0, 1, 2, 3]], ["SP", 4, 0, 131712, [28], 1], ["AN", 4, 0, 5], ["AN", 4, 1, 6]]]], "r": [[6.07843e-06, 6.07646e-06, 6.07545e-06], 0, 3.21619, 1667942884], "v": "v0.6"}
{"i": [["[\"batch_norm\", 1, 14, 14, 672]", "cuda -keys=cuda,gpu -max_num_threads=1024 -model=unknown -thread_warp_size=32", [-1, 16, 64, 49152, 2147483647, 1024, 8, 32], "", 0, []], [[], [["CI", 2], ["FU", 4, [0, 1, 2, 3]], ["SP", 4, 0, 131712, [7], 1], ["AN", 4, 0, 5], ["AN", 4, 1, 6]]]], "r": [[1.68233e-05, 1.6829e-05, 1.6828e-05], 0, 3.45197, 1667942884], "v": "v0.6"}
{"i": [["[\"batch_norm\", 1, 14, 14, 672]", "cuda -keys=cuda,gpu -max_num_threads=1024 -model=unknown -thread_warp_size=32", [-1, 16, 64, 49152, 2147483647, 1024, 8, 32], "", 0, []], [[], [["CI", 2], ["FU", 4, [0, 1, 2, 3]], ["SP", 4, 0, 131712, [24], 1], ["AN", 4, 0, 5], ["AN", 4, 1, 6]]]], "r": [[6.78183e-06, 6.78544e-06, 6.77476e-06], 0, 3.92195, 1667942885], "v": "v0.6"}
{"i": [["[\"batch_norm\", 1, 14, 14, 672]", "cuda -keys=cuda,gpu -max_num_threads=1024 -model=unknown -thread_warp_size=32", [-1, 16, 64, 49152, 2147483647, 1024, 8, 32], "", 0, []], [[], [["CI", 2], ["FU", 4, [0, 1, 2, 3]], ["SP", 4, 0, 131712, [42], 1], ["AN", 4, 0, 5], ["AN", 4, 1, 6]]]], "r": [[4.95905e-06, 4.95178e-06, 4.94942e-06], 0, 3.56545, 1667942884], "v": "v0.6"}
{"i": [["[\"batch_norm\", 1, 14, 14, 672]", "cuda -keys=cuda,gpu -max_num_threads=1024 -model=unknown -thread_warp_size=32", [-1, 16, 64, 49152, 2147483647, 1024, 8, 32], "", 0, []], [[], [["CI", 2], ["FU", 4, [0, 1, 2, 3]], ["SP", 4, 0, 131712, [4], 1], ["AN", 4, 0, 5], ["AN", 4, 1, 6]]]], "r": [[2.73484e-05, 2.735e-05, 2.73479e-05], 0, 4.22658, 1667942885], "v": "v0.6"}
{"i": [["[\"batch_norm\", 1, 14, 14, 672]", "cuda -keys=cuda,gpu -max_num_threads=1024 -model=unknown -thread_warp_size=32", [-1, 16, 64, 49152, 2147483647, 1024, 8, 32], "", 0, []], [[], [["CI", 2], ["FU", 4, [0, 1, 2, 3]], ["SP", 4, 0, 131712, [56], 1], ["AN", 4, 0, 5], ["AN", 4, 1, 6]]]], "r": [[4.32859e-06, 4.33028e-06, 4.32993e-06], 0, 4.51112, 1667942885], "v": "v0.6"}
{"i": [["[\"batch_norm\", 1, 14, 14, 672]", "cuda -keys=cuda,gpu -max_num_threads=1024 -model=unknown -thread_warp_size=32", [-1, 16, 64, 49152, 2147483647, 1024, 8, 32], "", 0, []], [[], [["CI", 2], ["FU", 4, [0, 1, 2, 3]], ["SP", 4, 0, 131712, [2], 1], ["AN", 4, 0, 5], ["AN", 4, 1, 6]]]], "r": [[5.16897e-05, 5.16946e-05, 5.16846e-05], 0, 4.79407, 1667942886], "v": "v0.6"}
{"i": [["[\"batch_norm\", 1, 14, 14, 672]", "cuda -keys=cuda,gpu -max_num_threads=1024 -model=unknown -thread_warp_size=32", [-1, 16, 64, 49152, 2147483647, 1024, 8, 32], "", 0, []], [[], [["CI", 2], ["FU", 4, [0, 1, 2, 3]], ["SP", 4, 0, 131712, [1], 1], ["AN", 4, 0, 5], ["AN", 4, 1, 6]]]], "r": [[0.000100355, 0.000100363, 0.000100358], 0, 5.10805, 1667942886], "v": "v0.6"}
{"i": [["[\"batch_norm\", 1, 14, 14, 672]", "cuda -keys=cuda,gpu -max_num_threads=1024 -model=unknown -thread_warp_size=32", [-1, 16, 64, 49152, 2147483647, 1024, 8, 32], "", 0, []], [[], [["CI", 2], ["FU", 4, [0, 1, 2, 3]], ["SP", 4, 0, 131712, [64], 1], ["AN", 4, 0, 5], ["AN", 4, 1, 6]]]], "r": [[4.15608e-06, 4.1472e-06, 4.15311e-06], 0, 5.63416, 1667942887], "v": "v0.6"}
{"i": [["[\"batch_norm\", 1, 14, 14, 672]", "cuda -keys=cuda,gpu -max_num_threads=1024 -model=unknown -thread_warp_size=32", [-1, 16, 64, 49152, 2147483647, 1024, 8, 32], "", 0, []], [[], [["CI", 2], ["FU", 4, [0, 1, 2, 3]], ["SP", 4, 0, 131712, [14], 1], ["AN", 4, 0, 5], ["AN", 4, 1, 6]]]], "r": [[9.70519e-06, 9.70563e-06, 9.70285e-06], 0, 5.37572, 1667942886], "v": "v0.6"}
{"i": [["[\"batch_norm\", 1, 14, 14, 672]", "cuda -keys=cuda,gpu -max_num_threads=1024 -model=unknown -thread_warp_size=32", [-1, 16, 64, 49152, 2147483647, 1024, 8, 32], "", 0, []], [[], [["CI", 2], ["FU", 4, [0, 1, 2, 3]], ["SP", 4, 0, 131712, [24], 1], ["AN", 4, 0, 5], ["AN", 4, 1, 6]]]], "r": [[6.71569e-06, 6.72117e-06, 6.72318e-06], 0, 0.894963, 1667943251], "v": "v0.6"}
{"i": [["[\"batch_norm\", 1, 14, 14, 672]", "cuda -keys=cuda,gpu -max_num_threads=1024 -model=unknown -thread_warp_size=32", [-1, 16, 64, 49152, 2147483647, 1024, 8, 32], "", 0, []], [[], [["CI", 2], ["FU", 4, [0, 1, 2, 3]], ["SP", 4, 0, 131712, [16], 1], ["AN", 4, 0, 5], ["AN", 4, 1, 6]]]], "r": [[8.84508e-06, 8.84943e-06, 8.8557e-06], 0, 1.24691, 1667943252], "v": "v0.6"}
{"i": [["[\"batch_norm\", 1, 14, 14, 672]", "cuda -keys=cuda,gpu -max_num_threads=1024 -model=unknown -thread_warp_size=32", [-1, 16, 64, 49152, 2147483647, 1024, 8, 32], "", 0, []], [[], [["CI", 2], ["FU", 4, [0, 1, 2, 3]], ["SP", 4, 0, 131712, [12], 1], ["AN", 4, 0, 5], ["AN", 4, 1, 6]]]], "r": [[1.08658e-05, 1.08672e-05, 1.08571e-05], 0, 2.66155, 1667943253], "v": "v0.6"}
{"i": [["[\"batch_norm\", 1, 14, 14, 672]", "cuda -keys=cuda,gpu -max_num_threads=1024 -model=unknown -thread_warp_size=32", [-1, 16, 64, 49152, 2147483647, 1024, 8, 32], "", 0, []], [[], [["CI", 2], ["FU", 4, [0, 1, 2, 3]], ["SP", 4, 0, 131712, [4], 1], ["AN", 4, 0, 5], ["AN", 4, 1, 6]]]], "r": [[2.72178e-05, 2.72282e-05, 2.72175e-05], 0, 1.59899, 1667943252], "v": "v0.6"}
{"i": [["[\"batch_norm\", 1, 14, 14, 672]", "cuda -keys=cuda,gpu -max_num_threads=1024 -model=unknown -thread_warp_size=32", [-1, 16, 64, 49152, 2147483647, 1024, 8, 32], "", 0, []], [[], [["CI", 2], ["FU", 4, [0, 1, 2, 3]], ["SP", 4, 0, 131712, [48], 1], ["AN", 4, 0, 5], ["AN", 4, 1, 6]]]], "r": [[4.87669e-06, 4.87581e-06, 4.87198e-06], 0, 1.78228, 1667943252], "v": "v0.6"}
{"i": [["[\"batch_norm\", 1, 14, 14, 672]", "cuda -keys=cuda,gpu -max_num_threads=1024 -model=unknown -thread_warp_size=32", [-1, 16, 64, 49152, 2147483647, 1024, 8, 32], "", 0, []], [[], [["CI", 2], ["FU", 4, [0, 1, 2, 3]], ["SP", 4, 0, 131712, [6], 1], ["AN", 4, 0, 5], ["AN", 4, 1, 6]]]], "r": [[1.90616e-05, 1.90649e-05, 1.90531e-05], 0, 0.664012, 1667943251], "v": "v0.6"}
{"i": [["[\"batch_norm\", 1, 14, 14, 672]", "cuda -keys=cuda,gpu -max_num_threads=1024 -model=unknown -thread_warp_size=32", [-1, 16, 64, 49152, 2147483647, 1024, 8, 32], "", 0, []], [[], [["CI", 2], ["FU", 4, [0, 1, 2, 3]], ["SP", 4, 0, 131712, [1], 1], ["AN", 4, 0, 5], ["AN", 4, 1, 6]]]], "r": [[0.000100275, 0.000100273, 0.000100254], 0, 2.07067, 1667943253], "v": "v0.6"}
{"i": [["[\"batch_norm\", 1, 14, 14, 672]", "cuda -keys=cuda,gpu -max_num_threads=1024 -model=unknown -thread_warp_size=32", [-1, 16, 64, 49152, 2147483647, 1024, 8, 32], "", 0, []], [[], [["CI", 2], ["FU", 4, [0, 1, 2, 3]], ["SP", 4, 0, 131712, [28], 1], ["AN", 4, 0, 5], ["AN", 4, 1, 6]]]], "r": [[6.04942e-06, 6.05373e-06, 6.04741e-06], 0, 2.39381, 1667943253], "v": "v0.6"}
{"i": [["[\"batch_norm\", 1, 14, 14, 672]", "cuda -keys=cuda,gpu -max_num_threads=1024 -model=unknown -thread_warp_size=32", [-1, 16, 64, 49152, 2147483647, 1024, 8, 32], "", 0, []], [[], [["CI", 2], ["FU", 4, [0, 1, 2, 3]], ["SP", 4, 0, 131712, [3], 1], ["AN", 4, 0, 5], ["AN", 4, 1, 6]]]], "r": [[3.53591e-05, 3.5381e-05, 3.53769e-05], 0, 2.79792, 1667943254], "v": "v0.6"}
{"i": [["[\"batch_norm\", 1, 14, 14, 672]", "cuda -keys=cuda,gpu -max_num_threads=1024 -model=unknown -thread_warp_size=32", [-1, 16, 64, 49152, 2147483647, 1024, 8, 32], "", 0, []], [[], [["CI", 2], ["FU", 4, [0, 1, 2, 3]], ["SP", 4, 0, 131712, [64], 1], ["AN", 4, 0, 5], ["AN", 4, 1, 6]]]], "r": [[4.23035e-06, 4.22977e-06, 4.22878e-06], 0, 3.14816, 1667943254], "v": "v0.6"}
{"i": [["[\"batch_norm\", 1, 14, 14, 672]", "cuda -keys=cuda,gpu -max_num_threads=1024 -model=unknown -thread_warp_size=32", [-1, 16, 64, 49152, 2147483647, 1024, 8, 32], "", 0, []], [[], [["CI", 2], ["FU", 4, [0, 1, 2, 3]], ["SP", 4, 0, 131712, [49], 1], ["AN", 4, 0, 5], ["AN", 4, 1, 6]]]], "r": [[4.7145e-06, 4.71138e-06, 4.71057e-06], 0, 3.86661, 1667943255], "v": "v0.6"}
{"i": [["[\"batch_norm\", 1, 14, 14, 672]", "cuda -keys=cuda,gpu -max_num_threads=1024 -model=unknown -thread_warp_size=32", [-1, 16, 64, 49152, 2147483647, 1024, 8, 32], "", 0, []], [[], [["CI", 2], ["FU", 4, [0, 1, 2, 3]], ["SP", 4, 0, 131712, [42], 1], ["AN", 4, 0, 5], ["AN", 4, 1, 6]]]], "r": [[5.14086e-06, 5.13927e-06, 5.13765e-06], 0, 3.35915, 1667943254], "v": "v0.6"}
{"i": [["[\"batch_norm\", 1, 14, 14, 672]", "cuda -keys=cuda,gpu -max_num_threads=1024 -model=unknown -thread_warp_size=32", [-1, 16, 64, 49152, 2147483647, 1024, 8, 32], "", 0, []], [[], [["CI", 2], ["FU", 4, [0, 1, 2, 3]], ["SP", 4, 0, 131712, [14], 1], ["AN", 4, 0, 5], ["AN", 4, 1, 6]]]], "r": [[9.7912e-06, 9.78345e-06, 9.78452e-06], 0, 3.61413, 1667943255], "v": "v0.6"}
{"i": [["[\"batch_norm\", 1, 14, 14, 672]", "cuda -keys=cuda,gpu -max_num_threads=1024 -model=unknown -thread_warp_size=32", [-1, 16, 64, 49152, 2147483647, 1024, 8, 32], "", 0, []], [[], [["CI", 2], ["FU", 4, [0, 1, 2, 3]], ["SP", 4, 0, 131712, [32], 1], ["AN", 4, 0, 5], ["AN", 4, 1, 6]]]], "r": [[5.84927e-06, 5.84434e-06, 5.84359e-06], 0, 4.11179, 1667943255], "v": "v0.6"}
{"i": [["[\"batch_norm\", 1, 14, 14, 672]", "cuda -keys=cuda,gpu -max_num_threads=1024 -model=unknown -thread_warp_size=32", [-1, 16, 64, 49152, 2147483647, 1024, 8, 32], "", 0, []], [[], [["CI", 2], ["FU", 4, [0, 1, 2, 3]], ["SP", 4, 0, 131712, [8], 1], ["AN", 4, 0, 5], ["AN", 4, 1, 6]]]], "r": [[1.51102e-05, 1.51143e-05, 1.51112e-05], 0, 4.41619, 1667943256], "v": "v0.6"}
{"i": [["[\"batch_norm\", 1, 14, 14, 672]", "cuda -keys=cuda,gpu -max_num_threads=1024 -model=unknown -thread_warp_size=32", [-1, 16, 64, 49152, 2147483647, 1024, 8, 32], "", 0, []], [[], [["CI", 2], ["FU", 4, [0, 1, 2, 3]], ["SP", 4, 0, 131712, [21], 1], ["AN", 4, 0, 5], ["AN", 4, 1, 6]]]], "r": [[7.21313e-06, 7.214e-06, 7.21638e-06], 0, 4.71392, 1667943256], "v": "v0.6"}
{"i": [["[\"batch_norm\", 1, 14, 14, 672]", "cuda -keys=cuda,gpu -max_num_threads=1024 -model=unknown -thread_warp_size=32", [-1, 16, 64, 49152, 2147483647, 1024, 8, 32], "", 0, []], [[], [["CI", 2], ["FU", 4, [0, 1, 2, 3]], ["SP", 4, 0, 131712, [7], 1], ["AN", 4, 0, 5], ["AN", 4, 1, 6]]]], "r": [[1.68244e-05, 1.68174e-05, 1.6817e-05], 0, 4.95964, 1667943256], "v": "v0.6"}
{"i": [["[\"batch_norm\", 1, 14, 14, 672]", "cuda -keys=cuda,gpu -max_num_threads=1024 -model=unknown -thread_warp_size=32", [-1, 16, 64, 49152, 2147483647, 1024, 8, 32], "", 0, []], [[], [["CI", 2], ["FU", 4, [0, 1, 2, 3]], ["SP", 4, 0, 131712, [56], 1], ["AN", 4, 0, 5], ["AN", 4, 1, 6]]]], "r": [[4.39286e-06, 4.39413e-06, 4.39051e-06], 0, 5.30396, 1667943257], "v": "v0.6"}
{"i": [["[\"batch_norm\", 1, 14, 14, 672]", "cuda -keys=cuda,gpu -max_num_threads=1024 -model=unknown -thread_warp_size=32", [-1, 16, 64, 49152, 2147483647, 1024, 8, 32], "", 0, []], [[], [["CI", 2], ["FU", 4, [0, 1, 2, 3]], ["SP", 4, 0, 131712, [2], 1], ["AN", 4, 0, 5], ["AN", 4, 1, 6]]]], "r": [[5.15967e-05, 5.15943e-05, 5.16127e-05], 0, 5.50486, 1667943257], "v": "v0.6"}
{"i": [["[\"batch_norm\", 1, 14, 14, 672]", "cuda -keys=cuda,gpu -max_num_threads=1024 -model=unknown -thread_warp_size=32", [-1, 16, 64, 49152, 2147483647, 1024, 8, 32], "", 0, []], [[], [["CI", 2], ["FU", 4, [0, 1, 2, 3]], ["SP", 4, 0, 131712, [8], 1], ["AN", 4, 0, 5], ["AN", 4, 1, 6]]]], "r": [[1.51003e-05, 1.50989e-05, 1.50925e-05], 0, 1.60694, 1667944435], "v": "v0.6"}
{"i": [["[\"batch_norm\", 1, 14, 14, 672]", "cuda -keys=cuda,gpu -max_num_threads=1024 -model=unknown -thread_warp_size=32", [-1, 16, 64, 49152, 2147483647, 1024, 8, 32], "", 0, []], [[], [["CI", 2], ["FU", 4, [0, 1, 2, 3]], ["SP", 4, 0, 131712, [28], 1], ["AN", 4, 0, 5], ["AN", 4, 1, 6]]]], "r": [[6.09127e-06, 6.0922e-06, 6.08987e-06], 0, 2.20771, 1667944435], "v": "v0.6"}
{"i": [["[\"batch_norm\", 1, 14, 14, 672]", "cuda -keys=cuda,gpu -max_num_threads=1024 -model=unknown -thread_warp_size=32", [-1, 16, 64, 49152, 2147483647, 1024, 8, 32], "", 0, []], [[], [["CI", 2], ["FU", 4, [0, 1, 2, 3]], ["SP", 4, 0, 131712, [21], 1], ["AN", 4, 0, 5], ["AN", 4, 1, 6]]]], "r": [[7.24409e-06, 7.24466e-06, 7.24283e-06], 0, 2.50524, 1667944436], "v": "v0.6"}
{"i": [["[\"batch_norm\", 1, 14, 14, 672]", "cuda -keys=cuda,gpu -max_num_threads=1024 -model=unknown -thread_warp_size=32", [-1, 16, 64, 49152, 2147483647, 1024, 8, 32], "", 0, []], [[], [["CI", 2], ["FU", 4, [0, 1, 2, 3]], ["SP", 4, 0, 131712, [3], 1], ["AN", 4, 0, 5], ["AN", 4, 1, 6]]]], "r": [[3.53904e-05, 3.53941e-05, 3.53947e-05], 0, 0.603064, 1667944434], "v": "v0.6"}
{"i": [["[\"batch_norm\", 1, 14, 14, 672]", "cuda -keys=cuda,gpu -max_num_threads=1024 -model=unknown -thread_warp_size=32", [-1, 16, 64, 49152, 2147483647, 1024, 8, 32], "", 0, []], [[], [["CI", 2], ["FU", 4, [0, 1, 2, 3]], ["SP", 4, 0, 131712, [4], 1], ["AN", 4, 0, 5], ["AN", 4, 1, 6]]]], "r": [[2.70588e-05, 2.7061e-05, 2.70563e-05], 0, 1.29468, 1667944434], "v": "v0.6"}
{"i": [["[\"batch_norm\", 1, 14, 14, 672]", "cuda -keys=cuda,gpu -max_num_threads=1024 -model=unknown -thread_warp_size=32", [-1, 16, 64, 49152, 2147483647, 1024, 8, 32], "", 0, []], [[], [["CI", 2], ["FU", 4, [0, 1, 2, 3]], ["SP", 4, 0, 131712, [12], 1], ["AN", 4, 0, 5], ["AN", 4, 1, 6]]]], "r": [[1.08949e-05, 1.0886e-05, 1.08838e-05], 0, 0.961423, 1667944434], "v": "v0.6"}
{"i": [["[\"batch_norm\", 1, 14, 14, 672]", "cuda -keys=cuda,gpu -max_num_threads=1024 -model=unknown -thread_warp_size=32", [-1, 16, 64, 49152, 2147483647, 1024, 8, 32], "", 0, []], [[], [["CI", 2], ["FU", 4, [0, 1, 2, 3]], ["SP", 4, 0, 131712, [32], 1], ["AN", 4, 0, 5], ["AN", 4, 1, 6]]]], "r": [[5.6692e-06, 5.66537e-06, 5.66951e-06], 0, 1.92378, 1667944435], "v": "v0.6"}
{"i": [["[\"batch_norm\", 1, 14, 14, 672]", "cuda -keys=cuda,gpu -max_num_threads=1024 -model=unknown -thread_warp_size=32", [-1, 16, 64, 49152, 2147483647, 1024, 8, 32], "", 0, []], [[], [["CI", 2], ["FU", 4, [0, 1, 2, 3]], ["SP", 4, 0, 131712, [24], 1], ["AN", 4, 0, 5], ["AN", 4, 1, 6]]]], "r": [[6.72847e-06, 6.73991e-06, 6.72144e-06], 0, 2.71079, 1667944436], "v": "v0.6"}
{"i": [["[\"batch_norm\", 1, 14, 14, 672]", "cuda -keys=cuda,gpu -max_num_threads=1024 -model=unknown -thread_warp_size=32", [-1, 16, 64, 49152, 2147483647, 1024, 8, 32], "", 0, []], [[], [["CI", 2], ["FU", 4, [0, 1, 2, 3]], ["SP", 4, 0, 131712, [7], 1], ["AN", 4, 0, 5], ["AN", 4, 1, 6]]]], "r": [[1.66996e-05, 1.67061e-05, 1.6689e-05], 0, 2.96398, 1667944436], "v": "v0.6"}
{"i": [["[\"batch_norm\", 1, 14, 14, 672]", "cuda -keys=cuda,gpu -max_num_threads=1024 -model=unknown -thread_warp_size=32", [-1, 16, 64, 49152, 2147483647, 1024, 8, 32], "", 0, []], [[], [["CI", 2], ["FU", 4, [0, 1, 2, 3]], ["SP", 4, 0, 131712, [16], 1], ["AN", 4, 0, 5], ["AN", 4, 1, 6]]]], "r": [[8.83827e-06, 8.8421e-06, 8.84392e-06], 0, 3.54541, 1667944437], "v": "v0.6"}
{"i": [["[\"batch_norm\", 1, 14, 14, 672]", "cuda -keys=cuda,gpu -max_num_threads=1024 -model=unknown -thread_warp_size=32", [-1, 16, 64, 49152, 2147483647, 1024, 8, 32], "", 0, []], [[], [["CI", 2], ["FU", 4, [0, 1, 2, 3]], ["SP", 4, 0, 131712, [64], 1], ["AN", 4, 0, 5], ["AN", 4, 1, 6]]]], "r": [[4.30799e-06, 4.3093e-06, 4.30971e-06], 0, 3.78384, 1667944437], "v": "v0.6"}
{"i": [["[\"batch_norm\", 1, 14, 14, 672]", "cuda -keys=cuda,gpu -max_num_threads=1024 -model=unknown -thread_warp_size=32", [-1, 16, 64, 49152, 2147483647, 1024, 8, 32], "", 0, []], [[], [["CI", 2], ["FU", 4, [0, 1, 2, 3]], ["SP", 4, 0, 131712, [2], 1], ["AN", 4, 0, 5], ["AN", 4, 1, 6]]]], "r": [[5.14947e-05, 5.15e-05, 5.14883e-05], 0, 4.04176, 1667944438], "v": "v0.6"}
{"i": [["[\"batch_norm\", 1, 14, 14, 672]", "cuda -keys=cuda,gpu -max_num_threads=1024 -model=unknown -thread_warp_size=32", [-1, 16, 64, 49152, 2147483647, 1024, 8, 32], "", 0, []], [[], [["CI", 2], ["FU", 4, [0, 1, 2, 3]], ["SP", 4, 0, 131712, [49], 1], ["AN", 4, 0, 5], ["AN", 4, 1, 6]]]], "r": [[4.66089e-06, 4.65905e-06, 4.65965e-06], 0, 4.30553, 1667944438], "v": "v0.6"}
{"i": [["[\"batch_norm\", 1, 14, 14, 672]", "cuda -keys=cuda,gpu -max_num_threads=1024 -model=unknown -thread_warp_size=32", [-1, 16, 64, 49152, 2147483647, 1024, 8, 32], "", 0, []], [[], [["CI", 2], ["FU", 4, [0, 1, 2, 3]], ["SP", 4, 0, 131712, [6], 1], ["AN", 4, 0, 5], ["AN", 4, 1, 6]]]], "r": [[1.90989e-05, 1.90703e-05, 1.90874e-05], 0, 4.54214, 1667944438], "v": "v0.6"}
{"i": [["[\"batch_norm\", 1, 14, 14, 672]", "cuda -keys=cuda,gpu -max_num_threads=1024 -model=unknown -thread_warp_size=32", [-1, 16, 64, 49152, 2147483647, 1024, 8, 32], "", 0, []], [[], [["CI", 2], ["FU", 4, [0, 1, 2, 3]], ["SP", 4, 0, 131712, [14], 1], ["AN", 4, 0, 5], ["AN", 4, 1, 6]]]], "r": [[9.73162e-06, 9.72832e-06, 9.73427e-06], 0, 4.8517, 1667944439], "v": "v0.6"}
{"i": [["[\"batch_norm\", 1, 14, 14, 672]", "cuda -keys=cuda,gpu -max_num_threads=1024 -model=unknown -thread_warp_size=32", [-1, 16, 64, 49152, 2147483647, 1024, 8, 32], "", 0, []], [[], [["CI", 2], ["FU", 4, [0, 1, 2, 3]], ["SP", 4, 0, 131712, [42], 1], ["AN", 4, 0, 5], ["AN", 4, 1, 6]]]], "r": [[4.95664e-06, 4.95786e-06, 4.95676e-06], 0, 5.12125, 1667944439], "v": "v0.6"}
{"i": [["[\"batch_norm\", 1, 14, 14, 672]", "cuda -keys=cuda,gpu -max_num_threads=1024 -model=unknown -thread_warp_size=32", [-1, 16, 64, 49152, 2147483647, 1024, 8, 32], "", 0, []], [[], [["CI", 2], ["FU", 4, [0, 1, 2, 3]], ["SP", 4, 0, 131712, [56], 1], ["AN", 4, 0, 5], ["AN", 4, 1, 6]]]], "r": [[4.37351e-06, 4.37227e-06, 4.37409e-06], 0, 5.36596, 1667944439], "v": "v0.6"}
{"i": [["[\"batch_norm\", 1, 14, 14, 672]", "cuda -keys=cuda,gpu -max_num_threads=1024 -model=unknown -thread_warp_size=32", [-1, 16, 64, 49152, 2147483647, 1024, 8, 32], "", 0, []], [[], [["CI", 2], ["FU", 4, [0, 1, 2, 3]], ["SP", 4, 0, 131712, [48], 1], ["AN", 4, 0, 5], ["AN", 4, 1, 6]]]], "r": [[4.66645e-06, 4.6638e-06, 4.66381e-06], 0, 5.67933, 1667944440], "v": "v0.6"}
{"i": [["[\"batch_norm\", 1, 14, 14, 672]", "cuda -keys=cuda,gpu -max_num_threads=1024 -model=unknown -thread_warp_size=32", [-1, 16, 64, 49152, 2147483647, 1024, 8, 32], "", 0, []], [[], [["CI", 2], ["FU", 4, [0, 1, 2, 3]], ["SP", 4, 0, 131712, [1], 1], ["AN", 4, 0, 5], ["AN", 4, 1, 6]]]], "r": [[0.00010033, 0.000100359, 0.000100354], 0, 3.26787, 1667944437], "v": "v0.6"}
{"i": [["[\"batch_norm\", 1, 14, 14, 672]", "cuda -keys=cuda,gpu -max_num_threads=1024 -model=unknown -thread_warp_size=32", [-1, 16, 64, 49152, 2147483647, 1024, 8, 32], "", 0, []], [[], [["CI", 2], ["FU", 4, [0, 1, 2, 3]], ["SP", 4, 0, 131712, [16], 1], ["AN", 4, 0, 5], ["AN", 4, 1, 6]]]], "r": [[8.87984e-06, 8.88545e-06, 8.88729e-06], 0, 1.76477, 1667944481], "v": "v0.6"}
{"i": [["[\"batch_norm\", 1, 14, 14, 672]", "cuda -keys=cuda,gpu -max_num_threads=1024 -model=unknown -thread_warp_size=32", [-1, 16, 64, 49152, 2147483647, 1024, 8, 32], "", 0, []], [[], [["CI", 2], ["FU", 4, [0, 1, 2, 3]], ["SP", 4, 0, 131712, [56], 1], ["AN", 4, 0, 5], ["AN", 4, 1, 6]]]], "r": [[4.44878e-06, 4.4517e-06, 4.44694e-06], 0, 1.51792, 1667944481], "v": "v0.6"}
{"i": [["[\"batch_norm\", 1, 14, 14, 672]", "cuda -keys=cuda,gpu -max_num_threads=1024 -model=unknown -thread_warp_size=32", [-1, 16, 64, 49152, 2147483647, 1024, 8, 32], "", 0, []], [[], [["CI", 2], ["FU", 4, [0, 1, 2, 3]], ["SP", 4, 0, 131712, [42], 1], ["AN", 4, 0, 5], ["AN", 4, 1, 6]]]], "r": [[4.96641e-06, 4.96303e-06, 4.95988e-06], 0, 0.647338, 1667944480], "v": "v0.6"}
{"i": [["[\"batch_norm\", 1, 14, 14, 672]", "cuda -keys=cuda,gpu -max_num_threads=1024 -model=unknown -thread_warp_size=32", [-1, 16, 64, 49152, 2147483647, 1024, 8, 32], "", 0, []], [[], [["CI", 2], ["FU", 4, [0, 1, 2, 3]], ["SP", 4, 0, 131712, [8], 1], ["AN", 4, 0, 5], ["AN", 4, 1, 6]]]], "r": [[1.49875e-05, 1.50021e-05, 1.49893e-05], 0, 1.24784, 1667944481], "v": "v0.6"}
{"i": [["[\"batch_norm\", 1, 14, 14, 672]", "cuda -keys=cuda,gpu -max_num_threads=1024 -model=unknown -thread_warp_size=32", [-1, 16, 64, 49152, 2147483647, 1024, 8, 32], "", 0, []], [[], [["CI", 2], ["FU", 4, [0, 1, 2, 3]], ["SP", 4, 0, 131712, [28], 1], ["AN", 4, 0, 5], ["AN", 4, 1, 6]]]], "r": [[6.14134e-06, 6.1422e-06, 6.13942e-06], 0, 0.907236, 1667944480], "v": "v0.6"}
{"i": [["[\"batch_norm\", 1, 14, 14, 672]", "cuda -keys=cuda,gpu -max_num_threads=1024 -model=unknown -thread_warp_size=32", [-1, 16, 64, 49152, 2147483647, 1024, 8, 32], "", 0, []], [[], [["CI", 2], ["FU", 4, [0, 1, 2, 3]], ["SP", 4, 0, 131712, [12], 1], ["AN", 4, 0, 5], ["AN", 4, 1, 6]]]], "r": [[1.09129e-05, 1.09182e-05, 1.09183e-05], 0, 2.38613, 1667944482], "v": "v0.6"}
{"i": [["[\"batch_norm\", 1, 14, 14, 672]", "cuda -keys=cuda,gpu -max_num_threads=1024 -model=unknown -thread_warp_size=32", [-1, 16, 64, 49152, 2147483647, 1024, 8, 32], "", 0, []], [[], [["CI", 2], ["FU", 4, [0, 1, 2, 3]], ["SP", 4, 0, 131712, [14], 1], ["AN", 4, 0, 5], ["AN", 4, 1, 6]]]], "r": [[9.82139e-06, 9.81629e-06, 9.82106e-06], 0, 2.73166, 1667944482], "v": "v0.6"}
{"i": [["[\"batch_norm\", 1, 14, 14, 672]", "cuda -keys=cuda,gpu -max_num_threads=1024 -model=unknown -thread_warp_size=32", [-1, 16, 64, 49152, 2147483647, 1024, 8, 32], "", 0, []], [[], [["CI", 2], ["FU", 4, [0, 1, 2, 3]], ["SP", 4, 0, 131712, [48], 1], ["AN", 4, 0, 5], ["AN", 4, 1, 6]]]], "r": [[4.6598e-06, 4.65854e-06, 4.66205e-06], 0, 2.07651, 1667944482], "v": "v0.6"}
{"i": [["[\"batch_norm\", 1, 14, 14, 672]", "cuda -keys=cuda,gpu -max_num_threads=1024 -model=unknown -thread_warp_size=32", [-1, 16, 64, 49152, 2147483647, 1024, 8, 32], "", 0, []], [[], [["CI", 2], ["FU", 4, [0, 1, 2, 3]], ["SP", 4, 0, 131712, [6], 1], ["AN", 4, 0, 5], ["AN", 4, 1, 6]]]], "r": [[1.913e-05, 1.91236e-05, 1.91297e-05], 0, 2.93555, 1667944483], "v": "v0.6"}
{"i": [["[\"batch_norm\", 1, 14, 14, 672]", "cuda -keys=cuda,gpu -max_num_threads=1024 -model=unknown -thread_warp_size=32", [-1, 16, 64, 49152, 2147483647, 1024, 8, 32], "", 0, []], [[], [["CI", 2], ["FU", 4, [0, 1, 2, 3]], ["SP", 4, 0, 131712, [24], 1], ["AN", 4, 0, 5], ["AN", 4, 1, 6]]]], "r": [[6.941e-06, 6.94727e-06, 6.94815e-06], 0, 3.43138, 1667944483], "v": "v0.6"}
{"i": [["[\"batch_norm\", 1, 14, 14, 672]", "cuda -keys=cuda,gpu -max_num_threads=1024 -model=unknown -thread_warp_size=32", [-1, 16, 64, 49152, 2147483647, 1024, 8, 32], "", 0, []], [[], [["CI", 2], ["FU", 4, [0, 1, 2, 3]], ["SP", 4, 0, 131712, [2], 1], ["AN", 4, 0, 5], ["AN", 4, 1, 6]]]], "r": [[5.15089e-05, 5.15154e-05, 5.15162e-05], 0, 3.12949, 1667944483], "v": "v0.6"}
{"i": [["[\"batch_norm\", 1, 14, 14, 672]", "cuda -keys=cuda,gpu -max_num_threads=1024 -model=unknown -thread_warp_size=32", [-1, 16, 64, 49152, 2147483647, 1024, 8, 32], "", 0, []], [[], [["CI", 2], ["FU", 4, [0, 1, 2, 3]], ["SP", 4, 0, 131712, [7], 1], ["AN", 4, 0, 5], ["AN", 4, 1, 6]]]], "r": [[1.66877e-05, 1.6686e-05, 1.66906e-05], 0, 3.66947, 1667944484], "v": "v0.6"}
{"i": [["[\"batch_norm\", 1, 14, 14, 672]", "cuda -keys=cuda,gpu -max_num_threads=1024 -model=unknown -thread_warp_size=32", [-1, 16, 64, 49152, 2147483647, 1024, 8, 32], "", 0, []], [[], [["CI", 2], ["FU", 4, [0, 1, 2, 3]], ["SP", 4, 0, 131712, [49], 1], ["AN", 4, 0, 5], ["AN", 4, 1, 6]]]], "r": [[4.66475e-06, 4.66347e-06, 4.66823e-06], 0, 3.97079, 1667944484], "v": "v0.6"}
{"i": [["[\"batch_norm\", 1, 14, 14, 672]", "cuda -keys=cuda,gpu -max_num_threads=1024 -model=unknown -thread_warp_size=32", [-1, 16, 64, 49152, 2147483647, 1024, 8, 32], "", 0, []], [[], [["CI", 2], ["FU", 4, [0, 1, 2, 3]], ["SP", 4, 0, 131712, [3], 1], ["AN", 4, 0, 5], ["AN", 4, 1, 6]]]], "r": [[3.52345e-05, 3.52373e-05, 3.5241e-05], 0, 4.1968, 1667944484], "v": "v0.6"}
{"i": [["[\"batch_norm\", 1, 14, 14, 672]", "cuda -keys=cuda,gpu -max_num_threads=1024 -model=unknown -thread_warp_size=32", [-1, 16, 64, 49152, 2147483647, 1024, 8, 32], "", 0, []], [[], [["CI", 2], ["FU", 4, [0, 1, 2, 3]], ["SP", 4, 0, 131712, [32], 1], ["AN", 4, 0, 5], ["AN", 4, 1, 6]]]], "r": [[5.83593e-06, 5.83147e-06, 5.82995e-06], 0, 4.50721, 1667944485], "v": "v0.6"}
{"i": [["[\"batch_norm\", 1, 14, 14, 672]", "cuda -keys=cuda,gpu -max_num_threads=1024 -model=unknown -thread_warp_size=32", [-1, 16, 64, 49152, 2147483647, 1024, 8, 32], "", 0, []], [[], [["CI", 2], ["FU", 4, [0, 1, 2, 3]], ["SP", 4, 0, 131712, [1], 1], ["AN", 4, 0, 5], ["AN", 4, 1, 6]]]], "r": [[0.000100293, 0.000100266, 0.000100291], 0, 4.83521, 1667944485], "v": "v0.6"}
{"i": [["[\"batch_norm\", 1, 14, 14, 672]", "cuda -keys=cuda,gpu -max_num_threads=1024 -model=unknown -thread_warp_size=32", [-1, 16, 64, 49152, 2147483647, 1024, 8, 32], "", 0, []], [[], [["CI", 2], ["FU", 4, [0, 1, 2, 3]], ["SP", 4, 0, 131712, [21], 1], ["AN", 4, 0, 5], ["AN", 4, 1, 6]]]], "r": [[7.38764e-06, 7.38246e-06, 7.3861e-06], 0, 5.06324, 1667944485], "v": "v0.6"}
{"i": [["[\"batch_norm\", 1, 14, 14, 672]", "cuda -keys=cuda,gpu -max_num_threads=1024 -model=unknown -thread_warp_size=32", [-1, 16, 64, 49152, 2147483647, 1024, 8, 32], "", 0, []], [[], [["CI", 2], ["FU", 4, [0, 1, 2, 3]], ["SP", 4, 0, 131712, [64], 1], ["AN", 4, 0, 5], ["AN", 4, 1, 6]]]], "r": [[4.19422e-06, 4.18917e-06, 4.19393e-06], 0, 5.36085, 1667944486], "v": "v0.6"}
{"i": [["[\"batch_norm\", 1, 14, 14, 672]", "cuda -keys=cuda,gpu -max_num_threads=1024 -model=unknown -thread_warp_size=32", [-1, 16, 64, 49152, 2147483647, 1024, 8, 32], "", 0, []], [[], [["CI", 2], ["FU", 4, [0, 1, 2, 3]], ["SP", 4, 0, 131712, [4], 1], ["AN", 4, 0, 5], ["AN", 4, 1, 6]]]], "r": [[2.73342e-05, 2.73316e-05, 2.73344e-05], 0, 5.6901, 1667944486], "v": "v0.6"}
{"i": [["[\"batch_norm\", 1, 14, 14, 672]", "cuda -keys=cuda,gpu -max_num_threads=1024 -model=unknown -thread_warp_size=32", [-1, 16, 64, 49152, 2147483647, 1024, 8, 32], "", 0, []], [[], [["CI", 2], ["FU", 4, [0, 1, 2, 3]], ["SP", 4, 0, 131712, [8], 1], ["AN", 4, 0, 5], ["AN", 4, 1, 6]]]], "r": [[1.49523e-05, 1.49527e-05, 1.49547e-05], 0, 2.67905, 1667944549], "v": "v0.6"}
{"i": [["[\"batch_norm\", 1, 14, 14, 672]", "cuda -keys=cuda,gpu -max_num_threads=1024 -model=unknown -thread_warp_size=32", [-1, 16, 64, 49152, 2147483647, 1024, 8, 32], "", 0, []], [[], [["CI", 2], ["FU", 4, [0, 1, 2, 3]], ["SP", 4, 0, 131712, [7], 1], ["AN", 4, 0, 5], ["AN", 4, 1, 6]]]], "r": [[1.66829e-05, 1.66849e-05, 1.66834e-05], 0, 1.8093, 1667944548], "v": "v0.6"}
{"i": [["[\"batch_norm\", 1, 14, 14, 672]", "cuda -keys=cuda,gpu -max_num_threads=1024 -model=unknown -thread_warp_size=32", [-1, 16, 64, 49152, 2147483647, 1024, 8, 32], "", 0, []], [[], [["CI", 2], ["FU", 4, [0, 1, 2, 3]], ["SP", 4, 0, 131712, [42], 1], ["AN", 4, 0, 5], ["AN", 4, 1, 6]]]], "r": [[5.08312e-06, 5.08147e-06, 5.08104e-06], 0, 0.588214, 1667944546], "v": "v0.6"}
{"i": [["[\"batch_norm\", 1, 14, 14, 672]", "cuda -keys=cuda,gpu -max_num_threads=1024 -model=unknown -thread_warp_size=32", [-1, 16, 64, 49152, 2147483647, 1024, 8, 32], "", 0, []], [[], [["CI", 2], ["FU", 4, [0, 1, 2, 3]], ["SP", 4, 0, 131712, [49], 1], ["AN", 4, 0, 5], ["AN", 4, 1, 6]]]], "r": [[4.65367e-06, 4.65352e-06, 4.65426e-06], 0, 2.43239, 1667944548], "v": "v0.6"}
{"i": [["[\"batch_norm\", 1, 14, 14, 672]", "cuda -keys=cuda,gpu -max_num_threads=1024 -model=unknown -thread_warp_size=32", [-1, 16, 64, 49152, 2147483647, 1024, 8, 32], "", 0, []], [[], [["CI", 2], ["FU", 4, [0, 1, 2, 3]], ["SP", 4, 0, 131712, [56], 1], ["AN", 4, 0, 5], ["AN", 4, 1, 6]]]], "r": [[4.35791e-06, 4.36059e-06, 4.36103e-06], 0, 2.10716, 1667944548], "v": "v0.6"}
{"i": [["[\"batch_norm\", 1, 14, 14, 672]", "cuda -keys=cuda,gpu -max_num_threads=1024 -model=unknown -thread_warp_size=32", [-1, 16, 64, 49152, 2147483647, 1024, 8, 32], "", 0, []], [[], [["CI", 2], ["FU", 4, [0, 1, 2, 3]], ["SP", 4, 0, 131712, [28], 1], ["AN", 4, 0, 5], ["AN", 4, 1, 6]]]], "r": [[6.14315e-06, 6.14264e-06, 6.14912e-06], 0, 0.97464, 1667944547], "v": "v0.6"}
{"i": [["[\"batch_norm\", 1, 14, 14, 672]", "cuda -keys=cuda,gpu -max_num_threads=1024 -model=unknown -thread_warp_size=32", [-1, 16, 64, 49152, 2147483647, 1024, 8, 32], "", 0, []], [[], [["CI", 2], ["FU", 4, [0, 1, 2, 3]], ["SP", 4, 0, 131712, [16], 1], ["AN", 4, 0, 5], ["AN", 4, 1, 6]]]], "r": [[8.74652e-06, 8.73881e-06, 8.74905e-06], 0, 1.19524, 1667944547], "v": "v0.6"}
{"i": [["[\"batch_norm\", 1, 14, 14, 672]", "cuda -keys=cuda,gpu -max_num_threads=1024 -model=unknown -thread_warp_size=32", [-1, 16, 64, 49152, 2147483647, 1024, 8, 32], "", 0, []], [[], [["CI", 2], ["FU", 4, [0, 1, 2, 3]], ["SP", 4, 0, 131712, [32], 1], ["AN", 4, 0, 5], ["AN", 4, 1, 6]]]], "r": [[5.78551e-06, 5.788e-06, 5.79011e-06], 0, 1.45814, 1667944547], "v": "v0.6"}
{"i": [["[\"batch_norm\", 1, 14, 14, 672]", "cuda -keys=cuda,gpu -max_num_threads=1024 -model=unknown -thread_warp_size=32", [-1, 16, 64, 49152, 2147483647, 1024, 8, 32], "", 0, []], [[], [["CI", 2], ["FU", 4, [0, 1, 2, 3]], ["SP", 4, 0, 131712, [3], 1], ["AN", 4, 0, 5], ["AN", 4, 1, 6]]]], "r": [[3.5195e-05, 3.51937e-05, 3.51988e-05], 0, 2.94115, 1667944549], "v": "v0.6"}
{"i": [["[\"batch_norm\", 1, 14, 14, 672]", "cuda -keys=cuda,gpu -max_num_threads=1024 -model=unknown -thread_warp_size=32", [-1, 16, 64, 49152, 2147483647, 1024, 8, 32], "", 0, []], [[], [["CI", 2], ["FU", 4, [0, 1, 2, 3]], ["SP", 4, 0, 131712, [14], 1], ["AN", 4, 0, 5], ["AN", 4, 1, 6]]]], "r": [[9.64618e-06, 9.64275e-06, 9.64704e-06], 0, 3.45798, 1667944550], "v": "v0.6"}
{"i": [["[\"batch_norm\", 1, 14, 14, 672]", "cuda -keys=cuda,gpu -max_num_threads=1024 -model=unknown -thread_warp_size=32", [-1, 16, 64, 49152, 2147483647, 1024, 8, 32], "", 0, []], [[], [["CI", 2], ["FU", 4, [0, 1, 2, 3]], ["SP", 4, 0, 131712, [1], 1], ["AN", 4, 0, 5], ["AN", 4, 1, 6]]]], "r": [[0.000100328, 0.000100332, 0.000100336], 0, 3.64694, 1667944550], "v": "v0.6"}
{"i": [["[\"batch_norm\", 1, 14, 14, 672]", "cuda -keys=cuda,gpu -max_num_threads=1024 -model=unknown -thread_warp_size=32", [-1, 16, 64, 49152, 2147483647, 1024, 8, 32], "", 0, []], [[], [["CI", 2], ["FU", 4, [0, 1, 2, 3]], ["SP", 4, 0, 131712, [24], 1], ["AN", 4, 0, 5], ["AN", 4, 1, 6]]]], "r": [[6.82427e-06, 6.82433e-06, 6.82627e-06], 0, 3.22467, 1667944549], "v": "v0.6"}
{"i": [["[\"batch_norm\", 1, 14, 14, 672]", "cuda -keys=cuda,gpu -max_num_threads=1024 -model=unknown -thread_warp_size=32", [-1, 16, 64, 49152, 2147483647, 1024, 8, 32], "", 0, []], [[], [["CI", 2], ["FU", 4, [0, 1, 2, 3]], ["SP", 4, 0, 131712, [2], 1], ["AN", 4, 0, 5], ["AN", 4, 1, 6]]]], "r": [[5.16292e-05, 5.16456e-05, 5.16523e-05], 0, 4.23292, 1667944551], "v": "v0.6"}
{"i": [["[\"batch_norm\", 1, 14, 14, 672]", "cuda -keys=cuda,gpu -max_num_threads=1024 -model=unknown -thread_warp_size=32", [-1, 16, 64, 49152, 2147483647, 1024, 8, 32], "", 0, []], [[], [["CI", 2], ["FU", 4, [0, 1, 2, 3]], ["SP", 4, 0, 131712, [64], 1], ["AN", 4, 0, 5], ["AN", 4, 1, 6]]]], "r": [[4.22213e-06, 4.21645e-06, 4.21736e-06], 0, 3.96231, 1667944550], "v": "v0.6"}
{"i": [["[\"batch_norm\", 1, 14, 14, 672]", "cuda -keys=cuda,gpu -max_num_threads=1024 -model=unknown -thread_warp_size=32", [-1, 16, 64, 49152, 2147483647, 1024, 8, 32], "", 0, []], [[], [["CI", 2], ["FU", 4, [0, 1, 2, 3]], ["SP", 4, 0, 131712, [12], 1], ["AN", 4, 0, 5], ["AN", 4, 1, 6]]]], "r": [[1.07975e-05, 1.07917e-05, 1.07908e-05], 0, 4.54676, 1667944551], "v": "v0.6"}
{"i": [["[\"batch_norm\", 1, 14, 14, 672]", "cuda -keys=cuda,gpu -max_num_threads=1024 -model=unknown -thread_warp_size=32", [-1, 16, 64, 49152, 2147483647, 1024, 8, 32], "", 0, []], [[], [["CI", 2], ["FU", 4, [0, 1, 2, 3]], ["SP", 4, 0, 131712, [4], 1], ["AN", 4, 0, 5], ["AN", 4, 1, 6]]]], "r": [[2.72982e-05, 2.72859e-05, 2.72996e-05], 0, 4.9215, 1667944551], "v": "v0.6"}
{"i": [["[\"batch_norm\", 1, 14, 14, 672]", "cuda -keys=cuda,gpu -max_num_threads=1024 -model=unknown -thread_warp_size=32", [-1, 16, 64, 49152, 2147483647, 1024, 8, 32], "", 0, []], [[], [["CI", 2], ["FU", 4, [0, 1, 2, 3]], ["SP", 4, 0, 131712, [21], 1], ["AN", 4, 0, 5], ["AN", 4, 1, 6]]]], "r": [[7.43187e-06, 7.43364e-06, 7.42957e-06], 0, 5.31591, 1667944552], "v": "v0.6"}
{"i": [["[\"batch_norm\", 1, 14, 14, 672]", "cuda -keys=cuda,gpu -max_num_threads=1024 -model=unknown -thread_warp_size=32", [-1, 16, 64, 49152, 2147483647, 1024, 8, 32], "", 0, []], [[], [["CI", 2], ["FU", 4, [0, 1, 2, 3]], ["SP", 4, 0, 131712, [6], 1], ["AN", 4, 0, 5], ["AN", 4, 1, 6]]]], "r": [[1.90678e-05, 1.90682e-05, 1.90664e-05], 0, 5.10067, 1667944552], "v": "v0.6"}
{"i": [["[\"batch_norm\", 1, 14, 14, 672]", "cuda -keys=cuda,gpu -max_num_threads=1024 -model=unknown -thread_warp_size=32", [-1, 16, 64, 49152, 2147483647, 1024, 8, 32], "", 0, []], [[], [["CI", 2], ["FU", 4, [0, 1, 2, 3]], ["SP", 4, 0, 131712, [48], 1], ["AN", 4, 0, 5], ["AN", 4, 1, 6]]]], "r": [[4.78009e-06, 4.77485e-06, 4.78309e-06], 0, 5.64258, 1667944552], "v": "v0.6"}
{"i": [["[\"batch_norm\", 1, 14, 14, 672]", "cuda -keys=cuda,gpu -max_num_threads=1024 -model=unknown -thread_warp_size=32", [-1, 16, 64, 49152, 2147483647, 1024, 8, 32], "", 0, []], [[], [["CI", 2], ["FU", 4, [0, 1, 2, 3]], ["SP", 4, 0, 131712, [16], 1], ["AN", 4, 0, 5], ["AN", 4, 1, 6]]]], "r": [[8.69384e-06, 8.68708e-06, 8.6946e-06], 0, 2.34113, 1667944673], "v": "v0.6"}
{"i": [["[\"batch_norm\", 1, 14, 14, 672]", "cuda -keys=cuda,gpu -max_num_threads=1024 -model=unknown -thread_warp_size=32", [-1, 16, 64, 49152, 2147483647, 1024, 8, 32], "", 0, []], [[], [["CI", 2], ["FU", 4, [0, 1, 2, 3]], ["SP", 4, 0, 131712, [3], 1], ["AN", 4, 0, 5], ["AN", 4, 1, 6]]]], "r": [[3.51944e-05, 3.51926e-05, 3.51947e-05], 0, 1.17237, 1667944671], "v": "v0.6"}
{"i": [["[\"batch_norm\", 1, 14, 14, 672]", "cuda -keys=cuda,gpu -max_num_threads=1024 -model=unknown -thread_warp_size=32", [-1, 16, 64, 49152, 2147483647, 1024, 8, 32], "", 0, []], [[], [["CI", 2], ["FU", 4, [0, 1, 2, 3]], ["SP", 4, 0, 131712, [7], 1], ["AN", 4, 0, 5], ["AN", 4, 1, 6]]]], "r": [[1.67368e-05, 1.67526e-05, 1.67409e-05], 0, 2.01498, 1667944672], "v": "v0.6"}
{"i": [["[\"batch_norm\", 1, 14, 14, 672]", "cuda -keys=cuda,gpu -max_num_threads=1024 -model=unknown -thread_warp_size=32", [-1, 16, 64, 49152, 2147483647, 1024, 8, 32], "", 0, []], [[], [["CI", 2], ["FU", 4, [0, 1, 2, 3]], ["SP", 4, 0, 131712, [49], 1], ["AN", 4, 0, 5], ["AN", 4, 1, 6]]]], "r": [[4.75312e-06, 4.75031e-06, 4.75002e-06], 0, 0.958215, 1667944671], "v": "v0.6"}
{"i": [["[\"batch_norm\", 1, 14, 14, 672]", "cuda -keys=cuda,gpu -max_num_threads=1024 -model=unknown -thread_warp_size=32", [-1, 16, 64, 49152, 2147483647, 1024, 8, 32], "", 0, []], [[], [["CI", 2], ["FU", 4, [0, 1, 2, 3]], ["SP", 4, 0, 131712, [4], 1], ["AN", 4, 0, 5], ["AN", 4, 1, 6]]]], "r": [[2.72208e-05, 2.71758e-05, 2.71979e-05], 0, 1.80825, 1667944672], "v": "v0.6"}
{"i": [["[\"batch_norm\", 1, 14, 14, 672]", "cuda -keys=cuda,gpu -max_num_threads=1024 -model=unknown -thread_warp_size=32", [-1, 16, 64, 49152, 2147483647, 1024, 8, 32], "", 0, []], [[], [["CI", 2], ["FU", 4, [0, 1, 2, 3]], ["SP", 4, 0, 131712, [6], 1], ["AN", 4, 0, 5], ["AN", 4, 1, 6]]]], "r": [[1.90069e-05, 1.89922e-05, 1.89911e-05], 0, 0.670237, 1667944671], "v": "v0.6"}
{"i": [["[\"batch_norm\", 1, 14, 14, 672]", "cuda -keys=cuda,gpu -max_num_threads=1024 -model=unknown -thread_warp_size=32", [-1, 16, 64, 49152, 2147483647, 1024, 8, 32], "", 0, []], [[], [["CI", 2], ["FU", 4, [0, 1, 2, 3]], ["SP", 4, 0, 131712, [1], 1], ["AN", 4, 0, 5], ["AN", 4, 1, 6]]]], "r": [[0.000100275, 0.00010029, 0.00010029], 0, 1.61425, 1667944672], "v": "v0.6"}
{"i": [["[\"batch_norm\", 1, 14, 14, 672]", "cuda -keys=cuda,gpu -max_num_threads=1024 -model=unknown -thread_warp_size=32", [-1, 16, 64, 49152, 2147483647, 1024, 8, 32], "", 0, []], [[], [["CI", 2], ["FU", 4, [0, 1, 2, 3]], ["SP", 4, 0, 131712, [2], 1], ["AN", 4, 0, 5], ["AN", 4, 1, 6]]]], "r": [[5.15659e-05, 5.15581e-05, 5.15601e-05], 0, 2.64722, 1667944673], "v": "v0.6"}
{"i": [["[\"batch_norm\", 1, 14, 14, 672]", "cuda -keys=cuda,gpu -max_num_threads=1024 -model=unknown -thread_warp_size=32", [-1, 16, 64, 49152, 2147483647, 1024, 8, 32], "", 0, []], [[], [["CI", 2], ["FU", 4, [0, 1, 2, 3]], ["SP", 4, 0, 131712, [56], 1], ["AN", 4, 0, 5], ["AN", 4, 1, 6]]]], "r": [[4.41593e-06, 4.41563e-06, 4.41536e-06], 0, 2.88052, 1667944673], "v": "v0.6"}
{"i": [["[\"batch_norm\", 1, 14, 14, 672]", "cuda -keys=cuda,gpu -max_num_threads=1024 -model=unknown -thread_warp_size=32", [-1, 16, 64, 49152, 2147483647, 1024, 8, 32], "", 0, []], [[], [["CI", 2], ["FU", 4, [0, 1, 2, 3]], ["SP", 4, 0, 131712, [64], 1], ["AN", 4, 0, 5], ["AN", 4, 1, 6]]]], "r": [[4.3046e-06, 4.30523e-06, 4.30874e-06], 0, 3.16099, 1667944674], "v": "v0.6"}
{"i": [["[\"batch_norm\", 1, 14, 14, 672]", "cuda -keys=cuda,gpu -max_num_threads=1024 -model=unknown -thread_warp_size=32", [-1, 16, 64, 49152, 2147483647, 1024, 8, 32], "", 0, []], [[], [["CI", 2], ["FU", 4, [0, 1, 2, 3]], ["SP", 4, 0, 131712, [24], 1], ["AN", 4, 0, 5], ["AN", 4, 1, 6]]]], "r": [[6.94586e-06, 6.93307e-06, 6.93987e-06], 0, 3.40725, 1667944674], "v": "v0.6"}
{"i": [["[\"batch_norm\", 1, 14, 14, 672]", "cuda -keys=cuda,gpu -max_num_threads=1024 -model=unknown -thread_warp_size=32", [-1, 16, 64, 49152, 2147483647, 1024, 8, 32], "", 0, []], [[], [["CI", 2], ["FU", 4, [0, 1, 2, 3]], ["SP", 4, 0, 131712, [8], 1], ["AN", 4, 0, 5], ["AN", 4, 1, 6]]]], "r": [[1.49802e-05, 1.49678e-05, 1.49995e-05], 0, 3.61984, 1667944674], "v": "v0.6"}
{"i": [["[\"batch_norm\", 1, 14, 14, 672]", "cuda -keys=cuda,gpu -max_num_threads=1024 -model=unknown -thread_warp_size=32", [-1, 16, 64, 49152, 2147483647, 1024, 8, 32], "", 0, []], [[], [["CI", 2], ["FU", 4, [0, 1, 2, 3]], ["SP", 4, 0, 131712, [42], 1], ["AN", 4, 0, 5], ["AN", 4, 1, 6]]]], "r": [[4.97588e-06, 4.9779e-06, 4.96962e-06], 0, 3.90865, 1667944675], "v": "v0.6"}
{"i": [["[\"batch_norm\", 1, 14, 14, 672]", "cuda -keys=cuda,gpu -max_num_threads=1024 -model=unknown -thread_warp_size=32", [-1, 16, 64, 49152, 2147483647, 1024, 8, 32], "", 0, []], [[], [["CI", 2], ["FU", 4, [0, 1, 2, 3]], ["SP", 4, 0, 131712, [14], 1], ["AN", 4, 0, 5], ["AN", 4, 1, 6]]]], "r": [[9.60032e-06, 9.6029e-06, 9.60117e-06], 0, 4.14844, 1667944675], "v": "v0.6"}
{"i": [["[\"batch_norm\", 1, 14, 14, 672]", "cuda -keys=cuda,gpu -max_num_threads=1024 -model=unknown -thread_warp_size=32", [-1, 16, 64, 49152, 2147483647, 1024, 8, 32], "", 0, []], [[], [["CI", 2], ["FU", 4, [0, 1, 2, 3]], ["SP", 4, 0, 131712, [12], 1], ["AN", 4, 0, 5], ["AN", 4, 1, 6]]]], "r": [[1.08652e-05, 1.08721e-05, 1.08618e-05], 0, 4.41677, 1667944675], "v": "v0.6"}
{"i": [["[\"batch_norm\", 1, 14, 14, 672]", "cuda -keys=cuda,gpu -max_num_threads=1024 -model=unknown -thread_warp_size=32", [-1, 16, 64, 49152, 2147483647, 1024, 8, 32], "", 0, []], [[], [["CI", 2], ["FU", 4, [0, 1, 2, 3]], ["SP", 4, 0, 131712, [28], 1], ["AN", 4, 0, 5], ["AN", 4, 1, 6]]]], "r": [[6.08741e-06, 6.08896e-06, 6.08877e-06], 0, 4.71288, 1667944676], "v": "v0.6"}
{"i": [["[\"batch_norm\", 1, 14, 14, 672]", "cuda -keys=cuda,gpu -max_num_threads=1024 -model=unknown -thread_warp_size=32", [-1, 16, 64, 49152, 2147483647, 1024, 8, 32], "", 0, []], [[], [["CI", 2], ["FU", 4, [0, 1, 2, 3]], ["SP", 4, 0, 131712, [32], 1], ["AN", 4, 0, 5], ["AN", 4, 1, 6]]]], "r": [[5.70291e-06, 5.7002e-06, 5.70382e-06], 0, 4.97704, 1667944676], "v": "v0.6"}
{"i": [["[\"batch_norm\", 1, 14, 14, 672]", "cuda -keys=cuda,gpu -max_num_threads=1024 -model=unknown -thread_warp_size=32", [-1, 16, 64, 49152, 2147483647, 1024, 8, 32], "", 0, []], [[], [["CI", 2], ["FU", 4, [0, 1, 2, 3]], ["SP", 4, 0, 131712, [21], 1], ["AN", 4, 0, 5], ["AN", 4, 1, 6]]]], "r": [[7.19192e-06, 7.19382e-06, 7.19394e-06], 0, 5.23087, 1667944676], "v": "v0.6"}
{"i": [["[\"batch_norm\", 1, 14, 14, 672]", "cuda -keys=cuda,gpu -max_num_threads=1024 -model=unknown -thread_warp_size=32", [-1, 16, 64, 49152, 2147483647, 1024, 8, 32], "", 0, []], [[], [["CI", 2], ["FU", 4, [0, 1, 2, 3]], ["SP", 4, 0, 131712, [48], 1], ["AN", 4, 0, 5], ["AN", 4, 1, 6]]]], "r": [[4.65961e-06, 4.6606e-06, 4.66238e-06], 0, 5.52836, 1667944677], "v": "v0.6"}
{"i": [["[\"batch_norm\", 1, 14, 14, 672]", "cuda -keys=cuda,gpu -max_num_threads=1024 -model=unknown -thread_warp_size=32", [-1, 16, 64, 49152, 2147483647, 1024, 8, 32], "", 0, []], [[], [["CI", 2], ["FU", 4, [0, 1, 2, 3]], ["SP", 4, 0, 131712, [21], 1], ["AN", 4, 0, 5], ["AN", 4, 1, 6]]]], "r": [[7.2326e-06, 7.2282e-06, 7.22842e-06], 0, 2.85073, 1667944720], "v": "v0.6"}
{"i": [["[\"batch_norm\", 1, 14, 14, 672]", "cuda -keys=cuda,gpu -max_num_threads=1024 -model=unknown -thread_warp_size=32", [-1, 16, 64, 49152, 2147483647, 1024, 8, 32], "", 0, []], [[], [["CI", 2], ["FU", 4, [0, 1, 2, 3]], ["SP", 4, 0, 131712, [2], 1], ["AN", 4, 0, 5], ["AN", 4, 1, 6]]]], "r": [[5.16766e-05, 5.16946e-05, 5.16854e-05], 0, 1.60921, 1667944718], "v": "v0.6"}
{"i": [["[\"batch_norm\", 1, 14, 14, 672]", "cuda -keys=cuda,gpu -max_num_threads=1024 -model=unknown -thread_warp_size=32", [-1, 16, 64, 49152, 2147483647, 1024, 8, 32], "", 0, []], [[], [["CI", 2], ["FU", 4, [0, 1, 2, 3]], ["SP", 4, 0, 131712, [16], 1], ["AN", 4, 0, 5], ["AN", 4, 1, 6]]]], "r": [[8.75123e-06, 8.75231e-06, 8.75343e-06], 0, 2.23323, 1667944719], "v": "v0.6"}
{"i": [["[\"batch_norm\", 1, 14, 14, 672]", "cuda -keys=cuda,gpu -max_num_threads=1024 -model=unknown -thread_warp_size=32", [-1, 16, 64, 49152, 2147483647, 1024, 8, 32], "", 0, []], [[], [["CI", 2], ["FU", 4, [0, 1, 2, 3]], ["SP", 4, 0, 131712, [32], 1], ["AN", 4, 0, 5], ["AN", 4, 1, 6]]]], "r": [[5.66742e-06, 5.66424e-06, 5.66381e-06], 0, 1.28739, 1667944718], "v": "v0.6"}
{"i": [["[\"batch_norm\", 1, 14, 14, 672]", "cuda -keys=cuda,gpu -max_num_threads=1024 -model=unknown -thread_warp_size=32", [-1, 16, 64, 49152, 2147483647, 1024, 8, 32], "", 0, []], [[], [["CI", 2], ["FU", 4, [0, 1, 2, 3]], ["SP", 4, 0, 131712, [14], 1], ["AN", 4, 0, 5], ["AN", 4, 1, 6]]]], "r": [[9.84862e-06, 9.85559e-06, 9.85469e-06], 0, 2.55208, 1667944719], "v": "v0.6"}
{"i": [["[\"batch_norm\", 1, 14, 14, 672]", "cuda -keys=cuda,gpu -max_num_threads=1024 -model=unknown -thread_warp_size=32", [-1, 16, 64, 49152, 2147483647, 1024, 8, 32], "", 0, []], [[], [["CI", 2], ["FU", 4, [0, 1, 2, 3]], ["SP", 4, 0, 131712, [48], 1], ["AN", 4, 0, 5], ["AN", 4, 1, 6]]]], "r": [[4.66363e-06, 4.66292e-06, 4.66365e-06], 0, 0.975487, 1667944718], "v": "v0.6"}
{"i": [["[\"batch_norm\", 1, 14, 14, 672]", "cuda -keys=cuda,gpu -max_num_threads=1024 -model=unknown -thread_warp_size=32", [-1, 16, 64, 49152, 2147483647, 1024, 8, 32], "", 0, []], [[], [["CI", 2], ["FU", 4, [0, 1, 2, 3]], ["SP", 4, 0, 131712, [1], 1], ["AN", 4, 0, 5], ["AN", 4, 1, 6]]]], "r": [[0.000100366, 0.00010038, 0.000100335], 0, 0.666485, 1667944717], "v": "v0.6"}
{"i": [["[\"batch_norm\", 1, 14, 14, 672]", "cuda -keys=cuda,gpu -max_num_threads=1024 -model=unknown -thread_warp_size=32", [-1, 16, 64, 49152, 2147483647, 1024, 8, 32], "", 0, []], [[], [["CI", 2], ["FU", 4, [0, 1, 2, 3]], ["SP", 4, 0, 131712, [28], 1], ["AN", 4, 0, 5], ["AN", 4, 1, 6]]]], "r": [[6.09684e-06, 6.09908e-06, 6.10191e-06], 0, 3.07659, 1667944720], "v": "v0.6"}
{"i": [["[\"batch_norm\", 1, 14, 14, 672]", "cuda -keys=cuda,gpu -max_num_threads=1024 -model=unknown -thread_warp_size=32", [-1, 16, 64, 49152, 2147483647, 1024, 8, 32], "", 0, []], [[], [["CI", 2], ["FU", 4, [0, 1, 2, 3]], ["SP", 4, 0, 131712, [12], 1], ["AN", 4, 0, 5], ["AN", 4, 1, 6]]]], "r": [[1.09645e-05, 1.09685e-05, 1.09649e-05], 0, 1.8666, 1667944719], "v": "v0.6"}
{"i": [["[\"batch_norm\", 1, 14, 14, 672]", "cuda -keys=cuda,gpu -max_num_threads=1024 -model=unknown -thread_warp_size=32", [-1, 16, 64, 49152, 2147483647, 1024, 8, 32], "", 0, []], [[], [["CI", 2], ["FU", 4, [0, 1, 2, 3]], ["SP", 4, 0, 131712, [7], 1], ["AN", 4, 0, 5], ["AN", 4, 1, 6]]]], "r": [[1.66931e-05, 1.66893e-05, 1.66894e-05], 0, 3.39865, 1667944720], "v": "v0.6"}
{"i": [["[\"batch_norm\", 1, 14, 14, 672]", "cuda -keys=cuda,gpu -max_num_threads=1024 -model=unknown -thread_warp_size=32", [-1, 16, 64, 49152, 2147483647, 1024, 8, 32], "", 0, []], [[], [["CI", 2], ["FU", 4, [0, 1, 2, 3]], ["SP", 4, 0, 131712, [49], 1], ["AN", 4, 0, 5], ["AN", 4, 1, 6]]]], "r": [[4.63044e-06, 4.63297e-06, 4.62792e-06], 0, 3.56884, 1667944721], "v": "v0.6"}
{"i": [["[\"batch_norm\", 1, 14, 14, 672]", "cuda -keys=cuda,gpu -max_num_threads=1024 -model=unknown -thread_warp_size=32", [-1, 16, 64, 49152, 2147483647, 1024, 8, 32], "", 0, []], [[], [["CI", 2], ["FU", 4, [0, 1, 2, 3]], ["SP", 4, 0, 131712, [3], 1], ["AN", 4, 0, 5], ["AN", 4, 1, 6]]]], "r": [[3.5307e-05, 3.53093e-05, 3.53104e-05], 0, 3.82191, 1667944721], "v": "v0.6"}
{"i": [["[\"batch_norm\", 1, 14, 14, 672]", "cuda -keys=cuda,gpu -max_num_threads=1024 -model=unknown -thread_warp_size=32", [-1, 16, 64, 49152, 2147483647, 1024, 8, 32], "", 0, []], [[], [["CI", 2], ["FU", 4, [0, 1, 2, 3]], ["SP", 4, 0, 131712, [4], 1], ["AN", 4, 0, 5], ["AN", 4, 1, 6]]]], "r": [[2.71311e-05, 2.71342e-05, 2.71316e-05], 0, 4.13978, 1667944721], "v": "v0.6"}
{"i": [["[\"batch_norm\", 1, 14, 14, 672]", "cuda -keys=cuda,gpu -max_num_threads=1024 -model=unknown -thread_warp_size=32", [-1, 16, 64, 49152, 2147483647, 1024, 8, 32], "", 0, []], [[], [["CI", 2], ["FU", 4, [0, 1, 2, 3]], ["SP", 4, 0, 131712, [64], 1], ["AN", 4, 0, 5], ["AN", 4, 1, 6]]]], "r": [[4.36609e-06, 4.3744e-06, 4.37067e-06], 0, 4.4048, 1667944722], "v": "v0.6"}
{"i": [["[\"batch_norm\", 1, 14, 14, 672]", "cuda -keys=cuda,gpu -max_num_threads=1024 -model=unknown -thread_warp_size=32", [-1, 16, 64, 49152, 2147483647, 1024, 8, 32], "", 0, []], [[], [["CI", 2], ["FU", 4, [0, 1, 2, 3]], ["SP", 4, 0, 131712, [6], 1], ["AN", 4, 0, 5], ["AN", 4, 1, 6]]]], "r": [[1.90192e-05, 1.90219e-05, 1.90191e-05], 0, 4.6252, 1667944722], "v": "v0.6"}
{"i": [["[\"batch_norm\", 1, 14, 14, 672]", "cuda -keys=cuda,gpu -max_num_threads=1024 -model=unknown -thread_warp_size=32", [-1, 16, 64, 49152, 2147483647, 1024, 8, 32], "", 0, []], [[], [["CI", 2], ["FU", 4, [0, 1, 2, 3]], ["SP", 4, 0, 131712, [8], 1], ["AN", 4, 0, 5], ["AN", 4, 1, 6]]]], "r": [[1.50349e-05, 1.50296e-05, 1.50312e-05], 0, 4.89643, 1667944722], "v": "v0.6"}
{"i": [["[\"batch_norm\", 1, 14, 14, 672]", "cuda -keys=cuda,gpu -max_num_threads=1024 -model=unknown -thread_warp_size=32", [-1, 16, 64, 49152, 2147483647, 1024, 8, 32], "", 0, []], [[], [["CI", 2], ["FU", 4, [0, 1, 2, 3]], ["SP", 4, 0, 131712, [24], 1], ["AN", 4, 0, 5], ["AN", 4, 1, 6]]]], "r": [[6.9127e-06, 6.91283e-06, 6.91614e-06], 0, 5.20623, 1667944723], "v": "v0.6"}
