python/models/efficientnet/VertiFusionEfficientNet_kernel_configs/efficient_mul_1_56_56_96.log
{"i": [["[\"mul\", 1, 56, 56, 96]", "cuda -keys=cuda,gpu -max_num_threads=1024 -model=unknown -thread_warp_size=32", [-1, 16, 64, 49152, 2147483647, 1024, 8, 32], "", 0, []], [[], [["FU", 2, [0, 1, 2, 3]], ["SP", 2, 0, 301056, [7], 1], ["AN", 2, 0, 5], ["AN", 2, 1, 6]]]], "r": [[3.46115e-05, 3.45968e-05, 3.46273e-05], 0, 0.948512, 1667925396], "v": "v0.6"}
{"i": [["[\"mul\", 1, 56, 56, 96]", "cuda -keys=cuda,gpu -max_num_threads=1024 -model=unknown -thread_warp_size=32", [-1, 16, 64, 49152, 2147483647, 1024, 8, 32], "", 0, []], [[], [["FU", 2, [0, 1, 2, 3]], ["SP", 2, 0, 301056, [21], 1], ["AN", 2, 0, 5], ["AN", 2, 1, 6]]]], "r": [[1.34082e-05, 1.34135e-05, 1.3412e-05], 0, 1.53518, 1667925396], "v": "v0.6"}
{"i": [["[\"mul\", 1, 56, 56, 96]", "cuda -keys=cuda,gpu -max_num_threads=1024 -model=unknown -thread_warp_size=32", [-1, 16, 64, 49152, 2147483647, 1024, 8, 32], "", 0, []], [[], [["FU", 2, [0, 1, 2, 3]], ["SP", 2, 0, 301056, [49], 1], ["AN", 2, 0, 5], ["AN", 2, 1, 6]]]], "r": [[7.13364e-06, 7.13346e-06, 7.12958e-06], 0, 1.24708, 1667925396], "v": "v0.6"}
{"i": [["[\"mul\", 1, 56, 56, 96]", "cuda -keys=cuda,gpu -max_num_threads=1024 -model=unknown -thread_warp_size=32", [-1, 16, 64, 49152, 2147483647, 1024, 8, 32], "", 0, []], [[], [["FU", 2, [0, 1, 2, 3]], ["SP", 2, 0, 301056, [64], 1], ["AN", 2, 0, 5], ["AN", 2, 1, 6]]]], "r": [[6.12189e-06, 6.11932e-06, 6.12073e-06], 0, 0.611228, 1667925395], "v": "v0.6"}
{"i": [["[\"mul\", 1, 56, 56, 96]", "cuda -keys=cuda,gpu -max_num_threads=1024 -model=unknown -thread_warp_size=32", [-1, 16, 64, 49152, 2147483647, 1024, 8, 32], "", 0, []], [[], [["FU", 2, [0, 1, 2, 3]], ["SP", 2, 0, 301056, [8], 1], ["AN", 2, 0, 5], ["AN", 2, 1, 6]]]], "r": [[3.06839e-05, 3.06829e-05, 3.06768e-05], 0, 2.1644, 1667925397], "v": "v0.6"}
{"i": [["[\"mul\", 1, 56, 56, 96]", "cuda -keys=cuda,gpu -max_num_threads=1024 -model=unknown -thread_warp_size=32", [-1, 16, 64, 49152, 2147483647, 1024, 8, 32], "", 0, []], [[], [["FU", 2, [0, 1, 2, 3]], ["SP", 2, 0, 301056, [4], 1], ["AN", 2, 0, 5], ["AN", 2, 1, 6]]]], "r": [[5.85054e-05, 5.85151e-05, 5.8523e-05], 0, 1.84597, 1667925397], "v": "v0.6"}
{"i": [["[\"mul\", 1, 56, 56, 96]", "cuda -keys=cuda,gpu -max_num_threads=1024 -model=unknown -thread_warp_size=32", [-1, 16, 64, 49152, 2147483647, 1024, 8, 32], "", 0, []], [[], [["FU", 2, [0, 1, 2, 3]], ["SP", 2, 0, 301056, [12], 1], ["AN", 2, 0, 5], ["AN", 2, 1, 6]]]], "r": [[2.14428e-05, 2.14428e-05, 2.14435e-05], 0, 2.4498, 1667925397], "v": "v0.6"}
{"i": [["[\"mul\", 1, 56, 56, 96]", "cuda -keys=cuda,gpu -max_num_threads=1024 -model=unknown -thread_warp_size=32", [-1, 16, 64, 49152, 2147483647, 1024, 8, 32], "", 0, []], [[], [["FU", 2, [0, 1, 2, 3]], ["SP", 2, 0, 301056, [24], 1], ["AN", 2, 0, 5], ["AN", 2, 1, 6]]]], "r": [[1.21824e-05, 1.21856e-05, 1.21822e-05], 0, 2.6821, 1667925398], "v": "v0.6"}
{"i": [["[\"mul\", 1, 56, 56, 96]", "cuda -keys=cuda,gpu -max_num_threads=1024 -model=unknown -thread_warp_size=32", [-1, 16, 64, 49152, 2147483647, 1024, 8, 32], "", 0, []], [[], [["FU", 2, [0, 1, 2, 3]], ["SP", 2, 0, 301056, [28], 1], ["AN", 2, 0, 5], ["AN", 2, 1, 6]]]], "r": [[1.06468e-05, 1.06533e-05, 1.06504e-05], 0, 2.87008, 1667925398], "v": "v0.6"}
{"i": [["[\"mul\", 1, 56, 56, 96]", "cuda -keys=cuda,gpu -max_num_threads=1024 -model=unknown -thread_warp_size=32", [-1, 16, 64, 49152, 2147483647, 1024, 8, 32], "", 0, []], [[], [["FU", 2, [0, 1, 2, 3]], ["SP", 2, 0, 301056, [56], 1], ["AN", 2, 0, 5], ["AN", 2, 1, 6]]]], "r": [[6.77283e-06, 6.78066e-06, 6.78005e-06], 0, 3.78524, 1667925399], "v": "v0.6"}
{"i": [["[\"mul\", 1, 56, 56, 96]", "cuda -keys=cuda,gpu -max_num_threads=1024 -model=unknown -thread_warp_size=32", [-1, 16, 64, 49152, 2147483647, 1024, 8, 32], "", 0, []], [[], [["FU", 2, [0, 1, 2, 3]], ["SP", 2, 0, 301056, [3], 1], ["AN", 2, 0, 5], ["AN", 2, 1, 6]]]], "r": [[7.70425e-05, 7.70532e-05, 7.70518e-05], 0, 3.19304, 1667925398], "v": "v0.6"}
{"i": [["[\"mul\", 1, 56, 56, 96]", "cuda -keys=cuda,gpu -max_num_threads=1024 -model=unknown -thread_warp_size=32", [-1, 16, 64, 49152, 2147483647, 1024, 8, 32], "", 0, []], [[], [["FU", 2, [0, 1, 2, 3]], ["SP", 2, 0, 301056, [2], 1], ["AN", 2, 0, 5], ["AN", 2, 1, 6]]]], "r": [[0.000114394, 0.000114369, 0.000114391], 0, 3.47522, 1667925399], "v": "v0.6"}
{"i": [["[\"mul\", 1, 56, 56, 96]", "cuda -keys=cuda,gpu -max_num_threads=1024 -model=unknown -thread_warp_size=32", [-1, 16, 64, 49152, 2147483647, 1024, 8, 32], "", 0, []], [[], [["FU", 2, [0, 1, 2, 3]], ["SP", 2, 0, 301056, [16], 1], ["AN", 2, 0, 5], ["AN", 2, 1, 6]]]], "r": [[1.68377e-05, 1.68449e-05, 1.68399e-05], 0, 4.08394, 1667925399], "v": "v0.6"}
{"i": [["[\"mul\", 1, 56, 56, 96]", "cuda -keys=cuda,gpu -max_num_threads=1024 -model=unknown -thread_warp_size=32", [-1, 16, 64, 49152, 2147483647, 1024, 8, 32], "", 0, []], [[], [["FU", 2, [0, 1, 2, 3]], ["SP", 2, 0, 301056, [42], 1], ["AN", 2, 0, 5], ["AN", 2, 1, 6]]]], "r": [[8.12611e-06, 8.12615e-06, 8.12298e-06], 0, 4.36437, 1667925400], "v": "v0.6"}
{"i": [["[\"mul\", 1, 56, 56, 96]", "cuda -keys=cuda,gpu -max_num_threads=1024 -model=unknown -thread_warp_size=32", [-1, 16, 64, 49152, 2147483647, 1024, 8, 32], "", 0, []], [[], [["FU", 2, [0, 1, 2, 3]], ["SP", 2, 0, 301056, [32], 1], ["AN", 2, 0, 5], ["AN", 2, 1, 6]]]], "r": [[9.6536e-06, 9.66192e-06, 9.65812e-06], 0, 4.65415, 1667925400], "v": "v0.6"}
{"i": [["[\"mul\", 1, 56, 56, 96]", "cuda -keys=cuda,gpu -max_num_threads=1024 -model=unknown -thread_warp_size=32", [-1, 16, 64, 49152, 2147483647, 1024, 8, 32], "", 0, []], [[], [["FU", 2, [0, 1, 2, 3]], ["SP", 2, 0, 301056, [48], 1], ["AN", 2, 0, 5], ["AN", 2, 1, 6]]]], "r": [[7.26922e-06, 7.2681e-06, 7.27017e-06], 0, 4.96337, 1667925400], "v": "v0.6"}
{"i": [["[\"mul\", 1, 56, 56, 96]", "cuda -keys=cuda,gpu -max_num_threads=1024 -model=unknown -thread_warp_size=32", [-1, 16, 64, 49152, 2147483647, 1024, 8, 32], "", 0, []], [[], [["FU", 2, [0, 1, 2, 3]], ["SP", 2, 0, 301056, [1], 1], ["AN", 2, 0, 5], ["AN", 2, 1, 6]]]], "r": [[0.000225828, 0.000225827, 0.000225826], 0, 5.2558, 1667925401], "v": "v0.6"}
{"i": [["[\"mul\", 1, 56, 56, 96]", "cuda -keys=cuda,gpu -max_num_threads=1024 -model=unknown -thread_warp_size=32", [-1, 16, 64, 49152, 2147483647, 1024, 8, 32], "", 0, []], [[], [["FU", 2, [0, 1, 2, 3]], ["SP", 2, 0, 301056, [14], 1], ["AN", 2, 0, 5], ["AN", 2, 1, 6]]]], "r": [[1.86246e-05, 1.86262e-05, 1.86246e-05], 0, 5.50197, 1667925401], "v": "v0.6"}
{"i": [["[\"mul\", 1, 56, 56, 96]", "cuda -keys=cuda,gpu -max_num_threads=1024 -model=unknown -thread_warp_size=32", [-1, 16, 64, 49152, 2147483647, 1024, 8, 32], "", 0, []], [[], [["FU", 2, [0, 1, 2, 3]], ["SP", 2, 0, 301056, [6], 1], ["AN", 2, 0, 5], ["AN", 2, 1, 6]]]], "r": [[3.99623e-05, 3.99656e-05, 3.99686e-05], 0, 5.82937, 1667925401], "v": "v0.6"}
{"i": [["[\"mul\", 1, 56, 56, 96]", "cuda -keys=cuda,gpu -max_num_threads=1024 -model=unknown -thread_warp_size=32", [-1, 16, 64, 49152, 2147483647, 1024, 8, 32], "", 0, []], [[], [["FU", 2, [0, 1, 2, 3]], ["SP", 2, 0, 301056, [3], 1], ["AN", 2, 0, 5], ["AN", 2, 1, 6]]]], "r": [[7.7054e-05, 7.70507e-05, 7.70386e-05], 0, 2.20492, 1667925970], "v": "v0.6"}
{"i": [["[\"mul\", 1, 56, 56, 96]", "cuda -keys=cuda,gpu -max_num_threads=1024 -model=unknown -thread_warp_size=32", [-1, 16, 64, 49152, 2147483647, 1024, 8, 32], "", 0, []], [[], [["FU", 2, [0, 1, 2, 3]], ["SP", 2, 0, 301056, [16], 1], ["AN", 2, 0, 5], ["AN", 2, 1, 6]]]], "r": [[1.67026e-05, 1.67067e-05, 1.67001e-05], 0, 1.89226, 1667925969], "v": "v0.6"}
{"i": [["[\"mul\", 1, 56, 56, 96]", "cuda -keys=cuda,gpu -max_num_threads=1024 -model=unknown -thread_warp_size=32", [-1, 16, 64, 49152, 2147483647, 1024, 8, 32], "", 0, []], [[], [["FU", 2, [0, 1, 2, 3]], ["SP", 2, 0, 301056, [28], 1], ["AN", 2, 0, 5], ["AN", 2, 1, 6]]]], "r": [[1.07508e-05, 1.07494e-05, 1.07485e-05], 0, 0.961931, 1667925968], "v": "v0.6"}
{"i": [["[\"mul\", 1, 56, 56, 96]", "cuda -keys=cuda,gpu -max_num_threads=1024 -model=unknown -thread_warp_size=32", [-1, 16, 64, 49152, 2147483647, 1024, 8, 32], "", 0, []], [[], [["FU", 2, [0, 1, 2, 3]], ["SP", 2, 0, 301056, [48], 1], ["AN", 2, 0, 5], ["AN", 2, 1, 6]]]], "r": [[7.21417e-06, 7.21386e-06, 7.21338e-06], 0, 0.664652, 1667925968], "v": "v0.6"}
{"i": [["[\"mul\", 1, 56, 56, 96]", "cuda -keys=cuda,gpu -max_num_threads=1024 -model=unknown -thread_warp_size=32", [-1, 16, 64, 49152, 2147483647, 1024, 8, 32], "", 0, []], [[], [["FU", 2, [0, 1, 2, 3]], ["SP", 2, 0, 301056, [6], 1], ["AN", 2, 0, 5], ["AN", 2, 1, 6]]]], "r": [[3.97702e-05, 3.97791e-05, 3.97672e-05], 0, 1.26376, 1667925969], "v": "v0.6"}
{"i": [["[\"mul\", 1, 56, 56, 96]", "cuda -keys=cuda,gpu -max_num_threads=1024 -model=unknown -thread_warp_size=32", [-1, 16, 64, 49152, 2147483647, 1024, 8, 32], "", 0, []], [[], [["FU", 2, [0, 1, 2, 3]], ["SP", 2, 0, 301056, [8], 1], ["AN", 2, 0, 5], ["AN", 2, 1, 6]]]], "r": [[3.06635e-05, 3.06729e-05, 3.06764e-05], 0, 2.84579, 1667925970], "v": "v0.6"}
{"i": [["[\"mul\", 1, 56, 56, 96]", "cuda -keys=cuda,gpu -max_num_threads=1024 -model=unknown -thread_warp_size=32", [-1, 16, 64, 49152, 2147483647, 1024, 8, 32], "", 0, []], [[], [["FU", 2, [0, 1, 2, 3]], ["SP", 2, 0, 301056, [4], 1], ["AN", 2, 0, 5], ["AN", 2, 1, 6]]]], "r": [[5.85261e-05, 5.85017e-05, 5.85073e-05], 0, 2.52717, 1667925970], "v": "v0.6"}
{"i": [["[\"mul\", 1, 56, 56, 96]", "cuda -keys=cuda,gpu -max_num_threads=1024 -model=unknown -thread_warp_size=32", [-1, 16, 64, 49152, 2147483647, 1024, 8, 32], "", 0, []], [[], [["FU", 2, [0, 1, 2, 3]], ["SP", 2, 0, 301056, [24], 1], ["AN", 2, 0, 5], ["AN", 2, 1, 6]]]], "r": [[1.20342e-05, 1.20413e-05, 1.20372e-05], 0, 1.59412, 1667925969], "v": "v0.6"}
{"i": [["[\"mul\", 1, 56, 56, 96]", "cuda -keys=cuda,gpu -max_num_threads=1024 -model=unknown -thread_warp_size=32", [-1, 16, 64, 49152, 2147483647, 1024, 8, 32], "", 0, []], [[], [["FU", 2, [0, 1, 2, 3]], ["SP", 2, 0, 301056, [14], 1], ["AN", 2, 0, 5], ["AN", 2, 1, 6]]]], "r": [[1.86492e-05, 1.86633e-05, 1.86523e-05], 0, 3.42136, 1667925971], "v": "v0.6"}
{"i": [["[\"mul\", 1, 56, 56, 96]", "cuda -keys=cuda,gpu -max_num_threads=1024 -model=unknown -thread_warp_size=32", [-1, 16, 64, 49152, 2147483647, 1024, 8, 32], "", 0, []], [[], [["FU", 2, [0, 1, 2, 3]], ["SP", 2, 0, 301056, [32], 1], ["AN", 2, 0, 5], ["AN", 2, 1, 6]]]], "r": [[9.68948e-06, 9.68649e-06, 9.69086e-06], 0, 3.09319, 1667925971], "v": "v0.6"}
{"i": [["[\"mul\", 1, 56, 56, 96]", "cuda -keys=cuda,gpu -max_num_threads=1024 -model=unknown -thread_warp_size=32", [-1, 16, 64, 49152, 2147483647, 1024, 8, 32], "", 0, []], [[], [["FU", 2, [0, 1, 2, 3]], ["SP", 2, 0, 301056, [56], 1], ["AN", 2, 0, 5], ["AN", 2, 1, 6]]]], "r": [[6.55256e-06, 6.55618e-06, 6.55282e-06], 0, 3.66894, 1667925971], "v": "v0.6"}
{"i": [["[\"mul\", 1, 56, 56, 96]", "cuda -keys=cuda,gpu -max_num_threads=1024 -model=unknown -thread_warp_size=32", [-1, 16, 64, 49152, 2147483647, 1024, 8, 32], "", 0, []], [[], [["FU", 2, [0, 1, 2, 3]], ["SP", 2, 0, 301056, [7], 1], ["AN", 2, 0, 5], ["AN", 2, 1, 6]]]], "r": [[3.4477e-05, 3.449e-05, 3.44856e-05], 0, 3.90392, 1667925972], "v": "v0.6"}
{"i": [["[\"mul\", 1, 56, 56, 96]", "cuda -keys=cuda,gpu -max_num_threads=1024 -model=unknown -thread_warp_size=32", [-1, 16, 64, 49152, 2147483647, 1024, 8, 32], "", 0, []], [[], [["FU", 2, [0, 1, 2, 3]], ["SP", 2, 0, 301056, [21], 1], ["AN", 2, 0, 5], ["AN", 2, 1, 6]]]], "r": [[1.34721e-05, 1.34721e-05, 1.34709e-05], 0, 4.2491, 1667925972], "v": "v0.6"}
{"i": [["[\"mul\", 1, 56, 56, 96]", "cuda -keys=cuda,gpu -max_num_threads=1024 -model=unknown -thread_warp_size=32", [-1, 16, 64, 49152, 2147483647, 1024, 8, 32], "", 0, []], [[], [["FU", 2, [0, 1, 2, 3]], ["SP", 2, 0, 301056, [49], 1], ["AN", 2, 0, 5], ["AN", 2, 1, 6]]]], "r": [[7.14232e-06, 7.1432e-06, 7.14033e-06], 0, 4.5248, 1667925972], "v": "v0.6"}
{"i": [["[\"mul\", 1, 56, 56, 96]", "cuda -keys=cuda,gpu -max_num_threads=1024 -model=unknown -thread_warp_size=32", [-1, 16, 64, 49152, 2147483647, 1024, 8, 32], "", 0, []], [[], [["FU", 2, [0, 1, 2, 3]], ["SP", 2, 0, 301056, [1], 1], ["AN", 2, 0, 5], ["AN", 2, 1, 6]]]], "r": [[0.000225942, 0.000225892, 0.000225929], 0, 4.80409, 1667925973], "v": "v0.6"}
{"i": [["[\"mul\", 1, 56, 56, 96]", "cuda -keys=cuda,gpu -max_num_threads=1024 -model=unknown -thread_warp_size=32", [-1, 16, 64, 49152, 2147483647, 1024, 8, 32], "", 0, []], [[], [["FU", 2, [0, 1, 2, 3]], ["SP", 2, 0, 301056, [2], 1], ["AN", 2, 0, 5], ["AN", 2, 1, 6]]]], "r": [[0.000114305, 0.000114304, 0.000114319], 0, 5.11585, 1667925973], "v": "v0.6"}
{"i": [["[\"mul\", 1, 56, 56, 96]", "cuda -keys=cuda,gpu -max_num_threads=1024 -model=unknown -thread_warp_size=32", [-1, 16, 64, 49152, 2147483647, 1024, 8, 32], "", 0, []], [[], [["FU", 2, [0, 1, 2, 3]], ["SP", 2, 0, 301056, [42], 1], ["AN", 2, 0, 5], ["AN", 2, 1, 6]]]], "r": [[7.96237e-06, 7.95497e-06, 7.94948e-06], 0, 5.38907, 1667925973], "v": "v0.6"}
{"i": [["[\"mul\", 1, 56, 56, 96]", "cuda -keys=cuda,gpu -max_num_threads=1024 -model=unknown -thread_warp_size=32", [-1, 16, 64, 49152, 2147483647, 1024, 8, 32], "", 0, []], [[], [["FU", 2, [0, 1, 2, 3]], ["SP", 2, 0, 301056, [64], 1], ["AN", 2, 0, 5], ["AN", 2, 1, 6]]]], "r": [[6.03735e-06, 6.03343e-06, 6.03895e-06], 0, 5.73876, 1667925974], "v": "v0.6"}
{"i": [["[\"mul\", 1, 56, 56, 96]", "cuda -keys=cuda,gpu -max_num_threads=1024 -model=unknown -thread_warp_size=32", [-1, 16, 64, 49152, 2147483647, 1024, 8, 32], "", 0, []], [[], [["FU", 2, [0, 1, 2, 3]], ["SP", 2, 0, 301056, [12], 1], ["AN", 2, 0, 5], ["AN", 2, 1, 6]]]], "r": [[2.1293e-05, 2.13133e-05, 2.13048e-05], 0, 5.94689, 1667925974], "v": "v0.6"}
{"i": [["[\"mul\", 1, 56, 56, 96]", "cuda -keys=cuda,gpu -max_num_threads=1024 -model=unknown -thread_warp_size=32", [-1, 16, 64, 49152, 2147483647, 1024, 8, 32], "", 0, []], [[], [["FU", 2, [0, 1, 2, 3]], ["SP", 2, 0, 301056, [7], 1], ["AN", 2, 0, 5], ["AN", 2, 1, 6]]]], "r": [[3.46161e-05, 3.46124e-05, 3.46019e-05], 0, 1.5226, 1667932927], "v": "v0.6"}
{"i": [["[\"mul\", 1, 56, 56, 96]", "cuda -keys=cuda,gpu -max_num_threads=1024 -model=unknown -thread_warp_size=32", [-1, 16, 64, 49152, 2147483647, 1024, 8, 32], "", 0, []], [[], [["FU", 2, [0, 1, 2, 3]], ["SP", 2, 0, 301056, [12], 1], ["AN", 2, 0, 5], ["AN", 2, 1, 6]]]], "r": [[2.13399e-05, 2.13472e-05, 2.13422e-05], 0, 0.652553, 1667932926], "v": "v0.6"}
{"i": [["[\"mul\", 1, 56, 56, 96]", "cuda -keys=cuda,gpu -max_num_threads=1024 -model=unknown -thread_warp_size=32", [-1, 16, 64, 49152, 2147483647, 1024, 8, 32], "", 0, []], [[], [["FU", 2, [0, 1, 2, 3]], ["SP", 2, 0, 301056, [6], 1], ["AN", 2, 0, 5], ["AN", 2, 1, 6]]]], "r": [[3.98339e-05, 3.9846e-05, 3.98564e-05], 0, 1.17541, 1667932927], "v": "v0.6"}
{"i": [["[\"mul\", 1, 56, 56, 96]", "cuda -keys=cuda,gpu -max_num_threads=1024 -model=unknown -thread_warp_size=32", [-1, 16, 64, 49152, 2147483647, 1024, 8, 32], "", 0, []], [[], [["FU", 2, [0, 1, 2, 3]], ["SP", 2, 0, 301056, [49], 1], ["AN", 2, 0, 5], ["AN", 2, 1, 6]]]], "r": [[7.18995e-06, 7.1867e-06, 7.18389e-06], 0, 2.19538, 1667932928], "v": "v0.6"}
{"i": [["[\"mul\", 1, 56, 56, 96]", "cuda -keys=cuda,gpu -max_num_threads=1024 -model=unknown -thread_warp_size=32", [-1, 16, 64, 49152, 2147483647, 1024, 8, 32], "", 0, []], [[], [["FU", 2, [0, 1, 2, 3]], ["SP", 2, 0, 301056, [3], 1], ["AN", 2, 0, 5], ["AN", 2, 1, 6]]]], "r": [[7.70262e-05, 7.70272e-05, 7.70275e-05], 0, 0.8732, 1667932926], "v": "v0.6"}
{"i": [["[\"mul\", 1, 56, 56, 96]", "cuda -keys=cuda,gpu -max_num_threads=1024 -model=unknown -thread_warp_size=32", [-1, 16, 64, 49152, 2147483647, 1024, 8, 32], "", 0, []], [[], [["FU", 2, [0, 1, 2, 3]], ["SP", 2, 0, 301056, [2], 1], ["AN", 2, 0, 5], ["AN", 2, 1, 6]]]], "r": [[0.000114329, 0.000114355, 0.000114355], 0, 1.87313, 1667932928], "v": "v0.6"}
{"i": [["[\"mul\", 1, 56, 56, 96]", "cuda -keys=cuda,gpu -max_num_threads=1024 -model=unknown -thread_warp_size=32", [-1, 16, 64, 49152, 2147483647, 1024, 8, 32], "", 0, []], [[], [["FU", 2, [0, 1, 2, 3]], ["SP", 2, 0, 301056, [1], 1], ["AN", 2, 0, 5], ["AN", 2, 1, 6]]]], "r": [[0.000225821, 0.000225822, 0.000225847], 0, 2.53645, 1667932928], "v": "v0.6"}
{"i": [["[\"mul\", 1, 56, 56, 96]", "cuda -keys=cuda,gpu -max_num_threads=1024 -model=unknown -thread_warp_size=32", [-1, 16, 64, 49152, 2147483647, 1024, 8, 32], "", 0, []], [[], [["FU", 2, [0, 1, 2, 3]], ["SP", 2, 0, 301056, [21], 1], ["AN", 2, 0, 5], ["AN", 2, 1, 6]]]], "r": [[1.33617e-05, 1.33649e-05, 1.33716e-05], 0, 2.79232, 1667932929], "v": "v0.6"}
{"i": [["[\"mul\", 1, 56, 56, 96]", "cuda -keys=cuda,gpu -max_num_threads=1024 -model=unknown -thread_warp_size=32", [-1, 16, 64, 49152, 2147483647, 1024, 8, 32], "", 0, []], [[], [["FU", 2, [0, 1, 2, 3]], ["SP", 2, 0, 301056, [8], 1], ["AN", 2, 0, 5], ["AN", 2, 1, 6]]]], "r": [[3.06374e-05, 3.06306e-05, 3.06346e-05], 0, 3.02538, 1667932929], "v": "v0.6"}
{"i": [["[\"mul\", 1, 56, 56, 96]", "cuda -keys=cuda,gpu -max_num_threads=1024 -model=unknown -thread_warp_size=32", [-1, 16, 64, 49152, 2147483647, 1024, 8, 32], "", 0, []], [[], [["FU", 2, [0, 1, 2, 3]], ["SP", 2, 0, 301056, [16], 1], ["AN", 2, 0, 5], ["AN", 2, 1, 6]]]], "r": [[1.6831e-05, 1.68295e-05, 1.6834e-05], 0, 3.39484, 1667932929], "v": "v0.6"}
{"i": [["[\"mul\", 1, 56, 56, 96]", "cuda -keys=cuda,gpu -max_num_threads=1024 -model=unknown -thread_warp_size=32", [-1, 16, 64, 49152, 2147483647, 1024, 8, 32], "", 0, []], [[], [["FU", 2, [0, 1, 2, 3]], ["SP", 2, 0, 301056, [64], 1], ["AN", 2, 0, 5], ["AN", 2, 1, 6]]]], "r": [[6.07047e-06, 6.07281e-06, 6.08024e-06], 0, 3.64455, 1667932930], "v": "v0.6"}
{"i": [["[\"mul\", 1, 56, 56, 96]", "cuda -keys=cuda,gpu -max_num_threads=1024 -model=unknown -thread_warp_size=32", [-1, 16, 64, 49152, 2147483647, 1024, 8, 32], "", 0, []], [[], [["FU", 2, [0, 1, 2, 3]], ["SP", 2, 0, 301056, [14], 1], ["AN", 2, 0, 5], ["AN", 2, 1, 6]]]], "r": [[1.86606e-05, 1.8668e-05, 1.86629e-05], 0, 3.95861, 1667932930], "v": "v0.6"}
{"i": [["[\"mul\", 1, 56, 56, 96]", "cuda -keys=cuda,gpu -max_num_threads=1024 -model=unknown -thread_warp_size=32", [-1, 16, 64, 49152, 2147483647, 1024, 8, 32], "", 0, []], [[], [["FU", 2, [0, 1, 2, 3]], ["SP", 2, 0, 301056, [48], 1], ["AN", 2, 0, 5], ["AN", 2, 1, 6]]]], "r": [[7.40547e-06, 7.40167e-06, 7.39884e-06], 0, 4.26241, 1667932930], "v": "v0.6"}
{"i": [["[\"mul\", 1, 56, 56, 96]", "cuda -keys=cuda,gpu -max_num_threads=1024 -model=unknown -thread_warp_size=32", [-1, 16, 64, 49152, 2147483647, 1024, 8, 32], "", 0, []], [[], [["FU", 2, [0, 1, 2, 3]], ["SP", 2, 0, 301056, [32], 1], ["AN", 2, 0, 5], ["AN", 2, 1, 6]]]], "r": [[9.62617e-06, 9.62645e-06, 9.63885e-06], 0, 4.52334, 1667932931], "v": "v0.6"}
{"i": [["[\"mul\", 1, 56, 56, 96]", "cuda -keys=cuda,gpu -max_num_threads=1024 -model=unknown -thread_warp_size=32", [-1, 16, 64, 49152, 2147483647, 1024, 8, 32], "", 0, []], [[], [["FU", 2, [0, 1, 2, 3]], ["SP", 2, 0, 301056, [28], 1], ["AN", 2, 0, 5], ["AN", 2, 1, 6]]]], "r": [[1.07718e-05, 1.07716e-05, 1.07637e-05], 0, 4.83583, 1667932931], "v": "v0.6"}
{"i": [["[\"mul\", 1, 56, 56, 96]", "cuda -keys=cuda,gpu -max_num_threads=1024 -model=unknown -thread_warp_size=32", [-1, 16, 64, 49152, 2147483647, 1024, 8, 32], "", 0, []], [[], [["FU", 2, [0, 1, 2, 3]], ["SP", 2, 0, 301056, [42], 1], ["AN", 2, 0, 5], ["AN", 2, 1, 6]]]], "r": [[8.1229e-06, 8.12364e-06, 8.12124e-06], 0, 5.14276, 1667932931], "v": "v0.6"}
{"i": [["[\"mul\", 1, 56, 56, 96]", "cuda -keys=cuda,gpu -max_num_threads=1024 -model=unknown -thread_warp_size=32", [-1, 16, 64, 49152, 2147483647, 1024, 8, 32], "", 0, []], [[], [["FU", 2, [0, 1, 2, 3]], ["SP", 2, 0, 301056, [24], 1], ["AN", 2, 0, 5], ["AN", 2, 1, 6]]]], "r": [[1.19765e-05, 1.19745e-05, 1.1978e-05], 0, 5.40911, 1667932932], "v": "v0.6"}
{"i": [["[\"mul\", 1, 56, 56, 96]", "cuda -keys=cuda,gpu -max_num_threads=1024 -model=unknown -thread_warp_size=32", [-1, 16, 64, 49152, 2147483647, 1024, 8, 32], "", 0, []], [[], [["FU", 2, [0, 1, 2, 3]], ["SP", 2, 0, 301056, [4], 1], ["AN", 2, 0, 5], ["AN", 2, 1, 6]]]], "r": [[5.84646e-05, 5.84546e-05, 5.84686e-05], 0, 5.74268, 1667932932], "v": "v0.6"}
{"i": [["[\"mul\", 1, 56, 56, 96]", "cuda -keys=cuda,gpu -max_num_threads=1024 -model=unknown -thread_warp_size=32", [-1, 16, 64, 49152, 2147483647, 1024, 8, 32], "", 0, []], [[], [["FU", 2, [0, 1, 2, 3]], ["SP", 2, 0, 301056, [56], 1], ["AN", 2, 0, 5], ["AN", 2, 1, 6]]]], "r": [[6.75915e-06, 6.76634e-06, 6.77174e-06], 0, 6.04106, 1667932932], "v": "v0.6"}
