python/models/efficientnet/VertiFusionEfficientNet_kernel_configs/efficient_mul_1_1_1_672.log
{"i": [["[\"mul\", 1, 1, 1, 672]", "cuda -keys=cuda,gpu -max_num_threads=1024 -model=unknown -thread_warp_size=32", [-1, 16, 64, 49152, 2147483647, 1024, 8, 32], "", 0, []], [[], [["FU", 2, [0, 1, 2, 3]], ["SP", 2, 0, 672, [42], 1], ["AN", 2, 0, 5], ["AN", 2, 1, 6]]]], "r": [[2.62829e-06, 2.63005e-06, 2.64177e-06], 0, 0.590833, 1667927345], "v": "v0.6"}
{"i": [["[\"mul\", 1, 1, 1, 672]", "cuda -keys=cuda,gpu -max_num_threads=1024 -model=unknown -thread_warp_size=32", [-1, 16, 64, 49152, 2147483647, 1024, 8, 32], "", 0, []], [[], [["FU", 2, [0, 1, 2, 3]], ["SP", 2, 0, 672, [8], 1], ["AN", 2, 0, 5], ["AN", 2, 1, 6]]]], "r": [[2.49985e-06, 2.49491e-06, 2.49666e-06], 0, 2.01455, 1667927347], "v": "v0.6"}
{"i": [["[\"mul\", 1, 1, 1, 672]", "cuda -keys=cuda,gpu -max_num_threads=1024 -model=unknown -thread_warp_size=32", [-1, 16, 64, 49152, 2147483647, 1024, 8, 32], "", 0, []], [[], [["FU", 2, [0, 1, 2, 3]], ["SP", 2, 0, 672, [21], 1], ["AN", 2, 0, 5], ["AN", 2, 1, 6]]]], "r": [[2.67537e-06, 2.66958e-06, 2.6928e-06], 0, 1.40261, 1667927346], "v": "v0.6"}
{"i": [["[\"mul\", 1, 1, 1, 672]", "cuda -keys=cuda,gpu -max_num_threads=1024 -model=unknown -thread_warp_size=32", [-1, 16, 64, 49152, 2147483647, 1024, 8, 32], "", 0, []], [[], [["FU", 2, [0, 1, 2, 3]], ["SP", 2, 0, 672, [56], 1], ["AN", 2, 0, 5], ["AN", 2, 1, 6]]]], "r": [[2.50064e-06, 2.50345e-06, 2.501e-06], 0, 0.937225, 1667927345], "v": "v0.6"}
{"i": [["[\"mul\", 1, 1, 1, 672]", "cuda -keys=cuda,gpu -max_num_threads=1024 -model=unknown -thread_warp_size=32", [-1, 16, 64, 49152, 2147483647, 1024, 8, 32], "", 0, []], [[], [["FU", 2, [0, 1, 2, 3]], ["SP", 2, 0, 672, [14], 1], ["AN", 2, 0, 5], ["AN", 2, 1, 6]]]], "r": [[2.59435e-06, 2.59835e-06, 2.62669e-06], 0, 2.29202, 1667927347], "v": "v0.6"}
{"i": [["[\"mul\", 1, 1, 1, 672]", "cuda -keys=cuda,gpu -max_num_threads=1024 -model=unknown -thread_warp_size=32", [-1, 16, 64, 49152, 2147483647, 1024, 8, 32], "", 0, []], [[], [["FU", 2, [0, 1, 2, 3]], ["SP", 2, 0, 672, [32], 1], ["AN", 2, 0, 5], ["AN", 2, 1, 6]]]], "r": [[2.68511e-06, 2.67955e-06, 2.70855e-06], 0, 1.07766, 1667927346], "v": "v0.6"}
{"i": [["[\"mul\", 1, 1, 1, 672]", "cuda -keys=cuda,gpu -max_num_threads=1024 -model=unknown -thread_warp_size=32", [-1, 16, 64, 49152, 2147483647, 1024, 8, 32], "", 0, []], [[], [["FU", 2, [0, 1, 2, 3]], ["SP", 2, 0, 672, [6], 1], ["AN", 2, 0, 5], ["AN", 2, 1, 6]]]], "r": [[2.49144e-06, 2.4874e-06, 2.48571e-06], 0, 2.61004, 1667927347], "v": "v0.6"}
{"i": [["[\"mul\", 1, 1, 1, 672]", "cuda -keys=cuda,gpu -max_num_threads=1024 -model=unknown -thread_warp_size=32", [-1, 16, 64, 49152, 2147483647, 1024, 8, 32], "", 0, []], [[], [["FU", 2, [0, 1, 2, 3]], ["SP", 2, 0, 672, [7], 1], ["AN", 2, 0, 5], ["AN", 2, 1, 6]]]], "r": [[2.67945e-06, 2.67352e-06, 2.67899e-06], 0, 1.64308, 1667927346], "v": "v0.6"}
{"i": [["[\"mul\", 1, 1, 1, 672]", "cuda -keys=cuda,gpu -max_num_threads=1024 -model=unknown -thread_warp_size=32", [-1, 16, 64, 49152, 2147483647, 1024, 8, 32], "", 0, []], [[], [["FU", 2, [0, 1, 2, 3]], ["SP", 2, 0, 672, [12], 1], ["AN", 2, 0, 5], ["AN", 2, 1, 6]]]], "r": [[2.51312e-06, 2.51623e-06, 2.51621e-06], 0, 2.73295, 1667927348], "v": "v0.6"}
{"i": [["[\"mul\", 1, 1, 1, 672]", "cuda -keys=cuda,gpu -max_num_threads=1024 -model=unknown -thread_warp_size=32", [-1, 16, 64, 49152, 2147483647, 1024, 8, 32], "", 0, []], [[], [["FU", 2, [0, 1, 2, 3]], ["SP", 2, 0, 672, [4], 1], ["AN", 2, 0, 5], ["AN", 2, 1, 6]]]], "r": [[2.71045e-06, 2.70988e-06, 2.72269e-06], 0, 3.01898, 1667927348], "v": "v0.6"}
{"i": [["[\"mul\", 1, 1, 1, 672]", "cuda -keys=cuda,gpu -max_num_threads=1024 -model=unknown -thread_warp_size=32", [-1, 16, 64, 49152, 2147483647, 1024, 8, 32], "", 0, []], [[], [["FU", 2, [0, 1, 2, 3]], ["SP", 2, 0, 672, [48], 1], ["AN", 2, 0, 5], ["AN", 2, 1, 6]]]], "r": [[2.56244e-06, 2.5707e-06, 2.57007e-06], 0, 3.55335, 1667927348], "v": "v0.6"}
{"i": [["[\"mul\", 1, 1, 1, 672]", "cuda -keys=cuda,gpu -max_num_threads=1024 -model=unknown -thread_warp_size=32", [-1, 16, 64, 49152, 2147483647, 1024, 8, 32], "", 0, []], [[], [["FU", 2, [0, 1, 2, 3]], ["SP", 2, 0, 672, [28], 1], ["AN", 2, 0, 5], ["AN", 2, 1, 6]]]], "r": [[2.64111e-06, 2.64197e-06, 2.65494e-06], 0, 3.30613, 1667927348], "v": "v0.6"}
{"i": [["[\"mul\", 1, 1, 1, 672]", "cuda -keys=cuda,gpu -max_num_threads=1024 -model=unknown -thread_warp_size=32", [-1, 16, 64, 49152, 2147483647, 1024, 8, 32], "", 0, []], [[], [["FU", 2, [0, 1, 2, 3]], ["SP", 2, 0, 672, [2], 1], ["AN", 2, 0, 5], ["AN", 2, 1, 6]]]], "r": [[2.96544e-06, 2.96349e-06, 2.97159e-06], 0, 4.03275, 1667927349], "v": "v0.6"}
{"i": [["[\"mul\", 1, 1, 1, 672]", "cuda -keys=cuda,gpu -max_num_threads=1024 -model=unknown -thread_warp_size=32", [-1, 16, 64, 49152, 2147483647, 1024, 8, 32], "", 0, []], [[], [["FU", 2, [0, 1, 2, 3]], ["SP", 2, 0, 672, [3], 1], ["AN", 2, 0, 5], ["AN", 2, 1, 6]]]], "r": [[2.80481e-06, 2.80076e-06, 2.81451e-06], 0, 3.77934, 1667927349], "v": "v0.6"}
{"i": [["[\"mul\", 1, 1, 1, 672]", "cuda -keys=cuda,gpu -max_num_threads=1024 -model=unknown -thread_warp_size=32", [-1, 16, 64, 49152, 2147483647, 1024, 8, 32], "", 0, []], [[], [["FU", 2, [0, 1, 2, 3]], ["SP", 2, 0, 672, [1], 1], ["AN", 2, 0, 5], ["AN", 2, 1, 6]]]], "r": [[3.18245e-06, 3.18371e-06, 3.18963e-06], 0, 4.29613, 1667927349], "v": "v0.6"}
{"i": [["[\"mul\", 1, 1, 1, 672]", "cuda -keys=cuda,gpu -max_num_threads=1024 -model=unknown -thread_warp_size=32", [-1, 16, 64, 49152, 2147483647, 1024, 8, 32], "", 0, []], [[], [["FU", 2, [0, 1, 2, 3]], ["SP", 2, 0, 672, [24], 1], ["AN", 2, 0, 5], ["AN", 2, 1, 6]]]], "r": [[2.50791e-06, 2.51298e-06, 2.51258e-06], 0, 4.52005, 1667927350], "v": "v0.6"}
{"i": [["[\"mul\", 1, 1, 1, 672]", "cuda -keys=cuda,gpu -max_num_threads=1024 -model=unknown -thread_warp_size=32", [-1, 16, 64, 49152, 2147483647, 1024, 8, 32], "", 0, []], [[], [["FU", 2, [0, 1, 2, 3]], ["SP", 2, 0, 672, [16], 1], ["AN", 2, 0, 5], ["AN", 2, 1, 6]]]], "r": [[2.48697e-06, 2.48294e-06, 2.48202e-06], 0, 4.84335, 1667927350], "v": "v0.6"}
{"i": [["[\"mul\", 1, 1, 1, 672]", "cuda -keys=cuda,gpu -max_num_threads=1024 -model=unknown -thread_warp_size=32", [-1, 16, 64, 49152, 2147483647, 1024, 8, 32], "", 0, []], [[], [["FU", 2, [0, 1, 2, 3]], ["SP", 2, 0, 672, [8], 1], ["AN", 2, 0, 5], ["AN", 2, 1, 6]]]], "r": [[2.50564e-06, 2.50348e-06, 2.50211e-06], 0, 2.05036, 1667927450], "v": "v0.6"}
{"i": [["[\"mul\", 1, 1, 1, 672]", "cuda -keys=cuda,gpu -max_num_threads=1024 -model=unknown -thread_warp_size=32", [-1, 16, 64, 49152, 2147483647, 1024, 8, 32], "", 0, []], [[], [["FU", 2, [0, 1, 2, 3]], ["SP", 2, 0, 672, [16], 1], ["AN", 2, 0, 5], ["AN", 2, 1, 6]]]], "r": [[2.51292e-06, 2.51445e-06, 2.51517e-06], 0, 0.910824, 1667927448], "v": "v0.6"}
{"i": [["[\"mul\", 1, 1, 1, 672]", "cuda -keys=cuda,gpu -max_num_threads=1024 -model=unknown -thread_warp_size=32", [-1, 16, 64, 49152, 2147483647, 1024, 8, 32], "", 0, []], [[], [["FU", 2, [0, 1, 2, 3]], ["SP", 2, 0, 672, [24], 1], ["AN", 2, 0, 5], ["AN", 2, 1, 6]]]], "r": [[2.66716e-06, 2.68206e-06, 2.70715e-06], 0, 0.589459, 1667927448], "v": "v0.6"}
{"i": [["[\"mul\", 1, 1, 1, 672]", "cuda -keys=cuda,gpu -max_num_threads=1024 -model=unknown -thread_warp_size=32", [-1, 16, 64, 49152, 2147483647, 1024, 8, 32], "", 0, []], [[], [["FU", 2, [0, 1, 2, 3]], ["SP", 2, 0, 672, [6], 1], ["AN", 2, 0, 5], ["AN", 2, 1, 6]]]], "r": [[2.58637e-06, 2.58525e-06, 2.58565e-06], 0, 2.64062, 1667927450], "v": "v0.6"}
{"i": [["[\"mul\", 1, 1, 1, 672]", "cuda -keys=cuda,gpu -max_num_threads=1024 -model=unknown -thread_warp_size=32", [-1, 16, 64, 49152, 2147483647, 1024, 8, 32], "", 0, []], [[], [["FU", 2, [0, 1, 2, 3]], ["SP", 2, 0, 672, [4], 1], ["AN", 2, 0, 5], ["AN", 2, 1, 6]]]], "r": [[2.62155e-06, 2.61985e-06, 2.61903e-06], 0, 1.1293, 1667927449], "v": "v0.6"}
{"i": [["[\"mul\", 1, 1, 1, 672]", "cuda -keys=cuda,gpu -max_num_threads=1024 -model=unknown -thread_warp_size=32", [-1, 16, 64, 49152, 2147483647, 1024, 8, 32], "", 0, []], [[], [["FU", 2, [0, 1, 2, 3]], ["SP", 2, 0, 672, [7], 1], ["AN", 2, 0, 5], ["AN", 2, 1, 6]]]], "r": [[2.56728e-06, 2.567e-06, 2.56432e-06], 0, 1.41934, 1667927449], "v": "v0.6"}
{"i": [["[\"mul\", 1, 1, 1, 672]", "cuda -keys=cuda,gpu -max_num_threads=1024 -model=unknown -thread_warp_size=32", [-1, 16, 64, 49152, 2147483647, 1024, 8, 32], "", 0, []], [[], [["FU", 2, [0, 1, 2, 3]], ["SP", 2, 0, 672, [3], 1], ["AN", 2, 0, 5], ["AN", 2, 1, 6]]]], "r": [[2.88891e-06, 2.88721e-06, 2.90252e-06], 0, 1.74733, 1667927449], "v": "v0.6"}
{"i": [["[\"mul\", 1, 1, 1, 672]", "cuda -keys=cuda,gpu -max_num_threads=1024 -model=unknown -thread_warp_size=32", [-1, 16, 64, 49152, 2147483647, 1024, 8, 32], "", 0, []], [[], [["FU", 2, [0, 1, 2, 3]], ["SP", 2, 0, 672, [28], 1], ["AN", 2, 0, 5], ["AN", 2, 1, 6]]]], "r": [[2.59511e-06, 2.60144e-06, 2.62274e-06], 0, 2.24328, 1667927450], "v": "v0.6"}
{"i": [["[\"mul\", 1, 1, 1, 672]", "cuda -keys=cuda,gpu -max_num_threads=1024 -model=unknown -thread_warp_size=32", [-1, 16, 64, 49152, 2147483647, 1024, 8, 32], "", 0, []], [[], [["FU", 2, [0, 1, 2, 3]], ["SP", 2, 0, 672, [32], 1], ["AN", 2, 0, 5], ["AN", 2, 1, 6]]]], "r": [[2.52702e-06, 2.52845e-06, 2.52828e-06], 0, 2.81155, 1667927451], "v": "v0.6"}
{"i": [["[\"mul\", 1, 1, 1, 672]", "cuda -keys=cuda,gpu -max_num_threads=1024 -model=unknown -thread_warp_size=32", [-1, 16, 64, 49152, 2147483647, 1024, 8, 32], "", 0, []], [[], [["FU", 2, [0, 1, 2, 3]], ["SP", 2, 0, 672, [42], 1], ["AN", 2, 0, 5], ["AN", 2, 1, 6]]]], "r": [[2.66576e-06, 2.65964e-06, 2.68651e-06], 0, 3.08662, 1667927451], "v": "v0.6"}
{"i": [["[\"mul\", 1, 1, 1, 672]", "cuda -keys=cuda,gpu -max_num_threads=1024 -model=unknown -thread_warp_size=32", [-1, 16, 64, 49152, 2147483647, 1024, 8, 32], "", 0, []], [[], [["FU", 2, [0, 1, 2, 3]], ["SP", 2, 0, 672, [1], 1], ["AN", 2, 0, 5], ["AN", 2, 1, 6]]]], "r": [[3.08416e-06, 3.08812e-06, 3.09435e-06], 0, 3.33921, 1667927451], "v": "v0.6"}
{"i": [["[\"mul\", 1, 1, 1, 672]", "cuda -keys=cuda,gpu -max_num_threads=1024 -model=unknown -thread_warp_size=32", [-1, 16, 64, 49152, 2147483647, 1024, 8, 32], "", 0, []], [[], [["FU", 2, [0, 1, 2, 3]], ["SP", 2, 0, 672, [21], 1], ["AN", 2, 0, 5], ["AN", 2, 1, 6]]]], "r": [[2.62148e-06, 2.62174e-06, 2.63002e-06], 0, 3.61028, 1667927452], "v": "v0.6"}
{"i": [["[\"mul\", 1, 1, 1, 672]", "cuda -keys=cuda,gpu -max_num_threads=1024 -model=unknown -thread_warp_size=32", [-1, 16, 64, 49152, 2147483647, 1024, 8, 32], "", 0, []], [[], [["FU", 2, [0, 1, 2, 3]], ["SP", 2, 0, 672, [48], 1], ["AN", 2, 0, 5], ["AN", 2, 1, 6]]]], "r": [[2.51264e-06, 2.51119e-06, 2.5123e-06], 0, 4.1032, 1667927452], "v": "v0.6"}
{"i": [["[\"mul\", 1, 1, 1, 672]", "cuda -keys=cuda,gpu -max_num_threads=1024 -model=unknown -thread_warp_size=32", [-1, 16, 64, 49152, 2147483647, 1024, 8, 32], "", 0, []], [[], [["FU", 2, [0, 1, 2, 3]], ["SP", 2, 0, 672, [14], 1], ["AN", 2, 0, 5], ["AN", 2, 1, 6]]]], "r": [[2.48399e-06, 2.48318e-06, 2.48415e-06], 0, 3.75601, 1667927452], "v": "v0.6"}
{"i": [["[\"mul\", 1, 1, 1, 672]", "cuda -keys=cuda,gpu -max_num_threads=1024 -model=unknown -thread_warp_size=32", [-1, 16, 64, 49152, 2147483647, 1024, 8, 32], "", 0, []], [[], [["FU", 2, [0, 1, 2, 3]], ["SP", 2, 0, 672, [56], 1], ["AN", 2, 0, 5], ["AN", 2, 1, 6]]]], "r": [[2.63343e-06, 2.63103e-06, 2.65535e-06], 0, 4.33897, 1667927453], "v": "v0.6"}
{"i": [["[\"mul\", 1, 1, 1, 672]", "cuda -keys=cuda,gpu -max_num_threads=1024 -model=unknown -thread_warp_size=32", [-1, 16, 64, 49152, 2147483647, 1024, 8, 32], "", 0, []], [[], [["FU", 2, [0, 1, 2, 3]], ["SP", 2, 0, 672, [12], 1], ["AN", 2, 0, 5], ["AN", 2, 1, 6]]]], "r": [[2.51042e-06, 2.50527e-06, 2.50728e-06], 0, 4.5879, 1667927453], "v": "v0.6"}
{"i": [["[\"mul\", 1, 1, 1, 672]", "cuda -keys=cuda,gpu -max_num_threads=1024 -model=unknown -thread_warp_size=32", [-1, 16, 64, 49152, 2147483647, 1024, 8, 32], "", 0, []], [[], [["FU", 2, [0, 1, 2, 3]], ["SP", 2, 0, 672, [2], 1], ["AN", 2, 0, 5], ["AN", 2, 1, 6]]]], "r": [[2.93048e-06, 2.93212e-06, 2.93657e-06], 0, 4.86522, 1667927453], "v": "v0.6"}
{"i": [["[\"mul\", 1, 1, 1, 672]", "cuda -keys=cuda,gpu -max_num_threads=1024 -model=unknown -thread_warp_size=32", [-1, 16, 64, 49152, 2147483647, 1024, 8, 32], "", 0, []], [[], [["FU", 2, [0, 1, 2, 3]], ["SP", 2, 0, 672, [28], 1], ["AN", 2, 0, 5], ["AN", 2, 1, 6]]]], "r": [[2.62255e-06, 2.62189e-06, 2.62865e-06], 0, 1.48302, 1667944102], "v": "v0.6"}
{"i": [["[\"mul\", 1, 1, 1, 672]", "cuda -keys=cuda,gpu -max_num_threads=1024 -model=unknown -thread_warp_size=32", [-1, 16, 64, 49152, 2147483647, 1024, 8, 32], "", 0, []], [[], [["FU", 2, [0, 1, 2, 3]], ["SP", 2, 0, 672, [24], 1], ["AN", 2, 0, 5], ["AN", 2, 1, 6]]]], "r": [[2.50188e-06, 2.46336e-06, 2.462e-06], 0, 0.600169, 1667944101], "v": "v0.6"}
{"i": [["[\"mul\", 1, 1, 1, 672]", "cuda -keys=cuda,gpu -max_num_threads=1024 -model=unknown -thread_warp_size=32", [-1, 16, 64, 49152, 2147483647, 1024, 8, 32], "", 0, []], [[], [["FU", 2, [0, 1, 2, 3]], ["SP", 2, 0, 672, [16], 1], ["AN", 2, 0, 5], ["AN", 2, 1, 6]]]], "r": [[2.62511e-06, 2.62262e-06, 2.63783e-06], 0, 2.36575, 1667944103], "v": "v0.6"}
{"i": [["[\"mul\", 1, 1, 1, 672]", "cuda -keys=cuda,gpu -max_num_threads=1024 -model=unknown -thread_warp_size=32", [-1, 16, 64, 49152, 2147483647, 1024, 8, 32], "", 0, []], [[], [["FU", 2, [0, 1, 2, 3]], ["SP", 2, 0, 672, [4], 1], ["AN", 2, 0, 5], ["AN", 2, 1, 6]]]], "r": [[2.69267e-06, 2.69096e-06, 2.6911e-06], 0, 2.71063, 1667944103], "v": "v0.6"}
{"i": [["[\"mul\", 1, 1, 1, 672]", "cuda -keys=cuda,gpu -max_num_threads=1024 -model=unknown -thread_warp_size=32", [-1, 16, 64, 49152, 2147483647, 1024, 8, 32], "", 0, []], [[], [["FU", 2, [0, 1, 2, 3]], ["SP", 2, 0, 672, [56], 1], ["AN", 2, 0, 5], ["AN", 2, 1, 6]]]], "r": [[2.68058e-06, 2.6825e-06, 2.7032e-06], 0, 1.00882, 1667944101], "v": "v0.6"}
{"i": [["[\"mul\", 1, 1, 1, 672]", "cuda -keys=cuda,gpu -max_num_threads=1024 -model=unknown -thread_warp_size=32", [-1, 16, 64, 49152, 2147483647, 1024, 8, 32], "", 0, []], [[], [["FU", 2, [0, 1, 2, 3]], ["SP", 2, 0, 672, [8], 1], ["AN", 2, 0, 5], ["AN", 2, 1, 6]]]], "r": [[2.52813e-06, 2.52414e-06, 2.52673e-06], 0, 1.16949, 1667944102], "v": "v0.6"}
{"i": [["[\"mul\", 1, 1, 1, 672]", "cuda -keys=cuda,gpu -max_num_threads=1024 -model=unknown -thread_warp_size=32", [-1, 16, 64, 49152, 2147483647, 1024, 8, 32], "", 0, []], [[], [["FU", 2, [0, 1, 2, 3]], ["SP", 2, 0, 672, [3], 1], ["AN", 2, 0, 5], ["AN", 2, 1, 6]]]], "r": [[2.86015e-06, 2.86098e-06, 2.87199e-06], 0, 1.79505, 1667944102], "v": "v0.6"}
{"i": [["[\"mul\", 1, 1, 1, 672]", "cuda -keys=cuda,gpu -max_num_threads=1024 -model=unknown -thread_warp_size=32", [-1, 16, 64, 49152, 2147483647, 1024, 8, 32], "", 0, []], [[], [["FU", 2, [0, 1, 2, 3]], ["SP", 2, 0, 672, [21], 1], ["AN", 2, 0, 5], ["AN", 2, 1, 6]]]], "r": [[2.46231e-06, 2.4566e-06, 2.45538e-06], 0, 2.10425, 1667944103], "v": "v0.6"}
{"i": [["[\"mul\", 1, 1, 1, 672]", "cuda -keys=cuda,gpu -max_num_threads=1024 -model=unknown -thread_warp_size=32", [-1, 16, 64, 49152, 2147483647, 1024, 8, 32], "", 0, []], [[], [["FU", 2, [0, 1, 2, 3]], ["SP", 2, 0, 672, [7], 1], ["AN", 2, 0, 5], ["AN", 2, 1, 6]]]], "r": [[2.47682e-06, 2.47289e-06, 2.4711e-06], 0, 2.87591, 1667944103], "v": "v0.6"}
{"i": [["[\"mul\", 1, 1, 1, 672]", "cuda -keys=cuda,gpu -max_num_threads=1024 -model=unknown -thread_warp_size=32", [-1, 16, 64, 49152, 2147483647, 1024, 8, 32], "", 0, []], [[], [["FU", 2, [0, 1, 2, 3]], ["SP", 2, 0, 672, [12], 1], ["AN", 2, 0, 5], ["AN", 2, 1, 6]]]], "r": [[2.48528e-06, 2.4814e-06, 2.48181e-06], 0, 3.62601, 1667944104], "v": "v0.6"}
{"i": [["[\"mul\", 1, 1, 1, 672]", "cuda -keys=cuda,gpu -max_num_threads=1024 -model=unknown -thread_warp_size=32", [-1, 16, 64, 49152, 2147483647, 1024, 8, 32], "", 0, []], [[], [["FU", 2, [0, 1, 2, 3]], ["SP", 2, 0, 672, [6], 1], ["AN", 2, 0, 5], ["AN", 2, 1, 6]]]], "r": [[2.56872e-06, 2.56924e-06, 2.56674e-06], 0, 3.05117, 1667944104], "v": "v0.6"}
{"i": [["[\"mul\", 1, 1, 1, 672]", "cuda -keys=cuda,gpu -max_num_threads=1024 -model=unknown -thread_warp_size=32", [-1, 16, 64, 49152, 2147483647, 1024, 8, 32], "", 0, []], [[], [["FU", 2, [0, 1, 2, 3]], ["SP", 2, 0, 672, [1], 1], ["AN", 2, 0, 5], ["AN", 2, 1, 6]]]], "r": [[3.18312e-06, 3.18269e-06, 3.18827e-06], 0, 3.34807, 1667944104], "v": "v0.6"}
{"i": [["[\"mul\", 1, 1, 1, 672]", "cuda -keys=cuda,gpu -max_num_threads=1024 -model=unknown -thread_warp_size=32", [-1, 16, 64, 49152, 2147483647, 1024, 8, 32], "", 0, []], [[], [["FU", 2, [0, 1, 2, 3]], ["SP", 2, 0, 672, [32], 1], ["AN", 2, 0, 5], ["AN", 2, 1, 6]]]], "r": [[2.5263e-06, 2.5243e-06, 2.52747e-06], 0, 3.88723, 1667944105], "v": "v0.6"}
{"i": [["[\"mul\", 1, 1, 1, 672]", "cuda -keys=cuda,gpu -max_num_threads=1024 -model=unknown -thread_warp_size=32", [-1, 16, 64, 49152, 2147483647, 1024, 8, 32], "", 0, []], [[], [["FU", 2, [0, 1, 2, 3]], ["SP", 2, 0, 672, [42], 1], ["AN", 2, 0, 5], ["AN", 2, 1, 6]]]], "r": [[2.48914e-06, 2.488e-06, 2.48964e-06], 0, 4.18603, 1667944105], "v": "v0.6"}
{"i": [["[\"mul\", 1, 1, 1, 672]", "cuda -keys=cuda,gpu -max_num_threads=1024 -model=unknown -thread_warp_size=32", [-1, 16, 64, 49152, 2147483647, 1024, 8, 32], "", 0, []], [[], [["FU", 2, [0, 1, 2, 3]], ["SP", 2, 0, 672, [2], 1], ["AN", 2, 0, 5], ["AN", 2, 1, 6]]]], "r": [[2.83161e-06, 2.83373e-06, 2.83318e-06], 0, 4.43964, 1667944105], "v": "v0.6"}
{"i": [["[\"mul\", 1, 1, 1, 672]", "cuda -keys=cuda,gpu -max_num_threads=1024 -model=unknown -thread_warp_size=32", [-1, 16, 64, 49152, 2147483647, 1024, 8, 32], "", 0, []], [[], [["FU", 2, [0, 1, 2, 3]], ["SP", 2, 0, 672, [48], 1], ["AN", 2, 0, 5], ["AN", 2, 1, 6]]]], "r": [[2.50751e-06, 2.50774e-06, 2.51324e-06], 0, 4.69258, 1667944106], "v": "v0.6"}
{"i": [["[\"mul\", 1, 1, 1, 672]", "cuda -keys=cuda,gpu -max_num_threads=1024 -model=unknown -thread_warp_size=32", [-1, 16, 64, 49152, 2147483647, 1024, 8, 32], "", 0, []], [[], [["FU", 2, [0, 1, 2, 3]], ["SP", 2, 0, 672, [14], 1], ["AN", 2, 0, 5], ["AN", 2, 1, 6]]]], "r": [[2.59243e-06, 2.59743e-06, 2.62142e-06], 0, 4.99011, 1667944106], "v": "v0.6"}
{"i": [["[\"mul\", 1, 1, 1, 672]", "cuda -keys=cuda,gpu -max_num_threads=1024 -model=unknown -thread_warp_size=32", [-1, 16, 64, 49152, 2147483647, 1024, 8, 32], "", 0, []], [[], [["FU", 2, [0, 1, 2, 3]], ["SP", 2, 0, 672, [6], 1], ["AN", 2, 0, 5], ["AN", 2, 1, 6]]]], "r": [[2.53008e-06, 2.52384e-06, 2.5236e-06], 0, 1.84201, 1667944649], "v": "v0.6"}
{"i": [["[\"mul\", 1, 1, 1, 672]", "cuda -keys=cuda,gpu -max_num_threads=1024 -model=unknown -thread_warp_size=32", [-1, 16, 64, 49152, 2147483647, 1024, 8, 32], "", 0, []], [[], [["FU", 2, [0, 1, 2, 3]], ["SP", 2, 0, 672, [12], 1], ["AN", 2, 0, 5], ["AN", 2, 1, 6]]]], "r": [[2.47761e-06, 2.46651e-06, 2.47095e-06], 0, 1.06821, 1667944648], "v": "v0.6"}
{"i": [["[\"mul\", 1, 1, 1, 672]", "cuda -keys=cuda,gpu -max_num_threads=1024 -model=unknown -thread_warp_size=32", [-1, 16, 64, 49152, 2147483647, 1024, 8, 32], "", 0, []], [[], [["FU", 2, [0, 1, 2, 3]], ["SP", 2, 0, 672, [14], 1], ["AN", 2, 0, 5], ["AN", 2, 1, 6]]]], "r": [[2.47427e-06, 2.46356e-06, 2.46583e-06], 0, 1.54304, 1667944649], "v": "v0.6"}
{"i": [["[\"mul\", 1, 1, 1, 672]", "cuda -keys=cuda,gpu -max_num_threads=1024 -model=unknown -thread_warp_size=32", [-1, 16, 64, 49152, 2147483647, 1024, 8, 32], "", 0, []], [[], [["FU", 2, [0, 1, 2, 3]], ["SP", 2, 0, 672, [4], 1], ["AN", 2, 0, 5], ["AN", 2, 1, 6]]]], "r": [[2.62774e-06, 2.6347e-06, 2.63387e-06], 0, 0.697543, 1667944648], "v": "v0.6"}
{"i": [["[\"mul\", 1, 1, 1, 672]", "cuda -keys=cuda,gpu -max_num_threads=1024 -model=unknown -thread_warp_size=32", [-1, 16, 64, 49152, 2147483647, 1024, 8, 32], "", 0, []], [[], [["FU", 2, [0, 1, 2, 3]], ["SP", 2, 0, 672, [1], 1], ["AN", 2, 0, 5], ["AN", 2, 1, 6]]]], "r": [[3.07078e-06, 3.07279e-06, 3.07255e-06], 0, 1.34958, 1667944648], "v": "v0.6"}
{"i": [["[\"mul\", 1, 1, 1, 672]", "cuda -keys=cuda,gpu -max_num_threads=1024 -model=unknown -thread_warp_size=32", [-1, 16, 64, 49152, 2147483647, 1024, 8, 32], "", 0, []], [[], [["FU", 2, [0, 1, 2, 3]], ["SP", 2, 0, 672, [2], 1], ["AN", 2, 0, 5], ["AN", 2, 1, 6]]]], "r": [[2.95393e-06, 2.95097e-06, 2.96181e-06], 0, 2.48778, 1667944650], "v": "v0.6"}
{"i": [["[\"mul\", 1, 1, 1, 672]", "cuda -keys=cuda,gpu -max_num_threads=1024 -model=unknown -thread_warp_size=32", [-1, 16, 64, 49152, 2147483647, 1024, 8, 32], "", 0, []], [[], [["FU", 2, [0, 1, 2, 3]], ["SP", 2, 0, 672, [21], 1], ["AN", 2, 0, 5], ["AN", 2, 1, 6]]]], "r": [[2.6215e-06, 2.62493e-06, 2.63882e-06], 0, 2.31962, 1667944650], "v": "v0.6"}
{"i": [["[\"mul\", 1, 1, 1, 672]", "cuda -keys=cuda,gpu -max_num_threads=1024 -model=unknown -thread_warp_size=32", [-1, 16, 64, 49152, 2147483647, 1024, 8, 32], "", 0, []], [[], [["FU", 2, [0, 1, 2, 3]], ["SP", 2, 0, 672, [16], 1], ["AN", 2, 0, 5], ["AN", 2, 1, 6]]]], "r": [[2.70228e-06, 2.69956e-06, 2.72455e-06], 0, 2.05736, 1667944649], "v": "v0.6"}
{"i": [["[\"mul\", 1, 1, 1, 672]", "cuda -keys=cuda,gpu -max_num_threads=1024 -model=unknown -thread_warp_size=32", [-1, 16, 64, 49152, 2147483647, 1024, 8, 32], "", 0, []], [[], [["FU", 2, [0, 1, 2, 3]], ["SP", 2, 0, 672, [28], 1], ["AN", 2, 0, 5], ["AN", 2, 1, 6]]]], "r": [[2.6652e-06, 2.66547e-06, 2.68139e-06], 0, 2.72033, 1667944650], "v": "v0.6"}
{"i": [["[\"mul\", 1, 1, 1, 672]", "cuda -keys=cuda,gpu -max_num_threads=1024 -model=unknown -thread_warp_size=32", [-1, 16, 64, 49152, 2147483647, 1024, 8, 32], "", 0, []], [[], [["FU", 2, [0, 1, 2, 3]], ["SP", 2, 0, 672, [24], 1], ["AN", 2, 0, 5], ["AN", 2, 1, 6]]]], "r": [[2.663e-06, 2.65952e-06, 2.67587e-06], 0, 3.0136, 1667944651], "v": "v0.6"}
{"i": [["[\"mul\", 1, 1, 1, 672]", "cuda -keys=cuda,gpu -max_num_threads=1024 -model=unknown -thread_warp_size=32", [-1, 16, 64, 49152, 2147483647, 1024, 8, 32], "", 0, []], [[], [["FU", 2, [0, 1, 2, 3]], ["SP", 2, 0, 672, [8], 1], ["AN", 2, 0, 5], ["AN", 2, 1, 6]]]], "r": [[2.48494e-06, 2.47532e-06, 2.48007e-06], 0, 3.62922, 1667944651], "v": "v0.6"}
{"i": [["[\"mul\", 1, 1, 1, 672]", "cuda -keys=cuda,gpu -max_num_threads=1024 -model=unknown -thread_warp_size=32", [-1, 16, 64, 49152, 2147483647, 1024, 8, 32], "", 0, []], [[], [["FU", 2, [0, 1, 2, 3]], ["SP", 2, 0, 672, [3], 1], ["AN", 2, 0, 5], ["AN", 2, 1, 6]]]], "r": [[2.88598e-06, 2.88858e-06, 2.89109e-06], 0, 3.33075, 1667944651], "v": "v0.6"}
{"i": [["[\"mul\", 1, 1, 1, 672]", "cuda -keys=cuda,gpu -max_num_threads=1024 -model=unknown -thread_warp_size=32", [-1, 16, 64, 49152, 2147483647, 1024, 8, 32], "", 0, []], [[], [["FU", 2, [0, 1, 2, 3]], ["SP", 2, 0, 672, [48], 1], ["AN", 2, 0, 5], ["AN", 2, 1, 6]]]], "r": [[2.48333e-06, 2.4851e-06, 2.48484e-06], 0, 4.11524, 1667944652], "v": "v0.6"}
{"i": [["[\"mul\", 1, 1, 1, 672]", "cuda -keys=cuda,gpu -max_num_threads=1024 -model=unknown -thread_warp_size=32", [-1, 16, 64, 49152, 2147483647, 1024, 8, 32], "", 0, []], [[], [["FU", 2, [0, 1, 2, 3]], ["SP", 2, 0, 672, [32], 1], ["AN", 2, 0, 5], ["AN", 2, 1, 6]]]], "r": [[2.66729e-06, 2.66469e-06, 2.68524e-06], 0, 3.87165, 1667944652], "v": "v0.6"}
{"i": [["[\"mul\", 1, 1, 1, 672]", "cuda -keys=cuda,gpu -max_num_threads=1024 -model=unknown -thread_warp_size=32", [-1, 16, 64, 49152, 2147483647, 1024, 8, 32], "", 0, []], [[], [["FU", 2, [0, 1, 2, 3]], ["SP", 2, 0, 672, [7], 1], ["AN", 2, 0, 5], ["AN", 2, 1, 6]]]], "r": [[2.67938e-06, 2.68168e-06, 2.69689e-06], 0, 4.38228, 1667944652], "v": "v0.6"}
{"i": [["[\"mul\", 1, 1, 1, 672]", "cuda -keys=cuda,gpu -max_num_threads=1024 -model=unknown -thread_warp_size=32", [-1, 16, 64, 49152, 2147483647, 1024, 8, 32], "", 0, []], [[], [["FU", 2, [0, 1, 2, 3]], ["SP", 2, 0, 672, [42], 1], ["AN", 2, 0, 5], ["AN", 2, 1, 6]]]], "r": [[2.66215e-06, 2.66325e-06, 2.67859e-06], 0, 4.62114, 1667944653], "v": "v0.6"}
{"i": [["[\"mul\", 1, 1, 1, 672]", "cuda -keys=cuda,gpu -max_num_threads=1024 -model=unknown -thread_warp_size=32", [-1, 16, 64, 49152, 2147483647, 1024, 8, 32], "", 0, []], [[], [["FU", 2, [0, 1, 2, 3]], ["SP", 2, 0, 672, [56], 1], ["AN", 2, 0, 5], ["AN", 2, 1, 6]]]], "r": [[2.52428e-06, 2.53925e-06, 2.54059e-06], 0, 4.97971, 1667944653], "v": "v0.6"}
{"i": [["[\"mul\", 1, 1, 1, 672]", "cuda -keys=cuda,gpu -max_num_threads=1024 -model=unknown -thread_warp_size=32", [-1, 16, 64, 49152, 2147483647, 1024, 8, 32], "", 0, []], [[], [["FU", 2, [0, 1, 2, 3]], ["SP", 2, 0, 672, [14], 1], ["AN", 2, 0, 5], ["AN", 2, 1, 6]]]], "r": [[2.5234e-06, 2.52637e-06, 2.52993e-06], 0, 1.31637, 1667945182], "v": "v0.6"}
{"i": [["[\"mul\", 1, 1, 1, 672]", "cuda -keys=cuda,gpu -max_num_threads=1024 -model=unknown -thread_warp_size=32", [-1, 16, 64, 49152, 2147483647, 1024, 8, 32], "", 0, []], [[], [["FU", 2, [0, 1, 2, 3]], ["SP", 2, 0, 672, [16], 1], ["AN", 2, 0, 5], ["AN", 2, 1, 6]]]], "r": [[2.59321e-06, 2.59252e-06, 2.62504e-06], 0, 2.02542, 1667945183], "v": "v0.6"}
{"i": [["[\"mul\", 1, 1, 1, 672]", "cuda -keys=cuda,gpu -max_num_threads=1024 -model=unknown -thread_warp_size=32", [-1, 16, 64, 49152, 2147483647, 1024, 8, 32], "", 0, []], [[], [["FU", 2, [0, 1, 2, 3]], ["SP", 2, 0, 672, [8], 1], ["AN", 2, 0, 5], ["AN", 2, 1, 6]]]], "r": [[2.5474e-06, 2.54577e-06, 2.54623e-06], 0, 2.55552, 1667945184], "v": "v0.6"}
{"i": [["[\"mul\", 1, 1, 1, 672]", "cuda -keys=cuda,gpu -max_num_threads=1024 -model=unknown -thread_warp_size=32", [-1, 16, 64, 49152, 2147483647, 1024, 8, 32], "", 0, []], [[], [["FU", 2, [0, 1, 2, 3]], ["SP", 2, 0, 672, [3], 1], ["AN", 2, 0, 5], ["AN", 2, 1, 6]]]], "r": [[2.85299e-06, 2.85421e-06, 2.86352e-06], 0, 3.07938, 1667945184], "v": "v0.6"}
{"i": [["[\"mul\", 1, 1, 1, 672]", "cuda -keys=cuda,gpu -max_num_threads=1024 -model=unknown -thread_warp_size=32", [-1, 16, 64, 49152, 2147483647, 1024, 8, 32], "", 0, []], [[], [["FU", 2, [0, 1, 2, 3]], ["SP", 2, 0, 672, [2], 1], ["AN", 2, 0, 5], ["AN", 2, 1, 6]]]], "r": [[2.96157e-06, 2.9622e-06, 2.96993e-06], 0, 0.561301, 1667945181], "v": "v0.6"}
{"i": [["[\"mul\", 1, 1, 1, 672]", "cuda -keys=cuda,gpu -max_num_threads=1024 -model=unknown -thread_warp_size=32", [-1, 16, 64, 49152, 2147483647, 1024, 8, 32], "", 0, []], [[], [["FU", 2, [0, 1, 2, 3]], ["SP", 2, 0, 672, [6], 1], ["AN", 2, 0, 5], ["AN", 2, 1, 6]]]], "r": [[2.53196e-06, 2.53031e-06, 2.53193e-06], 0, 1.05555, 1667945182], "v": "v0.6"}
{"i": [["[\"mul\", 1, 1, 1, 672]", "cuda -keys=cuda,gpu -max_num_threads=1024 -model=unknown -thread_warp_size=32", [-1, 16, 64, 49152, 2147483647, 1024, 8, 32], "", 0, []], [[], [["FU", 2, [0, 1, 2, 3]], ["SP", 2, 0, 672, [42], 1], ["AN", 2, 0, 5], ["AN", 2, 1, 6]]]], "r": [[2.66004e-06, 2.66173e-06, 2.68282e-06], 0, 0.742688, 1667945182], "v": "v0.6"}
{"i": [["[\"mul\", 1, 1, 1, 672]", "cuda -keys=cuda,gpu -max_num_threads=1024 -model=unknown -thread_warp_size=32", [-1, 16, 64, 49152, 2147483647, 1024, 8, 32], "", 0, []], [[], [["FU", 2, [0, 1, 2, 3]], ["SP", 2, 0, 672, [24], 1], ["AN", 2, 0, 5], ["AN", 2, 1, 6]]]], "r": [[2.48161e-06, 2.47913e-06, 2.48072e-06], 0, 1.66713, 1667945183], "v": "v0.6"}
{"i": [["[\"mul\", 1, 1, 1, 672]", "cuda -keys=cuda,gpu -max_num_threads=1024 -model=unknown -thread_warp_size=32", [-1, 16, 64, 49152, 2147483647, 1024, 8, 32], "", 0, []], [[], [["FU", 2, [0, 1, 2, 3]], ["SP", 2, 0, 672, [1], 1], ["AN", 2, 0, 5], ["AN", 2, 1, 6]]]], "r": [[3.04457e-06, 3.04958e-06, 3.04982e-06], 0, 2.25793, 1667945183], "v": "v0.6"}
{"i": [["[\"mul\", 1, 1, 1, 672]", "cuda -keys=cuda,gpu -max_num_threads=1024 -model=unknown -thread_warp_size=32", [-1, 16, 64, 49152, 2147483647, 1024, 8, 32], "", 0, []], [[], [["FU", 2, [0, 1, 2, 3]], ["SP", 2, 0, 672, [4], 1], ["AN", 2, 0, 5], ["AN", 2, 1, 6]]]], "r": [[2.62303e-06, 2.62189e-06, 2.62072e-06], 0, 2.82138, 1667945184], "v": "v0.6"}
{"i": [["[\"mul\", 1, 1, 1, 672]", "cuda -keys=cuda,gpu -max_num_threads=1024 -model=unknown -thread_warp_size=32", [-1, 16, 64, 49152, 2147483647, 1024, 8, 32], "", 0, []], [[], [["FU", 2, [0, 1, 2, 3]], ["SP", 2, 0, 672, [7], 1], ["AN", 2, 0, 5], ["AN", 2, 1, 6]]]], "r": [[2.51665e-06, 2.51295e-06, 2.51499e-06], 0, 3.68109, 1667945185], "v": "v0.6"}
{"i": [["[\"mul\", 1, 1, 1, 672]", "cuda -keys=cuda,gpu -max_num_threads=1024 -model=unknown -thread_warp_size=32", [-1, 16, 64, 49152, 2147483647, 1024, 8, 32], "", 0, []], [[], [["FU", 2, [0, 1, 2, 3]], ["SP", 2, 0, 672, [48], 1], ["AN", 2, 0, 5], ["AN", 2, 1, 6]]]], "r": [[2.50328e-06, 2.5038e-06, 2.50502e-06], 0, 3.36669, 1667945185], "v": "v0.6"}
{"i": [["[\"mul\", 1, 1, 1, 672]", "cuda -keys=cuda,gpu -max_num_threads=1024 -model=unknown -thread_warp_size=32", [-1, 16, 64, 49152, 2147483647, 1024, 8, 32], "", 0, []], [[], [["FU", 2, [0, 1, 2, 3]], ["SP", 2, 0, 672, [28], 1], ["AN", 2, 0, 5], ["AN", 2, 1, 6]]]], "r": [[2.48866e-06, 2.48328e-06, 2.4841e-06], 0, 4.2603, 1667945186], "v": "v0.6"}
{"i": [["[\"mul\", 1, 1, 1, 672]", "cuda -keys=cuda,gpu -max_num_threads=1024 -model=unknown -thread_warp_size=32", [-1, 16, 64, 49152, 2147483647, 1024, 8, 32], "", 0, []], [[], [["FU", 2, [0, 1, 2, 3]], ["SP", 2, 0, 672, [32], 1], ["AN", 2, 0, 5], ["AN", 2, 1, 6]]]], "r": [[2.69291e-06, 2.69293e-06, 2.70713e-06], 0, 3.94726, 1667945185], "v": "v0.6"}
{"i": [["[\"mul\", 1, 1, 1, 672]", "cuda -keys=cuda,gpu -max_num_threads=1024 -model=unknown -thread_warp_size=32", [-1, 16, 64, 49152, 2147483647, 1024, 8, 32], "", 0, []], [[], [["FU", 2, [0, 1, 2, 3]], ["SP", 2, 0, 672, [21], 1], ["AN", 2, 0, 5], ["AN", 2, 1, 6]]]], "r": [[2.48698e-06, 2.48776e-06, 2.48599e-06], 0, 4.48644, 1667945186], "v": "v0.6"}
{"i": [["[\"mul\", 1, 1, 1, 672]", "cuda -keys=cuda,gpu -max_num_threads=1024 -model=unknown -thread_warp_size=32", [-1, 16, 64, 49152, 2147483647, 1024, 8, 32], "", 0, []], [[], [["FU", 2, [0, 1, 2, 3]], ["SP", 2, 0, 672, [12], 1], ["AN", 2, 0, 5], ["AN", 2, 1, 6]]]], "r": [[2.5158e-06, 2.51696e-06, 2.51822e-06], 0, 4.74162, 1667945186], "v": "v0.6"}
{"i": [["[\"mul\", 1, 1, 1, 672]", "cuda -keys=cuda,gpu -max_num_threads=1024 -model=unknown -thread_warp_size=32", [-1, 16, 64, 49152, 2147483647, 1024, 8, 32], "", 0, []], [[], [["FU", 2, [0, 1, 2, 3]], ["SP", 2, 0, 672, [56], 1], ["AN", 2, 0, 5], ["AN", 2, 1, 6]]]], "r": [[2.57649e-06, 2.57325e-06, 2.61545e-06], 0, 5.05557, 1667945187], "v": "v0.6"}
