python/models/efficientnet/VertiFusionEfficientNet_kernel_configs/efficient_mul_1_1_1_480.log
{"i": [["[\"mul\", 1, 1, 1, 480]", "cuda -keys=cuda,gpu -max_num_threads=1024 -model=unknown -thread_warp_size=32", [-1, 16, 64, 49152, 2147483647, 1024, 8, 32], "", 0, []], [[], [["FU", 2, [0, 1, 2, 3]], ["SP", 2, 0, 480, [10], 1], ["AN", 2, 0, 5], ["AN", 2, 1, 6]]]], "r": [[2.58424e-06, 2.58784e-06, 2.59772e-06], 0, 1.999, 1667926892], "v": "v0.6"}
{"i": [["[\"mul\", 1, 1, 1, 480]", "cuda -keys=cuda,gpu -max_num_threads=1024 -model=unknown -thread_warp_size=32", [-1, 16, 64, 49152, 2147483647, 1024, 8, 32], "", 0, []], [[], [["FU", 2, [0, 1, 2, 3]], ["SP", 2, 0, 480, [60], 1], ["AN", 2, 0, 5], ["AN", 2, 1, 6]]]], "r": [[2.55733e-06, 2.55805e-06, 2.58128e-06], 0, 0.559699, 1667926890], "v": "v0.6"}
{"i": [["[\"mul\", 1, 1, 1, 480]", "cuda -keys=cuda,gpu -max_num_threads=1024 -model=unknown -thread_warp_size=32", [-1, 16, 64, 49152, 2147483647, 1024, 8, 32], "", 0, []], [[], [["FU", 2, [0, 1, 2, 3]], ["SP", 2, 0, 480, [15], 1], ["AN", 2, 0, 5], ["AN", 2, 1, 6]]]], "r": [[2.66322e-06, 2.66747e-06, 2.69067e-06], 0, 0.94899, 1667926891], "v": "v0.6"}
{"i": [["[\"mul\", 1, 1, 1, 480]", "cuda -keys=cuda,gpu -max_num_threads=1024 -model=unknown -thread_warp_size=32", [-1, 16, 64, 49152, 2147483647, 1024, 8, 32], "", 0, []], [[], [["FU", 2, [0, 1, 2, 3]], ["SP", 2, 0, 480, [3], 1], ["AN", 2, 0, 5], ["AN", 2, 1, 6]]]], "r": [[2.70193e-06, 2.70284e-06, 2.71293e-06], 0, 1.72566, 1667926892], "v": "v0.6"}
{"i": [["[\"mul\", 1, 1, 1, 480]", "cuda -keys=cuda,gpu -max_num_threads=1024 -model=unknown -thread_warp_size=32", [-1, 16, 64, 49152, 2147483647, 1024, 8, 32], "", 0, []], [[], [["FU", 2, [0, 1, 2, 3]], ["SP", 2, 0, 480, [12], 1], ["AN", 2, 0, 5], ["AN", 2, 1, 6]]]], "r": [[2.4689e-06, 2.47067e-06, 2.47041e-06], 0, 1.14434, 1667926891], "v": "v0.6"}
{"i": [["[\"mul\", 1, 1, 1, 480]", "cuda -keys=cuda,gpu -max_num_threads=1024 -model=unknown -thread_warp_size=32", [-1, 16, 64, 49152, 2147483647, 1024, 8, 32], "", 0, []], [[], [["FU", 2, [0, 1, 2, 3]], ["SP", 2, 0, 480, [4], 1], ["AN", 2, 0, 5], ["AN", 2, 1, 6]]]], "r": [[2.67277e-06, 2.6617e-06, 2.67922e-06], 0, 1.43131, 1667926891], "v": "v0.6"}
{"i": [["[\"mul\", 1, 1, 1, 480]", "cuda -keys=cuda,gpu -max_num_threads=1024 -model=unknown -thread_warp_size=32", [-1, 16, 64, 49152, 2147483647, 1024, 8, 32], "", 0, []], [[], [["FU", 2, [0, 1, 2, 3]], ["SP", 2, 0, 480, [6], 1], ["AN", 2, 0, 5], ["AN", 2, 1, 6]]]], "r": [[2.58697e-06, 2.58783e-06, 2.58822e-06], 0, 2.54097, 1667926893], "v": "v0.6"}
{"i": [["[\"mul\", 1, 1, 1, 480]", "cuda -keys=cuda,gpu -max_num_threads=1024 -model=unknown -thread_warp_size=32", [-1, 16, 64, 49152, 2147483647, 1024, 8, 32], "", 0, []], [[], [["FU", 2, [0, 1, 2, 3]], ["SP", 2, 0, 480, [20], 1], ["AN", 2, 0, 5], ["AN", 2, 1, 6]]]], "r": [[2.58252e-06, 2.58536e-06, 2.59842e-06], 0, 3.0098, 1667926893], "v": "v0.6"}
{"i": [["[\"mul\", 1, 1, 1, 480]", "cuda -keys=cuda,gpu -max_num_threads=1024 -model=unknown -thread_warp_size=32", [-1, 16, 64, 49152, 2147483647, 1024, 8, 32], "", 0, []], [[], [["FU", 2, [0, 1, 2, 3]], ["SP", 2, 0, 480, [48], 1], ["AN", 2, 0, 5], ["AN", 2, 1, 6]]]], "r": [[2.60332e-06, 2.6045e-06, 2.63025e-06], 0, 2.1975, 1667926892], "v": "v0.6"}
{"i": [["[\"mul\", 1, 1, 1, 480]", "cuda -keys=cuda,gpu -max_num_threads=1024 -model=unknown -thread_warp_size=32", [-1, 16, 64, 49152, 2147483647, 1024, 8, 32], "", 0, []], [[], [["FU", 2, [0, 1, 2, 3]], ["SP", 2, 0, 480, [8], 1], ["AN", 2, 0, 5], ["AN", 2, 1, 6]]]], "r": [[2.65426e-06, 2.65083e-06, 2.67044e-06], 0, 2.71255, 1667926893], "v": "v0.6"}
{"i": [["[\"mul\", 1, 1, 1, 480]", "cuda -keys=cuda,gpu -max_num_threads=1024 -model=unknown -thread_warp_size=32", [-1, 16, 64, 49152, 2147483647, 1024, 8, 32], "", 0, []], [[], [["FU", 2, [0, 1, 2, 3]], ["SP", 2, 0, 480, [16], 1], ["AN", 2, 0, 5], ["AN", 2, 1, 6]]]], "r": [[2.65842e-06, 2.66236e-06, 2.68783e-06], 0, 3.29449, 1667926893], "v": "v0.6"}
{"i": [["[\"mul\", 1, 1, 1, 480]", "cuda -keys=cuda,gpu -max_num_threads=1024 -model=unknown -thread_warp_size=32", [-1, 16, 64, 49152, 2147483647, 1024, 8, 32], "", 0, []], [[], [["FU", 2, [0, 1, 2, 3]], ["SP", 2, 0, 480, [24], 1], ["AN", 2, 0, 5], ["AN", 2, 1, 6]]]], "r": [[2.66328e-06, 2.66915e-06, 2.68979e-06], 0, 3.53362, 1667926894], "v": "v0.6"}
{"i": [["[\"mul\", 1, 1, 1, 480]", "cuda -keys=cuda,gpu -max_num_threads=1024 -model=unknown -thread_warp_size=32", [-1, 16, 64, 49152, 2147483647, 1024, 8, 32], "", 0, []], [[], [["FU", 2, [0, 1, 2, 3]], ["SP", 2, 0, 480, [5], 1], ["AN", 2, 0, 5], ["AN", 2, 1, 6]]]], "r": [[2.46838e-06, 2.46371e-06, 2.46368e-06], 0, 3.7941, 1667926894], "v": "v0.6"}
{"i": [["[\"mul\", 1, 1, 1, 480]", "cuda -keys=cuda,gpu -max_num_threads=1024 -model=unknown -thread_warp_size=32", [-1, 16, 64, 49152, 2147483647, 1024, 8, 32], "", 0, []], [[], [["FU", 2, [0, 1, 2, 3]], ["SP", 2, 0, 480, [30], 1], ["AN", 2, 0, 5], ["AN", 2, 1, 6]]]], "r": [[2.46428e-06, 2.46508e-06, 2.46542e-06], 0, 4.09731, 1667926894], "v": "v0.6"}
{"i": [["[\"mul\", 1, 1, 1, 480]", "cuda -keys=cuda,gpu -max_num_threads=1024 -model=unknown -thread_warp_size=32", [-1, 16, 64, 49152, 2147483647, 1024, 8, 32], "", 0, []], [[], [["FU", 2, [0, 1, 2, 3]], ["SP", 2, 0, 480, [40], 1], ["AN", 2, 0, 5], ["AN", 2, 1, 6]]]], "r": [[2.45915e-06, 2.45891e-06, 2.45695e-06], 0, 4.35545, 1667926895], "v": "v0.6"}
{"i": [["[\"mul\", 1, 1, 1, 480]", "cuda -keys=cuda,gpu -max_num_threads=1024 -model=unknown -thread_warp_size=32", [-1, 16, 64, 49152, 2147483647, 1024, 8, 32], "", 0, []], [[], [["FU", 2, [0, 1, 2, 3]], ["SP", 2, 0, 480, [32], 1], ["AN", 2, 0, 5], ["AN", 2, 1, 6]]]], "r": [[2.61013e-06, 2.60971e-06, 2.63657e-06], 0, 4.88165, 1667926895], "v": "v0.6"}
{"i": [["[\"mul\", 1, 1, 1, 480]", "cuda -keys=cuda,gpu -max_num_threads=1024 -model=unknown -thread_warp_size=32", [-1, 16, 64, 49152, 2147483647, 1024, 8, 32], "", 0, []], [[], [["FU", 2, [0, 1, 2, 3]], ["SP", 2, 0, 480, [2], 1], ["AN", 2, 0, 5], ["AN", 2, 1, 6]]]], "r": [[2.72903e-06, 2.73198e-06, 2.73291e-06], 0, 5.14236, 1667926896], "v": "v0.6"}
{"i": [["[\"mul\", 1, 1, 1, 480]", "cuda -keys=cuda,gpu -max_num_threads=1024 -model=unknown -thread_warp_size=32", [-1, 16, 64, 49152, 2147483647, 1024, 8, 32], "", 0, []], [[], [["FU", 2, [0, 1, 2, 3]], ["SP", 2, 0, 480, [1], 1], ["AN", 2, 0, 5], ["AN", 2, 1, 6]]]], "r": [[2.90698e-06, 2.91235e-06, 2.91278e-06], 0, 4.53999, 1667926895], "v": "v0.6"}
{"i": [["[\"mul\", 1, 1, 1, 480]", "cuda -keys=cuda,gpu -max_num_threads=1024 -model=unknown -thread_warp_size=32", [-1, 16, 64, 49152, 2147483647, 1024, 8, 32], "", 0, []], [[], [["FU", 2, [0, 1, 2, 3]], ["SP", 2, 0, 480, [40], 1], ["AN", 2, 0, 5], ["AN", 2, 1, 6]]]], "r": [[2.56699e-06, 2.56395e-06, 2.58411e-06], 0, 0.534169, 1667926993], "v": "v0.6"}
{"i": [["[\"mul\", 1, 1, 1, 480]", "cuda -keys=cuda,gpu -max_num_threads=1024 -model=unknown -thread_warp_size=32", [-1, 16, 64, 49152, 2147483647, 1024, 8, 32], "", 0, []], [[], [["FU", 2, [0, 1, 2, 3]], ["SP", 2, 0, 480, [15], 1], ["AN", 2, 0, 5], ["AN", 2, 1, 6]]]], "r": [[2.49406e-06, 2.49542e-06, 2.49484e-06], 0, 1.07541, 1667926993], "v": "v0.6"}
{"i": [["[\"mul\", 1, 1, 1, 480]", "cuda -keys=cuda,gpu -max_num_threads=1024 -model=unknown -thread_warp_size=32", [-1, 16, 64, 49152, 2147483647, 1024, 8, 32], "", 0, []], [[], [["FU", 2, [0, 1, 2, 3]], ["SP", 2, 0, 480, [48], 1], ["AN", 2, 0, 5], ["AN", 2, 1, 6]]]], "r": [[2.60706e-06, 2.61868e-06, 2.63975e-06], 0, 1.30348, 1667926994], "v": "v0.6"}
{"i": [["[\"mul\", 1, 1, 1, 480]", "cuda -keys=cuda,gpu -max_num_threads=1024 -model=unknown -thread_warp_size=32", [-1, 16, 64, 49152, 2147483647, 1024, 8, 32], "", 0, []], [[], [["FU", 2, [0, 1, 2, 3]], ["SP", 2, 0, 480, [8], 1], ["AN", 2, 0, 5], ["AN", 2, 1, 6]]]], "r": [[2.68357e-06, 2.68436e-06, 2.70779e-06], 0, 2.17149, 1667926995], "v": "v0.6"}
{"i": [["[\"mul\", 1, 1, 1, 480]", "cuda -keys=cuda,gpu -max_num_threads=1024 -model=unknown -thread_warp_size=32", [-1, 16, 64, 49152, 2147483647, 1024, 8, 32], "", 0, []], [[], [["FU", 2, [0, 1, 2, 3]], ["SP", 2, 0, 480, [32], 1], ["AN", 2, 0, 5], ["AN", 2, 1, 6]]]], "r": [[2.51622e-06, 2.5221e-06, 2.55821e-06], 0, 0.83177, 1667926993], "v": "v0.6"}
{"i": [["[\"mul\", 1, 1, 1, 480]", "cuda -keys=cuda,gpu -max_num_threads=1024 -model=unknown -thread_warp_size=32", [-1, 16, 64, 49152, 2147483647, 1024, 8, 32], "", 0, []], [[], [["FU", 2, [0, 1, 2, 3]], ["SP", 2, 0, 480, [60], 1], ["AN", 2, 0, 5], ["AN", 2, 1, 6]]]], "r": [[2.46436e-06, 2.4579e-06, 2.45768e-06], 0, 1.65014, 1667926994], "v": "v0.6"}
{"i": [["[\"mul\", 1, 1, 1, 480]", "cuda -keys=cuda,gpu -max_num_threads=1024 -model=unknown -thread_warp_size=32", [-1, 16, 64, 49152, 2147483647, 1024, 8, 32], "", 0, []], [[], [["FU", 2, [0, 1, 2, 3]], ["SP", 2, 0, 480, [4], 1], ["AN", 2, 0, 5], ["AN", 2, 1, 6]]]], "r": [[2.54245e-06, 2.53883e-06, 2.5363e-06], 0, 1.91496, 1667926994], "v": "v0.6"}
{"i": [["[\"mul\", 1, 1, 1, 480]", "cuda -keys=cuda,gpu -max_num_threads=1024 -model=unknown -thread_warp_size=32", [-1, 16, 64, 49152, 2147483647, 1024, 8, 32], "", 0, []], [[], [["FU", 2, [0, 1, 2, 3]], ["SP", 2, 0, 480, [5], 1], ["AN", 2, 0, 5], ["AN", 2, 1, 6]]]], "r": [[2.52985e-06, 2.53161e-06, 2.53015e-06], 0, 2.48055, 1667926995], "v": "v0.6"}
{"i": [["[\"mul\", 1, 1, 1, 480]", "cuda -keys=cuda,gpu -max_num_threads=1024 -model=unknown -thread_warp_size=32", [-1, 16, 64, 49152, 2147483647, 1024, 8, 32], "", 0, []], [[], [["FU", 2, [0, 1, 2, 3]], ["SP", 2, 0, 480, [6], 1], ["AN", 2, 0, 5], ["AN", 2, 1, 6]]]], "r": [[2.49024e-06, 2.48856e-06, 2.48696e-06], 0, 2.72406, 1667926995], "v": "v0.6"}
{"i": [["[\"mul\", 1, 1, 1, 480]", "cuda -keys=cuda,gpu -max_num_threads=1024 -model=unknown -thread_warp_size=32", [-1, 16, 64, 49152, 2147483647, 1024, 8, 32], "", 0, []], [[], [["FU", 2, [0, 1, 2, 3]], ["SP", 2, 0, 480, [3], 1], ["AN", 2, 0, 5], ["AN", 2, 1, 6]]]], "r": [[2.69352e-06, 2.69515e-06, 2.69455e-06], 0, 2.95468, 1667926996], "v": "v0.6"}
{"i": [["[\"mul\", 1, 1, 1, 480]", "cuda -keys=cuda,gpu -max_num_threads=1024 -model=unknown -thread_warp_size=32", [-1, 16, 64, 49152, 2147483647, 1024, 8, 32], "", 0, []], [[], [["FU", 2, [0, 1, 2, 3]], ["SP", 2, 0, 480, [30], 1], ["AN", 2, 0, 5], ["AN", 2, 1, 6]]]], "r": [[2.44813e-06, 2.4442e-06, 2.44318e-06], 0, 3.51327, 1667926996], "v": "v0.6"}
{"i": [["[\"mul\", 1, 1, 1, 480]", "cuda -keys=cuda,gpu -max_num_threads=1024 -model=unknown -thread_warp_size=32", [-1, 16, 64, 49152, 2147483647, 1024, 8, 32], "", 0, []], [[], [["FU", 2, [0, 1, 2, 3]], ["SP", 2, 0, 480, [1], 1], ["AN", 2, 0, 5], ["AN", 2, 1, 6]]]], "r": [[2.84855e-06, 2.84815e-06, 2.84811e-06], 0, 3.223, 1667926996], "v": "v0.6"}
{"i": [["[\"mul\", 1, 1, 1, 480]", "cuda -keys=cuda,gpu -max_num_threads=1024 -model=unknown -thread_warp_size=32", [-1, 16, 64, 49152, 2147483647, 1024, 8, 32], "", 0, []], [[], [["FU", 2, [0, 1, 2, 3]], ["SP", 2, 0, 480, [16], 1], ["AN", 2, 0, 5], ["AN", 2, 1, 6]]]], "r": [[2.49254e-06, 2.49457e-06, 2.49167e-06], 0, 3.75939, 1667926997], "v": "v0.6"}
{"i": [["[\"mul\", 1, 1, 1, 480]", "cuda -keys=cuda,gpu -max_num_threads=1024 -model=unknown -thread_warp_size=32", [-1, 16, 64, 49152, 2147483647, 1024, 8, 32], "", 0, []], [[], [["FU", 2, [0, 1, 2, 3]], ["SP", 2, 0, 480, [24], 1], ["AN", 2, 0, 5], ["AN", 2, 1, 6]]]], "r": [[2.54356e-06, 2.54079e-06, 2.55712e-06], 0, 4.04279, 1667926997], "v": "v0.6"}
{"i": [["[\"mul\", 1, 1, 1, 480]", "cuda -keys=cuda,gpu -max_num_threads=1024 -model=unknown -thread_warp_size=32", [-1, 16, 64, 49152, 2147483647, 1024, 8, 32], "", 0, []], [[], [["FU", 2, [0, 1, 2, 3]], ["SP", 2, 0, 480, [2], 1], ["AN", 2, 0, 5], ["AN", 2, 1, 6]]]], "r": [[2.68071e-06, 2.68379e-06, 2.68456e-06], 0, 4.31631, 1667926997], "v": "v0.6"}
{"i": [["[\"mul\", 1, 1, 1, 480]", "cuda -keys=cuda,gpu -max_num_threads=1024 -model=unknown -thread_warp_size=32", [-1, 16, 64, 49152, 2147483647, 1024, 8, 32], "", 0, []], [[], [["FU", 2, [0, 1, 2, 3]], ["SP", 2, 0, 480, [10], 1], ["AN", 2, 0, 5], ["AN", 2, 1, 6]]]], "r": [[2.67772e-06, 2.68069e-06, 2.70172e-06], 0, 4.55167, 1667926998], "v": "v0.6"}
{"i": [["[\"mul\", 1, 1, 1, 480]", "cuda -keys=cuda,gpu -max_num_threads=1024 -model=unknown -thread_warp_size=32", [-1, 16, 64, 49152, 2147483647, 1024, 8, 32], "", 0, []], [[], [["FU", 2, [0, 1, 2, 3]], ["SP", 2, 0, 480, [20], 1], ["AN", 2, 0, 5], ["AN", 2, 1, 6]]]], "r": [[2.47391e-06, 2.47602e-06, 2.47209e-06], 0, 4.82585, 1667926998], "v": "v0.6"}
{"i": [["[\"mul\", 1, 1, 1, 480]", "cuda -keys=cuda,gpu -max_num_threads=1024 -model=unknown -thread_warp_size=32", [-1, 16, 64, 49152, 2147483647, 1024, 8, 32], "", 0, []], [[], [["FU", 2, [0, 1, 2, 3]], ["SP", 2, 0, 480, [12], 1], ["AN", 2, 0, 5], ["AN", 2, 1, 6]]]], "r": [[2.66697e-06, 2.66761e-06, 2.68928e-06], 0, 5.07885, 1667926998], "v": "v0.6"}
{"i": [["[\"mul\", 1, 1, 1, 480]", "cuda -keys=cuda,gpu -max_num_threads=1024 -model=unknown -thread_warp_size=32", [-1, 16, 64, 49152, 2147483647, 1024, 8, 32], "", 0, []], [[], [["FU", 2, [0, 1, 2, 3]], ["SP", 2, 0, 480, [8], 1], ["AN", 2, 0, 5], ["AN", 2, 1, 6]]]], "r": [[2.65137e-06, 2.65078e-06, 2.66606e-06], 0, 0.949511, 1667941131], "v": "v0.6"}
{"i": [["[\"mul\", 1, 1, 1, 480]", "cuda -keys=cuda,gpu -max_num_threads=1024 -model=unknown -thread_warp_size=32", [-1, 16, 64, 49152, 2147483647, 1024, 8, 32], "", 0, []], [[], [["FU", 2, [0, 1, 2, 3]], ["SP", 2, 0, 480, [1], 1], ["AN", 2, 0, 5], ["AN", 2, 1, 6]]]], "r": [[2.95072e-06, 2.95243e-06, 2.96582e-06], 0, 1.81549, 1667941132], "v": "v0.6"}
{"i": [["[\"mul\", 1, 1, 1, 480]", "cuda -keys=cuda,gpu -max_num_threads=1024 -model=unknown -thread_warp_size=32", [-1, 16, 64, 49152, 2147483647, 1024, 8, 32], "", 0, []], [[], [["FU", 2, [0, 1, 2, 3]], ["SP", 2, 0, 480, [60], 1], ["AN", 2, 0, 5], ["AN", 2, 1, 6]]]], "r": [[2.46183e-06, 2.45359e-06, 2.45345e-06], 0, 2.72873, 1667941133], "v": "v0.6"}
{"i": [["[\"mul\", 1, 1, 1, 480]", "cuda -keys=cuda,gpu -max_num_threads=1024 -model=unknown -thread_warp_size=32", [-1, 16, 64, 49152, 2147483647, 1024, 8, 32], "", 0, []], [[], [["FU", 2, [0, 1, 2, 3]], ["SP", 2, 0, 480, [32], 1], ["AN", 2, 0, 5], ["AN", 2, 1, 6]]]], "r": [[2.45025e-06, 2.44733e-06, 2.44664e-06], 0, 1.28289, 1667941131], "v": "v0.6"}
{"i": [["[\"mul\", 1, 1, 1, 480]", "cuda -keys=cuda,gpu -max_num_threads=1024 -model=unknown -thread_warp_size=32", [-1, 16, 64, 49152, 2147483647, 1024, 8, 32], "", 0, []], [[], [["FU", 2, [0, 1, 2, 3]], ["SP", 2, 0, 480, [3], 1], ["AN", 2, 0, 5], ["AN", 2, 1, 6]]]], "r": [[2.63635e-06, 2.63279e-06, 2.63227e-06], 0, 0.592869, 1667941130], "v": "v0.6"}
{"i": [["[\"mul\", 1, 1, 1, 480]", "cuda -keys=cuda,gpu -max_num_threads=1024 -model=unknown -thread_warp_size=32", [-1, 16, 64, 49152, 2147483647, 1024, 8, 32], "", 0, []], [[], [["FU", 2, [0, 1, 2, 3]], ["SP", 2, 0, 480, [40], 1], ["AN", 2, 0, 5], ["AN", 2, 1, 6]]]], "r": [[2.5645e-06, 2.56634e-06, 2.58247e-06], 0, 1.49003, 1667941131], "v": "v0.6"}
{"i": [["[\"mul\", 1, 1, 1, 480]", "cuda -keys=cuda,gpu -max_num_threads=1024 -model=unknown -thread_warp_size=32", [-1, 16, 64, 49152, 2147483647, 1024, 8, 32], "", 0, []], [[], [["FU", 2, [0, 1, 2, 3]], ["SP", 2, 0, 480, [10], 1], ["AN", 2, 0, 5], ["AN", 2, 1, 6]]]], "r": [[2.53193e-06, 2.53238e-06, 2.54381e-06], 0, 2.37293, 1667941132], "v": "v0.6"}
{"i": [["[\"mul\", 1, 1, 1, 480]", "cuda -keys=cuda,gpu -max_num_threads=1024 -model=unknown -thread_warp_size=32", [-1, 16, 64, 49152, 2147483647, 1024, 8, 32], "", 0, []], [[], [["FU", 2, [0, 1, 2, 3]], ["SP", 2, 0, 480, [16], 1], ["AN", 2, 0, 5], ["AN", 2, 1, 6]]]], "r": [[2.65336e-06, 2.65203e-06, 2.67188e-06], 0, 2.02454, 1667941132], "v": "v0.6"}
{"i": [["[\"mul\", 1, 1, 1, 480]", "cuda -keys=cuda,gpu -max_num_threads=1024 -model=unknown -thread_warp_size=32", [-1, 16, 64, 49152, 2147483647, 1024, 8, 32], "", 0, []], [[], [["FU", 2, [0, 1, 2, 3]], ["SP", 2, 0, 480, [2], 1], ["AN", 2, 0, 5], ["AN", 2, 1, 6]]]], "r": [[2.93389e-06, 2.92833e-06, 2.92654e-06], 0, 2.94013, 1667941133], "v": "v0.6"}
{"i": [["[\"mul\", 1, 1, 1, 480]", "cuda -keys=cuda,gpu -max_num_threads=1024 -model=unknown -thread_warp_size=32", [-1, 16, 64, 49152, 2147483647, 1024, 8, 32], "", 0, []], [[], [["FU", 2, [0, 1, 2, 3]], ["SP", 2, 0, 480, [24], 1], ["AN", 2, 0, 5], ["AN", 2, 1, 6]]]], "r": [[2.4761e-06, 2.47186e-06, 2.47087e-06], 0, 3.05526, 1667941133], "v": "v0.6"}
{"i": [["[\"mul\", 1, 1, 1, 480]", "cuda -keys=cuda,gpu -max_num_threads=1024 -model=unknown -thread_warp_size=32", [-1, 16, 64, 49152, 2147483647, 1024, 8, 32], "", 0, []], [[], [["FU", 2, [0, 1, 2, 3]], ["SP", 2, 0, 480, [5], 1], ["AN", 2, 0, 5], ["AN", 2, 1, 6]]]], "r": [[2.49155e-06, 2.49007e-06, 2.48902e-06], 0, 3.67115, 1667941134], "v": "v0.6"}
{"i": [["[\"mul\", 1, 1, 1, 480]", "cuda -keys=cuda,gpu -max_num_threads=1024 -model=unknown -thread_warp_size=32", [-1, 16, 64, 49152, 2147483647, 1024, 8, 32], "", 0, []], [[], [["FU", 2, [0, 1, 2, 3]], ["SP", 2, 0, 480, [20], 1], ["AN", 2, 0, 5], ["AN", 2, 1, 6]]]], "r": [[2.48136e-06, 2.48118e-06, 2.4777e-06], 0, 3.38298, 1667941134], "v": "v0.6"}
{"i": [["[\"mul\", 1, 1, 1, 480]", "cuda -keys=cuda,gpu -max_num_threads=1024 -model=unknown -thread_warp_size=32", [-1, 16, 64, 49152, 2147483647, 1024, 8, 32], "", 0, []], [[], [["FU", 2, [0, 1, 2, 3]], ["SP", 2, 0, 480, [6], 1], ["AN", 2, 0, 5], ["AN", 2, 1, 6]]]], "r": [[2.57769e-06, 2.57648e-06, 2.577e-06], 0, 3.90493, 1667941134], "v": "v0.6"}
{"i": [["[\"mul\", 1, 1, 1, 480]", "cuda -keys=cuda,gpu -max_num_threads=1024 -model=unknown -thread_warp_size=32", [-1, 16, 64, 49152, 2147483647, 1024, 8, 32], "", 0, []], [[], [["FU", 2, [0, 1, 2, 3]], ["SP", 2, 0, 480, [48], 1], ["AN", 2, 0, 5], ["AN", 2, 1, 6]]]], "r": [[2.61578e-06, 2.61171e-06, 2.63994e-06], 0, 4.24483, 1667941135], "v": "v0.6"}
{"i": [["[\"mul\", 1, 1, 1, 480]", "cuda -keys=cuda,gpu -max_num_threads=1024 -model=unknown -thread_warp_size=32", [-1, 16, 64, 49152, 2147483647, 1024, 8, 32], "", 0, []], [[], [["FU", 2, [0, 1, 2, 3]], ["SP", 2, 0, 480, [4], 1], ["AN", 2, 0, 5], ["AN", 2, 1, 6]]]], "r": [[2.62121e-06, 2.61797e-06, 2.62025e-06], 0, 4.48609, 1667941135], "v": "v0.6"}
{"i": [["[\"mul\", 1, 1, 1, 480]", "cuda -keys=cuda,gpu -max_num_threads=1024 -model=unknown -thread_warp_size=32", [-1, 16, 64, 49152, 2147483647, 1024, 8, 32], "", 0, []], [[], [["FU", 2, [0, 1, 2, 3]], ["SP", 2, 0, 480, [12], 1], ["AN", 2, 0, 5], ["AN", 2, 1, 6]]]], "r": [[2.47591e-06, 2.46928e-06, 2.47037e-06], 0, 4.73263, 1667941135], "v": "v0.6"}
{"i": [["[\"mul\", 1, 1, 1, 480]", "cuda -keys=cuda,gpu -max_num_threads=1024 -model=unknown -thread_warp_size=32", [-1, 16, 64, 49152, 2147483647, 1024, 8, 32], "", 0, []], [[], [["FU", 2, [0, 1, 2, 3]], ["SP", 2, 0, 480, [30], 1], ["AN", 2, 0, 5], ["AN", 2, 1, 6]]]], "r": [[2.4515e-06, 2.45292e-06, 2.44894e-06], 0, 5.0394, 1667941136], "v": "v0.6"}
{"i": [["[\"mul\", 1, 1, 1, 480]", "cuda -keys=cuda,gpu -max_num_threads=1024 -model=unknown -thread_warp_size=32", [-1, 16, 64, 49152, 2147483647, 1024, 8, 32], "", 0, []], [[], [["FU", 2, [0, 1, 2, 3]], ["SP", 2, 0, 480, [15], 1], ["AN", 2, 0, 5], ["AN", 2, 1, 6]]]], "r": [[2.61592e-06, 2.61707e-06, 2.63378e-06], 0, 5.29482, 1667941136], "v": "v0.6"}
{"i": [["[\"mul\", 1, 1, 1, 480]", "cuda -keys=cuda,gpu -max_num_threads=1024 -model=unknown -thread_warp_size=32", [-1, 16, 64, 49152, 2147483647, 1024, 8, 32], "", 0, []], [[], [["FU", 2, [0, 1, 2, 3]], ["SP", 2, 0, 480, [40], 1], ["AN", 2, 0, 5], ["AN", 2, 1, 6]]]], "r": [[2.59864e-06, 2.59825e-06, 2.62397e-06], 0, 0.972179, 1667941682], "v": "v0.6"}
{"i": [["[\"mul\", 1, 1, 1, 480]", "cuda -keys=cuda,gpu -max_num_threads=1024 -model=unknown -thread_warp_size=32", [-1, 16, 64, 49152, 2147483647, 1024, 8, 32], "", 0, []], [[], [["FU", 2, [0, 1, 2, 3]], ["SP", 2, 0, 480, [48], 1], ["AN", 2, 0, 5], ["AN", 2, 1, 6]]]], "r": [[2.53139e-06, 2.53772e-06, 2.54169e-06], 0, 1.25398, 1667941682], "v": "v0.6"}
{"i": [["[\"mul\", 1, 1, 1, 480]", "cuda -keys=cuda,gpu -max_num_threads=1024 -model=unknown -thread_warp_size=32", [-1, 16, 64, 49152, 2147483647, 1024, 8, 32], "", 0, []], [[], [["FU", 2, [0, 1, 2, 3]], ["SP", 2, 0, 480, [60], 1], ["AN", 2, 0, 5], ["AN", 2, 1, 6]]]], "r": [[2.45916e-06, 2.45543e-06, 2.45509e-06], 0, 1.87044, 1667941683], "v": "v0.6"}
{"i": [["[\"mul\", 1, 1, 1, 480]", "cuda -keys=cuda,gpu -max_num_threads=1024 -model=unknown -thread_warp_size=32", [-1, 16, 64, 49152, 2147483647, 1024, 8, 32], "", 0, []], [[], [["FU", 2, [0, 1, 2, 3]], ["SP", 2, 0, 480, [10], 1], ["AN", 2, 0, 5], ["AN", 2, 1, 6]]]], "r": [[2.67183e-06, 2.67585e-06, 2.70261e-06], 0, 2.32514, 1667941683], "v": "v0.6"}
{"i": [["[\"mul\", 1, 1, 1, 480]", "cuda -keys=cuda,gpu -max_num_threads=1024 -model=unknown -thread_warp_size=32", [-1, 16, 64, 49152, 2147483647, 1024, 8, 32], "", 0, []], [[], [["FU", 2, [0, 1, 2, 3]], ["SP", 2, 0, 480, [16], 1], ["AN", 2, 0, 5], ["AN", 2, 1, 6]]]], "r": [[2.47489e-06, 2.47424e-06, 2.47598e-06], 0, 0.660019, 1667941681], "v": "v0.6"}
{"i": [["[\"mul\", 1, 1, 1, 480]", "cuda -keys=cuda,gpu -max_num_threads=1024 -model=unknown -thread_warp_size=32", [-1, 16, 64, 49152, 2147483647, 1024, 8, 32], "", 0, []], [[], [["FU", 2, [0, 1, 2, 3]], ["SP", 2, 0, 480, [20], 1], ["AN", 2, 0, 5], ["AN", 2, 1, 6]]]], "r": [[2.48525e-06, 2.48095e-06, 2.48213e-06], 0, 1.52547, 1667941682], "v": "v0.6"}
{"i": [["[\"mul\", 1, 1, 1, 480]", "cuda -keys=cuda,gpu -max_num_threads=1024 -model=unknown -thread_warp_size=32", [-1, 16, 64, 49152, 2147483647, 1024, 8, 32], "", 0, []], [[], [["FU", 2, [0, 1, 2, 3]], ["SP", 2, 0, 480, [4], 1], ["AN", 2, 0, 5], ["AN", 2, 1, 6]]]], "r": [[2.52079e-06, 2.51451e-06, 2.51745e-06], 0, 2.09337, 1667941683], "v": "v0.6"}
{"i": [["[\"mul\", 1, 1, 1, 480]", "cuda -keys=cuda,gpu -max_num_threads=1024 -model=unknown -thread_warp_size=32", [-1, 16, 64, 49152, 2147483647, 1024, 8, 32], "", 0, []], [[], [["FU", 2, [0, 1, 2, 3]], ["SP", 2, 0, 480, [5], 1], ["AN", 2, 0, 5], ["AN", 2, 1, 6]]]], "r": [[2.54174e-06, 2.54325e-06, 2.54501e-06], 0, 2.6782, 1667941684], "v": "v0.6"}
{"i": [["[\"mul\", 1, 1, 1, 480]", "cuda -keys=cuda,gpu -max_num_threads=1024 -model=unknown -thread_warp_size=32", [-1, 16, 64, 49152, 2147483647, 1024, 8, 32], "", 0, []], [[], [["FU", 2, [0, 1, 2, 3]], ["SP", 2, 0, 480, [24], 1], ["AN", 2, 0, 5], ["AN", 2, 1, 6]]]], "r": [[2.46918e-06, 2.46343e-06, 2.46364e-06], 0, 2.84528, 1667941684], "v": "v0.6"}
{"i": [["[\"mul\", 1, 1, 1, 480]", "cuda -keys=cuda,gpu -max_num_threads=1024 -model=unknown -thread_warp_size=32", [-1, 16, 64, 49152, 2147483647, 1024, 8, 32], "", 0, []], [[], [["FU", 2, [0, 1, 2, 3]], ["SP", 2, 0, 480, [12], 1], ["AN", 2, 0, 5], ["AN", 2, 1, 6]]]], "r": [[2.65462e-06, 2.65993e-06, 2.68233e-06], 0, 3.40543, 1667941685], "v": "v0.6"}
{"i": [["[\"mul\", 1, 1, 1, 480]", "cuda -keys=cuda,gpu -max_num_threads=1024 -model=unknown -thread_warp_size=32", [-1, 16, 64, 49152, 2147483647, 1024, 8, 32], "", 0, []], [[], [["FU", 2, [0, 1, 2, 3]], ["SP", 2, 0, 480, [30], 1], ["AN", 2, 0, 5], ["AN", 2, 1, 6]]]], "r": [[2.51848e-06, 2.53183e-06, 2.53487e-06], 0, 3.07222, 1667941684], "v": "v0.6"}
{"i": [["[\"mul\", 1, 1, 1, 480]", "cuda -keys=cuda,gpu -max_num_threads=1024 -model=unknown -thread_warp_size=32", [-1, 16, 64, 49152, 2147483647, 1024, 8, 32], "", 0, []], [[], [["FU", 2, [0, 1, 2, 3]], ["SP", 2, 0, 480, [3], 1], ["AN", 2, 0, 5], ["AN", 2, 1, 6]]]], "r": [[2.62744e-06, 2.62672e-06, 2.6283e-06], 0, 3.61942, 1667941685], "v": "v0.6"}
{"i": [["[\"mul\", 1, 1, 1, 480]", "cuda -keys=cuda,gpu -max_num_threads=1024 -model=unknown -thread_warp_size=32", [-1, 16, 64, 49152, 2147483647, 1024, 8, 32], "", 0, []], [[], [["FU", 2, [0, 1, 2, 3]], ["SP", 2, 0, 480, [1], 1], ["AN", 2, 0, 5], ["AN", 2, 1, 6]]]], "r": [[2.92565e-06, 2.92716e-06, 2.92642e-06], 0, 3.88584, 1667941685], "v": "v0.6"}
{"i": [["[\"mul\", 1, 1, 1, 480]", "cuda -keys=cuda,gpu -max_num_threads=1024 -model=unknown -thread_warp_size=32", [-1, 16, 64, 49152, 2147483647, 1024, 8, 32], "", 0, []], [[], [["FU", 2, [0, 1, 2, 3]], ["SP", 2, 0, 480, [2], 1], ["AN", 2, 0, 5], ["AN", 2, 1, 6]]]], "r": [[2.91181e-06, 2.91137e-06, 2.91064e-06], 0, 4.14316, 1667941686], "v": "v0.6"}
{"i": [["[\"mul\", 1, 1, 1, 480]", "cuda -keys=cuda,gpu -max_num_threads=1024 -model=unknown -thread_warp_size=32", [-1, 16, 64, 49152, 2147483647, 1024, 8, 32], "", 0, []], [[], [["FU", 2, [0, 1, 2, 3]], ["SP", 2, 0, 480, [8], 1], ["AN", 2, 0, 5], ["AN", 2, 1, 6]]]], "r": [[2.63721e-06, 2.63644e-06, 2.66112e-06], 0, 4.41804, 1667941686], "v": "v0.6"}
{"i": [["[\"mul\", 1, 1, 1, 480]", "cuda -keys=cuda,gpu -max_num_threads=1024 -model=unknown -thread_warp_size=32", [-1, 16, 64, 49152, 2147483647, 1024, 8, 32], "", 0, []], [[], [["FU", 2, [0, 1, 2, 3]], ["SP", 2, 0, 480, [32], 1], ["AN", 2, 0, 5], ["AN", 2, 1, 6]]]], "r": [[2.50649e-06, 2.49976e-06, 2.52291e-06], 0, 4.64622, 1667941686], "v": "v0.6"}
{"i": [["[\"mul\", 1, 1, 1, 480]", "cuda -keys=cuda,gpu -max_num_threads=1024 -model=unknown -thread_warp_size=32", [-1, 16, 64, 49152, 2147483647, 1024, 8, 32], "", 0, []], [[], [["FU", 2, [0, 1, 2, 3]], ["SP", 2, 0, 480, [15], 1], ["AN", 2, 0, 5], ["AN", 2, 1, 6]]]], "r": [[2.62171e-06, 2.61972e-06, 2.639e-06], 0, 4.98318, 1667941687], "v": "v0.6"}
{"i": [["[\"mul\", 1, 1, 1, 480]", "cuda -keys=cuda,gpu -max_num_threads=1024 -model=unknown -thread_warp_size=32", [-1, 16, 64, 49152, 2147483647, 1024, 8, 32], "", 0, []], [[], [["FU", 2, [0, 1, 2, 3]], ["SP", 2, 0, 480, [6], 1], ["AN", 2, 0, 5], ["AN", 2, 1, 6]]]], "r": [[2.68849e-06, 2.69222e-06, 2.70648e-06], 0, 5.17774, 1667941687], "v": "v0.6"}
{"i": [["[\"mul\", 1, 1, 1, 480]", "cuda -keys=cuda,gpu -max_num_threads=1024 -model=unknown -thread_warp_size=32", [-1, 16, 64, 49152, 2147483647, 1024, 8, 32], "", 0, []], [[], [["FU", 2, [0, 1, 2, 3]], ["SP", 2, 0, 480, [1], 1], ["AN", 2, 0, 5], ["AN", 2, 1, 6]]]], "r": [[3.03264e-06, 3.03301e-06, 3.02847e-06], 0, 0.577643, 1667942249], "v": "v0.6"}
{"i": [["[\"mul\", 1, 1, 1, 480]", "cuda -keys=cuda,gpu -max_num_threads=1024 -model=unknown -thread_warp_size=32", [-1, 16, 64, 49152, 2147483647, 1024, 8, 32], "", 0, []], [[], [["FU", 2, [0, 1, 2, 3]], ["SP", 2, 0, 480, [10], 1], ["AN", 2, 0, 5], ["AN", 2, 1, 6]]]], "r": [[2.4795e-06, 2.47984e-06, 2.47975e-06], 0, 1.19183, 1667942250], "v": "v0.6"}
{"i": [["[\"mul\", 1, 1, 1, 480]", "cuda -keys=cuda,gpu -max_num_threads=1024 -model=unknown -thread_warp_size=32", [-1, 16, 64, 49152, 2147483647, 1024, 8, 32], "", 0, []], [[], [["FU", 2, [0, 1, 2, 3]], ["SP", 2, 0, 480, [24], 1], ["AN", 2, 0, 5], ["AN", 2, 1, 6]]]], "r": [[2.66972e-06, 2.67198e-06, 2.69939e-06], 0, 1.52767, 1667942250], "v": "v0.6"}
{"i": [["[\"mul\", 1, 1, 1, 480]", "cuda -keys=cuda,gpu -max_num_threads=1024 -model=unknown -thread_warp_size=32", [-1, 16, 64, 49152, 2147483647, 1024, 8, 32], "", 0, []], [[], [["FU", 2, [0, 1, 2, 3]], ["SP", 2, 0, 480, [12], 1], ["AN", 2, 0, 5], ["AN", 2, 1, 6]]]], "r": [[2.47875e-06, 2.47619e-06, 2.47517e-06], 0, 1.82421, 1667942251], "v": "v0.6"}
{"i": [["[\"mul\", 1, 1, 1, 480]", "cuda -keys=cuda,gpu -max_num_threads=1024 -model=unknown -thread_warp_size=32", [-1, 16, 64, 49152, 2147483647, 1024, 8, 32], "", 0, []], [[], [["FU", 2, [0, 1, 2, 3]], ["SP", 2, 0, 480, [30], 1], ["AN", 2, 0, 5], ["AN", 2, 1, 6]]]], "r": [[2.45386e-06, 2.44597e-06, 2.44795e-06], 0, 0.995476, 1667942250], "v": "v0.6"}
{"i": [["[\"mul\", 1, 1, 1, 480]", "cuda -keys=cuda,gpu -max_num_threads=1024 -model=unknown -thread_warp_size=32", [-1, 16, 64, 49152, 2147483647, 1024, 8, 32], "", 0, []], [[], [["FU", 2, [0, 1, 2, 3]], ["SP", 2, 0, 480, [8], 1], ["AN", 2, 0, 5], ["AN", 2, 1, 6]]]], "r": [[2.61555e-06, 2.61897e-06, 2.62322e-06], 0, 2.36832, 1667942251], "v": "v0.6"}
{"i": [["[\"mul\", 1, 1, 1, 480]", "cuda -keys=cuda,gpu -max_num_threads=1024 -model=unknown -thread_warp_size=32", [-1, 16, 64, 49152, 2147483647, 1024, 8, 32], "", 0, []], [[], [["FU", 2, [0, 1, 2, 3]], ["SP", 2, 0, 480, [6], 1], ["AN", 2, 0, 5], ["AN", 2, 1, 6]]]], "r": [[2.63958e-06, 2.63927e-06, 2.64766e-06], 0, 2.06637, 1667942251], "v": "v0.6"}
{"i": [["[\"mul\", 1, 1, 1, 480]", "cuda -keys=cuda,gpu -max_num_threads=1024 -model=unknown -thread_warp_size=32", [-1, 16, 64, 49152, 2147483647, 1024, 8, 32], "", 0, []], [[], [["FU", 2, [0, 1, 2, 3]], ["SP", 2, 0, 480, [60], 1], ["AN", 2, 0, 5], ["AN", 2, 1, 6]]]], "r": [[2.45442e-06, 2.44881e-06, 2.43195e-06], 0, 2.83414, 1667942252], "v": "v0.6"}
{"i": [["[\"mul\", 1, 1, 1, 480]", "cuda -keys=cuda,gpu -max_num_threads=1024 -model=unknown -thread_warp_size=32", [-1, 16, 64, 49152, 2147483647, 1024, 8, 32], "", 0, []], [[], [["FU", 2, [0, 1, 2, 3]], ["SP", 2, 0, 480, [4], 1], ["AN", 2, 0, 5], ["AN", 2, 1, 6]]]], "r": [[2.75212e-06, 2.75333e-06, 2.75417e-06], 0, 2.52098, 1667942252], "v": "v0.6"}
{"i": [["[\"mul\", 1, 1, 1, 480]", "cuda -keys=cuda,gpu -max_num_threads=1024 -model=unknown -thread_warp_size=32", [-1, 16, 64, 49152, 2147483647, 1024, 8, 32], "", 0, []], [[], [["FU", 2, [0, 1, 2, 3]], ["SP", 2, 0, 480, [48], 1], ["AN", 2, 0, 5], ["AN", 2, 1, 6]]]], "r": [[2.62747e-06, 2.63179e-06, 2.65626e-06], 0, 3.06371, 1667942252], "v": "v0.6"}
{"i": [["[\"mul\", 1, 1, 1, 480]", "cuda -keys=cuda,gpu -max_num_threads=1024 -model=unknown -thread_warp_size=32", [-1, 16, 64, 49152, 2147483647, 1024, 8, 32], "", 0, []], [[], [["FU", 2, [0, 1, 2, 3]], ["SP", 2, 0, 480, [5], 1], ["AN", 2, 0, 5], ["AN", 2, 1, 6]]]], "r": [[2.68895e-06, 2.69407e-06, 2.70465e-06], 0, 3.31918, 1667942253], "v": "v0.6"}
{"i": [["[\"mul\", 1, 1, 1, 480]", "cuda -keys=cuda,gpu -max_num_threads=1024 -model=unknown -thread_warp_size=32", [-1, 16, 64, 49152, 2147483647, 1024, 8, 32], "", 0, []], [[], [["FU", 2, [0, 1, 2, 3]], ["SP", 2, 0, 480, [20], 1], ["AN", 2, 0, 5], ["AN", 2, 1, 6]]]], "r": [[2.52776e-06, 2.53354e-06, 2.5329e-06], 0, 3.56699, 1667942253], "v": "v0.6"}
{"i": [["[\"mul\", 1, 1, 1, 480]", "cuda -keys=cuda,gpu -max_num_threads=1024 -model=unknown -thread_warp_size=32", [-1, 16, 64, 49152, 2147483647, 1024, 8, 32], "", 0, []], [[], [["FU", 2, [0, 1, 2, 3]], ["SP", 2, 0, 480, [16], 1], ["AN", 2, 0, 5], ["AN", 2, 1, 6]]]], "r": [[2.56459e-06, 2.57156e-06, 2.59898e-06], 0, 3.7877, 1667942253], "v": "v0.6"}
{"i": [["[\"mul\", 1, 1, 1, 480]", "cuda -keys=cuda,gpu -max_num_threads=1024 -model=unknown -thread_warp_size=32", [-1, 16, 64, 49152, 2147483647, 1024, 8, 32], "", 0, []], [[], [["FU", 2, [0, 1, 2, 3]], ["SP", 2, 0, 480, [40], 1], ["AN", 2, 0, 5], ["AN", 2, 1, 6]]]], "r": [[2.59969e-06, 2.60474e-06, 2.62416e-06], 0, 4.10189, 1667942254], "v": "v0.6"}
{"i": [["[\"mul\", 1, 1, 1, 480]", "cuda -keys=cuda,gpu -max_num_threads=1024 -model=unknown -thread_warp_size=32", [-1, 16, 64, 49152, 2147483647, 1024, 8, 32], "", 0, []], [[], [["FU", 2, [0, 1, 2, 3]], ["SP", 2, 0, 480, [2], 1], ["AN", 2, 0, 5], ["AN", 2, 1, 6]]]], "r": [[2.92318e-06, 2.92698e-06, 2.93409e-06], 0, 4.62833, 1667942254], "v": "v0.6"}
{"i": [["[\"mul\", 1, 1, 1, 480]", "cuda -keys=cuda,gpu -max_num_threads=1024 -model=unknown -thread_warp_size=32", [-1, 16, 64, 49152, 2147483647, 1024, 8, 32], "", 0, []], [[], [["FU", 2, [0, 1, 2, 3]], ["SP", 2, 0, 480, [32], 1], ["AN", 2, 0, 5], ["AN", 2, 1, 6]]]], "r": [[2.46438e-06, 2.46565e-06, 2.46708e-06], 0, 4.31846, 1667942254], "v": "v0.6"}
{"i": [["[\"mul\", 1, 1, 1, 480]", "cuda -keys=cuda,gpu -max_num_threads=1024 -model=unknown -thread_warp_size=32", [-1, 16, 64, 49152, 2147483647, 1024, 8, 32], "", 0, []], [[], [["FU", 2, [0, 1, 2, 3]], ["SP", 2, 0, 480, [3], 1], ["AN", 2, 0, 5], ["AN", 2, 1, 6]]]], "r": [[2.62458e-06, 2.62342e-06, 2.62448e-06], 0, 4.91805, 1667942255], "v": "v0.6"}
{"i": [["[\"mul\", 1, 1, 1, 480]", "cuda -keys=cuda,gpu -max_num_threads=1024 -model=unknown -thread_warp_size=32", [-1, 16, 64, 49152, 2147483647, 1024, 8, 32], "", 0, []], [[], [["FU", 2, [0, 1, 2, 3]], ["SP", 2, 0, 480, [15], 1], ["AN", 2, 0, 5], ["AN", 2, 1, 6]]]], "r": [[2.61269e-06, 2.60983e-06, 2.63294e-06], 0, 5.24086, 1667942255], "v": "v0.6"}
