python/models/efficientnet/VertiFusionEfficientNet_kernel_configs/efficient_mul_1_14_14_480.log
{"i": [["[\"mul\", 1, 14, 14, 480]", "cuda -keys=cuda,gpu -max_num_threads=1024 -model=unknown -thread_warp_size=32", [-1, 16, 64, 49152, 2147483647, 1024, 8, 32], "", 0, []], [[], [["FU", 2, [0, 1, 2, 3]], ["SP", 2, 0, 94080, [8], 1], ["AN", 2, 0, 5], ["AN", 2, 1, 6]]]], "r": [[1.14502e-05, 1.14369e-05, 1.14382e-05], 0, 2.37442, 1667926753], "v": "v0.6"}
{"i": [["[\"mul\", 1, 14, 14, 480]", "cuda -keys=cuda,gpu -max_num_threads=1024 -model=unknown -thread_warp_size=32", [-1, 16, 64, 49152, 2147483647, 1024, 8, 32], "", 0, []], [[], [["FU", 2, [0, 1, 2, 3]], ["SP", 2, 0, 94080, [20], 1], ["AN", 2, 0, 5], ["AN", 2, 1, 6]]]], "r": [[6.14696e-06, 6.15205e-06, 6.15378e-06], 0, 0.564015, 1667926751], "v": "v0.6"}
{"i": [["[\"mul\", 1, 14, 14, 480]", "cuda -keys=cuda,gpu -max_num_threads=1024 -model=unknown -thread_warp_size=32", [-1, 16, 64, 49152, 2147483647, 1024, 8, 32], "", 0, []], [[], [["FU", 2, [0, 1, 2, 3]], ["SP", 2, 0, 94080, [2], 1], ["AN", 2, 0, 5], ["AN", 2, 1, 6]]]], "r": [[3.7538e-05, 3.75413e-05, 3.75441e-05], 0, 1.8139, 1667926752], "v": "v0.6"}
{"i": [["[\"mul\", 1, 14, 14, 480]", "cuda -keys=cuda,gpu -max_num_threads=1024 -model=unknown -thread_warp_size=32", [-1, 16, 64, 49152, 2147483647, 1024, 8, 32], "", 0, []], [[], [["FU", 2, [0, 1, 2, 3]], ["SP", 2, 0, 94080, [64], 1], ["AN", 2, 0, 5], ["AN", 2, 1, 6]]]], "r": [[3.73572e-06, 3.72749e-06, 3.72396e-06], 0, 2.60823, 1667926753], "v": "v0.6"}
{"i": [["[\"mul\", 1, 14, 14, 480]", "cuda -keys=cuda,gpu -max_num_threads=1024 -model=unknown -thread_warp_size=32", [-1, 16, 64, 49152, 2147483647, 1024, 8, 32], "", 0, []], [[], [["FU", 2, [0, 1, 2, 3]], ["SP", 2, 0, 94080, [60], 1], ["AN", 2, 0, 5], ["AN", 2, 1, 6]]]], "r": [[3.74766e-06, 3.74862e-06, 3.74871e-06], 0, 0.886523, 1667926751], "v": "v0.6"}
{"i": [["[\"mul\", 1, 14, 14, 480]", "cuda -keys=cuda,gpu -max_num_threads=1024 -model=unknown -thread_warp_size=32", [-1, 16, 64, 49152, 2147483647, 1024, 8, 32], "", 0, []], [[], [["FU", 2, [0, 1, 2, 3]], ["SP", 2, 0, 94080, [1], 1], ["AN", 2, 0, 5], ["AN", 2, 1, 6]]]], "r": [[7.25041e-05, 7.2498e-05, 7.2511e-05], 0, 1.17224, 1667926751], "v": "v0.6"}
{"i": [["[\"mul\", 1, 14, 14, 480]", "cuda -keys=cuda,gpu -max_num_threads=1024 -model=unknown -thread_warp_size=32", [-1, 16, 64, 49152, 2147483647, 1024, 8, 32], "", 0, []], [[], [["FU", 2, [0, 1, 2, 3]], ["SP", 2, 0, 94080, [24], 1], ["AN", 2, 0, 5], ["AN", 2, 1, 6]]]], "r": [[5.52383e-06, 5.52935e-06, 5.53017e-06], 0, 1.54625, 1667926752], "v": "v0.6"}
{"i": [["[\"mul\", 1, 14, 14, 480]", "cuda -keys=cuda,gpu -max_num_threads=1024 -model=unknown -thread_warp_size=32", [-1, 16, 64, 49152, 2147483647, 1024, 8, 32], "", 0, []], [[], [["FU", 2, [0, 1, 2, 3]], ["SP", 2, 0, 94080, [28], 1], ["AN", 2, 0, 5], ["AN", 2, 1, 6]]]], "r": [[5.12893e-06, 5.12619e-06, 5.13581e-06], 0, 1.9915, 1667926752], "v": "v0.6"}
{"i": [["[\"mul\", 1, 14, 14, 480]", "cuda -keys=cuda,gpu -max_num_threads=1024 -model=unknown -thread_warp_size=32", [-1, 16, 64, 49152, 2147483647, 1024, 8, 32], "", 0, []], [[], [["FU", 2, [0, 1, 2, 3]], ["SP", 2, 0, 94080, [7], 1], ["AN", 2, 0, 5], ["AN", 2, 1, 6]]]], "r": [[1.272e-05, 1.27164e-05, 1.27229e-05], 0, 3.09626, 1667926754], "v": "v0.6"}
{"i": [["[\"mul\", 1, 14, 14, 480]", "cuda -keys=cuda,gpu -max_num_threads=1024 -model=unknown -thread_warp_size=32", [-1, 16, 64, 49152, 2147483647, 1024, 8, 32], "", 0, []], [[], [["FU", 2, [0, 1, 2, 3]], ["SP", 2, 0, 94080, [35], 1], ["AN", 2, 0, 5], ["AN", 2, 1, 6]]]], "r": [[4.48238e-06, 4.48017e-06, 4.48352e-06], 0, 3.31834, 1667926754], "v": "v0.6"}
{"i": [["[\"mul\", 1, 14, 14, 480]", "cuda -keys=cuda,gpu -max_num_threads=1024 -model=unknown -thread_warp_size=32", [-1, 16, 64, 49152, 2147483647, 1024, 8, 32], "", 0, []], [[], [["FU", 2, [0, 1, 2, 3]], ["SP", 2, 0, 94080, [15], 1], ["AN", 2, 0, 5], ["AN", 2, 1, 6]]]], "r": [[7.27718e-06, 7.28301e-06, 7.27736e-06], 0, 3.88906, 1667926755], "v": "v0.6"}
{"i": [["[\"mul\", 1, 14, 14, 480]", "cuda -keys=cuda,gpu -max_num_threads=1024 -model=unknown -thread_warp_size=32", [-1, 16, 64, 49152, 2147483647, 1024, 8, 32], "", 0, []], [[], [["FU", 2, [0, 1, 2, 3]], ["SP", 2, 0, 94080, [32], 1], ["AN", 2, 0, 5], ["AN", 2, 1, 6]]]], "r": [[4.80571e-06, 4.80488e-06, 4.80313e-06], 0, 4.22648, 1667926755], "v": "v0.6"}
{"i": [["[\"mul\", 1, 14, 14, 480]", "cuda -keys=cuda,gpu -max_num_threads=1024 -model=unknown -thread_warp_size=32", [-1, 16, 64, 49152, 2147483647, 1024, 8, 32], "", 0, []], [[], [["FU", 2, [0, 1, 2, 3]], ["SP", 2, 0, 94080, [16], 1], ["AN", 2, 0, 5], ["AN", 2, 1, 6]]]], "r": [[6.99121e-06, 6.9874e-06, 6.99458e-06], 0, 3.53658, 1667926754], "v": "v0.6"}
{"i": [["[\"mul\", 1, 14, 14, 480]", "cuda -keys=cuda,gpu -max_num_threads=1024 -model=unknown -thread_warp_size=32", [-1, 16, 64, 49152, 2147483647, 1024, 8, 32], "", 0, []], [[], [["FU", 2, [0, 1, 2, 3]], ["SP", 2, 0, 94080, [4], 1], ["AN", 2, 0, 5], ["AN", 2, 1, 6]]]], "r": [[2.03398e-05, 2.03399e-05, 2.03428e-05], 0, 4.42076, 1667926755], "v": "v0.6"}
{"i": [["[\"mul\", 1, 14, 14, 480]", "cuda -keys=cuda,gpu -max_num_threads=1024 -model=unknown -thread_warp_size=32", [-1, 16, 64, 49152, 2147483647, 1024, 8, 32], "", 0, []], [[], [["FU", 2, [0, 1, 2, 3]], ["SP", 2, 0, 94080, [3], 1], ["AN", 2, 0, 5], ["AN", 2, 1, 6]]]], "r": [[2.59577e-05, 2.59658e-05, 2.59659e-05], 0, 4.71454, 1667926756], "v": "v0.6"}
{"i": [["[\"mul\", 1, 14, 14, 480]", "cuda -keys=cuda,gpu -max_num_threads=1024 -model=unknown -thread_warp_size=32", [-1, 16, 64, 49152, 2147483647, 1024, 8, 32], "", 0, []], [[], [["FU", 2, [0, 1, 2, 3]], ["SP", 2, 0, 94080, [10], 1], ["AN", 2, 0, 5], ["AN", 2, 1, 6]]]], "r": [[9.67024e-06, 9.67331e-06, 9.66817e-06], 0, 4.97564, 1667926756], "v": "v0.6"}
{"i": [["[\"mul\", 1, 14, 14, 480]", "cuda -keys=cuda,gpu -max_num_threads=1024 -model=unknown -thread_warp_size=32", [-1, 16, 64, 49152, 2147483647, 1024, 8, 32], "", 0, []], [[], [["FU", 2, [0, 1, 2, 3]], ["SP", 2, 0, 94080, [21], 1], ["AN", 2, 0, 5], ["AN", 2, 1, 6]]]], "r": [[5.93767e-06, 5.93508e-06, 5.93833e-06], 0, 5.20141, 1667926756], "v": "v0.6"}
{"i": [["[\"mul\", 1, 14, 14, 480]", "cuda -keys=cuda,gpu -max_num_threads=1024 -model=unknown -thread_warp_size=32", [-1, 16, 64, 49152, 2147483647, 1024, 8, 32], "", 0, []], [[], [["FU", 2, [0, 1, 2, 3]], ["SP", 2, 0, 94080, [48], 1], ["AN", 2, 0, 5], ["AN", 2, 1, 6]]]], "r": [[4.20484e-06, 4.20247e-06, 4.20587e-06], 0, 5.48611, 1667926757], "v": "v0.6"}
{"i": [["[\"mul\", 1, 14, 14, 480]", "cuda -keys=cuda,gpu -max_num_threads=1024 -model=unknown -thread_warp_size=32", [-1, 16, 64, 49152, 2147483647, 1024, 8, 32], "", 0, []], [[], [["FU", 2, [0, 1, 2, 3]], ["SP", 2, 0, 94080, [6], 1], ["AN", 2, 0, 5], ["AN", 2, 1, 6]]]], "r": [[1.43722e-05, 1.43791e-05, 1.43665e-05], 0, 2.78659, 1667926753], "v": "v0.6"}
{"i": [["[\"mul\", 1, 14, 14, 480]", "cuda -keys=cuda,gpu -max_num_threads=1024 -model=unknown -thread_warp_size=32", [-1, 16, 64, 49152, 2147483647, 1024, 8, 32], "", 0, []], [[], [["FU", 2, [0, 1, 2, 3]], ["SP", 2, 0, 94080, [5], 1], ["AN", 2, 0, 5], ["AN", 2, 1, 6]]]], "r": [[1.66822e-05, 1.66849e-05, 1.66841e-05], 0, 5.78597, 1667926757], "v": "v0.6"}
{"i": [["[\"mul\", 1, 14, 14, 480]", "cuda -keys=cuda,gpu -max_num_threads=1024 -model=unknown -thread_warp_size=32", [-1, 16, 64, 49152, 2147483647, 1024, 8, 32], "", 0, []], [[], [["FU", 2, [0, 1, 2, 3]], ["SP", 2, 0, 94080, [21], 1], ["AN", 2, 0, 5], ["AN", 2, 1, 6]]]], "r": [[5.95308e-06, 5.94744e-06, 5.9518e-06], 0, 2.12933, 1667939897], "v": "v0.6"}
{"i": [["[\"mul\", 1, 14, 14, 480]", "cuda -keys=cuda,gpu -max_num_threads=1024 -model=unknown -thread_warp_size=32", [-1, 16, 64, 49152, 2147483647, 1024, 8, 32], "", 0, []], [[], [["FU", 2, [0, 1, 2, 3]], ["SP", 2, 0, 94080, [30], 1], ["AN", 2, 0, 5], ["AN", 2, 1, 6]]]], "r": [[5.00972e-06, 5.01046e-06, 5.01265e-06], 0, 1.28694, 1667939896], "v": "v0.6"}
{"i": [["[\"mul\", 1, 14, 14, 480]", "cuda -keys=cuda,gpu -max_num_threads=1024 -model=unknown -thread_warp_size=32", [-1, 16, 64, 49152, 2147483647, 1024, 8, 32], "", 0, []], [[], [["FU", 2, [0, 1, 2, 3]], ["SP", 2, 0, 94080, [32], 1], ["AN", 2, 0, 5], ["AN", 2, 1, 6]]]], "r": [[4.946e-06, 4.94617e-06, 4.94426e-06], 0, 2.46341, 1667939897], "v": "v0.6"}
{"i": [["[\"mul\", 1, 14, 14, 480]", "cuda -keys=cuda,gpu -max_num_threads=1024 -model=unknown -thread_warp_size=32", [-1, 16, 64, 49152, 2147483647, 1024, 8, 32], "", 0, []], [[], [["FU", 2, [0, 1, 2, 3]], ["SP", 2, 0, 94080, [64], 1], ["AN", 2, 0, 5], ["AN", 2, 1, 6]]]], "r": [[3.61128e-06, 3.6221e-06, 5.62826e-06], 0, 0.59477, 1667939895], "v": "v0.6"}
{"i": [["[\"mul\", 1, 14, 14, 480]", "cuda -keys=cuda,gpu -max_num_threads=1024 -model=unknown -thread_warp_size=32", [-1, 16, 64, 49152, 2147483647, 1024, 8, 32], "", 0, []], [[], [["FU", 2, [0, 1, 2, 3]], ["SP", 2, 0, 94080, [20], 1], ["AN", 2, 0, 5], ["AN", 2, 1, 6]]]], "r": [[6.15534e-06, 6.15404e-06, 6.15148e-06], 0, 1.63919, 1667939896], "v": "v0.6"}
{"i": [["[\"mul\", 1, 14, 14, 480]", "cuda -keys=cuda,gpu -max_num_threads=1024 -model=unknown -thread_warp_size=32", [-1, 16, 64, 49152, 2147483647, 1024, 8, 32], "", 0, []], [[], [["FU", 2, [0, 1, 2, 3]], ["SP", 2, 0, 94080, [4], 1], ["AN", 2, 0, 5], ["AN", 2, 1, 6]]]], "r": [[2.0139e-05, 2.01404e-05, 2.01429e-05], 0, 1.91841, 1667939896], "v": "v0.6"}
{"i": [["[\"mul\", 1, 14, 14, 480]", "cuda -keys=cuda,gpu -max_num_threads=1024 -model=unknown -thread_warp_size=32", [-1, 16, 64, 49152, 2147483647, 1024, 8, 32], "", 0, []], [[], [["FU", 2, [0, 1, 2, 3]], ["SP", 2, 0, 94080, [40], 1], ["AN", 2, 0, 5], ["AN", 2, 1, 6]]]], "r": [[4.4197e-06, 1.18118e-05, 4.42047e-06], 0, 1.00039, 1667939895], "v": "v0.6"}
{"i": [["[\"mul\", 1, 14, 14, 480]", "cuda -keys=cuda,gpu -max_num_threads=1024 -model=unknown -thread_warp_size=32", [-1, 16, 64, 49152, 2147483647, 1024, 8, 32], "", 0, []], [[], [["FU", 2, [0, 1, 2, 3]], ["SP", 2, 0, 94080, [15], 1], ["AN", 2, 0, 5], ["AN", 2, 1, 6]]]], "r": [[7.31434e-06, 7.31339e-06, 7.31096e-06], 0, 2.73744, 1667939897], "v": "v0.6"}
{"i": [["[\"mul\", 1, 14, 14, 480]", "cuda -keys=cuda,gpu -max_num_threads=1024 -model=unknown -thread_warp_size=32", [-1, 16, 64, 49152, 2147483647, 1024, 8, 32], "", 0, []], [[], [["FU", 2, [0, 1, 2, 3]], ["SP", 2, 0, 94080, [42], 1], ["AN", 2, 0, 5], ["AN", 2, 1, 6]]]], "r": [[4.22564e-06, 4.23046e-06, 4.22801e-06], 0, 2.97401, 1667939898], "v": "v0.6"}
{"i": [["[\"mul\", 1, 14, 14, 480]", "cuda -keys=cuda,gpu -max_num_threads=1024 -model=unknown -thread_warp_size=32", [-1, 16, 64, 49152, 2147483647, 1024, 8, 32], "", 0, []], [[], [["FU", 2, [0, 1, 2, 3]], ["SP", 2, 0, 94080, [56], 1], ["AN", 2, 0, 5], ["AN", 2, 1, 6]]]], "r": [[4.02747e-06, 4.02867e-06, 4.02709e-06], 0, 3.48832, 1667939898], "v": "v0.6"}
{"i": [["[\"mul\", 1, 14, 14, 480]", "cuda -keys=cuda,gpu -max_num_threads=1024 -model=unknown -thread_warp_size=32", [-1, 16, 64, 49152, 2147483647, 1024, 8, 32], "", 0, []], [[], [["FU", 2, [0, 1, 2, 3]], ["SP", 2, 0, 94080, [24], 1], ["AN", 2, 0, 5], ["AN", 2, 1, 6]]]], "r": [[5.49505e-06, 5.49445e-06, 5.49266e-06], 0, 3.78014, 1667939899], "v": "v0.6"}
{"i": [["[\"mul\", 1, 14, 14, 480]", "cuda -keys=cuda,gpu -max_num_threads=1024 -model=unknown -thread_warp_size=32", [-1, 16, 64, 49152, 2147483647, 1024, 8, 32], "", 0, []], [[], [["FU", 2, [0, 1, 2, 3]], ["SP", 2, 0, 94080, [5], 1], ["AN", 2, 0, 5], ["AN", 2, 1, 6]]]], "r": [[1.67459e-05, 1.67391e-05, 1.67387e-05], 0, 4.04189, 1667939899], "v": "v0.6"}
{"i": [["[\"mul\", 1, 14, 14, 480]", "cuda -keys=cuda,gpu -max_num_threads=1024 -model=unknown -thread_warp_size=32", [-1, 16, 64, 49152, 2147483647, 1024, 8, 32], "", 0, []], [[], [["FU", 2, [0, 1, 2, 3]], ["SP", 2, 0, 94080, [14], 1], ["AN", 2, 0, 5], ["AN", 2, 1, 6]]]], "r": [[7.61532e-06, 7.6205e-06, 7.61535e-06], 0, 4.51734, 1667939900], "v": "v0.6"}
{"i": [["[\"mul\", 1, 14, 14, 480]", "cuda -keys=cuda,gpu -max_num_threads=1024 -model=unknown -thread_warp_size=32", [-1, 16, 64, 49152, 2147483647, 1024, 8, 32], "", 0, []], [[], [["FU", 2, [0, 1, 2, 3]], ["SP", 2, 0, 94080, [1], 1], ["AN", 2, 0, 5], ["AN", 2, 1, 6]]]], "r": [[7.24015e-05, 7.23765e-05, 7.23865e-05], 0, 4.18181, 1667939899], "v": "v0.6"}
{"i": [["[\"mul\", 1, 14, 14, 480]", "cuda -keys=cuda,gpu -max_num_threads=1024 -model=unknown -thread_warp_size=32", [-1, 16, 64, 49152, 2147483647, 1024, 8, 32], "", 0, []], [[], [["FU", 2, [0, 1, 2, 3]], ["SP", 2, 0, 94080, [35], 1], ["AN", 2, 0, 5], ["AN", 2, 1, 6]]]], "r": [[4.48729e-06, 4.48226e-06, 4.48638e-06], 0, 4.80951, 1667939900], "v": "v0.6"}
{"i": [["[\"mul\", 1, 14, 14, 480]", "cuda -keys=cuda,gpu -max_num_threads=1024 -model=unknown -thread_warp_size=32", [-1, 16, 64, 49152, 2147483647, 1024, 8, 32], "", 0, []], [[], [["FU", 2, [0, 1, 2, 3]], ["SP", 2, 0, 94080, [48], 1], ["AN", 2, 0, 5], ["AN", 2, 1, 6]]]], "r": [[4.13555e-06, 4.13804e-06, 4.1378e-06], 0, 5.34538, 1667939901], "v": "v0.6"}
{"i": [["[\"mul\", 1, 14, 14, 480]", "cuda -keys=cuda,gpu -max_num_threads=1024 -model=unknown -thread_warp_size=32", [-1, 16, 64, 49152, 2147483647, 1024, 8, 32], "", 0, []], [[], [["FU", 2, [0, 1, 2, 3]], ["SP", 2, 0, 94080, [8], 1], ["AN", 2, 0, 5], ["AN", 2, 1, 6]]]], "r": [[1.14997e-05, 1.14971e-05, 1.15006e-05], 0, 5.66058, 1667939901], "v": "v0.6"}
{"i": [["[\"mul\", 1, 14, 14, 480]", "cuda -keys=cuda,gpu -max_num_threads=1024 -model=unknown -thread_warp_size=32", [-1, 16, 64, 49152, 2147483647, 1024, 8, 32], "", 0, []], [[], [["FU", 2, [0, 1, 2, 3]], ["SP", 2, 0, 94080, [6], 1], ["AN", 2, 0, 5], ["AN", 2, 1, 6]]]], "r": [[1.4383e-05, 1.43804e-05, 1.43802e-05], 0, 5.88168, 1667939901], "v": "v0.6"}
{"i": [["[\"mul\", 1, 14, 14, 480]", "cuda -keys=cuda,gpu -max_num_threads=1024 -model=unknown -thread_warp_size=32", [-1, 16, 64, 49152, 2147483647, 1024, 8, 32], "", 0, []], [[], [["FU", 2, [0, 1, 2, 3]], ["SP", 2, 0, 94080, [16], 1], ["AN", 2, 0, 5], ["AN", 2, 1, 6]]]], "r": [[6.97926e-06, 6.98122e-06, 6.98483e-06], 0, 6.0595, 1667939902], "v": "v0.6"}
{"i": [["[\"mul\", 1, 14, 14, 480]", "cuda -keys=cuda,gpu -max_num_threads=1024 -model=unknown -thread_warp_size=32", [-1, 16, 64, 49152, 2147483647, 1024, 8, 32], "", 0, []], [[], [["FU", 2, [0, 1, 2, 3]], ["SP", 2, 0, 94080, [60], 1], ["AN", 2, 0, 5], ["AN", 2, 1, 6]]]], "r": [[3.78109e-06, 3.78325e-06, 3.78434e-06], 0, 3.15316, 1667939898], "v": "v0.6"}
{"i": [["[\"mul\", 1, 14, 14, 480]", "cuda -keys=cuda,gpu -max_num_threads=1024 -model=unknown -thread_warp_size=32", [-1, 16, 64, 49152, 2147483647, 1024, 8, 32], "", 0, []], [[], [["FU", 2, [0, 1, 2, 3]], ["SP", 2, 0, 94080, [49], 1], ["AN", 2, 0, 5], ["AN", 2, 1, 6]]]], "r": [[4.22384e-06, 4.22128e-06, 4.22265e-06], 0, 6.66647, 1667939902], "v": "v0.6"}
{"i": [["[\"mul\", 1, 14, 14, 480]", "cuda -keys=cuda,gpu -max_num_threads=1024 -model=unknown -thread_warp_size=32", [-1, 16, 64, 49152, 2147483647, 1024, 8, 32], "", 0, []], [[], [["FU", 2, [0, 1, 2, 3]], ["SP", 2, 0, 94080, [3], 1], ["AN", 2, 0, 5], ["AN", 2, 1, 6]]]], "r": [[2.60559e-05, 2.60405e-05, 2.60415e-05], 0, 6.34587, 1667939902], "v": "v0.6"}
{"i": [["[\"mul\", 1, 14, 14, 480]", "cuda -keys=cuda,gpu -max_num_threads=1024 -model=unknown -thread_warp_size=32", [-1, 16, 64, 49152, 2147483647, 1024, 8, 32], "", 0, []], [[], [["FU", 2, [0, 1, 2, 3]], ["SP", 2, 0, 94080, [10], 1], ["AN", 2, 0, 5], ["AN", 2, 1, 6]]]], "r": [[9.612e-06, 9.61215e-06, 9.61378e-06], 0, 7.56218, 1667939903], "v": "v0.6"}
{"i": [["[\"mul\", 1, 14, 14, 480]", "cuda -keys=cuda,gpu -max_num_threads=1024 -model=unknown -thread_warp_size=32", [-1, 16, 64, 49152, 2147483647, 1024, 8, 32], "", 0, []], [[], [["FU", 2, [0, 1, 2, 3]], ["SP", 2, 0, 94080, [28], 1], ["AN", 2, 0, 5], ["AN", 2, 1, 6]]]], "r": [[5.24097e-06, 5.24133e-06, 5.23864e-06], 0, 6.89735, 1667939903], "v": "v0.6"}
{"i": [["[\"mul\", 1, 14, 14, 480]", "cuda -keys=cuda,gpu -max_num_threads=1024 -model=unknown -thread_warp_size=32", [-1, 16, 64, 49152, 2147483647, 1024, 8, 32], "", 0, []], [[], [["FU", 2, [0, 1, 2, 3]], ["SP", 2, 0, 94080, [12], 1], ["AN", 2, 0, 5], ["AN", 2, 1, 6]]]], "r": [[8.44878e-06, 8.45414e-06, 8.44535e-06], 0, 7.17252, 1667939903], "v": "v0.6"}
{"i": [["[\"mul\", 1, 14, 14, 480]", "cuda -keys=cuda,gpu -max_num_threads=1024 -model=unknown -thread_warp_size=32", [-1, 16, 64, 49152, 2147483647, 1024, 8, 32], "", 0, []], [[], [["FU", 2, [0, 1, 2, 3]], ["SP", 2, 0, 94080, [2], 1], ["AN", 2, 0, 5], ["AN", 2, 1, 6]]]], "r": [[3.75471e-05, 3.75484e-05, 3.75424e-05], 0, 5.14578, 1667939900], "v": "v0.6"}
{"i": [["[\"mul\", 1, 14, 14, 480]", "cuda -keys=cuda,gpu -max_num_threads=1024 -model=unknown -thread_warp_size=32", [-1, 16, 64, 49152, 2147483647, 1024, 8, 32], "", 0, []], [[], [["FU", 2, [0, 1, 2, 3]], ["SP", 2, 0, 94080, [7], 1], ["AN", 2, 0, 5], ["AN", 2, 1, 6]]]], "r": [[1.26725e-05, 1.26731e-05, 1.2673e-05], 0, 7.74754, 1667939904], "v": "v0.6"}
{"i": [["[\"mul\", 1, 14, 14, 480]", "cuda -keys=cuda,gpu -max_num_threads=1024 -model=unknown -thread_warp_size=32", [-1, 16, 64, 49152, 2147483647, 1024, 8, 32], "", 0, []], [[], [["FU", 2, [0, 1, 2, 3]], ["SP", 2, 0, 94080, [15], 1], ["AN", 2, 0, 5], ["AN", 2, 1, 6]]]], "r": [[7.41048e-06, 7.41214e-06, 7.40632e-06], 0, 0.927489, 1667940314], "v": "v0.6"}
{"i": [["[\"mul\", 1, 14, 14, 480]", "cuda -keys=cuda,gpu -max_num_threads=1024 -model=unknown -thread_warp_size=32", [-1, 16, 64, 49152, 2147483647, 1024, 8, 32], "", 0, []], [[], [["FU", 2, [0, 1, 2, 3]], ["SP", 2, 0, 94080, [10], 1], ["AN", 2, 0, 5], ["AN", 2, 1, 6]]]], "r": [[9.73049e-06, 9.72455e-06, 9.72381e-06], 0, 2.2321, 1667940315], "v": "v0.6"}
{"i": [["[\"mul\", 1, 14, 14, 480]", "cuda -keys=cuda,gpu -max_num_threads=1024 -model=unknown -thread_warp_size=32", [-1, 16, 64, 49152, 2147483647, 1024, 8, 32], "", 0, []], [[], [["FU", 2, [0, 1, 2, 3]], ["SP", 2, 0, 94080, [5], 1], ["AN", 2, 0, 5], ["AN", 2, 1, 6]]]], "r": [[1.67169e-05, 1.67151e-05, 1.6722e-05], 0, 0.636936, 1667940314], "v": "v0.6"}
{"i": [["[\"mul\", 1, 14, 14, 480]", "cuda -keys=cuda,gpu -max_num_threads=1024 -model=unknown -thread_warp_size=32", [-1, 16, 64, 49152, 2147483647, 1024, 8, 32], "", 0, []], [[], [["FU", 2, [0, 1, 2, 3]], ["SP", 2, 0, 94080, [20], 1], ["AN", 2, 0, 5], ["AN", 2, 1, 6]]]], "r": [[6.19718e-06, 6.19025e-06, 6.18874e-06], 0, 1.94959, 1667940315], "v": "v0.6"}
{"i": [["[\"mul\", 1, 14, 14, 480]", "cuda -keys=cuda,gpu -max_num_threads=1024 -model=unknown -thread_warp_size=32", [-1, 16, 64, 49152, 2147483647, 1024, 8, 32], "", 0, []], [[], [["FU", 2, [0, 1, 2, 3]], ["SP", 2, 0, 94080, [49], 1], ["AN", 2, 0, 5], ["AN", 2, 1, 6]]]], "r": [[3.99574e-06, 4.00319e-06, 4.0063e-06], 0, 2.72403, 1667940316], "v": "v0.6"}
{"i": [["[\"mul\", 1, 14, 14, 480]", "cuda -keys=cuda,gpu -max_num_threads=1024 -model=unknown -thread_warp_size=32", [-1, 16, 64, 49152, 2147483647, 1024, 8, 32], "", 0, []], [[], [["FU", 2, [0, 1, 2, 3]], ["SP", 2, 0, 94080, [14], 1], ["AN", 2, 0, 5], ["AN", 2, 1, 6]]]], "r": [[7.60196e-06, 7.59991e-06, 7.60088e-06], 0, 1.28003, 1667940314], "v": "v0.6"}
{"i": [["[\"mul\", 1, 14, 14, 480]", "cuda -keys=cuda,gpu -max_num_threads=1024 -model=unknown -thread_warp_size=32", [-1, 16, 64, 49152, 2147483647, 1024, 8, 32], "", 0, []], [[], [["FU", 2, [0, 1, 2, 3]], ["SP", 2, 0, 94080, [1], 1], ["AN", 2, 0, 5], ["AN", 2, 1, 6]]]], "r": [[7.24838e-05, 7.25009e-05, 7.25018e-05], 0, 1.67535, 1667940315], "v": "v0.6"}
{"i": [["[\"mul\", 1, 14, 14, 480]", "cuda -keys=cuda,gpu -max_num_threads=1024 -model=unknown -thread_warp_size=32", [-1, 16, 64, 49152, 2147483647, 1024, 8, 32], "", 0, []], [[], [["FU", 2, [0, 1, 2, 3]], ["SP", 2, 0, 94080, [35], 1], ["AN", 2, 0, 5], ["AN", 2, 1, 6]]]], "r": [[4.70355e-06, 4.70275e-06, 4.70207e-06], 0, 2.56129, 1667940316], "v": "v0.6"}
{"i": [["[\"mul\", 1, 14, 14, 480]", "cuda -keys=cuda,gpu -max_num_threads=1024 -model=unknown -thread_warp_size=32", [-1, 16, 64, 49152, 2147483647, 1024, 8, 32], "", 0, []], [[], [["FU", 2, [0, 1, 2, 3]], ["SP", 2, 0, 94080, [12], 1], ["AN", 2, 0, 5], ["AN", 2, 1, 6]]]], "r": [[8.41069e-06, 8.41702e-06, 8.41539e-06], 0, 3.02872, 1667940316], "v": "v0.6"}
{"i": [["[\"mul\", 1, 14, 14, 480]", "cuda -keys=cuda,gpu -max_num_threads=1024 -model=unknown -thread_warp_size=32", [-1, 16, 64, 49152, 2147483647, 1024, 8, 32], "", 0, []], [[], [["FU", 2, [0, 1, 2, 3]], ["SP", 2, 0, 94080, [8], 1], ["AN", 2, 0, 5], ["AN", 2, 1, 6]]]], "r": [[1.13528e-05, 1.13585e-05, 1.1351e-05], 0, 3.54971, 1667940317], "v": "v0.6"}
{"i": [["[\"mul\", 1, 14, 14, 480]", "cuda -keys=cuda,gpu -max_num_threads=1024 -model=unknown -thread_warp_size=32", [-1, 16, 64, 49152, 2147483647, 1024, 8, 32], "", 0, []], [[], [["FU", 2, [0, 1, 2, 3]], ["SP", 2, 0, 94080, [30], 1], ["AN", 2, 0, 5], ["AN", 2, 1, 6]]]], "r": [[5.01087e-06, 5.01133e-06, 5.01006e-06], 0, 3.33924, 1667940317], "v": "v0.6"}
{"i": [["[\"mul\", 1, 14, 14, 480]", "cuda -keys=cuda,gpu -max_num_threads=1024 -model=unknown -thread_warp_size=32", [-1, 16, 64, 49152, 2147483647, 1024, 8, 32], "", 0, []], [[], [["FU", 2, [0, 1, 2, 3]], ["SP", 2, 0, 94080, [3], 1], ["AN", 2, 0, 5], ["AN", 2, 1, 6]]]], "r": [[2.5948e-05, 2.59402e-05, 2.59496e-05], 0, 4.13577, 1667940318], "v": "v0.6"}
{"i": [["[\"mul\", 1, 14, 14, 480]", "cuda -keys=cuda,gpu -max_num_threads=1024 -model=unknown -thread_warp_size=32", [-1, 16, 64, 49152, 2147483647, 1024, 8, 32], "", 0, []], [[], [["FU", 2, [0, 1, 2, 3]], ["SP", 2, 0, 94080, [24], 1], ["AN", 2, 0, 5], ["AN", 2, 1, 6]]]], "r": [[5.54408e-06, 5.5451e-06, 5.5416e-06], 0, 4.36483, 1667940318], "v": "v0.6"}
{"i": [["[\"mul\", 1, 14, 14, 480]", "cuda -keys=cuda,gpu -max_num_threads=1024 -model=unknown -thread_warp_size=32", [-1, 16, 64, 49152, 2147483647, 1024, 8, 32], "", 0, []], [[], [["FU", 2, [0, 1, 2, 3]], ["SP", 2, 0, 94080, [6], 1], ["AN", 2, 0, 5], ["AN", 2, 1, 6]]]], "r": [[1.43016e-05, 1.42995e-05, 1.43012e-05], 0, 4.64093, 1667940318], "v": "v0.6"}
{"i": [["[\"mul\", 1, 14, 14, 480]", "cuda -keys=cuda,gpu -max_num_threads=1024 -model=unknown -thread_warp_size=32", [-1, 16, 64, 49152, 2147483647, 1024, 8, 32], "", 0, []], [[], [["FU", 2, [0, 1, 2, 3]], ["SP", 2, 0, 94080, [64], 1], ["AN", 2, 0, 5], ["AN", 2, 1, 6]]]], "r": [[3.71477e-06, 3.71394e-06, 3.71531e-06], 0, 4.86019, 1667940319], "v": "v0.6"}
{"i": [["[\"mul\", 1, 14, 14, 480]", "cuda -keys=cuda,gpu -max_num_threads=1024 -model=unknown -thread_warp_size=32", [-1, 16, 64, 49152, 2147483647, 1024, 8, 32], "", 0, []], [[], [["FU", 2, [0, 1, 2, 3]], ["SP", 2, 0, 94080, [21], 1], ["AN", 2, 0, 5], ["AN", 2, 1, 6]]]], "r": [[5.91979e-06, 5.92162e-06, 5.92238e-06], 0, 5.69984, 1667940320], "v": "v0.6"}
{"i": [["[\"mul\", 1, 14, 14, 480]", "cuda -keys=cuda,gpu -max_num_threads=1024 -model=unknown -thread_warp_size=32", [-1, 16, 64, 49152, 2147483647, 1024, 8, 32], "", 0, []], [[], [["FU", 2, [0, 1, 2, 3]], ["SP", 2, 0, 94080, [48], 1], ["AN", 2, 0, 5], ["AN", 2, 1, 6]]]], "r": [[4.04294e-06, 4.04098e-06, 4.04172e-06], 0, 5.10174, 1667940319], "v": "v0.6"}
{"i": [["[\"mul\", 1, 14, 14, 480]", "cuda -keys=cuda,gpu -max_num_threads=1024 -model=unknown -thread_warp_size=32", [-1, 16, 64, 49152, 2147483647, 1024, 8, 32], "", 0, []], [[], [["FU", 2, [0, 1, 2, 3]], ["SP", 2, 0, 94080, [56], 1], ["AN", 2, 0, 5], ["AN", 2, 1, 6]]]], "r": [[3.8962e-06, 3.90234e-06, 3.91293e-06], 0, 5.37575, 1667940319], "v": "v0.6"}
{"i": [["[\"mul\", 1, 14, 14, 480]", "cuda -keys=cuda,gpu -max_num_threads=1024 -model=unknown -thread_warp_size=32", [-1, 16, 64, 49152, 2147483647, 1024, 8, 32], "", 0, []], [[], [["FU", 2, [0, 1, 2, 3]], ["SP", 2, 0, 94080, [7], 1], ["AN", 2, 0, 5], ["AN", 2, 1, 6]]]], "r": [[1.27139e-05, 1.27175e-05, 1.2721e-05], 0, 6.00475, 1667940320], "v": "v0.6"}
{"i": [["[\"mul\", 1, 14, 14, 480]", "cuda -keys=cuda,gpu -max_num_threads=1024 -model=unknown -thread_warp_size=32", [-1, 16, 64, 49152, 2147483647, 1024, 8, 32], "", 0, []], [[], [["FU", 2, [0, 1, 2, 3]], ["SP", 2, 0, 94080, [32], 1], ["AN", 2, 0, 5], ["AN", 2, 1, 6]]]], "r": [[4.93253e-06, 4.92822e-06, 4.93495e-06], 0, 6.32949, 1667940320], "v": "v0.6"}
{"i": [["[\"mul\", 1, 14, 14, 480]", "cuda -keys=cuda,gpu -max_num_threads=1024 -model=unknown -thread_warp_size=32", [-1, 16, 64, 49152, 2147483647, 1024, 8, 32], "", 0, []], [[], [["FU", 2, [0, 1, 2, 3]], ["SP", 2, 0, 94080, [60], 1], ["AN", 2, 0, 5], ["AN", 2, 1, 6]]]], "r": [[3.75058e-06, 3.75116e-06, 3.75217e-06], 0, 6.82132, 1667940321], "v": "v0.6"}
{"i": [["[\"mul\", 1, 14, 14, 480]", "cuda -keys=cuda,gpu -max_num_threads=1024 -model=unknown -thread_warp_size=32", [-1, 16, 64, 49152, 2147483647, 1024, 8, 32], "", 0, []], [[], [["FU", 2, [0, 1, 2, 3]], ["SP", 2, 0, 94080, [40], 1], ["AN", 2, 0, 5], ["AN", 2, 1, 6]]]], "r": [[4.50564e-06, 4.50285e-06, 4.50468e-06], 0, 6.52939, 1667940321], "v": "v0.6"}
{"i": [["[\"mul\", 1, 14, 14, 480]", "cuda -keys=cuda,gpu -max_num_threads=1024 -model=unknown -thread_warp_size=32", [-1, 16, 64, 49152, 2147483647, 1024, 8, 32], "", 0, []], [[], [["FU", 2, [0, 1, 2, 3]], ["SP", 2, 0, 94080, [2], 1], ["AN", 2, 0, 5], ["AN", 2, 1, 6]]]], "r": [[3.75668e-05, 3.75697e-05, 3.75695e-05], 0, 7.02925, 1667940321], "v": "v0.6"}
{"i": [["[\"mul\", 1, 14, 14, 480]", "cuda -keys=cuda,gpu -max_num_threads=1024 -model=unknown -thread_warp_size=32", [-1, 16, 64, 49152, 2147483647, 1024, 8, 32], "", 0, []], [[], [["FU", 2, [0, 1, 2, 3]], ["SP", 2, 0, 94080, [28], 1], ["AN", 2, 0, 5], ["AN", 2, 1, 6]]]], "r": [[5.04794e-06, 5.0492e-06, 5.04733e-06], 0, 3.80892, 1667940317], "v": "v0.6"}
{"i": [["[\"mul\", 1, 14, 14, 480]", "cuda -keys=cuda,gpu -max_num_threads=1024 -model=unknown -thread_warp_size=32", [-1, 16, 64, 49152, 2147483647, 1024, 8, 32], "", 0, []], [[], [["FU", 2, [0, 1, 2, 3]], ["SP", 2, 0, 94080, [4], 1], ["AN", 2, 0, 5], ["AN", 2, 1, 6]]]], "r": [[2.03101e-05, 2.03058e-05, 2.03101e-05], 0, 7.42117, 1667940322], "v": "v0.6"}
{"i": [["[\"mul\", 1, 14, 14, 480]", "cuda -keys=cuda,gpu -max_num_threads=1024 -model=unknown -thread_warp_size=32", [-1, 16, 64, 49152, 2147483647, 1024, 8, 32], "", 0, []], [[], [["FU", 2, [0, 1, 2, 3]], ["SP", 2, 0, 94080, [42], 1], ["AN", 2, 0, 5], ["AN", 2, 1, 6]]]], "r": [[4.18577e-06, 4.18624e-06, 4.18457e-06], 0, 7.92885, 1667940322], "v": "v0.6"}
{"i": [["[\"mul\", 1, 14, 14, 480]", "cuda -keys=cuda,gpu -max_num_threads=1024 -model=unknown -thread_warp_size=32", [-1, 16, 64, 49152, 2147483647, 1024, 8, 32], "", 0, []], [[], [["FU", 2, [0, 1, 2, 3]], ["SP", 2, 0, 94080, [16], 1], ["AN", 2, 0, 5], ["AN", 2, 1, 6]]]], "r": [[6.98119e-06, 6.97784e-06, 6.9822e-06], 0, 7.5954, 1667940322], "v": "v0.6"}
{"i": [["[\"mul\", 1, 14, 14, 480]", "cuda -keys=cuda,gpu -max_num_threads=1024 -model=unknown -thread_warp_size=32", [-1, 16, 64, 49152, 2147483647, 1024, 8, 32], "", 0, []], [[], [["FU", 2, [0, 1, 2, 3]], ["SP", 2, 0, 94080, [5], 1], ["AN", 2, 0, 5], ["AN", 2, 1, 6]]]], "r": [[1.66511e-05, 1.66468e-05, 1.66509e-05], 0, 3.27161, 1667941547], "v": "v0.6"}
{"i": [["[\"mul\", 1, 14, 14, 480]", "cuda -keys=cuda,gpu -max_num_threads=1024 -model=unknown -thread_warp_size=32", [-1, 16, 64, 49152, 2147483647, 1024, 8, 32], "", 0, []], [[], [["FU", 2, [0, 1, 2, 3]], ["SP", 2, 0, 94080, [20], 1], ["AN", 2, 0, 5], ["AN", 2, 1, 6]]]], "r": [[6.3013e-06, 6.3008e-06, 6.29724e-06], 0, 1.28397, 1667941545], "v": "v0.6"}
{"i": [["[\"mul\", 1, 14, 14, 480]", "cuda -keys=cuda,gpu -max_num_threads=1024 -model=unknown -thread_warp_size=32", [-1, 16, 64, 49152, 2147483647, 1024, 8, 32], "", 0, []], [[], [["FU", 2, [0, 1, 2, 3]], ["SP", 2, 0, 94080, [56], 1], ["AN", 2, 0, 5], ["AN", 2, 1, 6]]]], "r": [[3.90102e-06, 3.8957e-06, 3.89888e-06], 0, 0.621635, 1667941544], "v": "v0.6"}
{"i": [["[\"mul\", 1, 14, 14, 480]", "cuda -keys=cuda,gpu -max_num_threads=1024 -model=unknown -thread_warp_size=32", [-1, 16, 64, 49152, 2147483647, 1024, 8, 32], "", 0, []], [[], [["FU", 2, [0, 1, 2, 3]], ["SP", 2, 0, 94080, [49], 1], ["AN", 2, 0, 5], ["AN", 2, 1, 6]]]], "r": [[4.22075e-06, 8.05429e-06, 4.2257e-06], 0, 0.973794, 1667941544], "v": "v0.6"}
{"i": [["[\"mul\", 1, 14, 14, 480]", "cuda -keys=cuda,gpu -max_num_threads=1024 -model=unknown -thread_warp_size=32", [-1, 16, 64, 49152, 2147483647, 1024, 8, 32], "", 0, []], [[], [["FU", 2, [0, 1, 2, 3]], ["SP", 2, 0, 94080, [1], 1], ["AN", 2, 0, 5], ["AN", 2, 1, 6]]]], "r": [[7.24883e-05, 7.24746e-05, 7.24645e-05], 0, 1.56735, 1667941545], "v": "v0.6"}
{"i": [["[\"mul\", 1, 14, 14, 480]", "cuda -keys=cuda,gpu -max_num_threads=1024 -model=unknown -thread_warp_size=32", [-1, 16, 64, 49152, 2147483647, 1024, 8, 32], "", 0, []], [[], [["FU", 2, [0, 1, 2, 3]], ["SP", 2, 0, 94080, [3], 1], ["AN", 2, 0, 5], ["AN", 2, 1, 6]]]], "r": [[2.60017e-05, 2.60017e-05, 2.59951e-05], 0, 2.15772, 1667941546], "v": "v0.6"}
{"i": [["[\"mul\", 1, 14, 14, 480]", "cuda -keys=cuda,gpu -max_num_threads=1024 -model=unknown -thread_warp_size=32", [-1, 16, 64, 49152, 2147483647, 1024, 8, 32], "", 0, []], [[], [["FU", 2, [0, 1, 2, 3]], ["SP", 2, 0, 94080, [6], 1], ["AN", 2, 0, 5], ["AN", 2, 1, 6]]]], "r": [[1.44335e-05, 1.44296e-05, 1.44402e-05], 0, 1.88733, 1667941545], "v": "v0.6"}
{"i": [["[\"mul\", 1, 14, 14, 480]", "cuda -keys=cuda,gpu -max_num_threads=1024 -model=unknown -thread_warp_size=32", [-1, 16, 64, 49152, 2147483647, 1024, 8, 32], "", 0, []], [[], [["FU", 2, [0, 1, 2, 3]], ["SP", 2, 0, 94080, [16], 1], ["AN", 2, 0, 5], ["AN", 2, 1, 6]]]], "r": [[6.96105e-06, 6.96077e-06, 6.95882e-06], 0, 2.92068, 1667941547], "v": "v0.6"}
{"i": [["[\"mul\", 1, 14, 14, 480]", "cuda -keys=cuda,gpu -max_num_threads=1024 -model=unknown -thread_warp_size=32", [-1, 16, 64, 49152, 2147483647, 1024, 8, 32], "", 0, []], [[], [["FU", 2, [0, 1, 2, 3]], ["SP", 2, 0, 94080, [10], 1], ["AN", 2, 0, 5], ["AN", 2, 1, 6]]]], "r": [[9.68513e-06, 9.68465e-06, 9.68264e-06], 0, 3.83448, 1667941548], "v": "v0.6"}
{"i": [["[\"mul\", 1, 14, 14, 480]", "cuda -keys=cuda,gpu -max_num_threads=1024 -model=unknown -thread_warp_size=32", [-1, 16, 64, 49152, 2147483647, 1024, 8, 32], "", 0, []], [[], [["FU", 2, [0, 1, 2, 3]], ["SP", 2, 0, 94080, [21], 1], ["AN", 2, 0, 5], ["AN", 2, 1, 6]]]], "r": [[5.97013e-06, 5.96921e-06, 5.97122e-06], 0, 2.47873, 1667941546], "v": "v0.6"}
{"i": [["[\"mul\", 1, 14, 14, 480]", "cuda -keys=cuda,gpu -max_num_threads=1024 -model=unknown -thread_warp_size=32", [-1, 16, 64, 49152, 2147483647, 1024, 8, 32], "", 0, []], [[], [["FU", 2, [0, 1, 2, 3]], ["SP", 2, 0, 94080, [12], 1], ["AN", 2, 0, 5], ["AN", 2, 1, 6]]]], "r": [[8.59627e-06, 8.58626e-06, 8.58917e-06], 0, 4.18276, 1667941548], "v": "v0.6"}
{"i": [["[\"mul\", 1, 14, 14, 480]", "cuda -keys=cuda,gpu -max_num_threads=1024 -model=unknown -thread_warp_size=32", [-1, 16, 64, 49152, 2147483647, 1024, 8, 32], "", 0, []], [[], [["FU", 2, [0, 1, 2, 3]], ["SP", 2, 0, 94080, [30], 1], ["AN", 2, 0, 5], ["AN", 2, 1, 6]]]], "r": [[4.98986e-06, 4.98969e-06, 4.99063e-06], 0, 2.58855, 1667941546], "v": "v0.6"}
{"i": [["[\"mul\", 1, 14, 14, 480]", "cuda -keys=cuda,gpu -max_num_threads=1024 -model=unknown -thread_warp_size=32", [-1, 16, 64, 49152, 2147483647, 1024, 8, 32], "", 0, []], [[], [["FU", 2, [0, 1, 2, 3]], ["SP", 2, 0, 94080, [40], 1], ["AN", 2, 0, 5], ["AN", 2, 1, 6]]]], "r": [[4.45283e-06, 4.45127e-06, 4.45094e-06], 0, 4.63129, 1667941549], "v": "v0.6"}
{"i": [["[\"mul\", 1, 14, 14, 480]", "cuda -keys=cuda,gpu -max_num_threads=1024 -model=unknown -thread_warp_size=32", [-1, 16, 64, 49152, 2147483647, 1024, 8, 32], "", 0, []], [[], [["FU", 2, [0, 1, 2, 3]], ["SP", 2, 0, 94080, [32], 1], ["AN", 2, 0, 5], ["AN", 2, 1, 6]]]], "r": [[4.77915e-06, 4.77486e-06, 4.77882e-06], 0, 4.37281, 1667941548], "v": "v0.6"}
{"i": [["[\"mul\", 1, 14, 14, 480]", "cuda -keys=cuda,gpu -max_num_threads=1024 -model=unknown -thread_warp_size=32", [-1, 16, 64, 49152, 2147483647, 1024, 8, 32], "", 0, []], [[], [["FU", 2, [0, 1, 2, 3]], ["SP", 2, 0, 94080, [64], 1], ["AN", 2, 0, 5], ["AN", 2, 1, 6]]]], "r": [[3.60669e-06, 3.6076e-06, 3.60732e-06], 0, 4.92675, 1667941549], "v": "v0.6"}
{"i": [["[\"mul\", 1, 14, 14, 480]", "cuda -keys=cuda,gpu -max_num_threads=1024 -model=unknown -thread_warp_size=32", [-1, 16, 64, 49152, 2147483647, 1024, 8, 32], "", 0, []], [[], [["FU", 2, [0, 1, 2, 3]], ["SP", 2, 0, 94080, [8], 1], ["AN", 2, 0, 5], ["AN", 2, 1, 6]]]], "r": [[1.14506e-05, 1.14559e-05, 1.14479e-05], 0, 5.18864, 1667941549], "v": "v0.6"}
{"i": [["[\"mul\", 1, 14, 14, 480]", "cuda -keys=cuda,gpu -max_num_threads=1024 -model=unknown -thread_warp_size=32", [-1, 16, 64, 49152, 2147483647, 1024, 8, 32], "", 0, []], [[], [["FU", 2, [0, 1, 2, 3]], ["SP", 2, 0, 94080, [2], 1], ["AN", 2, 0, 5], ["AN", 2, 1, 6]]]], "r": [[3.75755e-05, 3.75697e-05, 3.75783e-05], 0, 5.44524, 1667941550], "v": "v0.6"}
{"i": [["[\"mul\", 1, 14, 14, 480]", "cuda -keys=cuda,gpu -max_num_threads=1024 -model=unknown -thread_warp_size=32", [-1, 16, 64, 49152, 2147483647, 1024, 8, 32], "", 0, []], [[], [["FU", 2, [0, 1, 2, 3]], ["SP", 2, 0, 94080, [35], 1], ["AN", 2, 0, 5], ["AN", 2, 1, 6]]]], "r": [[4.69509e-06, 4.69224e-06, 4.69192e-06], 0, 5.69713, 1667941550], "v": "v0.6"}
{"i": [["[\"mul\", 1, 14, 14, 480]", "cuda -keys=cuda,gpu -max_num_threads=1024 -model=unknown -thread_warp_size=32", [-1, 16, 64, 49152, 2147483647, 1024, 8, 32], "", 0, []], [[], [["FU", 2, [0, 1, 2, 3]], ["SP", 2, 0, 94080, [48], 1], ["AN", 2, 0, 5], ["AN", 2, 1, 6]]]], "r": [[4.15717e-06, 4.14899e-06, 4.15631e-06], 0, 6.07719, 1667941550], "v": "v0.6"}
{"i": [["[\"mul\", 1, 14, 14, 480]", "cuda -keys=cuda,gpu -max_num_threads=1024 -model=unknown -thread_warp_size=32", [-1, 16, 64, 49152, 2147483647, 1024, 8, 32], "", 0, []], [[], [["FU", 2, [0, 1, 2, 3]], ["SP", 2, 0, 94080, [4], 1], ["AN", 2, 0, 5], ["AN", 2, 1, 6]]]], "r": [[2.01746e-05, 2.01732e-05, 2.01778e-05], 0, 6.30912, 1667941551], "v": "v0.6"}
{"i": [["[\"mul\", 1, 14, 14, 480]", "cuda -keys=cuda,gpu -max_num_threads=1024 -model=unknown -thread_warp_size=32", [-1, 16, 64, 49152, 2147483647, 1024, 8, 32], "", 0, []], [[], [["FU", 2, [0, 1, 2, 3]], ["SP", 2, 0, 94080, [42], 1], ["AN", 2, 0, 5], ["AN", 2, 1, 6]]]], "r": [[4.22182e-06, 4.22155e-06, 4.22274e-06], 0, 3.5808, 1667941547], "v": "v0.6"}
{"i": [["[\"mul\", 1, 14, 14, 480]", "cuda -keys=cuda,gpu -max_num_threads=1024 -model=unknown -thread_warp_size=32", [-1, 16, 64, 49152, 2147483647, 1024, 8, 32], "", 0, []], [[], [["FU", 2, [0, 1, 2, 3]], ["SP", 2, 0, 94080, [24], 1], ["AN", 2, 0, 5], ["AN", 2, 1, 6]]]], "r": [[5.56709e-06, 5.56299e-06, 5.56157e-06], 0, 6.51849, 1667941551], "v": "v0.6"}
{"i": [["[\"mul\", 1, 14, 14, 480]", "cuda -keys=cuda,gpu -max_num_threads=1024 -model=unknown -thread_warp_size=32", [-1, 16, 64, 49152, 2147483647, 1024, 8, 32], "", 0, []], [[], [["FU", 2, [0, 1, 2, 3]], ["SP", 2, 0, 94080, [60], 1], ["AN", 2, 0, 5], ["AN", 2, 1, 6]]]], "r": [[3.97941e-06, 3.97779e-06, 3.98301e-06], 0, 6.771, 1667941551], "v": "v0.6"}
{"i": [["[\"mul\", 1, 14, 14, 480]", "cuda -keys=cuda,gpu -max_num_threads=1024 -model=unknown -thread_warp_size=32", [-1, 16, 64, 49152, 2147483647, 1024, 8, 32], "", 0, []], [[], [["FU", 2, [0, 1, 2, 3]], ["SP", 2, 0, 94080, [15], 1], ["AN", 2, 0, 5], ["AN", 2, 1, 6]]]], "r": [[7.34062e-06, 7.3317e-06, 7.32912e-06], 0, 7.12714, 1667941552], "v": "v0.6"}
{"i": [["[\"mul\", 1, 14, 14, 480]", "cuda -keys=cuda,gpu -max_num_threads=1024 -model=unknown -thread_warp_size=32", [-1, 16, 64, 49152, 2147483647, 1024, 8, 32], "", 0, []], [[], [["FU", 2, [0, 1, 2, 3]], ["SP", 2, 0, 94080, [14], 1], ["AN", 2, 0, 5], ["AN", 2, 1, 6]]]], "r": [[7.62703e-06, 7.63116e-06, 7.62755e-06], 0, 7.29314, 1667941552], "v": "v0.6"}
{"i": [["[\"mul\", 1, 14, 14, 480]", "cuda -keys=cuda,gpu -max_num_threads=1024 -model=unknown -thread_warp_size=32", [-1, 16, 64, 49152, 2147483647, 1024, 8, 32], "", 0, []], [[], [["FU", 2, [0, 1, 2, 3]], ["SP", 2, 0, 94080, [7], 1], ["AN", 2, 0, 5], ["AN", 2, 1, 6]]]], "r": [[1.26893e-05, 1.26886e-05, 1.26891e-05], 0, 7.58034, 1667941552], "v": "v0.6"}
{"i": [["[\"mul\", 1, 14, 14, 480]", "cuda -keys=cuda,gpu -max_num_threads=1024 -model=unknown -thread_warp_size=32", [-1, 16, 64, 49152, 2147483647, 1024, 8, 32], "", 0, []], [[], [["FU", 2, [0, 1, 2, 3]], ["SP", 2, 0, 94080, [28], 1], ["AN", 2, 0, 5], ["AN", 2, 1, 6]]]], "r": [[5.09288e-06, 5.09589e-06, 5.0958e-06], 0, 7.86607, 1667941553], "v": "v0.6"}
{"i": [["[\"mul\", 1, 14, 14, 480]", "cuda -keys=cuda,gpu -max_num_threads=1024 -model=unknown -thread_warp_size=32", [-1, 16, 64, 49152, 2147483647, 1024, 8, 32], "", 0, []], [[], [["FU", 2, [0, 1, 2, 3]], ["SP", 2, 0, 94080, [16], 1], ["AN", 2, 0, 5], ["AN", 2, 1, 6]]]], "r": [[7.13343e-06, 7.13022e-06, 7.12402e-06], 0, 2.22563, 1667941621], "v": "v0.6"}
{"i": [["[\"mul\", 1, 14, 14, 480]", "cuda -keys=cuda,gpu -max_num_threads=1024 -model=unknown -thread_warp_size=32", [-1, 16, 64, 49152, 2147483647, 1024, 8, 32], "", 0, []], [[], [["FU", 2, [0, 1, 2, 3]], ["SP", 2, 0, 94080, [2], 1], ["AN", 2, 0, 5], ["AN", 2, 1, 6]]]], "r": [[3.76536e-05, 3.76575e-05, 3.76514e-05], 0, 0.949973, 1667941620], "v": "v0.6"}
{"i": [["[\"mul\", 1, 14, 14, 480]", "cuda -keys=cuda,gpu -max_num_threads=1024 -model=unknown -thread_warp_size=32", [-1, 16, 64, 49152, 2147483647, 1024, 8, 32], "", 0, []], [[], [["FU", 2, [0, 1, 2, 3]], ["SP", 2, 0, 94080, [10], 1], ["AN", 2, 0, 5], ["AN", 2, 1, 6]]]], "r": [[9.68042e-06, 9.67624e-06, 9.67591e-06], 0, 3.05528, 1667941622], "v": "v0.6"}
{"i": [["[\"mul\", 1, 14, 14, 480]", "cuda -keys=cuda,gpu -max_num_threads=1024 -model=unknown -thread_warp_size=32", [-1, 16, 64, 49152, 2147483647, 1024, 8, 32], "", 0, []], [[], [["FU", 2, [0, 1, 2, 3]], ["SP", 2, 0, 94080, [4], 1], ["AN", 2, 0, 5], ["AN", 2, 1, 6]]]], "r": [[2.01787e-05, 2.0181e-05, 2.01781e-05], 0, 1.29759, 1667941620], "v": "v0.6"}
{"i": [["[\"mul\", 1, 14, 14, 480]", "cuda -keys=cuda,gpu -max_num_threads=1024 -model=unknown -thread_warp_size=32", [-1, 16, 64, 49152, 2147483647, 1024, 8, 32], "", 0, []], [[], [["FU", 2, [0, 1, 2, 3]], ["SP", 2, 0, 94080, [42], 1], ["AN", 2, 0, 5], ["AN", 2, 1, 6]]]], "r": [[4.32322e-06, 4.31658e-06, 4.32064e-06], 0, 1.92864, 1667941621], "v": "v0.6"}
{"i": [["[\"mul\", 1, 14, 14, 480]", "cuda -keys=cuda,gpu -max_num_threads=1024 -model=unknown -thread_warp_size=32", [-1, 16, 64, 49152, 2147483647, 1024, 8, 32], "", 0, []], [[], [["FU", 2, [0, 1, 2, 3]], ["SP", 2, 0, 94080, [12], 1], ["AN", 2, 0, 5], ["AN", 2, 1, 6]]]], "r": [[8.67646e-06, 8.67692e-06, 8.66859e-06], 0, 0.593803, 1667941620], "v": "v0.6"}
{"i": [["[\"mul\", 1, 14, 14, 480]", "cuda -keys=cuda,gpu -max_num_threads=1024 -model=unknown -thread_warp_size=32", [-1, 16, 64, 49152, 2147483647, 1024, 8, 32], "", 0, []], [[], [["FU", 2, [0, 1, 2, 3]], ["SP", 2, 0, 94080, [32], 1], ["AN", 2, 0, 5], ["AN", 2, 1, 6]]]], "r": [[4.9601e-06, 4.95943e-06, 4.95696e-06], 0, 1.65461, 1667941621], "v": "v0.6"}
{"i": [["[\"mul\", 1, 14, 14, 480]", "cuda -keys=cuda,gpu -max_num_threads=1024 -model=unknown -thread_warp_size=32", [-1, 16, 64, 49152, 2147483647, 1024, 8, 32], "", 0, []], [[], [["FU", 2, [0, 1, 2, 3]], ["SP", 2, 0, 94080, [56], 1], ["AN", 2, 0, 5], ["AN", 2, 1, 6]]]], "r": [[3.75612e-06, 3.75799e-06, 3.7578e-06], 0, 3.40323, 1667941623], "v": "v0.6"}
{"i": [["[\"mul\", 1, 14, 14, 480]", "cuda -keys=cuda,gpu -max_num_threads=1024 -model=unknown -thread_warp_size=32", [-1, 16, 64, 49152, 2147483647, 1024, 8, 32], "", 0, []], [[], [["FU", 2, [0, 1, 2, 3]], ["SP", 2, 0, 94080, [20], 1], ["AN", 2, 0, 5], ["AN", 2, 1, 6]]]], "r": [[6.1739e-06, 6.17451e-06, 6.17824e-06], 0, 2.82234, 1667941622], "v": "v0.6"}
{"i": [["[\"mul\", 1, 14, 14, 480]", "cuda -keys=cuda,gpu -max_num_threads=1024 -model=unknown -thread_warp_size=32", [-1, 16, 64, 49152, 2147483647, 1024, 8, 32], "", 0, []], [[], [["FU", 2, [0, 1, 2, 3]], ["SP", 2, 0, 94080, [15], 1], ["AN", 2, 0, 5], ["AN", 2, 1, 6]]]], "r": [[7.32709e-06, 7.33568e-06, 7.32695e-06], 0, 2.5251, 1667941622], "v": "v0.6"}
{"i": [["[\"mul\", 1, 14, 14, 480]", "cuda -keys=cuda,gpu -max_num_threads=1024 -model=unknown -thread_warp_size=32", [-1, 16, 64, 49152, 2147483647, 1024, 8, 32], "", 0, []], [[], [["FU", 2, [0, 1, 2, 3]], ["SP", 2, 0, 94080, [49], 1], ["AN", 2, 0, 5], ["AN", 2, 1, 6]]]], "r": [[4.21733e-06, 4.22215e-06, 4.22466e-06], 0, 3.69078, 1667941623], "v": "v0.6"}
{"i": [["[\"mul\", 1, 14, 14, 480]", "cuda -keys=cuda,gpu -max_num_threads=1024 -model=unknown -thread_warp_size=32", [-1, 16, 64, 49152, 2147483647, 1024, 8, 32], "", 0, []], [[], [["FU", 2, [0, 1, 2, 3]], ["SP", 2, 0, 94080, [64], 1], ["AN", 2, 0, 5], ["AN", 2, 1, 6]]]], "r": [[3.85182e-06, 3.8505e-06, 3.85286e-06], 0, 3.91729, 1667941623], "v": "v0.6"}
{"i": [["[\"mul\", 1, 14, 14, 480]", "cuda -keys=cuda,gpu -max_num_threads=1024 -model=unknown -thread_warp_size=32", [-1, 16, 64, 49152, 2147483647, 1024, 8, 32], "", 0, []], [[], [["FU", 2, [0, 1, 2, 3]], ["SP", 2, 0, 94080, [3], 1], ["AN", 2, 0, 5], ["AN", 2, 1, 6]]]], "r": [[2.60054e-05, 2.6001e-05, 2.59905e-05], 0, 4.46227, 1667941624], "v": "v0.6"}
{"i": [["[\"mul\", 1, 14, 14, 480]", "cuda -keys=cuda,gpu -max_num_threads=1024 -model=unknown -thread_warp_size=32", [-1, 16, 64, 49152, 2147483647, 1024, 8, 32], "", 0, []], [[], [["FU", 2, [0, 1, 2, 3]], ["SP", 2, 0, 94080, [6], 1], ["AN", 2, 0, 5], ["AN", 2, 1, 6]]]], "r": [[1.43577e-05, 1.43587e-05, 1.43597e-05], 0, 4.68966, 1667941624], "v": "v0.6"}
{"i": [["[\"mul\", 1, 14, 14, 480]", "cuda -keys=cuda,gpu -max_num_threads=1024 -model=unknown -thread_warp_size=32", [-1, 16, 64, 49152, 2147483647, 1024, 8, 32], "", 0, []], [[], [["FU", 2, [0, 1, 2, 3]], ["SP", 2, 0, 94080, [40], 1], ["AN", 2, 0, 5], ["AN", 2, 1, 6]]]], "r": [[4.23293e-06, 4.2366e-06, 4.23828e-06], 0, 4.98918, 1667941625], "v": "v0.6"}
{"i": [["[\"mul\", 1, 14, 14, 480]", "cuda -keys=cuda,gpu -max_num_threads=1024 -model=unknown -thread_warp_size=32", [-1, 16, 64, 49152, 2147483647, 1024, 8, 32], "", 0, []], [[], [["FU", 2, [0, 1, 2, 3]], ["SP", 2, 0, 94080, [14], 1], ["AN", 2, 0, 5], ["AN", 2, 1, 6]]]], "r": [[7.75128e-06, 7.73728e-06, 7.74428e-06], 0, 5.24964, 1667941625], "v": "v0.6"}
{"i": [["[\"mul\", 1, 14, 14, 480]", "cuda -keys=cuda,gpu -max_num_threads=1024 -model=unknown -thread_warp_size=32", [-1, 16, 64, 49152, 2147483647, 1024, 8, 32], "", 0, []], [[], [["FU", 2, [0, 1, 2, 3]], ["SP", 2, 0, 94080, [60], 1], ["AN", 2, 0, 5], ["AN", 2, 1, 6]]]], "r": [[3.78369e-06, 3.78314e-06, 3.78509e-06], 0, 5.81972, 1667941626], "v": "v0.6"}
{"i": [["[\"mul\", 1, 14, 14, 480]", "cuda -keys=cuda,gpu -max_num_threads=1024 -model=unknown -thread_warp_size=32", [-1, 16, 64, 49152, 2147483647, 1024, 8, 32], "", 0, []], [[], [["FU", 2, [0, 1, 2, 3]], ["SP", 2, 0, 94080, [28], 1], ["AN", 2, 0, 5], ["AN", 2, 1, 6]]]], "r": [[5.19004e-06, 5.19393e-06, 5.19994e-06], 0, 5.47041, 1667941625], "v": "v0.6"}
{"i": [["[\"mul\", 1, 14, 14, 480]", "cuda -keys=cuda,gpu -max_num_threads=1024 -model=unknown -thread_warp_size=32", [-1, 16, 64, 49152, 2147483647, 1024, 8, 32], "", 0, []], [[], [["FU", 2, [0, 1, 2, 3]], ["SP", 2, 0, 94080, [8], 1], ["AN", 2, 0, 5], ["AN", 2, 1, 6]]]], "r": [[1.14323e-05, 1.14275e-05, 1.14308e-05], 0, 6.01349, 1667941626], "v": "v0.6"}
{"i": [["[\"mul\", 1, 14, 14, 480]", "cuda -keys=cuda,gpu -max_num_threads=1024 -model=unknown -thread_warp_size=32", [-1, 16, 64, 49152, 2147483647, 1024, 8, 32], "", 0, []], [[], [["FU", 2, [0, 1, 2, 3]], ["SP", 2, 0, 94080, [48], 1], ["AN", 2, 0, 5], ["AN", 2, 1, 6]]]], "r": [[4.01868e-06, 4.01578e-06, 4.01964e-06], 0, 6.33499, 1667941626], "v": "v0.6"}
{"i": [["[\"mul\", 1, 14, 14, 480]", "cuda -keys=cuda,gpu -max_num_threads=1024 -model=unknown -thread_warp_size=32", [-1, 16, 64, 49152, 2147483647, 1024, 8, 32], "", 0, []], [[], [["FU", 2, [0, 1, 2, 3]], ["SP", 2, 0, 94080, [1], 1], ["AN", 2, 0, 5], ["AN", 2, 1, 6]]]], "r": [[7.2417e-05, 7.24226e-05, 7.24088e-05], 0, 6.58782, 1667941627], "v": "v0.6"}
{"i": [["[\"mul\", 1, 14, 14, 480]", "cuda -keys=cuda,gpu -max_num_threads=1024 -model=unknown -thread_warp_size=32", [-1, 16, 64, 49152, 2147483647, 1024, 8, 32], "", 0, []], [[], [["FU", 2, [0, 1, 2, 3]], ["SP", 2, 0, 94080, [5], 1], ["AN", 2, 0, 5], ["AN", 2, 1, 6]]]], "r": [[1.68357e-05, 1.68401e-05, 1.68385e-05], 0, 4.26021, 1667941624], "v": "v0.6"}
{"i": [["[\"mul\", 1, 14, 14, 480]", "cuda -keys=cuda,gpu -max_num_threads=1024 -model=unknown -thread_warp_size=32", [-1, 16, 64, 49152, 2147483647, 1024, 8, 32], "", 0, []], [[], [["FU", 2, [0, 1, 2, 3]], ["SP", 2, 0, 94080, [30], 1], ["AN", 2, 0, 5], ["AN", 2, 1, 6]]]], "r": [[4.92969e-06, 4.93225e-06, 4.92878e-06], 0, 6.97157, 1667941627], "v": "v0.6"}
{"i": [["[\"mul\", 1, 14, 14, 480]", "cuda -keys=cuda,gpu -max_num_threads=1024 -model=unknown -thread_warp_size=32", [-1, 16, 64, 49152, 2147483647, 1024, 8, 32], "", 0, []], [[], [["FU", 2, [0, 1, 2, 3]], ["SP", 2, 0, 94080, [24], 1], ["AN", 2, 0, 5], ["AN", 2, 1, 6]]]], "r": [[5.65357e-06, 5.65799e-06, 5.65422e-06], 0, 7.1786, 1667941627], "v": "v0.6"}
{"i": [["[\"mul\", 1, 14, 14, 480]", "cuda -keys=cuda,gpu -max_num_threads=1024 -model=unknown -thread_warp_size=32", [-1, 16, 64, 49152, 2147483647, 1024, 8, 32], "", 0, []], [[], [["FU", 2, [0, 1, 2, 3]], ["SP", 2, 0, 94080, [7], 1], ["AN", 2, 0, 5], ["AN", 2, 1, 6]]]], "r": [[1.26996e-05, 1.2698e-05, 1.26929e-05], 0, 7.40297, 1667941628], "v": "v0.6"}
{"i": [["[\"mul\", 1, 14, 14, 480]", "cuda -keys=cuda,gpu -max_num_threads=1024 -model=unknown -thread_warp_size=32", [-1, 16, 64, 49152, 2147483647, 1024, 8, 32], "", 0, []], [[], [["FU", 2, [0, 1, 2, 3]], ["SP", 2, 0, 94080, [35], 1], ["AN", 2, 0, 5], ["AN", 2, 1, 6]]]], "r": [[4.56889e-06, 4.57234e-06, 4.57413e-06], 0, 7.65164, 1667941628], "v": "v0.6"}
{"i": [["[\"mul\", 1, 14, 14, 480]", "cuda -keys=cuda,gpu -max_num_threads=1024 -model=unknown -thread_warp_size=32", [-1, 16, 64, 49152, 2147483647, 1024, 8, 32], "", 0, []], [[], [["FU", 2, [0, 1, 2, 3]], ["SP", 2, 0, 94080, [21], 1], ["AN", 2, 0, 5], ["AN", 2, 1, 6]]]], "r": [[5.97045e-06, 5.96874e-06, 5.96674e-06], 0, 8.02999, 1667941628], "v": "v0.6"}
{"i": [["[\"mul\", 1, 14, 14, 480]", "cuda -keys=cuda,gpu -max_num_threads=1024 -model=unknown -thread_warp_size=32", [-1, 16, 64, 49152, 2147483647, 1024, 8, 32], "", 0, []], [[], [["FU", 2, [0, 1, 2, 3]], ["SP", 2, 0, 94080, [14], 1], ["AN", 2, 0, 5], ["AN", 2, 1, 6]]]], "r": [[7.57439e-06, 7.57754e-06, 7.57621e-06], 0, 2.8136, 1667941810], "v": "v0.6"}
{"i": [["[\"mul\", 1, 14, 14, 480]", "cuda -keys=cuda,gpu -max_num_threads=1024 -model=unknown -thread_warp_size=32", [-1, 16, 64, 49152, 2147483647, 1024, 8, 32], "", 0, []], [[], [["FU", 2, [0, 1, 2, 3]], ["SP", 2, 0, 94080, [8], 1], ["AN", 2, 0, 5], ["AN", 2, 1, 6]]]], "r": [[1.13508e-05, 1.13515e-05, 1.1355e-05], 0, 2.22097, 1667941809], "v": "v0.6"}
{"i": [["[\"mul\", 1, 14, 14, 480]", "cuda -keys=cuda,gpu -max_num_threads=1024 -model=unknown -thread_warp_size=32", [-1, 16, 64, 49152, 2147483647, 1024, 8, 32], "", 0, []], [[], [["FU", 2, [0, 1, 2, 3]], ["SP", 2, 0, 94080, [30], 1], ["AN", 2, 0, 5], ["AN", 2, 1, 6]]]], "r": [[4.99835e-06, 4.99887e-06, 4.99172e-06], 0, 1.84158, 1667941809], "v": "v0.6"}
{"i": [["[\"mul\", 1, 14, 14, 480]", "cuda -keys=cuda,gpu -max_num_threads=1024 -model=unknown -thread_warp_size=32", [-1, 16, 64, 49152, 2147483647, 1024, 8, 32], "", 0, []], [[], [["FU", 2, [0, 1, 2, 3]], ["SP", 2, 0, 94080, [16], 1], ["AN", 2, 0, 5], ["AN", 2, 1, 6]]]], "r": [[6.97084e-06, 6.9757e-06, 6.97319e-06], 0, 1.66412, 1667941809], "v": "v0.6"}
{"i": [["[\"mul\", 1, 14, 14, 480]", "cuda -keys=cuda,gpu -max_num_threads=1024 -model=unknown -thread_warp_size=32", [-1, 16, 64, 49152, 2147483647, 1024, 8, 32], "", 0, []], [[], [["FU", 2, [0, 1, 2, 3]], ["SP", 2, 0, 94080, [64], 1], ["AN", 2, 0, 5], ["AN", 2, 1, 6]]]], "r": [[3.63416e-06, 3.63164e-06, 3.63221e-06], 0, 0.988375, 1667941808], "v": "v0.6"}
{"i": [["[\"mul\", 1, 14, 14, 480]", "cuda -keys=cuda,gpu -max_num_threads=1024 -model=unknown -thread_warp_size=32", [-1, 16, 64, 49152, 2147483647, 1024, 8, 32], "", 0, []], [[], [["FU", 2, [0, 1, 2, 3]], ["SP", 2, 0, 94080, [35], 1], ["AN", 2, 0, 5], ["AN", 2, 1, 6]]]], "r": [[4.60364e-06, 4.60306e-06, 4.60071e-06], 0, 1.33359, 1667941808], "v": "v0.6"}
{"i": [["[\"mul\", 1, 14, 14, 480]", "cuda -keys=cuda,gpu -max_num_threads=1024 -model=unknown -thread_warp_size=32", [-1, 16, 64, 49152, 2147483647, 1024, 8, 32], "", 0, []], [[], [["FU", 2, [0, 1, 2, 3]], ["SP", 2, 0, 94080, [56], 1], ["AN", 2, 0, 5], ["AN", 2, 1, 6]]]], "r": [[3.75746e-06, 3.75854e-06, 3.75785e-06], 0, 0.690265, 1667941808], "v": "v0.6"}
{"i": [["[\"mul\", 1, 14, 14, 480]", "cuda -keys=cuda,gpu -max_num_threads=1024 -model=unknown -thread_warp_size=32", [-1, 16, 64, 49152, 2147483647, 1024, 8, 32], "", 0, []], [[], [["FU", 2, [0, 1, 2, 3]], ["SP", 2, 0, 94080, [4], 1], ["AN", 2, 0, 5], ["AN", 2, 1, 6]]]], "r": [[2.03543e-05, 2.03564e-05, 2.03562e-05], 0, 2.53307, 1667941810], "v": "v0.6"}
{"i": [["[\"mul\", 1, 14, 14, 480]", "cuda -keys=cuda,gpu -max_num_threads=1024 -model=unknown -thread_warp_size=32", [-1, 16, 64, 49152, 2147483647, 1024, 8, 32], "", 0, []], [[], [["FU", 2, [0, 1, 2, 3]], ["SP", 2, 0, 94080, [3], 1], ["AN", 2, 0, 5], ["AN", 2, 1, 6]]]], "r": [[2.59568e-05, 2.5956e-05, 2.59585e-05], 0, 3.42126, 1667941811], "v": "v0.6"}
{"i": [["[\"mul\", 1, 14, 14, 480]", "cuda -keys=cuda,gpu -max_num_threads=1024 -model=unknown -thread_warp_size=32", [-1, 16, 64, 49152, 2147483647, 1024, 8, 32], "", 0, []], [[], [["FU", 2, [0, 1, 2, 3]], ["SP", 2, 0, 94080, [28], 1], ["AN", 2, 0, 5], ["AN", 2, 1, 6]]]], "r": [[5.16519e-06, 5.16716e-06, 5.1641e-06], 0, 3.09266, 1667941810], "v": "v0.6"}
{"i": [["[\"mul\", 1, 14, 14, 480]", "cuda -keys=cuda,gpu -max_num_threads=1024 -model=unknown -thread_warp_size=32", [-1, 16, 64, 49152, 2147483647, 1024, 8, 32], "", 0, []], [[], [["FU", 2, [0, 1, 2, 3]], ["SP", 2, 0, 94080, [1], 1], ["AN", 2, 0, 5], ["AN", 2, 1, 6]]]], "r": [[7.24324e-05, 7.24408e-05, 7.24439e-05], 0, 3.93662, 1667941811], "v": "v0.6"}
{"i": [["[\"mul\", 1, 14, 14, 480]", "cuda -keys=cuda,gpu -max_num_threads=1024 -model=unknown -thread_warp_size=32", [-1, 16, 64, 49152, 2147483647, 1024, 8, 32], "", 0, []], [[], [["FU", 2, [0, 1, 2, 3]], ["SP", 2, 0, 94080, [24], 1], ["AN", 2, 0, 5], ["AN", 2, 1, 6]]]], "r": [[5.63633e-06, 5.64033e-06, 5.63356e-06], 0, 4.16802, 1667941812], "v": "v0.6"}
{"i": [["[\"mul\", 1, 14, 14, 480]", "cuda -keys=cuda,gpu -max_num_threads=1024 -model=unknown -thread_warp_size=32", [-1, 16, 64, 49152, 2147483647, 1024, 8, 32], "", 0, []], [[], [["FU", 2, [0, 1, 2, 3]], ["SP", 2, 0, 94080, [15], 1], ["AN", 2, 0, 5], ["AN", 2, 1, 6]]]], "r": [[7.31043e-06, 7.31165e-06, 7.31101e-06], 0, 4.49341, 1667941812], "v": "v0.6"}
{"i": [["[\"mul\", 1, 14, 14, 480]", "cuda -keys=cuda,gpu -max_num_threads=1024 -model=unknown -thread_warp_size=32", [-1, 16, 64, 49152, 2147483647, 1024, 8, 32], "", 0, []], [[], [["FU", 2, [0, 1, 2, 3]], ["SP", 2, 0, 94080, [7], 1], ["AN", 2, 0, 5], ["AN", 2, 1, 6]]]], "r": [[1.27894e-05, 1.27818e-05, 1.27865e-05], 0, 4.73796, 1667941812], "v": "v0.6"}
{"i": [["[\"mul\", 1, 14, 14, 480]", "cuda -keys=cuda,gpu -max_num_threads=1024 -model=unknown -thread_warp_size=32", [-1, 16, 64, 49152, 2147483647, 1024, 8, 32], "", 0, []], [[], [["FU", 2, [0, 1, 2, 3]], ["SP", 2, 0, 94080, [40], 1], ["AN", 2, 0, 5], ["AN", 2, 1, 6]]]], "r": [[4.29106e-06, 4.28527e-06, 4.29044e-06], 0, 4.94331, 1667941813], "v": "v0.6"}
{"i": [["[\"mul\", 1, 14, 14, 480]", "cuda -keys=cuda,gpu -max_num_threads=1024 -model=unknown -thread_warp_size=32", [-1, 16, 64, 49152, 2147483647, 1024, 8, 32], "", 0, []], [[], [["FU", 2, [0, 1, 2, 3]], ["SP", 2, 0, 94080, [10], 1], ["AN", 2, 0, 5], ["AN", 2, 1, 6]]]], "r": [[9.7623e-06, 9.76325e-06, 9.75917e-06], 0, 5.47755, 1667941813], "v": "v0.6"}
{"i": [["[\"mul\", 1, 14, 14, 480]", "cuda -keys=cuda,gpu -max_num_threads=1024 -model=unknown -thread_warp_size=32", [-1, 16, 64, 49152, 2147483647, 1024, 8, 32], "", 0, []], [[], [["FU", 2, [0, 1, 2, 3]], ["SP", 2, 0, 94080, [5], 1], ["AN", 2, 0, 5], ["AN", 2, 1, 6]]]], "r": [[1.66657e-05, 1.66777e-05, 1.6663e-05], 0, 5.8288, 1667941814], "v": "v0.6"}
{"i": [["[\"mul\", 1, 14, 14, 480]", "cuda -keys=cuda,gpu -max_num_threads=1024 -model=unknown -thread_warp_size=32", [-1, 16, 64, 49152, 2147483647, 1024, 8, 32], "", 0, []], [[], [["FU", 2, [0, 1, 2, 3]], ["SP", 2, 0, 94080, [12], 1], ["AN", 2, 0, 5], ["AN", 2, 1, 6]]]], "r": [[8.43557e-06, 8.43398e-06, 8.44225e-06], 0, 6.19714, 1667941814], "v": "v0.6"}
{"i": [["[\"mul\", 1, 14, 14, 480]", "cuda -keys=cuda,gpu -max_num_threads=1024 -model=unknown -thread_warp_size=32", [-1, 16, 64, 49152, 2147483647, 1024, 8, 32], "", 0, []], [[], [["FU", 2, [0, 1, 2, 3]], ["SP", 2, 0, 94080, [20], 1], ["AN", 2, 0, 5], ["AN", 2, 1, 6]]]], "r": [[6.0781e-06, 6.07781e-06, 6.07631e-06], 0, 6.31784, 1667941814], "v": "v0.6"}
{"i": [["[\"mul\", 1, 14, 14, 480]", "cuda -keys=cuda,gpu -max_num_threads=1024 -model=unknown -thread_warp_size=32", [-1, 16, 64, 49152, 2147483647, 1024, 8, 32], "", 0, []], [[], [["FU", 2, [0, 1, 2, 3]], ["SP", 2, 0, 94080, [60], 1], ["AN", 2, 0, 5], ["AN", 2, 1, 6]]]], "r": [[3.97979e-06, 3.9786e-06, 3.98472e-06], 0, 3.6796, 1667941811], "v": "v0.6"}
{"i": [["[\"mul\", 1, 14, 14, 480]", "cuda -keys=cuda,gpu -max_num_threads=1024 -model=unknown -thread_warp_size=32", [-1, 16, 64, 49152, 2147483647, 1024, 8, 32], "", 0, []], [[], [["FU", 2, [0, 1, 2, 3]], ["SP", 2, 0, 94080, [42], 1], ["AN", 2, 0, 5], ["AN", 2, 1, 6]]]], "r": [[4.42664e-06, 4.42139e-06, 4.41772e-06], 0, 6.58754, 1667941815], "v": "v0.6"}
{"i": [["[\"mul\", 1, 14, 14, 480]", "cuda -keys=cuda,gpu -max_num_threads=1024 -model=unknown -thread_warp_size=32", [-1, 16, 64, 49152, 2147483647, 1024, 8, 32], "", 0, []], [[], [["FU", 2, [0, 1, 2, 3]], ["SP", 2, 0, 94080, [32], 1], ["AN", 2, 0, 5], ["AN", 2, 1, 6]]]], "r": [[4.8477e-06, 4.84637e-06, 4.8434e-06], 0, 7.20629, 1667941815], "v": "v0.6"}
{"i": [["[\"mul\", 1, 14, 14, 480]", "cuda -keys=cuda,gpu -max_num_threads=1024 -model=unknown -thread_warp_size=32", [-1, 16, 64, 49152, 2147483647, 1024, 8, 32], "", 0, []], [[], [["FU", 2, [0, 1, 2, 3]], ["SP", 2, 0, 94080, [49], 1], ["AN", 2, 0, 5], ["AN", 2, 1, 6]]]], "r": [[3.98796e-06, 3.98707e-06, 3.98749e-06], 0, 6.94105, 1667941815], "v": "v0.6"}
{"i": [["[\"mul\", 1, 14, 14, 480]", "cuda -keys=cuda,gpu -max_num_threads=1024 -model=unknown -thread_warp_size=32", [-1, 16, 64, 49152, 2147483647, 1024, 8, 32], "", 0, []], [[], [["FU", 2, [0, 1, 2, 3]], ["SP", 2, 0, 94080, [48], 1], ["AN", 2, 0, 5], ["AN", 2, 1, 6]]]], "r": [[3.97725e-06, 3.97785e-06, 3.97979e-06], 0, 7.39749, 1667941816], "v": "v0.6"}
{"i": [["[\"mul\", 1, 14, 14, 480]", "cuda -keys=cuda,gpu -max_num_threads=1024 -model=unknown -thread_warp_size=32", [-1, 16, 64, 49152, 2147483647, 1024, 8, 32], "", 0, []], [[], [["FU", 2, [0, 1, 2, 3]], ["SP", 2, 0, 94080, [21], 1], ["AN", 2, 0, 5], ["AN", 2, 1, 6]]]], "r": [[5.96987e-06, 5.97075e-06, 5.97401e-06], 0, 7.67165, 1667941816], "v": "v0.6"}
{"i": [["[\"mul\", 1, 14, 14, 480]", "cuda -keys=cuda,gpu -max_num_threads=1024 -model=unknown -thread_warp_size=32", [-1, 16, 64, 49152, 2147483647, 1024, 8, 32], "", 0, []], [[], [["FU", 2, [0, 1, 2, 3]], ["SP", 2, 0, 94080, [6], 1], ["AN", 2, 0, 5], ["AN", 2, 1, 6]]]], "r": [[1.4297e-05, 1.42938e-05, 1.42965e-05], 0, 7.9349, 1667941816], "v": "v0.6"}
{"i": [["[\"mul\", 1, 14, 14, 480]", "cuda -keys=cuda,gpu -max_num_threads=1024 -model=unknown -thread_warp_size=32", [-1, 16, 64, 49152, 2147483647, 1024, 8, 32], "", 0, []], [[], [["FU", 2, [0, 1, 2, 3]], ["SP", 2, 0, 94080, [2], 1], ["AN", 2, 0, 5], ["AN", 2, 1, 6]]]], "r": [[3.7686e-05, 3.76814e-05, 3.76796e-05], 0, 5.18845, 1667941813], "v": "v0.6"}
{"i": [["[\"mul\", 1, 14, 14, 480]", "cuda -keys=cuda,gpu -max_num_threads=1024 -model=unknown -thread_warp_size=32", [-1, 16, 64, 49152, 2147483647, 1024, 8, 32], "", 0, []], [[], [["FU", 2, [0, 1, 2, 3]], ["SP", 2, 0, 94080, [7], 1], ["AN", 2, 0, 5], ["AN", 2, 1, 6]]]], "r": [[1.26239e-05, 1.26194e-05, 1.26125e-05], 0, 1.36206, 1667942188], "v": "v0.6"}
{"i": [["[\"mul\", 1, 14, 14, 480]", "cuda -keys=cuda,gpu -max_num_threads=1024 -model=unknown -thread_warp_size=32", [-1, 16, 64, 49152, 2147483647, 1024, 8, 32], "", 0, []], [[], [["FU", 2, [0, 1, 2, 3]], ["SP", 2, 0, 94080, [5], 1], ["AN", 2, 0, 5], ["AN", 2, 1, 6]]]], "r": [[1.6708e-05, 1.67156e-05, 1.67137e-05], 0, 0.627599, 1667942188], "v": "v0.6"}
{"i": [["[\"mul\", 1, 14, 14, 480]", "cuda -keys=cuda,gpu -max_num_threads=1024 -model=unknown -thread_warp_size=32", [-1, 16, 64, 49152, 2147483647, 1024, 8, 32], "", 0, []], [[], [["FU", 2, [0, 1, 2, 3]], ["SP", 2, 0, 94080, [16], 1], ["AN", 2, 0, 5], ["AN", 2, 1, 6]]]], "r": [[7.02834e-06, 7.03064e-06, 7.02869e-06], 0, 2.90416, 1667942190], "v": "v0.6"}
{"i": [["[\"mul\", 1, 14, 14, 480]", "cuda -keys=cuda,gpu -max_num_threads=1024 -model=unknown -thread_warp_size=32", [-1, 16, 64, 49152, 2147483647, 1024, 8, 32], "", 0, []], [[], [["FU", 2, [0, 1, 2, 3]], ["SP", 2, 0, 94080, [20], 1], ["AN", 2, 0, 5], ["AN", 2, 1, 6]]]], "r": [[6.15362e-06, 6.15275e-06, 6.14342e-06], 0, 1.02819, 1667942188], "v": "v0.6"}
{"i": [["[\"mul\", 1, 14, 14, 480]", "cuda -keys=cuda,gpu -max_num_threads=1024 -model=unknown -thread_warp_size=32", [-1, 16, 64, 49152, 2147483647, 1024, 8, 32], "", 0, []], [[], [["FU", 2, [0, 1, 2, 3]], ["SP", 2, 0, 94080, [48], 1], ["AN", 2, 0, 5], ["AN", 2, 1, 6]]]], "r": [[4.00937e-06, 4.00996e-06, 4.01365e-06], 0, 2.01013, 1667942189], "v": "v0.6"}
{"i": [["[\"mul\", 1, 14, 14, 480]", "cuda -keys=cuda,gpu -max_num_threads=1024 -model=unknown -thread_warp_size=32", [-1, 16, 64, 49152, 2147483647, 1024, 8, 32], "", 0, []], [[], [["FU", 2, [0, 1, 2, 3]], ["SP", 2, 0, 94080, [8], 1], ["AN", 2, 0, 5], ["AN", 2, 1, 6]]]], "r": [[1.14197e-05, 1.14173e-05, 1.14277e-05], 0, 1.70263, 1667942189], "v": "v0.6"}
{"i": [["[\"mul\", 1, 14, 14, 480]", "cuda -keys=cuda,gpu -max_num_threads=1024 -model=unknown -thread_warp_size=32", [-1, 16, 64, 49152, 2147483647, 1024, 8, 32], "", 0, []], [[], [["FU", 2, [0, 1, 2, 3]], ["SP", 2, 0, 94080, [60], 1], ["AN", 2, 0, 5], ["AN", 2, 1, 6]]]], "r": [[3.78266e-06, 3.78214e-06, 3.78527e-06], 0, 2.64541, 1667942190], "v": "v0.6"}
{"i": [["[\"mul\", 1, 14, 14, 480]", "cuda -keys=cuda,gpu -max_num_threads=1024 -model=unknown -thread_warp_size=32", [-1, 16, 64, 49152, 2147483647, 1024, 8, 32], "", 0, []], [[], [["FU", 2, [0, 1, 2, 3]], ["SP", 2, 0, 94080, [14], 1], ["AN", 2, 0, 5], ["AN", 2, 1, 6]]]], "r": [[7.58158e-06, 7.59036e-06, 7.58919e-06], 0, 2.3163, 1667942189], "v": "v0.6"}
{"i": [["[\"mul\", 1, 14, 14, 480]", "cuda -keys=cuda,gpu -max_num_threads=1024 -model=unknown -thread_warp_size=32", [-1, 16, 64, 49152, 2147483647, 1024, 8, 32], "", 0, []], [[], [["FU", 2, [0, 1, 2, 3]], ["SP", 2, 0, 94080, [49], 1], ["AN", 2, 0, 5], ["AN", 2, 1, 6]]]], "r": [[4.02422e-06, 4.0243e-06, 4.02572e-06], 0, 3.17172, 1667942190], "v": "v0.6"}
{"i": [["[\"mul\", 1, 14, 14, 480]", "cuda -keys=cuda,gpu -max_num_threads=1024 -model=unknown -thread_warp_size=32", [-1, 16, 64, 49152, 2147483647, 1024, 8, 32], "", 0, []], [[], [["FU", 2, [0, 1, 2, 3]], ["SP", 2, 0, 94080, [24], 1], ["AN", 2, 0, 5], ["AN", 2, 1, 6]]]], "r": [[5.57018e-06, 5.57369e-06, 5.57426e-06], 0, 3.47299, 1667942191], "v": "v0.6"}
{"i": [["[\"mul\", 1, 14, 14, 480]", "cuda -keys=cuda,gpu -max_num_threads=1024 -model=unknown -thread_warp_size=32", [-1, 16, 64, 49152, 2147483647, 1024, 8, 32], "", 0, []], [[], [["FU", 2, [0, 1, 2, 3]], ["SP", 2, 0, 94080, [15], 1], ["AN", 2, 0, 5], ["AN", 2, 1, 6]]]], "r": [[7.3842e-06, 7.40442e-06, 7.40011e-06], 0, 3.65635, 1667942191], "v": "v0.6"}
{"i": [["[\"mul\", 1, 14, 14, 480]", "cuda -keys=cuda,gpu -max_num_threads=1024 -model=unknown -thread_warp_size=32", [-1, 16, 64, 49152, 2147483647, 1024, 8, 32], "", 0, []], [[], [["FU", 2, [0, 1, 2, 3]], ["SP", 2, 0, 94080, [4], 1], ["AN", 2, 0, 5], ["AN", 2, 1, 6]]]], "r": [[2.01766e-05, 2.01823e-05, 2.01728e-05], 0, 3.93173, 1667942191], "v": "v0.6"}
{"i": [["[\"mul\", 1, 14, 14, 480]", "cuda -keys=cuda,gpu -max_num_threads=1024 -model=unknown -thread_warp_size=32", [-1, 16, 64, 49152, 2147483647, 1024, 8, 32], "", 0, []], [[], [["FU", 2, [0, 1, 2, 3]], ["SP", 2, 0, 94080, [40], 1], ["AN", 2, 0, 5], ["AN", 2, 1, 6]]]], "r": [[4.44991e-06, 4.4453e-06, 4.455e-06], 0, 4.80189, 1667942192], "v": "v0.6"}
{"i": [["[\"mul\", 1, 14, 14, 480]", "cuda -keys=cuda,gpu -max_num_threads=1024 -model=unknown -thread_warp_size=32", [-1, 16, 64, 49152, 2147483647, 1024, 8, 32], "", 0, []], [[], [["FU", 2, [0, 1, 2, 3]], ["SP", 2, 0, 94080, [3], 1], ["AN", 2, 0, 5], ["AN", 2, 1, 6]]]], "r": [[2.5942e-05, 2.5947e-05, 2.59469e-05], 0, 4.22164, 1667942192], "v": "v0.6"}
{"i": [["[\"mul\", 1, 14, 14, 480]", "cuda -keys=cuda,gpu -max_num_threads=1024 -model=unknown -thread_warp_size=32", [-1, 16, 64, 49152, 2147483647, 1024, 8, 32], "", 0, []], [[], [["FU", 2, [0, 1, 2, 3]], ["SP", 2, 0, 94080, [10], 1], ["AN", 2, 0, 5], ["AN", 2, 1, 6]]]], "r": [[9.85671e-06, 9.85816e-06, 9.85431e-06], 0, 5.00989, 1667942193], "v": "v0.6"}
{"i": [["[\"mul\", 1, 14, 14, 480]", "cuda -keys=cuda,gpu -max_num_threads=1024 -model=unknown -thread_warp_size=32", [-1, 16, 64, 49152, 2147483647, 1024, 8, 32], "", 0, []], [[], [["FU", 2, [0, 1, 2, 3]], ["SP", 2, 0, 94080, [64], 1], ["AN", 2, 0, 5], ["AN", 2, 1, 6]]]], "r": [[3.84845e-06, 3.84911e-06, 3.85245e-06], 0, 5.20348, 1667942193], "v": "v0.6"}
{"i": [["[\"mul\", 1, 14, 14, 480]", "cuda -keys=cuda,gpu -max_num_threads=1024 -model=unknown -thread_warp_size=32", [-1, 16, 64, 49152, 2147483647, 1024, 8, 32], "", 0, []], [[], [["FU", 2, [0, 1, 2, 3]], ["SP", 2, 0, 94080, [30], 1], ["AN", 2, 0, 5], ["AN", 2, 1, 6]]]], "r": [[5.13951e-06, 5.14619e-06, 5.13717e-06], 0, 5.39402, 1667942193], "v": "v0.6"}
{"i": [["[\"mul\", 1, 14, 14, 480]", "cuda -keys=cuda,gpu -max_num_threads=1024 -model=unknown -thread_warp_size=32", [-1, 16, 64, 49152, 2147483647, 1024, 8, 32], "", 0, []], [[], [["FU", 2, [0, 1, 2, 3]], ["SP", 2, 0, 94080, [6], 1], ["AN", 2, 0, 5], ["AN", 2, 1, 6]]]], "r": [[1.43691e-05, 1.4364e-05, 1.43742e-05], 0, 5.74221, 1667942194], "v": "v0.6"}
{"i": [["[\"mul\", 1, 14, 14, 480]", "cuda -keys=cuda,gpu -max_num_threads=1024 -model=unknown -thread_warp_size=32", [-1, 16, 64, 49152, 2147483647, 1024, 8, 32], "", 0, []], [[], [["FU", 2, [0, 1, 2, 3]], ["SP", 2, 0, 94080, [56], 1], ["AN", 2, 0, 5], ["AN", 2, 1, 6]]]], "r": [[3.8411e-06, 3.84656e-06, 3.8502e-06], 0, 6.10281, 1667942194], "v": "v0.6"}
{"i": [["[\"mul\", 1, 14, 14, 480]", "cuda -keys=cuda,gpu -max_num_threads=1024 -model=unknown -thread_warp_size=32", [-1, 16, 64, 49152, 2147483647, 1024, 8, 32], "", 0, []], [[], [["FU", 2, [0, 1, 2, 3]], ["SP", 2, 0, 94080, [12], 1], ["AN", 2, 0, 5], ["AN", 2, 1, 6]]]], "r": [[8.49561e-06, 8.50046e-06, 8.50092e-06], 0, 6.84675, 1667942195], "v": "v0.6"}
{"i": [["[\"mul\", 1, 14, 14, 480]", "cuda -keys=cuda,gpu -max_num_threads=1024 -model=unknown -thread_warp_size=32", [-1, 16, 64, 49152, 2147483647, 1024, 8, 32], "", 0, []], [[], [["FU", 2, [0, 1, 2, 3]], ["SP", 2, 0, 94080, [32], 1], ["AN", 2, 0, 5], ["AN", 2, 1, 6]]]], "r": [[4.75831e-06, 4.76017e-06, 4.75935e-06], 0, 6.14496, 1667942194], "v": "v0.6"}
{"i": [["[\"mul\", 1, 14, 14, 480]", "cuda -keys=cuda,gpu -max_num_threads=1024 -model=unknown -thread_warp_size=32", [-1, 16, 64, 49152, 2147483647, 1024, 8, 32], "", 0, []], [[], [["FU", 2, [0, 1, 2, 3]], ["SP", 2, 0, 94080, [42], 1], ["AN", 2, 0, 5], ["AN", 2, 1, 6]]]], "r": [[4.35316e-06, 4.35295e-06, 4.35134e-06], 0, 4.49452, 1667942192], "v": "v0.6"}
{"i": [["[\"mul\", 1, 14, 14, 480]", "cuda -keys=cuda,gpu -max_num_threads=1024 -model=unknown -thread_warp_size=32", [-1, 16, 64, 49152, 2147483647, 1024, 8, 32], "", 0, []], [[], [["FU", 2, [0, 1, 2, 3]], ["SP", 2, 0, 94080, [2], 1], ["AN", 2, 0, 5], ["AN", 2, 1, 6]]]], "r": [[3.76818e-05, 3.76908e-05, 3.7692e-05], 0, 6.47451, 1667942195], "v": "v0.6"}
