python/models/efficientnet/VertiFusionEfficientNet_kernel_configs/efficient_mul_1_14_14_240.log
{"i": [["[\"mul\", 1, 14, 14, 240]", "cuda -keys=cuda,gpu -max_num_threads=1024 -model=unknown -thread_warp_size=32", [-1, 16, 64, 49152, 2147483647, 1024, 8, 32], "", 0, []], [[], [["FU", 2, [0, 1, 2, 3]], ["SP", 2, 0, 47040, [10], 1], ["AN", 2, 0, 5], ["AN", 2, 1, 6]]]], "r": [[6.1379e-06, 6.8499e-06, 6.1401e-06], 0, 0.581264, 1667926583], "v": "v0.6"}
{"i": [["[\"mul\", 1, 14, 14, 240]", "cuda -keys=cuda,gpu -max_num_threads=1024 -model=unknown -thread_warp_size=32", [-1, 16, 64, 49152, 2147483647, 1024, 8, 32], "", 0, []], [[], [["FU", 2, [0, 1, 2, 3]], ["SP", 2, 0, 47040, [64], 1], ["AN", 2, 0, 5], ["AN", 2, 1, 6]]]], "r": [[3.09289e-06, 3.09934e-06, 3.09898e-06], 0, 2.15242, 1667926585], "v": "v0.6"}
{"i": [["[\"mul\", 1, 14, 14, 240]", "cuda -keys=cuda,gpu -max_num_threads=1024 -model=unknown -thread_warp_size=32", [-1, 16, 64, 49152, 2147483647, 1024, 8, 32], "", 0, []], [[], [["FU", 2, [0, 1, 2, 3]], ["SP", 2, 0, 47040, [6], 1], ["AN", 2, 0, 5], ["AN", 2, 1, 6]]]], "r": [[8.51293e-06, 8.5104e-06, 8.51654e-06], 0, 0.930523, 1667926584], "v": "v0.6"}
{"i": [["[\"mul\", 1, 14, 14, 240]", "cuda -keys=cuda,gpu -max_num_threads=1024 -model=unknown -thread_warp_size=32", [-1, 16, 64, 49152, 2147483647, 1024, 8, 32], "", 0, []], [[], [["FU", 2, [0, 1, 2, 3]], ["SP", 2, 0, 47040, [60], 1], ["AN", 2, 0, 5], ["AN", 2, 1, 6]]]], "r": [[3.32174e-06, 3.3199e-06, 3.32472e-06], 0, 1.85853, 1667926585], "v": "v0.6"}
{"i": [["[\"mul\", 1, 14, 14, 240]", "cuda -keys=cuda,gpu -max_num_threads=1024 -model=unknown -thread_warp_size=32", [-1, 16, 64, 49152, 2147483647, 1024, 8, 32], "", 0, []], [[], [["FU", 2, [0, 1, 2, 3]], ["SP", 2, 0, 47040, [49], 1], ["AN", 2, 0, 5], ["AN", 2, 1, 6]]]], "r": [[3.18512e-06, 3.18832e-06, 3.18901e-06], 0, 1.56927, 1667926584], "v": "v0.6"}
{"i": [["[\"mul\", 1, 14, 14, 240]", "cuda -keys=cuda,gpu -max_num_threads=1024 -model=unknown -thread_warp_size=32", [-1, 16, 64, 49152, 2147483647, 1024, 8, 32], "", 0, []], [[], [["FU", 2, [0, 1, 2, 3]], ["SP", 2, 0, 47040, [1], 1], ["AN", 2, 0, 5], ["AN", 2, 1, 6]]]], "r": [[3.75627e-05, 3.75636e-05, 3.75585e-05], 0, 1.19448, 1667926584], "v": "v0.6"}
{"i": [["[\"mul\", 1, 14, 14, 240]", "cuda -keys=cuda,gpu -max_num_threads=1024 -model=unknown -thread_warp_size=32", [-1, 16, 64, 49152, 2147483647, 1024, 8, 32], "", 0, []], [[], [["FU", 2, [0, 1, 2, 3]], ["SP", 2, 0, 47040, [42], 1], ["AN", 2, 0, 5], ["AN", 2, 1, 6]]]], "r": [[3.35623e-06, 3.36096e-06, 3.36018e-06], 0, 2.36849, 1667926585], "v": "v0.6"}
{"i": [["[\"mul\", 1, 14, 14, 240]", "cuda -keys=cuda,gpu -max_num_threads=1024 -model=unknown -thread_warp_size=32", [-1, 16, 64, 49152, 2147483647, 1024, 8, 32], "", 0, []], [[], [["FU", 2, [0, 1, 2, 3]], ["SP", 2, 0, 47040, [14], 1], ["AN", 2, 0, 5], ["AN", 2, 1, 6]]]], "r": [[5.18076e-06, 5.17169e-06, 5.17587e-06], 0, 2.85155, 1667926586], "v": "v0.6"}
{"i": [["[\"mul\", 1, 14, 14, 240]", "cuda -keys=cuda,gpu -max_num_threads=1024 -model=unknown -thread_warp_size=32", [-1, 16, 64, 49152, 2147483647, 1024, 8, 32], "", 0, []], [[], [["FU", 2, [0, 1, 2, 3]], ["SP", 2, 0, 47040, [30], 1], ["AN", 2, 0, 5], ["AN", 2, 1, 6]]]], "r": [[3.69386e-06, 3.69559e-06, 3.69642e-06], 0, 3.71411, 1667926587], "v": "v0.6"}
{"i": [["[\"mul\", 1, 14, 14, 240]", "cuda -keys=cuda,gpu -max_num_threads=1024 -model=unknown -thread_warp_size=32", [-1, 16, 64, 49152, 2147483647, 1024, 8, 32], "", 0, []], [[], [["FU", 2, [0, 1, 2, 3]], ["SP", 2, 0, 47040, [24], 1], ["AN", 2, 0, 5], ["AN", 2, 1, 6]]]], "r": [[4.12211e-06, 4.12425e-06, 4.1239e-06], 0, 3.14967, 1667926586], "v": "v0.6"}
{"i": [["[\"mul\", 1, 14, 14, 240]", "cuda -keys=cuda,gpu -max_num_threads=1024 -model=unknown -thread_warp_size=32", [-1, 16, 64, 49152, 2147483647, 1024, 8, 32], "", 0, []], [[], [["FU", 2, [0, 1, 2, 3]], ["SP", 2, 0, 47040, [4], 1], ["AN", 2, 0, 5], ["AN", 2, 1, 6]]]], "r": [[1.15014e-05, 1.15113e-05, 1.15195e-05], 0, 2.56891, 1667926586], "v": "v0.6"}
{"i": [["[\"mul\", 1, 14, 14, 240]", "cuda -keys=cuda,gpu -max_num_threads=1024 -model=unknown -thread_warp_size=32", [-1, 16, 64, 49152, 2147483647, 1024, 8, 32], "", 0, []], [[], [["FU", 2, [0, 1, 2, 3]], ["SP", 2, 0, 47040, [7], 1], ["AN", 2, 0, 5], ["AN", 2, 1, 6]]]], "r": [[7.83788e-06, 7.84025e-06, 7.84028e-06], 0, 3.37468, 1667926587], "v": "v0.6"}
{"i": [["[\"mul\", 1, 14, 14, 240]", "cuda -keys=cuda,gpu -max_num_threads=1024 -model=unknown -thread_warp_size=32", [-1, 16, 64, 49152, 2147483647, 1024, 8, 32], "", 0, []], [[], [["FU", 2, [0, 1, 2, 3]], ["SP", 2, 0, 47040, [3], 1], ["AN", 2, 0, 5], ["AN", 2, 1, 6]]]], "r": [[1.43914e-05, 1.43864e-05, 1.43892e-05], 0, 4.00181, 1667926587], "v": "v0.6"}
{"i": [["[\"mul\", 1, 14, 14, 240]", "cuda -keys=cuda,gpu -max_num_threads=1024 -model=unknown -thread_warp_size=32", [-1, 16, 64, 49152, 2147483647, 1024, 8, 32], "", 0, []], [[], [["FU", 2, [0, 1, 2, 3]], ["SP", 2, 0, 47040, [2], 1], ["AN", 2, 0, 5], ["AN", 2, 1, 6]]]], "r": [[2.01777e-05, 2.01748e-05, 2.01769e-05], 0, 4.25063, 1667926588], "v": "v0.6"}
{"i": [["[\"mul\", 1, 14, 14, 240]", "cuda -keys=cuda,gpu -max_num_threads=1024 -model=unknown -thread_warp_size=32", [-1, 16, 64, 49152, 2147483647, 1024, 8, 32], "", 0, []], [[], [["FU", 2, [0, 1, 2, 3]], ["SP", 2, 0, 47040, [48], 1], ["AN", 2, 0, 5], ["AN", 2, 1, 6]]]], "r": [[3.45269e-06, 3.45283e-06, 3.45524e-06], 0, 4.77975, 1667926588], "v": "v0.6"}
{"i": [["[\"mul\", 1, 14, 14, 240]", "cuda -keys=cuda,gpu -max_num_threads=1024 -model=unknown -thread_warp_size=32", [-1, 16, 64, 49152, 2147483647, 1024, 8, 32], "", 0, []], [[], [["FU", 2, [0, 1, 2, 3]], ["SP", 2, 0, 47040, [15], 1], ["AN", 2, 0, 5], ["AN", 2, 1, 6]]]], "r": [[5.03159e-06, 5.03401e-06, 5.03372e-06], 0, 4.5078, 1667926588], "v": "v0.6"}
{"i": [["[\"mul\", 1, 14, 14, 240]", "cuda -keys=cuda,gpu -max_num_threads=1024 -model=unknown -thread_warp_size=32", [-1, 16, 64, 49152, 2147483647, 1024, 8, 32], "", 0, []], [[], [["FU", 2, [0, 1, 2, 3]], ["SP", 2, 0, 47040, [32], 1], ["AN", 2, 0, 5], ["AN", 2, 1, 6]]]], "r": [[3.70253e-06, 3.70814e-06, 3.71e-06], 0, 5.03774, 1667926589], "v": "v0.6"}
{"i": [["[\"mul\", 1, 14, 14, 240]", "cuda -keys=cuda,gpu -max_num_threads=1024 -model=unknown -thread_warp_size=32", [-1, 16, 64, 49152, 2147483647, 1024, 8, 32], "", 0, []], [[], [["FU", 2, [0, 1, 2, 3]], ["SP", 2, 0, 47040, [12], 1], ["AN", 2, 0, 5], ["AN", 2, 1, 6]]]], "r": [[5.65379e-06, 5.65363e-06, 5.65528e-06], 0, 5.30059, 1667926589], "v": "v0.6"}
{"i": [["[\"mul\", 1, 14, 14, 240]", "cuda -keys=cuda,gpu -max_num_threads=1024 -model=unknown -thread_warp_size=32", [-1, 16, 64, 49152, 2147483647, 1024, 8, 32], "", 0, []], [[], [["FU", 2, [0, 1, 2, 3]], ["SP", 2, 0, 47040, [8], 1], ["AN", 2, 0, 5], ["AN", 2, 1, 6]]]], "r": [[6.92662e-06, 6.92578e-06, 6.92231e-06], 0, 5.61373, 1667926589], "v": "v0.6"}
{"i": [["[\"mul\", 1, 14, 14, 240]", "cuda -keys=cuda,gpu -max_num_threads=1024 -model=unknown -thread_warp_size=32", [-1, 16, 64, 49152, 2147483647, 1024, 8, 32], "", 0, []], [[], [["FU", 2, [0, 1, 2, 3]], ["SP", 2, 0, 47040, [16], 1], ["AN", 2, 0, 5], ["AN", 2, 1, 6]]]], "r": [[4.7482e-06, 4.74469e-06, 4.74524e-06], 0, 5.82879, 1667926590], "v": "v0.6"}
{"i": [["[\"mul\", 1, 14, 14, 240]", "cuda -keys=cuda,gpu -max_num_threads=1024 -model=unknown -thread_warp_size=32", [-1, 16, 64, 49152, 2147483647, 1024, 8, 32], "", 0, []], [[], [["FU", 2, [0, 1, 2, 3]], ["SP", 2, 0, 47040, [2], 1], ["AN", 2, 0, 5], ["AN", 2, 1, 6]]]], "r": [[2.01477e-05, 2.01504e-05, 2.01457e-05], 0, 1.92757, 1667939162], "v": "v0.6"}
{"i": [["[\"mul\", 1, 14, 14, 240]", "cuda -keys=cuda,gpu -max_num_threads=1024 -model=unknown -thread_warp_size=32", [-1, 16, 64, 49152, 2147483647, 1024, 8, 32], "", 0, []], [[], [["FU", 2, [0, 1, 2, 3]], ["SP", 2, 0, 47040, [15], 1], ["AN", 2, 0, 5], ["AN", 2, 1, 6]]]], "r": [[4.97852e-06, 4.98353e-06, 4.97544e-06], 0, 1.30805, 1667939161], "v": "v0.6"}
{"i": [["[\"mul\", 1, 14, 14, 240]", "cuda -keys=cuda,gpu -max_num_threads=1024 -model=unknown -thread_warp_size=32", [-1, 16, 64, 49152, 2147483647, 1024, 8, 32], "", 0, []], [[], [["FU", 2, [0, 1, 2, 3]], ["SP", 2, 0, 47040, [7], 1], ["AN", 2, 0, 5], ["AN", 2, 1, 6]]]], "r": [[7.59518e-06, 7.59502e-06, 7.59371e-06], 0, 0.969175, 1667939161], "v": "v0.6"}
{"i": [["[\"mul\", 1, 14, 14, 240]", "cuda -keys=cuda,gpu -max_num_threads=1024 -model=unknown -thread_warp_size=32", [-1, 16, 64, 49152, 2147483647, 1024, 8, 32], "", 0, []], [[], [["FU", 2, [0, 1, 2, 3]], ["SP", 2, 0, 47040, [21], 1], ["AN", 2, 0, 5], ["AN", 2, 1, 6]]]], "r": [[4.24376e-06, 4.25093e-06, 4.24764e-06], 0, 1.63364, 1667939161], "v": "v0.6"}
{"i": [["[\"mul\", 1, 14, 14, 240]", "cuda -keys=cuda,gpu -max_num_threads=1024 -model=unknown -thread_warp_size=32", [-1, 16, 64, 49152, 2147483647, 1024, 8, 32], "", 0, []], [[], [["FU", 2, [0, 1, 2, 3]], ["SP", 2, 0, 47040, [3], 1], ["AN", 2, 0, 5], ["AN", 2, 1, 6]]]], "r": [[1.44455e-05, 1.44417e-05, 1.44394e-05], 0, 2.58266, 1667939162], "v": "v0.6"}
{"i": [["[\"mul\", 1, 14, 14, 240]", "cuda -keys=cuda,gpu -max_num_threads=1024 -model=unknown -thread_warp_size=32", [-1, 16, 64, 49152, 2147483647, 1024, 8, 32], "", 0, []], [[], [["FU", 2, [0, 1, 2, 3]], ["SP", 2, 0, 47040, [6], 1], ["AN", 2, 0, 5], ["AN", 2, 1, 6]]]], "r": [[8.41696e-06, 8.42607e-06, 8.42043e-06], 0, 0.648607, 1667939160], "v": "v0.6"}
{"i": [["[\"mul\", 1, 14, 14, 240]", "cuda -keys=cuda,gpu -max_num_threads=1024 -model=unknown -thread_warp_size=32", [-1, 16, 64, 49152, 2147483647, 1024, 8, 32], "", 0, []], [[], [["FU", 2, [0, 1, 2, 3]], ["SP", 2, 0, 47040, [4], 1], ["AN", 2, 0, 5], ["AN", 2, 1, 6]]]], "r": [[1.14523e-05, 1.14526e-05, 1.14523e-05], 0, 2.21549, 1667939162], "v": "v0.6"}
{"i": [["[\"mul\", 1, 14, 14, 240]", "cuda -keys=cuda,gpu -max_num_threads=1024 -model=unknown -thread_warp_size=32", [-1, 16, 64, 49152, 2147483647, 1024, 8, 32], "", 0, []], [[], [["FU", 2, [0, 1, 2, 3]], ["SP", 2, 0, 47040, [8], 1], ["AN", 2, 0, 5], ["AN", 2, 1, 6]]]], "r": [[6.96078e-06, 6.96303e-06, 6.95664e-06], 0, 2.82893, 1667939163], "v": "v0.6"}
{"i": [["[\"mul\", 1, 14, 14, 240]", "cuda -keys=cuda,gpu -max_num_threads=1024 -model=unknown -thread_warp_size=32", [-1, 16, 64, 49152, 2147483647, 1024, 8, 32], "", 0, []], [[], [["FU", 2, [0, 1, 2, 3]], ["SP", 2, 0, 47040, [35], 1], ["AN", 2, 0, 5], ["AN", 2, 1, 6]]]], "r": [[3.51958e-06, 3.52393e-06, 3.52333e-06], 0, 3.1029, 1667939163], "v": "v0.6"}
{"i": [["[\"mul\", 1, 14, 14, 240]", "cuda -keys=cuda,gpu -max_num_threads=1024 -model=unknown -thread_warp_size=32", [-1, 16, 64, 49152, 2147483647, 1024, 8, 32], "", 0, []], [[], [["FU", 2, [0, 1, 2, 3]], ["SP", 2, 0, 47040, [12], 1], ["AN", 2, 0, 5], ["AN", 2, 1, 6]]]], "r": [[5.45504e-06, 5.45379e-06, 5.45481e-06], 0, 3.43758, 1667939163], "v": "v0.6"}
{"i": [["[\"mul\", 1, 14, 14, 240]", "cuda -keys=cuda,gpu -max_num_threads=1024 -model=unknown -thread_warp_size=32", [-1, 16, 64, 49152, 2147483647, 1024, 8, 32], "", 0, []], [[], [["FU", 2, [0, 1, 2, 3]], ["SP", 2, 0, 47040, [42], 1], ["AN", 2, 0, 5], ["AN", 2, 1, 6]]]], "r": [[3.51213e-06, 3.51184e-06, 3.51203e-06], 0, 3.89173, 1667939164], "v": "v0.6"}
{"i": [["[\"mul\", 1, 14, 14, 240]", "cuda -keys=cuda,gpu -max_num_threads=1024 -model=unknown -thread_warp_size=32", [-1, 16, 64, 49152, 2147483647, 1024, 8, 32], "", 0, []], [[], [["FU", 2, [0, 1, 2, 3]], ["SP", 2, 0, 47040, [28], 1], ["AN", 2, 0, 5], ["AN", 2, 1, 6]]]], "r": [[3.79345e-06, 3.79442e-06, 3.79852e-06], 0, 4.14738, 1667939164], "v": "v0.6"}
{"i": [["[\"mul\", 1, 14, 14, 240]", "cuda -keys=cuda,gpu -max_num_threads=1024 -model=unknown -thread_warp_size=32", [-1, 16, 64, 49152, 2147483647, 1024, 8, 32], "", 0, []], [[], [["FU", 2, [0, 1, 2, 3]], ["SP", 2, 0, 47040, [32], 1], ["AN", 2, 0, 5], ["AN", 2, 1, 6]]]], "r": [[3.73483e-06, 3.73273e-06, 3.73376e-06], 0, 4.42269, 1667939165], "v": "v0.6"}
{"i": [["[\"mul\", 1, 14, 14, 240]", "cuda -keys=cuda,gpu -max_num_threads=1024 -model=unknown -thread_warp_size=32", [-1, 16, 64, 49152, 2147483647, 1024, 8, 32], "", 0, []], [[], [["FU", 2, [0, 1, 2, 3]], ["SP", 2, 0, 47040, [56], 1], ["AN", 2, 0, 5], ["AN", 2, 1, 6]]]], "r": [[3.10145e-06, 3.10463e-06, 3.1047e-06], 0, 4.66787, 1667939165], "v": "v0.6"}
{"i": [["[\"mul\", 1, 14, 14, 240]", "cuda -keys=cuda,gpu -max_num_threads=1024 -model=unknown -thread_warp_size=32", [-1, 16, 64, 49152, 2147483647, 1024, 8, 32], "", 0, []], [[], [["FU", 2, [0, 1, 2, 3]], ["SP", 2, 0, 47040, [64], 1], ["AN", 2, 0, 5], ["AN", 2, 1, 6]]]], "r": [[3.27536e-06, 3.27258e-06, 3.28034e-06], 0, 4.94684, 1667939165], "v": "v0.6"}
{"i": [["[\"mul\", 1, 14, 14, 240]", "cuda -keys=cuda,gpu -max_num_threads=1024 -model=unknown -thread_warp_size=32", [-1, 16, 64, 49152, 2147483647, 1024, 8, 32], "", 0, []], [[], [["FU", 2, [0, 1, 2, 3]], ["SP", 2, 0, 47040, [14], 1], ["AN", 2, 0, 5], ["AN", 2, 1, 6]]]], "r": [[5.07698e-06, 5.07711e-06, 5.07885e-06], 0, 5.15019, 1667939166], "v": "v0.6"}
{"i": [["[\"mul\", 1, 14, 14, 240]", "cuda -keys=cuda,gpu -max_num_threads=1024 -model=unknown -thread_warp_size=32", [-1, 16, 64, 49152, 2147483647, 1024, 8, 32], "", 0, []], [[], [["FU", 2, [0, 1, 2, 3]], ["SP", 2, 0, 47040, [30], 1], ["AN", 2, 0, 5], ["AN", 2, 1, 6]]]], "r": [[3.84298e-06, 3.84908e-06, 3.84926e-06], 0, 5.39564, 1667939166], "v": "v0.6"}
{"i": [["[\"mul\", 1, 14, 14, 240]", "cuda -keys=cuda,gpu -max_num_threads=1024 -model=unknown -thread_warp_size=32", [-1, 16, 64, 49152, 2147483647, 1024, 8, 32], "", 0, []], [[], [["FU", 2, [0, 1, 2, 3]], ["SP", 2, 0, 47040, [1], 1], ["AN", 2, 0, 5], ["AN", 2, 1, 6]]]], "r": [[3.74624e-05, 3.74694e-05, 3.74602e-05], 0, 5.70021, 1667939166], "v": "v0.6"}
{"i": [["[\"mul\", 1, 14, 14, 240]", "cuda -keys=cuda,gpu -max_num_threads=1024 -model=unknown -thread_warp_size=32", [-1, 16, 64, 49152, 2147483647, 1024, 8, 32], "", 0, []], [[], [["FU", 2, [0, 1, 2, 3]], ["SP", 2, 0, 47040, [16], 1], ["AN", 2, 0, 5], ["AN", 2, 1, 6]]]], "r": [[4.89707e-06, 4.89456e-06, 4.90168e-06], 0, 5.88056, 1667939166], "v": "v0.6"}
{"i": [["[\"mul\", 1, 14, 14, 240]", "cuda -keys=cuda,gpu -max_num_threads=1024 -model=unknown -thread_warp_size=32", [-1, 16, 64, 49152, 2147483647, 1024, 8, 32], "", 0, []], [[], [["FU", 2, [0, 1, 2, 3]], ["SP", 2, 0, 47040, [40], 1], ["AN", 2, 0, 5], ["AN", 2, 1, 6]]]], "r": [[3.55493e-06, 3.55804e-06, 3.5614e-06], 0, 6.24342, 1667939167], "v": "v0.6"}
{"i": [["[\"mul\", 1, 14, 14, 240]", "cuda -keys=cuda,gpu -max_num_threads=1024 -model=unknown -thread_warp_size=32", [-1, 16, 64, 49152, 2147483647, 1024, 8, 32], "", 0, []], [[], [["FU", 2, [0, 1, 2, 3]], ["SP", 2, 0, 47040, [10], 1], ["AN", 2, 0, 5], ["AN", 2, 1, 6]]]], "r": [[6.27387e-06, 6.27057e-06, 6.26686e-06], 0, 3.6546, 1667939164], "v": "v0.6"}
{"i": [["[\"mul\", 1, 14, 14, 240]", "cuda -keys=cuda,gpu -max_num_threads=1024 -model=unknown -thread_warp_size=32", [-1, 16, 64, 49152, 2147483647, 1024, 8, 32], "", 0, []], [[], [["FU", 2, [0, 1, 2, 3]], ["SP", 2, 0, 47040, [24], 1], ["AN", 2, 0, 5], ["AN", 2, 1, 6]]]], "r": [[4.1005e-06, 4.10414e-06, 4.09854e-06], 0, 6.48407, 1667939167], "v": "v0.6"}
{"i": [["[\"mul\", 1, 14, 14, 240]", "cuda -keys=cuda,gpu -max_num_threads=1024 -model=unknown -thread_warp_size=32", [-1, 16, 64, 49152, 2147483647, 1024, 8, 32], "", 0, []], [[], [["FU", 2, [0, 1, 2, 3]], ["SP", 2, 0, 47040, [48], 1], ["AN", 2, 0, 5], ["AN", 2, 1, 6]]]], "r": [[3.44496e-06, 3.44095e-06, 3.44767e-06], 0, 6.79449, 1667939167], "v": "v0.6"}
{"i": [["[\"mul\", 1, 14, 14, 240]", "cuda -keys=cuda,gpu -max_num_threads=1024 -model=unknown -thread_warp_size=32", [-1, 16, 64, 49152, 2147483647, 1024, 8, 32], "", 0, []], [[], [["FU", 2, [0, 1, 2, 3]], ["SP", 2, 0, 47040, [49], 1], ["AN", 2, 0, 5], ["AN", 2, 1, 6]]]], "r": [[3.28778e-06, 3.28799e-06, 3.29699e-06], 0, 6.97014, 1667939168], "v": "v0.6"}
{"i": [["[\"mul\", 1, 14, 14, 240]", "cuda -keys=cuda,gpu -max_num_threads=1024 -model=unknown -thread_warp_size=32", [-1, 16, 64, 49152, 2147483647, 1024, 8, 32], "", 0, []], [[], [["FU", 2, [0, 1, 2, 3]], ["SP", 2, 0, 47040, [20], 1], ["AN", 2, 0, 5], ["AN", 2, 1, 6]]]], "r": [[4.29153e-06, 4.29067e-06, 4.2906e-06], 0, 7.3659, 1667939168], "v": "v0.6"}
{"i": [["[\"mul\", 1, 14, 14, 240]", "cuda -keys=cuda,gpu -max_num_threads=1024 -model=unknown -thread_warp_size=32", [-1, 16, 64, 49152, 2147483647, 1024, 8, 32], "", 0, []], [[], [["FU", 2, [0, 1, 2, 3]], ["SP", 2, 0, 47040, [5], 1], ["AN", 2, 0, 5], ["AN", 2, 1, 6]]]], "r": [[9.7107e-06, 9.71279e-06, 9.71738e-06], 0, 7.56873, 1667939168], "v": "v0.6"}
{"i": [["[\"mul\", 1, 14, 14, 240]", "cuda -keys=cuda,gpu -max_num_threads=1024 -model=unknown -thread_warp_size=32", [-1, 16, 64, 49152, 2147483647, 1024, 8, 32], "", 0, []], [[], [["FU", 2, [0, 1, 2, 3]], ["SP", 2, 0, 47040, [60], 1], ["AN", 2, 0, 5], ["AN", 2, 1, 6]]]], "r": [[3.08781e-06, 3.09e-06, 3.09243e-06], 0, 7.85821, 1667939169], "v": "v0.6"}
