python/models/efficientnet/VertiFusionEfficientNet_kernel_configs/efficient_mul_1_1_1_240.log
{"i": [["[\"mul\", 1, 1, 1, 240]", "cuda -keys=cuda,gpu -max_num_threads=1024 -model=unknown -thread_warp_size=32", [-1, 16, 64, 49152, 2147483647, 1024, 8, 32], "", 0, []], [[], [["FU", 2, [0, 1, 2, 3]], ["SP", 2, 0, 240, [3], 1], ["AN", 2, 0, 5], ["AN", 2, 1, 6]]]], "r": [[2.51877e-06, 2.51839e-06, 2.52087e-06], 0, 1.68694, 1667926448], "v": "v0.6"}
{"i": [["[\"mul\", 1, 1, 1, 240]", "cuda -keys=cuda,gpu -max_num_threads=1024 -model=unknown -thread_warp_size=32", [-1, 16, 64, 49152, 2147483647, 1024, 8, 32], "", 0, []], [[], [["FU", 2, [0, 1, 2, 3]], ["SP", 2, 0, 240, [30], 1], ["AN", 2, 0, 5], ["AN", 2, 1, 6]]]], "r": [[2.45017e-06, 2.44713e-06, 2.43531e-06], 0, 2.01736, 1667926448], "v": "v0.6"}
{"i": [["[\"mul\", 1, 1, 1, 240]", "cuda -keys=cuda,gpu -max_num_threads=1024 -model=unknown -thread_warp_size=32", [-1, 16, 64, 49152, 2147483647, 1024, 8, 32], "", 0, []], [[], [["FU", 2, [0, 1, 2, 3]], ["SP", 2, 0, 240, [4], 1], ["AN", 2, 0, 5], ["AN", 2, 1, 6]]]], "r": [[2.49189e-06, 2.49644e-06, 2.472e-06], 0, 1.06982, 1667926447], "v": "v0.6"}
{"i": [["[\"mul\", 1, 1, 1, 240]", "cuda -keys=cuda,gpu -max_num_threads=1024 -model=unknown -thread_warp_size=32", [-1, 16, 64, 49152, 2147483647, 1024, 8, 32], "", 0, []], [[], [["FU", 2, [0, 1, 2, 3]], ["SP", 2, 0, 240, [32], 1], ["AN", 2, 0, 5], ["AN", 2, 1, 6]]]], "r": [[2.62628e-06, 2.6288e-06, 2.65184e-06], 0, 2.34868, 1667926449], "v": "v0.6"}
{"i": [["[\"mul\", 1, 1, 1, 240]", "cuda -keys=cuda,gpu -max_num_threads=1024 -model=unknown -thread_warp_size=32", [-1, 16, 64, 49152, 2147483647, 1024, 8, 32], "", 0, []], [[], [["FU", 2, [0, 1, 2, 3]], ["SP", 2, 0, 240, [2], 1], ["AN", 2, 0, 5], ["AN", 2, 1, 6]]]], "r": [[2.53134e-06, 2.52547e-06, 2.52267e-06], 0, 1.41369, 1667926448], "v": "v0.6"}
{"i": [["[\"mul\", 1, 1, 1, 240]", "cuda -keys=cuda,gpu -max_num_threads=1024 -model=unknown -thread_warp_size=32", [-1, 16, 64, 49152, 2147483647, 1024, 8, 32], "", 0, []], [[], [["FU", 2, [0, 1, 2, 3]], ["SP", 2, 0, 240, [16], 1], ["AN", 2, 0, 5], ["AN", 2, 1, 6]]]], "r": [[3.761e-06, 3.58009e-06, 2.46596e-06], 0, 0.610169, 1667926447], "v": "v0.6"}
{"i": [["[\"mul\", 1, 1, 1, 240]", "cuda -keys=cuda,gpu -max_num_threads=1024 -model=unknown -thread_warp_size=32", [-1, 16, 64, 49152, 2147483647, 1024, 8, 32], "", 0, []], [[], [["FU", 2, [0, 1, 2, 3]], ["SP", 2, 0, 240, [48], 1], ["AN", 2, 0, 5], ["AN", 2, 1, 6]]]], "r": [[2.43381e-06, 2.44034e-06, 2.4339e-06], 0, 0.791046, 1667926447], "v": "v0.6"}
{"i": [["[\"mul\", 1, 1, 1, 240]", "cuda -keys=cuda,gpu -max_num_threads=1024 -model=unknown -thread_warp_size=32", [-1, 16, 64, 49152, 2147483647, 1024, 8, 32], "", 0, []], [[], [["FU", 2, [0, 1, 2, 3]], ["SP", 2, 0, 240, [60], 1], ["AN", 2, 0, 5], ["AN", 2, 1, 6]]]], "r": [[2.47312e-06, 2.46354e-06, 2.46241e-06], 0, 3.1204, 1667926450], "v": "v0.6"}
{"i": [["[\"mul\", 1, 1, 1, 240]", "cuda -keys=cuda,gpu -max_num_threads=1024 -model=unknown -thread_warp_size=32", [-1, 16, 64, 49152, 2147483647, 1024, 8, 32], "", 0, []], [[], [["FU", 2, [0, 1, 2, 3]], ["SP", 2, 0, 240, [5], 1], ["AN", 2, 0, 5], ["AN", 2, 1, 6]]]], "r": [[2.66119e-06, 2.66582e-06, 2.68562e-06], 0, 2.5177, 1667926449], "v": "v0.6"}
{"i": [["[\"mul\", 1, 1, 1, 240]", "cuda -keys=cuda,gpu -max_num_threads=1024 -model=unknown -thread_warp_size=32", [-1, 16, 64, 49152, 2147483647, 1024, 8, 32], "", 0, []], [[], [["FU", 2, [0, 1, 2, 3]], ["SP", 2, 0, 240, [12], 1], ["AN", 2, 0, 5], ["AN", 2, 1, 6]]]], "r": [[2.47111e-06, 2.46727e-06, 2.45347e-06], 0, 2.74377, 1667926449], "v": "v0.6"}
{"i": [["[\"mul\", 1, 1, 1, 240]", "cuda -keys=cuda,gpu -max_num_threads=1024 -model=unknown -thread_warp_size=32", [-1, 16, 64, 49152, 2147483647, 1024, 8, 32], "", 0, []], [[], [["FU", 2, [0, 1, 2, 3]], ["SP", 2, 0, 240, [40], 1], ["AN", 2, 0, 5], ["AN", 2, 1, 6]]]], "r": [[2.48648e-06, 2.50654e-06, 2.54275e-06], 0, 3.36532, 1667926450], "v": "v0.6"}
{"i": [["[\"mul\", 1, 1, 1, 240]", "cuda -keys=cuda,gpu -max_num_threads=1024 -model=unknown -thread_warp_size=32", [-1, 16, 64, 49152, 2147483647, 1024, 8, 32], "", 0, []], [[], [["FU", 2, [0, 1, 2, 3]], ["SP", 2, 0, 240, [6], 1], ["AN", 2, 0, 5], ["AN", 2, 1, 6]]]], "r": [[2.66815e-06, 2.67164e-06, 2.6946e-06], 0, 3.97033, 1667926451], "v": "v0.6"}
{"i": [["[\"mul\", 1, 1, 1, 240]", "cuda -keys=cuda,gpu -max_num_threads=1024 -model=unknown -thread_warp_size=32", [-1, 16, 64, 49152, 2147483647, 1024, 8, 32], "", 0, []], [[], [["FU", 2, [0, 1, 2, 3]], ["SP", 2, 0, 240, [20], 1], ["AN", 2, 0, 5], ["AN", 2, 1, 6]]]], "r": [[2.47295e-06, 2.46294e-06, 2.46257e-06], 0, 3.63131, 1667926450], "v": "v0.6"}
{"i": [["[\"mul\", 1, 1, 1, 240]", "cuda -keys=cuda,gpu -max_num_threads=1024 -model=unknown -thread_warp_size=32", [-1, 16, 64, 49152, 2147483647, 1024, 8, 32], "", 0, []], [[], [["FU", 2, [0, 1, 2, 3]], ["SP", 2, 0, 240, [24], 1], ["AN", 2, 0, 5], ["AN", 2, 1, 6]]]], "r": [[2.55767e-06, 2.55721e-06, 2.5686e-06], 0, 4.2062, 1667926451], "v": "v0.6"}
{"i": [["[\"mul\", 1, 1, 1, 240]", "cuda -keys=cuda,gpu -max_num_threads=1024 -model=unknown -thread_warp_size=32", [-1, 16, 64, 49152, 2147483647, 1024, 8, 32], "", 0, []], [[], [["FU", 2, [0, 1, 2, 3]], ["SP", 2, 0, 240, [8], 1], ["AN", 2, 0, 5], ["AN", 2, 1, 6]]]], "r": [[2.48495e-06, 2.48451e-06, 2.47783e-06], 0, 4.99709, 1667926452], "v": "v0.6"}
{"i": [["[\"mul\", 1, 1, 1, 240]", "cuda -keys=cuda,gpu -max_num_threads=1024 -model=unknown -thread_warp_size=32", [-1, 16, 64, 49152, 2147483647, 1024, 8, 32], "", 0, []], [[], [["FU", 2, [0, 1, 2, 3]], ["SP", 2, 0, 240, [1], 1], ["AN", 2, 0, 5], ["AN", 2, 1, 6]]]], "r": [[2.88179e-06, 2.88081e-06, 2.88349e-06], 0, 4.44737, 1667926451], "v": "v0.6"}
{"i": [["[\"mul\", 1, 1, 1, 240]", "cuda -keys=cuda,gpu -max_num_threads=1024 -model=unknown -thread_warp_size=32", [-1, 16, 64, 49152, 2147483647, 1024, 8, 32], "", 0, []], [[], [["FU", 2, [0, 1, 2, 3]], ["SP", 2, 0, 240, [15], 1], ["AN", 2, 0, 5], ["AN", 2, 1, 6]]]], "r": [[2.64037e-06, 2.64231e-06, 2.66686e-06], 0, 4.74343, 1667926452], "v": "v0.6"}
{"i": [["[\"mul\", 1, 1, 1, 240]", "cuda -keys=cuda,gpu -max_num_threads=1024 -model=unknown -thread_warp_size=32", [-1, 16, 64, 49152, 2147483647, 1024, 8, 32], "", 0, []], [[], [["FU", 2, [0, 1, 2, 3]], ["SP", 2, 0, 240, [10], 1], ["AN", 2, 0, 5], ["AN", 2, 1, 6]]]], "r": [[2.49395e-06, 2.49513e-06, 2.49424e-06], 0, 5.27786, 1667926452], "v": "v0.6"}
{"i": [["[\"mul\", 1, 1, 1, 240]", "cuda -keys=cuda,gpu -max_num_threads=1024 -model=unknown -thread_warp_size=32", [-1, 16, 64, 49152, 2147483647, 1024, 8, 32], "", 0, []], [[], [["FU", 2, [0, 1, 2, 3]], ["SP", 2, 0, 240, [4], 1], ["AN", 2, 0, 5], ["AN", 2, 1, 6]]]], "r": [[2.69958e-06, 2.69754e-06, 2.7184e-06], 0, 1.79273, 1667926644], "v": "v0.6"}
{"i": [["[\"mul\", 1, 1, 1, 240]", "cuda -keys=cuda,gpu -max_num_threads=1024 -model=unknown -thread_warp_size=32", [-1, 16, 64, 49152, 2147483647, 1024, 8, 32], "", 0, []], [[], [["FU", 2, [0, 1, 2, 3]], ["SP", 2, 0, 240, [32], 1], ["AN", 2, 0, 5], ["AN", 2, 1, 6]]]], "r": [[2.46031e-06, 2.45469e-06, 2.45334e-06], 0, 2.37268, 1667926645], "v": "v0.6"}
{"i": [["[\"mul\", 1, 1, 1, 240]", "cuda -keys=cuda,gpu -max_num_threads=1024 -model=unknown -thread_warp_size=32", [-1, 16, 64, 49152, 2147483647, 1024, 8, 32], "", 0, []], [[], [["FU", 2, [0, 1, 2, 3]], ["SP", 2, 0, 240, [3], 1], ["AN", 2, 0, 5], ["AN", 2, 1, 6]]]], "r": [[2.51376e-06, 2.51536e-06, 2.51566e-06], 0, 0.929957, 1667926643], "v": "v0.6"}
{"i": [["[\"mul\", 1, 1, 1, 240]", "cuda -keys=cuda,gpu -max_num_threads=1024 -model=unknown -thread_warp_size=32", [-1, 16, 64, 49152, 2147483647, 1024, 8, 32], "", 0, []], [[], [["FU", 2, [0, 1, 2, 3]], ["SP", 2, 0, 240, [40], 1], ["AN", 2, 0, 5], ["AN", 2, 1, 6]]]], "r": [[2.62318e-06, 2.62607e-06, 2.65534e-06], 0, 1.27615, 1667926644], "v": "v0.6"}
{"i": [["[\"mul\", 1, 1, 1, 240]", "cuda -keys=cuda,gpu -max_num_threads=1024 -model=unknown -thread_warp_size=32", [-1, 16, 64, 49152, 2147483647, 1024, 8, 32], "", 0, []], [[], [["FU", 2, [0, 1, 2, 3]], ["SP", 2, 0, 240, [30], 1], ["AN", 2, 0, 5], ["AN", 2, 1, 6]]]], "r": [[2.61395e-06, 2.61507e-06, 2.64141e-06], 0, 2.06705, 1667926645], "v": "v0.6"}
{"i": [["[\"mul\", 1, 1, 1, 240]", "cuda -keys=cuda,gpu -max_num_threads=1024 -model=unknown -thread_warp_size=32", [-1, 16, 64, 49152, 2147483647, 1024, 8, 32], "", 0, []], [[], [["FU", 2, [0, 1, 2, 3]], ["SP", 2, 0, 240, [24], 1], ["AN", 2, 0, 5], ["AN", 2, 1, 6]]]], "r": [[2.59048e-06, 2.59278e-06, 2.61186e-06], 0, 0.547526, 1667926643], "v": "v0.6"}
{"i": [["[\"mul\", 1, 1, 1, 240]", "cuda -keys=cuda,gpu -max_num_threads=1024 -model=unknown -thread_warp_size=32", [-1, 16, 64, 49152, 2147483647, 1024, 8, 32], "", 0, []], [[], [["FU", 2, [0, 1, 2, 3]], ["SP", 2, 0, 240, [8], 1], ["AN", 2, 0, 5], ["AN", 2, 1, 6]]]], "r": [[2.48192e-06, 2.48423e-06, 2.47922e-06], 0, 1.48901, 1667926644], "v": "v0.6"}
{"i": [["[\"mul\", 1, 1, 1, 240]", "cuda -keys=cuda,gpu -max_num_threads=1024 -model=unknown -thread_warp_size=32", [-1, 16, 64, 49152, 2147483647, 1024, 8, 32], "", 0, []], [[], [["FU", 2, [0, 1, 2, 3]], ["SP", 2, 0, 240, [60], 1], ["AN", 2, 0, 5], ["AN", 2, 1, 6]]]], "r": [[2.50525e-06, 2.49672e-06, 2.4996e-06], 0, 2.61985, 1667926645], "v": "v0.6"}
{"i": [["[\"mul\", 1, 1, 1, 240]", "cuda -keys=cuda,gpu -max_num_threads=1024 -model=unknown -thread_warp_size=32", [-1, 16, 64, 49152, 2147483647, 1024, 8, 32], "", 0, []], [[], [["FU", 2, [0, 1, 2, 3]], ["SP", 2, 0, 240, [16], 1], ["AN", 2, 0, 5], ["AN", 2, 1, 6]]]], "r": [[2.60359e-06, 2.61117e-06, 2.62964e-06], 0, 2.90689, 1667926646], "v": "v0.6"}
{"i": [["[\"mul\", 1, 1, 1, 240]", "cuda -keys=cuda,gpu -max_num_threads=1024 -model=unknown -thread_warp_size=32", [-1, 16, 64, 49152, 2147483647, 1024, 8, 32], "", 0, []], [[], [["FU", 2, [0, 1, 2, 3]], ["SP", 2, 0, 240, [1], 1], ["AN", 2, 0, 5], ["AN", 2, 1, 6]]]], "r": [[2.87476e-06, 2.87079e-06, 2.88184e-06], 0, 3.1083, 1667926646], "v": "v0.6"}
{"i": [["[\"mul\", 1, 1, 1, 240]", "cuda -keys=cuda,gpu -max_num_threads=1024 -model=unknown -thread_warp_size=32", [-1, 16, 64, 49152, 2147483647, 1024, 8, 32], "", 0, []], [[], [["FU", 2, [0, 1, 2, 3]], ["SP", 2, 0, 240, [10], 1], ["AN", 2, 0, 5], ["AN", 2, 1, 6]]]], "r": [[2.66419e-06, 2.67509e-06, 2.69812e-06], 0, 3.3826, 1667926646], "v": "v0.6"}
{"i": [["[\"mul\", 1, 1, 1, 240]", "cuda -keys=cuda,gpu -max_num_threads=1024 -model=unknown -thread_warp_size=32", [-1, 16, 64, 49152, 2147483647, 1024, 8, 32], "", 0, []], [[], [["FU", 2, [0, 1, 2, 3]], ["SP", 2, 0, 240, [12], 1], ["AN", 2, 0, 5], ["AN", 2, 1, 6]]]], "r": [[2.62006e-06, 2.6247e-06, 2.64489e-06], 0, 3.60884, 1667926647], "v": "v0.6"}
{"i": [["[\"mul\", 1, 1, 1, 240]", "cuda -keys=cuda,gpu -max_num_threads=1024 -model=unknown -thread_warp_size=32", [-1, 16, 64, 49152, 2147483647, 1024, 8, 32], "", 0, []], [[], [["FU", 2, [0, 1, 2, 3]], ["SP", 2, 0, 240, [6], 1], ["AN", 2, 0, 5], ["AN", 2, 1, 6]]]], "r": [[2.62998e-06, 2.63056e-06, 2.65046e-06], 0, 3.87643, 1667926647], "v": "v0.6"}
{"i": [["[\"mul\", 1, 1, 1, 240]", "cuda -keys=cuda,gpu -max_num_threads=1024 -model=unknown -thread_warp_size=32", [-1, 16, 64, 49152, 2147483647, 1024, 8, 32], "", 0, []], [[], [["FU", 2, [0, 1, 2, 3]], ["SP", 2, 0, 240, [48], 1], ["AN", 2, 0, 5], ["AN", 2, 1, 6]]]], "r": [[2.63212e-06, 2.63373e-06, 2.65656e-06], 0, 4.15583, 1667926647], "v": "v0.6"}
{"i": [["[\"mul\", 1, 1, 1, 240]", "cuda -keys=cuda,gpu -max_num_threads=1024 -model=unknown -thread_warp_size=32", [-1, 16, 64, 49152, 2147483647, 1024, 8, 32], "", 0, []], [[], [["FU", 2, [0, 1, 2, 3]], ["SP", 2, 0, 240, [5], 1], ["AN", 2, 0, 5], ["AN", 2, 1, 6]]]], "r": [[2.63963e-06, 2.64031e-06, 2.66276e-06], 0, 4.40604, 1667926647], "v": "v0.6"}
{"i": [["[\"mul\", 1, 1, 1, 240]", "cuda -keys=cuda,gpu -max_num_threads=1024 -model=unknown -thread_warp_size=32", [-1, 16, 64, 49152, 2147483647, 1024, 8, 32], "", 0, []], [[], [["FU", 2, [0, 1, 2, 3]], ["SP", 2, 0, 240, [2], 1], ["AN", 2, 0, 5], ["AN", 2, 1, 6]]]], "r": [[2.55406e-06, 2.55173e-06, 2.55235e-06], 0, 4.64597, 1667926648], "v": "v0.6"}
{"i": [["[\"mul\", 1, 1, 1, 240]", "cuda -keys=cuda,gpu -max_num_threads=1024 -model=unknown -thread_warp_size=32", [-1, 16, 64, 49152, 2147483647, 1024, 8, 32], "", 0, []], [[], [["FU", 2, [0, 1, 2, 3]], ["SP", 2, 0, 240, [20], 1], ["AN", 2, 0, 5], ["AN", 2, 1, 6]]]], "r": [[2.51363e-06, 2.52176e-06, 2.5609e-06], 0, 4.94886, 1667926648], "v": "v0.6"}
{"i": [["[\"mul\", 1, 1, 1, 240]", "cuda -keys=cuda,gpu -max_num_threads=1024 -model=unknown -thread_warp_size=32", [-1, 16, 64, 49152, 2147483647, 1024, 8, 32], "", 0, []], [[], [["FU", 2, [0, 1, 2, 3]], ["SP", 2, 0, 240, [15], 1], ["AN", 2, 0, 5], ["AN", 2, 1, 6]]]], "r": [[2.45865e-06, 2.44407e-06, 2.44275e-06], 0, 5.19914, 1667926648], "v": "v0.6"}
{"i": [["[\"mul\", 1, 1, 1, 240]", "cuda -keys=cuda,gpu -max_num_threads=1024 -model=unknown -thread_warp_size=32", [-1, 16, 64, 49152, 2147483647, 1024, 8, 32], "", 0, []], [[], [["FU", 2, [0, 1, 2, 3]], ["SP", 2, 0, 240, [20], 1], ["AN", 2, 0, 5], ["AN", 2, 1, 6]]]], "r": [[2.61521e-06, 2.61166e-06, 2.63781e-06], 0, 1.28805, 1667938349], "v": "v0.6"}
{"i": [["[\"mul\", 1, 1, 1, 240]", "cuda -keys=cuda,gpu -max_num_threads=1024 -model=unknown -thread_warp_size=32", [-1, 16, 64, 49152, 2147483647, 1024, 8, 32], "", 0, []], [[], [["FU", 2, [0, 1, 2, 3]], ["SP", 2, 0, 240, [5], 1], ["AN", 2, 0, 5], ["AN", 2, 1, 6]]]], "r": [[2.47285e-06, 2.4673e-06, 2.47217e-06], 0, 1.55299, 1667938350], "v": "v0.6"}
{"i": [["[\"mul\", 1, 1, 1, 240]", "cuda -keys=cuda,gpu -max_num_threads=1024 -model=unknown -thread_warp_size=32", [-1, 16, 64, 49152, 2147483647, 1024, 8, 32], "", 0, []], [[], [["FU", 2, [0, 1, 2, 3]], ["SP", 2, 0, 240, [16], 1], ["AN", 2, 0, 5], ["AN", 2, 1, 6]]]], "r": [[2.61133e-06, 2.60746e-06, 2.63559e-06], 0, 2.14333, 1667938350], "v": "v0.6"}
{"i": [["[\"mul\", 1, 1, 1, 240]", "cuda -keys=cuda,gpu -max_num_threads=1024 -model=unknown -thread_warp_size=32", [-1, 16, 64, 49152, 2147483647, 1024, 8, 32], "", 0, []], [[], [["FU", 2, [0, 1, 2, 3]], ["SP", 2, 0, 240, [8], 1], ["AN", 2, 0, 5], ["AN", 2, 1, 6]]]], "r": [[2.51177e-06, 2.50734e-06, 2.50529e-06], 0, 2.69515, 1667938351], "v": "v0.6"}
{"i": [["[\"mul\", 1, 1, 1, 240]", "cuda -keys=cuda,gpu -max_num_threads=1024 -model=unknown -thread_warp_size=32", [-1, 16, 64, 49152, 2147483647, 1024, 8, 32], "", 0, []], [[], [["FU", 2, [0, 1, 2, 3]], ["SP", 2, 0, 240, [24], 1], ["AN", 2, 0, 5], ["AN", 2, 1, 6]]]], "r": [[2.62369e-06, 2.62387e-06, 2.65057e-06], 0, 1.91164, 1667938350], "v": "v0.6"}
{"i": [["[\"mul\", 1, 1, 1, 240]", "cuda -keys=cuda,gpu -max_num_threads=1024 -model=unknown -thread_warp_size=32", [-1, 16, 64, 49152, 2147483647, 1024, 8, 32], "", 0, []], [[], [["FU", 2, [0, 1, 2, 3]], ["SP", 2, 0, 240, [10], 1], ["AN", 2, 0, 5], ["AN", 2, 1, 6]]]], "r": [[2.6308e-06, 2.63445e-06, 2.64976e-06], 0, 0.953385, 1667938349], "v": "v0.6"}
{"i": [["[\"mul\", 1, 1, 1, 240]", "cuda -keys=cuda,gpu -max_num_threads=1024 -model=unknown -thread_warp_size=32", [-1, 16, 64, 49152, 2147483647, 1024, 8, 32], "", 0, []], [[], [["FU", 2, [0, 1, 2, 3]], ["SP", 2, 0, 240, [6], 1], ["AN", 2, 0, 5], ["AN", 2, 1, 6]]]], "r": [[2.597e-06, 2.60188e-06, 2.61767e-06], 0, 2.92129, 1667938351], "v": "v0.6"}
{"i": [["[\"mul\", 1, 1, 1, 240]", "cuda -keys=cuda,gpu -max_num_threads=1024 -model=unknown -thread_warp_size=32", [-1, 16, 64, 49152, 2147483647, 1024, 8, 32], "", 0, []], [[], [["FU", 2, [0, 1, 2, 3]], ["SP", 2, 0, 240, [3], 1], ["AN", 2, 0, 5], ["AN", 2, 1, 6]]]], "r": [[2.56145e-06, 2.54973e-06, 2.55166e-06], 0, 0.596707, 1667938349], "v": "v0.6"}
{"i": [["[\"mul\", 1, 1, 1, 240]", "cuda -keys=cuda,gpu -max_num_threads=1024 -model=unknown -thread_warp_size=32", [-1, 16, 64, 49152, 2147483647, 1024, 8, 32], "", 0, []], [[], [["FU", 2, [0, 1, 2, 3]], ["SP", 2, 0, 240, [2], 1], ["AN", 2, 0, 5], ["AN", 2, 1, 6]]]], "r": [[2.58909e-06, 2.58612e-06, 2.58674e-06], 0, 2.36289, 1667938351], "v": "v0.6"}
{"i": [["[\"mul\", 1, 1, 1, 240]", "cuda -keys=cuda,gpu -max_num_threads=1024 -model=unknown -thread_warp_size=32", [-1, 16, 64, 49152, 2147483647, 1024, 8, 32], "", 0, []], [[], [["FU", 2, [0, 1, 2, 3]], ["SP", 2, 0, 240, [60], 1], ["AN", 2, 0, 5], ["AN", 2, 1, 6]]]], "r": [[2.60064e-06, 2.60524e-06, 2.62669e-06], 0, 3.08482, 1667938352], "v": "v0.6"}
{"i": [["[\"mul\", 1, 1, 1, 240]", "cuda -keys=cuda,gpu -max_num_threads=1024 -model=unknown -thread_warp_size=32", [-1, 16, 64, 49152, 2147483647, 1024, 8, 32], "", 0, []], [[], [["FU", 2, [0, 1, 2, 3]], ["SP", 2, 0, 240, [30], 1], ["AN", 2, 0, 5], ["AN", 2, 1, 6]]]], "r": [[2.60784e-06, 2.60868e-06, 2.63141e-06], 0, 3.35783, 1667938352], "v": "v0.6"}
{"i": [["[\"mul\", 1, 1, 1, 240]", "cuda -keys=cuda,gpu -max_num_threads=1024 -model=unknown -thread_warp_size=32", [-1, 16, 64, 49152, 2147483647, 1024, 8, 32], "", 0, []], [[], [["FU", 2, [0, 1, 2, 3]], ["SP", 2, 0, 240, [15], 1], ["AN", 2, 0, 5], ["AN", 2, 1, 6]]]], "r": [[2.64435e-06, 2.63884e-06, 2.66055e-06], 0, 3.63213, 1667938352], "v": "v0.6"}
{"i": [["[\"mul\", 1, 1, 1, 240]", "cuda -keys=cuda,gpu -max_num_threads=1024 -model=unknown -thread_warp_size=32", [-1, 16, 64, 49152, 2147483647, 1024, 8, 32], "", 0, []], [[], [["FU", 2, [0, 1, 2, 3]], ["SP", 2, 0, 240, [12], 1], ["AN", 2, 0, 5], ["AN", 2, 1, 6]]]], "r": [[2.4791e-06, 2.47639e-06, 2.47856e-06], 0, 3.89058, 1667938353], "v": "v0.6"}
{"i": [["[\"mul\", 1, 1, 1, 240]", "cuda -keys=cuda,gpu -max_num_threads=1024 -model=unknown -thread_warp_size=32", [-1, 16, 64, 49152, 2147483647, 1024, 8, 32], "", 0, []], [[], [["FU", 2, [0, 1, 2, 3]], ["SP", 2, 0, 240, [32], 1], ["AN", 2, 0, 5], ["AN", 2, 1, 6]]]], "r": [[2.47521e-06, 2.48128e-06, 2.47975e-06], 0, 4.1719, 1667938353], "v": "v0.6"}
{"i": [["[\"mul\", 1, 1, 1, 240]", "cuda -keys=cuda,gpu -max_num_threads=1024 -model=unknown -thread_warp_size=32", [-1, 16, 64, 49152, 2147483647, 1024, 8, 32], "", 0, []], [[], [["FU", 2, [0, 1, 2, 3]], ["SP", 2, 0, 240, [40], 1], ["AN", 2, 0, 5], ["AN", 2, 1, 6]]]], "r": [[2.59604e-06, 2.59384e-06, 2.61349e-06], 0, 4.43109, 1667938353], "v": "v0.6"}
{"i": [["[\"mul\", 1, 1, 1, 240]", "cuda -keys=cuda,gpu -max_num_threads=1024 -model=unknown -thread_warp_size=32", [-1, 16, 64, 49152, 2147483647, 1024, 8, 32], "", 0, []], [[], [["FU", 2, [0, 1, 2, 3]], ["SP", 2, 0, 240, [48], 1], ["AN", 2, 0, 5], ["AN", 2, 1, 6]]]], "r": [[2.50969e-06, 2.50623e-06, 2.50492e-06], 0, 4.68038, 1667938353], "v": "v0.6"}
{"i": [["[\"mul\", 1, 1, 1, 240]", "cuda -keys=cuda,gpu -max_num_threads=1024 -model=unknown -thread_warp_size=32", [-1, 16, 64, 49152, 2147483647, 1024, 8, 32], "", 0, []], [[], [["FU", 2, [0, 1, 2, 3]], ["SP", 2, 0, 240, [4], 1], ["AN", 2, 0, 5], ["AN", 2, 1, 6]]]], "r": [[2.62951e-06, 2.63092e-06, 2.64689e-06], 0, 4.98888, 1667938354], "v": "v0.6"}
{"i": [["[\"mul\", 1, 1, 1, 240]", "cuda -keys=cuda,gpu -max_num_threads=1024 -model=unknown -thread_warp_size=32", [-1, 16, 64, 49152, 2147483647, 1024, 8, 32], "", 0, []], [[], [["FU", 2, [0, 1, 2, 3]], ["SP", 2, 0, 240, [1], 1], ["AN", 2, 0, 5], ["AN", 2, 1, 6]]]], "r": [[2.88805e-06, 2.88584e-06, 2.89796e-06], 0, 5.23284, 1667938354], "v": "v0.6"}
{"i": [["[\"mul\", 1, 1, 1, 240]", "cuda -keys=cuda,gpu -max_num_threads=1024 -model=unknown -thread_warp_size=32", [-1, 16, 64, 49152, 2147483647, 1024, 8, 32], "", 0, []], [[], [["FU", 2, [0, 1, 2, 3]], ["SP", 2, 0, 240, [10], 1], ["AN", 2, 0, 5], ["AN", 2, 1, 6]]]], "r": [[2.62549e-06, 2.62575e-06, 2.64836e-06], 0, 2.30765, 1667939226], "v": "v0.6"}
{"i": [["[\"mul\", 1, 1, 1, 240]", "cuda -keys=cuda,gpu -max_num_threads=1024 -model=unknown -thread_warp_size=32", [-1, 16, 64, 49152, 2147483647, 1024, 8, 32], "", 0, []], [[], [["FU", 2, [0, 1, 2, 3]], ["SP", 2, 0, 240, [12], 1], ["AN", 2, 0, 5], ["AN", 2, 1, 6]]]], "r": [[2.48989e-06, 2.48607e-06, 2.48951e-06], 0, 1.39579, 1667939225], "v": "v0.6"}
{"i": [["[\"mul\", 1, 1, 1, 240]", "cuda -keys=cuda,gpu -max_num_threads=1024 -model=unknown -thread_warp_size=32", [-1, 16, 64, 49152, 2147483647, 1024, 8, 32], "", 0, []], [[], [["FU", 2, [0, 1, 2, 3]], ["SP", 2, 0, 240, [48], 1], ["AN", 2, 0, 5], ["AN", 2, 1, 6]]]], "r": [[2.59347e-06, 2.60478e-06, 2.58808e-06], 0, 0.559821, 1667939224], "v": "v0.6"}
{"i": [["[\"mul\", 1, 1, 1, 240]", "cuda -keys=cuda,gpu -max_num_threads=1024 -model=unknown -thread_warp_size=32", [-1, 16, 64, 49152, 2147483647, 1024, 8, 32], "", 0, []], [[], [["FU", 2, [0, 1, 2, 3]], ["SP", 2, 0, 240, [3], 1], ["AN", 2, 0, 5], ["AN", 2, 1, 6]]]], "r": [[2.48442e-06, 2.48299e-06, 2.48474e-06], 0, 2.03374, 1667939226], "v": "v0.6"}
{"i": [["[\"mul\", 1, 1, 1, 240]", "cuda -keys=cuda,gpu -max_num_threads=1024 -model=unknown -thread_warp_size=32", [-1, 16, 64, 49152, 2147483647, 1024, 8, 32], "", 0, []], [[], [["FU", 2, [0, 1, 2, 3]], ["SP", 2, 0, 240, [30], 1], ["AN", 2, 0, 5], ["AN", 2, 1, 6]]]], "r": [[2.44108e-06, 2.44224e-06, 2.44445e-06], 0, 0.942097, 1667939225], "v": "v0.6"}
{"i": [["[\"mul\", 1, 1, 1, 240]", "cuda -keys=cuda,gpu -max_num_threads=1024 -model=unknown -thread_warp_size=32", [-1, 16, 64, 49152, 2147483647, 1024, 8, 32], "", 0, []], [[], [["FU", 2, [0, 1, 2, 3]], ["SP", 2, 0, 240, [2], 1], ["AN", 2, 0, 5], ["AN", 2, 1, 6]]]], "r": [[2.64586e-06, 2.65159e-06, 2.66296e-06], 0, 1.11178, 1667939225], "v": "v0.6"}
{"i": [["[\"mul\", 1, 1, 1, 240]", "cuda -keys=cuda,gpu -max_num_threads=1024 -model=unknown -thread_warp_size=32", [-1, 16, 64, 49152, 2147483647, 1024, 8, 32], "", 0, []], [[], [["FU", 2, [0, 1, 2, 3]], ["SP", 2, 0, 240, [5], 1], ["AN", 2, 0, 5], ["AN", 2, 1, 6]]]], "r": [[2.48121e-06, 2.47155e-06, 2.47487e-06], 0, 1.7316, 1667939226], "v": "v0.6"}
{"i": [["[\"mul\", 1, 1, 1, 240]", "cuda -keys=cuda,gpu -max_num_threads=1024 -model=unknown -thread_warp_size=32", [-1, 16, 64, 49152, 2147483647, 1024, 8, 32], "", 0, []], [[], [["FU", 2, [0, 1, 2, 3]], ["SP", 2, 0, 240, [20], 1], ["AN", 2, 0, 5], ["AN", 2, 1, 6]]]], "r": [[2.467e-06, 2.4713e-06, 2.46961e-06], 0, 2.56316, 1667939227], "v": "v0.6"}
{"i": [["[\"mul\", 1, 1, 1, 240]", "cuda -keys=cuda,gpu -max_num_threads=1024 -model=unknown -thread_warp_size=32", [-1, 16, 64, 49152, 2147483647, 1024, 8, 32], "", 0, []], [[], [["FU", 2, [0, 1, 2, 3]], ["SP", 2, 0, 240, [6], 1], ["AN", 2, 0, 5], ["AN", 2, 1, 6]]]], "r": [[2.59854e-06, 2.59649e-06, 2.60626e-06], 0, 2.80834, 1667939227], "v": "v0.6"}
{"i": [["[\"mul\", 1, 1, 1, 240]", "cuda -keys=cuda,gpu -max_num_threads=1024 -model=unknown -thread_warp_size=32", [-1, 16, 64, 49152, 2147483647, 1024, 8, 32], "", 0, []], [[], [["FU", 2, [0, 1, 2, 3]], ["SP", 2, 0, 240, [15], 1], ["AN", 2, 0, 5], ["AN", 2, 1, 6]]]], "r": [[2.45998e-06, 2.45324e-06, 2.45372e-06], 0, 3.0407, 1667939227], "v": "v0.6"}
{"i": [["[\"mul\", 1, 1, 1, 240]", "cuda -keys=cuda,gpu -max_num_threads=1024 -model=unknown -thread_warp_size=32", [-1, 16, 64, 49152, 2147483647, 1024, 8, 32], "", 0, []], [[], [["FU", 2, [0, 1, 2, 3]], ["SP", 2, 0, 240, [16], 1], ["AN", 2, 0, 5], ["AN", 2, 1, 6]]]], "r": [[2.61164e-06, 2.61958e-06, 2.63049e-06], 0, 3.30419, 1667939228], "v": "v0.6"}
{"i": [["[\"mul\", 1, 1, 1, 240]", "cuda -keys=cuda,gpu -max_num_threads=1024 -model=unknown -thread_warp_size=32", [-1, 16, 64, 49152, 2147483647, 1024, 8, 32], "", 0, []], [[], [["FU", 2, [0, 1, 2, 3]], ["SP", 2, 0, 240, [60], 1], ["AN", 2, 0, 5], ["AN", 2, 1, 6]]]], "r": [[2.5905e-06, 2.58851e-06, 2.61229e-06], 0, 3.53111, 1667939228], "v": "v0.6"}
{"i": [["[\"mul\", 1, 1, 1, 240]", "cuda -keys=cuda,gpu -max_num_threads=1024 -model=unknown -thread_warp_size=32", [-1, 16, 64, 49152, 2147483647, 1024, 8, 32], "", 0, []], [[], [["FU", 2, [0, 1, 2, 3]], ["SP", 2, 0, 240, [24], 1], ["AN", 2, 0, 5], ["AN", 2, 1, 6]]]], "r": [[2.6213e-06, 2.6257e-06, 2.65819e-06], 0, 3.79493, 1667939228], "v": "v0.6"}
{"i": [["[\"mul\", 1, 1, 1, 240]", "cuda -keys=cuda,gpu -max_num_threads=1024 -model=unknown -thread_warp_size=32", [-1, 16, 64, 49152, 2147483647, 1024, 8, 32], "", 0, []], [[], [["FU", 2, [0, 1, 2, 3]], ["SP", 2, 0, 240, [1], 1], ["AN", 2, 0, 5], ["AN", 2, 1, 6]]]], "r": [[2.73614e-06, 2.74301e-06, 2.74094e-06], 0, 4.10594, 1667939229], "v": "v0.6"}
{"i": [["[\"mul\", 1, 1, 1, 240]", "cuda -keys=cuda,gpu -max_num_threads=1024 -model=unknown -thread_warp_size=32", [-1, 16, 64, 49152, 2147483647, 1024, 8, 32], "", 0, []], [[], [["FU", 2, [0, 1, 2, 3]], ["SP", 2, 0, 240, [32], 1], ["AN", 2, 0, 5], ["AN", 2, 1, 6]]]], "r": [[2.58046e-06, 2.57532e-06, 2.5921e-06], 0, 4.34621, 1667939229], "v": "v0.6"}
{"i": [["[\"mul\", 1, 1, 1, 240]", "cuda -keys=cuda,gpu -max_num_threads=1024 -model=unknown -thread_warp_size=32", [-1, 16, 64, 49152, 2147483647, 1024, 8, 32], "", 0, []], [[], [["FU", 2, [0, 1, 2, 3]], ["SP", 2, 0, 240, [4], 1], ["AN", 2, 0, 5], ["AN", 2, 1, 6]]]], "r": [[2.50973e-06, 2.51342e-06, 2.513e-06], 0, 4.60549, 1667939229], "v": "v0.6"}
{"i": [["[\"mul\", 1, 1, 1, 240]", "cuda -keys=cuda,gpu -max_num_threads=1024 -model=unknown -thread_warp_size=32", [-1, 16, 64, 49152, 2147483647, 1024, 8, 32], "", 0, []], [[], [["FU", 2, [0, 1, 2, 3]], ["SP", 2, 0, 240, [40], 1], ["AN", 2, 0, 5], ["AN", 2, 1, 6]]]], "r": [[2.51521e-06, 2.51412e-06, 2.5561e-06], 0, 4.90453, 1667939230], "v": "v0.6"}
{"i": [["[\"mul\", 1, 1, 1, 240]", "cuda -keys=cuda,gpu -max_num_threads=1024 -model=unknown -thread_warp_size=32", [-1, 16, 64, 49152, 2147483647, 1024, 8, 32], "", 0, []], [[], [["FU", 2, [0, 1, 2, 3]], ["SP", 2, 0, 240, [8], 1], ["AN", 2, 0, 5], ["AN", 2, 1, 6]]]], "r": [[2.59798e-06, 2.59724e-06, 2.61602e-06], 0, 5.18267, 1667939230], "v": "v0.6"}
