python/models/efficientnet/VertiFusionEfficientNet_kernel_configs/efficient_batch_norm_1_56_56_144.log
{"i": [["[\"batch_norm\", 1, 56, 56, 144]", "cuda -keys=cuda,gpu -max_num_threads=1024 -model=unknown -thread_warp_size=32", [-1, 16, 64, 49152, 2147483647, 1024, 8, 32], "", 0, []], [[], [["CI", 2], ["FU", 4, [0, 1, 2, 3]], ["SP", 4, 0, 451584, [1], 1], ["AN", 4, 0, 5], ["AN", 4, 1, 6]]]], "r": [[0.000337613, 0.00033759, 0.000337597], 0, 2.41648, 1667925573], "v": "v0.6"}
{"i": [["[\"batch_norm\", 1, 56, 56, 144]", "cuda -keys=cuda,gpu -max_num_threads=1024 -model=unknown -thread_warp_size=32", [-1, 16, 64, 49152, 2147483647, 1024, 8, 32], "", 0, []], [[], [["CI", 2], ["FU", 4, [0, 1, 2, 3]], ["SP", 4, 0, 451584, [18], 1], ["AN", 4, 0, 5], ["AN", 4, 1, 6]]]], "r": [[2.13509e-05, 2.13553e-05, 2.13554e-05], 0, 0.773602, 1667925572], "v": "v0.6"}
{"i": [["[\"batch_norm\", 1, 56, 56, 144]", "cuda -keys=cuda,gpu -max_num_threads=1024 -model=unknown -thread_warp_size=32", [-1, 16, 64, 49152, 2147483647, 1024, 8, 32], "", 0, []], [[], [["CI", 2], ["FU", 4, [0, 1, 2, 3]], ["SP", 4, 0, 451584, [64], 1], ["AN", 4, 0, 5], ["AN", 4, 1, 6]]]], "r": [[7.9975e-06, 7.99797e-06, 7.99919e-06], 0, 1.90041, 1667925573], "v": "v0.6"}
{"i": [["[\"batch_norm\", 1, 56, 56, 144]", "cuda -keys=cuda,gpu -max_num_threads=1024 -model=unknown -thread_warp_size=32", [-1, 16, 64, 49152, 2147483647, 1024, 8, 32], "", 0, []], [[], [["CI", 2], ["FU", 4, [0, 1, 2, 3]], ["SP", 4, 0, 451584, [4], 1], ["AN", 4, 0, 5], ["AN", 4, 1, 6]]]], "r": [[8.63207e-05, 8.63153e-05, 8.63238e-05], 0, 1.56758, 1667925572], "v": "v0.6"}
{"i": [["[\"batch_norm\", 1, 56, 56, 144]", "cuda -keys=cuda,gpu -max_num_threads=1024 -model=unknown -thread_warp_size=32", [-1, 16, 64, 49152, 2147483647, 1024, 8, 32], "", 0, []], [[], [["CI", 2], ["FU", 4, [0, 1, 2, 3]], ["SP", 4, 0, 451584, [42], 1], ["AN", 4, 0, 5], ["AN", 4, 1, 6]]]], "r": [[1.05684e-05, 1.05708e-05, 1.05713e-05], 0, 1.13633, 1667925572], "v": "v0.6"}
{"i": [["[\"batch_norm\", 1, 56, 56, 144]", "cuda -keys=cuda,gpu -max_num_threads=1024 -model=unknown -thread_warp_size=32", [-1, 16, 64, 49152, 2147483647, 1024, 8, 32], "", 0, []], [[], [["CI", 2], ["FU", 4, [0, 1, 2, 3]], ["SP", 4, 0, 451584, [56], 1], ["AN", 4, 0, 5], ["AN", 4, 1, 6]]]], "r": [[8.67807e-06, 8.67711e-06, 8.67392e-06], 0, 2.70061, 1667925574], "v": "v0.6"}
{"i": [["[\"batch_norm\", 1, 56, 56, 144]", "cuda -keys=cuda,gpu -max_num_threads=1024 -model=unknown -thread_warp_size=32", [-1, 16, 64, 49152, 2147483647, 1024, 8, 32], "", 0, []], [[], [["CI", 2], ["FU", 4, [0, 1, 2, 3]], ["SP", 4, 0, 451584, [9], 1], ["AN", 4, 0, 5], ["AN", 4, 1, 6]]]], "r": [[3.99514e-05, 3.99464e-05, 3.99647e-05], 0, 2.09638, 1667925573], "v": "v0.6"}
{"i": [["[\"batch_norm\", 1, 56, 56, 144]", "cuda -keys=cuda,gpu -max_num_threads=1024 -model=unknown -thread_warp_size=32", [-1, 16, 64, 49152, 2147483647, 1024, 8, 32], "", 0, []], [[], [["CI", 2], ["FU", 4, [0, 1, 2, 3]], ["SP", 4, 0, 451584, [32], 1], ["AN", 4, 0, 5], ["AN", 4, 1, 6]]]], "r": [[1.31782e-05, 1.31769e-05, 1.31755e-05], 0, 2.9882, 1667925574], "v": "v0.6"}
{"i": [["[\"batch_norm\", 1, 56, 56, 144]", "cuda -keys=cuda,gpu -max_num_threads=1024 -model=unknown -thread_warp_size=32", [-1, 16, 64, 49152, 2147483647, 1024, 8, 32], "", 0, []], [[], [["CI", 2], ["FU", 4, [0, 1, 2, 3]], ["SP", 4, 0, 451584, [2], 1], ["AN", 4, 0, 5], ["AN", 4, 1, 6]]]], "r": [[0.000170179, 0.000170165, 0.000170192], 0, 3.68141, 1667925575], "v": "v0.6"}
{"i": [["[\"batch_norm\", 1, 56, 56, 144]", "cuda -keys=cuda,gpu -max_num_threads=1024 -model=unknown -thread_warp_size=32", [-1, 16, 64, 49152, 2147483647, 1024, 8, 32], "", 0, []], [[], [["CI", 2], ["FU", 4, [0, 1, 2, 3]], ["SP", 4, 0, 451584, [12], 1], ["AN", 4, 0, 5], ["AN", 4, 1, 6]]]], "r": [[3.06602e-05, 3.06536e-05, 3.06571e-05], 0, 3.27893, 1667925574], "v": "v0.6"}
{"i": [["[\"batch_norm\", 1, 56, 56, 144]", "cuda -keys=cuda,gpu -max_num_threads=1024 -model=unknown -thread_warp_size=32", [-1, 16, 64, 49152, 2147483647, 1024, 8, 32], "", 0, []], [[], [["CI", 2], ["FU", 4, [0, 1, 2, 3]], ["SP", 4, 0, 451584, [24], 1], ["AN", 4, 0, 5], ["AN", 4, 1, 6]]]], "r": [[1.68558e-05, 1.68519e-05, 1.68642e-05], 0, 3.93695, 1667925575], "v": "v0.6"}
{"i": [["[\"batch_norm\", 1, 56, 56, 144]", "cuda -keys=cuda,gpu -max_num_threads=1024 -model=unknown -thread_warp_size=32", [-1, 16, 64, 49152, 2147483647, 1024, 8, 32], "", 0, []], [[], [["CI", 2], ["FU", 4, [0, 1, 2, 3]], ["SP", 4, 0, 451584, [7], 1], ["AN", 4, 0, 5], ["AN", 4, 1, 6]]]], "r": [[5.05505e-05, 5.05567e-05, 5.05517e-05], 0, 4.2074, 1667925576], "v": "v0.6"}
{"i": [["[\"batch_norm\", 1, 56, 56, 144]", "cuda -keys=cuda,gpu -max_num_threads=1024 -model=unknown -thread_warp_size=32", [-1, 16, 64, 49152, 2147483647, 1024, 8, 32], "", 0, []], [[], [["CI", 2], ["FU", 4, [0, 1, 2, 3]], ["SP", 4, 0, 451584, [3], 1], ["AN", 4, 0, 5], ["AN", 4, 1, 6]]]], "r": [[0.000114362, 0.000114371, 0.000114383], 0, 4.56847, 1667925576], "v": "v0.6"}
{"i": [["[\"batch_norm\", 1, 56, 56, 144]", "cuda -keys=cuda,gpu -max_num_threads=1024 -model=unknown -thread_warp_size=32", [-1, 16, 64, 49152, 2147483647, 1024, 8, 32], "", 0, []], [[], [["CI", 2], ["FU", 4, [0, 1, 2, 3]], ["SP", 4, 0, 451584, [16], 1], ["AN", 4, 0, 5], ["AN", 4, 1, 6]]]], "r": [[2.368e-05, 2.36815e-05, 2.36713e-05], 0, 5.20409, 1667925577], "v": "v0.6"}
{"i": [["[\"batch_norm\", 1, 56, 56, 144]", "cuda -keys=cuda,gpu -max_num_threads=1024 -model=unknown -thread_warp_size=32", [-1, 16, 64, 49152, 2147483647, 1024, 8, 32], "", 0, []], [[], [["CI", 2], ["FU", 4, [0, 1, 2, 3]], ["SP", 4, 0, 451584, [36], 1], ["AN", 4, 0, 5], ["AN", 4, 1, 6]]]], "r": [[1.18979e-05, 1.18881e-05, 1.18802e-05], 0, 4.84664, 1667925576], "v": "v0.6"}
{"i": [["[\"batch_norm\", 1, 56, 56, 144]", "cuda -keys=cuda,gpu -max_num_threads=1024 -model=unknown -thread_warp_size=32", [-1, 16, 64, 49152, 2147483647, 1024, 8, 32], "", 0, []], [[], [["CI", 2], ["FU", 4, [0, 1, 2, 3]], ["SP", 4, 0, 451584, [21], 1], ["AN", 4, 0, 5], ["AN", 4, 1, 6]]]], "r": [[1.8723e-05, 1.87178e-05, 1.87304e-05], 0, 5.53732, 1667925577], "v": "v0.6"}
{"i": [["[\"batch_norm\", 1, 56, 56, 144]", "cuda -keys=cuda,gpu -max_num_threads=1024 -model=unknown -thread_warp_size=32", [-1, 16, 64, 49152, 2147483647, 1024, 8, 32], "", 0, []], [[], [["CI", 2], ["FU", 4, [0, 1, 2, 3]], ["SP", 4, 0, 451584, [49], 1], ["AN", 4, 0, 5], ["AN", 4, 1, 6]]]], "r": [[9.51839e-06, 9.52349e-06, 9.51562e-06], 0, 5.81514, 1667925577], "v": "v0.6"}
{"i": [["[\"batch_norm\", 1, 56, 56, 144]", "cuda -keys=cuda,gpu -max_num_threads=1024 -model=unknown -thread_warp_size=32", [-1, 16, 64, 49152, 2147483647, 1024, 8, 32], "", 0, []], [[], [["CI", 2], ["FU", 4, [0, 1, 2, 3]], ["SP", 4, 0, 451584, [48], 1], ["AN", 4, 0, 5], ["AN", 4, 1, 6]]]], "r": [[9.56606e-06, 9.5714e-06, 9.56521e-06], 0, 6.10296, 1667925578], "v": "v0.6"}
{"i": [["[\"batch_norm\", 1, 56, 56, 144]", "cuda -keys=cuda,gpu -max_num_threads=1024 -model=unknown -thread_warp_size=32", [-1, 16, 64, 49152, 2147483647, 1024, 8, 32], "", 0, []], [[], [["CI", 2], ["FU", 4, [0, 1, 2, 3]], ["SP", 4, 0, 451584, [14], 1], ["AN", 4, 0, 5], ["AN", 4, 1, 6]]]], "r": [[2.66129e-05, 2.66108e-05, 2.66119e-05], 0, 6.46928, 1667925578], "v": "v0.6"}
{"i": [["[\"batch_norm\", 1, 56, 56, 144]", "cuda -keys=cuda,gpu -max_num_threads=1024 -model=unknown -thread_warp_size=32", [-1, 16, 64, 49152, 2147483647, 1024, 8, 32], "", 0, []], [[], [["CI", 2], ["FU", 4, [0, 1, 2, 3]], ["SP", 4, 0, 451584, [8], 1], ["AN", 4, 0, 5], ["AN", 4, 1, 6]]]], "r": [[4.46521e-05, 4.46419e-05, 4.46367e-05], 0, 6.76964, 1667925579], "v": "v0.6"}
{"i": [["[\"batch_norm\", 1, 56, 56, 144]", "cuda -keys=cuda,gpu -max_num_threads=1024 -model=unknown -thread_warp_size=32", [-1, 16, 64, 49152, 2147483647, 1024, 8, 32], "", 0, []], [[], [["CI", 2], ["FU", 4, [0, 1, 2, 3]], ["SP", 4, 0, 451584, [56], 1], ["AN", 4, 0, 5], ["AN", 4, 1, 6]]]], "r": [[8.76668e-06, 8.75843e-06, 8.7681e-06], 0, 0.739695, 1667934354], "v": "v0.6"}
{"i": [["[\"batch_norm\", 1, 56, 56, 144]", "cuda -keys=cuda,gpu -max_num_threads=1024 -model=unknown -thread_warp_size=32", [-1, 16, 64, 49152, 2147483647, 1024, 8, 32], "", 0, []], [[], [["CI", 2], ["FU", 4, [0, 1, 2, 3]], ["SP", 4, 0, 451584, [12], 1], ["AN", 4, 0, 5], ["AN", 4, 1, 6]]]], "r": [[3.05932e-05, 3.05988e-05, 3.05563e-05], 0, 1.0334, 1667934355], "v": "v0.6"}
{"i": [["[\"batch_norm\", 1, 56, 56, 144]", "cuda -keys=cuda,gpu -max_num_threads=1024 -model=unknown -thread_warp_size=32", [-1, 16, 64, 49152, 2147483647, 1024, 8, 32], "", 0, []], [[], [["CI", 2], ["FU", 4, [0, 1, 2, 3]], ["SP", 4, 0, 451584, [2], 1], ["AN", 4, 0, 5], ["AN", 4, 1, 6]]]], "r": [[0.000170255, 0.000170229, 0.000170242], 0, 1.9684, 1667934356], "v": "v0.6"}
{"i": [["[\"batch_norm\", 1, 56, 56, 144]", "cuda -keys=cuda,gpu -max_num_threads=1024 -model=unknown -thread_warp_size=32", [-1, 16, 64, 49152, 2147483647, 1024, 8, 32], "", 0, []], [[], [["CI", 2], ["FU", 4, [0, 1, 2, 3]], ["SP", 4, 0, 451584, [42], 1], ["AN", 4, 0, 5], ["AN", 4, 1, 6]]]], "r": [[1.06252e-05, 1.06145e-05, 1.06083e-05], 0, 1.74886, 1667934356], "v": "v0.6"}
{"i": [["[\"batch_norm\", 1, 56, 56, 144]", "cuda -keys=cuda,gpu -max_num_threads=1024 -model=unknown -thread_warp_size=32", [-1, 16, 64, 49152, 2147483647, 1024, 8, 32], "", 0, []], [[], [["CI", 2], ["FU", 4, [0, 1, 2, 3]], ["SP", 4, 0, 451584, [36], 1], ["AN", 4, 0, 5], ["AN", 4, 1, 6]]]], "r": [[1.19625e-05, 1.19581e-05, 1.19477e-05], 0, 1.4271, 1667934355], "v": "v0.6"}
{"i": [["[\"batch_norm\", 1, 56, 56, 144]", "cuda -keys=cuda,gpu -max_num_threads=1024 -model=unknown -thread_warp_size=32", [-1, 16, 64, 49152, 2147483647, 1024, 8, 32], "", 0, []], [[], [["CI", 2], ["FU", 4, [0, 1, 2, 3]], ["SP", 4, 0, 451584, [24], 1], ["AN", 4, 0, 5], ["AN", 4, 1, 6]]]], "r": [[1.67278e-05, 1.67317e-05, 1.67289e-05], 0, 2.27504, 1667934356], "v": "v0.6"}
{"i": [["[\"batch_norm\", 1, 56, 56, 144]", "cuda -keys=cuda,gpu -max_num_threads=1024 -model=unknown -thread_warp_size=32", [-1, 16, 64, 49152, 2147483647, 1024, 8, 32], "", 0, []], [[], [["CI", 2], ["FU", 4, [0, 1, 2, 3]], ["SP", 4, 0, 451584, [7], 1], ["AN", 4, 0, 5], ["AN", 4, 1, 6]]]], "r": [[5.05564e-05, 5.05614e-05, 5.05606e-05], 0, 2.53952, 1667934357], "v": "v0.6"}
{"i": [["[\"batch_norm\", 1, 56, 56, 144]", "cuda -keys=cuda,gpu -max_num_threads=1024 -model=unknown -thread_warp_size=32", [-1, 16, 64, 49152, 2147483647, 1024, 8, 32], "", 0, []], [[], [["CI", 2], ["FU", 4, [0, 1, 2, 3]], ["SP", 4, 0, 451584, [1], 1], ["AN", 4, 0, 5], ["AN", 4, 1, 6]]]], "r": [[0.000337649, 0.00033765, 0.000337716], 0, 2.71179, 1667934357], "v": "v0.6"}
{"i": [["[\"batch_norm\", 1, 56, 56, 144]", "cuda -keys=cuda,gpu -max_num_threads=1024 -model=unknown -thread_warp_size=32", [-1, 16, 64, 49152, 2147483647, 1024, 8, 32], "", 0, []], [[], [["CI", 2], ["FU", 4, [0, 1, 2, 3]], ["SP", 4, 0, 451584, [48], 1], ["AN", 4, 0, 5], ["AN", 4, 1, 6]]]], "r": [[9.58675e-06, 9.58868e-06, 9.58822e-06], 0, 3.04382, 1667934357], "v": "v0.6"}
{"i": [["[\"batch_norm\", 1, 56, 56, 144]", "cuda -keys=cuda,gpu -max_num_threads=1024 -model=unknown -thread_warp_size=32", [-1, 16, 64, 49152, 2147483647, 1024, 8, 32], "", 0, []], [[], [["CI", 2], ["FU", 4, [0, 1, 2, 3]], ["SP", 4, 0, 451584, [4], 1], ["AN", 4, 0, 5], ["AN", 4, 1, 6]]]], "r": [[8.63504e-05, 8.63599e-05, 8.63706e-05], 0, 3.71335, 1667934358], "v": "v0.6"}
{"i": [["[\"batch_norm\", 1, 56, 56, 144]", "cuda -keys=cuda,gpu -max_num_threads=1024 -model=unknown -thread_warp_size=32", [-1, 16, 64, 49152, 2147483647, 1024, 8, 32], "", 0, []], [[], [["CI", 2], ["FU", 4, [0, 1, 2, 3]], ["SP", 4, 0, 451584, [6], 1], ["AN", 4, 0, 5], ["AN", 4, 1, 6]]]], "r": [[5.85441e-05, 5.85552e-05, 5.85549e-05], 0, 3.91466, 1667934358], "v": "v0.6"}
{"i": [["[\"batch_norm\", 1, 56, 56, 144]", "cuda -keys=cuda,gpu -max_num_threads=1024 -model=unknown -thread_warp_size=32", [-1, 16, 64, 49152, 2147483647, 1024, 8, 32], "", 0, []], [[], [["CI", 2], ["FU", 4, [0, 1, 2, 3]], ["SP", 4, 0, 451584, [32], 1], ["AN", 4, 0, 5], ["AN", 4, 1, 6]]]], "r": [[1.30979e-05, 1.31017e-05, 1.3093e-05], 0, 4.25132, 1667934359], "v": "v0.6"}
{"i": [["[\"batch_norm\", 1, 56, 56, 144]", "cuda -keys=cuda,gpu -max_num_threads=1024 -model=unknown -thread_warp_size=32", [-1, 16, 64, 49152, 2147483647, 1024, 8, 32], "", 0, []], [[], [["CI", 2], ["FU", 4, [0, 1, 2, 3]], ["SP", 4, 0, 451584, [18], 1], ["AN", 4, 0, 5], ["AN", 4, 1, 6]]]], "r": [[2.14742e-05, 2.14735e-05, 2.14733e-05], 0, 4.53664, 1667934359], "v": "v0.6"}
{"i": [["[\"batch_norm\", 1, 56, 56, 144]", "cuda -keys=cuda,gpu -max_num_threads=1024 -model=unknown -thread_warp_size=32", [-1, 16, 64, 49152, 2147483647, 1024, 8, 32], "", 0, []], [[], [["CI", 2], ["FU", 4, [0, 1, 2, 3]], ["SP", 4, 0, 451584, [49], 1], ["AN", 4, 0, 5], ["AN", 4, 1, 6]]]], "r": [[9.50979e-06, 9.5091e-06, 9.51015e-06], 0, 4.72645, 1667934359], "v": "v0.6"}
{"i": [["[\"batch_norm\", 1, 56, 56, 144]", "cuda -keys=cuda,gpu -max_num_threads=1024 -model=unknown -thread_warp_size=32", [-1, 16, 64, 49152, 2147483647, 1024, 8, 32], "", 0, []], [[], [["CI", 2], ["FU", 4, [0, 1, 2, 3]], ["SP", 4, 0, 451584, [21], 1], ["AN", 4, 0, 5], ["AN", 4, 1, 6]]]], "r": [[1.88613e-05, 1.88604e-05, 1.88703e-05], 0, 5.41827, 1667934360], "v": "v0.6"}
{"i": [["[\"batch_norm\", 1, 56, 56, 144]", "cuda -keys=cuda,gpu -max_num_threads=1024 -model=unknown -thread_warp_size=32", [-1, 16, 64, 49152, 2147483647, 1024, 8, 32], "", 0, []], [[], [["CI", 2], ["FU", 4, [0, 1, 2, 3]], ["SP", 4, 0, 451584, [16], 1], ["AN", 4, 0, 5], ["AN", 4, 1, 6]]]], "r": [[2.35933e-05, 2.35926e-05, 2.35977e-05], 0, 5.0802, 1667934360], "v": "v0.6"}
{"i": [["[\"batch_norm\", 1, 56, 56, 144]", "cuda -keys=cuda,gpu -max_num_threads=1024 -model=unknown -thread_warp_size=32", [-1, 16, 64, 49152, 2147483647, 1024, 8, 32], "", 0, []], [[], [["CI", 2], ["FU", 4, [0, 1, 2, 3]], ["SP", 4, 0, 451584, [14], 1], ["AN", 4, 0, 5], ["AN", 4, 1, 6]]]], "r": [[2.66018e-05, 2.66002e-05, 2.65951e-05], 0, 5.60257, 1667934360], "v": "v0.6"}
{"i": [["[\"batch_norm\", 1, 56, 56, 144]", "cuda -keys=cuda,gpu -max_num_threads=1024 -model=unknown -thread_warp_size=32", [-1, 16, 64, 49152, 2147483647, 1024, 8, 32], "", 0, []], [[], [["CI", 2], ["FU", 4, [0, 1, 2, 3]], ["SP", 4, 0, 451584, [28], 1], ["AN", 4, 0, 5], ["AN", 4, 1, 6]]]], "r": [[1.485e-05, 1.48384e-05, 1.48446e-05], 0, 5.97479, 1667934361], "v": "v0.6"}
{"i": [["[\"batch_norm\", 1, 56, 56, 144]", "cuda -keys=cuda,gpu -max_num_threads=1024 -model=unknown -thread_warp_size=32", [-1, 16, 64, 49152, 2147483647, 1024, 8, 32], "", 0, []], [[], [["CI", 2], ["FU", 4, [0, 1, 2, 3]], ["SP", 4, 0, 451584, [63], 1], ["AN", 4, 0, 5], ["AN", 4, 1, 6]]]], "r": [[7.93756e-06, 7.9396e-06, 7.93502e-06], 0, 3.35126, 1667934358], "v": "v0.6"}
{"i": [["[\"batch_norm\", 1, 56, 56, 144]", "cuda -keys=cuda,gpu -max_num_threads=1024 -model=unknown -thread_warp_size=32", [-1, 16, 64, 49152, 2147483647, 1024, 8, 32], "", 0, []], [[], [["CI", 2], ["FU", 4, [0, 1, 2, 3]], ["SP", 4, 0, 451584, [3], 1], ["AN", 4, 0, 5], ["AN", 4, 1, 6]]]], "r": [[0.000114268, 0.000114304, 0.000114283], 0, 6.31266, 1667934361], "v": "v0.6"}
{"i": [["[\"batch_norm\", 1, 56, 56, 144]", "cuda -keys=cuda,gpu -max_num_threads=1024 -model=unknown -thread_warp_size=32", [-1, 16, 64, 49152, 2147483647, 1024, 8, 32], "", 0, []], [[], [["CI", 2], ["FU", 4, [0, 1, 2, 3]], ["SP", 4, 0, 451584, [8], 1], ["AN", 4, 0, 5], ["AN", 4, 1, 6]]]], "r": [[4.45237e-05, 4.45174e-05, 4.4533e-05], 0, 6.61739, 1667934361], "v": "v0.6"}
{"i": [["[\"batch_norm\", 1, 56, 56, 144]", "cuda -keys=cuda,gpu -max_num_threads=1024 -model=unknown -thread_warp_size=32", [-1, 16, 64, 49152, 2147483647, 1024, 8, 32], "", 0, []], [[], [["CI", 2], ["FU", 4, [0, 1, 2, 3]], ["SP", 4, 0, 451584, [64], 1], ["AN", 4, 0, 5], ["AN", 4, 1, 6]]]], "r": [[7.92241e-06, 7.91057e-06, 7.91684e-06], 0, 7.13588, 1667934362], "v": "v0.6"}
{"i": [["[\"batch_norm\", 1, 56, 56, 144]", "cuda -keys=cuda,gpu -max_num_threads=1024 -model=unknown -thread_warp_size=32", [-1, 16, 64, 49152, 2147483647, 1024, 8, 32], "", 0, []], [[], [["CI", 2], ["FU", 4, [0, 1, 2, 3]], ["SP", 4, 0, 451584, [9], 1], ["AN", 4, 0, 5], ["AN", 4, 1, 6]]]], "r": [[4.00111e-05, 4.00174e-05, 4.00145e-05], 0, 6.8421, 1667934362], "v": "v0.6"}
{"i": [["[\"batch_norm\", 1, 56, 56, 144]", "cuda -keys=cuda,gpu -max_num_threads=1024 -model=unknown -thread_warp_size=32", [-1, 16, 64, 49152, 2147483647, 1024, 8, 32], "", 0, []], [[], [["CI", 2], ["FU", 4, [0, 1, 2, 3]], ["SP", 4, 0, 451584, [42], 1], ["AN", 4, 0, 5], ["AN", 4, 1, 6]]]], "r": [[1.05944e-05, 1.05915e-05, 1.05838e-05], 0, 0.756964, 1667934762], "v": "v0.6"}
{"i": [["[\"batch_norm\", 1, 56, 56, 144]", "cuda -keys=cuda,gpu -max_num_threads=1024 -model=unknown -thread_warp_size=32", [-1, 16, 64, 49152, 2147483647, 1024, 8, 32], "", 0, []], [[], [["CI", 2], ["FU", 4, [0, 1, 2, 3]], ["SP", 4, 0, 451584, [14], 1], ["AN", 4, 0, 5], ["AN", 4, 1, 6]]]], "r": [[2.66745e-05, 2.66662e-05, 2.66623e-05], 0, 3.67082, 1667934765], "v": "v0.6"}
{"i": [["[\"batch_norm\", 1, 56, 56, 144]", "cuda -keys=cuda,gpu -max_num_threads=1024 -model=unknown -thread_warp_size=32", [-1, 16, 64, 49152, 2147483647, 1024, 8, 32], "", 0, []], [[], [["CI", 2], ["FU", 4, [0, 1, 2, 3]], ["SP", 4, 0, 451584, [32], 1], ["AN", 4, 0, 5], ["AN", 4, 1, 6]]]], "r": [[1.31653e-05, 1.31624e-05, 1.31648e-05], 0, 1.38526, 1667934763], "v": "v0.6"}
{"i": [["[\"batch_norm\", 1, 56, 56, 144]", "cuda -keys=cuda,gpu -max_num_threads=1024 -model=unknown -thread_warp_size=32", [-1, 16, 64, 49152, 2147483647, 1024, 8, 32], "", 0, []], [[], [["CI", 2], ["FU", 4, [0, 1, 2, 3]], ["SP", 4, 0, 451584, [28], 1], ["AN", 4, 0, 5], ["AN", 4, 1, 6]]]], "r": [[1.48139e-05, 1.48205e-05, 1.48107e-05], 0, 0.985488, 1667934762], "v": "v0.6"}
{"i": [["[\"batch_norm\", 1, 56, 56, 144]", "cuda -keys=cuda,gpu -max_num_threads=1024 -model=unknown -thread_warp_size=32", [-1, 16, 64, 49152, 2147483647, 1024, 8, 32], "", 0, []], [[], [["CI", 2], ["FU", 4, [0, 1, 2, 3]], ["SP", 4, 0, 451584, [6], 1], ["AN", 4, 0, 5], ["AN", 4, 1, 6]]]], "r": [[5.85583e-05, 5.8561e-05, 5.85497e-05], 0, 2.76052, 1667934764], "v": "v0.6"}
{"i": [["[\"batch_norm\", 1, 56, 56, 144]", "cuda -keys=cuda,gpu -max_num_threads=1024 -model=unknown -thread_warp_size=32", [-1, 16, 64, 49152, 2147483647, 1024, 8, 32], "", 0, []], [[], [["CI", 2], ["FU", 4, [0, 1, 2, 3]], ["SP", 4, 0, 451584, [2], 1], ["AN", 4, 0, 5], ["AN", 4, 1, 6]]]], "r": [[0.000170207, 0.000170193, 0.000170192], 0, 3.04341, 1667934764], "v": "v0.6"}
{"i": [["[\"batch_norm\", 1, 56, 56, 144]", "cuda -keys=cuda,gpu -max_num_threads=1024 -model=unknown -thread_warp_size=32", [-1, 16, 64, 49152, 2147483647, 1024, 8, 32], "", 0, []], [[], [["CI", 2], ["FU", 4, [0, 1, 2, 3]], ["SP", 4, 0, 451584, [4], 1], ["AN", 4, 0, 5], ["AN", 4, 1, 6]]]], "r": [[8.63825e-05, 8.63982e-05, 8.63733e-05], 0, 2.05861, 1667934763], "v": "v0.6"}
{"i": [["[\"batch_norm\", 1, 56, 56, 144]", "cuda -keys=cuda,gpu -max_num_threads=1024 -model=unknown -thread_warp_size=32", [-1, 16, 64, 49152, 2147483647, 1024, 8, 32], "", 0, []], [[], [["CI", 2], ["FU", 4, [0, 1, 2, 3]], ["SP", 4, 0, 451584, [21], 1], ["AN", 4, 0, 5], ["AN", 4, 1, 6]]]], "r": [[1.86817e-05, 1.86906e-05, 1.86891e-05], 0, 0.642417, 1667934762], "v": "v0.6"}
{"i": [["[\"batch_norm\", 1, 56, 56, 144]", "cuda -keys=cuda,gpu -max_num_threads=1024 -model=unknown -thread_warp_size=32", [-1, 16, 64, 49152, 2147483647, 1024, 8, 32], "", 0, []], [[], [["CI", 2], ["FU", 4, [0, 1, 2, 3]], ["SP", 4, 0, 451584, [12], 1], ["AN", 4, 0, 5], ["AN", 4, 1, 6]]]], "r": [[3.07523e-05, 3.07621e-05, 3.07561e-05], 0, 2.38758, 1667934764], "v": "v0.6"}
{"i": [["[\"batch_norm\", 1, 56, 56, 144]", "cuda -keys=cuda,gpu -max_num_threads=1024 -model=unknown -thread_warp_size=32", [-1, 16, 64, 49152, 2147483647, 1024, 8, 32], "", 0, []], [[], [["CI", 2], ["FU", 4, [0, 1, 2, 3]], ["SP", 4, 0, 451584, [63], 1], ["AN", 4, 0, 5], ["AN", 4, 1, 6]]]], "r": [[7.99999e-06, 7.99713e-06, 7.99813e-06], 0, 1.6875, 1667934763], "v": "v0.6"}
{"i": [["[\"batch_norm\", 1, 56, 56, 144]", "cuda -keys=cuda,gpu -max_num_threads=1024 -model=unknown -thread_warp_size=32", [-1, 16, 64, 49152, 2147483647, 1024, 8, 32], "", 0, []], [[], [["CI", 2], ["FU", 4, [0, 1, 2, 3]], ["SP", 4, 0, 451584, [64], 1], ["AN", 4, 0, 5], ["AN", 4, 1, 6]]]], "r": [[7.9357e-06, 7.94089e-06, 7.93024e-06], 0, 3.99938, 1667934765], "v": "v0.6"}
{"i": [["[\"batch_norm\", 1, 56, 56, 144]", "cuda -keys=cuda,gpu -max_num_threads=1024 -model=unknown -thread_warp_size=32", [-1, 16, 64, 49152, 2147483647, 1024, 8, 32], "", 0, []], [[], [["CI", 2], ["FU", 4, [0, 1, 2, 3]], ["SP", 4, 0, 451584, [9], 1], ["AN", 4, 0, 5], ["AN", 4, 1, 6]]]], "r": [[3.98372e-05, 3.98333e-05, 3.98246e-05], 0, 4.29108, 1667934766], "v": "v0.6"}
{"i": [["[\"batch_norm\", 1, 56, 56, 144]", "cuda -keys=cuda,gpu -max_num_threads=1024 -model=unknown -thread_warp_size=32", [-1, 16, 64, 49152, 2147483647, 1024, 8, 32], "", 0, []], [[], [["CI", 2], ["FU", 4, [0, 1, 2, 3]], ["SP", 4, 0, 451584, [1], 1], ["AN", 4, 0, 5], ["AN", 4, 1, 6]]]], "r": [[0.000337632, 0.000337573, 0.000337622], 0, 4.79917, 1667934766], "v": "v0.6"}
{"i": [["[\"batch_norm\", 1, 56, 56, 144]", "cuda -keys=cuda,gpu -max_num_threads=1024 -model=unknown -thread_warp_size=32", [-1, 16, 64, 49152, 2147483647, 1024, 8, 32], "", 0, []], [[], [["CI", 2], ["FU", 4, [0, 1, 2, 3]], ["SP", 4, 0, 451584, [16], 1], ["AN", 4, 0, 5], ["AN", 4, 1, 6]]]], "r": [[2.37844e-05, 2.37899e-05, 2.38028e-05], 0, 4.57369, 1667934766], "v": "v0.6"}
{"i": [["[\"batch_norm\", 1, 56, 56, 144]", "cuda -keys=cuda,gpu -max_num_threads=1024 -model=unknown -thread_warp_size=32", [-1, 16, 64, 49152, 2147483647, 1024, 8, 32], "", 0, []], [[], [["CI", 2], ["FU", 4, [0, 1, 2, 3]], ["SP", 4, 0, 451584, [18], 1], ["AN", 4, 0, 5], ["AN", 4, 1, 6]]]], "r": [[2.13161e-05, 2.1312e-05, 2.1314e-05], 0, 5.12955, 1667934767], "v": "v0.6"}
{"i": [["[\"batch_norm\", 1, 56, 56, 144]", "cuda -keys=cuda,gpu -max_num_threads=1024 -model=unknown -thread_warp_size=32", [-1, 16, 64, 49152, 2147483647, 1024, 8, 32], "", 0, []], [[], [["CI", 2], ["FU", 4, [0, 1, 2, 3]], ["SP", 4, 0, 451584, [3], 1], ["AN", 4, 0, 5], ["AN", 4, 1, 6]]]], "r": [[0.00011438, 0.00011438, 0.000114378], 0, 5.42305, 1667934767], "v": "v0.6"}
{"i": [["[\"batch_norm\", 1, 56, 56, 144]", "cuda -keys=cuda,gpu -max_num_threads=1024 -model=unknown -thread_warp_size=32", [-1, 16, 64, 49152, 2147483647, 1024, 8, 32], "", 0, []], [[], [["CI", 2], ["FU", 4, [0, 1, 2, 3]], ["SP", 4, 0, 451584, [24], 1], ["AN", 4, 0, 5], ["AN", 4, 1, 6]]]], "r": [[1.67193e-05, 1.67138e-05, 1.6716e-05], 0, 5.71803, 1667934767], "v": "v0.6"}
{"i": [["[\"batch_norm\", 1, 56, 56, 144]", "cuda -keys=cuda,gpu -max_num_threads=1024 -model=unknown -thread_warp_size=32", [-1, 16, 64, 49152, 2147483647, 1024, 8, 32], "", 0, []], [[], [["CI", 2], ["FU", 4, [0, 1, 2, 3]], ["SP", 4, 0, 451584, [7], 1], ["AN", 4, 0, 5], ["AN", 4, 1, 6]]]], "r": [[5.05146e-05, 5.05191e-05, 5.05342e-05], 0, 5.99259, 1667934768], "v": "v0.6"}
{"i": [["[\"batch_norm\", 1, 56, 56, 144]", "cuda -keys=cuda,gpu -max_num_threads=1024 -model=unknown -thread_warp_size=32", [-1, 16, 64, 49152, 2147483647, 1024, 8, 32], "", 0, []], [[], [["CI", 2], ["FU", 4, [0, 1, 2, 3]], ["SP", 4, 0, 451584, [48], 1], ["AN", 4, 0, 5], ["AN", 4, 1, 6]]]], "r": [[9.7996e-06, 9.79447e-06, 9.7973e-06], 0, 6.31514, 1667934768], "v": "v0.6"}
{"i": [["[\"batch_norm\", 1, 56, 56, 144]", "cuda -keys=cuda,gpu -max_num_threads=1024 -model=unknown -thread_warp_size=32", [-1, 16, 64, 49152, 2147483647, 1024, 8, 32], "", 0, []], [[], [["CI", 2], ["FU", 4, [0, 1, 2, 3]], ["SP", 4, 0, 451584, [8], 1], ["AN", 4, 0, 5], ["AN", 4, 1, 6]]]], "r": [[4.45799e-05, 4.45707e-05, 4.45782e-05], 0, 6.60664, 1667934769], "v": "v0.6"}
{"i": [["[\"batch_norm\", 1, 56, 56, 144]", "cuda -keys=cuda,gpu -max_num_threads=1024 -model=unknown -thread_warp_size=32", [-1, 16, 64, 49152, 2147483647, 1024, 8, 32], "", 0, []], [[], [["CI", 2], ["FU", 4, [0, 1, 2, 3]], ["SP", 4, 0, 451584, [36], 1], ["AN", 4, 0, 5], ["AN", 4, 1, 6]]]], "r": [[1.1956e-05, 1.1954e-05, 1.19519e-05], 0, 6.97466, 1667934769], "v": "v0.6"}
{"i": [["[\"batch_norm\", 1, 56, 56, 144]", "cuda -keys=cuda,gpu -max_num_threads=1024 -model=unknown -thread_warp_size=32", [-1, 16, 64, 49152, 2147483647, 1024, 8, 32], "", 0, []], [[], [["CI", 2], ["FU", 4, [0, 1, 2, 3]], ["SP", 4, 0, 451584, [49], 1], ["AN", 4, 0, 5], ["AN", 4, 1, 6]]]], "r": [[9.45081e-06, 9.45114e-06, 9.45269e-06], 0, 3.33348, 1667934765], "v": "v0.6"}
{"i": [["[\"batch_norm\", 1, 56, 56, 144]", "cuda -keys=cuda,gpu -max_num_threads=1024 -model=unknown -thread_warp_size=32", [-1, 16, 64, 49152, 2147483647, 1024, 8, 32], "", 0, []], [[], [["CI", 2], ["FU", 4, [0, 1, 2, 3]], ["SP", 4, 0, 451584, [56], 1], ["AN", 4, 0, 5], ["AN", 4, 1, 6]]]], "r": [[8.62201e-06, 8.62032e-06, 8.61928e-06], 0, 7.22903, 1667934769], "v": "v0.6"}
{"i": [["[\"batch_norm\", 1, 56, 56, 144]", "cuda -keys=cuda,gpu -max_num_threads=1024 -model=unknown -thread_warp_size=32", [-1, 16, 64, 49152, 2147483647, 1024, 8, 32], "", 0, []], [[], [["CI", 2], ["FU", 4, [0, 1, 2, 3]], ["SP", 4, 0, 451584, [36], 1], ["AN", 4, 0, 5], ["AN", 4, 1, 6]]]], "r": [[1.18757e-05, 1.18751e-05, 1.18829e-05], 0, 2.24199, 1667935921], "v": "v0.6"}
{"i": [["[\"batch_norm\", 1, 56, 56, 144]", "cuda -keys=cuda,gpu -max_num_threads=1024 -model=unknown -thread_warp_size=32", [-1, 16, 64, 49152, 2147483647, 1024, 8, 32], "", 0, []], [[], [["CI", 2], ["FU", 4, [0, 1, 2, 3]], ["SP", 4, 0, 451584, [14], 1], ["AN", 4, 0, 5], ["AN", 4, 1, 6]]]], "r": [[2.66333e-05, 2.6636e-05, 2.66394e-05], 0, 1.92763, 1667935920], "v": "v0.6"}
{"i": [["[\"batch_norm\", 1, 56, 56, 144]", "cuda -keys=cuda,gpu -max_num_threads=1024 -model=unknown -thread_warp_size=32", [-1, 16, 64, 49152, 2147483647, 1024, 8, 32], "", 0, []], [[], [["CI", 2], ["FU", 4, [0, 1, 2, 3]], ["SP", 4, 0, 451584, [28], 1], ["AN", 4, 0, 5], ["AN", 4, 1, 6]]]], "r": [[1.48084e-05, 1.48034e-05, 1.47996e-05], 0, 1.03544, 1667935919], "v": "v0.6"}
{"i": [["[\"batch_norm\", 1, 56, 56, 144]", "cuda -keys=cuda,gpu -max_num_threads=1024 -model=unknown -thread_warp_size=32", [-1, 16, 64, 49152, 2147483647, 1024, 8, 32], "", 0, []], [[], [["CI", 2], ["FU", 4, [0, 1, 2, 3]], ["SP", 4, 0, 451584, [1], 1], ["AN", 4, 0, 5], ["AN", 4, 1, 6]]]], "r": [[0.000337592, 0.000337628, 0.000337596], 0, 2.59667, 1667935921], "v": "v0.6"}
{"i": [["[\"batch_norm\", 1, 56, 56, 144]", "cuda -keys=cuda,gpu -max_num_threads=1024 -model=unknown -thread_warp_size=32", [-1, 16, 64, 49152, 2147483647, 1024, 8, 32], "", 0, []], [[], [["CI", 2], ["FU", 4, [0, 1, 2, 3]], ["SP", 4, 0, 451584, [42], 1], ["AN", 4, 0, 5], ["AN", 4, 1, 6]]]], "r": [[1.06867e-05, 1.06799e-05, 1.06821e-05], 0, 0.641269, 1667935919], "v": "v0.6"}
{"i": [["[\"batch_norm\", 1, 56, 56, 144]", "cuda -keys=cuda,gpu -max_num_threads=1024 -model=unknown -thread_warp_size=32", [-1, 16, 64, 49152, 2147483647, 1024, 8, 32], "", 0, []], [[], [["CI", 2], ["FU", 4, [0, 1, 2, 3]], ["SP", 4, 0, 451584, [56], 1], ["AN", 4, 0, 5], ["AN", 4, 1, 6]]]], "r": [[8.76822e-06, 8.76493e-06, 8.76844e-06], 0, 1.64564, 1667935920], "v": "v0.6"}
{"i": [["[\"batch_norm\", 1, 56, 56, 144]", "cuda -keys=cuda,gpu -max_num_threads=1024 -model=unknown -thread_warp_size=32", [-1, 16, 64, 49152, 2147483647, 1024, 8, 32], "", 0, []], [[], [["CI", 2], ["FU", 4, [0, 1, 2, 3]], ["SP", 4, 0, 451584, [6], 1], ["AN", 4, 0, 5], ["AN", 4, 1, 6]]]], "r": [[5.86008e-05, 5.86101e-05, 5.85931e-05], 0, 1.29263, 1667935920], "v": "v0.6"}
{"i": [["[\"batch_norm\", 1, 56, 56, 144]", "cuda -keys=cuda,gpu -max_num_threads=1024 -model=unknown -thread_warp_size=32", [-1, 16, 64, 49152, 2147483647, 1024, 8, 32], "", 0, []], [[], [["CI", 2], ["FU", 4, [0, 1, 2, 3]], ["SP", 4, 0, 451584, [4], 1], ["AN", 4, 0, 5], ["AN", 4, 1, 6]]]], "r": [[8.63836e-05, 8.63658e-05, 8.63873e-05], 0, 2.87288, 1667935922], "v": "v0.6"}
{"i": [["[\"batch_norm\", 1, 56, 56, 144]", "cuda -keys=cuda,gpu -max_num_threads=1024 -model=unknown -thread_warp_size=32", [-1, 16, 64, 49152, 2147483647, 1024, 8, 32], "", 0, []], [[], [["CI", 2], ["FU", 4, [0, 1, 2, 3]], ["SP", 4, 0, 451584, [2], 1], ["AN", 4, 0, 5], ["AN", 4, 1, 6]]]], "r": [[0.000170199, 0.000170206, 0.00017021], 0, 3.07788, 1667935922], "v": "v0.6"}
{"i": [["[\"batch_norm\", 1, 56, 56, 144]", "cuda -keys=cuda,gpu -max_num_threads=1024 -model=unknown -thread_warp_size=32", [-1, 16, 64, 49152, 2147483647, 1024, 8, 32], "", 0, []], [[], [["CI", 2], ["FU", 4, [0, 1, 2, 3]], ["SP", 4, 0, 451584, [16], 1], ["AN", 4, 0, 5], ["AN", 4, 1, 6]]]], "r": [[2.36016e-05, 2.36047e-05, 2.36044e-05], 0, 3.37279, 1667935922], "v": "v0.6"}
{"i": [["[\"batch_norm\", 1, 56, 56, 144]", "cuda -keys=cuda,gpu -max_num_threads=1024 -model=unknown -thread_warp_size=32", [-1, 16, 64, 49152, 2147483647, 1024, 8, 32], "", 0, []], [[], [["CI", 2], ["FU", 4, [0, 1, 2, 3]], ["SP", 4, 0, 451584, [63], 1], ["AN", 4, 0, 5], ["AN", 4, 1, 6]]]], "r": [[7.9699e-06, 7.96417e-06, 7.96971e-06], 0, 4.33685, 1667935923], "v": "v0.6"}
{"i": [["[\"batch_norm\", 1, 56, 56, 144]", "cuda -keys=cuda,gpu -max_num_threads=1024 -model=unknown -thread_warp_size=32", [-1, 16, 64, 49152, 2147483647, 1024, 8, 32], "", 0, []], [[], [["CI", 2], ["FU", 4, [0, 1, 2, 3]], ["SP", 4, 0, 451584, [64], 1], ["AN", 4, 0, 5], ["AN", 4, 1, 6]]]], "r": [[7.84767e-06, 7.84355e-06, 7.84545e-06], 0, 3.95095, 1667935923], "v": "v0.6"}
{"i": [["[\"batch_norm\", 1, 56, 56, 144]", "cuda -keys=cuda,gpu -max_num_threads=1024 -model=unknown -thread_warp_size=32", [-1, 16, 64, 49152, 2147483647, 1024, 8, 32], "", 0, []], [[], [["CI", 2], ["FU", 4, [0, 1, 2, 3]], ["SP", 4, 0, 451584, [32], 1], ["AN", 4, 0, 5], ["AN", 4, 1, 6]]]], "r": [[1.31678e-05, 1.31653e-05, 1.31683e-05], 0, 4.50398, 1667935924], "v": "v0.6"}
{"i": [["[\"batch_norm\", 1, 56, 56, 144]", "cuda -keys=cuda,gpu -max_num_threads=1024 -model=unknown -thread_warp_size=32", [-1, 16, 64, 49152, 2147483647, 1024, 8, 32], "", 0, []], [[], [["CI", 2], ["FU", 4, [0, 1, 2, 3]], ["SP", 4, 0, 451584, [49], 1], ["AN", 4, 0, 5], ["AN", 4, 1, 6]]]], "r": [[9.4247e-06, 9.42379e-06, 9.42672e-06], 0, 4.76938, 1667935924], "v": "v0.6"}
{"i": [["[\"batch_norm\", 1, 56, 56, 144]", "cuda -keys=cuda,gpu -max_num_threads=1024 -model=unknown -thread_warp_size=32", [-1, 16, 64, 49152, 2147483647, 1024, 8, 32], "", 0, []], [[], [["CI", 2], ["FU", 4, [0, 1, 2, 3]], ["SP", 4, 0, 451584, [7], 1], ["AN", 4, 0, 5], ["AN", 4, 1, 6]]]], "r": [[5.05211e-05, 5.05075e-05, 5.0515e-05], 0, 5.07913, 1667935924], "v": "v0.6"}
{"i": [["[\"batch_norm\", 1, 56, 56, 144]", "cuda -keys=cuda,gpu -max_num_threads=1024 -model=unknown -thread_warp_size=32", [-1, 16, 64, 49152, 2147483647, 1024, 8, 32], "", 0, []], [[], [["CI", 2], ["FU", 4, [0, 1, 2, 3]], ["SP", 4, 0, 451584, [18], 1], ["AN", 4, 0, 5], ["AN", 4, 1, 6]]]], "r": [[2.14146e-05, 2.14129e-05, 2.14079e-05], 0, 5.3703, 1667935925], "v": "v0.6"}
{"i": [["[\"batch_norm\", 1, 56, 56, 144]", "cuda -keys=cuda,gpu -max_num_threads=1024 -model=unknown -thread_warp_size=32", [-1, 16, 64, 49152, 2147483647, 1024, 8, 32], "", 0, []], [[], [["CI", 2], ["FU", 4, [0, 1, 2, 3]], ["SP", 4, 0, 451584, [24], 1], ["AN", 4, 0, 5], ["AN", 4, 1, 6]]]], "r": [[1.67135e-05, 1.67188e-05, 1.67197e-05], 0, 5.66472, 1667935925], "v": "v0.6"}
{"i": [["[\"batch_norm\", 1, 56, 56, 144]", "cuda -keys=cuda,gpu -max_num_threads=1024 -model=unknown -thread_warp_size=32", [-1, 16, 64, 49152, 2147483647, 1024, 8, 32], "", 0, []], [[], [["CI", 2], ["FU", 4, [0, 1, 2, 3]], ["SP", 4, 0, 451584, [12], 1], ["AN", 4, 0, 5], ["AN", 4, 1, 6]]]], "r": [[3.06379e-05, 3.06451e-05, 3.06347e-05], 0, 5.97261, 1667935925], "v": "v0.6"}
{"i": [["[\"batch_norm\", 1, 56, 56, 144]", "cuda -keys=cuda,gpu -max_num_threads=1024 -model=unknown -thread_warp_size=32", [-1, 16, 64, 49152, 2147483647, 1024, 8, 32], "", 0, []], [[], [["CI", 2], ["FU", 4, [0, 1, 2, 3]], ["SP", 4, 0, 451584, [8], 1], ["AN", 4, 0, 5], ["AN", 4, 1, 6]]]], "r": [[4.46445e-05, 4.4649e-05, 4.46301e-05], 0, 6.23388, 1667935926], "v": "v0.6"}
{"i": [["[\"batch_norm\", 1, 56, 56, 144]", "cuda -keys=cuda,gpu -max_num_threads=1024 -model=unknown -thread_warp_size=32", [-1, 16, 64, 49152, 2147483647, 1024, 8, 32], "", 0, []], [[], [["CI", 2], ["FU", 4, [0, 1, 2, 3]], ["SP", 4, 0, 451584, [48], 1], ["AN", 4, 0, 5], ["AN", 4, 1, 6]]]], "r": [[9.58292e-06, 9.5879e-06, 9.58404e-06], 0, 6.61188, 1667935926], "v": "v0.6"}
{"i": [["[\"batch_norm\", 1, 56, 56, 144]", "cuda -keys=cuda,gpu -max_num_threads=1024 -model=unknown -thread_warp_size=32", [-1, 16, 64, 49152, 2147483647, 1024, 8, 32], "", 0, []], [[], [["CI", 2], ["FU", 4, [0, 1, 2, 3]], ["SP", 4, 0, 451584, [9], 1], ["AN", 4, 0, 5], ["AN", 4, 1, 6]]]], "r": [[3.98757e-05, 3.98733e-05, 3.98686e-05], 0, 3.63341, 1667935923], "v": "v0.6"}
{"i": [["[\"batch_norm\", 1, 56, 56, 144]", "cuda -keys=cuda,gpu -max_num_threads=1024 -model=unknown -thread_warp_size=32", [-1, 16, 64, 49152, 2147483647, 1024, 8, 32], "", 0, []], [[], [["CI", 2], ["FU", 4, [0, 1, 2, 3]], ["SP", 4, 0, 451584, [3], 1], ["AN", 4, 0, 5], ["AN", 4, 1, 6]]]], "r": [[0.000114301, 0.000114288, 0.000114299], 0, 6.88356, 1667935926], "v": "v0.6"}
{"i": [["[\"batch_norm\", 1, 56, 56, 144]", "cuda -keys=cuda,gpu -max_num_threads=1024 -model=unknown -thread_warp_size=32", [-1, 16, 64, 49152, 2147483647, 1024, 8, 32], "", 0, []], [[], [["CI", 2], ["FU", 4, [0, 1, 2, 3]], ["SP", 4, 0, 451584, [21], 1], ["AN", 4, 0, 5], ["AN", 4, 1, 6]]]], "r": [[1.86429e-05, 1.86441e-05, 1.86371e-05], 0, 7.15233, 1667935927], "v": "v0.6"}
{"i": [["[\"batch_norm\", 1, 56, 56, 144]", "cuda -keys=cuda,gpu -max_num_threads=1024 -model=unknown -thread_warp_size=32", [-1, 16, 64, 49152, 2147483647, 1024, 8, 32], "", 0, []], [[], [["CI", 2], ["FU", 4, [0, 1, 2, 3]], ["SP", 4, 0, 451584, [1], 1], ["AN", 4, 0, 5], ["AN", 4, 1, 6]]]], "r": [[0.000337656, 0.000337636, 0.000337589], 0, 1.70983, 1667935970], "v": "v0.6"}
{"i": [["[\"batch_norm\", 1, 56, 56, 144]", "cuda -keys=cuda,gpu -max_num_threads=1024 -model=unknown -thread_warp_size=32", [-1, 16, 64, 49152, 2147483647, 1024, 8, 32], "", 0, []], [[], [["CI", 2], ["FU", 4, [0, 1, 2, 3]], ["SP", 4, 0, 451584, [8], 1], ["AN", 4, 0, 5], ["AN", 4, 1, 6]]]], "r": [[4.45197e-05, 4.45123e-05, 4.4492e-05], 0, 1.36952, 1667935970], "v": "v0.6"}
{"i": [["[\"batch_norm\", 1, 56, 56, 144]", "cuda -keys=cuda,gpu -max_num_threads=1024 -model=unknown -thread_warp_size=32", [-1, 16, 64, 49152, 2147483647, 1024, 8, 32], "", 0, []], [[], [["CI", 2], ["FU", 4, [0, 1, 2, 3]], ["SP", 4, 0, 451584, [42], 1], ["AN", 4, 0, 5], ["AN", 4, 1, 6]]]], "r": [[1.07773e-05, 1.07704e-05, 1.07697e-05], 0, 1.03813, 1667935969], "v": "v0.6"}
{"i": [["[\"batch_norm\", 1, 56, 56, 144]", "cuda -keys=cuda,gpu -max_num_threads=1024 -model=unknown -thread_warp_size=32", [-1, 16, 64, 49152, 2147483647, 1024, 8, 32], "", 0, []], [[], [["CI", 2], ["FU", 4, [0, 1, 2, 3]], ["SP", 4, 0, 451584, [18], 1], ["AN", 4, 0, 5], ["AN", 4, 1, 6]]]], "r": [[2.13078e-05, 2.13011e-05, 2.1306e-05], 0, 2.01041, 1667935970], "v": "v0.6"}
{"i": [["[\"batch_norm\", 1, 56, 56, 144]", "cuda -keys=cuda,gpu -max_num_threads=1024 -model=unknown -thread_warp_size=32", [-1, 16, 64, 49152, 2147483647, 1024, 8, 32], "", 0, []], [[], [["CI", 2], ["FU", 4, [0, 1, 2, 3]], ["SP", 4, 0, 451584, [12], 1], ["AN", 4, 0, 5], ["AN", 4, 1, 6]]]], "r": [[3.05428e-05, 3.05377e-05, 3.0536e-05], 0, 0.630313, 1667935969], "v": "v0.6"}
{"i": [["[\"batch_norm\", 1, 56, 56, 144]", "cuda -keys=cuda,gpu -max_num_threads=1024 -model=unknown -thread_warp_size=32", [-1, 16, 64, 49152, 2147483647, 1024, 8, 32], "", 0, []], [[], [["CI", 2], ["FU", 4, [0, 1, 2, 3]], ["SP", 4, 0, 451584, [14], 1], ["AN", 4, 0, 5], ["AN", 4, 1, 6]]]], "r": [[2.66815e-05, 2.66803e-05, 2.66759e-05], 0, 2.31211, 1667935971], "v": "v0.6"}
{"i": [["[\"batch_norm\", 1, 56, 56, 144]", "cuda -keys=cuda,gpu -max_num_threads=1024 -model=unknown -thread_warp_size=32", [-1, 16, 64, 49152, 2147483647, 1024, 8, 32], "", 0, []], [[], [["CI", 2], ["FU", 4, [0, 1, 2, 3]], ["SP", 4, 0, 451584, [64], 1], ["AN", 4, 0, 5], ["AN", 4, 1, 6]]]], "r": [[7.8887e-06, 7.88036e-06, 7.8862e-06], 0, 2.72577, 1667935971], "v": "v0.6"}
{"i": [["[\"batch_norm\", 1, 56, 56, 144]", "cuda -keys=cuda,gpu -max_num_threads=1024 -model=unknown -thread_warp_size=32", [-1, 16, 64, 49152, 2147483647, 1024, 8, 32], "", 0, []], [[], [["CI", 2], ["FU", 4, [0, 1, 2, 3]], ["SP", 4, 0, 451584, [36], 1], ["AN", 4, 0, 5], ["AN", 4, 1, 6]]]], "r": [[1.1899e-05, 1.18755e-05, 1.18893e-05], 0, 2.96024, 1667935971], "v": "v0.6"}
{"i": [["[\"batch_norm\", 1, 56, 56, 144]", "cuda -keys=cuda,gpu -max_num_threads=1024 -model=unknown -thread_warp_size=32", [-1, 16, 64, 49152, 2147483647, 1024, 8, 32], "", 0, []], [[], [["CI", 2], ["FU", 4, [0, 1, 2, 3]], ["SP", 4, 0, 451584, [24], 1], ["AN", 4, 0, 5], ["AN", 4, 1, 6]]]], "r": [[1.67562e-05, 1.67578e-05, 1.67561e-05], 0, 3.20955, 1667935972], "v": "v0.6"}
{"i": [["[\"batch_norm\", 1, 56, 56, 144]", "cuda -keys=cuda,gpu -max_num_threads=1024 -model=unknown -thread_warp_size=32", [-1, 16, 64, 49152, 2147483647, 1024, 8, 32], "", 0, []], [[], [["CI", 2], ["FU", 4, [0, 1, 2, 3]], ["SP", 4, 0, 451584, [9], 1], ["AN", 4, 0, 5], ["AN", 4, 1, 6]]]], "r": [[3.97972e-05, 3.98037e-05, 3.98001e-05], 0, 3.45109, 1667935972], "v": "v0.6"}
{"i": [["[\"batch_norm\", 1, 56, 56, 144]", "cuda -keys=cuda,gpu -max_num_threads=1024 -model=unknown -thread_warp_size=32", [-1, 16, 64, 49152, 2147483647, 1024, 8, 32], "", 0, []], [[], [["CI", 2], ["FU", 4, [0, 1, 2, 3]], ["SP", 4, 0, 451584, [32], 1], ["AN", 4, 0, 5], ["AN", 4, 1, 6]]]], "r": [[1.31828e-05, 1.31835e-05, 1.31855e-05], 0, 3.74373, 1667935972], "v": "v0.6"}
{"i": [["[\"batch_norm\", 1, 56, 56, 144]", "cuda -keys=cuda,gpu -max_num_threads=1024 -model=unknown -thread_warp_size=32", [-1, 16, 64, 49152, 2147483647, 1024, 8, 32], "", 0, []], [[], [["CI", 2], ["FU", 4, [0, 1, 2, 3]], ["SP", 4, 0, 451584, [4], 1], ["AN", 4, 0, 5], ["AN", 4, 1, 6]]]], "r": [[8.63526e-05, 8.63418e-05, 8.63493e-05], 0, 3.98663, 1667935973], "v": "v0.6"}
{"i": [["[\"batch_norm\", 1, 56, 56, 144]", "cuda -keys=cuda,gpu -max_num_threads=1024 -model=unknown -thread_warp_size=32", [-1, 16, 64, 49152, 2147483647, 1024, 8, 32], "", 0, []], [[], [["CI", 2], ["FU", 4, [0, 1, 2, 3]], ["SP", 4, 0, 451584, [16], 1], ["AN", 4, 0, 5], ["AN", 4, 1, 6]]]], "r": [[2.37494e-05, 2.37552e-05, 2.37555e-05], 0, 4.71783, 1667935974], "v": "v0.6"}
{"i": [["[\"batch_norm\", 1, 56, 56, 144]", "cuda -keys=cuda,gpu -max_num_threads=1024 -model=unknown -thread_warp_size=32", [-1, 16, 64, 49152, 2147483647, 1024, 8, 32], "", 0, []], [[], [["CI", 2], ["FU", 4, [0, 1, 2, 3]], ["SP", 4, 0, 451584, [49], 1], ["AN", 4, 0, 5], ["AN", 4, 1, 6]]]], "r": [[9.57355e-06, 9.5655e-06, 9.5711e-06], 0, 4.17935, 1667935973], "v": "v0.6"}
{"i": [["[\"batch_norm\", 1, 56, 56, 144]", "cuda -keys=cuda,gpu -max_num_threads=1024 -model=unknown -thread_warp_size=32", [-1, 16, 64, 49152, 2147483647, 1024, 8, 32], "", 0, []], [[], [["CI", 2], ["FU", 4, [0, 1, 2, 3]], ["SP", 4, 0, 451584, [21], 1], ["AN", 4, 0, 5], ["AN", 4, 1, 6]]]], "r": [[1.86827e-05, 1.86897e-05, 1.86705e-05], 0, 5.69462, 1667935975], "v": "v0.6"}
{"i": [["[\"batch_norm\", 1, 56, 56, 144]", "cuda -keys=cuda,gpu -max_num_threads=1024 -model=unknown -thread_warp_size=32", [-1, 16, 64, 49152, 2147483647, 1024, 8, 32], "", 0, []], [[], [["CI", 2], ["FU", 4, [0, 1, 2, 3]], ["SP", 4, 0, 451584, [2], 1], ["AN", 4, 0, 5], ["AN", 4, 1, 6]]]], "r": [[0.00017024, 0.000170154, 0.000170197], 0, 4.38219, 1667935973], "v": "v0.6"}
{"i": [["[\"batch_norm\", 1, 56, 56, 144]", "cuda -keys=cuda,gpu -max_num_threads=1024 -model=unknown -thread_warp_size=32", [-1, 16, 64, 49152, 2147483647, 1024, 8, 32], "", 0, []], [[], [["CI", 2], ["FU", 4, [0, 1, 2, 3]], ["SP", 4, 0, 451584, [48], 1], ["AN", 4, 0, 5], ["AN", 4, 1, 6]]]], "r": [[9.56983e-06, 9.57095e-06, 9.56831e-06], 0, 6.00416, 1667935975], "v": "v0.6"}
{"i": [["[\"batch_norm\", 1, 56, 56, 144]", "cuda -keys=cuda,gpu -max_num_threads=1024 -model=unknown -thread_warp_size=32", [-1, 16, 64, 49152, 2147483647, 1024, 8, 32], "", 0, []], [[], [["CI", 2], ["FU", 4, [0, 1, 2, 3]], ["SP", 4, 0, 451584, [7], 1], ["AN", 4, 0, 5], ["AN", 4, 1, 6]]]], "r": [[5.05679e-05, 5.05634e-05, 5.05649e-05], 0, 5.10508, 1667935974], "v": "v0.6"}
{"i": [["[\"batch_norm\", 1, 56, 56, 144]", "cuda -keys=cuda,gpu -max_num_threads=1024 -model=unknown -thread_warp_size=32", [-1, 16, 64, 49152, 2147483647, 1024, 8, 32], "", 0, []], [[], [["CI", 2], ["FU", 4, [0, 1, 2, 3]], ["SP", 4, 0, 451584, [28], 1], ["AN", 4, 0, 5], ["AN", 4, 1, 6]]]], "r": [[1.4704e-05, 1.46986e-05, 1.46963e-05], 0, 5.36086, 1667935975], "v": "v0.6"}
{"i": [["[\"batch_norm\", 1, 56, 56, 144]", "cuda -keys=cuda,gpu -max_num_threads=1024 -model=unknown -thread_warp_size=32", [-1, 16, 64, 49152, 2147483647, 1024, 8, 32], "", 0, []], [[], [["CI", 2], ["FU", 4, [0, 1, 2, 3]], ["SP", 4, 0, 451584, [63], 1], ["AN", 4, 0, 5], ["AN", 4, 1, 6]]]], "r": [[7.95565e-06, 7.95244e-06, 7.94911e-06], 0, 6.30189, 1667935976], "v": "v0.6"}
{"i": [["[\"batch_norm\", 1, 56, 56, 144]", "cuda -keys=cuda,gpu -max_num_threads=1024 -model=unknown -thread_warp_size=32", [-1, 16, 64, 49152, 2147483647, 1024, 8, 32], "", 0, []], [[], [["CI", 2], ["FU", 4, [0, 1, 2, 3]], ["SP", 4, 0, 451584, [6], 1], ["AN", 4, 0, 5], ["AN", 4, 1, 6]]]], "r": [[5.86166e-05, 5.86306e-05, 5.86188e-05], 0, 6.58848, 1667935976], "v": "v0.6"}
{"i": [["[\"batch_norm\", 1, 56, 56, 144]", "cuda -keys=cuda,gpu -max_num_threads=1024 -model=unknown -thread_warp_size=32", [-1, 16, 64, 49152, 2147483647, 1024, 8, 32], "", 0, []], [[], [["CI", 2], ["FU", 4, [0, 1, 2, 3]], ["SP", 4, 0, 451584, [3], 1], ["AN", 4, 0, 5], ["AN", 4, 1, 6]]]], "r": [[0.000114397, 0.000114378, 0.000114385], 0, 7.17914, 1667935977], "v": "v0.6"}
{"i": [["[\"batch_norm\", 1, 56, 56, 144]", "cuda -keys=cuda,gpu -max_num_threads=1024 -model=unknown -thread_warp_size=32", [-1, 16, 64, 49152, 2147483647, 1024, 8, 32], "", 0, []], [[], [["CI", 2], ["FU", 4, [0, 1, 2, 3]], ["SP", 4, 0, 451584, [56], 1], ["AN", 4, 0, 5], ["AN", 4, 1, 6]]]], "r": [[8.64323e-06, 8.6337e-06, 8.63372e-06], 0, 6.92808, 1667935976], "v": "v0.6"}
