python/models/efficientnet/VertiFusionEfficientNet_kernel_configs/efficient_batch_norm_1_112_112_32.log
{"i": [["[\"batch_norm\", 1, 112, 112, 32]", "cuda -keys=cuda,gpu -max_num_threads=1024 -model=unknown -thread_warp_size=32", [-1, 16, 64, 49152, 2147483647, 1024, 8, 32], "", 0, []], [[], [["CI", 2], ["FU", 4, [0, 1, 2, 3]], ["SP", 4, 0, 401408, [8], 1], ["AN", 4, 0, 5], ["AN", 4, 1, 6]]]], "r": [[3.97596e-05, 3.97659e-05, 3.97632e-05], 0, 2.75625, 1667924552], "v": "v0.6"}
{"i": [["[\"batch_norm\", 1, 112, 112, 32]", "cuda -keys=cuda,gpu -max_num_threads=1024 -model=unknown -thread_warp_size=32", [-1, 16, 64, 49152, 2147483647, 1024, 8, 32], "", 0, []], [[], [["CI", 2], ["FU", 4, [0, 1, 2, 3]], ["SP", 4, 0, 401408, [7], 1], ["AN", 4, 0, 5], ["AN", 4, 1, 6]]]], "r": [[4.51464e-05, 4.5142e-05, 4.51458e-05], 0, 0.890457, 1667924551], "v": "v0.6"}
{"i": [["[\"batch_norm\", 1, 112, 112, 32]", "cuda -keys=cuda,gpu -max_num_threads=1024 -model=unknown -thread_warp_size=32", [-1, 16, 64, 49152, 2147483647, 1024, 8, 32], "", 0, []], [[], [["CI", 2], ["FU", 4, [0, 1, 2, 3]], ["SP", 4, 0, 401408, [56], 1], ["AN", 4, 0, 5], ["AN", 4, 1, 6]]]], "r": [[8.01888e-06, 8.01631e-06, 7.99625e-06], 0, 2.33849, 1667924552], "v": "v0.6"}
{"i": [["[\"batch_norm\", 1, 112, 112, 32]", "cuda -keys=cuda,gpu -max_num_threads=1024 -model=unknown -thread_warp_size=32", [-1, 16, 64, 49152, 2147483647, 1024, 8, 32], "", 0, []], [[], [["CI", 2], ["FU", 4, [0, 1, 2, 3]], ["SP", 4, 0, 401408, [2], 1], ["AN", 4, 0, 5], ["AN", 4, 1, 6]]]], "r": [[0.000151421, 0.000151428, 0.000151435], 0, 1.98407, 1667924552], "v": "v0.6"}
{"i": [["[\"batch_norm\", 1, 112, 112, 32]", "cuda -keys=cuda,gpu -max_num_threads=1024 -model=unknown -thread_warp_size=32", [-1, 16, 64, 49152, 2147483647, 1024, 8, 32], "", 0, []], [[], [["CI", 2], ["FU", 4, [0, 1, 2, 3]], ["SP", 4, 0, 401408, [64], 1], ["AN", 4, 0, 5], ["AN", 4, 1, 6]]]], "r": [[7.2477e-06, 7.24743e-06, 7.24947e-06], 0, 1.21386, 1667924551], "v": "v0.6"}
{"i": [["[\"batch_norm\", 1, 112, 112, 32]", "cuda -keys=cuda,gpu -max_num_threads=1024 -model=unknown -thread_warp_size=32", [-1, 16, 64, 49152, 2147483647, 1024, 8, 32], "", 0, []], [[], [["CI", 2], ["FU", 4, [0, 1, 2, 3]], ["SP", 4, 0, 401408, [28], 1], ["AN", 4, 0, 5], ["AN", 4, 1, 6]]]], "r": [[1.33823e-05, 1.3378e-05, 1.33765e-05], 0, 1.61939, 1667924551], "v": "v0.6"}
{"i": [["[\"batch_norm\", 1, 112, 112, 32]", "cuda -keys=cuda,gpu -max_num_threads=1024 -model=unknown -thread_warp_size=32", [-1, 16, 64, 49152, 2147483647, 1024, 8, 32], "", 0, []], [[], [["CI", 2], ["FU", 4, [0, 1, 2, 3]], ["SP", 4, 0, 401408, [32], 1], ["AN", 4, 0, 5], ["AN", 4, 1, 6]]]], "r": [[1.19665e-05, 1.19682e-05, 1.19632e-05], 0, 0.565654, 1667924550], "v": "v0.6"}
{"i": [["[\"batch_norm\", 1, 112, 112, 32]", "cuda -keys=cuda,gpu -max_num_threads=1024 -model=unknown -thread_warp_size=32", [-1, 16, 64, 49152, 2147483647, 1024, 8, 32], "", 0, []], [[], [["CI", 2], ["FU", 4, [0, 1, 2, 3]], ["SP", 4, 0, 401408, [1], 1], ["AN", 4, 0, 5], ["AN", 4, 1, 6]]]], "r": [[0.000300423, 0.000300443, 0.000300444], 0, 3.0311, 1667924553], "v": "v0.6"}
{"i": [["[\"batch_norm\", 1, 112, 112, 32]", "cuda -keys=cuda,gpu -max_num_threads=1024 -model=unknown -thread_warp_size=32", [-1, 16, 64, 49152, 2147483647, 1024, 8, 32], "", 0, []], [[], [["CI", 2], ["FU", 4, [0, 1, 2, 3]], ["SP", 4, 0, 401408, [14], 1], ["AN", 4, 0, 5], ["AN", 4, 1, 6]]]], "r": [[2.3926e-05, 2.39223e-05, 2.39222e-05], 0, 3.33009, 1667924553], "v": "v0.6"}
{"i": [["[\"batch_norm\", 1, 112, 112, 32]", "cuda -keys=cuda,gpu -max_num_threads=1024 -model=unknown -thread_warp_size=32", [-1, 16, 64, 49152, 2147483647, 1024, 8, 32], "", 0, []], [[], [["CI", 2], ["FU", 4, [0, 1, 2, 3]], ["SP", 4, 0, 401408, [49], 1], ["AN", 4, 0, 5], ["AN", 4, 1, 6]]]], "r": [[8.70507e-06, 8.7041e-06, 8.69453e-06], 0, 3.63855, 1667924554], "v": "v0.6"}
{"i": [["[\"batch_norm\", 1, 112, 112, 32]", "cuda -keys=cuda,gpu -max_num_threads=1024 -model=unknown -thread_warp_size=32", [-1, 16, 64, 49152, 2147483647, 1024, 8, 32], "", 0, []], [[], [["CI", 2], ["FU", 4, [0, 1, 2, 3]], ["SP", 4, 0, 401408, [4], 1], ["AN", 4, 0, 5], ["AN", 4, 1, 6]]]], "r": [[7.70361e-05, 7.70221e-05, 7.70347e-05], 0, 3.96575, 1667924554], "v": "v0.6"}
{"i": [["[\"batch_norm\", 1, 112, 112, 32]", "cuda -keys=cuda,gpu -max_num_threads=1024 -model=unknown -thread_warp_size=32", [-1, 16, 64, 49152, 2147483647, 1024, 8, 32], "", 0, []], [[], [["CI", 2], ["FU", 4, [0, 1, 2, 3]], ["SP", 4, 0, 401408, [16], 1], ["AN", 4, 0, 5], ["AN", 4, 1, 6]]]], "r": [[2.13396e-05, 2.13445e-05, 2.13372e-05], 0, 4.25669, 1667924554], "v": "v0.6"}
{"i": [["[\"batch_norm\", 1, 112, 112, 32]", "cuda -keys=cuda,gpu -max_num_threads=1024 -model=unknown -thread_warp_size=32", [-1, 16, 64, 49152, 2147483647, 1024, 8, 32], "", 0, []], [[], [["CI", 2], ["FU", 4, [0, 1, 2, 3]], ["SP", 4, 0, 401408, [8], 1], ["AN", 4, 0, 5], ["AN", 4, 1, 6]]]], "r": [[3.97754e-05, 3.97818e-05, 3.97836e-05], 0, 0.603992, 1667924816], "v": "v0.6"}
{"i": [["[\"batch_norm\", 1, 112, 112, 32]", "cuda -keys=cuda,gpu -max_num_threads=1024 -model=unknown -thread_warp_size=32", [-1, 16, 64, 49152, 2147483647, 1024, 8, 32], "", 0, []], [[], [["CI", 2], ["FU", 4, [0, 1, 2, 3]], ["SP", 4, 0, 401408, [16], 1], ["AN", 4, 0, 5], ["AN", 4, 1, 6]]]], "r": [[2.13131e-05, 2.13139e-05, 2.1307e-05], 0, 1.44505, 1667924817], "v": "v0.6"}
{"i": [["[\"batch_norm\", 1, 112, 112, 32]", "cuda -keys=cuda,gpu -max_num_threads=1024 -model=unknown -thread_warp_size=32", [-1, 16, 64, 49152, 2147483647, 1024, 8, 32], "", 0, []], [[], [["CI", 2], ["FU", 4, [0, 1, 2, 3]], ["SP", 4, 0, 401408, [7], 1], ["AN", 4, 0, 5], ["AN", 4, 1, 6]]]], "r": [[4.51769e-05, 4.51848e-05, 4.51691e-05], 0, 0.783406, 1667924816], "v": "v0.6"}
{"i": [["[\"batch_norm\", 1, 112, 112, 32]", "cuda -keys=cuda,gpu -max_num_threads=1024 -model=unknown -thread_warp_size=32", [-1, 16, 64, 49152, 2147483647, 1024, 8, 32], "", 0, []], [[], [["CI", 2], ["FU", 4, [0, 1, 2, 3]], ["SP", 4, 0, 401408, [14], 1], ["AN", 4, 0, 5], ["AN", 4, 1, 6]]]], "r": [[2.40896e-05, 2.40822e-05, 2.40815e-05], 0, 1.09519, 1667924816], "v": "v0.6"}
{"i": [["[\"batch_norm\", 1, 112, 112, 32]", "cuda -keys=cuda,gpu -max_num_threads=1024 -model=unknown -thread_warp_size=32", [-1, 16, 64, 49152, 2147483647, 1024, 8, 32], "", 0, []], [[], [["CI", 2], ["FU", 4, [0, 1, 2, 3]], ["SP", 4, 0, 401408, [64], 1], ["AN", 4, 0, 5], ["AN", 4, 1, 6]]]], "r": [[7.25422e-06, 7.25381e-06, 7.25304e-06], 0, 1.72197, 1667924817], "v": "v0.6"}
{"i": [["[\"batch_norm\", 1, 112, 112, 32]", "cuda -keys=cuda,gpu -max_num_threads=1024 -model=unknown -thread_warp_size=32", [-1, 16, 64, 49152, 2147483647, 1024, 8, 32], "", 0, []], [[], [["CI", 2], ["FU", 4, [0, 1, 2, 3]], ["SP", 4, 0, 401408, [49], 1], ["AN", 4, 0, 5], ["AN", 4, 1, 6]]]], "r": [[8.82371e-06, 8.82227e-06, 8.82591e-06], 0, 2.03771, 1667924817], "v": "v0.6"}
{"i": [["[\"batch_norm\", 1, 112, 112, 32]", "cuda -keys=cuda,gpu -max_num_threads=1024 -model=unknown -thread_warp_size=32", [-1, 16, 64, 49152, 2147483647, 1024, 8, 32], "", 0, []], [[], [["CI", 2], ["FU", 4, [0, 1, 2, 3]], ["SP", 4, 0, 401408, [32], 1], ["AN", 4, 0, 5], ["AN", 4, 1, 6]]]], "r": [[1.20302e-05, 1.20284e-05, 1.20274e-05], 0, 2.39596, 1667924818], "v": "v0.6"}
{"i": [["[\"batch_norm\", 1, 112, 112, 32]", "cuda -keys=cuda,gpu -max_num_threads=1024 -model=unknown -thread_warp_size=32", [-1, 16, 64, 49152, 2147483647, 1024, 8, 32], "", 0, []], [[], [["CI", 2], ["FU", 4, [0, 1, 2, 3]], ["SP", 4, 0, 401408, [1], 1], ["AN", 4, 0, 5], ["AN", 4, 1, 6]]]], "r": [[0.000300401, 0.000300428, 0.000300389], 0, 2.64957, 1667924818], "v": "v0.6"}
{"i": [["[\"batch_norm\", 1, 112, 112, 32]", "cuda -keys=cuda,gpu -max_num_threads=1024 -model=unknown -thread_warp_size=32", [-1, 16, 64, 49152, 2147483647, 1024, 8, 32], "", 0, []], [[], [["CI", 2], ["FU", 4, [0, 1, 2, 3]], ["SP", 4, 0, 401408, [28], 1], ["AN", 4, 0, 5], ["AN", 4, 1, 6]]]], "r": [[1.34067e-05, 1.33929e-05, 1.33951e-05], 0, 2.92312, 1667924818], "v": "v0.6"}
{"i": [["[\"batch_norm\", 1, 112, 112, 32]", "cuda -keys=cuda,gpu -max_num_threads=1024 -model=unknown -thread_warp_size=32", [-1, 16, 64, 49152, 2147483647, 1024, 8, 32], "", 0, []], [[], [["CI", 2], ["FU", 4, [0, 1, 2, 3]], ["SP", 4, 0, 401408, [4], 1], ["AN", 4, 0, 5], ["AN", 4, 1, 6]]]], "r": [[7.70568e-05, 7.70343e-05, 7.70392e-05], 0, 3.22647, 1667924819], "v": "v0.6"}
{"i": [["[\"batch_norm\", 1, 112, 112, 32]", "cuda -keys=cuda,gpu -max_num_threads=1024 -model=unknown -thread_warp_size=32", [-1, 16, 64, 49152, 2147483647, 1024, 8, 32], "", 0, []], [[], [["CI", 2], ["FU", 4, [0, 1, 2, 3]], ["SP", 4, 0, 401408, [2], 1], ["AN", 4, 0, 5], ["AN", 4, 1, 6]]]], "r": [[0.000151574, 0.000151584, 0.000151612], 0, 3.49116, 1667924819], "v": "v0.6"}
{"i": [["[\"batch_norm\", 1, 112, 112, 32]", "cuda -keys=cuda,gpu -max_num_threads=1024 -model=unknown -thread_warp_size=32", [-1, 16, 64, 49152, 2147483647, 1024, 8, 32], "", 0, []], [[], [["CI", 2], ["FU", 4, [0, 1, 2, 3]], ["SP", 4, 0, 401408, [56], 1], ["AN", 4, 0, 5], ["AN", 4, 1, 6]]]], "r": [[7.92912e-06, 7.93211e-06, 7.93151e-06], 0, 3.77604, 1667924819], "v": "v0.6"}
{"i": [["[\"batch_norm\", 1, 112, 112, 32]", "cuda -keys=cuda,gpu -max_num_threads=1024 -model=unknown -thread_warp_size=32", [-1, 16, 64, 49152, 2147483647, 1024, 8, 32], "", 0, []], [[], [["CI", 2], ["FU", 4, [0, 1, 2, 3]], ["SP", 4, 0, 401408, [4], 1], ["AN", 4, 0, 5], ["AN", 4, 1, 6]]]], "r": [[7.7163e-05, 7.71413e-05, 7.71584e-05], 0, 0.836212, 1667931238], "v": "v0.6"}
{"i": [["[\"batch_norm\", 1, 112, 112, 32]", "cuda -keys=cuda,gpu -max_num_threads=1024 -model=unknown -thread_warp_size=32", [-1, 16, 64, 49152, 2147483647, 1024, 8, 32], "", 0, []], [[], [["CI", 2], ["FU", 4, [0, 1, 2, 3]], ["SP", 4, 0, 401408, [2], 1], ["AN", 4, 0, 5], ["AN", 4, 1, 6]]]], "r": [[0.000151431, 0.000151549, 0.000151671], 0, 0.578183, 1667931238], "v": "v0.6"}
{"i": [["[\"batch_norm\", 1, 112, 112, 32]", "cuda -keys=cuda,gpu -max_num_threads=1024 -model=unknown -thread_warp_size=32", [-1, 16, 64, 49152, 2147483647, 1024, 8, 32], "", 0, []], [[], [["CI", 2], ["FU", 4, [0, 1, 2, 3]], ["SP", 4, 0, 401408, [64], 1], ["AN", 4, 0, 5], ["AN", 4, 1, 6]]]], "r": [[7.20036e-06, 7.20084e-06, 7.19981e-06], 0, 1.45222, 1667931239], "v": "v0.6"}
{"i": [["[\"batch_norm\", 1, 112, 112, 32]", "cuda -keys=cuda,gpu -max_num_threads=1024 -model=unknown -thread_warp_size=32", [-1, 16, 64, 49152, 2147483647, 1024, 8, 32], "", 0, []], [[], [["CI", 2], ["FU", 4, [0, 1, 2, 3]], ["SP", 4, 0, 401408, [1], 1], ["AN", 4, 0, 5], ["AN", 4, 1, 6]]]], "r": [[0.000300366, 0.000300379, 0.00030041], 0, 1.73776, 1667931240], "v": "v0.6"}
{"i": [["[\"batch_norm\", 1, 112, 112, 32]", "cuda -keys=cuda,gpu -max_num_threads=1024 -model=unknown -thread_warp_size=32", [-1, 16, 64, 49152, 2147483647, 1024, 8, 32], "", 0, []], [[], [["CI", 2], ["FU", 4, [0, 1, 2, 3]], ["SP", 4, 0, 401408, [7], 1], ["AN", 4, 0, 5], ["AN", 4, 1, 6]]]], "r": [[4.5228e-05, 4.5226e-05, 4.52265e-05], 0, 1.06793, 1667931239], "v": "v0.6"}
{"i": [["[\"batch_norm\", 1, 112, 112, 32]", "cuda -keys=cuda,gpu -max_num_threads=1024 -model=unknown -thread_warp_size=32", [-1, 16, 64, 49152, 2147483647, 1024, 8, 32], "", 0, []], [[], [["CI", 2], ["FU", 4, [0, 1, 2, 3]], ["SP", 4, 0, 401408, [56], 1], ["AN", 4, 0, 5], ["AN", 4, 1, 6]]]], "r": [[7.8744e-06, 7.87432e-06, 7.87553e-06], 0, 2.03696, 1667931240], "v": "v0.6"}
{"i": [["[\"batch_norm\", 1, 112, 112, 32]", "cuda -keys=cuda,gpu -max_num_threads=1024 -model=unknown -thread_warp_size=32", [-1, 16, 64, 49152, 2147483647, 1024, 8, 32], "", 0, []], [[], [["CI", 2], ["FU", 4, [0, 1, 2, 3]], ["SP", 4, 0, 401408, [14], 1], ["AN", 4, 0, 5], ["AN", 4, 1, 6]]]], "r": [[2.39757e-05, 2.39783e-05, 2.39723e-05], 0, 2.35082, 1667931240], "v": "v0.6"}
{"i": [["[\"batch_norm\", 1, 112, 112, 32]", "cuda -keys=cuda,gpu -max_num_threads=1024 -model=unknown -thread_warp_size=32", [-1, 16, 64, 49152, 2147483647, 1024, 8, 32], "", 0, []], [[], [["CI", 2], ["FU", 4, [0, 1, 2, 3]], ["SP", 4, 0, 401408, [49], 1], ["AN", 4, 0, 5], ["AN", 4, 1, 6]]]], "r": [[8.64361e-06, 8.64629e-06, 8.64664e-06], 0, 2.62473, 1667931241], "v": "v0.6"}
{"i": [["[\"batch_norm\", 1, 112, 112, 32]", "cuda -keys=cuda,gpu -max_num_threads=1024 -model=unknown -thread_warp_size=32", [-1, 16, 64, 49152, 2147483647, 1024, 8, 32], "", 0, []], [[], [["CI", 2], ["FU", 4, [0, 1, 2, 3]], ["SP", 4, 0, 401408, [28], 1], ["AN", 4, 0, 5], ["AN", 4, 1, 6]]]], "r": [[1.34297e-05, 1.34193e-05, 1.34217e-05], 0, 2.88437, 1667931241], "v": "v0.6"}
{"i": [["[\"batch_norm\", 1, 112, 112, 32]", "cuda -keys=cuda,gpu -max_num_threads=1024 -model=unknown -thread_warp_size=32", [-1, 16, 64, 49152, 2147483647, 1024, 8, 32], "", 0, []], [[], [["CI", 2], ["FU", 4, [0, 1, 2, 3]], ["SP", 4, 0, 401408, [8], 1], ["AN", 4, 0, 5], ["AN", 4, 1, 6]]]], "r": [[3.98158e-05, 3.98119e-05, 3.98266e-05], 0, 3.18647, 1667931241], "v": "v0.6"}
{"i": [["[\"batch_norm\", 1, 112, 112, 32]", "cuda -keys=cuda,gpu -max_num_threads=1024 -model=unknown -thread_warp_size=32", [-1, 16, 64, 49152, 2147483647, 1024, 8, 32], "", 0, []], [[], [["CI", 2], ["FU", 4, [0, 1, 2, 3]], ["SP", 4, 0, 401408, [16], 1], ["AN", 4, 0, 5], ["AN", 4, 1, 6]]]], "r": [[2.14299e-05, 2.14293e-05, 2.14207e-05], 0, 3.4506, 1667931242], "v": "v0.6"}
{"i": [["[\"batch_norm\", 1, 112, 112, 32]", "cuda -keys=cuda,gpu -max_num_threads=1024 -model=unknown -thread_warp_size=32", [-1, 16, 64, 49152, 2147483647, 1024, 8, 32], "", 0, []], [[], [["CI", 2], ["FU", 4, [0, 1, 2, 3]], ["SP", 4, 0, 401408, [32], 1], ["AN", 4, 0, 5], ["AN", 4, 1, 6]]]], "r": [[1.20028e-05, 1.20059e-05, 1.20094e-05], 0, 3.72446, 1667931242], "v": "v0.6"}
{"i": [["[\"batch_norm\", 1, 112, 112, 32]", "cuda -keys=cuda,gpu -max_num_threads=1024 -model=unknown -thread_warp_size=32", [-1, 16, 64, 49152, 2147483647, 1024, 8, 32], "", 0, []], [[], [["CI", 2], ["FU", 4, [0, 1, 2, 3]], ["SP", 4, 0, 401408, [8], 1], ["AN", 4, 0, 5], ["AN", 4, 1, 6]]]], "r": [[3.979e-05, 3.97887e-05, 3.97926e-05], 0, 0.950561, 1667932151], "v": "v0.6"}
{"i": [["[\"batch_norm\", 1, 112, 112, 32]", "cuda -keys=cuda,gpu -max_num_threads=1024 -model=unknown -thread_warp_size=32", [-1, 16, 64, 49152, 2147483647, 1024, 8, 32], "", 0, []], [[], [["CI", 2], ["FU", 4, [0, 1, 2, 3]], ["SP", 4, 0, 401408, [28], 1], ["AN", 4, 0, 5], ["AN", 4, 1, 6]]]], "r": [[1.34268e-05, 1.34129e-05, 1.34206e-05], 0, 1.87855, 1667932153], "v": "v0.6"}
{"i": [["[\"batch_norm\", 1, 112, 112, 32]", "cuda -keys=cuda,gpu -max_num_threads=1024 -model=unknown -thread_warp_size=32", [-1, 16, 64, 49152, 2147483647, 1024, 8, 32], "", 0, []], [[], [["CI", 2], ["FU", 4, [0, 1, 2, 3]], ["SP", 4, 0, 401408, [4], 1], ["AN", 4, 0, 5], ["AN", 4, 1, 6]]]], "r": [[7.70138e-05, 7.70138e-05, 7.70097e-05], 0, 1.21104, 1667932152], "v": "v0.6"}
{"i": [["[\"batch_norm\", 1, 112, 112, 32]", "cuda -keys=cuda,gpu -max_num_threads=1024 -model=unknown -thread_warp_size=32", [-1, 16, 64, 49152, 2147483647, 1024, 8, 32], "", 0, []], [[], [["CI", 2], ["FU", 4, [0, 1, 2, 3]], ["SP", 4, 0, 401408, [56], 1], ["AN", 4, 0, 5], ["AN", 4, 1, 6]]]], "r": [[7.92149e-06, 7.91803e-06, 7.91309e-06], 0, 0.59823, 1667932151], "v": "v0.6"}
{"i": [["[\"batch_norm\", 1, 112, 112, 32]", "cuda -keys=cuda,gpu -max_num_threads=1024 -model=unknown -thread_warp_size=32", [-1, 16, 64, 49152, 2147483647, 1024, 8, 32], "", 0, []], [[], [["CI", 2], ["FU", 4, [0, 1, 2, 3]], ["SP", 4, 0, 401408, [7], 1], ["AN", 4, 0, 5], ["AN", 4, 1, 6]]]], "r": [[4.51271e-05, 4.51318e-05, 4.51256e-05], 0, 1.5646, 1667932152], "v": "v0.6"}
{"i": [["[\"batch_norm\", 1, 112, 112, 32]", "cuda -keys=cuda,gpu -max_num_threads=1024 -model=unknown -thread_warp_size=32", [-1, 16, 64, 49152, 2147483647, 1024, 8, 32], "", 0, []], [[], [["CI", 2], ["FU", 4, [0, 1, 2, 3]], ["SP", 4, 0, 401408, [16], 1], ["AN", 4, 0, 5], ["AN", 4, 1, 6]]]], "r": [[2.1505e-05, 2.15198e-05, 2.15083e-05], 0, 2.14845, 1667932153], "v": "v0.6"}
{"i": [["[\"batch_norm\", 1, 112, 112, 32]", "cuda -keys=cuda,gpu -max_num_threads=1024 -model=unknown -thread_warp_size=32", [-1, 16, 64, 49152, 2147483647, 1024, 8, 32], "", 0, []], [[], [["CI", 2], ["FU", 4, [0, 1, 2, 3]], ["SP", 4, 0, 401408, [49], 1], ["AN", 4, 0, 5], ["AN", 4, 1, 6]]]], "r": [[8.70087e-06, 8.69694e-06, 8.69749e-06], 0, 2.38351, 1667932153], "v": "v0.6"}
{"i": [["[\"batch_norm\", 1, 112, 112, 32]", "cuda -keys=cuda,gpu -max_num_threads=1024 -model=unknown -thread_warp_size=32", [-1, 16, 64, 49152, 2147483647, 1024, 8, 32], "", 0, []], [[], [["CI", 2], ["FU", 4, [0, 1, 2, 3]], ["SP", 4, 0, 401408, [2], 1], ["AN", 4, 0, 5], ["AN", 4, 1, 6]]]], "r": [[0.000151521, 0.000151413, 0.000151448], 0, 2.71308, 1667932154], "v": "v0.6"}
{"i": [["[\"batch_norm\", 1, 112, 112, 32]", "cuda -keys=cuda,gpu -max_num_threads=1024 -model=unknown -thread_warp_size=32", [-1, 16, 64, 49152, 2147483647, 1024, 8, 32], "", 0, []], [[], [["CI", 2], ["FU", 4, [0, 1, 2, 3]], ["SP", 4, 0, 401408, [14], 1], ["AN", 4, 0, 5], ["AN", 4, 1, 6]]]], "r": [[2.39885e-05, 2.39845e-05, 2.39887e-05], 0, 3.00233, 1667932154], "v": "v0.6"}
{"i": [["[\"batch_norm\", 1, 112, 112, 32]", "cuda -keys=cuda,gpu -max_num_threads=1024 -model=unknown -thread_warp_size=32", [-1, 16, 64, 49152, 2147483647, 1024, 8, 32], "", 0, []], [[], [["CI", 2], ["FU", 4, [0, 1, 2, 3]], ["SP", 4, 0, 401408, [32], 1], ["AN", 4, 0, 5], ["AN", 4, 1, 6]]]], "r": [[1.20157e-05, 1.20136e-05, 1.20073e-05], 0, 3.27704, 1667932154], "v": "v0.6"}
{"i": [["[\"batch_norm\", 1, 112, 112, 32]", "cuda -keys=cuda,gpu -max_num_threads=1024 -model=unknown -thread_warp_size=32", [-1, 16, 64, 49152, 2147483647, 1024, 8, 32], "", 0, []], [[], [["CI", 2], ["FU", 4, [0, 1, 2, 3]], ["SP", 4, 0, 401408, [1], 1], ["AN", 4, 0, 5], ["AN", 4, 1, 6]]]], "r": [[0.000300371, 0.000300338, 0.000300355], 0, 3.55169, 1667932155], "v": "v0.6"}
{"i": [["[\"batch_norm\", 1, 112, 112, 32]", "cuda -keys=cuda,gpu -max_num_threads=1024 -model=unknown -thread_warp_size=32", [-1, 16, 64, 49152, 2147483647, 1024, 8, 32], "", 0, []], [[], [["CI", 2], ["FU", 4, [0, 1, 2, 3]], ["SP", 4, 0, 401408, [64], 1], ["AN", 4, 0, 5], ["AN", 4, 1, 6]]]], "r": [[7.14709e-06, 7.14869e-06, 7.14736e-06], 0, 3.86564, 1667932155], "v": "v0.6"}
