python/models/efficientnet/VertiFusionEfficientNet_kernel_configs/efficient_mul_1_1_1_1152.log
{"i": [["[\"mul\", 1, 1, 1, 1152]", "cuda -keys=cuda,gpu -max_num_threads=1024 -model=unknown -thread_warp_size=32", [-1, 16, 64, 49152, 2147483647, 1024, 8, 32], "", 0, []], [[], [["FU", 2, [0, 1, 2, 3]], ["SP", 2, 0, 1152, [2], 1], ["AN", 2, 0, 5], ["AN", 2, 1, 6]]]], "r": [[3.20125e-06, 3.19964e-06, 3.20632e-06], 0, 1.08185, 1667927852], "v": "v0.6"}
{"i": [["[\"mul\", 1, 1, 1, 1152]", "cuda -keys=cuda,gpu -max_num_threads=1024 -model=unknown -thread_warp_size=32", [-1, 16, 64, 49152, 2147483647, 1024, 8, 32], "", 0, []], [[], [["FU", 2, [0, 1, 2, 3]], ["SP", 2, 0, 1152, [16], 1], ["AN", 2, 0, 5], ["AN", 2, 1, 6]]]], "r": [[2.5332e-06, 2.53296e-06, 2.53172e-06], 0, 2.83711, 1667927854], "v": "v0.6"}
{"i": [["[\"mul\", 1, 1, 1, 1152]", "cuda -keys=cuda,gpu -max_num_threads=1024 -model=unknown -thread_warp_size=32", [-1, 16, 64, 49152, 2147483647, 1024, 8, 32], "", 0, []], [[], [["FU", 2, [0, 1, 2, 3]], ["SP", 2, 0, 1152, [8], 1], ["AN", 2, 0, 5], ["AN", 2, 1, 6]]]], "r": [[2.60895e-06, 2.60029e-06, 2.60126e-06], 0, 1.71382, 1667927852], "v": "v0.6"}
{"i": [["[\"mul\", 1, 1, 1, 1152]", "cuda -keys=cuda,gpu -max_num_threads=1024 -model=unknown -thread_warp_size=32", [-1, 16, 64, 49152, 2147483647, 1024, 8, 32], "", 0, []], [[], [["FU", 2, [0, 1, 2, 3]], ["SP", 2, 0, 1152, [12], 1], ["AN", 2, 0, 5], ["AN", 2, 1, 6]]]], "r": [[2.72219e-06, 2.71402e-06, 2.7172e-06], 0, 2.00996, 1667927853], "v": "v0.6"}
{"i": [["[\"mul\", 1, 1, 1, 1152]", "cuda -keys=cuda,gpu -max_num_threads=1024 -model=unknown -thread_warp_size=32", [-1, 16, 64, 49152, 2147483647, 1024, 8, 32], "", 0, []], [[], [["FU", 2, [0, 1, 2, 3]], ["SP", 2, 0, 1152, [24], 1], ["AN", 2, 0, 5], ["AN", 2, 1, 6]]]], "r": [[2.66992e-06, 2.66955e-06, 2.68746e-06], 0, 0.544078, 1667927851], "v": "v0.6"}
{"i": [["[\"mul\", 1, 1, 1, 1152]", "cuda -keys=cuda,gpu -max_num_threads=1024 -model=unknown -thread_warp_size=32", [-1, 16, 64, 49152, 2147483647, 1024, 8, 32], "", 0, []], [[], [["FU", 2, [0, 1, 2, 3]], ["SP", 2, 0, 1152, [6], 1], ["AN", 2, 0, 5], ["AN", 2, 1, 6]]]], "r": [[2.736e-06, 2.74337e-06, 2.74856e-06], 0, 0.829922, 1667927851], "v": "v0.6"}
{"i": [["[\"mul\", 1, 1, 1, 1152]", "cuda -keys=cuda,gpu -max_num_threads=1024 -model=unknown -thread_warp_size=32", [-1, 16, 64, 49152, 2147483647, 1024, 8, 32], "", 0, []], [[], [["FU", 2, [0, 1, 2, 3]], ["SP", 2, 0, 1152, [18], 1], ["AN", 2, 0, 5], ["AN", 2, 1, 6]]]], "r": [[2.69772e-06, 2.70381e-06, 2.71432e-06], 0, 1.32666, 1667927852], "v": "v0.6"}
{"i": [["[\"mul\", 1, 1, 1, 1152]", "cuda -keys=cuda,gpu -max_num_threads=1024 -model=unknown -thread_warp_size=32", [-1, 16, 64, 49152, 2147483647, 1024, 8, 32], "", 0, []], [[], [["FU", 2, [0, 1, 2, 3]], ["SP", 2, 0, 1152, [3], 1], ["AN", 2, 0, 5], ["AN", 2, 1, 6]]]], "r": [[2.92086e-06, 2.92037e-06, 2.92194e-06], 0, 3.08598, 1667927854], "v": "v0.6"}
{"i": [["[\"mul\", 1, 1, 1, 1152]", "cuda -keys=cuda,gpu -max_num_threads=1024 -model=unknown -thread_warp_size=32", [-1, 16, 64, 49152, 2147483647, 1024, 8, 32], "", 0, []], [[], [["FU", 2, [0, 1, 2, 3]], ["SP", 2, 0, 1152, [64], 1], ["AN", 2, 0, 5], ["AN", 2, 1, 6]]]], "r": [[2.67085e-06, 2.66603e-06, 2.68339e-06], 0, 2.20712, 1667927853], "v": "v0.6"}
{"i": [["[\"mul\", 1, 1, 1, 1152]", "cuda -keys=cuda,gpu -max_num_threads=1024 -model=unknown -thread_warp_size=32", [-1, 16, 64, 49152, 2147483647, 1024, 8, 32], "", 0, []], [[], [["FU", 2, [0, 1, 2, 3]], ["SP", 2, 0, 1152, [32], 1], ["AN", 2, 0, 5], ["AN", 2, 1, 6]]]], "r": [[2.61331e-06, 2.61539e-06, 2.62452e-06], 0, 2.50884, 1667927853], "v": "v0.6"}
{"i": [["[\"mul\", 1, 1, 1, 1152]", "cuda -keys=cuda,gpu -max_num_threads=1024 -model=unknown -thread_warp_size=32", [-1, 16, 64, 49152, 2147483647, 1024, 8, 32], "", 0, []], [[], [["FU", 2, [0, 1, 2, 3]], ["SP", 2, 0, 1152, [9], 1], ["AN", 2, 0, 5], ["AN", 2, 1, 6]]]], "r": [[2.5636e-06, 2.55958e-06, 2.56135e-06], 0, 3.40849, 1667927854], "v": "v0.6"}
{"i": [["[\"mul\", 1, 1, 1, 1152]", "cuda -keys=cuda,gpu -max_num_threads=1024 -model=unknown -thread_warp_size=32", [-1, 16, 64, 49152, 2147483647, 1024, 8, 32], "", 0, []], [[], [["FU", 2, [0, 1, 2, 3]], ["SP", 2, 0, 1152, [4], 1], ["AN", 2, 0, 5], ["AN", 2, 1, 6]]]], "r": [[2.95921e-06, 2.95878e-06, 2.97165e-06], 0, 3.62905, 1667927854], "v": "v0.6"}
{"i": [["[\"mul\", 1, 1, 1, 1152]", "cuda -keys=cuda,gpu -max_num_threads=1024 -model=unknown -thread_warp_size=32", [-1, 16, 64, 49152, 2147483647, 1024, 8, 32], "", 0, []], [[], [["FU", 2, [0, 1, 2, 3]], ["SP", 2, 0, 1152, [1], 1], ["AN", 2, 0, 5], ["AN", 2, 1, 6]]]], "r": [[3.39165e-06, 3.40655e-06, 3.41159e-06], 0, 3.82169, 1667927855], "v": "v0.6"}
{"i": [["[\"mul\", 1, 1, 1, 1152]", "cuda -keys=cuda,gpu -max_num_threads=1024 -model=unknown -thread_warp_size=32", [-1, 16, 64, 49152, 2147483647, 1024, 8, 32], "", 0, []], [[], [["FU", 2, [0, 1, 2, 3]], ["SP", 2, 0, 1152, [48], 1], ["AN", 2, 0, 5], ["AN", 2, 1, 6]]]], "r": [[2.60889e-06, 2.60965e-06, 2.63841e-06], 0, 4.15513, 1667927855], "v": "v0.6"}
{"i": [["[\"mul\", 1, 1, 1, 1152]", "cuda -keys=cuda,gpu -max_num_threads=1024 -model=unknown -thread_warp_size=32", [-1, 16, 64, 49152, 2147483647, 1024, 8, 32], "", 0, []], [[], [["FU", 2, [0, 1, 2, 3]], ["SP", 2, 0, 1152, [36], 1], ["AN", 2, 0, 5], ["AN", 2, 1, 6]]]], "r": [[2.50692e-06, 2.50551e-06, 2.50424e-06], 0, 4.38971, 1667927855], "v": "v0.6"}
{"i": [["[\"mul\", 1, 1, 1, 1152]", "cuda -keys=cuda,gpu -max_num_threads=1024 -model=unknown -thread_warp_size=32", [-1, 16, 64, 49152, 2147483647, 1024, 8, 32], "", 0, []], [[], [["FU", 2, [0, 1, 2, 3]], ["SP", 2, 0, 1152, [24], 1], ["AN", 2, 0, 5], ["AN", 2, 1, 6]]]], "r": [[2.67922e-06, 2.68903e-06, 2.69925e-06], 0, 2.03369, 1667927969], "v": "v0.6"}
{"i": [["[\"mul\", 1, 1, 1, 1152]", "cuda -keys=cuda,gpu -max_num_threads=1024 -model=unknown -thread_warp_size=32", [-1, 16, 64, 49152, 2147483647, 1024, 8, 32], "", 0, []], [[], [["FU", 2, [0, 1, 2, 3]], ["SP", 2, 0, 1152, [64], 1], ["AN", 2, 0, 5], ["AN", 2, 1, 6]]]], "r": [[2.52556e-06, 4.29482e-06, 2.5301e-06], 0, 0.602436, 1667927968], "v": "v0.6"}
{"i": [["[\"mul\", 1, 1, 1, 1152]", "cuda -keys=cuda,gpu -max_num_threads=1024 -model=unknown -thread_warp_size=32", [-1, 16, 64, 49152, 2147483647, 1024, 8, 32], "", 0, []], [[], [["FU", 2, [0, 1, 2, 3]], ["SP", 2, 0, 1152, [36], 1], ["AN", 2, 0, 5], ["AN", 2, 1, 6]]]], "r": [[2.70477e-06, 2.70651e-06, 2.72122e-06], 0, 1.69555, 1667927969], "v": "v0.6"}
{"i": [["[\"mul\", 1, 1, 1, 1152]", "cuda -keys=cuda,gpu -max_num_threads=1024 -model=unknown -thread_warp_size=32", [-1, 16, 64, 49152, 2147483647, 1024, 8, 32], "", 0, []], [[], [["FU", 2, [0, 1, 2, 3]], ["SP", 2, 0, 1152, [48], 1], ["AN", 2, 0, 5], ["AN", 2, 1, 6]]]], "r": [[2.66971e-06, 2.67086e-06, 2.68419e-06], 0, 0.919461, 1667927968], "v": "v0.6"}
{"i": [["[\"mul\", 1, 1, 1, 1152]", "cuda -keys=cuda,gpu -max_num_threads=1024 -model=unknown -thread_warp_size=32", [-1, 16, 64, 49152, 2147483647, 1024, 8, 32], "", 0, []], [[], [["FU", 2, [0, 1, 2, 3]], ["SP", 2, 0, 1152, [12], 1], ["AN", 2, 0, 5], ["AN", 2, 1, 6]]]], "r": [[2.51631e-06, 2.51107e-06, 2.51004e-06], 0, 1.47032, 1667927969], "v": "v0.6"}
{"i": [["[\"mul\", 1, 1, 1, 1152]", "cuda -keys=cuda,gpu -max_num_threads=1024 -model=unknown -thread_warp_size=32", [-1, 16, 64, 49152, 2147483647, 1024, 8, 32], "", 0, []], [[], [["FU", 2, [0, 1, 2, 3]], ["SP", 2, 0, 1152, [16], 1], ["AN", 2, 0, 5], ["AN", 2, 1, 6]]]], "r": [[2.51537e-06, 2.51172e-06, 2.51051e-06], 0, 1.17175, 1667927968], "v": "v0.6"}
{"i": [["[\"mul\", 1, 1, 1, 1152]", "cuda -keys=cuda,gpu -max_num_threads=1024 -model=unknown -thread_warp_size=32", [-1, 16, 64, 49152, 2147483647, 1024, 8, 32], "", 0, []], [[], [["FU", 2, [0, 1, 2, 3]], ["SP", 2, 0, 1152, [6], 1], ["AN", 2, 0, 5], ["AN", 2, 1, 6]]]], "r": [[2.65514e-06, 2.65458e-06, 2.65195e-06], 0, 2.23105, 1667927970], "v": "v0.6"}
{"i": [["[\"mul\", 1, 1, 1, 1152]", "cuda -keys=cuda,gpu -max_num_threads=1024 -model=unknown -thread_warp_size=32", [-1, 16, 64, 49152, 2147483647, 1024, 8, 32], "", 0, []], [[], [["FU", 2, [0, 1, 2, 3]], ["SP", 2, 0, 1152, [1], 1], ["AN", 2, 0, 5], ["AN", 2, 1, 6]]]], "r": [[3.40839e-06, 3.40887e-06, 3.40982e-06], 0, 2.46883, 1667927970], "v": "v0.6"}
{"i": [["[\"mul\", 1, 1, 1, 1152]", "cuda -keys=cuda,gpu -max_num_threads=1024 -model=unknown -thread_warp_size=32", [-1, 16, 64, 49152, 2147483647, 1024, 8, 32], "", 0, []], [[], [["FU", 2, [0, 1, 2, 3]], ["SP", 2, 0, 1152, [3], 1], ["AN", 2, 0, 5], ["AN", 2, 1, 6]]]], "r": [[2.88068e-06, 2.88156e-06, 2.88196e-06], 0, 2.72385, 1667927970], "v": "v0.6"}
{"i": [["[\"mul\", 1, 1, 1, 1152]", "cuda -keys=cuda,gpu -max_num_threads=1024 -model=unknown -thread_warp_size=32", [-1, 16, 64, 49152, 2147483647, 1024, 8, 32], "", 0, []], [[], [["FU", 2, [0, 1, 2, 3]], ["SP", 2, 0, 1152, [4], 1], ["AN", 2, 0, 5], ["AN", 2, 1, 6]]]], "r": [[2.90392e-06, 2.90353e-06, 2.91329e-06], 0, 2.97135, 1667927971], "v": "v0.6"}
{"i": [["[\"mul\", 1, 1, 1, 1152]", "cuda -keys=cuda,gpu -max_num_threads=1024 -model=unknown -thread_warp_size=32", [-1, 16, 64, 49152, 2147483647, 1024, 8, 32], "", 0, []], [[], [["FU", 2, [0, 1, 2, 3]], ["SP", 2, 0, 1152, [2], 1], ["AN", 2, 0, 5], ["AN", 2, 1, 6]]]], "r": [[2.90009e-06, 2.90268e-06, 2.90322e-06], 0, 3.24402, 1667927971], "v": "v0.6"}
{"i": [["[\"mul\", 1, 1, 1, 1152]", "cuda -keys=cuda,gpu -max_num_threads=1024 -model=unknown -thread_warp_size=32", [-1, 16, 64, 49152, 2147483647, 1024, 8, 32], "", 0, []], [[], [["FU", 2, [0, 1, 2, 3]], ["SP", 2, 0, 1152, [18], 1], ["AN", 2, 0, 5], ["AN", 2, 1, 6]]]], "r": [[2.67865e-06, 2.67823e-06, 2.6945e-06], 0, 3.50344, 1667927971], "v": "v0.6"}
{"i": [["[\"mul\", 1, 1, 1, 1152]", "cuda -keys=cuda,gpu -max_num_threads=1024 -model=unknown -thread_warp_size=32", [-1, 16, 64, 49152, 2147483647, 1024, 8, 32], "", 0, []], [[], [["FU", 2, [0, 1, 2, 3]], ["SP", 2, 0, 1152, [9], 1], ["AN", 2, 0, 5], ["AN", 2, 1, 6]]]], "r": [[2.58128e-06, 2.57591e-06, 2.58088e-06], 0, 4.02025, 1667927972], "v": "v0.6"}
{"i": [["[\"mul\", 1, 1, 1, 1152]", "cuda -keys=cuda,gpu -max_num_threads=1024 -model=unknown -thread_warp_size=32", [-1, 16, 64, 49152, 2147483647, 1024, 8, 32], "", 0, []], [[], [["FU", 2, [0, 1, 2, 3]], ["SP", 2, 0, 1152, [8], 1], ["AN", 2, 0, 5], ["AN", 2, 1, 6]]]], "r": [[2.59337e-06, 2.59336e-06, 2.59499e-06], 0, 3.74651, 1667927971], "v": "v0.6"}
{"i": [["[\"mul\", 1, 1, 1, 1152]", "cuda -keys=cuda,gpu -max_num_threads=1024 -model=unknown -thread_warp_size=32", [-1, 16, 64, 49152, 2147483647, 1024, 8, 32], "", 0, []], [[], [["FU", 2, [0, 1, 2, 3]], ["SP", 2, 0, 1152, [32], 1], ["AN", 2, 0, 5], ["AN", 2, 1, 6]]]], "r": [[2.47313e-06, 2.47147e-06, 2.47325e-06], 0, 4.29532, 1667927972], "v": "v0.6"}
{"i": [["[\"mul\", 1, 1, 1, 1152]", "cuda -keys=cuda,gpu -max_num_threads=1024 -model=unknown -thread_warp_size=32", [-1, 16, 64, 49152, 2147483647, 1024, 8, 32], "", 0, []], [[], [["FU", 2, [0, 1, 2, 3]], ["SP", 2, 0, 1152, [8], 1], ["AN", 2, 0, 5], ["AN", 2, 1, 6]]]], "r": [[2.52465e-06, 2.51923e-06, 2.51836e-06], 0, 2.06654, 1667947083], "v": "v0.6"}
{"i": [["[\"mul\", 1, 1, 1, 1152]", "cuda -keys=cuda,gpu -max_num_threads=1024 -model=unknown -thread_warp_size=32", [-1, 16, 64, 49152, 2147483647, 1024, 8, 32], "", 0, []], [[], [["FU", 2, [0, 1, 2, 3]], ["SP", 2, 0, 1152, [48], 1], ["AN", 2, 0, 5], ["AN", 2, 1, 6]]]], "r": [[2.67948e-06, 2.67739e-06, 2.70336e-06], 0, 1.4904, 1667947082], "v": "v0.6"}
{"i": [["[\"mul\", 1, 1, 1, 1152]", "cuda -keys=cuda,gpu -max_num_threads=1024 -model=unknown -thread_warp_size=32", [-1, 16, 64, 49152, 2147483647, 1024, 8, 32], "", 0, []], [[], [["FU", 2, [0, 1, 2, 3]], ["SP", 2, 0, 1152, [6], 1], ["AN", 2, 0, 5], ["AN", 2, 1, 6]]]], "r": [[2.69428e-06, 2.69032e-06, 2.71016e-06], 0, 0.880752, 1667947082], "v": "v0.6"}
{"i": [["[\"mul\", 1, 1, 1, 1152]", "cuda -keys=cuda,gpu -max_num_threads=1024 -model=unknown -thread_warp_size=32", [-1, 16, 64, 49152, 2147483647, 1024, 8, 32], "", 0, []], [[], [["FU", 2, [0, 1, 2, 3]], ["SP", 2, 0, 1152, [1], 1], ["AN", 2, 0, 5], ["AN", 2, 1, 6]]]], "r": [[3.39596e-06, 3.39554e-06, 3.39847e-06], 0, 1.17005, 1667947082], "v": "v0.6"}
{"i": [["[\"mul\", 1, 1, 1, 1152]", "cuda -keys=cuda,gpu -max_num_threads=1024 -model=unknown -thread_warp_size=32", [-1, 16, 64, 49152, 2147483647, 1024, 8, 32], "", 0, []], [[], [["FU", 2, [0, 1, 2, 3]], ["SP", 2, 0, 1152, [2], 1], ["AN", 2, 0, 5], ["AN", 2, 1, 6]]]], "r": [[2.99872e-06, 3.0027e-06, 3.00323e-06], 0, 1.7606, 1667947083], "v": "v0.6"}
{"i": [["[\"mul\", 1, 1, 1, 1152]", "cuda -keys=cuda,gpu -max_num_threads=1024 -model=unknown -thread_warp_size=32", [-1, 16, 64, 49152, 2147483647, 1024, 8, 32], "", 0, []], [[], [["FU", 2, [0, 1, 2, 3]], ["SP", 2, 0, 1152, [4], 1], ["AN", 2, 0, 5], ["AN", 2, 1, 6]]]], "r": [[2.69471e-06, 2.69649e-06, 2.69837e-06], 0, 0.547717, 1667947081], "v": "v0.6"}
{"i": [["[\"mul\", 1, 1, 1, 1152]", "cuda -keys=cuda,gpu -max_num_threads=1024 -model=unknown -thread_warp_size=32", [-1, 16, 64, 49152, 2147483647, 1024, 8, 32], "", 0, []], [[], [["FU", 2, [0, 1, 2, 3]], ["SP", 2, 0, 1152, [36], 1], ["AN", 2, 0, 5], ["AN", 2, 1, 6]]]], "r": [[2.50107e-06, 2.49647e-06, 2.498e-06], 0, 2.62443, 1667947084], "v": "v0.6"}
{"i": [["[\"mul\", 1, 1, 1, 1152]", "cuda -keys=cuda,gpu -max_num_threads=1024 -model=unknown -thread_warp_size=32", [-1, 16, 64, 49152, 2147483647, 1024, 8, 32], "", 0, []], [[], [["FU", 2, [0, 1, 2, 3]], ["SP", 2, 0, 1152, [3], 1], ["AN", 2, 0, 5], ["AN", 2, 1, 6]]]], "r": [[2.7681e-06, 2.76974e-06, 2.76684e-06], 0, 2.84775, 1667947084], "v": "v0.6"}
{"i": [["[\"mul\", 1, 1, 1, 1152]", "cuda -keys=cuda,gpu -max_num_threads=1024 -model=unknown -thread_warp_size=32", [-1, 16, 64, 49152, 2147483647, 1024, 8, 32], "", 0, []], [[], [["FU", 2, [0, 1, 2, 3]], ["SP", 2, 0, 1152, [32], 1], ["AN", 2, 0, 5], ["AN", 2, 1, 6]]]], "r": [[2.55779e-06, 2.55396e-06, 2.55216e-06], 0, 2.30424, 1667947083], "v": "v0.6"}
{"i": [["[\"mul\", 1, 1, 1, 1152]", "cuda -keys=cuda,gpu -max_num_threads=1024 -model=unknown -thread_warp_size=32", [-1, 16, 64, 49152, 2147483647, 1024, 8, 32], "", 0, []], [[], [["FU", 2, [0, 1, 2, 3]], ["SP", 2, 0, 1152, [9], 1], ["AN", 2, 0, 5], ["AN", 2, 1, 6]]]], "r": [[2.59415e-06, 2.60275e-06, 2.59747e-06], 0, 3.09754, 1667947084], "v": "v0.6"}
{"i": [["[\"mul\", 1, 1, 1, 1152]", "cuda -keys=cuda,gpu -max_num_threads=1024 -model=unknown -thread_warp_size=32", [-1, 16, 64, 49152, 2147483647, 1024, 8, 32], "", 0, []], [[], [["FU", 2, [0, 1, 2, 3]], ["SP", 2, 0, 1152, [12], 1], ["AN", 2, 0, 5], ["AN", 2, 1, 6]]]], "r": [[2.5842e-06, 2.58593e-06, 2.58246e-06], 0, 3.40713, 1667947085], "v": "v0.6"}
{"i": [["[\"mul\", 1, 1, 1, 1152]", "cuda -keys=cuda,gpu -max_num_threads=1024 -model=unknown -thread_warp_size=32", [-1, 16, 64, 49152, 2147483647, 1024, 8, 32], "", 0, []], [[], [["FU", 2, [0, 1, 2, 3]], ["SP", 2, 0, 1152, [64], 1], ["AN", 2, 0, 5], ["AN", 2, 1, 6]]]], "r": [[2.51267e-06, 2.50856e-06, 2.50761e-06], 0, 3.64769, 1667947085], "v": "v0.6"}
{"i": [["[\"mul\", 1, 1, 1, 1152]", "cuda -keys=cuda,gpu -max_num_threads=1024 -model=unknown -thread_warp_size=32", [-1, 16, 64, 49152, 2147483647, 1024, 8, 32], "", 0, []], [[], [["FU", 2, [0, 1, 2, 3]], ["SP", 2, 0, 1152, [24], 1], ["AN", 2, 0, 5], ["AN", 2, 1, 6]]]], "r": [[2.53079e-06, 2.53165e-06, 2.53175e-06], 0, 3.90691, 1667947085], "v": "v0.6"}
{"i": [["[\"mul\", 1, 1, 1, 1152]", "cuda -keys=cuda,gpu -max_num_threads=1024 -model=unknown -thread_warp_size=32", [-1, 16, 64, 49152, 2147483647, 1024, 8, 32], "", 0, []], [[], [["FU", 2, [0, 1, 2, 3]], ["SP", 2, 0, 1152, [16], 1], ["AN", 2, 0, 5], ["AN", 2, 1, 6]]]], "r": [[2.53561e-06, 2.53803e-06, 2.53865e-06], 0, 4.22808, 1667947086], "v": "v0.6"}
{"i": [["[\"mul\", 1, 1, 1, 1152]", "cuda -keys=cuda,gpu -max_num_threads=1024 -model=unknown -thread_warp_size=32", [-1, 16, 64, 49152, 2147483647, 1024, 8, 32], "", 0, []], [[], [["FU", 2, [0, 1, 2, 3]], ["SP", 2, 0, 1152, [18], 1], ["AN", 2, 0, 5], ["AN", 2, 1, 6]]]], "r": [[2.68139e-06, 2.68086e-06, 2.69723e-06], 0, 4.47009, 1667947086], "v": "v0.6"}
{"i": [["[\"mul\", 1, 1, 1, 1152]", "cuda -keys=cuda,gpu -max_num_threads=1024 -model=unknown -thread_warp_size=32", [-1, 16, 64, 49152, 2147483647, 1024, 8, 32], "", 0, []], [[], [["FU", 2, [0, 1, 2, 3]], ["SP", 2, 0, 1152, [36], 1], ["AN", 2, 0, 5], ["AN", 2, 1, 6]]]], "r": [[2.48546e-06, 2.47989e-06, 2.48155e-06], 0, 2.36052, 1667947719], "v": "v0.6"}
{"i": [["[\"mul\", 1, 1, 1, 1152]", "cuda -keys=cuda,gpu -max_num_threads=1024 -model=unknown -thread_warp_size=32", [-1, 16, 64, 49152, 2147483647, 1024, 8, 32], "", 0, []], [[], [["FU", 2, [0, 1, 2, 3]], ["SP", 2, 0, 1152, [16], 1], ["AN", 2, 0, 5], ["AN", 2, 1, 6]]]], "r": [[2.6876e-06, 2.68441e-06, 2.69813e-06], 0, 1.18541, 1667947718], "v": "v0.6"}
{"i": [["[\"mul\", 1, 1, 1, 1152]", "cuda -keys=cuda,gpu -max_num_threads=1024 -model=unknown -thread_warp_size=32", [-1, 16, 64, 49152, 2147483647, 1024, 8, 32], "", 0, []], [[], [["FU", 2, [0, 1, 2, 3]], ["SP", 2, 0, 1152, [1], 1], ["AN", 2, 0, 5], ["AN", 2, 1, 6]]]], "r": [[3.56604e-06, 3.56046e-06, 3.56245e-06], 0, 0.903147, 1667947717], "v": "v0.6"}
{"i": [["[\"mul\", 1, 1, 1, 1152]", "cuda -keys=cuda,gpu -max_num_threads=1024 -model=unknown -thread_warp_size=32", [-1, 16, 64, 49152, 2147483647, 1024, 8, 32], "", 0, []], [[], [["FU", 2, [0, 1, 2, 3]], ["SP", 2, 0, 1152, [48], 1], ["AN", 2, 0, 5], ["AN", 2, 1, 6]]]], "r": [[2.58754e-06, 2.58574e-06, 2.59959e-06], 0, 0.574289, 1667947717], "v": "v0.6"}
{"i": [["[\"mul\", 1, 1, 1, 1152]", "cuda -keys=cuda,gpu -max_num_threads=1024 -model=unknown -thread_warp_size=32", [-1, 16, 64, 49152, 2147483647, 1024, 8, 32], "", 0, []], [[], [["FU", 2, [0, 1, 2, 3]], ["SP", 2, 0, 1152, [64], 1], ["AN", 2, 0, 5], ["AN", 2, 1, 6]]]], "r": [[2.50148e-06, 2.50212e-06, 2.50138e-06], 0, 1.45822, 1667947718], "v": "v0.6"}
{"i": [["[\"mul\", 1, 1, 1, 1152]", "cuda -keys=cuda,gpu -max_num_threads=1024 -model=unknown -thread_warp_size=32", [-1, 16, 64, 49152, 2147483647, 1024, 8, 32], "", 0, []], [[], [["FU", 2, [0, 1, 2, 3]], ["SP", 2, 0, 1152, [4], 1], ["AN", 2, 0, 5], ["AN", 2, 1, 6]]]], "r": [[2.73519e-06, 2.738e-06, 2.73559e-06], 0, 1.75998, 1667947718], "v": "v0.6"}
{"i": [["[\"mul\", 1, 1, 1, 1152]", "cuda -keys=cuda,gpu -max_num_threads=1024 -model=unknown -thread_warp_size=32", [-1, 16, 64, 49152, 2147483647, 1024, 8, 32], "", 0, []], [[], [["FU", 2, [0, 1, 2, 3]], ["SP", 2, 0, 1152, [32], 1], ["AN", 2, 0, 5], ["AN", 2, 1, 6]]]], "r": [[2.68052e-06, 2.679e-06, 2.70337e-06], 0, 1.99433, 1667947719], "v": "v0.6"}
{"i": [["[\"mul\", 1, 1, 1, 1152]", "cuda -keys=cuda,gpu -max_num_threads=1024 -model=unknown -thread_warp_size=32", [-1, 16, 64, 49152, 2147483647, 1024, 8, 32], "", 0, []], [[], [["FU", 2, [0, 1, 2, 3]], ["SP", 2, 0, 1152, [3], 1], ["AN", 2, 0, 5], ["AN", 2, 1, 6]]]], "r": [[2.82398e-06, 2.82414e-06, 2.82298e-06], 0, 2.61745, 1667947719], "v": "v0.6"}
{"i": [["[\"mul\", 1, 1, 1, 1152]", "cuda -keys=cuda,gpu -max_num_threads=1024 -model=unknown -thread_warp_size=32", [-1, 16, 64, 49152, 2147483647, 1024, 8, 32], "", 0, []], [[], [["FU", 2, [0, 1, 2, 3]], ["SP", 2, 0, 1152, [24], 1], ["AN", 2, 0, 5], ["AN", 2, 1, 6]]]], "r": [[2.61015e-06, 2.60528e-06, 2.63061e-06], 0, 2.85176, 1667947720], "v": "v0.6"}
{"i": [["[\"mul\", 1, 1, 1, 1152]", "cuda -keys=cuda,gpu -max_num_threads=1024 -model=unknown -thread_warp_size=32", [-1, 16, 64, 49152, 2147483647, 1024, 8, 32], "", 0, []], [[], [["FU", 2, [0, 1, 2, 3]], ["SP", 2, 0, 1152, [12], 1], ["AN", 2, 0, 5], ["AN", 2, 1, 6]]]], "r": [[2.50115e-06, 2.49551e-06, 2.49749e-06], 0, 3.07648, 1667947720], "v": "v0.6"}
{"i": [["[\"mul\", 1, 1, 1, 1152]", "cuda -keys=cuda,gpu -max_num_threads=1024 -model=unknown -thread_warp_size=32", [-1, 16, 64, 49152, 2147483647, 1024, 8, 32], "", 0, []], [[], [["FU", 2, [0, 1, 2, 3]], ["SP", 2, 0, 1152, [2], 1], ["AN", 2, 0, 5], ["AN", 2, 1, 6]]]], "r": [[3.19992e-06, 3.20044e-06, 3.20801e-06], 0, 3.35566, 1667947720], "v": "v0.6"}
{"i": [["[\"mul\", 1, 1, 1, 1152]", "cuda -keys=cuda,gpu -max_num_threads=1024 -model=unknown -thread_warp_size=32", [-1, 16, 64, 49152, 2147483647, 1024, 8, 32], "", 0, []], [[], [["FU", 2, [0, 1, 2, 3]], ["SP", 2, 0, 1152, [9], 1], ["AN", 2, 0, 5], ["AN", 2, 1, 6]]]], "r": [[2.62517e-06, 2.61822e-06, 2.6188e-06], 0, 3.61793, 1667947721], "v": "v0.6"}
{"i": [["[\"mul\", 1, 1, 1, 1152]", "cuda -keys=cuda,gpu -max_num_threads=1024 -model=unknown -thread_warp_size=32", [-1, 16, 64, 49152, 2147483647, 1024, 8, 32], "", 0, []], [[], [["FU", 2, [0, 1, 2, 3]], ["SP", 2, 0, 1152, [8], 1], ["AN", 2, 0, 5], ["AN", 2, 1, 6]]]], "r": [[2.64769e-06, 2.64869e-06, 2.66685e-06], 0, 3.8767, 1667947721], "v": "v0.6"}
{"i": [["[\"mul\", 1, 1, 1, 1152]", "cuda -keys=cuda,gpu -max_num_threads=1024 -model=unknown -thread_warp_size=32", [-1, 16, 64, 49152, 2147483647, 1024, 8, 32], "", 0, []], [[], [["FU", 2, [0, 1, 2, 3]], ["SP", 2, 0, 1152, [6], 1], ["AN", 2, 0, 5], ["AN", 2, 1, 6]]]], "r": [[2.61851e-06, 2.6151e-06, 2.61684e-06], 0, 4.1863, 1667947721], "v": "v0.6"}
{"i": [["[\"mul\", 1, 1, 1, 1152]", "cuda -keys=cuda,gpu -max_num_threads=1024 -model=unknown -thread_warp_size=32", [-1, 16, 64, 49152, 2147483647, 1024, 8, 32], "", 0, []], [[], [["FU", 2, [0, 1, 2, 3]], ["SP", 2, 0, 1152, [18], 1], ["AN", 2, 0, 5], ["AN", 2, 1, 6]]]], "r": [[2.6084e-06, 2.61133e-06, 2.61277e-06], 0, 4.45473, 1667947722], "v": "v0.6"}
{"i": [["[\"mul\", 1, 1, 1, 1152]", "cuda -keys=cuda,gpu -max_num_threads=1024 -model=unknown -thread_warp_size=32", [-1, 16, 64, 49152, 2147483647, 1024, 8, 32], "", 0, []], [[], [["FU", 2, [0, 1, 2, 3]], ["SP", 2, 0, 1152, [4], 1], ["AN", 2, 0, 5], ["AN", 2, 1, 6]]]], "r": [[2.69321e-06, 2.69836e-06, 2.69423e-06], 0, 1.29136, 1667947982], "v": "v0.6"}
{"i": [["[\"mul\", 1, 1, 1, 1152]", "cuda -keys=cuda,gpu -max_num_threads=1024 -model=unknown -thread_warp_size=32", [-1, 16, 64, 49152, 2147483647, 1024, 8, 32], "", 0, []], [[], [["FU", 2, [0, 1, 2, 3]], ["SP", 2, 0, 1152, [16], 1], ["AN", 2, 0, 5], ["AN", 2, 1, 6]]]], "r": [[2.58001e-06, 2.58984e-06, 2.58811e-06], 0, 1.55597, 1667947982], "v": "v0.6"}
{"i": [["[\"mul\", 1, 1, 1, 1152]", "cuda -keys=cuda,gpu -max_num_threads=1024 -model=unknown -thread_warp_size=32", [-1, 16, 64, 49152, 2147483647, 1024, 8, 32], "", 0, []], [[], [["FU", 2, [0, 1, 2, 3]], ["SP", 2, 0, 1152, [18], 1], ["AN", 2, 0, 5], ["AN", 2, 1, 6]]]], "r": [[2.47365e-06, 2.45992e-06, 2.46134e-06], 0, 0.626687, 1667947981], "v": "v0.6"}
{"i": [["[\"mul\", 1, 1, 1, 1152]", "cuda -keys=cuda,gpu -max_num_threads=1024 -model=unknown -thread_warp_size=32", [-1, 16, 64, 49152, 2147483647, 1024, 8, 32], "", 0, []], [[], [["FU", 2, [0, 1, 2, 3]], ["SP", 2, 0, 1152, [1], 1], ["AN", 2, 0, 5], ["AN", 2, 1, 6]]]], "r": [[3.42559e-06, 3.42603e-06, 3.42771e-06], 0, 2.15233, 1667947983], "v": "v0.6"}
{"i": [["[\"mul\", 1, 1, 1, 1152]", "cuda -keys=cuda,gpu -max_num_threads=1024 -model=unknown -thread_warp_size=32", [-1, 16, 64, 49152, 2147483647, 1024, 8, 32], "", 0, []], [[], [["FU", 2, [0, 1, 2, 3]], ["SP", 2, 0, 1152, [32], 1], ["AN", 2, 0, 5], ["AN", 2, 1, 6]]]], "r": [[2.64665e-06, 2.6507e-06, 2.66681e-06], 0, 1.86393, 1667947983], "v": "v0.6"}
{"i": [["[\"mul\", 1, 1, 1, 1152]", "cuda -keys=cuda,gpu -max_num_threads=1024 -model=unknown -thread_warp_size=32", [-1, 16, 64, 49152, 2147483647, 1024, 8, 32], "", 0, []], [[], [["FU", 2, [0, 1, 2, 3]], ["SP", 2, 0, 1152, [8], 1], ["AN", 2, 0, 5], ["AN", 2, 1, 6]]]], "r": [[2.56266e-06, 2.56081e-06, 2.55799e-06], 0, 0.950868, 1667947982], "v": "v0.6"}
{"i": [["[\"mul\", 1, 1, 1, 1152]", "cuda -keys=cuda,gpu -max_num_threads=1024 -model=unknown -thread_warp_size=32", [-1, 16, 64, 49152, 2147483647, 1024, 8, 32], "", 0, []], [[], [["FU", 2, [0, 1, 2, 3]], ["SP", 2, 0, 1152, [48], 1], ["AN", 2, 0, 5], ["AN", 2, 1, 6]]]], "r": [[2.55309e-06, 2.54943e-06, 2.55016e-06], 0, 2.3785, 1667947983], "v": "v0.6"}
{"i": [["[\"mul\", 1, 1, 1, 1152]", "cuda -keys=cuda,gpu -max_num_threads=1024 -model=unknown -thread_warp_size=32", [-1, 16, 64, 49152, 2147483647, 1024, 8, 32], "", 0, []], [[], [["FU", 2, [0, 1, 2, 3]], ["SP", 2, 0, 1152, [24], 1], ["AN", 2, 0, 5], ["AN", 2, 1, 6]]]], "r": [[2.49554e-06, 2.49121e-06, 2.48998e-06], 0, 2.64266, 1667947984], "v": "v0.6"}
{"i": [["[\"mul\", 1, 1, 1, 1152]", "cuda -keys=cuda,gpu -max_num_threads=1024 -model=unknown -thread_warp_size=32", [-1, 16, 64, 49152, 2147483647, 1024, 8, 32], "", 0, []], [[], [["FU", 2, [0, 1, 2, 3]], ["SP", 2, 0, 1152, [2], 1], ["AN", 2, 0, 5], ["AN", 2, 1, 6]]]], "r": [[2.936e-06, 2.94839e-06, 2.94635e-06], 0, 2.8366, 1667947984], "v": "v0.6"}
{"i": [["[\"mul\", 1, 1, 1, 1152]", "cuda -keys=cuda,gpu -max_num_threads=1024 -model=unknown -thread_warp_size=32", [-1, 16, 64, 49152, 2147483647, 1024, 8, 32], "", 0, []], [[], [["FU", 2, [0, 1, 2, 3]], ["SP", 2, 0, 1152, [3], 1], ["AN", 2, 0, 5], ["AN", 2, 1, 6]]]], "r": [[2.82808e-06, 2.82781e-06, 2.82998e-06], 0, 3.43625, 1667947985], "v": "v0.6"}
{"i": [["[\"mul\", 1, 1, 1, 1152]", "cuda -keys=cuda,gpu -max_num_threads=1024 -model=unknown -thread_warp_size=32", [-1, 16, 64, 49152, 2147483647, 1024, 8, 32], "", 0, []], [[], [["FU", 2, [0, 1, 2, 3]], ["SP", 2, 0, 1152, [64], 1], ["AN", 2, 0, 5], ["AN", 2, 1, 6]]]], "r": [[2.6278e-06, 2.6257e-06, 2.63904e-06], 0, 3.07383, 1667947984], "v": "v0.6"}
{"i": [["[\"mul\", 1, 1, 1, 1152]", "cuda -keys=cuda,gpu -max_num_threads=1024 -model=unknown -thread_warp_size=32", [-1, 16, 64, 49152, 2147483647, 1024, 8, 32], "", 0, []], [[], [["FU", 2, [0, 1, 2, 3]], ["SP", 2, 0, 1152, [36], 1], ["AN", 2, 0, 5], ["AN", 2, 1, 6]]]], "r": [[2.51136e-06, 2.5091e-06, 2.5104e-06], 0, 3.68607, 1667947985], "v": "v0.6"}
{"i": [["[\"mul\", 1, 1, 1, 1152]", "cuda -keys=cuda,gpu -max_num_threads=1024 -model=unknown -thread_warp_size=32", [-1, 16, 64, 49152, 2147483647, 1024, 8, 32], "", 0, []], [[], [["FU", 2, [0, 1, 2, 3]], ["SP", 2, 0, 1152, [12], 1], ["AN", 2, 0, 5], ["AN", 2, 1, 6]]]], "r": [[2.47587e-06, 2.4698e-06, 2.46932e-06], 0, 3.93353, 1667947985], "v": "v0.6"}
{"i": [["[\"mul\", 1, 1, 1, 1152]", "cuda -keys=cuda,gpu -max_num_threads=1024 -model=unknown -thread_warp_size=32", [-1, 16, 64, 49152, 2147483647, 1024, 8, 32], "", 0, []], [[], [["FU", 2, [0, 1, 2, 3]], ["SP", 2, 0, 1152, [9], 1], ["AN", 2, 0, 5], ["AN", 2, 1, 6]]]], "r": [[2.63224e-06, 2.63803e-06, 2.64308e-06], 0, 4.21998, 1667947986], "v": "v0.6"}
{"i": [["[\"mul\", 1, 1, 1, 1152]", "cuda -keys=cuda,gpu -max_num_threads=1024 -model=unknown -thread_warp_size=32", [-1, 16, 64, 49152, 2147483647, 1024, 8, 32], "", 0, []], [[], [["FU", 2, [0, 1, 2, 3]], ["SP", 2, 0, 1152, [6], 1], ["AN", 2, 0, 5], ["AN", 2, 1, 6]]]], "r": [[2.65242e-06, 2.65225e-06, 2.66221e-06], 0, 4.44656, 1667947986], "v": "v0.6"}
{"i": [["[\"mul\", 1, 1, 1, 1152]", "cuda -keys=cuda,gpu -max_num_threads=1024 -model=unknown -thread_warp_size=32", [-1, 16, 64, 49152, 2147483647, 1024, 8, 32], "", 0, []], [[], [["FU", 2, [0, 1, 2, 3]], ["SP", 2, 0, 1152, [36], 1], ["AN", 2, 0, 5], ["AN", 2, 1, 6]]]], "r": [[2.46391e-06, 2.46014e-06, 2.46017e-06], 0, 2.01483, 1667948547], "v": "v0.6"}
{"i": [["[\"mul\", 1, 1, 1, 1152]", "cuda -keys=cuda,gpu -max_num_threads=1024 -model=unknown -thread_warp_size=32", [-1, 16, 64, 49152, 2147483647, 1024, 8, 32], "", 0, []], [[], [["FU", 2, [0, 1, 2, 3]], ["SP", 2, 0, 1152, [32], 1], ["AN", 2, 0, 5], ["AN", 2, 1, 6]]]], "r": [[2.68525e-06, 2.68405e-06, 2.70361e-06], 0, 2.30096, 1667948548], "v": "v0.6"}
{"i": [["[\"mul\", 1, 1, 1, 1152]", "cuda -keys=cuda,gpu -max_num_threads=1024 -model=unknown -thread_warp_size=32", [-1, 16, 64, 49152, 2147483647, 1024, 8, 32], "", 0, []], [[], [["FU", 2, [0, 1, 2, 3]], ["SP", 2, 0, 1152, [2], 1], ["AN", 2, 0, 5], ["AN", 2, 1, 6]]]], "r": [[3.12552e-06, 3.12699e-06, 3.13289e-06], 0, 1.50346, 1667948547], "v": "v0.6"}
{"i": [["[\"mul\", 1, 1, 1, 1152]", "cuda -keys=cuda,gpu -max_num_threads=1024 -model=unknown -thread_warp_size=32", [-1, 16, 64, 49152, 2147483647, 1024, 8, 32], "", 0, []], [[], [["FU", 2, [0, 1, 2, 3]], ["SP", 2, 0, 1152, [64], 1], ["AN", 2, 0, 5], ["AN", 2, 1, 6]]]], "r": [[2.64125e-06, 2.64067e-06, 3.60243e-06], 0, 0.549023, 1667948546], "v": "v0.6"}
{"i": [["[\"mul\", 1, 1, 1, 1152]", "cuda -keys=cuda,gpu -max_num_threads=1024 -model=unknown -thread_warp_size=32", [-1, 16, 64, 49152, 2147483647, 1024, 8, 32], "", 0, []], [[], [["FU", 2, [0, 1, 2, 3]], ["SP", 2, 0, 1152, [8], 1], ["AN", 2, 0, 5], ["AN", 2, 1, 6]]]], "r": [[2.59938e-06, 2.60336e-06, 2.59137e-06], 0, 0.903201, 1667948546], "v": "v0.6"}
{"i": [["[\"mul\", 1, 1, 1, 1152]", "cuda -keys=cuda,gpu -max_num_threads=1024 -model=unknown -thread_warp_size=32", [-1, 16, 64, 49152, 2147483647, 1024, 8, 32], "", 0, []], [[], [["FU", 2, [0, 1, 2, 3]], ["SP", 2, 0, 1152, [16], 1], ["AN", 2, 0, 5], ["AN", 2, 1, 6]]]], "r": [[2.5046e-06, 2.50221e-06, 2.50468e-06], 0, 1.21189, 1667948546], "v": "v0.6"}
{"i": [["[\"mul\", 1, 1, 1, 1152]", "cuda -keys=cuda,gpu -max_num_threads=1024 -model=unknown -thread_warp_size=32", [-1, 16, 64, 49152, 2147483647, 1024, 8, 32], "", 0, []], [[], [["FU", 2, [0, 1, 2, 3]], ["SP", 2, 0, 1152, [9], 1], ["AN", 2, 0, 5], ["AN", 2, 1, 6]]]], "r": [[2.59539e-06, 2.59286e-06, 2.59258e-06], 0, 1.75588, 1667948547], "v": "v0.6"}
{"i": [["[\"mul\", 1, 1, 1, 1152]", "cuda -keys=cuda,gpu -max_num_threads=1024 -model=unknown -thread_warp_size=32", [-1, 16, 64, 49152, 2147483647, 1024, 8, 32], "", 0, []], [[], [["FU", 2, [0, 1, 2, 3]], ["SP", 2, 0, 1152, [48], 1], ["AN", 2, 0, 5], ["AN", 2, 1, 6]]]], "r": [[2.52304e-06, 2.52348e-06, 2.52433e-06], 0, 2.5667, 1667948548], "v": "v0.6"}
{"i": [["[\"mul\", 1, 1, 1, 1152]", "cuda -keys=cuda,gpu -max_num_threads=1024 -model=unknown -thread_warp_size=32", [-1, 16, 64, 49152, 2147483647, 1024, 8, 32], "", 0, []], [[], [["FU", 2, [0, 1, 2, 3]], ["SP", 2, 0, 1152, [24], 1], ["AN", 2, 0, 5], ["AN", 2, 1, 6]]]], "r": [[2.6022e-06, 2.60666e-06, 2.60934e-06], 0, 2.80036, 1667948548], "v": "v0.6"}
{"i": [["[\"mul\", 1, 1, 1, 1152]", "cuda -keys=cuda,gpu -max_num_threads=1024 -model=unknown -thread_warp_size=32", [-1, 16, 64, 49152, 2147483647, 1024, 8, 32], "", 0, []], [[], [["FU", 2, [0, 1, 2, 3]], ["SP", 2, 0, 1152, [18], 1], ["AN", 2, 0, 5], ["AN", 2, 1, 6]]]], "r": [[2.51316e-06, 2.51525e-06, 2.51555e-06], 0, 3.03119, 1667948549], "v": "v0.6"}
{"i": [["[\"mul\", 1, 1, 1, 1152]", "cuda -keys=cuda,gpu -max_num_threads=1024 -model=unknown -thread_warp_size=32", [-1, 16, 64, 49152, 2147483647, 1024, 8, 32], "", 0, []], [[], [["FU", 2, [0, 1, 2, 3]], ["SP", 2, 0, 1152, [6], 1], ["AN", 2, 0, 5], ["AN", 2, 1, 6]]]], "r": [[2.62796e-06, 2.6271e-06, 2.62506e-06], 0, 3.34881, 1667948549], "v": "v0.6"}
{"i": [["[\"mul\", 1, 1, 1, 1152]", "cuda -keys=cuda,gpu -max_num_threads=1024 -model=unknown -thread_warp_size=32", [-1, 16, 64, 49152, 2147483647, 1024, 8, 32], "", 0, []], [[], [["FU", 2, [0, 1, 2, 3]], ["SP", 2, 0, 1152, [3], 1], ["AN", 2, 0, 5], ["AN", 2, 1, 6]]]], "r": [[2.93606e-06, 2.93805e-06, 2.9474e-06], 0, 3.60692, 1667948549], "v": "v0.6"}
{"i": [["[\"mul\", 1, 1, 1, 1152]", "cuda -keys=cuda,gpu -max_num_threads=1024 -model=unknown -thread_warp_size=32", [-1, 16, 64, 49152, 2147483647, 1024, 8, 32], "", 0, []], [[], [["FU", 2, [0, 1, 2, 3]], ["SP", 2, 0, 1152, [4], 1], ["AN", 2, 0, 5], ["AN", 2, 1, 6]]]], "r": [[2.70858e-06, 2.7114e-06, 2.71098e-06], 0, 3.85323, 1667948550], "v": "v0.6"}
{"i": [["[\"mul\", 1, 1, 1, 1152]", "cuda -keys=cuda,gpu -max_num_threads=1024 -model=unknown -thread_warp_size=32", [-1, 16, 64, 49152, 2147483647, 1024, 8, 32], "", 0, []], [[], [["FU", 2, [0, 1, 2, 3]], ["SP", 2, 0, 1152, [1], 1], ["AN", 2, 0, 5], ["AN", 2, 1, 6]]]], "r": [[3.36496e-06, 3.3656e-06, 3.36843e-06], 0, 4.13671, 1667948550], "v": "v0.6"}
{"i": [["[\"mul\", 1, 1, 1, 1152]", "cuda -keys=cuda,gpu -max_num_threads=1024 -model=unknown -thread_warp_size=32", [-1, 16, 64, 49152, 2147483647, 1024, 8, 32], "", 0, []], [[], [["FU", 2, [0, 1, 2, 3]], ["SP", 2, 0, 1152, [12], 1], ["AN", 2, 0, 5], ["AN", 2, 1, 6]]]], "r": [[2.60768e-06, 2.60811e-06, 2.60508e-06], 0, 4.39365, 1667948550], "v": "v0.6"}
