python/models/efficientnet/VertiFusionEfficientNet_kernel_configs/efficient_sigmoid_1_1_1_48.log
{"i": [["[\"sigmoid\", 1, 1, 1, 48]", "cuda -keys=cuda,gpu -max_num_threads=1024 -model=unknown -thread_warp_size=32", [-1, 16, 64, 49152, 2147483647, 1024, 8, 32], "", 0, []], [[], [["FU", 1, [0, 1, 2, 3]], ["SP", 1, 0, 48, [3], 1], ["AN", 1, 0, 5], ["AN", 1, 1, 6]]]], "r": [[2.55147e-06, 2.57148e-06, 2.56931e-06], 0, 1.41535, 1667927784], "v": "v0.6"}
{"i": [["[\"sigmoid\", 1, 1, 1, 48]", "cuda -keys=cuda,gpu -max_num_threads=1024 -model=unknown -thread_warp_size=32", [-1, 16, 64, 49152, 2147483647, 1024, 8, 32], "", 0, []], [[], [["FU", 1, [0, 1, 2, 3]], ["SP", 1, 0, 48, [2], 1], ["AN", 1, 0, 5], ["AN", 1, 1, 6]]]], "r": [[2.71079e-06, 2.732e-06, 2.72715e-06], 0, 0.508689, 1667927783], "v": "v0.6"}
{"i": [["[\"sigmoid\", 1, 1, 1, 48]", "cuda -keys=cuda,gpu -max_num_threads=1024 -model=unknown -thread_warp_size=32", [-1, 16, 64, 49152, 2147483647, 1024, 8, 32], "", 0, []], [[], [["FU", 1, [0, 1, 2, 3]], ["SP", 1, 0, 48, [48], 1], ["AN", 1, 0, 5], ["AN", 1, 1, 6]]]], "r": [[2.49662e-06, 2.49205e-06, 2.49193e-06], 0, 0.804347, 1667927783], "v": "v0.6"}
{"i": [["[\"sigmoid\", 1, 1, 1, 48]", "cuda -keys=cuda,gpu -max_num_threads=1024 -model=unknown -thread_warp_size=32", [-1, 16, 64, 49152, 2147483647, 1024, 8, 32], "", 0, []], [[], [["FU", 1, [0, 1, 2, 3]], ["SP", 1, 0, 48, [1], 1], ["AN", 1, 0, 5], ["AN", 1, 1, 6]]]], "r": [[2.55285e-06, 2.54262e-06, 2.54395e-06], 0, 1.0953, 1667927783], "v": "v0.6"}
{"i": [["[\"sigmoid\", 1, 1, 1, 48]", "cuda -keys=cuda,gpu -max_num_threads=1024 -model=unknown -thread_warp_size=32", [-1, 16, 64, 49152, 2147483647, 1024, 8, 32], "", 0, []], [[], [["FU", 1, [0, 1, 2, 3]], ["SP", 1, 0, 48, [16], 1], ["AN", 1, 0, 5], ["AN", 1, 1, 6]]]], "r": [[2.69536e-06, 2.71426e-06, 2.72674e-06], 0, 1.68125, 1667927784], "v": "v0.6"}
{"i": [["[\"sigmoid\", 1, 1, 1, 48]", "cuda -keys=cuda,gpu -max_num_threads=1024 -model=unknown -thread_warp_size=32", [-1, 16, 64, 49152, 2147483647, 1024, 8, 32], "", 0, []], [[], [["FU", 1, [0, 1, 2, 3]], ["SP", 1, 0, 48, [32], 1], ["AN", 1, 0, 5], ["AN", 1, 1, 6]]]], "r": [[2.54283e-06, 2.54034e-06, 2.53365e-06], 0, 2.00936, 1667927784], "v": "v0.6"}
{"i": [["[\"sigmoid\", 1, 1, 1, 48]", "cuda -keys=cuda,gpu -max_num_threads=1024 -model=unknown -thread_warp_size=32", [-1, 16, 64, 49152, 2147483647, 1024, 8, 32], "", 0, []], [[], [["FU", 1, [0, 1, 2, 3]], ["SP", 1, 0, 48, [8], 1], ["AN", 1, 0, 5], ["AN", 1, 1, 6]]]], "r": [[2.49144e-06, 2.46787e-06, 2.47679e-06], 0, 2.52448, 1667927785], "v": "v0.6"}
{"i": [["[\"sigmoid\", 1, 1, 1, 48]", "cuda -keys=cuda,gpu -max_num_threads=1024 -model=unknown -thread_warp_size=32", [-1, 16, 64, 49152, 2147483647, 1024, 8, 32], "", 0, []], [[], [["FU", 1, [0, 1, 2, 3]], ["SP", 1, 0, 48, [12], 1], ["AN", 1, 0, 5], ["AN", 1, 1, 6]]]], "r": [[2.53211e-06, 2.53043e-06, 2.52971e-06], 0, 2.27148, 1667927785], "v": "v0.6"}
{"i": [["[\"sigmoid\", 1, 1, 1, 48]", "cuda -keys=cuda,gpu -max_num_threads=1024 -model=unknown -thread_warp_size=32", [-1, 16, 64, 49152, 2147483647, 1024, 8, 32], "", 0, []], [[], [["FU", 1, [0, 1, 2, 3]], ["SP", 1, 0, 48, [6], 1], ["AN", 1, 0, 5], ["AN", 1, 1, 6]]]], "r": [[2.51433e-06, 2.5119e-06, 2.51236e-06], 0, 2.81923, 1667927785], "v": "v0.6"}
{"i": [["[\"sigmoid\", 1, 1, 1, 48]", "cuda -keys=cuda,gpu -max_num_threads=1024 -model=unknown -thread_warp_size=32", [-1, 16, 64, 49152, 2147483647, 1024, 8, 32], "", 0, []], [[], [["FU", 1, [0, 1, 2, 3]], ["SP", 1, 0, 48, [4], 1], ["AN", 1, 0, 5], ["AN", 1, 1, 6]]]], "r": [[2.56554e-06, 2.56848e-06, 2.56914e-06], 0, 3.06897, 1667927785], "v": "v0.6"}
{"i": [["[\"sigmoid\", 1, 1, 1, 48]", "cuda -keys=cuda,gpu -max_num_threads=1024 -model=unknown -thread_warp_size=32", [-1, 16, 64, 49152, 2147483647, 1024, 8, 32], "", 0, []], [[], [["FU", 1, [0, 1, 2, 3]], ["SP", 1, 0, 48, [24], 1], ["AN", 1, 0, 5], ["AN", 1, 1, 6]]]], "r": [[2.68433e-06, 2.68929e-06, 2.71685e-06], 0, 3.30208, 1667927786], "v": "v0.6"}
{"i": [["[\"sigmoid\", 1, 1, 1, 48]", "cuda -keys=cuda,gpu -max_num_threads=1024 -model=unknown -thread_warp_size=32", [-1, 16, 64, 49152, 2147483647, 1024, 8, 32], "", 0, []], [[], [["FU", 1, [0, 1, 2, 3]], ["SP", 1, 0, 48, [24], 1], ["AN", 1, 0, 5], ["AN", 1, 1, 6]]]], "r": [[2.68792e-06, 2.70122e-06, 2.70605e-06], 0, 0.790248, 1667927917], "v": "v0.6"}
{"i": [["[\"sigmoid\", 1, 1, 1, 48]", "cuda -keys=cuda,gpu -max_num_threads=1024 -model=unknown -thread_warp_size=32", [-1, 16, 64, 49152, 2147483647, 1024, 8, 32], "", 0, []], [[], [["FU", 1, [0, 1, 2, 3]], ["SP", 1, 0, 48, [16], 1], ["AN", 1, 0, 5], ["AN", 1, 1, 6]]]], "r": [[2.46294e-06, 2.45324e-06, 2.45315e-06], 0, 1.06933, 1667927918], "v": "v0.6"}
{"i": [["[\"sigmoid\", 1, 1, 1, 48]", "cuda -keys=cuda,gpu -max_num_threads=1024 -model=unknown -thread_warp_size=32", [-1, 16, 64, 49152, 2147483647, 1024, 8, 32], "", 0, []], [[], [["FU", 1, [0, 1, 2, 3]], ["SP", 1, 0, 48, [8], 1], ["AN", 1, 0, 5], ["AN", 1, 1, 6]]]], "r": [[2.57878e-06, 2.58806e-06, 2.59948e-06], 0, 2.00327, 1667927919], "v": "v0.6"}
{"i": [["[\"sigmoid\", 1, 1, 1, 48]", "cuda -keys=cuda,gpu -max_num_threads=1024 -model=unknown -thread_warp_size=32", [-1, 16, 64, 49152, 2147483647, 1024, 8, 32], "", 0, []], [[], [["FU", 1, [0, 1, 2, 3]], ["SP", 1, 0, 48, [2], 1], ["AN", 1, 0, 5], ["AN", 1, 1, 6]]]], "r": [[2.56258e-06, 2.55169e-06, 2.55453e-06], 0, 1.37086, 1667927918], "v": "v0.6"}
{"i": [["[\"sigmoid\", 1, 1, 1, 48]", "cuda -keys=cuda,gpu -max_num_threads=1024 -model=unknown -thread_warp_size=32", [-1, 16, 64, 49152, 2147483647, 1024, 8, 32], "", 0, []], [[], [["FU", 1, [0, 1, 2, 3]], ["SP", 1, 0, 48, [48], 1], ["AN", 1, 0, 5], ["AN", 1, 1, 6]]]], "r": [[2.59235e-06, 2.59884e-06, 2.62137e-06], 0, 1.65367, 1667927918], "v": "v0.6"}
{"i": [["[\"sigmoid\", 1, 1, 1, 48]", "cuda -keys=cuda,gpu -max_num_threads=1024 -model=unknown -thread_warp_size=32", [-1, 16, 64, 49152, 2147483647, 1024, 8, 32], "", 0, []], [[], [["FU", 1, [0, 1, 2, 3]], ["SP", 1, 0, 48, [4], 1], ["AN", 1, 0, 5], ["AN", 1, 1, 6]]]], "r": [[2.69433e-06, 2.71024e-06, 2.71468e-06], 0, 0.492564, 1667927917], "v": "v0.6"}
{"i": [["[\"sigmoid\", 1, 1, 1, 48]", "cuda -keys=cuda,gpu -max_num_threads=1024 -model=unknown -thread_warp_size=32", [-1, 16, 64, 49152, 2147483647, 1024, 8, 32], "", 0, []], [[], [["FU", 1, [0, 1, 2, 3]], ["SP", 1, 0, 48, [32], 1], ["AN", 1, 0, 5], ["AN", 1, 1, 6]]]], "r": [[2.47615e-06, 2.46741e-06, 2.46775e-06], 0, 2.27985, 1667927919], "v": "v0.6"}
{"i": [["[\"sigmoid\", 1, 1, 1, 48]", "cuda -keys=cuda,gpu -max_num_threads=1024 -model=unknown -thread_warp_size=32", [-1, 16, 64, 49152, 2147483647, 1024, 8, 32], "", 0, []], [[], [["FU", 1, [0, 1, 2, 3]], ["SP", 1, 0, 48, [12], 1], ["AN", 1, 0, 5], ["AN", 1, 1, 6]]]], "r": [[2.67243e-06, 2.68755e-06, 2.69466e-06], 0, 2.46421, 1667927919], "v": "v0.6"}
{"i": [["[\"sigmoid\", 1, 1, 1, 48]", "cuda -keys=cuda,gpu -max_num_threads=1024 -model=unknown -thread_warp_size=32", [-1, 16, 64, 49152, 2147483647, 1024, 8, 32], "", 0, []], [[], [["FU", 1, [0, 1, 2, 3]], ["SP", 1, 0, 48, [3], 1], ["AN", 1, 0, 5], ["AN", 1, 1, 6]]]], "r": [[2.579e-06, 2.56896e-06, 2.57088e-06], 0, 3.01157, 1667927920], "v": "v0.6"}
{"i": [["[\"sigmoid\", 1, 1, 1, 48]", "cuda -keys=cuda,gpu -max_num_threads=1024 -model=unknown -thread_warp_size=32", [-1, 16, 64, 49152, 2147483647, 1024, 8, 32], "", 0, []], [[], [["FU", 1, [0, 1, 2, 3]], ["SP", 1, 0, 48, [1], 1], ["AN", 1, 0, 5], ["AN", 1, 1, 6]]]], "r": [[2.56045e-06, 2.54932e-06, 2.5511e-06], 0, 2.76693, 1667927920], "v": "v0.6"}
{"i": [["[\"sigmoid\", 1, 1, 1, 48]", "cuda -keys=cuda,gpu -max_num_threads=1024 -model=unknown -thread_warp_size=32", [-1, 16, 64, 49152, 2147483647, 1024, 8, 32], "", 0, []], [[], [["FU", 1, [0, 1, 2, 3]], ["SP", 1, 0, 48, [6], 1], ["AN", 1, 0, 5], ["AN", 1, 1, 6]]]], "r": [[2.64362e-06, 2.63714e-06, 2.6348e-06], 0, 3.29965, 1667927920], "v": "v0.6"}
{"i": [["[\"sigmoid\", 1, 1, 1, 48]", "cuda -keys=cuda,gpu -max_num_threads=1024 -model=unknown -thread_warp_size=32", [-1, 16, 64, 49152, 2147483647, 1024, 8, 32], "", 0, []], [[], [["FU", 1, [0, 1, 2, 3]], ["SP", 1, 0, 48, [4], 1], ["AN", 1, 0, 5], ["AN", 1, 1, 6]]]], "r": [[2.4892e-06, 2.4786e-06, 2.47888e-06], 0, 1.81055, 1667946780], "v": "v0.6"}
{"i": [["[\"sigmoid\", 1, 1, 1, 48]", "cuda -keys=cuda,gpu -max_num_threads=1024 -model=unknown -thread_warp_size=32", [-1, 16, 64, 49152, 2147483647, 1024, 8, 32], "", 0, []], [[], [["FU", 1, [0, 1, 2, 3]], ["SP", 1, 0, 48, [6], 1], ["AN", 1, 0, 5], ["AN", 1, 1, 6]]]], "r": [[2.56749e-06, 2.57164e-06, 2.5706e-06], 0, 0.618003, 1667946779], "v": "v0.6"}
{"i": [["[\"sigmoid\", 1, 1, 1, 48]", "cuda -keys=cuda,gpu -max_num_threads=1024 -model=unknown -thread_warp_size=32", [-1, 16, 64, 49152, 2147483647, 1024, 8, 32], "", 0, []], [[], [["FU", 1, [0, 1, 2, 3]], ["SP", 1, 0, 48, [24], 1], ["AN", 1, 0, 5], ["AN", 1, 1, 6]]]], "r": [[2.64189e-06, 2.65601e-06, 2.66211e-06], 0, 1.44826, 1667946780], "v": "v0.6"}
{"i": [["[\"sigmoid\", 1, 1, 1, 48]", "cuda -keys=cuda,gpu -max_num_threads=1024 -model=unknown -thread_warp_size=32", [-1, 16, 64, 49152, 2147483647, 1024, 8, 32], "", 0, []], [[], [["FU", 1, [0, 1, 2, 3]], ["SP", 1, 0, 48, [2], 1], ["AN", 1, 0, 5], ["AN", 1, 1, 6]]]], "r": [[2.63125e-06, 2.62768e-06, 2.62458e-06], 0, 1.15637, 1667946780], "v": "v0.6"}
{"i": [["[\"sigmoid\", 1, 1, 1, 48]", "cuda -keys=cuda,gpu -max_num_threads=1024 -model=unknown -thread_warp_size=32", [-1, 16, 64, 49152, 2147483647, 1024, 8, 32], "", 0, []], [[], [["FU", 1, [0, 1, 2, 3]], ["SP", 1, 0, 48, [12], 1], ["AN", 1, 0, 5], ["AN", 1, 1, 6]]]], "r": [[2.66615e-06, 2.68359e-06, 2.68934e-06], 0, 0.85705, 1667946779], "v": "v0.6"}
{"i": [["[\"sigmoid\", 1, 1, 1, 48]", "cuda -keys=cuda,gpu -max_num_threads=1024 -model=unknown -thread_warp_size=32", [-1, 16, 64, 49152, 2147483647, 1024, 8, 32], "", 0, []], [[], [["FU", 1, [0, 1, 2, 3]], ["SP", 1, 0, 48, [8], 1], ["AN", 1, 0, 5], ["AN", 1, 1, 6]]]], "r": [[2.49273e-06, 2.48702e-06, 2.48822e-06], 0, 1.93445, 1667946781], "v": "v0.6"}
{"i": [["[\"sigmoid\", 1, 1, 1, 48]", "cuda -keys=cuda,gpu -max_num_threads=1024 -model=unknown -thread_warp_size=32", [-1, 16, 64, 49152, 2147483647, 1024, 8, 32], "", 0, []], [[], [["FU", 1, [0, 1, 2, 3]], ["SP", 1, 0, 48, [16], 1], ["AN", 1, 0, 5], ["AN", 1, 1, 6]]]], "r": [[2.55498e-06, 2.54665e-06, 2.54471e-06], 0, 2.26355, 1667946781], "v": "v0.6"}
{"i": [["[\"sigmoid\", 1, 1, 1, 48]", "cuda -keys=cuda,gpu -max_num_threads=1024 -model=unknown -thread_warp_size=32", [-1, 16, 64, 49152, 2147483647, 1024, 8, 32], "", 0, []], [[], [["FU", 1, [0, 1, 2, 3]], ["SP", 1, 0, 48, [1], 1], ["AN", 1, 0, 5], ["AN", 1, 1, 6]]]], "r": [[2.49657e-06, 2.49053e-06, 2.49146e-06], 0, 2.51173, 1667946781], "v": "v0.6"}
{"i": [["[\"sigmoid\", 1, 1, 1, 48]", "cuda -keys=cuda,gpu -max_num_threads=1024 -model=unknown -thread_warp_size=32", [-1, 16, 64, 49152, 2147483647, 1024, 8, 32], "", 0, []], [[], [["FU", 1, [0, 1, 2, 3]], ["SP", 1, 0, 48, [32], 1], ["AN", 1, 0, 5], ["AN", 1, 1, 6]]]], "r": [[2.67528e-06, 2.68658e-06, 2.69252e-06], 0, 3.06328, 1667946782], "v": "v0.6"}
{"i": [["[\"sigmoid\", 1, 1, 1, 48]", "cuda -keys=cuda,gpu -max_num_threads=1024 -model=unknown -thread_warp_size=32", [-1, 16, 64, 49152, 2147483647, 1024, 8, 32], "", 0, []], [[], [["FU", 1, [0, 1, 2, 3]], ["SP", 1, 0, 48, [3], 1], ["AN", 1, 0, 5], ["AN", 1, 1, 6]]]], "r": [[2.49197e-06, 2.48353e-06, 2.48935e-06], 0, 2.77354, 1667946782], "v": "v0.6"}
{"i": [["[\"sigmoid\", 1, 1, 1, 48]", "cuda -keys=cuda,gpu -max_num_threads=1024 -model=unknown -thread_warp_size=32", [-1, 16, 64, 49152, 2147483647, 1024, 8, 32], "", 0, []], [[], [["FU", 1, [0, 1, 2, 3]], ["SP", 1, 0, 48, [48], 1], ["AN", 1, 0, 5], ["AN", 1, 1, 6]]]], "r": [[2.65915e-06, 2.66256e-06, 2.68177e-06], 0, 3.35656, 1667946782], "v": "v0.6"}
{"i": [["[\"sigmoid\", 1, 1, 1, 48]", "cuda -keys=cuda,gpu -max_num_threads=1024 -model=unknown -thread_warp_size=32", [-1, 16, 64, 49152, 2147483647, 1024, 8, 32], "", 0, []], [[], [["FU", 1, [0, 1, 2, 3]], ["SP", 1, 0, 48, [48], 1], ["AN", 1, 0, 5], ["AN", 1, 1, 6]]]], "r": [[2.58547e-06, 2.59582e-06, 2.60607e-06], 0, 1.75335, 1667947667], "v": "v0.6"}
{"i": [["[\"sigmoid\", 1, 1, 1, 48]", "cuda -keys=cuda,gpu -max_num_threads=1024 -model=unknown -thread_warp_size=32", [-1, 16, 64, 49152, 2147483647, 1024, 8, 32], "", 0, []], [[], [["FU", 1, [0, 1, 2, 3]], ["SP", 1, 0, 48, [6], 1], ["AN", 1, 0, 5], ["AN", 1, 1, 6]]]], "r": [[2.6902e-06, 2.69126e-06, 2.70584e-06], 0, 1.50896, 1667947667], "v": "v0.6"}
{"i": [["[\"sigmoid\", 1, 1, 1, 48]", "cuda -keys=cuda,gpu -max_num_threads=1024 -model=unknown -thread_warp_size=32", [-1, 16, 64, 49152, 2147483647, 1024, 8, 32], "", 0, []], [[], [["FU", 1, [0, 1, 2, 3]], ["SP", 1, 0, 48, [4], 1], ["AN", 1, 0, 5], ["AN", 1, 1, 6]]]], "r": [[2.55427e-06, 2.54425e-06, 2.54547e-06], 0, 1.20216, 1667947666], "v": "v0.6"}
{"i": [["[\"sigmoid\", 1, 1, 1, 48]", "cuda -keys=cuda,gpu -max_num_threads=1024 -model=unknown -thread_warp_size=32", [-1, 16, 64, 49152, 2147483647, 1024, 8, 32], "", 0, []], [[], [["FU", 1, [0, 1, 2, 3]], ["SP", 1, 0, 48, [32], 1], ["AN", 1, 0, 5], ["AN", 1, 1, 6]]]], "r": [[2.53968e-06, 2.53451e-06, 2.53499e-06], 0, 0.546956, 1667947666], "v": "v0.6"}
{"i": [["[\"sigmoid\", 1, 1, 1, 48]", "cuda -keys=cuda,gpu -max_num_threads=1024 -model=unknown -thread_warp_size=32", [-1, 16, 64, 49152, 2147483647, 1024, 8, 32], "", 0, []], [[], [["FU", 1, [0, 1, 2, 3]], ["SP", 1, 0, 48, [12], 1], ["AN", 1, 0, 5], ["AN", 1, 1, 6]]]], "r": [[2.63765e-06, 2.64633e-06, 2.65309e-06], 0, 0.854215, 1667947666], "v": "v0.6"}
{"i": [["[\"sigmoid\", 1, 1, 1, 48]", "cuda -keys=cuda,gpu -max_num_threads=1024 -model=unknown -thread_warp_size=32", [-1, 16, 64, 49152, 2147483647, 1024, 8, 32], "", 0, []], [[], [["FU", 1, [0, 1, 2, 3]], ["SP", 1, 0, 48, [8], 1], ["AN", 1, 0, 5], ["AN", 1, 1, 6]]]], "r": [[2.52158e-06, 2.52171e-06, 2.52122e-06], 0, 2.04492, 1667947667], "v": "v0.6"}
{"i": [["[\"sigmoid\", 1, 1, 1, 48]", "cuda -keys=cuda,gpu -max_num_threads=1024 -model=unknown -thread_warp_size=32", [-1, 16, 64, 49152, 2147483647, 1024, 8, 32], "", 0, []], [[], [["FU", 1, [0, 1, 2, 3]], ["SP", 1, 0, 48, [2], 1], ["AN", 1, 0, 5], ["AN", 1, 1, 6]]]], "r": [[2.7136e-06, 2.72865e-06, 2.71605e-06], 0, 2.27858, 1667947668], "v": "v0.6"}
{"i": [["[\"sigmoid\", 1, 1, 1, 48]", "cuda -keys=cuda,gpu -max_num_threads=1024 -model=unknown -thread_warp_size=32", [-1, 16, 64, 49152, 2147483647, 1024, 8, 32], "", 0, []], [[], [["FU", 1, [0, 1, 2, 3]], ["SP", 1, 0, 48, [1], 1], ["AN", 1, 0, 5], ["AN", 1, 1, 6]]]], "r": [[2.55505e-06, 2.5447e-06, 2.54841e-06], 0, 2.51622, 1667947668], "v": "v0.6"}
{"i": [["[\"sigmoid\", 1, 1, 1, 48]", "cuda -keys=cuda,gpu -max_num_threads=1024 -model=unknown -thread_warp_size=32", [-1, 16, 64, 49152, 2147483647, 1024, 8, 32], "", 0, []], [[], [["FU", 1, [0, 1, 2, 3]], ["SP", 1, 0, 48, [24], 1], ["AN", 1, 0, 5], ["AN", 1, 1, 6]]]], "r": [[2.49578e-06, 2.48691e-06, 2.49201e-06], 0, 2.79469, 1667947668], "v": "v0.6"}
{"i": [["[\"sigmoid\", 1, 1, 1, 48]", "cuda -keys=cuda,gpu -max_num_threads=1024 -model=unknown -thread_warp_size=32", [-1, 16, 64, 49152, 2147483647, 1024, 8, 32], "", 0, []], [[], [["FU", 1, [0, 1, 2, 3]], ["SP", 1, 0, 48, [3], 1], ["AN", 1, 0, 5], ["AN", 1, 1, 6]]]], "r": [[2.49757e-06, 2.48874e-06, 2.48901e-06], 0, 3.07002, 1667947669], "v": "v0.6"}
{"i": [["[\"sigmoid\", 1, 1, 1, 48]", "cuda -keys=cuda,gpu -max_num_threads=1024 -model=unknown -thread_warp_size=32", [-1, 16, 64, 49152, 2147483647, 1024, 8, 32], "", 0, []], [[], [["FU", 1, [0, 1, 2, 3]], ["SP", 1, 0, 48, [16], 1], ["AN", 1, 0, 5], ["AN", 1, 1, 6]]]], "r": [[2.55488e-06, 2.54954e-06, 2.54873e-06], 0, 3.30879, 1667947669], "v": "v0.6"}
{"i": [["[\"sigmoid\", 1, 1, 1, 48]", "cuda -keys=cuda,gpu -max_num_threads=1024 -model=unknown -thread_warp_size=32", [-1, 16, 64, 49152, 2147483647, 1024, 8, 32], "", 0, []], [[], [["FU", 1, [0, 1, 2, 3]], ["SP", 1, 0, 48, [32], 1], ["AN", 1, 0, 5], ["AN", 1, 1, 6]]]], "r": [[2.54153e-06, 2.54237e-06, 2.54152e-06], 0, 1.80328, 1667947931], "v": "v0.6"}
{"i": [["[\"sigmoid\", 1, 1, 1, 48]", "cuda -keys=cuda,gpu -max_num_threads=1024 -model=unknown -thread_warp_size=32", [-1, 16, 64, 49152, 2147483647, 1024, 8, 32], "", 0, []], [[], [["FU", 1, [0, 1, 2, 3]], ["SP", 1, 0, 48, [12], 1], ["AN", 1, 0, 5], ["AN", 1, 1, 6]]]], "r": [[2.50498e-06, 2.50009e-06, 2.5033e-06], 0, 0.874555, 1667947930], "v": "v0.6"}
{"i": [["[\"sigmoid\", 1, 1, 1, 48]", "cuda -keys=cuda,gpu -max_num_threads=1024 -model=unknown -thread_warp_size=32", [-1, 16, 64, 49152, 2147483647, 1024, 8, 32], "", 0, []], [[], [["FU", 1, [0, 1, 2, 3]], ["SP", 1, 0, 48, [16], 1], ["AN", 1, 0, 5], ["AN", 1, 1, 6]]]], "r": [[2.68672e-06, 2.70167e-06, 2.71023e-06], 0, 2.12453, 1667947931], "v": "v0.6"}
{"i": [["[\"sigmoid\", 1, 1, 1, 48]", "cuda -keys=cuda,gpu -max_num_threads=1024 -model=unknown -thread_warp_size=32", [-1, 16, 64, 49152, 2147483647, 1024, 8, 32], "", 0, []], [[], [["FU", 1, [0, 1, 2, 3]], ["SP", 1, 0, 48, [4], 1], ["AN", 1, 0, 5], ["AN", 1, 1, 6]]]], "r": [[2.48744e-06, 2.47881e-06, 2.48105e-06], 0, 0.538715, 1667947930], "v": "v0.6"}
{"i": [["[\"sigmoid\", 1, 1, 1, 48]", "cuda -keys=cuda,gpu -max_num_threads=1024 -model=unknown -thread_warp_size=32", [-1, 16, 64, 49152, 2147483647, 1024, 8, 32], "", 0, []], [[], [["FU", 1, [0, 1, 2, 3]], ["SP", 1, 0, 48, [3], 1], ["AN", 1, 0, 5], ["AN", 1, 1, 6]]]], "r": [[2.58616e-06, 2.57888e-06, 2.57702e-06], 0, 1.49263, 1667947931], "v": "v0.6"}
{"i": [["[\"sigmoid\", 1, 1, 1, 48]", "cuda -keys=cuda,gpu -max_num_threads=1024 -model=unknown -thread_warp_size=32", [-1, 16, 64, 49152, 2147483647, 1024, 8, 32], "", 0, []], [[], [["FU", 1, [0, 1, 2, 3]], ["SP", 1, 0, 48, [24], 1], ["AN", 1, 0, 5], ["AN", 1, 1, 6]]]], "r": [[2.68785e-06, 2.69995e-06, 2.70847e-06], 0, 2.4051, 1667947931], "v": "v0.6"}
{"i": [["[\"sigmoid\", 1, 1, 1, 48]", "cuda -keys=cuda,gpu -max_num_threads=1024 -model=unknown -thread_warp_size=32", [-1, 16, 64, 49152, 2147483647, 1024, 8, 32], "", 0, []], [[], [["FU", 1, [0, 1, 2, 3]], ["SP", 1, 0, 48, [48], 1], ["AN", 1, 0, 5], ["AN", 1, 1, 6]]]], "r": [[2.60888e-06, 2.61555e-06, 2.62483e-06], 0, 1.18256, 1667947930], "v": "v0.6"}
{"i": [["[\"sigmoid\", 1, 1, 1, 48]", "cuda -keys=cuda,gpu -max_num_threads=1024 -model=unknown -thread_warp_size=32", [-1, 16, 64, 49152, 2147483647, 1024, 8, 32], "", 0, []], [[], [["FU", 1, [0, 1, 2, 3]], ["SP", 1, 0, 48, [6], 1], ["AN", 1, 0, 5], ["AN", 1, 1, 6]]]], "r": [[2.67949e-06, 2.69595e-06, 2.69864e-06], 0, 2.94807, 1667947932], "v": "v0.6"}
{"i": [["[\"sigmoid\", 1, 1, 1, 48]", "cuda -keys=cuda,gpu -max_num_threads=1024 -model=unknown -thread_warp_size=32", [-1, 16, 64, 49152, 2147483647, 1024, 8, 32], "", 0, []], [[], [["FU", 1, [0, 1, 2, 3]], ["SP", 1, 0, 48, [1], 1], ["AN", 1, 0, 5], ["AN", 1, 1, 6]]]], "r": [[2.59441e-06, 2.58849e-06, 2.58736e-06], 0, 2.68768, 1667947932], "v": "v0.6"}
{"i": [["[\"sigmoid\", 1, 1, 1, 48]", "cuda -keys=cuda,gpu -max_num_threads=1024 -model=unknown -thread_warp_size=32", [-1, 16, 64, 49152, 2147483647, 1024, 8, 32], "", 0, []], [[], [["FU", 1, [0, 1, 2, 3]], ["SP", 1, 0, 48, [8], 1], ["AN", 1, 0, 5], ["AN", 1, 1, 6]]]], "r": [[2.49855e-06, 2.48897e-06, 2.48933e-06], 0, 3.19557, 1667947932], "v": "v0.6"}
{"i": [["[\"sigmoid\", 1, 1, 1, 48]", "cuda -keys=cuda,gpu -max_num_threads=1024 -model=unknown -thread_warp_size=32", [-1, 16, 64, 49152, 2147483647, 1024, 8, 32], "", 0, []], [[], [["FU", 1, [0, 1, 2, 3]], ["SP", 1, 0, 48, [2], 1], ["AN", 1, 0, 5], ["AN", 1, 1, 6]]]], "r": [[2.52942e-06, 2.52033e-06, 2.52021e-06], 0, 3.48891, 1667947933], "v": "v0.6"}
{"i": [["[\"sigmoid\", 1, 1, 1, 48]", "cuda -keys=cuda,gpu -max_num_threads=1024 -model=unknown -thread_warp_size=32", [-1, 16, 64, 49152, 2147483647, 1024, 8, 32], "", 0, []], [[], [["FU", 1, [0, 1, 2, 3]], ["SP", 1, 0, 48, [16], 1], ["AN", 1, 0, 5], ["AN", 1, 1, 6]]]], "r": [[2.66961e-06, 2.67563e-06, 2.685e-06], 0, 1.67686, 1667948496], "v": "v0.6"}
{"i": [["[\"sigmoid\", 1, 1, 1, 48]", "cuda -keys=cuda,gpu -max_num_threads=1024 -model=unknown -thread_warp_size=32", [-1, 16, 64, 49152, 2147483647, 1024, 8, 32], "", 0, []], [[], [["FU", 1, [0, 1, 2, 3]], ["SP", 1, 0, 48, [32], 1], ["AN", 1, 0, 5], ["AN", 1, 1, 6]]]], "r": [[2.61273e-06, 2.60958e-06, 2.60951e-06], 0, 0.831594, 1667948495], "v": "v0.6"}
{"i": [["[\"sigmoid\", 1, 1, 1, 48]", "cuda -keys=cuda,gpu -max_num_threads=1024 -model=unknown -thread_warp_size=32", [-1, 16, 64, 49152, 2147483647, 1024, 8, 32], "", 0, []], [[], [["FU", 1, [0, 1, 2, 3]], ["SP", 1, 0, 48, [48], 1], ["AN", 1, 0, 5], ["AN", 1, 1, 6]]]], "r": [[2.58843e-06, 2.58174e-06, 2.62035e-06], 0, 1.47076, 1667948495], "v": "v0.6"}
{"i": [["[\"sigmoid\", 1, 1, 1, 48]", "cuda -keys=cuda,gpu -max_num_threads=1024 -model=unknown -thread_warp_size=32", [-1, 16, 64, 49152, 2147483647, 1024, 8, 32], "", 0, []], [[], [["FU", 1, [0, 1, 2, 3]], ["SP", 1, 0, 48, [6], 1], ["AN", 1, 0, 5], ["AN", 1, 1, 6]]]], "r": [[2.68223e-06, 2.70269e-06, 2.70015e-06], 0, 0.509854, 1667948494], "v": "v0.6"}
{"i": [["[\"sigmoid\", 1, 1, 1, 48]", "cuda -keys=cuda,gpu -max_num_threads=1024 -model=unknown -thread_warp_size=32", [-1, 16, 64, 49152, 2147483647, 1024, 8, 32], "", 0, []], [[], [["FU", 1, [0, 1, 2, 3]], ["SP", 1, 0, 48, [4], 1], ["AN", 1, 0, 5], ["AN", 1, 1, 6]]]], "r": [[2.50198e-06, 2.49623e-06, 2.49749e-06], 0, 1.12354, 1667948495], "v": "v0.6"}
{"i": [["[\"sigmoid\", 1, 1, 1, 48]", "cuda -keys=cuda,gpu -max_num_threads=1024 -model=unknown -thread_warp_size=32", [-1, 16, 64, 49152, 2147483647, 1024, 8, 32], "", 0, []], [[], [["FU", 1, [0, 1, 2, 3]], ["SP", 1, 0, 48, [12], 1], ["AN", 1, 0, 5], ["AN", 1, 1, 6]]]], "r": [[2.61184e-06, 2.6091e-06, 2.63189e-06], 0, 1.96423, 1667948496], "v": "v0.6"}
{"i": [["[\"sigmoid\", 1, 1, 1, 48]", "cuda -keys=cuda,gpu -max_num_threads=1024 -model=unknown -thread_warp_size=32", [-1, 16, 64, 49152, 2147483647, 1024, 8, 32], "", 0, []], [[], [["FU", 1, [0, 1, 2, 3]], ["SP", 1, 0, 48, [3], 1], ["AN", 1, 0, 5], ["AN", 1, 1, 6]]]], "r": [[2.67791e-06, 2.69673e-06, 2.69347e-06], 0, 2.18364, 1667948496], "v": "v0.6"}
{"i": [["[\"sigmoid\", 1, 1, 1, 48]", "cuda -keys=cuda,gpu -max_num_threads=1024 -model=unknown -thread_warp_size=32", [-1, 16, 64, 49152, 2147483647, 1024, 8, 32], "", 0, []], [[], [["FU", 1, [0, 1, 2, 3]], ["SP", 1, 0, 48, [8], 1], ["AN", 1, 0, 5], ["AN", 1, 1, 6]]]], "r": [[2.50608e-06, 2.49598e-06, 2.49978e-06], 0, 2.4524, 1667948497], "v": "v0.6"}
{"i": [["[\"sigmoid\", 1, 1, 1, 48]", "cuda -keys=cuda,gpu -max_num_threads=1024 -model=unknown -thread_warp_size=32", [-1, 16, 64, 49152, 2147483647, 1024, 8, 32], "", 0, []], [[], [["FU", 1, [0, 1, 2, 3]], ["SP", 1, 0, 48, [24], 1], ["AN", 1, 0, 5], ["AN", 1, 1, 6]]]], "r": [[2.5559e-06, 2.54999e-06, 2.55005e-06], 0, 2.74708, 1667948497], "v": "v0.6"}
{"i": [["[\"sigmoid\", 1, 1, 1, 48]", "cuda -keys=cuda,gpu -max_num_threads=1024 -model=unknown -thread_warp_size=32", [-1, 16, 64, 49152, 2147483647, 1024, 8, 32], "", 0, []], [[], [["FU", 1, [0, 1, 2, 3]], ["SP", 1, 0, 48, [2], 1], ["AN", 1, 0, 5], ["AN", 1, 1, 6]]]], "r": [[2.50306e-06, 2.49203e-06, 2.49233e-06], 0, 3.01117, 1667948497], "v": "v0.6"}
{"i": [["[\"sigmoid\", 1, 1, 1, 48]", "cuda -keys=cuda,gpu -max_num_threads=1024 -model=unknown -thread_warp_size=32", [-1, 16, 64, 49152, 2147483647, 1024, 8, 32], "", 0, []], [[], [["FU", 1, [0, 1, 2, 3]], ["SP", 1, 0, 48, [1], 1], ["AN", 1, 0, 5], ["AN", 1, 1, 6]]]], "r": [[2.49979e-06, 2.48946e-06, 2.49171e-06], 0, 3.26155, 1667948498], "v": "v0.6"}
