python/models/efficientnet/VertiFusionEfficientNet_kernel_configs/efficient_sigmoid_1_1_1_240.log
{"i": [["[\"sigmoid\", 1, 1, 1, 240]", "cuda -keys=cuda,gpu -max_num_threads=1024 -model=unknown -thread_warp_size=32", [-1, 16, 64, 49152, 2147483647, 1024, 8, 32], "", 0, []], [[], [["FU", 1, [0, 1, 2, 3]], ["SP", 1, 0, 240, [3], 1], ["AN", 1, 0, 5], ["AN", 1, 1, 6]]]], "r": [[2.64254e-06, 2.65613e-06, 2.65172e-06], 0, 2.11058, 1667926428], "v": "v0.6"}
{"i": [["[\"sigmoid\", 1, 1, 1, 240]", "cuda -keys=cuda,gpu -max_num_threads=1024 -model=unknown -thread_warp_size=32", [-1, 16, 64, 49152, 2147483647, 1024, 8, 32], "", 0, []], [[], [["FU", 1, [0, 1, 2, 3]], ["SP", 1, 0, 240, [16], 1], ["AN", 1, 0, 5], ["AN", 1, 1, 6]]]], "r": [[2.49674e-06, 2.48678e-06, 2.49132e-06], 0, 2.71775, 1667926429], "v": "v0.6"}
{"i": [["[\"sigmoid\", 1, 1, 1, 240]", "cuda -keys=cuda,gpu -max_num_threads=1024 -model=unknown -thread_warp_size=32", [-1, 16, 64, 49152, 2147483647, 1024, 8, 32], "", 0, []], [[], [["FU", 1, [0, 1, 2, 3]], ["SP", 1, 0, 240, [15], 1], ["AN", 1, 0, 5], ["AN", 1, 1, 6]]]], "r": [[2.64164e-06, 2.63739e-06, 2.63516e-06], 0, 0.602069, 1667926427], "v": "v0.6"}
{"i": [["[\"sigmoid\", 1, 1, 1, 240]", "cuda -keys=cuda,gpu -max_num_threads=1024 -model=unknown -thread_warp_size=32", [-1, 16, 64, 49152, 2147483647, 1024, 8, 32], "", 0, []], [[], [["FU", 1, [0, 1, 2, 3]], ["SP", 1, 0, 240, [6], 1], ["AN", 1, 0, 5], ["AN", 1, 1, 6]]]], "r": [[2.50231e-06, 2.48905e-06, 2.49223e-06], 0, 1.54563, 1667926428], "v": "v0.6"}
{"i": [["[\"sigmoid\", 1, 1, 1, 240]", "cuda -keys=cuda,gpu -max_num_threads=1024 -model=unknown -thread_warp_size=32", [-1, 16, 64, 49152, 2147483647, 1024, 8, 32], "", 0, []], [[], [["FU", 1, [0, 1, 2, 3]], ["SP", 1, 0, 240, [4], 1], ["AN", 1, 0, 5], ["AN", 1, 1, 6]]]], "r": [[2.60351e-06, 2.59854e-06, 2.59609e-06], 0, 0.931823, 1667926427], "v": "v0.6"}
{"i": [["[\"sigmoid\", 1, 1, 1, 240]", "cuda -keys=cuda,gpu -max_num_threads=1024 -model=unknown -thread_warp_size=32", [-1, 16, 64, 49152, 2147483647, 1024, 8, 32], "", 0, []], [[], [["FU", 1, [0, 1, 2, 3]], ["SP", 1, 0, 240, [8], 1], ["AN", 1, 0, 5], ["AN", 1, 1, 6]]]], "r": [[2.5653e-06, 2.5621e-06, 2.56121e-06], 0, 2.35706, 1667926429], "v": "v0.6"}
{"i": [["[\"sigmoid\", 1, 1, 1, 240]", "cuda -keys=cuda,gpu -max_num_threads=1024 -model=unknown -thread_warp_size=32", [-1, 16, 64, 49152, 2147483647, 1024, 8, 32], "", 0, []], [[], [["FU", 1, [0, 1, 2, 3]], ["SP", 1, 0, 240, [10], 1], ["AN", 1, 0, 5], ["AN", 1, 1, 6]]]], "r": [[2.62361e-06, 2.61423e-06, 2.61708e-06], 0, 1.81937, 1667926428], "v": "v0.6"}
{"i": [["[\"sigmoid\", 1, 1, 1, 240]", "cuda -keys=cuda,gpu -max_num_threads=1024 -model=unknown -thread_warp_size=32", [-1, 16, 64, 49152, 2147483647, 1024, 8, 32], "", 0, []], [[], [["FU", 1, [0, 1, 2, 3]], ["SP", 1, 0, 240, [40], 1], ["AN", 1, 0, 5], ["AN", 1, 1, 6]]]], "r": [[2.69636e-06, 2.71191e-06, 2.70876e-06], 0, 1.20545, 1667926427], "v": "v0.6"}
{"i": [["[\"sigmoid\", 1, 1, 1, 240]", "cuda -keys=cuda,gpu -max_num_threads=1024 -model=unknown -thread_warp_size=32", [-1, 16, 64, 49152, 2147483647, 1024, 8, 32], "", 0, []], [[], [["FU", 1, [0, 1, 2, 3]], ["SP", 1, 0, 240, [24], 1], ["AN", 1, 0, 5], ["AN", 1, 1, 6]]]], "r": [[2.65441e-06, 2.67627e-06, 2.66411e-06], 0, 2.94342, 1667926429], "v": "v0.6"}
{"i": [["[\"sigmoid\", 1, 1, 1, 240]", "cuda -keys=cuda,gpu -max_num_threads=1024 -model=unknown -thread_warp_size=32", [-1, 16, 64, 49152, 2147483647, 1024, 8, 32], "", 0, []], [[], [["FU", 1, [0, 1, 2, 3]], ["SP", 1, 0, 240, [12], 1], ["AN", 1, 0, 5], ["AN", 1, 1, 6]]]], "r": [[2.5007e-06, 2.48885e-06, 2.49065e-06], 0, 3.20326, 1667926430], "v": "v0.6"}
{"i": [["[\"sigmoid\", 1, 1, 1, 240]", "cuda -keys=cuda,gpu -max_num_threads=1024 -model=unknown -thread_warp_size=32", [-1, 16, 64, 49152, 2147483647, 1024, 8, 32], "", 0, []], [[], [["FU", 1, [0, 1, 2, 3]], ["SP", 1, 0, 240, [48], 1], ["AN", 1, 0, 5], ["AN", 1, 1, 6]]]], "r": [[2.69864e-06, 2.72039e-06, 2.7149e-06], 0, 3.4494, 1667926430], "v": "v0.6"}
{"i": [["[\"sigmoid\", 1, 1, 1, 240]", "cuda -keys=cuda,gpu -max_num_threads=1024 -model=unknown -thread_warp_size=32", [-1, 16, 64, 49152, 2147483647, 1024, 8, 32], "", 0, []], [[], [["FU", 1, [0, 1, 2, 3]], ["SP", 1, 0, 240, [30], 1], ["AN", 1, 0, 5], ["AN", 1, 1, 6]]]], "r": [[2.68091e-06, 2.70182e-06, 2.70026e-06], 0, 3.94297, 1667926431], "v": "v0.6"}
{"i": [["[\"sigmoid\", 1, 1, 1, 240]", "cuda -keys=cuda,gpu -max_num_threads=1024 -model=unknown -thread_warp_size=32", [-1, 16, 64, 49152, 2147483647, 1024, 8, 32], "", 0, []], [[], [["FU", 1, [0, 1, 2, 3]], ["SP", 1, 0, 240, [5], 1], ["AN", 1, 0, 5], ["AN", 1, 1, 6]]]], "r": [[2.69629e-06, 2.69456e-06, 2.69559e-06], 0, 3.70622, 1667926430], "v": "v0.6"}
{"i": [["[\"sigmoid\", 1, 1, 1, 240]", "cuda -keys=cuda,gpu -max_num_threads=1024 -model=unknown -thread_warp_size=32", [-1, 16, 64, 49152, 2147483647, 1024, 8, 32], "", 0, []], [[], [["FU", 1, [0, 1, 2, 3]], ["SP", 1, 0, 240, [2], 1], ["AN", 1, 0, 5], ["AN", 1, 1, 6]]]], "r": [[2.83398e-06, 2.84421e-06, 2.851e-06], 0, 4.21394, 1667926431], "v": "v0.6"}
{"i": [["[\"sigmoid\", 1, 1, 1, 240]", "cuda -keys=cuda,gpu -max_num_threads=1024 -model=unknown -thread_warp_size=32", [-1, 16, 64, 49152, 2147483647, 1024, 8, 32], "", 0, []], [[], [["FU", 1, [0, 1, 2, 3]], ["SP", 1, 0, 240, [60], 1], ["AN", 1, 0, 5], ["AN", 1, 1, 6]]]], "r": [[2.52815e-06, 2.52871e-06, 2.52637e-06], 0, 4.49532, 1667926431], "v": "v0.6"}
{"i": [["[\"sigmoid\", 1, 1, 1, 240]", "cuda -keys=cuda,gpu -max_num_threads=1024 -model=unknown -thread_warp_size=32", [-1, 16, 64, 49152, 2147483647, 1024, 8, 32], "", 0, []], [[], [["FU", 1, [0, 1, 2, 3]], ["SP", 1, 0, 240, [32], 1], ["AN", 1, 0, 5], ["AN", 1, 1, 6]]]], "r": [[2.53349e-06, 2.5302e-06, 2.53243e-06], 0, 4.79267, 1667926432], "v": "v0.6"}
{"i": [["[\"sigmoid\", 1, 1, 1, 240]", "cuda -keys=cuda,gpu -max_num_threads=1024 -model=unknown -thread_warp_size=32", [-1, 16, 64, 49152, 2147483647, 1024, 8, 32], "", 0, []], [[], [["FU", 1, [0, 1, 2, 3]], ["SP", 1, 0, 240, [1], 1], ["AN", 1, 0, 5], ["AN", 1, 1, 6]]]], "r": [[2.87679e-06, 2.88577e-06, 2.88052e-06], 0, 5.07644, 1667926432], "v": "v0.6"}
{"i": [["[\"sigmoid\", 1, 1, 1, 240]", "cuda -keys=cuda,gpu -max_num_threads=1024 -model=unknown -thread_warp_size=32", [-1, 16, 64, 49152, 2147483647, 1024, 8, 32], "", 0, []], [[], [["FU", 1, [0, 1, 2, 3]], ["SP", 1, 0, 240, [20], 1], ["AN", 1, 0, 5], ["AN", 1, 1, 6]]]], "r": [[2.50116e-06, 2.49559e-06, 2.49488e-06], 0, 5.36006, 1667926432], "v": "v0.6"}
{"i": [["[\"sigmoid\", 1, 1, 1, 240]", "cuda -keys=cuda,gpu -max_num_threads=1024 -model=unknown -thread_warp_size=32", [-1, 16, 64, 49152, 2147483647, 1024, 8, 32], "", 0, []], [[], [["FU", 1, [0, 1, 2, 3]], ["SP", 1, 0, 240, [5], 1], ["AN", 1, 0, 5], ["AN", 1, 1, 6]]]], "r": [[2.54113e-06, 2.53538e-06, 2.535e-06], 0, 1.4778, 1667926624], "v": "v0.6"}
{"i": [["[\"sigmoid\", 1, 1, 1, 240]", "cuda -keys=cuda,gpu -max_num_threads=1024 -model=unknown -thread_warp_size=32", [-1, 16, 64, 49152, 2147483647, 1024, 8, 32], "", 0, []], [[], [["FU", 1, [0, 1, 2, 3]], ["SP", 1, 0, 240, [48], 1], ["AN", 1, 0, 5], ["AN", 1, 1, 6]]]], "r": [[2.52829e-06, 2.52349e-06, 2.52093e-06], 0, 1.26074, 1667926623], "v": "v0.6"}
{"i": [["[\"sigmoid\", 1, 1, 1, 240]", "cuda -keys=cuda,gpu -max_num_threads=1024 -model=unknown -thread_warp_size=32", [-1, 16, 64, 49152, 2147483647, 1024, 8, 32], "", 0, []], [[], [["FU", 1, [0, 1, 2, 3]], ["SP", 1, 0, 240, [30], 1], ["AN", 1, 0, 5], ["AN", 1, 1, 6]]]], "r": [[2.65094e-06, 2.65495e-06, 2.66596e-06], 0, 1.79272, 1667926624], "v": "v0.6"}
{"i": [["[\"sigmoid\", 1, 1, 1, 240]", "cuda -keys=cuda,gpu -max_num_threads=1024 -model=unknown -thread_warp_size=32", [-1, 16, 64, 49152, 2147483647, 1024, 8, 32], "", 0, []], [[], [["FU", 1, [0, 1, 2, 3]], ["SP", 1, 0, 240, [60], 1], ["AN", 1, 0, 5], ["AN", 1, 1, 6]]]], "r": [[2.53148e-06, 2.5213e-06, 2.52488e-06], 0, 0.632139, 1667926623], "v": "v0.6"}
{"i": [["[\"sigmoid\", 1, 1, 1, 240]", "cuda -keys=cuda,gpu -max_num_threads=1024 -model=unknown -thread_warp_size=32", [-1, 16, 64, 49152, 2147483647, 1024, 8, 32], "", 0, []], [[], [["FU", 1, [0, 1, 2, 3]], ["SP", 1, 0, 240, [16], 1], ["AN", 1, 0, 5], ["AN", 1, 1, 6]]]], "r": [[2.52456e-06, 2.52338e-06, 2.52521e-06], 0, 2.06174, 1667926624], "v": "v0.6"}
{"i": [["[\"sigmoid\", 1, 1, 1, 240]", "cuda -keys=cuda,gpu -max_num_threads=1024 -model=unknown -thread_warp_size=32", [-1, 16, 64, 49152, 2147483647, 1024, 8, 32], "", 0, []], [[], [["FU", 1, [0, 1, 2, 3]], ["SP", 1, 0, 240, [24], 1], ["AN", 1, 0, 5], ["AN", 1, 1, 6]]]], "r": [[2.69672e-06, 2.69952e-06, 2.71272e-06], 0, 0.899817, 1667926623], "v": "v0.6"}
{"i": [["[\"sigmoid\", 1, 1, 1, 240]", "cuda -keys=cuda,gpu -max_num_threads=1024 -model=unknown -thread_warp_size=32", [-1, 16, 64, 49152, 2147483647, 1024, 8, 32], "", 0, []], [[], [["FU", 1, [0, 1, 2, 3]], ["SP", 1, 0, 240, [32], 1], ["AN", 1, 0, 5], ["AN", 1, 1, 6]]]], "r": [[2.47866e-06, 2.46729e-06, 2.46894e-06], 0, 2.10979, 1667926625], "v": "v0.6"}
{"i": [["[\"sigmoid\", 1, 1, 1, 240]", "cuda -keys=cuda,gpu -max_num_threads=1024 -model=unknown -thread_warp_size=32", [-1, 16, 64, 49152, 2147483647, 1024, 8, 32], "", 0, []], [[], [["FU", 1, [0, 1, 2, 3]], ["SP", 1, 0, 240, [10], 1], ["AN", 1, 0, 5], ["AN", 1, 1, 6]]]], "r": [[2.61543e-06, 2.61396e-06, 2.61724e-06], 0, 3.09706, 1667926626], "v": "v0.6"}
{"i": [["[\"sigmoid\", 1, 1, 1, 240]", "cuda -keys=cuda,gpu -max_num_threads=1024 -model=unknown -thread_warp_size=32", [-1, 16, 64, 49152, 2147483647, 1024, 8, 32], "", 0, []], [[], [["FU", 1, [0, 1, 2, 3]], ["SP", 1, 0, 240, [20], 1], ["AN", 1, 0, 5], ["AN", 1, 1, 6]]]], "r": [[2.55064e-06, 2.5475e-06, 2.54726e-06], 0, 2.78541, 1667926625], "v": "v0.6"}
{"i": [["[\"sigmoid\", 1, 1, 1, 240]", "cuda -keys=cuda,gpu -max_num_threads=1024 -model=unknown -thread_warp_size=32", [-1, 16, 64, 49152, 2147483647, 1024, 8, 32], "", 0, []], [[], [["FU", 1, [0, 1, 2, 3]], ["SP", 1, 0, 240, [2], 1], ["AN", 1, 0, 5], ["AN", 1, 1, 6]]]], "r": [[2.69103e-06, 2.68993e-06, 2.6894e-06], 0, 2.45552, 1667926625], "v": "v0.6"}
{"i": [["[\"sigmoid\", 1, 1, 1, 240]", "cuda -keys=cuda,gpu -max_num_threads=1024 -model=unknown -thread_warp_size=32", [-1, 16, 64, 49152, 2147483647, 1024, 8, 32], "", 0, []], [[], [["FU", 1, [0, 1, 2, 3]], ["SP", 1, 0, 240, [8], 1], ["AN", 1, 0, 5], ["AN", 1, 1, 6]]]], "r": [[2.54836e-06, 2.53993e-06, 2.53717e-06], 0, 3.84123, 1667926627], "v": "v0.6"}
{"i": [["[\"sigmoid\", 1, 1, 1, 240]", "cuda -keys=cuda,gpu -max_num_threads=1024 -model=unknown -thread_warp_size=32", [-1, 16, 64, 49152, 2147483647, 1024, 8, 32], "", 0, []], [[], [["FU", 1, [0, 1, 2, 3]], ["SP", 1, 0, 240, [6], 1], ["AN", 1, 0, 5], ["AN", 1, 1, 6]]]], "r": [[2.59187e-06, 2.61696e-06, 2.63093e-06], 0, 3.53418, 1667926626], "v": "v0.6"}
{"i": [["[\"sigmoid\", 1, 1, 1, 240]", "cuda -keys=cuda,gpu -max_num_threads=1024 -model=unknown -thread_warp_size=32", [-1, 16, 64, 49152, 2147483647, 1024, 8, 32], "", 0, []], [[], [["FU", 1, [0, 1, 2, 3]], ["SP", 1, 0, 240, [40], 1], ["AN", 1, 0, 5], ["AN", 1, 1, 6]]]], "r": [[2.56015e-06, 2.56417e-06, 2.55727e-06], 0, 3.23673, 1667926626], "v": "v0.6"}
{"i": [["[\"sigmoid\", 1, 1, 1, 240]", "cuda -keys=cuda,gpu -max_num_threads=1024 -model=unknown -thread_warp_size=32", [-1, 16, 64, 49152, 2147483647, 1024, 8, 32], "", 0, []], [[], [["FU", 1, [0, 1, 2, 3]], ["SP", 1, 0, 240, [1], 1], ["AN", 1, 0, 5], ["AN", 1, 1, 6]]]], "r": [[2.70773e-06, 2.70221e-06, 2.70355e-06], 0, 4.37209, 1667926627], "v": "v0.6"}
{"i": [["[\"sigmoid\", 1, 1, 1, 240]", "cuda -keys=cuda,gpu -max_num_threads=1024 -model=unknown -thread_warp_size=32", [-1, 16, 64, 49152, 2147483647, 1024, 8, 32], "", 0, []], [[], [["FU", 1, [0, 1, 2, 3]], ["SP", 1, 0, 240, [4], 1], ["AN", 1, 0, 5], ["AN", 1, 1, 6]]]], "r": [[2.72597e-06, 2.74698e-06, 2.74555e-06], 0, 4.14038, 1667926627], "v": "v0.6"}
{"i": [["[\"sigmoid\", 1, 1, 1, 240]", "cuda -keys=cuda,gpu -max_num_threads=1024 -model=unknown -thread_warp_size=32", [-1, 16, 64, 49152, 2147483647, 1024, 8, 32], "", 0, []], [[], [["FU", 1, [0, 1, 2, 3]], ["SP", 1, 0, 240, [3], 1], ["AN", 1, 0, 5], ["AN", 1, 1, 6]]]], "r": [[2.60845e-06, 2.59941e-06, 2.60371e-06], 0, 4.62577, 1667926628], "v": "v0.6"}
{"i": [["[\"sigmoid\", 1, 1, 1, 240]", "cuda -keys=cuda,gpu -max_num_threads=1024 -model=unknown -thread_warp_size=32", [-1, 16, 64, 49152, 2147483647, 1024, 8, 32], "", 0, []], [[], [["FU", 1, [0, 1, 2, 3]], ["SP", 1, 0, 240, [12], 1], ["AN", 1, 0, 5], ["AN", 1, 1, 6]]]], "r": [[2.57997e-06, 2.57498e-06, 2.57404e-06], 0, 5.20128, 1667926628], "v": "v0.6"}
{"i": [["[\"sigmoid\", 1, 1, 1, 240]", "cuda -keys=cuda,gpu -max_num_threads=1024 -model=unknown -thread_warp_size=32", [-1, 16, 64, 49152, 2147483647, 1024, 8, 32], "", 0, []], [[], [["FU", 1, [0, 1, 2, 3]], ["SP", 1, 0, 240, [15], 1], ["AN", 1, 0, 5], ["AN", 1, 1, 6]]]], "r": [[2.67613e-06, 2.68707e-06, 2.69782e-06], 0, 4.92352, 1667926628], "v": "v0.6"}
{"i": [["[\"sigmoid\", 1, 1, 1, 240]", "cuda -keys=cuda,gpu -max_num_threads=1024 -model=unknown -thread_warp_size=32", [-1, 16, 64, 49152, 2147483647, 1024, 8, 32], "", 0, []], [[], [["FU", 1, [0, 1, 2, 3]], ["SP", 1, 0, 240, [32], 1], ["AN", 1, 0, 5], ["AN", 1, 1, 6]]]], "r": [[2.47719e-06, 2.46279e-06, 2.46729e-06], 0, 2.23632, 1667938330], "v": "v0.6"}
{"i": [["[\"sigmoid\", 1, 1, 1, 240]", "cuda -keys=cuda,gpu -max_num_threads=1024 -model=unknown -thread_warp_size=32", [-1, 16, 64, 49152, 2147483647, 1024, 8, 32], "", 0, []], [[], [["FU", 1, [0, 1, 2, 3]], ["SP", 1, 0, 240, [20], 1], ["AN", 1, 0, 5], ["AN", 1, 1, 6]]]], "r": [[2.49855e-06, 2.4881e-06, 2.48994e-06], 0, 1.53049, 1667938329], "v": "v0.6"}
{"i": [["[\"sigmoid\", 1, 1, 1, 240]", "cuda -keys=cuda,gpu -max_num_threads=1024 -model=unknown -thread_warp_size=32", [-1, 16, 64, 49152, 2147483647, 1024, 8, 32], "", 0, []], [[], [["FU", 1, [0, 1, 2, 3]], ["SP", 1, 0, 240, [12], 1], ["AN", 1, 0, 5], ["AN", 1, 1, 6]]]], "r": [[2.47914e-06, 2.46619e-06, 2.47182e-06], 0, 1.23149, 1667938329], "v": "v0.6"}
{"i": [["[\"sigmoid\", 1, 1, 1, 240]", "cuda -keys=cuda,gpu -max_num_threads=1024 -model=unknown -thread_warp_size=32", [-1, 16, 64, 49152, 2147483647, 1024, 8, 32], "", 0, []], [[], [["FU", 1, [0, 1, 2, 3]], ["SP", 1, 0, 240, [16], 1], ["AN", 1, 0, 5], ["AN", 1, 1, 6]]]], "r": [[2.64922e-06, 2.66474e-06, 2.66165e-06], 0, 1.86674, 1667938329], "v": "v0.6"}
{"i": [["[\"sigmoid\", 1, 1, 1, 240]", "cuda -keys=cuda,gpu -max_num_threads=1024 -model=unknown -thread_warp_size=32", [-1, 16, 64, 49152, 2147483647, 1024, 8, 32], "", 0, []], [[], [["FU", 1, [0, 1, 2, 3]], ["SP", 1, 0, 240, [60], 1], ["AN", 1, 0, 5], ["AN", 1, 1, 6]]]], "r": [[2.53305e-06, 2.52973e-06, 2.53178e-06], 0, 0.595381, 1667938328], "v": "v0.6"}
{"i": [["[\"sigmoid\", 1, 1, 1, 240]", "cuda -keys=cuda,gpu -max_num_threads=1024 -model=unknown -thread_warp_size=32", [-1, 16, 64, 49152, 2147483647, 1024, 8, 32], "", 0, []], [[], [["FU", 1, [0, 1, 2, 3]], ["SP", 1, 0, 240, [40], 1], ["AN", 1, 0, 5], ["AN", 1, 1, 6]]]], "r": [[2.57224e-06, 2.58412e-06, 2.59141e-06], 0, 0.937061, 1667938328], "v": "v0.6"}
{"i": [["[\"sigmoid\", 1, 1, 1, 240]", "cuda -keys=cuda,gpu -max_num_threads=1024 -model=unknown -thread_warp_size=32", [-1, 16, 64, 49152, 2147483647, 1024, 8, 32], "", 0, []], [[], [["FU", 1, [0, 1, 2, 3]], ["SP", 1, 0, 240, [8], 1], ["AN", 1, 0, 5], ["AN", 1, 1, 6]]]], "r": [[2.48013e-06, 2.47011e-06, 2.47181e-06], 0, 2.43409, 1667938330], "v": "v0.6"}
{"i": [["[\"sigmoid\", 1, 1, 1, 240]", "cuda -keys=cuda,gpu -max_num_threads=1024 -model=unknown -thread_warp_size=32", [-1, 16, 64, 49152, 2147483647, 1024, 8, 32], "", 0, []], [[], [["FU", 1, [0, 1, 2, 3]], ["SP", 1, 0, 240, [4], 1], ["AN", 1, 0, 5], ["AN", 1, 1, 6]]]], "r": [[2.50041e-06, 2.48846e-06, 2.49456e-06], 0, 2.70668, 1667938330], "v": "v0.6"}
{"i": [["[\"sigmoid\", 1, 1, 1, 240]", "cuda -keys=cuda,gpu -max_num_threads=1024 -model=unknown -thread_warp_size=32", [-1, 16, 64, 49152, 2147483647, 1024, 8, 32], "", 0, []], [[], [["FU", 1, [0, 1, 2, 3]], ["SP", 1, 0, 240, [24], 1], ["AN", 1, 0, 5], ["AN", 1, 1, 6]]]], "r": [[2.67679e-06, 2.68576e-06, 2.69496e-06], 0, 2.8965, 1667938331], "v": "v0.6"}
{"i": [["[\"sigmoid\", 1, 1, 1, 240]", "cuda -keys=cuda,gpu -max_num_threads=1024 -model=unknown -thread_warp_size=32", [-1, 16, 64, 49152, 2147483647, 1024, 8, 32], "", 0, []], [[], [["FU", 1, [0, 1, 2, 3]], ["SP", 1, 0, 240, [48], 1], ["AN", 1, 0, 5], ["AN", 1, 1, 6]]]], "r": [[2.57288e-06, 2.57705e-06, 2.57738e-06], 0, 3.14569, 1667938331], "v": "v0.6"}
{"i": [["[\"sigmoid\", 1, 1, 1, 240]", "cuda -keys=cuda,gpu -max_num_threads=1024 -model=unknown -thread_warp_size=32", [-1, 16, 64, 49152, 2147483647, 1024, 8, 32], "", 0, []], [[], [["FU", 1, [0, 1, 2, 3]], ["SP", 1, 0, 240, [2], 1], ["AN", 1, 0, 5], ["AN", 1, 1, 6]]]], "r": [[2.68389e-06, 2.68511e-06, 2.68585e-06], 0, 3.43334, 1667938331], "v": "v0.6"}
{"i": [["[\"sigmoid\", 1, 1, 1, 240]", "cuda -keys=cuda,gpu -max_num_threads=1024 -model=unknown -thread_warp_size=32", [-1, 16, 64, 49152, 2147483647, 1024, 8, 32], "", 0, []], [[], [["FU", 1, [0, 1, 2, 3]], ["SP", 1, 0, 240, [6], 1], ["AN", 1, 0, 5], ["AN", 1, 1, 6]]]], "r": [[2.57461e-06, 2.56785e-06, 2.57275e-06], 0, 3.7219, 1667938332], "v": "v0.6"}
{"i": [["[\"sigmoid\", 1, 1, 1, 240]", "cuda -keys=cuda,gpu -max_num_threads=1024 -model=unknown -thread_warp_size=32", [-1, 16, 64, 49152, 2147483647, 1024, 8, 32], "", 0, []], [[], [["FU", 1, [0, 1, 2, 3]], ["SP", 1, 0, 240, [10], 1], ["AN", 1, 0, 5], ["AN", 1, 1, 6]]]], "r": [[2.53223e-06, 2.52175e-06, 2.52615e-06], 0, 3.96012, 1667938332], "v": "v0.6"}
{"i": [["[\"sigmoid\", 1, 1, 1, 240]", "cuda -keys=cuda,gpu -max_num_threads=1024 -model=unknown -thread_warp_size=32", [-1, 16, 64, 49152, 2147483647, 1024, 8, 32], "", 0, []], [[], [["FU", 1, [0, 1, 2, 3]], ["SP", 1, 0, 240, [3], 1], ["AN", 1, 0, 5], ["AN", 1, 1, 6]]]], "r": [[2.63019e-06, 2.6182e-06, 2.62078e-06], 0, 4.2632, 1667938332], "v": "v0.6"}
{"i": [["[\"sigmoid\", 1, 1, 1, 240]", "cuda -keys=cuda,gpu -max_num_threads=1024 -model=unknown -thread_warp_size=32", [-1, 16, 64, 49152, 2147483647, 1024, 8, 32], "", 0, []], [[], [["FU", 1, [0, 1, 2, 3]], ["SP", 1, 0, 240, [15], 1], ["AN", 1, 0, 5], ["AN", 1, 1, 6]]]], "r": [[2.5597e-06, 2.55077e-06, 2.55138e-06], 0, 4.53722, 1667938333], "v": "v0.6"}
{"i": [["[\"sigmoid\", 1, 1, 1, 240]", "cuda -keys=cuda,gpu -max_num_threads=1024 -model=unknown -thread_warp_size=32", [-1, 16, 64, 49152, 2147483647, 1024, 8, 32], "", 0, []], [[], [["FU", 1, [0, 1, 2, 3]], ["SP", 1, 0, 240, [30], 1], ["AN", 1, 0, 5], ["AN", 1, 1, 6]]]], "r": [[2.47252e-06, 2.46306e-06, 2.46737e-06], 0, 4.8025, 1667938333], "v": "v0.6"}
{"i": [["[\"sigmoid\", 1, 1, 1, 240]", "cuda -keys=cuda,gpu -max_num_threads=1024 -model=unknown -thread_warp_size=32", [-1, 16, 64, 49152, 2147483647, 1024, 8, 32], "", 0, []], [[], [["FU", 1, [0, 1, 2, 3]], ["SP", 1, 0, 240, [1], 1], ["AN", 1, 0, 5], ["AN", 1, 1, 6]]]], "r": [[2.72096e-06, 2.71781e-06, 2.71757e-06], 0, 5.12933, 1667938333], "v": "v0.6"}
{"i": [["[\"sigmoid\", 1, 1, 1, 240]", "cuda -keys=cuda,gpu -max_num_threads=1024 -model=unknown -thread_warp_size=32", [-1, 16, 64, 49152, 2147483647, 1024, 8, 32], "", 0, []], [[], [["FU", 1, [0, 1, 2, 3]], ["SP", 1, 0, 240, [5], 1], ["AN", 1, 0, 5], ["AN", 1, 1, 6]]]], "r": [[2.52693e-06, 2.51907e-06, 2.52332e-06], 0, 5.38749, 1667938334], "v": "v0.6"}
{"i": [["[\"sigmoid\", 1, 1, 1, 240]", "cuda -keys=cuda,gpu -max_num_threads=1024 -model=unknown -thread_warp_size=32", [-1, 16, 64, 49152, 2147483647, 1024, 8, 32], "", 0, []], [[], [["FU", 1, [0, 1, 2, 3]], ["SP", 1, 0, 240, [1], 1], ["AN", 1, 0, 5], ["AN", 1, 1, 6]]]], "r": [[2.7833e-06, 2.78523e-06, 2.78574e-06], 0, 1.63072, 1667939205], "v": "v0.6"}
{"i": [["[\"sigmoid\", 1, 1, 1, 240]", "cuda -keys=cuda,gpu -max_num_threads=1024 -model=unknown -thread_warp_size=32", [-1, 16, 64, 49152, 2147483647, 1024, 8, 32], "", 0, []], [[], [["FU", 1, [0, 1, 2, 3]], ["SP", 1, 0, 240, [40], 1], ["AN", 1, 0, 5], ["AN", 1, 1, 6]]]], "r": [[2.64762e-06, 2.65768e-06, 2.66089e-06], 0, 1.03694, 1667939205], "v": "v0.6"}
{"i": [["[\"sigmoid\", 1, 1, 1, 240]", "cuda -keys=cuda,gpu -max_num_threads=1024 -model=unknown -thread_warp_size=32", [-1, 16, 64, 49152, 2147483647, 1024, 8, 32], "", 0, []], [[], [["FU", 1, [0, 1, 2, 3]], ["SP", 1, 0, 240, [32], 1], ["AN", 1, 0, 5], ["AN", 1, 1, 6]]]], "r": [[2.49938e-06, 2.4913e-06, 2.49218e-06], 0, 1.94622, 1667939206], "v": "v0.6"}
{"i": [["[\"sigmoid\", 1, 1, 1, 240]", "cuda -keys=cuda,gpu -max_num_threads=1024 -model=unknown -thread_warp_size=32", [-1, 16, 64, 49152, 2147483647, 1024, 8, 32], "", 0, []], [[], [["FU", 1, [0, 1, 2, 3]], ["SP", 1, 0, 240, [8], 1], ["AN", 1, 0, 5], ["AN", 1, 1, 6]]]], "r": [[2.71379e-06, 2.72804e-06, 2.7349e-06], 0, 1.29854, 1667939205], "v": "v0.6"}
{"i": [["[\"sigmoid\", 1, 1, 1, 240]", "cuda -keys=cuda,gpu -max_num_threads=1024 -model=unknown -thread_warp_size=32", [-1, 16, 64, 49152, 2147483647, 1024, 8, 32], "", 0, []], [[], [["FU", 1, [0, 1, 2, 3]], ["SP", 1, 0, 240, [15], 1], ["AN", 1, 0, 5], ["AN", 1, 1, 6]]]], "r": [[2.50375e-06, 2.48324e-06, 2.48658e-06], 0, 0.716357, 1667939204], "v": "v0.6"}
{"i": [["[\"sigmoid\", 1, 1, 1, 240]", "cuda -keys=cuda,gpu -max_num_threads=1024 -model=unknown -thread_warp_size=32", [-1, 16, 64, 49152, 2147483647, 1024, 8, 32], "", 0, []], [[], [["FU", 1, [0, 1, 2, 3]], ["SP", 1, 0, 240, [16], 1], ["AN", 1, 0, 5], ["AN", 1, 1, 6]]]], "r": [[2.65483e-06, 2.65311e-06, 2.6597e-06], 0, 0.569013, 1667939204], "v": "v0.6"}
{"i": [["[\"sigmoid\", 1, 1, 1, 240]", "cuda -keys=cuda,gpu -max_num_threads=1024 -model=unknown -thread_warp_size=32", [-1, 16, 64, 49152, 2147483647, 1024, 8, 32], "", 0, []], [[], [["FU", 1, [0, 1, 2, 3]], ["SP", 1, 0, 240, [6], 1], ["AN", 1, 0, 5], ["AN", 1, 1, 6]]]], "r": [[2.61092e-06, 2.6023e-06, 2.60377e-06], 0, 2.2528, 1667939206], "v": "v0.6"}
{"i": [["[\"sigmoid\", 1, 1, 1, 240]", "cuda -keys=cuda,gpu -max_num_threads=1024 -model=unknown -thread_warp_size=32", [-1, 16, 64, 49152, 2147483647, 1024, 8, 32], "", 0, []], [[], [["FU", 1, [0, 1, 2, 3]], ["SP", 1, 0, 240, [20], 1], ["AN", 1, 0, 5], ["AN", 1, 1, 6]]]], "r": [[2.56217e-06, 2.55504e-06, 2.55645e-06], 0, 2.80022, 1667939207], "v": "v0.6"}
{"i": [["[\"sigmoid\", 1, 1, 1, 240]", "cuda -keys=cuda,gpu -max_num_threads=1024 -model=unknown -thread_warp_size=32", [-1, 16, 64, 49152, 2147483647, 1024, 8, 32], "", 0, []], [[], [["FU", 1, [0, 1, 2, 3]], ["SP", 1, 0, 240, [12], 1], ["AN", 1, 0, 5], ["AN", 1, 1, 6]]]], "r": [[2.54059e-06, 2.53246e-06, 2.53631e-06], 0, 3.06413, 1667939207], "v": "v0.6"}
{"i": [["[\"sigmoid\", 1, 1, 1, 240]", "cuda -keys=cuda,gpu -max_num_threads=1024 -model=unknown -thread_warp_size=32", [-1, 16, 64, 49152, 2147483647, 1024, 8, 32], "", 0, []], [[], [["FU", 1, [0, 1, 2, 3]], ["SP", 1, 0, 240, [30], 1], ["AN", 1, 0, 5], ["AN", 1, 1, 6]]]], "r": [[2.68376e-06, 2.68497e-06, 2.70257e-06], 0, 3.34866, 1667939207], "v": "v0.6"}
{"i": [["[\"sigmoid\", 1, 1, 1, 240]", "cuda -keys=cuda,gpu -max_num_threads=1024 -model=unknown -thread_warp_size=32", [-1, 16, 64, 49152, 2147483647, 1024, 8, 32], "", 0, []], [[], [["FU", 1, [0, 1, 2, 3]], ["SP", 1, 0, 240, [60], 1], ["AN", 1, 0, 5], ["AN", 1, 1, 6]]]], "r": [[2.54493e-06, 2.54166e-06, 2.53908e-06], 0, 3.60685, 1667939208], "v": "v0.6"}
{"i": [["[\"sigmoid\", 1, 1, 1, 240]", "cuda -keys=cuda,gpu -max_num_threads=1024 -model=unknown -thread_warp_size=32", [-1, 16, 64, 49152, 2147483647, 1024, 8, 32], "", 0, []], [[], [["FU", 1, [0, 1, 2, 3]], ["SP", 1, 0, 240, [48], 1], ["AN", 1, 0, 5], ["AN", 1, 1, 6]]]], "r": [[2.6505e-06, 2.65369e-06, 2.65423e-06], 0, 3.82419, 1667939208], "v": "v0.6"}
{"i": [["[\"sigmoid\", 1, 1, 1, 240]", "cuda -keys=cuda,gpu -max_num_threads=1024 -model=unknown -thread_warp_size=32", [-1, 16, 64, 49152, 2147483647, 1024, 8, 32], "", 0, []], [[], [["FU", 1, [0, 1, 2, 3]], ["SP", 1, 0, 240, [2], 1], ["AN", 1, 0, 5], ["AN", 1, 1, 6]]]], "r": [[2.82784e-06, 2.84389e-06, 2.84732e-06], 0, 4.08304, 1667939208], "v": "v0.6"}
{"i": [["[\"sigmoid\", 1, 1, 1, 240]", "cuda -keys=cuda,gpu -max_num_threads=1024 -model=unknown -thread_warp_size=32", [-1, 16, 64, 49152, 2147483647, 1024, 8, 32], "", 0, []], [[], [["FU", 1, [0, 1, 2, 3]], ["SP", 1, 0, 240, [24], 1], ["AN", 1, 0, 5], ["AN", 1, 1, 6]]]], "r": [[2.51092e-06, 2.50411e-06, 2.5067e-06], 0, 4.34856, 1667939209], "v": "v0.6"}
{"i": [["[\"sigmoid\", 1, 1, 1, 240]", "cuda -keys=cuda,gpu -max_num_threads=1024 -model=unknown -thread_warp_size=32", [-1, 16, 64, 49152, 2147483647, 1024, 8, 32], "", 0, []], [[], [["FU", 1, [0, 1, 2, 3]], ["SP", 1, 0, 240, [4], 1], ["AN", 1, 0, 5], ["AN", 1, 1, 6]]]], "r": [[2.55864e-06, 2.54856e-06, 2.55318e-06], 0, 4.63797, 1667939209], "v": "v0.6"}
{"i": [["[\"sigmoid\", 1, 1, 1, 240]", "cuda -keys=cuda,gpu -max_num_threads=1024 -model=unknown -thread_warp_size=32", [-1, 16, 64, 49152, 2147483647, 1024, 8, 32], "", 0, []], [[], [["FU", 1, [0, 1, 2, 3]], ["SP", 1, 0, 240, [3], 1], ["AN", 1, 0, 5], ["AN", 1, 1, 6]]]], "r": [[2.61427e-06, 2.61407e-06, 2.61307e-06], 0, 4.9315, 1667939209], "v": "v0.6"}
{"i": [["[\"sigmoid\", 1, 1, 1, 240]", "cuda -keys=cuda,gpu -max_num_threads=1024 -model=unknown -thread_warp_size=32", [-1, 16, 64, 49152, 2147483647, 1024, 8, 32], "", 0, []], [[], [["FU", 1, [0, 1, 2, 3]], ["SP", 1, 0, 240, [5], 1], ["AN", 1, 0, 5], ["AN", 1, 1, 6]]]], "r": [[2.50324e-06, 2.49841e-06, 2.49794e-06], 0, 2.47341, 1667939206], "v": "v0.6"}
{"i": [["[\"sigmoid\", 1, 1, 1, 240]", "cuda -keys=cuda,gpu -max_num_threads=1024 -model=unknown -thread_warp_size=32", [-1, 16, 64, 49152, 2147483647, 1024, 8, 32], "", 0, []], [[], [["FU", 1, [0, 1, 2, 3]], ["SP", 1, 0, 240, [10], 1], ["AN", 1, 0, 5], ["AN", 1, 1, 6]]]], "r": [[2.61473e-06, 2.61023e-06, 2.61013e-06], 0, 5.23314, 1667939210], "v": "v0.6"}
