python/models/efficientnet/VertiFusionEfficientNet_kernel_configs/efficient_conv1x1_1_1_1_6_144.log
{"i": [["[\"conv1x1\", 1, 1, 1, 6, 144]", "cuda -keys=cuda,gpu -max_num_threads=1024 -model=unknown -thread_warp_size=32", [-1, 16, 64, 49152, 2147483647, 1024, 8, 32], "", 0, []], [[], [["CHW", 2, "local"], ["SP", 2, 0, 1, [1, 1, 1, 1], 1], ["SP", 2, 5, 1, [1, 1, 1, 1], 1], ["SP", 2, 10, 1, [1, 1, 1, 1], 1], ["SP", 2, 15, 144, [1, 48, 1, 3], 1], ["SP", 2, 20, 6, [2, 3], 1], ["RE", 2, [0, 5, 10, 15, 1, 6, 11, 16, 2, 7, 12, 17, 20, 21, 3, 8, 13, 18, 22, 4, 9, 14, 19]], ["FSP", 3, 0, 1, 3], ["FSP", 3, 4, 2, 3], ["FSP", 3, 8, 3, 3], ["FSP", 3, 12, 4, 3], ["RE", 3, [0, 4, 8, 12, 1, 5, 9, 13, 2, 6, 10, 14, 3, 7, 11, 15]], ["CA", 2, 3, 11], ["CHR", 1, "shared", [2]], ["CA", 2, 3, 12], ["CHR", 0, "shared", [3]], ["CA", 1, 4, 12], ["FU", 5, [0, 1, 2, 3]], ["AN", 5, 0, 5], ["FU", 5, [1, 2, 3, 4]], ["AN", 5, 1, 4], ["FU", 5, [2, 3, 4, 5]], ["AN", 5, 2, 6], ["FU", 3, [0, 1]], ["SP", 3, 0, 18, [1], 1], ["AN", 3, 1, 2], ["FFSP", 3, 0, [4, 3, 2, 1], 1, 1], ["AN", 3, 1, 6], ["FU", 1, [0, 1, 2, 3]], ["SP", 1, 0, 6, [3], 1], ["AN", 1, 1, 2], ["FFSP", 1, 0, [4, 3, 2, 1], 1, 1], ["AN", 1, 1, 6], ["PR", 4, 0, "auto_unroll_max_step$512"]]]], "r": [[2.67537e-06, 2.6738e-06, 2.67408e-06], 0, 1.0444, 1667925698], "v": "v0.6"}
{"i": [["[\"conv1x1\", 1, 1, 1, 6, 144]", "cuda -keys=cuda,gpu -max_num_threads=1024 -model=unknown -thread_warp_size=32", [-1, 16, 64, 49152, 2147483647, 1024, 8, 32], "", 0, []], [[], [["CHW", 2, "local"], ["SP", 2, 0, 1, [1, 1, 1, 1], 1], ["SP", 2, 5, 1, [1, 1, 1, 1], 1], ["SP", 2, 10, 1, [1, 1, 1, 1], 1], ["SP", 2, 15, 144, [1, 48, 1, 3], 1], ["SP", 2, 20, 6, [1, 1], 1], ["RE", 2, [0, 5, 10, 15, 1, 6, 11, 16, 2, 7, 12, 17, 20, 21, 3, 8, 13, 18, 22, 4, 9, 14, 19]], ["FSP", 3, 0, 1, 3], ["FSP", 3, 4, 2, 3], ["FSP", 3, 8, 3, 3], ["FSP", 3, 12, 4, 3], ["RE", 3, [0, 4, 8, 12, 1, 5, 9, 13, 2, 6, 10, 14, 3, 7, 11, 15]], ["CA", 2, 3, 11], ["CHR", 1, "shared", [2]], ["CA", 2, 3, 12], ["CHR", 0, "shared", [3]], ["CA", 1, 4, 12], ["FU", 5, [0, 1, 2, 3]], ["AN", 5, 0, 5], ["FU", 5, [1, 2, 3, 4]], ["AN", 5, 1, 4], ["FU", 5, [2, 3, 4, 5]], ["AN", 5, 2, 6], ["FU", 3, [0, 1]], ["SP", 3, 0, 3, [1], 1], ["AN", 3, 1, 2], ["FFSP", 3, 0, [4, 3, 2, 1], 1, 1], ["AN", 3, 1, 6], ["FU", 1, [0, 1, 2, 3]], ["SP", 1, 0, 1, [1], 1], ["AN", 1, 1, 2], ["FFSP", 1, 0, [4, 3, 2, 1], 1, 1], ["AN", 1, 1, 6], ["PR", 4, 0, "auto_unroll_max_step$16"]]]], "r": [[2.91721e-06, 2.92087e-06, 2.92035e-06], 0, 1.40155, 1667925698], "v": "v0.6"}
{"i": [["[\"conv1x1\", 1, 1, 1, 6, 144]", "cuda -keys=cuda,gpu -max_num_threads=1024 -model=unknown -thread_warp_size=32", [-1, 16, 64, 49152, 2147483647, 1024, 8, 32], "", 0, []], [[], [["CHW", 2, "local"], ["SP", 2, 0, 1, [1, 1, 1, 1], 1], ["SP", 2, 5, 1, [1, 1, 1, 1], 1], ["SP", 2, 10, 1, [1, 1, 1, 1], 1], ["SP", 2, 15, 144, [1, 48, 3, 1], 1], ["SP", 2, 20, 6, [1, 2], 1], ["RE", 2, [0, 5, 10, 15, 1, 6, 11, 16, 2, 7, 12, 17, 20, 21, 3, 8, 13, 18, 22, 4, 9, 14, 19]], ["FSP", 3, 0, 1, 3], ["FSP", 3, 4, 2, 3], ["FSP", 3, 8, 3, 3], ["FSP", 3, 12, 4, 3], ["RE", 3, [0, 4, 8, 12, 1, 5, 9, 13, 2, 6, 10, 14, 3, 7, 11, 15]], ["CA", 2, 3, 11], ["CHR", 1, "shared", [2]], ["CA", 2, 3, 12], ["CHR", 0, "shared", [3]], ["CA", 1, 4, 12], ["FU", 5, [0, 1, 2, 3]], ["AN", 5, 0, 5], ["FU", 5, [1, 2, 3, 4]], ["AN", 5, 1, 4], ["FU", 5, [2, 3, 4, 5]], ["AN", 5, 2, 6], ["FU", 3, [0, 1]], ["SP", 3, 0, 18, [1], 1], ["AN", 3, 1, 2], ["FFSP", 3, 0, [4, 3, 2, 1], 1, 1], ["AN", 3, 1, 6], ["FU", 1, [0, 1, 2, 3]], ["SP", 1, 0, 6, [1], 1], ["AN", 1, 1, 2], ["FFSP", 1, 0, [4, 3, 2, 1], 1, 1], ["AN", 1, 1, 6], ["PR", 4, 0, "auto_unroll_max_step$64"]]]], "r": [[2.96725e-06, 2.97244e-06, 2.98082e-06], 0, 1.73558, 1667925699], "v": "v0.6"}
{"i": [["[\"conv1x1\", 1, 1, 1, 6, 144]", "cuda -keys=cuda,gpu -max_num_threads=1024 -model=unknown -thread_warp_size=32", [-1, 16, 64, 49152, 2147483647, 1024, 8, 32], "", 0, []], [[], [["CHW", 2, "local"], ["SP", 2, 0, 1, [1, 1, 1, 1], 1], ["SP", 2, 5, 1, [1, 1, 1, 1], 1], ["SP", 2, 10, 1, [1, 1, 1, 1], 1], ["SP", 2, 15, 144, [1, 36, 2, 1], 1], ["SP", 2, 20, 6, [2, 1], 1], ["RE", 2, [0, 5, 10, 15, 1, 6, 11, 16, 2, 7, 12, 17, 20, 21, 3, 8, 13, 18, 22, 4, 9, 14, 19]], ["FSP", 3, 0, 1, 3], ["FSP", 3, 4, 2, 3], ["FSP", 3, 8, 3, 3], ["FSP", 3, 12, 4, 3], ["RE", 3, [0, 4, 8, 12, 1, 5, 9, 13, 2, 6, 10, 14, 3, 7, 11, 15]], ["CA", 2, 3, 11], ["CHR", 1, "shared", [2]], ["CA", 2, 3, 12], ["CHR", 0, "shared", [3]], ["CA", 1, 4, 12], ["FU", 5, [0, 1, 2, 3]], ["AN", 5, 0, 5], ["FU", 5, [1, 2, 3, 4]], ["AN", 5, 1, 4], ["FU", 5, [2, 3, 4, 5]], ["AN", 5, 2, 6], ["FU", 3, [0, 1]], ["SP", 3, 0, 4, [2], 1], ["AN", 3, 1, 2], ["FFSP", 3, 0, [4, 3, 2, 1], 1, 1], ["AN", 3, 1, 6], ["FU", 1, [0, 1, 2, 3]], ["SP", 1, 0, 2, [1], 1], ["AN", 1, 1, 2], ["FFSP", 1, 0, [4, 3, 2, 1], 1, 1], ["AN", 1, 1, 6], ["PR", 4, 0, "auto_unroll_max_step$0"]]]], "r": [[2.68982e-06, 2.68544e-06, 2.70085e-06], 0, 0.672094, 1667925698], "v": "v0.6"}
{"i": [["[\"conv1x1\", 1, 1, 1, 6, 144]", "cuda -keys=cuda,gpu -max_num_threads=1024 -model=unknown -thread_warp_size=32", [-1, 16, 64, 49152, 2147483647, 1024, 8, 32], "", 0, []], [[], [["CHW", 2, "local"], ["SP", 2, 0, 1, [1, 1, 1, 1], 1], ["SP", 2, 5, 1, [1, 1, 1, 1], 1], ["SP", 2, 10, 1, [1, 1, 1, 1], 1], ["SP", 2, 15, 144, [1, 36, 1, 4], 1], ["SP", 2, 20, 6, [1, 3], 1], ["RE", 2, [0, 5, 10, 15, 1, 6, 11, 16, 2, 7, 12, 17, 20, 21, 3, 8, 13, 18, 22, 4, 9, 14, 19]], ["FSP", 3, 0, 1, 3], ["FSP", 3, 4, 2, 3], ["FSP", 3, 8, 3, 3], ["FSP", 3, 12, 4, 3], ["RE", 3, [0, 4, 8, 12, 1, 5, 9, 13, 2, 6, 10, 14, 3, 7, 11, 15]], ["CA", 2, 3, 11], ["CHR", 1, "shared", [2]], ["CA", 2, 3, 12], ["CHR", 0, "shared", [3]], ["CA", 1, 4, 12], ["FU", 5, [0, 1, 2, 3]], ["AN", 5, 0, 5], ["FU", 5, [1, 2, 3, 4]], ["AN", 5, 1, 4], ["FU", 5, [2, 3, 4, 5]], ["AN", 5, 2, 6], ["FU", 3, [0, 1]], ["SP", 3, 0, 6, [3], 1], ["AN", 3, 1, 2], ["FFSP", 3, 0, [4, 3, 2, 1], 1, 1], ["AN", 3, 1, 6], ["FU", 1, [0, 1, 2, 3]], ["SP", 1, 0, 3, [1], 1], ["AN", 1, 1, 2], ["FFSP", 1, 0, [4, 3, 2, 1], 1, 1], ["AN", 1, 1, 6], ["PR", 4, 0, "auto_unroll_max_step$512"]]]], "r": [[3.02978e-06, 3.03459e-06, 3.03089e-06], 0, 2.68158, 1667925700], "v": "v0.6"}
{"i": [["[\"conv1x1\", 1, 1, 1, 6, 144]", "cuda -keys=cuda,gpu -max_num_threads=1024 -model=unknown -thread_warp_size=32", [-1, 16, 64, 49152, 2147483647, 1024, 8, 32], "", 0, []], [[], [["CHW", 2, "local"], ["SP", 2, 0, 1, [1, 1, 1, 1], 1], ["SP", 2, 5, 1, [1, 1, 1, 1], 1], ["SP", 2, 10, 1, [1, 1, 1, 1], 1], ["SP", 2, 15, 144, [1, 36, 4, 1], 1], ["SP", 2, 20, 6, [1, 2], 1], ["RE", 2, [0, 5, 10, 15, 1, 6, 11, 16, 2, 7, 12, 17, 20, 21, 3, 8, 13, 18, 22, 4, 9, 14, 19]], ["FSP", 3, 0, 1, 3], ["FSP", 3, 4, 2, 3], ["FSP", 3, 8, 3, 3], ["FSP", 3, 12, 4, 3], ["RE", 3, [0, 4, 8, 12, 1, 5, 9, 13, 2, 6, 10, 14, 3, 7, 11, 15]], ["CA", 2, 3, 11], ["CHR", 1, "shared", [2]], ["CA", 2, 3, 12], ["CHR", 0, "shared", [3]], ["CA", 1, 4, 12], ["FU", 5, [0, 1, 2, 3]], ["AN", 5, 0, 5], ["FU", 5, [1, 2, 3, 4]], ["AN", 5, 1, 4], ["FU", 5, [2, 3, 4, 5]], ["AN", 5, 2, 6], ["FU", 3, [0, 1]], ["SP", 3, 0, 8, [1], 1], ["AN", 3, 1, 2], ["FFSP", 3, 0, [4, 3, 2, 1], 1, 1], ["AN", 3, 1, 6], ["FU", 1, [0, 1, 2, 3]], ["SP", 1, 0, 2, [2], 1], ["AN", 1, 1, 2], ["FFSP", 1, 0, [4, 3, 2, 1], 1, 1], ["AN", 1, 1, 6], ["PR", 4, 0, "auto_unroll_max_step$16"]]]], "r": [[2.9867e-06, 2.99289e-06, 2.99068e-06], 0, 2.34564, 1667925699], "v": "v0.6"}
{"i": [["[\"conv1x1\", 1, 1, 1, 6, 144]", "cuda -keys=cuda,gpu -max_num_threads=1024 -model=unknown -thread_warp_size=32", [-1, 16, 64, 49152, 2147483647, 1024, 8, 32], "", 0, []], [[], [["CHW", 2, "local"], ["SP", 2, 0, 1, [1, 1, 1, 1], 1], ["SP", 2, 5, 1, [1, 1, 1, 1], 1], ["SP", 2, 10, 1, [1, 1, 1, 1], 1], ["SP", 2, 15, 144, [2, 24, 3, 1], 1], ["SP", 2, 20, 6, [6, 1], 1], ["RE", 2, [0, 5, 10, 15, 1, 6, 11, 16, 2, 7, 12, 17, 20, 21, 3, 8, 13, 18, 22, 4, 9, 14, 19]], ["FSP", 3, 0, 1, 3], ["FSP", 3, 4, 2, 3], ["FSP", 3, 8, 3, 3], ["FSP", 3, 12, 4, 3], ["RE", 3, [0, 4, 8, 12, 1, 5, 9, 13, 2, 6, 10, 14, 3, 7, 11, 15]], ["CA", 2, 3, 11], ["CHR", 1, "shared", [2]], ["CA", 2, 3, 12], ["CHR", 0, "shared", [3]], ["CA", 1, 4, 12], ["FU", 5, [0, 1, 2, 3]], ["AN", 5, 0, 5], ["FU", 5, [1, 2, 3, 4]], ["AN", 5, 1, 4], ["FU", 5, [2, 3, 4, 5]], ["AN", 5, 2, 6], ["FU", 3, [0, 1]], ["SP", 3, 0, 2, [1], 1], ["AN", 3, 1, 2], ["FFSP", 3, 0, [4, 3, 2, 1], 1, 1], ["AN", 3, 1, 6], ["FU", 1, [0, 1, 2, 3]], ["SP", 1, 0, 2, [1], 1], ["AN", 1, 1, 2], ["FFSP", 1, 0, [4, 3, 2, 1], 1, 1], ["AN", 1, 1, 6], ["PR", 4, 0, "auto_unroll_max_step$1024"]]]], "r": [[2.83913e-06, 2.84293e-06, 2.8428e-06], 0, 2.09553, 1667925699], "v": "v0.6"}
{"i": [["[\"conv1x1\", 1, 1, 1, 6, 144]", "cuda -keys=cuda,gpu -max_num_threads=1024 -model=unknown -thread_warp_size=32", [-1, 16, 64, 49152, 2147483647, 1024, 8, 32], "", 0, []], [[], [["CHW", 2, "local"], ["SP", 2, 0, 1, [1, 1, 1, 1], 1], ["SP", 2, 5, 1, [1, 1, 1, 1], 1], ["SP", 2, 10, 1, [1, 1, 1, 1], 1], ["SP", 2, 15, 144, [1, 72, 1, 2], 1], ["SP", 2, 20, 6, [1, 6], 1], ["RE", 2, [0, 5, 10, 15, 1, 6, 11, 16, 2, 7, 12, 17, 20, 21, 3, 8, 13, 18, 22, 4, 9, 14, 19]], ["FSP", 3, 0, 1, 3], ["FSP", 3, 4, 2, 3], ["FSP", 3, 8, 3, 3], ["FSP", 3, 12, 4, 3], ["RE", 3, [0, 4, 8, 12, 1, 5, 9, 13, 2, 6, 10, 14, 3, 7, 11, 15]], ["CA", 2, 3, 11], ["CHR", 1, "shared", [2]], ["CA", 2, 3, 12], ["CHR", 0, "shared", [3]], ["CA", 1, 4, 12], ["FU", 5, [0, 1, 2, 3]], ["AN", 5, 0, 5], ["FU", 5, [1, 2, 3, 4]], ["AN", 5, 1, 4], ["FU", 5, [2, 3, 4, 5]], ["AN", 5, 2, 6], ["FU", 3, [0, 1]], ["SP", 3, 0, 6, [2], 1], ["AN", 3, 1, 2], ["FFSP", 3, 0, [4, 3, 2, 1], 1, 1], ["AN", 3, 1, 6], ["FU", 1, [0, 1, 2, 3]], ["SP", 1, 0, 3, [1], 1], ["AN", 1, 1, 2], ["FFSP", 1, 0, [4, 3, 2, 1], 1, 1], ["AN", 1, 1, 6], ["PR", 4, 0, "auto_unroll_max_step$0"]]]], "r": [[2.48014e-06, 2.46805e-06, 2.4683e-06], 0, 2.97513, 1667925700], "v": "v0.6"}
{"i": [["[\"conv1x1\", 1, 1, 1, 6, 144]", "cuda -keys=cuda,gpu -max_num_threads=1024 -model=unknown -thread_warp_size=32", [-1, 16, 64, 49152, 2147483647, 1024, 8, 32], "", 0, []], [[], [["CHW", 2, "local"], ["SP", 2, 0, 1, [1, 1, 1, 1], 1], ["SP", 2, 5, 1, [1, 1, 1, 1], 1], ["SP", 2, 10, 1, [1, 1, 1, 1], 1], ["SP", 2, 15, 144, [1, 48, 1, 1], 1], ["SP", 2, 20, 6, [1, 3], 1], ["RE", 2, [0, 5, 10, 15, 1, 6, 11, 16, 2, 7, 12, 17, 20, 21, 3, 8, 13, 18, 22, 4, 9, 14, 19]], ["FSP", 3, 0, 1, 3], ["FSP", 3, 4, 2, 3], ["FSP", 3, 8, 3, 3], ["FSP", 3, 12, 4, 3], ["RE", 3, [0, 4, 8, 12, 1, 5, 9, 13, 2, 6, 10, 14, 3, 7, 11, 15]], ["CA", 2, 3, 11], ["CHR", 1, "shared", [2]], ["CA", 2, 3, 12], ["CHR", 0, "shared", [3]], ["CA", 1, 4, 12], ["FU", 5, [0, 1, 2, 3]], ["AN", 5, 0, 5], ["FU", 5, [1, 2, 3, 4]], ["AN", 5, 1, 4], ["FU", 5, [2, 3, 4, 5]], ["AN", 5, 2, 6], ["FU", 3, [0, 1]], ["SP", 3, 0, 3, [1], 1], ["AN", 3, 1, 2], ["FFSP", 3, 0, [4, 3, 2, 1], 1, 1], ["AN", 3, 1, 6], ["FU", 1, [0, 1, 2, 3]], ["SP", 1, 0, 3, [1], 1], ["AN", 1, 1, 2], ["FFSP", 1, 0, [4, 3, 2, 1], 1, 1], ["AN", 1, 1, 6], ["PR", 4, 0, "auto_unroll_max_step$16"]]]], "r": [[2.53428e-06, 2.53322e-06, 2.53183e-06], 0, 3.2875, 1667925700], "v": "v0.6"}
{"i": [["[\"conv1x1\", 1, 1, 1, 6, 144]", "cuda -keys=cuda,gpu -max_num_threads=1024 -model=unknown -thread_warp_size=32", [-1, 16, 64, 49152, 2147483647, 1024, 8, 32], "", 0, []], [[], [["CHW", 2, "local"], ["SP", 2, 0, 1, [1, 1, 1, 1], 1], ["SP", 2, 5, 1, [1, 1, 1, 1], 1], ["SP", 2, 10, 1, [1, 1, 1, 1], 1], ["SP", 2, 15, 144, [2, 36, 2, 1], 1], ["SP", 2, 20, 6, [1, 2], 1], ["RE", 2, [0, 5, 10, 15, 1, 6, 11, 16, 2, 7, 12, 17, 20, 21, 3, 8, 13, 18, 22, 4, 9, 14, 19]], ["FSP", 3, 0, 1, 3], ["FSP", 3, 4, 2, 3], ["FSP", 3, 8, 3, 3], ["FSP", 3, 12, 4, 3], ["RE", 3, [0, 4, 8, 12, 1, 5, 9, 13, 2, 6, 10, 14, 3, 7, 11, 15]], ["CA", 2, 3, 11], ["CHR", 1, "shared", [2]], ["CA", 2, 3, 12], ["CHR", 0, "shared", [3]], ["CA", 1, 4, 12], ["FU", 5, [0, 1, 2, 3]], ["AN", 5, 0, 5], ["FU", 5, [1, 2, 3, 4]], ["AN", 5, 1, 4], ["FU", 5, [2, 3, 4, 5]], ["AN", 5, 2, 6], ["FU", 3, [0, 1]], ["SP", 3, 0, 4, [1], 1], ["AN", 3, 1, 2], ["FFSP", 3, 0, [4, 3, 2, 1], 1, 1], ["AN", 3, 1, 6], ["FU", 1, [0, 1, 2, 3]], ["SP", 1, 0, 2, [2], 1], ["AN", 1, 1, 2], ["FFSP", 1, 0, [4, 3, 2, 1], 1, 1], ["AN", 1, 1, 6], ["PR", 4, 0, "auto_unroll_max_step$16"]]]], "r": [[2.93482e-06, 2.93551e-06, 2.93553e-06], 0, 3.53043, 1667925701], "v": "v0.6"}
{"i": [["[\"conv1x1\", 1, 1, 1, 6, 144]", "cuda -keys=cuda,gpu -max_num_threads=1024 -model=unknown -thread_warp_size=32", [-1, 16, 64, 49152, 2147483647, 1024, 8, 32], "", 0, []], [[], [["CHW", 2, "local"], ["SP", 2, 0, 1, [1, 1, 1, 1], 1], ["SP", 2, 5, 1, [1, 1, 1, 1], 1], ["SP", 2, 10, 1, [1, 1, 1, 1], 1], ["SP", 2, 15, 144, [1, 72, 1, 2], 1], ["SP", 2, 20, 6, [2, 3], 1], ["RE", 2, [0, 5, 10, 15, 1, 6, 11, 16, 2, 7, 12, 17, 20, 21, 3, 8, 13, 18, 22, 4, 9, 14, 19]], ["FSP", 3, 0, 1, 3], ["FSP", 3, 4, 2, 3], ["FSP", 3, 8, 3, 3], ["FSP", 3, 12, 4, 3], ["RE", 3, [0, 4, 8, 12, 1, 5, 9, 13, 2, 6, 10, 14, 3, 7, 11, 15]], ["CA", 2, 3, 11], ["CHR", 1, "shared", [2]], ["CA", 2, 3, 12], ["CHR", 0, "shared", [3]], ["CA", 1, 4, 12], ["FU", 5, [0, 1, 2, 3]], ["AN", 5, 0, 5], ["FU", 5, [1, 2, 3, 4]], ["AN", 5, 1, 4], ["FU", 5, [2, 3, 4, 5]], ["AN", 5, 2, 6], ["FU", 3, [0, 1]], ["SP", 3, 0, 12, [1], 1], ["AN", 3, 1, 2], ["FFSP", 3, 0, [4, 3, 2, 1], 1, 1], ["AN", 3, 1, 6], ["FU", 1, [0, 1, 2, 3]], ["SP", 1, 0, 6, [2], 1], ["AN", 1, 1, 2], ["FFSP", 1, 0, [4, 3, 2, 1], 1, 1], ["AN", 1, 1, 6], ["PR", 4, 0, "auto_unroll_max_step$16"]]]], "r": [[2.47822e-06, 2.46848e-06, 2.46944e-06], 0, 3.83329, 1667925701], "v": "v0.6"}
{"i": [["[\"conv1x1\", 1, 1, 1, 6, 144]", "cuda -keys=cuda,gpu -max_num_threads=1024 -model=unknown -thread_warp_size=32", [-1, 16, 64, 49152, 2147483647, 1024, 8, 32], "", 0, []], [[], [["CHW", 2, "local"], ["SP", 2, 0, 1, [1, 1, 1, 1], 1], ["SP", 2, 5, 1, [1, 1, 1, 1], 1], ["SP", 2, 10, 1, [1, 1, 1, 1], 1], ["SP", 2, 15, 144, [1, 72, 1, 1], 1], ["SP", 2, 20, 6, [1, 3], 1], ["RE", 2, [0, 5, 10, 15, 1, 6, 11, 16, 2, 7, 12, 17, 20, 21, 3, 8, 13, 18, 22, 4, 9, 14, 19]], ["FSP", 3, 0, 1, 3], ["FSP", 3, 4, 2, 3], ["FSP", 3, 8, 3, 3], ["FSP", 3, 12, 4, 3], ["RE", 3, [0, 4, 8, 12, 1, 5, 9, 13, 2, 6, 10, 14, 3, 7, 11, 15]], ["CA", 2, 3, 11], ["CHR", 1, "shared", [2]], ["CA", 2, 3, 12], ["CHR", 0, "shared", [3]], ["CA", 1, 4, 12], ["FU", 5, [0, 1, 2, 3]], ["AN", 5, 0, 5], ["FU", 5, [1, 2, 3, 4]], ["AN", 5, 1, 4], ["FU", 5, [2, 3, 4, 5]], ["AN", 5, 2, 6], ["FU", 3, [0, 1]], ["SP", 3, 0, 3, [3], 1], ["AN", 3, 1, 2], ["FFSP", 3, 0, [4, 3, 2, 1], 1, 1], ["AN", 3, 1, 6], ["FU", 1, [0, 1, 2, 3]], ["SP", 1, 0, 3, [3], 1], ["AN", 1, 1, 2], ["FFSP", 1, 0, [4, 3, 2, 1], 1, 1], ["AN", 1, 1, 6], ["PR", 4, 0, "auto_unroll_max_step$512"]]]], "r": [[2.56757e-06, 2.56458e-06, 2.56684e-06], 0, 4.14829, 1667925702], "v": "v0.6"}
{"i": [["[\"conv1x1\", 1, 1, 1, 6, 144]", "cuda -keys=cuda,gpu -max_num_threads=1024 -model=unknown -thread_warp_size=32", [-1, 16, 64, 49152, 2147483647, 1024, 8, 32], "", 0, []], [[], [["CHW", 2, "local"], ["SP", 2, 0, 1, [1, 1, 1, 1], 1], ["SP", 2, 5, 1, [1, 1, 1, 1], 1], ["SP", 2, 10, 1, [1, 1, 1, 1], 1], ["SP", 2, 15, 144, [1, 72, 1, 1], 1], ["SP", 2, 20, 6, [1, 2], 1], ["RE", 2, [0, 5, 10, 15, 1, 6, 11, 16, 2, 7, 12, 17, 20, 21, 3, 8, 13, 18, 22, 4, 9, 14, 19]], ["FSP", 3, 0, 1, 3], ["FSP", 3, 4, 2, 3], ["FSP", 3, 8, 3, 3], ["FSP", 3, 12, 4, 3], ["RE", 3, [0, 4, 8, 12, 1, 5, 9, 13, 2, 6, 10, 14, 3, 7, 11, 15]], ["CA", 2, 3, 11], ["CHR", 1, "shared", [2]], ["CA", 2, 3, 12], ["CHR", 0, "shared", [3]], ["CA", 1, 4, 12], ["FU", 5, [0, 1, 2, 3]], ["AN", 5, 0, 5], ["FU", 5, [1, 2, 3, 4]], ["AN", 5, 1, 4], ["FU", 5, [2, 3, 4, 5]], ["AN", 5, 2, 6], ["FU", 3, [0, 1]], ["SP", 3, 0, 2, [2], 1], ["AN", 3, 1, 2], ["FFSP", 3, 0, [4, 3, 2, 1], 1, 1], ["AN", 3, 1, 6], ["FU", 1, [0, 1, 2, 3]], ["SP", 1, 0, 2, [1], 1], ["AN", 1, 1, 2], ["FFSP", 1, 0, [4, 3, 2, 1], 1, 1], ["AN", 1, 1, 6], ["PR", 4, 0, "auto_unroll_max_step$16"]]]], "r": [[2.56055e-06, 2.55476e-06, 2.55828e-06], 0, 4.93382, 1667925703], "v": "v0.6"}
{"i": [["[\"conv1x1\", 1, 1, 1, 6, 144]", "cuda -keys=cuda,gpu -max_num_threads=1024 -model=unknown -thread_warp_size=32", [-1, 16, 64, 49152, 2147483647, 1024, 8, 32], "", 0, []], [[], [["CHW", 2, "local"], ["SP", 2, 0, 1, [1, 1, 1, 1], 1], ["SP", 2, 5, 1, [1, 1, 1, 1], 1], ["SP", 2, 10, 1, [1, 1, 1, 1], 1], ["SP", 2, 15, 144, [1, 48, 1, 1], 1], ["SP", 2, 20, 6, [6, 1], 1], ["RE", 2, [0, 5, 10, 15, 1, 6, 11, 16, 2, 7, 12, 17, 20, 21, 3, 8, 13, 18, 22, 4, 9, 14, 19]], ["FSP", 3, 0, 1, 3], ["FSP", 3, 4, 2, 3], ["FSP", 3, 8, 3, 3], ["FSP", 3, 12, 4, 3], ["RE", 3, [0, 4, 8, 12, 1, 5, 9, 13, 2, 6, 10, 14, 3, 7, 11, 15]], ["CA", 2, 3, 11], ["CHR", 1, "shared", [2]], ["CA", 2, 3, 12], ["CHR", 0, "shared", [3]], ["CA", 1, 4, 12], ["FU", 5, [0, 1, 2, 3]], ["AN", 5, 0, 5], ["FU", 5, [1, 2, 3, 4]], ["AN", 5, 1, 4], ["FU", 5, [2, 3, 4, 5]], ["AN", 5, 2, 6], ["FU", 3, [0, 1]], ["SP", 3, 0, 6, [1], 1], ["AN", 3, 1, 2], ["FFSP", 3, 0, [4, 3, 2, 1], 1, 1], ["AN", 3, 1, 6], ["FU", 1, [0, 1, 2, 3]], ["SP", 1, 0, 6, [2], 1], ["AN", 1, 1, 2], ["FFSP", 1, 0, [4, 3, 2, 1], 1, 1], ["AN", 1, 1, 6], ["PR", 4, 0, "auto_unroll_max_step$16"]]]], "r": [[2.47734e-06, 2.46619e-06, 2.466e-06], 0, 5.30924, 1667925703], "v": "v0.6"}
{"i": [["[\"conv1x1\", 1, 1, 1, 6, 144]", "cuda -keys=cuda,gpu -max_num_threads=1024 -model=unknown -thread_warp_size=32", [-1, 16, 64, 49152, 2147483647, 1024, 8, 32], "", 0, []], [[], [["CHW", 2, "local"], ["SP", 2, 0, 1, [1, 1, 1, 1], 1], ["SP", 2, 5, 1, [1, 1, 1, 1], 1], ["SP", 2, 10, 1, [1, 1, 1, 1], 1], ["SP", 2, 15, 144, [1, 12, 3, 1], 1], ["SP", 2, 20, 6, [1, 1], 1], ["RE", 2, [0, 5, 10, 15, 1, 6, 11, 16, 2, 7, 12, 17, 20, 21, 3, 8, 13, 18, 22, 4, 9, 14, 19]], ["FSP", 3, 0, 1, 3], ["FSP", 3, 4, 2, 3], ["FSP", 3, 8, 3, 3], ["FSP", 3, 12, 4, 3], ["RE", 3, [0, 4, 8, 12, 1, 5, 9, 13, 2, 6, 10, 14, 3, 7, 11, 15]], ["CA", 2, 3, 11], ["CHR", 1, "shared", [2]], ["CA", 2, 3, 12], ["CHR", 0, "shared", [3]], ["CA", 1, 4, 12], ["FU", 5, [0, 1, 2, 3]], ["AN", 5, 0, 5], ["FU", 5, [1, 2, 3, 4]], ["AN", 5, 1, 4], ["FU", 5, [2, 3, 4, 5]], ["AN", 5, 2, 6], ["FU", 3, [0, 1]], ["SP", 3, 0, 3, [1], 1], ["AN", 3, 1, 2], ["FFSP", 3, 0, [4, 3, 2, 1], 1, 1], ["AN", 3, 1, 6], ["FU", 1, [0, 1, 2, 3]], ["SP", 1, 0, 1, [1], 1], ["AN", 1, 1, 2], ["FFSP", 1, 0, [4, 3, 2, 1], 1, 1], ["AN", 1, 1, 6], ["PR", 4, 0, "auto_unroll_max_step$16"]]]], "r": [[2.80507e-06, 2.8075e-06, 2.80679e-06], 0, 6.79638, 1667925705], "v": "v0.6"}
{"i": [["[\"conv1x1\", 1, 1, 1, 6, 144]", "cuda -keys=cuda,gpu -max_num_threads=1024 -model=unknown -thread_warp_size=32", [-1, 16, 64, 49152, 2147483647, 1024, 8, 32], "", 0, []], [[], [["CHW", 2, "local"], ["SP", 2, 0, 1, [1, 1, 1, 1], 1], ["SP", 2, 5, 1, [1, 1, 1, 1], 1], ["SP", 2, 10, 1, [1, 1, 1, 1], 1], ["SP", 2, 15, 144, [1, 12, 12, 1], 1], ["SP", 2, 20, 6, [3, 1], 1], ["RE", 2, [0, 5, 10, 15, 1, 6, 11, 16, 2, 7, 12, 17, 20, 21, 3, 8, 13, 18, 22, 4, 9, 14, 19]], ["FSP", 3, 0, 1, 3], ["FSP", 3, 4, 2, 3], ["FSP", 3, 8, 3, 3], ["FSP", 3, 12, 4, 3], ["RE", 3, [0, 4, 8, 12, 1, 5, 9, 13, 2, 6, 10, 14, 3, 7, 11, 15]], ["CA", 2, 3, 11], ["CHR", 1, "shared", [2]], ["CA", 2, 3, 12], ["CHR", 0, "shared", [3]], ["CA", 1, 4, 12], ["FU", 5, [0, 1, 2, 3]], ["AN", 5, 0, 5], ["FU", 5, [1, 2, 3, 4]], ["AN", 5, 1, 4], ["FU", 5, [2, 3, 4, 5]], ["AN", 5, 2, 6], ["FU", 3, [0, 1]], ["SP", 3, 0, 3, [1], 1], ["AN", 3, 1, 2], ["FFSP", 3, 0, [4, 3, 2, 1], 1, 1], ["AN", 3, 1, 6], ["FU", 1, [0, 1, 2, 3]], ["SP", 1, 0, 3, [1], 1], ["AN", 1, 1, 2], ["FFSP", 1, 0, [4, 3, 2, 1], 1, 1], ["AN", 1, 1, 6], ["PR", 4, 0, "auto_unroll_max_step$1024"]]]], "r": [[3.45725e-06, 3.45697e-06, 3.45632e-06], 0, 7.2449, 1667925705], "v": "v0.6"}
{"i": [["[\"conv1x1\", 1, 1, 1, 6, 144]", "cuda -keys=cuda,gpu -max_num_threads=1024 -model=unknown -thread_warp_size=32", [-1, 16, 64, 49152, 2147483647, 1024, 8, 32], "", 0, []], [[], [["CHW", 2, "local"], ["SP", 2, 0, 1, [1, 1, 1, 1], 1], ["SP", 2, 5, 1, [1, 1, 1, 1], 1], ["SP", 2, 10, 1, [1, 1, 1, 1], 1], ["SP", 2, 15, 144, [1, 48, 1, 1], 1], ["SP", 2, 20, 6, [2, 3], 1], ["RE", 2, [0, 5, 10, 15, 1, 6, 11, 16, 2, 7, 12, 17, 20, 21, 3, 8, 13, 18, 22, 4, 9, 14, 19]], ["FSP", 3, 0, 1, 3], ["FSP", 3, 4, 2, 3], ["FSP", 3, 8, 3, 3], ["FSP", 3, 12, 4, 3], ["RE", 3, [0, 4, 8, 12, 1, 5, 9, 13, 2, 6, 10, 14, 3, 7, 11, 15]], ["CA", 2, 3, 11], ["CHR", 1, "shared", [2]], ["CA", 2, 3, 12], ["CHR", 0, "shared", [3]], ["CA", 1, 4, 12], ["FU", 5, [0, 1, 2, 3]], ["AN", 5, 0, 5], ["FU", 5, [1, 2, 3, 4]], ["AN", 5, 1, 4], ["FU", 5, [2, 3, 4, 5]], ["AN", 5, 2, 6], ["FU", 3, [0, 1]], ["SP", 3, 0, 6, [1], 1], ["AN", 3, 1, 2], ["FFSP", 3, 0, [4, 3, 2, 1], 1, 1], ["AN", 3, 1, 6], ["FU", 1, [0, 1, 2, 3]], ["SP", 1, 0, 6, [1], 1], ["AN", 1, 1, 2], ["FFSP", 1, 0, [4, 3, 2, 1], 1, 1], ["AN", 1, 1, 6], ["PR", 4, 0, "auto_unroll_max_step$0"]]]], "r": [[2.51107e-06, 2.50791e-06, 2.50902e-06], 0, 7.38835, 1667925705], "v": "v0.6"}
{"i": [["[\"conv1x1\", 1, 1, 1, 6, 144]", "cuda -keys=cuda,gpu -max_num_threads=1024 -model=unknown -thread_warp_size=32", [-1, 16, 64, 49152, 2147483647, 1024, 8, 32], "", 0, []], [[], [["CHW", 2, "local"], ["SP", 2, 0, 1, [1, 1, 1, 1], 1], ["SP", 2, 5, 1, [1, 1, 1, 1], 1], ["SP", 2, 10, 1, [1, 1, 1, 1], 1], ["SP", 2, 15, 144, [1, 144, 1, 1], 1], ["SP", 2, 20, 6, [3, 1], 1], ["RE", 2, [0, 5, 10, 15, 1, 6, 11, 16, 2, 7, 12, 17, 20, 21, 3, 8, 13, 18, 22, 4, 9, 14, 19]], ["FSP", 3, 0, 1, 3], ["FSP", 3, 4, 2, 3], ["FSP", 3, 8, 3, 3], ["FSP", 3, 12, 4, 3], ["RE", 3, [0, 4, 8, 12, 1, 5, 9, 13, 2, 6, 10, 14, 3, 7, 11, 15]], ["CA", 2, 3, 11], ["CHR", 1, "shared", [2]], ["CA", 2, 3, 12], ["CHR", 0, "shared", [3]], ["CA", 1, 4, 12], ["FU", 5, [0, 1, 2, 3]], ["AN", 5, 0, 5], ["FU", 5, [1, 2, 3, 4]], ["AN", 5, 1, 4], ["FU", 5, [2, 3, 4, 5]], ["AN", 5, 2, 6], ["FU", 3, [0, 1]], ["SP", 3, 0, 3, [1], 1], ["AN", 3, 1, 2], ["FFSP", 3, 0, [4, 3, 2, 1], 1, 1], ["AN", 3, 1, 6], ["FU", 1, [0, 1, 2, 3]], ["SP", 1, 0, 3, [3], 1], ["AN", 1, 1, 2], ["FFSP", 1, 0, [4, 3, 2, 1], 1, 1], ["AN", 1, 1, 6], ["PR", 4, 0, "auto_unroll_max_step$1024"]]]], "r": [[2.59633e-06, 2.59433e-06, 2.59214e-06], 0, 3.73331, 1667935327], "v": "v0.6"}
{"i": [["[\"conv1x1\", 1, 1, 1, 6, 144]", "cuda -keys=cuda,gpu -max_num_threads=1024 -model=unknown -thread_warp_size=32", [-1, 16, 64, 49152, 2147483647, 1024, 8, 32], "", 0, []], [[], [["CHW", 2, "local"], ["SP", 2, 0, 1, [1, 1, 1, 1], 1], ["SP", 2, 5, 1, [1, 1, 1, 1], 1], ["SP", 2, 10, 1, [1, 1, 1, 1], 1], ["SP", 2, 15, 144, [1, 48, 1, 3], 1], ["SP", 2, 20, 6, [1, 6], 1], ["RE", 2, [0, 5, 10, 15, 1, 6, 11, 16, 2, 7, 12, 17, 20, 21, 3, 8, 13, 18, 22, 4, 9, 14, 19]], ["FSP", 3, 0, 1, 3], ["FSP", 3, 4, 2, 3], ["FSP", 3, 8, 3, 3], ["FSP", 3, 12, 4, 3], ["RE", 3, [0, 4, 8, 12, 1, 5, 9, 13, 2, 6, 10, 14, 3, 7, 11, 15]], ["CA", 2, 3, 11], ["CHR", 1, "shared", [2]], ["CA", 2, 3, 12], ["CHR", 0, "shared", [3]], ["CA", 1, 4, 12], ["FU", 5, [0, 1, 2, 3]], ["AN", 5, 0, 5], ["FU", 5, [1, 2, 3, 4]], ["AN", 5, 1, 4], ["FU", 5, [2, 3, 4, 5]], ["AN", 5, 2, 6], ["FU", 3, [0, 1]], ["SP", 3, 0, 18, [1], 1], ["AN", 3, 1, 2], ["FFSP", 3, 0, [4, 3, 2, 1], 1, 1], ["AN", 3, 1, 6], ["FU", 1, [0, 1, 2, 3]], ["SP", 1, 0, 6, [2], 1], ["AN", 1, 1, 2], ["FFSP", 1, 0, [4, 3, 2, 1], 1, 1], ["AN", 1, 1, 6], ["PR", 4, 0, "auto_unroll_max_step$1024"]]]], "r": [[2.65046e-06, 2.65277e-06, 2.66517e-06], 0, 0.679999, 1667935324], "v": "v0.6"}
{"i": [["[\"conv1x1\", 1, 1, 1, 6, 144]", "cuda -keys=cuda,gpu -max_num_threads=1024 -model=unknown -thread_warp_size=32", [-1, 16, 64, 49152, 2147483647, 1024, 8, 32], "", 0, []], [[], [["CHW", 2, "local"], ["SP", 2, 0, 1, [1, 1, 1, 1], 1], ["SP", 2, 5, 1, [1, 1, 1, 1], 1], ["SP", 2, 10, 1, [1, 1, 1, 1], 1], ["SP", 2, 15, 144, [1, 48, 3, 1], 1], ["SP", 2, 20, 6, [3, 2], 1], ["RE", 2, [0, 5, 10, 15, 1, 6, 11, 16, 2, 7, 12, 17, 20, 21, 3, 8, 13, 18, 22, 4, 9, 14, 19]], ["FSP", 3, 0, 1, 3], ["FSP", 3, 4, 2, 3], ["FSP", 3, 8, 3, 3], ["FSP", 3, 12, 4, 3], ["RE", 3, [0, 4, 8, 12, 1, 5, 9, 13, 2, 6, 10, 14, 3, 7, 11, 15]], ["CA", 2, 3, 11], ["CHR", 1, "shared", [2]], ["CA", 2, 3, 12], ["CHR", 0, "shared", [3]], ["CA", 1, 4, 12], ["FU", 5, [0, 1, 2, 3]], ["AN", 5, 0, 5], ["FU", 5, [1, 2, 3, 4]], ["AN", 5, 1, 4], ["FU", 5, [2, 3, 4, 5]], ["AN", 5, 2, 6], ["FU", 3, [0, 1]], ["SP", 3, 0, 6, [1], 1], ["AN", 3, 1, 2], ["FFSP", 3, 0, [4, 3, 2, 1], 1, 1], ["AN", 3, 1, 6], ["FU", 1, [0, 1, 2, 3]], ["SP", 1, 0, 6, [1], 1], ["AN", 1, 1, 2], ["FFSP", 1, 0, [4, 3, 2, 1], 1, 1], ["AN", 1, 1, 6], ["PR", 4, 0, "auto_unroll_max_step$1024"]]]], "r": [[2.64242e-06, 2.64199e-06, 2.64444e-06], 0, 2.15668, 1667935326], "v": "v0.6"}
{"i": [["[\"conv1x1\", 1, 1, 1, 6, 144]", "cuda -keys=cuda,gpu -max_num_threads=1024 -model=unknown -thread_warp_size=32", [-1, 16, 64, 49152, 2147483647, 1024, 8, 32], "", 0, []], [[], [["CHW", 2, "local"], ["SP", 2, 0, 1, [1, 1, 1, 1], 1], ["SP", 2, 5, 1, [1, 1, 1, 1], 1], ["SP", 2, 10, 1, [1, 1, 1, 1], 1], ["SP", 2, 15, 144, [1, 48, 1, 1], 1], ["SP", 2, 20, 6, [1, 6], 1], ["RE", 2, [0, 5, 10, 15, 1, 6, 11, 16, 2, 7, 12, 17, 20, 21, 3, 8, 13, 18, 22, 4, 9, 14, 19]], ["FSP", 3, 0, 1, 3], ["FSP", 3, 4, 2, 3], ["FSP", 3, 8, 3, 3], ["FSP", 3, 12, 4, 3], ["RE", 3, [0, 4, 8, 12, 1, 5, 9, 13, 2, 6, 10, 14, 3, 7, 11, 15]], ["CA", 2, 3, 11], ["CHR", 1, "shared", [2]], ["CA", 2, 3, 12], ["CHR", 0, "shared", [3]], ["CA", 1, 4, 12], ["FU", 5, [0, 1, 2, 3]], ["AN", 5, 0, 5], ["FU", 5, [1, 2, 3, 4]], ["AN", 5, 1, 4], ["FU", 5, [2, 3, 4, 5]], ["AN", 5, 2, 6], ["FU", 3, [0, 1]], ["SP", 3, 0, 18, [2], 1], ["AN", 3, 1, 2], ["FFSP", 3, 0, [4, 3, 2, 1], 1, 1], ["AN", 3, 1, 6], ["FU", 1, [0, 1, 2, 3]], ["SP", 1, 0, 6, [1], 1], ["AN", 1, 1, 2], ["FFSP", 1, 0, [4, 3, 2, 1], 1, 1], ["AN", 1, 1, 6], ["PR", 4, 0, "auto_unroll_max_step$16"]]]], "r": [[2.67023e-06, 2.66502e-06, 2.69149e-06], 0, 1.10661, 1667935325], "v": "v0.6"}
{"i": [["[\"conv1x1\", 1, 1, 1, 6, 144]", "cuda -keys=cuda,gpu -max_num_threads=1024 -model=unknown -thread_warp_size=32", [-1, 16, 64, 49152, 2147483647, 1024, 8, 32], "", 0, []], [[], [["CHW", 2, "local"], ["SP", 2, 0, 1, [1, 1, 1, 1], 1], ["SP", 2, 5, 1, [1, 1, 1, 1], 1], ["SP", 2, 10, 1, [1, 1, 1, 1], 1], ["SP", 2, 15, 144, [1, 1, 2, 4], 1], ["SP", 2, 20, 6, [1, 2], 1], ["RE", 2, [0, 5, 10, 15, 1, 6, 11, 16, 2, 7, 12, 17, 20, 21, 3, 8, 13, 18, 22, 4, 9, 14, 19]], ["FSP", 3, 0, 1, 3], ["FSP", 3, 4, 2, 3], ["FSP", 3, 8, 3, 3], ["FSP", 3, 12, 4, 3], ["RE", 3, [0, 4, 8, 12, 1, 5, 9, 13, 2, 6, 10, 14, 3, 7, 11, 15]], ["CA", 2, 3, 11], ["CHR", 1, "shared", [2]], ["CA", 2, 3, 12], ["CHR", 0, "shared", [3]], ["CA", 1, 4, 12], ["FU", 5, [0, 1, 2, 3]], ["AN", 5, 0, 5], ["FU", 5, [1, 2, 3, 4]], ["AN", 5, 1, 4], ["FU", 5, [2, 3, 4, 5]], ["AN", 5, 2, 6], ["FU", 3, [0, 1]], ["SP", 3, 0, 2, [1], 1], ["AN", 3, 1, 2], ["FFSP", 3, 0, [4, 3, 2, 1], 1, 1], ["AN", 3, 1, 6], ["FU", 1, [0, 1, 2, 3]], ["SP", 1, 0, 1, [1], 1], ["AN", 1, 1, 2], ["FFSP", 1, 0, [4, 3, 2, 1], 1, 1], ["AN", 1, 1, 6], ["PR", 4, 0, "auto_unroll_max_step$512"]]]], "r": [[2.92489e-06, 2.92743e-06, 2.92864e-06], 0, 4.41434, 1667935328], "v": "v0.6"}
{"i": [["[\"conv1x1\", 1, 1, 1, 6, 144]", "cuda -keys=cuda,gpu -max_num_threads=1024 -model=unknown -thread_warp_size=32", [-1, 16, 64, 49152, 2147483647, 1024, 8, 32], "", 0, []], [[], [["CHW", 2, "local"], ["SP", 2, 0, 1, [1, 1, 1, 1], 1], ["SP", 2, 5, 1, [1, 1, 1, 1], 1], ["SP", 2, 10, 1, [1, 1, 1, 1], 1], ["SP", 2, 15, 144, [1, 72, 1, 1], 1], ["SP", 2, 20, 6, [1, 1], 1], ["RE", 2, [0, 5, 10, 15, 1, 6, 11, 16, 2, 7, 12, 17, 20, 21, 3, 8, 13, 18, 22, 4, 9, 14, 19]], ["FSP", 3, 0, 1, 3], ["FSP", 3, 4, 2, 3], ["FSP", 3, 8, 3, 3], ["FSP", 3, 12, 4, 3], ["RE", 3, [0, 4, 8, 12, 1, 5, 9, 13, 2, 6, 10, 14, 3, 7, 11, 15]], ["CA", 2, 3, 11], ["CHR", 1, "shared", [2]], ["CA", 2, 3, 12], ["CHR", 0, "shared", [3]], ["CA", 1, 4, 12], ["FU", 5, [0, 1, 2, 3]], ["AN", 5, 0, 5], ["FU", 5, [1, 2, 3, 4]], ["AN", 5, 1, 4], ["FU", 5, [2, 3, 4, 5]], ["AN", 5, 2, 6], ["FU", 3, [0, 1]], ["SP", 3, 0, 6, [1], 1], ["AN", 3, 1, 2], ["FFSP", 3, 0, [4, 3, 2, 1], 1, 1], ["AN", 3, 1, 6], ["FU", 1, [0, 1, 2, 3]], ["SP", 1, 0, 6, [1], 1], ["AN", 1, 1, 2], ["FFSP", 1, 0, [4, 3, 2, 1], 1, 1], ["AN", 1, 1, 6], ["PR", 4, 0, "auto_unroll_max_step$512"]]]], "r": [[2.72438e-06, 2.72624e-06, 2.72598e-06], 0, 4.12509, 1667935328], "v": "v0.6"}
{"i": [["[\"conv1x1\", 1, 1, 1, 6, 144]", "cuda -keys=cuda,gpu -max_num_threads=1024 -model=unknown -thread_warp_size=32", [-1, 16, 64, 49152, 2147483647, 1024, 8, 32], "", 0, []], [[], [["CHW", 2, "local"], ["SP", 2, 0, 1, [1, 1, 1, 1], 1], ["SP", 2, 5, 1, [1, 1, 1, 1], 1], ["SP", 2, 10, 1, [1, 1, 1, 1], 1], ["SP", 2, 15, 144, [2, 18, 1, 1], 1], ["SP", 2, 20, 6, [1, 6], 1], ["RE", 2, [0, 5, 10, 15, 1, 6, 11, 16, 2, 7, 12, 17, 20, 21, 3, 8, 13, 18, 22, 4, 9, 14, 19]], ["FSP", 3, 0, 1, 3], ["FSP", 3, 4, 2, 3], ["FSP", 3, 8, 3, 3], ["FSP", 3, 12, 4, 3], ["RE", 3, [0, 4, 8, 12, 1, 5, 9, 13, 2, 6, 10, 14, 3, 7, 11, 15]], ["CA", 2, 3, 11], ["CHR", 1, "shared", [2]], ["CA", 2, 3, 12], ["CHR", 0, "shared", [3]], ["CA", 1, 4, 12], ["FU", 5, [0, 1, 2, 3]], ["AN", 5, 0, 5], ["FU", 5, [1, 2, 3, 4]], ["AN", 5, 1, 4], ["FU", 5, [2, 3, 4, 5]], ["AN", 5, 2, 6], ["FU", 3, [0, 1]], ["SP", 3, 0, 6, [1], 1], ["AN", 3, 1, 2], ["FFSP", 3, 0, [4, 3, 2, 1], 1, 1], ["AN", 3, 1, 6], ["FU", 1, [0, 1, 2, 3]], ["SP", 1, 0, 6, [1], 1], ["AN", 1, 1, 2], ["FFSP", 1, 0, [4, 3, 2, 1], 1, 1], ["AN", 1, 1, 6], ["PR", 4, 0, "auto_unroll_max_step$1024"]]]], "r": [[2.60335e-06, 2.59832e-06, 2.60016e-06], 0, 2.46422, 1667935326], "v": "v0.6"}
{"i": [["[\"conv1x1\", 1, 1, 1, 6, 144]", "cuda -keys=cuda,gpu -max_num_threads=1024 -model=unknown -thread_warp_size=32", [-1, 16, 64, 49152, 2147483647, 1024, 8, 32], "", 0, []], [[], [["CHW", 2, "local"], ["SP", 2, 0, 1, [1, 1, 1, 1], 1], ["SP", 2, 5, 1, [1, 1, 1, 1], 1], ["SP", 2, 10, 1, [1, 1, 1, 1], 1], ["SP", 2, 15, 144, [1, 36, 4, 1], 1], ["SP", 2, 20, 6, [2, 3], 1], ["RE", 2, [0, 5, 10, 15, 1, 6, 11, 16, 2, 7, 12, 17, 20, 21, 3, 8, 13, 18, 22, 4, 9, 14, 19]], ["FSP", 3, 0, 1, 3], ["FSP", 3, 4, 2, 3], ["FSP", 3, 8, 3, 3], ["FSP", 3, 12, 4, 3], ["RE", 3, [0, 4, 8, 12, 1, 5, 9, 13, 2, 6, 10, 14, 3, 7, 11, 15]], ["CA", 2, 3, 11], ["CHR", 1, "shared", [2]], ["CA", 2, 3, 12], ["CHR", 0, "shared", [3]], ["CA", 1, 4, 12], ["FU", 5, [0, 1, 2, 3]], ["AN", 5, 0, 5], ["FU", 5, [1, 2, 3, 4]], ["AN", 5, 1, 4], ["FU", 5, [2, 3, 4, 5]], ["AN", 5, 2, 6], ["FU", 3, [0, 1]], ["SP", 3, 0, 24, [1], 1], ["AN", 3, 1, 2], ["FFSP", 3, 0, [4, 3, 2, 1], 1, 1], ["AN", 3, 1, 6], ["FU", 1, [0, 1, 2, 3]], ["SP", 1, 0, 6, [1], 1], ["AN", 1, 1, 2], ["FFSP", 1, 0, [4, 3, 2, 1], 1, 1], ["AN", 1, 1, 6], ["PR", 4, 0, "auto_unroll_max_step$0"]]]], "r": [[2.87528e-06, 2.8723e-06, 2.88361e-06], 0, 2.79476, 1667935326], "v": "v0.6"}
{"i": [["[\"conv1x1\", 1, 1, 1, 6, 144]", "cuda -keys=cuda,gpu -max_num_threads=1024 -model=unknown -thread_warp_size=32", [-1, 16, 64, 49152, 2147483647, 1024, 8, 32], "", 0, []], [[], [["CHW", 2, "local"], ["SP", 2, 0, 1, [1, 1, 1, 1], 1], ["SP", 2, 5, 1, [1, 1, 1, 1], 1], ["SP", 2, 10, 1, [1, 1, 1, 1], 1], ["SP", 2, 15, 144, [2, 72, 1, 1], 1], ["SP", 2, 20, 6, [3, 1], 1], ["RE", 2, [0, 5, 10, 15, 1, 6, 11, 16, 2, 7, 12, 17, 20, 21, 3, 8, 13, 18, 22, 4, 9, 14, 19]], ["FSP", 3, 0, 1, 3], ["FSP", 3, 4, 2, 3], ["FSP", 3, 8, 3, 3], ["FSP", 3, 12, 4, 3], ["RE", 3, [0, 4, 8, 12, 1, 5, 9, 13, 2, 6, 10, 14, 3, 7, 11, 15]], ["CA", 2, 3, 11], ["CHR", 1, "shared", [2]], ["CA", 2, 3, 12], ["CHR", 0, "shared", [3]], ["CA", 1, 4, 12], ["FU", 5, [0, 1, 2, 3]], ["AN", 5, 0, 5], ["FU", 5, [1, 2, 3, 4]], ["AN", 5, 1, 4], ["FU", 5, [2, 3, 4, 5]], ["AN", 5, 2, 6], ["FU", 3, [0, 1]], ["SP", 3, 0, 3, [1], 1], ["AN", 3, 1, 2], ["FFSP", 3, 0, [4, 3, 2, 1], 1, 1], ["AN", 3, 1, 6], ["FU", 1, [0, 1, 2, 3]], ["SP", 1, 0, 3, [1], 1], ["AN", 1, 1, 2], ["FFSP", 1, 0, [4, 3, 2, 1], 1, 1], ["AN", 1, 1, 6], ["PR", 4, 0, "auto_unroll_max_step$16"]]]], "r": [[2.62363e-06, 2.62005e-06, 2.62097e-06], 0, 4.83072, 1667935329], "v": "v0.6"}
{"i": [["[\"conv1x1\", 1, 1, 1, 6, 144]", "cuda -keys=cuda,gpu -max_num_threads=1024 -model=unknown -thread_warp_size=32", [-1, 16, 64, 49152, 2147483647, 1024, 8, 32], "", 0, []], [[], [["CHW", 2, "local"], ["SP", 2, 0, 1, [1, 1, 1, 1], 1], ["SP", 2, 5, 1, [1, 1, 1, 1], 1], ["SP", 2, 10, 1, [1, 1, 1, 1], 1], ["SP", 2, 15, 144, [1, 48, 1, 3], 1], ["SP", 2, 20, 6, [1, 2], 1], ["RE", 2, [0, 5, 10, 15, 1, 6, 11, 16, 2, 7, 12, 17, 20, 21, 3, 8, 13, 18, 22, 4, 9, 14, 19]], ["FSP", 3, 0, 1, 3], ["FSP", 3, 4, 2, 3], ["FSP", 3, 8, 3, 3], ["FSP", 3, 12, 4, 3], ["RE", 3, [0, 4, 8, 12, 1, 5, 9, 13, 2, 6, 10, 14, 3, 7, 11, 15]], ["CA", 2, 3, 11], ["CHR", 1, "shared", [2]], ["CA", 2, 3, 12], ["CHR", 0, "shared", [3]], ["CA", 1, 4, 12], ["FU", 5, [0, 1, 2, 3]], ["AN", 5, 0, 5], ["FU", 5, [1, 2, 3, 4]], ["AN", 5, 1, 4], ["FU", 5, [2, 3, 4, 5]], ["AN", 5, 2, 6], ["FU", 3, [0, 1]], ["SP", 3, 0, 1, [1], 1], ["AN", 3, 1, 2], ["FFSP", 3, 0, [4, 3, 2, 1], 1, 1], ["AN", 3, 1, 6], ["FU", 1, [0, 1, 2, 3]], ["SP", 1, 0, 1, [1], 1], ["AN", 1, 1, 2], ["FFSP", 1, 0, [4, 3, 2, 1], 1, 1], ["AN", 1, 1, 6], ["PR", 4, 0, "auto_unroll_max_step$64"]]]], "r": [[2.7484e-06, 2.75223e-06, 2.75168e-06], 0, 5.05618, 1667935329], "v": "v0.6"}
{"i": [["[\"conv1x1\", 1, 1, 1, 6, 144]", "cuda -keys=cuda,gpu -max_num_threads=1024 -model=unknown -thread_warp_size=32", [-1, 16, 64, 49152, 2147483647, 1024, 8, 32], "", 0, []], [[], [["CHW", 2, "local"], ["SP", 2, 0, 1, [1, 1, 1, 1], 1], ["SP", 2, 5, 1, [1, 1, 1, 1], 1], ["SP", 2, 10, 1, [1, 1, 1, 1], 1], ["SP", 2, 15, 144, [2, 18, 1, 2], 1], ["SP", 2, 20, 6, [6, 1], 1], ["RE", 2, [0, 5, 10, 15, 1, 6, 11, 16, 2, 7, 12, 17, 20, 21, 3, 8, 13, 18, 22, 4, 9, 14, 19]], ["FSP", 3, 0, 1, 3], ["FSP", 3, 4, 2, 3], ["FSP", 3, 8, 3, 3], ["FSP", 3, 12, 4, 3], ["RE", 3, [0, 4, 8, 12, 1, 5, 9, 13, 2, 6, 10, 14, 3, 7, 11, 15]], ["CA", 2, 3, 11], ["CHR", 1, "shared", [2]], ["CA", 2, 3, 12], ["CHR", 0, "shared", [3]], ["CA", 1, 4, 12], ["FU", 5, [0, 1, 2, 3]], ["AN", 5, 0, 5], ["FU", 5, [1, 2, 3, 4]], ["AN", 5, 1, 4], ["FU", 5, [2, 3, 4, 5]], ["AN", 5, 2, 6], ["FU", 3, [0, 1]], ["SP", 3, 0, 12, [1], 1], ["AN", 3, 1, 2], ["FFSP", 3, 0, [4, 3, 2, 1], 1, 1], ["AN", 3, 1, 6], ["FU", 1, [0, 1, 2, 3]], ["SP", 1, 0, 6, [3], 1], ["AN", 1, 1, 2], ["FFSP", 1, 0, [4, 3, 2, 1], 1, 1], ["AN", 1, 1, 6], ["PR", 4, 0, "auto_unroll_max_step$64"]]]], "r": [[2.83365e-06, 2.83605e-06, 2.83584e-06], 0, 6.12408, 1667935330], "v": "v0.6"}
{"i": [["[\"conv1x1\", 1, 1, 1, 6, 144]", "cuda -keys=cuda,gpu -max_num_threads=1024 -model=unknown -thread_warp_size=32", [-1, 16, 64, 49152, 2147483647, 1024, 8, 32], "", 0, []], [[], [["CHW", 2, "local"], ["SP", 2, 0, 1, [1, 1, 1, 1], 1], ["SP", 2, 5, 1, [1, 1, 1, 1], 1], ["SP", 2, 10, 1, [1, 1, 1, 1], 1], ["SP", 2, 15, 144, [3, 48, 1, 1], 1], ["SP", 2, 20, 6, [1, 2], 1], ["RE", 2, [0, 5, 10, 15, 1, 6, 11, 16, 2, 7, 12, 17, 20, 21, 3, 8, 13, 18, 22, 4, 9, 14, 19]], ["FSP", 3, 0, 1, 3], ["FSP", 3, 4, 2, 3], ["FSP", 3, 8, 3, 3], ["FSP", 3, 12, 4, 3], ["RE", 3, [0, 4, 8, 12, 1, 5, 9, 13, 2, 6, 10, 14, 3, 7, 11, 15]], ["CA", 2, 3, 11], ["CHR", 1, "shared", [2]], ["CA", 2, 3, 12], ["CHR", 0, "shared", [3]], ["CA", 1, 4, 12], ["FU", 5, [0, 1, 2, 3]], ["AN", 5, 0, 5], ["FU", 5, [1, 2, 3, 4]], ["AN", 5, 1, 4], ["FU", 5, [2, 3, 4, 5]], ["AN", 5, 2, 6], ["FU", 3, [0, 1]], ["SP", 3, 0, 2, [1], 1], ["AN", 3, 1, 2], ["FFSP", 3, 0, [4, 3, 2, 1], 1, 1], ["AN", 3, 1, 6], ["FU", 1, [0, 1, 2, 3]], ["SP", 1, 0, 2, [1], 1], ["AN", 1, 1, 2], ["FFSP", 1, 0, [4, 3, 2, 1], 1, 1], ["AN", 1, 1, 6], ["PR", 4, 0, "auto_unroll_max_step$0"]]]], "r": [[2.98906e-06, 2.98867e-06, 2.99891e-06], 0, 5.91327, 1667935330], "v": "v0.6"}
{"i": [["[\"conv1x1\", 1, 1, 1, 6, 144]", "cuda -keys=cuda,gpu -max_num_threads=1024 -model=unknown -thread_warp_size=32", [-1, 16, 64, 49152, 2147483647, 1024, 8, 32], "", 0, []], [[], [["CHW", 2, "local"], ["SP", 2, 0, 1, [1, 1, 1, 1], 1], ["SP", 2, 5, 1, [1, 1, 1, 1], 1], ["SP", 2, 10, 1, [1, 1, 1, 1], 1], ["SP", 2, 15, 144, [6, 6, 4, 1], 1], ["SP", 2, 20, 6, [1, 6], 1], ["RE", 2, [0, 5, 10, 15, 1, 6, 11, 16, 2, 7, 12, 17, 20, 21, 3, 8, 13, 18, 22, 4, 9, 14, 19]], ["FSP", 3, 0, 1, 3], ["FSP", 3, 4, 2, 3], ["FSP", 3, 8, 3, 3], ["FSP", 3, 12, 4, 3], ["RE", 3, [0, 4, 8, 12, 1, 5, 9, 13, 2, 6, 10, 14, 3, 7, 11, 15]], ["CA", 2, 3, 11], ["CHR", 1, "shared", [2]], ["CA", 2, 3, 12], ["CHR", 0, "shared", [3]], ["CA", 1, 4, 12], ["FU", 5, [0, 1, 2, 3]], ["AN", 5, 0, 5], ["FU", 5, [1, 2, 3, 4]], ["AN", 5, 1, 4], ["FU", 5, [2, 3, 4, 5]], ["AN", 5, 2, 6], ["FU", 3, [0, 1]], ["SP", 3, 0, 24, [2], 1], ["AN", 3, 1, 2], ["FFSP", 3, 0, [4, 3, 2, 1], 1, 1], ["AN", 3, 1, 6], ["FU", 1, [0, 1, 2, 3]], ["SP", 1, 0, 6, [1], 1], ["AN", 1, 1, 2], ["FFSP", 1, 0, [4, 3, 2, 1], 1, 1], ["AN", 1, 1, 6], ["PR", 4, 0, "auto_unroll_max_step$0"]]]], "r": [[3.56221e-06, 3.56039e-06, 3.55941e-06], 0, 7.28296, 1667935331], "v": "v0.6"}
{"i": [["[\"conv1x1\", 1, 1, 1, 6, 144]", "cuda -keys=cuda,gpu -max_num_threads=1024 -model=unknown -thread_warp_size=32", [-1, 16, 64, 49152, 2147483647, 1024, 8, 32], "", 0, []], [[], [["CHW", 2, "local"], ["SP", 2, 0, 1, [1, 1, 1, 1], 1], ["SP", 2, 5, 1, [1, 1, 1, 1], 1], ["SP", 2, 10, 1, [1, 1, 1, 1], 1], ["SP", 2, 15, 144, [1, 2, 2, 18], 1], ["SP", 2, 20, 6, [3, 1], 1], ["RE", 2, [0, 5, 10, 15, 1, 6, 11, 16, 2, 7, 12, 17, 20, 21, 3, 8, 13, 18, 22, 4, 9, 14, 19]], ["FSP", 3, 0, 1, 3], ["FSP", 3, 4, 2, 3], ["FSP", 3, 8, 3, 3], ["FSP", 3, 12, 4, 3], ["RE", 3, [0, 4, 8, 12, 1, 5, 9, 13, 2, 6, 10, 14, 3, 7, 11, 15]], ["CA", 2, 3, 11], ["CHR", 1, "shared", [2]], ["CA", 2, 3, 12], ["CHR", 0, "shared", [3]], ["CA", 1, 4, 12], ["FU", 5, [0, 1, 2, 3]], ["AN", 5, 0, 5], ["FU", 5, [1, 2, 3, 4]], ["AN", 5, 1, 4], ["FU", 5, [2, 3, 4, 5]], ["AN", 5, 2, 6], ["FU", 3, [0, 1]], ["SP", 3, 0, 2, [1], 1], ["AN", 3, 1, 2], ["FFSP", 3, 0, [4, 3, 2, 1], 1, 1], ["AN", 3, 1, 6], ["FU", 1, [0, 1, 2, 3]], ["SP", 1, 0, 1, [1], 1], ["AN", 1, 1, 2], ["FFSP", 1, 0, [4, 3, 2, 1], 1, 1], ["AN", 1, 1, 6], ["PR", 4, 0, "auto_unroll_max_step$512"]]]], "r": [[5.30303e-06, 5.30095e-06, 5.30384e-06], 0, 7.36759, 1667935331], "v": "v0.6"}
{"i": [["[\"conv1x1\", 1, 1, 1, 6, 144]", "cuda -keys=cuda,gpu -max_num_threads=1024 -model=unknown -thread_warp_size=32", [-1, 16, 64, 49152, 2147483647, 1024, 8, 32], "", 0, []], [[], [["CHW", 2, "local"], ["SP", 2, 0, 1, [1, 1, 1, 1], 1], ["SP", 2, 5, 1, [1, 1, 1, 1], 1], ["SP", 2, 10, 1, [1, 1, 1, 1], 1], ["SP", 2, 15, 144, [4, 9, 4, 1], 1], ["SP", 2, 20, 6, [1, 1], 1], ["RE", 2, [0, 5, 10, 15, 1, 6, 11, 16, 2, 7, 12, 17, 20, 21, 3, 8, 13, 18, 22, 4, 9, 14, 19]], ["FSP", 3, 0, 1, 3], ["FSP", 3, 4, 2, 3], ["FSP", 3, 8, 3, 3], ["FSP", 3, 12, 4, 3], ["RE", 3, [0, 4, 8, 12, 1, 5, 9, 13, 2, 6, 10, 14, 3, 7, 11, 15]], ["CA", 2, 3, 11], ["CHR", 1, "shared", [2]], ["CA", 2, 3, 12], ["CHR", 0, "shared", [3]], ["CA", 1, 4, 12], ["FU", 5, [0, 1, 2, 3]], ["AN", 5, 0, 5], ["FU", 5, [1, 2, 3, 4]], ["AN", 5, 1, 4], ["FU", 5, [2, 3, 4, 5]], ["AN", 5, 2, 6], ["FU", 3, [0, 1]], ["SP", 3, 0, 1, [1], 1], ["AN", 3, 1, 2], ["FFSP", 3, 0, [4, 3, 2, 1], 1, 1], ["AN", 3, 1, 6], ["FU", 1, [0, 1, 2, 3]], ["SP", 1, 0, 1, [1], 1], ["AN", 1, 1, 2], ["FFSP", 1, 0, [4, 3, 2, 1], 1, 1], ["AN", 1, 1, 6], ["PR", 4, 0, "auto_unroll_max_step$512"]]]], "r": [[4.02881e-06, 4.03294e-06, 4.03368e-06], 0, 6.38912, 1667935330], "v": "v0.6"}
{"i": [["[\"conv1x1\", 1, 1, 1, 6, 144]", "cuda -keys=cuda,gpu -max_num_threads=1024 -model=unknown -thread_warp_size=32", [-1, 16, 64, 49152, 2147483647, 1024, 8, 32], "", 0, []], [[], [["CHW", 2, "local"], ["SP", 2, 0, 1, [1, 1, 1, 1], 1], ["SP", 2, 5, 1, [1, 1, 1, 1], 1], ["SP", 2, 10, 1, [1, 1, 1, 1], 1], ["SP", 2, 15, 144, [2, 36, 2, 1], 1], ["SP", 2, 20, 6, [3, 2], 1], ["RE", 2, [0, 5, 10, 15, 1, 6, 11, 16, 2, 7, 12, 17, 20, 21, 3, 8, 13, 18, 22, 4, 9, 14, 19]], ["FSP", 3, 0, 1, 3], ["FSP", 3, 4, 2, 3], ["FSP", 3, 8, 3, 3], ["FSP", 3, 12, 4, 3], ["RE", 3, [0, 4, 8, 12, 1, 5, 9, 13, 2, 6, 10, 14, 3, 7, 11, 15]], ["CA", 2, 3, 11], ["CHR", 1, "shared", [2]], ["CA", 2, 3, 12], ["CHR", 0, "shared", [3]], ["CA", 1, 4, 12], ["FU", 5, [0, 1, 2, 3]], ["AN", 5, 0, 5], ["FU", 5, [1, 2, 3, 4]], ["AN", 5, 1, 4], ["FU", 5, [2, 3, 4, 5]], ["AN", 5, 2, 6], ["FU", 3, [0, 1]], ["SP", 3, 0, 2, [1], 1], ["AN", 3, 1, 2], ["FFSP", 3, 0, [4, 3, 2, 1], 1, 1], ["AN", 3, 1, 6], ["FU", 1, [0, 1, 2, 3]], ["SP", 1, 0, 1, [1], 1], ["AN", 1, 1, 2], ["FFSP", 1, 0, [4, 3, 2, 1], 1, 1], ["AN", 1, 1, 6], ["PR", 4, 0, "auto_unroll_max_step$16"]]]], "r": [[2.67018e-06, 2.67408e-06, 2.6809e-06], 0, 7.86649, 1667935332], "v": "v0.6"}
{"i": [["[\"conv1x1\", 1, 1, 1, 6, 144]", "cuda -keys=cuda,gpu -max_num_threads=1024 -model=unknown -thread_warp_size=32", [-1, 16, 64, 49152, 2147483647, 1024, 8, 32], "", 0, []], [[], [["CHW", 2, "local"], ["SP", 2, 0, 1, [1, 1, 1, 1], 1], ["SP", 2, 5, 1, [1, 1, 1, 1], 1], ["SP", 2, 10, 1, [1, 1, 1, 1], 1], ["SP", 2, 15, 144, [1, 36, 1, 4], 1], ["SP", 2, 20, 6, [1, 3], 1], ["RE", 2, [0, 5, 10, 15, 1, 6, 11, 16, 2, 7, 12, 17, 20, 21, 3, 8, 13, 18, 22, 4, 9, 14, 19]], ["FSP", 3, 0, 1, 3], ["FSP", 3, 4, 2, 3], ["FSP", 3, 8, 3, 3], ["FSP", 3, 12, 4, 3], ["RE", 3, [0, 4, 8, 12, 1, 5, 9, 13, 2, 6, 10, 14, 3, 7, 11, 15]], ["CA", 2, 3, 11], ["CHR", 1, "shared", [2]], ["CA", 2, 3, 12], ["CHR", 0, "shared", [3]], ["CA", 1, 4, 12], ["FU", 5, [0, 1, 2, 3]], ["AN", 5, 0, 5], ["FU", 5, [1, 2, 3, 4]], ["AN", 5, 1, 4], ["FU", 5, [2, 3, 4, 5]], ["AN", 5, 2, 6], ["FU", 3, [0, 1]], ["SP", 3, 0, 12, [1], 1], ["AN", 3, 1, 2], ["FFSP", 3, 0, [4, 3, 2, 1], 1, 1], ["AN", 3, 1, 6], ["FU", 1, [0, 1, 2, 3]], ["SP", 1, 0, 3, [3], 1], ["AN", 1, 1, 2], ["FFSP", 1, 0, [4, 3, 2, 1], 1, 1], ["AN", 1, 1, 6], ["PR", 4, 0, "auto_unroll_max_step$512"]]]], "r": [[3.10605e-06, 3.10816e-06, 3.10745e-06], 0, 7.55645, 1667935332], "v": "v0.6"}
{"i": [["[\"conv1x1\", 1, 1, 1, 6, 144]", "cuda -keys=cuda,gpu -max_num_threads=1024 -model=unknown -thread_warp_size=32", [-1, 16, 64, 49152, 2147483647, 1024, 8, 32], "", 0, []], [[], [["CHW", 2, "local"], ["SP", 2, 0, 1, [1, 1, 1, 1], 1], ["SP", 2, 5, 1, [1, 1, 1, 1], 1], ["SP", 2, 10, 1, [1, 1, 1, 1], 1], ["SP", 2, 15, 144, [1, 48, 1, 1], 1], ["SP", 2, 20, 6, [1, 2], 1], ["RE", 2, [0, 5, 10, 15, 1, 6, 11, 16, 2, 7, 12, 17, 20, 21, 3, 8, 13, 18, 22, 4, 9, 14, 19]], ["FSP", 3, 0, 1, 3], ["FSP", 3, 4, 2, 3], ["FSP", 3, 8, 3, 3], ["FSP", 3, 12, 4, 3], ["RE", 3, [0, 4, 8, 12, 1, 5, 9, 13, 2, 6, 10, 14, 3, 7, 11, 15]], ["CA", 2, 3, 11], ["CHR", 1, "shared", [2]], ["CA", 2, 3, 12], ["CHR", 0, "shared", [3]], ["CA", 1, 4, 12], ["FU", 5, [0, 1, 2, 3]], ["AN", 5, 0, 5], ["FU", 5, [1, 2, 3, 4]], ["AN", 5, 1, 4], ["FU", 5, [2, 3, 4, 5]], ["AN", 5, 2, 6], ["FU", 3, [0, 1]], ["SP", 3, 0, 6, [1], 1], ["AN", 3, 1, 2], ["FFSP", 3, 0, [4, 3, 2, 1], 1, 1], ["AN", 3, 1, 6], ["FU", 1, [0, 1, 2, 3]], ["SP", 1, 0, 6, [1], 1], ["AN", 1, 1, 2], ["FFSP", 1, 0, [4, 3, 2, 1], 1, 1], ["AN", 1, 1, 6], ["PR", 4, 0, "auto_unroll_max_step$0"]]]], "r": [[2.52299e-06, 2.5154e-06, 2.51588e-06], 0, 8.22358, 1667935332], "v": "v0.6"}
{"i": [["[\"conv1x1\", 1, 1, 1, 6, 144]", "cuda -keys=cuda,gpu -max_num_threads=1024 -model=unknown -thread_warp_size=32", [-1, 16, 64, 49152, 2147483647, 1024, 8, 32], "", 0, []], [[], [["CHW", 2, "local"], ["SP", 2, 0, 1, [1, 1, 1, 1], 1], ["SP", 2, 5, 1, [1, 1, 1, 1], 1], ["SP", 2, 10, 1, [1, 1, 1, 1], 1], ["SP", 2, 15, 144, [1, 72, 1, 1], 1], ["SP", 2, 20, 6, [3, 1], 1], ["RE", 2, [0, 5, 10, 15, 1, 6, 11, 16, 2, 7, 12, 17, 20, 21, 3, 8, 13, 18, 22, 4, 9, 14, 19]], ["FSP", 3, 0, 1, 3], ["FSP", 3, 4, 2, 3], ["FSP", 3, 8, 3, 3], ["FSP", 3, 12, 4, 3], ["RE", 3, [0, 4, 8, 12, 1, 5, 9, 13, 2, 6, 10, 14, 3, 7, 11, 15]], ["CA", 2, 3, 11], ["CHR", 1, "shared", [2]], ["CA", 2, 3, 12], ["CHR", 0, "shared", [3]], ["CA", 1, 4, 12], ["FU", 5, [0, 1, 2, 3]], ["AN", 5, 0, 5], ["FU", 5, [1, 2, 3, 4]], ["AN", 5, 1, 4], ["FU", 5, [2, 3, 4, 5]], ["AN", 5, 2, 6], ["FU", 3, [0, 1]], ["SP", 3, 0, 3, [1], 1], ["AN", 3, 1, 2], ["FFSP", 3, 0, [4, 3, 2, 1], 1, 1], ["AN", 3, 1, 6], ["FU", 1, [0, 1, 2, 3]], ["SP", 1, 0, 3, [1], 1], ["AN", 1, 1, 2], ["FFSP", 1, 0, [4, 3, 2, 1], 1, 1], ["AN", 1, 1, 6], ["PR", 4, 0, "auto_unroll_max_step$0"]]]], "r": [[2.49686e-06, 2.48567e-06, 2.48293e-06], 0, 8.50694, 1667935333], "v": "v0.6"}
{"i": [["[\"conv1x1\", 1, 1, 1, 6, 144]", "cuda -keys=cuda,gpu -max_num_threads=1024 -model=unknown -thread_warp_size=32", [-1, 16, 64, 49152, 2147483647, 1024, 8, 32], "", 0, []], [[], [["CHW", 2, "local"], ["SP", 2, 0, 1, [1, 1, 1, 1], 1], ["SP", 2, 5, 1, [1, 1, 1, 1], 1], ["SP", 2, 10, 1, [1, 1, 1, 1], 1], ["SP", 2, 15, 144, [1, 36, 1, 2], 1], ["SP", 2, 20, 6, [6, 1], 1], ["RE", 2, [0, 5, 10, 15, 1, 6, 11, 16, 2, 7, 12, 17, 20, 21, 3, 8, 13, 18, 22, 4, 9, 14, 19]], ["FSP", 3, 0, 1, 3], ["FSP", 3, 4, 2, 3], ["FSP", 3, 8, 3, 3], ["FSP", 3, 12, 4, 3], ["RE", 3, [0, 4, 8, 12, 1, 5, 9, 13, 2, 6, 10, 14, 3, 7, 11, 15]], ["CA", 2, 3, 11], ["CHR", 1, "shared", [2]], ["CA", 2, 3, 12], ["CHR", 0, "shared", [3]], ["CA", 1, 4, 12], ["FU", 5, [0, 1, 2, 3]], ["AN", 5, 0, 5], ["FU", 5, [1, 2, 3, 4]], ["AN", 5, 1, 4], ["FU", 5, [2, 3, 4, 5]], ["AN", 5, 2, 6], ["FU", 3, [0, 1]], ["SP", 3, 0, 2, [1], 1], ["AN", 3, 1, 2], ["FFSP", 3, 0, [4, 3, 2, 1], 1, 1], ["AN", 3, 1, 6], ["FU", 1, [0, 1, 2, 3]], ["SP", 1, 0, 1, [1], 1], ["AN", 1, 1, 2], ["FFSP", 1, 0, [4, 3, 2, 1], 1, 1], ["AN", 1, 1, 6], ["PR", 4, 0, "auto_unroll_max_step$0"]]]], "r": [[2.63339e-06, 2.63063e-06, 2.6305e-06], 0, 8.97483, 1667935333], "v": "v0.6"}
{"i": [["[\"conv1x1\", 1, 1, 1, 6, 144]", "cuda -keys=cuda,gpu -max_num_threads=1024 -model=unknown -thread_warp_size=32", [-1, 16, 64, 49152, 2147483647, 1024, 8, 32], "", 0, []], [[], [["CHW", 2, "local"], ["SP", 2, 0, 1, [1, 1, 1, 1], 1], ["SP", 2, 5, 1, [1, 1, 1, 1], 1], ["SP", 2, 10, 1, [1, 1, 1, 1], 1], ["SP", 2, 15, 144, [1, 72, 2, 1], 1], ["SP", 2, 20, 6, [1, 1], 1], ["RE", 2, [0, 5, 10, 15, 1, 6, 11, 16, 2, 7, 12, 17, 20, 21, 3, 8, 13, 18, 22, 4, 9, 14, 19]], ["FSP", 3, 0, 1, 3], ["FSP", 3, 4, 2, 3], ["FSP", 3, 8, 3, 3], ["FSP", 3, 12, 4, 3], ["RE", 3, [0, 4, 8, 12, 1, 5, 9, 13, 2, 6, 10, 14, 3, 7, 11, 15]], ["CA", 2, 3, 11], ["CHR", 1, "shared", [2]], ["CA", 2, 3, 12], ["CHR", 0, "shared", [3]], ["CA", 1, 4, 12], ["FU", 5, [0, 1, 2, 3]], ["AN", 5, 0, 5], ["FU", 5, [1, 2, 3, 4]], ["AN", 5, 1, 4], ["FU", 5, [2, 3, 4, 5]], ["AN", 5, 2, 6], ["FU", 3, [0, 1]], ["SP", 3, 0, 2, [1], 1], ["AN", 3, 1, 2], ["FFSP", 3, 0, [4, 3, 2, 1], 1, 1], ["AN", 3, 1, 6], ["FU", 1, [0, 1, 2, 3]], ["SP", 1, 0, 1, [1], 1], ["AN", 1, 1, 2], ["FFSP", 1, 0, [4, 3, 2, 1], 1, 1], ["AN", 1, 1, 6], ["PR", 4, 0, "auto_unroll_max_step$512"]]]], "r": [[2.90286e-06, 2.90088e-06, 2.91117e-06], 0, 8.57981, 1667935333], "v": "v0.6"}
{"i": [["[\"conv1x1\", 1, 1, 1, 6, 144]", "cuda -keys=cuda,gpu -max_num_threads=1024 -model=unknown -thread_warp_size=32", [-1, 16, 64, 49152, 2147483647, 1024, 8, 32], "", 0, []], [[], [["CHW", 2, "local"], ["SP", 2, 0, 1, [1, 1, 1, 1], 1], ["SP", 2, 5, 1, [1, 1, 1, 1], 1], ["SP", 2, 10, 1, [1, 1, 1, 1], 1], ["SP", 2, 15, 144, [1, 16, 9, 1], 1], ["SP", 2, 20, 6, [1, 6], 1], ["RE", 2, [0, 5, 10, 15, 1, 6, 11, 16, 2, 7, 12, 17, 20, 21, 3, 8, 13, 18, 22, 4, 9, 14, 19]], ["FSP", 3, 0, 1, 3], ["FSP", 3, 4, 2, 3], ["FSP", 3, 8, 3, 3], ["FSP", 3, 12, 4, 3], ["RE", 3, [0, 4, 8, 12, 1, 5, 9, 13, 2, 6, 10, 14, 3, 7, 11, 15]], ["CA", 2, 3, 11], ["CHR", 1, "shared", [2]], ["CA", 2, 3, 12], ["CHR", 0, "shared", [3]], ["CA", 1, 4, 12], ["FU", 5, [0, 1, 2, 3]], ["AN", 5, 0, 5], ["FU", 5, [1, 2, 3, 4]], ["AN", 5, 1, 4], ["FU", 5, [2, 3, 4, 5]], ["AN", 5, 2, 6], ["FU", 3, [0, 1]], ["SP", 3, 0, 6, [1], 1], ["AN", 3, 1, 2], ["FFSP", 3, 0, [4, 3, 2, 1], 1, 1], ["AN", 3, 1, 6], ["FU", 1, [0, 1, 2, 3]], ["SP", 1, 0, 6, [1], 1], ["AN", 1, 1, 2], ["FFSP", 1, 0, [4, 3, 2, 1], 1, 1], ["AN", 1, 1, 6], ["PR", 4, 0, "auto_unroll_max_step$512"]]]], "r": [[3.1921e-06, 3.19237e-06, 3.19752e-06], 0, 5.55812, 1667935329], "v": "v0.6"}
{"i": [["[\"conv1x1\", 1, 1, 1, 6, 144]", "cuda -keys=cuda,gpu -max_num_threads=1024 -model=unknown -thread_warp_size=32", [-1, 16, 64, 49152, 2147483647, 1024, 8, 32], "", 0, []], [[], [["CHW", 2, "local"], ["SP", 2, 0, 1, [1, 1, 1, 1], 1], ["SP", 2, 5, 1, [1, 1, 1, 1], 1], ["SP", 2, 10, 1, [1, 1, 1, 1], 1], ["SP", 2, 15, 144, [1, 12, 1, 2], 1], ["SP", 2, 20, 6, [1, 1], 1], ["RE", 2, [0, 5, 10, 15, 1, 6, 11, 16, 2, 7, 12, 17, 20, 21, 3, 8, 13, 18, 22, 4, 9, 14, 19]], ["FSP", 3, 0, 1, 3], ["FSP", 3, 4, 2, 3], ["FSP", 3, 8, 3, 3], ["FSP", 3, 12, 4, 3], ["RE", 3, [0, 4, 8, 12, 1, 5, 9, 13, 2, 6, 10, 14, 3, 7, 11, 15]], ["CA", 2, 3, 11], ["CHR", 1, "shared", [2]], ["CA", 2, 3, 12], ["CHR", 0, "shared", [3]], ["CA", 1, 4, 12], ["FU", 5, [0, 1, 2, 3]], ["AN", 5, 0, 5], ["FU", 5, [1, 2, 3, 4]], ["AN", 5, 1, 4], ["FU", 5, [2, 3, 4, 5]], ["AN", 5, 2, 6], ["FU", 3, [0, 1]], ["SP", 3, 0, 2, [1], 1], ["AN", 3, 1, 2], ["FFSP", 3, 0, [4, 3, 2, 1], 1, 1], ["AN", 3, 1, 6], ["FU", 1, [0, 1, 2, 3]], ["SP", 1, 0, 1, [1], 1], ["AN", 1, 1, 2], ["FFSP", 1, 0, [4, 3, 2, 1], 1, 1], ["AN", 1, 1, 6], ["PR", 4, 0, "auto_unroll_max_step$0"]]]], "r": [[2.76588e-06, 2.77138e-06, 2.76909e-06], 0, 9.16694, 1667935334], "v": "v0.6"}
{"i": [["[\"conv1x1\", 1, 1, 1, 6, 144]", "cuda -keys=cuda,gpu -max_num_threads=1024 -model=unknown -thread_warp_size=32", [-1, 16, 64, 49152, 2147483647, 1024, 8, 32], "", 0, []], [[], [["CHW", 2, "local"], ["SP", 2, 0, 1, [1, 1, 1, 1], 1], ["SP", 2, 5, 1, [1, 1, 1, 1], 1], ["SP", 2, 10, 1, [1, 1, 1, 1], 1], ["SP", 2, 15, 144, [1, 72, 1, 1], 1], ["SP", 2, 20, 6, [1, 2], 1], ["RE", 2, [0, 5, 10, 15, 1, 6, 11, 16, 2, 7, 12, 17, 20, 21, 3, 8, 13, 18, 22, 4, 9, 14, 19]], ["FSP", 3, 0, 1, 3], ["FSP", 3, 4, 2, 3], ["FSP", 3, 8, 3, 3], ["FSP", 3, 12, 4, 3], ["RE", 3, [0, 4, 8, 12, 1, 5, 9, 13, 2, 6, 10, 14, 3, 7, 11, 15]], ["CA", 2, 3, 11], ["CHR", 1, "shared", [2]], ["CA", 2, 3, 12], ["CHR", 0, "shared", [3]], ["CA", 1, 4, 12], ["FU", 5, [0, 1, 2, 3]], ["AN", 5, 0, 5], ["FU", 5, [1, 2, 3, 4]], ["AN", 5, 1, 4], ["FU", 5, [2, 3, 4, 5]], ["AN", 5, 2, 6], ["FU", 3, [0, 1]], ["SP", 3, 0, 6, [1], 1], ["AN", 3, 1, 2], ["FFSP", 3, 0, [4, 3, 2, 1], 1, 1], ["AN", 3, 1, 6], ["FU", 1, [0, 1, 2, 3]], ["SP", 1, 0, 6, [1], 1], ["AN", 1, 1, 2], ["FFSP", 1, 0, [4, 3, 2, 1], 1, 1], ["AN", 1, 1, 6], ["PR", 4, 0, "auto_unroll_max_step$512"]]]], "r": [[2.59142e-06, 2.59412e-06, 2.59462e-06], 0, 9.92145, 1667935334], "v": "v0.6"}
{"i": [["[\"conv1x1\", 1, 1, 1, 6, 144]", "cuda -keys=cuda,gpu -max_num_threads=1024 -model=unknown -thread_warp_size=32", [-1, 16, 64, 49152, 2147483647, 1024, 8, 32], "", 0, []], [[], [["CHW", 2, "local"], ["SP", 2, 0, 1, [1, 1, 1, 1], 1], ["SP", 2, 5, 1, [1, 1, 1, 1], 1], ["SP", 2, 10, 1, [1, 1, 1, 1], 1], ["SP", 2, 15, 144, [1, 36, 2, 2], 1], ["SP", 2, 20, 6, [6, 1], 1], ["RE", 2, [0, 5, 10, 15, 1, 6, 11, 16, 2, 7, 12, 17, 20, 21, 3, 8, 13, 18, 22, 4, 9, 14, 19]], ["FSP", 3, 0, 1, 3], ["FSP", 3, 4, 2, 3], ["FSP", 3, 8, 3, 3], ["FSP", 3, 12, 4, 3], ["RE", 3, [0, 4, 8, 12, 1, 5, 9, 13, 2, 6, 10, 14, 3, 7, 11, 15]], ["CA", 2, 3, 11], ["CHR", 1, "shared", [2]], ["CA", 2, 3, 12], ["CHR", 0, "shared", [3]], ["CA", 1, 4, 12], ["FU", 5, [0, 1, 2, 3]], ["AN", 5, 0, 5], ["FU", 5, [1, 2, 3, 4]], ["AN", 5, 1, 4], ["FU", 5, [2, 3, 4, 5]], ["AN", 5, 2, 6], ["FU", 3, [0, 1]], ["SP", 3, 0, 12, [2], 1], ["AN", 3, 1, 2], ["FFSP", 3, 0, [4, 3, 2, 1], 1, 1], ["AN", 3, 1, 6], ["FU", 1, [0, 1, 2, 3]], ["SP", 1, 0, 6, [3], 1], ["AN", 1, 1, 2], ["FFSP", 1, 0, [4, 3, 2, 1], 1, 1], ["AN", 1, 1, 6], ["PR", 4, 0, "auto_unroll_max_step$16"]]]], "r": [[2.69277e-06, 2.69822e-06, 2.69879e-06], 0, 9.51727, 1667935334], "v": "v0.6"}
{"i": [["[\"conv1x1\", 1, 1, 1, 6, 144]", "cuda -keys=cuda,gpu -max_num_threads=1024 -model=unknown -thread_warp_size=32", [-1, 16, 64, 49152, 2147483647, 1024, 8, 32], "", 0, []], [[], [["CHW", 2, "local"], ["SP", 2, 0, 1, [1, 1, 1, 1], 1], ["SP", 2, 5, 1, [1, 1, 1, 1], 1], ["SP", 2, 10, 1, [1, 1, 1, 1], 1], ["SP", 2, 15, 144, [2, 72, 1, 1], 1], ["SP", 2, 20, 6, [1, 2], 1], ["RE", 2, [0, 5, 10, 15, 1, 6, 11, 16, 2, 7, 12, 17, 20, 21, 3, 8, 13, 18, 22, 4, 9, 14, 19]], ["FSP", 3, 0, 1, 3], ["FSP", 3, 4, 2, 3], ["FSP", 3, 8, 3, 3], ["FSP", 3, 12, 4, 3], ["RE", 3, [0, 4, 8, 12, 1, 5, 9, 13, 2, 6, 10, 14, 3, 7, 11, 15]], ["CA", 2, 3, 11], ["CHR", 1, "shared", [2]], ["CA", 2, 3, 12], ["CHR", 0, "shared", [3]], ["CA", 1, 4, 12], ["FU", 5, [0, 1, 2, 3]], ["AN", 5, 0, 5], ["FU", 5, [1, 2, 3, 4]], ["AN", 5, 1, 4], ["FU", 5, [2, 3, 4, 5]], ["AN", 5, 2, 6], ["FU", 3, [0, 1]], ["SP", 3, 0, 2, [2], 1], ["AN", 3, 1, 2], ["FFSP", 3, 0, [4, 3, 2, 1], 1, 1], ["AN", 3, 1, 6], ["FU", 1, [0, 1, 2, 3]], ["SP", 1, 0, 2, [1], 1], ["AN", 1, 1, 2], ["FFSP", 1, 0, [4, 3, 2, 1], 1, 1], ["AN", 1, 1, 6], ["PR", 4, 0, "auto_unroll_max_step$64"]]]], "r": [[2.6456e-06, 2.64918e-06, 2.65558e-06], 0, 10.0839, 1667935335], "v": "v0.6"}
{"i": [["[\"conv1x1\", 1, 1, 1, 6, 144]", "cuda -keys=cuda,gpu -max_num_threads=1024 -model=unknown -thread_warp_size=32", [-1, 16, 64, 49152, 2147483647, 1024, 8, 32], "", 0, []], [[], [["CHW", 2, "local"], ["SP", 2, 0, 1, [1, 1, 1, 1], 1], ["SP", 2, 5, 1, [1, 1, 1, 1], 1], ["SP", 2, 10, 1, [1, 1, 1, 1], 1], ["SP", 2, 15, 144, [1, 72, 2, 1], 1], ["SP", 2, 20, 6, [2, 1], 1], ["RE", 2, [0, 5, 10, 15, 1, 6, 11, 16, 2, 7, 12, 17, 20, 21, 3, 8, 13, 18, 22, 4, 9, 14, 19]], ["FSP", 3, 0, 1, 3], ["FSP", 3, 4, 2, 3], ["FSP", 3, 8, 3, 3], ["FSP", 3, 12, 4, 3], ["RE", 3, [0, 4, 8, 12, 1, 5, 9, 13, 2, 6, 10, 14, 3, 7, 11, 15]], ["CA", 2, 3, 11], ["CHR", 1, "shared", [2]], ["CA", 2, 3, 12], ["CHR", 0, "shared", [3]], ["CA", 1, 4, 12], ["FU", 5, [0, 1, 2, 3]], ["AN", 5, 0, 5], ["FU", 5, [1, 2, 3, 4]], ["AN", 5, 1, 4], ["FU", 5, [2, 3, 4, 5]], ["AN", 5, 2, 6], ["FU", 3, [0, 1]], ["SP", 3, 0, 12, [1], 1], ["AN", 3, 1, 2], ["FFSP", 3, 0, [4, 3, 2, 1], 1, 1], ["AN", 3, 1, 6], ["FU", 1, [0, 1, 2, 3]], ["SP", 1, 0, 6, [1], 1], ["AN", 1, 1, 2], ["FFSP", 1, 0, [4, 3, 2, 1], 1, 1], ["AN", 1, 1, 6], ["PR", 4, 0, "auto_unroll_max_step$1024"]]]], "r": [[2.69367e-06, 2.69525e-06, 2.69415e-06], 0, 10.9305, 1667935336], "v": "v0.6"}
{"i": [["[\"conv1x1\", 1, 1, 1, 6, 144]", "cuda -keys=cuda,gpu -max_num_threads=1024 -model=unknown -thread_warp_size=32", [-1, 16, 64, 49152, 2147483647, 1024, 8, 32], "", 0, []], [[], [["CHW", 2, "local"], ["SP", 2, 0, 1, [1, 1, 1, 1], 1], ["SP", 2, 5, 1, [1, 1, 1, 1], 1], ["SP", 2, 10, 1, [1, 1, 1, 1], 1], ["SP", 2, 15, 144, [1, 36, 1, 2], 1], ["SP", 2, 20, 6, [2, 1], 1], ["RE", 2, [0, 5, 10, 15, 1, 6, 11, 16, 2, 7, 12, 17, 20, 21, 3, 8, 13, 18, 22, 4, 9, 14, 19]], ["FSP", 3, 0, 1, 3], ["FSP", 3, 4, 2, 3], ["FSP", 3, 8, 3, 3], ["FSP", 3, 12, 4, 3], ["RE", 3, [0, 4, 8, 12, 1, 5, 9, 13, 2, 6, 10, 14, 3, 7, 11, 15]], ["CA", 2, 3, 11], ["CHR", 1, "shared", [2]], ["CA", 2, 3, 12], ["CHR", 0, "shared", [3]], ["CA", 1, 4, 12], ["FU", 5, [0, 1, 2, 3]], ["AN", 5, 0, 5], ["FU", 5, [1, 2, 3, 4]], ["AN", 5, 1, 4], ["FU", 5, [2, 3, 4, 5]], ["AN", 5, 2, 6], ["FU", 3, [0, 1]], ["SP", 3, 0, 1, [1], 1], ["AN", 3, 1, 2], ["FFSP", 3, 0, [4, 3, 2, 1], 1, 1], ["AN", 3, 1, 6], ["FU", 1, [0, 1, 2, 3]], ["SP", 1, 0, 1, [1], 1], ["AN", 1, 1, 2], ["FFSP", 1, 0, [4, 3, 2, 1], 1, 1], ["AN", 1, 1, 6], ["PR", 4, 0, "auto_unroll_max_step$512"]]]], "r": [[2.64725e-06, 2.63964e-06, 2.64204e-06], 0, 11.3919, 1667935336], "v": "v0.6"}
{"i": [["[\"conv1x1\", 1, 1, 1, 6, 144]", "cuda -keys=cuda,gpu -max_num_threads=1024 -model=unknown -thread_warp_size=32", [-1, 16, 64, 49152, 2147483647, 1024, 8, 32], "", 0, []], [[], [["CHW", 2, "local"], ["SP", 2, 0, 1, [1, 1, 1, 1], 1], ["SP", 2, 5, 1, [1, 1, 1, 1], 1], ["SP", 2, 10, 1, [1, 1, 1, 1], 1], ["SP", 2, 15, 144, [1, 144, 1, 1], 1], ["SP", 2, 20, 6, [3, 2], 1], ["RE", 2, [0, 5, 10, 15, 1, 6, 11, 16, 2, 7, 12, 17, 20, 21, 3, 8, 13, 18, 22, 4, 9, 14, 19]], ["FSP", 3, 0, 1, 3], ["FSP", 3, 4, 2, 3], ["FSP", 3, 8, 3, 3], ["FSP", 3, 12, 4, 3], ["RE", 3, [0, 4, 8, 12, 1, 5, 9, 13, 2, 6, 10, 14, 3, 7, 11, 15]], ["CA", 2, 3, 11], ["CHR", 1, "shared", [2]], ["CA", 2, 3, 12], ["CHR", 0, "shared", [3]], ["CA", 1, 4, 12], ["FU", 5, [0, 1, 2, 3]], ["AN", 5, 0, 5], ["FU", 5, [1, 2, 3, 4]], ["AN", 5, 1, 4], ["FU", 5, [2, 3, 4, 5]], ["AN", 5, 2, 6], ["FU", 3, [0, 1]], ["SP", 3, 0, 6, [1], 1], ["AN", 3, 1, 2], ["FFSP", 3, 0, [4, 3, 2, 1], 1, 1], ["AN", 3, 1, 6], ["FU", 1, [0, 1, 2, 3]], ["SP", 1, 0, 6, [1], 1], ["AN", 1, 1, 2], ["FFSP", 1, 0, [4, 3, 2, 1], 1, 1], ["AN", 1, 1, 6], ["PR", 4, 0, "auto_unroll_max_step$1024"]]]], "r": [[2.55041e-06, 2.55178e-06, 2.54872e-06], 0, 12.0675, 1667935337], "v": "v0.6"}
{"i": [["[\"conv1x1\", 1, 1, 1, 6, 144]", "cuda -keys=cuda,gpu -max_num_threads=1024 -model=unknown -thread_warp_size=32", [-1, 16, 64, 49152, 2147483647, 1024, 8, 32], "", 0, []], [[], [["CHW", 2, "local"], ["SP", 2, 0, 1, [1, 1, 1, 1], 1], ["SP", 2, 5, 1, [1, 1, 1, 1], 1], ["SP", 2, 10, 1, [1, 1, 1, 1], 1], ["SP", 2, 15, 144, [2, 72, 1, 1], 1], ["SP", 2, 20, 6, [3, 2], 1], ["RE", 2, [0, 5, 10, 15, 1, 6, 11, 16, 2, 7, 12, 17, 20, 21, 3, 8, 13, 18, 22, 4, 9, 14, 19]], ["FSP", 3, 0, 1, 3], ["FSP", 3, 4, 2, 3], ["FSP", 3, 8, 3, 3], ["FSP", 3, 12, 4, 3], ["RE", 3, [0, 4, 8, 12, 1, 5, 9, 13, 2, 6, 10, 14, 3, 7, 11, 15]], ["CA", 2, 3, 11], ["CHR", 1, "shared", [2]], ["CA", 2, 3, 12], ["CHR", 0, "shared", [3]], ["CA", 1, 4, 12], ["FU", 5, [0, 1, 2, 3]], ["AN", 5, 0, 5], ["FU", 5, [1, 2, 3, 4]], ["AN", 5, 1, 4], ["FU", 5, [2, 3, 4, 5]], ["AN", 5, 2, 6], ["FU", 3, [0, 1]], ["SP", 3, 0, 6, [2], 1], ["AN", 3, 1, 2], ["FFSP", 3, 0, [4, 3, 2, 1], 1, 1], ["AN", 3, 1, 6], ["FU", 1, [0, 1, 2, 3]], ["SP", 1, 0, 6, [1], 1], ["AN", 1, 1, 2], ["FFSP", 1, 0, [4, 3, 2, 1], 1, 1], ["AN", 1, 1, 6], ["PR", 4, 0, "auto_unroll_max_step$0"]]]], "r": [[2.55347e-06, 2.55132e-06, 2.54875e-06], 0, 10.9688, 1667935336], "v": "v0.6"}
{"i": [["[\"conv1x1\", 1, 1, 1, 6, 144]", "cuda -keys=cuda,gpu -max_num_threads=1024 -model=unknown -thread_warp_size=32", [-1, 16, 64, 49152, 2147483647, 1024, 8, 32], "", 0, []], [[], [["CHW", 2, "local"], ["SP", 2, 0, 1, [1, 1, 1, 1], 1], ["SP", 2, 5, 1, [1, 1, 1, 1], 1], ["SP", 2, 10, 1, [1, 1, 1, 1], 1], ["SP", 2, 15, 144, [1, 2, 36, 1], 1], ["SP", 2, 20, 6, [6, 1], 1], ["RE", 2, [0, 5, 10, 15, 1, 6, 11, 16, 2, 7, 12, 17, 20, 21, 3, 8, 13, 18, 22, 4, 9, 14, 19]], ["FSP", 3, 0, 1, 3], ["FSP", 3, 4, 2, 3], ["FSP", 3, 8, 3, 3], ["FSP", 3, 12, 4, 3], ["RE", 3, [0, 4, 8, 12, 1, 5, 9, 13, 2, 6, 10, 14, 3, 7, 11, 15]], ["CA", 2, 3, 11], ["CHR", 1, "shared", [2]], ["CA", 2, 3, 12], ["CHR", 0, "shared", [3]], ["CA", 1, 4, 12], ["FU", 5, [0, 1, 2, 3]], ["AN", 5, 0, 5], ["FU", 5, [1, 2, 3, 4]], ["AN", 5, 1, 4], ["FU", 5, [2, 3, 4, 5]], ["AN", 5, 2, 6], ["FU", 3, [0, 1]], ["SP", 3, 0, 6, [1], 1], ["AN", 3, 1, 2], ["FFSP", 3, 0, [4, 3, 2, 1], 1, 1], ["AN", 3, 1, 6], ["FU", 1, [0, 1, 2, 3]], ["SP", 1, 0, 6, [1], 1], ["AN", 1, 1, 2], ["FFSP", 1, 0, [4, 3, 2, 1], 1, 1], ["AN", 1, 1, 6], ["PR", 4, 0, "auto_unroll_max_step$1024"]]]], "r": [[6.48697e-06, 6.48661e-06, 6.48731e-06], 0, 13.1187, 1667935338], "v": "v0.6"}
{"i": [["[\"conv1x1\", 1, 1, 1, 6, 144]", "cuda -keys=cuda,gpu -max_num_threads=1024 -model=unknown -thread_warp_size=32", [-1, 16, 64, 49152, 2147483647, 1024, 8, 32], "", 0, []], [[], [["CHW", 2, "local"], ["SP", 2, 0, 1, [1, 1, 1, 1], 1], ["SP", 2, 5, 1, [1, 1, 1, 1], 1], ["SP", 2, 10, 1, [1, 1, 1, 1], 1], ["SP", 2, 15, 144, [1, 48, 1, 3], 1], ["SP", 2, 20, 6, [1, 1], 1], ["RE", 2, [0, 5, 10, 15, 1, 6, 11, 16, 2, 7, 12, 17, 20, 21, 3, 8, 13, 18, 22, 4, 9, 14, 19]], ["FSP", 3, 0, 1, 3], ["FSP", 3, 4, 2, 3], ["FSP", 3, 8, 3, 3], ["FSP", 3, 12, 4, 3], ["RE", 3, [0, 4, 8, 12, 1, 5, 9, 13, 2, 6, 10, 14, 3, 7, 11, 15]], ["CA", 2, 3, 11], ["CHR", 1, "shared", [2]], ["CA", 2, 3, 12], ["CHR", 0, "shared", [3]], ["CA", 1, 4, 12], ["FU", 5, [0, 1, 2, 3]], ["AN", 5, 0, 5], ["FU", 5, [1, 2, 3, 4]], ["AN", 5, 1, 4], ["FU", 5, [2, 3, 4, 5]], ["AN", 5, 2, 6], ["FU", 3, [0, 1]], ["SP", 3, 0, 9, [1], 1], ["AN", 3, 1, 2], ["FFSP", 3, 0, [4, 3, 2, 1], 1, 1], ["AN", 3, 1, 6], ["FU", 1, [0, 1, 2, 3]], ["SP", 1, 0, 3, [1], 1], ["AN", 1, 1, 2], ["FFSP", 1, 0, [4, 3, 2, 1], 1, 1], ["AN", 1, 1, 6], ["PR", 4, 0, "auto_unroll_max_step$512"]]]], "r": [[3.13244e-06, 3.13687e-06, 3.14351e-06], 0, 13.0312, 1667935338], "v": "v0.6"}
{"i": [["[\"conv1x1\", 1, 1, 1, 6, 144]", "cuda -keys=cuda,gpu -max_num_threads=1024 -model=unknown -thread_warp_size=32", [-1, 16, 64, 49152, 2147483647, 1024, 8, 32], "", 0, []], [[], [["CHW", 2, "local"], ["SP", 2, 0, 1, [1, 1, 1, 1], 1], ["SP", 2, 5, 1, [1, 1, 1, 1], 1], ["SP", 2, 10, 1, [1, 1, 1, 1], 1], ["SP", 2, 15, 144, [1, 72, 1, 1], 1], ["SP", 2, 20, 6, [1, 1], 1], ["RE", 2, [0, 5, 10, 15, 1, 6, 11, 16, 2, 7, 12, 17, 20, 21, 3, 8, 13, 18, 22, 4, 9, 14, 19]], ["FSP", 3, 0, 1, 3], ["FSP", 3, 4, 2, 3], ["FSP", 3, 8, 3, 3], ["FSP", 3, 12, 4, 3], ["RE", 3, [0, 4, 8, 12, 1, 5, 9, 13, 2, 6, 10, 14, 3, 7, 11, 15]], ["CA", 2, 3, 11], ["CHR", 1, "shared", [2]], ["CA", 2, 3, 12], ["CHR", 0, "shared", [3]], ["CA", 1, 4, 12], ["FU", 5, [0, 1, 2, 3]], ["AN", 5, 0, 5], ["FU", 5, [1, 2, 3, 4]], ["AN", 5, 1, 4], ["FU", 5, [2, 3, 4, 5]], ["AN", 5, 2, 6], ["FU", 3, [0, 1]], ["SP", 3, 0, 3, [1], 1], ["AN", 3, 1, 2], ["FFSP", 3, 0, [4, 3, 2, 1], 1, 1], ["AN", 3, 1, 6], ["FU", 1, [0, 1, 2, 3]], ["SP", 1, 0, 3, [1], 1], ["AN", 1, 1, 2], ["FFSP", 1, 0, [4, 3, 2, 1], 1, 1], ["AN", 1, 1, 6], ["PR", 4, 0, "auto_unroll_max_step$0"]]]], "r": [[2.88761e-06, 2.88897e-06, 2.89547e-06], 0, 13.3489, 1667935339], "v": "v0.6"}
{"i": [["[\"conv1x1\", 1, 1, 1, 6, 144]", "cuda -keys=cuda,gpu -max_num_threads=1024 -model=unknown -thread_warp_size=32", [-1, 16, 64, 49152, 2147483647, 1024, 8, 32], "", 0, []], [[], [["CHW", 2, "local"], ["SP", 2, 0, 1, [1, 1, 1, 1], 1], ["SP", 2, 5, 1, [1, 1, 1, 1], 1], ["SP", 2, 10, 1, [1, 1, 1, 1], 1], ["SP", 2, 15, 144, [1, 72, 1, 1], 1], ["SP", 2, 20, 6, [1, 3], 1], ["RE", 2, [0, 5, 10, 15, 1, 6, 11, 16, 2, 7, 12, 17, 20, 21, 3, 8, 13, 18, 22, 4, 9, 14, 19]], ["FSP", 3, 0, 1, 3], ["FSP", 3, 4, 2, 3], ["FSP", 3, 8, 3, 3], ["FSP", 3, 12, 4, 3], ["RE", 3, [0, 4, 8, 12, 1, 5, 9, 13, 2, 6, 10, 14, 3, 7, 11, 15]], ["CA", 2, 3, 11], ["CHR", 1, "shared", [2]], ["CA", 2, 3, 12], ["CHR", 0, "shared", [3]], ["CA", 1, 4, 12], ["FU", 5, [0, 1, 2, 3]], ["AN", 5, 0, 5], ["FU", 5, [1, 2, 3, 4]], ["AN", 5, 1, 4], ["FU", 5, [2, 3, 4, 5]], ["AN", 5, 2, 6], ["FU", 3, [0, 1]], ["SP", 3, 0, 3, [3], 1], ["AN", 3, 1, 2], ["FFSP", 3, 0, [4, 3, 2, 1], 1, 1], ["AN", 3, 1, 6], ["FU", 1, [0, 1, 2, 3]], ["SP", 1, 0, 3, [1], 1], ["AN", 1, 1, 2], ["FFSP", 1, 0, [4, 3, 2, 1], 1, 1], ["AN", 1, 1, 6], ["PR", 4, 0, "auto_unroll_max_step$512"]]]], "r": [[2.73473e-06, 2.73012e-06, 2.7413e-06], 0, 12.8051, 1667935338], "v": "v0.6"}
{"i": [["[\"conv1x1\", 1, 1, 1, 6, 144]", "cuda -keys=cuda,gpu -max_num_threads=1024 -model=unknown -thread_warp_size=32", [-1, 16, 64, 49152, 2147483647, 1024, 8, 32], "", 0, []], [[], [["CHW", 2, "local"], ["SP", 2, 0, 1, [1, 1, 1, 1], 1], ["SP", 2, 5, 1, [1, 1, 1, 1], 1], ["SP", 2, 10, 1, [1, 1, 1, 1], 1], ["SP", 2, 15, 144, [1, 48, 3, 1], 1], ["SP", 2, 20, 6, [1, 1], 1], ["RE", 2, [0, 5, 10, 15, 1, 6, 11, 16, 2, 7, 12, 17, 20, 21, 3, 8, 13, 18, 22, 4, 9, 14, 19]], ["FSP", 3, 0, 1, 3], ["FSP", 3, 4, 2, 3], ["FSP", 3, 8, 3, 3], ["FSP", 3, 12, 4, 3], ["RE", 3, [0, 4, 8, 12, 1, 5, 9, 13, 2, 6, 10, 14, 3, 7, 11, 15]], ["CA", 2, 3, 11], ["CHR", 1, "shared", [2]], ["CA", 2, 3, 12], ["CHR", 0, "shared", [3]], ["CA", 1, 4, 12], ["FU", 5, [0, 1, 2, 3]], ["AN", 5, 0, 5], ["FU", 5, [1, 2, 3, 4]], ["AN", 5, 1, 4], ["FU", 5, [2, 3, 4, 5]], ["AN", 5, 2, 6], ["FU", 3, [0, 1]], ["SP", 3, 0, 9, [1], 1], ["AN", 3, 1, 2], ["FFSP", 3, 0, [4, 3, 2, 1], 1, 1], ["AN", 3, 1, 6], ["FU", 1, [0, 1, 2, 3]], ["SP", 1, 0, 3, [3], 1], ["AN", 1, 1, 2], ["FFSP", 1, 0, [4, 3, 2, 1], 1, 1], ["AN", 1, 1, 6], ["PR", 4, 0, "auto_unroll_max_step$512"]]]], "r": [[3.13228e-06, 3.12948e-06, 3.13744e-06], 0, 10.3337, 1667935335], "v": "v0.6"}
