python/models/efficientnet/VertiFusionEfficientNet_kernel_configs/efficient_sigmoid_1_56_56_144.log
{"i": [["[\"sigmoid\", 1, 56, 56, 144]", "cuda -keys=cuda,gpu -max_num_threads=1024 -model=unknown -thread_warp_size=32", [-1, 16, 64, 49152, 2147483647, 1024, 8, 32], "", 0, []], [[], [["FU", 1, [0, 1, 2, 3]], ["SP", 1, 0, 451584, [49], 1], ["AN", 1, 0, 5], ["AN", 1, 1, 6]]]], "r": [[9.67618e-06, 9.68548e-06, 9.68788e-06], 0, 2.54749, 1667925593], "v": "v0.6"}
{"i": [["[\"sigmoid\", 1, 56, 56, 144]", "cuda -keys=cuda,gpu -max_num_threads=1024 -model=unknown -thread_warp_size=32", [-1, 16, 64, 49152, 2147483647, 1024, 8, 32], "", 0, []], [[], [["FU", 1, [0, 1, 2, 3]], ["SP", 1, 0, 451584, [36], 1], ["AN", 1, 0, 5], ["AN", 1, 1, 6]]]], "r": [[1.20366e-05, 1.20512e-05, 1.20495e-05], 0, 2.24732, 1667925593], "v": "v0.6"}
{"i": [["[\"sigmoid\", 1, 56, 56, 144]", "cuda -keys=cuda,gpu -max_num_threads=1024 -model=unknown -thread_warp_size=32", [-1, 16, 64, 49152, 2147483647, 1024, 8, 32], "", 0, []], [[], [["FU", 1, [0, 1, 2, 3]], ["SP", 1, 0, 451584, [21], 1], ["AN", 1, 0, 5], ["AN", 1, 1, 6]]]], "r": [[1.88993e-05, 1.89112e-05, 1.89107e-05], 0, 1.31246, 1667925592], "v": "v0.6"}
{"i": [["[\"sigmoid\", 1, 56, 56, 144]", "cuda -keys=cuda,gpu -max_num_threads=1024 -model=unknown -thread_warp_size=32", [-1, 16, 64, 49152, 2147483647, 1024, 8, 32], "", 0, []], [[], [["FU", 1, [0, 1, 2, 3]], ["SP", 1, 0, 451584, [16], 1], ["AN", 1, 0, 5], ["AN", 1, 1, 6]]]], "r": [[2.40072e-05, 2.40275e-05, 2.40211e-05], 0, 0.999405, 1667925591], "v": "v0.6"}
{"i": [["[\"sigmoid\", 1, 56, 56, 144]", "cuda -keys=cuda,gpu -max_num_threads=1024 -model=unknown -thread_warp_size=32", [-1, 16, 64, 49152, 2147483647, 1024, 8, 32], "", 0, []], [[], [["FU", 1, [0, 1, 2, 3]], ["SP", 1, 0, 451584, [24], 1], ["AN", 1, 0, 5], ["AN", 1, 1, 6]]]], "r": [[1.6922e-05, 1.6934e-05, 1.69347e-05], 0, 0.628772, 1667925591], "v": "v0.6"}
{"i": [["[\"sigmoid\", 1, 56, 56, 144]", "cuda -keys=cuda,gpu -max_num_threads=1024 -model=unknown -thread_warp_size=32", [-1, 16, 64, 49152, 2147483647, 1024, 8, 32], "", 0, []], [[], [["FU", 1, [0, 1, 2, 3]], ["SP", 1, 0, 451584, [9], 1], ["AN", 1, 0, 5], ["AN", 1, 1, 6]]]], "r": [[4.02221e-05, 4.02423e-05, 4.02423e-05], 0, 1.96743, 1667925592], "v": "v0.6"}
{"i": [["[\"sigmoid\", 1, 56, 56, 144]", "cuda -keys=cuda,gpu -max_num_threads=1024 -model=unknown -thread_warp_size=32", [-1, 16, 64, 49152, 2147483647, 1024, 8, 32], "", 0, []], [[], [["FU", 1, [0, 1, 2, 3]], ["SP", 1, 0, 451584, [12], 1], ["AN", 1, 0, 5], ["AN", 1, 1, 6]]]], "r": [[3.09527e-05, 3.09639e-05, 3.09759e-05], 0, 1.62324, 1667925592], "v": "v0.6"}
{"i": [["[\"sigmoid\", 1, 56, 56, 144]", "cuda -keys=cuda,gpu -max_num_threads=1024 -model=unknown -thread_warp_size=32", [-1, 16, 64, 49152, 2147483647, 1024, 8, 32], "", 0, []], [[], [["FU", 1, [0, 1, 2, 3]], ["SP", 1, 0, 451584, [28], 1], ["AN", 1, 0, 5], ["AN", 1, 1, 6]]]], "r": [[1.51138e-05, 1.51235e-05, 1.51239e-05], 0, 2.84254, 1667925593], "v": "v0.6"}
{"i": [["[\"sigmoid\", 1, 56, 56, 144]", "cuda -keys=cuda,gpu -max_num_threads=1024 -model=unknown -thread_warp_size=32", [-1, 16, 64, 49152, 2147483647, 1024, 8, 32], "", 0, []], [[], [["FU", 1, [0, 1, 2, 3]], ["SP", 1, 0, 451584, [56], 1], ["AN", 1, 0, 5], ["AN", 1, 1, 6]]]], "r": [[8.72005e-06, 8.73614e-06, 8.72979e-06], 0, 3.35419, 1667925594], "v": "v0.6"}
{"i": [["[\"sigmoid\", 1, 56, 56, 144]", "cuda -keys=cuda,gpu -max_num_threads=1024 -model=unknown -thread_warp_size=32", [-1, 16, 64, 49152, 2147483647, 1024, 8, 32], "", 0, []], [[], [["FU", 1, [0, 1, 2, 3]], ["SP", 1, 0, 451584, [3], 1], ["AN", 1, 0, 5], ["AN", 1, 1, 6]]]], "r": [[0.00011455, 0.000114621, 0.000114608], 0, 3.03743, 1667925594], "v": "v0.6"}
{"i": [["[\"sigmoid\", 1, 56, 56, 144]", "cuda -keys=cuda,gpu -max_num_threads=1024 -model=unknown -thread_warp_size=32", [-1, 16, 64, 49152, 2147483647, 1024, 8, 32], "", 0, []], [[], [["FU", 1, [0, 1, 2, 3]], ["SP", 1, 0, 451584, [63], 1], ["AN", 1, 0, 5], ["AN", 1, 1, 6]]]], "r": [[7.98266e-06, 7.99517e-06, 7.99038e-06], 0, 3.68579, 1667925595], "v": "v0.6"}
{"i": [["[\"sigmoid\", 1, 56, 56, 144]", "cuda -keys=cuda,gpu -max_num_threads=1024 -model=unknown -thread_warp_size=32", [-1, 16, 64, 49152, 2147483647, 1024, 8, 32], "", 0, []], [[], [["FU", 1, [0, 1, 2, 3]], ["SP", 1, 0, 451584, [8], 1], ["AN", 1, 0, 5], ["AN", 1, 1, 6]]]], "r": [[4.47248e-05, 4.473e-05, 4.4732e-05], 0, 4.23586, 1667925595], "v": "v0.6"}
{"i": [["[\"sigmoid\", 1, 56, 56, 144]", "cuda -keys=cuda,gpu -max_num_threads=1024 -model=unknown -thread_warp_size=32", [-1, 16, 64, 49152, 2147483647, 1024, 8, 32], "", 0, []], [[], [["FU", 1, [0, 1, 2, 3]], ["SP", 1, 0, 451584, [4], 1], ["AN", 1, 0, 5], ["AN", 1, 1, 6]]]], "r": [[8.65834e-05, 8.65923e-05, 8.65911e-05], 0, 3.9108, 1667925595], "v": "v0.6"}
{"i": [["[\"sigmoid\", 1, 56, 56, 144]", "cuda -keys=cuda,gpu -max_num_threads=1024 -model=unknown -thread_warp_size=32", [-1, 16, 64, 49152, 2147483647, 1024, 8, 32], "", 0, []], [[], [["FU", 1, [0, 1, 2, 3]], ["SP", 1, 0, 451584, [32], 1], ["AN", 1, 0, 5], ["AN", 1, 1, 6]]]], "r": [[1.34792e-05, 1.34928e-05, 1.34879e-05], 0, 4.51808, 1667925596], "v": "v0.6"}
{"i": [["[\"sigmoid\", 1, 56, 56, 144]", "cuda -keys=cuda,gpu -max_num_threads=1024 -model=unknown -thread_warp_size=32", [-1, 16, 64, 49152, 2147483647, 1024, 8, 32], "", 0, []], [[], [["FU", 1, [0, 1, 2, 3]], ["SP", 1, 0, 451584, [48], 1], ["AN", 1, 0, 5], ["AN", 1, 1, 6]]]], "r": [[9.7361e-06, 9.72476e-06, 9.73383e-06], 0, 4.79119, 1667925596], "v": "v0.6"}
{"i": [["[\"sigmoid\", 1, 56, 56, 144]", "cuda -keys=cuda,gpu -max_num_threads=1024 -model=unknown -thread_warp_size=32", [-1, 16, 64, 49152, 2147483647, 1024, 8, 32], "", 0, []], [[], [["FU", 1, [0, 1, 2, 3]], ["SP", 1, 0, 451584, [64], 1], ["AN", 1, 0, 5], ["AN", 1, 1, 6]]]], "r": [[7.94307e-06, 7.9559e-06, 7.95306e-06], 0, 5.07453, 1667925596], "v": "v0.6"}
{"i": [["[\"sigmoid\", 1, 56, 56, 144]", "cuda -keys=cuda,gpu -max_num_threads=1024 -model=unknown -thread_warp_size=32", [-1, 16, 64, 49152, 2147483647, 1024, 8, 32], "", 0, []], [[], [["FU", 1, [0, 1, 2, 3]], ["SP", 1, 0, 451584, [2], 1], ["AN", 1, 0, 5], ["AN", 1, 1, 6]]]], "r": [[0.000170451, 0.000170421, 0.000170454], 0, 5.35564, 1667925597], "v": "v0.6"}
{"i": [["[\"sigmoid\", 1, 56, 56, 144]", "cuda -keys=cuda,gpu -max_num_threads=1024 -model=unknown -thread_warp_size=32", [-1, 16, 64, 49152, 2147483647, 1024, 8, 32], "", 0, []], [[], [["FU", 1, [0, 1, 2, 3]], ["SP", 1, 0, 451584, [6], 1], ["AN", 1, 0, 5], ["AN", 1, 1, 6]]]], "r": [[5.87844e-05, 5.87951e-05, 5.87938e-05], 0, 5.64311, 1667925597], "v": "v0.6"}
{"i": [["[\"sigmoid\", 1, 56, 56, 144]", "cuda -keys=cuda,gpu -max_num_threads=1024 -model=unknown -thread_warp_size=32", [-1, 16, 64, 49152, 2147483647, 1024, 8, 32], "", 0, []], [[], [["FU", 1, [0, 1, 2, 3]], ["SP", 1, 0, 451584, [18], 1], ["AN", 1, 0, 5], ["AN", 1, 1, 6]]]], "r": [[2.1611e-05, 2.16073e-05, 2.16014e-05], 0, 5.94241, 1667925597], "v": "v0.6"}
{"i": [["[\"sigmoid\", 1, 56, 56, 144]", "cuda -keys=cuda,gpu -max_num_threads=1024 -model=unknown -thread_warp_size=32", [-1, 16, 64, 49152, 2147483647, 1024, 8, 32], "", 0, []], [[], [["FU", 1, [0, 1, 2, 3]], ["SP", 1, 0, 451584, [14], 1], ["AN", 1, 0, 5], ["AN", 1, 1, 6]]]], "r": [[2.69647e-05, 2.69831e-05, 2.69868e-05], 0, 6.27263, 1667925598], "v": "v0.6"}
{"i": [["[\"sigmoid\", 1, 56, 56, 144]", "cuda -keys=cuda,gpu -max_num_threads=1024 -model=unknown -thread_warp_size=32", [-1, 16, 64, 49152, 2147483647, 1024, 8, 32], "", 0, []], [[], [["FU", 1, [0, 1, 2, 3]], ["SP", 1, 0, 451584, [16], 1], ["AN", 1, 0, 5], ["AN", 1, 1, 6]]]], "r": [[2.39247e-05, 2.39302e-05, 2.39329e-05], 0, 1.30051, 1667934377], "v": "v0.6"}
{"i": [["[\"sigmoid\", 1, 56, 56, 144]", "cuda -keys=cuda,gpu -max_num_threads=1024 -model=unknown -thread_warp_size=32", [-1, 16, 64, 49152, 2147483647, 1024, 8, 32], "", 0, []], [[], [["FU", 1, [0, 1, 2, 3]], ["SP", 1, 0, 451584, [4], 1], ["AN", 1, 0, 5], ["AN", 1, 1, 6]]]], "r": [[8.66135e-05, 8.66279e-05, 8.66234e-05], 0, 1.0636, 1667934377], "v": "v0.6"}
{"i": [["[\"sigmoid\", 1, 56, 56, 144]", "cuda -keys=cuda,gpu -max_num_threads=1024 -model=unknown -thread_warp_size=32", [-1, 16, 64, 49152, 2147483647, 1024, 8, 32], "", 0, []], [[], [["FU", 1, [0, 1, 2, 3]], ["SP", 1, 0, 451584, [18], 1], ["AN", 1, 0, 5], ["AN", 1, 1, 6]]]], "r": [[2.15665e-05, 2.15754e-05, 2.15666e-05], 0, 1.62425, 1667934378], "v": "v0.6"}
{"i": [["[\"sigmoid\", 1, 56, 56, 144]", "cuda -keys=cuda,gpu -max_num_threads=1024 -model=unknown -thread_warp_size=32", [-1, 16, 64, 49152, 2147483647, 1024, 8, 32], "", 0, []], [[], [["FU", 1, [0, 1, 2, 3]], ["SP", 1, 0, 451584, [49], 1], ["AN", 1, 0, 5], ["AN", 1, 1, 6]]]], "r": [[9.66501e-06, 9.67656e-06, 9.68043e-06], 0, 1.98899, 1667934378], "v": "v0.6"}
{"i": [["[\"sigmoid\", 1, 56, 56, 144]", "cuda -keys=cuda,gpu -max_num_threads=1024 -model=unknown -thread_warp_size=32", [-1, 16, 64, 49152, 2147483647, 1024, 8, 32], "", 0, []], [[], [["FU", 1, [0, 1, 2, 3]], ["SP", 1, 0, 451584, [3], 1], ["AN", 1, 0, 5], ["AN", 1, 1, 6]]]], "r": [[0.000114505, 0.000114508, 0.000114502], 0, 2.61142, 1667934379], "v": "v0.6"}
{"i": [["[\"sigmoid\", 1, 56, 56, 144]", "cuda -keys=cuda,gpu -max_num_threads=1024 -model=unknown -thread_warp_size=32", [-1, 16, 64, 49152, 2147483647, 1024, 8, 32], "", 0, []], [[], [["FU", 1, [0, 1, 2, 3]], ["SP", 1, 0, 451584, [7], 1], ["AN", 1, 0, 5], ["AN", 1, 1, 6]]]], "r": [[5.06645e-05, 5.06708e-05, 5.06846e-05], 0, 2.27604, 1667934378], "v": "v0.6"}
{"i": [["[\"sigmoid\", 1, 56, 56, 144]", "cuda -keys=cuda,gpu -max_num_threads=1024 -model=unknown -thread_warp_size=32", [-1, 16, 64, 49152, 2147483647, 1024, 8, 32], "", 0, []], [[], [["FU", 1, [0, 1, 2, 3]], ["SP", 1, 0, 451584, [64], 1], ["AN", 1, 0, 5], ["AN", 1, 1, 6]]]], "r": [[8.00181e-06, 8.0182e-06, 8.01994e-06], 0, 0.68252, 1667934377], "v": "v0.6"}
{"i": [["[\"sigmoid\", 1, 56, 56, 144]", "cuda -keys=cuda,gpu -max_num_threads=1024 -model=unknown -thread_warp_size=32", [-1, 16, 64, 49152, 2147483647, 1024, 8, 32], "", 0, []], [[], [["FU", 1, [0, 1, 2, 3]], ["SP", 1, 0, 451584, [42], 1], ["AN", 1, 0, 5], ["AN", 1, 1, 6]]]], "r": [[1.07083e-05, 1.07146e-05, 1.07178e-05], 0, 2.9307, 1667934379], "v": "v0.6"}
{"i": [["[\"sigmoid\", 1, 56, 56, 144]", "cuda -keys=cuda,gpu -max_num_threads=1024 -model=unknown -thread_warp_size=32", [-1, 16, 64, 49152, 2147483647, 1024, 8, 32], "", 0, []], [[], [["FU", 1, [0, 1, 2, 3]], ["SP", 1, 0, 451584, [1], 1], ["AN", 1, 0, 5], ["AN", 1, 1, 6]]]], "r": [[0.000337817, 0.000337782, 0.000337807], 0, 3.22344, 1667934379], "v": "v0.6"}
{"i": [["[\"sigmoid\", 1, 56, 56, 144]", "cuda -keys=cuda,gpu -max_num_threads=1024 -model=unknown -thread_warp_size=32", [-1, 16, 64, 49152, 2147483647, 1024, 8, 32], "", 0, []], [[], [["FU", 1, [0, 1, 2, 3]], ["SP", 1, 0, 451584, [28], 1], ["AN", 1, 0, 5], ["AN", 1, 1, 6]]]], "r": [[1.50124e-05, 1.50242e-05, 1.50289e-05], 0, 3.43356, 1667934380], "v": "v0.6"}
{"i": [["[\"sigmoid\", 1, 56, 56, 144]", "cuda -keys=cuda,gpu -max_num_threads=1024 -model=unknown -thread_warp_size=32", [-1, 16, 64, 49152, 2147483647, 1024, 8, 32], "", 0, []], [[], [["FU", 1, [0, 1, 2, 3]], ["SP", 1, 0, 451584, [63], 1], ["AN", 1, 0, 5], ["AN", 1, 1, 6]]]], "r": [[8.02283e-06, 8.0273e-06, 8.02755e-06], 0, 3.67421, 1667934380], "v": "v0.6"}
{"i": [["[\"sigmoid\", 1, 56, 56, 144]", "cuda -keys=cuda,gpu -max_num_threads=1024 -model=unknown -thread_warp_size=32", [-1, 16, 64, 49152, 2147483647, 1024, 8, 32], "", 0, []], [[], [["FU", 1, [0, 1, 2, 3]], ["SP", 1, 0, 451584, [21], 1], ["AN", 1, 0, 5], ["AN", 1, 1, 6]]]], "r": [[1.892e-05, 1.89261e-05, 1.89322e-05], 0, 4.30513, 1667934381], "v": "v0.6"}
{"i": [["[\"sigmoid\", 1, 56, 56, 144]", "cuda -keys=cuda,gpu -max_num_threads=1024 -model=unknown -thread_warp_size=32", [-1, 16, 64, 49152, 2147483647, 1024, 8, 32], "", 0, []], [[], [["FU", 1, [0, 1, 2, 3]], ["SP", 1, 0, 451584, [48], 1], ["AN", 1, 0, 5], ["AN", 1, 1, 6]]]], "r": [[9.72225e-06, 9.731e-06, 9.72487e-06], 0, 4.62109, 1667934381], "v": "v0.6"}
{"i": [["[\"sigmoid\", 1, 56, 56, 144]", "cuda -keys=cuda,gpu -max_num_threads=1024 -model=unknown -thread_warp_size=32", [-1, 16, 64, 49152, 2147483647, 1024, 8, 32], "", 0, []], [[], [["FU", 1, [0, 1, 2, 3]], ["SP", 1, 0, 451584, [9], 1], ["AN", 1, 0, 5], ["AN", 1, 1, 6]]]], "r": [[4.00887e-05, 4.01059e-05, 4.01004e-05], 0, 4.86139, 1667934382], "v": "v0.6"}
{"i": [["[\"sigmoid\", 1, 56, 56, 144]", "cuda -keys=cuda,gpu -max_num_threads=1024 -model=unknown -thread_warp_size=32", [-1, 16, 64, 49152, 2147483647, 1024, 8, 32], "", 0, []], [[], [["FU", 1, [0, 1, 2, 3]], ["SP", 1, 0, 451584, [6], 1], ["AN", 1, 0, 5], ["AN", 1, 1, 6]]]], "r": [[5.88828e-05, 5.88812e-05, 5.88596e-05], 0, 5.1461, 1667934382], "v": "v0.6"}
{"i": [["[\"sigmoid\", 1, 56, 56, 144]", "cuda -keys=cuda,gpu -max_num_threads=1024 -model=unknown -thread_warp_size=32", [-1, 16, 64, 49152, 2147483647, 1024, 8, 32], "", 0, []], [[], [["FU", 1, [0, 1, 2, 3]], ["SP", 1, 0, 451584, [2], 1], ["AN", 1, 0, 5], ["AN", 1, 1, 6]]]], "r": [[0.000170557, 0.000170552, 0.000170574], 0, 5.4433, 1667934382], "v": "v0.6"}
{"i": [["[\"sigmoid\", 1, 56, 56, 144]", "cuda -keys=cuda,gpu -max_num_threads=1024 -model=unknown -thread_warp_size=32", [-1, 16, 64, 49152, 2147483647, 1024, 8, 32], "", 0, []], [[], [["FU", 1, [0, 1, 2, 3]], ["SP", 1, 0, 451584, [12], 1], ["AN", 1, 0, 5], ["AN", 1, 1, 6]]]], "r": [[3.09709e-05, 3.09947e-05, 3.09849e-05], 0, 5.74703, 1667934383], "v": "v0.6"}
{"i": [["[\"sigmoid\", 1, 56, 56, 144]", "cuda -keys=cuda,gpu -max_num_threads=1024 -model=unknown -thread_warp_size=32", [-1, 16, 64, 49152, 2147483647, 1024, 8, 32], "", 0, []], [[], [["FU", 1, [0, 1, 2, 3]], ["SP", 1, 0, 451584, [8], 1], ["AN", 1, 0, 5], ["AN", 1, 1, 6]]]], "r": [[4.46236e-05, 4.46266e-05, 4.46317e-05], 0, 6.05091, 1667934383], "v": "v0.6"}
{"i": [["[\"sigmoid\", 1, 56, 56, 144]", "cuda -keys=cuda,gpu -max_num_threads=1024 -model=unknown -thread_warp_size=32", [-1, 16, 64, 49152, 2147483647, 1024, 8, 32], "", 0, []], [[], [["FU", 1, [0, 1, 2, 3]], ["SP", 1, 0, 451584, [14], 1], ["AN", 1, 0, 5], ["AN", 1, 1, 6]]]], "r": [[2.69244e-05, 2.69398e-05, 2.69398e-05], 0, 6.35378, 1667934383], "v": "v0.6"}
{"i": [["[\"sigmoid\", 1, 56, 56, 144]", "cuda -keys=cuda,gpu -max_num_threads=1024 -model=unknown -thread_warp_size=32", [-1, 16, 64, 49152, 2147483647, 1024, 8, 32], "", 0, []], [[], [["FU", 1, [0, 1, 2, 3]], ["SP", 1, 0, 451584, [56], 1], ["AN", 1, 0, 5], ["AN", 1, 1, 6]]]], "r": [[8.83002e-06, 8.84931e-06, 8.84598e-06], 0, 6.72905, 1667934384], "v": "v0.6"}
{"i": [["[\"sigmoid\", 1, 56, 56, 144]", "cuda -keys=cuda,gpu -max_num_threads=1024 -model=unknown -thread_warp_size=32", [-1, 16, 64, 49152, 2147483647, 1024, 8, 32], "", 0, []], [[], [["FU", 1, [0, 1, 2, 3]], ["SP", 1, 0, 451584, [32], 1], ["AN", 1, 0, 5], ["AN", 1, 1, 6]]]], "r": [[1.34579e-05, 1.34695e-05, 1.34644e-05], 0, 6.94375, 1667934384], "v": "v0.6"}
{"i": [["[\"sigmoid\", 1, 56, 56, 144]", "cuda -keys=cuda,gpu -max_num_threads=1024 -model=unknown -thread_warp_size=32", [-1, 16, 64, 49152, 2147483647, 1024, 8, 32], "", 0, []], [[], [["FU", 1, [0, 1, 2, 3]], ["SP", 1, 0, 451584, [24], 1], ["AN", 1, 0, 5], ["AN", 1, 1, 6]]]], "r": [[1.69926e-05, 1.70008e-05, 1.69998e-05], 0, 7.20994, 1667934384], "v": "v0.6"}
{"i": [["[\"sigmoid\", 1, 56, 56, 144]", "cuda -keys=cuda,gpu -max_num_threads=1024 -model=unknown -thread_warp_size=32", [-1, 16, 64, 49152, 2147483647, 1024, 8, 32], "", 0, []], [[], [["FU", 1, [0, 1, 2, 3]], ["SP", 1, 0, 451584, [36], 1], ["AN", 1, 0, 5], ["AN", 1, 1, 6]]]], "r": [[1.21476e-05, 1.21533e-05, 1.21534e-05], 0, 3.95054, 1667934381], "v": "v0.6"}
{"i": [["[\"sigmoid\", 1, 56, 56, 144]", "cuda -keys=cuda,gpu -max_num_threads=1024 -model=unknown -thread_warp_size=32", [-1, 16, 64, 49152, 2147483647, 1024, 8, 32], "", 0, []], [[], [["FU", 1, [0, 1, 2, 3]], ["SP", 1, 0, 451584, [6], 1], ["AN", 1, 0, 5], ["AN", 1, 1, 6]]]], "r": [[5.87933e-05, 5.88169e-05, 5.87977e-05], 0, 2.92528, 1667934786], "v": "v0.6"}
{"i": [["[\"sigmoid\", 1, 56, 56, 144]", "cuda -keys=cuda,gpu -max_num_threads=1024 -model=unknown -thread_warp_size=32", [-1, 16, 64, 49152, 2147483647, 1024, 8, 32], "", 0, []], [[], [["FU", 1, [0, 1, 2, 3]], ["SP", 1, 0, 451584, [32], 1], ["AN", 1, 0, 5], ["AN", 1, 1, 6]]]], "r": [[1.35187e-05, 1.35427e-05, 1.35455e-05], 0, 1.62716, 1667934785], "v": "v0.6"}
{"i": [["[\"sigmoid\", 1, 56, 56, 144]", "cuda -keys=cuda,gpu -max_num_threads=1024 -model=unknown -thread_warp_size=32", [-1, 16, 64, 49152, 2147483647, 1024, 8, 32], "", 0, []], [[], [["FU", 1, [0, 1, 2, 3]], ["SP", 1, 0, 451584, [42], 1], ["AN", 1, 0, 5], ["AN", 1, 1, 6]]]], "r": [[1.07474e-05, 1.07708e-05, 1.07594e-05], 0, 0.976267, 1667934784], "v": "v0.6"}
{"i": [["[\"sigmoid\", 1, 56, 56, 144]", "cuda -keys=cuda,gpu -max_num_threads=1024 -model=unknown -thread_warp_size=32", [-1, 16, 64, 49152, 2147483647, 1024, 8, 32], "", 0, []], [[], [["FU", 1, [0, 1, 2, 3]], ["SP", 1, 0, 451584, [8], 1], ["AN", 1, 0, 5], ["AN", 1, 1, 6]]]], "r": [[4.46815e-05, 4.46976e-05, 4.46808e-05], 0, 2.59441, 1667934786], "v": "v0.6"}
{"i": [["[\"sigmoid\", 1, 56, 56, 144]", "cuda -keys=cuda,gpu -max_num_threads=1024 -model=unknown -thread_warp_size=32", [-1, 16, 64, 49152, 2147483647, 1024, 8, 32], "", 0, []], [[], [["FU", 1, [0, 1, 2, 3]], ["SP", 1, 0, 451584, [3], 1], ["AN", 1, 0, 5], ["AN", 1, 1, 6]]]], "r": [[0.000114544, 0.000114545, 0.00011454], 0, 2.02095, 1667934785], "v": "v0.6"}
{"i": [["[\"sigmoid\", 1, 56, 56, 144]", "cuda -keys=cuda,gpu -max_num_threads=1024 -model=unknown -thread_warp_size=32", [-1, 16, 64, 49152, 2147483647, 1024, 8, 32], "", 0, []], [[], [["FU", 1, [0, 1, 2, 3]], ["SP", 1, 0, 451584, [21], 1], ["AN", 1, 0, 5], ["AN", 1, 1, 6]]]], "r": [[1.89621e-05, 3.40822e-05, 1.89722e-05], 0, 0.698727, 1667934784], "v": "v0.6"}
{"i": [["[\"sigmoid\", 1, 56, 56, 144]", "cuda -keys=cuda,gpu -max_num_threads=1024 -model=unknown -thread_warp_size=32", [-1, 16, 64, 49152, 2147483647, 1024, 8, 32], "", 0, []], [[], [["FU", 1, [0, 1, 2, 3]], ["SP", 1, 0, 451584, [7], 1], ["AN", 1, 0, 5], ["AN", 1, 1, 6]]]], "r": [[5.07365e-05, 5.07421e-05, 5.07314e-05], 0, 1.25901, 1667934785], "v": "v0.6"}
{"i": [["[\"sigmoid\", 1, 56, 56, 144]", "cuda -keys=cuda,gpu -max_num_threads=1024 -model=unknown -thread_warp_size=32", [-1, 16, 64, 49152, 2147483647, 1024, 8, 32], "", 0, []], [[], [["FU", 1, [0, 1, 2, 3]], ["SP", 1, 0, 451584, [2], 1], ["AN", 1, 0, 5], ["AN", 1, 1, 6]]]], "r": [[0.000170383, 0.00017039, 0.00017041], 0, 2.28889, 1667934786], "v": "v0.6"}
{"i": [["[\"sigmoid\", 1, 56, 56, 144]", "cuda -keys=cuda,gpu -max_num_threads=1024 -model=unknown -thread_warp_size=32", [-1, 16, 64, 49152, 2147483647, 1024, 8, 32], "", 0, []], [[], [["FU", 1, [0, 1, 2, 3]], ["SP", 1, 0, 451584, [49], 1], ["AN", 1, 0, 5], ["AN", 1, 1, 6]]]], "r": [[9.56819e-06, 9.57709e-06, 9.5775e-06], 0, 3.22136, 1667934787], "v": "v0.6"}
{"i": [["[\"sigmoid\", 1, 56, 56, 144]", "cuda -keys=cuda,gpu -max_num_threads=1024 -model=unknown -thread_warp_size=32", [-1, 16, 64, 49152, 2147483647, 1024, 8, 32], "", 0, []], [[], [["FU", 1, [0, 1, 2, 3]], ["SP", 1, 0, 451584, [24], 1], ["AN", 1, 0, 5], ["AN", 1, 1, 6]]]], "r": [[1.69928e-05, 1.70099e-05, 1.70105e-05], 0, 3.71236, 1667934787], "v": "v0.6"}
{"i": [["[\"sigmoid\", 1, 56, 56, 144]", "cuda -keys=cuda,gpu -max_num_threads=1024 -model=unknown -thread_warp_size=32", [-1, 16, 64, 49152, 2147483647, 1024, 8, 32], "", 0, []], [[], [["FU", 1, [0, 1, 2, 3]], ["SP", 1, 0, 451584, [12], 1], ["AN", 1, 0, 5], ["AN", 1, 1, 6]]]], "r": [[3.09271e-05, 3.09569e-05, 3.09443e-05], 0, 4.06084, 1667934788], "v": "v0.6"}
{"i": [["[\"sigmoid\", 1, 56, 56, 144]", "cuda -keys=cuda,gpu -max_num_threads=1024 -model=unknown -thread_warp_size=32", [-1, 16, 64, 49152, 2147483647, 1024, 8, 32], "", 0, []], [[], [["FU", 1, [0, 1, 2, 3]], ["SP", 1, 0, 451584, [48], 1], ["AN", 1, 0, 5], ["AN", 1, 1, 6]]]], "r": [[9.81154e-06, 9.83799e-06, 9.82577e-06], 0, 4.26403, 1667934788], "v": "v0.6"}
{"i": [["[\"sigmoid\", 1, 56, 56, 144]", "cuda -keys=cuda,gpu -max_num_threads=1024 -model=unknown -thread_warp_size=32", [-1, 16, 64, 49152, 2147483647, 1024, 8, 32], "", 0, []], [[], [["FU", 1, [0, 1, 2, 3]], ["SP", 1, 0, 451584, [64], 1], ["AN", 1, 0, 5], ["AN", 1, 1, 6]]]], "r": [[7.92794e-06, 7.93312e-06, 7.93285e-06], 0, 5.49798, 1667934789], "v": "v0.6"}
{"i": [["[\"sigmoid\", 1, 56, 56, 144]", "cuda -keys=cuda,gpu -max_num_threads=1024 -model=unknown -thread_warp_size=32", [-1, 16, 64, 49152, 2147483647, 1024, 8, 32], "", 0, []], [[], [["FU", 1, [0, 1, 2, 3]], ["SP", 1, 0, 451584, [14], 1], ["AN", 1, 0, 5], ["AN", 1, 1, 6]]]], "r": [[2.69177e-05, 2.69361e-05, 2.69298e-05], 0, 4.61245, 1667934788], "v": "v0.6"}
{"i": [["[\"sigmoid\", 1, 56, 56, 144]", "cuda -keys=cuda,gpu -max_num_threads=1024 -model=unknown -thread_warp_size=32", [-1, 16, 64, 49152, 2147483647, 1024, 8, 32], "", 0, []], [[], [["FU", 1, [0, 1, 2, 3]], ["SP", 1, 0, 451584, [63], 1], ["AN", 1, 0, 5], ["AN", 1, 1, 6]]]], "r": [[8.02406e-06, 8.03959e-06, 8.03689e-06], 0, 4.88984, 1667934789], "v": "v0.6"}
{"i": [["[\"sigmoid\", 1, 56, 56, 144]", "cuda -keys=cuda,gpu -max_num_threads=1024 -model=unknown -thread_warp_size=32", [-1, 16, 64, 49152, 2147483647, 1024, 8, 32], "", 0, []], [[], [["FU", 1, [0, 1, 2, 3]], ["SP", 1, 0, 451584, [4], 1], ["AN", 1, 0, 5], ["AN", 1, 1, 6]]]], "r": [[8.66218e-05, 8.66251e-05, 8.66062e-05], 0, 5.12813, 1667934789], "v": "v0.6"}
{"i": [["[\"sigmoid\", 1, 56, 56, 144]", "cuda -keys=cuda,gpu -max_num_threads=1024 -model=unknown -thread_warp_size=32", [-1, 16, 64, 49152, 2147483647, 1024, 8, 32], "", 0, []], [[], [["FU", 1, [0, 1, 2, 3]], ["SP", 1, 0, 451584, [56], 1], ["AN", 1, 0, 5], ["AN", 1, 1, 6]]]], "r": [[8.82389e-06, 8.84117e-06, 8.84365e-06], 0, 5.7485, 1667934790], "v": "v0.6"}
{"i": [["[\"sigmoid\", 1, 56, 56, 144]", "cuda -keys=cuda,gpu -max_num_threads=1024 -model=unknown -thread_warp_size=32", [-1, 16, 64, 49152, 2147483647, 1024, 8, 32], "", 0, []], [[], [["FU", 1, [0, 1, 2, 3]], ["SP", 1, 0, 451584, [9], 1], ["AN", 1, 0, 5], ["AN", 1, 1, 6]]]], "r": [[4.01083e-05, 4.01143e-05, 4.01191e-05], 0, 6.36853, 1667934791], "v": "v0.6"}
{"i": [["[\"sigmoid\", 1, 56, 56, 144]", "cuda -keys=cuda,gpu -max_num_threads=1024 -model=unknown -thread_warp_size=32", [-1, 16, 64, 49152, 2147483647, 1024, 8, 32], "", 0, []], [[], [["FU", 1, [0, 1, 2, 3]], ["SP", 1, 0, 451584, [28], 1], ["AN", 1, 0, 5], ["AN", 1, 1, 6]]]], "r": [[1.49611e-05, 1.49657e-05, 1.49618e-05], 0, 6.04854, 1667934790], "v": "v0.6"}
{"i": [["[\"sigmoid\", 1, 56, 56, 144]", "cuda -keys=cuda,gpu -max_num_threads=1024 -model=unknown -thread_warp_size=32", [-1, 16, 64, 49152, 2147483647, 1024, 8, 32], "", 0, []], [[], [["FU", 1, [0, 1, 2, 3]], ["SP", 1, 0, 451584, [1], 1], ["AN", 1, 0, 5], ["AN", 1, 1, 6]]]], "r": [[0.000337776, 0.000337757, 0.000337755], 0, 6.64164, 1667934791], "v": "v0.6"}
{"i": [["[\"sigmoid\", 1, 56, 56, 144]", "cuda -keys=cuda,gpu -max_num_threads=1024 -model=unknown -thread_warp_size=32", [-1, 16, 64, 49152, 2147483647, 1024, 8, 32], "", 0, []], [[], [["FU", 1, [0, 1, 2, 3]], ["SP", 1, 0, 451584, [36], 1], ["AN", 1, 0, 5], ["AN", 1, 1, 6]]]], "r": [[1.20366e-05, 1.2055e-05, 1.20471e-05], 0, 7.01727, 1667934791], "v": "v0.6"}
{"i": [["[\"sigmoid\", 1, 56, 56, 144]", "cuda -keys=cuda,gpu -max_num_threads=1024 -model=unknown -thread_warp_size=32", [-1, 16, 64, 49152, 2147483647, 1024, 8, 32], "", 0, []], [[], [["FU", 1, [0, 1, 2, 3]], ["SP", 1, 0, 451584, [16], 1], ["AN", 1, 0, 5], ["AN", 1, 1, 6]]]], "r": [[2.40032e-05, 2.40168e-05, 2.4015e-05], 0, 7.22036, 1667934792], "v": "v0.6"}
{"i": [["[\"sigmoid\", 1, 56, 56, 144]", "cuda -keys=cuda,gpu -max_num_threads=1024 -model=unknown -thread_warp_size=32", [-1, 16, 64, 49152, 2147483647, 1024, 8, 32], "", 0, []], [[], [["FU", 1, [0, 1, 2, 3]], ["SP", 1, 0, 451584, [18], 1], ["AN", 1, 0, 5], ["AN", 1, 1, 6]]]], "r": [[2.16173e-05, 2.16439e-05, 2.1643e-05], 0, 3.385, 1667934787], "v": "v0.6"}
{"i": [["[\"sigmoid\", 1, 56, 56, 144]", "cuda -keys=cuda,gpu -max_num_threads=1024 -model=unknown -thread_warp_size=32", [-1, 16, 64, 49152, 2147483647, 1024, 8, 32], "", 0, []], [[], [["FU", 1, [0, 1, 2, 3]], ["SP", 1, 0, 451584, [63], 1], ["AN", 1, 0, 5], ["AN", 1, 1, 6]]]], "r": [[8.05607e-06, 8.06763e-06, 8.07118e-06], 0, 0.97429, 1667935992], "v": "v0.6"}
{"i": [["[\"sigmoid\", 1, 56, 56, 144]", "cuda -keys=cuda,gpu -max_num_threads=1024 -model=unknown -thread_warp_size=32", [-1, 16, 64, 49152, 2147483647, 1024, 8, 32], "", 0, []], [[], [["FU", 1, [0, 1, 2, 3]], ["SP", 1, 0, 451584, [2], 1], ["AN", 1, 0, 5], ["AN", 1, 1, 6]]]], "r": [[0.000170397, 0.000170399, 0.000170471], 0, 0.64888, 1667935991], "v": "v0.6"}
{"i": [["[\"sigmoid\", 1, 56, 56, 144]", "cuda -keys=cuda,gpu -max_num_threads=1024 -model=unknown -thread_warp_size=32", [-1, 16, 64, 49152, 2147483647, 1024, 8, 32], "", 0, []], [[], [["FU", 1, [0, 1, 2, 3]], ["SP", 1, 0, 451584, [56], 1], ["AN", 1, 0, 5], ["AN", 1, 1, 6]]]], "r": [[8.7427e-06, 8.76022e-06, 8.76213e-06], 0, 1.97226, 1667935993], "v": "v0.6"}
{"i": [["[\"sigmoid\", 1, 56, 56, 144]", "cuda -keys=cuda,gpu -max_num_threads=1024 -model=unknown -thread_warp_size=32", [-1, 16, 64, 49152, 2147483647, 1024, 8, 32], "", 0, []], [[], [["FU", 1, [0, 1, 2, 3]], ["SP", 1, 0, 451584, [8], 1], ["AN", 1, 0, 5], ["AN", 1, 1, 6]]]], "r": [[4.47475e-05, 4.47923e-05, 4.47595e-05], 0, 1.33531, 1667935992], "v": "v0.6"}
{"i": [["[\"sigmoid\", 1, 56, 56, 144]", "cuda -keys=cuda,gpu -max_num_threads=1024 -model=unknown -thread_warp_size=32", [-1, 16, 64, 49152, 2147483647, 1024, 8, 32], "", 0, []], [[], [["FU", 1, [0, 1, 2, 3]], ["SP", 1, 0, 451584, [1], 1], ["AN", 1, 0, 5], ["AN", 1, 1, 6]]]], "r": [[0.000337782, 0.000337803, 0.00033781], 0, 1.66963, 1667935992], "v": "v0.6"}
{"i": [["[\"sigmoid\", 1, 56, 56, 144]", "cuda -keys=cuda,gpu -max_num_threads=1024 -model=unknown -thread_warp_size=32", [-1, 16, 64, 49152, 2147483647, 1024, 8, 32], "", 0, []], [[], [["FU", 1, [0, 1, 2, 3]], ["SP", 1, 0, 451584, [6], 1], ["AN", 1, 0, 5], ["AN", 1, 1, 6]]]], "r": [[5.87314e-05, 5.87378e-05, 5.87297e-05], 0, 2.4365, 1667935993], "v": "v0.6"}
{"i": [["[\"sigmoid\", 1, 56, 56, 144]", "cuda -keys=cuda,gpu -max_num_threads=1024 -model=unknown -thread_warp_size=32", [-1, 16, 64, 49152, 2147483647, 1024, 8, 32], "", 0, []], [[], [["FU", 1, [0, 1, 2, 3]], ["SP", 1, 0, 451584, [42], 1], ["AN", 1, 0, 5], ["AN", 1, 1, 6]]]], "r": [[1.07404e-05, 1.07416e-05, 1.07469e-05], 0, 3.39602, 1667935994], "v": "v0.6"}
{"i": [["[\"sigmoid\", 1, 56, 56, 144]", "cuda -keys=cuda,gpu -max_num_threads=1024 -model=unknown -thread_warp_size=32", [-1, 16, 64, 49152, 2147483647, 1024, 8, 32], "", 0, []], [[], [["FU", 1, [0, 1, 2, 3]], ["SP", 1, 0, 451584, [14], 1], ["AN", 1, 0, 5], ["AN", 1, 1, 6]]]], "r": [[2.6909e-05, 2.69234e-05, 2.69168e-05], 0, 3.11394, 1667935994], "v": "v0.6"}
{"i": [["[\"sigmoid\", 1, 56, 56, 144]", "cuda -keys=cuda,gpu -max_num_threads=1024 -model=unknown -thread_warp_size=32", [-1, 16, 64, 49152, 2147483647, 1024, 8, 32], "", 0, []], [[], [["FU", 1, [0, 1, 2, 3]], ["SP", 1, 0, 451584, [36], 1], ["AN", 1, 0, 5], ["AN", 1, 1, 6]]]], "r": [[1.20221e-05, 1.20459e-05, 1.20462e-05], 0, 2.1495, 1667935993], "v": "v0.6"}
{"i": [["[\"sigmoid\", 1, 56, 56, 144]", "cuda -keys=cuda,gpu -max_num_threads=1024 -model=unknown -thread_warp_size=32", [-1, 16, 64, 49152, 2147483647, 1024, 8, 32], "", 0, []], [[], [["FU", 1, [0, 1, 2, 3]], ["SP", 1, 0, 451584, [32], 1], ["AN", 1, 0, 5], ["AN", 1, 1, 6]]]], "r": [[1.34448e-05, 1.34472e-05, 1.34486e-05], 0, 2.73722, 1667935994], "v": "v0.6"}
{"i": [["[\"sigmoid\", 1, 56, 56, 144]", "cuda -keys=cuda,gpu -max_num_threads=1024 -model=unknown -thread_warp_size=32", [-1, 16, 64, 49152, 2147483647, 1024, 8, 32], "", 0, []], [[], [["FU", 1, [0, 1, 2, 3]], ["SP", 1, 0, 451584, [49], 1], ["AN", 1, 0, 5], ["AN", 1, 1, 6]]]], "r": [[9.72859e-06, 9.74226e-06, 9.74049e-06], 0, 3.69871, 1667935995], "v": "v0.6"}
{"i": [["[\"sigmoid\", 1, 56, 56, 144]", "cuda -keys=cuda,gpu -max_num_threads=1024 -model=unknown -thread_warp_size=32", [-1, 16, 64, 49152, 2147483647, 1024, 8, 32], "", 0, []], [[], [["FU", 1, [0, 1, 2, 3]], ["SP", 1, 0, 451584, [3], 1], ["AN", 1, 0, 5], ["AN", 1, 1, 6]]]], "r": [[0.000114621, 0.000114663, 0.000114636], 0, 4.29791, 1667935996], "v": "v0.6"}
{"i": [["[\"sigmoid\", 1, 56, 56, 144]", "cuda -keys=cuda,gpu -max_num_threads=1024 -model=unknown -thread_warp_size=32", [-1, 16, 64, 49152, 2147483647, 1024, 8, 32], "", 0, []], [[], [["FU", 1, [0, 1, 2, 3]], ["SP", 1, 0, 451584, [7], 1], ["AN", 1, 0, 5], ["AN", 1, 1, 6]]]], "r": [[5.08142e-05, 5.08236e-05, 5.08374e-05], 0, 4.63824, 1667935996], "v": "v0.6"}
{"i": [["[\"sigmoid\", 1, 56, 56, 144]", "cuda -keys=cuda,gpu -max_num_threads=1024 -model=unknown -thread_warp_size=32", [-1, 16, 64, 49152, 2147483647, 1024, 8, 32], "", 0, []], [[], [["FU", 1, [0, 1, 2, 3]], ["SP", 1, 0, 451584, [48], 1], ["AN", 1, 0, 5], ["AN", 1, 1, 6]]]], "r": [[9.73283e-06, 9.75711e-06, 9.75764e-06], 0, 4.92892, 1667935996], "v": "v0.6"}
{"i": [["[\"sigmoid\", 1, 56, 56, 144]", "cuda -keys=cuda,gpu -max_num_threads=1024 -model=unknown -thread_warp_size=32", [-1, 16, 64, 49152, 2147483647, 1024, 8, 32], "", 0, []], [[], [["FU", 1, [0, 1, 2, 3]], ["SP", 1, 0, 451584, [64], 1], ["AN", 1, 0, 5], ["AN", 1, 1, 6]]]], "r": [[8.01053e-06, 8.01491e-06, 8.01829e-06], 0, 5.1439, 1667935997], "v": "v0.6"}
{"i": [["[\"sigmoid\", 1, 56, 56, 144]", "cuda -keys=cuda,gpu -max_num_threads=1024 -model=unknown -thread_warp_size=32", [-1, 16, 64, 49152, 2147483647, 1024, 8, 32], "", 0, []], [[], [["FU", 1, [0, 1, 2, 3]], ["SP", 1, 0, 451584, [16], 1], ["AN", 1, 0, 5], ["AN", 1, 1, 6]]]], "r": [[2.38615e-05, 2.38783e-05, 2.38737e-05], 0, 5.48944, 1667935997], "v": "v0.6"}
{"i": [["[\"sigmoid\", 1, 56, 56, 144]", "cuda -keys=cuda,gpu -max_num_threads=1024 -model=unknown -thread_warp_size=32", [-1, 16, 64, 49152, 2147483647, 1024, 8, 32], "", 0, []], [[], [["FU", 1, [0, 1, 2, 3]], ["SP", 1, 0, 451584, [24], 1], ["AN", 1, 0, 5], ["AN", 1, 1, 6]]]], "r": [[1.69039e-05, 1.69199e-05, 1.69176e-05], 0, 5.75604, 1667935997], "v": "v0.6"}
{"i": [["[\"sigmoid\", 1, 56, 56, 144]", "cuda -keys=cuda,gpu -max_num_threads=1024 -model=unknown -thread_warp_size=32", [-1, 16, 64, 49152, 2147483647, 1024, 8, 32], "", 0, []], [[], [["FU", 1, [0, 1, 2, 3]], ["SP", 1, 0, 451584, [4], 1], ["AN", 1, 0, 5], ["AN", 1, 1, 6]]]], "r": [[8.67767e-05, 8.68074e-05, 8.6789e-05], 0, 6.02988, 1667935998], "v": "v0.6"}
{"i": [["[\"sigmoid\", 1, 56, 56, 144]", "cuda -keys=cuda,gpu -max_num_threads=1024 -model=unknown -thread_warp_size=32", [-1, 16, 64, 49152, 2147483647, 1024, 8, 32], "", 0, []], [[], [["FU", 1, [0, 1, 2, 3]], ["SP", 1, 0, 451584, [21], 1], ["AN", 1, 0, 5], ["AN", 1, 1, 6]]]], "r": [[1.90643e-05, 1.90848e-05, 1.90813e-05], 0, 6.34199, 1667935998], "v": "v0.6"}
{"i": [["[\"sigmoid\", 1, 56, 56, 144]", "cuda -keys=cuda,gpu -max_num_threads=1024 -model=unknown -thread_warp_size=32", [-1, 16, 64, 49152, 2147483647, 1024, 8, 32], "", 0, []], [[], [["FU", 1, [0, 1, 2, 3]], ["SP", 1, 0, 451584, [9], 1], ["AN", 1, 0, 5], ["AN", 1, 1, 6]]]], "r": [[4.00924e-05, 4.00973e-05, 4.00939e-05], 0, 6.58734, 1667935998], "v": "v0.6"}
{"i": [["[\"sigmoid\", 1, 56, 56, 144]", "cuda -keys=cuda,gpu -max_num_threads=1024 -model=unknown -thread_warp_size=32", [-1, 16, 64, 49152, 2147483647, 1024, 8, 32], "", 0, []], [[], [["FU", 1, [0, 1, 2, 3]], ["SP", 1, 0, 451584, [12], 1], ["AN", 1, 0, 5], ["AN", 1, 1, 6]]]], "r": [[3.08757e-05, 3.08748e-05, 3.08683e-05], 0, 6.9367, 1667935999], "v": "v0.6"}
{"i": [["[\"sigmoid\", 1, 56, 56, 144]", "cuda -keys=cuda,gpu -max_num_threads=1024 -model=unknown -thread_warp_size=32", [-1, 16, 64, 49152, 2147483647, 1024, 8, 32], "", 0, []], [[], [["FU", 1, [0, 1, 2, 3]], ["SP", 1, 0, 451584, [28], 1], ["AN", 1, 0, 5], ["AN", 1, 1, 6]]]], "r": [[1.50272e-05, 1.5032e-05, 1.50383e-05], 0, 3.95785, 1667935995], "v": "v0.6"}
{"i": [["[\"sigmoid\", 1, 56, 56, 144]", "cuda -keys=cuda,gpu -max_num_threads=1024 -model=unknown -thread_warp_size=32", [-1, 16, 64, 49152, 2147483647, 1024, 8, 32], "", 0, []], [[], [["FU", 1, [0, 1, 2, 3]], ["SP", 1, 0, 451584, [18], 1], ["AN", 1, 0, 5], ["AN", 1, 1, 6]]]], "r": [[2.16214e-05, 2.16362e-05, 2.16375e-05], 0, 7.23686, 1667935999], "v": "v0.6"}
