python/models/efficientnet/VertiFusionEfficientNet_kernel_configs/efficient_mul_1_1_1_20.log
{"i": [["[\"mul\", 1, 1, 1, 20]", "cuda -keys=cuda,gpu -max_num_threads=1024 -model=unknown -thread_warp_size=32", [-1, 16, 64, 49152, 2147483647, 1024, 8, 32], "", 0, []], [[], [["FU", 2, [0, 1, 2, 3]], ["AN", 2, 0, 6]]]], "r": [[2.41817e-06, 2.41205e-06, 2.40872e-06], 0, 0.536717, 1667926842], "v": "v0.6"}
{"i": [["[\"mul\", 1, 1, 1, 20]", "cuda -keys=cuda,gpu -max_num_threads=1024 -model=unknown -thread_warp_size=32", [-1, 16, 64, 49152, 2147483647, 1024, 8, 32], "", 0, []], [[], [["FU", 2, [0, 1, 2, 3]], ["AN", 2, 0, 6]]]], "r": [[2.43048e-06, 2.48125e-06, 2.4944e-06], 0, 0.501282, 1667926961], "v": "v0.6"}
{"i": [["[\"mul\", 1, 1, 1, 20]", "cuda -keys=cuda,gpu -max_num_threads=1024 -model=unknown -thread_warp_size=32", [-1, 16, 64, 49152, 2147483647, 1024, 8, 32], "", 0, []], [[], [["FU", 2, [0, 1, 2, 3]], ["AN", 2, 0, 6]]]], "r": [[2.4093e-06, 2.41848e-06, 2.41239e-06], 0, 0.502066, 1667927058], "v": "v0.6"}
{"i": [["[\"mul\", 1, 1, 1, 20]", "cuda -keys=cuda,gpu -max_num_threads=1024 -model=unknown -thread_warp_size=32", [-1, 16, 64, 49152, 2147483647, 1024, 8, 32], "", 0, []], [[], [["FU", 2, [0, 1, 2, 3]], ["AN", 2, 0, 6]]]], "r": [[2.43212e-06, 2.46766e-06, 2.47395e-06], 0, 0.504405, 1667940854], "v": "v0.6"}
{"i": [["[\"mul\", 1, 1, 1, 20]", "cuda -keys=cuda,gpu -max_num_threads=1024 -model=unknown -thread_warp_size=32", [-1, 16, 64, 49152, 2147483647, 1024, 8, 32], "", 0, []], [[], [["FU", 2, [0, 1, 2, 3]], ["AN", 2, 0, 6]]]], "r": [[2.44759e-06, 2.43827e-06, 2.43852e-06], 0, 0.509618, 1667941650], "v": "v0.6"}
{"i": [["[\"mul\", 1, 1, 1, 20]", "cuda -keys=cuda,gpu -max_num_threads=1024 -model=unknown -thread_warp_size=32", [-1, 16, 64, 49152, 2147483647, 1024, 8, 32], "", 0, []], [[], [["FU", 2, [0, 1, 2, 3]], ["AN", 2, 0, 6]]]], "r": [[2.37819e-06, 2.38188e-06, 2.3768e-06], 0, 0.5159, 1667942218], "v": "v0.6"}
