python/models/efficientnet/VertiFusionEfficientNet_kernel_configs/efficient_mul_1_1_1_28.log
{"i": [["[\"mul\", 1, 1, 1, 28]", "cuda -keys=cuda,gpu -max_num_threads=1024 -model=unknown -thread_warp_size=32", [-1, 16, 64, 49152, 2147483647, 1024, 8, 32], "", 0, []], [[], [["FU", 2, [0, 1, 2, 3]], ["AN", 2, 0, 6]]]], "r": [[2.41668e-06, 2.4339e-06, 2.43823e-06], 0, 0.527826, 1667927298], "v": "v0.6"}
{"i": [["[\"mul\", 1, 1, 1, 28]", "cuda -keys=cuda,gpu -max_num_threads=1024 -model=unknown -thread_warp_size=32", [-1, 16, 64, 49152, 2147483647, 1024, 8, 32], "", 0, []], [[], [["FU", 2, [0, 1, 2, 3]], ["AN", 2, 0, 6]]]], "r": [[2.44762e-06, 2.43524e-06, 2.43396e-06], 0, 0.503071, 1667927417], "v": "v0.6"}
{"i": [["[\"mul\", 1, 1, 1, 28]", "cuda -keys=cuda,gpu -max_num_threads=1024 -model=unknown -thread_warp_size=32", [-1, 16, 64, 49152, 2147483647, 1024, 8, 32], "", 0, []], [[], [["FU", 2, [0, 1, 2, 3]], ["AN", 2, 0, 6]]]], "r": [[2.56549e-06, 2.57081e-06, 2.60205e-06], 0, 0.482047, 1667927583], "v": "v0.6"}
{"i": [["[\"mul\", 1, 1, 1, 28]", "cuda -keys=cuda,gpu -max_num_threads=1024 -model=unknown -thread_warp_size=32", [-1, 16, 64, 49152, 2147483647, 1024, 8, 32], "", 0, []], [[], [["FU", 2, [0, 1, 2, 3]], ["AN", 2, 0, 6]]]], "r": [[2.38723e-06, 2.38594e-06, 2.38076e-06], 0, 0.510746, 1667943824], "v": "v0.6"}
{"i": [["[\"mul\", 1, 1, 1, 28]", "cuda -keys=cuda,gpu -max_num_threads=1024 -model=unknown -thread_warp_size=32", [-1, 16, 64, 49152, 2147483647, 1024, 8, 32], "", 0, []], [[], [["FU", 2, [0, 1, 2, 3]], ["AN", 2, 0, 6]]]], "r": [[2.43558e-06, 2.42129e-06, 2.42232e-06], 0, 0.505687, 1667944616], "v": "v0.6"}
{"i": [["[\"mul\", 1, 1, 1, 28]", "cuda -keys=cuda,gpu -max_num_threads=1024 -model=unknown -thread_warp_size=32", [-1, 16, 64, 49152, 2147483647, 1024, 8, 32], "", 0, []], [[], [["FU", 2, [0, 1, 2, 3]], ["AN", 2, 0, 6]]]], "r": [[2.39375e-06, 2.39762e-06, 2.39648e-06], 0, 0.508513, 1667945150], "v": "v0.6"}
