python/models/efficientnet/VertiFusionEfficientNet_kernel_configs/efficient_mul_1_1_1_4.log
{"i": [["[\"mul\", 1, 1, 1, 4]", "cuda -keys=cuda,gpu -max_num_threads=1024 -model=unknown -thread_warp_size=32", [-1, 16, 64, 49152, 2147483647, 1024, 8, 32], "", 0, []], [[], [["FU", 2, [0, 1, 2, 3]], ["AN", 2, 0, 6]]]], "r": [[2.45789e-06, 2.44706e-06, 2.44437e-06], 0, 0.534397, 1667925440], "v": "v0.6"}
{"i": [["[\"mul\", 1, 1, 1, 4]", "cuda -keys=cuda,gpu -max_num_threads=1024 -model=unknown -thread_warp_size=32", [-1, 16, 64, 49152, 2147483647, 1024, 8, 32], "", 0, []], [[], [["FU", 2, [0, 1, 2, 3]], ["AN", 2, 0, 6]]]], "r": [[2.39535e-06, 2.39474e-06, 2.38941e-06], 0, 0.50038, 1667925995], "v": "v0.6"}
{"i": [["[\"mul\", 1, 1, 1, 4]", "cuda -keys=cuda,gpu -max_num_threads=1024 -model=unknown -thread_warp_size=32", [-1, 16, 64, 49152, 2147483647, 1024, 8, 32], "", 0, []], [[], [["FU", 2, [0, 1, 2, 3]], ["AN", 2, 0, 6]]]], "r": [[2.55018e-06, 2.56326e-06, 2.59392e-06], 0, 0.489405, 1667933424], "v": "v0.6"}
