python/models/efficientnet/VertiFusionEfficientNet_kernel_configs/efficient_mul_1_1_1_48.log
{"i": [["[\"mul\", 1, 1, 1, 48]", "cuda -keys=cuda,gpu -max_num_threads=1024 -model=unknown -thread_warp_size=32", [-1, 16, 64, 49152, 2147483647, 1024, 8, 32], "", 0, []], [[], [["FU", 2, [0, 1, 2, 3]], ["SP", 2, 0, 48, [6], 1], ["AN", 2, 0, 5], ["AN", 2, 1, 6]]]], "r": [[2.46347e-06, 2.464e-06, 2.48792e-06], 0, 0.891811, 1667927800], "v": "v0.6"}
{"i": [["[\"mul\", 1, 1, 1, 48]", "cuda -keys=cuda,gpu -max_num_threads=1024 -model=unknown -thread_warp_size=32", [-1, 16, 64, 49152, 2147483647, 1024, 8, 32], "", 0, []], [[], [["FU", 2, [0, 1, 2, 3]], ["SP", 2, 0, 48, [8], 1], ["AN", 2, 0, 5], ["AN", 2, 1, 6]]]], "r": [[2.43932e-06, 2.4422e-06, 2.44914e-06], 0, 0.513803, 1667927800], "v": "v0.6"}
{"i": [["[\"mul\", 1, 1, 1, 48]", "cuda -keys=cuda,gpu -max_num_threads=1024 -model=unknown -thread_warp_size=32", [-1, 16, 64, 49152, 2147483647, 1024, 8, 32], "", 0, []], [[], [["FU", 2, [0, 1, 2, 3]], ["SP", 2, 0, 48, [1], 1], ["AN", 2, 0, 5], ["AN", 2, 1, 6]]]], "r": [[2.66065e-06, 2.66071e-06, 2.68732e-06], 0, 1.7161, 1667927801], "v": "v0.6"}
{"i": [["[\"mul\", 1, 1, 1, 48]", "cuda -keys=cuda,gpu -max_num_threads=1024 -model=unknown -thread_warp_size=32", [-1, 16, 64, 49152, 2147483647, 1024, 8, 32], "", 0, []], [[], [["FU", 2, [0, 1, 2, 3]], ["SP", 2, 0, 48, [12], 1], ["AN", 2, 0, 5], ["AN", 2, 1, 6]]]], "r": [[2.5033e-06, 2.52241e-06, 2.52041e-06], 0, 1.42254, 1667927801], "v": "v0.6"}
{"i": [["[\"mul\", 1, 1, 1, 48]", "cuda -keys=cuda,gpu -max_num_threads=1024 -model=unknown -thread_warp_size=32", [-1, 16, 64, 49152, 2147483647, 1024, 8, 32], "", 0, []], [[], [["FU", 2, [0, 1, 2, 3]], ["SP", 2, 0, 48, [48], 1], ["AN", 2, 0, 5], ["AN", 2, 1, 6]]]], "r": [[2.39191e-06, 2.37751e-06, 2.37724e-06], 0, 1.12685, 1667927800], "v": "v0.6"}
{"i": [["[\"mul\", 1, 1, 1, 48]", "cuda -keys=cuda,gpu -max_num_threads=1024 -model=unknown -thread_warp_size=32", [-1, 16, 64, 49152, 2147483647, 1024, 8, 32], "", 0, []], [[], [["FU", 2, [0, 1, 2, 3]], ["SP", 2, 0, 48, [24], 1], ["AN", 2, 0, 5], ["AN", 2, 1, 6]]]], "r": [[2.40991e-06, 2.4042e-06, 2.40419e-06], 0, 2.02146, 1667927801], "v": "v0.6"}
{"i": [["[\"mul\", 1, 1, 1, 48]", "cuda -keys=cuda,gpu -max_num_threads=1024 -model=unknown -thread_warp_size=32", [-1, 16, 64, 49152, 2147483647, 1024, 8, 32], "", 0, []], [[], [["FU", 2, [0, 1, 2, 3]], ["SP", 2, 0, 48, [3], 1], ["AN", 2, 0, 5], ["AN", 2, 1, 6]]]], "r": [[2.44436e-06, 2.44286e-06, 2.44101e-06], 0, 2.60308, 1667927802], "v": "v0.6"}
{"i": [["[\"mul\", 1, 1, 1, 48]", "cuda -keys=cuda,gpu -max_num_threads=1024 -model=unknown -thread_warp_size=32", [-1, 16, 64, 49152, 2147483647, 1024, 8, 32], "", 0, []], [[], [["FU", 2, [0, 1, 2, 3]], ["SP", 2, 0, 48, [32], 1], ["AN", 2, 0, 5], ["AN", 2, 1, 6]]]], "r": [[2.46734e-06, 2.45239e-06, 2.4543e-06], 0, 2.31129, 1667927802], "v": "v0.6"}
{"i": [["[\"mul\", 1, 1, 1, 48]", "cuda -keys=cuda,gpu -max_num_threads=1024 -model=unknown -thread_warp_size=32", [-1, 16, 64, 49152, 2147483647, 1024, 8, 32], "", 0, []], [[], [["FU", 2, [0, 1, 2, 3]], ["SP", 2, 0, 48, [2], 1], ["AN", 2, 0, 5], ["AN", 2, 1, 6]]]], "r": [[2.64399e-06, 2.64336e-06, 2.66626e-06], 0, 2.82214, 1667927802], "v": "v0.6"}
{"i": [["[\"mul\", 1, 1, 1, 48]", "cuda -keys=cuda,gpu -max_num_threads=1024 -model=unknown -thread_warp_size=32", [-1, 16, 64, 49152, 2147483647, 1024, 8, 32], "", 0, []], [[], [["FU", 2, [0, 1, 2, 3]], ["SP", 2, 0, 48, [16], 1], ["AN", 2, 0, 5], ["AN", 2, 1, 6]]]], "r": [[2.4147e-06, 2.40997e-06, 2.40995e-06], 0, 3.09327, 1667927803], "v": "v0.6"}
{"i": [["[\"mul\", 1, 1, 1, 48]", "cuda -keys=cuda,gpu -max_num_threads=1024 -model=unknown -thread_warp_size=32", [-1, 16, 64, 49152, 2147483647, 1024, 8, 32], "", 0, []], [[], [["FU", 2, [0, 1, 2, 3]], ["SP", 2, 0, 48, [4], 1], ["AN", 2, 0, 5], ["AN", 2, 1, 6]]]], "r": [[2.46655e-06, 2.46689e-06, 2.46493e-06], 0, 3.38032, 1667927803], "v": "v0.6"}
{"i": [["[\"mul\", 1, 1, 1, 48]", "cuda -keys=cuda,gpu -max_num_threads=1024 -model=unknown -thread_warp_size=32", [-1, 16, 64, 49152, 2147483647, 1024, 8, 32], "", 0, []], [[], [["FU", 2, [0, 1, 2, 3]], ["SP", 2, 0, 48, [3], 1], ["AN", 2, 0, 5], ["AN", 2, 1, 6]]]], "r": [[2.4489e-06, 2.43721e-06, 2.43639e-06], 0, 1.45727, 1667927935], "v": "v0.6"}
{"i": [["[\"mul\", 1, 1, 1, 48]", "cuda -keys=cuda,gpu -max_num_threads=1024 -model=unknown -thread_warp_size=32", [-1, 16, 64, 49152, 2147483647, 1024, 8, 32], "", 0, []], [[], [["FU", 2, [0, 1, 2, 3]], ["SP", 2, 0, 48, [4], 1], ["AN", 2, 0, 5], ["AN", 2, 1, 6]]]], "r": [[2.63147e-06, 2.63022e-06, 2.661e-06], 0, 0.857049, 1667927935], "v": "v0.6"}
{"i": [["[\"mul\", 1, 1, 1, 48]", "cuda -keys=cuda,gpu -max_num_threads=1024 -model=unknown -thread_warp_size=32", [-1, 16, 64, 49152, 2147483647, 1024, 8, 32], "", 0, []], [[], [["FU", 2, [0, 1, 2, 3]], ["SP", 2, 0, 48, [16], 1], ["AN", 2, 0, 5], ["AN", 2, 1, 6]]]], "r": [[2.55676e-06, 2.56581e-06, 2.58556e-06], 0, 0.501376, 1667927934], "v": "v0.6"}
{"i": [["[\"mul\", 1, 1, 1, 48]", "cuda -keys=cuda,gpu -max_num_threads=1024 -model=unknown -thread_warp_size=32", [-1, 16, 64, 49152, 2147483647, 1024, 8, 32], "", 0, []], [[], [["FU", 2, [0, 1, 2, 3]], ["SP", 2, 0, 48, [12], 1], ["AN", 2, 0, 5], ["AN", 2, 1, 6]]]], "r": [[2.44439e-06, 2.43202e-06, 2.43223e-06], 0, 2.08992, 1667927936], "v": "v0.6"}
{"i": [["[\"mul\", 1, 1, 1, 48]", "cuda -keys=cuda,gpu -max_num_threads=1024 -model=unknown -thread_warp_size=32", [-1, 16, 64, 49152, 2147483647, 1024, 8, 32], "", 0, []], [[], [["FU", 2, [0, 1, 2, 3]], ["SP", 2, 0, 48, [48], 1], ["AN", 2, 0, 5], ["AN", 2, 1, 6]]]], "r": [[2.39588e-06, 2.44634e-06, 2.41834e-06], 0, 1.14008, 1667927935], "v": "v0.6"}
{"i": [["[\"mul\", 1, 1, 1, 48]", "cuda -keys=cuda,gpu -max_num_threads=1024 -model=unknown -thread_warp_size=32", [-1, 16, 64, 49152, 2147483647, 1024, 8, 32], "", 0, []], [[], [["FU", 2, [0, 1, 2, 3]], ["SP", 2, 0, 48, [24], 1], ["AN", 2, 0, 5], ["AN", 2, 1, 6]]]], "r": [[2.43365e-06, 2.43062e-06, 2.4369e-06], 0, 1.78219, 1667927936], "v": "v0.6"}
{"i": [["[\"mul\", 1, 1, 1, 48]", "cuda -keys=cuda,gpu -max_num_threads=1024 -model=unknown -thread_warp_size=32", [-1, 16, 64, 49152, 2147483647, 1024, 8, 32], "", 0, []], [[], [["FU", 2, [0, 1, 2, 3]], ["SP", 2, 0, 48, [2], 1], ["AN", 2, 0, 5], ["AN", 2, 1, 6]]]], "r": [[2.64067e-06, 2.63438e-06, 2.66343e-06], 0, 2.33756, 1667927936], "v": "v0.6"}
{"i": [["[\"mul\", 1, 1, 1, 48]", "cuda -keys=cuda,gpu -max_num_threads=1024 -model=unknown -thread_warp_size=32", [-1, 16, 64, 49152, 2147483647, 1024, 8, 32], "", 0, []], [[], [["FU", 2, [0, 1, 2, 3]], ["SP", 2, 0, 48, [6], 1], ["AN", 2, 0, 5], ["AN", 2, 1, 6]]]], "r": [[2.59167e-06, 2.58138e-06, 2.61358e-06], 0, 2.63734, 1667927937], "v": "v0.6"}
{"i": [["[\"mul\", 1, 1, 1, 48]", "cuda -keys=cuda,gpu -max_num_threads=1024 -model=unknown -thread_warp_size=32", [-1, 16, 64, 49152, 2147483647, 1024, 8, 32], "", 0, []], [[], [["FU", 2, [0, 1, 2, 3]], ["SP", 2, 0, 48, [8], 1], ["AN", 2, 0, 5], ["AN", 2, 1, 6]]]], "r": [[2.46404e-06, 2.46159e-06, 2.4846e-06], 0, 2.85811, 1667927937], "v": "v0.6"}
{"i": [["[\"mul\", 1, 1, 1, 48]", "cuda -keys=cuda,gpu -max_num_threads=1024 -model=unknown -thread_warp_size=32", [-1, 16, 64, 49152, 2147483647, 1024, 8, 32], "", 0, []], [[], [["FU", 2, [0, 1, 2, 3]], ["SP", 2, 0, 48, [32], 1], ["AN", 2, 0, 5], ["AN", 2, 1, 6]]]], "r": [[2.59075e-06, 2.58483e-06, 2.61481e-06], 0, 3.08114, 1667927937], "v": "v0.6"}
{"i": [["[\"mul\", 1, 1, 1, 48]", "cuda -keys=cuda,gpu -max_num_threads=1024 -model=unknown -thread_warp_size=32", [-1, 16, 64, 49152, 2147483647, 1024, 8, 32], "", 0, []], [[], [["FU", 2, [0, 1, 2, 3]], ["SP", 2, 0, 48, [1], 1], ["AN", 2, 0, 5], ["AN", 2, 1, 6]]]], "r": [[2.64922e-06, 2.6522e-06, 2.67067e-06], 0, 3.37099, 1667927938], "v": "v0.6"}
{"i": [["[\"mul\", 1, 1, 1, 48]", "cuda -keys=cuda,gpu -max_num_threads=1024 -model=unknown -thread_warp_size=32", [-1, 16, 64, 49152, 2147483647, 1024, 8, 32], "", 0, []], [[], [["FU", 2, [0, 1, 2, 3]], ["SP", 2, 0, 48, [1], 1], ["AN", 2, 0, 5], ["AN", 2, 1, 6]]]], "r": [[2.47788e-06, 2.47384e-06, 2.47493e-06], 0, 1.73112, 1667946798], "v": "v0.6"}
{"i": [["[\"mul\", 1, 1, 1, 48]", "cuda -keys=cuda,gpu -max_num_threads=1024 -model=unknown -thread_warp_size=32", [-1, 16, 64, 49152, 2147483647, 1024, 8, 32], "", 0, []], [[], [["FU", 2, [0, 1, 2, 3]], ["SP", 2, 0, 48, [2], 1], ["AN", 2, 0, 5], ["AN", 2, 1, 6]]]], "r": [[2.62936e-06, 2.63207e-06, 2.65624e-06], 0, 1.3615, 1667946798], "v": "v0.6"}
{"i": [["[\"mul\", 1, 1, 1, 48]", "cuda -keys=cuda,gpu -max_num_threads=1024 -model=unknown -thread_warp_size=32", [-1, 16, 64, 49152, 2147483647, 1024, 8, 32], "", 0, []], [[], [["FU", 2, [0, 1, 2, 3]], ["SP", 2, 0, 48, [3], 1], ["AN", 2, 0, 5], ["AN", 2, 1, 6]]]], "r": [[2.4653e-06, 2.46203e-06, 2.41481e-06], 0, 0.852846, 1667946797], "v": "v0.6"}
{"i": [["[\"mul\", 1, 1, 1, 48]", "cuda -keys=cuda,gpu -max_num_threads=1024 -model=unknown -thread_warp_size=32", [-1, 16, 64, 49152, 2147483647, 1024, 8, 32], "", 0, []], [[], [["FU", 2, [0, 1, 2, 3]], ["SP", 2, 0, 48, [24], 1], ["AN", 2, 0, 5], ["AN", 2, 1, 6]]]], "r": [[2.44127e-06, 2.44044e-06, 2.46584e-06], 0, 0.571795, 1667946797], "v": "v0.6"}
{"i": [["[\"mul\", 1, 1, 1, 48]", "cuda -keys=cuda,gpu -max_num_threads=1024 -model=unknown -thread_warp_size=32", [-1, 16, 64, 49152, 2147483647, 1024, 8, 32], "", 0, []], [[], [["FU", 2, [0, 1, 2, 3]], ["SP", 2, 0, 48, [48], 1], ["AN", 2, 0, 5], ["AN", 2, 1, 6]]]], "r": [[2.57131e-06, 2.57006e-06, 2.60435e-06], 0, 1.99483, 1667946798], "v": "v0.6"}
{"i": [["[\"mul\", 1, 1, 1, 48]", "cuda -keys=cuda,gpu -max_num_threads=1024 -model=unknown -thread_warp_size=32", [-1, 16, 64, 49152, 2147483647, 1024, 8, 32], "", 0, []], [[], [["FU", 2, [0, 1, 2, 3]], ["SP", 2, 0, 48, [4], 1], ["AN", 2, 0, 5], ["AN", 2, 1, 6]]]], "r": [[2.47245e-06, 2.45978e-06, 2.45942e-06], 0, 2.29704, 1667946799], "v": "v0.6"}
{"i": [["[\"mul\", 1, 1, 1, 48]", "cuda -keys=cuda,gpu -max_num_threads=1024 -model=unknown -thread_warp_size=32", [-1, 16, 64, 49152, 2147483647, 1024, 8, 32], "", 0, []], [[], [["FU", 2, [0, 1, 2, 3]], ["SP", 2, 0, 48, [6], 1], ["AN", 2, 0, 5], ["AN", 2, 1, 6]]]], "r": [[2.47622e-06, 2.46129e-06, 2.46114e-06], 0, 1.02738, 1667946797], "v": "v0.6"}
{"i": [["[\"mul\", 1, 1, 1, 48]", "cuda -keys=cuda,gpu -max_num_threads=1024 -model=unknown -thread_warp_size=32", [-1, 16, 64, 49152, 2147483647, 1024, 8, 32], "", 0, []], [[], [["FU", 2, [0, 1, 2, 3]], ["SP", 2, 0, 48, [32], 1], ["AN", 2, 0, 5], ["AN", 2, 1, 6]]]], "r": [[2.44391e-06, 2.43865e-06, 2.43481e-06], 0, 2.61206, 1667946799], "v": "v0.6"}
{"i": [["[\"mul\", 1, 1, 1, 48]", "cuda -keys=cuda,gpu -max_num_threads=1024 -model=unknown -thread_warp_size=32", [-1, 16, 64, 49152, 2147483647, 1024, 8, 32], "", 0, []], [[], [["FU", 2, [0, 1, 2, 3]], ["SP", 2, 0, 48, [16], 1], ["AN", 2, 0, 5], ["AN", 2, 1, 6]]]], "r": [[2.43056e-06, 2.40603e-06, 2.40746e-06], 0, 2.85863, 1667946799], "v": "v0.6"}
{"i": [["[\"mul\", 1, 1, 1, 48]", "cuda -keys=cuda,gpu -max_num_threads=1024 -model=unknown -thread_warp_size=32", [-1, 16, 64, 49152, 2147483647, 1024, 8, 32], "", 0, []], [[], [["FU", 2, [0, 1, 2, 3]], ["SP", 2, 0, 48, [12], 1], ["AN", 2, 0, 5], ["AN", 2, 1, 6]]]], "r": [[2.42556e-06, 2.41166e-06, 2.41347e-06], 0, 3.12222, 1667946800], "v": "v0.6"}
{"i": [["[\"mul\", 1, 1, 1, 48]", "cuda -keys=cuda,gpu -max_num_threads=1024 -model=unknown -thread_warp_size=32", [-1, 16, 64, 49152, 2147483647, 1024, 8, 32], "", 0, []], [[], [["FU", 2, [0, 1, 2, 3]], ["SP", 2, 0, 48, [8], 1], ["AN", 2, 0, 5], ["AN", 2, 1, 6]]]], "r": [[2.58538e-06, 2.59699e-06, 2.60264e-06], 0, 3.42721, 1667946800], "v": "v0.6"}
{"i": [["[\"mul\", 1, 1, 1, 48]", "cuda -keys=cuda,gpu -max_num_threads=1024 -model=unknown -thread_warp_size=32", [-1, 16, 64, 49152, 2147483647, 1024, 8, 32], "", 0, []], [[], [["FU", 2, [0, 1, 2, 3]], ["SP", 2, 0, 48, [16], 1], ["AN", 2, 0, 5], ["AN", 2, 1, 6]]]], "r": [[2.41129e-06, 2.41167e-06, 2.38902e-06], 0, 1.17025, 1667947684], "v": "v0.6"}
{"i": [["[\"mul\", 1, 1, 1, 48]", "cuda -keys=cuda,gpu -max_num_threads=1024 -model=unknown -thread_warp_size=32", [-1, 16, 64, 49152, 2147483647, 1024, 8, 32], "", 0, []], [[], [["FU", 2, [0, 1, 2, 3]], ["SP", 2, 0, 48, [4], 1], ["AN", 2, 0, 5], ["AN", 2, 1, 6]]]], "r": [[2.55606e-06, 2.58548e-06, 2.58417e-06], 0, 0.554798, 1667947683], "v": "v0.6"}
{"i": [["[\"mul\", 1, 1, 1, 48]", "cuda -keys=cuda,gpu -max_num_threads=1024 -model=unknown -thread_warp_size=32", [-1, 16, 64, 49152, 2147483647, 1024, 8, 32], "", 0, []], [[], [["FU", 2, [0, 1, 2, 3]], ["SP", 2, 0, 48, [8], 1], ["AN", 2, 0, 5], ["AN", 2, 1, 6]]]], "r": [[2.47844e-06, 2.49093e-06, 2.51004e-06], 0, 1.40772, 1667947684], "v": "v0.6"}
{"i": [["[\"mul\", 1, 1, 1, 48]", "cuda -keys=cuda,gpu -max_num_threads=1024 -model=unknown -thread_warp_size=32", [-1, 16, 64, 49152, 2147483647, 1024, 8, 32], "", 0, []], [[], [["FU", 2, [0, 1, 2, 3]], ["SP", 2, 0, 48, [2], 1], ["AN", 2, 0, 5], ["AN", 2, 1, 6]]]], "r": [[2.47272e-06, 2.46464e-06, 2.46155e-06], 0, 1.7045, 1667947684], "v": "v0.6"}
{"i": [["[\"mul\", 1, 1, 1, 48]", "cuda -keys=cuda,gpu -max_num_threads=1024 -model=unknown -thread_warp_size=32", [-1, 16, 64, 49152, 2147483647, 1024, 8, 32], "", 0, []], [[], [["FU", 2, [0, 1, 2, 3]], ["SP", 2, 0, 48, [48], 1], ["AN", 2, 0, 5], ["AN", 2, 1, 6]]]], "r": [[2.42478e-06, 2.49502e-06, 2.46329e-06], 0, 0.866424, 1667947683], "v": "v0.6"}
{"i": [["[\"mul\", 1, 1, 1, 48]", "cuda -keys=cuda,gpu -max_num_threads=1024 -model=unknown -thread_warp_size=32", [-1, 16, 64, 49152, 2147483647, 1024, 8, 32], "", 0, []], [[], [["FU", 2, [0, 1, 2, 3]], ["SP", 2, 0, 48, [6], 1], ["AN", 2, 0, 5], ["AN", 2, 1, 6]]]], "r": [[2.61463e-06, 2.62449e-06, 2.64976e-06], 0, 1.95585, 1667947685], "v": "v0.6"}
{"i": [["[\"mul\", 1, 1, 1, 48]", "cuda -keys=cuda,gpu -max_num_threads=1024 -model=unknown -thread_warp_size=32", [-1, 16, 64, 49152, 2147483647, 1024, 8, 32], "", 0, []], [[], [["FU", 2, [0, 1, 2, 3]], ["SP", 2, 0, 48, [32], 1], ["AN", 2, 0, 5], ["AN", 2, 1, 6]]]], "r": [[2.47017e-06, 2.4687e-06, 2.46924e-06], 0, 2.20421, 1667947685], "v": "v0.6"}
{"i": [["[\"mul\", 1, 1, 1, 48]", "cuda -keys=cuda,gpu -max_num_threads=1024 -model=unknown -thread_warp_size=32", [-1, 16, 64, 49152, 2147483647, 1024, 8, 32], "", 0, []], [[], [["FU", 2, [0, 1, 2, 3]], ["SP", 2, 0, 48, [3], 1], ["AN", 2, 0, 5], ["AN", 2, 1, 6]]]], "r": [[2.42789e-06, 2.41248e-06, 2.4135e-06], 0, 2.74497, 1667947686], "v": "v0.6"}
{"i": [["[\"mul\", 1, 1, 1, 48]", "cuda -keys=cuda,gpu -max_num_threads=1024 -model=unknown -thread_warp_size=32", [-1, 16, 64, 49152, 2147483647, 1024, 8, 32], "", 0, []], [[], [["FU", 2, [0, 1, 2, 3]], ["SP", 2, 0, 48, [1], 1], ["AN", 2, 0, 5], ["AN", 2, 1, 6]]]], "r": [[2.49473e-06, 2.49544e-06, 2.49404e-06], 0, 2.46253, 1667947685], "v": "v0.6"}
{"i": [["[\"mul\", 1, 1, 1, 48]", "cuda -keys=cuda,gpu -max_num_threads=1024 -model=unknown -thread_warp_size=32", [-1, 16, 64, 49152, 2147483647, 1024, 8, 32], "", 0, []], [[], [["FU", 2, [0, 1, 2, 3]], ["SP", 2, 0, 48, [24], 1], ["AN", 2, 0, 5], ["AN", 2, 1, 6]]]], "r": [[2.42291e-06, 2.41885e-06, 2.41783e-06], 0, 3.01004, 1667947686], "v": "v0.6"}
{"i": [["[\"mul\", 1, 1, 1, 48]", "cuda -keys=cuda,gpu -max_num_threads=1024 -model=unknown -thread_warp_size=32", [-1, 16, 64, 49152, 2147483647, 1024, 8, 32], "", 0, []], [[], [["FU", 2, [0, 1, 2, 3]], ["SP", 2, 0, 48, [12], 1], ["AN", 2, 0, 5], ["AN", 2, 1, 6]]]], "r": [[2.47952e-06, 2.50571e-06, 2.50137e-06], 0, 3.31453, 1667947686], "v": "v0.6"}
{"i": [["[\"mul\", 1, 1, 1, 48]", "cuda -keys=cuda,gpu -max_num_threads=1024 -model=unknown -thread_warp_size=32", [-1, 16, 64, 49152, 2147483647, 1024, 8, 32], "", 0, []], [[], [["FU", 2, [0, 1, 2, 3]], ["SP", 2, 0, 48, [1], 1], ["AN", 2, 0, 5], ["AN", 2, 1, 6]]]], "r": [[2.48475e-06, 2.48231e-06, 2.48535e-06], 0, 1.21702, 1667947948], "v": "v0.6"}
{"i": [["[\"mul\", 1, 1, 1, 48]", "cuda -keys=cuda,gpu -max_num_threads=1024 -model=unknown -thread_warp_size=32", [-1, 16, 64, 49152, 2147483647, 1024, 8, 32], "", 0, []], [[], [["FU", 2, [0, 1, 2, 3]], ["SP", 2, 0, 48, [6], 1], ["AN", 2, 0, 5], ["AN", 2, 1, 6]]]], "r": [[2.43174e-06, 2.42468e-06, 2.42433e-06], 0, 1.79968, 1667947949], "v": "v0.6"}
{"i": [["[\"mul\", 1, 1, 1, 48]", "cuda -keys=cuda,gpu -max_num_threads=1024 -model=unknown -thread_warp_size=32", [-1, 16, 64, 49152, 2147483647, 1024, 8, 32], "", 0, []], [[], [["FU", 2, [0, 1, 2, 3]], ["SP", 2, 0, 48, [16], 1], ["AN", 2, 0, 5], ["AN", 2, 1, 6]]]], "r": [[2.53013e-06, 2.53275e-06, 2.5275e-06], 0, 0.924662, 1667947948], "v": "v0.6"}
{"i": [["[\"mul\", 1, 1, 1, 48]", "cuda -keys=cuda,gpu -max_num_threads=1024 -model=unknown -thread_warp_size=32", [-1, 16, 64, 49152, 2147483647, 1024, 8, 32], "", 0, []], [[], [["FU", 2, [0, 1, 2, 3]], ["SP", 2, 0, 48, [2], 1], ["AN", 2, 0, 5], ["AN", 2, 1, 6]]]], "r": [[2.62694e-06, 2.62281e-06, 2.64347e-06], 0, 1.52396, 1667947948], "v": "v0.6"}
{"i": [["[\"mul\", 1, 1, 1, 48]", "cuda -keys=cuda,gpu -max_num_threads=1024 -model=unknown -thread_warp_size=32", [-1, 16, 64, 49152, 2147483647, 1024, 8, 32], "", 0, []], [[], [["FU", 2, [0, 1, 2, 3]], ["SP", 2, 0, 48, [24], 1], ["AN", 2, 0, 5], ["AN", 2, 1, 6]]]], "r": [[2.44105e-06, 2.44278e-06, 2.45128e-06], 0, 0.522465, 1667947947], "v": "v0.6"}
{"i": [["[\"mul\", 1, 1, 1, 48]", "cuda -keys=cuda,gpu -max_num_threads=1024 -model=unknown -thread_warp_size=32", [-1, 16, 64, 49152, 2147483647, 1024, 8, 32], "", 0, []], [[], [["FU", 2, [0, 1, 2, 3]], ["SP", 2, 0, 48, [4], 1], ["AN", 2, 0, 5], ["AN", 2, 1, 6]]]], "r": [[2.50481e-06, 2.53505e-06, 2.53568e-06], 0, 2.02092, 1667947949], "v": "v0.6"}
{"i": [["[\"mul\", 1, 1, 1, 48]", "cuda -keys=cuda,gpu -max_num_threads=1024 -model=unknown -thread_warp_size=32", [-1, 16, 64, 49152, 2147483647, 1024, 8, 32], "", 0, []], [[], [["FU", 2, [0, 1, 2, 3]], ["SP", 2, 0, 48, [32], 1], ["AN", 2, 0, 5], ["AN", 2, 1, 6]]]], "r": [[2.42842e-06, 2.41821e-06, 2.41251e-06], 0, 2.62469, 1667947950], "v": "v0.6"}
{"i": [["[\"mul\", 1, 1, 1, 48]", "cuda -keys=cuda,gpu -max_num_threads=1024 -model=unknown -thread_warp_size=32", [-1, 16, 64, 49152, 2147483647, 1024, 8, 32], "", 0, []], [[], [["FU", 2, [0, 1, 2, 3]], ["SP", 2, 0, 48, [3], 1], ["AN", 2, 0, 5], ["AN", 2, 1, 6]]]], "r": [[2.44151e-06, 2.43339e-06, 2.42652e-06], 0, 2.28724, 1667947949], "v": "v0.6"}
{"i": [["[\"mul\", 1, 1, 1, 48]", "cuda -keys=cuda,gpu -max_num_threads=1024 -model=unknown -thread_warp_size=32", [-1, 16, 64, 49152, 2147483647, 1024, 8, 32], "", 0, []], [[], [["FU", 2, [0, 1, 2, 3]], ["SP", 2, 0, 48, [48], 1], ["AN", 2, 0, 5], ["AN", 2, 1, 6]]]], "r": [[2.42629e-06, 2.40668e-06, 2.4061e-06], 0, 2.85346, 1667947950], "v": "v0.6"}
{"i": [["[\"mul\", 1, 1, 1, 48]", "cuda -keys=cuda,gpu -max_num_threads=1024 -model=unknown -thread_warp_size=32", [-1, 16, 64, 49152, 2147483647, 1024, 8, 32], "", 0, []], [[], [["FU", 2, [0, 1, 2, 3]], ["SP", 2, 0, 48, [8], 1], ["AN", 2, 0, 5], ["AN", 2, 1, 6]]]], "r": [[2.61829e-06, 2.61512e-06, 2.6526e-06], 0, 3.10186, 1667947950], "v": "v0.6"}
{"i": [["[\"mul\", 1, 1, 1, 48]", "cuda -keys=cuda,gpu -max_num_threads=1024 -model=unknown -thread_warp_size=32", [-1, 16, 64, 49152, 2147483647, 1024, 8, 32], "", 0, []], [[], [["FU", 2, [0, 1, 2, 3]], ["SP", 2, 0, 48, [12], 1], ["AN", 2, 0, 5], ["AN", 2, 1, 6]]]], "r": [[2.44627e-06, 2.45209e-06, 2.44654e-06], 0, 3.39588, 1667947951], "v": "v0.6"}
{"i": [["[\"mul\", 1, 1, 1, 48]", "cuda -keys=cuda,gpu -max_num_threads=1024 -model=unknown -thread_warp_size=32", [-1, 16, 64, 49152, 2147483647, 1024, 8, 32], "", 0, []], [[], [["FU", 2, [0, 1, 2, 3]], ["SP", 2, 0, 48, [3], 1], ["AN", 2, 0, 5], ["AN", 2, 1, 6]]]], "r": [[2.43843e-06, 2.41437e-06, 2.41635e-06], 0, 1.25554, 1667948512], "v": "v0.6"}
{"i": [["[\"mul\", 1, 1, 1, 48]", "cuda -keys=cuda,gpu -max_num_threads=1024 -model=unknown -thread_warp_size=32", [-1, 16, 64, 49152, 2147483647, 1024, 8, 32], "", 0, []], [[], [["FU", 2, [0, 1, 2, 3]], ["SP", 2, 0, 48, [8], 1], ["AN", 2, 0, 5], ["AN", 2, 1, 6]]]], "r": [[2.43423e-06, 2.4336e-06, 2.43523e-06], 0, 1.44578, 1667948513], "v": "v0.6"}
{"i": [["[\"mul\", 1, 1, 1, 48]", "cuda -keys=cuda,gpu -max_num_threads=1024 -model=unknown -thread_warp_size=32", [-1, 16, 64, 49152, 2147483647, 1024, 8, 32], "", 0, []], [[], [["FU", 2, [0, 1, 2, 3]], ["SP", 2, 0, 48, [12], 1], ["AN", 2, 0, 5], ["AN", 2, 1, 6]]]], "r": [[2.60247e-06, 2.63036e-06, 2.62847e-06], 0, 0.552458, 1667948512], "v": "v0.6"}
{"i": [["[\"mul\", 1, 1, 1, 48]", "cuda -keys=cuda,gpu -max_num_threads=1024 -model=unknown -thread_warp_size=32", [-1, 16, 64, 49152, 2147483647, 1024, 8, 32], "", 0, []], [[], [["FU", 2, [0, 1, 2, 3]], ["SP", 2, 0, 48, [48], 1], ["AN", 2, 0, 5], ["AN", 2, 1, 6]]]], "r": [[2.40803e-06, 2.40451e-06, 2.39454e-06], 0, 0.897932, 1667948512], "v": "v0.6"}
{"i": [["[\"mul\", 1, 1, 1, 48]", "cuda -keys=cuda,gpu -max_num_threads=1024 -model=unknown -thread_warp_size=32", [-1, 16, 64, 49152, 2147483647, 1024, 8, 32], "", 0, []], [[], [["FU", 2, [0, 1, 2, 3]], ["SP", 2, 0, 48, [2], 1], ["AN", 2, 0, 5], ["AN", 2, 1, 6]]]], "r": [[2.52847e-06, 2.56369e-06, 2.56317e-06], 0, 1.76612, 1667948513], "v": "v0.6"}
{"i": [["[\"mul\", 1, 1, 1, 48]", "cuda -keys=cuda,gpu -max_num_threads=1024 -model=unknown -thread_warp_size=32", [-1, 16, 64, 49152, 2147483647, 1024, 8, 32], "", 0, []], [[], [["FU", 2, [0, 1, 2, 3]], ["SP", 2, 0, 48, [16], 1], ["AN", 2, 0, 5], ["AN", 2, 1, 6]]]], "r": [[2.56951e-06, 2.57096e-06, 2.59566e-06], 0, 1.99877, 1667948513], "v": "v0.6"}
{"i": [["[\"mul\", 1, 1, 1, 48]", "cuda -keys=cuda,gpu -max_num_threads=1024 -model=unknown -thread_warp_size=32", [-1, 16, 64, 49152, 2147483647, 1024, 8, 32], "", 0, []], [[], [["FU", 2, [0, 1, 2, 3]], ["SP", 2, 0, 48, [24], 1], ["AN", 2, 0, 5], ["AN", 2, 1, 6]]]], "r": [[2.42373e-06, 2.40338e-06, 2.40065e-06], 0, 2.29427, 1667948514], "v": "v0.6"}
{"i": [["[\"mul\", 1, 1, 1, 48]", "cuda -keys=cuda,gpu -max_num_threads=1024 -model=unknown -thread_warp_size=32", [-1, 16, 64, 49152, 2147483647, 1024, 8, 32], "", 0, []], [[], [["FU", 2, [0, 1, 2, 3]], ["SP", 2, 0, 48, [6], 1], ["AN", 2, 0, 5], ["AN", 2, 1, 6]]]], "r": [[2.41969e-06, 2.40707e-06, 2.40333e-06], 0, 2.62144, 1667948514], "v": "v0.6"}
{"i": [["[\"mul\", 1, 1, 1, 48]", "cuda -keys=cuda,gpu -max_num_threads=1024 -model=unknown -thread_warp_size=32", [-1, 16, 64, 49152, 2147483647, 1024, 8, 32], "", 0, []], [[], [["FU", 2, [0, 1, 2, 3]], ["SP", 2, 0, 48, [32], 1], ["AN", 2, 0, 5], ["AN", 2, 1, 6]]]], "r": [[2.60534e-06, 2.60137e-06, 2.62438e-06], 0, 2.86737, 1667948514], "v": "v0.6"}
{"i": [["[\"mul\", 1, 1, 1, 48]", "cuda -keys=cuda,gpu -max_num_threads=1024 -model=unknown -thread_warp_size=32", [-1, 16, 64, 49152, 2147483647, 1024, 8, 32], "", 0, []], [[], [["FU", 2, [0, 1, 2, 3]], ["SP", 2, 0, 48, [1], 1], ["AN", 2, 0, 5], ["AN", 2, 1, 6]]]], "r": [[2.6272e-06, 2.61699e-06, 2.64337e-06], 0, 3.09933, 1667948515], "v": "v0.6"}
{"i": [["[\"mul\", 1, 1, 1, 48]", "cuda -keys=cuda,gpu -max_num_threads=1024 -model=unknown -thread_warp_size=32", [-1, 16, 64, 49152, 2147483647, 1024, 8, 32], "", 0, []], [[], [["FU", 2, [0, 1, 2, 3]], ["SP", 2, 0, 48, [4], 1], ["AN", 2, 0, 5], ["AN", 2, 1, 6]]]], "r": [[2.62273e-06, 2.61426e-06, 2.61628e-06], 0, 3.38586, 1667948515], "v": "v0.6"}
