python/models/efficientnet/VertiFusionEfficientNet_kernel_configs/efficient_sigmoid_1_14_14_672.log
{"i": [["[\"sigmoid\", 1, 14, 14, 672]", "cuda -keys=cuda,gpu -max_num_threads=1024 -model=unknown -thread_warp_size=32", [-1, 16, 64, 49152, 2147483647, 1024, 8, 32], "", 0, []], [[], [["FU", 1, [0, 1, 2, 3]], ["SP", 1, 0, 131712, [48], 1], ["AN", 1, 0, 5], ["AN", 1, 1, 6]]]], "r": [[4.72765e-06, 4.73684e-06, 4.73914e-06], 0, 0.566728, 1667927140], "v": "v0.6"}
{"i": [["[\"sigmoid\", 1, 14, 14, 672]", "cuda -keys=cuda,gpu -max_num_threads=1024 -model=unknown -thread_warp_size=32", [-1, 16, 64, 49152, 2147483647, 1024, 8, 32], "", 0, []], [[], [["FU", 1, [0, 1, 2, 3]], ["SP", 1, 0, 131712, [12], 1], ["AN", 1, 0, 5], ["AN", 1, 1, 6]]]], "r": [[1.1161e-05, 1.11782e-05, 1.11781e-05], 0, 1.53792, 1667927141], "v": "v0.6"}
{"i": [["[\"sigmoid\", 1, 14, 14, 672]", "cuda -keys=cuda,gpu -max_num_threads=1024 -model=unknown -thread_warp_size=32", [-1, 16, 64, 49152, 2147483647, 1024, 8, 32], "", 0, []], [[], [["FU", 1, [0, 1, 2, 3]], ["SP", 1, 0, 131712, [49], 1], ["AN", 1, 0, 5], ["AN", 1, 1, 6]]]], "r": [[4.71891e-06, 4.73675e-06, 4.7431e-06], 0, 2.15491, 1667927141], "v": "v0.6"}
{"i": [["[\"sigmoid\", 1, 14, 14, 672]", "cuda -keys=cuda,gpu -max_num_threads=1024 -model=unknown -thread_warp_size=32", [-1, 16, 64, 49152, 2147483647, 1024, 8, 32], "", 0, []], [[], [["FU", 1, [0, 1, 2, 3]], ["SP", 1, 0, 131712, [24], 1], ["AN", 1, 0, 5], ["AN", 1, 1, 6]]]], "r": [[6.92876e-06, 6.95173e-06, 6.95315e-06], 0, 1.31793, 1667927140], "v": "v0.6"}
{"i": [["[\"sigmoid\", 1, 14, 14, 672]", "cuda -keys=cuda,gpu -max_num_threads=1024 -model=unknown -thread_warp_size=32", [-1, 16, 64, 49152, 2147483647, 1024, 8, 32], "", 0, []], [[], [["FU", 1, [0, 1, 2, 3]], ["SP", 1, 0, 131712, [1], 1], ["AN", 1, 0, 5], ["AN", 1, 1, 6]]]], "r": [[0.000100585, 0.000100588, 0.00010059], 0, 0.985069, 1667927140], "v": "v0.6"}
{"i": [["[\"sigmoid\", 1, 14, 14, 672]", "cuda -keys=cuda,gpu -max_num_threads=1024 -model=unknown -thread_warp_size=32", [-1, 16, 64, 49152, 2147483647, 1024, 8, 32], "", 0, []], [[], [["FU", 1, [0, 1, 2, 3]], ["SP", 1, 0, 131712, [6], 1], ["AN", 1, 0, 5], ["AN", 1, 1, 6]]]], "r": [[1.92848e-05, 1.93036e-05, 1.93022e-05], 0, 1.87174, 1667927141], "v": "v0.6"}
{"i": [["[\"sigmoid\", 1, 14, 14, 672]", "cuda -keys=cuda,gpu -max_num_threads=1024 -model=unknown -thread_warp_size=32", [-1, 16, 64, 49152, 2147483647, 1024, 8, 32], "", 0, []], [[], [["FU", 1, [0, 1, 2, 3]], ["SP", 1, 0, 131712, [3], 1], ["AN", 1, 0, 5], ["AN", 1, 1, 6]]]], "r": [[3.55728e-05, 3.55923e-05, 3.55999e-05], 0, 2.43102, 1667927142], "v": "v0.6"}
{"i": [["[\"sigmoid\", 1, 14, 14, 672]", "cuda -keys=cuda,gpu -max_num_threads=1024 -model=unknown -thread_warp_size=32", [-1, 16, 64, 49152, 2147483647, 1024, 8, 32], "", 0, []], [[], [["FU", 1, [0, 1, 2, 3]], ["SP", 1, 0, 131712, [64], 1], ["AN", 1, 0, 5], ["AN", 1, 1, 6]]]], "r": [[4.13424e-06, 4.1524e-06, 4.14613e-06], 0, 2.72434, 1667927142], "v": "v0.6"}
{"i": [["[\"sigmoid\", 1, 14, 14, 672]", "cuda -keys=cuda,gpu -max_num_threads=1024 -model=unknown -thread_warp_size=32", [-1, 16, 64, 49152, 2147483647, 1024, 8, 32], "", 0, []], [[], [["FU", 1, [0, 1, 2, 3]], ["SP", 1, 0, 131712, [16], 1], ["AN", 1, 0, 5], ["AN", 1, 1, 6]]]], "r": [[9.01642e-06, 9.02694e-06, 9.02443e-06], 0, 2.98608, 1667927142], "v": "v0.6"}
{"i": [["[\"sigmoid\", 1, 14, 14, 672]", "cuda -keys=cuda,gpu -max_num_threads=1024 -model=unknown -thread_warp_size=32", [-1, 16, 64, 49152, 2147483647, 1024, 8, 32], "", 0, []], [[], [["FU", 1, [0, 1, 2, 3]], ["SP", 1, 0, 131712, [8], 1], ["AN", 1, 0, 5], ["AN", 1, 1, 6]]]], "r": [[1.51024e-05, 1.51141e-05, 1.51067e-05], 0, 3.40838, 1667927143], "v": "v0.6"}
{"i": [["[\"sigmoid\", 1, 14, 14, 672]", "cuda -keys=cuda,gpu -max_num_threads=1024 -model=unknown -thread_warp_size=32", [-1, 16, 64, 49152, 2147483647, 1024, 8, 32], "", 0, []], [[], [["FU", 1, [0, 1, 2, 3]], ["SP", 1, 0, 131712, [56], 1], ["AN", 1, 0, 5], ["AN", 1, 1, 6]]]], "r": [[4.41325e-06, 4.41973e-06, 4.41885e-06], 0, 3.06984, 1667927143], "v": "v0.6"}
{"i": [["[\"sigmoid\", 1, 14, 14, 672]", "cuda -keys=cuda,gpu -max_num_threads=1024 -model=unknown -thread_warp_size=32", [-1, 16, 64, 49152, 2147483647, 1024, 8, 32], "", 0, []], [[], [["FU", 1, [0, 1, 2, 3]], ["SP", 1, 0, 131712, [28], 1], ["AN", 1, 0, 5], ["AN", 1, 1, 6]]]], "r": [[6.21878e-06, 6.23224e-06, 6.2341e-06], 0, 3.64498, 1667927143], "v": "v0.6"}
{"i": [["[\"sigmoid\", 1, 14, 14, 672]", "cuda -keys=cuda,gpu -max_num_threads=1024 -model=unknown -thread_warp_size=32", [-1, 16, 64, 49152, 2147483647, 1024, 8, 32], "", 0, []], [[], [["FU", 1, [0, 1, 2, 3]], ["SP", 1, 0, 131712, [32], 1], ["AN", 1, 0, 5], ["AN", 1, 1, 6]]]], "r": [[5.88299e-06, 5.90381e-06, 5.90055e-06], 0, 3.9183, 1667927143], "v": "v0.6"}
{"i": [["[\"sigmoid\", 1, 14, 14, 672]", "cuda -keys=cuda,gpu -max_num_threads=1024 -model=unknown -thread_warp_size=32", [-1, 16, 64, 49152, 2147483647, 1024, 8, 32], "", 0, []], [[], [["FU", 1, [0, 1, 2, 3]], ["SP", 1, 0, 131712, [14], 1], ["AN", 1, 0, 5], ["AN", 1, 1, 6]]]], "r": [[9.86988e-06, 9.89178e-06, 9.89394e-06], 0, 4.20964, 1667927144], "v": "v0.6"}
{"i": [["[\"sigmoid\", 1, 14, 14, 672]", "cuda -keys=cuda,gpu -max_num_threads=1024 -model=unknown -thread_warp_size=32", [-1, 16, 64, 49152, 2147483647, 1024, 8, 32], "", 0, []], [[], [["FU", 1, [0, 1, 2, 3]], ["SP", 1, 0, 131712, [21], 1], ["AN", 1, 0, 5], ["AN", 1, 1, 6]]]], "r": [[7.54479e-06, 7.54684e-06, 7.54847e-06], 0, 4.45467, 1667927144], "v": "v0.6"}
{"i": [["[\"sigmoid\", 1, 14, 14, 672]", "cuda -keys=cuda,gpu -max_num_threads=1024 -model=unknown -thread_warp_size=32", [-1, 16, 64, 49152, 2147483647, 1024, 8, 32], "", 0, []], [[], [["FU", 1, [0, 1, 2, 3]], ["SP", 1, 0, 131712, [4], 1], ["AN", 1, 0, 5], ["AN", 1, 1, 6]]]], "r": [[2.74276e-05, 2.74513e-05, 2.74498e-05], 0, 4.68544, 1667927144], "v": "v0.6"}
{"i": [["[\"sigmoid\", 1, 14, 14, 672]", "cuda -keys=cuda,gpu -max_num_threads=1024 -model=unknown -thread_warp_size=32", [-1, 16, 64, 49152, 2147483647, 1024, 8, 32], "", 0, []], [[], [["FU", 1, [0, 1, 2, 3]], ["SP", 1, 0, 131712, [2], 1], ["AN", 1, 0, 5], ["AN", 1, 1, 6]]]], "r": [[5.17404e-05, 5.1733e-05, 5.17379e-05], 0, 5.00335, 1667927145], "v": "v0.6"}
{"i": [["[\"sigmoid\", 1, 14, 14, 672]", "cuda -keys=cuda,gpu -max_num_threads=1024 -model=unknown -thread_warp_size=32", [-1, 16, 64, 49152, 2147483647, 1024, 8, 32], "", 0, []], [[], [["FU", 1, [0, 1, 2, 3]], ["SP", 1, 0, 131712, [42], 1], ["AN", 1, 0, 5], ["AN", 1, 1, 6]]]], "r": [[5.02332e-06, 5.04757e-06, 5.04793e-06], 0, 5.54848, 1667927145], "v": "v0.6"}
{"i": [["[\"sigmoid\", 1, 14, 14, 672]", "cuda -keys=cuda,gpu -max_num_threads=1024 -model=unknown -thread_warp_size=32", [-1, 16, 64, 49152, 2147483647, 1024, 8, 32], "", 0, []], [[], [["FU", 1, [0, 1, 2, 3]], ["SP", 1, 0, 131712, [7], 1], ["AN", 1, 0, 5], ["AN", 1, 1, 6]]]], "r": [[1.7013e-05, 1.70309e-05, 1.70236e-05], 0, 5.30645, 1667927145], "v": "v0.6"}
{"i": [["[\"sigmoid\", 1, 14, 14, 672]", "cuda -keys=cuda,gpu -max_num_threads=1024 -model=unknown -thread_warp_size=32", [-1, 16, 64, 49152, 2147483647, 1024, 8, 32], "", 0, []], [[], [["FU", 1, [0, 1, 2, 3]], ["SP", 1, 0, 131712, [28], 1], ["AN", 1, 0, 5], ["AN", 1, 1, 6]]]], "r": [[6.29766e-06, 6.31038e-06, 6.31124e-06], 0, 1.99092, 1667927231], "v": "v0.6"}
{"i": [["[\"sigmoid\", 1, 14, 14, 672]", "cuda -keys=cuda,gpu -max_num_threads=1024 -model=unknown -thread_warp_size=32", [-1, 16, 64, 49152, 2147483647, 1024, 8, 32], "", 0, []], [[], [["FU", 1, [0, 1, 2, 3]], ["SP", 1, 0, 131712, [4], 1], ["AN", 1, 0, 5], ["AN", 1, 1, 6]]]], "r": [[2.72742e-05, 2.72899e-05, 2.72734e-05], 0, 2.32929, 1667927232], "v": "v0.6"}
{"i": [["[\"sigmoid\", 1, 14, 14, 672]", "cuda -keys=cuda,gpu -max_num_threads=1024 -model=unknown -thread_warp_size=32", [-1, 16, 64, 49152, 2147483647, 1024, 8, 32], "", 0, []], [[], [["FU", 1, [0, 1, 2, 3]], ["SP", 1, 0, 131712, [2], 1], ["AN", 1, 0, 5], ["AN", 1, 1, 6]]]], "r": [[5.15873e-05, 5.16018e-05, 5.16019e-05], 0, 1.73854, 1667927231], "v": "v0.6"}
{"i": [["[\"sigmoid\", 1, 14, 14, 672]", "cuda -keys=cuda,gpu -max_num_threads=1024 -model=unknown -thread_warp_size=32", [-1, 16, 64, 49152, 2147483647, 1024, 8, 32], "", 0, []], [[], [["FU", 1, [0, 1, 2, 3]], ["SP", 1, 0, 131712, [32], 1], ["AN", 1, 0, 5], ["AN", 1, 1, 6]]]], "r": [[5.95309e-06, 5.95858e-06, 5.95294e-06], 0, 0.606978, 1667927230], "v": "v0.6"}
{"i": [["[\"sigmoid\", 1, 14, 14, 672]", "cuda -keys=cuda,gpu -max_num_threads=1024 -model=unknown -thread_warp_size=32", [-1, 16, 64, 49152, 2147483647, 1024, 8, 32], "", 0, []], [[], [["FU", 1, [0, 1, 2, 3]], ["SP", 1, 0, 131712, [16], 1], ["AN", 1, 0, 5], ["AN", 1, 1, 6]]]], "r": [[8.86796e-06, 8.88203e-06, 8.87337e-06], 0, 0.939656, 1667927230], "v": "v0.6"}
{"i": [["[\"sigmoid\", 1, 14, 14, 672]", "cuda -keys=cuda,gpu -max_num_threads=1024 -model=unknown -thread_warp_size=32", [-1, 16, 64, 49152, 2147483647, 1024, 8, 32], "", 0, []], [[], [["FU", 1, [0, 1, 2, 3]], ["SP", 1, 0, 131712, [48], 1], ["AN", 1, 0, 5], ["AN", 1, 1, 6]]]], "r": [[4.66836e-06, 4.67936e-06, 4.67855e-06], 0, 1.20913, 1667927230], "v": "v0.6"}
{"i": [["[\"sigmoid\", 1, 14, 14, 672]", "cuda -keys=cuda,gpu -max_num_threads=1024 -model=unknown -thread_warp_size=32", [-1, 16, 64, 49152, 2147483647, 1024, 8, 32], "", 0, []], [[], [["FU", 1, [0, 1, 2, 3]], ["SP", 1, 0, 131712, [7], 1], ["AN", 1, 0, 5], ["AN", 1, 1, 6]]]], "r": [[1.69185e-05, 1.69245e-05, 1.69269e-05], 0, 1.46076, 1667927231], "v": "v0.6"}
{"i": [["[\"sigmoid\", 1, 14, 14, 672]", "cuda -keys=cuda,gpu -max_num_threads=1024 -model=unknown -thread_warp_size=32", [-1, 16, 64, 49152, 2147483647, 1024, 8, 32], "", 0, []], [[], [["FU", 1, [0, 1, 2, 3]], ["SP", 1, 0, 131712, [24], 1], ["AN", 1, 0, 5], ["AN", 1, 1, 6]]]], "r": [[6.81905e-06, 6.8305e-06, 6.82815e-06], 0, 2.58366, 1667927232], "v": "v0.6"}
{"i": [["[\"sigmoid\", 1, 14, 14, 672]", "cuda -keys=cuda,gpu -max_num_threads=1024 -model=unknown -thread_warp_size=32", [-1, 16, 64, 49152, 2147483647, 1024, 8, 32], "", 0, []], [[], [["FU", 1, [0, 1, 2, 3]], ["SP", 1, 0, 131712, [21], 1], ["AN", 1, 0, 5], ["AN", 1, 1, 6]]]], "r": [[7.57585e-06, 7.58819e-06, 7.58271e-06], 0, 2.83425, 1667927232], "v": "v0.6"}
{"i": [["[\"sigmoid\", 1, 14, 14, 672]", "cuda -keys=cuda,gpu -max_num_threads=1024 -model=unknown -thread_warp_size=32", [-1, 16, 64, 49152, 2147483647, 1024, 8, 32], "", 0, []], [[], [["FU", 1, [0, 1, 2, 3]], ["SP", 1, 0, 131712, [49], 1], ["AN", 1, 0, 5], ["AN", 1, 1, 6]]]], "r": [[4.66298e-06, 4.67533e-06, 4.67326e-06], 0, 3.04707, 1667927233], "v": "v0.6"}
{"i": [["[\"sigmoid\", 1, 14, 14, 672]", "cuda -keys=cuda,gpu -max_num_threads=1024 -model=unknown -thread_warp_size=32", [-1, 16, 64, 49152, 2147483647, 1024, 8, 32], "", 0, []], [[], [["FU", 1, [0, 1, 2, 3]], ["SP", 1, 0, 131712, [3], 1], ["AN", 1, 0, 5], ["AN", 1, 1, 6]]]], "r": [[3.54477e-05, 3.54738e-05, 3.54822e-05], 0, 3.56704, 1667927233], "v": "v0.6"}
{"i": [["[\"sigmoid\", 1, 14, 14, 672]", "cuda -keys=cuda,gpu -max_num_threads=1024 -model=unknown -thread_warp_size=32", [-1, 16, 64, 49152, 2147483647, 1024, 8, 32], "", 0, []], [[], [["FU", 1, [0, 1, 2, 3]], ["SP", 1, 0, 131712, [12], 1], ["AN", 1, 0, 5], ["AN", 1, 1, 6]]]], "r": [[1.10369e-05, 1.10626e-05, 1.1064e-05], 0, 3.31231, 1667927233], "v": "v0.6"}
{"i": [["[\"sigmoid\", 1, 14, 14, 672]", "cuda -keys=cuda,gpu -max_num_threads=1024 -model=unknown -thread_warp_size=32", [-1, 16, 64, 49152, 2147483647, 1024, 8, 32], "", 0, []], [[], [["FU", 1, [0, 1, 2, 3]], ["SP", 1, 0, 131712, [14], 1], ["AN", 1, 0, 5], ["AN", 1, 1, 6]]]], "r": [[9.86829e-06, 9.88855e-06, 9.88747e-06], 0, 4.14711, 1667927234], "v": "v0.6"}
{"i": [["[\"sigmoid\", 1, 14, 14, 672]", "cuda -keys=cuda,gpu -max_num_threads=1024 -model=unknown -thread_warp_size=32", [-1, 16, 64, 49152, 2147483647, 1024, 8, 32], "", 0, []], [[], [["FU", 1, [0, 1, 2, 3]], ["SP", 1, 0, 131712, [1], 1], ["AN", 1, 0, 5], ["AN", 1, 1, 6]]]], "r": [[0.000100508, 0.000100528, 0.00010052], 0, 3.81127, 1667927234], "v": "v0.6"}
{"i": [["[\"sigmoid\", 1, 14, 14, 672]", "cuda -keys=cuda,gpu -max_num_threads=1024 -model=unknown -thread_warp_size=32", [-1, 16, 64, 49152, 2147483647, 1024, 8, 32], "", 0, []], [[], [["FU", 1, [0, 1, 2, 3]], ["SP", 1, 0, 131712, [6], 1], ["AN", 1, 0, 5], ["AN", 1, 1, 6]]]], "r": [[1.92698e-05, 1.92892e-05, 1.9286e-05], 0, 4.40298, 1667927234], "v": "v0.6"}
{"i": [["[\"sigmoid\", 1, 14, 14, 672]", "cuda -keys=cuda,gpu -max_num_threads=1024 -model=unknown -thread_warp_size=32", [-1, 16, 64, 49152, 2147483647, 1024, 8, 32], "", 0, []], [[], [["FU", 1, [0, 1, 2, 3]], ["SP", 1, 0, 131712, [56], 1], ["AN", 1, 0, 5], ["AN", 1, 1, 6]]]], "r": [[4.37244e-06, 4.39119e-06, 4.39157e-06], 0, 4.65501, 1667927235], "v": "v0.6"}
{"i": [["[\"sigmoid\", 1, 14, 14, 672]", "cuda -keys=cuda,gpu -max_num_threads=1024 -model=unknown -thread_warp_size=32", [-1, 16, 64, 49152, 2147483647, 1024, 8, 32], "", 0, []], [[], [["FU", 1, [0, 1, 2, 3]], ["SP", 1, 0, 131712, [64], 1], ["AN", 1, 0, 5], ["AN", 1, 1, 6]]]], "r": [[4.09612e-06, 4.1076e-06, 4.10692e-06], 0, 4.95815, 1667927235], "v": "v0.6"}
{"i": [["[\"sigmoid\", 1, 14, 14, 672]", "cuda -keys=cuda,gpu -max_num_threads=1024 -model=unknown -thread_warp_size=32", [-1, 16, 64, 49152, 2147483647, 1024, 8, 32], "", 0, []], [[], [["FU", 1, [0, 1, 2, 3]], ["SP", 1, 0, 131712, [42], 1], ["AN", 1, 0, 5], ["AN", 1, 1, 6]]]], "r": [[4.99231e-06, 5.00184e-06, 5.01028e-06], 0, 5.52106, 1667927236], "v": "v0.6"}
{"i": [["[\"sigmoid\", 1, 14, 14, 672]", "cuda -keys=cuda,gpu -max_num_threads=1024 -model=unknown -thread_warp_size=32", [-1, 16, 64, 49152, 2147483647, 1024, 8, 32], "", 0, []], [[], [["FU", 1, [0, 1, 2, 3]], ["SP", 1, 0, 131712, [8], 1], ["AN", 1, 0, 5], ["AN", 1, 1, 6]]]], "r": [[1.51402e-05, 1.51493e-05, 1.51463e-05], 0, 5.20566, 1667927235], "v": "v0.6"}
{"i": [["[\"sigmoid\", 1, 14, 14, 672]", "cuda -keys=cuda,gpu -max_num_threads=1024 -model=unknown -thread_warp_size=32", [-1, 16, 64, 49152, 2147483647, 1024, 8, 32], "", 0, []], [[], [["FU", 1, [0, 1, 2, 3]], ["SP", 1, 0, 131712, [48], 1], ["AN", 1, 0, 5], ["AN", 1, 1, 6]]]], "r": [[4.63175e-06, 4.64382e-06, 4.64774e-06], 0, 1.82361, 1667942903], "v": "v0.6"}
{"i": [["[\"sigmoid\", 1, 14, 14, 672]", "cuda -keys=cuda,gpu -max_num_threads=1024 -model=unknown -thread_warp_size=32", [-1, 16, 64, 49152, 2147483647, 1024, 8, 32], "", 0, []], [[], [["FU", 1, [0, 1, 2, 3]], ["SP", 1, 0, 131712, [2], 1], ["AN", 1, 0, 5], ["AN", 1, 1, 6]]]], "r": [[5.17169e-05, 5.17378e-05, 5.17543e-05], 0, 2.69862, 1667942904], "v": "v0.6"}
{"i": [["[\"sigmoid\", 1, 14, 14, 672]", "cuda -keys=cuda,gpu -max_num_threads=1024 -model=unknown -thread_warp_size=32", [-1, 16, 64, 49152, 2147483647, 1024, 8, 32], "", 0, []], [[], [["FU", 1, [0, 1, 2, 3]], ["SP", 1, 0, 131712, [3], 1], ["AN", 1, 0, 5], ["AN", 1, 1, 6]]]], "r": [[3.54417e-05, 3.54637e-05, 3.54574e-05], 0, 1.22643, 1667942902], "v": "v0.6"}
{"i": [["[\"sigmoid\", 1, 14, 14, 672]", "cuda -keys=cuda,gpu -max_num_threads=1024 -model=unknown -thread_warp_size=32", [-1, 16, 64, 49152, 2147483647, 1024, 8, 32], "", 0, []], [[], [["FU", 1, [0, 1, 2, 3]], ["SP", 1, 0, 131712, [28], 1], ["AN", 1, 0, 5], ["AN", 1, 1, 6]]]], "r": [[6.1199e-06, 6.13205e-06, 6.13185e-06], 0, 0.916479, 1667942902], "v": "v0.6"}
{"i": [["[\"sigmoid\", 1, 14, 14, 672]", "cuda -keys=cuda,gpu -max_num_threads=1024 -model=unknown -thread_warp_size=32", [-1, 16, 64, 49152, 2147483647, 1024, 8, 32], "", 0, []], [[], [["FU", 1, [0, 1, 2, 3]], ["SP", 1, 0, 131712, [1], 1], ["AN", 1, 0, 5], ["AN", 1, 1, 6]]]], "r": [[0.000100565, 0.000100578, 0.000100597], 0, 1.4866, 1667942902], "v": "v0.6"}
{"i": [["[\"sigmoid\", 1, 14, 14, 672]", "cuda -keys=cuda,gpu -max_num_threads=1024 -model=unknown -thread_warp_size=32", [-1, 16, 64, 49152, 2147483647, 1024, 8, 32], "", 0, []], [[], [["FU", 1, [0, 1, 2, 3]], ["SP", 1, 0, 131712, [6], 1], ["AN", 1, 0, 5], ["AN", 1, 1, 6]]]], "r": [[1.92334e-05, 1.92452e-05, 1.925e-05], 0, 2.39403, 1667942903], "v": "v0.6"}
{"i": [["[\"sigmoid\", 1, 14, 14, 672]", "cuda -keys=cuda,gpu -max_num_threads=1024 -model=unknown -thread_warp_size=32", [-1, 16, 64, 49152, 2147483647, 1024, 8, 32], "", 0, []], [[], [["FU", 1, [0, 1, 2, 3]], ["SP", 1, 0, 131712, [16], 1], ["AN", 1, 0, 5], ["AN", 1, 1, 6]]]], "r": [[8.95298e-06, 8.96559e-06, 8.96564e-06], 0, 0.594764, 1667942901], "v": "v0.6"}
{"i": [["[\"sigmoid\", 1, 14, 14, 672]", "cuda -keys=cuda,gpu -max_num_threads=1024 -model=unknown -thread_warp_size=32", [-1, 16, 64, 49152, 2147483647, 1024, 8, 32], "", 0, []], [[], [["FU", 1, [0, 1, 2, 3]], ["SP", 1, 0, 131712, [56], 1], ["AN", 1, 0, 5], ["AN", 1, 1, 6]]]], "r": [[4.44041e-06, 4.44612e-06, 4.44789e-06], 0, 3.01058, 1667942904], "v": "v0.6"}
{"i": [["[\"sigmoid\", 1, 14, 14, 672]", "cuda -keys=cuda,gpu -max_num_threads=1024 -model=unknown -thread_warp_size=32", [-1, 16, 64, 49152, 2147483647, 1024, 8, 32], "", 0, []], [[], [["FU", 1, [0, 1, 2, 3]], ["SP", 1, 0, 131712, [64], 1], ["AN", 1, 0, 5], ["AN", 1, 1, 6]]]], "r": [[4.12021e-06, 4.13229e-06, 4.13612e-06], 0, 2.06927, 1667942903], "v": "v0.6"}
{"i": [["[\"sigmoid\", 1, 14, 14, 672]", "cuda -keys=cuda,gpu -max_num_threads=1024 -model=unknown -thread_warp_size=32", [-1, 16, 64, 49152, 2147483647, 1024, 8, 32], "", 0, []], [[], [["FU", 1, [0, 1, 2, 3]], ["SP", 1, 0, 131712, [14], 1], ["AN", 1, 0, 5], ["AN", 1, 1, 6]]]], "r": [[9.8642e-06, 9.876e-06, 9.8764e-06], 0, 3.27222, 1667942904], "v": "v0.6"}
{"i": [["[\"sigmoid\", 1, 14, 14, 672]", "cuda -keys=cuda,gpu -max_num_threads=1024 -model=unknown -thread_warp_size=32", [-1, 16, 64, 49152, 2147483647, 1024, 8, 32], "", 0, []], [[], [["FU", 1, [0, 1, 2, 3]], ["SP", 1, 0, 131712, [4], 1], ["AN", 1, 0, 5], ["AN", 1, 1, 6]]]], "r": [[2.73664e-05, 2.73722e-05, 2.73943e-05], 0, 3.79818, 1667942905], "v": "v0.6"}
{"i": [["[\"sigmoid\", 1, 14, 14, 672]", "cuda -keys=cuda,gpu -max_num_threads=1024 -model=unknown -thread_warp_size=32", [-1, 16, 64, 49152, 2147483647, 1024, 8, 32], "", 0, []], [[], [["FU", 1, [0, 1, 2, 3]], ["SP", 1, 0, 131712, [49], 1], ["AN", 1, 0, 5], ["AN", 1, 1, 6]]]], "r": [[4.71057e-06, 4.71792e-06, 4.71793e-06], 0, 3.54466, 1667942905], "v": "v0.6"}
{"i": [["[\"sigmoid\", 1, 14, 14, 672]", "cuda -keys=cuda,gpu -max_num_threads=1024 -model=unknown -thread_warp_size=32", [-1, 16, 64, 49152, 2147483647, 1024, 8, 32], "", 0, []], [[], [["FU", 1, [0, 1, 2, 3]], ["SP", 1, 0, 131712, [7], 1], ["AN", 1, 0, 5], ["AN", 1, 1, 6]]]], "r": [[1.68979e-05, 1.69089e-05, 1.69091e-05], 0, 4.04763, 1667942905], "v": "v0.6"}
{"i": [["[\"sigmoid\", 1, 14, 14, 672]", "cuda -keys=cuda,gpu -max_num_threads=1024 -model=unknown -thread_warp_size=32", [-1, 16, 64, 49152, 2147483647, 1024, 8, 32], "", 0, []], [[], [["FU", 1, [0, 1, 2, 3]], ["SP", 1, 0, 131712, [42], 1], ["AN", 1, 0, 5], ["AN", 1, 1, 6]]]], "r": [[4.99615e-06, 5.01378e-06, 5.00981e-06], 0, 4.2989, 1667942906], "v": "v0.6"}
{"i": [["[\"sigmoid\", 1, 14, 14, 672]", "cuda -keys=cuda,gpu -max_num_threads=1024 -model=unknown -thread_warp_size=32", [-1, 16, 64, 49152, 2147483647, 1024, 8, 32], "", 0, []], [[], [["FU", 1, [0, 1, 2, 3]], ["SP", 1, 0, 131712, [24], 1], ["AN", 1, 0, 5], ["AN", 1, 1, 6]]]], "r": [[6.88155e-06, 6.89154e-06, 6.89305e-06], 0, 4.55675, 1667942906], "v": "v0.6"}
{"i": [["[\"sigmoid\", 1, 14, 14, 672]", "cuda -keys=cuda,gpu -max_num_threads=1024 -model=unknown -thread_warp_size=32", [-1, 16, 64, 49152, 2147483647, 1024, 8, 32], "", 0, []], [[], [["FU", 1, [0, 1, 2, 3]], ["SP", 1, 0, 131712, [32], 1], ["AN", 1, 0, 5], ["AN", 1, 1, 6]]]], "r": [[5.76645e-06, 5.78077e-06, 5.78128e-06], 0, 4.8415, 1667942906], "v": "v0.6"}
{"i": [["[\"sigmoid\", 1, 14, 14, 672]", "cuda -keys=cuda,gpu -max_num_threads=1024 -model=unknown -thread_warp_size=32", [-1, 16, 64, 49152, 2147483647, 1024, 8, 32], "", 0, []], [[], [["FU", 1, [0, 1, 2, 3]], ["SP", 1, 0, 131712, [8], 1], ["AN", 1, 0, 5], ["AN", 1, 1, 6]]]], "r": [[1.51099e-05, 1.51214e-05, 1.51202e-05], 0, 5.17805, 1667942906], "v": "v0.6"}
{"i": [["[\"sigmoid\", 1, 14, 14, 672]", "cuda -keys=cuda,gpu -max_num_threads=1024 -model=unknown -thread_warp_size=32", [-1, 16, 64, 49152, 2147483647, 1024, 8, 32], "", 0, []], [[], [["FU", 1, [0, 1, 2, 3]], ["SP", 1, 0, 131712, [21], 1], ["AN", 1, 0, 5], ["AN", 1, 1, 6]]]], "r": [[7.47397e-06, 7.48612e-06, 7.48617e-06], 0, 5.36612, 1667942907], "v": "v0.6"}
{"i": [["[\"sigmoid\", 1, 14, 14, 672]", "cuda -keys=cuda,gpu -max_num_threads=1024 -model=unknown -thread_warp_size=32", [-1, 16, 64, 49152, 2147483647, 1024, 8, 32], "", 0, []], [[], [["FU", 1, [0, 1, 2, 3]], ["SP", 1, 0, 131712, [12], 1], ["AN", 1, 0, 5], ["AN", 1, 1, 6]]]], "r": [[1.11413e-05, 1.11503e-05, 1.11372e-05], 0, 5.62525, 1667942907], "v": "v0.6"}
{"i": [["[\"sigmoid\", 1, 14, 14, 672]", "cuda -keys=cuda,gpu -max_num_threads=1024 -model=unknown -thread_warp_size=32", [-1, 16, 64, 49152, 2147483647, 1024, 8, 32], "", 0, []], [[], [["FU", 1, [0, 1, 2, 3]], ["SP", 1, 0, 131712, [42], 1], ["AN", 1, 0, 5], ["AN", 1, 1, 6]]]], "r": [[4.94639e-06, 4.95852e-06, 4.95763e-06], 0, 2.22225, 1667943273], "v": "v0.6"}
{"i": [["[\"sigmoid\", 1, 14, 14, 672]", "cuda -keys=cuda,gpu -max_num_threads=1024 -model=unknown -thread_warp_size=32", [-1, 16, 64, 49152, 2147483647, 1024, 8, 32], "", 0, []], [[], [["FU", 1, [0, 1, 2, 3]], ["SP", 1, 0, 131712, [1], 1], ["AN", 1, 0, 5], ["AN", 1, 1, 6]]]], "r": [[0.000100611, 0.000100627, 0.000100612], 0, 2.69405, 1667943274], "v": "v0.6"}
{"i": [["[\"sigmoid\", 1, 14, 14, 672]", "cuda -keys=cuda,gpu -max_num_threads=1024 -model=unknown -thread_warp_size=32", [-1, 16, 64, 49152, 2147483647, 1024, 8, 32], "", 0, []], [[], [["FU", 1, [0, 1, 2, 3]], ["SP", 1, 0, 131712, [6], 1], ["AN", 1, 0, 5], ["AN", 1, 1, 6]]]], "r": [[1.94514e-05, 1.94572e-05, 1.94625e-05], 0, 1.33064, 1667943272], "v": "v0.6"}
{"i": [["[\"sigmoid\", 1, 14, 14, 672]", "cuda -keys=cuda,gpu -max_num_threads=1024 -model=unknown -thread_warp_size=32", [-1, 16, 64, 49152, 2147483647, 1024, 8, 32], "", 0, []], [[], [["FU", 1, [0, 1, 2, 3]], ["SP", 1, 0, 131712, [16], 1], ["AN", 1, 0, 5], ["AN", 1, 1, 6]]]], "r": [[8.92823e-06, 8.94592e-06, 8.94413e-06], 0, 1.90915, 1667943273], "v": "v0.6"}
{"i": [["[\"sigmoid\", 1, 14, 14, 672]", "cuda -keys=cuda,gpu -max_num_threads=1024 -model=unknown -thread_warp_size=32", [-1, 16, 64, 49152, 2147483647, 1024, 8, 32], "", 0, []], [[], [["FU", 1, [0, 1, 2, 3]], ["SP", 1, 0, 131712, [49], 1], ["AN", 1, 0, 5], ["AN", 1, 1, 6]]]], "r": [[4.79363e-06, 4.80768e-06, 4.80644e-06], 0, 0.662223, 1667943271], "v": "v0.6"}
{"i": [["[\"sigmoid\", 1, 14, 14, 672]", "cuda -keys=cuda,gpu -max_num_threads=1024 -model=unknown -thread_warp_size=32", [-1, 16, 64, 49152, 2147483647, 1024, 8, 32], "", 0, []], [[], [["FU", 1, [0, 1, 2, 3]], ["SP", 1, 0, 131712, [28], 1], ["AN", 1, 0, 5], ["AN", 1, 1, 6]]]], "r": [[6.1981e-06, 6.21639e-06, 6.21673e-06], 0, 1.62046, 1667943272], "v": "v0.6"}
{"i": [["[\"sigmoid\", 1, 14, 14, 672]", "cuda -keys=cuda,gpu -max_num_threads=1024 -model=unknown -thread_warp_size=32", [-1, 16, 64, 49152, 2147483647, 1024, 8, 32], "", 0, []], [[], [["FU", 1, [0, 1, 2, 3]], ["SP", 1, 0, 131712, [24], 1], ["AN", 1, 0, 5], ["AN", 1, 1, 6]]]], "r": [[6.80776e-06, 6.82356e-06, 6.8252e-06], 0, 1.00773, 1667943272], "v": "v0.6"}
{"i": [["[\"sigmoid\", 1, 14, 14, 672]", "cuda -keys=cuda,gpu -max_num_threads=1024 -model=unknown -thread_warp_size=32", [-1, 16, 64, 49152, 2147483647, 1024, 8, 32], "", 0, []], [[], [["FU", 1, [0, 1, 2, 3]], ["SP", 1, 0, 131712, [32], 1], ["AN", 1, 0, 5], ["AN", 1, 1, 6]]]], "r": [[5.73252e-06, 5.74489e-06, 5.74138e-06], 0, 2.96454, 1667943274], "v": "v0.6"}
{"i": [["[\"sigmoid\", 1, 14, 14, 672]", "cuda -keys=cuda,gpu -max_num_threads=1024 -model=unknown -thread_warp_size=32", [-1, 16, 64, 49152, 2147483647, 1024, 8, 32], "", 0, []], [[], [["FU", 1, [0, 1, 2, 3]], ["SP", 1, 0, 131712, [48], 1], ["AN", 1, 0, 5], ["AN", 1, 1, 6]]]], "r": [[4.72217e-06, 4.74115e-06, 4.73557e-06], 0, 2.30039, 1667943273], "v": "v0.6"}
{"i": [["[\"sigmoid\", 1, 14, 14, 672]", "cuda -keys=cuda,gpu -max_num_threads=1024 -model=unknown -thread_warp_size=32", [-1, 16, 64, 49152, 2147483647, 1024, 8, 32], "", 0, []], [[], [["FU", 1, [0, 1, 2, 3]], ["SP", 1, 0, 131712, [8], 1], ["AN", 1, 0, 5], ["AN", 1, 1, 6]]]], "r": [[1.5148e-05, 1.51543e-05, 1.51504e-05], 0, 3.15235, 1667943274], "v": "v0.6"}
{"i": [["[\"sigmoid\", 1, 14, 14, 672]", "cuda -keys=cuda,gpu -max_num_threads=1024 -model=unknown -thread_warp_size=32", [-1, 16, 64, 49152, 2147483647, 1024, 8, 32], "", 0, []], [[], [["FU", 1, [0, 1, 2, 3]], ["SP", 1, 0, 131712, [2], 1], ["AN", 1, 0, 5], ["AN", 1, 1, 6]]]], "r": [[5.17239e-05, 5.17358e-05, 5.17364e-05], 0, 3.47365, 1667943275], "v": "v0.6"}
{"i": [["[\"sigmoid\", 1, 14, 14, 672]", "cuda -keys=cuda,gpu -max_num_threads=1024 -model=unknown -thread_warp_size=32", [-1, 16, 64, 49152, 2147483647, 1024, 8, 32], "", 0, []], [[], [["FU", 1, [0, 1, 2, 3]], ["SP", 1, 0, 131712, [4], 1], ["AN", 1, 0, 5], ["AN", 1, 1, 6]]]], "r": [[2.73391e-05, 2.73497e-05, 2.73588e-05], 0, 3.75495, 1667943275], "v": "v0.6"}
{"i": [["[\"sigmoid\", 1, 14, 14, 672]", "cuda -keys=cuda,gpu -max_num_threads=1024 -model=unknown -thread_warp_size=32", [-1, 16, 64, 49152, 2147483647, 1024, 8, 32], "", 0, []], [[], [["FU", 1, [0, 1, 2, 3]], ["SP", 1, 0, 131712, [12], 1], ["AN", 1, 0, 5], ["AN", 1, 1, 6]]]], "r": [[1.11576e-05, 1.11737e-05, 1.11631e-05], 0, 3.95112, 1667943275], "v": "v0.6"}
{"i": [["[\"sigmoid\", 1, 14, 14, 672]", "cuda -keys=cuda,gpu -max_num_threads=1024 -model=unknown -thread_warp_size=32", [-1, 16, 64, 49152, 2147483647, 1024, 8, 32], "", 0, []], [[], [["FU", 1, [0, 1, 2, 3]], ["SP", 1, 0, 131712, [7], 1], ["AN", 1, 0, 5], ["AN", 1, 1, 6]]]], "r": [[1.69608e-05, 1.69714e-05, 1.69704e-05], 0, 4.27864, 1667943276], "v": "v0.6"}
{"i": [["[\"sigmoid\", 1, 14, 14, 672]", "cuda -keys=cuda,gpu -max_num_threads=1024 -model=unknown -thread_warp_size=32", [-1, 16, 64, 49152, 2147483647, 1024, 8, 32], "", 0, []], [[], [["FU", 1, [0, 1, 2, 3]], ["SP", 1, 0, 131712, [21], 1], ["AN", 1, 0, 5], ["AN", 1, 1, 6]]]], "r": [[7.40026e-06, 7.42618e-06, 7.4198e-06], 0, 4.537, 1667943276], "v": "v0.6"}
{"i": [["[\"sigmoid\", 1, 14, 14, 672]", "cuda -keys=cuda,gpu -max_num_threads=1024 -model=unknown -thread_warp_size=32", [-1, 16, 64, 49152, 2147483647, 1024, 8, 32], "", 0, []], [[], [["FU", 1, [0, 1, 2, 3]], ["SP", 1, 0, 131712, [64], 1], ["AN", 1, 0, 5], ["AN", 1, 1, 6]]]], "r": [[4.1191e-06, 4.13739e-06, 4.13623e-06], 0, 4.78917, 1667943276], "v": "v0.6"}
{"i": [["[\"sigmoid\", 1, 14, 14, 672]", "cuda -keys=cuda,gpu -max_num_threads=1024 -model=unknown -thread_warp_size=32", [-1, 16, 64, 49152, 2147483647, 1024, 8, 32], "", 0, []], [[], [["FU", 1, [0, 1, 2, 3]], ["SP", 1, 0, 131712, [56], 1], ["AN", 1, 0, 5], ["AN", 1, 1, 6]]]], "r": [[4.37793e-06, 4.3937e-06, 4.39571e-06], 0, 5.04577, 1667943277], "v": "v0.6"}
{"i": [["[\"sigmoid\", 1, 14, 14, 672]", "cuda -keys=cuda,gpu -max_num_threads=1024 -model=unknown -thread_warp_size=32", [-1, 16, 64, 49152, 2147483647, 1024, 8, 32], "", 0, []], [[], [["FU", 1, [0, 1, 2, 3]], ["SP", 1, 0, 131712, [14], 1], ["AN", 1, 0, 5], ["AN", 1, 1, 6]]]], "r": [[9.79962e-06, 9.80576e-06, 9.81453e-06], 0, 5.38223, 1667943277], "v": "v0.6"}
{"i": [["[\"sigmoid\", 1, 14, 14, 672]", "cuda -keys=cuda,gpu -max_num_threads=1024 -model=unknown -thread_warp_size=32", [-1, 16, 64, 49152, 2147483647, 1024, 8, 32], "", 0, []], [[], [["FU", 1, [0, 1, 2, 3]], ["SP", 1, 0, 131712, [3], 1], ["AN", 1, 0, 5], ["AN", 1, 1, 6]]]], "r": [[3.53854e-05, 3.53922e-05, 3.53959e-05], 0, 5.6199, 1667943277], "v": "v0.6"}
{"i": [["[\"sigmoid\", 1, 14, 14, 672]", "cuda -keys=cuda,gpu -max_num_threads=1024 -model=unknown -thread_warp_size=32", [-1, 16, 64, 49152, 2147483647, 1024, 8, 32], "", 0, []], [[], [["FU", 1, [0, 1, 2, 3]], ["SP", 1, 0, 131712, [6], 1], ["AN", 1, 0, 5], ["AN", 1, 1, 6]]]], "r": [[1.9211e-05, 1.9216e-05, 1.92169e-05], 0, 1.38879, 1667944501], "v": "v0.6"}
{"i": [["[\"sigmoid\", 1, 14, 14, 672]", "cuda -keys=cuda,gpu -max_num_threads=1024 -model=unknown -thread_warp_size=32", [-1, 16, 64, 49152, 2147483647, 1024, 8, 32], "", 0, []], [[], [["FU", 1, [0, 1, 2, 3]], ["SP", 1, 0, 131712, [16], 1], ["AN", 1, 0, 5], ["AN", 1, 1, 6]]]], "r": [[1.63215e-05, 9.00017e-06, 9.00292e-06], 0, 0.52856, 1667944500], "v": "v0.6"}
{"i": [["[\"sigmoid\", 1, 14, 14, 672]", "cuda -keys=cuda,gpu -max_num_threads=1024 -model=unknown -thread_warp_size=32", [-1, 16, 64, 49152, 2147483647, 1024, 8, 32], "", 0, []], [[], [["FU", 1, [0, 1, 2, 3]], ["SP", 1, 0, 131712, [14], 1], ["AN", 1, 0, 5], ["AN", 1, 1, 6]]]], "r": [[9.80647e-06, 9.81934e-06, 9.81869e-06], 0, 2.6871, 1667944503], "v": "v0.6"}
{"i": [["[\"sigmoid\", 1, 14, 14, 672]", "cuda -keys=cuda,gpu -max_num_threads=1024 -model=unknown -thread_warp_size=32", [-1, 16, 64, 49152, 2147483647, 1024, 8, 32], "", 0, []], [[], [["FU", 1, [0, 1, 2, 3]], ["SP", 1, 0, 131712, [4], 1], ["AN", 1, 0, 5], ["AN", 1, 1, 6]]]], "r": [[2.72782e-05, 2.72926e-05, 2.72956e-05], 0, 2.40417, 1667944502], "v": "v0.6"}
{"i": [["[\"sigmoid\", 1, 14, 14, 672]", "cuda -keys=cuda,gpu -max_num_threads=1024 -model=unknown -thread_warp_size=32", [-1, 16, 64, 49152, 2147483647, 1024, 8, 32], "", 0, []], [[], [["FU", 1, [0, 1, 2, 3]], ["SP", 1, 0, 131712, [64], 1], ["AN", 1, 0, 5], ["AN", 1, 1, 6]]]], "r": [[4.06787e-06, 4.07884e-06, 4.08459e-06], 0, 0.78043, 1667944501], "v": "v0.6"}
{"i": [["[\"sigmoid\", 1, 14, 14, 672]", "cuda -keys=cuda,gpu -max_num_threads=1024 -model=unknown -thread_warp_size=32", [-1, 16, 64, 49152, 2147483647, 1024, 8, 32], "", 0, []], [[], [["FU", 1, [0, 1, 2, 3]], ["SP", 1, 0, 131712, [12], 1], ["AN", 1, 0, 5], ["AN", 1, 1, 6]]]], "r": [[1.10353e-05, 1.10489e-05, 1.10475e-05], 0, 2.06966, 1667944502], "v": "v0.6"}
{"i": [["[\"sigmoid\", 1, 14, 14, 672]", "cuda -keys=cuda,gpu -max_num_threads=1024 -model=unknown -thread_warp_size=32", [-1, 16, 64, 49152, 2147483647, 1024, 8, 32], "", 0, []], [[], [["FU", 1, [0, 1, 2, 3]], ["SP", 1, 0, 131712, [24], 1], ["AN", 1, 0, 5], ["AN", 1, 1, 6]]]], "r": [[6.8491e-06, 6.86352e-06, 6.86474e-06], 0, 1.71146, 1667944502], "v": "v0.6"}
{"i": [["[\"sigmoid\", 1, 14, 14, 672]", "cuda -keys=cuda,gpu -max_num_threads=1024 -model=unknown -thread_warp_size=32", [-1, 16, 64, 49152, 2147483647, 1024, 8, 32], "", 0, []], [[], [["FU", 1, [0, 1, 2, 3]], ["SP", 1, 0, 131712, [48], 1], ["AN", 1, 0, 5], ["AN", 1, 1, 6]]]], "r": [[4.64398e-06, 4.65382e-06, 4.65619e-06], 0, 1.06814, 1667944501], "v": "v0.6"}
{"i": [["[\"sigmoid\", 1, 14, 14, 672]", "cuda -keys=cuda,gpu -max_num_threads=1024 -model=unknown -thread_warp_size=32", [-1, 16, 64, 49152, 2147483647, 1024, 8, 32], "", 0, []], [[], [["FU", 1, [0, 1, 2, 3]], ["SP", 1, 0, 131712, [32], 1], ["AN", 1, 0, 5], ["AN", 1, 1, 6]]]], "r": [[5.82486e-06, 5.83975e-06, 5.83613e-06], 0, 3.0795, 1667944503], "v": "v0.6"}
{"i": [["[\"sigmoid\", 1, 14, 14, 672]", "cuda -keys=cuda,gpu -max_num_threads=1024 -model=unknown -thread_warp_size=32", [-1, 16, 64, 49152, 2147483647, 1024, 8, 32], "", 0, []], [[], [["FU", 1, [0, 1, 2, 3]], ["SP", 1, 0, 131712, [8], 1], ["AN", 1, 0, 5], ["AN", 1, 1, 6]]]], "r": [[1.51519e-05, 1.51617e-05, 1.51644e-05], 0, 3.43334, 1667944504], "v": "v0.6"}
{"i": [["[\"sigmoid\", 1, 14, 14, 672]", "cuda -keys=cuda,gpu -max_num_threads=1024 -model=unknown -thread_warp_size=32", [-1, 16, 64, 49152, 2147483647, 1024, 8, 32], "", 0, []], [[], [["FU", 1, [0, 1, 2, 3]], ["SP", 1, 0, 131712, [3], 1], ["AN", 1, 0, 5], ["AN", 1, 1, 6]]]], "r": [[3.53906e-05, 3.5394e-05, 3.53897e-05], 0, 3.71945, 1667944504], "v": "v0.6"}
{"i": [["[\"sigmoid\", 1, 14, 14, 672]", "cuda -keys=cuda,gpu -max_num_threads=1024 -model=unknown -thread_warp_size=32", [-1, 16, 64, 49152, 2147483647, 1024, 8, 32], "", 0, []], [[], [["FU", 1, [0, 1, 2, 3]], ["SP", 1, 0, 131712, [21], 1], ["AN", 1, 0, 5], ["AN", 1, 1, 6]]]], "r": [[7.55051e-06, 7.5567e-06, 7.55783e-06], 0, 3.95659, 1667944504], "v": "v0.6"}
{"i": [["[\"sigmoid\", 1, 14, 14, 672]", "cuda -keys=cuda,gpu -max_num_threads=1024 -model=unknown -thread_warp_size=32", [-1, 16, 64, 49152, 2147483647, 1024, 8, 32], "", 0, []], [[], [["FU", 1, [0, 1, 2, 3]], ["SP", 1, 0, 131712, [49], 1], ["AN", 1, 0, 5], ["AN", 1, 1, 6]]]], "r": [[4.7596e-06, 4.77136e-06, 4.77557e-06], 0, 4.26888, 1667944505], "v": "v0.6"}
{"i": [["[\"sigmoid\", 1, 14, 14, 672]", "cuda -keys=cuda,gpu -max_num_threads=1024 -model=unknown -thread_warp_size=32", [-1, 16, 64, 49152, 2147483647, 1024, 8, 32], "", 0, []], [[], [["FU", 1, [0, 1, 2, 3]], ["SP", 1, 0, 131712, [1], 1], ["AN", 1, 0, 5], ["AN", 1, 1, 6]]]], "r": [[0.000100633, 0.000100647, 0.000100659], 0, 4.55919, 1667944505], "v": "v0.6"}
{"i": [["[\"sigmoid\", 1, 14, 14, 672]", "cuda -keys=cuda,gpu -max_num_threads=1024 -model=unknown -thread_warp_size=32", [-1, 16, 64, 49152, 2147483647, 1024, 8, 32], "", 0, []], [[], [["FU", 1, [0, 1, 2, 3]], ["SP", 1, 0, 131712, [42], 1], ["AN", 1, 0, 5], ["AN", 1, 1, 6]]]], "r": [[5.13421e-06, 5.14895e-06, 5.1439e-06], 0, 4.78951, 1667944505], "v": "v0.6"}
{"i": [["[\"sigmoid\", 1, 14, 14, 672]", "cuda -keys=cuda,gpu -max_num_threads=1024 -model=unknown -thread_warp_size=32", [-1, 16, 64, 49152, 2147483647, 1024, 8, 32], "", 0, []], [[], [["FU", 1, [0, 1, 2, 3]], ["SP", 1, 0, 131712, [2], 1], ["AN", 1, 0, 5], ["AN", 1, 1, 6]]]], "r": [[5.16078e-05, 5.16274e-05, 5.16228e-05], 0, 5.07782, 1667944506], "v": "v0.6"}
{"i": [["[\"sigmoid\", 1, 14, 14, 672]", "cuda -keys=cuda,gpu -max_num_threads=1024 -model=unknown -thread_warp_size=32", [-1, 16, 64, 49152, 2147483647, 1024, 8, 32], "", 0, []], [[], [["FU", 1, [0, 1, 2, 3]], ["SP", 1, 0, 131712, [56], 1], ["AN", 1, 0, 5], ["AN", 1, 1, 6]]]], "r": [[4.37647e-06, 4.39168e-06, 4.39336e-06], 0, 5.43337, 1667944506], "v": "v0.6"}
{"i": [["[\"sigmoid\", 1, 14, 14, 672]", "cuda -keys=cuda,gpu -max_num_threads=1024 -model=unknown -thread_warp_size=32", [-1, 16, 64, 49152, 2147483647, 1024, 8, 32], "", 0, []], [[], [["FU", 1, [0, 1, 2, 3]], ["SP", 1, 0, 131712, [7], 1], ["AN", 1, 0, 5], ["AN", 1, 1, 6]]]], "r": [[1.69615e-05, 1.69694e-05, 1.69686e-05], 0, 5.61185, 1667944506], "v": "v0.6"}
{"i": [["[\"sigmoid\", 1, 14, 14, 672]", "cuda -keys=cuda,gpu -max_num_threads=1024 -model=unknown -thread_warp_size=32", [-1, 16, 64, 49152, 2147483647, 1024, 8, 32], "", 0, []], [[], [["FU", 1, [0, 1, 2, 3]], ["SP", 1, 0, 131712, [28], 1], ["AN", 1, 0, 5], ["AN", 1, 1, 6]]]], "r": [[6.24516e-06, 6.25878e-06, 6.25864e-06], 0, 2.88732, 1667944503], "v": "v0.6"}
{"i": [["[\"sigmoid\", 1, 14, 14, 672]", "cuda -keys=cuda,gpu -max_num_threads=1024 -model=unknown -thread_warp_size=32", [-1, 16, 64, 49152, 2147483647, 1024, 8, 32], "", 0, []], [[], [["FU", 1, [0, 1, 2, 3]], ["SP", 1, 0, 131712, [2], 1], ["AN", 1, 0, 5], ["AN", 1, 1, 6]]]], "r": [[5.16321e-05, 5.16486e-05, 5.16534e-05], 0, 2.12309, 1667944569], "v": "v0.6"}
{"i": [["[\"sigmoid\", 1, 14, 14, 672]", "cuda -keys=cuda,gpu -max_num_threads=1024 -model=unknown -thread_warp_size=32", [-1, 16, 64, 49152, 2147483647, 1024, 8, 32], "", 0, []], [[], [["FU", 1, [0, 1, 2, 3]], ["SP", 1, 0, 131712, [12], 1], ["AN", 1, 0, 5], ["AN", 1, 1, 6]]]], "r": [[1.11152e-05, 1.12413e-05, 1.11337e-05], 0, 0.627949, 1667944567], "v": "v0.6"}
{"i": [["[\"sigmoid\", 1, 14, 14, 672]", "cuda -keys=cuda,gpu -max_num_threads=1024 -model=unknown -thread_warp_size=32", [-1, 16, 64, 49152, 2147483647, 1024, 8, 32], "", 0, []], [[], [["FU", 1, [0, 1, 2, 3]], ["SP", 1, 0, 131712, [21], 1], ["AN", 1, 0, 5], ["AN", 1, 1, 6]]]], "r": [[7.54305e-06, 7.55221e-06, 7.55722e-06], 0, 1.76379, 1667944568], "v": "v0.6"}
{"i": [["[\"sigmoid\", 1, 14, 14, 672]", "cuda -keys=cuda,gpu -max_num_threads=1024 -model=unknown -thread_warp_size=32", [-1, 16, 64, 49152, 2147483647, 1024, 8, 32], "", 0, []], [[], [["FU", 1, [0, 1, 2, 3]], ["SP", 1, 0, 131712, [48], 1], ["AN", 1, 0, 5], ["AN", 1, 1, 6]]]], "r": [[4.62964e-06, 4.6437e-06, 4.63914e-06], 0, 1.55813, 1667944568], "v": "v0.6"}
{"i": [["[\"sigmoid\", 1, 14, 14, 672]", "cuda -keys=cuda,gpu -max_num_threads=1024 -model=unknown -thread_warp_size=32", [-1, 16, 64, 49152, 2147483647, 1024, 8, 32], "", 0, []], [[], [["FU", 1, [0, 1, 2, 3]], ["SP", 1, 0, 131712, [42], 1], ["AN", 1, 0, 5], ["AN", 1, 1, 6]]]], "r": [[5.16421e-06, 5.17694e-06, 5.17668e-06], 0, 0.893869, 1667944567], "v": "v0.6"}
{"i": [["[\"sigmoid\", 1, 14, 14, 672]", "cuda -keys=cuda,gpu -max_num_threads=1024 -model=unknown -thread_warp_size=32", [-1, 16, 64, 49152, 2147483647, 1024, 8, 32], "", 0, []], [[], [["FU", 1, [0, 1, 2, 3]], ["SP", 1, 0, 131712, [8], 1], ["AN", 1, 0, 5], ["AN", 1, 1, 6]]]], "r": [[1.5129e-05, 1.51475e-05, 1.51538e-05], 0, 1.21645, 1667944568], "v": "v0.6"}
{"i": [["[\"sigmoid\", 1, 14, 14, 672]", "cuda -keys=cuda,gpu -max_num_threads=1024 -model=unknown -thread_warp_size=32", [-1, 16, 64, 49152, 2147483647, 1024, 8, 32], "", 0, []], [[], [["FU", 1, [0, 1, 2, 3]], ["SP", 1, 0, 131712, [32], 1], ["AN", 1, 0, 5], ["AN", 1, 1, 6]]]], "r": [[5.72112e-06, 5.73336e-06, 5.73253e-06], 0, 2.65118, 1667944569], "v": "v0.6"}
{"i": [["[\"sigmoid\", 1, 14, 14, 672]", "cuda -keys=cuda,gpu -max_num_threads=1024 -model=unknown -thread_warp_size=32", [-1, 16, 64, 49152, 2147483647, 1024, 8, 32], "", 0, []], [[], [["FU", 1, [0, 1, 2, 3]], ["SP", 1, 0, 131712, [14], 1], ["AN", 1, 0, 5], ["AN", 1, 1, 6]]]], "r": [[9.88523e-06, 9.89826e-06, 9.89573e-06], 0, 2.32949, 1667944569], "v": "v0.6"}
{"i": [["[\"sigmoid\", 1, 14, 14, 672]", "cuda -keys=cuda,gpu -max_num_threads=1024 -model=unknown -thread_warp_size=32", [-1, 16, 64, 49152, 2147483647, 1024, 8, 32], "", 0, []], [[], [["FU", 1, [0, 1, 2, 3]], ["SP", 1, 0, 131712, [4], 1], ["AN", 1, 0, 5], ["AN", 1, 1, 6]]]], "r": [[2.74536e-05, 2.74827e-05, 2.7482e-05], 0, 3.1692, 1667944570], "v": "v0.6"}
{"i": [["[\"sigmoid\", 1, 14, 14, 672]", "cuda -keys=cuda,gpu -max_num_threads=1024 -model=unknown -thread_warp_size=32", [-1, 16, 64, 49152, 2147483647, 1024, 8, 32], "", 0, []], [[], [["FU", 1, [0, 1, 2, 3]], ["SP", 1, 0, 131712, [56], 1], ["AN", 1, 0, 5], ["AN", 1, 1, 6]]]], "r": [[4.40825e-06, 4.42229e-06, 4.42149e-06], 0, 3.43817, 1667944570], "v": "v0.6"}
{"i": [["[\"sigmoid\", 1, 14, 14, 672]", "cuda -keys=cuda,gpu -max_num_threads=1024 -model=unknown -thread_warp_size=32", [-1, 16, 64, 49152, 2147483647, 1024, 8, 32], "", 0, []], [[], [["FU", 1, [0, 1, 2, 3]], ["SP", 1, 0, 131712, [64], 1], ["AN", 1, 0, 5], ["AN", 1, 1, 6]]]], "r": [[4.19132e-06, 4.19925e-06, 4.19713e-06], 0, 3.68214, 1667944570], "v": "v0.6"}
{"i": [["[\"sigmoid\", 1, 14, 14, 672]", "cuda -keys=cuda,gpu -max_num_threads=1024 -model=unknown -thread_warp_size=32", [-1, 16, 64, 49152, 2147483647, 1024, 8, 32], "", 0, []], [[], [["FU", 1, [0, 1, 2, 3]], ["SP", 1, 0, 131712, [49], 1], ["AN", 1, 0, 5], ["AN", 1, 1, 6]]]], "r": [[4.75865e-06, 4.775e-06, 4.76628e-06], 0, 3.91781, 1667944571], "v": "v0.6"}
{"i": [["[\"sigmoid\", 1, 14, 14, 672]", "cuda -keys=cuda,gpu -max_num_threads=1024 -model=unknown -thread_warp_size=32", [-1, 16, 64, 49152, 2147483647, 1024, 8, 32], "", 0, []], [[], [["FU", 1, [0, 1, 2, 3]], ["SP", 1, 0, 131712, [24], 1], ["AN", 1, 0, 5], ["AN", 1, 1, 6]]]], "r": [[6.77317e-06, 6.78667e-06, 6.78453e-06], 0, 4.23357, 1667944571], "v": "v0.6"}
{"i": [["[\"sigmoid\", 1, 14, 14, 672]", "cuda -keys=cuda,gpu -max_num_threads=1024 -model=unknown -thread_warp_size=32", [-1, 16, 64, 49152, 2147483647, 1024, 8, 32], "", 0, []], [[], [["FU", 1, [0, 1, 2, 3]], ["SP", 1, 0, 131712, [7], 1], ["AN", 1, 0, 5], ["AN", 1, 1, 6]]]], "r": [[1.68837e-05, 1.68943e-05, 1.68977e-05], 0, 4.47393, 1667944571], "v": "v0.6"}
{"i": [["[\"sigmoid\", 1, 14, 14, 672]", "cuda -keys=cuda,gpu -max_num_threads=1024 -model=unknown -thread_warp_size=32", [-1, 16, 64, 49152, 2147483647, 1024, 8, 32], "", 0, []], [[], [["FU", 1, [0, 1, 2, 3]], ["SP", 1, 0, 131712, [28], 1], ["AN", 1, 0, 5], ["AN", 1, 1, 6]]]], "r": [[6.19041e-06, 6.20227e-06, 6.20173e-06], 0, 4.75688, 1667944572], "v": "v0.6"}
{"i": [["[\"sigmoid\", 1, 14, 14, 672]", "cuda -keys=cuda,gpu -max_num_threads=1024 -model=unknown -thread_warp_size=32", [-1, 16, 64, 49152, 2147483647, 1024, 8, 32], "", 0, []], [[], [["FU", 1, [0, 1, 2, 3]], ["SP", 1, 0, 131712, [1], 1], ["AN", 1, 0, 5], ["AN", 1, 1, 6]]]], "r": [[0.000100588, 0.000100594, 0.000100608], 0, 5.06968, 1667944572], "v": "v0.6"}
{"i": [["[\"sigmoid\", 1, 14, 14, 672]", "cuda -keys=cuda,gpu -max_num_threads=1024 -model=unknown -thread_warp_size=32", [-1, 16, 64, 49152, 2147483647, 1024, 8, 32], "", 0, []], [[], [["FU", 1, [0, 1, 2, 3]], ["SP", 1, 0, 131712, [16], 1], ["AN", 1, 0, 5], ["AN", 1, 1, 6]]]], "r": [[8.97968e-06, 8.99348e-06, 8.9934e-06], 0, 5.34204, 1667944573], "v": "v0.6"}
{"i": [["[\"sigmoid\", 1, 14, 14, 672]", "cuda -keys=cuda,gpu -max_num_threads=1024 -model=unknown -thread_warp_size=32", [-1, 16, 64, 49152, 2147483647, 1024, 8, 32], "", 0, []], [[], [["FU", 1, [0, 1, 2, 3]], ["SP", 1, 0, 131712, [6], 1], ["AN", 1, 0, 5], ["AN", 1, 1, 6]]]], "r": [[1.92028e-05, 1.92128e-05, 1.92136e-05], 0, 2.95709, 1667944570], "v": "v0.6"}
{"i": [["[\"sigmoid\", 1, 14, 14, 672]", "cuda -keys=cuda,gpu -max_num_threads=1024 -model=unknown -thread_warp_size=32", [-1, 16, 64, 49152, 2147483647, 1024, 8, 32], "", 0, []], [[], [["FU", 1, [0, 1, 2, 3]], ["SP", 1, 0, 131712, [3], 1], ["AN", 1, 0, 5], ["AN", 1, 1, 6]]]], "r": [[3.5426e-05, 3.54422e-05, 3.54391e-05], 0, 5.56848, 1667944573], "v": "v0.6"}
{"i": [["[\"sigmoid\", 1, 14, 14, 672]", "cuda -keys=cuda,gpu -max_num_threads=1024 -model=unknown -thread_warp_size=32", [-1, 16, 64, 49152, 2147483647, 1024, 8, 32], "", 0, []], [[], [["FU", 1, [0, 1, 2, 3]], ["SP", 1, 0, 131712, [2], 1], ["AN", 1, 0, 5], ["AN", 1, 1, 6]]]], "r": [[5.16577e-05, 5.16778e-05, 5.16623e-05], 0, 1.36381, 1667944738], "v": "v0.6"}
{"i": [["[\"sigmoid\", 1, 14, 14, 672]", "cuda -keys=cuda,gpu -max_num_threads=1024 -model=unknown -thread_warp_size=32", [-1, 16, 64, 49152, 2147483647, 1024, 8, 32], "", 0, []], [[], [["FU", 1, [0, 1, 2, 3]], ["SP", 1, 0, 131712, [32], 1], ["AN", 1, 0, 5], ["AN", 1, 1, 6]]]], "r": [[5.93584e-06, 5.94592e-06, 5.94812e-06], 0, 1.94774, 1667944739], "v": "v0.6"}
{"i": [["[\"sigmoid\", 1, 14, 14, 672]", "cuda -keys=cuda,gpu -max_num_threads=1024 -model=unknown -thread_warp_size=32", [-1, 16, 64, 49152, 2147483647, 1024, 8, 32], "", 0, []], [[], [["FU", 1, [0, 1, 2, 3]], ["SP", 1, 0, 131712, [6], 1], ["AN", 1, 0, 5], ["AN", 1, 1, 6]]]], "r": [[1.93565e-05, 1.93731e-05, 1.93771e-05], 0, 2.45128, 1667944740], "v": "v0.6"}
{"i": [["[\"sigmoid\", 1, 14, 14, 672]", "cuda -keys=cuda,gpu -max_num_threads=1024 -model=unknown -thread_warp_size=32", [-1, 16, 64, 49152, 2147483647, 1024, 8, 32], "", 0, []], [[], [["FU", 1, [0, 1, 2, 3]], ["SP", 1, 0, 131712, [24], 1], ["AN", 1, 0, 5], ["AN", 1, 1, 6]]]], "r": [[6.9137e-06, 6.92019e-06, 6.92526e-06], 0, 1.62674, 1667944739], "v": "v0.6"}
{"i": [["[\"sigmoid\", 1, 14, 14, 672]", "cuda -keys=cuda,gpu -max_num_threads=1024 -model=unknown -thread_warp_size=32", [-1, 16, 64, 49152, 2147483647, 1024, 8, 32], "", 0, []], [[], [["FU", 1, [0, 1, 2, 3]], ["SP", 1, 0, 131712, [4], 1], ["AN", 1, 0, 5], ["AN", 1, 1, 6]]]], "r": [[2.7385e-05, 2.74011e-05, 2.74056e-05], 0, 1.06658, 1667944738], "v": "v0.6"}
{"i": [["[\"sigmoid\", 1, 14, 14, 672]", "cuda -keys=cuda,gpu -max_num_threads=1024 -model=unknown -thread_warp_size=32", [-1, 16, 64, 49152, 2147483647, 1024, 8, 32], "", 0, []], [[], [["FU", 1, [0, 1, 2, 3]], ["SP", 1, 0, 131712, [1], 1], ["AN", 1, 0, 5], ["AN", 1, 1, 6]]]], "r": [[0.000100572, 0.000100586, 0.000100577], 0, 0.643943, 1667944738], "v": "v0.6"}
{"i": [["[\"sigmoid\", 1, 14, 14, 672]", "cuda -keys=cuda,gpu -max_num_threads=1024 -model=unknown -thread_warp_size=32", [-1, 16, 64, 49152, 2147483647, 1024, 8, 32], "", 0, []], [[], [["FU", 1, [0, 1, 2, 3]], ["SP", 1, 0, 131712, [64], 1], ["AN", 1, 0, 5], ["AN", 1, 1, 6]]]], "r": [[4.17154e-06, 4.184e-06, 4.18779e-06], 0, 2.1832, 1667944739], "v": "v0.6"}
{"i": [["[\"sigmoid\", 1, 14, 14, 672]", "cuda -keys=cuda,gpu -max_num_threads=1024 -model=unknown -thread_warp_size=32", [-1, 16, 64, 49152, 2147483647, 1024, 8, 32], "", 0, []], [[], [["FU", 1, [0, 1, 2, 3]], ["SP", 1, 0, 131712, [48], 1], ["AN", 1, 0, 5], ["AN", 1, 1, 6]]]], "r": [[4.68545e-06, 4.70324e-06, 4.70293e-06], 0, 2.72232, 1667944740], "v": "v0.6"}
{"i": [["[\"sigmoid\", 1, 14, 14, 672]", "cuda -keys=cuda,gpu -max_num_threads=1024 -model=unknown -thread_warp_size=32", [-1, 16, 64, 49152, 2147483647, 1024, 8, 32], "", 0, []], [[], [["FU", 1, [0, 1, 2, 3]], ["SP", 1, 0, 131712, [28], 1], ["AN", 1, 0, 5], ["AN", 1, 1, 6]]]], "r": [[6.38505e-06, 6.39793e-06, 6.3985e-06], 0, 2.91395, 1667944740], "v": "v0.6"}
{"i": [["[\"sigmoid\", 1, 14, 14, 672]", "cuda -keys=cuda,gpu -max_num_threads=1024 -model=unknown -thread_warp_size=32", [-1, 16, 64, 49152, 2147483647, 1024, 8, 32], "", 0, []], [[], [["FU", 1, [0, 1, 2, 3]], ["SP", 1, 0, 131712, [21], 1], ["AN", 1, 0, 5], ["AN", 1, 1, 6]]]], "r": [[7.41895e-06, 7.42147e-06, 7.42198e-06], 0, 3.46214, 1667944741], "v": "v0.6"}
{"i": [["[\"sigmoid\", 1, 14, 14, 672]", "cuda -keys=cuda,gpu -max_num_threads=1024 -model=unknown -thread_warp_size=32", [-1, 16, 64, 49152, 2147483647, 1024, 8, 32], "", 0, []], [[], [["FU", 1, [0, 1, 2, 3]], ["SP", 1, 0, 131712, [12], 1], ["AN", 1, 0, 5], ["AN", 1, 1, 6]]]], "r": [[1.09905e-05, 1.10062e-05, 1.10055e-05], 0, 3.11924, 1667944741], "v": "v0.6"}
{"i": [["[\"sigmoid\", 1, 14, 14, 672]", "cuda -keys=cuda,gpu -max_num_threads=1024 -model=unknown -thread_warp_size=32", [-1, 16, 64, 49152, 2147483647, 1024, 8, 32], "", 0, []], [[], [["FU", 1, [0, 1, 2, 3]], ["SP", 1, 0, 131712, [16], 1], ["AN", 1, 0, 5], ["AN", 1, 1, 6]]]], "r": [[8.96857e-06, 8.97691e-06, 8.97994e-06], 0, 3.70703, 1667944741], "v": "v0.6"}
{"i": [["[\"sigmoid\", 1, 14, 14, 672]", "cuda -keys=cuda,gpu -max_num_threads=1024 -model=unknown -thread_warp_size=32", [-1, 16, 64, 49152, 2147483647, 1024, 8, 32], "", 0, []], [[], [["FU", 1, [0, 1, 2, 3]], ["SP", 1, 0, 131712, [3], 1], ["AN", 1, 0, 5], ["AN", 1, 1, 6]]]], "r": [[3.54641e-05, 3.54922e-05, 3.54919e-05], 0, 3.98099, 1667944742], "v": "v0.6"}
{"i": [["[\"sigmoid\", 1, 14, 14, 672]", "cuda -keys=cuda,gpu -max_num_threads=1024 -model=unknown -thread_warp_size=32", [-1, 16, 64, 49152, 2147483647, 1024, 8, 32], "", 0, []], [[], [["FU", 1, [0, 1, 2, 3]], ["SP", 1, 0, 131712, [14], 1], ["AN", 1, 0, 5], ["AN", 1, 1, 6]]]], "r": [[1.00499e-05, 1.00617e-05, 1.00585e-05], 0, 4.27204, 1667944742], "v": "v0.6"}
{"i": [["[\"sigmoid\", 1, 14, 14, 672]", "cuda -keys=cuda,gpu -max_num_threads=1024 -model=unknown -thread_warp_size=32", [-1, 16, 64, 49152, 2147483647, 1024, 8, 32], "", 0, []], [[], [["FU", 1, [0, 1, 2, 3]], ["SP", 1, 0, 131712, [42], 1], ["AN", 1, 0, 5], ["AN", 1, 1, 6]]]], "r": [[5.16108e-06, 5.17336e-06, 5.17531e-06], 0, 4.47727, 1667944742], "v": "v0.6"}
{"i": [["[\"sigmoid\", 1, 14, 14, 672]", "cuda -keys=cuda,gpu -max_num_threads=1024 -model=unknown -thread_warp_size=32", [-1, 16, 64, 49152, 2147483647, 1024, 8, 32], "", 0, []], [[], [["FU", 1, [0, 1, 2, 3]], ["SP", 1, 0, 131712, [49], 1], ["AN", 1, 0, 5], ["AN", 1, 1, 6]]]], "r": [[4.61503e-06, 4.62998e-06, 4.62468e-06], 0, 4.83295, 1667944743], "v": "v0.6"}
{"i": [["[\"sigmoid\", 1, 14, 14, 672]", "cuda -keys=cuda,gpu -max_num_threads=1024 -model=unknown -thread_warp_size=32", [-1, 16, 64, 49152, 2147483647, 1024, 8, 32], "", 0, []], [[], [["FU", 1, [0, 1, 2, 3]], ["SP", 1, 0, 131712, [8], 1], ["AN", 1, 0, 5], ["AN", 1, 1, 6]]]], "r": [[1.51351e-05, 1.51465e-05, 1.51461e-05], 0, 5.05728, 1667944743], "v": "v0.6"}
{"i": [["[\"sigmoid\", 1, 14, 14, 672]", "cuda -keys=cuda,gpu -max_num_threads=1024 -model=unknown -thread_warp_size=32", [-1, 16, 64, 49152, 2147483647, 1024, 8, 32], "", 0, []], [[], [["FU", 1, [0, 1, 2, 3]], ["SP", 1, 0, 131712, [7], 1], ["AN", 1, 0, 5], ["AN", 1, 1, 6]]]], "r": [[1.69218e-05, 1.69517e-05, 1.69286e-05], 0, 5.31098, 1667944743], "v": "v0.6"}
{"i": [["[\"sigmoid\", 1, 14, 14, 672]", "cuda -keys=cuda,gpu -max_num_threads=1024 -model=unknown -thread_warp_size=32", [-1, 16, 64, 49152, 2147483647, 1024, 8, 32], "", 0, []], [[], [["FU", 1, [0, 1, 2, 3]], ["SP", 1, 0, 131712, [56], 1], ["AN", 1, 0, 5], ["AN", 1, 1, 6]]]], "r": [[4.42917e-06, 4.44164e-06, 4.43916e-06], 0, 5.61629, 1667944744], "v": "v0.6"}
