python/models/resnext/ResNextHorizontal_kernel_configs/resnext_imagenet_50_relu_1_112_112_64.log
{"i": [["[\"relu\", 1, 112, 112, 64]", "cuda -keys=cuda,gpu -max_num_threads=1024 -model=unknown -thread_warp_size=32", [-1, 16, 64, 49152, 2147483647, 1024, 8, 32], "", 0, []], [[], [["FU", 1, [0, 1, 2, 3]], ["SP", 1, 0, 802816, [14], 1], ["AN", 1, 0, 5], ["AN", 1, 1, 6]]]], "r": [[4.52532e-05, 4.52658e-05, 4.52708e-05], 0, 0.588615, 1667896546], "v": "v0.6"}
{"i": [["[\"relu\", 1, 112, 112, 64]", "cuda -keys=cuda,gpu -max_num_threads=1024 -model=unknown -thread_warp_size=32", [-1, 16, 64, 49152, 2147483647, 1024, 8, 32], "", 0, []], [[], [["FU", 1, [0, 1, 2, 3]], ["SP", 1, 0, 802816, [64], 1], ["AN", 1, 0, 5], ["AN", 1, 1, 6]]]], "r": [[1.19503e-05, 1.19673e-05, 1.19512e-05], 0, 2.07446, 1667896547], "v": "v0.6"}
{"i": [["[\"relu\", 1, 112, 112, 64]", "cuda -keys=cuda,gpu -max_num_threads=1024 -model=unknown -thread_warp_size=32", [-1, 16, 64, 49152, 2147483647, 1024, 8, 32], "", 0, []], [[], [["FU", 1, [0, 1, 2, 3]], ["SP", 1, 0, 802816, [7], 1], ["AN", 1, 0, 5], ["AN", 1, 1, 6]]]], "r": [[8.76916e-05, 8.77232e-05, 8.77218e-05], 0, 0.952273, 1667896546], "v": "v0.6"}
{"i": [["[\"relu\", 1, 112, 112, 64]", "cuda -keys=cuda,gpu -max_num_threads=1024 -model=unknown -thread_warp_size=32", [-1, 16, 64, 49152, 2147483647, 1024, 8, 32], "", 0, []], [[], [["FU", 1, [0, 1, 2, 3]], ["SP", 1, 0, 802816, [32], 1], ["AN", 1, 0, 5], ["AN", 1, 1, 6]]]], "r": [[2.1377e-05, 2.13891e-05, 2.13808e-05], 0, 1.71875, 1667896547], "v": "v0.6"}
{"i": [["[\"relu\", 1, 112, 112, 64]", "cuda -keys=cuda,gpu -max_num_threads=1024 -model=unknown -thread_warp_size=32", [-1, 16, 64, 49152, 2147483647, 1024, 8, 32], "", 0, []], [[], [["FU", 1, [0, 1, 2, 3]], ["SP", 1, 0, 802816, [1], 1], ["AN", 1, 0, 5], ["AN", 1, 1, 6]]]], "r": [[0.000598066, 0.000598028, 0.00059812], 0, 2.83142, 1667896548], "v": "v0.6"}
{"i": [["[\"relu\", 1, 112, 112, 64]", "cuda -keys=cuda,gpu -max_num_threads=1024 -model=unknown -thread_warp_size=32", [-1, 16, 64, 49152, 2147483647, 1024, 8, 32], "", 0, []], [[], [["FU", 1, [0, 1, 2, 3]], ["SP", 1, 0, 802816, [4], 1], ["AN", 1, 0, 5], ["AN", 1, 1, 6]]]], "r": [[0.000151576, 0.000151563, 0.000151554], 0, 1.34312, 1667896546], "v": "v0.6"}
{"i": [["[\"relu\", 1, 112, 112, 64]", "cuda -keys=cuda,gpu -max_num_threads=1024 -model=unknown -thread_warp_size=32", [-1, 16, 64, 49152, 2147483647, 1024, 8, 32], "", 0, []], [[], [["FU", 1, [0, 1, 2, 3]], ["SP", 1, 0, 802816, [8], 1], ["AN", 1, 0, 5], ["AN", 1, 1, 6]]]], "r": [[7.70828e-05, 7.7102e-05, 7.70979e-05], 0, 2.48554, 1667896547], "v": "v0.6"}
{"i": [["[\"relu\", 1, 112, 112, 64]", "cuda -keys=cuda,gpu -max_num_threads=1024 -model=unknown -thread_warp_size=32", [-1, 16, 64, 49152, 2147483647, 1024, 8, 32], "", 0, []], [[], [["FU", 1, [0, 1, 2, 3]], ["SP", 1, 0, 802816, [28], 1], ["AN", 1, 0, 5], ["AN", 1, 1, 6]]]], "r": [[2.39908e-05, 2.39981e-05, 2.39995e-05], 0, 3.19186, 1667896548], "v": "v0.6"}
{"i": [["[\"relu\", 1, 112, 112, 64]", "cuda -keys=cuda,gpu -max_num_threads=1024 -model=unknown -thread_warp_size=32", [-1, 16, 64, 49152, 2147483647, 1024, 8, 32], "", 0, []], [[], [["FU", 1, [0, 1, 2, 3]], ["SP", 1, 0, 802816, [16], 1], ["AN", 1, 0, 5], ["AN", 1, 1, 6]]]], "r": [[3.97802e-05, 3.97897e-05, 3.97991e-05], 0, 3.60649, 1667896549], "v": "v0.6"}
{"i": [["[\"relu\", 1, 112, 112, 64]", "cuda -keys=cuda,gpu -max_num_threads=1024 -model=unknown -thread_warp_size=32", [-1, 16, 64, 49152, 2147483647, 1024, 8, 32], "", 0, []], [[], [["FU", 1, [0, 1, 2, 3]], ["SP", 1, 0, 802816, [56], 1], ["AN", 1, 0, 5], ["AN", 1, 1, 6]]]], "r": [[1.31801e-05, 1.31858e-05, 1.31971e-05], 0, 3.95517, 1667896549], "v": "v0.6"}
{"i": [["[\"relu\", 1, 112, 112, 64]", "cuda -keys=cuda,gpu -max_num_threads=1024 -model=unknown -thread_warp_size=32", [-1, 16, 64, 49152, 2147483647, 1024, 8, 32], "", 0, []], [[], [["FU", 1, [0, 1, 2, 3]], ["SP", 1, 0, 802816, [49], 1], ["AN", 1, 0, 5], ["AN", 1, 1, 6]]]], "r": [[1.47048e-05, 1.47117e-05, 1.47014e-05], 0, 4.31337, 1667896549], "v": "v0.6"}
{"i": [["[\"relu\", 1, 112, 112, 64]", "cuda -keys=cuda,gpu -max_num_threads=1024 -model=unknown -thread_warp_size=32", [-1, 16, 64, 49152, 2147483647, 1024, 8, 32], "", 0, []], [[], [["FU", 1, [0, 1, 2, 3]], ["SP", 1, 0, 802816, [2], 1], ["AN", 1, 0, 5], ["AN", 1, 1, 6]]]], "r": [[0.000300393, 0.000300407, 0.000300486], 0, 4.70626, 1667896550], "v": "v0.6"}
{"i": [["[\"relu\", 1, 112, 112, 64]", "cuda -keys=cuda,gpu -max_num_threads=1024 -model=unknown -thread_warp_size=32", [-1, 16, 64, 49152, 2147483647, 1024, 8, 32], "", 0, []], [[], [["FU", 1, [0, 1, 2, 3]], ["SP", 1, 0, 802816, [7], 1], ["AN", 1, 0, 5], ["AN", 1, 1, 6]]]], "r": [[8.77779e-05, 8.7794e-05, 8.78002e-05], 0, 1.56289, 1667900954], "v": "v0.6"}
{"i": [["[\"relu\", 1, 112, 112, 64]", "cuda -keys=cuda,gpu -max_num_threads=1024 -model=unknown -thread_warp_size=32", [-1, 16, 64, 49152, 2147483647, 1024, 8, 32], "", 0, []], [[], [["FU", 1, [0, 1, 2, 3]], ["SP", 1, 0, 802816, [14], 1], ["AN", 1, 0, 5], ["AN", 1, 1, 6]]]], "r": [[4.53201e-05, 4.53348e-05, 4.53526e-05], 0, 1.08122, 1667900954], "v": "v0.6"}
{"i": [["[\"relu\", 1, 112, 112, 64]", "cuda -keys=cuda,gpu -max_num_threads=1024 -model=unknown -thread_warp_size=32", [-1, 16, 64, 49152, 2147483647, 1024, 8, 32], "", 0, []], [[], [["FU", 1, [0, 1, 2, 3]], ["SP", 1, 0, 802816, [2], 1], ["AN", 1, 0, 5], ["AN", 1, 1, 6]]]], "r": [[0.000300373, 0.000300377, 0.000300434], 0, 0.726189, 1667900953], "v": "v0.6"}
{"i": [["[\"relu\", 1, 112, 112, 64]", "cuda -keys=cuda,gpu -max_num_threads=1024 -model=unknown -thread_warp_size=32", [-1, 16, 64, 49152, 2147483647, 1024, 8, 32], "", 0, []], [[], [["FU", 1, [0, 1, 2, 3]], ["SP", 1, 0, 802816, [28], 1], ["AN", 1, 0, 5], ["AN", 1, 1, 6]]]], "r": [[2.40041e-05, 2.40171e-05, 2.40178e-05], 0, 1.99745, 1667900955], "v": "v0.6"}
{"i": [["[\"relu\", 1, 112, 112, 64]", "cuda -keys=cuda,gpu -max_num_threads=1024 -model=unknown -thread_warp_size=32", [-1, 16, 64, 49152, 2147483647, 1024, 8, 32], "", 0, []], [[], [["FU", 1, [0, 1, 2, 3]], ["SP", 1, 0, 802816, [56], 1], ["AN", 1, 0, 5], ["AN", 1, 1, 6]]]], "r": [[1.31454e-05, 1.31526e-05, 1.31564e-05], 0, 4.70888, 1667900957], "v": "v0.6"}
{"i": [["[\"relu\", 1, 112, 112, 64]", "cuda -keys=cuda,gpu -max_num_threads=1024 -model=unknown -thread_warp_size=32", [-1, 16, 64, 49152, 2147483647, 1024, 8, 32], "", 0, []], [[], [["FU", 1, [0, 1, 2, 3]], ["SP", 1, 0, 802816, [16], 1], ["AN", 1, 0, 5], ["AN", 1, 1, 6]]]], "r": [[3.97942e-05, 3.98069e-05, 3.98057e-05], 0, 2.439, 1667900955], "v": "v0.6"}
{"i": [["[\"relu\", 1, 112, 112, 64]", "cuda -keys=cuda,gpu -max_num_threads=1024 -model=unknown -thread_warp_size=32", [-1, 16, 64, 49152, 2147483647, 1024, 8, 32], "", 0, []], [[], [["FU", 1, [0, 1, 2, 3]], ["SP", 1, 0, 802816, [4], 1], ["AN", 1, 0, 5], ["AN", 1, 1, 6]]]], "r": [[0.000151573, 0.000151525, 0.000151533], 0, 2.92991, 1667900956], "v": "v0.6"}
{"i": [["[\"relu\", 1, 112, 112, 64]", "cuda -keys=cuda,gpu -max_num_threads=1024 -model=unknown -thread_warp_size=32", [-1, 16, 64, 49152, 2147483647, 1024, 8, 32], "", 0, []], [[], [["FU", 1, [0, 1, 2, 3]], ["SP", 1, 0, 802816, [8], 1], ["AN", 1, 0, 5], ["AN", 1, 1, 6]]]], "r": [[7.69961e-05, 7.70085e-05, 7.70106e-05], 0, 5.63488, 1667900958], "v": "v0.6"}
{"i": [["[\"relu\", 1, 112, 112, 64]", "cuda -keys=cuda,gpu -max_num_threads=1024 -model=unknown -thread_warp_size=32", [-1, 16, 64, 49152, 2147483647, 1024, 8, 32], "", 0, []], [[], [["FU", 1, [0, 1, 2, 3]], ["SP", 1, 0, 802816, [32], 1], ["AN", 1, 0, 5], ["AN", 1, 1, 6]]]], "r": [[2.1497e-05, 2.15151e-05, 2.15141e-05], 0, 5.17933, 1667900958], "v": "v0.6"}
{"i": [["[\"relu\", 1, 112, 112, 64]", "cuda -keys=cuda,gpu -max_num_threads=1024 -model=unknown -thread_warp_size=32", [-1, 16, 64, 49152, 2147483647, 1024, 8, 32], "", 0, []], [[], [["FU", 1, [0, 1, 2, 3]], ["SP", 1, 0, 802816, [1], 1], ["AN", 1, 0, 5], ["AN", 1, 1, 6]]]], "r": [[0.000598264, 0.000598267, 0.000598291], 0, 3.81342, 1667900956], "v": "v0.6"}
{"i": [["[\"relu\", 1, 112, 112, 64]", "cuda -keys=cuda,gpu -max_num_threads=1024 -model=unknown -thread_warp_size=32", [-1, 16, 64, 49152, 2147483647, 1024, 8, 32], "", 0, []], [[], [["FU", 1, [0, 1, 2, 3]], ["SP", 1, 0, 802816, [49], 1], ["AN", 1, 0, 5], ["AN", 1, 1, 6]]]], "r": [[1.47367e-05, 1.47495e-05, 1.4749e-05], 0, 3.36808, 1667900956], "v": "v0.6"}
{"i": [["[\"relu\", 1, 112, 112, 64]", "cuda -keys=cuda,gpu -max_num_threads=1024 -model=unknown -thread_warp_size=32", [-1, 16, 64, 49152, 2147483647, 1024, 8, 32], "", 0, []], [[], [["FU", 1, [0, 1, 2, 3]], ["SP", 1, 0, 802816, [64], 1], ["AN", 1, 0, 5], ["AN", 1, 1, 6]]]], "r": [[1.18506e-05, 1.18592e-05, 1.18633e-05], 0, 4.2614, 1667900957], "v": "v0.6"}
{"i": [["[\"relu\", 1, 112, 112, 64]", "cuda -keys=cuda,gpu -max_num_threads=1024 -model=unknown -thread_warp_size=32", [-1, 16, 64, 49152, 2147483647, 1024, 8, 32], "", 0, []], [[], [["FU", 1, [0, 1, 2, 3]], ["SP", 1, 0, 802816, [2], 1], ["AN", 1, 0, 5], ["AN", 1, 1, 6]]]], "r": [[0.000300447, 0.000300447, 0.000300439], 0, 1.25267, 1667956964], "v": "v0.6"}
{"i": [["[\"relu\", 1, 112, 112, 64]", "cuda -keys=cuda,gpu -max_num_threads=1024 -model=unknown -thread_warp_size=32", [-1, 16, 64, 49152, 2147483647, 1024, 8, 32], "", 0, []], [[], [["FU", 1, [0, 1, 2, 3]], ["SP", 1, 0, 802816, [1], 1], ["AN", 1, 0, 5], ["AN", 1, 1, 6]]]], "r": [[0.000598057, 0.000598125, 0.000598121], 0, 1.97884, 1667956965], "v": "v0.6"}
{"i": [["[\"relu\", 1, 112, 112, 64]", "cuda -keys=cuda,gpu -max_num_threads=1024 -model=unknown -thread_warp_size=32", [-1, 16, 64, 49152, 2147483647, 1024, 8, 32], "", 0, []], [[], [["FU", 1, [0, 1, 2, 3]], ["SP", 1, 0, 802816, [56], 1], ["AN", 1, 0, 5], ["AN", 1, 1, 6]]]], "r": [[1.32918e-05, 1.32762e-05, 1.32768e-05], 0, 0.544482, 1667956963], "v": "v0.6"}
{"i": [["[\"relu\", 1, 112, 112, 64]", "cuda -keys=cuda,gpu -max_num_threads=1024 -model=unknown -thread_warp_size=32", [-1, 16, 64, 49152, 2147483647, 1024, 8, 32], "", 0, []], [[], [["FU", 1, [0, 1, 2, 3]], ["SP", 1, 0, 802816, [64], 1], ["AN", 1, 0, 5], ["AN", 1, 1, 6]]]], "r": [[1.18223e-05, 1.18236e-05, 1.18087e-05], 0, 2.70848, 1667956966], "v": "v0.6"}
{"i": [["[\"relu\", 1, 112, 112, 64]", "cuda -keys=cuda,gpu -max_num_threads=1024 -model=unknown -thread_warp_size=32", [-1, 16, 64, 49152, 2147483647, 1024, 8, 32], "", 0, []], [[], [["FU", 1, [0, 1, 2, 3]], ["SP", 1, 0, 802816, [8], 1], ["AN", 1, 0, 5], ["AN", 1, 1, 6]]]], "r": [[7.70654e-05, 7.70793e-05, 7.70723e-05], 0, 1.63429, 1667956965], "v": "v0.6"}
{"i": [["[\"relu\", 1, 112, 112, 64]", "cuda -keys=cuda,gpu -max_num_threads=1024 -model=unknown -thread_warp_size=32", [-1, 16, 64, 49152, 2147483647, 1024, 8, 32], "", 0, []], [[], [["FU", 1, [0, 1, 2, 3]], ["SP", 1, 0, 802816, [14], 1], ["AN", 1, 0, 5], ["AN", 1, 1, 6]]]], "r": [[4.51723e-05, 4.51883e-05, 4.5184e-05], 0, 2.32195, 1667956965], "v": "v0.6"}
{"i": [["[\"relu\", 1, 112, 112, 64]", "cuda -keys=cuda,gpu -max_num_threads=1024 -model=unknown -thread_warp_size=32", [-1, 16, 64, 49152, 2147483647, 1024, 8, 32], "", 0, []], [[], [["FU", 1, [0, 1, 2, 3]], ["SP", 1, 0, 802816, [49], 1], ["AN", 1, 0, 5], ["AN", 1, 1, 6]]]], "r": [[1.46963e-05, 1.47044e-05, 1.47011e-05], 0, 3.40162, 1667956966], "v": "v0.6"}
{"i": [["[\"relu\", 1, 112, 112, 64]", "cuda -keys=cuda,gpu -max_num_threads=1024 -model=unknown -thread_warp_size=32", [-1, 16, 64, 49152, 2147483647, 1024, 8, 32], "", 0, []], [[], [["FU", 1, [0, 1, 2, 3]], ["SP", 1, 0, 802816, [32], 1], ["AN", 1, 0, 5], ["AN", 1, 1, 6]]]], "r": [[2.13341e-05, 2.1357e-05, 2.13542e-05], 0, 3.06746, 1667956966], "v": "v0.6"}
{"i": [["[\"relu\", 1, 112, 112, 64]", "cuda -keys=cuda,gpu -max_num_threads=1024 -model=unknown -thread_warp_size=32", [-1, 16, 64, 49152, 2147483647, 1024, 8, 32], "", 0, []], [[], [["FU", 1, [0, 1, 2, 3]], ["SP", 1, 0, 802816, [7], 1], ["AN", 1, 0, 5], ["AN", 1, 1, 6]]]], "r": [[8.78309e-05, 8.78648e-05, 8.7862e-05], 0, 3.7859, 1667956967], "v": "v0.6"}
{"i": [["[\"relu\", 1, 112, 112, 64]", "cuda -keys=cuda,gpu -max_num_threads=1024 -model=unknown -thread_warp_size=32", [-1, 16, 64, 49152, 2147483647, 1024, 8, 32], "", 0, []], [[], [["FU", 1, [0, 1, 2, 3]], ["SP", 1, 0, 802816, [28], 1], ["AN", 1, 0, 5], ["AN", 1, 1, 6]]]], "r": [[2.39391e-05, 2.39582e-05, 2.39574e-05], 0, 4.11609, 1667956967], "v": "v0.6"}
{"i": [["[\"relu\", 1, 112, 112, 64]", "cuda -keys=cuda,gpu -max_num_threads=1024 -model=unknown -thread_warp_size=32", [-1, 16, 64, 49152, 2147483647, 1024, 8, 32], "", 0, []], [[], [["FU", 1, [0, 1, 2, 3]], ["SP", 1, 0, 802816, [16], 1], ["AN", 1, 0, 5], ["AN", 1, 1, 6]]]], "r": [[3.99258e-05, 3.99267e-05, 3.99267e-05], 0, 4.4437, 1667956967], "v": "v0.6"}
{"i": [["[\"relu\", 1, 112, 112, 64]", "cuda -keys=cuda,gpu -max_num_threads=1024 -model=unknown -thread_warp_size=32", [-1, 16, 64, 49152, 2147483647, 1024, 8, 32], "", 0, []], [[], [["FU", 1, [0, 1, 2, 3]], ["SP", 1, 0, 802816, [4], 1], ["AN", 1, 0, 5], ["AN", 1, 1, 6]]]], "r": [[0.000151615, 0.000151556, 0.000151538], 0, 4.82431, 1667956968], "v": "v0.6"}
