python/models/resnext/ResNextHorizontal_kernel_configs/resnext_imagenet_50_batch_norm_1_14_14_1024.log
{"i": [["[\"batch_norm\", 1, 14, 14, 1024]", "cuda -keys=cuda,gpu -max_num_threads=1024 -model=unknown -thread_warp_size=32", [-1, 16, 64, 49152, 2147483647, 1024, 8, 32], "", 0, []], [[], [["CI", 2], ["FU", 4, [0, 1, 2, 3]], ["SP", 4, 0, 200704, [8], 1], ["AN", 4, 0, 5], ["AN", 4, 1, 6]]]], "r": [[2.13693e-05, 2.13582e-05, 2.13664e-05], 0, 1.76335, 1667897362], "v": "v0.6"}
{"i": [["[\"batch_norm\", 1, 14, 14, 1024]", "cuda -keys=cuda,gpu -max_num_threads=1024 -model=unknown -thread_warp_size=32", [-1, 16, 64, 49152, 2147483647, 1024, 8, 32], "", 0, []], [[], [["CI", 2], ["FU", 4, [0, 1, 2, 3]], ["SP", 4, 0, 200704, [32], 1], ["AN", 4, 0, 5], ["AN", 4, 1, 6]]]], "r": [[7.33266e-06, 7.33754e-06, 7.32711e-06], 0, 1.45193, 1667897361], "v": "v0.6"}
{"i": [["[\"batch_norm\", 1, 14, 14, 1024]", "cuda -keys=cuda,gpu -max_num_threads=1024 -model=unknown -thread_warp_size=32", [-1, 16, 64, 49152, 2147483647, 1024, 8, 32], "", 0, []], [[], [["CI", 2], ["FU", 4, [0, 1, 2, 3]], ["SP", 4, 0, 200704, [56], 1], ["AN", 4, 0, 5], ["AN", 4, 1, 6]]]], "r": [[5.46396e-06, 5.46949e-06, 5.46202e-06], 0, 2.38768, 1667897362], "v": "v0.6"}
{"i": [["[\"batch_norm\", 1, 14, 14, 1024]", "cuda -keys=cuda,gpu -max_num_threads=1024 -model=unknown -thread_warp_size=32", [-1, 16, 64, 49152, 2147483647, 1024, 8, 32], "", 0, []], [[], [["CI", 2], ["FU", 4, [0, 1, 2, 3]], ["SP", 4, 0, 200704, [64], 1], ["AN", 4, 0, 5], ["AN", 4, 1, 6]]]], "r": [[5.02288e-06, 5.01914e-06, 5.01808e-06], 0, 0.820211, 1667897361], "v": "v0.6"}
{"i": [["[\"batch_norm\", 1, 14, 14, 1024]", "cuda -keys=cuda,gpu -max_num_threads=1024 -model=unknown -thread_warp_size=32", [-1, 16, 64, 49152, 2147483647, 1024, 8, 32], "", 0, []], [[], [["CI", 2], ["FU", 4, [0, 1, 2, 3]], ["SP", 4, 0, 200704, [4], 1], ["AN", 4, 0, 5], ["AN", 4, 1, 6]]]], "r": [[3.98406e-05, 3.98528e-05, 3.98482e-05], 0, 0.526563, 1667897360], "v": "v0.6"}
{"i": [["[\"batch_norm\", 1, 14, 14, 1024]", "cuda -keys=cuda,gpu -max_num_threads=1024 -model=unknown -thread_warp_size=32", [-1, 16, 64, 49152, 2147483647, 1024, 8, 32], "", 0, []], [[], [["CI", 2], ["FU", 4, [0, 1, 2, 3]], ["SP", 4, 0, 200704, [1], 1], ["AN", 4, 0, 5], ["AN", 4, 1, 6]]]], "r": [[0.000151572, 0.000151554, 0.000151547], 0, 1.10573, 1667897361], "v": "v0.6"}
{"i": [["[\"batch_norm\", 1, 14, 14, 1024]", "cuda -keys=cuda,gpu -max_num_threads=1024 -model=unknown -thread_warp_size=32", [-1, 16, 64, 49152, 2147483647, 1024, 8, 32], "", 0, []], [[], [["CI", 2], ["FU", 4, [0, 1, 2, 3]], ["SP", 4, 0, 200704, [16], 1], ["AN", 4, 0, 5], ["AN", 4, 1, 6]]]], "r": [[1.19912e-05, 1.19809e-05, 1.19813e-05], 0, 3.00027, 1667897363], "v": "v0.6"}
{"i": [["[\"batch_norm\", 1, 14, 14, 1024]", "cuda -keys=cuda,gpu -max_num_threads=1024 -model=unknown -thread_warp_size=32", [-1, 16, 64, 49152, 2147483647, 1024, 8, 32], "", 0, []], [[], [["CI", 2], ["FU", 4, [0, 1, 2, 3]], ["SP", 4, 0, 200704, [7], 1], ["AN", 4, 0, 5], ["AN", 4, 1, 6]]]], "r": [[2.40355e-05, 2.40265e-05, 2.403e-05], 0, 2.0656, 1667897362], "v": "v0.6"}
{"i": [["[\"batch_norm\", 1, 14, 14, 1024]", "cuda -keys=cuda,gpu -max_num_threads=1024 -model=unknown -thread_warp_size=32", [-1, 16, 64, 49152, 2147483647, 1024, 8, 32], "", 0, []], [[], [["CI", 2], ["FU", 4, [0, 1, 2, 3]], ["SP", 4, 0, 200704, [28], 1], ["AN", 4, 0, 5], ["AN", 4, 1, 6]]]], "r": [[8.12142e-06, 8.12044e-06, 8.11931e-06], 0, 3.33044, 1667897363], "v": "v0.6"}
{"i": [["[\"batch_norm\", 1, 14, 14, 1024]", "cuda -keys=cuda,gpu -max_num_threads=1024 -model=unknown -thread_warp_size=32", [-1, 16, 64, 49152, 2147483647, 1024, 8, 32], "", 0, []], [[], [["CI", 2], ["FU", 4, [0, 1, 2, 3]], ["SP", 4, 0, 200704, [49], 1], ["AN", 4, 0, 5], ["AN", 4, 1, 6]]]], "r": [[5.68246e-06, 5.68137e-06, 5.68277e-06], 0, 3.91799, 1667897364], "v": "v0.6"}
{"i": [["[\"batch_norm\", 1, 14, 14, 1024]", "cuda -keys=cuda,gpu -max_num_threads=1024 -model=unknown -thread_warp_size=32", [-1, 16, 64, 49152, 2147483647, 1024, 8, 32], "", 0, []], [[], [["CI", 2], ["FU", 4, [0, 1, 2, 3]], ["SP", 4, 0, 200704, [14], 1], ["AN", 4, 0, 5], ["AN", 4, 1, 6]]]], "r": [[1.33947e-05, 1.33925e-05, 1.33884e-05], 0, 2.69521, 1667897363], "v": "v0.6"}
{"i": [["[\"batch_norm\", 1, 14, 14, 1024]", "cuda -keys=cuda,gpu -max_num_threads=1024 -model=unknown -thread_warp_size=32", [-1, 16, 64, 49152, 2147483647, 1024, 8, 32], "", 0, []], [[], [["CI", 2], ["FU", 4, [0, 1, 2, 3]], ["SP", 4, 0, 200704, [2], 1], ["AN", 4, 0, 5], ["AN", 4, 1, 6]]]], "r": [[7.70794e-05, 7.70883e-05, 7.70602e-05], 0, 3.61572, 1667897364], "v": "v0.6"}
{"i": [["[\"batch_norm\", 1, 14, 14, 1024]", "cuda -keys=cuda,gpu -max_num_threads=1024 -model=unknown -thread_warp_size=32", [-1, 16, 64, 49152, 2147483647, 1024, 8, 32], "", 0, []], [[], [["CI", 2], ["FU", 4, [0, 1, 2, 3]], ["SP", 4, 0, 200704, [8], 1], ["AN", 4, 0, 5], ["AN", 4, 1, 6]]]], "r": [[2.14e-05, 2.14003e-05, 2.14055e-05], 0, 2.13495, 1667968264], "v": "v0.6"}
{"i": [["[\"batch_norm\", 1, 14, 14, 1024]", "cuda -keys=cuda,gpu -max_num_threads=1024 -model=unknown -thread_warp_size=32", [-1, 16, 64, 49152, 2147483647, 1024, 8, 32], "", 0, []], [[], [["CI", 2], ["FU", 4, [0, 1, 2, 3]], ["SP", 4, 0, 200704, [2], 1], ["AN", 4, 0, 5], ["AN", 4, 1, 6]]]], "r": [[7.7134e-05, 7.71101e-05, 7.71236e-05], 0, 0.854549, 1667968263], "v": "v0.6"}
{"i": [["[\"batch_norm\", 1, 14, 14, 1024]", "cuda -keys=cuda,gpu -max_num_threads=1024 -model=unknown -thread_warp_size=32", [-1, 16, 64, 49152, 2147483647, 1024, 8, 32], "", 0, []], [[], [["CI", 2], ["FU", 4, [0, 1, 2, 3]], ["SP", 4, 0, 200704, [49], 1], ["AN", 4, 0, 5], ["AN", 4, 1, 6]]]], "r": [[5.89716e-06, 5.89691e-06, 5.89819e-06], 0, 1.82044, 1667968264], "v": "v0.6"}
{"i": [["[\"batch_norm\", 1, 14, 14, 1024]", "cuda -keys=cuda,gpu -max_num_threads=1024 -model=unknown -thread_warp_size=32", [-1, 16, 64, 49152, 2147483647, 1024, 8, 32], "", 0, []], [[], [["CI", 2], ["FU", 4, [0, 1, 2, 3]], ["SP", 4, 0, 200704, [28], 1], ["AN", 4, 0, 5], ["AN", 4, 1, 6]]]], "r": [[8.16145e-06, 8.16429e-06, 8.15275e-06], 0, 1.50105, 1667968263], "v": "v0.6"}
{"i": [["[\"batch_norm\", 1, 14, 14, 1024]", "cuda -keys=cuda,gpu -max_num_threads=1024 -model=unknown -thread_warp_size=32", [-1, 16, 64, 49152, 2147483647, 1024, 8, 32], "", 0, []], [[], [["CI", 2], ["FU", 4, [0, 1, 2, 3]], ["SP", 4, 0, 200704, [1], 1], ["AN", 4, 0, 5], ["AN", 4, 1, 6]]]], "r": [[0.000151599, 0.000151644, 0.000151589], 0, 0.53608, 1667968262], "v": "v0.6"}
{"i": [["[\"batch_norm\", 1, 14, 14, 1024]", "cuda -keys=cuda,gpu -max_num_threads=1024 -model=unknown -thread_warp_size=32", [-1, 16, 64, 49152, 2147483647, 1024, 8, 32], "", 0, []], [[], [["CI", 2], ["FU", 4, [0, 1, 2, 3]], ["SP", 4, 0, 200704, [64], 1], ["AN", 4, 0, 5], ["AN", 4, 1, 6]]]], "r": [[5.08915e-06, 5.08545e-06, 5.08949e-06], 0, 1.13704, 1667968263], "v": "v0.6"}
{"i": [["[\"batch_norm\", 1, 14, 14, 1024]", "cuda -keys=cuda,gpu -max_num_threads=1024 -model=unknown -thread_warp_size=32", [-1, 16, 64, 49152, 2147483647, 1024, 8, 32], "", 0, []], [[], [["CI", 2], ["FU", 4, [0, 1, 2, 3]], ["SP", 4, 0, 200704, [14], 1], ["AN", 4, 0, 5], ["AN", 4, 1, 6]]]], "r": [[1.33701e-05, 1.33673e-05, 1.33636e-05], 0, 2.47163, 1667968264], "v": "v0.6"}
{"i": [["[\"batch_norm\", 1, 14, 14, 1024]", "cuda -keys=cuda,gpu -max_num_threads=1024 -model=unknown -thread_warp_size=32", [-1, 16, 64, 49152, 2147483647, 1024, 8, 32], "", 0, []], [[], [["CI", 2], ["FU", 4, [0, 1, 2, 3]], ["SP", 4, 0, 200704, [7], 1], ["AN", 4, 0, 5], ["AN", 4, 1, 6]]]], "r": [[2.3983e-05, 2.39804e-05, 2.39799e-05], 0, 3.1046, 1667968265], "v": "v0.6"}
{"i": [["[\"batch_norm\", 1, 14, 14, 1024]", "cuda -keys=cuda,gpu -max_num_threads=1024 -model=unknown -thread_warp_size=32", [-1, 16, 64, 49152, 2147483647, 1024, 8, 32], "", 0, []], [[], [["CI", 2], ["FU", 4, [0, 1, 2, 3]], ["SP", 4, 0, 200704, [4], 1], ["AN", 4, 0, 5], ["AN", 4, 1, 6]]]], "r": [[3.98569e-05, 3.98575e-05, 3.9848e-05], 0, 3.44314, 1667968265], "v": "v0.6"}
{"i": [["[\"batch_norm\", 1, 14, 14, 1024]", "cuda -keys=cuda,gpu -max_num_threads=1024 -model=unknown -thread_warp_size=32", [-1, 16, 64, 49152, 2147483647, 1024, 8, 32], "", 0, []], [[], [["CI", 2], ["FU", 4, [0, 1, 2, 3]], ["SP", 4, 0, 200704, [56], 1], ["AN", 4, 0, 5], ["AN", 4, 1, 6]]]], "r": [[5.47701e-06, 5.47755e-06, 5.47538e-06], 0, 2.78458, 1667968265], "v": "v0.6"}
{"i": [["[\"batch_norm\", 1, 14, 14, 1024]", "cuda -keys=cuda,gpu -max_num_threads=1024 -model=unknown -thread_warp_size=32", [-1, 16, 64, 49152, 2147483647, 1024, 8, 32], "", 0, []], [[], [["CI", 2], ["FU", 4, [0, 1, 2, 3]], ["SP", 4, 0, 200704, [16], 1], ["AN", 4, 0, 5], ["AN", 4, 1, 6]]]], "r": [[1.21783e-05, 1.21693e-05, 1.21785e-05], 0, 3.75161, 1667968266], "v": "v0.6"}
{"i": [["[\"batch_norm\", 1, 14, 14, 1024]", "cuda -keys=cuda,gpu -max_num_threads=1024 -model=unknown -thread_warp_size=32", [-1, 16, 64, 49152, 2147483647, 1024, 8, 32], "", 0, []], [[], [["CI", 2], ["FU", 4, [0, 1, 2, 3]], ["SP", 4, 0, 200704, [32], 1], ["AN", 4, 0, 5], ["AN", 4, 1, 6]]]], "r": [[7.23562e-06, 7.23787e-06, 7.23624e-06], 0, 4.06582, 1667968266], "v": "v0.6"}
{"i": [["[\"batch_norm\", 1, 14, 14, 1024]", "cuda -keys=cuda,gpu -max_num_threads=1024 -model=unknown -thread_warp_size=32", [-1, 16, 64, 49152, 2147483647, 1024, 8, 32], "", 0, []], [[], [["CI", 2], ["FU", 4, [0, 1, 2, 3]], ["SP", 4, 0, 200704, [28], 1], ["AN", 4, 0, 5], ["AN", 4, 1, 6]]]], "r": [[8.04176e-06, 8.03613e-06, 8.04023e-06], 0, 2.42305, 1667968372], "v": "v0.6"}
{"i": [["[\"batch_norm\", 1, 14, 14, 1024]", "cuda -keys=cuda,gpu -max_num_threads=1024 -model=unknown -thread_warp_size=32", [-1, 16, 64, 49152, 2147483647, 1024, 8, 32], "", 0, []], [[], [["CI", 2], ["FU", 4, [0, 1, 2, 3]], ["SP", 4, 0, 200704, [56], 1], ["AN", 4, 0, 5], ["AN", 4, 1, 6]]]], "r": [[5.32795e-06, 5.32626e-06, 5.32901e-06], 0, 1.1212, 1667968370], "v": "v0.6"}
{"i": [["[\"batch_norm\", 1, 14, 14, 1024]", "cuda -keys=cuda,gpu -max_num_threads=1024 -model=unknown -thread_warp_size=32", [-1, 16, 64, 49152, 2147483647, 1024, 8, 32], "", 0, []], [[], [["CI", 2], ["FU", 4, [0, 1, 2, 3]], ["SP", 4, 0, 200704, [2], 1], ["AN", 4, 0, 5], ["AN", 4, 1, 6]]]], "r": [[7.70543e-05, 7.70389e-05, 7.7038e-05], 0, 0.518232, 1667968370], "v": "v0.6"}
{"i": [["[\"batch_norm\", 1, 14, 14, 1024]", "cuda -keys=cuda,gpu -max_num_threads=1024 -model=unknown -thread_warp_size=32", [-1, 16, 64, 49152, 2147483647, 1024, 8, 32], "", 0, []], [[], [["CI", 2], ["FU", 4, [0, 1, 2, 3]], ["SP", 4, 0, 200704, [14], 1], ["AN", 4, 0, 5], ["AN", 4, 1, 6]]]], "r": [[1.33072e-05, 1.33062e-05, 1.3302e-05], 0, 1.79476, 1667968371], "v": "v0.6"}
{"i": [["[\"batch_norm\", 1, 14, 14, 1024]", "cuda -keys=cuda,gpu -max_num_threads=1024 -model=unknown -thread_warp_size=32", [-1, 16, 64, 49152, 2147483647, 1024, 8, 32], "", 0, []], [[], [["CI", 2], ["FU", 4, [0, 1, 2, 3]], ["SP", 4, 0, 200704, [49], 1], ["AN", 4, 0, 5], ["AN", 4, 1, 6]]]], "r": [[5.73078e-06, 5.73755e-06, 5.72959e-06], 0, 0.839285, 1667968370], "v": "v0.6"}
{"i": [["[\"batch_norm\", 1, 14, 14, 1024]", "cuda -keys=cuda,gpu -max_num_threads=1024 -model=unknown -thread_warp_size=32", [-1, 16, 64, 49152, 2147483647, 1024, 8, 32], "", 0, []], [[], [["CI", 2], ["FU", 4, [0, 1, 2, 3]], ["SP", 4, 0, 200704, [16], 1], ["AN", 4, 0, 5], ["AN", 4, 1, 6]]]], "r": [[1.20558e-05, 1.20544e-05, 1.20554e-05], 0, 1.48552, 1667968371], "v": "v0.6"}
{"i": [["[\"batch_norm\", 1, 14, 14, 1024]", "cuda -keys=cuda,gpu -max_num_threads=1024 -model=unknown -thread_warp_size=32", [-1, 16, 64, 49152, 2147483647, 1024, 8, 32], "", 0, []], [[], [["CI", 2], ["FU", 4, [0, 1, 2, 3]], ["SP", 4, 0, 200704, [1], 1], ["AN", 4, 0, 5], ["AN", 4, 1, 6]]]], "r": [[0.000151654, 0.000151622, 0.000151645], 0, 2.72081, 1667968372], "v": "v0.6"}
{"i": [["[\"batch_norm\", 1, 14, 14, 1024]", "cuda -keys=cuda,gpu -max_num_threads=1024 -model=unknown -thread_warp_size=32", [-1, 16, 64, 49152, 2147483647, 1024, 8, 32], "", 0, []], [[], [["CI", 2], ["FU", 4, [0, 1, 2, 3]], ["SP", 4, 0, 200704, [64], 1], ["AN", 4, 0, 5], ["AN", 4, 1, 6]]]], "r": [[4.92884e-06, 4.92009e-06, 4.92207e-06], 0, 2.07865, 1667968371], "v": "v0.6"}
{"i": [["[\"batch_norm\", 1, 14, 14, 1024]", "cuda -keys=cuda,gpu -max_num_threads=1024 -model=unknown -thread_warp_size=32", [-1, 16, 64, 49152, 2147483647, 1024, 8, 32], "", 0, []], [[], [["CI", 2], ["FU", 4, [0, 1, 2, 3]], ["SP", 4, 0, 200704, [4], 1], ["AN", 4, 0, 5], ["AN", 4, 1, 6]]]], "r": [[3.98464e-05, 3.98457e-05, 3.9853e-05], 0, 3.01825, 1667968372], "v": "v0.6"}
{"i": [["[\"batch_norm\", 1, 14, 14, 1024]", "cuda -keys=cuda,gpu -max_num_threads=1024 -model=unknown -thread_warp_size=32", [-1, 16, 64, 49152, 2147483647, 1024, 8, 32], "", 0, []], [[], [["CI", 2], ["FU", 4, [0, 1, 2, 3]], ["SP", 4, 0, 200704, [8], 1], ["AN", 4, 0, 5], ["AN", 4, 1, 6]]]], "r": [[2.13477e-05, 2.13493e-05, 2.13477e-05], 0, 3.67592, 1667968373], "v": "v0.6"}
{"i": [["[\"batch_norm\", 1, 14, 14, 1024]", "cuda -keys=cuda,gpu -max_num_threads=1024 -model=unknown -thread_warp_size=32", [-1, 16, 64, 49152, 2147483647, 1024, 8, 32], "", 0, []], [[], [["CI", 2], ["FU", 4, [0, 1, 2, 3]], ["SP", 4, 0, 200704, [32], 1], ["AN", 4, 0, 5], ["AN", 4, 1, 6]]]], "r": [[7.37219e-06, 7.36679e-06, 7.36662e-06], 0, 3.3628, 1667968373], "v": "v0.6"}
{"i": [["[\"batch_norm\", 1, 14, 14, 1024]", "cuda -keys=cuda,gpu -max_num_threads=1024 -model=unknown -thread_warp_size=32", [-1, 16, 64, 49152, 2147483647, 1024, 8, 32], "", 0, []], [[], [["CI", 2], ["FU", 4, [0, 1, 2, 3]], ["SP", 4, 0, 200704, [7], 1], ["AN", 4, 0, 5], ["AN", 4, 1, 6]]]], "r": [[2.42168e-05, 2.42165e-05, 2.42169e-05], 0, 3.9683, 1667968373], "v": "v0.6"}
{"i": [["[\"batch_norm\", 1, 14, 14, 1024]", "cuda -keys=cuda,gpu -max_num_threads=1024 -model=unknown -thread_warp_size=32", [-1, 16, 64, 49152, 2147483647, 1024, 8, 32], "", 0, []], [[], [["CI", 2], ["FU", 4, [0, 1, 2, 3]], ["SP", 4, 0, 200704, [4], 1], ["AN", 4, 0, 5], ["AN", 4, 1, 6]]]], "r": [[3.99404e-05, 3.99626e-05, 3.99534e-05], 0, 1.46942, 1667968478], "v": "v0.6"}
{"i": [["[\"batch_norm\", 1, 14, 14, 1024]", "cuda -keys=cuda,gpu -max_num_threads=1024 -model=unknown -thread_warp_size=32", [-1, 16, 64, 49152, 2147483647, 1024, 8, 32], "", 0, []], [[], [["CI", 2], ["FU", 4, [0, 1, 2, 3]], ["SP", 4, 0, 200704, [56], 1], ["AN", 4, 0, 5], ["AN", 4, 1, 6]]]], "r": [[5.21202e-06, 5.20919e-06, 5.21364e-06], 0, 1.1018, 1667968478], "v": "v0.6"}
{"i": [["[\"batch_norm\", 1, 14, 14, 1024]", "cuda -keys=cuda,gpu -max_num_threads=1024 -model=unknown -thread_warp_size=32", [-1, 16, 64, 49152, 2147483647, 1024, 8, 32], "", 0, []], [[], [["CI", 2], ["FU", 4, [0, 1, 2, 3]], ["SP", 4, 0, 200704, [32], 1], ["AN", 4, 0, 5], ["AN", 4, 1, 6]]]], "r": [[7.40584e-06, 7.39957e-06, 7.4026e-06], 0, 0.527644, 1667968477], "v": "v0.6"}
{"i": [["[\"batch_norm\", 1, 14, 14, 1024]", "cuda -keys=cuda,gpu -max_num_threads=1024 -model=unknown -thread_warp_size=32", [-1, 16, 64, 49152, 2147483647, 1024, 8, 32], "", 0, []], [[], [["CI", 2], ["FU", 4, [0, 1, 2, 3]], ["SP", 4, 0, 200704, [28], 1], ["AN", 4, 0, 5], ["AN", 4, 1, 6]]]], "r": [[8.05412e-06, 8.03979e-06, 8.04484e-06], 0, 1.7662, 1667968478], "v": "v0.6"}
{"i": [["[\"batch_norm\", 1, 14, 14, 1024]", "cuda -keys=cuda,gpu -max_num_threads=1024 -model=unknown -thread_warp_size=32", [-1, 16, 64, 49152, 2147483647, 1024, 8, 32], "", 0, []], [[], [["CI", 2], ["FU", 4, [0, 1, 2, 3]], ["SP", 4, 0, 200704, [49], 1], ["AN", 4, 0, 5], ["AN", 4, 1, 6]]]], "r": [[5.5944e-06, 5.59524e-06, 5.59535e-06], 0, 0.797186, 1667968477], "v": "v0.6"}
{"i": [["[\"batch_norm\", 1, 14, 14, 1024]", "cuda -keys=cuda,gpu -max_num_threads=1024 -model=unknown -thread_warp_size=32", [-1, 16, 64, 49152, 2147483647, 1024, 8, 32], "", 0, []], [[], [["CI", 2], ["FU", 4, [0, 1, 2, 3]], ["SP", 4, 0, 200704, [64], 1], ["AN", 4, 0, 5], ["AN", 4, 1, 6]]]], "r": [[4.86948e-06, 4.8747e-06, 4.87189e-06], 0, 2.07109, 1667968479], "v": "v0.6"}
{"i": [["[\"batch_norm\", 1, 14, 14, 1024]", "cuda -keys=cuda,gpu -max_num_threads=1024 -model=unknown -thread_warp_size=32", [-1, 16, 64, 49152, 2147483647, 1024, 8, 32], "", 0, []], [[], [["CI", 2], ["FU", 4, [0, 1, 2, 3]], ["SP", 4, 0, 200704, [14], 1], ["AN", 4, 0, 5], ["AN", 4, 1, 6]]]], "r": [[1.33653e-05, 1.33605e-05, 1.33634e-05], 0, 2.73052, 1667968479], "v": "v0.6"}
{"i": [["[\"batch_norm\", 1, 14, 14, 1024]", "cuda -keys=cuda,gpu -max_num_threads=1024 -model=unknown -thread_warp_size=32", [-1, 16, 64, 49152, 2147483647, 1024, 8, 32], "", 0, []], [[], [["CI", 2], ["FU", 4, [0, 1, 2, 3]], ["SP", 4, 0, 200704, [1], 1], ["AN", 4, 0, 5], ["AN", 4, 1, 6]]]], "r": [[0.000151523, 0.000151428, 0.000151451], 0, 2.4095, 1667968479], "v": "v0.6"}
{"i": [["[\"batch_norm\", 1, 14, 14, 1024]", "cuda -keys=cuda,gpu -max_num_threads=1024 -model=unknown -thread_warp_size=32", [-1, 16, 64, 49152, 2147483647, 1024, 8, 32], "", 0, []], [[], [["CI", 2], ["FU", 4, [0, 1, 2, 3]], ["SP", 4, 0, 200704, [2], 1], ["AN", 4, 0, 5], ["AN", 4, 1, 6]]]], "r": [[7.70786e-05, 7.70827e-05, 7.70942e-05], 0, 3.02819, 1667968480], "v": "v0.6"}
{"i": [["[\"batch_norm\", 1, 14, 14, 1024]", "cuda -keys=cuda,gpu -max_num_threads=1024 -model=unknown -thread_warp_size=32", [-1, 16, 64, 49152, 2147483647, 1024, 8, 32], "", 0, []], [[], [["CI", 2], ["FU", 4, [0, 1, 2, 3]], ["SP", 4, 0, 200704, [16], 1], ["AN", 4, 0, 5], ["AN", 4, 1, 6]]]], "r": [[1.1989e-05, 1.19867e-05, 1.19875e-05], 0, 3.6979, 1667968480], "v": "v0.6"}
{"i": [["[\"batch_norm\", 1, 14, 14, 1024]", "cuda -keys=cuda,gpu -max_num_threads=1024 -model=unknown -thread_warp_size=32", [-1, 16, 64, 49152, 2147483647, 1024, 8, 32], "", 0, []], [[], [["CI", 2], ["FU", 4, [0, 1, 2, 3]], ["SP", 4, 0, 200704, [8], 1], ["AN", 4, 0, 5], ["AN", 4, 1, 6]]]], "r": [[2.12888e-05, 2.12897e-05, 2.12937e-05], 0, 3.36524, 1667968480], "v": "v0.6"}
{"i": [["[\"batch_norm\", 1, 14, 14, 1024]", "cuda -keys=cuda,gpu -max_num_threads=1024 -model=unknown -thread_warp_size=32", [-1, 16, 64, 49152, 2147483647, 1024, 8, 32], "", 0, []], [[], [["CI", 2], ["FU", 4, [0, 1, 2, 3]], ["SP", 4, 0, 200704, [7], 1], ["AN", 4, 0, 5], ["AN", 4, 1, 6]]]], "r": [[2.40608e-05, 2.40554e-05, 2.40644e-05], 0, 3.96935, 1667968481], "v": "v0.6"}
{"i": [["[\"batch_norm\", 1, 14, 14, 1024]", "cuda -keys=cuda,gpu -max_num_threads=1024 -model=unknown -thread_warp_size=32", [-1, 16, 64, 49152, 2147483647, 1024, 8, 32], "", 0, []], [[], [["CI", 2], ["FU", 4, [0, 1, 2, 3]], ["SP", 4, 0, 200704, [56], 1], ["AN", 4, 0, 5], ["AN", 4, 1, 6]]]], "r": [[5.38394e-06, 5.38751e-06, 5.37822e-06], 0, 1.13424, 1667968585], "v": "v0.6"}
{"i": [["[\"batch_norm\", 1, 14, 14, 1024]", "cuda -keys=cuda,gpu -max_num_threads=1024 -model=unknown -thread_warp_size=32", [-1, 16, 64, 49152, 2147483647, 1024, 8, 32], "", 0, []], [[], [["CI", 2], ["FU", 4, [0, 1, 2, 3]], ["SP", 4, 0, 200704, [14], 1], ["AN", 4, 0, 5], ["AN", 4, 1, 6]]]], "r": [[1.34656e-05, 1.34591e-05, 1.34649e-05], 0, 1.48054, 1667968585], "v": "v0.6"}
{"i": [["[\"batch_norm\", 1, 14, 14, 1024]", "cuda -keys=cuda,gpu -max_num_threads=1024 -model=unknown -thread_warp_size=32", [-1, 16, 64, 49152, 2147483647, 1024, 8, 32], "", 0, []], [[], [["CI", 2], ["FU", 4, [0, 1, 2, 3]], ["SP", 4, 0, 200704, [64], 1], ["AN", 4, 0, 5], ["AN", 4, 1, 6]]]], "r": [[4.88269e-06, 4.88164e-06, 4.88214e-06], 0, 1.79181, 1667968586], "v": "v0.6"}
{"i": [["[\"batch_norm\", 1, 14, 14, 1024]", "cuda -keys=cuda,gpu -max_num_threads=1024 -model=unknown -thread_warp_size=32", [-1, 16, 64, 49152, 2147483647, 1024, 8, 32], "", 0, []], [[], [["CI", 2], ["FU", 4, [0, 1, 2, 3]], ["SP", 4, 0, 200704, [49], 1], ["AN", 4, 0, 5], ["AN", 4, 1, 6]]]], "r": [[5.72529e-06, 5.71087e-06, 5.71038e-06], 0, 0.532933, 1667968584], "v": "v0.6"}
{"i": [["[\"batch_norm\", 1, 14, 14, 1024]", "cuda -keys=cuda,gpu -max_num_threads=1024 -model=unknown -thread_warp_size=32", [-1, 16, 64, 49152, 2147483647, 1024, 8, 32], "", 0, []], [[], [["CI", 2], ["FU", 4, [0, 1, 2, 3]], ["SP", 4, 0, 200704, [2], 1], ["AN", 4, 0, 5], ["AN", 4, 1, 6]]]], "r": [[7.7098e-05, 7.70861e-05, 7.70921e-05], 0, 0.806549, 1667968585], "v": "v0.6"}
{"i": [["[\"batch_norm\", 1, 14, 14, 1024]", "cuda -keys=cuda,gpu -max_num_threads=1024 -model=unknown -thread_warp_size=32", [-1, 16, 64, 49152, 2147483647, 1024, 8, 32], "", 0, []], [[], [["CI", 2], ["FU", 4, [0, 1, 2, 3]], ["SP", 4, 0, 200704, [1], 1], ["AN", 4, 0, 5], ["AN", 4, 1, 6]]]], "r": [[0.000151545, 0.000151559, 0.00015154], 0, 2.07717, 1667968586], "v": "v0.6"}
{"i": [["[\"batch_norm\", 1, 14, 14, 1024]", "cuda -keys=cuda,gpu -max_num_threads=1024 -model=unknown -thread_warp_size=32", [-1, 16, 64, 49152, 2147483647, 1024, 8, 32], "", 0, []], [[], [["CI", 2], ["FU", 4, [0, 1, 2, 3]], ["SP", 4, 0, 200704, [7], 1], ["AN", 4, 0, 5], ["AN", 4, 1, 6]]]], "r": [[2.41516e-05, 2.41597e-05, 2.41528e-05], 0, 2.73593, 1667968587], "v": "v0.6"}
{"i": [["[\"batch_norm\", 1, 14, 14, 1024]", "cuda -keys=cuda,gpu -max_num_threads=1024 -model=unknown -thread_warp_size=32", [-1, 16, 64, 49152, 2147483647, 1024, 8, 32], "", 0, []], [[], [["CI", 2], ["FU", 4, [0, 1, 2, 3]], ["SP", 4, 0, 200704, [28], 1], ["AN", 4, 0, 5], ["AN", 4, 1, 6]]]], "r": [[8.09919e-06, 8.09485e-06, 8.09301e-06], 0, 4.01244, 1667968588], "v": "v0.6"}
{"i": [["[\"batch_norm\", 1, 14, 14, 1024]", "cuda -keys=cuda,gpu -max_num_threads=1024 -model=unknown -thread_warp_size=32", [-1, 16, 64, 49152, 2147483647, 1024, 8, 32], "", 0, []], [[], [["CI", 2], ["FU", 4, [0, 1, 2, 3]], ["SP", 4, 0, 200704, [16], 1], ["AN", 4, 0, 5], ["AN", 4, 1, 6]]]], "r": [[1.19809e-05, 1.19743e-05, 1.19763e-05], 0, 3.71073, 1667968588], "v": "v0.6"}
{"i": [["[\"batch_norm\", 1, 14, 14, 1024]", "cuda -keys=cuda,gpu -max_num_threads=1024 -model=unknown -thread_warp_size=32", [-1, 16, 64, 49152, 2147483647, 1024, 8, 32], "", 0, []], [[], [["CI", 2], ["FU", 4, [0, 1, 2, 3]], ["SP", 4, 0, 200704, [32], 1], ["AN", 4, 0, 5], ["AN", 4, 1, 6]]]], "r": [[7.37604e-06, 7.37342e-06, 7.3717e-06], 0, 2.41323, 1667968586], "v": "v0.6"}
{"i": [["[\"batch_norm\", 1, 14, 14, 1024]", "cuda -keys=cuda,gpu -max_num_threads=1024 -model=unknown -thread_warp_size=32", [-1, 16, 64, 49152, 2147483647, 1024, 8, 32], "", 0, []], [[], [["CI", 2], ["FU", 4, [0, 1, 2, 3]], ["SP", 4, 0, 200704, [8], 1], ["AN", 4, 0, 5], ["AN", 4, 1, 6]]]], "r": [[2.14149e-05, 2.14073e-05, 2.14123e-05], 0, 3.39081, 1667968587], "v": "v0.6"}
{"i": [["[\"batch_norm\", 1, 14, 14, 1024]", "cuda -keys=cuda,gpu -max_num_threads=1024 -model=unknown -thread_warp_size=32", [-1, 16, 64, 49152, 2147483647, 1024, 8, 32], "", 0, []], [[], [["CI", 2], ["FU", 4, [0, 1, 2, 3]], ["SP", 4, 0, 200704, [4], 1], ["AN", 4, 0, 5], ["AN", 4, 1, 6]]]], "r": [[3.98573e-05, 3.98489e-05, 3.98569e-05], 0, 3.03728, 1667968587], "v": "v0.6"}
{"i": [["[\"batch_norm\", 1, 14, 14, 1024]", "cuda -keys=cuda,gpu -max_num_threads=1024 -model=unknown -thread_warp_size=32", [-1, 16, 64, 49152, 2147483647, 1024, 8, 32], "", 0, []], [[], [["CI", 2], ["FU", 4, [0, 1, 2, 3]], ["SP", 4, 0, 200704, [2], 1], ["AN", 4, 0, 5], ["AN", 4, 1, 6]]]], "r": [[7.70482e-05, 7.70434e-05, 7.70425e-05], 0, 2.09237, 1667968693], "v": "v0.6"}
{"i": [["[\"batch_norm\", 1, 14, 14, 1024]", "cuda -keys=cuda,gpu -max_num_threads=1024 -model=unknown -thread_warp_size=32", [-1, 16, 64, 49152, 2147483647, 1024, 8, 32], "", 0, []], [[], [["CI", 2], ["FU", 4, [0, 1, 2, 3]], ["SP", 4, 0, 200704, [49], 1], ["AN", 4, 0, 5], ["AN", 4, 1, 6]]]], "r": [[5.67192e-06, 5.66916e-06, 5.66991e-06], 0, 0.529941, 1667968692], "v": "v0.6"}
{"i": [["[\"batch_norm\", 1, 14, 14, 1024]", "cuda -keys=cuda,gpu -max_num_threads=1024 -model=unknown -thread_warp_size=32", [-1, 16, 64, 49152, 2147483647, 1024, 8, 32], "", 0, []], [[], [["CI", 2], ["FU", 4, [0, 1, 2, 3]], ["SP", 4, 0, 200704, [56], 1], ["AN", 4, 0, 5], ["AN", 4, 1, 6]]]], "r": [[5.41852e-06, 5.41288e-06, 5.4173e-06], 0, 1.1118, 1667968692], "v": "v0.6"}
{"i": [["[\"batch_norm\", 1, 14, 14, 1024]", "cuda -keys=cuda,gpu -max_num_threads=1024 -model=unknown -thread_warp_size=32", [-1, 16, 64, 49152, 2147483647, 1024, 8, 32], "", 0, []], [[], [["CI", 2], ["FU", 4, [0, 1, 2, 3]], ["SP", 4, 0, 200704, [64], 1], ["AN", 4, 0, 5], ["AN", 4, 1, 6]]]], "r": [[4.90642e-06, 4.90639e-06, 4.90654e-06], 0, 1.7833, 1667968693], "v": "v0.6"}
{"i": [["[\"batch_norm\", 1, 14, 14, 1024]", "cuda -keys=cuda,gpu -max_num_threads=1024 -model=unknown -thread_warp_size=32", [-1, 16, 64, 49152, 2147483647, 1024, 8, 32], "", 0, []], [[], [["CI", 2], ["FU", 4, [0, 1, 2, 3]], ["SP", 4, 0, 200704, [1], 1], ["AN", 4, 0, 5], ["AN", 4, 1, 6]]]], "r": [[0.000151613, 0.000151602, 0.000151665], 0, 0.816882, 1667968692], "v": "v0.6"}
{"i": [["[\"batch_norm\", 1, 14, 14, 1024]", "cuda -keys=cuda,gpu -max_num_threads=1024 -model=unknown -thread_warp_size=32", [-1, 16, 64, 49152, 2147483647, 1024, 8, 32], "", 0, []], [[], [["CI", 2], ["FU", 4, [0, 1, 2, 3]], ["SP", 4, 0, 200704, [16], 1], ["AN", 4, 0, 5], ["AN", 4, 1, 6]]]], "r": [[1.20435e-05, 1.20442e-05, 1.20436e-05], 0, 3.06215, 1667968695], "v": "v0.6"}
{"i": [["[\"batch_norm\", 1, 14, 14, 1024]", "cuda -keys=cuda,gpu -max_num_threads=1024 -model=unknown -thread_warp_size=32", [-1, 16, 64, 49152, 2147483647, 1024, 8, 32], "", 0, []], [[], [["CI", 2], ["FU", 4, [0, 1, 2, 3]], ["SP", 4, 0, 200704, [14], 1], ["AN", 4, 0, 5], ["AN", 4, 1, 6]]]], "r": [[1.33443e-05, 1.33404e-05, 1.33444e-05], 0, 1.46775, 1667968693], "v": "v0.6"}
{"i": [["[\"batch_norm\", 1, 14, 14, 1024]", "cuda -keys=cuda,gpu -max_num_threads=1024 -model=unknown -thread_warp_size=32", [-1, 16, 64, 49152, 2147483647, 1024, 8, 32], "", 0, []], [[], [["CI", 2], ["FU", 4, [0, 1, 2, 3]], ["SP", 4, 0, 200704, [32], 1], ["AN", 4, 0, 5], ["AN", 4, 1, 6]]]], "r": [[7.26584e-06, 7.26454e-06, 7.26243e-06], 0, 2.41938, 1667968694], "v": "v0.6"}
{"i": [["[\"batch_norm\", 1, 14, 14, 1024]", "cuda -keys=cuda,gpu -max_num_threads=1024 -model=unknown -thread_warp_size=32", [-1, 16, 64, 49152, 2147483647, 1024, 8, 32], "", 0, []], [[], [["CI", 2], ["FU", 4, [0, 1, 2, 3]], ["SP", 4, 0, 200704, [28], 1], ["AN", 4, 0, 5], ["AN", 4, 1, 6]]]], "r": [[7.96504e-06, 7.96156e-06, 7.96067e-06], 0, 2.73667, 1667968694], "v": "v0.6"}
{"i": [["[\"batch_norm\", 1, 14, 14, 1024]", "cuda -keys=cuda,gpu -max_num_threads=1024 -model=unknown -thread_warp_size=32", [-1, 16, 64, 49152, 2147483647, 1024, 8, 32], "", 0, []], [[], [["CI", 2], ["FU", 4, [0, 1, 2, 3]], ["SP", 4, 0, 200704, [7], 1], ["AN", 4, 0, 5], ["AN", 4, 1, 6]]]], "r": [[2.40621e-05, 2.40685e-05, 2.40663e-05], 0, 3.98485, 1667968696], "v": "v0.6"}
{"i": [["[\"batch_norm\", 1, 14, 14, 1024]", "cuda -keys=cuda,gpu -max_num_threads=1024 -model=unknown -thread_warp_size=32", [-1, 16, 64, 49152, 2147483647, 1024, 8, 32], "", 0, []], [[], [["CI", 2], ["FU", 4, [0, 1, 2, 3]], ["SP", 4, 0, 200704, [8], 1], ["AN", 4, 0, 5], ["AN", 4, 1, 6]]]], "r": [[2.1407e-05, 2.14165e-05, 2.14031e-05], 0, 3.66349, 1667968695], "v": "v0.6"}
{"i": [["[\"batch_norm\", 1, 14, 14, 1024]", "cuda -keys=cuda,gpu -max_num_threads=1024 -model=unknown -thread_warp_size=32", [-1, 16, 64, 49152, 2147483647, 1024, 8, 32], "", 0, []], [[], [["CI", 2], ["FU", 4, [0, 1, 2, 3]], ["SP", 4, 0, 200704, [4], 1], ["AN", 4, 0, 5], ["AN", 4, 1, 6]]]], "r": [[3.9957e-05, 3.99701e-05, 3.99597e-05], 0, 3.35613, 1667968695], "v": "v0.6"}
{"i": [["[\"batch_norm\", 1, 14, 14, 1024]", "cuda -keys=cuda,gpu -max_num_threads=1024 -model=unknown -thread_warp_size=32", [-1, 16, 64, 49152, 2147483647, 1024, 8, 32], "", 0, []], [[], [["CI", 2], ["FU", 4, [0, 1, 2, 3]], ["SP", 4, 0, 200704, [16], 1], ["AN", 4, 0, 5], ["AN", 4, 1, 6]]]], "r": [[1.20357e-05, 1.20296e-05, 1.20316e-05], 0, 1.4569, 1667968800], "v": "v0.6"}
{"i": [["[\"batch_norm\", 1, 14, 14, 1024]", "cuda -keys=cuda,gpu -max_num_threads=1024 -model=unknown -thread_warp_size=32", [-1, 16, 64, 49152, 2147483647, 1024, 8, 32], "", 0, []], [[], [["CI", 2], ["FU", 4, [0, 1, 2, 3]], ["SP", 4, 0, 200704, [28], 1], ["AN", 4, 0, 5], ["AN", 4, 1, 6]]]], "r": [[8.19767e-06, 8.19671e-06, 8.19874e-06], 0, 1.11582, 1667968800], "v": "v0.6"}
{"i": [["[\"batch_norm\", 1, 14, 14, 1024]", "cuda -keys=cuda,gpu -max_num_threads=1024 -model=unknown -thread_warp_size=32", [-1, 16, 64, 49152, 2147483647, 1024, 8, 32], "", 0, []], [[], [["CI", 2], ["FU", 4, [0, 1, 2, 3]], ["SP", 4, 0, 200704, [64], 1], ["AN", 4, 0, 5], ["AN", 4, 1, 6]]]], "r": [[5.0951e-06, 5.08989e-06, 5.08963e-06], 0, 2.0872, 1667968801], "v": "v0.6"}
{"i": [["[\"batch_norm\", 1, 14, 14, 1024]", "cuda -keys=cuda,gpu -max_num_threads=1024 -model=unknown -thread_warp_size=32", [-1, 16, 64, 49152, 2147483647, 1024, 8, 32], "", 0, []], [[], [["CI", 2], ["FU", 4, [0, 1, 2, 3]], ["SP", 4, 0, 200704, [49], 1], ["AN", 4, 0, 5], ["AN", 4, 1, 6]]]], "r": [[5.59571e-06, 5.59532e-06, 5.59895e-06], 0, 0.525281, 1667968799], "v": "v0.6"}
{"i": [["[\"batch_norm\", 1, 14, 14, 1024]", "cuda -keys=cuda,gpu -max_num_threads=1024 -model=unknown -thread_warp_size=32", [-1, 16, 64, 49152, 2147483647, 1024, 8, 32], "", 0, []], [[], [["CI", 2], ["FU", 4, [0, 1, 2, 3]], ["SP", 4, 0, 200704, [7], 1], ["AN", 4, 0, 5], ["AN", 4, 1, 6]]]], "r": [[2.40163e-05, 2.40246e-05, 2.40186e-05], 0, 0.822104, 1667968799], "v": "v0.6"}
{"i": [["[\"batch_norm\", 1, 14, 14, 1024]", "cuda -keys=cuda,gpu -max_num_threads=1024 -model=unknown -thread_warp_size=32", [-1, 16, 64, 49152, 2147483647, 1024, 8, 32], "", 0, []], [[], [["CI", 2], ["FU", 4, [0, 1, 2, 3]], ["SP", 4, 0, 200704, [4], 1], ["AN", 4, 0, 5], ["AN", 4, 1, 6]]]], "r": [[3.98798e-05, 3.98876e-05, 3.98762e-05], 0, 1.77868, 1667968800], "v": "v0.6"}
{"i": [["[\"batch_norm\", 1, 14, 14, 1024]", "cuda -keys=cuda,gpu -max_num_threads=1024 -model=unknown -thread_warp_size=32", [-1, 16, 64, 49152, 2147483647, 1024, 8, 32], "", 0, []], [[], [["CI", 2], ["FU", 4, [0, 1, 2, 3]], ["SP", 4, 0, 200704, [1], 1], ["AN", 4, 0, 5], ["AN", 4, 1, 6]]]], "r": [[0.000151654, 0.00015161, 0.000151657], 0, 2.72615, 1667968801], "v": "v0.6"}
{"i": [["[\"batch_norm\", 1, 14, 14, 1024]", "cuda -keys=cuda,gpu -max_num_threads=1024 -model=unknown -thread_warp_size=32", [-1, 16, 64, 49152, 2147483647, 1024, 8, 32], "", 0, []], [[], [["CI", 2], ["FU", 4, [0, 1, 2, 3]], ["SP", 4, 0, 200704, [8], 1], ["AN", 4, 0, 5], ["AN", 4, 1, 6]]]], "r": [[2.13788e-05, 2.13777e-05, 2.138e-05], 0, 2.41858, 1667968801], "v": "v0.6"}
{"i": [["[\"batch_norm\", 1, 14, 14, 1024]", "cuda -keys=cuda,gpu -max_num_threads=1024 -model=unknown -thread_warp_size=32", [-1, 16, 64, 49152, 2147483647, 1024, 8, 32], "", 0, []], [[], [["CI", 2], ["FU", 4, [0, 1, 2, 3]], ["SP", 4, 0, 200704, [56], 1], ["AN", 4, 0, 5], ["AN", 4, 1, 6]]]], "r": [[5.29427e-06, 5.29284e-06, 5.29426e-06], 0, 3.03283, 1667968802], "v": "v0.6"}
{"i": [["[\"batch_norm\", 1, 14, 14, 1024]", "cuda -keys=cuda,gpu -max_num_threads=1024 -model=unknown -thread_warp_size=32", [-1, 16, 64, 49152, 2147483647, 1024, 8, 32], "", 0, []], [[], [["CI", 2], ["FU", 4, [0, 1, 2, 3]], ["SP", 4, 0, 200704, [2], 1], ["AN", 4, 0, 5], ["AN", 4, 1, 6]]]], "r": [[7.70674e-05, 7.70572e-05, 7.70563e-05], 0, 3.38691, 1667968802], "v": "v0.6"}
{"i": [["[\"batch_norm\", 1, 14, 14, 1024]", "cuda -keys=cuda,gpu -max_num_threads=1024 -model=unknown -thread_warp_size=32", [-1, 16, 64, 49152, 2147483647, 1024, 8, 32], "", 0, []], [[], [["CI", 2], ["FU", 4, [0, 1, 2, 3]], ["SP", 4, 0, 200704, [32], 1], ["AN", 4, 0, 5], ["AN", 4, 1, 6]]]], "r": [[7.29028e-06, 7.2874e-06, 7.28893e-06], 0, 3.66883, 1667968802], "v": "v0.6"}
{"i": [["[\"batch_norm\", 1, 14, 14, 1024]", "cuda -keys=cuda,gpu -max_num_threads=1024 -model=unknown -thread_warp_size=32", [-1, 16, 64, 49152, 2147483647, 1024, 8, 32], "", 0, []], [[], [["CI", 2], ["FU", 4, [0, 1, 2, 3]], ["SP", 4, 0, 200704, [14], 1], ["AN", 4, 0, 5], ["AN", 4, 1, 6]]]], "r": [[1.34251e-05, 1.34252e-05, 1.34242e-05], 0, 3.98807, 1667968803], "v": "v0.6"}
{"i": [["[\"batch_norm\", 1, 14, 14, 1024]", "cuda -keys=cuda,gpu -max_num_threads=1024 -model=unknown -thread_warp_size=32", [-1, 16, 64, 49152, 2147483647, 1024, 8, 32], "", 0, []], [[], [["CI", 2], ["FU", 4, [0, 1, 2, 3]], ["SP", 4, 0, 200704, [16], 1], ["AN", 4, 0, 5], ["AN", 4, 1, 6]]]], "r": [[1.2076e-05, 1.208e-05, 1.20802e-05], 0, 1.75851, 1667968908], "v": "v0.6"}
{"i": [["[\"batch_norm\", 1, 14, 14, 1024]", "cuda -keys=cuda,gpu -max_num_threads=1024 -model=unknown -thread_warp_size=32", [-1, 16, 64, 49152, 2147483647, 1024, 8, 32], "", 0, []], [[], [["CI", 2], ["FU", 4, [0, 1, 2, 3]], ["SP", 4, 0, 200704, [28], 1], ["AN", 4, 0, 5], ["AN", 4, 1, 6]]]], "r": [[8.02806e-06, 8.02727e-06, 8.02033e-06], 0, 0.537997, 1667968906], "v": "v0.6"}
{"i": [["[\"batch_norm\", 1, 14, 14, 1024]", "cuda -keys=cuda,gpu -max_num_threads=1024 -model=unknown -thread_warp_size=32", [-1, 16, 64, 49152, 2147483647, 1024, 8, 32], "", 0, []], [[], [["CI", 2], ["FU", 4, [0, 1, 2, 3]], ["SP", 4, 0, 200704, [14], 1], ["AN", 4, 0, 5], ["AN", 4, 1, 6]]]], "r": [[1.33783e-05, 1.33824e-05, 1.33831e-05], 0, 2.07467, 1667968908], "v": "v0.6"}
{"i": [["[\"batch_norm\", 1, 14, 14, 1024]", "cuda -keys=cuda,gpu -max_num_threads=1024 -model=unknown -thread_warp_size=32", [-1, 16, 64, 49152, 2147483647, 1024, 8, 32], "", 0, []], [[], [["CI", 2], ["FU", 4, [0, 1, 2, 3]], ["SP", 4, 0, 200704, [32], 1], ["AN", 4, 0, 5], ["AN", 4, 1, 6]]]], "r": [[7.45621e-06, 7.46244e-06, 7.46092e-06], 0, 1.13646, 1667968907], "v": "v0.6"}
{"i": [["[\"batch_norm\", 1, 14, 14, 1024]", "cuda -keys=cuda,gpu -max_num_threads=1024 -model=unknown -thread_warp_size=32", [-1, 16, 64, 49152, 2147483647, 1024, 8, 32], "", 0, []], [[], [["CI", 2], ["FU", 4, [0, 1, 2, 3]], ["SP", 4, 0, 200704, [4], 1], ["AN", 4, 0, 5], ["AN", 4, 1, 6]]]], "r": [[3.98737e-05, 3.98639e-05, 3.98662e-05], 0, 1.45687, 1667968907], "v": "v0.6"}
{"i": [["[\"batch_norm\", 1, 14, 14, 1024]", "cuda -keys=cuda,gpu -max_num_threads=1024 -model=unknown -thread_warp_size=32", [-1, 16, 64, 49152, 2147483647, 1024, 8, 32], "", 0, []], [[], [["CI", 2], ["FU", 4, [0, 1, 2, 3]], ["SP", 4, 0, 200704, [7], 1], ["AN", 4, 0, 5], ["AN", 4, 1, 6]]]], "r": [[2.39805e-05, 2.39711e-05, 2.39725e-05], 0, 0.821826, 1667968907], "v": "v0.6"}
{"i": [["[\"batch_norm\", 1, 14, 14, 1024]", "cuda -keys=cuda,gpu -max_num_threads=1024 -model=unknown -thread_warp_size=32", [-1, 16, 64, 49152, 2147483647, 1024, 8, 32], "", 0, []], [[], [["CI", 2], ["FU", 4, [0, 1, 2, 3]], ["SP", 4, 0, 200704, [2], 1], ["AN", 4, 0, 5], ["AN", 4, 1, 6]]]], "r": [[7.7076e-05, 7.70651e-05, 7.70436e-05], 0, 2.44728, 1667968908], "v": "v0.6"}
{"i": [["[\"batch_norm\", 1, 14, 14, 1024]", "cuda -keys=cuda,gpu -max_num_threads=1024 -model=unknown -thread_warp_size=32", [-1, 16, 64, 49152, 2147483647, 1024, 8, 32], "", 0, []], [[], [["CI", 2], ["FU", 4, [0, 1, 2, 3]], ["SP", 4, 0, 200704, [1], 1], ["AN", 4, 0, 5], ["AN", 4, 1, 6]]]], "r": [[0.000151654, 0.000151675, 0.000151637], 0, 3.05222, 1667968909], "v": "v0.6"}
{"i": [["[\"batch_norm\", 1, 14, 14, 1024]", "cuda -keys=cuda,gpu -max_num_threads=1024 -model=unknown -thread_warp_size=32", [-1, 16, 64, 49152, 2147483647, 1024, 8, 32], "", 0, []], [[], [["CI", 2], ["FU", 4, [0, 1, 2, 3]], ["SP", 4, 0, 200704, [8], 1], ["AN", 4, 0, 5], ["AN", 4, 1, 6]]]], "r": [[2.13122e-05, 2.13151e-05, 2.13112e-05], 0, 2.76173, 1667968909], "v": "v0.6"}
{"i": [["[\"batch_norm\", 1, 14, 14, 1024]", "cuda -keys=cuda,gpu -max_num_threads=1024 -model=unknown -thread_warp_size=32", [-1, 16, 64, 49152, 2147483647, 1024, 8, 32], "", 0, []], [[], [["CI", 2], ["FU", 4, [0, 1, 2, 3]], ["SP", 4, 0, 200704, [64], 1], ["AN", 4, 0, 5], ["AN", 4, 1, 6]]]], "r": [[4.91982e-06, 4.92434e-06, 4.92429e-06], 0, 3.71559, 1667968910], "v": "v0.6"}
{"i": [["[\"batch_norm\", 1, 14, 14, 1024]", "cuda -keys=cuda,gpu -max_num_threads=1024 -model=unknown -thread_warp_size=32", [-1, 16, 64, 49152, 2147483647, 1024, 8, 32], "", 0, []], [[], [["CI", 2], ["FU", 4, [0, 1, 2, 3]], ["SP", 4, 0, 200704, [49], 1], ["AN", 4, 0, 5], ["AN", 4, 1, 6]]]], "r": [[5.62317e-06, 5.6236e-06, 5.62879e-06], 0, 4.00207, 1667968910], "v": "v0.6"}
{"i": [["[\"batch_norm\", 1, 14, 14, 1024]", "cuda -keys=cuda,gpu -max_num_threads=1024 -model=unknown -thread_warp_size=32", [-1, 16, 64, 49152, 2147483647, 1024, 8, 32], "", 0, []], [[], [["CI", 2], ["FU", 4, [0, 1, 2, 3]], ["SP", 4, 0, 200704, [56], 1], ["AN", 4, 0, 5], ["AN", 4, 1, 6]]]], "r": [[5.2027e-06, 5.20054e-06, 5.20262e-06], 0, 3.41069, 1667968909], "v": "v0.6"}
{"i": [["[\"batch_norm\", 1, 14, 14, 1024]", "cuda -keys=cuda,gpu -max_num_threads=1024 -model=unknown -thread_warp_size=32", [-1, 16, 64, 49152, 2147483647, 1024, 8, 32], "", 0, []], [[], [["CI", 2], ["FU", 4, [0, 1, 2, 3]], ["SP", 4, 0, 200704, [8], 1], ["AN", 4, 0, 5], ["AN", 4, 1, 6]]]], "r": [[2.14816e-05, 2.14951e-05, 2.14914e-05], 0, 2.43119, 1667969017], "v": "v0.6"}
{"i": [["[\"batch_norm\", 1, 14, 14, 1024]", "cuda -keys=cuda,gpu -max_num_threads=1024 -model=unknown -thread_warp_size=32", [-1, 16, 64, 49152, 2147483647, 1024, 8, 32], "", 0, []], [[], [["CI", 2], ["FU", 4, [0, 1, 2, 3]], ["SP", 4, 0, 200704, [4], 1], ["AN", 4, 0, 5], ["AN", 4, 1, 6]]]], "r": [[3.99655e-05, 3.99807e-05, 3.99695e-05], 0, 1.46211, 1667969016], "v": "v0.6"}
{"i": [["[\"batch_norm\", 1, 14, 14, 1024]", "cuda -keys=cuda,gpu -max_num_threads=1024 -model=unknown -thread_warp_size=32", [-1, 16, 64, 49152, 2147483647, 1024, 8, 32], "", 0, []], [[], [["CI", 2], ["FU", 4, [0, 1, 2, 3]], ["SP", 4, 0, 200704, [32], 1], ["AN", 4, 0, 5], ["AN", 4, 1, 6]]]], "r": [[7.33139e-06, 7.33237e-06, 7.32547e-06], 0, 0.814753, 1667969015], "v": "v0.6"}
{"i": [["[\"batch_norm\", 1, 14, 14, 1024]", "cuda -keys=cuda,gpu -max_num_threads=1024 -model=unknown -thread_warp_size=32", [-1, 16, 64, 49152, 2147483647, 1024, 8, 32], "", 0, []], [[], [["CI", 2], ["FU", 4, [0, 1, 2, 3]], ["SP", 4, 0, 200704, [28], 1], ["AN", 4, 0, 5], ["AN", 4, 1, 6]]]], "r": [[7.90971e-06, 7.91674e-06, 7.90923e-06], 0, 0.53232, 1667969015], "v": "v0.6"}
{"i": [["[\"batch_norm\", 1, 14, 14, 1024]", "cuda -keys=cuda,gpu -max_num_threads=1024 -model=unknown -thread_warp_size=32", [-1, 16, 64, 49152, 2147483647, 1024, 8, 32], "", 0, []], [[], [["CI", 2], ["FU", 4, [0, 1, 2, 3]], ["SP", 4, 0, 200704, [1], 1], ["AN", 4, 0, 5], ["AN", 4, 1, 6]]]], "r": [[0.000151617, 0.000151589, 0.000151598], 0, 1.09856, 1667969015], "v": "v0.6"}
{"i": [["[\"batch_norm\", 1, 14, 14, 1024]", "cuda -keys=cuda,gpu -max_num_threads=1024 -model=unknown -thread_warp_size=32", [-1, 16, 64, 49152, 2147483647, 1024, 8, 32], "", 0, []], [[], [["CI", 2], ["FU", 4, [0, 1, 2, 3]], ["SP", 4, 0, 200704, [16], 1], ["AN", 4, 0, 5], ["AN", 4, 1, 6]]]], "r": [[1.2051e-05, 1.20562e-05, 1.20548e-05], 0, 2.0746, 1667969016], "v": "v0.6"}
{"i": [["[\"batch_norm\", 1, 14, 14, 1024]", "cuda -keys=cuda,gpu -max_num_threads=1024 -model=unknown -thread_warp_size=32", [-1, 16, 64, 49152, 2147483647, 1024, 8, 32], "", 0, []], [[], [["CI", 2], ["FU", 4, [0, 1, 2, 3]], ["SP", 4, 0, 200704, [7], 1], ["AN", 4, 0, 5], ["AN", 4, 1, 6]]]], "r": [[2.40213e-05, 2.40311e-05, 2.40138e-05], 0, 1.75675, 1667969016], "v": "v0.6"}
{"i": [["[\"batch_norm\", 1, 14, 14, 1024]", "cuda -keys=cuda,gpu -max_num_threads=1024 -model=unknown -thread_warp_size=32", [-1, 16, 64, 49152, 2147483647, 1024, 8, 32], "", 0, []], [[], [["CI", 2], ["FU", 4, [0, 1, 2, 3]], ["SP", 4, 0, 200704, [2], 1], ["AN", 4, 0, 5], ["AN", 4, 1, 6]]]], "r": [[7.71996e-05, 7.71613e-05, 7.71882e-05], 0, 4.01304, 1667969018], "v": "v0.6"}
{"i": [["[\"batch_norm\", 1, 14, 14, 1024]", "cuda -keys=cuda,gpu -max_num_threads=1024 -model=unknown -thread_warp_size=32", [-1, 16, 64, 49152, 2147483647, 1024, 8, 32], "", 0, []], [[], [["CI", 2], ["FU", 4, [0, 1, 2, 3]], ["SP", 4, 0, 200704, [49], 1], ["AN", 4, 0, 5], ["AN", 4, 1, 6]]]], "r": [[5.60904e-06, 5.61045e-06, 5.60831e-06], 0, 3.01294, 1667969017], "v": "v0.6"}
{"i": [["[\"batch_norm\", 1, 14, 14, 1024]", "cuda -keys=cuda,gpu -max_num_threads=1024 -model=unknown -thread_warp_size=32", [-1, 16, 64, 49152, 2147483647, 1024, 8, 32], "", 0, []], [[], [["CI", 2], ["FU", 4, [0, 1, 2, 3]], ["SP", 4, 0, 200704, [14], 1], ["AN", 4, 0, 5], ["AN", 4, 1, 6]]]], "r": [[1.34792e-05, 1.34723e-05, 1.34769e-05], 0, 3.37641, 1667969018], "v": "v0.6"}
{"i": [["[\"batch_norm\", 1, 14, 14, 1024]", "cuda -keys=cuda,gpu -max_num_threads=1024 -model=unknown -thread_warp_size=32", [-1, 16, 64, 49152, 2147483647, 1024, 8, 32], "", 0, []], [[], [["CI", 2], ["FU", 4, [0, 1, 2, 3]], ["SP", 4, 0, 200704, [64], 1], ["AN", 4, 0, 5], ["AN", 4, 1, 6]]]], "r": [[4.92924e-06, 4.92754e-06, 4.93444e-06], 0, 2.72543, 1667969017], "v": "v0.6"}
{"i": [["[\"batch_norm\", 1, 14, 14, 1024]", "cuda -keys=cuda,gpu -max_num_threads=1024 -model=unknown -thread_warp_size=32", [-1, 16, 64, 49152, 2147483647, 1024, 8, 32], "", 0, []], [[], [["CI", 2], ["FU", 4, [0, 1, 2, 3]], ["SP", 4, 0, 200704, [56], 1], ["AN", 4, 0, 5], ["AN", 4, 1, 6]]]], "r": [[5.3234e-06, 5.32302e-06, 5.33054e-06], 0, 3.69051, 1667969018], "v": "v0.6"}
{"i": [["[\"batch_norm\", 1, 14, 14, 1024]", "cuda -keys=cuda,gpu -max_num_threads=1024 -model=unknown -thread_warp_size=32", [-1, 16, 64, 49152, 2147483647, 1024, 8, 32], "", 0, []], [[], [["CI", 2], ["FU", 4, [0, 1, 2, 3]], ["SP", 4, 0, 200704, [14], 1], ["AN", 4, 0, 5], ["AN", 4, 1, 6]]]], "r": [[1.33786e-05, 1.33745e-05, 1.33781e-05], 0, 0.802322, 1667969123], "v": "v0.6"}
{"i": [["[\"batch_norm\", 1, 14, 14, 1024]", "cuda -keys=cuda,gpu -max_num_threads=1024 -model=unknown -thread_warp_size=32", [-1, 16, 64, 49152, 2147483647, 1024, 8, 32], "", 0, []], [[], [["CI", 2], ["FU", 4, [0, 1, 2, 3]], ["SP", 4, 0, 200704, [4], 1], ["AN", 4, 0, 5], ["AN", 4, 1, 6]]]], "r": [[3.99016e-05, 3.99014e-05, 3.98952e-05], 0, 0.539338, 1667969122], "v": "v0.6"}
{"i": [["[\"batch_norm\", 1, 14, 14, 1024]", "cuda -keys=cuda,gpu -max_num_threads=1024 -model=unknown -thread_warp_size=32", [-1, 16, 64, 49152, 2147483647, 1024, 8, 32], "", 0, []], [[], [["CI", 2], ["FU", 4, [0, 1, 2, 3]], ["SP", 4, 0, 200704, [16], 1], ["AN", 4, 0, 5], ["AN", 4, 1, 6]]]], "r": [[1.21474e-05, 1.21396e-05, 1.21435e-05], 0, 1.77878, 1667969124], "v": "v0.6"}
{"i": [["[\"batch_norm\", 1, 14, 14, 1024]", "cuda -keys=cuda,gpu -max_num_threads=1024 -model=unknown -thread_warp_size=32", [-1, 16, 64, 49152, 2147483647, 1024, 8, 32], "", 0, []], [[], [["CI", 2], ["FU", 4, [0, 1, 2, 3]], ["SP", 4, 0, 200704, [28], 1], ["AN", 4, 0, 5], ["AN", 4, 1, 6]]]], "r": [[7.99279e-06, 7.99144e-06, 7.99251e-06], 0, 1.48003, 1667969123], "v": "v0.6"}
{"i": [["[\"batch_norm\", 1, 14, 14, 1024]", "cuda -keys=cuda,gpu -max_num_threads=1024 -model=unknown -thread_warp_size=32", [-1, 16, 64, 49152, 2147483647, 1024, 8, 32], "", 0, []], [[], [["CI", 2], ["FU", 4, [0, 1, 2, 3]], ["SP", 4, 0, 200704, [8], 1], ["AN", 4, 0, 5], ["AN", 4, 1, 6]]]], "r": [[2.12943e-05, 2.12809e-05, 2.12756e-05], 0, 1.11776, 1667969123], "v": "v0.6"}
{"i": [["[\"batch_norm\", 1, 14, 14, 1024]", "cuda -keys=cuda,gpu -max_num_threads=1024 -model=unknown -thread_warp_size=32", [-1, 16, 64, 49152, 2147483647, 1024, 8, 32], "", 0, []], [[], [["CI", 2], ["FU", 4, [0, 1, 2, 3]], ["SP", 4, 0, 200704, [7], 1], ["AN", 4, 0, 5], ["AN", 4, 1, 6]]]], "r": [[2.39771e-05, 2.39664e-05, 2.39739e-05], 0, 2.04505, 1667969124], "v": "v0.6"}
{"i": [["[\"batch_norm\", 1, 14, 14, 1024]", "cuda -keys=cuda,gpu -max_num_threads=1024 -model=unknown -thread_warp_size=32", [-1, 16, 64, 49152, 2147483647, 1024, 8, 32], "", 0, []], [[], [["CI", 2], ["FU", 4, [0, 1, 2, 3]], ["SP", 4, 0, 200704, [56], 1], ["AN", 4, 0, 5], ["AN", 4, 1, 6]]]], "r": [[5.41747e-06, 5.4113e-06, 5.41116e-06], 0, 2.70299, 1667969125], "v": "v0.6"}
{"i": [["[\"batch_norm\", 1, 14, 14, 1024]", "cuda -keys=cuda,gpu -max_num_threads=1024 -model=unknown -thread_warp_size=32", [-1, 16, 64, 49152, 2147483647, 1024, 8, 32], "", 0, []], [[], [["CI", 2], ["FU", 4, [0, 1, 2, 3]], ["SP", 4, 0, 200704, [2], 1], ["AN", 4, 0, 5], ["AN", 4, 1, 6]]]], "r": [[7.72283e-05, 7.72004e-05, 7.72253e-05], 0, 3.02581, 1667969125], "v": "v0.6"}
{"i": [["[\"batch_norm\", 1, 14, 14, 1024]", "cuda -keys=cuda,gpu -max_num_threads=1024 -model=unknown -thread_warp_size=32", [-1, 16, 64, 49152, 2147483647, 1024, 8, 32], "", 0, []], [[], [["CI", 2], ["FU", 4, [0, 1, 2, 3]], ["SP", 4, 0, 200704, [64], 1], ["AN", 4, 0, 5], ["AN", 4, 1, 6]]]], "r": [[4.88055e-06, 4.87854e-06, 4.88073e-06], 0, 2.3905, 1667969124], "v": "v0.6"}
{"i": [["[\"batch_norm\", 1, 14, 14, 1024]", "cuda -keys=cuda,gpu -max_num_threads=1024 -model=unknown -thread_warp_size=32", [-1, 16, 64, 49152, 2147483647, 1024, 8, 32], "", 0, []], [[], [["CI", 2], ["FU", 4, [0, 1, 2, 3]], ["SP", 4, 0, 200704, [32], 1], ["AN", 4, 0, 5], ["AN", 4, 1, 6]]]], "r": [[7.28972e-06, 7.28746e-06, 7.28822e-06], 0, 3.34693, 1667969125], "v": "v0.6"}
{"i": [["[\"batch_norm\", 1, 14, 14, 1024]", "cuda -keys=cuda,gpu -max_num_threads=1024 -model=unknown -thread_warp_size=32", [-1, 16, 64, 49152, 2147483647, 1024, 8, 32], "", 0, []], [[], [["CI", 2], ["FU", 4, [0, 1, 2, 3]], ["SP", 4, 0, 200704, [49], 1], ["AN", 4, 0, 5], ["AN", 4, 1, 6]]]], "r": [[5.85445e-06, 5.85546e-06, 5.86566e-06], 0, 3.66368, 1667969126], "v": "v0.6"}
{"i": [["[\"batch_norm\", 1, 14, 14, 1024]", "cuda -keys=cuda,gpu -max_num_threads=1024 -model=unknown -thread_warp_size=32", [-1, 16, 64, 49152, 2147483647, 1024, 8, 32], "", 0, []], [[], [["CI", 2], ["FU", 4, [0, 1, 2, 3]], ["SP", 4, 0, 200704, [1], 1], ["AN", 4, 0, 5], ["AN", 4, 1, 6]]]], "r": [[0.00015156, 0.000151543, 0.000151558], 0, 3.96293, 1667969126], "v": "v0.6"}
{"i": [["[\"batch_norm\", 1, 14, 14, 1024]", "cuda -keys=cuda,gpu -max_num_threads=1024 -model=unknown -thread_warp_size=32", [-1, 16, 64, 49152, 2147483647, 1024, 8, 32], "", 0, []], [[], [["CI", 2], ["FU", 4, [0, 1, 2, 3]], ["SP", 4, 0, 200704, [64], 1], ["AN", 4, 0, 5], ["AN", 4, 1, 6]]]], "r": [[4.87263e-06, 4.87202e-06, 4.87189e-06], 0, 1.71096, 1667969231], "v": "v0.6"}
{"i": [["[\"batch_norm\", 1, 14, 14, 1024]", "cuda -keys=cuda,gpu -max_num_threads=1024 -model=unknown -thread_warp_size=32", [-1, 16, 64, 49152, 2147483647, 1024, 8, 32], "", 0, []], [[], [["CI", 2], ["FU", 4, [0, 1, 2, 3]], ["SP", 4, 0, 200704, [28], 1], ["AN", 4, 0, 5], ["AN", 4, 1, 6]]]], "r": [[8.08859e-06, 8.07891e-06, 8.08969e-06], 0, 1.09488, 1667969231], "v": "v0.6"}
{"i": [["[\"batch_norm\", 1, 14, 14, 1024]", "cuda -keys=cuda,gpu -max_num_threads=1024 -model=unknown -thread_warp_size=32", [-1, 16, 64, 49152, 2147483647, 1024, 8, 32], "", 0, []], [[], [["CI", 2], ["FU", 4, [0, 1, 2, 3]], ["SP", 4, 0, 200704, [4], 1], ["AN", 4, 0, 5], ["AN", 4, 1, 6]]]], "r": [[3.98139e-05, 3.98072e-05, 3.98067e-05], 0, 1.40799, 1667969231], "v": "v0.6"}
{"i": [["[\"batch_norm\", 1, 14, 14, 1024]", "cuda -keys=cuda,gpu -max_num_threads=1024 -model=unknown -thread_warp_size=32", [-1, 16, 64, 49152, 2147483647, 1024, 8, 32], "", 0, []], [[], [["CI", 2], ["FU", 4, [0, 1, 2, 3]], ["SP", 4, 0, 200704, [2], 1], ["AN", 4, 0, 5], ["AN", 4, 1, 6]]]], "r": [[7.70617e-05, 7.70663e-05, 7.70814e-05], 0, 2.68718, 1667969232], "v": "v0.6"}
{"i": [["[\"batch_norm\", 1, 14, 14, 1024]", "cuda -keys=cuda,gpu -max_num_threads=1024 -model=unknown -thread_warp_size=32", [-1, 16, 64, 49152, 2147483647, 1024, 8, 32], "", 0, []], [[], [["CI", 2], ["FU", 4, [0, 1, 2, 3]], ["SP", 4, 0, 200704, [1], 1], ["AN", 4, 0, 5], ["AN", 4, 1, 6]]]], "r": [[0.000151571, 0.000151537, 0.000151557], 0, 0.521304, 1667969230], "v": "v0.6"}
{"i": [["[\"batch_norm\", 1, 14, 14, 1024]", "cuda -keys=cuda,gpu -max_num_threads=1024 -model=unknown -thread_warp_size=32", [-1, 16, 64, 49152, 2147483647, 1024, 8, 32], "", 0, []], [[], [["CI", 2], ["FU", 4, [0, 1, 2, 3]], ["SP", 4, 0, 200704, [7], 1], ["AN", 4, 0, 5], ["AN", 4, 1, 6]]]], "r": [[2.39428e-05, 2.39491e-05, 2.39423e-05], 0, 2.02103, 1667969232], "v": "v0.6"}
{"i": [["[\"batch_norm\", 1, 14, 14, 1024]", "cuda -keys=cuda,gpu -max_num_threads=1024 -model=unknown -thread_warp_size=32", [-1, 16, 64, 49152, 2147483647, 1024, 8, 32], "", 0, []], [[], [["CI", 2], ["FU", 4, [0, 1, 2, 3]], ["SP", 4, 0, 200704, [8], 1], ["AN", 4, 0, 5], ["AN", 4, 1, 6]]]], "r": [[2.14746e-05, 2.14576e-05, 2.1462e-05], 0, 0.75753, 1667969230], "v": "v0.6"}
{"i": [["[\"batch_norm\", 1, 14, 14, 1024]", "cuda -keys=cuda,gpu -max_num_threads=1024 -model=unknown -thread_warp_size=32", [-1, 16, 64, 49152, 2147483647, 1024, 8, 32], "", 0, []], [[], [["CI", 2], ["FU", 4, [0, 1, 2, 3]], ["SP", 4, 0, 200704, [49], 1], ["AN", 4, 0, 5], ["AN", 4, 1, 6]]]], "r": [[5.87317e-06, 5.87391e-06, 5.87228e-06], 0, 2.37615, 1667969232], "v": "v0.6"}
{"i": [["[\"batch_norm\", 1, 14, 14, 1024]", "cuda -keys=cuda,gpu -max_num_threads=1024 -model=unknown -thread_warp_size=32", [-1, 16, 64, 49152, 2147483647, 1024, 8, 32], "", 0, []], [[], [["CI", 2], ["FU", 4, [0, 1, 2, 3]], ["SP", 4, 0, 200704, [16], 1], ["AN", 4, 0, 5], ["AN", 4, 1, 6]]]], "r": [[1.20558e-05, 1.20476e-05, 1.20431e-05], 0, 3.34348, 1667969233], "v": "v0.6"}
{"i": [["[\"batch_norm\", 1, 14, 14, 1024]", "cuda -keys=cuda,gpu -max_num_threads=1024 -model=unknown -thread_warp_size=32", [-1, 16, 64, 49152, 2147483647, 1024, 8, 32], "", 0, []], [[], [["CI", 2], ["FU", 4, [0, 1, 2, 3]], ["SP", 4, 0, 200704, [32], 1], ["AN", 4, 0, 5], ["AN", 4, 1, 6]]]], "r": [[7.32826e-06, 7.32877e-06, 7.34042e-06], 0, 2.98287, 1667969233], "v": "v0.6"}
{"i": [["[\"batch_norm\", 1, 14, 14, 1024]", "cuda -keys=cuda,gpu -max_num_threads=1024 -model=unknown -thread_warp_size=32", [-1, 16, 64, 49152, 2147483647, 1024, 8, 32], "", 0, []], [[], [["CI", 2], ["FU", 4, [0, 1, 2, 3]], ["SP", 4, 0, 200704, [14], 1], ["AN", 4, 0, 5], ["AN", 4, 1, 6]]]], "r": [[1.3351e-05, 1.33546e-05, 1.33525e-05], 0, 3.95705, 1667969234], "v": "v0.6"}
{"i": [["[\"batch_norm\", 1, 14, 14, 1024]", "cuda -keys=cuda,gpu -max_num_threads=1024 -model=unknown -thread_warp_size=32", [-1, 16, 64, 49152, 2147483647, 1024, 8, 32], "", 0, []], [[], [["CI", 2], ["FU", 4, [0, 1, 2, 3]], ["SP", 4, 0, 200704, [56], 1], ["AN", 4, 0, 5], ["AN", 4, 1, 6]]]], "r": [[5.20367e-06, 5.19991e-06, 5.2019e-06], 0, 3.63295, 1667969233], "v": "v0.6"}
{"i": [["[\"batch_norm\", 1, 14, 14, 1024]", "cuda -keys=cuda,gpu -max_num_threads=1024 -model=unknown -thread_warp_size=32", [-1, 16, 64, 49152, 2147483647, 1024, 8, 32], "", 0, []], [[], [["CI", 2], ["FU", 4, [0, 1, 2, 3]], ["SP", 4, 0, 200704, [8], 1], ["AN", 4, 0, 5], ["AN", 4, 1, 6]]]], "r": [[2.15445e-05, 2.15439e-05, 2.15532e-05], 0, 1.1254, 1667969338], "v": "v0.6"}
{"i": [["[\"batch_norm\", 1, 14, 14, 1024]", "cuda -keys=cuda,gpu -max_num_threads=1024 -model=unknown -thread_warp_size=32", [-1, 16, 64, 49152, 2147483647, 1024, 8, 32], "", 0, []], [[], [["CI", 2], ["FU", 4, [0, 1, 2, 3]], ["SP", 4, 0, 200704, [4], 1], ["AN", 4, 0, 5], ["AN", 4, 1, 6]]]], "r": [[3.9837e-05, 3.98266e-05, 3.98239e-05], 0, 0.544744, 1667969338], "v": "v0.6"}
{"i": [["[\"batch_norm\", 1, 14, 14, 1024]", "cuda -keys=cuda,gpu -max_num_threads=1024 -model=unknown -thread_warp_size=32", [-1, 16, 64, 49152, 2147483647, 1024, 8, 32], "", 0, []], [[], [["CI", 2], ["FU", 4, [0, 1, 2, 3]], ["SP", 4, 0, 200704, [7], 1], ["AN", 4, 0, 5], ["AN", 4, 1, 6]]]], "r": [[2.39896e-05, 2.39824e-05, 2.39723e-05], 0, 1.75767, 1667969339], "v": "v0.6"}
{"i": [["[\"batch_norm\", 1, 14, 14, 1024]", "cuda -keys=cuda,gpu -max_num_threads=1024 -model=unknown -thread_warp_size=32", [-1, 16, 64, 49152, 2147483647, 1024, 8, 32], "", 0, []], [[], [["CI", 2], ["FU", 4, [0, 1, 2, 3]], ["SP", 4, 0, 200704, [28], 1], ["AN", 4, 0, 5], ["AN", 4, 1, 6]]]], "r": [[7.99602e-06, 7.99766e-06, 8.00446e-06], 0, 0.817736, 1667969338], "v": "v0.6"}
{"i": [["[\"batch_norm\", 1, 14, 14, 1024]", "cuda -keys=cuda,gpu -max_num_threads=1024 -model=unknown -thread_warp_size=32", [-1, 16, 64, 49152, 2147483647, 1024, 8, 32], "", 0, []], [[], [["CI", 2], ["FU", 4, [0, 1, 2, 3]], ["SP", 4, 0, 200704, [14], 1], ["AN", 4, 0, 5], ["AN", 4, 1, 6]]]], "r": [[1.33509e-05, 1.33505e-05, 1.33495e-05], 0, 2.08198, 1667969340], "v": "v0.6"}
{"i": [["[\"batch_norm\", 1, 14, 14, 1024]", "cuda -keys=cuda,gpu -max_num_threads=1024 -model=unknown -thread_warp_size=32", [-1, 16, 64, 49152, 2147483647, 1024, 8, 32], "", 0, []], [[], [["CI", 2], ["FU", 4, [0, 1, 2, 3]], ["SP", 4, 0, 200704, [56], 1], ["AN", 4, 0, 5], ["AN", 4, 1, 6]]]], "r": [[5.38177e-06, 5.38457e-06, 5.38472e-06], 0, 1.43865, 1667969339], "v": "v0.6"}
{"i": [["[\"batch_norm\", 1, 14, 14, 1024]", "cuda -keys=cuda,gpu -max_num_threads=1024 -model=unknown -thread_warp_size=32", [-1, 16, 64, 49152, 2147483647, 1024, 8, 32], "", 0, []], [[], [["CI", 2], ["FU", 4, [0, 1, 2, 3]], ["SP", 4, 0, 200704, [32], 1], ["AN", 4, 0, 5], ["AN", 4, 1, 6]]]], "r": [[7.29112e-06, 7.28878e-06, 7.28737e-06], 0, 2.45828, 1667969340], "v": "v0.6"}
{"i": [["[\"batch_norm\", 1, 14, 14, 1024]", "cuda -keys=cuda,gpu -max_num_threads=1024 -model=unknown -thread_warp_size=32", [-1, 16, 64, 49152, 2147483647, 1024, 8, 32], "", 0, []], [[], [["CI", 2], ["FU", 4, [0, 1, 2, 3]], ["SP", 4, 0, 200704, [49], 1], ["AN", 4, 0, 5], ["AN", 4, 1, 6]]]], "r": [[5.64099e-06, 5.64006e-06, 5.63927e-06], 0, 2.75944, 1667969340], "v": "v0.6"}
{"i": [["[\"batch_norm\", 1, 14, 14, 1024]", "cuda -keys=cuda,gpu -max_num_threads=1024 -model=unknown -thread_warp_size=32", [-1, 16, 64, 49152, 2147483647, 1024, 8, 32], "", 0, []], [[], [["CI", 2], ["FU", 4, [0, 1, 2, 3]], ["SP", 4, 0, 200704, [1], 1], ["AN", 4, 0, 5], ["AN", 4, 1, 6]]]], "r": [[0.00015152, 0.000151533, 0.000151455], 0, 3.05749, 1667969341], "v": "v0.6"}
{"i": [["[\"batch_norm\", 1, 14, 14, 1024]", "cuda -keys=cuda,gpu -max_num_threads=1024 -model=unknown -thread_warp_size=32", [-1, 16, 64, 49152, 2147483647, 1024, 8, 32], "", 0, []], [[], [["CI", 2], ["FU", 4, [0, 1, 2, 3]], ["SP", 4, 0, 200704, [64], 1], ["AN", 4, 0, 5], ["AN", 4, 1, 6]]]], "r": [[4.92455e-06, 4.92578e-06, 4.92519e-06], 0, 3.43414, 1667969341], "v": "v0.6"}
{"i": [["[\"batch_norm\", 1, 14, 14, 1024]", "cuda -keys=cuda,gpu -max_num_threads=1024 -model=unknown -thread_warp_size=32", [-1, 16, 64, 49152, 2147483647, 1024, 8, 32], "", 0, []], [[], [["CI", 2], ["FU", 4, [0, 1, 2, 3]], ["SP", 4, 0, 200704, [2], 1], ["AN", 4, 0, 5], ["AN", 4, 1, 6]]]], "r": [[7.71733e-05, 7.71747e-05, 7.71692e-05], 0, 3.76356, 1667969341], "v": "v0.6"}
{"i": [["[\"batch_norm\", 1, 14, 14, 1024]", "cuda -keys=cuda,gpu -max_num_threads=1024 -model=unknown -thread_warp_size=32", [-1, 16, 64, 49152, 2147483647, 1024, 8, 32], "", 0, []], [[], [["CI", 2], ["FU", 4, [0, 1, 2, 3]], ["SP", 4, 0, 200704, [16], 1], ["AN", 4, 0, 5], ["AN", 4, 1, 6]]]], "r": [[1.20464e-05, 1.2045e-05, 1.20498e-05], 0, 4.05699, 1667969342], "v": "v0.6"}
{"i": [["[\"batch_norm\", 1, 14, 14, 1024]", "cuda -keys=cuda,gpu -max_num_threads=1024 -model=unknown -thread_warp_size=32", [-1, 16, 64, 49152, 2147483647, 1024, 8, 32], "", 0, []], [[], [["CI", 2], ["FU", 4, [0, 1, 2, 3]], ["SP", 4, 0, 200704, [1], 1], ["AN", 4, 0, 5], ["AN", 4, 1, 6]]]], "r": [[0.000151797, 0.000151528, 0.000151577], 0, 0.52641, 1667969446], "v": "v0.6"}
{"i": [["[\"batch_norm\", 1, 14, 14, 1024]", "cuda -keys=cuda,gpu -max_num_threads=1024 -model=unknown -thread_warp_size=32", [-1, 16, 64, 49152, 2147483647, 1024, 8, 32], "", 0, []], [[], [["CI", 2], ["FU", 4, [0, 1, 2, 3]], ["SP", 4, 0, 200704, [49], 1], ["AN", 4, 0, 5], ["AN", 4, 1, 6]]]], "r": [[5.7438e-06, 5.7349e-06, 5.75548e-06], 0, 0.819766, 1667969446], "v": "v0.6"}
{"i": [["[\"batch_norm\", 1, 14, 14, 1024]", "cuda -keys=cuda,gpu -max_num_threads=1024 -model=unknown -thread_warp_size=32", [-1, 16, 64, 49152, 2147483647, 1024, 8, 32], "", 0, []], [[], [["CI", 2], ["FU", 4, [0, 1, 2, 3]], ["SP", 4, 0, 200704, [56], 1], ["AN", 4, 0, 5], ["AN", 4, 1, 6]]]], "r": [[5.47736e-06, 5.479e-06, 5.47756e-06], 0, 2.44737, 1667969448], "v": "v0.6"}
{"i": [["[\"batch_norm\", 1, 14, 14, 1024]", "cuda -keys=cuda,gpu -max_num_threads=1024 -model=unknown -thread_warp_size=32", [-1, 16, 64, 49152, 2147483647, 1024, 8, 32], "", 0, []], [[], [["CI", 2], ["FU", 4, [0, 1, 2, 3]], ["SP", 4, 0, 200704, [28], 1], ["AN", 4, 0, 5], ["AN", 4, 1, 6]]]], "r": [[7.92288e-06, 7.91884e-06, 7.92296e-06], 0, 1.12071, 1667969446], "v": "v0.6"}
{"i": [["[\"batch_norm\", 1, 14, 14, 1024]", "cuda -keys=cuda,gpu -max_num_threads=1024 -model=unknown -thread_warp_size=32", [-1, 16, 64, 49152, 2147483647, 1024, 8, 32], "", 0, []], [[], [["CI", 2], ["FU", 4, [0, 1, 2, 3]], ["SP", 4, 0, 200704, [4], 1], ["AN", 4, 0, 5], ["AN", 4, 1, 6]]]], "r": [[3.99002e-05, 3.98737e-05, 3.98738e-05], 0, 1.79152, 1667969447], "v": "v0.6"}
{"i": [["[\"batch_norm\", 1, 14, 14, 1024]", "cuda -keys=cuda,gpu -max_num_threads=1024 -model=unknown -thread_warp_size=32", [-1, 16, 64, 49152, 2147483647, 1024, 8, 32], "", 0, []], [[], [["CI", 2], ["FU", 4, [0, 1, 2, 3]], ["SP", 4, 0, 200704, [32], 1], ["AN", 4, 0, 5], ["AN", 4, 1, 6]]]], "r": [[7.22262e-06, 7.21876e-06, 7.22516e-06], 0, 2.08618, 1667969447], "v": "v0.6"}
{"i": [["[\"batch_norm\", 1, 14, 14, 1024]", "cuda -keys=cuda,gpu -max_num_threads=1024 -model=unknown -thread_warp_size=32", [-1, 16, 64, 49152, 2147483647, 1024, 8, 32], "", 0, []], [[], [["CI", 2], ["FU", 4, [0, 1, 2, 3]], ["SP", 4, 0, 200704, [8], 1], ["AN", 4, 0, 5], ["AN", 4, 1, 6]]]], "r": [[2.13331e-05, 2.13288e-05, 2.13325e-05], 0, 1.46816, 1667969447], "v": "v0.6"}
{"i": [["[\"batch_norm\", 1, 14, 14, 1024]", "cuda -keys=cuda,gpu -max_num_threads=1024 -model=unknown -thread_warp_size=32", [-1, 16, 64, 49152, 2147483647, 1024, 8, 32], "", 0, []], [[], [["CI", 2], ["FU", 4, [0, 1, 2, 3]], ["SP", 4, 0, 200704, [14], 1], ["AN", 4, 0, 5], ["AN", 4, 1, 6]]]], "r": [[1.33416e-05, 1.33414e-05, 1.33377e-05], 0, 2.7662, 1667969448], "v": "v0.6"}
{"i": [["[\"batch_norm\", 1, 14, 14, 1024]", "cuda -keys=cuda,gpu -max_num_threads=1024 -model=unknown -thread_warp_size=32", [-1, 16, 64, 49152, 2147483647, 1024, 8, 32], "", 0, []], [[], [["CI", 2], ["FU", 4, [0, 1, 2, 3]], ["SP", 4, 0, 200704, [2], 1], ["AN", 4, 0, 5], ["AN", 4, 1, 6]]]], "r": [[7.71039e-05, 7.71064e-05, 7.71028e-05], 0, 3.73992, 1667969449], "v": "v0.6"}
{"i": [["[\"batch_norm\", 1, 14, 14, 1024]", "cuda -keys=cuda,gpu -max_num_threads=1024 -model=unknown -thread_warp_size=32", [-1, 16, 64, 49152, 2147483647, 1024, 8, 32], "", 0, []], [[], [["CI", 2], ["FU", 4, [0, 1, 2, 3]], ["SP", 4, 0, 200704, [64], 1], ["AN", 4, 0, 5], ["AN", 4, 1, 6]]]], "r": [[4.9178e-06, 4.9155e-06, 4.91805e-06], 0, 3.06479, 1667969448], "v": "v0.6"}
{"i": [["[\"batch_norm\", 1, 14, 14, 1024]", "cuda -keys=cuda,gpu -max_num_threads=1024 -model=unknown -thread_warp_size=32", [-1, 16, 64, 49152, 2147483647, 1024, 8, 32], "", 0, []], [[], [["CI", 2], ["FU", 4, [0, 1, 2, 3]], ["SP", 4, 0, 200704, [16], 1], ["AN", 4, 0, 5], ["AN", 4, 1, 6]]]], "r": [[1.20544e-05, 1.20539e-05, 1.20578e-05], 0, 3.42741, 1667969449], "v": "v0.6"}
{"i": [["[\"batch_norm\", 1, 14, 14, 1024]", "cuda -keys=cuda,gpu -max_num_threads=1024 -model=unknown -thread_warp_size=32", [-1, 16, 64, 49152, 2147483647, 1024, 8, 32], "", 0, []], [[], [["CI", 2], ["FU", 4, [0, 1, 2, 3]], ["SP", 4, 0, 200704, [7], 1], ["AN", 4, 0, 5], ["AN", 4, 1, 6]]]], "r": [[2.4141e-05, 2.41256e-05, 2.41425e-05], 0, 4.03457, 1667969449], "v": "v0.6"}
{"i": [["[\"batch_norm\", 1, 14, 14, 1024]", "cuda -keys=cuda,gpu -max_num_threads=1024 -model=unknown -thread_warp_size=32", [-1, 16, 64, 49152, 2147483647, 1024, 8, 32], "", 0, []], [[], [["CI", 2], ["FU", 4, [0, 1, 2, 3]], ["SP", 4, 0, 200704, [56], 1], ["AN", 4, 0, 5], ["AN", 4, 1, 6]]]], "r": [[5.31965e-06, 5.31813e-06, 5.31794e-06], 0, 1.4935, 1667969554], "v": "v0.6"}
{"i": [["[\"batch_norm\", 1, 14, 14, 1024]", "cuda -keys=cuda,gpu -max_num_threads=1024 -model=unknown -thread_warp_size=32", [-1, 16, 64, 49152, 2147483647, 1024, 8, 32], "", 0, []], [[], [["CI", 2], ["FU", 4, [0, 1, 2, 3]], ["SP", 4, 0, 200704, [2], 1], ["AN", 4, 0, 5], ["AN", 4, 1, 6]]]], "r": [[7.71754e-05, 7.71736e-05, 7.71619e-05], 0, 1.15447, 1667969554], "v": "v0.6"}
{"i": [["[\"batch_norm\", 1, 14, 14, 1024]", "cuda -keys=cuda,gpu -max_num_threads=1024 -model=unknown -thread_warp_size=32", [-1, 16, 64, 49152, 2147483647, 1024, 8, 32], "", 0, []], [[], [["CI", 2], ["FU", 4, [0, 1, 2, 3]], ["SP", 4, 0, 200704, [7], 1], ["AN", 4, 0, 5], ["AN", 4, 1, 6]]]], "r": [[2.39788e-05, 2.39656e-05, 2.39664e-05], 0, 2.45165, 1667969555], "v": "v0.6"}
{"i": [["[\"batch_norm\", 1, 14, 14, 1024]", "cuda -keys=cuda,gpu -max_num_threads=1024 -model=unknown -thread_warp_size=32", [-1, 16, 64, 49152, 2147483647, 1024, 8, 32], "", 0, []], [[], [["CI", 2], ["FU", 4, [0, 1, 2, 3]], ["SP", 4, 0, 200704, [4], 1], ["AN", 4, 0, 5], ["AN", 4, 1, 6]]]], "r": [[4.00677e-05, 4.002e-05, 4.00661e-05], 0, 0.540326, 1667969553], "v": "v0.6"}
{"i": [["[\"batch_norm\", 1, 14, 14, 1024]", "cuda -keys=cuda,gpu -max_num_threads=1024 -model=unknown -thread_warp_size=32", [-1, 16, 64, 49152, 2147483647, 1024, 8, 32], "", 0, []], [[], [["CI", 2], ["FU", 4, [0, 1, 2, 3]], ["SP", 4, 0, 200704, [32], 1], ["AN", 4, 0, 5], ["AN", 4, 1, 6]]]], "r": [[7.23892e-06, 7.23458e-06, 7.23419e-06], 0, 0.839105, 1667969554], "v": "v0.6"}
{"i": [["[\"batch_norm\", 1, 14, 14, 1024]", "cuda -keys=cuda,gpu -max_num_threads=1024 -model=unknown -thread_warp_size=32", [-1, 16, 64, 49152, 2147483647, 1024, 8, 32], "", 0, []], [[], [["CI", 2], ["FU", 4, [0, 1, 2, 3]], ["SP", 4, 0, 200704, [8], 1], ["AN", 4, 0, 5], ["AN", 4, 1, 6]]]], "r": [[2.13779e-05, 2.13577e-05, 2.13633e-05], 0, 2.10092, 1667969555], "v": "v0.6"}
{"i": [["[\"batch_norm\", 1, 14, 14, 1024]", "cuda -keys=cuda,gpu -max_num_threads=1024 -model=unknown -thread_warp_size=32", [-1, 16, 64, 49152, 2147483647, 1024, 8, 32], "", 0, []], [[], [["CI", 2], ["FU", 4, [0, 1, 2, 3]], ["SP", 4, 0, 200704, [64], 1], ["AN", 4, 0, 5], ["AN", 4, 1, 6]]]], "r": [[4.92377e-06, 4.92143e-06, 4.92539e-06], 0, 1.78514, 1667969555], "v": "v0.6"}
{"i": [["[\"batch_norm\", 1, 14, 14, 1024]", "cuda -keys=cuda,gpu -max_num_threads=1024 -model=unknown -thread_warp_size=32", [-1, 16, 64, 49152, 2147483647, 1024, 8, 32], "", 0, []], [[], [["CI", 2], ["FU", 4, [0, 1, 2, 3]], ["SP", 4, 0, 200704, [49], 1], ["AN", 4, 0, 5], ["AN", 4, 1, 6]]]], "r": [[5.62487e-06, 5.62395e-06, 5.62358e-06], 0, 2.75933, 1667969556], "v": "v0.6"}
{"i": [["[\"batch_norm\", 1, 14, 14, 1024]", "cuda -keys=cuda,gpu -max_num_threads=1024 -model=unknown -thread_warp_size=32", [-1, 16, 64, 49152, 2147483647, 1024, 8, 32], "", 0, []], [[], [["CI", 2], ["FU", 4, [0, 1, 2, 3]], ["SP", 4, 0, 200704, [1], 1], ["AN", 4, 0, 5], ["AN", 4, 1, 6]]]], "r": [[0.000151543, 0.000151556, 0.000151533], 0, 3.05475, 1667969556], "v": "v0.6"}
{"i": [["[\"batch_norm\", 1, 14, 14, 1024]", "cuda -keys=cuda,gpu -max_num_threads=1024 -model=unknown -thread_warp_size=32", [-1, 16, 64, 49152, 2147483647, 1024, 8, 32], "", 0, []], [[], [["CI", 2], ["FU", 4, [0, 1, 2, 3]], ["SP", 4, 0, 200704, [28], 1], ["AN", 4, 0, 5], ["AN", 4, 1, 6]]]], "r": [[8.11634e-06, 8.11382e-06, 8.11821e-06], 0, 3.74407, 1667969557], "v": "v0.6"}
{"i": [["[\"batch_norm\", 1, 14, 14, 1024]", "cuda -keys=cuda,gpu -max_num_threads=1024 -model=unknown -thread_warp_size=32", [-1, 16, 64, 49152, 2147483647, 1024, 8, 32], "", 0, []], [[], [["CI", 2], ["FU", 4, [0, 1, 2, 3]], ["SP", 4, 0, 200704, [14], 1], ["AN", 4, 0, 5], ["AN", 4, 1, 6]]]], "r": [[1.34094e-05, 1.34043e-05, 1.34065e-05], 0, 3.42171, 1667969556], "v": "v0.6"}
{"i": [["[\"batch_norm\", 1, 14, 14, 1024]", "cuda -keys=cuda,gpu -max_num_threads=1024 -model=unknown -thread_warp_size=32", [-1, 16, 64, 49152, 2147483647, 1024, 8, 32], "", 0, []], [[], [["CI", 2], ["FU", 4, [0, 1, 2, 3]], ["SP", 4, 0, 200704, [16], 1], ["AN", 4, 0, 5], ["AN", 4, 1, 6]]]], "r": [[1.19945e-05, 1.19921e-05, 1.19931e-05], 0, 4.03842, 1667969557], "v": "v0.6"}
{"i": [["[\"batch_norm\", 1, 14, 14, 1024]", "cuda -keys=cuda,gpu -max_num_threads=1024 -model=unknown -thread_warp_size=32", [-1, 16, 64, 49152, 2147483647, 1024, 8, 32], "", 0, []], [[], [["CI", 2], ["FU", 4, [0, 1, 2, 3]], ["SP", 4, 0, 200704, [56], 1], ["AN", 4, 0, 5], ["AN", 4, 1, 6]]]], "r": [[5.43729e-06, 5.43109e-06, 5.42787e-06], 0, 1.47341, 1667969662], "v": "v0.6"}
