python/models/resnext/ResNextHorizontal_kernel_configs/resnext_imagenet_50_hfused_relu_1_7_7_32_64.log
{"i": [["[\"hfused_relu\", 1, 7, 7, 32, 64]", "cuda -keys=cuda,gpu -max_num_threads=1024 -model=unknown -thread_warp_size=32", [-1, 16, 64, 49152, 2147483647, 1024, 8, 32], "", 0, []], [[], [["FU", 1, [0, 1, 2, 3, 4]], ["SP", 1, 0, 100352, [14], 1], ["AN", 1, 0, 5], ["AN", 1, 1, 6]]]], "r": [[8.00484e-06, 8.01935e-06, 8.01395e-06], 0, 0.848273, 1667897713], "v": "v0.6"}
{"i": [["[\"hfused_relu\", 1, 7, 7, 32, 64]", "cuda -keys=cuda,gpu -max_num_threads=1024 -model=unknown -thread_warp_size=32", [-1, 16, 64, 49152, 2147483647, 1024, 8, 32], "", 0, []], [[], [["FU", 1, [0, 1, 2, 3, 4]], ["SP", 1, 0, 100352, [64], 1], ["AN", 1, 0, 5], ["AN", 1, 1, 6]]]], "r": [[3.65255e-06, 3.6605e-06, 3.66188e-06], 0, 1.73704, 1667897714], "v": "v0.6"}
{"i": [["[\"hfused_relu\", 1, 7, 7, 32, 64]", "cuda -keys=cuda,gpu -max_num_threads=1024 -model=unknown -thread_warp_size=32", [-1, 16, 64, 49152, 2147483647, 1024, 8, 32], "", 0, []], [[], [["FU", 1, [0, 1, 2, 3, 4]], ["SP", 1, 0, 100352, [2], 1], ["AN", 1, 0, 5], ["AN", 1, 1, 6]]]], "r": [[3.98169e-05, 3.98287e-05, 3.98353e-05], 0, 1.42851, 1667897713], "v": "v0.6"}
{"i": [["[\"hfused_relu\", 1, 7, 7, 32, 64]", "cuda -keys=cuda,gpu -max_num_threads=1024 -model=unknown -thread_warp_size=32", [-1, 16, 64, 49152, 2147483647, 1024, 8, 32], "", 0, []], [[], [["FU", 1, [0, 1, 2, 3, 4]], ["SP", 1, 0, 100352, [8], 1], ["AN", 1, 0, 5], ["AN", 1, 1, 6]]]], "r": [[1.20969e-05, 1.21184e-05, 1.21232e-05], 0, 0.504843, 1667897713], "v": "v0.6"}
{"i": [["[\"hfused_relu\", 1, 7, 7, 32, 64]", "cuda -keys=cuda,gpu -max_num_threads=1024 -model=unknown -thread_warp_size=32", [-1, 16, 64, 49152, 2147483647, 1024, 8, 32], "", 0, []], [[], [["FU", 1, [0, 1, 2, 3, 4]], ["SP", 1, 0, 100352, [28], 1], ["AN", 1, 0, 5], ["AN", 1, 1, 6]]]], "r": [[5.2192e-06, 5.22944e-06, 5.23328e-06], 0, 1.14168, 1667897713], "v": "v0.6"}
{"i": [["[\"hfused_relu\", 1, 7, 7, 32, 64]", "cuda -keys=cuda,gpu -max_num_threads=1024 -model=unknown -thread_warp_size=32", [-1, 16, 64, 49152, 2147483647, 1024, 8, 32], "", 0, []], [[], [["FU", 1, [0, 1, 2, 3, 4]], ["SP", 1, 0, 100352, [16], 1], ["AN", 1, 0, 5], ["AN", 1, 1, 6]]]], "r": [[7.37582e-06, 7.3864e-06, 7.38802e-06], 0, 2.67259, 1667897715], "v": "v0.6"}
{"i": [["[\"hfused_relu\", 1, 7, 7, 32, 64]", "cuda -keys=cuda,gpu -max_num_threads=1024 -model=unknown -thread_warp_size=32", [-1, 16, 64, 49152, 2147483647, 1024, 8, 32], "", 0, []], [[], [["FU", 1, [0, 1, 2, 3, 4]], ["SP", 1, 0, 100352, [1], 1], ["AN", 1, 0, 5], ["AN", 1, 1, 6]]]], "r": [[7.7034e-05, 7.70372e-05, 7.70465e-05], 0, 2.04909, 1667897714], "v": "v0.6"}
{"i": [["[\"hfused_relu\", 1, 7, 7, 32, 64]", "cuda -keys=cuda,gpu -max_num_threads=1024 -model=unknown -thread_warp_size=32", [-1, 16, 64, 49152, 2147483647, 1024, 8, 32], "", 0, []], [[], [["FU", 1, [0, 1, 2, 3, 4]], ["SP", 1, 0, 100352, [32], 1], ["AN", 1, 0, 5], ["AN", 1, 1, 6]]]], "r": [[4.82492e-06, 4.835e-06, 4.83207e-06], 0, 2.32746, 1667897714], "v": "v0.6"}
{"i": [["[\"hfused_relu\", 1, 7, 7, 32, 64]", "cuda -keys=cuda,gpu -max_num_threads=1024 -model=unknown -thread_warp_size=32", [-1, 16, 64, 49152, 2147483647, 1024, 8, 32], "", 0, []], [[], [["FU", 1, [0, 1, 2, 3, 4]], ["SP", 1, 0, 100352, [56], 1], ["AN", 1, 0, 5], ["AN", 1, 1, 6]]]], "r": [[3.76695e-06, 3.77944e-06, 3.77665e-06], 0, 3.59884, 1667897716], "v": "v0.6"}
{"i": [["[\"hfused_relu\", 1, 7, 7, 32, 64]", "cuda -keys=cuda,gpu -max_num_threads=1024 -model=unknown -thread_warp_size=32", [-1, 16, 64, 49152, 2147483647, 1024, 8, 32], "", 0, []], [[], [["FU", 1, [0, 1, 2, 3, 4]], ["SP", 1, 0, 100352, [7], 1], ["AN", 1, 0, 5], ["AN", 1, 1, 6]]]], "r": [[1.34715e-05, 1.34814e-05, 1.34753e-05], 0, 3.26748, 1667897715], "v": "v0.6"}
{"i": [["[\"hfused_relu\", 1, 7, 7, 32, 64]", "cuda -keys=cuda,gpu -max_num_threads=1024 -model=unknown -thread_warp_size=32", [-1, 16, 64, 49152, 2147483647, 1024, 8, 32], "", 0, []], [[], [["FU", 1, [0, 1, 2, 3, 4]], ["SP", 1, 0, 100352, [4], 1], ["AN", 1, 0, 5], ["AN", 1, 1, 6]]]], "r": [[2.1303e-05, 2.13136e-05, 2.13121e-05], 0, 2.97428, 1667897715], "v": "v0.6"}
{"i": [["[\"hfused_relu\", 1, 7, 7, 32, 64]", "cuda -keys=cuda,gpu -max_num_threads=1024 -model=unknown -thread_warp_size=32", [-1, 16, 64, 49152, 2147483647, 1024, 8, 32], "", 0, []], [[], [["FU", 1, [0, 1, 2, 3, 4]], ["SP", 1, 0, 100352, [49], 1], ["AN", 1, 0, 5], ["AN", 1, 1, 6]]]], "r": [[4.01085e-06, 4.02216e-06, 4.02351e-06], 0, 3.89482, 1667897716], "v": "v0.6"}
{"i": [["[\"hfused_relu\", 1, 7, 7, 32, 64]", "cuda -keys=cuda,gpu -max_num_threads=1024 -model=unknown -thread_warp_size=32", [-1, 16, 64, 49152, 2147483647, 1024, 8, 32], "", 0, []], [[], [["FU", 1, [0, 1, 2, 3, 4]], ["SP", 1, 0, 100352, [7], 1], ["AN", 1, 0, 5], ["AN", 1, 1, 6]]]], "r": [[1.34071e-05, 1.34223e-05, 1.3424e-05], 0, 0.820998, 1667974804], "v": "v0.6"}
{"i": [["[\"hfused_relu\", 1, 7, 7, 32, 64]", "cuda -keys=cuda,gpu -max_num_threads=1024 -model=unknown -thread_warp_size=32", [-1, 16, 64, 49152, 2147483647, 1024, 8, 32], "", 0, []], [[], [["FU", 1, [0, 1, 2, 3, 4]], ["SP", 1, 0, 100352, [4], 1], ["AN", 1, 0, 5], ["AN", 1, 1, 6]]]], "r": [[2.14037e-05, 2.14244e-05, 2.14228e-05], 0, 1.44171, 1667974804], "v": "v0.6"}
{"i": [["[\"hfused_relu\", 1, 7, 7, 32, 64]", "cuda -keys=cuda,gpu -max_num_threads=1024 -model=unknown -thread_warp_size=32", [-1, 16, 64, 49152, 2147483647, 1024, 8, 32], "", 0, []], [[], [["FU", 1, [0, 1, 2, 3, 4]], ["SP", 1, 0, 100352, [28], 1], ["AN", 1, 0, 5], ["AN", 1, 1, 6]]]], "r": [[5.29114e-06, 5.30939e-06, 5.30707e-06], 0, 0.527429, 1667974803], "v": "v0.6"}
{"i": [["[\"hfused_relu\", 1, 7, 7, 32, 64]", "cuda -keys=cuda,gpu -max_num_threads=1024 -model=unknown -thread_warp_size=32", [-1, 16, 64, 49152, 2147483647, 1024, 8, 32], "", 0, []], [[], [["FU", 1, [0, 1, 2, 3, 4]], ["SP", 1, 0, 100352, [56], 1], ["AN", 1, 0, 5], ["AN", 1, 1, 6]]]], "r": [[3.7738e-06, 3.78472e-06, 3.78057e-06], 0, 2.3692, 1667974805], "v": "v0.6"}
{"i": [["[\"hfused_relu\", 1, 7, 7, 32, 64]", "cuda -keys=cuda,gpu -max_num_threads=1024 -model=unknown -thread_warp_size=32", [-1, 16, 64, 49152, 2147483647, 1024, 8, 32], "", 0, []], [[], [["FU", 1, [0, 1, 2, 3, 4]], ["SP", 1, 0, 100352, [64], 1], ["AN", 1, 0, 5], ["AN", 1, 1, 6]]]], "r": [[3.82631e-06, 3.83825e-06, 3.84139e-06], 0, 1.13901, 1667974804], "v": "v0.6"}
{"i": [["[\"hfused_relu\", 1, 7, 7, 32, 64]", "cuda -keys=cuda,gpu -max_num_threads=1024 -model=unknown -thread_warp_size=32", [-1, 16, 64, 49152, 2147483647, 1024, 8, 32], "", 0, []], [[], [["FU", 1, [0, 1, 2, 3, 4]], ["SP", 1, 0, 100352, [2], 1], ["AN", 1, 0, 5], ["AN", 1, 1, 6]]]], "r": [[3.99137e-05, 3.99163e-05, 3.99007e-05], 0, 2.07391, 1667974805], "v": "v0.6"}
{"i": [["[\"hfused_relu\", 1, 7, 7, 32, 64]", "cuda -keys=cuda,gpu -max_num_threads=1024 -model=unknown -thread_warp_size=32", [-1, 16, 64, 49152, 2147483647, 1024, 8, 32], "", 0, []], [[], [["FU", 1, [0, 1, 2, 3, 4]], ["SP", 1, 0, 100352, [49], 1], ["AN", 1, 0, 5], ["AN", 1, 1, 6]]]], "r": [[4.15709e-06, 4.17666e-06, 4.17687e-06], 0, 2.70847, 1667974806], "v": "v0.6"}
{"i": [["[\"hfused_relu\", 1, 7, 7, 32, 64]", "cuda -keys=cuda,gpu -max_num_threads=1024 -model=unknown -thread_warp_size=32", [-1, 16, 64, 49152, 2147483647, 1024, 8, 32], "", 0, []], [[], [["FU", 1, [0, 1, 2, 3, 4]], ["SP", 1, 0, 100352, [8], 1], ["AN", 1, 0, 5], ["AN", 1, 1, 6]]]], "r": [[1.20265e-05, 1.20383e-05, 1.20362e-05], 0, 1.75543, 1667974805], "v": "v0.6"}
{"i": [["[\"hfused_relu\", 1, 7, 7, 32, 64]", "cuda -keys=cuda,gpu -max_num_threads=1024 -model=unknown -thread_warp_size=32", [-1, 16, 64, 49152, 2147483647, 1024, 8, 32], "", 0, []], [[], [["FU", 1, [0, 1, 2, 3, 4]], ["SP", 1, 0, 100352, [14], 1], ["AN", 1, 0, 5], ["AN", 1, 1, 6]]]], "r": [[7.93714e-06, 7.96171e-06, 7.97405e-06], 0, 2.98285, 1667974806], "v": "v0.6"}
{"i": [["[\"hfused_relu\", 1, 7, 7, 32, 64]", "cuda -keys=cuda,gpu -max_num_threads=1024 -model=unknown -thread_warp_size=32", [-1, 16, 64, 49152, 2147483647, 1024, 8, 32], "", 0, []], [[], [["FU", 1, [0, 1, 2, 3, 4]], ["SP", 1, 0, 100352, [1], 1], ["AN", 1, 0, 5], ["AN", 1, 1, 6]]]], "r": [[7.70106e-05, 7.70213e-05, 7.7046e-05], 0, 3.30278, 1667974806], "v": "v0.6"}
{"i": [["[\"hfused_relu\", 1, 7, 7, 32, 64]", "cuda -keys=cuda,gpu -max_num_threads=1024 -model=unknown -thread_warp_size=32", [-1, 16, 64, 49152, 2147483647, 1024, 8, 32], "", 0, []], [[], [["FU", 1, [0, 1, 2, 3, 4]], ["SP", 1, 0, 100352, [32], 1], ["AN", 1, 0, 5], ["AN", 1, 1, 6]]]], "r": [[5.06225e-06, 5.07154e-06, 5.07309e-06], 0, 3.62703, 1667974807], "v": "v0.6"}
{"i": [["[\"hfused_relu\", 1, 7, 7, 32, 64]", "cuda -keys=cuda,gpu -max_num_threads=1024 -model=unknown -thread_warp_size=32", [-1, 16, 64, 49152, 2147483647, 1024, 8, 32], "", 0, []], [[], [["FU", 1, [0, 1, 2, 3, 4]], ["SP", 1, 0, 100352, [16], 1], ["AN", 1, 0, 5], ["AN", 1, 1, 6]]]], "r": [[7.24721e-06, 7.26093e-06, 7.26516e-06], 0, 3.93754, 1667974807], "v": "v0.6"}
{"i": [["[\"hfused_relu\", 1, 7, 7, 32, 64]", "cuda -keys=cuda,gpu -max_num_threads=1024 -model=unknown -thread_warp_size=32", [-1, 16, 64, 49152, 2147483647, 1024, 8, 32], "", 0, []], [[], [["FU", 1, [0, 1, 2, 3, 4]], ["SP", 1, 0, 100352, [56], 1], ["AN", 1, 0, 5], ["AN", 1, 1, 6]]]], "r": [[3.95943e-06, 3.97223e-06, 3.9667e-06], 0, 0.862653, 1667975633], "v": "v0.6"}
{"i": [["[\"hfused_relu\", 1, 7, 7, 32, 64]", "cuda -keys=cuda,gpu -max_num_threads=1024 -model=unknown -thread_warp_size=32", [-1, 16, 64, 49152, 2147483647, 1024, 8, 32], "", 0, []], [[], [["FU", 1, [0, 1, 2, 3, 4]], ["SP", 1, 0, 100352, [8], 1], ["AN", 1, 0, 5], ["AN", 1, 1, 6]]]], "r": [[1.19885e-05, 1.20066e-05, 1.2004e-05], 0, 2.36374, 1667975635], "v": "v0.6"}
{"i": [["[\"hfused_relu\", 1, 7, 7, 32, 64]", "cuda -keys=cuda,gpu -max_num_threads=1024 -model=unknown -thread_warp_size=32", [-1, 16, 64, 49152, 2147483647, 1024, 8, 32], "", 0, []], [[], [["FU", 1, [0, 1, 2, 3, 4]], ["SP", 1, 0, 100352, [16], 1], ["AN", 1, 0, 5], ["AN", 1, 1, 6]]]], "r": [[7.27667e-06, 7.27796e-06, 7.2826e-06], 0, 1.44127, 1667975634], "v": "v0.6"}
{"i": [["[\"hfused_relu\", 1, 7, 7, 32, 64]", "cuda -keys=cuda,gpu -max_num_threads=1024 -model=unknown -thread_warp_size=32", [-1, 16, 64, 49152, 2147483647, 1024, 8, 32], "", 0, []], [[], [["FU", 1, [0, 1, 2, 3, 4]], ["SP", 1, 0, 100352, [4], 1], ["AN", 1, 0, 5], ["AN", 1, 1, 6]]]], "r": [[2.13997e-05, 2.14111e-05, 2.14041e-05], 0, 0.516615, 1667975633], "v": "v0.6"}
{"i": [["[\"hfused_relu\", 1, 7, 7, 32, 64]", "cuda -keys=cuda,gpu -max_num_threads=1024 -model=unknown -thread_warp_size=32", [-1, 16, 64, 49152, 2147483647, 1024, 8, 32], "", 0, []], [[], [["FU", 1, [0, 1, 2, 3, 4]], ["SP", 1, 0, 100352, [2], 1], ["AN", 1, 0, 5], ["AN", 1, 1, 6]]]], "r": [[3.99506e-05, 3.99801e-05, 3.99641e-05], 0, 1.15468, 1667975633], "v": "v0.6"}
{"i": [["[\"hfused_relu\", 1, 7, 7, 32, 64]", "cuda -keys=cuda,gpu -max_num_threads=1024 -model=unknown -thread_warp_size=32", [-1, 16, 64, 49152, 2147483647, 1024, 8, 32], "", 0, []], [[], [["FU", 1, [0, 1, 2, 3, 4]], ["SP", 1, 0, 100352, [64], 1], ["AN", 1, 0, 5], ["AN", 1, 1, 6]]]], "r": [[3.75578e-06, 3.77102e-06, 3.76466e-06], 0, 1.7704, 1667975634], "v": "v0.6"}
{"i": [["[\"hfused_relu\", 1, 7, 7, 32, 64]", "cuda -keys=cuda,gpu -max_num_threads=1024 -model=unknown -thread_warp_size=32", [-1, 16, 64, 49152, 2147483647, 1024, 8, 32], "", 0, []], [[], [["FU", 1, [0, 1, 2, 3, 4]], ["SP", 1, 0, 100352, [7], 1], ["AN", 1, 0, 5], ["AN", 1, 1, 6]]]], "r": [[1.33274e-05, 1.33389e-05, 1.33382e-05], 0, 2.06715, 1667975634], "v": "v0.6"}
{"i": [["[\"hfused_relu\", 1, 7, 7, 32, 64]", "cuda -keys=cuda,gpu -max_num_threads=1024 -model=unknown -thread_warp_size=32", [-1, 16, 64, 49152, 2147483647, 1024, 8, 32], "", 0, []], [[], [["FU", 1, [0, 1, 2, 3, 4]], ["SP", 1, 0, 100352, [1], 1], ["AN", 1, 0, 5], ["AN", 1, 1, 6]]]], "r": [[7.70573e-05, 7.70453e-05, 7.70445e-05], 0, 2.71462, 1667975635], "v": "v0.6"}
{"i": [["[\"hfused_relu\", 1, 7, 7, 32, 64]", "cuda -keys=cuda,gpu -max_num_threads=1024 -model=unknown -thread_warp_size=32", [-1, 16, 64, 49152, 2147483647, 1024, 8, 32], "", 0, []], [[], [["FU", 1, [0, 1, 2, 3, 4]], ["SP", 1, 0, 100352, [49], 1], ["AN", 1, 0, 5], ["AN", 1, 1, 6]]]], "r": [[4.09913e-06, 4.10451e-06, 4.08954e-06], 0, 3.00128, 1667975635], "v": "v0.6"}
{"i": [["[\"hfused_relu\", 1, 7, 7, 32, 64]", "cuda -keys=cuda,gpu -max_num_threads=1024 -model=unknown -thread_warp_size=32", [-1, 16, 64, 49152, 2147483647, 1024, 8, 32], "", 0, []], [[], [["FU", 1, [0, 1, 2, 3, 4]], ["SP", 1, 0, 100352, [14], 1], ["AN", 1, 0, 5], ["AN", 1, 1, 6]]]], "r": [[7.88902e-06, 7.90192e-06, 7.9027e-06], 0, 3.6441, 1667975636], "v": "v0.6"}
{"i": [["[\"hfused_relu\", 1, 7, 7, 32, 64]", "cuda -keys=cuda,gpu -max_num_threads=1024 -model=unknown -thread_warp_size=32", [-1, 16, 64, 49152, 2147483647, 1024, 8, 32], "", 0, []], [[], [["FU", 1, [0, 1, 2, 3, 4]], ["SP", 1, 0, 100352, [28], 1], ["AN", 1, 0, 5], ["AN", 1, 1, 6]]]], "r": [[5.25835e-06, 5.27199e-06, 5.27133e-06], 0, 3.95037, 1667975636], "v": "v0.6"}
{"i": [["[\"hfused_relu\", 1, 7, 7, 32, 64]", "cuda -keys=cuda,gpu -max_num_threads=1024 -model=unknown -thread_warp_size=32", [-1, 16, 64, 49152, 2147483647, 1024, 8, 32], "", 0, []], [[], [["FU", 1, [0, 1, 2, 3, 4]], ["SP", 1, 0, 100352, [32], 1], ["AN", 1, 0, 5], ["AN", 1, 1, 6]]]], "r": [[4.88346e-06, 4.89224e-06, 4.89581e-06], 0, 3.29219, 1667975636], "v": "v0.6"}
{"i": [["[\"hfused_relu\", 1, 7, 7, 32, 64]", "cuda -keys=cuda,gpu -max_num_threads=1024 -model=unknown -thread_warp_size=32", [-1, 16, 64, 49152, 2147483647, 1024, 8, 32], "", 0, []], [[], [["FU", 1, [0, 1, 2, 3, 4]], ["SP", 1, 0, 100352, [16], 1], ["AN", 1, 0, 5], ["AN", 1, 1, 6]]]], "r": [[7.35388e-06, 7.37398e-06, 7.37331e-06], 0, 1.41001, 1667976541], "v": "v0.6"}
{"i": [["[\"hfused_relu\", 1, 7, 7, 32, 64]", "cuda -keys=cuda,gpu -max_num_threads=1024 -model=unknown -thread_warp_size=32", [-1, 16, 64, 49152, 2147483647, 1024, 8, 32], "", 0, []], [[], [["FU", 1, [0, 1, 2, 3, 4]], ["SP", 1, 0, 100352, [32], 1], ["AN", 1, 0, 5], ["AN", 1, 1, 6]]]], "r": [[5.00496e-06, 5.00241e-06, 5.01433e-06], 0, 0.512371, 1667976540], "v": "v0.6"}
{"i": [["[\"hfused_relu\", 1, 7, 7, 32, 64]", "cuda -keys=cuda,gpu -max_num_threads=1024 -model=unknown -thread_warp_size=32", [-1, 16, 64, 49152, 2147483647, 1024, 8, 32], "", 0, []], [[], [["FU", 1, [0, 1, 2, 3, 4]], ["SP", 1, 0, 100352, [7], 1], ["AN", 1, 0, 5], ["AN", 1, 1, 6]]]], "r": [[1.34031e-05, 1.34066e-05, 1.33967e-05], 0, 1.75491, 1667976541], "v": "v0.6"}
{"i": [["[\"hfused_relu\", 1, 7, 7, 32, 64]", "cuda -keys=cuda,gpu -max_num_threads=1024 -model=unknown -thread_warp_size=32", [-1, 16, 64, 49152, 2147483647, 1024, 8, 32], "", 0, []], [[], [["FU", 1, [0, 1, 2, 3, 4]], ["SP", 1, 0, 100352, [64], 1], ["AN", 1, 0, 5], ["AN", 1, 1, 6]]]], "r": [[3.66665e-06, 3.67106e-06, 3.67303e-06], 0, 0.864706, 1667976540], "v": "v0.6"}
{"i": [["[\"hfused_relu\", 1, 7, 7, 32, 64]", "cuda -keys=cuda,gpu -max_num_threads=1024 -model=unknown -thread_warp_size=32", [-1, 16, 64, 49152, 2147483647, 1024, 8, 32], "", 0, []], [[], [["FU", 1, [0, 1, 2, 3, 4]], ["SP", 1, 0, 100352, [28], 1], ["AN", 1, 0, 5], ["AN", 1, 1, 6]]]], "r": [[5.22467e-06, 5.23357e-06, 5.23049e-06], 0, 1.15859, 1667976541], "v": "v0.6"}
{"i": [["[\"hfused_relu\", 1, 7, 7, 32, 64]", "cuda -keys=cuda,gpu -max_num_threads=1024 -model=unknown -thread_warp_size=32", [-1, 16, 64, 49152, 2147483647, 1024, 8, 32], "", 0, []], [[], [["FU", 1, [0, 1, 2, 3, 4]], ["SP", 1, 0, 100352, [8], 1], ["AN", 1, 0, 5], ["AN", 1, 1, 6]]]], "r": [[1.20445e-05, 1.20552e-05, 1.20675e-05], 0, 2.05938, 1667976542], "v": "v0.6"}
{"i": [["[\"hfused_relu\", 1, 7, 7, 32, 64]", "cuda -keys=cuda,gpu -max_num_threads=1024 -model=unknown -thread_warp_size=32", [-1, 16, 64, 49152, 2147483647, 1024, 8, 32], "", 0, []], [[], [["FU", 1, [0, 1, 2, 3, 4]], ["SP", 1, 0, 100352, [49], 1], ["AN", 1, 0, 5], ["AN", 1, 1, 6]]]], "r": [[4.13613e-06, 4.14579e-06, 4.1455e-06], 0, 2.3702, 1667976542], "v": "v0.6"}
{"i": [["[\"hfused_relu\", 1, 7, 7, 32, 64]", "cuda -keys=cuda,gpu -max_num_threads=1024 -model=unknown -thread_warp_size=32", [-1, 16, 64, 49152, 2147483647, 1024, 8, 32], "", 0, []], [[], [["FU", 1, [0, 1, 2, 3, 4]], ["SP", 1, 0, 100352, [56], 1], ["AN", 1, 0, 5], ["AN", 1, 1, 6]]]], "r": [[3.85983e-06, 3.87357e-06, 3.87307e-06], 0, 2.695, 1667976542], "v": "v0.6"}
{"i": [["[\"hfused_relu\", 1, 7, 7, 32, 64]", "cuda -keys=cuda,gpu -max_num_threads=1024 -model=unknown -thread_warp_size=32", [-1, 16, 64, 49152, 2147483647, 1024, 8, 32], "", 0, []], [[], [["FU", 1, [0, 1, 2, 3, 4]], ["SP", 1, 0, 100352, [4], 1], ["AN", 1, 0, 5], ["AN", 1, 1, 6]]]], "r": [[2.13332e-05, 2.13503e-05, 2.13424e-05], 0, 2.99959, 1667976543], "v": "v0.6"}
{"i": [["[\"hfused_relu\", 1, 7, 7, 32, 64]", "cuda -keys=cuda,gpu -max_num_threads=1024 -model=unknown -thread_warp_size=32", [-1, 16, 64, 49152, 2147483647, 1024, 8, 32], "", 0, []], [[], [["FU", 1, [0, 1, 2, 3, 4]], ["SP", 1, 0, 100352, [14], 1], ["AN", 1, 0, 5], ["AN", 1, 1, 6]]]], "r": [[7.9248e-06, 7.94163e-06, 7.93452e-06], 0, 3.29155, 1667976543], "v": "v0.6"}
{"i": [["[\"hfused_relu\", 1, 7, 7, 32, 64]", "cuda -keys=cuda,gpu -max_num_threads=1024 -model=unknown -thread_warp_size=32", [-1, 16, 64, 49152, 2147483647, 1024, 8, 32], "", 0, []], [[], [["FU", 1, [0, 1, 2, 3, 4]], ["SP", 1, 0, 100352, [2], 1], ["AN", 1, 0, 5], ["AN", 1, 1, 6]]]], "r": [[3.98827e-05, 3.98946e-05, 3.98987e-05], 0, 3.95972, 1667976544], "v": "v0.6"}
{"i": [["[\"hfused_relu\", 1, 7, 7, 32, 64]", "cuda -keys=cuda,gpu -max_num_threads=1024 -model=unknown -thread_warp_size=32", [-1, 16, 64, 49152, 2147483647, 1024, 8, 32], "", 0, []], [[], [["FU", 1, [0, 1, 2, 3, 4]], ["SP", 1, 0, 100352, [1], 1], ["AN", 1, 0, 5], ["AN", 1, 1, 6]]]], "r": [[7.71213e-05, 7.71379e-05, 7.71484e-05], 0, 3.63903, 1667976543], "v": "v0.6"}
{"i": [["[\"hfused_relu\", 1, 7, 7, 32, 64]", "cuda -keys=cuda,gpu -max_num_threads=1024 -model=unknown -thread_warp_size=32", [-1, 16, 64, 49152, 2147483647, 1024, 8, 32], "", 0, []], [[], [["FU", 1, [0, 1, 2, 3, 4]], ["SP", 1, 0, 100352, [7], 1], ["AN", 1, 0, 5], ["AN", 1, 1, 6]]]], "r": [[1.33873e-05, 1.34016e-05, 1.34017e-05], 0, 2.11452, 1667976583], "v": "v0.6"}
{"i": [["[\"hfused_relu\", 1, 7, 7, 32, 64]", "cuda -keys=cuda,gpu -max_num_threads=1024 -model=unknown -thread_warp_size=32", [-1, 16, 64, 49152, 2147483647, 1024, 8, 32], "", 0, []], [[], [["FU", 1, [0, 1, 2, 3, 4]], ["SP", 1, 0, 100352, [28], 1], ["AN", 1, 0, 5], ["AN", 1, 1, 6]]]], "r": [[5.47242e-06, 5.47866e-06, 5.47801e-06], 0, 0.863016, 1667976582], "v": "v0.6"}
{"i": [["[\"hfused_relu\", 1, 7, 7, 32, 64]", "cuda -keys=cuda,gpu -max_num_threads=1024 -model=unknown -thread_warp_size=32", [-1, 16, 64, 49152, 2147483647, 1024, 8, 32], "", 0, []], [[], [["FU", 1, [0, 1, 2, 3, 4]], ["SP", 1, 0, 100352, [2], 1], ["AN", 1, 0, 5], ["AN", 1, 1, 6]]]], "r": [[3.98465e-05, 3.98606e-05, 3.98608e-05], 0, 0.524188, 1667976582], "v": "v0.6"}
{"i": [["[\"hfused_relu\", 1, 7, 7, 32, 64]", "cuda -keys=cuda,gpu -max_num_threads=1024 -model=unknown -thread_warp_size=32", [-1, 16, 64, 49152, 2147483647, 1024, 8, 32], "", 0, []], [[], [["FU", 1, [0, 1, 2, 3, 4]], ["SP", 1, 0, 100352, [1], 1], ["AN", 1, 0, 5], ["AN", 1, 1, 6]]]], "r": [[7.81442e-05, 7.70223e-05, 7.70272e-05], 0, 1.79724, 1667976583], "v": "v0.6"}
{"i": [["[\"hfused_relu\", 1, 7, 7, 32, 64]", "cuda -keys=cuda,gpu -max_num_threads=1024 -model=unknown -thread_warp_size=32", [-1, 16, 64, 49152, 2147483647, 1024, 8, 32], "", 0, []], [[], [["FU", 1, [0, 1, 2, 3, 4]], ["SP", 1, 0, 100352, [64], 1], ["AN", 1, 0, 5], ["AN", 1, 1, 6]]]], "r": [[3.56534e-06, 3.57554e-06, 3.57481e-06], 0, 1.14322, 1667976582], "v": "v0.6"}
{"i": [["[\"hfused_relu\", 1, 7, 7, 32, 64]", "cuda -keys=cuda,gpu -max_num_threads=1024 -model=unknown -thread_warp_size=32", [-1, 16, 64, 49152, 2147483647, 1024, 8, 32], "", 0, []], [[], [["FU", 1, [0, 1, 2, 3, 4]], ["SP", 1, 0, 100352, [8], 1], ["AN", 1, 0, 5], ["AN", 1, 1, 6]]]], "r": [[1.21154e-05, 1.21321e-05, 1.21241e-05], 0, 1.44801, 1667976583], "v": "v0.6"}
{"i": [["[\"hfused_relu\", 1, 7, 7, 32, 64]", "cuda -keys=cuda,gpu -max_num_threads=1024 -model=unknown -thread_warp_size=32", [-1, 16, 64, 49152, 2147483647, 1024, 8, 32], "", 0, []], [[], [["FU", 1, [0, 1, 2, 3, 4]], ["SP", 1, 0, 100352, [16], 1], ["AN", 1, 0, 5], ["AN", 1, 1, 6]]]], "r": [[7.35898e-06, 7.38292e-06, 7.38172e-06], 0, 2.74346, 1667976584], "v": "v0.6"}
{"i": [["[\"hfused_relu\", 1, 7, 7, 32, 64]", "cuda -keys=cuda,gpu -max_num_threads=1024 -model=unknown -thread_warp_size=32", [-1, 16, 64, 49152, 2147483647, 1024, 8, 32], "", 0, []], [[], [["FU", 1, [0, 1, 2, 3, 4]], ["SP", 1, 0, 100352, [4], 1], ["AN", 1, 0, 5], ["AN", 1, 1, 6]]]], "r": [[2.12701e-05, 2.12782e-05, 2.127e-05], 0, 2.38905, 1667976584], "v": "v0.6"}
{"i": [["[\"hfused_relu\", 1, 7, 7, 32, 64]", "cuda -keys=cuda,gpu -max_num_threads=1024 -model=unknown -thread_warp_size=32", [-1, 16, 64, 49152, 2147483647, 1024, 8, 32], "", 0, []], [[], [["FU", 1, [0, 1, 2, 3, 4]], ["SP", 1, 0, 100352, [49], 1], ["AN", 1, 0, 5], ["AN", 1, 1, 6]]]], "r": [[4.22317e-06, 4.23843e-06, 4.23715e-06], 0, 3.68713, 1667976585], "v": "v0.6"}
{"i": [["[\"hfused_relu\", 1, 7, 7, 32, 64]", "cuda -keys=cuda,gpu -max_num_threads=1024 -model=unknown -thread_warp_size=32", [-1, 16, 64, 49152, 2147483647, 1024, 8, 32], "", 0, []], [[], [["FU", 1, [0, 1, 2, 3, 4]], ["SP", 1, 0, 100352, [14], 1], ["AN", 1, 0, 5], ["AN", 1, 1, 6]]]], "r": [[7.86654e-06, 7.87863e-06, 7.87901e-06], 0, 3.36629, 1667976585], "v": "v0.6"}
{"i": [["[\"hfused_relu\", 1, 7, 7, 32, 64]", "cuda -keys=cuda,gpu -max_num_threads=1024 -model=unknown -thread_warp_size=32", [-1, 16, 64, 49152, 2147483647, 1024, 8, 32], "", 0, []], [[], [["FU", 1, [0, 1, 2, 3, 4]], ["SP", 1, 0, 100352, [32], 1], ["AN", 1, 0, 5], ["AN", 1, 1, 6]]]], "r": [[5.00282e-06, 5.01587e-06, 5.01236e-06], 0, 3.04543, 1667976584], "v": "v0.6"}
{"i": [["[\"hfused_relu\", 1, 7, 7, 32, 64]", "cuda -keys=cuda,gpu -max_num_threads=1024 -model=unknown -thread_warp_size=32", [-1, 16, 64, 49152, 2147483647, 1024, 8, 32], "", 0, []], [[], [["FU", 1, [0, 1, 2, 3, 4]], ["SP", 1, 0, 100352, [56], 1], ["AN", 1, 0, 5], ["AN", 1, 1, 6]]]], "r": [[3.78627e-06, 3.78839e-06, 3.79416e-06], 0, 4.00318, 1667976585], "v": "v0.6"}
