python/models/resnext/ResNextHorizontal_kernel_configs/resnext_imagenet_50_batch_norm_1_56_56_256.log
{"i": [["[\"batch_norm\", 1, 56, 56, 256]", "cuda -keys=cuda,gpu -max_num_threads=1024 -model=unknown -thread_warp_size=32", [-1, 16, 64, 49152, 2147483647, 1024, 8, 32], "", 0, []], [[], [["CI", 2], ["FU", 4, [0, 1, 2, 3]], ["SP", 4, 0, 802816, [49], 1], ["AN", 4, 0, 5], ["AN", 4, 1, 6]]]], "r": [[1.48346e-05, 1.48346e-05, 1.48287e-05], 0, 1.73554, 1667896718], "v": "v0.6"}
{"i": [["[\"batch_norm\", 1, 56, 56, 256]", "cuda -keys=cuda,gpu -max_num_threads=1024 -model=unknown -thread_warp_size=32", [-1, 16, 64, 49152, 2147483647, 1024, 8, 32], "", 0, []], [[], [["CI", 2], ["FU", 4, [0, 1, 2, 3]], ["SP", 4, 0, 802816, [14], 1], ["AN", 4, 0, 5], ["AN", 4, 1, 6]]]], "r": [[4.5224e-05, 4.52202e-05, 4.52139e-05], 0, 0.962823, 1667896717], "v": "v0.6"}
{"i": [["[\"batch_norm\", 1, 56, 56, 256]", "cuda -keys=cuda,gpu -max_num_threads=1024 -model=unknown -thread_warp_size=32", [-1, 16, 64, 49152, 2147483647, 1024, 8, 32], "", 0, []], [[], [["CI", 2], ["FU", 4, [0, 1, 2, 3]], ["SP", 4, 0, 802816, [64], 1], ["AN", 4, 0, 5], ["AN", 4, 1, 6]]]], "r": [[1.19054e-05, 1.19095e-05, 1.19106e-05], 0, 2.08786, 1667896718], "v": "v0.6"}
{"i": [["[\"batch_norm\", 1, 56, 56, 256]", "cuda -keys=cuda,gpu -max_num_threads=1024 -model=unknown -thread_warp_size=32", [-1, 16, 64, 49152, 2147483647, 1024, 8, 32], "", 0, []], [[], [["CI", 2], ["FU", 4, [0, 1, 2, 3]], ["SP", 4, 0, 802816, [7], 1], ["AN", 4, 0, 5], ["AN", 4, 1, 6]]]], "r": [[8.77003e-05, 8.77237e-05, 8.77012e-05], 0, 1.33836, 1667896718], "v": "v0.6"}
{"i": [["[\"batch_norm\", 1, 56, 56, 256]", "cuda -keys=cuda,gpu -max_num_threads=1024 -model=unknown -thread_warp_size=32", [-1, 16, 64, 49152, 2147483647, 1024, 8, 32], "", 0, []], [[], [["CI", 2], ["FU", 4, [0, 1, 2, 3]], ["SP", 4, 0, 802816, [16], 1], ["AN", 4, 0, 5], ["AN", 4, 1, 6]]]], "r": [[3.98e-05, 3.98079e-05, 3.98067e-05], 0, 0.592479, 1667896717], "v": "v0.6"}
{"i": [["[\"batch_norm\", 1, 56, 56, 256]", "cuda -keys=cuda,gpu -max_num_threads=1024 -model=unknown -thread_warp_size=32", [-1, 16, 64, 49152, 2147483647, 1024, 8, 32], "", 0, []], [[], [["CI", 2], ["FU", 4, [0, 1, 2, 3]], ["SP", 4, 0, 802816, [28], 1], ["AN", 4, 0, 5], ["AN", 4, 1, 6]]]], "r": [[2.41443e-05, 2.41363e-05, 2.41438e-05], 0, 2.42753, 1667896719], "v": "v0.6"}
{"i": [["[\"batch_norm\", 1, 56, 56, 256]", "cuda -keys=cuda,gpu -max_num_threads=1024 -model=unknown -thread_warp_size=32", [-1, 16, 64, 49152, 2147483647, 1024, 8, 32], "", 0, []], [[], [["CI", 2], ["FU", 4, [0, 1, 2, 3]], ["SP", 4, 0, 802816, [2], 1], ["AN", 4, 0, 5], ["AN", 4, 1, 6]]]], "r": [[0.000300358, 0.000300383, 0.000300397], 0, 2.83106, 1667896719], "v": "v0.6"}
{"i": [["[\"batch_norm\", 1, 56, 56, 256]", "cuda -keys=cuda,gpu -max_num_threads=1024 -model=unknown -thread_warp_size=32", [-1, 16, 64, 49152, 2147483647, 1024, 8, 32], "", 0, []], [[], [["CI", 2], ["FU", 4, [0, 1, 2, 3]], ["SP", 4, 0, 802816, [4], 1], ["AN", 4, 0, 5], ["AN", 4, 1, 6]]]], "r": [[0.0001516, 0.000151573, 0.000151608], 0, 3.18641, 1667896720], "v": "v0.6"}
{"i": [["[\"batch_norm\", 1, 56, 56, 256]", "cuda -keys=cuda,gpu -max_num_threads=1024 -model=unknown -thread_warp_size=32", [-1, 16, 64, 49152, 2147483647, 1024, 8, 32], "", 0, []], [[], [["CI", 2], ["FU", 4, [0, 1, 2, 3]], ["SP", 4, 0, 802816, [32], 1], ["AN", 4, 0, 5], ["AN", 4, 1, 6]]]], "r": [[2.14533e-05, 2.14533e-05, 2.14433e-05], 0, 4.29408, 1667896721], "v": "v0.6"}
{"i": [["[\"batch_norm\", 1, 56, 56, 256]", "cuda -keys=cuda,gpu -max_num_threads=1024 -model=unknown -thread_warp_size=32", [-1, 16, 64, 49152, 2147483647, 1024, 8, 32], "", 0, []], [[], [["CI", 2], ["FU", 4, [0, 1, 2, 3]], ["SP", 4, 0, 802816, [8], 1], ["AN", 4, 0, 5], ["AN", 4, 1, 6]]]], "r": [[7.71103e-05, 7.71051e-05, 7.71189e-05], 0, 3.91859, 1667896720], "v": "v0.6"}
{"i": [["[\"batch_norm\", 1, 56, 56, 256]", "cuda -keys=cuda,gpu -max_num_threads=1024 -model=unknown -thread_warp_size=32", [-1, 16, 64, 49152, 2147483647, 1024, 8, 32], "", 0, []], [[], [["CI", 2], ["FU", 4, [0, 1, 2, 3]], ["SP", 4, 0, 802816, [56], 1], ["AN", 4, 0, 5], ["AN", 4, 1, 6]]]], "r": [[1.32775e-05, 1.32757e-05, 1.32784e-05], 0, 4.64889, 1667896721], "v": "v0.6"}
{"i": [["[\"batch_norm\", 1, 56, 56, 256]", "cuda -keys=cuda,gpu -max_num_threads=1024 -model=unknown -thread_warp_size=32", [-1, 16, 64, 49152, 2147483647, 1024, 8, 32], "", 0, []], [[], [["CI", 2], ["FU", 4, [0, 1, 2, 3]], ["SP", 4, 0, 802816, [1], 1], ["AN", 4, 0, 5], ["AN", 4, 1, 6]]]], "r": [[0.000598093, 0.000598067, 0.000598048], 0, 3.51087, 1667896720], "v": "v0.6"}
{"i": [["[\"batch_norm\", 1, 56, 56, 256]", "cuda -keys=cuda,gpu -max_num_threads=1024 -model=unknown -thread_warp_size=32", [-1, 16, 64, 49152, 2147483647, 1024, 8, 32], "", 0, []], [[], [["CI", 2], ["FU", 4, [0, 1, 2, 3]], ["SP", 4, 0, 802816, [16], 1], ["AN", 4, 0, 5], ["AN", 4, 1, 6]]]], "r": [[3.98545e-05, 3.98651e-05, 3.98568e-05], 0, 2.07467, 1667905378], "v": "v0.6"}
{"i": [["[\"batch_norm\", 1, 56, 56, 256]", "cuda -keys=cuda,gpu -max_num_threads=1024 -model=unknown -thread_warp_size=32", [-1, 16, 64, 49152, 2147483647, 1024, 8, 32], "", 0, []], [[], [["CI", 2], ["FU", 4, [0, 1, 2, 3]], ["SP", 4, 0, 802816, [28], 1], ["AN", 4, 0, 5], ["AN", 4, 1, 6]]]], "r": [[2.40905e-05, 2.40822e-05, 2.40927e-05], 0, 2.49911, 1667905379], "v": "v0.6"}
{"i": [["[\"batch_norm\", 1, 56, 56, 256]", "cuda -keys=cuda,gpu -max_num_threads=1024 -model=unknown -thread_warp_size=32", [-1, 16, 64, 49152, 2147483647, 1024, 8, 32], "", 0, []], [[], [["CI", 2], ["FU", 4, [0, 1, 2, 3]], ["SP", 4, 0, 802816, [49], 1], ["AN", 4, 0, 5], ["AN", 4, 1, 6]]]], "r": [[1.47731e-05, 1.477e-05, 1.47633e-05], 0, 1.55492, 1667905378], "v": "v0.6"}
{"i": [["[\"batch_norm\", 1, 56, 56, 256]", "cuda -keys=cuda,gpu -max_num_threads=1024 -model=unknown -thread_warp_size=32", [-1, 16, 64, 49152, 2147483647, 1024, 8, 32], "", 0, []], [[], [["CI", 2], ["FU", 4, [0, 1, 2, 3]], ["SP", 4, 0, 802816, [56], 1], ["AN", 4, 0, 5], ["AN", 4, 1, 6]]]], "r": [[1.34103e-05, 1.33964e-05, 1.34143e-05], 0, 0.748161, 1667905377], "v": "v0.6"}
{"i": [["[\"batch_norm\", 1, 56, 56, 256]", "cuda -keys=cuda,gpu -max_num_threads=1024 -model=unknown -thread_warp_size=32", [-1, 16, 64, 49152, 2147483647, 1024, 8, 32], "", 0, []], [[], [["CI", 2], ["FU", 4, [0, 1, 2, 3]], ["SP", 4, 0, 802816, [7], 1], ["AN", 4, 0, 5], ["AN", 4, 1, 6]]]], "r": [[8.77224e-05, 8.77277e-05, 8.77273e-05], 0, 2.93962, 1667905379], "v": "v0.6"}
{"i": [["[\"batch_norm\", 1, 56, 56, 256]", "cuda -keys=cuda,gpu -max_num_threads=1024 -model=unknown -thread_warp_size=32", [-1, 16, 64, 49152, 2147483647, 1024, 8, 32], "", 0, []], [[], [["CI", 2], ["FU", 4, [0, 1, 2, 3]], ["SP", 4, 0, 802816, [64], 1], ["AN", 4, 0, 5], ["AN", 4, 1, 6]]]], "r": [[1.19024e-05, 1.1887e-05, 1.18889e-05], 0, 1.15404, 1667905377], "v": "v0.6"}
{"i": [["[\"batch_norm\", 1, 56, 56, 256]", "cuda -keys=cuda,gpu -max_num_threads=1024 -model=unknown -thread_warp_size=32", [-1, 16, 64, 49152, 2147483647, 1024, 8, 32], "", 0, []], [[], [["CI", 2], ["FU", 4, [0, 1, 2, 3]], ["SP", 4, 0, 802816, [1], 1], ["AN", 4, 0, 5], ["AN", 4, 1, 6]]]], "r": [[0.000598236, 0.000598161, 0.000598156], 0, 3.4401, 1667905380], "v": "v0.6"}
{"i": [["[\"batch_norm\", 1, 56, 56, 256]", "cuda -keys=cuda,gpu -max_num_threads=1024 -model=unknown -thread_warp_size=32", [-1, 16, 64, 49152, 2147483647, 1024, 8, 32], "", 0, []], [[], [["CI", 2], ["FU", 4, [0, 1, 2, 3]], ["SP", 4, 0, 802816, [32], 1], ["AN", 4, 0, 5], ["AN", 4, 1, 6]]]], "r": [[2.14647e-05, 2.14761e-05, 2.14572e-05], 0, 4.27547, 1667905381], "v": "v0.6"}
{"i": [["[\"batch_norm\", 1, 56, 56, 256]", "cuda -keys=cuda,gpu -max_num_threads=1024 -model=unknown -thread_warp_size=32", [-1, 16, 64, 49152, 2147483647, 1024, 8, 32], "", 0, []], [[], [["CI", 2], ["FU", 4, [0, 1, 2, 3]], ["SP", 4, 0, 802816, [2], 1], ["AN", 4, 0, 5], ["AN", 4, 1, 6]]]], "r": [[0.00030043, 0.000300461, 0.000300426], 0, 3.87554, 1667905380], "v": "v0.6"}
{"i": [["[\"batch_norm\", 1, 56, 56, 256]", "cuda -keys=cuda,gpu -max_num_threads=1024 -model=unknown -thread_warp_size=32", [-1, 16, 64, 49152, 2147483647, 1024, 8, 32], "", 0, []], [[], [["CI", 2], ["FU", 4, [0, 1, 2, 3]], ["SP", 4, 0, 802816, [14], 1], ["AN", 4, 0, 5], ["AN", 4, 1, 6]]]], "r": [[4.53537e-05, 4.53457e-05, 4.53336e-05], 0, 5.53754, 1667905382], "v": "v0.6"}
{"i": [["[\"batch_norm\", 1, 56, 56, 256]", "cuda -keys=cuda,gpu -max_num_threads=1024 -model=unknown -thread_warp_size=32", [-1, 16, 64, 49152, 2147483647, 1024, 8, 32], "", 0, []], [[], [["CI", 2], ["FU", 4, [0, 1, 2, 3]], ["SP", 4, 0, 802816, [8], 1], ["AN", 4, 0, 5], ["AN", 4, 1, 6]]]], "r": [[7.7101e-05, 7.7105e-05, 7.70784e-05], 0, 4.78768, 1667905381], "v": "v0.6"}
{"i": [["[\"batch_norm\", 1, 56, 56, 256]", "cuda -keys=cuda,gpu -max_num_threads=1024 -model=unknown -thread_warp_size=32", [-1, 16, 64, 49152, 2147483647, 1024, 8, 32], "", 0, []], [[], [["CI", 2], ["FU", 4, [0, 1, 2, 3]], ["SP", 4, 0, 802816, [4], 1], ["AN", 4, 0, 5], ["AN", 4, 1, 6]]]], "r": [[0.000151641, 0.000151632, 0.000151656], 0, 5.15677, 1667905382], "v": "v0.6"}
{"i": [["[\"batch_norm\", 1, 56, 56, 256]", "cuda -keys=cuda,gpu -max_num_threads=1024 -model=unknown -thread_warp_size=32", [-1, 16, 64, 49152, 2147483647, 1024, 8, 32], "", 0, []], [[], [["CI", 2], ["FU", 4, [0, 1, 2, 3]], ["SP", 4, 0, 802816, [4], 1], ["AN", 4, 0, 5], ["AN", 4, 1, 6]]]], "r": [[0.000151579, 0.000151562, 0.000151572], 0, 1.16504, 1667906629], "v": "v0.6"}
{"i": [["[\"batch_norm\", 1, 56, 56, 256]", "cuda -keys=cuda,gpu -max_num_threads=1024 -model=unknown -thread_warp_size=32", [-1, 16, 64, 49152, 2147483647, 1024, 8, 32], "", 0, []], [[], [["CI", 2], ["FU", 4, [0, 1, 2, 3]], ["SP", 4, 0, 802816, [64], 1], ["AN", 4, 0, 5], ["AN", 4, 1, 6]]]], "r": [[1.18791e-05, 1.18741e-05, 1.18805e-05], 0, 2.47446, 1667906630], "v": "v0.6"}
{"i": [["[\"batch_norm\", 1, 56, 56, 256]", "cuda -keys=cuda,gpu -max_num_threads=1024 -model=unknown -thread_warp_size=32", [-1, 16, 64, 49152, 2147483647, 1024, 8, 32], "", 0, []], [[], [["CI", 2], ["FU", 4, [0, 1, 2, 3]], ["SP", 4, 0, 802816, [49], 1], ["AN", 4, 0, 5], ["AN", 4, 1, 6]]]], "r": [[1.47946e-05, 1.47949e-05, 1.47906e-05], 0, 1.59012, 1667906629], "v": "v0.6"}
{"i": [["[\"batch_norm\", 1, 56, 56, 256]", "cuda -keys=cuda,gpu -max_num_threads=1024 -model=unknown -thread_warp_size=32", [-1, 16, 64, 49152, 2147483647, 1024, 8, 32], "", 0, []], [[], [["CI", 2], ["FU", 4, [0, 1, 2, 3]], ["SP", 4, 0, 802816, [7], 1], ["AN", 4, 0, 5], ["AN", 4, 1, 6]]]], "r": [[8.77327e-05, 8.77376e-05, 8.77508e-05], 0, 0.742318, 1667906628], "v": "v0.6"}
{"i": [["[\"batch_norm\", 1, 56, 56, 256]", "cuda -keys=cuda,gpu -max_num_threads=1024 -model=unknown -thread_warp_size=32", [-1, 16, 64, 49152, 2147483647, 1024, 8, 32], "", 0, []], [[], [["CI", 2], ["FU", 4, [0, 1, 2, 3]], ["SP", 4, 0, 802816, [1], 1], ["AN", 4, 0, 5], ["AN", 4, 1, 6]]]], "r": [[0.000598032, 0.000598059, 0.000598097], 0, 2.87183, 1667906631], "v": "v0.6"}
{"i": [["[\"batch_norm\", 1, 56, 56, 256]", "cuda -keys=cuda,gpu -max_num_threads=1024 -model=unknown -thread_warp_size=32", [-1, 16, 64, 49152, 2147483647, 1024, 8, 32], "", 0, []], [[], [["CI", 2], ["FU", 4, [0, 1, 2, 3]], ["SP", 4, 0, 802816, [16], 1], ["AN", 4, 0, 5], ["AN", 4, 1, 6]]]], "r": [[3.9938e-05, 3.99501e-05, 3.99325e-05], 0, 2.0565, 1667906630], "v": "v0.6"}
{"i": [["[\"batch_norm\", 1, 56, 56, 256]", "cuda -keys=cuda,gpu -max_num_threads=1024 -model=unknown -thread_warp_size=32", [-1, 16, 64, 49152, 2147483647, 1024, 8, 32], "", 0, []], [[], [["CI", 2], ["FU", 4, [0, 1, 2, 3]], ["SP", 4, 0, 802816, [14], 1], ["AN", 4, 0, 5], ["AN", 4, 1, 6]]]], "r": [[4.51718e-05, 4.51776e-05, 4.51746e-05], 0, 4.18067, 1667906632], "v": "v0.6"}
{"i": [["[\"batch_norm\", 1, 56, 56, 256]", "cuda -keys=cuda,gpu -max_num_threads=1024 -model=unknown -thread_warp_size=32", [-1, 16, 64, 49152, 2147483647, 1024, 8, 32], "", 0, []], [[], [["CI", 2], ["FU", 4, [0, 1, 2, 3]], ["SP", 4, 0, 802816, [2], 1], ["AN", 4, 0, 5], ["AN", 4, 1, 6]]]], "r": [[0.00030047, 0.000300494, 0.0003004], 0, 3.74306, 1667906631], "v": "v0.6"}
{"i": [["[\"batch_norm\", 1, 56, 56, 256]", "cuda -keys=cuda,gpu -max_num_threads=1024 -model=unknown -thread_warp_size=32", [-1, 16, 64, 49152, 2147483647, 1024, 8, 32], "", 0, []], [[], [["CI", 2], ["FU", 4, [0, 1, 2, 3]], ["SP", 4, 0, 802816, [8], 1], ["AN", 4, 0, 5], ["AN", 4, 1, 6]]]], "r": [[7.71981e-05, 7.72021e-05, 7.71891e-05], 0, 3.34947, 1667906631], "v": "v0.6"}
{"i": [["[\"batch_norm\", 1, 56, 56, 256]", "cuda -keys=cuda,gpu -max_num_threads=1024 -model=unknown -thread_warp_size=32", [-1, 16, 64, 49152, 2147483647, 1024, 8, 32], "", 0, []], [[], [["CI", 2], ["FU", 4, [0, 1, 2, 3]], ["SP", 4, 0, 802816, [28], 1], ["AN", 4, 0, 5], ["AN", 4, 1, 6]]]], "r": [[2.39659e-05, 2.39756e-05, 2.39705e-05], 0, 4.63668, 1667906632], "v": "v0.6"}
{"i": [["[\"batch_norm\", 1, 56, 56, 256]", "cuda -keys=cuda,gpu -max_num_threads=1024 -model=unknown -thread_warp_size=32", [-1, 16, 64, 49152, 2147483647, 1024, 8, 32], "", 0, []], [[], [["CI", 2], ["FU", 4, [0, 1, 2, 3]], ["SP", 4, 0, 802816, [56], 1], ["AN", 4, 0, 5], ["AN", 4, 1, 6]]]], "r": [[1.33395e-05, 1.33413e-05, 1.33374e-05], 0, 5.23032, 1667906633], "v": "v0.6"}
{"i": [["[\"batch_norm\", 1, 56, 56, 256]", "cuda -keys=cuda,gpu -max_num_threads=1024 -model=unknown -thread_warp_size=32", [-1, 16, 64, 49152, 2147483647, 1024, 8, 32], "", 0, []], [[], [["CI", 2], ["FU", 4, [0, 1, 2, 3]], ["SP", 4, 0, 802816, [32], 1], ["AN", 4, 0, 5], ["AN", 4, 1, 6]]]], "r": [[2.15148e-05, 2.15257e-05, 2.15125e-05], 0, 5.63052, 1667906633], "v": "v0.6"}
{"i": [["[\"batch_norm\", 1, 56, 56, 256]", "cuda -keys=cuda,gpu -max_num_threads=1024 -model=unknown -thread_warp_size=32", [-1, 16, 64, 49152, 2147483647, 1024, 8, 32], "", 0, []], [[], [["CI", 2], ["FU", 4, [0, 1, 2, 3]], ["SP", 4, 0, 802816, [1], 1], ["AN", 4, 0, 5], ["AN", 4, 1, 6]]]], "r": [[0.000598105, 0.000598042, 0.000598043], 0, 2.72442, 1667957114], "v": "v0.6"}
{"i": [["[\"batch_norm\", 1, 56, 56, 256]", "cuda -keys=cuda,gpu -max_num_threads=1024 -model=unknown -thread_warp_size=32", [-1, 16, 64, 49152, 2147483647, 1024, 8, 32], "", 0, []], [[], [["CI", 2], ["FU", 4, [0, 1, 2, 3]], ["SP", 4, 0, 802816, [8], 1], ["AN", 4, 0, 5], ["AN", 4, 1, 6]]]], "r": [[7.70795e-05, 7.70745e-05, 7.7079e-05], 0, 1.27027, 1667957113], "v": "v0.6"}
{"i": [["[\"batch_norm\", 1, 56, 56, 256]", "cuda -keys=cuda,gpu -max_num_threads=1024 -model=unknown -thread_warp_size=32", [-1, 16, 64, 49152, 2147483647, 1024, 8, 32], "", 0, []], [[], [["CI", 2], ["FU", 4, [0, 1, 2, 3]], ["SP", 4, 0, 802816, [4], 1], ["AN", 4, 0, 5], ["AN", 4, 1, 6]]]], "r": [[0.000151607, 0.000151581, 0.000151575], 0, 1.99651, 1667957114], "v": "v0.6"}
{"i": [["[\"batch_norm\", 1, 56, 56, 256]", "cuda -keys=cuda,gpu -max_num_threads=1024 -model=unknown -thread_warp_size=32", [-1, 16, 64, 49152, 2147483647, 1024, 8, 32], "", 0, []], [[], [["CI", 2], ["FU", 4, [0, 1, 2, 3]], ["SP", 4, 0, 802816, [16], 1], ["AN", 4, 0, 5], ["AN", 4, 1, 6]]]], "r": [[3.97971e-05, 3.97965e-05, 3.97963e-05], 0, 1.66317, 1667957113], "v": "v0.6"}
{"i": [["[\"batch_norm\", 1, 56, 56, 256]", "cuda -keys=cuda,gpu -max_num_threads=1024 -model=unknown -thread_warp_size=32", [-1, 16, 64, 49152, 2147483647, 1024, 8, 32], "", 0, []], [[], [["CI", 2], ["FU", 4, [0, 1, 2, 3]], ["SP", 4, 0, 802816, [32], 1], ["AN", 4, 0, 5], ["AN", 4, 1, 6]]]], "r": [[2.1339e-05, 2.1337e-05, 2.13385e-05], 0, 0.918294, 1667957112], "v": "v0.6"}
{"i": [["[\"batch_norm\", 1, 56, 56, 256]", "cuda -keys=cuda,gpu -max_num_threads=1024 -model=unknown -thread_warp_size=32", [-1, 16, 64, 49152, 2147483647, 1024, 8, 32], "", 0, []], [[], [["CI", 2], ["FU", 4, [0, 1, 2, 3]], ["SP", 4, 0, 802816, [49], 1], ["AN", 4, 0, 5], ["AN", 4, 1, 6]]]], "r": [[1.47864e-05, 1.47794e-05, 1.47716e-05], 0, 0.568248, 1667957112], "v": "v0.6"}
{"i": [["[\"batch_norm\", 1, 56, 56, 256]", "cuda -keys=cuda,gpu -max_num_threads=1024 -model=unknown -thread_warp_size=32", [-1, 16, 64, 49152, 2147483647, 1024, 8, 32], "", 0, []], [[], [["CI", 2], ["FU", 4, [0, 1, 2, 3]], ["SP", 4, 0, 802816, [7], 1], ["AN", 4, 0, 5], ["AN", 4, 1, 6]]]], "r": [[8.76911e-05, 8.76977e-05, 8.77015e-05], 0, 2.35184, 1667957114], "v": "v0.6"}
{"i": [["[\"batch_norm\", 1, 56, 56, 256]", "cuda -keys=cuda,gpu -max_num_threads=1024 -model=unknown -thread_warp_size=32", [-1, 16, 64, 49152, 2147483647, 1024, 8, 32], "", 0, []], [[], [["CI", 2], ["FU", 4, [0, 1, 2, 3]], ["SP", 4, 0, 802816, [56], 1], ["AN", 4, 0, 5], ["AN", 4, 1, 6]]]], "r": [[1.33727e-05, 1.33777e-05, 1.33699e-05], 0, 3.05025, 1667957115], "v": "v0.6"}
{"i": [["[\"batch_norm\", 1, 56, 56, 256]", "cuda -keys=cuda,gpu -max_num_threads=1024 -model=unknown -thread_warp_size=32", [-1, 16, 64, 49152, 2147483647, 1024, 8, 32], "", 0, []], [[], [["CI", 2], ["FU", 4, [0, 1, 2, 3]], ["SP", 4, 0, 802816, [28], 1], ["AN", 4, 0, 5], ["AN", 4, 1, 6]]]], "r": [[2.41873e-05, 2.41889e-05, 2.41853e-05], 0, 3.40191, 1667957115], "v": "v0.6"}
{"i": [["[\"batch_norm\", 1, 56, 56, 256]", "cuda -keys=cuda,gpu -max_num_threads=1024 -model=unknown -thread_warp_size=32", [-1, 16, 64, 49152, 2147483647, 1024, 8, 32], "", 0, []], [[], [["CI", 2], ["FU", 4, [0, 1, 2, 3]], ["SP", 4, 0, 802816, [14], 1], ["AN", 4, 0, 5], ["AN", 4, 1, 6]]]], "r": [[4.52138e-05, 4.52266e-05, 4.51992e-05], 0, 3.76695, 1667957115], "v": "v0.6"}
{"i": [["[\"batch_norm\", 1, 56, 56, 256]", "cuda -keys=cuda,gpu -max_num_threads=1024 -model=unknown -thread_warp_size=32", [-1, 16, 64, 49152, 2147483647, 1024, 8, 32], "", 0, []], [[], [["CI", 2], ["FU", 4, [0, 1, 2, 3]], ["SP", 4, 0, 802816, [2], 1], ["AN", 4, 0, 5], ["AN", 4, 1, 6]]]], "r": [[0.00030039, 0.000300407, 0.000300392], 0, 4.07424, 1667957116], "v": "v0.6"}
{"i": [["[\"batch_norm\", 1, 56, 56, 256]", "cuda -keys=cuda,gpu -max_num_threads=1024 -model=unknown -thread_warp_size=32", [-1, 16, 64, 49152, 2147483647, 1024, 8, 32], "", 0, []], [[], [["CI", 2], ["FU", 4, [0, 1, 2, 3]], ["SP", 4, 0, 802816, [64], 1], ["AN", 4, 0, 5], ["AN", 4, 1, 6]]]], "r": [[1.19021e-05, 1.18979e-05, 1.19065e-05], 0, 4.42329, 1667957116], "v": "v0.6"}
{"i": [["[\"batch_norm\", 1, 56, 56, 256]", "cuda -keys=cuda,gpu -max_num_threads=1024 -model=unknown -thread_warp_size=32", [-1, 16, 64, 49152, 2147483647, 1024, 8, 32], "", 0, []], [[], [["CI", 2], ["FU", 4, [0, 1, 2, 3]], ["SP", 4, 0, 802816, [7], 1], ["AN", 4, 0, 5], ["AN", 4, 1, 6]]]], "r": [[8.77378e-05, 8.77177e-05, 8.77474e-05], 0, 0.55446, 1667957134], "v": "v0.6"}
{"i": [["[\"batch_norm\", 1, 56, 56, 256]", "cuda -keys=cuda,gpu -max_num_threads=1024 -model=unknown -thread_warp_size=32", [-1, 16, 64, 49152, 2147483647, 1024, 8, 32], "", 0, []], [[], [["CI", 2], ["FU", 4, [0, 1, 2, 3]], ["SP", 4, 0, 802816, [56], 1], ["AN", 4, 0, 5], ["AN", 4, 1, 6]]]], "r": [[1.32791e-05, 1.32752e-05, 1.32603e-05], 0, 1.92135, 1667957136], "v": "v0.6"}
{"i": [["[\"batch_norm\", 1, 56, 56, 256]", "cuda -keys=cuda,gpu -max_num_threads=1024 -model=unknown -thread_warp_size=32", [-1, 16, 64, 49152, 2147483647, 1024, 8, 32], "", 0, []], [[], [["CI", 2], ["FU", 4, [0, 1, 2, 3]], ["SP", 4, 0, 802816, [4], 1], ["AN", 4, 0, 5], ["AN", 4, 1, 6]]]], "r": [[0.0001516, 0.000151618, 0.000151615], 0, 0.880535, 1667957134], "v": "v0.6"}
{"i": [["[\"batch_norm\", 1, 56, 56, 256]", "cuda -keys=cuda,gpu -max_num_threads=1024 -model=unknown -thread_warp_size=32", [-1, 16, 64, 49152, 2147483647, 1024, 8, 32], "", 0, []], [[], [["CI", 2], ["FU", 4, [0, 1, 2, 3]], ["SP", 4, 0, 802816, [2], 1], ["AN", 4, 0, 5], ["AN", 4, 1, 6]]]], "r": [[0.000300486, 0.000300538, 0.000300496], 0, 1.58026, 1667957135], "v": "v0.6"}
{"i": [["[\"batch_norm\", 1, 56, 56, 256]", "cuda -keys=cuda,gpu -max_num_threads=1024 -model=unknown -thread_warp_size=32", [-1, 16, 64, 49152, 2147483647, 1024, 8, 32], "", 0, []], [[], [["CI", 2], ["FU", 4, [0, 1, 2, 3]], ["SP", 4, 0, 802816, [14], 1], ["AN", 4, 0, 5], ["AN", 4, 1, 6]]]], "r": [[4.52568e-05, 4.52413e-05, 4.52261e-05], 0, 2.25056, 1667957136], "v": "v0.6"}
{"i": [["[\"batch_norm\", 1, 56, 56, 256]", "cuda -keys=cuda,gpu -max_num_threads=1024 -model=unknown -thread_warp_size=32", [-1, 16, 64, 49152, 2147483647, 1024, 8, 32], "", 0, []], [[], [["CI", 2], ["FU", 4, [0, 1, 2, 3]], ["SP", 4, 0, 802816, [1], 1], ["AN", 4, 0, 5], ["AN", 4, 1, 6]]]], "r": [[0.000598045, 0.000598013, 0.000598077], 0, 1.21327, 1667957135], "v": "v0.6"}
{"i": [["[\"batch_norm\", 1, 56, 56, 256]", "cuda -keys=cuda,gpu -max_num_threads=1024 -model=unknown -thread_warp_size=32", [-1, 16, 64, 49152, 2147483647, 1024, 8, 32], "", 0, []], [[], [["CI", 2], ["FU", 4, [0, 1, 2, 3]], ["SP", 4, 0, 802816, [32], 1], ["AN", 4, 0, 5], ["AN", 4, 1, 6]]]], "r": [[2.13751e-05, 2.13579e-05, 2.13672e-05], 0, 2.62222, 1667957136], "v": "v0.6"}
{"i": [["[\"batch_norm\", 1, 56, 56, 256]", "cuda -keys=cuda,gpu -max_num_threads=1024 -model=unknown -thread_warp_size=32", [-1, 16, 64, 49152, 2147483647, 1024, 8, 32], "", 0, []], [[], [["CI", 2], ["FU", 4, [0, 1, 2, 3]], ["SP", 4, 0, 802816, [49], 1], ["AN", 4, 0, 5], ["AN", 4, 1, 6]]]], "r": [[1.48088e-05, 1.48112e-05, 1.47979e-05], 0, 2.96159, 1667957137], "v": "v0.6"}
{"i": [["[\"batch_norm\", 1, 56, 56, 256]", "cuda -keys=cuda,gpu -max_num_threads=1024 -model=unknown -thread_warp_size=32", [-1, 16, 64, 49152, 2147483647, 1024, 8, 32], "", 0, []], [[], [["CI", 2], ["FU", 4, [0, 1, 2, 3]], ["SP", 4, 0, 802816, [8], 1], ["AN", 4, 0, 5], ["AN", 4, 1, 6]]]], "r": [[7.70621e-05, 7.70546e-05, 7.70574e-05], 0, 3.67811, 1667957137], "v": "v0.6"}
{"i": [["[\"batch_norm\", 1, 56, 56, 256]", "cuda -keys=cuda,gpu -max_num_threads=1024 -model=unknown -thread_warp_size=32", [-1, 16, 64, 49152, 2147483647, 1024, 8, 32], "", 0, []], [[], [["CI", 2], ["FU", 4, [0, 1, 2, 3]], ["SP", 4, 0, 802816, [64], 1], ["AN", 4, 0, 5], ["AN", 4, 1, 6]]]], "r": [[1.19246e-05, 1.19251e-05, 1.19215e-05], 0, 3.29297, 1667957137], "v": "v0.6"}
{"i": [["[\"batch_norm\", 1, 56, 56, 256]", "cuda -keys=cuda,gpu -max_num_threads=1024 -model=unknown -thread_warp_size=32", [-1, 16, 64, 49152, 2147483647, 1024, 8, 32], "", 0, []], [[], [["CI", 2], ["FU", 4, [0, 1, 2, 3]], ["SP", 4, 0, 802816, [28], 1], ["AN", 4, 0, 5], ["AN", 4, 1, 6]]]], "r": [[2.39732e-05, 2.39725e-05, 2.39713e-05], 0, 4.34561, 1667957138], "v": "v0.6"}
{"i": [["[\"batch_norm\", 1, 56, 56, 256]", "cuda -keys=cuda,gpu -max_num_threads=1024 -model=unknown -thread_warp_size=32", [-1, 16, 64, 49152, 2147483647, 1024, 8, 32], "", 0, []], [[], [["CI", 2], ["FU", 4, [0, 1, 2, 3]], ["SP", 4, 0, 802816, [16], 1], ["AN", 4, 0, 5], ["AN", 4, 1, 6]]]], "r": [[3.98475e-05, 3.98537e-05, 3.98543e-05], 0, 4.00653, 1667957138], "v": "v0.6"}
{"i": [["[\"batch_norm\", 1, 56, 56, 256]", "cuda -keys=cuda,gpu -max_num_threads=1024 -model=unknown -thread_warp_size=32", [-1, 16, 64, 49152, 2147483647, 1024, 8, 32], "", 0, []], [[], [["CI", 2], ["FU", 4, [0, 1, 2, 3]], ["SP", 4, 0, 802816, [28], 1], ["AN", 4, 0, 5], ["AN", 4, 1, 6]]]], "r": [[2.40182e-05, 2.40193e-05, 2.40141e-05], 0, 1.95868, 1667958063], "v": "v0.6"}
{"i": [["[\"batch_norm\", 1, 56, 56, 256]", "cuda -keys=cuda,gpu -max_num_threads=1024 -model=unknown -thread_warp_size=32", [-1, 16, 64, 49152, 2147483647, 1024, 8, 32], "", 0, []], [[], [["CI", 2], ["FU", 4, [0, 1, 2, 3]], ["SP", 4, 0, 802816, [14], 1], ["AN", 4, 0, 5], ["AN", 4, 1, 6]]]], "r": [[4.51768e-05, 4.51727e-05, 4.51715e-05], 0, 1.22621, 1667958062], "v": "v0.6"}
{"i": [["[\"batch_norm\", 1, 56, 56, 256]", "cuda -keys=cuda,gpu -max_num_threads=1024 -model=unknown -thread_warp_size=32", [-1, 16, 64, 49152, 2147483647, 1024, 8, 32], "", 0, []], [[], [["CI", 2], ["FU", 4, [0, 1, 2, 3]], ["SP", 4, 0, 802816, [4], 1], ["AN", 4, 0, 5], ["AN", 4, 1, 6]]]], "r": [[0.000151562, 0.000151559, 0.00015155], 0, 0.883418, 1667958062], "v": "v0.6"}
{"i": [["[\"batch_norm\", 1, 56, 56, 256]", "cuda -keys=cuda,gpu -max_num_threads=1024 -model=unknown -thread_warp_size=32", [-1, 16, 64, 49152, 2147483647, 1024, 8, 32], "", 0, []], [[], [["CI", 2], ["FU", 4, [0, 1, 2, 3]], ["SP", 4, 0, 802816, [16], 1], ["AN", 4, 0, 5], ["AN", 4, 1, 6]]]], "r": [[3.99598e-05, 3.99581e-05, 3.99652e-05], 0, 0.556385, 1667958062], "v": "v0.6"}
{"i": [["[\"batch_norm\", 1, 56, 56, 256]", "cuda -keys=cuda,gpu -max_num_threads=1024 -model=unknown -thread_warp_size=32", [-1, 16, 64, 49152, 2147483647, 1024, 8, 32], "", 0, []], [[], [["CI", 2], ["FU", 4, [0, 1, 2, 3]], ["SP", 4, 0, 802816, [8], 1], ["AN", 4, 0, 5], ["AN", 4, 1, 6]]]], "r": [[7.71892e-05, 7.71604e-05, 7.71638e-05], 0, 1.61897, 1667958063], "v": "v0.6"}
{"i": [["[\"batch_norm\", 1, 56, 56, 256]", "cuda -keys=cuda,gpu -max_num_threads=1024 -model=unknown -thread_warp_size=32", [-1, 16, 64, 49152, 2147483647, 1024, 8, 32], "", 0, []], [[], [["CI", 2], ["FU", 4, [0, 1, 2, 3]], ["SP", 4, 0, 802816, [7], 1], ["AN", 4, 0, 5], ["AN", 4, 1, 6]]]], "r": [[8.76825e-05, 8.76756e-05, 8.76749e-05], 0, 2.29772, 1667958063], "v": "v0.6"}
{"i": [["[\"batch_norm\", 1, 56, 56, 256]", "cuda -keys=cuda,gpu -max_num_threads=1024 -model=unknown -thread_warp_size=32", [-1, 16, 64, 49152, 2147483647, 1024, 8, 32], "", 0, []], [[], [["CI", 2], ["FU", 4, [0, 1, 2, 3]], ["SP", 4, 0, 802816, [49], 1], ["AN", 4, 0, 5], ["AN", 4, 1, 6]]]], "r": [[1.49212e-05, 1.48944e-05, 1.49031e-05], 0, 2.63029, 1667958064], "v": "v0.6"}
{"i": [["[\"batch_norm\", 1, 56, 56, 256]", "cuda -keys=cuda,gpu -max_num_threads=1024 -model=unknown -thread_warp_size=32", [-1, 16, 64, 49152, 2147483647, 1024, 8, 32], "", 0, []], [[], [["CI", 2], ["FU", 4, [0, 1, 2, 3]], ["SP", 4, 0, 802816, [64], 1], ["AN", 4, 0, 5], ["AN", 4, 1, 6]]]], "r": [[1.20467e-05, 1.20381e-05, 1.20366e-05], 0, 2.96623, 1667958064], "v": "v0.6"}
{"i": [["[\"batch_norm\", 1, 56, 56, 256]", "cuda -keys=cuda,gpu -max_num_threads=1024 -model=unknown -thread_warp_size=32", [-1, 16, 64, 49152, 2147483647, 1024, 8, 32], "", 0, []], [[], [["CI", 2], ["FU", 4, [0, 1, 2, 3]], ["SP", 4, 0, 802816, [56], 1], ["AN", 4, 0, 5], ["AN", 4, 1, 6]]]], "r": [[1.327e-05, 1.32767e-05, 1.32584e-05], 0, 4.31956, 1667958066], "v": "v0.6"}
{"i": [["[\"batch_norm\", 1, 56, 56, 256]", "cuda -keys=cuda,gpu -max_num_threads=1024 -model=unknown -thread_warp_size=32", [-1, 16, 64, 49152, 2147483647, 1024, 8, 32], "", 0, []], [[], [["CI", 2], ["FU", 4, [0, 1, 2, 3]], ["SP", 4, 0, 802816, [1], 1], ["AN", 4, 0, 5], ["AN", 4, 1, 6]]]], "r": [[0.000598068, 0.000597999, 0.000598009], 0, 3.97852, 1667958065], "v": "v0.6"}
{"i": [["[\"batch_norm\", 1, 56, 56, 256]", "cuda -keys=cuda,gpu -max_num_threads=1024 -model=unknown -thread_warp_size=32", [-1, 16, 64, 49152, 2147483647, 1024, 8, 32], "", 0, []], [[], [["CI", 2], ["FU", 4, [0, 1, 2, 3]], ["SP", 4, 0, 802816, [32], 1], ["AN", 4, 0, 5], ["AN", 4, 1, 6]]]], "r": [[2.14618e-05, 2.14495e-05, 2.14587e-05], 0, 3.66719, 1667958065], "v": "v0.6"}
{"i": [["[\"batch_norm\", 1, 56, 56, 256]", "cuda -keys=cuda,gpu -max_num_threads=1024 -model=unknown -thread_warp_size=32", [-1, 16, 64, 49152, 2147483647, 1024, 8, 32], "", 0, []], [[], [["CI", 2], ["FU", 4, [0, 1, 2, 3]], ["SP", 4, 0, 802816, [2], 1], ["AN", 4, 0, 5], ["AN", 4, 1, 6]]]], "r": [[0.00030049, 0.000300495, 0.000300429], 0, 3.28219, 1667958065], "v": "v0.6"}
{"i": [["[\"batch_norm\", 1, 56, 56, 256]", "cuda -keys=cuda,gpu -max_num_threads=1024 -model=unknown -thread_warp_size=32", [-1, 16, 64, 49152, 2147483647, 1024, 8, 32], "", 0, []], [[], [["CI", 2], ["FU", 4, [0, 1, 2, 3]], ["SP", 4, 0, 802816, [4], 1], ["AN", 4, 0, 5], ["AN", 4, 1, 6]]]], "r": [[0.000151567, 0.000151588, 0.000151557], 0, 2.22211, 1667958170], "v": "v0.6"}
{"i": [["[\"batch_norm\", 1, 56, 56, 256]", "cuda -keys=cuda,gpu -max_num_threads=1024 -model=unknown -thread_warp_size=32", [-1, 16, 64, 49152, 2147483647, 1024, 8, 32], "", 0, []], [[], [["CI", 2], ["FU", 4, [0, 1, 2, 3]], ["SP", 4, 0, 802816, [7], 1], ["AN", 4, 0, 5], ["AN", 4, 1, 6]]]], "r": [[8.76444e-05, 8.76678e-05, 8.76518e-05], 0, 1.9104, 1667958170], "v": "v0.6"}
{"i": [["[\"batch_norm\", 1, 56, 56, 256]", "cuda -keys=cuda,gpu -max_num_threads=1024 -model=unknown -thread_warp_size=32", [-1, 16, 64, 49152, 2147483647, 1024, 8, 32], "", 0, []], [[], [["CI", 2], ["FU", 4, [0, 1, 2, 3]], ["SP", 4, 0, 802816, [2], 1], ["AN", 4, 0, 5], ["AN", 4, 1, 6]]]], "r": [[0.000300344, 0.000300384, 0.000300342], 0, 0.876699, 1667958169], "v": "v0.6"}
{"i": [["[\"batch_norm\", 1, 56, 56, 256]", "cuda -keys=cuda,gpu -max_num_threads=1024 -model=unknown -thread_warp_size=32", [-1, 16, 64, 49152, 2147483647, 1024, 8, 32], "", 0, []], [[], [["CI", 2], ["FU", 4, [0, 1, 2, 3]], ["SP", 4, 0, 802816, [1], 1], ["AN", 4, 0, 5], ["AN", 4, 1, 6]]]], "r": [[0.000598038, 0.000597987, 0.000598001], 0, 1.57304, 1667958170], "v": "v0.6"}
{"i": [["[\"batch_norm\", 1, 56, 56, 256]", "cuda -keys=cuda,gpu -max_num_threads=1024 -model=unknown -thread_warp_size=32", [-1, 16, 64, 49152, 2147483647, 1024, 8, 32], "", 0, []], [[], [["CI", 2], ["FU", 4, [0, 1, 2, 3]], ["SP", 4, 0, 802816, [8], 1], ["AN", 4, 0, 5], ["AN", 4, 1, 6]]]], "r": [[7.70981e-05, 7.70502e-05, 7.70901e-05], 0, 0.551765, 1667958169], "v": "v0.6"}
{"i": [["[\"batch_norm\", 1, 56, 56, 256]", "cuda -keys=cuda,gpu -max_num_threads=1024 -model=unknown -thread_warp_size=32", [-1, 16, 64, 49152, 2147483647, 1024, 8, 32], "", 0, []], [[], [["CI", 2], ["FU", 4, [0, 1, 2, 3]], ["SP", 4, 0, 802816, [49], 1], ["AN", 4, 0, 5], ["AN", 4, 1, 6]]]], "r": [[1.4775e-05, 1.47754e-05, 1.47783e-05], 0, 1.21068, 1667958169], "v": "v0.6"}
{"i": [["[\"batch_norm\", 1, 56, 56, 256]", "cuda -keys=cuda,gpu -max_num_threads=1024 -model=unknown -thread_warp_size=32", [-1, 16, 64, 49152, 2147483647, 1024, 8, 32], "", 0, []], [[], [["CI", 2], ["FU", 4, [0, 1, 2, 3]], ["SP", 4, 0, 802816, [56], 1], ["AN", 4, 0, 5], ["AN", 4, 1, 6]]]], "r": [[1.33776e-05, 1.33909e-05, 1.33873e-05], 0, 2.9359, 1667958171], "v": "v0.6"}
{"i": [["[\"batch_norm\", 1, 56, 56, 256]", "cuda -keys=cuda,gpu -max_num_threads=1024 -model=unknown -thread_warp_size=32", [-1, 16, 64, 49152, 2147483647, 1024, 8, 32], "", 0, []], [[], [["CI", 2], ["FU", 4, [0, 1, 2, 3]], ["SP", 4, 0, 802816, [32], 1], ["AN", 4, 0, 5], ["AN", 4, 1, 6]]]], "r": [[2.13365e-05, 2.13346e-05, 2.1333e-05], 0, 3.27318, 1667958172], "v": "v0.6"}
{"i": [["[\"batch_norm\", 1, 56, 56, 256]", "cuda -keys=cuda,gpu -max_num_threads=1024 -model=unknown -thread_warp_size=32", [-1, 16, 64, 49152, 2147483647, 1024, 8, 32], "", 0, []], [[], [["CI", 2], ["FU", 4, [0, 1, 2, 3]], ["SP", 4, 0, 802816, [28], 1], ["AN", 4, 0, 5], ["AN", 4, 1, 6]]]], "r": [[2.40336e-05, 2.40325e-05, 2.40405e-05], 0, 4.29689, 1667958173], "v": "v0.6"}
{"i": [["[\"batch_norm\", 1, 56, 56, 256]", "cuda -keys=cuda,gpu -max_num_threads=1024 -model=unknown -thread_warp_size=32", [-1, 16, 64, 49152, 2147483647, 1024, 8, 32], "", 0, []], [[], [["CI", 2], ["FU", 4, [0, 1, 2, 3]], ["SP", 4, 0, 802816, [14], 1], ["AN", 4, 0, 5], ["AN", 4, 1, 6]]]], "r": [[4.52887e-05, 4.52806e-05, 4.52871e-05], 0, 2.59339, 1667958171], "v": "v0.6"}
{"i": [["[\"batch_norm\", 1, 56, 56, 256]", "cuda -keys=cuda,gpu -max_num_threads=1024 -model=unknown -thread_warp_size=32", [-1, 16, 64, 49152, 2147483647, 1024, 8, 32], "", 0, []], [[], [["CI", 2], ["FU", 4, [0, 1, 2, 3]], ["SP", 4, 0, 802816, [16], 1], ["AN", 4, 0, 5], ["AN", 4, 1, 6]]]], "r": [[3.98519e-05, 3.98539e-05, 3.98542e-05], 0, 3.62167, 1667958172], "v": "v0.6"}
{"i": [["[\"batch_norm\", 1, 56, 56, 256]", "cuda -keys=cuda,gpu -max_num_threads=1024 -model=unknown -thread_warp_size=32", [-1, 16, 64, 49152, 2147483647, 1024, 8, 32], "", 0, []], [[], [["CI", 2], ["FU", 4, [0, 1, 2, 3]], ["SP", 4, 0, 802816, [64], 1], ["AN", 4, 0, 5], ["AN", 4, 1, 6]]]], "r": [[1.19614e-05, 1.19613e-05, 1.19614e-05], 0, 3.95666, 1667958172], "v": "v0.6"}
