python/models/resnext/ResNextHorizontal_kernel_configs/resnext_imagenet_50_relu_1_28_28_1024.log
{"i": [["[\"relu\", 1, 28, 28, 1024]", "cuda -keys=cuda,gpu -max_num_threads=1024 -model=unknown -thread_warp_size=32", [-1, 16, 64, 49152, 2147483647, 1024, 8, 32], "", 0, []], [[], [["FU", 1, [0, 1, 2, 3]], ["SP", 1, 0, 802816, [1], 1], ["AN", 1, 0, 5], ["AN", 1, 1, 6]]]], "r": [[0.00059809, 0.000598062, 0.000598131], 0, 1.54265, 1667897224], "v": "v0.6"}
{"i": [["[\"relu\", 1, 28, 28, 1024]", "cuda -keys=cuda,gpu -max_num_threads=1024 -model=unknown -thread_warp_size=32", [-1, 16, 64, 49152, 2147483647, 1024, 8, 32], "", 0, []], [[], [["FU", 1, [0, 1, 2, 3]], ["SP", 1, 0, 802816, [56], 1], ["AN", 1, 0, 5], ["AN", 1, 1, 6]]]], "r": [[1.31527e-05, 1.31593e-05, 1.31619e-05], 0, 1.85965, 1667897224], "v": "v0.6"}
{"i": [["[\"relu\", 1, 28, 28, 1024]", "cuda -keys=cuda,gpu -max_num_threads=1024 -model=unknown -thread_warp_size=32", [-1, 16, 64, 49152, 2147483647, 1024, 8, 32], "", 0, []], [[], [["FU", 1, [0, 1, 2, 3]], ["SP", 1, 0, 802816, [4], 1], ["AN", 1, 0, 5], ["AN", 1, 1, 6]]]], "r": [[0.000151614, 0.00015157, 0.000151604], 0, 1.22317, 1667897223], "v": "v0.6"}
{"i": [["[\"relu\", 1, 28, 28, 1024]", "cuda -keys=cuda,gpu -max_num_threads=1024 -model=unknown -thread_warp_size=32", [-1, 16, 64, 49152, 2147483647, 1024, 8, 32], "", 0, []], [[], [["FU", 1, [0, 1, 2, 3]], ["SP", 1, 0, 802816, [64], 1], ["AN", 1, 0, 5], ["AN", 1, 1, 6]]]], "r": [[1.18274e-05, 1.18408e-05, 1.18427e-05], 0, 0.532598, 1667897223], "v": "v0.6"}
{"i": [["[\"relu\", 1, 28, 28, 1024]", "cuda -keys=cuda,gpu -max_num_threads=1024 -model=unknown -thread_warp_size=32", [-1, 16, 64, 49152, 2147483647, 1024, 8, 32], "", 0, []], [[], [["FU", 1, [0, 1, 2, 3]], ["SP", 1, 0, 802816, [32], 1], ["AN", 1, 0, 5], ["AN", 1, 1, 6]]]], "r": [[2.13653e-05, 2.14008e-05, 2.13946e-05], 0, 0.857729, 1667897223], "v": "v0.6"}
{"i": [["[\"relu\", 1, 28, 28, 1024]", "cuda -keys=cuda,gpu -max_num_threads=1024 -model=unknown -thread_warp_size=32", [-1, 16, 64, 49152, 2147483647, 1024, 8, 32], "", 0, []], [[], [["FU", 1, [0, 1, 2, 3]], ["SP", 1, 0, 802816, [7], 1], ["AN", 1, 0, 5], ["AN", 1, 1, 6]]]], "r": [[8.76671e-05, 8.76897e-05, 8.76691e-05], 0, 2.88521, 1667897225], "v": "v0.6"}
{"i": [["[\"relu\", 1, 28, 28, 1024]", "cuda -keys=cuda,gpu -max_num_threads=1024 -model=unknown -thread_warp_size=32", [-1, 16, 64, 49152, 2147483647, 1024, 8, 32], "", 0, []], [[], [["FU", 1, [0, 1, 2, 3]], ["SP", 1, 0, 802816, [28], 1], ["AN", 1, 0, 5], ["AN", 1, 1, 6]]]], "r": [[2.39854e-05, 2.40049e-05, 2.40041e-05], 0, 3.25203, 1667897225], "v": "v0.6"}
{"i": [["[\"relu\", 1, 28, 28, 1024]", "cuda -keys=cuda,gpu -max_num_threads=1024 -model=unknown -thread_warp_size=32", [-1, 16, 64, 49152, 2147483647, 1024, 8, 32], "", 0, []], [[], [["FU", 1, [0, 1, 2, 3]], ["SP", 1, 0, 802816, [16], 1], ["AN", 1, 0, 5], ["AN", 1, 1, 6]]]], "r": [[4.00392e-05, 4.00573e-05, 4.00446e-05], 0, 2.21837, 1667897224], "v": "v0.6"}
{"i": [["[\"relu\", 1, 28, 28, 1024]", "cuda -keys=cuda,gpu -max_num_threads=1024 -model=unknown -thread_warp_size=32", [-1, 16, 64, 49152, 2147483647, 1024, 8, 32], "", 0, []], [[], [["FU", 1, [0, 1, 2, 3]], ["SP", 1, 0, 802816, [2], 1], ["AN", 1, 0, 5], ["AN", 1, 1, 6]]]], "r": [[0.000300452, 0.000300448, 0.000300441], 0, 4.25144, 1667897226], "v": "v0.6"}
{"i": [["[\"relu\", 1, 28, 28, 1024]", "cuda -keys=cuda,gpu -max_num_threads=1024 -model=unknown -thread_warp_size=32", [-1, 16, 64, 49152, 2147483647, 1024, 8, 32], "", 0, []], [[], [["FU", 1, [0, 1, 2, 3]], ["SP", 1, 0, 802816, [14], 1], ["AN", 1, 0, 5], ["AN", 1, 1, 6]]]], "r": [[4.52881e-05, 4.52879e-05, 4.52821e-05], 0, 2.54355, 1667897225], "v": "v0.6"}
{"i": [["[\"relu\", 1, 28, 28, 1024]", "cuda -keys=cuda,gpu -max_num_threads=1024 -model=unknown -thread_warp_size=32", [-1, 16, 64, 49152, 2147483647, 1024, 8, 32], "", 0, []], [[], [["FU", 1, [0, 1, 2, 3]], ["SP", 1, 0, 802816, [49], 1], ["AN", 1, 0, 5], ["AN", 1, 1, 6]]]], "r": [[1.4652e-05, 1.46632e-05, 1.46684e-05], 0, 3.54954, 1667897226], "v": "v0.6"}
{"i": [["[\"relu\", 1, 28, 28, 1024]", "cuda -keys=cuda,gpu -max_num_threads=1024 -model=unknown -thread_warp_size=32", [-1, 16, 64, 49152, 2147483647, 1024, 8, 32], "", 0, []], [[], [["FU", 1, [0, 1, 2, 3]], ["SP", 1, 0, 802816, [8], 1], ["AN", 1, 0, 5], ["AN", 1, 1, 6]]]], "r": [[7.70207e-05, 7.70287e-05, 7.70254e-05], 0, 3.88424, 1667897226], "v": "v0.6"}
{"i": [["[\"relu\", 1, 28, 28, 1024]", "cuda -keys=cuda,gpu -max_num_threads=1024 -model=unknown -thread_warp_size=32", [-1, 16, 64, 49152, 2147483647, 1024, 8, 32], "", 0, []], [[], [["FU", 1, [0, 1, 2, 3]], ["SP", 1, 0, 802816, [56], 1], ["AN", 1, 0, 5], ["AN", 1, 1, 6]]]], "r": [[1.32687e-05, 1.32876e-05, 1.32941e-05], 0, 0.895467, 1667965805], "v": "v0.6"}
{"i": [["[\"relu\", 1, 28, 28, 1024]", "cuda -keys=cuda,gpu -max_num_threads=1024 -model=unknown -thread_warp_size=32", [-1, 16, 64, 49152, 2147483647, 1024, 8, 32], "", 0, []], [[], [["FU", 1, [0, 1, 2, 3]], ["SP", 1, 0, 802816, [49], 1], ["AN", 1, 0, 5], ["AN", 1, 1, 6]]]], "r": [[1.47499e-05, 1.47613e-05, 1.47576e-05], 0, 1.60542, 1667965806], "v": "v0.6"}
{"i": [["[\"relu\", 1, 28, 28, 1024]", "cuda -keys=cuda,gpu -max_num_threads=1024 -model=unknown -thread_warp_size=32", [-1, 16, 64, 49152, 2147483647, 1024, 8, 32], "", 0, []], [[], [["FU", 1, [0, 1, 2, 3]], ["SP", 1, 0, 802816, [14], 1], ["AN", 1, 0, 5], ["AN", 1, 1, 6]]]], "r": [[4.51568e-05, 4.51674e-05, 4.51596e-05], 0, 1.9635, 1667965806], "v": "v0.6"}
{"i": [["[\"relu\", 1, 28, 28, 1024]", "cuda -keys=cuda,gpu -max_num_threads=1024 -model=unknown -thread_warp_size=32", [-1, 16, 64, 49152, 2147483647, 1024, 8, 32], "", 0, []], [[], [["FU", 1, [0, 1, 2, 3]], ["SP", 1, 0, 802816, [7], 1], ["AN", 1, 0, 5], ["AN", 1, 1, 6]]]], "r": [[8.76438e-05, 8.76599e-05, 8.76522e-05], 0, 0.563787, 1667965805], "v": "v0.6"}
{"i": [["[\"relu\", 1, 28, 28, 1024]", "cuda -keys=cuda,gpu -max_num_threads=1024 -model=unknown -thread_warp_size=32", [-1, 16, 64, 49152, 2147483647, 1024, 8, 32], "", 0, []], [[], [["FU", 1, [0, 1, 2, 3]], ["SP", 1, 0, 802816, [28], 1], ["AN", 1, 0, 5], ["AN", 1, 1, 6]]]], "r": [[2.40453e-05, 2.40587e-05, 2.40562e-05], 0, 1.27538, 1667965805], "v": "v0.6"}
{"i": [["[\"relu\", 1, 28, 28, 1024]", "cuda -keys=cuda,gpu -max_num_threads=1024 -model=unknown -thread_warp_size=32", [-1, 16, 64, 49152, 2147483647, 1024, 8, 32], "", 0, []], [[], [["FU", 1, [0, 1, 2, 3]], ["SP", 1, 0, 802816, [8], 1], ["AN", 1, 0, 5], ["AN", 1, 1, 6]]]], "r": [[7.72349e-05, 7.72597e-05, 7.72459e-05], 0, 2.3495, 1667965807], "v": "v0.6"}
{"i": [["[\"relu\", 1, 28, 28, 1024]", "cuda -keys=cuda,gpu -max_num_threads=1024 -model=unknown -thread_warp_size=32", [-1, 16, 64, 49152, 2147483647, 1024, 8, 32], "", 0, []], [[], [["FU", 1, [0, 1, 2, 3]], ["SP", 1, 0, 802816, [16], 1], ["AN", 1, 0, 5], ["AN", 1, 1, 6]]]], "r": [[3.9783e-05, 3.97902e-05, 3.97764e-05], 0, 3.34865, 1667965808], "v": "v0.6"}
{"i": [["[\"relu\", 1, 28, 28, 1024]", "cuda -keys=cuda,gpu -max_num_threads=1024 -model=unknown -thread_warp_size=32", [-1, 16, 64, 49152, 2147483647, 1024, 8, 32], "", 0, []], [[], [["FU", 1, [0, 1, 2, 3]], ["SP", 1, 0, 802816, [2], 1], ["AN", 1, 0, 5], ["AN", 1, 1, 6]]]], "r": [[0.000300358, 0.000300344, 0.000300368], 0, 2.97656, 1667965807], "v": "v0.6"}
{"i": [["[\"relu\", 1, 28, 28, 1024]", "cuda -keys=cuda,gpu -max_num_threads=1024 -model=unknown -thread_warp_size=32", [-1, 16, 64, 49152, 2147483647, 1024, 8, 32], "", 0, []], [[], [["FU", 1, [0, 1, 2, 3]], ["SP", 1, 0, 802816, [32], 1], ["AN", 1, 0, 5], ["AN", 1, 1, 6]]]], "r": [[2.1329e-05, 2.13334e-05, 2.1335e-05], 0, 2.64596, 1667965807], "v": "v0.6"}
{"i": [["[\"relu\", 1, 28, 28, 1024]", "cuda -keys=cuda,gpu -max_num_threads=1024 -model=unknown -thread_warp_size=32", [-1, 16, 64, 49152, 2147483647, 1024, 8, 32], "", 0, []], [[], [["FU", 1, [0, 1, 2, 3]], ["SP", 1, 0, 802816, [1], 1], ["AN", 1, 0, 5], ["AN", 1, 1, 6]]]], "r": [[0.000598003, 0.00059797, 0.000598065], 0, 3.67052, 1667965808], "v": "v0.6"}
{"i": [["[\"relu\", 1, 28, 28, 1024]", "cuda -keys=cuda,gpu -max_num_threads=1024 -model=unknown -thread_warp_size=32", [-1, 16, 64, 49152, 2147483647, 1024, 8, 32], "", 0, []], [[], [["FU", 1, [0, 1, 2, 3]], ["SP", 1, 0, 802816, [64], 1], ["AN", 1, 0, 5], ["AN", 1, 1, 6]]]], "r": [[1.17935e-05, 1.17969e-05, 1.17885e-05], 0, 4.3405, 1667965809], "v": "v0.6"}
{"i": [["[\"relu\", 1, 28, 28, 1024]", "cuda -keys=cuda,gpu -max_num_threads=1024 -model=unknown -thread_warp_size=32", [-1, 16, 64, 49152, 2147483647, 1024, 8, 32], "", 0, []], [[], [["FU", 1, [0, 1, 2, 3]], ["SP", 1, 0, 802816, [4], 1], ["AN", 1, 0, 5], ["AN", 1, 1, 6]]]], "r": [[0.000151572, 0.000151518, 0.000151595], 0, 3.99211, 1667965808], "v": "v0.6"}
