python/models/resnext/ResNextHorizontal_kernel_configs/resnext_imagenet_50_fused_conv3x3_1_56_56_4_4_3.log
{"i": [["[\"fused_conv3x3\", 1, 56, 56, 4, 4, 3, 3, 64]", "cuda -keys=cuda,gpu -max_num_threads=1024 -model=unknown -thread_warp_size=32", [-1, 16, 64, 49152, 2147483647, 1024, 8, 32], "", 0, []], [[], [["CHW", 3, "local"], ["SP", 3, 0, 1, [1, 1, 1, 1], 1], ["SP", 3, 5, 64, [4, 1, 1, 4], 1], ["SP", 3, 10, 56, [1, 8, 1, 1], 1], ["SP", 3, 15, 56, [1, 7, 4, 1], 1], ["SP", 3, 20, 4, [1, 4, 1, 1], 1], ["SP", 3, 25, 4, [1, 1], 1], ["SP", 3, 28, 3, [3, 1], 1], ["SP", 3, 31, 3, [3, 1], 1], ["RE", 3, [0, 5, 10, 15, 20, 1, 6, 11, 16, 21, 2, 7, 12, 17, 22, 25, 28, 31, 26, 29, 32, 3, 8, 13, 18, 23, 27, 30, 33, 4, 9, 14, 19, 24]], ["FSP", 4, 0, 1, 3], ["FSP", 4, 4, 2, 3], ["FSP", 4, 8, 3, 3], ["FSP", 4, 12, 4, 3], ["FSP", 4, 16, 5, 3], ["RE", 4, [0, 4, 8, 12, 16, 1, 5, 9, 13, 17, 2, 6, 10, 14, 18, 3, 7, 11, 15, 19]], ["CA", 3, 4, 14], ["CHR", 2, "shared", [3]], ["CA", 3, 4, 17], ["CHR", 1, "shared", [4]], ["CA", 2, 5, 17], ["CI", 1], ["FU", 6, [0, 1, 2, 3, 4]], ["AN", 6, 0, 5], ["FU", 6, [1, 2, 3, 4, 5]], ["AN", 6, 1, 4], ["FU", 6, [2, 3, 4, 5, 6]], ["AN", 6, 2, 6], ["FU", 4, [0, 1, 2, 3, 4]], ["SP", 4, 0, 36, [1], 1], ["AN", 4, 1, 2], ["FFSP", 4, 0, [5, 4, 3, 2, 1], 1, 1], ["AN", 4, 1, 6], ["FU", 2, [0, 1, 2, 3, 4]], ["SP", 2, 0, 48, [1], 1], ["AN", 2, 1, 2], ["FFSP", 2, 0, [5, 4, 3, 2, 1], 1, 1], ["AN", 2, 1, 6], ["PR", 5, 0, "auto_unroll_max_step$64"]]]], "r": [[2.10329e-05, 2.10294e-05, 2.10367e-05], 0, 1.4375, 1667896668], "v": "v0.6"}
{"i": [["[\"fused_conv3x3\", 1, 56, 56, 4, 4, 3, 3, 64]", "cuda -keys=cuda,gpu -max_num_threads=1024 -model=unknown -thread_warp_size=32", [-1, 16, 64, 49152, 2147483647, 1024, 8, 32], "", 0, []], [[], [["CHW", 3, "local"], ["SP", 3, 0, 1, [1, 1, 1, 1], 1], ["SP", 3, 5, 64, [1, 1, 2, 2], 1], ["SP", 3, 10, 56, [1, 7, 1, 4], 1], ["SP", 3, 15, 56, [1, 7, 4, 1], 1], ["SP", 3, 20, 4, [1, 2, 1, 1], 1], ["SP", 3, 25, 4, [2, 1], 1], ["SP", 3, 28, 3, [1, 1], 1], ["SP", 3, 31, 3, [3, 1], 1], ["RE", 3, [0, 5, 10, 15, 20, 1, 6, 11, 16, 21, 2, 7, 12, 17, 22, 25, 28, 31, 26, 29, 32, 3, 8, 13, 18, 23, 27, 30, 33, 4, 9, 14, 19, 24]], ["FSP", 4, 0, 1, 3], ["FSP", 4, 4, 2, 3], ["FSP", 4, 8, 3, 3], ["FSP", 4, 12, 4, 3], ["FSP", 4, 16, 5, 3], ["RE", 4, [0, 4, 8, 12, 16, 1, 5, 9, 13, 17, 2, 6, 10, 14, 18, 3, 7, 11, 15, 19]], ["CA", 3, 4, 14], ["CHR", 2, "shared", [3]], ["CA", 3, 4, 17], ["CHR", 1, "shared", [4]], ["CA", 2, 5, 17], ["CI", 1], ["FU", 6, [0, 1, 2, 3, 4]], ["AN", 6, 0, 5], ["FU", 6, [1, 2, 3, 4, 5]], ["AN", 6, 1, 4], ["FU", 6, [2, 3, 4, 5, 6]], ["AN", 6, 2, 6], ["FU", 4, [0, 1, 2, 3, 4]], ["SP", 4, 0, 24, [1], 1], ["AN", 4, 1, 2], ["FFSP", 4, 0, [5, 4, 3, 2, 1], 1, 1], ["AN", 4, 1, 6], ["FU", 2, [0, 1, 2, 3, 4]], ["SP", 2, 0, 128, [1], 1], ["AN", 2, 1, 2], ["FFSP", 2, 0, [5, 4, 3, 2, 1], 1, 1], ["AN", 2, 1, 6], ["PR", 5, 0, "auto_unroll_max_step$16"]]]], "r": [[0.000115357, 0.00011528, 0.000115321], 0, 1.75385, 1667896669], "v": "v0.6"}
{"i": [["[\"fused_conv3x3\", 1, 56, 56, 4, 4, 3, 3, 64]", "cuda -keys=cuda,gpu -max_num_threads=1024 -model=unknown -thread_warp_size=32", [-1, 16, 64, 49152, 2147483647, 1024, 8, 32], "", 0, []], [[], [["CHW", 3, "local"], ["SP", 3, 0, 1, [1, 1, 1, 1], 1], ["SP", 3, 5, 64, [1, 8, 2, 1], 1], ["SP", 3, 10, 56, [1, 4, 1, 7], 1], ["SP", 3, 15, 56, [1, 1, 1, 14], 1], ["SP", 3, 20, 4, [2, 2, 1, 1], 1], ["SP", 3, 25, 4, [1, 1], 1], ["SP", 3, 28, 3, [1, 1], 1], ["SP", 3, 31, 3, [1, 3], 1], ["RE", 3, [0, 5, 10, 15, 20, 1, 6, 11, 16, 21, 2, 7, 12, 17, 22, 25, 28, 31, 26, 29, 32, 3, 8, 13, 18, 23, 27, 30, 33, 4, 9, 14, 19, 24]], ["FSP", 4, 0, 1, 3], ["FSP", 4, 4, 2, 3], ["FSP", 4, 8, 3, 3], ["FSP", 4, 12, 4, 3], ["FSP", 4, 16, 5, 3], ["RE", 4, [0, 4, 8, 12, 16, 1, 5, 9, 13, 17, 2, 6, 10, 14, 18, 3, 7, 11, 15, 19]], ["CA", 3, 4, 14], ["CHR", 2, "shared", [3]], ["CA", 3, 4, 17], ["CHR", 1, "shared", [4]], ["CA", 2, 5, 17], ["CI", 1], ["FU", 6, [0, 1, 2, 3, 4]], ["AN", 6, 0, 5], ["FU", 6, [1, 2, 3, 4, 5]], ["AN", 6, 1, 4], ["FU", 6, [2, 3, 4, 5, 6]], ["AN", 6, 2, 6], ["FU", 4, [0, 1, 2, 3, 4]], ["SP", 4, 0, 18, [18], 1], ["AN", 4, 1, 2], ["FFSP", 4, 0, [5, 4, 3, 2, 1], 1, 1], ["AN", 4, 1, 6], ["FU", 2, [0, 1, 2, 3, 4]], ["SP", 2, 0, 288, [6], 1], ["AN", 2, 1, 2], ["FFSP", 2, 0, [5, 4, 3, 2, 1], 1, 1], ["AN", 2, 1, 6], ["PR", 5, 0, "auto_unroll_max_step$64"]]]], "r": [[0.000436688, 0.000436778, 0.000436699], 0, 7.02441, 1667896673], "v": "v0.6"}
{"i": [["[\"fused_conv3x3\", 1, 56, 56, 4, 4, 3, 3, 64]", "cuda -keys=cuda,gpu -max_num_threads=1024 -model=unknown -thread_warp_size=32", [-1, 16, 64, 49152, 2147483647, 1024, 8, 32], "", 0, []], [[], [["CHW", 3, "local"], ["SP", 3, 0, 1, [1, 1, 1, 1], 1], ["SP", 3, 5, 64, [1, 4, 2, 1], 1], ["SP", 3, 10, 56, [1, 4, 2, 1], 1], ["SP", 3, 15, 56, [4, 2, 1, 1], 1], ["SP", 3, 20, 4, [1, 1, 4, 1], 1], ["SP", 3, 25, 4, [1, 1], 1], ["SP", 3, 28, 3, [1, 1], 1], ["SP", 3, 31, 3, [1, 1], 1], ["RE", 3, [0, 5, 10, 15, 20, 1, 6, 11, 16, 21, 2, 7, 12, 17, 22, 25, 28, 31, 26, 29, 32, 3, 8, 13, 18, 23, 27, 30, 33, 4, 9, 14, 19, 24]], ["FSP", 4, 0, 1, 3], ["FSP", 4, 4, 2, 3], ["FSP", 4, 8, 3, 3], ["FSP", 4, 12, 4, 3], ["FSP", 4, 16, 5, 3], ["RE", 4, [0, 4, 8, 12, 16, 1, 5, 9, 13, 17, 2, 6, 10, 14, 18, 3, 7, 11, 15, 19]], ["CA", 3, 4, 14], ["CHR", 2, "shared", [3]], ["CA", 3, 4, 17], ["CHR", 1, "shared", [4]], ["CA", 2, 5, 17], ["CI", 1], ["FU", 6, [0, 1, 2, 3, 4]], ["AN", 6, 0, 5], ["FU", 6, [1, 2, 3, 4, 5]], ["AN", 6, 1, 4], ["FU", 6, [2, 3, 4, 5, 6]], ["AN", 6, 2, 6], ["FU", 4, [0, 1, 2, 3, 4]], ["SP", 4, 0, 144, [1], 1], ["AN", 4, 1, 2], ["FFSP", 4, 0, [5, 4, 3, 2, 1], 1, 1], ["AN", 4, 1, 6], ["FU", 2, [0, 1, 2, 3, 4]], ["SP", 2, 0, 48, [1], 1], ["AN", 2, 1, 2], ["FFSP", 2, 0, [5, 4, 3, 2, 1], 1, 1], ["AN", 2, 1, 6], ["PR", 5, 0, "auto_unroll_max_step$512"]]]], "r": [[3.56392e-05, 3.56503e-05, 3.56424e-05], 0, 2.5594, 1667896669], "v": "v0.6"}
{"i": [["[\"fused_conv3x3\", 1, 56, 56, 4, 4, 3, 3, 64]", "cuda -keys=cuda,gpu -max_num_threads=1024 -model=unknown -thread_warp_size=32", [-1, 16, 64, 49152, 2147483647, 1024, 8, 32], "", 0, []], [[], [["CHW", 3, "local"], ["SP", 3, 0, 1, [1, 1, 1, 1], 1], ["SP", 3, 5, 64, [1, 1, 2, 2], 1], ["SP", 3, 10, 56, [1, 1, 2, 2], 1], ["SP", 3, 15, 56, [1, 7, 1, 4], 1], ["SP", 3, 20, 4, [1, 2, 1, 1], 1], ["SP", 3, 25, 4, [4, 1], 1], ["SP", 3, 28, 3, [1, 1], 1], ["SP", 3, 31, 3, [3, 1], 1], ["RE", 3, [0, 5, 10, 15, 20, 1, 6, 11, 16, 21, 2, 7, 12, 17, 22, 25, 28, 31, 26, 29, 32, 3, 8, 13, 18, 23, 27, 30, 33, 4, 9, 14, 19, 24]], ["FSP", 4, 0, 1, 3], ["FSP", 4, 4, 2, 3], ["FSP", 4, 8, 3, 3], ["FSP", 4, 12, 4, 3], ["FSP", 4, 16, 5, 3], ["RE", 4, [0, 4, 8, 12, 16, 1, 5, 9, 13, 17, 2, 6, 10, 14, 18, 3, 7, 11, 15, 19]], ["CA", 3, 4, 14], ["CHR", 2, "shared", [3]], ["CA", 3, 4, 17], ["CHR", 1, "shared", [4]], ["CA", 2, 5, 17], ["CI", 1], ["FU", 6, [0, 1, 2, 3, 4]], ["AN", 6, 0, 5], ["FU", 6, [1, 2, 3, 4, 5]], ["AN", 6, 1, 4], ["FU", 6, [2, 3, 4, 5, 6]], ["AN", 6, 2, 6], ["FU", 4, [0, 1, 2, 3, 4]], ["SP", 4, 0, 24, [1], 1], ["AN", 4, 1, 2], ["FFSP", 4, 0, [5, 4, 3, 2, 1], 1, 1], ["AN", 4, 1, 6], ["FU", 2, [0, 1, 2, 3, 4]], ["SP", 2, 0, 128, [1], 1], ["AN", 2, 1, 2], ["FFSP", 2, 0, [5, 4, 3, 2, 1], 1, 1], ["AN", 2, 1, 6], ["PR", 5, 0, "auto_unroll_max_step$16"]]]], "r": [[9.9116e-05, 9.9089e-05, 9.9111e-05], 0, 3.86889, 1667896671], "v": "v0.6"}
{"i": [["[\"fused_conv3x3\", 1, 56, 56, 4, 4, 3, 3, 64]", "cuda -keys=cuda,gpu -max_num_threads=1024 -model=unknown -thread_warp_size=32", [-1, 16, 64, 49152, 2147483647, 1024, 8, 32], "", 0, []], [[], [["CHW", 3, "local"], ["SP", 3, 0, 1, [1, 1, 1, 1], 1], ["SP", 3, 5, 64, [1, 4, 2, 1], 1], ["SP", 3, 10, 56, [1, 28, 2, 1], 1], ["SP", 3, 15, 56, [4, 2, 1, 1], 1], ["SP", 3, 20, 4, [1, 1, 4, 1], 1], ["SP", 3, 25, 4, [1, 2], 1], ["SP", 3, 28, 3, [1, 3], 1], ["SP", 3, 31, 3, [3, 1], 1], ["RE", 3, [0, 5, 10, 15, 20, 1, 6, 11, 16, 21, 2, 7, 12, 17, 22, 25, 28, 31, 26, 29, 32, 3, 8, 13, 18, 23, 27, 30, 33, 4, 9, 14, 19, 24]], ["FSP", 4, 0, 1, 3], ["FSP", 4, 4, 2, 3], ["FSP", 4, 8, 3, 3], ["FSP", 4, 12, 4, 3], ["FSP", 4, 16, 5, 3], ["RE", 4, [0, 4, 8, 12, 16, 1, 5, 9, 13, 17, 2, 6, 10, 14, 18, 3, 7, 11, 15, 19]], ["CA", 3, 4, 14], ["CHR", 2, "shared", [3]], ["CA", 3, 4, 17], ["CHR", 1, "shared", [4]], ["CA", 2, 5, 17], ["CI", 1], ["FU", 6, [0, 1, 2, 3, 4]], ["AN", 6, 0, 5], ["FU", 6, [1, 2, 3, 4, 5]], ["AN", 6, 1, 4], ["FU", 6, [2, 3, 4, 5, 6]], ["AN", 6, 2, 6], ["FU", 4, [0, 1, 2, 3, 4]], ["SP", 4, 0, 144, [48], 1], ["AN", 4, 1, 2], ["FFSP", 4, 0, [5, 4, 3, 2, 1], 1, 1], ["AN", 4, 1, 6], ["FU", 2, [0, 1, 2, 3, 4]], ["SP", 2, 0, 48, [1], 1], ["AN", 2, 1, 2], ["FFSP", 2, 0, [5, 4, 3, 2, 1], 1, 1], ["AN", 2, 1, 6], ["PR", 5, 0, "auto_unroll_max_step$512"]]]], "r": [[2.83356e-05, 2.83294e-05, 2.83159e-05], 0, 1.48211, 1667896668], "v": "v0.6"}
{"i": [["[\"fused_conv3x3\", 1, 56, 56, 4, 4, 3, 3, 64]", "cuda -keys=cuda,gpu -max_num_threads=1024 -model=unknown -thread_warp_size=32", [-1, 16, 64, 49152, 2147483647, 1024, 8, 32], "", 0, []], [[], [["CHW", 3, "local"], ["SP", 3, 0, 1, [1, 1, 1, 1], 1], ["SP", 3, 5, 64, [1, 2, 2, 2], 1], ["SP", 3, 10, 56, [1, 4, 1, 1], 1], ["SP", 3, 15, 56, [1, 8, 1, 1], 1], ["SP", 3, 20, 4, [1, 1, 2, 1], 1], ["SP", 3, 25, 4, [2, 1], 1], ["SP", 3, 28, 3, [1, 1], 1], ["SP", 3, 31, 3, [1, 3], 1], ["RE", 3, [0, 5, 10, 15, 20, 1, 6, 11, 16, 21, 2, 7, 12, 17, 22, 25, 28, 31, 26, 29, 32, 3, 8, 13, 18, 23, 27, 30, 33, 4, 9, 14, 19, 24]], ["FSP", 4, 0, 1, 3], ["FSP", 4, 4, 2, 3], ["FSP", 4, 8, 3, 3], ["FSP", 4, 12, 4, 3], ["FSP", 4, 16, 5, 3], ["RE", 4, [0, 4, 8, 12, 16, 1, 5, 9, 13, 17, 2, 6, 10, 14, 18, 3, 7, 11, 15, 19]], ["CA", 3, 4, 14], ["CHR", 2, "shared", [3]], ["CA", 3, 4, 17], ["CHR", 1, "shared", [4]], ["CA", 2, 5, 17], ["CI", 1], ["FU", 6, [0, 1, 2, 3, 4]], ["AN", 6, 0, 5], ["FU", 6, [1, 2, 3, 4, 5]], ["AN", 6, 1, 4], ["FU", 6, [2, 3, 4, 5, 6]], ["AN", 6, 2, 6], ["FU", 4, [0, 1, 2, 3, 4]], ["SP", 4, 0, 48, [1], 1], ["AN", 4, 1, 2], ["FFSP", 4, 0, [5, 4, 3, 2, 1], 1, 1], ["AN", 4, 1, 6], ["FU", 2, [0, 1, 2, 3, 4]], ["SP", 2, 0, 16, [1], 1], ["AN", 2, 1, 2], ["FFSP", 2, 0, [5, 4, 3, 2, 1], 1, 1], ["AN", 2, 1, 6], ["PR", 5, 0, "auto_unroll_max_step$64"]]]], "r": [[1.59465e-05, 1.59284e-05, 1.59136e-05], 0, 3.06402, 1667896670], "v": "v0.6"}
{"i": [["[\"fused_conv3x3\", 1, 56, 56, 4, 4, 3, 3, 64]", "cuda -keys=cuda,gpu -max_num_threads=1024 -model=unknown -thread_warp_size=32", [-1, 16, 64, 49152, 2147483647, 1024, 8, 32], "", 0, []], [[], [["CHW", 3, "local"], ["SP", 3, 0, 1, [1, 1, 1, 1], 1], ["SP", 3, 5, 64, [1, 1, 2, 2], 1], ["SP", 3, 10, 56, [1, 4, 7, 2], 1], ["SP", 3, 15, 56, [1, 8, 1, 1], 1], ["SP", 3, 20, 4, [2, 1, 2, 1], 1], ["SP", 3, 25, 4, [1, 4], 1], ["SP", 3, 28, 3, [3, 1], 1], ["SP", 3, 31, 3, [1, 1], 1], ["RE", 3, [0, 5, 10, 15, 20, 1, 6, 11, 16, 21, 2, 7, 12, 17, 22, 25, 28, 31, 26, 29, 32, 3, 8, 13, 18, 23, 27, 30, 33, 4, 9, 14, 19, 24]], ["FSP", 4, 0, 1, 3], ["FSP", 4, 4, 2, 3], ["FSP", 4, 8, 3, 3], ["FSP", 4, 12, 4, 3], ["FSP", 4, 16, 5, 3], ["RE", 4, [0, 4, 8, 12, 16, 1, 5, 9, 13, 17, 2, 6, 10, 14, 18, 3, 7, 11, 15, 19]], ["CA", 3, 4, 14], ["CHR", 2, "shared", [3]], ["CA", 3, 4, 17], ["CHR", 1, "shared", [4]], ["CA", 2, 5, 17], ["CI", 1], ["FU", 6, [0, 1, 2, 3, 4]], ["AN", 6, 0, 5], ["FU", 6, [1, 2, 3, 4, 5]], ["AN", 6, 1, 4], ["FU", 6, [2, 3, 4, 5, 6]], ["AN", 6, 2, 6], ["FU", 4, [0, 1, 2, 3, 4]], ["SP", 4, 0, 96, [2], 1], ["AN", 4, 1, 2], ["FFSP", 4, 0, [5, 4, 3, 2, 1], 1, 1], ["AN", 4, 1, 6], ["FU", 2, [0, 1, 2, 3, 4]], ["SP", 2, 0, 768, [1], 1], ["AN", 2, 1, 2], ["FFSP", 2, 0, [5, 4, 3, 2, 1], 1, 1], ["AN", 2, 1, 6], ["PR", 5, 0, "auto_unroll_max_step$16"]]]], "r": [[0.00027538, 0.00027535, 0.000275366], 0, 9.45675, 1667896676], "v": "v0.6"}
{"i": [["[\"fused_conv3x3\", 1, 56, 56, 4, 4, 3, 3, 64]", "cuda -keys=cuda,gpu -max_num_threads=1024 -model=unknown -thread_warp_size=32", [-1, 16, 64, 49152, 2147483647, 1024, 8, 32], "", 0, []], [[], [["CHW", 3, "local"], ["SP", 3, 0, 1, [1, 1, 1, 1], 1], ["SP", 3, 5, 64, [1, 8, 1, 1], 1], ["SP", 3, 10, 56, [1, 4, 2, 1], 1], ["SP", 3, 15, 56, [4, 2, 1, 1], 1], ["SP", 3, 20, 4, [1, 1, 4, 1], 1], ["SP", 3, 25, 4, [1, 1], 1], ["SP", 3, 28, 3, [1, 3], 1], ["SP", 3, 31, 3, [3, 1], 1], ["RE", 3, [0, 5, 10, 15, 20, 1, 6, 11, 16, 21, 2, 7, 12, 17, 22, 25, 28, 31, 26, 29, 32, 3, 8, 13, 18, 23, 27, 30, 33, 4, 9, 14, 19, 24]], ["FSP", 4, 0, 1, 3], ["FSP", 4, 4, 2, 3], ["FSP", 4, 8, 3, 3], ["FSP", 4, 12, 4, 3], ["FSP", 4, 16, 5, 3], ["RE", 4, [0, 4, 8, 12, 16, 1, 5, 9, 13, 17, 2, 6, 10, 14, 18, 3, 7, 11, 15, 19]], ["CA", 3, 4, 14], ["CHR", 2, "shared", [3]], ["CA", 3, 4, 17], ["CHR", 1, "shared", [4]], ["CA", 2, 5, 17], ["CI", 1], ["FU", 6, [0, 1, 2, 3, 4]], ["AN", 6, 0, 5], ["FU", 6, [1, 2, 3, 4, 5]], ["AN", 6, 1, 4], ["FU", 6, [2, 3, 4, 5, 6]], ["AN", 6, 2, 6], ["FU", 4, [0, 1, 2, 3, 4]], ["SP", 4, 0, 144, [1], 1], ["AN", 4, 1, 2], ["FFSP", 4, 0, [5, 4, 3, 2, 1], 1, 1], ["AN", 4, 1, 6], ["FU", 2, [0, 1, 2, 3, 4]], ["SP", 2, 0, 48, [1], 1], ["AN", 2, 1, 2], ["FFSP", 2, 0, [5, 4, 3, 2, 1], 1, 1], ["AN", 2, 1, 6], ["PR", 5, 0, "auto_unroll_max_step$16"]]]], "r": [[2.14434e-05, 2.14215e-05, 2.14211e-05], 0, 3.4741, 1667896670], "v": "v0.6"}
{"i": [["[\"fused_conv3x3\", 1, 56, 56, 4, 4, 3, 3, 64]", "cuda -keys=cuda,gpu -max_num_threads=1024 -model=unknown -thread_warp_size=32", [-1, 16, 64, 49152, 2147483647, 1024, 8, 32], "", 0, []], [[], [["CHW", 3, "local"], ["SP", 3, 0, 1, [1, 1, 1, 1], 1], ["SP", 3, 5, 64, [1, 4, 2, 2], 1], ["SP", 3, 10, 56, [1, 1, 1, 8], 1], ["SP", 3, 15, 56, [1, 4, 1, 1], 1], ["SP", 3, 20, 4, [1, 2, 1, 1], 1], ["SP", 3, 25, 4, [1, 2], 1], ["SP", 3, 28, 3, [1, 1], 1], ["SP", 3, 31, 3, [3, 1], 1], ["RE", 3, [0, 5, 10, 15, 20, 1, 6, 11, 16, 21, 2, 7, 12, 17, 22, 25, 28, 31, 26, 29, 32, 3, 8, 13, 18, 23, 27, 30, 33, 4, 9, 14, 19, 24]], ["FSP", 4, 0, 1, 3], ["FSP", 4, 4, 2, 3], ["FSP", 4, 8, 3, 3], ["FSP", 4, 12, 4, 3], ["FSP", 4, 16, 5, 3], ["RE", 4, [0, 4, 8, 12, 16, 1, 5, 9, 13, 17, 2, 6, 10, 14, 18, 3, 7, 11, 15, 19]], ["CA", 3, 4, 14], ["CHR", 2, "shared", [3]], ["CA", 3, 4, 17], ["CHR", 1, "shared", [4]], ["CA", 2, 5, 17], ["CI", 1], ["FU", 6, [0, 1, 2, 3, 4]], ["AN", 6, 0, 5], ["FU", 6, [1, 2, 3, 4, 5]], ["AN", 6, 1, 4], ["FU", 6, [2, 3, 4, 5, 6]], ["AN", 6, 2, 6], ["FU", 4, [0, 1, 2, 3, 4]], ["SP", 4, 0, 24, [24], 1], ["AN", 4, 1, 2], ["FFSP", 4, 0, [5, 4, 3, 2, 1], 1, 1], ["AN", 4, 1, 6], ["FU", 2, [0, 1, 2, 3, 4]], ["SP", 2, 0, 64, [1], 1], ["AN", 2, 1, 2], ["FFSP", 2, 0, [5, 4, 3, 2, 1], 1, 1], ["AN", 2, 1, 6], ["PR", 5, 0, "auto_unroll_max_step$64"]]]], "r": [[2.51613e-05, 2.51722e-05, 2.51848e-05], 0, 2.81034, 1667896670], "v": "v0.6"}
{"i": [["[\"fused_conv3x3\", 1, 56, 56, 4, 4, 3, 3, 64]", "cuda -keys=cuda,gpu -max_num_threads=1024 -model=unknown -thread_warp_size=32", [-1, 16, 64, 49152, 2147483647, 1024, 8, 32], "", 0, []], [[], [["CHW", 3, "local"], ["SP", 3, 0, 1, [1, 1, 1, 1], 1], ["SP", 3, 5, 64, [1, 8, 1, 1], 1], ["SP", 3, 10, 56, [1, 4, 1, 14], 1], ["SP", 3, 15, 56, [1, 8, 1, 1], 1], ["SP", 3, 20, 4, [2, 2, 1, 1], 1], ["SP", 3, 25, 4, [1, 1], 1], ["SP", 3, 28, 3, [3, 1], 1], ["SP", 3, 31, 3, [1, 3], 1], ["RE", 3, [0, 5, 10, 15, 20, 1, 6, 11, 16, 21, 2, 7, 12, 17, 22, 25, 28, 31, 26, 29, 32, 3, 8, 13, 18, 23, 27, 30, 33, 4, 9, 14, 19, 24]], ["FSP", 4, 0, 1, 3], ["FSP", 4, 4, 2, 3], ["FSP", 4, 8, 3, 3], ["FSP", 4, 12, 4, 3], ["FSP", 4, 16, 5, 3], ["RE", 4, [0, 4, 8, 12, 16, 1, 5, 9, 13, 17, 2, 6, 10, 14, 18, 3, 7, 11, 15, 19]], ["CA", 3, 4, 14], ["CHR", 2, "shared", [3]], ["CA", 3, 4, 17], ["CHR", 1, "shared", [4]], ["CA", 2, 5, 17], ["CI", 1], ["FU", 6, [0, 1, 2, 3, 4]], ["AN", 6, 0, 5], ["FU", 6, [1, 2, 3, 4, 5]], ["AN", 6, 1, 4], ["FU", 6, [2, 3, 4, 5, 6]], ["AN", 6, 2, 6], ["FU", 4, [0, 1, 2, 3, 4]], ["SP", 4, 0, 9, [1], 1], ["AN", 4, 1, 2], ["FFSP", 4, 0, [5, 4, 3, 2, 1], 1, 1], ["AN", 4, 1, 6], ["FU", 2, [0, 1, 2, 3, 4]], ["SP", 2, 0, 48, [48], 1], ["AN", 2, 1, 2], ["FFSP", 2, 0, [5, 4, 3, 2, 1], 1, 1], ["AN", 2, 1, 6], ["PR", 5, 0, "auto_unroll_max_step$64"]]]], "r": [[3.11962e-05, 3.11897e-05, 3.11966e-05], 0, 5.13982, 1667896672], "v": "v0.6"}
{"i": [["[\"fused_conv3x3\", 1, 56, 56, 4, 4, 3, 3, 64]", "cuda -keys=cuda,gpu -max_num_threads=1024 -model=unknown -thread_warp_size=32", [-1, 16, 64, 49152, 2147483647, 1024, 8, 32], "", 0, []], [[], [["CHW", 3, "local"], ["SP", 3, 0, 1, [1, 1, 1, 1], 1], ["SP", 3, 5, 64, [1, 8, 2, 2], 1], ["SP", 3, 10, 56, [2, 2, 1, 2], 1], ["SP", 3, 15, 56, [4, 2, 1, 1], 1], ["SP", 3, 20, 4, [1, 2, 2, 1], 1], ["SP", 3, 25, 4, [1, 1], 1], ["SP", 3, 28, 3, [1, 1], 1], ["SP", 3, 31, 3, [1, 3], 1], ["RE", 3, [0, 5, 10, 15, 20, 1, 6, 11, 16, 21, 2, 7, 12, 17, 22, 25, 28, 31, 26, 29, 32, 3, 8, 13, 18, 23, 27, 30, 33, 4, 9, 14, 19, 24]], ["FSP", 4, 0, 1, 3], ["FSP", 4, 4, 2, 3], ["FSP", 4, 8, 3, 3], ["FSP", 4, 12, 4, 3], ["FSP", 4, 16, 5, 3], ["RE", 4, [0, 4, 8, 12, 16, 1, 5, 9, 13, 17, 2, 6, 10, 14, 18, 3, 7, 11, 15, 19]], ["CA", 3, 4, 14], ["CHR", 2, "shared", [3]], ["CA", 3, 4, 17], ["CHR", 1, "shared", [4]], ["CA", 2, 5, 17], ["CI", 1], ["FU", 6, [0, 1, 2, 3, 4]], ["AN", 6, 0, 5], ["FU", 6, [1, 2, 3, 4, 5]], ["AN", 6, 1, 4], ["FU", 6, [2, 3, 4, 5, 6]], ["AN", 6, 2, 6], ["FU", 4, [0, 1, 2, 3, 4]], ["SP", 4, 0, 24, [1], 1], ["AN", 4, 1, 2], ["FFSP", 4, 0, [5, 4, 3, 2, 1], 1, 1], ["AN", 4, 1, 6], ["FU", 2, [0, 1, 2, 3, 4]], ["SP", 2, 0, 48, [1], 1], ["AN", 2, 1, 2], ["FFSP", 2, 0, [5, 4, 3, 2, 1], 1, 1], ["AN", 2, 1, 6], ["PR", 5, 0, "auto_unroll_max_step$64"]]]], "r": [[2.04579e-05, 2.04579e-05, 2.04484e-05], 0, 6.97741, 1667896674], "v": "v0.6"}
{"i": [["[\"fused_conv3x3\", 1, 56, 56, 4, 4, 3, 3, 64]", "cuda -keys=cuda,gpu -max_num_threads=1024 -model=unknown -thread_warp_size=32", [-1, 16, 64, 49152, 2147483647, 1024, 8, 32], "", 0, []], [[], [["CHW", 3, "local"], ["SP", 3, 0, 1, [1, 1, 1, 1], 1], ["SP", 3, 5, 64, [1, 8, 2, 2], 1], ["SP", 3, 10, 56, [2, 2, 1, 2], 1], ["SP", 3, 15, 56, [4, 2, 1, 1], 1], ["SP", 3, 20, 4, [1, 4, 1, 1], 1], ["SP", 3, 25, 4, [1, 1], 1], ["SP", 3, 28, 3, [1, 1], 1], ["SP", 3, 31, 3, [3, 1], 1], ["RE", 3, [0, 5, 10, 15, 20, 1, 6, 11, 16, 21, 2, 7, 12, 17, 22, 25, 28, 31, 26, 29, 32, 3, 8, 13, 18, 23, 27, 30, 33, 4, 9, 14, 19, 24]], ["FSP", 4, 0, 1, 3], ["FSP", 4, 4, 2, 3], ["FSP", 4, 8, 3, 3], ["FSP", 4, 12, 4, 3], ["FSP", 4, 16, 5, 3], ["RE", 4, [0, 4, 8, 12, 16, 1, 5, 9, 13, 17, 2, 6, 10, 14, 18, 3, 7, 11, 15, 19]], ["CA", 3, 4, 14], ["CHR", 2, "shared", [3]], ["CA", 3, 4, 17], ["CHR", 1, "shared", [4]], ["CA", 2, 5, 17], ["CI", 1], ["FU", 6, [0, 1, 2, 3, 4]], ["AN", 6, 0, 5], ["FU", 6, [1, 2, 3, 4, 5]], ["AN", 6, 1, 4], ["FU", 6, [2, 3, 4, 5, 6]], ["AN", 6, 2, 6], ["FU", 4, [0, 1, 2, 3, 4]], ["SP", 4, 0, 24, [1], 1], ["AN", 4, 1, 2], ["FFSP", 4, 0, [5, 4, 3, 2, 1], 1, 1], ["AN", 4, 1, 6], ["FU", 2, [0, 1, 2, 3, 4]], ["SP", 2, 0, 48, [1], 1], ["AN", 2, 1, 2], ["FFSP", 2, 0, [5, 4, 3, 2, 1], 1, 1], ["AN", 2, 1, 6], ["PR", 5, 0, "auto_unroll_max_step$64"]]]], "r": [[1.4829e-05, 1.48159e-05, 1.48285e-05], 0, 7.35607, 1667896674], "v": "v0.6"}
{"i": [["[\"fused_conv3x3\", 1, 56, 56, 4, 4, 3, 3, 64]", "cuda -keys=cuda,gpu -max_num_threads=1024 -model=unknown -thread_warp_size=32", [-1, 16, 64, 49152, 2147483647, 1024, 8, 32], "", 0, []], [[], [["CHW", 3, "local"], ["SP", 3, 0, 1, [1, 1, 1, 1], 1], ["SP", 3, 5, 64, [1, 4, 1, 2], 1], ["SP", 3, 10, 56, [1, 1, 1, 1], 1], ["SP", 3, 15, 56, [1, 7, 2, 4], 1], ["SP", 3, 20, 4, [1, 2, 1, 2], 1], ["SP", 3, 25, 4, [4, 1], 1], ["SP", 3, 28, 3, [3, 1], 1], ["SP", 3, 31, 3, [1, 3], 1], ["RE", 3, [0, 5, 10, 15, 20, 1, 6, 11, 16, 21, 2, 7, 12, 17, 22, 25, 28, 31, 26, 29, 32, 3, 8, 13, 18, 23, 27, 30, 33, 4, 9, 14, 19, 24]], ["FSP", 4, 0, 1, 3], ["FSP", 4, 4, 2, 3], ["FSP", 4, 8, 3, 3], ["FSP", 4, 12, 4, 3], ["FSP", 4, 16, 5, 3], ["RE", 4, [0, 4, 8, 12, 16, 1, 5, 9, 13, 17, 2, 6, 10, 14, 18, 3, 7, 11, 15, 19]], ["CA", 3, 4, 14], ["CHR", 2, "shared", [3]], ["CA", 3, 4, 17], ["CHR", 1, "shared", [4]], ["CA", 2, 5, 17], ["CI", 1], ["FU", 6, [0, 1, 2, 3, 4]], ["AN", 6, 0, 5], ["FU", 6, [1, 2, 3, 4, 5]], ["AN", 6, 1, 4], ["FU", 6, [2, 3, 4, 5, 6]], ["AN", 6, 2, 6], ["FU", 4, [0, 1, 2, 3, 4]], ["SP", 4, 0, 144, [1], 1], ["AN", 4, 1, 2], ["FFSP", 4, 0, [5, 4, 3, 2, 1], 1, 1], ["AN", 4, 1, 6], ["FU", 2, [0, 1, 2, 3, 4]], ["SP", 2, 0, 240, [4], 1], ["AN", 2, 1, 2], ["FFSP", 2, 0, [5, 4, 3, 2, 1], 1, 1], ["AN", 2, 1, 6], ["PR", 5, 0, "auto_unroll_max_step$16"]]]], "r": [[4.33417e-05, 4.32894e-05, 4.33259e-05], 0, 8.87301, 1667896676], "v": "v0.6"}
{"i": [["[\"fused_conv3x3\", 1, 56, 56, 4, 4, 3, 3, 64]", "cuda -keys=cuda,gpu -max_num_threads=1024 -model=unknown -thread_warp_size=32", [-1, 16, 64, 49152, 2147483647, 1024, 8, 32], "", 0, []], [[], [["CHW", 3, "local"], ["SP", 3, 0, 1, [1, 1, 1, 1], 1], ["SP", 3, 5, 64, [1, 4, 2, 1], 1], ["SP", 3, 10, 56, [1, 4, 2, 1], 1], ["SP", 3, 15, 56, [4, 2, 1, 1], 1], ["SP", 3, 20, 4, [1, 1, 4, 1], 1], ["SP", 3, 25, 4, [1, 2], 1], ["SP", 3, 28, 3, [1, 3], 1], ["SP", 3, 31, 3, [3, 1], 1], ["RE", 3, [0, 5, 10, 15, 20, 1, 6, 11, 16, 21, 2, 7, 12, 17, 22, 25, 28, 31, 26, 29, 32, 3, 8, 13, 18, 23, 27, 30, 33, 4, 9, 14, 19, 24]], ["FSP", 4, 0, 1, 3], ["FSP", 4, 4, 2, 3], ["FSP", 4, 8, 3, 3], ["FSP", 4, 12, 4, 3], ["FSP", 4, 16, 5, 3], ["RE", 4, [0, 4, 8, 12, 16, 1, 5, 9, 13, 17, 2, 6, 10, 14, 18, 3, 7, 11, 15, 19]], ["CA", 3, 4, 14], ["CHR", 2, "shared", [3]], ["CA", 3, 4, 17], ["CHR", 1, "shared", [4]], ["CA", 2, 5, 17], ["CI", 1], ["FU", 6, [0, 1, 2, 3, 4]], ["AN", 6, 0, 5], ["FU", 6, [1, 2, 3, 4, 5]], ["AN", 6, 1, 4], ["FU", 6, [2, 3, 4, 5, 6]], ["AN", 6, 2, 6], ["FU", 4, [0, 1, 2, 3, 4]], ["SP", 4, 0, 144, [48], 1], ["AN", 4, 1, 2], ["FFSP", 4, 0, [5, 4, 3, 2, 1], 1, 1], ["AN", 4, 1, 6], ["FU", 2, [0, 1, 2, 3, 4]], ["SP", 2, 0, 48, [24], 1], ["AN", 2, 1, 2], ["FFSP", 2, 0, [5, 4, 3, 2, 1], 1, 1], ["AN", 2, 1, 6], ["PR", 5, 0, "auto_unroll_max_step$512"]]]], "r": [[2.63589e-05, 2.63275e-05, 2.63476e-05], 0, 9.30591, 1667896676], "v": "v0.6"}
{"i": [["[\"fused_conv3x3\", 1, 56, 56, 4, 4, 3, 3, 64]", "cuda -keys=cuda,gpu -max_num_threads=1024 -model=unknown -thread_warp_size=32", [-1, 16, 64, 49152, 2147483647, 1024, 8, 32], "", 0, []], [[], [["CHW", 3, "local"], ["SP", 3, 0, 1, [1, 1, 1, 1], 1], ["SP", 3, 5, 64, [1, 4, 2, 1], 1], ["SP", 3, 10, 56, [2, 4, 1, 1], 1], ["SP", 3, 15, 56, [2, 2, 1, 1], 1], ["SP", 3, 20, 4, [1, 1, 4, 1], 1], ["SP", 3, 25, 4, [2, 1], 1], ["SP", 3, 28, 3, [1, 3], 1], ["SP", 3, 31, 3, [3, 1], 1], ["RE", 3, [0, 5, 10, 15, 20, 1, 6, 11, 16, 21, 2, 7, 12, 17, 22, 25, 28, 31, 26, 29, 32, 3, 8, 13, 18, 23, 27, 30, 33, 4, 9, 14, 19, 24]], ["FSP", 4, 0, 1, 3], ["FSP", 4, 4, 2, 3], ["FSP", 4, 8, 3, 3], ["FSP", 4, 12, 4, 3], ["FSP", 4, 16, 5, 3], ["RE", 4, [0, 4, 8, 12, 16, 1, 5, 9, 13, 17, 2, 6, 10, 14, 18, 3, 7, 11, 15, 19]], ["CA", 3, 4, 14], ["CHR", 2, "shared", [3]], ["CA", 3, 4, 17], ["CHR", 1, "shared", [4]], ["CA", 2, 5, 17], ["CI", 1], ["FU", 6, [0, 1, 2, 3, 4]], ["AN", 6, 0, 5], ["FU", 6, [1, 2, 3, 4, 5]], ["AN", 6, 1, 4], ["FU", 6, [2, 3, 4, 5, 6]], ["AN", 6, 2, 6], ["FU", 4, [0, 1, 2, 3, 4]], ["SP", 4, 0, 144, [1], 1], ["AN", 4, 1, 2], ["FFSP", 4, 0, [5, 4, 3, 2, 1], 1, 1], ["AN", 4, 1, 6], ["FU", 2, [0, 1, 2, 3, 4]], ["SP", 2, 0, 48, [1], 1], ["AN", 2, 1, 2], ["FFSP", 2, 0, [5, 4, 3, 2, 1], 1, 1], ["AN", 2, 1, 6], ["PR", 5, 0, "auto_unroll_max_step$512"]]]], "r": [[1.89641e-05, 1.89457e-05, 1.89449e-05], 0, 5.54426, 1667896672], "v": "v0.6"}
{"i": [["[\"fused_conv3x3\", 1, 56, 56, 4, 4, 3, 3, 64]", "cuda -keys=cuda,gpu -max_num_threads=1024 -model=unknown -thread_warp_size=32", [-1, 16, 64, 49152, 2147483647, 1024, 8, 32], "", 0, []], [[], [["CHW", 3, "local"], ["SP", 3, 0, 1, [1, 1, 1, 1], 1], ["SP", 3, 5, 64, [1, 2, 4, 1], 1], ["SP", 3, 10, 56, [1, 1, 4, 1], 1], ["SP", 3, 15, 56, [1, 4, 14, 1], 1], ["SP", 3, 20, 4, [1, 4, 1, 1], 1], ["SP", 3, 25, 4, [1, 1], 1], ["SP", 3, 28, 3, [1, 3], 1], ["SP", 3, 31, 3, [3, 1], 1], ["RE", 3, [0, 5, 10, 15, 20, 1, 6, 11, 16, 21, 2, 7, 12, 17, 22, 25, 28, 31, 26, 29, 32, 3, 8, 13, 18, 23, 27, 30, 33, 4, 9, 14, 19, 24]], ["FSP", 4, 0, 1, 3], ["FSP", 4, 4, 2, 3], ["FSP", 4, 8, 3, 3], ["FSP", 4, 12, 4, 3], ["FSP", 4, 16, 5, 3], ["RE", 4, [0, 4, 8, 12, 16, 1, 5, 9, 13, 17, 2, 6, 10, 14, 18, 3, 7, 11, 15, 19]], ["CA", 3, 4, 14], ["CHR", 2, "shared", [3]], ["CA", 3, 4, 17], ["CHR", 1, "shared", [4]], ["CA", 2, 5, 17], ["CI", 1], ["FU", 6, [0, 1, 2, 3, 4]], ["AN", 6, 0, 5], ["FU", 6, [1, 2, 3, 4, 5]], ["AN", 6, 1, 4], ["FU", 6, [2, 3, 4, 5, 6]], ["AN", 6, 2, 6], ["FU", 4, [0, 1, 2, 3, 4]], ["SP", 4, 0, 72, [1], 1], ["AN", 4, 1, 2], ["FFSP", 4, 0, [5, 4, 3, 2, 1], 1, 1], ["AN", 4, 1, 6], ["FU", 2, [0, 1, 2, 3, 4]], ["SP", 2, 0, 192, [1], 1], ["AN", 2, 1, 2], ["FFSP", 2, 0, [5, 4, 3, 2, 1], 1, 1], ["AN", 2, 1, 6], ["PR", 5, 0, "auto_unroll_max_step$0"]]]], "r": [[8.50177e-05, 8.49832e-05, 8.50011e-05], 0, 5.96831, 1667896673], "v": "v0.6"}
{"i": [["[\"fused_conv3x3\", 1, 56, 56, 4, 4, 3, 3, 64]", "cuda -keys=cuda,gpu -max_num_threads=1024 -model=unknown -thread_warp_size=32", [-1, 16, 64, 49152, 2147483647, 1024, 8, 32], "", 0, []], [[], [["CHW", 3, "local"], ["SP", 3, 0, 1, [1, 1, 1, 1], 1], ["SP", 3, 5, 64, [1, 2, 2, 8], 1], ["SP", 3, 10, 56, [1, 1, 4, 1], 1], ["SP", 3, 15, 56, [1, 8, 1, 1], 1], ["SP", 3, 20, 4, [2, 1, 1, 2], 1], ["SP", 3, 25, 4, [1, 1], 1], ["SP", 3, 28, 3, [3, 1], 1], ["SP", 3, 31, 3, [3, 1], 1], ["RE", 3, [0, 5, 10, 15, 20, 1, 6, 11, 16, 21, 2, 7, 12, 17, 22, 25, 28, 31, 26, 29, 32, 3, 8, 13, 18, 23, 27, 30, 33, 4, 9, 14, 19, 24]], ["FSP", 4, 0, 1, 3], ["FSP", 4, 4, 2, 3], ["FSP", 4, 8, 3, 3], ["FSP", 4, 12, 4, 3], ["FSP", 4, 16, 5, 3], ["RE", 4, [0, 4, 8, 12, 16, 1, 5, 9, 13, 17, 2, 6, 10, 14, 18, 3, 7, 11, 15, 19]], ["CA", 3, 4, 14], ["CHR", 2, "shared", [3]], ["CA", 3, 4, 17], ["CHR", 1, "shared", [4]], ["CA", 2, 5, 17], ["CI", 1], ["FU", 6, [0, 1, 2, 3, 4]], ["AN", 6, 0, 5], ["FU", 6, [1, 2, 3, 4, 5]], ["AN", 6, 1, 4], ["FU", 6, [2, 3, 4, 5, 6]], ["AN", 6, 2, 6], ["FU", 4, [0, 1, 2, 3, 4]], ["SP", 4, 0, 96, [1], 1], ["AN", 4, 1, 2], ["FFSP", 4, 0, [5, 4, 3, 2, 1], 1, 1], ["AN", 4, 1, 6], ["FU", 2, [0, 1, 2, 3, 4]], ["SP", 2, 0, 288, [1], 1], ["AN", 2, 1, 2], ["FFSP", 2, 0, [5, 4, 3, 2, 1], 1, 1], ["AN", 2, 1, 6], ["PR", 5, 0, "auto_unroll_max_step$0"]]]], "r": [[0.000182937, 0.000183011, 0.000182946], 0, 9.94559, 1667896677], "v": "v0.6"}
{"i": [["[\"fused_conv3x3\", 1, 56, 56, 4, 4, 3, 3, 64]", "cuda -keys=cuda,gpu -max_num_threads=1024 -model=unknown -thread_warp_size=32", [-1, 16, 64, 49152, 2147483647, 1024, 8, 32], "", 0, []], [[], [["CHW", 3, "local"], ["SP", 3, 0, 1, [1, 1, 1, 1], 1], ["SP", 3, 5, 64, [1, 8, 1, 1], 1], ["SP", 3, 10, 56, [2, 2, 1, 14], 1], ["SP", 3, 15, 56, [1, 8, 1, 1], 1], ["SP", 3, 20, 4, [2, 2, 1, 1], 1], ["SP", 3, 25, 4, [1, 1], 1], ["SP", 3, 28, 3, [3, 1], 1], ["SP", 3, 31, 3, [1, 3], 1], ["RE", 3, [0, 5, 10, 15, 20, 1, 6, 11, 16, 21, 2, 7, 12, 17, 22, 25, 28, 31, 26, 29, 32, 3, 8, 13, 18, 23, 27, 30, 33, 4, 9, 14, 19, 24]], ["FSP", 4, 0, 1, 3], ["FSP", 4, 4, 2, 3], ["FSP", 4, 8, 3, 3], ["FSP", 4, 12, 4, 3], ["FSP", 4, 16, 5, 3], ["RE", 4, [0, 4, 8, 12, 16, 1, 5, 9, 13, 17, 2, 6, 10, 14, 18, 3, 7, 11, 15, 19]], ["CA", 3, 4, 14], ["CHR", 2, "shared", [3]], ["CA", 3, 4, 17], ["CHR", 1, "shared", [4]], ["CA", 2, 5, 17], ["CI", 1], ["FU", 6, [0, 1, 2, 3, 4]], ["AN", 6, 0, 5], ["FU", 6, [1, 2, 3, 4, 5]], ["AN", 6, 1, 4], ["FU", 6, [2, 3, 4, 5, 6]], ["AN", 6, 2, 6], ["FU", 4, [0, 1, 2, 3, 4]], ["SP", 4, 0, 9, [3], 1], ["AN", 4, 1, 2], ["FFSP", 4, 0, [5, 4, 3, 2, 1], 1, 1], ["AN", 4, 1, 6], ["FU", 2, [0, 1, 2, 3, 4]], ["SP", 2, 0, 48, [1], 1], ["AN", 2, 1, 2], ["FFSP", 2, 0, [5, 4, 3, 2, 1], 1, 1], ["AN", 2, 1, 6], ["PR", 5, 0, "auto_unroll_max_step$64"]]]], "r": [[1.84391e-05, 1.84327e-05, 1.84257e-05], 0, 4.38092, 1667896671], "v": "v0.6"}
{"i": [["[\"fused_conv3x3\", 1, 56, 56, 4, 4, 3, 3, 64]", "cuda -keys=cuda,gpu -max_num_threads=1024 -model=unknown -thread_warp_size=32", [-1, 16, 64, 49152, 2147483647, 1024, 8, 32], "", 0, []], [[], [["CHW", 3, "local"], ["SP", 3, 0, 1, [1, 1, 1, 1], 1], ["SP", 3, 5, 64, [1, 4, 1, 2], 1], ["SP", 3, 10, 56, [1, 2, 1, 2], 1], ["SP", 3, 15, 56, [1, 1, 14, 2], 1], ["SP", 3, 20, 4, [1, 4, 1, 1], 1], ["SP", 3, 25, 4, [1, 1], 1], ["SP", 3, 28, 3, [1, 1], 1], ["SP", 3, 31, 3, [1, 1], 1], ["RE", 3, [0, 5, 10, 15, 20, 1, 6, 11, 16, 21, 2, 7, 12, 17, 22, 25, 28, 31, 26, 29, 32, 3, 8, 13, 18, 23, 27, 30, 33, 4, 9, 14, 19, 24]], ["FSP", 4, 0, 1, 3], ["FSP", 4, 4, 2, 3], ["FSP", 4, 8, 3, 3], ["FSP", 4, 12, 4, 3], ["FSP", 4, 16, 5, 3], ["RE", 4, [0, 4, 8, 12, 16, 1, 5, 9, 13, 17, 2, 6, 10, 14, 18, 3, 7, 11, 15, 19]], ["CA", 3, 4, 14], ["CHR", 2, "shared", [3]], ["CA", 3, 4, 17], ["CHR", 1, "shared", [4]], ["CA", 2, 5, 17], ["CI", 1], ["FU", 6, [0, 1, 2, 3, 4]], ["AN", 6, 0, 5], ["FU", 6, [1, 2, 3, 4, 5]], ["AN", 6, 1, 4], ["FU", 6, [2, 3, 4, 5, 6]], ["AN", 6, 2, 6], ["FU", 4, [0, 1, 2, 3, 4]], ["SP", 4, 0, 2, [1], 1], ["AN", 4, 1, 2], ["FFSP", 4, 0, [5, 4, 3, 2, 1], 1, 1], ["AN", 4, 1, 6], ["FU", 2, [0, 1, 2, 3, 4]], ["SP", 2, 0, 112, [1], 1], ["AN", 2, 1, 2], ["FFSP", 2, 0, [5, 4, 3, 2, 1], 1, 1], ["AN", 2, 1, 6], ["PR", 5, 0, "auto_unroll_max_step$1024"]]]], "r": [[3.37348e-05, 3.37349e-05, 3.37256e-05], 0, 8.98589, 1667896675], "v": "v0.6"}
{"i": [["[\"fused_conv3x3\", 1, 56, 56, 4, 4, 3, 3, 64]", "cuda -keys=cuda,gpu -max_num_threads=1024 -model=unknown -thread_warp_size=32", [-1, 16, 64, 49152, 2147483647, 1024, 8, 32], "", 0, []], [[], [["CHW", 3, "local"], ["SP", 3, 0, 1, [1, 1, 1, 1], 1], ["SP", 3, 5, 64, [1, 8, 1, 8], 1], ["SP", 3, 10, 56, [2, 1, 2, 2], 1], ["SP", 3, 15, 56, [1, 4, 2, 1], 1], ["SP", 3, 20, 4, [2, 2, 1, 1], 1], ["SP", 3, 25, 4, [1, 1], 1], ["SP", 3, 28, 3, [3, 1], 1], ["SP", 3, 31, 3, [1, 3], 1], ["RE", 3, [0, 5, 10, 15, 20, 1, 6, 11, 16, 21, 2, 7, 12, 17, 22, 25, 28, 31, 26, 29, 32, 3, 8, 13, 18, 23, 27, 30, 33, 4, 9, 14, 19, 24]], ["FSP", 4, 0, 1, 3], ["FSP", 4, 4, 2, 3], ["FSP", 4, 8, 3, 3], ["FSP", 4, 12, 4, 3], ["FSP", 4, 16, 5, 3], ["RE", 4, [0, 4, 8, 12, 16, 1, 5, 9, 13, 17, 2, 6, 10, 14, 18, 3, 7, 11, 15, 19]], ["CA", 3, 4, 14], ["CHR", 2, "shared", [3]], ["CA", 3, 4, 17], ["CHR", 1, "shared", [4]], ["CA", 2, 5, 17], ["CI", 1], ["FU", 6, [0, 1, 2, 3, 4]], ["AN", 6, 0, 5], ["FU", 6, [1, 2, 3, 4, 5]], ["AN", 6, 1, 4], ["FU", 6, [2, 3, 4, 5, 6]], ["AN", 6, 2, 6], ["FU", 4, [0, 1, 2, 3, 4]], ["SP", 4, 0, 72, [1], 1], ["AN", 4, 1, 2], ["FFSP", 4, 0, [5, 4, 3, 2, 1], 1, 1], ["AN", 4, 1, 6], ["FU", 2, [0, 1, 2, 3, 4]], ["SP", 2, 0, 192, [1], 1], ["AN", 2, 1, 2], ["FFSP", 2, 0, [5, 4, 3, 2, 1], 1, 1], ["AN", 2, 1, 6], ["PR", 5, 0, "auto_unroll_max_step$64"]]]], "r": [[0.000180947, 0.000180961, 0.000180917], 0, 7.3448, 1667902444], "v": "v0.6"}
{"i": [["[\"fused_conv3x3\", 1, 56, 56, 4, 4, 3, 3, 64]", "cuda -keys=cuda,gpu -max_num_threads=1024 -model=unknown -thread_warp_size=32", [-1, 16, 64, 49152, 2147483647, 1024, 8, 32], "", 0, []], [[], [["CHW", 3, "local"], ["SP", 3, 0, 1, [1, 1, 1, 1], 1], ["SP", 3, 5, 64, [2, 4, 2, 2], 1], ["SP", 3, 10, 56, [1, 4, 14, 1], 1], ["SP", 3, 15, 56, [1, 1, 2, 1], 1], ["SP", 3, 20, 4, [2, 1, 2, 1], 1], ["SP", 3, 25, 4, [1, 1], 1], ["SP", 3, 28, 3, [1, 3], 1], ["SP", 3, 31, 3, [1, 3], 1], ["RE", 3, [0, 5, 10, 15, 20, 1, 6, 11, 16, 21, 2, 7, 12, 17, 22, 25, 28, 31, 26, 29, 32, 3, 8, 13, 18, 23, 27, 30, 33, 4, 9, 14, 19, 24]], ["FSP", 4, 0, 1, 3], ["FSP", 4, 4, 2, 3], ["FSP", 4, 8, 3, 3], ["FSP", 4, 12, 4, 3], ["FSP", 4, 16, 5, 3], ["RE", 4, [0, 4, 8, 12, 16, 1, 5, 9, 13, 17, 2, 6, 10, 14, 18, 3, 7, 11, 15, 19]], ["CA", 3, 4, 14], ["CHR", 2, "shared", [3]], ["CA", 3, 4, 17], ["CHR", 1, "shared", [4]], ["CA", 2, 5, 17], ["CI", 1], ["FU", 6, [0, 1, 2, 3, 4]], ["AN", 6, 0, 5], ["FU", 6, [1, 2, 3, 4, 5]], ["AN", 6, 1, 4], ["FU", 6, [2, 3, 4, 5, 6]], ["AN", 6, 2, 6], ["FU", 4, [0, 1, 2, 3, 4]], ["SP", 4, 0, 72, [1], 1], ["AN", 4, 1, 2], ["FFSP", 4, 0, [5, 4, 3, 2, 1], 1, 1], ["AN", 4, 1, 6], ["FU", 2, [0, 1, 2, 3, 4]], ["SP", 2, 0, 144, [1], 1], ["AN", 2, 1, 2], ["FFSP", 2, 0, [5, 4, 3, 2, 1], 1, 1], ["AN", 2, 1, 6], ["PR", 5, 0, "auto_unroll_max_step$1024"]]]], "r": [[0.000205089, 0.000204751, 0.000204848], 0, 16.6068, 1667902441], "v": "v0.6"}
{"i": [["[\"fused_conv3x3\", 1, 56, 56, 4, 4, 3, 3, 64]", "cuda -keys=cuda,gpu -max_num_threads=1024 -model=unknown -thread_warp_size=32", [-1, 16, 64, 49152, 2147483647, 1024, 8, 32], "", 0, []], [[], [["CHW", 3, "local"], ["SP", 3, 0, 1, [1, 1, 1, 1], 1], ["SP", 3, 5, 64, [1, 16, 2, 1], 1], ["SP", 3, 10, 56, [1, 1, 2, 1], 1], ["SP", 3, 15, 56, [2, 1, 7, 2], 1], ["SP", 3, 20, 4, [1, 2, 1, 1], 1], ["SP", 3, 25, 4, [2, 1], 1], ["SP", 3, 28, 3, [1, 1], 1], ["SP", 3, 31, 3, [1, 3], 1], ["RE", 3, [0, 5, 10, 15, 20, 1, 6, 11, 16, 21, 2, 7, 12, 17, 22, 25, 28, 31, 26, 29, 32, 3, 8, 13, 18, 23, 27, 30, 33, 4, 9, 14, 19, 24]], ["FSP", 4, 0, 1, 3], ["FSP", 4, 4, 2, 3], ["FSP", 4, 8, 3, 3], ["FSP", 4, 12, 4, 3], ["FSP", 4, 16, 5, 3], ["RE", 4, [0, 4, 8, 12, 16, 1, 5, 9, 13, 17, 2, 6, 10, 14, 18, 3, 7, 11, 15, 19]], ["CA", 3, 4, 14], ["CHR", 2, "shared", [3]], ["CA", 3, 4, 17], ["CHR", 1, "shared", [4]], ["CA", 2, 5, 17], ["CI", 1], ["FU", 6, [0, 1, 2, 3, 4]], ["AN", 6, 0, 5], ["FU", 6, [1, 2, 3, 4, 5]], ["AN", 6, 1, 4], ["FU", 6, [2, 3, 4, 5, 6]], ["AN", 6, 2, 6], ["FU", 4, [0, 1, 2, 3, 4]], ["SP", 4, 0, 12, [1], 1], ["AN", 4, 1, 2], ["FFSP", 4, 0, [5, 4, 3, 2, 1], 1, 1], ["AN", 4, 1, 6], ["FU", 2, [0, 1, 2, 3, 4]], ["SP", 2, 0, 224, [1], 1], ["AN", 2, 1, 2], ["FFSP", 2, 0, [5, 4, 3, 2, 1], 1, 1], ["AN", 2, 1, 6], ["PR", 5, 0, "auto_unroll_max_step$0"]]]], "r": [[0.000170479, 0.000170387, 0.000170545], 0, 12.0586, 1667902450], "v": "v0.6"}
{"i": [["[\"fused_conv3x3\", 1, 56, 56, 4, 4, 3, 3, 64]", "cuda -keys=cuda,gpu -max_num_threads=1024 -model=unknown -thread_warp_size=32", [-1, 16, 64, 49152, 2147483647, 1024, 8, 32], "", 0, []], [[], [["CHW", 3, "local"], ["SP", 3, 0, 1, [1, 1, 1, 1], 1], ["SP", 3, 5, 64, [1, 4, 2, 1], 1], ["SP", 3, 10, 56, [2, 7, 1, 1], 1], ["SP", 3, 15, 56, [1, 2, 1, 1], 1], ["SP", 3, 20, 4, [1, 1, 1, 4], 1], ["SP", 3, 25, 4, [1, 4], 1], ["SP", 3, 28, 3, [3, 1], 1], ["SP", 3, 31, 3, [1, 3], 1], ["RE", 3, [0, 5, 10, 15, 20, 1, 6, 11, 16, 21, 2, 7, 12, 17, 22, 25, 28, 31, 26, 29, 32, 3, 8, 13, 18, 23, 27, 30, 33, 4, 9, 14, 19, 24]], ["FSP", 4, 0, 1, 3], ["FSP", 4, 4, 2, 3], ["FSP", 4, 8, 3, 3], ["FSP", 4, 12, 4, 3], ["FSP", 4, 16, 5, 3], ["RE", 4, [0, 4, 8, 12, 16, 1, 5, 9, 13, 17, 2, 6, 10, 14, 18, 3, 7, 11, 15, 19]], ["CA", 3, 4, 14], ["CHR", 2, "shared", [3]], ["CA", 3, 4, 17], ["CHR", 1, "shared", [4]], ["CA", 2, 5, 17], ["CI", 1], ["FU", 6, [0, 1, 2, 3, 4]], ["AN", 6, 0, 5], ["FU", 6, [1, 2, 3, 4, 5]], ["AN", 6, 1, 4], ["FU", 6, [2, 3, 4, 5, 6]], ["AN", 6, 2, 6], ["FU", 4, [0, 1, 2, 3, 4]], ["SP", 4, 0, 144, [1], 1], ["AN", 4, 1, 2], ["FFSP", 4, 0, [5, 4, 3, 2, 1], 1, 1], ["AN", 4, 1, 6], ["FU", 2, [0, 1, 2, 3, 4]], ["SP", 2, 0, 72, [1], 1], ["AN", 2, 1, 2], ["FFSP", 2, 0, [5, 4, 3, 2, 1], 1, 1], ["AN", 2, 1, 6], ["PR", 5, 0, "auto_unroll_max_step$64"]]]], "r": [[1.83025e-05, 1.83063e-05, 1.83191e-05], 0, 6.21116, 1667902442], "v": "v0.6"}
{"i": [["[\"fused_conv3x3\", 1, 56, 56, 4, 4, 3, 3, 64]", "cuda -keys=cuda,gpu -max_num_threads=1024 -model=unknown -thread_warp_size=32", [-1, 16, 64, 49152, 2147483647, 1024, 8, 32], "", 0, []], [[], [["CHW", 3, "local"], ["SP", 3, 0, 1, [1, 1, 1, 1], 1], ["SP", 3, 5, 64, [2, 2, 1, 2], 1], ["SP", 3, 10, 56, [1, 1, 1, 1], 1], ["SP", 3, 15, 56, [1, 8, 1, 7], 1], ["SP", 3, 20, 4, [1, 2, 1, 1], 1], ["SP", 3, 25, 4, [1, 1], 1], ["SP", 3, 28, 3, [1, 3], 1], ["SP", 3, 31, 3, [1, 3], 1], ["RE", 3, [0, 5, 10, 15, 20, 1, 6, 11, 16, 21, 2, 7, 12, 17, 22, 25, 28, 31, 26, 29, 32, 3, 8, 13, 18, 23, 27, 30, 33, 4, 9, 14, 19, 24]], ["FSP", 4, 0, 1, 3], ["FSP", 4, 4, 2, 3], ["FSP", 4, 8, 3, 3], ["FSP", 4, 12, 4, 3], ["FSP", 4, 16, 5, 3], ["RE", 4, [0, 4, 8, 12, 16, 1, 5, 9, 13, 17, 2, 6, 10, 14, 18, 3, 7, 11, 15, 19]], ["CA", 3, 4, 14], ["CHR", 2, "shared", [3]], ["CA", 3, 4, 17], ["CHR", 1, "shared", [4]], ["CA", 2, 5, 17], ["CI", 1], ["FU", 6, [0, 1, 2, 3, 4]], ["AN", 6, 0, 5], ["FU", 6, [1, 2, 3, 4, 5]], ["AN", 6, 1, 4], ["FU", 6, [2, 3, 4, 5, 6]], ["AN", 6, 2, 6], ["FU", 4, [0, 1, 2, 3, 4]], ["SP", 4, 0, 36, [1], 1], ["AN", 4, 1, 2], ["FFSP", 4, 0, [5, 4, 3, 2, 1], 1, 1], ["AN", 4, 1, 6], ["FU", 2, [0, 1, 2, 3, 4]], ["SP", 2, 0, 108, [1], 1], ["AN", 2, 1, 2], ["FFSP", 2, 0, [5, 4, 3, 2, 1], 1, 1], ["AN", 2, 1, 6], ["PR", 5, 0, "auto_unroll_max_step$0"]]]], "r": [[7.22723e-05, 7.2271e-05, 7.22135e-05], 0, 11.067, 1667902449], "v": "v0.6"}
{"i": [["[\"fused_conv3x3\", 1, 56, 56, 4, 4, 3, 3, 64]", "cuda -keys=cuda,gpu -max_num_threads=1024 -model=unknown -thread_warp_size=32", [-1, 16, 64, 49152, 2147483647, 1024, 8, 32], "", 0, []], [[], [["CHW", 3, "local"], ["SP", 3, 0, 1, [1, 1, 1, 1], 1], ["SP", 3, 5, 64, [1, 4, 8, 1], 1], ["SP", 3, 10, 56, [4, 1, 1, 2], 1], ["SP", 3, 15, 56, [1, 7, 1, 2], 1], ["SP", 3, 20, 4, [1, 2, 1, 2], 1], ["SP", 3, 25, 4, [1, 2], 1], ["SP", 3, 28, 3, [1, 1], 1], ["SP", 3, 31, 3, [1, 1], 1], ["RE", 3, [0, 5, 10, 15, 20, 1, 6, 11, 16, 21, 2, 7, 12, 17, 22, 25, 28, 31, 26, 29, 32, 3, 8, 13, 18, 23, 27, 30, 33, 4, 9, 14, 19, 24]], ["FSP", 4, 0, 1, 3], ["FSP", 4, 4, 2, 3], ["FSP", 4, 8, 3, 3], ["FSP", 4, 12, 4, 3], ["FSP", 4, 16, 5, 3], ["RE", 4, [0, 4, 8, 12, 16, 1, 5, 9, 13, 17, 2, 6, 10, 14, 18, 3, 7, 11, 15, 19]], ["CA", 3, 4, 14], ["CHR", 2, "shared", [3]], ["CA", 3, 4, 17], ["CHR", 1, "shared", [4]], ["CA", 2, 5, 17], ["CI", 1], ["FU", 6, [0, 1, 2, 3, 4]], ["AN", 6, 0, 5], ["FU", 6, [1, 2, 3, 4, 5]], ["AN", 6, 1, 4], ["FU", 6, [2, 3, 4, 5, 6]], ["AN", 6, 2, 6], ["FU", 4, [0, 1, 2, 3, 4]], ["SP", 4, 0, 96, [1], 1], ["AN", 4, 1, 2], ["FFSP", 4, 0, [5, 4, 3, 2, 1], 1, 1], ["AN", 4, 1, 6], ["FU", 2, [0, 1, 2, 3, 4]], ["SP", 2, 0, 64, [1], 1], ["AN", 2, 1, 2], ["FFSP", 2, 0, [5, 4, 3, 2, 1], 1, 1], ["AN", 2, 1, 6], ["PR", 5, 0, "auto_unroll_max_step$1024"]]]], "r": [[0.000134364, 0.000134295, 0.000134326], 0, 16.6557, 1667902448], "v": "v0.6"}
{"i": [["[\"fused_conv3x3\", 1, 56, 56, 4, 4, 3, 3, 64]", "cuda -keys=cuda,gpu -max_num_threads=1024 -model=unknown -thread_warp_size=32", [-1, 16, 64, 49152, 2147483647, 1024, 8, 32], "", 0, []], [[], [["CHW", 3, "local"], ["SP", 3, 0, 1, [1, 1, 1, 1], 1], ["SP", 3, 5, 64, [1, 4, 2, 4], 1], ["SP", 3, 10, 56, [2, 2, 1, 7], 1], ["SP", 3, 15, 56, [1, 2, 1, 2], 1], ["SP", 3, 20, 4, [2, 2, 1, 1], 1], ["SP", 3, 25, 4, [1, 1], 1], ["SP", 3, 28, 3, [1, 1], 1], ["SP", 3, 31, 3, [1, 3], 1], ["RE", 3, [0, 5, 10, 15, 20, 1, 6, 11, 16, 21, 2, 7, 12, 17, 22, 25, 28, 31, 26, 29, 32, 3, 8, 13, 18, 23, 27, 30, 33, 4, 9, 14, 19, 24]], ["FSP", 4, 0, 1, 3], ["FSP", 4, 4, 2, 3], ["FSP", 4, 8, 3, 3], ["FSP", 4, 12, 4, 3], ["FSP", 4, 16, 5, 3], ["RE", 4, [0, 4, 8, 12, 16, 1, 5, 9, 13, 17, 2, 6, 10, 14, 18, 3, 7, 11, 15, 19]], ["CA", 3, 4, 14], ["CHR", 2, "shared", [3]], ["CA", 3, 4, 17], ["CHR", 1, "shared", [4]], ["CA", 2, 5, 17], ["CI", 1], ["FU", 6, [0, 1, 2, 3, 4]], ["AN", 6, 0, 5], ["FU", 6, [1, 2, 3, 4, 5]], ["AN", 6, 1, 4], ["FU", 6, [2, 3, 4, 5, 6]], ["AN", 6, 2, 6], ["FU", 4, [0, 1, 2, 3, 4]], ["SP", 4, 0, 72, [1], 1], ["AN", 4, 1, 2], ["FFSP", 4, 0, [5, 4, 3, 2, 1], 1, 1], ["AN", 4, 1, 6], ["FU", 2, [0, 1, 2, 3, 4]], ["SP", 2, 0, 512, [1], 1], ["AN", 2, 1, 2], ["FFSP", 2, 0, [5, 4, 3, 2, 1], 1, 1], ["AN", 2, 1, 6], ["PR", 5, 0, "auto_unroll_max_step$16"]]]], "r": [[0.000153506, 0.000153441, 0.000153423], 0, 15.9646, 1667902453], "v": "v0.6"}
{"i": [["[\"fused_conv3x3\", 1, 56, 56, 4, 4, 3, 3, 64]", "cuda -keys=cuda,gpu -max_num_threads=1024 -model=unknown -thread_warp_size=32", [-1, 16, 64, 49152, 2147483647, 1024, 8, 32], "", 0, []], [[], [["CHW", 3, "local"], ["SP", 3, 0, 1, [1, 1, 1, 1], 1], ["SP", 3, 5, 64, [1, 2, 1, 2], 1], ["SP", 3, 10, 56, [1, 4, 1, 14], 1], ["SP", 3, 15, 56, [1, 4, 2, 1], 1], ["SP", 3, 20, 4, [1, 2, 1, 1], 1], ["SP", 3, 25, 4, [4, 1], 1], ["SP", 3, 28, 3, [1, 1], 1], ["SP", 3, 31, 3, [1, 1], 1], ["RE", 3, [0, 5, 10, 15, 20, 1, 6, 11, 16, 21, 2, 7, 12, 17, 22, 25, 28, 31, 26, 29, 32, 3, 8, 13, 18, 23, 27, 30, 33, 4, 9, 14, 19, 24]], ["FSP", 4, 0, 1, 3], ["FSP", 4, 4, 2, 3], ["FSP", 4, 8, 3, 3], ["FSP", 4, 12, 4, 3], ["FSP", 4, 16, 5, 3], ["RE", 4, [0, 4, 8, 12, 16, 1, 5, 9, 13, 17, 2, 6, 10, 14, 18, 3, 7, 11, 15, 19]], ["CA", 3, 4, 14], ["CHR", 2, "shared", [3]], ["CA", 3, 4, 17], ["CHR", 1, "shared", [4]], ["CA", 2, 5, 17], ["CI", 1], ["FU", 6, [0, 1, 2, 3, 4]], ["AN", 6, 0, 5], ["FU", 6, [1, 2, 3, 4, 5]], ["AN", 6, 1, 4], ["FU", 6, [2, 3, 4, 5, 6]], ["AN", 6, 2, 6], ["FU", 4, [0, 1, 2, 3, 4]], ["SP", 4, 0, 48, [1], 1], ["AN", 4, 1, 2], ["FFSP", 4, 0, [5, 4, 3, 2, 1], 1, 1], ["AN", 4, 1, 6], ["FU", 2, [0, 1, 2, 3, 4]], ["SP", 2, 0, 448, [1], 1], ["AN", 2, 1, 2], ["FFSP", 2, 0, [5, 4, 3, 2, 1], 1, 1], ["AN", 2, 1, 6], ["PR", 5, 0, "auto_unroll_max_step$64"]]]], "r": [[7.25852e-05, 7.24885e-05, 7.26509e-05], 0, 5.98265, 1667902444], "v": "v0.6"}
{"i": [["[\"fused_conv3x3\", 1, 56, 56, 4, 4, 3, 3, 64]", "cuda -keys=cuda,gpu -max_num_threads=1024 -model=unknown -thread_warp_size=32", [-1, 16, 64, 49152, 2147483647, 1024, 8, 32], "", 0, []], [[], [["CHW", 3, "local"], ["SP", 3, 0, 1, [1, 1, 1, 1], 1], ["SP", 3, 5, 64, [1, 2, 1, 2], 1], ["SP", 3, 10, 56, [1, 14, 1, 2], 1], ["SP", 3, 15, 56, [2, 1, 7, 2], 1], ["SP", 3, 20, 4, [1, 2, 1, 1], 1], ["SP", 3, 25, 4, [1, 1], 1], ["SP", 3, 28, 3, [3, 1], 1], ["SP", 3, 31, 3, [1, 1], 1], ["RE", 3, [0, 5, 10, 15, 20, 1, 6, 11, 16, 21, 2, 7, 12, 17, 22, 25, 28, 31, 26, 29, 32, 3, 8, 13, 18, 23, 27, 30, 33, 4, 9, 14, 19, 24]], ["FSP", 4, 0, 1, 3], ["FSP", 4, 4, 2, 3], ["FSP", 4, 8, 3, 3], ["FSP", 4, 12, 4, 3], ["FSP", 4, 16, 5, 3], ["RE", 4, [0, 4, 8, 12, 16, 1, 5, 9, 13, 17, 2, 6, 10, 14, 18, 3, 7, 11, 15, 19]], ["CA", 3, 4, 14], ["CHR", 2, "shared", [3]], ["CA", 3, 4, 17], ["CHR", 1, "shared", [4]], ["CA", 2, 5, 17], ["CI", 1], ["FU", 6, [0, 1, 2, 3, 4]], ["AN", 6, 0, 5], ["FU", 6, [1, 2, 3, 4, 5]], ["AN", 6, 1, 4], ["FU", 6, [2, 3, 4, 5, 6]], ["AN", 6, 2, 6], ["FU", 4, [0, 1, 2, 3, 4]], ["SP", 4, 0, 6, [1], 1], ["AN", 4, 1, 2], ["FFSP", 4, 0, [5, 4, 3, 2, 1], 1, 1], ["AN", 4, 1, 6], ["FU", 2, [0, 1, 2, 3, 4]], ["SP", 2, 0, 128, [1], 1], ["AN", 2, 1, 2], ["FFSP", 2, 0, [5, 4, 3, 2, 1], 1, 1], ["AN", 2, 1, 6], ["PR", 5, 0, "auto_unroll_max_step$64"]]]], "r": [[0.000303817, 0.000303721, 0.000304307], 0, 6.92107, 1667902445], "v": "v0.6"}
{"i": [["[\"fused_conv3x3\", 1, 56, 56, 4, 4, 3, 3, 64]", "cuda -keys=cuda,gpu -max_num_threads=1024 -model=unknown -thread_warp_size=32", [-1, 16, 64, 49152, 2147483647, 1024, 8, 32], "", 0, []], [[], [["CHW", 3, "local"], ["SP", 3, 0, 1, [1, 1, 1, 1], 1], ["SP", 3, 5, 64, [1, 1, 2, 2], 1], ["SP", 3, 10, 56, [2, 1, 4, 1], 1], ["SP", 3, 15, 56, [1, 28, 2, 1], 1], ["SP", 3, 20, 4, [1, 2, 1, 1], 1], ["SP", 3, 25, 4, [2, 1], 1], ["SP", 3, 28, 3, [3, 1], 1], ["SP", 3, 31, 3, [1, 1], 1], ["RE", 3, [0, 5, 10, 15, 20, 1, 6, 11, 16, 21, 2, 7, 12, 17, 22, 25, 28, 31, 26, 29, 32, 3, 8, 13, 18, 23, 27, 30, 33, 4, 9, 14, 19, 24]], ["FSP", 4, 0, 1, 3], ["FSP", 4, 4, 2, 3], ["FSP", 4, 8, 3, 3], ["FSP", 4, 12, 4, 3], ["FSP", 4, 16, 5, 3], ["RE", 4, [0, 4, 8, 12, 16, 1, 5, 9, 13, 17, 2, 6, 10, 14, 18, 3, 7, 11, 15, 19]], ["CA", 3, 4, 14], ["CHR", 2, "shared", [3]], ["CA", 3, 4, 17], ["CHR", 1, "shared", [4]], ["CA", 2, 5, 17], ["CI", 1], ["FU", 6, [0, 1, 2, 3, 4]], ["AN", 6, 0, 5], ["FU", 6, [1, 2, 3, 4, 5]], ["AN", 6, 1, 4], ["FU", 6, [2, 3, 4, 5, 6]], ["AN", 6, 2, 6], ["FU", 4, [0, 1, 2, 3, 4]], ["SP", 4, 0, 12, [1], 1], ["AN", 4, 1, 2], ["FFSP", 4, 0, [5, 4, 3, 2, 1], 1, 1], ["AN", 4, 1, 6], ["FU", 2, [0, 1, 2, 3, 4]], ["SP", 2, 0, 96, [1], 1], ["AN", 2, 1, 2], ["FFSP", 2, 0, [5, 4, 3, 2, 1], 1, 1], ["AN", 2, 1, 6], ["PR", 5, 0, "auto_unroll_max_step$0"]]]], "r": [[0.000169556, 0.000169512, 0.00016963], 0, 1.45045, 1667902439], "v": "v0.6"}
{"i": [["[\"fused_conv3x3\", 1, 56, 56, 4, 4, 3, 3, 64]", "cuda -keys=cuda,gpu -max_num_threads=1024 -model=unknown -thread_warp_size=32", [-1, 16, 64, 49152, 2147483647, 1024, 8, 32], "", 0, []], [[], [["CHW", 3, "local"], ["SP", 3, 0, 1, [1, 1, 1, 1], 1], ["SP", 3, 5, 64, [1, 4, 1, 8], 1], ["SP", 3, 10, 56, [8, 1, 1, 1], 1], ["SP", 3, 15, 56, [1, 4, 1, 1], 1], ["SP", 3, 20, 4, [1, 2, 2, 1], 1], ["SP", 3, 25, 4, [1, 4], 1], ["SP", 3, 28, 3, [1, 1], 1], ["SP", 3, 31, 3, [3, 1], 1], ["RE", 3, [0, 5, 10, 15, 20, 1, 6, 11, 16, 21, 2, 7, 12, 17, 22, 25, 28, 31, 26, 29, 32, 3, 8, 13, 18, 23, 27, 30, 33, 4, 9, 14, 19, 24]], ["FSP", 4, 0, 1, 3], ["FSP", 4, 4, 2, 3], ["FSP", 4, 8, 3, 3], ["FSP", 4, 12, 4, 3], ["FSP", 4, 16, 5, 3], ["RE", 4, [0, 4, 8, 12, 16, 1, 5, 9, 13, 17, 2, 6, 10, 14, 18, 3, 7, 11, 15, 19]], ["CA", 3, 4, 14], ["CHR", 2, "shared", [3]], ["CA", 3, 4, 17], ["CHR", 1, "shared", [4]], ["CA", 2, 5, 17], ["CI", 1], ["FU", 6, [0, 1, 2, 3, 4]], ["AN", 6, 0, 5], ["FU", 6, [1, 2, 3, 4, 5]], ["AN", 6, 1, 4], ["FU", 6, [2, 3, 4, 5, 6]], ["AN", 6, 2, 6], ["FU", 4, [0, 1, 2, 3, 4]], ["SP", 4, 0, 64, [64], 1], ["AN", 4, 1, 2], ["FFSP", 4, 0, [5, 4, 3, 2, 1], 1, 1], ["AN", 4, 1, 6], ["FU", 2, [0, 1, 2, 3, 4]], ["SP", 2, 0, 64, [1], 1], ["AN", 2, 1, 2], ["FFSP", 2, 0, [5, 4, 3, 2, 1], 1, 1], ["AN", 2, 1, 6], ["PR", 5, 0, "auto_unroll_max_step$64"]]]], "r": [[6.79494e-05, 6.79421e-05, 6.79771e-05], 0, 4.60565, 1667902442], "v": "v0.6"}
{"i": [["[\"fused_conv3x3\", 1, 56, 56, 4, 4, 3, 3, 64]", "cuda -keys=cuda,gpu -max_num_threads=1024 -model=unknown -thread_warp_size=32", [-1, 16, 64, 49152, 2147483647, 1024, 8, 32], "", 0, []], [[], [["CHW", 3, "local"], ["SP", 3, 0, 1, [1, 1, 1, 1], 1], ["SP", 3, 5, 64, [1, 8, 2, 2], 1], ["SP", 3, 10, 56, [1, 2, 1, 14], 1], ["SP", 3, 15, 56, [2, 4, 1, 1], 1], ["SP", 3, 20, 4, [4, 1, 1, 1], 1], ["SP", 3, 25, 4, [1, 1], 1], ["SP", 3, 28, 3, [3, 1], 1], ["SP", 3, 31, 3, [1, 1], 1], ["RE", 3, [0, 5, 10, 15, 20, 1, 6, 11, 16, 21, 2, 7, 12, 17, 22, 25, 28, 31, 26, 29, 32, 3, 8, 13, 18, 23, 27, 30, 33, 4, 9, 14, 19, 24]], ["FSP", 4, 0, 1, 3], ["FSP", 4, 4, 2, 3], ["FSP", 4, 8, 3, 3], ["FSP", 4, 12, 4, 3], ["FSP", 4, 16, 5, 3], ["RE", 4, [0, 4, 8, 12, 16, 1, 5, 9, 13, 17, 2, 6, 10, 14, 18, 3, 7, 11, 15, 19]], ["CA", 3, 4, 14], ["CHR", 2, "shared", [3]], ["CA", 3, 4, 17], ["CHR", 1, "shared", [4]], ["CA", 2, 5, 17], ["CI", 1], ["FU", 6, [0, 1, 2, 3, 4]], ["AN", 6, 0, 5], ["FU", 6, [1, 2, 3, 4, 5]], ["AN", 6, 1, 4], ["FU", 6, [2, 3, 4, 5, 6]], ["AN", 6, 2, 6], ["FU", 4, [0, 1, 2, 3, 4]], ["SP", 4, 0, 12, [1], 1], ["AN", 4, 1, 2], ["FFSP", 4, 0, [5, 4, 3, 2, 1], 1, 1], ["AN", 4, 1, 6], ["FU", 2, [0, 1, 2, 3, 4]], ["SP", 2, 0, 192, [1], 1], ["AN", 2, 1, 2], ["FFSP", 2, 0, [5, 4, 3, 2, 1], 1, 1], ["AN", 2, 1, 6], ["PR", 5, 0, "auto_unroll_max_step$16"]]]], "r": [[0.000658454, 0.000659129, 0.000659355], 0, 2.75684, 1667902440], "v": "v0.6"}
{"i": [["[\"fused_conv3x3\", 1, 56, 56, 4, 4, 3, 3, 64]", "cuda -keys=cuda,gpu -max_num_threads=1024 -model=unknown -thread_warp_size=32", [-1, 16, 64, 49152, 2147483647, 1024, 8, 32], "", 0, []], [[], [["CHW", 3, "local"], ["SP", 3, 0, 1, [1, 1, 1, 1], 1], ["SP", 3, 5, 64, [1, 8, 1, 8], 1], ["SP", 3, 10, 56, [2, 1, 2, 2], 1], ["SP", 3, 15, 56, [2, 2, 2, 1], 1], ["SP", 3, 20, 4, [2, 2, 1, 1], 1], ["SP", 3, 25, 4, [1, 1], 1], ["SP", 3, 28, 3, [3, 1], 1], ["SP", 3, 31, 3, [1, 1], 1], ["RE", 3, [0, 5, 10, 15, 20, 1, 6, 11, 16, 21, 2, 7, 12, 17, 22, 25, 28, 31, 26, 29, 32, 3, 8, 13, 18, 23, 27, 30, 33, 4, 9, 14, 19, 24]], ["FSP", 4, 0, 1, 3], ["FSP", 4, 4, 2, 3], ["FSP", 4, 8, 3, 3], ["FSP", 4, 12, 4, 3], ["FSP", 4, 16, 5, 3], ["RE", 4, [0, 4, 8, 12, 16, 1, 5, 9, 13, 17, 2, 6, 10, 14, 18, 3, 7, 11, 15, 19]], ["CA", 3, 4, 14], ["CHR", 2, "shared", [3]], ["CA", 3, 4, 17], ["CHR", 1, "shared", [4]], ["CA", 2, 5, 17], ["CI", 1], ["FU", 6, [0, 1, 2, 3, 4]], ["AN", 6, 0, 5], ["FU", 6, [1, 2, 3, 4, 5]], ["AN", 6, 1, 4], ["FU", 6, [2, 3, 4, 5, 6]], ["AN", 6, 2, 6], ["FU", 4, [0, 1, 2, 3, 4]], ["SP", 4, 0, 72, [1], 1], ["AN", 4, 1, 2], ["FFSP", 4, 0, [5, 4, 3, 2, 1], 1, 1], ["AN", 4, 1, 6], ["FU", 2, [0, 1, 2, 3, 4]], ["SP", 2, 0, 192, [1], 1], ["AN", 2, 1, 2], ["FFSP", 2, 0, [5, 4, 3, 2, 1], 1, 1], ["AN", 2, 1, 6], ["PR", 5, 0, "auto_unroll_max_step$64"]]]], "r": [[0.000865709, 0.000865403, 0.000865497], 0, 14.7939, 1667902452], "v": "v0.6"}
{"i": [["[\"fused_conv3x3\", 1, 56, 56, 4, 4, 3, 3, 64]", "cuda -keys=cuda,gpu -max_num_threads=1024 -model=unknown -thread_warp_size=32", [-1, 16, 64, 49152, 2147483647, 1024, 8, 32], "", 0, []], [[], [["CHW", 3, "local"], ["SP", 3, 0, 1, [1, 1, 1, 1], 1], ["SP", 3, 5, 64, [1, 8, 4, 1], 1], ["SP", 3, 10, 56, [1, 1, 2, 2], 1], ["SP", 3, 15, 56, [1, 7, 1, 1], 1], ["SP", 3, 20, 4, [1, 1, 1, 1], 1], ["SP", 3, 25, 4, [1, 4], 1], ["SP", 3, 28, 3, [1, 1], 1], ["SP", 3, 31, 3, [1, 1], 1], ["RE", 3, [0, 5, 10, 15, 20, 1, 6, 11, 16, 21, 2, 7, 12, 17, 22, 25, 28, 31, 26, 29, 32, 3, 8, 13, 18, 23, 27, 30, 33, 4, 9, 14, 19, 24]], ["FSP", 4, 0, 1, 3], ["FSP", 4, 4, 2, 3], ["FSP", 4, 8, 3, 3], ["FSP", 4, 12, 4, 3], ["FSP", 4, 16, 5, 3], ["RE", 4, [0, 4, 8, 12, 16, 1, 5, 9, 13, 17, 2, 6, 10, 14, 18, 3, 7, 11, 15, 19]], ["CA", 3, 4, 14], ["CHR", 2, "shared", [3]], ["CA", 3, 4, 17], ["CHR", 1, "shared", [4]], ["CA", 2, 5, 17], ["CI", 1], ["FU", 6, [0, 1, 2, 3, 4]], ["AN", 6, 0, 5], ["FU", 6, [1, 2, 3, 4, 5]], ["AN", 6, 1, 4], ["FU", 6, [2, 3, 4, 5, 6]], ["AN", 6, 2, 6], ["FU", 4, [0, 1, 2, 3, 4]], ["SP", 4, 0, 16, [4], 1], ["AN", 4, 1, 2], ["FFSP", 4, 0, [5, 4, 3, 2, 1], 1, 1], ["AN", 4, 1, 6], ["FU", 2, [0, 1, 2, 3, 4]], ["SP", 2, 0, 64, [2], 1], ["AN", 2, 1, 2], ["FFSP", 2, 0, [5, 4, 3, 2, 1], 1, 1], ["AN", 2, 1, 6], ["PR", 5, 0, "auto_unroll_max_step$512"]]]], "r": [[7.73968e-05, 7.73817e-05, 7.74672e-05], 0, 29.2703, 1667902458], "v": "v0.6"}
{"i": [["[\"fused_conv3x3\", 1, 56, 56, 4, 4, 3, 3, 64]", "cuda -keys=cuda,gpu -max_num_threads=1024 -model=unknown -thread_warp_size=32", [-1, 16, 64, 49152, 2147483647, 1024, 8, 32], "", 0, []], [[], [["CHW", 3, "local"], ["SP", 3, 0, 1, [1, 1, 1, 1], 1], ["SP", 3, 5, 64, [1, 8, 2, 1], 1], ["SP", 3, 10, 56, [1, 7, 1, 2], 1], ["SP", 3, 15, 56, [1, 1, 2, 2], 1], ["SP", 3, 20, 4, [2, 2, 1, 1], 1], ["SP", 3, 25, 4, [1, 2], 1], ["SP", 3, 28, 3, [1, 1], 1], ["SP", 3, 31, 3, [1, 1], 1], ["RE", 3, [0, 5, 10, 15, 20, 1, 6, 11, 16, 21, 2, 7, 12, 17, 22, 25, 28, 31, 26, 29, 32, 3, 8, 13, 18, 23, 27, 30, 33, 4, 9, 14, 19, 24]], ["FSP", 4, 0, 1, 3], ["FSP", 4, 4, 2, 3], ["FSP", 4, 8, 3, 3], ["FSP", 4, 12, 4, 3], ["FSP", 4, 16, 5, 3], ["RE", 4, [0, 4, 8, 12, 16, 1, 5, 9, 13, 17, 2, 6, 10, 14, 18, 3, 7, 11, 15, 19]], ["CA", 3, 4, 14], ["CHR", 2, "shared", [3]], ["CA", 3, 4, 17], ["CHR", 1, "shared", [4]], ["CA", 2, 5, 17], ["CI", 1], ["FU", 6, [0, 1, 2, 3, 4]], ["AN", 6, 0, 5], ["FU", 6, [1, 2, 3, 4, 5]], ["AN", 6, 1, 4], ["FU", 6, [2, 3, 4, 5, 6]], ["AN", 6, 2, 6], ["FU", 4, [0, 1, 2, 3, 4]], ["SP", 4, 0, 4, [1], 1], ["AN", 4, 1, 2], ["FFSP", 4, 0, [5, 4, 3, 2, 1], 1, 1], ["AN", 4, 1, 6], ["FU", 2, [0, 1, 2, 3, 4]], ["SP", 2, 0, 16, [8], 1], ["AN", 2, 1, 2], ["FFSP", 2, 0, [5, 4, 3, 2, 1], 1, 1], ["AN", 2, 1, 6], ["PR", 5, 0, "auto_unroll_max_step$64"]]]], "r": [[0.000110067, 0.000110007, 0.000110028], 0, 16.0257, 1667902454], "v": "v0.6"}
{"i": [["[\"fused_conv3x3\", 1, 56, 56, 4, 4, 3, 3, 64]", "cuda -keys=cuda,gpu -max_num_threads=1024 -model=unknown -thread_warp_size=32", [-1, 16, 64, 49152, 2147483647, 1024, 8, 32], "", 0, []], [[], [["CHW", 3, "local"], ["SP", 3, 0, 1, [1, 1, 1, 1], 1], ["SP", 3, 5, 64, [2, 1, 1, 4], 1], ["SP", 3, 10, 56, [1, 28, 1, 1], 1], ["SP", 3, 15, 56, [1, 2, 1, 1], 1], ["SP", 3, 20, 4, [1, 1, 1, 2], 1], ["SP", 3, 25, 4, [2, 1], 1], ["SP", 3, 28, 3, [1, 3], 1], ["SP", 3, 31, 3, [1, 3], 1], ["RE", 3, [0, 5, 10, 15, 20, 1, 6, 11, 16, 21, 2, 7, 12, 17, 22, 25, 28, 31, 26, 29, 32, 3, 8, 13, 18, 23, 27, 30, 33, 4, 9, 14, 19, 24]], ["FSP", 4, 0, 1, 3], ["FSP", 4, 4, 2, 3], ["FSP", 4, 8, 3, 3], ["FSP", 4, 12, 4, 3], ["FSP", 4, 16, 5, 3], ["RE", 4, [0, 4, 8, 12, 16, 1, 5, 9, 13, 17, 2, 6, 10, 14, 18, 3, 7, 11, 15, 19]], ["CA", 3, 4, 14], ["CHR", 2, "shared", [3]], ["CA", 3, 4, 17], ["CHR", 1, "shared", [4]], ["CA", 2, 5, 17], ["CI", 1], ["FU", 6, [0, 1, 2, 3, 4]], ["AN", 6, 0, 5], ["FU", 6, [1, 2, 3, 4, 5]], ["AN", 6, 1, 4], ["FU", 6, [2, 3, 4, 5, 6]], ["AN", 6, 2, 6], ["FU", 4, [0, 1, 2, 3, 4]], ["SP", 4, 0, 72, [1], 1], ["AN", 4, 1, 2], ["FFSP", 4, 0, [5, 4, 3, 2, 1], 1, 1], ["AN", 4, 1, 6], ["FU", 2, [0, 1, 2, 3, 4]], ["SP", 2, 0, 72, [1], 1], ["AN", 2, 1, 2], ["FFSP", 2, 0, [5, 4, 3, 2, 1], 1, 1], ["AN", 2, 1, 6], ["PR", 5, 0, "auto_unroll_max_step$1024"]]]], "r": [[2.25257e-05, 2.254e-05, 2.25239e-05], 0, 20.431, 1667902456], "v": "v0.6"}
{"i": [["[\"fused_conv3x3\", 1, 56, 56, 4, 4, 3, 3, 64]", "cuda -keys=cuda,gpu -max_num_threads=1024 -model=unknown -thread_warp_size=32", [-1, 16, 64, 49152, 2147483647, 1024, 8, 32], "", 0, []], [[], [["CHW", 3, "local"], ["SP", 3, 0, 1, [1, 1, 1, 1], 1], ["SP", 3, 5, 64, [1, 1, 4, 1], 1], ["SP", 3, 10, 56, [1, 7, 1, 1], 1], ["SP", 3, 15, 56, [4, 7, 2, 1], 1], ["SP", 3, 20, 4, [1, 1, 1, 4], 1], ["SP", 3, 25, 4, [2, 1], 1], ["SP", 3, 28, 3, [1, 3], 1], ["SP", 3, 31, 3, [3, 1], 1], ["RE", 3, [0, 5, 10, 15, 20, 1, 6, 11, 16, 21, 2, 7, 12, 17, 22, 25, 28, 31, 26, 29, 32, 3, 8, 13, 18, 23, 27, 30, 33, 4, 9, 14, 19, 24]], ["FSP", 4, 0, 1, 3], ["FSP", 4, 4, 2, 3], ["FSP", 4, 8, 3, 3], ["FSP", 4, 12, 4, 3], ["FSP", 4, 16, 5, 3], ["RE", 4, [0, 4, 8, 12, 16, 1, 5, 9, 13, 17, 2, 6, 10, 14, 18, 3, 7, 11, 15, 19]], ["CA", 3, 4, 14], ["CHR", 2, "shared", [3]], ["CA", 3, 4, 17], ["CHR", 1, "shared", [4]], ["CA", 2, 5, 17], ["CI", 1], ["FU", 6, [0, 1, 2, 3, 4]], ["AN", 6, 0, 5], ["FU", 6, [1, 2, 3, 4, 5]], ["AN", 6, 1, 4], ["FU", 6, [2, 3, 4, 5, 6]], ["AN", 6, 2, 6], ["FU", 4, [0, 1, 2, 3, 4]], ["SP", 4, 0, 72, [1], 1], ["AN", 4, 1, 2], ["FFSP", 4, 0, [5, 4, 3, 2, 1], 1, 1], ["AN", 4, 1, 6], ["FU", 2, [0, 1, 2, 3, 4]], ["SP", 2, 0, 24, [1], 1], ["AN", 2, 1, 2], ["FFSP", 2, 0, [5, 4, 3, 2, 1], 1, 1], ["AN", 2, 1, 6], ["PR", 5, 0, "auto_unroll_max_step$1024"]]]], "r": [[4.01582e-05, 4.01347e-05, 4.00932e-05], 0, 10.7501, 1667902446], "v": "v0.6"}
{"i": [["[\"fused_conv3x3\", 1, 56, 56, 4, 4, 3, 3, 64]", "cuda -keys=cuda,gpu -max_num_threads=1024 -model=unknown -thread_warp_size=32", [-1, 16, 64, 49152, 2147483647, 1024, 8, 32], "", 0, []], [[], [["CHW", 3, "local"], ["SP", 3, 0, 1, [1, 1, 1, 1], 1], ["SP", 3, 5, 64, [1, 16, 2, 2], 1], ["SP", 3, 10, 56, [1, 2, 7, 1], 1], ["SP", 3, 15, 56, [1, 1, 2, 2], 1], ["SP", 3, 20, 4, [1, 1, 2, 2], 1], ["SP", 3, 25, 4, [1, 1], 1], ["SP", 3, 28, 3, [1, 1], 1], ["SP", 3, 31, 3, [3, 1], 1], ["RE", 3, [0, 5, 10, 15, 20, 1, 6, 11, 16, 21, 2, 7, 12, 17, 22, 25, 28, 31, 26, 29, 32, 3, 8, 13, 18, 23, 27, 30, 33, 4, 9, 14, 19, 24]], ["FSP", 4, 0, 1, 3], ["FSP", 4, 4, 2, 3], ["FSP", 4, 8, 3, 3], ["FSP", 4, 12, 4, 3], ["FSP", 4, 16, 5, 3], ["RE", 4, [0, 4, 8, 12, 16, 1, 5, 9, 13, 17, 2, 6, 10, 14, 18, 3, 7, 11, 15, 19]], ["CA", 3, 4, 14], ["CHR", 2, "shared", [3]], ["CA", 3, 4, 17], ["CHR", 1, "shared", [4]], ["CA", 2, 5, 17], ["CI", 1], ["FU", 6, [0, 1, 2, 3, 4]], ["AN", 6, 0, 5], ["FU", 6, [1, 2, 3, 4, 5]], ["AN", 6, 1, 4], ["FU", 6, [2, 3, 4, 5, 6]], ["AN", 6, 2, 6], ["FU", 4, [0, 1, 2, 3, 4]], ["SP", 4, 0, 96, [1], 1], ["AN", 4, 1, 2], ["FFSP", 4, 0, [5, 4, 3, 2, 1], 1, 1], ["AN", 4, 1, 6], ["FU", 2, [0, 1, 2, 3, 4]], ["SP", 2, 0, 224, [1], 1], ["AN", 2, 1, 2], ["FFSP", 2, 0, [5, 4, 3, 2, 1], 1, 1], ["AN", 2, 1, 6], ["PR", 5, 0, "auto_unroll_max_step$1024"]]]], "r": [[0.000462053, 0.000461445, 0.000461167], 0, 11.6948, 1667902443], "v": "v0.6"}
{"i": [["[\"fused_conv3x3\", 1, 56, 56, 4, 4, 3, 3, 64]", "cuda -keys=cuda,gpu -max_num_threads=1024 -model=unknown -thread_warp_size=32", [-1, 16, 64, 49152, 2147483647, 1024, 8, 32], "", 0, []], [[], [["CHW", 3, "local"], ["SP", 3, 0, 1, [1, 1, 1, 1], 1], ["SP", 3, 5, 64, [2, 1, 1, 1], 1], ["SP", 3, 10, 56, [1, 56, 1, 1], 1], ["SP", 3, 15, 56, [7, 1, 8, 1], 1], ["SP", 3, 20, 4, [1, 4, 1, 1], 1], ["SP", 3, 25, 4, [1, 1], 1], ["SP", 3, 28, 3, [1, 1], 1], ["SP", 3, 31, 3, [1, 1], 1], ["RE", 3, [0, 5, 10, 15, 20, 1, 6, 11, 16, 21, 2, 7, 12, 17, 22, 25, 28, 31, 26, 29, 32, 3, 8, 13, 18, 23, 27, 30, 33, 4, 9, 14, 19, 24]], ["FSP", 4, 0, 1, 3], ["FSP", 4, 4, 2, 3], ["FSP", 4, 8, 3, 3], ["FSP", 4, 12, 4, 3], ["FSP", 4, 16, 5, 3], ["RE", 4, [0, 4, 8, 12, 16, 1, 5, 9, 13, 17, 2, 6, 10, 14, 18, 3, 7, 11, 15, 19]], ["CA", 3, 4, 14], ["CHR", 2, "shared", [3]], ["CA", 3, 4, 17], ["CHR", 1, "shared", [4]], ["CA", 2, 5, 17], ["CI", 1], ["FU", 6, [0, 1, 2, 3, 4]], ["AN", 6, 0, 5], ["FU", 6, [1, 2, 3, 4, 5]], ["AN", 6, 1, 4], ["FU", 6, [2, 3, 4, 5, 6]], ["AN", 6, 2, 6], ["FU", 4, [0, 1, 2, 3, 4]], ["SP", 4, 0, 2, [1], 1], ["AN", 4, 1, 2], ["FFSP", 4, 0, [5, 4, 3, 2, 1], 1, 1], ["AN", 4, 1, 6], ["FU", 2, [0, 1, 2, 3, 4]], ["SP", 2, 0, 16, [1], 1], ["AN", 2, 1, 2], ["FFSP", 2, 0, [5, 4, 3, 2, 1], 1, 1], ["AN", 2, 1, 6], ["PR", 5, 0, "auto_unroll_max_step$0"]]]], "r": [[5.70855e-05, 5.70991e-05, 5.70733e-05], 0, 10.0615, 1667902448], "v": "v0.6"}
{"i": [["[\"fused_conv3x3\", 1, 56, 56, 4, 4, 3, 3, 64]", "cuda -keys=cuda,gpu -max_num_threads=1024 -model=unknown -thread_warp_size=32", [-1, 16, 64, 49152, 2147483647, 1024, 8, 32], "", 0, []], [[], [["CHW", 3, "local"], ["SP", 3, 0, 1, [1, 1, 1, 1], 1], ["SP", 3, 5, 64, [1, 16, 1, 1], 1], ["SP", 3, 10, 56, [1, 1, 4, 2], 1], ["SP", 3, 15, 56, [1, 28, 1, 1], 1], ["SP", 3, 20, 4, [2, 1, 1, 1], 1], ["SP", 3, 25, 4, [1, 2], 1], ["SP", 3, 28, 3, [1, 3], 1], ["SP", 3, 31, 3, [3, 1], 1], ["RE", 3, [0, 5, 10, 15, 20, 1, 6, 11, 16, 21, 2, 7, 12, 17, 22, 25, 28, 31, 26, 29, 32, 3, 8, 13, 18, 23, 27, 30, 33, 4, 9, 14, 19, 24]], ["FSP", 4, 0, 1, 3], ["FSP", 4, 4, 2, 3], ["FSP", 4, 8, 3, 3], ["FSP", 4, 12, 4, 3], ["FSP", 4, 16, 5, 3], ["RE", 4, [0, 4, 8, 12, 16, 1, 5, 9, 13, 17, 2, 6, 10, 14, 18, 3, 7, 11, 15, 19]], ["CA", 3, 4, 14], ["CHR", 2, "shared", [3]], ["CA", 3, 4, 17], ["CHR", 1, "shared", [4]], ["CA", 2, 5, 17], ["CI", 1], ["FU", 6, [0, 1, 2, 3, 4]], ["AN", 6, 0, 5], ["FU", 6, [1, 2, 3, 4, 5]], ["AN", 6, 1, 4], ["FU", 6, [2, 3, 4, 5, 6]], ["AN", 6, 2, 6], ["FU", 4, [0, 1, 2, 3, 4]], ["SP", 4, 0, 6, [1], 1], ["AN", 4, 1, 2], ["FFSP", 4, 0, [5, 4, 3, 2, 1], 1, 1], ["AN", 4, 1, 6], ["FU", 2, [0, 1, 2, 3, 4]], ["SP", 2, 0, 60, [1], 1], ["AN", 2, 1, 2], ["FFSP", 2, 0, [5, 4, 3, 2, 1], 1, 1], ["AN", 2, 1, 6], ["PR", 5, 0, "auto_unroll_max_step$1024"]]]], "r": [[3.67419e-05, 3.6745e-05, 3.67551e-05], 0, 13.9024, 1667902449], "v": "v0.6"}
{"i": [["[\"fused_conv3x3\", 1, 56, 56, 4, 4, 3, 3, 64]", "cuda -keys=cuda,gpu -max_num_threads=1024 -model=unknown -thread_warp_size=32", [-1, 16, 64, 49152, 2147483647, 1024, 8, 32], "", 0, []], [[], [["CHW", 3, "local"], ["SP", 3, 0, 1, [1, 1, 1, 1], 1], ["SP", 3, 5, 64, [2, 32, 1, 1], 1], ["SP", 3, 10, 56, [1, 1, 7, 2], 1], ["SP", 3, 15, 56, [1, 4, 1, 2], 1], ["SP", 3, 20, 4, [1, 1, 1, 2], 1], ["SP", 3, 25, 4, [1, 1], 1], ["SP", 3, 28, 3, [3, 1], 1], ["SP", 3, 31, 3, [3, 1], 1], ["RE", 3, [0, 5, 10, 15, 20, 1, 6, 11, 16, 21, 2, 7, 12, 17, 22, 25, 28, 31, 26, 29, 32, 3, 8, 13, 18, 23, 27, 30, 33, 4, 9, 14, 19, 24]], ["FSP", 4, 0, 1, 3], ["FSP", 4, 4, 2, 3], ["FSP", 4, 8, 3, 3], ["FSP", 4, 12, 4, 3], ["FSP", 4, 16, 5, 3], ["RE", 4, [0, 4, 8, 12, 16, 1, 5, 9, 13, 17, 2, 6, 10, 14, 18, 3, 7, 11, 15, 19]], ["CA", 3, 4, 14], ["CHR", 2, "shared", [3]], ["CA", 3, 4, 17], ["CHR", 1, "shared", [4]], ["CA", 2, 5, 17], ["CI", 1], ["FU", 6, [0, 1, 2, 3, 4]], ["AN", 6, 0, 5], ["FU", 6, [1, 2, 3, 4, 5]], ["AN", 6, 1, 4], ["FU", 6, [2, 3, 4, 5, 6]], ["AN", 6, 2, 6], ["FU", 4, [0, 1, 2, 3, 4]], ["SP", 4, 0, 18, [1], 1], ["AN", 4, 1, 2], ["FFSP", 4, 0, [5, 4, 3, 2, 1], 1, 1], ["AN", 4, 1, 6], ["FU", 2, [0, 1, 2, 3, 4]], ["SP", 2, 0, 36, [1], 1], ["AN", 2, 1, 2], ["FFSP", 2, 0, [5, 4, 3, 2, 1], 1, 1], ["AN", 2, 1, 6], ["PR", 5, 0, "auto_unroll_max_step$512"]]]], "r": [[4.69348e-05, 4.6978e-05, 4.69401e-05], 0, 23.4362, 1667902457], "v": "v0.6"}
{"i": [["[\"fused_conv3x3\", 1, 56, 56, 4, 4, 3, 3, 64]", "cuda -keys=cuda,gpu -max_num_threads=1024 -model=unknown -thread_warp_size=32", [-1, 16, 64, 49152, 2147483647, 1024, 8, 32], "", 0, []], [[], [["CHW", 3, "local"], ["SP", 3, 0, 1, [1, 1, 1, 1], 1], ["SP", 3, 5, 64, [1, 2, 1, 2], 1], ["SP", 3, 10, 56, [1, 28, 2, 1], 1], ["SP", 3, 15, 56, [4, 1, 1, 2], 1], ["SP", 3, 20, 4, [1, 4, 1, 1], 1], ["SP", 3, 25, 4, [2, 2], 1], ["SP", 3, 28, 3, [1, 1], 1], ["SP", 3, 31, 3, [1, 3], 1], ["RE", 3, [0, 5, 10, 15, 20, 1, 6, 11, 16, 21, 2, 7, 12, 17, 22, 25, 28, 31, 26, 29, 32, 3, 8, 13, 18, 23, 27, 30, 33, 4, 9, 14, 19, 24]], ["FSP", 4, 0, 1, 3], ["FSP", 4, 4, 2, 3], ["FSP", 4, 8, 3, 3], ["FSP", 4, 12, 4, 3], ["FSP", 4, 16, 5, 3], ["RE", 4, [0, 4, 8, 12, 16, 1, 5, 9, 13, 17, 2, 6, 10, 14, 18, 3, 7, 11, 15, 19]], ["CA", 3, 4, 14], ["CHR", 2, "shared", [3]], ["CA", 3, 4, 17], ["CHR", 1, "shared", [4]], ["CA", 2, 5, 17], ["CI", 1], ["FU", 6, [0, 1, 2, 3, 4]], ["AN", 6, 0, 5], ["FU", 6, [1, 2, 3, 4, 5]], ["AN", 6, 1, 4], ["FU", 6, [2, 3, 4, 5, 6]], ["AN", 6, 2, 6], ["FU", 4, [0, 1, 2, 3, 4]], ["SP", 4, 0, 24, [1], 1], ["AN", 4, 1, 2], ["FFSP", 4, 0, [5, 4, 3, 2, 1], 1, 1], ["AN", 4, 1, 6], ["FU", 2, [0, 1, 2, 3, 4]], ["SP", 2, 0, 32, [1], 1], ["AN", 2, 1, 2], ["FFSP", 2, 0, [5, 4, 3, 2, 1], 1, 1], ["AN", 2, 1, 6], ["PR", 5, 0, "auto_unroll_max_step$64"]]]], "r": [[2.76709e-05, 2.76782e-05, 2.76532e-05], 0, 13.3291, 1667902450], "v": "v0.6"}
{"i": [["[\"fused_conv3x3\", 1, 56, 56, 4, 4, 3, 3, 64]", "cuda -keys=cuda,gpu -max_num_threads=1024 -model=unknown -thread_warp_size=32", [-1, 16, 64, 49152, 2147483647, 1024, 8, 32], "", 0, []], [[], [["CHW", 3, "local"], ["SP", 3, 0, 1, [1, 1, 1, 1], 1], ["SP", 3, 5, 64, [2, 2, 1, 2], 1], ["SP", 3, 10, 56, [1, 1, 14, 2], 1], ["SP", 3, 15, 56, [1, 8, 1, 1], 1], ["SP", 3, 20, 4, [1, 4, 1, 1], 1], ["SP", 3, 25, 4, [1, 2], 1], ["SP", 3, 28, 3, [1, 3], 1], ["SP", 3, 31, 3, [3, 1], 1], ["RE", 3, [0, 5, 10, 15, 20, 1, 6, 11, 16, 21, 2, 7, 12, 17, 22, 25, 28, 31, 26, 29, 32, 3, 8, 13, 18, 23, 27, 30, 33, 4, 9, 14, 19, 24]], ["FSP", 4, 0, 1, 3], ["FSP", 4, 4, 2, 3], ["FSP", 4, 8, 3, 3], ["FSP", 4, 12, 4, 3], ["FSP", 4, 16, 5, 3], ["RE", 4, [0, 4, 8, 12, 16, 1, 5, 9, 13, 17, 2, 6, 10, 14, 18, 3, 7, 11, 15, 19]], ["CA", 3, 4, 14], ["CHR", 2, "shared", [3]], ["CA", 3, 4, 17], ["CHR", 1, "shared", [4]], ["CA", 2, 5, 17], ["CI", 1], ["FU", 6, [0, 1, 2, 3, 4]], ["AN", 6, 0, 5], ["FU", 6, [1, 2, 3, 4, 5]], ["AN", 6, 1, 4], ["FU", 6, [2, 3, 4, 5, 6]], ["AN", 6, 2, 6], ["FU", 4, [0, 1, 2, 3, 4]], ["SP", 4, 0, 72, [4], 1], ["AN", 4, 1, 2], ["FFSP", 4, 0, [5, 4, 3, 2, 1], 1, 1], ["AN", 4, 1, 6], ["FU", 2, [0, 1, 2, 3, 4]], ["SP", 2, 0, 384, [1], 1], ["AN", 2, 1, 2], ["FFSP", 2, 0, [5, 4, 3, 2, 1], 1, 1], ["AN", 2, 1, 6], ["PR", 5, 0, "auto_unroll_max_step$0"]]]], "r": [[7.06954e-05, 7.0624e-05, 7.06245e-05], 0, 14.0109, 1667902452], "v": "v0.6"}
{"i": [["[\"fused_conv3x3\", 1, 56, 56, 4, 4, 3, 3, 64]", "cuda -keys=cuda,gpu -max_num_threads=1024 -model=unknown -thread_warp_size=32", [-1, 16, 64, 49152, 2147483647, 1024, 8, 32], "", 0, []], [[], [["CHW", 3, "local"], ["SP", 3, 0, 1, [1, 1, 1, 1], 1], ["SP", 3, 5, 64, [1, 8, 4, 1], 1], ["SP", 3, 10, 56, [1, 1, 2, 2], 1], ["SP", 3, 15, 56, [1, 7, 1, 1], 1], ["SP", 3, 20, 4, [1, 1, 1, 2], 1], ["SP", 3, 25, 4, [1, 4], 1], ["SP", 3, 28, 3, [1, 1], 1], ["SP", 3, 31, 3, [1, 1], 1], ["RE", 3, [0, 5, 10, 15, 20, 1, 6, 11, 16, 21, 2, 7, 12, 17, 22, 25, 28, 31, 26, 29, 32, 3, 8, 13, 18, 23, 27, 30, 33, 4, 9, 14, 19, 24]], ["FSP", 4, 0, 1, 3], ["FSP", 4, 4, 2, 3], ["FSP", 4, 8, 3, 3], ["FSP", 4, 12, 4, 3], ["FSP", 4, 16, 5, 3], ["RE", 4, [0, 4, 8, 12, 16, 1, 5, 9, 13, 17, 2, 6, 10, 14, 18, 3, 7, 11, 15, 19]], ["CA", 3, 4, 14], ["CHR", 2, "shared", [3]], ["CA", 3, 4, 17], ["CHR", 1, "shared", [4]], ["CA", 2, 5, 17], ["CI", 1], ["FU", 6, [0, 1, 2, 3, 4]], ["AN", 6, 0, 5], ["FU", 6, [1, 2, 3, 4, 5]], ["AN", 6, 1, 4], ["FU", 6, [2, 3, 4, 5, 6]], ["AN", 6, 2, 6], ["FU", 4, [0, 1, 2, 3, 4]], ["SP", 4, 0, 16, [4], 1], ["AN", 4, 1, 2], ["FFSP", 4, 0, [5, 4, 3, 2, 1], 1, 1], ["AN", 4, 1, 6], ["FU", 2, [0, 1, 2, 3, 4]], ["SP", 2, 0, 64, [8], 1], ["AN", 2, 1, 2], ["FFSP", 2, 0, [5, 4, 3, 2, 1], 1, 1], ["AN", 2, 1, 6], ["PR", 5, 0, "auto_unroll_max_step$512"]]]], "r": [[7.98755e-05, 7.97756e-05, 7.99055e-05], 0, 16.5084, 1667902451], "v": "v0.6"}
