python/models/resnext/ResNextHorizontal_kernel_configs/resnext_imagenet_50_hfused_relu_1_14_14_16_64.log
{"i": [["[\"hfused_relu\", 1, 14, 14, 16, 64]", "cuda -keys=cuda,gpu -max_num_threads=1024 -model=unknown -thread_warp_size=32", [-1, 16, 64, 49152, 2147483647, 1024, 8, 32], "", 0, []], [[], [["FU", 1, [0, 1, 2, 3, 4]], ["SP", 1, 0, 200704, [1], 1], ["AN", 1, 0, 5], ["AN", 1, 1, 6]]]], "r": [[0.000151612, 0.000151602, 0.000151619], 0, 0.504718, 1667897289], "v": "v0.6"}
{"i": [["[\"hfused_relu\", 1, 14, 14, 16, 64]", "cuda -keys=cuda,gpu -max_num_threads=1024 -model=unknown -thread_warp_size=32", [-1, 16, 64, 49152, 2147483647, 1024, 8, 32], "", 0, []], [[], [["FU", 1, [0, 1, 2, 3, 4]], ["SP", 1, 0, 200704, [8], 1], ["AN", 1, 0, 5], ["AN", 1, 1, 6]]]], "r": [[2.13725e-05, 2.13703e-05, 2.1394e-05], 0, 1.17007, 1667897290], "v": "v0.6"}
{"i": [["[\"hfused_relu\", 1, 14, 14, 16, 64]", "cuda -keys=cuda,gpu -max_num_threads=1024 -model=unknown -thread_warp_size=32", [-1, 16, 64, 49152, 2147483647, 1024, 8, 32], "", 0, []], [[], [["FU", 1, [0, 1, 2, 3, 4]], ["SP", 1, 0, 200704, [28], 1], ["AN", 1, 0, 5], ["AN", 1, 1, 6]]]], "r": [[8.04196e-06, 8.06854e-06, 8.06745e-06], 0, 0.852025, 1667897290], "v": "v0.6"}
{"i": [["[\"hfused_relu\", 1, 14, 14, 16, 64]", "cuda -keys=cuda,gpu -max_num_threads=1024 -model=unknown -thread_warp_size=32", [-1, 16, 64, 49152, 2147483647, 1024, 8, 32], "", 0, []], [[], [["FU", 1, [0, 1, 2, 3, 4]], ["SP", 1, 0, 200704, [14], 1], ["AN", 1, 0, 5], ["AN", 1, 1, 6]]]], "r": [[1.33679e-05, 1.3382e-05, 1.33801e-05], 0, 1.8158, 1667897291], "v": "v0.6"}
{"i": [["[\"hfused_relu\", 1, 14, 14, 16, 64]", "cuda -keys=cuda,gpu -max_num_threads=1024 -model=unknown -thread_warp_size=32", [-1, 16, 64, 49152, 2147483647, 1024, 8, 32], "", 0, []], [[], [["FU", 1, [0, 1, 2, 3, 4]], ["SP", 1, 0, 200704, [16], 1], ["AN", 1, 0, 5], ["AN", 1, 1, 6]]]], "r": [[1.20093e-05, 1.20225e-05, 1.20226e-05], 0, 2.10527, 1667897291], "v": "v0.6"}
{"i": [["[\"hfused_relu\", 1, 14, 14, 16, 64]", "cuda -keys=cuda,gpu -max_num_threads=1024 -model=unknown -thread_warp_size=32", [-1, 16, 64, 49152, 2147483647, 1024, 8, 32], "", 0, []], [[], [["FU", 1, [0, 1, 2, 3, 4]], ["SP", 1, 0, 200704, [56], 1], ["AN", 1, 0, 5], ["AN", 1, 1, 6]]]], "r": [[5.13759e-06, 5.15333e-06, 5.14972e-06], 0, 1.46178, 1667897290], "v": "v0.6"}
{"i": [["[\"hfused_relu\", 1, 14, 14, 16, 64]", "cuda -keys=cuda,gpu -max_num_threads=1024 -model=unknown -thread_warp_size=32", [-1, 16, 64, 49152, 2147483647, 1024, 8, 32], "", 0, []], [[], [["FU", 1, [0, 1, 2, 3, 4]], ["SP", 1, 0, 200704, [4], 1], ["AN", 1, 0, 5], ["AN", 1, 1, 6]]]], "r": [[3.9822e-05, 3.9834e-05, 3.9837e-05], 0, 2.39767, 1667897291], "v": "v0.6"}
{"i": [["[\"hfused_relu\", 1, 14, 14, 16, 64]", "cuda -keys=cuda,gpu -max_num_threads=1024 -model=unknown -thread_warp_size=32", [-1, 16, 64, 49152, 2147483647, 1024, 8, 32], "", 0, []], [[], [["FU", 1, [0, 1, 2, 3, 4]], ["SP", 1, 0, 200704, [49], 1], ["AN", 1, 0, 5], ["AN", 1, 1, 6]]]], "r": [[5.5738e-06, 5.58802e-06, 5.5887e-06], 0, 2.72426, 1667897292], "v": "v0.6"}
{"i": [["[\"hfused_relu\", 1, 14, 14, 16, 64]", "cuda -keys=cuda,gpu -max_num_threads=1024 -model=unknown -thread_warp_size=32", [-1, 16, 64, 49152, 2147483647, 1024, 8, 32], "", 0, []], [[], [["FU", 1, [0, 1, 2, 3, 4]], ["SP", 1, 0, 200704, [7], 1], ["AN", 1, 0, 5], ["AN", 1, 1, 6]]]], "r": [[2.40504e-05, 2.40761e-05, 2.4088e-05], 0, 3.32881, 1667897292], "v": "v0.6"}
{"i": [["[\"hfused_relu\", 1, 14, 14, 16, 64]", "cuda -keys=cuda,gpu -max_num_threads=1024 -model=unknown -thread_warp_size=32", [-1, 16, 64, 49152, 2147483647, 1024, 8, 32], "", 0, []], [[], [["FU", 1, [0, 1, 2, 3, 4]], ["SP", 1, 0, 200704, [32], 1], ["AN", 1, 0, 5], ["AN", 1, 1, 6]]]], "r": [[7.32748e-06, 7.33138e-06, 7.32885e-06], 0, 3.03201, 1667897292], "v": "v0.6"}
{"i": [["[\"hfused_relu\", 1, 14, 14, 16, 64]", "cuda -keys=cuda,gpu -max_num_threads=1024 -model=unknown -thread_warp_size=32", [-1, 16, 64, 49152, 2147483647, 1024, 8, 32], "", 0, []], [[], [["FU", 1, [0, 1, 2, 3, 4]], ["SP", 1, 0, 200704, [2], 1], ["AN", 1, 0, 5], ["AN", 1, 1, 6]]]], "r": [[7.70651e-05, 7.70966e-05, 7.71009e-05], 0, 3.68829, 1667897293], "v": "v0.6"}
{"i": [["[\"hfused_relu\", 1, 14, 14, 16, 64]", "cuda -keys=cuda,gpu -max_num_threads=1024 -model=unknown -thread_warp_size=32", [-1, 16, 64, 49152, 2147483647, 1024, 8, 32], "", 0, []], [[], [["FU", 1, [0, 1, 2, 3, 4]], ["SP", 1, 0, 200704, [64], 1], ["AN", 1, 0, 5], ["AN", 1, 1, 6]]]], "r": [[4.867e-06, 4.87364e-06, 4.87451e-06], 0, 3.9731, 1667897293], "v": "v0.6"}
{"i": [["[\"hfused_relu\", 1, 14, 14, 16, 64]", "cuda -keys=cuda,gpu -max_num_threads=1024 -model=unknown -thread_warp_size=32", [-1, 16, 64, 49152, 2147483647, 1024, 8, 32], "", 0, []], [[], [["FU", 1, [0, 1, 2, 3, 4]], ["SP", 1, 0, 200704, [64], 1], ["AN", 1, 0, 5], ["AN", 1, 1, 6]]]], "r": [[4.84953e-06, 4.86915e-06, 4.86854e-06], 0, 0.519559, 1667966578], "v": "v0.6"}
{"i": [["[\"hfused_relu\", 1, 14, 14, 16, 64]", "cuda -keys=cuda,gpu -max_num_threads=1024 -model=unknown -thread_warp_size=32", [-1, 16, 64, 49152, 2147483647, 1024, 8, 32], "", 0, []], [[], [["FU", 1, [0, 1, 2, 3, 4]], ["SP", 1, 0, 200704, [4], 1], ["AN", 1, 0, 5], ["AN", 1, 1, 6]]]], "r": [[3.98449e-05, 3.98604e-05, 3.98555e-05], 0, 1.50485, 1667966579], "v": "v0.6"}
{"i": [["[\"hfused_relu\", 1, 14, 14, 16, 64]", "cuda -keys=cuda,gpu -max_num_threads=1024 -model=unknown -thread_warp_size=32", [-1, 16, 64, 49152, 2147483647, 1024, 8, 32], "", 0, []], [[], [["FU", 1, [0, 1, 2, 3, 4]], ["SP", 1, 0, 200704, [32], 1], ["AN", 1, 0, 5], ["AN", 1, 1, 6]]]], "r": [[7.35422e-06, 7.37698e-06, 7.37204e-06], 0, 2.13667, 1667966579], "v": "v0.6"}
{"i": [["[\"hfused_relu\", 1, 14, 14, 16, 64]", "cuda -keys=cuda,gpu -max_num_threads=1024 -model=unknown -thread_warp_size=32", [-1, 16, 64, 49152, 2147483647, 1024, 8, 32], "", 0, []], [[], [["FU", 1, [0, 1, 2, 3, 4]], ["SP", 1, 0, 200704, [56], 1], ["AN", 1, 0, 5], ["AN", 1, 1, 6]]]], "r": [[5.31588e-06, 5.31936e-06, 5.31628e-06], 0, 0.878475, 1667966578], "v": "v0.6"}
{"i": [["[\"hfused_relu\", 1, 14, 14, 16, 64]", "cuda -keys=cuda,gpu -max_num_threads=1024 -model=unknown -thread_warp_size=32", [-1, 16, 64, 49152, 2147483647, 1024, 8, 32], "", 0, []], [[], [["FU", 1, [0, 1, 2, 3, 4]], ["SP", 1, 0, 200704, [28], 1], ["AN", 1, 0, 5], ["AN", 1, 1, 6]]]], "r": [[7.98677e-06, 8.00011e-06, 7.99715e-06], 0, 1.19141, 1667966578], "v": "v0.6"}
{"i": [["[\"hfused_relu\", 1, 14, 14, 16, 64]", "cuda -keys=cuda,gpu -max_num_threads=1024 -model=unknown -thread_warp_size=32", [-1, 16, 64, 49152, 2147483647, 1024, 8, 32], "", 0, []], [[], [["FU", 1, [0, 1, 2, 3, 4]], ["SP", 1, 0, 200704, [49], 1], ["AN", 1, 0, 5], ["AN", 1, 1, 6]]]], "r": [[5.65166e-06, 5.67187e-06, 5.66905e-06], 0, 1.81885, 1667966579], "v": "v0.6"}
{"i": [["[\"hfused_relu\", 1, 14, 14, 16, 64]", "cuda -keys=cuda,gpu -max_num_threads=1024 -model=unknown -thread_warp_size=32", [-1, 16, 64, 49152, 2147483647, 1024, 8, 32], "", 0, []], [[], [["FU", 1, [0, 1, 2, 3, 4]], ["SP", 1, 0, 200704, [1], 1], ["AN", 1, 0, 5], ["AN", 1, 1, 6]]]], "r": [[0.000151533, 0.000151465, 0.000151526], 0, 2.45098, 1667966580], "v": "v0.6"}
{"i": [["[\"hfused_relu\", 1, 14, 14, 16, 64]", "cuda -keys=cuda,gpu -max_num_threads=1024 -model=unknown -thread_warp_size=32", [-1, 16, 64, 49152, 2147483647, 1024, 8, 32], "", 0, []], [[], [["FU", 1, [0, 1, 2, 3, 4]], ["SP", 1, 0, 200704, [2], 1], ["AN", 1, 0, 5], ["AN", 1, 1, 6]]]], "r": [[7.70242e-05, 7.70298e-05, 7.70453e-05], 0, 3.09801, 1667966580], "v": "v0.6"}
{"i": [["[\"hfused_relu\", 1, 14, 14, 16, 64]", "cuda -keys=cuda,gpu -max_num_threads=1024 -model=unknown -thread_warp_size=32", [-1, 16, 64, 49152, 2147483647, 1024, 8, 32], "", 0, []], [[], [["FU", 1, [0, 1, 2, 3, 4]], ["SP", 1, 0, 200704, [7], 1], ["AN", 1, 0, 5], ["AN", 1, 1, 6]]]], "r": [[2.39685e-05, 2.39798e-05, 2.39763e-05], 0, 3.77791, 1667966581], "v": "v0.6"}
{"i": [["[\"hfused_relu\", 1, 14, 14, 16, 64]", "cuda -keys=cuda,gpu -max_num_threads=1024 -model=unknown -thread_warp_size=32", [-1, 16, 64, 49152, 2147483647, 1024, 8, 32], "", 0, []], [[], [["FU", 1, [0, 1, 2, 3, 4]], ["SP", 1, 0, 200704, [16], 1], ["AN", 1, 0, 5], ["AN", 1, 1, 6]]]], "r": [[1.20373e-05, 1.20546e-05, 1.20617e-05], 0, 4.09197, 1667966581], "v": "v0.6"}
{"i": [["[\"hfused_relu\", 1, 14, 14, 16, 64]", "cuda -keys=cuda,gpu -max_num_threads=1024 -model=unknown -thread_warp_size=32", [-1, 16, 64, 49152, 2147483647, 1024, 8, 32], "", 0, []], [[], [["FU", 1, [0, 1, 2, 3, 4]], ["SP", 1, 0, 200704, [8], 1], ["AN", 1, 0, 5], ["AN", 1, 1, 6]]]], "r": [[2.14907e-05, 2.15177e-05, 2.15096e-05], 0, 3.41853, 1667966581], "v": "v0.6"}
{"i": [["[\"hfused_relu\", 1, 14, 14, 16, 64]", "cuda -keys=cuda,gpu -max_num_threads=1024 -model=unknown -thread_warp_size=32", [-1, 16, 64, 49152, 2147483647, 1024, 8, 32], "", 0, []], [[], [["FU", 1, [0, 1, 2, 3, 4]], ["SP", 1, 0, 200704, [14], 1], ["AN", 1, 0, 5], ["AN", 1, 1, 6]]]], "r": [[1.3367e-05, 1.33912e-05, 1.33891e-05], 0, 2.79927, 1667966580], "v": "v0.6"}
{"i": [["[\"hfused_relu\", 1, 14, 14, 16, 64]", "cuda -keys=cuda,gpu -max_num_threads=1024 -model=unknown -thread_warp_size=32", [-1, 16, 64, 49152, 2147483647, 1024, 8, 32], "", 0, []], [[], [["FU", 1, [0, 1, 2, 3, 4]], ["SP", 1, 0, 200704, [7], 1], ["AN", 1, 0, 5], ["AN", 1, 1, 6]]]], "r": [[2.39713e-05, 2.39789e-05, 2.39729e-05], 0, 0.873972, 1667967482], "v": "v0.6"}
{"i": [["[\"hfused_relu\", 1, 14, 14, 16, 64]", "cuda -keys=cuda,gpu -max_num_threads=1024 -model=unknown -thread_warp_size=32", [-1, 16, 64, 49152, 2147483647, 1024, 8, 32], "", 0, []], [[], [["FU", 1, [0, 1, 2, 3, 4]], ["SP", 1, 0, 200704, [16], 1], ["AN", 1, 0, 5], ["AN", 1, 1, 6]]]], "r": [[1.20246e-05, 1.20292e-05, 1.20198e-05], 0, 2.14075, 1667967484], "v": "v0.6"}
{"i": [["[\"hfused_relu\", 1, 14, 14, 16, 64]", "cuda -keys=cuda,gpu -max_num_threads=1024 -model=unknown -thread_warp_size=32", [-1, 16, 64, 49152, 2147483647, 1024, 8, 32], "", 0, []], [[], [["FU", 1, [0, 1, 2, 3, 4]], ["SP", 1, 0, 200704, [8], 1], ["AN", 1, 0, 5], ["AN", 1, 1, 6]]]], "r": [[2.1386e-05, 2.14092e-05, 2.13971e-05], 0, 1.83222, 1667967483], "v": "v0.6"}
{"i": [["[\"hfused_relu\", 1, 14, 14, 16, 64]", "cuda -keys=cuda,gpu -max_num_threads=1024 -model=unknown -thread_warp_size=32", [-1, 16, 64, 49152, 2147483647, 1024, 8, 32], "", 0, []], [[], [["FU", 1, [0, 1, 2, 3, 4]], ["SP", 1, 0, 200704, [1], 1], ["AN", 1, 0, 5], ["AN", 1, 1, 6]]]], "r": [[0.000151553, 0.000151526, 0.000151595], 0, 0.519938, 1667967482], "v": "v0.6"}
{"i": [["[\"hfused_relu\", 1, 14, 14, 16, 64]", "cuda -keys=cuda,gpu -max_num_threads=1024 -model=unknown -thread_warp_size=32", [-1, 16, 64, 49152, 2147483647, 1024, 8, 32], "", 0, []], [[], [["FU", 1, [0, 1, 2, 3, 4]], ["SP", 1, 0, 200704, [32], 1], ["AN", 1, 0, 5], ["AN", 1, 1, 6]]]], "r": [[7.32952e-06, 7.32644e-06, 7.33381e-06], 0, 1.1892, 1667967483], "v": "v0.6"}
{"i": [["[\"hfused_relu\", 1, 14, 14, 16, 64]", "cuda -keys=cuda,gpu -max_num_threads=1024 -model=unknown -thread_warp_size=32", [-1, 16, 64, 49152, 2147483647, 1024, 8, 32], "", 0, []], [[], [["FU", 1, [0, 1, 2, 3, 4]], ["SP", 1, 0, 200704, [56], 1], ["AN", 1, 0, 5], ["AN", 1, 1, 6]]]], "r": [[5.13991e-06, 5.15259e-06, 5.15198e-06], 0, 1.48021, 1667967483], "v": "v0.6"}
{"i": [["[\"hfused_relu\", 1, 14, 14, 16, 64]", "cuda -keys=cuda,gpu -max_num_threads=1024 -model=unknown -thread_warp_size=32", [-1, 16, 64, 49152, 2147483647, 1024, 8, 32], "", 0, []], [[], [["FU", 1, [0, 1, 2, 3, 4]], ["SP", 1, 0, 200704, [49], 1], ["AN", 1, 0, 5], ["AN", 1, 1, 6]]]], "r": [[5.70332e-06, 5.72735e-06, 5.72655e-06], 0, 2.7827, 1667967484], "v": "v0.6"}
{"i": [["[\"hfused_relu\", 1, 14, 14, 16, 64]", "cuda -keys=cuda,gpu -max_num_threads=1024 -model=unknown -thread_warp_size=32", [-1, 16, 64, 49152, 2147483647, 1024, 8, 32], "", 0, []], [[], [["FU", 1, [0, 1, 2, 3, 4]], ["SP", 1, 0, 200704, [2], 1], ["AN", 1, 0, 5], ["AN", 1, 1, 6]]]], "r": [[7.71125e-05, 7.71269e-05, 7.71401e-05], 0, 3.10076, 1667967485], "v": "v0.6"}
{"i": [["[\"hfused_relu\", 1, 14, 14, 16, 64]", "cuda -keys=cuda,gpu -max_num_threads=1024 -model=unknown -thread_warp_size=32", [-1, 16, 64, 49152, 2147483647, 1024, 8, 32], "", 0, []], [[], [["FU", 1, [0, 1, 2, 3, 4]], ["SP", 1, 0, 200704, [14], 1], ["AN", 1, 0, 5], ["AN", 1, 1, 6]]]], "r": [[1.34507e-05, 1.34681e-05, 1.34682e-05], 0, 4.06361, 1667967486], "v": "v0.6"}
{"i": [["[\"hfused_relu\", 1, 14, 14, 16, 64]", "cuda -keys=cuda,gpu -max_num_threads=1024 -model=unknown -thread_warp_size=32", [-1, 16, 64, 49152, 2147483647, 1024, 8, 32], "", 0, []], [[], [["FU", 1, [0, 1, 2, 3, 4]], ["SP", 1, 0, 200704, [28], 1], ["AN", 1, 0, 5], ["AN", 1, 1, 6]]]], "r": [[7.94145e-06, 7.94951e-06, 7.9504e-06], 0, 3.38789, 1667967485], "v": "v0.6"}
{"i": [["[\"hfused_relu\", 1, 14, 14, 16, 64]", "cuda -keys=cuda,gpu -max_num_threads=1024 -model=unknown -thread_warp_size=32", [-1, 16, 64, 49152, 2147483647, 1024, 8, 32], "", 0, []], [[], [["FU", 1, [0, 1, 2, 3, 4]], ["SP", 1, 0, 200704, [4], 1], ["AN", 1, 0, 5], ["AN", 1, 1, 6]]]], "r": [[3.9836e-05, 3.98443e-05, 3.98487e-05], 0, 2.4259, 1667967484], "v": "v0.6"}
{"i": [["[\"hfused_relu\", 1, 14, 14, 16, 64]", "cuda -keys=cuda,gpu -max_num_threads=1024 -model=unknown -thread_warp_size=32", [-1, 16, 64, 49152, 2147483647, 1024, 8, 32], "", 0, []], [[], [["FU", 1, [0, 1, 2, 3, 4]], ["SP", 1, 0, 200704, [64], 1], ["AN", 1, 0, 5], ["AN", 1, 1, 6]]]], "r": [[4.8243e-06, 4.83248e-06, 4.83097e-06], 0, 3.74518, 1667967485], "v": "v0.6"}
{"i": [["[\"hfused_relu\", 1, 14, 14, 16, 64]", "cuda -keys=cuda,gpu -max_num_threads=1024 -model=unknown -thread_warp_size=32", [-1, 16, 64, 49152, 2147483647, 1024, 8, 32], "", 0, []], [[], [["FU", 1, [0, 1, 2, 3, 4]], ["SP", 1, 0, 200704, [14], 1], ["AN", 1, 0, 5], ["AN", 1, 1, 6]]]], "r": [[1.35044e-05, 1.35081e-05, 1.35129e-05], 0, 2.13117, 1667968307], "v": "v0.6"}
{"i": [["[\"hfused_relu\", 1, 14, 14, 16, 64]", "cuda -keys=cuda,gpu -max_num_threads=1024 -model=unknown -thread_warp_size=32", [-1, 16, 64, 49152, 2147483647, 1024, 8, 32], "", 0, []], [[], [["FU", 1, [0, 1, 2, 3, 4]], ["SP", 1, 0, 200704, [8], 1], ["AN", 1, 0, 5], ["AN", 1, 1, 6]]]], "r": [[2.13863e-05, 2.13906e-05, 2.13941e-05], 0, 1.16094, 1667968306], "v": "v0.6"}
{"i": [["[\"hfused_relu\", 1, 14, 14, 16, 64]", "cuda -keys=cuda,gpu -max_num_threads=1024 -model=unknown -thread_warp_size=32", [-1, 16, 64, 49152, 2147483647, 1024, 8, 32], "", 0, []], [[], [["FU", 1, [0, 1, 2, 3, 4]], ["SP", 1, 0, 200704, [28], 1], ["AN", 1, 0, 5], ["AN", 1, 1, 6]]]], "r": [[7.90956e-06, 7.90303e-06, 7.92041e-06], 0, 1.8108, 1667968307], "v": "v0.6"}
{"i": [["[\"hfused_relu\", 1, 14, 14, 16, 64]", "cuda -keys=cuda,gpu -max_num_threads=1024 -model=unknown -thread_warp_size=32", [-1, 16, 64, 49152, 2147483647, 1024, 8, 32], "", 0, []], [[], [["FU", 1, [0, 1, 2, 3, 4]], ["SP", 1, 0, 200704, [49], 1], ["AN", 1, 0, 5], ["AN", 1, 1, 6]]]], "r": [[5.54798e-06, 5.56205e-06, 5.56049e-06], 0, 0.503229, 1667968305], "v": "v0.6"}
{"i": [["[\"hfused_relu\", 1, 14, 14, 16, 64]", "cuda -keys=cuda,gpu -max_num_threads=1024 -model=unknown -thread_warp_size=32", [-1, 16, 64, 49152, 2147483647, 1024, 8, 32], "", 0, []], [[], [["FU", 1, [0, 1, 2, 3, 4]], ["SP", 1, 0, 200704, [7], 1], ["AN", 1, 0, 5], ["AN", 1, 1, 6]]]], "r": [[2.39902e-05, 2.40036e-05, 2.39908e-05], 0, 1.46434, 1667968306], "v": "v0.6"}
{"i": [["[\"hfused_relu\", 1, 14, 14, 16, 64]", "cuda -keys=cuda,gpu -max_num_threads=1024 -model=unknown -thread_warp_size=32", [-1, 16, 64, 49152, 2147483647, 1024, 8, 32], "", 0, []], [[], [["FU", 1, [0, 1, 2, 3, 4]], ["SP", 1, 0, 200704, [56], 1], ["AN", 1, 0, 5], ["AN", 1, 1, 6]]]], "r": [[5.23016e-06, 5.24212e-06, 5.24151e-06], 0, 0.836804, 1667968305], "v": "v0.6"}
{"i": [["[\"hfused_relu\", 1, 14, 14, 16, 64]", "cuda -keys=cuda,gpu -max_num_threads=1024 -model=unknown -thread_warp_size=32", [-1, 16, 64, 49152, 2147483647, 1024, 8, 32], "", 0, []], [[], [["FU", 1, [0, 1, 2, 3, 4]], ["SP", 1, 0, 200704, [64], 1], ["AN", 1, 0, 5], ["AN", 1, 1, 6]]]], "r": [[5.02322e-06, 5.03294e-06, 5.03332e-06], 0, 2.42638, 1667968307], "v": "v0.6"}
{"i": [["[\"hfused_relu\", 1, 14, 14, 16, 64]", "cuda -keys=cuda,gpu -max_num_threads=1024 -model=unknown -thread_warp_size=32", [-1, 16, 64, 49152, 2147483647, 1024, 8, 32], "", 0, []], [[], [["FU", 1, [0, 1, 2, 3, 4]], ["SP", 1, 0, 200704, [2], 1], ["AN", 1, 0, 5], ["AN", 1, 1, 6]]]], "r": [[7.70423e-05, 7.70447e-05, 7.70598e-05], 0, 2.77349, 1667968308], "v": "v0.6"}
{"i": [["[\"hfused_relu\", 1, 14, 14, 16, 64]", "cuda -keys=cuda,gpu -max_num_threads=1024 -model=unknown -thread_warp_size=32", [-1, 16, 64, 49152, 2147483647, 1024, 8, 32], "", 0, []], [[], [["FU", 1, [0, 1, 2, 3, 4]], ["SP", 1, 0, 200704, [1], 1], ["AN", 1, 0, 5], ["AN", 1, 1, 6]]]], "r": [[0.000151556, 0.000151578, 0.00015156], 0, 3.0708, 1667968308], "v": "v0.6"}
{"i": [["[\"hfused_relu\", 1, 14, 14, 16, 64]", "cuda -keys=cuda,gpu -max_num_threads=1024 -model=unknown -thread_warp_size=32", [-1, 16, 64, 49152, 2147483647, 1024, 8, 32], "", 0, []], [[], [["FU", 1, [0, 1, 2, 3, 4]], ["SP", 1, 0, 200704, [4], 1], ["AN", 1, 0, 5], ["AN", 1, 1, 6]]]], "r": [[3.98445e-05, 3.98477e-05, 3.98493e-05], 0, 3.72325, 1667968309], "v": "v0.6"}
{"i": [["[\"hfused_relu\", 1, 14, 14, 16, 64]", "cuda -keys=cuda,gpu -max_num_threads=1024 -model=unknown -thread_warp_size=32", [-1, 16, 64, 49152, 2147483647, 1024, 8, 32], "", 0, []], [[], [["FU", 1, [0, 1, 2, 3, 4]], ["SP", 1, 0, 200704, [32], 1], ["AN", 1, 0, 5], ["AN", 1, 1, 6]]]], "r": [[7.19398e-06, 7.20669e-06, 7.21166e-06], 0, 4.04856, 1667968309], "v": "v0.6"}
{"i": [["[\"hfused_relu\", 1, 14, 14, 16, 64]", "cuda -keys=cuda,gpu -max_num_threads=1024 -model=unknown -thread_warp_size=32", [-1, 16, 64, 49152, 2147483647, 1024, 8, 32], "", 0, []], [[], [["FU", 1, [0, 1, 2, 3, 4]], ["SP", 1, 0, 200704, [16], 1], ["AN", 1, 0, 5], ["AN", 1, 1, 6]]]], "r": [[1.21221e-05, 1.21327e-05, 1.21359e-05], 0, 3.36803, 1667968308], "v": "v0.6"}
{"i": [["[\"hfused_relu\", 1, 14, 14, 16, 64]", "cuda -keys=cuda,gpu -max_num_threads=1024 -model=unknown -thread_warp_size=32", [-1, 16, 64, 49152, 2147483647, 1024, 8, 32], "", 0, []], [[], [["FU", 1, [0, 1, 2, 3, 4]], ["SP", 1, 0, 200704, [2], 1], ["AN", 1, 0, 5], ["AN", 1, 1, 6]]]], "r": [[7.71623e-05, 7.71726e-05, 7.71542e-05], 0, 2.45783, 1667968350], "v": "v0.6"}
{"i": [["[\"hfused_relu\", 1, 14, 14, 16, 64]", "cuda -keys=cuda,gpu -max_num_threads=1024 -model=unknown -thread_warp_size=32", [-1, 16, 64, 49152, 2147483647, 1024, 8, 32], "", 0, []], [[], [["FU", 1, [0, 1, 2, 3, 4]], ["SP", 1, 0, 200704, [64], 1], ["AN", 1, 0, 5], ["AN", 1, 1, 6]]]], "r": [[4.8136e-06, 4.82481e-06, 4.82541e-06], 0, 1.20241, 1667968349], "v": "v0.6"}
{"i": [["[\"hfused_relu\", 1, 14, 14, 16, 64]", "cuda -keys=cuda,gpu -max_num_threads=1024 -model=unknown -thread_warp_size=32", [-1, 16, 64, 49152, 2147483647, 1024, 8, 32], "", 0, []], [[], [["FU", 1, [0, 1, 2, 3, 4]], ["SP", 1, 0, 200704, [16], 1], ["AN", 1, 0, 5], ["AN", 1, 1, 6]]]], "r": [[1.21806e-05, 1.21972e-05, 1.21977e-05], 0, 2.16667, 1667968350], "v": "v0.6"}
{"i": [["[\"hfused_relu\", 1, 14, 14, 16, 64]", "cuda -keys=cuda,gpu -max_num_threads=1024 -model=unknown -thread_warp_size=32", [-1, 16, 64, 49152, 2147483647, 1024, 8, 32], "", 0, []], [[], [["FU", 1, [0, 1, 2, 3, 4]], ["SP", 1, 0, 200704, [4], 1], ["AN", 1, 0, 5], ["AN", 1, 1, 6]]]], "r": [[3.98163e-05, 3.98334e-05, 3.98292e-05], 0, 0.52579, 1667968348], "v": "v0.6"}
{"i": [["[\"hfused_relu\", 1, 14, 14, 16, 64]", "cuda -keys=cuda,gpu -max_num_threads=1024 -model=unknown -thread_warp_size=32", [-1, 16, 64, 49152, 2147483647, 1024, 8, 32], "", 0, []], [[], [["FU", 1, [0, 1, 2, 3, 4]], ["SP", 1, 0, 200704, [14], 1], ["AN", 1, 0, 5], ["AN", 1, 1, 6]]]], "r": [[1.33359e-05, 1.33469e-05, 1.3342e-05], 0, 0.890934, 1667968348], "v": "v0.6"}
{"i": [["[\"hfused_relu\", 1, 14, 14, 16, 64]", "cuda -keys=cuda,gpu -max_num_threads=1024 -model=unknown -thread_warp_size=32", [-1, 16, 64, 49152, 2147483647, 1024, 8, 32], "", 0, []], [[], [["FU", 1, [0, 1, 2, 3, 4]], ["SP", 1, 0, 200704, [1], 1], ["AN", 1, 0, 5], ["AN", 1, 1, 6]]]], "r": [[0.000151653, 0.000151629, 0.000151609], 0, 1.49691, 1667968349], "v": "v0.6"}
{"i": [["[\"hfused_relu\", 1, 14, 14, 16, 64]", "cuda -keys=cuda,gpu -max_num_threads=1024 -model=unknown -thread_warp_size=32", [-1, 16, 64, 49152, 2147483647, 1024, 8, 32], "", 0, []], [[], [["FU", 1, [0, 1, 2, 3, 4]], ["SP", 1, 0, 200704, [32], 1], ["AN", 1, 0, 5], ["AN", 1, 1, 6]]]], "r": [[7.26334e-06, 7.27143e-06, 7.27281e-06], 0, 1.85512, 1667968349], "v": "v0.6"}
{"i": [["[\"hfused_relu\", 1, 14, 14, 16, 64]", "cuda -keys=cuda,gpu -max_num_threads=1024 -model=unknown -thread_warp_size=32", [-1, 16, 64, 49152, 2147483647, 1024, 8, 32], "", 0, []], [[], [["FU", 1, [0, 1, 2, 3, 4]], ["SP", 1, 0, 200704, [7], 1], ["AN", 1, 0, 5], ["AN", 1, 1, 6]]]], "r": [[2.39196e-05, 2.39268e-05, 2.39348e-05], 0, 3.08887, 1667968351], "v": "v0.6"}
{"i": [["[\"hfused_relu\", 1, 14, 14, 16, 64]", "cuda -keys=cuda,gpu -max_num_threads=1024 -model=unknown -thread_warp_size=32", [-1, 16, 64, 49152, 2147483647, 1024, 8, 32], "", 0, []], [[], [["FU", 1, [0, 1, 2, 3, 4]], ["SP", 1, 0, 200704, [49], 1], ["AN", 1, 0, 5], ["AN", 1, 1, 6]]]], "r": [[5.56232e-06, 5.57118e-06, 5.57338e-06], 0, 2.75364, 1667968350], "v": "v0.6"}
{"i": [["[\"hfused_relu\", 1, 14, 14, 16, 64]", "cuda -keys=cuda,gpu -max_num_threads=1024 -model=unknown -thread_warp_size=32", [-1, 16, 64, 49152, 2147483647, 1024, 8, 32], "", 0, []], [[], [["FU", 1, [0, 1, 2, 3, 4]], ["SP", 1, 0, 200704, [28], 1], ["AN", 1, 0, 5], ["AN", 1, 1, 6]]]], "r": [[7.86702e-06, 7.88184e-06, 7.88005e-06], 0, 3.39549, 1667968351], "v": "v0.6"}
{"i": [["[\"hfused_relu\", 1, 14, 14, 16, 64]", "cuda -keys=cuda,gpu -max_num_threads=1024 -model=unknown -thread_warp_size=32", [-1, 16, 64, 49152, 2147483647, 1024, 8, 32], "", 0, []], [[], [["FU", 1, [0, 1, 2, 3, 4]], ["SP", 1, 0, 200704, [8], 1], ["AN", 1, 0, 5], ["AN", 1, 1, 6]]]], "r": [[2.15015e-05, 2.1527e-05, 2.15211e-05], 0, 4.03148, 1667968352], "v": "v0.6"}
{"i": [["[\"hfused_relu\", 1, 14, 14, 16, 64]", "cuda -keys=cuda,gpu -max_num_threads=1024 -model=unknown -thread_warp_size=32", [-1, 16, 64, 49152, 2147483647, 1024, 8, 32], "", 0, []], [[], [["FU", 1, [0, 1, 2, 3, 4]], ["SP", 1, 0, 200704, [56], 1], ["AN", 1, 0, 5], ["AN", 1, 1, 6]]]], "r": [[5.21202e-06, 5.22131e-06, 5.22829e-06], 0, 3.74413, 1667968351], "v": "v0.6"}
{"i": [["[\"hfused_relu\", 1, 14, 14, 16, 64]", "cuda -keys=cuda,gpu -max_num_threads=1024 -model=unknown -thread_warp_size=32", [-1, 16, 64, 49152, 2147483647, 1024, 8, 32], "", 0, []], [[], [["FU", 1, [0, 1, 2, 3, 4]], ["SP", 1, 0, 200704, [16], 1], ["AN", 1, 0, 5], ["AN", 1, 1, 6]]]], "r": [[1.21358e-05, 1.21461e-05, 1.21445e-05], 0, 2.12026, 1667968414], "v": "v0.6"}
{"i": [["[\"hfused_relu\", 1, 14, 14, 16, 64]", "cuda -keys=cuda,gpu -max_num_threads=1024 -model=unknown -thread_warp_size=32", [-1, 16, 64, 49152, 2147483647, 1024, 8, 32], "", 0, []], [[], [["FU", 1, [0, 1, 2, 3, 4]], ["SP", 1, 0, 200704, [8], 1], ["AN", 1, 0, 5], ["AN", 1, 1, 6]]]], "r": [[2.1283e-05, 2.12941e-05, 2.12894e-05], 0, 1.47348, 1667968413], "v": "v0.6"}
{"i": [["[\"hfused_relu\", 1, 14, 14, 16, 64]", "cuda -keys=cuda,gpu -max_num_threads=1024 -model=unknown -thread_warp_size=32", [-1, 16, 64, 49152, 2147483647, 1024, 8, 32], "", 0, []], [[], [["FU", 1, [0, 1, 2, 3, 4]], ["SP", 1, 0, 200704, [28], 1], ["AN", 1, 0, 5], ["AN", 1, 1, 6]]]], "r": [[7.97563e-06, 7.98947e-06, 7.9869e-06], 0, 1.80081, 1667968413], "v": "v0.6"}
{"i": [["[\"hfused_relu\", 1, 14, 14, 16, 64]", "cuda -keys=cuda,gpu -max_num_threads=1024 -model=unknown -thread_warp_size=32", [-1, 16, 64, 49152, 2147483647, 1024, 8, 32], "", 0, []], [[], [["FU", 1, [0, 1, 2, 3, 4]], ["SP", 1, 0, 200704, [4], 1], ["AN", 1, 0, 5], ["AN", 1, 1, 6]]]], "r": [[3.97826e-05, 3.97871e-05, 3.97924e-05], 0, 0.523495, 1667968412], "v": "v0.6"}
{"i": [["[\"hfused_relu\", 1, 14, 14, 16, 64]", "cuda -keys=cuda,gpu -max_num_threads=1024 -model=unknown -thread_warp_size=32", [-1, 16, 64, 49152, 2147483647, 1024, 8, 32], "", 0, []], [[], [["FU", 1, [0, 1, 2, 3, 4]], ["SP", 1, 0, 200704, [7], 1], ["AN", 1, 0, 5], ["AN", 1, 1, 6]]]], "r": [[2.39055e-05, 2.39201e-05, 2.39163e-05], 0, 1.1716, 1667968413], "v": "v0.6"}
{"i": [["[\"hfused_relu\", 1, 14, 14, 16, 64]", "cuda -keys=cuda,gpu -max_num_threads=1024 -model=unknown -thread_warp_size=32", [-1, 16, 64, 49152, 2147483647, 1024, 8, 32], "", 0, []], [[], [["FU", 1, [0, 1, 2, 3, 4]], ["SP", 1, 0, 200704, [32], 1], ["AN", 1, 0, 5], ["AN", 1, 1, 6]]]], "r": [[7.19184e-06, 7.2043e-06, 7.20311e-06], 0, 0.865887, 1667968412], "v": "v0.6"}
{"i": [["[\"hfused_relu\", 1, 14, 14, 16, 64]", "cuda -keys=cuda,gpu -max_num_threads=1024 -model=unknown -thread_warp_size=32", [-1, 16, 64, 49152, 2147483647, 1024, 8, 32], "", 0, []], [[], [["FU", 1, [0, 1, 2, 3, 4]], ["SP", 1, 0, 200704, [56], 1], ["AN", 1, 0, 5], ["AN", 1, 1, 6]]]], "r": [[5.18432e-06, 5.1966e-06, 5.19705e-06], 0, 3.40811, 1667968415], "v": "v0.6"}
{"i": [["[\"hfused_relu\", 1, 14, 14, 16, 64]", "cuda -keys=cuda,gpu -max_num_threads=1024 -model=unknown -thread_warp_size=32", [-1, 16, 64, 49152, 2147483647, 1024, 8, 32], "", 0, []], [[], [["FU", 1, [0, 1, 2, 3, 4]], ["SP", 1, 0, 200704, [49], 1], ["AN", 1, 0, 5], ["AN", 1, 1, 6]]]], "r": [[5.63862e-06, 5.64624e-06, 5.64836e-06], 0, 2.78308, 1667968414], "v": "v0.6"}
{"i": [["[\"hfused_relu\", 1, 14, 14, 16, 64]", "cuda -keys=cuda,gpu -max_num_threads=1024 -model=unknown -thread_warp_size=32", [-1, 16, 64, 49152, 2147483647, 1024, 8, 32], "", 0, []], [[], [["FU", 1, [0, 1, 2, 3, 4]], ["SP", 1, 0, 200704, [14], 1], ["AN", 1, 0, 5], ["AN", 1, 1, 6]]]], "r": [[1.33231e-05, 1.33335e-05, 1.33392e-05], 0, 2.43709, 1667968414], "v": "v0.6"}
{"i": [["[\"hfused_relu\", 1, 14, 14, 16, 64]", "cuda -keys=cuda,gpu -max_num_threads=1024 -model=unknown -thread_warp_size=32", [-1, 16, 64, 49152, 2147483647, 1024, 8, 32], "", 0, []], [[], [["FU", 1, [0, 1, 2, 3, 4]], ["SP", 1, 0, 200704, [64], 1], ["AN", 1, 0, 5], ["AN", 1, 1, 6]]]], "r": [[4.79407e-06, 4.80464e-06, 4.80483e-06], 0, 3.09206, 1667968415], "v": "v0.6"}
{"i": [["[\"hfused_relu\", 1, 14, 14, 16, 64]", "cuda -keys=cuda,gpu -max_num_threads=1024 -model=unknown -thread_warp_size=32", [-1, 16, 64, 49152, 2147483647, 1024, 8, 32], "", 0, []], [[], [["FU", 1, [0, 1, 2, 3, 4]], ["SP", 1, 0, 200704, [2], 1], ["AN", 1, 0, 5], ["AN", 1, 1, 6]]]], "r": [[7.70582e-05, 7.7058e-05, 7.70593e-05], 0, 3.73677, 1667968415], "v": "v0.6"}
{"i": [["[\"hfused_relu\", 1, 14, 14, 16, 64]", "cuda -keys=cuda,gpu -max_num_threads=1024 -model=unknown -thread_warp_size=32", [-1, 16, 64, 49152, 2147483647, 1024, 8, 32], "", 0, []], [[], [["FU", 1, [0, 1, 2, 3, 4]], ["SP", 1, 0, 200704, [1], 1], ["AN", 1, 0, 5], ["AN", 1, 1, 6]]]], "r": [[0.000151527, 0.000151517, 0.000151546], 0, 4.04304, 1667968416], "v": "v0.6"}
{"i": [["[\"hfused_relu\", 1, 14, 14, 16, 64]", "cuda -keys=cuda,gpu -max_num_threads=1024 -model=unknown -thread_warp_size=32", [-1, 16, 64, 49152, 2147483647, 1024, 8, 32], "", 0, []], [[], [["FU", 1, [0, 1, 2, 3, 4]], ["SP", 1, 0, 200704, [49], 1], ["AN", 1, 0, 5], ["AN", 1, 1, 6]]]], "r": [[5.56142e-06, 5.57217e-06, 5.57123e-06], 0, 0.521991, 1667968455], "v": "v0.6"}
{"i": [["[\"hfused_relu\", 1, 14, 14, 16, 64]", "cuda -keys=cuda,gpu -max_num_threads=1024 -model=unknown -thread_warp_size=32", [-1, 16, 64, 49152, 2147483647, 1024, 8, 32], "", 0, []], [[], [["FU", 1, [0, 1, 2, 3, 4]], ["SP", 1, 0, 200704, [56], 1], ["AN", 1, 0, 5], ["AN", 1, 1, 6]]]], "r": [[5.29417e-06, 5.31623e-06, 5.31601e-06], 0, 0.85711, 1667968455], "v": "v0.6"}
{"i": [["[\"hfused_relu\", 1, 14, 14, 16, 64]", "cuda -keys=cuda,gpu -max_num_threads=1024 -model=unknown -thread_warp_size=32", [-1, 16, 64, 49152, 2147483647, 1024, 8, 32], "", 0, []], [[], [["FU", 1, [0, 1, 2, 3, 4]], ["SP", 1, 0, 200704, [14], 1], ["AN", 1, 0, 5], ["AN", 1, 1, 6]]]], "r": [[1.33805e-05, 1.33886e-05, 1.33921e-05], 0, 3.10106, 1667968458], "v": "v0.6"}
{"i": [["[\"hfused_relu\", 1, 14, 14, 16, 64]", "cuda -keys=cuda,gpu -max_num_threads=1024 -model=unknown -thread_warp_size=32", [-1, 16, 64, 49152, 2147483647, 1024, 8, 32], "", 0, []], [[], [["FU", 1, [0, 1, 2, 3, 4]], ["SP", 1, 0, 200704, [28], 1], ["AN", 1, 0, 5], ["AN", 1, 1, 6]]]], "r": [[7.97575e-06, 7.9908e-06, 7.99366e-06], 0, 1.47168, 1667968456], "v": "v0.6"}
{"i": [["[\"hfused_relu\", 1, 14, 14, 16, 64]", "cuda -keys=cuda,gpu -max_num_threads=1024 -model=unknown -thread_warp_size=32", [-1, 16, 64, 49152, 2147483647, 1024, 8, 32], "", 0, []], [[], [["FU", 1, [0, 1, 2, 3, 4]], ["SP", 1, 0, 200704, [1], 1], ["AN", 1, 0, 5], ["AN", 1, 1, 6]]]], "r": [[0.00015158, 0.000151605, 0.000151623], 0, 1.15715, 1667968456], "v": "v0.6"}
{"i": [["[\"hfused_relu\", 1, 14, 14, 16, 64]", "cuda -keys=cuda,gpu -max_num_threads=1024 -model=unknown -thread_warp_size=32", [-1, 16, 64, 49152, 2147483647, 1024, 8, 32], "", 0, []], [[], [["FU", 1, [0, 1, 2, 3, 4]], ["SP", 1, 0, 200704, [4], 1], ["AN", 1, 0, 5], ["AN", 1, 1, 6]]]], "r": [[3.99938e-05, 4.00108e-05, 3.99925e-05], 0, 2.12564, 1667968457], "v": "v0.6"}
{"i": [["[\"hfused_relu\", 1, 14, 14, 16, 64]", "cuda -keys=cuda,gpu -max_num_threads=1024 -model=unknown -thread_warp_size=32", [-1, 16, 64, 49152, 2147483647, 1024, 8, 32], "", 0, []], [[], [["FU", 1, [0, 1, 2, 3, 4]], ["SP", 1, 0, 200704, [2], 1], ["AN", 1, 0, 5], ["AN", 1, 1, 6]]]], "r": [[7.70876e-05, 7.70984e-05, 7.70762e-05], 0, 1.80995, 1667968456], "v": "v0.6"}
{"i": [["[\"hfused_relu\", 1, 14, 14, 16, 64]", "cuda -keys=cuda,gpu -max_num_threads=1024 -model=unknown -thread_warp_size=32", [-1, 16, 64, 49152, 2147483647, 1024, 8, 32], "", 0, []], [[], [["FU", 1, [0, 1, 2, 3, 4]], ["SP", 1, 0, 200704, [16], 1], ["AN", 1, 0, 5], ["AN", 1, 1, 6]]]], "r": [[1.20081e-05, 1.20176e-05, 1.20162e-05], 0, 2.78793, 1667968457], "v": "v0.6"}
{"i": [["[\"hfused_relu\", 1, 14, 14, 16, 64]", "cuda -keys=cuda,gpu -max_num_threads=1024 -model=unknown -thread_warp_size=32", [-1, 16, 64, 49152, 2147483647, 1024, 8, 32], "", 0, []], [[], [["FU", 1, [0, 1, 2, 3, 4]], ["SP", 1, 0, 200704, [64], 1], ["AN", 1, 0, 5], ["AN", 1, 1, 6]]]], "r": [[4.92884e-06, 4.92746e-06, 4.93343e-06], 0, 3.38309, 1667968458], "v": "v0.6"}
{"i": [["[\"hfused_relu\", 1, 14, 14, 16, 64]", "cuda -keys=cuda,gpu -max_num_threads=1024 -model=unknown -thread_warp_size=32", [-1, 16, 64, 49152, 2147483647, 1024, 8, 32], "", 0, []], [[], [["FU", 1, [0, 1, 2, 3, 4]], ["SP", 1, 0, 200704, [7], 1], ["AN", 1, 0, 5], ["AN", 1, 1, 6]]]], "r": [[2.39957e-05, 2.39965e-05, 2.40138e-05], 0, 2.42389, 1667968457], "v": "v0.6"}
{"i": [["[\"hfused_relu\", 1, 14, 14, 16, 64]", "cuda -keys=cuda,gpu -max_num_threads=1024 -model=unknown -thread_warp_size=32", [-1, 16, 64, 49152, 2147483647, 1024, 8, 32], "", 0, []], [[], [["FU", 1, [0, 1, 2, 3, 4]], ["SP", 1, 0, 200704, [32], 1], ["AN", 1, 0, 5], ["AN", 1, 1, 6]]]], "r": [[7.23791e-06, 7.24928e-06, 7.25046e-06], 0, 3.7417, 1667968458], "v": "v0.6"}
{"i": [["[\"hfused_relu\", 1, 14, 14, 16, 64]", "cuda -keys=cuda,gpu -max_num_threads=1024 -model=unknown -thread_warp_size=32", [-1, 16, 64, 49152, 2147483647, 1024, 8, 32], "", 0, []], [[], [["FU", 1, [0, 1, 2, 3, 4]], ["SP", 1, 0, 200704, [8], 1], ["AN", 1, 0, 5], ["AN", 1, 1, 6]]]], "r": [[2.13682e-05, 2.1381e-05, 2.13793e-05], 0, 4.02796, 1667968459], "v": "v0.6"}
{"i": [["[\"hfused_relu\", 1, 14, 14, 16, 64]", "cuda -keys=cuda,gpu -max_num_threads=1024 -model=unknown -thread_warp_size=32", [-1, 16, 64, 49152, 2147483647, 1024, 8, 32], "", 0, []], [[], [["FU", 1, [0, 1, 2, 3, 4]], ["SP", 1, 0, 200704, [4], 1], ["AN", 1, 0, 5], ["AN", 1, 1, 6]]]], "r": [[3.99449e-05, 3.99464e-05, 3.99484e-05], 0, 1.20909, 1667968520], "v": "v0.6"}
{"i": [["[\"hfused_relu\", 1, 14, 14, 16, 64]", "cuda -keys=cuda,gpu -max_num_threads=1024 -model=unknown -thread_warp_size=32", [-1, 16, 64, 49152, 2147483647, 1024, 8, 32], "", 0, []], [[], [["FU", 1, [0, 1, 2, 3, 4]], ["SP", 1, 0, 200704, [64], 1], ["AN", 1, 0, 5], ["AN", 1, 1, 6]]]], "r": [[5.01953e-06, 5.03051e-06, 5.02824e-06], 0, 2.1916, 1667968521], "v": "v0.6"}
{"i": [["[\"hfused_relu\", 1, 14, 14, 16, 64]", "cuda -keys=cuda,gpu -max_num_threads=1024 -model=unknown -thread_warp_size=32", [-1, 16, 64, 49152, 2147483647, 1024, 8, 32], "", 0, []], [[], [["FU", 1, [0, 1, 2, 3, 4]], ["SP", 1, 0, 200704, [2], 1], ["AN", 1, 0, 5], ["AN", 1, 1, 6]]]], "r": [[7.7157e-05, 7.71354e-05, 7.71672e-05], 0, 1.87334, 1667968521], "v": "v0.6"}
{"i": [["[\"hfused_relu\", 1, 14, 14, 16, 64]", "cuda -keys=cuda,gpu -max_num_threads=1024 -model=unknown -thread_warp_size=32", [-1, 16, 64, 49152, 2147483647, 1024, 8, 32], "", 0, []], [[], [["FU", 1, [0, 1, 2, 3, 4]], ["SP", 1, 0, 200704, [8], 1], ["AN", 1, 0, 5], ["AN", 1, 1, 6]]]], "r": [[2.12699e-05, 2.12804e-05, 2.12835e-05], 0, 2.50838, 1667968522], "v": "v0.6"}
{"i": [["[\"hfused_relu\", 1, 14, 14, 16, 64]", "cuda -keys=cuda,gpu -max_num_threads=1024 -model=unknown -thread_warp_size=32", [-1, 16, 64, 49152, 2147483647, 1024, 8, 32], "", 0, []], [[], [["FU", 1, [0, 1, 2, 3, 4]], ["SP", 1, 0, 200704, [28], 1], ["AN", 1, 0, 5], ["AN", 1, 1, 6]]]], "r": [[7.92209e-06, 7.93788e-06, 7.934e-06], 0, 0.883073, 1667968520], "v": "v0.6"}
{"i": [["[\"hfused_relu\", 1, 14, 14, 16, 64]", "cuda -keys=cuda,gpu -max_num_threads=1024 -model=unknown -thread_warp_size=32", [-1, 16, 64, 49152, 2147483647, 1024, 8, 32], "", 0, []], [[], [["FU", 1, [0, 1, 2, 3, 4]], ["SP", 1, 0, 200704, [32], 1], ["AN", 1, 0, 5], ["AN", 1, 1, 6]]]], "r": [[7.19353e-06, 7.20423e-06, 7.2091e-06], 0, 0.520073, 1667968519], "v": "v0.6"}
{"i": [["[\"hfused_relu\", 1, 14, 14, 16, 64]", "cuda -keys=cuda,gpu -max_num_threads=1024 -model=unknown -thread_warp_size=32", [-1, 16, 64, 49152, 2147483647, 1024, 8, 32], "", 0, []], [[], [["FU", 1, [0, 1, 2, 3, 4]], ["SP", 1, 0, 200704, [7], 1], ["AN", 1, 0, 5], ["AN", 1, 1, 6]]]], "r": [[2.40671e-05, 2.40714e-05, 2.40704e-05], 0, 1.50655, 1667968521], "v": "v0.6"}
{"i": [["[\"hfused_relu\", 1, 14, 14, 16, 64]", "cuda -keys=cuda,gpu -max_num_threads=1024 -model=unknown -thread_warp_size=32", [-1, 16, 64, 49152, 2147483647, 1024, 8, 32], "", 0, []], [[], [["FU", 1, [0, 1, 2, 3, 4]], ["SP", 1, 0, 200704, [16], 1], ["AN", 1, 0, 5], ["AN", 1, 1, 6]]]], "r": [[1.20217e-05, 1.20451e-05, 1.20465e-05], 0, 3.13717, 1667968522], "v": "v0.6"}
{"i": [["[\"hfused_relu\", 1, 14, 14, 16, 64]", "cuda -keys=cuda,gpu -max_num_threads=1024 -model=unknown -thread_warp_size=32", [-1, 16, 64, 49152, 2147483647, 1024, 8, 32], "", 0, []], [[], [["FU", 1, [0, 1, 2, 3, 4]], ["SP", 1, 0, 200704, [56], 1], ["AN", 1, 0, 5], ["AN", 1, 1, 6]]]], "r": [[5.21807e-06, 5.23123e-06, 5.23088e-06], 0, 2.83126, 1667968522], "v": "v0.6"}
{"i": [["[\"hfused_relu\", 1, 14, 14, 16, 64]", "cuda -keys=cuda,gpu -max_num_threads=1024 -model=unknown -thread_warp_size=32", [-1, 16, 64, 49152, 2147483647, 1024, 8, 32], "", 0, []], [[], [["FU", 1, [0, 1, 2, 3, 4]], ["SP", 1, 0, 200704, [49], 1], ["AN", 1, 0, 5], ["AN", 1, 1, 6]]]], "r": [[5.54433e-06, 5.56497e-06, 5.55522e-06], 0, 3.4592, 1667968523], "v": "v0.6"}
{"i": [["[\"hfused_relu\", 1, 14, 14, 16, 64]", "cuda -keys=cuda,gpu -max_num_threads=1024 -model=unknown -thread_warp_size=32", [-1, 16, 64, 49152, 2147483647, 1024, 8, 32], "", 0, []], [[], [["FU", 1, [0, 1, 2, 3, 4]], ["SP", 1, 0, 200704, [1], 1], ["AN", 1, 0, 5], ["AN", 1, 1, 6]]]], "r": [[0.000151607, 0.000151592, 0.000151606], 0, 4.10884, 1667968523], "v": "v0.6"}
{"i": [["[\"hfused_relu\", 1, 14, 14, 16, 64]", "cuda -keys=cuda,gpu -max_num_threads=1024 -model=unknown -thread_warp_size=32", [-1, 16, 64, 49152, 2147483647, 1024, 8, 32], "", 0, []], [[], [["FU", 1, [0, 1, 2, 3, 4]], ["SP", 1, 0, 200704, [14], 1], ["AN", 1, 0, 5], ["AN", 1, 1, 6]]]], "r": [[1.33948e-05, 1.34046e-05, 1.33938e-05], 0, 3.79674, 1667968523], "v": "v0.6"}
{"i": [["[\"hfused_relu\", 1, 14, 14, 16, 64]", "cuda -keys=cuda,gpu -max_num_threads=1024 -model=unknown -thread_warp_size=32", [-1, 16, 64, 49152, 2147483647, 1024, 8, 32], "", 0, []], [[], [["FU", 1, [0, 1, 2, 3, 4]], ["SP", 1, 0, 200704, [8], 1], ["AN", 1, 0, 5], ["AN", 1, 1, 6]]]], "r": [[2.14046e-05, 2.14372e-05, 2.14348e-05], 0, 0.523857, 1667968563], "v": "v0.6"}
{"i": [["[\"hfused_relu\", 1, 14, 14, 16, 64]", "cuda -keys=cuda,gpu -max_num_threads=1024 -model=unknown -thread_warp_size=32", [-1, 16, 64, 49152, 2147483647, 1024, 8, 32], "", 0, []], [[], [["FU", 1, [0, 1, 2, 3, 4]], ["SP", 1, 0, 200704, [32], 1], ["AN", 1, 0, 5], ["AN", 1, 1, 6]]]], "r": [[7.19873e-06, 7.20758e-06, 7.20823e-06], 0, 1.17703, 1667968563], "v": "v0.6"}
{"i": [["[\"hfused_relu\", 1, 14, 14, 16, 64]", "cuda -keys=cuda,gpu -max_num_threads=1024 -model=unknown -thread_warp_size=32", [-1, 16, 64, 49152, 2147483647, 1024, 8, 32], "", 0, []], [[], [["FU", 1, [0, 1, 2, 3, 4]], ["SP", 1, 0, 200704, [7], 1], ["AN", 1, 0, 5], ["AN", 1, 1, 6]]]], "r": [[2.3988e-05, 2.40055e-05, 2.4009e-05], 0, 1.81975, 1667968564], "v": "v0.6"}
{"i": [["[\"hfused_relu\", 1, 14, 14, 16, 64]", "cuda -keys=cuda,gpu -max_num_threads=1024 -model=unknown -thread_warp_size=32", [-1, 16, 64, 49152, 2147483647, 1024, 8, 32], "", 0, []], [[], [["FU", 1, [0, 1, 2, 3, 4]], ["SP", 1, 0, 200704, [14], 1], ["AN", 1, 0, 5], ["AN", 1, 1, 6]]]], "r": [[1.34197e-05, 1.34282e-05, 1.34281e-05], 0, 0.878318, 1667968563], "v": "v0.6"}
{"i": [["[\"hfused_relu\", 1, 14, 14, 16, 64]", "cuda -keys=cuda,gpu -max_num_threads=1024 -model=unknown -thread_warp_size=32", [-1, 16, 64, 49152, 2147483647, 1024, 8, 32], "", 0, []], [[], [["FU", 1, [0, 1, 2, 3, 4]], ["SP", 1, 0, 200704, [56], 1], ["AN", 1, 0, 5], ["AN", 1, 1, 6]]]], "r": [[5.20286e-06, 5.23023e-06, 5.23133e-06], 0, 1.4856, 1667968564], "v": "v0.6"}
{"i": [["[\"hfused_relu\", 1, 14, 14, 16, 64]", "cuda -keys=cuda,gpu -max_num_threads=1024 -model=unknown -thread_warp_size=32", [-1, 16, 64, 49152, 2147483647, 1024, 8, 32], "", 0, []], [[], [["FU", 1, [0, 1, 2, 3, 4]], ["SP", 1, 0, 200704, [1], 1], ["AN", 1, 0, 5], ["AN", 1, 1, 6]]]], "r": [[0.00015156, 0.000151559, 0.00015159], 0, 3.1217, 1667968565], "v": "v0.6"}
{"i": [["[\"hfused_relu\", 1, 14, 14, 16, 64]", "cuda -keys=cuda,gpu -max_num_threads=1024 -model=unknown -thread_warp_size=32", [-1, 16, 64, 49152, 2147483647, 1024, 8, 32], "", 0, []], [[], [["FU", 1, [0, 1, 2, 3, 4]], ["SP", 1, 0, 200704, [2], 1], ["AN", 1, 0, 5], ["AN", 1, 1, 6]]]], "r": [[7.70916e-05, 7.7121e-05, 7.71226e-05], 0, 2.13916, 1667968564], "v": "v0.6"}
{"i": [["[\"hfused_relu\", 1, 14, 14, 16, 64]", "cuda -keys=cuda,gpu -max_num_threads=1024 -model=unknown -thread_warp_size=32", [-1, 16, 64, 49152, 2147483647, 1024, 8, 32], "", 0, []], [[], [["FU", 1, [0, 1, 2, 3, 4]], ["SP", 1, 0, 200704, [4], 1], ["AN", 1, 0, 5], ["AN", 1, 1, 6]]]], "r": [[3.98431e-05, 3.98494e-05, 3.98551e-05], 0, 2.45735, 1667968565], "v": "v0.6"}
{"i": [["[\"hfused_relu\", 1, 14, 14, 16, 64]", "cuda -keys=cuda,gpu -max_num_threads=1024 -model=unknown -thread_warp_size=32", [-1, 16, 64, 49152, 2147483647, 1024, 8, 32], "", 0, []], [[], [["FU", 1, [0, 1, 2, 3, 4]], ["SP", 1, 0, 200704, [28], 1], ["AN", 1, 0, 5], ["AN", 1, 1, 6]]]], "r": [[7.89572e-06, 7.90979e-06, 7.91016e-06], 0, 2.81546, 1667968565], "v": "v0.6"}
{"i": [["[\"hfused_relu\", 1, 14, 14, 16, 64]", "cuda -keys=cuda,gpu -max_num_threads=1024 -model=unknown -thread_warp_size=32", [-1, 16, 64, 49152, 2147483647, 1024, 8, 32], "", 0, []], [[], [["FU", 1, [0, 1, 2, 3, 4]], ["SP", 1, 0, 200704, [16], 1], ["AN", 1, 0, 5], ["AN", 1, 1, 6]]]], "r": [[1.20538e-05, 1.20564e-05, 1.20557e-05], 0, 3.41235, 1667968566], "v": "v0.6"}
{"i": [["[\"hfused_relu\", 1, 14, 14, 16, 64]", "cuda -keys=cuda,gpu -max_num_threads=1024 -model=unknown -thread_warp_size=32", [-1, 16, 64, 49152, 2147483647, 1024, 8, 32], "", 0, []], [[], [["FU", 1, [0, 1, 2, 3, 4]], ["SP", 1, 0, 200704, [64], 1], ["AN", 1, 0, 5], ["AN", 1, 1, 6]]]], "r": [[4.77243e-06, 4.78613e-06, 4.78757e-06], 0, 4.05184, 1667968566], "v": "v0.6"}
{"i": [["[\"hfused_relu\", 1, 14, 14, 16, 64]", "cuda -keys=cuda,gpu -max_num_threads=1024 -model=unknown -thread_warp_size=32", [-1, 16, 64, 49152, 2147483647, 1024, 8, 32], "", 0, []], [[], [["FU", 1, [0, 1, 2, 3, 4]], ["SP", 1, 0, 200704, [49], 1], ["AN", 1, 0, 5], ["AN", 1, 1, 6]]]], "r": [[5.77527e-06, 5.78636e-06, 5.78875e-06], 0, 3.74109, 1667968566], "v": "v0.6"}
{"i": [["[\"hfused_relu\", 1, 14, 14, 16, 64]", "cuda -keys=cuda,gpu -max_num_threads=1024 -model=unknown -thread_warp_size=32", [-1, 16, 64, 49152, 2147483647, 1024, 8, 32], "", 0, []], [[], [["FU", 1, [0, 1, 2, 3, 4]], ["SP", 1, 0, 200704, [7], 1], ["AN", 1, 0, 5], ["AN", 1, 1, 6]]]], "r": [[2.4193e-05, 2.42079e-05, 2.421e-05], 0, 0.535064, 1667968627], "v": "v0.6"}
{"i": [["[\"hfused_relu\", 1, 14, 14, 16, 64]", "cuda -keys=cuda,gpu -max_num_threads=1024 -model=unknown -thread_warp_size=32", [-1, 16, 64, 49152, 2147483647, 1024, 8, 32], "", 0, []], [[], [["FU", 1, [0, 1, 2, 3, 4]], ["SP", 1, 0, 200704, [16], 1], ["AN", 1, 0, 5], ["AN", 1, 1, 6]]]], "r": [[1.19884e-05, 1.20014e-05, 1.20122e-05], 0, 1.47307, 1667968628], "v": "v0.6"}
{"i": [["[\"hfused_relu\", 1, 14, 14, 16, 64]", "cuda -keys=cuda,gpu -max_num_threads=1024 -model=unknown -thread_warp_size=32", [-1, 16, 64, 49152, 2147483647, 1024, 8, 32], "", 0, []], [[], [["FU", 1, [0, 1, 2, 3, 4]], ["SP", 1, 0, 200704, [32], 1], ["AN", 1, 0, 5], ["AN", 1, 1, 6]]]], "r": [[7.34981e-06, 7.3718e-06, 7.3687e-06], 0, 1.17825, 1667968628], "v": "v0.6"}
{"i": [["[\"hfused_relu\", 1, 14, 14, 16, 64]", "cuda -keys=cuda,gpu -max_num_threads=1024 -model=unknown -thread_warp_size=32", [-1, 16, 64, 49152, 2147483647, 1024, 8, 32], "", 0, []], [[], [["FU", 1, [0, 1, 2, 3, 4]], ["SP", 1, 0, 200704, [28], 1], ["AN", 1, 0, 5], ["AN", 1, 1, 6]]]], "r": [[7.86402e-06, 7.87555e-06, 7.88611e-06], 0, 0.869434, 1667968628], "v": "v0.6"}
{"i": [["[\"hfused_relu\", 1, 14, 14, 16, 64]", "cuda -keys=cuda,gpu -max_num_threads=1024 -model=unknown -thread_warp_size=32", [-1, 16, 64, 49152, 2147483647, 1024, 8, 32], "", 0, []], [[], [["FU", 1, [0, 1, 2, 3, 4]], ["SP", 1, 0, 200704, [49], 1], ["AN", 1, 0, 5], ["AN", 1, 1, 6]]]], "r": [[5.68262e-06, 5.69005e-06, 5.68927e-06], 0, 1.807, 1667968629], "v": "v0.6"}
{"i": [["[\"hfused_relu\", 1, 14, 14, 16, 64]", "cuda -keys=cuda,gpu -max_num_threads=1024 -model=unknown -thread_warp_size=32", [-1, 16, 64, 49152, 2147483647, 1024, 8, 32], "", 0, []], [[], [["FU", 1, [0, 1, 2, 3, 4]], ["SP", 1, 0, 200704, [56], 1], ["AN", 1, 0, 5], ["AN", 1, 1, 6]]]], "r": [[5.13608e-06, 5.15277e-06, 5.15338e-06], 0, 2.12335, 1667968629], "v": "v0.6"}
{"i": [["[\"hfused_relu\", 1, 14, 14, 16, 64]", "cuda -keys=cuda,gpu -max_num_threads=1024 -model=unknown -thread_warp_size=32", [-1, 16, 64, 49152, 2147483647, 1024, 8, 32], "", 0, []], [[], [["FU", 1, [0, 1, 2, 3, 4]], ["SP", 1, 0, 200704, [14], 1], ["AN", 1, 0, 5], ["AN", 1, 1, 6]]]], "r": [[1.34244e-05, 1.34228e-05, 1.34328e-05], 0, 2.43699, 1667968629], "v": "v0.6"}
{"i": [["[\"hfused_relu\", 1, 14, 14, 16, 64]", "cuda -keys=cuda,gpu -max_num_threads=1024 -model=unknown -thread_warp_size=32", [-1, 16, 64, 49152, 2147483647, 1024, 8, 32], "", 0, []], [[], [["FU", 1, [0, 1, 2, 3, 4]], ["SP", 1, 0, 200704, [2], 1], ["AN", 1, 0, 5], ["AN", 1, 1, 6]]]], "r": [[7.70351e-05, 7.70487e-05, 7.70428e-05], 0, 3.11376, 1667968630], "v": "v0.6"}
{"i": [["[\"hfused_relu\", 1, 14, 14, 16, 64]", "cuda -keys=cuda,gpu -max_num_threads=1024 -model=unknown -thread_warp_size=32", [-1, 16, 64, 49152, 2147483647, 1024, 8, 32], "", 0, []], [[], [["FU", 1, [0, 1, 2, 3, 4]], ["SP", 1, 0, 200704, [4], 1], ["AN", 1, 0, 5], ["AN", 1, 1, 6]]]], "r": [[3.98257e-05, 3.98368e-05, 3.98375e-05], 0, 2.78717, 1667968630], "v": "v0.6"}
{"i": [["[\"hfused_relu\", 1, 14, 14, 16, 64]", "cuda -keys=cuda,gpu -max_num_threads=1024 -model=unknown -thread_warp_size=32", [-1, 16, 64, 49152, 2147483647, 1024, 8, 32], "", 0, []], [[], [["FU", 1, [0, 1, 2, 3, 4]], ["SP", 1, 0, 200704, [64], 1], ["AN", 1, 0, 5], ["AN", 1, 1, 6]]]], "r": [[4.77392e-06, 4.78445e-06, 4.78471e-06], 0, 3.40288, 1667968630], "v": "v0.6"}
{"i": [["[\"hfused_relu\", 1, 14, 14, 16, 64]", "cuda -keys=cuda,gpu -max_num_threads=1024 -model=unknown -thread_warp_size=32", [-1, 16, 64, 49152, 2147483647, 1024, 8, 32], "", 0, []], [[], [["FU", 1, [0, 1, 2, 3, 4]], ["SP", 1, 0, 200704, [1], 1], ["AN", 1, 0, 5], ["AN", 1, 1, 6]]]], "r": [[0.000151546, 0.000151527, 0.000151592], 0, 4.06769, 1667968631], "v": "v0.6"}
{"i": [["[\"hfused_relu\", 1, 14, 14, 16, 64]", "cuda -keys=cuda,gpu -max_num_threads=1024 -model=unknown -thread_warp_size=32", [-1, 16, 64, 49152, 2147483647, 1024, 8, 32], "", 0, []], [[], [["FU", 1, [0, 1, 2, 3, 4]], ["SP", 1, 0, 200704, [8], 1], ["AN", 1, 0, 5], ["AN", 1, 1, 6]]]], "r": [[2.15169e-05, 2.15296e-05, 2.15257e-05], 0, 3.75578, 1667968631], "v": "v0.6"}
{"i": [["[\"hfused_relu\", 1, 14, 14, 16, 64]", "cuda -keys=cuda,gpu -max_num_threads=1024 -model=unknown -thread_warp_size=32", [-1, 16, 64, 49152, 2147483647, 1024, 8, 32], "", 0, []], [[], [["FU", 1, [0, 1, 2, 3, 4]], ["SP", 1, 0, 200704, [4], 1], ["AN", 1, 0, 5], ["AN", 1, 1, 6]]]], "r": [[3.99232e-05, 3.99554e-05, 3.99424e-05], 0, 1.48782, 1667968671], "v": "v0.6"}
{"i": [["[\"hfused_relu\", 1, 14, 14, 16, 64]", "cuda -keys=cuda,gpu -max_num_threads=1024 -model=unknown -thread_warp_size=32", [-1, 16, 64, 49152, 2147483647, 1024, 8, 32], "", 0, []], [[], [["FU", 1, [0, 1, 2, 3, 4]], ["SP", 1, 0, 200704, [2], 1], ["AN", 1, 0, 5], ["AN", 1, 1, 6]]]], "r": [[7.70412e-05, 7.70347e-05, 7.70411e-05], 0, 1.84084, 1667968671], "v": "v0.6"}
{"i": [["[\"hfused_relu\", 1, 14, 14, 16, 64]", "cuda -keys=cuda,gpu -max_num_threads=1024 -model=unknown -thread_warp_size=32", [-1, 16, 64, 49152, 2147483647, 1024, 8, 32], "", 0, []], [[], [["FU", 1, [0, 1, 2, 3, 4]], ["SP", 1, 0, 200704, [1], 1], ["AN", 1, 0, 5], ["AN", 1, 1, 6]]]], "r": [[0.000151544, 0.000151519, 0.00015153], 0, 1.17827, 1667968671], "v": "v0.6"}
{"i": [["[\"hfused_relu\", 1, 14, 14, 16, 64]", "cuda -keys=cuda,gpu -max_num_threads=1024 -model=unknown -thread_warp_size=32", [-1, 16, 64, 49152, 2147483647, 1024, 8, 32], "", 0, []], [[], [["FU", 1, [0, 1, 2, 3, 4]], ["SP", 1, 0, 200704, [32], 1], ["AN", 1, 0, 5], ["AN", 1, 1, 6]]]], "r": [[7.22315e-06, 7.23757e-06, 7.23578e-06], 0, 0.520371, 1667968670], "v": "v0.6"}
{"i": [["[\"hfused_relu\", 1, 14, 14, 16, 64]", "cuda -keys=cuda,gpu -max_num_threads=1024 -model=unknown -thread_warp_size=32", [-1, 16, 64, 49152, 2147483647, 1024, 8, 32], "", 0, []], [[], [["FU", 1, [0, 1, 2, 3, 4]], ["SP", 1, 0, 200704, [64], 1], ["AN", 1, 0, 5], ["AN", 1, 1, 6]]]], "r": [[4.87987e-06, 4.8845e-06, 4.88522e-06], 0, 0.876984, 1667968670], "v": "v0.6"}
{"i": [["[\"hfused_relu\", 1, 14, 14, 16, 64]", "cuda -keys=cuda,gpu -max_num_threads=1024 -model=unknown -thread_warp_size=32", [-1, 16, 64, 49152, 2147483647, 1024, 8, 32], "", 0, []], [[], [["FU", 1, [0, 1, 2, 3, 4]], ["SP", 1, 0, 200704, [14], 1], ["AN", 1, 0, 5], ["AN", 1, 1, 6]]]], "r": [[1.33613e-05, 1.33771e-05, 1.33823e-05], 0, 2.19731, 1667968672], "v": "v0.6"}
{"i": [["[\"hfused_relu\", 1, 14, 14, 16, 64]", "cuda -keys=cuda,gpu -max_num_threads=1024 -model=unknown -thread_warp_size=32", [-1, 16, 64, 49152, 2147483647, 1024, 8, 32], "", 0, []], [[], [["FU", 1, [0, 1, 2, 3, 4]], ["SP", 1, 0, 200704, [16], 1], ["AN", 1, 0, 5], ["AN", 1, 1, 6]]]], "r": [[1.20579e-05, 1.20823e-05, 1.20652e-05], 0, 2.51584, 1667968672], "v": "v0.6"}
{"i": [["[\"hfused_relu\", 1, 14, 14, 16, 64]", "cuda -keys=cuda,gpu -max_num_threads=1024 -model=unknown -thread_warp_size=32", [-1, 16, 64, 49152, 2147483647, 1024, 8, 32], "", 0, []], [[], [["FU", 1, [0, 1, 2, 3, 4]], ["SP", 1, 0, 200704, [56], 1], ["AN", 1, 0, 5], ["AN", 1, 1, 6]]]], "r": [[5.21747e-06, 5.22837e-06, 5.22283e-06], 0, 3.1469, 1667968673], "v": "v0.6"}
{"i": [["[\"hfused_relu\", 1, 14, 14, 16, 64]", "cuda -keys=cuda,gpu -max_num_threads=1024 -model=unknown -thread_warp_size=32", [-1, 16, 64, 49152, 2147483647, 1024, 8, 32], "", 0, []], [[], [["FU", 1, [0, 1, 2, 3, 4]], ["SP", 1, 0, 200704, [7], 1], ["AN", 1, 0, 5], ["AN", 1, 1, 6]]]], "r": [[2.40575e-05, 2.40804e-05, 2.40857e-05], 0, 2.83639, 1667968672], "v": "v0.6"}
{"i": [["[\"hfused_relu\", 1, 14, 14, 16, 64]", "cuda -keys=cuda,gpu -max_num_threads=1024 -model=unknown -thread_warp_size=32", [-1, 16, 64, 49152, 2147483647, 1024, 8, 32], "", 0, []], [[], [["FU", 1, [0, 1, 2, 3, 4]], ["SP", 1, 0, 200704, [28], 1], ["AN", 1, 0, 5], ["AN", 1, 1, 6]]]], "r": [[7.98175e-06, 7.99355e-06, 7.99047e-06], 0, 3.80411, 1667968673], "v": "v0.6"}
{"i": [["[\"hfused_relu\", 1, 14, 14, 16, 64]", "cuda -keys=cuda,gpu -max_num_threads=1024 -model=unknown -thread_warp_size=32", [-1, 16, 64, 49152, 2147483647, 1024, 8, 32], "", 0, []], [[], [["FU", 1, [0, 1, 2, 3, 4]], ["SP", 1, 0, 200704, [49], 1], ["AN", 1, 0, 5], ["AN", 1, 1, 6]]]], "r": [[5.55002e-06, 5.56049e-06, 5.56236e-06], 0, 3.43688, 1667968673], "v": "v0.6"}
{"i": [["[\"hfused_relu\", 1, 14, 14, 16, 64]", "cuda -keys=cuda,gpu -max_num_threads=1024 -model=unknown -thread_warp_size=32", [-1, 16, 64, 49152, 2147483647, 1024, 8, 32], "", 0, []], [[], [["FU", 1, [0, 1, 2, 3, 4]], ["SP", 1, 0, 200704, [8], 1], ["AN", 1, 0, 5], ["AN", 1, 1, 6]]]], "r": [[2.12403e-05, 2.12642e-05, 2.12415e-05], 0, 4.10695, 1667968674], "v": "v0.6"}
{"i": [["[\"hfused_relu\", 1, 14, 14, 16, 64]", "cuda -keys=cuda,gpu -max_num_threads=1024 -model=unknown -thread_warp_size=32", [-1, 16, 64, 49152, 2147483647, 1024, 8, 32], "", 0, []], [[], [["FU", 1, [0, 1, 2, 3, 4]], ["SP", 1, 0, 200704, [28], 1], ["AN", 1, 0, 5], ["AN", 1, 1, 6]]]], "r": [[7.86916e-06, 7.87756e-06, 7.88094e-06], 0, 0.518739, 1667968734], "v": "v0.6"}
{"i": [["[\"hfused_relu\", 1, 14, 14, 16, 64]", "cuda -keys=cuda,gpu -max_num_threads=1024 -model=unknown -thread_warp_size=32", [-1, 16, 64, 49152, 2147483647, 1024, 8, 32], "", 0, []], [[], [["FU", 1, [0, 1, 2, 3, 4]], ["SP", 1, 0, 200704, [8], 1], ["AN", 1, 0, 5], ["AN", 1, 1, 6]]]], "r": [[2.13098e-05, 2.13232e-05, 2.13257e-05], 0, 2.11593, 1667968736], "v": "v0.6"}
{"i": [["[\"hfused_relu\", 1, 14, 14, 16, 64]", "cuda -keys=cuda,gpu -max_num_threads=1024 -model=unknown -thread_warp_size=32", [-1, 16, 64, 49152, 2147483647, 1024, 8, 32], "", 0, []], [[], [["FU", 1, [0, 1, 2, 3, 4]], ["SP", 1, 0, 200704, [16], 1], ["AN", 1, 0, 5], ["AN", 1, 1, 6]]]], "r": [[1.20467e-05, 1.20608e-05, 1.20661e-05], 0, 1.47089, 1667968735], "v": "v0.6"}
{"i": [["[\"hfused_relu\", 1, 14, 14, 16, 64]", "cuda -keys=cuda,gpu -max_num_threads=1024 -model=unknown -thread_warp_size=32", [-1, 16, 64, 49152, 2147483647, 1024, 8, 32], "", 0, []], [[], [["FU", 1, [0, 1, 2, 3, 4]], ["SP", 1, 0, 200704, [4], 1], ["AN", 1, 0, 5], ["AN", 1, 1, 6]]]], "r": [[3.9837e-05, 3.98541e-05, 3.98493e-05], 0, 1.15696, 1667968735], "v": "v0.6"}
{"i": [["[\"hfused_relu\", 1, 14, 14, 16, 64]", "cuda -keys=cuda,gpu -max_num_threads=1024 -model=unknown -thread_warp_size=32", [-1, 16, 64, 49152, 2147483647, 1024, 8, 32], "", 0, []], [[], [["FU", 1, [0, 1, 2, 3, 4]], ["SP", 1, 0, 200704, [2], 1], ["AN", 1, 0, 5], ["AN", 1, 1, 6]]]], "r": [[7.71786e-05, 7.71806e-05, 7.71528e-05], 0, 1.81875, 1667968736], "v": "v0.6"}
{"i": [["[\"hfused_relu\", 1, 14, 14, 16, 64]", "cuda -keys=cuda,gpu -max_num_threads=1024 -model=unknown -thread_warp_size=32", [-1, 16, 64, 49152, 2147483647, 1024, 8, 32], "", 0, []], [[], [["FU", 1, [0, 1, 2, 3, 4]], ["SP", 1, 0, 200704, [1], 1], ["AN", 1, 0, 5], ["AN", 1, 1, 6]]]], "r": [[0.000151421, 0.000151447, 0.00015145], 0, 0.844948, 1667968735], "v": "v0.6"}
{"i": [["[\"hfused_relu\", 1, 14, 14, 16, 64]", "cuda -keys=cuda,gpu -max_num_threads=1024 -model=unknown -thread_warp_size=32", [-1, 16, 64, 49152, 2147483647, 1024, 8, 32], "", 0, []], [[], [["FU", 1, [0, 1, 2, 3, 4]], ["SP", 1, 0, 200704, [56], 1], ["AN", 1, 0, 5], ["AN", 1, 1, 6]]]], "r": [[5.24032e-06, 5.24639e-06, 5.24059e-06], 0, 2.4286, 1667968736], "v": "v0.6"}
{"i": [["[\"hfused_relu\", 1, 14, 14, 16, 64]", "cuda -keys=cuda,gpu -max_num_threads=1024 -model=unknown -thread_warp_size=32", [-1, 16, 64, 49152, 2147483647, 1024, 8, 32], "", 0, []], [[], [["FU", 1, [0, 1, 2, 3, 4]], ["SP", 1, 0, 200704, [32], 1], ["AN", 1, 0, 5], ["AN", 1, 1, 6]]]], "r": [[7.19437e-06, 7.20345e-06, 7.20816e-06], 0, 2.75153, 1667968737], "v": "v0.6"}
{"i": [["[\"hfused_relu\", 1, 14, 14, 16, 64]", "cuda -keys=cuda,gpu -max_num_threads=1024 -model=unknown -thread_warp_size=32", [-1, 16, 64, 49152, 2147483647, 1024, 8, 32], "", 0, []], [[], [["FU", 1, [0, 1, 2, 3, 4]], ["SP", 1, 0, 200704, [49], 1], ["AN", 1, 0, 5], ["AN", 1, 1, 6]]]], "r": [[5.66704e-06, 5.67606e-06, 5.6767e-06], 0, 3.74169, 1667968738], "v": "v0.6"}
{"i": [["[\"hfused_relu\", 1, 14, 14, 16, 64]", "cuda -keys=cuda,gpu -max_num_threads=1024 -model=unknown -thread_warp_size=32", [-1, 16, 64, 49152, 2147483647, 1024, 8, 32], "", 0, []], [[], [["FU", 1, [0, 1, 2, 3, 4]], ["SP", 1, 0, 200704, [14], 1], ["AN", 1, 0, 5], ["AN", 1, 1, 6]]]], "r": [[1.34539e-05, 1.34695e-05, 1.34757e-05], 0, 3.06687, 1667968737], "v": "v0.6"}
{"i": [["[\"hfused_relu\", 1, 14, 14, 16, 64]", "cuda -keys=cuda,gpu -max_num_threads=1024 -model=unknown -thread_warp_size=32", [-1, 16, 64, 49152, 2147483647, 1024, 8, 32], "", 0, []], [[], [["FU", 1, [0, 1, 2, 3, 4]], ["SP", 1, 0, 200704, [7], 1], ["AN", 1, 0, 5], ["AN", 1, 1, 6]]]], "r": [[2.39675e-05, 2.3975e-05, 2.39746e-05], 0, 3.3931, 1667968737], "v": "v0.6"}
{"i": [["[\"hfused_relu\", 1, 14, 14, 16, 64]", "cuda -keys=cuda,gpu -max_num_threads=1024 -model=unknown -thread_warp_size=32", [-1, 16, 64, 49152, 2147483647, 1024, 8, 32], "", 0, []], [[], [["FU", 1, [0, 1, 2, 3, 4]], ["SP", 1, 0, 200704, [64], 1], ["AN", 1, 0, 5], ["AN", 1, 1, 6]]]], "r": [[4.95364e-06, 4.97023e-06, 4.97223e-06], 0, 4.03671, 1667968738], "v": "v0.6"}
{"i": [["[\"hfused_relu\", 1, 14, 14, 16, 64]", "cuda -keys=cuda,gpu -max_num_threads=1024 -model=unknown -thread_warp_size=32", [-1, 16, 64, 49152, 2147483647, 1024, 8, 32], "", 0, []], [[], [["FU", 1, [0, 1, 2, 3, 4]], ["SP", 1, 0, 200704, [32], 1], ["AN", 1, 0, 5], ["AN", 1, 1, 6]]]], "r": [[7.23555e-06, 7.24851e-06, 7.25053e-06], 0, 0.854713, 1667968777], "v": "v0.6"}
{"i": [["[\"hfused_relu\", 1, 14, 14, 16, 64]", "cuda -keys=cuda,gpu -max_num_threads=1024 -model=unknown -thread_warp_size=32", [-1, 16, 64, 49152, 2147483647, 1024, 8, 32], "", 0, []], [[], [["FU", 1, [0, 1, 2, 3, 4]], ["SP", 1, 0, 200704, [7], 1], ["AN", 1, 0, 5], ["AN", 1, 1, 6]]]], "r": [[2.4098e-05, 2.41432e-05, 2.41491e-05], 0, 1.17088, 1667968778], "v": "v0.6"}
{"i": [["[\"hfused_relu\", 1, 14, 14, 16, 64]", "cuda -keys=cuda,gpu -max_num_threads=1024 -model=unknown -thread_warp_size=32", [-1, 16, 64, 49152, 2147483647, 1024, 8, 32], "", 0, []], [[], [["FU", 1, [0, 1, 2, 3, 4]], ["SP", 1, 0, 200704, [64], 1], ["AN", 1, 0, 5], ["AN", 1, 1, 6]]]], "r": [[4.87264e-06, 4.88445e-06, 4.88616e-06], 0, 0.519535, 1667968777], "v": "v0.6"}
{"i": [["[\"hfused_relu\", 1, 14, 14, 16, 64]", "cuda -keys=cuda,gpu -max_num_threads=1024 -model=unknown -thread_warp_size=32", [-1, 16, 64, 49152, 2147483647, 1024, 8, 32], "", 0, []], [[], [["FU", 1, [0, 1, 2, 3, 4]], ["SP", 1, 0, 200704, [1], 1], ["AN", 1, 0, 5], ["AN", 1, 1, 6]]]], "r": [[0.000151517, 0.000151522, 0.000151534], 0, 2.1485, 1667968779], "v": "v0.6"}
{"i": [["[\"hfused_relu\", 1, 14, 14, 16, 64]", "cuda -keys=cuda,gpu -max_num_threads=1024 -model=unknown -thread_warp_size=32", [-1, 16, 64, 49152, 2147483647, 1024, 8, 32], "", 0, []], [[], [["FU", 1, [0, 1, 2, 3, 4]], ["SP", 1, 0, 200704, [14], 1], ["AN", 1, 0, 5], ["AN", 1, 1, 6]]]], "r": [[1.34386e-05, 1.3468e-05, 1.3459e-05], 0, 1.48433, 1667968778], "v": "v0.6"}
{"i": [["[\"hfused_relu\", 1, 14, 14, 16, 64]", "cuda -keys=cuda,gpu -max_num_threads=1024 -model=unknown -thread_warp_size=32", [-1, 16, 64, 49152, 2147483647, 1024, 8, 32], "", 0, []], [[], [["FU", 1, [0, 1, 2, 3, 4]], ["SP", 1, 0, 200704, [2], 1], ["AN", 1, 0, 5], ["AN", 1, 1, 6]]]], "r": [[7.70625e-05, 7.70565e-05, 7.70661e-05], 0, 2.81627, 1667968779], "v": "v0.6"}
{"i": [["[\"hfused_relu\", 1, 14, 14, 16, 64]", "cuda -keys=cuda,gpu -max_num_threads=1024 -model=unknown -thread_warp_size=32", [-1, 16, 64, 49152, 2147483647, 1024, 8, 32], "", 0, []], [[], [["FU", 1, [0, 1, 2, 3, 4]], ["SP", 1, 0, 200704, [16], 1], ["AN", 1, 0, 5], ["AN", 1, 1, 6]]]], "r": [[1.20168e-05, 1.20246e-05, 1.2033e-05], 0, 1.84132, 1667968778], "v": "v0.6"}
{"i": [["[\"hfused_relu\", 1, 14, 14, 16, 64]", "cuda -keys=cuda,gpu -max_num_threads=1024 -model=unknown -thread_warp_size=32", [-1, 16, 64, 49152, 2147483647, 1024, 8, 32], "", 0, []], [[], [["FU", 1, [0, 1, 2, 3, 4]], ["SP", 1, 0, 200704, [56], 1], ["AN", 1, 0, 5], ["AN", 1, 1, 6]]]], "r": [[5.18478e-06, 5.19698e-06, 5.20041e-06], 0, 2.44352, 1667968779], "v": "v0.6"}
{"i": [["[\"hfused_relu\", 1, 14, 14, 16, 64]", "cuda -keys=cuda,gpu -max_num_threads=1024 -model=unknown -thread_warp_size=32", [-1, 16, 64, 49152, 2147483647, 1024, 8, 32], "", 0, []], [[], [["FU", 1, [0, 1, 2, 3, 4]], ["SP", 1, 0, 200704, [8], 1], ["AN", 1, 0, 5], ["AN", 1, 1, 6]]]], "r": [[2.13125e-05, 2.13359e-05, 2.13367e-05], 0, 3.11417, 1667968780], "v": "v0.6"}
{"i": [["[\"hfused_relu\", 1, 14, 14, 16, 64]", "cuda -keys=cuda,gpu -max_num_threads=1024 -model=unknown -thread_warp_size=32", [-1, 16, 64, 49152, 2147483647, 1024, 8, 32], "", 0, []], [[], [["FU", 1, [0, 1, 2, 3, 4]], ["SP", 1, 0, 200704, [49], 1], ["AN", 1, 0, 5], ["AN", 1, 1, 6]]]], "r": [[5.65128e-06, 5.66259e-06, 5.661e-06], 0, 3.4072, 1667968780], "v": "v0.6"}
{"i": [["[\"hfused_relu\", 1, 14, 14, 16, 64]", "cuda -keys=cuda,gpu -max_num_threads=1024 -model=unknown -thread_warp_size=32", [-1, 16, 64, 49152, 2147483647, 1024, 8, 32], "", 0, []], [[], [["FU", 1, [0, 1, 2, 3, 4]], ["SP", 1, 0, 200704, [4], 1], ["AN", 1, 0, 5], ["AN", 1, 1, 6]]]], "r": [[4.00276e-05, 4.00426e-05, 4.00468e-05], 0, 3.7574, 1667968780], "v": "v0.6"}
{"i": [["[\"hfused_relu\", 1, 14, 14, 16, 64]", "cuda -keys=cuda,gpu -max_num_threads=1024 -model=unknown -thread_warp_size=32", [-1, 16, 64, 49152, 2147483647, 1024, 8, 32], "", 0, []], [[], [["FU", 1, [0, 1, 2, 3, 4]], ["SP", 1, 0, 200704, [28], 1], ["AN", 1, 0, 5], ["AN", 1, 1, 6]]]], "r": [[7.89141e-06, 7.90439e-06, 7.90723e-06], 0, 4.06731, 1667968781], "v": "v0.6"}
{"i": [["[\"hfused_relu\", 1, 14, 14, 16, 64]", "cuda -keys=cuda,gpu -max_num_threads=1024 -model=unknown -thread_warp_size=32", [-1, 16, 64, 49152, 2147483647, 1024, 8, 32], "", 0, []], [[], [["FU", 1, [0, 1, 2, 3, 4]], ["SP", 1, 0, 200704, [16], 1], ["AN", 1, 0, 5], ["AN", 1, 1, 6]]]], "r": [[1.20913e-05, 1.21006e-05, 1.21058e-05], 0, 0.88493, 1667968842], "v": "v0.6"}
{"i": [["[\"hfused_relu\", 1, 14, 14, 16, 64]", "cuda -keys=cuda,gpu -max_num_threads=1024 -model=unknown -thread_warp_size=32", [-1, 16, 64, 49152, 2147483647, 1024, 8, 32], "", 0, []], [[], [["FU", 1, [0, 1, 2, 3, 4]], ["SP", 1, 0, 200704, [4], 1], ["AN", 1, 0, 5], ["AN", 1, 1, 6]]]], "r": [[3.98511e-05, 3.98553e-05, 3.98584e-05], 0, 2.16549, 1667968843], "v": "v0.6"}
{"i": [["[\"hfused_relu\", 1, 14, 14, 16, 64]", "cuda -keys=cuda,gpu -max_num_threads=1024 -model=unknown -thread_warp_size=32", [-1, 16, 64, 49152, 2147483647, 1024, 8, 32], "", 0, []], [[], [["FU", 1, [0, 1, 2, 3, 4]], ["SP", 1, 0, 200704, [7], 1], ["AN", 1, 0, 5], ["AN", 1, 1, 6]]]], "r": [[2.40538e-05, 2.40627e-05, 2.40653e-05], 0, 1.86476, 1667968843], "v": "v0.6"}
{"i": [["[\"hfused_relu\", 1, 14, 14, 16, 64]", "cuda -keys=cuda,gpu -max_num_threads=1024 -model=unknown -thread_warp_size=32", [-1, 16, 64, 49152, 2147483647, 1024, 8, 32], "", 0, []], [[], [["FU", 1, [0, 1, 2, 3, 4]], ["SP", 1, 0, 200704, [8], 1], ["AN", 1, 0, 5], ["AN", 1, 1, 6]]]], "r": [[2.1264e-05, 2.1278e-05, 2.12758e-05], 0, 0.534818, 1667968842], "v": "v0.6"}
{"i": [["[\"hfused_relu\", 1, 14, 14, 16, 64]", "cuda -keys=cuda,gpu -max_num_threads=1024 -model=unknown -thread_warp_size=32", [-1, 16, 64, 49152, 2147483647, 1024, 8, 32], "", 0, []], [[], [["FU", 1, [0, 1, 2, 3, 4]], ["SP", 1, 0, 200704, [2], 1], ["AN", 1, 0, 5], ["AN", 1, 1, 6]]]], "r": [[7.70767e-05, 7.70895e-05, 7.71138e-05], 0, 1.2052, 1667968842], "v": "v0.6"}
{"i": [["[\"hfused_relu\", 1, 14, 14, 16, 64]", "cuda -keys=cuda,gpu -max_num_threads=1024 -model=unknown -thread_warp_size=32", [-1, 16, 64, 49152, 2147483647, 1024, 8, 32], "", 0, []], [[], [["FU", 1, [0, 1, 2, 3, 4]], ["SP", 1, 0, 200704, [56], 1], ["AN", 1, 0, 5], ["AN", 1, 1, 6]]]], "r": [[5.1845e-06, 5.19421e-06, 5.19525e-06], 0, 1.50634, 1667968843], "v": "v0.6"}
{"i": [["[\"hfused_relu\", 1, 14, 14, 16, 64]", "cuda -keys=cuda,gpu -max_num_threads=1024 -model=unknown -thread_warp_size=32", [-1, 16, 64, 49152, 2147483647, 1024, 8, 32], "", 0, []], [[], [["FU", 1, [0, 1, 2, 3, 4]], ["SP", 1, 0, 200704, [49], 1], ["AN", 1, 0, 5], ["AN", 1, 1, 6]]]], "r": [[5.61866e-06, 5.64301e-06, 5.64045e-06], 0, 2.82369, 1667968844], "v": "v0.6"}
{"i": [["[\"hfused_relu\", 1, 14, 14, 16, 64]", "cuda -keys=cuda,gpu -max_num_threads=1024 -model=unknown -thread_warp_size=32", [-1, 16, 64, 49152, 2147483647, 1024, 8, 32], "", 0, []], [[], [["FU", 1, [0, 1, 2, 3, 4]], ["SP", 1, 0, 200704, [64], 1], ["AN", 1, 0, 5], ["AN", 1, 1, 6]]]], "r": [[5.03012e-06, 5.03356e-06, 5.03855e-06], 0, 2.48232, 1667968844], "v": "v0.6"}
{"i": [["[\"hfused_relu\", 1, 14, 14, 16, 64]", "cuda -keys=cuda,gpu -max_num_threads=1024 -model=unknown -thread_warp_size=32", [-1, 16, 64, 49152, 2147483647, 1024, 8, 32], "", 0, []], [[], [["FU", 1, [0, 1, 2, 3, 4]], ["SP", 1, 0, 200704, [32], 1], ["AN", 1, 0, 5], ["AN", 1, 1, 6]]]], "r": [[7.40958e-06, 7.4124e-06, 7.42018e-06], 0, 3.1403, 1667968844], "v": "v0.6"}
{"i": [["[\"hfused_relu\", 1, 14, 14, 16, 64]", "cuda -keys=cuda,gpu -max_num_threads=1024 -model=unknown -thread_warp_size=32", [-1, 16, 64, 49152, 2147483647, 1024, 8, 32], "", 0, []], [[], [["FU", 1, [0, 1, 2, 3, 4]], ["SP", 1, 0, 200704, [1], 1], ["AN", 1, 0, 5], ["AN", 1, 1, 6]]]], "r": [[0.000151422, 0.000151446, 0.000151414], 0, 3.44517, 1667968845], "v": "v0.6"}
{"i": [["[\"hfused_relu\", 1, 14, 14, 16, 64]", "cuda -keys=cuda,gpu -max_num_threads=1024 -model=unknown -thread_warp_size=32", [-1, 16, 64, 49152, 2147483647, 1024, 8, 32], "", 0, []], [[], [["FU", 1, [0, 1, 2, 3, 4]], ["SP", 1, 0, 200704, [28], 1], ["AN", 1, 0, 5], ["AN", 1, 1, 6]]]], "r": [[7.94211e-06, 7.95924e-06, 7.9629e-06], 0, 4.10846, 1667968845], "v": "v0.6"}
{"i": [["[\"hfused_relu\", 1, 14, 14, 16, 64]", "cuda -keys=cuda,gpu -max_num_threads=1024 -model=unknown -thread_warp_size=32", [-1, 16, 64, 49152, 2147483647, 1024, 8, 32], "", 0, []], [[], [["FU", 1, [0, 1, 2, 3, 4]], ["SP", 1, 0, 200704, [14], 1], ["AN", 1, 0, 5], ["AN", 1, 1, 6]]]], "r": [[1.33711e-05, 1.33965e-05, 1.3395e-05], 0, 3.79115, 1667968845], "v": "v0.6"}
{"i": [["[\"hfused_relu\", 1, 14, 14, 16, 64]", "cuda -keys=cuda,gpu -max_num_threads=1024 -model=unknown -thread_warp_size=32", [-1, 16, 64, 49152, 2147483647, 1024, 8, 32], "", 0, []], [[], [["FU", 1, [0, 1, 2, 3, 4]], ["SP", 1, 0, 200704, [32], 1], ["AN", 1, 0, 5], ["AN", 1, 1, 6]]]], "r": [[7.23492e-06, 7.25315e-06, 7.25631e-06], 0, 1.1716, 1667968885], "v": "v0.6"}
{"i": [["[\"hfused_relu\", 1, 14, 14, 16, 64]", "cuda -keys=cuda,gpu -max_num_threads=1024 -model=unknown -thread_warp_size=32", [-1, 16, 64, 49152, 2147483647, 1024, 8, 32], "", 0, []], [[], [["FU", 1, [0, 1, 2, 3, 4]], ["SP", 1, 0, 200704, [8], 1], ["AN", 1, 0, 5], ["AN", 1, 1, 6]]]], "r": [[2.13745e-05, 2.13773e-05, 2.13815e-05], 0, 1.49411, 1667968886], "v": "v0.6"}
{"i": [["[\"hfused_relu\", 1, 14, 14, 16, 64]", "cuda -keys=cuda,gpu -max_num_threads=1024 -model=unknown -thread_warp_size=32", [-1, 16, 64, 49152, 2147483647, 1024, 8, 32], "", 0, []], [[], [["FU", 1, [0, 1, 2, 3, 4]], ["SP", 1, 0, 200704, [4], 1], ["AN", 1, 0, 5], ["AN", 1, 1, 6]]]], "r": [[3.9783e-05, 3.97972e-05, 3.98038e-05], 0, 0.533055, 1667968885], "v": "v0.6"}
