python/models/resnext/ResNextHorizontal_kernel_configs/resnext_imagenet_50_hfused_batch_norm_1_14_14_32_64.log
{"i": [["[\"hfused_batch_norm\", 1, 14, 14, 32, 64]", "cuda -keys=cuda,gpu -max_num_threads=1024 -model=unknown -thread_warp_size=32", [-1, 16, 64, 49152, 2147483647, 1024, 8, 32], "", 0, []], [[], [["CI", 2], ["FU", 4, [0, 1, 2, 3, 4]], ["SP", 4, 0, 401408, [56], 1], ["AN", 4, 0, 5], ["AN", 4, 1, 6]]]], "r": [[8.02356e-06, 8.03324e-06, 8.02591e-06], 0, 0.560388, 1667897497], "v": "v0.6"}
{"i": [["[\"hfused_batch_norm\", 1, 14, 14, 32, 64]", "cuda -keys=cuda,gpu -max_num_threads=1024 -model=unknown -thread_warp_size=32", [-1, 16, 64, 49152, 2147483647, 1024, 8, 32], "", 0, []], [[], [["CI", 2], ["FU", 4, [0, 1, 2, 3, 4]], ["SP", 4, 0, 401408, [64], 1], ["AN", 4, 0, 5], ["AN", 4, 1, 6]]]], "r": [[7.32254e-06, 7.32238e-06, 7.3161e-06], 0, 0.904348, 1667897497], "v": "v0.6"}
{"i": [["[\"hfused_batch_norm\", 1, 14, 14, 32, 64]", "cuda -keys=cuda,gpu -max_num_threads=1024 -model=unknown -thread_warp_size=32", [-1, 16, 64, 49152, 2147483647, 1024, 8, 32], "", 0, []], [[], [["CI", 2], ["FU", 4, [0, 1, 2, 3, 4]], ["SP", 4, 0, 401408, [32], 1], ["AN", 4, 0, 5], ["AN", 4, 1, 6]]]], "r": [[1.20289e-05, 1.20222e-05, 1.20235e-05], 0, 2.68648, 1667897499], "v": "v0.6"}
{"i": [["[\"hfused_batch_norm\", 1, 14, 14, 32, 64]", "cuda -keys=cuda,gpu -max_num_threads=1024 -model=unknown -thread_warp_size=32", [-1, 16, 64, 49152, 2147483647, 1024, 8, 32], "", 0, []], [[], [["CI", 2], ["FU", 4, [0, 1, 2, 3, 4]], ["SP", 4, 0, 401408, [4], 1], ["AN", 4, 0, 5], ["AN", 4, 1, 6]]]], "r": [[7.70605e-05, 7.70643e-05, 7.70581e-05], 0, 1.3002, 1667897498], "v": "v0.6"}
{"i": [["[\"hfused_batch_norm\", 1, 14, 14, 32, 64]", "cuda -keys=cuda,gpu -max_num_threads=1024 -model=unknown -thread_warp_size=32", [-1, 16, 64, 49152, 2147483647, 1024, 8, 32], "", 0, []], [[], [["CI", 2], ["FU", 4, [0, 1, 2, 3, 4]], ["SP", 4, 0, 401408, [28], 1], ["AN", 4, 0, 5], ["AN", 4, 1, 6]]]], "r": [[1.35418e-05, 1.35452e-05, 1.35365e-05], 0, 2.34246, 1667897499], "v": "v0.6"}
{"i": [["[\"hfused_batch_norm\", 1, 14, 14, 32, 64]", "cuda -keys=cuda,gpu -max_num_threads=1024 -model=unknown -thread_warp_size=32", [-1, 16, 64, 49152, 2147483647, 1024, 8, 32], "", 0, []], [[], [["CI", 2], ["FU", 4, [0, 1, 2, 3, 4]], ["SP", 4, 0, 401408, [1], 1], ["AN", 4, 0, 5], ["AN", 4, 1, 6]]]], "r": [[0.000300425, 0.000300445, 0.000300416], 0, 1.94849, 1667897498], "v": "v0.6"}
{"i": [["[\"hfused_batch_norm\", 1, 14, 14, 32, 64]", "cuda -keys=cuda,gpu -max_num_threads=1024 -model=unknown -thread_warp_size=32", [-1, 16, 64, 49152, 2147483647, 1024, 8, 32], "", 0, []], [[], [["CI", 2], ["FU", 4, [0, 1, 2, 3, 4]], ["SP", 4, 0, 401408, [16], 1], ["AN", 4, 0, 5], ["AN", 4, 1, 6]]]], "r": [[2.13297e-05, 2.13502e-05, 2.13335e-05], 0, 2.99986, 1667897500], "v": "v0.6"}
{"i": [["[\"hfused_batch_norm\", 1, 14, 14, 32, 64]", "cuda -keys=cuda,gpu -max_num_threads=1024 -model=unknown -thread_warp_size=32", [-1, 16, 64, 49152, 2147483647, 1024, 8, 32], "", 0, []], [[], [["CI", 2], ["FU", 4, [0, 1, 2, 3, 4]], ["SP", 4, 0, 401408, [2], 1], ["AN", 4, 0, 5], ["AN", 4, 1, 6]]]], "r": [[0.000151522, 0.000151553, 0.000151557], 0, 1.62003, 1667897498], "v": "v0.6"}
{"i": [["[\"hfused_batch_norm\", 1, 14, 14, 32, 64]", "cuda -keys=cuda,gpu -max_num_threads=1024 -model=unknown -thread_warp_size=32", [-1, 16, 64, 49152, 2147483647, 1024, 8, 32], "", 0, []], [[], [["CI", 2], ["FU", 4, [0, 1, 2, 3, 4]], ["SP", 4, 0, 401408, [8], 1], ["AN", 4, 0, 5], ["AN", 4, 1, 6]]]], "r": [[3.98526e-05, 3.98555e-05, 3.98588e-05], 0, 3.73547, 1667897500], "v": "v0.6"}
{"i": [["[\"hfused_batch_norm\", 1, 14, 14, 32, 64]", "cuda -keys=cuda,gpu -max_num_threads=1024 -model=unknown -thread_warp_size=32", [-1, 16, 64, 49152, 2147483647, 1024, 8, 32], "", 0, []], [[], [["CI", 2], ["FU", 4, [0, 1, 2, 3, 4]], ["SP", 4, 0, 401408, [49], 1], ["AN", 4, 0, 5], ["AN", 4, 1, 6]]]], "r": [[8.73123e-06, 8.72135e-06, 8.71902e-06], 0, 4.04655, 1667897501], "v": "v0.6"}
{"i": [["[\"hfused_batch_norm\", 1, 14, 14, 32, 64]", "cuda -keys=cuda,gpu -max_num_threads=1024 -model=unknown -thread_warp_size=32", [-1, 16, 64, 49152, 2147483647, 1024, 8, 32], "", 0, []], [[], [["CI", 2], ["FU", 4, [0, 1, 2, 3, 4]], ["SP", 4, 0, 401408, [7], 1], ["AN", 4, 0, 5], ["AN", 4, 1, 6]]]], "r": [[4.52748e-05, 4.52669e-05, 4.52573e-05], 0, 3.391, 1667897500], "v": "v0.6"}
{"i": [["[\"hfused_batch_norm\", 1, 14, 14, 32, 64]", "cuda -keys=cuda,gpu -max_num_threads=1024 -model=unknown -thread_warp_size=32", [-1, 16, 64, 49152, 2147483647, 1024, 8, 32], "", 0, []], [[], [["CI", 2], ["FU", 4, [0, 1, 2, 3, 4]], ["SP", 4, 0, 401408, [14], 1], ["AN", 4, 0, 5], ["AN", 4, 1, 6]]]], "r": [[2.42495e-05, 2.42638e-05, 2.42611e-05], 0, 4.43791, 1667897501], "v": "v0.6"}
{"i": [["[\"hfused_batch_norm\", 1, 14, 14, 32, 64]", "cuda -keys=cuda,gpu -max_num_threads=1024 -model=unknown -thread_warp_size=32", [-1, 16, 64, 49152, 2147483647, 1024, 8, 32], "", 0, []], [[], [["CI", 2], ["FU", 4, [0, 1, 2, 3, 4]], ["SP", 4, 0, 401408, [2], 1], ["AN", 4, 0, 5], ["AN", 4, 1, 6]]]], "r": [[0.000151642, 0.000151637, 0.000151643], 0, 1.96814, 1667971374], "v": "v0.6"}
{"i": [["[\"hfused_batch_norm\", 1, 14, 14, 32, 64]", "cuda -keys=cuda,gpu -max_num_threads=1024 -model=unknown -thread_warp_size=32", [-1, 16, 64, 49152, 2147483647, 1024, 8, 32], "", 0, []], [[], [["CI", 2], ["FU", 4, [0, 1, 2, 3, 4]], ["SP", 4, 0, 401408, [64], 1], ["AN", 4, 0, 5], ["AN", 4, 1, 6]]]], "r": [[7.38686e-06, 7.38602e-06, 7.38191e-06], 0, 2.68831, 1667971375], "v": "v0.6"}
{"i": [["[\"hfused_batch_norm\", 1, 14, 14, 32, 64]", "cuda -keys=cuda,gpu -max_num_threads=1024 -model=unknown -thread_warp_size=32", [-1, 16, 64, 49152, 2147483647, 1024, 8, 32], "", 0, []], [[], [["CI", 2], ["FU", 4, [0, 1, 2, 3, 4]], ["SP", 4, 0, 401408, [56], 1], ["AN", 4, 0, 5], ["AN", 4, 1, 6]]]], "r": [[7.99319e-06, 7.99558e-06, 7.98871e-06], 0, 0.920026, 1667971373], "v": "v0.6"}
{"i": [["[\"hfused_batch_norm\", 1, 14, 14, 32, 64]", "cuda -keys=cuda,gpu -max_num_threads=1024 -model=unknown -thread_warp_size=32", [-1, 16, 64, 49152, 2147483647, 1024, 8, 32], "", 0, []], [[], [["CI", 2], ["FU", 4, [0, 1, 2, 3, 4]], ["SP", 4, 0, 401408, [1], 1], ["AN", 4, 0, 5], ["AN", 4, 1, 6]]]], "r": [[0.000300349, 0.00030036, 0.000300378], 0, 1.61439, 1667971374], "v": "v0.6"}
{"i": [["[\"hfused_batch_norm\", 1, 14, 14, 32, 64]", "cuda -keys=cuda,gpu -max_num_threads=1024 -model=unknown -thread_warp_size=32", [-1, 16, 64, 49152, 2147483647, 1024, 8, 32], "", 0, []], [[], [["CI", 2], ["FU", 4, [0, 1, 2, 3, 4]], ["SP", 4, 0, 401408, [32], 1], ["AN", 4, 0, 5], ["AN", 4, 1, 6]]]], "r": [[1.2022e-05, 1.20204e-05, 1.20174e-05], 0, 0.572738, 1667971373], "v": "v0.6"}
{"i": [["[\"hfused_batch_norm\", 1, 14, 14, 32, 64]", "cuda -keys=cuda,gpu -max_num_threads=1024 -model=unknown -thread_warp_size=32", [-1, 16, 64, 49152, 2147483647, 1024, 8, 32], "", 0, []], [[], [["CI", 2], ["FU", 4, [0, 1, 2, 3, 4]], ["SP", 4, 0, 401408, [4], 1], ["AN", 4, 0, 5], ["AN", 4, 1, 6]]]], "r": [[7.7045e-05, 7.70331e-05, 7.70667e-05], 0, 1.27072, 1667971374], "v": "v0.6"}
{"i": [["[\"hfused_batch_norm\", 1, 14, 14, 32, 64]", "cuda -keys=cuda,gpu -max_num_threads=1024 -model=unknown -thread_warp_size=32", [-1, 16, 64, 49152, 2147483647, 1024, 8, 32], "", 0, []], [[], [["CI", 2], ["FU", 4, [0, 1, 2, 3, 4]], ["SP", 4, 0, 401408, [28], 1], ["AN", 4, 0, 5], ["AN", 4, 1, 6]]]], "r": [[1.34511e-05, 1.34444e-05, 1.34482e-05], 0, 4.13397, 1667971377], "v": "v0.6"}
{"i": [["[\"hfused_batch_norm\", 1, 14, 14, 32, 64]", "cuda -keys=cuda,gpu -max_num_threads=1024 -model=unknown -thread_warp_size=32", [-1, 16, 64, 49152, 2147483647, 1024, 8, 32], "", 0, []], [[], [["CI", 2], ["FU", 4, [0, 1, 2, 3, 4]], ["SP", 4, 0, 401408, [14], 1], ["AN", 4, 0, 5], ["AN", 4, 1, 6]]]], "r": [[2.42669e-05, 2.42686e-05, 2.42572e-05], 0, 2.33989, 1667971375], "v": "v0.6"}
{"i": [["[\"hfused_batch_norm\", 1, 14, 14, 32, 64]", "cuda -keys=cuda,gpu -max_num_threads=1024 -model=unknown -thread_warp_size=32", [-1, 16, 64, 49152, 2147483647, 1024, 8, 32], "", 0, []], [[], [["CI", 2], ["FU", 4, [0, 1, 2, 3, 4]], ["SP", 4, 0, 401408, [8], 1], ["AN", 4, 0, 5], ["AN", 4, 1, 6]]]], "r": [[3.98572e-05, 3.98462e-05, 3.98503e-05], 0, 3.04013, 1667971376], "v": "v0.6"}
{"i": [["[\"hfused_batch_norm\", 1, 14, 14, 32, 64]", "cuda -keys=cuda,gpu -max_num_threads=1024 -model=unknown -thread_warp_size=32", [-1, 16, 64, 49152, 2147483647, 1024, 8, 32], "", 0, []], [[], [["CI", 2], ["FU", 4, [0, 1, 2, 3, 4]], ["SP", 4, 0, 401408, [16], 1], ["AN", 4, 0, 5], ["AN", 4, 1, 6]]]], "r": [[2.13778e-05, 2.13811e-05, 2.13765e-05], 0, 3.791, 1667971376], "v": "v0.6"}
{"i": [["[\"hfused_batch_norm\", 1, 14, 14, 32, 64]", "cuda -keys=cuda,gpu -max_num_threads=1024 -model=unknown -thread_warp_size=32", [-1, 16, 64, 49152, 2147483647, 1024, 8, 32], "", 0, []], [[], [["CI", 2], ["FU", 4, [0, 1, 2, 3, 4]], ["SP", 4, 0, 401408, [7], 1], ["AN", 4, 0, 5], ["AN", 4, 1, 6]]]], "r": [[4.53892e-05, 4.53728e-05, 4.53828e-05], 0, 3.43178, 1667971376], "v": "v0.6"}
{"i": [["[\"hfused_batch_norm\", 1, 14, 14, 32, 64]", "cuda -keys=cuda,gpu -max_num_threads=1024 -model=unknown -thread_warp_size=32", [-1, 16, 64, 49152, 2147483647, 1024, 8, 32], "", 0, []], [[], [["CI", 2], ["FU", 4, [0, 1, 2, 3, 4]], ["SP", 4, 0, 401408, [49], 1], ["AN", 4, 0, 5], ["AN", 4, 1, 6]]]], "r": [[8.75698e-06, 8.75804e-06, 8.75543e-06], 0, 4.53298, 1667971377], "v": "v0.6"}
{"i": [["[\"hfused_batch_norm\", 1, 14, 14, 32, 64]", "cuda -keys=cuda,gpu -max_num_threads=1024 -model=unknown -thread_warp_size=32", [-1, 16, 64, 49152, 2147483647, 1024, 8, 32], "", 0, []], [[], [["CI", 2], ["FU", 4, [0, 1, 2, 3, 4]], ["SP", 4, 0, 401408, [32], 1], ["AN", 4, 0, 5], ["AN", 4, 1, 6]]]], "r": [[1.22202e-05, 1.22227e-05, 1.22323e-05], 0, 0.877035, 1667972279], "v": "v0.6"}
{"i": [["[\"hfused_batch_norm\", 1, 14, 14, 32, 64]", "cuda -keys=cuda,gpu -max_num_threads=1024 -model=unknown -thread_warp_size=32", [-1, 16, 64, 49152, 2147483647, 1024, 8, 32], "", 0, []], [[], [["CI", 2], ["FU", 4, [0, 1, 2, 3, 4]], ["SP", 4, 0, 401408, [14], 1], ["AN", 4, 0, 5], ["AN", 4, 1, 6]]]], "r": [[2.42376e-05, 2.42423e-05, 2.42442e-05], 0, 1.85911, 1667972280], "v": "v0.6"}
{"i": [["[\"hfused_batch_norm\", 1, 14, 14, 32, 64]", "cuda -keys=cuda,gpu -max_num_threads=1024 -model=unknown -thread_warp_size=32", [-1, 16, 64, 49152, 2147483647, 1024, 8, 32], "", 0, []], [[], [["CI", 2], ["FU", 4, [0, 1, 2, 3, 4]], ["SP", 4, 0, 401408, [7], 1], ["AN", 4, 0, 5], ["AN", 4, 1, 6]]]], "r": [[4.53191e-05, 4.53085e-05, 4.53301e-05], 0, 1.23082, 1667972280], "v": "v0.6"}
{"i": [["[\"hfused_batch_norm\", 1, 14, 14, 32, 64]", "cuda -keys=cuda,gpu -max_num_threads=1024 -model=unknown -thread_warp_size=32", [-1, 16, 64, 49152, 2147483647, 1024, 8, 32], "", 0, []], [[], [["CI", 2], ["FU", 4, [0, 1, 2, 3, 4]], ["SP", 4, 0, 401408, [16], 1], ["AN", 4, 0, 5], ["AN", 4, 1, 6]]]], "r": [[2.14102e-05, 2.14114e-05, 2.14203e-05], 0, 1.53219, 1667972280], "v": "v0.6"}
{"i": [["[\"hfused_batch_norm\", 1, 14, 14, 32, 64]", "cuda -keys=cuda,gpu -max_num_threads=1024 -model=unknown -thread_warp_size=32", [-1, 16, 64, 49152, 2147483647, 1024, 8, 32], "", 0, []], [[], [["CI", 2], ["FU", 4, [0, 1, 2, 3, 4]], ["SP", 4, 0, 401408, [8], 1], ["AN", 4, 0, 5], ["AN", 4, 1, 6]]]], "r": [[3.98838e-05, 3.98809e-05, 3.98956e-05], 0, 0.550955, 1667972279], "v": "v0.6"}
{"i": [["[\"hfused_batch_norm\", 1, 14, 14, 32, 64]", "cuda -keys=cuda,gpu -max_num_threads=1024 -model=unknown -thread_warp_size=32", [-1, 16, 64, 49152, 2147483647, 1024, 8, 32], "", 0, []], [[], [["CI", 2], ["FU", 4, [0, 1, 2, 3, 4]], ["SP", 4, 0, 401408, [64], 1], ["AN", 4, 0, 5], ["AN", 4, 1, 6]]]], "r": [[7.27139e-06, 7.27544e-06, 7.27497e-06], 0, 2.51971, 1667972281], "v": "v0.6"}
{"i": [["[\"hfused_batch_norm\", 1, 14, 14, 32, 64]", "cuda -keys=cuda,gpu -max_num_threads=1024 -model=unknown -thread_warp_size=32", [-1, 16, 64, 49152, 2147483647, 1024, 8, 32], "", 0, []], [[], [["CI", 2], ["FU", 4, [0, 1, 2, 3, 4]], ["SP", 4, 0, 401408, [2], 1], ["AN", 4, 0, 5], ["AN", 4, 1, 6]]]], "r": [[0.000151533, 0.000151531, 0.000151562], 0, 2.20242, 1667972281], "v": "v0.6"}
{"i": [["[\"hfused_batch_norm\", 1, 14, 14, 32, 64]", "cuda -keys=cuda,gpu -max_num_threads=1024 -model=unknown -thread_warp_size=32", [-1, 16, 64, 49152, 2147483647, 1024, 8, 32], "", 0, []], [[], [["CI", 2], ["FU", 4, [0, 1, 2, 3, 4]], ["SP", 4, 0, 401408, [49], 1], ["AN", 4, 0, 5], ["AN", 4, 1, 6]]]], "r": [[8.68924e-06, 8.68597e-06, 8.67876e-06], 0, 3.20901, 1667972282], "v": "v0.6"}
{"i": [["[\"hfused_batch_norm\", 1, 14, 14, 32, 64]", "cuda -keys=cuda,gpu -max_num_threads=1024 -model=unknown -thread_warp_size=32", [-1, 16, 64, 49152, 2147483647, 1024, 8, 32], "", 0, []], [[], [["CI", 2], ["FU", 4, [0, 1, 2, 3, 4]], ["SP", 4, 0, 401408, [28], 1], ["AN", 4, 0, 5], ["AN", 4, 1, 6]]]], "r": [[1.36163e-05, 1.36148e-05, 1.36155e-05], 0, 2.83399, 1667972281], "v": "v0.6"}
{"i": [["[\"hfused_batch_norm\", 1, 14, 14, 32, 64]", "cuda -keys=cuda,gpu -max_num_threads=1024 -model=unknown -thread_warp_size=32", [-1, 16, 64, 49152, 2147483647, 1024, 8, 32], "", 0, []], [[], [["CI", 2], ["FU", 4, [0, 1, 2, 3, 4]], ["SP", 4, 0, 401408, [1], 1], ["AN", 4, 0, 5], ["AN", 4, 1, 6]]]], "r": [[0.000300386, 0.000300357, 0.000300385], 0, 4.17165, 1667972283], "v": "v0.6"}
{"i": [["[\"hfused_batch_norm\", 1, 14, 14, 32, 64]", "cuda -keys=cuda,gpu -max_num_threads=1024 -model=unknown -thread_warp_size=32", [-1, 16, 64, 49152, 2147483647, 1024, 8, 32], "", 0, []], [[], [["CI", 2], ["FU", 4, [0, 1, 2, 3, 4]], ["SP", 4, 0, 401408, [56], 1], ["AN", 4, 0, 5], ["AN", 4, 1, 6]]]], "r": [[8.10492e-06, 8.10436e-06, 8.1043e-06], 0, 3.50555, 1667972282], "v": "v0.6"}
{"i": [["[\"hfused_batch_norm\", 1, 14, 14, 32, 64]", "cuda -keys=cuda,gpu -max_num_threads=1024 -model=unknown -thread_warp_size=32", [-1, 16, 64, 49152, 2147483647, 1024, 8, 32], "", 0, []], [[], [["CI", 2], ["FU", 4, [0, 1, 2, 3, 4]], ["SP", 4, 0, 401408, [4], 1], ["AN", 4, 0, 5], ["AN", 4, 1, 6]]]], "r": [[7.71056e-05, 7.71022e-05, 7.70791e-05], 0, 3.80613, 1667972282], "v": "v0.6"}
