python/models/resnext/ResNextHorizontal_kernel_configs/resnext_imagenet_50_hfused_relu_1_28_28_16_64.log
{"i": [["[\"hfused_relu\", 1, 28, 28, 16, 64]", "cuda -keys=cuda,gpu -max_num_threads=1024 -model=unknown -thread_warp_size=32", [-1, 16, 64, 49152, 2147483647, 1024, 8, 32], "", 0, []], [[], [["FU", 1, [0, 1, 2, 3, 4]], ["SP", 1, 0, 802816, [7], 1], ["AN", 1, 0, 5], ["AN", 1, 1, 6]]]], "r": [[8.78954e-05, 8.79074e-05, 8.79386e-05], 0, 0.542733, 1667897089], "v": "v0.6"}
{"i": [["[\"hfused_relu\", 1, 28, 28, 16, 64]", "cuda -keys=cuda,gpu -max_num_threads=1024 -model=unknown -thread_warp_size=32", [-1, 16, 64, 49152, 2147483647, 1024, 8, 32], "", 0, []], [[], [["FU", 1, [0, 1, 2, 3, 4]], ["SP", 1, 0, 802816, [28], 1], ["AN", 1, 0, 5], ["AN", 1, 1, 6]]]], "r": [[2.39912e-05, 2.40001e-05, 2.40014e-05], 0, 1.57046, 1667897090], "v": "v0.6"}
{"i": [["[\"hfused_relu\", 1, 28, 28, 16, 64]", "cuda -keys=cuda,gpu -max_num_threads=1024 -model=unknown -thread_warp_size=32", [-1, 16, 64, 49152, 2147483647, 1024, 8, 32], "", 0, []], [[], [["FU", 1, [0, 1, 2, 3, 4]], ["SP", 1, 0, 802816, [32], 1], ["AN", 1, 0, 5], ["AN", 1, 1, 6]]]], "r": [[2.13355e-05, 2.13564e-05, 2.13538e-05], 0, 0.912106, 1667897090], "v": "v0.6"}
{"i": [["[\"hfused_relu\", 1, 28, 28, 16, 64]", "cuda -keys=cuda,gpu -max_num_threads=1024 -model=unknown -thread_warp_size=32", [-1, 16, 64, 49152, 2147483647, 1024, 8, 32], "", 0, []], [[], [["FU", 1, [0, 1, 2, 3, 4]], ["SP", 1, 0, 802816, [64], 1], ["AN", 1, 0, 5], ["AN", 1, 1, 6]]]], "r": [[1.17881e-05, 1.18035e-05, 1.17919e-05], 0, 1.24151, 1667897090], "v": "v0.6"}
{"i": [["[\"hfused_relu\", 1, 28, 28, 16, 64]", "cuda -keys=cuda,gpu -max_num_threads=1024 -model=unknown -thread_warp_size=32", [-1, 16, 64, 49152, 2147483647, 1024, 8, 32], "", 0, []], [[], [["FU", 1, [0, 1, 2, 3, 4]], ["SP", 1, 0, 802816, [4], 1], ["AN", 1, 0, 5], ["AN", 1, 1, 6]]]], "r": [[0.000151565, 0.000151566, 0.000151553], 0, 1.93675, 1667897091], "v": "v0.6"}
{"i": [["[\"hfused_relu\", 1, 28, 28, 16, 64]", "cuda -keys=cuda,gpu -max_num_threads=1024 -model=unknown -thread_warp_size=32", [-1, 16, 64, 49152, 2147483647, 1024, 8, 32], "", 0, []], [[], [["FU", 1, [0, 1, 2, 3, 4]], ["SP", 1, 0, 802816, [8], 1], ["AN", 1, 0, 5], ["AN", 1, 1, 6]]]], "r": [[7.69689e-05, 7.69851e-05, 7.69716e-05], 0, 2.25625, 1667897091], "v": "v0.6"}
{"i": [["[\"hfused_relu\", 1, 28, 28, 16, 64]", "cuda -keys=cuda,gpu -max_num_threads=1024 -model=unknown -thread_warp_size=32", [-1, 16, 64, 49152, 2147483647, 1024, 8, 32], "", 0, []], [[], [["FU", 1, [0, 1, 2, 3, 4]], ["SP", 1, 0, 802816, [1], 1], ["AN", 1, 0, 5], ["AN", 1, 1, 6]]]], "r": [[0.000598137, 0.000598037, 0.00059813], 0, 2.58585, 1667897091], "v": "v0.6"}
{"i": [["[\"hfused_relu\", 1, 28, 28, 16, 64]", "cuda -keys=cuda,gpu -max_num_threads=1024 -model=unknown -thread_warp_size=32", [-1, 16, 64, 49152, 2147483647, 1024, 8, 32], "", 0, []], [[], [["FU", 1, [0, 1, 2, 3, 4]], ["SP", 1, 0, 802816, [2], 1], ["AN", 1, 0, 5], ["AN", 1, 1, 6]]]], "r": [[0.000300417, 0.00030038, 0.000300402], 0, 2.93558, 1667897092], "v": "v0.6"}
{"i": [["[\"hfused_relu\", 1, 28, 28, 16, 64]", "cuda -keys=cuda,gpu -max_num_threads=1024 -model=unknown -thread_warp_size=32", [-1, 16, 64, 49152, 2147483647, 1024, 8, 32], "", 0, []], [[], [["FU", 1, [0, 1, 2, 3, 4]], ["SP", 1, 0, 802816, [14], 1], ["AN", 1, 0, 5], ["AN", 1, 1, 6]]]], "r": [[4.52132e-05, 4.52222e-05, 4.52264e-05], 0, 3.25701, 1667897092], "v": "v0.6"}
{"i": [["[\"hfused_relu\", 1, 28, 28, 16, 64]", "cuda -keys=cuda,gpu -max_num_threads=1024 -model=unknown -thread_warp_size=32", [-1, 16, 64, 49152, 2147483647, 1024, 8, 32], "", 0, []], [[], [["FU", 1, [0, 1, 2, 3, 4]], ["SP", 1, 0, 802816, [16], 1], ["AN", 1, 0, 5], ["AN", 1, 1, 6]]]], "r": [[3.98725e-05, 3.9879e-05, 3.98872e-05], 0, 3.58213, 1667897092], "v": "v0.6"}
{"i": [["[\"hfused_relu\", 1, 28, 28, 16, 64]", "cuda -keys=cuda,gpu -max_num_threads=1024 -model=unknown -thread_warp_size=32", [-1, 16, 64, 49152, 2147483647, 1024, 8, 32], "", 0, []], [[], [["FU", 1, [0, 1, 2, 3, 4]], ["SP", 1, 0, 802816, [49], 1], ["AN", 1, 0, 5], ["AN", 1, 1, 6]]]], "r": [[1.47573e-05, 1.47758e-05, 1.47791e-05], 0, 3.9602, 1667897093], "v": "v0.6"}
{"i": [["[\"hfused_relu\", 1, 28, 28, 16, 64]", "cuda -keys=cuda,gpu -max_num_threads=1024 -model=unknown -thread_warp_size=32", [-1, 16, 64, 49152, 2147483647, 1024, 8, 32], "", 0, []], [[], [["FU", 1, [0, 1, 2, 3, 4]], ["SP", 1, 0, 802816, [56], 1], ["AN", 1, 0, 5], ["AN", 1, 1, 6]]]], "r": [[1.32273e-05, 1.324e-05, 1.32387e-05], 0, 4.29181, 1667897093], "v": "v0.6"}
{"i": [["[\"hfused_relu\", 1, 28, 28, 16, 64]", "cuda -keys=cuda,gpu -max_num_threads=1024 -model=unknown -thread_warp_size=32", [-1, 16, 64, 49152, 2147483647, 1024, 8, 32], "", 0, []], [[], [["FU", 1, [0, 1, 2, 3, 4]], ["SP", 1, 0, 802816, [4], 1], ["AN", 1, 0, 5], ["AN", 1, 1, 6]]]], "r": [[0.000151531, 0.000151544, 0.000151541], 0, 1.61802, 1667963261], "v": "v0.6"}
{"i": [["[\"hfused_relu\", 1, 28, 28, 16, 64]", "cuda -keys=cuda,gpu -max_num_threads=1024 -model=unknown -thread_warp_size=32", [-1, 16, 64, 49152, 2147483647, 1024, 8, 32], "", 0, []], [[], [["FU", 1, [0, 1, 2, 3, 4]], ["SP", 1, 0, 802816, [28], 1], ["AN", 1, 0, 5], ["AN", 1, 1, 6]]]], "r": [[2.39541e-05, 2.39702e-05, 2.39691e-05], 0, 0.948958, 1667963261], "v": "v0.6"}
{"i": [["[\"hfused_relu\", 1, 28, 28, 16, 64]", "cuda -keys=cuda,gpu -max_num_threads=1024 -model=unknown -thread_warp_size=32", [-1, 16, 64, 49152, 2147483647, 1024, 8, 32], "", 0, []], [[], [["FU", 1, [0, 1, 2, 3, 4]], ["SP", 1, 0, 802816, [14], 1], ["AN", 1, 0, 5], ["AN", 1, 1, 6]]]], "r": [[4.51276e-05, 4.51449e-05, 4.51364e-05], 0, 0.554979, 1667963260], "v": "v0.6"}
{"i": [["[\"hfused_relu\", 1, 28, 28, 16, 64]", "cuda -keys=cuda,gpu -max_num_threads=1024 -model=unknown -thread_warp_size=32", [-1, 16, 64, 49152, 2147483647, 1024, 8, 32], "", 0, []], [[], [["FU", 1, [0, 1, 2, 3, 4]], ["SP", 1, 0, 802816, [64], 1], ["AN", 1, 0, 5], ["AN", 1, 1, 6]]]], "r": [[1.18348e-05, 1.1858e-05, 1.18317e-05], 0, 2.00244, 1667963262], "v": "v0.6"}
{"i": [["[\"hfused_relu\", 1, 28, 28, 16, 64]", "cuda -keys=cuda,gpu -max_num_threads=1024 -model=unknown -thread_warp_size=32", [-1, 16, 64, 49152, 2147483647, 1024, 8, 32], "", 0, []], [[], [["FU", 1, [0, 1, 2, 3, 4]], ["SP", 1, 0, 802816, [49], 1], ["AN", 1, 0, 5], ["AN", 1, 1, 6]]]], "r": [[1.47185e-05, 1.47156e-05, 1.47126e-05], 0, 1.28624, 1667963261], "v": "v0.6"}
{"i": [["[\"hfused_relu\", 1, 28, 28, 16, 64]", "cuda -keys=cuda,gpu -max_num_threads=1024 -model=unknown -thread_warp_size=32", [-1, 16, 64, 49152, 2147483647, 1024, 8, 32], "", 0, []], [[], [["FU", 1, [0, 1, 2, 3, 4]], ["SP", 1, 0, 802816, [8], 1], ["AN", 1, 0, 5], ["AN", 1, 1, 6]]]], "r": [[7.71537e-05, 7.71661e-05, 7.71628e-05], 0, 2.33871, 1667963262], "v": "v0.6"}
{"i": [["[\"hfused_relu\", 1, 28, 28, 16, 64]", "cuda -keys=cuda,gpu -max_num_threads=1024 -model=unknown -thread_warp_size=32", [-1, 16, 64, 49152, 2147483647, 1024, 8, 32], "", 0, []], [[], [["FU", 1, [0, 1, 2, 3, 4]], ["SP", 1, 0, 802816, [1], 1], ["AN", 1, 0, 5], ["AN", 1, 1, 6]]]], "r": [[0.000598085, 0.00059807, 0.000598125], 0, 3.04518, 1667963263], "v": "v0.6"}
{"i": [["[\"hfused_relu\", 1, 28, 28, 16, 64]", "cuda -keys=cuda,gpu -max_num_threads=1024 -model=unknown -thread_warp_size=32", [-1, 16, 64, 49152, 2147483647, 1024, 8, 32], "", 0, []], [[], [["FU", 1, [0, 1, 2, 3, 4]], ["SP", 1, 0, 802816, [56], 1], ["AN", 1, 0, 5], ["AN", 1, 1, 6]]]], "r": [[1.31768e-05, 1.31892e-05, 1.31777e-05], 0, 4.44098, 1667963264], "v": "v0.6"}
{"i": [["[\"hfused_relu\", 1, 28, 28, 16, 64]", "cuda -keys=cuda,gpu -max_num_threads=1024 -model=unknown -thread_warp_size=32", [-1, 16, 64, 49152, 2147483647, 1024, 8, 32], "", 0, []], [[], [["FU", 1, [0, 1, 2, 3, 4]], ["SP", 1, 0, 802816, [32], 1], ["AN", 1, 0, 5], ["AN", 1, 1, 6]]]], "r": [[2.13181e-05, 2.13278e-05, 2.13283e-05], 0, 2.66488, 1667963263], "v": "v0.6"}
{"i": [["[\"hfused_relu\", 1, 28, 28, 16, 64]", "cuda -keys=cuda,gpu -max_num_threads=1024 -model=unknown -thread_warp_size=32", [-1, 16, 64, 49152, 2147483647, 1024, 8, 32], "", 0, []], [[], [["FU", 1, [0, 1, 2, 3, 4]], ["SP", 1, 0, 802816, [7], 1], ["AN", 1, 0, 5], ["AN", 1, 1, 6]]]], "r": [[8.77044e-05, 8.77455e-05, 8.77129e-05], 0, 3.38854, 1667963263], "v": "v0.6"}
{"i": [["[\"hfused_relu\", 1, 28, 28, 16, 64]", "cuda -keys=cuda,gpu -max_num_threads=1024 -model=unknown -thread_warp_size=32", [-1, 16, 64, 49152, 2147483647, 1024, 8, 32], "", 0, []], [[], [["FU", 1, [0, 1, 2, 3, 4]], ["SP", 1, 0, 802816, [16], 1], ["AN", 1, 0, 5], ["AN", 1, 1, 6]]]], "r": [[3.99702e-05, 3.9988e-05, 3.99958e-05], 0, 3.71347, 1667963264], "v": "v0.6"}
{"i": [["[\"hfused_relu\", 1, 28, 28, 16, 64]", "cuda -keys=cuda,gpu -max_num_threads=1024 -model=unknown -thread_warp_size=32", [-1, 16, 64, 49152, 2147483647, 1024, 8, 32], "", 0, []], [[], [["FU", 1, [0, 1, 2, 3, 4]], ["SP", 1, 0, 802816, [2], 1], ["AN", 1, 0, 5], ["AN", 1, 1, 6]]]], "r": [[0.000300433, 0.000300434, 0.000300481], 0, 4.09757, 1667963264], "v": "v0.6"}
{"i": [["[\"hfused_relu\", 1, 28, 28, 16, 64]", "cuda -keys=cuda,gpu -max_num_threads=1024 -model=unknown -thread_warp_size=32", [-1, 16, 64, 49152, 2147483647, 1024, 8, 32], "", 0, []], [[], [["FU", 1, [0, 1, 2, 3, 4]], ["SP", 1, 0, 802816, [14], 1], ["AN", 1, 0, 5], ["AN", 1, 1, 6]]]], "r": [[4.51814e-05, 4.5202e-05, 4.51987e-05], 0, 3.70478, 1667964123], "v": "v0.6"}
{"i": [["[\"hfused_relu\", 1, 28, 28, 16, 64]", "cuda -keys=cuda,gpu -max_num_threads=1024 -model=unknown -thread_warp_size=32", [-1, 16, 64, 49152, 2147483647, 1024, 8, 32], "", 0, []], [[], [["FU", 1, [0, 1, 2, 3, 4]], ["SP", 1, 0, 802816, [32], 1], ["AN", 1, 0, 5], ["AN", 1, 1, 6]]]], "r": [[2.12821e-05, 2.12893e-05, 2.12925e-05], 0, 1.96202, 1667964121], "v": "v0.6"}
{"i": [["[\"hfused_relu\", 1, 28, 28, 16, 64]", "cuda -keys=cuda,gpu -max_num_threads=1024 -model=unknown -thread_warp_size=32", [-1, 16, 64, 49152, 2147483647, 1024, 8, 32], "", 0, []], [[], [["FU", 1, [0, 1, 2, 3, 4]], ["SP", 1, 0, 802816, [1], 1], ["AN", 1, 0, 5], ["AN", 1, 1, 6]]]], "r": [[0.00059799, 0.000598025, 0.000598102], 0, 1.59522, 1667964121], "v": "v0.6"}
{"i": [["[\"hfused_relu\", 1, 28, 28, 16, 64]", "cuda -keys=cuda,gpu -max_num_threads=1024 -model=unknown -thread_warp_size=32", [-1, 16, 64, 49152, 2147483647, 1024, 8, 32], "", 0, []], [[], [["FU", 1, [0, 1, 2, 3, 4]], ["SP", 1, 0, 802816, [28], 1], ["AN", 1, 0, 5], ["AN", 1, 1, 6]]]], "r": [[2.39646e-05, 2.39731e-05, 2.39734e-05], 0, 0.921945, 1667964120], "v": "v0.6"}
{"i": [["[\"hfused_relu\", 1, 28, 28, 16, 64]", "cuda -keys=cuda,gpu -max_num_threads=1024 -model=unknown -thread_warp_size=32", [-1, 16, 64, 49152, 2147483647, 1024, 8, 32], "", 0, []], [[], [["FU", 1, [0, 1, 2, 3, 4]], ["SP", 1, 0, 802816, [16], 1], ["AN", 1, 0, 5], ["AN", 1, 1, 6]]]], "r": [[3.98417e-05, 3.98548e-05, 3.98546e-05], 0, 0.545446, 1667964120], "v": "v0.6"}
{"i": [["[\"hfused_relu\", 1, 28, 28, 16, 64]", "cuda -keys=cuda,gpu -max_num_threads=1024 -model=unknown -thread_warp_size=32", [-1, 16, 64, 49152, 2147483647, 1024, 8, 32], "", 0, []], [[], [["FU", 1, [0, 1, 2, 3, 4]], ["SP", 1, 0, 802816, [7], 1], ["AN", 1, 0, 5], ["AN", 1, 1, 6]]]], "r": [[8.76441e-05, 8.76611e-05, 8.76513e-05], 0, 1.26519, 1667964120], "v": "v0.6"}
{"i": [["[\"hfused_relu\", 1, 28, 28, 16, 64]", "cuda -keys=cuda,gpu -max_num_threads=1024 -model=unknown -thread_warp_size=32", [-1, 16, 64, 49152, 2147483647, 1024, 8, 32], "", 0, []], [[], [["FU", 1, [0, 1, 2, 3, 4]], ["SP", 1, 0, 802816, [56], 1], ["AN", 1, 0, 5], ["AN", 1, 1, 6]]]], "r": [[1.31806e-05, 1.31882e-05, 1.31843e-05], 0, 2.66093, 1667964122], "v": "v0.6"}
{"i": [["[\"hfused_relu\", 1, 28, 28, 16, 64]", "cuda -keys=cuda,gpu -max_num_threads=1024 -model=unknown -thread_warp_size=32", [-1, 16, 64, 49152, 2147483647, 1024, 8, 32], "", 0, []], [[], [["FU", 1, [0, 1, 2, 3, 4]], ["SP", 1, 0, 802816, [4], 1], ["AN", 1, 0, 5], ["AN", 1, 1, 6]]]], "r": [[0.000151413, 0.000151424, 0.000151444], 0, 3.04562, 1667964122], "v": "v0.6"}
{"i": [["[\"hfused_relu\", 1, 28, 28, 16, 64]", "cuda -keys=cuda,gpu -max_num_threads=1024 -model=unknown -thread_warp_size=32", [-1, 16, 64, 49152, 2147483647, 1024, 8, 32], "", 0, []], [[], [["FU", 1, [0, 1, 2, 3, 4]], ["SP", 1, 0, 802816, [2], 1], ["AN", 1, 0, 5], ["AN", 1, 1, 6]]]], "r": [[0.000300366, 0.000300351, 0.000300386], 0, 3.35385, 1667964123], "v": "v0.6"}
{"i": [["[\"hfused_relu\", 1, 28, 28, 16, 64]", "cuda -keys=cuda,gpu -max_num_threads=1024 -model=unknown -thread_warp_size=32", [-1, 16, 64, 49152, 2147483647, 1024, 8, 32], "", 0, []], [[], [["FU", 1, [0, 1, 2, 3, 4]], ["SP", 1, 0, 802816, [49], 1], ["AN", 1, 0, 5], ["AN", 1, 1, 6]]]], "r": [[1.46293e-05, 1.46298e-05, 1.46383e-05], 0, 4.41759, 1667964124], "v": "v0.6"}
{"i": [["[\"hfused_relu\", 1, 28, 28, 16, 64]", "cuda -keys=cuda,gpu -max_num_threads=1024 -model=unknown -thread_warp_size=32", [-1, 16, 64, 49152, 2147483647, 1024, 8, 32], "", 0, []], [[], [["FU", 1, [0, 1, 2, 3, 4]], ["SP", 1, 0, 802816, [64], 1], ["AN", 1, 0, 5], ["AN", 1, 1, 6]]]], "r": [[1.18974e-05, 1.19091e-05, 1.1897e-05], 0, 2.31525, 1667964122], "v": "v0.6"}
{"i": [["[\"hfused_relu\", 1, 28, 28, 16, 64]", "cuda -keys=cuda,gpu -max_num_threads=1024 -model=unknown -thread_warp_size=32", [-1, 16, 64, 49152, 2147483647, 1024, 8, 32], "", 0, []], [[], [["FU", 1, [0, 1, 2, 3, 4]], ["SP", 1, 0, 802816, [8], 1], ["AN", 1, 0, 5], ["AN", 1, 1, 6]]]], "r": [[7.71141e-05, 7.71246e-05, 7.71089e-05], 0, 4.07026, 1667964123], "v": "v0.6"}
