python/models/resnext/ResNextHorizontal_kernel_configs/resnext_imagenet_50_fused_conv3x3_1_14_14_16_16_3.log
{"i": [["[\"fused_conv3x3\", 1, 14, 14, 16, 16, 3, 3, 64]", "cuda -keys=cuda,gpu -max_num_threads=1024 -model=unknown -thread_warp_size=32", [-1, 16, 64, 49152, 2147483647, 1024, 8, 32], "", 0, []], [[], [["CHW", 3, "local"], ["SP", 3, 0, 1, [1, 1, 1, 1], 1], ["SP", 3, 5, 64, [1, 2, 2, 1], 1], ["SP", 3, 10, 14, [1, 7, 1, 2], 1], ["SP", 3, 15, 14, [1, 1, 1, 7], 1], ["SP", 3, 20, 16, [2, 8, 1, 1], 1], ["SP", 3, 25, 16, [1, 8], 1], ["SP", 3, 28, 3, [3, 1], 1], ["SP", 3, 31, 3, [3, 1], 1], ["RE", 3, [0, 5, 10, 15, 20, 1, 6, 11, 16, 21, 2, 7, 12, 17, 22, 25, 28, 31, 26, 29, 32, 3, 8, 13, 18, 23, 27, 30, 33, 4, 9, 14, 19, 24]], ["FSP", 4, 0, 1, 3], ["FSP", 4, 4, 2, 3], ["FSP", 4, 8, 3, 3], ["FSP", 4, 12, 4, 3], ["FSP", 4, 16, 5, 3], ["RE", 4, [0, 4, 8, 12, 16, 1, 5, 9, 13, 17, 2, 6, 10, 14, 18, 3, 7, 11, 15, 19]], ["CA", 3, 4, 14], ["CHR", 2, "shared", [3]], ["CA", 3, 4, 17], ["CHR", 1, "shared", [4]], ["CA", 2, 5, 17], ["CI", 1], ["FU", 6, [0, 1, 2, 3, 4]], ["AN", 6, 0, 5], ["FU", 6, [1, 2, 3, 4, 5]], ["AN", 6, 1, 4], ["FU", 6, [2, 3, 4, 5, 6]], ["AN", 6, 2, 6], ["FU", 4, [0, 1, 2, 3, 4]], ["SP", 4, 0, 144, [1], 1], ["AN", 4, 1, 2], ["FFSP", 4, 0, [5, 4, 3, 2, 1], 1, 1], ["AN", 4, 1, 6], ["FU", 2, [0, 1, 2, 3, 4]], ["SP", 2, 0, 576, [6], 1], ["AN", 2, 1, 2], ["FFSP", 2, 0, [5, 4, 3, 2, 1], 1, 1], ["AN", 2, 1, 6], ["PR", 5, 0, "auto_unroll_max_step$16"]]]], "r": [[3.66043e-05, 3.65903e-05, 3.6538e-05], 0, 1.50907, 1667897313], "v": "v0.6"}
{"i": [["[\"fused_conv3x3\", 1, 14, 14, 16, 16, 3, 3, 64]", "cuda -keys=cuda,gpu -max_num_threads=1024 -model=unknown -thread_warp_size=32", [-1, 16, 64, 49152, 2147483647, 1024, 8, 32], "", 0, []], [[], [["CHW", 3, "local"], ["SP", 3, 0, 1, [1, 1, 1, 1], 1], ["SP", 3, 5, 64, [1, 8, 2, 2], 1], ["SP", 3, 10, 14, [1, 1, 1, 1], 1], ["SP", 3, 15, 14, [1, 7, 1, 2], 1], ["SP", 3, 20, 16, [1, 4, 2, 1], 1], ["SP", 3, 25, 16, [1, 4], 1], ["SP", 3, 28, 3, [1, 1], 1], ["SP", 3, 31, 3, [1, 1], 1], ["RE", 3, [0, 5, 10, 15, 20, 1, 6, 11, 16, 21, 2, 7, 12, 17, 22, 25, 28, 31, 26, 29, 32, 3, 8, 13, 18, 23, 27, 30, 33, 4, 9, 14, 19, 24]], ["FSP", 4, 0, 1, 3], ["FSP", 4, 4, 2, 3], ["FSP", 4, 8, 3, 3], ["FSP", 4, 12, 4, 3], ["FSP", 4, 16, 5, 3], ["RE", 4, [0, 4, 8, 12, 16, 1, 5, 9, 13, 17, 2, 6, 10, 14, 18, 3, 7, 11, 15, 19]], ["CA", 3, 4, 14], ["CHR", 2, "shared", [3]], ["CA", 3, 4, 17], ["CHR", 1, "shared", [4]], ["CA", 2, 5, 17], ["CI", 1], ["FU", 6, [0, 1, 2, 3, 4]], ["AN", 6, 0, 5], ["FU", 6, [1, 2, 3, 4, 5]], ["AN", 6, 1, 4], ["FU", 6, [2, 3, 4, 5, 6]], ["AN", 6, 2, 6], ["FU", 4, [0, 1, 2, 3, 4]], ["SP", 4, 0, 32, [16], 1], ["AN", 4, 1, 2], ["FFSP", 4, 0, [5, 4, 3, 2, 1], 1, 1], ["AN", 4, 1, 6], ["FU", 2, [0, 1, 2, 3, 4]], ["SP", 2, 0, 32, [1], 1], ["AN", 2, 1, 2], ["FFSP", 2, 0, [5, 4, 3, 2, 1], 1, 1], ["AN", 2, 1, 6], ["PR", 5, 0, "auto_unroll_max_step$512"]]]], "r": [[6.44826e-05, 6.44867e-05, 6.44928e-05], 0, 2.01426, 1667897314], "v": "v0.6"}
{"i": [["[\"fused_conv3x3\", 1, 14, 14, 16, 16, 3, 3, 64]", "cuda -keys=cuda,gpu -max_num_threads=1024 -model=unknown -thread_warp_size=32", [-1, 16, 64, 49152, 2147483647, 1024, 8, 32], "", 0, []], [[], [["CHW", 3, "local"], ["SP", 3, 0, 1, [1, 1, 1, 1], 1], ["SP", 3, 5, 64, [1, 1, 1, 1], 1], ["SP", 3, 10, 14, [1, 14, 1, 1], 1], ["SP", 3, 15, 14, [2, 7, 1, 1], 1], ["SP", 3, 20, 16, [4, 1, 4, 1], 1], ["SP", 3, 25, 16, [1, 16], 1], ["SP", 3, 28, 3, [1, 3], 1], ["SP", 3, 31, 3, [1, 1], 1], ["RE", 3, [0, 5, 10, 15, 20, 1, 6, 11, 16, 21, 2, 7, 12, 17, 22, 25, 28, 31, 26, 29, 32, 3, 8, 13, 18, 23, 27, 30, 33, 4, 9, 14, 19, 24]], ["FSP", 4, 0, 1, 3], ["FSP", 4, 4, 2, 3], ["FSP", 4, 8, 3, 3], ["FSP", 4, 12, 4, 3], ["FSP", 4, 16, 5, 3], ["RE", 4, [0, 4, 8, 12, 16, 1, 5, 9, 13, 17, 2, 6, 10, 14, 18, 3, 7, 11, 15, 19]], ["CA", 3, 4, 14], ["CHR", 2, "shared", [3]], ["CA", 3, 4, 17], ["CHR", 1, "shared", [4]], ["CA", 2, 5, 17], ["CI", 1], ["FU", 6, [0, 1, 2, 3, 4]], ["AN", 6, 0, 5], ["FU", 6, [1, 2, 3, 4, 5]], ["AN", 6, 1, 4], ["FU", 6, [2, 3, 4, 5, 6]], ["AN", 6, 2, 6], ["FU", 4, [0, 1, 2, 3, 4]], ["SP", 4, 0, 192, [1], 1], ["AN", 4, 1, 2], ["FFSP", 4, 0, [5, 4, 3, 2, 1], 1, 1], ["AN", 4, 1, 6], ["FU", 2, [0, 1, 2, 3, 4]], ["SP", 2, 0, 144, [1], 1], ["AN", 2, 1, 2], ["FFSP", 2, 0, [5, 4, 3, 2, 1], 1, 1], ["AN", 2, 1, 6], ["PR", 5, 0, "auto_unroll_max_step$64"]]]], "r": [[2.77432e-05, 2.7746e-05, 2.77615e-05], 0, 6.58458, 1667897319], "v": "v0.6"}
{"i": [["[\"fused_conv3x3\", 1, 14, 14, 16, 16, 3, 3, 64]", "cuda -keys=cuda,gpu -max_num_threads=1024 -model=unknown -thread_warp_size=32", [-1, 16, 64, 49152, 2147483647, 1024, 8, 32], "", 0, []], [[], [["CHW", 3, "local"], ["SP", 3, 0, 1, [1, 1, 1, 1], 1], ["SP", 3, 5, 64, [1, 1, 4, 1], 1], ["SP", 3, 10, 14, [1, 7, 1, 1], 1], ["SP", 3, 15, 14, [1, 7, 2, 1], 1], ["SP", 3, 20, 16, [1, 1, 4, 2], 1], ["SP", 3, 25, 16, [4, 2], 1], ["SP", 3, 28, 3, [3, 1], 1], ["SP", 3, 31, 3, [3, 1], 1], ["RE", 3, [0, 5, 10, 15, 20, 1, 6, 11, 16, 21, 2, 7, 12, 17, 22, 25, 28, 31, 26, 29, 32, 3, 8, 13, 18, 23, 27, 30, 33, 4, 9, 14, 19, 24]], ["FSP", 4, 0, 1, 3], ["FSP", 4, 4, 2, 3], ["FSP", 4, 8, 3, 3], ["FSP", 4, 12, 4, 3], ["FSP", 4, 16, 5, 3], ["RE", 4, [0, 4, 8, 12, 16, 1, 5, 9, 13, 17, 2, 6, 10, 14, 18, 3, 7, 11, 15, 19]], ["CA", 3, 4, 14], ["CHR", 2, "shared", [3]], ["CA", 3, 4, 17], ["CHR", 1, "shared", [4]], ["CA", 2, 5, 17], ["CI", 1], ["FU", 6, [0, 1, 2, 3, 4]], ["AN", 6, 0, 5], ["FU", 6, [1, 2, 3, 4, 5]], ["AN", 6, 1, 4], ["FU", 6, [2, 3, 4, 5, 6]], ["AN", 6, 2, 6], ["FU", 4, [0, 1, 2, 3, 4]], ["SP", 4, 0, 384, [1], 1], ["AN", 4, 1, 2], ["FFSP", 4, 0, [5, 4, 3, 2, 1], 1, 1], ["AN", 4, 1, 6], ["FU", 2, [0, 1, 2, 3, 4]], ["SP", 2, 0, 32, [1], 1], ["AN", 2, 1, 2], ["FFSP", 2, 0, [5, 4, 3, 2, 1], 1, 1], ["AN", 2, 1, 6], ["PR", 5, 0, "auto_unroll_max_step$16"]]]], "r": [[8.47022e-05, 8.47002e-05, 8.46761e-05], 0, 2.60286, 1667897314], "v": "v0.6"}
{"i": [["[\"fused_conv3x3\", 1, 14, 14, 16, 16, 3, 3, 64]", "cuda -keys=cuda,gpu -max_num_threads=1024 -model=unknown -thread_warp_size=32", [-1, 16, 64, 49152, 2147483647, 1024, 8, 32], "", 0, []], [[], [["CHW", 3, "local"], ["SP", 3, 0, 1, [1, 1, 1, 1], 1], ["SP", 3, 5, 64, [4, 1, 1, 1], 1], ["SP", 3, 10, 14, [1, 7, 1, 1], 1], ["SP", 3, 15, 14, [2, 1, 1, 1], 1], ["SP", 3, 20, 16, [1, 16, 1, 1], 1], ["SP", 3, 25, 16, [4, 4], 1], ["SP", 3, 28, 3, [1, 1], 1], ["SP", 3, 31, 3, [3, 1], 1], ["RE", 3, [0, 5, 10, 15, 20, 1, 6, 11, 16, 21, 2, 7, 12, 17, 22, 25, 28, 31, 26, 29, 32, 3, 8, 13, 18, 23, 27, 30, 33, 4, 9, 14, 19, 24]], ["FSP", 4, 0, 1, 3], ["FSP", 4, 4, 2, 3], ["FSP", 4, 8, 3, 3], ["FSP", 4, 12, 4, 3], ["FSP", 4, 16, 5, 3], ["RE", 4, [0, 4, 8, 12, 16, 1, 5, 9, 13, 17, 2, 6, 10, 14, 18, 3, 7, 11, 15, 19]], ["CA", 3, 4, 14], ["CHR", 2, "shared", [3]], ["CA", 3, 4, 17], ["CHR", 1, "shared", [4]], ["CA", 2, 5, 17], ["CI", 1], ["FU", 6, [0, 1, 2, 3, 4]], ["AN", 6, 0, 5], ["FU", 6, [1, 2, 3, 4, 5]], ["AN", 6, 1, 4], ["FU", 6, [2, 3, 4, 5, 6]], ["AN", 6, 2, 6], ["FU", 4, [0, 1, 2, 3, 4]], ["SP", 4, 0, 144, [1], 1], ["AN", 4, 1, 2], ["FFSP", 4, 0, [5, 4, 3, 2, 1], 1, 1], ["AN", 4, 1, 6], ["FU", 2, [0, 1, 2, 3, 4]], ["SP", 2, 0, 144, [18], 1], ["AN", 2, 1, 2], ["FFSP", 2, 0, [5, 4, 3, 2, 1], 1, 1], ["AN", 2, 1, 6], ["PR", 5, 0, "auto_unroll_max_step$16"]]]], "r": [[3.42075e-05, 3.4203e-05, 3.42055e-05], 0, 0.763698, 1667897313], "v": "v0.6"}
{"i": [["[\"fused_conv3x3\", 1, 14, 14, 16, 16, 3, 3, 64]", "cuda -keys=cuda,gpu -max_num_threads=1024 -model=unknown -thread_warp_size=32", [-1, 16, 64, 49152, 2147483647, 1024, 8, 32], "", 0, []], [[], [["CHW", 3, "local"], ["SP", 3, 0, 1, [1, 1, 1, 1], 1], ["SP", 3, 5, 64, [2, 1, 2, 2], 1], ["SP", 3, 10, 14, [1, 7, 1, 1], 1], ["SP", 3, 15, 14, [1, 2, 1, 7], 1], ["SP", 3, 20, 16, [1, 8, 1, 1], 1], ["SP", 3, 25, 16, [2, 1], 1], ["SP", 3, 28, 3, [3, 1], 1], ["SP", 3, 31, 3, [3, 1], 1], ["RE", 3, [0, 5, 10, 15, 20, 1, 6, 11, 16, 21, 2, 7, 12, 17, 22, 25, 28, 31, 26, 29, 32, 3, 8, 13, 18, 23, 27, 30, 33, 4, 9, 14, 19, 24]], ["FSP", 4, 0, 1, 3], ["FSP", 4, 4, 2, 3], ["FSP", 4, 8, 3, 3], ["FSP", 4, 12, 4, 3], ["FSP", 4, 16, 5, 3], ["RE", 4, [0, 4, 8, 12, 16, 1, 5, 9, 13, 17, 2, 6, 10, 14, 18, 3, 7, 11, 15, 19]], ["CA", 3, 4, 14], ["CHR", 2, "shared", [3]], ["CA", 3, 4, 17], ["CHR", 1, "shared", [4]], ["CA", 2, 5, 17], ["CI", 1], ["FU", 6, [0, 1, 2, 3, 4]], ["AN", 6, 0, 5], ["FU", 6, [1, 2, 3, 4, 5]], ["AN", 6, 1, 4], ["FU", 6, [2, 3, 4, 5, 6]], ["AN", 6, 2, 6], ["FU", 4, [0, 1, 2, 3, 4]], ["SP", 4, 0, 72, [1], 1], ["AN", 4, 1, 2], ["FFSP", 4, 0, [5, 4, 3, 2, 1], 1, 1], ["AN", 4, 1, 6], ["FU", 2, [0, 1, 2, 3, 4]], ["SP", 2, 0, 216, [1], 1], ["AN", 2, 1, 2], ["FFSP", 2, 0, [5, 4, 3, 2, 1], 1, 1], ["AN", 2, 1, 6], ["PR", 5, 0, "auto_unroll_max_step$16"]]]], "r": [[6.65893e-05, 6.65567e-05, 6.65318e-05], 0, 3.45169, 1667897315], "v": "v0.6"}
{"i": [["[\"fused_conv3x3\", 1, 14, 14, 16, 16, 3, 3, 64]", "cuda -keys=cuda,gpu -max_num_threads=1024 -model=unknown -thread_warp_size=32", [-1, 16, 64, 49152, 2147483647, 1024, 8, 32], "", 0, []], [[], [["CHW", 3, "local"], ["SP", 3, 0, 1, [1, 1, 1, 1], 1], ["SP", 3, 5, 64, [1, 2, 8, 2], 1], ["SP", 3, 10, 14, [1, 1, 7, 1], 1], ["SP", 3, 15, 14, [1, 1, 1, 1], 1], ["SP", 3, 20, 16, [1, 16, 1, 1], 1], ["SP", 3, 25, 16, [1, 4], 1], ["SP", 3, 28, 3, [1, 1], 1], ["SP", 3, 31, 3, [1, 3], 1], ["RE", 3, [0, 5, 10, 15, 20, 1, 6, 11, 16, 21, 2, 7, 12, 17, 22, 25, 28, 31, 26, 29, 32, 3, 8, 13, 18, 23, 27, 30, 33, 4, 9, 14, 19, 24]], ["FSP", 4, 0, 1, 3], ["FSP", 4, 4, 2, 3], ["FSP", 4, 8, 3, 3], ["FSP", 4, 12, 4, 3], ["FSP", 4, 16, 5, 3], ["RE", 4, [0, 4, 8, 12, 16, 1, 5, 9, 13, 17, 2, 6, 10, 14, 18, 3, 7, 11, 15, 19]], ["CA", 3, 4, 14], ["CHR", 2, "shared", [3]], ["CA", 3, 4, 17], ["CHR", 1, "shared", [4]], ["CA", 2, 5, 17], ["CI", 1], ["FU", 6, [0, 1, 2, 3, 4]], ["AN", 6, 0, 5], ["FU", 6, [1, 2, 3, 4, 5]], ["AN", 6, 1, 4], ["FU", 6, [2, 3, 4, 5, 6]], ["AN", 6, 2, 6], ["FU", 4, [0, 1, 2, 3, 4]], ["SP", 4, 0, 192, [1], 1], ["AN", 4, 1, 2], ["FFSP", 4, 0, [5, 4, 3, 2, 1], 1, 1], ["AN", 4, 1, 6], ["FU", 2, [0, 1, 2, 3, 4]], ["SP", 2, 0, 448, [1], 1], ["AN", 2, 1, 2], ["FFSP", 2, 0, [5, 4, 3, 2, 1], 1, 1], ["AN", 2, 1, 6], ["PR", 5, 0, "auto_unroll_max_step$64"]]]], "r": [[0.000116515, 0.000116452, 0.000116448], 0, 4.08513, 1667897316], "v": "v0.6"}
{"i": [["[\"fused_conv3x3\", 1, 14, 14, 16, 16, 3, 3, 64]", "cuda -keys=cuda,gpu -max_num_threads=1024 -model=unknown -thread_warp_size=32", [-1, 16, 64, 49152, 2147483647, 1024, 8, 32], "", 0, []], [[], [["CHW", 3, "local"], ["SP", 3, 0, 1, [1, 1, 1, 1], 1], ["SP", 3, 5, 64, [2, 16, 1, 2], 1], ["SP", 3, 10, 14, [1, 1, 7, 2], 1], ["SP", 3, 15, 14, [1, 1, 1, 1], 1], ["SP", 3, 20, 16, [1, 4, 2, 2], 1], ["SP", 3, 25, 16, [1, 2], 1], ["SP", 3, 28, 3, [1, 1], 1], ["SP", 3, 31, 3, [3, 1], 1], ["RE", 3, [0, 5, 10, 15, 20, 1, 6, 11, 16, 21, 2, 7, 12, 17, 22, 25, 28, 31, 26, 29, 32, 3, 8, 13, 18, 23, 27, 30, 33, 4, 9, 14, 19, 24]], ["FSP", 4, 0, 1, 3], ["FSP", 4, 4, 2, 3], ["FSP", 4, 8, 3, 3], ["FSP", 4, 12, 4, 3], ["FSP", 4, 16, 5, 3], ["RE", 4, [0, 4, 8, 12, 16, 1, 5, 9, 13, 17, 2, 6, 10, 14, 18, 3, 7, 11, 15, 19]], ["CA", 3, 4, 14], ["CHR", 2, "shared", [3]], ["CA", 3, 4, 17], ["CHR", 1, "shared", [4]], ["CA", 2, 5, 17], ["CI", 1], ["FU", 6, [0, 1, 2, 3, 4]], ["AN", 6, 0, 5], ["FU", 6, [1, 2, 3, 4, 5]], ["AN", 6, 1, 4], ["FU", 6, [2, 3, 4, 5, 6]], ["AN", 6, 2, 6], ["FU", 4, [0, 1, 2, 3, 4]], ["SP", 4, 0, 48, [1], 1], ["AN", 4, 1, 2], ["FFSP", 4, 0, [5, 4, 3, 2, 1], 1, 1], ["AN", 4, 1, 6], ["FU", 2, [0, 1, 2, 3, 4]], ["SP", 2, 0, 56, [1], 1], ["AN", 2, 1, 2], ["FFSP", 2, 0, [5, 4, 3, 2, 1], 1, 1], ["AN", 2, 1, 6], ["PR", 5, 0, "auto_unroll_max_step$16"]]]], "r": [[0.000326123, 0.000326039, 0.00032602], 0, 3.31116, 1667897315], "v": "v0.6"}
{"i": [["[\"fused_conv3x3\", 1, 14, 14, 16, 16, 3, 3, 64]", "cuda -keys=cuda,gpu -max_num_threads=1024 -model=unknown -thread_warp_size=32", [-1, 16, 64, 49152, 2147483647, 1024, 8, 32], "", 0, []], [[], [["CHW", 3, "local"], ["SP", 3, 0, 1, [1, 1, 1, 1], 1], ["SP", 3, 5, 64, [1, 4, 4, 2], 1], ["SP", 3, 10, 14, [1, 1, 1, 2], 1], ["SP", 3, 15, 14, [1, 7, 1, 1], 1], ["SP", 3, 20, 16, [2, 8, 1, 1], 1], ["SP", 3, 25, 16, [4, 1], 1], ["SP", 3, 28, 3, [1, 3], 1], ["SP", 3, 31, 3, [1, 1], 1], ["RE", 3, [0, 5, 10, 15, 20, 1, 6, 11, 16, 21, 2, 7, 12, 17, 22, 25, 28, 31, 26, 29, 32, 3, 8, 13, 18, 23, 27, 30, 33, 4, 9, 14, 19, 24]], ["FSP", 4, 0, 1, 3], ["FSP", 4, 4, 2, 3], ["FSP", 4, 8, 3, 3], ["FSP", 4, 12, 4, 3], ["FSP", 4, 16, 5, 3], ["RE", 4, [0, 4, 8, 12, 16, 1, 5, 9, 13, 17, 2, 6, 10, 14, 18, 3, 7, 11, 15, 19]], ["CA", 3, 4, 14], ["CHR", 2, "shared", [3]], ["CA", 3, 4, 17], ["CHR", 1, "shared", [4]], ["CA", 2, 5, 17], ["CI", 1], ["FU", 6, [0, 1, 2, 3, 4]], ["AN", 6, 0, 5], ["FU", 6, [1, 2, 3, 4, 5]], ["AN", 6, 1, 4], ["FU", 6, [2, 3, 4, 5, 6]], ["AN", 6, 2, 6], ["FU", 4, [0, 1, 2, 3, 4]], ["SP", 4, 0, 96, [1], 1], ["AN", 4, 1, 2], ["FFSP", 4, 0, [5, 4, 3, 2, 1], 1, 1], ["AN", 4, 1, 6], ["FU", 2, [0, 1, 2, 3, 4]], ["SP", 2, 0, 288, [1], 1], ["AN", 2, 1, 2], ["FFSP", 2, 0, [5, 4, 3, 2, 1], 1, 1], ["AN", 2, 1, 6], ["PR", 5, 0, "auto_unroll_max_step$16"]]]], "r": [[0.000122915, 0.000122884, 0.000122818], 0, 7.26211, 1667897319], "v": "v0.6"}
{"i": [["[\"fused_conv3x3\", 1, 14, 14, 16, 16, 3, 3, 64]", "cuda -keys=cuda,gpu -max_num_threads=1024 -model=unknown -thread_warp_size=32", [-1, 16, 64, 49152, 2147483647, 1024, 8, 32], "", 0, []], [[], [["CHW", 3, "local"], ["SP", 3, 0, 1, [1, 1, 1, 1], 1], ["SP", 3, 5, 64, [2, 16, 1, 2], 1], ["SP", 3, 10, 14, [1, 1, 7, 2], 1], ["SP", 3, 15, 14, [1, 1, 1, 1], 1], ["SP", 3, 20, 16, [1, 4, 2, 2], 1], ["SP", 3, 25, 16, [1, 2], 1], ["SP", 3, 28, 3, [1, 1], 1], ["SP", 3, 31, 3, [3, 1], 1], ["RE", 3, [0, 5, 10, 15, 20, 1, 6, 11, 16, 21, 2, 7, 12, 17, 22, 25, 28, 31, 26, 29, 32, 3, 8, 13, 18, 23, 27, 30, 33, 4, 9, 14, 19, 24]], ["FSP", 4, 0, 1, 3], ["FSP", 4, 4, 2, 3], ["FSP", 4, 8, 3, 3], ["FSP", 4, 12, 4, 3], ["FSP", 4, 16, 5, 3], ["RE", 4, [0, 4, 8, 12, 16, 1, 5, 9, 13, 17, 2, 6, 10, 14, 18, 3, 7, 11, 15, 19]], ["CA", 3, 4, 14], ["CHR", 2, "shared", [3]], ["CA", 3, 4, 17], ["CHR", 1, "shared", [4]], ["CA", 2, 5, 17], ["CI", 1], ["FU", 6, [0, 1, 2, 3, 4]], ["AN", 6, 0, 5], ["FU", 6, [1, 2, 3, 4, 5]], ["AN", 6, 1, 4], ["FU", 6, [2, 3, 4, 5, 6]], ["AN", 6, 2, 6], ["FU", 4, [0, 1, 2, 3, 4]], ["SP", 4, 0, 48, [1], 1], ["AN", 4, 1, 2], ["FFSP", 4, 0, [5, 4, 3, 2, 1], 1, 1], ["AN", 4, 1, 6], ["FU", 2, [0, 1, 2, 3, 4]], ["SP", 2, 0, 56, [2], 1], ["AN", 2, 1, 2], ["FFSP", 2, 0, [5, 4, 3, 2, 1], 1, 1], ["AN", 2, 1, 6], ["PR", 5, 0, "auto_unroll_max_step$16"]]]], "r": [[0.000325839, 0.00032576, 0.000325734], 0, 6.33706, 1667897318], "v": "v0.6"}
{"i": [["[\"fused_conv3x3\", 1, 14, 14, 16, 16, 3, 3, 64]", "cuda -keys=cuda,gpu -max_num_threads=1024 -model=unknown -thread_warp_size=32", [-1, 16, 64, 49152, 2147483647, 1024, 8, 32], "", 0, []], [[], [["CHW", 3, "local"], ["SP", 3, 0, 1, [1, 1, 1, 1], 1], ["SP", 3, 5, 64, [1, 1, 4, 2], 1], ["SP", 3, 10, 14, [2, 7, 1, 1], 1], ["SP", 3, 15, 14, [1, 7, 1, 1], 1], ["SP", 3, 20, 16, [1, 1, 16, 1], 1], ["SP", 3, 25, 16, [2, 1], 1], ["SP", 3, 28, 3, [1, 3], 1], ["SP", 3, 31, 3, [1, 1], 1], ["RE", 3, [0, 5, 10, 15, 20, 1, 6, 11, 16, 21, 2, 7, 12, 17, 22, 25, 28, 31, 26, 29, 32, 3, 8, 13, 18, 23, 27, 30, 33, 4, 9, 14, 19, 24]], ["FSP", 4, 0, 1, 3], ["FSP", 4, 4, 2, 3], ["FSP", 4, 8, 3, 3], ["FSP", 4, 12, 4, 3], ["FSP", 4, 16, 5, 3], ["RE", 4, [0, 4, 8, 12, 16, 1, 5, 9, 13, 17, 2, 6, 10, 14, 18, 3, 7, 11, 15, 19]], ["CA", 3, 4, 14], ["CHR", 2, "shared", [3]], ["CA", 3, 4, 17], ["CHR", 1, "shared", [4]], ["CA", 2, 5, 17], ["CI", 1], ["FU", 6, [0, 1, 2, 3, 4]], ["AN", 6, 0, 5], ["FU", 6, [1, 2, 3, 4, 5]], ["AN", 6, 1, 4], ["FU", 6, [2, 3, 4, 5, 6]], ["AN", 6, 2, 6], ["FU", 4, [0, 1, 2, 3, 4]], ["SP", 4, 0, 768, [1], 1], ["AN", 4, 1, 2], ["FFSP", 4, 0, [5, 4, 3, 2, 1], 1, 1], ["AN", 4, 1, 6], ["FU", 2, [0, 1, 2, 3, 4]], ["SP", 2, 0, 144, [1], 1], ["AN", 2, 1, 2], ["FFSP", 2, 0, [5, 4, 3, 2, 1], 1, 1], ["AN", 2, 1, 6], ["PR", 5, 0, "auto_unroll_max_step$512"]]]], "r": [[0.00021849, 0.000218536, 0.000218317], 0, 9.28239, 1667897320], "v": "v0.6"}
{"i": [["[\"fused_conv3x3\", 1, 14, 14, 16, 16, 3, 3, 64]", "cuda -keys=cuda,gpu -max_num_threads=1024 -model=unknown -thread_warp_size=32", [-1, 16, 64, 49152, 2147483647, 1024, 8, 32], "", 0, []], [[], [["CHW", 3, "local"], ["SP", 3, 0, 1, [1, 1, 1, 1], 1], ["SP", 3, 5, 64, [1, 4, 1, 4], 1], ["SP", 3, 10, 14, [1, 2, 1, 7], 1], ["SP", 3, 15, 14, [1, 2, 1, 1], 1], ["SP", 3, 20, 16, [2, 2, 1, 1], 1], ["SP", 3, 25, 16, [2, 2], 1], ["SP", 3, 28, 3, [3, 1], 1], ["SP", 3, 31, 3, [1, 1], 1], ["RE", 3, [0, 5, 10, 15, 20, 1, 6, 11, 16, 21, 2, 7, 12, 17, 22, 25, 28, 31, 26, 29, 32, 3, 8, 13, 18, 23, 27, 30, 33, 4, 9, 14, 19, 24]], ["FSP", 4, 0, 1, 3], ["FSP", 4, 4, 2, 3], ["FSP", 4, 8, 3, 3], ["FSP", 4, 12, 4, 3], ["FSP", 4, 16, 5, 3], ["RE", 4, [0, 4, 8, 12, 16, 1, 5, 9, 13, 17, 2, 6, 10, 14, 18, 3, 7, 11, 15, 19]], ["CA", 3, 4, 14], ["CHR", 2, "shared", [3]], ["CA", 3, 4, 17], ["CHR", 1, "shared", [4]], ["CA", 2, 5, 17], ["CI", 1], ["FU", 6, [0, 1, 2, 3, 4]], ["AN", 6, 0, 5], ["FU", 6, [1, 2, 3, 4, 5]], ["AN", 6, 1, 4], ["FU", 6, [2, 3, 4, 5, 6]], ["AN", 6, 2, 6], ["FU", 4, [0, 1, 2, 3, 4]], ["SP", 4, 0, 48, [1], 1], ["AN", 4, 1, 2], ["FFSP", 4, 0, [5, 4, 3, 2, 1], 1, 1], ["AN", 4, 1, 6], ["FU", 2, [0, 1, 2, 3, 4]], ["SP", 2, 0, 112, [1], 1], ["AN", 2, 1, 2], ["FFSP", 2, 0, [5, 4, 3, 2, 1], 1, 1], ["AN", 2, 1, 6], ["PR", 5, 0, "auto_unroll_max_step$64"]]]], "r": [[0.000348531, 0.000348506, 0.000348515], 0, 4.68249, 1667897317], "v": "v0.6"}
{"i": [["[\"fused_conv3x3\", 1, 14, 14, 16, 16, 3, 3, 64]", "cuda -keys=cuda,gpu -max_num_threads=1024 -model=unknown -thread_warp_size=32", [-1, 16, 64, 49152, 2147483647, 1024, 8, 32], "", 0, []], [[], [["CHW", 3, "local"], ["SP", 3, 0, 1, [1, 1, 1, 1], 1], ["SP", 3, 5, 64, [2, 2, 2, 1], 1], ["SP", 3, 10, 14, [1, 1, 7, 2], 1], ["SP", 3, 15, 14, [1, 2, 7, 1], 1], ["SP", 3, 20, 16, [1, 8, 1, 1], 1], ["SP", 3, 25, 16, [2, 1], 1], ["SP", 3, 28, 3, [3, 1], 1], ["SP", 3, 31, 3, [1, 3], 1], ["RE", 3, [0, 5, 10, 15, 20, 1, 6, 11, 16, 21, 2, 7, 12, 17, 22, 25, 28, 31, 26, 29, 32, 3, 8, 13, 18, 23, 27, 30, 33, 4, 9, 14, 19, 24]], ["FSP", 4, 0, 1, 3], ["FSP", 4, 4, 2, 3], ["FSP", 4, 8, 3, 3], ["FSP", 4, 12, 4, 3], ["FSP", 4, 16, 5, 3], ["RE", 4, [0, 4, 8, 12, 16, 1, 5, 9, 13, 17, 2, 6, 10, 14, 18, 3, 7, 11, 15, 19]], ["CA", 3, 4, 14], ["CHR", 2, "shared", [3]], ["CA", 3, 4, 17], ["CHR", 1, "shared", [4]], ["CA", 2, 5, 17], ["CI", 1], ["FU", 6, [0, 1, 2, 3, 4]], ["AN", 6, 0, 5], ["FU", 6, [1, 2, 3, 4, 5]], ["AN", 6, 1, 4], ["FU", 6, [2, 3, 4, 5, 6]], ["AN", 6, 2, 6], ["FU", 4, [0, 1, 2, 3, 4]], ["SP", 4, 0, 36, [2], 1], ["AN", 4, 1, 2], ["FFSP", 4, 0, [5, 4, 3, 2, 1], 1, 1], ["AN", 4, 1, 6], ["FU", 2, [0, 1, 2, 3, 4]], ["SP", 2, 0, 576, [1], 1], ["AN", 2, 1, 2], ["FFSP", 2, 0, [5, 4, 3, 2, 1], 1, 1], ["AN", 2, 1, 6], ["PR", 5, 0, "auto_unroll_max_step$1024"]]]], "r": [[0.000222786, 0.000222726, 0.000222599], 0, 7.94594, 1667897318], "v": "v0.6"}
{"i": [["[\"fused_conv3x3\", 1, 14, 14, 16, 16, 3, 3, 64]", "cuda -keys=cuda,gpu -max_num_threads=1024 -model=unknown -thread_warp_size=32", [-1, 16, 64, 49152, 2147483647, 1024, 8, 32], "", 0, []], [[], [["CHW", 3, "local"], ["SP", 3, 0, 1, [1, 1, 1, 1], 1], ["SP", 3, 5, 64, [1, 1, 1, 1], 1], ["SP", 3, 10, 14, [1, 7, 2, 1], 1], ["SP", 3, 15, 14, [1, 7, 1, 2], 1], ["SP", 3, 20, 16, [4, 1, 1, 4], 1], ["SP", 3, 25, 16, [4, 4], 1], ["SP", 3, 28, 3, [1, 1], 1], ["SP", 3, 31, 3, [1, 1], 1], ["RE", 3, [0, 5, 10, 15, 20, 1, 6, 11, 16, 21, 2, 7, 12, 17, 22, 25, 28, 31, 26, 29, 32, 3, 8, 13, 18, 23, 27, 30, 33, 4, 9, 14, 19, 24]], ["FSP", 4, 0, 1, 3], ["FSP", 4, 4, 2, 3], ["FSP", 4, 8, 3, 3], ["FSP", 4, 12, 4, 3], ["FSP", 4, 16, 5, 3], ["RE", 4, [0, 4, 8, 12, 16, 1, 5, 9, 13, 17, 2, 6, 10, 14, 18, 3, 7, 11, 15, 19]], ["CA", 3, 4, 14], ["CHR", 2, "shared", [3]], ["CA", 3, 4, 17], ["CHR", 1, "shared", [4]], ["CA", 2, 5, 17], ["CI", 1], ["FU", 6, [0, 1, 2, 3, 4]], ["AN", 6, 0, 5], ["FU", 6, [1, 2, 3, 4, 5]], ["AN", 6, 1, 4], ["FU", 6, [2, 3, 4, 5, 6]], ["AN", 6, 2, 6], ["FU", 4, [0, 1, 2, 3, 4]], ["SP", 4, 0, 192, [1], 1], ["AN", 4, 1, 2], ["FFSP", 4, 0, [5, 4, 3, 2, 1], 1, 1], ["AN", 4, 1, 6], ["FU", 2, [0, 1, 2, 3, 4]], ["SP", 2, 0, 256, [1], 1], ["AN", 2, 1, 2], ["FFSP", 2, 0, [5, 4, 3, 2, 1], 1, 1], ["AN", 2, 1, 6], ["PR", 5, 0, "auto_unroll_max_step$512"]]]], "r": [[4.5395e-05, 4.53985e-05, 4.53843e-05], 0, 4.43121, 1667897316], "v": "v0.6"}
{"i": [["[\"fused_conv3x3\", 1, 14, 14, 16, 16, 3, 3, 64]", "cuda -keys=cuda,gpu -max_num_threads=1024 -model=unknown -thread_warp_size=32", [-1, 16, 64, 49152, 2147483647, 1024, 8, 32], "", 0, []], [[], [["CHW", 3, "local"], ["SP", 3, 0, 1, [1, 1, 1, 1], 1], ["SP", 3, 5, 64, [1, 2, 8, 2], 1], ["SP", 3, 10, 14, [1, 1, 7, 1], 1], ["SP", 3, 15, 14, [2, 1, 1, 1], 1], ["SP", 3, 20, 16, [1, 16, 1, 1], 1], ["SP", 3, 25, 16, [1, 4], 1], ["SP", 3, 28, 3, [1, 1], 1], ["SP", 3, 31, 3, [1, 1], 1], ["RE", 3, [0, 5, 10, 15, 20, 1, 6, 11, 16, 21, 2, 7, 12, 17, 22, 25, 28, 31, 26, 29, 32, 3, 8, 13, 18, 23, 27, 30, 33, 4, 9, 14, 19, 24]], ["FSP", 4, 0, 1, 3], ["FSP", 4, 4, 2, 3], ["FSP", 4, 8, 3, 3], ["FSP", 4, 12, 4, 3], ["FSP", 4, 16, 5, 3], ["RE", 4, [0, 4, 8, 12, 16, 1, 5, 9, 13, 17, 2, 6, 10, 14, 18, 3, 7, 11, 15, 19]], ["CA", 3, 4, 14], ["CHR", 2, "shared", [3]], ["CA", 3, 4, 17], ["CHR", 1, "shared", [4]], ["CA", 2, 5, 17], ["CI", 1], ["FU", 6, [0, 1, 2, 3, 4]], ["AN", 6, 0, 5], ["FU", 6, [1, 2, 3, 4, 5]], ["AN", 6, 1, 4], ["FU", 6, [2, 3, 4, 5, 6]], ["AN", 6, 2, 6], ["FU", 4, [0, 1, 2, 3, 4]], ["SP", 4, 0, 192, [1], 1], ["AN", 4, 1, 2], ["FFSP", 4, 0, [5, 4, 3, 2, 1], 1, 1], ["AN", 4, 1, 6], ["FU", 2, [0, 1, 2, 3, 4]], ["SP", 2, 0, 448, [1], 1], ["AN", 2, 1, 2], ["FFSP", 2, 0, [5, 4, 3, 2, 1], 1, 1], ["AN", 2, 1, 6], ["PR", 5, 0, "auto_unroll_max_step$64"]]]], "r": [[0.000217898, 0.000217915, 0.000217789], 0, 9.89992, 1667897321], "v": "v0.6"}
{"i": [["[\"fused_conv3x3\", 1, 14, 14, 16, 16, 3, 3, 64]", "cuda -keys=cuda,gpu -max_num_threads=1024 -model=unknown -thread_warp_size=32", [-1, 16, 64, 49152, 2147483647, 1024, 8, 32], "", 0, []], [[], [["CHW", 3, "local"], ["SP", 3, 0, 1, [1, 1, 1, 1], 1], ["SP", 3, 5, 64, [1, 8, 2, 1], 1], ["SP", 3, 10, 14, [1, 1, 1, 7], 1], ["SP", 3, 15, 14, [1, 14, 1, 1], 1], ["SP", 3, 20, 16, [1, 4, 2, 1], 1], ["SP", 3, 25, 16, [1, 4], 1], ["SP", 3, 28, 3, [1, 1], 1], ["SP", 3, 31, 3, [1, 1], 1], ["RE", 3, [0, 5, 10, 15, 20, 1, 6, 11, 16, 21, 2, 7, 12, 17, 22, 25, 28, 31, 26, 29, 32, 3, 8, 13, 18, 23, 27, 30, 33, 4, 9, 14, 19, 24]], ["FSP", 4, 0, 1, 3], ["FSP", 4, 4, 2, 3], ["FSP", 4, 8, 3, 3], ["FSP", 4, 12, 4, 3], ["FSP", 4, 16, 5, 3], ["RE", 4, [0, 4, 8, 12, 16, 1, 5, 9, 13, 17, 2, 6, 10, 14, 18, 3, 7, 11, 15, 19]], ["CA", 3, 4, 14], ["CHR", 2, "shared", [3]], ["CA", 3, 4, 17], ["CHR", 1, "shared", [4]], ["CA", 2, 5, 17], ["CI", 1], ["FU", 6, [0, 1, 2, 3, 4]], ["AN", 6, 0, 5], ["FU", 6, [1, 2, 3, 4, 5]], ["AN", 6, 1, 4], ["FU", 6, [2, 3, 4, 5, 6]], ["AN", 6, 2, 6], ["FU", 4, [0, 1, 2, 3, 4]], ["SP", 4, 0, 32, [2], 1], ["AN", 4, 1, 2], ["FFSP", 4, 0, [5, 4, 3, 2, 1], 1, 1], ["AN", 4, 1, 6], ["FU", 2, [0, 1, 2, 3, 4]], ["SP", 2, 0, 32, [1], 1], ["AN", 2, 1, 2], ["FFSP", 2, 0, [5, 4, 3, 2, 1], 1, 1], ["AN", 2, 1, 6], ["PR", 5, 0, "auto_unroll_max_step$0"]]]], "r": [[6.75328e-05, 6.75511e-05, 6.75464e-05], 0, 5.01243, 1667897317], "v": "v0.6"}
{"i": [["[\"fused_conv3x3\", 1, 14, 14, 16, 16, 3, 3, 64]", "cuda -keys=cuda,gpu -max_num_threads=1024 -model=unknown -thread_warp_size=32", [-1, 16, 64, 49152, 2147483647, 1024, 8, 32], "", 0, []], [[], [["CHW", 3, "local"], ["SP", 3, 0, 1, [1, 1, 1, 1], 1], ["SP", 3, 5, 64, [1, 1, 1, 2], 1], ["SP", 3, 10, 14, [1, 7, 1, 2], 1], ["SP", 3, 15, 14, [1, 1, 1, 14], 1], ["SP", 3, 20, 16, [1, 2, 8, 1], 1], ["SP", 3, 25, 16, [1, 1], 1], ["SP", 3, 28, 3, [1, 1], 1], ["SP", 3, 31, 3, [1, 1], 1], ["RE", 3, [0, 5, 10, 15, 20, 1, 6, 11, 16, 21, 2, 7, 12, 17, 22, 25, 28, 31, 26, 29, 32, 3, 8, 13, 18, 23, 27, 30, 33, 4, 9, 14, 19, 24]], ["FSP", 4, 0, 1, 3], ["FSP", 4, 4, 2, 3], ["FSP", 4, 8, 3, 3], ["FSP", 4, 12, 4, 3], ["FSP", 4, 16, 5, 3], ["RE", 4, [0, 4, 8, 12, 16, 1, 5, 9, 13, 17, 2, 6, 10, 14, 18, 3, 7, 11, 15, 19]], ["CA", 3, 4, 14], ["CHR", 2, "shared", [3]], ["CA", 3, 4, 17], ["CHR", 1, "shared", [4]], ["CA", 2, 5, 17], ["CI", 1], ["FU", 6, [0, 1, 2, 3, 4]], ["AN", 6, 0, 5], ["FU", 6, [1, 2, 3, 4, 5]], ["AN", 6, 1, 4], ["FU", 6, [2, 3, 4, 5, 6]], ["AN", 6, 2, 6], ["FU", 4, [0, 1, 2, 3, 4]], ["SP", 4, 0, 768, [1], 1], ["AN", 4, 1, 2], ["FFSP", 4, 0, [5, 4, 3, 2, 1], 1, 1], ["AN", 4, 1, 6], ["FU", 2, [0, 1, 2, 3, 4]], ["SP", 2, 0, 512, [1], 1], ["AN", 2, 1, 2], ["FFSP", 2, 0, [5, 4, 3, 2, 1], 1, 1], ["AN", 2, 1, 6], ["PR", 5, 0, "auto_unroll_max_step$0"]]]], "r": [[0.000609742, 0.00060798, 0.000607041], 0, 10.5936, 1667897322], "v": "v0.6"}
{"i": [["[\"fused_conv3x3\", 1, 14, 14, 16, 16, 3, 3, 64]", "cuda -keys=cuda,gpu -max_num_threads=1024 -model=unknown -thread_warp_size=32", [-1, 16, 64, 49152, 2147483647, 1024, 8, 32], "", 0, []], [[], [["CHW", 3, "local"], ["SP", 3, 0, 1, [1, 1, 1, 1], 1], ["SP", 3, 5, 64, [8, 2, 2, 1], 1], ["SP", 3, 10, 14, [1, 7, 1, 2], 1], ["SP", 3, 15, 14, [1, 7, 1, 1], 1], ["SP", 3, 20, 16, [1, 1, 4, 1], 1], ["SP", 3, 25, 16, [1, 2], 1], ["SP", 3, 28, 3, [1, 3], 1], ["SP", 3, 31, 3, [3, 1], 1], ["RE", 3, [0, 5, 10, 15, 20, 1, 6, 11, 16, 21, 2, 7, 12, 17, 22, 25, 28, 31, 26, 29, 32, 3, 8, 13, 18, 23, 27, 30, 33, 4, 9, 14, 19, 24]], ["FSP", 4, 0, 1, 3], ["FSP", 4, 4, 2, 3], ["FSP", 4, 8, 3, 3], ["FSP", 4, 12, 4, 3], ["FSP", 4, 16, 5, 3], ["RE", 4, [0, 4, 8, 12, 16, 1, 5, 9, 13, 17, 2, 6, 10, 14, 18, 3, 7, 11, 15, 19]], ["CA", 3, 4, 14], ["CHR", 2, "shared", [3]], ["CA", 3, 4, 17], ["CHR", 1, "shared", [4]], ["CA", 2, 5, 17], ["CI", 1], ["FU", 6, [0, 1, 2, 3, 4]], ["AN", 6, 0, 5], ["FU", 6, [1, 2, 3, 4, 5]], ["AN", 6, 1, 4], ["FU", 6, [2, 3, 4, 5, 6]], ["AN", 6, 2, 6], ["FU", 4, [0, 1, 2, 3, 4]], ["SP", 4, 0, 144, [1], 1], ["AN", 4, 1, 2], ["FFSP", 4, 0, [5, 4, 3, 2, 1], 1, 1], ["AN", 4, 1, 6], ["FU", 2, [0, 1, 2, 3, 4]], ["SP", 2, 0, 48, [12], 1], ["AN", 2, 1, 2], ["FFSP", 2, 0, [5, 4, 3, 2, 1], 1, 1], ["AN", 2, 1, 6], ["PR", 5, 0, "auto_unroll_max_step$16"]]]], "r": [[0.000270757, 0.000270729, 0.000270851], 0, 9.92308, 1667897322], "v": "v0.6"}
{"i": [["[\"fused_conv3x3\", 1, 14, 14, 16, 16, 3, 3, 64]", "cuda -keys=cuda,gpu -max_num_threads=1024 -model=unknown -thread_warp_size=32", [-1, 16, 64, 49152, 2147483647, 1024, 8, 32], "", 0, []], [[], [["CHW", 3, "local"], ["SP", 3, 0, 1, [1, 1, 1, 1], 1], ["SP", 3, 5, 64, [2, 8, 1, 2], 1], ["SP", 3, 10, 14, [1, 1, 1, 1], 1], ["SP", 3, 15, 14, [1, 7, 2, 1], 1], ["SP", 3, 20, 16, [1, 4, 2, 1], 1], ["SP", 3, 25, 16, [1, 4], 1], ["SP", 3, 28, 3, [1, 1], 1], ["SP", 3, 31, 3, [1, 1], 1], ["RE", 3, [0, 5, 10, 15, 20, 1, 6, 11, 16, 21, 2, 7, 12, 17, 22, 25, 28, 31, 26, 29, 32, 3, 8, 13, 18, 23, 27, 30, 33, 4, 9, 14, 19, 24]], ["FSP", 4, 0, 1, 3], ["FSP", 4, 4, 2, 3], ["FSP", 4, 8, 3, 3], ["FSP", 4, 12, 4, 3], ["FSP", 4, 16, 5, 3], ["RE", 4, [0, 4, 8, 12, 16, 1, 5, 9, 13, 17, 2, 6, 10, 14, 18, 3, 7, 11, 15, 19]], ["CA", 3, 4, 14], ["CHR", 2, "shared", [3]], ["CA", 3, 4, 17], ["CHR", 1, "shared", [4]], ["CA", 2, 5, 17], ["CI", 1], ["FU", 6, [0, 1, 2, 3, 4]], ["AN", 6, 0, 5], ["FU", 6, [1, 2, 3, 4, 5]], ["AN", 6, 1, 4], ["FU", 6, [2, 3, 4, 5, 6]], ["AN", 6, 2, 6], ["FU", 4, [0, 1, 2, 3, 4]], ["SP", 4, 0, 32, [1], 1], ["AN", 4, 1, 2], ["FFSP", 4, 0, [5, 4, 3, 2, 1], 1, 1], ["AN", 4, 1, 6], ["FU", 2, [0, 1, 2, 3, 4]], ["SP", 2, 0, 32, [1], 1], ["AN", 2, 1, 2], ["FFSP", 2, 0, [5, 4, 3, 2, 1], 1, 1], ["AN", 2, 1, 6], ["PR", 5, 0, "auto_unroll_max_step$1024"]]]], "r": [[3.17671e-05, 3.17178e-05, 3.1729e-05], 0, 7.6622, 1667897319], "v": "v0.6"}
{"i": [["[\"fused_conv3x3\", 1, 14, 14, 16, 16, 3, 3, 64]", "cuda -keys=cuda,gpu -max_num_threads=1024 -model=unknown -thread_warp_size=32", [-1, 16, 64, 49152, 2147483647, 1024, 8, 32], "", 0, []], [[], [["CHW", 3, "local"], ["SP", 3, 0, 1, [1, 1, 1, 1], 1], ["SP", 3, 5, 64, [4, 1, 1, 1], 1], ["SP", 3, 10, 14, [1, 7, 1, 1], 1], ["SP", 3, 15, 14, [2, 1, 1, 1], 1], ["SP", 3, 20, 16, [1, 16, 1, 1], 1], ["SP", 3, 25, 16, [4, 4], 1], ["SP", 3, 28, 3, [1, 3], 1], ["SP", 3, 31, 3, [3, 1], 1], ["RE", 3, [0, 5, 10, 15, 20, 1, 6, 11, 16, 21, 2, 7, 12, 17, 22, 25, 28, 31, 26, 29, 32, 3, 8, 13, 18, 23, 27, 30, 33, 4, 9, 14, 19, 24]], ["FSP", 4, 0, 1, 3], ["FSP", 4, 4, 2, 3], ["FSP", 4, 8, 3, 3], ["FSP", 4, 12, 4, 3], ["FSP", 4, 16, 5, 3], ["RE", 4, [0, 4, 8, 12, 16, 1, 5, 9, 13, 17, 2, 6, 10, 14, 18, 3, 7, 11, 15, 19]], ["CA", 3, 4, 14], ["CHR", 2, "shared", [3]], ["CA", 3, 4, 17], ["CHR", 1, "shared", [4]], ["CA", 2, 5, 17], ["CI", 1], ["FU", 6, [0, 1, 2, 3, 4]], ["AN", 6, 0, 5], ["FU", 6, [1, 2, 3, 4, 5]], ["AN", 6, 1, 4], ["FU", 6, [2, 3, 4, 5, 6]], ["AN", 6, 2, 6], ["FU", 4, [0, 1, 2, 3, 4]], ["SP", 4, 0, 144, [1], 1], ["AN", 4, 1, 2], ["FFSP", 4, 0, [5, 4, 3, 2, 1], 1, 1], ["AN", 4, 1, 6], ["FU", 2, [0, 1, 2, 3, 4]], ["SP", 2, 0, 144, [1], 1], ["AN", 2, 1, 2], ["FFSP", 2, 0, [5, 4, 3, 2, 1], 1, 1], ["AN", 2, 1, 6], ["PR", 5, 0, "auto_unroll_max_step$16"]]]], "r": [[2.31878e-05, 2.31782e-05, 2.31695e-05], 0, 8.45642, 1667897321], "v": "v0.6"}
{"i": [["[\"fused_conv3x3\", 1, 14, 14, 16, 16, 3, 3, 64]", "cuda -keys=cuda,gpu -max_num_threads=1024 -model=unknown -thread_warp_size=32", [-1, 16, 64, 49152, 2147483647, 1024, 8, 32], "", 0, []], [[], [["CHW", 3, "local"], ["SP", 3, 0, 1, [1, 1, 1, 1], 1], ["SP", 3, 5, 64, [1, 4, 1, 16], 1], ["SP", 3, 10, 14, [1, 1, 14, 1], 1], ["SP", 3, 15, 14, [1, 1, 2, 1], 1], ["SP", 3, 20, 16, [1, 16, 1, 1], 1], ["SP", 3, 25, 16, [1, 1], 1], ["SP", 3, 28, 3, [1, 3], 1], ["SP", 3, 31, 3, [1, 1], 1], ["RE", 3, [0, 5, 10, 15, 20, 1, 6, 11, 16, 21, 2, 7, 12, 17, 22, 25, 28, 31, 26, 29, 32, 3, 8, 13, 18, 23, 27, 30, 33, 4, 9, 14, 19, 24]], ["FSP", 4, 0, 1, 3], ["FSP", 4, 4, 2, 3], ["FSP", 4, 8, 3, 3], ["FSP", 4, 12, 4, 3], ["FSP", 4, 16, 5, 3], ["RE", 4, [0, 4, 8, 12, 16, 1, 5, 9, 13, 17, 2, 6, 10, 14, 18, 3, 7, 11, 15, 19]], ["CA", 3, 4, 14], ["CHR", 2, "shared", [3]], ["CA", 3, 4, 17], ["CHR", 1, "shared", [4]], ["CA", 2, 5, 17], ["CI", 1], ["FU", 6, [0, 1, 2, 3, 4]], ["AN", 6, 0, 5], ["FU", 6, [1, 2, 3, 4, 5]], ["AN", 6, 1, 4], ["FU", 6, [2, 3, 4, 5, 6]], ["AN", 6, 2, 6], ["FU", 4, [0, 1, 2, 3, 4]], ["SP", 4, 0, 144, [1], 1], ["AN", 4, 1, 2], ["FFSP", 4, 0, [5, 4, 3, 2, 1], 1, 1], ["AN", 4, 1, 6], ["FU", 2, [0, 1, 2, 3, 4]], ["SP", 2, 0, 256, [1], 1], ["AN", 2, 1, 2], ["FFSP", 2, 0, [5, 4, 3, 2, 1], 1, 1], ["AN", 2, 1, 6], ["PR", 5, 0, "auto_unroll_max_step$1024"]]]], "r": [[0.000475775, 0.000475941, 0.000475699], 0, 4.66671, 1667966612], "v": "v0.6"}
{"i": [["[\"fused_conv3x3\", 1, 14, 14, 16, 16, 3, 3, 64]", "cuda -keys=cuda,gpu -max_num_threads=1024 -model=unknown -thread_warp_size=32", [-1, 16, 64, 49152, 2147483647, 1024, 8, 32], "", 0, []], [[], [["CHW", 3, "local"], ["SP", 3, 0, 1, [1, 1, 1, 1], 1], ["SP", 3, 5, 64, [1, 1, 1, 4], 1], ["SP", 3, 10, 14, [1, 7, 1, 1], 1], ["SP", 3, 15, 14, [1, 14, 1, 1], 1], ["SP", 3, 20, 16, [4, 4, 1, 1], 1], ["SP", 3, 25, 16, [2, 2], 1], ["SP", 3, 28, 3, [3, 1], 1], ["SP", 3, 31, 3, [1, 1], 1], ["RE", 3, [0, 5, 10, 15, 20, 1, 6, 11, 16, 21, 2, 7, 12, 17, 22, 25, 28, 31, 26, 29, 32, 3, 8, 13, 18, 23, 27, 30, 33, 4, 9, 14, 19, 24]], ["FSP", 4, 0, 1, 3], ["FSP", 4, 4, 2, 3], ["FSP", 4, 8, 3, 3], ["FSP", 4, 12, 4, 3], ["FSP", 4, 16, 5, 3], ["RE", 4, [0, 4, 8, 12, 16, 1, 5, 9, 13, 17, 2, 6, 10, 14, 18, 3, 7, 11, 15, 19]], ["CA", 3, 4, 14], ["CHR", 2, "shared", [3]], ["CA", 3, 4, 17], ["CHR", 1, "shared", [4]], ["CA", 2, 5, 17], ["CI", 1], ["FU", 6, [0, 1, 2, 3, 4]], ["AN", 6, 0, 5], ["FU", 6, [1, 2, 3, 4, 5]], ["AN", 6, 1, 4], ["FU", 6, [2, 3, 4, 5, 6]], ["AN", 6, 2, 6], ["FU", 4, [0, 1, 2, 3, 4]], ["SP", 4, 0, 144, [1], 1], ["AN", 4, 1, 2], ["FFSP", 4, 0, [5, 4, 3, 2, 1], 1, 1], ["AN", 4, 1, 6], ["FU", 2, [0, 1, 2, 3, 4]], ["SP", 2, 0, 144, [1], 1], ["AN", 2, 1, 2], ["FFSP", 2, 0, [5, 4, 3, 2, 1], 1, 1], ["AN", 2, 1, 6], ["PR", 5, 0, "auto_unroll_max_step$1024"]]]], "r": [[4.21938e-05, 4.2187e-05, 4.2182e-05], 0, 6.06612, 1667966612], "v": "v0.6"}
{"i": [["[\"fused_conv3x3\", 1, 14, 14, 16, 16, 3, 3, 64]", "cuda -keys=cuda,gpu -max_num_threads=1024 -model=unknown -thread_warp_size=32", [-1, 16, 64, 49152, 2147483647, 1024, 8, 32], "", 0, []], [[], [["CHW", 3, "local"], ["SP", 3, 0, 1, [1, 1, 1, 1], 1], ["SP", 3, 5, 64, [1, 2, 2, 1], 1], ["SP", 3, 10, 14, [7, 1, 1, 1], 1], ["SP", 3, 15, 14, [1, 7, 2, 1], 1], ["SP", 3, 20, 16, [1, 4, 1, 1], 1], ["SP", 3, 25, 16, [8, 1], 1], ["SP", 3, 28, 3, [1, 1], 1], ["SP", 3, 31, 3, [1, 3], 1], ["RE", 3, [0, 5, 10, 15, 20, 1, 6, 11, 16, 21, 2, 7, 12, 17, 22, 25, 28, 31, 26, 29, 32, 3, 8, 13, 18, 23, 27, 30, 33, 4, 9, 14, 19, 24]], ["FSP", 4, 0, 1, 3], ["FSP", 4, 4, 2, 3], ["FSP", 4, 8, 3, 3], ["FSP", 4, 12, 4, 3], ["FSP", 4, 16, 5, 3], ["RE", 4, [0, 4, 8, 12, 16, 1, 5, 9, 13, 17, 2, 6, 10, 14, 18, 3, 7, 11, 15, 19]], ["CA", 3, 4, 14], ["CHR", 2, "shared", [3]], ["CA", 3, 4, 17], ["CHR", 1, "shared", [4]], ["CA", 2, 5, 17], ["CI", 1], ["FU", 6, [0, 1, 2, 3, 4]], ["AN", 6, 0, 5], ["FU", 6, [1, 2, 3, 4, 5]], ["AN", 6, 1, 4], ["FU", 6, [2, 3, 4, 5, 6]], ["AN", 6, 2, 6], ["FU", 4, [0, 1, 2, 3, 4]], ["SP", 4, 0, 48, [1], 1], ["AN", 4, 1, 2], ["FFSP", 4, 0, [5, 4, 3, 2, 1], 1, 1], ["AN", 4, 1, 6], ["FU", 2, [0, 1, 2, 3, 4]], ["SP", 2, 0, 32, [32], 1], ["AN", 2, 1, 2], ["FFSP", 2, 0, [5, 4, 3, 2, 1], 1, 1], ["AN", 2, 1, 6], ["PR", 5, 0, "auto_unroll_max_step$512"]]]], "r": [[7.49278e-05, 7.49352e-05, 7.49598e-05], 0, 4.68485, 1667966611], "v": "v0.6"}
{"i": [["[\"fused_conv3x3\", 1, 14, 14, 16, 16, 3, 3, 64]", "cuda -keys=cuda,gpu -max_num_threads=1024 -model=unknown -thread_warp_size=32", [-1, 16, 64, 49152, 2147483647, 1024, 8, 32], "", 0, []], [[], [["CHW", 3, "local"], ["SP", 3, 0, 1, [1, 1, 1, 1], 1], ["SP", 3, 5, 64, [2, 1, 1, 4], 1], ["SP", 3, 10, 14, [1, 7, 1, 1], 1], ["SP", 3, 15, 14, [1, 7, 1, 1], 1], ["SP", 3, 20, 16, [1, 2, 1, 4], 1], ["SP", 3, 25, 16, [1, 4], 1], ["SP", 3, 28, 3, [3, 1], 1], ["SP", 3, 31, 3, [1, 3], 1], ["RE", 3, [0, 5, 10, 15, 20, 1, 6, 11, 16, 21, 2, 7, 12, 17, 22, 25, 28, 31, 26, 29, 32, 3, 8, 13, 18, 23, 27, 30, 33, 4, 9, 14, 19, 24]], ["FSP", 4, 0, 1, 3], ["FSP", 4, 4, 2, 3], ["FSP", 4, 8, 3, 3], ["FSP", 4, 12, 4, 3], ["FSP", 4, 16, 5, 3], ["RE", 4, [0, 4, 8, 12, 16, 1, 5, 9, 13, 17, 2, 6, 10, 14, 18, 3, 7, 11, 15, 19]], ["CA", 3, 4, 14], ["CHR", 2, "shared", [3]], ["CA", 3, 4, 17], ["CHR", 1, "shared", [4]], ["CA", 2, 5, 17], ["CI", 1], ["FU", 6, [0, 1, 2, 3, 4]], ["AN", 6, 0, 5], ["FU", 6, [1, 2, 3, 4, 5]], ["AN", 6, 1, 4], ["FU", 6, [2, 3, 4, 5, 6]], ["AN", 6, 2, 6], ["FU", 4, [0, 1, 2, 3, 4]], ["SP", 4, 0, 576, [1], 1], ["AN", 4, 1, 2], ["FFSP", 4, 0, [5, 4, 3, 2, 1], 1, 1], ["AN", 4, 1, 6], ["FU", 2, [0, 1, 2, 3, 4]], ["SP", 2, 0, 144, [1], 1], ["AN", 2, 1, 2], ["FFSP", 2, 0, [5, 4, 3, 2, 1], 1, 1], ["AN", 2, 1, 6], ["PR", 5, 0, "auto_unroll_max_step$0"]]]], "r": [[4.7619e-05, 4.76673e-05, 4.76145e-05], 0, 5.77759, 1667966613], "v": "v0.6"}
{"i": [["[\"fused_conv3x3\", 1, 14, 14, 16, 16, 3, 3, 64]", "cuda -keys=cuda,gpu -max_num_threads=1024 -model=unknown -thread_warp_size=32", [-1, 16, 64, 49152, 2147483647, 1024, 8, 32], "", 0, []], [[], [["CHW", 3, "local"], ["SP", 3, 0, 1, [1, 1, 1, 1], 1], ["SP", 3, 5, 64, [2, 2, 2, 1], 1], ["SP", 3, 10, 14, [1, 7, 1, 2], 1], ["SP", 3, 15, 14, [1, 14, 1, 1], 1], ["SP", 3, 20, 16, [2, 1, 1, 2], 1], ["SP", 3, 25, 16, [1, 2], 1], ["SP", 3, 28, 3, [1, 1], 1], ["SP", 3, 31, 3, [1, 3], 1], ["RE", 3, [0, 5, 10, 15, 20, 1, 6, 11, 16, 21, 2, 7, 12, 17, 22, 25, 28, 31, 26, 29, 32, 3, 8, 13, 18, 23, 27, 30, 33, 4, 9, 14, 19, 24]], ["FSP", 4, 0, 1, 3], ["FSP", 4, 4, 2, 3], ["FSP", 4, 8, 3, 3], ["FSP", 4, 12, 4, 3], ["FSP", 4, 16, 5, 3], ["RE", 4, [0, 4, 8, 12, 16, 1, 5, 9, 13, 17, 2, 6, 10, 14, 18, 3, 7, 11, 15, 19]], ["CA", 3, 4, 14], ["CHR", 2, "shared", [3]], ["CA", 3, 4, 17], ["CHR", 1, "shared", [4]], ["CA", 2, 5, 17], ["CI", 1], ["FU", 6, [0, 1, 2, 3, 4]], ["AN", 6, 0, 5], ["FU", 6, [1, 2, 3, 4, 5]], ["AN", 6, 1, 4], ["FU", 6, [2, 3, 4, 5, 6]], ["AN", 6, 2, 6], ["FU", 4, [0, 1, 2, 3, 4]], ["SP", 4, 0, 72, [4], 1], ["AN", 4, 1, 2], ["FFSP", 4, 0, [5, 4, 3, 2, 1], 1, 1], ["AN", 4, 1, 6], ["FU", 2, [0, 1, 2, 3, 4]], ["SP", 2, 0, 48, [1], 1], ["AN", 2, 1, 2], ["FFSP", 2, 0, [5, 4, 3, 2, 1], 1, 1], ["AN", 2, 1, 6], ["PR", 5, 0, "auto_unroll_max_step$16"]]]], "r": [[4.34924e-05, 4.34643e-05, 4.34578e-05], 0, 2.11419, 1667966609], "v": "v0.6"}
{"i": [["[\"fused_conv3x3\", 1, 14, 14, 16, 16, 3, 3, 64]", "cuda -keys=cuda,gpu -max_num_threads=1024 -model=unknown -thread_warp_size=32", [-1, 16, 64, 49152, 2147483647, 1024, 8, 32], "", 0, []], [[], [["CHW", 3, "local"], ["SP", 3, 0, 1, [1, 1, 1, 1], 1], ["SP", 3, 5, 64, [1, 8, 1, 1], 1], ["SP", 3, 10, 14, [1, 2, 7, 1], 1], ["SP", 3, 15, 14, [2, 1, 7, 1], 1], ["SP", 3, 20, 16, [1, 1, 1, 4], 1], ["SP", 3, 25, 16, [2, 2], 1], ["SP", 3, 28, 3, [3, 1], 1], ["SP", 3, 31, 3, [3, 1], 1], ["RE", 3, [0, 5, 10, 15, 20, 1, 6, 11, 16, 21, 2, 7, 12, 17, 22, 25, 28, 31, 26, 29, 32, 3, 8, 13, 18, 23, 27, 30, 33, 4, 9, 14, 19, 24]], ["FSP", 4, 0, 1, 3], ["FSP", 4, 4, 2, 3], ["FSP", 4, 8, 3, 3], ["FSP", 4, 12, 4, 3], ["FSP", 4, 16, 5, 3], ["RE", 4, [0, 4, 8, 12, 16, 1, 5, 9, 13, 17, 2, 6, 10, 14, 18, 3, 7, 11, 15, 19]], ["CA", 3, 4, 14], ["CHR", 2, "shared", [3]], ["CA", 3, 4, 17], ["CHR", 1, "shared", [4]], ["CA", 2, 5, 17], ["CI", 1], ["FU", 6, [0, 1, 2, 3, 4]], ["AN", 6, 0, 5], ["FU", 6, [1, 2, 3, 4, 5]], ["AN", 6, 1, 4], ["FU", 6, [2, 3, 4, 5, 6]], ["AN", 6, 2, 6], ["FU", 4, [0, 1, 2, 3, 4]], ["SP", 4, 0, 144, [1], 1], ["AN", 4, 1, 2], ["FFSP", 4, 0, [5, 4, 3, 2, 1], 1, 1], ["AN", 4, 1, 6], ["FU", 2, [0, 1, 2, 3, 4]], ["SP", 2, 0, 108, [1], 1], ["AN", 2, 1, 2], ["FFSP", 2, 0, [5, 4, 3, 2, 1], 1, 1], ["AN", 2, 1, 6], ["PR", 5, 0, "auto_unroll_max_step$0"]]]], "r": [[0.00067006, 0.000670202, 0.000670001], 0, 10.199, 1667966617], "v": "v0.6"}
{"i": [["[\"fused_conv3x3\", 1, 14, 14, 16, 16, 3, 3, 64]", "cuda -keys=cuda,gpu -max_num_threads=1024 -model=unknown -thread_warp_size=32", [-1, 16, 64, 49152, 2147483647, 1024, 8, 32], "", 0, []], [[], [["CHW", 3, "local"], ["SP", 3, 0, 1, [1, 1, 1, 1], 1], ["SP", 3, 5, 64, [2, 1, 4, 1], 1], ["SP", 3, 10, 14, [1, 7, 1, 2], 1], ["SP", 3, 15, 14, [1, 7, 1, 1], 1], ["SP", 3, 20, 16, [1, 8, 2, 1], 1], ["SP", 3, 25, 16, [2, 4], 1], ["SP", 3, 28, 3, [1, 1], 1], ["SP", 3, 31, 3, [1, 1], 1], ["RE", 3, [0, 5, 10, 15, 20, 1, 6, 11, 16, 21, 2, 7, 12, 17, 22, 25, 28, 31, 26, 29, 32, 3, 8, 13, 18, 23, 27, 30, 33, 4, 9, 14, 19, 24]], ["FSP", 4, 0, 1, 3], ["FSP", 4, 4, 2, 3], ["FSP", 4, 8, 3, 3], ["FSP", 4, 12, 4, 3], ["FSP", 4, 16, 5, 3], ["RE", 4, [0, 4, 8, 12, 16, 1, 5, 9, 13, 17, 2, 6, 10, 14, 18, 3, 7, 11, 15, 19]], ["CA", 3, 4, 14], ["CHR", 2, "shared", [3]], ["CA", 3, 4, 17], ["CHR", 1, "shared", [4]], ["CA", 2, 5, 17], ["CI", 1], ["FU", 6, [0, 1, 2, 3, 4]], ["AN", 6, 0, 5], ["FU", 6, [1, 2, 3, 4, 5]], ["AN", 6, 1, 4], ["FU", 6, [2, 3, 4, 5, 6]], ["AN", 6, 2, 6], ["FU", 4, [0, 1, 2, 3, 4]], ["SP", 4, 0, 192, [1], 1], ["AN", 4, 1, 2], ["FFSP", 4, 0, [5, 4, 3, 2, 1], 1, 1], ["AN", 4, 1, 6], ["FU", 2, [0, 1, 2, 3, 4]], ["SP", 2, 0, 64, [1], 1], ["AN", 2, 1, 2], ["FFSP", 2, 0, [5, 4, 3, 2, 1], 1, 1], ["AN", 2, 1, 6], ["PR", 5, 0, "auto_unroll_max_step$512"]]]], "r": [[5.49278e-05, 5.4888e-05, 5.48952e-05], 0, 2.86797, 1667966610], "v": "v0.6"}
{"i": [["[\"fused_conv3x3\", 1, 14, 14, 16, 16, 3, 3, 64]", "cuda -keys=cuda,gpu -max_num_threads=1024 -model=unknown -thread_warp_size=32", [-1, 16, 64, 49152, 2147483647, 1024, 8, 32], "", 0, []], [[], [["CHW", 3, "local"], ["SP", 3, 0, 1, [1, 1, 1, 1], 1], ["SP", 3, 5, 64, [1, 2, 4, 1], 1], ["SP", 3, 10, 14, [2, 7, 1, 1], 1], ["SP", 3, 15, 14, [1, 2, 1, 1], 1], ["SP", 3, 20, 16, [1, 2, 1, 8], 1], ["SP", 3, 25, 16, [1, 8], 1], ["SP", 3, 28, 3, [1, 1], 1], ["SP", 3, 31, 3, [1, 1], 1], ["RE", 3, [0, 5, 10, 15, 20, 1, 6, 11, 16, 21, 2, 7, 12, 17, 22, 25, 28, 31, 26, 29, 32, 3, 8, 13, 18, 23, 27, 30, 33, 4, 9, 14, 19, 24]], ["FSP", 4, 0, 1, 3], ["FSP", 4, 4, 2, 3], ["FSP", 4, 8, 3, 3], ["FSP", 4, 12, 4, 3], ["FSP", 4, 16, 5, 3], ["RE", 4, [0, 4, 8, 12, 16, 1, 5, 9, 13, 17, 2, 6, 10, 14, 18, 3, 7, 11, 15, 19]], ["CA", 3, 4, 14], ["CHR", 2, "shared", [3]], ["CA", 3, 4, 17], ["CHR", 1, "shared", [4]], ["CA", 2, 5, 17], ["CI", 1], ["FU", 6, [0, 1, 2, 3, 4]], ["AN", 6, 0, 5], ["FU", 6, [1, 2, 3, 4, 5]], ["AN", 6, 1, 4], ["FU", 6, [2, 3, 4, 5, 6]], ["AN", 6, 2, 6], ["FU", 4, [0, 1, 2, 3, 4]], ["SP", 4, 0, 768, [1], 1], ["AN", 4, 1, 2], ["FFSP", 4, 0, [5, 4, 3, 2, 1], 1, 1], ["AN", 4, 1, 6], ["FU", 2, [0, 1, 2, 3, 4]], ["SP", 2, 0, 32, [2], 1], ["AN", 2, 1, 2], ["FFSP", 2, 0, [5, 4, 3, 2, 1], 1, 1], ["AN", 2, 1, 6], ["PR", 5, 0, "auto_unroll_max_step$0"]]]], "r": [[9.70905e-05, 9.70818e-05, 9.70576e-05], 0, 3.61233, 1667966611], "v": "v0.6"}
{"i": [["[\"fused_conv3x3\", 1, 14, 14, 16, 16, 3, 3, 64]", "cuda -keys=cuda,gpu -max_num_threads=1024 -model=unknown -thread_warp_size=32", [-1, 16, 64, 49152, 2147483647, 1024, 8, 32], "", 0, []], [[], [["CHW", 3, "local"], ["SP", 3, 0, 1, [1, 1, 1, 1], 1], ["SP", 3, 5, 64, [1, 32, 1, 2], 1], ["SP", 3, 10, 14, [1, 2, 1, 7], 1], ["SP", 3, 15, 14, [1, 2, 1, 1], 1], ["SP", 3, 20, 16, [1, 4, 1, 2], 1], ["SP", 3, 25, 16, [1, 1], 1], ["SP", 3, 28, 3, [1, 1], 1], ["SP", 3, 31, 3, [3, 1], 1], ["RE", 3, [0, 5, 10, 15, 20, 1, 6, 11, 16, 21, 2, 7, 12, 17, 22, 25, 28, 31, 26, 29, 32, 3, 8, 13, 18, 23, 27, 30, 33, 4, 9, 14, 19, 24]], ["FSP", 4, 0, 1, 3], ["FSP", 4, 4, 2, 3], ["FSP", 4, 8, 3, 3], ["FSP", 4, 12, 4, 3], ["FSP", 4, 16, 5, 3], ["RE", 4, [0, 4, 8, 12, 16, 1, 5, 9, 13, 17, 2, 6, 10, 14, 18, 3, 7, 11, 15, 19]], ["CA", 3, 4, 14], ["CHR", 2, "shared", [3]], ["CA", 3, 4, 17], ["CHR", 1, "shared", [4]], ["CA", 2, 5, 17], ["CI", 1], ["FU", 6, [0, 1, 2, 3, 4]], ["AN", 6, 0, 5], ["FU", 6, [1, 2, 3, 4, 5]], ["AN", 6, 1, 4], ["FU", 6, [2, 3, 4, 5, 6]], ["AN", 6, 2, 6], ["FU", 4, [0, 1, 2, 3, 4]], ["SP", 4, 0, 24, [1], 1], ["AN", 4, 1, 2], ["FFSP", 4, 0, [5, 4, 3, 2, 1], 1, 1], ["AN", 4, 1, 6], ["FU", 2, [0, 1, 2, 3, 4]], ["SP", 2, 0, 14, [1], 1], ["AN", 2, 1, 2], ["FFSP", 2, 0, [5, 4, 3, 2, 1], 1, 1], ["AN", 2, 1, 6], ["PR", 5, 0, "auto_unroll_max_step$64"]]]], "r": [[9.99721e-05, 9.99492e-05, 9.99482e-05], 0, 1.58996, 1667966609], "v": "v0.6"}
{"i": [["[\"fused_conv3x3\", 1, 14, 14, 16, 16, 3, 3, 64]", "cuda -keys=cuda,gpu -max_num_threads=1024 -model=unknown -thread_warp_size=32", [-1, 16, 64, 49152, 2147483647, 1024, 8, 32], "", 0, []], [[], [["CHW", 3, "local"], ["SP", 3, 0, 1, [1, 1, 1, 1], 1], ["SP", 3, 5, 64, [1, 1, 8, 1], 1], ["SP", 3, 10, 14, [1, 7, 1, 1], 1], ["SP", 3, 15, 14, [1, 1, 1, 2], 1], ["SP", 3, 20, 16, [1, 4, 2, 1], 1], ["SP", 3, 25, 16, [1, 1], 1], ["SP", 3, 28, 3, [1, 3], 1], ["SP", 3, 31, 3, [3, 1], 1], ["RE", 3, [0, 5, 10, 15, 20, 1, 6, 11, 16, 21, 2, 7, 12, 17, 22, 25, 28, 31, 26, 29, 32, 3, 8, 13, 18, 23, 27, 30, 33, 4, 9, 14, 19, 24]], ["FSP", 4, 0, 1, 3], ["FSP", 4, 4, 2, 3], ["FSP", 4, 8, 3, 3], ["FSP", 4, 12, 4, 3], ["FSP", 4, 16, 5, 3], ["RE", 4, [0, 4, 8, 12, 16, 1, 5, 9, 13, 17, 2, 6, 10, 14, 18, 3, 7, 11, 15, 19]], ["CA", 3, 4, 14], ["CHR", 2, "shared", [3]], ["CA", 3, 4, 17], ["CHR", 1, "shared", [4]], ["CA", 2, 5, 17], ["CI", 1], ["FU", 6, [0, 1, 2, 3, 4]], ["AN", 6, 0, 5], ["FU", 6, [1, 2, 3, 4, 5]], ["AN", 6, 1, 4], ["FU", 6, [2, 3, 4, 5, 6]], ["AN", 6, 2, 6], ["FU", 4, [0, 1, 2, 3, 4]], ["SP", 4, 0, 18, [1], 1], ["AN", 4, 1, 2], ["FFSP", 4, 0, [5, 4, 3, 2, 1], 1, 1], ["AN", 4, 1, 6], ["FU", 2, [0, 1, 2, 3, 4]], ["SP", 2, 0, 12, [1], 1], ["AN", 2, 1, 2], ["FFSP", 2, 0, [5, 4, 3, 2, 1], 1, 1], ["AN", 2, 1, 6], ["PR", 5, 0, "auto_unroll_max_step$512"]]]], "r": [[2.8335e-05, 2.833e-05, 2.83348e-05], 0, 7.11948, 1667966614], "v": "v0.6"}
{"i": [["[\"fused_conv3x3\", 1, 14, 14, 16, 16, 3, 3, 64]", "cuda -keys=cuda,gpu -max_num_threads=1024 -model=unknown -thread_warp_size=32", [-1, 16, 64, 49152, 2147483647, 1024, 8, 32], "", 0, []], [[], [["CHW", 3, "local"], ["SP", 3, 0, 1, [1, 1, 1, 1], 1], ["SP", 3, 5, 64, [2, 1, 1, 1], 1], ["SP", 3, 10, 14, [2, 1, 1, 1], 1], ["SP", 3, 15, 14, [1, 1, 1, 1], 1], ["SP", 3, 20, 16, [1, 8, 1, 1], 1], ["SP", 3, 25, 16, [8, 1], 1], ["SP", 3, 28, 3, [3, 1], 1], ["SP", 3, 31, 3, [1, 3], 1], ["RE", 3, [0, 5, 10, 15, 20, 1, 6, 11, 16, 21, 2, 7, 12, 17, 22, 25, 28, 31, 26, 29, 32, 3, 8, 13, 18, 23, 27, 30, 33, 4, 9, 14, 19, 24]], ["FSP", 4, 0, 1, 3], ["FSP", 4, 4, 2, 3], ["FSP", 4, 8, 3, 3], ["FSP", 4, 12, 4, 3], ["FSP", 4, 16, 5, 3], ["RE", 4, [0, 4, 8, 12, 16, 1, 5, 9, 13, 17, 2, 6, 10, 14, 18, 3, 7, 11, 15, 19]], ["CA", 3, 4, 14], ["CHR", 2, "shared", [3]], ["CA", 3, 4, 17], ["CHR", 1, "shared", [4]], ["CA", 2, 5, 17], ["CI", 1], ["FU", 6, [0, 1, 2, 3, 4]], ["AN", 6, 0, 5], ["FU", 6, [1, 2, 3, 4, 5]], ["AN", 6, 1, 4], ["FU", 6, [2, 3, 4, 5, 6]], ["AN", 6, 2, 6], ["FU", 4, [0, 1, 2, 3, 4]], ["SP", 4, 0, 72, [1], 1], ["AN", 4, 1, 2], ["FFSP", 4, 0, [5, 4, 3, 2, 1], 1, 1], ["AN", 4, 1, 6], ["FU", 2, [0, 1, 2, 3, 4]], ["SP", 2, 0, 216, [1], 1], ["AN", 2, 1, 2], ["FFSP", 2, 0, [5, 4, 3, 2, 1], 1, 1], ["AN", 2, 1, 6], ["PR", 5, 0, "auto_unroll_max_step$512"]]]], "r": [[5.37001e-05, 5.3685e-05, 5.36595e-05], 0, 6.15152, 1667966613], "v": "v0.6"}
{"i": [["[\"fused_conv3x3\", 1, 14, 14, 16, 16, 3, 3, 64]", "cuda -keys=cuda,gpu -max_num_threads=1024 -model=unknown -thread_warp_size=32", [-1, 16, 64, 49152, 2147483647, 1024, 8, 32], "", 0, []], [[], [["CHW", 3, "local"], ["SP", 3, 0, 1, [1, 1, 1, 1], 1], ["SP", 3, 5, 64, [2, 8, 1, 1], 1], ["SP", 3, 10, 14, [1, 1, 1, 1], 1], ["SP", 3, 15, 14, [2, 7, 1, 1], 1], ["SP", 3, 20, 16, [2, 4, 2, 1], 1], ["SP", 3, 25, 16, [2, 2], 1], ["SP", 3, 28, 3, [1, 1], 1], ["SP", 3, 31, 3, [1, 3], 1], ["RE", 3, [0, 5, 10, 15, 20, 1, 6, 11, 16, 21, 2, 7, 12, 17, 22, 25, 28, 31, 26, 29, 32, 3, 8, 13, 18, 23, 27, 30, 33, 4, 9, 14, 19, 24]], ["FSP", 4, 0, 1, 3], ["FSP", 4, 4, 2, 3], ["FSP", 4, 8, 3, 3], ["FSP", 4, 12, 4, 3], ["FSP", 4, 16, 5, 3], ["RE", 4, [0, 4, 8, 12, 16, 1, 5, 9, 13, 17, 2, 6, 10, 14, 18, 3, 7, 11, 15, 19]], ["CA", 3, 4, 14], ["CHR", 2, "shared", [3]], ["CA", 3, 4, 17], ["CHR", 1, "shared", [4]], ["CA", 2, 5, 17], ["CI", 1], ["FU", 6, [0, 1, 2, 3, 4]], ["AN", 6, 0, 5], ["FU", 6, [1, 2, 3, 4, 5]], ["AN", 6, 1, 4], ["FU", 6, [2, 3, 4, 5, 6]], ["AN", 6, 2, 6], ["FU", 4, [0, 1, 2, 3, 4]], ["SP", 4, 0, 24, [1], 1], ["AN", 4, 1, 2], ["FFSP", 4, 0, [5, 4, 3, 2, 1], 1, 1], ["AN", 4, 1, 6], ["FU", 2, [0, 1, 2, 3, 4]], ["SP", 2, 0, 8, [8], 1], ["AN", 2, 1, 2], ["FFSP", 2, 0, [5, 4, 3, 2, 1], 1, 1], ["AN", 2, 1, 6], ["PR", 5, 0, "auto_unroll_max_step$512"]]]], "r": [[2.95658e-05, 2.95517e-05, 2.95488e-05], 0, 8.83355, 1667966616], "v": "v0.6"}
{"i": [["[\"fused_conv3x3\", 1, 14, 14, 16, 16, 3, 3, 64]", "cuda -keys=cuda,gpu -max_num_threads=1024 -model=unknown -thread_warp_size=32", [-1, 16, 64, 49152, 2147483647, 1024, 8, 32], "", 0, []], [[], [["CHW", 3, "local"], ["SP", 3, 0, 1, [1, 1, 1, 1], 1], ["SP", 3, 5, 64, [1, 4, 2, 2], 1], ["SP", 3, 10, 14, [14, 1, 1, 1], 1], ["SP", 3, 15, 14, [1, 14, 1, 1], 1], ["SP", 3, 20, 16, [1, 4, 2, 2], 1], ["SP", 3, 25, 16, [1, 1], 1], ["SP", 3, 28, 3, [1, 1], 1], ["SP", 3, 31, 3, [1, 1], 1], ["RE", 3, [0, 5, 10, 15, 20, 1, 6, 11, 16, 21, 2, 7, 12, 17, 22, 25, 28, 31, 26, 29, 32, 3, 8, 13, 18, 23, 27, 30, 33, 4, 9, 14, 19, 24]], ["FSP", 4, 0, 1, 3], ["FSP", 4, 4, 2, 3], ["FSP", 4, 8, 3, 3], ["FSP", 4, 12, 4, 3], ["FSP", 4, 16, 5, 3], ["RE", 4, [0, 4, 8, 12, 16, 1, 5, 9, 13, 17, 2, 6, 10, 14, 18, 3, 7, 11, 15, 19]], ["CA", 3, 4, 14], ["CHR", 2, "shared", [3]], ["CA", 3, 4, 17], ["CHR", 1, "shared", [4]], ["CA", 2, 5, 17], ["CI", 1], ["FU", 6, [0, 1, 2, 3, 4]], ["AN", 6, 0, 5], ["FU", 6, [1, 2, 3, 4, 5]], ["AN", 6, 1, 4], ["FU", 6, [2, 3, 4, 5, 6]], ["AN", 6, 2, 6], ["FU", 4, [0, 1, 2, 3, 4]], ["SP", 4, 0, 48, [1], 1], ["AN", 4, 1, 2], ["FFSP", 4, 0, [5, 4, 3, 2, 1], 1, 1], ["AN", 4, 1, 6], ["FU", 2, [0, 1, 2, 3, 4]], ["SP", 2, 0, 16, [1], 1], ["AN", 2, 1, 2], ["FFSP", 2, 0, [5, 4, 3, 2, 1], 1, 1], ["AN", 2, 1, 6], ["PR", 5, 0, "auto_unroll_max_step$16"]]]], "r": [[0.0023656, 0.00236427, 0.00236358], 0, 7.5856, 1667966615], "v": "v0.6"}
{"i": [["[\"fused_conv3x3\", 1, 14, 14, 16, 16, 3, 3, 64]", "cuda -keys=cuda,gpu -max_num_threads=1024 -model=unknown -thread_warp_size=32", [-1, 16, 64, 49152, 2147483647, 1024, 8, 32], "", 0, []], [[], [["CHW", 3, "local"], ["SP", 3, 0, 1, [1, 1, 1, 1], 1], ["SP", 3, 5, 64, [4, 2, 2, 1], 1], ["SP", 3, 10, 14, [1, 1, 1, 14], 1], ["SP", 3, 15, 14, [1, 14, 1, 1], 1], ["SP", 3, 20, 16, [1, 4, 2, 2], 1], ["SP", 3, 25, 16, [2, 1], 1], ["SP", 3, 28, 3, [1, 3], 1], ["SP", 3, 31, 3, [1, 1], 1], ["RE", 3, [0, 5, 10, 15, 20, 1, 6, 11, 16, 21, 2, 7, 12, 17, 22, 25, 28, 31, 26, 29, 32, 3, 8, 13, 18, 23, 27, 30, 33, 4, 9, 14, 19, 24]], ["FSP", 4, 0, 1, 3], ["FSP", 4, 4, 2, 3], ["FSP", 4, 8, 3, 3], ["FSP", 4, 12, 4, 3], ["FSP", 4, 16, 5, 3], ["RE", 4, [0, 4, 8, 12, 16, 1, 5, 9, 13, 17, 2, 6, 10, 14, 18, 3, 7, 11, 15, 19]], ["CA", 3, 4, 14], ["CHR", 2, "shared", [3]], ["CA", 3, 4, 17], ["CHR", 1, "shared", [4]], ["CA", 2, 5, 17], ["CI", 1], ["FU", 6, [0, 1, 2, 3, 4]], ["AN", 6, 0, 5], ["FU", 6, [1, 2, 3, 4, 5]], ["AN", 6, 1, 4], ["FU", 6, [2, 3, 4, 5, 6]], ["AN", 6, 2, 6], ["FU", 4, [0, 1, 2, 3, 4]], ["SP", 4, 0, 48, [1], 1], ["AN", 4, 1, 2], ["FFSP", 4, 0, [5, 4, 3, 2, 1], 1, 1], ["AN", 4, 1, 6], ["FU", 2, [0, 1, 2, 3, 4]], ["SP", 2, 0, 108, [1], 1], ["AN", 2, 1, 2], ["FFSP", 2, 0, [5, 4, 3, 2, 1], 1, 1], ["AN", 2, 1, 6], ["PR", 5, 0, "auto_unroll_max_step$64"]]]], "r": [[0.00106255, 0.00106306, 0.00106301], 0, 4.51806, 1667966610], "v": "v0.6"}
{"i": [["[\"fused_conv3x3\", 1, 14, 14, 16, 16, 3, 3, 64]", "cuda -keys=cuda,gpu -max_num_threads=1024 -model=unknown -thread_warp_size=32", [-1, 16, 64, 49152, 2147483647, 1024, 8, 32], "", 0, []], [[], [["CHW", 3, "local"], ["SP", 3, 0, 1, [1, 1, 1, 1], 1], ["SP", 3, 5, 64, [2, 8, 1, 2], 1], ["SP", 3, 10, 14, [1, 7, 1, 1], 1], ["SP", 3, 15, 14, [2, 1, 1, 7], 1], ["SP", 3, 20, 16, [2, 2, 4, 1], 1], ["SP", 3, 25, 16, [1, 1], 1], ["SP", 3, 28, 3, [3, 1], 1], ["SP", 3, 31, 3, [1, 3], 1], ["RE", 3, [0, 5, 10, 15, 20, 1, 6, 11, 16, 21, 2, 7, 12, 17, 22, 25, 28, 31, 26, 29, 32, 3, 8, 13, 18, 23, 27, 30, 33, 4, 9, 14, 19, 24]], ["FSP", 4, 0, 1, 3], ["FSP", 4, 4, 2, 3], ["FSP", 4, 8, 3, 3], ["FSP", 4, 12, 4, 3], ["FSP", 4, 16, 5, 3], ["RE", 4, [0, 4, 8, 12, 16, 1, 5, 9, 13, 17, 2, 6, 10, 14, 18, 3, 7, 11, 15, 19]], ["CA", 3, 4, 14], ["CHR", 2, "shared", [3]], ["CA", 3, 4, 17], ["CHR", 1, "shared", [4]], ["CA", 2, 5, 17], ["CI", 1], ["FU", 6, [0, 1, 2, 3, 4]], ["AN", 6, 0, 5], ["FU", 6, [1, 2, 3, 4, 5]], ["AN", 6, 1, 4], ["FU", 6, [2, 3, 4, 5, 6]], ["AN", 6, 2, 6], ["FU", 4, [0, 1, 2, 3, 4]], ["SP", 4, 0, 72, [1], 1], ["AN", 4, 1, 2], ["FFSP", 4, 0, [5, 4, 3, 2, 1], 1, 1], ["AN", 4, 1, 6], ["FU", 2, [0, 1, 2, 3, 4]], ["SP", 2, 0, 54, [1], 1], ["AN", 2, 1, 2], ["FFSP", 2, 0, [5, 4, 3, 2, 1], 1, 1], ["AN", 2, 1, 6], ["PR", 5, 0, "auto_unroll_max_step$0"]]]], "r": [[0.000720184, 0.00071798, 0.000719383], 0, 11.4115, 1667966618], "v": "v0.6"}
{"i": [["[\"fused_conv3x3\", 1, 14, 14, 16, 16, 3, 3, 64]", "cuda -keys=cuda,gpu -max_num_threads=1024 -model=unknown -thread_warp_size=32", [-1, 16, 64, 49152, 2147483647, 1024, 8, 32], "", 0, []], [[], [["CHW", 3, "local"], ["SP", 3, 0, 1, [1, 1, 1, 1], 1], ["SP", 3, 5, 64, [2, 1, 1, 4], 1], ["SP", 3, 10, 14, [1, 7, 1, 1], 1], ["SP", 3, 15, 14, [1, 7, 1, 1], 1], ["SP", 3, 20, 16, [1, 2, 1, 4], 1], ["SP", 3, 25, 16, [1, 2], 1], ["SP", 3, 28, 3, [1, 1], 1], ["SP", 3, 31, 3, [1, 3], 1], ["RE", 3, [0, 5, 10, 15, 20, 1, 6, 11, 16, 21, 2, 7, 12, 17, 22, 25, 28, 31, 26, 29, 32, 3, 8, 13, 18, 23, 27, 30, 33, 4, 9, 14, 19, 24]], ["FSP", 4, 0, 1, 3], ["FSP", 4, 4, 2, 3], ["FSP", 4, 8, 3, 3], ["FSP", 4, 12, 4, 3], ["FSP", 4, 16, 5, 3], ["RE", 4, [0, 4, 8, 12, 16, 1, 5, 9, 13, 17, 2, 6, 10, 14, 18, 3, 7, 11, 15, 19]], ["CA", 3, 4, 14], ["CHR", 2, "shared", [3]], ["CA", 3, 4, 17], ["CHR", 1, "shared", [4]], ["CA", 2, 5, 17], ["CI", 1], ["FU", 6, [0, 1, 2, 3, 4]], ["AN", 6, 0, 5], ["FU", 6, [1, 2, 3, 4, 5]], ["AN", 6, 1, 4], ["FU", 6, [2, 3, 4, 5, 6]], ["AN", 6, 2, 6], ["FU", 4, [0, 1, 2, 3, 4]], ["SP", 4, 0, 576, [1], 1], ["AN", 4, 1, 2], ["FFSP", 4, 0, [5, 4, 3, 2, 1], 1, 1], ["AN", 4, 1, 6], ["FU", 2, [0, 1, 2, 3, 4]], ["SP", 2, 0, 144, [1], 1], ["AN", 2, 1, 2], ["FFSP", 2, 0, [5, 4, 3, 2, 1], 1, 1], ["AN", 2, 1, 6], ["PR", 5, 0, "auto_unroll_max_step$0"]]]], "r": [[2.34952e-05, 2.35075e-05, 2.34851e-05], 0, 12.2797, 1667966620], "v": "v0.6"}
{"i": [["[\"fused_conv3x3\", 1, 14, 14, 16, 16, 3, 3, 64]", "cuda -keys=cuda,gpu -max_num_threads=1024 -model=unknown -thread_warp_size=32", [-1, 16, 64, 49152, 2147483647, 1024, 8, 32], "", 0, []], [[], [["CHW", 3, "local"], ["SP", 3, 0, 1, [1, 1, 1, 1], 1], ["SP", 3, 5, 64, [1, 4, 8, 1], 1], ["SP", 3, 10, 14, [1, 2, 7, 1], 1], ["SP", 3, 15, 14, [1, 14, 1, 1], 1], ["SP", 3, 20, 16, [1, 4, 1, 2], 1], ["SP", 3, 25, 16, [1, 1], 1], ["SP", 3, 28, 3, [3, 1], 1], ["SP", 3, 31, 3, [3, 1], 1], ["RE", 3, [0, 5, 10, 15, 20, 1, 6, 11, 16, 21, 2, 7, 12, 17, 22, 25, 28, 31, 26, 29, 32, 3, 8, 13, 18, 23, 27, 30, 33, 4, 9, 14, 19, 24]], ["FSP", 4, 0, 1, 3], ["FSP", 4, 4, 2, 3], ["FSP", 4, 8, 3, 3], ["FSP", 4, 12, 4, 3], ["FSP", 4, 16, 5, 3], ["RE", 4, [0, 4, 8, 12, 16, 1, 5, 9, 13, 17, 2, 6, 10, 14, 18, 3, 7, 11, 15, 19]], ["CA", 3, 4, 14], ["CHR", 2, "shared", [3]], ["CA", 3, 4, 17], ["CHR", 1, "shared", [4]], ["CA", 2, 5, 17], ["CI", 1], ["FU", 6, [0, 1, 2, 3, 4]], ["AN", 6, 0, 5], ["FU", 6, [1, 2, 3, 4, 5]], ["AN", 6, 1, 4], ["FU", 6, [2, 3, 4, 5, 6]], ["AN", 6, 2, 6], ["FU", 4, [0, 1, 2, 3, 4]], ["SP", 4, 0, 144, [1], 1], ["AN", 4, 1, 2], ["FFSP", 4, 0, [5, 4, 3, 2, 1], 1, 1], ["AN", 4, 1, 6], ["FU", 2, [0, 1, 2, 3, 4]], ["SP", 2, 0, 216, [1], 1], ["AN", 2, 1, 2], ["FFSP", 2, 0, [5, 4, 3, 2, 1], 1, 1], ["AN", 2, 1, 6], ["PR", 5, 0, "auto_unroll_max_step$512"]]]], "r": [[0.000201042, 0.000200886, 0.000200986], 0, 14.9037, 1667966622], "v": "v0.6"}
{"i": [["[\"fused_conv3x3\", 1, 14, 14, 16, 16, 3, 3, 64]", "cuda -keys=cuda,gpu -max_num_threads=1024 -model=unknown -thread_warp_size=32", [-1, 16, 64, 49152, 2147483647, 1024, 8, 32], "", 0, []], [[], [["CHW", 3, "local"], ["SP", 3, 0, 1, [1, 1, 1, 1], 1], ["SP", 3, 5, 64, [2, 4, 1, 1], 1], ["SP", 3, 10, 14, [1, 2, 1, 1], 1], ["SP", 3, 15, 14, [2, 1, 1, 7], 1], ["SP", 3, 20, 16, [1, 2, 1, 8], 1], ["SP", 3, 25, 16, [1, 1], 1], ["SP", 3, 28, 3, [1, 1], 1], ["SP", 3, 31, 3, [1, 3], 1], ["RE", 3, [0, 5, 10, 15, 20, 1, 6, 11, 16, 21, 2, 7, 12, 17, 22, 25, 28, 31, 26, 29, 32, 3, 8, 13, 18, 23, 27, 30, 33, 4, 9, 14, 19, 24]], ["FSP", 4, 0, 1, 3], ["FSP", 4, 4, 2, 3], ["FSP", 4, 8, 3, 3], ["FSP", 4, 12, 4, 3], ["FSP", 4, 16, 5, 3], ["RE", 4, [0, 4, 8, 12, 16, 1, 5, 9, 13, 17, 2, 6, 10, 14, 18, 3, 7, 11, 15, 19]], ["CA", 3, 4, 14], ["CHR", 2, "shared", [3]], ["CA", 3, 4, 17], ["CHR", 1, "shared", [4]], ["CA", 2, 5, 17], ["CI", 1], ["FU", 6, [0, 1, 2, 3, 4]], ["AN", 6, 0, 5], ["FU", 6, [1, 2, 3, 4, 5]], ["AN", 6, 1, 4], ["FU", 6, [2, 3, 4, 5, 6]], ["AN", 6, 2, 6], ["FU", 4, [0, 1, 2, 3, 4]], ["SP", 4, 0, 72, [1], 1], ["AN", 4, 1, 2], ["FFSP", 4, 0, [5, 4, 3, 2, 1], 1, 1], ["AN", 4, 1, 6], ["FU", 2, [0, 1, 2, 3, 4]], ["SP", 2, 0, 12, [1], 1], ["AN", 2, 1, 2], ["FFSP", 2, 0, [5, 4, 3, 2, 1], 1, 1], ["AN", 2, 1, 6], ["PR", 5, 0, "auto_unroll_max_step$512"]]]], "r": [[0.000114501, 0.000114477, 0.000114496], 0, 6.9542, 1667966614], "v": "v0.6"}
{"i": [["[\"fused_conv3x3\", 1, 14, 14, 16, 16, 3, 3, 64]", "cuda -keys=cuda,gpu -max_num_threads=1024 -model=unknown -thread_warp_size=32", [-1, 16, 64, 49152, 2147483647, 1024, 8, 32], "", 0, []], [[], [["CHW", 3, "local"], ["SP", 3, 0, 1, [1, 1, 1, 1], 1], ["SP", 3, 5, 64, [1, 2, 2, 2], 1], ["SP", 3, 10, 14, [1, 1, 1, 7], 1], ["SP", 3, 15, 14, [1, 7, 1, 2], 1], ["SP", 3, 20, 16, [1, 16, 1, 1], 1], ["SP", 3, 25, 16, [1, 4], 1], ["SP", 3, 28, 3, [1, 3], 1], ["SP", 3, 31, 3, [1, 1], 1], ["RE", 3, [0, 5, 10, 15, 20, 1, 6, 11, 16, 21, 2, 7, 12, 17, 22, 25, 28, 31, 26, 29, 32, 3, 8, 13, 18, 23, 27, 30, 33, 4, 9, 14, 19, 24]], ["FSP", 4, 0, 1, 3], ["FSP", 4, 4, 2, 3], ["FSP", 4, 8, 3, 3], ["FSP", 4, 12, 4, 3], ["FSP", 4, 16, 5, 3], ["RE", 4, [0, 4, 8, 12, 16, 1, 5, 9, 13, 17, 2, 6, 10, 14, 18, 3, 7, 11, 15, 19]], ["CA", 3, 4, 14], ["CHR", 2, "shared", [3]], ["CA", 3, 4, 17], ["CHR", 1, "shared", [4]], ["CA", 2, 5, 17], ["CI", 1], ["FU", 6, [0, 1, 2, 3, 4]], ["AN", 6, 0, 5], ["FU", 6, [1, 2, 3, 4, 5]], ["AN", 6, 1, 4], ["FU", 6, [2, 3, 4, 5, 6]], ["AN", 6, 2, 6], ["FU", 4, [0, 1, 2, 3, 4]], ["SP", 4, 0, 48, [1], 1], ["AN", 4, 1, 2], ["FFSP", 4, 0, [5, 4, 3, 2, 1], 1, 1], ["AN", 4, 1, 6], ["FU", 2, [0, 1, 2, 3, 4]], ["SP", 2, 0, 576, [3], 1], ["AN", 2, 1, 2], ["FFSP", 2, 0, [5, 4, 3, 2, 1], 1, 1], ["AN", 2, 1, 6], ["PR", 5, 0, "auto_unroll_max_step$16"]]]], "r": [[9.8723e-05, 9.87261e-05, 9.87607e-05], 0, 13.8233, 1667966621], "v": "v0.6"}
{"i": [["[\"fused_conv3x3\", 1, 14, 14, 16, 16, 3, 3, 64]", "cuda -keys=cuda,gpu -max_num_threads=1024 -model=unknown -thread_warp_size=32", [-1, 16, 64, 49152, 2147483647, 1024, 8, 32], "", 0, []], [[], [["CHW", 3, "local"], ["SP", 3, 0, 1, [1, 1, 1, 1], 1], ["SP", 3, 5, 64, [1, 4, 4, 2], 1], ["SP", 3, 10, 14, [1, 2, 1, 1], 1], ["SP", 3, 15, 14, [2, 1, 1, 7], 1], ["SP", 3, 20, 16, [1, 4, 4, 1], 1], ["SP", 3, 25, 16, [1, 2], 1], ["SP", 3, 28, 3, [1, 1], 1], ["SP", 3, 31, 3, [1, 1], 1], ["RE", 3, [0, 5, 10, 15, 20, 1, 6, 11, 16, 21, 2, 7, 12, 17, 22, 25, 28, 31, 26, 29, 32, 3, 8, 13, 18, 23, 27, 30, 33, 4, 9, 14, 19, 24]], ["FSP", 4, 0, 1, 3], ["FSP", 4, 4, 2, 3], ["FSP", 4, 8, 3, 3], ["FSP", 4, 12, 4, 3], ["FSP", 4, 16, 5, 3], ["RE", 4, [0, 4, 8, 12, 16, 1, 5, 9, 13, 17, 2, 6, 10, 14, 18, 3, 7, 11, 15, 19]], ["CA", 3, 4, 14], ["CHR", 2, "shared", [3]], ["CA", 3, 4, 17], ["CHR", 1, "shared", [4]], ["CA", 2, 5, 17], ["CI", 1], ["FU", 6, [0, 1, 2, 3, 4]], ["AN", 6, 0, 5], ["FU", 6, [1, 2, 3, 4, 5]], ["AN", 6, 1, 4], ["FU", 6, [2, 3, 4, 5, 6]], ["AN", 6, 2, 6], ["FU", 4, [0, 1, 2, 3, 4]], ["SP", 4, 0, 64, [1], 1], ["AN", 4, 1, 2], ["FFSP", 4, 0, [5, 4, 3, 2, 1], 1, 1], ["AN", 4, 1, 6], ["FU", 2, [0, 1, 2, 3, 4]], ["SP", 2, 0, 112, [1], 1], ["AN", 2, 1, 2], ["FFSP", 2, 0, [5, 4, 3, 2, 1], 1, 1], ["AN", 2, 1, 6], ["PR", 5, 0, "auto_unroll_max_step$512"]]]], "r": [[0.000388151, 0.000388041, 0.000388091], 0, 13.5116, 1667966619], "v": "v0.6"}
{"i": [["[\"fused_conv3x3\", 1, 14, 14, 16, 16, 3, 3, 64]", "cuda -keys=cuda,gpu -max_num_threads=1024 -model=unknown -thread_warp_size=32", [-1, 16, 64, 49152, 2147483647, 1024, 8, 32], "", 0, []], [[], [["CHW", 3, "local"], ["SP", 3, 0, 1, [1, 1, 1, 1], 1], ["SP", 3, 5, 64, [2, 8, 1, 1], 1], ["SP", 3, 10, 14, [1, 1, 2, 1], 1], ["SP", 3, 15, 14, [2, 7, 1, 1], 1], ["SP", 3, 20, 16, [2, 4, 2, 1], 1], ["SP", 3, 25, 16, [4, 1], 1], ["SP", 3, 28, 3, [1, 1], 1], ["SP", 3, 31, 3, [1, 3], 1], ["RE", 3, [0, 5, 10, 15, 20, 1, 6, 11, 16, 21, 2, 7, 12, 17, 22, 25, 28, 31, 26, 29, 32, 3, 8, 13, 18, 23, 27, 30, 33, 4, 9, 14, 19, 24]], ["FSP", 4, 0, 1, 3], ["FSP", 4, 4, 2, 3], ["FSP", 4, 8, 3, 3], ["FSP", 4, 12, 4, 3], ["FSP", 4, 16, 5, 3], ["RE", 4, [0, 4, 8, 12, 16, 1, 5, 9, 13, 17, 2, 6, 10, 14, 18, 3, 7, 11, 15, 19]], ["CA", 3, 4, 14], ["CHR", 2, "shared", [3]], ["CA", 3, 4, 17], ["CHR", 1, "shared", [4]], ["CA", 2, 5, 17], ["CI", 1], ["FU", 6, [0, 1, 2, 3, 4]], ["AN", 6, 0, 5], ["FU", 6, [1, 2, 3, 4, 5]], ["AN", 6, 1, 4], ["FU", 6, [2, 3, 4, 5, 6]], ["AN", 6, 2, 6], ["FU", 4, [0, 1, 2, 3, 4]], ["SP", 4, 0, 24, [1], 1], ["AN", 4, 1, 2], ["FFSP", 4, 0, [5, 4, 3, 2, 1], 1, 1], ["AN", 4, 1, 6], ["FU", 2, [0, 1, 2, 3, 4]], ["SP", 2, 0, 8, [1], 1], ["AN", 2, 1, 2], ["FFSP", 2, 0, [5, 4, 3, 2, 1], 1, 1], ["AN", 2, 1, 6], ["PR", 5, 0, "auto_unroll_max_step$16"]]]], "r": [[3.11219e-05, 3.11423e-05, 3.11225e-05], 0, 8.70616, 1667966616], "v": "v0.6"}
{"i": [["[\"fused_conv3x3\", 1, 14, 14, 16, 16, 3, 3, 64]", "cuda -keys=cuda,gpu -max_num_threads=1024 -model=unknown -thread_warp_size=32", [-1, 16, 64, 49152, 2147483647, 1024, 8, 32], "", 0, []], [[], [["CHW", 3, "local"], ["SP", 3, 0, 1, [1, 1, 1, 1], 1], ["SP", 3, 5, 64, [1, 4, 1, 4], 1], ["SP", 3, 10, 14, [1, 14, 1, 1], 1], ["SP", 3, 15, 14, [1, 2, 1, 7], 1], ["SP", 3, 20, 16, [1, 2, 1, 4], 1], ["SP", 3, 25, 16, [2, 1], 1], ["SP", 3, 28, 3, [1, 3], 1], ["SP", 3, 31, 3, [1, 3], 1], ["RE", 3, [0, 5, 10, 15, 20, 1, 6, 11, 16, 21, 2, 7, 12, 17, 22, 25, 28, 31, 26, 29, 32, 3, 8, 13, 18, 23, 27, 30, 33, 4, 9, 14, 19, 24]], ["FSP", 4, 0, 1, 3], ["FSP", 4, 4, 2, 3], ["FSP", 4, 8, 3, 3], ["FSP", 4, 12, 4, 3], ["FSP", 4, 16, 5, 3], ["RE", 4, [0, 4, 8, 12, 16, 1, 5, 9, 13, 17, 2, 6, 10, 14, 18, 3, 7, 11, 15, 19]], ["CA", 3, 4, 14], ["CHR", 2, "shared", [3]], ["CA", 3, 4, 17], ["CHR", 1, "shared", [4]], ["CA", 2, 5, 17], ["CI", 1], ["FU", 6, [0, 1, 2, 3, 4]], ["AN", 6, 0, 5], ["FU", 6, [1, 2, 3, 4, 5]], ["AN", 6, 1, 4], ["FU", 6, [2, 3, 4, 5, 6]], ["AN", 6, 2, 6], ["FU", 4, [0, 1, 2, 3, 4]], ["SP", 4, 0, 288, [6], 1], ["AN", 4, 1, 2], ["FFSP", 4, 0, [5, 4, 3, 2, 1], 1, 1], ["AN", 4, 1, 6], ["FU", 2, [0, 1, 2, 3, 4]], ["SP", 2, 0, 648, [1], 1], ["AN", 2, 1, 2], ["FFSP", 2, 0, [5, 4, 3, 2, 1], 1, 1], ["AN", 2, 1, 6], ["PR", 5, 0, "auto_unroll_max_step$512"]]]], "r": [[0.000155088, 0.000155113, 0.000155047], 0, 14.0643, 1667966621], "v": "v0.6"}
{"i": [["[\"fused_conv3x3\", 1, 14, 14, 16, 16, 3, 3, 64]", "cuda -keys=cuda,gpu -max_num_threads=1024 -model=unknown -thread_warp_size=32", [-1, 16, 64, 49152, 2147483647, 1024, 8, 32], "", 0, []], [[], [["CHW", 3, "local"], ["SP", 3, 0, 1, [1, 1, 1, 1], 1], ["SP", 3, 5, 64, [2, 16, 1, 1], 1], ["SP", 3, 10, 14, [1, 14, 1, 1], 1], ["SP", 3, 15, 14, [1, 1, 1, 1], 1], ["SP", 3, 20, 16, [1, 1, 2, 4], 1], ["SP", 3, 25, 16, [4, 1], 1], ["SP", 3, 28, 3, [1, 3], 1], ["SP", 3, 31, 3, [1, 1], 1], ["RE", 3, [0, 5, 10, 15, 20, 1, 6, 11, 16, 21, 2, 7, 12, 17, 22, 25, 28, 31, 26, 29, 32, 3, 8, 13, 18, 23, 27, 30, 33, 4, 9, 14, 19, 24]], ["FSP", 4, 0, 1, 3], ["FSP", 4, 4, 2, 3], ["FSP", 4, 8, 3, 3], ["FSP", 4, 12, 4, 3], ["FSP", 4, 16, 5, 3], ["RE", 4, [0, 4, 8, 12, 16, 1, 5, 9, 13, 17, 2, 6, 10, 14, 18, 3, 7, 11, 15, 19]], ["CA", 3, 4, 14], ["CHR", 2, "shared", [3]], ["CA", 3, 4, 17], ["CHR", 1, "shared", [4]], ["CA", 2, 5, 17], ["CI", 1], ["FU", 6, [0, 1, 2, 3, 4]], ["AN", 6, 0, 5], ["FU", 6, [1, 2, 3, 4, 5]], ["AN", 6, 1, 4], ["FU", 6, [2, 3, 4, 5, 6]], ["AN", 6, 2, 6], ["FU", 4, [0, 1, 2, 3, 4]], ["SP", 4, 0, 96, [48], 1], ["AN", 4, 1, 2], ["FFSP", 4, 0, [5, 4, 3, 2, 1], 1, 1], ["AN", 4, 1, 6], ["FU", 2, [0, 1, 2, 3, 4]], ["SP", 2, 0, 36, [1], 1], ["AN", 2, 1, 2], ["FFSP", 2, 0, [5, 4, 3, 2, 1], 1, 1], ["AN", 2, 1, 6], ["PR", 5, 0, "auto_unroll_max_step$1024"]]]], "r": [[7.10973e-05, 7.11144e-05, 7.10783e-05], 0, 12.8639, 1667966619], "v": "v0.6"}
