python/models/resnext/ResNextHorizontal_kernel_configs/resnext_imagenet_50_hfused_batch_norm_1_28_28_8_64.log
{"i": [["[\"hfused_batch_norm\", 1, 28, 28, 8, 64]", "cuda -keys=cuda,gpu -max_num_threads=1024 -model=unknown -thread_warp_size=32", [-1, 16, 64, 49152, 2147483647, 1024, 8, 32], "", 0, []], [[], [["CI", 2], ["FU", 4, [0, 1, 2, 3, 4]], ["SP", 4, 0, 401408, [16], 1], ["AN", 4, 0, 5], ["AN", 4, 1, 6]]]], "r": [[2.14567e-05, 2.145e-05, 2.1455e-05], 0, 1.29364, 1667896840], "v": "v0.6"}
{"i": [["[\"hfused_batch_norm\", 1, 28, 28, 8, 64]", "cuda -keys=cuda,gpu -max_num_threads=1024 -model=unknown -thread_warp_size=32", [-1, 16, 64, 49152, 2147483647, 1024, 8, 32], "", 0, []], [[], [["CI", 2], ["FU", 4, [0, 1, 2, 3, 4]], ["SP", 4, 0, 401408, [28], 1], ["AN", 4, 0, 5], ["AN", 4, 1, 6]]]], "r": [[1.34085e-05, 1.34053e-05, 1.34063e-05], 0, 1.63631, 1667896841], "v": "v0.6"}
{"i": [["[\"hfused_batch_norm\", 1, 28, 28, 8, 64]", "cuda -keys=cuda,gpu -max_num_threads=1024 -model=unknown -thread_warp_size=32", [-1, 16, 64, 49152, 2147483647, 1024, 8, 32], "", 0, []], [[], [["CI", 2], ["FU", 4, [0, 1, 2, 3, 4]], ["SP", 4, 0, 401408, [2], 1], ["AN", 4, 0, 5], ["AN", 4, 1, 6]]]], "r": [[0.00015158, 0.000151585, 0.000151587], 0, 3.40401, 1667896843], "v": "v0.6"}
{"i": [["[\"hfused_batch_norm\", 1, 28, 28, 8, 64]", "cuda -keys=cuda,gpu -max_num_threads=1024 -model=unknown -thread_warp_size=32", [-1, 16, 64, 49152, 2147483647, 1024, 8, 32], "", 0, []], [[], [["CI", 2], ["FU", 4, [0, 1, 2, 3, 4]], ["SP", 4, 0, 401408, [64], 1], ["AN", 4, 0, 5], ["AN", 4, 1, 6]]]], "r": [[7.22574e-06, 7.22653e-06, 7.22585e-06], 0, 0.562405, 1667896840], "v": "v0.6"}
{"i": [["[\"hfused_batch_norm\", 1, 28, 28, 8, 64]", "cuda -keys=cuda,gpu -max_num_threads=1024 -model=unknown -thread_warp_size=32", [-1, 16, 64, 49152, 2147483647, 1024, 8, 32], "", 0, []], [[], [["CI", 2], ["FU", 4, [0, 1, 2, 3, 4]], ["SP", 4, 0, 401408, [8], 1], ["AN", 4, 0, 5], ["AN", 4, 1, 6]]]], "r": [[3.98631e-05, 3.98572e-05, 3.98596e-05], 0, 0.89476, 1667896840], "v": "v0.6"}
{"i": [["[\"hfused_batch_norm\", 1, 28, 28, 8, 64]", "cuda -keys=cuda,gpu -max_num_threads=1024 -model=unknown -thread_warp_size=32", [-1, 16, 64, 49152, 2147483647, 1024, 8, 32], "", 0, []], [[], [["CI", 2], ["FU", 4, [0, 1, 2, 3, 4]], ["SP", 4, 0, 401408, [49], 1], ["AN", 4, 0, 5], ["AN", 4, 1, 6]]]], "r": [[8.74761e-06, 8.74923e-06, 8.74011e-06], 0, 3.74988, 1667896843], "v": "v0.6"}
{"i": [["[\"hfused_batch_norm\", 1, 28, 28, 8, 64]", "cuda -keys=cuda,gpu -max_num_threads=1024 -model=unknown -thread_warp_size=32", [-1, 16, 64, 49152, 2147483647, 1024, 8, 32], "", 0, []], [[], [["CI", 2], ["FU", 4, [0, 1, 2, 3, 4]], ["SP", 4, 0, 401408, [14], 1], ["AN", 4, 0, 5], ["AN", 4, 1, 6]]]], "r": [[2.40223e-05, 2.40216e-05, 2.40158e-05], 0, 3.03681, 1667896842], "v": "v0.6"}
{"i": [["[\"hfused_batch_norm\", 1, 28, 28, 8, 64]", "cuda -keys=cuda,gpu -max_num_threads=1024 -model=unknown -thread_warp_size=32", [-1, 16, 64, 49152, 2147483647, 1024, 8, 32], "", 0, []], [[], [["CI", 2], ["FU", 4, [0, 1, 2, 3, 4]], ["SP", 4, 0, 401408, [7], 1], ["AN", 4, 0, 5], ["AN", 4, 1, 6]]]], "r": [[4.52015e-05, 4.51676e-05, 4.51604e-05], 0, 1.98214, 1667896841], "v": "v0.6"}
{"i": [["[\"hfused_batch_norm\", 1, 28, 28, 8, 64]", "cuda -keys=cuda,gpu -max_num_threads=1024 -model=unknown -thread_warp_size=32", [-1, 16, 64, 49152, 2147483647, 1024, 8, 32], "", 0, []], [[], [["CI", 2], ["FU", 4, [0, 1, 2, 3, 4]], ["SP", 4, 0, 401408, [32], 1], ["AN", 4, 0, 5], ["AN", 4, 1, 6]]]], "r": [[1.19713e-05, 1.1969e-05, 1.19643e-05], 0, 2.35401, 1667896841], "v": "v0.6"}
{"i": [["[\"hfused_batch_norm\", 1, 28, 28, 8, 64]", "cuda -keys=cuda,gpu -max_num_threads=1024 -model=unknown -thread_warp_size=32", [-1, 16, 64, 49152, 2147483647, 1024, 8, 32], "", 0, []], [[], [["CI", 2], ["FU", 4, [0, 1, 2, 3, 4]], ["SP", 4, 0, 401408, [1], 1], ["AN", 4, 0, 5], ["AN", 4, 1, 6]]]], "r": [[0.000300444, 0.000300458, 0.000300423], 0, 2.68707, 1667896842], "v": "v0.6"}
{"i": [["[\"hfused_batch_norm\", 1, 28, 28, 8, 64]", "cuda -keys=cuda,gpu -max_num_threads=1024 -model=unknown -thread_warp_size=32", [-1, 16, 64, 49152, 2147483647, 1024, 8, 32], "", 0, []], [[], [["CI", 2], ["FU", 4, [0, 1, 2, 3, 4]], ["SP", 4, 0, 401408, [56], 1], ["AN", 4, 0, 5], ["AN", 4, 1, 6]]]], "r": [[7.9811e-06, 7.98999e-06, 7.9869e-06], 0, 4.45768, 1667896844], "v": "v0.6"}
{"i": [["[\"hfused_batch_norm\", 1, 28, 28, 8, 64]", "cuda -keys=cuda,gpu -max_num_threads=1024 -model=unknown -thread_warp_size=32", [-1, 16, 64, 49152, 2147483647, 1024, 8, 32], "", 0, []], [[], [["CI", 2], ["FU", 4, [0, 1, 2, 3, 4]], ["SP", 4, 0, 401408, [4], 1], ["AN", 4, 0, 5], ["AN", 4, 1, 6]]]], "r": [[7.70706e-05, 7.70762e-05, 7.70968e-05], 0, 4.05616, 1667896843], "v": "v0.6"}
{"i": [["[\"hfused_batch_norm\", 1, 28, 28, 8, 64]", "cuda -keys=cuda,gpu -max_num_threads=1024 -model=unknown -thread_warp_size=32", [-1, 16, 64, 49152, 2147483647, 1024, 8, 32], "", 0, []], [[], [["CI", 2], ["FU", 4, [0, 1, 2, 3, 4]], ["SP", 4, 0, 401408, [64], 1], ["AN", 4, 0, 5], ["AN", 4, 1, 6]]]], "r": [[7.38104e-06, 7.39238e-06, 7.38721e-06], 0, 1.88649, 1667958950], "v": "v0.6"}
{"i": [["[\"hfused_batch_norm\", 1, 28, 28, 8, 64]", "cuda -keys=cuda,gpu -max_num_threads=1024 -model=unknown -thread_warp_size=32", [-1, 16, 64, 49152, 2147483647, 1024, 8, 32], "", 0, []], [[], [["CI", 2], ["FU", 4, [0, 1, 2, 3, 4]], ["SP", 4, 0, 401408, [14], 1], ["AN", 4, 0, 5], ["AN", 4, 1, 6]]]], "r": [[2.40433e-05, 2.40439e-05, 2.40409e-05], 0, 0.853993, 1667958949], "v": "v0.6"}
{"i": [["[\"hfused_batch_norm\", 1, 28, 28, 8, 64]", "cuda -keys=cuda,gpu -max_num_threads=1024 -model=unknown -thread_warp_size=32", [-1, 16, 64, 49152, 2147483647, 1024, 8, 32], "", 0, []], [[], [["CI", 2], ["FU", 4, [0, 1, 2, 3, 4]], ["SP", 4, 0, 401408, [56], 1], ["AN", 4, 0, 5], ["AN", 4, 1, 6]]]], "r": [[7.98074e-06, 7.9787e-06, 7.97414e-06], 0, 1.55703, 1667958949], "v": "v0.6"}
{"i": [["[\"hfused_batch_norm\", 1, 28, 28, 8, 64]", "cuda -keys=cuda,gpu -max_num_threads=1024 -model=unknown -thread_warp_size=32", [-1, 16, 64, 49152, 2147483647, 1024, 8, 32], "", 0, []], [[], [["CI", 2], ["FU", 4, [0, 1, 2, 3, 4]], ["SP", 4, 0, 401408, [32], 1], ["AN", 4, 0, 5], ["AN", 4, 1, 6]]]], "r": [[1.20761e-05, 1.20694e-05, 1.20718e-05], 0, 0.550832, 1667958948], "v": "v0.6"}
{"i": [["[\"hfused_batch_norm\", 1, 28, 28, 8, 64]", "cuda -keys=cuda,gpu -max_num_threads=1024 -model=unknown -thread_warp_size=32", [-1, 16, 64, 49152, 2147483647, 1024, 8, 32], "", 0, []], [[], [["CI", 2], ["FU", 4, [0, 1, 2, 3, 4]], ["SP", 4, 0, 401408, [7], 1], ["AN", 4, 0, 5], ["AN", 4, 1, 6]]]], "r": [[4.53675e-05, 4.53517e-05, 4.53534e-05], 0, 2.23891, 1667958950], "v": "v0.6"}
{"i": [["[\"hfused_batch_norm\", 1, 28, 28, 8, 64]", "cuda -keys=cuda,gpu -max_num_threads=1024 -model=unknown -thread_warp_size=32", [-1, 16, 64, 49152, 2147483647, 1024, 8, 32], "", 0, []], [[], [["CI", 2], ["FU", 4, [0, 1, 2, 3, 4]], ["SP", 4, 0, 401408, [28], 1], ["AN", 4, 0, 5], ["AN", 4, 1, 6]]]], "r": [[1.35417e-05, 1.35296e-05, 1.35293e-05], 0, 1.23321, 1667958949], "v": "v0.6"}
{"i": [["[\"hfused_batch_norm\", 1, 28, 28, 8, 64]", "cuda -keys=cuda,gpu -max_num_threads=1024 -model=unknown -thread_warp_size=32", [-1, 16, 64, 49152, 2147483647, 1024, 8, 32], "", 0, []], [[], [["CI", 2], ["FU", 4, [0, 1, 2, 3, 4]], ["SP", 4, 0, 401408, [49], 1], ["AN", 4, 0, 5], ["AN", 4, 1, 6]]]], "r": [[8.8091e-06, 8.81408e-06, 8.80358e-06], 0, 2.8754, 1667958951], "v": "v0.6"}
{"i": [["[\"hfused_batch_norm\", 1, 28, 28, 8, 64]", "cuda -keys=cuda,gpu -max_num_threads=1024 -model=unknown -thread_warp_size=32", [-1, 16, 64, 49152, 2147483647, 1024, 8, 32], "", 0, []], [[], [["CI", 2], ["FU", 4, [0, 1, 2, 3, 4]], ["SP", 4, 0, 401408, [16], 1], ["AN", 4, 0, 5], ["AN", 4, 1, 6]]]], "r": [[2.15058e-05, 2.14931e-05, 2.1499e-05], 0, 2.56251, 1667958950], "v": "v0.6"}
{"i": [["[\"hfused_batch_norm\", 1, 28, 28, 8, 64]", "cuda -keys=cuda,gpu -max_num_threads=1024 -model=unknown -thread_warp_size=32", [-1, 16, 64, 49152, 2147483647, 1024, 8, 32], "", 0, []], [[], [["CI", 2], ["FU", 4, [0, 1, 2, 3, 4]], ["SP", 4, 0, 401408, [8], 1], ["AN", 4, 0, 5], ["AN", 4, 1, 6]]]], "r": [[3.98319e-05, 3.98336e-05, 3.98433e-05], 0, 3.23045, 1667958951], "v": "v0.6"}
{"i": [["[\"hfused_batch_norm\", 1, 28, 28, 8, 64]", "cuda -keys=cuda,gpu -max_num_threads=1024 -model=unknown -thread_warp_size=32", [-1, 16, 64, 49152, 2147483647, 1024, 8, 32], "", 0, []], [[], [["CI", 2], ["FU", 4, [0, 1, 2, 3, 4]], ["SP", 4, 0, 401408, [1], 1], ["AN", 4, 0, 5], ["AN", 4, 1, 6]]]], "r": [[0.000300405, 0.000300444, 0.000300448], 0, 3.79836, 1667958952], "v": "v0.6"}
{"i": [["[\"hfused_batch_norm\", 1, 28, 28, 8, 64]", "cuda -keys=cuda,gpu -max_num_threads=1024 -model=unknown -thread_warp_size=32", [-1, 16, 64, 49152, 2147483647, 1024, 8, 32], "", 0, []], [[], [["CI", 2], ["FU", 4, [0, 1, 2, 3, 4]], ["SP", 4, 0, 401408, [2], 1], ["AN", 4, 0, 5], ["AN", 4, 1, 6]]]], "r": [[0.000151559, 0.000151545, 0.000151552], 0, 4.16568, 1667958952], "v": "v0.6"}
{"i": [["[\"hfused_batch_norm\", 1, 28, 28, 8, 64]", "cuda -keys=cuda,gpu -max_num_threads=1024 -model=unknown -thread_warp_size=32", [-1, 16, 64, 49152, 2147483647, 1024, 8, 32], "", 0, []], [[], [["CI", 2], ["FU", 4, [0, 1, 2, 3, 4]], ["SP", 4, 0, 401408, [4], 1], ["AN", 4, 0, 5], ["AN", 4, 1, 6]]]], "r": [[7.72386e-05, 7.7264e-05, 7.72671e-05], 0, 3.54955, 1667958951], "v": "v0.6"}
{"i": [["[\"hfused_batch_norm\", 1, 28, 28, 8, 64]", "cuda -keys=cuda,gpu -max_num_threads=1024 -model=unknown -thread_warp_size=32", [-1, 16, 64, 49152, 2147483647, 1024, 8, 32], "", 0, []], [[], [["CI", 2], ["FU", 4, [0, 1, 2, 3, 4]], ["SP", 4, 0, 401408, [1], 1], ["AN", 4, 0, 5], ["AN", 4, 1, 6]]]], "r": [[0.000300464, 0.000300458, 0.000300454], 0, 1.52275, 1667959772], "v": "v0.6"}
{"i": [["[\"hfused_batch_norm\", 1, 28, 28, 8, 64]", "cuda -keys=cuda,gpu -max_num_threads=1024 -model=unknown -thread_warp_size=32", [-1, 16, 64, 49152, 2147483647, 1024, 8, 32], "", 0, []], [[], [["CI", 2], ["FU", 4, [0, 1, 2, 3, 4]], ["SP", 4, 0, 401408, [49], 1], ["AN", 4, 0, 5], ["AN", 4, 1, 6]]]], "r": [[8.73003e-06, 8.72714e-06, 8.70683e-06], 0, 2.20038, 1667959773], "v": "v0.6"}
{"i": [["[\"hfused_batch_norm\", 1, 28, 28, 8, 64]", "cuda -keys=cuda,gpu -max_num_threads=1024 -model=unknown -thread_warp_size=32", [-1, 16, 64, 49152, 2147483647, 1024, 8, 32], "", 0, []], [[], [["CI", 2], ["FU", 4, [0, 1, 2, 3, 4]], ["SP", 4, 0, 401408, [4], 1], ["AN", 4, 0, 5], ["AN", 4, 1, 6]]]], "r": [[7.72411e-05, 7.72479e-05, 7.72567e-05], 0, 0.865875, 1667959771], "v": "v0.6"}
{"i": [["[\"hfused_batch_norm\", 1, 28, 28, 8, 64]", "cuda -keys=cuda,gpu -max_num_threads=1024 -model=unknown -thread_warp_size=32", [-1, 16, 64, 49152, 2147483647, 1024, 8, 32], "", 0, []], [[], [["CI", 2], ["FU", 4, [0, 1, 2, 3, 4]], ["SP", 4, 0, 401408, [14], 1], ["AN", 4, 0, 5], ["AN", 4, 1, 6]]]], "r": [[2.40791e-05, 2.40935e-05, 2.40786e-05], 0, 1.22375, 1667959772], "v": "v0.6"}
{"i": [["[\"hfused_batch_norm\", 1, 28, 28, 8, 64]", "cuda -keys=cuda,gpu -max_num_threads=1024 -model=unknown -thread_warp_size=32", [-1, 16, 64, 49152, 2147483647, 1024, 8, 32], "", 0, []], [[], [["CI", 2], ["FU", 4, [0, 1, 2, 3, 4]], ["SP", 4, 0, 401408, [2], 1], ["AN", 4, 0, 5], ["AN", 4, 1, 6]]]], "r": [[0.000151561, 0.000151559, 0.000151571], 0, 2.87835, 1667959773], "v": "v0.6"}
{"i": [["[\"hfused_batch_norm\", 1, 28, 28, 8, 64]", "cuda -keys=cuda,gpu -max_num_threads=1024 -model=unknown -thread_warp_size=32", [-1, 16, 64, 49152, 2147483647, 1024, 8, 32], "", 0, []], [[], [["CI", 2], ["FU", 4, [0, 1, 2, 3, 4]], ["SP", 4, 0, 401408, [28], 1], ["AN", 4, 0, 5], ["AN", 4, 1, 6]]]], "r": [[1.34585e-05, 1.34583e-05, 1.34552e-05], 0, 0.544527, 1667959771], "v": "v0.6"}
{"i": [["[\"hfused_batch_norm\", 1, 28, 28, 8, 64]", "cuda -keys=cuda,gpu -max_num_threads=1024 -model=unknown -thread_warp_size=32", [-1, 16, 64, 49152, 2147483647, 1024, 8, 32], "", 0, []], [[], [["CI", 2], ["FU", 4, [0, 1, 2, 3, 4]], ["SP", 4, 0, 401408, [7], 1], ["AN", 4, 0, 5], ["AN", 4, 1, 6]]]], "r": [[4.51903e-05, 4.51832e-05, 4.51857e-05], 0, 2.5699, 1667959773], "v": "v0.6"}
{"i": [["[\"hfused_batch_norm\", 1, 28, 28, 8, 64]", "cuda -keys=cuda,gpu -max_num_threads=1024 -model=unknown -thread_warp_size=32", [-1, 16, 64, 49152, 2147483647, 1024, 8, 32], "", 0, []], [[], [["CI", 2], ["FU", 4, [0, 1, 2, 3, 4]], ["SP", 4, 0, 401408, [32], 1], ["AN", 4, 0, 5], ["AN", 4, 1, 6]]]], "r": [[1.20635e-05, 1.20834e-05, 1.20826e-05], 0, 1.84068, 1667959772], "v": "v0.6"}
{"i": [["[\"hfused_batch_norm\", 1, 28, 28, 8, 64]", "cuda -keys=cuda,gpu -max_num_threads=1024 -model=unknown -thread_warp_size=32", [-1, 16, 64, 49152, 2147483647, 1024, 8, 32], "", 0, []], [[], [["CI", 2], ["FU", 4, [0, 1, 2, 3, 4]], ["SP", 4, 0, 401408, [56], 1], ["AN", 4, 0, 5], ["AN", 4, 1, 6]]]], "r": [[8.10391e-06, 8.10057e-06, 8.10271e-06], 0, 3.84486, 1667959774], "v": "v0.6"}
{"i": [["[\"hfused_batch_norm\", 1, 28, 28, 8, 64]", "cuda -keys=cuda,gpu -max_num_threads=1024 -model=unknown -thread_warp_size=32", [-1, 16, 64, 49152, 2147483647, 1024, 8, 32], "", 0, []], [[], [["CI", 2], ["FU", 4, [0, 1, 2, 3, 4]], ["SP", 4, 0, 401408, [8], 1], ["AN", 4, 0, 5], ["AN", 4, 1, 6]]]], "r": [[3.98488e-05, 3.98505e-05, 3.98475e-05], 0, 3.53959, 1667959774], "v": "v0.6"}
{"i": [["[\"hfused_batch_norm\", 1, 28, 28, 8, 64]", "cuda -keys=cuda,gpu -max_num_threads=1024 -model=unknown -thread_warp_size=32", [-1, 16, 64, 49152, 2147483647, 1024, 8, 32], "", 0, []], [[], [["CI", 2], ["FU", 4, [0, 1, 2, 3, 4]], ["SP", 4, 0, 401408, [16], 1], ["AN", 4, 0, 5], ["AN", 4, 1, 6]]]], "r": [[2.13996e-05, 2.14e-05, 2.13953e-05], 0, 4.21061, 1667959775], "v": "v0.6"}
{"i": [["[\"hfused_batch_norm\", 1, 28, 28, 8, 64]", "cuda -keys=cuda,gpu -max_num_threads=1024 -model=unknown -thread_warp_size=32", [-1, 16, 64, 49152, 2147483647, 1024, 8, 32], "", 0, []], [[], [["CI", 2], ["FU", 4, [0, 1, 2, 3, 4]], ["SP", 4, 0, 401408, [64], 1], ["AN", 4, 0, 5], ["AN", 4, 1, 6]]]], "r": [[7.40267e-06, 7.40145e-06, 7.39927e-06], 0, 3.21363, 1667959774], "v": "v0.6"}
{"i": [["[\"hfused_batch_norm\", 1, 28, 28, 8, 64]", "cuda -keys=cuda,gpu -max_num_threads=1024 -model=unknown -thread_warp_size=32", [-1, 16, 64, 49152, 2147483647, 1024, 8, 32], "", 0, []], [[], [["CI", 2], ["FU", 4, [0, 1, 2, 3, 4]], ["SP", 4, 0, 401408, [1], 1], ["AN", 4, 0, 5], ["AN", 4, 1, 6]]]], "r": [[0.000300487, 0.000300448, 0.000300418], 0, 1.32547, 1667962173], "v": "v0.6"}
{"i": [["[\"hfused_batch_norm\", 1, 28, 28, 8, 64]", "cuda -keys=cuda,gpu -max_num_threads=1024 -model=unknown -thread_warp_size=32", [-1, 16, 64, 49152, 2147483647, 1024, 8, 32], "", 0, []], [[], [["CI", 2], ["FU", 4, [0, 1, 2, 3, 4]], ["SP", 4, 0, 401408, [16], 1], ["AN", 4, 0, 5], ["AN", 4, 1, 6]]]], "r": [[2.13829e-05, 2.13868e-05, 2.13808e-05], 0, 2.01636, 1667962174], "v": "v0.6"}
{"i": [["[\"hfused_batch_norm\", 1, 28, 28, 8, 64]", "cuda -keys=cuda,gpu -max_num_threads=1024 -model=unknown -thread_warp_size=32", [-1, 16, 64, 49152, 2147483647, 1024, 8, 32], "", 0, []], [[], [["CI", 2], ["FU", 4, [0, 1, 2, 3, 4]], ["SP", 4, 0, 401408, [32], 1], ["AN", 4, 0, 5], ["AN", 4, 1, 6]]]], "r": [[1.2052e-05, 1.20667e-05, 1.20465e-05], 0, 1.67267, 1667962174], "v": "v0.6"}
{"i": [["[\"hfused_batch_norm\", 1, 28, 28, 8, 64]", "cuda -keys=cuda,gpu -max_num_threads=1024 -model=unknown -thread_warp_size=32", [-1, 16, 64, 49152, 2147483647, 1024, 8, 32], "", 0, []], [[], [["CI", 2], ["FU", 4, [0, 1, 2, 3, 4]], ["SP", 4, 0, 401408, [8], 1], ["AN", 4, 0, 5], ["AN", 4, 1, 6]]]], "r": [[3.98574e-05, 3.98502e-05, 3.98486e-05], 0, 0.582801, 1667962173], "v": "v0.6"}
{"i": [["[\"hfused_batch_norm\", 1, 28, 28, 8, 64]", "cuda -keys=cuda,gpu -max_num_threads=1024 -model=unknown -thread_warp_size=32", [-1, 16, 64, 49152, 2147483647, 1024, 8, 32], "", 0, []], [[], [["CI", 2], ["FU", 4, [0, 1, 2, 3, 4]], ["SP", 4, 0, 401408, [28], 1], ["AN", 4, 0, 5], ["AN", 4, 1, 6]]]], "r": [[1.34412e-05, 1.34424e-05, 1.34395e-05], 0, 2.39856, 1667962175], "v": "v0.6"}
{"i": [["[\"hfused_batch_norm\", 1, 28, 28, 8, 64]", "cuda -keys=cuda,gpu -max_num_threads=1024 -model=unknown -thread_warp_size=32", [-1, 16, 64, 49152, 2147483647, 1024, 8, 32], "", 0, []], [[], [["CI", 2], ["FU", 4, [0, 1, 2, 3, 4]], ["SP", 4, 0, 401408, [56], 1], ["AN", 4, 0, 5], ["AN", 4, 1, 6]]]], "r": [[7.91041e-06, 7.90946e-06, 7.90287e-06], 0, 0.936715, 1667962173], "v": "v0.6"}
{"i": [["[\"hfused_batch_norm\", 1, 28, 28, 8, 64]", "cuda -keys=cuda,gpu -max_num_threads=1024 -model=unknown -thread_warp_size=32", [-1, 16, 64, 49152, 2147483647, 1024, 8, 32], "", 0, []], [[], [["CI", 2], ["FU", 4, [0, 1, 2, 3, 4]], ["SP", 4, 0, 401408, [14], 1], ["AN", 4, 0, 5], ["AN", 4, 1, 6]]]], "r": [[2.41545e-05, 2.4149e-05, 2.41433e-05], 0, 2.75934, 1667962175], "v": "v0.6"}
{"i": [["[\"hfused_batch_norm\", 1, 28, 28, 8, 64]", "cuda -keys=cuda,gpu -max_num_threads=1024 -model=unknown -thread_warp_size=32", [-1, 16, 64, 49152, 2147483647, 1024, 8, 32], "", 0, []], [[], [["CI", 2], ["FU", 4, [0, 1, 2, 3, 4]], ["SP", 4, 0, 401408, [49], 1], ["AN", 4, 0, 5], ["AN", 4, 1, 6]]]], "r": [[8.68982e-06, 8.69196e-06, 8.68349e-06], 0, 3.51173, 1667962176], "v": "v0.6"}
{"i": [["[\"hfused_batch_norm\", 1, 28, 28, 8, 64]", "cuda -keys=cuda,gpu -max_num_threads=1024 -model=unknown -thread_warp_size=32", [-1, 16, 64, 49152, 2147483647, 1024, 8, 32], "", 0, []], [[], [["CI", 2], ["FU", 4, [0, 1, 2, 3, 4]], ["SP", 4, 0, 401408, [2], 1], ["AN", 4, 0, 5], ["AN", 4, 1, 6]]]], "r": [[0.000151555, 0.000151537, 0.000151536], 0, 4.60805, 1667962177], "v": "v0.6"}
{"i": [["[\"hfused_batch_norm\", 1, 28, 28, 8, 64]", "cuda -keys=cuda,gpu -max_num_threads=1024 -model=unknown -thread_warp_size=32", [-1, 16, 64, 49152, 2147483647, 1024, 8, 32], "", 0, []], [[], [["CI", 2], ["FU", 4, [0, 1, 2, 3, 4]], ["SP", 4, 0, 401408, [4], 1], ["AN", 4, 0, 5], ["AN", 4, 1, 6]]]], "r": [[7.71267e-05, 7.71267e-05, 7.71361e-05], 0, 4.22416, 1667962176], "v": "v0.6"}
{"i": [["[\"hfused_batch_norm\", 1, 28, 28, 8, 64]", "cuda -keys=cuda,gpu -max_num_threads=1024 -model=unknown -thread_warp_size=32", [-1, 16, 64, 49152, 2147483647, 1024, 8, 32], "", 0, []], [[], [["CI", 2], ["FU", 4, [0, 1, 2, 3, 4]], ["SP", 4, 0, 401408, [64], 1], ["AN", 4, 0, 5], ["AN", 4, 1, 6]]]], "r": [[7.32219e-06, 7.3176e-06, 7.31363e-06], 0, 3.11046, 1667962175], "v": "v0.6"}
{"i": [["[\"hfused_batch_norm\", 1, 28, 28, 8, 64]", "cuda -keys=cuda,gpu -max_num_threads=1024 -model=unknown -thread_warp_size=32", [-1, 16, 64, 49152, 2147483647, 1024, 8, 32], "", 0, []], [[], [["CI", 2], ["FU", 4, [0, 1, 2, 3, 4]], ["SP", 4, 0, 401408, [7], 1], ["AN", 4, 0, 5], ["AN", 4, 1, 6]]]], "r": [[4.52069e-05, 4.52075e-05, 4.52018e-05], 0, 3.87821, 1667962176], "v": "v0.6"}
{"i": [["[\"hfused_batch_norm\", 1, 28, 28, 8, 64]", "cuda -keys=cuda,gpu -max_num_threads=1024 -model=unknown -thread_warp_size=32", [-1, 16, 64, 49152, 2147483647, 1024, 8, 32], "", 0, []], [[], [["CI", 2], ["FU", 4, [0, 1, 2, 3, 4]], ["SP", 4, 0, 401408, [14], 1], ["AN", 4, 0, 5], ["AN", 4, 1, 6]]]], "r": [[2.39521e-05, 2.39524e-05, 2.39523e-05], 0, 0.546137, 1667962216], "v": "v0.6"}
{"i": [["[\"hfused_batch_norm\", 1, 28, 28, 8, 64]", "cuda -keys=cuda,gpu -max_num_threads=1024 -model=unknown -thread_warp_size=32", [-1, 16, 64, 49152, 2147483647, 1024, 8, 32], "", 0, []], [[], [["CI", 2], ["FU", 4, [0, 1, 2, 3, 4]], ["SP", 4, 0, 401408, [56], 1], ["AN", 4, 0, 5], ["AN", 4, 1, 6]]]], "r": [[8.03917e-06, 8.04134e-06, 8.03771e-06], 0, 1.21997, 1667962217], "v": "v0.6"}
{"i": [["[\"hfused_batch_norm\", 1, 28, 28, 8, 64]", "cuda -keys=cuda,gpu -max_num_threads=1024 -model=unknown -thread_warp_size=32", [-1, 16, 64, 49152, 2147483647, 1024, 8, 32], "", 0, []], [[], [["CI", 2], ["FU", 4, [0, 1, 2, 3, 4]], ["SP", 4, 0, 401408, [1], 1], ["AN", 4, 0, 5], ["AN", 4, 1, 6]]]], "r": [[0.000300368, 0.000300337, 0.000300399], 0, 0.871185, 1667962217], "v": "v0.6"}
{"i": [["[\"hfused_batch_norm\", 1, 28, 28, 8, 64]", "cuda -keys=cuda,gpu -max_num_threads=1024 -model=unknown -thread_warp_size=32", [-1, 16, 64, 49152, 2147483647, 1024, 8, 32], "", 0, []], [[], [["CI", 2], ["FU", 4, [0, 1, 2, 3, 4]], ["SP", 4, 0, 401408, [32], 1], ["AN", 4, 0, 5], ["AN", 4, 1, 6]]]], "r": [[1.19913e-05, 1.19754e-05, 1.19744e-05], 0, 1.87616, 1667962218], "v": "v0.6"}
{"i": [["[\"hfused_batch_norm\", 1, 28, 28, 8, 64]", "cuda -keys=cuda,gpu -max_num_threads=1024 -model=unknown -thread_warp_size=32", [-1, 16, 64, 49152, 2147483647, 1024, 8, 32], "", 0, []], [[], [["CI", 2], ["FU", 4, [0, 1, 2, 3, 4]], ["SP", 4, 0, 401408, [16], 1], ["AN", 4, 0, 5], ["AN", 4, 1, 6]]]], "r": [[2.14167e-05, 2.14244e-05, 2.14237e-05], 0, 1.54809, 1667962217], "v": "v0.6"}
{"i": [["[\"hfused_batch_norm\", 1, 28, 28, 8, 64]", "cuda -keys=cuda,gpu -max_num_threads=1024 -model=unknown -thread_warp_size=32", [-1, 16, 64, 49152, 2147483647, 1024, 8, 32], "", 0, []], [[], [["CI", 2], ["FU", 4, [0, 1, 2, 3, 4]], ["SP", 4, 0, 401408, [64], 1], ["AN", 4, 0, 5], ["AN", 4, 1, 6]]]], "r": [[7.35629e-06, 7.3526e-06, 7.35276e-06], 0, 2.22614, 1667962218], "v": "v0.6"}
{"i": [["[\"hfused_batch_norm\", 1, 28, 28, 8, 64]", "cuda -keys=cuda,gpu -max_num_threads=1024 -model=unknown -thread_warp_size=32", [-1, 16, 64, 49152, 2147483647, 1024, 8, 32], "", 0, []], [[], [["CI", 2], ["FU", 4, [0, 1, 2, 3, 4]], ["SP", 4, 0, 401408, [49], 1], ["AN", 4, 0, 5], ["AN", 4, 1, 6]]]], "r": [[8.68276e-06, 8.67755e-06, 8.67514e-06], 0, 2.54318, 1667962218], "v": "v0.6"}
{"i": [["[\"hfused_batch_norm\", 1, 28, 28, 8, 64]", "cuda -keys=cuda,gpu -max_num_threads=1024 -model=unknown -thread_warp_size=32", [-1, 16, 64, 49152, 2147483647, 1024, 8, 32], "", 0, []], [[], [["CI", 2], ["FU", 4, [0, 1, 2, 3, 4]], ["SP", 4, 0, 401408, [28], 1], ["AN", 4, 0, 5], ["AN", 4, 1, 6]]]], "r": [[1.34533e-05, 1.3448e-05, 1.34525e-05], 0, 3.23852, 1667962219], "v": "v0.6"}
{"i": [["[\"hfused_batch_norm\", 1, 28, 28, 8, 64]", "cuda -keys=cuda,gpu -max_num_threads=1024 -model=unknown -thread_warp_size=32", [-1, 16, 64, 49152, 2147483647, 1024, 8, 32], "", 0, []], [[], [["CI", 2], ["FU", 4, [0, 1, 2, 3, 4]], ["SP", 4, 0, 401408, [2], 1], ["AN", 4, 0, 5], ["AN", 4, 1, 6]]]], "r": [[0.000151538, 0.000151481, 0.000151461], 0, 3.56848, 1667962219], "v": "v0.6"}
{"i": [["[\"hfused_batch_norm\", 1, 28, 28, 8, 64]", "cuda -keys=cuda,gpu -max_num_threads=1024 -model=unknown -thread_warp_size=32", [-1, 16, 64, 49152, 2147483647, 1024, 8, 32], "", 0, []], [[], [["CI", 2], ["FU", 4, [0, 1, 2, 3, 4]], ["SP", 4, 0, 401408, [4], 1], ["AN", 4, 0, 5], ["AN", 4, 1, 6]]]], "r": [[7.7099e-05, 7.71012e-05, 7.71011e-05], 0, 3.86368, 1667962220], "v": "v0.6"}
{"i": [["[\"hfused_batch_norm\", 1, 28, 28, 8, 64]", "cuda -keys=cuda,gpu -max_num_threads=1024 -model=unknown -thread_warp_size=32", [-1, 16, 64, 49152, 2147483647, 1024, 8, 32], "", 0, []], [[], [["CI", 2], ["FU", 4, [0, 1, 2, 3, 4]], ["SP", 4, 0, 401408, [7], 1], ["AN", 4, 0, 5], ["AN", 4, 1, 6]]]], "r": [[4.52068e-05, 4.52018e-05, 4.52128e-05], 0, 4.2289, 1667962220], "v": "v0.6"}
{"i": [["[\"hfused_batch_norm\", 1, 28, 28, 8, 64]", "cuda -keys=cuda,gpu -max_num_threads=1024 -model=unknown -thread_warp_size=32", [-1, 16, 64, 49152, 2147483647, 1024, 8, 32], "", 0, []], [[], [["CI", 2], ["FU", 4, [0, 1, 2, 3, 4]], ["SP", 4, 0, 401408, [8], 1], ["AN", 4, 0, 5], ["AN", 4, 1, 6]]]], "r": [[4.00027e-05, 4.00225e-05, 4.001e-05], 0, 2.86428, 1667962219], "v": "v0.6"}
{"i": [["[\"hfused_batch_norm\", 1, 28, 28, 8, 64]", "cuda -keys=cuda,gpu -max_num_threads=1024 -model=unknown -thread_warp_size=32", [-1, 16, 64, 49152, 2147483647, 1024, 8, 32], "", 0, []], [[], [["CI", 2], ["FU", 4, [0, 1, 2, 3, 4]], ["SP", 4, 0, 401408, [8], 1], ["AN", 4, 0, 5], ["AN", 4, 1, 6]]]], "r": [[3.99265e-05, 3.99344e-05, 3.99071e-05], 0, 0.860198, 1667962282], "v": "v0.6"}
{"i": [["[\"hfused_batch_norm\", 1, 28, 28, 8, 64]", "cuda -keys=cuda,gpu -max_num_threads=1024 -model=unknown -thread_warp_size=32", [-1, 16, 64, 49152, 2147483647, 1024, 8, 32], "", 0, []], [[], [["CI", 2], ["FU", 4, [0, 1, 2, 3, 4]], ["SP", 4, 0, 401408, [7], 1], ["AN", 4, 0, 5], ["AN", 4, 1, 6]]]], "r": [[4.53653e-05, 4.53576e-05, 4.53631e-05], 0, 2.21572, 1667962283], "v": "v0.6"}
{"i": [["[\"hfused_batch_norm\", 1, 28, 28, 8, 64]", "cuda -keys=cuda,gpu -max_num_threads=1024 -model=unknown -thread_warp_size=32", [-1, 16, 64, 49152, 2147483647, 1024, 8, 32], "", 0, []], [[], [["CI", 2], ["FU", 4, [0, 1, 2, 3, 4]], ["SP", 4, 0, 401408, [64], 1], ["AN", 4, 0, 5], ["AN", 4, 1, 6]]]], "r": [[7.23753e-06, 7.24011e-06, 7.23737e-06], 0, 0.54647, 1667962282], "v": "v0.6"}
{"i": [["[\"hfused_batch_norm\", 1, 28, 28, 8, 64]", "cuda -keys=cuda,gpu -max_num_threads=1024 -model=unknown -thread_warp_size=32", [-1, 16, 64, 49152, 2147483647, 1024, 8, 32], "", 0, []], [[], [["CI", 2], ["FU", 4, [0, 1, 2, 3, 4]], ["SP", 4, 0, 401408, [1], 1], ["AN", 4, 0, 5], ["AN", 4, 1, 6]]]], "r": [[0.00030042, 0.000300404, 0.000300358], 0, 1.85316, 1667962283], "v": "v0.6"}
{"i": [["[\"hfused_batch_norm\", 1, 28, 28, 8, 64]", "cuda -keys=cuda,gpu -max_num_threads=1024 -model=unknown -thread_warp_size=32", [-1, 16, 64, 49152, 2147483647, 1024, 8, 32], "", 0, []], [[], [["CI", 2], ["FU", 4, [0, 1, 2, 3, 4]], ["SP", 4, 0, 401408, [2], 1], ["AN", 4, 0, 5], ["AN", 4, 1, 6]]]], "r": [[0.000151531, 0.000151526, 0.000151546], 0, 1.23975, 1667962282], "v": "v0.6"}
{"i": [["[\"hfused_batch_norm\", 1, 28, 28, 8, 64]", "cuda -keys=cuda,gpu -max_num_threads=1024 -model=unknown -thread_warp_size=32", [-1, 16, 64, 49152, 2147483647, 1024, 8, 32], "", 0, []], [[], [["CI", 2], ["FU", 4, [0, 1, 2, 3, 4]], ["SP", 4, 0, 401408, [14], 1], ["AN", 4, 0, 5], ["AN", 4, 1, 6]]]], "r": [[2.42431e-05, 2.42485e-05, 2.42387e-05], 0, 1.5403, 1667962283], "v": "v0.6"}
{"i": [["[\"hfused_batch_norm\", 1, 28, 28, 8, 64]", "cuda -keys=cuda,gpu -max_num_threads=1024 -model=unknown -thread_warp_size=32", [-1, 16, 64, 49152, 2147483647, 1024, 8, 32], "", 0, []], [[], [["CI", 2], ["FU", 4, [0, 1, 2, 3, 4]], ["SP", 4, 0, 401408, [49], 1], ["AN", 4, 0, 5], ["AN", 4, 1, 6]]]], "r": [[8.71247e-06, 8.7114e-06, 8.7115e-06], 0, 3.23453, 1667962284], "v": "v0.6"}
{"i": [["[\"hfused_batch_norm\", 1, 28, 28, 8, 64]", "cuda -keys=cuda,gpu -max_num_threads=1024 -model=unknown -thread_warp_size=32", [-1, 16, 64, 49152, 2147483647, 1024, 8, 32], "", 0, []], [[], [["CI", 2], ["FU", 4, [0, 1, 2, 3, 4]], ["SP", 4, 0, 401408, [56], 1], ["AN", 4, 0, 5], ["AN", 4, 1, 6]]]], "r": [[8.00728e-06, 8.00619e-06, 8.0108e-06], 0, 2.54032, 1667962284], "v": "v0.6"}
{"i": [["[\"hfused_batch_norm\", 1, 28, 28, 8, 64]", "cuda -keys=cuda,gpu -max_num_threads=1024 -model=unknown -thread_warp_size=32", [-1, 16, 64, 49152, 2147483647, 1024, 8, 32], "", 0, []], [[], [["CI", 2], ["FU", 4, [0, 1, 2, 3, 4]], ["SP", 4, 0, 401408, [16], 1], ["AN", 4, 0, 5], ["AN", 4, 1, 6]]]], "r": [[2.15848e-05, 2.15814e-05, 2.15804e-05], 0, 2.86249, 1667962284], "v": "v0.6"}
{"i": [["[\"hfused_batch_norm\", 1, 28, 28, 8, 64]", "cuda -keys=cuda,gpu -max_num_threads=1024 -model=unknown -thread_warp_size=32", [-1, 16, 64, 49152, 2147483647, 1024, 8, 32], "", 0, []], [[], [["CI", 2], ["FU", 4, [0, 1, 2, 3, 4]], ["SP", 4, 0, 401408, [32], 1], ["AN", 4, 0, 5], ["AN", 4, 1, 6]]]], "r": [[1.20521e-05, 1.20551e-05, 1.20552e-05], 0, 3.87733, 1667962285], "v": "v0.6"}
{"i": [["[\"hfused_batch_norm\", 1, 28, 28, 8, 64]", "cuda -keys=cuda,gpu -max_num_threads=1024 -model=unknown -thread_warp_size=32", [-1, 16, 64, 49152, 2147483647, 1024, 8, 32], "", 0, []], [[], [["CI", 2], ["FU", 4, [0, 1, 2, 3, 4]], ["SP", 4, 0, 401408, [4], 1], ["AN", 4, 0, 5], ["AN", 4, 1, 6]]]], "r": [[7.70951e-05, 7.70974e-05, 7.71042e-05], 0, 3.56013, 1667962285], "v": "v0.6"}
{"i": [["[\"hfused_batch_norm\", 1, 28, 28, 8, 64]", "cuda -keys=cuda,gpu -max_num_threads=1024 -model=unknown -thread_warp_size=32", [-1, 16, 64, 49152, 2147483647, 1024, 8, 32], "", 0, []], [[], [["CI", 2], ["FU", 4, [0, 1, 2, 3, 4]], ["SP", 4, 0, 401408, [28], 1], ["AN", 4, 0, 5], ["AN", 4, 1, 6]]]], "r": [[1.34095e-05, 1.34102e-05, 1.34068e-05], 0, 4.25588, 1667962286], "v": "v0.6"}
{"i": [["[\"hfused_batch_norm\", 1, 28, 28, 8, 64]", "cuda -keys=cuda,gpu -max_num_threads=1024 -model=unknown -thread_warp_size=32", [-1, 16, 64, 49152, 2147483647, 1024, 8, 32], "", 0, []], [[], [["CI", 2], ["FU", 4, [0, 1, 2, 3, 4]], ["SP", 4, 0, 401408, [32], 1], ["AN", 4, 0, 5], ["AN", 4, 1, 6]]]], "r": [[1.20811e-05, 1.20916e-05, 1.20803e-05], 0, 1.55495, 1667962326], "v": "v0.6"}
{"i": [["[\"hfused_batch_norm\", 1, 28, 28, 8, 64]", "cuda -keys=cuda,gpu -max_num_threads=1024 -model=unknown -thread_warp_size=32", [-1, 16, 64, 49152, 2147483647, 1024, 8, 32], "", 0, []], [[], [["CI", 2], ["FU", 4, [0, 1, 2, 3, 4]], ["SP", 4, 0, 401408, [56], 1], ["AN", 4, 0, 5], ["AN", 4, 1, 6]]]], "r": [[7.90903e-06, 7.90808e-06, 7.9112e-06], 0, 1.23749, 1667962326], "v": "v0.6"}
{"i": [["[\"hfused_batch_norm\", 1, 28, 28, 8, 64]", "cuda -keys=cuda,gpu -max_num_threads=1024 -model=unknown -thread_warp_size=32", [-1, 16, 64, 49152, 2147483647, 1024, 8, 32], "", 0, []], [[], [["CI", 2], ["FU", 4, [0, 1, 2, 3, 4]], ["SP", 4, 0, 401408, [14], 1], ["AN", 4, 0, 5], ["AN", 4, 1, 6]]]], "r": [[2.40517e-05, 2.40507e-05, 2.40526e-05], 0, 0.547909, 1667962325], "v": "v0.6"}
{"i": [["[\"hfused_batch_norm\", 1, 28, 28, 8, 64]", "cuda -keys=cuda,gpu -max_num_threads=1024 -model=unknown -thread_warp_size=32", [-1, 16, 64, 49152, 2147483647, 1024, 8, 32], "", 0, []], [[], [["CI", 2], ["FU", 4, [0, 1, 2, 3, 4]], ["SP", 4, 0, 401408, [2], 1], ["AN", 4, 0, 5], ["AN", 4, 1, 6]]]], "r": [[0.000151612, 0.000151596, 0.000151618], 0, 0.868041, 1667962325], "v": "v0.6"}
{"i": [["[\"hfused_batch_norm\", 1, 28, 28, 8, 64]", "cuda -keys=cuda,gpu -max_num_threads=1024 -model=unknown -thread_warp_size=32", [-1, 16, 64, 49152, 2147483647, 1024, 8, 32], "", 0, []], [[], [["CI", 2], ["FU", 4, [0, 1, 2, 3, 4]], ["SP", 4, 0, 401408, [8], 1], ["AN", 4, 0, 5], ["AN", 4, 1, 6]]]], "r": [[3.98717e-05, 3.98673e-05, 3.9865e-05], 0, 2.56943, 1667962327], "v": "v0.6"}
{"i": [["[\"hfused_batch_norm\", 1, 28, 28, 8, 64]", "cuda -keys=cuda,gpu -max_num_threads=1024 -model=unknown -thread_warp_size=32", [-1, 16, 64, 49152, 2147483647, 1024, 8, 32], "", 0, []], [[], [["CI", 2], ["FU", 4, [0, 1, 2, 3, 4]], ["SP", 4, 0, 401408, [7], 1], ["AN", 4, 0, 5], ["AN", 4, 1, 6]]]], "r": [[4.52976e-05, 4.52743e-05, 4.52671e-05], 0, 1.88418, 1667962326], "v": "v0.6"}
{"i": [["[\"hfused_batch_norm\", 1, 28, 28, 8, 64]", "cuda -keys=cuda,gpu -max_num_threads=1024 -model=unknown -thread_warp_size=32", [-1, 16, 64, 49152, 2147483647, 1024, 8, 32], "", 0, []], [[], [["CI", 2], ["FU", 4, [0, 1, 2, 3, 4]], ["SP", 4, 0, 401408, [64], 1], ["AN", 4, 0, 5], ["AN", 4, 1, 6]]]], "r": [[7.25092e-06, 7.24572e-06, 7.238e-06], 0, 2.24137, 1667962327], "v": "v0.6"}
{"i": [["[\"hfused_batch_norm\", 1, 28, 28, 8, 64]", "cuda -keys=cuda,gpu -max_num_threads=1024 -model=unknown -thread_warp_size=32", [-1, 16, 64, 49152, 2147483647, 1024, 8, 32], "", 0, []], [[], [["CI", 2], ["FU", 4, [0, 1, 2, 3, 4]], ["SP", 4, 0, 401408, [16], 1], ["AN", 4, 0, 5], ["AN", 4, 1, 6]]]], "r": [[2.15814e-05, 2.159e-05, 2.15737e-05], 0, 2.90488, 1667962327], "v": "v0.6"}
{"i": [["[\"hfused_batch_norm\", 1, 28, 28, 8, 64]", "cuda -keys=cuda,gpu -max_num_threads=1024 -model=unknown -thread_warp_size=32", [-1, 16, 64, 49152, 2147483647, 1024, 8, 32], "", 0, []], [[], [["CI", 2], ["FU", 4, [0, 1, 2, 3, 4]], ["SP", 4, 0, 401408, [49], 1], ["AN", 4, 0, 5], ["AN", 4, 1, 6]]]], "r": [[8.76512e-06, 8.76311e-06, 8.75695e-06], 0, 4.24595, 1667962329], "v": "v0.6"}
{"i": [["[\"hfused_batch_norm\", 1, 28, 28, 8, 64]", "cuda -keys=cuda,gpu -max_num_threads=1024 -model=unknown -thread_warp_size=32", [-1, 16, 64, 49152, 2147483647, 1024, 8, 32], "", 0, []], [[], [["CI", 2], ["FU", 4, [0, 1, 2, 3, 4]], ["SP", 4, 0, 401408, [1], 1], ["AN", 4, 0, 5], ["AN", 4, 1, 6]]]], "r": [[0.00030039, 0.000300389, 0.000300365], 0, 3.23913, 1667962328], "v": "v0.6"}
{"i": [["[\"hfused_batch_norm\", 1, 28, 28, 8, 64]", "cuda -keys=cuda,gpu -max_num_threads=1024 -model=unknown -thread_warp_size=32", [-1, 16, 64, 49152, 2147483647, 1024, 8, 32], "", 0, []], [[], [["CI", 2], ["FU", 4, [0, 1, 2, 3, 4]], ["SP", 4, 0, 401408, [4], 1], ["AN", 4, 0, 5], ["AN", 4, 1, 6]]]], "r": [[7.70988e-05, 7.70904e-05, 7.70919e-05], 0, 3.88504, 1667962328], "v": "v0.6"}
{"i": [["[\"hfused_batch_norm\", 1, 28, 28, 8, 64]", "cuda -keys=cuda,gpu -max_num_threads=1024 -model=unknown -thread_warp_size=32", [-1, 16, 64, 49152, 2147483647, 1024, 8, 32], "", 0, []], [[], [["CI", 2], ["FU", 4, [0, 1, 2, 3, 4]], ["SP", 4, 0, 401408, [28], 1], ["AN", 4, 0, 5], ["AN", 4, 1, 6]]]], "r": [[1.35707e-05, 1.35602e-05, 1.35741e-05], 0, 3.5554, 1667962328], "v": "v0.6"}
{"i": [["[\"hfused_batch_norm\", 1, 28, 28, 8, 64]", "cuda -keys=cuda,gpu -max_num_threads=1024 -model=unknown -thread_warp_size=32", [-1, 16, 64, 49152, 2147483647, 1024, 8, 32], "", 0, []], [[], [["CI", 2], ["FU", 4, [0, 1, 2, 3, 4]], ["SP", 4, 0, 401408, [4], 1], ["AN", 4, 0, 5], ["AN", 4, 1, 6]]]], "r": [[7.73065e-05, 7.73219e-05, 7.72821e-05], 0, 1.25855, 1667962390], "v": "v0.6"}
{"i": [["[\"hfused_batch_norm\", 1, 28, 28, 8, 64]", "cuda -keys=cuda,gpu -max_num_threads=1024 -model=unknown -thread_warp_size=32", [-1, 16, 64, 49152, 2147483647, 1024, 8, 32], "", 0, []], [[], [["CI", 2], ["FU", 4, [0, 1, 2, 3, 4]], ["SP", 4, 0, 401408, [14], 1], ["AN", 4, 0, 5], ["AN", 4, 1, 6]]]], "r": [[2.40987e-05, 2.41083e-05, 2.40969e-05], 0, 2.24143, 1667962391], "v": "v0.6"}
{"i": [["[\"hfused_batch_norm\", 1, 28, 28, 8, 64]", "cuda -keys=cuda,gpu -max_num_threads=1024 -model=unknown -thread_warp_size=32", [-1, 16, 64, 49152, 2147483647, 1024, 8, 32], "", 0, []], [[], [["CI", 2], ["FU", 4, [0, 1, 2, 3, 4]], ["SP", 4, 0, 401408, [28], 1], ["AN", 4, 0, 5], ["AN", 4, 1, 6]]]], "r": [[1.35976e-05, 1.36016e-05, 1.35972e-05], 0, 0.550107, 1667962390], "v": "v0.6"}
{"i": [["[\"hfused_batch_norm\", 1, 28, 28, 8, 64]", "cuda -keys=cuda,gpu -max_num_threads=1024 -model=unknown -thread_warp_size=32", [-1, 16, 64, 49152, 2147483647, 1024, 8, 32], "", 0, []], [[], [["CI", 2], ["FU", 4, [0, 1, 2, 3, 4]], ["SP", 4, 0, 401408, [16], 1], ["AN", 4, 0, 5], ["AN", 4, 1, 6]]]], "r": [[2.14833e-05, 2.14826e-05, 2.14807e-05], 0, 1.88211, 1667962391], "v": "v0.6"}
{"i": [["[\"hfused_batch_norm\", 1, 28, 28, 8, 64]", "cuda -keys=cuda,gpu -max_num_threads=1024 -model=unknown -thread_warp_size=32", [-1, 16, 64, 49152, 2147483647, 1024, 8, 32], "", 0, []], [[], [["CI", 2], ["FU", 4, [0, 1, 2, 3, 4]], ["SP", 4, 0, 401408, [8], 1], ["AN", 4, 0, 5], ["AN", 4, 1, 6]]]], "r": [[3.98945e-05, 3.9883e-05, 3.98888e-05], 0, 0.881099, 1667962390], "v": "v0.6"}
{"i": [["[\"hfused_batch_norm\", 1, 28, 28, 8, 64]", "cuda -keys=cuda,gpu -max_num_threads=1024 -model=unknown -thread_warp_size=32", [-1, 16, 64, 49152, 2147483647, 1024, 8, 32], "", 0, []], [[], [["CI", 2], ["FU", 4, [0, 1, 2, 3, 4]], ["SP", 4, 0, 401408, [49], 1], ["AN", 4, 0, 5], ["AN", 4, 1, 6]]]], "r": [[8.68873e-06, 8.69147e-06, 8.68912e-06], 0, 1.54219, 1667962391], "v": "v0.6"}
{"i": [["[\"hfused_batch_norm\", 1, 28, 28, 8, 64]", "cuda -keys=cuda,gpu -max_num_threads=1024 -model=unknown -thread_warp_size=32", [-1, 16, 64, 49152, 2147483647, 1024, 8, 32], "", 0, []], [[], [["CI", 2], ["FU", 4, [0, 1, 2, 3, 4]], ["SP", 4, 0, 401408, [32], 1], ["AN", 4, 0, 5], ["AN", 4, 1, 6]]]], "r": [[1.20292e-05, 1.20232e-05, 1.20306e-05], 0, 3.21846, 1667962393], "v": "v0.6"}
{"i": [["[\"hfused_batch_norm\", 1, 28, 28, 8, 64]", "cuda -keys=cuda,gpu -max_num_threads=1024 -model=unknown -thread_warp_size=32", [-1, 16, 64, 49152, 2147483647, 1024, 8, 32], "", 0, []], [[], [["CI", 2], ["FU", 4, [0, 1, 2, 3, 4]], ["SP", 4, 0, 401408, [2], 1], ["AN", 4, 0, 5], ["AN", 4, 1, 6]]]], "r": [[0.000151535, 0.000151546, 0.000151572], 0, 2.84744, 1667962392], "v": "v0.6"}
{"i": [["[\"hfused_batch_norm\", 1, 28, 28, 8, 64]", "cuda -keys=cuda,gpu -max_num_threads=1024 -model=unknown -thread_warp_size=32", [-1, 16, 64, 49152, 2147483647, 1024, 8, 32], "", 0, []], [[], [["CI", 2], ["FU", 4, [0, 1, 2, 3, 4]], ["SP", 4, 0, 401408, [56], 1], ["AN", 4, 0, 5], ["AN", 4, 1, 6]]]], "r": [[7.91151e-06, 7.90629e-06, 7.90592e-06], 0, 2.55571, 1667962392], "v": "v0.6"}
{"i": [["[\"hfused_batch_norm\", 1, 28, 28, 8, 64]", "cuda -keys=cuda,gpu -max_num_threads=1024 -model=unknown -thread_warp_size=32", [-1, 16, 64, 49152, 2147483647, 1024, 8, 32], "", 0, []], [[], [["CI", 2], ["FU", 4, [0, 1, 2, 3, 4]], ["SP", 4, 0, 401408, [64], 1], ["AN", 4, 0, 5], ["AN", 4, 1, 6]]]], "r": [[7.34912e-06, 7.34811e-06, 7.34822e-06], 0, 3.53803, 1667962393], "v": "v0.6"}
{"i": [["[\"hfused_batch_norm\", 1, 28, 28, 8, 64]", "cuda -keys=cuda,gpu -max_num_threads=1024 -model=unknown -thread_warp_size=32", [-1, 16, 64, 49152, 2147483647, 1024, 8, 32], "", 0, []], [[], [["CI", 2], ["FU", 4, [0, 1, 2, 3, 4]], ["SP", 4, 0, 401408, [1], 1], ["AN", 4, 0, 5], ["AN", 4, 1, 6]]]], "r": [[0.000300436, 0.000300464, 0.00030043], 0, 3.85575, 1667962393], "v": "v0.6"}
{"i": [["[\"hfused_batch_norm\", 1, 28, 28, 8, 64]", "cuda -keys=cuda,gpu -max_num_threads=1024 -model=unknown -thread_warp_size=32", [-1, 16, 64, 49152, 2147483647, 1024, 8, 32], "", 0, []], [[], [["CI", 2], ["FU", 4, [0, 1, 2, 3, 4]], ["SP", 4, 0, 401408, [7], 1], ["AN", 4, 0, 5], ["AN", 4, 1, 6]]]], "r": [[4.52298e-05, 4.52199e-05, 4.52164e-05], 0, 4.19413, 1667962394], "v": "v0.6"}
{"i": [["[\"hfused_batch_norm\", 1, 28, 28, 8, 64]", "cuda -keys=cuda,gpu -max_num_threads=1024 -model=unknown -thread_warp_size=32", [-1, 16, 64, 49152, 2147483647, 1024, 8, 32], "", 0, []], [[], [["CI", 2], ["FU", 4, [0, 1, 2, 3, 4]], ["SP", 4, 0, 401408, [4], 1], ["AN", 4, 0, 5], ["AN", 4, 1, 6]]]], "r": [[7.71452e-05, 7.71404e-05, 7.71666e-05], 0, 1.55129, 1667962434], "v": "v0.6"}
{"i": [["[\"hfused_batch_norm\", 1, 28, 28, 8, 64]", "cuda -keys=cuda,gpu -max_num_threads=1024 -model=unknown -thread_warp_size=32", [-1, 16, 64, 49152, 2147483647, 1024, 8, 32], "", 0, []], [[], [["CI", 2], ["FU", 4, [0, 1, 2, 3, 4]], ["SP", 4, 0, 401408, [49], 1], ["AN", 4, 0, 5], ["AN", 4, 1, 6]]]], "r": [[8.8548e-06, 8.85231e-06, 8.84689e-06], 0, 0.545997, 1667962432], "v": "v0.6"}
{"i": [["[\"hfused_batch_norm\", 1, 28, 28, 8, 64]", "cuda -keys=cuda,gpu -max_num_threads=1024 -model=unknown -thread_warp_size=32", [-1, 16, 64, 49152, 2147483647, 1024, 8, 32], "", 0, []], [[], [["CI", 2], ["FU", 4, [0, 1, 2, 3, 4]], ["SP", 4, 0, 401408, [28], 1], ["AN", 4, 0, 5], ["AN", 4, 1, 6]]]], "r": [[1.34398e-05, 1.34474e-05, 1.34454e-05], 0, 2.54218, 1667962435], "v": "v0.6"}
{"i": [["[\"hfused_batch_norm\", 1, 28, 28, 8, 64]", "cuda -keys=cuda,gpu -max_num_threads=1024 -model=unknown -thread_warp_size=32", [-1, 16, 64, 49152, 2147483647, 1024, 8, 32], "", 0, []], [[], [["CI", 2], ["FU", 4, [0, 1, 2, 3, 4]], ["SP", 4, 0, 401408, [1], 1], ["AN", 4, 0, 5], ["AN", 4, 1, 6]]]], "r": [[0.000300442, 0.000300448, 0.000300437], 0, 1.84675, 1667962434], "v": "v0.6"}
{"i": [["[\"hfused_batch_norm\", 1, 28, 28, 8, 64]", "cuda -keys=cuda,gpu -max_num_threads=1024 -model=unknown -thread_warp_size=32", [-1, 16, 64, 49152, 2147483647, 1024, 8, 32], "", 0, []], [[], [["CI", 2], ["FU", 4, [0, 1, 2, 3, 4]], ["SP", 4, 0, 401408, [14], 1], ["AN", 4, 0, 5], ["AN", 4, 1, 6]]]], "r": [[2.40416e-05, 2.40414e-05, 2.40404e-05], 0, 1.22754, 1667962433], "v": "v0.6"}
{"i": [["[\"hfused_batch_norm\", 1, 28, 28, 8, 64]", "cuda -keys=cuda,gpu -max_num_threads=1024 -model=unknown -thread_warp_size=32", [-1, 16, 64, 49152, 2147483647, 1024, 8, 32], "", 0, []], [[], [["CI", 2], ["FU", 4, [0, 1, 2, 3, 4]], ["SP", 4, 0, 401408, [56], 1], ["AN", 4, 0, 5], ["AN", 4, 1, 6]]]], "r": [[7.96008e-06, 7.956e-06, 7.95686e-06], 0, 0.855293, 1667962433], "v": "v0.6"}
{"i": [["[\"hfused_batch_norm\", 1, 28, 28, 8, 64]", "cuda -keys=cuda,gpu -max_num_threads=1024 -model=unknown -thread_warp_size=32", [-1, 16, 64, 49152, 2147483647, 1024, 8, 32], "", 0, []], [[], [["CI", 2], ["FU", 4, [0, 1, 2, 3, 4]], ["SP", 4, 0, 401408, [2], 1], ["AN", 4, 0, 5], ["AN", 4, 1, 6]]]], "r": [[0.000151549, 0.000151576, 0.000151558], 0, 2.20944, 1667962434], "v": "v0.6"}
{"i": [["[\"hfused_batch_norm\", 1, 28, 28, 8, 64]", "cuda -keys=cuda,gpu -max_num_threads=1024 -model=unknown -thread_warp_size=32", [-1, 16, 64, 49152, 2147483647, 1024, 8, 32], "", 0, []], [[], [["CI", 2], ["FU", 4, [0, 1, 2, 3, 4]], ["SP", 4, 0, 401408, [64], 1], ["AN", 4, 0, 5], ["AN", 4, 1, 6]]]], "r": [[7.16302e-06, 7.16329e-06, 7.15505e-06], 0, 2.85434, 1667962435], "v": "v0.6"}
{"i": [["[\"hfused_batch_norm\", 1, 28, 28, 8, 64]", "cuda -keys=cuda,gpu -max_num_threads=1024 -model=unknown -thread_warp_size=32", [-1, 16, 64, 49152, 2147483647, 1024, 8, 32], "", 0, []], [[], [["CI", 2], ["FU", 4, [0, 1, 2, 3, 4]], ["SP", 4, 0, 401408, [7], 1], ["AN", 4, 0, 5], ["AN", 4, 1, 6]]]], "r": [[4.53397e-05, 4.53365e-05, 4.53351e-05], 0, 3.22343, 1667962435], "v": "v0.6"}
{"i": [["[\"hfused_batch_norm\", 1, 28, 28, 8, 64]", "cuda -keys=cuda,gpu -max_num_threads=1024 -model=unknown -thread_warp_size=32", [-1, 16, 64, 49152, 2147483647, 1024, 8, 32], "", 0, []], [[], [["CI", 2], ["FU", 4, [0, 1, 2, 3, 4]], ["SP", 4, 0, 401408, [16], 1], ["AN", 4, 0, 5], ["AN", 4, 1, 6]]]], "r": [[2.15589e-05, 2.15638e-05, 2.15473e-05], 0, 3.53863, 1667962436], "v": "v0.6"}
{"i": [["[\"hfused_batch_norm\", 1, 28, 28, 8, 64]", "cuda -keys=cuda,gpu -max_num_threads=1024 -model=unknown -thread_warp_size=32", [-1, 16, 64, 49152, 2147483647, 1024, 8, 32], "", 0, []], [[], [["CI", 2], ["FU", 4, [0, 1, 2, 3, 4]], ["SP", 4, 0, 401408, [8], 1], ["AN", 4, 0, 5], ["AN", 4, 1, 6]]]], "r": [[4.00505e-05, 4.00449e-05, 4.00549e-05], 0, 4.21999, 1667962436], "v": "v0.6"}
{"i": [["[\"hfused_batch_norm\", 1, 28, 28, 8, 64]", "cuda -keys=cuda,gpu -max_num_threads=1024 -model=unknown -thread_warp_size=32", [-1, 16, 64, 49152, 2147483647, 1024, 8, 32], "", 0, []], [[], [["CI", 2], ["FU", 4, [0, 1, 2, 3, 4]], ["SP", 4, 0, 401408, [32], 1], ["AN", 4, 0, 5], ["AN", 4, 1, 6]]]], "r": [[1.20595e-05, 1.20605e-05, 1.2054e-05], 0, 3.84866, 1667962436], "v": "v0.6"}
