python/models/resnext/ResNextHorizontal_kernel_configs/resnext_imagenet_50_conv1x1_1_28_28_512_512.log
{"i": [["[\"conv1x1\", 1, 28, 28, 512, 512]", "cuda -keys=cuda,gpu -max_num_threads=1024 -model=unknown -thread_warp_size=32", [-1, 16, 64, 49152, 2147483647, 1024, 8, 32], "", 0, []], [[], [["CHW", 2, "local"], ["SP", 2, 0, 1, [1, 1, 1, 1], 1], ["SP", 2, 5, 28, [1, 1, 28, 1], 1], ["SP", 2, 10, 28, [1, 7, 1, 2], 1], ["SP", 2, 15, 512, [1, 32, 4, 1], 1], ["SP", 2, 20, 512, [1, 8], 1], ["RE", 2, [0, 5, 10, 15, 1, 6, 11, 16, 2, 7, 12, 17, 20, 21, 3, 8, 13, 18, 22, 4, 9, 14, 19]], ["FSP", 3, 0, 1, 3], ["FSP", 3, 4, 2, 3], ["FSP", 3, 8, 3, 3], ["FSP", 3, 12, 4, 3], ["RE", 3, [0, 4, 8, 12, 1, 5, 9, 13, 2, 6, 10, 14, 3, 7, 11, 15]], ["CA", 2, 3, 11], ["CHR", 1, "shared", [2]], ["CA", 2, 3, 12], ["CHR", 0, "shared", [3]], ["CA", 1, 4, 12], ["FU", 5, [0, 1, 2, 3]], ["AN", 5, 0, 5], ["FU", 5, [1, 2, 3, 4]], ["AN", 5, 1, 4], ["FU", 5, [2, 3, 4, 5]], ["AN", 5, 2, 6], ["FU", 3, [0, 1]], ["SP", 3, 0, 64, [1], 1], ["AN", 3, 1, 2], ["FFSP", 3, 0, [4, 3, 2, 1], 1, 1], ["AN", 3, 1, 6], ["FU", 1, [0, 1, 2, 3]], ["SP", 1, 0, 448, [1], 1], ["AN", 1, 1, 2], ["FFSP", 1, 0, [4, 3, 2, 1], 1, 1], ["AN", 1, 1, 6], ["PR", 4, 0, "auto_unroll_max_step$16"]]]], "r": [[0.000775987, 0.000775855, 0.0007755], 0, 2.84915, 1667896911], "v": "v0.6"}
{"i": [["[\"conv1x1\", 1, 28, 28, 512, 512]", "cuda -keys=cuda,gpu -max_num_threads=1024 -model=unknown -thread_warp_size=32", [-1, 16, 64, 49152, 2147483647, 1024, 8, 32], "", 0, []], [[], [["CHW", 2, "local"], ["SP", 2, 0, 1, [1, 1, 1, 1], 1], ["SP", 2, 5, 28, [1, 2, 14, 1], 1], ["SP", 2, 10, 28, [1, 7, 2, 1], 1], ["SP", 2, 15, 512, [1, 8, 16, 4], 1], ["SP", 2, 20, 512, [4, 2], 1], ["RE", 2, [0, 5, 10, 15, 1, 6, 11, 16, 2, 7, 12, 17, 20, 21, 3, 8, 13, 18, 22, 4, 9, 14, 19]], ["FSP", 3, 0, 1, 3], ["FSP", 3, 4, 2, 3], ["FSP", 3, 8, 3, 3], ["FSP", 3, 12, 4, 3], ["RE", 3, [0, 4, 8, 12, 1, 5, 9, 13, 2, 6, 10, 14, 3, 7, 11, 15]], ["CA", 2, 3, 11], ["CHR", 1, "shared", [2]], ["CA", 2, 3, 12], ["CHR", 0, "shared", [3]], ["CA", 1, 4, 12], ["FU", 5, [0, 1, 2, 3]], ["AN", 5, 0, 5], ["FU", 5, [1, 2, 3, 4]], ["AN", 5, 1, 4], ["FU", 5, [2, 3, 4, 5]], ["AN", 5, 2, 6], ["FU", 3, [0, 1]], ["SP", 3, 0, 512, [1], 1], ["AN", 3, 1, 2], ["FFSP", 3, 0, [4, 3, 2, 1], 1, 1], ["AN", 3, 1, 6], ["FU", 1, [0, 1, 2, 3]], ["SP", 1, 0, 224, [1], 1], ["AN", 1, 1, 2], ["FFSP", 1, 0, [4, 3, 2, 1], 1, 1], ["AN", 1, 1, 6], ["PR", 4, 0, "auto_unroll_max_step$512"]]]], "r": [[0.00775418, 0.00775661, 0.00775273], 0, 1.52947, 1667896909], "v": "v0.6"}
{"i": [["[\"conv1x1\", 1, 28, 28, 512, 512]", "cuda -keys=cuda,gpu -max_num_threads=1024 -model=unknown -thread_warp_size=32", [-1, 16, 64, 49152, 2147483647, 1024, 8, 32], "", 0, []], [[], [["CHW", 2, "local"], ["SP", 2, 0, 1, [1, 1, 1, 1], 1], ["SP", 2, 5, 28, [2, 1, 2, 1], 1], ["SP", 2, 10, 28, [7, 2, 1, 2], 1], ["SP", 2, 15, 512, [1, 64, 4, 2], 1], ["SP", 2, 20, 512, [8, 1], 1], ["RE", 2, [0, 5, 10, 15, 1, 6, 11, 16, 2, 7, 12, 17, 20, 21, 3, 8, 13, 18, 22, 4, 9, 14, 19]], ["FSP", 3, 0, 1, 3], ["FSP", 3, 4, 2, 3], ["FSP", 3, 8, 3, 3], ["FSP", 3, 12, 4, 3], ["RE", 3, [0, 4, 8, 12, 1, 5, 9, 13, 2, 6, 10, 14, 3, 7, 11, 15]], ["CA", 2, 3, 11], ["CHR", 1, "shared", [2]], ["CA", 2, 3, 12], ["CHR", 0, "shared", [3]], ["CA", 1, 4, 12], ["FU", 5, [0, 1, 2, 3]], ["AN", 5, 0, 5], ["FU", 5, [1, 2, 3, 4]], ["AN", 5, 1, 4], ["FU", 5, [2, 3, 4, 5]], ["AN", 5, 2, 6], ["FU", 3, [0, 1]], ["SP", 3, 0, 64, [1], 1], ["AN", 3, 1, 2], ["FFSP", 3, 0, [4, 3, 2, 1], 1, 1], ["AN", 3, 1, 6], ["FU", 1, [0, 1, 2, 3]], ["SP", 1, 0, 32, [1], 1], ["AN", 1, 1, 2], ["FFSP", 1, 0, [4, 3, 2, 1], 1, 1], ["AN", 1, 1, 6], ["PR", 4, 0, "auto_unroll_max_step$64"]]]], "r": [[0.00356641, 0.00356891, 0.00356876], 0, 4.36233, 1667896912], "v": "v0.6"}
{"i": [["[\"conv1x1\", 1, 28, 28, 512, 512]", "cuda -keys=cuda,gpu -max_num_threads=1024 -model=unknown -thread_warp_size=32", [-1, 16, 64, 49152, 2147483647, 1024, 8, 32], "", 0, []], [[], [["CHW", 2, "local"], ["SP", 2, 0, 1, [1, 1, 1, 1], 1], ["SP", 2, 5, 28, [7, 1, 1, 4], 1], ["SP", 2, 10, 28, [1, 1, 1, 1], 1], ["SP", 2, 15, 512, [1, 32, 8, 2], 1], ["SP", 2, 20, 512, [1, 8], 1], ["RE", 2, [0, 5, 10, 15, 1, 6, 11, 16, 2, 7, 12, 17, 20, 21, 3, 8, 13, 18, 22, 4, 9, 14, 19]], ["FSP", 3, 0, 1, 3], ["FSP", 3, 4, 2, 3], ["FSP", 3, 8, 3, 3], ["FSP", 3, 12, 4, 3], ["RE", 3, [0, 4, 8, 12, 1, 5, 9, 13, 2, 6, 10, 14, 3, 7, 11, 15]], ["CA", 2, 3, 11], ["CHR", 1, "shared", [2]], ["CA", 2, 3, 12], ["CHR", 0, "shared", [3]], ["CA", 1, 4, 12], ["FU", 5, [0, 1, 2, 3]], ["AN", 5, 0, 5], ["FU", 5, [1, 2, 3, 4]], ["AN", 5, 1, 4], ["FU", 5, [2, 3, 4, 5]], ["AN", 5, 2, 6], ["FU", 3, [0, 1]], ["SP", 3, 0, 128, [1], 1], ["AN", 3, 1, 2], ["FFSP", 3, 0, [4, 3, 2, 1], 1, 1], ["AN", 3, 1, 6], ["FU", 1, [0, 1, 2, 3]], ["SP", 1, 0, 32, [16], 1], ["AN", 1, 1, 2], ["FFSP", 1, 0, [4, 3, 2, 1], 1, 1], ["AN", 1, 1, 6], ["PR", 4, 0, "auto_unroll_max_step$16"]]]], "r": [[0.000680458, 0.000680315, 0.000680203], 0, 1.54407, 1667896909], "v": "v0.6"}
{"i": [["[\"conv1x1\", 1, 28, 28, 512, 512]", "cuda -keys=cuda,gpu -max_num_threads=1024 -model=unknown -thread_warp_size=32", [-1, 16, 64, 49152, 2147483647, 1024, 8, 32], "", 0, []], [[], [["CHW", 2, "local"], ["SP", 2, 0, 1, [1, 1, 1, 1], 1], ["SP", 2, 5, 28, [1, 1, 1, 7], 1], ["SP", 2, 10, 28, [1, 28, 1, 1], 1], ["SP", 2, 15, 512, [2, 4, 1, 64], 1], ["SP", 2, 20, 512, [1, 8], 1], ["RE", 2, [0, 5, 10, 15, 1, 6, 11, 16, 2, 7, 12, 17, 20, 21, 3, 8, 13, 18, 22, 4, 9, 14, 19]], ["FSP", 3, 0, 1, 3], ["FSP", 3, 4, 2, 3], ["FSP", 3, 8, 3, 3], ["FSP", 3, 12, 4, 3], ["RE", 3, [0, 4, 8, 12, 1, 5, 9, 13, 2, 6, 10, 14, 3, 7, 11, 15]], ["CA", 2, 3, 11], ["CHR", 1, "shared", [2]], ["CA", 2, 3, 12], ["CHR", 0, "shared", [3]], ["CA", 1, 4, 12], ["FU", 5, [0, 1, 2, 3]], ["AN", 5, 0, 5], ["FU", 5, [1, 2, 3, 4]], ["AN", 5, 1, 4], ["FU", 5, [2, 3, 4, 5]], ["AN", 5, 2, 6], ["FU", 3, [0, 1]], ["SP", 3, 0, 512, [8], 1], ["AN", 3, 1, 2], ["FFSP", 3, 0, [4, 3, 2, 1], 1, 1], ["AN", 3, 1, 6], ["FU", 1, [0, 1, 2, 3]], ["SP", 1, 0, 56, [2], 1], ["AN", 1, 1, 2], ["FFSP", 1, 0, [4, 3, 2, 1], 1, 1], ["AN", 1, 1, 6], ["PR", 4, 0, "auto_unroll_max_step$64"]]]], "r": [[0.00726631, 0.00726951, 0.00726212], 0, 2.14465, 1667896910], "v": "v0.6"}
{"i": [["[\"conv1x1\", 1, 28, 28, 512, 512]", "cuda -keys=cuda,gpu -max_num_threads=1024 -model=unknown -thread_warp_size=32", [-1, 16, 64, 49152, 2147483647, 1024, 8, 32], "", 0, []], [[], [["CHW", 2, "local"], ["SP", 2, 0, 1, [1, 1, 1, 1], 1], ["SP", 2, 5, 28, [1, 1, 7, 2], 1], ["SP", 2, 10, 28, [1, 7, 1, 1], 1], ["SP", 2, 15, 512, [1, 64, 1, 2], 1], ["SP", 2, 20, 512, [2, 1], 1], ["RE", 2, [0, 5, 10, 15, 1, 6, 11, 16, 2, 7, 12, 17, 20, 21, 3, 8, 13, 18, 22, 4, 9, 14, 19]], ["FSP", 3, 0, 1, 3], ["FSP", 3, 4, 2, 3], ["FSP", 3, 8, 3, 3], ["FSP", 3, 12, 4, 3], ["RE", 3, [0, 4, 8, 12, 1, 5, 9, 13, 2, 6, 10, 14, 3, 7, 11, 15]], ["CA", 2, 3, 11], ["CHR", 1, "shared", [2]], ["CA", 2, 3, 12], ["CHR", 0, "shared", [3]], ["CA", 1, 4, 12], ["FU", 5, [0, 1, 2, 3]], ["AN", 5, 0, 5], ["FU", 5, [1, 2, 3, 4]], ["AN", 5, 1, 4], ["FU", 5, [2, 3, 4, 5]], ["AN", 5, 2, 6], ["FU", 3, [0, 1]], ["SP", 3, 0, 4, [1], 1], ["AN", 3, 1, 2], ["FFSP", 3, 0, [4, 3, 2, 1], 1, 1], ["AN", 3, 1, 6], ["FU", 1, [0, 1, 2, 3]], ["SP", 1, 0, 196, [1], 1], ["AN", 1, 1, 2], ["FFSP", 1, 0, [4, 3, 2, 1], 1, 1], ["AN", 1, 1, 6], ["PR", 4, 0, "auto_unroll_max_step$64"]]]], "r": [[0.000201166, 0.00020117, 0.000201193], 0, 4.00707, 1667896912], "v": "v0.6"}
{"i": [["[\"conv1x1\", 1, 28, 28, 512, 512]", "cuda -keys=cuda,gpu -max_num_threads=1024 -model=unknown -thread_warp_size=32", [-1, 16, 64, 49152, 2147483647, 1024, 8, 32], "", 0, []], [[], [["CHW", 2, "local"], ["SP", 2, 0, 1, [1, 1, 1, 1], 1], ["SP", 2, 5, 28, [1, 7, 1, 4], 1], ["SP", 2, 10, 28, [1, 1, 1, 7], 1], ["SP", 2, 15, 512, [2, 16, 2, 4], 1], ["SP", 2, 20, 512, [4, 2], 1], ["RE", 2, [0, 5, 10, 15, 1, 6, 11, 16, 2, 7, 12, 17, 20, 21, 3, 8, 13, 18, 22, 4, 9, 14, 19]], ["FSP", 3, 0, 1, 3], ["FSP", 3, 4, 2, 3], ["FSP", 3, 8, 3, 3], ["FSP", 3, 12, 4, 3], ["RE", 3, [0, 4, 8, 12, 1, 5, 9, 13, 2, 6, 10, 14, 3, 7, 11, 15]], ["CA", 2, 3, 11], ["CHR", 1, "shared", [2]], ["CA", 2, 3, 12], ["CHR", 0, "shared", [3]], ["CA", 1, 4, 12], ["FU", 5, [0, 1, 2, 3]], ["AN", 5, 0, 5], ["FU", 5, [1, 2, 3, 4]], ["AN", 5, 1, 4], ["FU", 5, [2, 3, 4, 5]], ["AN", 5, 2, 6], ["FU", 3, [0, 1]], ["SP", 3, 0, 64, [1], 1], ["AN", 3, 1, 2], ["FFSP", 3, 0, [4, 3, 2, 1], 1, 1], ["AN", 3, 1, 6], ["FU", 1, [0, 1, 2, 3]], ["SP", 1, 0, 224, [1], 1], ["AN", 1, 1, 2], ["FFSP", 1, 0, [4, 3, 2, 1], 1, 1], ["AN", 1, 1, 6], ["PR", 4, 0, "auto_unroll_max_step$16"]]]], "r": [[0.00167288, 0.00167421, 0.00167291], 0, 2.83961, 1667896910], "v": "v0.6"}
{"i": [["[\"conv1x1\", 1, 28, 28, 512, 512]", "cuda -keys=cuda,gpu -max_num_threads=1024 -model=unknown -thread_warp_size=32", [-1, 16, 64, 49152, 2147483647, 1024, 8, 32], "", 0, []], [[], [["CHW", 2, "local"], ["SP", 2, 0, 1, [1, 1, 1, 1], 1], ["SP", 2, 5, 28, [1, 1, 4, 1], 1], ["SP", 2, 10, 28, [1, 1, 14, 1], 1], ["SP", 2, 15, 512, [1, 64, 2, 1], 1], ["SP", 2, 20, 512, [2, 1], 1], ["RE", 2, [0, 5, 10, 15, 1, 6, 11, 16, 2, 7, 12, 17, 20, 21, 3, 8, 13, 18, 22, 4, 9, 14, 19]], ["FSP", 3, 0, 1, 3], ["FSP", 3, 4, 2, 3], ["FSP", 3, 8, 3, 3], ["FSP", 3, 12, 4, 3], ["RE", 3, [0, 4, 8, 12, 1, 5, 9, 13, 2, 6, 10, 14, 3, 7, 11, 15]], ["CA", 2, 3, 11], ["CHR", 1, "shared", [2]], ["CA", 2, 3, 12], ["CHR", 0, "shared", [3]], ["CA", 1, 4, 12], ["FU", 5, [0, 1, 2, 3]], ["AN", 5, 0, 5], ["FU", 5, [1, 2, 3, 4]], ["AN", 5, 1, 4], ["FU", 5, [2, 3, 4, 5]], ["AN", 5, 2, 6], ["FU", 3, [0, 1]], ["SP", 3, 0, 4, [1], 1], ["AN", 3, 1, 2], ["FFSP", 3, 0, [4, 3, 2, 1], 1, 1], ["AN", 3, 1, 6], ["FU", 1, [0, 1, 2, 3]], ["SP", 1, 0, 112, [1], 1], ["AN", 1, 1, 2], ["FFSP", 1, 0, [4, 3, 2, 1], 1, 1], ["AN", 1, 1, 6], ["PR", 4, 0, "auto_unroll_max_step$1024"]]]], "r": [[0.000157828, 0.000157809, 0.00015782], 0, 3.18023, 1667896911], "v": "v0.6"}
{"i": [["[\"conv1x1\", 1, 28, 28, 512, 512]", "cuda -keys=cuda,gpu -max_num_threads=1024 -model=unknown -thread_warp_size=32", [-1, 16, 64, 49152, 2147483647, 1024, 8, 32], "", 0, []], [[], [["CHW", 2, "local"], ["SP", 2, 0, 1, [1, 1, 1, 1], 1], ["SP", 2, 5, 28, [2, 7, 1, 1], 1], ["SP", 2, 10, 28, [2, 1, 7, 1], 1], ["SP", 2, 15, 512, [1, 16, 16, 1], 1], ["SP", 2, 20, 512, [2, 8], 1], ["RE", 2, [0, 5, 10, 15, 1, 6, 11, 16, 2, 7, 12, 17, 20, 21, 3, 8, 13, 18, 22, 4, 9, 14, 19]], ["FSP", 3, 0, 1, 3], ["FSP", 3, 4, 2, 3], ["FSP", 3, 8, 3, 3], ["FSP", 3, 12, 4, 3], ["RE", 3, [0, 4, 8, 12, 1, 5, 9, 13, 2, 6, 10, 14, 3, 7, 11, 15]], ["CA", 2, 3, 11], ["CHR", 1, "shared", [2]], ["CA", 2, 3, 12], ["CHR", 0, "shared", [3]], ["CA", 1, 4, 12], ["FU", 5, [0, 1, 2, 3]], ["AN", 5, 0, 5], ["FU", 5, [1, 2, 3, 4]], ["AN", 5, 1, 4], ["FU", 5, [2, 3, 4, 5]], ["AN", 5, 2, 6], ["FU", 3, [0, 1]], ["SP", 3, 0, 256, [8], 1], ["AN", 3, 1, 2], ["FFSP", 3, 0, [4, 3, 2, 1], 1, 1], ["AN", 3, 1, 6], ["FU", 1, [0, 1, 2, 3]], ["SP", 1, 0, 112, [2], 1], ["AN", 1, 1, 2], ["FFSP", 1, 0, [4, 3, 2, 1], 1, 1], ["AN", 1, 1, 6], ["PR", 4, 0, "auto_unroll_max_step$1024"]]]], "r": [[0.000728958, 0.000728665, 0.00073044], 0, 5.89229, 1667896913], "v": "v0.6"}
{"i": [["[\"conv1x1\", 1, 28, 28, 512, 512]", "cuda -keys=cuda,gpu -max_num_threads=1024 -model=unknown -thread_warp_size=32", [-1, 16, 64, 49152, 2147483647, 1024, 8, 32], "", 0, []], [[], [["CHW", 2, "local"], ["SP", 2, 0, 1, [1, 1, 1, 1], 1], ["SP", 2, 5, 28, [1, 2, 2, 7], 1], ["SP", 2, 10, 28, [1, 14, 2, 1], 1], ["SP", 2, 15, 512, [1, 8, 8, 2], 1], ["SP", 2, 20, 512, [2, 1], 1], ["RE", 2, [0, 5, 10, 15, 1, 6, 11, 16, 2, 7, 12, 17, 20, 21, 3, 8, 13, 18, 22, 4, 9, 14, 19]], ["FSP", 3, 0, 1, 3], ["FSP", 3, 4, 2, 3], ["FSP", 3, 8, 3, 3], ["FSP", 3, 12, 4, 3], ["RE", 3, [0, 4, 8, 12, 1, 5, 9, 13, 2, 6, 10, 14, 3, 7, 11, 15]], ["CA", 2, 3, 11], ["CHR", 1, "shared", [2]], ["CA", 2, 3, 12], ["CHR", 0, "shared", [3]], ["CA", 1, 4, 12], ["FU", 5, [0, 1, 2, 3]], ["AN", 5, 0, 5], ["FU", 5, [1, 2, 3, 4]], ["AN", 5, 1, 4], ["FU", 5, [2, 3, 4, 5]], ["AN", 5, 2, 6], ["FU", 3, [0, 1]], ["SP", 3, 0, 128, [1], 1], ["AN", 3, 1, 2], ["FFSP", 3, 0, [4, 3, 2, 1], 1, 1], ["AN", 3, 1, 6], ["FU", 1, [0, 1, 2, 3]], ["SP", 1, 0, 224, [1], 1], ["AN", 1, 1, 2], ["FFSP", 1, 0, [4, 3, 2, 1], 1, 1], ["AN", 1, 1, 6], ["PR", 4, 0, "auto_unroll_max_step$1024"]]]], "r": [[0.0100472, 0.0100388, 0.0100214], 0, 9.95917, 1667896917], "v": "v0.6"}
{"i": [["[\"conv1x1\", 1, 28, 28, 512, 512]", "cuda -keys=cuda,gpu -max_num_threads=1024 -model=unknown -thread_warp_size=32", [-1, 16, 64, 49152, 2147483647, 1024, 8, 32], "", 0, []], [[], [["CHW", 2, "local"], ["SP", 2, 0, 1, [1, 1, 1, 1], 1], ["SP", 2, 5, 28, [1, 1, 1, 7], 1], ["SP", 2, 10, 28, [2, 1, 7, 1], 1], ["SP", 2, 15, 512, [2, 64, 2, 2], 1], ["SP", 2, 20, 512, [2, 1], 1], ["RE", 2, [0, 5, 10, 15, 1, 6, 11, 16, 2, 7, 12, 17, 20, 21, 3, 8, 13, 18, 22, 4, 9, 14, 19]], ["FSP", 3, 0, 1, 3], ["FSP", 3, 4, 2, 3], ["FSP", 3, 8, 3, 3], ["FSP", 3, 12, 4, 3], ["RE", 3, [0, 4, 8, 12, 1, 5, 9, 13, 2, 6, 10, 14, 3, 7, 11, 15]], ["CA", 2, 3, 11], ["CHR", 1, "shared", [2]], ["CA", 2, 3, 12], ["CHR", 0, "shared", [3]], ["CA", 1, 4, 12], ["FU", 5, [0, 1, 2, 3]], ["AN", 5, 0, 5], ["FU", 5, [1, 2, 3, 4]], ["AN", 5, 1, 4], ["FU", 5, [2, 3, 4, 5]], ["AN", 5, 2, 6], ["FU", 3, [0, 1]], ["SP", 3, 0, 8, [1], 1], ["AN", 3, 1, 2], ["FFSP", 3, 0, [4, 3, 2, 1], 1, 1], ["AN", 3, 1, 6], ["FU", 1, [0, 1, 2, 3]], ["SP", 1, 0, 98, [2], 1], ["AN", 1, 1, 2], ["FFSP", 1, 0, [4, 3, 2, 1], 1, 1], ["AN", 1, 1, 6], ["PR", 4, 0, "auto_unroll_max_step$1024"]]]], "r": [[0.0106484, 0.0105604, 0.0106361], 0, 8.26209, 1667896914], "v": "v0.6"}
{"i": [["[\"conv1x1\", 1, 28, 28, 512, 512]", "cuda -keys=cuda,gpu -max_num_threads=1024 -model=unknown -thread_warp_size=32", [-1, 16, 64, 49152, 2147483647, 1024, 8, 32], "", 0, []], [[], [["CHW", 2, "local"], ["SP", 2, 0, 1, [1, 1, 1, 1], 1], ["SP", 2, 5, 28, [1, 14, 1, 1], 1], ["SP", 2, 10, 28, [1, 1, 1, 28], 1], ["SP", 2, 15, 512, [1, 16, 1, 2], 1], ["SP", 2, 20, 512, [8, 1], 1], ["RE", 2, [0, 5, 10, 15, 1, 6, 11, 16, 2, 7, 12, 17, 20, 21, 3, 8, 13, 18, 22, 4, 9, 14, 19]], ["FSP", 3, 0, 1, 3], ["FSP", 3, 4, 2, 3], ["FSP", 3, 8, 3, 3], ["FSP", 3, 12, 4, 3], ["RE", 3, [0, 4, 8, 12, 1, 5, 9, 13, 2, 6, 10, 14, 3, 7, 11, 15]], ["CA", 2, 3, 11], ["CHR", 1, "shared", [2]], ["CA", 2, 3, 12], ["CHR", 0, "shared", [3]], ["CA", 1, 4, 12], ["FU", 5, [0, 1, 2, 3]], ["AN", 5, 0, 5], ["FU", 5, [1, 2, 3, 4]], ["AN", 5, 1, 4], ["FU", 5, [2, 3, 4, 5]], ["AN", 5, 2, 6], ["FU", 3, [0, 1]], ["SP", 3, 0, 32, [16], 1], ["AN", 3, 1, 2], ["FFSP", 3, 0, [4, 3, 2, 1], 1, 1], ["AN", 3, 1, 6], ["FU", 1, [0, 1, 2, 3]], ["SP", 1, 0, 112, [1], 1], ["AN", 1, 1, 2], ["FFSP", 1, 0, [4, 3, 2, 1], 1, 1], ["AN", 1, 1, 6], ["PR", 4, 0, "auto_unroll_max_step$64"]]]], "r": [[0.000230739, 0.000230714, 0.000230704], 0, 4.33964, 1667896912], "v": "v0.6"}
{"i": [["[\"conv1x1\", 1, 28, 28, 512, 512]", "cuda -keys=cuda,gpu -max_num_threads=1024 -model=unknown -thread_warp_size=32", [-1, 16, 64, 49152, 2147483647, 1024, 8, 32], "", 0, []], [[], [["CHW", 2, "local"], ["SP", 2, 0, 1, [1, 1, 1, 1], 1], ["SP", 2, 5, 28, [2, 1, 14, 1], 1], ["SP", 2, 10, 28, [1, 4, 7, 1], 1], ["SP", 2, 15, 512, [2, 16, 1, 1], 1], ["SP", 2, 20, 512, [1, 8], 1], ["RE", 2, [0, 5, 10, 15, 1, 6, 11, 16, 2, 7, 12, 17, 20, 21, 3, 8, 13, 18, 22, 4, 9, 14, 19]], ["FSP", 3, 0, 1, 3], ["FSP", 3, 4, 2, 3], ["FSP", 3, 8, 3, 3], ["FSP", 3, 12, 4, 3], ["RE", 3, [0, 4, 8, 12, 1, 5, 9, 13, 2, 6, 10, 14, 3, 7, 11, 15]], ["CA", 2, 3, 11], ["CHR", 1, "shared", [2]], ["CA", 2, 3, 12], ["CHR", 0, "shared", [3]], ["CA", 1, 4, 12], ["FU", 5, [0, 1, 2, 3]], ["AN", 5, 0, 5], ["FU", 5, [1, 2, 3, 4]], ["AN", 5, 1, 4], ["FU", 5, [2, 3, 4, 5]], ["AN", 5, 2, 6], ["FU", 3, [0, 1]], ["SP", 3, 0, 8, [8], 1], ["AN", 3, 1, 2], ["FFSP", 3, 0, [4, 3, 2, 1], 1, 1], ["AN", 3, 1, 6], ["FU", 1, [0, 1, 2, 3]], ["SP", 1, 0, 1568, [1], 1], ["AN", 1, 1, 2], ["FFSP", 1, 0, [4, 3, 2, 1], 1, 1], ["AN", 1, 1, 6], ["PR", 4, 0, "auto_unroll_max_step$512"]]]], "r": [[0.000746661, 0.000746409, 0.000746145], 0, 10.2924, 1667896918], "v": "v0.6"}
{"i": [["[\"conv1x1\", 1, 28, 28, 512, 512]", "cuda -keys=cuda,gpu -max_num_threads=1024 -model=unknown -thread_warp_size=32", [-1, 16, 64, 49152, 2147483647, 1024, 8, 32], "", 0, []], [[], [["CHW", 2, "local"], ["SP", 2, 0, 1, [1, 1, 1, 1], 1], ["SP", 2, 5, 28, [1, 2, 1, 1], 1], ["SP", 2, 10, 28, [1, 1, 1, 1], 1], ["SP", 2, 15, 512, [4, 16, 2, 4], 1], ["SP", 2, 20, 512, [1, 16], 1], ["RE", 2, [0, 5, 10, 15, 1, 6, 11, 16, 2, 7, 12, 17, 20, 21, 3, 8, 13, 18, 22, 4, 9, 14, 19]], ["FSP", 3, 0, 1, 3], ["FSP", 3, 4, 2, 3], ["FSP", 3, 8, 3, 3], ["FSP", 3, 12, 4, 3], ["RE", 3, [0, 4, 8, 12, 1, 5, 9, 13, 2, 6, 10, 14, 3, 7, 11, 15]], ["CA", 2, 3, 11], ["CHR", 1, "shared", [2]], ["CA", 2, 3, 12], ["CHR", 0, "shared", [3]], ["CA", 1, 4, 12], ["FU", 5, [0, 1, 2, 3]], ["AN", 5, 0, 5], ["FU", 5, [1, 2, 3, 4]], ["AN", 5, 1, 4], ["FU", 5, [2, 3, 4, 5]], ["AN", 5, 2, 6], ["FU", 3, [0, 1]], ["SP", 3, 0, 128, [1], 1], ["AN", 3, 1, 2], ["FFSP", 3, 0, [4, 3, 2, 1], 1, 1], ["AN", 3, 1, 6], ["FU", 1, [0, 1, 2, 3]], ["SP", 1, 0, 16, [1], 1], ["AN", 1, 1, 2], ["FFSP", 1, 0, [4, 3, 2, 1], 1, 1], ["AN", 1, 1, 6], ["PR", 4, 0, "auto_unroll_max_step$1024"]]]], "r": [[0.000164369, 0.000164191, 0.000163581], 0, 7.57197, 1667896915], "v": "v0.6"}
{"i": [["[\"conv1x1\", 1, 28, 28, 512, 512]", "cuda -keys=cuda,gpu -max_num_threads=1024 -model=unknown -thread_warp_size=32", [-1, 16, 64, 49152, 2147483647, 1024, 8, 32], "", 0, []], [[], [["CHW", 2, "local"], ["SP", 2, 0, 1, [1, 1, 1, 1], 1], ["SP", 2, 5, 28, [1, 1, 1, 1], 1], ["SP", 2, 10, 28, [2, 1, 14, 1], 1], ["SP", 2, 15, 512, [1, 8, 1, 16], 1], ["SP", 2, 20, 512, [1, 4], 1], ["RE", 2, [0, 5, 10, 15, 1, 6, 11, 16, 2, 7, 12, 17, 20, 21, 3, 8, 13, 18, 22, 4, 9, 14, 19]], ["FSP", 3, 0, 1, 3], ["FSP", 3, 4, 2, 3], ["FSP", 3, 8, 3, 3], ["FSP", 3, 12, 4, 3], ["RE", 3, [0, 4, 8, 12, 1, 5, 9, 13, 2, 6, 10, 14, 3, 7, 11, 15]], ["CA", 2, 3, 11], ["CHR", 1, "shared", [2]], ["CA", 2, 3, 12], ["CHR", 0, "shared", [3]], ["CA", 1, 4, 12], ["FU", 5, [0, 1, 2, 3]], ["AN", 5, 0, 5], ["FU", 5, [1, 2, 3, 4]], ["AN", 5, 1, 4], ["FU", 5, [2, 3, 4, 5]], ["AN", 5, 2, 6], ["FU", 3, [0, 1]], ["SP", 3, 0, 128, [1], 1], ["AN", 3, 1, 2], ["FFSP", 3, 0, [4, 3, 2, 1], 1, 1], ["AN", 3, 1, 6], ["FU", 1, [0, 1, 2, 3]], ["SP", 1, 0, 8, [4], 1], ["AN", 1, 1, 2], ["FFSP", 1, 0, [4, 3, 2, 1], 1, 1], ["AN", 1, 1, 6], ["PR", 4, 0, "auto_unroll_max_step$1024"]]]], "r": [[0.00171462, 0.00169446, 0.00169196], 0, 8.07778, 1667896916], "v": "v0.6"}
{"i": [["[\"conv1x1\", 1, 28, 28, 512, 512]", "cuda -keys=cuda,gpu -max_num_threads=1024 -model=unknown -thread_warp_size=32", [-1, 16, 64, 49152, 2147483647, 1024, 8, 32], "", 0, []], [[], [["CHW", 2, "local"], ["SP", 2, 0, 1, [1, 1, 1, 1], 1], ["SP", 2, 5, 28, [2, 1, 1, 2], 1], ["SP", 2, 10, 28, [1, 7, 2, 2], 1], ["SP", 2, 15, 512, [2, 2, 1, 8], 1], ["SP", 2, 20, 512, [2, 8], 1], ["RE", 2, [0, 5, 10, 15, 1, 6, 11, 16, 2, 7, 12, 17, 20, 21, 3, 8, 13, 18, 22, 4, 9, 14, 19]], ["FSP", 3, 0, 1, 3], ["FSP", 3, 4, 2, 3], ["FSP", 3, 8, 3, 3], ["FSP", 3, 12, 4, 3], ["RE", 3, [0, 4, 8, 12, 1, 5, 9, 13, 2, 6, 10, 14, 3, 7, 11, 15]], ["CA", 2, 3, 11], ["CHR", 1, "shared", [2]], ["CA", 2, 3, 12], ["CHR", 0, "shared", [3]], ["CA", 1, 4, 12], ["FU", 5, [0, 1, 2, 3]], ["AN", 5, 0, 5], ["FU", 5, [1, 2, 3, 4]], ["AN", 5, 1, 4], ["FU", 5, [2, 3, 4, 5]], ["AN", 5, 2, 6], ["FU", 3, [0, 1]], ["SP", 3, 0, 128, [1], 1], ["AN", 3, 1, 2], ["FFSP", 3, 0, [4, 3, 2, 1], 1, 1], ["AN", 3, 1, 6], ["FU", 1, [0, 1, 2, 3]], ["SP", 1, 0, 128, [1], 1], ["AN", 1, 1, 2], ["FFSP", 1, 0, [4, 3, 2, 1], 1, 1], ["AN", 1, 1, 6], ["PR", 4, 0, "auto_unroll_max_step$0"]]]], "r": [[0.00085017, 0.000850207, 0.000849978], 0, 7.45666, 1667896915], "v": "v0.6"}
{"i": [["[\"conv1x1\", 1, 28, 28, 512, 512]", "cuda -keys=cuda,gpu -max_num_threads=1024 -model=unknown -thread_warp_size=32", [-1, 16, 64, 49152, 2147483647, 1024, 8, 32], "", 0, []], [[], [["CHW", 2, "local"], ["SP", 2, 0, 1, [1, 1, 1, 1], 1], ["SP", 2, 5, 28, [1, 1, 1, 2], 1], ["SP", 2, 10, 28, [1, 14, 1, 2], 1], ["SP", 2, 15, 512, [2, 16, 1, 1], 1], ["SP", 2, 20, 512, [8, 16], 1], ["RE", 2, [0, 5, 10, 15, 1, 6, 11, 16, 2, 7, 12, 17, 20, 21, 3, 8, 13, 18, 22, 4, 9, 14, 19]], ["FSP", 3, 0, 1, 3], ["FSP", 3, 4, 2, 3], ["FSP", 3, 8, 3, 3], ["FSP", 3, 12, 4, 3], ["RE", 3, [0, 4, 8, 12, 1, 5, 9, 13, 2, 6, 10, 14, 3, 7, 11, 15]], ["CA", 2, 3, 11], ["CHR", 1, "shared", [2]], ["CA", 2, 3, 12], ["CHR", 0, "shared", [3]], ["CA", 1, 4, 12], ["FU", 5, [0, 1, 2, 3]], ["AN", 5, 0, 5], ["FU", 5, [1, 2, 3, 4]], ["AN", 5, 1, 4], ["FU", 5, [2, 3, 4, 5]], ["AN", 5, 2, 6], ["FU", 3, [0, 1]], ["SP", 3, 0, 128, [8], 1], ["AN", 3, 1, 2], ["FFSP", 3, 0, [4, 3, 2, 1], 1, 1], ["AN", 3, 1, 6], ["FU", 1, [0, 1, 2, 3]], ["SP", 1, 0, 512, [1], 1], ["AN", 1, 1, 2], ["FFSP", 1, 0, [4, 3, 2, 1], 1, 1], ["AN", 1, 1, 6], ["PR", 4, 0, "auto_unroll_max_step$64"]]]], "r": [[6.11202e-05, 6.11221e-05, 6.11196e-05], 0, 6.96576, 1667896915], "v": "v0.6"}
{"i": [["[\"conv1x1\", 1, 28, 28, 512, 512]", "cuda -keys=cuda,gpu -max_num_threads=1024 -model=unknown -thread_warp_size=32", [-1, 16, 64, 49152, 2147483647, 1024, 8, 32], "", 0, []], [[], [["CHW", 2, "local"], ["SP", 2, 0, 1, [1, 1, 1, 1], 1], ["SP", 2, 5, 28, [1, 1, 1, 1], 1], ["SP", 2, 10, 28, [1, 1, 2, 7], 1], ["SP", 2, 15, 512, [4, 8, 4, 4], 1], ["SP", 2, 20, 512, [1, 2], 1], ["RE", 2, [0, 5, 10, 15, 1, 6, 11, 16, 2, 7, 12, 17, 20, 21, 3, 8, 13, 18, 22, 4, 9, 14, 19]], ["FSP", 3, 0, 1, 3], ["FSP", 3, 4, 2, 3], ["FSP", 3, 8, 3, 3], ["FSP", 3, 12, 4, 3], ["RE", 3, [0, 4, 8, 12, 1, 5, 9, 13, 2, 6, 10, 14, 3, 7, 11, 15]], ["CA", 2, 3, 11], ["CHR", 1, "shared", [2]], ["CA", 2, 3, 12], ["CHR", 0, "shared", [3]], ["CA", 1, 4, 12], ["FU", 5, [0, 1, 2, 3]], ["AN", 5, 0, 5], ["FU", 5, [1, 2, 3, 4]], ["AN", 5, 1, 4], ["FU", 5, [2, 3, 4, 5]], ["AN", 5, 2, 6], ["FU", 3, [0, 1]], ["SP", 3, 0, 32, [1], 1], ["AN", 3, 1, 2], ["FFSP", 3, 0, [4, 3, 2, 1], 1, 1], ["AN", 3, 1, 6], ["FU", 1, [0, 1, 2, 3]], ["SP", 1, 0, 28, [1], 1], ["AN", 1, 1, 2], ["FFSP", 1, 0, [4, 3, 2, 1], 1, 1], ["AN", 1, 1, 6], ["PR", 4, 0, "auto_unroll_max_step$1024"]]]], "r": [[0.00149723, 0.0014969, 0.00149543], 0, 13.2921, 1667896919], "v": "v0.6"}
{"i": [["[\"conv1x1\", 1, 28, 28, 512, 512]", "cuda -keys=cuda,gpu -max_num_threads=1024 -model=unknown -thread_warp_size=32", [-1, 16, 64, 49152, 2147483647, 1024, 8, 32], "", 0, []], [[], [["CHW", 2, "local"], ["SP", 2, 0, 1, [1, 1, 1, 1], 1], ["SP", 2, 5, 28, [2, 7, 1, 1], 1], ["SP", 2, 10, 28, [2, 1, 7, 1], 1], ["SP", 2, 15, 512, [1, 16, 16, 1], 1], ["SP", 2, 20, 512, [2, 2], 1], ["RE", 2, [0, 5, 10, 15, 1, 6, 11, 16, 2, 7, 12, 17, 20, 21, 3, 8, 13, 18, 22, 4, 9, 14, 19]], ["FSP", 3, 0, 1, 3], ["FSP", 3, 4, 2, 3], ["FSP", 3, 8, 3, 3], ["FSP", 3, 12, 4, 3], ["RE", 3, [0, 4, 8, 12, 1, 5, 9, 13, 2, 6, 10, 14, 3, 7, 11, 15]], ["CA", 2, 3, 11], ["CHR", 1, "shared", [2]], ["CA", 2, 3, 12], ["CHR", 0, "shared", [3]], ["CA", 1, 4, 12], ["FU", 5, [0, 1, 2, 3]], ["AN", 5, 0, 5], ["FU", 5, [1, 2, 3, 4]], ["AN", 5, 1, 4], ["FU", 5, [2, 3, 4, 5]], ["AN", 5, 2, 6], ["FU", 3, [0, 1]], ["SP", 3, 0, 256, [1], 1], ["AN", 3, 1, 2], ["FFSP", 3, 0, [4, 3, 2, 1], 1, 1], ["AN", 3, 1, 6], ["FU", 1, [0, 1, 2, 3]], ["SP", 1, 0, 112, [1], 1], ["AN", 1, 1, 2], ["FFSP", 1, 0, [4, 3, 2, 1], 1, 1], ["AN", 1, 1, 6], ["PR", 4, 0, "auto_unroll_max_step$1024"]]]], "r": [[0.0073343, 0.00732591, 0.00733954], 0, 10.6019, 1667896917], "v": "v0.6"}
{"i": [["[\"conv1x1\", 1, 28, 28, 512, 512]", "cuda -keys=cuda,gpu -max_num_threads=1024 -model=unknown -thread_warp_size=32", [-1, 16, 64, 49152, 2147483647, 1024, 8, 32], "", 0, []], [[], [["CHW", 2, "local"], ["SP", 2, 0, 1, [1, 1, 1, 1], 1], ["SP", 2, 5, 28, [1, 1, 14, 1], 1], ["SP", 2, 10, 28, [1, 4, 7, 1], 1], ["SP", 2, 15, 512, [1, 32, 2, 2], 1], ["SP", 2, 20, 512, [1, 16], 1], ["RE", 2, [0, 5, 10, 15, 1, 6, 11, 16, 2, 7, 12, 17, 20, 21, 3, 8, 13, 18, 22, 4, 9, 14, 19]], ["FSP", 3, 0, 1, 3], ["FSP", 3, 4, 2, 3], ["FSP", 3, 8, 3, 3], ["FSP", 3, 12, 4, 3], ["RE", 3, [0, 4, 8, 12, 1, 5, 9, 13, 2, 6, 10, 14, 3, 7, 11, 15]], ["CA", 2, 3, 11], ["CHR", 1, "shared", [2]], ["CA", 2, 3, 12], ["CHR", 0, "shared", [3]], ["CA", 1, 4, 12], ["FU", 5, [0, 1, 2, 3]], ["AN", 5, 0, 5], ["FU", 5, [1, 2, 3, 4]], ["AN", 5, 1, 4], ["FU", 5, [2, 3, 4, 5]], ["AN", 5, 2, 6], ["FU", 3, [0, 1]], ["SP", 3, 0, 64, [1], 1], ["AN", 3, 1, 2], ["FFSP", 3, 0, [4, 3, 2, 1], 1, 1], ["AN", 3, 1, 6], ["FU", 1, [0, 1, 2, 3]], ["SP", 1, 0, 1568, [1], 1], ["AN", 1, 1, 2], ["FFSP", 1, 0, [4, 3, 2, 1], 1, 1], ["AN", 1, 1, 6], ["PR", 4, 0, "auto_unroll_max_step$64"]]]], "r": [[0.000514753, 0.000514474, 0.00051422], 0, 9.85768, 1667896918], "v": "v0.6"}
{"i": [["[\"conv1x1\", 1, 28, 28, 512, 512]", "cuda -keys=cuda,gpu -max_num_threads=1024 -model=unknown -thread_warp_size=32", [-1, 16, 64, 49152, 2147483647, 1024, 8, 32], "", 0, []], [[], [["CHW", 2, "local"], ["SP", 2, 0, 1, [1, 1, 1, 1], 1], ["SP", 2, 5, 28, [1, 1, 2, 2], 1], ["SP", 2, 10, 28, [1, 2, 1, 14], 1], ["SP", 2, 15, 512, [2, 16, 2, 1], 1], ["SP", 2, 20, 512, [1, 2], 1], ["RE", 2, [0, 5, 10, 15, 1, 6, 11, 16, 2, 7, 12, 17, 20, 21, 3, 8, 13, 18, 22, 4, 9, 14, 19]], ["FSP", 3, 0, 1, 3], ["FSP", 3, 4, 2, 3], ["FSP", 3, 8, 3, 3], ["FSP", 3, 12, 4, 3], ["RE", 3, [0, 4, 8, 12, 1, 5, 9, 13, 2, 6, 10, 14, 3, 7, 11, 15]], ["CA", 2, 3, 11], ["CHR", 1, "shared", [2]], ["CA", 2, 3, 12], ["CHR", 0, "shared", [3]], ["CA", 1, 4, 12], ["FU", 5, [0, 1, 2, 3]], ["AN", 5, 0, 5], ["FU", 5, [1, 2, 3, 4]], ["AN", 5, 1, 4], ["FU", 5, [2, 3, 4, 5]], ["AN", 5, 2, 6], ["FU", 3, [0, 1]], ["SP", 3, 0, 4, [1], 1], ["AN", 3, 1, 2], ["FFSP", 3, 0, [4, 3, 2, 1], 1, 1], ["AN", 3, 1, 6], ["FU", 1, [0, 1, 2, 3]], ["SP", 1, 0, 56, [4], 1], ["AN", 1, 1, 2], ["FFSP", 1, 0, [4, 3, 2, 1], 1, 1], ["AN", 1, 1, 6], ["PR", 4, 0, "auto_unroll_max_step$64"]]]], "r": [[0.000307847, 0.000307862, 0.000307847], 0, 8.78136, 1667959821], "v": "v0.6"}
{"i": [["[\"conv1x1\", 1, 28, 28, 512, 512]", "cuda -keys=cuda,gpu -max_num_threads=1024 -model=unknown -thread_warp_size=32", [-1, 16, 64, 49152, 2147483647, 1024, 8, 32], "", 0, []], [[], [["CHW", 2, "local"], ["SP", 2, 0, 1, [1, 1, 1, 1], 1], ["SP", 2, 5, 28, [2, 7, 1, 2], 1], ["SP", 2, 10, 28, [1, 2, 2, 1], 1], ["SP", 2, 15, 512, [2, 16, 4, 2], 1], ["SP", 2, 20, 512, [8, 4], 1], ["RE", 2, [0, 5, 10, 15, 1, 6, 11, 16, 2, 7, 12, 17, 20, 21, 3, 8, 13, 18, 22, 4, 9, 14, 19]], ["FSP", 3, 0, 1, 3], ["FSP", 3, 4, 2, 3], ["FSP", 3, 8, 3, 3], ["FSP", 3, 12, 4, 3], ["RE", 3, [0, 4, 8, 12, 1, 5, 9, 13, 2, 6, 10, 14, 3, 7, 11, 15]], ["CA", 2, 3, 11], ["CHR", 1, "shared", [2]], ["CA", 2, 3, 12], ["CHR", 0, "shared", [3]], ["CA", 1, 4, 12], ["FU", 5, [0, 1, 2, 3]], ["AN", 5, 0, 5], ["FU", 5, [1, 2, 3, 4]], ["AN", 5, 1, 4], ["FU", 5, [2, 3, 4, 5]], ["AN", 5, 2, 6], ["FU", 3, [0, 1]], ["SP", 3, 0, 256, [1], 1], ["AN", 3, 1, 2], ["FFSP", 3, 0, [4, 3, 2, 1], 1, 1], ["AN", 3, 1, 6], ["FU", 1, [0, 1, 2, 3]], ["SP", 1, 0, 128, [1], 1], ["AN", 1, 1, 2], ["FFSP", 1, 0, [4, 3, 2, 1], 1, 1], ["AN", 1, 1, 6], ["PR", 4, 0, "auto_unroll_max_step$512"]]]], "r": [[0.000241966, 0.000241952, 0.000241898], 0, 18.1693, 1667959830], "v": "v0.6"}
{"i": [["[\"conv1x1\", 1, 28, 28, 512, 512]", "cuda -keys=cuda,gpu -max_num_threads=1024 -model=unknown -thread_warp_size=32", [-1, 16, 64, 49152, 2147483647, 1024, 8, 32], "", 0, []], [[], [["CHW", 2, "local"], ["SP", 2, 0, 1, [1, 1, 1, 1], 1], ["SP", 2, 5, 28, [1, 2, 7, 1], 1], ["SP", 2, 10, 28, [2, 1, 2, 1], 1], ["SP", 2, 15, 512, [2, 64, 2, 1], 1], ["SP", 2, 20, 512, [16, 1], 1], ["RE", 2, [0, 5, 10, 15, 1, 6, 11, 16, 2, 7, 12, 17, 20, 21, 3, 8, 13, 18, 22, 4, 9, 14, 19]], ["FSP", 3, 0, 1, 3], ["FSP", 3, 4, 2, 3], ["FSP", 3, 8, 3, 3], ["FSP", 3, 12, 4, 3], ["RE", 3, [0, 4, 8, 12, 1, 5, 9, 13, 2, 6, 10, 14, 3, 7, 11, 15]], ["CA", 2, 3, 11], ["CHR", 1, "shared", [2]], ["CA", 2, 3, 12], ["CHR", 0, "shared", [3]], ["CA", 1, 4, 12], ["FU", 5, [0, 1, 2, 3]], ["AN", 5, 0, 5], ["FU", 5, [1, 2, 3, 4]], ["AN", 5, 1, 4], ["FU", 5, [2, 3, 4, 5]], ["AN", 5, 2, 6], ["FU", 3, [0, 1]], ["SP", 3, 0, 32, [1], 1], ["AN", 3, 1, 2], ["FFSP", 3, 0, [4, 3, 2, 1], 1, 1], ["AN", 3, 1, 6], ["FU", 1, [0, 1, 2, 3]], ["SP", 1, 0, 112, [1], 1], ["AN", 1, 1, 2], ["FFSP", 1, 0, [4, 3, 2, 1], 1, 1], ["AN", 1, 1, 6], ["PR", 4, 0, "auto_unroll_max_step$0"]]]], "r": [[0.000121888, 0.000121781, 0.000121766], 0, 2.6106, 1667959815], "v": "v0.6"}
{"i": [["[\"conv1x1\", 1, 28, 28, 512, 512]", "cuda -keys=cuda,gpu -max_num_threads=1024 -model=unknown -thread_warp_size=32", [-1, 16, 64, 49152, 2147483647, 1024, 8, 32], "", 0, []], [[], [["CHW", 2, "local"], ["SP", 2, 0, 1, [1, 1, 1, 1], 1], ["SP", 2, 5, 28, [2, 7, 2, 1], 1], ["SP", 2, 10, 28, [1, 7, 1, 1], 1], ["SP", 2, 15, 512, [1, 1, 16, 4], 1], ["SP", 2, 20, 512, [4, 2], 1], ["RE", 2, [0, 5, 10, 15, 1, 6, 11, 16, 2, 7, 12, 17, 20, 21, 3, 8, 13, 18, 22, 4, 9, 14, 19]], ["FSP", 3, 0, 1, 3], ["FSP", 3, 4, 2, 3], ["FSP", 3, 8, 3, 3], ["FSP", 3, 12, 4, 3], ["RE", 3, [0, 4, 8, 12, 1, 5, 9, 13, 2, 6, 10, 14, 3, 7, 11, 15]], ["CA", 2, 3, 11], ["CHR", 1, "shared", [2]], ["CA", 2, 3, 12], ["CHR", 0, "shared", [3]], ["CA", 1, 4, 12], ["FU", 5, [0, 1, 2, 3]], ["AN", 5, 0, 5], ["FU", 5, [1, 2, 3, 4]], ["AN", 5, 1, 4], ["FU", 5, [2, 3, 4, 5]], ["AN", 5, 2, 6], ["FU", 3, [0, 1]], ["SP", 3, 0, 512, [1], 1], ["AN", 3, 1, 2], ["FFSP", 3, 0, [4, 3, 2, 1], 1, 1], ["AN", 3, 1, 6], ["FU", 1, [0, 1, 2, 3]], ["SP", 1, 0, 16, [1], 1], ["AN", 1, 1, 2], ["FFSP", 1, 0, [4, 3, 2, 1], 1, 1], ["AN", 1, 1, 6], ["PR", 4, 0, "auto_unroll_max_step$16"]]]], "r": [[0.000662933, 0.000662059, 0.000662121], 0, 10.597, 1667959823], "v": "v0.6"}
{"i": [["[\"conv1x1\", 1, 28, 28, 512, 512]", "cuda -keys=cuda,gpu -max_num_threads=1024 -model=unknown -thread_warp_size=32", [-1, 16, 64, 49152, 2147483647, 1024, 8, 32], "", 0, []], [[], [["CHW", 2, "local"], ["SP", 2, 0, 1, [1, 1, 1, 1], 1], ["SP", 2, 5, 28, [1, 2, 7, 2], 1], ["SP", 2, 10, 28, [4, 1, 7, 1], 1], ["SP", 2, 15, 512, [1, 32, 1, 4], 1], ["SP", 2, 20, 512, [1, 2], 1], ["RE", 2, [0, 5, 10, 15, 1, 6, 11, 16, 2, 7, 12, 17, 20, 21, 3, 8, 13, 18, 22, 4, 9, 14, 19]], ["FSP", 3, 0, 1, 3], ["FSP", 3, 4, 2, 3], ["FSP", 3, 8, 3, 3], ["FSP", 3, 12, 4, 3], ["RE", 3, [0, 4, 8, 12, 1, 5, 9, 13, 2, 6, 10, 14, 3, 7, 11, 15]], ["CA", 2, 3, 11], ["CHR", 1, "shared", [2]], ["CA", 2, 3, 12], ["CHR", 0, "shared", [3]], ["CA", 1, 4, 12], ["FU", 5, [0, 1, 2, 3]], ["AN", 5, 0, 5], ["FU", 5, [1, 2, 3, 4]], ["AN", 5, 1, 4], ["FU", 5, [2, 3, 4, 5]], ["AN", 5, 2, 6], ["FU", 3, [0, 1]], ["SP", 3, 0, 8, [1], 1], ["AN", 3, 1, 2], ["FFSP", 3, 0, [4, 3, 2, 1], 1, 1], ["AN", 3, 1, 6], ["FU", 1, [0, 1, 2, 3]], ["SP", 1, 0, 196, [1], 1], ["AN", 1, 1, 2], ["FFSP", 1, 0, [4, 3, 2, 1], 1, 1], ["AN", 1, 1, 6], ["PR", 4, 0, "auto_unroll_max_step$512"]]]], "r": [[0.00538138, 0.00540128, 0.00539595], 0, 5.44251, 1667959817], "v": "v0.6"}
{"i": [["[\"conv1x1\", 1, 28, 28, 512, 512]", "cuda -keys=cuda,gpu -max_num_threads=1024 -model=unknown -thread_warp_size=32", [-1, 16, 64, 49152, 2147483647, 1024, 8, 32], "", 0, []], [[], [["CHW", 2, "local"], ["SP", 2, 0, 1, [1, 1, 1, 1], 1], ["SP", 2, 5, 28, [1, 1, 1, 4], 1], ["SP", 2, 10, 28, [4, 7, 1, 1], 1], ["SP", 2, 15, 512, [2, 16, 1, 16], 1], ["SP", 2, 20, 512, [8, 1], 1], ["RE", 2, [0, 5, 10, 15, 1, 6, 11, 16, 2, 7, 12, 17, 20, 21, 3, 8, 13, 18, 22, 4, 9, 14, 19]], ["FSP", 3, 0, 1, 3], ["FSP", 3, 4, 2, 3], ["FSP", 3, 8, 3, 3], ["FSP", 3, 12, 4, 3], ["RE", 3, [0, 4, 8, 12, 1, 5, 9, 13, 2, 6, 10, 14, 3, 7, 11, 15]], ["CA", 2, 3, 11], ["CHR", 1, "shared", [2]], ["CA", 2, 3, 12], ["CHR", 0, "shared", [3]], ["CA", 1, 4, 12], ["FU", 5, [0, 1, 2, 3]], ["AN", 5, 0, 5], ["FU", 5, [1, 2, 3, 4]], ["AN", 5, 1, 4], ["FU", 5, [2, 3, 4, 5]], ["AN", 5, 2, 6], ["FU", 3, [0, 1]], ["SP", 3, 0, 256, [2], 1], ["AN", 3, 1, 2], ["FFSP", 3, 0, [4, 3, 2, 1], 1, 1], ["AN", 3, 1, 6], ["FU", 1, [0, 1, 2, 3]], ["SP", 1, 0, 64, [1], 1], ["AN", 1, 1, 2], ["FFSP", 1, 0, [4, 3, 2, 1], 1, 1], ["AN", 1, 1, 6], ["PR", 4, 0, "auto_unroll_max_step$64"]]]], "r": [[0.0040194, 0.00401862, 0.00401593], 0, 3.33925, 1667959815], "v": "v0.6"}
{"i": [["[\"conv1x1\", 1, 28, 28, 512, 512]", "cuda -keys=cuda,gpu -max_num_threads=1024 -model=unknown -thread_warp_size=32", [-1, 16, 64, 49152, 2147483647, 1024, 8, 32], "", 0, []], [[], [["CHW", 2, "local"], ["SP", 2, 0, 1, [1, 1, 1, 1], 1], ["SP", 2, 5, 28, [1, 2, 1, 7], 1], ["SP", 2, 10, 28, [1, 28, 1, 1], 1], ["SP", 2, 15, 512, [2, 4, 1, 8], 1], ["SP", 2, 20, 512, [8, 1], 1], ["RE", 2, [0, 5, 10, 15, 1, 6, 11, 16, 2, 7, 12, 17, 20, 21, 3, 8, 13, 18, 22, 4, 9, 14, 19]], ["FSP", 3, 0, 1, 3], ["FSP", 3, 4, 2, 3], ["FSP", 3, 8, 3, 3], ["FSP", 3, 12, 4, 3], ["RE", 3, [0, 4, 8, 12, 1, 5, 9, 13, 2, 6, 10, 14, 3, 7, 11, 15]], ["CA", 2, 3, 11], ["CHR", 1, "shared", [2]], ["CA", 2, 3, 12], ["CHR", 0, "shared", [3]], ["CA", 1, 4, 12], ["FU", 5, [0, 1, 2, 3]], ["AN", 5, 0, 5], ["FU", 5, [1, 2, 3, 4]], ["AN", 5, 1, 4], ["FU", 5, [2, 3, 4, 5]], ["AN", 5, 2, 6], ["FU", 3, [0, 1]], ["SP", 3, 0, 64, [1], 1], ["AN", 3, 1, 2], ["FFSP", 3, 0, [4, 3, 2, 1], 1, 1], ["AN", 3, 1, 6], ["FU", 1, [0, 1, 2, 3]], ["SP", 1, 0, 112, [1], 1], ["AN", 1, 1, 2], ["FFSP", 1, 0, [4, 3, 2, 1], 1, 1], ["AN", 1, 1, 6], ["PR", 4, 0, "auto_unroll_max_step$0"]]]], "r": [[0.000257372, 0.000257452, 0.000257168], 0, 3.59454, 1667959816], "v": "v0.6"}
{"i": [["[\"conv1x1\", 1, 28, 28, 512, 512]", "cuda -keys=cuda,gpu -max_num_threads=1024 -model=unknown -thread_warp_size=32", [-1, 16, 64, 49152, 2147483647, 1024, 8, 32], "", 0, []], [[], [["CHW", 2, "local"], ["SP", 2, 0, 1, [1, 1, 1, 1], 1], ["SP", 2, 5, 28, [2, 7, 1, 2], 1], ["SP", 2, 10, 28, [1, 1, 1, 1], 1], ["SP", 2, 15, 512, [4, 1, 8, 16], 1], ["SP", 2, 20, 512, [2, 4], 1], ["RE", 2, [0, 5, 10, 15, 1, 6, 11, 16, 2, 7, 12, 17, 20, 21, 3, 8, 13, 18, 22, 4, 9, 14, 19]], ["FSP", 3, 0, 1, 3], ["FSP", 3, 4, 2, 3], ["FSP", 3, 8, 3, 3], ["FSP", 3, 12, 4, 3], ["RE", 3, [0, 4, 8, 12, 1, 5, 9, 13, 2, 6, 10, 14, 3, 7, 11, 15]], ["CA", 2, 3, 11], ["CHR", 1, "shared", [2]], ["CA", 2, 3, 12], ["CHR", 0, "shared", [3]], ["CA", 1, 4, 12], ["FU", 5, [0, 1, 2, 3]], ["AN", 5, 0, 5], ["FU", 5, [1, 2, 3, 4]], ["AN", 5, 1, 4], ["FU", 5, [2, 3, 4, 5]], ["AN", 5, 2, 6], ["FU", 3, [0, 1]], ["SP", 3, 0, 1024, [1], 1], ["AN", 3, 1, 2], ["FFSP", 3, 0, [4, 3, 2, 1], 1, 1], ["AN", 3, 1, 6], ["FU", 1, [0, 1, 2, 3]], ["SP", 1, 0, 32, [1], 1], ["AN", 1, 1, 2], ["FFSP", 1, 0, [4, 3, 2, 1], 1, 1], ["AN", 1, 1, 6], ["PR", 4, 0, "auto_unroll_max_step$16"]]]], "r": [[0.00774504, 0.00779833, 0.00766175], 0, 15.1034, 1667959827], "v": "v0.6"}
{"i": [["[\"conv1x1\", 1, 28, 28, 512, 512]", "cuda -keys=cuda,gpu -max_num_threads=1024 -model=unknown -thread_warp_size=32", [-1, 16, 64, 49152, 2147483647, 1024, 8, 32], "", 0, []], [[], [["CHW", 2, "local"], ["SP", 2, 0, 1, [1, 1, 1, 1], 1], ["SP", 2, 5, 28, [1, 1, 2, 14], 1], ["SP", 2, 10, 28, [2, 1, 2, 1], 1], ["SP", 2, 15, 512, [2, 128, 1, 2], 1], ["SP", 2, 20, 512, [4, 2], 1], ["RE", 2, [0, 5, 10, 15, 1, 6, 11, 16, 2, 7, 12, 17, 20, 21, 3, 8, 13, 18, 22, 4, 9, 14, 19]], ["FSP", 3, 0, 1, 3], ["FSP", 3, 4, 2, 3], ["FSP", 3, 8, 3, 3], ["FSP", 3, 12, 4, 3], ["RE", 3, [0, 4, 8, 12, 1, 5, 9, 13, 2, 6, 10, 14, 3, 7, 11, 15]], ["CA", 2, 3, 11], ["CHR", 1, "shared", [2]], ["CA", 2, 3, 12], ["CHR", 0, "shared", [3]], ["CA", 1, 4, 12], ["FU", 5, [0, 1, 2, 3]], ["AN", 5, 0, 5], ["FU", 5, [1, 2, 3, 4]], ["AN", 5, 1, 4], ["FU", 5, [2, 3, 4, 5]], ["AN", 5, 2, 6], ["FU", 3, [0, 1]], ["SP", 3, 0, 16, [1], 1], ["AN", 3, 1, 2], ["FFSP", 3, 0, [4, 3, 2, 1], 1, 1], ["AN", 3, 1, 6], ["FU", 1, [0, 1, 2, 3]], ["SP", 1, 0, 448, [56], 1], ["AN", 1, 1, 2], ["FFSP", 1, 0, [4, 3, 2, 1], 1, 1], ["AN", 1, 1, 6], ["PR", 4, 0, "auto_unroll_max_step$1024"]]]], "r": [[0.00335731, 0.00335827, 0.00335926], 0, 8.93803, 1667959819], "v": "v0.6"}
{"i": [["[\"conv1x1\", 1, 28, 28, 512, 512]", "cuda -keys=cuda,gpu -max_num_threads=1024 -model=unknown -thread_warp_size=32", [-1, 16, 64, 49152, 2147483647, 1024, 8, 32], "", 0, []], [[], [["CHW", 2, "local"], ["SP", 2, 0, 1, [1, 1, 1, 1], 1], ["SP", 2, 5, 28, [2, 1, 1, 2], 1], ["SP", 2, 10, 28, [1, 2, 2, 1], 1], ["SP", 2, 15, 512, [1, 512, 1, 1], 1], ["SP", 2, 20, 512, [4, 4], 1], ["RE", 2, [0, 5, 10, 15, 1, 6, 11, 16, 2, 7, 12, 17, 20, 21, 3, 8, 13, 18, 22, 4, 9, 14, 19]], ["FSP", 3, 0, 1, 3], ["FSP", 3, 4, 2, 3], ["FSP", 3, 8, 3, 3], ["FSP", 3, 12, 4, 3], ["RE", 3, [0, 4, 8, 12, 1, 5, 9, 13, 2, 6, 10, 14, 3, 7, 11, 15]], ["CA", 2, 3, 11], ["CHR", 1, "shared", [2]], ["CA", 2, 3, 12], ["CHR", 0, "shared", [3]], ["CA", 1, 4, 12], ["FU", 5, [0, 1, 2, 3]], ["AN", 5, 0, 5], ["FU", 5, [1, 2, 3, 4]], ["AN", 5, 1, 4], ["FU", 5, [2, 3, 4, 5]], ["AN", 5, 2, 6], ["FU", 3, [0, 1]], ["SP", 3, 0, 16, [1], 1], ["AN", 3, 1, 2], ["FFSP", 3, 0, [4, 3, 2, 1], 1, 1], ["AN", 3, 1, 6], ["FU", 1, [0, 1, 2, 3]], ["SP", 1, 0, 64, [2], 1], ["AN", 1, 1, 2], ["FFSP", 1, 0, [4, 3, 2, 1], 1, 1], ["AN", 1, 1, 6], ["PR", 4, 0, "auto_unroll_max_step$0"]]]], "r": [[0.000102078, 0.000102082, 0.000102022], 0, 8.70771, 1667959822], "v": "v0.6"}
{"i": [["[\"conv1x1\", 1, 28, 28, 512, 512]", "cuda -keys=cuda,gpu -max_num_threads=1024 -model=unknown -thread_warp_size=32", [-1, 16, 64, 49152, 2147483647, 1024, 8, 32], "", 0, []], [[], [["CHW", 2, "local"], ["SP", 2, 0, 1, [1, 1, 1, 1], 1], ["SP", 2, 5, 28, [7, 1, 1, 1], 1], ["SP", 2, 10, 28, [1, 2, 7, 2], 1], ["SP", 2, 15, 512, [1, 32, 2, 2], 1], ["SP", 2, 20, 512, [2, 2], 1], ["RE", 2, [0, 5, 10, 15, 1, 6, 11, 16, 2, 7, 12, 17, 20, 21, 3, 8, 13, 18, 22, 4, 9, 14, 19]], ["FSP", 3, 0, 1, 3], ["FSP", 3, 4, 2, 3], ["FSP", 3, 8, 3, 3], ["FSP", 3, 12, 4, 3], ["RE", 3, [0, 4, 8, 12, 1, 5, 9, 13, 2, 6, 10, 14, 3, 7, 11, 15]], ["CA", 2, 3, 11], ["CHR", 1, "shared", [2]], ["CA", 2, 3, 12], ["CHR", 0, "shared", [3]], ["CA", 1, 4, 12], ["FU", 5, [0, 1, 2, 3]], ["AN", 5, 0, 5], ["FU", 5, [1, 2, 3, 4]], ["AN", 5, 1, 4], ["FU", 5, [2, 3, 4, 5]], ["AN", 5, 2, 6], ["FU", 3, [0, 1]], ["SP", 3, 0, 16, [1], 1], ["AN", 3, 1, 2], ["FFSP", 3, 0, [4, 3, 2, 1], 1, 1], ["AN", 3, 1, 6], ["FU", 1, [0, 1, 2, 3]], ["SP", 1, 0, 56, [1], 1], ["AN", 1, 1, 2], ["FFSP", 1, 0, [4, 3, 2, 1], 1, 1], ["AN", 1, 1, 6], ["PR", 4, 0, "auto_unroll_max_step$512"]]]], "r": [[0.00161524, 0.00161502, 0.00161484], 0, 19.6768, 1667959832], "v": "v0.6"}
{"i": [["[\"conv1x1\", 1, 28, 28, 512, 512]", "cuda -keys=cuda,gpu -max_num_threads=1024 -model=unknown -thread_warp_size=32", [-1, 16, 64, 49152, 2147483647, 1024, 8, 32], "", 0, []], [[], [["CHW", 2, "local"], ["SP", 2, 0, 1, [1, 1, 1, 1], 1], ["SP", 2, 5, 28, [1, 1, 2, 14], 1], ["SP", 2, 10, 28, [1, 2, 1, 1], 1], ["SP", 2, 15, 512, [1, 16, 2, 8], 1], ["SP", 2, 20, 512, [1, 1], 1], ["RE", 2, [0, 5, 10, 15, 1, 6, 11, 16, 2, 7, 12, 17, 20, 21, 3, 8, 13, 18, 22, 4, 9, 14, 19]], ["FSP", 3, 0, 1, 3], ["FSP", 3, 4, 2, 3], ["FSP", 3, 8, 3, 3], ["FSP", 3, 12, 4, 3], ["RE", 3, [0, 4, 8, 12, 1, 5, 9, 13, 2, 6, 10, 14, 3, 7, 11, 15]], ["CA", 2, 3, 11], ["CHR", 1, "shared", [2]], ["CA", 2, 3, 12], ["CHR", 0, "shared", [3]], ["CA", 1, 4, 12], ["FU", 5, [0, 1, 2, 3]], ["AN", 5, 0, 5], ["FU", 5, [1, 2, 3, 4]], ["AN", 5, 1, 4], ["FU", 5, [2, 3, 4, 5]], ["AN", 5, 2, 6], ["FU", 3, [0, 1]], ["SP", 3, 0, 16, [1], 1], ["AN", 3, 1, 2], ["FFSP", 3, 0, [4, 3, 2, 1], 1, 1], ["AN", 3, 1, 6], ["FU", 1, [0, 1, 2, 3]], ["SP", 1, 0, 56, [1], 1], ["AN", 1, 1, 2], ["FFSP", 1, 0, [4, 3, 2, 1], 1, 1], ["AN", 1, 1, 6], ["PR", 4, 0, "auto_unroll_max_step$16"]]]], "r": [[0.00110605, 0.00110668, 0.00110568], 0, 11.9411, 1667959824], "v": "v0.6"}
{"i": [["[\"conv1x1\", 1, 28, 28, 512, 512]", "cuda -keys=cuda,gpu -max_num_threads=1024 -model=unknown -thread_warp_size=32", [-1, 16, 64, 49152, 2147483647, 1024, 8, 32], "", 0, []], [[], [["CHW", 2, "local"], ["SP", 2, 0, 1, [1, 1, 1, 1], 1], ["SP", 2, 5, 28, [1, 1, 28, 1], 1], ["SP", 2, 10, 28, [1, 2, 1, 1], 1], ["SP", 2, 15, 512, [8, 8, 4, 1], 1], ["SP", 2, 20, 512, [1, 16], 1], ["RE", 2, [0, 5, 10, 15, 1, 6, 11, 16, 2, 7, 12, 17, 20, 21, 3, 8, 13, 18, 22, 4, 9, 14, 19]], ["FSP", 3, 0, 1, 3], ["FSP", 3, 4, 2, 3], ["FSP", 3, 8, 3, 3], ["FSP", 3, 12, 4, 3], ["RE", 3, [0, 4, 8, 12, 1, 5, 9, 13, 2, 6, 10, 14, 3, 7, 11, 15]], ["CA", 2, 3, 11], ["CHR", 1, "shared", [2]], ["CA", 2, 3, 12], ["CHR", 0, "shared", [3]], ["CA", 1, 4, 12], ["FU", 5, [0, 1, 2, 3]], ["AN", 5, 0, 5], ["FU", 5, [1, 2, 3, 4]], ["AN", 5, 1, 4], ["FU", 5, [2, 3, 4, 5]], ["AN", 5, 2, 6], ["FU", 3, [0, 1]], ["SP", 3, 0, 8, [4], 1], ["AN", 3, 1, 2], ["FFSP", 3, 0, [4, 3, 2, 1], 1, 1], ["AN", 3, 1, 6], ["FU", 1, [0, 1, 2, 3]], ["SP", 1, 0, 14, [1], 1], ["AN", 1, 1, 2], ["FFSP", 1, 0, [4, 3, 2, 1], 1, 1], ["AN", 1, 1, 6], ["PR", 4, 0, "auto_unroll_max_step$64"]]]], "r": [[0.00249574, 0.00249724, 0.00249802], 0, 10.7981, 1667959823], "v": "v0.6"}
{"i": [["[\"conv1x1\", 1, 28, 28, 512, 512]", "cuda -keys=cuda,gpu -max_num_threads=1024 -model=unknown -thread_warp_size=32", [-1, 16, 64, 49152, 2147483647, 1024, 8, 32], "", 0, []], [[], [["CHW", 2, "local"], ["SP", 2, 0, 1, [1, 1, 1, 1], 1], ["SP", 2, 5, 28, [2, 1, 1, 14], 1], ["SP", 2, 10, 28, [1, 1, 2, 2], 1], ["SP", 2, 15, 512, [1, 128, 2, 2], 1], ["SP", 2, 20, 512, [4, 1], 1], ["RE", 2, [0, 5, 10, 15, 1, 6, 11, 16, 2, 7, 12, 17, 20, 21, 3, 8, 13, 18, 22, 4, 9, 14, 19]], ["FSP", 3, 0, 1, 3], ["FSP", 3, 4, 2, 3], ["FSP", 3, 8, 3, 3], ["FSP", 3, 12, 4, 3], ["RE", 3, [0, 4, 8, 12, 1, 5, 9, 13, 2, 6, 10, 14, 3, 7, 11, 15]], ["CA", 2, 3, 11], ["CHR", 1, "shared", [2]], ["CA", 2, 3, 12], ["CHR", 0, "shared", [3]], ["CA", 1, 4, 12], ["FU", 5, [0, 1, 2, 3]], ["AN", 5, 0, 5], ["FU", 5, [1, 2, 3, 4]], ["AN", 5, 1, 4], ["FU", 5, [2, 3, 4, 5]], ["AN", 5, 2, 6], ["FU", 3, [0, 1]], ["SP", 3, 0, 16, [1], 1], ["AN", 3, 1, 2], ["FFSP", 3, 0, [4, 3, 2, 1], 1, 1], ["AN", 3, 1, 6], ["FU", 1, [0, 1, 2, 3]], ["SP", 1, 0, 448, [1], 1], ["AN", 1, 1, 2], ["FFSP", 1, 0, [4, 3, 2, 1], 1, 1], ["AN", 1, 1, 6], ["PR", 4, 0, "auto_unroll_max_step$1024"]]]], "r": [[0.00579435, 0.00579213, 0.00579727], 0, 9.7529, 1667959821], "v": "v0.6"}
{"i": [["[\"conv1x1\", 1, 28, 28, 512, 512]", "cuda -keys=cuda,gpu -max_num_threads=1024 -model=unknown -thread_warp_size=32", [-1, 16, 64, 49152, 2147483647, 1024, 8, 32], "", 0, []], [[], [["CHW", 2, "local"], ["SP", 2, 0, 1, [1, 1, 1, 1], 1], ["SP", 2, 5, 28, [1, 4, 7, 1], 1], ["SP", 2, 10, 28, [1, 1, 7, 4], 1], ["SP", 2, 15, 512, [2, 8, 2, 16], 1], ["SP", 2, 20, 512, [4, 2], 1], ["RE", 2, [0, 5, 10, 15, 1, 6, 11, 16, 2, 7, 12, 17, 20, 21, 3, 8, 13, 18, 22, 4, 9, 14, 19]], ["FSP", 3, 0, 1, 3], ["FSP", 3, 4, 2, 3], ["FSP", 3, 8, 3, 3], ["FSP", 3, 12, 4, 3], ["RE", 3, [0, 4, 8, 12, 1, 5, 9, 13, 2, 6, 10, 14, 3, 7, 11, 15]], ["CA", 2, 3, 11], ["CHR", 1, "shared", [2]], ["CA", 2, 3, 12], ["CHR", 0, "shared", [3]], ["CA", 1, 4, 12], ["FU", 5, [0, 1, 2, 3]], ["AN", 5, 0, 5], ["FU", 5, [1, 2, 3, 4]], ["AN", 5, 1, 4], ["FU", 5, [2, 3, 4, 5]], ["AN", 5, 2, 6], ["FU", 3, [0, 1]], ["SP", 3, 0, 128, [1], 1], ["AN", 3, 1, 2], ["FFSP", 3, 0, [4, 3, 2, 1], 1, 1], ["AN", 3, 1, 6], ["FU", 1, [0, 1, 2, 3]], ["SP", 1, 0, 3136, [1], 1], ["AN", 1, 1, 2], ["FFSP", 1, 0, [4, 3, 2, 1], 1, 1], ["AN", 1, 1, 6], ["PR", 4, 0, "auto_unroll_max_step$1024"]]]], "r": [[0.0212038, 0.0211525, 0.0211767], 0, 6.9327, 1667959817], "v": "v0.6"}
{"i": [["[\"conv1x1\", 1, 28, 28, 512, 512]", "cuda -keys=cuda,gpu -max_num_threads=1024 -model=unknown -thread_warp_size=32", [-1, 16, 64, 49152, 2147483647, 1024, 8, 32], "", 0, []], [[], [["CHW", 2, "local"], ["SP", 2, 0, 1, [1, 1, 1, 1], 1], ["SP", 2, 5, 28, [1, 2, 1, 1], 1], ["SP", 2, 10, 28, [1, 4, 1, 1], 1], ["SP", 2, 15, 512, [4, 8, 1, 2], 1], ["SP", 2, 20, 512, [1, 32], 1], ["RE", 2, [0, 5, 10, 15, 1, 6, 11, 16, 2, 7, 12, 17, 20, 21, 3, 8, 13, 18, 22, 4, 9, 14, 19]], ["FSP", 3, 0, 1, 3], ["FSP", 3, 4, 2, 3], ["FSP", 3, 8, 3, 3], ["FSP", 3, 12, 4, 3], ["RE", 3, [0, 4, 8, 12, 1, 5, 9, 13, 2, 6, 10, 14, 3, 7, 11, 15]], ["CA", 2, 3, 11], ["CHR", 1, "shared", [2]], ["CA", 2, 3, 12], ["CHR", 0, "shared", [3]], ["CA", 1, 4, 12], ["FU", 5, [0, 1, 2, 3]], ["AN", 5, 0, 5], ["FU", 5, [1, 2, 3, 4]], ["AN", 5, 1, 4], ["FU", 5, [2, 3, 4, 5]], ["AN", 5, 2, 6], ["FU", 3, [0, 1]], ["SP", 3, 0, 256, [1], 1], ["AN", 3, 1, 2], ["FFSP", 3, 0, [4, 3, 2, 1], 1, 1], ["AN", 3, 1, 6], ["FU", 1, [0, 1, 2, 3]], ["SP", 1, 0, 128, [64], 1], ["AN", 1, 1, 2], ["FFSP", 1, 0, [4, 3, 2, 1], 1, 1], ["AN", 1, 1, 6], ["PR", 4, 0, "auto_unroll_max_step$0"]]]], "r": [[0.000142517, 0.000142387, 0.000142383], 0, 15.4524, 1667959828], "v": "v0.6"}
{"i": [["[\"conv1x1\", 1, 28, 28, 512, 512]", "cuda -keys=cuda,gpu -max_num_threads=1024 -model=unknown -thread_warp_size=32", [-1, 16, 64, 49152, 2147483647, 1024, 8, 32], "", 0, []], [[], [["CHW", 2, "local"], ["SP", 2, 0, 1, [1, 1, 1, 1], 1], ["SP", 2, 5, 28, [1, 1, 14, 1], 1], ["SP", 2, 10, 28, [1, 28, 1, 1], 1], ["SP", 2, 15, 512, [4, 4, 1, 16], 1], ["SP", 2, 20, 512, [8, 2], 1], ["RE", 2, [0, 5, 10, 15, 1, 6, 11, 16, 2, 7, 12, 17, 20, 21, 3, 8, 13, 18, 22, 4, 9, 14, 19]], ["FSP", 3, 0, 1, 3], ["FSP", 3, 4, 2, 3], ["FSP", 3, 8, 3, 3], ["FSP", 3, 12, 4, 3], ["RE", 3, [0, 4, 8, 12, 1, 5, 9, 13, 2, 6, 10, 14, 3, 7, 11, 15]], ["CA", 2, 3, 11], ["CHR", 1, "shared", [2]], ["CA", 2, 3, 12], ["CHR", 0, "shared", [3]], ["CA", 1, 4, 12], ["FU", 5, [0, 1, 2, 3]], ["AN", 5, 0, 5], ["FU", 5, [1, 2, 3, 4]], ["AN", 5, 1, 4], ["FU", 5, [2, 3, 4, 5]], ["AN", 5, 2, 6], ["FU", 3, [0, 1]], ["SP", 3, 0, 256, [32], 1], ["AN", 3, 1, 2], ["FFSP", 3, 0, [4, 3, 2, 1], 1, 1], ["AN", 3, 1, 6], ["FU", 1, [0, 1, 2, 3]], ["SP", 1, 0, 224, [1], 1], ["AN", 1, 1, 2], ["FFSP", 1, 0, [4, 3, 2, 1], 1, 1], ["AN", 1, 1, 6], ["PR", 4, 0, "auto_unroll_max_step$64"]]]], "r": [[0.0046162, 0.00461705, 0.00461659], 0, 15.3963, 1667959828], "v": "v0.6"}
{"i": [["[\"conv1x1\", 1, 28, 28, 512, 512]", "cuda -keys=cuda,gpu -max_num_threads=1024 -model=unknown -thread_warp_size=32", [-1, 16, 64, 49152, 2147483647, 1024, 8, 32], "", 0, []], [[], [["CHW", 2, "local"], ["SP", 2, 0, 1, [1, 1, 1, 1], 1], ["SP", 2, 5, 28, [1, 14, 1, 1], 1], ["SP", 2, 10, 28, [7, 1, 1, 4], 1], ["SP", 2, 15, 512, [1, 16, 32, 1], 1], ["SP", 2, 20, 512, [4, 1], 1], ["RE", 2, [0, 5, 10, 15, 1, 6, 11, 16, 2, 7, 12, 17, 20, 21, 3, 8, 13, 18, 22, 4, 9, 14, 19]], ["FSP", 3, 0, 1, 3], ["FSP", 3, 4, 2, 3], ["FSP", 3, 8, 3, 3], ["FSP", 3, 12, 4, 3], ["RE", 3, [0, 4, 8, 12, 1, 5, 9, 13, 2, 6, 10, 14, 3, 7, 11, 15]], ["CA", 2, 3, 11], ["CHR", 1, "shared", [2]], ["CA", 2, 3, 12], ["CHR", 0, "shared", [3]], ["CA", 1, 4, 12], ["FU", 5, [0, 1, 2, 3]], ["AN", 5, 0, 5], ["FU", 5, [1, 2, 3, 4]], ["AN", 5, 1, 4], ["FU", 5, [2, 3, 4, 5]], ["AN", 5, 2, 6], ["FU", 3, [0, 1]], ["SP", 3, 0, 128, [1], 1], ["AN", 3, 1, 2], ["FFSP", 3, 0, [4, 3, 2, 1], 1, 1], ["AN", 3, 1, 6], ["FU", 1, [0, 1, 2, 3]], ["SP", 1, 0, 16, [1], 1], ["AN", 1, 1, 2], ["FFSP", 1, 0, [4, 3, 2, 1], 1, 1], ["AN", 1, 1, 6], ["PR", 4, 0, "auto_unroll_max_step$64"]]]], "r": [[0.0121644, 0.0121496, 0.0121542], 0, 8.31562, 1667959820], "v": "v0.6"}
{"i": [["[\"conv1x1\", 1, 28, 28, 512, 512]", "cuda -keys=cuda,gpu -max_num_threads=1024 -model=unknown -thread_warp_size=32", [-1, 16, 64, 49152, 2147483647, 1024, 8, 32], "", 0, []], [[], [["CHW", 2, "local"], ["SP", 2, 0, 1, [1, 1, 1, 1], 1], ["SP", 2, 5, 28, [1, 14, 1, 1], 1], ["SP", 2, 10, 28, [1, 2, 2, 1], 1], ["SP", 2, 15, 512, [4, 1, 8, 2], 1], ["SP", 2, 20, 512, [2, 8], 1], ["RE", 2, [0, 5, 10, 15, 1, 6, 11, 16, 2, 7, 12, 17, 20, 21, 3, 8, 13, 18, 22, 4, 9, 14, 19]], ["FSP", 3, 0, 1, 3], ["FSP", 3, 4, 2, 3], ["FSP", 3, 8, 3, 3], ["FSP", 3, 12, 4, 3], ["RE", 3, [0, 4, 8, 12, 1, 5, 9, 13, 2, 6, 10, 14, 3, 7, 11, 15]], ["CA", 2, 3, 11], ["CHR", 1, "shared", [2]], ["CA", 2, 3, 12], ["CHR", 0, "shared", [3]], ["CA", 1, 4, 12], ["FU", 5, [0, 1, 2, 3]], ["AN", 5, 0, 5], ["FU", 5, [1, 2, 3, 4]], ["AN", 5, 1, 4], ["FU", 5, [2, 3, 4, 5]], ["AN", 5, 2, 6], ["FU", 3, [0, 1]], ["SP", 3, 0, 128, [1], 1], ["AN", 3, 1, 2], ["FFSP", 3, 0, [4, 3, 2, 1], 1, 1], ["AN", 3, 1, 6], ["FU", 1, [0, 1, 2, 3]], ["SP", 1, 0, 32, [1], 1], ["AN", 1, 1, 2], ["FFSP", 1, 0, [4, 3, 2, 1], 1, 1], ["AN", 1, 1, 6], ["PR", 4, 0, "auto_unroll_max_step$0"]]]], "r": [[0.000613712, 0.000613793, 0.000613519], 0, 12.9529, 1667959825], "v": "v0.6"}
{"i": [["[\"conv1x1\", 1, 28, 28, 512, 512]", "cuda -keys=cuda,gpu -max_num_threads=1024 -model=unknown -thread_warp_size=32", [-1, 16, 64, 49152, 2147483647, 1024, 8, 32], "", 0, []], [[], [["CHW", 2, "local"], ["SP", 2, 0, 1, [1, 1, 1, 1], 1], ["SP", 2, 5, 28, [1, 1, 2, 2], 1], ["SP", 2, 10, 28, [2, 1, 1, 14], 1], ["SP", 2, 15, 512, [2, 16, 2, 1], 1], ["SP", 2, 20, 512, [1, 2], 1], ["RE", 2, [0, 5, 10, 15, 1, 6, 11, 16, 2, 7, 12, 17, 20, 21, 3, 8, 13, 18, 22, 4, 9, 14, 19]], ["FSP", 3, 0, 1, 3], ["FSP", 3, 4, 2, 3], ["FSP", 3, 8, 3, 3], ["FSP", 3, 12, 4, 3], ["RE", 3, [0, 4, 8, 12, 1, 5, 9, 13, 2, 6, 10, 14, 3, 7, 11, 15]], ["CA", 2, 3, 11], ["CHR", 1, "shared", [2]], ["CA", 2, 3, 12], ["CHR", 0, "shared", [3]], ["CA", 1, 4, 12], ["FU", 5, [0, 1, 2, 3]], ["AN", 5, 0, 5], ["FU", 5, [1, 2, 3, 4]], ["AN", 5, 1, 4], ["FU", 5, [2, 3, 4, 5]], ["AN", 5, 2, 6], ["FU", 3, [0, 1]], ["SP", 3, 0, 4, [1], 1], ["AN", 3, 1, 2], ["FFSP", 3, 0, [4, 3, 2, 1], 1, 1], ["AN", 3, 1, 6], ["FU", 1, [0, 1, 2, 3]], ["SP", 1, 0, 56, [1], 1], ["AN", 1, 1, 2], ["FFSP", 1, 0, [4, 3, 2, 1], 1, 1], ["AN", 1, 1, 6], ["PR", 4, 0, "auto_unroll_max_step$64"]]]], "r": [[0.00108566, 0.00108526, 0.00108477], 0, 17.4347, 1667959830], "v": "v0.6"}
{"i": [["[\"conv1x1\", 1, 28, 28, 512, 512]", "cuda -keys=cuda,gpu -max_num_threads=1024 -model=unknown -thread_warp_size=32", [-1, 16, 64, 49152, 2147483647, 1024, 8, 32], "", 0, []], [[], [["CHW", 2, "local"], ["SP", 2, 0, 1, [1, 1, 1, 1], 1], ["SP", 2, 5, 28, [1, 14, 2, 1], 1], ["SP", 2, 10, 28, [1, 2, 14, 1], 1], ["SP", 2, 15, 512, [1, 16, 2, 4], 1], ["SP", 2, 20, 512, [2, 4], 1], ["RE", 2, [0, 5, 10, 15, 1, 6, 11, 16, 2, 7, 12, 17, 20, 21, 3, 8, 13, 18, 22, 4, 9, 14, 19]], ["FSP", 3, 0, 1, 3], ["FSP", 3, 4, 2, 3], ["FSP", 3, 8, 3, 3], ["FSP", 3, 12, 4, 3], ["RE", 3, [0, 4, 8, 12, 1, 5, 9, 13, 2, 6, 10, 14, 3, 7, 11, 15]], ["CA", 2, 3, 11], ["CHR", 1, "shared", [2]], ["CA", 2, 3, 12], ["CHR", 0, "shared", [3]], ["CA", 1, 4, 12], ["FU", 5, [0, 1, 2, 3]], ["AN", 5, 0, 5], ["FU", 5, [1, 2, 3, 4]], ["AN", 5, 1, 4], ["FU", 5, [2, 3, 4, 5]], ["AN", 5, 2, 6], ["FU", 3, [0, 1]], ["SP", 3, 0, 64, [1], 1], ["AN", 3, 1, 2], ["FFSP", 3, 0, [4, 3, 2, 1], 1, 1], ["AN", 3, 1, 6], ["FU", 1, [0, 1, 2, 3]], ["SP", 1, 0, 224, [1], 1], ["AN", 1, 1, 2], ["FFSP", 1, 0, [4, 3, 2, 1], 1, 1], ["AN", 1, 1, 6], ["PR", 4, 0, "auto_unroll_max_step$16"]]]], "r": [[0.00179861, 0.00180189, 0.00180063], 0, 13.2943, 1667959826], "v": "v0.6"}
{"i": [["[\"conv1x1\", 1, 28, 28, 512, 512]", "cuda -keys=cuda,gpu -max_num_threads=1024 -model=unknown -thread_warp_size=32", [-1, 16, 64, 49152, 2147483647, 1024, 8, 32], "", 0, []], [[], [["CHW", 2, "local"], ["SP", 2, 0, 1, [1, 1, 1, 1], 1], ["SP", 2, 5, 28, [2, 1, 14, 1], 1], ["SP", 2, 10, 28, [1, 1, 4, 7], 1], ["SP", 2, 15, 512, [1, 64, 2, 4], 1], ["SP", 2, 20, 512, [4, 1], 1], ["RE", 2, [0, 5, 10, 15, 1, 6, 11, 16, 2, 7, 12, 17, 20, 21, 3, 8, 13, 18, 22, 4, 9, 14, 19]], ["FSP", 3, 0, 1, 3], ["FSP", 3, 4, 2, 3], ["FSP", 3, 8, 3, 3], ["FSP", 3, 12, 4, 3], ["RE", 3, [0, 4, 8, 12, 1, 5, 9, 13, 2, 6, 10, 14, 3, 7, 11, 15]], ["CA", 2, 3, 11], ["CHR", 1, "shared", [2]], ["CA", 2, 3, 12], ["CHR", 0, "shared", [3]], ["CA", 1, 4, 12], ["FU", 5, [0, 1, 2, 3]], ["AN", 5, 0, 5], ["FU", 5, [1, 2, 3, 4]], ["AN", 5, 1, 4], ["FU", 5, [2, 3, 4, 5]], ["AN", 5, 2, 6], ["FU", 3, [0, 1]], ["SP", 3, 0, 64, [1], 1], ["AN", 3, 1, 2], ["FFSP", 3, 0, [4, 3, 2, 1], 1, 1], ["AN", 3, 1, 6], ["FU", 1, [0, 1, 2, 3]], ["SP", 1, 0, 3136, [1], 1], ["AN", 1, 1, 2], ["FFSP", 1, 0, [4, 3, 2, 1], 1, 1], ["AN", 1, 1, 6], ["PR", 4, 0, "auto_unroll_max_step$1024"]]]], "r": [[0.0241763, 0.0241856, 0.0241807], 0, 15.8613, 1667959826], "v": "v0.6"}
{"i": [["[\"conv1x1\", 1, 28, 28, 512, 512]", "cuda -keys=cuda,gpu -max_num_threads=1024 -model=unknown -thread_warp_size=32", [-1, 16, 64, 49152, 2147483647, 1024, 8, 32], "", 0, []], [[], [["CHW", 2, "local"], ["SP", 2, 0, 1, [1, 1, 1, 1], 1], ["SP", 2, 5, 28, [1, 1, 2, 1], 1], ["SP", 2, 10, 28, [1, 2, 7, 1], 1], ["SP", 2, 15, 512, [2, 32, 2, 2], 1], ["SP", 2, 20, 512, [2, 4], 1], ["RE", 2, [0, 5, 10, 15, 1, 6, 11, 16, 2, 7, 12, 17, 20, 21, 3, 8, 13, 18, 22, 4, 9, 14, 19]], ["FSP", 3, 0, 1, 3], ["FSP", 3, 4, 2, 3], ["FSP", 3, 8, 3, 3], ["FSP", 3, 12, 4, 3], ["RE", 3, [0, 4, 8, 12, 1, 5, 9, 13, 2, 6, 10, 14, 3, 7, 11, 15]], ["CA", 2, 3, 11], ["CHR", 1, "shared", [2]], ["CA", 2, 3, 12], ["CHR", 0, "shared", [3]], ["CA", 1, 4, 12], ["FU", 5, [0, 1, 2, 3]], ["AN", 5, 0, 5], ["FU", 5, [1, 2, 3, 4]], ["AN", 5, 1, 4], ["FU", 5, [2, 3, 4, 5]], ["AN", 5, 2, 6], ["FU", 3, [0, 1]], ["SP", 3, 0, 64, [1], 1], ["AN", 3, 1, 2], ["FFSP", 3, 0, [4, 3, 2, 1], 1, 1], ["AN", 3, 1, 6], ["FU", 1, [0, 1, 2, 3]], ["SP", 1, 0, 112, [1], 1], ["AN", 1, 1, 2], ["FFSP", 1, 0, [4, 3, 2, 1], 1, 1], ["AN", 1, 1, 6], ["PR", 4, 0, "auto_unroll_max_step$64"]]]], "r": [[0.000159673, 0.00015974, 0.000159625], 0, 1.57289, 1667959814], "v": "v0.6"}
{"i": [["[\"conv1x1\", 1, 28, 28, 512, 512]", "cuda -keys=cuda,gpu -max_num_threads=1024 -model=unknown -thread_warp_size=32", [-1, 16, 64, 49152, 2147483647, 1024, 8, 32], "", 0, []], [[], [["CHW", 2, "local"], ["SP", 2, 0, 1, [1, 1, 1, 1], 1], ["SP", 2, 5, 28, [1, 2, 14, 1], 1], ["SP", 2, 10, 28, [2, 14, 1, 1], 1], ["SP", 2, 15, 512, [2, 1, 4, 32], 1], ["SP", 2, 20, 512, [1, 1], 1], ["RE", 2, [0, 5, 10, 15, 1, 6, 11, 16, 2, 7, 12, 17, 20, 21, 3, 8, 13, 18, 22, 4, 9, 14, 19]], ["FSP", 3, 0, 1, 3], ["FSP", 3, 4, 2, 3], ["FSP", 3, 8, 3, 3], ["FSP", 3, 12, 4, 3], ["RE", 3, [0, 4, 8, 12, 1, 5, 9, 13, 2, 6, 10, 14, 3, 7, 11, 15]], ["CA", 2, 3, 11], ["CHR", 1, "shared", [2]], ["CA", 2, 3, 12], ["CHR", 0, "shared", [3]], ["CA", 1, 4, 12], ["FU", 5, [0, 1, 2, 3]], ["AN", 5, 0, 5], ["FU", 5, [1, 2, 3, 4]], ["AN", 5, 1, 4], ["FU", 5, [2, 3, 4, 5]], ["AN", 5, 2, 6], ["FU", 3, [0, 1]], ["SP", 3, 0, 128, [1], 1], ["AN", 3, 1, 2], ["FFSP", 3, 0, [4, 3, 2, 1], 1, 1], ["AN", 3, 1, 6], ["FU", 1, [0, 1, 2, 3]], ["SP", 1, 0, 2, [1], 1], ["AN", 1, 1, 2], ["FFSP", 1, 0, [4, 3, 2, 1], 1, 1], ["AN", 1, 1, 6], ["PR", 4, 0, "auto_unroll_max_step$512"]]]], "r": [[0.0448618, 0.0448543, 0.0448113], 0, 21.4377, 1667959831], "v": "v0.6"}
{"i": [["[\"conv1x1\", 1, 28, 28, 512, 512]", "cuda -keys=cuda,gpu -max_num_threads=1024 -model=unknown -thread_warp_size=32", [-1, 16, 64, 49152, 2147483647, 1024, 8, 32], "", 0, []], [[], [["CHW", 2, "local"], ["SP", 2, 0, 1, [1, 1, 1, 1], 1], ["SP", 2, 5, 28, [1, 14, 2, 1], 1], ["SP", 2, 10, 28, [1, 2, 1, 14], 1], ["SP", 2, 15, 512, [2, 4, 2, 2], 1], ["SP", 2, 20, 512, [2, 1], 1], ["RE", 2, [0, 5, 10, 15, 1, 6, 11, 16, 2, 7, 12, 17, 20, 21, 3, 8, 13, 18, 22, 4, 9, 14, 19]], ["FSP", 3, 0, 1, 3], ["FSP", 3, 4, 2, 3], ["FSP", 3, 8, 3, 3], ["FSP", 3, 12, 4, 3], ["RE", 3, [0, 4, 8, 12, 1, 5, 9, 13, 2, 6, 10, 14, 3, 7, 11, 15]], ["CA", 2, 3, 11], ["CHR", 1, "shared", [2]], ["CA", 2, 3, 12], ["CHR", 0, "shared", [3]], ["CA", 1, 4, 12], ["FU", 5, [0, 1, 2, 3]], ["AN", 5, 0, 5], ["FU", 5, [1, 2, 3, 4]], ["AN", 5, 1, 4], ["FU", 5, [2, 3, 4, 5]], ["AN", 5, 2, 6], ["FU", 3, [0, 1]], ["SP", 3, 0, 8, [2], 1], ["AN", 3, 1, 2], ["FFSP", 3, 0, [4, 3, 2, 1], 1, 1], ["AN", 3, 1, 6], ["FU", 1, [0, 1, 2, 3]], ["SP", 1, 0, 28, [1], 1], ["AN", 1, 1, 2], ["FFSP", 1, 0, [4, 3, 2, 1], 1, 1], ["AN", 1, 1, 6], ["PR", 4, 0, "auto_unroll_max_step$1024"]]]], "r": [[0.000453549, 0.000453516, 0.000453489], 0, 21.5117, 1667959834], "v": "v0.6"}
{"i": [["[\"conv1x1\", 1, 28, 28, 512, 512]", "cuda -keys=cuda,gpu -max_num_threads=1024 -model=unknown -thread_warp_size=32", [-1, 16, 64, 49152, 2147483647, 1024, 8, 32], "", 0, []], [[], [["CHW", 2, "local"], ["SP", 2, 0, 1, [1, 1, 1, 1], 1], ["SP", 2, 5, 28, [1, 14, 1, 1], 1], ["SP", 2, 10, 28, [1, 1, 1, 4], 1], ["SP", 2, 15, 512, [2, 16, 4, 1], 1], ["SP", 2, 20, 512, [1, 32], 1], ["RE", 2, [0, 5, 10, 15, 1, 6, 11, 16, 2, 7, 12, 17, 20, 21, 3, 8, 13, 18, 22, 4, 9, 14, 19]], ["FSP", 3, 0, 1, 3], ["FSP", 3, 4, 2, 3], ["FSP", 3, 8, 3, 3], ["FSP", 3, 12, 4, 3], ["RE", 3, [0, 4, 8, 12, 1, 5, 9, 13, 2, 6, 10, 14, 3, 7, 11, 15]], ["CA", 2, 3, 11], ["CHR", 1, "shared", [2]], ["CA", 2, 3, 12], ["CHR", 0, "shared", [3]], ["CA", 1, 4, 12], ["FU", 5, [0, 1, 2, 3]], ["AN", 5, 0, 5], ["FU", 5, [1, 2, 3, 4]], ["AN", 5, 1, 4], ["FU", 5, [2, 3, 4, 5]], ["AN", 5, 2, 6], ["FU", 3, [0, 1]], ["SP", 3, 0, 128, [1], 1], ["AN", 3, 1, 2], ["FFSP", 3, 0, [4, 3, 2, 1], 1, 1], ["AN", 3, 1, 6], ["FU", 1, [0, 1, 2, 3]], ["SP", 1, 0, 256, [1], 1], ["AN", 1, 1, 2], ["FFSP", 1, 0, [4, 3, 2, 1], 1, 1], ["AN", 1, 1, 6], ["PR", 4, 0, "auto_unroll_max_step$16"]]]], "r": [[9.00858e-05, 9.00702e-05, 9.00835e-05], 0, 15.5602, 1667959829], "v": "v0.6"}
{"i": [["[\"conv1x1\", 1, 28, 28, 512, 512]", "cuda -keys=cuda,gpu -max_num_threads=1024 -model=unknown -thread_warp_size=32", [-1, 16, 64, 49152, 2147483647, 1024, 8, 32], "", 0, []], [[], [["CHW", 2, "local"], ["SP", 2, 0, 1, [1, 1, 1, 1], 1], ["SP", 2, 5, 28, [7, 1, 1, 2], 1], ["SP", 2, 10, 28, [1, 1, 1, 28], 1], ["SP", 2, 15, 512, [1, 128, 1, 4], 1], ["SP", 2, 20, 512, [4, 1], 1], ["RE", 2, [0, 5, 10, 15, 1, 6, 11, 16, 2, 7, 12, 17, 20, 21, 3, 8, 13, 18, 22, 4, 9, 14, 19]], ["FSP", 3, 0, 1, 3], ["FSP", 3, 4, 2, 3], ["FSP", 3, 8, 3, 3], ["FSP", 3, 12, 4, 3], ["RE", 3, [0, 4, 8, 12, 1, 5, 9, 13, 2, 6, 10, 14, 3, 7, 11, 15]], ["CA", 2, 3, 11], ["CHR", 1, "shared", [2]], ["CA", 2, 3, 12], ["CHR", 0, "shared", [3]], ["CA", 1, 4, 12], ["FU", 5, [0, 1, 2, 3]], ["AN", 5, 0, 5], ["FU", 5, [1, 2, 3, 4]], ["AN", 5, 1, 4], ["FU", 5, [2, 3, 4, 5]], ["AN", 5, 2, 6], ["FU", 3, [0, 1]], ["SP", 3, 0, 16, [1], 1], ["AN", 3, 1, 2], ["FFSP", 3, 0, [4, 3, 2, 1], 1, 1], ["AN", 3, 1, 6], ["FU", 1, [0, 1, 2, 3]], ["SP", 1, 0, 224, [1], 1], ["AN", 1, 1, 2], ["FFSP", 1, 0, [4, 3, 2, 1], 1, 1], ["AN", 1, 1, 6], ["PR", 4, 0, "auto_unroll_max_step$512"]]]], "r": [[0.012117, 0.012114, 0.0121121], 0, 24.8913, 1667959836], "v": "v0.6"}
{"i": [["[\"conv1x1\", 1, 28, 28, 512, 512]", "cuda -keys=cuda,gpu -max_num_threads=1024 -model=unknown -thread_warp_size=32", [-1, 16, 64, 49152, 2147483647, 1024, 8, 32], "", 0, []], [[], [["CHW", 2, "local"], ["SP", 2, 0, 1, [1, 1, 1, 1], 1], ["SP", 2, 5, 28, [1, 2, 1, 1], 1], ["SP", 2, 10, 28, [2, 1, 7, 1], 1], ["SP", 2, 15, 512, [1, 32, 8, 1], 1], ["SP", 2, 20, 512, [1, 2], 1], ["RE", 2, [0, 5, 10, 15, 1, 6, 11, 16, 2, 7, 12, 17, 20, 21, 3, 8, 13, 18, 22, 4, 9, 14, 19]], ["FSP", 3, 0, 1, 3], ["FSP", 3, 4, 2, 3], ["FSP", 3, 8, 3, 3], ["FSP", 3, 12, 4, 3], ["RE", 3, [0, 4, 8, 12, 1, 5, 9, 13, 2, 6, 10, 14, 3, 7, 11, 15]], ["CA", 2, 3, 11], ["CHR", 1, "shared", [2]], ["CA", 2, 3, 12], ["CHR", 0, "shared", [3]], ["CA", 1, 4, 12], ["FU", 5, [0, 1, 2, 3]], ["AN", 5, 0, 5], ["FU", 5, [1, 2, 3, 4]], ["AN", 5, 1, 4], ["FU", 5, [2, 3, 4, 5]], ["AN", 5, 2, 6], ["FU", 3, [0, 1]], ["SP", 3, 0, 16, [1], 1], ["AN", 3, 1, 2], ["FFSP", 3, 0, [4, 3, 2, 1], 1, 1], ["AN", 3, 1, 6], ["FU", 1, [0, 1, 2, 3]], ["SP", 1, 0, 14, [14], 1], ["AN", 1, 1, 2], ["FFSP", 1, 0, [4, 3, 2, 1], 1, 1], ["AN", 1, 1, 6], ["PR", 4, 0, "auto_unroll_max_step$64"]]]], "r": [[0.000187434, 0.00018745, 0.000187434], 0, 11.3074, 1667959824], "v": "v0.6"}
{"i": [["[\"conv1x1\", 1, 28, 28, 512, 512]", "cuda -keys=cuda,gpu -max_num_threads=1024 -model=unknown -thread_warp_size=32", [-1, 16, 64, 49152, 2147483647, 1024, 8, 32], "", 0, []], [[], [["CHW", 2, "local"], ["SP", 2, 0, 1, [1, 1, 1, 1], 1], ["SP", 2, 5, 28, [1, 2, 14, 1], 1], ["SP", 2, 10, 28, [1, 2, 7, 2], 1], ["SP", 2, 15, 512, [1, 256, 2, 1], 1], ["SP", 2, 20, 512, [8, 1], 1], ["RE", 2, [0, 5, 10, 15, 1, 6, 11, 16, 2, 7, 12, 17, 20, 21, 3, 8, 13, 18, 22, 4, 9, 14, 19]], ["FSP", 3, 0, 1, 3], ["FSP", 3, 4, 2, 3], ["FSP", 3, 8, 3, 3], ["FSP", 3, 12, 4, 3], ["RE", 3, [0, 4, 8, 12, 1, 5, 9, 13, 2, 6, 10, 14, 3, 7, 11, 15]], ["CA", 2, 3, 11], ["CHR", 1, "shared", [2]], ["CA", 2, 3, 12], ["CHR", 0, "shared", [3]], ["CA", 1, 4, 12], ["FU", 5, [0, 1, 2, 3]], ["AN", 5, 0, 5], ["FU", 5, [1, 2, 3, 4]], ["AN", 5, 1, 4], ["FU", 5, [2, 3, 4, 5]], ["AN", 5, 2, 6], ["FU", 3, [0, 1]], ["SP", 3, 0, 16, [4], 1], ["AN", 3, 1, 2], ["FFSP", 3, 0, [4, 3, 2, 1], 1, 1], ["AN", 3, 1, 6], ["FU", 1, [0, 1, 2, 3]], ["SP", 1, 0, 1568, [1], 1], ["AN", 1, 1, 2], ["FFSP", 1, 0, [4, 3, 2, 1], 1, 1], ["AN", 1, 1, 6], ["PR", 4, 0, "auto_unroll_max_step$64"]]]], "r": [[0.0242548, 0.0242535, 0.0242511], 0, 24.8905, 1667959837], "v": "v0.6"}
{"i": [["[\"conv1x1\", 1, 28, 28, 512, 512]", "cuda -keys=cuda,gpu -max_num_threads=1024 -model=unknown -thread_warp_size=32", [-1, 16, 64, 49152, 2147483647, 1024, 8, 32], "", 0, []], [[], [["CHW", 2, "local"], ["SP", 2, 0, 1, [1, 1, 1, 1], 1], ["SP", 2, 5, 28, [1, 2, 1, 7], 1], ["SP", 2, 10, 28, [1, 14, 2, 1], 1], ["SP", 2, 15, 512, [2, 4, 1, 8], 1], ["SP", 2, 20, 512, [8, 1], 1], ["RE", 2, [0, 5, 10, 15, 1, 6, 11, 16, 2, 7, 12, 17, 20, 21, 3, 8, 13, 18, 22, 4, 9, 14, 19]], ["FSP", 3, 0, 1, 3], ["FSP", 3, 4, 2, 3], ["FSP", 3, 8, 3, 3], ["FSP", 3, 12, 4, 3], ["RE", 3, [0, 4, 8, 12, 1, 5, 9, 13, 2, 6, 10, 14, 3, 7, 11, 15]], ["CA", 2, 3, 11], ["CHR", 1, "shared", [2]], ["CA", 2, 3, 12], ["CHR", 0, "shared", [3]], ["CA", 1, 4, 12], ["FU", 5, [0, 1, 2, 3]], ["AN", 5, 0, 5], ["FU", 5, [1, 2, 3, 4]], ["AN", 5, 1, 4], ["FU", 5, [2, 3, 4, 5]], ["AN", 5, 2, 6], ["FU", 3, [0, 1]], ["SP", 3, 0, 64, [8], 1], ["AN", 3, 1, 2], ["FFSP", 3, 0, [4, 3, 2, 1], 1, 1], ["AN", 3, 1, 6], ["FU", 1, [0, 1, 2, 3]], ["SP", 1, 0, 112, [1], 1], ["AN", 1, 1, 2], ["FFSP", 1, 0, [4, 3, 2, 1], 1, 1], ["AN", 1, 1, 6], ["PR", 4, 0, "auto_unroll_max_step$512"]]]], "r": [[0.000421781, 0.00042168, 0.000421865], 0, 20.4051, 1667959833], "v": "v0.6"}
{"i": [["[\"conv1x1\", 1, 28, 28, 512, 512]", "cuda -keys=cuda,gpu -max_num_threads=1024 -model=unknown -thread_warp_size=32", [-1, 16, 64, 49152, 2147483647, 1024, 8, 32], "", 0, []], [[], [["CHW", 2, "local"], ["SP", 2, 0, 1, [1, 1, 1, 1], 1], ["SP", 2, 5, 28, [2, 1, 7, 1], 1], ["SP", 2, 10, 28, [1, 1, 1, 2], 1], ["SP", 2, 15, 512, [1, 128, 2, 1], 1], ["SP", 2, 20, 512, [2, 8], 1], ["RE", 2, [0, 5, 10, 15, 1, 6, 11, 16, 2, 7, 12, 17, 20, 21, 3, 8, 13, 18, 22, 4, 9, 14, 19]], ["FSP", 3, 0, 1, 3], ["FSP", 3, 4, 2, 3], ["FSP", 3, 8, 3, 3], ["FSP", 3, 12, 4, 3], ["RE", 3, [0, 4, 8, 12, 1, 5, 9, 13, 2, 6, 10, 14, 3, 7, 11, 15]], ["CA", 2, 3, 11], ["CHR", 1, "shared", [2]], ["CA", 2, 3, 12], ["CHR", 0, "shared", [3]], ["CA", 1, 4, 12], ["FU", 5, [0, 1, 2, 3]], ["AN", 5, 0, 5], ["FU", 5, [1, 2, 3, 4]], ["AN", 5, 1, 4], ["FU", 5, [2, 3, 4, 5]], ["AN", 5, 2, 6], ["FU", 3, [0, 1]], ["SP", 3, 0, 32, [1], 1], ["AN", 3, 1, 2], ["FFSP", 3, 0, [4, 3, 2, 1], 1, 1], ["AN", 3, 1, 6], ["FU", 1, [0, 1, 2, 3]], ["SP", 1, 0, 64, [1], 1], ["AN", 1, 1, 2], ["FFSP", 1, 0, [4, 3, 2, 1], 1, 1], ["AN", 1, 1, 6], ["PR", 4, 0, "auto_unroll_max_step$64"]]]], "r": [[7.3927e-05, 7.39067e-05, 7.38294e-05], 0, 2.23679, 1667959814], "v": "v0.6"}
