python/models/resnext/ResNextHorizontal_kernel_configs/resnext_imagenet_50_hfused_batch_norm_1_7_7_32_64.log
{"i": [["[\"hfused_batch_norm\", 1, 7, 7, 32, 64]", "cuda -keys=cuda,gpu -max_num_threads=1024 -model=unknown -thread_warp_size=32", [-1, 16, 64, 49152, 2147483647, 1024, 8, 32], "", 0, []], [[], [["CI", 2], ["FU", 4, [0, 1, 2, 3, 4]], ["SP", 4, 0, 100352, [8], 1], ["AN", 4, 0, 5], ["AN", 4, 1, 6]]]], "r": [[1.19754e-05, 1.19738e-05, 1.19725e-05], 0, 2.24236, 1667897696], "v": "v0.6"}
{"i": [["[\"hfused_batch_norm\", 1, 7, 7, 32, 64]", "cuda -keys=cuda,gpu -max_num_threads=1024 -model=unknown -thread_warp_size=32", [-1, 16, 64, 49152, 2147483647, 1024, 8, 32], "", 0, []], [[], [["CI", 2], ["FU", 4, [0, 1, 2, 3, 4]], ["SP", 4, 0, 100352, [56], 1], ["AN", 4, 0, 5], ["AN", 4, 1, 6]]]], "r": [[3.97193e-06, 3.9679e-06, 3.97053e-06], 0, 1.24398, 1667897695], "v": "v0.6"}
{"i": [["[\"hfused_batch_norm\", 1, 7, 7, 32, 64]", "cuda -keys=cuda,gpu -max_num_threads=1024 -model=unknown -thread_warp_size=32", [-1, 16, 64, 49152, 2147483647, 1024, 8, 32], "", 0, []], [[], [["CI", 2], ["FU", 4, [0, 1, 2, 3, 4]], ["SP", 4, 0, 100352, [32], 1], ["AN", 4, 0, 5], ["AN", 4, 1, 6]]]], "r": [[5.12376e-06, 5.12423e-06, 5.13101e-06], 0, 0.878536, 1667897694], "v": "v0.6"}
{"i": [["[\"hfused_batch_norm\", 1, 7, 7, 32, 64]", "cuda -keys=cuda,gpu -max_num_threads=1024 -model=unknown -thread_warp_size=32", [-1, 16, 64, 49152, 2147483647, 1024, 8, 32], "", 0, []], [[], [["CI", 2], ["FU", 4, [0, 1, 2, 3, 4]], ["SP", 4, 0, 100352, [64], 1], ["AN", 4, 0, 5], ["AN", 4, 1, 6]]]], "r": [[3.84917e-06, 3.8463e-06, 3.84766e-06], 0, 0.54563, 1667897694], "v": "v0.6"}
{"i": [["[\"hfused_batch_norm\", 1, 7, 7, 32, 64]", "cuda -keys=cuda,gpu -max_num_threads=1024 -model=unknown -thread_warp_size=32", [-1, 16, 64, 49152, 2147483647, 1024, 8, 32], "", 0, []], [[], [["CI", 2], ["FU", 4, [0, 1, 2, 3, 4]], ["SP", 4, 0, 100352, [7], 1], ["AN", 4, 0, 5], ["AN", 4, 1, 6]]]], "r": [[1.3485e-05, 1.3486e-05, 1.34893e-05], 0, 1.89911, 1667897695], "v": "v0.6"}
{"i": [["[\"hfused_batch_norm\", 1, 7, 7, 32, 64]", "cuda -keys=cuda,gpu -max_num_threads=1024 -model=unknown -thread_warp_size=32", [-1, 16, 64, 49152, 2147483647, 1024, 8, 32], "", 0, []], [[], [["CI", 2], ["FU", 4, [0, 1, 2, 3, 4]], ["SP", 4, 0, 100352, [16], 1], ["AN", 4, 0, 5], ["AN", 4, 1, 6]]]], "r": [[7.28186e-06, 7.27892e-06, 7.27671e-06], 0, 1.56511, 1667897695], "v": "v0.6"}
{"i": [["[\"hfused_batch_norm\", 1, 7, 7, 32, 64]", "cuda -keys=cuda,gpu -max_num_threads=1024 -model=unknown -thread_warp_size=32", [-1, 16, 64, 49152, 2147483647, 1024, 8, 32], "", 0, []], [[], [["CI", 2], ["FU", 4, [0, 1, 2, 3, 4]], ["SP", 4, 0, 100352, [1], 1], ["AN", 4, 0, 5], ["AN", 4, 1, 6]]]], "r": [[7.71936e-05, 7.71891e-05, 7.72087e-05], 0, 2.58686, 1667897696], "v": "v0.6"}
{"i": [["[\"hfused_batch_norm\", 1, 7, 7, 32, 64]", "cuda -keys=cuda,gpu -max_num_threads=1024 -model=unknown -thread_warp_size=32", [-1, 16, 64, 49152, 2147483647, 1024, 8, 32], "", 0, []], [[], [["CI", 2], ["FU", 4, [0, 1, 2, 3, 4]], ["SP", 4, 0, 100352, [49], 1], ["AN", 4, 0, 5], ["AN", 4, 1, 6]]]], "r": [[4.16454e-06, 4.1584e-06, 4.16674e-06], 0, 2.90722, 1667897696], "v": "v0.6"}
{"i": [["[\"hfused_batch_norm\", 1, 7, 7, 32, 64]", "cuda -keys=cuda,gpu -max_num_threads=1024 -model=unknown -thread_warp_size=32", [-1, 16, 64, 49152, 2147483647, 1024, 8, 32], "", 0, []], [[], [["CI", 2], ["FU", 4, [0, 1, 2, 3, 4]], ["SP", 4, 0, 100352, [2], 1], ["AN", 4, 0, 5], ["AN", 4, 1, 6]]]], "r": [[4.01091e-05, 4.01036e-05, 4.0101e-05], 0, 3.25627, 1667897697], "v": "v0.6"}
{"i": [["[\"hfused_batch_norm\", 1, 7, 7, 32, 64]", "cuda -keys=cuda,gpu -max_num_threads=1024 -model=unknown -thread_warp_size=32", [-1, 16, 64, 49152, 2147483647, 1024, 8, 32], "", 0, []], [[], [["CI", 2], ["FU", 4, [0, 1, 2, 3, 4]], ["SP", 4, 0, 100352, [14], 1], ["AN", 4, 0, 5], ["AN", 4, 1, 6]]]], "r": [[8.02286e-06, 8.01932e-06, 8.02027e-06], 0, 3.91711, 1667897697], "v": "v0.6"}
{"i": [["[\"hfused_batch_norm\", 1, 7, 7, 32, 64]", "cuda -keys=cuda,gpu -max_num_threads=1024 -model=unknown -thread_warp_size=32", [-1, 16, 64, 49152, 2147483647, 1024, 8, 32], "", 0, []], [[], [["CI", 2], ["FU", 4, [0, 1, 2, 3, 4]], ["SP", 4, 0, 100352, [4], 1], ["AN", 4, 0, 5], ["AN", 4, 1, 6]]]], "r": [[2.1528e-05, 2.15102e-05, 2.15126e-05], 0, 3.57738, 1667897697], "v": "v0.6"}
{"i": [["[\"hfused_batch_norm\", 1, 7, 7, 32, 64]", "cuda -keys=cuda,gpu -max_num_threads=1024 -model=unknown -thread_warp_size=32", [-1, 16, 64, 49152, 2147483647, 1024, 8, 32], "", 0, []], [[], [["CI", 2], ["FU", 4, [0, 1, 2, 3, 4]], ["SP", 4, 0, 100352, [28], 1], ["AN", 4, 0, 5], ["AN", 4, 1, 6]]]], "r": [[5.3844e-06, 5.38568e-06, 5.39054e-06], 0, 4.2956, 1667897698], "v": "v0.6"}
{"i": [["[\"hfused_batch_norm\", 1, 7, 7, 32, 64]", "cuda -keys=cuda,gpu -max_num_threads=1024 -model=unknown -thread_warp_size=32", [-1, 16, 64, 49152, 2147483647, 1024, 8, 32], "", 0, []], [[], [["CI", 2], ["FU", 4, [0, 1, 2, 3, 4]], ["SP", 4, 0, 100352, [1], 1], ["AN", 4, 0, 5], ["AN", 4, 1, 6]]]], "r": [[7.71385e-05, 7.71156e-05, 7.71222e-05], 0, 0.910523, 1667974785], "v": "v0.6"}
{"i": [["[\"hfused_batch_norm\", 1, 7, 7, 32, 64]", "cuda -keys=cuda,gpu -max_num_threads=1024 -model=unknown -thread_warp_size=32", [-1, 16, 64, 49152, 2147483647, 1024, 8, 32], "", 0, []], [[], [["CI", 2], ["FU", 4, [0, 1, 2, 3, 4]], ["SP", 4, 0, 100352, [49], 1], ["AN", 4, 0, 5], ["AN", 4, 1, 6]]]], "r": [[4.29381e-06, 4.2902e-06, 4.2886e-06], 0, 1.95084, 1667974786], "v": "v0.6"}
{"i": [["[\"hfused_batch_norm\", 1, 7, 7, 32, 64]", "cuda -keys=cuda,gpu -max_num_threads=1024 -model=unknown -thread_warp_size=32", [-1, 16, 64, 49152, 2147483647, 1024, 8, 32], "", 0, []], [[], [["CI", 2], ["FU", 4, [0, 1, 2, 3, 4]], ["SP", 4, 0, 100352, [2], 1], ["AN", 4, 0, 5], ["AN", 4, 1, 6]]]], "r": [[3.99152e-05, 3.9909e-05, 3.98973e-05], 0, 1.63486, 1667974785], "v": "v0.6"}
{"i": [["[\"hfused_batch_norm\", 1, 7, 7, 32, 64]", "cuda -keys=cuda,gpu -max_num_threads=1024 -model=unknown -thread_warp_size=32", [-1, 16, 64, 49152, 2147483647, 1024, 8, 32], "", 0, []], [[], [["CI", 2], ["FU", 4, [0, 1, 2, 3, 4]], ["SP", 4, 0, 100352, [16], 1], ["AN", 4, 0, 5], ["AN", 4, 1, 6]]]], "r": [[7.32853e-06, 7.32395e-06, 7.3223e-06], 0, 1.27926, 1667974785], "v": "v0.6"}
{"i": [["[\"hfused_batch_norm\", 1, 7, 7, 32, 64]", "cuda -keys=cuda,gpu -max_num_threads=1024 -model=unknown -thread_warp_size=32", [-1, 16, 64, 49152, 2147483647, 1024, 8, 32], "", 0, []], [[], [["CI", 2], ["FU", 4, [0, 1, 2, 3, 4]], ["SP", 4, 0, 100352, [8], 1], ["AN", 4, 0, 5], ["AN", 4, 1, 6]]]], "r": [[1.20692e-05, 1.20749e-05, 1.20614e-05], 0, 0.563789, 1667974784], "v": "v0.6"}
{"i": [["[\"hfused_batch_norm\", 1, 7, 7, 32, 64]", "cuda -keys=cuda,gpu -max_num_threads=1024 -model=unknown -thread_warp_size=32", [-1, 16, 64, 49152, 2147483647, 1024, 8, 32], "", 0, []], [[], [["CI", 2], ["FU", 4, [0, 1, 2, 3, 4]], ["SP", 4, 0, 100352, [28], 1], ["AN", 4, 0, 5], ["AN", 4, 1, 6]]]], "r": [[5.372e-06, 5.37224e-06, 5.37166e-06], 0, 2.63802, 1667974787], "v": "v0.6"}
{"i": [["[\"hfused_batch_norm\", 1, 7, 7, 32, 64]", "cuda -keys=cuda,gpu -max_num_threads=1024 -model=unknown -thread_warp_size=32", [-1, 16, 64, 49152, 2147483647, 1024, 8, 32], "", 0, []], [[], [["CI", 2], ["FU", 4, [0, 1, 2, 3, 4]], ["SP", 4, 0, 100352, [56], 1], ["AN", 4, 0, 5], ["AN", 4, 1, 6]]]], "r": [[4.08279e-06, 4.07631e-06, 4.07617e-06], 0, 3.34973, 1667974787], "v": "v0.6"}
{"i": [["[\"hfused_batch_norm\", 1, 7, 7, 32, 64]", "cuda -keys=cuda,gpu -max_num_threads=1024 -model=unknown -thread_warp_size=32", [-1, 16, 64, 49152, 2147483647, 1024, 8, 32], "", 0, []], [[], [["CI", 2], ["FU", 4, [0, 1, 2, 3, 4]], ["SP", 4, 0, 100352, [4], 1], ["AN", 4, 0, 5], ["AN", 4, 1, 6]]]], "r": [[2.13838e-05, 2.13869e-05, 2.13897e-05], 0, 2.32315, 1667974786], "v": "v0.6"}
{"i": [["[\"hfused_batch_norm\", 1, 7, 7, 32, 64]", "cuda -keys=cuda,gpu -max_num_threads=1024 -model=unknown -thread_warp_size=32", [-1, 16, 64, 49152, 2147483647, 1024, 8, 32], "", 0, []], [[], [["CI", 2], ["FU", 4, [0, 1, 2, 3, 4]], ["SP", 4, 0, 100352, [64], 1], ["AN", 4, 0, 5], ["AN", 4, 1, 6]]]], "r": [[3.98324e-06, 3.98164e-06, 3.98407e-06], 0, 2.97771, 1667974787], "v": "v0.6"}
{"i": [["[\"hfused_batch_norm\", 1, 7, 7, 32, 64]", "cuda -keys=cuda,gpu -max_num_threads=1024 -model=unknown -thread_warp_size=32", [-1, 16, 64, 49152, 2147483647, 1024, 8, 32], "", 0, []], [[], [["CI", 2], ["FU", 4, [0, 1, 2, 3, 4]], ["SP", 4, 0, 100352, [32], 1], ["AN", 4, 0, 5], ["AN", 4, 1, 6]]]], "r": [[4.89514e-06, 4.89475e-06, 4.90014e-06], 0, 3.66878, 1667974788], "v": "v0.6"}
{"i": [["[\"hfused_batch_norm\", 1, 7, 7, 32, 64]", "cuda -keys=cuda,gpu -max_num_threads=1024 -model=unknown -thread_warp_size=32", [-1, 16, 64, 49152, 2147483647, 1024, 8, 32], "", 0, []], [[], [["CI", 2], ["FU", 4, [0, 1, 2, 3, 4]], ["SP", 4, 0, 100352, [14], 1], ["AN", 4, 0, 5], ["AN", 4, 1, 6]]]], "r": [[8.14087e-06, 8.13914e-06, 8.12799e-06], 0, 4.40271, 1667974788], "v": "v0.6"}
{"i": [["[\"hfused_batch_norm\", 1, 7, 7, 32, 64]", "cuda -keys=cuda,gpu -max_num_threads=1024 -model=unknown -thread_warp_size=32", [-1, 16, 64, 49152, 2147483647, 1024, 8, 32], "", 0, []], [[], [["CI", 2], ["FU", 4, [0, 1, 2, 3, 4]], ["SP", 4, 0, 100352, [7], 1], ["AN", 4, 0, 5], ["AN", 4, 1, 6]]]], "r": [[1.34848e-05, 1.34848e-05, 1.34767e-05], 0, 4.00863, 1667974788], "v": "v0.6"}
{"i": [["[\"hfused_batch_norm\", 1, 7, 7, 32, 64]", "cuda -keys=cuda,gpu -max_num_threads=1024 -model=unknown -thread_warp_size=32", [-1, 16, 64, 49152, 2147483647, 1024, 8, 32], "", 0, []], [[], [["CI", 2], ["FU", 4, [0, 1, 2, 3, 4]], ["SP", 4, 0, 100352, [1], 1], ["AN", 4, 0, 5], ["AN", 4, 1, 6]]]], "r": [[7.7157e-05, 7.71736e-05, 7.71717e-05], 0, 1.14196, 1667975615], "v": "v0.6"}
{"i": [["[\"hfused_batch_norm\", 1, 7, 7, 32, 64]", "cuda -keys=cuda,gpu -max_num_threads=1024 -model=unknown -thread_warp_size=32", [-1, 16, 64, 49152, 2147483647, 1024, 8, 32], "", 0, []], [[], [["CI", 2], ["FU", 4, [0, 1, 2, 3, 4]], ["SP", 4, 0, 100352, [7], 1], ["AN", 4, 0, 5], ["AN", 4, 1, 6]]]], "r": [[1.33851e-05, 1.33902e-05, 1.33935e-05], 0, 0.794599, 1667975614], "v": "v0.6"}
{"i": [["[\"hfused_batch_norm\", 1, 7, 7, 32, 64]", "cuda -keys=cuda,gpu -max_num_threads=1024 -model=unknown -thread_warp_size=32", [-1, 16, 64, 49152, 2147483647, 1024, 8, 32], "", 0, []], [[], [["CI", 2], ["FU", 4, [0, 1, 2, 3, 4]], ["SP", 4, 0, 100352, [56], 1], ["AN", 4, 0, 5], ["AN", 4, 1, 6]]]], "r": [[4.1416e-06, 4.14317e-06, 4.14164e-06], 0, 2.05493, 1667975616], "v": "v0.6"}
{"i": [["[\"hfused_batch_norm\", 1, 7, 7, 32, 64]", "cuda -keys=cuda,gpu -max_num_threads=1024 -model=unknown -thread_warp_size=32", [-1, 16, 64, 49152, 2147483647, 1024, 8, 32], "", 0, []], [[], [["CI", 2], ["FU", 4, [0, 1, 2, 3, 4]], ["SP", 4, 0, 100352, [16], 1], ["AN", 4, 0, 5], ["AN", 4, 1, 6]]]], "r": [[7.30815e-06, 7.3092e-06, 7.30786e-06], 0, 1.7521, 1667975615], "v": "v0.6"}
{"i": [["[\"hfused_batch_norm\", 1, 7, 7, 32, 64]", "cuda -keys=cuda,gpu -max_num_threads=1024 -model=unknown -thread_warp_size=32", [-1, 16, 64, 49152, 2147483647, 1024, 8, 32], "", 0, []], [[], [["CI", 2], ["FU", 4, [0, 1, 2, 3, 4]], ["SP", 4, 0, 100352, [14], 1], ["AN", 4, 0, 5], ["AN", 4, 1, 6]]]], "r": [[8.13556e-06, 8.13158e-06, 8.12846e-06], 0, 0.527844, 1667975614], "v": "v0.6"}
{"i": [["[\"hfused_batch_norm\", 1, 7, 7, 32, 64]", "cuda -keys=cuda,gpu -max_num_threads=1024 -model=unknown -thread_warp_size=32", [-1, 16, 64, 49152, 2147483647, 1024, 8, 32], "", 0, []], [[], [["CI", 2], ["FU", 4, [0, 1, 2, 3, 4]], ["SP", 4, 0, 100352, [32], 1], ["AN", 4, 0, 5], ["AN", 4, 1, 6]]]], "r": [[4.97346e-06, 4.97702e-06, 4.97566e-06], 0, 1.44425, 1667975615], "v": "v0.6"}
{"i": [["[\"hfused_batch_norm\", 1, 7, 7, 32, 64]", "cuda -keys=cuda,gpu -max_num_threads=1024 -model=unknown -thread_warp_size=32", [-1, 16, 64, 49152, 2147483647, 1024, 8, 32], "", 0, []], [[], [["CI", 2], ["FU", 4, [0, 1, 2, 3, 4]], ["SP", 4, 0, 100352, [64], 1], ["AN", 4, 0, 5], ["AN", 4, 1, 6]]]], "r": [[3.93412e-06, 3.92985e-06, 3.933e-06], 0, 2.66098, 1667975616], "v": "v0.6"}
{"i": [["[\"hfused_batch_norm\", 1, 7, 7, 32, 64]", "cuda -keys=cuda,gpu -max_num_threads=1024 -model=unknown -thread_warp_size=32", [-1, 16, 64, 49152, 2147483647, 1024, 8, 32], "", 0, []], [[], [["CI", 2], ["FU", 4, [0, 1, 2, 3, 4]], ["SP", 4, 0, 100352, [49], 1], ["AN", 4, 0, 5], ["AN", 4, 1, 6]]]], "r": [[4.17182e-06, 4.16778e-06, 4.16817e-06], 0, 2.35521, 1667975616], "v": "v0.6"}
{"i": [["[\"hfused_batch_norm\", 1, 7, 7, 32, 64]", "cuda -keys=cuda,gpu -max_num_threads=1024 -model=unknown -thread_warp_size=32", [-1, 16, 64, 49152, 2147483647, 1024, 8, 32], "", 0, []], [[], [["CI", 2], ["FU", 4, [0, 1, 2, 3, 4]], ["SP", 4, 0, 100352, [4], 1], ["AN", 4, 0, 5], ["AN", 4, 1, 6]]]], "r": [[2.13439e-05, 2.13415e-05, 2.13442e-05], 0, 3.9346, 1667975618], "v": "v0.6"}
{"i": [["[\"hfused_batch_norm\", 1, 7, 7, 32, 64]", "cuda -keys=cuda,gpu -max_num_threads=1024 -model=unknown -thread_warp_size=32", [-1, 16, 64, 49152, 2147483647, 1024, 8, 32], "", 0, []], [[], [["CI", 2], ["FU", 4, [0, 1, 2, 3, 4]], ["SP", 4, 0, 100352, [8], 1], ["AN", 4, 0, 5], ["AN", 4, 1, 6]]]], "r": [[1.21794e-05, 1.21838e-05, 1.2176e-05], 0, 3.25807, 1667975617], "v": "v0.6"}
{"i": [["[\"hfused_batch_norm\", 1, 7, 7, 32, 64]", "cuda -keys=cuda,gpu -max_num_threads=1024 -model=unknown -thread_warp_size=32", [-1, 16, 64, 49152, 2147483647, 1024, 8, 32], "", 0, []], [[], [["CI", 2], ["FU", 4, [0, 1, 2, 3, 4]], ["SP", 4, 0, 100352, [28], 1], ["AN", 4, 0, 5], ["AN", 4, 1, 6]]]], "r": [[5.37522e-06, 5.37661e-06, 5.37131e-06], 0, 2.94779, 1667975617], "v": "v0.6"}
{"i": [["[\"hfused_batch_norm\", 1, 7, 7, 32, 64]", "cuda -keys=cuda,gpu -max_num_threads=1024 -model=unknown -thread_warp_size=32", [-1, 16, 64, 49152, 2147483647, 1024, 8, 32], "", 0, []], [[], [["CI", 2], ["FU", 4, [0, 1, 2, 3, 4]], ["SP", 4, 0, 100352, [2], 1], ["AN", 4, 0, 5], ["AN", 4, 1, 6]]]], "r": [[3.99859e-05, 3.99729e-05, 3.99679e-05], 0, 3.57437, 1667975617], "v": "v0.6"}
{"i": [["[\"hfused_batch_norm\", 1, 7, 7, 32, 64]", "cuda -keys=cuda,gpu -max_num_threads=1024 -model=unknown -thread_warp_size=32", [-1, 16, 64, 49152, 2147483647, 1024, 8, 32], "", 0, []], [[], [["CI", 2], ["FU", 4, [0, 1, 2, 3, 4]], ["SP", 4, 0, 100352, [16], 1], ["AN", 4, 0, 5], ["AN", 4, 1, 6]]]], "r": [[7.22144e-06, 7.22229e-06, 7.22003e-06], 0, 1.51793, 1667976522], "v": "v0.6"}
{"i": [["[\"hfused_batch_norm\", 1, 7, 7, 32, 64]", "cuda -keys=cuda,gpu -max_num_threads=1024 -model=unknown -thread_warp_size=32", [-1, 16, 64, 49152, 2147483647, 1024, 8, 32], "", 0, []], [[], [["CI", 2], ["FU", 4, [0, 1, 2, 3, 4]], ["SP", 4, 0, 100352, [1], 1], ["AN", 4, 0, 5], ["AN", 4, 1, 6]]]], "r": [[7.70951e-05, 7.71009e-05, 7.70971e-05], 0, 0.538669, 1667976521], "v": "v0.6"}
{"i": [["[\"hfused_batch_norm\", 1, 7, 7, 32, 64]", "cuda -keys=cuda,gpu -max_num_threads=1024 -model=unknown -thread_warp_size=32", [-1, 16, 64, 49152, 2147483647, 1024, 8, 32], "", 0, []], [[], [["CI", 2], ["FU", 4, [0, 1, 2, 3, 4]], ["SP", 4, 0, 100352, [2], 1], ["AN", 4, 0, 5], ["AN", 4, 1, 6]]]], "r": [[3.99036e-05, 3.98954e-05, 3.98978e-05], 0, 0.845934, 1667976522], "v": "v0.6"}
{"i": [["[\"hfused_batch_norm\", 1, 7, 7, 32, 64]", "cuda -keys=cuda,gpu -max_num_threads=1024 -model=unknown -thread_warp_size=32", [-1, 16, 64, 49152, 2147483647, 1024, 8, 32], "", 0, []], [[], [["CI", 2], ["FU", 4, [0, 1, 2, 3, 4]], ["SP", 4, 0, 100352, [7], 1], ["AN", 4, 0, 5], ["AN", 4, 1, 6]]]], "r": [[1.35081e-05, 1.35129e-05, 1.35112e-05], 0, 1.21992, 1667976522], "v": "v0.6"}
{"i": [["[\"hfused_batch_norm\", 1, 7, 7, 32, 64]", "cuda -keys=cuda,gpu -max_num_threads=1024 -model=unknown -thread_warp_size=32", [-1, 16, 64, 49152, 2147483647, 1024, 8, 32], "", 0, []], [[], [["CI", 2], ["FU", 4, [0, 1, 2, 3, 4]], ["SP", 4, 0, 100352, [28], 1], ["AN", 4, 0, 5], ["AN", 4, 1, 6]]]], "r": [[5.41163e-06, 5.41476e-06, 5.41275e-06], 0, 2.11479, 1667976523], "v": "v0.6"}
{"i": [["[\"hfused_batch_norm\", 1, 7, 7, 32, 64]", "cuda -keys=cuda,gpu -max_num_threads=1024 -model=unknown -thread_warp_size=32", [-1, 16, 64, 49152, 2147483647, 1024, 8, 32], "", 0, []], [[], [["CI", 2], ["FU", 4, [0, 1, 2, 3, 4]], ["SP", 4, 0, 100352, [14], 1], ["AN", 4, 0, 5], ["AN", 4, 1, 6]]]], "r": [[8.12209e-06, 8.11566e-06, 8.11525e-06], 0, 2.42816, 1667976523], "v": "v0.6"}
{"i": [["[\"hfused_batch_norm\", 1, 7, 7, 32, 64]", "cuda -keys=cuda,gpu -max_num_threads=1024 -model=unknown -thread_warp_size=32", [-1, 16, 64, 49152, 2147483647, 1024, 8, 32], "", 0, []], [[], [["CI", 2], ["FU", 4, [0, 1, 2, 3, 4]], ["SP", 4, 0, 100352, [64], 1], ["AN", 4, 0, 5], ["AN", 4, 1, 6]]]], "r": [[3.78305e-06, 3.7854e-06, 3.78766e-06], 0, 1.79218, 1667976523], "v": "v0.6"}
{"i": [["[\"hfused_batch_norm\", 1, 7, 7, 32, 64]", "cuda -keys=cuda,gpu -max_num_threads=1024 -model=unknown -thread_warp_size=32", [-1, 16, 64, 49152, 2147483647, 1024, 8, 32], "", 0, []], [[], [["CI", 2], ["FU", 4, [0, 1, 2, 3, 4]], ["SP", 4, 0, 100352, [8], 1], ["AN", 4, 0, 5], ["AN", 4, 1, 6]]]], "r": [[1.20276e-05, 1.20304e-05, 1.20286e-05], 0, 2.69681, 1667976524], "v": "v0.6"}
{"i": [["[\"hfused_batch_norm\", 1, 7, 7, 32, 64]", "cuda -keys=cuda,gpu -max_num_threads=1024 -model=unknown -thread_warp_size=32", [-1, 16, 64, 49152, 2147483647, 1024, 8, 32], "", 0, []], [[], [["CI", 2], ["FU", 4, [0, 1, 2, 3, 4]], ["SP", 4, 0, 100352, [49], 1], ["AN", 4, 0, 5], ["AN", 4, 1, 6]]]], "r": [[4.23702e-06, 4.23495e-06, 4.23521e-06], 0, 4.01094, 1667976525], "v": "v0.6"}
{"i": [["[\"hfused_batch_norm\", 1, 7, 7, 32, 64]", "cuda -keys=cuda,gpu -max_num_threads=1024 -model=unknown -thread_warp_size=32", [-1, 16, 64, 49152, 2147483647, 1024, 8, 32], "", 0, []], [[], [["CI", 2], ["FU", 4, [0, 1, 2, 3, 4]], ["SP", 4, 0, 100352, [4], 1], ["AN", 4, 0, 5], ["AN", 4, 1, 6]]]], "r": [[2.13979e-05, 2.1394e-05, 2.13964e-05], 0, 3.65763, 1667976525], "v": "v0.6"}
{"i": [["[\"hfused_batch_norm\", 1, 7, 7, 32, 64]", "cuda -keys=cuda,gpu -max_num_threads=1024 -model=unknown -thread_warp_size=32", [-1, 16, 64, 49152, 2147483647, 1024, 8, 32], "", 0, []], [[], [["CI", 2], ["FU", 4, [0, 1, 2, 3, 4]], ["SP", 4, 0, 100352, [56], 1], ["AN", 4, 0, 5], ["AN", 4, 1, 6]]]], "r": [[3.97344e-06, 3.97293e-06, 3.97e-06], 0, 3.02114, 1667976524], "v": "v0.6"}
{"i": [["[\"hfused_batch_norm\", 1, 7, 7, 32, 64]", "cuda -keys=cuda,gpu -max_num_threads=1024 -model=unknown -thread_warp_size=32", [-1, 16, 64, 49152, 2147483647, 1024, 8, 32], "", 0, []], [[], [["CI", 2], ["FU", 4, [0, 1, 2, 3, 4]], ["SP", 4, 0, 100352, [32], 1], ["AN", 4, 0, 5], ["AN", 4, 1, 6]]]], "r": [[4.87147e-06, 4.87038e-06, 4.8715e-06], 0, 3.335, 1667976524], "v": "v0.6"}
{"i": [["[\"hfused_batch_norm\", 1, 7, 7, 32, 64]", "cuda -keys=cuda,gpu -max_num_threads=1024 -model=unknown -thread_warp_size=32", [-1, 16, 64, 49152, 2147483647, 1024, 8, 32], "", 0, []], [[], [["CI", 2], ["FU", 4, [0, 1, 2, 3, 4]], ["SP", 4, 0, 100352, [4], 1], ["AN", 4, 0, 5], ["AN", 4, 1, 6]]]], "r": [[2.14082e-05, 2.14172e-05, 2.14214e-05], 0, 1.48181, 1667976564], "v": "v0.6"}
{"i": [["[\"hfused_batch_norm\", 1, 7, 7, 32, 64]", "cuda -keys=cuda,gpu -max_num_threads=1024 -model=unknown -thread_warp_size=32", [-1, 16, 64, 49152, 2147483647, 1024, 8, 32], "", 0, []], [[], [["CI", 2], ["FU", 4, [0, 1, 2, 3, 4]], ["SP", 4, 0, 100352, [8], 1], ["AN", 4, 0, 5], ["AN", 4, 1, 6]]]], "r": [[1.2051e-05, 1.20519e-05, 1.2057e-05], 0, 0.539799, 1667976563], "v": "v0.6"}
{"i": [["[\"hfused_batch_norm\", 1, 7, 7, 32, 64]", "cuda -keys=cuda,gpu -max_num_threads=1024 -model=unknown -thread_warp_size=32", [-1, 16, 64, 49152, 2147483647, 1024, 8, 32], "", 0, []], [[], [["CI", 2], ["FU", 4, [0, 1, 2, 3, 4]], ["SP", 4, 0, 100352, [2], 1], ["AN", 4, 0, 5], ["AN", 4, 1, 6]]]], "r": [[3.98872e-05, 3.98807e-05, 3.98866e-05], 0, 0.83828, 1667976563], "v": "v0.6"}
{"i": [["[\"hfused_batch_norm\", 1, 7, 7, 32, 64]", "cuda -keys=cuda,gpu -max_num_threads=1024 -model=unknown -thread_warp_size=32", [-1, 16, 64, 49152, 2147483647, 1024, 8, 32], "", 0, []], [[], [["CI", 2], ["FU", 4, [0, 1, 2, 3, 4]], ["SP", 4, 0, 100352, [49], 1], ["AN", 4, 0, 5], ["AN", 4, 1, 6]]]], "r": [[4.21485e-06, 4.21339e-06, 4.21057e-06], 0, 1.80304, 1667976564], "v": "v0.6"}
{"i": [["[\"hfused_batch_norm\", 1, 7, 7, 32, 64]", "cuda -keys=cuda,gpu -max_num_threads=1024 -model=unknown -thread_warp_size=32", [-1, 16, 64, 49152, 2147483647, 1024, 8, 32], "", 0, []], [[], [["CI", 2], ["FU", 4, [0, 1, 2, 3, 4]], ["SP", 4, 0, 100352, [28], 1], ["AN", 4, 0, 5], ["AN", 4, 1, 6]]]], "r": [[5.54448e-06, 5.54315e-06, 5.54769e-06], 0, 2.42033, 1667976565], "v": "v0.6"}
{"i": [["[\"hfused_batch_norm\", 1, 7, 7, 32, 64]", "cuda -keys=cuda,gpu -max_num_threads=1024 -model=unknown -thread_warp_size=32", [-1, 16, 64, 49152, 2147483647, 1024, 8, 32], "", 0, []], [[], [["CI", 2], ["FU", 4, [0, 1, 2, 3, 4]], ["SP", 4, 0, 100352, [14], 1], ["AN", 4, 0, 5], ["AN", 4, 1, 6]]]], "r": [[8.14449e-06, 8.13601e-06, 8.14182e-06], 0, 1.19661, 1667976564], "v": "v0.6"}
{"i": [["[\"hfused_batch_norm\", 1, 7, 7, 32, 64]", "cuda -keys=cuda,gpu -max_num_threads=1024 -model=unknown -thread_warp_size=32", [-1, 16, 64, 49152, 2147483647, 1024, 8, 32], "", 0, []], [[], [["CI", 2], ["FU", 4, [0, 1, 2, 3, 4]], ["SP", 4, 0, 100352, [32], 1], ["AN", 4, 0, 5], ["AN", 4, 1, 6]]]], "r": [[5.13738e-06, 5.13642e-06, 5.13616e-06], 0, 2.12975, 1667976565], "v": "v0.6"}
{"i": [["[\"hfused_batch_norm\", 1, 7, 7, 32, 64]", "cuda -keys=cuda,gpu -max_num_threads=1024 -model=unknown -thread_warp_size=32", [-1, 16, 64, 49152, 2147483647, 1024, 8, 32], "", 0, []], [[], [["CI", 2], ["FU", 4, [0, 1, 2, 3, 4]], ["SP", 4, 0, 100352, [64], 1], ["AN", 4, 0, 5], ["AN", 4, 1, 6]]]], "r": [[3.79551e-06, 3.79501e-06, 3.79621e-06], 0, 3.05393, 1667976566], "v": "v0.6"}
{"i": [["[\"hfused_batch_norm\", 1, 7, 7, 32, 64]", "cuda -keys=cuda,gpu -max_num_threads=1024 -model=unknown -thread_warp_size=32", [-1, 16, 64, 49152, 2147483647, 1024, 8, 32], "", 0, []], [[], [["CI", 2], ["FU", 4, [0, 1, 2, 3, 4]], ["SP", 4, 0, 100352, [1], 1], ["AN", 4, 0, 5], ["AN", 4, 1, 6]]]], "r": [[7.71384e-05, 7.71286e-05, 7.7124e-05], 0, 2.70177, 1667976565], "v": "v0.6"}
{"i": [["[\"hfused_batch_norm\", 1, 7, 7, 32, 64]", "cuda -keys=cuda,gpu -max_num_threads=1024 -model=unknown -thread_warp_size=32", [-1, 16, 64, 49152, 2147483647, 1024, 8, 32], "", 0, []], [[], [["CI", 2], ["FU", 4, [0, 1, 2, 3, 4]], ["SP", 4, 0, 100352, [16], 1], ["AN", 4, 0, 5], ["AN", 4, 1, 6]]]], "r": [[7.33393e-06, 7.33755e-06, 7.33633e-06], 0, 3.993, 1667976567], "v": "v0.6"}
{"i": [["[\"hfused_batch_norm\", 1, 7, 7, 32, 64]", "cuda -keys=cuda,gpu -max_num_threads=1024 -model=unknown -thread_warp_size=32", [-1, 16, 64, 49152, 2147483647, 1024, 8, 32], "", 0, []], [[], [["CI", 2], ["FU", 4, [0, 1, 2, 3, 4]], ["SP", 4, 0, 100352, [56], 1], ["AN", 4, 0, 5], ["AN", 4, 1, 6]]]], "r": [[3.99221e-06, 3.99665e-06, 3.99876e-06], 0, 3.31319, 1667976566], "v": "v0.6"}
{"i": [["[\"hfused_batch_norm\", 1, 7, 7, 32, 64]", "cuda -keys=cuda,gpu -max_num_threads=1024 -model=unknown -thread_warp_size=32", [-1, 16, 64, 49152, 2147483647, 1024, 8, 32], "", 0, []], [[], [["CI", 2], ["FU", 4, [0, 1, 2, 3, 4]], ["SP", 4, 0, 100352, [7], 1], ["AN", 4, 0, 5], ["AN", 4, 1, 6]]]], "r": [[1.34477e-05, 1.34423e-05, 1.34441e-05], 0, 3.63084, 1667976566], "v": "v0.6"}
