python/models/resnext/ResNextHorizontal_kernel_configs/resnext_imagenet_50_batch_norm_1_28_28_512.log
{"i": [["[\"batch_norm\", 1, 28, 28, 512]", "cuda -keys=cuda,gpu -max_num_threads=1024 -model=unknown -thread_warp_size=32", [-1, 16, 64, 49152, 2147483647, 1024, 8, 32], "", 0, []], [[], [["CI", 2], ["FU", 4, [0, 1, 2, 3]], ["SP", 4, 0, 401408, [56], 1], ["AN", 4, 0, 5], ["AN", 4, 1, 6]]]], "r": [[8.01873e-06, 8.01787e-06, 8.01272e-06], 0, 0.567355, 1667896933], "v": "v0.6"}
{"i": [["[\"batch_norm\", 1, 28, 28, 512]", "cuda -keys=cuda,gpu -max_num_threads=1024 -model=unknown -thread_warp_size=32", [-1, 16, 64, 49152, 2147483647, 1024, 8, 32], "", 0, []], [[], [["CI", 2], ["FU", 4, [0, 1, 2, 3]], ["SP", 4, 0, 401408, [64], 1], ["AN", 4, 0, 5], ["AN", 4, 1, 6]]]], "r": [[7.39627e-06, 7.39744e-06, 7.38983e-06], 0, 2.29122, 1667896935], "v": "v0.6"}
{"i": [["[\"batch_norm\", 1, 28, 28, 512]", "cuda -keys=cuda,gpu -max_num_threads=1024 -model=unknown -thread_warp_size=32", [-1, 16, 64, 49152, 2147483647, 1024, 8, 32], "", 0, []], [[], [["CI", 2], ["FU", 4, [0, 1, 2, 3]], ["SP", 4, 0, 401408, [14], 1], ["AN", 4, 0, 5], ["AN", 4, 1, 6]]]], "r": [[2.3961e-05, 2.39643e-05, 2.39629e-05], 0, 1.61689, 1667896934], "v": "v0.6"}
{"i": [["[\"batch_norm\", 1, 28, 28, 512]", "cuda -keys=cuda,gpu -max_num_threads=1024 -model=unknown -thread_warp_size=32", [-1, 16, 64, 49152, 2147483647, 1024, 8, 32], "", 0, []], [[], [["CI", 2], ["FU", 4, [0, 1, 2, 3]], ["SP", 4, 0, 401408, [7], 1], ["AN", 4, 0, 5], ["AN", 4, 1, 6]]]], "r": [[4.52176e-05, 4.521e-05, 4.52189e-05], 0, 0.899618, 1667896934], "v": "v0.6"}
{"i": [["[\"batch_norm\", 1, 28, 28, 512]", "cuda -keys=cuda,gpu -max_num_threads=1024 -model=unknown -thread_warp_size=32", [-1, 16, 64, 49152, 2147483647, 1024, 8, 32], "", 0, []], [[], [["CI", 2], ["FU", 4, [0, 1, 2, 3]], ["SP", 4, 0, 401408, [8], 1], ["AN", 4, 0, 5], ["AN", 4, 1, 6]]]], "r": [[3.97884e-05, 3.97812e-05, 3.9781e-05], 0, 2.71068, 1667896936], "v": "v0.6"}
{"i": [["[\"batch_norm\", 1, 28, 28, 512]", "cuda -keys=cuda,gpu -max_num_threads=1024 -model=unknown -thread_warp_size=32", [-1, 16, 64, 49152, 2147483647, 1024, 8, 32], "", 0, []], [[], [["CI", 2], ["FU", 4, [0, 1, 2, 3]], ["SP", 4, 0, 401408, [49], 1], ["AN", 4, 0, 5], ["AN", 4, 1, 6]]]], "r": [[8.76003e-06, 8.75751e-06, 8.75688e-06], 0, 1.23214, 1667896934], "v": "v0.6"}
{"i": [["[\"batch_norm\", 1, 28, 28, 512]", "cuda -keys=cuda,gpu -max_num_threads=1024 -model=unknown -thread_warp_size=32", [-1, 16, 64, 49152, 2147483647, 1024, 8, 32], "", 0, []], [[], [["CI", 2], ["FU", 4, [0, 1, 2, 3]], ["SP", 4, 0, 401408, [2], 1], ["AN", 4, 0, 5], ["AN", 4, 1, 6]]]], "r": [[0.000151615, 0.000151588, 0.000151615], 0, 3.37051, 1667896936], "v": "v0.6"}
{"i": [["[\"batch_norm\", 1, 28, 28, 512]", "cuda -keys=cuda,gpu -max_num_threads=1024 -model=unknown -thread_warp_size=32", [-1, 16, 64, 49152, 2147483647, 1024, 8, 32], "", 0, []], [[], [["CI", 2], ["FU", 4, [0, 1, 2, 3]], ["SP", 4, 0, 401408, [32], 1], ["AN", 4, 0, 5], ["AN", 4, 1, 6]]]], "r": [[1.20807e-05, 1.20758e-05, 1.20647e-05], 0, 1.95376, 1667896935], "v": "v0.6"}
{"i": [["[\"batch_norm\", 1, 28, 28, 512]", "cuda -keys=cuda,gpu -max_num_threads=1024 -model=unknown -thread_warp_size=32", [-1, 16, 64, 49152, 2147483647, 1024, 8, 32], "", 0, []], [[], [["CI", 2], ["FU", 4, [0, 1, 2, 3]], ["SP", 4, 0, 401408, [28], 1], ["AN", 4, 0, 5], ["AN", 4, 1, 6]]]], "r": [[1.33882e-05, 1.33903e-05, 1.33863e-05], 0, 3.03844, 1667896936], "v": "v0.6"}
{"i": [["[\"batch_norm\", 1, 28, 28, 512]", "cuda -keys=cuda,gpu -max_num_threads=1024 -model=unknown -thread_warp_size=32", [-1, 16, 64, 49152, 2147483647, 1024, 8, 32], "", 0, []], [[], [["CI", 2], ["FU", 4, [0, 1, 2, 3]], ["SP", 4, 0, 401408, [16], 1], ["AN", 4, 0, 5], ["AN", 4, 1, 6]]]], "r": [[2.13034e-05, 2.13065e-05, 2.13054e-05], 0, 4.07723, 1667896937], "v": "v0.6"}
{"i": [["[\"batch_norm\", 1, 28, 28, 512]", "cuda -keys=cuda,gpu -max_num_threads=1024 -model=unknown -thread_warp_size=32", [-1, 16, 64, 49152, 2147483647, 1024, 8, 32], "", 0, []], [[], [["CI", 2], ["FU", 4, [0, 1, 2, 3]], ["SP", 4, 0, 401408, [1], 1], ["AN", 4, 0, 5], ["AN", 4, 1, 6]]]], "r": [[0.000300433, 0.000300488, 0.000300463], 0, 4.41436, 1667896937], "v": "v0.6"}
{"i": [["[\"batch_norm\", 1, 28, 28, 512]", "cuda -keys=cuda,gpu -max_num_threads=1024 -model=unknown -thread_warp_size=32", [-1, 16, 64, 49152, 2147483647, 1024, 8, 32], "", 0, []], [[], [["CI", 2], ["FU", 4, [0, 1, 2, 3]], ["SP", 4, 0, 401408, [4], 1], ["AN", 4, 0, 5], ["AN", 4, 1, 6]]]], "r": [[7.71291e-05, 7.71472e-05, 7.7159e-05], 0, 3.76221, 1667896937], "v": "v0.6"}
{"i": [["[\"batch_norm\", 1, 28, 28, 512]", "cuda -keys=cuda,gpu -max_num_threads=1024 -model=unknown -thread_warp_size=32", [-1, 16, 64, 49152, 2147483647, 1024, 8, 32], "", 0, []], [[], [["CI", 2], ["FU", 4, [0, 1, 2, 3]], ["SP", 4, 0, 401408, [2], 1], ["AN", 4, 0, 5], ["AN", 4, 1, 6]]]], "r": [[0.000151569, 0.000151539, 0.000151602], 0, 1.53713, 1667960535], "v": "v0.6"}
{"i": [["[\"batch_norm\", 1, 28, 28, 512]", "cuda -keys=cuda,gpu -max_num_threads=1024 -model=unknown -thread_warp_size=32", [-1, 16, 64, 49152, 2147483647, 1024, 8, 32], "", 0, []], [[], [["CI", 2], ["FU", 4, [0, 1, 2, 3]], ["SP", 4, 0, 401408, [4], 1], ["AN", 4, 0, 5], ["AN", 4, 1, 6]]]], "r": [[7.70489e-05, 7.70465e-05, 7.70436e-05], 0, 0.86243, 1667960535], "v": "v0.6"}
{"i": [["[\"batch_norm\", 1, 28, 28, 512]", "cuda -keys=cuda,gpu -max_num_threads=1024 -model=unknown -thread_warp_size=32", [-1, 16, 64, 49152, 2147483647, 1024, 8, 32], "", 0, []], [[], [["CI", 2], ["FU", 4, [0, 1, 2, 3]], ["SP", 4, 0, 401408, [28], 1], ["AN", 4, 0, 5], ["AN", 4, 1, 6]]]], "r": [[1.33486e-05, 1.3355e-05, 1.33528e-05], 0, 1.85913, 1667960536], "v": "v0.6"}
{"i": [["[\"batch_norm\", 1, 28, 28, 512]", "cuda -keys=cuda,gpu -max_num_threads=1024 -model=unknown -thread_warp_size=32", [-1, 16, 64, 49152, 2147483647, 1024, 8, 32], "", 0, []], [[], [["CI", 2], ["FU", 4, [0, 1, 2, 3]], ["SP", 4, 0, 401408, [49], 1], ["AN", 4, 0, 5], ["AN", 4, 1, 6]]]], "r": [[8.72313e-06, 8.71703e-06, 8.7142e-06], 0, 0.541443, 1667960534], "v": "v0.6"}
{"i": [["[\"batch_norm\", 1, 28, 28, 512]", "cuda -keys=cuda,gpu -max_num_threads=1024 -model=unknown -thread_warp_size=32", [-1, 16, 64, 49152, 2147483647, 1024, 8, 32], "", 0, []], [[], [["CI", 2], ["FU", 4, [0, 1, 2, 3]], ["SP", 4, 0, 401408, [32], 1], ["AN", 4, 0, 5], ["AN", 4, 1, 6]]]], "r": [[1.2158e-05, 1.21543e-05, 1.21534e-05], 0, 1.18666, 1667960535], "v": "v0.6"}
{"i": [["[\"batch_norm\", 1, 28, 28, 512]", "cuda -keys=cuda,gpu -max_num_threads=1024 -model=unknown -thread_warp_size=32", [-1, 16, 64, 49152, 2147483647, 1024, 8, 32], "", 0, []], [[], [["CI", 2], ["FU", 4, [0, 1, 2, 3]], ["SP", 4, 0, 401408, [64], 1], ["AN", 4, 0, 5], ["AN", 4, 1, 6]]]], "r": [[7.35058e-06, 7.35162e-06, 7.34794e-06], 0, 2.53646, 1667960536], "v": "v0.6"}
{"i": [["[\"batch_norm\", 1, 28, 28, 512]", "cuda -keys=cuda,gpu -max_num_threads=1024 -model=unknown -thread_warp_size=32", [-1, 16, 64, 49152, 2147483647, 1024, 8, 32], "", 0, []], [[], [["CI", 2], ["FU", 4, [0, 1, 2, 3]], ["SP", 4, 0, 401408, [16], 1], ["AN", 4, 0, 5], ["AN", 4, 1, 6]]]], "r": [[2.13343e-05, 2.13314e-05, 2.13316e-05], 0, 2.85935, 1667960537], "v": "v0.6"}
{"i": [["[\"batch_norm\", 1, 28, 28, 512]", "cuda -keys=cuda,gpu -max_num_threads=1024 -model=unknown -thread_warp_size=32", [-1, 16, 64, 49152, 2147483647, 1024, 8, 32], "", 0, []], [[], [["CI", 2], ["FU", 4, [0, 1, 2, 3]], ["SP", 4, 0, 401408, [1], 1], ["AN", 4, 0, 5], ["AN", 4, 1, 6]]]], "r": [[0.000300368, 0.000300364, 0.000300363], 0, 3.53149, 1667960537], "v": "v0.6"}
{"i": [["[\"batch_norm\", 1, 28, 28, 512]", "cuda -keys=cuda,gpu -max_num_threads=1024 -model=unknown -thread_warp_size=32", [-1, 16, 64, 49152, 2147483647, 1024, 8, 32], "", 0, []], [[], [["CI", 2], ["FU", 4, [0, 1, 2, 3]], ["SP", 4, 0, 401408, [8], 1], ["AN", 4, 0, 5], ["AN", 4, 1, 6]]]], "r": [[3.99882e-05, 3.99777e-05, 3.99881e-05], 0, 3.17871, 1667960537], "v": "v0.6"}
{"i": [["[\"batch_norm\", 1, 28, 28, 512]", "cuda -keys=cuda,gpu -max_num_threads=1024 -model=unknown -thread_warp_size=32", [-1, 16, 64, 49152, 2147483647, 1024, 8, 32], "", 0, []], [[], [["CI", 2], ["FU", 4, [0, 1, 2, 3]], ["SP", 4, 0, 401408, [14], 1], ["AN", 4, 0, 5], ["AN", 4, 1, 6]]]], "r": [[2.39813e-05, 2.39742e-05, 2.39765e-05], 0, 4.15805, 1667960538], "v": "v0.6"}
{"i": [["[\"batch_norm\", 1, 28, 28, 512]", "cuda -keys=cuda,gpu -max_num_threads=1024 -model=unknown -thread_warp_size=32", [-1, 16, 64, 49152, 2147483647, 1024, 8, 32], "", 0, []], [[], [["CI", 2], ["FU", 4, [0, 1, 2, 3]], ["SP", 4, 0, 401408, [56], 1], ["AN", 4, 0, 5], ["AN", 4, 1, 6]]]], "r": [[7.94316e-06, 7.95111e-06, 7.94652e-06], 0, 2.16413, 1667960536], "v": "v0.6"}
{"i": [["[\"batch_norm\", 1, 28, 28, 512]", "cuda -keys=cuda,gpu -max_num_threads=1024 -model=unknown -thread_warp_size=32", [-1, 16, 64, 49152, 2147483647, 1024, 8, 32], "", 0, []], [[], [["CI", 2], ["FU", 4, [0, 1, 2, 3]], ["SP", 4, 0, 401408, [7], 1], ["AN", 4, 0, 5], ["AN", 4, 1, 6]]]], "r": [[4.52745e-05, 4.52817e-05, 4.52738e-05], 0, 3.83516, 1667960538], "v": "v0.6"}
{"i": [["[\"batch_norm\", 1, 28, 28, 512]", "cuda -keys=cuda,gpu -max_num_threads=1024 -model=unknown -thread_warp_size=32", [-1, 16, 64, 49152, 2147483647, 1024, 8, 32], "", 0, []], [[], [["CI", 2], ["FU", 4, [0, 1, 2, 3]], ["SP", 4, 0, 401408, [49], 1], ["AN", 4, 0, 5], ["AN", 4, 1, 6]]]], "r": [[8.71615e-06, 8.71513e-06, 8.7118e-06], 0, 1.15902, 1667961272], "v": "v0.6"}
{"i": [["[\"batch_norm\", 1, 28, 28, 512]", "cuda -keys=cuda,gpu -max_num_threads=1024 -model=unknown -thread_warp_size=32", [-1, 16, 64, 49152, 2147483647, 1024, 8, 32], "", 0, []], [[], [["CI", 2], ["FU", 4, [0, 1, 2, 3]], ["SP", 4, 0, 401408, [64], 1], ["AN", 4, 0, 5], ["AN", 4, 1, 6]]]], "r": [[7.33819e-06, 7.33774e-06, 7.33511e-06], 0, 0.854036, 1667961272], "v": "v0.6"}
{"i": [["[\"batch_norm\", 1, 28, 28, 512]", "cuda -keys=cuda,gpu -max_num_threads=1024 -model=unknown -thread_warp_size=32", [-1, 16, 64, 49152, 2147483647, 1024, 8, 32], "", 0, []], [[], [["CI", 2], ["FU", 4, [0, 1, 2, 3]], ["SP", 4, 0, 401408, [14], 1], ["AN", 4, 0, 5], ["AN", 4, 1, 6]]]], "r": [[2.41765e-05, 2.41682e-05, 2.41602e-05], 0, 0.534851, 1667961271], "v": "v0.6"}
{"i": [["[\"batch_norm\", 1, 28, 28, 512]", "cuda -keys=cuda,gpu -max_num_threads=1024 -model=unknown -thread_warp_size=32", [-1, 16, 64, 49152, 2147483647, 1024, 8, 32], "", 0, []], [[], [["CI", 2], ["FU", 4, [0, 1, 2, 3]], ["SP", 4, 0, 401408, [1], 1], ["AN", 4, 0, 5], ["AN", 4, 1, 6]]]], "r": [[0.000300422, 0.000300473, 0.000300444], 0, 2.13084, 1667961273], "v": "v0.6"}
{"i": [["[\"batch_norm\", 1, 28, 28, 512]", "cuda -keys=cuda,gpu -max_num_threads=1024 -model=unknown -thread_warp_size=32", [-1, 16, 64, 49152, 2147483647, 1024, 8, 32], "", 0, []], [[], [["CI", 2], ["FU", 4, [0, 1, 2, 3]], ["SP", 4, 0, 401408, [16], 1], ["AN", 4, 0, 5], ["AN", 4, 1, 6]]]], "r": [[2.13287e-05, 2.13352e-05, 2.13282e-05], 0, 1.51954, 1667961272], "v": "v0.6"}
{"i": [["[\"batch_norm\", 1, 28, 28, 512]", "cuda -keys=cuda,gpu -max_num_threads=1024 -model=unknown -thread_warp_size=32", [-1, 16, 64, 49152, 2147483647, 1024, 8, 32], "", 0, []], [[], [["CI", 2], ["FU", 4, [0, 1, 2, 3]], ["SP", 4, 0, 401408, [7], 1], ["AN", 4, 0, 5], ["AN", 4, 1, 6]]]], "r": [[4.51988e-05, 4.52035e-05, 4.51934e-05], 0, 2.81271, 1667961274], "v": "v0.6"}
{"i": [["[\"batch_norm\", 1, 28, 28, 512]", "cuda -keys=cuda,gpu -max_num_threads=1024 -model=unknown -thread_warp_size=32", [-1, 16, 64, 49152, 2147483647, 1024, 8, 32], "", 0, []], [[], [["CI", 2], ["FU", 4, [0, 1, 2, 3]], ["SP", 4, 0, 401408, [4], 1], ["AN", 4, 0, 5], ["AN", 4, 1, 6]]]], "r": [[7.71298e-05, 7.71326e-05, 7.71517e-05], 0, 1.84383, 1667961273], "v": "v0.6"}
{"i": [["[\"batch_norm\", 1, 28, 28, 512]", "cuda -keys=cuda,gpu -max_num_threads=1024 -model=unknown -thread_warp_size=32", [-1, 16, 64, 49152, 2147483647, 1024, 8, 32], "", 0, []], [[], [["CI", 2], ["FU", 4, [0, 1, 2, 3]], ["SP", 4, 0, 401408, [2], 1], ["AN", 4, 0, 5], ["AN", 4, 1, 6]]]], "r": [[0.000151637, 0.000151593, 0.000151617], 0, 3.48282, 1667961274], "v": "v0.6"}
{"i": [["[\"batch_norm\", 1, 28, 28, 512]", "cuda -keys=cuda,gpu -max_num_threads=1024 -model=unknown -thread_warp_size=32", [-1, 16, 64, 49152, 2147483647, 1024, 8, 32], "", 0, []], [[], [["CI", 2], ["FU", 4, [0, 1, 2, 3]], ["SP", 4, 0, 401408, [28], 1], ["AN", 4, 0, 5], ["AN", 4, 1, 6]]]], "r": [[1.33591e-05, 1.33593e-05, 1.33608e-05], 0, 2.4975, 1667961273], "v": "v0.6"}
{"i": [["[\"batch_norm\", 1, 28, 28, 512]", "cuda -keys=cuda,gpu -max_num_threads=1024 -model=unknown -thread_warp_size=32", [-1, 16, 64, 49152, 2147483647, 1024, 8, 32], "", 0, []], [[], [["CI", 2], ["FU", 4, [0, 1, 2, 3]], ["SP", 4, 0, 401408, [56], 1], ["AN", 4, 0, 5], ["AN", 4, 1, 6]]]], "r": [[7.96072e-06, 7.95255e-06, 7.95405e-06], 0, 3.11549, 1667961274], "v": "v0.6"}
{"i": [["[\"batch_norm\", 1, 28, 28, 512]", "cuda -keys=cuda,gpu -max_num_threads=1024 -model=unknown -thread_warp_size=32", [-1, 16, 64, 49152, 2147483647, 1024, 8, 32], "", 0, []], [[], [["CI", 2], ["FU", 4, [0, 1, 2, 3]], ["SP", 4, 0, 401408, [32], 1], ["AN", 4, 0, 5], ["AN", 4, 1, 6]]]], "r": [[1.19817e-05, 1.19799e-05, 1.19818e-05], 0, 4.12806, 1667961275], "v": "v0.6"}
{"i": [["[\"batch_norm\", 1, 28, 28, 512]", "cuda -keys=cuda,gpu -max_num_threads=1024 -model=unknown -thread_warp_size=32", [-1, 16, 64, 49152, 2147483647, 1024, 8, 32], "", 0, []], [[], [["CI", 2], ["FU", 4, [0, 1, 2, 3]], ["SP", 4, 0, 401408, [8], 1], ["AN", 4, 0, 5], ["AN", 4, 1, 6]]]], "r": [[3.98332e-05, 3.98272e-05, 3.9828e-05], 0, 3.80904, 1667961275], "v": "v0.6"}
{"i": [["[\"batch_norm\", 1, 28, 28, 512]", "cuda -keys=cuda,gpu -max_num_threads=1024 -model=unknown -thread_warp_size=32", [-1, 16, 64, 49152, 2147483647, 1024, 8, 32], "", 0, []], [[], [["CI", 2], ["FU", 4, [0, 1, 2, 3]], ["SP", 4, 0, 401408, [4], 1], ["AN", 4, 0, 5], ["AN", 4, 1, 6]]]], "r": [[7.7046e-05, 7.70382e-05, 7.70626e-05], 0, 1.9736, 1667962258], "v": "v0.6"}
{"i": [["[\"batch_norm\", 1, 28, 28, 512]", "cuda -keys=cuda,gpu -max_num_threads=1024 -model=unknown -thread_warp_size=32", [-1, 16, 64, 49152, 2147483647, 1024, 8, 32], "", 0, []], [[], [["CI", 2], ["FU", 4, [0, 1, 2, 3]], ["SP", 4, 0, 401408, [16], 1], ["AN", 4, 0, 5], ["AN", 4, 1, 6]]]], "r": [[2.1344e-05, 2.13599e-05, 2.13438e-05], 0, 1.28245, 1667962257], "v": "v0.6"}
{"i": [["[\"batch_norm\", 1, 28, 28, 512]", "cuda -keys=cuda,gpu -max_num_threads=1024 -model=unknown -thread_warp_size=32", [-1, 16, 64, 49152, 2147483647, 1024, 8, 32], "", 0, []], [[], [["CI", 2], ["FU", 4, [0, 1, 2, 3]], ["SP", 4, 0, 401408, [56], 1], ["AN", 4, 0, 5], ["AN", 4, 1, 6]]]], "r": [[8.01324e-06, 8.02721e-06, 8.01456e-06], 0, 1.61976, 1667962258], "v": "v0.6"}
{"i": [["[\"batch_norm\", 1, 28, 28, 512]", "cuda -keys=cuda,gpu -max_num_threads=1024 -model=unknown -thread_warp_size=32", [-1, 16, 64, 49152, 2147483647, 1024, 8, 32], "", 0, []], [[], [["CI", 2], ["FU", 4, [0, 1, 2, 3]], ["SP", 4, 0, 401408, [7], 1], ["AN", 4, 0, 5], ["AN", 4, 1, 6]]]], "r": [[4.52689e-05, 4.52605e-05, 4.52465e-05], 0, 0.572408, 1667962256], "v": "v0.6"}
{"i": [["[\"batch_norm\", 1, 28, 28, 512]", "cuda -keys=cuda,gpu -max_num_threads=1024 -model=unknown -thread_warp_size=32", [-1, 16, 64, 49152, 2147483647, 1024, 8, 32], "", 0, []], [[], [["CI", 2], ["FU", 4, [0, 1, 2, 3]], ["SP", 4, 0, 401408, [32], 1], ["AN", 4, 0, 5], ["AN", 4, 1, 6]]]], "r": [[1.21364e-05, 1.21413e-05, 1.2137e-05], 0, 0.880499, 1667962257], "v": "v0.6"}
{"i": [["[\"batch_norm\", 1, 28, 28, 512]", "cuda -keys=cuda,gpu -max_num_threads=1024 -model=unknown -thread_warp_size=32", [-1, 16, 64, 49152, 2147483647, 1024, 8, 32], "", 0, []], [[], [["CI", 2], ["FU", 4, [0, 1, 2, 3]], ["SP", 4, 0, 401408, [49], 1], ["AN", 4, 0, 5], ["AN", 4, 1, 6]]]], "r": [[8.68754e-06, 8.68389e-06, 8.68106e-06], 0, 2.70433, 1667962259], "v": "v0.6"}
{"i": [["[\"batch_norm\", 1, 28, 28, 512]", "cuda -keys=cuda,gpu -max_num_threads=1024 -model=unknown -thread_warp_size=32", [-1, 16, 64, 49152, 2147483647, 1024, 8, 32], "", 0, []], [[], [["CI", 2], ["FU", 4, [0, 1, 2, 3]], ["SP", 4, 0, 401408, [2], 1], ["AN", 4, 0, 5], ["AN", 4, 1, 6]]]], "r": [[0.000151542, 0.000151449, 0.000151479], 0, 2.37029, 1667962258], "v": "v0.6"}
{"i": [["[\"batch_norm\", 1, 28, 28, 512]", "cuda -keys=cuda,gpu -max_num_threads=1024 -model=unknown -thread_warp_size=32", [-1, 16, 64, 49152, 2147483647, 1024, 8, 32], "", 0, []], [[], [["CI", 2], ["FU", 4, [0, 1, 2, 3]], ["SP", 4, 0, 401408, [1], 1], ["AN", 4, 0, 5], ["AN", 4, 1, 6]]]], "r": [[0.000300455, 0.000300474, 0.000300392], 0, 3.4183, 1667962259], "v": "v0.6"}
{"i": [["[\"batch_norm\", 1, 28, 28, 512]", "cuda -keys=cuda,gpu -max_num_threads=1024 -model=unknown -thread_warp_size=32", [-1, 16, 64, 49152, 2147483647, 1024, 8, 32], "", 0, []], [[], [["CI", 2], ["FU", 4, [0, 1, 2, 3]], ["SP", 4, 0, 401408, [14], 1], ["AN", 4, 0, 5], ["AN", 4, 1, 6]]]], "r": [[2.39865e-05, 2.39781e-05, 2.39804e-05], 0, 3.02672, 1667962259], "v": "v0.6"}
{"i": [["[\"batch_norm\", 1, 28, 28, 512]", "cuda -keys=cuda,gpu -max_num_threads=1024 -model=unknown -thread_warp_size=32", [-1, 16, 64, 49152, 2147483647, 1024, 8, 32], "", 0, []], [[], [["CI", 2], ["FU", 4, [0, 1, 2, 3]], ["SP", 4, 0, 401408, [28], 1], ["AN", 4, 0, 5], ["AN", 4, 1, 6]]]], "r": [[1.36047e-05, 1.35936e-05, 1.35935e-05], 0, 3.77531, 1667962260], "v": "v0.6"}
{"i": [["[\"batch_norm\", 1, 28, 28, 512]", "cuda -keys=cuda,gpu -max_num_threads=1024 -model=unknown -thread_warp_size=32", [-1, 16, 64, 49152, 2147483647, 1024, 8, 32], "", 0, []], [[], [["CI", 2], ["FU", 4, [0, 1, 2, 3]], ["SP", 4, 0, 401408, [64], 1], ["AN", 4, 0, 5], ["AN", 4, 1, 6]]]], "r": [[7.41309e-06, 7.40991e-06, 7.41202e-06], 0, 4.51447, 1667962261], "v": "v0.6"}
{"i": [["[\"batch_norm\", 1, 28, 28, 512]", "cuda -keys=cuda,gpu -max_num_threads=1024 -model=unknown -thread_warp_size=32", [-1, 16, 64, 49152, 2147483647, 1024, 8, 32], "", 0, []], [[], [["CI", 2], ["FU", 4, [0, 1, 2, 3]], ["SP", 4, 0, 401408, [8], 1], ["AN", 4, 0, 5], ["AN", 4, 1, 6]]]], "r": [[3.99777e-05, 3.99697e-05, 3.99747e-05], 0, 4.11711, 1667962260], "v": "v0.6"}
{"i": [["[\"batch_norm\", 1, 28, 28, 512]", "cuda -keys=cuda,gpu -max_num_threads=1024 -model=unknown -thread_warp_size=32", [-1, 16, 64, 49152, 2147483647, 1024, 8, 32], "", 0, []], [[], [["CI", 2], ["FU", 4, [0, 1, 2, 3]], ["SP", 4, 0, 401408, [56], 1], ["AN", 4, 0, 5], ["AN", 4, 1, 6]]]], "r": [[8.12532e-06, 8.12249e-06, 8.11668e-06], 0, 2.53485, 1667962367], "v": "v0.6"}
{"i": [["[\"batch_norm\", 1, 28, 28, 512]", "cuda -keys=cuda,gpu -max_num_threads=1024 -model=unknown -thread_warp_size=32", [-1, 16, 64, 49152, 2147483647, 1024, 8, 32], "", 0, []], [[], [["CI", 2], ["FU", 4, [0, 1, 2, 3]], ["SP", 4, 0, 401408, [16], 1], ["AN", 4, 0, 5], ["AN", 4, 1, 6]]]], "r": [[2.13653e-05, 2.13784e-05, 2.13614e-05], 0, 1.18104, 1667962366], "v": "v0.6"}
{"i": [["[\"batch_norm\", 1, 28, 28, 512]", "cuda -keys=cuda,gpu -max_num_threads=1024 -model=unknown -thread_warp_size=32", [-1, 16, 64, 49152, 2147483647, 1024, 8, 32], "", 0, []], [[], [["CI", 2], ["FU", 4, [0, 1, 2, 3]], ["SP", 4, 0, 401408, [8], 1], ["AN", 4, 0, 5], ["AN", 4, 1, 6]]]], "r": [[3.97852e-05, 3.97846e-05, 3.97779e-05], 0, 1.84315, 1667962367], "v": "v0.6"}
{"i": [["[\"batch_norm\", 1, 28, 28, 512]", "cuda -keys=cuda,gpu -max_num_threads=1024 -model=unknown -thread_warp_size=32", [-1, 16, 64, 49152, 2147483647, 1024, 8, 32], "", 0, []], [[], [["CI", 2], ["FU", 4, [0, 1, 2, 3]], ["SP", 4, 0, 401408, [7], 1], ["AN", 4, 0, 5], ["AN", 4, 1, 6]]]], "r": [[4.52419e-05, 4.52541e-05, 4.52434e-05], 0, 0.871106, 1667962366], "v": "v0.6"}
{"i": [["[\"batch_norm\", 1, 28, 28, 512]", "cuda -keys=cuda,gpu -max_num_threads=1024 -model=unknown -thread_warp_size=32", [-1, 16, 64, 49152, 2147483647, 1024, 8, 32], "", 0, []], [[], [["CI", 2], ["FU", 4, [0, 1, 2, 3]], ["SP", 4, 0, 401408, [28], 1], ["AN", 4, 0, 5], ["AN", 4, 1, 6]]]], "r": [[1.35392e-05, 1.35305e-05, 1.35257e-05], 0, 0.542465, 1667962365], "v": "v0.6"}
{"i": [["[\"batch_norm\", 1, 28, 28, 512]", "cuda -keys=cuda,gpu -max_num_threads=1024 -model=unknown -thread_warp_size=32", [-1, 16, 64, 49152, 2147483647, 1024, 8, 32], "", 0, []], [[], [["CI", 2], ["FU", 4, [0, 1, 2, 3]], ["SP", 4, 0, 401408, [64], 1], ["AN", 4, 0, 5], ["AN", 4, 1, 6]]]], "r": [[7.44927e-06, 7.44562e-06, 7.44765e-06], 0, 2.16406, 1667962367], "v": "v0.6"}
{"i": [["[\"batch_norm\", 1, 28, 28, 512]", "cuda -keys=cuda,gpu -max_num_threads=1024 -model=unknown -thread_warp_size=32", [-1, 16, 64, 49152, 2147483647, 1024, 8, 32], "", 0, []], [[], [["CI", 2], ["FU", 4, [0, 1, 2, 3]], ["SP", 4, 0, 401408, [4], 1], ["AN", 4, 0, 5], ["AN", 4, 1, 6]]]], "r": [[7.71404e-05, 7.71429e-05, 7.71381e-05], 0, 1.54442, 1667962366], "v": "v0.6"}
{"i": [["[\"batch_norm\", 1, 28, 28, 512]", "cuda -keys=cuda,gpu -max_num_threads=1024 -model=unknown -thread_warp_size=32", [-1, 16, 64, 49152, 2147483647, 1024, 8, 32], "", 0, []], [[], [["CI", 2], ["FU", 4, [0, 1, 2, 3]], ["SP", 4, 0, 401408, [32], 1], ["AN", 4, 0, 5], ["AN", 4, 1, 6]]]], "r": [[1.21705e-05, 1.21547e-05, 1.21486e-05], 0, 3.17879, 1667962368], "v": "v0.6"}
{"i": [["[\"batch_norm\", 1, 28, 28, 512]", "cuda -keys=cuda,gpu -max_num_threads=1024 -model=unknown -thread_warp_size=32", [-1, 16, 64, 49152, 2147483647, 1024, 8, 32], "", 0, []], [[], [["CI", 2], ["FU", 4, [0, 1, 2, 3]], ["SP", 4, 0, 401408, [1], 1], ["AN", 4, 0, 5], ["AN", 4, 1, 6]]]], "r": [[0.000300378, 0.000300436, 0.000300449], 0, 2.85077, 1667962368], "v": "v0.6"}
{"i": [["[\"batch_norm\", 1, 28, 28, 512]", "cuda -keys=cuda,gpu -max_num_threads=1024 -model=unknown -thread_warp_size=32", [-1, 16, 64, 49152, 2147483647, 1024, 8, 32], "", 0, []], [[], [["CI", 2], ["FU", 4, [0, 1, 2, 3]], ["SP", 4, 0, 401408, [49], 1], ["AN", 4, 0, 5], ["AN", 4, 1, 6]]]], "r": [[8.75407e-06, 8.75409e-06, 8.75211e-06], 0, 3.82489, 1667962369], "v": "v0.6"}
{"i": [["[\"batch_norm\", 1, 28, 28, 512]", "cuda -keys=cuda,gpu -max_num_threads=1024 -model=unknown -thread_warp_size=32", [-1, 16, 64, 49152, 2147483647, 1024, 8, 32], "", 0, []], [[], [["CI", 2], ["FU", 4, [0, 1, 2, 3]], ["SP", 4, 0, 401408, [2], 1], ["AN", 4, 0, 5], ["AN", 4, 1, 6]]]], "r": [[0.000151553, 0.000151517, 0.000151572], 0, 3.50082, 1667962368], "v": "v0.6"}
{"i": [["[\"batch_norm\", 1, 28, 28, 512]", "cuda -keys=cuda,gpu -max_num_threads=1024 -model=unknown -thread_warp_size=32", [-1, 16, 64, 49152, 2147483647, 1024, 8, 32], "", 0, []], [[], [["CI", 2], ["FU", 4, [0, 1, 2, 3]], ["SP", 4, 0, 401408, [14], 1], ["AN", 4, 0, 5], ["AN", 4, 1, 6]]]], "r": [[2.39874e-05, 2.39825e-05, 2.39857e-05], 0, 4.13936, 1667962369], "v": "v0.6"}
{"i": [["[\"batch_norm\", 1, 28, 28, 512]", "cuda -keys=cuda,gpu -max_num_threads=1024 -model=unknown -thread_warp_size=32", [-1, 16, 64, 49152, 2147483647, 1024, 8, 32], "", 0, []], [[], [["CI", 2], ["FU", 4, [0, 1, 2, 3]], ["SP", 4, 0, 401408, [7], 1], ["AN", 4, 0, 5], ["AN", 4, 1, 6]]]], "r": [[4.51854e-05, 4.51828e-05, 4.51799e-05], 0, 2.20446, 1667962475], "v": "v0.6"}
{"i": [["[\"batch_norm\", 1, 28, 28, 512]", "cuda -keys=cuda,gpu -max_num_threads=1024 -model=unknown -thread_warp_size=32", [-1, 16, 64, 49152, 2147483647, 1024, 8, 32], "", 0, []], [[], [["CI", 2], ["FU", 4, [0, 1, 2, 3]], ["SP", 4, 0, 401408, [64], 1], ["AN", 4, 0, 5], ["AN", 4, 1, 6]]]], "r": [[7.20831e-06, 7.21194e-06, 7.21028e-06], 0, 0.541028, 1667962473], "v": "v0.6"}
{"i": [["[\"batch_norm\", 1, 28, 28, 512]", "cuda -keys=cuda,gpu -max_num_threads=1024 -model=unknown -thread_warp_size=32", [-1, 16, 64, 49152, 2147483647, 1024, 8, 32], "", 0, []], [[], [["CI", 2], ["FU", 4, [0, 1, 2, 3]], ["SP", 4, 0, 401408, [4], 1], ["AN", 4, 0, 5], ["AN", 4, 1, 6]]]], "r": [[7.71447e-05, 7.71298e-05, 7.71432e-05], 0, 0.851848, 1667962473], "v": "v0.6"}
{"i": [["[\"batch_norm\", 1, 28, 28, 512]", "cuda -keys=cuda,gpu -max_num_threads=1024 -model=unknown -thread_warp_size=32", [-1, 16, 64, 49152, 2147483647, 1024, 8, 32], "", 0, []], [[], [["CI", 2], ["FU", 4, [0, 1, 2, 3]], ["SP", 4, 0, 401408, [49], 1], ["AN", 4, 0, 5], ["AN", 4, 1, 6]]]], "r": [[8.71851e-06, 8.72262e-06, 8.72381e-06], 0, 2.58886, 1667962475], "v": "v0.6"}
{"i": [["[\"batch_norm\", 1, 28, 28, 512]", "cuda -keys=cuda,gpu -max_num_threads=1024 -model=unknown -thread_warp_size=32", [-1, 16, 64, 49152, 2147483647, 1024, 8, 32], "", 0, []], [[], [["CI", 2], ["FU", 4, [0, 1, 2, 3]], ["SP", 4, 0, 401408, [8], 1], ["AN", 4, 0, 5], ["AN", 4, 1, 6]]]], "r": [[3.98226e-05, 3.98306e-05, 3.98205e-05], 0, 1.54892, 1667962474], "v": "v0.6"}
{"i": [["[\"batch_norm\", 1, 28, 28, 512]", "cuda -keys=cuda,gpu -max_num_threads=1024 -model=unknown -thread_warp_size=32", [-1, 16, 64, 49152, 2147483647, 1024, 8, 32], "", 0, []], [[], [["CI", 2], ["FU", 4, [0, 1, 2, 3]], ["SP", 4, 0, 401408, [2], 1], ["AN", 4, 0, 5], ["AN", 4, 1, 6]]]], "r": [[0.000151543, 0.000151567, 0.00015154], 0, 1.1665, 1667962474], "v": "v0.6"}
{"i": [["[\"batch_norm\", 1, 28, 28, 512]", "cuda -keys=cuda,gpu -max_num_threads=1024 -model=unknown -thread_warp_size=32", [-1, 16, 64, 49152, 2147483647, 1024, 8, 32], "", 0, []], [[], [["CI", 2], ["FU", 4, [0, 1, 2, 3]], ["SP", 4, 0, 401408, [32], 1], ["AN", 4, 0, 5], ["AN", 4, 1, 6]]]], "r": [[1.21646e-05, 1.21648e-05, 1.21618e-05], 0, 1.86613, 1667962474], "v": "v0.6"}
{"i": [["[\"batch_norm\", 1, 28, 28, 512]", "cuda -keys=cuda,gpu -max_num_threads=1024 -model=unknown -thread_warp_size=32", [-1, 16, 64, 49152, 2147483647, 1024, 8, 32], "", 0, []], [[], [["CI", 2], ["FU", 4, [0, 1, 2, 3]], ["SP", 4, 0, 401408, [56], 1], ["AN", 4, 0, 5], ["AN", 4, 1, 6]]]], "r": [[7.88858e-06, 7.8878e-06, 7.88694e-06], 0, 3.55693, 1667962476], "v": "v0.6"}
{"i": [["[\"batch_norm\", 1, 28, 28, 512]", "cuda -keys=cuda,gpu -max_num_threads=1024 -model=unknown -thread_warp_size=32", [-1, 16, 64, 49152, 2147483647, 1024, 8, 32], "", 0, []], [[], [["CI", 2], ["FU", 4, [0, 1, 2, 3]], ["SP", 4, 0, 401408, [28], 1], ["AN", 4, 0, 5], ["AN", 4, 1, 6]]]], "r": [[1.34157e-05, 1.34113e-05, 1.34054e-05], 0, 3.20623, 1667962476], "v": "v0.6"}
{"i": [["[\"batch_norm\", 1, 28, 28, 512]", "cuda -keys=cuda,gpu -max_num_threads=1024 -model=unknown -thread_warp_size=32", [-1, 16, 64, 49152, 2147483647, 1024, 8, 32], "", 0, []], [[], [["CI", 2], ["FU", 4, [0, 1, 2, 3]], ["SP", 4, 0, 401408, [14], 1], ["AN", 4, 0, 5], ["AN", 4, 1, 6]]]], "r": [[2.40902e-05, 2.40864e-05, 2.40838e-05], 0, 4.19385, 1667962477], "v": "v0.6"}
{"i": [["[\"batch_norm\", 1, 28, 28, 512]", "cuda -keys=cuda,gpu -max_num_threads=1024 -model=unknown -thread_warp_size=32", [-1, 16, 64, 49152, 2147483647, 1024, 8, 32], "", 0, []], [[], [["CI", 2], ["FU", 4, [0, 1, 2, 3]], ["SP", 4, 0, 401408, [1], 1], ["AN", 4, 0, 5], ["AN", 4, 1, 6]]]], "r": [[0.000300395, 0.000300429, 0.000300403], 0, 2.8845, 1667962475], "v": "v0.6"}
{"i": [["[\"batch_norm\", 1, 28, 28, 512]", "cuda -keys=cuda,gpu -max_num_threads=1024 -model=unknown -thread_warp_size=32", [-1, 16, 64, 49152, 2147483647, 1024, 8, 32], "", 0, []], [[], [["CI", 2], ["FU", 4, [0, 1, 2, 3]], ["SP", 4, 0, 401408, [16], 1], ["AN", 4, 0, 5], ["AN", 4, 1, 6]]]], "r": [[2.13322e-05, 2.13391e-05, 2.1329e-05], 0, 3.85824, 1667962476], "v": "v0.6"}
