python/models/resnext/ResNextHorizontal_kernel_configs/resnext_imagenet_50_maxpool_1_7_7_2048_7_7_1.log
{"i": [["[\"maxpool\", 1, 7, 7, 2048, 7, 7, 1]", "cuda -keys=cuda,gpu -max_num_threads=1024 -model=unknown -thread_warp_size=32", [-1, 16, 64, 49152, 2147483647, 1024, 8, 32], "", 0, []], [[], [["FU", 1, [4, 5]], ["SP", 1, 4, 49, [24], 1], ["AN", 1, 5, 6], ["FU", 1, [0, 1, 2, 3]], ["AN", 1, 0, 5], ["PR", 1, 0, "auto_unroll_max_step$0"]]]], "r": [[8.9891e-05, 8.9507e-05, 8.98404e-05], 0, 6.25954, 1667897816], "v": "v0.6"}
{"i": [["[\"maxpool\", 1, 7, 7, 2048, 7, 7, 1]", "cuda -keys=cuda,gpu -max_num_threads=1024 -model=unknown -thread_warp_size=32", [-1, 16, 64, 49152, 2147483647, 1024, 8, 32], "", 0, []], [[], [["FU", 1, [4, 5]], ["SP", 1, 4, 49, [1], 1], ["AN", 1, 5, 6], ["FU", 1, [0, 1, 2, 3]], ["AN", 1, 0, 5], ["PR", 1, 0, "auto_unroll_max_step$0"]]]], "r": [[7.92257e-05, 7.92741e-05, 7.92196e-05], 0, 0.692287, 1667897810], "v": "v0.6"}
{"i": [["[\"maxpool\", 1, 7, 7, 2048, 7, 7, 1]", "cuda -keys=cuda,gpu -max_num_threads=1024 -model=unknown -thread_warp_size=32", [-1, 16, 64, 49152, 2147483647, 1024, 8, 32], "", 0, []], [[], [["FU", 1, [4, 5]], ["SP", 1, 4, 49, [7], 1], ["AN", 1, 5, 6], ["FU", 1, [0, 1, 2, 3]], ["AN", 1, 0, 5], ["PR", 1, 0, "auto_unroll_max_step$64"]]]], "r": [[8.82226e-05, 8.79453e-05, 8.77336e-05], 0, 1.60724, 1667897811], "v": "v0.6"}
{"i": [["[\"maxpool\", 1, 7, 7, 2048, 7, 7, 1]", "cuda -keys=cuda,gpu -max_num_threads=1024 -model=unknown -thread_warp_size=32", [-1, 16, 64, 49152, 2147483647, 1024, 8, 32], "", 0, []], [[], [["FU", 1, [0, 1, 2, 3]], ["SP", 1, 0, 100352, [64], 1], ["AN", 1, 0, 5], ["AN", 1, 1, 6], ["PR", 1, 0, "auto_unroll_max_step$1024"]]]], "r": [[7.1777e-06, 7.18028e-06, 7.18422e-06], 0, 1.00303, 1667897810], "v": "v0.6"}
{"i": [["[\"maxpool\", 1, 7, 7, 2048, 7, 7, 1]", "cuda -keys=cuda,gpu -max_num_threads=1024 -model=unknown -thread_warp_size=32", [-1, 16, 64, 49152, 2147483647, 1024, 8, 32], "", 0, []], [[], [["FU", 1, [4, 5]], ["SP", 1, 4, 49, [49], 1], ["AN", 1, 5, 6], ["FU", 1, [0, 1, 2, 3]], ["AN", 1, 0, 5], ["PR", 1, 0, "auto_unroll_max_step$512"]]]], "r": [[8.80814e-05, 8.78693e-05, 8.79193e-05], 0, 4.28717, 1667897814], "v": "v0.6"}
{"i": [["[\"maxpool\", 1, 7, 7, 2048, 7, 7, 1]", "cuda -keys=cuda,gpu -max_num_threads=1024 -model=unknown -thread_warp_size=32", [-1, 16, 64, 49152, 2147483647, 1024, 8, 32], "", 0, []], [[], [["FU", 1, [0, 1, 2, 3]], ["SP", 1, 0, 100352, [32], 1], ["AN", 1, 0, 5], ["AN", 1, 1, 6], ["PR", 1, 0, "auto_unroll_max_step$1024"]]]], "r": [[6.75301e-06, 6.76109e-06, 6.75971e-06], 0, 1.993, 1667897811], "v": "v0.6"}
{"i": [["[\"maxpool\", 1, 7, 7, 2048, 7, 7, 1]", "cuda -keys=cuda,gpu -max_num_threads=1024 -model=unknown -thread_warp_size=32", [-1, 16, 64, 49152, 2147483647, 1024, 8, 32], "", 0, []], [[], [["FU", 1, [4, 5]], ["SP", 1, 4, 49, [7], 1], ["AN", 1, 5, 6], ["FU", 1, [0, 1, 2, 3]], ["AN", 1, 0, 5], ["PR", 1, 0, "auto_unroll_max_step$512"]]]], "r": [[8.78977e-05, 8.78705e-05, 8.79683e-05], 0, 1.34011, 1667897811], "v": "v0.6"}
{"i": [["[\"maxpool\", 1, 7, 7, 2048, 7, 7, 1]", "cuda -keys=cuda,gpu -max_num_threads=1024 -model=unknown -thread_warp_size=32", [-1, 16, 64, 49152, 2147483647, 1024, 8, 32], "", 0, []], [[], [["FU", 1, [4, 5]], ["SP", 1, 4, 49, [49], 1], ["AN", 1, 5, 6], ["FU", 1, [0, 1, 2, 3]], ["AN", 1, 0, 5], ["PR", 1, 0, "auto_unroll_max_step$64"]]]], "r": [[8.77406e-05, 8.76994e-05, 8.7408e-05], 0, 2.60707, 1667897812], "v": "v0.6"}
{"i": [["[\"maxpool\", 1, 7, 7, 2048, 7, 7, 1]", "cuda -keys=cuda,gpu -max_num_threads=1024 -model=unknown -thread_warp_size=32", [-1, 16, 64, 49152, 2147483647, 1024, 8, 32], "", 0, []], [[], [["FU", 1, [4, 5]], ["SP", 1, 4, 49, [2], 1], ["AN", 1, 5, 6], ["FU", 1, [0, 1, 2, 3]], ["AN", 1, 0, 5], ["PR", 1, 0, "auto_unroll_max_step$512"]]]], "r": [[7.9377e-05, 7.9315e-05, 7.93207e-05], 0, 5.95413, 1667897815], "v": "v0.6"}
{"i": [["[\"maxpool\", 1, 7, 7, 2048, 7, 7, 1]", "cuda -keys=cuda,gpu -max_num_threads=1024 -model=unknown -thread_warp_size=32", [-1, 16, 64, 49152, 2147483647, 1024, 8, 32], "", 0, []], [[], [["FU", 1, [4, 5]], ["SP", 1, 4, 49, [24], 1], ["AN", 1, 5, 6], ["FU", 1, [0, 1, 2, 3]], ["AN", 1, 0, 5], ["PR", 1, 0, "auto_unroll_max_step$16"]]]], "r": [[8.98166e-05, 8.95491e-05, 8.96593e-05], 0, 3.005, 1667897812], "v": "v0.6"}
{"i": [["[\"maxpool\", 1, 7, 7, 2048, 7, 7, 1]", "cuda -keys=cuda,gpu -max_num_threads=1024 -model=unknown -thread_warp_size=32", [-1, 16, 64, 49152, 2147483647, 1024, 8, 32], "", 0, []], [[], [["FU", 1, [4, 5]], ["SP", 1, 4, 49, [4], 1], ["AN", 1, 5, 6], ["FU", 1, [0, 1, 2, 3]], ["AN", 1, 0, 5], ["PR", 1, 0, "auto_unroll_max_step$16"]]]], "r": [[8.12257e-05, 8.13041e-05, 8.11355e-05], 0, 3.62847, 1667897813], "v": "v0.6"}
{"i": [["[\"maxpool\", 1, 7, 7, 2048, 7, 7, 1]", "cuda -keys=cuda,gpu -max_num_threads=1024 -model=unknown -thread_warp_size=32", [-1, 16, 64, 49152, 2147483647, 1024, 8, 32], "", 0, []], [[], [["FU", 1, [0, 1, 2, 3]], ["SP", 1, 0, 100352, [28], 1], ["AN", 1, 0, 5], ["AN", 1, 1, 6], ["PR", 1, 0, "auto_unroll_max_step$16"]]]], "r": [[7.77255e-06, 7.7856e-06, 7.77481e-06], 0, 2.23885, 1667897812], "v": "v0.6"}
{"i": [["[\"maxpool\", 1, 7, 7, 2048, 7, 7, 1]", "cuda -keys=cuda,gpu -max_num_threads=1024 -model=unknown -thread_warp_size=32", [-1, 16, 64, 49152, 2147483647, 1024, 8, 32], "", 0, []], [[], [["FU", 1, [0, 1, 2, 3]], ["SP", 1, 0, 100352, [32], 1], ["AN", 1, 0, 5], ["AN", 1, 1, 6], ["PR", 1, 0, "auto_unroll_max_step$16"]]]], "r": [[6.74814e-06, 6.77158e-06, 6.76875e-06], 0, 3.97899, 1667897813], "v": "v0.6"}
{"i": [["[\"maxpool\", 1, 7, 7, 2048, 7, 7, 1]", "cuda -keys=cuda,gpu -max_num_threads=1024 -model=unknown -thread_warp_size=32", [-1, 16, 64, 49152, 2147483647, 1024, 8, 32], "", 0, []], [[], [["FU", 1, [0, 1, 2, 3]], ["SP", 1, 0, 100352, [1], 1], ["AN", 1, 0, 5], ["AN", 1, 1, 6], ["PR", 1, 0, "auto_unroll_max_step$1024"]]]], "r": [[7.92753e-05, 7.93786e-05, 7.93554e-05], 0, 5.22168, 1667897815], "v": "v0.6"}
{"i": [["[\"maxpool\", 1, 7, 7, 2048, 7, 7, 1]", "cuda -keys=cuda,gpu -max_num_threads=1024 -model=unknown -thread_warp_size=32", [-1, 16, 64, 49152, 2147483647, 1024, 8, 32], "", 0, []], [[], [["FU", 1, [4, 5]], ["SP", 1, 4, 49, [4], 1], ["AN", 1, 5, 6], ["FU", 1, [0, 1, 2, 3]], ["AN", 1, 0, 5], ["PR", 1, 0, "auto_unroll_max_step$0"]]]], "r": [[8.0653e-05, 8.105e-05, 8.10507e-05], 0, 4.58664, 1667897814], "v": "v0.6"}
{"i": [["[\"maxpool\", 1, 7, 7, 2048, 7, 7, 1]", "cuda -keys=cuda,gpu -max_num_threads=1024 -model=unknown -thread_warp_size=32", [-1, 16, 64, 49152, 2147483647, 1024, 8, 32], "", 0, []], [[], [["FU", 1, [0, 1, 2, 3]], ["SP", 1, 0, 100352, [2], 1], ["AN", 1, 0, 5], ["AN", 1, 1, 6], ["PR", 1, 0, "auto_unroll_max_step$0"]]]], "r": [[4.66822e-05, 4.66854e-05, 4.67658e-05], 0, 5.58551, 1667897815], "v": "v0.6"}
{"i": [["[\"maxpool\", 1, 7, 7, 2048, 7, 7, 1]", "cuda -keys=cuda,gpu -max_num_threads=1024 -model=unknown -thread_warp_size=32", [-1, 16, 64, 49152, 2147483647, 1024, 8, 32], "", 0, []], [[], [["FU", 1, [0, 1, 2, 3]], ["SP", 1, 0, 100352, [4], 1], ["AN", 1, 0, 5], ["AN", 1, 1, 6], ["PR", 1, 0, "auto_unroll_max_step$0"]]]], "r": [[2.48259e-05, 2.48905e-05, 2.48291e-05], 0, 6.57597, 1667897816], "v": "v0.6"}
{"i": [["[\"maxpool\", 1, 7, 7, 2048, 7, 7, 1]", "cuda -keys=cuda,gpu -max_num_threads=1024 -model=unknown -thread_warp_size=32", [-1, 16, 64, 49152, 2147483647, 1024, 8, 32], "", 0, []], [[], [["FU", 1, [4, 5]], ["SP", 1, 4, 49, [1], 1], ["AN", 1, 5, 6], ["FU", 1, [0, 1, 2, 3]], ["AN", 1, 0, 5], ["PR", 1, 0, "auto_unroll_max_step$64"]]]], "r": [[7.92424e-05, 7.92389e-05, 7.93925e-05], 0, 3.3159, 1667897813], "v": "v0.6"}
{"i": [["[\"maxpool\", 1, 7, 7, 2048, 7, 7, 1]", "cuda -keys=cuda,gpu -max_num_threads=1024 -model=unknown -thread_warp_size=32", [-1, 16, 64, 49152, 2147483647, 1024, 8, 32], "", 0, []], [[], [["FU", 1, [4, 5]], ["SP", 1, 4, 49, [48], 1], ["AN", 1, 5, 6], ["FU", 1, [0, 1, 2, 3]], ["AN", 1, 0, 5], ["PR", 1, 0, "auto_unroll_max_step$1024"]]]], "r": [[8.89869e-05, 8.88411e-05, 8.88869e-05], 0, 6.70468, 1667897817], "v": "v0.6"}
{"i": [["[\"maxpool\", 1, 7, 7, 2048, 7, 7, 1]", "cuda -keys=cuda,gpu -max_num_threads=1024 -model=unknown -thread_warp_size=32", [-1, 16, 64, 49152, 2147483647, 1024, 8, 32], "", 0, []], [[], [["FU", 1, [0, 1, 2, 3]], ["SP", 1, 0, 100352, [32], 1], ["AN", 1, 0, 5], ["AN", 1, 1, 6], ["PR", 1, 0, "auto_unroll_max_step$0"]]]], "r": [[6.756e-06, 6.76163e-06, 6.76621e-06], 0, 4.85671, 1667897814], "v": "v0.6"}
{"i": [["[\"maxpool\", 1, 7, 7, 2048, 7, 7, 1]", "cuda -keys=cuda,gpu -max_num_threads=1024 -model=unknown -thread_warp_size=32", [-1, 16, 64, 49152, 2147483647, 1024, 8, 32], "", 0, []], [[], [["FU", 1, [0, 1, 2, 3]], ["SP", 1, 0, 100352, [1], 1], ["AN", 1, 0, 5], ["AN", 1, 1, 6], ["PR", 1, 0, "auto_unroll_max_step$64"]]]], "r": [[7.91844e-05, 7.90491e-05, 7.92966e-05], 0, 3.68482, 1667976627], "v": "v0.6"}
{"i": [["[\"maxpool\", 1, 7, 7, 2048, 7, 7, 1]", "cuda -keys=cuda,gpu -max_num_threads=1024 -model=unknown -thread_warp_size=32", [-1, 16, 64, 49152, 2147483647, 1024, 8, 32], "", 0, []], [[], [["FU", 1, [0, 1, 2, 3]], ["SP", 1, 0, 100352, [56], 1], ["AN", 1, 0, 5], ["AN", 1, 1, 6], ["PR", 1, 0, "auto_unroll_max_step$1024"]]]], "r": [[7.82623e-06, 7.82761e-06, 7.83895e-06], 0, 1.76474, 1667976625], "v": "v0.6"}
{"i": [["[\"maxpool\", 1, 7, 7, 2048, 7, 7, 1]", "cuda -keys=cuda,gpu -max_num_threads=1024 -model=unknown -thread_warp_size=32", [-1, 16, 64, 49152, 2147483647, 1024, 8, 32], "", 0, []], [[], [["FU", 1, [0, 1, 2, 3]], ["SP", 1, 0, 100352, [1], 1], ["AN", 1, 0, 5], ["AN", 1, 1, 6], ["PR", 1, 0, "auto_unroll_max_step$16"]]]], "r": [[7.9287e-05, 7.92242e-05, 7.93679e-05], 0, 4.56552, 1667976628], "v": "v0.6"}
{"i": [["[\"maxpool\", 1, 7, 7, 2048, 7, 7, 1]", "cuda -keys=cuda,gpu -max_num_threads=1024 -model=unknown -thread_warp_size=32", [-1, 16, 64, 49152, 2147483647, 1024, 8, 32], "", 0, []], [[], [["FU", 1, [4, 5]], ["SP", 1, 4, 49, [1], 1], ["AN", 1, 5, 6], ["FU", 1, [0, 1, 2, 3]], ["AN", 1, 0, 5], ["PR", 1, 0, "auto_unroll_max_step$512"]]]], "r": [[7.93029e-05, 7.9461e-05, 7.91867e-05], 0, 1.45972, 1667976625], "v": "v0.6"}
{"i": [["[\"maxpool\", 1, 7, 7, 2048, 7, 7, 1]", "cuda -keys=cuda,gpu -max_num_threads=1024 -model=unknown -thread_warp_size=32", [-1, 16, 64, 49152, 2147483647, 1024, 8, 32], "", 0, []], [[], [["FU", 1, [4, 5]], ["SP", 1, 4, 49, [48], 1], ["AN", 1, 5, 6], ["FU", 1, [0, 1, 2, 3]], ["AN", 1, 0, 5], ["PR", 1, 0, "auto_unroll_max_step$512"]]]], "r": [[8.91951e-05, 8.87661e-05, 8.89569e-05], 0, 2.76314, 1667976626], "v": "v0.6"}
{"i": [["[\"maxpool\", 1, 7, 7, 2048, 7, 7, 1]", "cuda -keys=cuda,gpu -max_num_threads=1024 -model=unknown -thread_warp_size=32", [-1, 16, 64, 49152, 2147483647, 1024, 8, 32], "", 0, []], [[], [["FU", 1, [0, 1, 2, 3]], ["SP", 1, 0, 100352, [49], 1], ["AN", 1, 0, 5], ["AN", 1, 1, 6], ["PR", 1, 0, "auto_unroll_max_step$1024"]]]], "r": [[8.57592e-06, 8.58391e-06, 8.57851e-06], 0, 1.94562, 1667976625], "v": "v0.6"}
{"i": [["[\"maxpool\", 1, 7, 7, 2048, 7, 7, 1]", "cuda -keys=cuda,gpu -max_num_threads=1024 -model=unknown -thread_warp_size=32", [-1, 16, 64, 49152, 2147483647, 1024, 8, 32], "", 0, []], [[], [["FU", 1, [0, 1, 2, 3]], ["SP", 1, 0, 100352, [14], 1], ["AN", 1, 0, 5], ["AN", 1, 1, 6], ["PR", 1, 0, "auto_unroll_max_step$1024"]]]], "r": [[1.13067e-05, 1.13342e-05, 1.13314e-05], 0, 12.5526, 1667976637], "v": "v0.6"}
{"i": [["[\"maxpool\", 1, 7, 7, 2048, 7, 7, 1]", "cuda -keys=cuda,gpu -max_num_threads=1024 -model=unknown -thread_warp_size=32", [-1, 16, 64, 49152, 2147483647, 1024, 8, 32], "", 0, []], [[], [["FU", 1, [0, 1, 2, 3]], ["SP", 1, 0, 100352, [2], 1], ["AN", 1, 0, 5], ["AN", 1, 1, 6], ["PR", 1, 0, "auto_unroll_max_step$64"]]]], "r": [[4.65237e-05, 4.65918e-05, 4.6482e-05], 0, 4.64154, 1667976629], "v": "v0.6"}
{"i": [["[\"maxpool\", 1, 7, 7, 2048, 7, 7, 1]", "cuda -keys=cuda,gpu -max_num_threads=1024 -model=unknown -thread_warp_size=32", [-1, 16, 64, 49152, 2147483647, 1024, 8, 32], "", 0, []], [[], [["FU", 1, [4, 5]], ["SP", 1, 4, 49, [8], 1], ["AN", 1, 5, 6], ["FU", 1, [0, 1, 2, 3]], ["AN", 1, 0, 5], ["PR", 1, 0, "auto_unroll_max_step$0"]]]], "r": [[8.66866e-05, 8.68162e-05, 8.65227e-05], 0, 5.13805, 1667976629], "v": "v0.6"}
{"i": [["[\"maxpool\", 1, 7, 7, 2048, 7, 7, 1]", "cuda -keys=cuda,gpu -max_num_threads=1024 -model=unknown -thread_warp_size=32", [-1, 16, 64, 49152, 2147483647, 1024, 8, 32], "", 0, []], [[], [["FU", 1, [0, 1, 2, 3]], ["SP", 1, 0, 100352, [2], 1], ["AN", 1, 0, 5], ["AN", 1, 1, 6], ["PR", 1, 0, "auto_unroll_max_step$1024"]]]], "r": [[4.66818e-05, 4.67343e-05, 4.66458e-05], 0, 3.02366, 1667976627], "v": "v0.6"}
{"i": [["[\"maxpool\", 1, 7, 7, 2048, 7, 7, 1]", "cuda -keys=cuda,gpu -max_num_threads=1024 -model=unknown -thread_warp_size=32", [-1, 16, 64, 49152, 2147483647, 1024, 8, 32], "", 0, []], [[], [["FU", 1, [0, 1, 2, 3]], ["SP", 1, 0, 100352, [14], 1], ["AN", 1, 0, 5], ["AN", 1, 1, 6], ["PR", 1, 0, "auto_unroll_max_step$64"]]]], "r": [[1.13274e-05, 1.13405e-05, 1.13367e-05], 0, 6.00664, 1667976630], "v": "v0.6"}
{"i": [["[\"maxpool\", 1, 7, 7, 2048, 7, 7, 1]", "cuda -keys=cuda,gpu -max_num_threads=1024 -model=unknown -thread_warp_size=32", [-1, 16, 64, 49152, 2147483647, 1024, 8, 32], "", 0, []], [[], [["FU", 1, [4, 5]], ["SP", 1, 4, 49, [48], 1], ["AN", 1, 5, 6], ["FU", 1, [0, 1, 2, 3]], ["AN", 1, 0, 5], ["PR", 1, 0, "auto_unroll_max_step$16"]]]], "r": [[8.90797e-05, 8.87706e-05, 8.88544e-05], 0, 5.64374, 1667976629], "v": "v0.6"}
{"i": [["[\"maxpool\", 1, 7, 7, 2048, 7, 7, 1]", "cuda -keys=cuda,gpu -max_num_threads=1024 -model=unknown -thread_warp_size=32", [-1, 16, 64, 49152, 2147483647, 1024, 8, 32], "", 0, []], [[], [["FU", 1, [0, 1, 2, 3]], ["SP", 1, 0, 100352, [28], 1], ["AN", 1, 0, 5], ["AN", 1, 1, 6], ["PR", 1, 0, "auto_unroll_max_step$64"]]]], "r": [[7.7742e-06, 7.79169e-06, 7.79106e-06], 0, 3.27328, 1667976627], "v": "v0.6"}
{"i": [["[\"maxpool\", 1, 7, 7, 2048, 7, 7, 1]", "cuda -keys=cuda,gpu -max_num_threads=1024 -model=unknown -thread_warp_size=32", [-1, 16, 64, 49152, 2147483647, 1024, 8, 32], "", 0, []], [[], [["FU", 1, [4, 5]], ["SP", 1, 4, 49, [2], 1], ["AN", 1, 5, 6], ["FU", 1, [0, 1, 2, 3]], ["AN", 1, 0, 5], ["PR", 1, 0, "auto_unroll_max_step$512"]]]], "r": [[7.93358e-05, 7.92862e-05, 7.92742e-05], 0, 2.54591, 1667976626], "v": "v0.6"}
{"i": [["[\"maxpool\", 1, 7, 7, 2048, 7, 7, 1]", "cuda -keys=cuda,gpu -max_num_threads=1024 -model=unknown -thread_warp_size=32", [-1, 16, 64, 49152, 2147483647, 1024, 8, 32], "", 0, []], [[], [["FU", 1, [4, 5]], ["SP", 1, 4, 49, [12], 1], ["AN", 1, 5, 6], ["FU", 1, [0, 1, 2, 3]], ["AN", 1, 0, 5], ["PR", 1, 0, "auto_unroll_max_step$1024"]]]], "r": [[8.86234e-05, 8.87954e-05, 8.89862e-05], 0, 6.365, 1667976630], "v": "v0.6"}
{"i": [["[\"maxpool\", 1, 7, 7, 2048, 7, 7, 1]", "cuda -keys=cuda,gpu -max_num_threads=1024 -model=unknown -thread_warp_size=32", [-1, 16, 64, 49152, 2147483647, 1024, 8, 32], "", 0, []], [[], [["FU", 1, [0, 1, 2, 3]], ["SP", 1, 0, 100352, [64], 1], ["AN", 1, 0, 5], ["AN", 1, 1, 6], ["PR", 1, 0, "auto_unroll_max_step$512"]]]], "r": [[7.23495e-06, 7.24387e-06, 7.25504e-06], 0, 7.02793, 1667976631], "v": "v0.6"}
{"i": [["[\"maxpool\", 1, 7, 7, 2048, 7, 7, 1]", "cuda -keys=cuda,gpu -max_num_threads=1024 -model=unknown -thread_warp_size=32", [-1, 16, 64, 49152, 2147483647, 1024, 8, 32], "", 0, []], [[], [["FU", 1, [0, 1, 2, 3]], ["SP", 1, 0, 100352, [32], 1], ["AN", 1, 0, 5], ["AN", 1, 1, 6], ["PR", 1, 0, "auto_unroll_max_step$0"]]]], "r": [[6.76706e-06, 6.77598e-06, 6.78205e-06], 0, 6.03789, 1667976630], "v": "v0.6"}
{"i": [["[\"maxpool\", 1, 7, 7, 2048, 7, 7, 1]", "cuda -keys=cuda,gpu -max_num_threads=1024 -model=unknown -thread_warp_size=32", [-1, 16, 64, 49152, 2147483647, 1024, 8, 32], "", 0, []], [[], [["FU", 1, [4, 5]], ["SP", 1, 4, 49, [2], 1], ["AN", 1, 5, 6], ["FU", 1, [0, 1, 2, 3]], ["AN", 1, 0, 5], ["PR", 1, 0, "auto_unroll_max_step$1024"]]]], "r": [[7.93038e-05, 7.94058e-05, 7.93578e-05], 0, 3.72323, 1667976628], "v": "v0.6"}
{"i": [["[\"maxpool\", 1, 7, 7, 2048, 7, 7, 1]", "cuda -keys=cuda,gpu -max_num_threads=1024 -model=unknown -thread_warp_size=32", [-1, 16, 64, 49152, 2147483647, 1024, 8, 32], "", 0, []], [[], [["FU", 1, [0, 1, 2, 3]], ["SP", 1, 0, 100352, [7], 1], ["AN", 1, 0, 5], ["AN", 1, 1, 6], ["PR", 1, 0, "auto_unroll_max_step$512"]]]], "r": [[1.69123e-05, 1.6977e-05, 1.69254e-05], 0, 7.41723, 1667976632], "v": "v0.6"}
{"i": [["[\"maxpool\", 1, 7, 7, 2048, 7, 7, 1]", "cuda -keys=cuda,gpu -max_num_threads=1024 -model=unknown -thread_warp_size=32", [-1, 16, 64, 49152, 2147483647, 1024, 8, 32], "", 0, []], [[], [["FU", 1, [4, 5]], ["SP", 1, 4, 49, [1], 1], ["AN", 1, 5, 6], ["FU", 1, [0, 1, 2, 3]], ["AN", 1, 0, 5], ["PR", 1, 0, "auto_unroll_max_step$0"]]]], "r": [[7.94686e-05, 7.92072e-05, 7.9109e-05], 0, 10.3829, 1667976635], "v": "v0.6"}
{"i": [["[\"maxpool\", 1, 7, 7, 2048, 7, 7, 1]", "cuda -keys=cuda,gpu -max_num_threads=1024 -model=unknown -thread_warp_size=32", [-1, 16, 64, 49152, 2147483647, 1024, 8, 32], "", 0, []], [[], [["FU", 1, [4, 5]], ["SP", 1, 4, 49, [24], 1], ["AN", 1, 5, 6], ["FU", 1, [0, 1, 2, 3]], ["AN", 1, 0, 5], ["PR", 1, 0, "auto_unroll_max_step$0"]]]], "r": [[8.96526e-05, 8.95634e-05, 8.95729e-05], 0, 9.5752, 1667976634], "v": "v0.6"}
{"i": [["[\"maxpool\", 1, 7, 7, 2048, 7, 7, 1]", "cuda -keys=cuda,gpu -max_num_threads=1024 -model=unknown -thread_warp_size=32", [-1, 16, 64, 49152, 2147483647, 1024, 8, 32], "", 0, []], [[], [["FU", 1, [0, 1, 2, 3]], ["SP", 1, 0, 100352, [2], 1], ["AN", 1, 0, 5], ["AN", 1, 1, 6], ["PR", 1, 0, "auto_unroll_max_step$512"]]]], "r": [[4.65368e-05, 4.65492e-05, 4.6647e-05], 0, 11.7819, 1667976636], "v": "v0.6"}
{"i": [["[\"maxpool\", 1, 7, 7, 2048, 7, 7, 1]", "cuda -keys=cuda,gpu -max_num_threads=1024 -model=unknown -thread_warp_size=32", [-1, 16, 64, 49152, 2147483647, 1024, 8, 32], "", 0, []], [[], [["FU", 1, [4, 5]], ["SP", 1, 4, 49, [49], 1], ["AN", 1, 5, 6], ["FU", 1, [0, 1, 2, 3]], ["AN", 1, 0, 5], ["PR", 1, 0, "auto_unroll_max_step$16"]]]], "r": [[8.78353e-05, 8.8179e-05, 8.79034e-05], 0, 8.26976, 1667976633], "v": "v0.6"}
{"i": [["[\"maxpool\", 1, 7, 7, 2048, 7, 7, 1]", "cuda -keys=cuda,gpu -max_num_threads=1024 -model=unknown -thread_warp_size=32", [-1, 16, 64, 49152, 2147483647, 1024, 8, 32], "", 0, []], [[], [["FU", 1, [4, 5]], ["SP", 1, 4, 49, [12], 1], ["AN", 1, 5, 6], ["FU", 1, [0, 1, 2, 3]], ["AN", 1, 0, 5], ["PR", 1, 0, "auto_unroll_max_step$512"]]]], "r": [[8.89054e-05, 8.89466e-05, 8.8661e-05], 0, 4.1, 1667976628], "v": "v0.6"}
{"i": [["[\"maxpool\", 1, 7, 7, 2048, 7, 7, 1]", "cuda -keys=cuda,gpu -max_num_threads=1024 -model=unknown -thread_warp_size=32", [-1, 16, 64, 49152, 2147483647, 1024, 8, 32], "", 0, []], [[], [["FU", 1, [4, 5]], ["SP", 1, 4, 49, [7], 1], ["AN", 1, 5, 6], ["FU", 1, [0, 1, 2, 3]], ["AN", 1, 0, 5], ["PR", 1, 0, "auto_unroll_max_step$64"]]]], "r": [[8.78818e-05, 8.79826e-05, 8.78086e-05], 0, 8.53157, 1667976633], "v": "v0.6"}
{"i": [["[\"maxpool\", 1, 7, 7, 2048, 7, 7, 1]", "cuda -keys=cuda,gpu -max_num_threads=1024 -model=unknown -thread_warp_size=32", [-1, 16, 64, 49152, 2147483647, 1024, 8, 32], "", 0, []], [[], [["FU", 1, [0, 1, 2, 3]], ["SP", 1, 0, 100352, [8], 1], ["AN", 1, 0, 5], ["AN", 1, 1, 6], ["PR", 1, 0, "auto_unroll_max_step$1024"]]]], "r": [[1.41988e-05, 1.42005e-05, 1.41983e-05], 0, 11.0446, 1667976635], "v": "v0.6"}
{"i": [["[\"maxpool\", 1, 7, 7, 2048, 7, 7, 1]", "cuda -keys=cuda,gpu -max_num_threads=1024 -model=unknown -thread_warp_size=32", [-1, 16, 64, 49152, 2147483647, 1024, 8, 32], "", 0, []], [[], [["FU", 1, [0, 1, 2, 3]], ["SP", 1, 0, 100352, [56], 1], ["AN", 1, 0, 5], ["AN", 1, 1, 6], ["PR", 1, 0, "auto_unroll_max_step$16"]]]], "r": [[7.82558e-06, 7.83358e-06, 7.82954e-06], 0, 9.33636, 1667976634], "v": "v0.6"}
{"i": [["[\"maxpool\", 1, 7, 7, 2048, 7, 7, 1]", "cuda -keys=cuda,gpu -max_num_threads=1024 -model=unknown -thread_warp_size=32", [-1, 16, 64, 49152, 2147483647, 1024, 8, 32], "", 0, []], [[], [["FU", 1, [0, 1, 2, 3]], ["SP", 1, 0, 100352, [4], 1], ["AN", 1, 0, 5], ["AN", 1, 1, 6], ["PR", 1, 0, "auto_unroll_max_step$512"]]]], "r": [[2.47476e-05, 2.48978e-05, 2.47668e-05], 0, 14.0014, 1667976639], "v": "v0.6"}
{"i": [["[\"maxpool\", 1, 7, 7, 2048, 7, 7, 1]", "cuda -keys=cuda,gpu -max_num_threads=1024 -model=unknown -thread_warp_size=32", [-1, 16, 64, 49152, 2147483647, 1024, 8, 32], "", 0, []], [[], [["FU", 1, [4, 5]], ["SP", 1, 4, 49, [24], 1], ["AN", 1, 5, 6], ["FU", 1, [0, 1, 2, 3]], ["AN", 1, 0, 5], ["PR", 1, 0, "auto_unroll_max_step$1024"]]]], "r": [[8.97909e-05, 9.00014e-05, 8.96584e-05], 0, 13.2702, 1667976638], "v": "v0.6"}
{"i": [["[\"maxpool\", 1, 7, 7, 2048, 7, 7, 1]", "cuda -keys=cuda,gpu -max_num_threads=1024 -model=unknown -thread_warp_size=32", [-1, 16, 64, 49152, 2147483647, 1024, 8, 32], "", 0, []], [[], [["FU", 1, [0, 1, 2, 3]], ["SP", 1, 0, 100352, [2], 1], ["AN", 1, 0, 5], ["AN", 1, 1, 6], ["PR", 1, 0, "auto_unroll_max_step$16"]]]], "r": [[4.66369e-05, 4.65449e-05, 4.65776e-05], 0, 7.17315, 1667976631], "v": "v0.6"}
{"i": [["[\"maxpool\", 1, 7, 7, 2048, 7, 7, 1]", "cuda -keys=cuda,gpu -max_num_threads=1024 -model=unknown -thread_warp_size=32", [-1, 16, 64, 49152, 2147483647, 1024, 8, 32], "", 0, []], [[], [["FU", 1, [0, 1, 2, 3]], ["SP", 1, 0, 100352, [28], 1], ["AN", 1, 0, 5], ["AN", 1, 1, 6], ["PR", 1, 0, "auto_unroll_max_step$1024"]]]], "r": [[7.75866e-06, 7.7687e-06, 7.75907e-06], 0, 11.9261, 1667976636], "v": "v0.6"}
{"i": [["[\"maxpool\", 1, 7, 7, 2048, 7, 7, 1]", "cuda -keys=cuda,gpu -max_num_threads=1024 -model=unknown -thread_warp_size=32", [-1, 16, 64, 49152, 2147483647, 1024, 8, 32], "", 0, []], [[], [["FU", 1, [4, 5]], ["SP", 1, 4, 49, [49], 1], ["AN", 1, 5, 6], ["FU", 1, [0, 1, 2, 3]], ["AN", 1, 0, 5], ["PR", 1, 0, "auto_unroll_max_step$1024"]]]], "r": [[8.77361e-05, 8.76683e-05, 8.75768e-05], 0, 11.2812, 1667976636], "v": "v0.6"}
{"i": [["[\"maxpool\", 1, 7, 7, 2048, 7, 7, 1]", "cuda -keys=cuda,gpu -max_num_threads=1024 -model=unknown -thread_warp_size=32", [-1, 16, 64, 49152, 2147483647, 1024, 8, 32], "", 0, []], [[], [["FU", 1, [0, 1, 2, 3]], ["SP", 1, 0, 100352, [32], 1], ["AN", 1, 0, 5], ["AN", 1, 1, 6], ["PR", 1, 0, "auto_unroll_max_step$1024"]]]], "r": [[6.74699e-06, 6.75782e-06, 6.74886e-06], 0, 13.7299, 1667976638], "v": "v0.6"}
{"i": [["[\"maxpool\", 1, 7, 7, 2048, 7, 7, 1]", "cuda -keys=cuda,gpu -max_num_threads=1024 -model=unknown -thread_warp_size=32", [-1, 16, 64, 49152, 2147483647, 1024, 8, 32], "", 0, []], [[], [["FU", 1, [4, 5]], ["SP", 1, 4, 49, [16], 1], ["AN", 1, 5, 6], ["FU", 1, [0, 1, 2, 3]], ["AN", 1, 0, 5], ["PR", 1, 0, "auto_unroll_max_step$1024"]]]], "r": [[8.85514e-05, 8.83703e-05, 8.86367e-05], 0, 7.94595, 1667976632], "v": "v0.6"}
{"i": [["[\"maxpool\", 1, 7, 7, 2048, 7, 7, 1]", "cuda -keys=cuda,gpu -max_num_threads=1024 -model=unknown -thread_warp_size=32", [-1, 16, 64, 49152, 2147483647, 1024, 8, 32], "", 0, []], [[], [["FU", 1, [4, 5]], ["SP", 1, 4, 49, [32], 1], ["AN", 1, 5, 6], ["FU", 1, [0, 1, 2, 3]], ["AN", 1, 0, 5], ["PR", 1, 0, "auto_unroll_max_step$16"]]]], "r": [[8.39698e-05, 8.40125e-05, 8.40241e-05], 0, 9.83876, 1667976634], "v": "v0.6"}
{"i": [["[\"maxpool\", 1, 7, 7, 2048, 7, 7, 1]", "cuda -keys=cuda,gpu -max_num_threads=1024 -model=unknown -thread_warp_size=32", [-1, 16, 64, 49152, 2147483647, 1024, 8, 32], "", 0, []], [[], [["FU", 1, [0, 1, 2, 3]], ["SP", 1, 0, 100352, [49], 1], ["AN", 1, 0, 5], ["AN", 1, 1, 6], ["PR", 1, 0, "auto_unroll_max_step$64"]]]], "r": [[8.65448e-06, 8.66599e-06, 8.6582e-06], 0, 10.6168, 1667976635], "v": "v0.6"}
{"i": [["[\"maxpool\", 1, 7, 7, 2048, 7, 7, 1]", "cuda -keys=cuda,gpu -max_num_threads=1024 -model=unknown -thread_warp_size=32", [-1, 16, 64, 49152, 2147483647, 1024, 8, 32], "", 0, []], [[], [["FU", 1, [0, 1, 2, 3]], ["SP", 1, 0, 100352, [16], 1], ["AN", 1, 0, 5], ["AN", 1, 1, 6], ["PR", 1, 0, "auto_unroll_max_step$512"]]]], "r": [[8.49745e-06, 8.53144e-06, 8.51762e-06], 0, 8.97064, 1667976633], "v": "v0.6"}
{"i": [["[\"maxpool\", 1, 7, 7, 2048, 7, 7, 1]", "cuda -keys=cuda,gpu -max_num_threads=1024 -model=unknown -thread_warp_size=32", [-1, 16, 64, 49152, 2147483647, 1024, 8, 32], "", 0, []], [[], [["FU", 1, [4, 5]], ["SP", 1, 4, 49, [4], 1], ["AN", 1, 5, 6], ["FU", 1, [0, 1, 2, 3]], ["AN", 1, 0, 5], ["PR", 1, 0, "auto_unroll_max_step$0"]]]], "r": [[8.10026e-05, 8.10404e-05, 8.16785e-05], 0, 12.7803, 1667976637], "v": "v0.6"}
{"i": [["[\"maxpool\", 1, 7, 7, 2048, 7, 7, 1]", "cuda -keys=cuda,gpu -max_num_threads=1024 -model=unknown -thread_warp_size=32", [-1, 16, 64, 49152, 2147483647, 1024, 8, 32], "", 0, []], [[], [["FU", 1, [0, 1, 2, 3]], ["SP", 1, 0, 100352, [32], 1], ["AN", 1, 0, 5], ["AN", 1, 1, 6], ["PR", 1, 0, "auto_unroll_max_step$64"]]]], "r": [[6.75882e-06, 6.76275e-06, 6.76478e-06], 0, 12.4318, 1667976637], "v": "v0.6"}
{"i": [["[\"maxpool\", 1, 7, 7, 2048, 7, 7, 1]", "cuda -keys=cuda,gpu -max_num_threads=1024 -model=unknown -thread_warp_size=32", [-1, 16, 64, 49152, 2147483647, 1024, 8, 32], "", 0, []], [[], [["FU", 1, [4, 5]], ["SP", 1, 4, 49, [8], 1], ["AN", 1, 5, 6], ["FU", 1, [0, 1, 2, 3]], ["AN", 1, 0, 5], ["PR", 1, 0, "auto_unroll_max_step$64"]]]], "r": [[8.65563e-05, 8.66678e-05, 8.64813e-05], 0, 14.2807, 1667976639], "v": "v0.6"}
{"i": [["[\"maxpool\", 1, 7, 7, 2048, 7, 7, 1]", "cuda -keys=cuda,gpu -max_num_threads=1024 -model=unknown -thread_warp_size=32", [-1, 16, 64, 49152, 2147483647, 1024, 8, 32], "", 0, []], [[], [["FU", 1, [0, 1, 2, 3]], ["SP", 1, 0, 100352, [28], 1], ["AN", 1, 0, 5], ["AN", 1, 1, 6], ["PR", 1, 0, "auto_unroll_max_step$0"]]]], "r": [[7.86465e-06, 7.88654e-06, 7.88155e-06], 0, 6.5881, 1667976631], "v": "v0.6"}
{"i": [["[\"maxpool\", 1, 7, 7, 2048, 7, 7, 1]", "cuda -keys=cuda,gpu -max_num_threads=1024 -model=unknown -thread_warp_size=32", [-1, 16, 64, 49152, 2147483647, 1024, 8, 32], "", 0, []], [[], [["FU", 1, [4, 5]], ["SP", 1, 4, 49, [49], 1], ["AN", 1, 5, 6], ["FU", 1, [0, 1, 2, 3]], ["AN", 1, 0, 5], ["PR", 1, 0, "auto_unroll_max_step$64"]]]], "r": [[8.76681e-05, 8.75456e-05, 8.73011e-05], 0, 13.4467, 1667976638], "v": "v0.6"}
{"i": [["[\"maxpool\", 1, 7, 7, 2048, 7, 7, 1]", "cuda -keys=cuda,gpu -max_num_threads=1024 -model=unknown -thread_warp_size=32", [-1, 16, 64, 49152, 2147483647, 1024, 8, 32], "", 0, []], [[], [["FU", 1, [0, 1, 2, 3]], ["SP", 1, 0, 100352, [64], 1], ["AN", 1, 0, 5], ["AN", 1, 1, 6], ["PR", 1, 0, "auto_unroll_max_step$0"]]]], "r": [[7.23372e-06, 7.24202e-06, 7.24829e-06], 0, 14.494, 1667976639], "v": "v0.6"}
{"i": [["[\"maxpool\", 1, 7, 7, 2048, 7, 7, 1]", "cuda -keys=cuda,gpu -max_num_threads=1024 -model=unknown -thread_warp_size=32", [-1, 16, 64, 49152, 2147483647, 1024, 8, 32], "", 0, []], [[], [["FU", 1, [4, 5]], ["SP", 1, 4, 49, [32], 1], ["AN", 1, 5, 6], ["FU", 1, [0, 1, 2, 3]], ["AN", 1, 0, 5], ["PR", 1, 0, "auto_unroll_max_step$64"]]]], "r": [[8.41379e-05, 8.40228e-05, 8.42029e-05], 0, 14.3532, 1667976640], "v": "v0.6"}
{"i": [["[\"maxpool\", 1, 7, 7, 2048, 7, 7, 1]", "cuda -keys=cuda,gpu -max_num_threads=1024 -model=unknown -thread_warp_size=32", [-1, 16, 64, 49152, 2147483647, 1024, 8, 32], "", 0, []], [[], [["FU", 1, [4, 5]], ["SP", 1, 4, 49, [6], 1], ["AN", 1, 5, 6], ["FU", 1, [0, 1, 2, 3]], ["AN", 1, 0, 5], ["PR", 1, 0, "auto_unroll_max_step$1024"]]]], "r": [[8.73589e-05, 8.75117e-05, 8.74598e-05], 0, 14.3741, 1667976640], "v": "v0.6"}
{"i": [["[\"maxpool\", 1, 7, 7, 2048, 7, 7, 1]", "cuda -keys=cuda,gpu -max_num_threads=1024 -model=unknown -thread_warp_size=32", [-1, 16, 64, 49152, 2147483647, 1024, 8, 32], "", 0, []], [[], [["FU", 1, [4, 5]], ["SP", 1, 4, 49, [32], 1], ["AN", 1, 5, 6], ["FU", 1, [0, 1, 2, 3]], ["AN", 1, 0, 5], ["PR", 1, 0, "auto_unroll_max_step$1024"]]]], "r": [[8.40677e-05, 8.40999e-05, 8.40772e-05], 0, 14.3011, 1667976640], "v": "v0.6"}
{"i": [["[\"maxpool\", 1, 7, 7, 2048, 7, 7, 1]", "cuda -keys=cuda,gpu -max_num_threads=1024 -model=unknown -thread_warp_size=32", [-1, 16, 64, 49152, 2147483647, 1024, 8, 32], "", 0, []], [[], [["FU", 1, [4, 5]], ["SP", 1, 4, 49, [48], 1], ["AN", 1, 5, 6], ["FU", 1, [0, 1, 2, 3]], ["AN", 1, 0, 5], ["PR", 1, 0, "auto_unroll_max_step$0"]]]], "r": [[8.8878e-05, 8.88629e-05, 8.85701e-05], 0, 14.181, 1667976641], "v": "v0.6"}
{"i": [["[\"maxpool\", 1, 7, 7, 2048, 7, 7, 1]", "cuda -keys=cuda,gpu -max_num_threads=1024 -model=unknown -thread_warp_size=32", [-1, 16, 64, 49152, 2147483647, 1024, 8, 32], "", 0, []], [[], [["FU", 1, [0, 1, 2, 3]], ["SP", 1, 0, 100352, [64], 1], ["AN", 1, 0, 5], ["AN", 1, 1, 6], ["PR", 1, 0, "auto_unroll_max_step$64"]]]], "r": [[7.25061e-06, 7.2625e-06, 7.27138e-06], 0, 14.1936, 1667976641], "v": "v0.6"}
{"i": [["[\"maxpool\", 1, 7, 7, 2048, 7, 7, 1]", "cuda -keys=cuda,gpu -max_num_threads=1024 -model=unknown -thread_warp_size=32", [-1, 16, 64, 49152, 2147483647, 1024, 8, 32], "", 0, []], [[], [["FU", 1, [4, 5]], ["SP", 1, 4, 49, [12], 1], ["AN", 1, 5, 6], ["FU", 1, [0, 1, 2, 3]], ["AN", 1, 0, 5], ["PR", 1, 0, "auto_unroll_max_step$16"]]]], "r": [[8.89251e-05, 8.87199e-05, 8.87838e-05], 0, 14.2255, 1667976641], "v": "v0.6"}
{"i": [["[\"maxpool\", 1, 7, 7, 2048, 7, 7, 1]", "cuda -keys=cuda,gpu -max_num_threads=1024 -model=unknown -thread_warp_size=32", [-1, 16, 64, 49152, 2147483647, 1024, 8, 32], "", 0, []], [[], [["FU", 1, [4, 5]], ["SP", 1, 4, 49, [1], 1], ["AN", 1, 5, 6], ["FU", 1, [0, 1, 2, 3]], ["AN", 1, 0, 5], ["PR", 1, 0, "auto_unroll_max_step$16"]]]], "r": [[7.91768e-05, 7.94064e-05, 7.93398e-05], 0, 14.1316, 1667976642], "v": "v0.6"}
{"i": [["[\"maxpool\", 1, 7, 7, 2048, 7, 7, 1]", "cuda -keys=cuda,gpu -max_num_threads=1024 -model=unknown -thread_warp_size=32", [-1, 16, 64, 49152, 2147483647, 1024, 8, 32], "", 0, []], [[], [["FU", 1, [4, 5]], ["SP", 1, 4, 49, [48], 1], ["AN", 1, 5, 6], ["FU", 1, [0, 1, 2, 3]], ["AN", 1, 0, 5], ["PR", 1, 0, "auto_unroll_max_step$64"]]]], "r": [[8.89867e-05, 8.90061e-05, 8.88379e-05], 0, 14.149, 1667976642], "v": "v0.6"}
{"i": [["[\"maxpool\", 1, 7, 7, 2048, 7, 7, 1]", "cuda -keys=cuda,gpu -max_num_threads=1024 -model=unknown -thread_warp_size=32", [-1, 16, 64, 49152, 2147483647, 1024, 8, 32], "", 0, []], [[], [["FU", 1, [0, 1, 2, 3]], ["SP", 1, 0, 100352, [4], 1], ["AN", 1, 0, 5], ["AN", 1, 1, 6], ["PR", 1, 0, "auto_unroll_max_step$0"]]]], "r": [[2.48919e-05, 2.48163e-05, 2.48876e-05], 0, 14.2492, 1667976642], "v": "v0.6"}
{"i": [["[\"maxpool\", 1, 7, 7, 2048, 7, 7, 1]", "cuda -keys=cuda,gpu -max_num_threads=1024 -model=unknown -thread_warp_size=32", [-1, 16, 64, 49152, 2147483647, 1024, 8, 32], "", 0, []], [[], [["FU", 1, [4, 5]], ["SP", 1, 4, 49, [16], 1], ["AN", 1, 5, 6], ["FU", 1, [0, 1, 2, 3]], ["AN", 1, 0, 5], ["PR", 1, 0, "auto_unroll_max_step$512"]]]], "r": [[8.85283e-05, 8.84606e-05, 8.82821e-05], 0, 14.0581, 1667976643], "v": "v0.6"}
{"i": [["[\"maxpool\", 1, 7, 7, 2048, 7, 7, 1]", "cuda -keys=cuda,gpu -max_num_threads=1024 -model=unknown -thread_warp_size=32", [-1, 16, 64, 49152, 2147483647, 1024, 8, 32], "", 0, []], [[], [["FU", 1, [4, 5]], ["SP", 1, 4, 49, [49], 1], ["AN", 1, 5, 6], ["FU", 1, [0, 1, 2, 3]], ["AN", 1, 0, 5], ["PR", 1, 0, "auto_unroll_max_step$512"]]]], "r": [[8.74126e-05, 8.75893e-05, 8.78381e-05], 0, 14.1067, 1667976643], "v": "v0.6"}
{"i": [["[\"maxpool\", 1, 7, 7, 2048, 7, 7, 1]", "cuda -keys=cuda,gpu -max_num_threads=1024 -model=unknown -thread_warp_size=32", [-1, 16, 64, 49152, 2147483647, 1024, 8, 32], "", 0, []], [[], [["FU", 1, [4, 5]], ["SP", 1, 4, 49, [4], 1], ["AN", 1, 5, 6], ["FU", 1, [0, 1, 2, 3]], ["AN", 1, 0, 5], ["PR", 1, 0, "auto_unroll_max_step$1024"]]]], "r": [[8.07821e-05, 8.12833e-05, 8.05914e-05], 0, 13.9913, 1667976643], "v": "v0.6"}
{"i": [["[\"maxpool\", 1, 7, 7, 2048, 7, 7, 1]", "cuda -keys=cuda,gpu -max_num_threads=1024 -model=unknown -thread_warp_size=32", [-1, 16, 64, 49152, 2147483647, 1024, 8, 32], "", 0, []], [[], [["FU", 1, [4, 5]], ["SP", 1, 4, 49, [8], 1], ["AN", 1, 5, 6], ["FU", 1, [0, 1, 2, 3]], ["AN", 1, 0, 5], ["PR", 1, 0, "auto_unroll_max_step$512"]]]], "r": [[8.67375e-05, 8.67994e-05, 8.66302e-05], 0, 14.0383, 1667976644], "v": "v0.6"}
{"i": [["[\"maxpool\", 1, 7, 7, 2048, 7, 7, 1]", "cuda -keys=cuda,gpu -max_num_threads=1024 -model=unknown -thread_warp_size=32", [-1, 16, 64, 49152, 2147483647, 1024, 8, 32], "", 0, []], [[], [["FU", 1, [4, 5]], ["SP", 1, 4, 49, [4], 1], ["AN", 1, 5, 6], ["FU", 1, [0, 1, 2, 3]], ["AN", 1, 0, 5], ["PR", 1, 0, "auto_unroll_max_step$512"]]]], "r": [[8.11117e-05, 8.10095e-05, 8.10983e-05], 0, 13.9021, 1667976644], "v": "v0.6"}
{"i": [["[\"maxpool\", 1, 7, 7, 2048, 7, 7, 1]", "cuda -keys=cuda,gpu -max_num_threads=1024 -model=unknown -thread_warp_size=32", [-1, 16, 64, 49152, 2147483647, 1024, 8, 32], "", 0, []], [[], [["FU", 1, [0, 1, 2, 3]], ["SP", 1, 0, 100352, [1], 1], ["AN", 1, 0, 5], ["AN", 1, 1, 6], ["PR", 1, 0, "auto_unroll_max_step$0"]]]], "r": [[7.94153e-05, 7.93818e-05, 7.94617e-05], 0, 14.0336, 1667976644], "v": "v0.6"}
{"i": [["[\"maxpool\", 1, 7, 7, 2048, 7, 7, 1]", "cuda -keys=cuda,gpu -max_num_threads=1024 -model=unknown -thread_warp_size=32", [-1, 16, 64, 49152, 2147483647, 1024, 8, 32], "", 0, []], [[], [["FU", 1, [4, 5]], ["SP", 1, 4, 49, [4], 1], ["AN", 1, 5, 6], ["FU", 1, [0, 1, 2, 3]], ["AN", 1, 0, 5], ["PR", 1, 0, "auto_unroll_max_step$64"]]]], "r": [[8.09842e-05, 8.1386e-05, 8.13975e-05], 0, 13.9125, 1667976645], "v": "v0.6"}
{"i": [["[\"maxpool\", 1, 7, 7, 2048, 7, 7, 1]", "cuda -keys=cuda,gpu -max_num_threads=1024 -model=unknown -thread_warp_size=32", [-1, 16, 64, 49152, 2147483647, 1024, 8, 32], "", 0, []], [[], [["FU", 1, [4, 5]], ["SP", 1, 4, 49, [1], 1], ["AN", 1, 5, 6], ["FU", 1, [0, 1, 2, 3]], ["AN", 1, 0, 5], ["PR", 1, 0, "auto_unroll_max_step$64"]]]], "r": [[7.91796e-05, 7.91268e-05, 7.91484e-05], 0, 13.899, 1667976645], "v": "v0.6"}
{"i": [["[\"maxpool\", 1, 7, 7, 2048, 7, 7, 1]", "cuda -keys=cuda,gpu -max_num_threads=1024 -model=unknown -thread_warp_size=32", [-1, 16, 64, 49152, 2147483647, 1024, 8, 32], "", 0, []], [[], [["FU", 1, [0, 1, 2, 3]], ["SP", 1, 0, 100352, [14], 1], ["AN", 1, 0, 5], ["AN", 1, 1, 6], ["PR", 1, 0, "auto_unroll_max_step$16"]]]], "r": [[1.12569e-05, 1.12778e-05, 1.12683e-05], 0, 13.8669, 1667976645], "v": "v0.6"}
{"i": [["[\"maxpool\", 1, 7, 7, 2048, 7, 7, 1]", "cuda -keys=cuda,gpu -max_num_threads=1024 -model=unknown -thread_warp_size=32", [-1, 16, 64, 49152, 2147483647, 1024, 8, 32], "", 0, []], [[], [["FU", 1, [4, 5]], ["SP", 1, 4, 49, [32], 1], ["AN", 1, 5, 6], ["FU", 1, [0, 1, 2, 3]], ["AN", 1, 0, 5], ["PR", 1, 0, "auto_unroll_max_step$0"]]]], "r": [[8.41947e-05, 8.41044e-05, 8.40588e-05], 0, 13.7679, 1667976646], "v": "v0.6"}
{"i": [["[\"maxpool\", 1, 7, 7, 2048, 7, 7, 1]", "cuda -keys=cuda,gpu -max_num_threads=1024 -model=unknown -thread_warp_size=32", [-1, 16, 64, 49152, 2147483647, 1024, 8, 32], "", 0, []], [[], [["FU", 1, [0, 1, 2, 3]], ["SP", 1, 0, 100352, [32], 1], ["AN", 1, 0, 5], ["AN", 1, 1, 6], ["PR", 1, 0, "auto_unroll_max_step$512"]]]], "r": [[6.74842e-06, 6.77589e-06, 6.76554e-06], 0, 13.7325, 1667976646], "v": "v0.6"}
{"i": [["[\"maxpool\", 1, 7, 7, 2048, 7, 7, 1]", "cuda -keys=cuda,gpu -max_num_threads=1024 -model=unknown -thread_warp_size=32", [-1, 16, 64, 49152, 2147483647, 1024, 8, 32], "", 0, []], [[], [["FU", 1, [0, 1, 2, 3]], ["SP", 1, 0, 100352, [28], 1], ["AN", 1, 0, 5], ["AN", 1, 1, 6], ["PR", 1, 0, "auto_unroll_max_step$16"]]]], "r": [[7.85687e-06, 7.86969e-06, 7.86756e-06], 0, 13.7659, 1667976646], "v": "v0.6"}
{"i": [["[\"maxpool\", 1, 7, 7, 2048, 7, 7, 1]", "cuda -keys=cuda,gpu -max_num_threads=1024 -model=unknown -thread_warp_size=32", [-1, 16, 64, 49152, 2147483647, 1024, 8, 32], "", 0, []], [[], [["FU", 1, [0, 1, 2, 3]], ["SP", 1, 0, 100352, [8], 1], ["AN", 1, 0, 5], ["AN", 1, 1, 6], ["PR", 1, 0, "auto_unroll_max_step$0"]]]], "r": [[1.41937e-05, 1.4184e-05, 1.42101e-05], 0, 2.59455, 1667976657], "v": "v0.6"}
{"i": [["[\"maxpool\", 1, 7, 7, 2048, 7, 7, 1]", "cuda -keys=cuda,gpu -max_num_threads=1024 -model=unknown -thread_warp_size=32", [-1, 16, 64, 49152, 2147483647, 1024, 8, 32], "", 0, []], [[], [["FU", 1, [0, 1, 2, 3]], ["SP", 1, 0, 100352, [56], 1], ["AN", 1, 0, 5], ["AN", 1, 1, 6], ["PR", 1, 0, "auto_unroll_max_step$0"]]]], "r": [[7.74816e-06, 7.77042e-06, 7.77187e-06], 0, 4.0359, 1667976658], "v": "v0.6"}
{"i": [["[\"maxpool\", 1, 7, 7, 2048, 7, 7, 1]", "cuda -keys=cuda,gpu -max_num_threads=1024 -model=unknown -thread_warp_size=32", [-1, 16, 64, 49152, 2147483647, 1024, 8, 32], "", 0, []], [[], [["FU", 1, [4, 5]], ["SP", 1, 4, 49, [6], 1], ["AN", 1, 5, 6], ["FU", 1, [0, 1, 2, 3]], ["AN", 1, 0, 5], ["PR", 1, 0, "auto_unroll_max_step$0"]]]], "r": [[8.74972e-05, 8.72662e-05, 8.73313e-05], 0, 4.14564, 1667976658], "v": "v0.6"}
{"i": [["[\"maxpool\", 1, 7, 7, 2048, 7, 7, 1]", "cuda -keys=cuda,gpu -max_num_threads=1024 -model=unknown -thread_warp_size=32", [-1, 16, 64, 49152, 2147483647, 1024, 8, 32], "", 0, []], [[], [["FU", 1, [4, 5]], ["SP", 1, 4, 49, [1], 1], ["AN", 1, 5, 6], ["FU", 1, [0, 1, 2, 3]], ["AN", 1, 0, 5], ["PR", 1, 0, "auto_unroll_max_step$1024"]]]], "r": [[7.92681e-05, 7.92118e-05, 7.92873e-05], 0, 4.47079, 1667976659], "v": "v0.6"}
{"i": [["[\"maxpool\", 1, 7, 7, 2048, 7, 7, 1]", "cuda -keys=cuda,gpu -max_num_threads=1024 -model=unknown -thread_warp_size=32", [-1, 16, 64, 49152, 2147483647, 1024, 8, 32], "", 0, []], [[], [["FU", 1, [0, 1, 2, 3]], ["SP", 1, 0, 100352, [49], 1], ["AN", 1, 0, 5], ["AN", 1, 1, 6], ["PR", 1, 0, "auto_unroll_max_step$0"]]]], "r": [[8.67174e-06, 8.67399e-06, 8.66164e-06], 0, 1.46169, 1667976655], "v": "v0.6"}
{"i": [["[\"maxpool\", 1, 7, 7, 2048, 7, 7, 1]", "cuda -keys=cuda,gpu -max_num_threads=1024 -model=unknown -thread_warp_size=32", [-1, 16, 64, 49152, 2147483647, 1024, 8, 32], "", 0, []], [[], [["FU", 1, [0, 1, 2, 3]], ["SP", 1, 0, 100352, [14], 1], ["AN", 1, 0, 5], ["AN", 1, 1, 6], ["PR", 1, 0, "auto_unroll_max_step$0"]]]], "r": [[1.12869e-05, 1.12935e-05, 1.12888e-05], 0, 4.92895, 1667976659], "v": "v0.6"}
{"i": [["[\"maxpool\", 1, 7, 7, 2048, 7, 7, 1]", "cuda -keys=cuda,gpu -max_num_threads=1024 -model=unknown -thread_warp_size=32", [-1, 16, 64, 49152, 2147483647, 1024, 8, 32], "", 0, []], [[], [["FU", 1, [4, 5]], ["SP", 1, 4, 49, [32], 1], ["AN", 1, 5, 6], ["FU", 1, [0, 1, 2, 3]], ["AN", 1, 0, 5], ["PR", 1, 0, "auto_unroll_max_step$512"]]]], "r": [[8.40696e-05, 8.42698e-05, 8.40217e-05], 0, 1.86331, 1667976656], "v": "v0.6"}
{"i": [["[\"maxpool\", 1, 7, 7, 2048, 7, 7, 1]", "cuda -keys=cuda,gpu -max_num_threads=1024 -model=unknown -thread_warp_size=32", [-1, 16, 64, 49152, 2147483647, 1024, 8, 32], "", 0, []], [[], [["FU", 1, [0, 1, 2, 3]], ["SP", 1, 0, 100352, [32], 1], ["AN", 1, 0, 5], ["AN", 1, 1, 6], ["PR", 1, 0, "auto_unroll_max_step$16"]]]], "r": [[6.75362e-06, 1.2643e-05, 1.12055e-05], 0, 1.431, 1667976655], "v": "v0.6"}
{"i": [["[\"maxpool\", 1, 7, 7, 2048, 7, 7, 1]", "cuda -keys=cuda,gpu -max_num_threads=1024 -model=unknown -thread_warp_size=32", [-1, 16, 64, 49152, 2147483647, 1024, 8, 32], "", 0, []], [[], [["FU", 1, [0, 1, 2, 3]], ["SP", 1, 0, 100352, [8], 1], ["AN", 1, 0, 5], ["AN", 1, 1, 6], ["PR", 1, 0, "auto_unroll_max_step$512"]]]], "r": [[1.42447e-05, 1.42169e-05, 1.42535e-05], 0, 3.13254, 1667976657], "v": "v0.6"}
{"i": [["[\"maxpool\", 1, 7, 7, 2048, 7, 7, 1]", "cuda -keys=cuda,gpu -max_num_threads=1024 -model=unknown -thread_warp_size=32", [-1, 16, 64, 49152, 2147483647, 1024, 8, 32], "", 0, []], [[], [["FU", 1, [0, 1, 2, 3]], ["SP", 1, 0, 100352, [2], 1], ["AN", 1, 0, 5], ["AN", 1, 1, 6], ["PR", 1, 0, "auto_unroll_max_step$0"]]]], "r": [[4.66435e-05, 4.66285e-05, 4.67269e-05], 0, 2.7684, 1667976657], "v": "v0.6"}
{"i": [["[\"maxpool\", 1, 7, 7, 2048, 7, 7, 1]", "cuda -keys=cuda,gpu -max_num_threads=1024 -model=unknown -thread_warp_size=32", [-1, 16, 64, 49152, 2147483647, 1024, 8, 32], "", 0, []], [[], [["FU", 1, [4, 5]], ["SP", 1, 4, 49, [48], 1], ["AN", 1, 5, 6], ["FU", 1, [0, 1, 2, 3]], ["AN", 1, 0, 5], ["PR", 1, 0, "auto_unroll_max_step$1024"]]]], "r": [[8.87727e-05, 8.88513e-05, 8.86148e-05], 0, 11.5676, 1667976666], "v": "v0.6"}
{"i": [["[\"maxpool\", 1, 7, 7, 2048, 7, 7, 1]", "cuda -keys=cuda,gpu -max_num_threads=1024 -model=unknown -thread_warp_size=32", [-1, 16, 64, 49152, 2147483647, 1024, 8, 32], "", 0, []], [[], [["FU", 1, [0, 1, 2, 3]], ["SP", 1, 0, 100352, [7], 1], ["AN", 1, 0, 5], ["AN", 1, 1, 6], ["PR", 1, 0, "auto_unroll_max_step$64"]]]], "r": [[1.69294e-05, 1.69173e-05, 1.69343e-05], 0, 7.40426, 1667976662], "v": "v0.6"}
{"i": [["[\"maxpool\", 1, 7, 7, 2048, 7, 7, 1]", "cuda -keys=cuda,gpu -max_num_threads=1024 -model=unknown -thread_warp_size=32", [-1, 16, 64, 49152, 2147483647, 1024, 8, 32], "", 0, []], [[], [["FU", 1, [0, 1, 2, 3]], ["SP", 1, 0, 100352, [64], 1], ["AN", 1, 0, 5], ["AN", 1, 1, 6], ["PR", 1, 0, "auto_unroll_max_step$16"]]]], "r": [[7.19123e-06, 7.1988e-06, 7.20349e-06], 0, 3.40263, 1667976658], "v": "v0.6"}
{"i": [["[\"maxpool\", 1, 7, 7, 2048, 7, 7, 1]", "cuda -keys=cuda,gpu -max_num_threads=1024 -model=unknown -thread_warp_size=32", [-1, 16, 64, 49152, 2147483647, 1024, 8, 32], "", 0, []], [[], [["FU", 1, [4, 5]], ["SP", 1, 4, 49, [8], 1], ["AN", 1, 5, 6], ["FU", 1, [0, 1, 2, 3]], ["AN", 1, 0, 5], ["PR", 1, 0, "auto_unroll_max_step$1024"]]]], "r": [[8.65721e-05, 8.66122e-05, 8.68036e-05], 0, 2.19546, 1667976656], "v": "v0.6"}
{"i": [["[\"maxpool\", 1, 7, 7, 2048, 7, 7, 1]", "cuda -keys=cuda,gpu -max_num_threads=1024 -model=unknown -thread_warp_size=32", [-1, 16, 64, 49152, 2147483647, 1024, 8, 32], "", 0, []], [[], [["FU", 1, [4, 5]], ["SP", 1, 4, 49, [7], 1], ["AN", 1, 5, 6], ["FU", 1, [0, 1, 2, 3]], ["AN", 1, 0, 5], ["PR", 1, 0, "auto_unroll_max_step$1024"]]]], "r": [[8.79836e-05, 8.81586e-05, 8.792e-05], 0, 8.14793, 1667976663], "v": "v0.6"}
{"i": [["[\"maxpool\", 1, 7, 7, 2048, 7, 7, 1]", "cuda -keys=cuda,gpu -max_num_threads=1024 -model=unknown -thread_warp_size=32", [-1, 16, 64, 49152, 2147483647, 1024, 8, 32], "", 0, []], [[], [["FU", 1, [4, 5]], ["SP", 1, 4, 49, [7], 1], ["AN", 1, 5, 6], ["FU", 1, [0, 1, 2, 3]], ["AN", 1, 0, 5], ["PR", 1, 0, "auto_unroll_max_step$512"]]]], "r": [[8.76819e-05, 8.7888e-05, 8.78105e-05], 0, 5.65714, 1667976660], "v": "v0.6"}
{"i": [["[\"maxpool\", 1, 7, 7, 2048, 7, 7, 1]", "cuda -keys=cuda,gpu -max_num_threads=1024 -model=unknown -thread_warp_size=32", [-1, 16, 64, 49152, 2147483647, 1024, 8, 32], "", 0, []], [[], [["FU", 1, [4, 5]], ["SP", 1, 4, 49, [16], 1], ["AN", 1, 5, 6], ["FU", 1, [0, 1, 2, 3]], ["AN", 1, 0, 5], ["PR", 1, 0, "auto_unroll_max_step$0"]]]], "r": [[8.84718e-05, 8.83602e-05, 8.83539e-05], 0, 5.18108, 1667976660], "v": "v0.6"}
{"i": [["[\"maxpool\", 1, 7, 7, 2048, 7, 7, 1]", "cuda -keys=cuda,gpu -max_num_threads=1024 -model=unknown -thread_warp_size=32", [-1, 16, 64, 49152, 2147483647, 1024, 8, 32], "", 0, []], [[], [["FU", 1, [0, 1, 2, 3]], ["SP", 1, 0, 100352, [16], 1], ["AN", 1, 0, 5], ["AN", 1, 1, 6], ["PR", 1, 0, "auto_unroll_max_step$1024"]]]], "r": [[8.51456e-06, 8.52624e-06, 8.52748e-06], 0, 5.69467, 1667976660], "v": "v0.6"}
{"i": [["[\"maxpool\", 1, 7, 7, 2048, 7, 7, 1]", "cuda -keys=cuda,gpu -max_num_threads=1024 -model=unknown -thread_warp_size=32", [-1, 16, 64, 49152, 2147483647, 1024, 8, 32], "", 0, []], [[], [["FU", 1, [0, 1, 2, 3]], ["SP", 1, 0, 100352, [64], 1], ["AN", 1, 0, 5], ["AN", 1, 1, 6], ["PR", 1, 0, "auto_unroll_max_step$1024"]]]], "r": [[7.19654e-06, 7.21302e-06, 7.20744e-06], 0, 9.2707, 1667976664], "v": "v0.6"}
{"i": [["[\"maxpool\", 1, 7, 7, 2048, 7, 7, 1]", "cuda -keys=cuda,gpu -max_num_threads=1024 -model=unknown -thread_warp_size=32", [-1, 16, 64, 49152, 2147483647, 1024, 8, 32], "", 0, []], [[], [["FU", 1, [0, 1, 2, 3]], ["SP", 1, 0, 100352, [16], 1], ["AN", 1, 0, 5], ["AN", 1, 1, 6], ["PR", 1, 0, "auto_unroll_max_step$0"]]]], "r": [[8.43346e-06, 8.44467e-06, 8.44358e-06], 0, 10.5465, 1667976665], "v": "v0.6"}
{"i": [["[\"maxpool\", 1, 7, 7, 2048, 7, 7, 1]", "cuda -keys=cuda,gpu -max_num_threads=1024 -model=unknown -thread_warp_size=32", [-1, 16, 64, 49152, 2147483647, 1024, 8, 32], "", 0, []], [[], [["FU", 1, [4, 5]], ["SP", 1, 4, 49, [6], 1], ["AN", 1, 5, 6], ["FU", 1, [0, 1, 2, 3]], ["AN", 1, 0, 5], ["PR", 1, 0, "auto_unroll_max_step$16"]]]], "r": [[8.73244e-05, 8.74734e-05, 8.75441e-05], 0, 7.82152, 1667976662], "v": "v0.6"}
{"i": [["[\"maxpool\", 1, 7, 7, 2048, 7, 7, 1]", "cuda -keys=cuda,gpu -max_num_threads=1024 -model=unknown -thread_warp_size=32", [-1, 16, 64, 49152, 2147483647, 1024, 8, 32], "", 0, []], [[], [["FU", 1, [0, 1, 2, 3]], ["SP", 1, 0, 100352, [16], 1], ["AN", 1, 0, 5], ["AN", 1, 1, 6], ["PR", 1, 0, "auto_unroll_max_step$16"]]]], "r": [[8.52583e-06, 8.53283e-06, 8.54143e-06], 0, 8.33773, 1667976663], "v": "v0.6"}
{"i": [["[\"maxpool\", 1, 7, 7, 2048, 7, 7, 1]", "cuda -keys=cuda,gpu -max_num_threads=1024 -model=unknown -thread_warp_size=32", [-1, 16, 64, 49152, 2147483647, 1024, 8, 32], "", 0, []], [[], [["FU", 1, [4, 5]], ["SP", 1, 4, 49, [7], 1], ["AN", 1, 5, 6], ["FU", 1, [0, 1, 2, 3]], ["AN", 1, 0, 5], ["PR", 1, 0, "auto_unroll_max_step$0"]]]], "r": [[8.78395e-05, 8.78748e-05, 8.80615e-05], 0, 5.98386, 1667976661], "v": "v0.6"}
{"i": [["[\"maxpool\", 1, 7, 7, 2048, 7, 7, 1]", "cuda -keys=cuda,gpu -max_num_threads=1024 -model=unknown -thread_warp_size=32", [-1, 16, 64, 49152, 2147483647, 1024, 8, 32], "", 0, []], [[], [["FU", 1, [0, 1, 2, 3]], ["SP", 1, 0, 100352, [4], 1], ["AN", 1, 0, 5], ["AN", 1, 1, 6], ["PR", 1, 0, "auto_unroll_max_step$16"]]]], "r": [[2.47239e-05, 2.47353e-05, 2.47316e-05], 0, 6.96212, 1667976661], "v": "v0.6"}
{"i": [["[\"maxpool\", 1, 7, 7, 2048, 7, 7, 1]", "cuda -keys=cuda,gpu -max_num_threads=1024 -model=unknown -thread_warp_size=32", [-1, 16, 64, 49152, 2147483647, 1024, 8, 32], "", 0, []], [[], [["FU", 1, [4, 5]], ["SP", 1, 4, 49, [3], 1], ["AN", 1, 5, 6], ["FU", 1, [0, 1, 2, 3]], ["AN", 1, 0, 5], ["PR", 1, 0, "auto_unroll_max_step$512"]]]], "r": [[7.90428e-05, 7.92251e-05, 7.90266e-05], 0, 6.46166, 1667976661], "v": "v0.6"}
{"i": [["[\"maxpool\", 1, 7, 7, 2048, 7, 7, 1]", "cuda -keys=cuda,gpu -max_num_threads=1024 -model=unknown -thread_warp_size=32", [-1, 16, 64, 49152, 2147483647, 1024, 8, 32], "", 0, []], [[], [["FU", 1, [4, 5]], ["SP", 1, 4, 49, [24], 1], ["AN", 1, 5, 6], ["FU", 1, [0, 1, 2, 3]], ["AN", 1, 0, 5], ["PR", 1, 0, "auto_unroll_max_step$64"]]]], "r": [[8.95956e-05, 8.98257e-05, 8.97052e-05], 0, 13.8487, 1667976669], "v": "v0.6"}
{"i": [["[\"maxpool\", 1, 7, 7, 2048, 7, 7, 1]", "cuda -keys=cuda,gpu -max_num_threads=1024 -model=unknown -thread_warp_size=32", [-1, 16, 64, 49152, 2147483647, 1024, 8, 32], "", 0, []], [[], [["FU", 1, [0, 1, 2, 3]], ["SP", 1, 0, 100352, [1], 1], ["AN", 1, 0, 5], ["AN", 1, 1, 6], ["PR", 1, 0, "auto_unroll_max_step$1024"]]]], "r": [[7.9531e-05, 7.91365e-05, 7.91998e-05], 0, 11.0104, 1667976666], "v": "v0.6"}
{"i": [["[\"maxpool\", 1, 7, 7, 2048, 7, 7, 1]", "cuda -keys=cuda,gpu -max_num_threads=1024 -model=unknown -thread_warp_size=32", [-1, 16, 64, 49152, 2147483647, 1024, 8, 32], "", 0, []], [[], [["FU", 1, [4, 5]], ["SP", 1, 4, 49, [49], 1], ["AN", 1, 5, 6], ["FU", 1, [0, 1, 2, 3]], ["AN", 1, 0, 5], ["PR", 1, 0, "auto_unroll_max_step$0"]]]], "r": [[8.77886e-05, 8.7615e-05, 8.77425e-05], 0, 9.82066, 1667976664], "v": "v0.6"}
{"i": [["[\"maxpool\", 1, 7, 7, 2048, 7, 7, 1]", "cuda -keys=cuda,gpu -max_num_threads=1024 -model=unknown -thread_warp_size=32", [-1, 16, 64, 49152, 2147483647, 1024, 8, 32], "", 0, []], [[], [["FU", 1, [4, 5]], ["SP", 1, 4, 49, [3], 1], ["AN", 1, 5, 6], ["FU", 1, [0, 1, 2, 3]], ["AN", 1, 0, 5], ["PR", 1, 0, "auto_unroll_max_step$16"]]]], "r": [[7.9177e-05, 7.89754e-05, 7.90635e-05], 0, 10.2513, 1667976665], "v": "v0.6"}
{"i": [["[\"maxpool\", 1, 7, 7, 2048, 7, 7, 1]", "cuda -keys=cuda,gpu -max_num_threads=1024 -model=unknown -thread_warp_size=32", [-1, 16, 64, 49152, 2147483647, 1024, 8, 32], "", 0, []], [[], [["FU", 1, [0, 1, 2, 3]], ["SP", 1, 0, 100352, [4], 1], ["AN", 1, 0, 5], ["AN", 1, 1, 6], ["PR", 1, 0, "auto_unroll_max_step$1024"]]]], "r": [[2.47246e-05, 2.46799e-05, 2.48555e-05], 0, 7.10225, 1667976662], "v": "v0.6"}
{"i": [["[\"maxpool\", 1, 7, 7, 2048, 7, 7, 1]", "cuda -keys=cuda,gpu -max_num_threads=1024 -model=unknown -thread_warp_size=32", [-1, 16, 64, 49152, 2147483647, 1024, 8, 32], "", 0, []], [[], [["FU", 1, [4, 5]], ["SP", 1, 4, 49, [8], 1], ["AN", 1, 5, 6], ["FU", 1, [0, 1, 2, 3]], ["AN", 1, 0, 5], ["PR", 1, 0, "auto_unroll_max_step$16"]]]], "r": [[8.65686e-05, 8.65209e-05, 8.65937e-05], 0, 4.26385, 1667976659], "v": "v0.6"}
{"i": [["[\"maxpool\", 1, 7, 7, 2048, 7, 7, 1]", "cuda -keys=cuda,gpu -max_num_threads=1024 -model=unknown -thread_warp_size=32", [-1, 16, 64, 49152, 2147483647, 1024, 8, 32], "", 0, []], [[], [["FU", 1, [4, 5]], ["SP", 1, 4, 49, [24], 1], ["AN", 1, 5, 6], ["FU", 1, [0, 1, 2, 3]], ["AN", 1, 0, 5], ["PR", 1, 0, "auto_unroll_max_step$16"]]]], "r": [[8.95768e-05, 8.9795e-05, 8.97647e-05], 0, 12.3334, 1667976667], "v": "v0.6"}
{"i": [["[\"maxpool\", 1, 7, 7, 2048, 7, 7, 1]", "cuda -keys=cuda,gpu -max_num_threads=1024 -model=unknown -thread_warp_size=32", [-1, 16, 64, 49152, 2147483647, 1024, 8, 32], "", 0, []], [[], [["FU", 1, [4, 5]], ["SP", 1, 4, 49, [7], 1], ["AN", 1, 5, 6], ["FU", 1, [0, 1, 2, 3]], ["AN", 1, 0, 5], ["PR", 1, 0, "auto_unroll_max_step$16"]]]], "r": [[8.77651e-05, 8.78773e-05, 8.78534e-05], 0, 12.0936, 1667976667], "v": "v0.6"}
{"i": [["[\"maxpool\", 1, 7, 7, 2048, 7, 7, 1]", "cuda -keys=cuda,gpu -max_num_threads=1024 -model=unknown -thread_warp_size=32", [-1, 16, 64, 49152, 2147483647, 1024, 8, 32], "", 0, []], [[], [["FU", 1, [0, 1, 2, 3]], ["SP", 1, 0, 100352, [16], 1], ["AN", 1, 0, 5], ["AN", 1, 1, 6], ["PR", 1, 0, "auto_unroll_max_step$64"]]]], "r": [[8.45135e-06, 8.46942e-06, 8.46072e-06], 0, 10.8943, 1667976666], "v": "v0.6"}
{"i": [["[\"maxpool\", 1, 7, 7, 2048, 7, 7, 1]", "cuda -keys=cuda,gpu -max_num_threads=1024 -model=unknown -thread_warp_size=32", [-1, 16, 64, 49152, 2147483647, 1024, 8, 32], "", 0, []], [[], [["FU", 1, [0, 1, 2, 3]], ["SP", 1, 0, 100352, [8], 1], ["AN", 1, 0, 5], ["AN", 1, 1, 6], ["PR", 1, 0, "auto_unroll_max_step$64"]]]], "r": [[1.42343e-05, 1.42328e-05, 1.42424e-05], 0, 13.1786, 1667976668], "v": "v0.6"}
{"i": [["[\"maxpool\", 1, 7, 7, 2048, 7, 7, 1]", "cuda -keys=cuda,gpu -max_num_threads=1024 -model=unknown -thread_warp_size=32", [-1, 16, 64, 49152, 2147483647, 1024, 8, 32], "", 0, []], [[], [["FU", 1, [0, 1, 2, 3]], ["SP", 1, 0, 100352, [4], 1], ["AN", 1, 0, 5], ["AN", 1, 1, 6], ["PR", 1, 0, "auto_unroll_max_step$64"]]]], "r": [[2.4829e-05, 2.48767e-05, 2.48657e-05], 0, 10.0254, 1667976665], "v": "v0.6"}
{"i": [["[\"maxpool\", 1, 7, 7, 2048, 7, 7, 1]", "cuda -keys=cuda,gpu -max_num_threads=1024 -model=unknown -thread_warp_size=32", [-1, 16, 64, 49152, 2147483647, 1024, 8, 32], "", 0, []], [[], [["FU", 1, [0, 1, 2, 3]], ["SP", 1, 0, 100352, [7], 1], ["AN", 1, 0, 5], ["AN", 1, 1, 6], ["PR", 1, 0, "auto_unroll_max_step$0"]]]], "r": [[1.6844e-05, 1.68517e-05, 1.68524e-05], 0, 13.375, 1667976668], "v": "v0.6"}
{"i": [["[\"maxpool\", 1, 7, 7, 2048, 7, 7, 1]", "cuda -keys=cuda,gpu -max_num_threads=1024 -model=unknown -thread_warp_size=32", [-1, 16, 64, 49152, 2147483647, 1024, 8, 32], "", 0, []], [[], [["FU", 1, [4, 5]], ["SP", 1, 4, 49, [2], 1], ["AN", 1, 5, 6], ["FU", 1, [0, 1, 2, 3]], ["AN", 1, 0, 5], ["PR", 1, 0, "auto_unroll_max_step$64"]]]], "r": [[7.92742e-05, 7.93151e-05, 7.92883e-05], 0, 12.7222, 1667976668], "v": "v0.6"}
{"i": [["[\"maxpool\", 1, 7, 7, 2048, 7, 7, 1]", "cuda -keys=cuda,gpu -max_num_threads=1024 -model=unknown -thread_warp_size=32", [-1, 16, 64, 49152, 2147483647, 1024, 8, 32], "", 0, []], [[], [["FU", 1, [0, 1, 2, 3]], ["SP", 1, 0, 100352, [56], 1], ["AN", 1, 0, 5], ["AN", 1, 1, 6], ["PR", 1, 0, "auto_unroll_max_step$64"]]]], "r": [[7.83706e-06, 7.85722e-06, 7.83988e-06], 0, 8.8778, 1667976664], "v": "v0.6"}
{"i": [["[\"maxpool\", 1, 7, 7, 2048, 7, 7, 1]", "cuda -keys=cuda,gpu -max_num_threads=1024 -model=unknown -thread_warp_size=32", [-1, 16, 64, 49152, 2147483647, 1024, 8, 32], "", 0, []], [[], [["FU", 1, [4, 5]], ["SP", 1, 4, 49, [4], 1], ["AN", 1, 5, 6], ["FU", 1, [0, 1, 2, 3]], ["AN", 1, 0, 5], ["PR", 1, 0, "auto_unroll_max_step$16"]]]], "r": [[8.09416e-05, 8.07274e-05, 8.07561e-05], 0, 11.7289, 1667976667], "v": "v0.6"}
{"i": [["[\"maxpool\", 1, 7, 7, 2048, 7, 7, 1]", "cuda -keys=cuda,gpu -max_num_threads=1024 -model=unknown -thread_warp_size=32", [-1, 16, 64, 49152, 2147483647, 1024, 8, 32], "", 0, []], [[], [["FU", 1, [4, 5]], ["SP", 1, 4, 49, [16], 1], ["AN", 1, 5, 6], ["FU", 1, [0, 1, 2, 3]], ["AN", 1, 0, 5], ["PR", 1, 0, "auto_unroll_max_step$64"]]]], "r": [[8.85413e-05, 8.8541e-05, 8.84442e-05], 0, 1.77063, 1667976656], "v": "v0.6"}
{"i": [["[\"maxpool\", 1, 7, 7, 2048, 7, 7, 1]", "cuda -keys=cuda,gpu -max_num_threads=1024 -model=unknown -thread_warp_size=32", [-1, 16, 64, 49152, 2147483647, 1024, 8, 32], "", 0, []], [[], [["FU", 1, [0, 1, 2, 3]], ["SP", 1, 0, 100352, [49], 1], ["AN", 1, 0, 5], ["AN", 1, 1, 6], ["PR", 1, 0, "auto_unroll_max_step$16"]]]], "r": [[8.5835e-06, 8.58692e-06, 8.59166e-06], 0, 8.48985, 1667976663], "v": "v0.6"}
{"i": [["[\"maxpool\", 1, 7, 7, 2048, 7, 7, 1]", "cuda -keys=cuda,gpu -max_num_threads=1024 -model=unknown -thread_warp_size=32", [-1, 16, 64, 49152, 2147483647, 1024, 8, 32], "", 0, []], [[], [["FU", 1, [4, 5]], ["SP", 1, 4, 49, [3], 1], ["AN", 1, 5, 6], ["FU", 1, [0, 1, 2, 3]], ["AN", 1, 0, 5], ["PR", 1, 0, "auto_unroll_max_step$0"]]]], "r": [[7.92413e-05, 7.90597e-05, 7.92095e-05], 0, 13.875, 1667976669], "v": "v0.6"}
{"i": [["[\"maxpool\", 1, 7, 7, 2048, 7, 7, 1]", "cuda -keys=cuda,gpu -max_num_threads=1024 -model=unknown -thread_warp_size=32", [-1, 16, 64, 49152, 2147483647, 1024, 8, 32], "", 0, []], [[], [["FU", 1, [0, 1, 2, 3]], ["SP", 1, 0, 100352, [49], 1], ["AN", 1, 0, 5], ["AN", 1, 1, 6], ["PR", 1, 0, "auto_unroll_max_step$512"]]]], "r": [[8.59089e-06, 8.60689e-06, 8.60123e-06], 0, 13.7752, 1667976669], "v": "v0.6"}
{"i": [["[\"maxpool\", 1, 7, 7, 2048, 7, 7, 1]", "cuda -keys=cuda,gpu -max_num_threads=1024 -model=unknown -thread_warp_size=32", [-1, 16, 64, 49152, 2147483647, 1024, 8, 32], "", 0, []], [[], [["FU", 1, [0, 1, 2, 3]], ["SP", 1, 0, 100352, [14], 1], ["AN", 1, 0, 5], ["AN", 1, 1, 6], ["PR", 1, 0, "auto_unroll_max_step$512"]]]], "r": [[1.1348e-05, 1.13546e-05, 1.13395e-05], 0, 13.82, 1667976670], "v": "v0.6"}
{"i": [["[\"maxpool\", 1, 7, 7, 2048, 7, 7, 1]", "cuda -keys=cuda,gpu -max_num_threads=1024 -model=unknown -thread_warp_size=32", [-1, 16, 64, 49152, 2147483647, 1024, 8, 32], "", 0, []], [[], [["FU", 1, [4, 5]], ["SP", 1, 4, 49, [12], 1], ["AN", 1, 5, 6], ["FU", 1, [0, 1, 2, 3]], ["AN", 1, 0, 5], ["PR", 1, 0, "auto_unroll_max_step$0"]]]], "r": [[8.87643e-05, 8.8677e-05, 8.88963e-05], 0, 13.7742, 1667976670], "v": "v0.6"}
{"i": [["[\"maxpool\", 1, 7, 7, 2048, 7, 7, 1]", "cuda -keys=cuda,gpu -max_num_threads=1024 -model=unknown -thread_warp_size=32", [-1, 16, 64, 49152, 2147483647, 1024, 8, 32], "", 0, []], [[], [["FU", 1, [4, 5]], ["SP", 1, 4, 49, [12], 1], ["AN", 1, 5, 6], ["FU", 1, [0, 1, 2, 3]], ["AN", 1, 0, 5], ["PR", 1, 0, "auto_unroll_max_step$64"]]]], "r": [[8.88264e-05, 8.85823e-05, 8.87091e-05], 0, 13.8233, 1667976670], "v": "v0.6"}
{"i": [["[\"maxpool\", 1, 7, 7, 2048, 7, 7, 1]", "cuda -keys=cuda,gpu -max_num_threads=1024 -model=unknown -thread_warp_size=32", [-1, 16, 64, 49152, 2147483647, 1024, 8, 32], "", 0, []], [[], [["FU", 1, [4, 5]], ["SP", 1, 4, 49, [24], 1], ["AN", 1, 5, 6], ["FU", 1, [0, 1, 2, 3]], ["AN", 1, 0, 5], ["PR", 1, 0, "auto_unroll_max_step$512"]]]], "r": [[8.97362e-05, 8.9687e-05, 8.96434e-05], 0, 13.7649, 1667976671], "v": "v0.6"}
{"i": [["[\"maxpool\", 1, 7, 7, 2048, 7, 7, 1]", "cuda -keys=cuda,gpu -max_num_threads=1024 -model=unknown -thread_warp_size=32", [-1, 16, 64, 49152, 2147483647, 1024, 8, 32], "", 0, []], [[], [["FU", 1, [0, 1, 2, 3]], ["SP", 1, 0, 100352, [7], 1], ["AN", 1, 0, 5], ["AN", 1, 1, 6], ["PR", 1, 0, "auto_unroll_max_step$16"]]]], "r": [[1.69047e-05, 1.69288e-05, 1.6938e-05], 0, 13.8506, 1667976671], "v": "v0.6"}
{"i": [["[\"maxpool\", 1, 7, 7, 2048, 7, 7, 1]", "cuda -keys=cuda,gpu -max_num_threads=1024 -model=unknown -thread_warp_size=32", [-1, 16, 64, 49152, 2147483647, 1024, 8, 32], "", 0, []], [[], [["FU", 1, [4, 5]], ["SP", 1, 4, 49, [3], 1], ["AN", 1, 5, 6], ["FU", 1, [0, 1, 2, 3]], ["AN", 1, 0, 5], ["PR", 1, 0, "auto_unroll_max_step$64"]]]], "r": [[7.9235e-05, 7.90944e-05, 7.90467e-05], 0, 13.7701, 1667976671], "v": "v0.6"}
{"i": [["[\"maxpool\", 1, 7, 7, 2048, 7, 7, 1]", "cuda -keys=cuda,gpu -max_num_threads=1024 -model=unknown -thread_warp_size=32", [-1, 16, 64, 49152, 2147483647, 1024, 8, 32], "", 0, []], [[], [["FU", 1, [0, 1, 2, 3]], ["SP", 1, 0, 100352, [28], 1], ["AN", 1, 0, 5], ["AN", 1, 1, 6], ["PR", 1, 0, "auto_unroll_max_step$512"]]]], "r": [[7.81654e-06, 7.81108e-06, 7.82703e-06], 0, 13.8941, 1667976672], "v": "v0.6"}
{"i": [["[\"maxpool\", 1, 7, 7, 2048, 7, 7, 1]", "cuda -keys=cuda,gpu -max_num_threads=1024 -model=unknown -thread_warp_size=32", [-1, 16, 64, 49152, 2147483647, 1024, 8, 32], "", 0, []], [[], [["FU", 1, [0, 1, 2, 3]], ["SP", 1, 0, 100352, [1], 1], ["AN", 1, 0, 5], ["AN", 1, 1, 6], ["PR", 1, 0, "auto_unroll_max_step$512"]]]], "r": [[7.92517e-05, 7.91744e-05, 7.9294e-05], 0, 13.8318, 1667976672], "v": "v0.6"}
{"i": [["[\"maxpool\", 1, 7, 7, 2048, 7, 7, 1]", "cuda -keys=cuda,gpu -max_num_threads=1024 -model=unknown -thread_warp_size=32", [-1, 16, 64, 49152, 2147483647, 1024, 8, 32], "", 0, []], [[], [["FU", 1, [0, 1, 2, 3]], ["SP", 1, 0, 100352, [8], 1], ["AN", 1, 0, 5], ["AN", 1, 1, 6], ["PR", 1, 0, "auto_unroll_max_step$16"]]]], "r": [[1.42499e-05, 1.42625e-05, 1.42401e-05], 0, 13.7516, 1667976672], "v": "v0.6"}
{"i": [["[\"maxpool\", 1, 7, 7, 2048, 7, 7, 1]", "cuda -keys=cuda,gpu -max_num_threads=1024 -model=unknown -thread_warp_size=32", [-1, 16, 64, 49152, 2147483647, 1024, 8, 32], "", 0, []], [[], [["FU", 1, [4, 5]], ["SP", 1, 4, 49, [3], 1], ["AN", 1, 5, 6], ["FU", 1, [0, 1, 2, 3]], ["AN", 1, 0, 5], ["PR", 1, 0, "auto_unroll_max_step$1024"]]]], "r": [[7.89605e-05, 7.90738e-05, 7.91304e-05], 0, 13.8429, 1667976673], "v": "v0.6"}
{"i": [["[\"maxpool\", 1, 7, 7, 2048, 7, 7, 1]", "cuda -keys=cuda,gpu -max_num_threads=1024 -model=unknown -thread_warp_size=32", [-1, 16, 64, 49152, 2147483647, 1024, 8, 32], "", 0, []], [[], [["FU", 1, [4, 5]], ["SP", 1, 4, 49, [2], 1], ["AN", 1, 5, 6], ["FU", 1, [0, 1, 2, 3]], ["AN", 1, 0, 5], ["PR", 1, 0, "auto_unroll_max_step$0"]]]], "r": [[7.92184e-05, 7.92985e-05, 7.92119e-05], 0, 13.7055, 1667976673], "v": "v0.6"}
{"i": [["[\"maxpool\", 1, 7, 7, 2048, 7, 7, 1]", "cuda -keys=cuda,gpu -max_num_threads=1024 -model=unknown -thread_warp_size=32", [-1, 16, 64, 49152, 2147483647, 1024, 8, 32], "", 0, []], [[], [["FU", 1, [4, 5]], ["SP", 1, 4, 49, [2], 1], ["AN", 1, 5, 6], ["FU", 1, [0, 1, 2, 3]], ["AN", 1, 0, 5], ["PR", 1, 0, "auto_unroll_max_step$16"]]]], "r": [[7.93024e-05, 7.92072e-05, 7.91914e-05], 0, 13.7655, 1667976673], "v": "v0.6"}
{"i": [["[\"maxpool\", 1, 7, 7, 2048, 7, 7, 1]", "cuda -keys=cuda,gpu -max_num_threads=1024 -model=unknown -thread_warp_size=32", [-1, 16, 64, 49152, 2147483647, 1024, 8, 32], "", 0, []], [[], [["FU", 1, [0, 1, 2, 3]], ["SP", 1, 0, 100352, [7], 1], ["AN", 1, 0, 5], ["AN", 1, 1, 6], ["PR", 1, 0, "auto_unroll_max_step$1024"]]]], "r": [[1.68433e-05, 1.68839e-05, 1.68637e-05], 0, 13.8384, 1667976674], "v": "v0.6"}
{"i": [["[\"maxpool\", 1, 7, 7, 2048, 7, 7, 1]", "cuda -keys=cuda,gpu -max_num_threads=1024 -model=unknown -thread_warp_size=32", [-1, 16, 64, 49152, 2147483647, 1024, 8, 32], "", 0, []], [[], [["FU", 1, [4, 5]], ["SP", 1, 4, 49, [6], 1], ["AN", 1, 5, 6], ["FU", 1, [0, 1, 2, 3]], ["AN", 1, 0, 5], ["PR", 1, 0, "auto_unroll_max_step$512"]]]], "r": [[8.72733e-05, 8.72855e-05, 8.71383e-05], 0, 13.7532, 1667976674], "v": "v0.6"}
{"i": [["[\"maxpool\", 1, 7, 7, 2048, 7, 7, 1]", "cuda -keys=cuda,gpu -max_num_threads=1024 -model=unknown -thread_warp_size=32", [-1, 16, 64, 49152, 2147483647, 1024, 8, 32], "", 0, []], [[], [["FU", 1, [4, 5]], ["SP", 1, 4, 49, [16], 1], ["AN", 1, 5, 6], ["FU", 1, [0, 1, 2, 3]], ["AN", 1, 0, 5], ["PR", 1, 0, "auto_unroll_max_step$16"]]]], "r": [[8.8324e-05, 8.83959e-05, 8.8169e-05], 0, 13.7111, 1667976674], "v": "v0.6"}
{"i": [["[\"maxpool\", 1, 7, 7, 2048, 7, 7, 1]", "cuda -keys=cuda,gpu -max_num_threads=1024 -model=unknown -thread_warp_size=32", [-1, 16, 64, 49152, 2147483647, 1024, 8, 32], "", 0, []], [[], [["FU", 1, [0, 1, 2, 3]], ["SP", 1, 0, 100352, [56], 1], ["AN", 1, 0, 5], ["AN", 1, 1, 6], ["PR", 1, 0, "auto_unroll_max_step$512"]]]], "r": [[7.75549e-06, 7.76539e-06, 7.76011e-06], 0, 13.7355, 1667976675], "v": "v0.6"}
{"i": [["[\"maxpool\", 1, 7, 7, 2048, 7, 7, 1]", "cuda -keys=cuda,gpu -max_num_threads=1024 -model=unknown -thread_warp_size=32", [-1, 16, 64, 49152, 2147483647, 1024, 8, 32], "", 0, []], [[], [["FU", 1, [4, 5]], ["SP", 1, 4, 49, [6], 1], ["AN", 1, 5, 6], ["FU", 1, [0, 1, 2, 3]], ["AN", 1, 0, 5], ["PR", 1, 0, "auto_unroll_max_step$64"]]]], "r": [[8.74527e-05, 8.72066e-05, 8.73254e-05], 0, 13.695, 1667976675], "v": "v0.6"}
