python/models/resnext/ResNextHorizontal_kernel_configs/resnext_imagenet_50_hfused_conv1x1_stride_1_56_56_256_8_64_s2.log
{"i": [["[\"hfused_conv1x1_stride\", 1, 56, 56, 256, 8, 64, 2]", "cuda -keys=cuda,gpu -max_num_threads=1024 -model=unknown -thread_warp_size=32", [-1, 16, 64, 49152, 2147483647, 1024, 8, 32], "", 0, []], [[], [["CHW", 2, "local"], ["SP", 2, 0, 1, [1, 1, 1, 1], 1], ["SP", 2, 5, 64, [1, 1, 1, 16], 1], ["SP", 2, 10, 28, [2, 1, 1, 1], 1], ["SP", 2, 15, 28, [1, 7, 1, 1], 1], ["SP", 2, 20, 8, [1, 2, 4, 1], 1], ["SP", 2, 25, 256, [4, 4], 1], ["RE", 2, [0, 5, 10, 15, 20, 1, 6, 11, 16, 21, 2, 7, 12, 17, 22, 25, 26, 3, 8, 13, 18, 23, 27, 4, 9, 14, 19, 24]], ["FSP", 3, 0, 1, 3], ["FSP", 3, 4, 2, 3], ["FSP", 3, 8, 3, 3], ["FSP", 3, 12, 4, 3], ["FSP", 3, 16, 5, 3], ["RE", 3, [0, 4, 8, 12, 16, 1, 5, 9, 13, 17, 2, 6, 10, 14, 18, 3, 7, 11, 15, 19]], ["CA", 2, 3, 14], ["CHR", 1, "shared", [2]], ["CA", 2, 3, 15], ["CHR", 0, "shared", [3]], ["CA", 1, 4, 15], ["FU", 5, [0, 1, 2, 3, 4]], ["AN", 5, 0, 5], ["FU", 5, [1, 2, 3, 4, 5]], ["AN", 5, 1, 4], ["FU", 5, [2, 3, 4, 5, 6]], ["AN", 5, 2, 6], ["FU", 3, [0, 1, 2]], ["SP", 3, 0, 128, [1], 1], ["AN", 3, 1, 2], ["FFSP", 3, 0, [5, 4, 3, 2, 1], 1, 1], ["AN", 3, 1, 6], ["FU", 1, [0, 1, 2, 3]], ["SP", 1, 0, 16, [1], 1], ["AN", 1, 1, 2], ["FFSP", 1, 0, [5, 4, 3, 2, 1], 1, 1], ["AN", 1, 1, 6], ["PR", 4, 0, "auto_unroll_max_step$16"]]]], "r": [[0.000400647, 0.000400715, 0.000400645], 0, 2.16205, 1667896815], "v": "v0.6"}
{"i": [["[\"hfused_conv1x1_stride\", 1, 56, 56, 256, 8, 64, 2]", "cuda -keys=cuda,gpu -max_num_threads=1024 -model=unknown -thread_warp_size=32", [-1, 16, 64, 49152, 2147483647, 1024, 8, 32], "", 0, []], [[], [["CHW", 2, "local"], ["SP", 2, 0, 1, [1, 1, 1, 1], 1], ["SP", 2, 5, 64, [2, 8, 1, 1], 1], ["SP", 2, 10, 28, [2, 1, 7, 2], 1], ["SP", 2, 15, 28, [1, 4, 7, 1], 1], ["SP", 2, 20, 8, [1, 8, 1, 1], 1], ["SP", 2, 25, 256, [1, 1], 1], ["RE", 2, [0, 5, 10, 15, 20, 1, 6, 11, 16, 21, 2, 7, 12, 17, 22, 25, 26, 3, 8, 13, 18, 23, 27, 4, 9, 14, 19, 24]], ["FSP", 3, 0, 1, 3], ["FSP", 3, 4, 2, 3], ["FSP", 3, 8, 3, 3], ["FSP", 3, 12, 4, 3], ["FSP", 3, 16, 5, 3], ["RE", 3, [0, 4, 8, 12, 16, 1, 5, 9, 13, 17, 2, 6, 10, 14, 18, 3, 7, 11, 15, 19]], ["CA", 2, 3, 14], ["CHR", 1, "shared", [2]], ["CA", 2, 3, 15], ["CHR", 0, "shared", [3]], ["CA", 1, 4, 15], ["FU", 5, [0, 1, 2, 3, 4]], ["AN", 5, 0, 5], ["FU", 5, [1, 2, 3, 4, 5]], ["AN", 5, 1, 4], ["FU", 5, [2, 3, 4, 5, 6]], ["AN", 5, 2, 6], ["FU", 3, [0, 1, 2]], ["SP", 3, 0, 4, [1], 1], ["AN", 3, 1, 2], ["FFSP", 3, 0, [5, 4, 3, 2, 1], 1, 1], ["AN", 3, 1, 6], ["FU", 1, [0, 1, 2, 3]], ["SP", 1, 0, 351, [27], 1], ["AN", 1, 1, 2], ["FFSP", 1, 0, [5, 4, 3, 2, 1], 1, 1], ["AN", 1, 1, 6], ["PR", 4, 0, "auto_unroll_max_step$0"]]]], "r": [[0.00407525, 0.00407493, 0.00407627], 0, 4.31147, 1667896817], "v": "v0.6"}
{"i": [["[\"hfused_conv1x1_stride\", 1, 56, 56, 256, 8, 64, 2]", "cuda -keys=cuda,gpu -max_num_threads=1024 -model=unknown -thread_warp_size=32", [-1, 16, 64, 49152, 2147483647, 1024, 8, 32], "", 0, []], [[], [["CHW", 2, "local"], ["SP", 2, 0, 1, [1, 1, 1, 1], 1], ["SP", 2, 5, 64, [1, 64, 1, 1], 1], ["SP", 2, 10, 28, [2, 7, 2, 1], 1], ["SP", 2, 15, 28, [1, 1, 1, 4], 1], ["SP", 2, 20, 8, [4, 1, 1, 2], 1], ["SP", 2, 25, 256, [2, 4], 1], ["RE", 2, [0, 5, 10, 15, 20, 1, 6, 11, 16, 21, 2, 7, 12, 17, 22, 25, 26, 3, 8, 13, 18, 23, 27, 4, 9, 14, 19, 24]], ["FSP", 3, 0, 1, 3], ["FSP", 3, 4, 2, 3], ["FSP", 3, 8, 3, 3], ["FSP", 3, 12, 4, 3], ["FSP", 3, 16, 5, 3], ["RE", 3, [0, 4, 8, 12, 16, 1, 5, 9, 13, 17, 2, 6, 10, 14, 18, 3, 7, 11, 15, 19]], ["CA", 2, 3, 14], ["CHR", 1, "shared", [2]], ["CA", 2, 3, 15], ["CHR", 0, "shared", [3]], ["CA", 1, 4, 15], ["FU", 5, [0, 1, 2, 3, 4]], ["AN", 5, 0, 5], ["FU", 5, [1, 2, 3, 4, 5]], ["AN", 5, 1, 4], ["FU", 5, [2, 3, 4, 5, 6]], ["AN", 5, 2, 6], ["FU", 3, [0, 1, 2]], ["SP", 3, 0, 16, [8], 1], ["AN", 3, 1, 2], ["FFSP", 3, 0, [5, 4, 3, 2, 1], 1, 1], ["AN", 3, 1, 6], ["FU", 1, [0, 1, 2, 3]], ["SP", 1, 0, 168, [1], 1], ["AN", 1, 1, 2], ["FFSP", 1, 0, [5, 4, 3, 2, 1], 1, 1], ["AN", 1, 1, 6], ["PR", 4, 0, "auto_unroll_max_step$16"]]]], "r": [[0.000609127, 0.000609272, 0.000609115], 0, 1.04575, 1667896814], "v": "v0.6"}
{"i": [["[\"hfused_conv1x1_stride\", 1, 56, 56, 256, 8, 64, 2]", "cuda -keys=cuda,gpu -max_num_threads=1024 -model=unknown -thread_warp_size=32", [-1, 16, 64, 49152, 2147483647, 1024, 8, 32], "", 0, []], [[], [["CHW", 2, "local"], ["SP", 2, 0, 1, [1, 1, 1, 1], 1], ["SP", 2, 5, 64, [1, 8, 2, 4], 1], ["SP", 2, 10, 28, [1, 14, 1, 1], 1], ["SP", 2, 15, 28, [7, 1, 2, 1], 1], ["SP", 2, 20, 8, [1, 1, 1, 1], 1], ["SP", 2, 25, 256, [8, 1], 1], ["RE", 2, [0, 5, 10, 15, 20, 1, 6, 11, 16, 21, 2, 7, 12, 17, 22, 25, 26, 3, 8, 13, 18, 23, 27, 4, 9, 14, 19, 24]], ["FSP", 3, 0, 1, 3], ["FSP", 3, 4, 2, 3], ["FSP", 3, 8, 3, 3], ["FSP", 3, 12, 4, 3], ["FSP", 3, 16, 5, 3], ["RE", 3, [0, 4, 8, 12, 16, 1, 5, 9, 13, 17, 2, 6, 10, 14, 18, 3, 7, 11, 15, 19]], ["CA", 2, 3, 14], ["CHR", 1, "shared", [2]], ["CA", 2, 3, 15], ["CHR", 0, "shared", [3]], ["CA", 1, 4, 15], ["FU", 5, [0, 1, 2, 3, 4]], ["AN", 5, 0, 5], ["FU", 5, [1, 2, 3, 4, 5]], ["AN", 5, 1, 4], ["FU", 5, [2, 3, 4, 5, 6]], ["AN", 5, 2, 6], ["FU", 3, [0, 1, 2]], ["SP", 3, 0, 32, [1], 1], ["AN", 3, 1, 2], ["FFSP", 3, 0, [5, 4, 3, 2, 1], 1, 1], ["AN", 3, 1, 6], ["FU", 1, [0, 1, 2, 3]], ["SP", 1, 0, 24, [1], 1], ["AN", 1, 1, 2], ["FFSP", 1, 0, [5, 4, 3, 2, 1], 1, 1], ["AN", 1, 1, 6], ["PR", 4, 0, "auto_unroll_max_step$512"]]]], "r": [[0.000151768, 0.000151846, 0.000151773], 0, 1.8221, 1667896815], "v": "v0.6"}
{"i": [["[\"hfused_conv1x1_stride\", 1, 56, 56, 256, 8, 64, 2]", "cuda -keys=cuda,gpu -max_num_threads=1024 -model=unknown -thread_warp_size=32", [-1, 16, 64, 49152, 2147483647, 1024, 8, 32], "", 0, []], [[], [["CHW", 2, "local"], ["SP", 2, 0, 1, [1, 1, 1, 1], 1], ["SP", 2, 5, 64, [1, 4, 4, 4], 1], ["SP", 2, 10, 28, [1, 4, 1, 1], 1], ["SP", 2, 15, 28, [1, 14, 1, 1], 1], ["SP", 2, 20, 8, [1, 1, 1, 8], 1], ["SP", 2, 25, 256, [8, 2], 1], ["RE", 2, [0, 5, 10, 15, 20, 1, 6, 11, 16, 21, 2, 7, 12, 17, 22, 25, 26, 3, 8, 13, 18, 23, 27, 4, 9, 14, 19, 24]], ["FSP", 3, 0, 1, 3], ["FSP", 3, 4, 2, 3], ["FSP", 3, 8, 3, 3], ["FSP", 3, 12, 4, 3], ["FSP", 3, 16, 5, 3], ["RE", 3, [0, 4, 8, 12, 16, 1, 5, 9, 13, 17, 2, 6, 10, 14, 18, 3, 7, 11, 15, 19]], ["CA", 2, 3, 14], ["CHR", 1, "shared", [2]], ["CA", 2, 3, 15], ["CHR", 0, "shared", [3]], ["CA", 1, 4, 15], ["FU", 5, [0, 1, 2, 3, 4]], ["AN", 5, 0, 5], ["FU", 5, [1, 2, 3, 4, 5]], ["AN", 5, 1, 4], ["FU", 5, [2, 3, 4, 5, 6]], ["AN", 5, 2, 6], ["FU", 3, [0, 1, 2]], ["SP", 3, 0, 1024, [1], 1], ["AN", 3, 1, 2], ["FFSP", 3, 0, [5, 4, 3, 2, 1], 1, 1], ["AN", 3, 1, 6], ["FU", 1, [0, 1, 2, 3]], ["SP", 1, 0, 16, [1], 1], ["AN", 1, 1, 2], ["FFSP", 1, 0, [5, 4, 3, 2, 1], 1, 1], ["AN", 1, 1, 6], ["PR", 4, 0, "auto_unroll_max_step$0"]]]], "r": [[0.000296843, 0.000296802, 0.000296837], 0, 1.49661, 1667896814], "v": "v0.6"}
{"i": [["[\"hfused_conv1x1_stride\", 1, 56, 56, 256, 8, 64, 2]", "cuda -keys=cuda,gpu -max_num_threads=1024 -model=unknown -thread_warp_size=32", [-1, 16, 64, 49152, 2147483647, 1024, 8, 32], "", 0, []], [[], [["CHW", 2, "local"], ["SP", 2, 0, 1, [1, 1, 1, 1], 1], ["SP", 2, 5, 64, [1, 16, 1, 1], 1], ["SP", 2, 10, 28, [1, 1, 1, 7], 1], ["SP", 2, 15, 28, [1, 14, 2, 1], 1], ["SP", 2, 20, 8, [1, 2, 1, 2], 1], ["SP", 2, 25, 256, [1, 8], 1], ["RE", 2, [0, 5, 10, 15, 20, 1, 6, 11, 16, 21, 2, 7, 12, 17, 22, 25, 26, 3, 8, 13, 18, 23, 27, 4, 9, 14, 19, 24]], ["FSP", 3, 0, 1, 3], ["FSP", 3, 4, 2, 3], ["FSP", 3, 8, 3, 3], ["FSP", 3, 12, 4, 3], ["FSP", 3, 16, 5, 3], ["RE", 3, [0, 4, 8, 12, 16, 1, 5, 9, 13, 17, 2, 6, 10, 14, 18, 3, 7, 11, 15, 19]], ["CA", 2, 3, 14], ["CHR", 1, "shared", [2]], ["CA", 2, 3, 15], ["CHR", 0, "shared", [3]], ["CA", 1, 4, 15], ["FU", 5, [0, 1, 2, 3, 4]], ["AN", 5, 0, 5], ["FU", 5, [1, 2, 3, 4, 5]], ["AN", 5, 1, 4], ["FU", 5, [2, 3, 4, 5, 6]], ["AN", 5, 2, 6], ["FU", 3, [0, 1, 2]], ["SP", 3, 0, 16, [1], 1], ["AN", 3, 1, 2], ["FFSP", 3, 0, [5, 4, 3, 2, 1], 1, 1], ["AN", 3, 1, 6], ["FU", 1, [0, 1, 2, 3]], ["SP", 1, 0, 312, [1], 1], ["AN", 1, 1, 2], ["FFSP", 1, 0, [5, 4, 3, 2, 1], 1, 1], ["AN", 1, 1, 6], ["PR", 4, 0, "auto_unroll_max_step$0"]]]], "r": [[0.000194932, 0.000194802, 0.000194925], 0, 5.95815, 1667896819], "v": "v0.6"}
{"i": [["[\"hfused_conv1x1_stride\", 1, 56, 56, 256, 8, 64, 2]", "cuda -keys=cuda,gpu -max_num_threads=1024 -model=unknown -thread_warp_size=32", [-1, 16, 64, 49152, 2147483647, 1024, 8, 32], "", 0, []], [[], [["CHW", 2, "local"], ["SP", 2, 0, 1, [1, 1, 1, 1], 1], ["SP", 2, 5, 64, [1, 8, 1, 1], 1], ["SP", 2, 10, 28, [1, 4, 7, 1], 1], ["SP", 2, 15, 28, [1, 7, 1, 4], 1], ["SP", 2, 20, 8, [2, 1, 4, 1], 1], ["SP", 2, 25, 256, [1, 1], 1], ["RE", 2, [0, 5, 10, 15, 20, 1, 6, 11, 16, 21, 2, 7, 12, 17, 22, 25, 26, 3, 8, 13, 18, 23, 27, 4, 9, 14, 19, 24]], ["FSP", 3, 0, 1, 3], ["FSP", 3, 4, 2, 3], ["FSP", 3, 8, 3, 3], ["FSP", 3, 12, 4, 3], ["FSP", 3, 16, 5, 3], ["RE", 3, [0, 4, 8, 12, 16, 1, 5, 9, 13, 17, 2, 6, 10, 14, 18, 3, 7, 11, 15, 19]], ["CA", 2, 3, 14], ["CHR", 1, "shared", [2]], ["CA", 2, 3, 15], ["CHR", 0, "shared", [3]], ["CA", 1, 4, 15], ["FU", 5, [0, 1, 2, 3, 4]], ["AN", 5, 0, 5], ["FU", 5, [1, 2, 3, 4, 5]], ["AN", 5, 1, 4], ["FU", 5, [2, 3, 4, 5, 6]], ["AN", 5, 2, 6], ["FU", 3, [0, 1, 2]], ["SP", 3, 0, 4, [1], 1], ["AN", 3, 1, 2], ["FFSP", 3, 0, [5, 4, 3, 2, 1], 1, 1], ["AN", 3, 1, 6], ["FU", 1, [0, 1, 2, 3]], ["SP", 1, 0, 91, [1], 1], ["AN", 1, 1, 2], ["FFSP", 1, 0, [5, 4, 3, 2, 1], 1, 1], ["AN", 1, 1, 6], ["PR", 4, 0, "auto_unroll_max_step$16"]]]], "r": [[0.000960196, 0.000960674, 0.000960429], 0, 4.69586, 1667896818], "v": "v0.6"}
{"i": [["[\"hfused_conv1x1_stride\", 1, 56, 56, 256, 8, 64, 2]", "cuda -keys=cuda,gpu -max_num_threads=1024 -model=unknown -thread_warp_size=32", [-1, 16, 64, 49152, 2147483647, 1024, 8, 32], "", 0, []], [[], [["CHW", 2, "local"], ["SP", 2, 0, 1, [1, 1, 1, 1], 1], ["SP", 2, 5, 64, [1, 4, 1, 4], 1], ["SP", 2, 10, 28, [1, 1, 1, 7], 1], ["SP", 2, 15, 28, [1, 14, 2, 1], 1], ["SP", 2, 20, 8, [1, 1, 2, 2], 1], ["SP", 2, 25, 256, [1, 8], 1], ["RE", 2, [0, 5, 10, 15, 20, 1, 6, 11, 16, 21, 2, 7, 12, 17, 22, 25, 26, 3, 8, 13, 18, 23, 27, 4, 9, 14, 19, 24]], ["FSP", 3, 0, 1, 3], ["FSP", 3, 4, 2, 3], ["FSP", 3, 8, 3, 3], ["FSP", 3, 12, 4, 3], ["FSP", 3, 16, 5, 3], ["RE", 3, [0, 4, 8, 12, 16, 1, 5, 9, 13, 17, 2, 6, 10, 14, 18, 3, 7, 11, 15, 19]], ["CA", 2, 3, 14], ["CHR", 1, "shared", [2]], ["CA", 2, 3, 15], ["CHR", 0, "shared", [3]], ["CA", 1, 4, 15], ["FU", 5, [0, 1, 2, 3, 4]], ["AN", 5, 0, 5], ["FU", 5, [1, 2, 3, 4, 5]], ["AN", 5, 1, 4], ["FU", 5, [2, 3, 4, 5, 6]], ["AN", 5, 2, 6], ["FU", 3, [0, 1, 2]], ["SP", 3, 0, 16, [1], 1], ["AN", 3, 1, 2], ["FFSP", 3, 0, [5, 4, 3, 2, 1], 1, 1], ["AN", 3, 1, 6], ["FU", 1, [0, 1, 2, 3]], ["SP", 1, 0, 312, [1], 1], ["AN", 1, 1, 2], ["FFSP", 1, 0, [5, 4, 3, 2, 1], 1, 1], ["AN", 1, 1, 6], ["PR", 4, 0, "auto_unroll_max_step$0"]]]], "r": [[0.000686725, 0.000686801, 0.000686836], 0, 3.02876, 1667896816], "v": "v0.6"}
{"i": [["[\"hfused_conv1x1_stride\", 1, 56, 56, 256, 8, 64, 2]", "cuda -keys=cuda,gpu -max_num_threads=1024 -model=unknown -thread_warp_size=32", [-1, 16, 64, 49152, 2147483647, 1024, 8, 32], "", 0, []], [[], [["CHW", 2, "local"], ["SP", 2, 0, 1, [1, 1, 1, 1], 1], ["SP", 2, 5, 64, [2, 4, 1, 4], 1], ["SP", 2, 10, 28, [1, 2, 7, 1], 1], ["SP", 2, 15, 28, [1, 14, 1, 1], 1], ["SP", 2, 20, 8, [1, 2, 1, 1], 1], ["SP", 2, 25, 256, [1, 8], 1], ["RE", 2, [0, 5, 10, 15, 20, 1, 6, 11, 16, 21, 2, 7, 12, 17, 22, 25, 26, 3, 8, 13, 18, 23, 27, 4, 9, 14, 19, 24]], ["FSP", 3, 0, 1, 3], ["FSP", 3, 4, 2, 3], ["FSP", 3, 8, 3, 3], ["FSP", 3, 12, 4, 3], ["FSP", 3, 16, 5, 3], ["RE", 3, [0, 4, 8, 12, 16, 1, 5, 9, 13, 17, 2, 6, 10, 14, 18, 3, 7, 11, 15, 19]], ["CA", 2, 3, 14], ["CHR", 1, "shared", [2]], ["CA", 2, 3, 15], ["CHR", 0, "shared", [3]], ["CA", 1, 4, 15], ["FU", 5, [0, 1, 2, 3, 4]], ["AN", 5, 0, 5], ["FU", 5, [1, 2, 3, 4, 5]], ["AN", 5, 1, 4], ["FU", 5, [2, 3, 4, 5, 6]], ["AN", 5, 2, 6], ["FU", 3, [0, 1, 2]], ["SP", 3, 0, 32, [1], 1], ["AN", 3, 1, 2], ["FFSP", 3, 0, [5, 4, 3, 2, 1], 1, 1], ["AN", 3, 1, 6], ["FU", 1, [0, 1, 2, 3]], ["SP", 1, 0, 104, [8], 1], ["AN", 1, 1, 2], ["FFSP", 1, 0, [5, 4, 3, 2, 1], 1, 1], ["AN", 1, 1, 6], ["PR", 4, 0, "auto_unroll_max_step$0"]]]], "r": [[0.000273964, 0.000273585, 0.000273464], 0, 2.51462, 1667896815], "v": "v0.6"}
{"i": [["[\"hfused_conv1x1_stride\", 1, 56, 56, 256, 8, 64, 2]", "cuda -keys=cuda,gpu -max_num_threads=1024 -model=unknown -thread_warp_size=32", [-1, 16, 64, 49152, 2147483647, 1024, 8, 32], "", 0, []], [[], [["CHW", 2, "local"], ["SP", 2, 0, 1, [1, 1, 1, 1], 1], ["SP", 2, 5, 64, [1, 8, 1, 2], 1], ["SP", 2, 10, 28, [2, 1, 1, 1], 1], ["SP", 2, 15, 28, [1, 1, 1, 28], 1], ["SP", 2, 20, 8, [1, 2, 4, 1], 1], ["SP", 2, 25, 256, [4, 4], 1], ["RE", 2, [0, 5, 10, 15, 20, 1, 6, 11, 16, 21, 2, 7, 12, 17, 22, 25, 26, 3, 8, 13, 18, 23, 27, 4, 9, 14, 19, 24]], ["FSP", 3, 0, 1, 3], ["FSP", 3, 4, 2, 3], ["FSP", 3, 8, 3, 3], ["FSP", 3, 12, 4, 3], ["FSP", 3, 16, 5, 3], ["RE", 3, [0, 4, 8, 12, 16, 1, 5, 9, 13, 17, 2, 6, 10, 14, 18, 3, 7, 11, 15, 19]], ["CA", 2, 3, 14], ["CHR", 1, "shared", [2]], ["CA", 2, 3, 15], ["CHR", 0, "shared", [3]], ["CA", 1, 4, 15], ["FU", 5, [0, 1, 2, 3, 4]], ["AN", 5, 0, 5], ["FU", 5, [1, 2, 3, 4, 5]], ["AN", 5, 1, 4], ["FU", 5, [2, 3, 4, 5, 6]], ["AN", 5, 2, 6], ["FU", 3, [0, 1, 2]], ["SP", 3, 0, 128, [1], 1], ["AN", 3, 1, 2], ["FFSP", 3, 0, [5, 4, 3, 2, 1], 1, 1], ["AN", 3, 1, 6], ["FU", 1, [0, 1, 2, 3]], ["SP", 1, 0, 16, [1], 1], ["AN", 1, 1, 2], ["FFSP", 1, 0, [5, 4, 3, 2, 1], 1, 1], ["AN", 1, 1, 6], ["PR", 4, 0, "auto_unroll_max_step$0"]]]], "r": [[0.000498569, 0.00049809, 0.000497937], 0, 4.33783, 1667896817], "v": "v0.6"}
{"i": [["[\"hfused_conv1x1_stride\", 1, 56, 56, 256, 8, 64, 2]", "cuda -keys=cuda,gpu -max_num_threads=1024 -model=unknown -thread_warp_size=32", [-1, 16, 64, 49152, 2147483647, 1024, 8, 32], "", 0, []], [[], [["CHW", 2, "local"], ["SP", 2, 0, 1, [1, 1, 1, 1], 1], ["SP", 2, 5, 64, [1, 8, 1, 2], 1], ["SP", 2, 10, 28, [2, 2, 1, 1], 1], ["SP", 2, 15, 28, [2, 7, 1, 1], 1], ["SP", 2, 20, 8, [1, 2, 4, 1], 1], ["SP", 2, 25, 256, [4, 4], 1], ["RE", 2, [0, 5, 10, 15, 20, 1, 6, 11, 16, 21, 2, 7, 12, 17, 22, 25, 26, 3, 8, 13, 18, 23, 27, 4, 9, 14, 19, 24]], ["FSP", 3, 0, 1, 3], ["FSP", 3, 4, 2, 3], ["FSP", 3, 8, 3, 3], ["FSP", 3, 12, 4, 3], ["FSP", 3, 16, 5, 3], ["RE", 3, [0, 4, 8, 12, 16, 1, 5, 9, 13, 17, 2, 6, 10, 14, 18, 3, 7, 11, 15, 19]], ["CA", 2, 3, 14], ["CHR", 1, "shared", [2]], ["CA", 2, 3, 15], ["CHR", 0, "shared", [3]], ["CA", 1, 4, 15], ["FU", 5, [0, 1, 2, 3, 4]], ["AN", 5, 0, 5], ["FU", 5, [1, 2, 3, 4, 5]], ["AN", 5, 1, 4], ["FU", 5, [2, 3, 4, 5, 6]], ["AN", 5, 2, 6], ["FU", 3, [0, 1, 2]], ["SP", 3, 0, 128, [4], 1], ["AN", 3, 1, 2], ["FFSP", 3, 0, [5, 4, 3, 2, 1], 1, 1], ["AN", 3, 1, 6], ["FU", 1, [0, 1, 2, 3]], ["SP", 1, 0, 16, [1], 1], ["AN", 1, 1, 2], ["FFSP", 1, 0, [5, 4, 3, 2, 1], 1, 1], ["AN", 1, 1, 6], ["PR", 4, 0, "auto_unroll_max_step$0"]]]], "r": [[0.000104886, 0.000104855, 0.000104829], 0, 9.11166, 1667896822], "v": "v0.6"}
{"i": [["[\"hfused_conv1x1_stride\", 1, 56, 56, 256, 8, 64, 2]", "cuda -keys=cuda,gpu -max_num_threads=1024 -model=unknown -thread_warp_size=32", [-1, 16, 64, 49152, 2147483647, 1024, 8, 32], "", 0, []], [[], [["CHW", 2, "local"], ["SP", 2, 0, 1, [1, 1, 1, 1], 1], ["SP", 2, 5, 64, [4, 2, 1, 1], 1], ["SP", 2, 10, 28, [1, 1, 1, 2], 1], ["SP", 2, 15, 28, [1, 28, 1, 1], 1], ["SP", 2, 20, 8, [2, 2, 1, 1], 1], ["SP", 2, 25, 256, [1, 32], 1], ["RE", 2, [0, 5, 10, 15, 20, 1, 6, 11, 16, 21, 2, 7, 12, 17, 22, 25, 26, 3, 8, 13, 18, 23, 27, 4, 9, 14, 19, 24]], ["FSP", 3, 0, 1, 3], ["FSP", 3, 4, 2, 3], ["FSP", 3, 8, 3, 3], ["FSP", 3, 12, 4, 3], ["FSP", 3, 16, 5, 3], ["RE", 3, [0, 4, 8, 12, 16, 1, 5, 9, 13, 17, 2, 6, 10, 14, 18, 3, 7, 11, 15, 19]], ["CA", 2, 3, 14], ["CHR", 1, "shared", [2]], ["CA", 2, 3, 15], ["CHR", 0, "shared", [3]], ["CA", 1, 4, 15], ["FU", 5, [0, 1, 2, 3, 4]], ["AN", 5, 0, 5], ["FU", 5, [1, 2, 3, 4, 5]], ["AN", 5, 1, 4], ["FU", 5, [2, 3, 4, 5, 6]], ["AN", 5, 2, 6], ["FU", 3, [0, 1, 2]], ["SP", 3, 0, 32, [16], 1], ["AN", 3, 1, 2], ["FFSP", 3, 0, [5, 4, 3, 2, 1], 1, 1], ["AN", 3, 1, 6], ["FU", 1, [0, 1, 2, 3]], ["SP", 1, 0, 96, [1], 1], ["AN", 1, 1, 2], ["FFSP", 1, 0, [5, 4, 3, 2, 1], 1, 1], ["AN", 1, 1, 6], ["PR", 4, 0, "auto_unroll_max_step$0"]]]], "r": [[9.92218e-05, 9.92838e-05, 9.94543e-05], 0, 6.32044, 1667896819], "v": "v0.6"}
{"i": [["[\"hfused_conv1x1_stride\", 1, 56, 56, 256, 8, 64, 2]", "cuda -keys=cuda,gpu -max_num_threads=1024 -model=unknown -thread_warp_size=32", [-1, 16, 64, 49152, 2147483647, 1024, 8, 32], "", 0, []], [[], [["CHW", 2, "local"], ["SP", 2, 0, 1, [1, 1, 1, 1], 1], ["SP", 2, 5, 64, [1, 4, 4, 4], 1], ["SP", 2, 10, 28, [1, 4, 1, 1], 1], ["SP", 2, 15, 28, [1, 14, 1, 1], 1], ["SP", 2, 20, 8, [2, 1, 4, 1], 1], ["SP", 2, 25, 256, [8, 2], 1], ["RE", 2, [0, 5, 10, 15, 20, 1, 6, 11, 16, 21, 2, 7, 12, 17, 22, 25, 26, 3, 8, 13, 18, 23, 27, 4, 9, 14, 19, 24]], ["FSP", 3, 0, 1, 3], ["FSP", 3, 4, 2, 3], ["FSP", 3, 8, 3, 3], ["FSP", 3, 12, 4, 3], ["FSP", 3, 16, 5, 3], ["RE", 3, [0, 4, 8, 12, 16, 1, 5, 9, 13, 17, 2, 6, 10, 14, 18, 3, 7, 11, 15, 19]], ["CA", 2, 3, 14], ["CHR", 1, "shared", [2]], ["CA", 2, 3, 15], ["CHR", 0, "shared", [3]], ["CA", 1, 4, 15], ["FU", 5, [0, 1, 2, 3, 4]], ["AN", 5, 0, 5], ["FU", 5, [1, 2, 3, 4, 5]], ["AN", 5, 1, 4], ["FU", 5, [2, 3, 4, 5, 6]], ["AN", 5, 2, 6], ["FU", 3, [0, 1, 2]], ["SP", 3, 0, 1024, [1], 1], ["AN", 3, 1, 2], ["FFSP", 3, 0, [5, 4, 3, 2, 1], 1, 1], ["AN", 3, 1, 6], ["FU", 1, [0, 1, 2, 3]], ["SP", 1, 0, 16, [1], 1], ["AN", 1, 1, 2], ["FFSP", 1, 0, [5, 4, 3, 2, 1], 1, 1], ["AN", 1, 1, 6], ["PR", 4, 0, "auto_unroll_max_step$0"]]]], "r": [[0.000297232, 0.000297101, 0.000297144], 0, 8.20225, 1667896821], "v": "v0.6"}
{"i": [["[\"hfused_conv1x1_stride\", 1, 56, 56, 256, 8, 64, 2]", "cuda -keys=cuda,gpu -max_num_threads=1024 -model=unknown -thread_warp_size=32", [-1, 16, 64, 49152, 2147483647, 1024, 8, 32], "", 0, []], [[], [["CHW", 2, "local"], ["SP", 2, 0, 1, [1, 1, 1, 1], 1], ["SP", 2, 5, 64, [1, 32, 1, 2], 1], ["SP", 2, 10, 28, [1, 1, 1, 1], 1], ["SP", 2, 15, 28, [1, 2, 7, 1], 1], ["SP", 2, 20, 8, [1, 1, 2, 4], 1], ["SP", 2, 25, 256, [2, 8], 1], ["RE", 2, [0, 5, 10, 15, 20, 1, 6, 11, 16, 21, 2, 7, 12, 17, 22, 25, 26, 3, 8, 13, 18, 23, 27, 4, 9, 14, 19, 24]], ["FSP", 3, 0, 1, 3], ["FSP", 3, 4, 2, 3], ["FSP", 3, 8, 3, 3], ["FSP", 3, 12, 4, 3], ["FSP", 3, 16, 5, 3], ["RE", 3, [0, 4, 8, 12, 16, 1, 5, 9, 13, 17, 2, 6, 10, 14, 18, 3, 7, 11, 15, 19]], ["CA", 2, 3, 14], ["CHR", 1, "shared", [2]], ["CA", 2, 3, 15], ["CHR", 0, "shared", [3]], ["CA", 1, 4, 15], ["FU", 5, [0, 1, 2, 3, 4]], ["AN", 5, 0, 5], ["FU", 5, [1, 2, 3, 4, 5]], ["AN", 5, 1, 4], ["FU", 5, [2, 3, 4, 5, 6]], ["AN", 5, 2, 6], ["FU", 3, [0, 1, 2]], ["SP", 3, 0, 256, [1], 1], ["AN", 3, 1, 2], ["FFSP", 3, 0, [5, 4, 3, 2, 1], 1, 1], ["AN", 3, 1, 6], ["FU", 1, [0, 1, 2, 3]], ["SP", 1, 0, 432, [1], 1], ["AN", 1, 1, 2], ["FFSP", 1, 0, [5, 4, 3, 2, 1], 1, 1], ["AN", 1, 1, 6], ["PR", 4, 0, "auto_unroll_max_step$0"]]]], "r": [[0.000211935, 0.000211976, 0.000211843], 0, 6.96591, 1667896820], "v": "v0.6"}
{"i": [["[\"hfused_conv1x1_stride\", 1, 56, 56, 256, 8, 64, 2]", "cuda -keys=cuda,gpu -max_num_threads=1024 -model=unknown -thread_warp_size=32", [-1, 16, 64, 49152, 2147483647, 1024, 8, 32], "", 0, []], [[], [["CHW", 2, "local"], ["SP", 2, 0, 1, [1, 1, 1, 1], 1], ["SP", 2, 5, 64, [1, 4, 8, 2], 1], ["SP", 2, 10, 28, [1, 7, 1, 2], 1], ["SP", 2, 15, 28, [2, 1, 1, 1], 1], ["SP", 2, 20, 8, [1, 2, 2, 1], 1], ["SP", 2, 25, 256, [4, 2], 1], ["RE", 2, [0, 5, 10, 15, 20, 1, 6, 11, 16, 21, 2, 7, 12, 17, 22, 25, 26, 3, 8, 13, 18, 23, 27, 4, 9, 14, 19, 24]], ["FSP", 3, 0, 1, 3], ["FSP", 3, 4, 2, 3], ["FSP", 3, 8, 3, 3], ["FSP", 3, 12, 4, 3], ["FSP", 3, 16, 5, 3], ["RE", 3, [0, 4, 8, 12, 16, 1, 5, 9, 13, 17, 2, 6, 10, 14, 18, 3, 7, 11, 15, 19]], ["CA", 2, 3, 14], ["CHR", 1, "shared", [2]], ["CA", 2, 3, 15], ["CHR", 0, "shared", [3]], ["CA", 1, 4, 15], ["FU", 5, [0, 1, 2, 3, 4]], ["AN", 5, 0, 5], ["FU", 5, [1, 2, 3, 4, 5]], ["AN", 5, 1, 4], ["FU", 5, [2, 3, 4, 5, 6]], ["AN", 5, 2, 6], ["FU", 3, [0, 1, 2]], ["SP", 3, 0, 256, [1], 1], ["AN", 3, 1, 2], ["FFSP", 3, 0, [5, 4, 3, 2, 1], 1, 1], ["AN", 3, 1, 6], ["FU", 1, [0, 1, 2, 3]], ["SP", 1, 0, 24, [1], 1], ["AN", 1, 1, 2], ["FFSP", 1, 0, [5, 4, 3, 2, 1], 1, 1], ["AN", 1, 1, 6], ["PR", 4, 0, "auto_unroll_max_step$0"]]]], "r": [[0.000232527, 0.00023249, 0.000232522], 0, 8.86767, 1667896822], "v": "v0.6"}
{"i": [["[\"hfused_conv1x1_stride\", 1, 56, 56, 256, 8, 64, 2]", "cuda -keys=cuda,gpu -max_num_threads=1024 -model=unknown -thread_warp_size=32", [-1, 16, 64, 49152, 2147483647, 1024, 8, 32], "", 0, []], [[], [["CHW", 2, "local"], ["SP", 2, 0, 1, [1, 1, 1, 1], 1], ["SP", 2, 5, 64, [2, 8, 1, 2], 1], ["SP", 2, 10, 28, [1, 7, 1, 1], 1], ["SP", 2, 15, 28, [1, 2, 7, 1], 1], ["SP", 2, 20, 8, [2, 1, 1, 4], 1], ["SP", 2, 25, 256, [1, 2], 1], ["RE", 2, [0, 5, 10, 15, 20, 1, 6, 11, 16, 21, 2, 7, 12, 17, 22, 25, 26, 3, 8, 13, 18, 23, 27, 4, 9, 14, 19, 24]], ["FSP", 3, 0, 1, 3], ["FSP", 3, 4, 2, 3], ["FSP", 3, 8, 3, 3], ["FSP", 3, 12, 4, 3], ["FSP", 3, 16, 5, 3], ["RE", 3, [0, 4, 8, 12, 16, 1, 5, 9, 13, 17, 2, 6, 10, 14, 18, 3, 7, 11, 15, 19]], ["CA", 2, 3, 14], ["CHR", 1, "shared", [2]], ["CA", 2, 3, 15], ["CHR", 0, "shared", [3]], ["CA", 1, 4, 15], ["FU", 5, [0, 1, 2, 3, 4]], ["AN", 5, 0, 5], ["FU", 5, [1, 2, 3, 4, 5]], ["AN", 5, 1, 4], ["FU", 5, [2, 3, 4, 5, 6]], ["AN", 5, 2, 6], ["FU", 3, [0, 1, 2]], ["SP", 3, 0, 16, [1], 1], ["AN", 3, 1, 2], ["FFSP", 3, 0, [5, 4, 3, 2, 1], 1, 1], ["AN", 3, 1, 6], ["FU", 1, [0, 1, 2, 3]], ["SP", 1, 0, 54, [1], 1], ["AN", 1, 1, 2], ["FFSP", 1, 0, [5, 4, 3, 2, 1], 1, 1], ["AN", 1, 1, 6], ["PR", 4, 0, "auto_unroll_max_step$1024"]]]], "r": [[0.00023334, 0.000233264, 0.000233109], 0, 7.62886, 1667896820], "v": "v0.6"}
{"i": [["[\"hfused_conv1x1_stride\", 1, 56, 56, 256, 8, 64, 2]", "cuda -keys=cuda,gpu -max_num_threads=1024 -model=unknown -thread_warp_size=32", [-1, 16, 64, 49152, 2147483647, 1024, 8, 32], "", 0, []], [[], [["CHW", 2, "local"], ["SP", 2, 0, 1, [1, 1, 1, 1], 1], ["SP", 2, 5, 64, [1, 1, 32, 2], 1], ["SP", 2, 10, 28, [1, 7, 1, 1], 1], ["SP", 2, 15, 28, [1, 7, 1, 1], 1], ["SP", 2, 20, 8, [1, 2, 1, 2], 1], ["SP", 2, 25, 256, [1, 8], 1], ["RE", 2, [0, 5, 10, 15, 20, 1, 6, 11, 16, 21, 2, 7, 12, 17, 22, 25, 26, 3, 8, 13, 18, 23, 27, 4, 9, 14, 19, 24]], ["FSP", 3, 0, 1, 3], ["FSP", 3, 4, 2, 3], ["FSP", 3, 8, 3, 3], ["FSP", 3, 12, 4, 3], ["FSP", 3, 16, 5, 3], ["RE", 3, [0, 4, 8, 12, 16, 1, 5, 9, 13, 17, 2, 6, 10, 14, 18, 3, 7, 11, 15, 19]], ["CA", 2, 3, 14], ["CHR", 1, "shared", [2]], ["CA", 2, 3, 15], ["CHR", 0, "shared", [3]], ["CA", 1, 4, 15], ["FU", 5, [0, 1, 2, 3, 4]], ["AN", 5, 0, 5], ["FU", 5, [1, 2, 3, 4, 5]], ["AN", 5, 1, 4], ["FU", 5, [2, 3, 4, 5, 6]], ["AN", 5, 2, 6], ["FU", 3, [0, 1, 2]], ["SP", 3, 0, 512, [1], 1], ["AN", 3, 1, 2], ["FFSP", 3, 0, [5, 4, 3, 2, 1], 1, 1], ["AN", 3, 1, 6], ["FU", 1, [0, 1, 2, 3]], ["SP", 1, 0, 4, [1], 1], ["AN", 1, 1, 2], ["FFSP", 1, 0, [5, 4, 3, 2, 1], 1, 1], ["AN", 1, 1, 6], ["PR", 4, 0, "auto_unroll_max_step$16"]]]], "r": [[0.000410966, 0.000411182, 0.000411578], 0, 5.5381, 1667896819], "v": "v0.6"}
{"i": [["[\"hfused_conv1x1_stride\", 1, 56, 56, 256, 8, 64, 2]", "cuda -keys=cuda,gpu -max_num_threads=1024 -model=unknown -thread_warp_size=32", [-1, 16, 64, 49152, 2147483647, 1024, 8, 32], "", 0, []], [[], [["CHW", 2, "local"], ["SP", 2, 0, 1, [1, 1, 1, 1], 1], ["SP", 2, 5, 64, [4, 4, 4, 1], 1], ["SP", 2, 10, 28, [1, 7, 2, 1], 1], ["SP", 2, 15, 28, [2, 2, 1, 7], 1], ["SP", 2, 20, 8, [1, 4, 2, 1], 1], ["SP", 2, 25, 256, [2, 2], 1], ["RE", 2, [0, 5, 10, 15, 20, 1, 6, 11, 16, 21, 2, 7, 12, 17, 22, 25, 26, 3, 8, 13, 18, 23, 27, 4, 9, 14, 19, 24]], ["FSP", 3, 0, 1, 3], ["FSP", 3, 4, 2, 3], ["FSP", 3, 8, 3, 3], ["FSP", 3, 12, 4, 3], ["FSP", 3, 16, 5, 3], ["RE", 3, [0, 4, 8, 12, 16, 1, 5, 9, 13, 17, 2, 6, 10, 14, 18, 3, 7, 11, 15, 19]], ["CA", 2, 3, 14], ["CHR", 1, "shared", [2]], ["CA", 2, 3, 15], ["CHR", 0, "shared", [3]], ["CA", 1, 4, 15], ["FU", 5, [0, 1, 2, 3, 4]], ["AN", 5, 0, 5], ["FU", 5, [1, 2, 3, 4, 5]], ["AN", 5, 1, 4], ["FU", 5, [2, 3, 4, 5, 6]], ["AN", 5, 2, 6], ["FU", 3, [0, 1, 2]], ["SP", 3, 0, 32, [1], 1], ["AN", 3, 1, 2], ["FFSP", 3, 0, [5, 4, 3, 2, 1], 1, 1], ["AN", 3, 1, 6], ["FU", 1, [0, 1, 2, 3]], ["SP", 1, 0, 156, [1], 1], ["AN", 1, 1, 2], ["FFSP", 1, 0, [5, 4, 3, 2, 1], 1, 1], ["AN", 1, 1, 6], ["PR", 4, 0, "auto_unroll_max_step$0"]]]], "r": [[0.00332082, 0.00331771, 0.00332137], 0, 5.90683, 1667896818], "v": "v0.6"}
{"i": [["[\"hfused_conv1x1_stride\", 1, 56, 56, 256, 8, 64, 2]", "cuda -keys=cuda,gpu -max_num_threads=1024 -model=unknown -thread_warp_size=32", [-1, 16, 64, 49152, 2147483647, 1024, 8, 32], "", 0, []], [[], [["CHW", 2, "local"], ["SP", 2, 0, 1, [1, 1, 1, 1], 1], ["SP", 2, 5, 64, [1, 16, 1, 2], 1], ["SP", 2, 10, 28, [1, 14, 1, 1], 1], ["SP", 2, 15, 28, [1, 2, 2, 1], 1], ["SP", 2, 20, 8, [1, 2, 2, 2], 1], ["SP", 2, 25, 256, [8, 1], 1], ["RE", 2, [0, 5, 10, 15, 20, 1, 6, 11, 16, 21, 2, 7, 12, 17, 22, 25, 26, 3, 8, 13, 18, 23, 27, 4, 9, 14, 19, 24]], ["FSP", 3, 0, 1, 3], ["FSP", 3, 4, 2, 3], ["FSP", 3, 8, 3, 3], ["FSP", 3, 12, 4, 3], ["FSP", 3, 16, 5, 3], ["RE", 3, [0, 4, 8, 12, 16, 1, 5, 9, 13, 17, 2, 6, 10, 14, 18, 3, 7, 11, 15, 19]], ["CA", 2, 3, 14], ["CHR", 1, "shared", [2]], ["CA", 2, 3, 15], ["CHR", 0, "shared", [3]], ["CA", 1, 4, 15], ["FU", 5, [0, 1, 2, 3, 4]], ["AN", 5, 0, 5], ["FU", 5, [1, 2, 3, 4, 5]], ["AN", 5, 1, 4], ["FU", 5, [2, 3, 4, 5, 6]], ["AN", 5, 2, 6], ["FU", 3, [0, 1, 2]], ["SP", 3, 0, 64, [1], 1], ["AN", 3, 1, 2], ["FFSP", 3, 0, [5, 4, 3, 2, 1], 1, 1], ["AN", 3, 1, 6], ["FU", 1, [0, 1, 2, 3]], ["SP", 1, 0, 24, [1], 1], ["AN", 1, 1, 2], ["FFSP", 1, 0, [5, 4, 3, 2, 1], 1, 1], ["AN", 1, 1, 6], ["PR", 4, 0, "auto_unroll_max_step$1024"]]]], "r": [[8.41833e-05, 8.41327e-05, 8.41796e-05], 0, 7.61572, 1667896821], "v": "v0.6"}
{"i": [["[\"hfused_conv1x1_stride\", 1, 56, 56, 256, 8, 64, 2]", "cuda -keys=cuda,gpu -max_num_threads=1024 -model=unknown -thread_warp_size=32", [-1, 16, 64, 49152, 2147483647, 1024, 8, 32], "", 0, []], [[], [["CHW", 2, "local"], ["SP", 2, 0, 1, [1, 1, 1, 1], 1], ["SP", 2, 5, 64, [2, 32, 1, 1], 1], ["SP", 2, 10, 28, [1, 7, 1, 4], 1], ["SP", 2, 15, 28, [1, 4, 7, 1], 1], ["SP", 2, 20, 8, [2, 1, 1, 2], 1], ["SP", 2, 25, 256, [2, 1], 1], ["RE", 2, [0, 5, 10, 15, 20, 1, 6, 11, 16, 21, 2, 7, 12, 17, 22, 25, 26, 3, 8, 13, 18, 23, 27, 4, 9, 14, 19, 24]], ["FSP", 3, 0, 1, 3], ["FSP", 3, 4, 2, 3], ["FSP", 3, 8, 3, 3], ["FSP", 3, 12, 4, 3], ["FSP", 3, 16, 5, 3], ["RE", 3, [0, 4, 8, 12, 16, 1, 5, 9, 13, 17, 2, 6, 10, 14, 18, 3, 7, 11, 15, 19]], ["CA", 2, 3, 14], ["CHR", 1, "shared", [2]], ["CA", 2, 3, 15], ["CHR", 0, "shared", [3]], ["CA", 1, 4, 15], ["FU", 5, [0, 1, 2, 3, 4]], ["AN", 5, 0, 5], ["FU", 5, [1, 2, 3, 4, 5]], ["AN", 5, 1, 4], ["FU", 5, [2, 3, 4, 5, 6]], ["AN", 5, 2, 6], ["FU", 3, [0, 1, 2]], ["SP", 3, 0, 4, [1], 1], ["AN", 3, 1, 2], ["FFSP", 3, 0, [5, 4, 3, 2, 1], 1, 1], ["AN", 3, 1, 6], ["FU", 1, [0, 1, 2, 3]], ["SP", 1, 0, 182, [1], 1], ["AN", 1, 1, 2], ["FFSP", 1, 0, [5, 4, 3, 2, 1], 1, 1], ["AN", 1, 1, 6], ["PR", 4, 0, "auto_unroll_max_step$1024"]]]], "r": [[0.00386155, 0.00385958, 0.00386038], 0, 8.83774, 1667896822], "v": "v0.6"}
{"i": [["[\"hfused_conv1x1_stride\", 1, 56, 56, 256, 8, 64, 2]", "cuda -keys=cuda,gpu -max_num_threads=1024 -model=unknown -thread_warp_size=32", [-1, 16, 64, 49152, 2147483647, 1024, 8, 32], "", 0, []], [[], [["CHW", 2, "local"], ["SP", 2, 0, 1, [1, 1, 1, 1], 1], ["SP", 2, 5, 64, [1, 2, 4, 1], 1], ["SP", 2, 10, 28, [1, 14, 1, 1], 1], ["SP", 2, 15, 28, [1, 7, 1, 1], 1], ["SP", 2, 20, 8, [2, 4, 1, 1], 1], ["SP", 2, 25, 256, [8, 1], 1], ["RE", 2, [0, 5, 10, 15, 20, 1, 6, 11, 16, 21, 2, 7, 12, 17, 22, 25, 26, 3, 8, 13, 18, 23, 27, 4, 9, 14, 19, 24]], ["FSP", 3, 0, 1, 3], ["FSP", 3, 4, 2, 3], ["FSP", 3, 8, 3, 3], ["FSP", 3, 12, 4, 3], ["FSP", 3, 16, 5, 3], ["RE", 3, [0, 4, 8, 12, 16, 1, 5, 9, 13, 17, 2, 6, 10, 14, 18, 3, 7, 11, 15, 19]], ["CA", 2, 3, 14], ["CHR", 1, "shared", [2]], ["CA", 2, 3, 15], ["CHR", 0, "shared", [3]], ["CA", 1, 4, 15], ["FU", 5, [0, 1, 2, 3, 4]], ["AN", 5, 0, 5], ["FU", 5, [1, 2, 3, 4, 5]], ["AN", 5, 1, 4], ["FU", 5, [2, 3, 4, 5, 6]], ["AN", 5, 2, 6], ["FU", 3, [0, 1, 2]], ["SP", 3, 0, 64, [2], 1], ["AN", 3, 1, 2], ["FFSP", 3, 0, [5, 4, 3, 2, 1], 1, 1], ["AN", 3, 1, 6], ["FU", 1, [0, 1, 2, 3]], ["SP", 1, 0, 8, [1], 1], ["AN", 1, 1, 2], ["FFSP", 1, 0, [5, 4, 3, 2, 1], 1, 1], ["AN", 1, 1, 6], ["PR", 4, 0, "auto_unroll_max_step$16"]]]], "r": [[7.61241e-05, 7.60679e-05, 7.60644e-05], 0, 5.98099, 1667958202], "v": "v0.6"}
{"i": [["[\"hfused_conv1x1_stride\", 1, 56, 56, 256, 8, 64, 2]", "cuda -keys=cuda,gpu -max_num_threads=1024 -model=unknown -thread_warp_size=32", [-1, 16, 64, 49152, 2147483647, 1024, 8, 32], "", 0, []], [[], [["CHW", 2, "local"], ["SP", 2, 0, 1, [1, 1, 1, 1], 1], ["SP", 2, 5, 64, [1, 2, 32, 1], 1], ["SP", 2, 10, 28, [1, 1, 1, 1], 1], ["SP", 2, 15, 28, [1, 7, 1, 1], 1], ["SP", 2, 20, 8, [2, 1, 1, 2], 1], ["SP", 2, 25, 256, [2, 8], 1], ["RE", 2, [0, 5, 10, 15, 20, 1, 6, 11, 16, 21, 2, 7, 12, 17, 22, 25, 26, 3, 8, 13, 18, 23, 27, 4, 9, 14, 19, 24]], ["FSP", 3, 0, 1, 3], ["FSP", 3, 4, 2, 3], ["FSP", 3, 8, 3, 3], ["FSP", 3, 12, 4, 3], ["FSP", 3, 16, 5, 3], ["RE", 3, [0, 4, 8, 12, 16, 1, 5, 9, 13, 17, 2, 6, 10, 14, 18, 3, 7, 11, 15, 19]], ["CA", 2, 3, 14], ["CHR", 1, "shared", [2]], ["CA", 2, 3, 15], ["CHR", 0, "shared", [3]], ["CA", 1, 4, 15], ["FU", 5, [0, 1, 2, 3, 4]], ["AN", 5, 0, 5], ["FU", 5, [1, 2, 3, 4, 5]], ["AN", 5, 1, 4], ["FU", 5, [2, 3, 4, 5, 6]], ["AN", 5, 2, 6], ["FU", 3, [0, 1, 2]], ["SP", 3, 0, 256, [1], 1], ["AN", 3, 1, 2], ["FFSP", 3, 0, [5, 4, 3, 2, 1], 1, 1], ["AN", 3, 1, 6], ["FU", 1, [0, 1, 2, 3]], ["SP", 1, 0, 16, [1], 1], ["AN", 1, 1, 2], ["FFSP", 1, 0, [5, 4, 3, 2, 1], 1, 1], ["AN", 1, 1, 6], ["PR", 4, 0, "auto_unroll_max_step$16"]]]], "r": [[0.000751959, 0.000751124, 0.000751914], 0, 8.86905, 1667958205], "v": "v0.6"}
{"i": [["[\"hfused_conv1x1_stride\", 1, 56, 56, 256, 8, 64, 2]", "cuda -keys=cuda,gpu -max_num_threads=1024 -model=unknown -thread_warp_size=32", [-1, 16, 64, 49152, 2147483647, 1024, 8, 32], "", 0, []], [[], [["CHW", 2, "local"], ["SP", 2, 0, 1, [1, 1, 1, 1], 1], ["SP", 2, 5, 64, [1, 2, 1, 2], 1], ["SP", 2, 10, 28, [1, 1, 2, 14], 1], ["SP", 2, 15, 28, [1, 1, 1, 1], 1], ["SP", 2, 20, 8, [2, 1, 1, 4], 1], ["SP", 2, 25, 256, [4, 32], 1], ["RE", 2, [0, 5, 10, 15, 20, 1, 6, 11, 16, 21, 2, 7, 12, 17, 22, 25, 26, 3, 8, 13, 18, 23, 27, 4, 9, 14, 19, 24]], ["FSP", 3, 0, 1, 3], ["FSP", 3, 4, 2, 3], ["FSP", 3, 8, 3, 3], ["FSP", 3, 12, 4, 3], ["FSP", 3, 16, 5, 3], ["RE", 3, [0, 4, 8, 12, 16, 1, 5, 9, 13, 17, 2, 6, 10, 14, 18, 3, 7, 11, 15, 19]], ["CA", 2, 3, 14], ["CHR", 1, "shared", [2]], ["CA", 2, 3, 15], ["CHR", 0, "shared", [3]], ["CA", 1, 4, 15], ["FU", 5, [0, 1, 2, 3, 4]], ["AN", 5, 0, 5], ["FU", 5, [1, 2, 3, 4, 5]], ["AN", 5, 1, 4], ["FU", 5, [2, 3, 4, 5, 6]], ["AN", 5, 2, 6], ["FU", 3, [0, 1, 2]], ["SP", 3, 0, 32, [1], 1], ["AN", 3, 1, 2], ["FFSP", 3, 0, [5, 4, 3, 2, 1], 1, 1], ["AN", 3, 1, 6], ["FU", 1, [0, 1, 2, 3]], ["SP", 1, 0, 220, [1], 1], ["AN", 1, 1, 2], ["FFSP", 1, 0, [5, 4, 3, 2, 1], 1, 1], ["AN", 1, 1, 6], ["PR", 4, 0, "auto_unroll_max_step$64"]]]], "r": [[0.00127463, 0.0012531, 0.00125241], 0, 12.3376, 1667958207], "v": "v0.6"}
{"i": [["[\"hfused_conv1x1_stride\", 1, 56, 56, 256, 8, 64, 2]", "cuda -keys=cuda,gpu -max_num_threads=1024 -model=unknown -thread_warp_size=32", [-1, 16, 64, 49152, 2147483647, 1024, 8, 32], "", 0, []], [[], [["CHW", 2, "local"], ["SP", 2, 0, 1, [1, 1, 1, 1], 1], ["SP", 2, 5, 64, [1, 8, 1, 4], 1], ["SP", 2, 10, 28, [1, 7, 1, 2], 1], ["SP", 2, 15, 28, [7, 2, 1, 2], 1], ["SP", 2, 20, 8, [1, 2, 4, 1], 1], ["SP", 2, 25, 256, [1, 2], 1], ["RE", 2, [0, 5, 10, 15, 20, 1, 6, 11, 16, 21, 2, 7, 12, 17, 22, 25, 26, 3, 8, 13, 18, 23, 27, 4, 9, 14, 19, 24]], ["FSP", 3, 0, 1, 3], ["FSP", 3, 4, 2, 3], ["FSP", 3, 8, 3, 3], ["FSP", 3, 12, 4, 3], ["FSP", 3, 16, 5, 3], ["RE", 3, [0, 4, 8, 12, 16, 1, 5, 9, 13, 17, 2, 6, 10, 14, 18, 3, 7, 11, 15, 19]], ["CA", 2, 3, 14], ["CHR", 1, "shared", [2]], ["CA", 2, 3, 15], ["CHR", 0, "shared", [3]], ["CA", 1, 4, 15], ["FU", 5, [0, 1, 2, 3, 4]], ["AN", 5, 0, 5], ["FU", 5, [1, 2, 3, 4, 5]], ["AN", 5, 1, 4], ["FU", 5, [2, 3, 4, 5, 6]], ["AN", 5, 2, 6], ["FU", 3, [0, 1, 2]], ["SP", 3, 0, 32, [4], 1], ["AN", 3, 1, 2], ["FFSP", 3, 0, [5, 4, 3, 2, 1], 1, 1], ["AN", 3, 1, 6], ["FU", 1, [0, 1, 2, 3]], ["SP", 1, 0, 18, [18], 1], ["AN", 1, 1, 2], ["FFSP", 1, 0, [5, 4, 3, 2, 1], 1, 1], ["AN", 1, 1, 6], ["PR", 4, 0, "auto_unroll_max_step$0"]]]], "r": [[0.00275993, 0.00275827, 0.00275718], 0, 14.6334, 1667958210], "v": "v0.6"}
{"i": [["[\"hfused_conv1x1_stride\", 1, 56, 56, 256, 8, 64, 2]", "cuda -keys=cuda,gpu -max_num_threads=1024 -model=unknown -thread_warp_size=32", [-1, 16, 64, 49152, 2147483647, 1024, 8, 32], "", 0, []], [[], [["CHW", 2, "local"], ["SP", 2, 0, 1, [1, 1, 1, 1], 1], ["SP", 2, 5, 64, [2, 4, 1, 2], 1], ["SP", 2, 10, 28, [2, 7, 1, 1], 1], ["SP", 2, 15, 28, [1, 1, 1, 1], 1], ["SP", 2, 20, 8, [2, 2, 1, 1], 1], ["SP", 2, 25, 256, [1, 1], 1], ["RE", 2, [0, 5, 10, 15, 20, 1, 6, 11, 16, 21, 2, 7, 12, 17, 22, 25, 26, 3, 8, 13, 18, 23, 27, 4, 9, 14, 19, 24]], ["FSP", 3, 0, 1, 3], ["FSP", 3, 4, 2, 3], ["FSP", 3, 8, 3, 3], ["FSP", 3, 12, 4, 3], ["FSP", 3, 16, 5, 3], ["RE", 3, [0, 4, 8, 12, 16, 1, 5, 9, 13, 17, 2, 6, 10, 14, 18, 3, 7, 11, 15, 19]], ["CA", 2, 3, 14], ["CHR", 1, "shared", [2]], ["CA", 2, 3, 15], ["CHR", 0, "shared", [3]], ["CA", 1, 4, 15], ["FU", 5, [0, 1, 2, 3, 4]], ["AN", 5, 0, 5], ["FU", 5, [1, 2, 3, 4, 5]], ["AN", 5, 1, 4], ["FU", 5, [2, 3, 4, 5, 6]], ["AN", 5, 2, 6], ["FU", 3, [0, 1, 2]], ["SP", 3, 0, 2, [1], 1], ["AN", 3, 1, 2], ["FFSP", 3, 0, [5, 4, 3, 2, 1], 1, 1], ["AN", 3, 1, 6], ["FU", 1, [0, 1, 2, 3]], ["SP", 1, 0, 1, [1], 1], ["AN", 1, 1, 2], ["FFSP", 1, 0, [5, 4, 3, 2, 1], 1, 1], ["AN", 1, 1, 6], ["PR", 4, 0, "auto_unroll_max_step$0"]]]], "r": [[0.000114387, 0.000114421, 0.000114385], 0, 6.62132, 1667958203], "v": "v0.6"}
{"i": [["[\"hfused_conv1x1_stride\", 1, 56, 56, 256, 8, 64, 2]", "cuda -keys=cuda,gpu -max_num_threads=1024 -model=unknown -thread_warp_size=32", [-1, 16, 64, 49152, 2147483647, 1024, 8, 32], "", 0, []], [[], [["CHW", 2, "local"], ["SP", 2, 0, 1, [1, 1, 1, 1], 1], ["SP", 2, 5, 64, [4, 1, 4, 2], 1], ["SP", 2, 10, 28, [2, 7, 2, 1], 1], ["SP", 2, 15, 28, [1, 7, 1, 2], 1], ["SP", 2, 20, 8, [1, 1, 1, 1], 1], ["SP", 2, 25, 256, [1, 1], 1], ["RE", 2, [0, 5, 10, 15, 20, 1, 6, 11, 16, 21, 2, 7, 12, 17, 22, 25, 26, 3, 8, 13, 18, 23, 27, 4, 9, 14, 19, 24]], ["FSP", 3, 0, 1, 3], ["FSP", 3, 4, 2, 3], ["FSP", 3, 8, 3, 3], ["FSP", 3, 12, 4, 3], ["FSP", 3, 16, 5, 3], ["RE", 3, [0, 4, 8, 12, 16, 1, 5, 9, 13, 17, 2, 6, 10, 14, 18, 3, 7, 11, 15, 19]], ["CA", 2, 3, 14], ["CHR", 1, "shared", [2]], ["CA", 2, 3, 15], ["CHR", 0, "shared", [3]], ["CA", 1, 4, 15], ["FU", 5, [0, 1, 2, 3, 4]], ["AN", 5, 0, 5], ["FU", 5, [1, 2, 3, 4, 5]], ["AN", 5, 1, 4], ["FU", 5, [2, 3, 4, 5, 6]], ["AN", 5, 2, 6], ["FU", 3, [0, 1, 2]], ["SP", 3, 0, 8, [1], 1], ["AN", 3, 1, 2], ["FFSP", 3, 0, [5, 4, 3, 2, 1], 1, 1], ["AN", 3, 1, 6], ["FU", 1, [0, 1, 2, 3]], ["SP", 1, 0, 9, [1], 1], ["AN", 1, 1, 2], ["FFSP", 1, 0, [5, 4, 3, 2, 1], 1, 1], ["AN", 1, 1, 6], ["PR", 4, 0, "auto_unroll_max_step$64"]]]], "r": [[0.000863297, 0.000862854, 0.000862838], 0, 8.71245, 1667958205], "v": "v0.6"}
{"i": [["[\"hfused_conv1x1_stride\", 1, 56, 56, 256, 8, 64, 2]", "cuda -keys=cuda,gpu -max_num_threads=1024 -model=unknown -thread_warp_size=32", [-1, 16, 64, 49152, 2147483647, 1024, 8, 32], "", 0, []], [[], [["CHW", 2, "local"], ["SP", 2, 0, 1, [1, 1, 1, 1], 1], ["SP", 2, 5, 64, [1, 4, 2, 2], 1], ["SP", 2, 10, 28, [1, 7, 1, 2], 1], ["SP", 2, 15, 28, [2, 1, 14, 1], 1], ["SP", 2, 20, 8, [1, 2, 1, 1], 1], ["SP", 2, 25, 256, [1, 2], 1], ["RE", 2, [0, 5, 10, 15, 20, 1, 6, 11, 16, 21, 2, 7, 12, 17, 22, 25, 26, 3, 8, 13, 18, 23, 27, 4, 9, 14, 19, 24]], ["FSP", 3, 0, 1, 3], ["FSP", 3, 4, 2, 3], ["FSP", 3, 8, 3, 3], ["FSP", 3, 12, 4, 3], ["FSP", 3, 16, 5, 3], ["RE", 3, [0, 4, 8, 12, 16, 1, 5, 9, 13, 17, 2, 6, 10, 14, 18, 3, 7, 11, 15, 19]], ["CA", 2, 3, 14], ["CHR", 1, "shared", [2]], ["CA", 2, 3, 15], ["CHR", 0, "shared", [3]], ["CA", 1, 4, 15], ["FU", 5, [0, 1, 2, 3, 4]], ["AN", 5, 0, 5], ["FU", 5, [1, 2, 3, 4, 5]], ["AN", 5, 1, 4], ["FU", 5, [2, 3, 4, 5, 6]], ["AN", 5, 2, 6], ["FU", 3, [0, 1, 2]], ["SP", 3, 0, 8, [1], 1], ["AN", 3, 1, 2], ["FFSP", 3, 0, [5, 4, 3, 2, 1], 1, 1], ["AN", 3, 1, 6], ["FU", 1, [0, 1, 2, 3]], ["SP", 1, 0, 162, [1], 1], ["AN", 1, 1, 2], ["FFSP", 1, 0, [5, 4, 3, 2, 1], 1, 1], ["AN", 1, 1, 6], ["PR", 4, 0, "auto_unroll_max_step$64"]]]], "r": [[0.000473814, 0.000473474, 0.000473601], 0, 8.6738, 1667958204], "v": "v0.6"}
{"i": [["[\"hfused_conv1x1_stride\", 1, 56, 56, 256, 8, 64, 2]", "cuda -keys=cuda,gpu -max_num_threads=1024 -model=unknown -thread_warp_size=32", [-1, 16, 64, 49152, 2147483647, 1024, 8, 32], "", 0, []], [[], [["CHW", 2, "local"], ["SP", 2, 0, 1, [1, 1, 1, 1], 1], ["SP", 2, 5, 64, [2, 1, 4, 8], 1], ["SP", 2, 10, 28, [1, 14, 1, 1], 1], ["SP", 2, 15, 28, [1, 4, 1, 1], 1], ["SP", 2, 20, 8, [4, 2, 1, 1], 1], ["SP", 2, 25, 256, [16, 1], 1], ["RE", 2, [0, 5, 10, 15, 20, 1, 6, 11, 16, 21, 2, 7, 12, 17, 22, 25, 26, 3, 8, 13, 18, 23, 27, 4, 9, 14, 19, 24]], ["FSP", 3, 0, 1, 3], ["FSP", 3, 4, 2, 3], ["FSP", 3, 8, 3, 3], ["FSP", 3, 12, 4, 3], ["FSP", 3, 16, 5, 3], ["RE", 3, [0, 4, 8, 12, 16, 1, 5, 9, 13, 17, 2, 6, 10, 14, 18, 3, 7, 11, 15, 19]], ["CA", 2, 3, 14], ["CHR", 1, "shared", [2]], ["CA", 2, 3, 15], ["CHR", 0, "shared", [3]], ["CA", 1, 4, 15], ["FU", 5, [0, 1, 2, 3, 4]], ["AN", 5, 0, 5], ["FU", 5, [1, 2, 3, 4, 5]], ["AN", 5, 1, 4], ["FU", 5, [2, 3, 4, 5, 6]], ["AN", 5, 2, 6], ["FU", 3, [0, 1, 2]], ["SP", 3, 0, 512, [1], 1], ["AN", 3, 1, 2], ["FFSP", 3, 0, [5, 4, 3, 2, 1], 1, 1], ["AN", 3, 1, 6], ["FU", 1, [0, 1, 2, 3]], ["SP", 1, 0, 16, [1], 1], ["AN", 1, 1, 2], ["FFSP", 1, 0, [5, 4, 3, 2, 1], 1, 1], ["AN", 1, 1, 6], ["PR", 4, 0, "auto_unroll_max_step$1024"]]]], "r": [[0.0012606, 0.00126059, 0.00126042], 0, 14.4126, 1667958209], "v": "v0.6"}
{"i": [["[\"hfused_conv1x1_stride\", 1, 56, 56, 256, 8, 64, 2]", "cuda -keys=cuda,gpu -max_num_threads=1024 -model=unknown -thread_warp_size=32", [-1, 16, 64, 49152, 2147483647, 1024, 8, 32], "", 0, []], [[], [["CHW", 2, "local"], ["SP", 2, 0, 1, [1, 1, 1, 1], 1], ["SP", 2, 5, 64, [2, 1, 4, 8], 1], ["SP", 2, 10, 28, [1, 14, 1, 1], 1], ["SP", 2, 15, 28, [1, 4, 1, 1], 1], ["SP", 2, 20, 8, [4, 2, 1, 1], 1], ["SP", 2, 25, 256, [8, 2], 1], ["RE", 2, [0, 5, 10, 15, 20, 1, 6, 11, 16, 21, 2, 7, 12, 17, 22, 25, 26, 3, 8, 13, 18, 23, 27, 4, 9, 14, 19, 24]], ["FSP", 3, 0, 1, 3], ["FSP", 3, 4, 2, 3], ["FSP", 3, 8, 3, 3], ["FSP", 3, 12, 4, 3], ["FSP", 3, 16, 5, 3], ["RE", 3, [0, 4, 8, 12, 16, 1, 5, 9, 13, 17, 2, 6, 10, 14, 18, 3, 7, 11, 15, 19]], ["CA", 2, 3, 14], ["CHR", 1, "shared", [2]], ["CA", 2, 3, 15], ["CHR", 0, "shared", [3]], ["CA", 1, 4, 15], ["FU", 5, [0, 1, 2, 3, 4]], ["AN", 5, 0, 5], ["FU", 5, [1, 2, 3, 4, 5]], ["AN", 5, 1, 4], ["FU", 5, [2, 3, 4, 5, 6]], ["AN", 5, 2, 6], ["FU", 3, [0, 1, 2]], ["SP", 3, 0, 512, [16], 1], ["AN", 3, 1, 2], ["FFSP", 3, 0, [5, 4, 3, 2, 1], 1, 1], ["AN", 3, 1, 6], ["FU", 1, [0, 1, 2, 3]], ["SP", 1, 0, 16, [8], 1], ["AN", 1, 1, 2], ["FFSP", 1, 0, [5, 4, 3, 2, 1], 1, 1], ["AN", 1, 1, 6], ["PR", 4, 0, "auto_unroll_max_step$1024"]]]], "r": [[0.00130459, 0.00130495, 0.00130471], 0, 7.71742, 1667958202], "v": "v0.6"}
{"i": [["[\"hfused_conv1x1_stride\", 1, 56, 56, 256, 8, 64, 2]", "cuda -keys=cuda,gpu -max_num_threads=1024 -model=unknown -thread_warp_size=32", [-1, 16, 64, 49152, 2147483647, 1024, 8, 32], "", 0, []], [[], [["CHW", 2, "local"], ["SP", 2, 0, 1, [1, 1, 1, 1], 1], ["SP", 2, 5, 64, [2, 16, 2, 1], 1], ["SP", 2, 10, 28, [1, 1, 2, 7], 1], ["SP", 2, 15, 28, [4, 1, 1, 1], 1], ["SP", 2, 20, 8, [1, 8, 1, 1], 1], ["SP", 2, 25, 256, [4, 2], 1], ["RE", 2, [0, 5, 10, 15, 20, 1, 6, 11, 16, 21, 2, 7, 12, 17, 22, 25, 26, 3, 8, 13, 18, 23, 27, 4, 9, 14, 19, 24]], ["FSP", 3, 0, 1, 3], ["FSP", 3, 4, 2, 3], ["FSP", 3, 8, 3, 3], ["FSP", 3, 12, 4, 3], ["FSP", 3, 16, 5, 3], ["RE", 3, [0, 4, 8, 12, 16, 1, 5, 9, 13, 17, 2, 6, 10, 14, 18, 3, 7, 11, 15, 19]], ["CA", 2, 3, 14], ["CHR", 1, "shared", [2]], ["CA", 2, 3, 15], ["CHR", 0, "shared", [3]], ["CA", 1, 4, 15], ["FU", 5, [0, 1, 2, 3, 4]], ["AN", 5, 0, 5], ["FU", 5, [1, 2, 3, 4, 5]], ["AN", 5, 1, 4], ["FU", 5, [2, 3, 4, 5, 6]], ["AN", 5, 2, 6], ["FU", 3, [0, 1, 2]], ["SP", 3, 0, 64, [1], 1], ["AN", 3, 1, 2], ["FFSP", 3, 0, [5, 4, 3, 2, 1], 1, 1], ["AN", 3, 1, 6], ["FU", 1, [0, 1, 2, 3]], ["SP", 1, 0, 216, [1], 1], ["AN", 1, 1, 2], ["FFSP", 1, 0, [5, 4, 3, 2, 1], 1, 1], ["AN", 1, 1, 6], ["PR", 4, 0, "auto_unroll_max_step$512"]]]], "r": [[0.000388817, 0.000388, 0.000388343], 0, 13.6388, 1667958209], "v": "v0.6"}
{"i": [["[\"hfused_conv1x1_stride\", 1, 56, 56, 256, 8, 64, 2]", "cuda -keys=cuda,gpu -max_num_threads=1024 -model=unknown -thread_warp_size=32", [-1, 16, 64, 49152, 2147483647, 1024, 8, 32], "", 0, []], [[], [["CHW", 2, "local"], ["SP", 2, 0, 1, [1, 1, 1, 1], 1], ["SP", 2, 5, 64, [1, 32, 2, 1], 1], ["SP", 2, 10, 28, [1, 1, 2, 2], 1], ["SP", 2, 15, 28, [1, 1, 1, 1], 1], ["SP", 2, 20, 8, [4, 1, 1, 2], 1], ["SP", 2, 25, 256, [8, 2], 1], ["RE", 2, [0, 5, 10, 15, 20, 1, 6, 11, 16, 21, 2, 7, 12, 17, 22, 25, 26, 3, 8, 13, 18, 23, 27, 4, 9, 14, 19, 24]], ["FSP", 3, 0, 1, 3], ["FSP", 3, 4, 2, 3], ["FSP", 3, 8, 3, 3], ["FSP", 3, 12, 4, 3], ["FSP", 3, 16, 5, 3], ["RE", 3, [0, 4, 8, 12, 16, 1, 5, 9, 13, 17, 2, 6, 10, 14, 18, 3, 7, 11, 15, 19]], ["CA", 2, 3, 14], ["CHR", 1, "shared", [2]], ["CA", 2, 3, 15], ["CHR", 0, "shared", [3]], ["CA", 1, 4, 15], ["FU", 5, [0, 1, 2, 3, 4]], ["AN", 5, 0, 5], ["FU", 5, [1, 2, 3, 4, 5]], ["AN", 5, 1, 4], ["FU", 5, [2, 3, 4, 5, 6]], ["AN", 5, 2, 6], ["FU", 3, [0, 1, 2]], ["SP", 3, 0, 64, [1], 1], ["AN", 3, 1, 2], ["FFSP", 3, 0, [5, 4, 3, 2, 1], 1, 1], ["AN", 3, 1, 6], ["FU", 1, [0, 1, 2, 3]], ["SP", 1, 0, 112, [1], 1], ["AN", 1, 1, 2], ["FFSP", 1, 0, [5, 4, 3, 2, 1], 1, 1], ["AN", 1, 1, 6], ["PR", 4, 0, "auto_unroll_max_step$16"]]]], "r": [[0.000204297, 0.000204247, 0.000204243], 0, 23.3246, 1667958220], "v": "v0.6"}
{"i": [["[\"hfused_conv1x1_stride\", 1, 56, 56, 256, 8, 64, 2]", "cuda -keys=cuda,gpu -max_num_threads=1024 -model=unknown -thread_warp_size=32", [-1, 16, 64, 49152, 2147483647, 1024, 8, 32], "", 0, []], [[], [["CHW", 2, "local"], ["SP", 2, 0, 1, [1, 1, 1, 1], 1], ["SP", 2, 5, 64, [2, 32, 1, 1], 1], ["SP", 2, 10, 28, [1, 1, 2, 14], 1], ["SP", 2, 15, 28, [2, 1, 1, 1], 1], ["SP", 2, 20, 8, [1, 1, 1, 8], 1], ["SP", 2, 25, 256, [4, 1], 1], ["RE", 2, [0, 5, 10, 15, 20, 1, 6, 11, 16, 21, 2, 7, 12, 17, 22, 25, 26, 3, 8, 13, 18, 23, 27, 4, 9, 14, 19, 24]], ["FSP", 3, 0, 1, 3], ["FSP", 3, 4, 2, 3], ["FSP", 3, 8, 3, 3], ["FSP", 3, 12, 4, 3], ["FSP", 3, 16, 5, 3], ["RE", 3, [0, 4, 8, 12, 16, 1, 5, 9, 13, 17, 2, 6, 10, 14, 18, 3, 7, 11, 15, 19]], ["CA", 2, 3, 14], ["CHR", 1, "shared", [2]], ["CA", 2, 3, 15], ["CHR", 0, "shared", [3]], ["CA", 1, 4, 15], ["FU", 5, [0, 1, 2, 3, 4]], ["AN", 5, 0, 5], ["FU", 5, [1, 2, 3, 4, 5]], ["AN", 5, 1, 4], ["FU", 5, [2, 3, 4, 5, 6]], ["AN", 5, 2, 6], ["FU", 3, [0, 1, 2]], ["SP", 3, 0, 32, [1], 1], ["AN", 3, 1, 2], ["FFSP", 3, 0, [5, 4, 3, 2, 1], 1, 1], ["AN", 3, 1, 6], ["FU", 1, [0, 1, 2, 3]], ["SP", 1, 0, 220, [5], 1], ["AN", 1, 1, 2], ["FFSP", 1, 0, [5, 4, 3, 2, 1], 1, 1], ["AN", 1, 1, 6], ["PR", 4, 0, "auto_unroll_max_step$16"]]]], "r": [[0.00142264, 0.00142238, 0.00142252], 0, 8.17375, 1667958204], "v": "v0.6"}
{"i": [["[\"hfused_conv1x1_stride\", 1, 56, 56, 256, 8, 64, 2]", "cuda -keys=cuda,gpu -max_num_threads=1024 -model=unknown -thread_warp_size=32", [-1, 16, 64, 49152, 2147483647, 1024, 8, 32], "", 0, []], [[], [["CHW", 2, "local"], ["SP", 2, 0, 1, [1, 1, 1, 1], 1], ["SP", 2, 5, 64, [4, 1, 4, 4], 1], ["SP", 2, 10, 28, [1, 14, 2, 1], 1], ["SP", 2, 15, 28, [1, 14, 1, 1], 1], ["SP", 2, 20, 8, [1, 2, 2, 1], 1], ["SP", 2, 25, 256, [1, 2], 1], ["RE", 2, [0, 5, 10, 15, 20, 1, 6, 11, 16, 21, 2, 7, 12, 17, 22, 25, 26, 3, 8, 13, 18, 23, 27, 4, 9, 14, 19, 24]], ["FSP", 3, 0, 1, 3], ["FSP", 3, 4, 2, 3], ["FSP", 3, 8, 3, 3], ["FSP", 3, 12, 4, 3], ["FSP", 3, 16, 5, 3], ["RE", 3, [0, 4, 8, 12, 16, 1, 5, 9, 13, 17, 2, 6, 10, 14, 18, 3, 7, 11, 15, 19]], ["CA", 2, 3, 14], ["CHR", 1, "shared", [2]], ["CA", 2, 3, 15], ["CHR", 0, "shared", [3]], ["CA", 1, 4, 15], ["FU", 5, [0, 1, 2, 3, 4]], ["AN", 5, 0, 5], ["FU", 5, [1, 2, 3, 4, 5]], ["AN", 5, 1, 4], ["FU", 5, [2, 3, 4, 5, 6]], ["AN", 5, 2, 6], ["FU", 3, [0, 1, 2]], ["SP", 3, 0, 64, [64], 1], ["AN", 3, 1, 2], ["FFSP", 3, 0, [5, 4, 3, 2, 1], 1, 1], ["AN", 3, 1, 6], ["FU", 1, [0, 1, 2, 3]], ["SP", 1, 0, 14, [1], 1], ["AN", 1, 1, 2], ["FFSP", 1, 0, [5, 4, 3, 2, 1], 1, 1], ["AN", 1, 1, 6], ["PR", 4, 0, "auto_unroll_max_step$16"]]]], "r": [[0.00291863, 0.00291588, 0.00291806], 0, 19.6897, 1667958215], "v": "v0.6"}
{"i": [["[\"hfused_conv1x1_stride\", 1, 56, 56, 256, 8, 64, 2]", "cuda -keys=cuda,gpu -max_num_threads=1024 -model=unknown -thread_warp_size=32", [-1, 16, 64, 49152, 2147483647, 1024, 8, 32], "", 0, []], [[], [["CHW", 2, "local"], ["SP", 2, 0, 1, [1, 1, 1, 1], 1], ["SP", 2, 5, 64, [1, 32, 1, 1], 1], ["SP", 2, 10, 28, [1, 2, 7, 1], 1], ["SP", 2, 15, 28, [1, 1, 2, 2], 1], ["SP", 2, 20, 8, [2, 1, 1, 1], 1], ["SP", 2, 25, 256, [1, 32], 1], ["RE", 2, [0, 5, 10, 15, 20, 1, 6, 11, 16, 21, 2, 7, 12, 17, 22, 25, 26, 3, 8, 13, 18, 23, 27, 4, 9, 14, 19, 24]], ["FSP", 3, 0, 1, 3], ["FSP", 3, 4, 2, 3], ["FSP", 3, 8, 3, 3], ["FSP", 3, 12, 4, 3], ["FSP", 3, 16, 5, 3], ["RE", 3, [0, 4, 8, 12, 16, 1, 5, 9, 13, 17, 2, 6, 10, 14, 18, 3, 7, 11, 15, 19]], ["CA", 2, 3, 14], ["CHR", 1, "shared", [2]], ["CA", 2, 3, 15], ["CHR", 0, "shared", [3]], ["CA", 1, 4, 15], ["FU", 5, [0, 1, 2, 3, 4]], ["AN", 5, 0, 5], ["FU", 5, [1, 2, 3, 4, 5]], ["AN", 5, 1, 4], ["FU", 5, [2, 3, 4, 5, 6]], ["AN", 5, 2, 6], ["FU", 3, [0, 1, 2]], ["SP", 3, 0, 32, [1], 1], ["AN", 3, 1, 2], ["FFSP", 3, 0, [5, 4, 3, 2, 1], 1, 1], ["AN", 3, 1, 6], ["FU", 1, [0, 1, 2, 3]], ["SP", 1, 0, 1248, [1], 1], ["AN", 1, 1, 2], ["FFSP", 1, 0, [5, 4, 3, 2, 1], 1, 1], ["AN", 1, 1, 6], ["PR", 4, 0, "auto_unroll_max_step$64"]]]], "r": [[0.000217155, 0.000217097, 0.000217159], 0, 11.904, 1667958208], "v": "v0.6"}
{"i": [["[\"hfused_conv1x1_stride\", 1, 56, 56, 256, 8, 64, 2]", "cuda -keys=cuda,gpu -max_num_threads=1024 -model=unknown -thread_warp_size=32", [-1, 16, 64, 49152, 2147483647, 1024, 8, 32], "", 0, []], [[], [["CHW", 2, "local"], ["SP", 2, 0, 1, [1, 1, 1, 1], 1], ["SP", 2, 5, 64, [4, 8, 1, 2], 1], ["SP", 2, 10, 28, [1, 1, 7, 1], 1], ["SP", 2, 15, 28, [1, 2, 1, 7], 1], ["SP", 2, 20, 8, [1, 2, 1, 4], 1], ["SP", 2, 25, 256, [1, 1], 1], ["RE", 2, [0, 5, 10, 15, 20, 1, 6, 11, 16, 21, 2, 7, 12, 17, 22, 25, 26, 3, 8, 13, 18, 23, 27, 4, 9, 14, 19, 24]], ["FSP", 3, 0, 1, 3], ["FSP", 3, 4, 2, 3], ["FSP", 3, 8, 3, 3], ["FSP", 3, 12, 4, 3], ["FSP", 3, 16, 5, 3], ["RE", 3, [0, 4, 8, 12, 16, 1, 5, 9, 13, 17, 2, 6, 10, 14, 18, 3, 7, 11, 15, 19]], ["CA", 2, 3, 14], ["CHR", 1, "shared", [2]], ["CA", 2, 3, 15], ["CHR", 0, "shared", [3]], ["CA", 1, 4, 15], ["FU", 5, [0, 1, 2, 3, 4]], ["AN", 5, 0, 5], ["FU", 5, [1, 2, 3, 4, 5]], ["AN", 5, 1, 4], ["FU", 5, [2, 3, 4, 5, 6]], ["AN", 5, 2, 6], ["FU", 3, [0, 1, 2]], ["SP", 3, 0, 64, [1], 1], ["AN", 3, 1, 2], ["FFSP", 3, 0, [5, 4, 3, 2, 1], 1, 1], ["AN", 3, 1, 6], ["FU", 1, [0, 1, 2, 3]], ["SP", 1, 0, 1352, [1], 1], ["AN", 1, 1, 2], ["FFSP", 1, 0, [5, 4, 3, 2, 1], 1, 1], ["AN", 1, 1, 6], ["PR", 4, 0, "auto_unroll_max_step$0"]]]], "r": [[0.00609981, 0.00611004, 0.00610537], 0, 21.4642, 1667958217], "v": "v0.6"}
{"i": [["[\"hfused_conv1x1_stride\", 1, 56, 56, 256, 8, 64, 2]", "cuda -keys=cuda,gpu -max_num_threads=1024 -model=unknown -thread_warp_size=32", [-1, 16, 64, 49152, 2147483647, 1024, 8, 32], "", 0, []], [[], [["CHW", 2, "local"], ["SP", 2, 0, 1, [1, 1, 1, 1], 1], ["SP", 2, 5, 64, [4, 1, 4, 4], 1], ["SP", 2, 10, 28, [1, 7, 4, 1], 1], ["SP", 2, 15, 28, [1, 14, 1, 1], 1], ["SP", 2, 20, 8, [1, 1, 2, 1], 1], ["SP", 2, 25, 256, [1, 2], 1], ["RE", 2, [0, 5, 10, 15, 20, 1, 6, 11, 16, 21, 2, 7, 12, 17, 22, 25, 26, 3, 8, 13, 18, 23, 27, 4, 9, 14, 19, 24]], ["FSP", 3, 0, 1, 3], ["FSP", 3, 4, 2, 3], ["FSP", 3, 8, 3, 3], ["FSP", 3, 12, 4, 3], ["FSP", 3, 16, 5, 3], ["RE", 3, [0, 4, 8, 12, 16, 1, 5, 9, 13, 17, 2, 6, 10, 14, 18, 3, 7, 11, 15, 19]], ["CA", 2, 3, 14], ["CHR", 1, "shared", [2]], ["CA", 2, 3, 15], ["CHR", 0, "shared", [3]], ["CA", 1, 4, 15], ["FU", 5, [0, 1, 2, 3, 4]], ["AN", 5, 0, 5], ["FU", 5, [1, 2, 3, 4, 5]], ["AN", 5, 1, 4], ["FU", 5, [2, 3, 4, 5, 6]], ["AN", 5, 2, 6], ["FU", 3, [0, 1, 2]], ["SP", 3, 0, 64, [1], 1], ["AN", 3, 1, 2], ["FFSP", 3, 0, [5, 4, 3, 2, 1], 1, 1], ["AN", 3, 1, 6], ["FU", 1, [0, 1, 2, 3]], ["SP", 1, 0, 14, [1], 1], ["AN", 1, 1, 2], ["FFSP", 1, 0, [5, 4, 3, 2, 1], 1, 1], ["AN", 1, 1, 6], ["PR", 4, 0, "auto_unroll_max_step$16"]]]], "r": [[0.00146749, 0.0014664, 0.0014667], 0, 18.9133, 1667958215], "v": "v0.6"}
{"i": [["[\"hfused_conv1x1_stride\", 1, 56, 56, 256, 8, 64, 2]", "cuda -keys=cuda,gpu -max_num_threads=1024 -model=unknown -thread_warp_size=32", [-1, 16, 64, 49152, 2147483647, 1024, 8, 32], "", 0, []], [[], [["CHW", 2, "local"], ["SP", 2, 0, 1, [1, 1, 1, 1], 1], ["SP", 2, 5, 64, [2, 16, 2, 1], 1], ["SP", 2, 10, 28, [1, 7, 1, 4], 1], ["SP", 2, 15, 28, [1, 2, 2, 1], 1], ["SP", 2, 20, 8, [1, 1, 1, 8], 1], ["SP", 2, 25, 256, [4, 1], 1], ["RE", 2, [0, 5, 10, 15, 20, 1, 6, 11, 16, 21, 2, 7, 12, 17, 22, 25, 26, 3, 8, 13, 18, 23, 27, 4, 9, 14, 19, 24]], ["FSP", 3, 0, 1, 3], ["FSP", 3, 4, 2, 3], ["FSP", 3, 8, 3, 3], ["FSP", 3, 12, 4, 3], ["FSP", 3, 16, 5, 3], ["RE", 3, [0, 4, 8, 12, 16, 1, 5, 9, 13, 17, 2, 6, 10, 14, 18, 3, 7, 11, 15, 19]], ["CA", 2, 3, 14], ["CHR", 1, "shared", [2]], ["CA", 2, 3, 15], ["CHR", 0, "shared", [3]], ["CA", 1, 4, 15], ["FU", 5, [0, 1, 2, 3, 4]], ["AN", 5, 0, 5], ["FU", 5, [1, 2, 3, 4, 5]], ["AN", 5, 1, 4], ["FU", 5, [2, 3, 4, 5, 6]], ["AN", 5, 2, 6], ["FU", 3, [0, 1, 2]], ["SP", 3, 0, 16, [1], 1], ["AN", 3, 1, 2], ["FFSP", 3, 0, [5, 4, 3, 2, 1], 1, 1], ["AN", 3, 1, 6], ["FU", 1, [0, 1, 2, 3]], ["SP", 1, 0, 84, [1], 1], ["AN", 1, 1, 2], ["FFSP", 1, 0, [5, 4, 3, 2, 1], 1, 1], ["AN", 1, 1, 6], ["PR", 4, 0, "auto_unroll_max_step$1024"]]]], "r": [[0.000687558, 0.00068775, 0.000687252], 0, 15.857, 1667958210], "v": "v0.6"}
{"i": [["[\"hfused_conv1x1_stride\", 1, 56, 56, 256, 8, 64, 2]", "cuda -keys=cuda,gpu -max_num_threads=1024 -model=unknown -thread_warp_size=32", [-1, 16, 64, 49152, 2147483647, 1024, 8, 32], "", 0, []], [[], [["CHW", 2, "local"], ["SP", 2, 0, 1, [1, 1, 1, 1], 1], ["SP", 2, 5, 64, [2, 4, 1, 2], 1], ["SP", 2, 10, 28, [2, 7, 1, 1], 1], ["SP", 2, 15, 28, [1, 1, 1, 1], 1], ["SP", 2, 20, 8, [2, 2, 1, 1], 1], ["SP", 2, 25, 256, [1, 1], 1], ["RE", 2, [0, 5, 10, 15, 20, 1, 6, 11, 16, 21, 2, 7, 12, 17, 22, 25, 26, 3, 8, 13, 18, 23, 27, 4, 9, 14, 19, 24]], ["FSP", 3, 0, 1, 3], ["FSP", 3, 4, 2, 3], ["FSP", 3, 8, 3, 3], ["FSP", 3, 12, 4, 3], ["FSP", 3, 16, 5, 3], ["RE", 3, [0, 4, 8, 12, 16, 1, 5, 9, 13, 17, 2, 6, 10, 14, 18, 3, 7, 11, 15, 19]], ["CA", 2, 3, 14], ["CHR", 1, "shared", [2]], ["CA", 2, 3, 15], ["CHR", 0, "shared", [3]], ["CA", 1, 4, 15], ["FU", 5, [0, 1, 2, 3, 4]], ["AN", 5, 0, 5], ["FU", 5, [1, 2, 3, 4, 5]], ["AN", 5, 1, 4], ["FU", 5, [2, 3, 4, 5, 6]], ["AN", 5, 2, 6], ["FU", 3, [0, 1, 2]], ["SP", 3, 0, 2, [1], 1], ["AN", 3, 1, 2], ["FFSP", 3, 0, [5, 4, 3, 2, 1], 1, 1], ["AN", 3, 1, 6], ["FU", 1, [0, 1, 2, 3]], ["SP", 1, 0, 1, [1], 1], ["AN", 1, 1, 2], ["FFSP", 1, 0, [5, 4, 3, 2, 1], 1, 1], ["AN", 1, 1, 6], ["PR", 4, 0, "auto_unroll_max_step$64"]]]], "r": [[8.8172e-05, 8.81118e-05, 8.81804e-05], 0, 14.2305, 1667958211], "v": "v0.6"}
{"i": [["[\"hfused_conv1x1_stride\", 1, 56, 56, 256, 8, 64, 2]", "cuda -keys=cuda,gpu -max_num_threads=1024 -model=unknown -thread_warp_size=32", [-1, 16, 64, 49152, 2147483647, 1024, 8, 32], "", 0, []], [[], [["CHW", 2, "local"], ["SP", 2, 0, 1, [1, 1, 1, 1], 1], ["SP", 2, 5, 64, [1, 1, 16, 4], 1], ["SP", 2, 10, 28, [1, 2, 2, 7], 1], ["SP", 2, 15, 28, [1, 1, 1, 4], 1], ["SP", 2, 20, 8, [1, 2, 2, 1], 1], ["SP", 2, 25, 256, [2, 8], 1], ["RE", 2, [0, 5, 10, 15, 20, 1, 6, 11, 16, 21, 2, 7, 12, 17, 22, 25, 26, 3, 8, 13, 18, 23, 27, 4, 9, 14, 19, 24]], ["FSP", 3, 0, 1, 3], ["FSP", 3, 4, 2, 3], ["FSP", 3, 8, 3, 3], ["FSP", 3, 12, 4, 3], ["FSP", 3, 16, 5, 3], ["RE", 3, [0, 4, 8, 12, 16, 1, 5, 9, 13, 17, 2, 6, 10, 14, 18, 3, 7, 11, 15, 19]], ["CA", 2, 3, 14], ["CHR", 1, "shared", [2]], ["CA", 2, 3, 15], ["CHR", 0, "shared", [3]], ["CA", 1, 4, 15], ["FU", 5, [0, 1, 2, 3, 4]], ["AN", 5, 0, 5], ["FU", 5, [1, 2, 3, 4, 5]], ["AN", 5, 1, 4], ["FU", 5, [2, 3, 4, 5, 6]], ["AN", 5, 2, 6], ["FU", 3, [0, 1, 2]], ["SP", 3, 0, 128, [1], 1], ["AN", 3, 1, 2], ["FFSP", 3, 0, [5, 4, 3, 2, 1], 1, 1], ["AN", 3, 1, 6], ["FU", 1, [0, 1, 2, 3]], ["SP", 1, 0, 432, [1], 1], ["AN", 1, 1, 2], ["FFSP", 1, 0, [5, 4, 3, 2, 1], 1, 1], ["AN", 1, 1, 6], ["PR", 4, 0, "auto_unroll_max_step$1024"]]]], "r": [[0.00727639, 0.00727971, 0.00727716], 0, 9.09703, 1667958198], "v": "v0.6"}
{"i": [["[\"hfused_conv1x1_stride\", 1, 56, 56, 256, 8, 64, 2]", "cuda -keys=cuda,gpu -max_num_threads=1024 -model=unknown -thread_warp_size=32", [-1, 16, 64, 49152, 2147483647, 1024, 8, 32], "", 0, []], [[], [["CHW", 2, "local"], ["SP", 2, 0, 1, [1, 1, 1, 1], 1], ["SP", 2, 5, 64, [4, 2, 4, 1], 1], ["SP", 2, 10, 28, [1, 7, 4, 1], 1], ["SP", 2, 15, 28, [1, 14, 1, 1], 1], ["SP", 2, 20, 8, [1, 1, 1, 2], 1], ["SP", 2, 25, 256, [1, 2], 1], ["RE", 2, [0, 5, 10, 15, 20, 1, 6, 11, 16, 21, 2, 7, 12, 17, 22, 25, 26, 3, 8, 13, 18, 23, 27, 4, 9, 14, 19, 24]], ["FSP", 3, 0, 1, 3], ["FSP", 3, 4, 2, 3], ["FSP", 3, 8, 3, 3], ["FSP", 3, 12, 4, 3], ["FSP", 3, 16, 5, 3], ["RE", 3, [0, 4, 8, 12, 16, 1, 5, 9, 13, 17, 2, 6, 10, 14, 18, 3, 7, 11, 15, 19]], ["CA", 2, 3, 14], ["CHR", 1, "shared", [2]], ["CA", 2, 3, 15], ["CHR", 0, "shared", [3]], ["CA", 1, 4, 15], ["FU", 5, [0, 1, 2, 3, 4]], ["AN", 5, 0, 5], ["FU", 5, [1, 2, 3, 4, 5]], ["AN", 5, 1, 4], ["FU", 5, [2, 3, 4, 5, 6]], ["AN", 5, 2, 6], ["FU", 3, [0, 1, 2]], ["SP", 3, 0, 64, [1], 1], ["AN", 3, 1, 2], ["FFSP", 3, 0, [5, 4, 3, 2, 1], 1, 1], ["AN", 3, 1, 6], ["FU", 1, [0, 1, 2, 3]], ["SP", 1, 0, 14, [1], 1], ["AN", 1, 1, 2], ["FFSP", 1, 0, [5, 4, 3, 2, 1], 1, 1], ["AN", 1, 1, 6], ["PR", 4, 0, "auto_unroll_max_step$16"]]]], "r": [[0.000319583, 0.000319456, 0.000319231], 0, 9.29377, 1667958206], "v": "v0.6"}
{"i": [["[\"hfused_conv1x1_stride\", 1, 56, 56, 256, 8, 64, 2]", "cuda -keys=cuda,gpu -max_num_threads=1024 -model=unknown -thread_warp_size=32", [-1, 16, 64, 49152, 2147483647, 1024, 8, 32], "", 0, []], [[], [["CHW", 2, "local"], ["SP", 2, 0, 1, [1, 1, 1, 1], 1], ["SP", 2, 5, 64, [2, 8, 2, 1], 1], ["SP", 2, 10, 28, [1, 7, 1, 2], 1], ["SP", 2, 15, 28, [2, 1, 2, 7], 1], ["SP", 2, 20, 8, [2, 2, 1, 1], 1], ["SP", 2, 25, 256, [2, 1], 1], ["RE", 2, [0, 5, 10, 15, 20, 1, 6, 11, 16, 21, 2, 7, 12, 17, 22, 25, 26, 3, 8, 13, 18, 23, 27, 4, 9, 14, 19, 24]], ["FSP", 3, 0, 1, 3], ["FSP", 3, 4, 2, 3], ["FSP", 3, 8, 3, 3], ["FSP", 3, 12, 4, 3], ["FSP", 3, 16, 5, 3], ["RE", 3, [0, 4, 8, 12, 16, 1, 5, 9, 13, 17, 2, 6, 10, 14, 18, 3, 7, 11, 15, 19]], ["CA", 2, 3, 14], ["CHR", 1, "shared", [2]], ["CA", 2, 3, 15], ["CHR", 0, "shared", [3]], ["CA", 1, 4, 15], ["FU", 5, [0, 1, 2, 3, 4]], ["AN", 5, 0, 5], ["FU", 5, [1, 2, 3, 4, 5]], ["AN", 5, 1, 4], ["FU", 5, [2, 3, 4, 5, 6]], ["AN", 5, 2, 6], ["FU", 3, [0, 1, 2]], ["SP", 3, 0, 8, [1], 1], ["AN", 3, 1, 2], ["FFSP", 3, 0, [5, 4, 3, 2, 1], 1, 1], ["AN", 3, 1, 6], ["FU", 1, [0, 1, 2, 3]], ["SP", 1, 0, 162, [1], 1], ["AN", 1, 1, 2], ["FFSP", 1, 0, [5, 4, 3, 2, 1], 1, 1], ["AN", 1, 1, 6], ["PR", 4, 0, "auto_unroll_max_step$64"]]]], "r": [[0.00193518, 0.00193346, 0.00193237], 0, 4.4737, 1667958199], "v": "v0.6"}
{"i": [["[\"hfused_conv1x1_stride\", 1, 56, 56, 256, 8, 64, 2]", "cuda -keys=cuda,gpu -max_num_threads=1024 -model=unknown -thread_warp_size=32", [-1, 16, 64, 49152, 2147483647, 1024, 8, 32], "", 0, []], [[], [["CHW", 2, "local"], ["SP", 2, 0, 1, [1, 1, 1, 1], 1], ["SP", 2, 5, 64, [2, 4, 4, 2], 1], ["SP", 2, 10, 28, [1, 1, 1, 28], 1], ["SP", 2, 15, 28, [2, 1, 1, 2], 1], ["SP", 2, 20, 8, [1, 4, 1, 1], 1], ["SP", 2, 25, 256, [1, 2], 1], ["RE", 2, [0, 5, 10, 15, 20, 1, 6, 11, 16, 21, 2, 7, 12, 17, 22, 25, 26, 3, 8, 13, 18, 23, 27, 4, 9, 14, 19, 24]], ["FSP", 3, 0, 1, 3], ["FSP", 3, 4, 2, 3], ["FSP", 3, 8, 3, 3], ["FSP", 3, 12, 4, 3], ["FSP", 3, 16, 5, 3], ["RE", 3, [0, 4, 8, 12, 16, 1, 5, 9, 13, 17, 2, 6, 10, 14, 18, 3, 7, 11, 15, 19]], ["CA", 2, 3, 14], ["CHR", 1, "shared", [2]], ["CA", 2, 3, 15], ["CHR", 0, "shared", [3]], ["CA", 1, 4, 15], ["FU", 5, [0, 1, 2, 3, 4]], ["AN", 5, 0, 5], ["FU", 5, [1, 2, 3, 4, 5]], ["AN", 5, 1, 4], ["FU", 5, [2, 3, 4, 5, 6]], ["AN", 5, 2, 6], ["FU", 3, [0, 1, 2]], ["SP", 3, 0, 64, [1], 1], ["AN", 3, 1, 2], ["FFSP", 3, 0, [5, 4, 3, 2, 1], 1, 1], ["AN", 3, 1, 6], ["FU", 1, [0, 1, 2, 3]], ["SP", 1, 0, 168, [1], 1], ["AN", 1, 1, 2], ["FFSP", 1, 0, [5, 4, 3, 2, 1], 1, 1], ["AN", 1, 1, 6], ["PR", 4, 0, "auto_unroll_max_step$1024"]]]], "r": [[0.0105421, 0.0105481, 0.0105189], 0, 27.1007, 1667958218], "v": "v0.6"}
{"i": [["[\"hfused_conv1x1_stride\", 1, 56, 56, 256, 8, 64, 2]", "cuda -keys=cuda,gpu -max_num_threads=1024 -model=unknown -thread_warp_size=32", [-1, 16, 64, 49152, 2147483647, 1024, 8, 32], "", 0, []], [[], [["CHW", 2, "local"], ["SP", 2, 0, 1, [1, 1, 1, 1], 1], ["SP", 2, 5, 64, [4, 1, 4, 4], 1], ["SP", 2, 10, 28, [1, 7, 4, 1], 1], ["SP", 2, 15, 28, [1, 2, 7, 1], 1], ["SP", 2, 20, 8, [1, 1, 2, 1], 1], ["SP", 2, 25, 256, [1, 2], 1], ["RE", 2, [0, 5, 10, 15, 20, 1, 6, 11, 16, 21, 2, 7, 12, 17, 22, 25, 26, 3, 8, 13, 18, 23, 27, 4, 9, 14, 19, 24]], ["FSP", 3, 0, 1, 3], ["FSP", 3, 4, 2, 3], ["FSP", 3, 8, 3, 3], ["FSP", 3, 12, 4, 3], ["FSP", 3, 16, 5, 3], ["RE", 3, [0, 4, 8, 12, 16, 1, 5, 9, 13, 17, 2, 6, 10, 14, 18, 3, 7, 11, 15, 19]], ["CA", 2, 3, 14], ["CHR", 1, "shared", [2]], ["CA", 2, 3, 15], ["CHR", 0, "shared", [3]], ["CA", 1, 4, 15], ["FU", 5, [0, 1, 2, 3, 4]], ["AN", 5, 0, 5], ["FU", 5, [1, 2, 3, 4, 5]], ["AN", 5, 1, 4], ["FU", 5, [2, 3, 4, 5, 6]], ["AN", 5, 2, 6], ["FU", 3, [0, 1, 2]], ["SP", 3, 0, 64, [1], 1], ["AN", 3, 1, 2], ["FFSP", 3, 0, [5, 4, 3, 2, 1], 1, 1], ["AN", 3, 1, 6], ["FU", 1, [0, 1, 2, 3]], ["SP", 1, 0, 14, [1], 1], ["AN", 1, 1, 2], ["FFSP", 1, 0, [5, 4, 3, 2, 1], 1, 1], ["AN", 1, 1, 6], ["PR", 4, 0, "auto_unroll_max_step$16"]]]], "r": [[0.0087163, 0.00869656, 0.00868804], 0, 16.419, 1667958212], "v": "v0.6"}
{"i": [["[\"hfused_conv1x1_stride\", 1, 56, 56, 256, 8, 64, 2]", "cuda -keys=cuda,gpu -max_num_threads=1024 -model=unknown -thread_warp_size=32", [-1, 16, 64, 49152, 2147483647, 1024, 8, 32], "", 0, []], [[], [["CHW", 2, "local"], ["SP", 2, 0, 1, [1, 1, 1, 1], 1], ["SP", 2, 5, 64, [1, 1, 8, 1], 1], ["SP", 2, 10, 28, [1, 28, 1, 1], 1], ["SP", 2, 15, 28, [1, 7, 2, 1], 1], ["SP", 2, 20, 8, [2, 1, 1, 1], 1], ["SP", 2, 25, 256, [2, 2], 1], ["RE", 2, [0, 5, 10, 15, 20, 1, 6, 11, 16, 21, 2, 7, 12, 17, 22, 25, 26, 3, 8, 13, 18, 23, 27, 4, 9, 14, 19, 24]], ["FSP", 3, 0, 1, 3], ["FSP", 3, 4, 2, 3], ["FSP", 3, 8, 3, 3], ["FSP", 3, 12, 4, 3], ["FSP", 3, 16, 5, 3], ["RE", 3, [0, 4, 8, 12, 16, 1, 5, 9, 13, 17, 2, 6, 10, 14, 18, 3, 7, 11, 15, 19]], ["CA", 2, 3, 14], ["CHR", 1, "shared", [2]], ["CA", 2, 3, 15], ["CHR", 0, "shared", [3]], ["CA", 1, 4, 15], ["FU", 5, [0, 1, 2, 3, 4]], ["AN", 5, 0, 5], ["FU", 5, [1, 2, 3, 4, 5]], ["AN", 5, 1, 4], ["FU", 5, [2, 3, 4, 5, 6]], ["AN", 5, 2, 6], ["FU", 3, [0, 1, 2]], ["SP", 3, 0, 64, [4], 1], ["AN", 3, 1, 2], ["FFSP", 3, 0, [5, 4, 3, 2, 1], 1, 1], ["AN", 3, 1, 6], ["FU", 1, [0, 1, 2, 3]], ["SP", 1, 0, 24, [1], 1], ["AN", 1, 1, 2], ["FFSP", 1, 0, [5, 4, 3, 2, 1], 1, 1], ["AN", 1, 1, 6], ["PR", 4, 0, "auto_unroll_max_step$16"]]]], "r": [[0.000319054, 0.000319002, 0.000318977], 0, 19.599, 1667958216], "v": "v0.6"}
{"i": [["[\"hfused_conv1x1_stride\", 1, 56, 56, 256, 8, 64, 2]", "cuda -keys=cuda,gpu -max_num_threads=1024 -model=unknown -thread_warp_size=32", [-1, 16, 64, 49152, 2147483647, 1024, 8, 32], "", 0, []], [[], [["CHW", 2, "local"], ["SP", 2, 0, 1, [1, 1, 1, 1], 1], ["SP", 2, 5, 64, [2, 2, 4, 2], 1], ["SP", 2, 10, 28, [1, 4, 1, 1], 1], ["SP", 2, 15, 28, [1, 1, 4, 1], 1], ["SP", 2, 20, 8, [1, 2, 1, 2], 1], ["SP", 2, 25, 256, [2, 2], 1], ["RE", 2, [0, 5, 10, 15, 20, 1, 6, 11, 16, 21, 2, 7, 12, 17, 22, 25, 26, 3, 8, 13, 18, 23, 27, 4, 9, 14, 19, 24]], ["FSP", 3, 0, 1, 3], ["FSP", 3, 4, 2, 3], ["FSP", 3, 8, 3, 3], ["FSP", 3, 12, 4, 3], ["FSP", 3, 16, 5, 3], ["RE", 3, [0, 4, 8, 12, 16, 1, 5, 9, 13, 17, 2, 6, 10, 14, 18, 3, 7, 11, 15, 19]], ["CA", 2, 3, 14], ["CHR", 1, "shared", [2]], ["CA", 2, 3, 15], ["CHR", 0, "shared", [3]], ["CA", 1, 4, 15], ["FU", 5, [0, 1, 2, 3, 4]], ["AN", 5, 0, 5], ["FU", 5, [1, 2, 3, 4, 5]], ["AN", 5, 1, 4], ["FU", 5, [2, 3, 4, 5, 6]], ["AN", 5, 2, 6], ["FU", 3, [0, 1, 2]], ["SP", 3, 0, 32, [1], 1], ["AN", 3, 1, 2], ["FFSP", 3, 0, [5, 4, 3, 2, 1], 1, 1], ["AN", 3, 1, 6], ["FU", 1, [0, 1, 2, 3]], ["SP", 1, 0, 6, [1], 1], ["AN", 1, 1, 2], ["FFSP", 1, 0, [5, 4, 3, 2, 1], 1, 1], ["AN", 1, 1, 6], ["PR", 4, 0, "auto_unroll_max_step$16"]]]], "r": [[9.52452e-05, 9.51852e-05, 9.52525e-05], 0, 24.8783, 1667958221], "v": "v0.6"}
{"i": [["[\"hfused_conv1x1_stride\", 1, 56, 56, 256, 8, 64, 2]", "cuda -keys=cuda,gpu -max_num_threads=1024 -model=unknown -thread_warp_size=32", [-1, 16, 64, 49152, 2147483647, 1024, 8, 32], "", 0, []], [[], [["CHW", 2, "local"], ["SP", 2, 0, 1, [1, 1, 1, 1], 1], ["SP", 2, 5, 64, [4, 1, 4, 2], 1], ["SP", 2, 10, 28, [2, 7, 1, 2], 1], ["SP", 2, 15, 28, [1, 7, 1, 2], 1], ["SP", 2, 20, 8, [1, 1, 8, 1], 1], ["SP", 2, 25, 256, [1, 1], 1], ["RE", 2, [0, 5, 10, 15, 20, 1, 6, 11, 16, 21, 2, 7, 12, 17, 22, 25, 26, 3, 8, 13, 18, 23, 27, 4, 9, 14, 19, 24]], ["FSP", 3, 0, 1, 3], ["FSP", 3, 4, 2, 3], ["FSP", 3, 8, 3, 3], ["FSP", 3, 12, 4, 3], ["FSP", 3, 16, 5, 3], ["RE", 3, [0, 4, 8, 12, 16, 1, 5, 9, 13, 17, 2, 6, 10, 14, 18, 3, 7, 11, 15, 19]], ["CA", 2, 3, 14], ["CHR", 1, "shared", [2]], ["CA", 2, 3, 15], ["CHR", 0, "shared", [3]], ["CA", 1, 4, 15], ["FU", 5, [0, 1, 2, 3, 4]], ["AN", 5, 0, 5], ["FU", 5, [1, 2, 3, 4, 5]], ["AN", 5, 1, 4], ["FU", 5, [2, 3, 4, 5, 6]], ["AN", 5, 2, 6], ["FU", 3, [0, 1, 2]], ["SP", 3, 0, 8, [1], 1], ["AN", 3, 1, 2], ["FFSP", 3, 0, [5, 4, 3, 2, 1], 1, 1], ["AN", 3, 1, 6], ["FU", 1, [0, 1, 2, 3]], ["SP", 1, 0, 9, [9], 1], ["AN", 1, 1, 2], ["FFSP", 1, 0, [5, 4, 3, 2, 1], 1, 1], ["AN", 1, 1, 6], ["PR", 4, 0, "auto_unroll_max_step$64"]]]], "r": [[0.015186, 0.0151769, 0.0152088], 0, 23.9313, 1667958219], "v": "v0.6"}
{"i": [["[\"hfused_conv1x1_stride\", 1, 56, 56, 256, 8, 64, 2]", "cuda -keys=cuda,gpu -max_num_threads=1024 -model=unknown -thread_warp_size=32", [-1, 16, 64, 49152, 2147483647, 1024, 8, 32], "", 0, []], [[], [["CHW", 2, "local"], ["SP", 2, 0, 1, [1, 1, 1, 1], 1], ["SP", 2, 5, 64, [2, 4, 1, 8], 1], ["SP", 2, 10, 28, [1, 28, 1, 1], 1], ["SP", 2, 15, 28, [2, 1, 2, 1], 1], ["SP", 2, 20, 8, [1, 8, 1, 1], 1], ["SP", 2, 25, 256, [4, 1], 1], ["RE", 2, [0, 5, 10, 15, 20, 1, 6, 11, 16, 21, 2, 7, 12, 17, 22, 25, 26, 3, 8, 13, 18, 23, 27, 4, 9, 14, 19, 24]], ["FSP", 3, 0, 1, 3], ["FSP", 3, 4, 2, 3], ["FSP", 3, 8, 3, 3], ["FSP", 3, 12, 4, 3], ["FSP", 3, 16, 5, 3], ["RE", 3, [0, 4, 8, 12, 16, 1, 5, 9, 13, 17, 2, 6, 10, 14, 18, 3, 7, 11, 15, 19]], ["CA", 2, 3, 14], ["CHR", 1, "shared", [2]], ["CA", 2, 3, 15], ["CHR", 0, "shared", [3]], ["CA", 1, 4, 15], ["FU", 5, [0, 1, 2, 3, 4]], ["AN", 5, 0, 5], ["FU", 5, [1, 2, 3, 4, 5]], ["AN", 5, 1, 4], ["FU", 5, [2, 3, 4, 5, 6]], ["AN", 5, 2, 6], ["FU", 3, [0, 1, 2]], ["SP", 3, 0, 32, [16], 1], ["AN", 3, 1, 2], ["FFSP", 3, 0, [5, 4, 3, 2, 1], 1, 1], ["AN", 3, 1, 6], ["FU", 1, [0, 1, 2, 3]], ["SP", 1, 0, 12, [1], 1], ["AN", 1, 1, 2], ["FFSP", 1, 0, [5, 4, 3, 2, 1], 1, 1], ["AN", 1, 1, 6], ["PR", 4, 0, "auto_unroll_max_step$16"]]]], "r": [[0.000350823, 0.000350703, 0.000350716], 0, 24.9888, 1667958221], "v": "v0.6"}
