python/models/resnext/ResNextHorizontal_kernel_configs/resnext_imagenet_50_hfused_conv1x1_stride_1_7_7_2048_32_64_s1.log
{"i": [["[\"hfused_conv1x1_stride\", 1, 7, 7, 2048, 32, 64, 1]", "cuda -keys=cuda,gpu -max_num_threads=1024 -model=unknown -thread_warp_size=32", [-1, 16, 64, 49152, 2147483647, 1024, 8, 32], "", 0, []], [[], [["CHW", 2, "local"], ["SP", 2, 0, 1, [1, 1, 1, 1], 1], ["SP", 2, 5, 64, [1, 8, 2, 4], 1], ["SP", 2, 10, 7, [1, 7, 1, 1], 1], ["SP", 2, 15, 7, [1, 7, 1, 1], 1], ["SP", 2, 20, 32, [2, 2, 2, 1], 1], ["SP", 2, 25, 2048, [2, 4], 1], ["RE", 2, [0, 5, 10, 15, 20, 1, 6, 11, 16, 21, 2, 7, 12, 17, 22, 25, 26, 3, 8, 13, 18, 23, 27, 4, 9, 14, 19, 24]], ["FSP", 3, 0, 1, 3], ["FSP", 3, 4, 2, 3], ["FSP", 3, 8, 3, 3], ["FSP", 3, 12, 4, 3], ["FSP", 3, 16, 5, 3], ["RE", 3, [0, 4, 8, 12, 16, 1, 5, 9, 13, 17, 2, 6, 10, 14, 18, 3, 7, 11, 15, 19]], ["CA", 2, 3, 14], ["CHR", 1, "shared", [2]], ["CA", 2, 3, 15], ["CHR", 0, "shared", [3]], ["CA", 1, 4, 15], ["FU", 5, [0, 1, 2, 3, 4]], ["AN", 5, 0, 5], ["FU", 5, [1, 2, 3, 4, 5]], ["AN", 5, 1, 4], ["FU", 5, [2, 3, 4, 5, 6]], ["AN", 5, 2, 6], ["FU", 3, [0, 1, 2]], ["SP", 3, 0, 128, [16], 1], ["AN", 3, 1, 2], ["FFSP", 3, 0, [5, 4, 3, 2, 1], 1, 1], ["AN", 3, 1, 6], ["FU", 1, [0, 1, 2, 3]], ["SP", 1, 0, 8, [1], 1], ["AN", 1, 1, 2], ["FFSP", 1, 0, [5, 4, 3, 2, 1], 1, 1], ["AN", 1, 1, 6], ["PR", 4, 0, "auto_unroll_max_step$512"]]]], "r": [[0.00199125, 0.00199058, 0.00198986], 0, 4.55934, 1667897669], "v": "v0.6"}
{"i": [["[\"hfused_conv1x1_stride\", 1, 7, 7, 2048, 32, 64, 1]", "cuda -keys=cuda,gpu -max_num_threads=1024 -model=unknown -thread_warp_size=32", [-1, 16, 64, 49152, 2147483647, 1024, 8, 32], "", 0, []], [[], [["CHW", 2, "local"], ["SP", 2, 0, 1, [1, 1, 1, 1], 1], ["SP", 2, 5, 64, [1, 1, 64, 1], 1], ["SP", 2, 10, 7, [1, 1, 1, 1], 1], ["SP", 2, 15, 7, [1, 1, 1, 7], 1], ["SP", 2, 20, 32, [4, 8, 1, 1], 1], ["SP", 2, 25, 2048, [1, 2], 1], ["RE", 2, [0, 5, 10, 15, 20, 1, 6, 11, 16, 21, 2, 7, 12, 17, 22, 25, 26, 3, 8, 13, 18, 23, 27, 4, 9, 14, 19, 24]], ["FSP", 3, 0, 1, 3], ["FSP", 3, 4, 2, 3], ["FSP", 3, 8, 3, 3], ["FSP", 3, 12, 4, 3], ["FSP", 3, 16, 5, 3], ["RE", 3, [0, 4, 8, 12, 16, 1, 5, 9, 13, 17, 2, 6, 10, 14, 18, 3, 7, 11, 15, 19]], ["CA", 2, 3, 14], ["CHR", 1, "shared", [2]], ["CA", 2, 3, 15], ["CHR", 0, "shared", [3]], ["CA", 1, 4, 15], ["FU", 5, [0, 1, 2, 3, 4]], ["AN", 5, 0, 5], ["FU", 5, [1, 2, 3, 4, 5]], ["AN", 5, 1, 4], ["FU", 5, [2, 3, 4, 5, 6]], ["AN", 5, 2, 6], ["FU", 3, [0, 1, 2]], ["SP", 3, 0, 64, [1], 1], ["AN", 3, 1, 2], ["FFSP", 3, 0, [5, 4, 3, 2, 1], 1, 1], ["AN", 3, 1, 6], ["FU", 1, [0, 1, 2, 3]], ["SP", 1, 0, 2, [1], 1], ["AN", 1, 1, 2], ["FFSP", 1, 0, [5, 4, 3, 2, 1], 1, 1], ["AN", 1, 1, 6], ["PR", 4, 0, "auto_unroll_max_step$512"]]]], "r": [[0.031505, 0.031485, 0.0314334], 0, 6.85453, 1667897668], "v": "v0.6"}
{"i": [["[\"hfused_conv1x1_stride\", 1, 7, 7, 2048, 32, 64, 1]", "cuda -keys=cuda,gpu -max_num_threads=1024 -model=unknown -thread_warp_size=32", [-1, 16, 64, 49152, 2147483647, 1024, 8, 32], "", 0, []], [[], [["CHW", 2, "local"], ["SP", 2, 0, 1, [1, 1, 1, 1], 1], ["SP", 2, 5, 64, [1, 8, 2, 2], 1], ["SP", 2, 10, 7, [1, 1, 7, 1], 1], ["SP", 2, 15, 7, [1, 7, 1, 1], 1], ["SP", 2, 20, 32, [1, 2, 1, 8], 1], ["SP", 2, 25, 2048, [2, 4], 1], ["RE", 2, [0, 5, 10, 15, 20, 1, 6, 11, 16, 21, 2, 7, 12, 17, 22, 25, 26, 3, 8, 13, 18, 23, 27, 4, 9, 14, 19, 24]], ["FSP", 3, 0, 1, 3], ["FSP", 3, 4, 2, 3], ["FSP", 3, 8, 3, 3], ["FSP", 3, 12, 4, 3], ["FSP", 3, 16, 5, 3], ["RE", 3, [0, 4, 8, 12, 16, 1, 5, 9, 13, 17, 2, 6, 10, 14, 18, 3, 7, 11, 15, 19]], ["CA", 2, 3, 14], ["CHR", 1, "shared", [2]], ["CA", 2, 3, 15], ["CHR", 0, "shared", [3]], ["CA", 1, 4, 15], ["FU", 5, [0, 1, 2, 3, 4]], ["AN", 5, 0, 5], ["FU", 5, [1, 2, 3, 4, 5]], ["AN", 5, 1, 4], ["FU", 5, [2, 3, 4, 5, 6]], ["AN", 5, 2, 6], ["FU", 3, [0, 1, 2]], ["SP", 3, 0, 128, [1], 1], ["AN", 3, 1, 2], ["FFSP", 3, 0, [5, 4, 3, 2, 1], 1, 1], ["AN", 3, 1, 6], ["FU", 1, [0, 1, 2, 3]], ["SP", 1, 0, 56, [1], 1], ["AN", 1, 1, 2], ["FFSP", 1, 0, [5, 4, 3, 2, 1], 1, 1], ["AN", 1, 1, 6], ["PR", 4, 0, "auto_unroll_max_step$512"]]]], "r": [[0.00173011, 0.00173392, 0.00173053], 0, 3.83175, 1667897667], "v": "v0.6"}
{"i": [["[\"hfused_conv1x1_stride\", 1, 7, 7, 2048, 32, 64, 1]", "cuda -keys=cuda,gpu -max_num_threads=1024 -model=unknown -thread_warp_size=32", [-1, 16, 64, 49152, 2147483647, 1024, 8, 32], "", 0, []], [[], [["CHW", 2, "local"], ["SP", 2, 0, 1, [1, 1, 1, 1], 1], ["SP", 2, 5, 64, [1, 2, 1, 16], 1], ["SP", 2, 10, 7, [1, 7, 1, 1], 1], ["SP", 2, 15, 7, [1, 7, 1, 1], 1], ["SP", 2, 20, 32, [2, 1, 1, 4], 1], ["SP", 2, 25, 2048, [16, 1], 1], ["RE", 2, [0, 5, 10, 15, 20, 1, 6, 11, 16, 21, 2, 7, 12, 17, 22, 25, 26, 3, 8, 13, 18, 23, 27, 4, 9, 14, 19, 24]], ["FSP", 3, 0, 1, 3], ["FSP", 3, 4, 2, 3], ["FSP", 3, 8, 3, 3], ["FSP", 3, 12, 4, 3], ["FSP", 3, 16, 5, 3], ["RE", 3, [0, 4, 8, 12, 16, 1, 5, 9, 13, 17, 2, 6, 10, 14, 18, 3, 7, 11, 15, 19]], ["CA", 2, 3, 14], ["CHR", 1, "shared", [2]], ["CA", 2, 3, 15], ["CHR", 0, "shared", [3]], ["CA", 1, 4, 15], ["FU", 5, [0, 1, 2, 3, 4]], ["AN", 5, 0, 5], ["FU", 5, [1, 2, 3, 4, 5]], ["AN", 5, 1, 4], ["FU", 5, [2, 3, 4, 5, 6]], ["AN", 5, 2, 6], ["FU", 3, [0, 1, 2]], ["SP", 3, 0, 1024, [1], 1], ["AN", 3, 1, 2], ["FFSP", 3, 0, [5, 4, 3, 2, 1], 1, 1], ["AN", 3, 1, 6], ["FU", 1, [0, 1, 2, 3]], ["SP", 1, 0, 16, [2], 1], ["AN", 1, 1, 2], ["FFSP", 1, 0, [5, 4, 3, 2, 1], 1, 1], ["AN", 1, 1, 6], ["PR", 4, 0, "auto_unroll_max_step$512"]]]], "r": [[0.000863823, 0.000863163, 0.000863471], 0, 5.19046, 1667897669], "v": "v0.6"}
{"i": [["[\"hfused_conv1x1_stride\", 1, 7, 7, 2048, 32, 64, 1]", "cuda -keys=cuda,gpu -max_num_threads=1024 -model=unknown -thread_warp_size=32", [-1, 16, 64, 49152, 2147483647, 1024, 8, 32], "", 0, []], [[], [["CHW", 2, "local"], ["SP", 2, 0, 1, [1, 1, 1, 1], 1], ["SP", 2, 5, 64, [1, 32, 1, 2], 1], ["SP", 2, 10, 7, [1, 1, 1, 1], 1], ["SP", 2, 15, 7, [1, 1, 1, 7], 1], ["SP", 2, 20, 32, [1, 1, 8, 2], 1], ["SP", 2, 25, 2048, [4, 2], 1], ["RE", 2, [0, 5, 10, 15, 20, 1, 6, 11, 16, 21, 2, 7, 12, 17, 22, 25, 26, 3, 8, 13, 18, 23, 27, 4, 9, 14, 19, 24]], ["FSP", 3, 0, 1, 3], ["FSP", 3, 4, 2, 3], ["FSP", 3, 8, 3, 3], ["FSP", 3, 12, 4, 3], ["FSP", 3, 16, 5, 3], ["RE", 3, [0, 4, 8, 12, 16, 1, 5, 9, 13, 17, 2, 6, 10, 14, 18, 3, 7, 11, 15, 19]], ["CA", 2, 3, 14], ["CHR", 1, "shared", [2]], ["CA", 2, 3, 15], ["CHR", 0, "shared", [3]], ["CA", 1, 4, 15], ["FU", 5, [0, 1, 2, 3, 4]], ["AN", 5, 0, 5], ["FU", 5, [1, 2, 3, 4, 5]], ["AN", 5, 1, 4], ["FU", 5, [2, 3, 4, 5, 6]], ["AN", 5, 2, 6], ["FU", 3, [0, 1, 2]], ["SP", 3, 0, 256, [1], 1], ["AN", 3, 1, 2], ["FFSP", 3, 0, [5, 4, 3, 2, 1], 1, 1], ["AN", 3, 1, 6], ["FU", 1, [0, 1, 2, 3]], ["SP", 1, 0, 56, [1], 1], ["AN", 1, 1, 2], ["FFSP", 1, 0, [5, 4, 3, 2, 1], 1, 1], ["AN", 1, 1, 6], ["PR", 4, 0, "auto_unroll_max_step$64"]]]], "r": [[0.00309127, 0.00309141, 0.00309158], 0, 5.88156, 1667897670], "v": "v0.6"}
{"i": [["[\"hfused_conv1x1_stride\", 1, 7, 7, 2048, 32, 64, 1]", "cuda -keys=cuda,gpu -max_num_threads=1024 -model=unknown -thread_warp_size=32", [-1, 16, 64, 49152, 2147483647, 1024, 8, 32], "", 0, []], [[], [["CHW", 2, "local"], ["SP", 2, 0, 1, [1, 1, 1, 1], 1], ["SP", 2, 5, 64, [1, 4, 1, 16], 1], ["SP", 2, 10, 7, [1, 7, 1, 1], 1], ["SP", 2, 15, 7, [1, 7, 1, 1], 1], ["SP", 2, 20, 32, [2, 1, 1, 4], 1], ["SP", 2, 25, 2048, [16, 1], 1], ["RE", 2, [0, 5, 10, 15, 20, 1, 6, 11, 16, 21, 2, 7, 12, 17, 22, 25, 26, 3, 8, 13, 18, 23, 27, 4, 9, 14, 19, 24]], ["FSP", 3, 0, 1, 3], ["FSP", 3, 4, 2, 3], ["FSP", 3, 8, 3, 3], ["FSP", 3, 12, 4, 3], ["FSP", 3, 16, 5, 3], ["RE", 3, [0, 4, 8, 12, 16, 1, 5, 9, 13, 17, 2, 6, 10, 14, 18, 3, 7, 11, 15, 19]], ["CA", 2, 3, 14], ["CHR", 1, "shared", [2]], ["CA", 2, 3, 15], ["CHR", 0, "shared", [3]], ["CA", 1, 4, 15], ["FU", 5, [0, 1, 2, 3, 4]], ["AN", 5, 0, 5], ["FU", 5, [1, 2, 3, 4, 5]], ["AN", 5, 1, 4], ["FU", 5, [2, 3, 4, 5, 6]], ["AN", 5, 2, 6], ["FU", 3, [0, 1, 2]], ["SP", 3, 0, 1024, [1], 1], ["AN", 3, 1, 2], ["FFSP", 3, 0, [5, 4, 3, 2, 1], 1, 1], ["AN", 3, 1, 6], ["FU", 1, [0, 1, 2, 3]], ["SP", 1, 0, 16, [1], 1], ["AN", 1, 1, 2], ["FFSP", 1, 0, [5, 4, 3, 2, 1], 1, 1], ["AN", 1, 1, 6], ["PR", 4, 0, "auto_unroll_max_step$512"]]]], "r": [[0.00137447, 0.00137515, 0.00137371], 0, 2.28347, 1667897666], "v": "v0.6"}
{"i": [["[\"hfused_conv1x1_stride\", 1, 7, 7, 2048, 32, 64, 1]", "cuda -keys=cuda,gpu -max_num_threads=1024 -model=unknown -thread_warp_size=32", [-1, 16, 64, 49152, 2147483647, 1024, 8, 32], "", 0, []], [[], [["CHW", 2, "local"], ["SP", 2, 0, 1, [1, 1, 1, 1], 1], ["SP", 2, 5, 64, [1, 32, 1, 2], 1], ["SP", 2, 10, 7, [1, 1, 1, 1], 1], ["SP", 2, 15, 7, [1, 1, 1, 1], 1], ["SP", 2, 20, 32, [1, 1, 8, 2], 1], ["SP", 2, 25, 2048, [4, 2], 1], ["RE", 2, [0, 5, 10, 15, 20, 1, 6, 11, 16, 21, 2, 7, 12, 17, 22, 25, 26, 3, 8, 13, 18, 23, 27, 4, 9, 14, 19, 24]], ["FSP", 3, 0, 1, 3], ["FSP", 3, 4, 2, 3], ["FSP", 3, 8, 3, 3], ["FSP", 3, 12, 4, 3], ["FSP", 3, 16, 5, 3], ["RE", 3, [0, 4, 8, 12, 16, 1, 5, 9, 13, 17, 2, 6, 10, 14, 18, 3, 7, 11, 15, 19]], ["CA", 2, 3, 14], ["CHR", 1, "shared", [2]], ["CA", 2, 3, 15], ["CHR", 0, "shared", [3]], ["CA", 1, 4, 15], ["FU", 5, [0, 1, 2, 3, 4]], ["AN", 5, 0, 5], ["FU", 5, [1, 2, 3, 4, 5]], ["AN", 5, 1, 4], ["FU", 5, [2, 3, 4, 5, 6]], ["AN", 5, 2, 6], ["FU", 3, [0, 1, 2]], ["SP", 3, 0, 256, [1], 1], ["AN", 3, 1, 2], ["FFSP", 3, 0, [5, 4, 3, 2, 1], 1, 1], ["AN", 3, 1, 6], ["FU", 1, [0, 1, 2, 3]], ["SP", 1, 0, 56, [1], 1], ["AN", 1, 1, 2], ["FFSP", 1, 0, [5, 4, 3, 2, 1], 1, 1], ["AN", 1, 1, 6], ["PR", 4, 0, "auto_unroll_max_step$64"]]]], "r": [[0.00296013, 0.00296069, 0.00295985], 0, 5.3927, 1667897670], "v": "v0.6"}
{"i": [["[\"hfused_conv1x1_stride\", 1, 7, 7, 2048, 32, 64, 1]", "cuda -keys=cuda,gpu -max_num_threads=1024 -model=unknown -thread_warp_size=32", [-1, 16, 64, 49152, 2147483647, 1024, 8, 32], "", 0, []], [[], [["CHW", 2, "local"], ["SP", 2, 0, 1, [1, 1, 1, 1], 1], ["SP", 2, 5, 64, [1, 2, 1, 16], 1], ["SP", 2, 10, 7, [1, 7, 1, 1], 1], ["SP", 2, 15, 7, [1, 1, 7, 1], 1], ["SP", 2, 20, 32, [2, 1, 1, 4], 1], ["SP", 2, 25, 2048, [16, 1], 1], ["RE", 2, [0, 5, 10, 15, 20, 1, 6, 11, 16, 21, 2, 7, 12, 17, 22, 25, 26, 3, 8, 13, 18, 23, 27, 4, 9, 14, 19, 24]], ["FSP", 3, 0, 1, 3], ["FSP", 3, 4, 2, 3], ["FSP", 3, 8, 3, 3], ["FSP", 3, 12, 4, 3], ["FSP", 3, 16, 5, 3], ["RE", 3, [0, 4, 8, 12, 16, 1, 5, 9, 13, 17, 2, 6, 10, 14, 18, 3, 7, 11, 15, 19]], ["CA", 2, 3, 14], ["CHR", 1, "shared", [2]], ["CA", 2, 3, 15], ["CHR", 0, "shared", [3]], ["CA", 1, 4, 15], ["FU", 5, [0, 1, 2, 3, 4]], ["AN", 5, 0, 5], ["FU", 5, [1, 2, 3, 4, 5]], ["AN", 5, 1, 4], ["FU", 5, [2, 3, 4, 5, 6]], ["AN", 5, 2, 6], ["FU", 3, [0, 1, 2]], ["SP", 3, 0, 1024, [1], 1], ["AN", 3, 1, 2], ["FFSP", 3, 0, [5, 4, 3, 2, 1], 1, 1], ["AN", 3, 1, 6], ["FU", 1, [0, 1, 2, 3]], ["SP", 1, 0, 16, [1], 1], ["AN", 1, 1, 2], ["FFSP", 1, 0, [5, 4, 3, 2, 1], 1, 1], ["AN", 1, 1, 6], ["PR", 4, 0, "auto_unroll_max_step$512"]]]], "r": [[0.0125394, 0.0125346, 0.012531], 0, 3.44782, 1667897666], "v": "v0.6"}
{"i": [["[\"hfused_conv1x1_stride\", 1, 7, 7, 2048, 32, 64, 1]", "cuda -keys=cuda,gpu -max_num_threads=1024 -model=unknown -thread_warp_size=32", [-1, 16, 64, 49152, 2147483647, 1024, 8, 32], "", 0, []], [[], [["CHW", 2, "local"], ["SP", 2, 0, 1, [1, 1, 1, 1], 1], ["SP", 2, 5, 64, [1, 16, 1, 4], 1], ["SP", 2, 10, 7, [1, 1, 1, 7], 1], ["SP", 2, 15, 7, [1, 7, 1, 1], 1], ["SP", 2, 20, 32, [1, 1, 1, 1], 1], ["SP", 2, 25, 2048, [2, 2], 1], ["RE", 2, [0, 5, 10, 15, 20, 1, 6, 11, 16, 21, 2, 7, 12, 17, 22, 25, 26, 3, 8, 13, 18, 23, 27, 4, 9, 14, 19, 24]], ["FSP", 3, 0, 1, 3], ["FSP", 3, 4, 2, 3], ["FSP", 3, 8, 3, 3], ["FSP", 3, 12, 4, 3], ["FSP", 3, 16, 5, 3], ["RE", 3, [0, 4, 8, 12, 16, 1, 5, 9, 13, 17, 2, 6, 10, 14, 18, 3, 7, 11, 15, 19]], ["CA", 2, 3, 14], ["CHR", 1, "shared", [2]], ["CA", 2, 3, 15], ["CHR", 0, "shared", [3]], ["CA", 1, 4, 15], ["FU", 5, [0, 1, 2, 3, 4]], ["AN", 5, 0, 5], ["FU", 5, [1, 2, 3, 4, 5]], ["AN", 5, 1, 4], ["FU", 5, [2, 3, 4, 5, 6]], ["AN", 5, 2, 6], ["FU", 3, [0, 1, 2]], ["SP", 3, 0, 64, [1], 1], ["AN", 3, 1, 2], ["FFSP", 3, 0, [5, 4, 3, 2, 1], 1, 1], ["AN", 3, 1, 6], ["FU", 1, [0, 1, 2, 3]], ["SP", 1, 0, 28, [2], 1], ["AN", 1, 1, 2], ["FFSP", 1, 0, [5, 4, 3, 2, 1], 1, 1], ["AN", 1, 1, 6], ["PR", 4, 0, "auto_unroll_max_step$0"]]]], "r": [[0.00039319, 0.000393118, 0.000393113], 0, 8.84516, 1667897673], "v": "v0.6"}
{"i": [["[\"hfused_conv1x1_stride\", 1, 7, 7, 2048, 32, 64, 1]", "cuda -keys=cuda,gpu -max_num_threads=1024 -model=unknown -thread_warp_size=32", [-1, 16, 64, 49152, 2147483647, 1024, 8, 32], "", 0, []], [[], [["CHW", 2, "local"], ["SP", 2, 0, 1, [1, 1, 1, 1], 1], ["SP", 2, 5, 64, [1, 8, 1, 4], 1], ["SP", 2, 10, 7, [7, 1, 1, 1], 1], ["SP", 2, 15, 7, [1, 1, 7, 1], 1], ["SP", 2, 20, 32, [1, 2, 1, 1], 1], ["SP", 2, 25, 2048, [4, 2], 1], ["RE", 2, [0, 5, 10, 15, 20, 1, 6, 11, 16, 21, 2, 7, 12, 17, 22, 25, 26, 3, 8, 13, 18, 23, 27, 4, 9, 14, 19, 24]], ["FSP", 3, 0, 1, 3], ["FSP", 3, 4, 2, 3], ["FSP", 3, 8, 3, 3], ["FSP", 3, 12, 4, 3], ["FSP", 3, 16, 5, 3], ["RE", 3, [0, 4, 8, 12, 16, 1, 5, 9, 13, 17, 2, 6, 10, 14, 18, 3, 7, 11, 15, 19]], ["CA", 2, 3, 14], ["CHR", 1, "shared", [2]], ["CA", 2, 3, 15], ["CHR", 0, "shared", [3]], ["CA", 1, 4, 15], ["FU", 5, [0, 1, 2, 3, 4]], ["AN", 5, 0, 5], ["FU", 5, [1, 2, 3, 4, 5]], ["AN", 5, 1, 4], ["FU", 5, [2, 3, 4, 5, 6]], ["AN", 5, 2, 6], ["FU", 3, [0, 1, 2]], ["SP", 3, 0, 32, [1], 1], ["AN", 3, 1, 2], ["FFSP", 3, 0, [5, 4, 3, 2, 1], 1, 1], ["AN", 3, 1, 6], ["FU", 1, [0, 1, 2, 3]], ["SP", 1, 0, 56, [28], 1], ["AN", 1, 1, 2], ["FFSP", 1, 0, [5, 4, 3, 2, 1], 1, 1], ["AN", 1, 1, 6], ["PR", 4, 0, "auto_unroll_max_step$1024"]]]], "r": [[0.00138845, 0.00138864, 0.00138859], 0, 7.43009, 1667897671], "v": "v0.6"}
{"i": [["[\"hfused_conv1x1_stride\", 1, 7, 7, 2048, 32, 64, 1]", "cuda -keys=cuda,gpu -max_num_threads=1024 -model=unknown -thread_warp_size=32", [-1, 16, 64, 49152, 2147483647, 1024, 8, 32], "", 0, []], [[], [["CHW", 2, "local"], ["SP", 2, 0, 1, [1, 1, 1, 1], 1], ["SP", 2, 5, 64, [1, 32, 1, 1], 1], ["SP", 2, 10, 7, [1, 7, 1, 1], 1], ["SP", 2, 15, 7, [1, 1, 7, 1], 1], ["SP", 2, 20, 32, [2, 4, 2, 1], 1], ["SP", 2, 25, 2048, [16, 1], 1], ["RE", 2, [0, 5, 10, 15, 20, 1, 6, 11, 16, 21, 2, 7, 12, 17, 22, 25, 26, 3, 8, 13, 18, 23, 27, 4, 9, 14, 19, 24]], ["FSP", 3, 0, 1, 3], ["FSP", 3, 4, 2, 3], ["FSP", 3, 8, 3, 3], ["FSP", 3, 12, 4, 3], ["FSP", 3, 16, 5, 3], ["RE", 3, [0, 4, 8, 12, 16, 1, 5, 9, 13, 17, 2, 6, 10, 14, 18, 3, 7, 11, 15, 19]], ["CA", 2, 3, 14], ["CHR", 1, "shared", [2]], ["CA", 2, 3, 15], ["CHR", 0, "shared", [3]], ["CA", 1, 4, 15], ["FU", 5, [0, 1, 2, 3, 4]], ["AN", 5, 0, 5], ["FU", 5, [1, 2, 3, 4, 5]], ["AN", 5, 1, 4], ["FU", 5, [2, 3, 4, 5, 6]], ["AN", 5, 2, 6], ["FU", 3, [0, 1, 2]], ["SP", 3, 0, 64, [1], 1], ["AN", 3, 1, 2], ["FFSP", 3, 0, [5, 4, 3, 2, 1], 1, 1], ["AN", 3, 1, 6], ["FU", 1, [0, 1, 2, 3]], ["SP", 1, 0, 112, [1], 1], ["AN", 1, 1, 2], ["FFSP", 1, 0, [5, 4, 3, 2, 1], 1, 1], ["AN", 1, 1, 6], ["PR", 4, 0, "auto_unroll_max_step$64"]]]], "r": [[0.00154429, 0.00154323, 0.00154344], 0, 6.18485, 1667897671], "v": "v0.6"}
{"i": [["[\"hfused_conv1x1_stride\", 1, 7, 7, 2048, 32, 64, 1]", "cuda -keys=cuda,gpu -max_num_threads=1024 -model=unknown -thread_warp_size=32", [-1, 16, 64, 49152, 2147483647, 1024, 8, 32], "", 0, []], [[], [["CHW", 2, "local"], ["SP", 2, 0, 1, [1, 1, 1, 1], 1], ["SP", 2, 5, 64, [2, 4, 1, 4], 1], ["SP", 2, 10, 7, [1, 1, 1, 7], 1], ["SP", 2, 15, 7, [1, 7, 1, 1], 1], ["SP", 2, 20, 32, [1, 1, 4, 1], 1], ["SP", 2, 25, 2048, [1, 1], 1], ["RE", 2, [0, 5, 10, 15, 20, 1, 6, 11, 16, 21, 2, 7, 12, 17, 22, 25, 26, 3, 8, 13, 18, 23, 27, 4, 9, 14, 19, 24]], ["FSP", 3, 0, 1, 3], ["FSP", 3, 4, 2, 3], ["FSP", 3, 8, 3, 3], ["FSP", 3, 12, 4, 3], ["FSP", 3, 16, 5, 3], ["RE", 3, [0, 4, 8, 12, 16, 1, 5, 9, 13, 17, 2, 6, 10, 14, 18, 3, 7, 11, 15, 19]], ["CA", 2, 3, 14], ["CHR", 1, "shared", [2]], ["CA", 2, 3, 15], ["CHR", 0, "shared", [3]], ["CA", 1, 4, 15], ["FU", 5, [0, 1, 2, 3, 4]], ["AN", 5, 0, 5], ["FU", 5, [1, 2, 3, 4, 5]], ["AN", 5, 1, 4], ["FU", 5, [2, 3, 4, 5, 6]], ["AN", 5, 2, 6], ["FU", 3, [0, 1, 2]], ["SP", 3, 0, 64, [1], 1], ["AN", 3, 1, 2], ["FFSP", 3, 0, [5, 4, 3, 2, 1], 1, 1], ["AN", 3, 1, 6], ["FU", 1, [0, 1, 2, 3]], ["SP", 1, 0, 28, [1], 1], ["AN", 1, 1, 2], ["FFSP", 1, 0, [5, 4, 3, 2, 1], 1, 1], ["AN", 1, 1, 6], ["PR", 4, 0, "auto_unroll_max_step$64"]]]], "r": [[0.00124784, 0.00124734, 0.00124749], 0, 8.60366, 1667897673], "v": "v0.6"}
{"i": [["[\"hfused_conv1x1_stride\", 1, 7, 7, 2048, 32, 64, 1]", "cuda -keys=cuda,gpu -max_num_threads=1024 -model=unknown -thread_warp_size=32", [-1, 16, 64, 49152, 2147483647, 1024, 8, 32], "", 0, []], [[], [["CHW", 2, "local"], ["SP", 2, 0, 1, [1, 1, 1, 1], 1], ["SP", 2, 5, 64, [1, 8, 2, 4], 1], ["SP", 2, 10, 7, [1, 7, 1, 1], 1], ["SP", 2, 15, 7, [1, 1, 1, 1], 1], ["SP", 2, 20, 32, [1, 1, 1, 1], 1], ["SP", 2, 25, 2048, [32, 1], 1], ["RE", 2, [0, 5, 10, 15, 20, 1, 6, 11, 16, 21, 2, 7, 12, 17, 22, 25, 26, 3, 8, 13, 18, 23, 27, 4, 9, 14, 19, 24]], ["FSP", 3, 0, 1, 3], ["FSP", 3, 4, 2, 3], ["FSP", 3, 8, 3, 3], ["FSP", 3, 12, 4, 3], ["FSP", 3, 16, 5, 3], ["RE", 3, [0, 4, 8, 12, 16, 1, 5, 9, 13, 17, 2, 6, 10, 14, 18, 3, 7, 11, 15, 19]], ["CA", 2, 3, 14], ["CHR", 1, "shared", [2]], ["CA", 2, 3, 15], ["CHR", 0, "shared", [3]], ["CA", 1, 4, 15], ["FU", 5, [0, 1, 2, 3, 4]], ["AN", 5, 0, 5], ["FU", 5, [1, 2, 3, 4, 5]], ["AN", 5, 1, 4], ["FU", 5, [2, 3, 4, 5, 6]], ["AN", 5, 2, 6], ["FU", 3, [0, 1, 2]], ["SP", 3, 0, 1024, [1], 1], ["AN", 3, 1, 2], ["FFSP", 3, 0, [5, 4, 3, 2, 1], 1, 1], ["AN", 3, 1, 6], ["FU", 1, [0, 1, 2, 3]], ["SP", 1, 0, 224, [1], 1], ["AN", 1, 1, 2], ["FFSP", 1, 0, [5, 4, 3, 2, 1], 1, 1], ["AN", 1, 1, 6], ["PR", 4, 0, "auto_unroll_max_step$1024"]]]], "r": [[0.000496486, 0.00049697, 0.000496201], 0, 8.23434, 1667897672], "v": "v0.6"}
{"i": [["[\"hfused_conv1x1_stride\", 1, 7, 7, 2048, 32, 64, 1]", "cuda -keys=cuda,gpu -max_num_threads=1024 -model=unknown -thread_warp_size=32", [-1, 16, 64, 49152, 2147483647, 1024, 8, 32], "", 0, []], [[], [["CHW", 2, "local"], ["SP", 2, 0, 1, [1, 1, 1, 1], 1], ["SP", 2, 5, 64, [4, 2, 4, 2], 1], ["SP", 2, 10, 7, [1, 7, 1, 1], 1], ["SP", 2, 15, 7, [1, 7, 1, 1], 1], ["SP", 2, 20, 32, [1, 2, 8, 1], 1], ["SP", 2, 25, 2048, [2, 2], 1], ["RE", 2, [0, 5, 10, 15, 20, 1, 6, 11, 16, 21, 2, 7, 12, 17, 22, 25, 26, 3, 8, 13, 18, 23, 27, 4, 9, 14, 19, 24]], ["FSP", 3, 0, 1, 3], ["FSP", 3, 4, 2, 3], ["FSP", 3, 8, 3, 3], ["FSP", 3, 12, 4, 3], ["FSP", 3, 16, 5, 3], ["RE", 3, [0, 4, 8, 12, 16, 1, 5, 9, 13, 17, 2, 6, 10, 14, 18, 3, 7, 11, 15, 19]], ["CA", 2, 3, 14], ["CHR", 1, "shared", [2]], ["CA", 2, 3, 15], ["CHR", 0, "shared", [3]], ["CA", 1, 4, 15], ["FU", 5, [0, 1, 2, 3, 4]], ["AN", 5, 0, 5], ["FU", 5, [1, 2, 3, 4, 5]], ["AN", 5, 1, 4], ["FU", 5, [2, 3, 4, 5, 6]], ["AN", 5, 2, 6], ["FU", 3, [0, 1, 2]], ["SP", 3, 0, 256, [16], 1], ["AN", 3, 1, 2], ["FFSP", 3, 0, [5, 4, 3, 2, 1], 1, 1], ["AN", 3, 1, 6], ["FU", 1, [0, 1, 2, 3]], ["SP", 1, 0, 4, [1], 1], ["AN", 1, 1, 2], ["FFSP", 1, 0, [5, 4, 3, 2, 1], 1, 1], ["AN", 1, 1, 6], ["PR", 4, 0, "auto_unroll_max_step$0"]]]], "r": [[0.0104707, 0.0104597, 0.0104562], 0, 11.8989, 1667897676], "v": "v0.6"}
{"i": [["[\"hfused_conv1x1_stride\", 1, 7, 7, 2048, 32, 64, 1]", "cuda -keys=cuda,gpu -max_num_threads=1024 -model=unknown -thread_warp_size=32", [-1, 16, 64, 49152, 2147483647, 1024, 8, 32], "", 0, []], [[], [["CHW", 2, "local"], ["SP", 2, 0, 1, [1, 1, 1, 1], 1], ["SP", 2, 5, 64, [2, 8, 1, 1], 1], ["SP", 2, 10, 7, [7, 1, 1, 1], 1], ["SP", 2, 15, 7, [1, 1, 7, 1], 1], ["SP", 2, 20, 32, [1, 1, 1, 8], 1], ["SP", 2, 25, 2048, [2, 1], 1], ["RE", 2, [0, 5, 10, 15, 20, 1, 6, 11, 16, 21, 2, 7, 12, 17, 22, 25, 26, 3, 8, 13, 18, 23, 27, 4, 9, 14, 19, 24]], ["FSP", 3, 0, 1, 3], ["FSP", 3, 4, 2, 3], ["FSP", 3, 8, 3, 3], ["FSP", 3, 12, 4, 3], ["FSP", 3, 16, 5, 3], ["RE", 3, [0, 4, 8, 12, 16, 1, 5, 9, 13, 17, 2, 6, 10, 14, 18, 3, 7, 11, 15, 19]], ["CA", 2, 3, 14], ["CHR", 1, "shared", [2]], ["CA", 2, 3, 15], ["CHR", 0, "shared", [3]], ["CA", 1, 4, 15], ["FU", 5, [0, 1, 2, 3, 4]], ["AN", 5, 0, 5], ["FU", 5, [1, 2, 3, 4, 5]], ["AN", 5, 1, 4], ["FU", 5, [2, 3, 4, 5, 6]], ["AN", 5, 2, 6], ["FU", 3, [0, 1, 2]], ["SP", 3, 0, 4, [1], 1], ["AN", 3, 1, 2], ["FFSP", 3, 0, [5, 4, 3, 2, 1], 1, 1], ["AN", 3, 1, 6], ["FU", 1, [0, 1, 2, 3]], ["SP", 1, 0, 2, [2], 1], ["AN", 1, 1, 2], ["FFSP", 1, 0, [5, 4, 3, 2, 1], 1, 1], ["AN", 1, 1, 6], ["PR", 4, 0, "auto_unroll_max_step$64"]]]], "r": [[0.0124613, 0.0124536, 0.0124687], 0, 8.21732, 1667897672], "v": "v0.6"}
{"i": [["[\"hfused_conv1x1_stride\", 1, 7, 7, 2048, 32, 64, 1]", "cuda -keys=cuda,gpu -max_num_threads=1024 -model=unknown -thread_warp_size=32", [-1, 16, 64, 49152, 2147483647, 1024, 8, 32], "", 0, []], [[], [["CHW", 2, "local"], ["SP", 2, 0, 1, [1, 1, 1, 1], 1], ["SP", 2, 5, 64, [1, 4, 2, 1], 1], ["SP", 2, 10, 7, [1, 1, 7, 1], 1], ["SP", 2, 15, 7, [1, 1, 1, 7], 1], ["SP", 2, 20, 32, [1, 8, 1, 2], 1], ["SP", 2, 25, 2048, [2, 4], 1], ["RE", 2, [0, 5, 10, 15, 20, 1, 6, 11, 16, 21, 2, 7, 12, 17, 22, 25, 26, 3, 8, 13, 18, 23, 27, 4, 9, 14, 19, 24]], ["FSP", 3, 0, 1, 3], ["FSP", 3, 4, 2, 3], ["FSP", 3, 8, 3, 3], ["FSP", 3, 12, 4, 3], ["FSP", 3, 16, 5, 3], ["RE", 3, [0, 4, 8, 12, 16, 1, 5, 9, 13, 17, 2, 6, 10, 14, 18, 3, 7, 11, 15, 19]], ["CA", 2, 3, 14], ["CHR", 1, "shared", [2]], ["CA", 2, 3, 15], ["CHR", 0, "shared", [3]], ["CA", 1, 4, 15], ["FU", 5, [0, 1, 2, 3, 4]], ["AN", 5, 0, 5], ["FU", 5, [1, 2, 3, 4, 5]], ["AN", 5, 1, 4], ["FU", 5, [2, 3, 4, 5, 6]], ["AN", 5, 2, 6], ["FU", 3, [0, 1, 2]], ["SP", 3, 0, 64, [1], 1], ["AN", 3, 1, 2], ["FFSP", 3, 0, [5, 4, 3, 2, 1], 1, 1], ["AN", 3, 1, 6], ["FU", 1, [0, 1, 2, 3]], ["SP", 1, 0, 392, [1], 1], ["AN", 1, 1, 2], ["FFSP", 1, 0, [5, 4, 3, 2, 1], 1, 1], ["AN", 1, 1, 6], ["PR", 4, 0, "auto_unroll_max_step$0"]]]], "r": [[0.00109821, 0.00109862, 0.00109837], 0, 9.91927, 1667897674], "v": "v0.6"}
{"i": [["[\"hfused_conv1x1_stride\", 1, 7, 7, 2048, 32, 64, 1]", "cuda -keys=cuda,gpu -max_num_threads=1024 -model=unknown -thread_warp_size=32", [-1, 16, 64, 49152, 2147483647, 1024, 8, 32], "", 0, []], [[], [["CHW", 2, "local"], ["SP", 2, 0, 1, [1, 1, 1, 1], 1], ["SP", 2, 5, 64, [4, 4, 2, 2], 1], ["SP", 2, 10, 7, [1, 7, 1, 1], 1], ["SP", 2, 15, 7, [1, 1, 7, 1], 1], ["SP", 2, 20, 32, [1, 1, 1, 2], 1], ["SP", 2, 25, 2048, [2, 1], 1], ["RE", 2, [0, 5, 10, 15, 20, 1, 6, 11, 16, 21, 2, 7, 12, 17, 22, 25, 26, 3, 8, 13, 18, 23, 27, 4, 9, 14, 19, 24]], ["FSP", 3, 0, 1, 3], ["FSP", 3, 4, 2, 3], ["FSP", 3, 8, 3, 3], ["FSP", 3, 12, 4, 3], ["FSP", 3, 16, 5, 3], ["RE", 3, [0, 4, 8, 12, 16, 1, 5, 9, 13, 17, 2, 6, 10, 14, 18, 3, 7, 11, 15, 19]], ["CA", 2, 3, 14], ["CHR", 1, "shared", [2]], ["CA", 2, 3, 15], ["CHR", 0, "shared", [3]], ["CA", 1, 4, 15], ["FU", 5, [0, 1, 2, 3, 4]], ["AN", 5, 0, 5], ["FU", 5, [1, 2, 3, 4, 5]], ["AN", 5, 1, 4], ["FU", 5, [2, 3, 4, 5, 6]], ["AN", 5, 2, 6], ["FU", 3, [0, 1, 2]], ["SP", 3, 0, 8, [1], 1], ["AN", 3, 1, 2], ["FFSP", 3, 0, [5, 4, 3, 2, 1], 1, 1], ["AN", 3, 1, 6], ["FU", 1, [0, 1, 2, 3]], ["SP", 1, 0, 14, [7], 1], ["AN", 1, 1, 2], ["FFSP", 1, 0, [5, 4, 3, 2, 1], 1, 1], ["AN", 1, 1, 6], ["PR", 4, 0, "auto_unroll_max_step$512"]]]], "r": [[0.00173982, 0.00172941, 0.00173212], 0, 10.9579, 1667897675], "v": "v0.6"}
{"i": [["[\"hfused_conv1x1_stride\", 1, 7, 7, 2048, 32, 64, 1]", "cuda -keys=cuda,gpu -max_num_threads=1024 -model=unknown -thread_warp_size=32", [-1, 16, 64, 49152, 2147483647, 1024, 8, 32], "", 0, []], [[], [["CHW", 2, "local"], ["SP", 2, 0, 1, [1, 1, 1, 1], 1], ["SP", 2, 5, 64, [1, 32, 2, 1], 1], ["SP", 2, 10, 7, [7, 1, 1, 1], 1], ["SP", 2, 15, 7, [1, 7, 1, 1], 1], ["SP", 2, 20, 32, [1, 4, 2, 4], 1], ["SP", 2, 25, 2048, [1, 2], 1], ["RE", 2, [0, 5, 10, 15, 20, 1, 6, 11, 16, 21, 2, 7, 12, 17, 22, 25, 26, 3, 8, 13, 18, 23, 27, 4, 9, 14, 19, 24]], ["FSP", 3, 0, 1, 3], ["FSP", 3, 4, 2, 3], ["FSP", 3, 8, 3, 3], ["FSP", 3, 12, 4, 3], ["FSP", 3, 16, 5, 3], ["RE", 3, [0, 4, 8, 12, 16, 1, 5, 9, 13, 17, 2, 6, 10, 14, 18, 3, 7, 11, 15, 19]], ["CA", 2, 3, 14], ["CHR", 1, "shared", [2]], ["CA", 2, 3, 15], ["CHR", 0, "shared", [3]], ["CA", 1, 4, 15], ["FU", 5, [0, 1, 2, 3, 4]], ["AN", 5, 0, 5], ["FU", 5, [1, 2, 3, 4, 5]], ["AN", 5, 1, 4], ["FU", 5, [2, 3, 4, 5, 6]], ["AN", 5, 2, 6], ["FU", 3, [0, 1, 2]], ["SP", 3, 0, 64, [1], 1], ["AN", 3, 1, 2], ["FFSP", 3, 0, [5, 4, 3, 2, 1], 1, 1], ["AN", 3, 1, 6], ["FU", 1, [0, 1, 2, 3]], ["SP", 1, 0, 4, [1], 1], ["AN", 1, 1, 2], ["FFSP", 1, 0, [5, 4, 3, 2, 1], 1, 1], ["AN", 1, 1, 6], ["PR", 4, 0, "auto_unroll_max_step$0"]]]], "r": [[0.0260085, 0.0260107, 0.0260101], 0, 11.8849, 1667897676], "v": "v0.6"}
{"i": [["[\"hfused_conv1x1_stride\", 1, 7, 7, 2048, 32, 64, 1]", "cuda -keys=cuda,gpu -max_num_threads=1024 -model=unknown -thread_warp_size=32", [-1, 16, 64, 49152, 2147483647, 1024, 8, 32], "", 0, []], [[], [["CHW", 2, "local"], ["SP", 2, 0, 1, [1, 1, 1, 1], 1], ["SP", 2, 5, 64, [1, 2, 1, 16], 1], ["SP", 2, 10, 7, [1, 7, 1, 1], 1], ["SP", 2, 15, 7, [1, 7, 1, 1], 1], ["SP", 2, 20, 32, [2, 1, 1, 4], 1], ["SP", 2, 25, 2048, [16, 1], 1], ["RE", 2, [0, 5, 10, 15, 20, 1, 6, 11, 16, 21, 2, 7, 12, 17, 22, 25, 26, 3, 8, 13, 18, 23, 27, 4, 9, 14, 19, 24]], ["FSP", 3, 0, 1, 3], ["FSP", 3, 4, 2, 3], ["FSP", 3, 8, 3, 3], ["FSP", 3, 12, 4, 3], ["FSP", 3, 16, 5, 3], ["RE", 3, [0, 4, 8, 12, 16, 1, 5, 9, 13, 17, 2, 6, 10, 14, 18, 3, 7, 11, 15, 19]], ["CA", 2, 3, 14], ["CHR", 1, "shared", [2]], ["CA", 2, 3, 15], ["CHR", 0, "shared", [3]], ["CA", 1, 4, 15], ["FU", 5, [0, 1, 2, 3, 4]], ["AN", 5, 0, 5], ["FU", 5, [1, 2, 3, 4, 5]], ["AN", 5, 1, 4], ["FU", 5, [2, 3, 4, 5, 6]], ["AN", 5, 2, 6], ["FU", 3, [0, 1, 2]], ["SP", 3, 0, 1024, [8], 1], ["AN", 3, 1, 2], ["FFSP", 3, 0, [5, 4, 3, 2, 1], 1, 1], ["AN", 3, 1, 6], ["FU", 1, [0, 1, 2, 3]], ["SP", 1, 0, 16, [1], 1], ["AN", 1, 1, 2], ["FFSP", 1, 0, [5, 4, 3, 2, 1], 1, 1], ["AN", 1, 1, 6], ["PR", 4, 0, "auto_unroll_max_step$512"]]]], "r": [[0.00117903, 0.00117887, 0.00117959], 0, 10.2891, 1667897675], "v": "v0.6"}
{"i": [["[\"hfused_conv1x1_stride\", 1, 7, 7, 2048, 32, 64, 1]", "cuda -keys=cuda,gpu -max_num_threads=1024 -model=unknown -thread_warp_size=32", [-1, 16, 64, 49152, 2147483647, 1024, 8, 32], "", 0, []], [[], [["CHW", 2, "local"], ["SP", 2, 0, 1, [1, 1, 1, 1], 1], ["SP", 2, 5, 64, [2, 4, 1, 2], 1], ["SP", 2, 10, 7, [1, 1, 1, 7], 1], ["SP", 2, 15, 7, [1, 7, 1, 1], 1], ["SP", 2, 20, 32, [1, 4, 4, 2], 1], ["SP", 2, 25, 2048, [8, 1], 1], ["RE", 2, [0, 5, 10, 15, 20, 1, 6, 11, 16, 21, 2, 7, 12, 17, 22, 25, 26, 3, 8, 13, 18, 23, 27, 4, 9, 14, 19, 24]], ["FSP", 3, 0, 1, 3], ["FSP", 3, 4, 2, 3], ["FSP", 3, 8, 3, 3], ["FSP", 3, 12, 4, 3], ["FSP", 3, 16, 5, 3], ["RE", 3, [0, 4, 8, 12, 16, 1, 5, 9, 13, 17, 2, 6, 10, 14, 18, 3, 7, 11, 15, 19]], ["CA", 2, 3, 14], ["CHR", 1, "shared", [2]], ["CA", 2, 3, 15], ["CHR", 0, "shared", [3]], ["CA", 1, 4, 15], ["FU", 5, [0, 1, 2, 3, 4]], ["AN", 5, 0, 5], ["FU", 5, [1, 2, 3, 4, 5]], ["AN", 5, 1, 4], ["FU", 5, [2, 3, 4, 5, 6]], ["AN", 5, 2, 6], ["FU", 3, [0, 1, 2]], ["SP", 3, 0, 128, [1], 1], ["AN", 3, 1, 2], ["FFSP", 3, 0, [5, 4, 3, 2, 1], 1, 1], ["AN", 3, 1, 6], ["FU", 1, [0, 1, 2, 3]], ["SP", 1, 0, 56, [1], 1], ["AN", 1, 1, 2], ["FFSP", 1, 0, [5, 4, 3, 2, 1], 1, 1], ["AN", 1, 1, 6], ["PR", 4, 0, "auto_unroll_max_step$0"]]]], "r": [[0.00199413, 0.00199381, 0.00199336], 0, 12.2666, 1667897677], "v": "v0.6"}
{"i": [["[\"hfused_conv1x1_stride\", 1, 7, 7, 2048, 32, 64, 1]", "cuda -keys=cuda,gpu -max_num_threads=1024 -model=unknown -thread_warp_size=32", [-1, 16, 64, 49152, 2147483647, 1024, 8, 32], "", 0, []], [[], [["CHW", 2, "local"], ["SP", 2, 0, 1, [1, 1, 1, 1], 1], ["SP", 2, 5, 64, [1, 2, 1, 1], 1], ["SP", 2, 10, 7, [1, 1, 1, 1], 1], ["SP", 2, 15, 7, [1, 7, 1, 1], 1], ["SP", 2, 20, 32, [2, 8, 1, 2], 1], ["SP", 2, 25, 2048, [8, 8], 1], ["RE", 2, [0, 5, 10, 15, 20, 1, 6, 11, 16, 21, 2, 7, 12, 17, 22, 25, 26, 3, 8, 13, 18, 23, 27, 4, 9, 14, 19, 24]], ["FSP", 3, 0, 1, 3], ["FSP", 3, 4, 2, 3], ["FSP", 3, 8, 3, 3], ["FSP", 3, 12, 4, 3], ["FSP", 3, 16, 5, 3], ["RE", 3, [0, 4, 8, 12, 16, 1, 5, 9, 13, 17, 2, 6, 10, 14, 18, 3, 7, 11, 15, 19]], ["CA", 2, 3, 14], ["CHR", 1, "shared", [2]], ["CA", 2, 3, 15], ["CHR", 0, "shared", [3]], ["CA", 1, 4, 15], ["FU", 5, [0, 1, 2, 3, 4]], ["AN", 5, 0, 5], ["FU", 5, [1, 2, 3, 4, 5]], ["AN", 5, 1, 4], ["FU", 5, [2, 3, 4, 5, 6]], ["AN", 5, 2, 6], ["FU", 3, [0, 1, 2]], ["SP", 3, 0, 128, [4], 1], ["AN", 3, 1, 2], ["FFSP", 3, 0, [5, 4, 3, 2, 1], 1, 1], ["AN", 3, 1, 6], ["FU", 1, [0, 1, 2, 3]], ["SP", 1, 0, 448, [1], 1], ["AN", 1, 1, 2], ["FFSP", 1, 0, [5, 4, 3, 2, 1], 1, 1], ["AN", 1, 1, 6], ["PR", 4, 0, "auto_unroll_max_step$1024"]]]], "r": [[0.000158888, 0.000159286, 0.000159326], 0, 12.7072, 1667974037], "v": "v0.6"}
{"i": [["[\"hfused_conv1x1_stride\", 1, 7, 7, 2048, 32, 64, 1]", "cuda -keys=cuda,gpu -max_num_threads=1024 -model=unknown -thread_warp_size=32", [-1, 16, 64, 49152, 2147483647, 1024, 8, 32], "", 0, []], [[], [["CHW", 2, "local"], ["SP", 2, 0, 1, [1, 1, 1, 1], 1], ["SP", 2, 5, 64, [1, 8, 4, 2], 1], ["SP", 2, 10, 7, [1, 1, 1, 7], 1], ["SP", 2, 15, 7, [7, 1, 1, 1], 1], ["SP", 2, 20, 32, [1, 8, 1, 2], 1], ["SP", 2, 25, 2048, [1, 8], 1], ["RE", 2, [0, 5, 10, 15, 20, 1, 6, 11, 16, 21, 2, 7, 12, 17, 22, 25, 26, 3, 8, 13, 18, 23, 27, 4, 9, 14, 19, 24]], ["FSP", 3, 0, 1, 3], ["FSP", 3, 4, 2, 3], ["FSP", 3, 8, 3, 3], ["FSP", 3, 12, 4, 3], ["FSP", 3, 16, 5, 3], ["RE", 3, [0, 4, 8, 12, 16, 1, 5, 9, 13, 17, 2, 6, 10, 14, 18, 3, 7, 11, 15, 19]], ["CA", 2, 3, 14], ["CHR", 1, "shared", [2]], ["CA", 2, 3, 15], ["CHR", 0, "shared", [3]], ["CA", 1, 4, 15], ["FU", 5, [0, 1, 2, 3, 4]], ["AN", 5, 0, 5], ["FU", 5, [1, 2, 3, 4, 5]], ["AN", 5, 1, 4], ["FU", 5, [2, 3, 4, 5, 6]], ["AN", 5, 2, 6], ["FU", 3, [0, 1, 2]], ["SP", 3, 0, 64, [1], 1], ["AN", 3, 1, 2], ["FFSP", 3, 0, [5, 4, 3, 2, 1], 1, 1], ["AN", 3, 1, 6], ["FU", 1, [0, 1, 2, 3]], ["SP", 1, 0, 28, [1], 1], ["AN", 1, 1, 2], ["FFSP", 1, 0, [5, 4, 3, 2, 1], 1, 1], ["AN", 1, 1, 6], ["PR", 4, 0, "auto_unroll_max_step$16"]]]], "r": [[0.010191, 0.0102111, 0.0101819], 0, 8.97924, 1667974032], "v": "v0.6"}
{"i": [["[\"hfused_conv1x1_stride\", 1, 7, 7, 2048, 32, 64, 1]", "cuda -keys=cuda,gpu -max_num_threads=1024 -model=unknown -thread_warp_size=32", [-1, 16, 64, 49152, 2147483647, 1024, 8, 32], "", 0, []], [[], [["CHW", 2, "local"], ["SP", 2, 0, 1, [1, 1, 1, 1], 1], ["SP", 2, 5, 64, [1, 16, 1, 2], 1], ["SP", 2, 10, 7, [1, 1, 1, 1], 1], ["SP", 2, 15, 7, [1, 7, 1, 1], 1], ["SP", 2, 20, 32, [1, 1, 32, 1], 1], ["SP", 2, 25, 2048, [1, 4], 1], ["RE", 2, [0, 5, 10, 15, 20, 1, 6, 11, 16, 21, 2, 7, 12, 17, 22, 25, 26, 3, 8, 13, 18, 23, 27, 4, 9, 14, 19, 24]], ["FSP", 3, 0, 1, 3], ["FSP", 3, 4, 2, 3], ["FSP", 3, 8, 3, 3], ["FSP", 3, 12, 4, 3], ["FSP", 3, 16, 5, 3], ["RE", 3, [0, 4, 8, 12, 16, 1, 5, 9, 13, 17, 2, 6, 10, 14, 18, 3, 7, 11, 15, 19]], ["CA", 2, 3, 14], ["CHR", 1, "shared", [2]], ["CA", 2, 3, 15], ["CHR", 0, "shared", [3]], ["CA", 1, 4, 15], ["FU", 5, [0, 1, 2, 3, 4]], ["AN", 5, 0, 5], ["FU", 5, [1, 2, 3, 4, 5]], ["AN", 5, 1, 4], ["FU", 5, [2, 3, 4, 5, 6]], ["AN", 5, 2, 6], ["FU", 3, [0, 1, 2]], ["SP", 3, 0, 512, [1], 1], ["AN", 3, 1, 2], ["FFSP", 3, 0, [5, 4, 3, 2, 1], 1, 1], ["AN", 3, 1, 6], ["FU", 1, [0, 1, 2, 3]], ["SP", 1, 0, 4, [1], 1], ["AN", 1, 1, 2], ["FFSP", 1, 0, [5, 4, 3, 2, 1], 1, 1], ["AN", 1, 1, 6], ["PR", 4, 0, "auto_unroll_max_step$1024"]]]], "r": [[0.00107669, 0.00107649, 0.00107639], 0, 4.2556, 1667974029], "v": "v0.6"}
{"i": [["[\"hfused_conv1x1_stride\", 1, 7, 7, 2048, 32, 64, 1]", "cuda -keys=cuda,gpu -max_num_threads=1024 -model=unknown -thread_warp_size=32", [-1, 16, 64, 49152, 2147483647, 1024, 8, 32], "", 0, []], [[], [["CHW", 2, "local"], ["SP", 2, 0, 1, [1, 1, 1, 1], 1], ["SP", 2, 5, 64, [1, 16, 1, 1], 1], ["SP", 2, 10, 7, [1, 7, 1, 1], 1], ["SP", 2, 15, 7, [1, 1, 1, 1], 1], ["SP", 2, 20, 32, [1, 8, 1, 2], 1], ["SP", 2, 25, 2048, [1, 32], 1], ["RE", 2, [0, 5, 10, 15, 20, 1, 6, 11, 16, 21, 2, 7, 12, 17, 22, 25, 26, 3, 8, 13, 18, 23, 27, 4, 9, 14, 19, 24]], ["FSP", 3, 0, 1, 3], ["FSP", 3, 4, 2, 3], ["FSP", 3, 8, 3, 3], ["FSP", 3, 12, 4, 3], ["FSP", 3, 16, 5, 3], ["RE", 3, [0, 4, 8, 12, 16, 1, 5, 9, 13, 17, 2, 6, 10, 14, 18, 3, 7, 11, 15, 19]], ["CA", 2, 3, 14], ["CHR", 1, "shared", [2]], ["CA", 2, 3, 15], ["CHR", 0, "shared", [3]], ["CA", 1, 4, 15], ["FU", 5, [0, 1, 2, 3, 4]], ["AN", 5, 0, 5], ["FU", 5, [1, 2, 3, 4, 5]], ["AN", 5, 1, 4], ["FU", 5, [2, 3, 4, 5, 6]], ["AN", 5, 2, 6], ["FU", 3, [0, 1, 2]], ["SP", 3, 0, 64, [1], 1], ["AN", 3, 1, 2], ["FFSP", 3, 0, [5, 4, 3, 2, 1], 1, 1], ["AN", 3, 1, 6], ["FU", 1, [0, 1, 2, 3]], ["SP", 1, 0, 224, [1], 1], ["AN", 1, 1, 2], ["FFSP", 1, 0, [5, 4, 3, 2, 1], 1, 1], ["AN", 1, 1, 6], ["PR", 4, 0, "auto_unroll_max_step$0"]]]], "r": [[0.000227604, 0.000227547, 0.000227846], 0, 5.89985, 1667974031], "v": "v0.6"}
{"i": [["[\"hfused_conv1x1_stride\", 1, 7, 7, 2048, 32, 64, 1]", "cuda -keys=cuda,gpu -max_num_threads=1024 -model=unknown -thread_warp_size=32", [-1, 16, 64, 49152, 2147483647, 1024, 8, 32], "", 0, []], [[], [["CHW", 2, "local"], ["SP", 2, 0, 1, [1, 1, 1, 1], 1], ["SP", 2, 5, 64, [1, 2, 1, 1], 1], ["SP", 2, 10, 7, [1, 1, 7, 1], 1], ["SP", 2, 15, 7, [1, 7, 1, 1], 1], ["SP", 2, 20, 32, [2, 4, 2, 1], 1], ["SP", 2, 25, 2048, [2, 2], 1], ["RE", 2, [0, 5, 10, 15, 20, 1, 6, 11, 16, 21, 2, 7, 12, 17, 22, 25, 26, 3, 8, 13, 18, 23, 27, 4, 9, 14, 19, 24]], ["FSP", 3, 0, 1, 3], ["FSP", 3, 4, 2, 3], ["FSP", 3, 8, 3, 3], ["FSP", 3, 12, 4, 3], ["FSP", 3, 16, 5, 3], ["RE", 3, [0, 4, 8, 12, 16, 1, 5, 9, 13, 17, 2, 6, 10, 14, 18, 3, 7, 11, 15, 19]], ["CA", 2, 3, 14], ["CHR", 1, "shared", [2]], ["CA", 2, 3, 15], ["CHR", 0, "shared", [3]], ["CA", 1, 4, 15], ["FU", 5, [0, 1, 2, 3, 4]], ["AN", 5, 0, 5], ["FU", 5, [1, 2, 3, 4, 5]], ["AN", 5, 1, 4], ["FU", 5, [2, 3, 4, 5, 6]], ["AN", 5, 2, 6], ["FU", 3, [0, 1, 2]], ["SP", 3, 0, 32, [1], 1], ["AN", 3, 1, 2], ["FFSP", 3, 0, [5, 4, 3, 2, 1], 1, 1], ["AN", 3, 1, 6], ["FU", 1, [0, 1, 2, 3]], ["SP", 1, 0, 112, [1], 1], ["AN", 1, 1, 2], ["FFSP", 1, 0, [5, 4, 3, 2, 1], 1, 1], ["AN", 1, 1, 6], ["PR", 4, 0, "auto_unroll_max_step$1024"]]]], "r": [[0.000274421, 0.000274323, 0.000274282], 0, 8.06749, 1667974033], "v": "v0.6"}
{"i": [["[\"hfused_conv1x1_stride\", 1, 7, 7, 2048, 32, 64, 1]", "cuda -keys=cuda,gpu -max_num_threads=1024 -model=unknown -thread_warp_size=32", [-1, 16, 64, 49152, 2147483647, 1024, 8, 32], "", 0, []], [[], [["CHW", 2, "local"], ["SP", 2, 0, 1, [1, 1, 1, 1], 1], ["SP", 2, 5, 64, [4, 1, 1, 1], 1], ["SP", 2, 10, 7, [1, 1, 1, 1], 1], ["SP", 2, 15, 7, [1, 7, 1, 1], 1], ["SP", 2, 20, 32, [1, 32, 1, 1], 1], ["SP", 2, 25, 2048, [1, 32], 1], ["RE", 2, [0, 5, 10, 15, 20, 1, 6, 11, 16, 21, 2, 7, 12, 17, 22, 25, 26, 3, 8, 13, 18, 23, 27, 4, 9, 14, 19, 24]], ["FSP", 3, 0, 1, 3], ["FSP", 3, 4, 2, 3], ["FSP", 3, 8, 3, 3], ["FSP", 3, 12, 4, 3], ["FSP", 3, 16, 5, 3], ["RE", 3, [0, 4, 8, 12, 16, 1, 5, 9, 13, 17, 2, 6, 10, 14, 18, 3, 7, 11, 15, 19]], ["CA", 2, 3, 14], ["CHR", 1, "shared", [2]], ["CA", 2, 3, 15], ["CHR", 0, "shared", [3]], ["CA", 1, 4, 15], ["FU", 5, [0, 1, 2, 3, 4]], ["AN", 5, 0, 5], ["FU", 5, [1, 2, 3, 4, 5]], ["AN", 5, 1, 4], ["FU", 5, [2, 3, 4, 5, 6]], ["AN", 5, 2, 6], ["FU", 3, [0, 1, 2]], ["SP", 3, 0, 128, [1], 1], ["AN", 3, 1, 2], ["FFSP", 3, 0, [5, 4, 3, 2, 1], 1, 1], ["AN", 3, 1, 6], ["FU", 1, [0, 1, 2, 3]], ["SP", 1, 0, 224, [1], 1], ["AN", 1, 1, 2], ["FFSP", 1, 0, [5, 4, 3, 2, 1], 1, 1], ["AN", 1, 1, 6], ["PR", 4, 0, "auto_unroll_max_step$16"]]]], "r": [[0.000223923, 0.000223706, 0.000223996], 0, 4.92713, 1667974030], "v": "v0.6"}
{"i": [["[\"hfused_conv1x1_stride\", 1, 7, 7, 2048, 32, 64, 1]", "cuda -keys=cuda,gpu -max_num_threads=1024 -model=unknown -thread_warp_size=32", [-1, 16, 64, 49152, 2147483647, 1024, 8, 32], "", 0, []], [[], [["CHW", 2, "local"], ["SP", 2, 0, 1, [1, 1, 1, 1], 1], ["SP", 2, 5, 64, [4, 4, 2, 1], 1], ["SP", 2, 10, 7, [1, 7, 1, 1], 1], ["SP", 2, 15, 7, [1, 7, 1, 1], 1], ["SP", 2, 20, 32, [1, 4, 1, 2], 1], ["SP", 2, 25, 2048, [4, 1], 1], ["RE", 2, [0, 5, 10, 15, 20, 1, 6, 11, 16, 21, 2, 7, 12, 17, 22, 25, 26, 3, 8, 13, 18, 23, 27, 4, 9, 14, 19, 24]], ["FSP", 3, 0, 1, 3], ["FSP", 3, 4, 2, 3], ["FSP", 3, 8, 3, 3], ["FSP", 3, 12, 4, 3], ["FSP", 3, 16, 5, 3], ["RE", 3, [0, 4, 8, 12, 16, 1, 5, 9, 13, 17, 2, 6, 10, 14, 18, 3, 7, 11, 15, 19]], ["CA", 2, 3, 14], ["CHR", 1, "shared", [2]], ["CA", 2, 3, 15], ["CHR", 0, "shared", [3]], ["CA", 1, 4, 15], ["FU", 5, [0, 1, 2, 3, 4]], ["AN", 5, 0, 5], ["FU", 5, [1, 2, 3, 4, 5]], ["AN", 5, 1, 4], ["FU", 5, [2, 3, 4, 5, 6]], ["AN", 5, 2, 6], ["FU", 3, [0, 1, 2]], ["SP", 3, 0, 32, [1], 1], ["AN", 3, 1, 2], ["FFSP", 3, 0, [5, 4, 3, 2, 1], 1, 1], ["AN", 3, 1, 6], ["FU", 1, [0, 1, 2, 3]], ["SP", 1, 0, 4, [1], 1], ["AN", 1, 1, 2], ["FFSP", 1, 0, [5, 4, 3, 2, 1], 1, 1], ["AN", 1, 1, 6], ["PR", 4, 0, "auto_unroll_max_step$0"]]]], "r": [[0.00111276, 0.00111235, 0.00111144], 0, 2.09, 1667974026], "v": "v0.6"}
{"i": [["[\"hfused_conv1x1_stride\", 1, 7, 7, 2048, 32, 64, 1]", "cuda -keys=cuda,gpu -max_num_threads=1024 -model=unknown -thread_warp_size=32", [-1, 16, 64, 49152, 2147483647, 1024, 8, 32], "", 0, []], [[], [["CHW", 2, "local"], ["SP", 2, 0, 1, [1, 1, 1, 1], 1], ["SP", 2, 5, 64, [1, 2, 2, 1], 1], ["SP", 2, 10, 7, [1, 7, 1, 1], 1], ["SP", 2, 15, 7, [1, 1, 7, 1], 1], ["SP", 2, 20, 32, [1, 4, 4, 2], 1], ["SP", 2, 25, 2048, [2, 1], 1], ["RE", 2, [0, 5, 10, 15, 20, 1, 6, 11, 16, 21, 2, 7, 12, 17, 22, 25, 26, 3, 8, 13, 18, 23, 27, 4, 9, 14, 19, 24]], ["FSP", 3, 0, 1, 3], ["FSP", 3, 4, 2, 3], ["FSP", 3, 8, 3, 3], ["FSP", 3, 12, 4, 3], ["FSP", 3, 16, 5, 3], ["RE", 3, [0, 4, 8, 12, 16, 1, 5, 9, 13, 17, 2, 6, 10, 14, 18, 3, 7, 11, 15, 19]], ["CA", 2, 3, 14], ["CHR", 1, "shared", [2]], ["CA", 2, 3, 15], ["CHR", 0, "shared", [3]], ["CA", 1, 4, 15], ["FU", 5, [0, 1, 2, 3, 4]], ["AN", 5, 0, 5], ["FU", 5, [1, 2, 3, 4, 5]], ["AN", 5, 1, 4], ["FU", 5, [2, 3, 4, 5, 6]], ["AN", 5, 2, 6], ["FU", 3, [0, 1, 2]], ["SP", 3, 0, 32, [1], 1], ["AN", 3, 1, 2], ["FFSP", 3, 0, [5, 4, 3, 2, 1], 1, 1], ["AN", 3, 1, 6], ["FU", 1, [0, 1, 2, 3]], ["SP", 1, 0, 14, [1], 1], ["AN", 1, 1, 2], ["FFSP", 1, 0, [5, 4, 3, 2, 1], 1, 1], ["AN", 1, 1, 6], ["PR", 4, 0, "auto_unroll_max_step$1024"]]]], "r": [[0.000620113, 0.000620184, 0.000620148], 0, 1.68641, 1667974026], "v": "v0.6"}
{"i": [["[\"hfused_conv1x1_stride\", 1, 7, 7, 2048, 32, 64, 1]", "cuda -keys=cuda,gpu -max_num_threads=1024 -model=unknown -thread_warp_size=32", [-1, 16, 64, 49152, 2147483647, 1024, 8, 32], "", 0, []], [[], [["CHW", 2, "local"], ["SP", 2, 0, 1, [1, 1, 1, 1], 1], ["SP", 2, 5, 64, [2, 2, 1, 2], 1], ["SP", 2, 10, 7, [1, 1, 7, 1], 1], ["SP", 2, 15, 7, [1, 1, 1, 1], 1], ["SP", 2, 20, 32, [1, 4, 4, 1], 1], ["SP", 2, 25, 2048, [64, 1], 1], ["RE", 2, [0, 5, 10, 15, 20, 1, 6, 11, 16, 21, 2, 7, 12, 17, 22, 25, 26, 3, 8, 13, 18, 23, 27, 4, 9, 14, 19, 24]], ["FSP", 3, 0, 1, 3], ["FSP", 3, 4, 2, 3], ["FSP", 3, 8, 3, 3], ["FSP", 3, 12, 4, 3], ["FSP", 3, 16, 5, 3], ["RE", 3, [0, 4, 8, 12, 16, 1, 5, 9, 13, 17, 2, 6, 10, 14, 18, 3, 7, 11, 15, 19]], ["CA", 2, 3, 14], ["CHR", 1, "shared", [2]], ["CA", 2, 3, 15], ["CHR", 0, "shared", [3]], ["CA", 1, 4, 15], ["FU", 5, [0, 1, 2, 3, 4]], ["AN", 5, 0, 5], ["FU", 5, [1, 2, 3, 4, 5]], ["AN", 5, 1, 4], ["FU", 5, [2, 3, 4, 5, 6]], ["AN", 5, 2, 6], ["FU", 3, [0, 1, 2]], ["SP", 3, 0, 512, [1], 1], ["AN", 3, 1, 2], ["FFSP", 3, 0, [5, 4, 3, 2, 1], 1, 1], ["AN", 3, 1, 6], ["FU", 1, [0, 1, 2, 3]], ["SP", 1, 0, 448, [1], 1], ["AN", 1, 1, 2], ["FFSP", 1, 0, [5, 4, 3, 2, 1], 1, 1], ["AN", 1, 1, 6], ["PR", 4, 0, "auto_unroll_max_step$64"]]]], "r": [[0.00164039, 0.00163987, 0.00164037], 0, 5.70948, 1667974030], "v": "v0.6"}
{"i": [["[\"hfused_conv1x1_stride\", 1, 7, 7, 2048, 32, 64, 1]", "cuda -keys=cuda,gpu -max_num_threads=1024 -model=unknown -thread_warp_size=32", [-1, 16, 64, 49152, 2147483647, 1024, 8, 32], "", 0, []], [[], [["CHW", 2, "local"], ["SP", 2, 0, 1, [1, 1, 1, 1], 1], ["SP", 2, 5, 64, [4, 8, 1, 2], 1], ["SP", 2, 10, 7, [1, 1, 7, 1], 1], ["SP", 2, 15, 7, [1, 1, 1, 1], 1], ["SP", 2, 20, 32, [2, 2, 1, 1], 1], ["SP", 2, 25, 2048, [4, 8], 1], ["RE", 2, [0, 5, 10, 15, 20, 1, 6, 11, 16, 21, 2, 7, 12, 17, 22, 25, 26, 3, 8, 13, 18, 23, 27, 4, 9, 14, 19, 24]], ["FSP", 3, 0, 1, 3], ["FSP", 3, 4, 2, 3], ["FSP", 3, 8, 3, 3], ["FSP", 3, 12, 4, 3], ["FSP", 3, 16, 5, 3], ["RE", 3, [0, 4, 8, 12, 16, 1, 5, 9, 13, 17, 2, 6, 10, 14, 18, 3, 7, 11, 15, 19]], ["CA", 2, 3, 14], ["CHR", 1, "shared", [2]], ["CA", 2, 3, 15], ["CHR", 0, "shared", [3]], ["CA", 1, 4, 15], ["FU", 5, [0, 1, 2, 3, 4]], ["AN", 5, 0, 5], ["FU", 5, [1, 2, 3, 4, 5]], ["AN", 5, 1, 4], ["FU", 5, [2, 3, 4, 5, 6]], ["AN", 5, 2, 6], ["FU", 3, [0, 1, 2]], ["SP", 3, 0, 64, [1], 1], ["AN", 3, 1, 2], ["FFSP", 3, 0, [5, 4, 3, 2, 1], 1, 1], ["AN", 3, 1, 6], ["FU", 1, [0, 1, 2, 3]], ["SP", 1, 0, 32, [1], 1], ["AN", 1, 1, 2], ["FFSP", 1, 0, [5, 4, 3, 2, 1], 1, 1], ["AN", 1, 1, 6], ["PR", 4, 0, "auto_unroll_max_step$64"]]]], "r": [[0.00403971, 0.00404003, 0.00403845], 0, 7.33577, 1667974032], "v": "v0.6"}
{"i": [["[\"hfused_conv1x1_stride\", 1, 7, 7, 2048, 32, 64, 1]", "cuda -keys=cuda,gpu -max_num_threads=1024 -model=unknown -thread_warp_size=32", [-1, 16, 64, 49152, 2147483647, 1024, 8, 32], "", 0, []], [[], [["CHW", 2, "local"], ["SP", 2, 0, 1, [1, 1, 1, 1], 1], ["SP", 2, 5, 64, [1, 1, 32, 2], 1], ["SP", 2, 10, 7, [1, 7, 1, 1], 1], ["SP", 2, 15, 7, [1, 7, 1, 1], 1], ["SP", 2, 20, 32, [1, 8, 1, 1], 1], ["SP", 2, 25, 2048, [2, 1], 1], ["RE", 2, [0, 5, 10, 15, 20, 1, 6, 11, 16, 21, 2, 7, 12, 17, 22, 25, 26, 3, 8, 13, 18, 23, 27, 4, 9, 14, 19, 24]], ["FSP", 3, 0, 1, 3], ["FSP", 3, 4, 2, 3], ["FSP", 3, 8, 3, 3], ["FSP", 3, 12, 4, 3], ["FSP", 3, 16, 5, 3], ["RE", 3, [0, 4, 8, 12, 16, 1, 5, 9, 13, 17, 2, 6, 10, 14, 18, 3, 7, 11, 15, 19]], ["CA", 2, 3, 14], ["CHR", 1, "shared", [2]], ["CA", 2, 3, 15], ["CHR", 0, "shared", [3]], ["CA", 1, 4, 15], ["FU", 5, [0, 1, 2, 3, 4]], ["AN", 5, 0, 5], ["FU", 5, [1, 2, 3, 4, 5]], ["AN", 5, 1, 4], ["FU", 5, [2, 3, 4, 5, 6]], ["AN", 5, 2, 6], ["FU", 3, [0, 1, 2]], ["SP", 3, 0, 128, [1], 1], ["AN", 3, 1, 2], ["FFSP", 3, 0, [5, 4, 3, 2, 1], 1, 1], ["AN", 3, 1, 6], ["FU", 1, [0, 1, 2, 3]], ["SP", 1, 0, 14, [1], 1], ["AN", 1, 1, 2], ["FFSP", 1, 0, [5, 4, 3, 2, 1], 1, 1], ["AN", 1, 1, 6], ["PR", 4, 0, "auto_unroll_max_step$16"]]]], "r": [[0.0019326, 0.00193296, 0.00193172], 0, 6.2798, 1667974031], "v": "v0.6"}
{"i": [["[\"hfused_conv1x1_stride\", 1, 7, 7, 2048, 32, 64, 1]", "cuda -keys=cuda,gpu -max_num_threads=1024 -model=unknown -thread_warp_size=32", [-1, 16, 64, 49152, 2147483647, 1024, 8, 32], "", 0, []], [[], [["CHW", 2, "local"], ["SP", 2, 0, 1, [1, 1, 1, 1], 1], ["SP", 2, 5, 64, [2, 8, 2, 1], 1], ["SP", 2, 10, 7, [1, 1, 1, 1], 1], ["SP", 2, 15, 7, [1, 1, 1, 7], 1], ["SP", 2, 20, 32, [1, 1, 1, 1], 1], ["SP", 2, 25, 2048, [32, 1], 1], ["RE", 2, [0, 5, 10, 15, 20, 1, 6, 11, 16, 21, 2, 7, 12, 17, 22, 25, 26, 3, 8, 13, 18, 23, 27, 4, 9, 14, 19, 24]], ["FSP", 3, 0, 1, 3], ["FSP", 3, 4, 2, 3], ["FSP", 3, 8, 3, 3], ["FSP", 3, 12, 4, 3], ["FSP", 3, 16, 5, 3], ["RE", 3, [0, 4, 8, 12, 16, 1, 5, 9, 13, 17, 2, 6, 10, 14, 18, 3, 7, 11, 15, 19]], ["CA", 2, 3, 14], ["CHR", 1, "shared", [2]], ["CA", 2, 3, 15], ["CHR", 0, "shared", [3]], ["CA", 1, 4, 15], ["FU", 5, [0, 1, 2, 3, 4]], ["AN", 5, 0, 5], ["FU", 5, [1, 2, 3, 4, 5]], ["AN", 5, 1, 4], ["FU", 5, [2, 3, 4, 5, 6]], ["AN", 5, 2, 6], ["FU", 3, [0, 1, 2]], ["SP", 3, 0, 64, [1], 1], ["AN", 3, 1, 2], ["FFSP", 3, 0, [5, 4, 3, 2, 1], 1, 1], ["AN", 3, 1, 6], ["FU", 1, [0, 1, 2, 3]], ["SP", 1, 0, 32, [1], 1], ["AN", 1, 1, 2], ["FFSP", 1, 0, [5, 4, 3, 2, 1], 1, 1], ["AN", 1, 1, 6], ["PR", 4, 0, "auto_unroll_max_step$1024"]]]], "r": [[0.000461398, 0.000461897, 0.000462658], 0, 4.91913, 1667974027], "v": "v0.6"}
{"i": [["[\"hfused_conv1x1_stride\", 1, 7, 7, 2048, 32, 64, 1]", "cuda -keys=cuda,gpu -max_num_threads=1024 -model=unknown -thread_warp_size=32", [-1, 16, 64, 49152, 2147483647, 1024, 8, 32], "", 0, []], [[], [["CHW", 2, "local"], ["SP", 2, 0, 1, [1, 1, 1, 1], 1], ["SP", 2, 5, 64, [2, 8, 2, 1], 1], ["SP", 2, 10, 7, [1, 1, 1, 1], 1], ["SP", 2, 15, 7, [1, 7, 1, 1], 1], ["SP", 2, 20, 32, [1, 1, 1, 1], 1], ["SP", 2, 25, 2048, [32, 1], 1], ["RE", 2, [0, 5, 10, 15, 20, 1, 6, 11, 16, 21, 2, 7, 12, 17, 22, 25, 26, 3, 8, 13, 18, 23, 27, 4, 9, 14, 19, 24]], ["FSP", 3, 0, 1, 3], ["FSP", 3, 4, 2, 3], ["FSP", 3, 8, 3, 3], ["FSP", 3, 12, 4, 3], ["FSP", 3, 16, 5, 3], ["RE", 3, [0, 4, 8, 12, 16, 1, 5, 9, 13, 17, 2, 6, 10, 14, 18, 3, 7, 11, 15, 19]], ["CA", 2, 3, 14], ["CHR", 1, "shared", [2]], ["CA", 2, 3, 15], ["CHR", 0, "shared", [3]], ["CA", 1, 4, 15], ["FU", 5, [0, 1, 2, 3, 4]], ["AN", 5, 0, 5], ["FU", 5, [1, 2, 3, 4, 5]], ["AN", 5, 1, 4], ["FU", 5, [2, 3, 4, 5, 6]], ["AN", 5, 2, 6], ["FU", 3, [0, 1, 2]], ["SP", 3, 0, 64, [1], 1], ["AN", 3, 1, 2], ["FFSP", 3, 0, [5, 4, 3, 2, 1], 1, 1], ["AN", 3, 1, 6], ["FU", 1, [0, 1, 2, 3]], ["SP", 1, 0, 32, [16], 1], ["AN", 1, 1, 2], ["FFSP", 1, 0, [5, 4, 3, 2, 1], 1, 1], ["AN", 1, 1, 6], ["PR", 4, 0, "auto_unroll_max_step$1024"]]]], "r": [[0.000484838, 0.00048496, 0.000485253], 0, 9.07903, 1667974034], "v": "v0.6"}
{"i": [["[\"hfused_conv1x1_stride\", 1, 7, 7, 2048, 32, 64, 1]", "cuda -keys=cuda,gpu -max_num_threads=1024 -model=unknown -thread_warp_size=32", [-1, 16, 64, 49152, 2147483647, 1024, 8, 32], "", 0, []], [[], [["CHW", 2, "local"], ["SP", 2, 0, 1, [1, 1, 1, 1], 1], ["SP", 2, 5, 64, [2, 8, 2, 1], 1], ["SP", 2, 10, 7, [1, 7, 1, 1], 1], ["SP", 2, 15, 7, [1, 1, 7, 1], 1], ["SP", 2, 20, 32, [2, 1, 1, 8], 1], ["SP", 2, 25, 2048, [2, 4], 1], ["RE", 2, [0, 5, 10, 15, 20, 1, 6, 11, 16, 21, 2, 7, 12, 17, 22, 25, 26, 3, 8, 13, 18, 23, 27, 4, 9, 14, 19, 24]], ["FSP", 3, 0, 1, 3], ["FSP", 3, 4, 2, 3], ["FSP", 3, 8, 3, 3], ["FSP", 3, 12, 4, 3], ["FSP", 3, 16, 5, 3], ["RE", 3, [0, 4, 8, 12, 16, 1, 5, 9, 13, 17, 2, 6, 10, 14, 18, 3, 7, 11, 15, 19]], ["CA", 2, 3, 14], ["CHR", 1, "shared", [2]], ["CA", 2, 3, 15], ["CHR", 0, "shared", [3]], ["CA", 1, 4, 15], ["FU", 5, [0, 1, 2, 3, 4]], ["AN", 5, 0, 5], ["FU", 5, [1, 2, 3, 4, 5]], ["AN", 5, 1, 4], ["FU", 5, [2, 3, 4, 5, 6]], ["AN", 5, 2, 6], ["FU", 3, [0, 1, 2]], ["SP", 3, 0, 128, [1], 1], ["AN", 3, 1, 2], ["FFSP", 3, 0, [5, 4, 3, 2, 1], 1, 1], ["AN", 3, 1, 6], ["FU", 1, [0, 1, 2, 3]], ["SP", 1, 0, 56, [1], 1], ["AN", 1, 1, 2], ["FFSP", 1, 0, [5, 4, 3, 2, 1], 1, 1], ["AN", 1, 1, 6], ["PR", 4, 0, "auto_unroll_max_step$0"]]]], "r": [[0.00629077, 0.0062146, 0.00622436], 0, 4.13502, 1667974028], "v": "v0.6"}
{"i": [["[\"hfused_conv1x1_stride\", 1, 7, 7, 2048, 32, 64, 1]", "cuda -keys=cuda,gpu -max_num_threads=1024 -model=unknown -thread_warp_size=32", [-1, 16, 64, 49152, 2147483647, 1024, 8, 32], "", 0, []], [[], [["CHW", 2, "local"], ["SP", 2, 0, 1, [1, 1, 1, 1], 1], ["SP", 2, 5, 64, [1, 32, 1, 1], 1], ["SP", 2, 10, 7, [1, 7, 1, 1], 1], ["SP", 2, 15, 7, [1, 1, 7, 1], 1], ["SP", 2, 20, 32, [1, 2, 4, 2], 1], ["SP", 2, 25, 2048, [2, 2], 1], ["RE", 2, [0, 5, 10, 15, 20, 1, 6, 11, 16, 21, 2, 7, 12, 17, 22, 25, 26, 3, 8, 13, 18, 23, 27, 4, 9, 14, 19, 24]], ["FSP", 3, 0, 1, 3], ["FSP", 3, 4, 2, 3], ["FSP", 3, 8, 3, 3], ["FSP", 3, 12, 4, 3], ["FSP", 3, 16, 5, 3], ["RE", 3, [0, 4, 8, 12, 16, 1, 5, 9, 13, 17, 2, 6, 10, 14, 18, 3, 7, 11, 15, 19]], ["CA", 2, 3, 14], ["CHR", 1, "shared", [2]], ["CA", 2, 3, 15], ["CHR", 0, "shared", [3]], ["CA", 1, 4, 15], ["FU", 5, [0, 1, 2, 3, 4]], ["AN", 5, 0, 5], ["FU", 5, [1, 2, 3, 4, 5]], ["AN", 5, 1, 4], ["FU", 5, [2, 3, 4, 5, 6]], ["AN", 5, 2, 6], ["FU", 3, [0, 1, 2]], ["SP", 3, 0, 32, [1], 1], ["AN", 3, 1, 2], ["FFSP", 3, 0, [5, 4, 3, 2, 1], 1, 1], ["AN", 3, 1, 6], ["FU", 1, [0, 1, 2, 3]], ["SP", 1, 0, 28, [1], 1], ["AN", 1, 1, 2], ["FFSP", 1, 0, [5, 4, 3, 2, 1], 1, 1], ["AN", 1, 1, 6], ["PR", 4, 0, "auto_unroll_max_step$1024"]]]], "r": [[0.00103538, 0.00103628, 0.0010363], 0, 2.60964, 1667974027], "v": "v0.6"}
{"i": [["[\"hfused_conv1x1_stride\", 1, 7, 7, 2048, 32, 64, 1]", "cuda -keys=cuda,gpu -max_num_threads=1024 -model=unknown -thread_warp_size=32", [-1, 16, 64, 49152, 2147483647, 1024, 8, 32], "", 0, []], [[], [["CHW", 2, "local"], ["SP", 2, 0, 1, [1, 1, 1, 1], 1], ["SP", 2, 5, 64, [2, 2, 1, 1], 1], ["SP", 2, 10, 7, [1, 1, 1, 1], 1], ["SP", 2, 15, 7, [1, 7, 1, 1], 1], ["SP", 2, 20, 32, [2, 8, 2, 1], 1], ["SP", 2, 25, 2048, [8, 1], 1], ["RE", 2, [0, 5, 10, 15, 20, 1, 6, 11, 16, 21, 2, 7, 12, 17, 22, 25, 26, 3, 8, 13, 18, 23, 27, 4, 9, 14, 19, 24]], ["FSP", 3, 0, 1, 3], ["FSP", 3, 4, 2, 3], ["FSP", 3, 8, 3, 3], ["FSP", 3, 12, 4, 3], ["FSP", 3, 16, 5, 3], ["RE", 3, [0, 4, 8, 12, 16, 1, 5, 9, 13, 17, 2, 6, 10, 14, 18, 3, 7, 11, 15, 19]], ["CA", 2, 3, 14], ["CHR", 1, "shared", [2]], ["CA", 2, 3, 15], ["CHR", 0, "shared", [3]], ["CA", 1, 4, 15], ["FU", 5, [0, 1, 2, 3, 4]], ["AN", 5, 0, 5], ["FU", 5, [1, 2, 3, 4, 5]], ["AN", 5, 1, 4], ["FU", 5, [2, 3, 4, 5, 6]], ["AN", 5, 2, 6], ["FU", 3, [0, 1, 2]], ["SP", 3, 0, 64, [1], 1], ["AN", 3, 1, 2], ["FFSP", 3, 0, [5, 4, 3, 2, 1], 1, 1], ["AN", 3, 1, 6], ["FU", 1, [0, 1, 2, 3]], ["SP", 1, 0, 8, [4], 1], ["AN", 1, 1, 2], ["FFSP", 1, 0, [5, 4, 3, 2, 1], 1, 1], ["AN", 1, 1, 6], ["PR", 4, 0, "auto_unroll_max_step$16"]]]], "r": [[0.000222848, 0.000222575, 0.00022277], 0, 8.68641, 1667974033], "v": "v0.6"}
{"i": [["[\"hfused_conv1x1_stride\", 1, 7, 7, 2048, 32, 64, 1]", "cuda -keys=cuda,gpu -max_num_threads=1024 -model=unknown -thread_warp_size=32", [-1, 16, 64, 49152, 2147483647, 1024, 8, 32], "", 0, []], [[], [["CHW", 2, "local"], ["SP", 2, 0, 1, [1, 1, 1, 1], 1], ["SP", 2, 5, 64, [2, 8, 1, 1], 1], ["SP", 2, 10, 7, [7, 1, 1, 1], 1], ["SP", 2, 15, 7, [1, 7, 1, 1], 1], ["SP", 2, 20, 32, [1, 1, 16, 1], 1], ["SP", 2, 25, 2048, [1, 4], 1], ["RE", 2, [0, 5, 10, 15, 20, 1, 6, 11, 16, 21, 2, 7, 12, 17, 22, 25, 26, 3, 8, 13, 18, 23, 27, 4, 9, 14, 19, 24]], ["FSP", 3, 0, 1, 3], ["FSP", 3, 4, 2, 3], ["FSP", 3, 8, 3, 3], ["FSP", 3, 12, 4, 3], ["FSP", 3, 16, 5, 3], ["RE", 3, [0, 4, 8, 12, 16, 1, 5, 9, 13, 17, 2, 6, 10, 14, 18, 3, 7, 11, 15, 19]], ["CA", 2, 3, 14], ["CHR", 1, "shared", [2]], ["CA", 2, 3, 15], ["CHR", 0, "shared", [3]], ["CA", 1, 4, 15], ["FU", 5, [0, 1, 2, 3, 4]], ["AN", 5, 0, 5], ["FU", 5, [1, 2, 3, 4, 5]], ["AN", 5, 1, 4], ["FU", 5, [2, 3, 4, 5, 6]], ["AN", 5, 2, 6], ["FU", 3, [0, 1, 2]], ["SP", 3, 0, 256, [32], 1], ["AN", 3, 1, 2], ["FFSP", 3, 0, [5, 4, 3, 2, 1], 1, 1], ["AN", 3, 1, 6], ["FU", 1, [0, 1, 2, 3]], ["SP", 1, 0, 112, [1], 1], ["AN", 1, 1, 2], ["FFSP", 1, 0, [5, 4, 3, 2, 1], 1, 1], ["AN", 1, 1, 6], ["PR", 4, 0, "auto_unroll_max_step$0"]]]], "r": [[0.00387669, 0.00387201, 0.00386951], 0, 11.315, 1667974036], "v": "v0.6"}
{"i": [["[\"hfused_conv1x1_stride\", 1, 7, 7, 2048, 32, 64, 1]", "cuda -keys=cuda,gpu -max_num_threads=1024 -model=unknown -thread_warp_size=32", [-1, 16, 64, 49152, 2147483647, 1024, 8, 32], "", 0, []], [[], [["CHW", 2, "local"], ["SP", 2, 0, 1, [1, 1, 1, 1], 1], ["SP", 2, 5, 64, [2, 1, 4, 4], 1], ["SP", 2, 10, 7, [1, 7, 1, 1], 1], ["SP", 2, 15, 7, [1, 7, 1, 1], 1], ["SP", 2, 20, 32, [1, 4, 1, 8], 1], ["SP", 2, 25, 2048, [4, 2], 1], ["RE", 2, [0, 5, 10, 15, 20, 1, 6, 11, 16, 21, 2, 7, 12, 17, 22, 25, 26, 3, 8, 13, 18, 23, 27, 4, 9, 14, 19, 24]], ["FSP", 3, 0, 1, 3], ["FSP", 3, 4, 2, 3], ["FSP", 3, 8, 3, 3], ["FSP", 3, 12, 4, 3], ["FSP", 3, 16, 5, 3], ["RE", 3, [0, 4, 8, 12, 16, 1, 5, 9, 13, 17, 2, 6, 10, 14, 18, 3, 7, 11, 15, 19]], ["CA", 2, 3, 14], ["CHR", 1, "shared", [2]], ["CA", 2, 3, 15], ["CHR", 0, "shared", [3]], ["CA", 1, 4, 15], ["FU", 5, [0, 1, 2, 3, 4]], ["AN", 5, 0, 5], ["FU", 5, [1, 2, 3, 4, 5]], ["AN", 5, 1, 4], ["FU", 5, [2, 3, 4, 5, 6]], ["AN", 5, 2, 6], ["FU", 3, [0, 1, 2]], ["SP", 3, 0, 512, [1], 1], ["AN", 3, 1, 2], ["FFSP", 3, 0, [5, 4, 3, 2, 1], 1, 1], ["AN", 3, 1, 6], ["FU", 1, [0, 1, 2, 3]], ["SP", 1, 0, 56, [1], 1], ["AN", 1, 1, 2], ["FFSP", 1, 0, [5, 4, 3, 2, 1], 1, 1], ["AN", 1, 1, 6], ["PR", 4, 0, "auto_unroll_max_step$0"]]]], "r": [[0.00546791, 0.00548285, 0.00547515], 0, 5.43879, 1667974029], "v": "v0.6"}
{"i": [["[\"hfused_conv1x1_stride\", 1, 7, 7, 2048, 32, 64, 1]", "cuda -keys=cuda,gpu -max_num_threads=1024 -model=unknown -thread_warp_size=32", [-1, 16, 64, 49152, 2147483647, 1024, 8, 32], "", 0, []], [[], [["CHW", 2, "local"], ["SP", 2, 0, 1, [1, 1, 1, 1], 1], ["SP", 2, 5, 64, [1, 16, 2, 2], 1], ["SP", 2, 10, 7, [1, 1, 7, 1], 1], ["SP", 2, 15, 7, [1, 7, 1, 1], 1], ["SP", 2, 20, 32, [4, 2, 1, 1], 1], ["SP", 2, 25, 2048, [1, 1], 1], ["RE", 2, [0, 5, 10, 15, 20, 1, 6, 11, 16, 21, 2, 7, 12, 17, 22, 25, 26, 3, 8, 13, 18, 23, 27, 4, 9, 14, 19, 24]], ["FSP", 3, 0, 1, 3], ["FSP", 3, 4, 2, 3], ["FSP", 3, 8, 3, 3], ["FSP", 3, 12, 4, 3], ["FSP", 3, 16, 5, 3], ["RE", 3, [0, 4, 8, 12, 16, 1, 5, 9, 13, 17, 2, 6, 10, 14, 18, 3, 7, 11, 15, 19]], ["CA", 2, 3, 14], ["CHR", 1, "shared", [2]], ["CA", 2, 3, 15], ["CHR", 0, "shared", [3]], ["CA", 1, 4, 15], ["FU", 5, [0, 1, 2, 3, 4]], ["AN", 5, 0, 5], ["FU", 5, [1, 2, 3, 4, 5]], ["AN", 5, 1, 4], ["FU", 5, [2, 3, 4, 5, 6]], ["AN", 5, 2, 6], ["FU", 3, [0, 1, 2]], ["SP", 3, 0, 4, [1], 1], ["AN", 3, 1, 2], ["FFSP", 3, 0, [5, 4, 3, 2, 1], 1, 1], ["AN", 3, 1, 6], ["FU", 1, [0, 1, 2, 3]], ["SP", 1, 0, 49, [1], 1], ["AN", 1, 1, 2], ["FFSP", 1, 0, [5, 4, 3, 2, 1], 1, 1], ["AN", 1, 1, 6], ["PR", 4, 0, "auto_unroll_max_step$64"]]]], "r": [[0.00155541, 0.00155897, 0.00155648], 0, 11.3534, 1667974036], "v": "v0.6"}
{"i": [["[\"hfused_conv1x1_stride\", 1, 7, 7, 2048, 32, 64, 1]", "cuda -keys=cuda,gpu -max_num_threads=1024 -model=unknown -thread_warp_size=32", [-1, 16, 64, 49152, 2147483647, 1024, 8, 32], "", 0, []], [[], [["CHW", 2, "local"], ["SP", 2, 0, 1, [1, 1, 1, 1], 1], ["SP", 2, 5, 64, [1, 1, 8, 2], 1], ["SP", 2, 10, 7, [1, 7, 1, 1], 1], ["SP", 2, 15, 7, [1, 1, 7, 1], 1], ["SP", 2, 20, 32, [2, 1, 1, 16], 1], ["SP", 2, 25, 2048, [16, 1], 1], ["RE", 2, [0, 5, 10, 15, 20, 1, 6, 11, 16, 21, 2, 7, 12, 17, 22, 25, 26, 3, 8, 13, 18, 23, 27, 4, 9, 14, 19, 24]], ["FSP", 3, 0, 1, 3], ["FSP", 3, 4, 2, 3], ["FSP", 3, 8, 3, 3], ["FSP", 3, 12, 4, 3], ["FSP", 3, 16, 5, 3], ["RE", 3, [0, 4, 8, 12, 16, 1, 5, 9, 13, 17, 2, 6, 10, 14, 18, 3, 7, 11, 15, 19]], ["CA", 2, 3, 14], ["CHR", 1, "shared", [2]], ["CA", 2, 3, 15], ["CHR", 0, "shared", [3]], ["CA", 1, 4, 15], ["FU", 5, [0, 1, 2, 3, 4]], ["AN", 5, 0, 5], ["FU", 5, [1, 2, 3, 4, 5]], ["AN", 5, 1, 4], ["FU", 5, [2, 3, 4, 5, 6]], ["AN", 5, 2, 6], ["FU", 3, [0, 1, 2]], ["SP", 3, 0, 4096, [1], 1], ["AN", 3, 1, 2], ["FFSP", 3, 0, [5, 4, 3, 2, 1], 1, 1], ["AN", 3, 1, 6], ["FU", 1, [0, 1, 2, 3]], ["SP", 1, 0, 16, [1], 1], ["AN", 1, 1, 2], ["FFSP", 1, 0, [5, 4, 3, 2, 1], 1, 1], ["AN", 1, 1, 6], ["PR", 4, 0, "auto_unroll_max_step$64"]]]], "r": [[0.0548296, 0.0548591, 0.0548578], 0, 21.5444, 1667974046], "v": "v0.6"}
{"i": [["[\"hfused_conv1x1_stride\", 1, 7, 7, 2048, 32, 64, 1]", "cuda -keys=cuda,gpu -max_num_threads=1024 -model=unknown -thread_warp_size=32", [-1, 16, 64, 49152, 2147483647, 1024, 8, 32], "", 0, []], [[], [["CHW", 2, "local"], ["SP", 2, 0, 1, [1, 1, 1, 1], 1], ["SP", 2, 5, 64, [2, 2, 2, 4], 1], ["SP", 2, 10, 7, [1, 7, 1, 1], 1], ["SP", 2, 15, 7, [1, 1, 7, 1], 1], ["SP", 2, 20, 32, [1, 4, 1, 8], 1], ["SP", 2, 25, 2048, [4, 2], 1], ["RE", 2, [0, 5, 10, 15, 20, 1, 6, 11, 16, 21, 2, 7, 12, 17, 22, 25, 26, 3, 8, 13, 18, 23, 27, 4, 9, 14, 19, 24]], ["FSP", 3, 0, 1, 3], ["FSP", 3, 4, 2, 3], ["FSP", 3, 8, 3, 3], ["FSP", 3, 12, 4, 3], ["FSP", 3, 16, 5, 3], ["RE", 3, [0, 4, 8, 12, 16, 1, 5, 9, 13, 17, 2, 6, 10, 14, 18, 3, 7, 11, 15, 19]], ["CA", 2, 3, 14], ["CHR", 1, "shared", [2]], ["CA", 2, 3, 15], ["CHR", 0, "shared", [3]], ["CA", 1, 4, 15], ["FU", 5, [0, 1, 2, 3, 4]], ["AN", 5, 0, 5], ["FU", 5, [1, 2, 3, 4, 5]], ["AN", 5, 1, 4], ["FU", 5, [2, 3, 4, 5, 6]], ["AN", 5, 2, 6], ["FU", 3, [0, 1, 2]], ["SP", 3, 0, 512, [1], 1], ["AN", 3, 1, 2], ["FFSP", 3, 0, [5, 4, 3, 2, 1], 1, 1], ["AN", 3, 1, 6], ["FU", 1, [0, 1, 2, 3]], ["SP", 1, 0, 56, [1], 1], ["AN", 1, 1, 2], ["FFSP", 1, 0, [5, 4, 3, 2, 1], 1, 1], ["AN", 1, 1, 6], ["PR", 4, 0, "auto_unroll_max_step$64"]]]], "r": [[0.0136131, 0.0136142, 0.0136149], 0, 15.861, 1667974040], "v": "v0.6"}
{"i": [["[\"hfused_conv1x1_stride\", 1, 7, 7, 2048, 32, 64, 1]", "cuda -keys=cuda,gpu -max_num_threads=1024 -model=unknown -thread_warp_size=32", [-1, 16, 64, 49152, 2147483647, 1024, 8, 32], "", 0, []], [[], [["CHW", 2, "local"], ["SP", 2, 0, 1, [1, 1, 1, 1], 1], ["SP", 2, 5, 64, [1, 4, 1, 4], 1], ["SP", 2, 10, 7, [1, 1, 7, 1], 1], ["SP", 2, 15, 7, [1, 1, 1, 1], 1], ["SP", 2, 20, 32, [4, 4, 2, 1], 1], ["SP", 2, 25, 2048, [2, 2], 1], ["RE", 2, [0, 5, 10, 15, 20, 1, 6, 11, 16, 21, 2, 7, 12, 17, 22, 25, 26, 3, 8, 13, 18, 23, 27, 4, 9, 14, 19, 24]], ["FSP", 3, 0, 1, 3], ["FSP", 3, 4, 2, 3], ["FSP", 3, 8, 3, 3], ["FSP", 3, 12, 4, 3], ["FSP", 3, 16, 5, 3], ["RE", 3, [0, 4, 8, 12, 16, 1, 5, 9, 13, 17, 2, 6, 10, 14, 18, 3, 7, 11, 15, 19]], ["CA", 2, 3, 14], ["CHR", 1, "shared", [2]], ["CA", 2, 3, 15], ["CHR", 0, "shared", [3]], ["CA", 1, 4, 15], ["FU", 5, [0, 1, 2, 3, 4]], ["AN", 5, 0, 5], ["FU", 5, [1, 2, 3, 4, 5]], ["AN", 5, 1, 4], ["FU", 5, [2, 3, 4, 5, 6]], ["AN", 5, 2, 6], ["FU", 3, [0, 1, 2]], ["SP", 3, 0, 32, [1], 1], ["AN", 3, 1, 2], ["FFSP", 3, 0, [5, 4, 3, 2, 1], 1, 1], ["AN", 3, 1, 6], ["FU", 1, [0, 1, 2, 3]], ["SP", 1, 0, 4, [2], 1], ["AN", 1, 1, 2], ["FFSP", 1, 0, [5, 4, 3, 2, 1], 1, 1], ["AN", 1, 1, 6], ["PR", 4, 0, "auto_unroll_max_step$1024"]]]], "r": [[0.00238405, 0.00238272, 0.00238354], 0, 16.1929, 1667974039], "v": "v0.6"}
{"i": [["[\"hfused_conv1x1_stride\", 1, 7, 7, 2048, 32, 64, 1]", "cuda -keys=cuda,gpu -max_num_threads=1024 -model=unknown -thread_warp_size=32", [-1, 16, 64, 49152, 2147483647, 1024, 8, 32], "", 0, []], [[], [["CHW", 2, "local"], ["SP", 2, 0, 1, [1, 1, 1, 1], 1], ["SP", 2, 5, 64, [1, 1, 4, 8], 1], ["SP", 2, 10, 7, [1, 1, 1, 1], 1], ["SP", 2, 15, 7, [1, 7, 1, 1], 1], ["SP", 2, 20, 32, [4, 1, 2, 2], 1], ["SP", 2, 25, 2048, [4, 1], 1], ["RE", 2, [0, 5, 10, 15, 20, 1, 6, 11, 16, 21, 2, 7, 12, 17, 22, 25, 26, 3, 8, 13, 18, 23, 27, 4, 9, 14, 19, 24]], ["FSP", 3, 0, 1, 3], ["FSP", 3, 4, 2, 3], ["FSP", 3, 8, 3, 3], ["FSP", 3, 12, 4, 3], ["FSP", 3, 16, 5, 3], ["RE", 3, [0, 4, 8, 12, 16, 1, 5, 9, 13, 17, 2, 6, 10, 14, 18, 3, 7, 11, 15, 19]], ["CA", 2, 3, 14], ["CHR", 1, "shared", [2]], ["CA", 2, 3, 15], ["CHR", 0, "shared", [3]], ["CA", 1, 4, 15], ["FU", 5, [0, 1, 2, 3, 4]], ["AN", 5, 0, 5], ["FU", 5, [1, 2, 3, 4, 5]], ["AN", 5, 1, 4], ["FU", 5, [2, 3, 4, 5, 6]], ["AN", 5, 2, 6], ["FU", 3, [0, 1, 2]], ["SP", 3, 0, 1024, [8], 1], ["AN", 3, 1, 2], ["FFSP", 3, 0, [5, 4, 3, 2, 1], 1, 1], ["AN", 3, 1, 6], ["FU", 1, [0, 1, 2, 3]], ["SP", 1, 0, 4, [1], 1], ["AN", 1, 1, 2], ["FFSP", 1, 0, [5, 4, 3, 2, 1], 1, 1], ["AN", 1, 1, 6], ["PR", 4, 0, "auto_unroll_max_step$0"]]]], "r": [[0.0147591, 0.014752, 0.0147334], 0, 13.0304, 1667974037], "v": "v0.6"}
{"i": [["[\"hfused_conv1x1_stride\", 1, 7, 7, 2048, 32, 64, 1]", "cuda -keys=cuda,gpu -max_num_threads=1024 -model=unknown -thread_warp_size=32", [-1, 16, 64, 49152, 2147483647, 1024, 8, 32], "", 0, []], [[], [["CHW", 2, "local"], ["SP", 2, 0, 1, [1, 1, 1, 1], 1], ["SP", 2, 5, 64, [1, 16, 1, 2], 1], ["SP", 2, 10, 7, [1, 1, 1, 7], 1], ["SP", 2, 15, 7, [1, 1, 7, 1], 1], ["SP", 2, 20, 32, [1, 2, 1, 16], 1], ["SP", 2, 25, 2048, [1, 8], 1], ["RE", 2, [0, 5, 10, 15, 20, 1, 6, 11, 16, 21, 2, 7, 12, 17, 22, 25, 26, 3, 8, 13, 18, 23, 27, 4, 9, 14, 19, 24]], ["FSP", 3, 0, 1, 3], ["FSP", 3, 4, 2, 3], ["FSP", 3, 8, 3, 3], ["FSP", 3, 12, 4, 3], ["FSP", 3, 16, 5, 3], ["RE", 3, [0, 4, 8, 12, 16, 1, 5, 9, 13, 17, 2, 6, 10, 14, 18, 3, 7, 11, 15, 19]], ["CA", 2, 3, 14], ["CHR", 1, "shared", [2]], ["CA", 2, 3, 15], ["CHR", 0, "shared", [3]], ["CA", 1, 4, 15], ["FU", 5, [0, 1, 2, 3, 4]], ["AN", 5, 0, 5], ["FU", 5, [1, 2, 3, 4, 5]], ["AN", 5, 1, 4], ["FU", 5, [2, 3, 4, 5, 6]], ["AN", 5, 2, 6], ["FU", 3, [0, 1, 2]], ["SP", 3, 0, 256, [1], 1], ["AN", 3, 1, 2], ["FFSP", 3, 0, [5, 4, 3, 2, 1], 1, 1], ["AN", 3, 1, 6], ["FU", 1, [0, 1, 2, 3]], ["SP", 1, 0, 56, [1], 1], ["AN", 1, 1, 2], ["FFSP", 1, 0, [5, 4, 3, 2, 1], 1, 1], ["AN", 1, 1, 6], ["PR", 4, 0, "auto_unroll_max_step$512"]]]], "r": [[0.0119951, 0.0119936, 0.0119838], 0, 15.2613, 1667974038], "v": "v0.6"}
{"i": [["[\"hfused_conv1x1_stride\", 1, 7, 7, 2048, 32, 64, 1]", "cuda -keys=cuda,gpu -max_num_threads=1024 -model=unknown -thread_warp_size=32", [-1, 16, 64, 49152, 2147483647, 1024, 8, 32], "", 0, []], [[], [["CHW", 2, "local"], ["SP", 2, 0, 1, [1, 1, 1, 1], 1], ["SP", 2, 5, 64, [1, 8, 4, 2], 1], ["SP", 2, 10, 7, [1, 1, 7, 1], 1], ["SP", 2, 15, 7, [1, 1, 7, 1], 1], ["SP", 2, 20, 32, [1, 4, 2, 1], 1], ["SP", 2, 25, 2048, [16, 1], 1], ["RE", 2, [0, 5, 10, 15, 20, 1, 6, 11, 16, 21, 2, 7, 12, 17, 22, 25, 26, 3, 8, 13, 18, 23, 27, 4, 9, 14, 19, 24]], ["FSP", 3, 0, 1, 3], ["FSP", 3, 4, 2, 3], ["FSP", 3, 8, 3, 3], ["FSP", 3, 12, 4, 3], ["FSP", 3, 16, 5, 3], ["RE", 3, [0, 4, 8, 12, 16, 1, 5, 9, 13, 17, 2, 6, 10, 14, 18, 3, 7, 11, 15, 19]], ["CA", 2, 3, 14], ["CHR", 1, "shared", [2]], ["CA", 2, 3, 15], ["CHR", 0, "shared", [3]], ["CA", 1, 4, 15], ["FU", 5, [0, 1, 2, 3, 4]], ["AN", 5, 0, 5], ["FU", 5, [1, 2, 3, 4, 5]], ["AN", 5, 1, 4], ["FU", 5, [2, 3, 4, 5, 6]], ["AN", 5, 2, 6], ["FU", 3, [0, 1, 2]], ["SP", 3, 0, 256, [1], 1], ["AN", 3, 1, 2], ["FFSP", 3, 0, [5, 4, 3, 2, 1], 1, 1], ["AN", 3, 1, 6], ["FU", 1, [0, 1, 2, 3]], ["SP", 1, 0, 784, [1], 1], ["AN", 1, 1, 2], ["FFSP", 1, 0, [5, 4, 3, 2, 1], 1, 1], ["AN", 1, 1, 6], ["PR", 4, 0, "auto_unroll_max_step$0"]]]], "r": [[0.0120406, 0.0120464, 0.0120536], 0, 17.2426, 1667974042], "v": "v0.6"}
{"i": [["[\"hfused_conv1x1_stride\", 1, 7, 7, 2048, 32, 64, 1]", "cuda -keys=cuda,gpu -max_num_threads=1024 -model=unknown -thread_warp_size=32", [-1, 16, 64, 49152, 2147483647, 1024, 8, 32], "", 0, []], [[], [["CHW", 2, "local"], ["SP", 2, 0, 1, [1, 1, 1, 1], 1], ["SP", 2, 5, 64, [4, 2, 2, 2], 1], ["SP", 2, 10, 7, [1, 7, 1, 1], 1], ["SP", 2, 15, 7, [1, 7, 1, 1], 1], ["SP", 2, 20, 32, [1, 8, 1, 2], 1], ["SP", 2, 25, 2048, [4, 1], 1], ["RE", 2, [0, 5, 10, 15, 20, 1, 6, 11, 16, 21, 2, 7, 12, 17, 22, 25, 26, 3, 8, 13, 18, 23, 27, 4, 9, 14, 19, 24]], ["FSP", 3, 0, 1, 3], ["FSP", 3, 4, 2, 3], ["FSP", 3, 8, 3, 3], ["FSP", 3, 12, 4, 3], ["FSP", 3, 16, 5, 3], ["RE", 3, [0, 4, 8, 12, 16, 1, 5, 9, 13, 17, 2, 6, 10, 14, 18, 3, 7, 11, 15, 19]], ["CA", 2, 3, 14], ["CHR", 1, "shared", [2]], ["CA", 2, 3, 15], ["CHR", 0, "shared", [3]], ["CA", 1, 4, 15], ["FU", 5, [0, 1, 2, 3, 4]], ["AN", 5, 0, 5], ["FU", 5, [1, 2, 3, 4, 5]], ["AN", 5, 1, 4], ["FU", 5, [2, 3, 4, 5, 6]], ["AN", 5, 2, 6], ["FU", 3, [0, 1, 2]], ["SP", 3, 0, 32, [1], 1], ["AN", 3, 1, 2], ["FFSP", 3, 0, [5, 4, 3, 2, 1], 1, 1], ["AN", 3, 1, 6], ["FU", 1, [0, 1, 2, 3]], ["SP", 1, 0, 4, [1], 1], ["AN", 1, 1, 2], ["FFSP", 1, 0, [5, 4, 3, 2, 1], 1, 1], ["AN", 1, 1, 6], ["PR", 4, 0, "auto_unroll_max_step$0"]]]], "r": [[0.00170038, 0.00169323, 0.00169348], 0, 18.5206, 1667974044], "v": "v0.6"}
{"i": [["[\"hfused_conv1x1_stride\", 1, 7, 7, 2048, 32, 64, 1]", "cuda -keys=cuda,gpu -max_num_threads=1024 -model=unknown -thread_warp_size=32", [-1, 16, 64, 49152, 2147483647, 1024, 8, 32], "", 0, []], [[], [["CHW", 2, "local"], ["SP", 2, 0, 1, [1, 1, 1, 1], 1], ["SP", 2, 5, 64, [1, 1, 16, 1], 1], ["SP", 2, 10, 7, [1, 7, 1, 1], 1], ["SP", 2, 15, 7, [1, 7, 1, 1], 1], ["SP", 2, 20, 32, [2, 1, 1, 16], 1], ["SP", 2, 25, 2048, [2, 1], 1], ["RE", 2, [0, 5, 10, 15, 20, 1, 6, 11, 16, 21, 2, 7, 12, 17, 22, 25, 26, 3, 8, 13, 18, 23, 27, 4, 9, 14, 19, 24]], ["FSP", 3, 0, 1, 3], ["FSP", 3, 4, 2, 3], ["FSP", 3, 8, 3, 3], ["FSP", 3, 12, 4, 3], ["FSP", 3, 16, 5, 3], ["RE", 3, [0, 4, 8, 12, 16, 1, 5, 9, 13, 17, 2, 6, 10, 14, 18, 3, 7, 11, 15, 19]], ["CA", 2, 3, 14], ["CHR", 1, "shared", [2]], ["CA", 2, 3, 15], ["CHR", 0, "shared", [3]], ["CA", 1, 4, 15], ["FU", 5, [0, 1, 2, 3, 4]], ["AN", 5, 0, 5], ["FU", 5, [1, 2, 3, 4, 5]], ["AN", 5, 1, 4], ["FU", 5, [2, 3, 4, 5, 6]], ["AN", 5, 2, 6], ["FU", 3, [0, 1, 2]], ["SP", 3, 0, 4096, [1], 1], ["AN", 3, 1, 2], ["FFSP", 3, 0, [5, 4, 3, 2, 1], 1, 1], ["AN", 3, 1, 6], ["FU", 1, [0, 1, 2, 3]], ["SP", 1, 0, 16, [1], 1], ["AN", 1, 1, 2], ["FFSP", 1, 0, [5, 4, 3, 2, 1], 1, 1], ["AN", 1, 1, 6], ["PR", 4, 0, "auto_unroll_max_step$0"]]]], "r": [[0.0129816, 0.0129855, 0.0129645], 0, 18.5215, 1667974043], "v": "v0.6"}
