python/models/resnext/ResNextHorizontal_kernel_configs/resnext_imagenet_50_hfused_relu_1_14_14_32_64.log
{"i": [["[\"hfused_relu\", 1, 14, 14, 32, 64]", "cuda -keys=cuda,gpu -max_num_threads=1024 -model=unknown -thread_warp_size=32", [-1, 16, 64, 49152, 2147483647, 1024, 8, 32], "", 0, []], [[], [["FU", 1, [0, 1, 2, 3, 4]], ["SP", 1, 0, 401408, [56], 1], ["AN", 1, 0, 5], ["AN", 1, 1, 6]]]], "r": [[7.86789e-06, 7.883e-06, 7.87647e-06], 0, 1.15296, 1667897516], "v": "v0.6"}
{"i": [["[\"hfused_relu\", 1, 14, 14, 32, 64]", "cuda -keys=cuda,gpu -max_num_threads=1024 -model=unknown -thread_warp_size=32", [-1, 16, 64, 49152, 2147483647, 1024, 8, 32], "", 0, []], [[], [["FU", 1, [0, 1, 2, 3, 4]], ["SP", 1, 0, 401408, [2], 1], ["AN", 1, 0, 5], ["AN", 1, 1, 6]]]], "r": [[0.000151519, 0.000151541, 0.000151534], 0, 2.11446, 1667897517], "v": "v0.6"}
{"i": [["[\"hfused_relu\", 1, 14, 14, 32, 64]", "cuda -keys=cuda,gpu -max_num_threads=1024 -model=unknown -thread_warp_size=32", [-1, 16, 64, 49152, 2147483647, 1024, 8, 32], "", 0, []], [[], [["FU", 1, [0, 1, 2, 3, 4]], ["SP", 1, 0, 401408, [14], 1], ["AN", 1, 0, 5], ["AN", 1, 1, 6]]]], "r": [[2.40672e-05, 2.4067e-05, 2.40643e-05], 0, 1.45534, 1667897517], "v": "v0.6"}
{"i": [["[\"hfused_relu\", 1, 14, 14, 32, 64]", "cuda -keys=cuda,gpu -max_num_threads=1024 -model=unknown -thread_warp_size=32", [-1, 16, 64, 49152, 2147483647, 1024, 8, 32], "", 0, []], [[], [["FU", 1, [0, 1, 2, 3, 4]], ["SP", 1, 0, 401408, [64], 1], ["AN", 1, 0, 5], ["AN", 1, 1, 6]]]], "r": [[7.23323e-06, 7.237e-06, 7.22717e-06], 0, 0.521828, 1667897516], "v": "v0.6"}
{"i": [["[\"hfused_relu\", 1, 14, 14, 32, 64]", "cuda -keys=cuda,gpu -max_num_threads=1024 -model=unknown -thread_warp_size=32", [-1, 16, 64, 49152, 2147483647, 1024, 8, 32], "", 0, []], [[], [["FU", 1, [0, 1, 2, 3, 4]], ["SP", 1, 0, 401408, [28], 1], ["AN", 1, 0, 5], ["AN", 1, 1, 6]]]], "r": [[1.34539e-05, 1.34832e-05, 1.3466e-05], 0, 0.860323, 1667897516], "v": "v0.6"}
{"i": [["[\"hfused_relu\", 1, 14, 14, 32, 64]", "cuda -keys=cuda,gpu -max_num_threads=1024 -model=unknown -thread_warp_size=32", [-1, 16, 64, 49152, 2147483647, 1024, 8, 32], "", 0, []], [[], [["FU", 1, [0, 1, 2, 3, 4]], ["SP", 1, 0, 401408, [16], 1], ["AN", 1, 0, 5], ["AN", 1, 1, 6]]]], "r": [[2.12713e-05, 2.12804e-05, 2.12997e-05], 0, 1.81056, 1667897517], "v": "v0.6"}
{"i": [["[\"hfused_relu\", 1, 14, 14, 32, 64]", "cuda -keys=cuda,gpu -max_num_threads=1024 -model=unknown -thread_warp_size=32", [-1, 16, 64, 49152, 2147483647, 1024, 8, 32], "", 0, []], [[], [["FU", 1, [0, 1, 2, 3, 4]], ["SP", 1, 0, 401408, [49], 1], ["AN", 1, 0, 5], ["AN", 1, 1, 6]]]], "r": [[8.64324e-06, 8.65694e-06, 8.65638e-06], 0, 2.76494, 1667897518], "v": "v0.6"}
{"i": [["[\"hfused_relu\", 1, 14, 14, 32, 64]", "cuda -keys=cuda,gpu -max_num_threads=1024 -model=unknown -thread_warp_size=32", [-1, 16, 64, 49152, 2147483647, 1024, 8, 32], "", 0, []], [[], [["FU", 1, [0, 1, 2, 3, 4]], ["SP", 1, 0, 401408, [8], 1], ["AN", 1, 0, 5], ["AN", 1, 1, 6]]]], "r": [[3.99919e-05, 4.00009e-05, 3.99967e-05], 0, 2.42791, 1667897518], "v": "v0.6"}
{"i": [["[\"hfused_relu\", 1, 14, 14, 32, 64]", "cuda -keys=cuda,gpu -max_num_threads=1024 -model=unknown -thread_warp_size=32", [-1, 16, 64, 49152, 2147483647, 1024, 8, 32], "", 0, []], [[], [["FU", 1, [0, 1, 2, 3, 4]], ["SP", 1, 0, 401408, [1], 1], ["AN", 1, 0, 5], ["AN", 1, 1, 6]]]], "r": [[0.000300429, 0.00030044, 0.000300429], 0, 3.73411, 1667897519], "v": "v0.6"}
{"i": [["[\"hfused_relu\", 1, 14, 14, 32, 64]", "cuda -keys=cuda,gpu -max_num_threads=1024 -model=unknown -thread_warp_size=32", [-1, 16, 64, 49152, 2147483647, 1024, 8, 32], "", 0, []], [[], [["FU", 1, [0, 1, 2, 3, 4]], ["SP", 1, 0, 401408, [32], 1], ["AN", 1, 0, 5], ["AN", 1, 1, 6]]]], "r": [[1.21081e-05, 1.20914e-05, 1.21054e-05], 0, 3.38764, 1667897519], "v": "v0.6"}
{"i": [["[\"hfused_relu\", 1, 14, 14, 32, 64]", "cuda -keys=cuda,gpu -max_num_threads=1024 -model=unknown -thread_warp_size=32", [-1, 16, 64, 49152, 2147483647, 1024, 8, 32], "", 0, []], [[], [["FU", 1, [0, 1, 2, 3, 4]], ["SP", 1, 0, 401408, [7], 1], ["AN", 1, 0, 5], ["AN", 1, 1, 6]]]], "r": [[4.52642e-05, 4.52681e-05, 4.5266e-05], 0, 4.03006, 1667897519], "v": "v0.6"}
{"i": [["[\"hfused_relu\", 1, 14, 14, 32, 64]", "cuda -keys=cuda,gpu -max_num_threads=1024 -model=unknown -thread_warp_size=32", [-1, 16, 64, 49152, 2147483647, 1024, 8, 32], "", 0, []], [[], [["FU", 1, [0, 1, 2, 3, 4]], ["SP", 1, 0, 401408, [4], 1], ["AN", 1, 0, 5], ["AN", 1, 1, 6]]]], "r": [[7.71118e-05, 7.71211e-05, 7.71182e-05], 0, 3.07394, 1667897518], "v": "v0.6"}
{"i": [["[\"hfused_relu\", 1, 14, 14, 32, 64]", "cuda -keys=cuda,gpu -max_num_threads=1024 -model=unknown -thread_warp_size=32", [-1, 16, 64, 49152, 2147483647, 1024, 8, 32], "", 0, []], [[], [["FU", 1, [0, 1, 2, 3, 4]], ["SP", 1, 0, 401408, [56], 1], ["AN", 1, 0, 5], ["AN", 1, 1, 6]]]], "r": [[7.89494e-06, 7.90968e-06, 7.91431e-06], 0, 1.24011, 1667971393], "v": "v0.6"}
{"i": [["[\"hfused_relu\", 1, 14, 14, 32, 64]", "cuda -keys=cuda,gpu -max_num_threads=1024 -model=unknown -thread_warp_size=32", [-1, 16, 64, 49152, 2147483647, 1024, 8, 32], "", 0, []], [[], [["FU", 1, [0, 1, 2, 3, 4]], ["SP", 1, 0, 401408, [28], 1], ["AN", 1, 0, 5], ["AN", 1, 1, 6]]]], "r": [[1.34561e-05, 1.3485e-05, 1.34802e-05], 0, 1.9341, 1667971394], "v": "v0.6"}
{"i": [["[\"hfused_relu\", 1, 14, 14, 32, 64]", "cuda -keys=cuda,gpu -max_num_threads=1024 -model=unknown -thread_warp_size=32", [-1, 16, 64, 49152, 2147483647, 1024, 8, 32], "", 0, []], [[], [["FU", 1, [0, 1, 2, 3, 4]], ["SP", 1, 0, 401408, [7], 1], ["AN", 1, 0, 5], ["AN", 1, 1, 6]]]], "r": [[4.51663e-05, 4.51726e-05, 4.51676e-05], 0, 1.56512, 1667971393], "v": "v0.6"}
{"i": [["[\"hfused_relu\", 1, 14, 14, 32, 64]", "cuda -keys=cuda,gpu -max_num_threads=1024 -model=unknown -thread_warp_size=32", [-1, 16, 64, 49152, 2147483647, 1024, 8, 32], "", 0, []], [[], [["FU", 1, [0, 1, 2, 3, 4]], ["SP", 1, 0, 401408, [14], 1], ["AN", 1, 0, 5], ["AN", 1, 1, 6]]]], "r": [[2.40007e-05, 2.40071e-05, 2.40092e-05], 0, 0.544181, 1667971392], "v": "v0.6"}
{"i": [["[\"hfused_relu\", 1, 14, 14, 32, 64]", "cuda -keys=cuda,gpu -max_num_threads=1024 -model=unknown -thread_warp_size=32", [-1, 16, 64, 49152, 2147483647, 1024, 8, 32], "", 0, []], [[], [["FU", 1, [0, 1, 2, 3, 4]], ["SP", 1, 0, 401408, [1], 1], ["AN", 1, 0, 5], ["AN", 1, 1, 6]]]], "r": [[0.000300431, 0.000300404, 0.000300448], 0, 0.905092, 1667971393], "v": "v0.6"}
{"i": [["[\"hfused_relu\", 1, 14, 14, 32, 64]", "cuda -keys=cuda,gpu -max_num_threads=1024 -model=unknown -thread_warp_size=32", [-1, 16, 64, 49152, 2147483647, 1024, 8, 32], "", 0, []], [[], [["FU", 1, [0, 1, 2, 3, 4]], ["SP", 1, 0, 401408, [64], 1], ["AN", 1, 0, 5], ["AN", 1, 1, 6]]]], "r": [[7.2666e-06, 7.28494e-06, 7.28216e-06], 0, 2.19807, 1667971394], "v": "v0.6"}
{"i": [["[\"hfused_relu\", 1, 14, 14, 32, 64]", "cuda -keys=cuda,gpu -max_num_threads=1024 -model=unknown -thread_warp_size=32", [-1, 16, 64, 49152, 2147483647, 1024, 8, 32], "", 0, []], [[], [["FU", 1, [0, 1, 2, 3, 4]], ["SP", 1, 0, 401408, [49], 1], ["AN", 1, 0, 5], ["AN", 1, 1, 6]]]], "r": [[8.65726e-06, 8.66421e-06, 8.6658e-06], 0, 3.19097, 1667971395], "v": "v0.6"}
{"i": [["[\"hfused_relu\", 1, 14, 14, 32, 64]", "cuda -keys=cuda,gpu -max_num_threads=1024 -model=unknown -thread_warp_size=32", [-1, 16, 64, 49152, 2147483647, 1024, 8, 32], "", 0, []], [[], [["FU", 1, [0, 1, 2, 3, 4]], ["SP", 1, 0, 401408, [4], 1], ["AN", 1, 0, 5], ["AN", 1, 1, 6]]]], "r": [[7.71258e-05, 7.71229e-05, 7.71057e-05], 0, 2.52842, 1667971395], "v": "v0.6"}
{"i": [["[\"hfused_relu\", 1, 14, 14, 32, 64]", "cuda -keys=cuda,gpu -max_num_threads=1024 -model=unknown -thread_warp_size=32", [-1, 16, 64, 49152, 2147483647, 1024, 8, 32], "", 0, []], [[], [["FU", 1, [0, 1, 2, 3, 4]], ["SP", 1, 0, 401408, [2], 1], ["AN", 1, 0, 5], ["AN", 1, 1, 6]]]], "r": [[0.000151572, 0.000151549, 0.000151572], 0, 2.87953, 1667971395], "v": "v0.6"}
{"i": [["[\"hfused_relu\", 1, 14, 14, 32, 64]", "cuda -keys=cuda,gpu -max_num_threads=1024 -model=unknown -thread_warp_size=32", [-1, 16, 64, 49152, 2147483647, 1024, 8, 32], "", 0, []], [[], [["FU", 1, [0, 1, 2, 3, 4]], ["SP", 1, 0, 401408, [8], 1], ["AN", 1, 0, 5], ["AN", 1, 1, 6]]]], "r": [[3.97844e-05, 3.97912e-05, 3.97917e-05], 0, 3.48725, 1667971396], "v": "v0.6"}
{"i": [["[\"hfused_relu\", 1, 14, 14, 32, 64]", "cuda -keys=cuda,gpu -max_num_threads=1024 -model=unknown -thread_warp_size=32", [-1, 16, 64, 49152, 2147483647, 1024, 8, 32], "", 0, []], [[], [["FU", 1, [0, 1, 2, 3, 4]], ["SP", 1, 0, 401408, [16], 1], ["AN", 1, 0, 5], ["AN", 1, 1, 6]]]], "r": [[2.12571e-05, 2.12672e-05, 2.12764e-05], 0, 4.16886, 1667971396], "v": "v0.6"}
{"i": [["[\"hfused_relu\", 1, 14, 14, 32, 64]", "cuda -keys=cuda,gpu -max_num_threads=1024 -model=unknown -thread_warp_size=32", [-1, 16, 64, 49152, 2147483647, 1024, 8, 32], "", 0, []], [[], [["FU", 1, [0, 1, 2, 3, 4]], ["SP", 1, 0, 401408, [32], 1], ["AN", 1, 0, 5], ["AN", 1, 1, 6]]]], "r": [[1.20211e-05, 1.20397e-05, 1.20414e-05], 0, 3.83739, 1667971396], "v": "v0.6"}
{"i": [["[\"hfused_relu\", 1, 14, 14, 32, 64]", "cuda -keys=cuda,gpu -max_num_threads=1024 -model=unknown -thread_warp_size=32", [-1, 16, 64, 49152, 2147483647, 1024, 8, 32], "", 0, []], [[], [["FU", 1, [0, 1, 2, 3, 4]], ["SP", 1, 0, 401408, [4], 1], ["AN", 1, 0, 5], ["AN", 1, 1, 6]]]], "r": [[7.71377e-05, 7.71479e-05, 7.71697e-05], 0, 0.538406, 1667972298], "v": "v0.6"}
{"i": [["[\"hfused_relu\", 1, 14, 14, 32, 64]", "cuda -keys=cuda,gpu -max_num_threads=1024 -model=unknown -thread_warp_size=32", [-1, 16, 64, 49152, 2147483647, 1024, 8, 32], "", 0, []], [[], [["FU", 1, [0, 1, 2, 3, 4]], ["SP", 1, 0, 401408, [8], 1], ["AN", 1, 0, 5], ["AN", 1, 1, 6]]]], "r": [[3.99684e-05, 3.99704e-05, 3.99688e-05], 0, 1.51921, 1667972299], "v": "v0.6"}
{"i": [["[\"hfused_relu\", 1, 14, 14, 32, 64]", "cuda -keys=cuda,gpu -max_num_threads=1024 -model=unknown -thread_warp_size=32", [-1, 16, 64, 49152, 2147483647, 1024, 8, 32], "", 0, []], [[], [["FU", 1, [0, 1, 2, 3, 4]], ["SP", 1, 0, 401408, [16], 1], ["AN", 1, 0, 5], ["AN", 1, 1, 6]]]], "r": [[2.12605e-05, 2.12661e-05, 2.12842e-05], 0, 2.87699, 1667972300], "v": "v0.6"}
{"i": [["[\"hfused_relu\", 1, 14, 14, 32, 64]", "cuda -keys=cuda,gpu -max_num_threads=1024 -model=unknown -thread_warp_size=32", [-1, 16, 64, 49152, 2147483647, 1024, 8, 32], "", 0, []], [[], [["FU", 1, [0, 1, 2, 3, 4]], ["SP", 1, 0, 401408, [2], 1], ["AN", 1, 0, 5], ["AN", 1, 1, 6]]]], "r": [[0.000151611, 0.000151603, 0.000151663], 0, 1.19025, 1667972299], "v": "v0.6"}
{"i": [["[\"hfused_relu\", 1, 14, 14, 32, 64]", "cuda -keys=cuda,gpu -max_num_threads=1024 -model=unknown -thread_warp_size=32", [-1, 16, 64, 49152, 2147483647, 1024, 8, 32], "", 0, []], [[], [["FU", 1, [0, 1, 2, 3, 4]], ["SP", 1, 0, 401408, [28], 1], ["AN", 1, 0, 5], ["AN", 1, 1, 6]]]], "r": [[1.3462e-05, 1.34827e-05, 1.34832e-05], 0, 0.878382, 1667972298], "v": "v0.6"}
{"i": [["[\"hfused_relu\", 1, 14, 14, 32, 64]", "cuda -keys=cuda,gpu -max_num_threads=1024 -model=unknown -thread_warp_size=32", [-1, 16, 64, 49152, 2147483647, 1024, 8, 32], "", 0, []], [[], [["FU", 1, [0, 1, 2, 3, 4]], ["SP", 1, 0, 401408, [56], 1], ["AN", 1, 0, 5], ["AN", 1, 1, 6]]]], "r": [[7.90664e-06, 7.91759e-06, 7.9139e-06], 0, 2.20464, 1667972300], "v": "v0.6"}
{"i": [["[\"hfused_relu\", 1, 14, 14, 32, 64]", "cuda -keys=cuda,gpu -max_num_threads=1024 -model=unknown -thread_warp_size=32", [-1, 16, 64, 49152, 2147483647, 1024, 8, 32], "", 0, []], [[], [["FU", 1, [0, 1, 2, 3, 4]], ["SP", 1, 0, 401408, [49], 1], ["AN", 1, 0, 5], ["AN", 1, 1, 6]]]], "r": [[8.6087e-06, 8.60976e-06, 8.611e-06], 0, 1.87934, 1667972299], "v": "v0.6"}
{"i": [["[\"hfused_relu\", 1, 14, 14, 32, 64]", "cuda -keys=cuda,gpu -max_num_threads=1024 -model=unknown -thread_warp_size=32", [-1, 16, 64, 49152, 2147483647, 1024, 8, 32], "", 0, []], [[], [["FU", 1, [0, 1, 2, 3, 4]], ["SP", 1, 0, 401408, [7], 1], ["AN", 1, 0, 5], ["AN", 1, 1, 6]]]], "r": [[4.52654e-05, 4.52694e-05, 4.52781e-05], 0, 3.48883, 1667972301], "v": "v0.6"}
{"i": [["[\"hfused_relu\", 1, 14, 14, 32, 64]", "cuda -keys=cuda,gpu -max_num_threads=1024 -model=unknown -thread_warp_size=32", [-1, 16, 64, 49152, 2147483647, 1024, 8, 32], "", 0, []], [[], [["FU", 1, [0, 1, 2, 3, 4]], ["SP", 1, 0, 401408, [1], 1], ["AN", 1, 0, 5], ["AN", 1, 1, 6]]]], "r": [[0.00030037, 0.000300338, 0.000300414], 0, 2.5097, 1667972300], "v": "v0.6"}
{"i": [["[\"hfused_relu\", 1, 14, 14, 32, 64]", "cuda -keys=cuda,gpu -max_num_threads=1024 -model=unknown -thread_warp_size=32", [-1, 16, 64, 49152, 2147483647, 1024, 8, 32], "", 0, []], [[], [["FU", 1, [0, 1, 2, 3, 4]], ["SP", 1, 0, 401408, [32], 1], ["AN", 1, 0, 5], ["AN", 1, 1, 6]]]], "r": [[1.20708e-05, 1.20861e-05, 1.20697e-05], 0, 3.19599, 1667972301], "v": "v0.6"}
{"i": [["[\"hfused_relu\", 1, 14, 14, 32, 64]", "cuda -keys=cuda,gpu -max_num_threads=1024 -model=unknown -thread_warp_size=32", [-1, 16, 64, 49152, 2147483647, 1024, 8, 32], "", 0, []], [[], [["FU", 1, [0, 1, 2, 3, 4]], ["SP", 1, 0, 401408, [64], 1], ["AN", 1, 0, 5], ["AN", 1, 1, 6]]]], "r": [[7.15443e-06, 7.17286e-06, 7.17648e-06], 0, 3.85638, 1667972302], "v": "v0.6"}
{"i": [["[\"hfused_relu\", 1, 14, 14, 32, 64]", "cuda -keys=cuda,gpu -max_num_threads=1024 -model=unknown -thread_warp_size=32", [-1, 16, 64, 49152, 2147483647, 1024, 8, 32], "", 0, []], [[], [["FU", 1, [0, 1, 2, 3, 4]], ["SP", 1, 0, 401408, [14], 1], ["AN", 1, 0, 5], ["AN", 1, 1, 6]]]], "r": [[2.41972e-05, 2.42041e-05, 2.42053e-05], 0, 4.17656, 1667972302], "v": "v0.6"}
