python/models/resnext/ResNextHorizontal_kernel_configs/resnext_imagenet_50_relu_1_28_28_512.log
{"i": [["[\"relu\", 1, 28, 28, 512]", "cuda -keys=cuda,gpu -max_num_threads=1024 -model=unknown -thread_warp_size=32", [-1, 16, 64, 49152, 2147483647, 1024, 8, 32], "", 0, []], [[], [["FU", 1, [0, 1, 2, 3]], ["SP", 1, 0, 401408, [2], 1], ["AN", 1, 0, 5], ["AN", 1, 1, 6]]]], "r": [[0.00015159, 0.000151585, 0.000151591], 0, 1.50731, 1667896988], "v": "v0.6"}
{"i": [["[\"relu\", 1, 28, 28, 512]", "cuda -keys=cuda,gpu -max_num_threads=1024 -model=unknown -thread_warp_size=32", [-1, 16, 64, 49152, 2147483647, 1024, 8, 32], "", 0, []], [[], [["FU", 1, [0, 1, 2, 3]], ["SP", 1, 0, 401408, [49], 1], ["AN", 1, 0, 5], ["AN", 1, 1, 6]]]], "r": [[8.7596e-06, 8.77297e-06, 8.7704e-06], 0, 0.826898, 1667896987], "v": "v0.6"}
{"i": [["[\"relu\", 1, 28, 28, 512]", "cuda -keys=cuda,gpu -max_num_threads=1024 -model=unknown -thread_warp_size=32", [-1, 16, 64, 49152, 2147483647, 1024, 8, 32], "", 0, []], [[], [["FU", 1, [0, 1, 2, 3]], ["SP", 1, 0, 401408, [7], 1], ["AN", 1, 0, 5], ["AN", 1, 1, 6]]]], "r": [[4.51961e-05, 4.51895e-05, 4.52015e-05], 0, 1.19265, 1667896987], "v": "v0.6"}
{"i": [["[\"relu\", 1, 28, 28, 512]", "cuda -keys=cuda,gpu -max_num_threads=1024 -model=unknown -thread_warp_size=32", [-1, 16, 64, 49152, 2147483647, 1024, 8, 32], "", 0, []], [[], [["FU", 1, [0, 1, 2, 3]], ["SP", 1, 0, 401408, [4], 1], ["AN", 1, 0, 5], ["AN", 1, 1, 6]]]], "r": [[7.70513e-05, 7.70733e-05, 7.70813e-05], 0, 0.528869, 1667896987], "v": "v0.6"}
{"i": [["[\"relu\", 1, 28, 28, 512]", "cuda -keys=cuda,gpu -max_num_threads=1024 -model=unknown -thread_warp_size=32", [-1, 16, 64, 49152, 2147483647, 1024, 8, 32], "", 0, []], [[], [["FU", 1, [0, 1, 2, 3]], ["SP", 1, 0, 401408, [64], 1], ["AN", 1, 0, 5], ["AN", 1, 1, 6]]]], "r": [[7.33557e-06, 7.34839e-06, 7.34554e-06], 0, 1.77911, 1667896988], "v": "v0.6"}
{"i": [["[\"relu\", 1, 28, 28, 512]", "cuda -keys=cuda,gpu -max_num_threads=1024 -model=unknown -thread_warp_size=32", [-1, 16, 64, 49152, 2147483647, 1024, 8, 32], "", 0, []], [[], [["FU", 1, [0, 1, 2, 3]], ["SP", 1, 0, 401408, [16], 1], ["AN", 1, 0, 5], ["AN", 1, 1, 6]]]], "r": [[2.14664e-05, 2.14961e-05, 2.14868e-05], 0, 2.75109, 1667896989], "v": "v0.6"}
{"i": [["[\"relu\", 1, 28, 28, 512]", "cuda -keys=cuda,gpu -max_num_threads=1024 -model=unknown -thread_warp_size=32", [-1, 16, 64, 49152, 2147483647, 1024, 8, 32], "", 0, []], [[], [["FU", 1, [0, 1, 2, 3]], ["SP", 1, 0, 401408, [56], 1], ["AN", 1, 0, 5], ["AN", 1, 1, 6]]]], "r": [[7.82503e-06, 7.83986e-06, 7.83157e-06], 0, 2.42886, 1667896989], "v": "v0.6"}
{"i": [["[\"relu\", 1, 28, 28, 512]", "cuda -keys=cuda,gpu -max_num_threads=1024 -model=unknown -thread_warp_size=32", [-1, 16, 64, 49152, 2147483647, 1024, 8, 32], "", 0, []], [[], [["FU", 1, [0, 1, 2, 3]], ["SP", 1, 0, 401408, [8], 1], ["AN", 1, 0, 5], ["AN", 1, 1, 6]]]], "r": [[3.97876e-05, 3.98017e-05, 3.97999e-05], 0, 2.14049, 1667896988], "v": "v0.6"}
{"i": [["[\"relu\", 1, 28, 28, 512]", "cuda -keys=cuda,gpu -max_num_threads=1024 -model=unknown -thread_warp_size=32", [-1, 16, 64, 49152, 2147483647, 1024, 8, 32], "", 0, []], [[], [["FU", 1, [0, 1, 2, 3]], ["SP", 1, 0, 401408, [14], 1], ["AN", 1, 0, 5], ["AN", 1, 1, 6]]]], "r": [[2.39244e-05, 2.39526e-05, 2.39262e-05], 0, 3.69805, 1667896990], "v": "v0.6"}
{"i": [["[\"relu\", 1, 28, 28, 512]", "cuda -keys=cuda,gpu -max_num_threads=1024 -model=unknown -thread_warp_size=32", [-1, 16, 64, 49152, 2147483647, 1024, 8, 32], "", 0, []], [[], [["FU", 1, [0, 1, 2, 3]], ["SP", 1, 0, 401408, [1], 1], ["AN", 1, 0, 5], ["AN", 1, 1, 6]]]], "r": [[0.000300387, 0.000300447, 0.000300421], 0, 3.40184, 1667896990], "v": "v0.6"}
{"i": [["[\"relu\", 1, 28, 28, 512]", "cuda -keys=cuda,gpu -max_num_threads=1024 -model=unknown -thread_warp_size=32", [-1, 16, 64, 49152, 2147483647, 1024, 8, 32], "", 0, []], [[], [["FU", 1, [0, 1, 2, 3]], ["SP", 1, 0, 401408, [28], 1], ["AN", 1, 0, 5], ["AN", 1, 1, 6]]]], "r": [[1.34545e-05, 1.34515e-05, 1.34587e-05], 0, 3.10128, 1667896989], "v": "v0.6"}
{"i": [["[\"relu\", 1, 28, 28, 512]", "cuda -keys=cuda,gpu -max_num_threads=1024 -model=unknown -thread_warp_size=32", [-1, 16, 64, 49152, 2147483647, 1024, 8, 32], "", 0, []], [[], [["FU", 1, [0, 1, 2, 3]], ["SP", 1, 0, 401408, [32], 1], ["AN", 1, 0, 5], ["AN", 1, 1, 6]]]], "r": [[1.20984e-05, 1.21124e-05, 1.21186e-05], 0, 4.05492, 1667896990], "v": "v0.6"}
{"i": [["[\"relu\", 1, 28, 28, 512]", "cuda -keys=cuda,gpu -max_num_threads=1024 -model=unknown -thread_warp_size=32", [-1, 16, 64, 49152, 2147483647, 1024, 8, 32], "", 0, []], [[], [["FU", 1, [0, 1, 2, 3]], ["SP", 1, 0, 401408, [1], 1], ["AN", 1, 0, 5], ["AN", 1, 1, 6]]]], "r": [[0.000300368, 0.000300348, 0.000300336], 0, 1.15669, 1667961289], "v": "v0.6"}
{"i": [["[\"relu\", 1, 28, 28, 512]", "cuda -keys=cuda,gpu -max_num_threads=1024 -model=unknown -thread_warp_size=32", [-1, 16, 64, 49152, 2147483647, 1024, 8, 32], "", 0, []], [[], [["FU", 1, [0, 1, 2, 3]], ["SP", 1, 0, 401408, [14], 1], ["AN", 1, 0, 5], ["AN", 1, 1, 6]]]], "r": [[2.39932e-05, 2.40038e-05, 2.40055e-05], 0, 2.16617, 1667961290], "v": "v0.6"}
{"i": [["[\"relu\", 1, 28, 28, 512]", "cuda -keys=cuda,gpu -max_num_threads=1024 -model=unknown -thread_warp_size=32", [-1, 16, 64, 49152, 2147483647, 1024, 8, 32], "", 0, []], [[], [["FU", 1, [0, 1, 2, 3]], ["SP", 1, 0, 401408, [32], 1], ["AN", 1, 0, 5], ["AN", 1, 1, 6]]]], "r": [[1.20108e-05, 1.2023e-05, 1.20251e-05], 0, 0.523795, 1667961289], "v": "v0.6"}
{"i": [["[\"relu\", 1, 28, 28, 512]", "cuda -keys=cuda,gpu -max_num_threads=1024 -model=unknown -thread_warp_size=32", [-1, 16, 64, 49152, 2147483647, 1024, 8, 32], "", 0, []], [[], [["FU", 1, [0, 1, 2, 3]], ["SP", 1, 0, 401408, [4], 1], ["AN", 1, 0, 5], ["AN", 1, 1, 6]]]], "r": [[7.70734e-05, 7.70897e-05, 7.71096e-05], 0, 1.4882, 1667961290], "v": "v0.6"}
{"i": [["[\"relu\", 1, 28, 28, 512]", "cuda -keys=cuda,gpu -max_num_threads=1024 -model=unknown -thread_warp_size=32", [-1, 16, 64, 49152, 2147483647, 1024, 8, 32], "", 0, []], [[], [["FU", 1, [0, 1, 2, 3]], ["SP", 1, 0, 401408, [8], 1], ["AN", 1, 0, 5], ["AN", 1, 1, 6]]]], "r": [[3.98228e-05, 3.9839e-05, 3.98362e-05], 0, 0.892297, 1667961289], "v": "v0.6"}
{"i": [["[\"relu\", 1, 28, 28, 512]", "cuda -keys=cuda,gpu -max_num_threads=1024 -model=unknown -thread_warp_size=32", [-1, 16, 64, 49152, 2147483647, 1024, 8, 32], "", 0, []], [[], [["FU", 1, [0, 1, 2, 3]], ["SP", 1, 0, 401408, [16], 1], ["AN", 1, 0, 5], ["AN", 1, 1, 6]]]], "r": [[2.13475e-05, 2.13713e-05, 2.13676e-05], 0, 1.8613, 1667961290], "v": "v0.6"}
{"i": [["[\"relu\", 1, 28, 28, 512]", "cuda -keys=cuda,gpu -max_num_threads=1024 -model=unknown -thread_warp_size=32", [-1, 16, 64, 49152, 2147483647, 1024, 8, 32], "", 0, []], [[], [["FU", 1, [0, 1, 2, 3]], ["SP", 1, 0, 401408, [28], 1], ["AN", 1, 0, 5], ["AN", 1, 1, 6]]]], "r": [[1.33056e-05, 1.33192e-05, 1.33165e-05], 0, 2.52228, 1667961291], "v": "v0.6"}
{"i": [["[\"relu\", 1, 28, 28, 512]", "cuda -keys=cuda,gpu -max_num_threads=1024 -model=unknown -thread_warp_size=32", [-1, 16, 64, 49152, 2147483647, 1024, 8, 32], "", 0, []], [[], [["FU", 1, [0, 1, 2, 3]], ["SP", 1, 0, 401408, [49], 1], ["AN", 1, 0, 5], ["AN", 1, 1, 6]]]], "r": [[8.59403e-06, 8.60561e-06, 8.60698e-06], 0, 3.49201, 1667961292], "v": "v0.6"}
{"i": [["[\"relu\", 1, 28, 28, 512]", "cuda -keys=cuda,gpu -max_num_threads=1024 -model=unknown -thread_warp_size=32", [-1, 16, 64, 49152, 2147483647, 1024, 8, 32], "", 0, []], [[], [["FU", 1, [0, 1, 2, 3]], ["SP", 1, 0, 401408, [7], 1], ["AN", 1, 0, 5], ["AN", 1, 1, 6]]]], "r": [[4.51909e-05, 4.51726e-05, 4.51867e-05], 0, 3.77445, 1667961292], "v": "v0.6"}
{"i": [["[\"relu\", 1, 28, 28, 512]", "cuda -keys=cuda,gpu -max_num_threads=1024 -model=unknown -thread_warp_size=32", [-1, 16, 64, 49152, 2147483647, 1024, 8, 32], "", 0, []], [[], [["FU", 1, [0, 1, 2, 3]], ["SP", 1, 0, 401408, [2], 1], ["AN", 1, 0, 5], ["AN", 1, 1, 6]]]], "r": [[0.000151413, 0.000151429, 0.000151435], 0, 3.20792, 1667961291], "v": "v0.6"}
{"i": [["[\"relu\", 1, 28, 28, 512]", "cuda -keys=cuda,gpu -max_num_threads=1024 -model=unknown -thread_warp_size=32", [-1, 16, 64, 49152, 2147483647, 1024, 8, 32], "", 0, []], [[], [["FU", 1, [0, 1, 2, 3]], ["SP", 1, 0, 401408, [56], 1], ["AN", 1, 0, 5], ["AN", 1, 1, 6]]]], "r": [[7.89496e-06, 7.90813e-06, 7.90289e-06], 0, 2.77442, 1667961291], "v": "v0.6"}
{"i": [["[\"relu\", 1, 28, 28, 512]", "cuda -keys=cuda,gpu -max_num_threads=1024 -model=unknown -thread_warp_size=32", [-1, 16, 64, 49152, 2147483647, 1024, 8, 32], "", 0, []], [[], [["FU", 1, [0, 1, 2, 3]], ["SP", 1, 0, 401408, [64], 1], ["AN", 1, 0, 5], ["AN", 1, 1, 6]]]], "r": [[7.28208e-06, 7.29105e-06, 7.29053e-06], 0, 4.18252, 1667961292], "v": "v0.6"}
