python/autotvm_logs/conv2d_1_56_56_64_512_1_1.log
{"input": ["cuda -keys=cuda,gpu -max_num_threads=1024 -thread_warp_size=32", "tutorial/conv2d_no_batching", [1, 7, 7, 16, 16, 1, 1, [1, 1], [0, 0]], {}], "config": {"index": 8530, "code_hash": null, "entity": [["tile_f", "sp", [-1, 1, 1, 4]], ["tile_y", "sp", [-1, 1, 1, 7]], ["tile_x", "sp", [-1, 1, 1, 1]], ["tile_rc", "sp", [-1, 1, 1]], ["tile_ry", "sp", [-1, 1, 1]], ["tile_rx", "sp", [-1, 1, 1]], ["auto_unroll_max_step", "ot", 512], ["unroll_explicit", "ot", 0]]}, "result": [[1.1525522366522366e-05, 1.1539562049062049e-05], 0, 2.8234713077545166, 1634044270.4537733], "version": 0.2, "tvm_version": "0.8.dev0"}
{"input": ["cuda -keys=cuda,gpu -max_num_threads=1024 -thread_warp_size=32", "tutorial/conv2d_no_batching", [1, 7, 7, 16, 16, 1, 1, [1, 1], [0, 0]], {}], "config": {"index": 30071, "code_hash": null, "entity": [["tile_f", "sp", [-1, 2, 2, 1]], ["tile_y", "sp", [-1, 1, 1, 7]], ["tile_x", "sp", [-1, 1, 7, 1]], ["tile_rc", "sp", [-1, 8, 2]], ["tile_ry", "sp", [-1, 1, 1]], ["tile_rx", "sp", [-1, 1, 1]], ["auto_unroll_max_step", "ot", 0], ["unroll_explicit", "ot", 1]]}, "result": [[6.584640772708589e-06, 6.577425400739827e-06], 0, 2.8216938972473145, 1634044273.4131496], "version": 0.2, "tvm_version": "0.8.dev0"}
{"input": ["cuda -keys=cuda,gpu -max_num_threads=1024 -thread_warp_size=32", "tutorial/conv2d_no_batching", [1, 7, 7, 16, 16, 1, 1, [1, 1], [0, 0]], {}], "config": {"index": 11029, "code_hash": null, "entity": [["tile_f", "sp", [-1, 16, 1, 1]], ["tile_y", "sp", [-1, 1, 1, 7]], ["tile_x", "sp", [-1, 1, 7, 1]], ["tile_rc", "sp", [-1, 16, 1]], ["tile_ry", "sp", [-1, 1, 1]], ["tile_rx", "sp", [-1, 1, 1]], ["auto_unroll_max_step", "ot", 512], ["unroll_explicit", "ot", 0]]}, "result": [[1.416911660777385e-05, 1.41702871024735e-05], 0, 2.846449375152588, 1634044277.3154361], "version": 0.2, "tvm_version": "0.8.dev0"}
{"input": ["cuda -keys=cuda,gpu -max_num_threads=1024 -thread_warp_size=32", "tutorial/conv2d_no_batching", [1, 7, 7, 16, 16, 1, 1, [1, 1], [0, 0]], {}], "config": {"index": 38132, "code_hash": null, "entity": [["tile_f", "sp", [-1, 4, 1, 2]], ["tile_y", "sp", [-1, 7, 1, 1]], ["tile_x", "sp", [-1, 1, 1, 1]], ["tile_rc", "sp", [-1, 8, 2]], ["tile_ry", "sp", [-1, 1, 1]], ["tile_rx", "sp", [-1, 1, 1]], ["auto_unroll_max_step", "ot", 512], ["unroll_explicit", "ot", 1]]}, "result": [[9.918621988882025e-06, 9.916131562693023e-06], 0, 2.9054949283599854, 1634044280.81607], "version": 0.2, "tvm_version": "0.8.dev0"}
{"input": ["cuda -keys=cuda,gpu -max_num_threads=1024 -thread_warp_size=32", "tutorial/conv2d_no_batching", [1, 7, 7, 16, 16, 1, 1, [1, 1], [0, 0]], {}], "config": {"index": 47070, "code_hash": null, "entity": [["tile_f", "sp", [-1, 1, 4, 4]], ["tile_y", "sp", [-1, 1, 1, 1]], ["tile_x", "sp", [-1, 1, 1, 1]], ["tile_rc", "sp", [-1, 1, 4]], ["tile_ry", "sp", [-1, 1, 1]], ["tile_rx", "sp", [-1, 1, 1]], ["auto_unroll_max_step", "ot", 1500], ["unroll_explicit", "ot", 1]]}, "result": [[6.0088785117691735e-06, 6.003841305998482e-06], 0, 2.7866010665893555, 1634044283.7387679], "version": 0.2, "tvm_version": "0.8.dev0"}
{"input": ["cuda -keys=cuda,gpu -max_num_threads=1024 -thread_warp_size=32", "tutorial/conv2d_no_batching", [1, 7, 7, 16, 16, 1, 1, [1, 1], [0, 0]], {}], "config": {"index": 29997, "code_hash": null, "entity": [["tile_f", "sp", [-1, 4, 1, 1]], ["tile_y", "sp", [-1, 7, 1, 1]], ["tile_x", "sp", [-1, 1, 7, 1]], ["tile_rc", "sp", [-1, 8, 2]], ["tile_ry", "sp", [-1, 1, 1]], ["tile_rx", "sp", [-1, 1, 1]], ["auto_unroll_max_step", "ot", 0], ["unroll_explicit", "ot", 1]]}, "result": [[8.902002229654404e-06, 8.898445373467114e-06], 0, 2.81514310836792, 1634044287.1373277], "version": 0.2, "tvm_version": "0.8.dev0"}
{"input": ["cuda -keys=cuda,gpu -max_num_threads=1024 -thread_warp_size=32", "tutorial/conv2d_no_batching", [1, 7, 7, 16, 16, 1, 1, [1, 1], [0, 0]], {}], "config": {"index": 10027, "code_hash": null, "entity": [["tile_f", "sp", [-1, 4, 1, 2]], ["tile_y", "sp", [-1, 1, 7, 1]], ["tile_x", "sp", [-1, 1, 1, 7]], ["tile_rc", "sp", [-1, 4, 1]], ["tile_ry", "sp", [-1, 1, 1]], ["tile_rx", "sp", [-1, 1, 1]], ["auto_unroll_max_step", "ot", 512], ["unroll_explicit", "ot", 0]]}, "result": [[9.958497192763568e-06, 9.957086712414223e-06], 0, 2.739109992980957, 1634044290.8953097], "version": 0.2, "tvm_version": "0.8.dev0"}
{"input": ["cuda -keys=cuda,gpu -max_num_threads=1024 -thread_warp_size=32", "tutorial/conv2d_no_batching", [1, 7, 7, 16, 16, 1, 1, [1, 1], [0, 0]], {}], "config": {"index": 39791, "code_hash": null, "entity": [["tile_f", "sp", [-1, 1, 1, 8]], ["tile_y", "sp", [-1, 1, 1, 1]], ["tile_x", "sp", [-1, 1, 1, 1]], ["tile_rc", "sp", [-1, 4, 4]], ["tile_ry", "sp", [-1, 1, 1]], ["tile_rx", "sp", [-1, 1, 1]], ["auto_unroll_max_step", "ot", 512], ["unroll_explicit", "ot", 1]]}, "result": [[7.832727813584532e-06, 7.832073872087259e-06], 0, 2.8822789192199707, 1634044293.916545], "version": 0.2, "tvm_version": "0.8.dev0"}
{"input": ["cuda -keys=cuda,gpu -max_num_threads=1024 -thread_warp_size=32", "tutorial/conv2d_no_batching", [1, 7, 7, 16, 16, 1, 1, [1, 1], [0, 0]], {}], "config": {"index": 25659, "code_hash": null, "entity": [["tile_f", "sp", [-1, 16, 1, 1]], ["tile_y", "sp", [-1, 7, 1, 1]], ["tile_x", "sp", [-1, 1, 1, 7]], ["tile_rc", "sp", [-1, 1, 1]], ["tile_ry", "sp", [-1, 1, 1]], ["tile_rx", "sp", [-1, 1, 1]], ["auto_unroll_max_step", "ot", 0], ["unroll_explicit", "ot", 1]]}, "result": [[0.00027219264, 0.00026906436], 0, 3.005779504776001, 1634044297.5134485], "version": 0.2, "tvm_version": "0.8.dev0"}
{"input": ["cuda -keys=cuda,gpu -max_num_threads=1024 -thread_warp_size=32", "tutorial/conv2d_no_batching", [1, 7, 7, 16, 16, 1, 1, [1, 1], [0, 0]], {}], "config": {"index": 704, "code_hash": null, "entity": [["tile_f", "sp", [-1, 16, 1, 1]], ["tile_y", "sp", [-1, 1, 1, 1]], ["tile_x", "sp", [-1, 7, 1, 1]], ["tile_rc", "sp", [-1, 2, 1]], ["tile_ry", "sp", [-1, 1, 1]], ["tile_rx", "sp", [-1, 1, 1]], ["auto_unroll_max_step", "ot", 0], ["unroll_explicit", "ot", 0]]}, "result": [[1.460968641750228e-05, 1.4610123974475841e-05], 0, 2.9735960960388184, 1634044301.0845685], "version": 0.2, "tvm_version": "0.8.dev0"}
{"input": ["cuda -keys=cuda,gpu -max_num_threads=1024 -thread_warp_size=32", "tutorial/conv2d_no_batching", [1, 7, 7, 16, 16, 1, 1, [1, 1], [0, 0]], {}], "config": {"index": 27938, "code_hash": null, "entity": [["tile_f", "sp", [-1, 8, 2, 1]], ["tile_y", "sp", [-1, 1, 7, 1]], ["tile_x", "sp", [-1, 1, 1, 7]], ["tile_rc", "sp", [-1, 16, 1]], ["tile_ry", "sp", [-1, 1, 1]], ["tile_rx", "sp", [-1, 1, 1]], ["auto_unroll_max_step", "ot", 0], ["unroll_explicit", "ot", 1]]}, "result": [[1.0027342928660824e-05, 1.0026451188986234e-05], 0, 2.7839205265045166, 1634044304.4895527], "version": 0.2, "tvm_version": "0.8.dev0"}
{"input": ["cuda -keys=cuda,gpu -max_num_threads=1024 -thread_warp_size=32", "tutorial/conv2d_no_batching", [1, 7, 7, 16, 16, 1, 1, [1, 1], [0, 0]], {}], "config": {"index": 31822, "code_hash": null, "entity": [["tile_f", "sp", [-1, 4, 2, 1]], ["tile_y", "sp", [-1, 7, 1, 1]], ["tile_x", "sp", [-1, 1, 1, 7]], ["tile_rc", "sp", [-1, 4, 4]], ["tile_ry", "sp", [-1, 1, 1]], ["tile_rx", "sp", [-1, 1, 1]], ["auto_unroll_max_step", "ot", 0], ["unroll_explicit", "ot", 1]]}, "result": [[3.1615851272015655e-05, 3.160910763209393e-05], 0, 3.0839269161224365, 1634044308.1819253], "version": 0.2, "tvm_version": "0.8.dev0"}
{"input": ["cuda -keys=cuda,gpu -max_num_threads=1024 -thread_warp_size=32", "tutorial/conv2d_no_batching", [1, 7, 7, 16, 16, 1, 1, [1, 1], [0, 0]], {}], "config": {"index": 30202, "code_hash": null, "entity": [["tile_f", "sp", [-1, 2, 1, 8]], ["tile_y", "sp", [-1, 1, 7, 1]], ["tile_x", "sp", [-1, 1, 1, 7]], ["tile_rc", "sp", [-1, 8, 2]], ["tile_ry", "sp", [-1, 1, 1]], ["tile_rx", "sp", [-1, 1, 1]], ["auto_unroll_max_step", "ot", 0], ["unroll_explicit", "ot", 1]]}, "result": [[1.4338873440285204e-05, 1.4339291443850269e-05], 0, 2.8308520317077637, 1634044311.627755], "version": 0.2, "tvm_version": "0.8.dev0"}
{"input": ["cuda -keys=cuda,gpu -max_num_threads=1024 -thread_warp_size=32", "tutorial/conv2d_no_batching", [1, 7, 7, 16, 16, 1, 1, [1, 1], [0, 0]], {}], "config": {"index": 42392, "code_hash": null, "entity": [["tile_f", "sp", [-1, 4, 2, 1]], ["tile_y", "sp", [-1, 1, 1, 7]], ["tile_x", "sp", [-1, 1, 7, 1]], ["tile_rc", "sp", [-1, 1, 1]], ["tile_ry", "sp", [-1, 1, 1]], ["tile_rx", "sp", [-1, 1, 1]], ["auto_unroll_max_step", "ot", 1500], ["unroll_explicit", "ot", 1]]}, "result": [[1.1104307745987438e-05, 1.1115205861828331e-05], 0, 2.996251106262207, 1634044315.6940804], "version": 0.2, "tvm_version": "0.8.dev0"}
{"input": ["cuda -keys=cuda,gpu -max_num_threads=1024 -thread_warp_size=32", "tutorial/conv2d_no_batching", [1, 7, 7, 16, 16, 1, 1, [1, 1], [0, 0]], {}], "config": {"index": 1679, "code_hash": null, "entity": [["tile_f", "sp", [-1, 1, 1, 16]], ["tile_y", "sp", [-1, 1, 1, 7]], ["tile_x", "sp", [-1, 1, 1, 7]], ["tile_rc", "sp", [-1, 4, 1]], ["tile_ry", "sp", [-1, 1, 1]], ["tile_rx", "sp", [-1, 1, 1]], ["auto_unroll_max_step", "ot", 0], ["unroll_explicit", "ot", 0]]}, "result": [[0.00058966317, 0.00058824076], 0, 2.8868155479431152, 1634044319.1736934], "version": 0.2, "tvm_version": "0.8.dev0"}
{"input": ["cuda -keys=cuda,gpu -max_num_threads=1024 -thread_warp_size=32", "tutorial/conv2d_no_batching", [1, 7, 7, 16, 16, 1, 1, [1, 1], [0, 0]], {}], "config": {"index": 40680, "code_hash": null, "entity": [["tile_f", "sp", [-1, 2, 4, 1]], ["tile_y", "sp", [-1, 1, 7, 1]], ["tile_x", "sp", [-1, 1, 7, 1]], ["tile_rc", "sp", [-1, 1, 8]], ["tile_ry", "sp", [-1, 1, 1]], ["tile_rx", "sp", [-1, 1, 1]], ["auto_unroll_max_step", "ot", 512], ["unroll_explicit", "ot", 1]]}, "result": [[6.200690345368917e-06, 6.19254748822606e-06], 0, 2.7363479137420654, 1634044322.4936097], "version": 0.2, "tvm_version": "0.8.dev0"}
{"input": ["cuda -keys=cuda,gpu -max_num_threads=1024 -thread_warp_size=32", "tutorial/conv2d_no_batching", [1, 7, 7, 16, 16, 1, 1, [1, 1], [0, 0]], {}], "config": {"index": 5868, "code_hash": null, "entity": [["tile_f", "sp", [-1, 2, 4, 2]], ["tile_y", "sp", [-1, 1, 1, 7]], ["tile_x", "sp", [-1, 7, 1, 1]], ["tile_rc", "sp", [-1, 2, 4]], ["tile_ry", "sp", [-1, 1, 1]], ["tile_rx", "sp", [-1, 1, 1]], ["auto_unroll_max_step", "ot", 0], ["unroll_explicit", "ot", 0]]}, "result": [[2.908567509025271e-05, 2.9087435018050544e-05], 0, 3.0135371685028076, 1634044326.5330226], "version": 0.2, "tvm_version": "0.8.dev0"}
{"input": ["cuda -keys=cuda,gpu -max_num_threads=1024 -thread_warp_size=32", "tutorial/conv2d_no_batching", [1, 7, 7, 16, 16, 1, 1, [1, 1], [0, 0]], {}], "config": {"index": 44988, "code_hash": null, "entity": [["tile_f", "sp", [-1, 2, 8, 1]], ["tile_y", "sp", [-1, 7, 1, 1]], ["tile_x", "sp", [-1, 7, 1, 1]], ["tile_rc", "sp", [-1, 1, 2]], ["tile_ry", "sp", [-1, 1, 1]], ["tile_rx", "sp", [-1, 1, 1]], ["auto_unroll_max_step", "ot", 1500], ["unroll_explicit", "ot", 1]]}, "result": [[1.3545268189509307e-05, 1.354692216582064e-05], 0, 2.8725831508636475, 1634044329.5451705], "version": 0.2, "tvm_version": "0.8.dev0"}
{"input": ["cuda -keys=cuda,gpu -max_num_threads=1024 -thread_warp_size=32", "tutorial/conv2d_no_batching", [1, 7, 7, 16, 16, 1, 1, [1, 1], [0, 0]], {}], "config": {"index": 24048, "code_hash": null, "entity": [["tile_f", "sp", [-1, 8, 1, 1]], ["tile_y", "sp", [-1, 1, 1, 7]], ["tile_x", "sp", [-1, 1, 1, 7]], ["tile_rc", "sp", [-1, 1, 8]], ["tile_ry", "sp", [-1, 1, 1]], ["tile_rx", "sp", [-1, 1, 1]], ["auto_unroll_max_step", "ot", 1500], ["unroll_explicit", "ot", 0]]}, "result": [[7.957677639751553e-05, 7.954359006211181e-05], 0, 4.001404762268066, 1634044333.686414], "version": 0.2, "tvm_version": "0.8.dev0"}
{"input": ["cuda -keys=cuda,gpu -max_num_threads=1024 -thread_warp_size=32", "tutorial/conv2d_no_batching", [1, 7, 7, 16, 16, 1, 1, [1, 1], [0, 0]], {}], "config": {"index": 33444, "code_hash": null, "entity": [["tile_f", "sp", [-1, 1, 2, 2]], ["tile_y", "sp", [-1, 1, 1, 7]], ["tile_x", "sp", [-1, 1, 7, 1]], ["tile_rc", "sp", [-1, 1, 16]], ["tile_ry", "sp", [-1, 1, 1]], ["tile_rx", "sp", [-1, 1, 1]], ["auto_unroll_max_step", "ot", 0], ["unroll_explicit", "ot", 1]]}, "result": [[6.419803643724696e-06, 6.419877327935223e-06], 0, 2.787930965423584, 1634044337.0599465], "version": 0.2, "tvm_version": "0.8.dev0"}
{"input": ["cuda -keys=cuda,gpu -max_num_threads=1024 -thread_warp_size=32", "tutorial/conv2d_no_batching", [1, 7, 7, 16, 16, 1, 1, [1, 1], [0, 0]], {}], "config": {"index": 6003, "code_hash": null, "entity": [["tile_f", "sp", [-1, 8, 1, 2]], ["tile_y", "sp", [-1, 1, 1, 7]], ["tile_x", "sp", [-1, 1, 7, 1]], ["tile_rc", "sp", [-1, 2, 4]], ["tile_ry", "sp", [-1, 1, 1]], ["tile_rx", "sp", [-1, 1, 1]], ["auto_unroll_max_step", "ot", 0], ["unroll_explicit", "ot", 0]]}, "result": [[1.7408467027027026e-05, 1.7407281081081084e-05], 0, 2.9541473388671875, 1634044341.0718231], "version": 0.2, "tvm_version": "0.8.dev0"}
{"input": ["cuda -keys=cuda,gpu -max_num_threads=1024 -thread_warp_size=32", "tutorial/conv2d_no_batching", [1, 7, 7, 16, 16, 1, 1, [1, 1], [0, 0]], {}], "config": {"index": 25229, "code_hash": null, "entity": [["tile_f", "sp", [-1, 2, 2, 4]], ["tile_y", "sp", [-1, 1, 1, 1]], ["tile_x", "sp", [-1, 1, 1, 1]], ["tile_rc", "sp", [-1, 1, 1]], ["tile_ry", "sp", [-1, 1, 1]], ["tile_rx", "sp", [-1, 1, 1]], ["auto_unroll_max_step", "ot", 0], ["unroll_explicit", "ot", 1]]}, "result": [[1.3353267111853087e-05, 1.3352205342237062e-05], 0, 2.7039966583251953, 1634044344.3664048], "version": 0.2, "tvm_version": "0.8.dev0"}
{"input": ["cuda -keys=cuda,gpu -max_num_threads=1024 -thread_warp_size=32", "tutorial/conv2d_no_batching", [1, 7, 7, 16, 16, 1, 1, [1, 1], [0, 0]], {}], "config": {"index": 41871, "code_hash": null, "entity": [["tile_f", "sp", [-1, 4, 4, 1]], ["tile_y", "sp", [-1, 1, 1, 1]], ["tile_x", "sp", [-1, 1, 1, 7]], ["tile_rc", "sp", [-1, 1, 16]], ["tile_ry", "sp", [-1, 1, 1]], ["tile_rx", "sp", [-1, 1, 1]], ["auto_unroll_max_step", "ot", 512], ["unroll_explicit", "ot", 1]]}, "result": [[7.1051416405199455e-06, 7.1189480053787534e-06], 0, 3.089463233947754, 1634044348.026538], "version": 0.2, "tvm_version": "0.8.dev0"}
{"input": ["cuda -keys=cuda,gpu -max_num_threads=1024 -thread_warp_size=32", "tutorial/conv2d_no_batching", [1, 7, 7, 16, 16, 1, 1, [1, 1], [0, 0]], {}], "config": {"index": 46319, "code_hash": null, "entity": [["tile_f", "sp", [-1, 1, 16, 1]], ["tile_y", "sp", [-1, 1, 1, 7]], ["tile_x", "sp", [-1, 1, 7, 1]], ["tile_rc", "sp", [-1, 4, 2]], ["tile_ry", "sp", [-1, 1, 1]], ["tile_rx", "sp", [-1, 1, 1]], ["auto_unroll_max_step", "ot", 1500], ["unroll_explicit", "ot", 1]]}, "result": [[5.563862311204777e-06, 5.563638566912539e-06], 0, 2.7812774181365967, 1634044351.3926187], "version": 0.2, "tvm_version": "0.8.dev0"}
{"input": ["cuda -keys=cuda,gpu -max_num_threads=1024 -thread_warp_size=32", "tutorial/conv2d_no_batching", [1, 7, 7, 16, 16, 1, 1, [1, 1], [0, 0]], {}], "config": {"index": 18633, "code_hash": null, "entity": [["tile_f", "sp", [-1, 2, 8, 1]], ["tile_y", "sp", [-1, 1, 1, 1]], ["tile_x", "sp", [-1, 7, 1, 1]], ["tile_rc", "sp", [-1, 8, 1]], ["tile_ry", "sp", [-1, 1, 1]], ["tile_rx", "sp", [-1, 1, 1]], ["auto_unroll_max_step", "ot", 1500], ["unroll_explicit", "ot", 0]]}, "result": [[6.5238882956878855e-06, 6.523263244353182e-06], 0, 2.7543838024139404, 1634044355.184373], "version": 0.2, "tvm_version": "0.8.dev0"}
{"input": ["cuda -keys=cuda,gpu -max_num_threads=1024 -thread_warp_size=32", "tutorial/conv2d_no_batching", [1, 7, 7, 16, 16, 1, 1, [1, 1], [0, 0]], {}], "config": {"index": 37752, "code_hash": null, "entity": [["tile_f", "sp", [-1, 1, 4, 2]], ["tile_y", "sp", [-1, 1, 7, 1]], ["tile_x", "sp", [-1, 7, 1, 1]], ["tile_rc", "sp", [-1, 4, 2]], ["tile_ry", "sp", [-1, 1, 1]], ["tile_rx", "sp", [-1, 1, 1]], ["auto_unroll_max_step", "ot", 512], ["unroll_explicit", "ot", 1]]}, "result": [[7.514020476190476e-06, 7.530496666666666e-06], 0, 2.8413238525390625, 1634044358.6049242], "version": 0.2, "tvm_version": "0.8.dev0"}
{"input": ["cuda -keys=cuda,gpu -max_num_threads=1024 -thread_warp_size=32", "tutorial/conv2d_no_batching", [1, 7, 7, 16, 16, 1, 1, [1, 1], [0, 0]], {}], "config": {"index": 45141, "code_hash": null, "entity": [["tile_f", "sp", [-1, 2, 1, 4]], ["tile_y", "sp", [-1, 7, 1, 1]], ["tile_x", "sp", [-1, 1, 7, 1]], ["tile_rc", "sp", [-1, 1, 2]], ["tile_ry", "sp", [-1, 1, 1]], ["tile_rx", "sp", [-1, 1, 1]], ["auto_unroll_max_step", "ot", 1500], ["unroll_explicit", "ot", 1]]}, "result": [[1.2955975020145045e-05, 1.295221273166801e-05], 0, 3.5495636463165283, 1634044362.7607205], "version": 0.2, "tvm_version": "0.8.dev0"}
{"input": ["cuda -keys=cuda,gpu -max_num_threads=1024 -thread_warp_size=32", "tutorial/conv2d_no_batching", [1, 7, 7, 16, 16, 1, 1, [1, 1], [0, 0]], {}], "config": {"index": 41652, "code_hash": null, "entity": [["tile_f", "sp", [-1, 4, 1, 1]], ["tile_y", "sp", [-1, 1, 7, 1]], ["tile_x", "sp", [-1, 7, 1, 1]], ["tile_rc", "sp", [-1, 1, 16]], ["tile_ry", "sp", [-1, 1, 1]], ["tile_rx", "sp", [-1, 1, 1]], ["auto_unroll_max_step", "ot", 512], ["unroll_explicit", "ot", 1]]}, "result": [[7.894789887088855e-06, 7.915495336278841e-06], 0, 3.0317273139953613, 1634044366.8266938], "version": 0.2, "tvm_version": "0.8.dev0"}
{"input": ["cuda -keys=cuda,gpu -max_num_threads=1024 -thread_warp_size=32", "tutorial/conv2d_no_batching", [1, 7, 7, 16, 16, 1, 1, [1, 1], [0, 0]], {}], "config": {"index": 13157, "code_hash": null, "entity": [["tile_f", "sp", [-1, 2, 1, 8]], ["tile_y", "sp", [-1, 1, 1, 7]], ["tile_x", "sp", [-1, 7, 1, 1]], ["tile_rc", "sp", [-1, 8, 2]], ["tile_ry", "sp", [-1, 1, 1]], ["tile_rx", "sp", [-1, 1, 1]], ["auto_unroll_max_step", "ot", 512], ["unroll_explicit", "ot", 0]]}, "result": [[0.00030693665, 0.00030598338], 0, 3.3479583263397217, 1634044370.8038695], "version": 0.2, "tvm_version": "0.8.dev0"}
{"input": ["cuda -keys=cuda,gpu -max_num_threads=1024 -thread_warp_size=32", "tutorial/conv2d_no_batching", [1, 7, 7, 16, 16, 1, 1, [1, 1], [0, 0]], {}], "config": {"index": 32884, "code_hash": null, "entity": [["tile_f", "sp", [-1, 1, 2, 2]], ["tile_y", "sp", [-1, 1, 1, 7]], ["tile_x", "sp", [-1, 1, 7, 1]], ["tile_rc", "sp", [-1, 2, 8]], ["tile_ry", "sp", [-1, 1, 1]], ["tile_rx", "sp", [-1, 1, 1]], ["auto_unroll_max_step", "ot", 0], ["unroll_explicit", "ot", 1]]}, "result": [[6.6743303760033795e-06, 6.678136882129277e-06], 0, 2.7239673137664795, 1634044373.669268], "version": 0.2, "tvm_version": "0.8.dev0"}
{"input": ["cuda -keys=cuda,gpu -max_num_threads=1024 -thread_warp_size=32", "tutorial/conv2d_no_batching", [1, 7, 7, 16, 16, 1, 1, [1, 1], [0, 0]], {}], "config": {"index": 25127, "code_hash": null, "entity": [["tile_f", "sp", [-1, 2, 1, 8]], ["tile_y", "sp", [-1, 7, 1, 1]], ["tile_x", "sp", [-1, 1, 1, 7]], ["tile_rc", "sp", [-1, 1, 16]], ["tile_ry", "sp", [-1, 1, 1]], ["tile_rx", "sp", [-1, 1, 1]], ["auto_unroll_max_step", "ot", 1500], ["unroll_explicit", "ot", 0]]}, "result": [[0.0002721896, 0.00026582225999999997], 0, 7.209596633911133, 1634044381.4720519], "version": 0.2, "tvm_version": "0.8.dev0"}
{"input": ["cuda -keys=cuda,gpu -max_num_threads=1024 -thread_warp_size=32", "tutorial/conv2d_no_batching", [1, 7, 7, 16, 16, 1, 1, [1, 1], [0, 0]], {}], "config": {"index": 15298, "code_hash": null, "entity": [["tile_f", "sp", [-1, 8, 1, 1]], ["tile_y", "sp", [-1, 7, 1, 1]], ["tile_x", "sp", [-1, 7, 1, 1]], ["tile_rc", "sp", [-1, 1, 8]], ["tile_ry", "sp", [-1, 1, 1]], ["tile_rx", "sp", [-1, 1, 1]], ["auto_unroll_max_step", "ot", 512], ["unroll_explicit", "ot", 0]]}, "result": [[8.716755279503105e-05, 8.717204347826087e-05], 0, 4.31548810005188, 1634044386.379991], "version": 0.2, "tvm_version": "0.8.dev0"}
{"input": ["cuda -keys=cuda,gpu -max_num_threads=1024 -thread_warp_size=32", "tutorial/conv2d_no_batching", [1, 7, 7, 16, 16, 1, 1, [1, 1], [0, 0]], {}], "config": {"index": 33842, "code_hash": null, "entity": [["tile_f", "sp", [-1, 2, 1, 8]], ["tile_y", "sp", [-1, 1, 7, 1]], ["tile_x", "sp", [-1, 7, 1, 1]], ["tile_rc", "sp", [-1, 1, 1]], ["tile_ry", "sp", [-1, 1, 1]], ["tile_rx", "sp", [-1, 1, 1]], ["auto_unroll_max_step", "ot", 512], ["unroll_explicit", "ot", 1]]}, "result": [[1.7667623076923076e-05, 1.766777802197802e-05], 0, 2.7737090587615967, 1634044389.7557406], "version": 0.2, "tvm_version": "0.8.dev0"}
{"input": ["cuda -keys=cuda,gpu -max_num_threads=1024 -thread_warp_size=32", "tutorial/conv2d_no_batching", [1, 7, 7, 16, 16, 1, 1, [1, 1], [0, 0]], {}], "config": {"index": 20366, "code_hash": null, "entity": [["tile_f", "sp", [-1, 1, 1, 8]], ["tile_y", "sp", [-1, 7, 1, 1]], ["tile_x", "sp", [-1, 7, 1, 1]], ["tile_rc", "sp", [-1, 2, 2]], ["tile_ry", "sp", [-1, 1, 1]], ["tile_rx", "sp", [-1, 1, 1]], ["auto_unroll_max_step", "ot", 1500], ["unroll_explicit", "ot", 0]]}, "result": [[7.922649689440994e-05, 7.919131055900621e-05], 0, 3.3917174339294434, 1634044394.261387], "version": 0.2, "tvm_version": "0.8.dev0"}
{"input": ["cuda -keys=cuda,gpu -max_num_threads=1024 -thread_warp_size=32", "tutorial/conv2d_no_batching", [1, 7, 7, 16, 16, 1, 1, [1, 1], [0, 0]], {}], "config": {"index": 13331, "code_hash": null, "entity": [["tile_f", "sp", [-1, 1, 1, 8]], ["tile_y", "sp", [-1, 1, 1, 1]], ["tile_x", "sp", [-1, 1, 1, 7]], ["tile_rc", "sp", [-1, 8, 2]], ["tile_ry", "sp", [-1, 1, 1]], ["tile_rx", "sp", [-1, 1, 1]], ["auto_unroll_max_step", "ot", 512], ["unroll_explicit", "ot", 0]]}, "result": [[9.740939412484701e-06, 9.744801101591188e-06], 0, 2.9413902759552, 1634044397.343224], "version": 0.2, "tvm_version": "0.8.dev0"}
{"input": ["cuda -keys=cuda,gpu -max_num_threads=1024 -thread_warp_size=32", "tutorial/conv2d_no_batching", [1, 7, 7, 16, 16, 1, 1, [1, 1], [0, 0]], {}], "config": {"index": 20950, "code_hash": null, "entity": [["tile_f", "sp", [-1, 2, 2, 2]], ["tile_y", "sp", [-1, 1, 7, 1]], ["tile_x", "sp", [-1, 7, 1, 1]], ["tile_rc", "sp", [-1, 4, 2]], ["tile_ry", "sp", [-1, 1, 1]], ["tile_rx", "sp", [-1, 1, 1]], ["auto_unroll_max_step", "ot", 1500], ["unroll_explicit", "ot", 0]]}, "result": [[7.491919301557338e-06, 7.512974044360548e-06], 0, 2.822499990463257, 1634044400.7478695], "version": 0.2, "tvm_version": "0.8.dev0"}
{"input": ["cuda -keys=cuda,gpu -max_num_threads=1024 -thread_warp_size=32", "tutorial/conv2d_no_batching", [1, 7, 7, 16, 16, 1, 1, [1, 1], [0, 0]], {}], "config": {"index": 26695, "code_hash": null, "entity": [["tile_f", "sp", [-1, 1, 1, 4]], ["tile_y", "sp", [-1, 1, 7, 1]], ["tile_x", "sp", [-1, 1, 7, 1]], ["tile_rc", "sp", [-1, 4, 1]], ["tile_ry", "sp", [-1, 1, 1]], ["tile_rx", "sp", [-1, 1, 1]], ["auto_unroll_max_step", "ot", 0], ["unroll_explicit", "ot", 1]]}, "result": [[5.89472376311844e-06, 5.888904422788606e-06], 0, 2.7401599884033203, 1634044404.5238144], "version": 0.2, "tvm_version": "0.8.dev0"}
{"input": ["cuda -keys=cuda,gpu -max_num_threads=1024 -thread_warp_size=32", "tutorial/conv2d_no_batching", [1, 7, 7, 16, 16, 1, 1, [1, 1], [0, 0]], {}], "config": {"index": 15254, "code_hash": null, "entity": [["tile_f", "sp", [-1, 2, 2, 4]], ["tile_y", "sp", [-1, 1, 1, 7]], ["tile_x", "sp", [-1, 1, 1, 1]], ["tile_rc", "sp", [-1, 1, 8]], ["tile_ry", "sp", [-1, 1, 1]], ["tile_rx", "sp", [-1, 1, 1]], ["auto_unroll_max_step", "ot", 512], ["unroll_explicit", "ot", 0]]}, "result": [[1.0270824393358878e-05, 1.0284759259259258e-05], 0, 2.8553194999694824, 1634044408.4563766], "version": 0.2, "tvm_version": "0.8.dev0"}
{"input": ["cuda -keys=cuda,gpu -max_num_threads=1024 -thread_warp_size=32", "tutorial/conv2d_no_batching", [1, 7, 7, 16, 16, 1, 1, [1, 1], [0, 0]], {}], "config": {"index": 18919, "code_hash": null, "entity": [["tile_f", "sp", [-1, 1, 2, 2]], ["tile_y", "sp", [-1, 1, 1, 1]], ["tile_x", "sp", [-1, 1, 1, 7]], ["tile_rc", "sp", [-1, 8, 1]], ["tile_ry", "sp", [-1, 1, 1]], ["tile_rx", "sp", [-1, 1, 1]], ["auto_unroll_max_step", "ot", 1500], ["unroll_explicit", "ot", 0]]}, "result": [[7.64834541984733e-06, 7.656585400763359e-06], 0, 2.821472406387329, 1634044411.872929], "version": 0.2, "tvm_version": "0.8.dev0"}
{"input": ["cuda -keys=cuda,gpu -max_num_threads=1024 -thread_warp_size=32", "tutorial/conv2d_no_batching", [1, 7, 7, 16, 16, 1, 1, [1, 1], [0, 0]], {}], "config": {"index": 49599, "code_hash": null, "entity": [["tile_f", "sp", [-1, 16, 1, 1]], ["tile_y", "sp", [-1, 7, 1, 1]], ["tile_x", "sp", [-1, 1, 7, 1]], ["tile_rc", "sp", [-1, 2, 8]], ["tile_ry", "sp", [-1, 1, 1]], ["tile_rx", "sp", [-1, 1, 1]], ["auto_unroll_max_step", "ot", 1500], ["unroll_explicit", "ot", 1]]}, "result": [[1.1634447272727272e-05, 1.1633588363636364e-05], 0, 3.5918917655944824, 1634044416.0751655], "version": 0.2, "tvm_version": "0.8.dev0"}
{"input": ["cuda -keys=cuda,gpu -max_num_threads=1024 -thread_warp_size=32", "tutorial/conv2d_no_batching", [1, 7, 7, 16, 16, 1, 1, [1, 1], [0, 0]], {}], "config": {"index": 5374, "code_hash": null, "entity": [["tile_f", "sp", [-1, 1, 2, 2]], ["tile_y", "sp", [-1, 7, 1, 1]], ["tile_x", "sp", [-1, 1, 7, 1]], ["tile_rc", "sp", [-1, 1, 4]], ["tile_ry", "sp", [-1, 1, 1]], ["tile_rx", "sp", [-1, 1, 1]], ["auto_unroll_max_step", "ot", 0], ["unroll_explicit", "ot", 0]]}, "result": [[7.436015969938939e-06, 7.43204462188821e-06], 0, 2.7655184268951416, 1634044419.872539], "version": 0.2, "tvm_version": "0.8.dev0"}
{"input": ["cuda -keys=cuda,gpu -max_num_threads=1024 -thread_warp_size=32", "tutorial/conv2d_no_batching", [1, 7, 7, 16, 16, 1, 1, [1, 1], [0, 0]], {}], "config": {"index": 35741, "code_hash": null, "entity": [["tile_f", "sp", [-1, 2, 2, 1]], ["tile_y", "sp", [-1, 7, 1, 1]], ["tile_x", "sp", [-1, 1, 1, 7]], ["tile_rc", "sp", [-1, 8, 1]], ["tile_ry", "sp", [-1, 1, 1]], ["tile_rx", "sp", [-1, 1, 1]], ["auto_unroll_max_step", "ot", 512], ["unroll_explicit", "ot", 1]]}, "result": [[1.8026077441077442e-05, 1.803550280583614e-05], 0, 3.2128095626831055, 1634044423.2236931], "version": 0.2, "tvm_version": "0.8.dev0"}
{"input": ["cuda -keys=cuda,gpu -max_num_threads=1024 -thread_warp_size=32", "tutorial/conv2d_no_batching", [1, 7, 7, 16, 16, 1, 1, [1, 1], [0, 0]], {}], "config": {"index": 25922, "code_hash": null, "entity": [["tile_f", "sp", [-1, 1, 4, 2]], ["tile_y", "sp", [-1, 1, 1, 1]], ["tile_x", "sp", [-1, 7, 1, 1]], ["tile_rc", "sp", [-1, 2, 1]], ["tile_ry", "sp", [-1, 1, 1]], ["tile_rx", "sp", [-1, 1, 1]], ["auto_unroll_max_step", "ot", 0], ["unroll_explicit", "ot", 1]]}, "result": [[7.138442857142857e-06, 7.153325e-06], 0, 2.7067275047302246, 1634044426.9823694], "version": 0.2, "tvm_version": "0.8.dev0"}
{"input": ["cuda -keys=cuda,gpu -max_num_threads=1024 -thread_warp_size=32", "tutorial/conv2d_no_batching", [1, 7, 7, 16, 16, 1, 1, [1, 1], [0, 0]], {}], "config": {"index": 42965, "code_hash": null, "entity": [["tile_f", "sp", [-1, 2, 2, 2]], ["tile_y", "sp", [-1, 1, 1, 7]], ["tile_x", "sp", [-1, 1, 7, 1]], ["tile_rc", "sp", [-1, 2, 1]], ["tile_ry", "sp", [-1, 1, 1]], ["tile_rx", "sp", [-1, 1, 1]], ["auto_unroll_max_step", "ot", 1500], ["unroll_explicit", "ot", 1]]}, "result": [[1.0773956989247311e-05, 1.0785266801075267e-05], 0, 2.9423768520355225, 1634044430.5635612], "version": 0.2, "tvm_version": "0.8.dev0"}
{"input": ["cuda -keys=cuda,gpu -max_num_threads=1024 -thread_warp_size=32", "tutorial/conv2d_no_batching", [1, 7, 7, 16, 16, 1, 1, [1, 1], [0, 0]], {}], "config": {"index": 3153, "code_hash": null, "entity": [["tile_f", "sp", [-1, 8, 1, 1]], ["tile_y", "sp", [-1, 1, 7, 1]], ["tile_x", "sp", [-1, 1, 7, 1]], ["tile_rc", "sp", [-1, 1, 2]], ["tile_ry", "sp", [-1, 1, 1]], ["tile_rx", "sp", [-1, 1, 1]], ["auto_unroll_max_step", "ot", 0], ["unroll_explicit", "ot", 0]]}, "result": [[6.937340828924163e-06, 6.947493386243386e-06], 0, 2.7820348739624023, 1634044433.4823115], "version": 0.2, "tvm_version": "0.8.dev0"}
{"input": ["cuda -keys=cuda,gpu -max_num_threads=1024 -thread_warp_size=32", "tutorial/conv2d_no_batching", [1, 7, 7, 16, 16, 1, 1, [1, 1], [0, 0]], {}], "config": {"index": 30253, "code_hash": null, "entity": [["tile_f", "sp", [-1, 2, 8, 1]], ["tile_y", "sp", [-1, 1, 1, 1]], ["tile_x", "sp", [-1, 1, 1, 1]], ["tile_rc", "sp", [-1, 1, 4]], ["tile_ry", "sp", [-1, 1, 1]], ["tile_rx", "sp", [-1, 1, 1]], ["auto_unroll_max_step", "ot", 0], ["unroll_explicit", "ot", 1]]}, "result": [[6.126981818181818e-06, 6.127096324951644e-06], 0, 2.6976852416992188, 1634044436.7635632], "version": 0.2, "tvm_version": "0.8.dev0"}
{"input": ["cuda -keys=cuda,gpu -max_num_threads=1024 -thread_warp_size=32", "tutorial/conv2d_no_batching", [1, 7, 7, 16, 16, 1, 1, [1, 1], [0, 0]], {}], "config": {"index": 21673, "code_hash": null, "entity": [["tile_f", "sp", [-1, 8, 2, 1]], ["tile_y", "sp", [-1, 1, 1, 7]], ["tile_x", "sp", [-1, 1, 7, 1]], ["tile_rc", "sp", [-1, 8, 2]], ["tile_ry", "sp", [-1, 1, 1]], ["tile_rx", "sp", [-1, 1, 1]], ["auto_unroll_max_step", "ot", 1500], ["unroll_explicit", "ot", 0]]}, "result": [[8.95547635135135e-06, 8.957722972972973e-06], 0, 2.866434097290039, 1634044440.2130637], "version": 0.2, "tvm_version": "0.8.dev0"}
{"input": ["cuda -keys=cuda,gpu -max_num_threads=1024 -thread_warp_size=32", "tutorial/conv2d_no_batching", [1, 7, 7, 16, 16, 1, 1, [1, 1], [0, 0]], {}], "config": {"index": 11259, "code_hash": null, "entity": [["tile_f", "sp", [-1, 1, 8, 2]], ["tile_y", "sp", [-1, 7, 1, 1]], ["tile_x", "sp", [-1, 1, 1, 1]], ["tile_rc", "sp", [-1, 1, 2]], ["tile_ry", "sp", [-1, 1, 1]], ["tile_rx", "sp", [-1, 1, 1]], ["auto_unroll_max_step", "ot", 512], ["unroll_explicit", "ot", 0]]}, "result": [[6.430973902236951e-06, 6.42291797845899e-06], 0, 2.811415672302246, 1634044443.1634367], "version": 0.2, "tvm_version": "0.8.dev0"}
{"input": ["cuda -keys=cuda,gpu -max_num_threads=1024 -thread_warp_size=32", "tutorial/conv2d_no_batching", [1, 7, 7, 16, 16, 1, 1, [1, 1], [0, 0]], {}], "config": {"index": 34449, "code_hash": null, "entity": [["tile_f", "sp", [-1, 1, 4, 1]], ["tile_y", "sp", [-1, 1, 1, 1]], ["tile_x", "sp", [-1, 1, 7, 1]], ["tile_rc", "sp", [-1, 2, 1]], ["tile_ry", "sp", [-1, 1, 1]], ["tile_rx", "sp", [-1, 1, 1]], ["auto_unroll_max_step", "ot", 512], ["unroll_explicit", "ot", 1]]}, "result": [[1.0159843511450382e-05, 1.0153616412213741e-05], 0, 2.7226572036743164, 1634044446.5091257], "version": 0.2, "tvm_version": "0.8.dev0"}
{"input": ["cuda -keys=cuda,gpu -max_num_threads=1024 -thread_warp_size=32", "tutorial/conv2d_no_batching", [1, 7, 7, 16, 16, 1, 1, [1, 1], [0, 0]], {}], "config": {"index": 2570, "code_hash": null, "entity": [["tile_f", "sp", [-1, 1, 1, 2]], ["tile_y", "sp", [-1, 7, 1, 1]], ["tile_x", "sp", [-1, 1, 7, 1]], ["tile_rc", "sp", [-1, 16, 1]], ["tile_ry", "sp", [-1, 1, 1]], ["tile_rx", "sp", [-1, 1, 1]], ["auto_unroll_max_step", "ot", 0], ["unroll_explicit", "ot", 0]]}, "result": [[7.765415735794075e-06, 7.768503156872267e-06], 0, 2.71212100982666, 1634044450.266741], "version": 0.2, "tvm_version": "0.8.dev0"}
{"input": ["cuda -keys=cuda,gpu -max_num_threads=1024 -thread_warp_size=32", "tutorial/conv2d_no_batching", [1, 7, 7, 16, 16, 1, 1, [1, 1], [0, 0]], {}], "config": {"index": 377, "code_hash": null, "entity": [["tile_f", "sp", [-1, 4, 1, 4]], ["tile_y", "sp", [-1, 1, 7, 1]], ["tile_x", "sp", [-1, 1, 7, 1]], ["tile_rc", "sp", [-1, 1, 1]], ["tile_ry", "sp", [-1, 1, 1]], ["tile_rx", "sp", [-1, 1, 1]], ["auto_unroll_max_step", "ot", 0], ["unroll_explicit", "ot", 0]]}, "result": [[7.310659564823209e-06, 7.3191953762466e-06], 0, 2.8168394565582275, 1634044453.6926973], "version": 0.2, "tvm_version": "0.8.dev0"}
{"input": ["cuda -keys=cuda,gpu -max_num_threads=1024 -thread_warp_size=32", "tutorial/conv2d_no_batching", [1, 7, 7, 16, 16, 1, 1, [1, 1], [0, 0]], {}], "config": {"index": 23405, "code_hash": null, "entity": [["tile_f", "sp", [-1, 1, 1, 4]], ["tile_y", "sp", [-1, 1, 1, 1]], ["tile_x", "sp", [-1, 1, 1, 7]], ["tile_rc", "sp", [-1, 4, 4]], ["tile_ry", "sp", [-1, 1, 1]], ["tile_rx", "sp", [-1, 1, 1]], ["auto_unroll_max_step", "ot", 1500], ["unroll_explicit", "ot", 0]]}, "result": [[8.628717285945073e-06, 8.60475013462574e-06], 0, 2.8940281867980957, 1634044457.1743646], "version": 0.2, "tvm_version": "0.8.dev0"}
{"input": ["cuda -keys=cuda,gpu -max_num_threads=1024 -thread_warp_size=32", "tutorial/conv2d_no_batching", [1, 7, 7, 16, 16, 1, 1, [1, 1], [0, 0]], {}], "config": {"index": 22578, "code_hash": null, "entity": [["tile_f", "sp", [-1, 8, 1, 1]], ["tile_y", "sp", [-1, 7, 1, 1]], ["tile_x", "sp", [-1, 7, 1, 1]], ["tile_rc", "sp", [-1, 2, 4]], ["tile_ry", "sp", [-1, 1, 1]], ["tile_rx", "sp", [-1, 1, 1]], ["auto_unroll_max_step", "ot", 1500], ["unroll_explicit", "ot", 0]]}, "result": [[0.00010129393, 0.00010121638], 0, 4.071334362030029, 1634044461.8897076], "version": 0.2, "tvm_version": "0.8.dev0"}
{"input": ["cuda -keys=cuda,gpu -max_num_threads=1024 -thread_warp_size=32", "tutorial/conv2d_no_batching", [1, 7, 7, 16, 16, 1, 1, [1, 1], [0, 0]], {}], "config": {"index": 18258, "code_hash": null, "entity": [["tile_f", "sp", [-1, 2, 4, 2]], ["tile_y", "sp", [-1, 7, 1, 1]], ["tile_x", "sp", [-1, 1, 7, 1]], ["tile_rc", "sp", [-1, 4, 1]], ["tile_ry", "sp", [-1, 1, 1]], ["tile_rx", "sp", [-1, 1, 1]], ["auto_unroll_max_step", "ot", 1500], ["unroll_explicit", "ot", 0]]}, "result": [[6.734691493863732e-06, 6.764667371984765e-06], 0, 2.8033242225646973, 1634044464.8323808], "version": 0.2, "tvm_version": "0.8.dev0"}
{"input": ["cuda -keys=cuda,gpu -max_num_threads=1024 -thread_warp_size=32", "tutorial/conv2d_no_batching", [1, 7, 7, 16, 16, 1, 1, [1, 1], [0, 0]], {}], "config": {"index": 13539, "code_hash": null, "entity": [["tile_f", "sp", [-1, 2, 2, 4]], ["tile_y", "sp", [-1, 1, 7, 1]], ["tile_x", "sp", [-1, 1, 1, 1]], ["tile_rc", "sp", [-1, 1, 4]], ["tile_ry", "sp", [-1, 1, 1]], ["tile_rx", "sp", [-1, 1, 1]], ["auto_unroll_max_step", "ot", 512], ["unroll_explicit", "ot", 0]]}, "result": [[5.993685453160701e-06, 5.993213632901752e-06], 0, 2.760924816131592, 1634044467.7310665], "version": 0.2, "tvm_version": "0.8.dev0"}
{"input": ["cuda -keys=cuda,gpu -max_num_threads=1024 -thread_warp_size=32", "tutorial/conv2d_no_batching", [1, 7, 7, 16, 16, 1, 1, [1, 1], [0, 0]], {}], "config": {"index": 48881, "code_hash": null, "entity": [["tile_f", "sp", [-1, 4, 2, 2]], ["tile_y", "sp", [-1, 1, 1, 1]], ["tile_x", "sp", [-1, 7, 1, 1]], ["tile_rc", "sp", [-1, 1, 8]], ["tile_ry", "sp", [-1, 1, 1]], ["tile_rx", "sp", [-1, 1, 1]], ["auto_unroll_max_step", "ot", 1500], ["unroll_explicit", "ot", 1]]}, "result": [[9.082912031782066e-06, 9.077870601589104e-06], 0, 3.6551666259765625, 1634044472.505705], "version": 0.2, "tvm_version": "0.8.dev0"}
{"input": ["cuda -keys=cuda,gpu -max_num_threads=1024 -thread_warp_size=32", "tutorial/conv2d_no_batching", [1, 7, 7, 16, 16, 1, 1, [1, 1], [0, 0]], {}], "config": {"index": 43514, "code_hash": null, "entity": [["tile_f", "sp", [-1, 1, 4, 1]], ["tile_y", "sp", [-1, 1, 1, 7]], ["tile_x", "sp", [-1, 1, 7, 1]], ["tile_rc", "sp", [-1, 4, 1]], ["tile_ry", "sp", [-1, 1, 1]], ["tile_rx", "sp", [-1, 1, 1]], ["auto_unroll_max_step", "ot", 1500], ["unroll_explicit", "ot", 1]]}, "result": [[6.695332056194124e-06, 6.678361430395914e-06], 0, 2.750500440597534, 1634044475.8925207], "version": 0.2, "tvm_version": "0.8.dev0"}
{"input": ["cuda -keys=cuda,gpu -max_num_threads=1024 -thread_warp_size=32", "tutorial/conv2d_no_batching", [1, 7, 7, 16, 16, 1, 1, [1, 1], [0, 0]], {}], "config": {"index": 25453, "code_hash": null, "entity": [["tile_f", "sp", [-1, 8, 2, 1]], ["tile_y", "sp", [-1, 1, 1, 7]], ["tile_x", "sp", [-1, 7, 1, 1]], ["tile_rc", "sp", [-1, 1, 1]], ["tile_ry", "sp", [-1, 1, 1]], ["tile_rx", "sp", [-1, 1, 1]], ["auto_unroll_max_step", "ot", 0], ["unroll_explicit", "ot", 1]]}, "result": [[0.00014037436, 0.00013947063], 0, 2.9631571769714355, 1634044479.4314096], "version": 0.2, "tvm_version": "0.8.dev0"}
{"input": ["cuda -keys=cuda,gpu -max_num_threads=1024 -thread_warp_size=32", "tutorial/conv2d_no_batching", [1, 7, 7, 16, 16, 1, 1, [1, 1], [0, 0]], {}], "config": {"index": 2037, "code_hash": null, "entity": [["tile_f", "sp", [-1, 4, 2, 1]], ["tile_y", "sp", [-1, 1, 7, 1]], ["tile_x", "sp", [-1, 1, 7, 1]], ["tile_rc", "sp", [-1, 8, 1]], ["tile_ry", "sp", [-1, 1, 1]], ["tile_rx", "sp", [-1, 1, 1]], ["auto_unroll_max_step", "ot", 0], ["unroll_explicit", "ot", 0]]}, "result": [[5.580622728892056e-06, 5.580884218026363e-06], 0, 2.779892921447754, 1634044482.7990093], "version": 0.2, "tvm_version": "0.8.dev0"}
{"input": ["cuda -keys=cuda,gpu -max_num_threads=1024 -thread_warp_size=32", "tutorial/conv2d_no_batching", [1, 7, 7, 16, 16, 1, 1, [1, 1], [0, 0]], {}], "config": {"index": 23361, "code_hash": null, "entity": [["tile_f", "sp", [-1, 2, 1, 2]], ["tile_y", "sp", [-1, 1, 1, 7]], ["tile_x", "sp", [-1, 1, 7, 1]], ["tile_rc", "sp", [-1, 4, 4]], ["tile_ry", "sp", [-1, 1, 1]], ["tile_rx", "sp", [-1, 1, 1]], ["auto_unroll_max_step", "ot", 1500], ["unroll_explicit", "ot", 0]]}, "result": [[7.777178501945525e-06, 7.79144892996109e-06], 0, 2.9268102645874023, 1634044486.3147955], "version": 0.2, "tvm_version": "0.8.dev0"}
{"input": ["cuda -keys=cuda,gpu -max_num_threads=1024 -thread_warp_size=32", "tutorial/conv2d_no_batching", [1, 7, 7, 16, 16, 1, 1, [1, 1], [0, 0]], {}], "config": {"index": 2272, "code_hash": null, "entity": [["tile_f", "sp", [-1, 2, 1, 8]], ["tile_y", "sp", [-1, 1, 1, 1]], ["tile_x", "sp", [-1, 1, 1, 1]], ["tile_rc", "sp", [-1, 16, 1]], ["tile_ry", "sp", [-1, 1, 1]], ["tile_rx", "sp", [-1, 1, 1]], ["auto_unroll_max_step", "ot", 0], ["unroll_explicit", "ot", 0]]}, "result": [[9.700124246079615e-06, 9.714967430639323e-06], 0, 2.752544403076172, 1634044489.6489582], "version": 0.2, "tvm_version": "0.8.dev0"}
{"input": ["cuda -keys=cuda,gpu -max_num_threads=1024 -thread_warp_size=32", "tutorial/conv2d_no_batching", [1, 7, 7, 16, 16, 1, 1, [1, 1], [0, 0]], {}], "config": {"index": 42046, "code_hash": null, "entity": [["tile_f", "sp", [-1, 4, 4, 1]], ["tile_y", "sp", [-1, 7, 1, 1]], ["tile_x", "sp", [-1, 1, 1, 1]], ["tile_rc", "sp", [-1, 1, 1]], ["tile_ry", "sp", [-1, 1, 1]], ["tile_rx", "sp", [-1, 1, 1]], ["auto_unroll_max_step", "ot", 1500], ["unroll_explicit", "ot", 1]]}, "result": [[8.454229244777718e-06, 8.462257096946974e-06], 0, 3.0035338401794434, 1634044493.234285], "version": 0.2, "tvm_version": "0.8.dev0"}
{"input": ["cuda -keys=cuda,gpu -max_num_threads=1024 -thread_warp_size=32", "tutorial/conv2d_no_batching", [1, 7, 7, 16, 16, 1, 1, [1, 1], [0, 0]], {}], "config": {"index": 19374, "code_hash": null, "entity": [["tile_f", "sp", [-1, 1, 2, 2]], ["tile_y", "sp", [-1, 7, 1, 1]], ["tile_x", "sp", [-1, 1, 7, 1]], ["tile_rc", "sp", [-1, 16, 1]], ["tile_ry", "sp", [-1, 1, 1]], ["tile_rx", "sp", [-1, 1, 1]], ["auto_unroll_max_step", "ot", 1500], ["unroll_explicit", "ot", 0]]}, "result": [[6.378004455245039e-06, 6.375609558525718e-06], 0, 2.8040528297424316, 1634044496.1779282], "version": 0.2, "tvm_version": "0.8.dev0"}
{"input": ["cuda -keys=cuda,gpu -max_num_threads=1024 -thread_warp_size=32", "tutorial/conv2d_no_batching", [1, 7, 7, 16, 16, 1, 1, [1, 1], [0, 0]], {}], "config": {"index": 19814, "code_hash": null, "entity": [["tile_f", "sp", [-1, 16, 1, 1]], ["tile_y", "sp", [-1, 1, 7, 1]], ["tile_x", "sp", [-1, 7, 1, 1]], ["tile_rc", "sp", [-1, 1, 2]], ["tile_ry", "sp", [-1, 1, 1]], ["tile_rx", "sp", [-1, 1, 1]], ["auto_unroll_max_step", "ot", 1500], ["unroll_explicit", "ot", 0]]}, "result": [[1.5097450796626053e-05, 1.509765229615745e-05], 0, 2.8816018104553223, 1634044500.0870278], "version": 0.2, "tvm_version": "0.8.dev0"}
{"input": ["cuda -keys=cuda,gpu -max_num_threads=1024 -thread_warp_size=32", "tutorial/conv2d_no_batching", [1, 7, 7, 16, 16, 1, 1, [1, 1], [0, 0]], {}], "config": {"index": 46504, "code_hash": null, "entity": [["tile_f", "sp", [-1, 1, 8, 2]], ["tile_y", "sp", [-1, 1, 1, 1]], ["tile_x", "sp", [-1, 1, 1, 1]], ["tile_rc", "sp", [-1, 8, 2]], ["tile_ry", "sp", [-1, 1, 1]], ["tile_rx", "sp", [-1, 1, 1]], ["auto_unroll_max_step", "ot", 1500], ["unroll_explicit", "ot", 1]]}, "result": [[5.815228025009195e-06, 5.807567120264803e-06], 0, 0.684098482131958, 1634044524.4270506], "version": 0.2, "tvm_version": "0.8.dev0"}
{"input": ["cuda -keys=cuda,gpu -max_num_threads=1024 -thread_warp_size=32", "tutorial/conv2d_no_batching", [1, 7, 7, 16, 16, 1, 1, [1, 1], [0, 0]], {}], "config": {"index": 46784, "code_hash": null, "entity": [["tile_f", "sp", [-1, 1, 8, 2]], ["tile_y", "sp", [-1, 1, 1, 1]], ["tile_x", "sp", [-1, 1, 7, 1]], ["tile_rc", "sp", [-1, 8, 2]], ["tile_ry", "sp", [-1, 1, 1]], ["tile_rx", "sp", [-1, 1, 1]], ["auto_unroll_max_step", "ot", 1500], ["unroll_explicit", "ot", 1]]}, "result": [[5.472128434065934e-06, 5.473142857142857e-06], 0, 0.6748480796813965, 1634044525.2419024], "version": 0.2, "tvm_version": "0.8.dev0"}
{"input": ["cuda -keys=cuda,gpu -max_num_threads=1024 -thread_warp_size=32", "tutorial/conv2d_no_batching", [1, 7, 7, 16, 16, 1, 1, [1, 1], [0, 0]], {}], "config": {"index": 29984, "code_hash": null, "entity": [["tile_f", "sp", [-1, 1, 8, 2]], ["tile_y", "sp", [-1, 1, 1, 1]], ["tile_x", "sp", [-1, 1, 7, 1]], ["tile_rc", "sp", [-1, 8, 2]], ["tile_ry", "sp", [-1, 1, 1]], ["tile_rx", "sp", [-1, 1, 1]], ["auto_unroll_max_step", "ot", 0], ["unroll_explicit", "ot", 1]]}, "result": [[5.320624957264957e-06, 5.322149059829059e-06], 0, 0.7014508247375488, 1634044527.0769503], "version": 0.2, "tvm_version": "0.8.dev0"}
{"input": ["cuda -keys=cuda,gpu -max_num_threads=1024 -thread_warp_size=32", "tutorial/conv2d_no_batching", [1, 7, 7, 16, 16, 1, 1, [1, 1], [0, 0]], {}], "config": {"index": 38384, "code_hash": null, "entity": [["tile_f", "sp", [-1, 1, 8, 2]], ["tile_y", "sp", [-1, 1, 1, 1]], ["tile_x", "sp", [-1, 1, 7, 1]], ["tile_rc", "sp", [-1, 8, 2]], ["tile_ry", "sp", [-1, 1, 1]], ["tile_rx", "sp", [-1, 1, 1]], ["auto_unroll_max_step", "ot", 512], ["unroll_explicit", "ot", 1]]}, "result": [[5.164390732829445e-06, 5.171393690437069e-06], 0, 0.6345212459564209, 1634044528.8000002], "version": 0.2, "tvm_version": "0.8.dev0"}
{"input": ["cuda -keys=cuda,gpu -max_num_threads=1024 -thread_warp_size=32", "tutorial/conv2d_no_batching", [1, 7, 7, 16, 16, 1, 1, [1, 1], [0, 0]], {}], "config": {"index": 23250, "code_hash": null, "entity": [["tile_f", "sp", [-1, 2, 4, 1]], ["tile_y", "sp", [-1, 1, 1, 1]], ["tile_x", "sp", [-1, 1, 7, 1]], ["tile_rc", "sp", [-1, 4, 4]], ["tile_ry", "sp", [-1, 1, 1]], ["tile_rx", "sp", [-1, 1, 1]], ["auto_unroll_max_step", "ot", 1500], ["unroll_explicit", "ot", 0]]}, "result": [[5.577121730031391e-06, 5.566310777816533e-06], 0, 0.6749224662780762, 1634044529.6162634], "version": 0.2, "tvm_version": "0.8.dev0"}
{"input": ["cuda -keys=cuda,gpu -max_num_threads=1024 -thread_warp_size=32", "tutorial/conv2d_no_batching", [1, 7, 7, 16, 16, 1, 1, [1, 1], [0, 0]], {}], "config": {"index": 38104, "code_hash": null, "entity": [["tile_f", "sp", [-1, 1, 8, 2]], ["tile_y", "sp", [-1, 1, 1, 1]], ["tile_x", "sp", [-1, 1, 1, 1]], ["tile_rc", "sp", [-1, 8, 2]], ["tile_ry", "sp", [-1, 1, 1]], ["tile_rx", "sp", [-1, 1, 1]], ["auto_unroll_max_step", "ot", 512], ["unroll_explicit", "ot", 1]]}, "result": [[5.864818623784592e-06, 5.861719895287958e-06], 0, 0.6316168308258057, 1634044530.3842578], "version": 0.2, "tvm_version": "0.8.dev0"}
{"input": ["cuda -keys=cuda,gpu -max_num_threads=1024 -thread_warp_size=32", "tutorial/conv2d_no_batching", [1, 7, 7, 16, 16, 1, 1, [1, 1], [0, 0]], {}], "config": {"index": 29704, "code_hash": null, "entity": [["tile_f", "sp", [-1, 1, 8, 2]], ["tile_y", "sp", [-1, 1, 1, 1]], ["tile_x", "sp", [-1, 1, 1, 1]], ["tile_rc", "sp", [-1, 8, 2]], ["tile_ry", "sp", [-1, 1, 1]], ["tile_rx", "sp", [-1, 1, 1]], ["auto_unroll_max_step", "ot", 0], ["unroll_explicit", "ot", 1]]}, "result": [[5.788290527892175e-06, 5.796370273305878e-06], 0, 0.7158677577972412, 1634044532.1720345], "version": 0.2, "tvm_version": "0.8.dev0"}
{"input": ["cuda -keys=cuda,gpu -max_num_threads=1024 -thread_warp_size=32", "tutorial/conv2d_no_batching", [1, 7, 7, 16, 16, 1, 1, [1, 1], [0, 0]], {}], "config": {"index": 49584, "code_hash": null, "entity": [["tile_f", "sp", [-1, 1, 8, 2]], ["tile_y", "sp", [-1, 1, 1, 1]], ["tile_x", "sp", [-1, 1, 7, 1]], ["tile_rc", "sp", [-1, 2, 8]], ["tile_ry", "sp", [-1, 1, 1]], ["tile_rx", "sp", [-1, 1, 1]], ["auto_unroll_max_step", "ot", 1500], ["unroll_explicit", "ot", 1]]}, "result": [[5.592139169863969e-06, 5.5984391349843034e-06], 0, 0.649622917175293, 1634044533.4081113], "version": 0.2, "tvm_version": "0.8.dev0"}
{"input": ["cuda -keys=cuda,gpu -max_num_threads=1024 -thread_warp_size=32", "tutorial/conv2d_no_batching", [1, 7, 7, 16, 16, 1, 1, [1, 1], [0, 0]], {}], "config": {"index": 44544, "code_hash": null, "entity": [["tile_f", "sp", [-1, 1, 8, 2]], ["tile_y", "sp", [-1, 1, 1, 1]], ["tile_x", "sp", [-1, 1, 7, 1]], ["tile_rc", "sp", [-1, 16, 1]], ["tile_ry", "sp", [-1, 1, 1]], ["tile_rx", "sp", [-1, 1, 1]], ["auto_unroll_max_step", "ot", 1500], ["unroll_explicit", "ot", 1]]}, "result": [[5.164404934210525e-06, 5.168372039473684e-06], 0, 0.7043960094451904, 1634044534.766773], "version": 0.2, "tvm_version": "0.8.dev0"}
{"input": ["cuda -keys=cuda,gpu -max_num_threads=1024 -thread_warp_size=32", "tutorial/conv2d_no_batching", [1, 7, 7, 16, 16, 1, 1, [1, 1], [0, 0]], {}], "config": {"index": 21304, "code_hash": null, "entity": [["tile_f", "sp", [-1, 1, 8, 2]], ["tile_y", "sp", [-1, 1, 1, 1]], ["tile_x", "sp", [-1, 1, 1, 1]], ["tile_rc", "sp", [-1, 8, 2]], ["tile_ry", "sp", [-1, 1, 1]], ["tile_rx", "sp", [-1, 1, 1]], ["auto_unroll_max_step", "ot", 1500], ["unroll_explicit", "ot", 0]]}, "result": [[6.033419908466819e-06, 6.032860411899314e-06], 0, 0.7129623889923096, 1634044536.5014408], "version": 0.2, "tvm_version": "0.8.dev0"}
{"input": ["cuda -keys=cuda,gpu -max_num_threads=1024 -thread_warp_size=32", "tutorial/conv2d_no_batching", [1, 7, 7, 16, 16, 1, 1, [1, 1], [0, 0]], {}], "config": {"index": 41184, "code_hash": null, "entity": [["tile_f", "sp", [-1, 1, 8, 2]], ["tile_y", "sp", [-1, 1, 1, 1]], ["tile_x", "sp", [-1, 1, 7, 1]], ["tile_rc", "sp", [-1, 2, 8]], ["tile_ry", "sp", [-1, 1, 1]], ["tile_rx", "sp", [-1, 1, 1]], ["auto_unroll_max_step", "ot", 512], ["unroll_explicit", "ot", 1]]}, "result": [[5.579024669909659e-06, 5.586515288394718e-06], 0, 0.6833319664001465, 1634044537.8097887], "version": 0.2, "tvm_version": "0.8.dev0"}
{"input": ["cuda -keys=cuda,gpu -max_num_threads=1024 -thread_warp_size=32", "tutorial/conv2d_no_batching", [1, 7, 7, 16, 16, 1, 1, [1, 1], [0, 0]], {}], "config": {"index": 32784, "code_hash": null, "entity": [["tile_f", "sp", [-1, 1, 8, 2]], ["tile_y", "sp", [-1, 1, 1, 1]], ["tile_x", "sp", [-1, 1, 7, 1]], ["tile_rc", "sp", [-1, 2, 8]], ["tile_ry", "sp", [-1, 1, 1]], ["tile_rx", "sp", [-1, 1, 1]], ["auto_unroll_max_step", "ot", 0], ["unroll_explicit", "ot", 1]]}, "result": [[5.538533701657459e-06, 5.544430939226519e-06], 0, 0.6712267398834229, 1634044538.6212113], "version": 0.2, "tvm_version": "0.8.dev0"}
{"input": ["cuda -keys=cuda,gpu -max_num_threads=1024 -thread_warp_size=32", "tutorial/conv2d_no_batching", [1, 7, 7, 16, 16, 1, 1, [1, 1], [0, 0]], {}], "config": {"index": 6239, "code_hash": null, "entity": [["tile_f", "sp", [-1, 1, 4, 1]], ["tile_y", "sp", [-1, 1, 7, 1]], ["tile_x", "sp", [-1, 1, 1, 1]], ["tile_rc", "sp", [-1, 4, 4]], ["tile_ry", "sp", [-1, 1, 1]], ["tile_rx", "sp", [-1, 1, 1]], ["auto_unroll_max_step", "ot", 0], ["unroll_explicit", "ot", 0]]}, "result": [[5.376428814713896e-06, 5.3804121253406e-06], 0, 0.6720948219299316, 1634044539.4340436], "version": 0.2, "tvm_version": "0.8.dev0"}
{"input": ["cuda -keys=cuda,gpu -max_num_threads=1024 -thread_warp_size=32", "tutorial/conv2d_no_batching", [1, 7, 7, 16, 16, 1, 1, [1, 1], [0, 0]], {}], "config": {"index": 14639, "code_hash": null, "entity": [["tile_f", "sp", [-1, 1, 4, 1]], ["tile_y", "sp", [-1, 1, 7, 1]], ["tile_x", "sp", [-1, 1, 1, 1]], ["tile_rc", "sp", [-1, 4, 4]], ["tile_ry", "sp", [-1, 1, 1]], ["tile_rx", "sp", [-1, 1, 1]], ["auto_unroll_max_step", "ot", 512], ["unroll_explicit", "ot", 0]]}, "result": [[5.2197205051512135e-06, 5.2438152210036555e-06], 0, 0.6474616527557373, 1634044540.6809168], "version": 0.2, "tvm_version": "0.8.dev0"}
{"input": ["cuda -keys=cuda,gpu -max_num_threads=1024 -thread_warp_size=32", "tutorial/conv2d_no_batching", [1, 7, 7, 16, 16, 1, 1, [1, 1], [0, 0]], {}], "config": {"index": 36144, "code_hash": null, "entity": [["tile_f", "sp", [-1, 1, 8, 2]], ["tile_y", "sp", [-1, 1, 1, 1]], ["tile_x", "sp", [-1, 1, 7, 1]], ["tile_rc", "sp", [-1, 16, 1]], ["tile_ry", "sp", [-1, 1, 1]], ["tile_rx", "sp", [-1, 1, 1]], ["auto_unroll_max_step", "ot", 512], ["unroll_explicit", "ot", 1]]}, "result": [[5.44851797385621e-06, 5.459090413943355e-06], 0, 0.6258220672607422, 1634044541.4476652], "version": 0.2, "tvm_version": "0.8.dev0"}
{"input": ["cuda -keys=cuda,gpu -max_num_threads=1024 -thread_warp_size=32", "tutorial/conv2d_no_batching", [1, 7, 7, 16, 16, 1, 1, [1, 1], [0, 0]], {}], "config": {"index": 27744, "code_hash": null, "entity": [["tile_f", "sp", [-1, 1, 8, 2]], ["tile_y", "sp", [-1, 1, 1, 1]], ["tile_x", "sp", [-1, 1, 7, 1]], ["tile_rc", "sp", [-1, 16, 1]], ["tile_ry", "sp", [-1, 1, 1]], ["tile_rx", "sp", [-1, 1, 1]], ["auto_unroll_max_step", "ot", 0], ["unroll_explicit", "ot", 1]]}, "result": [[5.6015918510713024e-06, 5.600299964875307e-06], 0, 0.689284086227417, 1634044542.2734063], "version": 0.2, "tvm_version": "0.8.dev0"}
{"input": ["cuda -keys=cuda,gpu -max_num_threads=1024 -thread_warp_size=32", "tutorial/conv2d_no_batching", [1, 7, 7, 16, 16, 1, 1, [1, 1], [0, 0]], {}], "config": {"index": 48450, "code_hash": null, "entity": [["tile_f", "sp", [-1, 2, 4, 1]], ["tile_y", "sp", [-1, 1, 1, 1]], ["tile_x", "sp", [-1, 1, 7, 1]], ["tile_rc", "sp", [-1, 4, 4]], ["tile_ry", "sp", [-1, 1, 1]], ["tile_rx", "sp", [-1, 1, 1]], ["auto_unroll_max_step", "ot", 1500], ["unroll_explicit", "ot", 1]]}, "result": [[5.338310941137346e-06, 5.343235118057865e-06], 0, 0.6790142059326172, 1634044543.0956824], "version": 0.2, "tvm_version": "0.8.dev0"}
{"input": ["cuda -keys=cuda,gpu -max_num_threads=1024 -thread_warp_size=32", "tutorial/conv2d_no_batching", [1, 7, 7, 16, 16, 1, 1, [1, 1], [0, 0]], {}], "config": {"index": 6462, "code_hash": null, "entity": [["tile_f", "sp", [-1, 1, 4, 2]], ["tile_y", "sp", [-1, 1, 1, 1]], ["tile_x", "sp", [-1, 1, 7, 1]], ["tile_rc", "sp", [-1, 4, 4]], ["tile_ry", "sp", [-1, 1, 1]], ["tile_rx", "sp", [-1, 1, 1]], ["auto_unroll_max_step", "ot", 0], ["unroll_explicit", "ot", 0]]}, "result": [[5.489468415602348e-06, 5.492943734898171e-06], 0, 0.6983933448791504, 1634044543.9386072], "version": 0.2, "tvm_version": "0.8.dev0"}
{"input": ["cuda -keys=cuda,gpu -max_num_threads=1024 -thread_warp_size=32", "tutorial/conv2d_no_batching", [1, 7, 7, 16, 16, 1, 1, [1, 1], [0, 0]], {}], "config": {"index": 14862, "code_hash": null, "entity": [["tile_f", "sp", [-1, 1, 4, 2]], ["tile_y", "sp", [-1, 1, 1, 1]], ["tile_x", "sp", [-1, 1, 7, 1]], ["tile_rc", "sp", [-1, 4, 4]], ["tile_ry", "sp", [-1, 1, 1]], ["tile_rx", "sp", [-1, 1, 1]], ["auto_unroll_max_step", "ot", 512], ["unroll_explicit", "ot", 0]]}, "result": [[5.337532849239281e-06, 5.334507952973721e-06], 0, 0.6964101791381836, 1634044544.7769656], "version": 0.2, "tvm_version": "0.8.dev0"}
{"input": ["cuda -keys=cuda,gpu -max_num_threads=1024 -thread_warp_size=32", "tutorial/conv2d_no_batching", [1, 7, 7, 16, 16, 1, 1, [1, 1], [0, 0]], {}], "config": {"index": 23262, "code_hash": null, "entity": [["tile_f", "sp", [-1, 1, 4, 2]], ["tile_y", "sp", [-1, 1, 1, 1]], ["tile_x", "sp", [-1, 1, 7, 1]], ["tile_rc", "sp", [-1, 4, 4]], ["tile_ry", "sp", [-1, 1, 1]], ["tile_rx", "sp", [-1, 1, 1]], ["auto_unroll_max_step", "ot", 1500], ["unroll_explicit", "ot", 0]]}, "result": [[5.5131778634361236e-06, 5.53537114537445e-06], 0, 0.6251792907714844, 1634044545.5364065], "version": 0.2, "tvm_version": "0.8.dev0"}
{"input": ["cuda -keys=cuda,gpu -max_num_threads=1024 -thread_warp_size=32", "tutorial/conv2d_no_batching", [1, 7, 7, 16, 16, 1, 1, [1, 1], [0, 0]], {}], "config": {"index": 23249, "code_hash": null, "entity": [["tile_f", "sp", [-1, 1, 4, 1]], ["tile_y", "sp", [-1, 1, 1, 1]], ["tile_x", "sp", [-1, 1, 7, 1]], ["tile_rc", "sp", [-1, 4, 4]], ["tile_ry", "sp", [-1, 1, 1]], ["tile_rx", "sp", [-1, 1, 1]], ["auto_unroll_max_step", "ot", 1500], ["unroll_explicit", "ot", 0]]}, "result": [[5.06709694209499e-06, 5.066604424202993e-06], 0, 0.6883466243743896, 1634044546.3625624], "version": 0.2, "tvm_version": "0.8.dev0"}
{"input": ["cuda -keys=cuda,gpu -max_num_threads=1024 -thread_warp_size=32", "tutorial/conv2d_no_batching", [1, 7, 7, 16, 16, 1, 1, [1, 1], [0, 0]], {}], "config": {"index": 24929, "code_hash": null, "entity": [["tile_f", "sp", [-1, 1, 4, 1]], ["tile_y", "sp", [-1, 1, 1, 1]], ["tile_x", "sp", [-1, 1, 7, 1]], ["tile_rc", "sp", [-1, 1, 16]], ["tile_ry", "sp", [-1, 1, 1]], ["tile_rx", "sp", [-1, 1, 1]], ["auto_unroll_max_step", "ot", 1500], ["unroll_explicit", "ot", 0]]}, "result": [[5.0365461015852475e-06, 5.040076027175672e-06], 0, 0.6517441272735596, 1634044547.1587222], "version": 0.2, "tvm_version": "0.8.dev0"}
{"input": ["cuda -keys=cuda,gpu -max_num_threads=1024 -thread_warp_size=32", "tutorial/conv2d_no_batching", [1, 7, 7, 16, 16, 1, 1, [1, 1], [0, 0]], {}], "config": {"index": 6240, "code_hash": null, "entity": [["tile_f", "sp", [-1, 2, 4, 1]], ["tile_y", "sp", [-1, 1, 7, 1]], ["tile_x", "sp", [-1, 1, 1, 1]], ["tile_rc", "sp", [-1, 4, 4]], ["tile_ry", "sp", [-1, 1, 1]], ["tile_rx", "sp", [-1, 1, 1]], ["auto_unroll_max_step", "ot", 0], ["unroll_explicit", "ot", 0]]}, "result": [[5.3967583476764205e-06, 5.389002065404475e-06], 0, 0.6979608535766602, 1634044547.996256], "version": 0.2, "tvm_version": "0.8.dev0"}
{"input": ["cuda -keys=cuda,gpu -max_num_threads=1024 -thread_warp_size=32", "tutorial/conv2d_no_batching", [1, 7, 7, 16, 16, 1, 1, [1, 1], [0, 0]], {}], "config": {"index": 14640, "code_hash": null, "entity": [["tile_f", "sp", [-1, 2, 4, 1]], ["tile_y", "sp", [-1, 1, 7, 1]], ["tile_x", "sp", [-1, 1, 1, 1]], ["tile_rc", "sp", [-1, 4, 4]], ["tile_ry", "sp", [-1, 1, 1]], ["tile_rx", "sp", [-1, 1, 1]], ["auto_unroll_max_step", "ot", 512], ["unroll_explicit", "ot", 0]]}, "result": [[5.536042575650949e-06, 5.539549612948627e-06], 0, 0.6362061500549316, 1634044548.7683773], "version": 0.2, "tvm_version": "0.8.dev0"}
{"input": ["cuda -keys=cuda,gpu -max_num_threads=1024 -thread_warp_size=32", "tutorial/conv2d_no_batching", [1, 7, 7, 16, 16, 1, 1, [1, 1], [0, 0]], {}], "config": {"index": 6449, "code_hash": null, "entity": [["tile_f", "sp", [-1, 1, 4, 1]], ["tile_y", "sp", [-1, 1, 1, 1]], ["tile_x", "sp", [-1, 1, 7, 1]], ["tile_rc", "sp", [-1, 4, 4]], ["tile_ry", "sp", [-1, 1, 1]], ["tile_rx", "sp", [-1, 1, 1]], ["auto_unroll_max_step", "ot", 0], ["unroll_explicit", "ot", 0]]}, "result": [[5.319169297950958e-06, 5.325073228081961e-06], 0, 0.640594482421875, 1634044549.5461283], "version": 0.2, "tvm_version": "0.8.dev0"}
{"input": ["cuda -keys=cuda,gpu -max_num_threads=1024 -thread_warp_size=32", "tutorial/conv2d_no_batching", [1, 7, 7, 16, 16, 1, 1, [1, 1], [0, 0]], {}], "config": {"index": 14849, "code_hash": null, "entity": [["tile_f", "sp", [-1, 1, 4, 1]], ["tile_y", "sp", [-1, 1, 1, 1]], ["tile_x", "sp", [-1, 1, 7, 1]], ["tile_rc", "sp", [-1, 4, 4]], ["tile_ry", "sp", [-1, 1, 1]], ["tile_rx", "sp", [-1, 1, 1]], ["auto_unroll_max_step", "ot", 512], ["unroll_explicit", "ot", 0]]}, "result": [[5.4991967100753935e-06, 5.496821110349554e-06], 0, 0.6447553634643555, 1634044550.328212], "version": 0.2, "tvm_version": "0.8.dev0"}
{"input": ["cuda -keys=cuda,gpu -max_num_threads=1024 -thread_warp_size=32", "tutorial/conv2d_no_batching", [1, 7, 7, 16, 16, 1, 1, [1, 1], [0, 0]], {}], "config": {"index": 8142, "code_hash": null, "entity": [["tile_f", "sp", [-1, 1, 4, 2]], ["tile_y", "sp", [-1, 1, 1, 1]], ["tile_x", "sp", [-1, 1, 7, 1]], ["tile_rc", "sp", [-1, 1, 16]], ["tile_ry", "sp", [-1, 1, 1]], ["tile_rx", "sp", [-1, 1, 1]], ["auto_unroll_max_step", "ot", 0], ["unroll_explicit", "ot", 0]]}, "result": [[5.371086171662126e-06, 5.377174046321525e-06], 0, 0.6487932205200195, 1634044551.1135936], "version": 0.2, "tvm_version": "0.8.dev0"}
{"input": ["cuda -keys=cuda,gpu -max_num_threads=1024 -thread_warp_size=32", "tutorial/conv2d_no_batching", [1, 7, 7, 16, 16, 1, 1, [1, 1], [0, 0]], {}], "config": {"index": 24942, "code_hash": null, "entity": [["tile_f", "sp", [-1, 1, 4, 2]], ["tile_y", "sp", [-1, 1, 1, 1]], ["tile_x", "sp", [-1, 1, 7, 1]], ["tile_rc", "sp", [-1, 1, 16]], ["tile_ry", "sp", [-1, 1, 1]], ["tile_rx", "sp", [-1, 1, 1]], ["auto_unroll_max_step", "ot", 1500], ["unroll_explicit", "ot", 0]]}, "result": [[5.334325635876841e-06, 5.332210843373495e-06], 0, 0.631049394607544, 1634044551.8812628], "version": 0.2, "tvm_version": "0.8.dev0"}
{"input": ["cuda -keys=cuda,gpu -max_num_threads=1024 -thread_warp_size=32", "tutorial/conv2d_no_batching", [1, 7, 7, 16, 16, 1, 1, [1, 1], [0, 0]], {}], "config": {"index": 16542, "code_hash": null, "entity": [["tile_f", "sp", [-1, 1, 4, 2]], ["tile_y", "sp", [-1, 1, 1, 1]], ["tile_x", "sp", [-1, 1, 7, 1]], ["tile_rc", "sp", [-1, 1, 16]], ["tile_ry", "sp", [-1, 1, 1]], ["tile_rx", "sp", [-1, 1, 1]], ["auto_unroll_max_step", "ot", 512], ["unroll_explicit", "ot", 0]]}, "result": [[5.287736789297659e-06, 5.272460200668897e-06], 0, 0.6627137660980225, 1634044552.685961], "version": 0.2, "tvm_version": "0.8.dev0"}
{"input": ["cuda -keys=cuda,gpu -max_num_threads=1024 -thread_warp_size=32", "tutorial/conv2d_no_batching", [1, 7, 7, 16, 16, 1, 1, [1, 1], [0, 0]], {}], "config": {"index": 8129, "code_hash": null, "entity": [["tile_f", "sp", [-1, 1, 4, 1]], ["tile_y", "sp", [-1, 1, 1, 1]], ["tile_x", "sp", [-1, 1, 7, 1]], ["tile_rc", "sp", [-1, 1, 16]], ["tile_ry", "sp", [-1, 1, 1]], ["tile_rx", "sp", [-1, 1, 1]], ["auto_unroll_max_step", "ot", 0], ["unroll_explicit", "ot", 0]]}, "result": [[5.502710051107326e-06, 5.4981345826235105e-06], 0, 0.6561129093170166, 1634044553.4774225], "version": 0.2, "tvm_version": "0.8.dev0"}
{"input": ["cuda -keys=cuda,gpu -max_num_threads=1024 -thread_warp_size=32", "tutorial/conv2d_no_batching", [1, 7, 7, 16, 16, 1, 1, [1, 1], [0, 0]], {}], "config": {"index": 16529, "code_hash": null, "entity": [["tile_f", "sp", [-1, 1, 4, 1]], ["tile_y", "sp", [-1, 1, 1, 1]], ["tile_x", "sp", [-1, 1, 7, 1]], ["tile_rc", "sp", [-1, 1, 16]], ["tile_ry", "sp", [-1, 1, 1]], ["tile_rx", "sp", [-1, 1, 1]], ["auto_unroll_max_step", "ot", 512], ["unroll_explicit", "ot", 0]]}, "result": [[5.101567752442997e-06, 5.1007140065146576e-06], 0, 0.6419816017150879, 1634044554.257165], "version": 0.2, "tvm_version": "0.8.dev0"}
{"input": ["cuda -keys=cuda,gpu -max_num_threads=1024 -thread_warp_size=32", "tutorial/conv2d_no_batching", [1, 7, 7, 16, 16, 1, 1, [1, 1], [0, 0]], {}], "config": {"index": 41742, "code_hash": null, "entity": [["tile_f", "sp", [-1, 1, 4, 2]], ["tile_y", "sp", [-1, 1, 1, 1]], ["tile_x", "sp", [-1, 1, 7, 1]], ["tile_rc", "sp", [-1, 1, 16]], ["tile_ry", "sp", [-1, 1, 1]], ["tile_rx", "sp", [-1, 1, 1]], ["auto_unroll_max_step", "ot", 512], ["unroll_explicit", "ot", 1]]}, "result": [[5.411185414516684e-06, 5.41325730994152e-06], 0, 0.697486400604248, 1634044555.0940306], "version": 0.2, "tvm_version": "0.8.dev0"}
{"input": ["cuda -keys=cuda,gpu -max_num_threads=1024 -thread_warp_size=32", "tutorial/conv2d_no_batching", [1, 7, 7, 16, 16, 1, 1, [1, 1], [0, 0]], {}], "config": {"index": 33342, "code_hash": null, "entity": [["tile_f", "sp", [-1, 1, 4, 2]], ["tile_y", "sp", [-1, 1, 1, 1]], ["tile_x", "sp", [-1, 1, 7, 1]], ["tile_rc", "sp", [-1, 1, 16]], ["tile_ry", "sp", [-1, 1, 1]], ["tile_rx", "sp", [-1, 1, 1]], ["auto_unroll_max_step", "ot", 0], ["unroll_explicit", "ot", 1]]}, "result": [[5.288639421459805e-06, 5.2940985536495125e-06], 0, 0.6220378875732422, 1634044555.856265], "version": 0.2, "tvm_version": "0.8.dev0"}
{"input": ["cuda -keys=cuda,gpu -max_num_threads=1024 -thread_warp_size=32", "tutorial/conv2d_no_batching", [1, 7, 7, 16, 16, 1, 1, [1, 1], [0, 0]], {}], "config": {"index": 50142, "code_hash": null, "entity": [["tile_f", "sp", [-1, 1, 4, 2]], ["tile_y", "sp", [-1, 1, 1, 1]], ["tile_x", "sp", [-1, 1, 7, 1]], ["tile_rc", "sp", [-1, 1, 16]], ["tile_ry", "sp", [-1, 1, 1]], ["tile_rx", "sp", [-1, 1, 1]], ["auto_unroll_max_step", "ot", 1500], ["unroll_explicit", "ot", 1]]}, "result": [[5.475588335028823e-06, 5.478698202780603e-06], 0, 0.6413650512695312, 1634044556.6362007], "version": 0.2, "tvm_version": "0.8.dev0"}
{"input": ["cuda -keys=cuda,gpu -max_num_threads=1024 -thread_warp_size=32", "tutorial/conv2d_no_batching", [1, 7, 7, 16, 16, 1, 1, [1, 1], [0, 0]], {}], "config": {"index": 23040, "code_hash": null, "entity": [["tile_f", "sp", [-1, 2, 4, 1]], ["tile_y", "sp", [-1, 1, 7, 1]], ["tile_x", "sp", [-1, 1, 1, 1]], ["tile_rc", "sp", [-1, 4, 4]], ["tile_ry", "sp", [-1, 1, 1]], ["tile_rx", "sp", [-1, 1, 1]], ["auto_unroll_max_step", "ot", 1500], ["unroll_explicit", "ot", 0]]}, "result": [[5.628773012552301e-06, 5.630854951185495e-06], 0, 0.6606338024139404, 1634044557.4369605], "version": 0.2, "tvm_version": "0.8.dev0"}
{"input": ["cuda -keys=cuda,gpu -max_num_threads=1024 -thread_warp_size=32", "tutorial/conv2d_no_batching", [1, 7, 7, 16, 16, 1, 1, [1, 1], [0, 0]], {}], "config": {"index": 19344, "code_hash": null, "entity": [["tile_f", "sp", [-1, 1, 8, 2]], ["tile_y", "sp", [-1, 1, 1, 1]], ["tile_x", "sp", [-1, 1, 7, 1]], ["tile_rc", "sp", [-1, 16, 1]], ["tile_ry", "sp", [-1, 1, 1]], ["tile_rx", "sp", [-1, 1, 1]], ["auto_unroll_max_step", "ot", 1500], ["unroll_explicit", "ot", 0]]}, "result": [[5.3885134766291375e-06, 5.3864387581030365e-06], 0, 0.7004446983337402, 1634044558.2803297], "version": 0.2, "tvm_version": "0.8.dev0"}
{"input": ["cuda -keys=cuda,gpu -max_num_threads=1024 -thread_warp_size=32", "tutorial/conv2d_no_batching", [1, 56, 56, 64, 512, 1, 1, [1, 1], [0, 0]], {}], "config": {"index": 149540344, "code_hash": null, "entity": [["tile_f", "sp", [-1, 8, 4, 1]], ["tile_y", "sp", [-1, 4, 1, 1]], ["tile_x", "sp", [-1, 28, 2, 1]], ["tile_rc", "sp", [-1, 8, 1]], ["tile_ry", "sp", [-1, 1, 1]], ["tile_rx", "sp", [-1, 1, 1]], ["auto_unroll_max_step", "ot", 1500], ["unroll_explicit", "ot", 1]]}, "result": [[0.011559572680000001, 0.010482855219999998], 0, 8.788009881973267, 1634045928.1755474], "version": 0.2, "tvm_version": "0.8.dev0"}
{"input": ["cuda -keys=cuda,gpu -max_num_threads=1024 -thread_warp_size=32", "tutorial/conv2d_no_batching", [1, 56, 56, 64, 512, 1, 1, [1, 1], [0, 0]], {}], "config": {"index": 15469172, "code_hash": null, "entity": [["tile_f", "sp", [-1, 1, 2, 8]], ["tile_y", "sp", [-1, 1, 1, 28]], ["tile_x", "sp", [-1, 1, 2, 7]], ["tile_rc", "sp", [-1, 2, 8]], ["tile_ry", "sp", [-1, 1, 1]], ["tile_rx", "sp", [-1, 1, 1]], ["auto_unroll_max_step", "ot", 0], ["unroll_explicit", "ot", 0]]}, "result": [[0.011094612470000001, 0.01050153003], 0, 6.343950510025024, 1634045933.3839087], "version": 0.2, "tvm_version": "0.8.dev0"}
{"input": ["cuda -keys=cuda,gpu -max_num_threads=1024 -thread_warp_size=32", "tutorial/conv2d_no_batching", [1, 56, 56, 64, 512, 1, 1, [1, 1], [0, 0]], {}], "config": {"index": 36473887, "code_hash": null, "entity": [["tile_f", "sp", [-1, 1, 4, 16]], ["tile_y", "sp", [-1, 1, 2, 4]], ["tile_x", "sp", [-1, 1, 1, 8]], ["tile_rc", "sp", [-1, 4, 2]], ["tile_ry", "sp", [-1, 1, 1]], ["tile_rx", "sp", [-1, 1, 1]], ["auto_unroll_max_step", "ot", 512], ["unroll_explicit", "ot", 0]]}, "result": [[0.00607977259, 0.0051789120700000005], 0, 4.919663429260254, 1634045939.3376896], "version": 0.2, "tvm_version": "0.8.dev0"}
