python/autotvm_logs/fused_conv2d_fixed_nparts_|i+64_1_16_14_14|w+_64_16_16_3_3|ws+1_1|wd_1_1|p+_1_1.log
{"input": ["cuda -keys=cuda,gpu -max_num_threads=1024 -thread_warp_size=32", "fused_conv2d_fixed_nparts", [64, 1, 14, 14, 16, 16, 3, 3, [1, 1], [1, 1]], {}], "config": {"index": 269598, "code_hash": null, "entity": [["tile_y", "sp", [-1, 1, 2, 7]], ["tile_x", "sp", [-1, 2, 1, 1]], ["tile_rc", "sp", [-1, 8]], ["tile_ry", "sp", [-1, 1]], ["tile_rx", "sp", [-1, 3]], ["auto_unroll_max_step", "ot", 512], ["unroll_explicit", "ot", 1], ["tile_f", "sp", [-1, 8, 2]]]}, "result": [[4.1198168e-05, 4.1213662e-05], 0, 6.370264291763306, 1634621746.7423215], "version": 0.2, "tvm_version": "0.8.dev0"}
{"input": ["cuda -keys=cuda,gpu -max_num_threads=1024 -thread_warp_size=32", "fused_conv2d_fixed_nparts", [64, 1, 14, 14, 16, 16, 3, 3, [1, 1], [1, 1]], {}], "config": {"index": 121206, "code_hash": null, "entity": [["tile_y", "sp", [-1, 1, 7, 1]], ["tile_x", "sp", [-1, 2, 7, 1]], ["tile_rc", "sp", [-1, 8]], ["tile_ry", "sp", [-1, 1]], ["tile_rx", "sp", [-1, 3]], ["auto_unroll_max_step", "ot", 1500], ["unroll_explicit", "ot", 1], ["tile_f", "sp", [-1, 8, 1]]]}, "result": [[3.1349216e-05, 3.1340321e-05], 0, 12.450950145721436, 1634621752.6338997], "version": 0.2, "tvm_version": "0.8.dev0"}
{"input": ["cuda -keys=cuda,gpu -max_num_threads=1024 -thread_warp_size=32", "fused_conv2d_fixed_nparts", [64, 1, 14, 14, 16, 16, 3, 3, [1, 1], [1, 1]], {}], "config": {"index": 266589, "code_hash": null, "entity": [["tile_y", "sp", [-1, 2, 1, 7]], ["tile_x", "sp", [-1, 7, 2, 1]], ["tile_rc", "sp", [-1, 2]], ["tile_ry", "sp", [-1, 1]], ["tile_rx", "sp", [-1, 1]], ["auto_unroll_max_step", "ot", 512], ["unroll_explicit", "ot", 1], ["tile_f", "sp", [-1, 8, 2]]]}, "result": [[0.000434821658, 0.000408231334], 0, 11.059757232666016, 1634621750.8207295], "version": 0.2, "tvm_version": "0.8.dev0"}
{"input": ["cuda -keys=cuda,gpu -max_num_threads=1024 -thread_warp_size=32", "fused_conv2d_fixed_nparts", [64, 1, 14, 14, 16, 16, 3, 3, [1, 1], [1, 1]], {}], "config": {"index": 145594, "code_hash": null, "entity": [["tile_y", "sp", [-1, 7, 1, 2]], ["tile_x", "sp", [-1, 1, 7, 2]], ["tile_rc", "sp", [-1, 8]], ["tile_ry", "sp", [-1, 3]], ["tile_rx", "sp", [-1, 1]], ["auto_unroll_max_step", "ot", 512], ["unroll_explicit", "ot", 1], ["tile_f", "sp", [-1, 16, 1]]]}, "result": [[3.2998534999999995e-05, 3.2996933e-05], 0, 19.836090803146362, 1634621760.4725256], "version": 0.2, "tvm_version": "0.8.dev0"}
{"input": ["cuda -keys=cuda,gpu -max_num_threads=1024 -thread_warp_size=32", "fused_conv2d_fixed_nparts", [64, 1, 14, 14, 16, 16, 3, 3, [1, 1], [1, 1]], {}], "config": {"index": 317836, "code_hash": null, "entity": [["tile_y", "sp", [-1, 1, 1, 7]], ["tile_x", "sp", [-1, 1, 14, 1]], ["tile_rc", "sp", [-1, 2]], ["tile_ry", "sp", [-1, 1]], ["tile_rx", "sp", [-1, 1]], ["auto_unroll_max_step", "ot", 1500], ["unroll_explicit", "ot", 0], ["tile_f", "sp", [-1, 2, 4]]]}, "result": [[4.4080162e-05, 4.407760300000001e-05], 0, 18.470991849899292, 1634621758.7275121], "version": 0.2, "tvm_version": "0.8.dev0"}
{"input": ["cuda -keys=cuda,gpu -max_num_threads=1024 -thread_warp_size=32", "fused_conv2d_fixed_nparts", [64, 1, 14, 14, 16, 16, 3, 3, [1, 1], [1, 1]], {}], "config": {"index": 129154, "code_hash": null, "entity": [["tile_y", "sp", [-1, 7, 1, 1]], ["tile_x", "sp", [-1, 1, 14, 1]], ["tile_rc", "sp", [-1, 16]], ["tile_ry", "sp", [-1, 1]], ["tile_rx", "sp", [-1, 1]], ["auto_unroll_max_step", "ot", 512], ["unroll_explicit", "ot", 0], ["tile_f", "sp", [-1, 16, 1]]]}, "result": [[2.3470203000000003e-05, 2.3467204e-05], 0, 22.98645544052124, 1634621764.0100071], "version": 0.2, "tvm_version": "0.8.dev0"}
{"input": ["cuda -keys=cuda,gpu -max_num_threads=1024 -thread_warp_size=32", "fused_conv2d_fixed_nparts", [64, 1, 14, 14, 16, 16, 3, 3, [1, 1], [1, 1]], {}], "config": {"index": 130707, "code_hash": null, "entity": [["tile_y", "sp", [-1, 14, 1, 1]], ["tile_x", "sp", [-1, 1, 1, 2]], ["tile_rc", "sp", [-1, 1]], ["tile_ry", "sp", [-1, 1]], ["tile_rx", "sp", [-1, 3]], ["auto_unroll_max_step", "ot", 512], ["unroll_explicit", "ot", 0], ["tile_f", "sp", [-1, 16, 1]]]}, "result": [[4.0902087e-05, 4.0880525e-05], 0, 21.1423761844635, 1634621762.2512758], "version": 0.2, "tvm_version": "0.8.dev0"}
{"input": ["cuda -keys=cuda,gpu -max_num_threads=1024 -thread_warp_size=32", "fused_conv2d_fixed_nparts", [64, 1, 14, 14, 16, 16, 3, 3, [1, 1], [1, 1]], {}], "config": {"index": 420470, "code_hash": null, "entity": [["tile_y", "sp", [-1, 1, 7, 1]], ["tile_x", "sp", [-1, 2, 7, 1]], ["tile_rc", "sp", [-1, 4]], ["tile_ry", "sp", [-1, 1]], ["tile_rx", "sp", [-1, 1]], ["auto_unroll_max_step", "ot", 512], ["unroll_explicit", "ot", 1], ["tile_f", "sp", [-1, 2, 8]]]}, "result": [[2.3949427e-05, 2.3949255999999997e-05], 0, 24.832388877868652, 1634621765.8518147], "version": 0.2, "tvm_version": "0.8.dev0"}
{"input": ["cuda -keys=cuda,gpu -max_num_threads=1024 -thread_warp_size=32", "fused_conv2d_fixed_nparts", [64, 1, 14, 14, 16, 16, 3, 3, [1, 1], [1, 1]], {}], "config": {"index": 73914, "code_hash": null, "entity": [["tile_y", "sp", [-1, 7, 1, 2]], ["tile_x", "sp", [-1, 1, 7, 2]], ["tile_rc", "sp", [-1, 8]], ["tile_ry", "sp", [-1, 3]], ["tile_rx", "sp", [-1, 1]], ["auto_unroll_max_step", "ot", 1500], ["unroll_explicit", "ot", 0], ["tile_f", "sp", [-1, 4, 1]]]}, "result": [[0.000174840764, 0.000165135335], 0, 31.473474502563477, 1634621772.2418373], "version": 0.2, "tvm_version": "0.8.dev0"}
{"input": ["cuda -keys=cuda,gpu -max_num_threads=1024 -thread_warp_size=32", "fused_conv2d_fixed_nparts", [64, 1, 14, 14, 16, 16, 3, 3, [1, 1], [1, 1]], {}], "config": {"index": 162320, "code_hash": null, "entity": [["tile_y", "sp", [-1, 1, 1, 1]], ["tile_x", "sp", [-1, 2, 1, 1]], ["tile_rc", "sp", [-1, 16]], ["tile_ry", "sp", [-1, 1]], ["tile_rx", "sp", [-1, 3]], ["auto_unroll_max_step", "ot", 512], ["unroll_explicit", "ot", 0], ["tile_f", "sp", [-1, 1, 2]]]}, "result": [[0.0006195084109999999, 0.0005992193650000001], 0, 33.960630893707275, 1634621775.3047276], "version": 0.2, "tvm_version": "0.8.dev0"}
{"input": ["cuda -keys=cuda,gpu -max_num_threads=1024 -thread_warp_size=32", "fused_conv2d_fixed_nparts", [64, 1, 14, 14, 16, 16, 3, 3, [1, 1], [1, 1]], {}], "config": {"index": 137822, "code_hash": null, "entity": [["tile_y", "sp", [-1, 1, 2, 7]], ["tile_x", "sp", [-1, 7, 2, 1]], ["tile_rc", "sp", [-1, 8]], ["tile_ry", "sp", [-1, 3]], ["tile_rx", "sp", [-1, 3]], ["auto_unroll_max_step", "ot", 1500], ["unroll_explicit", "ot", 0], ["tile_f", "sp", [-1, 16, 1]]]}, "result": [[2.9199168000000002e-05, 2.9185798999999998e-05], 0, 39.72805857658386, 1634621780.9702926], "version": 0.2, "tvm_version": "0.8.dev0"}
{"input": ["cuda -keys=cuda,gpu -max_num_threads=1024 -thread_warp_size=32", "fused_conv2d_fixed_nparts", [64, 1, 14, 14, 16, 16, 3, 3, [1, 1], [1, 1]], {}], "config": {"index": 54086, "code_hash": null, "entity": [["tile_y", "sp", [-1, 1, 7, 1]], ["tile_x", "sp", [-1, 1, 2, 1]], ["tile_rc", "sp", [-1, 2]], ["tile_ry", "sp", [-1, 1]], ["tile_rx", "sp", [-1, 3]], ["auto_unroll_max_step", "ot", 512], ["unroll_explicit", "ot", 1], ["tile_f", "sp", [-1, 2, 1]]]}, "result": [[2.8652532e-05, 2.8632015e-05], 0, 35.70520353317261, 1634621777.0621157], "version": 0.2, "tvm_version": "0.8.dev0"}
{"input": ["cuda -keys=cuda,gpu -max_num_threads=1024 -thread_warp_size=32", "fused_conv2d_fixed_nparts", [64, 1, 14, 14, 16, 16, 3, 3, [1, 1], [1, 1]], {}], "config": {"index": 68256, "code_hash": null, "entity": [["tile_y", "sp", [-1, 1, 1, 1]], ["tile_x", "sp", [-1, 7, 1, 2]], ["tile_rc", "sp", [-1, 2]], ["tile_ry", "sp", [-1, 3]], ["tile_rx", "sp", [-1, 1]], ["auto_unroll_max_step", "ot", 512], ["unroll_explicit", "ot", 0], ["tile_f", "sp", [-1, 4, 1]]]}, "result": [[0.00010529456899999999, 9.698317500000001e-05], 0, 46.05621600151062, 1634621787.1966653], "version": 0.2, "tvm_version": "0.8.dev0"}
{"input": ["cuda -keys=cuda,gpu -max_num_threads=1024 -thread_warp_size=32", "fused_conv2d_fixed_nparts", [64, 1, 14, 14, 16, 16, 3, 3, [1, 1], [1, 1]], {}], "config": {"index": 322025, "code_hash": null, "entity": [["tile_y", "sp", [-1, 1, 1, 2]], ["tile_x", "sp", [-1, 1, 2, 7]], ["tile_rc", "sp", [-1, 4]], ["tile_ry", "sp", [-1, 3]], ["tile_rx", "sp", [-1, 3]], ["auto_unroll_max_step", "ot", 1500], ["unroll_explicit", "ot", 0], ["tile_f", "sp", [-1, 2, 4]]]}, "result": [[8.7341712e-05, 8.416022599999999e-05], 0, 38.085010290145874, 1634621779.1099036], "version": 0.2, "tvm_version": "0.8.dev0"}
{"input": ["cuda -keys=cuda,gpu -max_num_threads=1024 -thread_warp_size=32", "fused_conv2d_fixed_nparts", [64, 1, 14, 14, 16, 16, 3, 3, [1, 1], [1, 1]], {}], "config": {"index": 407899, "code_hash": null, "entity": [["tile_y", "sp", [-1, 1, 7, 2]], ["tile_x", "sp", [-1, 7, 2, 1]], ["tile_rc", "sp", [-1, 8]], ["tile_ry", "sp", [-1, 1]], ["tile_rx", "sp", [-1, 3]], ["auto_unroll_max_step", "ot", 512], ["unroll_explicit", "ot", 0], ["tile_f", "sp", [-1, 2, 8]]]}, "result": [[0.00010018860100000001, 9.670786599999999e-05], 0, 49.92633605003357, 1634621791.3060164], "version": 0.2, "tvm_version": "0.8.dev0"}
{"input": ["cuda -keys=cuda,gpu -max_num_threads=1024 -thread_warp_size=32", "fused_conv2d_fixed_nparts", [64, 1, 14, 14, 16, 16, 3, 3, [1, 1], [1, 1]], {}], "config": {"index": 238321, "code_hash": null, "entity": [["tile_y", "sp", [-1, 2, 1, 1]], ["tile_x", "sp", [-1, 1, 1, 14]], ["tile_rc", "sp", [-1, 1]], ["tile_ry", "sp", [-1, 1]], ["tile_rx", "sp", [-1, 3]], ["auto_unroll_max_step", "ot", 512], ["unroll_explicit", "ot", 1], ["tile_f", "sp", [-1, 4, 2]]]}, "result": [[9.201879099999998e-05, 8.7163592e-05], 0, 47.9202401638031, 1634621789.2591286], "version": 0.2, "tvm_version": "0.8.dev0"}
{"input": ["cuda -keys=cuda,gpu -max_num_threads=1024 -thread_warp_size=32", "fused_conv2d_fixed_nparts", [64, 1, 14, 14, 16, 16, 3, 3, [1, 1], [1, 1]], {}], "config": {"index": 136324, "code_hash": null, "entity": [["tile_y", "sp", [-1, 1, 2, 1]], ["tile_x", "sp", [-1, 1, 14, 1]], ["tile_rc", "sp", [-1, 4]], ["tile_ry", "sp", [-1, 1]], ["tile_rx", "sp", [-1, 3]], ["auto_unroll_max_step", "ot", 1500], ["unroll_explicit", "ot", 0], ["tile_f", "sp", [-1, 16, 1]]]}, "result": [[3.0571999e-05, 3.0553445e-05], 0, 59.22373557090759, 1634621801.1794474], "version": 0.2, "tvm_version": "0.8.dev0"}
{"input": ["cuda -keys=cuda,gpu -max_num_threads=1024 -thread_warp_size=32", "fused_conv2d_fixed_nparts", [64, 1, 14, 14, 16, 16, 3, 3, [1, 1], [1, 1]], {}], "config": {"index": 271157, "code_hash": null, "entity": [["tile_y", "sp", [-1, 7, 2, 1]], ["tile_x", "sp", [-1, 14, 1, 1]], ["tile_rc", "sp", [-1, 16]], ["tile_ry", "sp", [-1, 3]], ["tile_rx", "sp", [-1, 3]], ["auto_unroll_max_step", "ot", 512], ["unroll_explicit", "ot", 1], ["tile_f", "sp", [-1, 8, 2]]]}, "result": [[0.00010678348900000001, 0.00010410792399999999], 0, 52.3565468788147, 1634621793.484527], "version": 0.2, "tvm_version": "0.8.dev0"}
{"input": ["cuda -keys=cuda,gpu -max_num_threads=1024 -thread_warp_size=32", "fused_conv2d_fixed_nparts", [64, 1, 14, 14, 16, 16, 3, 3, [1, 1], [1, 1]], {}], "config": {"index": 339096, "code_hash": null, "entity": [["tile_y", "sp", [-1, 1, 14, 1]], ["tile_x", "sp", [-1, 1, 1, 2]], ["tile_rc", "sp", [-1, 16]], ["tile_ry", "sp", [-1, 1]], ["tile_rx", "sp", [-1, 1]], ["auto_unroll_max_step", "ot", 0], ["unroll_explicit", "ot", 0], ["tile_f", "sp", [-1, 4, 4]]]}, "result": [[5.3710631e-05, 5.3724361000000004e-05], 0, 53.417224168777466, 1634621795.296513], "version": 0.2, "tvm_version": "0.8.dev0"}
{"input": ["cuda -keys=cuda,gpu -max_num_threads=1024 -thread_warp_size=32", "fused_conv2d_fixed_nparts", [64, 1, 14, 14, 16, 16, 3, 3, [1, 1], [1, 1]], {}], "config": {"index": 96232, "code_hash": null, "entity": [["tile_y", "sp", [-1, 1, 14, 1]], ["tile_x", "sp", [-1, 1, 2, 7]], ["tile_rc", "sp", [-1, 1]], ["tile_ry", "sp", [-1, 3]], ["tile_rx", "sp", [-1, 3]], ["auto_unroll_max_step", "ot", 0], ["unroll_explicit", "ot", 0], ["tile_f", "sp", [-1, 8, 1]]]}, "result": [[4.2254243000000004e-05, 4.2237615e-05], 0, 60.77945041656494, 1634621802.9529703], "version": 0.2, "tvm_version": "0.8.dev0"}
{"input": ["cuda -keys=cuda,gpu -max_num_threads=1024 -thread_warp_size=32", "fused_conv2d_fixed_nparts", [64, 1, 14, 14, 16, 16, 3, 3, [1, 1], [1, 1]], {}], "config": {"index": 338889, "code_hash": null, "entity": [["tile_y", "sp", [-1, 1, 1, 2]], ["tile_x", "sp", [-1, 1, 1, 7]], ["tile_rc", "sp", [-1, 8]], ["tile_ry", "sp", [-1, 1]], ["tile_rx", "sp", [-1, 1]], ["auto_unroll_max_step", "ot", 0], ["unroll_explicit", "ot", 0], ["tile_f", "sp", [-1, 4, 4]]]}, "result": [[9.3903765e-05, 8.7126883e-05], 0, 62.84238076210022, 1634621805.03033], "version": 0.2, "tvm_version": "0.8.dev0"}
{"input": ["cuda -keys=cuda,gpu -max_num_threads=1024 -thread_warp_size=32", "fused_conv2d_fixed_nparts", [64, 1, 14, 14, 16, 16, 3, 3, [1, 1], [1, 1]], {}], "config": {"index": 265381, "code_hash": null, "entity": [["tile_y", "sp", [-1, 7, 2, 1]], ["tile_x", "sp", [-1, 7, 1, 2]], ["tile_rc", "sp", [-1, 2]], ["tile_ry", "sp", [-1, 3]], ["tile_rx", "sp", [-1, 3]], ["auto_unroll_max_step", "ot", 0], ["unroll_explicit", "ot", 1], ["tile_f", "sp", [-1, 8, 2]]]}, "result": [[0.000134707516, 0.00012288559699999999], 0, 69.63199853897095, 1634621811.9226582], "version": 0.2, "tvm_version": "0.8.dev0"}
{"input": ["cuda -keys=cuda,gpu -max_num_threads=1024 -thread_warp_size=32", "fused_conv2d_fixed_nparts", [64, 1, 14, 14, 16, 16, 3, 3, [1, 1], [1, 1]], {}], "config": {"index": 361002, "code_hash": null, "entity": [["tile_y", "sp", [-1, 7, 1, 2]], ["tile_x", "sp", [-1, 7, 1, 1]], ["tile_rc", "sp", [-1, 1]], ["tile_ry", "sp", [-1, 1]], ["tile_rx", "sp", [-1, 3]], ["auto_unroll_max_step", "ot", 512], ["unroll_explicit", "ot", 1], ["tile_f", "sp", [-1, 4, 4]]]}, "result": [[0.00031481094399999997, 0.000290985775], 0, 68.02010941505432, 1634621809.6527333], "version": 0.2, "tvm_version": "0.8.dev0"}
{"input": ["cuda -keys=cuda,gpu -max_num_threads=1024 -thread_warp_size=32", "fused_conv2d_fixed_nparts", [64, 1, 14, 14, 16, 16, 3, 3, [1, 1], [1, 1]], {}], "config": {"index": 223087, "code_hash": null, "entity": [["tile_y", "sp", [-1, 1, 1, 14]], ["tile_x", "sp", [-1, 1, 7, 1]], ["tile_rc", "sp", [-1, 2]], ["tile_ry", "sp", [-1, 1]], ["tile_rx", "sp", [-1, 3]], ["auto_unroll_max_step", "ot", 512], ["unroll_explicit", "ot", 0], ["tile_f", "sp", [-1, 4, 2]]]}, "result": [[4.4013579e-05, 4.401875900000001e-05], 0, 64.46118259429932, 1634621806.9102993], "version": 0.2, "tvm_version": "0.8.dev0"}
{"input": ["cuda -keys=cuda,gpu -max_num_threads=1024 -thread_warp_size=32", "fused_conv2d_fixed_nparts", [64, 1, 14, 14, 16, 16, 3, 3, [1, 1], [1, 1]], {}], "config": {"index": 396178, "code_hash": null, "entity": [["tile_y", "sp", [-1, 7, 1, 1]], ["tile_x", "sp", [-1, 1, 1, 2]], ["tile_rc", "sp", [-1, 4]], ["tile_ry", "sp", [-1, 3]], ["tile_rx", "sp", [-1, 1]], ["auto_unroll_max_step", "ot", 1500], ["unroll_explicit", "ot", 1], ["tile_f", "sp", [-1, 1, 8]]]}, "result": [[0.000460833567, 0.00044801197599999995], 0, 85.07954621315002, 1634621826.738976], "version": 0.2, "tvm_version": "0.8.dev0"}
{"input": ["cuda -keys=cuda,gpu -max_num_threads=1024 -thread_warp_size=32", "fused_conv2d_fixed_nparts", [64, 1, 14, 14, 16, 16, 3, 3, [1, 1], [1, 1]], {}], "config": {"index": 343939, "code_hash": null, "entity": [["tile_y", "sp", [-1, 14, 1, 1]], ["tile_x", "sp", [-1, 1, 14, 1]], ["tile_rc", "sp", [-1, 8]], ["tile_ry", "sp", [-1, 1]], ["tile_rx", "sp", [-1, 1]], ["auto_unroll_max_step", "ot", 512], ["unroll_explicit", "ot", 0], ["tile_f", "sp", [-1, 4, 4]]]}, "result": [[4.5097397999999994e-05, 4.509653e-05], 0, 77.27556467056274, 1634621819.8505917], "version": 0.2, "tvm_version": "0.8.dev0"}
{"input": ["cuda -keys=cuda,gpu -max_num_threads=1024 -thread_warp_size=32", "fused_conv2d_fixed_nparts", [64, 1, 14, 14, 16, 16, 3, 3, [1, 1], [1, 1]], {}], "config": {"index": 363744, "code_hash": null, "entity": [["tile_y", "sp", [-1, 1, 1, 1]], ["tile_x", "sp", [-1, 1, 2, 7]], ["tile_rc", "sp", [-1, 1]], ["tile_ry", "sp", [-1, 1]], ["tile_rx", "sp", [-1, 1]], ["auto_unroll_max_step", "ot", 1500], ["unroll_explicit", "ot", 1], ["tile_f", "sp", [-1, 4, 4]]]}, "result": [[7.471717e-05, 7.4705909e-05], 0, 75.33860874176025, 1634621817.888938], "version": 0.2, "tvm_version": "0.8.dev0"}
{"input": ["cuda -keys=cuda,gpu -max_num_threads=1024 -thread_warp_size=32", "fused_conv2d_fixed_nparts", [64, 1, 14, 14, 16, 16, 3, 3, [1, 1], [1, 1]], {}], "config": {"index": 397910, "code_hash": null, "entity": [["tile_y", "sp", [-1, 1, 7, 1]], ["tile_x", "sp", [-1, 7, 2, 1]], ["tile_rc", "sp", [-1, 16]], ["tile_ry", "sp", [-1, 1]], ["tile_rx", "sp", [-1, 3]], ["auto_unroll_max_step", "ot", 1500], ["unroll_explicit", "ot", 1], ["tile_f", "sp", [-1, 1, 8]]]}, "result": [[5.6761323e-05, 5.6762531e-05], 0, 86.55921292304993, 1634621828.620961], "version": 0.2, "tvm_version": "0.8.dev0"}
{"input": ["cuda -keys=cuda,gpu -max_num_threads=1024 -thread_warp_size=32", "fused_conv2d_fixed_nparts", [64, 1, 14, 14, 16, 16, 3, 3, [1, 1], [1, 1]], {}], "config": {"index": 452376, "code_hash": null, "entity": [["tile_y", "sp", [-1, 1, 14, 1]], ["tile_x", "sp", [-1, 2, 1, 1]], ["tile_rc", "sp", [-1, 4]], ["tile_ry", "sp", [-1, 3]], ["tile_rx", "sp", [-1, 1]], ["auto_unroll_max_step", "ot", 512], ["unroll_explicit", "ot", 1], ["tile_f", "sp", [-1, 1, 16]]]}, "result": [[5.8356876999999994e-05, 5.8383046e-05], 0, 92.257803440094, 1634621834.7052796], "version": 0.2, "tvm_version": "0.8.dev0"}
{"input": ["cuda -keys=cuda,gpu -max_num_threads=1024 -thread_warp_size=32", "fused_conv2d_fixed_nparts", [64, 1, 14, 14, 16, 16, 3, 3, [1, 1], [1, 1]], {}], "config": {"index": 367633, "code_hash": null, "entity": [["tile_y", "sp", [-1, 2, 1, 1]], ["tile_x", "sp", [-1, 2, 1, 1]], ["tile_rc", "sp", [-1, 2]], ["tile_ry", "sp", [-1, 3]], ["tile_rx", "sp", [-1, 3]], ["auto_unroll_max_step", "ot", 1500], ["unroll_explicit", "ot", 1], ["tile_f", "sp", [-1, 4, 4]]]}, "result": [[0.000118299638, 0.000108312217], 0, 95.9789559841156, 1634621838.4483335], "version": 0.2, "tvm_version": "0.8.dev0"}
{"input": ["cuda -keys=cuda,gpu -max_num_threads=1024 -thread_warp_size=32", "fused_conv2d_fixed_nparts", [64, 1, 14, 14, 16, 16, 3, 3, [1, 1], [1, 1]], {}], "config": {"index": 129427, "code_hash": null, "entity": [["tile_y", "sp", [-1, 14, 1, 1]], ["tile_x", "sp", [-1, 1, 1, 2]], ["tile_rc", "sp", [-1, 1]], ["tile_ry", "sp", [-1, 3]], ["tile_rx", "sp", [-1, 1]], ["auto_unroll_max_step", "ot", 512], ["unroll_explicit", "ot", 0], ["tile_f", "sp", [-1, 16, 1]]]}, "result": [[3.0595338000000006e-05, 3.0578599e-05], 0, 93.65599250793457, 1634621836.4716887], "version": 0.2, "tvm_version": "0.8.dev0"}
{"input": ["cuda -keys=cuda,gpu -max_num_threads=1024 -thread_warp_size=32", "fused_conv2d_fixed_nparts", [64, 1, 14, 14, 16, 16, 3, 3, [1, 1], [1, 1]], {}], "config": {"index": 117159, "code_hash": null, "entity": [["tile_y", "sp", [-1, 2, 7, 1]], ["tile_x", "sp", [-1, 7, 1, 2]], ["tile_rc", "sp", [-1, 4]], ["tile_ry", "sp", [-1, 3]], ["tile_rx", "sp", [-1, 3]], ["auto_unroll_max_step", "ot", 512], ["unroll_explicit", "ot", 1], ["tile_f", "sp", [-1, 8, 1]]]}, "result": [[5.3875168e-05, 5.3877651e-05], 0, 97.95676589012146, 1634621840.38848], "version": 0.2, "tvm_version": "0.8.dev0"}
{"input": ["cuda -keys=cuda,gpu -max_num_threads=1024 -thread_warp_size=32", "fused_conv2d_fixed_nparts", [64, 1, 14, 14, 16, 16, 3, 3, [1, 1], [1, 1]], {}], "config": {"index": 372087, "code_hash": null, "entity": [["tile_y", "sp", [-1, 2, 7, 1]], ["tile_x", "sp", [-1, 2, 7, 1]], ["tile_rc", "sp", [-1, 8]], ["tile_ry", "sp", [-1, 1]], ["tile_rx", "sp", [-1, 3]], ["auto_unroll_max_step", "ot", 0], ["unroll_explicit", "ot", 0], ["tile_f", "sp", [-1, 1, 8]]]}, "result": [[8.9782794e-05, 8.535916e-05], 0, 4.429853200912476, 1634621850.6737316], "version": 0.2, "tvm_version": "0.8.dev0"}
{"input": ["cuda -keys=cuda,gpu -max_num_threads=1024 -thread_warp_size=32", "fused_conv2d_fixed_nparts", [64, 1, 14, 14, 16, 16, 3, 3, [1, 1], [1, 1]], {}], "config": {"index": 324662, "code_hash": null, "entity": [["tile_y", "sp", [-1, 1, 7, 1]], ["tile_x", "sp", [-1, 14, 1, 1]], ["tile_rc", "sp", [-1, 8]], ["tile_ry", "sp", [-1, 3]], ["tile_rx", "sp", [-1, 1]], ["auto_unroll_max_step", "ot", 0], ["unroll_explicit", "ot", 1], ["tile_f", "sp", [-1, 2, 4]]]}, "result": [[0.000152941353, 0.00014501340700000002], 0, 6.589463949203491, 1634621852.7926054], "version": 0.2, "tvm_version": "0.8.dev0"}
{"input": ["cuda -keys=cuda,gpu -max_num_threads=1024 -thread_warp_size=32", "fused_conv2d_fixed_nparts", [64, 1, 14, 14, 16, 16, 3, 3, [1, 1], [1, 1]], {}], "config": {"index": 149490, "code_hash": null, "entity": [["tile_y", "sp", [-1, 7, 1, 1]], ["tile_x", "sp", [-1, 1, 1, 14]], ["tile_rc", "sp", [-1, 8]], ["tile_ry", "sp", [-1, 1]], ["tile_rx", "sp", [-1, 1]], ["auto_unroll_max_step", "ot", 1500], ["unroll_explicit", "ot", 1], ["tile_f", "sp", [-1, 16, 1]]]}, "result": [[0.00018410344699999997, 0.000170459389], 0, 3.692075252532959, 1634621848.665156], "version": 0.2, "tvm_version": "0.8.dev0"}
{"input": ["cuda -keys=cuda,gpu -max_num_threads=1024 -thread_warp_size=32", "fused_conv2d_fixed_nparts", [64, 1, 14, 14, 16, 16, 3, 3, [1, 1], [1, 1]], {}], "config": {"index": 377415, "code_hash": null, "entity": [["tile_y", "sp", [-1, 2, 7, 1]], ["tile_x", "sp", [-1, 1, 2, 1]], ["tile_rc", "sp", [-1, 16]], ["tile_ry", "sp", [-1, 1]], ["tile_rx", "sp", [-1, 3]], ["auto_unroll_max_step", "ot", 512], ["unroll_explicit", "ot", 0], ["tile_f", "sp", [-1, 1, 8]]]}, "result": [[0.000106028327, 9.8714509e-05], 0, 9.879323959350586, 1634621855.7694123], "version": 0.2, "tvm_version": "0.8.dev0"}
{"input": ["cuda -keys=cuda,gpu -max_num_threads=1024 -thread_warp_size=32", "fused_conv2d_fixed_nparts", [64, 1, 14, 14, 16, 16, 3, 3, [1, 1], [1, 1]], {}], "config": {"index": 63981, "code_hash": null, "entity": [["tile_y", "sp", [-1, 2, 1, 7]], ["tile_x", "sp", [-1, 1, 2, 7]], ["tile_rc", "sp", [-1, 16]], ["tile_ry", "sp", [-1, 3]], ["tile_rx", "sp", [-1, 1]], ["auto_unroll_max_step", "ot", 0], ["unroll_explicit", "ot", 0], ["tile_f", "sp", [-1, 4, 1]]]}, "result": [[0.000967043851, 0.000941489976], 0, 21.68212366104126, 1634621867.6897664], "version": 0.2, "tvm_version": "0.8.dev0"}
{"input": ["cuda -keys=cuda,gpu -max_num_threads=1024 -thread_warp_size=32", "fused_conv2d_fixed_nparts", [64, 1, 14, 14, 16, 16, 3, 3, [1, 1], [1, 1]], {}], "config": {"index": 432646, "code_hash": null, "entity": [["tile_y", "sp", [-1, 1, 7, 1]], ["tile_x", "sp", [-1, 1, 1, 1]], ["tile_rc", "sp", [-1, 1]], ["tile_ry", "sp", [-1, 1]], ["tile_rx", "sp", [-1, 3]], ["auto_unroll_max_step", "ot", 0], ["unroll_explicit", "ot", 0], ["tile_f", "sp", [-1, 1, 16]]]}, "result": [[7.038971399999999e-05, 6.530775800000001e-05], 0, 23.285255432128906, 1634621869.5346603], "version": 0.2, "tvm_version": "0.8.dev0"}
{"input": ["cuda -keys=cuda,gpu -max_num_threads=1024 -thread_warp_size=32", "fused_conv2d_fixed_nparts", [64, 1, 14, 14, 16, 16, 3, 3, [1, 1], [1, 1]], {}], "config": {"index": 76908, "code_hash": null, "entity": [["tile_y", "sp", [-1, 1, 1, 7]], ["tile_x", "sp", [-1, 1, 7, 1]], ["tile_rc", "sp", [-1, 1]], ["tile_ry", "sp", [-1, 1]], ["tile_rx", "sp", [-1, 1]], ["auto_unroll_max_step", "ot", 0], ["unroll_explicit", "ot", 1], ["tile_f", "sp", [-1, 4, 1]]]}, "result": [[8.1853038e-05, 8.1681112e-05], 0, 25.11424469947815, 1634621871.3856642], "version": 0.2, "tvm_version": "0.8.dev0"}
{"input": ["cuda -keys=cuda,gpu -max_num_threads=1024 -thread_warp_size=32", "fused_conv2d_fixed_nparts", [64, 1, 14, 14, 16, 16, 3, 3, [1, 1], [1, 1]], {}], "config": {"index": 344518, "code_hash": null, "entity": [["tile_y", "sp", [-1, 1, 7, 1]], ["tile_x", "sp", [-1, 1, 1, 7]], ["tile_rc", "sp", [-1, 1]], ["tile_ry", "sp", [-1, 3]], ["tile_rx", "sp", [-1, 1]], ["auto_unroll_max_step", "ot", 512], ["unroll_explicit", "ot", 0], ["tile_f", "sp", [-1, 4, 4]]]}, "result": [[5.3423589e-05, 5.0802926999999995e-05], 0, 32.9445059299469, 1634621879.234907], "version": 0.2, "tvm_version": "0.8.dev0"}
{"input": ["cuda -keys=cuda,gpu -max_num_threads=1024 -thread_warp_size=32", "fused_conv2d_fixed_nparts", [64, 1, 14, 14, 16, 16, 3, 3, [1, 1], [1, 1]], {}], "config": {"index": 457334, "code_hash": null, "entity": [["tile_y", "sp", [-1, 1, 7, 1]], ["tile_x", "sp", [-1, 2, 7, 1]], ["tile_rc", "sp", [-1, 2]], ["tile_ry", "sp", [-1, 3]], ["tile_rx", "sp", [-1, 1]], ["auto_unroll_max_step", "ot", 1500], ["unroll_explicit", "ot", 1], ["tile_f", "sp", [-1, 1, 16]]]}, "result": [[4.3494815000000003e-05, 4.3500065e-05], 0, 31.382901430130005, 1634621877.352858], "version": 0.2, "tvm_version": "0.8.dev0"}
{"input": ["cuda -keys=cuda,gpu -max_num_threads=1024 -thread_warp_size=32", "fused_conv2d_fixed_nparts", [64, 1, 14, 14, 16, 16, 3, 3, [1, 1], [1, 1]], {}], "config": {"index": 29452, "code_hash": null, "entity": [["tile_y", "sp", [-1, 1, 1, 7]], ["tile_x", "sp", [-1, 1, 1, 1]], ["tile_rc", "sp", [-1, 1]], ["tile_ry", "sp", [-1, 3]], ["tile_rx", "sp", [-1, 3]], ["auto_unroll_max_step", "ot", 1500], ["unroll_explicit", "ot", 1], ["tile_f", "sp", [-1, 1, 1]]]}, "result": [[0.000230907241, 0.00021160403899999998], 0, 43.7345175743103, 1634621889.3533056], "version": 0.2, "tvm_version": "0.8.dev0"}
{"input": ["cuda -keys=cuda,gpu -max_num_threads=1024 -thread_warp_size=32", "fused_conv2d_fixed_nparts", [64, 1, 14, 14, 16, 16, 3, 3, [1, 1], [1, 1]], {}], "config": {"index": 272847, "code_hash": null, "entity": [["tile_y", "sp", [-1, 1, 1, 14]], ["tile_x", "sp", [-1, 1, 1, 7]], ["tile_rc", "sp", [-1, 1]], ["tile_ry", "sp", [-1, 3]], ["tile_rx", "sp", [-1, 1]], ["auto_unroll_max_step", "ot", 1500], ["unroll_explicit", "ot", 1], ["tile_f", "sp", [-1, 8, 2]]]}, "result": [[8.1789128e-05, 8.180768999999999e-05], 0, 39.41136813163757, 1634621885.3041005], "version": 0.2, "tvm_version": "0.8.dev0"}
{"input": ["cuda -keys=cuda,gpu -max_num_threads=1024 -thread_warp_size=32", "fused_conv2d_fixed_nparts", [64, 1, 14, 14, 16, 16, 3, 3, [1, 1], [1, 1]], {}], "config": {"index": 267383, "code_hash": null, "entity": [["tile_y", "sp", [-1, 2, 7, 1]], ["tile_x", "sp", [-1, 2, 7, 1]], ["tile_rc", "sp", [-1, 16]], ["tile_ry", "sp", [-1, 1]], ["tile_rx", "sp", [-1, 1]], ["auto_unroll_max_step", "ot", 512], ["unroll_explicit", "ot", 1], ["tile_f", "sp", [-1, 8, 2]]]}, "result": [[3.3671548e-05, 3.3681485000000005e-05], 0, 40.95544910430908, 1634621887.0978498], "version": 0.2, "tvm_version": "0.8.dev0"}
{"input": ["cuda -keys=cuda,gpu -max_num_threads=1024 -thread_warp_size=32", "fused_conv2d_fixed_nparts", [64, 1, 14, 14, 16, 16, 3, 3, [1, 1], [1, 1]], {}], "config": {"index": 145104, "code_hash": null, "entity": [["tile_y", "sp", [-1, 1, 1, 1]], ["tile_x", "sp", [-1, 2, 1, 7]], ["tile_rc", "sp", [-1, 2]], ["tile_ry", "sp", [-1, 3]], ["tile_rx", "sp", [-1, 1]], ["auto_unroll_max_step", "ot", 512], ["unroll_explicit", "ot", 1], ["tile_f", "sp", [-1, 16, 1]]]}, "result": [[4.265152e-05, 4.2669086e-05], 0, 48.87760090827942, 1634621895.1838648], "version": 0.2, "tvm_version": "0.8.dev0"}
{"input": ["cuda -keys=cuda,gpu -max_num_threads=1024 -thread_warp_size=32", "fused_conv2d_fixed_nparts", [64, 1, 14, 14, 16, 16, 3, 3, [1, 1], [1, 1]], {}], "config": {"index": 167089, "code_hash": null, "entity": [["tile_y", "sp", [-1, 2, 1, 1]], ["tile_x", "sp", [-1, 1, 7, 2]], ["tile_rc", "sp", [-1, 4]], ["tile_ry", "sp", [-1, 1]], ["tile_rx", "sp", [-1, 3]], ["auto_unroll_max_step", "ot", 1500], ["unroll_explicit", "ot", 0], ["tile_f", "sp", [-1, 1, 2]]]}, "result": [[9.4132977e-05, 8.7427391e-05], 0, 45.28475594520569, 1634621891.4555075], "version": 0.2, "tvm_version": "0.8.dev0"}
{"input": ["cuda -keys=cuda,gpu -max_num_threads=1024 -thread_warp_size=32", "fused_conv2d_fixed_nparts", [64, 1, 14, 14, 16, 16, 3, 3, [1, 1], [1, 1]], {}], "config": {"index": 323046, "code_hash": null, "entity": [["tile_y", "sp", [-1, 1, 7, 1]], ["tile_x", "sp", [-1, 1, 2, 7]], ["tile_rc", "sp", [-1, 2]], ["tile_ry", "sp", [-1, 1]], ["tile_rx", "sp", [-1, 1]], ["auto_unroll_max_step", "ot", 0], ["unroll_explicit", "ot", 1], ["tile_f", "sp", [-1, 2, 4]]]}, "result": [[4.8328381000000004e-05, 4.8335669999999997e-05], 0, 46.92571473121643, 1634621893.3718493], "version": 0.2, "tvm_version": "0.8.dev0"}
{"input": ["cuda -keys=cuda,gpu -max_num_threads=1024 -thread_warp_size=32", "fused_conv2d_fixed_nparts", [64, 1, 14, 14, 16, 16, 3, 3, [1, 1], [1, 1]], {}], "config": {"index": 436468, "code_hash": null, "entity": [["tile_y", "sp", [-1, 1, 2, 1]], ["tile_x", "sp", [-1, 1, 1, 14]], ["tile_rc", "sp", [-1, 16]], ["tile_ry", "sp", [-1, 1]], ["tile_rx", "sp", [-1, 1]], ["auto_unroll_max_step", "ot", 512], ["unroll_explicit", "ot", 0], ["tile_f", "sp", [-1, 1, 16]]]}, "result": [[0.00035422631199999997, 0.000333607505], 0, 62.13077259063721, 1634621907.9991388], "version": 0.2, "tvm_version": "0.8.dev0"}
{"input": ["cuda -keys=cuda,gpu -max_num_threads=1024 -thread_warp_size=32", "fused_conv2d_fixed_nparts", [64, 1, 14, 14, 16, 16, 3, 3, [1, 1], [1, 1]], {}], "config": {"index": 3398, "code_hash": null, "entity": [["tile_y", "sp", [-1, 1, 7, 1]], ["tile_x", "sp", [-1, 1, 2, 1]], ["tile_rc", "sp", [-1, 8]], ["tile_ry", "sp", [-1, 1]], ["tile_rx", "sp", [-1, 3]], ["auto_unroll_max_step", "ot", 0], ["unroll_explicit", "ot", 0], ["tile_f", "sp", [-1, 1, 1]]]}, "result": [[4.657707599999999e-05, 4.6576764e-05], 0, 50.55924129486084, 1634621897.0784838], "version": 0.2, "tvm_version": "0.8.dev0"}
{"input": ["cuda -keys=cuda,gpu -max_num_threads=1024 -thread_warp_size=32", "fused_conv2d_fixed_nparts", [64, 1, 14, 14, 16, 16, 3, 3, [1, 1], [1, 1]], {}], "config": {"index": 335008, "code_hash": null, "entity": [["tile_y", "sp", [-1, 1, 1, 1]], ["tile_x", "sp", [-1, 7, 1, 2]], ["tile_rc", "sp", [-1, 8]], ["tile_ry", "sp", [-1, 3]], ["tile_rx", "sp", [-1, 1]], ["auto_unroll_max_step", "ot", 1500], ["unroll_explicit", "ot", 1], ["tile_f", "sp", [-1, 2, 4]]]}, "result": [[0.000152410509, 0.000140326173], 0, 64.33354091644287, 1634621910.1184082], "version": 0.2, "tvm_version": "0.8.dev0"}
{"input": ["cuda -keys=cuda,gpu -max_num_threads=1024 -thread_warp_size=32", "fused_conv2d_fixed_nparts", [64, 1, 14, 14, 16, 16, 3, 3, [1, 1], [1, 1]], {}], "config": {"index": 237415, "code_hash": null, "entity": [["tile_y", "sp", [-1, 2, 7, 1]], ["tile_x", "sp", [-1, 1, 7, 1]], ["tile_rc", "sp", [-1, 4]], ["tile_ry", "sp", [-1, 3]], ["tile_rx", "sp", [-1, 1]], ["auto_unroll_max_step", "ot", 512], ["unroll_explicit", "ot", 1], ["tile_f", "sp", [-1, 4, 2]]]}, "result": [[2.2034969e-05, 2.2022532000000002e-05], 0, 65.4897575378418, 1634621911.9163525], "version": 0.2, "tvm_version": "0.8.dev0"}
{"input": ["cuda -keys=cuda,gpu -max_num_threads=1024 -thread_warp_size=32", "fused_conv2d_fixed_nparts", [64, 1, 14, 14, 16, 16, 3, 3, [1, 1], [1, 1]], {}], "config": {"index": 49223, "code_hash": null, "entity": [["tile_y", "sp", [-1, 2, 7, 1]], ["tile_x", "sp", [-1, 1, 2, 1]], ["tile_rc", "sp", [-1, 4]], ["tile_ry", "sp", [-1, 1]], ["tile_rx", "sp", [-1, 3]], ["auto_unroll_max_step", "ot", 0], ["unroll_explicit", "ot", 1], ["tile_f", "sp", [-1, 2, 1]]]}, "result": [[2.8922135e-05, 2.8921502000000003e-05], 0, 67.10989284515381, 1634621913.6805632], "version": 0.2, "tvm_version": "0.8.dev0"}
{"input": ["cuda -keys=cuda,gpu -max_num_threads=1024 -thread_warp_size=32", "fused_conv2d_fixed_nparts", [64, 1, 14, 14, 16, 16, 3, 3, [1, 1], [1, 1]], {}], "config": {"index": 401816, "code_hash": null, "entity": [["tile_y", "sp", [-1, 1, 14, 1]], ["tile_x", "sp", [-1, 1, 1, 2]], ["tile_rc", "sp", [-1, 16]], ["tile_ry", "sp", [-1, 3]], ["tile_rx", "sp", [-1, 1]], ["auto_unroll_max_step", "ot", 0], ["unroll_explicit", "ot", 0], ["tile_f", "sp", [-1, 2, 8]]]}, "result": [[6.580834299999999e-05, 6.3240701e-05], 0, 70.72585916519165, 1634621917.382506], "version": 0.2, "tvm_version": "0.8.dev0"}
{"input": ["cuda -keys=cuda,gpu -max_num_threads=1024 -thread_warp_size=32", "fused_conv2d_fixed_nparts", [64, 1, 14, 14, 16, 16, 3, 3, [1, 1], [1, 1]], {}], "config": {"index": 226676, "code_hash": null, "entity": [["tile_y", "sp", [-1, 1, 2, 1]], ["tile_x", "sp", [-1, 2, 7, 1]], ["tile_rc", "sp", [-1, 1]], ["tile_ry", "sp", [-1, 3]], ["tile_rx", "sp", [-1, 1]], ["auto_unroll_max_step", "ot", 1500], ["unroll_explicit", "ot", 0], ["tile_f", "sp", [-1, 4, 2]]]}, "result": [[1.7135654e-05, 1.7150065999999997e-05], 0, 69.00943493843079, 1634621915.52455], "version": 0.2, "tvm_version": "0.8.dev0"}
{"input": ["cuda -keys=cuda,gpu -max_num_threads=1024 -thread_warp_size=32", "fused_conv2d_fixed_nparts", [64, 1, 14, 14, 16, 16, 3, 3, [1, 1], [1, 1]], {}], "config": {"index": 199865, "code_hash": null, "entity": [["tile_y", "sp", [-1, 1, 1, 2]], ["tile_x", "sp", [-1, 1, 7, 2]], ["tile_rc", "sp", [-1, 1]], ["tile_ry", "sp", [-1, 1]], ["tile_rx", "sp", [-1, 1]], ["auto_unroll_max_step", "ot", 0], ["unroll_explicit", "ot", 1], ["tile_f", "sp", [-1, 2, 2]]]}, "result": [[3.5272775000000004e-05, 3.5262861e-05], 0, 72.53607130050659, 1634621919.2071118], "version": 0.2, "tvm_version": "0.8.dev0"}
{"input": ["cuda -keys=cuda,gpu -max_num_threads=1024 -thread_warp_size=32", "fused_conv2d_fixed_nparts", [64, 1, 14, 14, 16, 16, 3, 3, [1, 1], [1, 1]], {}], "config": {"index": 78867, "code_hash": null, "entity": [["tile_y", "sp", [-1, 14, 1, 1]], ["tile_x", "sp", [-1, 2, 1, 1]], ["tile_rc", "sp", [-1, 8]], ["tile_ry", "sp", [-1, 3]], ["tile_rx", "sp", [-1, 1]], ["auto_unroll_max_step", "ot", 0], ["unroll_explicit", "ot", 1], ["tile_f", "sp", [-1, 4, 1]]]}, "result": [[9.3265208e-05, 9.344525199999999e-05], 0, 79.01097869873047, 1634621925.5683565], "version": 0.2, "tvm_version": "0.8.dev0"}
{"input": ["cuda -keys=cuda,gpu -max_num_threads=1024 -thread_warp_size=32", "fused_conv2d_fixed_nparts", [64, 1, 14, 14, 16, 16, 3, 3, [1, 1], [1, 1]], {}], "config": {"index": 342648, "code_hash": null, "entity": [["tile_y", "sp", [-1, 1, 14, 1]], ["tile_x", "sp", [-1, 2, 7, 1]], ["tile_rc", "sp", [-1, 8]], ["tile_ry", "sp", [-1, 3]], ["tile_rx", "sp", [-1, 3]], ["auto_unroll_max_step", "ot", 0], ["unroll_explicit", "ot", 0], ["tile_f", "sp", [-1, 4, 4]]]}, "result": [[2.5475085000000002e-05, 2.5460411e-05], 0, 97.34260678291321, 1634621944.0907648], "version": 0.2, "tvm_version": "0.8.dev0"}
{"input": ["cuda -keys=cuda,gpu -max_num_threads=1024 -thread_warp_size=32", "fused_conv2d_fixed_nparts", [64, 1, 14, 14, 16, 16, 3, 3, [1, 1], [1, 1]], {}], "config": {"index": 40268, "code_hash": null, "entity": [["tile_y", "sp", [-1, 1, 1, 7]], ["tile_x", "sp", [-1, 1, 2, 1]], ["tile_rc", "sp", [-1, 4]], ["tile_ry", "sp", [-1, 3]], ["tile_rx", "sp", [-1, 3]], ["auto_unroll_max_step", "ot", 512], ["unroll_explicit", "ot", 0], ["tile_f", "sp", [-1, 2, 1]]]}, "result": [[6.752196600000001e-05, 6.523756e-05], 0, 91.72172951698303, 1634621938.258275], "version": 0.2, "tvm_version": "0.8.dev0"}
{"input": ["cuda -keys=cuda,gpu -max_num_threads=1024 -thread_warp_size=32", "fused_conv2d_fixed_nparts", [64, 1, 14, 14, 16, 16, 3, 3, [1, 1], [1, 1]], {}], "config": {"index": 77148, "code_hash": null, "entity": [["tile_y", "sp", [-1, 1, 1, 7]], ["tile_x", "sp", [-1, 7, 2, 1]], ["tile_rc", "sp", [-1, 2]], ["tile_ry", "sp", [-1, 1]], ["tile_rx", "sp", [-1, 1]], ["auto_unroll_max_step", "ot", 0], ["unroll_explicit", "ot", 1], ["tile_f", "sp", [-1, 4, 1]]]}, "result": [[0.000400435547, 0.000384922603], 0, 89.7222375869751, 1634621936.3447404], "version": 0.2, "tvm_version": "0.8.dev0"}
{"input": ["cuda -keys=cuda,gpu -max_num_threads=1024 -thread_warp_size=32", "fused_conv2d_fixed_nparts", [64, 1, 14, 14, 16, 16, 3, 3, [1, 1], [1, 1]], {}], "config": {"index": 193615, "code_hash": null, "entity": [["tile_y", "sp", [-1, 1, 1, 14]], ["tile_x", "sp", [-1, 1, 2, 1]], ["tile_rc", "sp", [-1, 2]], ["tile_ry", "sp", [-1, 3]], ["tile_rx", "sp", [-1, 3]], ["auto_unroll_max_step", "ot", 512], ["unroll_explicit", "ot", 0], ["tile_f", "sp", [-1, 2, 2]]]}, "result": [[0.000108227564, 0.00010134793200000001], 0, 103.65618348121643, 1634621950.3011672], "version": 0.2, "tvm_version": "0.8.dev0"}
{"input": ["cuda -keys=cuda,gpu -max_num_threads=1024 -thread_warp_size=32", "fused_conv2d_fixed_nparts", [64, 1, 14, 14, 16, 16, 3, 3, [1, 1], [1, 1]], {}], "config": {"index": 255592, "code_hash": null, "entity": [["tile_y", "sp", [-1, 1, 14, 1]], ["tile_x", "sp", [-1, 1, 7, 1]], ["tile_rc", "sp", [-1, 8]], ["tile_ry", "sp", [-1, 3]], ["tile_rx", "sp", [-1, 3]], ["auto_unroll_max_step", "ot", 512], ["unroll_explicit", "ot", 0], ["tile_f", "sp", [-1, 8, 2]]]}, "result": [[2.5423732e-05, 2.5423147e-05], 0, 2.0013999938964844, 1634622014.203248], "version": 0.2, "tvm_version": "0.8.dev0"}
{"input": ["cuda -keys=cuda,gpu -max_num_threads=1024 -thread_warp_size=32", "fused_conv2d_fixed_nparts", [64, 1, 14, 14, 16, 16, 3, 3, [1, 1], [1, 1]], {}], "config": {"index": 270952, "code_hash": null, "entity": [["tile_y", "sp", [-1, 1, 14, 1]], ["tile_x", "sp", [-1, 1, 7, 1]], ["tile_rc", "sp", [-1, 8]], ["tile_ry", "sp", [-1, 3]], ["tile_rx", "sp", [-1, 3]], ["auto_unroll_max_step", "ot", 512], ["unroll_explicit", "ot", 1], ["tile_f", "sp", [-1, 8, 2]]]}, "result": [[2.5250542e-05, 2.5249421e-05], 0, 5.520442247390747, 1634622017.671102], "version": 0.2, "tvm_version": "0.8.dev0"}
{"input": ["cuda -keys=cuda,gpu -max_num_threads=1024 -thread_warp_size=32", "fused_conv2d_fixed_nparts", [64, 1, 14, 14, 16, 16, 3, 3, [1, 1], [1, 1]], {}], "config": {"index": 221796, "code_hash": null, "entity": [["tile_y", "sp", [-1, 1, 2, 1]], ["tile_x", "sp", [-1, 1, 7, 1]], ["tile_rc", "sp", [-1, 2]], ["tile_ry", "sp", [-1, 3]], ["tile_rx", "sp", [-1, 1]], ["auto_unroll_max_step", "ot", 512], ["unroll_explicit", "ot", 0], ["tile_f", "sp", [-1, 4, 2]]]}, "result": [[2.5745968e-05, 2.5735145e-05], 0, 8.91763710975647, 1634622021.292864], "version": 0.2, "tvm_version": "0.8.dev0"}
{"input": ["cuda -keys=cuda,gpu -max_num_threads=1024 -thread_warp_size=32", "fused_conv2d_fixed_nparts", [64, 1, 14, 14, 16, 16, 3, 3, [1, 1], [1, 1]], {}], "config": {"index": 237156, "code_hash": null, "entity": [["tile_y", "sp", [-1, 1, 2, 1]], ["tile_x", "sp", [-1, 1, 7, 1]], ["tile_rc", "sp", [-1, 2]], ["tile_ry", "sp", [-1, 3]], ["tile_rx", "sp", [-1, 1]], ["auto_unroll_max_step", "ot", 512], ["unroll_explicit", "ot", 1], ["tile_f", "sp", [-1, 4, 2]]]}, "result": [[2.5899048000000002e-05, 2.5900261e-05], 0, 3.610499858856201, 1634622015.8678901], "version": 0.2, "tvm_version": "0.8.dev0"}
{"input": ["cuda -keys=cuda,gpu -max_num_threads=1024 -thread_warp_size=32", "fused_conv2d_fixed_nparts", [64, 1, 14, 14, 16, 16, 3, 3, [1, 1], [1, 1]], {}], "config": {"index": 267876, "code_hash": null, "entity": [["tile_y", "sp", [-1, 1, 2, 1]], ["tile_x", "sp", [-1, 1, 7, 1]], ["tile_rc", "sp", [-1, 2]], ["tile_ry", "sp", [-1, 3]], ["tile_rx", "sp", [-1, 1]], ["auto_unroll_max_step", "ot", 512], ["unroll_explicit", "ot", 1], ["tile_f", "sp", [-1, 8, 2]]]}, "result": [[3.3544069000000005e-05, 3.352624699999999e-05], 0, 10.952446222305298, 1634622023.0824268], "version": 0.2, "tvm_version": "0.8.dev0"}
{"input": ["cuda -keys=cuda,gpu -max_num_threads=1024 -thread_warp_size=32", "fused_conv2d_fixed_nparts", [64, 1, 14, 14, 16, 16, 3, 3, [1, 1], [1, 1]], {}], "config": {"index": 252516, "code_hash": null, "entity": [["tile_y", "sp", [-1, 1, 2, 1]], ["tile_x", "sp", [-1, 1, 7, 1]], ["tile_rc", "sp", [-1, 2]], ["tile_ry", "sp", [-1, 3]], ["tile_rx", "sp", [-1, 1]], ["auto_unroll_max_step", "ot", 512], ["unroll_explicit", "ot", 0], ["tile_f", "sp", [-1, 8, 2]]]}, "result": [[2.7895677000000002e-05, 2.7885152e-05], 0, 7.144073009490967, 1634622019.4636118], "version": 0.2, "tvm_version": "0.8.dev0"}
{"input": ["cuda -keys=cuda,gpu -max_num_threads=1024 -thread_warp_size=32", "fused_conv2d_fixed_nparts", [64, 1, 14, 14, 16, 16, 3, 3, [1, 1], [1, 1]], {}], "config": {"index": 252772, "code_hash": null, "entity": [["tile_y", "sp", [-1, 1, 2, 1]], ["tile_x", "sp", [-1, 1, 7, 1]], ["tile_rc", "sp", [-1, 4]], ["tile_ry", "sp", [-1, 3]], ["tile_rx", "sp", [-1, 1]], ["auto_unroll_max_step", "ot", 512], ["unroll_explicit", "ot", 0], ["tile_f", "sp", [-1, 8, 2]]]}, "result": [[2.6938697999999998e-05, 2.6920087999999997e-05], 0, 17.863224267959595, 1634622030.2307894], "version": 0.2, "tvm_version": "0.8.dev0"}
{"input": ["cuda -keys=cuda,gpu -max_num_threads=1024 -thread_warp_size=32", "fused_conv2d_fixed_nparts", [64, 1, 14, 14, 16, 16, 3, 3, [1, 1], [1, 1]], {}], "config": {"index": 268132, "code_hash": null, "entity": [["tile_y", "sp", [-1, 1, 2, 1]], ["tile_x", "sp", [-1, 1, 7, 1]], ["tile_rc", "sp", [-1, 4]], ["tile_ry", "sp", [-1, 3]], ["tile_rx", "sp", [-1, 1]], ["auto_unroll_max_step", "ot", 512], ["unroll_explicit", "ot", 1], ["tile_f", "sp", [-1, 8, 2]]]}, "result": [[2.7933441e-05, 2.7908989e-05], 0, 12.734249353408813, 1634622024.9199939], "version": 0.2, "tvm_version": "0.8.dev0"}
{"input": ["cuda -keys=cuda,gpu -max_num_threads=1024 -thread_warp_size=32", "fused_conv2d_fixed_nparts", [64, 1, 14, 14, 16, 16, 3, 3, [1, 1], [1, 1]], {}], "config": {"index": 222022, "code_hash": null, "entity": [["tile_y", "sp", [-1, 1, 7, 1]], ["tile_x", "sp", [-1, 1, 2, 1]], ["tile_rc", "sp", [-1, 4]], ["tile_ry", "sp", [-1, 3]], ["tile_rx", "sp", [-1, 1]], ["auto_unroll_max_step", "ot", 512], ["unroll_explicit", "ot", 0], ["tile_f", "sp", [-1, 4, 2]]]}, "result": [[2.9748189e-05, 2.9747340000000002e-05], 0, 14.31974983215332, 1634622026.716713], "version": 0.2, "tvm_version": "0.8.dev0"}
{"input": ["cuda -keys=cuda,gpu -max_num_threads=1024 -thread_warp_size=32", "fused_conv2d_fixed_nparts", [64, 1, 14, 14, 16, 16, 3, 3, [1, 1], [1, 1]], {}], "config": {"index": 237382, "code_hash": null, "entity": [["tile_y", "sp", [-1, 1, 7, 1]], ["tile_x", "sp", [-1, 1, 2, 1]], ["tile_rc", "sp", [-1, 4]], ["tile_ry", "sp", [-1, 3]], ["tile_rx", "sp", [-1, 1]], ["auto_unroll_max_step", "ot", 512], ["unroll_explicit", "ot", 1], ["tile_f", "sp", [-1, 4, 2]]]}, "result": [[2.9295838000000002e-05, 2.9295698000000003e-05], 0, 16.17274308204651, 1634622028.516293], "version": 0.2, "tvm_version": "0.8.dev0"}
{"input": ["cuda -keys=cuda,gpu -max_num_threads=1024 -thread_warp_size=32", "fused_conv2d_fixed_nparts", [64, 1, 14, 14, 16, 16, 3, 3, [1, 1], [1, 1]], {}], "config": {"index": 251748, "code_hash": null, "entity": [["tile_y", "sp", [-1, 1, 2, 1]], ["tile_x", "sp", [-1, 1, 7, 1]], ["tile_rc", "sp", [-1, 8]], ["tile_ry", "sp", [-1, 1]], ["tile_rx", "sp", [-1, 1]], ["auto_unroll_max_step", "ot", 512], ["unroll_explicit", "ot", 0], ["tile_f", "sp", [-1, 8, 2]]]}, "result": [[3.1888576e-05, 3.1880326e-05], 0, 23.115365982055664, 1634622035.5400932], "version": 0.2, "tvm_version": "0.8.dev0"}
{"input": ["cuda -keys=cuda,gpu -max_num_threads=1024 -thread_warp_size=32", "fused_conv2d_fixed_nparts", [64, 1, 14, 14, 16, 16, 3, 3, [1, 1], [1, 1]], {}], "config": {"index": 267108, "code_hash": null, "entity": [["tile_y", "sp", [-1, 1, 2, 1]], ["tile_x", "sp", [-1, 1, 7, 1]], ["tile_rc", "sp", [-1, 8]], ["tile_ry", "sp", [-1, 1]], ["tile_rx", "sp", [-1, 1]], ["auto_unroll_max_step", "ot", 512], ["unroll_explicit", "ot", 1], ["tile_f", "sp", [-1, 8, 2]]]}, "result": [[3.2918826000000005e-05, 3.2911774e-05], 0, 21.496660470962524, 1634622033.7876816], "version": 0.2, "tvm_version": "0.8.dev0"}
{"input": ["cuda -keys=cuda,gpu -max_num_threads=1024 -thread_warp_size=32", "fused_conv2d_fixed_nparts", [64, 1, 14, 14, 16, 16, 3, 3, [1, 1], [1, 1]], {}], "config": {"index": 268133, "code_hash": null, "entity": [["tile_y", "sp", [-1, 7, 2, 1]], ["tile_x", "sp", [-1, 1, 7, 1]], ["tile_rc", "sp", [-1, 4]], ["tile_ry", "sp", [-1, 3]], ["tile_rx", "sp", [-1, 1]], ["auto_unroll_max_step", "ot", 512], ["unroll_explicit", "ot", 1], ["tile_f", "sp", [-1, 8, 2]]]}, "result": [[2.2585743e-05, 2.2565077999999998e-05], 0, 19.626247882843018, 1634622032.0432127], "version": 0.2, "tvm_version": "0.8.dev0"}
{"input": ["cuda -keys=cuda,gpu -max_num_threads=1024 -thread_warp_size=32", "fused_conv2d_fixed_nparts", [64, 1, 14, 14, 16, 16, 3, 3, [1, 1], [1, 1]], {}], "config": {"index": 252773, "code_hash": null, "entity": [["tile_y", "sp", [-1, 7, 2, 1]], ["tile_x", "sp", [-1, 1, 7, 1]], ["tile_rc", "sp", [-1, 4]], ["tile_ry", "sp", [-1, 3]], ["tile_rx", "sp", [-1, 1]], ["auto_unroll_max_step", "ot", 512], ["unroll_explicit", "ot", 0], ["tile_f", "sp", [-1, 8, 2]]]}, "result": [[2.3044391999999997e-05, 2.3039364e-05], 0, 30.18079161643982, 1634622042.7215862], "version": 0.2, "tvm_version": "0.8.dev0"}
{"input": ["cuda -keys=cuda,gpu -max_num_threads=1024 -thread_warp_size=32", "fused_conv2d_fixed_nparts", [64, 1, 14, 14, 16, 16, 3, 3, [1, 1], [1, 1]], {}], "config": {"index": 236148, "code_hash": null, "entity": [["tile_y", "sp", [-1, 1, 2, 1]], ["tile_x", "sp", [-1, 2, 7, 1]], ["tile_rc", "sp", [-1, 4]], ["tile_ry", "sp", [-1, 1]], ["tile_rx", "sp", [-1, 1]], ["auto_unroll_max_step", "ot", 512], ["unroll_explicit", "ot", 1], ["tile_f", "sp", [-1, 4, 2]]]}, "result": [[2.13095e-05, 2.130586e-05], 0, 24.945738077163696, 1634622037.266307], "version": 0.2, "tvm_version": "0.8.dev0"}
{"input": ["cuda -keys=cuda,gpu -max_num_threads=1024 -thread_warp_size=32", "fused_conv2d_fixed_nparts", [64, 1, 14, 14, 16, 16, 3, 3, [1, 1], [1, 1]], {}], "config": {"index": 220788, "code_hash": null, "entity": [["tile_y", "sp", [-1, 1, 2, 1]], ["tile_x", "sp", [-1, 2, 7, 1]], ["tile_rc", "sp", [-1, 4]], ["tile_ry", "sp", [-1, 1]], ["tile_rx", "sp", [-1, 1]], ["auto_unroll_max_step", "ot", 512], ["unroll_explicit", "ot", 0], ["tile_f", "sp", [-1, 4, 2]]]}, "result": [[2.1848274e-05, 2.1835959e-05], 0, 28.468207836151123, 1634622040.992093], "version": 0.2, "tvm_version": "0.8.dev0"}
{"input": ["cuda -keys=cuda,gpu -max_num_threads=1024 -thread_warp_size=32", "fused_conv2d_fixed_nparts", [64, 1, 14, 14, 16, 16, 3, 3, [1, 1], [1, 1]], {}], "config": {"index": 226916, "code_hash": null, "entity": [["tile_y", "sp", [-1, 1, 2, 1]], ["tile_x", "sp", [-1, 1, 7, 1]], ["tile_rc", "sp", [-1, 2]], ["tile_ry", "sp", [-1, 3]], ["tile_rx", "sp", [-1, 1]], ["auto_unroll_max_step", "ot", 1500], ["unroll_explicit", "ot", 0], ["tile_f", "sp", [-1, 4, 2]]]}, "result": [[2.7506598e-05, 2.7484565e-05], 0, 26.696099519729614, 1634622039.1510632], "version": 0.2, "tvm_version": "0.8.dev0"}
{"input": ["cuda -keys=cuda,gpu -max_num_threads=1024 -thread_warp_size=32", "fused_conv2d_fixed_nparts", [64, 1, 14, 14, 16, 16, 3, 3, [1, 1], [1, 1]], {}], "config": {"index": 242276, "code_hash": null, "entity": [["tile_y", "sp", [-1, 1, 2, 1]], ["tile_x", "sp", [-1, 1, 7, 1]], ["tile_rc", "sp", [-1, 2]], ["tile_ry", "sp", [-1, 3]], ["tile_rx", "sp", [-1, 1]], ["auto_unroll_max_step", "ot", 1500], ["unroll_explicit", "ot", 1], ["tile_f", "sp", [-1, 4, 2]]]}, "result": [[3.2557523000000004e-05, 3.2556099e-05], 0, 32.53695106506348, 1634622044.6499312], "version": 0.2, "tvm_version": "0.8.dev0"}
{"input": ["cuda -keys=cuda,gpu -max_num_threads=1024 -thread_warp_size=32", "fused_conv2d_fixed_nparts", [64, 1, 14, 14, 16, 16, 3, 3, [1, 1], [1, 1]], {}], "config": {"index": 251508, "code_hash": null, "entity": [["tile_y", "sp", [-1, 1, 2, 1]], ["tile_x", "sp", [-1, 2, 7, 1]], ["tile_rc", "sp", [-1, 4]], ["tile_ry", "sp", [-1, 1]], ["tile_rx", "sp", [-1, 1]], ["auto_unroll_max_step", "ot", 512], ["unroll_explicit", "ot", 0], ["tile_f", "sp", [-1, 8, 2]]]}, "result": [[2.109604e-05, 2.1100403e-05], 0, 33.76312875747681, 1634622046.3732488], "version": 0.2, "tvm_version": "0.8.dev0"}
{"input": ["cuda -keys=cuda,gpu -max_num_threads=1024 -thread_warp_size=32", "fused_conv2d_fixed_nparts", [64, 1, 14, 14, 16, 16, 3, 3, [1, 1], [1, 1]], {}], "config": {"index": 266868, "code_hash": null, "entity": [["tile_y", "sp", [-1, 1, 2, 1]], ["tile_x", "sp", [-1, 2, 7, 1]], ["tile_rc", "sp", [-1, 4]], ["tile_ry", "sp", [-1, 1]], ["tile_rx", "sp", [-1, 1]], ["auto_unroll_max_step", "ot", 512], ["unroll_explicit", "ot", 1], ["tile_f", "sp", [-1, 8, 2]]]}, "result": [[2.0826802e-05, 2.0830134999999998e-05], 0, 35.558374881744385, 1634622048.126578], "version": 0.2, "tvm_version": "0.8.dev0"}
{"input": ["cuda -keys=cuda,gpu -max_num_threads=1024 -thread_warp_size=32", "fused_conv2d_fixed_nparts", [64, 1, 14, 14, 16, 16, 3, 3, [1, 1], [1, 1]], {}], "config": {"index": 257636, "code_hash": null, "entity": [["tile_y", "sp", [-1, 1, 2, 1]], ["tile_x", "sp", [-1, 1, 7, 1]], ["tile_rc", "sp", [-1, 2]], ["tile_ry", "sp", [-1, 3]], ["tile_rx", "sp", [-1, 1]], ["auto_unroll_max_step", "ot", 1500], ["unroll_explicit", "ot", 0], ["tile_f", "sp", [-1, 8, 2]]]}, "result": [[2.7879809e-05, 2.7891388e-05], 0, 38.83408522605896, 1634622051.4507062], "version": 0.2, "tvm_version": "0.8.dev0"}
{"input": ["cuda -keys=cuda,gpu -max_num_threads=1024 -thread_warp_size=32", "fused_conv2d_fixed_nparts", [64, 1, 14, 14, 16, 16, 3, 3, [1, 1], [1, 1]], {}], "config": {"index": 272996, "code_hash": null, "entity": [["tile_y", "sp", [-1, 1, 2, 1]], ["tile_x", "sp", [-1, 1, 7, 1]], ["tile_rc", "sp", [-1, 2]], ["tile_ry", "sp", [-1, 3]], ["tile_rx", "sp", [-1, 1]], ["auto_unroll_max_step", "ot", 1500], ["unroll_explicit", "ot", 1], ["tile_f", "sp", [-1, 8, 2]]]}, "result": [[3.3545281e-05, 3.3558613e-05], 0, 37.37566137313843, 1634622049.7874956], "version": 0.2, "tvm_version": "0.8.dev0"}
{"input": ["cuda -keys=cuda,gpu -max_num_threads=1024 -thread_warp_size=32", "fused_conv2d_fixed_nparts", [64, 1, 14, 14, 16, 16, 3, 3, [1, 1], [1, 1]], {}], "config": {"index": 273252, "code_hash": null, "entity": [["tile_y", "sp", [-1, 1, 2, 1]], ["tile_x", "sp", [-1, 1, 7, 1]], ["tile_rc", "sp", [-1, 4]], ["tile_ry", "sp", [-1, 3]], ["tile_rx", "sp", [-1, 1]], ["auto_unroll_max_step", "ot", 1500], ["unroll_explicit", "ot", 1], ["tile_f", "sp", [-1, 8, 2]]]}, "result": [[2.7873342999999997e-05, 2.7865595e-05], 0, 47.75602698326111, 1634622060.3233771], "version": 0.2, "tvm_version": "0.8.dev0"}
{"input": ["cuda -keys=cuda,gpu -max_num_threads=1024 -thread_warp_size=32", "fused_conv2d_fixed_nparts", [64, 1, 14, 14, 16, 16, 3, 3, [1, 1], [1, 1]], {}], "config": {"index": 257892, "code_hash": null, "entity": [["tile_y", "sp", [-1, 1, 2, 1]], ["tile_x", "sp", [-1, 1, 7, 1]], ["tile_rc", "sp", [-1, 4]], ["tile_ry", "sp", [-1, 3]], ["tile_rx", "sp", [-1, 1]], ["auto_unroll_max_step", "ot", 1500], ["unroll_explicit", "ot", 0], ["tile_f", "sp", [-1, 8, 2]]]}, "result": [[2.6946635e-05, 2.6916322e-05], 0, 40.42435002326965, 1634622053.0439498], "version": 0.2, "tvm_version": "0.8.dev0"}
{"input": ["cuda -keys=cuda,gpu -max_num_threads=1024 -thread_warp_size=32", "fused_conv2d_fixed_nparts", [64, 1, 14, 14, 16, 16, 3, 3, [1, 1], [1, 1]], {}], "config": {"index": 343880, "code_hash": null, "entity": [["tile_y", "sp", [-1, 1, 14, 1]], ["tile_x", "sp", [-1, 1, 2, 1]], ["tile_rc", "sp", [-1, 8]], ["tile_ry", "sp", [-1, 1]], ["tile_rx", "sp", [-1, 1]], ["auto_unroll_max_step", "ot", 512], ["unroll_explicit", "ot", 0], ["tile_f", "sp", [-1, 4, 4]]]}, "result": [[2.6834286e-05, 2.6821062e-05], 0, 51.14269471168518, 1634622063.8518088], "version": 0.2, "tvm_version": "0.8.dev0"}
{"input": ["cuda -keys=cuda,gpu -max_num_threads=1024 -thread_warp_size=32", "fused_conv2d_fixed_nparts", [64, 1, 14, 14, 16, 16, 3, 3, [1, 1], [1, 1]], {}], "config": {"index": 359240, "code_hash": null, "entity": [["tile_y", "sp", [-1, 1, 14, 1]], ["tile_x", "sp", [-1, 1, 2, 1]], ["tile_rc", "sp", [-1, 8]], ["tile_ry", "sp", [-1, 1]], ["tile_rx", "sp", [-1, 1]], ["auto_unroll_max_step", "ot", 512], ["unroll_explicit", "ot", 1], ["tile_f", "sp", [-1, 4, 4]]]}, "result": [[2.6122607999999998e-05, 2.6125613999999998e-05], 0, 49.42825889587402, 1634622062.0355484], "version": 0.2, "tvm_version": "0.8.dev0"}
{"input": ["cuda -keys=cuda,gpu -max_num_threads=1024 -thread_warp_size=32", "fused_conv2d_fixed_nparts", [64, 1, 14, 14, 16, 16, 3, 3, [1, 1], [1, 1]], {}], "config": {"index": 227142, "code_hash": null, "entity": [["tile_y", "sp", [-1, 1, 7, 1]], ["tile_x", "sp", [-1, 1, 2, 1]], ["tile_rc", "sp", [-1, 4]], ["tile_ry", "sp", [-1, 3]], ["tile_rx", "sp", [-1, 1]], ["auto_unroll_max_step", "ot", 1500], ["unroll_explicit", "ot", 0], ["tile_f", "sp", [-1, 4, 2]]]}, "result": [[3.4168348e-05, 3.415526100000001e-05], 0, 42.430721044540405, 1634622054.9972057], "version": 0.2, "tvm_version": "0.8.dev0"}
{"input": ["cuda -keys=cuda,gpu -max_num_threads=1024 -thread_warp_size=32", "fused_conv2d_fixed_nparts", [64, 1, 14, 14, 16, 16, 3, 3, [1, 1], [1, 1]], {}], "config": {"index": 242502, "code_hash": null, "entity": [["tile_y", "sp", [-1, 1, 7, 1]], ["tile_x", "sp", [-1, 1, 2, 1]], ["tile_rc", "sp", [-1, 4]], ["tile_ry", "sp", [-1, 3]], ["tile_rx", "sp", [-1, 1]], ["auto_unroll_max_step", "ot", 1500], ["unroll_explicit", "ot", 1], ["tile_f", "sp", [-1, 4, 2]]]}, "result": [[3.2022767e-05, 3.1997601e-05], 0, 44.808899879455566, 1634622056.9242077], "version": 0.2, "tvm_version": "0.8.dev0"}
{"input": ["cuda -keys=cuda,gpu -max_num_threads=1024 -thread_warp_size=32", "fused_conv2d_fixed_nparts", [64, 1, 14, 14, 16, 16, 3, 3, [1, 1], [1, 1]], {}], "config": {"index": 260712, "code_hash": null, "entity": [["tile_y", "sp", [-1, 1, 14, 1]], ["tile_x", "sp", [-1, 1, 7, 1]], ["tile_rc", "sp", [-1, 8]], ["tile_ry", "sp", [-1, 3]], ["tile_rx", "sp", [-1, 3]], ["auto_unroll_max_step", "ot", 1500], ["unroll_explicit", "ot", 0], ["tile_f", "sp", [-1, 8, 2]]]}, "result": [[2.5460593e-05, 2.5467757e-05], 0, 45.93139934539795, 1634622058.6033423], "version": 0.2, "tvm_version": "0.8.dev0"}
{"input": ["cuda -keys=cuda,gpu -max_num_threads=1024 -thread_warp_size=32", "fused_conv2d_fixed_nparts", [64, 1, 14, 14, 16, 16, 3, 3, [1, 1], [1, 1]], {}], "config": {"index": 276072, "code_hash": null, "entity": [["tile_y", "sp", [-1, 1, 14, 1]], ["tile_x", "sp", [-1, 1, 7, 1]], ["tile_rc", "sp", [-1, 8]], ["tile_ry", "sp", [-1, 3]], ["tile_rx", "sp", [-1, 3]], ["auto_unroll_max_step", "ot", 1500], ["unroll_explicit", "ot", 1], ["tile_f", "sp", [-1, 8, 2]]]}, "result": [[2.5294229000000002e-05, 2.5304108e-05], 0, 56.26281380653381, 1634622068.8719747], "version": 0.2, "tvm_version": "0.8.dev0"}
{"input": ["cuda -keys=cuda,gpu -max_num_threads=1024 -thread_warp_size=32", "fused_conv2d_fixed_nparts", [64, 1, 14, 14, 16, 16, 3, 3, [1, 1], [1, 1]], {}], "config": {"index": 272228, "code_hash": null, "entity": [["tile_y", "sp", [-1, 1, 2, 1]], ["tile_x", "sp", [-1, 1, 7, 1]], ["tile_rc", "sp", [-1, 8]], ["tile_ry", "sp", [-1, 1]], ["tile_rx", "sp", [-1, 1]], ["auto_unroll_max_step", "ot", 1500], ["unroll_explicit", "ot", 1], ["tile_f", "sp", [-1, 8, 2]]]}, "result": [[3.2969028000000006e-05, 3.2968852e-05], 0, 52.91812324523926, 1634622065.53087], "version": 0.2, "tvm_version": "0.8.dev0"}
{"input": ["cuda -keys=cuda,gpu -max_num_threads=1024 -thread_warp_size=32", "fused_conv2d_fixed_nparts", [64, 1, 14, 14, 16, 16, 3, 3, [1, 1], [1, 1]], {}], "config": {"index": 256868, "code_hash": null, "entity": [["tile_y", "sp", [-1, 1, 2, 1]], ["tile_x", "sp", [-1, 1, 7, 1]], ["tile_rc", "sp", [-1, 8]], ["tile_ry", "sp", [-1, 1]], ["tile_rx", "sp", [-1, 1]], ["auto_unroll_max_step", "ot", 1500], ["unroll_explicit", "ot", 0], ["tile_f", "sp", [-1, 8, 2]]]}, "result": [[3.1885619e-05, 3.1878423000000006e-05], 0, 54.48767042160034, 1634622067.2328382], "version": 0.2, "tvm_version": "0.8.dev0"}
{"input": ["cuda -keys=cuda,gpu -max_num_threads=1024 -thread_warp_size=32", "fused_conv2d_fixed_nparts", [64, 1, 14, 14, 16, 16, 3, 3, [1, 1], [1, 1]], {}], "config": {"index": 250472, "code_hash": null, "entity": [["tile_y", "sp", [-1, 1, 14, 1]], ["tile_x", "sp", [-1, 1, 7, 1]], ["tile_rc", "sp", [-1, 8]], ["tile_ry", "sp", [-1, 3]], ["tile_rx", "sp", [-1, 3]], ["auto_unroll_max_step", "ot", 0], ["unroll_explicit", "ot", 0], ["tile_f", "sp", [-1, 8, 2]]]}, "result": [[2.4893209e-05, 2.4886517e-05], 0, 57.82702684402466, 1634622070.6727033], "version": 0.2, "tvm_version": "0.8.dev0"}
{"input": ["cuda -keys=cuda,gpu -max_num_threads=1024 -thread_warp_size=32", "fused_conv2d_fixed_nparts", [64, 1, 14, 14, 16, 16, 3, 3, [1, 1], [1, 1]], {}], "config": {"index": 265832, "code_hash": null, "entity": [["tile_y", "sp", [-1, 1, 14, 1]], ["tile_x", "sp", [-1, 1, 7, 1]], ["tile_rc", "sp", [-1, 8]], ["tile_ry", "sp", [-1, 3]], ["tile_rx", "sp", [-1, 3]], ["auto_unroll_max_step", "ot", 0], ["unroll_explicit", "ot", 1], ["tile_f", "sp", [-1, 8, 2]]]}, "result": [[2.5005803999999998e-05, 2.5020161e-05], 0, 59.44918489456177, 1634622072.3324666], "version": 0.2, "tvm_version": "0.8.dev0"}
{"input": ["cuda -keys=cuda,gpu -max_num_threads=1024 -thread_warp_size=32", "fused_conv2d_fixed_nparts", [64, 1, 14, 14, 16, 16, 3, 3, [1, 1], [1, 1]], {}], "config": {"index": 252532, "code_hash": null, "entity": [["tile_y", "sp", [-1, 1, 2, 1]], ["tile_x", "sp", [-1, 2, 7, 1]], ["tile_rc", "sp", [-1, 2]], ["tile_ry", "sp", [-1, 3]], ["tile_rx", "sp", [-1, 1]], ["auto_unroll_max_step", "ot", 512], ["unroll_explicit", "ot", 0], ["tile_f", "sp", [-1, 8, 2]]]}, "result": [[1.8457224000000002e-05, 1.8449159000000004e-05], 0, 61.19882559776306, 1634622074.086115], "version": 0.2, "tvm_version": "0.8.dev0"}
{"input": ["cuda -keys=cuda,gpu -max_num_threads=1024 -thread_warp_size=32", "fused_conv2d_fixed_nparts", [64, 1, 14, 14, 16, 16, 3, 3, [1, 1], [1, 1]], {}], "config": {"index": 267892, "code_hash": null, "entity": [["tile_y", "sp", [-1, 1, 2, 1]], ["tile_x", "sp", [-1, 2, 7, 1]], ["tile_rc", "sp", [-1, 2]], ["tile_ry", "sp", [-1, 3]], ["tile_rx", "sp", [-1, 1]], ["auto_unroll_max_step", "ot", 512], ["unroll_explicit", "ot", 1], ["tile_f", "sp", [-1, 8, 2]]]}, "result": [[1.8662033000000002e-05, 1.8669592000000003e-05], 0, 62.9098162651062, 1634622075.7863593], "version": 0.2, "tvm_version": "0.8.dev0"}
{"input": ["cuda -keys=cuda,gpu -max_num_threads=1024 -thread_warp_size=32", "fused_conv2d_fixed_nparts", [64, 1, 14, 14, 16, 16, 3, 3, [1, 1], [1, 1]], {}], "config": {"index": 224102, "code_hash": null, "entity": [["tile_y", "sp", [-1, 1, 7, 1]], ["tile_x", "sp", [-1, 1, 7, 1]], ["tile_rc", "sp", [-1, 1]], ["tile_ry", "sp", [-1, 3]], ["tile_rx", "sp", [-1, 3]], ["auto_unroll_max_step", "ot", 512], ["unroll_explicit", "ot", 0], ["tile_f", "sp", [-1, 4, 2]]]}, "result": [[3.2831297000000004e-05, 3.2804924999999997e-05], 0, 64.6126024723053, 1634622077.5133054], "version": 0.2, "tvm_version": "0.8.dev0"}
{"input": ["cuda -keys=cuda,gpu -max_num_threads=1024 -thread_warp_size=32", "fused_conv2d_fixed_nparts", [64, 1, 14, 14, 16, 16, 3, 3, [1, 1], [1, 1]], {}], "config": {"index": 239462, "code_hash": null, "entity": [["tile_y", "sp", [-1, 1, 7, 1]], ["tile_x", "sp", [-1, 1, 7, 1]], ["tile_rc", "sp", [-1, 1]], ["tile_ry", "sp", [-1, 3]], ["tile_rx", "sp", [-1, 3]], ["auto_unroll_max_step", "ot", 512], ["unroll_explicit", "ot", 1], ["tile_f", "sp", [-1, 4, 2]]]}, "result": [[3.2815139e-05, 3.282499e-05], 0, 66.3429205417633, 1634622079.272034], "version": 0.2, "tvm_version": "0.8.dev0"}
{"input": ["cuda -keys=cuda,gpu -max_num_threads=1024 -thread_warp_size=32", "fused_conv2d_fixed_nparts", [64, 1, 14, 14, 16, 16, 3, 3, [1, 1], [1, 1]], {}], "config": {"index": 222054, "code_hash": null, "entity": [["tile_y", "sp", [-1, 1, 7, 1]], ["tile_x", "sp", [-1, 1, 7, 1]], ["tile_rc", "sp", [-1, 4]], ["tile_ry", "sp", [-1, 3]], ["tile_rx", "sp", [-1, 1]], ["auto_unroll_max_step", "ot", 512], ["unroll_explicit", "ot", 0], ["tile_f", "sp", [-1, 4, 2]]]}, "result": [[2.3947762e-05, 2.3957291e-05], 0, 68.15885734558105, 1634622081.0525753], "version": 0.2, "tvm_version": "0.8.dev0"}
{"input": ["cuda -keys=cuda,gpu -max_num_threads=1024 -thread_warp_size=32", "fused_conv2d_fixed_nparts", [64, 1, 14, 14, 16, 16, 3, 3, [1, 1], [1, 1]], {}], "config": {"index": 237414, "code_hash": null, "entity": [["tile_y", "sp", [-1, 1, 7, 1]], ["tile_x", "sp", [-1, 1, 7, 1]], ["tile_rc", "sp", [-1, 4]], ["tile_ry", "sp", [-1, 3]], ["tile_rx", "sp", [-1, 1]], ["auto_unroll_max_step", "ot", 512], ["unroll_explicit", "ot", 1], ["tile_f", "sp", [-1, 4, 2]]]}, "result": [[2.3441604e-05, 2.3459082999999997e-05], 0, 69.95643019676208, 1634622082.7821918], "version": 0.2, "tvm_version": "0.8.dev0"}
{"input": ["cuda -keys=cuda,gpu -max_num_threads=1024 -thread_warp_size=32", "fused_conv2d_fixed_nparts", [64, 1, 14, 14, 16, 16, 3, 3, [1, 1], [1, 1]], {}], "config": {"index": 225908, "code_hash": null, "entity": [["tile_y", "sp", [-1, 1, 2, 1]], ["tile_x", "sp", [-1, 2, 7, 1]], ["tile_rc", "sp", [-1, 4]], ["tile_ry", "sp", [-1, 1]], ["tile_rx", "sp", [-1, 1]], ["auto_unroll_max_step", "ot", 1500], ["unroll_explicit", "ot", 0], ["tile_f", "sp", [-1, 4, 2]]]}, "result": [[2.6314979000000004e-05, 2.6319607999999996e-05], 0, 4.100640773773193, 1634622088.3603764], "version": 0.2, "tvm_version": "0.8.dev0"}
{"input": ["cuda -keys=cuda,gpu -max_num_threads=1024 -thread_warp_size=32", "fused_conv2d_fixed_nparts", [64, 1, 14, 14, 16, 16, 3, 3, [1, 1], [1, 1]], {}], "config": {"index": 241268, "code_hash": null, "entity": [["tile_y", "sp", [-1, 1, 2, 1]], ["tile_x", "sp", [-1, 2, 7, 1]], ["tile_rc", "sp", [-1, 4]], ["tile_ry", "sp", [-1, 1]], ["tile_rx", "sp", [-1, 1]], ["auto_unroll_max_step", "ot", 1500], ["unroll_explicit", "ot", 1], ["tile_f", "sp", [-1, 4, 2]]]}, "result": [[2.1954826e-05, 2.1951370000000003e-05], 0, 3.1604676246643066, 1634622086.4254339], "version": 0.2, "tvm_version": "0.8.dev0"}
{"input": ["cuda -keys=cuda,gpu -max_num_threads=1024 -thread_warp_size=32", "fused_conv2d_fixed_nparts", [64, 1, 14, 14, 16, 16, 3, 3, [1, 1], [1, 1]], {}], "config": {"index": 221798, "code_hash": null, "entity": [["tile_y", "sp", [-1, 1, 7, 1]], ["tile_x", "sp", [-1, 1, 7, 1]], ["tile_rc", "sp", [-1, 2]], ["tile_ry", "sp", [-1, 3]], ["tile_rx", "sp", [-1, 1]], ["auto_unroll_max_step", "ot", 512], ["unroll_explicit", "ot", 0], ["tile_f", "sp", [-1, 4, 2]]]}, "result": [[2.5481643999999997e-05, 2.5476718000000002e-05], 0, 9.23366117477417, 1634622093.6810563], "version": 0.2, "tvm_version": "0.8.dev0"}
{"input": ["cuda -keys=cuda,gpu -max_num_threads=1024 -thread_warp_size=32", "fused_conv2d_fixed_nparts", [64, 1, 14, 14, 16, 16, 3, 3, [1, 1], [1, 1]], {}], "config": {"index": 237158, "code_hash": null, "entity": [["tile_y", "sp", [-1, 1, 7, 1]], ["tile_x", "sp", [-1, 1, 7, 1]], ["tile_rc", "sp", [-1, 2]], ["tile_ry", "sp", [-1, 3]], ["tile_rx", "sp", [-1, 1]], ["auto_unroll_max_step", "ot", 512], ["unroll_explicit", "ot", 1], ["tile_f", "sp", [-1, 4, 2]]]}, "result": [[2.5821069e-05, 2.5822306999999998e-05], 0, 5.691443204879761, 1634622090.1326602], "version": 0.2, "tvm_version": "0.8.dev0"}
{"input": ["cuda -keys=cuda,gpu -max_num_threads=1024 -thread_warp_size=32", "fused_conv2d_fixed_nparts", [64, 1, 14, 14, 16, 16, 3, 3, [1, 1], [1, 1]], {}], "config": {"index": 221812, "code_hash": null, "entity": [["tile_y", "sp", [-1, 1, 2, 1]], ["tile_x", "sp", [-1, 2, 7, 1]], ["tile_rc", "sp", [-1, 2]], ["tile_ry", "sp", [-1, 3]], ["tile_rx", "sp", [-1, 1]], ["auto_unroll_max_step", "ot", 512], ["unroll_explicit", "ot", 0], ["tile_f", "sp", [-1, 4, 2]]]}, "result": [[1.8466057e-05, 1.8468461999999997e-05], 0, 7.47195029258728, 1634622091.922608], "version": 0.2, "tvm_version": "0.8.dev0"}
{"input": ["cuda -keys=cuda,gpu -max_num_threads=1024 -thread_warp_size=32", "fused_conv2d_fixed_nparts", [64, 1, 14, 14, 16, 16, 3, 3, [1, 1], [1, 1]], {}], "config": {"index": 237172, "code_hash": null, "entity": [["tile_y", "sp", [-1, 1, 2, 1]], ["tile_x", "sp", [-1, 2, 7, 1]], ["tile_rc", "sp", [-1, 2]], ["tile_ry", "sp", [-1, 3]], ["tile_rx", "sp", [-1, 1]], ["auto_unroll_max_step", "ot", 512], ["unroll_explicit", "ot", 1], ["tile_f", "sp", [-1, 4, 2]]]}, "result": [[1.8079135e-05, 1.807072e-05], 0, 12.932694435119629, 1634622097.3551812], "version": 0.2, "tvm_version": "0.8.dev0"}
