python/autotvm_logs/fused_conv2d_fixed_nparts_|i+64_1_32_7_7|w+_64_32_32_3_3|ws+1_1|wd_1_1|p+_1_1.log
{"input": ["cuda -keys=cuda,gpu -max_num_threads=1024 -thread_warp_size=32", "fused_conv2d_fixed_nparts", [64, 1, 7, 7, 32, 32, 3, 3, [1, 1], [1, 1]], {}], "config": {"index": 23262, "code_hash": null, "entity": [["tile_y", "sp", [-1, 1, 7, 1]], ["tile_x", "sp", [-1, 1, 1, 7]], ["tile_rc", "sp", [-1, 2]], ["tile_ry", "sp", [-1, 1]], ["tile_rx", "sp", [-1, 3]], ["auto_unroll_max_step", "ot", 0], ["unroll_explicit", "ot", 0], ["tile_f", "sp", [-1, 16, 2]]]}, "result": [[5.4476950000000004e-05, 5.4475079000000006e-05], 0, 2.168832540512085, 1634624300.8414285], "version": 0.2, "tvm_version": "0.8.dev0"}
{"input": ["cuda -keys=cuda,gpu -max_num_threads=1024 -thread_warp_size=32", "fused_conv2d_fixed_nparts", [64, 1, 7, 7, 32, 32, 3, 3, [1, 1], [1, 1]], {}], "config": {"index": 5505, "code_hash": null, "entity": [["tile_y", "sp", [-1, 7, 1, 1]], ["tile_x", "sp", [-1, 1, 1, 1]], ["tile_rc", "sp", [-1, 4]], ["tile_ry", "sp", [-1, 3]], ["tile_rx", "sp", [-1, 1]], ["auto_unroll_max_step", "ot", 1500], ["unroll_explicit", "ot", 0], ["tile_f", "sp", [-1, 4, 1]]]}, "result": [[9.903322500000001e-05, 9.524396000000001e-05], 0, 11.945772409439087, 1634624310.503548], "version": 0.2, "tvm_version": "0.8.dev0"}
{"input": ["cuda -keys=cuda,gpu -max_num_threads=1024 -thread_warp_size=32", "fused_conv2d_fixed_nparts", [64, 1, 7, 7, 32, 32, 3, 3, [1, 1], [1, 1]], {}], "config": {"index": 20963, "code_hash": null, "entity": [["tile_y", "sp", [-1, 1, 1, 7]], ["tile_x", "sp", [-1, 1, 1, 1]], ["tile_rc", "sp", [-1, 4]], ["tile_ry", "sp", [-1, 1]], ["tile_rx", "sp", [-1, 3]], ["auto_unroll_max_step", "ot", 0], ["unroll_explicit", "ot", 0], ["tile_f", "sp", [-1, 8, 2]]]}, "result": [[0.000123460452, 0.00011390510899999999], 0, 4.402357578277588, 1634624302.9969008], "version": 0.2, "tvm_version": "0.8.dev0"}
{"input": ["cuda -keys=cuda,gpu -max_num_threads=1024 -thread_warp_size=32", "fused_conv2d_fixed_nparts", [64, 1, 7, 7, 32, 32, 3, 3, [1, 1], [1, 1]], {}], "config": {"index": 9019, "code_hash": null, "entity": [["tile_y", "sp", [-1, 1, 1, 7]], ["tile_x", "sp", [-1, 1, 7, 1]], ["tile_rc", "sp", [-1, 32]], ["tile_ry", "sp", [-1, 3]], ["tile_rx", "sp", [-1, 1]], ["auto_unroll_max_step", "ot", 1500], ["unroll_explicit", "ot", 1], ["tile_f", "sp", [-1, 8, 1]]]}, "result": [[4.3021053000000005e-05, 4.2618829e-05], 0, 8.275699138641357, 1634624306.6821282], "version": 0.2, "tvm_version": "0.8.dev0"}
{"input": ["cuda -keys=cuda,gpu -max_num_threads=1024 -thread_warp_size=32", "fused_conv2d_fixed_nparts", [64, 1, 7, 7, 32, 32, 3, 3, [1, 1], [1, 1]], {}], "config": {"index": 42440, "code_hash": null, "entity": [["tile_y", "sp", [-1, 1, 1, 1]], ["tile_x", "sp", [-1, 1, 7, 1]], ["tile_rc", "sp", [-1, 1]], ["tile_ry", "sp", [-1, 1]], ["tile_rx", "sp", [-1, 3]], ["auto_unroll_max_step", "ot", 1500], ["unroll_explicit", "ot", 0], ["tile_f", "sp", [-1, 1, 16]]]}, "result": [[0.00010904859, 9.9522894e-05], 0, 6.464397668838501, 1634624304.9003005], "version": 0.2, "tvm_version": "0.8.dev0"}
{"input": ["cuda -keys=cuda,gpu -max_num_threads=1024 -thread_warp_size=32", "fused_conv2d_fixed_nparts", [64, 1, 7, 7, 32, 32, 3, 3, [1, 1], [1, 1]], {}], "config": {"index": 38314, "code_hash": null, "entity": [["tile_y", "sp", [-1, 1, 7, 1]], ["tile_x", "sp", [-1, 1, 7, 1]], ["tile_rc", "sp", [-1, 1]], ["tile_ry", "sp", [-1, 3]], ["tile_rx", "sp", [-1, 3]], ["auto_unroll_max_step", "ot", 0], ["unroll_explicit", "ot", 1], ["tile_f", "sp", [-1, 2, 8]]]}, "result": [[4.4671716e-05, 4.4667957e-05], 0, 9.83135437965393, 1634624308.439223], "version": 0.2, "tvm_version": "0.8.dev0"}
{"input": ["cuda -keys=cuda,gpu -max_num_threads=1024 -thread_warp_size=32", "fused_conv2d_fixed_nparts", [64, 1, 7, 7, 32, 32, 3, 3, [1, 1], [1, 1]], {}], "config": {"index": 37660, "code_hash": null, "entity": [["tile_y", "sp", [-1, 1, 1, 1]], ["tile_x", "sp", [-1, 1, 1, 7]], ["tile_rc", "sp", [-1, 2]], ["tile_ry", "sp", [-1, 1]], ["tile_rx", "sp", [-1, 1]], ["auto_unroll_max_step", "ot", 1500], ["unroll_explicit", "ot", 0], ["tile_f", "sp", [-1, 2, 8]]]}, "result": [[0.000187478763, 0.000174306861], 0, 14.450228214263916, 1634624312.9983034], "version": 0.2, "tvm_version": "0.8.dev0"}
{"input": ["cuda -keys=cuda,gpu -max_num_threads=1024 -thread_warp_size=32", "fused_conv2d_fixed_nparts", [64, 1, 7, 7, 32, 32, 3, 3, [1, 1], [1, 1]], {}], "config": {"index": 28746, "code_hash": null, "entity": [["tile_y", "sp", [-1, 1, 7, 1]], ["tile_x", "sp", [-1, 1, 7, 1]], ["tile_rc", "sp", [-1, 4]], ["tile_ry", "sp", [-1, 3]], ["tile_rx", "sp", [-1, 3]], ["auto_unroll_max_step", "ot", 1500], ["unroll_explicit", "ot", 0], ["tile_f", "sp", [-1, 2, 4]]]}, "result": [[3.3536183000000006e-05, 3.3541145e-05], 0, 25.25432586669922, 1634624324.0090263], "version": 0.2, "tvm_version": "0.8.dev0"}
{"input": ["cuda -keys=cuda,gpu -max_num_threads=1024 -thread_warp_size=32", "fused_conv2d_fixed_nparts", [64, 1, 7, 7, 32, 32, 3, 3, [1, 1], [1, 1]], {}], "config": {"index": 26434, "code_hash": null, "entity": [["tile_y", "sp", [-1, 1, 7, 1]], ["tile_x", "sp", [-1, 1, 1, 1]], ["tile_rc", "sp", [-1, 4]], ["tile_ry", "sp", [-1, 3]], ["tile_rx", "sp", [-1, 3]], ["auto_unroll_max_step", "ot", 1500], ["unroll_explicit", "ot", 0], ["tile_f", "sp", [-1, 1, 4]]]}, "result": [[0.00038264932, 0.000373366953], 0, 38.653040170669556, 1634624336.8583107], "version": 0.2, "tvm_version": "0.8.dev0"}
{"input": ["cuda -keys=cuda,gpu -max_num_threads=1024 -thread_warp_size=32", "fused_conv2d_fixed_nparts", [64, 1, 7, 7, 32, 32, 3, 3, [1, 1], [1, 1]], {}], "config": {"index": 27905, "code_hash": null, "entity": [["tile_y", "sp", [-1, 7, 1, 1]], ["tile_x", "sp", [-1, 1, 1, 1]], ["tile_rc", "sp", [-1, 16]], ["tile_ry", "sp", [-1, 1]], ["tile_rx", "sp", [-1, 3]], ["auto_unroll_max_step", "ot", 0], ["unroll_explicit", "ot", 0], ["tile_f", "sp", [-1, 2, 4]]]}, "result": [[0.000513301656, 0.000489790432], 0, 22.897706985473633, 1634624322.0612757], "version": 0.2, "tvm_version": "0.8.dev0"}
{"input": ["cuda -keys=cuda,gpu -max_num_threads=1024 -thread_warp_size=32", "fused_conv2d_fixed_nparts", [64, 1, 7, 7, 32, 32, 3, 3, [1, 1], [1, 1]], {}], "config": {"index": 8196, "code_hash": null, "entity": [["tile_y", "sp", [-1, 1, 1, 1]], ["tile_x", "sp", [-1, 7, 1, 1]], ["tile_rc", "sp", [-1, 4]], ["tile_ry", "sp", [-1, 3]], ["tile_rx", "sp", [-1, 1]], ["auto_unroll_max_step", "ot", 0], ["unroll_explicit", "ot", 1], ["tile_f", "sp", [-1, 8, 1]]]}, "result": [[0.00011607295000000001, 0.00010817472], 0, 20.12495994567871, 1634624319.2244053], "version": 0.2, "tvm_version": "0.8.dev0"}
{"input": ["cuda -keys=cuda,gpu -max_num_threads=1024 -thread_warp_size=32", "fused_conv2d_fixed_nparts", [64, 1, 7, 7, 32, 32, 3, 3, [1, 1], [1, 1]], {}], "config": {"index": 40392, "code_hash": null, "entity": [["tile_y", "sp", [-1, 1, 1, 1]], ["tile_x", "sp", [-1, 1, 7, 1]], ["tile_rc", "sp", [-1, 16]], ["tile_ry", "sp", [-1, 1]], ["tile_rx", "sp", [-1, 1]], ["auto_unroll_max_step", "ot", 0], ["unroll_explicit", "ot", 1], ["tile_f", "sp", [-1, 4, 8]]]}, "result": [[0.000107079901, 9.9650538e-05], 0, 26.579740047454834, 1634624325.9165907], "version": 0.2, "tvm_version": "0.8.dev0"}
{"input": ["cuda -keys=cuda,gpu -max_num_threads=1024 -thread_warp_size=32", "fused_conv2d_fixed_nparts", [64, 1, 7, 7, 32, 32, 3, 3, [1, 1], [1, 1]], {}], "config": {"index": 10442, "code_hash": null, "entity": [["tile_y", "sp", [-1, 1, 7, 1]], ["tile_x", "sp", [-1, 1, 7, 1]], ["tile_rc", "sp", [-1, 16]], ["tile_ry", "sp", [-1, 1]], ["tile_rx", "sp", [-1, 1]], ["auto_unroll_max_step", "ot", 0], ["unroll_explicit", "ot", 1], ["tile_f", "sp", [-1, 16, 1]]]}, "result": [[2.7391342e-05, 2.7378728e-05], 0, 28.31603741645813, 1634624327.6248684], "version": 0.2, "tvm_version": "0.8.dev0"}
{"input": ["cuda -keys=cuda,gpu -max_num_threads=1024 -thread_warp_size=32", "fused_conv2d_fixed_nparts", [64, 1, 7, 7, 32, 32, 3, 3, [1, 1], [1, 1]], {}], "config": {"index": 40494, "code_hash": null, "entity": [["tile_y", "sp", [-1, 1, 7, 1]], ["tile_x", "sp", [-1, 1, 1, 7]], ["tile_rc", "sp", [-1, 16]], ["tile_ry", "sp", [-1, 3]], ["tile_rx", "sp", [-1, 1]], ["auto_unroll_max_step", "ot", 0], ["unroll_explicit", "ot", 1], ["tile_f", "sp", [-1, 4, 8]]]}, "result": [[0.00016172610299999997, 0.000150536611], 0, 49.35672616958618, 1634624349.0192344], "version": 0.2, "tvm_version": "0.8.dev0"}
{"input": ["cuda -keys=cuda,gpu -max_num_threads=1024 -thread_warp_size=32", "fused_conv2d_fixed_nparts", [64, 1, 7, 7, 32, 32, 3, 3, [1, 1], [1, 1]], {}], "config": {"index": 11307, "code_hash": null, "entity": [["tile_y", "sp", [-1, 1, 1, 7]], ["tile_x", "sp", [-1, 1, 7, 1]], ["tile_rc", "sp", [-1, 16]], ["tile_ry", "sp", [-1, 3]], ["tile_rx", "sp", [-1, 1]], ["auto_unroll_max_step", "ot", 1500], ["unroll_explicit", "ot", 1], ["tile_f", "sp", [-1, 16, 1]]]}, "result": [[2.7859293e-05, 2.7863151e-05], 0, 30.65197229385376, 1634624329.580582], "version": 0.2, "tvm_version": "0.8.dev0"}
{"input": ["cuda -keys=cuda,gpu -max_num_threads=1024 -thread_warp_size=32", "fused_conv2d_fixed_nparts", [64, 1, 7, 7, 32, 32, 3, 3, [1, 1], [1, 1]], {}], "config": {"index": 9916, "code_hash": null, "entity": [["tile_y", "sp", [-1, 1, 1, 1]], ["tile_x", "sp", [-1, 1, 1, 7]], ["tile_rc", "sp", [-1, 2]], ["tile_ry", "sp", [-1, 3]], ["tile_rx", "sp", [-1, 3]], ["auto_unroll_max_step", "ot", 512], ["unroll_explicit", "ot", 0], ["tile_f", "sp", [-1, 16, 1]]]}, "result": [[6.5699416e-05, 6.569964100000001e-05], 0, 39.48486065864563, 1634624338.6952949], "version": 0.2, "tvm_version": "0.8.dev0"}
{"input": ["cuda -keys=cuda,gpu -max_num_threads=1024 -thread_warp_size=32", "fused_conv2d_fixed_nparts", [64, 1, 7, 7, 32, 32, 3, 3, [1, 1], [1, 1]], {}], "config": {"index": 37977, "code_hash": null, "entity": [["tile_y", "sp", [-1, 7, 1, 1]], ["tile_x", "sp", [-1, 1, 7, 1]], ["tile_rc", "sp", [-1, 8]], ["tile_ry", "sp", [-1, 3]], ["tile_rx", "sp", [-1, 3]], ["auto_unroll_max_step", "ot", 1500], ["unroll_explicit", "ot", 0], ["tile_f", "sp", [-1, 2, 8]]]}, "result": [[0.000410743911, 0.000395750968], 0, 55.58473873138428, 1634624354.2681277], "version": 0.2, "tvm_version": "0.8.dev0"}
{"input": ["cuda -keys=cuda,gpu -max_num_threads=1024 -thread_warp_size=32", "fused_conv2d_fixed_nparts", [64, 1, 7, 7, 32, 32, 3, 3, [1, 1], [1, 1]], {}], "config": {"index": 48356, "code_hash": null, "entity": [["tile_y", "sp", [-1, 1, 1, 1]], ["tile_x", "sp", [-1, 7, 1, 1]], ["tile_rc", "sp", [-1, 16]], ["tile_ry", "sp", [-1, 3]], ["tile_rx", "sp", [-1, 3]], ["auto_unroll_max_step", "ot", 1500], ["unroll_explicit", "ot", 1], ["tile_f", "sp", [-1, 1, 32]]]}, "result": [[0.0009589451400000001, 0.000931926194], 0, 48.48104119300842, 1634624346.969933], "version": 0.2, "tvm_version": "0.8.dev0"}
{"input": ["cuda -keys=cuda,gpu -max_num_threads=1024 -thread_warp_size=32", "fused_conv2d_fixed_nparts", [64, 1, 7, 7, 32, 32, 3, 3, [1, 1], [1, 1]], {}], "config": {"index": 4706, "code_hash": null, "entity": [["tile_y", "sp", [-1, 1, 7, 1]], ["tile_x", "sp", [-1, 1, 1, 1]], ["tile_rc", "sp", [-1, 1]], ["tile_ry", "sp", [-1, 3]], ["tile_rx", "sp", [-1, 1]], ["auto_unroll_max_step", "ot", 0], ["unroll_explicit", "ot", 0], ["tile_f", "sp", [-1, 4, 1]]]}, "result": [[7.0259077e-05, 6.647919199999999e-05], 0, 50.9491446018219, 1634624350.8579845], "version": 0.2, "tvm_version": "0.8.dev0"}
{"input": ["cuda -keys=cuda,gpu -max_num_threads=1024 -thread_warp_size=32", "fused_conv2d_fixed_nparts", [64, 1, 7, 7, 32, 32, 3, 3, [1, 1], [1, 1]], {}], "config": {"index": 5607, "code_hash": null, "entity": [["tile_y", "sp", [-1, 1, 1, 7]], ["tile_x", "sp", [-1, 7, 1, 1]], ["tile_rc", "sp", [-1, 4]], ["tile_ry", "sp", [-1, 1]], ["tile_rx", "sp", [-1, 3]], ["auto_unroll_max_step", "ot", 1500], ["unroll_explicit", "ot", 0], ["tile_f", "sp", [-1, 4, 1]]]}, "result": [[0.0008535322999999999, 0.000832520323], 0, 63.78817272186279, 1634624363.4238136], "version": 0.2, "tvm_version": "0.8.dev0"}
{"input": ["cuda -keys=cuda,gpu -max_num_threads=1024 -thread_warp_size=32", "fused_conv2d_fixed_nparts", [64, 1, 7, 7, 32, 32, 3, 3, [1, 1], [1, 1]], {}], "config": {"index": 30703, "code_hash": null, "entity": [["tile_y", "sp", [-1, 1, 1, 7]], ["tile_x", "sp", [-1, 1, 1, 7]], ["tile_rc", "sp", [-1, 16]], ["tile_ry", "sp", [-1, 3]], ["tile_rx", "sp", [-1, 3]], ["auto_unroll_max_step", "ot", 512], ["unroll_explicit", "ot", 0], ["tile_f", "sp", [-1, 4, 4]]]}, "result": [[0.00061156733, 0.0005978360940000001], 0, 57.77735877037048, 1634624357.5326366], "version": 0.2, "tvm_version": "0.8.dev0"}
{"input": ["cuda -keys=cuda,gpu -max_num_threads=1024 -thread_warp_size=32", "fused_conv2d_fixed_nparts", [64, 1, 7, 7, 32, 32, 3, 3, [1, 1], [1, 1]], {}], "config": {"index": 30241, "code_hash": null, "entity": [["tile_y", "sp", [-1, 7, 1, 1]], ["tile_x", "sp", [-1, 1, 1, 1]], ["tile_rc", "sp", [-1, 1]], ["tile_ry", "sp", [-1, 3]], ["tile_rx", "sp", [-1, 3]], ["auto_unroll_max_step", "ot", 0], ["unroll_explicit", "ot", 0], ["tile_f", "sp", [-1, 4, 4]]]}, "result": [[0.000134555216, 0.00013054719], 0, 59.3526885509491, 1634624359.5835948], "version": 0.2, "tvm_version": "0.8.dev0"}
{"input": ["cuda -keys=cuda,gpu -max_num_threads=1024 -thread_warp_size=32", "fused_conv2d_fixed_nparts", [64, 1, 7, 7, 32, 32, 3, 3, [1, 1], [1, 1]], {}], "config": {"index": 22868, "code_hash": null, "entity": [["tile_y", "sp", [-1, 1, 1, 1]], ["tile_x", "sp", [-1, 7, 1, 1]], ["tile_rc", "sp", [-1, 2]], ["tile_ry", "sp", [-1, 1]], ["tile_rx", "sp", [-1, 3]], ["auto_unroll_max_step", "ot", 1500], ["unroll_explicit", "ot", 1], ["tile_f", "sp", [-1, 8, 2]]]}, "result": [[7.3191291e-05, 7.1060943e-05], 0, 69.22947430610657, 1634624369.3822694], "version": 0.2, "tvm_version": "0.8.dev0"}
{"input": ["cuda -keys=cuda,gpu -max_num_threads=1024 -thread_warp_size=32", "fused_conv2d_fixed_nparts", [64, 1, 7, 7, 32, 32, 3, 3, [1, 1], [1, 1]], {}], "config": {"index": 10728, "code_hash": null, "entity": [["tile_y", "sp", [-1, 1, 1, 1]], ["tile_x", "sp", [-1, 1, 7, 1]], ["tile_rc", "sp", [-1, 16]], ["tile_ry", "sp", [-1, 3]], ["tile_rx", "sp", [-1, 3]], ["auto_unroll_max_step", "ot", 0], ["unroll_explicit", "ot", 1], ["tile_f", "sp", [-1, 16, 1]]]}, "result": [[0.000118469353, 0.00010799431900000001], 0, 73.35871291160583, 1634624373.8861132], "version": 0.2, "tvm_version": "0.8.dev0"}
{"input": ["cuda -keys=cuda,gpu -max_num_threads=1024 -thread_warp_size=32", "fused_conv2d_fixed_nparts", [64, 1, 7, 7, 32, 32, 3, 3, [1, 1], [1, 1]], {}], "config": {"index": 33085, "code_hash": null, "entity": [["tile_y", "sp", [-1, 7, 1, 1]], ["tile_x", "sp", [-1, 1, 1, 7]], ["tile_rc", "sp", [-1, 8]], ["tile_ry", "sp", [-1, 1]], ["tile_rx", "sp", [-1, 1]], ["auto_unroll_max_step", "ot", 1500], ["unroll_explicit", "ot", 0], ["tile_f", "sp", [-1, 8, 4]]]}, "result": [[0.000257550752, 0.000247853048], 0, 71.62408566474915, 1634624371.9421132], "version": 0.2, "tvm_version": "0.8.dev0"}
{"input": ["cuda -keys=cuda,gpu -max_num_threads=1024 -thread_warp_size=32", "fused_conv2d_fixed_nparts", [64, 1, 7, 7, 32, 32, 3, 3, [1, 1], [1, 1]], {}], "config": {"index": 37841, "code_hash": null, "entity": [["tile_y", "sp", [-1, 7, 1, 1]], ["tile_x", "sp", [-1, 1, 1, 1]], ["tile_rc", "sp", [-1, 2]], ["tile_ry", "sp", [-1, 1]], ["tile_rx", "sp", [-1, 3]], ["auto_unroll_max_step", "ot", 1500], ["unroll_explicit", "ot", 0], ["tile_f", "sp", [-1, 2, 8]]]}, "result": [[0.000178188428, 0.00016546625399999998], 0, 80.1398766040802, 1634624380.4842842], "version": 0.2, "tvm_version": "0.8.dev0"}
{"input": ["cuda -keys=cuda,gpu -max_num_threads=1024 -thread_warp_size=32", "fused_conv2d_fixed_nparts", [64, 1, 7, 7, 32, 32, 3, 3, [1, 1], [1, 1]], {}], "config": {"index": 35792, "code_hash": null, "entity": [["tile_y", "sp", [-1, 1, 1, 1]], ["tile_x", "sp", [-1, 1, 1, 1]], ["tile_rc", "sp", [-1, 32]], ["tile_ry", "sp", [-1, 1]], ["tile_rx", "sp", [-1, 1]], ["auto_unroll_max_step", "ot", 0], ["unroll_explicit", "ot", 1], ["tile_f", "sp", [-1, 1, 8]]]}, "result": [[0.000874700839, 0.000852769011], 0, 85.52661728858948, 1634624386.1387582], "version": 0.2, "tvm_version": "0.8.dev0"}
{"input": ["cuda -keys=cuda,gpu -max_num_threads=1024 -thread_warp_size=32", "fused_conv2d_fixed_nparts", [64, 1, 7, 7, 32, 32, 3, 3, [1, 1], [1, 1]], {}], "config": {"index": 33146, "code_hash": null, "entity": [["tile_y", "sp", [-1, 1, 7, 1]], ["tile_x", "sp", [-1, 1, 7, 1]], ["tile_rc", "sp", [-1, 2]], ["tile_ry", "sp", [-1, 3]], ["tile_rx", "sp", [-1, 1]], ["auto_unroll_max_step", "ot", 1500], ["unroll_explicit", "ot", 0], ["tile_f", "sp", [-1, 8, 4]]]}, "result": [[3.726865e-05, 3.7268504e-05], 0, 82.01211380958557, 1634624382.4318657], "version": 0.2, "tvm_version": "0.8.dev0"}
{"input": ["cuda -keys=cuda,gpu -max_num_threads=1024 -thread_warp_size=32", "fused_conv2d_fixed_nparts", [64, 1, 7, 7, 32, 32, 3, 3, [1, 1], [1, 1]], {}], "config": {"index": 18160, "code_hash": null, "entity": [["tile_y", "sp", [-1, 1, 1, 1]], ["tile_x", "sp", [-1, 1, 1, 1]], ["tile_rc", "sp", [-1, 2]], ["tile_ry", "sp", [-1, 3]], ["tile_rx", "sp", [-1, 1]], ["auto_unroll_max_step", "ot", 1500], ["unroll_explicit", "ot", 1], ["tile_f", "sp", [-1, 2, 2]]]}, "result": [[0.000638858831, 0.0006042219960000001], 0, 93.05489659309387, 1634624393.2699528], "version": 0.2, "tvm_version": "0.8.dev0"}
{"input": ["cuda -keys=cuda,gpu -max_num_threads=1024 -thread_warp_size=32", "fused_conv2d_fixed_nparts", [64, 1, 7, 7, 32, 32, 3, 3, [1, 1], [1, 1]], {}], "config": {"index": 44046, "code_hash": null, "entity": [["tile_y", "sp", [-1, 1, 7, 1]], ["tile_x", "sp", [-1, 1, 1, 7]], ["tile_rc", "sp", [-1, 16]], ["tile_ry", "sp", [-1, 1]], ["tile_rx", "sp", [-1, 3]], ["auto_unroll_max_step", "ot", 0], ["unroll_explicit", "ot", 0], ["tile_f", "sp", [-1, 2, 16]]]}, "result": [[0.00027869674700000004, 0.00025473285899999996], 0, 98.95912671089172, 1634624399.689228], "version": 0.2, "tvm_version": "0.8.dev0"}
{"input": ["cuda -keys=cuda,gpu -max_num_threads=1024 -thread_warp_size=32", "fused_conv2d_fixed_nparts", [64, 1, 7, 7, 32, 32, 3, 3, [1, 1], [1, 1]], {}], "config": {"index": 5485, "code_hash": null, "entity": [["tile_y", "sp", [-1, 7, 1, 1]], ["tile_x", "sp", [-1, 1, 1, 7]], ["tile_rc", "sp", [-1, 1]], ["tile_ry", "sp", [-1, 3]], ["tile_rx", "sp", [-1, 1]], ["auto_unroll_max_step", "ot", 1500], ["unroll_explicit", "ot", 0], ["tile_f", "sp", [-1, 4, 1]]]}, "result": [[0.0007548862589999999, 0.00072835936], 0, 102.85184574127197, 1634624403.2148893], "version": 0.2, "tvm_version": "0.8.dev0"}
{"input": ["cuda -keys=cuda,gpu -max_num_threads=1024 -thread_warp_size=32", "fused_conv2d_fixed_nparts", [64, 1, 7, 7, 32, 32, 3, 3, [1, 1], [1, 1]], {}], "config": {"index": 45208, "code_hash": null, "entity": [["tile_y", "sp", [-1, 1, 1, 1]], ["tile_x", "sp", [-1, 1, 7, 1]], ["tile_rc", "sp", [-1, 32]], ["tile_ry", "sp", [-1, 1]], ["tile_rx", "sp", [-1, 3]], ["auto_unroll_max_step", "ot", 0], ["unroll_explicit", "ot", 1], ["tile_f", "sp", [-1, 2, 16]]]}, "result": [[0.00023144769400000001, 0.000218115485], 0, 104.56724643707275, 1634624405.357034], "version": 0.2, "tvm_version": "0.8.dev0"}
{"input": ["cuda -keys=cuda,gpu -max_num_threads=1024 -thread_warp_size=32", "fused_conv2d_fixed_nparts", [64, 1, 7, 7, 32, 32, 3, 3, [1, 1], [1, 1]], {}], "config": {"index": 9241, "code_hash": null, "entity": [["tile_y", "sp", [-1, 7, 1, 1]], ["tile_x", "sp", [-1, 1, 7, 1]], ["tile_rc", "sp", [-1, 2]], ["tile_ry", "sp", [-1, 1]], ["tile_rx", "sp", [-1, 1]], ["auto_unroll_max_step", "ot", 0], ["unroll_explicit", "ot", 0], ["tile_f", "sp", [-1, 16, 1]]]}, "result": [[5.8522399000000005e-05, 5.8529301e-05], 0, 106.44717144966125, 1634624407.1933775], "version": 0.2, "tvm_version": "0.8.dev0"}
{"input": ["cuda -keys=cuda,gpu -max_num_threads=1024 -thread_warp_size=32", "fused_conv2d_fixed_nparts", [64, 1, 7, 7, 32, 32, 3, 3, [1, 1], [1, 1]], {}], "config": {"index": 39572, "code_hash": null, "entity": [["tile_y", "sp", [-1, 1, 1, 1]], ["tile_x", "sp", [-1, 7, 1, 1]], ["tile_rc", "sp", [-1, 2]], ["tile_ry", "sp", [-1, 1]], ["tile_rx", "sp", [-1, 1]], ["auto_unroll_max_step", "ot", 512], ["unroll_explicit", "ot", 0], ["tile_f", "sp", [-1, 4, 8]]]}, "result": [[0.00017095339000000001, 0.00015616418999999998], 0, 17.680238246917725, 1634624430.8913314], "version": 0.2, "tvm_version": "0.8.dev0"}
{"input": ["cuda -keys=cuda,gpu -max_num_threads=1024 -thread_warp_size=32", "fused_conv2d_fixed_nparts", [64, 1, 7, 7, 32, 32, 3, 3, [1, 1], [1, 1]], {}], "config": {"index": 3016, "code_hash": null, "entity": [["tile_y", "sp", [-1, 1, 1, 1]], ["tile_x", "sp", [-1, 1, 7, 1]], ["tile_rc", "sp", [-1, 4]], ["tile_ry", "sp", [-1, 3]], ["tile_rx", "sp", [-1, 3]], ["auto_unroll_max_step", "ot", 512], ["unroll_explicit", "ot", 0], ["tile_f", "sp", [-1, 2, 1]]]}, "result": [[8.8057454e-05, 8.8044231e-05], 0, 5.754450559616089, 1634624418.4622517], "version": 0.2, "tvm_version": "0.8.dev0"}
{"input": ["cuda -keys=cuda,gpu -max_num_threads=1024 -thread_warp_size=32", "fused_conv2d_fixed_nparts", [64, 1, 7, 7, 32, 32, 3, 3, [1, 1], [1, 1]], {}], "config": {"index": 38850, "code_hash": null, "entity": [["tile_y", "sp", [-1, 1, 7, 1]], ["tile_x", "sp", [-1, 1, 1, 1]], ["tile_rc", "sp", [-1, 16]], ["tile_ry", "sp", [-1, 1]], ["tile_rx", "sp", [-1, 1]], ["auto_unroll_max_step", "ot", 1500], ["unroll_explicit", "ot", 1], ["tile_f", "sp", [-1, 2, 8]]]}, "result": [[8.4728816e-05, 8.4630284e-05], 0, 4.185922622680664, 1634624416.3011827], "version": 0.2, "tvm_version": "0.8.dev0"}
{"input": ["cuda -keys=cuda,gpu -max_num_threads=1024 -thread_warp_size=32", "fused_conv2d_fixed_nparts", [64, 1, 7, 7, 32, 32, 3, 3, [1, 1], [1, 1]], {}], "config": {"index": 9556, "code_hash": null, "entity": [["tile_y", "sp", [-1, 1, 1, 1]], ["tile_x", "sp", [-1, 7, 1, 1]], ["tile_rc", "sp", [-1, 8]], ["tile_ry", "sp", [-1, 3]], ["tile_rx", "sp", [-1, 3]], ["auto_unroll_max_step", "ot", 0], ["unroll_explicit", "ot", 0], ["tile_f", "sp", [-1, 16, 1]]]}, "result": [[8.061924100000001e-05, 8.0654536e-05], 0, 15.491886138916016, 1634624428.689822], "version": 0.2, "tvm_version": "0.8.dev0"}
{"input": ["cuda -keys=cuda,gpu -max_num_threads=1024 -thread_warp_size=32", "fused_conv2d_fixed_nparts", [64, 1, 7, 7, 32, 32, 3, 3, [1, 1], [1, 1]], {}], "config": {"index": 5316, "code_hash": null, "entity": [["tile_y", "sp", [-1, 1, 1, 1]], ["tile_x", "sp", [-1, 7, 1, 1]], ["tile_rc", "sp", [-1, 4]], ["tile_ry", "sp", [-1, 3]], ["tile_rx", "sp", [-1, 3]], ["auto_unroll_max_step", "ot", 512], ["unroll_explicit", "ot", 0], ["tile_f", "sp", [-1, 4, 1]]]}, "result": [[0.00011056729699999999, 0.00010631798499999999], 0, 20.024533987045288, 1634624432.905487], "version": 0.2, "tvm_version": "0.8.dev0"}
{"input": ["cuda -keys=cuda,gpu -max_num_threads=1024 -thread_warp_size=32", "fused_conv2d_fixed_nparts", [64, 1, 7, 7, 32, 32, 3, 3, [1, 1], [1, 1]], {}], "config": {"index": 45118, "code_hash": null, "entity": [["tile_y", "sp", [-1, 1, 7, 1]], ["tile_x", "sp", [-1, 1, 1, 7]], ["tile_rc", "sp", [-1, 32]], ["tile_ry", "sp", [-1, 3]], ["tile_rx", "sp", [-1, 1]], ["auto_unroll_max_step", "ot", 0], ["unroll_explicit", "ot", 1], ["tile_f", "sp", [-1, 2, 16]]]}, "result": [[0.000305658123, 0.000287909405], 0, 28.67991805076599, 1634624441.8906462], "version": 0.2, "tvm_version": "0.8.dev0"}
{"input": ["cuda -keys=cuda,gpu -max_num_threads=1024 -thread_warp_size=32", "fused_conv2d_fixed_nparts", [64, 1, 7, 7, 32, 32, 3, 3, [1, 1], [1, 1]], {}], "config": {"index": 6975, "code_hash": null, "entity": [["tile_y", "sp", [-1, 1, 1, 7]], ["tile_x", "sp", [-1, 1, 1, 7]], ["tile_rc", "sp", [-1, 8]], ["tile_ry", "sp", [-1, 1]], ["tile_rx", "sp", [-1, 1]], ["auto_unroll_max_step", "ot", 0], ["unroll_explicit", "ot", 0], ["tile_f", "sp", [-1, 8, 1]]]}, "result": [[0.000250206642, 0.00024070181], 0, 26.39928388595581, 1634624439.57624], "version": 0.2, "tvm_version": "0.8.dev0"}
{"input": ["cuda -keys=cuda,gpu -max_num_threads=1024 -thread_warp_size=32", "fused_conv2d_fixed_nparts", [64, 1, 7, 7, 32, 32, 3, 3, [1, 1], [1, 1]], {}], "config": {"index": 46985, "code_hash": null, "entity": [["tile_y", "sp", [-1, 7, 1, 1]], ["tile_x", "sp", [-1, 1, 7, 1]], ["tile_rc", "sp", [-1, 4]], ["tile_ry", "sp", [-1, 3]], ["tile_rx", "sp", [-1, 1]], ["auto_unroll_max_step", "ot", 1500], ["unroll_explicit", "ot", 0], ["tile_f", "sp", [-1, 1, 32]]]}, "result": [[0.000648705058, 0.0006332349420000001], 0, 33.271403074264526, 1634624446.0514476], "version": 0.2, "tvm_version": "0.8.dev0"}
{"input": ["cuda -keys=cuda,gpu -max_num_threads=1024 -thread_warp_size=32", "fused_conv2d_fixed_nparts", [64, 1, 7, 7, 32, 32, 3, 3, [1, 1], [1, 1]], {}], "config": {"index": 39098, "code_hash": null, "entity": [["tile_y", "sp", [-1, 1, 7, 1]], ["tile_x", "sp", [-1, 1, 7, 1]], ["tile_rc", "sp", [-1, 2]], ["tile_ry", "sp", [-1, 3]], ["tile_rx", "sp", [-1, 3]], ["auto_unroll_max_step", "ot", 1500], ["unroll_explicit", "ot", 1], ["tile_f", "sp", [-1, 2, 8]]]}, "result": [[3.3486188e-05, 3.3482562e-05], 0, 34.76078200340271, 1634624447.8532438], "version": 0.2, "tvm_version": "0.8.dev0"}
{"input": ["cuda -keys=cuda,gpu -max_num_threads=1024 -thread_warp_size=32", "fused_conv2d_fixed_nparts", [64, 1, 7, 7, 32, 32, 3, 3, [1, 1], [1, 1]], {}], "config": {"index": 23565, "code_hash": null, "entity": [["tile_y", "sp", [-1, 7, 1, 1]], ["tile_x", "sp", [-1, 1, 1, 7]], ["tile_rc", "sp", [-1, 4]], ["tile_ry", "sp", [-1, 3]], ["tile_rx", "sp", [-1, 1]], ["auto_unroll_max_step", "ot", 512], ["unroll_explicit", "ot", 0], ["tile_f", "sp", [-1, 16, 2]]]}, "result": [[0.000164479029, 0.000156375817], 0, 37.232304096221924, 1634624450.4559934], "version": 0.2, "tvm_version": "0.8.dev0"}
{"input": ["cuda -keys=cuda,gpu -max_num_threads=1024 -thread_warp_size=32", "fused_conv2d_fixed_nparts", [64, 1, 7, 7, 32, 32, 3, 3, [1, 1], [1, 1]], {}], "config": {"index": 7471, "code_hash": null, "entity": [["tile_y", "sp", [-1, 1, 1, 7]], ["tile_x", "sp", [-1, 1, 1, 7]], ["tile_rc", "sp", [-1, 16]], ["tile_ry", "sp", [-1, 3]], ["tile_rx", "sp", [-1, 1]], ["auto_unroll_max_step", "ot", 512], ["unroll_explicit", "ot", 0], ["tile_f", "sp", [-1, 8, 1]]]}, "result": [[0.000193272108, 0.00017919217699999997], 0, 48.041388750076294, 1634624461.0125885], "version": 0.2, "tvm_version": "0.8.dev0"}
{"input": ["cuda -keys=cuda,gpu -max_num_threads=1024 -thread_warp_size=32", "fused_conv2d_fixed_nparts", [64, 1, 7, 7, 32, 32, 3, 3, [1, 1], [1, 1]], {}], "config": {"index": 40000, "code_hash": null, "entity": [["tile_y", "sp", [-1, 1, 1, 1]], ["tile_x", "sp", [-1, 1, 1, 1]], ["tile_rc", "sp", [-1, 16]], ["tile_ry", "sp", [-1, 1]], ["tile_rx", "sp", [-1, 1]], ["auto_unroll_max_step", "ot", 1500], ["unroll_explicit", "ot", 0], ["tile_f", "sp", [-1, 4, 8]]]}, "result": [[0.000632811485, 0.000610112794], 0, 51.33539032936096, 1634624464.2728913], "version": 0.2, "tvm_version": "0.8.dev0"}
{"input": ["cuda -keys=cuda,gpu -max_num_threads=1024 -thread_warp_size=32", "fused_conv2d_fixed_nparts", [64, 1, 7, 7, 32, 32, 3, 3, [1, 1], [1, 1]], {}], "config": {"index": 9479, "code_hash": null, "entity": [["tile_y", "sp", [-1, 1, 1, 7]], ["tile_x", "sp", [-1, 7, 1, 1]], ["tile_rc", "sp", [-1, 16]], ["tile_ry", "sp", [-1, 1]], ["tile_rx", "sp", [-1, 3]], ["auto_unroll_max_step", "ot", 0], ["unroll_explicit", "ot", 0], ["tile_f", "sp", [-1, 16, 1]]]}, "result": [[9.051455300000001e-05, 8.7646515e-05], 0, 61.18202567100525, 1634624474.5955877], "version": 0.2, "tvm_version": "0.8.dev0"}
{"input": ["cuda -keys=cuda,gpu -max_num_threads=1024 -thread_warp_size=32", "fused_conv2d_fixed_nparts", [64, 1, 7, 7, 32, 32, 3, 3, [1, 1], [1, 1]], {}], "config": {"index": 23581, "code_hash": null, "entity": [["tile_y", "sp", [-1, 7, 1, 1]], ["tile_x", "sp", [-1, 1, 1, 7]], ["tile_rc", "sp", [-1, 8]], ["tile_ry", "sp", [-1, 3]], ["tile_rx", "sp", [-1, 1]], ["auto_unroll_max_step", "ot", 512], ["unroll_explicit", "ot", 0], ["tile_f", "sp", [-1, 16, 2]]]}, "result": [[0.00018044782300000002, 0.000165130729], 0, 74.32200026512146, 1634624487.6317904], "version": 0.2, "tvm_version": "0.8.dev0"}
{"input": ["cuda -keys=cuda,gpu -max_num_threads=1024 -thread_warp_size=32", "fused_conv2d_fixed_nparts", [64, 1, 7, 7, 32, 32, 3, 3, [1, 1], [1, 1]], {}], "config": {"index": 43282, "code_hash": null, "entity": [["tile_y", "sp", [-1, 1, 7, 1]], ["tile_x", "sp", [-1, 1, 1, 1]], ["tile_rc", "sp", [-1, 32]], ["tile_ry", "sp", [-1, 1]], ["tile_rx", "sp", [-1, 3]], ["auto_unroll_max_step", "ot", 512], ["unroll_explicit", "ot", 1], ["tile_f", "sp", [-1, 1, 16]]]}, "result": [[0.000298390653, 0.00027762832], 0, 70.66869735717773, 1634624482.7813792], "version": 0.2, "tvm_version": "0.8.dev0"}
{"input": ["cuda -keys=cuda,gpu -max_num_threads=1024 -thread_warp_size=32", "fused_conv2d_fixed_nparts", [64, 1, 7, 7, 32, 32, 3, 3, [1, 1], [1, 1]], {}], "config": {"index": 14793, "code_hash": null, "entity": [["tile_y", "sp", [-1, 7, 1, 1]], ["tile_x", "sp", [-1, 1, 7, 1]], ["tile_rc", "sp", [-1, 1]], ["tile_ry", "sp", [-1, 1]], ["tile_rx", "sp", [-1, 3]], ["auto_unroll_max_step", "ot", 1500], ["unroll_explicit", "ot", 0], ["tile_f", "sp", [-1, 1, 2]]]}, "result": [[0.00028593533000000006, 0.00026857998], 0, 71.81001114845276, 1634624485.177873], "version": 0.2, "tvm_version": "0.8.dev0"}
{"input": ["cuda -keys=cuda,gpu -max_num_threads=1024 -thread_warp_size=32", "fused_conv2d_fixed_nparts", [64, 1, 7, 7, 32, 32, 3, 3, [1, 1], [1, 1]], {}], "config": {"index": 18258, "code_hash": null, "entity": [["tile_y", "sp", [-1, 1, 7, 1]], ["tile_x", "sp", [-1, 1, 1, 1]], ["tile_rc", "sp", [-1, 2]], ["tile_ry", "sp", [-1, 1]], ["tile_rx", "sp", [-1, 3]], ["auto_unroll_max_step", "ot", 1500], ["unroll_explicit", "ot", 1], ["tile_f", "sp", [-1, 2, 2]]]}, "result": [[6.3395541e-05, 6.1044231e-05], 0, 76.19587087631226, 1634624489.5164125], "version": 0.2, "tvm_version": "0.8.dev0"}
{"input": ["cuda -keys=cuda,gpu -max_num_threads=1024 -thread_warp_size=32", "fused_conv2d_fixed_nparts", [64, 1, 7, 7, 32, 32, 3, 3, [1, 1], [1, 1]], {}], "config": {"index": 25536, "code_hash": null, "entity": [["tile_y", "sp", [-1, 1, 1, 1]], ["tile_x", "sp", [-1, 1, 1, 1]], ["tile_rc", "sp", [-1, 1]], ["tile_ry", "sp", [-1, 1]], ["tile_rx", "sp", [-1, 3]], ["auto_unroll_max_step", "ot", 0], ["unroll_explicit", "ot", 0], ["tile_f", "sp", [-1, 1, 4]]]}, "result": [[0.000861014674, 0.0008383321029999999], 0, 64.57768249511719, 1634624478.1336806], "version": 0.2, "tvm_version": "0.8.dev0"}
{"input": ["cuda -keys=cuda,gpu -max_num_threads=1024 -thread_warp_size=32", "fused_conv2d_fixed_nparts", [64, 1, 7, 7, 32, 32, 3, 3, [1, 1], [1, 1]], {}], "config": {"index": 34056, "code_hash": null, "entity": [["tile_y", "sp", [-1, 1, 1, 1]], ["tile_x", "sp", [-1, 1, 7, 1]], ["tile_rc", "sp", [-1, 16]], ["tile_ry", "sp", [-1, 1]], ["tile_rx", "sp", [-1, 3]], ["auto_unroll_max_step", "ot", 512], ["unroll_explicit", "ot", 1], ["tile_f", "sp", [-1, 8, 4]]]}, "result": [[6.8435541e-05, 6.8432966e-05], 0, 66.7041916847229, 1634624480.0746539], "version": 0.2, "tvm_version": "0.8.dev0"}
{"input": ["cuda -keys=cuda,gpu -max_num_threads=1024 -thread_warp_size=32", "fused_conv2d_fixed_nparts", [64, 1, 7, 7, 32, 32, 3, 3, [1, 1], [1, 1]], {}], "config": {"index": 15210, "code_hash": null, "entity": [["tile_y", "sp", [-1, 1, 7, 1]], ["tile_x", "sp", [-1, 1, 7, 1]], ["tile_rc", "sp", [-1, 4]], ["tile_ry", "sp", [-1, 1]], ["tile_rx", "sp", [-1, 3]], ["auto_unroll_max_step", "ot", 0], ["unroll_explicit", "ot", 1], ["tile_f", "sp", [-1, 1, 2]]]}, "result": [[0.00010726612700000001, 0.000103233457], 0, 88.03854870796204, 1634624501.6568062], "version": 0.2, "tvm_version": "0.8.dev0"}
{"input": ["cuda -keys=cuda,gpu -max_num_threads=1024 -thread_warp_size=32", "fused_conv2d_fixed_nparts", [64, 1, 7, 7, 32, 32, 3, 3, [1, 1], [1, 1]], {}], "config": {"index": 26512, "code_hash": null, "entity": [["tile_y", "sp", [-1, 1, 1, 1]], ["tile_x", "sp", [-1, 1, 1, 1]], ["tile_rc", "sp", [-1, 2]], ["tile_ry", "sp", [-1, 1]], ["tile_rx", "sp", [-1, 1]], ["auto_unroll_max_step", "ot", 0], ["unroll_explicit", "ot", 1], ["tile_f", "sp", [-1, 1, 4]]]}, "result": [[0.0009218872380000001, 0.0008936143019999999], 0, 97.78701639175415, 1634624511.449764], "version": 0.2, "tvm_version": "0.8.dev0"}
{"input": ["cuda -keys=cuda,gpu -max_num_threads=1024 -thread_warp_size=32", "fused_conv2d_fixed_nparts", [64, 1, 7, 7, 32, 32, 3, 3, [1, 1], [1, 1]], {}], "config": {"index": 9425, "code_hash": null, "entity": [["tile_y", "sp", [-1, 7, 1, 1]], ["tile_x", "sp", [-1, 1, 1, 1]], ["tile_rc", "sp", [-1, 2]], ["tile_ry", "sp", [-1, 1]], ["tile_rx", "sp", [-1, 3]], ["auto_unroll_max_step", "ot", 0], ["unroll_explicit", "ot", 0], ["tile_f", "sp", [-1, 16, 1]]]}, "result": [[6.870653299999999e-05, 6.847154000000001e-05], 0, 82.13844919204712, 1634624495.793365], "version": 0.2, "tvm_version": "0.8.dev0"}
{"input": ["cuda -keys=cuda,gpu -max_num_threads=1024 -thread_warp_size=32", "fused_conv2d_fixed_nparts", [64, 1, 7, 7, 32, 32, 3, 3, [1, 1], [1, 1]], {}], "config": {"index": 30386, "code_hash": null, "entity": [["tile_y", "sp", [-1, 1, 7, 1]], ["tile_x", "sp", [-1, 1, 1, 1]], ["tile_rc", "sp", [-1, 8]], ["tile_ry", "sp", [-1, 1]], ["tile_rx", "sp", [-1, 1]], ["auto_unroll_max_step", "ot", 512], ["unroll_explicit", "ot", 0], ["tile_f", "sp", [-1, 4, 4]]]}, "result": [[7.041202699999999e-05, 7.0417648e-05], 0, 84.21108531951904, 1634624497.7631764], "version": 0.2, "tvm_version": "0.8.dev0"}
{"input": ["cuda -keys=cuda,gpu -max_num_threads=1024 -thread_warp_size=32", "fused_conv2d_fixed_nparts", [64, 1, 7, 7, 32, 32, 3, 3, [1, 1], [1, 1]], {}], "config": {"index": 29754, "code_hash": null, "entity": [["tile_y", "sp", [-1, 1, 7, 1]], ["tile_x", "sp", [-1, 1, 7, 1]], ["tile_rc", "sp", [-1, 32]], ["tile_ry", "sp", [-1, 3]], ["tile_rx", "sp", [-1, 1]], ["auto_unroll_max_step", "ot", 1500], ["unroll_explicit", "ot", 1], ["tile_f", "sp", [-1, 2, 4]]]}, "result": [[4.8858173999999995e-05, 4.8867622e-05], 0, 94.24698209762573, 1634624507.6544054], "version": 0.2, "tvm_version": "0.8.dev0"}
{"input": ["cuda -keys=cuda,gpu -max_num_threads=1024 -thread_warp_size=32", "fused_conv2d_fixed_nparts", [64, 1, 7, 7, 32, 32, 3, 3, [1, 1], [1, 1]], {}], "config": {"index": 4268, "code_hash": null, "entity": [["tile_y", "sp", [-1, 1, 1, 1]], ["tile_x", "sp", [-1, 1, 1, 7]], ["tile_rc", "sp", [-1, 4]], ["tile_ry", "sp", [-1, 1]], ["tile_rx", "sp", [-1, 1]], ["auto_unroll_max_step", "ot", 1500], ["unroll_explicit", "ot", 1], ["tile_f", "sp", [-1, 2, 1]]]}, "result": [[0.00017019501500000001, 0.00015934937], 0, 104.55220365524292, 1634624517.8560655], "version": 0.2, "tvm_version": "0.8.dev0"}
{"input": ["cuda -keys=cuda,gpu -max_num_threads=1024 -thread_warp_size=32", "fused_conv2d_fixed_nparts", [64, 1, 7, 7, 32, 32, 3, 3, [1, 1], [1, 1]], {}], "config": {"index": 4322, "code_hash": null, "entity": [["tile_y", "sp", [-1, 1, 7, 1]], ["tile_x", "sp", [-1, 1, 1, 1]], ["tile_rc", "sp", [-1, 1]], ["tile_ry", "sp", [-1, 3]], ["tile_rx", "sp", [-1, 1]], ["auto_unroll_max_step", "ot", 1500], ["unroll_explicit", "ot", 1], ["tile_f", "sp", [-1, 2, 1]]]}, "result": [[7.8490415e-05, 7.4192895e-05], 0, 99.7373354434967, 1634624513.3600075], "version": 0.2, "tvm_version": "0.8.dev0"}
{"input": ["cuda -keys=cuda,gpu -max_num_threads=1024 -thread_warp_size=32", "fused_conv2d_fixed_nparts", [64, 1, 7, 7, 32, 32, 3, 3, [1, 1], [1, 1]], {}], "config": {"index": 40252, "code_hash": null, "entity": [["tile_y", "sp", [-1, 1, 1, 1]], ["tile_x", "sp", [-1, 1, 1, 7]], ["tile_rc", "sp", [-1, 2]], ["tile_ry", "sp", [-1, 3]], ["tile_rx", "sp", [-1, 3]], ["auto_unroll_max_step", "ot", 1500], ["unroll_explicit", "ot", 0], ["tile_f", "sp", [-1, 4, 8]]]}, "result": [[0.00014331368, 0.000131683422], 0, 102.05721759796143, 1634624515.501323], "version": 0.2, "tvm_version": "0.8.dev0"}
{"input": ["cuda -keys=cuda,gpu -max_num_threads=1024 -thread_warp_size=32", "fused_conv2d_fixed_nparts", [64, 1, 7, 7, 32, 32, 3, 3, [1, 1], [1, 1]], {}], "config": {"index": 20070, "code_hash": null, "entity": [["tile_y", "sp", [-1, 1, 7, 1]], ["tile_x", "sp", [-1, 7, 1, 1]], ["tile_rc", "sp", [-1, 1]], ["tile_ry", "sp", [-1, 3]], ["tile_rx", "sp", [-1, 1]], ["auto_unroll_max_step", "ot", 512], ["unroll_explicit", "ot", 1], ["tile_f", "sp", [-1, 4, 2]]]}, "result": [[0.000151481428, 0.000140645565], 0, 112.52385210990906, 1634624526.1694617], "version": 0.2, "tvm_version": "0.8.dev0"}
{"input": ["cuda -keys=cuda,gpu -max_num_threads=1024 -thread_warp_size=32", "fused_conv2d_fixed_nparts", [64, 1, 7, 7, 32, 32, 3, 3, [1, 1], [1, 1]], {}], "config": {"index": 11541, "code_hash": null, "entity": [["tile_y", "sp", [-1, 7, 1, 1]], ["tile_x", "sp", [-1, 7, 1, 1]], ["tile_rc", "sp", [-1, 2]], ["tile_ry", "sp", [-1, 1]], ["tile_rx", "sp", [-1, 1]], ["auto_unroll_max_step", "ot", 0], ["unroll_explicit", "ot", 0], ["tile_f", "sp", [-1, 32, 1]]]}, "result": [[0.000175163058, 0.000162614525], 0, 110.42217016220093, 1634624524.139903], "version": 0.2, "tvm_version": "0.8.dev0"}
{"input": ["cuda -keys=cuda,gpu -max_num_threads=1024 -thread_warp_size=32", "fused_conv2d_fixed_nparts", [64, 1, 7, 7, 32, 32, 3, 3, [1, 1], [1, 1]], {}], "config": {"index": 24857, "code_hash": null, "entity": [["tile_y", "sp", [-1, 7, 1, 1]], ["tile_x", "sp", [-1, 1, 7, 1]], ["tile_rc", "sp", [-1, 32]], ["tile_ry", "sp", [-1, 1]], ["tile_rx", "sp", [-1, 3]], ["auto_unroll_max_step", "ot", 512], ["unroll_explicit", "ot", 1], ["tile_f", "sp", [-1, 16, 2]]]}, "result": [[3.4272505e-05, 3.4267867e-05], 0, 114.28823518753052, 1634624527.9661684], "version": 0.2, "tvm_version": "0.8.dev0"}
{"input": ["cuda -keys=cuda,gpu -max_num_threads=1024 -thread_warp_size=32", "fused_conv2d_fixed_nparts", [64, 1, 7, 7, 32, 32, 3, 3, [1, 1], [1, 1]], {}], "config": {"index": 33178, "code_hash": null, "entity": [["tile_y", "sp", [-1, 1, 7, 1]], ["tile_x", "sp", [-1, 1, 7, 1]], ["tile_rc", "sp", [-1, 8]], ["tile_ry", "sp", [-1, 3]], ["tile_rx", "sp", [-1, 1]], ["auto_unroll_max_step", "ot", 1500], ["unroll_explicit", "ot", 0], ["tile_f", "sp", [-1, 8, 4]]]}, "result": [[3.0324518e-05, 3.0306107000000004e-05], 0, 5.9103004932403564, 1634624556.9898427], "version": 0.2, "tvm_version": "0.8.dev0"}
{"input": ["cuda -keys=cuda,gpu -max_num_threads=1024 -thread_warp_size=32", "fused_conv2d_fixed_nparts", [64, 1, 7, 7, 32, 32, 3, 3, [1, 1], [1, 1]], {}], "config": {"index": 21818, "code_hash": null, "entity": [["tile_y", "sp", [-1, 1, 7, 1]], ["tile_x", "sp", [-1, 1, 7, 1]], ["tile_rc", "sp", [-1, 2]], ["tile_ry", "sp", [-1, 3]], ["tile_rx", "sp", [-1, 3]], ["auto_unroll_max_step", "ot", 1500], ["unroll_explicit", "ot", 0], ["tile_f", "sp", [-1, 8, 2]]]}, "result": [[3.3938086e-05, 3.3940130000000006e-05], 0, 7.788880109786987, 1634624558.9283023], "version": 0.2, "tvm_version": "0.8.dev0"}
{"input": ["cuda -keys=cuda,gpu -max_num_threads=1024 -thread_warp_size=32", "fused_conv2d_fixed_nparts", [64, 1, 7, 7, 32, 32, 3, 3, [1, 1], [1, 1]], {}], "config": {"index": 34330, "code_hash": null, "entity": [["tile_y", "sp", [-1, 1, 7, 1]], ["tile_x", "sp", [-1, 1, 7, 1]], ["tile_rc", "sp", [-1, 8]], ["tile_ry", "sp", [-1, 3]], ["tile_rx", "sp", [-1, 1]], ["auto_unroll_max_step", "ot", 1500], ["unroll_explicit", "ot", 1], ["tile_f", "sp", [-1, 8, 4]]]}, "result": [[3.0066265e-05, 3.005062e-05], 0, 3.0173492431640625, 1634624553.4292333], "version": 0.2, "tvm_version": "0.8.dev0"}
{"input": ["cuda -keys=cuda,gpu -max_num_threads=1024 -thread_warp_size=32", "fused_conv2d_fixed_nparts", [64, 1, 7, 7, 32, 32, 3, 3, [1, 1], [1, 1]], {}], "config": {"index": 21434, "code_hash": null, "entity": [["tile_y", "sp", [-1, 1, 7, 1]], ["tile_x", "sp", [-1, 1, 7, 1]], ["tile_rc", "sp", [-1, 2]], ["tile_ry", "sp", [-1, 3]], ["tile_rx", "sp", [-1, 3]], ["auto_unroll_max_step", "ot", 512], ["unroll_explicit", "ot", 0], ["tile_f", "sp", [-1, 8, 2]]]}, "result": [[3.1922330999999996e-05, 3.1927781000000004e-05], 0, 11.174971103668213, 1634624562.601795], "version": 0.2, "tvm_version": "0.8.dev0"}
{"input": ["cuda -keys=cuda,gpu -max_num_threads=1024 -thread_warp_size=32", "fused_conv2d_fixed_nparts", [64, 1, 7, 7, 32, 32, 3, 3, [1, 1], [1, 1]], {}], "config": {"index": 22970, "code_hash": null, "entity": [["tile_y", "sp", [-1, 1, 7, 1]], ["tile_x", "sp", [-1, 1, 7, 1]], ["tile_rc", "sp", [-1, 2]], ["tile_ry", "sp", [-1, 3]], ["tile_rx", "sp", [-1, 3]], ["auto_unroll_max_step", "ot", 1500], ["unroll_explicit", "ot", 1], ["tile_f", "sp", [-1, 8, 2]]]}, "result": [[3.3738461e-05, 3.373623e-05], 0, 10.445071697235107, 1634624560.8306305], "version": 0.2, "tvm_version": "0.8.dev0"}
{"input": ["cuda -keys=cuda,gpu -max_num_threads=1024 -thread_warp_size=32", "fused_conv2d_fixed_nparts", [64, 1, 7, 7, 32, 32, 3, 3, [1, 1], [1, 1]], {}], "config": {"index": 21050, "code_hash": null, "entity": [["tile_y", "sp", [-1, 1, 7, 1]], ["tile_x", "sp", [-1, 1, 7, 1]], ["tile_rc", "sp", [-1, 2]], ["tile_ry", "sp", [-1, 3]], ["tile_rx", "sp", [-1, 3]], ["auto_unroll_max_step", "ot", 0], ["unroll_explicit", "ot", 0], ["tile_f", "sp", [-1, 8, 2]]]}, "result": [[3.1953166e-05, 3.1973796e-05], 0, 3.7797319889068604, 1634624555.1366656], "version": 0.2, "tvm_version": "0.8.dev0"}
{"input": ["cuda -keys=cuda,gpu -max_num_threads=1024 -thread_warp_size=32", "fused_conv2d_fixed_nparts", [64, 1, 7, 7, 32, 32, 3, 3, [1, 1], [1, 1]], {}], "config": {"index": 32186, "code_hash": null, "entity": [["tile_y", "sp", [-1, 1, 7, 1]], ["tile_x", "sp", [-1, 1, 7, 1]], ["tile_rc", "sp", [-1, 2]], ["tile_ry", "sp", [-1, 3]], ["tile_rx", "sp", [-1, 3]], ["auto_unroll_max_step", "ot", 1500], ["unroll_explicit", "ot", 1], ["tile_f", "sp", [-1, 4, 4]]]}, "result": [[2.6653799e-05, 2.6637429e-05], 0, 14.80303430557251, 1634624566.1676695], "version": 0.2, "tvm_version": "0.8.dev0"}
{"input": ["cuda -keys=cuda,gpu -max_num_threads=1024 -thread_warp_size=32", "fused_conv2d_fixed_nparts", [64, 1, 7, 7, 32, 32, 3, 3, [1, 1], [1, 1]], {}], "config": {"index": 31034, "code_hash": null, "entity": [["tile_y", "sp", [-1, 1, 7, 1]], ["tile_x", "sp", [-1, 1, 7, 1]], ["tile_rc", "sp", [-1, 2]], ["tile_ry", "sp", [-1, 3]], ["tile_rx", "sp", [-1, 3]], ["auto_unroll_max_step", "ot", 1500], ["unroll_explicit", "ot", 0], ["tile_f", "sp", [-1, 4, 4]]]}, "result": [[2.6679636e-05, 2.6675958000000002e-05], 0, 12.939194679260254, 1634624564.35538], "version": 0.2, "tvm_version": "0.8.dev0"}
{"input": ["cuda -keys=cuda,gpu -max_num_threads=1024 -thread_warp_size=32", "fused_conv2d_fixed_nparts", [64, 1, 7, 7, 32, 32, 3, 3, [1, 1], [1, 1]], {}], "config": {"index": 21754, "code_hash": null, "entity": [["tile_y", "sp", [-1, 1, 7, 1]], ["tile_x", "sp", [-1, 1, 7, 1]], ["tile_rc", "sp", [-1, 8]], ["tile_ry", "sp", [-1, 1]], ["tile_rx", "sp", [-1, 3]], ["auto_unroll_max_step", "ot", 1500], ["unroll_explicit", "ot", 0], ["tile_f", "sp", [-1, 8, 2]]]}, "result": [[2.8803999e-05, 2.8814296e-05], 0, 16.853914737701416, 1634624568.041426], "version": 0.2, "tvm_version": "0.8.dev0"}
{"input": ["cuda -keys=cuda,gpu -max_num_threads=1024 -thread_warp_size=32", "fused_conv2d_fixed_nparts", [64, 1, 7, 7, 32, 32, 3, 3, [1, 1], [1, 1]], {}], "config": {"index": 22586, "code_hash": null, "entity": [["tile_y", "sp", [-1, 1, 7, 1]], ["tile_x", "sp", [-1, 1, 7, 1]], ["tile_rc", "sp", [-1, 2]], ["tile_ry", "sp", [-1, 3]], ["tile_rx", "sp", [-1, 3]], ["auto_unroll_max_step", "ot", 512], ["unroll_explicit", "ot", 1], ["tile_f", "sp", [-1, 8, 2]]]}, "result": [[3.1893158999999996e-05, 3.1902836e-05], 0, 18.31405997276306, 1634624569.7898505], "version": 0.2, "tvm_version": "0.8.dev0"}
{"input": ["cuda -keys=cuda,gpu -max_num_threads=1024 -thread_warp_size=32", "fused_conv2d_fixed_nparts", [64, 1, 7, 7, 32, 32, 3, 3, [1, 1], [1, 1]], {}], "config": {"index": 31802, "code_hash": null, "entity": [["tile_y", "sp", [-1, 1, 7, 1]], ["tile_x", "sp", [-1, 1, 7, 1]], ["tile_rc", "sp", [-1, 2]], ["tile_ry", "sp", [-1, 3]], ["tile_rx", "sp", [-1, 3]], ["auto_unroll_max_step", "ot", 512], ["unroll_explicit", "ot", 1], ["tile_f", "sp", [-1, 4, 4]]]}, "result": [[2.6550451e-05, 2.6553970999999998e-05], 0, 21.7656307220459, 1634624573.2219], "version": 0.2, "tvm_version": "0.8.dev0"}
{"input": ["cuda -keys=cuda,gpu -max_num_threads=1024 -thread_warp_size=32", "fused_conv2d_fixed_nparts", [64, 1, 7, 7, 32, 32, 3, 3, [1, 1], [1, 1]], {}], "config": {"index": 30650, "code_hash": null, "entity": [["tile_y", "sp", [-1, 1, 7, 1]], ["tile_x", "sp", [-1, 1, 7, 1]], ["tile_rc", "sp", [-1, 2]], ["tile_ry", "sp", [-1, 3]], ["tile_rx", "sp", [-1, 3]], ["auto_unroll_max_step", "ot", 512], ["unroll_explicit", "ot", 0], ["tile_f", "sp", [-1, 4, 4]]]}, "result": [[2.6789679e-05, 2.6790668e-05], 0, 23.377840757369995, 1634624574.9021664], "version": 0.2, "tvm_version": "0.8.dev0"}
{"input": ["cuda -keys=cuda,gpu -max_num_threads=1024 -thread_warp_size=32", "fused_conv2d_fixed_nparts", [64, 1, 7, 7, 32, 32, 3, 3, [1, 1], [1, 1]], {}], "config": {"index": 21370, "code_hash": null, "entity": [["tile_y", "sp", [-1, 1, 7, 1]], ["tile_x", "sp", [-1, 1, 7, 1]], ["tile_rc", "sp", [-1, 8]], ["tile_ry", "sp", [-1, 1]], ["tile_rx", "sp", [-1, 3]], ["auto_unroll_max_step", "ot", 512], ["unroll_explicit", "ot", 0], ["tile_f", "sp", [-1, 8, 2]]]}, "result": [[2.861109e-05, 2.8610730000000002e-05], 0, 20.081008672714233, 1634624571.5513272], "version": 0.2, "tvm_version": "0.8.dev0"}
{"input": ["cuda -keys=cuda,gpu -max_num_threads=1024 -thread_warp_size=32", "fused_conv2d_fixed_nparts", [64, 1, 7, 7, 32, 32, 3, 3, [1, 1], [1, 1]], {}], "config": {"index": 22202, "code_hash": null, "entity": [["tile_y", "sp", [-1, 1, 7, 1]], ["tile_x", "sp", [-1, 1, 7, 1]], ["tile_rc", "sp", [-1, 2]], ["tile_ry", "sp", [-1, 3]], ["tile_rx", "sp", [-1, 3]], ["auto_unroll_max_step", "ot", 0], ["unroll_explicit", "ot", 1], ["tile_f", "sp", [-1, 8, 2]]]}, "result": [[3.1874626e-05, 3.187074e-05], 0, 25.06672692298889, 1634624576.6030304], "version": 0.2, "tvm_version": "0.8.dev0"}
{"input": ["cuda -keys=cuda,gpu -max_num_threads=1024 -thread_warp_size=32", "fused_conv2d_fixed_nparts", [64, 1, 7, 7, 32, 32, 3, 3, [1, 1], [1, 1]], {}], "config": {"index": 32794, "code_hash": null, "entity": [["tile_y", "sp", [-1, 1, 7, 1]], ["tile_x", "sp", [-1, 1, 7, 1]], ["tile_rc", "sp", [-1, 8]], ["tile_ry", "sp", [-1, 3]], ["tile_rx", "sp", [-1, 1]], ["auto_unroll_max_step", "ot", 512], ["unroll_explicit", "ot", 0], ["tile_f", "sp", [-1, 8, 4]]]}, "result": [[2.8611848999999997e-05, 2.8612365e-05], 0, 28.642071962356567, 1634624580.202404], "version": 0.2, "tvm_version": "0.8.dev0"}
{"input": ["cuda -keys=cuda,gpu -max_num_threads=1024 -thread_warp_size=32", "fused_conv2d_fixed_nparts", [64, 1, 7, 7, 32, 32, 3, 3, [1, 1], [1, 1]], {}], "config": {"index": 20986, "code_hash": null, "entity": [["tile_y", "sp", [-1, 1, 7, 1]], ["tile_x", "sp", [-1, 1, 7, 1]], ["tile_rc", "sp", [-1, 8]], ["tile_ry", "sp", [-1, 1]], ["tile_rx", "sp", [-1, 3]], ["auto_unroll_max_step", "ot", 0], ["unroll_explicit", "ot", 0], ["tile_f", "sp", [-1, 8, 2]]]}, "result": [[2.7167622999999997e-05, 2.7168019999999996e-05], 0, 35.69844698905945, 1634624587.3705046], "version": 0.2, "tvm_version": "0.8.dev0"}
{"input": ["cuda -keys=cuda,gpu -max_num_threads=1024 -thread_warp_size=32", "fused_conv2d_fixed_nparts", [64, 1, 7, 7, 32, 32, 3, 3, [1, 1], [1, 1]], {}], "config": {"index": 21834, "code_hash": null, "entity": [["tile_y", "sp", [-1, 1, 7, 1]], ["tile_x", "sp", [-1, 1, 7, 1]], ["tile_rc", "sp", [-1, 4]], ["tile_ry", "sp", [-1, 3]], ["tile_rx", "sp", [-1, 3]], ["auto_unroll_max_step", "ot", 1500], ["unroll_explicit", "ot", 0], ["tile_f", "sp", [-1, 8, 2]]]}, "result": [[2.4464153e-05, 2.4462887e-05], 0, 27.06100869178772, 1634624578.4099932], "version": 0.2, "tvm_version": "0.8.dev0"}
{"input": ["cuda -keys=cuda,gpu -max_num_threads=1024 -thread_warp_size=32", "fused_conv2d_fixed_nparts", [64, 1, 7, 7, 32, 32, 3, 3, [1, 1], [1, 1]], {}], "config": {"index": 22986, "code_hash": null, "entity": [["tile_y", "sp", [-1, 1, 7, 1]], ["tile_x", "sp", [-1, 1, 7, 1]], ["tile_rc", "sp", [-1, 4]], ["tile_ry", "sp", [-1, 3]], ["tile_rx", "sp", [-1, 3]], ["auto_unroll_max_step", "ot", 1500], ["unroll_explicit", "ot", 1], ["tile_f", "sp", [-1, 8, 2]]]}, "result": [[2.7701585e-05, 2.7707091e-05], 0, 38.579750299453735, 1634624589.3179407], "version": 0.2, "tvm_version": "0.8.dev0"}
{"input": ["cuda -keys=cuda,gpu -max_num_threads=1024 -thread_warp_size=32", "fused_conv2d_fixed_nparts", [64, 1, 7, 7, 32, 32, 3, 3, [1, 1], [1, 1]], {}], "config": {"index": 22906, "code_hash": null, "entity": [["tile_y", "sp", [-1, 1, 7, 1]], ["tile_x", "sp", [-1, 1, 7, 1]], ["tile_rc", "sp", [-1, 8]], ["tile_ry", "sp", [-1, 1]], ["tile_rx", "sp", [-1, 3]], ["auto_unroll_max_step", "ot", 1500], ["unroll_explicit", "ot", 1], ["tile_f", "sp", [-1, 8, 2]]]}, "result": [[2.8889084e-05, 2.8879669e-05], 0, 31.453562259674072, 1634624582.160005], "version": 0.2, "tvm_version": "0.8.dev0"}
{"input": ["cuda -keys=cuda,gpu -max_num_threads=1024 -thread_warp_size=32", "fused_conv2d_fixed_nparts", [64, 1, 7, 7, 32, 32, 3, 3, [1, 1], [1, 1]], {}], "config": {"index": 21450, "code_hash": null, "entity": [["tile_y", "sp", [-1, 1, 7, 1]], ["tile_x", "sp", [-1, 1, 7, 1]], ["tile_rc", "sp", [-1, 4]], ["tile_ry", "sp", [-1, 3]], ["tile_rx", "sp", [-1, 3]], ["auto_unroll_max_step", "ot", 512], ["unroll_explicit", "ot", 0], ["tile_f", "sp", [-1, 8, 2]]]}, "result": [[2.4311330999999997e-05, 2.4324597e-05], 0, 33.99038863182068, 1634624585.6227348], "version": 0.2, "tvm_version": "0.8.dev0"}
{"input": ["cuda -keys=cuda,gpu -max_num_threads=1024 -thread_warp_size=32", "fused_conv2d_fixed_nparts", [64, 1, 7, 7, 32, 32, 3, 3, [1, 1], [1, 1]], {}], "config": {"index": 22602, "code_hash": null, "entity": [["tile_y", "sp", [-1, 1, 7, 1]], ["tile_x", "sp", [-1, 1, 7, 1]], ["tile_rc", "sp", [-1, 4]], ["tile_ry", "sp", [-1, 3]], ["tile_rx", "sp", [-1, 3]], ["auto_unroll_max_step", "ot", 512], ["unroll_explicit", "ot", 1], ["tile_f", "sp", [-1, 8, 2]]]}, "result": [[2.4574044e-05, 2.4565101e-05], 0, 39.35586428642273, 1634624591.0240602], "version": 0.2, "tvm_version": "0.8.dev0"}
{"input": ["cuda -keys=cuda,gpu -max_num_threads=1024 -thread_warp_size=32", "fused_conv2d_fixed_nparts", [64, 1, 7, 7, 32, 32, 3, 3, [1, 1], [1, 1]], {}], "config": {"index": 22522, "code_hash": null, "entity": [["tile_y", "sp", [-1, 1, 7, 1]], ["tile_x", "sp", [-1, 1, 7, 1]], ["tile_rc", "sp", [-1, 8]], ["tile_ry", "sp", [-1, 1]], ["tile_rx", "sp", [-1, 3]], ["auto_unroll_max_step", "ot", 512], ["unroll_explicit", "ot", 1], ["tile_f", "sp", [-1, 8, 2]]]}, "result": [[2.6980339e-05, 2.6996650000000002e-05], 0, 32.499825954437256, 1634624583.9870362], "version": 0.2, "tvm_version": "0.8.dev0"}
{"input": ["cuda -keys=cuda,gpu -max_num_threads=1024 -thread_warp_size=32", "fused_conv2d_fixed_nparts", [64, 1, 7, 7, 32, 32, 3, 3, [1, 1], [1, 1]], {}], "config": {"index": 22218, "code_hash": null, "entity": [["tile_y", "sp", [-1, 1, 7, 1]], ["tile_x", "sp", [-1, 1, 7, 1]], ["tile_rc", "sp", [-1, 4]], ["tile_ry", "sp", [-1, 3]], ["tile_rx", "sp", [-1, 3]], ["auto_unroll_max_step", "ot", 0], ["unroll_explicit", "ot", 1], ["tile_f", "sp", [-1, 8, 2]]]}, "result": [[2.9912867e-05, 2.9904477e-05], 0, 46.15229535102844, 1634624597.9618764], "version": 0.2, "tvm_version": "0.8.dev0"}
{"input": ["cuda -keys=cuda,gpu -max_num_threads=1024 -thread_warp_size=32", "fused_conv2d_fixed_nparts", [64, 1, 7, 7, 32, 32, 3, 3, [1, 1], [1, 1]], {}], "config": {"index": 21066, "code_hash": null, "entity": [["tile_y", "sp", [-1, 1, 7, 1]], ["tile_x", "sp", [-1, 1, 7, 1]], ["tile_rc", "sp", [-1, 4]], ["tile_ry", "sp", [-1, 3]], ["tile_rx", "sp", [-1, 3]], ["auto_unroll_max_step", "ot", 0], ["unroll_explicit", "ot", 0], ["tile_f", "sp", [-1, 8, 2]]]}, "result": [[2.9819656e-05, 2.9815919999999998e-05], 0, 42.77056860923767, 1634624594.5420144], "version": 0.2, "tvm_version": "0.8.dev0"}
{"input": ["cuda -keys=cuda,gpu -max_num_threads=1024 -thread_warp_size=32", "fused_conv2d_fixed_nparts", [64, 1, 7, 7, 32, 32, 3, 3, [1, 1], [1, 1]], {}], "config": {"index": 10314, "code_hash": null, "entity": [["tile_y", "sp", [-1, 1, 7, 1]], ["tile_x", "sp", [-1, 1, 7, 1]], ["tile_rc", "sp", [-1, 4]], ["tile_ry", "sp", [-1, 3]], ["tile_rx", "sp", [-1, 3]], ["auto_unroll_max_step", "ot", 1500], ["unroll_explicit", "ot", 0], ["tile_f", "sp", [-1, 16, 1]]]}, "result": [[3.2654712000000004e-05, 3.2648138e-05], 0, 50.059534311294556, 1634624601.7436647], "version": 0.2, "tvm_version": "0.8.dev0"}
{"input": ["cuda -keys=cuda,gpu -max_num_threads=1024 -thread_warp_size=32", "fused_conv2d_fixed_nparts", [64, 1, 7, 7, 32, 32, 3, 3, [1, 1], [1, 1]], {}], "config": {"index": 33946, "code_hash": null, "entity": [["tile_y", "sp", [-1, 1, 7, 1]], ["tile_x", "sp", [-1, 1, 7, 1]], ["tile_rc", "sp", [-1, 8]], ["tile_ry", "sp", [-1, 3]], ["tile_rx", "sp", [-1, 1]], ["auto_unroll_max_step", "ot", 512], ["unroll_explicit", "ot", 1], ["tile_f", "sp", [-1, 8, 4]]]}, "result": [[2.7739418000000003e-05, 2.7722245e-05], 0, 41.22370481491089, 1634624592.8133328], "version": 0.2, "tvm_version": "0.8.dev0"}
{"input": ["cuda -keys=cuda,gpu -max_num_threads=1024 -thread_warp_size=32", "fused_conv2d_fixed_nparts", [64, 1, 7, 7, 32, 32, 3, 3, [1, 1], [1, 1]], {}], "config": {"index": 28730, "code_hash": null, "entity": [["tile_y", "sp", [-1, 1, 7, 1]], ["tile_x", "sp", [-1, 1, 7, 1]], ["tile_rc", "sp", [-1, 2]], ["tile_ry", "sp", [-1, 3]], ["tile_rx", "sp", [-1, 3]], ["auto_unroll_max_step", "ot", 1500], ["unroll_explicit", "ot", 0], ["tile_f", "sp", [-1, 2, 4]]]}, "result": [[4.0519703e-05, 4.0521016e-05], 0, 44.599867820739746, 1634624596.2900455], "version": 0.2, "tvm_version": "0.8.dev0"}
{"input": ["cuda -keys=cuda,gpu -max_num_threads=1024 -thread_warp_size=32", "fused_conv2d_fixed_nparts", [64, 1, 7, 7, 32, 32, 3, 3, [1, 1], [1, 1]], {}], "config": {"index": 29882, "code_hash": null, "entity": [["tile_y", "sp", [-1, 1, 7, 1]], ["tile_x", "sp", [-1, 1, 7, 1]], ["tile_rc", "sp", [-1, 2]], ["tile_ry", "sp", [-1, 3]], ["tile_rx", "sp", [-1, 3]], ["auto_unroll_max_step", "ot", 1500], ["unroll_explicit", "ot", 1], ["tile_f", "sp", [-1, 2, 4]]]}, "result": [[3.1755778e-05, 3.1760218e-05], 0, 48.212937355041504, 1634624599.8066092], "version": 0.2, "tvm_version": "0.8.dev0"}
{"input": ["cuda -keys=cuda,gpu -max_num_threads=1024 -thread_warp_size=32", "fused_conv2d_fixed_nparts", [64, 1, 7, 7, 32, 32, 3, 3, [1, 1], [1, 1]], {}], "config": {"index": 30266, "code_hash": null, "entity": [["tile_y", "sp", [-1, 1, 7, 1]], ["tile_x", "sp", [-1, 1, 7, 1]], ["tile_rc", "sp", [-1, 2]], ["tile_ry", "sp", [-1, 3]], ["tile_rx", "sp", [-1, 3]], ["auto_unroll_max_step", "ot", 0], ["unroll_explicit", "ot", 0], ["tile_f", "sp", [-1, 4, 4]]]}, "result": [[3.0459803e-05, 3.0461179e-05], 0, 51.704643964767456, 1634624603.536096], "version": 0.2, "tvm_version": "0.8.dev0"}
{"input": ["cuda -keys=cuda,gpu -max_num_threads=1024 -thread_warp_size=32", "fused_conv2d_fixed_nparts", [64, 1, 7, 7, 32, 32, 3, 3, [1, 1], [1, 1]], {}], "config": {"index": 31418, "code_hash": null, "entity": [["tile_y", "sp", [-1, 1, 7, 1]], ["tile_x", "sp", [-1, 1, 7, 1]], ["tile_rc", "sp", [-1, 2]], ["tile_ry", "sp", [-1, 3]], ["tile_rx", "sp", [-1, 3]], ["auto_unroll_max_step", "ot", 0], ["unroll_explicit", "ot", 1], ["tile_f", "sp", [-1, 4, 4]]]}, "result": [[3.0361768e-05, 3.0364171e-05], 0, 53.38575267791748, 1634624605.2297971], "version": 0.2, "tvm_version": "0.8.dev0"}
{"input": ["cuda -keys=cuda,gpu -max_num_threads=1024 -thread_warp_size=32", "fused_conv2d_fixed_nparts", [64, 1, 7, 7, 32, 32, 3, 3, [1, 1], [1, 1]], {}], "config": {"index": 21658, "code_hash": null, "entity": [["tile_y", "sp", [-1, 1, 7, 1]], ["tile_x", "sp", [-1, 1, 7, 1]], ["tile_rc", "sp", [-1, 8]], ["tile_ry", "sp", [-1, 3]], ["tile_rx", "sp", [-1, 1]], ["auto_unroll_max_step", "ot", 1500], ["unroll_explicit", "ot", 0], ["tile_f", "sp", [-1, 8, 2]]]}, "result": [[2.9170673e-05, 2.9186948999999997e-05], 0, 57.269704818725586, 1634624608.8663483], "version": 0.2, "tvm_version": "0.8.dev0"}
{"input": ["cuda -keys=cuda,gpu -max_num_threads=1024 -thread_warp_size=32", "fused_conv2d_fixed_nparts", [64, 1, 7, 7, 32, 32, 3, 3, [1, 1], [1, 1]], {}], "config": {"index": 22138, "code_hash": null, "entity": [["tile_y", "sp", [-1, 1, 7, 1]], ["tile_x", "sp", [-1, 1, 7, 1]], ["tile_rc", "sp", [-1, 8]], ["tile_ry", "sp", [-1, 1]], ["tile_rx", "sp", [-1, 3]], ["auto_unroll_max_step", "ot", 0], ["unroll_explicit", "ot", 1], ["tile_f", "sp", [-1, 8, 2]]]}, "result": [[2.7142648999999997e-05, 2.7130465999999997e-05], 0, 55.05494523048401, 1634624606.9179735], "version": 0.2, "tvm_version": "0.8.dev0"}
{"input": ["cuda -keys=cuda,gpu -max_num_threads=1024 -thread_warp_size=32", "fused_conv2d_fixed_nparts", [64, 1, 7, 7, 32, 32, 3, 3, [1, 1], [1, 1]], {}], "config": {"index": 32410, "code_hash": null, "entity": [["tile_y", "sp", [-1, 1, 7, 1]], ["tile_x", "sp", [-1, 1, 7, 1]], ["tile_rc", "sp", [-1, 8]], ["tile_ry", "sp", [-1, 3]], ["tile_rx", "sp", [-1, 1]], ["auto_unroll_max_step", "ot", 0], ["unroll_explicit", "ot", 0], ["tile_f", "sp", [-1, 8, 4]]]}, "result": [[2.8010819999999998e-05, 2.8008175999999998e-05], 0, 58.72155547142029, 1634624610.6327655], "version": 0.2, "tvm_version": "0.8.dev0"}
{"input": ["cuda -keys=cuda,gpu -max_num_threads=1024 -thread_warp_size=32", "fused_conv2d_fixed_nparts", [64, 1, 7, 7, 32, 32, 3, 3, [1, 1], [1, 1]], {}], "config": {"index": 19514, "code_hash": null, "entity": [["tile_y", "sp", [-1, 1, 7, 1]], ["tile_x", "sp", [-1, 1, 7, 1]], ["tile_rc", "sp", [-1, 2]], ["tile_ry", "sp", [-1, 3]], ["tile_rx", "sp", [-1, 3]], ["auto_unroll_max_step", "ot", 1500], ["unroll_explicit", "ot", 0], ["tile_f", "sp", [-1, 4, 2]]]}, "result": [[2.7020378999999995e-05, 2.7009253e-05], 0, 62.21865892410278, 1634624614.1279624], "version": 0.2, "tvm_version": "0.8.dev0"}
{"input": ["cuda -keys=cuda,gpu -max_num_threads=1024 -thread_warp_size=32", "fused_conv2d_fixed_nparts", [64, 1, 7, 7, 32, 32, 3, 3, [1, 1], [1, 1]], {}], "config": {"index": 20666, "code_hash": null, "entity": [["tile_y", "sp", [-1, 1, 7, 1]], ["tile_x", "sp", [-1, 1, 7, 1]], ["tile_rc", "sp", [-1, 2]], ["tile_ry", "sp", [-1, 3]], ["tile_rx", "sp", [-1, 3]], ["auto_unroll_max_step", "ot", 1500], ["unroll_explicit", "ot", 1], ["tile_f", "sp", [-1, 4, 2]]]}, "result": [[2.6091702000000002e-05, 2.6082730999999998e-05], 0, 60.51983165740967, 1634624612.3721619], "version": 0.2, "tvm_version": "0.8.dev0"}
{"input": ["cuda -keys=cuda,gpu -max_num_threads=1024 -thread_warp_size=32", "fused_conv2d_fixed_nparts", [64, 1, 7, 7, 32, 32, 3, 3, [1, 1], [1, 1]], {}], "config": {"index": 24138, "code_hash": null, "entity": [["tile_y", "sp", [-1, 1, 7, 1]], ["tile_x", "sp", [-1, 1, 7, 1]], ["tile_rc", "sp", [-1, 4]], ["tile_ry", "sp", [-1, 3]], ["tile_rx", "sp", [-1, 3]], ["auto_unroll_max_step", "ot", 1500], ["unroll_explicit", "ot", 0], ["tile_f", "sp", [-1, 16, 2]]]}, "result": [[3.2583898e-05, 3.2582441e-05], 0, 69.5434422492981, 1634624621.3693564], "version": 0.2, "tvm_version": "0.8.dev0"}
{"input": ["cuda -keys=cuda,gpu -max_num_threads=1024 -thread_warp_size=32", "fused_conv2d_fixed_nparts", [64, 1, 7, 7, 32, 32, 3, 3, [1, 1], [1, 1]], {}], "config": {"index": 9930, "code_hash": null, "entity": [["tile_y", "sp", [-1, 1, 7, 1]], ["tile_x", "sp", [-1, 1, 7, 1]], ["tile_rc", "sp", [-1, 4]], ["tile_ry", "sp", [-1, 3]], ["tile_rx", "sp", [-1, 3]], ["auto_unroll_max_step", "ot", 512], ["unroll_explicit", "ot", 0], ["tile_f", "sp", [-1, 16, 1]]]}, "result": [[3.1030698e-05, 3.1036052e-05], 0, 65.7149407863617, 1634624617.679895], "version": 0.2, "tvm_version": "0.8.dev0"}
{"input": ["cuda -keys=cuda,gpu -max_num_threads=1024 -thread_warp_size=32", "fused_conv2d_fixed_nparts", [64, 1, 7, 7, 32, 32, 3, 3, [1, 1], [1, 1]], {}], "config": {"index": 31818, "code_hash": null, "entity": [["tile_y", "sp", [-1, 1, 7, 1]], ["tile_x", "sp", [-1, 1, 7, 1]], ["tile_rc", "sp", [-1, 4]], ["tile_ry", "sp", [-1, 3]], ["tile_rx", "sp", [-1, 3]], ["auto_unroll_max_step", "ot", 512], ["unroll_explicit", "ot", 1], ["tile_f", "sp", [-1, 4, 4]]]}, "result": [[2.4483134e-05, 2.4483402000000002e-05], 0, 64.1426773071289, 1634624615.8756967], "version": 0.2, "tvm_version": "0.8.dev0"}
{"input": ["cuda -keys=cuda,gpu -max_num_threads=1024 -thread_warp_size=32", "fused_conv2d_fixed_nparts", [64, 1, 7, 7, 32, 32, 3, 3, [1, 1], [1, 1]], {}], "config": {"index": 30666, "code_hash": null, "entity": [["tile_y", "sp", [-1, 1, 7, 1]], ["tile_x", "sp", [-1, 1, 7, 1]], ["tile_rc", "sp", [-1, 4]], ["tile_ry", "sp", [-1, 3]], ["tile_rx", "sp", [-1, 3]], ["auto_unroll_max_step", "ot", 512], ["unroll_explicit", "ot", 0], ["tile_f", "sp", [-1, 4, 4]]]}, "result": [[2.761771e-05, 2.7620812e-05], 0, 67.62277126312256, 1634624619.4821877], "version": 0.2, "tvm_version": "0.8.dev0"}
{"input": ["cuda -keys=cuda,gpu -max_num_threads=1024 -thread_warp_size=32", "fused_conv2d_fixed_nparts", [64, 1, 7, 7, 32, 32, 3, 3, [1, 1], [1, 1]], {}], "config": {"index": 32202, "code_hash": null, "entity": [["tile_y", "sp", [-1, 1, 7, 1]], ["tile_x", "sp", [-1, 1, 7, 1]], ["tile_rc", "sp", [-1, 4]], ["tile_ry", "sp", [-1, 3]], ["tile_rx", "sp", [-1, 3]], ["auto_unroll_max_step", "ot", 1500], ["unroll_explicit", "ot", 1], ["tile_f", "sp", [-1, 4, 4]]]}, "result": [[2.4407233e-05, 2.4397588e-05], 0, 71.26601028442383, 1634624623.0401323], "version": 0.2, "tvm_version": "0.8.dev0"}
{"input": ["cuda -keys=cuda,gpu -max_num_threads=1024 -thread_warp_size=32", "fused_conv2d_fixed_nparts", [64, 1, 7, 7, 32, 32, 3, 3, [1, 1], [1, 1]], {}], "config": {"index": 31050, "code_hash": null, "entity": [["tile_y", "sp", [-1, 1, 7, 1]], ["tile_x", "sp", [-1, 1, 7, 1]], ["tile_rc", "sp", [-1, 4]], ["tile_ry", "sp", [-1, 3]], ["tile_rx", "sp", [-1, 3]], ["auto_unroll_max_step", "ot", 1500], ["unroll_explicit", "ot", 0], ["tile_f", "sp", [-1, 4, 4]]]}, "result": [[2.7640668e-05, 2.7630624999999998e-05], 0, 3.7088463306427, 1634624632.6654835], "version": 0.2, "tvm_version": "0.8.dev0"}
{"input": ["cuda -keys=cuda,gpu -max_num_threads=1024 -thread_warp_size=32", "fused_conv2d_fixed_nparts", [64, 1, 7, 7, 32, 32, 3, 3, [1, 1], [1, 1]], {}], "config": {"index": 24122, "code_hash": null, "entity": [["tile_y", "sp", [-1, 1, 7, 1]], ["tile_x", "sp", [-1, 1, 7, 1]], ["tile_rc", "sp", [-1, 2]], ["tile_ry", "sp", [-1, 3]], ["tile_rx", "sp", [-1, 3]], ["auto_unroll_max_step", "ot", 1500], ["unroll_explicit", "ot", 0], ["tile_f", "sp", [-1, 16, 2]]]}, "result": [[3.8896397e-05, 3.8897917e-05], 0, 2.0967395305633545, 1634624631.019718], "version": 0.2, "tvm_version": "0.8.dev0"}
{"input": ["cuda -keys=cuda,gpu -max_num_threads=1024 -thread_warp_size=32", "fused_conv2d_fixed_nparts", [64, 1, 7, 7, 32, 32, 3, 3, [1, 1], [1, 1]], {}], "config": {"index": 17210, "code_hash": null, "entity": [["tile_y", "sp", [-1, 1, 7, 1]], ["tile_x", "sp", [-1, 1, 7, 1]], ["tile_rc", "sp", [-1, 2]], ["tile_ry", "sp", [-1, 3]], ["tile_rx", "sp", [-1, 3]], ["auto_unroll_max_step", "ot", 1500], ["unroll_explicit", "ot", 0], ["tile_f", "sp", [-1, 2, 2]]]}, "result": [[4.0606722e-05, 4.0608479000000005e-05], 0, 5.505604267120361, 1634624634.4685953], "version": 0.2, "tvm_version": "0.8.dev0"}
{"input": ["cuda -keys=cuda,gpu -max_num_threads=1024 -thread_warp_size=32", "fused_conv2d_fixed_nparts", [64, 1, 7, 7, 32, 32, 3, 3, [1, 1], [1, 1]], {}], "config": {"index": 18362, "code_hash": null, "entity": [["tile_y", "sp", [-1, 1, 7, 1]], ["tile_x", "sp", [-1, 1, 7, 1]], ["tile_rc", "sp", [-1, 2]], ["tile_ry", "sp", [-1, 3]], ["tile_rx", "sp", [-1, 3]], ["auto_unroll_max_step", "ot", 1500], ["unroll_explicit", "ot", 1], ["tile_f", "sp", [-1, 2, 2]]]}, "result": [[3.2237401e-05, 3.2236626999999996e-05], 0, 7.404093980789185, 1634624636.2328656], "version": 0.2, "tvm_version": "0.8.dev0"}
