python/autotvm_logs/thread_fused_matmul_1_289_1024_448.log
{"input": ["cuda -keys=cuda,gpu -max_num_threads=1024 -thread_warp_size=32", "auto_schedule_thread_fused_matmul", [1, 289, 1024, 448], {}], "config": {"index": 941, "code_hash": null, "entity": [["block_size_x", "ot", 8], ["block_size_y", "ot", 32], ["tx", "ot", 4], ["ty", "ot", 4], ["tk", "ot", 16]]}, "result": [[0.00025837755399999996, 0.000242494936], 0, 26.264731884002686, 1634217087.9802127], "version": 0.2, "tvm_version": "0.8.dev0"}
{"input": ["cuda -keys=cuda,gpu -max_num_threads=1024 -thread_warp_size=32", "auto_schedule_thread_fused_matmul", [1, 289, 1024, 448], {}], "config": {"index": 1102, "code_hash": null, "entity": [["block_size_x", "ot", 16], ["block_size_y", "ot", 4], ["tx", "ot", 2], ["ty", "ot", 16], ["tk", "ot", 16]]}, "result": [[0.000212037013, 0.00019690616600000002], 0, 34.92691135406494, 1634217096.4429436], "version": 0.2, "tvm_version": "0.8.dev0"}
{"input": ["cuda -keys=cuda,gpu -max_num_threads=1024 -thread_warp_size=32", "auto_schedule_thread_fused_matmul", [1, 289, 1024, 448], {}], "config": {"index": 463, "code_hash": null, "entity": [["block_size_x", "ot", 32], ["block_size_y", "ot", 16], ["tx", "ot", 8], ["ty", "ot", 2], ["tk", "ot", 8]]}, "result": [[0.000407543949, 0.00038896767199999996], 0, 2.9527571201324463, 1634217063.5857537], "version": 0.2, "tvm_version": "0.8.dev0"}
{"input": ["cuda -keys=cuda,gpu -max_num_threads=1024 -thread_warp_size=32", "auto_schedule_thread_fused_matmul", [1, 289, 1024, 448], {}], "config": {"index": 1250, "code_hash": null, "entity": [["block_size_x", "ot", 4], ["block_size_y", "ot", 4], ["tx", "ot", 8], ["ty", "ot", 2], ["tk", "ot", 32]]}, "result": [[0.00035509995500000003, 0.00033635141599999994], 0, 17.78660297393799, 1634217079.270781], "version": 0.2, "tvm_version": "0.8.dev0"}
{"input": ["cuda -keys=cuda,gpu -max_num_threads=1024 -thread_warp_size=32", "auto_schedule_thread_fused_matmul", [1, 289, 1024, 448], {}], "config": {"index": 520, "code_hash": null, "entity": [["block_size_x", "ot", 4], ["block_size_y", "ot", 64], ["tx", "ot", 2], ["ty", "ot", 4], ["tk", "ot", 8]]}, "result": [[0.000225388379, 0.000213487834], 0, 11.457503318786621, 1634217072.7631094], "version": 0.2, "tvm_version": "0.8.dev0"}
{"input": ["cuda -keys=cuda,gpu -max_num_threads=1024 -thread_warp_size=32", "auto_schedule_thread_fused_matmul", [1, 289, 1024, 448], {}], "config": {"index": 534, "code_hash": null, "entity": [["block_size_x", "ot", 64], ["block_size_y", "ot", 8], ["tx", "ot", 4], ["ty", "ot", 4], ["tk", "ot", 8]]}, "result": [[0.00037506311199999996, 0.00035465462600000003], 0, 24.07612681388855, 1634217085.7652256], "version": 0.2, "tvm_version": "0.8.dev0"}
{"input": ["cuda -keys=cuda,gpu -max_num_threads=1024 -thread_warp_size=32", "auto_schedule_thread_fused_matmul", [1, 289, 1024, 448], {}], "config": {"index": 633, "code_hash": null, "entity": [["block_size_x", "ot", 32], ["block_size_y", "ot", 8], ["tx", "ot", 4], ["ty", "ot", 8], ["tk", "ot", 8]]}, "result": [[0.000325220911, 0.00031169264199999995], 0, 39.209118127822876, 1634217101.02633], "version": 0.2, "tvm_version": "0.8.dev0"}
{"input": ["cuda -keys=cuda,gpu -max_num_threads=1024 -thread_warp_size=32", "auto_schedule_thread_fused_matmul", [1, 289, 1024, 448], {}], "config": {"index": 61, "code_hash": null, "entity": [["block_size_x", "ot", 8], ["block_size_y", "ot", 16], ["tx", "ot", 8], ["ty", "ot", 2], ["tk", "ot", 4]]}, "result": [[0.000285241429, 0.00027002308900000006], 0, 28.517308950424194, 1634217090.2440336], "version": 0.2, "tvm_version": "0.8.dev0"}
{"input": ["cuda -keys=cuda,gpu -max_num_threads=1024 -thread_warp_size=32", "auto_schedule_thread_fused_matmul", [1, 289, 1024, 448], {}], "config": {"index": 954, "code_hash": null, "entity": [["block_size_x", "ot", 64], ["block_size_y", "ot", 4], ["tx", "ot", 8], ["ty", "ot", 4], ["tk", "ot", 16]]}, "result": [[0.000405273188, 0.000387688047], 0, 47.801945209503174, 1634217109.645236], "version": 0.2, "tvm_version": "0.8.dev0"}
{"input": ["cuda -keys=cuda,gpu -max_num_threads=1024 -thread_warp_size=32", "auto_schedule_thread_fused_matmul", [1, 289, 1024, 448], {}], "config": {"index": 104, "code_hash": null, "entity": [["block_size_x", "ot", 64], ["block_size_y", "ot", 4], ["tx", "ot", 2], ["ty", "ot", 4], ["tk", "ot", 4]]}, "result": [[0.000245931935, 0.00022333845], 0, 36.84946656227112, 1634217098.6744025], "version": 0.2, "tvm_version": "0.8.dev0"}
{"input": ["cuda -keys=cuda,gpu -max_num_threads=1024 -thread_warp_size=32", "auto_schedule_thread_fused_matmul", [1, 289, 1024, 448], {}], "config": {"index": 614, "code_hash": null, "entity": [["block_size_x", "ot", 64], ["block_size_y", "ot", 16], ["tx", "ot", 2], ["ty", "ot", 8], ["tk", "ot", 8]]}, "result": [[0.0010952021290000001, 0.001084494023], 0, 62.935434341430664, 1634217124.8852563], "version": 0.2, "tvm_version": "0.8.dev0"}
{"input": ["cuda -keys=cuda,gpu -max_num_threads=1024 -thread_warp_size=32", "auto_schedule_thread_fused_matmul", [1, 289, 1024, 448], {}], "config": {"index": 902, "code_hash": null, "entity": [["block_size_x", "ot", 16], ["block_size_y", "ot", 4], ["tx", "ot", 2], ["ty", "ot", 4], ["tk", "ot", 16]]}, "result": [[0.000202296026, 0.00019013840999999998], 0, 41.270416498184204, 1634217103.1045818], "version": 0.2, "tvm_version": "0.8.dev0"}
{"input": ["cuda -keys=cuda,gpu -max_num_threads=1024 -thread_warp_size=32", "auto_schedule_thread_fused_matmul", [1, 289, 1024, 448], {}], "config": {"index": 505, "code_hash": null, "entity": [["block_size_x", "ot", 4], ["block_size_y", "ot", 8], ["tx", "ot", 2], ["ty", "ot", 4], ["tk", "ot", 8]]}, "result": [[0.00013048258699999997, 0.00011916022900000001], 0, 45.33864068984985, 1634217107.2056208], "version": 0.2, "tvm_version": "0.8.dev0"}
{"input": ["cuda -keys=cuda,gpu -max_num_threads=1024 -thread_warp_size=32", "auto_schedule_thread_fused_matmul", [1, 289, 1024, 448], {}], "config": {"index": 990, "code_hash": null, "entity": [["block_size_x", "ot", 4], ["block_size_y", "ot", 32], ["tx", "ot", 16], ["ty", "ot", 4], ["tk", "ot", 16]]}, "result": [[0.000679429635, 0.0006593559299999999], 0, 50.93888521194458, 1634217112.7405922], "version": 0.2, "tvm_version": "0.8.dev0"}
{"input": ["cuda -keys=cuda,gpu -max_num_threads=1024 -thread_warp_size=32", "auto_schedule_thread_fused_matmul", [1, 289, 1024, 448], {}], "config": {"index": 555, "code_hash": null, "entity": [["block_size_x", "ot", 4], ["block_size_y", "ot", 8], ["tx", "ot", 8], ["ty", "ot", 4], ["tk", "ot", 8]]}, "result": [[0.000241981241, 0.00022397678900000002], 0, 55.00424408912659, 1634217116.9154148], "version": 0.2, "tvm_version": "0.8.dev0"}
{"input": ["cuda -keys=cuda,gpu -max_num_threads=1024 -thread_warp_size=32", "auto_schedule_thread_fused_matmul", [1, 289, 1024, 448], {}], "config": {"index": 865, "code_hash": null, "entity": [["block_size_x", "ot", 4], ["block_size_y", "ot", 32], ["tx", "ot", 8], ["ty", "ot", 2], ["tk", "ot", 16]]}, "result": [[0.00023250496500000002, 0.00022277545900000002], 0, 43.426005601882935, 1634217105.2769337], "version": 0.2, "tvm_version": "0.8.dev0"}
{"input": ["cuda -keys=cuda,gpu -max_num_threads=1024 -thread_warp_size=32", "auto_schedule_thread_fused_matmul", [1, 289, 1024, 448], {}], "config": {"index": 1203, "code_hash": null, "entity": [["block_size_x", "ot", 32], ["block_size_y", "ot", 4], ["tx", "ot", 2], ["ty", "ot", 2], ["tk", "ot", 32]]}, "result": [[0.00031444274899999994, 0.000300858185], 0, 71.26847505569458, 1634217133.2797503], "version": 0.2, "tvm_version": "0.8.dev0"}
{"input": ["cuda -keys=cuda,gpu -max_num_threads=1024 -thread_warp_size=32", "auto_schedule_thread_fused_matmul", [1, 289, 1024, 448], {}], "config": {"index": 504, "code_hash": null, "entity": [["block_size_x", "ot", 64], ["block_size_y", "ot", 4], ["tx", "ot", 2], ["ty", "ot", 4], ["tk", "ot", 8]]}, "result": [[0.00023166953799999999, 0.00021638961599999997], 0, 52.94791769981384, 1634217114.8555417], "version": 0.2, "tvm_version": "0.8.dev0"}
{"input": ["cuda -keys=cuda,gpu -max_num_threads=1024 -thread_warp_size=32", "auto_schedule_thread_fused_matmul", [1, 289, 1024, 448], {}], "config": {"index": 907, "code_hash": null, "entity": [["block_size_x", "ot", 16], ["block_size_y", "ot", 8], ["tx", "ot", 2], ["ty", "ot", 4], ["tk", "ot", 16]]}, "result": [[0.000128856549, 0.0001175118], 0, 88.76060557365417, 1634217150.8378735], "version": 0.2, "tvm_version": "0.8.dev0"}
{"input": ["cuda -keys=cuda,gpu -max_num_threads=1024 -thread_warp_size=32", "auto_schedule_thread_fused_matmul", [1, 289, 1024, 448], {}], "config": {"index": 1151, "code_hash": null, "entity": [["block_size_x", "ot", 8], ["block_size_y", "ot", 4], ["tx", "ot", 8], ["ty", "ot", 16], ["tk", "ot", 16]]}, "result": [[0.000488530497, 0.000460447217], 0, 84.9811360836029, 1634217146.9912286], "version": 0.2, "tvm_version": "0.8.dev0"}
{"input": ["cuda -keys=cuda,gpu -max_num_threads=1024 -thread_warp_size=32", "auto_schedule_thread_fused_matmul", [1, 289, 1024, 448], {}], "config": {"index": 234, "code_hash": null, "entity": [["block_size_x", "ot", 64], ["block_size_y", "ot", 8], ["tx", "ot", 4], ["ty", "ot", 8], ["tk", "ot", 4]]}, "result": [[0.0005487057620000001, 0.0005323620539999999], 0, 74.02433204650879, 1634217136.0400884], "version": 0.2, "tvm_version": "0.8.dev0"}
{"input": ["cuda -keys=cuda,gpu -max_num_threads=1024 -thread_warp_size=32", "auto_schedule_thread_fused_matmul", [1, 289, 1024, 448], {}], "config": {"index": 1511, "code_hash": null, "entity": [["block_size_x", "ot", 8], ["block_size_y", "ot", 16], ["tx", "ot", 2], ["ty", "ot", 16], ["tk", "ot", 32]]}, "result": [[0.000578401113, 0.000568834404], 0, 5.281506776809692, 1634217066.4903736], "version": 0.2, "tvm_version": "0.8.dev0"}
{"input": ["cuda -keys=cuda,gpu -max_num_threads=1024 -thread_warp_size=32", "auto_schedule_thread_fused_matmul", [1, 289, 1024, 448], {}], "config": {"index": 415, "code_hash": null, "entity": [["block_size_x", "ot", 4], ["block_size_y", "ot", 32], ["tx", "ot", 2], ["ty", "ot", 2], ["tk", "ot", 8]]}, "result": [[0.000105684378, 0.00010146456899999999], 0, 86.79269361495972, 1634217148.8756955], "version": 0.2, "tvm_version": "0.8.dev0"}
{"input": ["cuda -keys=cuda,gpu -max_num_threads=1024 -thread_warp_size=32", "auto_schedule_thread_fused_matmul", [1, 289, 1024, 448], {}], "config": {"index": 930, "code_hash": null, "entity": [["block_size_x", "ot", 4], ["block_size_y", "ot", 8], ["tx", "ot", 4], ["ty", "ot", 4], ["tk", "ot", 16]]}, "result": [[0.000133358688, 0.000123117087], 0, 68.97752213478088, 1634217130.9740536], "version": 0.2, "tvm_version": "0.8.dev0"}
{"input": ["cuda -keys=cuda,gpu -max_num_threads=1024 -thread_warp_size=32", "auto_schedule_thread_fused_matmul", [1, 289, 1024, 448], {}], "config": {"index": 1254, "code_hash": null, "entity": [["block_size_x", "ot", 64], ["block_size_y", "ot", 4], ["tx", "ot", 8], ["ty", "ot", 2], ["tk", "ot", 32]]}, "result": [[0.00044584790700000004, 0.00042863291299999996], 0, 95.60490608215332, 1634217247.361511], "version": 0.2, "tvm_version": "0.8.dev0"}
{"input": ["cuda -keys=cuda,gpu -max_num_threads=1024 -thread_warp_size=32", "auto_schedule_thread_fused_matmul", [1, 289, 1024, 448], {}], "config": {"index": 335, "code_hash": null, "entity": [["block_size_x", "ot", 4], ["block_size_y", "ot", 16], ["tx", "ot", 4], ["ty", "ot", 16], ["tk", "ot", 4]]}, "result": [[0.0007696750170000001, 0.0007492899349999999], 0, 14.52122974395752, 1634217165.8019228], "version": 0.2, "tvm_version": "0.8.dev0"}
{"input": ["cuda -keys=cuda,gpu -max_num_threads=1024 -thread_warp_size=32", "auto_schedule_thread_fused_matmul", [1, 289, 1024, 448], {}], "config": {"index": 10, "code_hash": null, "entity": [["block_size_x", "ot", 4], ["block_size_y", "ot", 16], ["tx", "ot", 2], ["ty", "ot", 2], ["tk", "ot", 4]]}, "result": [[0.000128691588, 0.00011783156], 0, 2.04768967628479, 1634217153.3411858], "version": 0.2, "tvm_version": "0.8.dev0"}
{"input": ["cuda -keys=cuda,gpu -max_num_threads=1024 -thread_warp_size=32", "auto_schedule_thread_fused_matmul", [1, 289, 1024, 448], {}], "config": {"index": 615, "code_hash": null, "entity": [["block_size_x", "ot", 4], ["block_size_y", "ot", 32], ["tx", "ot", 2], ["ty", "ot", 8], ["tk", "ot", 8]]}, "result": [[0.00036330166099999997, 0.000350450468], 0, 20.153982877731323, 1634217171.4771993], "version": 0.2, "tvm_version": "0.8.dev0"}
{"input": ["cuda -keys=cuda,gpu -max_num_threads=1024 -thread_warp_size=32", "auto_schedule_thread_fused_matmul", [1, 289, 1024, 448], {}], "config": {"index": 1442, "code_hash": null, "entity": [["block_size_x", "ot", 16], ["block_size_y", "ot", 32], ["tx", "ot", 4], ["ty", "ot", 8], ["tk", "ot", 32]]}, "result": [[0.0009286988149999999, 0.0009157175479999999], 0, 5.648727655410767, 1634217156.9197023], "version": 0.2, "tvm_version": "0.8.dev0"}
{"input": ["cuda -keys=cuda,gpu -max_num_threads=1024 -thread_warp_size=32", "auto_schedule_thread_fused_matmul", [1, 289, 1024, 448], {}], "config": {"index": 147, "code_hash": null, "entity": [["block_size_x", "ot", 16], ["block_size_y", "ot", 64], ["tx", "ot", 4], ["ty", "ot", 4], ["tk", "ot", 4]]}, "result": [[0.0007199432129999999, 0.000703317671], 0, 11.274614572525024, 1634217162.6231117], "version": 0.2, "tvm_version": "0.8.dev0"}
{"input": ["cuda -keys=cuda,gpu -max_num_threads=1024 -thread_warp_size=32", "auto_schedule_thread_fused_matmul", [1, 289, 1024, 448], {}], "config": {"index": 754, "code_hash": null, "entity": [["block_size_x", "ot", 64], ["block_size_y", "ot", 4], ["tx", "ot", 8], ["ty", "ot", 16], ["tk", "ot", 8]]}, "result": [[0.0007505804309999999, 0.000737287513], 0, 17.731065273284912, 1634217169.019473], "version": 0.2, "tvm_version": "0.8.dev0"}
{"input": ["cuda -keys=cuda,gpu -max_num_threads=1024 -thread_warp_size=32", "auto_schedule_thread_fused_matmul", [1, 289, 1024, 448], {}], "config": {"index": 820, "code_hash": null, "entity": [["block_size_x", "ot", 4], ["block_size_y", "ot", 64], ["tx", "ot", 2], ["ty", "ot", 2], ["tk", "ot", 16]]}, "result": [[0.000118401158, 0.00011011161300000001], 0, 22.11571764945984, 1634217173.4720876], "version": 0.2, "tvm_version": "0.8.dev0"}
{"input": ["cuda -keys=cuda,gpu -max_num_threads=1024 -thread_warp_size=32", "auto_schedule_thread_fused_matmul", [1, 289, 1024, 448], {}], "config": {"index": 476, "code_hash": null, "entity": [["block_size_x", "ot", 8], ["block_size_y", "ot", 4], ["tx", "ot", 16], ["ty", "ot", 2], ["tk", "ot", 8]]}, "result": [[0.000458747334, 0.000440596146], 0, 8.163413524627686, 1634217159.490153], "version": 0.2, "tvm_version": "0.8.dev0"}
{"input": ["cuda -keys=cuda,gpu -max_num_threads=1024 -thread_warp_size=32", "auto_schedule_thread_fused_matmul", [1, 289, 1024, 448], {}], "config": {"index": 1028, "code_hash": null, "entity": [["block_size_x", "ot", 32], ["block_size_y", "ot", 4], ["tx", "ot", 4], ["ty", "ot", 8], ["tk", "ot", 16]]}, "result": [[0.00022643419800000002, 0.00021550935100000002], 0, 30.73343801498413, 1634217182.0935342], "version": 0.2, "tvm_version": "0.8.dev0"}
{"input": ["cuda -keys=cuda,gpu -max_num_threads=1024 -thread_warp_size=32", "auto_schedule_thread_fused_matmul", [1, 289, 1024, 448], {}], "config": {"index": 145, "code_hash": null, "entity": [["block_size_x", "ot", 4], ["block_size_y", "ot", 64], ["tx", "ot", 4], ["ty", "ot", 4], ["tk", "ot", 4]]}, "result": [[0.000304099869, 0.000291043208], 0, 28.553452253341675, 1634217179.9160883], "version": 0.2, "tvm_version": "0.8.dev0"}
{"input": ["cuda -keys=cuda,gpu -max_num_threads=1024 -thread_warp_size=32", "auto_schedule_thread_fused_matmul", [1, 289, 1024, 448], {}], "config": {"index": 526, "code_hash": null, "entity": [["block_size_x", "ot", 8], ["block_size_y", "ot", 4], ["tx", "ot", 4], ["ty", "ot", 4], ["tk", "ot", 8]]}, "result": [[0.00019616236, 0.00018537234900000001], 0, 39.110899925231934, 1634217190.5049734], "version": 0.2, "tvm_version": "0.8.dev0"}
{"input": ["cuda -keys=cuda,gpu -max_num_threads=1024 -thread_warp_size=32", "auto_schedule_thread_fused_matmul", [1, 289, 1024, 448], {}], "config": {"index": 129, "code_hash": null, "entity": [["block_size_x", "ot", 64], ["block_size_y", "ot", 4], ["tx", "ot", 4], ["ty", "ot", 4], ["tk", "ot", 4]]}, "result": [[0.000309832087, 0.000295906238], 0, 37.03508543968201, 1634217188.3895824], "version": 0.2, "tvm_version": "0.8.dev0"}
{"input": ["cuda -keys=cuda,gpu -max_num_threads=1024 -thread_warp_size=32", "auto_schedule_thread_fused_matmul", [1, 289, 1024, 448], {}], "config": {"index": 1227, "code_hash": null, "entity": [["block_size_x", "ot", 16], ["block_size_y", "ot", 4], ["tx", "ot", 4], ["ty", "ot", 2], ["tk", "ot", 32]]}, "result": [[0.00030698384499999997, 0.00029220662700000003], 0, 41.40087699890137, 1634217192.7813356], "version": 0.2, "tvm_version": "0.8.dev0"}
{"input": ["cuda -keys=cuda,gpu -max_num_threads=1024 -thread_warp_size=32", "auto_schedule_thread_fused_matmul", [1, 289, 1024, 448], {}], "config": {"index": 1403, "code_hash": null, "entity": [["block_size_x", "ot", 32], ["block_size_y", "ot", 4], ["tx", "ot", 2], ["ty", "ot", 8], ["tk", "ot", 32]]}, "result": [[0.000143051875, 0.00013098084399999998], 0, 32.682647705078125, 1634217184.0453877], "version": 0.2, "tvm_version": "0.8.dev0"}
{"input": ["cuda -keys=cuda,gpu -max_num_threads=1024 -thread_warp_size=32", "auto_schedule_thread_fused_matmul", [1, 289, 1024, 448], {}], "config": {"index": 1425, "code_hash": null, "entity": [["block_size_x", "ot", 4], ["block_size_y", "ot", 4], ["tx", "ot", 4], ["ty", "ot", 8], ["tk", "ot", 32]]}, "result": [[0.000186450312, 0.00016996265600000002], 0, 34.68834066390991, 1634217186.0719454], "version": 0.2, "tvm_version": "0.8.dev0"}
{"input": ["cuda -keys=cuda,gpu -max_num_threads=1024 -thread_warp_size=32", "auto_schedule_thread_fused_matmul", [1, 289, 1024, 448], {}], "config": {"index": 547, "code_hash": null, "entity": [["block_size_x", "ot", 16], ["block_size_y", "ot", 64], ["tx", "ot", 4], ["ty", "ot", 4], ["tk", "ot", 8]]}, "result": [[0.00081779309, 0.0008029316870000001], 0, 48.83620071411133, 1634217200.2243745], "version": 0.2, "tvm_version": "0.8.dev0"}
{"input": ["cuda -keys=cuda,gpu -max_num_threads=1024 -thread_warp_size=32", "auto_schedule_thread_fused_matmul", [1, 289, 1024, 448], {}], "config": {"index": 1478, "code_hash": null, "entity": [["block_size_x", "ot", 32], ["block_size_y", "ot", 4], ["tx", "ot", 16], ["ty", "ot", 8], ["tk", "ot", 32]]}, "result": [[0.00074733915, 0.000718114731], 0, 93.38050818443298, 1634217244.7506104], "version": 0.2, "tvm_version": "0.8.dev0"}
{"input": ["cuda -keys=cuda,gpu -max_num_threads=1024 -thread_warp_size=32", "auto_schedule_thread_fused_matmul", [1, 289, 1024, 448], {}], "config": {"index": 231, "code_hash": null, "entity": [["block_size_x", "ot", 8], ["block_size_y", "ot", 8], ["tx", "ot", 4], ["ty", "ot", 8], ["tk", "ot", 4]]}, "result": [[0.000242773448, 0.000230265219], 0, 85.07947039604187, 1634217236.5113385], "version": 0.2, "tvm_version": "0.8.dev0"}
{"input": ["cuda -keys=cuda,gpu -max_num_threads=1024 -thread_warp_size=32", "auto_schedule_thread_fused_matmul", [1, 289, 1024, 448], {}], "config": {"index": 1204, "code_hash": null, "entity": [["block_size_x", "ot", 64], ["block_size_y", "ot", 4], ["tx", "ot", 2], ["ty", "ot", 2], ["tk", "ot", 32]]}, "result": [[0.00041001666, 0.00039580316299999996], 0, 80.85883355140686, 1634217232.2982821], "version": 0.2, "tvm_version": "0.8.dev0"}
{"input": ["cuda -keys=cuda,gpu -max_num_threads=1024 -thread_warp_size=32", "auto_schedule_thread_fused_matmul", [1, 289, 1024, 448], {}], "config": {"index": 1079, "code_hash": null, "entity": [["block_size_x", "ot", 64], ["block_size_y", "ot", 4], ["tx", "ot", 16], ["ty", "ot", 8], ["tk", "ot", 16]]}, "result": [[0.000810272122, 0.0007938148619999999], 0, 71.89184784889221, 1634217223.2685897], "version": 0.2, "tvm_version": "0.8.dev0"}
{"input": ["cuda -keys=cuda,gpu -max_num_threads=1024 -thread_warp_size=32", "auto_schedule_thread_fused_matmul", [1, 289, 1024, 448], {}], "config": {"index": 1359, "code_hash": null, "entity": [["block_size_x", "ot", 64], ["block_size_y", "ot", 8], ["tx", "ot", 8], ["ty", "ot", 4], ["tk", "ot", 32]]}, "result": [[0.000420191665, 0.00040442478], 0, 59.609710454940796, 1634217211.004565], "version": 0.2, "tvm_version": "0.8.dev0"}
{"input": ["cuda -keys=cuda,gpu -max_num_threads=1024 -thread_warp_size=32", "auto_schedule_thread_fused_matmul", [1, 289, 1024, 448], {}], "config": {"index": 1388, "code_hash": null, "entity": [["block_size_x", "ot", 32], ["block_size_y", "ot", 16], ["tx", "ot", 16], ["ty", "ot", 4], ["tk", "ot", 32]]}, "result": [[0.000880945139, 0.000860168736], 0, 78.36802268028259, 1634217229.780058], "version": 0.2, "tvm_version": "0.8.dev0"}
{"input": ["cuda -keys=cuda,gpu -max_num_threads=1024 -thread_warp_size=32", "auto_schedule_thread_fused_matmul", [1, 289, 1024, 448], {}], "config": {"index": 107, "code_hash": null, "entity": [["block_size_x", "ot", 16], ["block_size_y", "ot", 8], ["tx", "ot", 2], ["ty", "ot", 4], ["tk", "ot", 4]]}, "result": [[0.000163392979, 0.00014889632], 0, 65.67088007926941, 1634217217.1052952], "version": 0.2, "tvm_version": "0.8.dev0"}
{"input": ["cuda -keys=cuda,gpu -max_num_threads=1024 -thread_warp_size=32", "auto_schedule_thread_fused_matmul", [1, 289, 1024, 448], {}], "config": {"index": 87, "code_hash": null, "entity": [["block_size_x", "ot", 16], ["block_size_y", "ot", 16], ["tx", "ot", 16], ["ty", "ot", 2], ["tk", "ot", 4]]}, "result": [[0.000573645355, 0.0005571346899999999], 0, 68.51663756370544, 1634217219.923894], "version": 0.2, "tvm_version": "0.8.dev0"}
{"input": ["cuda -keys=cuda,gpu -max_num_threads=1024 -thread_warp_size=32", "auto_schedule_thread_fused_matmul", [1, 289, 1024, 448], {}], "config": {"index": 1253, "code_hash": null, "entity": [["block_size_x", "ot", 32], ["block_size_y", "ot", 4], ["tx", "ot", 8], ["ty", "ot", 2], ["tk", "ot", 32]]}, "result": [[0.00045716470600000003, 0.000440783252], 0, 90.06451845169067, 1634217241.4992154], "version": 0.2, "tvm_version": "0.8.dev0"}
{"input": ["cuda -keys=cuda,gpu -max_num_threads=1024 -thread_warp_size=32", "auto_schedule_thread_fused_matmul", [1, 289, 1024, 448], {}], "config": {"index": 1321, "code_hash": null, "entity": [["block_size_x", "ot", 8], ["block_size_y", "ot", 64], ["tx", "ot", 2], ["ty", "ot", 4], ["tk", "ot", 32]]}, "result": [[0.000279414123, 0.00026972907500000004], 0, 87.42341160774231, 1634217238.8663309], "version": 0.2, "tvm_version": "0.8.dev0"}
{"input": ["cuda -keys=cuda,gpu -max_num_threads=1024 -thread_warp_size=32", "auto_schedule_thread_fused_matmul", [1, 289, 1024, 448], {}], "config": {"index": 735, "code_hash": null, "entity": [["block_size_x", "ot", 4], ["block_size_y", "ot", 16], ["tx", "ot", 4], ["ty", "ot", 16], ["tk", "ot", 8]]}, "result": [[0.000726678836, 0.000707946928], 0, 75.01732444763184, 1634217226.3958845], "version": 0.2, "tvm_version": "0.8.dev0"}
{"input": ["cuda -keys=cuda,gpu -max_num_threads=1024 -thread_warp_size=32", "auto_schedule_thread_fused_matmul", [1, 289, 1024, 448], {}], "config": {"index": 442, "code_hash": null, "entity": [["block_size_x", "ot", 16], ["block_size_y", "ot", 32], ["tx", "ot", 4], ["ty", "ot", 2], ["tk", "ot", 8]]}, "result": [[0.000176052965, 0.00016455888699999999], 0, 82.88630938529968, 1634217234.3344405], "version": 0.2, "tvm_version": "0.8.dev0"}
{"input": ["cuda -keys=cuda,gpu -max_num_threads=1024 -thread_warp_size=32", "auto_schedule_thread_fused_matmul", [1, 289, 1024, 448], {}], "config": {"index": 1211, "code_hash": null, "entity": [["block_size_x", "ot", 8], ["block_size_y", "ot", 16], ["tx", "ot", 2], ["ty", "ot", 2], ["tk", "ot", 32]]}, "result": [[0.000113034483, 0.000104458779], 0, 6.039728164672852, 1634217258.379234], "version": 0.2, "tvm_version": "0.8.dev0"}
{"input": ["cuda -keys=cuda,gpu -max_num_threads=1024 -thread_warp_size=32", "auto_schedule_thread_fused_matmul", [1, 289, 1024, 448], {}], "config": {"index": 811, "code_hash": null, "entity": [["block_size_x", "ot", 8], ["block_size_y", "ot", 16], ["tx", "ot", 2], ["ty", "ot", 2], ["tk", "ot", 16]]}, "result": [[0.000111509695, 0.000105378303], 0, 7.945960998535156, 1634217260.248025], "version": 0.2, "tvm_version": "0.8.dev0"}
{"input": ["cuda -keys=cuda,gpu -max_num_threads=1024 -thread_warp_size=32", "auto_schedule_thread_fused_matmul", [1, 289, 1024, 448], {}], "config": {"index": 810, "code_hash": null, "entity": [["block_size_x", "ot", 4], ["block_size_y", "ot", 16], ["tx", "ot", 2], ["ty", "ot", 2], ["tk", "ot", 16]]}, "result": [[0.000116448346, 0.00010653709], 0, 4.136214971542358, 1634217256.4480586], "version": 0.2, "tvm_version": "0.8.dev0"}
{"input": ["cuda -keys=cuda,gpu -max_num_threads=1024 -thread_warp_size=32", "auto_schedule_thread_fused_matmul", [1, 289, 1024, 448], {}], "config": {"index": 506, "code_hash": null, "entity": [["block_size_x", "ot", 8], ["block_size_y", "ot", 8], ["tx", "ot", 2], ["ty", "ot", 4], ["tk", "ot", 8]]}, "result": [[0.00011569363199999999, 0.000105755205], 0, 2.179943561553955, 1634217254.468581], "version": 0.2, "tvm_version": "0.8.dev0"}
{"input": ["cuda -keys=cuda,gpu -max_num_threads=1024 -thread_warp_size=32", "auto_schedule_thread_fused_matmul", [1, 289, 1024, 448], {}], "config": {"index": 410, "code_hash": null, "entity": [["block_size_x", "ot", 4], ["block_size_y", "ot", 16], ["tx", "ot", 2], ["ty", "ot", 2], ["tk", "ot", 8]]}, "result": [[0.000106166863, 0.000102791641], 0, 15.533304691314697, 1634217267.863249], "version": 0.2, "tvm_version": "0.8.dev0"}
{"input": ["cuda -keys=cuda,gpu -max_num_threads=1024 -thread_warp_size=32", "auto_schedule_thread_fused_matmul", [1, 289, 1024, 448], {}], "config": {"index": 411, "code_hash": null, "entity": [["block_size_x", "ot", 8], ["block_size_y", "ot", 16], ["tx", "ot", 2], ["ty", "ot", 2], ["tk", "ot", 8]]}, "result": [[0.00010379843, 9.912190099999999e-05], 0, 9.773548364639282, 1634217262.0778883], "version": 0.2, "tvm_version": "0.8.dev0"}
{"input": ["cuda -keys=cuda,gpu -max_num_threads=1024 -thread_warp_size=32", "auto_schedule_thread_fused_matmul", [1, 289, 1024, 448], {}], "config": {"index": 1206, "code_hash": null, "entity": [["block_size_x", "ot", 8], ["block_size_y", "ot", 8], ["tx", "ot", 2], ["ty", "ot", 2], ["tk", "ot", 32]]}, "result": [[0.000171650295, 0.000157362829], 0, 11.787089347839355, 1634217264.0858905], "version": 0.2, "tvm_version": "0.8.dev0"}
{"input": ["cuda -keys=cuda,gpu -max_num_threads=1024 -thread_warp_size=32", "auto_schedule_thread_fused_matmul", [1, 289, 1024, 448], {}], "config": {"index": 812, "code_hash": null, "entity": [["block_size_x", "ot", 16], ["block_size_y", "ot", 16], ["tx", "ot", 2], ["ty", "ot", 2], ["tk", "ot", 16]]}, "result": [[0.000105422029, 0.000101040114], 0, 13.663091897964478, 1634217266.0142508], "version": 0.2, "tvm_version": "0.8.dev0"}
{"input": ["cuda -keys=cuda,gpu -max_num_threads=1024 -thread_warp_size=32", "auto_schedule_thread_fused_matmul", [1, 289, 1024, 448], {}], "config": {"index": 806, "code_hash": null, "entity": [["block_size_x", "ot", 8], ["block_size_y", "ot", 8], ["tx", "ot", 2], ["ty", "ot", 2], ["tk", "ot", 16]]}, "result": [[0.000161818401, 0.000150376985], 0, 17.593077182769775, 1634217269.9278245], "version": 0.2, "tvm_version": "0.8.dev0"}
{"input": ["cuda -keys=cuda,gpu -max_num_threads=1024 -thread_warp_size=32", "auto_schedule_thread_fused_matmul", [1, 289, 1024, 448], {}], "config": {"index": 906, "code_hash": null, "entity": [["block_size_x", "ot", 8], ["block_size_y", "ot", 8], ["tx", "ot", 2], ["ty", "ot", 4], ["tk", "ot", 16]]}, "result": [[0.00013811658299999998, 0.000126783264], 0, 21.379213571548462, 1634217273.761072], "version": 0.2, "tvm_version": "0.8.dev0"}
{"input": ["cuda -keys=cuda,gpu -max_num_threads=1024 -thread_warp_size=32", "auto_schedule_thread_fused_matmul", [1, 289, 1024, 448], {}], "config": {"index": 815, "code_hash": null, "entity": [["block_size_x", "ot", 4], ["block_size_y", "ot", 32], ["tx", "ot", 2], ["ty", "ot", 2], ["tk", "ot", 16]]}, "result": [[9.468606800000001e-05, 9.046438399999999e-05], 0, 19.42939257621765, 1634217271.815502], "version": 0.2, "tvm_version": "0.8.dev0"}
{"input": ["cuda -keys=cuda,gpu -max_num_threads=1024 -thread_warp_size=32", "auto_schedule_thread_fused_matmul", [1, 289, 1024, 448], {}], "config": {"index": 515, "code_hash": null, "entity": [["block_size_x", "ot", 4], ["block_size_y", "ot", 32], ["tx", "ot", 2], ["ty", "ot", 4], ["tk", "ot", 8]]}, "result": [[0.000219087635, 0.00020445201], 0, 23.499479055404663, 1634217275.893545], "version": 0.2, "tvm_version": "0.8.dev0"}
{"input": ["cuda -keys=cuda,gpu -max_num_threads=1024 -thread_warp_size=32", "auto_schedule_thread_fused_matmul", [1, 289, 1024, 448], {}], "config": {"index": 1210, "code_hash": null, "entity": [["block_size_x", "ot", 4], ["block_size_y", "ot", 16], ["tx", "ot", 2], ["ty", "ot", 2], ["tk", "ot", 32]]}, "result": [[0.00011729138899999999, 0.00010924747499999999], 0, 27.322429180145264, 1634217279.7293503], "version": 0.2, "tvm_version": "0.8.dev0"}
{"input": ["cuda -keys=cuda,gpu -max_num_threads=1024 -thread_warp_size=32", "auto_schedule_thread_fused_matmul", [1, 289, 1024, 448], {}], "config": {"index": 435, "code_hash": null, "entity": [["block_size_x", "ot", 4], ["block_size_y", "ot", 16], ["tx", "ot", 4], ["ty", "ot", 2], ["tk", "ot", 8]]}, "result": [[0.000125046864, 0.00011647357100000002], 0, 25.44377112388611, 1634217277.8072405], "version": 0.2, "tvm_version": "0.8.dev0"}
{"input": ["cuda -keys=cuda,gpu -max_num_threads=1024 -thread_warp_size=32", "auto_schedule_thread_fused_matmul", [1, 289, 1024, 448], {}], "config": {"index": 406, "code_hash": null, "entity": [["block_size_x", "ot", 8], ["block_size_y", "ot", 8], ["tx", "ot", 2], ["ty", "ot", 2], ["tk", "ot", 8]]}, "result": [[0.000120120566, 0.000110270862], 0, 33.18516182899475, 1634217285.6017542], "version": 0.2, "tvm_version": "0.8.dev0"}
{"input": ["cuda -keys=cuda,gpu -max_num_threads=1024 -thread_warp_size=32", "auto_schedule_thread_fused_matmul", [1, 289, 1024, 448], {}], "config": {"index": 507, "code_hash": null, "entity": [["block_size_x", "ot", 16], ["block_size_y", "ot", 8], ["tx", "ot", 2], ["ty", "ot", 4], ["tk", "ot", 8]]}, "result": [[0.000126513329, 0.000116754122], 0, 31.26984739303589, 1634217283.6800451], "version": 0.2, "tvm_version": "0.8.dev0"}
{"input": ["cuda -keys=cuda,gpu -max_num_threads=1024 -thread_warp_size=32", "auto_schedule_thread_fused_matmul", [1, 289, 1024, 448], {}], "config": {"index": 905, "code_hash": null, "entity": [["block_size_x", "ot", 4], ["block_size_y", "ot", 8], ["tx", "ot", 2], ["ty", "ot", 4], ["tk", "ot", 16]]}, "result": [[0.000141845154, 0.00013131356299999998], 0, 29.30928945541382, 1634217281.7240002], "version": 0.2, "tvm_version": "0.8.dev0"}
{"input": ["cuda -keys=cuda,gpu -max_num_threads=1024 -thread_warp_size=32", "auto_schedule_thread_fused_matmul", [1, 289, 1024, 448], {}], "config": {"index": 511, "code_hash": null, "entity": [["block_size_x", "ot", 8], ["block_size_y", "ot", 16], ["tx", "ot", 2], ["ty", "ot", 4], ["tk", "ot", 8]]}, "result": [[0.000117076662, 0.00011033135199999999], 0, 35.061643838882446, 1634217287.4946043], "version": 0.2, "tvm_version": "0.8.dev0"}
{"input": ["cuda -keys=cuda,gpu -max_num_threads=1024 -thread_warp_size=32", "auto_schedule_thread_fused_matmul", [1, 289, 1024, 448], {}], "config": {"index": 416, "code_hash": null, "entity": [["block_size_x", "ot", 8], ["block_size_y", "ot", 32], ["tx", "ot", 2], ["ty", "ot", 2], ["tk", "ot", 8]]}, "result": [[0.00010495581400000001, 9.659448600000001e-05], 0, 36.96241068840027, 1634217289.4096825], "version": 0.2, "tvm_version": "0.8.dev0"}
{"input": ["cuda -keys=cuda,gpu -max_num_threads=1024 -thread_warp_size=32", "auto_schedule_thread_fused_matmul", [1, 289, 1024, 448], {}], "config": {"index": 816, "code_hash": null, "entity": [["block_size_x", "ot", 8], ["block_size_y", "ot", 32], ["tx", "ot", 2], ["ty", "ot", 2], ["tk", "ot", 16]]}, "result": [[8.8315302e-05, 8.4292014e-05], 0, 38.82660889625549, 1634217291.2819908], "version": 0.2, "tvm_version": "0.8.dev0"}
{"input": ["cuda -keys=cuda,gpu -max_num_threads=1024 -thread_warp_size=32", "auto_schedule_thread_fused_matmul", [1, 289, 1024, 448], {}], "config": {"index": 1306, "code_hash": null, "entity": [["block_size_x", "ot", 8], ["block_size_y", "ot", 8], ["tx", "ot", 2], ["ty", "ot", 4], ["tk", "ot", 32]]}, "result": [[0.000132638201, 0.000121564445], 0, 50.744903564453125, 1634217303.2334623], "version": 0.2, "tvm_version": "0.8.dev0"}
{"input": ["cuda -keys=cuda,gpu -max_num_threads=1024 -thread_warp_size=32", "auto_schedule_thread_fused_matmul", [1, 289, 1024, 448], {}], "config": {"index": 1305, "code_hash": null, "entity": [["block_size_x", "ot", 4], ["block_size_y", "ot", 8], ["tx", "ot", 2], ["ty", "ot", 4], ["tk", "ot", 32]]}, "result": [[0.00014519341700000002, 0.000132625996], 0, 44.80769634246826, 1634217297.297613], "version": 0.2, "tvm_version": "0.8.dev0"}
{"input": ["cuda -keys=cuda,gpu -max_num_threads=1024 -thread_warp_size=32", "auto_schedule_thread_fused_matmul", [1, 289, 1024, 448], {}], "config": {"index": 1205, "code_hash": null, "entity": [["block_size_x", "ot", 4], ["block_size_y", "ot", 8], ["tx", "ot", 2], ["ty", "ot", 2], ["tk", "ot", 32]]}, "result": [[0.00017660332399999998, 0.000166203269], 0, 40.8810875415802, 1634217293.3860202], "version": 0.2, "tvm_version": "0.8.dev0"}
{"input": ["cuda -keys=cuda,gpu -max_num_threads=1024 -thread_warp_size=32", "auto_schedule_thread_fused_matmul", [1, 289, 1024, 448], {}], "config": {"index": 510, "code_hash": null, "entity": [["block_size_x", "ot", 4], ["block_size_y", "ot", 16], ["tx", "ot", 2], ["ty", "ot", 4], ["tk", "ot", 8]]}, "result": [[0.00012582276700000001, 0.00011630085800000001], 0, 42.822675704956055, 1634217295.3256776], "version": 0.2, "tvm_version": "0.8.dev0"}
{"input": ["cuda -keys=cuda,gpu -max_num_threads=1024 -thread_warp_size=32", "auto_schedule_thread_fused_matmul", [1, 289, 1024, 448], {}], "config": {"index": 440, "code_hash": null, "entity": [["block_size_x", "ot", 4], ["block_size_y", "ot", 32], ["tx", "ot", 4], ["ty", "ot", 2], ["tk", "ot", 8]]}, "result": [[0.00010596460200000001, 9.6914919e-05], 0, 48.77573871612549, 1634217301.267402], "version": 0.2, "tvm_version": "0.8.dev0"}
{"input": ["cuda -keys=cuda,gpu -max_num_threads=1024 -thread_warp_size=32", "auto_schedule_thread_fused_matmul", [1, 289, 1024, 448], {}], "config": {"index": 431, "code_hash": null, "entity": [["block_size_x", "ot", 8], ["block_size_y", "ot", 8], ["tx", "ot", 4], ["ty", "ot", 2], ["tk", "ot", 8]]}, "result": [[0.00017374487300000002, 0.00015941102], 0, 46.8627188205719, 1634217299.359884], "version": 0.2, "tvm_version": "0.8.dev0"}
{"input": ["cuda -keys=cuda,gpu -max_num_threads=1024 -thread_warp_size=32", "auto_schedule_thread_fused_matmul", [1, 289, 1024, 448], {}], "config": {"index": 405, "code_hash": null, "entity": [["block_size_x", "ot", 4], ["block_size_y", "ot", 8], ["tx", "ot", 2], ["ty", "ot", 2], ["tk", "ot", 8]]}, "result": [[0.000135490635, 0.00012483684599999998], 0, 56.779189109802246, 1634217309.3274114], "version": 0.2, "tvm_version": "0.8.dev0"}
{"input": ["cuda -keys=cuda,gpu -max_num_threads=1024 -thread_warp_size=32", "auto_schedule_thread_fused_matmul", [1, 289, 1024, 448], {}], "config": {"index": 432, "code_hash": null, "entity": [["block_size_x", "ot", 16], ["block_size_y", "ot", 8], ["tx", "ot", 4], ["ty", "ot", 2], ["tk", "ot", 8]]}, "result": [[0.00019601538199999998, 0.00018547492099999999], 0, 54.842581272125244, 1634217307.3742738], "version": 0.2, "tvm_version": "0.8.dev0"}
{"input": ["cuda -keys=cuda,gpu -max_num_threads=1024 -thread_warp_size=32", "auto_schedule_thread_fused_matmul", [1, 289, 1024, 448], {}], "config": {"index": 105, "code_hash": null, "entity": [["block_size_x", "ot", 4], ["block_size_y", "ot", 8], ["tx", "ot", 2], ["ty", "ot", 4], ["tk", "ot", 4]]}, "result": [[0.00014751773600000002, 0.000134780213], 0, 66.56311798095703, 1634217319.1005147], "version": 0.2, "tvm_version": "0.8.dev0"}
{"input": ["cuda -keys=cuda,gpu -max_num_threads=1024 -thread_warp_size=32", "auto_schedule_thread_fused_matmul", [1, 289, 1024, 448], {}], "config": {"index": 436, "code_hash": null, "entity": [["block_size_x", "ot", 8], ["block_size_y", "ot", 16], ["tx", "ot", 4], ["ty", "ot", 2], ["tk", "ot", 8]]}, "result": [[0.00012443380899999999, 0.000113928077], 0, 62.75449180603027, 1634217315.288926], "version": 0.2, "tvm_version": "0.8.dev0"}
{"input": ["cuda -keys=cuda,gpu -max_num_threads=1024 -thread_warp_size=32", "auto_schedule_thread_fused_matmul", [1, 289, 1024, 448], {}], "config": {"index": 807, "code_hash": null, "entity": [["block_size_x", "ot", 16], ["block_size_y", "ot", 8], ["tx", "ot", 2], ["ty", "ot", 2], ["tk", "ot", 16]]}, "result": [[0.000170845402, 0.00015850999999999997], 0, 52.727765798568726, 1634217305.2444923], "version": 0.2, "tvm_version": "0.8.dev0"}
{"input": ["cuda -keys=cuda,gpu -max_num_threads=1024 -thread_warp_size=32", "auto_schedule_thread_fused_matmul", [1, 289, 1024, 448], {}], "config": {"index": 1307, "code_hash": null, "entity": [["block_size_x", "ot", 16], ["block_size_y", "ot", 8], ["tx", "ot", 2], ["ty", "ot", 4], ["tk", "ot", 32]]}, "result": [[0.000121830089, 0.000112597596], 0, 64.60656094551086, 1634217317.1968174], "version": 0.2, "tvm_version": "0.8.dev0"}
{"input": ["cuda -keys=cuda,gpu -max_num_threads=1024 -thread_warp_size=32", "auto_schedule_thread_fused_matmul", [1, 289, 1024, 448], {}], "config": {"index": 1230, "code_hash": null, "entity": [["block_size_x", "ot", 4], ["block_size_y", "ot", 8], ["tx", "ot", 4], ["ty", "ot", 2], ["tk", "ot", 32]]}, "result": [[0.0001539751, 0.00014341927000000002], 0, 58.743600845336914, 1634217311.2965288], "version": 0.2, "tvm_version": "0.8.dev0"}
{"input": ["cuda -keys=cuda,gpu -max_num_threads=1024 -thread_warp_size=32", "auto_schedule_thread_fused_matmul", [1, 289, 1024, 448], {}], "config": {"index": 831, "code_hash": null, "entity": [["block_size_x", "ot", 8], ["block_size_y", "ot", 8], ["tx", "ot", 4], ["ty", "ot", 2], ["tk", "ot", 16]]}, "result": [[0.000173940932, 0.00016018454299999998], 0, 74.39219498634338, 1634217326.9639692], "version": 0.2, "tvm_version": "0.8.dev0"}
{"input": ["cuda -keys=cuda,gpu -max_num_threads=1024 -thread_warp_size=32", "auto_schedule_thread_fused_matmul", [1, 289, 1024, 448], {}], "config": {"index": 835, "code_hash": null, "entity": [["block_size_x", "ot", 4], ["block_size_y", "ot", 16], ["tx", "ot", 4], ["ty", "ot", 2], ["tk", "ot", 16]]}, "result": [[0.00012074103599999999, 0.00011208467199999999], 0, 76.30617070198059, 1634217328.9018931], "version": 0.2, "tvm_version": "0.8.dev0"}
{"input": ["cuda -keys=cuda,gpu -max_num_threads=1024 -thread_warp_size=32", "auto_schedule_thread_fused_matmul", [1, 289, 1024, 448], {}], "config": {"index": 430, "code_hash": null, "entity": [["block_size_x", "ot", 4], ["block_size_y", "ot", 8], ["tx", "ot", 4], ["ty", "ot", 2], ["tk", "ot", 8]]}, "result": [[0.000154804806, 0.00014331890000000003], 0, 60.73229098320007, 1634217313.3136997], "version": 0.2, "tvm_version": "0.8.dev0"}
{"input": ["cuda -keys=cuda,gpu -max_num_threads=1024 -thread_warp_size=32", "auto_schedule_thread_fused_matmul", [1, 289, 1024, 448], {}], "config": {"index": 1235, "code_hash": null, "entity": [["block_size_x", "ot", 4], ["block_size_y", "ot", 16], ["tx", "ot", 4], ["ty", "ot", 2], ["tk", "ot", 32]]}, "result": [[0.00010437727, 9.832117399999999e-05], 0, 68.36554455757141, 1634217320.9524753], "version": 0.2, "tvm_version": "0.8.dev0"}
{"input": ["cuda -keys=cuda,gpu -max_num_threads=1024 -thread_warp_size=32", "auto_schedule_thread_fused_matmul", [1, 289, 1024, 448], {}], "config": {"index": 110, "code_hash": null, "entity": [["block_size_x", "ot", 4], ["block_size_y", "ot", 16], ["tx", "ot", 2], ["ty", "ot", 4], ["tk", "ot", 4]]}, "result": [[0.000141882046, 0.000129317163], 0, 78.22694945335388, 1634217330.8331301], "version": 0.2, "tvm_version": "0.8.dev0"}
{"input": ["cuda -keys=cuda,gpu -max_num_threads=1024 -thread_warp_size=32", "auto_schedule_thread_fused_matmul", [1, 289, 1024, 448], {}], "config": {"index": 106, "code_hash": null, "entity": [["block_size_x", "ot", 8], ["block_size_y", "ot", 8], ["tx", "ot", 2], ["ty", "ot", 4], ["tk", "ot", 4]]}, "result": [[0.00017363593399999998, 0.000161823057], 0, 72.41767358779907, 1634217325.023076], "version": 0.2, "tvm_version": "0.8.dev0"}
{"input": ["cuda -keys=cuda,gpu -max_num_threads=1024 -thread_warp_size=32", "auto_schedule_thread_fused_matmul", [1, 289, 1024, 448], {}], "config": {"index": 805, "code_hash": null, "entity": [["block_size_x", "ot", 4], ["block_size_y", "ot", 8], ["tx", "ot", 2], ["ty", "ot", 2], ["tk", "ot", 16]]}, "result": [[0.000174532128, 0.000161712187], 0, 70.36998438835144, 1634217322.9803853], "version": 0.2, "tvm_version": "0.8.dev0"}
{"input": ["cuda -keys=cuda,gpu -max_num_threads=1024 -thread_warp_size=32", "auto_schedule_thread_fused_matmul", [1, 289, 1024, 448], {}], "config": {"index": 836, "code_hash": null, "entity": [["block_size_x", "ot", 8], ["block_size_y", "ot", 16], ["tx", "ot", 4], ["ty", "ot", 2], ["tk", "ot", 16]]}, "result": [[0.00011623826, 0.000106088153], 0, 4.01319432258606, 1634217335.2932022], "version": 0.2, "tvm_version": "0.8.dev0"}
{"input": ["cuda -keys=cuda,gpu -max_num_threads=1024 -thread_warp_size=32", "auto_schedule_thread_fused_matmul", [1, 289, 1024, 448], {}], "config": {"index": 502, "code_hash": null, "entity": [["block_size_x", "ot", 16], ["block_size_y", "ot", 4], ["tx", "ot", 2], ["ty", "ot", 4], ["tk", "ot", 8]]}, "result": [[0.000164433544, 0.000150407136], 0, 2.050318479537964, 1634217333.3266537], "version": 0.2, "tvm_version": "0.8.dev0"}
{"input": ["cuda -keys=cuda,gpu -max_num_threads=1024 -thread_warp_size=32", "auto_schedule_thread_fused_matmul", [1, 289, 1024, 448], {}], "config": {"index": 1212, "code_hash": null, "entity": [["block_size_x", "ot", 16], ["block_size_y", "ot", 16], ["tx", "ot", 2], ["ty", "ot", 2], ["tk", "ot", 32]]}, "result": [[0.00010628301199999999, 9.694291099999999e-05], 0, 11.9013090133667, 1634217343.1900034], "version": 0.2, "tvm_version": "0.8.dev0"}
{"input": ["cuda -keys=cuda,gpu -max_num_threads=1024 -thread_warp_size=32", "auto_schedule_thread_fused_matmul", [1, 289, 1024, 448], {}], "config": {"index": 840, "code_hash": null, "entity": [["block_size_x", "ot", 4], ["block_size_y", "ot", 32], ["tx", "ot", 4], ["ty", "ot", 2], ["tk", "ot", 16]]}, "result": [[0.000154093176, 0.000143469005], 0, 8.037790060043335, 1634217339.3117878], "version": 0.2, "tvm_version": "0.8.dev0"}
{"input": ["cuda -keys=cuda,gpu -max_num_threads=1024 -thread_warp_size=32", "auto_schedule_thread_fused_matmul", [1, 289, 1024, 448], {}], "config": {"index": 530, "code_hash": null, "entity": [["block_size_x", "ot", 4], ["block_size_y", "ot", 8], ["tx", "ot", 4], ["ty", "ot", 4], ["tk", "ot", 8]]}, "result": [[0.000144427115, 0.00013203766799999998], 0, 5.990234613418579, 1634217337.2605333], "version": 0.2, "tvm_version": "0.8.dev0"}
{"input": ["cuda -keys=cuda,gpu -max_num_threads=1024 -thread_warp_size=32", "auto_schedule_thread_fused_matmul", [1, 289, 1024, 448], {}], "config": {"index": 830, "code_hash": null, "entity": [["block_size_x", "ot", 4], ["block_size_y", "ot", 8], ["tx", "ot", 4], ["ty", "ot", 2], ["tk", "ot", 16]]}, "result": [[0.000154551886, 0.000143287811], 0, 9.988616228103638, 1634217341.28596], "version": 0.2, "tvm_version": "0.8.dev0"}
{"input": ["cuda -keys=cuda,gpu -max_num_threads=1024 -thread_warp_size=32", "auto_schedule_thread_fused_matmul", [1, 289, 1024, 448], {}], "config": {"index": 1300, "code_hash": null, "entity": [["block_size_x", "ot", 4], ["block_size_y", "ot", 4], ["tx", "ot", 2], ["ty", "ot", 4], ["tk", "ot", 32]]}, "result": [[0.000229414759, 0.00021663269800000003], 0, 16.2502281665802, 1634217347.5316136], "version": 0.2, "tvm_version": "0.8.dev0"}
{"input": ["cuda -keys=cuda,gpu -max_num_threads=1024 -thread_warp_size=32", "auto_schedule_thread_fused_matmul", [1, 289, 1024, 448], {}], "config": {"index": 516, "code_hash": null, "entity": [["block_size_x", "ot", 8], ["block_size_y", "ot", 32], ["tx", "ot", 2], ["ty", "ot", 4], ["tk", "ot", 8]]}, "result": [[0.0002172706, 0.000208094243], 0, 14.087342977523804, 1634217345.3652613], "version": 0.2, "tvm_version": "0.8.dev0"}
{"input": ["cuda -keys=cuda,gpu -max_num_threads=1024 -thread_warp_size=32", "auto_schedule_thread_fused_matmul", [1, 289, 1024, 448], {}], "config": {"index": 131, "code_hash": null, "entity": [["block_size_x", "ot", 8], ["block_size_y", "ot", 8], ["tx", "ot", 4], ["ty", "ot", 4], ["tk", "ot", 4]]}, "result": [[0.000210981978, 0.000199097764], 0, 18.351908445358276, 1634217349.669526], "version": 0.2, "tvm_version": "0.8.dev0"}
{"input": ["cuda -keys=cuda,gpu -max_num_threads=1024 -thread_warp_size=32", "auto_schedule_thread_fused_matmul", [1, 289, 1024, 448], {}], "config": {"index": 412, "code_hash": null, "entity": [["block_size_x", "ot", 16], ["block_size_y", "ot", 16], ["tx", "ot", 2], ["ty", "ot", 2], ["tk", "ot", 8]]}, "result": [[0.000130669012, 0.000120136493], 0, 20.28727626800537, 1634217351.6271093], "version": 0.2, "tvm_version": "0.8.dev0"}
{"input": ["cuda -keys=cuda,gpu -max_num_threads=1024 -thread_warp_size=32", "auto_schedule_thread_fused_matmul", [1, 289, 1024, 448], {}], "config": {"index": 126, "code_hash": null, "entity": [["block_size_x", "ot", 8], ["block_size_y", "ot", 4], ["tx", "ot", 4], ["ty", "ot", 4], ["tk", "ot", 4]]}, "result": [[0.00016149134699999998, 0.00015024365499999998], 0, 24.29273271560669, 1634217355.6211762], "version": 0.2, "tvm_version": "0.8.dev0"}
{"input": ["cuda -keys=cuda,gpu -max_num_threads=1024 -thread_warp_size=32", "auto_schedule_thread_fused_matmul", [1, 289, 1024, 448], {}], "config": {"index": 501, "code_hash": null, "entity": [["block_size_x", "ot", 8], ["block_size_y", "ot", 4], ["tx", "ot", 2], ["ty", "ot", 4], ["tk", "ot", 8]]}, "result": [[0.00014891219699999999, 0.000137519072], 0, 22.274266958236694, 1634217353.5958576], "version": 0.2, "tvm_version": "0.8.dev0"}
{"input": ["cuda -keys=cuda,gpu -max_num_threads=1024 -thread_warp_size=32", "auto_schedule_thread_fused_matmul", [1, 289, 1024, 448], {}], "config": {"index": 1216, "code_hash": null, "entity": [["block_size_x", "ot", 8], ["block_size_y", "ot", 32], ["tx", "ot", 2], ["ty", "ot", 2], ["tk", "ot", 32]]}, "result": [[9.050297000000001e-05, 8.7733046e-05], 0, 26.12901282310486, 1634217357.4612482], "version": 0.2, "tvm_version": "0.8.dev0"}
{"input": ["cuda -keys=cuda,gpu -max_num_threads=1024 -thread_warp_size=32", "auto_schedule_thread_fused_matmul", [1, 289, 1024, 448], {}], "config": {"index": 910, "code_hash": null, "entity": [["block_size_x", "ot", 4], ["block_size_y", "ot", 16], ["tx", "ot", 2], ["ty", "ot", 4], ["tk", "ot", 16]]}, "result": [[0.000120439811, 0.000110127889], 0, 28.105688333511353, 1634217359.448172], "version": 0.2, "tvm_version": "0.8.dev0"}
{"input": ["cuda -keys=cuda,gpu -max_num_threads=1024 -thread_warp_size=32", "auto_schedule_thread_fused_matmul", [1, 289, 1024, 448], {}], "config": {"index": 817, "code_hash": null, "entity": [["block_size_x", "ot", 16], ["block_size_y", "ot", 32], ["tx", "ot", 2], ["ty", "ot", 2], ["tk", "ot", 16]]}, "result": [[9.2169619e-05, 8.550160900000001e-05], 0, 29.975616693496704, 1634217361.3318725], "version": 0.2, "tvm_version": "0.8.dev0"}
{"input": ["cuda -keys=cuda,gpu -max_num_threads=1024 -thread_warp_size=32", "auto_schedule_thread_fused_matmul", [1, 289, 1024, 448], {}], "config": {"index": 202, "code_hash": null, "entity": [["block_size_x", "ot", 16], ["block_size_y", "ot", 4], ["tx", "ot", 2], ["ty", "ot", 8], ["tk", "ot", 4]]}, "result": [[0.00018787517399999998, 0.000175085975], 0, 34.13039803504944, 1634217365.5013988], "version": 0.2, "tvm_version": "0.8.dev0"}
{"input": ["cuda -keys=cuda,gpu -max_num_threads=1024 -thread_warp_size=32", "auto_schedule_thread_fused_matmul", [1, 289, 1024, 448], {}], "config": {"index": 1330, "code_hash": null, "entity": [["block_size_x", "ot", 4], ["block_size_y", "ot", 8], ["tx", "ot", 4], ["ty", "ot", 4], ["tk", "ot", 32]]}, "result": [[0.00013431277800000002, 0.000124656049], 0, 36.12473750114441, 1634217367.4744852], "version": 0.2, "tvm_version": "0.8.dev0"}
{"input": ["cuda -keys=cuda,gpu -max_num_threads=1024 -thread_warp_size=32", "auto_schedule_thread_fused_matmul", [1, 289, 1024, 448], {}], "config": {"index": 535, "code_hash": null, "entity": [["block_size_x", "ot", 4], ["block_size_y", "ot", 16], ["tx", "ot", 4], ["ty", "ot", 4], ["tk", "ot", 8]]}, "result": [[0.00017695343700000003, 0.000163764083], 0, 32.04112887382507, 1634217363.4223037], "version": 0.2, "tvm_version": "0.8.dev0"}
{"input": ["cuda -keys=cuda,gpu -max_num_threads=1024 -thread_warp_size=32", "auto_schedule_thread_fused_matmul", [1, 289, 1024, 448], {}], "config": {"index": 437, "code_hash": null, "entity": [["block_size_x", "ot", 16], ["block_size_y", "ot", 16], ["tx", "ot", 4], ["ty", "ot", 2], ["tk", "ot", 8]]}, "result": [[0.000129603727, 0.00011898312], 0, 38.035423040390015, 1634217369.4275374], "version": 0.2, "tvm_version": "0.8.dev0"}
{"input": ["cuda -keys=cuda,gpu -max_num_threads=1024 -thread_warp_size=32", "auto_schedule_thread_fused_matmul", [1, 289, 1024, 448], {}], "config": {"index": 408, "code_hash": null, "entity": [["block_size_x", "ot", 32], ["block_size_y", "ot", 8], ["tx", "ot", 2], ["ty", "ot", 2], ["tk", "ot", 8]]}, "result": [[0.00014583119199999999, 0.000133641129], 0, 41.89622235298157, 1634217373.2964756], "version": 0.2, "tvm_version": "0.8.dev0"}
{"input": ["cuda -keys=cuda,gpu -max_num_threads=1024 -thread_warp_size=32", "auto_schedule_thread_fused_matmul", [1, 289, 1024, 448], {}], "config": {"index": 420, "code_hash": null, "entity": [["block_size_x", "ot", 4], ["block_size_y", "ot", 64], ["tx", "ot", 2], ["ty", "ot", 2], ["tk", "ot", 8]]}, "result": [[0.00014153344, 0.000129166955], 0, 40.00393104553223, 1634217371.3767774], "version": 0.2, "tvm_version": "0.8.dev0"}
{"input": ["cuda -keys=cuda,gpu -max_num_threads=1024 -thread_warp_size=32", "auto_schedule_thread_fused_matmul", [1, 289, 1024, 448], {}], "config": {"index": 251, "code_hash": null, "entity": [["block_size_x", "ot", 8], ["block_size_y", "ot", 4], ["tx", "ot", 8], ["ty", "ot", 8], ["tk", "ot", 4]]}, "result": [[0.000491614301, 0.000463058775], 0, 47.22708821296692, 1634217378.622275], "version": 0.2, "tvm_version": "0.8.dev0"}
{"input": ["cuda -keys=cuda,gpu -max_num_threads=1024 -thread_warp_size=32", "auto_schedule_thread_fused_matmul", [1, 289, 1024, 448], {}], "config": {"index": 1507, "code_hash": null, "entity": [["block_size_x", "ot", 16], ["block_size_y", "ot", 8], ["tx", "ot", 2], ["ty", "ot", 16], ["tk", "ot", 32]]}, "result": [[0.000431423105, 0.000421275483], 0, 44.53124713897705, 1634217375.893108], "version": 0.2, "tvm_version": "0.8.dev0"}
{"input": ["cuda -keys=cuda,gpu -max_num_threads=1024 -thread_warp_size=32", "auto_schedule_thread_fused_matmul", [1, 289, 1024, 448], {}], "config": {"index": 1310, "code_hash": null, "entity": [["block_size_x", "ot", 4], ["block_size_y", "ot", 16], ["tx", "ot", 2], ["ty", "ot", 4], ["tk", "ot", 32]]}, "result": [[0.000114721566, 0.000105749861], 0, 49.16579222679138, 1634217380.5776412], "version": 0.2, "tvm_version": "0.8.dev0"}
{"input": ["cuda -keys=cuda,gpu -max_num_threads=1024 -thread_warp_size=32", "auto_schedule_thread_fused_matmul", [1, 289, 1024, 448], {}], "config": {"index": 1527, "code_hash": null, "entity": [["block_size_x", "ot", 16], ["block_size_y", "ot", 4], ["tx", "ot", 4], ["ty", "ot", 16], ["tk", "ot", 32]]}, "result": [[0.000277718413, 0.000263334604], 0, 51.36125874519348, 1634217382.7772064], "version": 0.2, "tvm_version": "0.8.dev0"}
{"input": ["cuda -keys=cuda,gpu -max_num_threads=1024 -thread_warp_size=32", "auto_schedule_thread_fused_matmul", [1, 289, 1024, 448], {}], "config": {"index": 153, "code_hash": null, "entity": [["block_size_x", "ot", 32], ["block_size_y", "ot", 4], ["tx", "ot", 8], ["ty", "ot", 4], ["tk", "ot", 4]]}, "result": [[0.000449070526, 0.00043547110099999997], 0, 53.95375680923462, 1634217385.3896062], "version": 0.2, "tvm_version": "0.8.dev0"}
{"input": ["cuda -keys=cuda,gpu -max_num_threads=1024 -thread_warp_size=32", "auto_schedule_thread_fused_matmul", [1, 289, 1024, 448], {}], "config": {"index": 1135, "code_hash": null, "entity": [["block_size_x", "ot", 4], ["block_size_y", "ot", 16], ["tx", "ot", 4], ["ty", "ot", 16], ["tk", "ot", 16]]}, "result": [[0.00077982323, 0.000762021244], 0, 61.325477600097656, 1634217392.734286], "version": 0.2, "tvm_version": "0.8.dev0"}
{"input": ["cuda -keys=cuda,gpu -max_num_threads=1024 -thread_warp_size=32", "auto_schedule_thread_fused_matmul", [1, 289, 1024, 448], {}], "config": {"index": 821, "code_hash": null, "entity": [["block_size_x", "ot", 8], ["block_size_y", "ot", 64], ["tx", "ot", 2], ["ty", "ot", 2], ["tk", "ot", 16]]}, "result": [[0.000124438397, 0.00011542328], 0, 67.29674124717712, 1634217398.7940207], "version": 0.2, "tvm_version": "0.8.dev0"}
{"input": ["cuda -keys=cuda,gpu -max_num_threads=1024 -thread_warp_size=32", "auto_schedule_thread_fused_matmul", [1, 289, 1024, 448], {}], "config": {"index": 1405, "code_hash": null, "entity": [["block_size_x", "ot", 4], ["block_size_y", "ot", 8], ["tx", "ot", 2], ["ty", "ot", 8], ["tk", "ot", 32]]}, "result": [[0.000166712768, 0.000154728116], 0, 69.36777329444885, 1634217400.8414984], "version": 0.2, "tvm_version": "0.8.dev0"}
{"input": ["cuda -keys=cuda,gpu -max_num_threads=1024 -thread_warp_size=32", "auto_schedule_thread_fused_matmul", [1, 289, 1024, 448], {}], "config": {"index": 1433, "code_hash": null, "entity": [["block_size_x", "ot", 32], ["block_size_y", "ot", 8], ["tx", "ot", 4], ["ty", "ot", 8], ["tk", "ot", 32]]}, "result": [[0.000264058181, 0.00025193165], 0, 71.59699726104736, 1634217403.0963697], "version": 0.2, "tvm_version": "0.8.dev0"}
{"input": ["cuda -keys=cuda,gpu -max_num_threads=1024 -thread_warp_size=32", "auto_schedule_thread_fused_matmul", [1, 289, 1024, 448], {}], "config": {"index": 1354, "code_hash": null, "entity": [["block_size_x", "ot", 64], ["block_size_y", "ot", 4], ["tx", "ot", 8], ["ty", "ot", 4], ["tk", "ot", 32]]}, "result": [[0.000422667627, 0.000402076418], 0, 87.33076763153076, 1634217418.8654618], "version": 0.2, "tvm_version": "0.8.dev0"}
{"input": ["cuda -keys=cuda,gpu -max_num_threads=1024 -thread_warp_size=32", "auto_schedule_thread_fused_matmul", [1, 289, 1024, 448], {}], "config": {"index": 1150, "code_hash": null, "entity": [["block_size_x", "ot", 4], ["block_size_y", "ot", 4], ["tx", "ot", 8], ["ty", "ot", 16], ["tk", "ot", 16]]}, "result": [[0.000414481327, 0.000390368279], 0, 82.49126100540161, 1634217413.9585307], "version": 0.2, "tvm_version": "0.8.dev0"}
{"input": ["cuda -keys=cuda,gpu -max_num_threads=1024 -thread_warp_size=32", "auto_schedule_thread_fused_matmul", [1, 289, 1024, 448], {}], "config": {"index": 1128, "code_hash": null, "entity": [["block_size_x", "ot", 32], ["block_size_y", "ot", 4], ["tx", "ot", 4], ["ty", "ot", 16], ["tk", "ot", 16]]}, "result": [[0.00035480153400000006, 0.000337445763], 0, 84.85986685752869, 1634217416.3521864], "version": 0.2, "tvm_version": "0.8.dev0"}
{"input": ["cuda -keys=cuda,gpu -max_num_threads=1024 -thread_warp_size=32", "auto_schedule_thread_fused_matmul", [1, 289, 1024, 448], {}], "config": {"index": 1215, "code_hash": null, "entity": [["block_size_x", "ot", 4], ["block_size_y", "ot", 32], ["tx", "ot", 2], ["ty", "ot", 2], ["tk", "ot", 32]]}, "result": [[9.7963754e-05, 9.0168661e-05], 0, 2.191401720046997, 1634217444.7833574], "version": 0.2, "tvm_version": "0.8.dev0"}
{"input": ["cuda -keys=cuda,gpu -max_num_threads=1024 -thread_warp_size=32", "auto_schedule_thread_fused_matmul", [1, 289, 1024, 448], {}], "config": {"index": 1217, "code_hash": null, "entity": [["block_size_x", "ot", 16], ["block_size_y", "ot", 32], ["tx", "ot", 2], ["ty", "ot", 2], ["tk", "ot", 32]]}, "result": [[9.1089898e-05, 9.025255e-05], 0, 7.950780630111694, 1634217450.578968], "version": 0.2, "tvm_version": "0.8.dev0"}
{"input": ["cuda -keys=cuda,gpu -max_num_threads=1024 -thread_warp_size=32", "auto_schedule_thread_fused_matmul", [1, 289, 1024, 448], {}], "config": {"index": 15, "code_hash": null, "entity": [["block_size_x", "ot", 4], ["block_size_y", "ot", 32], ["tx", "ot", 2], ["ty", "ot", 2], ["tk", "ot", 4]]}, "result": [[0.000128972844, 0.00011885892200000001], 0, 6.035809516906738, 1634217448.6846287], "version": 0.2, "tvm_version": "0.8.dev0"}
{"input": ["cuda -keys=cuda,gpu -max_num_threads=1024 -thread_warp_size=32", "auto_schedule_thread_fused_matmul", [1, 289, 1024, 448], {}], "config": {"index": 1312, "code_hash": null, "entity": [["block_size_x", "ot", 16], ["block_size_y", "ot", 16], ["tx", "ot", 2], ["ty", "ot", 4], ["tk", "ot", 32]]}, "result": [[9.9777896e-05, 9.474291100000001e-05], 0, 4.017777681350708, 1634217446.6471698], "version": 0.2, "tvm_version": "0.8.dev0"}
{"input": ["cuda -keys=cuda,gpu -max_num_threads=1024 -thread_warp_size=32", "auto_schedule_thread_fused_matmul", [1, 289, 1024, 448], {}], "config": {"index": 912, "code_hash": null, "entity": [["block_size_x", "ot", 16], ["block_size_y", "ot", 16], ["tx", "ot", 2], ["ty", "ot", 4], ["tk", "ot", 16]]}, "result": [[0.000105498702, 9.6455358e-05], 0, 13.683411836624146, 1634217456.3503966], "version": 0.2, "tvm_version": "0.8.dev0"}
{"input": ["cuda -keys=cuda,gpu -max_num_threads=1024 -thread_warp_size=32", "auto_schedule_thread_fused_matmul", [1, 289, 1024, 448], {}], "config": {"index": 841, "code_hash": null, "entity": [["block_size_x", "ot", 8], ["block_size_y", "ot", 32], ["tx", "ot", 4], ["ty", "ot", 2], ["tk", "ot", 16]]}, "result": [[0.00015032364999999998, 0.00013840585999999998], 0, 9.924665451049805, 1634217452.5898833], "version": 0.2, "tvm_version": "0.8.dev0"}
{"input": ["cuda -keys=cuda,gpu -max_num_threads=1024 -thread_warp_size=32", "auto_schedule_thread_fused_matmul", [1, 289, 1024, 448], {}], "config": {"index": 1311, "code_hash": null, "entity": [["block_size_x", "ot", 8], ["block_size_y", "ot", 16], ["tx", "ot", 2], ["ty", "ot", 4], ["tk", "ot", 32]]}, "result": [[9.721521400000001e-05, 9.0726997e-05], 0, 15.633187532424927, 1634217458.258581], "version": 0.2, "tvm_version": "0.8.dev0"}
{"input": ["cuda -keys=cuda,gpu -max_num_threads=1024 -thread_warp_size=32", "auto_schedule_thread_fused_matmul", [1, 289, 1024, 448], {}], "config": {"index": 911, "code_hash": null, "entity": [["block_size_x", "ot", 8], ["block_size_y", "ot", 16], ["tx", "ot", 2], ["ty", "ot", 4], ["tk", "ot", 16]]}, "result": [[0.000111324559, 0.00010589789500000001], 0, 11.801489114761353, 1634217454.460646], "version": 0.2, "tvm_version": "0.8.dev0"}
{"input": ["cuda -keys=cuda,gpu -max_num_threads=1024 -thread_warp_size=32", "auto_schedule_thread_fused_matmul", [1, 289, 1024, 448], {}], "config": {"index": 1213, "code_hash": null, "entity": [["block_size_x", "ot", 32], ["block_size_y", "ot", 16], ["tx", "ot", 2], ["ty", "ot", 2], ["tk", "ot", 32]]}, "result": [[0.00010956987800000001, 0.000101511651], 0, 19.377013683319092, 1634217462.079979], "version": 0.2, "tvm_version": "0.8.dev0"}
{"input": ["cuda -keys=cuda,gpu -max_num_threads=1024 -thread_warp_size=32", "auto_schedule_thread_fused_matmul", [1, 289, 1024, 448], {}], "config": {"index": 1220, "code_hash": null, "entity": [["block_size_x", "ot", 4], ["block_size_y", "ot", 64], ["tx", "ot", 2], ["ty", "ot", 2], ["tk", "ot", 32]]}, "result": [[0.000115482965, 0.00011152089499999999], 0, 23.287023782730103, 1634217465.9852836], "version": 0.2, "tvm_version": "0.8.dev0"}
{"input": ["cuda -keys=cuda,gpu -max_num_threads=1024 -thread_warp_size=32", "auto_schedule_thread_fused_matmul", [1, 289, 1024, 448], {}], "config": {"index": 35, "code_hash": null, "entity": [["block_size_x", "ot", 4], ["block_size_y", "ot", 16], ["tx", "ot", 4], ["ty", "ot", 2], ["tk", "ot", 4]]}, "result": [[0.00016124745, 0.00014886577800000001], 0, 21.419519662857056, 1634217464.108905], "version": 0.2, "tvm_version": "0.8.dev0"}
{"input": ["cuda -keys=cuda,gpu -max_num_threads=1024 -thread_warp_size=32", "auto_schedule_thread_fused_matmul", [1, 289, 1024, 448], {}], "config": {"index": 1236, "code_hash": null, "entity": [["block_size_x", "ot", 8], ["block_size_y", "ot", 16], ["tx", "ot", 4], ["ty", "ot", 2], ["tk", "ot", 32]]}, "result": [[0.000100489502, 9.2241975e-05], 0, 17.456467390060425, 1634217460.171792], "version": 0.2, "tvm_version": "0.8.dev0"}
{"input": ["cuda -keys=cuda,gpu -max_num_threads=1024 -thread_warp_size=32", "auto_schedule_thread_fused_matmul", [1, 289, 1024, 448], {}], "config": {"index": 441, "code_hash": null, "entity": [["block_size_x", "ot", 8], ["block_size_y", "ot", 32], ["tx", "ot", 4], ["ty", "ot", 2], ["tk", "ot", 8]]}, "result": [[0.00011153587000000002, 0.000103382349], 0, 25.191022396087646, 1634217467.9048698], "version": 0.2, "tvm_version": "0.8.dev0"}
{"input": ["cuda -keys=cuda,gpu -max_num_threads=1024 -thread_warp_size=32", "auto_schedule_thread_fused_matmul", [1, 289, 1024, 448], {}], "config": {"index": 1240, "code_hash": null, "entity": [["block_size_x", "ot", 4], ["block_size_y", "ot", 32], ["tx", "ot", 4], ["ty", "ot", 2], ["tk", "ot", 32]]}, "result": [[9.9927445e-05, 9.290206299999999e-05], 0, 27.108668565750122, 1634217469.8195224], "version": 0.2, "tvm_version": "0.8.dev0"}
{"input": ["cuda -keys=cuda,gpu -max_num_threads=1024 -thread_warp_size=32", "auto_schedule_thread_fused_matmul", [1, 289, 1024, 448], {}], "config": {"index": 1313, "code_hash": null, "entity": [["block_size_x", "ot", 32], ["block_size_y", "ot", 16], ["tx", "ot", 2], ["ty", "ot", 4], ["tk", "ot", 32]]}, "result": [[0.000139777252, 0.00012851095200000002], 0, 29.076043128967285, 1634217471.8030372], "version": 0.2, "tvm_version": "0.8.dev0"}
{"input": ["cuda -keys=cuda,gpu -max_num_threads=1024 -thread_warp_size=32", "auto_schedule_thread_fused_matmul", [1, 289, 1024, 448], {}], "config": {"index": 1237, "code_hash": null, "entity": [["block_size_x", "ot", 16], ["block_size_y", "ot", 16], ["tx", "ot", 4], ["ty", "ot", 2], ["tk", "ot", 32]]}, "result": [[0.000116021754, 0.000106620743], 0, 36.839282274246216, 1634217479.6208544], "version": 0.2, "tvm_version": "0.8.dev0"}
{"input": ["cuda -keys=cuda,gpu -max_num_threads=1024 -thread_warp_size=32", "auto_schedule_thread_fused_matmul", [1, 289, 1024, 448], {}], "config": {"index": 1332, "code_hash": null, "entity": [["block_size_x", "ot", 16], ["block_size_y", "ot", 8], ["tx", "ot", 4], ["ty", "ot", 4], ["tk", "ot", 32]]}, "result": [[0.000117028487, 0.00011091345900000001], 0, 30.96821117401123, 1634217473.7398288], "version": 0.2, "tvm_version": "0.8.dev0"}
{"input": ["cuda -keys=cuda,gpu -max_num_threads=1024 -thread_warp_size=32", "auto_schedule_thread_fused_matmul", [1, 289, 1024, 448], {}], "config": {"index": 40, "code_hash": null, "entity": [["block_size_x", "ot", 4], ["block_size_y", "ot", 32], ["tx", "ot", 4], ["ty", "ot", 2], ["tk", "ot", 4]]}, "result": [[0.000169462054, 0.000158392966], 0, 33.01990342140198, 1634217475.8094447], "version": 0.2, "tvm_version": "0.8.dev0"}
{"input": ["cuda -keys=cuda,gpu -max_num_threads=1024 -thread_warp_size=32", "auto_schedule_thread_fused_matmul", [1, 289, 1024, 448], {}], "config": {"index": 1241, "code_hash": null, "entity": [["block_size_x", "ot", 8], ["block_size_y", "ot", 32], ["tx", "ot", 4], ["ty", "ot", 2], ["tk", "ot", 32]]}, "result": [[0.00010935571799999999, 0.000101131578], 0, 34.96157145500183, 1634217477.7397718], "version": 0.2, "tvm_version": "0.8.dev0"}
