python/autotvm_logs/thread_fused_matmul_1_289_1024_568.log
{"input": ["cuda -keys=cuda,gpu -max_num_threads=1024 -thread_warp_size=32", "auto_schedule_thread_fused_matmul", [1, 289, 1024, 568], {}], "config": {"index": 518, "code_hash": null, "entity": [["block_size_x", "ot", 32], ["block_size_y", "ot", 32], ["tx", "ot", 2], ["ty", "ot", 4], ["tk", "ot", 8]]}, "result": [[0.000573158536, 0.0005569582990000001], 0, 24.75089168548584, 1634214422.8989954], "version": 0.2, "tvm_version": "0.8.dev0"}
{"input": ["cuda -keys=cuda,gpu -max_num_threads=1024 -thread_warp_size=32", "auto_schedule_thread_fused_matmul", [1, 289, 1024, 568], {}], "config": {"index": 932, "code_hash": null, "entity": [["block_size_x", "ot", 16], ["block_size_y", "ot", 8], ["tx", "ot", 4], ["ty", "ot", 4], ["tk", "ot", 16]]}, "result": [[0.000256224038, 0.00024375031000000002], 0, 37.039939641952515, 1634214435.2521734], "version": 0.2, "tvm_version": "0.8.dev0"}
{"input": ["cuda -keys=cuda,gpu -max_num_threads=1024 -thread_warp_size=32", "auto_schedule_thread_fused_matmul", [1, 289, 1024, 568], {}], "config": {"index": 217, "code_hash": null, "entity": [["block_size_x", "ot", 16], ["block_size_y", "ot", 32], ["tx", "ot", 2], ["ty", "ot", 8], ["tk", "ot", 4]]}, "result": [[0.001075920448, 0.0010637837409999999], 0, 32.72466826438904, 1634214430.9287775], "version": 0.2, "tvm_version": "0.8.dev0"}
{"input": ["cuda -keys=cuda,gpu -max_num_threads=1024 -thread_warp_size=32", "auto_schedule_thread_fused_matmul", [1, 289, 1024, 568], {}], "config": {"index": 621, "code_hash": null, "entity": [["block_size_x", "ot", 8], ["block_size_y", "ot", 64], ["tx", "ot", 2], ["ty", "ot", 8], ["tk", "ot", 8]]}, "result": [[0.000962820192, 0.000947351296], 0, 11.461098194122314, 1634214409.4254742], "version": 0.2, "tvm_version": "0.8.dev0"}
{"input": ["cuda -keys=cuda,gpu -max_num_threads=1024 -thread_warp_size=32", "auto_schedule_thread_fused_matmul", [1, 289, 1024, 568], {}], "config": {"index": 1342, "code_hash": null, "entity": [["block_size_x", "ot", 16], ["block_size_y", "ot", 32], ["tx", "ot", 4], ["ty", "ot", 4], ["tk", "ot", 32]]}, "result": [[0.00032567355, 0.00031132443799999996], 0, 13.853540420532227, 1634214411.81637], "version": 0.2, "tvm_version": "0.8.dev0"}
{"input": ["cuda -keys=cuda,gpu -max_num_threads=1024 -thread_warp_size=32", "auto_schedule_thread_fused_matmul", [1, 289, 1024, 568], {}], "config": {"index": 1312, "code_hash": null, "entity": [["block_size_x", "ot", 16], ["block_size_y", "ot", 16], ["tx", "ot", 2], ["ty", "ot", 4], ["tk", "ot", 32]]}, "result": [[0.000202973626, 0.00018773510200000002], 0, 34.81984734535217, 1634214433.018811], "version": 0.2, "tvm_version": "0.8.dev0"}
{"input": ["cuda -keys=cuda,gpu -max_num_threads=1024 -thread_warp_size=32", "auto_schedule_thread_fused_matmul", [1, 289, 1024, 568], {}], "config": {"index": 1370, "code_hash": null, "entity": [["block_size_x", "ot", 4], ["block_size_y", "ot", 64], ["tx", "ot", 8], ["ty", "ot", 4], ["tk", "ot", 32]]}, "result": [[0.00042708531299999995, 0.000404886712], 0, 43.673569679260254, 1634214441.8720968], "version": 0.2, "tvm_version": "0.8.dev0"}
{"input": ["cuda -keys=cuda,gpu -max_num_threads=1024 -thread_warp_size=32", "auto_schedule_thread_fused_matmul", [1, 289, 1024, 568], {}], "config": {"index": 1126, "code_hash": null, "entity": [["block_size_x", "ot", 8], ["block_size_y", "ot", 4], ["tx", "ot", 4], ["ty", "ot", 16], ["tk", "ot", 16]]}, "result": [[0.00067245959, 0.000653808413], 0, 63.82524847984314, 1634214462.062722], "version": 0.2, "tvm_version": "0.8.dev0"}
{"input": ["cuda -keys=cuda,gpu -max_num_threads=1024 -thread_warp_size=32", "auto_schedule_thread_fused_matmul", [1, 289, 1024, 568], {}], "config": {"index": 554, "code_hash": null, "entity": [["block_size_x", "ot", 64], ["block_size_y", "ot", 4], ["tx", "ot", 8], ["ty", "ot", 4], ["tk", "ot", 8]]}, "result": [[0.000592924712, 0.0005771671080000001], 0, 46.544915199279785, 1634214444.7679641], "version": 0.2, "tvm_version": "0.8.dev0"}
{"input": ["cuda -keys=cuda,gpu -max_num_threads=1024 -thread_warp_size=32", "auto_schedule_thread_fused_matmul", [1, 289, 1024, 568], {}], "config": {"index": 1120, "code_hash": null, "entity": [["block_size_x", "ot", 4], ["block_size_y", "ot", 64], ["tx", "ot", 2], ["ty", "ot", 16], ["tk", "ot", 16]]}, "result": [[0.001100978213, 0.001084414689], 0, 54.554619789123535, 1634214452.788407], "version": 0.2, "tvm_version": "0.8.dev0"}
{"input": ["cuda -keys=cuda,gpu -max_num_threads=1024 -thread_warp_size=32", "auto_schedule_thread_fused_matmul", [1, 289, 1024, 568], {}], "config": {"index": 960, "code_hash": null, "entity": [["block_size_x", "ot", 4], ["block_size_y", "ot", 16], ["tx", "ot", 8], ["ty", "ot", 4], ["tk", "ot", 16]]}, "result": [[0.000376398023, 0.00036199013200000004], 0, 69.18397331237793, 1634214467.4752648], "version": 0.2, "tvm_version": "0.8.dev0"}
{"input": ["cuda -keys=cuda,gpu -max_num_threads=1024 -thread_warp_size=32", "auto_schedule_thread_fused_matmul", [1, 289, 1024, 568], {}], "config": {"index": 41, "code_hash": null, "entity": [["block_size_x", "ot", 8], ["block_size_y", "ot", 32], ["tx", "ot", 4], ["ty", "ot", 2], ["tk", "ot", 4]]}, "result": [[0.000212535488, 0.000199627406], 0, 56.62982511520386, 1634214454.9228935], "version": 0.2, "tvm_version": "0.8.dev0"}
{"input": ["cuda -keys=cuda,gpu -max_num_threads=1024 -thread_warp_size=32", "auto_schedule_thread_fused_matmul", [1, 289, 1024, 568], {}], "config": {"index": 6, "code_hash": null, "entity": [["block_size_x", "ot", 8], ["block_size_y", "ot", 8], ["tx", "ot", 2], ["ty", "ot", 2], ["tk", "ot", 4]]}, "result": [[0.000163314605, 0.00015192154], 0, 75.1914553642273, 1634214473.5518763], "version": 0.2, "tvm_version": "0.8.dev0"}
{"input": ["cuda -keys=cuda,gpu -max_num_threads=1024 -thread_warp_size=32", "auto_schedule_thread_fused_matmul", [1, 289, 1024, 568], {}], "config": {"index": 1132, "code_hash": null, "entity": [["block_size_x", "ot", 16], ["block_size_y", "ot", 8], ["tx", "ot", 4], ["ty", "ot", 16], ["tk", "ot", 16]]}, "result": [[0.000616218925, 0.000600267057], 0, 66.76441311836243, 1634214465.0230553], "version": 0.2, "tvm_version": "0.8.dev0"}
{"input": ["cuda -keys=cuda,gpu -max_num_threads=1024 -thread_warp_size=32", "auto_schedule_thread_fused_matmul", [1, 289, 1024, 568], {}], "config": {"index": 640, "code_hash": null, "entity": [["block_size_x", "ot", 4], ["block_size_y", "ot", 32], ["tx", "ot", 4], ["ty", "ot", 8], ["tk", "ot", 8]]}, "result": [[0.000458818716, 0.000439917304], 0, 81.94097065925598, 1634214480.2681792], "version": 0.2, "tvm_version": "0.8.dev0"}
{"input": ["cuda -keys=cuda,gpu -max_num_threads=1024 -thread_warp_size=32", "auto_schedule_thread_fused_matmul", [1, 289, 1024, 568], {}], "config": {"index": 978, "code_hash": null, "entity": [["block_size_x", "ot", 32], ["block_size_y", "ot", 4], ["tx", "ot", 16], ["ty", "ot", 4], ["tk", "ot", 16]]}, "result": [[0.000784024385, 0.0007667642849999999], 0, 88.44118976593018, 1634214486.8180318], "version": 0.2, "tvm_version": "0.8.dev0"}
{"input": ["cuda -keys=cuda,gpu -max_num_threads=1024 -thread_warp_size=32", "auto_schedule_thread_fused_matmul", [1, 289, 1024, 568], {}], "config": {"index": 30, "code_hash": null, "entity": [["block_size_x", "ot", 4], ["block_size_y", "ot", 8], ["tx", "ot", 4], ["ty", "ot", 2], ["tk", "ot", 4]]}, "result": [[0.000177829355, 0.000164872569], 0, 94.51521253585815, 1634214492.9460611], "version": 0.2, "tvm_version": "0.8.dev0"}
{"input": ["cuda -keys=cuda,gpu -max_num_threads=1024 -thread_warp_size=32", "auto_schedule_thread_fused_matmul", [1, 289, 1024, 568], {}], "config": {"index": 915, "code_hash": null, "entity": [["block_size_x", "ot", 4], ["block_size_y", "ot", 32], ["tx", "ot", 2], ["ty", "ot", 4], ["tk", "ot", 16]]}, "result": [[0.000219161853, 0.000203734095], 0, 96.61033368110657, 1634214495.0308325], "version": 0.2, "tvm_version": "0.8.dev0"}
{"input": ["cuda -keys=cuda,gpu -max_num_threads=1024 -thread_warp_size=32", "auto_schedule_thread_fused_matmul", [1, 289, 1024, 568], {}], "config": {"index": 70, "code_hash": null, "entity": [["block_size_x", "ot", 4], ["block_size_y", "ot", 64], ["tx", "ot", 8], ["ty", "ot", 2], ["tk", "ot", 4]]}, "result": [[0.00029516114399999997, 0.00028215573899999995], 0, 108.17052483558655, 1634214506.5857198], "version": 0.2, "tvm_version": "0.8.dev0"}
{"input": ["cuda -keys=cuda,gpu -max_num_threads=1024 -thread_warp_size=32", "auto_schedule_thread_fused_matmul", [1, 289, 1024, 568], {}], "config": {"index": 535, "code_hash": null, "entity": [["block_size_x", "ot", 4], ["block_size_y", "ot", 16], ["tx", "ot", 4], ["ty", "ot", 4], ["tk", "ot", 8]]}, "result": [[0.000263484459, 0.00025172758699999997], 0, 110.43165421485901, 1634214508.8382907], "version": 0.2, "tvm_version": "0.8.dev0"}
{"input": ["cuda -keys=cuda,gpu -max_num_threads=1024 -thread_warp_size=32", "auto_schedule_thread_fused_matmul", [1, 289, 1024, 568], {}], "config": {"index": 1465, "code_hash": null, "entity": [["block_size_x", "ot", 4], ["block_size_y", "ot", 32], ["tx", "ot", 8], ["ty", "ot", 8], ["tk", "ot", 32]]}, "result": [[0.000767731021, 0.000757640491], 0, 85.29345631599426, 1634214483.566376], "version": 0.2, "tvm_version": "0.8.dev0"}
{"input": ["cuda -keys=cuda,gpu -max_num_threads=1024 -thread_warp_size=32", "auto_schedule_thread_fused_matmul", [1, 289, 1024, 568], {}], "config": {"index": 151, "code_hash": null, "entity": [["block_size_x", "ot", 8], ["block_size_y", "ot", 4], ["tx", "ot", 8], ["ty", "ot", 4], ["tk", "ot", 4]]}, "result": [[0.000460773734, 0.00044701010600000003], 0, 105.87516260147095, 1634214504.2953467], "version": 0.2, "tvm_version": "0.8.dev0"}
{"input": ["cuda -keys=cuda,gpu -max_num_threads=1024 -thread_warp_size=32", "auto_schedule_thread_fused_matmul", [1, 289, 1024, 568], {}], "config": {"index": 800, "code_hash": null, "entity": [["block_size_x", "ot", 4], ["block_size_y", "ot", 4], ["tx", "ot", 2], ["ty", "ot", 2], ["tk", "ot", 16]]}, "result": [[0.00039783259700000004, 0.000381015079], 0, 103.19917559623718, 1634214501.6320705], "version": 0.2, "tvm_version": "0.8.dev0"}
{"input": ["cuda -keys=cuda,gpu -max_num_threads=1024 -thread_warp_size=32", "auto_schedule_thread_fused_matmul", [1, 289, 1024, 568], {}], "config": {"index": 858, "code_hash": null, "entity": [["block_size_x", "ot", 32], ["block_size_y", "ot", 8], ["tx", "ot", 8], ["ty", "ot", 2], ["tk", "ot", 16]]}, "result": [[0.000295950179, 0.000278450198], 0, 6.504040956497192, 1634214515.910223], "version": 0.2, "tvm_version": "0.8.dev0"}
{"input": ["cuda -keys=cuda,gpu -max_num_threads=1024 -thread_warp_size=32", "auto_schedule_thread_fused_matmul", [1, 289, 1024, 568], {}], "config": {"index": 641, "code_hash": null, "entity": [["block_size_x", "ot", 8], ["block_size_y", "ot", 32], ["tx", "ot", 4], ["ty", "ot", 8], ["tk", "ot", 8]]}, "result": [[0.000783602025, 0.000769489414], 0, 16.499890327453613, 1634214525.863218], "version": 0.2, "tvm_version": "0.8.dev0"}
{"input": ["cuda -keys=cuda,gpu -max_num_threads=1024 -thread_warp_size=32", "auto_schedule_thread_fused_matmul", [1, 289, 1024, 568], {}], "config": {"index": 964, "code_hash": null, "entity": [["block_size_x", "ot", 64], ["block_size_y", "ot", 16], ["tx", "ot", 8], ["ty", "ot", 4], ["tk", "ot", 16]]}, "result": [[0.001249638764, 0.001228102295], 0, 26.843791007995605, 1634214536.2686021], "version": 0.2, "tvm_version": "0.8.dev0"}
{"input": ["cuda -keys=cuda,gpu -max_num_threads=1024 -thread_warp_size=32", "auto_schedule_thread_fused_matmul", [1, 289, 1024, 568], {}], "config": {"index": 204, "code_hash": null, "entity": [["block_size_x", "ot", 64], ["block_size_y", "ot", 4], ["tx", "ot", 2], ["ty", "ot", 8], ["tk", "ot", 4]]}, "result": [[0.000443278277, 0.000428016334], 0, 13.117375135421753, 1634214522.5876307], "version": 0.2, "tvm_version": "0.8.dev0"}
{"input": ["cuda -keys=cuda,gpu -max_num_threads=1024 -thread_warp_size=32", "auto_schedule_thread_fused_matmul", [1, 289, 1024, 568], {}], "config": {"index": 902, "code_hash": null, "entity": [["block_size_x", "ot", 16], ["block_size_y", "ot", 4], ["tx", "ot", 2], ["ty", "ot", 4], ["tk", "ot", 16]]}, "result": [[0.000246821877, 0.00023320222499999998], 0, 22.678465366363525, 1634214532.1311843], "version": 0.2, "tvm_version": "0.8.dev0"}
{"input": ["cuda -keys=cuda,gpu -max_num_threads=1024 -thread_warp_size=32", "auto_schedule_thread_fused_matmul", [1, 289, 1024, 568], {}], "config": {"index": 1034, "code_hash": null, "entity": [["block_size_x", "ot", 64], ["block_size_y", "ot", 8], ["tx", "ot", 4], ["ty", "ot", 8], ["tk", "ot", 16]]}, "result": [[0.0007870998299999999, 0.000771364853], 0, 38.28345608711243, 1634214547.759823], "version": 0.2, "tvm_version": "0.8.dev0"}
{"input": ["cuda -keys=cuda,gpu -max_num_threads=1024 -thread_warp_size=32", "auto_schedule_thread_fused_matmul", [1, 289, 1024, 568], {}], "config": {"index": 409, "code_hash": null, "entity": [["block_size_x", "ot", 64], ["block_size_y", "ot", 8], ["tx", "ot", 2], ["ty", "ot", 2], ["tk", "ot", 8]]}, "result": [[0.000248524384, 0.00022936311799999997], 0, 40.3852481842041, 1634214549.8616369], "version": 0.2, "tvm_version": "0.8.dev0"}
{"input": ["cuda -keys=cuda,gpu -max_num_threads=1024 -thread_warp_size=32", "auto_schedule_thread_fused_matmul", [1, 289, 1024, 568], {}], "config": {"index": 162, "code_hash": null, "entity": [["block_size_x", "ot", 16], ["block_size_y", "ot", 16], ["tx", "ot", 8], ["ty", "ot", 4], ["tk", "ot", 4]]}, "result": [[0.0007877458120000001, 0.0007778078149999999], 0, 51.17788028717041, 1634214560.6145997], "version": 0.2, "tvm_version": "0.8.dev0"}
{"input": ["cuda -keys=cuda,gpu -max_num_threads=1024 -thread_warp_size=32", "auto_schedule_thread_fused_matmul", [1, 289, 1024, 568], {}], "config": {"index": 506, "code_hash": null, "entity": [["block_size_x", "ot", 8], ["block_size_y", "ot", 8], ["tx", "ot", 2], ["ty", "ot", 4], ["tk", "ot", 8]]}, "result": [[0.00019108725699999997, 0.00017643080800000001], 0, 47.79746890068054, 1634214557.297607], "version": 0.2, "tvm_version": "0.8.dev0"}
{"input": ["cuda -keys=cuda,gpu -max_num_threads=1024 -thread_warp_size=32", "auto_schedule_thread_fused_matmul", [1, 289, 1024, 568], {}], "config": {"index": 330, "code_hash": null, "entity": [["block_size_x", "ot", 4], ["block_size_y", "ot", 8], ["tx", "ot", 4], ["ty", "ot", 16], ["tk", "ot", 4]]}, "result": [[0.000724871843, 0.000710310926], 0, 45.82840943336487, 1634214555.2307062], "version": 0.2, "tvm_version": "0.8.dev0"}
{"input": ["cuda -keys=cuda,gpu -max_num_threads=1024 -thread_warp_size=32", "auto_schedule_thread_fused_matmul", [1, 289, 1024, 568], {}], "config": {"index": 25, "code_hash": null, "entity": [["block_size_x", "ot", 4], ["block_size_y", "ot", 4], ["tx", "ot", 4], ["ty", "ot", 2], ["tk", "ot", 4]]}, "result": [[0.00025537837499999997, 0.000242676925], 0, 42.6020712852478, 1634214552.0456555], "version": 0.2, "tvm_version": "0.8.dev0"}
{"input": ["cuda -keys=cuda,gpu -max_num_threads=1024 -thread_warp_size=32", "auto_schedule_thread_fused_matmul", [1, 289, 1024, 568], {}], "config": {"index": 803, "code_hash": null, "entity": [["block_size_x", "ot", 32], ["block_size_y", "ot", 4], ["tx", "ot", 2], ["ty", "ot", 2], ["tk", "ot", 16]]}, "result": [[0.0003701499, 0.000355083211], 0, 57.69753932952881, 1634214567.1481695], "version": 0.2, "tvm_version": "0.8.dev0"}
{"input": ["cuda -keys=cuda,gpu -max_num_threads=1024 -thread_warp_size=32", "auto_schedule_thread_fused_matmul", [1, 289, 1024, 568], {}], "config": {"index": 991, "code_hash": null, "entity": [["block_size_x", "ot", 8], ["block_size_y", "ot", 32], ["tx", "ot", 16], ["ty", "ot", 4], ["tk", "ot", 16]]}, "result": [[0.00079574135, 0.000783964158], 0, 61.065306186676025, 1634214570.5055883], "version": 0.2, "tvm_version": "0.8.dev0"}
{"input": ["cuda -keys=cuda,gpu -max_num_threads=1024 -thread_warp_size=32", "auto_schedule_thread_fused_matmul", [1, 289, 1024, 568], {}], "config": {"index": 957, "code_hash": null, "entity": [["block_size_x", "ot", 16], ["block_size_y", "ot", 8], ["tx", "ot", 8], ["ty", "ot", 4], ["tk", "ot", 16]]}, "result": [[0.00038829290200000007, 0.000369865697], 0, 63.51171684265137, 1634214572.9459105], "version": 0.2, "tvm_version": "0.8.dev0"}
{"input": ["cuda -keys=cuda,gpu -max_num_threads=1024 -thread_warp_size=32", "auto_schedule_thread_fused_matmul", [1, 289, 1024, 568], {}], "config": {"index": 207, "code_hash": null, "entity": [["block_size_x", "ot", 16], ["block_size_y", "ot", 8], ["tx", "ot", 2], ["ty", "ot", 8], ["tk", "ot", 4]]}, "result": [[0.000379317224, 0.000361178144], 0, 65.91852140426636, 1634214575.350905], "version": 0.2, "tvm_version": "0.8.dev0"}
{"input": ["cuda -keys=cuda,gpu -max_num_threads=1024 -thread_warp_size=32", "auto_schedule_thread_fused_matmul", [1, 289, 1024, 568], {}], "config": {"index": 835, "code_hash": null, "entity": [["block_size_x", "ot", 4], ["block_size_y", "ot", 16], ["tx", "ot", 4], ["ty", "ot", 2], ["tk", "ot", 16]]}, "result": [[0.000156778701, 0.000144629073], 0, 67.92864680290222, 1634214577.3867142], "version": 0.2, "tvm_version": "0.8.dev0"}
{"input": ["cuda -keys=cuda,gpu -max_num_threads=1024 -thread_warp_size=32", "auto_schedule_thread_fused_matmul", [1, 289, 1024, 568], {}], "config": {"index": 910, "code_hash": null, "entity": [["block_size_x", "ot", 4], ["block_size_y", "ot", 16], ["tx", "ot", 2], ["ty", "ot", 4], ["tk", "ot", 16]]}, "result": [[0.000171278499, 0.00015761257400000002], 0, 82.6051824092865, 1634214592.0899158], "version": 0.2, "tvm_version": "0.8.dev0"}
{"input": ["cuda -keys=cuda,gpu -max_num_threads=1024 -thread_warp_size=32", "auto_schedule_thread_fused_matmul", [1, 289, 1024, 568], {}], "config": {"index": 630, "code_hash": null, "entity": [["block_size_x", "ot", 4], ["block_size_y", "ot", 8], ["tx", "ot", 4], ["ty", "ot", 8], ["tk", "ot", 8]]}, "result": [[0.000370861028, 0.00035389284199999996], 0, 74.54539656639099, 1634214584.0356905], "version": 0.2, "tvm_version": "0.8.dev0"}
{"input": ["cuda -keys=cuda,gpu -max_num_threads=1024 -thread_warp_size=32", "auto_schedule_thread_fused_matmul", [1, 289, 1024, 568], {}], "config": {"index": 1222, "code_hash": null, "entity": [["block_size_x", "ot", 16], ["block_size_y", "ot", 64], ["tx", "ot", 2], ["ty", "ot", 2], ["tk", "ot", 32]]}, "result": [[0.000199967799, 0.00018817456400000001], 0, 72.09393978118896, 1634214581.579335], "version": 0.2, "tvm_version": "0.8.dev0"}
{"input": ["cuda -keys=cuda,gpu -max_num_threads=1024 -thread_warp_size=32", "auto_schedule_thread_fused_matmul", [1, 289, 1024, 568], {}], "config": {"index": 1255, "code_hash": null, "entity": [["block_size_x", "ot", 4], ["block_size_y", "ot", 8], ["tx", "ot", 8], ["ty", "ot", 2], ["tk", "ot", 32]]}, "result": [[0.00021157985099999998, 0.00019956212199999997], 0, 70.0642318725586, 1634214579.5409756], "version": 0.2, "tvm_version": "0.8.dev0"}
{"input": ["cuda -keys=cuda,gpu -max_num_threads=1024 -thread_warp_size=32", "auto_schedule_thread_fused_matmul", [1, 289, 1024, 568], {}], "config": {"index": 553, "code_hash": null, "entity": [["block_size_x", "ot", 32], ["block_size_y", "ot", 4], ["tx", "ot", 8], ["ty", "ot", 4], ["tk", "ot", 8]]}, "result": [[0.00052797938, 0.000509480026], 0, 77.2822630405426, 1634214586.75369], "version": 0.2, "tvm_version": "0.8.dev0"}
{"input": ["cuda -keys=cuda,gpu -max_num_threads=1024 -thread_warp_size=32", "auto_schedule_thread_fused_matmul", [1, 289, 1024, 568], {}], "config": {"index": 983, "code_hash": null, "entity": [["block_size_x", "ot", 32], ["block_size_y", "ot", 8], ["tx", "ot", 16], ["ty", "ot", 4], ["tk", "ot", 16]]}, "result": [[0.000761975898, 0.000738044461], 0, 80.57673382759094, 1634214590.014512], "version": 0.2, "tvm_version": "0.8.dev0"}
{"input": ["cuda -keys=cuda,gpu -max_num_threads=1024 -thread_warp_size=32", "auto_schedule_thread_fused_matmul", [1, 289, 1024, 568], {}], "config": {"index": 213, "code_hash": null, "entity": [["block_size_x", "ot", 32], ["block_size_y", "ot", 16], ["tx", "ot", 2], ["ty", "ot", 8], ["tk", "ot", 4]]}, "result": [[0.0006968751959999999, 0.000680409897], 0, 91.81340169906616, 1634214601.3234298], "version": 0.2, "tvm_version": "0.8.dev0"}
{"input": ["cuda -keys=cuda,gpu -max_num_threads=1024 -thread_warp_size=32", "auto_schedule_thread_fused_matmul", [1, 289, 1024, 568], {}], "config": {"index": 412, "code_hash": null, "entity": [["block_size_x", "ot", 16], ["block_size_y", "ot", 16], ["tx", "ot", 2], ["ty", "ot", 2], ["tk", "ot", 8]]}, "result": [[0.000162326971, 0.00015100186099999997], 0, 88.7122814655304, 1634214598.2368922], "version": 0.2, "tvm_version": "0.8.dev0"}
{"input": ["cuda -keys=cuda,gpu -max_num_threads=1024 -thread_warp_size=32", "auto_schedule_thread_fused_matmul", [1, 289, 1024, 568], {}], "config": {"index": 443, "code_hash": null, "entity": [["block_size_x", "ot", 32], ["block_size_y", "ot", 32], ["tx", "ot", 4], ["ty", "ot", 2], ["tk", "ot", 8]]}, "result": [[0.000406679203, 0.00038847632399999996], 0, 113.81549572944641, 1634214623.3536563], "version": 0.2, "tvm_version": "0.8.dev0"}
{"input": ["cuda -keys=cuda,gpu -max_num_threads=1024 -thread_warp_size=32", "auto_schedule_thread_fused_matmul", [1, 289, 1024, 568], {}], "config": {"index": 104, "code_hash": null, "entity": [["block_size_x", "ot", 64], ["block_size_y", "ot", 4], ["tx", "ot", 2], ["ty", "ot", 4], ["tk", "ot", 4]]}, "result": [[0.000230863626, 0.000216761051], 0, 98.91098284721375, 1634214608.4935958], "version": 0.2, "tvm_version": "0.8.dev0"}
{"input": ["cuda -keys=cuda,gpu -max_num_threads=1024 -thread_warp_size=32", "auto_schedule_thread_fused_matmul", [1, 289, 1024, 568], {}], "config": {"index": 1209, "code_hash": null, "entity": [["block_size_x", "ot", 64], ["block_size_y", "ot", 8], ["tx", "ot", 2], ["ty", "ot", 2], ["tk", "ot", 32]]}, "result": [[0.00026464011499999993, 0.000245170844], 0, 93.90841913223267, 1634214603.4617064], "version": 0.2, "tvm_version": "0.8.dev0"}
{"input": ["cuda -keys=cuda,gpu -max_num_threads=1024 -thread_warp_size=32", "auto_schedule_thread_fused_matmul", [1, 289, 1024, 568], {}], "config": {"index": 656, "code_hash": null, "entity": [["block_size_x", "ot", 8], ["block_size_y", "ot", 8], ["tx", "ot", 8], ["ty", "ot", 8], ["tk", "ot", 8]]}, "result": [[0.000623963928, 0.0006054815640000001], 0, 96.84378790855408, 1634214606.382842], "version": 0.2, "tvm_version": "0.8.dev0"}
{"input": ["cuda -keys=cuda,gpu -max_num_threads=1024 -thread_warp_size=32", "auto_schedule_thread_fused_matmul", [1, 289, 1024, 568], {}], "config": {"index": 147, "code_hash": null, "entity": [["block_size_x", "ot", 16], ["block_size_y", "ot", 64], ["tx", "ot", 4], ["ty", "ot", 4], ["tk", "ot", 4]]}, "result": [[0.00072197412, 0.000703201275], 0, 116.92813634872437, 1634214626.5144315], "version": 0.2, "tvm_version": "0.8.dev0"}
{"input": ["cuda -keys=cuda,gpu -max_num_threads=1024 -thread_warp_size=32", "auto_schedule_thread_fused_matmul", [1, 289, 1024, 568], {}], "config": {"index": 811, "code_hash": null, "entity": [["block_size_x", "ot", 8], ["block_size_y", "ot", 16], ["tx", "ot", 2], ["ty", "ot", 2], ["tk", "ot", 16]]}, "result": [[0.00014318314100000002, 0.00013148149799999999], 0, 2.17610239982605, 1634214637.8076394], "version": 0.2, "tvm_version": "0.8.dev0"}
{"input": ["cuda -keys=cuda,gpu -max_num_threads=1024 -thread_warp_size=32", "auto_schedule_thread_fused_matmul", [1, 289, 1024, 568], {}], "config": {"index": 812, "code_hash": null, "entity": [["block_size_x", "ot", 16], ["block_size_y", "ot", 16], ["tx", "ot", 2], ["ty", "ot", 2], ["tk", "ot", 16]]}, "result": [[0.00015320591099999997, 0.00014406772200000002], 0, 6.203120946884155, 1634214641.8332536], "version": 0.2, "tvm_version": "0.8.dev0"}
{"input": ["cuda -keys=cuda,gpu -max_num_threads=1024 -thread_warp_size=32", "auto_schedule_thread_fused_matmul", [1, 289, 1024, 568], {}], "config": {"index": 1211, "code_hash": null, "entity": [["block_size_x", "ot", 8], ["block_size_y", "ot", 16], ["tx", "ot", 2], ["ty", "ot", 2], ["tk", "ot", 32]]}, "result": [[0.000139131214, 0.00013006728], 0, 8.191107034683228, 1634214643.856114], "version": 0.2, "tvm_version": "0.8.dev0"}
{"input": ["cuda -keys=cuda,gpu -max_num_threads=1024 -thread_warp_size=32", "auto_schedule_thread_fused_matmul", [1, 289, 1024, 568], {}], "config": {"index": 1210, "code_hash": null, "entity": [["block_size_x", "ot", 4], ["block_size_y", "ot", 16], ["tx", "ot", 2], ["ty", "ot", 2], ["tk", "ot", 32]]}, "result": [[0.000153234285, 0.00014039254000000002], 0, 4.264545440673828, 1634214639.7798073], "version": 0.2, "tvm_version": "0.8.dev0"}
{"input": ["cuda -keys=cuda,gpu -max_num_threads=1024 -thread_warp_size=32", "auto_schedule_thread_fused_matmul", [1, 289, 1024, 568], {}], "config": {"index": 836, "code_hash": null, "entity": [["block_size_x", "ot", 8], ["block_size_y", "ot", 16], ["tx", "ot", 4], ["ty", "ot", 2], ["tk", "ot", 16]]}, "result": [[0.000151935046, 0.00014208822900000002], 0, 18.233367919921875, 1634214653.8904877], "version": 0.2, "tvm_version": "0.8.dev0"}
{"input": ["cuda -keys=cuda,gpu -max_num_threads=1024 -thread_warp_size=32", "auto_schedule_thread_fused_matmul", [1, 289, 1024, 568], {}], "config": {"index": 810, "code_hash": null, "entity": [["block_size_x", "ot", 4], ["block_size_y", "ot", 16], ["tx", "ot", 2], ["ty", "ot", 2], ["tk", "ot", 16]]}, "result": [[0.000149390094, 0.00013934417300000003], 0, 10.28553056716919, 1634214645.844018], "version": 0.2, "tvm_version": "0.8.dev0"}
{"input": ["cuda -keys=cuda,gpu -max_num_threads=1024 -thread_warp_size=32", "auto_schedule_thread_fused_matmul", [1, 289, 1024, 568], {}], "config": {"index": 1212, "code_hash": null, "entity": [["block_size_x", "ot", 16], ["block_size_y", "ot", 16], ["tx", "ot", 2], ["ty", "ot", 2], ["tk", "ot", 32]]}, "result": [[0.000149957858, 0.000139766769], 0, 12.218010902404785, 1634214647.8602436], "version": 0.2, "tvm_version": "0.8.dev0"}
{"input": ["cuda -keys=cuda,gpu -max_num_threads=1024 -thread_warp_size=32", "auto_schedule_thread_fused_matmul", [1, 289, 1024, 568], {}], "config": {"index": 1216, "code_hash": null, "entity": [["block_size_x", "ot", 8], ["block_size_y", "ot", 32], ["tx", "ot", 2], ["ty", "ot", 2], ["tk", "ot", 32]]}, "result": [[0.000150509632, 0.00013834079700000002], 0, 14.106078147888184, 1634214649.823318], "version": 0.2, "tvm_version": "0.8.dev0"}
{"input": ["cuda -keys=cuda,gpu -max_num_threads=1024 -thread_warp_size=32", "auto_schedule_thread_fused_matmul", [1, 289, 1024, 568], {}], "config": {"index": 840, "code_hash": null, "entity": [["block_size_x", "ot", 4], ["block_size_y", "ot", 32], ["tx", "ot", 4], ["ty", "ot", 2], ["tk", "ot", 16]]}, "result": [[0.00015513721099999999, 0.00014482343], 0, 16.09440016746521, 1634214651.811236], "version": 0.2, "tvm_version": "0.8.dev0"}
{"input": ["cuda -keys=cuda,gpu -max_num_threads=1024 -thread_warp_size=32", "auto_schedule_thread_fused_matmul", [1, 289, 1024, 568], {}], "config": {"index": 1206, "code_hash": null, "entity": [["block_size_x", "ot", 8], ["block_size_y", "ot", 8], ["tx", "ot", 2], ["ty", "ot", 2], ["tk", "ot", 32]]}, "result": [[0.000208399204, 0.000195271041], 0, 20.338865995407104, 1634214656.016229], "version": 0.2, "tvm_version": "0.8.dev0"}
{"input": ["cuda -keys=cuda,gpu -max_num_threads=1024 -thread_warp_size=32", "auto_schedule_thread_fused_matmul", [1, 289, 1024, 568], {}], "config": {"index": 435, "code_hash": null, "entity": [["block_size_x", "ot", 4], ["block_size_y", "ot", 16], ["tx", "ot", 4], ["ty", "ot", 2], ["tk", "ot", 8]]}, "result": [[0.000171185267, 0.000157583282], 0, 24.36660385131836, 1634214660.0245922], "version": 0.2, "tvm_version": "0.8.dev0"}
{"input": ["cuda -keys=cuda,gpu -max_num_threads=1024 -thread_warp_size=32", "auto_schedule_thread_fused_matmul", [1, 289, 1024, 568], {}], "config": {"index": 1235, "code_hash": null, "entity": [["block_size_x", "ot", 4], ["block_size_y", "ot", 16], ["tx", "ot", 4], ["ty", "ot", 2], ["tk", "ot", 32]]}, "result": [[0.00015275088, 0.00013954571999999998], 0, 22.373719215393066, 1634214657.959672], "version": 0.2, "tvm_version": "0.8.dev0"}
{"input": ["cuda -keys=cuda,gpu -max_num_threads=1024 -thread_warp_size=32", "auto_schedule_thread_fused_matmul", [1, 289, 1024, 568], {}], "config": {"index": 816, "code_hash": null, "entity": [["block_size_x", "ot", 8], ["block_size_y", "ot", 32], ["tx", "ot", 2], ["ty", "ot", 2], ["tk", "ot", 16]]}, "result": [[0.00015257828100000002, 0.000142097332], 0, 26.294520616531372, 1634214662.0587533], "version": 0.2, "tvm_version": "0.8.dev0"}
{"input": ["cuda -keys=cuda,gpu -max_num_threads=1024 -thread_warp_size=32", "auto_schedule_thread_fused_matmul", [1, 289, 1024, 568], {}], "config": {"index": 815, "code_hash": null, "entity": [["block_size_x", "ot", 4], ["block_size_y", "ot", 32], ["tx", "ot", 2], ["ty", "ot", 2], ["tk", "ot", 16]]}, "result": [[0.000147385321, 0.000143471938], 0, 32.49748730659485, 1634214668.2152145], "version": 0.2, "tvm_version": "0.8.dev0"}
{"input": ["cuda -keys=cuda,gpu -max_num_threads=1024 -thread_warp_size=32", "auto_schedule_thread_fused_matmul", [1, 289, 1024, 568], {}], "config": {"index": 1230, "code_hash": null, "entity": [["block_size_x", "ot", 4], ["block_size_y", "ot", 8], ["tx", "ot", 4], ["ty", "ot", 2], ["tk", "ot", 32]]}, "result": [[0.000206035539, 0.000192084418], 0, 30.45783567428589, 1634214666.1331193], "version": 0.2, "tvm_version": "0.8.dev0"}
{"input": ["cuda -keys=cuda,gpu -max_num_threads=1024 -thread_warp_size=32", "auto_schedule_thread_fused_matmul", [1, 289, 1024, 568], {}], "config": {"index": 436, "code_hash": null, "entity": [["block_size_x", "ot", 8], ["block_size_y", "ot", 16], ["tx", "ot", 4], ["ty", "ot", 2], ["tk", "ot", 8]]}, "result": [[0.00017372691299999998, 0.000161873929], 0, 28.310704469680786, 1634214664.1032825], "version": 0.2, "tvm_version": "0.8.dev0"}
{"input": ["cuda -keys=cuda,gpu -max_num_threads=1024 -thread_warp_size=32", "auto_schedule_thread_fused_matmul", [1, 289, 1024, 568], {}], "config": {"index": 807, "code_hash": null, "entity": [["block_size_x", "ot", 16], ["block_size_y", "ot", 8], ["tx", "ot", 2], ["ty", "ot", 2], ["tk", "ot", 16]]}, "result": [[0.000208773695, 0.00019673617300000002], 0, 38.627448320388794, 1634214674.3835247], "version": 0.2, "tvm_version": "0.8.dev0"}
{"input": ["cuda -keys=cuda,gpu -max_num_threads=1024 -thread_warp_size=32", "auto_schedule_thread_fused_matmul", [1, 289, 1024, 568], {}], "config": {"index": 830, "code_hash": null, "entity": [["block_size_x", "ot", 4], ["block_size_y", "ot", 8], ["tx", "ot", 4], ["ty", "ot", 2], ["tk", "ot", 16]]}, "result": [[0.00020449219999999998, 0.000187375721], 0, 36.57277727127075, 1634214672.2759914], "version": 0.2, "tvm_version": "0.8.dev0"}
{"input": ["cuda -keys=cuda,gpu -max_num_threads=1024 -thread_warp_size=32", "auto_schedule_thread_fused_matmul", [1, 289, 1024, 568], {}], "config": {"index": 31, "code_hash": null, "entity": [["block_size_x", "ot", 8], ["block_size_y", "ot", 8], ["tx", "ot", 4], ["ty", "ot", 2], ["tk", "ot", 4]]}, "result": [[0.00018347712200000003, 0.000170376806], 0, 34.58342528343201, 1634214670.2407737], "version": 0.2, "tvm_version": "0.8.dev0"}
{"input": ["cuda -keys=cuda,gpu -max_num_threads=1024 -thread_warp_size=32", "auto_schedule_thread_fused_matmul", [1, 289, 1024, 568], {}], "config": {"index": 440, "code_hash": null, "entity": [["block_size_x", "ot", 4], ["block_size_y", "ot", 32], ["tx", "ot", 4], ["ty", "ot", 2], ["tk", "ot", 8]]}, "result": [[0.00016757165299999998, 0.000157685454], 0, 40.7965874671936, 1634214676.4543018], "version": 0.2, "tvm_version": "0.8.dev0"}
{"input": ["cuda -keys=cuda,gpu -max_num_threads=1024 -thread_warp_size=32", "auto_schedule_thread_fused_matmul", [1, 289, 1024, 568], {}], "config": {"index": 411, "code_hash": null, "entity": [["block_size_x", "ot", 8], ["block_size_y", "ot", 16], ["tx", "ot", 2], ["ty", "ot", 2], ["tk", "ot", 8]]}, "result": [[0.000148116525, 0.000138158069], 0, 44.75418043136597, 1634214680.4164715], "version": 0.2, "tvm_version": "0.8.dev0"}
{"input": ["cuda -keys=cuda,gpu -max_num_threads=1024 -thread_warp_size=32", "auto_schedule_thread_fused_matmul", [1, 289, 1024, 568], {}], "config": {"index": 407, "code_hash": null, "entity": [["block_size_x", "ot", 16], ["block_size_y", "ot", 8], ["tx", "ot", 2], ["ty", "ot", 2], ["tk", "ot", 8]]}, "result": [[0.000175627678, 0.000163174839], 0, 48.818365812301636, 1634214684.5850782], "version": 0.2, "tvm_version": "0.8.dev0"}
{"input": ["cuda -keys=cuda,gpu -max_num_threads=1024 -thread_warp_size=32", "auto_schedule_thread_fused_matmul", [1, 289, 1024, 568], {}], "config": {"index": 1217, "code_hash": null, "entity": [["block_size_x", "ot", 16], ["block_size_y", "ot", 32], ["tx", "ot", 2], ["ty", "ot", 2], ["tk", "ot", 32]]}, "result": [[0.000189223177, 0.000175475147], 0, 46.76374077796936, 1634214682.4933054], "version": 0.2, "tvm_version": "0.8.dev0"}
{"input": ["cuda -keys=cuda,gpu -max_num_threads=1024 -thread_warp_size=32", "auto_schedule_thread_fused_matmul", [1, 289, 1024, 568], {}], "config": {"index": 1236, "code_hash": null, "entity": [["block_size_x", "ot", 8], ["block_size_y", "ot", 16], ["tx", "ot", 4], ["ty", "ot", 2], ["tk", "ot", 32]]}, "result": [[0.000151817762, 0.000142909131], 0, 42.8045289516449, 1634214678.471906], "version": 0.2, "tvm_version": "0.8.dev0"}
{"input": ["cuda -keys=cuda,gpu -max_num_threads=1024 -thread_warp_size=32", "auto_schedule_thread_fused_matmul", [1, 289, 1024, 568], {}], "config": {"index": 806, "code_hash": null, "entity": [["block_size_x", "ot", 8], ["block_size_y", "ot", 8], ["tx", "ot", 2], ["ty", "ot", 2], ["tk", "ot", 16]]}, "result": [[0.000204636538, 0.000191406347], 0, 59.294788122177124, 1634214694.9972856], "version": 0.2, "tvm_version": "0.8.dev0"}
{"input": ["cuda -keys=cuda,gpu -max_num_threads=1024 -thread_warp_size=32", "auto_schedule_thread_fused_matmul", [1, 289, 1024, 568], {}], "config": {"index": 1207, "code_hash": null, "entity": [["block_size_x", "ot", 16], ["block_size_y", "ot", 8], ["tx", "ot", 2], ["ty", "ot", 2], ["tk", "ot", 32]]}, "result": [[0.000214448212, 0.00020153902299999997], 0, 50.9572479724884, 1634214686.767288], "version": 0.2, "tvm_version": "0.8.dev0"}
{"input": ["cuda -keys=cuda,gpu -max_num_threads=1024 -thread_warp_size=32", "auto_schedule_thread_fused_matmul", [1, 289, 1024, 568], {}], "config": {"index": 35, "code_hash": null, "entity": [["block_size_x", "ot", 4], ["block_size_y", "ot", 16], ["tx", "ot", 4], ["ty", "ot", 2], ["tk", "ot", 4]]}, "result": [[0.000172795715, 0.00015847773799999997], 0, 53.04991817474365, 1634214688.7481694], "version": 0.2, "tvm_version": "0.8.dev0"}
{"input": ["cuda -keys=cuda,gpu -max_num_threads=1024 -thread_warp_size=32", "auto_schedule_thread_fused_matmul", [1, 289, 1024, 568], {}], "config": {"index": 416, "code_hash": null, "entity": [["block_size_x", "ot", 8], ["block_size_y", "ot", 32], ["tx", "ot", 2], ["ty", "ot", 2], ["tk", "ot", 8]]}, "result": [[0.000180215982, 0.000168612805], 0, 57.079814195632935, 1634214692.8760839], "version": 0.2, "tvm_version": "0.8.dev0"}
{"input": ["cuda -keys=cuda,gpu -max_num_threads=1024 -thread_warp_size=32", "auto_schedule_thread_fused_matmul", [1, 289, 1024, 568], {}], "config": {"index": 406, "code_hash": null, "entity": [["block_size_x", "ot", 8], ["block_size_y", "ot", 8], ["tx", "ot", 2], ["ty", "ot", 2], ["tk", "ot", 8]]}, "result": [[0.000166402168, 0.000155562693], 0, 55.08887004852295, 1634214690.8418288], "version": 0.2, "tvm_version": "0.8.dev0"}
{"input": ["cuda -keys=cuda,gpu -max_num_threads=1024 -thread_warp_size=32", "auto_schedule_thread_fused_matmul", [1, 289, 1024, 568], {}], "config": {"index": 817, "code_hash": null, "entity": [["block_size_x", "ot", 16], ["block_size_y", "ot", 32], ["tx", "ot", 2], ["ty", "ot", 2], ["tk", "ot", 16]]}, "result": [[0.000205725267, 0.000189061855], 0, 61.348671436309814, 1634214697.0710952], "version": 0.2, "tvm_version": "0.8.dev0"}
{"input": ["cuda -keys=cuda,gpu -max_num_threads=1024 -thread_warp_size=32", "auto_schedule_thread_fused_matmul", [1, 289, 1024, 568], {}], "config": {"index": 432, "code_hash": null, "entity": [["block_size_x", "ot", 16], ["block_size_y", "ot", 8], ["tx", "ot", 4], ["ty", "ot", 2], ["tk", "ot", 8]]}, "result": [[0.000216777469, 0.000201701334], 0, 63.45011901855469, 1634214699.222164], "version": 0.2, "tvm_version": "0.8.dev0"}
{"input": ["cuda -keys=cuda,gpu -max_num_threads=1024 -thread_warp_size=32", "auto_schedule_thread_fused_matmul", [1, 289, 1024, 568], {}], "config": {"index": 431, "code_hash": null, "entity": [["block_size_x", "ot", 8], ["block_size_y", "ot", 8], ["tx", "ot", 4], ["ty", "ot", 2], ["tk", "ot", 8]]}, "result": [[0.00020734391600000002, 0.00019093458699999998], 0, 69.49888896942139, 1634214705.3954155], "version": 0.2, "tvm_version": "0.8.dev0"}
{"input": ["cuda -keys=cuda,gpu -max_num_threads=1024 -thread_warp_size=32", "auto_schedule_thread_fused_matmul", [1, 289, 1024, 568], {}], "config": {"index": 7, "code_hash": null, "entity": [["block_size_x", "ot", 16], ["block_size_y", "ot", 8], ["tx", "ot", 2], ["ty", "ot", 2], ["tk", "ot", 4]]}, "result": [[0.000169783357, 0.000156411842], 0, 73.57342600822449, 1634214709.3905363], "version": 0.2, "tvm_version": "0.8.dev0"}
{"input": ["cuda -keys=cuda,gpu -max_num_threads=1024 -thread_warp_size=32", "auto_schedule_thread_fused_matmul", [1, 289, 1024, 568], {}], "config": {"index": 841, "code_hash": null, "entity": [["block_size_x", "ot", 8], ["block_size_y", "ot", 32], ["tx", "ot", 4], ["ty", "ot", 2], ["tk", "ot", 16]]}, "result": [[0.000189544992, 0.000178886074], 0, 77.69775438308716, 1634214713.4572048], "version": 0.2, "tvm_version": "0.8.dev0"}
{"input": ["cuda -keys=cuda,gpu -max_num_threads=1024 -thread_warp_size=32", "auto_schedule_thread_fused_matmul", [1, 289, 1024, 568], {}], "config": {"index": 36, "code_hash": null, "entity": [["block_size_x", "ot", 8], ["block_size_y", "ot", 16], ["tx", "ot", 4], ["ty", "ot", 2], ["tk", "ot", 4]]}, "result": [[0.000174418092, 0.000162292347], 0, 65.5159740447998, 1634214701.2610865], "version": 0.2, "tvm_version": "0.8.dev0"}
{"input": ["cuda -keys=cuda,gpu -max_num_threads=1024 -thread_warp_size=32", "auto_schedule_thread_fused_matmul", [1, 289, 1024, 568], {}], "config": {"index": 1215, "code_hash": null, "entity": [["block_size_x", "ot", 4], ["block_size_y", "ot", 32], ["tx", "ot", 2], ["ty", "ot", 2], ["tk", "ot", 32]]}, "result": [[0.00013907019099999998, 0.00012889969300000002], 0, 79.69608664512634, 1634214715.4977703], "version": 0.2, "tvm_version": "0.8.dev0"}
{"input": ["cuda -keys=cuda,gpu -max_num_threads=1024 -thread_warp_size=32", "auto_schedule_thread_fused_matmul", [1, 289, 1024, 568], {}], "config": {"index": 831, "code_hash": null, "entity": [["block_size_x", "ot", 8], ["block_size_y", "ot", 8], ["tx", "ot", 4], ["ty", "ot", 2], ["tk", "ot", 16]]}, "result": [[0.00020116135499999998, 0.000188233379], 0, 67.61945605278015, 1634214703.3539119], "version": 0.2, "tvm_version": "0.8.dev0"}
{"input": ["cuda -keys=cuda,gpu -max_num_threads=1024 -thread_warp_size=32", "auto_schedule_thread_fused_matmul", [1, 289, 1024, 568], {}], "config": {"index": 430, "code_hash": null, "entity": [["block_size_x", "ot", 4], ["block_size_y", "ot", 8], ["tx", "ot", 4], ["ty", "ot", 2], ["tk", "ot", 8]]}, "result": [[0.000197543082, 0.000186799913], 0, 71.75410985946655, 1634214707.5185316], "version": 0.2, "tvm_version": "0.8.dev0"}
{"input": ["cuda -keys=cuda,gpu -max_num_threads=1024 -thread_warp_size=32", "auto_schedule_thread_fused_matmul", [1, 289, 1024, 568], {}], "config": {"index": 410, "code_hash": null, "entity": [["block_size_x", "ot", 4], ["block_size_y", "ot", 16], ["tx", "ot", 2], ["ty", "ot", 2], ["tk", "ot", 8]]}, "result": [[0.000138825537, 0.000128320805], 0, 75.59522080421448, 1634214711.3631127], "version": 0.2, "tvm_version": "0.8.dev0"}
{"input": ["cuda -keys=cuda,gpu -max_num_threads=1024 -thread_warp_size=32", "auto_schedule_thread_fused_matmul", [1, 289, 1024, 568], {}], "config": {"index": 907, "code_hash": null, "entity": [["block_size_x", "ot", 16], ["block_size_y", "ot", 8], ["tx", "ot", 2], ["ty", "ot", 4], ["tk", "ot", 16]]}, "result": [[0.000175429116, 0.000161664333], 0, 81.79429602622986, 1634214717.5503955], "version": 0.2, "tvm_version": "0.8.dev0"}
{"input": ["cuda -keys=cuda,gpu -max_num_threads=1024 -thread_warp_size=32", "auto_schedule_thread_fused_matmul", [1, 289, 1024, 568], {}], "config": {"index": 820, "code_hash": null, "entity": [["block_size_x", "ot", 4], ["block_size_y", "ot", 64], ["tx", "ot", 2], ["ty", "ot", 2], ["tk", "ot", 16]]}, "result": [[0.00016440969399999998, 0.000151471116], 0, 2.0597033500671387, 1634214720.0250564], "version": 0.2, "tvm_version": "0.8.dev0"}
{"input": ["cuda -keys=cuda,gpu -max_num_threads=1024 -thread_warp_size=32", "auto_schedule_thread_fused_matmul", [1, 289, 1024, 568], {}], "config": {"index": 12, "code_hash": null, "entity": [["block_size_x", "ot", 16], ["block_size_y", "ot", 16], ["tx", "ot", 2], ["ty", "ot", 2], ["tk", "ot", 4]]}, "result": [[0.00018804596599999998, 0.000174795184], 0, 4.197361946105957, 1634214722.170078], "version": 0.2, "tvm_version": "0.8.dev0"}
{"input": ["cuda -keys=cuda,gpu -max_num_threads=1024 -thread_warp_size=32", "auto_schedule_thread_fused_matmul", [1, 289, 1024, 568], {}], "config": {"index": 415, "code_hash": null, "entity": [["block_size_x", "ot", 4], ["block_size_y", "ot", 32], ["tx", "ot", 2], ["ty", "ot", 2], ["tk", "ot", 8]]}, "result": [[0.00015168480000000002, 0.000142786417], 0, 8.270162582397461, 1634214726.2619572], "version": 0.2, "tvm_version": "0.8.dev0"}
{"input": ["cuda -keys=cuda,gpu -max_num_threads=1024 -thread_warp_size=32", "auto_schedule_thread_fused_matmul", [1, 289, 1024, 568], {}], "config": {"index": 11, "code_hash": null, "entity": [["block_size_x", "ot", 8], ["block_size_y", "ot", 16], ["tx", "ot", 2], ["ty", "ot", 2], ["tk", "ot", 4]]}, "result": [[0.000159446273, 0.000149893189], 0, 6.246817350387573, 1634214724.2360244], "version": 0.2, "tvm_version": "0.8.dev0"}
{"input": ["cuda -keys=cuda,gpu -max_num_threads=1024 -thread_warp_size=32", "auto_schedule_thread_fused_matmul", [1, 289, 1024, 568], {}], "config": {"index": 837, "code_hash": null, "entity": [["block_size_x", "ot", 16], ["block_size_y", "ot", 16], ["tx", "ot", 4], ["ty", "ot", 2], ["tk", "ot", 16]]}, "result": [[0.00019226785200000002, 0.000181966295], 0, 12.357594728469849, 1634214730.393464], "version": 0.2, "tvm_version": "0.8.dev0"}
{"input": ["cuda -keys=cuda,gpu -max_num_threads=1024 -thread_warp_size=32", "auto_schedule_thread_fused_matmul", [1, 289, 1024, 568], {}], "config": {"index": 32, "code_hash": null, "entity": [["block_size_x", "ot", 16], ["block_size_y", "ot", 8], ["tx", "ot", 4], ["ty", "ot", 2], ["tk", "ot", 4]]}, "result": [[0.00019866930600000003, 0.000184599606], 0, 10.270252227783203, 1634214728.3003294], "version": 0.2, "tvm_version": "0.8.dev0"}
{"input": ["cuda -keys=cuda,gpu -max_num_threads=1024 -thread_warp_size=32", "auto_schedule_thread_fused_matmul", [1, 289, 1024, 568], {}], "config": {"index": 417, "code_hash": null, "entity": [["block_size_x", "ot", 16], ["block_size_y", "ot", 32], ["tx", "ot", 2], ["ty", "ot", 2], ["tk", "ot", 8]]}, "result": [[0.000245885521, 0.00022910971499999998], 0, 16.59155511856079, 1634214734.6369603], "version": 0.2, "tvm_version": "0.8.dev0"}
{"input": ["cuda -keys=cuda,gpu -max_num_threads=1024 -thread_warp_size=32", "auto_schedule_thread_fused_matmul", [1, 289, 1024, 568], {}], "config": {"index": 1220, "code_hash": null, "entity": [["block_size_x", "ot", 4], ["block_size_y", "ot", 64], ["tx", "ot", 2], ["ty", "ot", 2], ["tk", "ot", 32]]}, "result": [[0.00016040829299999998, 0.00014779733400000002], 0, 18.593331575393677, 1634214736.6351686], "version": 0.2, "tvm_version": "0.8.dev0"}
{"input": ["cuda -keys=cuda,gpu -max_num_threads=1024 -thread_warp_size=32", "auto_schedule_thread_fused_matmul", [1, 289, 1024, 568], {}], "config": {"index": 1231, "code_hash": null, "entity": [["block_size_x", "ot", 8], ["block_size_y", "ot", 8], ["tx", "ot", 4], ["ty", "ot", 2], ["tk", "ot", 32]]}, "result": [[0.000206882558, 0.00019471453799999998], 0, 20.692671060562134, 1634214738.7367609], "version": 0.2, "tvm_version": "0.8.dev0"}
{"input": ["cuda -keys=cuda,gpu -max_num_threads=1024 -thread_warp_size=32", "auto_schedule_thread_fused_matmul", [1, 289, 1024, 568], {}], "config": {"index": 1205, "code_hash": null, "entity": [["block_size_x", "ot", 4], ["block_size_y", "ot", 8], ["tx", "ot", 2], ["ty", "ot", 2], ["tk", "ot", 32]]}, "result": [[0.000223521023, 0.000207189911], 0, 14.478622198104858, 1634214732.5153718], "version": 0.2, "tvm_version": "0.8.dev0"}
{"input": ["cuda -keys=cuda,gpu -max_num_threads=1024 -thread_warp_size=32", "auto_schedule_thread_fused_matmul", [1, 289, 1024, 568], {}], "config": {"index": 1237, "code_hash": null, "entity": [["block_size_x", "ot", 16], ["block_size_y", "ot", 16], ["tx", "ot", 4], ["ty", "ot", 2], ["tk", "ot", 32]]}, "result": [[0.000193411714, 0.00018024850100000002], 0, 24.78929901123047, 1634214742.841943], "version": 0.2, "tvm_version": "0.8.dev0"}
{"input": ["cuda -keys=cuda,gpu -max_num_threads=1024 -thread_warp_size=32", "auto_schedule_thread_fused_matmul", [1, 289, 1024, 568], {}], "config": {"index": 1240, "code_hash": null, "entity": [["block_size_x", "ot", 4], ["block_size_y", "ot", 32], ["tx", "ot", 4], ["ty", "ot", 2], ["tk", "ot", 32]]}, "result": [[0.000153197325, 0.000139918882], 0, 22.688410997390747, 1634214740.7471137], "version": 0.2, "tvm_version": "0.8.dev0"}
{"input": ["cuda -keys=cuda,gpu -max_num_threads=1024 -thread_warp_size=32", "auto_schedule_thread_fused_matmul", [1, 289, 1024, 568], {}], "config": {"index": 10, "code_hash": null, "entity": [["block_size_x", "ot", 4], ["block_size_y", "ot", 16], ["tx", "ot", 2], ["ty", "ot", 2], ["tk", "ot", 4]]}, "result": [[0.00016053171800000003, 0.00014960862900000003], 0, 26.78433632850647, 1634214744.8623874], "version": 0.2, "tvm_version": "0.8.dev0"}
{"input": ["cuda -keys=cuda,gpu -max_num_threads=1024 -thread_warp_size=32", "auto_schedule_thread_fused_matmul", [1, 289, 1024, 568], {}], "config": {"index": 912, "code_hash": null, "entity": [["block_size_x", "ot", 16], ["block_size_y", "ot", 16], ["tx", "ot", 2], ["ty", "ot", 4], ["tk", "ot", 16]]}, "result": [[0.000208605825, 0.00019470855499999998], 0, 28.894538164138794, 1634214746.9772227], "version": 0.2, "tvm_version": "0.8.dev0"}
{"input": ["cuda -keys=cuda,gpu -max_num_threads=1024 -thread_warp_size=32", "auto_schedule_thread_fused_matmul", [1, 289, 1024, 568], {}], "config": {"index": 845, "code_hash": null, "entity": [["block_size_x", "ot", 4], ["block_size_y", "ot", 64], ["tx", "ot", 4], ["ty", "ot", 2], ["tk", "ot", 16]]}, "result": [[0.000210694725, 0.000192827061], 0, 30.939587593078613, 1634214749.025198], "version": 0.2, "tvm_version": "0.8.dev0"}
{"input": ["cuda -keys=cuda,gpu -max_num_threads=1024 -thread_warp_size=32", "auto_schedule_thread_fused_matmul", [1, 289, 1024, 568], {}], "config": {"index": 402, "code_hash": null, "entity": [["block_size_x", "ot", 16], ["block_size_y", "ot", 4], ["tx", "ot", 2], ["ty", "ot", 2], ["tk", "ot", 8]]}, "result": [[0.000236018377, 0.000222634134], 0, 37.188350439071655, 1634214755.321867], "version": 0.2, "tvm_version": "0.8.dev0"}
{"input": ["cuda -keys=cuda,gpu -max_num_threads=1024 -thread_warp_size=32", "auto_schedule_thread_fused_matmul", [1, 289, 1024, 568], {}], "config": {"index": 821, "code_hash": null, "entity": [["block_size_x", "ot", 8], ["block_size_y", "ot", 64], ["tx", "ot", 2], ["ty", "ot", 2], ["tk", "ot", 16]]}, "result": [[0.00020454953699999996, 0.00018946213499999997], 0, 35.04803514480591, 1634214753.161458], "version": 0.2, "tvm_version": "0.8.dev0"}
{"input": ["cuda -keys=cuda,gpu -max_num_threads=1024 -thread_warp_size=32", "auto_schedule_thread_fused_matmul", [1, 289, 1024, 568], {}], "config": {"index": 8, "code_hash": null, "entity": [["block_size_x", "ot", 32], ["block_size_y", "ot", 8], ["tx", "ot", 2], ["ty", "ot", 2], ["tk", "ot", 4]]}, "result": [[0.00019784797499999997, 0.00018208485], 0, 32.995527267456055, 1634214751.1017554], "version": 0.2, "tvm_version": "0.8.dev0"}
{"input": ["cuda -keys=cuda,gpu -max_num_threads=1024 -thread_warp_size=32", "auto_schedule_thread_fused_matmul", [1, 289, 1024, 568], {}], "config": {"index": 2, "code_hash": null, "entity": [["block_size_x", "ot", 16], ["block_size_y", "ot", 4], ["tx", "ot", 2], ["ty", "ot", 2], ["tk", "ot", 4]]}, "result": [[0.000196919011, 0.00018195948700000002], 0, 39.20833778381348, 1634214757.3485858], "version": 0.2, "tvm_version": "0.8.dev0"}
{"input": ["cuda -keys=cuda,gpu -max_num_threads=1024 -thread_warp_size=32", "auto_schedule_thread_fused_matmul", [1, 289, 1024, 568], {}], "config": {"index": 832, "code_hash": null, "entity": [["block_size_x", "ot", 16], ["block_size_y", "ot", 8], ["tx", "ot", 4], ["ty", "ot", 2], ["tk", "ot", 16]]}, "result": [[0.00020685423299999999, 0.000194069714], 0, 41.326637506484985, 1634214759.4672444], "version": 0.2, "tvm_version": "0.8.dev0"}
{"input": ["cuda -keys=cuda,gpu -max_num_threads=1024 -thread_warp_size=32", "auto_schedule_thread_fused_matmul", [1, 289, 1024, 568], {}], "config": {"index": 26, "code_hash": null, "entity": [["block_size_x", "ot", 8], ["block_size_y", "ot", 4], ["tx", "ot", 4], ["ty", "ot", 2], ["tk", "ot", 4]]}, "result": [[0.000245597032, 0.000232238443], 0, 43.5156614780426, 1634214761.6580045], "version": 0.2, "tvm_version": "0.8.dev0"}
{"input": ["cuda -keys=cuda,gpu -max_num_threads=1024 -thread_warp_size=32", "auto_schedule_thread_fused_matmul", [1, 289, 1024, 568], {}], "config": {"index": 952, "code_hash": null, "entity": [["block_size_x", "ot", 16], ["block_size_y", "ot", 4], ["tx", "ot", 8], ["ty", "ot", 4], ["tk", "ot", 16]]}, "result": [[0.00043712590899999996, 0.000417142948], 0, 46.06114459037781, 1634214764.1792192], "version": 0.2, "tvm_version": "0.8.dev0"}
{"input": ["cuda -keys=cuda,gpu -max_num_threads=1024 -thread_warp_size=32", "auto_schedule_thread_fused_matmul", [1, 289, 1024, 568], {}], "config": {"index": 1334, "code_hash": null, "entity": [["block_size_x", "ot", 64], ["block_size_y", "ot", 8], ["tx", "ot", 4], ["ty", "ot", 4], ["tk", "ot", 32]]}, "result": [[0.000451884165, 0.000434620417], 0, 56.466286420822144, 1634214774.6230154], "version": 0.2, "tvm_version": "0.8.dev0"}
{"input": ["cuda -keys=cuda,gpu -max_num_threads=1024 -thread_warp_size=32", "auto_schedule_thread_fused_matmul", [1, 289, 1024, 568], {}], "config": {"index": 258, "code_hash": null, "entity": [["block_size_x", "ot", 32], ["block_size_y", "ot", 8], ["tx", "ot", 8], ["ty", "ot", 8], ["tk", "ot", 4]]}, "result": [[0.0010261404379999998, 0.0010116914889999999], 0, 49.844677448272705, 1634214767.950854], "version": 0.2, "tvm_version": "0.8.dev0"}
{"input": ["cuda -keys=cuda,gpu -max_num_threads=1024 -thread_warp_size=32", "auto_schedule_thread_fused_matmul", [1, 289, 1024, 568], {}], "config": {"index": 804, "code_hash": null, "entity": [["block_size_x", "ot", 64], ["block_size_y", "ot", 4], ["tx", "ot", 2], ["ty", "ot", 2], ["tk", "ot", 16]]}, "result": [[0.000388616784, 0.000372177805], 0, 58.9497184753418, 1634214777.0653899], "version": 0.2, "tvm_version": "0.8.dev0"}
{"input": ["cuda -keys=cuda,gpu -max_num_threads=1024 -thread_warp_size=32", "auto_schedule_thread_fused_matmul", [1, 289, 1024, 568], {}], "config": {"index": 481, "code_hash": null, "entity": [["block_size_x", "ot", 8], ["block_size_y", "ot", 8], ["tx", "ot", 16], ["ty", "ot", 2], ["tk", "ot", 8]]}, "result": [[0.0006949333880000001, 0.000684583979], 0, 72.73743915557861, 1634214790.922946], "version": 0.2, "tvm_version": "0.8.dev0"}
{"input": ["cuda -keys=cuda,gpu -max_num_threads=1024 -thread_warp_size=32", "auto_schedule_thread_fused_matmul", [1, 289, 1024, 568], {}], "config": {"index": 735, "code_hash": null, "entity": [["block_size_x", "ot", 4], ["block_size_y", "ot", 16], ["tx", "ot", 4], ["ty", "ot", 16], ["tk", "ot", 8]]}, "result": [[0.000741448385, 0.0007137166469999999], 0, 76.05234909057617, 1634214794.2034452], "version": 0.2, "tvm_version": "0.8.dev0"}
{"input": ["cuda -keys=cuda,gpu -max_num_threads=1024 -thread_warp_size=32", "auto_schedule_thread_fused_matmul", [1, 289, 1024, 568], {}], "config": {"index": 922, "code_hash": null, "entity": [["block_size_x", "ot", 16], ["block_size_y", "ot", 64], ["tx", "ot", 2], ["ty", "ot", 4], ["tk", "ot", 16]]}, "result": [[0.000520756624, 0.00050661289], 0, 81.14823126792908, 1634214799.3876655], "version": 0.2, "tvm_version": "0.8.dev0"}
{"input": ["cuda -keys=cuda,gpu -max_num_threads=1024 -thread_warp_size=32", "auto_schedule_thread_fused_matmul", [1, 289, 1024, 568], {}], "config": {"index": 1012, "code_hash": null, "entity": [["block_size_x", "ot", 16], ["block_size_y", "ot", 16], ["tx", "ot", 2], ["ty", "ot", 8], ["tk", "ot", 16]]}, "result": [[0.00035046686100000004, 0.00033416627899999997], 0, 78.3745346069336, 1634214796.6029413], "version": 0.2, "tvm_version": "0.8.dev0"}
{"input": ["cuda -keys=cuda,gpu -max_num_threads=1024 -thread_warp_size=32", "auto_schedule_thread_fused_matmul", [1, 289, 1024, 568], {}], "config": {"index": 827, "code_hash": null, "entity": [["block_size_x", "ot", 16], ["block_size_y", "ot", 4], ["tx", "ot", 4], ["ty", "ot", 2], ["tk", "ot", 16]]}, "result": [[0.0003625446, 0.00034244326799999996], 0, 69.47887825965881, 1634214787.7243028], "version": 0.2, "tvm_version": "0.8.dev0"}
{"input": ["cuda -keys=cuda,gpu -max_num_threads=1024 -thread_warp_size=32", "auto_schedule_thread_fused_matmul", [1, 289, 1024, 568], {}], "config": {"index": 891, "code_hash": null, "entity": [["block_size_x", "ot", 8], ["block_size_y", "ot", 32], ["tx", "ot", 16], ["ty", "ot", 2], ["tk", "ot", 16]]}, "result": [[0.000586990772, 0.0005712313360000001], 0, 89.0824179649353, 1634214807.3036814], "version": 0.2, "tvm_version": "0.8.dev0"}
{"input": ["cuda -keys=cuda,gpu -max_num_threads=1024 -thread_warp_size=32", "auto_schedule_thread_fused_matmul", [1, 289, 1024, 568], {}], "config": {"index": 1437, "code_hash": null, "entity": [["block_size_x", "ot", 16], ["block_size_y", "ot", 16], ["tx", "ot", 4], ["ty", "ot", 8], ["tk", "ot", 32]]}, "result": [[0.00043388239299999997, 0.00041440262699999996], 0, 91.63709831237793, 1634214809.8784106], "version": 0.2, "tvm_version": "0.8.dev0"}
{"input": ["cuda -keys=cuda,gpu -max_num_threads=1024 -thread_warp_size=32", "auto_schedule_thread_fused_matmul", [1, 289, 1024, 568], {}], "config": {"index": 155, "code_hash": null, "entity": [["block_size_x", "ot", 4], ["block_size_y", "ot", 8], ["tx", "ot", 8], ["ty", "ot", 4], ["tk", "ot", 4]]}, "result": [[0.000440375437, 0.000423388197], 0, 94.19456458091736, 1634214812.4287803], "version": 0.2, "tvm_version": "0.8.dev0"}
{"input": ["cuda -keys=cuda,gpu -max_num_threads=1024 -thread_warp_size=32", "auto_schedule_thread_fused_matmul", [1, 289, 1024, 568], {}], "config": {"index": 1295, "code_hash": null, "entity": [["block_size_x", "ot", 4], ["block_size_y", "ot", 64], ["tx", "ot", 16], ["ty", "ot", 2], ["tk", "ot", 32]]}, "result": [[0.00050221034, 0.000486243826], 0, 86.20422983169556, 1634214804.4092984], "version": 0.2, "tvm_version": "0.8.dev0"}
{"input": ["cuda -keys=cuda,gpu -max_num_threads=1024 -thread_warp_size=32", "auto_schedule_thread_fused_matmul", [1, 289, 1024, 568], {}], "config": {"index": 1346, "code_hash": null, "entity": [["block_size_x", "ot", 8], ["block_size_y", "ot", 64], ["tx", "ot", 4], ["ty", "ot", 4], ["tk", "ot", 32]]}, "result": [[0.000339025964, 0.000320920137], 0, 83.45382285118103, 1634214801.7143347], "version": 0.2, "tvm_version": "0.8.dev0"}
{"input": ["cuda -keys=cuda,gpu -max_num_threads=1024 -thread_warp_size=32", "auto_schedule_thread_fused_matmul", [1, 289, 1024, 568], {}], "config": {"index": 15, "code_hash": null, "entity": [["block_size_x", "ot", 4], ["block_size_y", "ot", 32], ["tx", "ot", 2], ["ty", "ot", 2], ["tk", "ot", 4]]}, "result": [[0.000169772503, 0.00015976650900000001], 0, 4.348799467086792, 1634214834.2482939], "version": 0.2, "tvm_version": "0.8.dev0"}
{"input": ["cuda -keys=cuda,gpu -max_num_threads=1024 -thread_warp_size=32", "auto_schedule_thread_fused_matmul", [1, 289, 1024, 568], {}], "config": {"index": 1311, "code_hash": null, "entity": [["block_size_x", "ot", 8], ["block_size_y", "ot", 16], ["tx", "ot", 2], ["ty", "ot", 4], ["tk", "ot", 32]]}, "result": [[0.00015990585300000001, 0.000149718624], 0, 2.271759271621704, 1634214832.1735468], "version": 0.2, "tvm_version": "0.8.dev0"}
{"input": ["cuda -keys=cuda,gpu -max_num_threads=1024 -thread_warp_size=32", "auto_schedule_thread_fused_matmul", [1, 289, 1024, 568], {}], "config": {"index": 911, "code_hash": null, "entity": [["block_size_x", "ot", 8], ["block_size_y", "ot", 16], ["tx", "ot", 2], ["ty", "ot", 4], ["tk", "ot", 16]]}, "result": [[0.000173986246, 0.00016127638899999998], 0, 10.379783391952515, 1634214840.3018746], "version": 0.2, "tvm_version": "0.8.dev0"}
{"input": ["cuda -keys=cuda,gpu -max_num_threads=1024 -thread_warp_size=32", "auto_schedule_thread_fused_matmul", [1, 289, 1024, 568], {}], "config": {"index": 40, "code_hash": null, "entity": [["block_size_x", "ot", 4], ["block_size_y", "ot", 32], ["tx", "ot", 4], ["ty", "ot", 2], ["tk", "ot", 4]]}, "result": [[0.00017468438599999999, 0.000161612169], 0, 12.41106915473938, 1634214842.3374426], "version": 0.2, "tvm_version": "0.8.dev0"}
{"input": ["cuda -keys=cuda,gpu -max_num_threads=1024 -thread_warp_size=32", "auto_schedule_thread_fused_matmul", [1, 289, 1024, 568], {}], "config": {"index": 110, "code_hash": null, "entity": [["block_size_x", "ot", 4], ["block_size_y", "ot", 16], ["tx", "ot", 2], ["ty", "ot", 4], ["tk", "ot", 4]]}, "result": [[0.000185204275, 0.00016948389800000002], 0, 8.310084819793701, 1634214838.2647734], "version": 0.2, "tvm_version": "0.8.dev0"}
{"input": ["cuda -keys=cuda,gpu -max_num_threads=1024 -thread_warp_size=32", "auto_schedule_thread_fused_matmul", [1, 289, 1024, 568], {}], "config": {"index": 1310, "code_hash": null, "entity": [["block_size_x", "ot", 4], ["block_size_y", "ot", 16], ["tx", "ot", 2], ["ty", "ot", 4], ["tk", "ot", 32]]}, "result": [[0.000175909154, 0.000162429568], 0, 6.384981632232666, 1634214836.3012538], "version": 0.2, "tvm_version": "0.8.dev0"}
{"input": ["cuda -keys=cuda,gpu -max_num_threads=1024 -thread_warp_size=32", "auto_schedule_thread_fused_matmul", [1, 289, 1024, 568], {}], "config": {"index": 420, "code_hash": null, "entity": [["block_size_x", "ot", 4], ["block_size_y", "ot", 64], ["tx", "ot", 2], ["ty", "ot", 2], ["tk", "ot", 8]]}, "result": [[0.00017566567900000003, 0.000161990174], 0, 16.43479013442993, 1634214846.4025977], "version": 0.2, "tvm_version": "0.8.dev0"}
{"input": ["cuda -keys=cuda,gpu -max_num_threads=1024 -thread_warp_size=32", "auto_schedule_thread_fused_matmul", [1, 289, 1024, 568], {}], "config": {"index": 511, "code_hash": null, "entity": [["block_size_x", "ot", 8], ["block_size_y", "ot", 16], ["tx", "ot", 2], ["ty", "ot", 4], ["tk", "ot", 8]]}, "result": [[0.00019582480000000002, 0.000179896263], 0, 18.464410543441772, 1634214848.4545374], "version": 0.2, "tvm_version": "0.8.dev0"}
{"input": ["cuda -keys=cuda,gpu -max_num_threads=1024 -thread_warp_size=32", "auto_schedule_thread_fused_matmul", [1, 289, 1024, 568], {}], "config": {"index": 510, "code_hash": null, "entity": [["block_size_x", "ot", 4], ["block_size_y", "ot", 16], ["tx", "ot", 2], ["ty", "ot", 4], ["tk", "ot", 8]]}, "result": [[0.000199441452, 0.000183838019], 0, 14.403035163879395, 1634214844.3653078], "version": 0.2, "tvm_version": "0.8.dev0"}
{"input": ["cuda -keys=cuda,gpu -max_num_threads=1024 -thread_warp_size=32", "auto_schedule_thread_fused_matmul", [1, 289, 1024, 568], {}], "config": {"index": 1245, "code_hash": null, "entity": [["block_size_x", "ot", 4], ["block_size_y", "ot", 64], ["tx", "ot", 4], ["ty", "ot", 2], ["tk", "ot", 32]]}, "result": [[0.000189673417, 0.000179368996], 0, 24.685118198394775, 1634214854.68728], "version": 0.2, "tvm_version": "0.8.dev0"}
{"input": ["cuda -keys=cuda,gpu -max_num_threads=1024 -thread_warp_size=32", "auto_schedule_thread_fused_matmul", [1, 289, 1024, 568], {}], "config": {"index": 1241, "code_hash": null, "entity": [["block_size_x", "ot", 8], ["block_size_y", "ot", 32], ["tx", "ot", 4], ["ty", "ot", 2], ["tk", "ot", 32]]}, "result": [[0.00018889456400000002, 0.00017842038199999998], 0, 20.508270263671875, 1634214850.5099242], "version": 0.2, "tvm_version": "0.8.dev0"}
{"input": ["cuda -keys=cuda,gpu -max_num_threads=1024 -thread_warp_size=32", "auto_schedule_thread_fused_matmul", [1, 289, 1024, 568], {}], "config": {"index": 860, "code_hash": null, "entity": [["block_size_x", "ot", 4], ["block_size_y", "ot", 16], ["tx", "ot", 8], ["ty", "ot", 2], ["tk", "ot", 16]]}, "result": [[0.000195527573, 0.000180468081], 0, 22.592899322509766, 1634214852.5737226], "version": 0.2, "tvm_version": "0.8.dev0"}
{"input": ["cuda -keys=cuda,gpu -max_num_threads=1024 -thread_warp_size=32", "auto_schedule_thread_fused_matmul", [1, 289, 1024, 568], {}], "config": {"index": 16, "code_hash": null, "entity": [["block_size_x", "ot", 8], ["block_size_y", "ot", 32], ["tx", "ot", 2], ["ty", "ot", 2], ["tk", "ot", 4]]}, "result": [[0.000203810236, 0.00018768718899999997], 0, 34.966395139694214, 1634214865.015115], "version": 0.2, "tvm_version": "0.8.dev0"}
{"input": ["cuda -keys=cuda,gpu -max_num_threads=1024 -thread_warp_size=32", "auto_schedule_thread_fused_matmul", [1, 289, 1024, 568], {}], "config": {"index": 1221, "code_hash": null, "entity": [["block_size_x", "ot", 8], ["block_size_y", "ot", 64], ["tx", "ot", 2], ["ty", "ot", 2], ["tk", "ot", 32]]}, "result": [[0.000194183094, 0.00018277663000000003], 0, 28.90013360977173, 1634214858.8457794], "version": 0.2, "tvm_version": "0.8.dev0"}
{"input": ["cuda -keys=cuda,gpu -max_num_threads=1024 -thread_warp_size=32", "auto_schedule_thread_fused_matmul", [1, 289, 1024, 568], {}], "config": {"index": 405, "code_hash": null, "entity": [["block_size_x", "ot", 4], ["block_size_y", "ot", 8], ["tx", "ot", 2], ["ty", "ot", 2], ["tk", "ot", 8]]}, "result": [[0.00016970562, 0.000155757056], 0, 26.704953908920288, 1634214856.7402833], "version": 0.2, "tvm_version": "0.8.dev0"}
{"input": ["cuda -keys=cuda,gpu -max_num_threads=1024 -thread_warp_size=32", "auto_schedule_thread_fused_matmul", [1, 289, 1024, 568], {}], "config": {"index": 106, "code_hash": null, "entity": [["block_size_x", "ot", 8], ["block_size_y", "ot", 8], ["tx", "ot", 2], ["ty", "ot", 4], ["tk", "ot", 4]]}, "result": [[0.00016951385400000002, 0.000158784404], 0, 30.795241355895996, 1634214860.8634756], "version": 0.2, "tvm_version": "0.8.dev0"}
{"input": ["cuda -keys=cuda,gpu -max_num_threads=1024 -thread_warp_size=32", "auto_schedule_thread_fused_matmul", [1, 289, 1024, 568], {}], "config": {"index": 111, "code_hash": null, "entity": [["block_size_x", "ot", 8], ["block_size_y", "ot", 16], ["tx", "ot", 2], ["ty", "ot", 4], ["tk", "ot", 4]]}, "result": [[0.000186596524, 0.000175820849], 0, 32.978795528411865, 1634214862.9771779], "version": 0.2, "tvm_version": "0.8.dev0"}
{"input": ["cuda -keys=cuda,gpu -max_num_threads=1024 -thread_warp_size=32", "auto_schedule_thread_fused_matmul", [1, 289, 1024, 568], {}], "config": {"index": 20, "code_hash": null, "entity": [["block_size_x", "ot", 4], ["block_size_y", "ot", 64], ["tx", "ot", 2], ["ty", "ot", 2], ["tk", "ot", 4]]}, "result": [[0.00019482396199999998, 0.000183296531], 0, 37.16202425956726, 1634214867.1892934], "version": 0.2, "tvm_version": "0.8.dev0"}
