python/autotvm_logs/thread_fused_matmul_1_3136_64_512.log
{"input": ["cuda -keys=cuda,gpu -max_num_threads=1024 -thread_warp_size=32", "auto_schedule_thread_fused_matmul", [1, 3136, 64, 512], {}], "config": {"index": 85, "code_hash": null, "entity": [["block_size", "ot", 4], ["tx", "ot", 4], ["ty", "ot", 2], ["tk", "ot", 8]]}, "result": [[0.000117810187], 0, 3.3383946418762207, 1634095664.3107336], "version": 0.2, "tvm_version": "0.8.dev0"}
{"input": ["cuda -keys=cuda,gpu -max_num_threads=1024 -thread_warp_size=32", "auto_schedule_thread_fused_matmul", [1, 3136, 64, 512], {}], "config": {"index": 36, "code_hash": null, "entity": [["block_size", "ot", 8], ["tx", "ot", 16], ["ty", "ot", 4], ["tk", "ot", 4]]}, "result": [[8.7039053e-05], 0, 3.303633451461792, 1634095667.8712664], "version": 0.2, "tvm_version": "0.8.dev0"}
{"input": ["cuda -keys=cuda,gpu -max_num_threads=1024 -thread_warp_size=32", "auto_schedule_thread_fused_matmul", [1, 3136, 64, 512], {}], "config": {"index": 295, "code_hash": null, "entity": [["block_size", "ot", 4], ["tx", "ot", 16], ["ty", "ot", 8], ["tk", "ot", 32]]}, "result": [[0.000132609419], 0, 3.6203370094299316, 1634095671.2419405], "version": 0.2, "tvm_version": "0.8.dev0"}
{"input": ["cuda -keys=cuda,gpu -max_num_threads=1024 -thread_warp_size=32", "auto_schedule_thread_fused_matmul", [1, 3136, 64, 512], {}], "config": {"index": 242, "code_hash": null, "entity": [["block_size", "ot", 16], ["tx", "ot", 2], ["ty", "ot", 2], ["tk", "ot", 32]]}, "result": [[4.4975532e-05], 0, 3.1981394290924072, 1634095674.2645066], "version": 0.2, "tvm_version": "0.8.dev0"}
{"input": ["cuda -keys=cuda,gpu -max_num_threads=1024 -thread_warp_size=32", "auto_schedule_thread_fused_matmul", [1, 3136, 64, 512], {}], "config": {"index": 123, "code_hash": null, "entity": [["block_size", "ot", 32], ["tx", "ot", 2], ["ty", "ot", 8], ["tk", "ot", 8]]}, "result": [[0.00014379197700000002], 0, 3.38364315032959, 1634095677.962083], "version": 0.2, "tvm_version": "0.8.dev0"}
{"input": ["cuda -keys=cuda,gpu -max_num_threads=1024 -thread_warp_size=32", "auto_schedule_thread_fused_matmul", [1, 3136, 64, 512], {}], "config": {"index": 115, "code_hash": null, "entity": [["block_size", "ot", 4], ["tx", "ot", 16], ["ty", "ot", 4], ["tk", "ot", 8]]}, "result": [[0.000113221613], 0, 3.3593759536743164, 1634095681.5859864], "version": 0.2, "tvm_version": "0.8.dev0"}
{"input": ["cuda -keys=cuda,gpu -max_num_threads=1024 -thread_warp_size=32", "auto_schedule_thread_fused_matmul", [1, 3136, 64, 512], {}], "config": {"index": 102, "code_hash": null, "entity": [["block_size", "ot", 16], ["tx", "ot", 2], ["ty", "ot", 4], ["tk", "ot", 8]]}, "result": [[5.582736100000001e-05], 0, 3.104736328125, 1634095684.985926], "version": 0.2, "tvm_version": "0.8.dev0"}
{"input": ["cuda -keys=cuda,gpu -max_num_threads=1024 -thread_warp_size=32", "auto_schedule_thread_fused_matmul", [1, 3136, 64, 512], {}], "config": {"index": 62, "code_hash": null, "entity": [["block_size", "ot", 16], ["tx", "ot", 2], ["ty", "ot", 16], ["tk", "ot", 4]]}, "result": [[0.000134496324], 0, 3.395097255706787, 1634095688.6934292], "version": 0.2, "tvm_version": "0.8.dev0"}
{"input": ["cuda -keys=cuda,gpu -max_num_threads=1024 -thread_warp_size=32", "auto_schedule_thread_fused_matmul", [1, 3136, 64, 512], {}], "config": {"index": 197, "code_hash": null, "entity": [["block_size", "ot", 16], ["tx", "ot", 16], ["ty", "ot", 4], ["tk", "ot", 16]]}, "result": [[8.1218174e-05], 0, 3.337320327758789, 1634095691.8261116], "version": 0.2, "tvm_version": "0.8.dev0"}
{"input": ["cuda -keys=cuda,gpu -max_num_threads=1024 -thread_warp_size=32", "auto_schedule_thread_fused_matmul", [1, 3136, 64, 512], {}], "config": {"index": 300, "code_hash": null, "entity": [["block_size", "ot", 4], ["tx", "ot", 2], ["ty", "ot", 16], ["tk", "ot", 32]]}, "result": [[0.00015807330999999998], 0, 3.495311975479126, 1634095699.6577477], "version": 0.2, "tvm_version": "0.8.dev0"}
{"input": ["cuda -keys=cuda,gpu -max_num_threads=1024 -thread_warp_size=32", "auto_schedule_thread_fused_matmul", [1, 3136, 64, 512], {}], "config": {"index": 163, "code_hash": null, "entity": [["block_size", "ot", 32], ["tx", "ot", 2], ["ty", "ot", 2], ["tk", "ot", 16]]}, "result": [[4.9817374e-05], 0, 3.264662981033325, 1634095702.7499337], "version": 0.2, "tvm_version": "0.8.dev0"}
{"input": ["cuda -keys=cuda,gpu -max_num_threads=1024 -thread_warp_size=32", "auto_schedule_thread_fused_matmul", [1, 3136, 64, 512], {}], "config": {"index": 288, "code_hash": null, "entity": [["block_size", "ot", 32], ["tx", "ot", 4], ["ty", "ot", 8], ["tk", "ot", 32]]}, "result": [[0.00011595928600000001], 0, 3.314941883087158, 1634095706.330297], "version": 0.2, "tvm_version": "0.8.dev0"}
{"input": ["cuda -keys=cuda,gpu -max_num_threads=1024 -thread_warp_size=32", "auto_schedule_thread_fused_matmul", [1, 3136, 64, 512], {}], "config": {"index": 103, "code_hash": null, "entity": [["block_size", "ot", 32], ["tx", "ot", 2], ["ty", "ot", 4], ["tk", "ot", 8]]}, "result": [[7.318392400000001e-05], 0, 3.1690514087677, 1634095709.829623], "version": 0.2, "tvm_version": "0.8.dev0"}
{"input": ["cuda -keys=cuda,gpu -max_num_threads=1024 -thread_warp_size=32", "auto_schedule_thread_fused_matmul", [1, 3136, 64, 512], {}], "config": {"index": 86, "code_hash": null, "entity": [["block_size", "ot", 8], ["tx", "ot", 4], ["ty", "ot", 2], ["tk", "ot", 8]]}, "result": [[5.6710549e-05], 0, 3.2442784309387207, 1634095712.8964999], "version": 0.2, "tvm_version": "0.8.dev0"}
{"input": ["cuda -keys=cuda,gpu -max_num_threads=1024 -thread_warp_size=32", "auto_schedule_thread_fused_matmul", [1, 3136, 64, 512], {}], "config": {"index": 195, "code_hash": null, "entity": [["block_size", "ot", 4], ["tx", "ot", 16], ["ty", "ot", 4], ["tk", "ot", 16]]}, "result": [[0.00011571484999999999], 0, 3.353238105773926, 1634095717.0083659], "version": 0.2, "tvm_version": "0.8.dev0"}
{"input": ["cuda -keys=cuda,gpu -max_num_threads=1024 -thread_warp_size=32", "auto_schedule_thread_fused_matmul", [1, 3136, 64, 512], {}], "config": {"index": 276, "code_hash": null, "entity": [["block_size", "ot", 8], ["tx", "ot", 16], ["ty", "ot", 4], ["tk", "ot", 32]]}, "result": [[0.000100058404], 0, 3.4680042266845703, 1634095720.2473674], "version": 0.2, "tvm_version": "0.8.dev0"}
{"input": ["cuda -keys=cuda,gpu -max_num_threads=1024 -thread_warp_size=32", "auto_schedule_thread_fused_matmul", [1, 3136, 64, 512], {}], "config": {"index": 48, "code_hash": null, "entity": [["block_size", "ot", 32], ["tx", "ot", 4], ["ty", "ot", 8], ["tk", "ot", 4]]}, "result": [[0.000130409239], 0, 3.3990111351013184, 1634095724.439685], "version": 0.2, "tvm_version": "0.8.dev0"}
{"input": ["cuda -keys=cuda,gpu -max_num_threads=1024 -thread_warp_size=32", "auto_schedule_thread_fused_matmul", [1, 3136, 64, 512], {}], "config": {"index": 67, "code_hash": null, "entity": [["block_size", "ot", 16], ["tx", "ot", 4], ["ty", "ot", 16], ["tk", "ot", 4]]}, "result": [[0.000121930248], 0, 3.444401741027832, 1634095727.6737602], "version": 0.2, "tvm_version": "0.8.dev0"}
{"input": ["cuda -keys=cuda,gpu -max_num_threads=1024 -thread_warp_size=32", "auto_schedule_thread_fused_matmul", [1, 3136, 64, 512], {}], "config": {"index": 272, "code_hash": null, "entity": [["block_size", "ot", 16], ["tx", "ot", 8], ["ty", "ot", 4], ["tk", "ot", 32]]}, "result": [[5.7464444999999995e-05], 0, 3.1656296253204346, 1634095731.122882], "version": 0.2, "tvm_version": "0.8.dev0"}
{"input": ["cuda -keys=cuda,gpu -max_num_threads=1024 -thread_warp_size=32", "auto_schedule_thread_fused_matmul", [1, 3136, 64, 512], {}], "config": {"index": 287, "code_hash": null, "entity": [["block_size", "ot", 16], ["tx", "ot", 4], ["ty", "ot", 8], ["tk", "ot", 32]]}, "result": [[7.673713700000002e-05], 0, 3.3148698806762695, 1634095734.7988193], "version": 0.2, "tvm_version": "0.8.dev0"}
{"input": ["cuda -keys=cuda,gpu -max_num_threads=1024 -thread_warp_size=32", "auto_schedule_thread_fused_matmul", [1, 3136, 64, 512], {}], "config": {"index": 290, "code_hash": null, "entity": [["block_size", "ot", 4], ["tx", "ot", 8], ["ty", "ot", 8], ["tk", "ot", 32]]}, "result": [[0.000115610075], 0, 3.3697872161865234, 1634095738.4675567], "version": 0.2, "tvm_version": "0.8.dev0"}
{"input": ["cuda -keys=cuda,gpu -max_num_threads=1024 -thread_warp_size=32", "auto_schedule_thread_fused_matmul", [1, 3136, 64, 512], {}], "config": {"index": 20, "code_hash": null, "entity": [["block_size", "ot", 4], ["tx", "ot", 2], ["ty", "ot", 4], ["tk", "ot", 4]]}, "result": [[0.00012068150199999999], 0, 3.2830231189727783, 1634095742.1062374], "version": 0.2, "tvm_version": "0.8.dev0"}
{"input": ["cuda -keys=cuda,gpu -max_num_threads=1024 -thread_warp_size=32", "auto_schedule_thread_fused_matmul", [1, 3136, 64, 512], {}], "config": {"index": 133, "code_hash": null, "entity": [["block_size", "ot", 32], ["tx", "ot", 8], ["ty", "ot", 8], ["tk", "ot", 8]]}, "result": [[0.00028674726500000004], 0, 4.002286911010742, 1634095745.9065797], "version": 0.2, "tvm_version": "0.8.dev0"}
{"input": ["cuda -keys=cuda,gpu -max_num_threads=1024 -thread_warp_size=32", "auto_schedule_thread_fused_matmul", [1, 3136, 64, 512], {}], "config": {"index": 267, "code_hash": null, "entity": [["block_size", "ot", 16], ["tx", "ot", 4], ["ty", "ot", 4], ["tk", "ot", 32]]}, "result": [[4.7251364e-05], 0, 3.165609121322632, 1634095749.3758817], "version": 0.2, "tvm_version": "0.8.dev0"}
{"input": ["cuda -keys=cuda,gpu -max_num_threads=1024 -thread_warp_size=32", "auto_schedule_thread_fused_matmul", [1, 3136, 64, 512], {}], "config": {"index": 175, "code_hash": null, "entity": [["block_size", "ot", 4], ["tx", "ot", 16], ["ty", "ot", 2], ["tk", "ot", 16]]}, "result": [[0.000196632536], 0, 3.7745022773742676, 1634095752.962772], "version": 0.2, "tvm_version": "0.8.dev0"}
{"input": ["cuda -keys=cuda,gpu -max_num_threads=1024 -thread_warp_size=32", "auto_schedule_thread_fused_matmul", [1, 3136, 64, 512], {}], "config": {"index": 51, "code_hash": null, "entity": [["block_size", "ot", 8], ["tx", "ot", 8], ["ty", "ot", 8], ["tk", "ot", 4]]}, "result": [[9.787021300000001e-05], 0, 3.2333943843841553, 1634095756.4625552], "version": 0.2, "tvm_version": "0.8.dev0"}
{"input": ["cuda -keys=cuda,gpu -max_num_threads=1024 -thread_warp_size=32", "auto_schedule_thread_fused_matmul", [1, 3136, 64, 512], {}], "config": {"index": 66, "code_hash": null, "entity": [["block_size", "ot", 8], ["tx", "ot", 4], ["ty", "ot", 16], ["tk", "ot", 4]]}, "result": [[0.00011906104000000001], 0, 3.413508653640747, 1634095759.6869552], "version": 0.2, "tvm_version": "0.8.dev0"}
{"input": ["cuda -keys=cuda,gpu -max_num_threads=1024 -thread_warp_size=32", "auto_schedule_thread_fused_matmul", [1, 3136, 64, 512], {}], "config": {"index": 105, "code_hash": null, "entity": [["block_size", "ot", 4], ["tx", "ot", 4], ["ty", "ot", 4], ["tk", "ot", 8]]}, "result": [[9.049104800000001e-05], 0, 3.2475674152374268, 1634095763.2286963], "version": 0.2, "tvm_version": "0.8.dev0"}
{"input": ["cuda -keys=cuda,gpu -max_num_threads=1024 -thread_warp_size=32", "auto_schedule_thread_fused_matmul", [1, 3136, 64, 512], {}], "config": {"index": 155, "code_hash": null, "entity": [["block_size", "ot", 4], ["tx", "ot", 16], ["ty", "ot", 16], ["tk", "ot", 8]]}, "result": [[0.00018019773], 0, 3.7459635734558105, 1634095767.0760455], "version": 0.2, "tvm_version": "0.8.dev0"}
{"input": ["cuda -keys=cuda,gpu -max_num_threads=1024 -thread_warp_size=32", "auto_schedule_thread_fused_matmul", [1, 3136, 64, 512], {}], "config": {"index": 203, "code_hash": null, "entity": [["block_size", "ot", 32], ["tx", "ot", 2], ["ty", "ot", 8], ["tk", "ot", 16]]}, "result": [[0.00013856666], 0, 3.3333308696746826, 1634095779.706307], "version": 0.2, "tvm_version": "0.8.dev0"}
{"input": ["cuda -keys=cuda,gpu -max_num_threads=1024 -thread_warp_size=32", "auto_schedule_thread_fused_matmul", [1, 3136, 64, 512], {}], "config": {"index": 8, "code_hash": null, "entity": [["block_size", "ot", 32], ["tx", "ot", 4], ["ty", "ot", 2], ["tk", "ot", 4]]}, "result": [[7.6402122e-05], 0, 3.176706552505493, 1634095783.2770636], "version": 0.2, "tvm_version": "0.8.dev0"}
{"input": ["cuda -keys=cuda,gpu -max_num_threads=1024 -thread_warp_size=32", "auto_schedule_thread_fused_matmul", [1, 3136, 64, 512], {}], "config": {"index": 88, "code_hash": null, "entity": [["block_size", "ot", 32], ["tx", "ot", 4], ["ty", "ot", 2], ["tk", "ot", 8]]}, "result": [[6.2707217e-05], 0, 3.2965500354766846, 1634095786.3613477], "version": 0.2, "tvm_version": "0.8.dev0"}
{"input": ["cuda -keys=cuda,gpu -max_num_threads=1024 -thread_warp_size=32", "auto_schedule_thread_fused_matmul", [1, 3136, 64, 512], {}], "config": {"index": 275, "code_hash": null, "entity": [["block_size", "ot", 4], ["tx", "ot", 16], ["ty", "ot", 4], ["tk", "ot", 32]]}, "result": [[0.000123595465], 0, 3.4633636474609375, 1634095790.1010616], "version": 0.2, "tvm_version": "0.8.dev0"}
{"input": ["cuda -keys=cuda,gpu -max_num_threads=1024 -thread_warp_size=32", "auto_schedule_thread_fused_matmul", [1, 3136, 64, 512], {}], "config": {"index": 11, "code_hash": null, "entity": [["block_size", "ot", 8], ["tx", "ot", 8], ["ty", "ot", 2], ["tk", "ot", 4]]}, "result": [[6.798434e-05], 0, 3.125638723373413, 1634095793.517077], "version": 0.2, "tvm_version": "0.8.dev0"}
{"input": ["cuda -keys=cuda,gpu -max_num_threads=1024 -thread_warp_size=32", "auto_schedule_thread_fused_matmul", [1, 3136, 64, 512], {}], "config": {"index": 247, "code_hash": null, "entity": [["block_size", "ot", 16], ["tx", "ot", 4], ["ty", "ot", 2], ["tk", "ot", 32]]}, "result": [[3.551476e-05], 0, 3.330348253250122, 1634095796.64996], "version": 0.2, "tvm_version": "0.8.dev0"}
{"input": ["cuda -keys=cuda,gpu -max_num_threads=1024 -thread_warp_size=32", "auto_schedule_thread_fused_matmul", [1, 3136, 64, 512], {}], "config": {"index": 128, "code_hash": null, "entity": [["block_size", "ot", 32], ["tx", "ot", 4], ["ty", "ot", 8], ["tk", "ot", 8]]}, "result": [[0.00012550027999999998], 0, 3.468107223510742, 1634095799.8995566], "version": 0.2, "tvm_version": "0.8.dev0"}
{"input": ["cuda -keys=cuda,gpu -max_num_threads=1024 -thread_warp_size=32", "auto_schedule_thread_fused_matmul", [1, 3136, 64, 512], {}], "config": {"index": 305, "code_hash": null, "entity": [["block_size", "ot", 4], ["tx", "ot", 4], ["ty", "ot", 16], ["tk", "ot", 32]]}, "result": [[0.000130420188], 0, 3.5171005725860596, 1634095803.6383262], "version": 0.2, "tvm_version": "0.8.dev0"}
{"input": ["cuda -keys=cuda,gpu -max_num_threads=1024 -thread_warp_size=32", "auto_schedule_thread_fused_matmul", [1, 3136, 64, 512], {}], "config": {"index": 57, "code_hash": null, "entity": [["block_size", "ot", 16], ["tx", "ot", 16], ["ty", "ot", 8], ["tk", "ot", 4]]}, "result": [[0.00012960822699999998], 0, 3.6443326473236084, 1634095807.0371354], "version": 0.2, "tvm_version": "0.8.dev0"}
{"input": ["cuda -keys=cuda,gpu -max_num_threads=1024 -thread_warp_size=32", "auto_schedule_thread_fused_matmul", [1, 3136, 64, 512], {}], "config": {"index": 113, "code_hash": null, "entity": [["block_size", "ot", 32], ["tx", "ot", 8], ["ty", "ot", 4], ["tk", "ot", 8]]}, "result": [[8.7190855e-05], 0, 3.4116859436035156, 1634095810.7389636], "version": 0.2, "tvm_version": "0.8.dev0"}
{"input": ["cuda -keys=cuda,gpu -max_num_threads=1024 -thread_warp_size=32", "auto_schedule_thread_fused_matmul", [1, 3136, 64, 512], {}], "config": {"index": 180, "code_hash": null, "entity": [["block_size", "ot", 4], ["tx", "ot", 2], ["ty", "ot", 4], ["tk", "ot", 16]]}, "result": [[0.00011770311700000001], 0, 3.3638298511505127, 1634095819.3265734], "version": 0.2, "tvm_version": "0.8.dev0"}
{"input": ["cuda -keys=cuda,gpu -max_num_threads=1024 -thread_warp_size=32", "auto_schedule_thread_fused_matmul", [1, 3136, 64, 512], {}], "config": {"index": 302, "code_hash": null, "entity": [["block_size", "ot", 16], ["tx", "ot", 2], ["ty", "ot", 16], ["tk", "ot", 32]]}, "result": [[0.000148836064], 0, 3.471412420272827, 1634095824.2545342], "version": 0.2, "tvm_version": "0.8.dev0"}
{"input": ["cuda -keys=cuda,gpu -max_num_threads=1024 -thread_warp_size=32", "auto_schedule_thread_fused_matmul", [1, 3136, 64, 512], {}], "config": {"index": 260, "code_hash": null, "entity": [["block_size", "ot", 4], ["tx", "ot", 2], ["ty", "ot", 4], ["tk", "ot", 32]]}, "result": [[0.000136525727], 0, 3.5189027786254883, 1634095827.5788176], "version": 0.2, "tvm_version": "0.8.dev0"}
{"input": ["cuda -keys=cuda,gpu -max_num_threads=1024 -thread_warp_size=32", "auto_schedule_thread_fused_matmul", [1, 3136, 64, 512], {}], "config": {"index": 227, "code_hash": null, "entity": [["block_size", "ot", 16], ["tx", "ot", 4], ["ty", "ot", 16], ["tk", "ot", 16]]}, "result": [[0.000108110276], 0, 3.5076005458831787, 1634095830.8706095], "version": 0.2, "tvm_version": "0.8.dev0"}
{"input": ["cuda -keys=cuda,gpu -max_num_threads=1024 -thread_warp_size=32", "auto_schedule_thread_fused_matmul", [1, 3136, 64, 512], {}], "config": {"index": 225, "code_hash": null, "entity": [["block_size", "ot", 4], ["tx", "ot", 4], ["ty", "ot", 16], ["tk", "ot", 16]]}, "result": [[0.000123473428], 0, 3.401519298553467, 1634095834.5260327], "version": 0.2, "tvm_version": "0.8.dev0"}
{"input": ["cuda -keys=cuda,gpu -max_num_threads=1024 -thread_warp_size=32", "auto_schedule_thread_fused_matmul", [1, 3136, 64, 512], {}], "config": {"index": 93, "code_hash": null, "entity": [["block_size", "ot", 32], ["tx", "ot", 8], ["ty", "ot", 2], ["tk", "ot", 8]]}, "result": [[9.690836e-05], 0, 3.2065412998199463, 1634095838.0302942], "version": 0.2, "tvm_version": "0.8.dev0"}
{"input": ["cuda -keys=cuda,gpu -max_num_threads=1024 -thread_warp_size=32", "auto_schedule_thread_fused_matmul", [1, 3136, 64, 512], {}], "config": {"index": 257, "code_hash": null, "entity": [["block_size", "ot", 16], ["tx", "ot", 16], ["ty", "ot", 2], ["tk", "ot", 32]]}, "result": [[8.134331e-05], 0, 3.2220489978790283, 1634095841.5349562], "version": 0.2, "tvm_version": "0.8.dev0"}
{"input": ["cuda -keys=cuda,gpu -max_num_threads=1024 -thread_warp_size=32", "auto_schedule_thread_fused_matmul", [1, 3136, 64, 512], {}], "config": {"index": 210, "code_hash": null, "entity": [["block_size", "ot", 4], ["tx", "ot", 8], ["ty", "ot", 8], ["tk", "ot", 16]]}, "result": [[0.00011015299100000001], 0, 3.4995615482330322, 1634095844.820748], "version": 0.2, "tvm_version": "0.8.dev0"}
{"input": ["cuda -keys=cuda,gpu -max_num_threads=1024 -thread_warp_size=32", "auto_schedule_thread_fused_matmul", [1, 3136, 64, 512], {}], "config": {"index": 71, "code_hash": null, "entity": [["block_size", "ot", 8], ["tx", "ot", 8], ["ty", "ot", 16], ["tk", "ot", 4]]}, "result": [[0.000105097812], 0, 3.343569040298462, 1634095848.402765], "version": 0.2, "tvm_version": "0.8.dev0"}
{"input": ["cuda -keys=cuda,gpu -max_num_threads=1024 -thread_warp_size=32", "auto_schedule_thread_fused_matmul", [1, 3136, 64, 512], {}], "config": {"index": 262, "code_hash": null, "entity": [["block_size", "ot", 16], ["tx", "ot", 2], ["ty", "ot", 4], ["tk", "ot", 32]]}, "result": [[5.0042738999999994e-05], 0, 3.053792953491211, 1634095852.2750916], "version": 0.2, "tvm_version": "0.8.dev0"}
{"input": ["cuda -keys=cuda,gpu -max_num_threads=1024 -thread_warp_size=32", "auto_schedule_thread_fused_matmul", [1, 3136, 64, 512], {}], "config": {"index": 281, "code_hash": null, "entity": [["block_size", "ot", 8], ["tx", "ot", 2], ["ty", "ot", 8], ["tk", "ot", 32]]}, "result": [[9.049341699999999e-05], 0, 3.299147844314575, 1634095855.8628447], "version": 0.2, "tvm_version": "0.8.dev0"}
{"input": ["cuda -keys=cuda,gpu -max_num_threads=1024 -thread_warp_size=32", "auto_schedule_thread_fused_matmul", [1, 3136, 64, 512], {}], "config": {"index": 193, "code_hash": null, "entity": [["block_size", "ot", 32], ["tx", "ot", 8], ["ty", "ot", 4], ["tk", "ot", 16]]}, "result": [[8.513960199999999e-05], 0, 3.383596658706665, 1634095859.0508182], "version": 0.2, "tvm_version": "0.8.dev0"}
{"input": ["cuda -keys=cuda,gpu -max_num_threads=1024 -thread_warp_size=32", "auto_schedule_thread_fused_matmul", [1, 3136, 64, 512], {}], "config": {"index": 145, "code_hash": null, "entity": [["block_size", "ot", 4], ["tx", "ot", 4], ["ty", "ot", 16], ["tk", "ot", 8]]}, "result": [[0.00011531232300000001], 0, 3.528398275375366, 1634095862.3629434], "version": 0.2, "tvm_version": "0.8.dev0"}
{"input": ["cuda -keys=cuda,gpu -max_num_threads=1024 -thread_warp_size=32", "auto_schedule_thread_fused_matmul", [1, 3136, 64, 512], {}], "config": {"index": 307, "code_hash": null, "entity": [["block_size", "ot", 16], ["tx", "ot", 4], ["ty", "ot", 16], ["tk", "ot", 32]]}, "result": [[0.00011447822499999999], 0, 3.435774803161621, 1634095866.0795164], "version": 0.2, "tvm_version": "0.8.dev0"}
{"input": ["cuda -keys=cuda,gpu -max_num_threads=1024 -thread_warp_size=32", "auto_schedule_thread_fused_matmul", [1, 3136, 64, 512], {}], "config": {"index": 182, "code_hash": null, "entity": [["block_size", "ot", 16], ["tx", "ot", 2], ["ty", "ot", 4], ["tk", "ot", 16]]}, "result": [[4.8832915e-05], 0, 3.078115463256836, 1634095869.4889464], "version": 0.2, "tvm_version": "0.8.dev0"}
{"input": ["cuda -keys=cuda,gpu -max_num_threads=1024 -thread_warp_size=32", "auto_schedule_thread_fused_matmul", [1, 3136, 64, 512], {}], "config": {"index": 270, "code_hash": null, "entity": [["block_size", "ot", 4], ["tx", "ot", 8], ["ty", "ot", 4], ["tk", "ot", 32]]}, "result": [[8.7845353e-05], 0, 3.448592185974121, 1634095872.7465084], "version": 0.2, "tvm_version": "0.8.dev0"}
{"input": ["cuda -keys=cuda,gpu -max_num_threads=1024 -thread_warp_size=32", "auto_schedule_thread_fused_matmul", [1, 3136, 64, 512], {}], "config": {"index": 140, "code_hash": null, "entity": [["block_size", "ot", 4], ["tx", "ot", 2], ["ty", "ot", 16], ["tk", "ot", 8]]}, "result": [[0.00014555183700000002], 0, 3.4162755012512207, 1634095876.4869497], "version": 0.2, "tvm_version": "0.8.dev0"}
{"input": ["cuda -keys=cuda,gpu -max_num_threads=1024 -thread_warp_size=32", "auto_schedule_thread_fused_matmul", [1, 3136, 64, 512], {}], "config": {"index": 101, "code_hash": null, "entity": [["block_size", "ot", 8], ["tx", "ot", 2], ["ty", "ot", 4], ["tk", "ot", 8]]}, "result": [[6.2129788e-05], 0, 3.107029914855957, 1634095879.9183464], "version": 0.2, "tvm_version": "0.8.dev0"}
{"input": ["cuda -keys=cuda,gpu -max_num_threads=1024 -thread_warp_size=32", "auto_schedule_thread_fused_matmul", [1, 3136, 64, 512], {}], "config": {"index": 165, "code_hash": null, "entity": [["block_size", "ot", 4], ["tx", "ot", 4], ["ty", "ot", 2], ["tk", "ot", 16]]}, "result": [[0.000119242291], 0, 3.4384379386901855, 1634095883.1857018], "version": 0.2, "tvm_version": "0.8.dev0"}
{"input": ["cuda -keys=cuda,gpu -max_num_threads=1024 -thread_warp_size=32", "auto_schedule_thread_fused_matmul", [1, 3136, 64, 512], {}], "config": {"index": 52, "code_hash": null, "entity": [["block_size", "ot", 16], ["tx", "ot", 8], ["ty", "ot", 8], ["tk", "ot", 4]]}, "result": [[0.00010742357900000001], 0, 3.306009292602539, 1634095886.8195887], "version": 0.2, "tvm_version": "0.8.dev0"}
{"input": ["cuda -keys=cuda,gpu -max_num_threads=1024 -thread_warp_size=32", "auto_schedule_thread_fused_matmul", [1, 3136, 64, 512], {}], "config": {"index": 167, "code_hash": null, "entity": [["block_size", "ot", 16], ["tx", "ot", 4], ["ty", "ot", 2], ["tk", "ot", 16]]}, "result": [[3.5661876e-05], 0, 2.3620355129241943, 1634095894.304725], "version": 0.2, "tvm_version": "0.8.dev0"}
{"input": ["cuda -keys=cuda,gpu -max_num_threads=1024 -thread_warp_size=32", "auto_schedule_thread_fused_matmul", [1, 3136, 64, 512], {}], "config": {"index": 87, "code_hash": null, "entity": [["block_size", "ot", 16], ["tx", "ot", 4], ["ty", "ot", 2], ["tk", "ot", 8]]}, "result": [[3.8074066e-05], 0, 2.431447982788086, 1634095896.4048023], "version": 0.2, "tvm_version": "0.8.dev0"}
{"input": ["cuda -keys=cuda,gpu -max_num_threads=1024 -thread_warp_size=32", "auto_schedule_thread_fused_matmul", [1, 3136, 64, 512], {}], "config": {"index": 107, "code_hash": null, "entity": [["block_size", "ot", 16], ["tx", "ot", 4], ["ty", "ot", 4], ["tk", "ot", 8]]}, "result": [[4.7060209e-05], 0, 2.4700825214385986, 1634095898.5389917], "version": 0.2, "tvm_version": "0.8.dev0"}
{"input": ["cuda -keys=cuda,gpu -max_num_threads=1024 -thread_warp_size=32", "auto_schedule_thread_fused_matmul", [1, 3136, 64, 512], {}], "config": {"index": 172, "code_hash": null, "entity": [["block_size", "ot", 16], ["tx", "ot", 8], ["ty", "ot", 2], ["tk", "ot", 16]]}, "result": [[5.2962141000000005e-05], 0, 2.5121335983276367, 1634095900.6918757], "version": 0.2, "tvm_version": "0.8.dev0"}
{"input": ["cuda -keys=cuda,gpu -max_num_threads=1024 -thread_warp_size=32", "auto_schedule_thread_fused_matmul", [1, 3136, 64, 512], {}], "config": {"index": 162, "code_hash": null, "entity": [["block_size", "ot", 16], ["tx", "ot", 2], ["ty", "ot", 2], ["tk", "ot", 16]]}, "result": [[3.9460745e-05], 0, 2.450143575668335, 1634095902.8038888], "version": 0.2, "tvm_version": "0.8.dev0"}
{"input": ["cuda -keys=cuda,gpu -max_num_threads=1024 -thread_warp_size=32", "auto_schedule_thread_fused_matmul", [1, 3136, 64, 512], {}], "config": {"index": 166, "code_hash": null, "entity": [["block_size", "ot", 8], ["tx", "ot", 4], ["ty", "ot", 2], ["tk", "ot", 16]]}, "result": [[5.1878618000000004e-05], 0, 2.4784059524536133, 1634095904.961066], "version": 0.2, "tvm_version": "0.8.dev0"}
{"input": ["cuda -keys=cuda,gpu -max_num_threads=1024 -thread_warp_size=32", "auto_schedule_thread_fused_matmul", [1, 3136, 64, 512], {}], "config": {"index": 92, "code_hash": null, "entity": [["block_size", "ot", 16], ["tx", "ot", 8], ["ty", "ot", 2], ["tk", "ot", 8]]}, "result": [[5.7342799e-05], 0, 2.503675699234009, 1634095907.1255994], "version": 0.2, "tvm_version": "0.8.dev0"}
{"input": ["cuda -keys=cuda,gpu -max_num_threads=1024 -thread_warp_size=32", "auto_schedule_thread_fused_matmul", [1, 3136, 64, 512], {}], "config": {"index": 266, "code_hash": null, "entity": [["block_size", "ot", 8], ["tx", "ot", 4], ["ty", "ot", 4], ["tk", "ot", 32]]}, "result": [[5.0415124e-05], 0, 2.501311779022217, 1634095909.2695255], "version": 0.2, "tvm_version": "0.8.dev0"}
{"input": ["cuda -keys=cuda,gpu -max_num_threads=1024 -thread_warp_size=32", "auto_schedule_thread_fused_matmul", [1, 3136, 64, 512], {}], "config": {"index": 186, "code_hash": null, "entity": [["block_size", "ot", 8], ["tx", "ot", 4], ["ty", "ot", 4], ["tk", "ot", 16]]}, "result": [[4.9237377e-05], 0, 2.502979040145874, 1634095911.4173172], "version": 0.2, "tvm_version": "0.8.dev0"}
{"input": ["cuda -keys=cuda,gpu -max_num_threads=1024 -thread_warp_size=32", "auto_schedule_thread_fused_matmul", [1, 3136, 64, 512], {}], "config": {"index": 252, "code_hash": null, "entity": [["block_size", "ot", 16], ["tx", "ot", 8], ["ty", "ot", 2], ["tk", "ot", 32]]}, "result": [[5.7108668000000003e-05], 0, 2.5303425788879395, 1634095913.6069496], "version": 0.2, "tvm_version": "0.8.dev0"}
{"input": ["cuda -keys=cuda,gpu -max_num_threads=1024 -thread_warp_size=32", "auto_schedule_thread_fused_matmul", [1, 3136, 64, 512], {}], "config": {"index": 181, "code_hash": null, "entity": [["block_size", "ot", 8], ["tx", "ot", 2], ["ty", "ot", 4], ["tk", "ot", 16]]}, "result": [[5.915468099999999e-05], 0, 2.5300095081329346, 1634095915.7900505], "version": 0.2, "tvm_version": "0.8.dev0"}
{"input": ["cuda -keys=cuda,gpu -max_num_threads=1024 -thread_warp_size=32", "auto_schedule_thread_fused_matmul", [1, 3136, 64, 512], {}], "config": {"index": 12, "code_hash": null, "entity": [["block_size", "ot", 16], ["tx", "ot", 8], ["ty", "ot", 2], ["tk", "ot", 4]]}, "result": [[6.3363661e-05], 0, 2.499016761779785, 1634095917.9553785], "version": 0.2, "tvm_version": "0.8.dev0"}
{"input": ["cuda -keys=cuda,gpu -max_num_threads=1024 -thread_warp_size=32", "auto_schedule_thread_fused_matmul", [1, 3136, 64, 512], {}], "config": {"index": 187, "code_hash": null, "entity": [["block_size", "ot", 16], ["tx", "ot", 4], ["ty", "ot", 4], ["tk", "ot", 16]]}, "result": [[4.4222988e-05], 0, 2.4417083263397217, 1634095920.059915], "version": 0.2, "tvm_version": "0.8.dev0"}
{"input": ["cuda -keys=cuda,gpu -max_num_threads=1024 -thread_warp_size=32", "auto_schedule_thread_fused_matmul", [1, 3136, 64, 512], {}], "config": {"index": 7, "code_hash": null, "entity": [["block_size", "ot", 16], ["tx", "ot", 4], ["ty", "ot", 2], ["tk", "ot", 4]]}, "result": [[4.6861847e-05], 0, 2.397355318069458, 1634095922.1544635], "version": 0.2, "tvm_version": "0.8.dev0"}
{"input": ["cuda -keys=cuda,gpu -max_num_threads=1024 -thread_warp_size=32", "auto_schedule_thread_fused_matmul", [1, 3136, 64, 512], {}], "config": {"index": 106, "code_hash": null, "entity": [["block_size", "ot", 8], ["tx", "ot", 4], ["ty", "ot", 4], ["tk", "ot", 8]]}, "result": [[4.8975926999999994e-05], 0, 2.466367721557617, 1634095924.3013177], "version": 0.2, "tvm_version": "0.8.dev0"}
{"input": ["cuda -keys=cuda,gpu -max_num_threads=1024 -thread_warp_size=32", "auto_schedule_thread_fused_matmul", [1, 3136, 64, 512], {}], "config": {"index": 27, "code_hash": null, "entity": [["block_size", "ot", 16], ["tx", "ot", 4], ["ty", "ot", 4], ["tk", "ot", 4]]}, "result": [[5.2547887e-05], 0, 2.436467409133911, 1634095926.393619], "version": 0.2, "tvm_version": "0.8.dev0"}
{"input": ["cuda -keys=cuda,gpu -max_num_threads=1024 -thread_warp_size=32", "auto_schedule_thread_fused_matmul", [1, 3136, 64, 512], {}], "config": {"index": 171, "code_hash": null, "entity": [["block_size", "ot", 8], ["tx", "ot", 8], ["ty", "ot", 2], ["tk", "ot", 16]]}, "result": [[4.6010818e-05], 0, 2.442727565765381, 1634095928.507054], "version": 0.2, "tvm_version": "0.8.dev0"}
{"input": ["cuda -keys=cuda,gpu -max_num_threads=1024 -thread_warp_size=32", "auto_schedule_thread_fused_matmul", [1, 3136, 64, 512], {}], "config": {"index": 168, "code_hash": null, "entity": [["block_size", "ot", 32], ["tx", "ot", 4], ["ty", "ot", 2], ["tk", "ot", 16]]}, "result": [[5.5241247e-05], 0, 2.47635817527771, 1634095930.668257], "version": 0.2, "tvm_version": "0.8.dev0"}
{"input": ["cuda -keys=cuda,gpu -max_num_threads=1024 -thread_warp_size=32", "auto_schedule_thread_fused_matmul", [1, 3136, 64, 512], {}], "config": {"index": 243, "code_hash": null, "entity": [["block_size", "ot", 32], ["tx", "ot", 2], ["ty", "ot", 2], ["tk", "ot", 32]]}, "result": [[4.0691223e-05], 0, 2.4166171550750732, 1634095932.786768], "version": 0.2, "tvm_version": "0.8.dev0"}
{"input": ["cuda -keys=cuda,gpu -max_num_threads=1024 -thread_warp_size=32", "auto_schedule_thread_fused_matmul", [1, 3136, 64, 512], {}], "config": {"index": 241, "code_hash": null, "entity": [["block_size", "ot", 8], ["tx", "ot", 2], ["ty", "ot", 2], ["tk", "ot", 32]]}, "result": [[6.6566988e-05], 0, 2.504518985748291, 1634095934.9664762], "version": 0.2, "tvm_version": "0.8.dev0"}
{"input": ["cuda -keys=cuda,gpu -max_num_threads=1024 -thread_warp_size=32", "auto_schedule_thread_fused_matmul", [1, 3136, 64, 512], {}], "config": {"index": 112, "code_hash": null, "entity": [["block_size", "ot", 16], ["tx", "ot", 8], ["ty", "ot", 4], ["tk", "ot", 8]]}, "result": [[5.5087705e-05], 0, 2.457510232925415, 1634095937.1078935], "version": 0.2, "tvm_version": "0.8.dev0"}
{"input": ["cuda -keys=cuda,gpu -max_num_threads=1024 -thread_warp_size=32", "auto_schedule_thread_fused_matmul", [1, 3136, 64, 512], {}], "config": {"index": 251, "code_hash": null, "entity": [["block_size", "ot", 8], ["tx", "ot", 8], ["ty", "ot", 2], ["tk", "ot", 32]]}, "result": [[4.9529234000000007e-05], 0, 2.4403252601623535, 1634095939.2260916], "version": 0.2, "tvm_version": "0.8.dev0"}
{"input": ["cuda -keys=cuda,gpu -max_num_threads=1024 -thread_warp_size=32", "auto_schedule_thread_fused_matmul", [1, 3136, 64, 512], {}], "config": {"index": 246, "code_hash": null, "entity": [["block_size", "ot", 8], ["tx", "ot", 4], ["ty", "ot", 2], ["tk", "ot", 32]]}, "result": [[5.3253691000000003e-05], 0, 2.479121446609497, 1634095941.388479], "version": 0.2, "tvm_version": "0.8.dev0"}
{"input": ["cuda -keys=cuda,gpu -max_num_threads=1024 -thread_warp_size=32", "auto_schedule_thread_fused_matmul", [1, 3136, 64, 512], {}], "config": {"index": 91, "code_hash": null, "entity": [["block_size", "ot", 8], ["tx", "ot", 8], ["ty", "ot", 2], ["tk", "ot", 8]]}, "result": [[4.5562896999999995e-05], 0, 2.388533115386963, 1634095943.4766264], "version": 0.2, "tvm_version": "0.8.dev0"}
{"input": ["cuda -keys=cuda,gpu -max_num_threads=1024 -thread_warp_size=32", "auto_schedule_thread_fused_matmul", [1, 3136, 64, 512], {}], "config": {"index": 32, "code_hash": null, "entity": [["block_size", "ot", 16], ["tx", "ot", 8], ["ty", "ot", 4], ["tk", "ot", 4]]}, "result": [[6.2812327e-05], 0, 2.4629859924316406, 1634095945.6353042], "version": 0.2, "tvm_version": "0.8.dev0"}
{"input": ["cuda -keys=cuda,gpu -max_num_threads=1024 -thread_warp_size=32", "auto_schedule_thread_fused_matmul", [1, 3136, 64, 512], {}], "config": {"index": 261, "code_hash": null, "entity": [["block_size", "ot", 8], ["tx", "ot", 2], ["ty", "ot", 4], ["tk", "ot", 32]]}, "result": [[5.8034996e-05], 0, 2.4609861373901367, 1634095947.793356], "version": 0.2, "tvm_version": "0.8.dev0"}
{"input": ["cuda -keys=cuda,gpu -max_num_threads=1024 -thread_warp_size=32", "auto_schedule_thread_fused_matmul", [1, 3136, 64, 512], {}], "config": {"index": 248, "code_hash": null, "entity": [["block_size", "ot", 32], ["tx", "ot", 4], ["ty", "ot", 2], ["tk", "ot", 32]]}, "result": [[5.3911866e-05], 0, 2.4936270713806152, 1634095949.9819024], "version": 0.2, "tvm_version": "0.8.dev0"}
{"input": ["cuda -keys=cuda,gpu -max_num_threads=1024 -thread_warp_size=32", "auto_schedule_thread_fused_matmul", [1, 3136, 64, 512], {}], "config": {"index": 161, "code_hash": null, "entity": [["block_size", "ot", 8], ["tx", "ot", 2], ["ty", "ot", 2], ["tk", "ot", 16]]}, "result": [[6.4307778e-05], 0, 2.5129926204681396, 1634095952.1997895], "version": 0.2, "tvm_version": "0.8.dev0"}
{"input": ["cuda -keys=cuda,gpu -max_num_threads=1024 -thread_warp_size=32", "auto_schedule_thread_fused_matmul", [1, 3136, 64, 512], {}], "config": {"index": 82, "code_hash": null, "entity": [["block_size", "ot", 16], ["tx", "ot", 2], ["ty", "ot", 2], ["tk", "ot", 8]]}, "result": [[4.5023265e-05], 0, 2.412313938140869, 1634095954.3130238], "version": 0.2, "tvm_version": "0.8.dev0"}
{"input": ["cuda -keys=cuda,gpu -max_num_threads=1024 -thread_warp_size=32", "auto_schedule_thread_fused_matmul", [1, 3136, 64, 512], {}], "config": {"index": 192, "code_hash": null, "entity": [["block_size", "ot", 16], ["tx", "ot", 8], ["ty", "ot", 4], ["tk", "ot", 16]]}, "result": [[5.1259416e-05], 0, 2.406183958053589, 1634095956.4216998], "version": 0.2, "tvm_version": "0.8.dev0"}
{"input": ["cuda -keys=cuda,gpu -max_num_threads=1024 -thread_warp_size=32", "auto_schedule_thread_fused_matmul", [1, 3136, 64, 512], {}], "config": {"index": 191, "code_hash": null, "entity": [["block_size", "ot", 8], ["tx", "ot", 8], ["ty", "ot", 4], ["tk", "ot", 16]]}, "result": [[4.610811300000001e-05], 0, 2.4358880519866943, 1634095958.560364], "version": 0.2, "tvm_version": "0.8.dev0"}
{"input": ["cuda -keys=cuda,gpu -max_num_threads=1024 -thread_warp_size=32", "auto_schedule_thread_fused_matmul", [1, 3136, 64, 512], {}], "config": {"index": 97, "code_hash": null, "entity": [["block_size", "ot", 16], ["tx", "ot", 16], ["ty", "ot", 2], ["tk", "ot", 8]]}, "result": [[9.097218100000002e-05], 0, 4.143374681472778, 1634095962.408583], "version": 0.2, "tvm_version": "0.8.dev0"}
{"input": ["cuda -keys=cuda,gpu -max_num_threads=1024 -thread_warp_size=32", "auto_schedule_thread_fused_matmul", [1, 3136, 64, 512], {}], "config": {"index": 6, "code_hash": null, "entity": [["block_size", "ot", 8], ["tx", "ot", 4], ["ty", "ot", 2], ["tk", "ot", 4]]}, "result": [[5.6480863e-05], 0, 2.5075440406799316, 1634095964.6252398], "version": 0.2, "tvm_version": "0.8.dev0"}
{"input": ["cuda -keys=cuda,gpu -max_num_threads=1024 -thread_warp_size=32", "auto_schedule_thread_fused_matmul", [1, 3136, 64, 512], {}], "config": {"index": 26, "code_hash": null, "entity": [["block_size", "ot", 8], ["tx", "ot", 4], ["ty", "ot", 4], ["tk", "ot", 4]]}, "result": [[5.3867477e-05], 0, 2.412149667739868, 1634095966.7470217], "version": 0.2, "tvm_version": "0.8.dev0"}
{"input": ["cuda -keys=cuda,gpu -max_num_threads=1024 -thread_warp_size=32", "auto_schedule_thread_fused_matmul", [1, 3136, 64, 512], {}], "config": {"index": 81, "code_hash": null, "entity": [["block_size", "ot", 8], ["tx", "ot", 2], ["ty", "ot", 2], ["tk", "ot", 8]]}, "result": [[5.5991759e-05], 0, 2.3976433277130127, 1634095968.8683758], "version": 0.2, "tvm_version": "0.8.dev0"}
{"input": ["cuda -keys=cuda,gpu -max_num_threads=1024 -thread_warp_size=32", "auto_schedule_thread_fused_matmul", [1, 3136, 64, 512], {}], "config": {"index": 173, "code_hash": null, "entity": [["block_size", "ot", 32], ["tx", "ot", 8], ["ty", "ot", 2], ["tk", "ot", 16]]}, "result": [[8.1183431e-05], 0, 2.468428373336792, 1634095971.0622978], "version": 0.2, "tvm_version": "0.8.dev0"}
{"input": ["cuda -keys=cuda,gpu -max_num_threads=1024 -thread_warp_size=32", "auto_schedule_thread_fused_matmul", [1, 3136, 64, 512], {}], "config": {"index": 31, "code_hash": null, "entity": [["block_size", "ot", 8], ["tx", "ot", 8], ["ty", "ot", 4], ["tk", "ot", 4]]}, "result": [[5.2576563e-05], 0, 2.4051830768585205, 1634095973.1863024], "version": 0.2, "tvm_version": "0.8.dev0"}
{"input": ["cuda -keys=cuda,gpu -max_num_threads=1024 -thread_warp_size=32", "auto_schedule_thread_fused_matmul", [1, 3136, 64, 512], {}], "config": {"index": 183, "code_hash": null, "entity": [["block_size", "ot", 32], ["tx", "ot", 2], ["ty", "ot", 4], ["tk", "ot", 16]]}, "result": [[5.9003967e-05], 0, 2.417635202407837, 1634095975.3315275], "version": 0.2, "tvm_version": "0.8.dev0"}
{"input": ["cuda -keys=cuda,gpu -max_num_threads=1024 -thread_warp_size=32", "auto_schedule_thread_fused_matmul", [1, 3136, 64, 512], {}], "config": {"index": 271, "code_hash": null, "entity": [["block_size", "ot", 8], ["tx", "ot", 8], ["ty", "ot", 4], ["tk", "ot", 32]]}, "result": [[4.9092439000000005e-05], 0, 2.404141902923584, 1634095977.4542775], "version": 0.2, "tvm_version": "0.8.dev0"}
{"input": ["cuda -keys=cuda,gpu -max_num_threads=1024 -thread_warp_size=32", "auto_schedule_thread_fused_matmul", [1, 3136, 64, 512], {}], "config": {"index": 177, "code_hash": null, "entity": [["block_size", "ot", 16], ["tx", "ot", 16], ["ty", "ot", 2], ["tk", "ot", 16]]}, "result": [[7.586837e-05], 0, 2.499080181121826, 1634095979.6690454], "version": 0.2, "tvm_version": "0.8.dev0"}
{"input": ["cuda -keys=cuda,gpu -max_num_threads=1024 -thread_warp_size=32", "auto_schedule_thread_fused_matmul", [1, 3136, 64, 512], {}], "config": {"index": 108, "code_hash": null, "entity": [["block_size", "ot", 32], ["tx", "ot", 4], ["ty", "ot", 4], ["tk", "ot", 8]]}, "result": [[8.776610100000002e-05], 0, 2.3805432319641113, 1634095982.4432323], "version": 0.2, "tvm_version": "0.8.dev0"}
{"input": ["cuda -keys=cuda,gpu -max_num_threads=1024 -thread_warp_size=32", "auto_schedule_thread_fused_matmul", [1, 3136, 64, 512], {}], "config": {"index": 286, "code_hash": null, "entity": [["block_size", "ot", 8], ["tx", "ot", 4], ["ty", "ot", 8], ["tk", "ot", 32]]}, "result": [[7.785326600000001e-05], 0, 2.453399419784546, 1634095984.6752439], "version": 0.2, "tvm_version": "0.8.dev0"}
{"input": ["cuda -keys=cuda,gpu -max_num_threads=1024 -thread_warp_size=32", "auto_schedule_thread_fused_matmul", [1, 3136, 64, 512], {}], "config": {"index": 188, "code_hash": null, "entity": [["block_size", "ot", 32], ["tx", "ot", 4], ["ty", "ot", 4], ["tk", "ot", 16]]}, "result": [[7.9711197e-05], 0, 2.3690860271453857, 1634095986.8448756], "version": 0.2, "tvm_version": "0.8.dev0"}
{"input": ["cuda -keys=cuda,gpu -max_num_threads=1024 -thread_warp_size=32", "auto_schedule_thread_fused_matmul", [1, 3136, 64, 512], {}], "config": {"index": 17, "code_hash": null, "entity": [["block_size", "ot", 16], ["tx", "ot", 16], ["ty", "ot", 2], ["tk", "ot", 4]]}, "result": [[9.7974717e-05], 0, 2.506751537322998, 1634095989.159554], "version": 0.2, "tvm_version": "0.8.dev0"}
{"input": ["cuda -keys=cuda,gpu -max_num_threads=1024 -thread_warp_size=32", "auto_schedule_thread_fused_matmul", [1, 3136, 64, 512], {}], "config": {"index": 111, "code_hash": null, "entity": [["block_size", "ot", 8], ["tx", "ot", 8], ["ty", "ot", 4], ["tk", "ot", 8]]}, "result": [[4.5376605e-05], 0, 2.2996058464050293, 1634095991.2648163], "version": 0.2, "tvm_version": "0.8.dev0"}
{"input": ["cuda -keys=cuda,gpu -max_num_threads=1024 -thread_warp_size=32", "auto_schedule_thread_fused_matmul", [1, 3136, 64, 512], {}], "config": {"index": 83, "code_hash": null, "entity": [["block_size", "ot", 32], ["tx", "ot", 2], ["ty", "ot", 2], ["tk", "ot", 8]]}, "result": [[4.929980299999999e-05], 0, 2.2735278606414795, 1634095993.3416617], "version": 0.2, "tvm_version": "0.8.dev0"}
{"input": ["cuda -keys=cuda,gpu -max_num_threads=1024 -thread_warp_size=32", "auto_schedule_thread_fused_matmul", [1, 3136, 64, 512], {}], "config": {"index": 206, "code_hash": null, "entity": [["block_size", "ot", 8], ["tx", "ot", 4], ["ty", "ot", 8], ["tk", "ot", 16]]}, "result": [[7.824036099999999e-05], 0, 2.4370036125183105, 1634095995.5772524], "version": 0.2, "tvm_version": "0.8.dev0"}
{"input": ["cuda -keys=cuda,gpu -max_num_threads=1024 -thread_warp_size=32", "auto_schedule_thread_fused_matmul", [1, 3136, 64, 512], {}], "config": {"index": 122, "code_hash": null, "entity": [["block_size", "ot", 16], ["tx", "ot", 2], ["ty", "ot", 8], ["tk", "ot", 8]]}, "result": [[8.8665494e-05], 0, 2.39328932762146, 1634095997.798521], "version": 0.2, "tvm_version": "0.8.dev0"}
{"input": ["cuda -keys=cuda,gpu -max_num_threads=1024 -thread_warp_size=32", "auto_schedule_thread_fused_matmul", [1, 3136, 64, 512], {}], "config": {"index": 16, "code_hash": null, "entity": [["block_size", "ot", 8], ["tx", "ot", 16], ["ty", "ot", 2], ["tk", "ot", 4]]}, "result": [[0.000101399853], 0, 2.4702746868133545, 1634096000.0594184], "version": 0.2, "tvm_version": "0.8.dev0"}
{"input": ["cuda -keys=cuda,gpu -max_num_threads=1024 -thread_warp_size=32", "auto_schedule_thread_fused_matmul", [1, 3136, 64, 512], {}], "config": {"index": 22, "code_hash": null, "entity": [["block_size", "ot", 16], ["tx", "ot", 2], ["ty", "ot", 4], ["tk", "ot", 4]]}, "result": [[5.7784689e-05], 0, 2.3852953910827637, 1634096002.2405145], "version": 0.2, "tvm_version": "0.8.dev0"}
{"input": ["cuda -keys=cuda,gpu -max_num_threads=1024 -thread_warp_size=32", "auto_schedule_thread_fused_matmul", [1, 3136, 64, 512], {}], "config": {"index": 2, "code_hash": null, "entity": [["block_size", "ot", 16], ["tx", "ot", 2], ["ty", "ot", 2], ["tk", "ot", 4]]}, "result": [[5.6471506e-05], 0, 2.3449718952178955, 1634096004.4034424], "version": 0.2, "tvm_version": "0.8.dev0"}
{"input": ["cuda -keys=cuda,gpu -max_num_threads=1024 -thread_warp_size=32", "auto_schedule_thread_fused_matmul", [1, 3136, 64, 512], {}], "config": {"index": 211, "code_hash": null, "entity": [["block_size", "ot", 8], ["tx", "ot", 8], ["ty", "ot", 8], ["tk", "ot", 16]]}, "result": [[7.3773644e-05], 0, 2.4380056858062744, 1634096006.6127594], "version": 0.2, "tvm_version": "0.8.dev0"}
{"input": ["cuda -keys=cuda,gpu -max_num_threads=1024 -thread_warp_size=32", "auto_schedule_thread_fused_matmul", [1, 3136, 64, 512], {}], "config": {"index": 117, "code_hash": null, "entity": [["block_size", "ot", 16], ["tx", "ot", 16], ["ty", "ot", 4], ["tk", "ot", 8]]}, "result": [[8.1306123e-05], 0, 2.493563175201416, 1634096008.888657], "version": 0.2, "tvm_version": "0.8.dev0"}
{"input": ["cuda -keys=cuda,gpu -max_num_threads=1024 -thread_warp_size=32", "auto_schedule_thread_fused_matmul", [1, 3136, 64, 512], {}], "config": {"index": 132, "code_hash": null, "entity": [["block_size", "ot", 16], ["tx", "ot", 8], ["ty", "ot", 8], ["tk", "ot", 8]]}, "result": [[9.543862e-05], 0, 2.506530523300171, 1634096011.178296], "version": 0.2, "tvm_version": "0.8.dev0"}
{"input": ["cuda -keys=cuda,gpu -max_num_threads=1024 -thread_warp_size=32", "auto_schedule_thread_fused_matmul", [1, 3136, 64, 512], {}], "config": {"index": 126, "code_hash": null, "entity": [["block_size", "ot", 8], ["tx", "ot", 4], ["ty", "ot", 8], ["tk", "ot", 8]]}, "result": [[7.8242138e-05], 0, 2.346060037612915, 1634096013.340007], "version": 0.2, "tvm_version": "0.8.dev0"}
{"input": ["cuda -keys=cuda,gpu -max_num_threads=1024 -thread_warp_size=32", "auto_schedule_thread_fused_matmul", [1, 3136, 64, 512], {}], "config": {"index": 196, "code_hash": null, "entity": [["block_size", "ot", 8], ["tx", "ot", 16], ["ty", "ot", 4], ["tk", "ot", 16]]}, "result": [[7.1905809e-05], 0, 2.395127296447754, 1634096015.5168786], "version": 0.2, "tvm_version": "0.8.dev0"}
{"input": ["cuda -keys=cuda,gpu -max_num_threads=1024 -thread_warp_size=32", "auto_schedule_thread_fused_matmul", [1, 3136, 64, 512], {}], "config": {"index": 176, "code_hash": null, "entity": [["block_size", "ot", 8], ["tx", "ot", 16], ["ty", "ot", 2], ["tk", "ot", 16]]}, "result": [[8.9858909e-05], 0, 2.4612059593200684, 1634096017.7759585], "version": 0.2, "tvm_version": "0.8.dev0"}
{"input": ["cuda -keys=cuda,gpu -max_num_threads=1024 -thread_warp_size=32", "auto_schedule_thread_fused_matmul", [1, 3136, 64, 512], {}], "config": {"index": 268, "code_hash": null, "entity": [["block_size", "ot", 32], ["tx", "ot", 4], ["ty", "ot", 4], ["tk", "ot", 32]]}, "result": [[7.675277e-05], 0, 2.407097816467285, 1634096020.0126421], "version": 0.2, "tvm_version": "0.8.dev0"}
{"input": ["cuda -keys=cuda,gpu -max_num_threads=1024 -thread_warp_size=32", "auto_schedule_thread_fused_matmul", [1, 3136, 64, 512], {}], "config": {"index": 127, "code_hash": null, "entity": [["block_size", "ot", 16], ["tx", "ot", 4], ["ty", "ot", 8], ["tk", "ot", 8]]}, "result": [[7.8074461e-05], 0, 2.3731281757354736, 1634096022.1936502], "version": 0.2, "tvm_version": "0.8.dev0"}
{"input": ["cuda -keys=cuda,gpu -max_num_threads=1024 -thread_warp_size=32", "auto_schedule_thread_fused_matmul", [1, 3136, 64, 512], {}], "config": {"index": 201, "code_hash": null, "entity": [["block_size", "ot", 8], ["tx", "ot", 2], ["ty", "ot", 8], ["tk", "ot", 16]]}, "result": [[8.9557045e-05], 0, 2.40837025642395, 1634096024.433135], "version": 0.2, "tvm_version": "0.8.dev0"}
{"input": ["cuda -keys=cuda,gpu -max_num_threads=1024 -thread_warp_size=32", "auto_schedule_thread_fused_matmul", [1, 3136, 64, 512], {}], "config": {"index": 1, "code_hash": null, "entity": [["block_size", "ot", 8], ["tx", "ot", 2], ["ty", "ot", 2], ["tk", "ot", 4]]}, "result": [[7.324032900000001e-05], 0, 2.3419735431671143, 1634096026.5966332], "version": 0.2, "tvm_version": "0.8.dev0"}
{"input": ["cuda -keys=cuda,gpu -max_num_threads=1024 -thread_warp_size=32", "auto_schedule_thread_fused_matmul", [1, 3136, 64, 512], {}], "config": {"index": 23, "code_hash": null, "entity": [["block_size", "ot", 32], ["tx", "ot", 2], ["ty", "ot", 4], ["tk", "ot", 4]]}, "result": [[7.2074113e-05], 0, 2.361675262451172, 1634096028.7832007], "version": 0.2, "tvm_version": "0.8.dev0"}
{"input": ["cuda -keys=cuda,gpu -max_num_threads=1024 -thread_warp_size=32", "auto_schedule_thread_fused_matmul", [1, 3136, 64, 512], {}], "config": {"index": 217, "code_hash": null, "entity": [["block_size", "ot", 16], ["tx", "ot", 16], ["ty", "ot", 8], ["tk", "ot", 16]]}, "result": [[0.00011448265400000001], 0, 2.6172235012054443, 1634096035.6112778], "version": 0.2, "tvm_version": "0.8.dev0"}
{"input": ["cuda -keys=cuda,gpu -max_num_threads=1024 -thread_warp_size=32", "auto_schedule_thread_fused_matmul", [1, 3136, 64, 512], {}], "config": {"index": 250, "code_hash": null, "entity": [["block_size", "ot", 4], ["tx", "ot", 8], ["ty", "ot", 2], ["tk", "ot", 32]]}, "result": [[0.000116894662], 0, 2.5348217487335205, 1634096037.957478], "version": 0.2, "tvm_version": "0.8.dev0"}
{"input": ["cuda -keys=cuda,gpu -max_num_threads=1024 -thread_warp_size=32", "auto_schedule_thread_fused_matmul", [1, 3136, 64, 512], {}], "config": {"index": 230, "code_hash": null, "entity": [["block_size", "ot", 4], ["tx", "ot", 8], ["ty", "ot", 16], ["tk", "ot", 16]]}, "result": [[0.00010790965500000001], 0, 2.546445369720459, 1634096040.2866693], "version": 0.2, "tvm_version": "0.8.dev0"}
{"input": ["cuda -keys=cuda,gpu -max_num_threads=1024 -thread_warp_size=32", "auto_schedule_thread_fused_matmul", [1, 3136, 64, 512], {}], "config": {"index": 95, "code_hash": null, "entity": [["block_size", "ot", 4], ["tx", "ot", 16], ["ty", "ot", 2], ["tk", "ot", 8]]}, "result": [[0.000182281813], 0, 2.6610805988311768, 1634096042.766066], "version": 0.2, "tvm_version": "0.8.dev0"}
{"input": ["cuda -keys=cuda,gpu -max_num_threads=1024 -thread_warp_size=32", "auto_schedule_thread_fused_matmul", [1, 3136, 64, 512], {}], "config": {"index": 15, "code_hash": null, "entity": [["block_size", "ot", 4], ["tx", "ot", 16], ["ty", "ot", 2], ["tk", "ot", 4]]}, "result": [[9.8103381e-05], 0, 2.5539259910583496, 1634096045.1227674], "version": 0.2, "tvm_version": "0.8.dev0"}
{"input": ["cuda -keys=cuda,gpu -max_num_threads=1024 -thread_warp_size=32", "auto_schedule_thread_fused_matmul", [1, 3136, 64, 512], {}], "config": {"index": 28, "code_hash": null, "entity": [["block_size", "ot", 32], ["tx", "ot", 4], ["ty", "ot", 4], ["tk", "ot", 4]]}, "result": [[0.00010287943699999999], 0, 2.4858431816101074, 1634096047.4320824], "version": 0.2, "tvm_version": "0.8.dev0"}
{"input": ["cuda -keys=cuda,gpu -max_num_threads=1024 -thread_warp_size=32", "auto_schedule_thread_fused_matmul", [1, 3136, 64, 512], {}], "config": {"index": 45, "code_hash": null, "entity": [["block_size", "ot", 4], ["tx", "ot", 4], ["ty", "ot", 8], ["tk", "ot", 4]]}, "result": [[9.763771800000002e-05], 0, 2.3557658195495605, 1634096049.6494503], "version": 0.2, "tvm_version": "0.8.dev0"}
{"input": ["cuda -keys=cuda,gpu -max_num_threads=1024 -thread_warp_size=32", "auto_schedule_thread_fused_matmul", [1, 3136, 64, 512], {}], "config": {"index": 151, "code_hash": null, "entity": [["block_size", "ot", 8], ["tx", "ot", 8], ["ty", "ot", 16], ["tk", "ot", 8]]}, "result": [[9.6674221e-05], 0, 2.4945058822631836, 1634096051.9142418], "version": 0.2, "tvm_version": "0.8.dev0"}
{"input": ["cuda -keys=cuda,gpu -max_num_threads=1024 -thread_warp_size=32", "auto_schedule_thread_fused_matmul", [1, 3136, 64, 512], {}], "config": {"index": 292, "code_hash": null, "entity": [["block_size", "ot", 16], ["tx", "ot", 8], ["ty", "ot", 8], ["tk", "ot", 32]]}, "result": [[8.9676084e-05], 0, 2.424428701400757, 1634096054.138574], "version": 0.2, "tvm_version": "0.8.dev0"}
{"input": ["cuda -keys=cuda,gpu -max_num_threads=1024 -thread_warp_size=32", "auto_schedule_thread_fused_matmul", [1, 3136, 64, 512], {}], "config": {"index": 207, "code_hash": null, "entity": [["block_size", "ot", 16], ["tx", "ot", 4], ["ty", "ot", 8], ["tk", "ot", 16]]}, "result": [[8.1754063e-05], 0, 2.7067577838897705, 1634096059.3254843], "version": 0.2, "tvm_version": "0.8.dev0"}
{"input": ["cuda -keys=cuda,gpu -max_num_threads=1024 -thread_warp_size=32", "auto_schedule_thread_fused_matmul", [1, 3136, 64, 512], {}], "config": {"index": 263, "code_hash": null, "entity": [["block_size", "ot", 32], ["tx", "ot", 2], ["ty", "ot", 4], ["tk", "ot", 32]]}, "result": [[6.178955899999999e-05], 0, 2.417987823486328, 1634096061.440487], "version": 0.2, "tvm_version": "0.8.dev0"}
{"input": ["cuda -keys=cuda,gpu -max_num_threads=1024 -thread_warp_size=32", "auto_schedule_thread_fused_matmul", [1, 3136, 64, 512], {}], "config": {"index": 3, "code_hash": null, "entity": [["block_size", "ot", 32], ["tx", "ot", 2], ["ty", "ot", 2], ["tk", "ot", 4]]}, "result": [[6.0799981e-05], 0, 2.4256324768066406, 1634096063.5752492], "version": 0.2, "tvm_version": "0.8.dev0"}
{"input": ["cuda -keys=cuda,gpu -max_num_threads=1024 -thread_warp_size=32", "auto_schedule_thread_fused_matmul", [1, 3136, 64, 512], {}], "config": {"index": 21, "code_hash": null, "entity": [["block_size", "ot", 8], ["tx", "ot", 2], ["ty", "ot", 4], ["tk", "ot", 4]]}, "result": [[6.560002e-05], 0, 2.504680871963501, 1634096065.775541], "version": 0.2, "tvm_version": "0.8.dev0"}
{"input": ["cuda -keys=cuda,gpu -max_num_threads=1024 -thread_warp_size=32", "auto_schedule_thread_fused_matmul", [1, 3136, 64, 512], {}], "config": {"index": 202, "code_hash": null, "entity": [["block_size", "ot", 16], ["tx", "ot", 2], ["ty", "ot", 8], ["tk", "ot", 16]]}, "result": [[8.281735700000001e-05], 0, 2.535757064819336, 1634096067.9885411], "version": 0.2, "tvm_version": "0.8.dev0"}
{"input": ["cuda -keys=cuda,gpu -max_num_threads=1024 -thread_warp_size=32", "auto_schedule_thread_fused_matmul", [1, 3136, 64, 512], {}], "config": {"index": 116, "code_hash": null, "entity": [["block_size", "ot", 8], ["tx", "ot", 16], ["ty", "ot", 4], ["tk", "ot", 8]]}, "result": [[7.069063e-05], 0, 2.536632537841797, 1634096070.2030973], "version": 0.2, "tvm_version": "0.8.dev0"}
{"input": ["cuda -keys=cuda,gpu -max_num_threads=1024 -thread_warp_size=32", "auto_schedule_thread_fused_matmul", [1, 3136, 64, 512], {}], "config": {"index": 131, "code_hash": null, "entity": [["block_size", "ot", 8], ["tx", "ot", 8], ["ty", "ot", 8], ["tk", "ot", 8]]}, "result": [[7.358086599999999e-05], 0, 2.4809818267822266, 1634096072.3771453], "version": 0.2, "tvm_version": "0.8.dev0"}
{"input": ["cuda -keys=cuda,gpu -max_num_threads=1024 -thread_warp_size=32", "auto_schedule_thread_fused_matmul", [1, 3136, 64, 512], {}], "config": {"index": 282, "code_hash": null, "entity": [["block_size", "ot", 16], ["tx", "ot", 2], ["ty", "ot", 8], ["tk", "ot", 32]]}, "result": [[8.122068299999999e-05], 0, 2.475120782852173, 1634096074.5630412], "version": 0.2, "tvm_version": "0.8.dev0"}
{"input": ["cuda -keys=cuda,gpu -max_num_threads=1024 -thread_warp_size=32", "auto_schedule_thread_fused_matmul", [1, 3136, 64, 512], {}], "config": {"index": 212, "code_hash": null, "entity": [["block_size", "ot", 16], ["tx", "ot", 8], ["ty", "ot", 8], ["tk", "ot", 16]]}, "result": [[9.0596086e-05], 0, 2.511561870574951, 1634096076.7794635], "version": 0.2, "tvm_version": "0.8.dev0"}
{"input": ["cuda -keys=cuda,gpu -max_num_threads=1024 -thread_warp_size=32", "auto_schedule_thread_fused_matmul", [1, 3136, 64, 512], {}], "config": {"index": 253, "code_hash": null, "entity": [["block_size", "ot", 32], ["tx", "ot", 8], ["ty", "ot", 2], ["tk", "ot", 32]]}, "result": [[7.4466969e-05], 0, 2.443687915802002, 1634096078.9403303], "version": 0.2, "tvm_version": "0.8.dev0"}
{"input": ["cuda -keys=cuda,gpu -max_num_threads=1024 -thread_warp_size=32", "auto_schedule_thread_fused_matmul", [1, 3136, 64, 512], {}], "config": {"index": 121, "code_hash": null, "entity": [["block_size", "ot", 8], ["tx", "ot", 2], ["ty", "ot", 8], ["tk", "ot", 8]]}, "result": [[8.821547500000001e-05], 0, 2.4558064937591553, 1634096081.1262426], "version": 0.2, "tvm_version": "0.8.dev0"}
{"input": ["cuda -keys=cuda,gpu -max_num_threads=1024 -thread_warp_size=32", "auto_schedule_thread_fused_matmul", [1, 3136, 64, 512], {}], "config": {"index": 46, "code_hash": null, "entity": [["block_size", "ot", 8], ["tx", "ot", 4], ["ty", "ot", 8], ["tk", "ot", 4]]}, "result": [[8.2345225e-05], 0, 2.515895366668701, 1634096083.355892], "version": 0.2, "tvm_version": "0.8.dev0"}
{"input": ["cuda -keys=cuda,gpu -max_num_threads=1024 -thread_warp_size=32", "auto_schedule_thread_fused_matmul", [1, 3136, 64, 512], {}], "config": {"index": 190, "code_hash": null, "entity": [["block_size", "ot", 4], ["tx", "ot", 8], ["ty", "ot", 4], ["tk", "ot", 16]]}, "result": [[7.6185935e-05], 0, 2.4727954864501953, 1634096085.544861], "version": 0.2, "tvm_version": "0.8.dev0"}
{"input": ["cuda -keys=cuda,gpu -max_num_threads=1024 -thread_warp_size=32", "auto_schedule_thread_fused_matmul", [1, 3136, 64, 512], {}], "config": {"index": 110, "code_hash": null, "entity": [["block_size", "ot", 4], ["tx", "ot", 8], ["ty", "ot", 4], ["tk", "ot", 8]]}, "result": [[7.025559199999999e-05], 0, 2.4578897953033447, 1634096087.7242634], "version": 0.2, "tvm_version": "0.8.dev0"}
{"input": ["cuda -keys=cuda,gpu -max_num_threads=1024 -thread_warp_size=32", "auto_schedule_thread_fused_matmul", [1, 3136, 64, 512], {}], "config": {"index": 291, "code_hash": null, "entity": [["block_size", "ot", 8], ["tx", "ot", 8], ["ty", "ot", 8], ["tk", "ot", 32]]}, "result": [[8.3724149e-05], 0, 2.4795033931732178, 1634096089.898449], "version": 0.2, "tvm_version": "0.8.dev0"}
{"input": ["cuda -keys=cuda,gpu -max_num_threads=1024 -thread_warp_size=32", "auto_schedule_thread_fused_matmul", [1, 3136, 64, 512], {}], "config": {"index": 277, "code_hash": null, "entity": [["block_size", "ot", 16], ["tx", "ot", 16], ["ty", "ot", 4], ["tk", "ot", 32]]}, "result": [[7.2144591e-05], 0, 2.494443416595459, 1634096092.0919108], "version": 0.2, "tvm_version": "0.8.dev0"}
{"input": ["cuda -keys=cuda,gpu -max_num_threads=1024 -thread_warp_size=32", "auto_schedule_thread_fused_matmul", [1, 3136, 64, 512], {}], "config": {"index": 47, "code_hash": null, "entity": [["block_size", "ot", 16], ["tx", "ot", 4], ["ty", "ot", 8], ["tk", "ot", 4]]}, "result": [[8.4594525e-05], 0, 2.499500274658203, 1634096094.324716], "version": 0.2, "tvm_version": "0.8.dev0"}
{"input": ["cuda -keys=cuda,gpu -max_num_threads=1024 -thread_warp_size=32", "auto_schedule_thread_fused_matmul", [1, 3136, 64, 512], {}], "config": {"index": 141, "code_hash": null, "entity": [["block_size", "ot", 8], ["tx", "ot", 2], ["ty", "ot", 16], ["tk", "ot", 8]]}, "result": [[0.000125366155], 0, 2.5605907440185547, 1634096096.626619], "version": 0.2, "tvm_version": "0.8.dev0"}
{"input": ["cuda -keys=cuda,gpu -max_num_threads=1024 -thread_warp_size=32", "auto_schedule_thread_fused_matmul", [1, 3136, 64, 512], {}], "config": {"index": 178, "code_hash": null, "entity": [["block_size", "ot", 32], ["tx", "ot", 16], ["ty", "ot", 2], ["tk", "ot", 16]]}, "result": [[0.000273941566], 0, 3.0661139488220215, 1634096099.4049666], "version": 0.2, "tvm_version": "0.8.dev0"}
{"input": ["cuda -keys=cuda,gpu -max_num_threads=1024 -thread_warp_size=32", "auto_schedule_thread_fused_matmul", [1, 3136, 64, 512], {}], "config": {"index": 33, "code_hash": null, "entity": [["block_size", "ot", 32], ["tx", "ot", 8], ["ty", "ot", 4], ["tk", "ot", 4]]}, "result": [[9.415057100000001e-05], 0, 2.4283204078674316, 1634096106.0516262], "version": 0.2, "tvm_version": "0.8.dev0"}
{"input": ["cuda -keys=cuda,gpu -max_num_threads=1024 -thread_warp_size=32", "auto_schedule_thread_fused_matmul", [1, 3136, 64, 512], {}], "config": {"index": 306, "code_hash": null, "entity": [["block_size", "ot", 8], ["tx", "ot", 4], ["ty", "ot", 16], ["tk", "ot", 32]]}, "result": [[0.000130309882], 0, 2.567479133605957, 1634096108.3550942], "version": 0.2, "tvm_version": "0.8.dev0"}
{"input": ["cuda -keys=cuda,gpu -max_num_threads=1024 -thread_warp_size=32", "auto_schedule_thread_fused_matmul", [1, 3136, 64, 512], {}], "config": {"index": 200, "code_hash": null, "entity": [["block_size", "ot", 4], ["tx", "ot", 2], ["ty", "ot", 8], ["tk", "ot", 16]]}, "result": [[0.000122314218], 0, 2.5628762245178223, 1634096110.6813486], "version": 0.2, "tvm_version": "0.8.dev0"}
{"input": ["cuda -keys=cuda,gpu -max_num_threads=1024 -thread_warp_size=32", "auto_schedule_thread_fused_matmul", [1, 3136, 64, 512], {}], "config": {"index": 130, "code_hash": null, "entity": [["block_size", "ot", 4], ["tx", "ot", 8], ["ty", "ot", 8], ["tk", "ot", 8]]}, "result": [[8.5479777e-05], 0, 2.4893958568573, 1634096122.359705], "version": 0.2, "tvm_version": "0.8.dev0"}
{"input": ["cuda -keys=cuda,gpu -max_num_threads=1024 -thread_warp_size=32", "auto_schedule_thread_fused_matmul", [1, 3136, 64, 512], {}], "config": {"index": 55, "code_hash": null, "entity": [["block_size", "ot", 4], ["tx", "ot", 16], ["ty", "ot", 8], ["tk", "ot", 4]]}, "result": [[0.00010679390999999999], 0, 2.5745654106140137, 1634096124.6657622], "version": 0.2, "tvm_version": "0.8.dev0"}
{"input": ["cuda -keys=cuda,gpu -max_num_threads=1024 -thread_warp_size=32", "auto_schedule_thread_fused_matmul", [1, 3136, 64, 512], {}], "config": {"index": 10, "code_hash": null, "entity": [["block_size", "ot", 4], ["tx", "ot", 8], ["ty", "ot", 2], ["tk", "ot", 4]]}, "result": [[0.000101965137], 0, 2.475877285003662, 1634096126.909483], "version": 0.2, "tvm_version": "0.8.dev0"}
{"input": ["cuda -keys=cuda,gpu -max_num_threads=1024 -thread_warp_size=32", "auto_schedule_thread_fused_matmul", [1, 3136, 64, 512], {}], "config": {"index": 160, "code_hash": null, "entity": [["block_size", "ot", 4], ["tx", "ot", 2], ["ty", "ot", 2], ["tk", "ot", 16]]}, "result": [[0.000146662816], 0, 2.6295247077941895, 1634096129.3143294], "version": 0.2, "tvm_version": "0.8.dev0"}
{"input": ["cuda -keys=cuda,gpu -max_num_threads=1024 -thread_warp_size=32", "auto_schedule_thread_fused_matmul", [1, 3136, 64, 512], {}], "config": {"index": 273, "code_hash": null, "entity": [["block_size", "ot", 32], ["tx", "ot", 8], ["ty", "ot", 4], ["tk", "ot", 32]]}, "result": [[7.954621500000001e-05], 0, 2.404393196105957, 1634096131.507639], "version": 0.2, "tvm_version": "0.8.dev0"}
{"input": ["cuda -keys=cuda,gpu -max_num_threads=1024 -thread_warp_size=32", "auto_schedule_thread_fused_matmul", [1, 3136, 64, 512], {}], "config": {"index": 30, "code_hash": null, "entity": [["block_size", "ot", 4], ["tx", "ot", 8], ["ty", "ot", 4], ["tk", "ot", 4]]}, "result": [[8.5264447e-05], 0, 2.556889057159424, 1634096136.2144063], "version": 0.2, "tvm_version": "0.8.dev0"}
{"input": ["cuda -keys=cuda,gpu -max_num_threads=1024 -thread_warp_size=32", "auto_schedule_thread_fused_matmul", [1, 3136, 64, 512], {}], "config": {"index": 96, "code_hash": null, "entity": [["block_size", "ot", 8], ["tx", "ot", 16], ["ty", "ot", 2], ["tk", "ot", 8]]}, "result": [[8.8203143e-05], 0, 2.587143898010254, 1634096138.4904811], "version": 0.2, "tvm_version": "0.8.dev0"}
{"input": ["cuda -keys=cuda,gpu -max_num_threads=1024 -thread_warp_size=32", "auto_schedule_thread_fused_matmul", [1, 3136, 64, 512], {}], "config": {"index": 42, "code_hash": null, "entity": [["block_size", "ot", 16], ["tx", "ot", 2], ["ty", "ot", 8], ["tk", "ot", 4]]}, "result": [[8.849631e-05], 0, 2.4987287521362305, 1634096140.7153904], "version": 0.2, "tvm_version": "0.8.dev0"}
{"input": ["cuda -keys=cuda,gpu -max_num_threads=1024 -thread_warp_size=32", "auto_schedule_thread_fused_matmul", [1, 3136, 64, 512], {}], "config": {"index": 41, "code_hash": null, "entity": [["block_size", "ot", 8], ["tx", "ot", 2], ["ty", "ot", 8], ["tk", "ot", 4]]}, "result": [[9.440806e-05], 0, 2.5409159660339355, 1634096142.9818175], "version": 0.2, "tvm_version": "0.8.dev0"}
{"input": ["cuda -keys=cuda,gpu -max_num_threads=1024 -thread_warp_size=32", "auto_schedule_thread_fused_matmul", [1, 3136, 64, 512], {}], "config": {"index": 185, "code_hash": null, "entity": [["block_size", "ot", 4], ["tx", "ot", 4], ["ty", "ot", 4], ["tk", "ot", 16]]}, "result": [[8.303866999999999e-05], 0, 2.524857521057129, 1634096145.211443], "version": 0.2, "tvm_version": "0.8.dev0"}
{"input": ["cuda -keys=cuda,gpu -max_num_threads=1024 -thread_warp_size=32", "auto_schedule_thread_fused_matmul", [1, 3136, 64, 512], {}], "config": {"index": 68, "code_hash": null, "entity": [["block_size", "ot", 32], ["tx", "ot", 4], ["ty", "ot", 16], ["tk", "ot", 4]]}, "result": [[0.000309986042], 0, 3.164712429046631, 1634096152.566169], "version": 0.2, "tvm_version": "0.8.dev0"}
{"input": ["cuda -keys=cuda,gpu -max_num_threads=1024 -thread_warp_size=32", "auto_schedule_thread_fused_matmul", [1, 3136, 64, 512], {}], "config": {"index": 50, "code_hash": null, "entity": [["block_size", "ot", 4], ["tx", "ot", 8], ["ty", "ot", 8], ["tk", "ot", 4]]}, "result": [[8.8469722e-05], 0, 2.517695426940918, 1634096154.7712898], "version": 0.2, "tvm_version": "0.8.dev0"}
