python/autotvm_logs/thread_fused_matmul_1_1225_384_224.log
{"input": ["cuda -keys=cuda,gpu -max_num_threads=1024 -thread_warp_size=32", "auto_schedule_thread_fused_matmul", [1, 1225, 384, 224], {}], "config": {"index": 1345, "code_hash": null, "entity": [["block_size_x", "ot", 4], ["block_size_y", "ot", 64], ["tx", "ot", 4], ["ty", "ot", 4], ["tk", "ot", 32]]}, "result": [[8.032136500000001e-05, 8.021569e-05], 0, 22.883733987808228, 1634211939.7937884], "version": 0.2, "tvm_version": "0.8.dev0"}
{"input": ["cuda -keys=cuda,gpu -max_num_threads=1024 -thread_warp_size=32", "auto_schedule_thread_fused_matmul", [1, 1225, 384, 224], {}], "config": {"index": 26, "code_hash": null, "entity": [["block_size_x", "ot", 8], ["block_size_y", "ot", 4], ["tx", "ot", 4], ["ty", "ot", 2], ["tk", "ot", 4]]}, "result": [[0.000150252963, 0.00013912501800000002], 0, 41.668774366378784, 1634211958.7785792], "version": 0.2, "tvm_version": "0.8.dev0"}
{"input": ["cuda -keys=cuda,gpu -max_num_threads=1024 -thread_warp_size=32", "auto_schedule_thread_fused_matmul", [1, 1225, 384, 224], {}], "config": {"index": 180, "code_hash": null, "entity": [["block_size_x", "ot", 4], ["block_size_y", "ot", 8], ["tx", "ot", 16], ["ty", "ot", 4], ["tk", "ot", 4]]}, "result": [[0.000205897444, 0.000190401023], 0, 33.500409841537476, 1634211950.4988751], "version": 0.2, "tvm_version": "0.8.dev0"}
{"input": ["cuda -keys=cuda,gpu -max_num_threads=1024 -thread_warp_size=32", "auto_schedule_thread_fused_matmul", [1, 1225, 384, 224], {}], "config": {"index": 333, "code_hash": null, "entity": [["block_size_x", "ot", 32], ["block_size_y", "ot", 8], ["tx", "ot", 4], ["ty", "ot", 16], ["tk", "ot", 4]]}, "result": [[0.0007096241020000001, 0.0006821347329999999], 0, 13.367265224456787, 1634211929.9650235], "version": 0.2, "tvm_version": "0.8.dev0"}
{"input": ["cuda -keys=cuda,gpu -max_num_threads=1024 -thread_warp_size=32", "auto_schedule_thread_fused_matmul", [1, 1225, 384, 224], {}], "config": {"index": 1, "code_hash": null, "entity": [["block_size_x", "ot", 8], ["block_size_y", "ot", 4], ["tx", "ot", 2], ["ty", "ot", 2], ["tk", "ot", 4]]}, "result": [[0.000139533879, 0.000128405946], 0, 2.092458486557007, 1634211918.8090558], "version": 0.2, "tvm_version": "0.8.dev0"}
{"input": ["cuda -keys=cuda,gpu -max_num_threads=1024 -thread_warp_size=32", "auto_schedule_thread_fused_matmul", [1, 1225, 384, 224], {}], "config": {"index": 1127, "code_hash": null, "entity": [["block_size_x", "ot", 16], ["block_size_y", "ot", 4], ["tx", "ot", 4], ["ty", "ot", 16], ["tk", "ot", 16]]}, "result": [[0.000247486539, 0.00023258865], 0, 35.710909843444824, 1634211952.6850991], "version": 0.2, "tvm_version": "0.8.dev0"}
{"input": ["cuda -keys=cuda,gpu -max_num_threads=1024 -thread_warp_size=32", "auto_schedule_thread_fused_matmul", [1, 1225, 384, 224], {}], "config": {"index": 464, "code_hash": null, "entity": [["block_size_x", "ot", 64], ["block_size_y", "ot", 16], ["tx", "ot", 8], ["ty", "ot", 2], ["tk", "ot", 8]]}, "result": [[0.00026044743399999997, 0.000242149774], 0, 7.920145034790039, 1634211924.7804086], "version": 0.2, "tvm_version": "0.8.dev0"}
{"input": ["cuda -keys=cuda,gpu -max_num_threads=1024 -thread_warp_size=32", "auto_schedule_thread_fused_matmul", [1, 1225, 384, 224], {}], "config": {"index": 846, "code_hash": null, "entity": [["block_size_x", "ot", 8], ["block_size_y", "ot", 64], ["tx", "ot", 4], ["ty", "ot", 2], ["tk", "ot", 16]]}, "result": [[8.568551100000001e-05, 7.919995400000001e-05], 0, 5.732985258102417, 1634211922.5760334], "version": 0.2, "tvm_version": "0.8.dev0"}
{"input": ["cuda -keys=cuda,gpu -max_num_threads=1024 -thread_warp_size=32", "auto_schedule_thread_fused_matmul", [1, 1225, 384, 224], {}], "config": {"index": 1403, "code_hash": null, "entity": [["block_size_x", "ot", 32], ["block_size_y", "ot", 4], ["tx", "ot", 2], ["ty", "ot", 8], ["tk", "ot", 32]]}, "result": [[0.000106476192, 9.9922755e-05], 0, 3.90697979927063, 1634211920.6771934], "version": 0.2, "tvm_version": "0.8.dev0"}
{"input": ["cuda -keys=cuda,gpu -max_num_threads=1024 -thread_warp_size=32", "auto_schedule_thread_fused_matmul", [1, 1225, 384, 224], {}], "config": {"index": 482, "code_hash": null, "entity": [["block_size_x", "ot", 16], ["block_size_y", "ot", 8], ["tx", "ot", 16], ["ty", "ot", 2], ["tk", "ot", 8]]}, "result": [[0.000179571452, 0.000165384526], 0, 9.938997268676758, 1634211926.8016531], "version": 0.2, "tvm_version": "0.8.dev0"}
{"input": ["cuda -keys=cuda,gpu -max_num_threads=1024 -thread_warp_size=32", "auto_schedule_thread_fused_matmul", [1, 1225, 384, 224], {}], "config": {"index": 437, "code_hash": null, "entity": [["block_size_x", "ot", 16], ["block_size_y", "ot", 16], ["tx", "ot", 4], ["ty", "ot", 2], ["tk", "ot", 8]]}, "result": [[7.4524754e-05, 7.3881742e-05], 0, 26.642470121383667, 1634211943.6698704], "version": 0.2, "tvm_version": "0.8.dev0"}
{"input": ["cuda -keys=cuda,gpu -max_num_threads=1024 -thread_warp_size=32", "auto_schedule_thread_fused_matmul", [1, 1225, 384, 224], {}], "config": {"index": 230, "code_hash": null, "entity": [["block_size_x", "ot", 4], ["block_size_y", "ot", 8], ["tx", "ot", 4], ["ty", "ot", 8], ["tk", "ot", 4]]}, "result": [[0.000211397313, 0.00019633703], 0, 24.950391054153442, 1634211941.8776472], "version": 0.2, "tvm_version": "0.8.dev0"}
{"input": ["cuda -keys=cuda,gpu -max_num_threads=1024 -thread_warp_size=32", "auto_schedule_thread_fused_matmul", [1, 1225, 384, 224], {}], "config": {"index": 1408, "code_hash": null, "entity": [["block_size_x", "ot", 32], ["block_size_y", "ot", 8], ["tx", "ot", 2], ["ty", "ot", 8], ["tk", "ot", 32]]}, "result": [[0.000134118259, 0.000122955001], 0, 19.095850944519043, 1634211936.0074544], "version": 0.2, "tvm_version": "0.8.dev0"}
{"input": ["cuda -keys=cuda,gpu -max_num_threads=1024 -thread_warp_size=32", "auto_schedule_thread_fused_matmul", [1, 1225, 384, 224], {}], "config": {"index": 279, "code_hash": null, "entity": [["block_size_x", "ot", 64], ["block_size_y", "ot", 4], ["tx", "ot", 16], ["ty", "ot", 8], ["tk", "ot", 4]]}, "result": [[0.000541877202, 0.000532588991], 0, 31.44396948814392, 1634211948.4374363], "version": 0.2, "tvm_version": "0.8.dev0"}
{"input": ["cuda -keys=cuda,gpu -max_num_threads=1024 -thread_warp_size=32", "auto_schedule_thread_fused_matmul", [1, 1225, 384, 224], {}], "config": {"index": 885, "code_hash": null, "entity": [["block_size_x", "ot", 4], ["block_size_y", "ot", 16], ["tx", "ot", 16], ["ty", "ot", 2], ["tk", "ot", 16]]}, "result": [[0.00013691591, 0.000128275175], 0, 21.00729489326477, 1634211937.9353118], "version": 0.2, "tvm_version": "0.8.dev0"}
{"input": ["cuda -keys=cuda,gpu -max_num_threads=1024 -thread_warp_size=32", "auto_schedule_thread_fused_matmul", [1, 1225, 384, 224], {}], "config": {"index": 1262, "code_hash": null, "entity": [["block_size_x", "ot", 16], ["block_size_y", "ot", 16], ["tx", "ot", 8], ["ty", "ot", 2], ["tk", "ot", 32]]}, "result": [[0.00010298049199999999, 9.522568900000001e-05], 0, 28.595309734344482, 1634211945.5928912], "version": 0.2, "tvm_version": "0.8.dev0"}
{"input": ["cuda -keys=cuda,gpu -max_num_threads=1024 -thread_warp_size=32", "auto_schedule_thread_fused_matmul", [1, 1225, 384, 224], {}], "config": {"index": 976, "code_hash": null, "entity": [["block_size_x", "ot", 8], ["block_size_y", "ot", 4], ["tx", "ot", 16], ["ty", "ot", 4], ["tk", "ot", 16]]}, "result": [[0.000200654203, 0.000186848732], 0, 47.896687507629395, 1634211964.9862006], "version": 0.2, "tvm_version": "0.8.dev0"}
{"input": ["cuda -keys=cuda,gpu -max_num_threads=1024 -thread_warp_size=32", "auto_schedule_thread_fused_matmul", [1, 1225, 384, 224], {}], "config": {"index": 1307, "code_hash": null, "entity": [["block_size_x", "ot", 16], ["block_size_y", "ot", 8], ["tx", "ot", 2], ["ty", "ot", 4], ["tk", "ot", 32]]}, "result": [[8.806336199999999e-05, 8.597797699999999e-05], 0, 60.27152347564697, 1634211977.4693031], "version": 0.2, "tvm_version": "0.8.dev0"}
{"input": ["cuda -keys=cuda,gpu -max_num_threads=1024 -thread_warp_size=32", "auto_schedule_thread_fused_matmul", [1, 1225, 384, 224], {}], "config": {"index": 1250, "code_hash": null, "entity": [["block_size_x", "ot", 4], ["block_size_y", "ot", 4], ["tx", "ot", 8], ["ty", "ot", 2], ["tk", "ot", 32]]}, "result": [[0.000236473705, 0.000218151762], 0, 58.29083704948425, 1634211975.536287], "version": 0.2, "tvm_version": "0.8.dev0"}
{"input": ["cuda -keys=cuda,gpu -max_num_threads=1024 -thread_warp_size=32", "auto_schedule_thread_fused_matmul", [1, 1225, 384, 224], {}], "config": {"index": 492, "code_hash": null, "entity": [["block_size_x", "ot", 16], ["block_size_y", "ot", 32], ["tx", "ot", 16], ["ty", "ot", 2], ["tk", "ot", 8]]}, "result": [[0.000395874768, 0.000382647736], 0, 50.306854486465454, 1634211967.454699], "version": 0.2, "tvm_version": "0.8.dev0"}
{"input": ["cuda -keys=cuda,gpu -max_num_threads=1024 -thread_warp_size=32", "auto_schedule_thread_fused_matmul", [1, 1225, 384, 224], {}], "config": {"index": 663, "code_hash": null, "entity": [["block_size_x", "ot", 32], ["block_size_y", "ot", 16], ["tx", "ot", 8], ["ty", "ot", 8], ["tk", "ot", 8]]}, "result": [[0.000590739401, 0.000573600306], 0, 63.12648272514343, 1634211980.3420942], "version": 0.2, "tvm_version": "0.8.dev0"}
{"input": ["cuda -keys=cuda,gpu -max_num_threads=1024 -thread_warp_size=32", "auto_schedule_thread_fused_matmul", [1, 1225, 384, 224], {}], "config": {"index": 302, "code_hash": null, "entity": [["block_size_x", "ot", 16], ["block_size_y", "ot", 4], ["tx", "ot", 2], ["ty", "ot", 16], ["tk", "ot", 4]]}, "result": [[0.000229209759, 0.000218176821], 0, 43.84976243972778, 1634211960.969913], "version": 0.2, "tvm_version": "0.8.dev0"}
{"input": ["cuda -keys=cuda,gpu -max_num_threads=1024 -thread_warp_size=32", "auto_schedule_thread_fused_matmul", [1, 1225, 384, 224], {}], "config": {"index": 446, "code_hash": null, "entity": [["block_size_x", "ot", 8], ["block_size_y", "ot", 64], ["tx", "ot", 4], ["ty", "ot", 2], ["tk", "ot", 8]]}, "result": [[9.101034e-05, 8.592984699999999e-05], 0, 52.10810136795044, 1634211969.3226285], "version": 0.2, "tvm_version": "0.8.dev0"}
{"input": ["cuda -keys=cuda,gpu -max_num_threads=1024 -thread_warp_size=32", "auto_schedule_thread_fused_matmul", [1, 1225, 384, 224], {}], "config": {"index": 883, "code_hash": null, "entity": [["block_size_x", "ot", 32], ["block_size_y", "ot", 8], ["tx", "ot", 16], ["ty", "ot", 2], ["tk", "ot", 16]]}, "result": [[0.00022369746499999998, 0.000208795919], 0, 65.14210247993469, 1634211982.4177024], "version": 0.2, "tvm_version": "0.8.dev0"}
{"input": ["cuda -keys=cuda,gpu -max_num_threads=1024 -thread_warp_size=32", "auto_schedule_thread_fused_matmul", [1, 1225, 384, 224], {}], "config": {"index": 1028, "code_hash": null, "entity": [["block_size_x", "ot", 32], ["block_size_y", "ot", 4], ["tx", "ot", 4], ["ty", "ot", 8], ["tk", "ot", 16]]}, "result": [[9.8011131e-05, 8.945605700000001e-05], 0, 45.72640776634216, 1634211962.8991044], "version": 0.2, "tvm_version": "0.8.dev0"}
{"input": ["cuda -keys=cuda,gpu -max_num_threads=1024 -thread_warp_size=32", "auto_schedule_thread_fused_matmul", [1, 1225, 384, 224], {}], "config": {"index": 356, "code_hash": null, "entity": [["block_size_x", "ot", 8], ["block_size_y", "ot", 8], ["tx", "ot", 8], ["ty", "ot", 16], ["tk", "ot", 4]]}, "result": [[0.001083560711, 0.0010589603970000002], 0, 71.06728434562683, 1634211988.2806916], "version": 0.2, "tvm_version": "0.8.dev0"}
{"input": ["cuda -keys=cuda,gpu -max_num_threads=1024 -thread_warp_size=32", "auto_schedule_thread_fused_matmul", [1, 1225, 384, 224], {}], "config": {"index": 1231, "code_hash": null, "entity": [["block_size_x", "ot", 8], ["block_size_y", "ot", 8], ["tx", "ot", 4], ["ty", "ot", 2], ["tk", "ot", 32]]}, "result": [[0.000116104872, 0.00010655289199999999], 0, 67.04372882843018, 1634211984.333825], "version": 0.2, "tvm_version": "0.8.dev0"}
{"input": ["cuda -keys=cuda,gpu -max_num_threads=1024 -thread_warp_size=32", "auto_schedule_thread_fused_matmul", [1, 1225, 384, 224], {}], "config": {"index": 404, "code_hash": null, "entity": [["block_size_x", "ot", 64], ["block_size_y", "ot", 4], ["tx", "ot", 2], ["ty", "ot", 2], ["tk", "ot", 8]]}, "result": [[0.00016499323399999998, 0.000154128396], 0, 72.95426440238953, 1634211990.2733564], "version": 0.2, "tvm_version": "0.8.dev0"}
{"input": ["cuda -keys=cuda,gpu -max_num_threads=1024 -thread_warp_size=32", "auto_schedule_thread_fused_matmul", [1, 1225, 384, 224], {}], "config": {"index": 134, "code_hash": null, "entity": [["block_size_x", "ot", 64], ["block_size_y", "ot", 8], ["tx", "ot", 4], ["ty", "ot", 4], ["tk", "ot", 4]]}, "result": [[0.000147504574, 0.000135427088], 0, 74.90741443634033, 1634211992.255806], "version": 0.2, "tvm_version": "0.8.dev0"}
{"input": ["cuda -keys=cuda,gpu -max_num_threads=1024 -thread_warp_size=32", "auto_schedule_thread_fused_matmul", [1, 1225, 384, 224], {}], "config": {"index": 39, "code_hash": null, "entity": [["block_size_x", "ot", 64], ["block_size_y", "ot", 16], ["tx", "ot", 4], ["ty", "ot", 2], ["tk", "ot", 4]]}, "result": [[0.00015346875600000002, 0.000141570486], 0, 5.159619092941284, 1634211997.8539069], "version": 0.2, "tvm_version": "0.8.dev0"}
{"input": ["cuda -keys=cuda,gpu -max_num_threads=1024 -thread_warp_size=32", "auto_schedule_thread_fused_matmul", [1, 1225, 384, 224], {}], "config": {"index": 1297, "code_hash": null, "entity": [["block_size_x", "ot", 16], ["block_size_y", "ot", 64], ["tx", "ot", 16], ["ty", "ot", 2], ["tk", "ot", 32]]}, "result": [[0.0006487031550000001, 0.000629633436], 0, 3.124507188796997, 1634211995.8250523], "version": 0.2, "tvm_version": "0.8.dev0"}
{"input": ["cuda -keys=cuda,gpu -max_num_threads=1024 -thread_warp_size=32", "auto_schedule_thread_fused_matmul", [1, 1225, 384, 224], {}], "config": {"index": 853, "code_hash": null, "entity": [["block_size_x", "ot", 32], ["block_size_y", "ot", 4], ["tx", "ot", 8], ["ty", "ot", 2], ["tk", "ot", 16]]}, "result": [[0.00023262559200000002, 0.00022198031000000002], 0, 11.494175910949707, 1634212004.1713946], "version": 0.2, "tvm_version": "0.8.dev0"}
{"input": ["cuda -keys=cuda,gpu -max_num_threads=1024 -thread_warp_size=32", "auto_schedule_thread_fused_matmul", [1, 1225, 384, 224], {}], "config": {"index": 408, "code_hash": null, "entity": [["block_size_x", "ot", 32], ["block_size_y", "ot", 8], ["tx", "ot", 2], ["ty", "ot", 2], ["tk", "ot", 8]]}, "result": [[9.505274799999999e-05, 9.1162033e-05], 0, 13.379772901535034, 1634212006.1090245], "version": 0.2, "tvm_version": "0.8.dev0"}
{"input": ["cuda -keys=cuda,gpu -max_num_threads=1024 -thread_warp_size=32", "auto_schedule_thread_fused_matmul", [1, 1225, 384, 224], {}], "config": {"index": 1151, "code_hash": null, "entity": [["block_size_x", "ot", 8], ["block_size_y", "ot", 4], ["tx", "ot", 8], ["ty", "ot", 16], ["tk", "ot", 16]]}, "result": [[0.001038926998, 0.0010135295699999999], 0, 17.375070333480835, 1634212010.0010984], "version": 0.2, "tvm_version": "0.8.dev0"}
{"input": ["cuda -keys=cuda,gpu -max_num_threads=1024 -thread_warp_size=32", "auto_schedule_thread_fused_matmul", [1, 1225, 384, 224], {}], "config": {"index": 531, "code_hash": null, "entity": [["block_size_x", "ot", 8], ["block_size_y", "ot", 8], ["tx", "ot", 4], ["ty", "ot", 4], ["tk", "ot", 8]]}, "result": [[8.998804e-05, 8.579231299999999e-05], 0, 19.224658727645874, 1634212011.899889], "version": 0.2, "tvm_version": "0.8.dev0"}
{"input": ["cuda -keys=cuda,gpu -max_num_threads=1024 -thread_warp_size=32", "auto_schedule_thread_fused_matmul", [1, 1225, 384, 224], {}], "config": {"index": 1066, "code_hash": null, "entity": [["block_size_x", "ot", 8], ["block_size_y", "ot", 32], ["tx", "ot", 8], ["ty", "ot", 8], ["tk", "ot", 16]]}, "result": [[0.000202311204, 0.00018965438], 0, 21.314834117889404, 1634212014.0024314], "version": 0.2, "tvm_version": "0.8.dev0"}
{"input": ["cuda -keys=cuda,gpu -max_num_threads=1024 -thread_warp_size=32", "auto_schedule_thread_fused_matmul", [1, 1225, 384, 224], {}], "config": {"index": 352, "code_hash": null, "entity": [["block_size_x", "ot", 16], ["block_size_y", "ot", 4], ["tx", "ot", 8], ["ty", "ot", 16], ["tk", "ot", 4]]}, "result": [[0.0010694312749999998, 0.001055071067], 0, 31.110435009002686, 1634212023.7899141], "version": 0.2, "tvm_version": "0.8.dev0"}
{"input": ["cuda -keys=cuda,gpu -max_num_threads=1024 -thread_warp_size=32", "auto_schedule_thread_fused_matmul", [1, 1225, 384, 224], {}], "config": {"index": 1362, "code_hash": null, "entity": [["block_size_x", "ot", 16], ["block_size_y", "ot", 16], ["tx", "ot", 8], ["ty", "ot", 4], ["tk", "ot", 32]]}, "result": [[0.000162101614, 0.00015166388], 0, 25.36502742767334, 1634212018.0809627], "version": 0.2, "tvm_version": "0.8.dev0"}
{"input": ["cuda -keys=cuda,gpu -max_num_threads=1024 -thread_warp_size=32", "auto_schedule_thread_fused_matmul", [1, 1225, 384, 224], {}], "config": {"index": 965, "code_hash": null, "entity": [["block_size_x", "ot", 4], ["block_size_y", "ot", 32], ["tx", "ot", 8], ["ty", "ot", 4], ["tk", "ot", 16]]}, "result": [[0.00015950830300000003, 0.00014595228299999998], 0, 23.322261095046997, 1634212016.0460637], "version": 0.2, "tvm_version": "0.8.dev0"}
{"input": ["cuda -keys=cuda,gpu -max_num_threads=1024 -thread_warp_size=32", "auto_schedule_thread_fused_matmul", [1, 1225, 384, 224], {}], "config": {"index": 950, "code_hash": null, "entity": [["block_size_x", "ot", 4], ["block_size_y", "ot", 4], ["tx", "ot", 8], ["ty", "ot", 4], ["tk", "ot", 16]]}, "result": [[0.00013417228200000001, 0.000126375174], 0, 27.239872217178345, 1634212019.9760058], "version": 0.2, "tvm_version": "0.8.dev0"}
{"input": ["cuda -keys=cuda,gpu -max_num_threads=1024 -thread_warp_size=32", "auto_schedule_thread_fused_matmul", [1, 1225, 384, 224], {}], "config": {"index": 1421, "code_hash": null, "entity": [["block_size_x", "ot", 8], ["block_size_y", "ot", 64], ["tx", "ot", 2], ["ty", "ot", 8], ["tk", "ot", 32]]}, "result": [[0.00024750551400000003, 0.000232110207], 0, 37.356895208358765, 1634212030.0659802], "version": 0.2, "tvm_version": "0.8.dev0"}
{"input": ["cuda -keys=cuda,gpu -max_num_threads=1024 -thread_warp_size=32", "auto_schedule_thread_fused_matmul", [1, 1225, 384, 224], {}], "config": {"index": 803, "code_hash": null, "entity": [["block_size_x", "ot", 32], ["block_size_y", "ot", 4], ["tx", "ot", 2], ["ty", "ot", 2], ["tk", "ot", 16]]}, "result": [[0.000222996424, 0.000208061374], 0, 45.19033670425415, 1634212037.9418268], "version": 0.2, "tvm_version": "0.8.dev0"}
{"input": ["cuda -keys=cuda,gpu -max_num_threads=1024 -thread_warp_size=32", "auto_schedule_thread_fused_matmul", [1, 1225, 384, 224], {}], "config": {"index": 406, "code_hash": null, "entity": [["block_size_x", "ot", 8], ["block_size_y", "ot", 8], ["tx", "ot", 2], ["ty", "ot", 2], ["tk", "ot", 8]]}, "result": [[9.260067600000001e-05, 8.6686417e-05], 0, 39.196799755096436, 1634212031.9332776], "version": 0.2, "tvm_version": "0.8.dev0"}
{"input": ["cuda -keys=cuda,gpu -max_num_threads=1024 -thread_warp_size=32", "auto_schedule_thread_fused_matmul", [1, 1225, 384, 224], {}], "config": {"index": 742, "code_hash": null, "entity": [["block_size_x", "ot", 16], ["block_size_y", "ot", 32], ["tx", "ot", 4], ["ty", "ot", 16], ["tk", "ot", 8]]}, "result": [[0.000677336142, 0.000662445789], 0, 48.37240505218506, 1634212041.0400507], "version": 0.2, "tvm_version": "0.8.dev0"}
{"input": ["cuda -keys=cuda,gpu -max_num_threads=1024 -thread_warp_size=32", "auto_schedule_thread_fused_matmul", [1, 1225, 384, 224], {}], "config": {"index": 1411, "code_hash": null, "entity": [["block_size_x", "ot", 8], ["block_size_y", "ot", 16], ["tx", "ot", 2], ["ty", "ot", 8], ["tk", "ot", 32]]}, "result": [[0.000133394317, 0.00012128044000000001], 0, 41.16227340698242, 1634212033.9050379], "version": 0.2, "tvm_version": "0.8.dev0"}
{"input": ["cuda -keys=cuda,gpu -max_num_threads=1024 -thread_warp_size=32", "auto_schedule_thread_fused_matmul", [1, 1225, 384, 224], {}], "config": {"index": 1232, "code_hash": null, "entity": [["block_size_x", "ot", 16], ["block_size_y", "ot", 8], ["tx", "ot", 4], ["ty", "ot", 2], ["tk", "ot", 32]]}, "result": [[0.00012315888599999999, 0.00011405779099999999], 0, 43.079312801361084, 1634212035.8560593], "version": 0.2, "tvm_version": "0.8.dev0"}
{"input": ["cuda -keys=cuda,gpu -max_num_threads=1024 -thread_warp_size=32", "auto_schedule_thread_fused_matmul", [1, 1225, 384, 224], {}], "config": {"index": 908, "code_hash": null, "entity": [["block_size_x", "ot", 32], ["block_size_y", "ot", 8], ["tx", "ot", 2], ["ty", "ot", 4], ["tk", "ot", 16]]}, "result": [[8.8497282e-05, 8.233044099999999e-05], 0, 88.17269039154053, 1634212080.8677166], "version": 0.2, "tvm_version": "0.8.dev0"}
{"input": ["cuda -keys=cuda,gpu -max_num_threads=1024 -thread_warp_size=32", "auto_schedule_thread_fused_matmul", [1, 1225, 384, 224], {}], "config": {"index": 1091, "code_hash": null, "entity": [["block_size_x", "ot", 8], ["block_size_y", "ot", 32], ["tx", "ot", 16], ["ty", "ot", 8], ["tk", "ot", 16]]}, "result": [[0.000316384271, 0.00030603828600000006], 0, 50.767308712005615, 1634212043.402813], "version": 0.2, "tvm_version": "0.8.dev0"}
{"input": ["cuda -keys=cuda,gpu -max_num_threads=1024 -thread_warp_size=32", "auto_schedule_thread_fused_matmul", [1, 1225, 384, 224], {}], "config": {"index": 168, "code_hash": null, "entity": [["block_size_x", "ot", 32], ["block_size_y", "ot", 32], ["tx", "ot", 8], ["ty", "ot", 4], ["tk", "ot", 4]]}, "result": [[0.000629043503, 0.000613527991], 0, 55.528332471847534, 1634212048.302689], "version": 0.2, "tvm_version": "0.8.dev0"}
{"input": ["cuda -keys=cuda,gpu -max_num_threads=1024 -thread_warp_size=32", "auto_schedule_thread_fused_matmul", [1, 1225, 384, 224], {}], "config": {"index": 611, "code_hash": null, "entity": [["block_size_x", "ot", 8], ["block_size_y", "ot", 16], ["tx", "ot", 2], ["ty", "ot", 8], ["tk", "ot", 8]]}, "result": [[0.00014004047, 0.000128198083], 0, 52.581411600112915, 1634212045.3148696], "version": 0.2, "tvm_version": "0.8.dev0"}
{"input": ["cuda -keys=cuda,gpu -max_num_threads=1024 -thread_warp_size=32", "auto_schedule_thread_fused_matmul", [1, 1225, 384, 224], {}], "config": {"index": 229, "code_hash": null, "entity": [["block_size_x", "ot", 64], ["block_size_y", "ot", 4], ["tx", "ot", 4], ["ty", "ot", 8], ["tk", "ot", 4]]}, "result": [[0.000159902082, 0.00014656564199999999], 0, 57.51735782623291, 1634212050.2634218], "version": 0.2, "tvm_version": "0.8.dev0"}
{"input": ["cuda -keys=cuda,gpu -max_num_threads=1024 -thread_warp_size=32", "auto_schedule_thread_fused_matmul", [1, 1225, 384, 224], {}], "config": {"index": 877, "code_hash": null, "entity": [["block_size_x", "ot", 16], ["block_size_y", "ot", 4], ["tx", "ot", 16], ["ty", "ot", 2], ["tk", "ot", 16]]}, "result": [[0.000239027587, 0.00022302994799999997], 0, 59.62377691268921, 1634212052.387612], "version": 0.2, "tvm_version": "0.8.dev0"}
{"input": ["cuda -keys=cuda,gpu -max_num_threads=1024 -thread_warp_size=32", "auto_schedule_thread_fused_matmul", [1, 1225, 384, 224], {}], "config": {"index": 9, "code_hash": null, "entity": [["block_size_x", "ot", 64], ["block_size_y", "ot", 8], ["tx", "ot", 2], ["ty", "ot", 2], ["tk", "ot", 4]]}, "result": [[9.9981944e-05, 9.687918399999999e-05], 0, 70.79963707923889, 1634212063.5913417], "version": 0.2, "tvm_version": "0.8.dev0"}
{"input": ["cuda -keys=cuda,gpu -max_num_threads=1024 -thread_warp_size=32", "auto_schedule_thread_fused_matmul", [1, 1225, 384, 224], {}], "config": {"index": 84, "code_hash": null, "entity": [["block_size_x", "ot", 64], ["block_size_y", "ot", 8], ["tx", "ot", 16], ["ty", "ot", 2], ["tk", "ot", 4]]}, "result": [[0.000687913837, 0.000670355564], 0, 62.748940229415894, 1634212055.4733372], "version": 0.2, "tvm_version": "0.8.dev0"}
{"input": ["cuda -keys=cuda,gpu -max_num_threads=1024 -thread_warp_size=32", "auto_schedule_thread_fused_matmul", [1, 1225, 384, 224], {}], "config": {"index": 146, "code_hash": null, "entity": [["block_size_x", "ot", 8], ["block_size_y", "ot", 64], ["tx", "ot", 4], ["ty", "ot", 4], ["tk", "ot", 4]]}, "result": [[0.000209256484, 0.00019456689], 0, 64.7876284122467, 1634212057.5953472], "version": 0.2, "tvm_version": "0.8.dev0"}
{"input": ["cuda -keys=cuda,gpu -max_num_threads=1024 -thread_warp_size=32", "auto_schedule_thread_fused_matmul", [1, 1225, 384, 224], {}], "config": {"index": 665, "code_hash": null, "entity": [["block_size_x", "ot", 4], ["block_size_y", "ot", 32], ["tx", "ot", 8], ["ty", "ot", 8], ["tk", "ot", 8]]}, "result": [[0.00014746203600000002, 0.00013793249700000003], 0, 83.97049283981323, 1634212076.6950905], "version": 0.2, "tvm_version": "0.8.dev0"}
{"input": ["cuda -keys=cuda,gpu -max_num_threads=1024 -thread_warp_size=32", "auto_schedule_thread_fused_matmul", [1, 1225, 384, 224], {}], "config": {"index": 1418, "code_hash": null, "entity": [["block_size_x", "ot", 32], ["block_size_y", "ot", 32], ["tx", "ot", 2], ["ty", "ot", 8], ["tk", "ot", 32]]}, "result": [[0.000571964161, 0.0005609775390000001], 0, 81.89881157875061, 1634212074.7345781], "version": 0.2, "tvm_version": "0.8.dev0"}
{"input": ["cuda -keys=cuda,gpu -max_num_threads=1024 -thread_warp_size=32", "auto_schedule_thread_fused_matmul", [1, 1225, 384, 224], {}], "config": {"index": 260, "code_hash": null, "entity": [["block_size_x", "ot", 4], ["block_size_y", "ot", 16], ["tx", "ot", 8], ["ty", "ot", 8], ["tk", "ot", 4]]}, "result": [[0.000279029844, 0.000264818522], 0, 86.2303466796875, 1634212078.9610326], "version": 0.2, "tvm_version": "0.8.dev0"}
{"input": ["cuda -keys=cuda,gpu -max_num_threads=1024 -thread_warp_size=32", "auto_schedule_thread_fused_matmul", [1, 1225, 384, 224], {}], "config": {"index": 811, "code_hash": null, "entity": [["block_size_x", "ot", 8], ["block_size_y", "ot", 16], ["tx", "ot", 2], ["ty", "ot", 2], ["tk", "ot", 16]]}, "result": [[7.572635200000002e-05, 7.347152e-05], 0, 5.770573139190674, 1634212091.3580203], "version": 0.2, "tvm_version": "0.8.dev0"}
{"input": ["cuda -keys=cuda,gpu -max_num_threads=1024 -thread_warp_size=32", "auto_schedule_thread_fused_matmul", [1, 1225, 384, 224], {}], "config": {"index": 812, "code_hash": null, "entity": [["block_size_x", "ot", 16], ["block_size_y", "ot", 16], ["tx", "ot", 2], ["ty", "ot", 2], ["tk", "ot", 16]]}, "result": [[7.9384759e-05, 7.4180153e-05], 0, 3.9189064502716064, 1634212089.5156891], "version": 0.2, "tvm_version": "0.8.dev0"}
{"input": ["cuda -keys=cuda,gpu -max_num_threads=1024 -thread_warp_size=32", "auto_schedule_thread_fused_matmul", [1, 1225, 384, 224], {}], "config": {"index": 507, "code_hash": null, "entity": [["block_size_x", "ot", 16], ["block_size_y", "ot", 8], ["tx", "ot", 2], ["ty", "ot", 4], ["tk", "ot", 8]]}, "result": [[7.180639700000001e-05, 7.118253600000001e-05], 0, 2.0195555686950684, 1634212087.6193633], "version": 0.2, "tvm_version": "0.8.dev0"}
{"input": ["cuda -keys=cuda,gpu -max_num_threads=1024 -thread_warp_size=32", "auto_schedule_thread_fused_matmul", [1, 1225, 384, 224], {}], "config": {"index": 1211, "code_hash": null, "entity": [["block_size_x", "ot", 8], ["block_size_y", "ot", 16], ["tx", "ot", 2], ["ty", "ot", 2], ["tk", "ot", 32]]}, "result": [[7.7602379e-05, 7.6663405e-05], 0, 7.578169345855713, 1634212093.1842234], "version": 0.2, "tvm_version": "0.8.dev0"}
{"input": ["cuda -keys=cuda,gpu -max_num_threads=1024 -thread_warp_size=32", "auto_schedule_thread_fused_matmul", [1, 1225, 384, 224], {}], "config": {"index": 1212, "code_hash": null, "entity": [["block_size_x", "ot", 16], ["block_size_y", "ot", 16], ["tx", "ot", 2], ["ty", "ot", 2], ["tk", "ot", 32]]}, "result": [[8.1015986e-05, 8.1070644e-05], 0, 9.356594562530518, 1634212094.9814236], "version": 0.2, "tvm_version": "0.8.dev0"}
{"input": ["cuda -keys=cuda,gpu -max_num_threads=1024 -thread_warp_size=32", "auto_schedule_thread_fused_matmul", [1, 1225, 384, 224], {}], "config": {"index": 907, "code_hash": null, "entity": [["block_size_x", "ot", 16], ["block_size_y", "ot", 8], ["tx", "ot", 2], ["ty", "ot", 4], ["tk", "ot", 16]]}, "result": [[8.8845832e-05, 8.746046799999999e-05], 0, 14.977060079574585, 1634212100.5955503], "version": 0.2, "tvm_version": "0.8.dev0"}
{"input": ["cuda -keys=cuda,gpu -max_num_threads=1024 -thread_warp_size=32", "auto_schedule_thread_fused_matmul", [1, 1225, 384, 224], {}], "config": {"index": 836, "code_hash": null, "entity": [["block_size_x", "ot", 8], ["block_size_y", "ot", 16], ["tx", "ot", 4], ["ty", "ot", 2], ["tk", "ot", 16]]}, "result": [[6.9925943e-05, 6.9825967e-05], 0, 11.184485673904419, 1634212096.820335], "version": 0.2, "tvm_version": "0.8.dev0"}
{"input": ["cuda -keys=cuda,gpu -max_num_threads=1024 -thread_warp_size=32", "auto_schedule_thread_fused_matmul", [1, 1225, 384, 224], {}], "config": {"index": 411, "code_hash": null, "entity": [["block_size_x", "ot", 8], ["block_size_y", "ot", 16], ["tx", "ot", 2], ["ty", "ot", 2], ["tk", "ot", 8]]}, "result": [[6.8485248e-05, 6.7869155e-05], 0, 13.08031964302063, 1634212098.7226217], "version": 0.2, "tvm_version": "0.8.dev0"}
{"input": ["cuda -keys=cuda,gpu -max_num_threads=1024 -thread_warp_size=32", "auto_schedule_thread_fused_matmul", [1, 1225, 384, 224], {}], "config": {"index": 413, "code_hash": null, "entity": [["block_size_x", "ot", 32], ["block_size_y", "ot", 16], ["tx", "ot", 2], ["ty", "ot", 2], ["tk", "ot", 8]]}, "result": [[7.731159100000002e-05, 7.7488494e-05], 0, 20.525660514831543, 1634212106.1918285], "version": 0.2, "tvm_version": "0.8.dev0"}
{"input": ["cuda -keys=cuda,gpu -max_num_threads=1024 -thread_warp_size=32", "auto_schedule_thread_fused_matmul", [1, 1225, 384, 224], {}], "config": {"index": 845, "code_hash": null, "entity": [["block_size_x", "ot", 4], ["block_size_y", "ot", 64], ["tx", "ot", 4], ["ty", "ot", 2], ["tk", "ot", 16]]}, "result": [[8.6369223e-05, 8.141733100000002e-05], 0, 16.877803325653076, 1634212102.4848056], "version": 0.2, "tvm_version": "0.8.dev0"}
{"input": ["cuda -keys=cuda,gpu -max_num_threads=1024 -thread_warp_size=32", "auto_schedule_thread_fused_matmul", [1, 1225, 384, 224], {}], "config": {"index": 445, "code_hash": null, "entity": [["block_size_x", "ot", 4], ["block_size_y", "ot", 64], ["tx", "ot", 4], ["ty", "ot", 2], ["tk", "ot", 8]]}, "result": [[8.8689663e-05, 8.5433205e-05], 0, 24.226871967315674, 1634212109.924672], "version": 0.2, "tvm_version": "0.8.dev0"}
{"input": ["cuda -keys=cuda,gpu -max_num_threads=1024 -thread_warp_size=32", "auto_schedule_thread_fused_matmul", [1, 1225, 384, 224], {}], "config": {"index": 1216, "code_hash": null, "entity": [["block_size_x", "ot", 8], ["block_size_y", "ot", 32], ["tx", "ot", 2], ["ty", "ot", 2], ["tk", "ot", 32]]}, "result": [[7.9521916e-05, 7.8123788e-05], 0, 18.6430082321167, 1634212104.3165672], "version": 0.2, "tvm_version": "0.8.dev0"}
{"input": ["cuda -keys=cuda,gpu -max_num_threads=1024 -thread_warp_size=32", "auto_schedule_thread_fused_matmul", [1, 1225, 384, 224], {}], "config": {"index": 813, "code_hash": null, "entity": [["block_size_x", "ot", 32], ["block_size_y", "ot", 16], ["tx", "ot", 2], ["ty", "ot", 2], ["tk", "ot", 16]]}, "result": [[8.2150274e-05, 7.8816463e-05], 0, 26.090142488479614, 1634212111.775953], "version": 0.2, "tvm_version": "0.8.dev0"}
{"input": ["cuda -keys=cuda,gpu -max_num_threads=1024 -thread_warp_size=32", "auto_schedule_thread_fused_matmul", [1, 1225, 384, 224], {}], "config": {"index": 1235, "code_hash": null, "entity": [["block_size_x", "ot", 4], ["block_size_y", "ot", 16], ["tx", "ot", 4], ["ty", "ot", 2], ["tk", "ot", 32]]}, "result": [[7.1795599e-05, 7.1391454e-05], 0, 22.371657848358154, 1634212108.0332987], "version": 0.2, "tvm_version": "0.8.dev0"}
{"input": ["cuda -keys=cuda,gpu -max_num_threads=1024 -thread_warp_size=32", "auto_schedule_thread_fused_matmul", [1, 1225, 384, 224], {}], "config": {"index": 412, "code_hash": null, "entity": [["block_size_x", "ot", 16], ["block_size_y", "ot", 16], ["tx", "ot", 2], ["ty", "ot", 2], ["tk", "ot", 8]]}, "result": [[7.375491e-05, 7.3669085e-05], 0, 27.85675048828125, 1634212113.5685973], "version": 0.2, "tvm_version": "0.8.dev0"}
{"input": ["cuda -keys=cuda,gpu -max_num_threads=1024 -thread_warp_size=32", "auto_schedule_thread_fused_matmul", [1, 1225, 384, 224], {}], "config": {"index": 816, "code_hash": null, "entity": [["block_size_x", "ot", 8], ["block_size_y", "ot", 32], ["tx", "ot", 2], ["ty", "ot", 2], ["tk", "ot", 16]]}, "result": [[8.2175944e-05, 7.505142499999999e-05], 0, 29.79701542854309, 1634212115.4867823], "version": 0.2, "tvm_version": "0.8.dev0"}
{"input": ["cuda -keys=cuda,gpu -max_num_threads=1024 -thread_warp_size=32", "auto_schedule_thread_fused_matmul", [1, 1225, 384, 224], {}], "config": {"index": 835, "code_hash": null, "entity": [["block_size_x", "ot", 4], ["block_size_y", "ot", 16], ["tx", "ot", 4], ["ty", "ot", 2], ["tk", "ot", 16]]}, "result": [[7.079898300000001e-05, 7.0849704e-05], 0, 31.578523874282837, 1634212117.3183813], "version": 0.2, "tvm_version": "0.8.dev0"}
{"input": ["cuda -keys=cuda,gpu -max_num_threads=1024 -thread_warp_size=32", "auto_schedule_thread_fused_matmul", [1, 1225, 384, 224], {}], "config": {"index": 1217, "code_hash": null, "entity": [["block_size_x", "ot", 16], ["block_size_y", "ot", 32], ["tx", "ot", 2], ["ty", "ot", 2], ["tk", "ot", 32]]}, "result": [[7.826841799999999e-05, 7.5955437e-05], 0, 33.412301778793335, 1634212119.1559489], "version": 0.2, "tvm_version": "0.8.dev0"}
{"input": ["cuda -keys=cuda,gpu -max_num_threads=1024 -thread_warp_size=32", "auto_schedule_thread_fused_matmul", [1, 1225, 384, 224], {}], "config": {"index": 107, "code_hash": null, "entity": [["block_size_x", "ot", 16], ["block_size_y", "ot", 8], ["tx", "ot", 2], ["ty", "ot", 4], ["tk", "ot", 4]]}, "result": [[7.8750191e-05, 7.8761523e-05], 0, 42.76637673377991, 1634212128.547957], "version": 0.2, "tvm_version": "0.8.dev0"}
{"input": ["cuda -keys=cuda,gpu -max_num_threads=1024 -thread_warp_size=32", "auto_schedule_thread_fused_matmul", [1, 1225, 384, 224], {}], "config": {"index": 438, "code_hash": null, "entity": [["block_size_x", "ot", 32], ["block_size_y", "ot", 16], ["tx", "ot", 4], ["ty", "ot", 2], ["tk", "ot", 8]]}, "result": [[9.1450505e-05, 8.587424e-05], 0, 40.94465684890747, 1634212126.7020252], "version": 0.2, "tvm_version": "0.8.dev0"}
{"input": ["cuda -keys=cuda,gpu -max_num_threads=1024 -thread_warp_size=32", "auto_schedule_thread_fused_matmul", [1, 1225, 384, 224], {}], "config": {"index": 911, "code_hash": null, "entity": [["block_size_x", "ot", 8], ["block_size_y", "ot", 16], ["tx", "ot", 2], ["ty", "ot", 4], ["tk", "ot", 16]]}, "result": [[9.022801900000001e-05, 8.7676007e-05], 0, 35.29096245765686, 1634212121.0374887], "version": 0.2, "tvm_version": "0.8.dev0"}
{"input": ["cuda -keys=cuda,gpu -max_num_threads=1024 -thread_warp_size=32", "auto_schedule_thread_fused_matmul", [1, 1225, 384, 224], {}], "config": {"index": 841, "code_hash": null, "entity": [["block_size_x", "ot", 8], ["block_size_y", "ot", 32], ["tx", "ot", 4], ["ty", "ot", 2], ["tk", "ot", 16]]}, "result": [[7.994602100000001e-05, 7.900974499999999e-05], 0, 37.13418889045715, 1634212122.8727837], "version": 0.2, "tvm_version": "0.8.dev0"}
{"input": ["cuda -keys=cuda,gpu -max_num_threads=1024 -thread_warp_size=32", "auto_schedule_thread_fused_matmul", [1, 1225, 384, 224], {}], "config": {"index": 407, "code_hash": null, "entity": [["block_size_x", "ot", 16], ["block_size_y", "ot", 8], ["tx", "ot", 2], ["ty", "ot", 2], ["tk", "ot", 8]]}, "result": [[8.8035327e-05, 8.3073692e-05], 0, 44.629541873931885, 1634212130.3997574], "version": 0.2, "tvm_version": "0.8.dev0"}
{"input": ["cuda -keys=cuda,gpu -max_num_threads=1024 -thread_warp_size=32", "auto_schedule_thread_fused_matmul", [1, 1225, 384, 224], {}], "config": {"index": 810, "code_hash": null, "entity": [["block_size_x", "ot", 4], ["block_size_y", "ot", 16], ["tx", "ot", 2], ["ty", "ot", 2], ["tk", "ot", 16]]}, "result": [[8.609785599999998e-05, 8.0893148e-05], 0, 39.00135850906372, 1634212124.7904463], "version": 0.2, "tvm_version": "0.8.dev0"}
{"input": ["cuda -keys=cuda,gpu -max_num_threads=1024 -thread_warp_size=32", "auto_schedule_thread_fused_matmul", [1, 1225, 384, 224], {}], "config": {"index": 821, "code_hash": null, "entity": [["block_size_x", "ot", 8], ["block_size_y", "ot", 64], ["tx", "ot", 2], ["ty", "ot", 2], ["tk", "ot", 16]]}, "result": [[8.437873399999999e-05, 7.936671099999999e-05], 0, 46.57511830329895, 1634212132.3097343], "version": 0.2, "tvm_version": "0.8.dev0"}
{"input": ["cuda -keys=cuda,gpu -max_num_threads=1024 -thread_warp_size=32", "auto_schedule_thread_fused_matmul", [1, 1225, 384, 224], {}], "config": {"index": 435, "code_hash": null, "entity": [["block_size_x", "ot", 4], ["block_size_y", "ot", 16], ["tx", "ot", 4], ["ty", "ot", 2], ["tk", "ot", 8]]}, "result": [[7.5695735e-05, 7.4345337e-05], 0, 50.278446435928345, 1634212136.1150348], "version": 0.2, "tvm_version": "0.8.dev0"}
{"input": ["cuda -keys=cuda,gpu -max_num_threads=1024 -thread_warp_size=32", "auto_schedule_thread_fused_matmul", [1, 1225, 384, 224], {}], "config": {"index": 441, "code_hash": null, "entity": [["block_size_x", "ot", 8], ["block_size_y", "ot", 32], ["tx", "ot", 4], ["ty", "ot", 2], ["tk", "ot", 8]]}, "result": [[8.967384400000001e-05, 8.9734419e-05], 0, 55.741135597229004, 1634212141.6000848], "version": 0.2, "tvm_version": "0.8.dev0"}
{"input": ["cuda -keys=cuda,gpu -max_num_threads=1024 -thread_warp_size=32", "auto_schedule_thread_fused_matmul", [1, 1225, 384, 224], {}], "config": {"index": 1308, "code_hash": null, "entity": [["block_size_x", "ot", 32], ["block_size_y", "ot", 8], ["tx", "ot", 2], ["ty", "ot", 4], ["tk", "ot", 32]]}, "result": [[8.6869923e-05, 8.278472e-05], 0, 48.39838695526123, 1634212134.2101774], "version": 0.2, "tvm_version": "0.8.dev0"}
{"input": ["cuda -keys=cuda,gpu -max_num_threads=1024 -thread_warp_size=32", "auto_schedule_thread_fused_matmul", [1, 1225, 384, 224], {}], "config": {"index": 416, "code_hash": null, "entity": [["block_size_x", "ot", 8], ["block_size_y", "ot", 32], ["tx", "ot", 2], ["ty", "ot", 2], ["tk", "ot", 8]]}, "result": [[9.035750099999999e-05, 8.6230899e-05], 0, 52.12018942832947, 1634212137.959395], "version": 0.2, "tvm_version": "0.8.dev0"}
{"input": ["cuda -keys=cuda,gpu -max_num_threads=1024 -thread_warp_size=32", "auto_schedule_thread_fused_matmul", [1, 1225, 384, 224], {}], "config": {"index": 1236, "code_hash": null, "entity": [["block_size_x", "ot", 8], ["block_size_y", "ot", 16], ["tx", "ot", 4], ["ty", "ot", 2], ["tk", "ot", 32]]}, "result": [[7.0548387e-05, 7.0543366e-05], 0, 53.945693016052246, 1634212139.7900157], "version": 0.2, "tvm_version": "0.8.dev0"}
{"input": ["cuda -keys=cuda,gpu -max_num_threads=1024 -thread_warp_size=32", "auto_schedule_thread_fused_matmul", [1, 1225, 384, 224], {}], "config": {"index": 436, "code_hash": null, "entity": [["block_size_x", "ot", 8], ["block_size_y", "ot", 16], ["tx", "ot", 4], ["ty", "ot", 2], ["tk", "ot", 8]]}, "result": [[7.471677099999999e-05, 7.4813608e-05], 0, 57.573997020721436, 1634212143.4424577], "version": 0.2, "tvm_version": "0.8.dev0"}
{"input": ["cuda -keys=cuda,gpu -max_num_threads=1024 -thread_warp_size=32", "auto_schedule_thread_fused_matmul", [1, 1225, 384, 224], {}], "config": {"index": 1210, "code_hash": null, "entity": [["block_size_x", "ot", 4], ["block_size_y", "ot", 16], ["tx", "ot", 2], ["ty", "ot", 2], ["tk", "ot", 32]]}, "result": [[8.7550252e-05, 8.406392399999999e-05], 0, 66.91161561012268, 1634212152.8242114], "version": 0.2, "tvm_version": "0.8.dev0"}
{"input": ["cuda -keys=cuda,gpu -max_num_threads=1024 -thread_warp_size=32", "auto_schedule_thread_fused_matmul", [1, 1225, 384, 224], {}], "config": {"index": 916, "code_hash": null, "entity": [["block_size_x", "ot", 8], ["block_size_y", "ot", 32], ["tx", "ot", 2], ["ty", "ot", 4], ["tk", "ot", 16]]}, "result": [[0.00011246125799999999, 0.00010246384999999999], 0, 59.47877526283264, 1634212145.3291252], "version": 0.2, "tvm_version": "0.8.dev0"}
{"input": ["cuda -keys=cuda,gpu -max_num_threads=1024 -thread_warp_size=32", "auto_schedule_thread_fused_matmul", [1, 1225, 384, 224], {}], "config": {"index": 906, "code_hash": null, "entity": [["block_size_x", "ot", 8], ["block_size_y", "ot", 8], ["tx", "ot", 2], ["ty", "ot", 4], ["tk", "ot", 16]]}, "result": [[8.8829485e-05, 8.8877819e-05], 0, 61.24698615074158, 1634212147.1396756], "version": 0.2, "tvm_version": "0.8.dev0"}
{"input": ["cuda -keys=cuda,gpu -max_num_threads=1024 -thread_warp_size=32", "auto_schedule_thread_fused_matmul", [1, 1225, 384, 224], {}], "config": {"index": 1245, "code_hash": null, "entity": [["block_size_x", "ot", 4], ["block_size_y", "ot", 64], ["tx", "ot", 4], ["ty", "ot", 2], ["tk", "ot", 32]]}, "result": [[8.209540200000001e-05, 8.043292500000001e-05], 0, 63.160117387771606, 1634212149.0105965], "version": 0.2, "tvm_version": "0.8.dev0"}
{"input": ["cuda -keys=cuda,gpu -max_num_threads=1024 -thread_warp_size=32", "auto_schedule_thread_fused_matmul", [1, 1225, 384, 224], {}], "config": {"index": 1306, "code_hash": null, "entity": [["block_size_x", "ot", 8], ["block_size_y", "ot", 8], ["tx", "ot", 2], ["ty", "ot", 4], ["tk", "ot", 32]]}, "result": [[8.890787e-05, 8.2764135e-05], 0, 65.01200556755066, 1634212150.9130416], "version": 0.2, "tvm_version": "0.8.dev0"}
{"input": ["cuda -keys=cuda,gpu -max_num_threads=1024 -thread_warp_size=32", "auto_schedule_thread_fused_matmul", [1, 1225, 384, 224], {}], "config": {"index": 837, "code_hash": null, "entity": [["block_size_x", "ot", 16], ["block_size_y", "ot", 16], ["tx", "ot", 4], ["ty", "ot", 2], ["tk", "ot", 16]]}, "result": [[6.947513900000001e-05, 6.9281315e-05], 0, 72.45718717575073, 1634212158.402292], "version": 0.2, "tvm_version": "0.8.dev0"}
{"input": ["cuda -keys=cuda,gpu -max_num_threads=1024 -thread_warp_size=32", "auto_schedule_thread_fused_matmul", [1, 1225, 384, 224], {}], "config": {"index": 1311, "code_hash": null, "entity": [["block_size_x", "ot", 8], ["block_size_y", "ot", 16], ["tx", "ot", 2], ["ty", "ot", 4], ["tk", "ot", 32]]}, "result": [[8.8898507e-05, 8.5123809e-05], 0, 68.77360367774963, 1634212154.6801472], "version": 0.2, "tvm_version": "0.8.dev0"}
{"input": ["cuda -keys=cuda,gpu -max_num_threads=1024 -thread_warp_size=32", "auto_schedule_thread_fused_matmul", [1, 1225, 384, 224], {}], "config": {"index": 817, "code_hash": null, "entity": [["block_size_x", "ot", 16], ["block_size_y", "ot", 32], ["tx", "ot", 2], ["ty", "ot", 2], ["tk", "ot", 16]]}, "result": [[8.4790468e-05, 8.488894100000001e-05], 0, 74.36227226257324, 1634212160.272749], "version": 0.2, "tvm_version": "0.8.dev0"}
{"input": ["cuda -keys=cuda,gpu -max_num_threads=1024 -thread_warp_size=32", "auto_schedule_thread_fused_matmul", [1, 1225, 384, 224], {}], "config": {"index": 1332, "code_hash": null, "entity": [["block_size_x", "ot", 16], ["block_size_y", "ot", 8], ["tx", "ot", 4], ["ty", "ot", 4], ["tk", "ot", 32]]}, "result": [[7.695046600000001e-05, 7.2375088e-05], 0, 70.68284916877747, 1634212156.5536535], "version": 0.2, "tvm_version": "0.8.dev0"}
{"input": ["cuda -keys=cuda,gpu -max_num_threads=1024 -thread_warp_size=32", "auto_schedule_thread_fused_matmul", [1, 1225, 384, 224], {}], "config": {"index": 108, "code_hash": null, "entity": [["block_size_x", "ot", 32], ["block_size_y", "ot", 8], ["tx", "ot", 2], ["ty", "ot", 4], ["tk", "ot", 4]]}, "result": [[8.6292272e-05, 8.4532632e-05], 0, 1.9837424755096436, 1634212162.6873825], "version": 0.2, "tvm_version": "0.8.dev0"}
{"input": ["cuda -keys=cuda,gpu -max_num_threads=1024 -thread_warp_size=32", "auto_schedule_thread_fused_matmul", [1, 1225, 384, 224], {}], "config": {"index": 1206, "code_hash": null, "entity": [["block_size_x", "ot", 8], ["block_size_y", "ot", 8], ["tx", "ot", 2], ["ty", "ot", 2], ["tk", "ot", 32]]}, "result": [[0.000129207868, 0.000120040932], 0, 5.77204442024231, 1634212166.4997847], "version": 0.2, "tvm_version": "0.8.dev0"}
{"input": ["cuda -keys=cuda,gpu -max_num_threads=1024 -thread_warp_size=32", "auto_schedule_thread_fused_matmul", [1, 1225, 384, 224], {}], "config": {"index": 410, "code_hash": null, "entity": [["block_size_x", "ot", 4], ["block_size_y", "ot", 16], ["tx", "ot", 2], ["ty", "ot", 2], ["tk", "ot", 8]]}, "result": [[7.7693442e-05, 7.63226e-05], 0, 7.571112871170044, 1634212168.3196669], "version": 0.2, "tvm_version": "0.8.dev0"}
{"input": ["cuda -keys=cuda,gpu -max_num_threads=1024 -thread_warp_size=32", "auto_schedule_thread_fused_matmul", [1, 1225, 384, 224], {}], "config": {"index": 417, "code_hash": null, "entity": [["block_size_x", "ot", 16], ["block_size_y", "ot", 32], ["tx", "ot", 2], ["ty", "ot", 2], ["tk", "ot", 8]]}, "result": [[9.570343699999999e-05, 8.8745459e-05], 0, 3.8454325199127197, 1634212164.5617392], "version": 0.2, "tvm_version": "0.8.dev0"}
{"input": ["cuda -keys=cuda,gpu -max_num_threads=1024 -thread_warp_size=32", "auto_schedule_thread_fused_matmul", [1, 1225, 384, 224], {}], "config": {"index": 37, "code_hash": null, "entity": [["block_size_x", "ot", 16], ["block_size_y", "ot", 16], ["tx", "ot", 4], ["ty", "ot", 2], ["tk", "ot", 4]]}, "result": [[8.430494099999999e-05, 8.040078200000001e-05], 0, 9.440825939178467, 1634212170.2063959], "version": 0.2, "tvm_version": "0.8.dev0"}
{"input": ["cuda -keys=cuda,gpu -max_num_threads=1024 -thread_warp_size=32", "auto_schedule_thread_fused_matmul", [1, 1225, 384, 224], {}], "config": {"index": 840, "code_hash": null, "entity": [["block_size_x", "ot", 4], ["block_size_y", "ot", 32], ["tx", "ot", 4], ["ty", "ot", 2], ["tk", "ot", 16]]}, "result": [[8.4219885e-05, 8.2667985e-05], 0, 11.320691108703613, 1634212172.075724], "version": 0.2, "tvm_version": "0.8.dev0"}
{"input": ["cuda -keys=cuda,gpu -max_num_threads=1024 -thread_warp_size=32", "auto_schedule_thread_fused_matmul", [1, 1225, 384, 224], {}], "config": {"index": 11, "code_hash": null, "entity": [["block_size_x", "ot", 8], ["block_size_y", "ot", 16], ["tx", "ot", 2], ["ty", "ot", 2], ["tk", "ot", 4]]}, "result": [[8.329034000000001e-05, 8.2680356e-05], 0, 13.133612155914307, 1634212173.8981817], "version": 0.2, "tvm_version": "0.8.dev0"}
{"input": ["cuda -keys=cuda,gpu -max_num_threads=1024 -thread_warp_size=32", "auto_schedule_thread_fused_matmul", [1, 1225, 384, 224], {}], "config": {"index": 1312, "code_hash": null, "entity": [["block_size_x", "ot", 16], ["block_size_y", "ot", 16], ["tx", "ot", 2], ["ty", "ot", 4], ["tk", "ot", 32]]}, "result": [[8.4598872e-05, 8.1797011e-05], 0, 14.975486278533936, 1634212175.7416062], "version": 0.2, "tvm_version": "0.8.dev0"}
{"input": ["cuda -keys=cuda,gpu -max_num_threads=1024 -thread_warp_size=32", "auto_schedule_thread_fused_matmul", [1, 1225, 384, 224], {}], "config": {"index": 1305, "code_hash": null, "entity": [["block_size_x", "ot", 4], ["block_size_y", "ot", 8], ["tx", "ot", 2], ["ty", "ot", 4], ["tk", "ot", 32]]}, "result": [[0.000110538343, 0.00010165082000000001], 0, 28.14261531829834, 1634212188.9569156], "version": 0.2, "tvm_version": "0.8.dev0"}
{"input": ["cuda -keys=cuda,gpu -max_num_threads=1024 -thread_warp_size=32", "auto_schedule_thread_fused_matmul", [1, 1225, 384, 224], {}], "config": {"index": 36, "code_hash": null, "entity": [["block_size_x", "ot", 8], ["block_size_y", "ot", 16], ["tx", "ot", 4], ["ty", "ot", 2], ["tk", "ot", 4]]}, "result": [[8.082623e-05, 7.5516469e-05], 0, 24.304054260253906, 1634212185.123079], "version": 0.2, "tvm_version": "0.8.dev0"}
{"input": ["cuda -keys=cuda,gpu -max_num_threads=1024 -thread_warp_size=32", "auto_schedule_thread_fused_matmul", [1, 1225, 384, 224], {}], "config": {"index": 511, "code_hash": null, "entity": [["block_size_x", "ot", 8], ["block_size_y", "ot", 16], ["tx", "ot", 2], ["ty", "ot", 4], ["tk", "ot", 8]]}, "result": [[9.320352200000001e-05, 8.7278312e-05], 0, 16.93600082397461, 1634212177.6869555], "version": 0.2, "tvm_version": "0.8.dev0"}
{"input": ["cuda -keys=cuda,gpu -max_num_threads=1024 -thread_warp_size=32", "auto_schedule_thread_fused_matmul", [1, 1225, 384, 224], {}], "config": {"index": 506, "code_hash": null, "entity": [["block_size_x", "ot", 8], ["block_size_y", "ot", 8], ["tx", "ot", 2], ["ty", "ot", 4], ["tk", "ot", 8]]}, "result": [[7.1174918e-05, 7.1252306e-05], 0, 20.596444129943848, 1634212181.4050732], "version": 0.2, "tvm_version": "0.8.dev0"}
{"input": ["cuda -keys=cuda,gpu -max_num_threads=1024 -thread_warp_size=32", "auto_schedule_thread_fused_matmul", [1, 1225, 384, 224], {}], "config": {"index": 1240, "code_hash": null, "entity": [["block_size_x", "ot", 4], ["block_size_y", "ot", 32], ["tx", "ot", 4], ["ty", "ot", 2], ["tk", "ot", 32]]}, "result": [[8.091702499999999e-05, 7.776044e-05], 0, 18.802685499191284, 1634212179.603662], "version": 0.2, "tvm_version": "0.8.dev0"}
{"input": ["cuda -keys=cuda,gpu -max_num_threads=1024 -thread_warp_size=32", "auto_schedule_thread_fused_matmul", [1, 1225, 384, 224], {}], "config": {"index": 512, "code_hash": null, "entity": [["block_size_x", "ot", 16], ["block_size_y", "ot", 16], ["tx", "ot", 2], ["ty", "ot", 4], ["tk", "ot", 8]]}, "result": [[9.2054862e-05, 8.7962856e-05], 0, 22.467666149139404, 1634212183.2747943], "version": 0.2, "tvm_version": "0.8.dev0"}
{"input": ["cuda -keys=cuda,gpu -max_num_threads=1024 -thread_warp_size=32", "auto_schedule_thread_fused_matmul", [1, 1225, 384, 224], {}], "config": {"index": 932, "code_hash": null, "entity": [["block_size_x", "ot", 16], ["block_size_y", "ot", 8], ["tx", "ot", 4], ["ty", "ot", 4], ["tk", "ot", 16]]}, "result": [[8.124931599999999e-05, 8.008365499999998e-05], 0, 31.842041492462158, 1634212192.6890917], "version": 0.2, "tvm_version": "0.8.dev0"}
{"input": ["cuda -keys=cuda,gpu -max_num_threads=1024 -thread_warp_size=32", "auto_schedule_thread_fused_matmul", [1, 1225, 384, 224], {}], "config": {"index": 1213, "code_hash": null, "entity": [["block_size_x", "ot", 32], ["block_size_y", "ot", 16], ["tx", "ot", 2], ["ty", "ot", 2], ["tk", "ot", 32]]}, "result": [[7.8423645e-05, 7.303722600000002e-05], 0, 26.175562620162964, 1634212187.0076592], "version": 0.2, "tvm_version": "0.8.dev0"}
{"input": ["cuda -keys=cuda,gpu -max_num_threads=1024 -thread_warp_size=32", "auto_schedule_thread_fused_matmul", [1, 1225, 384, 224], {}], "config": {"index": 532, "code_hash": null, "entity": [["block_size_x", "ot", 16], ["block_size_y", "ot", 8], ["tx", "ot", 4], ["ty", "ot", 4], ["tk", "ot", 8]]}, "result": [[8.8145611e-05, 8.574676500000001e-05], 0, 41.267433166503906, 1634212202.1361668], "version": 0.2, "tvm_version": "0.8.dev0"}
{"input": ["cuda -keys=cuda,gpu -max_num_threads=1024 -thread_warp_size=32", "auto_schedule_thread_fused_matmul", [1, 1225, 384, 224], {}], "config": {"index": 440, "code_hash": null, "entity": [["block_size_x", "ot", 4], ["block_size_y", "ot", 32], ["tx", "ot", 4], ["ty", "ot", 2], ["tk", "ot", 8]]}, "result": [[8.8339741e-05, 8.5850352e-05], 0, 33.69432735443115, 1634212194.5388544], "version": 0.2, "tvm_version": "0.8.dev0"}
{"input": ["cuda -keys=cuda,gpu -max_num_threads=1024 -thread_warp_size=32", "auto_schedule_thread_fused_matmul", [1, 1225, 384, 224], {}], "config": {"index": 132, "code_hash": null, "entity": [["block_size_x", "ot", 16], ["block_size_y", "ot", 8], ["tx", "ot", 4], ["ty", "ot", 4], ["tk", "ot", 4]]}, "result": [[0.000102895098, 9.8070601e-05], 0, 30.01034665107727, 1634212190.8659806], "version": 0.2, "tvm_version": "0.8.dev0"}
{"input": ["cuda -keys=cuda,gpu -max_num_threads=1024 -thread_warp_size=32", "auto_schedule_thread_fused_matmul", [1, 1225, 384, 224], {}], "config": {"index": 12, "code_hash": null, "entity": [["block_size_x", "ot", 16], ["block_size_y", "ot", 16], ["tx", "ot", 2], ["ty", "ot", 2], ["tk", "ot", 4]]}, "result": [[9.0609788e-05, 9.069695400000001e-05], 0, 37.41773796081543, 1634212198.2729118], "version": 0.2, "tvm_version": "0.8.dev0"}
{"input": ["cuda -keys=cuda,gpu -max_num_threads=1024 -thread_warp_size=32", "auto_schedule_thread_fused_matmul", [1, 1225, 384, 224], {}], "config": {"index": 502, "code_hash": null, "entity": [["block_size_x", "ot", 16], ["block_size_y", "ot", 4], ["tx", "ot", 2], ["ty", "ot", 4], ["tk", "ot", 8]]}, "result": [[0.00010071342, 9.318907499999999e-05], 0, 35.575828075408936, 1634212196.4349942], "version": 0.2, "tvm_version": "0.8.dev0"}
{"input": ["cuda -keys=cuda,gpu -max_num_threads=1024 -thread_warp_size=32", "auto_schedule_thread_fused_matmul", [1, 1225, 384, 224], {}], "config": {"index": 151, "code_hash": null, "entity": [["block_size_x", "ot", 8], ["block_size_y", "ot", 4], ["tx", "ot", 8], ["ty", "ot", 4], ["tk", "ot", 4]]}, "result": [[0.000168383258, 0.00015459005099999998], 0, 39.455727100372314, 1634212200.2825856], "version": 0.2, "tvm_version": "0.8.dev0"}
{"input": ["cuda -keys=cuda,gpu -max_num_threads=1024 -thread_warp_size=32", "auto_schedule_thread_fused_matmul", [1, 1225, 384, 224], {}], "config": {"index": 971, "code_hash": null, "entity": [["block_size_x", "ot", 8], ["block_size_y", "ot", 64], ["tx", "ot", 8], ["ty", "ot", 4], ["tk", "ot", 16]]}, "result": [[0.000257338141, 0.000244282197], 0, 45.724557399749756, 1634212206.6094055], "version": 0.2, "tvm_version": "0.8.dev0"}
{"input": ["cuda -keys=cuda,gpu -max_num_threads=1024 -thread_warp_size=32", "auto_schedule_thread_fused_matmul", [1, 1225, 384, 224], {}], "config": {"index": 1042, "code_hash": null, "entity": [["block_size_x", "ot", 16], ["block_size_y", "ot", 32], ["tx", "ot", 4], ["ty", "ot", 8], ["tk", "ot", 16]]}, "result": [[0.000340321769, 0.000325342468], 0, 49.996822357177734, 1634212210.8919337], "version": 0.2, "tvm_version": "0.8.dev0"}
{"input": ["cuda -keys=cuda,gpu -max_num_threads=1024 -thread_warp_size=32", "auto_schedule_thread_fused_matmul", [1, 1225, 384, 224], {}], "config": {"index": 1320, "code_hash": null, "entity": [["block_size_x", "ot", 4], ["block_size_y", "ot", 64], ["tx", "ot", 2], ["ty", "ot", 4], ["tk", "ot", 32]]}, "result": [[0.0001094299, 0.000102779454], 0, 47.61970257759094, 1634212208.5131013], "version": 0.2, "tvm_version": "0.8.dev0"}
{"input": ["cuda -keys=cuda,gpu -max_num_threads=1024 -thread_warp_size=32", "auto_schedule_thread_fused_matmul", [1, 1225, 384, 224], {}], "config": {"index": 1457, "code_hash": null, "entity": [["block_size_x", "ot", 16], ["block_size_y", "ot", 8], ["tx", "ot", 8], ["ty", "ot", 8], ["tk", "ot", 32]]}, "result": [[0.000271570684, 0.000258514853], 0, 43.57297086715698, 1634212204.4093554], "version": 0.2, "tvm_version": "0.8.dev0"}
{"input": ["cuda -keys=cuda,gpu -max_num_threads=1024 -thread_warp_size=32", "auto_schedule_thread_fused_matmul", [1, 1225, 384, 224], {}], "config": {"index": 592, "code_hash": null, "entity": [["block_size_x", "ot", 16], ["block_size_y", "ot", 32], ["tx", "ot", 16], ["ty", "ot", 4], ["tk", "ot", 8]]}, "result": [[0.000573489021, 0.000554009205], 0, 52.871076345443726, 1634212213.7043517], "version": 0.2, "tvm_version": "0.8.dev0"}
{"input": ["cuda -keys=cuda,gpu -max_num_threads=1024 -thread_warp_size=32", "auto_schedule_thread_fused_matmul", [1, 1225, 384, 224], {}], "config": {"index": 1475, "code_hash": null, "entity": [["block_size_x", "ot", 4], ["block_size_y", "ot", 4], ["tx", "ot", 16], ["ty", "ot", 8], ["tk", "ot", 32]]}, "result": [[0.000262870298, 0.00025263635300000004], 0, 55.04000186920166, 1634212215.9308405], "version": 0.2, "tvm_version": "0.8.dev0"}
{"input": ["cuda -keys=cuda,gpu -max_num_threads=1024 -thread_warp_size=32", "auto_schedule_thread_fused_matmul", [1, 1225, 384, 224], {}], "config": {"index": 1338, "code_hash": null, "entity": [["block_size_x", "ot", 32], ["block_size_y", "ot", 16], ["tx", "ot", 4], ["ty", "ot", 4], ["tk", "ot", 32]]}, "result": [[0.000173226496, 0.000158186489], 0, 60.950016021728516, 1634212221.9116545], "version": 0.2, "tvm_version": "0.8.dev0"}
{"input": ["cuda -keys=cuda,gpu -max_num_threads=1024 -thread_warp_size=32", "auto_schedule_thread_fused_matmul", [1, 1225, 384, 224], {}], "config": {"index": 1450, "code_hash": null, "entity": [["block_size_x", "ot", 4], ["block_size_y", "ot", 4], ["tx", "ot", 8], ["ty", "ot", 8], ["tk", "ot", 32]]}, "result": [[0.000159373771, 0.00014846656200000002], 0, 57.029125690460205, 1634212217.9589043], "version": 0.2, "tvm_version": "0.8.dev0"}
{"input": ["cuda -keys=cuda,gpu -max_num_threads=1024 -thread_warp_size=32", "auto_schedule_thread_fused_matmul", [1, 1225, 384, 224], {}], "config": {"index": 1129, "code_hash": null, "entity": [["block_size_x", "ot", 64], ["block_size_y", "ot", 4], ["tx", "ot", 4], ["ty", "ot", 16], ["tk", "ot", 16]]}, "result": [[0.000396940225, 0.00037051303000000004], 0, 63.580591917037964, 1634212224.4812987], "version": 0.2, "tvm_version": "0.8.dev0"}
{"input": ["cuda -keys=cuda,gpu -max_num_threads=1024 -thread_warp_size=32", "auto_schedule_thread_fused_matmul", [1, 1225, 384, 224], {}], "config": {"index": 1233, "code_hash": null, "entity": [["block_size_x", "ot", 32], ["block_size_y", "ot", 8], ["tx", "ot", 4], ["ty", "ot", 2], ["tk", "ot", 32]]}, "result": [[0.000119898666, 0.000111361197], 0, 58.96913504600525, 1634212219.9377012], "version": 0.2, "tvm_version": "0.8.dev0"}
{"input": ["cuda -keys=cuda,gpu -max_num_threads=1024 -thread_warp_size=32", "auto_schedule_thread_fused_matmul", [1, 1225, 384, 224], {}], "config": {"index": 888, "code_hash": null, "entity": [["block_size_x", "ot", 32], ["block_size_y", "ot", 16], ["tx", "ot", 16], ["ty", "ot", 2], ["tk", "ot", 16]]}, "result": [[0.000348732284, 0.00033078195499999997], 0, 72.3327100276947, 1634212233.3229756], "version": 0.2, "tvm_version": "0.8.dev0"}
{"input": ["cuda -keys=cuda,gpu -max_num_threads=1024 -thread_warp_size=32", "auto_schedule_thread_fused_matmul", [1, 1225, 384, 224], {}], "config": {"index": 596, "code_hash": null, "entity": [["block_size_x", "ot", 8], ["block_size_y", "ot", 64], ["tx", "ot", 16], ["ty", "ot", 4], ["tk", "ot", 8]]}, "result": [[0.000378854261, 0.00036277043099999996], 0, 66.03856134414673, 1634212226.9710736], "version": 0.2, "tvm_version": "0.8.dev0"}
{"input": ["cuda -keys=cuda,gpu -max_num_threads=1024 -thread_warp_size=32", "auto_schedule_thread_fused_matmul", [1, 1225, 384, 224], {}], "config": {"index": 575, "code_hash": null, "entity": [["block_size_x", "ot", 4], ["block_size_y", "ot", 4], ["tx", "ot", 16], ["ty", "ot", 4], ["tk", "ot", 8]]}, "result": [[0.000198304629, 0.000185006275], 0, 68.152583360672, 1634212229.08631], "version": 0.2, "tvm_version": "0.8.dev0"}
{"input": ["cuda -keys=cuda,gpu -max_num_threads=1024 -thread_warp_size=32", "auto_schedule_thread_fused_matmul", [1, 1225, 384, 224], {}], "config": {"index": 115, "code_hash": null, "entity": [["block_size_x", "ot", 4], ["block_size_y", "ot", 32], ["tx", "ot", 2], ["ty", "ot", 4], ["tk", "ot", 4]]}, "result": [[0.000123845213, 0.000119690966], 0, 69.9680380821228, 1634212230.9521477], "version": 0.2, "tvm_version": "0.8.dev0"}
{"input": ["cuda -keys=cuda,gpu -max_num_threads=1024 -thread_warp_size=32", "auto_schedule_thread_fused_matmul", [1, 1225, 384, 224], {}], "config": {"index": 508, "code_hash": null, "entity": [["block_size_x", "ot", 32], ["block_size_y", "ot", 8], ["tx", "ot", 2], ["ty", "ot", 4], ["tk", "ot", 8]]}, "result": [[7.4811003e-05, 7.360944600000001e-05], 0, 1.9564979076385498, 1634212253.5400374], "version": 0.2, "tvm_version": "0.8.dev0"}
{"input": ["cuda -keys=cuda,gpu -max_num_threads=1024 -thread_warp_size=32", "auto_schedule_thread_fused_matmul", [1, 1225, 384, 224], {}], "config": {"index": 1237, "code_hash": null, "entity": [["block_size_x", "ot", 16], ["block_size_y", "ot", 16], ["tx", "ot", 4], ["ty", "ot", 2], ["tk", "ot", 32]]}, "result": [[6.7208218e-05, 6.518111699999999e-05], 0, 11.172730684280396, 1634212262.838042], "version": 0.2, "tvm_version": "0.8.dev0"}
{"input": ["cuda -keys=cuda,gpu -max_num_threads=1024 -thread_warp_size=32", "auto_schedule_thread_fused_matmul", [1, 1225, 384, 224], {}], "config": {"index": 106, "code_hash": null, "entity": [["block_size_x", "ot", 8], ["block_size_y", "ot", 8], ["tx", "ot", 2], ["ty", "ot", 4], ["tk", "ot", 4]]}, "result": [[8.329700300000001e-05, 8.017981000000001e-05], 0, 7.567566394805908, 1634212259.220733], "version": 0.2, "tvm_version": "0.8.dev0"}
{"input": ["cuda -keys=cuda,gpu -max_num_threads=1024 -thread_warp_size=32", "auto_schedule_thread_fused_matmul", [1, 1225, 384, 224], {}], "config": {"index": 35, "code_hash": null, "entity": [["block_size_x", "ot", 4], ["block_size_y", "ot", 16], ["tx", "ot", 4], ["ty", "ot", 2], ["tk", "ot", 4]]}, "result": [[7.676132699999999e-05, 7.5732461e-05], 0, 14.835105657577515, 1634212266.5119352], "version": 0.2, "tvm_version": "0.8.dev0"}
{"input": ["cuda -keys=cuda,gpu -max_num_threads=1024 -thread_warp_size=32", "auto_schedule_thread_fused_matmul", [1, 1225, 384, 224], {}], "config": {"index": 1241, "code_hash": null, "entity": [["block_size_x", "ot", 8], ["block_size_y", "ot", 32], ["tx", "ot", 4], ["ty", "ot", 2], ["tk", "ot", 32]]}, "result": [[8.2057771e-05, 7.811915e-05], 0, 3.7383408546447754, 1634212255.4060466], "version": 0.2, "tvm_version": "0.8.dev0"}
{"input": ["cuda -keys=cuda,gpu -max_num_threads=1024 -thread_warp_size=32", "auto_schedule_thread_fused_matmul", [1, 1225, 384, 224], {}], "config": {"index": 1242, "code_hash": null, "entity": [["block_size_x", "ot", 16], ["block_size_y", "ot", 32], ["tx", "ot", 4], ["ty", "ot", 2], ["tk", "ot", 32]]}, "result": [[7.777951899999999e-05, 7.4008009e-05], 0, 5.653331995010376, 1634212257.292279], "version": 0.2, "tvm_version": "0.8.dev0"}
{"input": ["cuda -keys=cuda,gpu -max_num_threads=1024 -thread_warp_size=32", "auto_schedule_thread_fused_matmul", [1, 1225, 384, 224], {}], "config": {"index": 861, "code_hash": null, "entity": [["block_size_x", "ot", 8], ["block_size_y", "ot", 16], ["tx", "ot", 8], ["ty", "ot", 2], ["tk", "ot", 16]]}, "result": [[0.00010790395100000001, 0.00010398495400000001], 0, 13.059194087982178, 1634212264.6676917], "version": 0.2, "tvm_version": "0.8.dev0"}
{"input": ["cuda -keys=cuda,gpu -max_num_threads=1024 -thread_warp_size=32", "auto_schedule_thread_fused_matmul", [1, 1225, 384, 224], {}], "config": {"index": 1221, "code_hash": null, "entity": [["block_size_x", "ot", 8], ["block_size_y", "ot", 64], ["tx", "ot", 2], ["ty", "ot", 2], ["tk", "ot", 32]]}, "result": [[8.163194599999999e-05, 8.185733999999998e-05], 0, 9.389187097549438, 1634212261.0203638], "version": 0.2, "tvm_version": "0.8.dev0"}
{"input": ["cuda -keys=cuda,gpu -max_num_threads=1024 -thread_warp_size=32", "auto_schedule_thread_fused_matmul", [1, 1225, 384, 224], {}], "config": {"index": 815, "code_hash": null, "entity": [["block_size_x", "ot", 4], ["block_size_y", "ot", 32], ["tx", "ot", 2], ["ty", "ot", 2], ["tk", "ot", 16]]}, "result": [[9.034960899999999e-05, 8.852402700000001e-05], 0, 16.754132986068726, 1634212268.3965652], "version": 0.2, "tvm_version": "0.8.dev0"}
{"input": ["cuda -keys=cuda,gpu -max_num_threads=1024 -thread_warp_size=32", "auto_schedule_thread_fused_matmul", [1, 1225, 384, 224], {}], "config": {"index": 505, "code_hash": null, "entity": [["block_size_x", "ot", 4], ["block_size_y", "ot", 8], ["tx", "ot", 2], ["ty", "ot", 4], ["tk", "ot", 8]]}, "result": [[9.1951187e-05, 8.3408489e-05], 0, 18.61741065979004, 1634212270.299978], "version": 0.2, "tvm_version": "0.8.dev0"}
{"input": ["cuda -keys=cuda,gpu -max_num_threads=1024 -thread_warp_size=32", "auto_schedule_thread_fused_matmul", [1, 1225, 384, 224], {}], "config": {"index": 1215, "code_hash": null, "entity": [["block_size_x", "ot", 4], ["block_size_y", "ot", 32], ["tx", "ot", 2], ["ty", "ot", 2], ["tk", "ot", 32]]}, "result": [[8.6084142e-05, 8.3396911e-05], 0, 20.496949911117554, 1634212272.1768355], "version": 0.2, "tvm_version": "0.8.dev0"}
