python/models/efficientnet/kernel_configs/efficient_fused_depthwise_conv_14_14_672_5_5_s(2, 2).log
{"i": [["[\"fused_depthwise_conv2d\", 14, 14, 672, 5, 5, [2, 2]]", "cuda -keys=cuda,gpu -max_num_threads=1024 -model=unknown -thread_warp_size=32", [-1, 16, 64, 49152, 2147483647, 1024, 8, 32], "", 0, []], [[], [["CI", 8], ["CI", 7], ["CI", 5], ["CHW", 3, "local"], ["SP", 3, 0, 1, [1, 1, 1, 1], 1], ["SP", 3, 5, 7, [7, 1, 1, 1], 1], ["SP", 3, 10, 7, [1, 7, 1, 1], 1], ["SP", 3, 15, 672, [1, 7, 2, 2], 1], ["SP", 3, 20, 5, [5, 1], 1], ["SP", 3, 23, 5, [1, 5], 1], ["RE", 3, [0, 5, 10, 15, 1, 6, 11, 16, 2, 7, 12, 17, 20, 23, 21, 24, 3, 8, 13, 18, 22, 25, 4, 9, 14, 19]], ["FSP", 4, 0, 4, 3], ["FSP", 4, 4, 5, 3], ["FSP", 4, 8, 6, 3], ["FSP", 4, 12, 7, 3], ["RE", 4, [0, 4, 8, 12, 1, 5, 9, 13, 2, 6, 10, 14, 3, 7, 11, 15]], ["CA", 3, 4, 11], ["CHR", 2, "shared", [3]], ["CA", 3, 4, 13], ["CHR", 1, "shared", [4]], ["CA", 2, 5, 13], ["CI", 1], ["FU", 12, [0, 1, 2, 3]], ["SP", 12, 0, 32928, [1], 1], ["AN", 12, 0, 5], ["AN", 12, 1, 6], ["FU", 6, [0, 1, 2, 3]], ["AN", 6, 0, 5], ["FU", 6, [1, 2, 3, 4]], ["AN", 6, 1, 4], ["FU", 6, [2, 3, 4, 5]], ["AN", 6, 2, 6], ["FU", 4, [0, 1, 2, 3]], ["SP", 4, 0, 20, [1], 1], ["AN", 4, 1, 2], ["FFSP", 4, 0, [7, 6, 5, 4], 1, 1], ["AN", 4, 1, 6], ["FU", 2, [0, 1, 2, 3]], ["SP", 2, 0, 20, [20], 1], ["AN", 2, 1, 2], ["FFSP", 2, 0, [7, 6, 5, 4], 1, 1], ["AN", 2, 1, 6], ["PR", 5, 0, "auto_unroll_max_step$1024"]]]], "r": [[4.32253e-05, 4.3227e-05, 4.32264e-05, 4.32258e-05, 4.32292e-05, 4.32265e-05, 4.32257e-05, 4.3226e-05, 4.32226e-05, 4.32229e-05], 0, 56.5962, 1649226610], "v": "v0.6"}
{"i": [["[\"fused_depthwise_conv2d\", 14, 14, 672, 5, 5, [2, 2]]", "cuda -keys=cuda,gpu -max_num_threads=1024 -model=unknown -thread_warp_size=32", [-1, 16, 64, 49152, 2147483647, 1024, 8, 32], "", 0, []], [[], [["CI", 8], ["CI", 7], ["CI", 5], ["CHW", 3, "local"], ["SP", 3, 0, 1, [1, 1, 1, 1], 1], ["SP", 3, 5, 7, [1, 7, 1, 1], 1], ["SP", 3, 10, 7, [1, 1, 7, 1], 1], ["SP", 3, 15, 672, [1, 7, 1, 4], 1], ["SP", 3, 20, 5, [1, 1], 1], ["SP", 3, 23, 5, [1, 1], 1], ["RE", 3, [0, 5, 10, 15, 1, 6, 11, 16, 2, 7, 12, 17, 20, 23, 21, 24, 3, 8, 13, 18, 22, 25, 4, 9, 14, 19]], ["FSP", 4, 0, 4, 3], ["FSP", 4, 4, 5, 3], ["FSP", 4, 8, 6, 3], ["FSP", 4, 12, 7, 3], ["RE", 4, [0, 4, 8, 12, 1, 5, 9, 13, 2, 6, 10, 14, 3, 7, 11, 15]], ["CA", 3, 4, 11], ["CHR", 2, "shared", [3]], ["CA", 3, 4, 13], ["CHR", 1, "shared", [4]], ["CA", 2, 5, 13], ["CI", 1], ["FU", 12, [0, 1, 2, 3]], ["SP", 12, 0, 32928, [32], 1], ["AN", 12, 0, 5], ["AN", 12, 1, 6], ["FU", 6, [0, 1, 2, 3]], ["AN", 6, 0, 5], ["FU", 6, [1, 2, 3, 4]], ["AN", 6, 1, 4], ["FU", 6, [2, 3, 4, 5]], ["AN", 6, 2, 6], ["FU", 4, [0, 1, 2, 3]], ["SP", 4, 0, 20, [2], 1], ["AN", 4, 1, 2], ["FFSP", 4, 0, [7, 6, 5, 4], 1, 1], ["AN", 4, 1, 6], ["FU", 2, [0, 1, 2, 3]], ["SP", 2, 0, 260, [1], 1], ["AN", 2, 1, 2], ["FFSP", 2, 0, [7, 6, 5, 4], 1, 1], ["AN", 2, 1, 6], ["PR", 5, 0, "auto_unroll_max_step$64"]]]], "r": [[0.000676764, 0.000676783, 0.000676777, 0.000676795, 0.000676774, 0.000676739, 0.0006768, 0.000676736, 0.000676768, 0.000676778], 0, 54.77, 1649226616], "v": "v0.6"}
{"i": [["[\"fused_depthwise_conv2d\", 14, 14, 672, 5, 5, [2, 2]]", "cuda -keys=cuda,gpu -max_num_threads=1024 -model=unknown -thread_warp_size=32", [-1, 16, 64, 49152, 2147483647, 1024, 8, 32], "", 0, []], [[], [["CI", 8], ["CI", 7], ["CI", 5], ["CHW", 3, "local"], ["SP", 3, 0, 1, [1, 1, 1, 1], 1], ["SP", 3, 5, 7, [1, 7, 1, 1], 1], ["SP", 3, 10, 7, [1, 1, 1, 7], 1], ["SP", 3, 15, 672, [1, 6, 2, 2], 1], ["SP", 3, 20, 5, [1, 5], 1], ["SP", 3, 23, 5, [1, 5], 1], ["RE", 3, [0, 5, 10, 15, 1, 6, 11, 16, 2, 7, 12, 17, 20, 23, 21, 24, 3, 8, 13, 18, 22, 25, 4, 9, 14, 19]], ["FSP", 4, 0, 4, 3], ["FSP", 4, 4, 5, 3], ["FSP", 4, 8, 6, 3], ["FSP", 4, 12, 7, 3], ["RE", 4, [0, 4, 8, 12, 1, 5, 9, 13, 2, 6, 10, 14, 3, 7, 11, 15]], ["CA", 3, 4, 11], ["CHR", 2, "shared", [3]], ["CA", 3, 4, 13], ["CHR", 1, "shared", [4]], ["CA", 2, 5, 13], ["CI", 1], ["FU", 12, [0, 1, 2, 3]], ["SP", 12, 0, 32928, [32], 1], ["AN", 12, 0, 5], ["AN", 12, 1, 6], ["FU", 6, [0, 1, 2, 3]], ["AN", 6, 0, 5], ["FU", 6, [1, 2, 3, 4]], ["AN", 6, 1, 4], ["FU", 6, [2, 3, 4, 5]], ["AN", 6, 2, 6], ["FU", 4, [0, 1, 2, 3]], ["SP", 4, 0, 20, [1], 1], ["AN", 4, 1, 2], ["FFSP", 4, 0, [7, 6, 5, 4], 1, 1], ["AN", 4, 1, 6], ["FU", 2, [0, 1, 2, 3]], ["SP", 2, 0, 260, [1], 1], ["AN", 2, 1, 2], ["FFSP", 2, 0, [7, 6, 5, 4], 1, 1], ["AN", 2, 1, 6], ["PR", 5, 0, "auto_unroll_max_step$512"]]]], "r": [[1.23304e-05, 1.233e-05, 1.23303e-05, 1.233e-05, 1.23303e-05, 1.233e-05, 1.23306e-05, 1.23304e-05, 1.23303e-05, 1.23303e-05], 0, 20.5752, 1649226578], "v": "v0.6"}
{"i": [["[\"fused_depthwise_conv2d\", 14, 14, 672, 5, 5, [2, 2]]", "cuda -keys=cuda,gpu -max_num_threads=1024 -model=unknown -thread_warp_size=32", [-1, 16, 64, 49152, 2147483647, 1024, 8, 32], "", 0, []], [[], [["CI", 8], ["CI", 7], ["CI", 5], ["CHW", 3, "local"], ["SP", 3, 0, 1, [1, 1, 1, 1], 1], ["SP", 3, 5, 7, [1, 7, 1, 1], 1], ["SP", 3, 10, 7, [1, 1, 1, 7], 1], ["SP", 3, 15, 672, [1, 6, 2, 2], 1], ["SP", 3, 20, 5, [1, 1], 1], ["SP", 3, 23, 5, [1, 5], 1], ["RE", 3, [0, 5, 10, 15, 1, 6, 11, 16, 2, 7, 12, 17, 20, 23, 21, 24, 3, 8, 13, 18, 22, 25, 4, 9, 14, 19]], ["FSP", 4, 0, 4, 3], ["FSP", 4, 4, 5, 3], ["FSP", 4, 8, 6, 3], ["FSP", 4, 12, 7, 3], ["RE", 4, [0, 4, 8, 12, 1, 5, 9, 13, 2, 6, 10, 14, 3, 7, 11, 15]], ["CA", 3, 4, 11], ["CHR", 2, "shared", [3]], ["CA", 3, 4, 13], ["CHR", 1, "shared", [4]], ["CA", 2, 5, 13], ["CI", 1], ["FU", 12, [0, 1, 2, 3]], ["SP", 12, 0, 32928, [32], 1], ["AN", 12, 0, 5], ["AN", 12, 1, 6], ["FU", 6, [0, 1, 2, 3]], ["AN", 6, 0, 5], ["FU", 6, [1, 2, 3, 4]], ["AN", 6, 1, 4], ["FU", 6, [2, 3, 4, 5]], ["AN", 6, 2, 6], ["FU", 4, [0, 1, 2, 3]], ["SP", 4, 0, 20, [1], 1], ["AN", 4, 1, 2], ["FFSP", 4, 0, [7, 6, 5, 4], 1, 1], ["AN", 4, 1, 6], ["FU", 2, [0, 1, 2, 3]], ["SP", 2, 0, 68, [1], 1], ["AN", 2, 1, 2], ["FFSP", 2, 0, [7, 6, 5, 4], 1, 1], ["AN", 2, 1, 6], ["PR", 5, 0, "auto_unroll_max_step$64"]]]], "r": [[0.000168185, 0.000168179, 0.000168192, 0.000168191, 0.000168183, 0.000168193, 0.000168198, 0.000168177, 0.000168198, 0.000168178], 0, 28.1516, 1649226589], "v": "v0.6"}
{"i": [["[\"fused_depthwise_conv2d\", 14, 14, 672, 5, 5, [2, 2]]", "cuda -keys=cuda,gpu -max_num_threads=1024 -model=unknown -thread_warp_size=32", [-1, 16, 64, 49152, 2147483647, 1024, 8, 32], "", 0, []], [[], [["CI", 8], ["CI", 7], ["CI", 5], ["CHW", 3, "local"], ["SP", 3, 0, 1, [1, 1, 1, 1], 1], ["SP", 3, 5, 7, [1, 7, 1, 1], 1], ["SP", 3, 10, 7, [1, 1, 1, 7], 1], ["SP", 3, 15, 672, [1, 6, 7, 1], 1], ["SP", 3, 20, 5, [5, 1], 1], ["SP", 3, 23, 5, [1, 1], 1], ["RE", 3, [0, 5, 10, 15, 1, 6, 11, 16, 2, 7, 12, 17, 20, 23, 21, 24, 3, 8, 13, 18, 22, 25, 4, 9, 14, 19]], ["FSP", 4, 0, 4, 3], ["FSP", 4, 4, 5, 3], ["FSP", 4, 8, 6, 3], ["FSP", 4, 12, 7, 3], ["RE", 4, [0, 4, 8, 12, 1, 5, 9, 13, 2, 6, 10, 14, 3, 7, 11, 15]], ["CA", 3, 4, 11], ["CHR", 2, "shared", [3]], ["CA", 3, 4, 13], ["CHR", 1, "shared", [4]], ["CA", 2, 5, 13], ["CI", 1], ["FU", 12, [0, 1, 2, 3]], ["SP", 12, 0, 32928, [32], 1], ["AN", 12, 0, 5], ["AN", 12, 1, 6], ["FU", 6, [0, 1, 2, 3]], ["AN", 6, 0, 5], ["FU", 6, [1, 2, 3, 4]], ["AN", 6, 1, 4], ["FU", 6, [2, 3, 4, 5]], ["AN", 6, 2, 6], ["FU", 4, [0, 1, 2, 3]], ["SP", 4, 0, 35, [1], 1], ["AN", 4, 1, 2], ["FFSP", 4, 0, [7, 6, 5, 4], 1, 1], ["AN", 4, 1, 6], ["FU", 2, [0, 1, 2, 3]], ["SP", 2, 0, 455, [1], 1], ["AN", 2, 1, 2], ["FFSP", 2, 0, [7, 6, 5, 4], 1, 1], ["AN", 2, 1, 6], ["PR", 5, 0, "auto_unroll_max_step$0"]]]], "r": [[0.00020799, 0.000207992, 0.000208, 0.000207997, 0.000207985, 0.000207979, 0.000207988, 0.000207987, 0.000207985, 0.000207989], 0, 37.8714, 1649226599], "v": "v0.6"}
{"i": [["[\"fused_depthwise_conv2d\", 14, 14, 672, 5, 5, [2, 2]]", "cuda -keys=cuda,gpu -max_num_threads=1024 -model=unknown -thread_warp_size=32", [-1, 16, 64, 49152, 2147483647, 1024, 8, 32], "", 0, []], [[], [["CI", 8], ["CI", 7], ["CI", 5], ["CHW", 3, "local"], ["SP", 3, 0, 1, [1, 1, 1, 1], 1], ["SP", 3, 5, 7, [1, 1, 7, 1], 1], ["SP", 3, 10, 7, [1, 1, 1, 7], 1], ["SP", 3, 15, 672, [2, 16, 1, 1], 1], ["SP", 3, 20, 5, [1, 5], 1], ["SP", 3, 23, 5, [1, 5], 1], ["RE", 3, [0, 5, 10, 15, 1, 6, 11, 16, 2, 7, 12, 17, 20, 23, 21, 24, 3, 8, 13, 18, 22, 25, 4, 9, 14, 19]], ["FSP", 4, 0, 4, 3], ["FSP", 4, 4, 5, 3], ["FSP", 4, 8, 6, 3], ["FSP", 4, 12, 7, 3], ["RE", 4, [0, 4, 8, 12, 1, 5, 9, 13, 2, 6, 10, 14, 3, 7, 11, 15]], ["CA", 3, 4, 11], ["CHR", 2, "shared", [3]], ["CA", 3, 4, 13], ["CHR", 1, "shared", [4]], ["CA", 2, 5, 13], ["CI", 1], ["FU", 12, [0, 1, 2, 3]], ["SP", 12, 0, 32928, [32], 1], ["AN", 12, 0, 5], ["AN", 12, 1, 6], ["FU", 6, [0, 1, 2, 3]], ["AN", 6, 0, 5], ["FU", 6, [1, 2, 3, 4]], ["AN", 6, 1, 4], ["FU", 6, [2, 3, 4, 5]], ["AN", 6, 2, 6], ["FU", 4, [0, 1, 2, 3]], ["SP", 4, 0, 25, [1], 1], ["AN", 4, 1, 2], ["FFSP", 4, 0, [7, 6, 5, 4], 1, 1], ["AN", 4, 1, 6], ["FU", 2, [0, 1, 2, 3]], ["SP", 2, 0, 85, [1], 1], ["AN", 2, 1, 2], ["FFSP", 2, 0, [7, 6, 5, 4], 1, 1], ["AN", 2, 1, 6], ["PR", 5, 0, "auto_unroll_max_step$1024"]]]], "r": [[2.09083e-05, 2.09088e-05, 2.09098e-05, 2.09093e-05, 2.09091e-05, 2.09082e-05, 2.09095e-05, 2.09088e-05, 2.09078e-05, 2.0908e-05], 0, 29.2733, 1649226583], "v": "v0.6"}
{"i": [["[\"fused_depthwise_conv2d\", 14, 14, 672, 5, 5, [2, 2]]", "cuda -keys=cuda,gpu -max_num_threads=1024 -model=unknown -thread_warp_size=32", [-1, 16, 64, 49152, 2147483647, 1024, 8, 32], "", 0, []], [[], [["CI", 8], ["CI", 7], ["CI", 5], ["CHW", 3, "local"], ["SP", 3, 0, 1, [1, 1, 1, 1], 1], ["SP", 3, 5, 7, [1, 1, 7, 1], 1], ["SP", 3, 10, 7, [1, 7, 1, 1], 1], ["SP", 3, 15, 672, [1, 6, 1, 2], 1], ["SP", 3, 20, 5, [5, 1], 1], ["SP", 3, 23, 5, [1, 1], 1], ["RE", 3, [0, 5, 10, 15, 1, 6, 11, 16, 2, 7, 12, 17, 20, 23, 21, 24, 3, 8, 13, 18, 22, 25, 4, 9, 14, 19]], ["FSP", 4, 0, 4, 3], ["FSP", 4, 4, 5, 3], ["FSP", 4, 8, 6, 3], ["FSP", 4, 12, 7, 3], ["RE", 4, [0, 4, 8, 12, 1, 5, 9, 13, 2, 6, 10, 14, 3, 7, 11, 15]], ["CA", 3, 4, 11], ["CHR", 2, "shared", [3]], ["CA", 3, 4, 13], ["CHR", 1, "shared", [4]], ["CA", 2, 5, 13], ["CI", 1], ["FU", 12, [0, 1, 2, 3]], ["SP", 12, 0, 32928, [32], 1], ["AN", 12, 0, 5], ["AN", 12, 1, 6], ["FU", 6, [0, 1, 2, 3]], ["AN", 6, 0, 5], ["FU", 6, [1, 2, 3, 4]], ["AN", 6, 1, 4], ["FU", 6, [2, 3, 4, 5]], ["AN", 6, 2, 6], ["FU", 4, [0, 1, 2, 3]], ["SP", 4, 0, 10, [5], 1], ["AN", 4, 1, 2], ["FFSP", 4, 0, [7, 6, 5, 4], 1, 1], ["AN", 4, 1, 6], ["FU", 2, [0, 1, 2, 3]], ["SP", 2, 0, 34, [1], 1], ["AN", 2, 1, 2], ["FFSP", 2, 0, [7, 6, 5, 4], 1, 1], ["AN", 2, 1, 6], ["PR", 5, 0, "auto_unroll_max_step$512"]]]], "r": [[1.19345e-05, 1.19345e-05, 1.19341e-05, 1.19341e-05, 1.19341e-05, 1.19346e-05, 1.19346e-05, 1.19345e-05, 1.19337e-05, 1.19349e-05], 0, 61.0998, 1649226621], "v": "v0.6"}
{"i": [["[\"fused_depthwise_conv2d\", 14, 14, 672, 5, 5, [2, 2]]", "cuda -keys=cuda,gpu -max_num_threads=1024 -model=unknown -thread_warp_size=32", [-1, 16, 64, 49152, 2147483647, 1024, 8, 32], "", 0, []], [[], [["CI", 8], ["CI", 7], ["CI", 5], ["CHW", 3, "local"], ["SP", 3, 0, 1, [1, 1, 1, 1], 1], ["SP", 3, 5, 7, [7, 1, 1, 1], 1], ["SP", 3, 10, 7, [1, 1, 1, 1], 1], ["SP", 3, 15, 672, [2, 16, 21, 1], 1], ["SP", 3, 20, 5, [1, 1], 1], ["SP", 3, 23, 5, [1, 1], 1], ["RE", 3, [0, 5, 10, 15, 1, 6, 11, 16, 2, 7, 12, 17, 20, 23, 21, 24, 3, 8, 13, 18, 22, 25, 4, 9, 14, 19]], ["FSP", 4, 0, 4, 3], ["FSP", 4, 4, 5, 3], ["FSP", 4, 8, 6, 3], ["FSP", 4, 12, 7, 3], ["RE", 4, [0, 4, 8, 12, 1, 5, 9, 13, 2, 6, 10, 14, 3, 7, 11, 15]], ["CA", 3, 4, 11], ["CHR", 2, "shared", [3]], ["CA", 3, 4, 13], ["CHR", 1, "shared", [4]], ["CA", 2, 5, 13], ["CI", 1], ["FU", 12, [0, 1, 2, 3]], ["SP", 12, 0, 32928, [32], 1], ["AN", 12, 0, 5], ["AN", 12, 1, 6], ["FU", 6, [0, 1, 2, 3]], ["AN", 6, 0, 5], ["FU", 6, [1, 2, 3, 4]], ["AN", 6, 1, 4], ["FU", 6, [2, 3, 4, 5]], ["AN", 6, 2, 6], ["FU", 4, [0, 1, 2, 3]], ["SP", 4, 0, 21, [1], 1], ["AN", 4, 1, 2], ["FFSP", 4, 0, [7, 6, 5, 4], 1, 1], ["AN", 4, 1, 6], ["FU", 2, [0, 1, 2, 3]], ["SP", 2, 0, 21, [7], 1], ["AN", 2, 1, 2], ["FFSP", 2, 0, [7, 6, 5, 4], 1, 1], ["AN", 2, 1, 6], ["PR", 5, 0, "auto_unroll_max_step$64"]]]], "r": [[0.000614324, 0.000614331, 0.000614332, 0.000614369, 0.000614326, 0.000614325, 0.000614325, 0.000614323, 0.000614325, 0.000614336], 0, 44.9671, 1649226605], "v": "v0.6"}
{"i": [["[\"fused_depthwise_conv2d\", 14, 14, 672, 5, 5, [2, 2]]", "cuda -keys=cuda,gpu -max_num_threads=1024 -model=unknown -thread_warp_size=32", [-1, 16, 64, 49152, 2147483647, 1024, 8, 32], "", 0, []], [[], [["CI", 8], ["CI", 7], ["CI", 5], ["CHW", 3, "local"], ["SP", 3, 0, 1, [1, 1, 1, 1], 1], ["SP", 3, 5, 7, [1, 7, 1, 1], 1], ["SP", 3, 10, 7, [1, 1, 1, 1], 1], ["SP", 3, 15, 672, [1, 7, 1, 2], 1], ["SP", 3, 20, 5, [5, 1], 1], ["SP", 3, 23, 5, [5, 1], 1], ["RE", 3, [0, 5, 10, 15, 1, 6, 11, 16, 2, 7, 12, 17, 20, 23, 21, 24, 3, 8, 13, 18, 22, 25, 4, 9, 14, 19]], ["FSP", 4, 0, 4, 3], ["FSP", 4, 4, 5, 3], ["FSP", 4, 8, 6, 3], ["FSP", 4, 12, 7, 3], ["RE", 4, [0, 4, 8, 12, 1, 5, 9, 13, 2, 6, 10, 14, 3, 7, 11, 15]], ["CA", 3, 4, 11], ["CHR", 2, "shared", [3]], ["CA", 3, 4, 13], ["CHR", 1, "shared", [4]], ["CA", 2, 5, 13], ["CI", 1], ["FU", 12, [0, 1, 2, 3]], ["SP", 12, 0, 32928, [32], 1], ["AN", 12, 0, 5], ["AN", 12, 1, 6], ["FU", 6, [0, 1, 2, 3]], ["AN", 6, 0, 5], ["FU", 6, [1, 2, 3, 4]], ["AN", 6, 1, 4], ["FU", 6, [2, 3, 4, 5]], ["AN", 6, 2, 6], ["FU", 4, [0, 1, 2, 3]], ["SP", 4, 0, 50, [10], 1], ["AN", 4, 1, 2], ["FFSP", 4, 0, [7, 6, 5, 4], 1, 1], ["AN", 4, 1, 6], ["FU", 2, [0, 1, 2, 3]], ["SP", 2, 0, 170, [1], 1], ["AN", 2, 1, 2], ["FFSP", 2, 0, [7, 6, 5, 4], 1, 1], ["AN", 2, 1, 6], ["PR", 5, 0, "auto_unroll_max_step$64"]]]], "r": [[1.58e-05, 1.28657e-05, 9.26999e-06, 9.26852e-06, 9.26921e-06, 9.26973e-06, 9.26956e-06, 9.26964e-06, 9.27023e-06, 9.26948e-06], 0, 8.25706, 1649226568], "v": "v0.6"}
{"i": [["[\"fused_depthwise_conv2d\", 14, 14, 672, 5, 5, [2, 2]]", "cuda -keys=cuda,gpu -max_num_threads=1024 -model=unknown -thread_warp_size=32", [-1, 16, 64, 49152, 2147483647, 1024, 8, 32], "", 0, []], [[], [["CI", 8], ["CI", 7], ["CI", 5], ["CHW", 3, "local"], ["SP", 3, 0, 1, [1, 1, 1, 1], 1], ["SP", 3, 5, 7, [7, 1, 1, 1], 1], ["SP", 3, 10, 7, [1, 7, 1, 1], 1], ["SP", 3, 15, 672, [1, 2, 1, 2], 1], ["SP", 3, 20, 5, [1, 1], 1], ["SP", 3, 23, 5, [5, 1], 1], ["RE", 3, [0, 5, 10, 15, 1, 6, 11, 16, 2, 7, 12, 17, 20, 23, 21, 24, 3, 8, 13, 18, 22, 25, 4, 9, 14, 19]], ["FSP", 4, 0, 4, 3], ["FSP", 4, 4, 5, 3], ["FSP", 4, 8, 6, 3], ["FSP", 4, 12, 7, 3], ["RE", 4, [0, 4, 8, 12, 1, 5, 9, 13, 2, 6, 10, 14, 3, 7, 11, 15]], ["CA", 3, 4, 11], ["CHR", 2, "shared", [3]], ["CA", 3, 4, 13], ["CHR", 1, "shared", [4]], ["CA", 2, 5, 13], ["CI", 1], ["FU", 12, [0, 1, 2, 3]], ["SP", 12, 0, 32928, [32], 1], ["AN", 12, 0, 5], ["AN", 12, 1, 6], ["FU", 6, [0, 1, 2, 3]], ["AN", 6, 0, 5], ["FU", 6, [1, 2, 3, 4]], ["AN", 6, 1, 4], ["FU", 6, [2, 3, 4, 5]], ["AN", 6, 2, 6], ["FU", 4, [0, 1, 2, 3]], ["SP", 4, 0, 50, [1], 1], ["AN", 4, 1, 2], ["FFSP", 4, 0, [7, 6, 5, 4], 1, 1], ["AN", 4, 1, 6], ["FU", 2, [0, 1, 2, 3]], ["SP", 2, 0, 50, [50], 1], ["AN", 2, 1, 2], ["FFSP", 2, 0, [7, 6, 5, 4], 1, 1], ["AN", 2, 1, 6], ["PR", 5, 0, "auto_unroll_max_step$0"]]]], "r": [[0.000116644, 0.000116639, 0.000116734, 0.000116644, 0.000116635, 0.000116631, 0.000116639, 0.000116622, 0.000116625, 0.000116627], 0, 12.6986, 1649226573], "v": "v0.6"}
{"i": [["[\"fused_depthwise_conv2d\", 14, 14, 672, 5, 5, [2, 2]]", "cuda -keys=cuda,gpu -max_num_threads=1024 -model=unknown -thread_warp_size=32", [-1, 16, 64, 49152, 2147483647, 1024, 8, 32], "", 0, []], [[], [["CI", 8], ["CI", 7], ["CI", 5], ["CHW", 3, "local"], ["SP", 3, 0, 1, [1, 1, 1, 1], 1], ["SP", 3, 5, 7, [1, 1, 1, 1], 1], ["SP", 3, 10, 7, [1, 1, 1, 1], 1], ["SP", 3, 15, 672, [4, 7, 1, 2], 1], ["SP", 3, 20, 5, [1, 1], 1], ["SP", 3, 23, 5, [1, 1], 1], ["RE", 3, [0, 5, 10, 15, 1, 6, 11, 16, 2, 7, 12, 17, 20, 23, 21, 24, 3, 8, 13, 18, 22, 25, 4, 9, 14, 19]], ["FSP", 4, 0, 4, 3], ["FSP", 4, 4, 5, 3], ["FSP", 4, 8, 6, 3], ["FSP", 4, 12, 7, 3], ["RE", 4, [0, 4, 8, 12, 1, 5, 9, 13, 2, 6, 10, 14, 3, 7, 11, 15]], ["CA", 3, 4, 11], ["CHR", 2, "shared", [3]], ["CA", 3, 4, 13], ["CHR", 1, "shared", [4]], ["CA", 2, 5, 13], ["CI", 1], ["FU", 12, [0, 1, 2, 3]], ["SP", 12, 0, 32928, [32], 1], ["AN", 12, 0, 5], ["AN", 12, 1, 6], ["FU", 6, [0, 1, 2, 3]], ["AN", 6, 0, 5], ["FU", 6, [1, 2, 3, 4]], ["AN", 6, 1, 4], ["FU", 6, [2, 3, 4, 5]], ["AN", 6, 2, 6], ["FU", 4, [0, 1, 2, 3]], ["SP", 4, 0, 2, [1], 1], ["AN", 4, 1, 2], ["FFSP", 4, 0, [7, 6, 5, 4], 1, 1], ["AN", 4, 1, 6], ["FU", 2, [0, 1, 2, 3]], ["SP", 2, 0, 2, [2], 1], ["AN", 2, 1, 2], ["FFSP", 2, 0, [7, 6, 5, 4], 1, 1], ["AN", 2, 1, 6], ["PR", 5, 0, "auto_unroll_max_step$64"]]]], "r": [[1.36451e-05, 1.36448e-05, 1.36443e-05, 1.36438e-05, 1.36441e-05, 1.36422e-05, 1.36431e-05, 1.36432e-05, 1.36441e-05, 1.36427e-05], 0, 69.7725, 1649226631], "v": "v0.6"}
{"i": [["[\"fused_depthwise_conv2d\", 14, 14, 672, 5, 5, [2, 2]]", "cuda -keys=cuda,gpu -max_num_threads=1024 -model=unknown -thread_warp_size=32", [-1, 16, 64, 49152, 2147483647, 1024, 8, 32], "", 0, []], [[], [["CI", 8], ["CI", 7], ["CI", 5], ["CHW", 3, "local"], ["SP", 3, 0, 1, [1, 1, 1, 1], 1], ["SP", 3, 5, 7, [1, 1, 1, 1], 1], ["SP", 3, 10, 7, [1, 7, 1, 1], 1], ["SP", 3, 15, 672, [7, 12, 1, 1], 1], ["SP", 3, 20, 5, [1, 1], 1], ["SP", 3, 23, 5, [1, 5], 1], ["RE", 3, [0, 5, 10, 15, 1, 6, 11, 16, 2, 7, 12, 17, 20, 23, 21, 24, 3, 8, 13, 18, 22, 25, 4, 9, 14, 19]], ["FSP", 4, 0, 4, 3], ["FSP", 4, 4, 5, 3], ["FSP", 4, 8, 6, 3], ["FSP", 4, 12, 7, 3], ["RE", 4, [0, 4, 8, 12, 1, 5, 9, 13, 2, 6, 10, 14, 3, 7, 11, 15]], ["CA", 3, 4, 11], ["CHR", 2, "shared", [3]], ["CA", 3, 4, 13], ["CHR", 1, "shared", [4]], ["CA", 2, 5, 13], ["CI", 1], ["FU", 12, [0, 1, 2, 3]], ["SP", 12, 0, 32928, [32], 1], ["AN", 12, 0, 5], ["AN", 12, 1, 6], ["FU", 6, [0, 1, 2, 3]], ["AN", 6, 0, 5], ["FU", 6, [1, 2, 3, 4]], ["AN", 6, 1, 4], ["FU", 6, [2, 3, 4, 5]], ["AN", 6, 2, 6], ["FU", 4, [0, 1, 2, 3]], ["SP", 4, 0, 5, [1], 1], ["AN", 4, 1, 2], ["FFSP", 4, 0, [7, 6, 5, 4], 1, 1], ["AN", 4, 1, 6], ["FU", 2, [0, 1, 2, 3]], ["SP", 2, 0, 5, [1], 1], ["AN", 2, 1, 2], ["FFSP", 2, 0, [7, 6, 5, 4], 1, 1], ["AN", 2, 1, 6], ["PR", 5, 0, "auto_unroll_max_step$512"]]]], "r": [[1.08195e-05, 1.08195e-05, 1.08186e-05, 1.08184e-05, 1.08185e-05, 1.08175e-05, 1.08177e-05, 1.08177e-05, 1.08176e-05, 1.08176e-05], 0, 33.2604, 1649226593], "v": "v0.6"}
{"i": [["[\"fused_depthwise_conv2d\", 14, 14, 672, 5, 5, [2, 2]]", "cuda -keys=cuda,gpu -max_num_threads=1024 -model=unknown -thread_warp_size=32", [-1, 16, 64, 49152, 2147483647, 1024, 8, 32], "", 0, []], [[], [["CI", 8], ["CI", 7], ["CI", 5], ["CHW", 3, "local"], ["SP", 3, 0, 1, [1, 1, 1, 1], 1], ["SP", 3, 5, 7, [1, 7, 1, 1], 1], ["SP", 3, 10, 7, [1, 1, 7, 1], 1], ["SP", 3, 15, 672, [1, 6, 2, 2], 1], ["SP", 3, 20, 5, [1, 5], 1], ["SP", 3, 23, 5, [5, 1], 1], ["RE", 3, [0, 5, 10, 15, 1, 6, 11, 16, 2, 7, 12, 17, 20, 23, 21, 24, 3, 8, 13, 18, 22, 25, 4, 9, 14, 19]], ["FSP", 4, 0, 4, 3], ["FSP", 4, 4, 5, 3], ["FSP", 4, 8, 6, 3], ["FSP", 4, 12, 7, 3], ["RE", 4, [0, 4, 8, 12, 1, 5, 9, 13, 2, 6, 10, 14, 3, 7, 11, 15]], ["CA", 3, 4, 11], ["CHR", 2, "shared", [3]], ["CA", 3, 4, 13], ["CHR", 1, "shared", [4]], ["CA", 2, 5, 13], ["CI", 1], ["FU", 12, [0, 1, 2, 3]], ["SP", 12, 0, 32928, [16], 1], ["AN", 12, 0, 5], ["AN", 12, 1, 6], ["FU", 6, [0, 1, 2, 3]], ["AN", 6, 0, 5], ["FU", 6, [1, 2, 3, 4]], ["AN", 6, 1, 4], ["FU", 6, [2, 3, 4, 5]], ["AN", 6, 2, 6], ["FU", 4, [0, 1, 2, 3]], ["SP", 4, 0, 20, [1], 1], ["AN", 4, 1, 2], ["FFSP", 4, 0, [7, 6, 5, 4], 1, 1], ["AN", 4, 1, 6], ["FU", 2, [0, 1, 2, 3]], ["SP", 2, 0, 68, [34], 1], ["AN", 2, 1, 2], ["FFSP", 2, 0, [7, 6, 5, 4], 1, 1], ["AN", 2, 1, 6], ["PR", 5, 0, "auto_unroll_max_step$512"]]]], "r": [[2.49663e-05, 2.49661e-05, 2.49659e-05, 2.49655e-05, 2.49665e-05, 2.49655e-05, 2.49662e-05, 2.49667e-05, 2.49658e-05, 2.49658e-05], 0, 70.1387, 1649226626], "v": "v0.6"}
{"i": [["[\"fused_depthwise_conv2d\", 14, 14, 672, 5, 5, [2, 2]]", "cuda -keys=cuda,gpu -max_num_threads=1024 -model=unknown -thread_warp_size=32", [-1, 16, 64, 49152, 2147483647, 1024, 8, 32], "", 0, []], [[], [["CI", 8], ["CI", 7], ["CI", 5], ["CHW", 3, "local"], ["SP", 3, 0, 1, [1, 1, 1, 1], 1], ["SP", 3, 5, 7, [1, 7, 1, 1], 1], ["SP", 3, 10, 7, [7, 1, 1, 1], 1], ["SP", 3, 15, 672, [1, 8, 1, 1], 1], ["SP", 3, 20, 5, [1, 5], 1], ["SP", 3, 23, 5, [5, 1], 1], ["RE", 3, [0, 5, 10, 15, 1, 6, 11, 16, 2, 7, 12, 17, 20, 23, 21, 24, 3, 8, 13, 18, 22, 25, 4, 9, 14, 19]], ["FSP", 4, 0, 4, 3], ["FSP", 4, 4, 5, 3], ["FSP", 4, 8, 6, 3], ["FSP", 4, 12, 7, 3], ["RE", 4, [0, 4, 8, 12, 1, 5, 9, 13, 2, 6, 10, 14, 3, 7, 11, 15]], ["CA", 3, 4, 11], ["CHR", 2, "shared", [3]], ["CA", 3, 4, 13], ["CHR", 1, "shared", [4]], ["CA", 2, 5, 13], ["CI", 1], ["FU", 12, [0, 1, 2, 3]], ["SP", 12, 0, 32928, [32], 1], ["AN", 12, 0, 5], ["AN", 12, 1, 6], ["FU", 6, [0, 1, 2, 3]], ["AN", 6, 0, 5], ["FU", 6, [1, 2, 3, 4]], ["AN", 6, 1, 4], ["FU", 6, [2, 3, 4, 5]], ["AN", 6, 2, 6], ["FU", 4, [0, 1, 2, 3]], ["SP", 4, 0, 25, [1], 1], ["AN", 4, 1, 2], ["FFSP", 4, 0, [7, 6, 5, 4], 1, 1], ["AN", 4, 1, 6], ["FU", 2, [0, 1, 2, 3]], ["SP", 2, 0, 25, [1], 1], ["AN", 2, 1, 2], ["FFSP", 2, 0, [7, 6, 5, 4], 1, 1], ["AN", 2, 1, 6], ["PR", 5, 0, "auto_unroll_max_step$64"]]]], "r": [[7.96205e-06, 7.96452e-06, 7.96149e-06, 7.96282e-06, 7.96247e-06, 7.95952e-06, 7.96115e-06, 7.96371e-06, 7.96452e-06, 7.96124e-06], 0, 74.6614, 1649226635], "v": "v0.6"}
{"i": [["[\"fused_depthwise_conv2d\", 14, 14, 672, 5, 5, [2, 2]]", "cuda -keys=cuda,gpu -max_num_threads=1024 -model=unknown -thread_warp_size=32", [-1, 16, 64, 49152, 2147483647, 1024, 8, 32], "", 0, []], [[], [["CI", 8], ["CI", 7], ["CI", 5], ["CHW", 3, "local"], ["SP", 3, 0, 1, [1, 1, 1, 1], 1], ["SP", 3, 5, 7, [1, 1, 1, 7], 1], ["SP", 3, 10, 7, [1, 7, 1, 1], 1], ["SP", 3, 15, 672, [1, 7, 2, 2], 1], ["SP", 3, 20, 5, [1, 5], 1], ["SP", 3, 23, 5, [1, 5], 1], ["RE", 3, [0, 5, 10, 15, 1, 6, 11, 16, 2, 7, 12, 17, 20, 23, 21, 24, 3, 8, 13, 18, 22, 25, 4, 9, 14, 19]], ["FSP", 4, 0, 4, 3], ["FSP", 4, 4, 5, 3], ["FSP", 4, 8, 6, 3], ["FSP", 4, 12, 7, 3], ["RE", 4, [0, 4, 8, 12, 1, 5, 9, 13, 2, 6, 10, 14, 3, 7, 11, 15]], ["CA", 3, 4, 11], ["CHR", 2, "shared", [3]], ["CA", 3, 4, 13], ["CHR", 1, "shared", [4]], ["CA", 2, 5, 13], ["CI", 1], ["FU", 12, [0, 1, 2, 3]], ["SP", 12, 0, 32928, [32], 1], ["AN", 12, 0, 5], ["AN", 12, 1, 6], ["FU", 6, [0, 1, 2, 3]], ["AN", 6, 0, 5], ["FU", 6, [1, 2, 3, 4]], ["AN", 6, 1, 4], ["FU", 6, [2, 3, 4, 5]], ["AN", 6, 2, 6], ["FU", 4, [0, 1, 2, 3]], ["SP", 4, 0, 20, [1], 1], ["AN", 4, 1, 2], ["FFSP", 4, 0, [7, 6, 5, 4], 1, 1], ["AN", 4, 1, 6], ["FU", 2, [0, 1, 2, 3]], ["SP", 2, 0, 20, [4], 1], ["AN", 2, 1, 2], ["FFSP", 2, 0, [7, 6, 5, 4], 1, 1], ["AN", 2, 1, 6], ["PR", 5, 0, "auto_unroll_max_step$1024"]]]], "r": [[1.243e-05, 1.24318e-05, 1.24291e-05, 1.24305e-05, 1.24291e-05, 1.24307e-05, 1.2428e-05, 1.2428e-05, 1.24282e-05, 1.24302e-05], 0, 83.367, 1649226640], "v": "v0.6"}
{"i": [["[\"fused_depthwise_conv2d\", 14, 14, 672, 5, 5, [2, 2]]", "cuda -keys=cuda,gpu -max_num_threads=1024 -model=unknown -thread_warp_size=32", [-1, 16, 64, 49152, 2147483647, 1024, 8, 32], "", 0, []], [[], [["CI", 8], ["CI", 7], ["CI", 5], ["CHW", 3, "local"], ["SP", 3, 0, 1, [1, 1, 1, 1], 1], ["SP", 3, 5, 7, [1, 7, 1, 1], 1], ["SP", 3, 10, 7, [1, 1, 1, 7], 1], ["SP", 3, 15, 672, [1, 8, 1, 4], 1], ["SP", 3, 20, 5, [5, 1], 1], ["SP", 3, 23, 5, [5, 1], 1], ["RE", 3, [0, 5, 10, 15, 1, 6, 11, 16, 2, 7, 12, 17, 20, 23, 21, 24, 3, 8, 13, 18, 22, 25, 4, 9, 14, 19]], ["FSP", 4, 0, 4, 3], ["FSP", 4, 4, 5, 3], ["FSP", 4, 8, 6, 3], ["FSP", 4, 12, 7, 3], ["RE", 4, [0, 4, 8, 12, 1, 5, 9, 13, 2, 6, 10, 14, 3, 7, 11, 15]], ["CA", 3, 4, 11], ["CHR", 2, "shared", [3]], ["CA", 3, 4, 13], ["CHR", 1, "shared", [4]], ["CA", 2, 5, 13], ["CI", 1], ["FU", 12, [0, 1, 2, 3]], ["SP", 12, 0, 32928, [32], 1], ["AN", 12, 0, 5], ["AN", 12, 1, 6], ["FU", 6, [0, 1, 2, 3]], ["AN", 6, 0, 5], ["FU", 6, [1, 2, 3, 4]], ["AN", 6, 1, 4], ["FU", 6, [2, 3, 4, 5]], ["AN", 6, 2, 6], ["FU", 4, [0, 1, 2, 3]], ["SP", 4, 0, 20, [1], 1], ["AN", 4, 1, 2], ["FFSP", 4, 0, [7, 6, 5, 4], 1, 1], ["AN", 4, 1, 6], ["FU", 2, [0, 1, 2, 3]], ["SP", 2, 0, 260, [1], 1], ["AN", 2, 1, 2], ["FFSP", 2, 0, [7, 6, 5, 4], 1, 1], ["AN", 2, 1, 6], ["PR", 5, 0, "auto_unroll_max_step$512"]]]], "r": [[1.05698e-05, 1.05696e-05, 1.05694e-05, 1.05689e-05, 1.05701e-05, 1.05698e-05, 1.05697e-05, 1.05702e-05, 1.05702e-05, 1.05695e-05], 0, 85.1675, 1649226644], "v": "v0.6"}
{"i": [["[\"fused_depthwise_conv2d\", 14, 14, 672, 5, 5, [2, 2]]", "cuda -keys=cuda,gpu -max_num_threads=1024 -model=unknown -thread_warp_size=32", [-1, 16, 64, 49152, 2147483647, 1024, 8, 32], "", 0, []], [[], [["CI", 8], ["CI", 7], ["CI", 5], ["CHW", 3, "local"], ["SP", 3, 0, 1, [1, 1, 1, 1], 1], ["SP", 3, 5, 7, [1, 1, 1, 1], 1], ["SP", 3, 10, 7, [7, 1, 1, 1], 1], ["SP", 3, 15, 672, [1, 168, 2, 2], 1], ["SP", 3, 20, 5, [1, 1], 1], ["SP", 3, 23, 5, [1, 1], 1], ["RE", 3, [0, 5, 10, 15, 1, 6, 11, 16, 2, 7, 12, 17, 20, 23, 21, 24, 3, 8, 13, 18, 22, 25, 4, 9, 14, 19]], ["FSP", 4, 0, 4, 3], ["FSP", 4, 4, 5, 3], ["FSP", 4, 8, 6, 3], ["FSP", 4, 12, 7, 3], ["RE", 4, [0, 4, 8, 12, 1, 5, 9, 13, 2, 6, 10, 14, 3, 7, 11, 15]], ["CA", 3, 4, 11], ["CHR", 2, "shared", [3]], ["CA", 3, 4, 13], ["CHR", 1, "shared", [4]], ["CA", 2, 5, 13], ["CI", 1], ["FU", 12, [0, 1, 2, 3]], ["SP", 12, 0, 32928, [32], 1], ["AN", 12, 0, 5], ["AN", 12, 1, 6], ["FU", 6, [0, 1, 2, 3]], ["AN", 6, 0, 5], ["FU", 6, [1, 2, 3, 4]], ["AN", 6, 1, 4], ["FU", 6, [2, 3, 4, 5]], ["AN", 6, 2, 6], ["FU", 4, [0, 1, 2, 3]], ["SP", 4, 0, 84, [1], 1], ["AN", 4, 1, 2], ["FFSP", 4, 0, [7, 6, 5, 4], 1, 1], ["AN", 4, 1, 6], ["FU", 2, [0, 1, 2, 3]], ["SP", 2, 0, 84, [3], 1], ["AN", 2, 1, 2], ["FFSP", 2, 0, [7, 6, 5, 4], 1, 1], ["AN", 2, 1, 6], ["PR", 5, 0, "auto_unroll_max_step$64"]]]], "r": [[4.39466e-05, 4.39421e-05, 4.39388e-05, 4.39428e-05, 4.39415e-05, 4.3943e-05, 4.3936e-05, 4.39433e-05, 4.39389e-05, 4.39399e-05], 0, 100.142, 1649226660], "v": "v0.6"}
{"i": [["[\"fused_depthwise_conv2d\", 14, 14, 672, 5, 5, [2, 2]]", "cuda -keys=cuda,gpu -max_num_threads=1024 -model=unknown -thread_warp_size=32", [-1, 16, 64, 49152, 2147483647, 1024, 8, 32], "", 0, []], [[], [["CI", 8], ["CI", 7], ["CI", 5], ["CHW", 3, "local"], ["SP", 3, 0, 1, [1, 1, 1, 1], 1], ["SP", 3, 5, 7, [1, 1, 1, 1], 1], ["SP", 3, 10, 7, [7, 1, 1, 1], 1], ["SP", 3, 15, 672, [1, 24, 1, 2], 1], ["SP", 3, 20, 5, [5, 1], 1], ["SP", 3, 23, 5, [1, 1], 1], ["RE", 3, [0, 5, 10, 15, 1, 6, 11, 16, 2, 7, 12, 17, 20, 23, 21, 24, 3, 8, 13, 18, 22, 25, 4, 9, 14, 19]], ["FSP", 4, 0, 4, 3], ["FSP", 4, 4, 5, 3], ["FSP", 4, 8, 6, 3], ["FSP", 4, 12, 7, 3], ["RE", 4, [0, 4, 8, 12, 1, 5, 9, 13, 2, 6, 10, 14, 3, 7, 11, 15]], ["CA", 3, 4, 11], ["CHR", 2, "shared", [3]], ["CA", 3, 4, 13], ["CHR", 1, "shared", [4]], ["CA", 2, 5, 13], ["CI", 1], ["FU", 12, [0, 1, 2, 3]], ["SP", 12, 0, 32928, [32], 1], ["AN", 12, 0, 5], ["AN", 12, 1, 6], ["FU", 6, [0, 1, 2, 3]], ["AN", 6, 0, 5], ["FU", 6, [1, 2, 3, 4]], ["AN", 6, 1, 4], ["FU", 6, [2, 3, 4, 5]], ["AN", 6, 2, 6], ["FU", 4, [0, 1, 2, 3]], ["SP", 4, 0, 2, [2], 1], ["AN", 4, 1, 2], ["FFSP", 4, 0, [7, 6, 5, 4], 1, 1], ["AN", 4, 1, 6], ["FU", 2, [0, 1, 2, 3]], ["SP", 2, 0, 2, [1], 1], ["AN", 2, 1, 2], ["FFSP", 2, 0, [7, 6, 5, 4], 1, 1], ["AN", 2, 1, 6], ["PR", 5, 0, "auto_unroll_max_step$1024"]]]], "r": [[2.84714e-05, 2.84712e-05, 2.84672e-05, 2.84738e-05, 2.84731e-05, 2.8473e-05, 2.84707e-05, 2.84702e-05, 2.84742e-05, 2.8475e-05], 0, 118.904, 1649226678], "v": "v0.6"}
{"i": [["[\"fused_depthwise_conv2d\", 14, 14, 672, 5, 5, [2, 2]]", "cuda -keys=cuda,gpu -max_num_threads=1024 -model=unknown -thread_warp_size=32", [-1, 16, 64, 49152, 2147483647, 1024, 8, 32], "", 0, []], [[], [["CI", 8], ["CI", 7], ["CI", 5], ["CHW", 3, "local"], ["SP", 3, 0, 1, [1, 1, 1, 1], 1], ["SP", 3, 5, 7, [1, 1, 1, 1], 1], ["SP", 3, 10, 7, [1, 1, 1, 1], 1], ["SP", 3, 15, 672, [1, 112, 1, 6], 1], ["SP", 3, 20, 5, [1, 5], 1], ["SP", 3, 23, 5, [1, 1], 1], ["RE", 3, [0, 5, 10, 15, 1, 6, 11, 16, 2, 7, 12, 17, 20, 23, 21, 24, 3, 8, 13, 18, 22, 25, 4, 9, 14, 19]], ["FSP", 4, 0, 4, 3], ["FSP", 4, 4, 5, 3], ["FSP", 4, 8, 6, 3], ["FSP", 4, 12, 7, 3], ["RE", 4, [0, 4, 8, 12, 1, 5, 9, 13, 2, 6, 10, 14, 3, 7, 11, 15]], ["CA", 3, 4, 11], ["CHR", 2, "shared", [3]], ["CA", 3, 4, 13], ["CHR", 1, "shared", [4]], ["CA", 2, 5, 13], ["CI", 1], ["FU", 12, [0, 1, 2, 3]], ["SP", 12, 0, 32928, [1], 1], ["AN", 12, 0, 5], ["AN", 12, 1, 6], ["FU", 6, [0, 1, 2, 3]], ["AN", 6, 0, 5], ["FU", 6, [1, 2, 3, 4]], ["AN", 6, 1, 4], ["FU", 6, [2, 3, 4, 5]], ["AN", 6, 2, 6], ["FU", 4, [0, 1, 2, 3]], ["SP", 4, 0, 6, [1], 1], ["AN", 4, 1, 2], ["FFSP", 4, 0, [7, 6, 5, 4], 1, 1], ["AN", 4, 1, 6], ["FU", 2, [0, 1, 2, 3]], ["SP", 2, 0, 78, [1], 1], ["AN", 2, 1, 2], ["FFSP", 2, 0, [7, 6, 5, 4], 1, 1], ["AN", 2, 1, 6], ["PR", 5, 0, "auto_unroll_max_step$512"]]]], "r": [[3.71779e-05, 3.71781e-05, 3.71795e-05, 3.71796e-05, 3.71786e-05, 3.71786e-05, 3.71826e-05, 3.71835e-05, 3.71812e-05, 3.71786e-05], 0, 95.6273, 1649226655], "v": "v0.6"}
{"i": [["[\"fused_depthwise_conv2d\", 14, 14, 672, 5, 5, [2, 2]]", "cuda -keys=cuda,gpu -max_num_threads=1024 -model=unknown -thread_warp_size=32", [-1, 16, 64, 49152, 2147483647, 1024, 8, 32], "", 0, []], [[], [["CI", 8], ["CI", 7], ["CI", 5], ["CHW", 3, "local"], ["SP", 3, 0, 1, [1, 1, 1, 1], 1], ["SP", 3, 5, 7, [1, 7, 1, 1], 1], ["SP", 3, 10, 7, [1, 1, 1, 1], 1], ["SP", 3, 15, 672, [7, 16, 1, 2], 1], ["SP", 3, 20, 5, [1, 1], 1], ["SP", 3, 23, 5, [1, 1], 1], ["RE", 3, [0, 5, 10, 15, 1, 6, 11, 16, 2, 7, 12, 17, 20, 23, 21, 24, 3, 8, 13, 18, 22, 25, 4, 9, 14, 19]], ["FSP", 4, 0, 4, 3], ["FSP", 4, 4, 5, 3], ["FSP", 4, 8, 6, 3], ["FSP", 4, 12, 7, 3], ["RE", 4, [0, 4, 8, 12, 1, 5, 9, 13, 2, 6, 10, 14, 3, 7, 11, 15]], ["CA", 3, 4, 11], ["CHR", 2, "shared", [3]], ["CA", 3, 4, 13], ["CHR", 1, "shared", [4]], ["CA", 2, 5, 13], ["CI", 1], ["FU", 12, [0, 1, 2, 3]], ["SP", 12, 0, 32928, [32], 1], ["AN", 12, 0, 5], ["AN", 12, 1, 6], ["FU", 6, [0, 1, 2, 3]], ["AN", 6, 0, 5], ["FU", 6, [1, 2, 3, 4]], ["AN", 6, 1, 4], ["FU", 6, [2, 3, 4, 5]], ["AN", 6, 2, 6], ["FU", 4, [0, 1, 2, 3]], ["SP", 4, 0, 14, [7], 1], ["AN", 4, 1, 2], ["FFSP", 4, 0, [7, 6, 5, 4], 1, 1], ["AN", 4, 1, 6], ["FU", 2, [0, 1, 2, 3]], ["SP", 2, 0, 14, [1], 1], ["AN", 2, 1, 2], ["FFSP", 2, 0, [7, 6, 5, 4], 1, 1], ["AN", 2, 1, 6], ["PR", 5, 0, "auto_unroll_max_step$64"]]]], "r": [[3.63157e-05, 3.63125e-05, 3.63142e-05, 3.63142e-05, 3.63118e-05, 3.63145e-05, 3.63144e-05, 3.6314e-05, 3.63126e-05, 3.63144e-05], 0, 89.038, 1649226650], "v": "v0.6"}
{"i": [["[\"fused_depthwise_conv2d\", 14, 14, 672, 5, 5, [2, 2]]", "cuda -keys=cuda,gpu -max_num_threads=1024 -model=unknown -thread_warp_size=32", [-1, 16, 64, 49152, 2147483647, 1024, 8, 32], "", 0, []], [[], [["CI", 8], ["CI", 7], ["CI", 5], ["CHW", 3, "local"], ["SP", 3, 0, 1, [1, 1, 1, 1], 1], ["SP", 3, 5, 7, [1, 7, 1, 1], 1], ["SP", 3, 10, 7, [1, 1, 1, 1], 1], ["SP", 3, 15, 672, [1, 1, 42, 1], 1], ["SP", 3, 20, 5, [1, 5], 1], ["SP", 3, 23, 5, [1, 1], 1], ["RE", 3, [0, 5, 10, 15, 1, 6, 11, 16, 2, 7, 12, 17, 20, 23, 21, 24, 3, 8, 13, 18, 22, 25, 4, 9, 14, 19]], ["FSP", 4, 0, 4, 3], ["FSP", 4, 4, 5, 3], ["FSP", 4, 8, 6, 3], ["FSP", 4, 12, 7, 3], ["RE", 4, [0, 4, 8, 12, 1, 5, 9, 13, 2, 6, 10, 14, 3, 7, 11, 15]], ["CA", 3, 4, 11], ["CHR", 2, "shared", [3]], ["CA", 3, 4, 13], ["CHR", 1, "shared", [4]], ["CA", 2, 5, 13], ["CI", 1], ["FU", 12, [0, 1, 2, 3]], ["SP", 12, 0, 32928, [32], 1], ["AN", 12, 0, 5], ["AN", 12, 1, 6], ["FU", 6, [0, 1, 2, 3]], ["AN", 6, 0, 5], ["FU", 6, [1, 2, 3, 4]], ["AN", 6, 1, 4], ["FU", 6, [2, 3, 4, 5]], ["AN", 6, 2, 6], ["FU", 4, [0, 1, 2, 3]], ["SP", 4, 0, 210, [7], 1], ["AN", 4, 1, 2], ["FFSP", 4, 0, [7, 6, 5, 4], 1, 1], ["AN", 4, 1, 6], ["FU", 2, [0, 1, 2, 3]], ["SP", 2, 0, 210, [1], 1], ["AN", 2, 1, 2], ["FFSP", 2, 0, [7, 6, 5, 4], 1, 1], ["AN", 2, 1, 6], ["PR", 5, 0, "auto_unroll_max_step$64"]]]], "r": [[6.45659e-05, 6.45682e-05, 6.45674e-05, 6.4572e-05, 6.45679e-05, 6.45685e-05, 6.45668e-05, 6.4567e-05, 6.45663e-05, 6.45671e-05], 0, 104.86, 1649226666], "v": "v0.6"}
{"i": [["[\"fused_depthwise_conv2d\", 14, 14, 672, 5, 5, [2, 2]]", "cuda -keys=cuda,gpu -max_num_threads=1024 -model=unknown -thread_warp_size=32", [-1, 16, 64, 49152, 2147483647, 1024, 8, 32], "", 0, []], [[], [["CI", 8], ["CI", 7], ["CI", 5], ["CHW", 3, "local"], ["SP", 3, 0, 1, [1, 1, 1, 1], 1], ["SP", 3, 5, 7, [1, 1, 1, 1], 1], ["SP", 3, 10, 7, [1, 7, 1, 1], 1], ["SP", 3, 15, 672, [7, 12, 1, 1], 1], ["SP", 3, 20, 5, [1, 1], 1], ["SP", 3, 23, 5, [1, 5], 1], ["RE", 3, [0, 5, 10, 15, 1, 6, 11, 16, 2, 7, 12, 17, 20, 23, 21, 24, 3, 8, 13, 18, 22, 25, 4, 9, 14, 19]], ["FSP", 4, 0, 4, 3], ["FSP", 4, 4, 5, 3], ["FSP", 4, 8, 6, 3], ["FSP", 4, 12, 7, 3], ["RE", 4, [0, 4, 8, 12, 1, 5, 9, 13, 2, 6, 10, 14, 3, 7, 11, 15]], ["CA", 3, 4, 11], ["CHR", 2, "shared", [3]], ["CA", 3, 4, 13], ["CHR", 1, "shared", [4]], ["CA", 2, 5, 13], ["CI", 1], ["FU", 12, [0, 1, 2, 3]], ["SP", 12, 0, 32928, [8], 1], ["AN", 12, 0, 5], ["AN", 12, 1, 6], ["FU", 6, [0, 1, 2, 3]], ["AN", 6, 0, 5], ["FU", 6, [1, 2, 3, 4]], ["AN", 6, 1, 4], ["FU", 6, [2, 3, 4, 5]], ["AN", 6, 2, 6], ["FU", 4, [0, 1, 2, 3]], ["SP", 4, 0, 5, [1], 1], ["AN", 4, 1, 2], ["FFSP", 4, 0, [7, 6, 5, 4], 1, 1], ["AN", 4, 1, 6], ["FU", 2, [0, 1, 2, 3]], ["SP", 2, 0, 5, [1], 1], ["AN", 2, 1, 2], ["FFSP", 2, 0, [7, 6, 5, 4], 1, 1], ["AN", 2, 1, 6], ["PR", 5, 0, "auto_unroll_max_step$512"]]]], "r": [[1.31871e-05, 1.31878e-05, 1.31873e-05, 1.31873e-05, 1.31863e-05, 1.31872e-05, 1.31868e-05, 1.31869e-05, 1.31868e-05, 1.31869e-05], 0, 121.321, 1649226682], "v": "v0.6"}
{"i": [["[\"fused_depthwise_conv2d\", 14, 14, 672, 5, 5, [2, 2]]", "cuda -keys=cuda,gpu -max_num_threads=1024 -model=unknown -thread_warp_size=32", [-1, 16, 64, 49152, 2147483647, 1024, 8, 32], "", 0, []], [[], [["CI", 8], ["CI", 7], ["CI", 5], ["CHW", 3, "local"], ["SP", 3, 0, 1, [1, 1, 1, 1], 1], ["SP", 3, 5, 7, [1, 1, 1, 7], 1], ["SP", 3, 10, 7, [1, 1, 1, 1], 1], ["SP", 3, 15, 672, [2, 21, 2, 8], 1], ["SP", 3, 20, 5, [1, 1], 1], ["SP", 3, 23, 5, [1, 1], 1], ["RE", 3, [0, 5, 10, 15, 1, 6, 11, 16, 2, 7, 12, 17, 20, 23, 21, 24, 3, 8, 13, 18, 22, 25, 4, 9, 14, 19]], ["FSP", 4, 0, 4, 3], ["FSP", 4, 4, 5, 3], ["FSP", 4, 8, 6, 3], ["FSP", 4, 12, 7, 3], ["RE", 4, [0, 4, 8, 12, 1, 5, 9, 13, 2, 6, 10, 14, 3, 7, 11, 15]], ["CA", 3, 4, 11], ["CHR", 2, "shared", [3]], ["CA", 3, 4, 13], ["CHR", 1, "shared", [4]], ["CA", 2, 5, 13], ["CI", 1], ["FU", 12, [0, 1, 2, 3]], ["SP", 12, 0, 32928, [16], 1], ["AN", 12, 0, 5], ["AN", 12, 1, 6], ["FU", 6, [0, 1, 2, 3]], ["AN", 6, 0, 5], ["FU", 6, [1, 2, 3, 4]], ["AN", 6, 1, 4], ["FU", 6, [2, 3, 4, 5]], ["AN", 6, 2, 6], ["FU", 4, [0, 1, 2, 3]], ["SP", 4, 0, 16, [1], 1], ["AN", 4, 1, 2], ["FFSP", 4, 0, [7, 6, 5, 4], 1, 1], ["AN", 4, 1, 6], ["FU", 2, [0, 1, 2, 3]], ["SP", 2, 0, 16, [1], 1], ["AN", 2, 1, 2], ["FFSP", 2, 0, [7, 6, 5, 4], 1, 1], ["AN", 2, 1, 6], ["PR", 5, 0, "auto_unroll_max_step$1024"]]]], "r": [[0.000480691, 0.000480686, 0.000480675, 0.000480663, 0.000480644, 0.000480674, 0.000480676, 0.000480676, 0.00048065, 0.000480681], 0, 120.036, 1649226672], "v": "v0.6"}
{"i": [["[\"fused_depthwise_conv2d\", 14, 14, 672, 5, 5, [2, 2]]", "cuda -keys=cuda,gpu -max_num_threads=1024 -model=unknown -thread_warp_size=32", [-1, 16, 64, 49152, 2147483647, 1024, 8, 32], "", 0, []], [[], [["CI", 8], ["CI", 7], ["CI", 5], ["CHW", 3, "local"], ["SP", 3, 0, 1, [1, 1, 1, 1], 1], ["SP", 3, 5, 7, [7, 1, 1, 1], 1], ["SP", 3, 10, 7, [1, 7, 1, 1], 1], ["SP", 3, 15, 672, [1, 7, 2, 2], 1], ["SP", 3, 20, 5, [5, 1], 1], ["SP", 3, 23, 5, [1, 1], 1], ["RE", 3, [0, 5, 10, 15, 1, 6, 11, 16, 2, 7, 12, 17, 20, 23, 21, 24, 3, 8, 13, 18, 22, 25, 4, 9, 14, 19]], ["FSP", 4, 0, 4, 3], ["FSP", 4, 4, 5, 3], ["FSP", 4, 8, 6, 3], ["FSP", 4, 12, 7, 3], ["RE", 4, [0, 4, 8, 12, 1, 5, 9, 13, 2, 6, 10, 14, 3, 7, 11, 15]], ["CA", 3, 4, 11], ["CHR", 2, "shared", [3]], ["CA", 3, 4, 13], ["CHR", 1, "shared", [4]], ["CA", 2, 5, 13], ["CI", 1], ["FU", 12, [0, 1, 2, 3]], ["SP", 12, 0, 32928, [32], 1], ["AN", 12, 0, 5], ["AN", 12, 1, 6], ["FU", 6, [0, 1, 2, 3]], ["AN", 6, 0, 5], ["FU", 6, [1, 2, 3, 4]], ["AN", 6, 1, 4], ["FU", 6, [2, 3, 4, 5]], ["AN", 6, 2, 6], ["FU", 4, [0, 1, 2, 3]], ["SP", 4, 0, 20, [1], 1], ["AN", 4, 1, 2], ["FFSP", 4, 0, [7, 6, 5, 4], 1, 1], ["AN", 4, 1, 6], ["FU", 2, [0, 1, 2, 3]], ["SP", 2, 0, 20, [4], 1], ["AN", 2, 1, 2], ["FFSP", 2, 0, [7, 6, 5, 4], 1, 1], ["AN", 2, 1, 6], ["PR", 5, 0, "auto_unroll_max_step$16"]]]], "r": [[9.30986e-05, 9.31026e-05, 9.31069e-05, 9.30903e-05, 9.30971e-05, 9.30984e-05, 9.31093e-05, 9.31122e-05, 9.30935e-05, 9.31016e-05], 0, 126.336, 1649226688], "v": "v0.6"}
{"i": [["[\"fused_depthwise_conv2d\", 14, 14, 672, 5, 5, [2, 2]]", "cuda -keys=cuda,gpu -max_num_threads=1024 -model=unknown -thread_warp_size=32", [-1, 16, 64, 49152, 2147483647, 1024, 8, 32], "", 0, []], [[], [["CI", 8], ["CI", 7], ["CI", 5], ["CHW", 3, "local"], ["SP", 3, 0, 1, [1, 1, 1, 1], 1], ["SP", 3, 5, 7, [1, 7, 1, 1], 1], ["SP", 3, 10, 7, [7, 1, 1, 1], 1], ["SP", 3, 15, 672, [1, 8, 3, 2], 1], ["SP", 3, 20, 5, [1, 1], 1], ["SP", 3, 23, 5, [1, 5], 1], ["RE", 3, [0, 5, 10, 15, 1, 6, 11, 16, 2, 7, 12, 17, 20, 23, 21, 24, 3, 8, 13, 18, 22, 25, 4, 9, 14, 19]], ["FSP", 4, 0, 4, 3], ["FSP", 4, 4, 5, 3], ["FSP", 4, 8, 6, 3], ["FSP", 4, 12, 7, 3], ["RE", 4, [0, 4, 8, 12, 1, 5, 9, 13, 2, 6, 10, 14, 3, 7, 11, 15]], ["CA", 3, 4, 11], ["CHR", 2, "shared", [3]], ["CA", 3, 4, 13], ["CHR", 1, "shared", [4]], ["CA", 2, 5, 13], ["CI", 1], ["FU", 12, [0, 1, 2, 3]], ["SP", 12, 0, 32928, [32], 1], ["AN", 12, 0, 5], ["AN", 12, 1, 6], ["FU", 6, [0, 1, 2, 3]], ["AN", 6, 0, 5], ["FU", 6, [1, 2, 3, 4]], ["AN", 6, 1, 4], ["FU", 6, [2, 3, 4, 5]], ["AN", 6, 2, 6], ["FU", 4, [0, 1, 2, 3]], ["SP", 4, 0, 30, [15], 1], ["AN", 4, 1, 2], ["FFSP", 4, 0, [7, 6, 5, 4], 1, 1], ["AN", 4, 1, 6], ["FU", 2, [0, 1, 2, 3]], ["SP", 2, 0, 30, [15], 1], ["AN", 2, 1, 2], ["FFSP", 2, 0, [7, 6, 5, 4], 1, 1], ["AN", 2, 1, 6], ["PR", 5, 0, "auto_unroll_max_step$512"]]]], "r": [[7.63187e-05, 7.6316e-05, 7.63136e-05, 7.63218e-05, 7.63114e-05, 7.63156e-05, 7.6315e-05, 7.63154e-05, 7.63138e-05, 7.63147e-05], 0, 143.442, 1649226699], "v": "v0.6"}
{"i": [["[\"fused_depthwise_conv2d\", 14, 14, 672, 5, 5, [2, 2]]", "cuda -keys=cuda,gpu -max_num_threads=1024 -model=unknown -thread_warp_size=32", [-1, 16, 64, 49152, 2147483647, 1024, 8, 32], "", 0, []], [[], [["CI", 8], ["CI", 7], ["CI", 5], ["CHW", 3, "local"], ["SP", 3, 0, 1, [1, 1, 1, 1], 1], ["SP", 3, 5, 7, [1, 7, 1, 1], 1], ["SP", 3, 10, 7, [1, 1, 1, 1], 1], ["SP", 3, 15, 672, [1, 7, 1, 4], 1], ["SP", 3, 20, 5, [5, 1], 1], ["SP", 3, 23, 5, [1, 1], 1], ["RE", 3, [0, 5, 10, 15, 1, 6, 11, 16, 2, 7, 12, 17, 20, 23, 21, 24, 3, 8, 13, 18, 22, 25, 4, 9, 14, 19]], ["FSP", 4, 0, 4, 3], ["FSP", 4, 4, 5, 3], ["FSP", 4, 8, 6, 3], ["FSP", 4, 12, 7, 3], ["RE", 4, [0, 4, 8, 12, 1, 5, 9, 13, 2, 6, 10, 14, 3, 7, 11, 15]], ["CA", 3, 4, 11], ["CHR", 2, "shared", [3]], ["CA", 3, 4, 13], ["CHR", 1, "shared", [4]], ["CA", 2, 5, 13], ["CI", 1], ["FU", 12, [0, 1, 2, 3]], ["SP", 12, 0, 32928, [32], 1], ["AN", 12, 0, 5], ["AN", 12, 1, 6], ["FU", 6, [0, 1, 2, 3]], ["AN", 6, 0, 5], ["FU", 6, [1, 2, 3, 4]], ["AN", 6, 1, 4], ["FU", 6, [2, 3, 4, 5]], ["AN", 6, 2, 6], ["FU", 4, [0, 1, 2, 3]], ["SP", 4, 0, 20, [1], 1], ["AN", 4, 1, 2], ["FFSP", 4, 0, [7, 6, 5, 4], 1, 1], ["AN", 4, 1, 6], ["FU", 2, [0, 1, 2, 3]], ["SP", 2, 0, 260, [1], 1], ["AN", 2, 1, 2], ["FFSP", 2, 0, [7, 6, 5, 4], 1, 1], ["AN", 2, 1, 6], ["PR", 5, 0, "auto_unroll_max_step$64"]]]], "r": [[1.28126e-05, 1.28111e-05, 1.28093e-05, 1.28132e-05, 1.2814e-05, 1.28109e-05, 1.28138e-05, 1.28166e-05, 1.28152e-05, 1.28182e-05], 0, 130.752, 1649226693], "v": "v0.6"}
{"i": [["[\"fused_depthwise_conv2d\", 14, 14, 672, 5, 5, [2, 2]]", "cuda -keys=cuda,gpu -max_num_threads=1024 -model=unknown -thread_warp_size=32", [-1, 16, 64, 49152, 2147483647, 1024, 8, 32], "", 0, []], [[], [["CI", 8], ["CI", 7], ["CI", 5], ["CHW", 3, "local"], ["SP", 3, 0, 1, [1, 1, 1, 1], 1], ["SP", 3, 5, 7, [1, 7, 1, 1], 1], ["SP", 3, 10, 7, [1, 1, 1, 1], 1], ["SP", 3, 15, 672, [1, 6, 4, 14], 1], ["SP", 3, 20, 5, [5, 1], 1], ["SP", 3, 23, 5, [1, 1], 1], ["RE", 3, [0, 5, 10, 15, 1, 6, 11, 16, 2, 7, 12, 17, 20, 23, 21, 24, 3, 8, 13, 18, 22, 25, 4, 9, 14, 19]], ["FSP", 4, 0, 4, 3], ["FSP", 4, 4, 5, 3], ["FSP", 4, 8, 6, 3], ["FSP", 4, 12, 7, 3], ["RE", 4, [0, 4, 8, 12, 1, 5, 9, 13, 2, 6, 10, 14, 3, 7, 11, 15]], ["CA", 3, 4, 11], ["CHR", 2, "shared", [3]], ["CA", 3, 4, 13], ["CHR", 1, "shared", [4]], ["CA", 2, 5, 13], ["CI", 1], ["FU", 12, [0, 1, 2, 3]], ["SP", 12, 0, 32928, [32], 1], ["AN", 12, 0, 5], ["AN", 12, 1, 6], ["FU", 6, [0, 1, 2, 3]], ["AN", 6, 0, 5], ["FU", 6, [1, 2, 3, 4]], ["AN", 6, 1, 4], ["FU", 6, [2, 3, 4, 5]], ["AN", 6, 2, 6], ["FU", 4, [0, 1, 2, 3]], ["SP", 4, 0, 280, [1], 1], ["AN", 4, 1, 2], ["FFSP", 4, 0, [7, 6, 5, 4], 1, 1], ["AN", 4, 1, 6], ["FU", 2, [0, 1, 2, 3]], ["SP", 2, 0, 280, [7], 1], ["AN", 2, 1, 2], ["FFSP", 2, 0, [7, 6, 5, 4], 1, 1], ["AN", 2, 1, 6], ["PR", 5, 0, "auto_unroll_max_step$512"]]]], "r": [[3.14356e-05, 3.14359e-05, 3.14357e-05, 3.14358e-05, 3.14358e-05, 3.14361e-05, 3.1436e-05, 3.14358e-05, 3.14359e-05, 3.14361e-05], 0, 146.435, 1649226704], "v": "v0.6"}
{"i": [["[\"fused_depthwise_conv2d\", 14, 14, 672, 5, 5, [2, 2]]", "cuda -keys=cuda,gpu -max_num_threads=1024 -model=unknown -thread_warp_size=32", [-1, 16, 64, 49152, 2147483647, 1024, 8, 32], "", 0, []], [[], [["CI", 8], ["CI", 7], ["CI", 5], ["CHW", 3, "local"], ["SP", 3, 0, 1, [1, 1, 1, 1], 1], ["SP", 3, 5, 7, [1, 1, 1, 7], 1], ["SP", 3, 10, 7, [1, 1, 1, 7], 1], ["SP", 3, 15, 672, [14, 1, 1, 1], 1], ["SP", 3, 20, 5, [1, 1], 1], ["SP", 3, 23, 5, [1, 5], 1], ["RE", 3, [0, 5, 10, 15, 1, 6, 11, 16, 2, 7, 12, 17, 20, 23, 21, 24, 3, 8, 13, 18, 22, 25, 4, 9, 14, 19]], ["FSP", 4, 0, 4, 3], ["FSP", 4, 4, 5, 3], ["FSP", 4, 8, 6, 3], ["FSP", 4, 12, 7, 3], ["RE", 4, [0, 4, 8, 12, 1, 5, 9, 13, 2, 6, 10, 14, 3, 7, 11, 15]], ["CA", 3, 4, 11], ["CHR", 2, "shared", [3]], ["CA", 3, 4, 13], ["CHR", 1, "shared", [4]], ["CA", 2, 5, 13], ["CI", 1], ["FU", 12, [0, 1, 2, 3]], ["SP", 12, 0, 32928, [32], 1], ["AN", 12, 0, 5], ["AN", 12, 1, 6], ["FU", 6, [0, 1, 2, 3]], ["AN", 6, 0, 5], ["FU", 6, [1, 2, 3, 4]], ["AN", 6, 1, 4], ["FU", 6, [2, 3, 4, 5]], ["AN", 6, 2, 6], ["FU", 4, [0, 1, 2, 3]], ["SP", 4, 0, 5, [1], 1], ["AN", 4, 1, 2], ["FFSP", 4, 0, [7, 6, 5, 4], 1, 1], ["AN", 4, 1, 6], ["FU", 2, [0, 1, 2, 3]], ["SP", 2, 0, 17, [1], 1], ["AN", 2, 1, 2], ["FFSP", 2, 0, [7, 6, 5, 4], 1, 1], ["AN", 2, 1, 6], ["PR", 5, 0, "auto_unroll_max_step$16"]]]], "r": [[0.0026029, 0.00260291, 0.0026031, 0.00260313, 0.00260291, 0.00260282, 0.00260291, 0.00260287, 0.0026029, 0.00260281], 0, 152.558, 1649226714], "v": "v0.6"}
{"i": [["[\"fused_depthwise_conv2d\", 14, 14, 672, 5, 5, [2, 2]]", "cuda -keys=cuda,gpu -max_num_threads=1024 -model=unknown -thread_warp_size=32", [-1, 16, 64, 49152, 2147483647, 1024, 8, 32], "", 0, []], [[], [["CI", 8], ["CI", 7], ["CI", 5], ["CHW", 3, "local"], ["SP", 3, 0, 1, [1, 1, 1, 1], 1], ["SP", 3, 5, 7, [1, 7, 1, 1], 1], ["SP", 3, 10, 7, [7, 1, 1, 1], 1], ["SP", 3, 15, 672, [1, 8, 1, 1], 1], ["SP", 3, 20, 5, [1, 5], 1], ["SP", 3, 23, 5, [1, 5], 1], ["RE", 3, [0, 5, 10, 15, 1, 6, 11, 16, 2, 7, 12, 17, 20, 23, 21, 24, 3, 8, 13, 18, 22, 25, 4, 9, 14, 19]], ["FSP", 4, 0, 4, 3], ["FSP", 4, 4, 5, 3], ["FSP", 4, 8, 6, 3], ["FSP", 4, 12, 7, 3], ["RE", 4, [0, 4, 8, 12, 1, 5, 9, 13, 2, 6, 10, 14, 3, 7, 11, 15]], ["CA", 3, 4, 11], ["CHR", 2, "shared", [3]], ["CA", 3, 4, 13], ["CHR", 1, "shared", [4]], ["CA", 2, 5, 13], ["CI", 1], ["FU", 12, [0, 1, 2, 3]], ["SP", 12, 0, 32928, [16], 1], ["AN", 12, 0, 5], ["AN", 12, 1, 6], ["FU", 6, [0, 1, 2, 3]], ["AN", 6, 0, 5], ["FU", 6, [1, 2, 3, 4]], ["AN", 6, 1, 4], ["FU", 6, [2, 3, 4, 5]], ["AN", 6, 2, 6], ["FU", 4, [0, 1, 2, 3]], ["SP", 4, 0, 25, [1], 1], ["AN", 4, 1, 2], ["FFSP", 4, 0, [7, 6, 5, 4], 1, 1], ["AN", 4, 1, 6], ["FU", 2, [0, 1, 2, 3]], ["SP", 2, 0, 25, [1], 1], ["AN", 2, 1, 2], ["FFSP", 2, 0, [7, 6, 5, 4], 1, 1], ["AN", 2, 1, 6], ["PR", 5, 0, "auto_unroll_max_step$64"]]]], "r": [[8.6761e-06, 8.67689e-06, 8.67666e-06, 8.67528e-06, 8.67838e-06, 8.67801e-06, 8.67705e-06, 8.67795e-06, 8.67583e-06, 8.67845e-06], 0, 147.041, 1649226709], "v": "v0.6"}
{"i": [["[\"fused_depthwise_conv2d\", 14, 14, 672, 5, 5, [2, 2]]", "cuda -keys=cuda,gpu -max_num_threads=1024 -model=unknown -thread_warp_size=32", [-1, 16, 64, 49152, 2147483647, 1024, 8, 32], "", 0, []], [[], [["CI", 8], ["CI", 7], ["CI", 5], ["CHW", 3, "local"], ["SP", 3, 0, 1, [1, 1, 1, 1], 1], ["SP", 3, 5, 7, [1, 7, 1, 1], 1], ["SP", 3, 10, 7, [7, 1, 1, 1], 1], ["SP", 3, 15, 672, [1, 12, 1, 2], 1], ["SP", 3, 20, 5, [1, 5], 1], ["SP", 3, 23, 5, [1, 1], 1], ["RE", 3, [0, 5, 10, 15, 1, 6, 11, 16, 2, 7, 12, 17, 20, 23, 21, 24, 3, 8, 13, 18, 22, 25, 4, 9, 14, 19]], ["FSP", 4, 0, 4, 3], ["FSP", 4, 4, 5, 3], ["FSP", 4, 8, 6, 3], ["FSP", 4, 12, 7, 3], ["RE", 4, [0, 4, 8, 12, 1, 5, 9, 13, 2, 6, 10, 14, 3, 7, 11, 15]], ["CA", 3, 4, 11], ["CHR", 2, "shared", [3]], ["CA", 3, 4, 13], ["CHR", 1, "shared", [4]], ["CA", 2, 5, 13], ["CI", 1], ["FU", 12, [0, 1, 2, 3]], ["SP", 12, 0, 32928, [8], 1], ["AN", 12, 0, 5], ["AN", 12, 1, 6], ["FU", 6, [0, 1, 2, 3]], ["AN", 6, 0, 5], ["FU", 6, [1, 2, 3, 4]], ["AN", 6, 1, 4], ["FU", 6, [2, 3, 4, 5]], ["AN", 6, 2, 6], ["FU", 4, [0, 1, 2, 3]], ["SP", 4, 0, 2, [1], 1], ["AN", 4, 1, 2], ["FFSP", 4, 0, [7, 6, 5, 4], 1, 1], ["AN", 4, 1, 6], ["FU", 2, [0, 1, 2, 3]], ["SP", 2, 0, 2, [1], 1], ["AN", 2, 1, 2], ["FFSP", 2, 0, [7, 6, 5, 4], 1, 1], ["AN", 2, 1, 6], ["PR", 5, 0, "auto_unroll_max_step$0"]]]], "r": [[8.87291e-05, 8.87322e-05, 8.87314e-05, 8.87265e-05, 8.87319e-05, 8.87287e-05, 8.873e-05, 8.87321e-05, 8.87293e-05, 8.87317e-05], 0, 179.257, 1649226742], "v": "v0.6"}
{"i": [["[\"fused_depthwise_conv2d\", 14, 14, 672, 5, 5, [2, 2]]", "cuda -keys=cuda,gpu -max_num_threads=1024 -model=unknown -thread_warp_size=32", [-1, 16, 64, 49152, 2147483647, 1024, 8, 32], "", 0, []], [[], [["CI", 8], ["CI", 7], ["CI", 5], ["CHW", 3, "local"], ["SP", 3, 0, 1, [1, 1, 1, 1], 1], ["SP", 3, 5, 7, [1, 7, 1, 1], 1], ["SP", 3, 10, 7, [1, 7, 1, 1], 1], ["SP", 3, 15, 672, [6, 2, 1, 2], 1], ["SP", 3, 20, 5, [1, 5], 1], ["SP", 3, 23, 5, [1, 5], 1], ["RE", 3, [0, 5, 10, 15, 1, 6, 11, 16, 2, 7, 12, 17, 20, 23, 21, 24, 3, 8, 13, 18, 22, 25, 4, 9, 14, 19]], ["FSP", 4, 0, 4, 3], ["FSP", 4, 4, 5, 3], ["FSP", 4, 8, 6, 3], ["FSP", 4, 12, 7, 3], ["RE", 4, [0, 4, 8, 12, 1, 5, 9, 13, 2, 6, 10, 14, 3, 7, 11, 15]], ["CA", 3, 4, 11], ["CHR", 2, "shared", [3]], ["CA", 3, 4, 13], ["CHR", 1, "shared", [4]], ["CA", 2, 5, 13], ["CI", 1], ["FU", 12, [0, 1, 2, 3]], ["SP", 12, 0, 32928, [32], 1], ["AN", 12, 0, 5], ["AN", 12, 1, 6], ["FU", 6, [0, 1, 2, 3]], ["AN", 6, 0, 5], ["FU", 6, [1, 2, 3, 4]], ["AN", 6, 1, 4], ["FU", 6, [2, 3, 4, 5]], ["AN", 6, 2, 6], ["FU", 4, [0, 1, 2, 3]], ["SP", 4, 0, 10, [1], 1], ["AN", 4, 1, 2], ["FFSP", 4, 0, [7, 6, 5, 4], 1, 1], ["AN", 4, 1, 6], ["FU", 2, [0, 1, 2, 3]], ["SP", 2, 0, 10, [1], 1], ["AN", 2, 1, 2], ["FFSP", 2, 0, [7, 6, 5, 4], 1, 1], ["AN", 2, 1, 6], ["PR", 5, 0, "auto_unroll_max_step$64"]]]], "r": [[2.66888e-05, 2.66949e-05, 2.66889e-05, 2.66891e-05, 2.66873e-05, 2.66882e-05, 2.6686e-05, 2.66864e-05, 2.66861e-05, 2.66876e-05], 0, 157.344, 1649226720], "v": "v0.6"}
{"i": [["[\"fused_depthwise_conv2d\", 14, 14, 672, 5, 5, [2, 2]]", "cuda -keys=cuda,gpu -max_num_threads=1024 -model=unknown -thread_warp_size=32", [-1, 16, 64, 49152, 2147483647, 1024, 8, 32], "", 0, []], [[], [["CI", 8], ["CI", 7], ["CI", 5], ["CHW", 3, "local"], ["SP", 3, 0, 1, [1, 1, 1, 1], 1], ["SP", 3, 5, 7, [1, 1, 7, 1], 1], ["SP", 3, 10, 7, [1, 1, 7, 1], 1], ["SP", 3, 15, 672, [1, 6, 1, 2], 1], ["SP", 3, 20, 5, [1, 5], 1], ["SP", 3, 23, 5, [1, 1], 1], ["RE", 3, [0, 5, 10, 15, 1, 6, 11, 16, 2, 7, 12, 17, 20, 23, 21, 24, 3, 8, 13, 18, 22, 25, 4, 9, 14, 19]], ["FSP", 4, 0, 4, 3], ["FSP", 4, 4, 5, 3], ["FSP", 4, 8, 6, 3], ["FSP", 4, 12, 7, 3], ["RE", 4, [0, 4, 8, 12, 1, 5, 9, 13, 2, 6, 10, 14, 3, 7, 11, 15]], ["CA", 3, 4, 11], ["CHR", 2, "shared", [3]], ["CA", 3, 4, 13], ["CHR", 1, "shared", [4]], ["CA", 2, 5, 13], ["CI", 1], ["FU", 12, [0, 1, 2, 3]], ["SP", 12, 0, 32928, [32], 1], ["AN", 12, 0, 5], ["AN", 12, 1, 6], ["FU", 6, [0, 1, 2, 3]], ["AN", 6, 0, 5], ["FU", 6, [1, 2, 3, 4]], ["AN", 6, 1, 4], ["FU", 6, [2, 3, 4, 5]], ["AN", 6, 2, 6], ["FU", 4, [0, 1, 2, 3]], ["SP", 4, 0, 25, [1], 1], ["AN", 4, 1, 2], ["FFSP", 4, 0, [7, 6, 5, 4], 1, 1], ["AN", 4, 1, 6], ["FU", 2, [0, 1, 2, 3]], ["SP", 2, 0, 85, [1], 1], ["AN", 2, 1, 2], ["FFSP", 2, 0, [7, 6, 5, 4], 1, 1], ["AN", 2, 1, 6], ["PR", 5, 0, "auto_unroll_max_step$512"]]]], "r": [[0.000100173, 0.000100173, 0.000100179, 0.000100175, 0.000100174, 0.000100173, 0.000100167, 0.000100175, 0.000100171, 0.000100174], 0, 173.876, 1649226731], "v": "v0.6"}
{"i": [["[\"fused_depthwise_conv2d\", 14, 14, 672, 5, 5, [2, 2]]", "cuda -keys=cuda,gpu -max_num_threads=1024 -model=unknown -thread_warp_size=32", [-1, 16, 64, 49152, 2147483647, 1024, 8, 32], "", 0, []], [[], [["CI", 8], ["CI", 7], ["CI", 5], ["CHW", 3, "local"], ["SP", 3, 0, 1, [1, 1, 1, 1], 1], ["SP", 3, 5, 7, [1, 1, 1, 1], 1], ["SP", 3, 10, 7, [1, 7, 1, 1], 1], ["SP", 3, 15, 672, [7, 1, 4, 1], 1], ["SP", 3, 20, 5, [1, 5], 1], ["SP", 3, 23, 5, [5, 1], 1], ["RE", 3, [0, 5, 10, 15, 1, 6, 11, 16, 2, 7, 12, 17, 20, 23, 21, 24, 3, 8, 13, 18, 22, 25, 4, 9, 14, 19]], ["FSP", 4, 0, 4, 3], ["FSP", 4, 4, 5, 3], ["FSP", 4, 8, 6, 3], ["FSP", 4, 12, 7, 3], ["RE", 4, [0, 4, 8, 12, 1, 5, 9, 13, 2, 6, 10, 14, 3, 7, 11, 15]], ["CA", 3, 4, 11], ["CHR", 2, "shared", [3]], ["CA", 3, 4, 13], ["CHR", 1, "shared", [4]], ["CA", 2, 5, 13], ["CI", 1], ["FU", 12, [0, 1, 2, 3]], ["SP", 12, 0, 32928, [32], 1], ["AN", 12, 0, 5], ["AN", 12, 1, 6], ["FU", 6, [0, 1, 2, 3]], ["AN", 6, 0, 5], ["FU", 6, [1, 2, 3, 4]], ["AN", 6, 1, 4], ["FU", 6, [2, 3, 4, 5]], ["AN", 6, 2, 6], ["FU", 4, [0, 1, 2, 3]], ["SP", 4, 0, 100, [1], 1], ["AN", 4, 1, 2], ["FFSP", 4, 0, [7, 6, 5, 4], 1, 1], ["AN", 4, 1, 6], ["FU", 2, [0, 1, 2, 3]], ["SP", 2, 0, 100, [1], 1], ["AN", 2, 1, 2], ["FFSP", 2, 0, [7, 6, 5, 4], 1, 1], ["AN", 2, 1, 6], ["PR", 5, 0, "auto_unroll_max_step$64"]]]], "r": [[8.49608e-05, 8.49571e-05, 8.49584e-05, 8.49596e-05, 8.4959e-05, 8.49595e-05, 8.4959e-05, 8.49599e-05, 8.49588e-05, 8.49601e-05], 0, 163, 1649226725], "v": "v0.6"}
{"i": [["[\"fused_depthwise_conv2d\", 14, 14, 672, 5, 5, [2, 2]]", "cuda -keys=cuda,gpu -max_num_threads=1024 -model=unknown -thread_warp_size=32", [-1, 16, 64, 49152, 2147483647, 1024, 8, 32], "", 0, []], [[], [["CI", 8], ["CI", 7], ["CI", 5], ["CHW", 3, "local"], ["SP", 3, 0, 1, [1, 1, 1, 1], 1], ["SP", 3, 5, 7, [1, 1, 1, 1], 1], ["SP", 3, 10, 7, [1, 7, 1, 1], 1], ["SP", 3, 15, 672, [1, 8, 2, 42], 1], ["SP", 3, 20, 5, [1, 1], 1], ["SP", 3, 23, 5, [1, 1], 1], ["RE", 3, [0, 5, 10, 15, 1, 6, 11, 16, 2, 7, 12, 17, 20, 23, 21, 24, 3, 8, 13, 18, 22, 25, 4, 9, 14, 19]], ["FSP", 4, 0, 4, 3], ["FSP", 4, 4, 5, 3], ["FSP", 4, 8, 6, 3], ["FSP", 4, 12, 7, 3], ["RE", 4, [0, 4, 8, 12, 1, 5, 9, 13, 2, 6, 10, 14, 3, 7, 11, 15]], ["CA", 3, 4, 11], ["CHR", 2, "shared", [3]], ["CA", 3, 4, 13], ["CHR", 1, "shared", [4]], ["CA", 2, 5, 13], ["CI", 1], ["FU", 12, [0, 1, 2, 3]], ["SP", 12, 0, 32928, [2], 1], ["AN", 12, 0, 5], ["AN", 12, 1, 6], ["FU", 6, [0, 1, 2, 3]], ["AN", 6, 0, 5], ["FU", 6, [1, 2, 3, 4]], ["AN", 6, 1, 4], ["FU", 6, [2, 3, 4, 5]], ["AN", 6, 2, 6], ["FU", 4, [0, 1, 2, 3]], ["SP", 4, 0, 84, [1], 1], ["AN", 4, 1, 2], ["FFSP", 4, 0, [7, 6, 5, 4], 1, 1], ["AN", 4, 1, 6], ["FU", 2, [0, 1, 2, 3]], ["SP", 2, 0, 84, [21], 1], ["AN", 2, 1, 2], ["FFSP", 2, 0, [7, 6, 5, 4], 1, 1], ["AN", 2, 1, 6], ["PR", 5, 0, "auto_unroll_max_step$64"]]]], "r": [[0.000785477, 0.000785544, 0.000785589, 0.000785655, 0.000785554, 0.000785606, 0.00078562, 0.000785575, 0.000785619, 0.000785494], 0, 174.8, 1649226736], "v": "v0.6"}
{"i": [["[\"fused_depthwise_conv2d\", 14, 14, 672, 5, 5, [2, 2]]", "cuda -keys=cuda,gpu -max_num_threads=1024 -model=unknown -thread_warp_size=32", [-1, 16, 64, 49152, 2147483647, 1024, 8, 32], "", 0, []], [[], [["CI", 8], ["CI", 7], ["CI", 5], ["CHW", 3, "local"], ["SP", 3, 0, 1, [1, 1, 1, 1], 1], ["SP", 3, 5, 7, [1, 1, 7, 1], 1], ["SP", 3, 10, 7, [1, 1, 1, 1], 1], ["SP", 3, 15, 672, [1, 32, 3, 1], 1], ["SP", 3, 20, 5, [1, 5], 1], ["SP", 3, 23, 5, [1, 1], 1], ["RE", 3, [0, 5, 10, 15, 1, 6, 11, 16, 2, 7, 12, 17, 20, 23, 21, 24, 3, 8, 13, 18, 22, 25, 4, 9, 14, 19]], ["FSP", 4, 0, 4, 3], ["FSP", 4, 4, 5, 3], ["FSP", 4, 8, 6, 3], ["FSP", 4, 12, 7, 3], ["RE", 4, [0, 4, 8, 12, 1, 5, 9, 13, 2, 6, 10, 14, 3, 7, 11, 15]], ["CA", 3, 4, 11], ["CHR", 2, "shared", [3]], ["CA", 3, 4, 13], ["CHR", 1, "shared", [4]], ["CA", 2, 5, 13], ["CI", 1], ["FU", 12, [0, 1, 2, 3]], ["SP", 12, 0, 32928, [32], 1], ["AN", 12, 0, 5], ["AN", 12, 1, 6], ["FU", 6, [0, 1, 2, 3]], ["AN", 6, 0, 5], ["FU", 6, [1, 2, 3, 4]], ["AN", 6, 1, 4], ["FU", 6, [2, 3, 4, 5]], ["AN", 6, 2, 6], ["FU", 4, [0, 1, 2, 3]], ["SP", 4, 0, 15, [1], 1], ["AN", 4, 1, 2], ["FFSP", 4, 0, [7, 6, 5, 4], 1, 1], ["AN", 4, 1, 6], ["FU", 2, [0, 1, 2, 3]], ["SP", 2, 0, 51, [1], 1], ["AN", 2, 1, 2], ["FFSP", 2, 0, [7, 6, 5, 4], 1, 1], ["AN", 2, 1, 6], ["PR", 5, 0, "auto_unroll_max_step$64"]]]], "r": [[1.3391e-05, 1.33933e-05, 1.33938e-05, 1.33915e-05, 1.3391e-05, 1.33903e-05, 1.33912e-05, 1.33919e-05, 1.339e-05, 1.33915e-05], 0, 184.704, 1649226746], "v": "v0.6"}
{"i": [["[\"fused_depthwise_conv2d\", 14, 14, 672, 5, 5, [2, 2]]", "cuda -keys=cuda,gpu -max_num_threads=1024 -model=unknown -thread_warp_size=32", [-1, 16, 64, 49152, 2147483647, 1024, 8, 32], "", 0, []], [[], [["CI", 8], ["CI", 7], ["CI", 5], ["CHW", 3, "local"], ["SP", 3, 0, 1, [1, 1, 1, 1], 1], ["SP", 3, 5, 7, [1, 1, 1, 7], 1], ["SP", 3, 10, 7, [1, 1, 1, 7], 1], ["SP", 3, 15, 672, [2, 16, 1, 1], 1], ["SP", 3, 20, 5, [5, 1], 1], ["SP", 3, 23, 5, [1, 1], 1], ["RE", 3, [0, 5, 10, 15, 1, 6, 11, 16, 2, 7, 12, 17, 20, 23, 21, 24, 3, 8, 13, 18, 22, 25, 4, 9, 14, 19]], ["FSP", 4, 0, 4, 3], ["FSP", 4, 4, 5, 3], ["FSP", 4, 8, 6, 3], ["FSP", 4, 12, 7, 3], ["RE", 4, [0, 4, 8, 12, 1, 5, 9, 13, 2, 6, 10, 14, 3, 7, 11, 15]], ["CA", 3, 4, 11], ["CHR", 2, "shared", [3]], ["CA", 3, 4, 13], ["CHR", 1, "shared", [4]], ["CA", 2, 5, 13], ["CI", 1], ["FU", 12, [0, 1, 2, 3]], ["SP", 12, 0, 32928, [32], 1], ["AN", 12, 0, 5], ["AN", 12, 1, 6], ["FU", 6, [0, 1, 2, 3]], ["AN", 6, 0, 5], ["FU", 6, [1, 2, 3, 4]], ["AN", 6, 1, 4], ["FU", 6, [2, 3, 4, 5]], ["AN", 6, 2, 6], ["FU", 4, [0, 1, 2, 3]], ["SP", 4, 0, 25, [1], 1], ["AN", 4, 1, 2], ["FFSP", 4, 0, [7, 6, 5, 4], 1, 1], ["AN", 4, 1, 6], ["FU", 2, [0, 1, 2, 3]], ["SP", 2, 0, 85, [1], 1], ["AN", 2, 1, 2], ["FFSP", 2, 0, [7, 6, 5, 4], 1, 1], ["AN", 2, 1, 6], ["PR", 5, 0, "auto_unroll_max_step$1024"]]]], "r": [[8.25652e-05, 8.25667e-05, 8.25684e-05, 8.25664e-05, 8.25674e-05, 8.25658e-05, 8.25667e-05, 8.25703e-05, 8.25671e-05, 8.25671e-05], 0, 195.045, 1649226752], "v": "v0.6"}
{"i": [["[\"fused_depthwise_conv2d\", 14, 14, 672, 5, 5, [2, 2]]", "cuda -keys=cuda,gpu -max_num_threads=1024 -model=unknown -thread_warp_size=32", [-1, 16, 64, 49152, 2147483647, 1024, 8, 32], "", 0, []], [[], [["CI", 8], ["CI", 7], ["CI", 5], ["CHW", 3, "local"], ["SP", 3, 0, 1, [1, 1, 1, 1], 1], ["SP", 3, 5, 7, [1, 1, 1, 1], 1], ["SP", 3, 10, 7, [1, 7, 1, 1], 1], ["SP", 3, 15, 672, [1, 12, 1, 4], 1], ["SP", 3, 20, 5, [5, 1], 1], ["SP", 3, 23, 5, [1, 1], 1], ["RE", 3, [0, 5, 10, 15, 1, 6, 11, 16, 2, 7, 12, 17, 20, 23, 21, 24, 3, 8, 13, 18, 22, 25, 4, 9, 14, 19]], ["FSP", 4, 0, 4, 3], ["FSP", 4, 4, 5, 3], ["FSP", 4, 8, 6, 3], ["FSP", 4, 12, 7, 3], ["RE", 4, [0, 4, 8, 12, 1, 5, 9, 13, 2, 6, 10, 14, 3, 7, 11, 15]], ["CA", 3, 4, 11], ["CHR", 2, "shared", [3]], ["CA", 3, 4, 13], ["CHR", 1, "shared", [4]], ["CA", 2, 5, 13], ["CI", 1], ["FU", 12, [0, 1, 2, 3]], ["SP", 12, 0, 32928, [32], 1], ["AN", 12, 0, 5], ["AN", 12, 1, 6], ["FU", 6, [0, 1, 2, 3]], ["AN", 6, 0, 5], ["FU", 6, [1, 2, 3, 4]], ["AN", 6, 1, 4], ["FU", 6, [2, 3, 4, 5]], ["AN", 6, 2, 6], ["FU", 4, [0, 1, 2, 3]], ["SP", 4, 0, 2, [2], 1], ["AN", 4, 1, 2], ["FFSP", 4, 0, [7, 6, 5, 4], 1, 1], ["AN", 4, 1, 6], ["FU", 2, [0, 1, 2, 3]], ["SP", 2, 0, 2, [1], 1], ["AN", 2, 1, 2], ["FFSP", 2, 0, [7, 6, 5, 4], 1, 1], ["AN", 2, 1, 6], ["PR", 5, 0, "auto_unroll_max_step$1024"]]]], "r": [[1.58872e-05, 1.58838e-05, 1.58843e-05, 1.58856e-05, 1.58863e-05, 1.58845e-05, 1.58818e-05, 1.58828e-05, 1.58816e-05, 1.58835e-05], 0, 196.924, 1649226757], "v": "v0.6"}
{"i": [["[\"fused_depthwise_conv2d\", 14, 14, 672, 5, 5, [2, 2]]", "cuda -keys=cuda,gpu -max_num_threads=1024 -model=unknown -thread_warp_size=32", [-1, 16, 64, 49152, 2147483647, 1024, 8, 32], "", 0, []], [[], [["CI", 8], ["CI", 7], ["CI", 5], ["CHW", 3, "local"], ["SP", 3, 0, 1, [1, 1, 1, 1], 1], ["SP", 3, 5, 7, [1, 7, 1, 1], 1], ["SP", 3, 10, 7, [1, 1, 1, 1], 1], ["SP", 3, 15, 672, [1, 12, 1, 2], 1], ["SP", 3, 20, 5, [1, 5], 1], ["SP", 3, 23, 5, [5, 1], 1], ["RE", 3, [0, 5, 10, 15, 1, 6, 11, 16, 2, 7, 12, 17, 20, 23, 21, 24, 3, 8, 13, 18, 22, 25, 4, 9, 14, 19]], ["FSP", 4, 0, 4, 3], ["FSP", 4, 4, 5, 3], ["FSP", 4, 8, 6, 3], ["FSP", 4, 12, 7, 3], ["RE", 4, [0, 4, 8, 12, 1, 5, 9, 13, 2, 6, 10, 14, 3, 7, 11, 15]], ["CA", 3, 4, 11], ["CHR", 2, "shared", [3]], ["CA", 3, 4, 13], ["CHR", 1, "shared", [4]], ["CA", 2, 5, 13], ["CI", 1], ["FU", 12, [0, 1, 2, 3]], ["SP", 12, 0, 32928, [32], 1], ["AN", 12, 0, 5], ["AN", 12, 1, 6], ["FU", 6, [0, 1, 2, 3]], ["AN", 6, 0, 5], ["FU", 6, [1, 2, 3, 4]], ["AN", 6, 1, 4], ["FU", 6, [2, 3, 4, 5]], ["AN", 6, 2, 6], ["FU", 4, [0, 1, 2, 3]], ["SP", 4, 0, 2, [1], 1], ["AN", 4, 1, 2], ["FFSP", 4, 0, [7, 6, 5, 4], 1, 1], ["AN", 4, 1, 6], ["FU", 2, [0, 1, 2, 3]], ["SP", 2, 0, 2, [2], 1], ["AN", 2, 1, 2], ["FFSP", 2, 0, [7, 6, 5, 4], 1, 1], ["AN", 2, 1, 6], ["PR", 5, 0, "auto_unroll_max_step$0"]]]], "r": [[1.19143e-05, 1.19128e-05, 1.19161e-05, 1.19117e-05, 1.19162e-05, 1.19172e-05, 1.19173e-05, 1.1914e-05, 1.19113e-05, 1.19132e-05], 0, 199.014, 1649226762], "v": "v0.6"}
{"i": [["[\"fused_depthwise_conv2d\", 14, 14, 672, 5, 5, [2, 2]]", "cuda -keys=cuda,gpu -max_num_threads=1024 -model=unknown -thread_warp_size=32", [-1, 16, 64, 49152, 2147483647, 1024, 8, 32], "", 0, []], [[], [["CI", 8], ["CI", 7], ["CI", 5], ["CHW", 3, "local"], ["SP", 3, 0, 1, [1, 1, 1, 1], 1], ["SP", 3, 5, 7, [1, 1, 1, 1], 1], ["SP", 3, 10, 7, [1, 1, 1, 1], 1], ["SP", 3, 15, 672, [1, 168, 4, 1], 1], ["SP", 3, 20, 5, [5, 1], 1], ["SP", 3, 23, 5, [1, 1], 1], ["RE", 3, [0, 5, 10, 15, 1, 6, 11, 16, 2, 7, 12, 17, 20, 23, 21, 24, 3, 8, 13, 18, 22, 25, 4, 9, 14, 19]], ["FSP", 4, 0, 4, 3], ["FSP", 4, 4, 5, 3], ["FSP", 4, 8, 6, 3], ["FSP", 4, 12, 7, 3], ["RE", 4, [0, 4, 8, 12, 1, 5, 9, 13, 2, 6, 10, 14, 3, 7, 11, 15]], ["CA", 3, 4, 11], ["CHR", 2, "shared", [3]], ["CA", 3, 4, 13], ["CHR", 1, "shared", [4]], ["CA", 2, 5, 13], ["CI", 1], ["FU", 12, [0, 1, 2, 3]], ["SP", 12, 0, 32928, [2], 1], ["AN", 12, 0, 5], ["AN", 12, 1, 6], ["FU", 6, [0, 1, 2, 3]], ["AN", 6, 0, 5], ["FU", 6, [1, 2, 3, 4]], ["AN", 6, 1, 4], ["FU", 6, [2, 3, 4, 5]], ["AN", 6, 2, 6], ["FU", 4, [0, 1, 2, 3]], ["SP", 4, 0, 20, [1], 1], ["AN", 4, 1, 2], ["FFSP", 4, 0, [7, 6, 5, 4], 1, 1], ["AN", 4, 1, 6], ["FU", 2, [0, 1, 2, 3]], ["SP", 2, 0, 20, [1], 1], ["AN", 2, 1, 2], ["FFSP", 2, 0, [7, 6, 5, 4], 1, 1], ["AN", 2, 1, 6], ["PR", 5, 0, "auto_unroll_max_step$64"]]]], "r": [[2.48338e-05, 2.48355e-05, 2.48349e-05, 2.48332e-05, 2.48335e-05, 2.48324e-05, 2.48333e-05, 2.48356e-05, 2.48352e-05, 2.48339e-05], 0, 204.327, 1649226767], "v": "v0.6"}
{"i": [["[\"fused_depthwise_conv2d\", 14, 14, 672, 5, 5, [2, 2]]", "cuda -keys=cuda,gpu -max_num_threads=1024 -model=unknown -thread_warp_size=32", [-1, 16, 64, 49152, 2147483647, 1024, 8, 32], "", 0, []], [[], [["CI", 8], ["CI", 7], ["CI", 5], ["CHW", 3, "local"], ["SP", 3, 0, 1, [1, 1, 1, 1], 1], ["SP", 3, 5, 7, [1, 1, 1, 7], 1], ["SP", 3, 10, 7, [1, 1, 1, 1], 1], ["SP", 3, 15, 672, [1, 32, 3, 1], 1], ["SP", 3, 20, 5, [1, 5], 1], ["SP", 3, 23, 5, [1, 1], 1], ["RE", 3, [0, 5, 10, 15, 1, 6, 11, 16, 2, 7, 12, 17, 20, 23, 21, 24, 3, 8, 13, 18, 22, 25, 4, 9, 14, 19]], ["FSP", 4, 0, 4, 3], ["FSP", 4, 4, 5, 3], ["FSP", 4, 8, 6, 3], ["FSP", 4, 12, 7, 3], ["RE", 4, [0, 4, 8, 12, 1, 5, 9, 13, 2, 6, 10, 14, 3, 7, 11, 15]], ["CA", 3, 4, 11], ["CHR", 2, "shared", [3]], ["CA", 3, 4, 13], ["CHR", 1, "shared", [4]], ["CA", 2, 5, 13], ["CI", 1], ["FU", 12, [0, 1, 2, 3]], ["SP", 12, 0, 32928, [8], 1], ["AN", 12, 0, 5], ["AN", 12, 1, 6], ["FU", 6, [0, 1, 2, 3]], ["AN", 6, 0, 5], ["FU", 6, [1, 2, 3, 4]], ["AN", 6, 1, 4], ["FU", 6, [2, 3, 4, 5]], ["AN", 6, 2, 6], ["FU", 4, [0, 1, 2, 3]], ["SP", 4, 0, 15, [1], 1], ["AN", 4, 1, 2], ["FFSP", 4, 0, [7, 6, 5, 4], 1, 1], ["AN", 4, 1, 6], ["FU", 2, [0, 1, 2, 3]], ["SP", 2, 0, 51, [1], 1], ["AN", 2, 1, 2], ["FFSP", 2, 0, [7, 6, 5, 4], 1, 1], ["AN", 2, 1, 6], ["PR", 5, 0, "auto_unroll_max_step$64"]]]], "r": [[1.56414e-05, 1.56422e-05, 1.56414e-05, 1.56415e-05, 1.56418e-05, 1.56422e-05, 1.56425e-05, 1.56427e-05, 1.56413e-05, 1.56422e-05], 0, 209.32, 1649226772], "v": "v0.6"}
{"i": [["[\"fused_depthwise_conv2d\", 14, 14, 672, 5, 5, [2, 2]]", "cuda -keys=cuda,gpu -max_num_threads=1024 -model=unknown -thread_warp_size=32", [-1, 16, 64, 49152, 2147483647, 1024, 8, 32], "", 0, []], [[], [["CI", 8], ["CI", 7], ["CI", 5], ["CHW", 3, "local"], ["SP", 3, 0, 1, [1, 1, 1, 1], 1], ["SP", 3, 5, 7, [1, 7, 1, 1], 1], ["SP", 3, 10, 7, [1, 1, 1, 7], 1], ["SP", 3, 15, 672, [1, 7, 1, 2], 1], ["SP", 3, 20, 5, [5, 1], 1], ["SP", 3, 23, 5, [5, 1], 1], ["RE", 3, [0, 5, 10, 15, 1, 6, 11, 16, 2, 7, 12, 17, 20, 23, 21, 24, 3, 8, 13, 18, 22, 25, 4, 9, 14, 19]], ["FSP", 4, 0, 4, 3], ["FSP", 4, 4, 5, 3], ["FSP", 4, 8, 6, 3], ["FSP", 4, 12, 7, 3], ["RE", 4, [0, 4, 8, 12, 1, 5, 9, 13, 2, 6, 10, 14, 3, 7, 11, 15]], ["CA", 3, 4, 11], ["CHR", 2, "shared", [3]], ["CA", 3, 4, 13], ["CHR", 1, "shared", [4]], ["CA", 2, 5, 13], ["CI", 1], ["FU", 12, [0, 1, 2, 3]], ["SP", 12, 0, 32928, [32], 1], ["AN", 12, 0, 5], ["AN", 12, 1, 6], ["FU", 6, [0, 1, 2, 3]], ["AN", 6, 0, 5], ["FU", 6, [1, 2, 3, 4]], ["AN", 6, 1, 4], ["FU", 6, [2, 3, 4, 5]], ["AN", 6, 2, 6], ["FU", 4, [0, 1, 2, 3]], ["SP", 4, 0, 50, [1], 1], ["AN", 4, 1, 2], ["FFSP", 4, 0, [7, 6, 5, 4], 1, 1], ["AN", 4, 1, 6], ["FU", 2, [0, 1, 2, 3]], ["SP", 2, 0, 170, [17], 1], ["AN", 2, 1, 2], ["FFSP", 2, 0, [7, 6, 5, 4], 1, 1], ["AN", 2, 1, 6], ["PR", 5, 0, "auto_unroll_max_step$512"]]]], "r": [[1.42717e-05, 1.42736e-05, 1.42744e-05, 1.42723e-05, 1.4275e-05, 1.42738e-05, 1.42746e-05, 1.42745e-05, 1.42732e-05, 1.42735e-05], 0, 212.174, 1649226777], "v": "v0.6"}
{"i": [["[\"fused_depthwise_conv2d\", 14, 14, 672, 5, 5, [2, 2]]", "cuda -keys=cuda,gpu -max_num_threads=1024 -model=unknown -thread_warp_size=32", [-1, 16, 64, 49152, 2147483647, 1024, 8, 32], "", 0, []], [[], [["CI", 8], ["CI", 7], ["CI", 5], ["CHW", 3, "local"], ["SP", 3, 0, 1, [1, 1, 1, 1], 1], ["SP", 3, 5, 7, [1, 7, 1, 1], 1], ["SP", 3, 10, 7, [1, 7, 1, 1], 1], ["SP", 3, 15, 672, [1, 2, 1, 2], 1], ["SP", 3, 20, 5, [5, 1], 1], ["SP", 3, 23, 5, [5, 1], 1], ["RE", 3, [0, 5, 10, 15, 1, 6, 11, 16, 2, 7, 12, 17, 20, 23, 21, 24, 3, 8, 13, 18, 22, 25, 4, 9, 14, 19]], ["FSP", 4, 0, 4, 3], ["FSP", 4, 4, 5, 3], ["FSP", 4, 8, 6, 3], ["FSP", 4, 12, 7, 3], ["RE", 4, [0, 4, 8, 12, 1, 5, 9, 13, 2, 6, 10, 14, 3, 7, 11, 15]], ["CA", 3, 4, 11], ["CHR", 2, "shared", [3]], ["CA", 3, 4, 13], ["CHR", 1, "shared", [4]], ["CA", 2, 5, 13], ["CI", 1], ["FU", 12, [0, 1, 2, 3]], ["SP", 12, 0, 32928, [32], 1], ["AN", 12, 0, 5], ["AN", 12, 1, 6], ["FU", 6, [0, 1, 2, 3]], ["AN", 6, 0, 5], ["FU", 6, [1, 2, 3, 4]], ["AN", 6, 1, 4], ["FU", 6, [2, 3, 4, 5]], ["AN", 6, 2, 6], ["FU", 4, [0, 1, 2, 3]], ["SP", 4, 0, 50, [50], 1], ["AN", 4, 1, 2], ["FFSP", 4, 0, [7, 6, 5, 4], 1, 1], ["AN", 4, 1, 6], ["FU", 2, [0, 1, 2, 3]], ["SP", 2, 0, 50, [1], 1], ["AN", 2, 1, 2], ["FFSP", 2, 0, [7, 6, 5, 4], 1, 1], ["AN", 2, 1, 6], ["PR", 5, 0, "auto_unroll_max_step$64"]]]], "r": [[9.21618e-06, 9.21007e-06, 9.20793e-06, 9.22352e-06, 9.2188e-06, 9.21009e-06, 9.22185e-06, 9.22081e-06, 9.21906e-06, 9.21441e-06], 0, 209.393, 1649226781], "v": "v0.6"}
