python/models/efficientnet/kernel_configs/efficient_reudce_mean_7_7_1152.log
{"i": [["[\"reduce_mean\", 7, 7, 1152]", "cuda -keys=cuda,gpu -arch=sm_80 -max_num_threads=1024 -model=unknown -thread_warp_size=32", [-1, 16, 64, 49152, 2147483647, 1024, 8, 32], "", 0, []], [[], [["FU", 1, [2, 3]], ["SP", 2, 1, 1152, [12], 1], ["AN", 2, 2, 6], ["FSP", 1, 2, 1, 1], ["AN", 1, 3, 6], ["CA", 1, 2, 1], ["FU", 2, [0, 1]], ["AN", 2, 0, 5], ["PR", 1, 0, "auto_unroll_max_step$64"]]]], "r": [[4.75856e-06, 4.77415e-06, 4.77703e-06], 0, 2.23446, 1681118318], "v": "v0.6"}
{"i": [["[\"reduce_mean\", 7, 7, 1152]", "cuda -keys=cuda,gpu -arch=sm_80 -max_num_threads=1024 -model=unknown -thread_warp_size=32", [-1, 16, 64, 49152, 2147483647, 1024, 8, 32], "", 0, []], [[], [["FU", 2, [0, 1]], ["SP", 2, 0, 1152, [1], 1], ["AN", 2, 0, 5], ["AN", 2, 1, 6], ["FU", 1, [0, 1]], ["SP", 1, 0, 1152, [1], 1], ["AN", 1, 0, 5], ["AN", 1, 1, 6], ["PR", 1, 0, "auto_unroll_max_step$1024"]]]], "r": [[7.60142e-06, 7.61411e-06, 7.61592e-06], 0, 1.7579, 1681118318], "v": "v0.6"}
{"i": [["[\"reduce_mean\", 7, 7, 1152]", "cuda -keys=cuda,gpu -arch=sm_80 -max_num_threads=1024 -model=unknown -thread_warp_size=32", [-1, 16, 64, 49152, 2147483647, 1024, 8, 32], "", 0, []], [[], [["FU", 2, [0, 1]], ["SP", 2, 0, 1152, [4], 1], ["AN", 2, 0, 5], ["AN", 2, 1, 6], ["FU", 1, [0, 1]], ["SP", 1, 0, 1152, [16], 1], ["AN", 1, 0, 5], ["AN", 1, 1, 6], ["PR", 1, 0, "auto_unroll_max_step$64"]]]], "r": [[5.93142e-06, 5.90031e-06, 5.92676e-06], 0, 3.06565, 1681118319], "v": "v0.6"}
{"i": [["[\"reduce_mean\", 7, 7, 1152]", "cuda -keys=cuda,gpu -arch=sm_80 -max_num_threads=1024 -model=unknown -thread_warp_size=32", [-1, 16, 64, 49152, 2147483647, 1024, 8, 32], "", 0, []], [[], [["FU", 2, [0, 1]], ["SP", 2, 0, 1152, [32], 1], ["AN", 2, 0, 5], ["AN", 2, 1, 6], ["FU", 1, [0, 1]], ["SP", 1, 0, 1152, [6], 1], ["AN", 1, 0, 5], ["AN", 1, 1, 6], ["PR", 1, 0, "auto_unroll_max_step$0"]]]], "r": [[5.79506e-06, 5.73751e-06, 5.74581e-06], 0, 3.63388, 1681118320], "v": "v0.6"}
{"i": [["[\"reduce_mean\", 7, 7, 1152]", "cuda -keys=cuda,gpu -arch=sm_80 -max_num_threads=1024 -model=unknown -thread_warp_size=32", [-1, 16, 64, 49152, 2147483647, 1024, 8, 32], "", 0, []], [[], [["FU", 2, [0, 1]], ["SP", 2, 0, 1152, [1], 1], ["AN", 2, 0, 5], ["AN", 2, 1, 6], ["FU", 1, [0, 1]], ["SP", 1, 0, 1152, [32], 1], ["AN", 1, 0, 5], ["AN", 1, 1, 6], ["PR", 1, 0, "auto_unroll_max_step$64"]]]], "r": [[6.26041e-06, 6.2592e-06, 6.26322e-06], 0, 1.75606, 1681118317], "v": "v0.6"}
{"i": [["[\"reduce_mean\", 7, 7, 1152]", "cuda -keys=cuda,gpu -arch=sm_80 -max_num_threads=1024 -model=unknown -thread_warp_size=32", [-1, 16, 64, 49152, 2147483647, 1024, 8, 32], "", 0, []], [[], [["FU", 1, [2, 3]], ["SP", 2, 1, 1152, [48], 1], ["AN", 2, 2, 6], ["FSP", 1, 2, 1, 1], ["AN", 1, 3, 6], ["CA", 1, 2, 1], ["FU", 2, [0, 1]], ["AN", 2, 0, 5], ["PR", 1, 0, "auto_unroll_max_step$16"]]]], "r": [[1.67059e-05, 1.67199e-05, 1.67071e-05], 0, 2.83288, 1681118319], "v": "v0.6"}
{"i": [["[\"reduce_mean\", 7, 7, 1152]", "cuda -keys=cuda,gpu -arch=sm_80 -max_num_threads=1024 -model=unknown -thread_warp_size=32", [-1, 16, 64, 49152, 2147483647, 1024, 8, 32], "", 0, []], [[], [["FU", 2, [0, 1]], ["SP", 2, 0, 1152, [8], 1], ["AN", 2, 0, 5], ["AN", 2, 1, 6], ["FU", 1, [0, 1]], ["SP", 1, 0, 1152, [4], 1], ["AN", 1, 0, 5], ["AN", 1, 1, 6], ["PR", 1, 0, "auto_unroll_max_step$16"]]]], "r": [[6.16474e-06, 6.20259e-06, 6.17718e-06], 0, 5.55646, 1681118322], "v": "v0.6"}
{"i": [["[\"reduce_mean\", 7, 7, 1152]", "cuda -keys=cuda,gpu -arch=sm_80 -max_num_threads=1024 -model=unknown -thread_warp_size=32", [-1, 16, 64, 49152, 2147483647, 1024, 8, 32], "", 0, []], [[], [["FU", 2, [0, 1]], ["SP", 2, 0, 1152, [32], 1], ["AN", 2, 0, 5], ["AN", 2, 1, 6], ["FU", 1, [0, 1]], ["SP", 1, 0, 1152, [8], 1], ["AN", 1, 0, 5], ["AN", 1, 1, 6], ["PR", 1, 0, "auto_unroll_max_step$64"]]]], "r": [[5.64989e-06, 5.597e-06, 5.60219e-06], 0, 5.95226, 1681118322], "v": "v0.6"}
{"i": [["[\"reduce_mean\", 7, 7, 1152]", "cuda -keys=cuda,gpu -arch=sm_80 -max_num_threads=1024 -model=unknown -thread_warp_size=32", [-1, 16, 64, 49152, 2147483647, 1024, 8, 32], "", 0, []], [[], [["FU", 2, [0, 1]], ["SP", 2, 0, 1152, [4], 1], ["AN", 2, 0, 5], ["AN", 2, 1, 6], ["FU", 1, [0, 1]], ["SP", 1, 0, 1152, [32], 1], ["AN", 1, 0, 5], ["AN", 1, 1, 6], ["PR", 1, 0, "auto_unroll_max_step$64"]]]], "r": [[5.80284e-06, 5.81476e-06, 5.83239e-06], 0, 7.20629, 1681118323], "v": "v0.6"}
{"i": [["[\"reduce_mean\", 7, 7, 1152]", "cuda -keys=cuda,gpu -arch=sm_80 -max_num_threads=1024 -model=unknown -thread_warp_size=32", [-1, 16, 64, 49152, 2147483647, 1024, 8, 32], "", 0, []], [[], [["FU", 2, [0, 1]], ["SP", 2, 0, 1152, [6], 1], ["AN", 2, 0, 5], ["AN", 2, 1, 6], ["FU", 1, [0, 1]], ["SP", 1, 0, 1152, [32], 1], ["AN", 1, 0, 5], ["AN", 1, 1, 6], ["PR", 1, 0, "auto_unroll_max_step$1024"]]]], "r": [[5.73211e-06, 5.69535e-06, 5.70032e-06], 0, 6.4662, 1681118322], "v": "v0.6"}
{"i": [["[\"reduce_mean\", 7, 7, 1152]", "cuda -keys=cuda,gpu -arch=sm_80 -max_num_threads=1024 -model=unknown -thread_warp_size=32", [-1, 16, 64, 49152, 2147483647, 1024, 8, 32], "", 0, []], [[], [["FU", 2, [0, 1]], ["SP", 2, 0, 1152, [8], 1], ["AN", 2, 0, 5], ["AN", 2, 1, 6], ["FU", 1, [0, 1]], ["SP", 1, 0, 1152, [32], 1], ["AN", 1, 0, 5], ["AN", 1, 1, 6], ["PR", 1, 0, "auto_unroll_max_step$16"]]]], "r": [[5.71625e-06, 5.653e-06, 5.66492e-06], 0, 7.35181, 1681118324], "v": "v0.6"}
{"i": [["[\"reduce_mean\", 7, 7, 1152]", "cuda -keys=cuda,gpu -arch=sm_80 -max_num_threads=1024 -model=unknown -thread_warp_size=32", [-1, 16, 64, 49152, 2147483647, 1024, 8, 32], "", 0, []], [[], [["FU", 2, [0, 1]], ["SP", 2, 0, 1152, [1], 1], ["AN", 2, 0, 5], ["AN", 2, 1, 6], ["FU", 1, [0, 1]], ["SP", 1, 0, 1152, [2], 1], ["AN", 1, 0, 5], ["AN", 1, 1, 6], ["PR", 1, 0, "auto_unroll_max_step$512"]]]], "r": [[7.01802e-06, 7.03207e-06, 7.02589e-06], 0, 7.91543, 1681118324], "v": "v0.6"}
{"i": [["[\"reduce_mean\", 7, 7, 1152]", "cuda -keys=cuda,gpu -arch=sm_80 -max_num_threads=1024 -model=unknown -thread_warp_size=32", [-1, 16, 64, 49152, 2147483647, 1024, 8, 32], "", 0, []], [[], [["FU", 2, [0, 1]], ["SP", 2, 0, 1152, [1], 1], ["AN", 2, 0, 5], ["AN", 2, 1, 6], ["FU", 1, [0, 1]], ["SP", 1, 0, 1152, [64], 1], ["AN", 1, 0, 5], ["AN", 1, 1, 6], ["PR", 1, 0, "auto_unroll_max_step$0"]]]], "r": [[6.64682e-06, 6.66518e-06, 6.64682e-06], 0, 8.58717, 1681118325], "v": "v0.6"}
{"i": [["[\"reduce_mean\", 7, 7, 1152]", "cuda -keys=cuda,gpu -arch=sm_80 -max_num_threads=1024 -model=unknown -thread_warp_size=32", [-1, 16, 64, 49152, 2147483647, 1024, 8, 32], "", 0, []], [[], [["FU", 2, [0, 1]], ["SP", 2, 0, 1152, [64], 1], ["AN", 2, 0, 5], ["AN", 2, 1, 6], ["FU", 1, [0, 1]], ["SP", 1, 0, 1152, [4], 1], ["AN", 1, 0, 5], ["AN", 1, 1, 6], ["PR", 1, 0, "auto_unroll_max_step$1024"]]]], "r": [[5.88316e-06, 5.84738e-06, 5.84639e-06], 0, 8.11479, 1681118324], "v": "v0.6"}
{"i": [["[\"reduce_mean\", 7, 7, 1152]", "cuda -keys=cuda,gpu -arch=sm_80 -max_num_threads=1024 -model=unknown -thread_warp_size=32", [-1, 16, 64, 49152, 2147483647, 1024, 8, 32], "", 0, []], [[], [["FU", 2, [0, 1]], ["SP", 2, 0, 1152, [4], 1], ["AN", 2, 0, 5], ["AN", 2, 1, 6], ["FU", 1, [0, 1]], ["SP", 1, 0, 1152, [3], 1], ["AN", 1, 0, 5], ["AN", 1, 1, 6], ["PR", 1, 0, "auto_unroll_max_step$0"]]]], "r": [[6.22333e-06, 6.23836e-06, 6.24407e-06], 0, 6.77682, 1681118323], "v": "v0.6"}
{"i": [["[\"reduce_mean\", 7, 7, 1152]", "cuda -keys=cuda,gpu -arch=sm_80 -max_num_threads=1024 -model=unknown -thread_warp_size=32", [-1, 16, 64, 49152, 2147483647, 1024, 8, 32], "", 0, []], [[], [["FU", 2, [0, 1]], ["SP", 2, 0, 1152, [32], 1], ["AN", 2, 0, 5], ["AN", 2, 1, 6], ["FU", 1, [0, 1]], ["SP", 1, 0, 1152, [3], 1], ["AN", 1, 0, 5], ["AN", 1, 1, 6], ["PR", 1, 0, "auto_unroll_max_step$0"]]]], "r": [[6.05556e-06, 6.05854e-06, 6.0645e-06], 0, 10.4782, 1681118326], "v": "v0.6"}
{"i": [["[\"reduce_mean\", 7, 7, 1152]", "cuda -keys=cuda,gpu -arch=sm_80 -max_num_threads=1024 -model=unknown -thread_warp_size=32", [-1, 16, 64, 49152, 2147483647, 1024, 8, 32], "", 0, []], [[], [["FU", 1, [2, 3]], ["SP", 2, 1, 1152, [32], 1], ["AN", 2, 2, 6], ["FSP", 1, 2, 1, 1], ["AN", 1, 3, 6], ["CA", 1, 2, 1], ["FU", 2, [0, 1]], ["AN", 2, 0, 5], ["PR", 1, 0, "auto_unroll_max_step$0"]]]], "r": [[6.39441e-06, 6.40882e-06, 6.40782e-06], 0, 8.98436, 1681118325], "v": "v0.6"}
{"i": [["[\"reduce_mean\", 7, 7, 1152]", "cuda -keys=cuda,gpu -arch=sm_80 -max_num_threads=1024 -model=unknown -thread_warp_size=32", [-1, 16, 64, 49152, 2147483647, 1024, 8, 32], "", 0, []], [[], [["FU", 2, [0, 1]], ["SP", 2, 0, 1152, [32], 1], ["AN", 2, 0, 5], ["AN", 2, 1, 6], ["FU", 1, [0, 1]], ["SP", 1, 0, 1152, [32], 1], ["AN", 1, 0, 5], ["AN", 1, 1, 6], ["PR", 1, 0, "auto_unroll_max_step$512"]]]], "r": [[5.64069e-06, 5.59449e-06, 5.65162e-06], 0, 9.91664, 1681118326], "v": "v0.6"}
{"i": [["[\"reduce_mean\", 7, 7, 1152]", "cuda -keys=cuda,gpu -arch=sm_80 -max_num_threads=1024 -model=unknown -thread_warp_size=32", [-1, 16, 64, 49152, 2147483647, 1024, 8, 32], "", 0, []], [[], [["FU", 2, [0, 1]], ["SP", 2, 0, 1152, [2], 1], ["AN", 2, 0, 5], ["AN", 2, 1, 6], ["FU", 1, [0, 1]], ["SP", 1, 0, 1152, [1], 1], ["AN", 1, 0, 5], ["AN", 1, 1, 6], ["PR", 1, 0, "auto_unroll_max_step$16"]]]], "r": [[7.34044e-06, 7.35617e-06, 7.3528e-06], 0, 5.14929, 1681118321], "v": "v0.6"}
{"i": [["[\"reduce_mean\", 7, 7, 1152]", "cuda -keys=cuda,gpu -arch=sm_80 -max_num_threads=1024 -model=unknown -thread_warp_size=32", [-1, 16, 64, 49152, 2147483647, 1024, 8, 32], "", 0, []], [[], [["FU", 2, [0, 1]], ["SP", 2, 0, 1152, [1], 1], ["AN", 2, 0, 5], ["AN", 2, 1, 6], ["FU", 1, [0, 1]], ["SP", 1, 0, 1152, [32], 1], ["AN", 1, 0, 5], ["AN", 1, 1, 6], ["PR", 1, 0, "auto_unroll_max_step$512"]]]], "r": [[6.43402e-06, 6.45941e-06, 6.45941e-06], 0, 11.4066, 1681118327], "v": "v0.6"}
{"i": [["[\"reduce_mean\", 7, 7, 1152]", "cuda -keys=cuda,gpu -arch=sm_80 -max_num_threads=1024 -model=unknown -thread_warp_size=32", [-1, 16, 64, 49152, 2147483647, 1024, 8, 32], "", 0, []], [[], [["FU", 2, [0, 1]], ["SP", 2, 0, 1152, [36], 1], ["AN", 2, 0, 5], ["AN", 2, 1, 6], ["FU", 1, [0, 1]], ["SP", 1, 0, 1152, [32], 1], ["AN", 1, 0, 5], ["AN", 1, 1, 6], ["PR", 1, 0, "auto_unroll_max_step$0"]]]], "r": [[5.68044e-06, 5.63125e-06, 5.6243e-06], 0, 5.54676, 1681118321], "v": "v0.6"}
{"i": [["[\"reduce_mean\", 7, 7, 1152]", "cuda -keys=cuda,gpu -arch=sm_80 -max_num_threads=1024 -model=unknown -thread_warp_size=32", [-1, 16, 64, 49152, 2147483647, 1024, 8, 32], "", 0, []], [[], [["FU", 2, [0, 1]], ["SP", 2, 0, 1152, [32], 1], ["AN", 2, 0, 5], ["AN", 2, 1, 6], ["FU", 1, [0, 1]], ["SP", 1, 0, 1152, [18], 1], ["AN", 1, 0, 5], ["AN", 1, 1, 6], ["PR", 1, 0, "auto_unroll_max_step$16"]]]], "r": [[5.65663e-06, 5.6867e-06, 5.69344e-06], 0, 9.24061, 1681118325], "v": "v0.6"}
{"i": [["[\"reduce_mean\", 7, 7, 1152]", "cuda -keys=cuda,gpu -arch=sm_80 -max_num_threads=1024 -model=unknown -thread_warp_size=32", [-1, 16, 64, 49152, 2147483647, 1024, 8, 32], "", 0, []], [[], [["FU", 2, [0, 1]], ["SP", 2, 0, 1152, [24], 1], ["AN", 2, 0, 5], ["AN", 2, 1, 6], ["FU", 1, [0, 1]], ["SP", 1, 0, 1152, [2], 1], ["AN", 1, 0, 5], ["AN", 1, 1, 6], ["PR", 1, 0, "auto_unroll_max_step$16"]]]], "r": [[6.13622e-06, 6.13674e-06, 6.13622e-06], 0, 10.6469, 1681118327], "v": "v0.6"}
{"i": [["[\"reduce_mean\", 7, 7, 1152]", "cuda -keys=cuda,gpu -arch=sm_80 -max_num_threads=1024 -model=unknown -thread_warp_size=32", [-1, 16, 64, 49152, 2147483647, 1024, 8, 32], "", 0, []], [[], [["FU", 2, [0, 1]], ["SP", 2, 0, 1152, [64], 1], ["AN", 2, 0, 5], ["AN", 2, 1, 6], ["FU", 1, [0, 1]], ["SP", 1, 0, 1152, [16], 1], ["AN", 1, 0, 5], ["AN", 1, 1, 6], ["PR", 1, 0, "auto_unroll_max_step$0"]]]], "r": [[5.63622e-06, 5.6397e-06, 5.63871e-06], 0, 11.9202, 1681118328], "v": "v0.6"}
{"i": [["[\"reduce_mean\", 7, 7, 1152]", "cuda -keys=cuda,gpu -arch=sm_80 -max_num_threads=1024 -model=unknown -thread_warp_size=32", [-1, 16, 64, 49152, 2147483647, 1024, 8, 32], "", 0, []], [[], [["FU", 2, [0, 1]], ["SP", 2, 0, 1152, [64], 1], ["AN", 2, 0, 5], ["AN", 2, 1, 6], ["FU", 1, [0, 1]], ["SP", 1, 0, 1152, [1], 1], ["AN", 1, 0, 5], ["AN", 1, 1, 6], ["PR", 1, 0, "auto_unroll_max_step$64"]]]], "r": [[6.67274e-06, 6.68246e-06, 6.68894e-06], 0, 11.634, 1681118328], "v": "v0.6"}
{"i": [["[\"reduce_mean\", 7, 7, 1152]", "cuda -keys=cuda,gpu -arch=sm_80 -max_num_threads=1024 -model=unknown -thread_warp_size=32", [-1, 16, 64, 49152, 2147483647, 1024, 8, 32], "", 0, []], [[], [["FU", 2, [0, 1]], ["SP", 2, 0, 1152, [18], 1], ["AN", 2, 0, 5], ["AN", 2, 1, 6], ["FU", 1, [0, 1]], ["SP", 1, 0, 1152, [4], 1], ["AN", 1, 0, 5], ["AN", 1, 1, 6], ["PR", 1, 0, "auto_unroll_max_step$64"]]]], "r": [[6.05854e-06, 6.0814e-06, 6.07941e-06], 0, 12.4424, 1681118329], "v": "v0.6"}
{"i": [["[\"reduce_mean\", 7, 7, 1152]", "cuda -keys=cuda,gpu -arch=sm_80 -max_num_threads=1024 -model=unknown -thread_warp_size=32", [-1, 16, 64, 49152, 2147483647, 1024, 8, 32], "", 0, []], [[], [["FU", 2, [0, 1]], ["SP", 2, 0, 1152, [12], 1], ["AN", 2, 0, 5], ["AN", 2, 1, 6], ["FU", 1, [0, 1]], ["SP", 1, 0, 1152, [8], 1], ["AN", 1, 0, 5], ["AN", 1, 1, 6], ["PR", 1, 0, "auto_unroll_max_step$64"]]]], "r": [[5.69759e-06, 5.66492e-06, 5.65507e-06], 0, 12.3059, 1681118328], "v": "v0.6"}
{"i": [["[\"reduce_mean\", 7, 7, 1152]", "cuda -keys=cuda,gpu -arch=sm_80 -max_num_threads=1024 -model=unknown -thread_warp_size=32", [-1, 16, 64, 49152, 2147483647, 1024, 8, 32], "", 0, []], [[], [["FU", 2, [0, 1]], ["SP", 2, 0, 1152, [2], 1], ["AN", 2, 0, 5], ["AN", 2, 1, 6], ["FU", 1, [0, 1]], ["SP", 1, 0, 1152, [64], 1], ["AN", 1, 0, 5], ["AN", 1, 1, 6], ["PR", 1, 0, "auto_unroll_max_step$64"]]]], "r": [[6.13104e-06, 6.12845e-06, 6.14918e-06], 0, 13.5778, 1681118330], "v": "v0.6"}
{"i": [["[\"reduce_mean\", 7, 7, 1152]", "cuda -keys=cuda,gpu -arch=sm_80 -max_num_threads=1024 -model=unknown -thread_warp_size=32", [-1, 16, 64, 49152, 2147483647, 1024, 8, 32], "", 0, []], [[], [["FU", 1, [2, 3]], ["SP", 2, 1, 1152, [48], 1], ["AN", 2, 2, 6], ["FSP", 1, 2, 1, 1], ["AN", 1, 3, 6], ["CA", 1, 2, 1], ["FU", 2, [0, 1]], ["AN", 2, 0, 5], ["PR", 1, 0, "auto_unroll_max_step$0"]]]], "r": [[1.9065e-05, 1.90689e-05, 1.90573e-05], 0, 14.1834, 1681118331], "v": "v0.6"}
{"i": [["[\"reduce_mean\", 7, 7, 1152]", "cuda -keys=cuda,gpu -arch=sm_80 -max_num_threads=1024 -model=unknown -thread_warp_size=32", [-1, 16, 64, 49152, 2147483647, 1024, 8, 32], "", 0, []], [[], [["FU", 2, [0, 1]], ["SP", 2, 0, 1152, [32], 1], ["AN", 2, 0, 5], ["AN", 2, 1, 6], ["FU", 1, [0, 1]], ["SP", 1, 0, 1152, [2], 1], ["AN", 1, 0, 5], ["AN", 1, 1, 6], ["PR", 1, 0, "auto_unroll_max_step$64"]]]], "r": [[6.116e-06, 6.13259e-06, 6.13622e-06], 0, 14.3739, 1681118331], "v": "v0.6"}
{"i": [["[\"reduce_mean\", 7, 7, 1152]", "cuda -keys=cuda,gpu -arch=sm_80 -max_num_threads=1024 -model=unknown -thread_warp_size=32", [-1, 16, 64, 49152, 2147483647, 1024, 8, 32], "", 0, []], [[], [["FU", 2, [0, 1]], ["SP", 2, 0, 1152, [16], 1], ["AN", 2, 0, 5], ["AN", 2, 1, 6], ["FU", 1, [0, 1]], ["SP", 1, 0, 1152, [64], 1], ["AN", 1, 0, 5], ["AN", 1, 1, 6], ["PR", 1, 0, "auto_unroll_max_step$0"]]]], "r": [[5.85728e-06, 5.83654e-06, 5.83498e-06], 0, 14.7123, 1681118331], "v": "v0.6"}
{"i": [["[\"reduce_mean\", 7, 7, 1152]", "cuda -keys=cuda,gpu -arch=sm_80 -max_num_threads=1024 -model=unknown -thread_warp_size=32", [-1, 16, 64, 49152, 2147483647, 1024, 8, 32], "", 0, []], [[], [["FU", 1, [2, 3]], ["SP", 2, 1, 1152, [6], 1], ["AN", 2, 2, 6], ["FSP", 1, 2, 1, 1], ["AN", 1, 3, 6], ["CA", 1, 2, 1], ["FU", 2, [0, 1]], ["AN", 2, 0, 5], ["PR", 1, 0, "auto_unroll_max_step$0"]]]], "r": [[4.66544e-06, 4.67897e-06, 4.67856e-06], 0, 9.51926, 1681118326], "v": "v0.6"}
{"i": [["[\"reduce_mean\", 7, 7, 1152]", "cuda -keys=cuda,gpu -arch=sm_80 -max_num_threads=1024 -model=unknown -thread_warp_size=32", [-1, 16, 64, 49152, 2147483647, 1024, 8, 32], "", 0, []], [[], [["FU", 2, [0, 1]], ["SP", 2, 0, 1152, [32], 1], ["AN", 2, 0, 5], ["AN", 2, 1, 6], ["FU", 1, [0, 1]], ["SP", 1, 0, 1152, [8], 1], ["AN", 1, 0, 5], ["AN", 1, 1, 6], ["PR", 1, 0, "auto_unroll_max_step$1024"]]]], "r": [[5.62345e-06, 5.62137e-06, 5.62241e-06], 0, 2.40011, 1681118318], "v": "v0.6"}
{"i": [["[\"reduce_mean\", 7, 7, 1152]", "cuda -keys=cuda,gpu -arch=sm_80 -max_num_threads=1024 -model=unknown -thread_warp_size=32", [-1, 16, 64, 49152, 2147483647, 1024, 8, 32], "", 0, []], [[], [["FU", 2, [0, 1]], ["SP", 2, 0, 1152, [64], 1], ["AN", 2, 0, 5], ["AN", 2, 1, 6], ["FU", 1, [0, 1]], ["SP", 1, 0, 1152, [32], 1], ["AN", 1, 0, 5], ["AN", 1, 1, 6], ["PR", 1, 0, "auto_unroll_max_step$16"]]]], "r": [[5.5299e-06, 5.43997e-06, 5.42208e-06], 0, 2.96068, 1681118319], "v": "v0.6"}
{"i": [["[\"reduce_mean\", 7, 7, 1152]", "cuda -keys=cuda,gpu -arch=sm_80 -max_num_threads=1024 -model=unknown -thread_warp_size=32", [-1, 16, 64, 49152, 2147483647, 1024, 8, 32], "", 0, []], [[], [["FU", 2, [0, 1]], ["SP", 2, 0, 1152, [64], 1], ["AN", 2, 0, 5], ["AN", 2, 1, 6], ["FU", 1, [0, 1]], ["SP", 1, 0, 1152, [2], 1], ["AN", 1, 0, 5], ["AN", 1, 1, 6], ["PR", 1, 0, "auto_unroll_max_step$0"]]]], "r": [[6.03823e-06, 6.05119e-06, 6.0486e-06], 0, 4.07117, 1681118320], "v": "v0.6"}
{"i": [["[\"reduce_mean\", 7, 7, 1152]", "cuda -keys=cuda,gpu -arch=sm_80 -max_num_threads=1024 -model=unknown -thread_warp_size=32", [-1, 16, 64, 49152, 2147483647, 1024, 8, 32], "", 0, []], [[], [["FU", 2, [0, 1]], ["SP", 2, 0, 1152, [64], 1], ["AN", 2, 0, 5], ["AN", 2, 1, 6], ["FU", 1, [0, 1]], ["SP", 1, 0, 1152, [64], 1], ["AN", 1, 0, 5], ["AN", 1, 1, 6], ["PR", 1, 0, "auto_unroll_max_step$16"]]]], "r": [[5.78478e-06, 5.74702e-06, 5.72665e-06], 0, 4.27031, 1681118320], "v": "v0.6"}
{"i": [["[\"reduce_mean\", 7, 7, 1152]", "cuda -keys=cuda,gpu -arch=sm_80 -max_num_threads=1024 -model=unknown -thread_warp_size=32", [-1, 16, 64, 49152, 2147483647, 1024, 8, 32], "", 0, []], [[], [["FU", 2, [0, 1]], ["SP", 2, 0, 1152, [2], 1], ["AN", 2, 0, 5], ["AN", 2, 1, 6], ["FU", 1, [0, 1]], ["SP", 1, 0, 1152, [36], 1], ["AN", 1, 0, 5], ["AN", 1, 1, 6], ["PR", 1, 0, "auto_unroll_max_step$64"]]]], "r": [[6.29468e-06, 6.33951e-06, 6.32115e-06], 0, 4.54465, 1681118321], "v": "v0.6"}
{"i": [["[\"reduce_mean\", 7, 7, 1152]", "cuda -keys=cuda,gpu -arch=sm_80 -max_num_threads=1024 -model=unknown -thread_warp_size=32", [-1, 16, 64, 49152, 2147483647, 1024, 8, 32], "", 0, []], [[], [["FU", 1, [2, 3]], ["SP", 2, 1, 1152, [1], 1], ["AN", 2, 2, 6], ["FSP", 1, 2, 1, 1], ["AN", 1, 3, 6], ["CA", 1, 2, 1], ["FU", 2, [0, 1]], ["AN", 2, 0, 5], ["PR", 1, 0, "auto_unroll_max_step$16"]]]], "r": [[4.18697e-06, 4.19708e-06, 4.19747e-06], 0, 10.8066, 1681118327], "v": "v0.6"}
{"i": [["[\"reduce_mean\", 7, 7, 1152]", "cuda -keys=cuda,gpu -arch=sm_80 -max_num_threads=1024 -model=unknown -thread_warp_size=32", [-1, 16, 64, 49152, 2147483647, 1024, 8, 32], "", 0, []], [[], [["FU", 2, [0, 1]], ["SP", 2, 0, 1152, [32], 1], ["AN", 2, 0, 5], ["AN", 2, 1, 6], ["FU", 1, [0, 1]], ["SP", 1, 0, 1152, [16], 1], ["AN", 1, 0, 5], ["AN", 1, 1, 6], ["PR", 1, 0, "auto_unroll_max_step$0"]]]], "r": [[5.51499e-06, 5.48717e-06, 5.48618e-06], 0, 12.553, 1681118329], "v": "v0.6"}
{"i": [["[\"reduce_mean\", 7, 7, 1152]", "cuda -keys=cuda,gpu -arch=sm_80 -max_num_threads=1024 -model=unknown -thread_warp_size=32", [-1, 16, 64, 49152, 2147483647, 1024, 8, 32], "", 0, []], [[], [["FU", 1, [2, 3]], ["SP", 2, 1, 1152, [8], 1], ["AN", 2, 2, 6], ["FSP", 1, 2, 1, 1], ["AN", 1, 3, 6], ["CA", 1, 2, 1], ["FU", 2, [0, 1]], ["AN", 2, 0, 5], ["PR", 1, 0, "auto_unroll_max_step$0"]]]], "r": [[3.86102e-06, 3.87387e-06, 3.87203e-06], 0, 13.0449, 1681118329], "v": "v0.6"}
{"i": [["[\"reduce_mean\", 7, 7, 1152]", "cuda -keys=cuda,gpu -arch=sm_80 -max_num_threads=1024 -model=unknown -thread_warp_size=32", [-1, 16, 64, 49152, 2147483647, 1024, 8, 32], "", 0, []], [[], [["FU", 2, [0, 1]], ["SP", 2, 0, 1152, [32], 1], ["AN", 2, 0, 5], ["AN", 2, 1, 6], ["FU", 1, [0, 1]], ["SP", 1, 0, 1152, [16], 1], ["AN", 1, 0, 5], ["AN", 1, 1, 6], ["PR", 1, 0, "auto_unroll_max_step$16"]]]], "r": [[5.62032e-06, 5.65908e-06, 5.672e-06], 0, 13.8138, 1681118330], "v": "v0.6"}
{"i": [["[\"reduce_mean\", 7, 7, 1152]", "cuda -keys=cuda,gpu -arch=sm_80 -max_num_threads=1024 -model=unknown -thread_warp_size=32", [-1, 16, 64, 49152, 2147483647, 1024, 8, 32], "", 0, []], [[], [["FU", 1, [2, 3]], ["SP", 2, 1, 1152, [1], 1], ["AN", 2, 2, 6], ["FSP", 1, 2, 1, 1], ["AN", 1, 3, 6], ["CA", 1, 2, 1], ["FU", 2, [0, 1]], ["AN", 2, 0, 5], ["PR", 1, 0, "auto_unroll_max_step$1024"]]]], "r": [[4.18619e-06, 4.19747e-06, 4.19591e-06], 0, 14.8827, 1681118332], "v": "v0.6"}
{"i": [["[\"reduce_mean\", 7, 7, 1152]", "cuda -keys=cuda,gpu -arch=sm_80 -max_num_threads=1024 -model=unknown -thread_warp_size=32", [-1, 16, 64, 49152, 2147483647, 1024, 8, 32], "", 0, []], [[], [["FU", 2, [0, 1]], ["SP", 2, 0, 1152, [32], 1], ["AN", 2, 0, 5], ["AN", 2, 1, 6], ["FU", 1, [0, 1]], ["SP", 1, 0, 1152, [16], 1], ["AN", 1, 0, 5], ["AN", 1, 1, 6], ["PR", 1, 0, "auto_unroll_max_step$64"]]]], "r": [[5.72196e-06, 5.74114e-06, 5.75721e-06], 0, 14.7554, 1681118332], "v": "v0.6"}
{"i": [["[\"reduce_mean\", 7, 7, 1152]", "cuda -keys=cuda,gpu -arch=sm_80 -max_num_threads=1024 -model=unknown -thread_warp_size=32", [-1, 16, 64, 49152, 2147483647, 1024, 8, 32], "", 0, []], [[], [["FU", 2, [0, 1]], ["SP", 2, 0, 1152, [2], 1], ["AN", 2, 0, 5], ["AN", 2, 1, 6], ["FU", 1, [0, 1]], ["SP", 1, 0, 1152, [64], 1], ["AN", 1, 0, 5], ["AN", 1, 1, 6], ["PR", 1, 0, "auto_unroll_max_step$0"]]]], "r": [[6.12909e-06, 6.144e-06, 6.144e-06], 0, 14.7588, 1681118332], "v": "v0.6"}
{"i": [["[\"reduce_mean\", 7, 7, 1152]", "cuda -keys=cuda,gpu -arch=sm_80 -max_num_threads=1024 -model=unknown -thread_warp_size=32", [-1, 16, 64, 49152, 2147483647, 1024, 8, 32], "", 0, []], [[], [["FU", 2, [0, 1]], ["SP", 2, 0, 1152, [64], 1], ["AN", 2, 0, 5], ["AN", 2, 1, 6], ["FU", 1, [0, 1]], ["SP", 1, 0, 1152, [8], 1], ["AN", 1, 0, 5], ["AN", 1, 1, 6], ["PR", 1, 0, "auto_unroll_max_step$1024"]]]], "r": [[5.60205e-06, 5.61587e-06, 5.62863e-06], 0, 14.7504, 1681118333], "v": "v0.6"}
{"i": [["[\"reduce_mean\", 7, 7, 1152]", "cuda -keys=cuda,gpu -arch=sm_80 -max_num_threads=1024 -model=unknown -thread_warp_size=32", [-1, 16, 64, 49152, 2147483647, 1024, 8, 32], "", 0, []], [[], [["FU", 1, [2, 3]], ["SP", 2, 1, 1152, [9], 1], ["AN", 2, 2, 6], ["FSP", 1, 2, 1, 1], ["AN", 1, 3, 6], ["CA", 1, 2, 1], ["FU", 2, [0, 1]], ["AN", 2, 0, 5], ["PR", 1, 0, "auto_unroll_max_step$0"]]]], "r": [[5.03877e-06, 5.05087e-06, 5.04698e-06], 0, 14.7768, 1681118333], "v": "v0.6"}
{"i": [["[\"reduce_mean\", 7, 7, 1152]", "cuda -keys=cuda,gpu -arch=sm_80 -max_num_threads=1024 -model=unknown -thread_warp_size=32", [-1, 16, 64, 49152, 2147483647, 1024, 8, 32], "", 0, []], [[], [["FU", 2, [0, 1]], ["SP", 2, 0, 1152, [64], 1], ["AN", 2, 0, 5], ["AN", 2, 1, 6], ["FU", 1, [0, 1]], ["SP", 1, 0, 1152, [32], 1], ["AN", 1, 0, 5], ["AN", 1, 1, 6], ["PR", 1, 0, "auto_unroll_max_step$512"]]]], "r": [[5.57315e-06, 5.49382e-06, 5.52441e-06], 0, 14.8232, 1681118333], "v": "v0.6"}
{"i": [["[\"reduce_mean\", 7, 7, 1152]", "cuda -keys=cuda,gpu -arch=sm_80 -max_num_threads=1024 -model=unknown -thread_warp_size=32", [-1, 16, 64, 49152, 2147483647, 1024, 8, 32], "", 0, []], [[], [["FU", 1, [2, 3]], ["SP", 2, 1, 1152, [16], 1], ["AN", 2, 2, 6], ["FSP", 1, 2, 1, 1], ["AN", 1, 3, 6], ["CA", 1, 2, 1], ["FU", 2, [0, 1]], ["AN", 2, 0, 5], ["PR", 1, 0, "auto_unroll_max_step$0"]]]], "r": [[5.00896e-06, 5.0163e-06, 5.01674e-06], 0, 14.8064, 1681118334], "v": "v0.6"}
{"i": [["[\"reduce_mean\", 7, 7, 1152]", "cuda -keys=cuda,gpu -arch=sm_80 -max_num_threads=1024 -model=unknown -thread_warp_size=32", [-1, 16, 64, 49152, 2147483647, 1024, 8, 32], "", 0, []], [[], [["FU", 1, [2, 3]], ["SP", 2, 1, 1152, [1], 1], ["AN", 2, 2, 6], ["FSP", 1, 2, 1, 1], ["AN", 1, 3, 6], ["CA", 1, 2, 1], ["FU", 2, [0, 1]], ["AN", 2, 0, 5], ["PR", 1, 0, "auto_unroll_max_step$512"]]]], "r": [[4.25559e-06, 4.26585e-06, 4.26544e-06], 0, 14.7043, 1681118334], "v": "v0.6"}
{"i": [["[\"reduce_mean\", 7, 7, 1152]", "cuda -keys=cuda,gpu -arch=sm_80 -max_num_threads=1024 -model=unknown -thread_warp_size=32", [-1, 16, 64, 49152, 2147483647, 1024, 8, 32], "", 0, []], [[], [["FU", 2, [0, 1]], ["SP", 2, 0, 1152, [32], 1], ["AN", 2, 0, 5], ["AN", 2, 1, 6], ["FU", 1, [0, 1]], ["SP", 1, 0, 1152, [4], 1], ["AN", 1, 0, 5], ["AN", 1, 1, 6], ["PR", 1, 0, "auto_unroll_max_step$1024"]]]], "r": [[5.92883e-06, 5.92157e-06, 5.91328e-06], 0, 14.6674, 1681118334], "v": "v0.6"}
{"i": [["[\"reduce_mean\", 7, 7, 1152]", "cuda -keys=cuda,gpu -arch=sm_80 -max_num_threads=1024 -model=unknown -thread_warp_size=32", [-1, 16, 64, 49152, 2147483647, 1024, 8, 32], "", 0, []], [[], [["FU", 2, [0, 1]], ["SP", 2, 0, 1152, [8], 1], ["AN", 2, 0, 5], ["AN", 2, 1, 6], ["FU", 1, [0, 1]], ["SP", 1, 0, 1152, [64], 1], ["AN", 1, 0, 5], ["AN", 1, 1, 6], ["PR", 1, 0, "auto_unroll_max_step$16"]]]], "r": [[5.73699e-06, 5.75929e-06, 5.75566e-06], 0, 14.7017, 1681118335], "v": "v0.6"}
{"i": [["[\"reduce_mean\", 7, 7, 1152]", "cuda -keys=cuda,gpu -arch=sm_80 -max_num_threads=1024 -model=unknown -thread_warp_size=32", [-1, 16, 64, 49152, 2147483647, 1024, 8, 32], "", 0, []], [[], [["FU", 2, [0, 1]], ["SP", 2, 0, 1152, [32], 1], ["AN", 2, 0, 5], ["AN", 2, 1, 6], ["FU", 1, [0, 1]], ["SP", 1, 0, 1152, [32], 1], ["AN", 1, 0, 5], ["AN", 1, 1, 6], ["PR", 1, 0, "auto_unroll_max_step$0"]]]], "r": [[5.58123e-06, 5.55099e-06, 5.54019e-06], 0, 14.6186, 1681118335], "v": "v0.6"}
{"i": [["[\"reduce_mean\", 7, 7, 1152]", "cuda -keys=cuda,gpu -arch=sm_80 -max_num_threads=1024 -model=unknown -thread_warp_size=32", [-1, 16, 64, 49152, 2147483647, 1024, 8, 32], "", 0, []], [[], [["FU", 2, [0, 1]], ["SP", 2, 0, 1152, [32], 1], ["AN", 2, 0, 5], ["AN", 2, 1, 6], ["FU", 1, [0, 1]], ["SP", 1, 0, 1152, [32], 1], ["AN", 1, 0, 5], ["AN", 1, 1, 6], ["PR", 1, 0, "auto_unroll_max_step$64"]]]], "r": [[5.62529e-06, 5.47525e-06, 5.46481e-06], 0, 14.6057, 1681118335], "v": "v0.6"}
{"i": [["[\"reduce_mean\", 7, 7, 1152]", "cuda -keys=cuda,gpu -arch=sm_80 -max_num_threads=1024 -model=unknown -thread_warp_size=32", [-1, 16, 64, 49152, 2147483647, 1024, 8, 32], "", 0, []], [[], [["FU", 2, [0, 1]], ["SP", 2, 0, 1152, [8], 1], ["AN", 2, 0, 5], ["AN", 2, 1, 6], ["FU", 1, [0, 1]], ["SP", 1, 0, 1152, [8], 1], ["AN", 1, 0, 5], ["AN", 1, 1, 6], ["PR", 1, 0, "auto_unroll_max_step$512"]]]], "r": [[5.71174e-06, 5.72963e-06, 5.71522e-06], 0, 2.30473, 1681118363], "v": "v0.6"}
{"i": [["[\"reduce_mean\", 7, 7, 1152]", "cuda -keys=cuda,gpu -arch=sm_80 -max_num_threads=1024 -model=unknown -thread_warp_size=32", [-1, 16, 64, 49152, 2147483647, 1024, 8, 32], "", 0, []], [[], [["FU", 2, [0, 1]], ["SP", 2, 0, 1152, [4], 1], ["AN", 2, 0, 5], ["AN", 2, 1, 6], ["FU", 1, [0, 1]], ["SP", 1, 0, 1152, [4], 1], ["AN", 1, 0, 5], ["AN", 1, 1, 6], ["PR", 1, 0, "auto_unroll_max_step$64"]]]], "r": [[6.01697e-06, 6.03045e-06, 6.03408e-06], 0, 1.35525, 1681118362], "v": "v0.6"}
{"i": [["[\"reduce_mean\", 7, 7, 1152]", "cuda -keys=cuda,gpu -arch=sm_80 -max_num_threads=1024 -model=unknown -thread_warp_size=32", [-1, 16, 64, 49152, 2147483647, 1024, 8, 32], "", 0, []], [[], [["FU", 2, [0, 1]], ["SP", 2, 0, 1152, [64], 1], ["AN", 2, 0, 5], ["AN", 2, 1, 6], ["FU", 1, [0, 1]], ["SP", 1, 0, 1152, [18], 1], ["AN", 1, 0, 5], ["AN", 1, 1, 6], ["PR", 1, 0, "auto_unroll_max_step$0"]]]], "r": [[5.54282e-06, 5.46829e-06, 5.45487e-06], 0, 2.73752, 1681118364], "v": "v0.6"}
{"i": [["[\"reduce_mean\", 7, 7, 1152]", "cuda -keys=cuda,gpu -arch=sm_80 -max_num_threads=1024 -model=unknown -thread_warp_size=32", [-1, 16, 64, 49152, 2147483647, 1024, 8, 32], "", 0, []], [[], [["FU", 2, [0, 1]], ["SP", 2, 0, 1152, [64], 1], ["AN", 2, 0, 5], ["AN", 2, 1, 6], ["FU", 1, [0, 1]], ["SP", 1, 0, 1152, [2], 1], ["AN", 1, 0, 5], ["AN", 1, 1, 6], ["PR", 1, 0, "auto_unroll_max_step$1024"]]]], "r": [[6.33687e-06, 6.34776e-06, 6.34621e-06], 0, 1.52903, 1681118363], "v": "v0.6"}
{"i": [["[\"reduce_mean\", 7, 7, 1152]", "cuda -keys=cuda,gpu -arch=sm_80 -max_num_threads=1024 -model=unknown -thread_warp_size=32", [-1, 16, 64, 49152, 2147483647, 1024, 8, 32], "", 0, []], [[], [["FU", 2, [0, 1]], ["SP", 2, 0, 1152, [4], 1], ["AN", 2, 0, 5], ["AN", 2, 1, 6], ["FU", 1, [0, 1]], ["SP", 1, 0, 1152, [8], 1], ["AN", 1, 0, 5], ["AN", 1, 1, 6], ["PR", 1, 0, "auto_unroll_max_step$16"]]]], "r": [[6.19368e-06, 6.22002e-06, 6.21505e-06], 0, 1.88114, 1681118363], "v": "v0.6"}
{"i": [["[\"reduce_mean\", 7, 7, 1152]", "cuda -keys=cuda,gpu -arch=sm_80 -max_num_threads=1024 -model=unknown -thread_warp_size=32", [-1, 16, 64, 49152, 2147483647, 1024, 8, 32], "", 0, []], [[], [["FU", 2, [0, 1]], ["SP", 2, 0, 1152, [16], 1], ["AN", 2, 0, 5], ["AN", 2, 1, 6], ["FU", 1, [0, 1]], ["SP", 1, 0, 1152, [64], 1], ["AN", 1, 0, 5], ["AN", 1, 1, 6], ["PR", 1, 0, "auto_unroll_max_step$16"]]]], "r": [[5.72615e-06, 5.71671e-06, 5.72466e-06], 0, 3.48615, 1681118364], "v": "v0.6"}
{"i": [["[\"reduce_mean\", 7, 7, 1152]", "cuda -keys=cuda,gpu -arch=sm_80 -max_num_threads=1024 -model=unknown -thread_warp_size=32", [-1, 16, 64, 49152, 2147483647, 1024, 8, 32], "", 0, []], [[], [["FU", 2, [0, 1]], ["SP", 2, 0, 1152, [6], 1], ["AN", 2, 0, 5], ["AN", 2, 1, 6], ["FU", 1, [0, 1]], ["SP", 1, 0, 1152, [9], 1], ["AN", 1, 0, 5], ["AN", 1, 1, 6], ["PR", 1, 0, "auto_unroll_max_step$16"]]]], "r": [[5.90303e-06, 5.92092e-06, 5.92191e-06], 0, 4.93987, 1681118366], "v": "v0.6"}
{"i": [["[\"reduce_mean\", 7, 7, 1152]", "cuda -keys=cuda,gpu -arch=sm_80 -max_num_threads=1024 -model=unknown -thread_warp_size=32", [-1, 16, 64, 49152, 2147483647, 1024, 8, 32], "", 0, []], [[], [["FU", 1, [2, 3]], ["SP", 2, 1, 1152, [1], 1], ["AN", 2, 2, 6], ["FSP", 1, 2, 1, 1], ["AN", 1, 3, 6], ["CA", 1, 2, 1], ["FU", 2, [0, 1]], ["AN", 2, 0, 5], ["PR", 1, 0, "auto_unroll_max_step$64"]]]], "r": [[4.23868e-06, 4.25112e-06, 4.24839e-06], 0, 6.2189, 1681118367], "v": "v0.6"}
{"i": [["[\"reduce_mean\", 7, 7, 1152]", "cuda -keys=cuda,gpu -arch=sm_80 -max_num_threads=1024 -model=unknown -thread_warp_size=32", [-1, 16, 64, 49152, 2147483647, 1024, 8, 32], "", 0, []], [[], [["FU", 2, [0, 1]], ["SP", 2, 0, 1152, [16], 1], ["AN", 2, 0, 5], ["AN", 2, 1, 6], ["FU", 1, [0, 1]], ["SP", 1, 0, 1152, [16], 1], ["AN", 1, 0, 5], ["AN", 1, 1, 6], ["PR", 1, 0, "auto_unroll_max_step$512"]]]], "r": [[5.55822e-06, 5.55673e-06, 5.5771e-06], 0, 3.06021, 1681118364], "v": "v0.6"}
{"i": [["[\"reduce_mean\", 7, 7, 1152]", "cuda -keys=cuda,gpu -arch=sm_80 -max_num_threads=1024 -model=unknown -thread_warp_size=32", [-1, 16, 64, 49152, 2147483647, 1024, 8, 32], "", 0, []], [[], [["FU", 1, [2, 3]], ["SP", 2, 1, 1152, [4], 1], ["AN", 2, 2, 6], ["FSP", 1, 2, 1, 1], ["AN", 1, 3, 6], ["CA", 1, 2, 1], ["FU", 2, [0, 1]], ["AN", 2, 0, 5], ["PR", 1, 0, "auto_unroll_max_step$0"]]]], "r": [[4.12982e-06, 4.14071e-06, 4.13954e-06], 0, 5.6815, 1681118367], "v": "v0.6"}
{"i": [["[\"reduce_mean\", 7, 7, 1152]", "cuda -keys=cuda,gpu -arch=sm_80 -max_num_threads=1024 -model=unknown -thread_warp_size=32", [-1, 16, 64, 49152, 2147483647, 1024, 8, 32], "", 0, []], [[], [["FU", 1, [2, 3]], ["SP", 2, 1, 1152, [18], 1], ["AN", 2, 2, 6], ["FSP", 1, 2, 1, 1], ["AN", 1, 3, 6], ["CA", 1, 2, 1], ["FU", 2, [0, 1]], ["AN", 2, 0, 5], ["PR", 1, 0, "auto_unroll_max_step$16"]]]], "r": [[5.89738e-06, 5.91259e-06, 5.91306e-06], 0, 6.53448, 1681118368], "v": "v0.6"}
{"i": [["[\"reduce_mean\", 7, 7, 1152]", "cuda -keys=cuda,gpu -arch=sm_80 -max_num_threads=1024 -model=unknown -thread_warp_size=32", [-1, 16, 64, 49152, 2147483647, 1024, 8, 32], "", 0, []], [[], [["FU", 2, [0, 1]], ["SP", 2, 0, 1152, [48], 1], ["AN", 2, 0, 5], ["AN", 2, 1, 6], ["FU", 1, [0, 1]], ["SP", 1, 0, 1152, [48], 1], ["AN", 1, 0, 5], ["AN", 1, 1, 6], ["PR", 1, 0, "auto_unroll_max_step$64"]]]], "r": [[5.64417e-06, 5.6392e-06, 5.6248e-06], 0, 5.01053, 1681118366], "v": "v0.6"}
{"i": [["[\"reduce_mean\", 7, 7, 1152]", "cuda -keys=cuda,gpu -arch=sm_80 -max_num_threads=1024 -model=unknown -thread_warp_size=32", [-1, 16, 64, 49152, 2147483647, 1024, 8, 32], "", 0, []], [[], [["FU", 2, [0, 1]], ["SP", 2, 0, 1152, [4], 1], ["AN", 2, 0, 5], ["AN", 2, 1, 6], ["FU", 1, [0, 1]], ["SP", 1, 0, 1152, [6], 1], ["AN", 1, 0, 5], ["AN", 1, 1, 6], ["PR", 1, 0, "auto_unroll_max_step$64"]]]], "r": [[5.88514e-06, 5.8921e-06, 5.8921e-06], 0, 5.37359, 1681118367], "v": "v0.6"}
{"i": [["[\"reduce_mean\", 7, 7, 1152]", "cuda -keys=cuda,gpu -arch=sm_80 -max_num_threads=1024 -model=unknown -thread_warp_size=32", [-1, 16, 64, 49152, 2147483647, 1024, 8, 32], "", 0, []], [[], [["FU", 2, [0, 1]], ["SP", 2, 0, 1152, [64], 1], ["AN", 2, 0, 5], ["AN", 2, 1, 6], ["FU", 1, [0, 1]], ["SP", 1, 0, 1152, [1], 1], ["AN", 1, 0, 5], ["AN", 1, 1, 6], ["PR", 1, 0, "auto_unroll_max_step$0"]]]], "r": [[6.67382e-06, 6.69435e-06, 6.67436e-06], 0, 6.71983, 1681118368], "v": "v0.6"}
{"i": [["[\"reduce_mean\", 7, 7, 1152]", "cuda -keys=cuda,gpu -arch=sm_80 -max_num_threads=1024 -model=unknown -thread_warp_size=32", [-1, 16, 64, 49152, 2147483647, 1024, 8, 32], "", 0, []], [[], [["FU", 2, [0, 1]], ["SP", 2, 0, 1152, [64], 1], ["AN", 2, 0, 5], ["AN", 2, 1, 6], ["FU", 1, [0, 1]], ["SP", 1, 0, 1152, [64], 1], ["AN", 1, 0, 5], ["AN", 1, 1, 6], ["PR", 1, 0, "auto_unroll_max_step$64"]]]], "r": [[5.6099e-06, 5.58662e-06, 5.58187e-06], 0, 8.38117, 1681118370], "v": "v0.6"}
{"i": [["[\"reduce_mean\", 7, 7, 1152]", "cuda -keys=cuda,gpu -arch=sm_80 -max_num_threads=1024 -model=unknown -thread_warp_size=32", [-1, 16, 64, 49152, 2147483647, 1024, 8, 32], "", 0, []], [[], [["FU", 2, [0, 1]], ["SP", 2, 0, 1152, [48], 1], ["AN", 2, 0, 5], ["AN", 2, 1, 6], ["FU", 1, [0, 1]], ["SP", 1, 0, 1152, [8], 1], ["AN", 1, 0, 5], ["AN", 1, 1, 6], ["PR", 1, 0, "auto_unroll_max_step$64"]]]], "r": [[5.8449e-06, 5.87918e-06, 5.87272e-06], 0, 4.05332, 1681118365], "v": "v0.6"}
{"i": [["[\"reduce_mean\", 7, 7, 1152]", "cuda -keys=cuda,gpu -arch=sm_80 -max_num_threads=1024 -model=unknown -thread_warp_size=32", [-1, 16, 64, 49152, 2147483647, 1024, 8, 32], "", 0, []], [[], [["FU", 2, [0, 1]], ["SP", 2, 0, 1152, [4], 1], ["AN", 2, 0, 5], ["AN", 2, 1, 6], ["FU", 1, [0, 1]], ["SP", 1, 0, 1152, [2], 1], ["AN", 1, 0, 5], ["AN", 1, 1, 6], ["PR", 1, 0, "auto_unroll_max_step$64"]]]], "r": [[6.33584e-06, 6.34776e-06, 6.35036e-06], 0, 4.33425, 1681118366], "v": "v0.6"}
{"i": [["[\"reduce_mean\", 7, 7, 1152]", "cuda -keys=cuda,gpu -arch=sm_80 -max_num_threads=1024 -model=unknown -thread_warp_size=32", [-1, 16, 64, 49152, 2147483647, 1024, 8, 32], "", 0, []], [[], [["FU", 2, [0, 1]], ["SP", 2, 0, 1152, [1], 1], ["AN", 2, 0, 5], ["AN", 2, 1, 6], ["FU", 1, [0, 1]], ["SP", 1, 0, 1152, [1], 1], ["AN", 1, 0, 5], ["AN", 1, 1, 6], ["PR", 1, 0, "auto_unroll_max_step$0"]]]], "r": [[7.79908e-06, 7.86135e-06, 7.85953e-06], 0, 3.50998, 1681118365], "v": "v0.6"}
{"i": [["[\"reduce_mean\", 7, 7, 1152]", "cuda -keys=cuda,gpu -arch=sm_80 -max_num_threads=1024 -model=unknown -thread_warp_size=32", [-1, 16, 64, 49152, 2147483647, 1024, 8, 32], "", 0, []], [[], [["FU", 2, [0, 1]], ["SP", 2, 0, 1152, [36], 1], ["AN", 2, 0, 5], ["AN", 2, 1, 6], ["FU", 1, [0, 1]], ["SP", 1, 0, 1152, [1], 1], ["AN", 1, 0, 5], ["AN", 1, 1, 6], ["PR", 1, 0, "auto_unroll_max_step$1024"]]]], "r": [[6.78994e-06, 6.79858e-06, 6.79912e-06], 0, 8.64964, 1681118370], "v": "v0.6"}
{"i": [["[\"reduce_mean\", 7, 7, 1152]", "cuda -keys=cuda,gpu -arch=sm_80 -max_num_threads=1024 -model=unknown -thread_warp_size=32", [-1, 16, 64, 49152, 2147483647, 1024, 8, 32], "", 0, []], [[], [["FU", 2, [0, 1]], ["SP", 2, 0, 1152, [48], 1], ["AN", 2, 0, 5], ["AN", 2, 1, 6], ["FU", 1, [0, 1]], ["SP", 1, 0, 1152, [8], 1], ["AN", 1, 0, 5], ["AN", 1, 1, 6], ["PR", 1, 0, "auto_unroll_max_step$16"]]]], "r": [[5.66337e-06, 5.60478e-06, 5.597e-06], 0, 7.73419, 1681118369], "v": "v0.6"}
{"i": [["[\"reduce_mean\", 7, 7, 1152]", "cuda -keys=cuda,gpu -arch=sm_80 -max_num_threads=1024 -model=unknown -thread_warp_size=32", [-1, 16, 64, 49152, 2147483647, 1024, 8, 32], "", 0, []], [[], [["FU", 2, [0, 1]], ["SP", 2, 0, 1152, [9], 1], ["AN", 2, 0, 5], ["AN", 2, 1, 6], ["FU", 1, [0, 1]], ["SP", 1, 0, 1152, [8], 1], ["AN", 1, 0, 5], ["AN", 1, 1, 6], ["PR", 1, 0, "auto_unroll_max_step$64"]]]], "r": [[5.69237e-06, 5.78577e-06, 5.71721e-06], 0, 11.132, 1681118373], "v": "v0.6"}
{"i": [["[\"reduce_mean\", 7, 7, 1152]", "cuda -keys=cuda,gpu -arch=sm_80 -max_num_threads=1024 -model=unknown -thread_warp_size=32", [-1, 16, 64, 49152, 2147483647, 1024, 8, 32], "", 0, []], [[], [["FU", 2, [0, 1]], ["SP", 2, 0, 1152, [64], 1], ["AN", 2, 0, 5], ["AN", 2, 1, 6], ["FU", 1, [0, 1]], ["SP", 1, 0, 1152, [6], 1], ["AN", 1, 0, 5], ["AN", 1, 1, 6], ["PR", 1, 0, "auto_unroll_max_step$1024"]]]], "r": [[5.8295e-06, 5.8131e-06, 5.81062e-06], 0, 9.42008, 1681118371], "v": "v0.6"}
{"i": [["[\"reduce_mean\", 7, 7, 1152]", "cuda -keys=cuda,gpu -arch=sm_80 -max_num_threads=1024 -model=unknown -thread_warp_size=32", [-1, 16, 64, 49152, 2147483647, 1024, 8, 32], "", 0, []], [[], [["FU", 2, [0, 1]], ["SP", 2, 0, 1152, [64], 1], ["AN", 2, 0, 5], ["AN", 2, 1, 6], ["FU", 1, [0, 1]], ["SP", 1, 0, 1152, [36], 1], ["AN", 1, 0, 5], ["AN", 1, 1, 6], ["PR", 1, 0, "auto_unroll_max_step$0"]]]], "r": [[5.70131e-06, 5.67597e-06, 5.68392e-06], 0, 10.7766, 1681118372], "v": "v0.6"}
{"i": [["[\"reduce_mean\", 7, 7, 1152]", "cuda -keys=cuda,gpu -arch=sm_80 -max_num_threads=1024 -model=unknown -thread_warp_size=32", [-1, 16, 64, 49152, 2147483647, 1024, 8, 32], "", 0, []], [[], [["FU", 2, [0, 1]], ["SP", 2, 0, 1152, [6], 1], ["AN", 2, 0, 5], ["AN", 2, 1, 6], ["FU", 1, [0, 1]], ["SP", 1, 0, 1152, [16], 1], ["AN", 1, 0, 5], ["AN", 1, 1, 6], ["PR", 1, 0, "auto_unroll_max_step$1024"]]]], "r": [[5.62701e-06, 5.57807e-06, 5.58567e-06], 0, 9.81039, 1681118371], "v": "v0.6"}
{"i": [["[\"reduce_mean\", 7, 7, 1152]", "cuda -keys=cuda,gpu -arch=sm_80 -max_num_threads=1024 -model=unknown -thread_warp_size=32", [-1, 16, 64, 49152, 2147483647, 1024, 8, 32], "", 0, []], [[], [["FU", 2, [0, 1]], ["SP", 2, 0, 1152, [64], 1], ["AN", 2, 0, 5], ["AN", 2, 1, 6], ["FU", 1, [0, 1]], ["SP", 1, 0, 1152, [3], 1], ["AN", 1, 0, 5], ["AN", 1, 1, 6], ["PR", 1, 0, "auto_unroll_max_step$0"]]]], "r": [[5.84043e-06, 5.8285e-06, 5.83198e-06], 0, 8.1248, 1681118369], "v": "v0.6"}
{"i": [["[\"reduce_mean\", 7, 7, 1152]", "cuda -keys=cuda,gpu -arch=sm_80 -max_num_threads=1024 -model=unknown -thread_warp_size=32", [-1, 16, 64, 49152, 2147483647, 1024, 8, 32], "", 0, []], [[], [["FU", 2, [0, 1]], ["SP", 2, 0, 1152, [24], 1], ["AN", 2, 0, 5], ["AN", 2, 1, 6], ["FU", 1, [0, 1]], ["SP", 1, 0, 1152, [1], 1], ["AN", 1, 0, 5], ["AN", 1, 1, 6], ["PR", 1, 0, "auto_unroll_max_step$16"]]]], "r": [[6.94556e-06, 6.95118e-06, 6.96241e-06], 0, 10.4521, 1681118372], "v": "v0.6"}
{"i": [["[\"reduce_mean\", 7, 7, 1152]", "cuda -keys=cuda,gpu -arch=sm_80 -max_num_threads=1024 -model=unknown -thread_warp_size=32", [-1, 16, 64, 49152, 2147483647, 1024, 8, 32], "", 0, []], [[], [["FU", 2, [0, 1]], ["SP", 2, 0, 1152, [32], 1], ["AN", 2, 0, 5], ["AN", 2, 1, 6], ["FU", 1, [0, 1]], ["SP", 1, 0, 1152, [24], 1], ["AN", 1, 0, 5], ["AN", 1, 1, 6], ["PR", 1, 0, "auto_unroll_max_step$64"]]]], "r": [[5.56019e-06, 5.53116e-06, 5.50627e-06], 0, 7.24586, 1681118369], "v": "v0.6"}
{"i": [["[\"reduce_mean\", 7, 7, 1152]", "cuda -keys=cuda,gpu -arch=sm_80 -max_num_threads=1024 -model=unknown -thread_warp_size=32", [-1, 16, 64, 49152, 2147483647, 1024, 8, 32], "", 0, []], [[], [["FU", 2, [0, 1]], ["SP", 2, 0, 1152, [32], 1], ["AN", 2, 0, 5], ["AN", 2, 1, 6], ["FU", 1, [0, 1]], ["SP", 1, 0, 1152, [2], 1], ["AN", 1, 0, 5], ["AN", 1, 1, 6], ["PR", 1, 0, "auto_unroll_max_step$1024"]]]], "r": [[6.16189e-06, 6.17977e-06, 6.18126e-06], 0, 9.96573, 1681118371], "v": "v0.6"}
{"i": [["[\"reduce_mean\", 7, 7, 1152]", "cuda -keys=cuda,gpu -arch=sm_80 -max_num_threads=1024 -model=unknown -thread_warp_size=32", [-1, 16, 64, 49152, 2147483647, 1024, 8, 32], "", 0, []], [[], [["FU", 2, [0, 1]], ["SP", 2, 0, 1152, [8], 1], ["AN", 2, 0, 5], ["AN", 2, 1, 6], ["FU", 1, [0, 1]], ["SP", 1, 0, 1152, [32], 1], ["AN", 1, 0, 5], ["AN", 1, 1, 6], ["PR", 1, 0, "auto_unroll_max_step$64"]]]], "r": [[5.77242e-06, 5.77242e-06, 5.77404e-06], 0, 13.2175, 1681118375], "v": "v0.6"}
{"i": [["[\"reduce_mean\", 7, 7, 1152]", "cuda -keys=cuda,gpu -arch=sm_80 -max_num_threads=1024 -model=unknown -thread_warp_size=32", [-1, 16, 64, 49152, 2147483647, 1024, 8, 32], "", 0, []], [[], [["FU", 2, [0, 1]], ["SP", 2, 0, 1152, [32], 1], ["AN", 2, 0, 5], ["AN", 2, 1, 6], ["FU", 1, [0, 1]], ["SP", 1, 0, 1152, [1], 1], ["AN", 1, 0, 5], ["AN", 1, 1, 6], ["PR", 1, 0, "auto_unroll_max_step$64"]]]], "r": [[6.67112e-06, 6.68246e-06, 6.68408e-06], 0, 11.7648, 1681118373], "v": "v0.6"}
{"i": [["[\"reduce_mean\", 7, 7, 1152]", "cuda -keys=cuda,gpu -arch=sm_80 -max_num_threads=1024 -model=unknown -thread_warp_size=32", [-1, 16, 64, 49152, 2147483647, 1024, 8, 32], "", 0, []], [[], [["FU", 2, [0, 1]], ["SP", 2, 0, 1152, [32], 1], ["AN", 2, 0, 5], ["AN", 2, 1, 6], ["FU", 1, [0, 1]], ["SP", 1, 0, 1152, [24], 1], ["AN", 1, 0, 5], ["AN", 1, 1, 6], ["PR", 1, 0, "auto_unroll_max_step$0"]]]], "r": [[5.69535e-06, 5.72715e-06, 5.71323e-06], 0, 12.6214, 1681118374], "v": "v0.6"}
{"i": [["[\"reduce_mean\", 7, 7, 1152]", "cuda -keys=cuda,gpu -arch=sm_80 -max_num_threads=1024 -model=unknown -thread_warp_size=32", [-1, 16, 64, 49152, 2147483647, 1024, 8, 32], "", 0, []], [[], [["FU", 2, [0, 1]], ["SP", 2, 0, 1152, [12], 1], ["AN", 2, 0, 5], ["AN", 2, 1, 6], ["FU", 1, [0, 1]], ["SP", 1, 0, 1152, [32], 1], ["AN", 1, 0, 5], ["AN", 1, 1, 6], ["PR", 1, 0, "auto_unroll_max_step$512"]]]], "r": [[5.66405e-06, 5.59846e-06, 5.60443e-06], 0, 8.99543, 1681118370], "v": "v0.6"}
{"i": [["[\"reduce_mean\", 7, 7, 1152]", "cuda -keys=cuda,gpu -arch=sm_80 -max_num_threads=1024 -model=unknown -thread_warp_size=32", [-1, 16, 64, 49152, 2147483647, 1024, 8, 32], "", 0, []], [[], [["FU", 2, [0, 1]], ["SP", 2, 0, 1152, [36], 1], ["AN", 2, 0, 5], ["AN", 2, 1, 6], ["FU", 1, [0, 1]], ["SP", 1, 0, 1152, [64], 1], ["AN", 1, 0, 5], ["AN", 1, 1, 6], ["PR", 1, 0, "auto_unroll_max_step$0"]]]], "r": [[5.75149e-06, 5.73311e-06, 5.72715e-06], 0, 11.412, 1681118373], "v": "v0.6"}
{"i": [["[\"reduce_mean\", 7, 7, 1152]", "cuda -keys=cuda,gpu -arch=sm_80 -max_num_threads=1024 -model=unknown -thread_warp_size=32", [-1, 16, 64, 49152, 2147483647, 1024, 8, 32], "", 0, []], [[], [["FU", 1, [2, 3]], ["SP", 2, 1, 1152, [8], 1], ["AN", 2, 2, 6], ["FSP", 1, 2, 1, 1], ["AN", 1, 3, 6], ["CA", 1, 2, 1], ["FU", 2, [0, 1]], ["AN", 2, 0, 5], ["PR", 1, 0, "auto_unroll_max_step$64"]]]], "r": [[4.18412e-06, 4.20284e-06, 4.20321e-06], 0, 13.4638, 1681118375], "v": "v0.6"}
{"i": [["[\"reduce_mean\", 7, 7, 1152]", "cuda -keys=cuda,gpu -arch=sm_80 -max_num_threads=1024 -model=unknown -thread_warp_size=32", [-1, 16, 64, 49152, 2147483647, 1024, 8, 32], "", 0, []], [[], [["FU", 2, [0, 1]], ["SP", 2, 0, 1152, [2], 1], ["AN", 2, 0, 5], ["AN", 2, 1, 6], ["FU", 1, [0, 1]], ["SP", 1, 0, 1152, [48], 1], ["AN", 1, 0, 5], ["AN", 1, 1, 6], ["PR", 1, 0, "auto_unroll_max_step$64"]]]], "r": [[6.34059e-06, 6.35355e-06, 6.35463e-06], 0, 12.1199, 1681118374], "v": "v0.6"}
{"i": [["[\"reduce_mean\", 7, 7, 1152]", "cuda -keys=cuda,gpu -arch=sm_80 -max_num_threads=1024 -model=unknown -thread_warp_size=32", [-1, 16, 64, 49152, 2147483647, 1024, 8, 32], "", 0, []], [[], [["FU", 1, [2, 3]], ["SP", 2, 1, 1152, [2], 1], ["AN", 2, 2, 6], ["FSP", 1, 2, 1, 1], ["AN", 1, 3, 6], ["CA", 1, 2, 1], ["FU", 2, [0, 1]], ["AN", 2, 0, 5], ["PR", 1, 0, "auto_unroll_max_step$0"]]]], "r": [[4.67692e-06, 4.68923e-06, 4.69415e-06], 0, 12.5421, 1681118374], "v": "v0.6"}
{"i": [["[\"reduce_mean\", 7, 7, 1152]", "cuda -keys=cuda,gpu -arch=sm_80 -max_num_threads=1024 -model=unknown -thread_warp_size=32", [-1, 16, 64, 49152, 2147483647, 1024, 8, 32], "", 0, []], [[], [["FU", 2, [0, 1]], ["SP", 2, 0, 1152, [2], 1], ["AN", 2, 0, 5], ["AN", 2, 1, 6], ["FU", 1, [0, 1]], ["SP", 1, 0, 1152, [2], 1], ["AN", 1, 0, 5], ["AN", 1, 1, 6], ["PR", 1, 0, "auto_unroll_max_step$0"]]]], "r": [[6.81284e-06, 6.82373e-06, 6.86106e-06], 0, 13.9811, 1681118375], "v": "v0.6"}
{"i": [["[\"reduce_mean\", 7, 7, 1152]", "cuda -keys=cuda,gpu -arch=sm_80 -max_num_threads=1024 -model=unknown -thread_warp_size=32", [-1, 16, 64, 49152, 2147483647, 1024, 8, 32], "", 0, []], [[], [["FU", 2, [0, 1]], ["SP", 2, 0, 1152, [1], 1], ["AN", 2, 0, 5], ["AN", 2, 1, 6], ["FU", 1, [0, 1]], ["SP", 1, 0, 1152, [36], 1], ["AN", 1, 0, 5], ["AN", 1, 1, 6], ["PR", 1, 0, "auto_unroll_max_step$64"]]]], "r": [[6.77706e-06, 6.78692e-06, 6.79106e-06], 0, 14.061, 1681118376], "v": "v0.6"}
{"i": [["[\"reduce_mean\", 7, 7, 1152]", "cuda -keys=cuda,gpu -arch=sm_80 -max_num_threads=1024 -model=unknown -thread_warp_size=32", [-1, 16, 64, 49152, 2147483647, 1024, 8, 32], "", 0, []], [[], [["FU", 2, [0, 1]], ["SP", 2, 0, 1152, [4], 1], ["AN", 2, 0, 5], ["AN", 2, 1, 6], ["FU", 1, [0, 1]], ["SP", 1, 0, 1152, [2], 1], ["AN", 1, 0, 5], ["AN", 1, 1, 6], ["PR", 1, 0, "auto_unroll_max_step$1024"]]]], "r": [[6.37106e-06, 6.37603e-06, 6.38696e-06], 0, 14.3765, 1681118376], "v": "v0.6"}
{"i": [["[\"reduce_mean\", 7, 7, 1152]", "cuda -keys=cuda,gpu -arch=sm_80 -max_num_threads=1024 -model=unknown -thread_warp_size=32", [-1, 16, 64, 49152, 2147483647, 1024, 8, 32], "", 0, []], [[], [["FU", 2, [0, 1]], ["SP", 2, 0, 1152, [32], 1], ["AN", 2, 0, 5], ["AN", 2, 1, 6], ["FU", 1, [0, 1]], ["SP", 1, 0, 1152, [9], 1], ["AN", 1, 0, 5], ["AN", 1, 1, 6], ["PR", 1, 0, "auto_unroll_max_step$0"]]]], "r": [[5.67114e-06, 5.64937e-06, 5.64678e-06], 0, 7.05124, 1681118368], "v": "v0.6"}
{"i": [["[\"reduce_mean\", 7, 7, 1152]", "cuda -keys=cuda,gpu -arch=sm_80 -max_num_threads=1024 -model=unknown -thread_warp_size=32", [-1, 16, 64, 49152, 2147483647, 1024, 8, 32], "", 0, []], [[], [["FU", 2, [0, 1]], ["SP", 2, 0, 1152, [3], 1], ["AN", 2, 0, 5], ["AN", 2, 1, 6], ["FU", 1, [0, 1]], ["SP", 1, 0, 1152, [18], 1], ["AN", 1, 0, 5], ["AN", 1, 1, 6], ["PR", 1, 0, "auto_unroll_max_step$16"]]]], "r": [[5.78936e-06, 5.75981e-06, 5.79714e-06], 0, 14.685, 1681118376], "v": "v0.6"}
{"i": [["[\"reduce_mean\", 7, 7, 1152]", "cuda -keys=cuda,gpu -arch=sm_80 -max_num_threads=1024 -model=unknown -thread_warp_size=32", [-1, 16, 64, 49152, 2147483647, 1024, 8, 32], "", 0, []], [[], [["FU", 2, [0, 1]], ["SP", 2, 0, 1152, [2], 1], ["AN", 2, 0, 5], ["AN", 2, 1, 6], ["FU", 1, [0, 1]], ["SP", 1, 0, 1152, [32], 1], ["AN", 1, 0, 5], ["AN", 1, 1, 6], ["PR", 1, 0, "auto_unroll_max_step$0"]]]], "r": [[5.89359e-06, 5.89856e-06, 5.89657e-06], 0, 14.8264, 1681118377], "v": "v0.6"}
{"i": [["[\"reduce_mean\", 7, 7, 1152]", "cuda -keys=cuda,gpu -arch=sm_80 -max_num_threads=1024 -model=unknown -thread_warp_size=32", [-1, 16, 64, 49152, 2147483647, 1024, 8, 32], "", 0, []], [[], [["FU", 2, [0, 1]], ["SP", 2, 0, 1152, [64], 1], ["AN", 2, 0, 5], ["AN", 2, 1, 6], ["FU", 1, [0, 1]], ["SP", 1, 0, 1152, [32], 1], ["AN", 1, 0, 5], ["AN", 1, 1, 6], ["PR", 1, 0, "auto_unroll_max_step$0"]]]], "r": [[5.58663e-06, 5.53323e-06, 5.56123e-06], 0, 14.6795, 1681118377], "v": "v0.6"}
{"i": [["[\"reduce_mean\", 7, 7, 1152]", "cuda -keys=cuda,gpu -arch=sm_80 -max_num_threads=1024 -model=unknown -thread_warp_size=32", [-1, 16, 64, 49152, 2147483647, 1024, 8, 32], "", 0, []], [[], [["FU", 2, [0, 1]], ["SP", 2, 0, 1152, [32], 1], ["AN", 2, 0, 5], ["AN", 2, 1, 6], ["FU", 1, [0, 1]], ["SP", 1, 0, 1152, [2], 1], ["AN", 1, 0, 5], ["AN", 1, 1, 6], ["PR", 1, 0, "auto_unroll_max_step$16"]]]], "r": [[6.13374e-06, 6.13914e-06, 6.13968e-06], 0, 14.6207, 1681118377], "v": "v0.6"}
{"i": [["[\"reduce_mean\", 7, 7, 1152]", "cuda -keys=cuda,gpu -arch=sm_80 -max_num_threads=1024 -model=unknown -thread_warp_size=32", [-1, 16, 64, 49152, 2147483647, 1024, 8, 32], "", 0, []], [[], [["FU", 2, [0, 1]], ["SP", 2, 0, 1152, [8], 1], ["AN", 2, 0, 5], ["AN", 2, 1, 6], ["FU", 1, [0, 1]], ["SP", 1, 0, 1152, [48], 1], ["AN", 1, 0, 5], ["AN", 1, 1, 6], ["PR", 1, 0, "auto_unroll_max_step$1024"]]]], "r": [[5.65715e-06, 5.63226e-06, 5.66181e-06], 0, 14.6643, 1681118378], "v": "v0.6"}
{"i": [["[\"reduce_mean\", 7, 7, 1152]", "cuda -keys=cuda,gpu -arch=sm_80 -max_num_threads=1024 -model=unknown -thread_warp_size=32", [-1, 16, 64, 49152, 2147483647, 1024, 8, 32], "", 0, []], [[], [["FU", 2, [0, 1]], ["SP", 2, 0, 1152, [18], 1], ["AN", 2, 0, 5], ["AN", 2, 1, 6], ["FU", 1, [0, 1]], ["SP", 1, 0, 1152, [16], 1], ["AN", 1, 0, 5], ["AN", 1, 1, 6], ["PR", 1, 0, "auto_unroll_max_step$64"]]]], "r": [[5.62863e-06, 5.61619e-06, 5.63952e-06], 0, 14.5462, 1681118378], "v": "v0.6"}
{"i": [["[\"reduce_mean\", 7, 7, 1152]", "cuda -keys=cuda,gpu -arch=sm_80 -max_num_threads=1024 -model=unknown -thread_warp_size=32", [-1, 16, 64, 49152, 2147483647, 1024, 8, 32], "", 0, []], [[], [["FU", 1, [2, 3]], ["SP", 2, 1, 1152, [18], 1], ["AN", 2, 2, 6], ["FSP", 1, 2, 1, 1], ["AN", 1, 3, 6], ["CA", 1, 2, 1], ["FU", 2, [0, 1]], ["AN", 2, 0, 5], ["PR", 1, 0, "auto_unroll_max_step$0"]]]], "r": [[5.70969e-06, 5.72442e-06, 5.71302e-06], 0, 14.5289, 1681118378], "v": "v0.6"}
{"i": [["[\"reduce_mean\", 7, 7, 1152]", "cuda -keys=cuda,gpu -arch=sm_80 -max_num_threads=1024 -model=unknown -thread_warp_size=32", [-1, 16, 64, 49152, 2147483647, 1024, 8, 32], "", 0, []], [[], [["FU", 2, [0, 1]], ["SP", 2, 0, 1152, [1], 1], ["AN", 2, 0, 5], ["AN", 2, 1, 6], ["FU", 1, [0, 1]], ["SP", 1, 0, 1152, [1], 1], ["AN", 1, 0, 5], ["AN", 1, 1, 6], ["PR", 1, 0, "auto_unroll_max_step$64"]]]], "r": [[7.74528e-06, 7.76281e-06, 7.76221e-06], 0, 14.5572, 1681118379], "v": "v0.6"}
{"i": [["[\"reduce_mean\", 7, 7, 1152]", "cuda -keys=cuda,gpu -arch=sm_80 -max_num_threads=1024 -model=unknown -thread_warp_size=32", [-1, 16, 64, 49152, 2147483647, 1024, 8, 32], "", 0, []], [[], [["FU", 2, [0, 1]], ["SP", 2, 0, 1152, [8], 1], ["AN", 2, 0, 5], ["AN", 2, 1, 6], ["FU", 1, [0, 1]], ["SP", 1, 0, 1152, [16], 1], ["AN", 1, 0, 5], ["AN", 1, 1, 6], ["PR", 1, 0, "auto_unroll_max_step$16"]]]], "r": [[5.70678e-06, 5.67299e-06, 5.68491e-06], 0, 14.5598, 1681118379], "v": "v0.6"}
{"i": [["[\"reduce_mean\", 7, 7, 1152]", "cuda -keys=cuda,gpu -arch=sm_80 -max_num_threads=1024 -model=unknown -thread_warp_size=32", [-1, 16, 64, 49152, 2147483647, 1024, 8, 32], "", 0, []], [[], [["FU", 1, [2, 3]], ["SP", 2, 1, 1152, [3], 1], ["AN", 2, 2, 6], ["FSP", 1, 2, 1, 1], ["AN", 1, 3, 6], ["CA", 1, 2, 1], ["FU", 2, [0, 1]], ["AN", 2, 0, 5], ["PR", 1, 0, "auto_unroll_max_step$0"]]]], "r": [[4.88798e-06, 4.94501e-06, 4.94458e-06], 0, 14.5248, 1681118379], "v": "v0.6"}
{"i": [["[\"reduce_mean\", 7, 7, 1152]", "cuda -keys=cuda,gpu -arch=sm_80 -max_num_threads=1024 -model=unknown -thread_warp_size=32", [-1, 16, 64, 49152, 2147483647, 1024, 8, 32], "", 0, []], [[], [["FU", 2, [0, 1]], ["SP", 2, 0, 1152, [64], 1], ["AN", 2, 0, 5], ["AN", 2, 1, 6], ["FU", 1, [0, 1]], ["SP", 1, 0, 1152, [64], 1], ["AN", 1, 0, 5], ["AN", 1, 1, 6], ["PR", 1, 0, "auto_unroll_max_step$512"]]]], "r": [[5.66544e-06, 5.66803e-06, 5.69188e-06], 0, 14.5274, 1681118380], "v": "v0.6"}
{"i": [["[\"reduce_mean\", 7, 7, 1152]", "cuda -keys=cuda,gpu -arch=sm_80 -max_num_threads=1024 -model=unknown -thread_warp_size=32", [-1, 16, 64, 49152, 2147483647, 1024, 8, 32], "", 0, []], [[], [["FU", 1, [2, 3]], ["SP", 2, 1, 1152, [18], 1], ["AN", 2, 2, 6], ["FSP", 1, 2, 1, 1], ["AN", 1, 3, 6], ["CA", 1, 2, 1], ["FU", 2, [0, 1]], ["AN", 2, 0, 5], ["PR", 1, 0, "auto_unroll_max_step$64"]]]], "r": [[5.74946e-06, 5.75671e-06, 5.75989e-06], 0, 14.451, 1681118380], "v": "v0.6"}
{"i": [["[\"reduce_mean\", 7, 7, 1152]", "cuda -keys=cuda,gpu -arch=sm_80 -max_num_threads=1024 -model=unknown -thread_warp_size=32", [-1, 16, 64, 49152, 2147483647, 1024, 8, 32], "", 0, []], [[], [["FU", 2, [0, 1]], ["SP", 2, 0, 1152, [18], 1], ["AN", 2, 0, 5], ["AN", 2, 1, 6], ["FU", 1, [0, 1]], ["SP", 1, 0, 1152, [36], 1], ["AN", 1, 0, 5], ["AN", 1, 1, 6], ["PR", 1, 0, "auto_unroll_max_step$512"]]]], "r": [[5.90849e-06, 5.91595e-06, 5.91297e-06], 0, 14.4685, 1681118380], "v": "v0.6"}
{"i": [["[\"reduce_mean\", 7, 7, 1152]", "cuda -keys=cuda,gpu -arch=sm_80 -max_num_threads=1024 -model=unknown -thread_warp_size=32", [-1, 16, 64, 49152, 2147483647, 1024, 8, 32], "", 0, []], [[], [["FU", 2, [0, 1]], ["SP", 2, 0, 1152, [36], 1], ["AN", 2, 0, 5], ["AN", 2, 1, 6], ["FU", 1, [0, 1]], ["SP", 1, 0, 1152, [16], 1], ["AN", 1, 0, 5], ["AN", 1, 1, 6], ["PR", 1, 0, "auto_unroll_max_step$64"]]]], "r": [[5.72205e-06, 5.73012e-06, 5.7401e-06], 0, 14.5313, 1681118381], "v": "v0.6"}
{"i": [["[\"reduce_mean\", 7, 7, 1152]", "cuda -keys=cuda,gpu -arch=sm_80 -max_num_threads=1024 -model=unknown -thread_warp_size=32", [-1, 16, 64, 49152, 2147483647, 1024, 8, 32], "", 0, []], [[], [["FU", 1, [2, 3]], ["SP", 2, 1, 1152, [36], 1], ["AN", 2, 2, 6], ["FSP", 1, 2, 1, 1], ["AN", 1, 3, 6], ["CA", 1, 2, 1], ["FU", 2, [0, 1]], ["AN", 2, 0, 5], ["PR", 1, 0, "auto_unroll_max_step$64"]]]], "r": [[1.17496e-05, 1.17453e-05, 1.17522e-05], 0, 14.5327, 1681118381], "v": "v0.6"}
{"i": [["[\"reduce_mean\", 7, 7, 1152]", "cuda -keys=cuda,gpu -arch=sm_80 -max_num_threads=1024 -model=unknown -thread_warp_size=32", [-1, 16, 64, 49152, 2147483647, 1024, 8, 32], "", 0, []], [[], [["FU", 1, [2, 3]], ["SP", 2, 1, 1152, [24], 1], ["AN", 2, 2, 6], ["FSP", 1, 2, 1, 1], ["AN", 1, 3, 6], ["CA", 1, 2, 1], ["FU", 2, [0, 1]], ["AN", 2, 0, 5], ["PR", 1, 0, "auto_unroll_max_step$64"]]]], "r": [[5.65029e-06, 5.66883e-06, 5.66835e-06], 0, 14.4434, 1681118382], "v": "v0.6"}
{"i": [["[\"reduce_mean\", 7, 7, 1152]", "cuda -keys=cuda,gpu -arch=sm_80 -max_num_threads=1024 -model=unknown -thread_warp_size=32", [-1, 16, 64, 49152, 2147483647, 1024, 8, 32], "", 0, []], [[], [["FU", 2, [0, 1]], ["SP", 2, 0, 1152, [32], 1], ["AN", 2, 0, 5], ["AN", 2, 1, 6], ["FU", 1, [0, 1]], ["SP", 1, 0, 1152, [16], 1], ["AN", 1, 0, 5], ["AN", 1, 1, 6], ["PR", 1, 0, "auto_unroll_max_step$1024"]]]], "r": [[5.51996e-06, 5.48717e-06, 5.48965e-06], 0, 14.5092, 1681118382], "v": "v0.6"}
{"i": [["[\"reduce_mean\", 7, 7, 1152]", "cuda -keys=cuda,gpu -arch=sm_80 -max_num_threads=1024 -model=unknown -thread_warp_size=32", [-1, 16, 64, 49152, 2147483647, 1024, 8, 32], "", 0, []], [[], [["FU", 1, [2, 3]], ["SP", 2, 1, 1152, [32], 1], ["AN", 2, 2, 6], ["FSP", 1, 2, 1, 1], ["AN", 1, 3, 6], ["CA", 1, 2, 1], ["FU", 2, [0, 1]], ["AN", 2, 0, 5], ["PR", 1, 0, "auto_unroll_max_step$16"]]]], "r": [[6.16934e-06, 6.18176e-06, 6.18077e-06], 0, 14.4704, 1681118382], "v": "v0.6"}
{"i": [["[\"reduce_mean\", 7, 7, 1152]", "cuda -keys=cuda,gpu -arch=sm_80 -max_num_threads=1024 -model=unknown -thread_warp_size=32", [-1, 16, 64, 49152, 2147483647, 1024, 8, 32], "", 0, []], [[], [["FU", 2, [0, 1]], ["SP", 2, 0, 1152, [32], 1], ["AN", 2, 0, 5], ["AN", 2, 1, 6], ["FU", 1, [0, 1]], ["SP", 1, 0, 1152, [32], 1], ["AN", 1, 0, 5], ["AN", 1, 1, 6], ["PR", 1, 0, "auto_unroll_max_step$1024"]]]], "r": [[5.68193e-06, 5.56816e-06, 5.58952e-06], 0, 14.4487, 1681118383], "v": "v0.6"}
{"i": [["[\"reduce_mean\", 7, 7, 1152]", "cuda -keys=cuda,gpu -arch=sm_80 -max_num_threads=1024 -model=unknown -thread_warp_size=32", [-1, 16, 64, 49152, 2147483647, 1024, 8, 32], "", 0, []], [[], [["FU", 2, [0, 1]], ["SP", 2, 0, 1152, [4], 1], ["AN", 2, 0, 5], ["AN", 2, 1, 6], ["FU", 1, [0, 1]], ["SP", 1, 0, 1152, [64], 1], ["AN", 1, 0, 5], ["AN", 1, 1, 6], ["PR", 1, 0, "auto_unroll_max_step$1024"]]]], "r": [[5.8916e-06, 5.90204e-06, 5.90651e-06], 0, 14.5074, 1681118383], "v": "v0.6"}
{"i": [["[\"reduce_mean\", 7, 7, 1152]", "cuda -keys=cuda,gpu -arch=sm_80 -max_num_threads=1024 -model=unknown -thread_warp_size=32", [-1, 16, 64, 49152, 2147483647, 1024, 8, 32], "", 0, []], [[], [["FU", 1, [2, 3]], ["SP", 2, 1, 1152, [8], 1], ["AN", 2, 2, 6], ["FSP", 1, 2, 1, 1], ["AN", 1, 3, 6], ["CA", 1, 2, 1], ["FU", 2, [0, 1]], ["AN", 2, 0, 5], ["PR", 1, 0, "auto_unroll_max_step$16"]]]], "r": [[4.01203e-06, 4.02136e-06, 4.01203e-06], 0, 1.7754, 1681118410], "v": "v0.6"}
{"i": [["[\"reduce_mean\", 7, 7, 1152]", "cuda -keys=cuda,gpu -arch=sm_80 -max_num_threads=1024 -model=unknown -thread_warp_size=32", [-1, 16, 64, 49152, 2147483647, 1024, 8, 32], "", 0, []], [[], [["FU", 1, [2, 3]], ["SP", 2, 1, 1152, [4], 1], ["AN", 2, 2, 6], ["FSP", 1, 2, 1, 1], ["AN", 1, 3, 6], ["CA", 1, 2, 1], ["FU", 2, [0, 1]], ["AN", 2, 0, 5], ["PR", 1, 0, "auto_unroll_max_step$16"]]]], "r": [[3.5576e-06, 3.56796e-06, 3.56829e-06], 0, 1.98906, 1681118411], "v": "v0.6"}
{"i": [["[\"reduce_mean\", 7, 7, 1152]", "cuda -keys=cuda,gpu -arch=sm_80 -max_num_threads=1024 -model=unknown -thread_warp_size=32", [-1, 16, 64, 49152, 2147483647, 1024, 8, 32], "", 0, []], [[], [["FU", 1, [2, 3]], ["SP", 2, 1, 1152, [1], 1], ["AN", 2, 2, 6], ["FSP", 1, 2, 1, 1], ["AN", 1, 3, 6], ["CA", 1, 2, 1], ["FU", 2, [0, 1]], ["AN", 2, 0, 5], ["PR", 1, 0, "auto_unroll_max_step$0"]]]], "r": [[4.35117e-06, 4.37541e-06, 4.37614e-06], 0, 2.19399, 1681118411], "v": "v0.6"}
{"i": [["[\"reduce_mean\", 7, 7, 1152]", "cuda -keys=cuda,gpu -arch=sm_80 -max_num_threads=1024 -model=unknown -thread_warp_size=32", [-1, 16, 64, 49152, 2147483647, 1024, 8, 32], "", 0, []], [[], [["FU", 1, [2, 3]], ["SP", 2, 1, 1152, [6], 1], ["AN", 2, 2, 6], ["FSP", 1, 2, 1, 1], ["AN", 1, 3, 6], ["CA", 1, 2, 1], ["FU", 2, [0, 1]], ["AN", 2, 0, 5], ["PR", 1, 0, "auto_unroll_max_step$64"]]]], "r": [[3.62053e-06, 3.63338e-06, 3.63669e-06], 0, 4.33992, 1681118413], "v": "v0.6"}
{"i": [["[\"reduce_mean\", 7, 7, 1152]", "cuda -keys=cuda,gpu -arch=sm_80 -max_num_threads=1024 -model=unknown -thread_warp_size=32", [-1, 16, 64, 49152, 2147483647, 1024, 8, 32], "", 0, []], [[], [["FU", 1, [2, 3]], ["SP", 2, 1, 1152, [6], 1], ["AN", 2, 2, 6], ["FSP", 1, 2, 1, 1], ["AN", 1, 3, 6], ["CA", 1, 2, 1], ["FU", 2, [0, 1]], ["AN", 2, 0, 5], ["PR", 1, 0, "auto_unroll_max_step$16"]]]], "r": [[3.63133e-06, 3.64826e-06, 3.63824e-06], 0, 5.29735, 1681118414], "v": "v0.6"}
{"i": [["[\"reduce_mean\", 7, 7, 1152]", "cuda -keys=cuda,gpu -arch=sm_80 -max_num_threads=1024 -model=unknown -thread_warp_size=32", [-1, 16, 64, 49152, 2147483647, 1024, 8, 32], "", 0, []], [[], [["FU", 1, [2, 3]], ["SP", 2, 1, 1152, [2], 1], ["AN", 2, 2, 6], ["FSP", 1, 2, 1, 1], ["AN", 1, 3, 6], ["CA", 1, 2, 1], ["FU", 2, [0, 1]], ["AN", 2, 0, 5], ["PR", 1, 0, "auto_unroll_max_step$16"]]]], "r": [[4.51282e-06, 4.52308e-06, 4.52226e-06], 0, 6.58848, 1681118415], "v": "v0.6"}
{"i": [["[\"reduce_mean\", 7, 7, 1152]", "cuda -keys=cuda,gpu -arch=sm_80 -max_num_threads=1024 -model=unknown -thread_warp_size=32", [-1, 16, 64, 49152, 2147483647, 1024, 8, 32], "", 0, []], [[], [["FU", 1, [2, 3]], ["SP", 2, 1, 1152, [16], 1], ["AN", 2, 2, 6], ["FSP", 1, 2, 1, 1], ["AN", 1, 3, 6], ["CA", 1, 2, 1], ["FU", 2, [0, 1]], ["AN", 2, 0, 5], ["PR", 1, 0, "auto_unroll_max_step$64"]]]], "r": [[4.43539e-06, 4.44822e-06, 4.44783e-06], 0, 7.0139, 1681118416], "v": "v0.6"}
{"i": [["[\"reduce_mean\", 7, 7, 1152]", "cuda -keys=cuda,gpu -arch=sm_80 -max_num_threads=1024 -model=unknown -thread_warp_size=32", [-1, 16, 64, 49152, 2147483647, 1024, 8, 32], "", 0, []], [[], [["FU", 1, [2, 3]], ["SP", 2, 1, 1152, [16], 1], ["AN", 2, 2, 6], ["FSP", 1, 2, 1, 1], ["AN", 1, 3, 6], ["CA", 1, 2, 1], ["FU", 2, [0, 1]], ["AN", 2, 0, 5], ["PR", 1, 0, "auto_unroll_max_step$16"]]]], "r": [[4.41012e-06, 4.42178e-06, 4.42334e-06], 0, 4.51, 1681118413], "v": "v0.6"}
{"i": [["[\"reduce_mean\", 7, 7, 1152]", "cuda -keys=cuda,gpu -arch=sm_80 -max_num_threads=1024 -model=unknown -thread_warp_size=32", [-1, 16, 64, 49152, 2147483647, 1024, 8, 32], "", 0, []], [[], [["FU", 1, [2, 3]], ["SP", 2, 1, 1152, [12], 1], ["AN", 2, 2, 6], ["FSP", 1, 2, 1, 1], ["AN", 1, 3, 6], ["CA", 1, 2, 1], ["FU", 2, [0, 1]], ["AN", 2, 0, 5], ["PR", 1, 0, "auto_unroll_max_step$16"]]]], "r": [[4.57887e-06, 4.57723e-06, 4.58092e-06], 0, 3.83886, 1681118413], "v": "v0.6"}
{"i": [["[\"reduce_mean\", 7, 7, 1152]", "cuda -keys=cuda,gpu -arch=sm_80 -max_num_threads=1024 -model=unknown -thread_warp_size=32", [-1, 16, 64, 49152, 2147483647, 1024, 8, 32], "", 0, []], [[], [["FU", 1, [2, 3]], ["SP", 2, 1, 1152, [9], 1], ["AN", 2, 2, 6], ["FSP", 1, 2, 1, 1], ["AN", 1, 3, 6], ["CA", 1, 2, 1], ["FU", 2, [0, 1]], ["AN", 2, 0, 5], ["PR", 1, 0, "auto_unroll_max_step$64"]]]], "r": [[4.92038e-06, 4.93594e-06, 4.94761e-06], 0, 3.45805, 1681118412], "v": "v0.6"}
{"i": [["[\"reduce_mean\", 7, 7, 1152]", "cuda -keys=cuda,gpu -arch=sm_80 -max_num_threads=1024 -model=unknown -thread_warp_size=32", [-1, 16, 64, 49152, 2147483647, 1024, 8, 32], "", 0, []], [[], [["FU", 1, [2, 3]], ["SP", 2, 1, 1152, [3], 1], ["AN", 2, 2, 6], ["FSP", 1, 2, 1, 1], ["AN", 1, 3, 6], ["CA", 1, 2, 1], ["FU", 2, [0, 1]], ["AN", 2, 0, 5], ["PR", 1, 0, "auto_unroll_max_step$16"]]]], "r": [[4.89835e-06, 4.94458e-06, 4.94501e-06], 0, 8.03232, 1681118417], "v": "v0.6"}
{"i": [["[\"reduce_mean\", 7, 7, 1152]", "cuda -keys=cuda,gpu -arch=sm_80 -max_num_threads=1024 -model=unknown -thread_warp_size=32", [-1, 16, 64, 49152, 2147483647, 1024, 8, 32], "", 0, []], [[], [["FU", 1, [2, 3]], ["SP", 2, 1, 1152, [9], 1], ["AN", 2, 2, 6], ["FSP", 1, 2, 1, 1], ["AN", 1, 3, 6], ["CA", 1, 2, 1], ["FU", 2, [0, 1]], ["AN", 2, 0, 5], ["PR", 1, 0, "auto_unroll_max_step$16"]]]], "r": [[5.15586e-06, 5.17012e-06, 5.17055e-06], 0, 10.5483, 1681118420], "v": "v0.6"}
{"i": [["[\"reduce_mean\", 7, 7, 1152]", "cuda -keys=cuda,gpu -arch=sm_80 -max_num_threads=1024 -model=unknown -thread_warp_size=32", [-1, 16, 64, 49152, 2147483647, 1024, 8, 32], "", 0, []], [[], [["FU", 1, [2, 3]], ["SP", 2, 1, 1152, [12], 1], ["AN", 2, 2, 6], ["FSP", 1, 2, 1, 1], ["AN", 1, 3, 6], ["CA", 1, 2, 1], ["FU", 2, [0, 1]], ["AN", 2, 0, 5], ["PR", 1, 0, "auto_unroll_max_step$0"]]]], "r": [[4.58256e-06, 4.59446e-06, 4.59446e-06], 0, 8.51817, 1681118418], "v": "v0.6"}
{"i": [["[\"reduce_mean\", 7, 7, 1152]", "cuda -keys=cuda,gpu -arch=sm_80 -max_num_threads=1024 -model=unknown -thread_warp_size=32", [-1, 16, 64, 49152, 2147483647, 1024, 8, 32], "", 0, []], [[], [["FU", 2, [0, 1]], ["SP", 2, 0, 1152, [12], 1], ["AN", 2, 0, 5], ["AN", 2, 1, 6], ["FU", 1, [0, 1]], ["SP", 1, 0, 1152, [32], 1], ["AN", 1, 0, 5], ["AN", 1, 1, 6], ["PR", 1, 0, "auto_unroll_max_step$16"]]]], "r": [[5.68293e-06, 5.53189e-06, 5.53288e-06], 0, 7.751, 1681118417], "v": "v0.6"}
{"i": [["[\"reduce_mean\", 7, 7, 1152]", "cuda -keys=cuda,gpu -arch=sm_80 -max_num_threads=1024 -model=unknown -thread_warp_size=32", [-1, 16, 64, 49152, 2147483647, 1024, 8, 32], "", 0, []], [[], [["FU", 2, [0, 1]], ["SP", 2, 0, 1152, [32], 1], ["AN", 2, 0, 5], ["AN", 2, 1, 6], ["FU", 1, [0, 1]], ["SP", 1, 0, 1152, [24], 1], ["AN", 1, 0, 5], ["AN", 1, 1, 6], ["PR", 1, 0, "auto_unroll_max_step$512"]]]], "r": [[5.52692e-06, 5.4509e-06, 5.4981e-06], 0, 7.31735, 1681118416], "v": "v0.6"}
{"i": [["[\"reduce_mean\", 7, 7, 1152]", "cuda -keys=cuda,gpu -arch=sm_80 -max_num_threads=1024 -model=unknown -thread_warp_size=32", [-1, 16, 64, 49152, 2147483647, 1024, 8, 32], "", 0, []], [[], [["FU", 2, [0, 1]], ["SP", 2, 0, 1152, [32], 1], ["AN", 2, 0, 5], ["AN", 2, 1, 6], ["FU", 1, [0, 1]], ["SP", 1, 0, 1152, [24], 1], ["AN", 1, 0, 5], ["AN", 1, 1, 6], ["PR", 1, 0, "auto_unroll_max_step$16"]]]], "r": [[5.54182e-06, 5.45984e-06, 5.56021e-06], 0, 10.9952, 1681118420], "v": "v0.6"}
{"i": [["[\"reduce_mean\", 7, 7, 1152]", "cuda -keys=cuda,gpu -arch=sm_80 -max_num_threads=1024 -model=unknown -thread_warp_size=32", [-1, 16, 64, 49152, 2147483647, 1024, 8, 32], "", 0, []], [[], [["FU", 2, [0, 1]], ["SP", 2, 0, 1152, [16], 1], ["AN", 2, 0, 5], ["AN", 2, 1, 6], ["FU", 1, [0, 1]], ["SP", 1, 0, 1152, [32], 1], ["AN", 1, 0, 5], ["AN", 1, 1, 6], ["PR", 1, 0, "auto_unroll_max_step$0"]]]], "r": [[5.69603e-06, 5.52234e-06, 5.52649e-06], 0, 6.25418, 1681118415], "v": "v0.6"}
{"i": [["[\"reduce_mean\", 7, 7, 1152]", "cuda -keys=cuda,gpu -arch=sm_80 -max_num_threads=1024 -model=unknown -thread_warp_size=32", [-1, 16, 64, 49152, 2147483647, 1024, 8, 32], "", 0, []], [[], [["FU", 2, [0, 1]], ["SP", 2, 0, 1152, [18], 1], ["AN", 2, 0, 5], ["AN", 2, 1, 6], ["FU", 1, [0, 1]], ["SP", 1, 0, 1152, [32], 1], ["AN", 1, 0, 5], ["AN", 1, 1, 6], ["PR", 1, 0, "auto_unroll_max_step$16"]]]], "r": [[5.63026e-06, 5.50257e-06, 5.49611e-06], 0, 11.9322, 1681118421], "v": "v0.6"}
