python/models/efficientnet/kernel_configs/efficient_fused_pointwise_conv_bias_add_sigmoid_mul_14_14_28_672_1.log
{"i": [["[\"fused_pointwise_conv_bias_add_sigmoid_mul\", 14, 14, 28, 672, 1]", "cuda -keys=cuda,gpu -max_num_threads=1024 -model=unknown -thread_warp_size=32", [-1, 16, 64, 49152, 2147483647, 1024, 8, 32], "", 0, []], [[], [["CI", 5], ["CHW", 3, "local"], ["SP", 3, 0, 1, [1, 1, 1, 1], 1], ["SP", 3, 5, 672, [2, 48, 1, 7], 1], ["SP", 3, 10, 28, [14, 1], 1], ["RE", 3, [0, 5, 1, 6, 2, 7, 10, 11, 3, 8, 12, 4, 9]], ["FSP", 4, 0, 2, 3], ["FSP", 4, 4, 3, 3], ["RE", 4, [0, 4, 1, 5, 2, 6, 3, 7]], ["CA", 3, 4, 5], ["CHR", 2, "shared", [3]], ["CA", 3, 4, 6], ["CHR", 1, "shared", [4]], ["CA", 2, 5, 6], ["FU", 9, [0, 1, 2, 3]], ["SP", 9, 0, 131712, [32], 1], ["AN", 9, 0, 5], ["AN", 9, 1, 6], ["FU", 6, [0, 1]], ["AN", 6, 0, 5], ["FU", 6, [1, 2]], ["AN", 6, 1, 4], ["FU", 6, [2, 3]], ["AN", 6, 2, 6], ["FU", 4, [0, 1]], ["SP", 4, 0, 28, [1], 1], ["AN", 4, 1, 2], ["FFSP", 4, 0, [3, 2], 1, 1], ["AN", 4, 1, 6], ["FU", 2, [0, 1]], ["SP", 2, 0, 4, [1], 1], ["AN", 2, 1, 2], ["FFSP", 2, 0, [3, 2], 1, 1], ["AN", 2, 1, 6], ["PR", 5, 0, "auto_unroll_max_step$64"]]]], "r": [[2.17928e-05, 2.17859e-05, 2.17908e-05], 0, 7.16857, 1662031358], "v": "v0.6"}
{"i": [["[\"fused_pointwise_conv_bias_add_sigmoid_mul\", 14, 14, 28, 672, 1]", "cuda -keys=cuda,gpu -max_num_threads=1024 -model=unknown -thread_warp_size=32", [-1, 16, 64, 49152, 2147483647, 1024, 8, 32], "", 0, []], [[], [["CI", 5], ["CHW", 3, "local"], ["SP", 3, 0, 1, [1, 1, 1, 1], 1], ["SP", 3, 5, 672, [1, 42, 2, 2], 1], ["SP", 3, 10, 28, [2, 2], 1], ["RE", 3, [0, 5, 1, 6, 2, 7, 10, 11, 3, 8, 12, 4, 9]], ["FSP", 4, 0, 2, 3], ["FSP", 4, 4, 3, 3], ["RE", 4, [0, 4, 1, 5, 2, 6, 3, 7]], ["CA", 3, 4, 5], ["CHR", 2, "shared", [3]], ["CA", 3, 4, 6], ["CHR", 1, "shared", [4]], ["CA", 2, 5, 6], ["FU", 9, [0, 1, 2, 3]], ["SP", 9, 0, 131712, [32], 1], ["AN", 9, 0, 5], ["AN", 9, 1, 6], ["FU", 6, [0, 1]], ["AN", 6, 0, 5], ["FU", 6, [1, 2]], ["AN", 6, 1, 4], ["FU", 6, [2, 3]], ["AN", 6, 2, 6], ["FU", 4, [0, 1]], ["SP", 4, 0, 16, [2], 1], ["AN", 4, 1, 2], ["FFSP", 4, 0, [3, 2], 1, 1], ["AN", 4, 1, 6], ["FU", 2, [0, 1]], ["SP", 2, 0, 4, [1], 1], ["AN", 2, 1, 2], ["FFSP", 2, 0, [3, 2], 1, 1], ["AN", 2, 1, 6], ["PR", 5, 0, "auto_unroll_max_step$512"]]]], "r": [[2.10244e-05, 2.10116e-05, 2.10203e-05], 0, 6.29081, 1662031357], "v": "v0.6"}
{"i": [["[\"fused_pointwise_conv_bias_add_sigmoid_mul\", 14, 14, 28, 672, 1]", "cuda -keys=cuda,gpu -max_num_threads=1024 -model=unknown -thread_warp_size=32", [-1, 16, 64, 49152, 2147483647, 1024, 8, 32], "", 0, []], [[], [["CI", 5], ["CHW", 3, "local"], ["SP", 3, 0, 1, [1, 1, 1, 1], 1], ["SP", 3, 5, 672, [3, 112, 1, 2], 1], ["SP", 3, 10, 28, [2, 2], 1], ["RE", 3, [0, 5, 1, 6, 2, 7, 10, 11, 3, 8, 12, 4, 9]], ["FSP", 4, 0, 2, 3], ["FSP", 4, 4, 3, 3], ["RE", 4, [0, 4, 1, 5, 2, 6, 3, 7]], ["CA", 3, 4, 5], ["CHR", 2, "shared", [3]], ["CA", 3, 4, 6], ["CHR", 1, "shared", [4]], ["CA", 2, 5, 6], ["FU", 9, [0, 1, 2, 3]], ["SP", 9, 0, 131712, [32], 1], ["AN", 9, 0, 5], ["AN", 9, 1, 6], ["FU", 6, [0, 1]], ["AN", 6, 0, 5], ["FU", 6, [1, 2]], ["AN", 6, 1, 4], ["FU", 6, [2, 3]], ["AN", 6, 2, 6], ["FU", 4, [0, 1]], ["SP", 4, 0, 16, [1], 1], ["AN", 4, 1, 2], ["FFSP", 4, 0, [3, 2], 1, 1], ["AN", 4, 1, 6], ["FU", 2, [0, 1]], ["SP", 2, 0, 4, [1], 1], ["AN", 2, 1, 2], ["FFSP", 2, 0, [3, 2], 1, 1], ["AN", 2, 1, 6], ["PR", 5, 0, "auto_unroll_max_step$64"]]]], "r": [[2.26099e-05, 2.26132e-05, 2.26099e-05], 0, 8.05799, 1662031360], "v": "v0.6"}
{"i": [["[\"fused_pointwise_conv_bias_add_sigmoid_mul\", 14, 14, 28, 672, 1]", "cuda -keys=cuda,gpu -max_num_threads=1024 -model=unknown -thread_warp_size=32", [-1, 16, 64, 49152, 2147483647, 1024, 8, 32], "", 0, []], [[], [["CI", 5], ["CHW", 3, "local"], ["SP", 3, 0, 1, [1, 1, 1, 1], 1], ["SP", 3, 5, 672, [1, 224, 1, 1], 1], ["SP", 3, 10, 28, [1, 7], 1], ["RE", 3, [0, 5, 1, 6, 2, 7, 10, 11, 3, 8, 12, 4, 9]], ["FSP", 4, 0, 2, 3], ["FSP", 4, 4, 3, 3], ["RE", 4, [0, 4, 1, 5, 2, 6, 3, 7]], ["CA", 3, 4, 5], ["CHR", 2, "shared", [3]], ["CA", 3, 4, 6], ["CHR", 1, "shared", [4]], ["CA", 2, 5, 6], ["FU", 9, [0, 1, 2, 3]], ["SP", 9, 0, 131712, [64], 1], ["AN", 9, 0, 5], ["AN", 9, 1, 6], ["FU", 6, [0, 1]], ["AN", 6, 0, 5], ["FU", 6, [1, 2]], ["AN", 6, 1, 4], ["FU", 6, [2, 3]], ["AN", 6, 2, 6], ["FU", 4, [0, 1]], ["SP", 4, 0, 1, [1], 1], ["AN", 4, 1, 2], ["FFSP", 4, 0, [3, 2], 1, 1], ["AN", 4, 1, 6], ["FU", 2, [0, 1]], ["SP", 2, 0, 1, [1], 1], ["AN", 2, 1, 2], ["FFSP", 2, 0, [3, 2], 1, 1], ["AN", 2, 1, 6], ["PR", 5, 0, "auto_unroll_max_step$512"]]]], "r": [[1.36882e-05, 1.36867e-05, 1.36907e-05], 0, 7.68934, 1662031359], "v": "v0.6"}
{"i": [["[\"fused_pointwise_conv_bias_add_sigmoid_mul\", 14, 14, 28, 672, 1]", "cuda -keys=cuda,gpu -max_num_threads=1024 -model=unknown -thread_warp_size=32", [-1, 16, 64, 49152, 2147483647, 1024, 8, 32], "", 0, []], [[], [["CI", 5], ["CHW", 3, "local"], ["SP", 3, 0, 1, [1, 1, 1, 1], 1], ["SP", 3, 5, 672, [1, 48, 1, 7], 1], ["SP", 3, 10, 28, [2, 2], 1], ["RE", 3, [0, 5, 1, 6, 2, 7, 10, 11, 3, 8, 12, 4, 9]], ["FSP", 4, 0, 2, 3], ["FSP", 4, 4, 3, 3], ["RE", 4, [0, 4, 1, 5, 2, 6, 3, 7]], ["CA", 3, 4, 5], ["CHR", 2, "shared", [3]], ["CA", 3, 4, 6], ["CHR", 1, "shared", [4]], ["CA", 2, 5, 6], ["FU", 9, [0, 1, 2, 3]], ["SP", 9, 0, 131712, [32], 1], ["AN", 9, 0, 5], ["AN", 9, 1, 6], ["FU", 6, [0, 1]], ["AN", 6, 0, 5], ["FU", 6, [1, 2]], ["AN", 6, 1, 4], ["FU", 6, [2, 3]], ["AN", 6, 2, 6], ["FU", 4, [0, 1]], ["SP", 4, 0, 28, [2], 1], ["AN", 4, 1, 2], ["FFSP", 4, 0, [3, 2], 1, 1], ["AN", 4, 1, 6], ["FU", 2, [0, 1]], ["SP", 2, 0, 4, [1], 1], ["AN", 2, 1, 2], ["FFSP", 2, 0, [3, 2], 1, 1], ["AN", 2, 1, 6], ["PR", 5, 0, "auto_unroll_max_step$0"]]]], "r": [[3.34759e-05, 3.34901e-05, 3.34889e-05], 0, 4.25476, 1662031355], "v": "v0.6"}
{"i": [["[\"fused_pointwise_conv_bias_add_sigmoid_mul\", 14, 14, 28, 672, 1]", "cuda -keys=cuda,gpu -max_num_threads=1024 -model=unknown -thread_warp_size=32", [-1, 16, 64, 49152, 2147483647, 1024, 8, 32], "", 0, []], [[], [["CI", 5], ["CHW", 3, "local"], ["SP", 3, 0, 1, [1, 1, 1, 1], 1], ["SP", 3, 5, 672, [4, 84, 1, 2], 1], ["SP", 3, 10, 28, [1, 2], 1], ["RE", 3, [0, 5, 1, 6, 2, 7, 10, 11, 3, 8, 12, 4, 9]], ["FSP", 4, 0, 2, 3], ["FSP", 4, 4, 3, 3], ["RE", 4, [0, 4, 1, 5, 2, 6, 3, 7]], ["CA", 3, 4, 5], ["CHR", 2, "shared", [3]], ["CA", 3, 4, 6], ["CHR", 1, "shared", [4]], ["CA", 2, 5, 6], ["FU", 9, [0, 1, 2, 3]], ["SP", 9, 0, 131712, [64], 1], ["AN", 9, 0, 5], ["AN", 9, 1, 6], ["FU", 6, [0, 1]], ["AN", 6, 0, 5], ["FU", 6, [1, 2]], ["AN", 6, 1, 4], ["FU", 6, [2, 3]], ["AN", 6, 2, 6], ["FU", 4, [0, 1]], ["SP", 4, 0, 16, [1], 1], ["AN", 4, 1, 2], ["FFSP", 4, 0, [3, 2], 1, 1], ["AN", 4, 1, 6], ["FU", 2, [0, 1]], ["SP", 2, 0, 4, [1], 1], ["AN", 2, 1, 2], ["FFSP", 2, 0, [3, 2], 1, 1], ["AN", 2, 1, 6], ["PR", 5, 0, "auto_unroll_max_step$1024"]]]], "r": [[2.04492e-05, 2.04508e-05, 2.04472e-05], 0, 5.11589, 1662031356], "v": "v0.6"}
{"i": [["[\"fused_pointwise_conv_bias_add_sigmoid_mul\", 14, 14, 28, 672, 1]", "cuda -keys=cuda,gpu -max_num_threads=1024 -model=unknown -thread_warp_size=32", [-1, 16, 64, 49152, 2147483647, 1024, 8, 32], "", 0, []], [[], [["CI", 5], ["CHW", 3, "local"], ["SP", 3, 0, 1, [1, 1, 1, 1], 1], ["SP", 3, 5, 672, [2, 42, 1, 1], 1], ["SP", 3, 10, 28, [1, 7], 1], ["RE", 3, [0, 5, 1, 6, 2, 7, 10, 11, 3, 8, 12, 4, 9]], ["FSP", 4, 0, 2, 3], ["FSP", 4, 4, 3, 3], ["RE", 4, [0, 4, 1, 5, 2, 6, 3, 7]], ["CA", 3, 4, 5], ["CHR", 2, "shared", [3]], ["CA", 3, 4, 6], ["CHR", 1, "shared", [4]], ["CA", 2, 5, 6], ["FU", 9, [0, 1, 2, 3]], ["SP", 9, 0, 131712, [2], 1], ["AN", 9, 0, 5], ["AN", 9, 1, 6], ["FU", 6, [0, 1]], ["AN", 6, 0, 5], ["FU", 6, [1, 2]], ["AN", 6, 1, 4], ["FU", 6, [2, 3]], ["AN", 6, 2, 6], ["FU", 4, [0, 1]], ["SP", 4, 0, 7, [1], 1], ["AN", 4, 1, 2], ["FFSP", 4, 0, [3, 2], 1, 1], ["AN", 4, 1, 6], ["FU", 2, [0, 1]], ["SP", 2, 0, 7, [1], 1], ["AN", 2, 1, 2], ["FFSP", 2, 0, [3, 2], 1, 1], ["AN", 2, 1, 6], ["PR", 5, 0, "auto_unroll_max_step$512"]]]], "r": [[0.000100683, 0.000100711, 0.000100707], 0, 5.43181, 1662031357], "v": "v0.6"}
{"i": [["[\"fused_pointwise_conv_bias_add_sigmoid_mul\", 14, 14, 28, 672, 1]", "cuda -keys=cuda,gpu -max_num_threads=1024 -model=unknown -thread_warp_size=32", [-1, 16, 64, 49152, 2147483647, 1024, 8, 32], "", 0, []], [[], [["CI", 5], ["CHW", 3, "local"], ["SP", 3, 0, 1, [1, 1, 1, 1], 1], ["SP", 3, 5, 672, [1, 42, 2, 1], 1], ["SP", 3, 10, 28, [1, 7], 1], ["RE", 3, [0, 5, 1, 6, 2, 7, 10, 11, 3, 8, 12, 4, 9]], ["FSP", 4, 0, 2, 3], ["FSP", 4, 4, 3, 3], ["RE", 4, [0, 4, 1, 5, 2, 6, 3, 7]], ["CA", 3, 4, 5], ["CHR", 2, "shared", [3]], ["CA", 3, 4, 6], ["CHR", 1, "shared", [4]], ["CA", 2, 5, 6], ["FU", 9, [0, 1, 2, 3]], ["SP", 9, 0, 131712, [32], 1], ["AN", 9, 0, 5], ["AN", 9, 1, 6], ["FU", 6, [0, 1]], ["AN", 6, 0, 5], ["FU", 6, [1, 2]], ["AN", 6, 1, 4], ["FU", 6, [2, 3]], ["AN", 6, 2, 6], ["FU", 4, [0, 1]], ["SP", 4, 0, 14, [1], 1], ["AN", 4, 1, 2], ["FFSP", 4, 0, [3, 2], 1, 1], ["AN", 4, 1, 6], ["FU", 2, [0, 1]], ["SP", 2, 0, 7, [1], 1], ["AN", 2, 1, 2], ["FFSP", 2, 0, [3, 2], 1, 1], ["AN", 2, 1, 6], ["PR", 5, 0, "auto_unroll_max_step$512"]]]], "r": [[1.83809e-05, 1.83814e-05, 1.83798e-05], 0, 3.02381, 1662031354], "v": "v0.6"}
{"i": [["[\"fused_pointwise_conv_bias_add_sigmoid_mul\", 14, 14, 28, 672, 1]", "cuda -keys=cuda,gpu -max_num_threads=1024 -model=unknown -thread_warp_size=32", [-1, 16, 64, 49152, 2147483647, 1024, 8, 32], "", 0, []], [[], [["CI", 5], ["CHW", 3, "local"], ["SP", 3, 0, 1, [1, 1, 1, 1], 1], ["SP", 3, 5, 672, [3, 32, 1, 7], 1], ["SP", 3, 10, 28, [7, 1], 1], ["RE", 3, [0, 5, 1, 6, 2, 7, 10, 11, 3, 8, 12, 4, 9]], ["FSP", 4, 0, 2, 3], ["FSP", 4, 4, 3, 3], ["RE", 4, [0, 4, 1, 5, 2, 6, 3, 7]], ["CA", 3, 4, 5], ["CHR", 2, "shared", [3]], ["CA", 3, 4, 6], ["CHR", 1, "shared", [4]], ["CA", 2, 5, 6], ["FU", 9, [0, 1, 2, 3]], ["SP", 9, 0, 131712, [32], 1], ["AN", 9, 0, 5], ["AN", 9, 1, 6], ["FU", 6, [0, 1]], ["AN", 6, 0, 5], ["FU", 6, [1, 2]], ["AN", 6, 1, 4], ["FU", 6, [2, 3]], ["AN", 6, 2, 6], ["FU", 4, [0, 1]], ["SP", 4, 0, 49, [1], 1], ["AN", 4, 1, 2], ["FFSP", 4, 0, [3, 2], 1, 1], ["AN", 4, 1, 6], ["FU", 2, [0, 1]], ["SP", 2, 0, 7, [1], 1], ["AN", 2, 1, 2], ["FFSP", 2, 0, [3, 2], 1, 1], ["AN", 2, 1, 6], ["PR", 5, 0, "auto_unroll_max_step$16"]]]], "r": [[2.61585e-05, 2.61583e-05, 2.616e-05], 0, 1.87983, 1662031353], "v": "v0.6"}
{"i": [["[\"fused_pointwise_conv_bias_add_sigmoid_mul\", 14, 14, 28, 672, 1]", "cuda -keys=cuda,gpu -max_num_threads=1024 -model=unknown -thread_warp_size=32", [-1, 16, 64, 49152, 2147483647, 1024, 8, 32], "", 0, []], [[], [["CI", 5], ["CHW", 3, "local"], ["SP", 3, 0, 1, [1, 1, 1, 1], 1], ["SP", 3, 5, 672, [1, 32, 21, 1], 1], ["SP", 3, 10, 28, [2, 2], 1], ["RE", 3, [0, 5, 1, 6, 2, 7, 10, 11, 3, 8, 12, 4, 9]], ["FSP", 4, 0, 2, 3], ["FSP", 4, 4, 3, 3], ["RE", 4, [0, 4, 1, 5, 2, 6, 3, 7]], ["CA", 3, 4, 5], ["CHR", 2, "shared", [3]], ["CA", 3, 4, 6], ["CHR", 1, "shared", [4]], ["CA", 2, 5, 6], ["FU", 9, [0, 1, 2, 3]], ["SP", 9, 0, 131712, [32], 1], ["AN", 9, 0, 5], ["AN", 9, 1, 6], ["FU", 6, [0, 1]], ["AN", 6, 0, 5], ["FU", 6, [1, 2]], ["AN", 6, 1, 4], ["FU", 6, [2, 3]], ["AN", 6, 2, 6], ["FU", 4, [0, 1]], ["SP", 4, 0, 42, [1], 1], ["AN", 4, 1, 2], ["FFSP", 4, 0, [3, 2], 1, 1], ["AN", 4, 1, 6], ["FU", 2, [0, 1]], ["SP", 2, 0, 2, [1], 1], ["AN", 2, 1, 2], ["FFSP", 2, 0, [3, 2], 1, 1], ["AN", 2, 1, 6], ["PR", 5, 0, "auto_unroll_max_step$512"]]]], "r": [[2.71534e-05, 2.71398e-05, 2.71508e-05], 0, 3.69362, 1662031355], "v": "v0.6"}
{"i": [["[\"fused_pointwise_conv_bias_add_sigmoid_mul\", 14, 14, 28, 672, 1]", "cuda -keys=cuda,gpu -max_num_threads=1024 -model=unknown -thread_warp_size=32", [-1, 16, 64, 49152, 2147483647, 1024, 8, 32], "", 0, []], [[], [["CI", 5], ["CHW", 3, "local"], ["SP", 3, 0, 1, [1, 1, 1, 1], 1], ["SP", 3, 5, 672, [3, 56, 2, 1], 1], ["SP", 3, 10, 28, [1, 28], 1], ["RE", 3, [0, 5, 1, 6, 2, 7, 10, 11, 3, 8, 12, 4, 9]], ["FSP", 4, 0, 2, 3], ["FSP", 4, 4, 3, 3], ["RE", 4, [0, 4, 1, 5, 2, 6, 3, 7]], ["CA", 3, 4, 5], ["CHR", 2, "shared", [3]], ["CA", 3, 4, 6], ["CHR", 1, "shared", [4]], ["CA", 2, 5, 6], ["FU", 9, [0, 1, 2, 3]], ["SP", 9, 0, 131712, [32], 1], ["AN", 9, 0, 5], ["AN", 9, 1, 6], ["FU", 6, [0, 1]], ["AN", 6, 0, 5], ["FU", 6, [1, 2]], ["AN", 6, 1, 4], ["FU", 6, [2, 3]], ["AN", 6, 2, 6], ["FU", 4, [0, 1]], ["SP", 4, 0, 56, [1], 1], ["AN", 4, 1, 2], ["FFSP", 4, 0, [3, 2], 1, 1], ["AN", 4, 1, 6], ["FU", 2, [0, 1]], ["SP", 2, 0, 28, [1], 1], ["AN", 2, 1, 2], ["FFSP", 2, 0, [3, 2], 1, 1], ["AN", 2, 1, 6], ["PR", 5, 0, "auto_unroll_max_step$512"]]]], "r": [[1.96187e-05, 1.96206e-05, 1.96193e-05], 0, 2.94882, 1662031354], "v": "v0.6"}
{"i": [["[\"fused_pointwise_conv_bias_add_sigmoid_mul\", 14, 14, 28, 672, 1]", "cuda -keys=cuda,gpu -max_num_threads=1024 -model=unknown -thread_warp_size=32", [-1, 16, 64, 49152, 2147483647, 1024, 8, 32], "", 0, []], [[], [["CI", 5], ["CHW", 3, "local"], ["SP", 3, 0, 1, [1, 1, 1, 1], 1], ["SP", 3, 5, 672, [3, 32, 7, 1], 1], ["SP", 3, 10, 28, [2, 2], 1], ["RE", 3, [0, 5, 1, 6, 2, 7, 10, 11, 3, 8, 12, 4, 9]], ["FSP", 4, 0, 2, 3], ["FSP", 4, 4, 3, 3], ["RE", 4, [0, 4, 1, 5, 2, 6, 3, 7]], ["CA", 3, 4, 5], ["CHR", 2, "shared", [3]], ["CA", 3, 4, 6], ["CHR", 1, "shared", [4]], ["CA", 2, 5, 6], ["FU", 9, [0, 1, 2, 3]], ["SP", 9, 0, 131712, [32], 1], ["AN", 9, 0, 5], ["AN", 9, 1, 6], ["FU", 6, [0, 1]], ["AN", 6, 0, 5], ["FU", 6, [1, 2]], ["AN", 6, 1, 4], ["FU", 6, [2, 3]], ["AN", 6, 2, 6], ["FU", 4, [0, 1]], ["SP", 4, 0, 28, [1], 1], ["AN", 4, 1, 2], ["FFSP", 4, 0, [3, 2], 1, 1], ["AN", 4, 1, 6], ["FU", 2, [0, 1]], ["SP", 2, 0, 4, [2], 1], ["AN", 2, 1, 2], ["FFSP", 2, 0, [3, 2], 1, 1], ["AN", 2, 1, 6], ["PR", 5, 0, "auto_unroll_max_step$512"]]]], "r": [[2.6951e-05, 2.69488e-05, 2.6948e-05], 0, 10.0618, 1662031362], "v": "v0.6"}
{"i": [["[\"fused_pointwise_conv_bias_add_sigmoid_mul\", 14, 14, 28, 672, 1]", "cuda -keys=cuda,gpu -max_num_threads=1024 -model=unknown -thread_warp_size=32", [-1, 16, 64, 49152, 2147483647, 1024, 8, 32], "", 0, []], [[], [["CI", 5], ["CHW", 3, "local"], ["SP", 3, 0, 1, [1, 1, 1, 1], 1], ["SP", 3, 5, 672, [1, 48, 1, 7], 1], ["SP", 3, 10, 28, [1, 28], 1], ["RE", 3, [0, 5, 1, 6, 2, 7, 10, 11, 3, 8, 12, 4, 9]], ["FSP", 4, 0, 2, 3], ["FSP", 4, 4, 3, 3], ["RE", 4, [0, 4, 1, 5, 2, 6, 3, 7]], ["CA", 3, 4, 5], ["CHR", 2, "shared", [3]], ["CA", 3, 4, 6], ["CHR", 1, "shared", [4]], ["CA", 2, 5, 6], ["FU", 9, [0, 1, 2, 3]], ["SP", 9, 0, 131712, [32], 1], ["AN", 9, 0, 5], ["AN", 9, 1, 6], ["FU", 6, [0, 1]], ["AN", 6, 0, 5], ["FU", 6, [1, 2]], ["AN", 6, 1, 4], ["FU", 6, [2, 3]], ["AN", 6, 2, 6], ["FU", 4, [0, 1]], ["SP", 4, 0, 28, [1], 1], ["AN", 4, 1, 2], ["FFSP", 4, 0, [3, 2], 1, 1], ["AN", 4, 1, 6], ["FU", 2, [0, 1]], ["SP", 2, 0, 4, [1], 1], ["AN", 2, 1, 2], ["FFSP", 2, 0, [3, 2], 1, 1], ["AN", 2, 1, 6], ["PR", 5, 0, "auto_unroll_max_step$64"]]]], "r": [[2.53849e-05, 2.53983e-05, 2.53824e-05], 0, 6.29405, 1662031358], "v": "v0.6"}
{"i": [["[\"fused_pointwise_conv_bias_add_sigmoid_mul\", 14, 14, 28, 672, 1]", "cuda -keys=cuda,gpu -max_num_threads=1024 -model=unknown -thread_warp_size=32", [-1, 16, 64, 49152, 2147483647, 1024, 8, 32], "", 0, []], [[], [["CI", 5], ["CHW", 3, "local"], ["SP", 3, 0, 1, [1, 1, 1, 1], 1], ["SP", 3, 5, 672, [8, 42, 1, 2], 1], ["SP", 3, 10, 28, [2, 1], 1], ["RE", 3, [0, 5, 1, 6, 2, 7, 10, 11, 3, 8, 12, 4, 9]], ["FSP", 4, 0, 2, 3], ["FSP", 4, 4, 3, 3], ["RE", 4, [0, 4, 1, 5, 2, 6, 3, 7]], ["CA", 3, 4, 5], ["CHR", 2, "shared", [3]], ["CA", 3, 4, 6], ["CHR", 1, "shared", [4]], ["CA", 2, 5, 6], ["FU", 9, [0, 1, 2, 3]], ["SP", 9, 0, 131712, [64], 1], ["AN", 9, 0, 5], ["AN", 9, 1, 6], ["FU", 6, [0, 1]], ["AN", 6, 0, 5], ["FU", 6, [1, 2]], ["AN", 6, 1, 4], ["FU", 6, [2, 3]], ["AN", 6, 2, 6], ["FU", 4, [0, 1]], ["SP", 4, 0, 28, [1], 1], ["AN", 4, 1, 2], ["FFSP", 4, 0, [3, 2], 1, 1], ["AN", 4, 1, 6], ["FU", 2, [0, 1]], ["SP", 2, 0, 14, [1], 1], ["AN", 2, 1, 2], ["FFSP", 2, 0, [3, 2], 1, 1], ["AN", 2, 1, 6], ["PR", 5, 0, "auto_unroll_max_step$0"]]]], "r": [[3.08417e-05, 3.08431e-05, 3.08474e-05], 0, 10.7042, 1662031362], "v": "v0.6"}
{"i": [["[\"fused_pointwise_conv_bias_add_sigmoid_mul\", 14, 14, 28, 672, 1]", "cuda -keys=cuda,gpu -max_num_threads=1024 -model=unknown -thread_warp_size=32", [-1, 16, 64, 49152, 2147483647, 1024, 8, 32], "", 0, []], [[], [["CI", 5], ["CHW", 3, "local"], ["SP", 3, 0, 1, [1, 1, 1, 1], 1], ["SP", 3, 5, 672, [2, 336, 1, 1], 1], ["SP", 3, 10, 28, [1, 7], 1], ["RE", 3, [0, 5, 1, 6, 2, 7, 10, 11, 3, 8, 12, 4, 9]], ["FSP", 4, 0, 2, 3], ["FSP", 4, 4, 3, 3], ["RE", 4, [0, 4, 1, 5, 2, 6, 3, 7]], ["CA", 3, 4, 5], ["CHR", 2, "shared", [3]], ["CA", 3, 4, 6], ["CHR", 1, "shared", [4]], ["CA", 2, 5, 6], ["FU", 9, [0, 1, 2, 3]], ["SP", 9, 0, 131712, [64], 1], ["AN", 9, 0, 5], ["AN", 9, 1, 6], ["FU", 6, [0, 1]], ["AN", 6, 0, 5], ["FU", 6, [1, 2]], ["AN", 6, 1, 4], ["FU", 6, [2, 3]], ["AN", 6, 2, 6], ["FU", 4, [0, 1]], ["SP", 4, 0, 7, [1], 1], ["AN", 4, 1, 2], ["FFSP", 4, 0, [3, 2], 1, 1], ["AN", 4, 1, 6], ["FU", 2, [0, 1]], ["SP", 2, 0, 7, [1], 1], ["AN", 2, 1, 2], ["FFSP", 2, 0, [3, 2], 1, 1], ["AN", 2, 1, 6], ["PR", 5, 0, "auto_unroll_max_step$512"]]]], "r": [[1.62509e-05, 1.62526e-05, 1.62521e-05], 0, 11.811, 1662031363], "v": "v0.6"}
{"i": [["[\"fused_pointwise_conv_bias_add_sigmoid_mul\", 14, 14, 28, 672, 1]", "cuda -keys=cuda,gpu -max_num_threads=1024 -model=unknown -thread_warp_size=32", [-1, 16, 64, 49152, 2147483647, 1024, 8, 32], "", 0, []], [[], [["CI", 5], ["CHW", 3, "local"], ["SP", 3, 0, 1, [1, 1, 1, 1], 1], ["SP", 3, 5, 672, [1, 42, 1, 2], 1], ["SP", 3, 10, 28, [1, 4], 1], ["RE", 3, [0, 5, 1, 6, 2, 7, 10, 11, 3, 8, 12, 4, 9]], ["FSP", 4, 0, 2, 3], ["FSP", 4, 4, 3, 3], ["RE", 4, [0, 4, 1, 5, 2, 6, 3, 7]], ["CA", 3, 4, 5], ["CHR", 2, "shared", [3]], ["CA", 3, 4, 6], ["CHR", 1, "shared", [4]], ["CA", 2, 5, 6], ["FU", 9, [0, 1, 2, 3]], ["SP", 9, 0, 131712, [32], 1], ["AN", 9, 0, 5], ["AN", 9, 1, 6], ["FU", 6, [0, 1]], ["AN", 6, 0, 5], ["FU", 6, [1, 2]], ["AN", 6, 1, 4], ["FU", 6, [2, 3]], ["AN", 6, 2, 6], ["FU", 4, [0, 1]], ["SP", 4, 0, 16, [1], 1], ["AN", 4, 1, 2], ["FFSP", 4, 0, [3, 2], 1, 1], ["AN", 4, 1, 6], ["FU", 2, [0, 1]], ["SP", 2, 0, 4, [1], 1], ["AN", 2, 1, 2], ["FFSP", 2, 0, [3, 2], 1, 1], ["AN", 2, 1, 6], ["PR", 5, 0, "auto_unroll_max_step$512"]]]], "r": [[1.79513e-05, 1.79399e-05, 1.79535e-05], 0, 11.071, 1662031363], "v": "v0.6"}
{"i": [["[\"fused_pointwise_conv_bias_add_sigmoid_mul\", 14, 14, 28, 672, 1]", "cuda -keys=cuda,gpu -max_num_threads=1024 -model=unknown -thread_warp_size=32", [-1, 16, 64, 49152, 2147483647, 1024, 8, 32], "", 0, []], [[], [["CI", 5], ["CHW", 3, "local"], ["SP", 3, 0, 1, [1, 1, 1, 1], 1], ["SP", 3, 5, 672, [1, 42, 2, 2], 1], ["SP", 3, 10, 28, [14, 2], 1], ["RE", 3, [0, 5, 1, 6, 2, 7, 10, 11, 3, 8, 12, 4, 9]], ["FSP", 4, 0, 2, 3], ["FSP", 4, 4, 3, 3], ["RE", 4, [0, 4, 1, 5, 2, 6, 3, 7]], ["CA", 3, 4, 5], ["CHR", 2, "shared", [3]], ["CA", 3, 4, 6], ["CHR", 1, "shared", [4]], ["CA", 2, 5, 6], ["FU", 9, [0, 1, 2, 3]], ["SP", 9, 0, 131712, [4], 1], ["AN", 9, 0, 5], ["AN", 9, 1, 6], ["FU", 6, [0, 1]], ["AN", 6, 0, 5], ["FU", 6, [1, 2]], ["AN", 6, 1, 4], ["FU", 6, [2, 3]], ["AN", 6, 2, 6], ["FU", 4, [0, 1]], ["SP", 4, 0, 16, [1], 1], ["AN", 4, 1, 2], ["FFSP", 4, 0, [3, 2], 1, 1], ["AN", 4, 1, 6], ["FU", 2, [0, 1]], ["SP", 2, 0, 4, [4], 1], ["AN", 2, 1, 2], ["FFSP", 2, 0, [3, 2], 1, 1], ["AN", 2, 1, 6], ["PR", 5, 0, "auto_unroll_max_step$512"]]]], "r": [[5.65339e-05, 5.65141e-05, 5.65166e-05], 0, 8.66428, 1662031360], "v": "v0.6"}
{"i": [["[\"fused_pointwise_conv_bias_add_sigmoid_mul\", 14, 14, 28, 672, 1]", "cuda -keys=cuda,gpu -max_num_threads=1024 -model=unknown -thread_warp_size=32", [-1, 16, 64, 49152, 2147483647, 1024, 8, 32], "", 0, []], [[], [["CI", 5], ["CHW", 3, "local"], ["SP", 3, 0, 1, [1, 1, 1, 1], 1], ["SP", 3, 5, 672, [1, 16, 3, 7], 1], ["SP", 3, 10, 28, [1, 1], 1], ["RE", 3, [0, 5, 1, 6, 2, 7, 10, 11, 3, 8, 12, 4, 9]], ["FSP", 4, 0, 2, 3], ["FSP", 4, 4, 3, 3], ["RE", 4, [0, 4, 1, 5, 2, 6, 3, 7]], ["CA", 3, 4, 5], ["CHR", 2, "shared", [3]], ["CA", 3, 4, 6], ["CHR", 1, "shared", [4]], ["CA", 2, 5, 6], ["FU", 9, [0, 1, 2, 3]], ["SP", 9, 0, 131712, [32], 1], ["AN", 9, 0, 5], ["AN", 9, 1, 6], ["FU", 6, [0, 1]], ["AN", 6, 0, 5], ["FU", 6, [1, 2]], ["AN", 6, 1, 4], ["FU", 6, [2, 3]], ["AN", 6, 2, 6], ["FU", 4, [0, 1]], ["SP", 4, 0, 3, [1], 1], ["AN", 4, 1, 2], ["FFSP", 4, 0, [3, 2], 1, 1], ["AN", 4, 1, 6], ["FU", 2, [0, 1]], ["SP", 2, 0, 1, [1], 1], ["AN", 2, 1, 2], ["FFSP", 2, 0, [3, 2], 1, 1], ["AN", 2, 1, 6], ["PR", 5, 0, "auto_unroll_max_step$512"]]]], "r": [[3.48898e-05, 3.49137e-05, 3.49132e-05], 0, 12.2483, 1662031364], "v": "v0.6"}
{"i": [["[\"fused_pointwise_conv_bias_add_sigmoid_mul\", 14, 14, 28, 672, 1]", "cuda -keys=cuda,gpu -max_num_threads=1024 -model=unknown -thread_warp_size=32", [-1, 16, 64, 49152, 2147483647, 1024, 8, 32], "", 0, []], [[], [["CI", 5], ["CHW", 3, "local"], ["SP", 3, 0, 1, [1, 1, 1, 1], 1], ["SP", 3, 5, 672, [2, 4, 2, 42], 1], ["SP", 3, 10, 28, [14, 1], 1], ["RE", 3, [0, 5, 1, 6, 2, 7, 10, 11, 3, 8, 12, 4, 9]], ["FSP", 4, 0, 2, 3], ["FSP", 4, 4, 3, 3], ["RE", 4, [0, 4, 1, 5, 2, 6, 3, 7]], ["CA", 3, 4, 5], ["CHR", 2, "shared", [3]], ["CA", 3, 4, 6], ["CHR", 1, "shared", [4]], ["CA", 2, 5, 6], ["FU", 9, [0, 1, 2, 3]], ["SP", 9, 0, 131712, [64], 1], ["AN", 9, 0, 5], ["AN", 9, 1, 6], ["FU", 6, [0, 1]], ["AN", 6, 0, 5], ["FU", 6, [1, 2]], ["AN", 6, 1, 4], ["FU", 6, [2, 3]], ["AN", 6, 2, 6], ["FU", 4, [0, 1]], ["SP", 4, 0, 56, [1], 1], ["AN", 4, 1, 2], ["FFSP", 4, 0, [3, 2], 1, 1], ["AN", 4, 1, 6], ["FU", 2, [0, 1]], ["SP", 2, 0, 14, [7], 1], ["AN", 2, 1, 2], ["FFSP", 2, 0, [3, 2], 1, 1], ["AN", 2, 1, 6], ["PR", 5, 0, "auto_unroll_max_step$1024"]]]], "r": [[0.000104686, 0.00010468, 0.000104684], 0, 13.625, 1662031365], "v": "v0.6"}
{"i": [["[\"fused_pointwise_conv_bias_add_sigmoid_mul\", 14, 14, 28, 672, 1]", "cuda -keys=cuda,gpu -max_num_threads=1024 -model=unknown -thread_warp_size=32", [-1, 16, 64, 49152, 2147483647, 1024, 8, 32], "", 0, []], [[], [["CI", 5], ["CHW", 3, "local"], ["SP", 3, 0, 1, [1, 1, 1, 1], 1], ["SP", 3, 5, 672, [1, 168, 2, 2], 1], ["SP", 3, 10, 28, [1, 2], 1], ["RE", 3, [0, 5, 1, 6, 2, 7, 10, 11, 3, 8, 12, 4, 9]], ["FSP", 4, 0, 2, 3], ["FSP", 4, 4, 3, 3], ["RE", 4, [0, 4, 1, 5, 2, 6, 3, 7]], ["CA", 3, 4, 5], ["CHR", 2, "shared", [3]], ["CA", 3, 4, 6], ["CHR", 1, "shared", [4]], ["CA", 2, 5, 6], ["FU", 9, [0, 1, 2, 3]], ["SP", 9, 0, 131712, [32], 1], ["AN", 9, 0, 5], ["AN", 9, 1, 6], ["FU", 6, [0, 1]], ["AN", 6, 0, 5], ["FU", 6, [1, 2]], ["AN", 6, 1, 4], ["FU", 6, [2, 3]], ["AN", 6, 2, 6], ["FU", 4, [0, 1]], ["SP", 4, 0, 56, [1], 1], ["AN", 4, 1, 2], ["FFSP", 4, 0, [3, 2], 1, 1], ["AN", 4, 1, 6], ["FU", 2, [0, 1]], ["SP", 2, 0, 28, [2], 1], ["AN", 2, 1, 2], ["FFSP", 2, 0, [3, 2], 1, 1], ["AN", 2, 1, 6], ["PR", 5, 0, "auto_unroll_max_step$16"]]]], "r": [[2.32235e-05, 2.3221e-05, 2.32178e-05], 0, 14.2857, 1662031366], "v": "v0.6"}
{"i": [["[\"fused_pointwise_conv_bias_add_sigmoid_mul\", 14, 14, 28, 672, 1]", "cuda -keys=cuda,gpu -max_num_threads=1024 -model=unknown -thread_warp_size=32", [-1, 16, 64, 49152, 2147483647, 1024, 8, 32], "", 0, []], [[], [["CI", 5], ["CHW", 3, "local"], ["SP", 3, 0, 1, [1, 1, 1, 1], 1], ["SP", 3, 5, 672, [1, 56, 3, 1], 1], ["SP", 3, 10, 28, [28, 1], 1], ["RE", 3, [0, 5, 1, 6, 2, 7, 10, 11, 3, 8, 12, 4, 9]], ["FSP", 4, 0, 2, 3], ["FSP", 4, 4, 3, 3], ["RE", 4, [0, 4, 1, 5, 2, 6, 3, 7]], ["CA", 3, 4, 5], ["CHR", 2, "shared", [3]], ["CA", 3, 4, 6], ["CHR", 1, "shared", [4]], ["CA", 2, 5, 6], ["FU", 9, [0, 1, 2, 3]], ["SP", 9, 0, 131712, [16], 1], ["AN", 9, 0, 5], ["AN", 9, 1, 6], ["FU", 6, [0, 1]], ["AN", 6, 0, 5], ["FU", 6, [1, 2]], ["AN", 6, 1, 4], ["FU", 6, [2, 3]], ["AN", 6, 2, 6], ["FU", 4, [0, 1]], ["SP", 4, 0, 84, [1], 1], ["AN", 4, 1, 2], ["FFSP", 4, 0, [3, 2], 1, 1], ["AN", 4, 1, 6], ["FU", 2, [0, 1]], ["SP", 2, 0, 28, [1], 1], ["AN", 2, 1, 2], ["FFSP", 2, 0, [3, 2], 1, 1], ["AN", 2, 1, 6], ["PR", 5, 0, "auto_unroll_max_step$1024"]]]], "r": [[2.29441e-05, 2.29347e-05, 2.29355e-05], 0, 12.7543, 1662031365], "v": "v0.6"}
{"i": [["[\"fused_pointwise_conv_bias_add_sigmoid_mul\", 14, 14, 28, 672, 1]", "cuda -keys=cuda,gpu -max_num_threads=1024 -model=unknown -thread_warp_size=32", [-1, 16, 64, 49152, 2147483647, 1024, 8, 32], "", 0, []], [[], [["CI", 5], ["CHW", 3, "local"], ["SP", 3, 0, 1, [1, 1, 1, 1], 1], ["SP", 3, 5, 672, [1, 112, 1, 1], 1], ["SP", 3, 10, 28, [1, 4], 1], ["RE", 3, [0, 5, 1, 6, 2, 7, 10, 11, 3, 8, 12, 4, 9]], ["FSP", 4, 0, 2, 3], ["FSP", 4, 4, 3, 3], ["RE", 4, [0, 4, 1, 5, 2, 6, 3, 7]], ["CA", 3, 4, 5], ["CHR", 2, "shared", [3]], ["CA", 3, 4, 6], ["CHR", 1, "shared", [4]], ["CA", 2, 5, 6], ["FU", 9, [0, 1, 2, 3]], ["SP", 9, 0, 131712, [32], 1], ["AN", 9, 0, 5], ["AN", 9, 1, 6], ["FU", 6, [0, 1]], ["AN", 6, 0, 5], ["FU", 6, [1, 2]], ["AN", 6, 1, 4], ["FU", 6, [2, 3]], ["AN", 6, 2, 6], ["FU", 4, [0, 1]], ["SP", 4, 0, 4, [4], 1], ["AN", 4, 1, 2], ["FFSP", 4, 0, [3, 2], 1, 1], ["AN", 4, 1, 6], ["FU", 2, [0, 1]], ["SP", 2, 0, 4, [2], 1], ["AN", 2, 1, 2], ["FFSP", 2, 0, [3, 2], 1, 1], ["AN", 2, 1, 6], ["PR", 5, 0, "auto_unroll_max_step$64"]]]], "r": [[1.73649e-05, 1.73801e-05, 1.7362e-05], 0, 13.8651, 1662031366], "v": "v0.6"}
{"i": [["[\"fused_pointwise_conv_bias_add_sigmoid_mul\", 14, 14, 28, 672, 1]", "cuda -keys=cuda,gpu -max_num_threads=1024 -model=unknown -thread_warp_size=32", [-1, 16, 64, 49152, 2147483647, 1024, 8, 32], "", 0, []], [[], [["CI", 5], ["CHW", 3, "local"], ["SP", 3, 0, 1, [1, 1, 1, 1], 1], ["SP", 3, 5, 672, [1, 84, 1, 1], 1], ["SP", 3, 10, 28, [7, 4], 1], ["RE", 3, [0, 5, 1, 6, 2, 7, 10, 11, 3, 8, 12, 4, 9]], ["FSP", 4, 0, 2, 3], ["FSP", 4, 4, 3, 3], ["RE", 4, [0, 4, 1, 5, 2, 6, 3, 7]], ["CA", 3, 4, 5], ["CHR", 2, "shared", [3]], ["CA", 3, 4, 6], ["CHR", 1, "shared", [4]], ["CA", 2, 5, 6], ["FU", 9, [0, 1, 2, 3]], ["SP", 9, 0, 131712, [32], 1], ["AN", 9, 0, 5], ["AN", 9, 1, 6], ["FU", 6, [0, 1]], ["AN", 6, 0, 5], ["FU", 6, [1, 2]], ["AN", 6, 1, 4], ["FU", 6, [2, 3]], ["AN", 6, 2, 6], ["FU", 4, [0, 1]], ["SP", 4, 0, 14, [1], 1], ["AN", 4, 1, 2], ["FFSP", 4, 0, [3, 2], 1, 1], ["AN", 4, 1, 6], ["FU", 2, [0, 1]], ["SP", 2, 0, 14, [1], 1], ["AN", 2, 1, 2], ["FFSP", 2, 0, [3, 2], 1, 1], ["AN", 2, 1, 6], ["PR", 5, 0, "auto_unroll_max_step$64"]]]], "r": [[1.63446e-05, 1.63524e-05, 1.6347e-05], 0, 15.8694, 1662031368], "v": "v0.6"}
{"i": [["[\"fused_pointwise_conv_bias_add_sigmoid_mul\", 14, 14, 28, 672, 1]", "cuda -keys=cuda,gpu -max_num_threads=1024 -model=unknown -thread_warp_size=32", [-1, 16, 64, 49152, 2147483647, 1024, 8, 32], "", 0, []], [[], [["CI", 5], ["CHW", 3, "local"], ["SP", 3, 0, 1, [1, 1, 1, 1], 1], ["SP", 3, 5, 672, [8, 42, 1, 2], 1], ["SP", 3, 10, 28, [2, 7], 1], ["RE", 3, [0, 5, 1, 6, 2, 7, 10, 11, 3, 8, 12, 4, 9]], ["FSP", 4, 0, 2, 3], ["FSP", 4, 4, 3, 3], ["RE", 4, [0, 4, 1, 5, 2, 6, 3, 7]], ["CA", 3, 4, 5], ["CHR", 2, "shared", [3]], ["CA", 3, 4, 6], ["CHR", 1, "shared", [4]], ["CA", 2, 5, 6], ["FU", 9, [0, 1, 2, 3]], ["SP", 9, 0, 131712, [32], 1], ["AN", 9, 0, 5], ["AN", 9, 1, 6], ["FU", 6, [0, 1]], ["AN", 6, 0, 5], ["FU", 6, [1, 2]], ["AN", 6, 1, 4], ["FU", 6, [2, 3]], ["AN", 6, 2, 6], ["FU", 4, [0, 1]], ["SP", 4, 0, 28, [1], 1], ["AN", 4, 1, 2], ["FFSP", 4, 0, [3, 2], 1, 1], ["AN", 4, 1, 6], ["FU", 2, [0, 1]], ["SP", 2, 0, 14, [7], 1], ["AN", 2, 1, 2], ["FFSP", 2, 0, [3, 2], 1, 1], ["AN", 2, 1, 6], ["PR", 5, 0, "auto_unroll_max_step$0"]]]], "r": [[2.41763e-05, 2.41908e-05, 2.41811e-05], 0, 17.1668, 1662031369], "v": "v0.6"}
{"i": [["[\"fused_pointwise_conv_bias_add_sigmoid_mul\", 14, 14, 28, 672, 1]", "cuda -keys=cuda,gpu -max_num_threads=1024 -model=unknown -thread_warp_size=32", [-1, 16, 64, 49152, 2147483647, 1024, 8, 32], "", 0, []], [[], [["CI", 5], ["CHW", 3, "local"], ["SP", 3, 0, 1, [1, 1, 1, 1], 1], ["SP", 3, 5, 672, [8, 42, 1, 2], 1], ["SP", 3, 10, 28, [2, 1], 1], ["RE", 3, [0, 5, 1, 6, 2, 7, 10, 11, 3, 8, 12, 4, 9]], ["FSP", 4, 0, 2, 3], ["FSP", 4, 4, 3, 3], ["RE", 4, [0, 4, 1, 5, 2, 6, 3, 7]], ["CA", 3, 4, 5], ["CHR", 2, "shared", [3]], ["CA", 3, 4, 6], ["CHR", 1, "shared", [4]], ["CA", 2, 5, 6], ["FU", 9, [0, 1, 2, 3]], ["SP", 9, 0, 131712, [32], 1], ["AN", 9, 0, 5], ["AN", 9, 1, 6], ["FU", 6, [0, 1]], ["AN", 6, 0, 5], ["FU", 6, [1, 2]], ["AN", 6, 1, 4], ["FU", 6, [2, 3]], ["AN", 6, 2, 6], ["FU", 4, [0, 1]], ["SP", 4, 0, 28, [1], 1], ["AN", 4, 1, 2], ["FFSP", 4, 0, [3, 2], 1, 1], ["AN", 4, 1, 6], ["FU", 2, [0, 1]], ["SP", 2, 0, 14, [1], 1], ["AN", 2, 1, 2], ["FFSP", 2, 0, [3, 2], 1, 1], ["AN", 2, 1, 6], ["PR", 5, 0, "auto_unroll_max_step$0"]]]], "r": [[3.35028e-05, 3.35187e-05, 3.35321e-05], 0, 16.3732, 1662031368], "v": "v0.6"}
{"i": [["[\"fused_pointwise_conv_bias_add_sigmoid_mul\", 14, 14, 28, 672, 1]", "cuda -keys=cuda,gpu -max_num_threads=1024 -model=unknown -thread_warp_size=32", [-1, 16, 64, 49152, 2147483647, 1024, 8, 32], "", 0, []], [[], [["CI", 5], ["CHW", 3, "local"], ["SP", 3, 0, 1, [1, 1, 1, 1], 1], ["SP", 3, 5, 672, [3, 32, 1, 1], 1], ["SP", 3, 10, 28, [1, 2], 1], ["RE", 3, [0, 5, 1, 6, 2, 7, 10, 11, 3, 8, 12, 4, 9]], ["FSP", 4, 0, 2, 3], ["FSP", 4, 4, 3, 3], ["RE", 4, [0, 4, 1, 5, 2, 6, 3, 7]], ["CA", 3, 4, 5], ["CHR", 2, "shared", [3]], ["CA", 3, 4, 6], ["CHR", 1, "shared", [4]], ["CA", 2, 5, 6], ["FU", 9, [0, 1, 2, 3]], ["SP", 9, 0, 131712, [8], 1], ["AN", 9, 0, 5], ["AN", 9, 1, 6], ["FU", 6, [0, 1]], ["AN", 6, 0, 5], ["FU", 6, [1, 2]], ["AN", 6, 1, 4], ["FU", 6, [2, 3]], ["AN", 6, 2, 6], ["FU", 4, [0, 1]], ["SP", 4, 0, 2, [1], 1], ["AN", 4, 1, 2], ["FFSP", 4, 0, [3, 2], 1, 1], ["AN", 4, 1, 6], ["FU", 2, [0, 1]], ["SP", 2, 0, 2, [2], 1], ["AN", 2, 1, 2], ["FFSP", 2, 0, [3, 2], 1, 1], ["AN", 2, 1, 6], ["PR", 5, 0, "auto_unroll_max_step$0"]]]], "r": [[3.51515e-05, 3.51822e-05, 3.51816e-05], 0, 18.9426, 1662031371], "v": "v0.6"}
{"i": [["[\"fused_pointwise_conv_bias_add_sigmoid_mul\", 14, 14, 28, 672, 1]", "cuda -keys=cuda,gpu -max_num_threads=1024 -model=unknown -thread_warp_size=32", [-1, 16, 64, 49152, 2147483647, 1024, 8, 32], "", 0, []], [[], [["CI", 5], ["CHW", 3, "local"], ["SP", 3, 0, 1, [1, 1, 1, 1], 1], ["SP", 3, 5, 672, [1, 672, 1, 1], 1], ["SP", 3, 10, 28, [1, 2], 1], ["RE", 3, [0, 5, 1, 6, 2, 7, 10, 11, 3, 8, 12, 4, 9]], ["FSP", 4, 0, 2, 3], ["FSP", 4, 4, 3, 3], ["RE", 4, [0, 4, 1, 5, 2, 6, 3, 7]], ["CA", 3, 4, 5], ["CHR", 2, "shared", [3]], ["CA", 3, 4, 6], ["CHR", 1, "shared", [4]], ["CA", 2, 5, 6], ["FU", 9, [0, 1, 2, 3]], ["SP", 9, 0, 131712, [32], 1], ["AN", 9, 0, 5], ["AN", 9, 1, 6], ["FU", 6, [0, 1]], ["AN", 6, 0, 5], ["FU", 6, [1, 2]], ["AN", 6, 1, 4], ["FU", 6, [2, 3]], ["AN", 6, 2, 6], ["FU", 4, [0, 1]], ["SP", 4, 0, 2, [1], 1], ["AN", 4, 1, 2], ["FFSP", 4, 0, [3, 2], 1, 1], ["AN", 4, 1, 6], ["FU", 2, [0, 1]], ["SP", 2, 0, 2, [2], 1], ["AN", 2, 1, 2], ["FFSP", 2, 0, [3, 2], 1, 1], ["AN", 2, 1, 6], ["PR", 5, 0, "auto_unroll_max_step$0"]]]], "r": [[1.99553e-05, 1.99735e-05, 1.99593e-05], 0, 17.5789, 1662031370], "v": "v0.6"}
{"i": [["[\"fused_pointwise_conv_bias_add_sigmoid_mul\", 14, 14, 28, 672, 1]", "cuda -keys=cuda,gpu -max_num_threads=1024 -model=unknown -thread_warp_size=32", [-1, 16, 64, 49152, 2147483647, 1024, 8, 32], "", 0, []], [[], [["CI", 5], ["CHW", 3, "local"], ["SP", 3, 0, 1, [1, 1, 1, 1], 1], ["SP", 3, 5, 672, [2, 336, 1, 1], 1], ["SP", 3, 10, 28, [7, 1], 1], ["RE", 3, [0, 5, 1, 6, 2, 7, 10, 11, 3, 8, 12, 4, 9]], ["FSP", 4, 0, 2, 3], ["FSP", 4, 4, 3, 3], ["RE", 4, [0, 4, 1, 5, 2, 6, 3, 7]], ["CA", 3, 4, 5], ["CHR", 2, "shared", [3]], ["CA", 3, 4, 6], ["CHR", 1, "shared", [4]], ["CA", 2, 5, 6], ["FU", 9, [0, 1, 2, 3]], ["SP", 9, 0, 131712, [32], 1], ["AN", 9, 0, 5], ["AN", 9, 1, 6], ["FU", 6, [0, 1]], ["AN", 6, 0, 5], ["FU", 6, [1, 2]], ["AN", 6, 1, 4], ["FU", 6, [2, 3]], ["AN", 6, 2, 6], ["FU", 4, [0, 1]], ["SP", 4, 0, 28, [28], 1], ["AN", 4, 1, 2], ["FFSP", 4, 0, [3, 2], 1, 1], ["AN", 4, 1, 6], ["FU", 2, [0, 1]], ["SP", 2, 0, 28, [1], 1], ["AN", 2, 1, 2], ["FFSP", 2, 0, [3, 2], 1, 1], ["AN", 2, 1, 6], ["PR", 5, 0, "auto_unroll_max_step$16"]]]], "r": [[2.91854e-05, 2.9208e-05, 2.9199e-05], 0, 18.351, 1662031370], "v": "v0.6"}
{"i": [["[\"fused_pointwise_conv_bias_add_sigmoid_mul\", 14, 14, 28, 672, 1]", "cuda -keys=cuda,gpu -max_num_threads=1024 -model=unknown -thread_warp_size=32", [-1, 16, 64, 49152, 2147483647, 1024, 8, 32], "", 0, []], [[], [["CI", 5], ["CHW", 3, "local"], ["SP", 3, 0, 1, [1, 1, 1, 1], 1], ["SP", 3, 5, 672, [2, 56, 6, 1], 1], ["SP", 3, 10, 28, [1, 2], 1], ["RE", 3, [0, 5, 1, 6, 2, 7, 10, 11, 3, 8, 12, 4, 9]], ["FSP", 4, 0, 2, 3], ["FSP", 4, 4, 3, 3], ["RE", 4, [0, 4, 1, 5, 2, 6, 3, 7]], ["CA", 3, 4, 5], ["CHR", 2, "shared", [3]], ["CA", 3, 4, 6], ["CHR", 1, "shared", [4]], ["CA", 2, 5, 6], ["FU", 9, [0, 1, 2, 3]], ["SP", 9, 0, 131712, [64], 1], ["AN", 9, 0, 5], ["AN", 9, 1, 6], ["FU", 6, [0, 1]], ["AN", 6, 0, 5], ["FU", 6, [1, 2]], ["AN", 6, 1, 4], ["FU", 6, [2, 3]], ["AN", 6, 2, 6], ["FU", 4, [0, 1]], ["SP", 4, 0, 12, [3], 1], ["AN", 4, 1, 2], ["FFSP", 4, 0, [3, 2], 1, 1], ["AN", 4, 1, 6], ["FU", 2, [0, 1]], ["SP", 2, 0, 2, [2], 1], ["AN", 2, 1, 2], ["FFSP", 2, 0, [3, 2], 1, 1], ["AN", 2, 1, 6], ["PR", 5, 0, "auto_unroll_max_step$0"]]]], "r": [[3.06664e-05, 3.06874e-05, 3.0684e-05], 0, 20.931, 1662031373], "v": "v0.6"}
{"i": [["[\"fused_pointwise_conv_bias_add_sigmoid_mul\", 14, 14, 28, 672, 1]", "cuda -keys=cuda,gpu -max_num_threads=1024 -model=unknown -thread_warp_size=32", [-1, 16, 64, 49152, 2147483647, 1024, 8, 32], "", 0, []], [[], [["CI", 5], ["CHW", 3, "local"], ["SP", 3, 0, 1, [1, 1, 1, 1], 1], ["SP", 3, 5, 672, [4, 42, 1, 4], 1], ["SP", 3, 10, 28, [1, 4], 1], ["RE", 3, [0, 5, 1, 6, 2, 7, 10, 11, 3, 8, 12, 4, 9]], ["FSP", 4, 0, 2, 3], ["FSP", 4, 4, 3, 3], ["RE", 4, [0, 4, 1, 5, 2, 6, 3, 7]], ["CA", 3, 4, 5], ["CHR", 2, "shared", [3]], ["CA", 3, 4, 6], ["CHR", 1, "shared", [4]], ["CA", 2, 5, 6], ["FU", 9, [0, 1, 2, 3]], ["SP", 9, 0, 131712, [32], 1], ["AN", 9, 0, 5], ["AN", 9, 1, 6], ["FU", 6, [0, 1]], ["AN", 6, 0, 5], ["FU", 6, [1, 2]], ["AN", 6, 1, 4], ["FU", 6, [2, 3]], ["AN", 6, 2, 6], ["FU", 4, [0, 1]], ["SP", 4, 0, 8, [1], 1], ["AN", 4, 1, 2], ["FFSP", 4, 0, [3, 2], 1, 1], ["AN", 4, 1, 6], ["FU", 2, [0, 1]], ["SP", 2, 0, 4, [1], 1], ["AN", 2, 1, 2], ["FFSP", 2, 0, [3, 2], 1, 1], ["AN", 2, 1, 6], ["PR", 5, 0, "auto_unroll_max_step$512"]]]], "r": [[2.48273e-05, 2.48288e-05, 2.48264e-05], 0, 19.4132, 1662031371], "v": "v0.6"}
{"i": [["[\"fused_pointwise_conv_bias_add_sigmoid_mul\", 14, 14, 28, 672, 1]", "cuda -keys=cuda,gpu -max_num_threads=1024 -model=unknown -thread_warp_size=32", [-1, 16, 64, 49152, 2147483647, 1024, 8, 32], "", 0, []], [[], [["CI", 5], ["CHW", 3, "local"], ["SP", 3, 0, 1, [1, 1, 1, 1], 1], ["SP", 3, 5, 672, [1, 56, 4, 1], 1], ["SP", 3, 10, 28, [2, 1], 1], ["RE", 3, [0, 5, 1, 6, 2, 7, 10, 11, 3, 8, 12, 4, 9]], ["FSP", 4, 0, 2, 3], ["FSP", 4, 4, 3, 3], ["RE", 4, [0, 4, 1, 5, 2, 6, 3, 7]], ["CA", 3, 4, 5], ["CHR", 2, "shared", [3]], ["CA", 3, 4, 6], ["CHR", 1, "shared", [4]], ["CA", 2, 5, 6], ["FU", 9, [0, 1, 2, 3]], ["SP", 9, 0, 131712, [32], 1], ["AN", 9, 0, 5], ["AN", 9, 1, 6], ["FU", 6, [0, 1]], ["AN", 6, 0, 5], ["FU", 6, [1, 2]], ["AN", 6, 1, 4], ["FU", 6, [2, 3]], ["AN", 6, 2, 6], ["FU", 4, [0, 1]], ["SP", 4, 0, 8, [1], 1], ["AN", 4, 1, 2], ["FFSP", 4, 0, [3, 2], 1, 1], ["AN", 4, 1, 6], ["FU", 2, [0, 1]], ["SP", 2, 0, 2, [1], 1], ["AN", 2, 1, 2], ["FFSP", 2, 0, [3, 2], 1, 1], ["AN", 2, 1, 6], ["PR", 5, 0, "auto_unroll_max_step$0"]]]], "r": [[2.70238e-05, 2.70279e-05, 2.70263e-05], 0, 19.9548, 1662031372], "v": "v0.6"}
{"i": [["[\"fused_pointwise_conv_bias_add_sigmoid_mul\", 14, 14, 28, 672, 1]", "cuda -keys=cuda,gpu -max_num_threads=1024 -model=unknown -thread_warp_size=32", [-1, 16, 64, 49152, 2147483647, 1024, 8, 32], "", 0, []], [[], [["CI", 5], ["CHW", 3, "local"], ["SP", 3, 0, 1, [1, 1, 1, 1], 1], ["SP", 3, 5, 672, [1, 48, 1, 7], 1], ["SP", 3, 10, 28, [28, 1], 1], ["RE", 3, [0, 5, 1, 6, 2, 7, 10, 11, 3, 8, 12, 4, 9]], ["FSP", 4, 0, 2, 3], ["FSP", 4, 4, 3, 3], ["RE", 4, [0, 4, 1, 5, 2, 6, 3, 7]], ["CA", 3, 4, 5], ["CHR", 2, "shared", [3]], ["CA", 3, 4, 6], ["CHR", 1, "shared", [4]], ["CA", 2, 5, 6], ["FU", 9, [0, 1, 2, 3]], ["SP", 9, 0, 131712, [8], 1], ["AN", 9, 0, 5], ["AN", 9, 1, 6], ["FU", 6, [0, 1]], ["AN", 6, 0, 5], ["FU", 6, [1, 2]], ["AN", 6, 1, 4], ["FU", 6, [2, 3]], ["AN", 6, 2, 6], ["FU", 4, [0, 1]], ["SP", 4, 0, 28, [1], 1], ["AN", 4, 1, 2], ["FFSP", 4, 0, [3, 2], 1, 1], ["AN", 4, 1, 6], ["FU", 2, [0, 1]], ["SP", 2, 0, 4, [2], 1], ["AN", 2, 1, 2], ["FFSP", 2, 0, [3, 2], 1, 1], ["AN", 2, 1, 6], ["PR", 5, 0, "auto_unroll_max_step$64"]]]], "r": [[4.21675e-05, 4.21796e-05, 4.21757e-05], 0, 21.574, 1662031374], "v": "v0.6"}
{"i": [["[\"fused_pointwise_conv_bias_add_sigmoid_mul\", 14, 14, 28, 672, 1]", "cuda -keys=cuda,gpu -max_num_threads=1024 -model=unknown -thread_warp_size=32", [-1, 16, 64, 49152, 2147483647, 1024, 8, 32], "", 0, []], [[], [["CI", 5], ["CHW", 3, "local"], ["SP", 3, 0, 1, [1, 1, 1, 1], 1], ["SP", 3, 5, 672, [2, 112, 1, 3], 1], ["SP", 3, 10, 28, [2, 7], 1], ["RE", 3, [0, 5, 1, 6, 2, 7, 10, 11, 3, 8, 12, 4, 9]], ["FSP", 4, 0, 2, 3], ["FSP", 4, 4, 3, 3], ["RE", 4, [0, 4, 1, 5, 2, 6, 3, 7]], ["CA", 3, 4, 5], ["CHR", 2, "shared", [3]], ["CA", 3, 4, 6], ["CHR", 1, "shared", [4]], ["CA", 2, 5, 6], ["FU", 9, [0, 1, 2, 3]], ["SP", 9, 0, 131712, [64], 1], ["AN", 9, 0, 5], ["AN", 9, 1, 6], ["FU", 6, [0, 1]], ["AN", 6, 0, 5], ["FU", 6, [1, 2]], ["AN", 6, 1, 4], ["FU", 6, [2, 3]], ["AN", 6, 2, 6], ["FU", 4, [0, 1]], ["SP", 4, 0, 42, [2], 1], ["AN", 4, 1, 2], ["FFSP", 4, 0, [3, 2], 1, 1], ["AN", 4, 1, 6], ["FU", 2, [0, 1]], ["SP", 2, 0, 14, [1], 1], ["AN", 2, 1, 2], ["FFSP", 2, 0, [3, 2], 1, 1], ["AN", 2, 1, 6], ["PR", 5, 0, "auto_unroll_max_step$64"]]]], "r": [[1.57432e-05, 1.57448e-05, 1.57558e-05], 0, 22.9642, 1662031375], "v": "v0.6"}
{"i": [["[\"fused_pointwise_conv_bias_add_sigmoid_mul\", 14, 14, 28, 672, 1]", "cuda -keys=cuda,gpu -max_num_threads=1024 -model=unknown -thread_warp_size=32", [-1, 16, 64, 49152, 2147483647, 1024, 8, 32], "", 0, []], [[], [["CI", 5], ["CHW", 3, "local"], ["SP", 3, 0, 1, [1, 1, 1, 1], 1], ["SP", 3, 5, 672, [1, 84, 1, 1], 1], ["SP", 3, 10, 28, [1, 14], 1], ["RE", 3, [0, 5, 1, 6, 2, 7, 10, 11, 3, 8, 12, 4, 9]], ["FSP", 4, 0, 2, 3], ["FSP", 4, 4, 3, 3], ["RE", 4, [0, 4, 1, 5, 2, 6, 3, 7]], ["CA", 3, 4, 5], ["CHR", 2, "shared", [3]], ["CA", 3, 4, 6], ["CHR", 1, "shared", [4]], ["CA", 2, 5, 6], ["FU", 9, [0, 1, 2, 3]], ["SP", 9, 0, 131712, [32], 1], ["AN", 9, 0, 5], ["AN", 9, 1, 6], ["FU", 6, [0, 1]], ["AN", 6, 0, 5], ["FU", 6, [1, 2]], ["AN", 6, 1, 4], ["FU", 6, [2, 3]], ["AN", 6, 2, 6], ["FU", 4, [0, 1]], ["SP", 4, 0, 14, [1], 1], ["AN", 4, 1, 2], ["FFSP", 4, 0, [3, 2], 1, 1], ["AN", 4, 1, 6], ["FU", 2, [0, 1]], ["SP", 2, 0, 14, [7], 1], ["AN", 2, 1, 2], ["FFSP", 2, 0, [3, 2], 1, 1], ["AN", 2, 1, 6], ["PR", 5, 0, "auto_unroll_max_step$64"]]]], "r": [[1.67718e-05, 1.67716e-05, 1.67741e-05], 0, 20.5293, 1662031373], "v": "v0.6"}
{"i": [["[\"fused_pointwise_conv_bias_add_sigmoid_mul\", 14, 14, 28, 672, 1]", "cuda -keys=cuda,gpu -max_num_threads=1024 -model=unknown -thread_warp_size=32", [-1, 16, 64, 49152, 2147483647, 1024, 8, 32], "", 0, []], [[], [["CI", 5], ["CHW", 3, "local"], ["SP", 3, 0, 1, [1, 1, 1, 1], 1], ["SP", 3, 5, 672, [1, 112, 6, 1], 1], ["SP", 3, 10, 28, [7, 1], 1], ["RE", 3, [0, 5, 1, 6, 2, 7, 10, 11, 3, 8, 12, 4, 9]], ["FSP", 4, 0, 2, 3], ["FSP", 4, 4, 3, 3], ["RE", 4, [0, 4, 1, 5, 2, 6, 3, 7]], ["CA", 3, 4, 5], ["CHR", 2, "shared", [3]], ["CA", 3, 4, 6], ["CHR", 1, "shared", [4]], ["CA", 2, 5, 6], ["FU", 9, [0, 1, 2, 3]], ["SP", 9, 0, 131712, [64], 1], ["AN", 9, 0, 5], ["AN", 9, 1, 6], ["FU", 6, [0, 1]], ["AN", 6, 0, 5], ["FU", 6, [1, 2]], ["AN", 6, 1, 4], ["FU", 6, [2, 3]], ["AN", 6, 2, 6], ["FU", 4, [0, 1]], ["SP", 4, 0, 7, [1], 1], ["AN", 4, 1, 2], ["FFSP", 4, 0, [3, 2], 1, 1], ["AN", 4, 1, 6], ["FU", 2, [0, 1]], ["SP", 2, 0, 7, [1], 1], ["AN", 2, 1, 2], ["FFSP", 2, 0, [3, 2], 1, 1], ["AN", 2, 1, 6], ["PR", 5, 0, "auto_unroll_max_step$512"]]]], "r": [[1.82036e-05, 1.82105e-05, 1.82127e-05], 0, 22.3209, 1662031374], "v": "v0.6"}
{"i": [["[\"fused_pointwise_conv_bias_add_sigmoid_mul\", 14, 14, 28, 672, 1]", "cuda -keys=cuda,gpu -max_num_threads=1024 -model=unknown -thread_warp_size=32", [-1, 16, 64, 49152, 2147483647, 1024, 8, 32], "", 0, []], [[], [["CI", 5], ["CHW", 3, "local"], ["SP", 3, 0, 1, [1, 1, 1, 1], 1], ["SP", 3, 5, 672, [12, 14, 2, 1], 1], ["SP", 3, 10, 28, [2, 14], 1], ["RE", 3, [0, 5, 1, 6, 2, 7, 10, 11, 3, 8, 12, 4, 9]], ["FSP", 4, 0, 2, 3], ["FSP", 4, 4, 3, 3], ["RE", 4, [0, 4, 1, 5, 2, 6, 3, 7]], ["CA", 3, 4, 5], ["CHR", 2, "shared", [3]], ["CA", 3, 4, 6], ["CHR", 1, "shared", [4]], ["CA", 2, 5, 6], ["FU", 9, [0, 1, 2, 3]], ["SP", 9, 0, 131712, [4], 1], ["AN", 9, 0, 5], ["AN", 9, 1, 6], ["FU", 6, [0, 1]], ["AN", 6, 0, 5], ["FU", 6, [1, 2]], ["AN", 6, 1, 4], ["FU", 6, [2, 3]], ["AN", 6, 2, 6], ["FU", 4, [0, 1]], ["SP", 4, 0, 56, [1], 1], ["AN", 4, 1, 2], ["FFSP", 4, 0, [3, 2], 1, 1], ["AN", 4, 1, 6], ["FU", 2, [0, 1]], ["SP", 2, 0, 28, [1], 1], ["AN", 2, 1, 2], ["FFSP", 2, 0, [3, 2], 1, 1], ["AN", 2, 1, 6], ["PR", 5, 0, "auto_unroll_max_step$512"]]]], "r": [[0.00010062, 0.00010062, 0.000100598], 0, 24.6995, 1662031376], "v": "v0.6"}
{"i": [["[\"fused_pointwise_conv_bias_add_sigmoid_mul\", 14, 14, 28, 672, 1]", "cuda -keys=cuda,gpu -max_num_threads=1024 -model=unknown -thread_warp_size=32", [-1, 16, 64, 49152, 2147483647, 1024, 8, 32], "", 0, []], [[], [["CI", 5], ["CHW", 3, "local"], ["SP", 3, 0, 1, [1, 1, 1, 1], 1], ["SP", 3, 5, 672, [1, 32, 7, 3], 1], ["SP", 3, 10, 28, [2, 1], 1], ["RE", 3, [0, 5, 1, 6, 2, 7, 10, 11, 3, 8, 12, 4, 9]], ["FSP", 4, 0, 2, 3], ["FSP", 4, 4, 3, 3], ["RE", 4, [0, 4, 1, 5, 2, 6, 3, 7]], ["CA", 3, 4, 5], ["CHR", 2, "shared", [3]], ["CA", 3, 4, 6], ["CHR", 1, "shared", [4]], ["CA", 2, 5, 6], ["FU", 9, [0, 1, 2, 3]], ["SP", 9, 0, 131712, [32], 1], ["AN", 9, 0, 5], ["AN", 9, 1, 6], ["FU", 6, [0, 1]], ["AN", 6, 0, 5], ["FU", 6, [1, 2]], ["AN", 6, 1, 4], ["FU", 6, [2, 3]], ["AN", 6, 2, 6], ["FU", 4, [0, 1]], ["SP", 4, 0, 294, [1], 1], ["AN", 4, 1, 2], ["FFSP", 4, 0, [3, 2], 1, 1], ["AN", 4, 1, 6], ["FU", 2, [0, 1]], ["SP", 2, 0, 14, [7], 1], ["AN", 2, 1, 2], ["FFSP", 2, 0, [3, 2], 1, 1], ["AN", 2, 1, 6], ["PR", 5, 0, "auto_unroll_max_step$0"]]]], "r": [[3.27109e-05, 3.27323e-05, 3.27379e-05], 0, 24.5842, 1662031377], "v": "v0.6"}
{"i": [["[\"fused_pointwise_conv_bias_add_sigmoid_mul\", 14, 14, 28, 672, 1]", "cuda -keys=cuda,gpu -max_num_threads=1024 -model=unknown -thread_warp_size=32", [-1, 16, 64, 49152, 2147483647, 1024, 8, 32], "", 0, []], [[], [["CI", 5], ["CHW", 3, "local"], ["SP", 3, 0, 1, [1, 1, 1, 1], 1], ["SP", 3, 5, 672, [3, 7, 8, 1], 1], ["SP", 3, 10, 28, [1, 28], 1], ["RE", 3, [0, 5, 1, 6, 2, 7, 10, 11, 3, 8, 12, 4, 9]], ["FSP", 4, 0, 2, 3], ["FSP", 4, 4, 3, 3], ["RE", 4, [0, 4, 1, 5, 2, 6, 3, 7]], ["CA", 3, 4, 5], ["CHR", 2, "shared", [3]], ["CA", 3, 4, 6], ["CHR", 1, "shared", [4]], ["CA", 2, 5, 6], ["FU", 9, [0, 1, 2, 3]], ["SP", 9, 0, 131712, [64], 1], ["AN", 9, 0, 5], ["AN", 9, 1, 6], ["FU", 6, [0, 1]], ["AN", 6, 0, 5], ["FU", 6, [1, 2]], ["AN", 6, 1, 4], ["FU", 6, [2, 3]], ["AN", 6, 2, 6], ["FU", 4, [0, 1]], ["SP", 4, 0, 56, [1], 1], ["AN", 4, 1, 2], ["FFSP", 4, 0, [3, 2], 1, 1], ["AN", 4, 1, 6], ["FU", 2, [0, 1]], ["SP", 2, 0, 28, [1], 1], ["AN", 2, 1, 2], ["FFSP", 2, 0, [3, 2], 1, 1], ["AN", 2, 1, 6], ["PR", 5, 0, "auto_unroll_max_step$512"]]]], "r": [[6.15298e-05, 6.1517e-05, 6.14979e-05], 0, 23.3791, 1662031376], "v": "v0.6"}
{"i": [["[\"fused_pointwise_conv_bias_add_sigmoid_mul\", 14, 14, 28, 672, 1]", "cuda -keys=cuda,gpu -max_num_threads=1024 -model=unknown -thread_warp_size=32", [-1, 16, 64, 49152, 2147483647, 1024, 8, 32], "", 0, []], [[], [["CI", 5], ["CHW", 3, "local"], ["SP", 3, 0, 1, [1, 1, 1, 1], 1], ["SP", 3, 5, 672, [3, 32, 1, 7], 1], ["SP", 3, 10, 28, [1, 7], 1], ["RE", 3, [0, 5, 1, 6, 2, 7, 10, 11, 3, 8, 12, 4, 9]], ["FSP", 4, 0, 2, 3], ["FSP", 4, 4, 3, 3], ["RE", 4, [0, 4, 1, 5, 2, 6, 3, 7]], ["CA", 3, 4, 5], ["CHR", 2, "shared", [3]], ["CA", 3, 4, 6], ["CHR", 1, "shared", [4]], ["CA", 2, 5, 6], ["FU", 9, [0, 1, 2, 3]], ["SP", 9, 0, 131712, [4], 1], ["AN", 9, 0, 5], ["AN", 9, 1, 6], ["FU", 6, [0, 1]], ["AN", 6, 0, 5], ["FU", 6, [1, 2]], ["AN", 6, 1, 4], ["FU", 6, [2, 3]], ["AN", 6, 2, 6], ["FU", 4, [0, 1]], ["SP", 4, 0, 49, [1], 1], ["AN", 4, 1, 2], ["FFSP", 4, 0, [3, 2], 1, 1], ["AN", 4, 1, 6], ["FU", 2, [0, 1]], ["SP", 2, 0, 7, [1], 1], ["AN", 2, 1, 2], ["FFSP", 2, 0, [3, 2], 1, 1], ["AN", 2, 1, 6], ["PR", 5, 0, "auto_unroll_max_step$0"]]]], "r": [[6.42568e-05, 6.42632e-05, 6.42596e-05], 0, 25.3457, 1662031377], "v": "v0.6"}
{"i": [["[\"fused_pointwise_conv_bias_add_sigmoid_mul\", 14, 14, 28, 672, 1]", "cuda -keys=cuda,gpu -max_num_threads=1024 -model=unknown -thread_warp_size=32", [-1, 16, 64, 49152, 2147483647, 1024, 8, 32], "", 0, []], [[], [["CI", 5], ["CHW", 3, "local"], ["SP", 3, 0, 1, [1, 1, 1, 1], 1], ["SP", 3, 5, 672, [1, 32, 21, 1], 1], ["SP", 3, 10, 28, [4, 1], 1], ["RE", 3, [0, 5, 1, 6, 2, 7, 10, 11, 3, 8, 12, 4, 9]], ["FSP", 4, 0, 2, 3], ["FSP", 4, 4, 3, 3], ["RE", 4, [0, 4, 1, 5, 2, 6, 3, 7]], ["CA", 3, 4, 5], ["CHR", 2, "shared", [3]], ["CA", 3, 4, 6], ["CHR", 1, "shared", [4]], ["CA", 2, 5, 6], ["FU", 9, [0, 1, 2, 3]], ["SP", 9, 0, 131712, [32], 1], ["AN", 9, 0, 5], ["AN", 9, 1, 6], ["FU", 6, [0, 1]], ["AN", 6, 0, 5], ["FU", 6, [1, 2]], ["AN", 6, 1, 4], ["FU", 6, [2, 3]], ["AN", 6, 2, 6], ["FU", 4, [0, 1]], ["SP", 4, 0, 84, [1], 1], ["AN", 4, 1, 2], ["FFSP", 4, 0, [3, 2], 1, 1], ["AN", 4, 1, 6], ["FU", 2, [0, 1]], ["SP", 2, 0, 4, [2], 1], ["AN", 2, 1, 2], ["FFSP", 2, 0, [3, 2], 1, 1], ["AN", 2, 1, 6], ["PR", 5, 0, "auto_unroll_max_step$0"]]]], "r": [[2.76687e-05, 2.76835e-05, 2.76703e-05], 0, 25.0787, 1662031378], "v": "v0.6"}
{"i": [["[\"fused_pointwise_conv_bias_add_sigmoid_mul\", 14, 14, 28, 672, 1]", "cuda -keys=cuda,gpu -max_num_threads=1024 -model=unknown -thread_warp_size=32", [-1, 16, 64, 49152, 2147483647, 1024, 8, 32], "", 0, []], [[], [["CI", 5], ["CHW", 3, "local"], ["SP", 3, 0, 1, [1, 1, 1, 1], 1], ["SP", 3, 5, 672, [1, 112, 1, 1], 1], ["SP", 3, 10, 28, [7, 4], 1], ["RE", 3, [0, 5, 1, 6, 2, 7, 10, 11, 3, 8, 12, 4, 9]], ["FSP", 4, 0, 2, 3], ["FSP", 4, 4, 3, 3], ["RE", 4, [0, 4, 1, 5, 2, 6, 3, 7]], ["CA", 3, 4, 5], ["CHR", 2, "shared", [3]], ["CA", 3, 4, 6], ["CHR", 1, "shared", [4]], ["CA", 2, 5, 6], ["FU", 9, [0, 1, 2, 3]], ["SP", 9, 0, 131712, [32], 1], ["AN", 9, 0, 5], ["AN", 9, 1, 6], ["FU", 6, [0, 1]], ["AN", 6, 0, 5], ["FU", 6, [1, 2]], ["AN", 6, 1, 4], ["FU", 6, [2, 3]], ["AN", 6, 2, 6], ["FU", 4, [0, 1]], ["SP", 4, 0, 4, [1], 1], ["AN", 4, 1, 2], ["FFSP", 4, 0, [3, 2], 1, 1], ["AN", 4, 1, 6], ["FU", 2, [0, 1]], ["SP", 2, 0, 4, [1], 1], ["AN", 2, 1, 2], ["FFSP", 2, 0, [3, 2], 1, 1], ["AN", 2, 1, 6], ["PR", 5, 0, "auto_unroll_max_step$64"]]]], "r": [[1.60857e-05, 1.60898e-05, 1.60913e-05], 0, 25.0612, 1662031379], "v": "v0.6"}
{"i": [["[\"fused_pointwise_conv_bias_add_sigmoid_mul\", 14, 14, 28, 672, 1]", "cuda -keys=cuda,gpu -max_num_threads=1024 -model=unknown -thread_warp_size=32", [-1, 16, 64, 49152, 2147483647, 1024, 8, 32], "", 0, []], [[], [["CI", 5], ["CHW", 3, "local"], ["SP", 3, 0, 1, [1, 1, 1, 1], 1], ["SP", 3, 5, 672, [1, 56, 2, 1], 1], ["SP", 3, 10, 28, [1, 14], 1], ["RE", 3, [0, 5, 1, 6, 2, 7, 10, 11, 3, 8, 12, 4, 9]], ["FSP", 4, 0, 2, 3], ["FSP", 4, 4, 3, 3], ["RE", 4, [0, 4, 1, 5, 2, 6, 3, 7]], ["CA", 3, 4, 5], ["CHR", 2, "shared", [3]], ["CA", 3, 4, 6], ["CHR", 1, "shared", [4]], ["CA", 2, 5, 6], ["FU", 9, [0, 1, 2, 3]], ["SP", 9, 0, 131712, [3], 1], ["AN", 9, 0, 5], ["AN", 9, 1, 6], ["FU", 6, [0, 1]], ["AN", 6, 0, 5], ["FU", 6, [1, 2]], ["AN", 6, 1, 4], ["FU", 6, [2, 3]], ["AN", 6, 2, 6], ["FU", 4, [0, 1]], ["SP", 4, 0, 28, [1], 1], ["AN", 4, 1, 2], ["FFSP", 4, 0, [3, 2], 1, 1], ["AN", 4, 1, 6], ["FU", 2, [0, 1]], ["SP", 2, 0, 14, [1], 1], ["AN", 2, 1, 2], ["FFSP", 2, 0, [3, 2], 1, 1], ["AN", 2, 1, 6], ["PR", 5, 0, "auto_unroll_max_step$0"]]]], "r": [[7.24259e-05, 7.24425e-05, 7.24277e-05], 0, 25.1102, 1662031379], "v": "v0.6"}
{"i": [["[\"fused_pointwise_conv_bias_add_sigmoid_mul\", 14, 14, 28, 672, 1]", "cuda -keys=cuda,gpu -max_num_threads=1024 -model=unknown -thread_warp_size=32", [-1, 16, 64, 49152, 2147483647, 1024, 8, 32], "", 0, []], [[], [["CI", 5], ["CHW", 3, "local"], ["SP", 3, 0, 1, [1, 1, 1, 1], 1], ["SP", 3, 5, 672, [1, 32, 21, 1], 1], ["SP", 3, 10, 28, [1, 4], 1], ["RE", 3, [0, 5, 1, 6, 2, 7, 10, 11, 3, 8, 12, 4, 9]], ["FSP", 4, 0, 2, 3], ["FSP", 4, 4, 3, 3], ["RE", 4, [0, 4, 1, 5, 2, 6, 3, 7]], ["CA", 3, 4, 5], ["CHR", 2, "shared", [3]], ["CA", 3, 4, 6], ["CHR", 1, "shared", [4]], ["CA", 2, 5, 6], ["FU", 9, [0, 1, 2, 3]], ["SP", 9, 0, 131712, [32], 1], ["AN", 9, 0, 5], ["AN", 9, 1, 6], ["FU", 6, [0, 1]], ["AN", 6, 0, 5], ["FU", 6, [1, 2]], ["AN", 6, 1, 4], ["FU", 6, [2, 3]], ["AN", 6, 2, 6], ["FU", 4, [0, 1]], ["SP", 4, 0, 84, [3], 1], ["AN", 4, 1, 2], ["FFSP", 4, 0, [3, 2], 1, 1], ["AN", 4, 1, 6], ["FU", 2, [0, 1]], ["SP", 2, 0, 4, [1], 1], ["AN", 2, 1, 2], ["FFSP", 2, 0, [3, 2], 1, 1], ["AN", 2, 1, 6], ["PR", 5, 0, "auto_unroll_max_step$1024"]]]], "r": [[2.69719e-05, 2.69601e-05, 2.69801e-05], 0, 26.2308, 1662031380], "v": "v0.6"}
{"i": [["[\"fused_pointwise_conv_bias_add_sigmoid_mul\", 14, 14, 28, 672, 1]", "cuda -keys=cuda,gpu -max_num_threads=1024 -model=unknown -thread_warp_size=32", [-1, 16, 64, 49152, 2147483647, 1024, 8, 32], "", 0, []], [[], [["CI", 5], ["CHW", 3, "local"], ["SP", 3, 0, 1, [1, 1, 1, 1], 1], ["SP", 3, 5, 672, [12, 28, 1, 1], 1], ["SP", 3, 10, 28, [1, 28], 1], ["RE", 3, [0, 5, 1, 6, 2, 7, 10, 11, 3, 8, 12, 4, 9]], ["FSP", 4, 0, 2, 3], ["FSP", 4, 4, 3, 3], ["RE", 4, [0, 4, 1, 5, 2, 6, 3, 7]], ["CA", 3, 4, 5], ["CHR", 2, "shared", [3]], ["CA", 3, 4, 6], ["CHR", 1, "shared", [4]], ["CA", 2, 5, 6], ["FU", 9, [0, 1, 2, 3]], ["SP", 9, 0, 131712, [32], 1], ["AN", 9, 0, 5], ["AN", 9, 1, 6], ["FU", 6, [0, 1]], ["AN", 6, 0, 5], ["FU", 6, [1, 2]], ["AN", 6, 1, 4], ["FU", 6, [2, 3]], ["AN", 6, 2, 6], ["FU", 4, [0, 1]], ["SP", 4, 0, 56, [2], 1], ["AN", 4, 1, 2], ["FFSP", 4, 0, [3, 2], 1, 1], ["AN", 4, 1, 6], ["FU", 2, [0, 1]], ["SP", 2, 0, 28, [1], 1], ["AN", 2, 1, 2], ["FFSP", 2, 0, [3, 2], 1, 1], ["AN", 2, 1, 6], ["PR", 5, 0, "auto_unroll_max_step$512"]]]], "r": [[2.1819e-05, 2.18193e-05, 2.18059e-05], 0, 25.9772, 1662031381], "v": "v0.6"}
{"i": [["[\"fused_pointwise_conv_bias_add_sigmoid_mul\", 14, 14, 28, 672, 1]", "cuda -keys=cuda,gpu -max_num_threads=1024 -model=unknown -thread_warp_size=32", [-1, 16, 64, 49152, 2147483647, 1024, 8, 32], "", 0, []], [[], [["CI", 5], ["CHW", 3, "local"], ["SP", 3, 0, 1, [1, 1, 1, 1], 1], ["SP", 3, 5, 672, [1, 168, 2, 1], 1], ["SP", 3, 10, 28, [28, 1], 1], ["RE", 3, [0, 5, 1, 6, 2, 7, 10, 11, 3, 8, 12, 4, 9]], ["FSP", 4, 0, 2, 3], ["FSP", 4, 4, 3, 3], ["RE", 4, [0, 4, 1, 5, 2, 6, 3, 7]], ["CA", 3, 4, 5], ["CHR", 2, "shared", [3]], ["CA", 3, 4, 6], ["CHR", 1, "shared", [4]], ["CA", 2, 5, 6], ["FU", 9, [0, 1, 2, 3]], ["SP", 9, 0, 131712, [2], 1], ["AN", 9, 0, 5], ["AN", 9, 1, 6], ["FU", 6, [0, 1]], ["AN", 6, 0, 5], ["FU", 6, [1, 2]], ["AN", 6, 1, 4], ["FU", 6, [2, 3]], ["AN", 6, 2, 6], ["FU", 4, [0, 1]], ["SP", 4, 0, 56, [1], 1], ["AN", 4, 1, 2], ["FFSP", 4, 0, [3, 2], 1, 1], ["AN", 4, 1, 6], ["FU", 2, [0, 1]], ["SP", 2, 0, 28, [1], 1], ["AN", 2, 1, 2], ["FFSP", 2, 0, [3, 2], 1, 1], ["AN", 2, 1, 6], ["PR", 5, 0, "auto_unroll_max_step$1024"]]]], "r": [[9.98057e-05, 9.98168e-05, 9.98053e-05], 0, 25.675, 1662031382], "v": "v0.6"}
{"i": [["[\"fused_pointwise_conv_bias_add_sigmoid_mul\", 14, 14, 28, 672, 1]", "cuda -keys=cuda,gpu -max_num_threads=1024 -model=unknown -thread_warp_size=32", [-1, 16, 64, 49152, 2147483647, 1024, 8, 32], "", 0, []], [[], [["CI", 5], ["CHW", 3, "local"], ["SP", 3, 0, 1, [1, 1, 1, 1], 1], ["SP", 3, 5, 672, [1, 42, 2, 8], 1], ["SP", 3, 10, 28, [1, 1], 1], ["RE", 3, [0, 5, 1, 6, 2, 7, 10, 11, 3, 8, 12, 4, 9]], ["FSP", 4, 0, 2, 3], ["FSP", 4, 4, 3, 3], ["RE", 4, [0, 4, 1, 5, 2, 6, 3, 7]], ["CA", 3, 4, 5], ["CHR", 2, "shared", [3]], ["CA", 3, 4, 6], ["CHR", 1, "shared", [4]], ["CA", 2, 5, 6], ["FU", 9, [0, 1, 2, 3]], ["SP", 9, 0, 131712, [32], 1], ["AN", 9, 0, 5], ["AN", 9, 1, 6], ["FU", 6, [0, 1]], ["AN", 6, 0, 5], ["FU", 6, [1, 2]], ["AN", 6, 1, 4], ["FU", 6, [2, 3]], ["AN", 6, 2, 6], ["FU", 4, [0, 1]], ["SP", 4, 0, 112, [1], 1], ["AN", 4, 1, 2], ["FFSP", 4, 0, [3, 2], 1, 1], ["AN", 4, 1, 6], ["FU", 2, [0, 1]], ["SP", 2, 0, 7, [1], 1], ["AN", 2, 1, 2], ["FFSP", 2, 0, [3, 2], 1, 1], ["AN", 2, 1, 6], ["PR", 5, 0, "auto_unroll_max_step$64"]]]], "r": [[8.32121e-05, 8.32102e-05, 8.32035e-05], 0, 25.5869, 1662031383], "v": "v0.6"}
{"i": [["[\"fused_pointwise_conv_bias_add_sigmoid_mul\", 14, 14, 28, 672, 1]", "cuda -keys=cuda,gpu -max_num_threads=1024 -model=unknown -thread_warp_size=32", [-1, 16, 64, 49152, 2147483647, 1024, 8, 32], "", 0, []], [[], [["CI", 5], ["CHW", 3, "local"], ["SP", 3, 0, 1, [1, 1, 1, 1], 1], ["SP", 3, 5, 672, [3, 1, 2, 56], 1], ["SP", 3, 10, 28, [1, 28], 1], ["RE", 3, [0, 5, 1, 6, 2, 7, 10, 11, 3, 8, 12, 4, 9]], ["FSP", 4, 0, 2, 3], ["FSP", 4, 4, 3, 3], ["RE", 4, [0, 4, 1, 5, 2, 6, 3, 7]], ["CA", 3, 4, 5], ["CHR", 2, "shared", [3]], ["CA", 3, 4, 6], ["CHR", 1, "shared", [4]], ["CA", 2, 5, 6], ["FU", 9, [0, 1, 2, 3]], ["SP", 9, 0, 131712, [64], 1], ["AN", 9, 0, 5], ["AN", 9, 1, 6], ["FU", 6, [0, 1]], ["AN", 6, 0, 5], ["FU", 6, [1, 2]], ["AN", 6, 1, 4], ["FU", 6, [2, 3]], ["AN", 6, 2, 6], ["FU", 4, [0, 1]], ["SP", 4, 0, 56, [1], 1], ["AN", 4, 1, 2], ["FFSP", 4, 0, [3, 2], 1, 1], ["AN", 4, 1, 6], ["FU", 2, [0, 1]], ["SP", 2, 0, 28, [1], 1], ["AN", 2, 1, 2], ["FFSP", 2, 0, [3, 2], 1, 1], ["AN", 2, 1, 6], ["PR", 5, 0, "auto_unroll_max_step$512"]]]], "r": [[0.000184565, 0.000184558, 0.000184513], 0, 26.5142, 1662031383], "v": "v0.6"}
{"i": [["[\"fused_pointwise_conv_bias_add_sigmoid_mul\", 14, 14, 28, 672, 1]", "cuda -keys=cuda,gpu -max_num_threads=1024 -model=unknown -thread_warp_size=32", [-1, 16, 64, 49152, 2147483647, 1024, 8, 32], "", 0, []], [[], [["CI", 5], ["CHW", 3, "local"], ["SP", 3, 0, 1, [1, 1, 1, 1], 1], ["SP", 3, 5, 672, [1, 168, 1, 1], 1], ["SP", 3, 10, 28, [2, 7], 1], ["RE", 3, [0, 5, 1, 6, 2, 7, 10, 11, 3, 8, 12, 4, 9]], ["FSP", 4, 0, 2, 3], ["FSP", 4, 4, 3, 3], ["RE", 4, [0, 4, 1, 5, 2, 6, 3, 7]], ["CA", 3, 4, 5], ["CHR", 2, "shared", [3]], ["CA", 3, 4, 6], ["CHR", 1, "shared", [4]], ["CA", 2, 5, 6], ["FU", 9, [0, 1, 2, 3]], ["SP", 9, 0, 131712, [8], 1], ["AN", 9, 0, 5], ["AN", 9, 1, 6], ["FU", 6, [0, 1]], ["AN", 6, 0, 5], ["FU", 6, [1, 2]], ["AN", 6, 1, 4], ["FU", 6, [2, 3]], ["AN", 6, 2, 6], ["FU", 4, [0, 1]], ["SP", 4, 0, 14, [1], 1], ["AN", 4, 1, 2], ["FFSP", 4, 0, [3, 2], 1, 1], ["AN", 4, 1, 6], ["FU", 2, [0, 1]], ["SP", 2, 0, 14, [7], 1], ["AN", 2, 1, 2], ["FFSP", 2, 0, [3, 2], 1, 1], ["AN", 2, 1, 6], ["PR", 5, 0, "auto_unroll_max_step$64"]]]], "r": [[3.37544e-05, 3.37963e-05, 3.37902e-05], 0, 25.6783, 1662031384], "v": "v0.6"}
{"i": [["[\"fused_pointwise_conv_bias_add_sigmoid_mul\", 14, 14, 28, 672, 1]", "cuda -keys=cuda,gpu -max_num_threads=1024 -model=unknown -thread_warp_size=32", [-1, 16, 64, 49152, 2147483647, 1024, 8, 32], "", 0, []], [[], [["CI", 5], ["CHW", 3, "local"], ["SP", 3, 0, 1, [1, 1, 1, 1], 1], ["SP", 3, 5, 672, [1, 56, 4, 1], 1], ["SP", 3, 10, 28, [1, 1], 1], ["RE", 3, [0, 5, 1, 6, 2, 7, 10, 11, 3, 8, 12, 4, 9]], ["FSP", 4, 0, 2, 3], ["FSP", 4, 4, 3, 3], ["RE", 4, [0, 4, 1, 5, 2, 6, 3, 7]], ["CA", 3, 4, 5], ["CHR", 2, "shared", [3]], ["CA", 3, 4, 6], ["CHR", 1, "shared", [4]], ["CA", 2, 5, 6], ["FU", 9, [0, 1, 2, 3]], ["SP", 9, 0, 131712, [28], 1], ["AN", 9, 0, 5], ["AN", 9, 1, 6], ["FU", 6, [0, 1]], ["AN", 6, 0, 5], ["FU", 6, [1, 2]], ["AN", 6, 1, 4], ["FU", 6, [2, 3]], ["AN", 6, 2, 6], ["FU", 4, [0, 1]], ["SP", 4, 0, 8, [1], 1], ["AN", 4, 1, 2], ["FFSP", 4, 0, [3, 2], 1, 1], ["AN", 4, 1, 6], ["FU", 2, [0, 1]], ["SP", 2, 0, 2, [2], 1], ["AN", 2, 1, 2], ["FFSP", 2, 0, [3, 2], 1, 1], ["AN", 2, 1, 6], ["PR", 5, 0, "auto_unroll_max_step$0"]]]], "r": [[2.38679e-05, 2.38805e-05, 2.38777e-05], 0, 25.6049, 1662031385], "v": "v0.6"}
{"i": [["[\"fused_pointwise_conv_bias_add_sigmoid_mul\", 14, 14, 28, 672, 1]", "cuda -keys=cuda,gpu -max_num_threads=1024 -model=unknown -thread_warp_size=32", [-1, 16, 64, 49152, 2147483647, 1024, 8, 32], "", 0, []], [[], [["CI", 5], ["CHW", 3, "local"], ["SP", 3, 0, 1, [1, 1, 1, 1], 1], ["SP", 3, 5, 672, [1, 56, 4, 1], 1], ["SP", 3, 10, 28, [2, 1], 1], ["RE", 3, [0, 5, 1, 6, 2, 7, 10, 11, 3, 8, 12, 4, 9]], ["FSP", 4, 0, 2, 3], ["FSP", 4, 4, 3, 3], ["RE", 4, [0, 4, 1, 5, 2, 6, 3, 7]], ["CA", 3, 4, 5], ["CHR", 2, "shared", [3]], ["CA", 3, 4, 6], ["CHR", 1, "shared", [4]], ["CA", 2, 5, 6], ["FU", 9, [0, 1, 2, 3]], ["SP", 9, 0, 131712, [32], 1], ["AN", 9, 0, 5], ["AN", 9, 1, 6], ["FU", 6, [0, 1]], ["AN", 6, 0, 5], ["FU", 6, [1, 2]], ["AN", 6, 1, 4], ["FU", 6, [2, 3]], ["AN", 6, 2, 6], ["FU", 4, [0, 1]], ["SP", 4, 0, 8, [1], 1], ["AN", 4, 1, 2], ["FFSP", 4, 0, [3, 2], 1, 1], ["AN", 4, 1, 6], ["FU", 2, [0, 1]], ["SP", 2, 0, 2, [1], 1], ["AN", 2, 1, 2], ["FFSP", 2, 0, [3, 2], 1, 1], ["AN", 2, 1, 6], ["PR", 5, 0, "auto_unroll_max_step$512"]]]], "r": [[2.15369e-05, 2.15389e-05, 2.15456e-05], 0, 25.6367, 1662031385], "v": "v0.6"}
{"i": [["[\"fused_pointwise_conv_bias_add_sigmoid_mul\", 14, 14, 28, 672, 1]", "cuda -keys=cuda,gpu -max_num_threads=1024 -model=unknown -thread_warp_size=32", [-1, 16, 64, 49152, 2147483647, 1024, 8, 32], "", 0, []], [[], [["CI", 5], ["CHW", 3, "local"], ["SP", 3, 0, 1, [1, 1, 1, 1], 1], ["SP", 3, 5, 672, [1, 42, 2, 2], 1], ["SP", 3, 10, 28, [2, 2], 1], ["RE", 3, [0, 5, 1, 6, 2, 7, 10, 11, 3, 8, 12, 4, 9]], ["FSP", 4, 0, 2, 3], ["FSP", 4, 4, 3, 3], ["RE", 4, [0, 4, 1, 5, 2, 6, 3, 7]], ["CA", 3, 4, 5], ["CHR", 2, "shared", [3]], ["CA", 3, 4, 6], ["CHR", 1, "shared", [4]], ["CA", 2, 5, 6], ["FU", 9, [0, 1, 2, 3]], ["SP", 9, 0, 131712, [1], 1], ["AN", 9, 0, 5], ["AN", 9, 1, 6], ["FU", 6, [0, 1]], ["AN", 6, 0, 5], ["FU", 6, [1, 2]], ["AN", 6, 1, 4], ["FU", 6, [2, 3]], ["AN", 6, 2, 6], ["FU", 4, [0, 1]], ["SP", 4, 0, 16, [1], 1], ["AN", 4, 1, 2], ["FFSP", 4, 0, [3, 2], 1, 1], ["AN", 4, 1, 6], ["FU", 2, [0, 1]], ["SP", 2, 0, 4, [2], 1], ["AN", 2, 1, 2], ["FFSP", 2, 0, [3, 2], 1, 1], ["AN", 2, 1, 6], ["PR", 5, 0, "auto_unroll_max_step$64"]]]], "r": [[0.000191095, 0.000191115, 0.000191104], 0, 25.1989, 1662031386], "v": "v0.6"}
{"i": [["[\"fused_pointwise_conv_bias_add_sigmoid_mul\", 14, 14, 28, 672, 1]", "cuda -keys=cuda,gpu -max_num_threads=1024 -model=unknown -thread_warp_size=32", [-1, 16, 64, 49152, 2147483647, 1024, 8, 32], "", 0, []], [[], [["CI", 5], ["CHW", 3, "local"], ["SP", 3, 0, 1, [1, 1, 1, 1], 1], ["SP", 3, 5, 672, [2, 336, 1, 1], 1], ["SP", 3, 10, 28, [1, 14], 1], ["RE", 3, [0, 5, 1, 6, 2, 7, 10, 11, 3, 8, 12, 4, 9]], ["FSP", 4, 0, 2, 3], ["FSP", 4, 4, 3, 3], ["RE", 4, [0, 4, 1, 5, 2, 6, 3, 7]], ["CA", 3, 4, 5], ["CHR", 2, "shared", [3]], ["CA", 3, 4, 6], ["CHR", 1, "shared", [4]], ["CA", 2, 5, 6], ["FU", 9, [0, 1, 2, 3]], ["SP", 9, 0, 131712, [32], 1], ["AN", 9, 0, 5], ["AN", 9, 1, 6], ["FU", 6, [0, 1]], ["AN", 6, 0, 5], ["FU", 6, [1, 2]], ["AN", 6, 1, 4], ["FU", 6, [2, 3]], ["AN", 6, 2, 6], ["FU", 4, [0, 1]], ["SP", 4, 0, 14, [1], 1], ["AN", 4, 1, 2], ["FFSP", 4, 0, [3, 2], 1, 1], ["AN", 4, 1, 6], ["FU", 2, [0, 1]], ["SP", 2, 0, 14, [1], 1], ["AN", 2, 1, 2], ["FFSP", 2, 0, [3, 2], 1, 1], ["AN", 2, 1, 6], ["PR", 5, 0, "auto_unroll_max_step$0"]]]], "r": [[1.90607e-05, 1.90614e-05, 1.90676e-05], 0, 25.2375, 1662031386], "v": "v0.6"}
{"i": [["[\"fused_pointwise_conv_bias_add_sigmoid_mul\", 14, 14, 28, 672, 1]", "cuda -keys=cuda,gpu -max_num_threads=1024 -model=unknown -thread_warp_size=32", [-1, 16, 64, 49152, 2147483647, 1024, 8, 32], "", 0, []], [[], [["CI", 5], ["CHW", 3, "local"], ["SP", 3, 0, 1, [1, 1, 1, 1], 1], ["SP", 3, 5, 672, [1, 96, 1, 7], 1], ["SP", 3, 10, 28, [1, 4], 1], ["RE", 3, [0, 5, 1, 6, 2, 7, 10, 11, 3, 8, 12, 4, 9]], ["FSP", 4, 0, 2, 3], ["FSP", 4, 4, 3, 3], ["RE", 4, [0, 4, 1, 5, 2, 6, 3, 7]], ["CA", 3, 4, 5], ["CHR", 2, "shared", [3]], ["CA", 3, 4, 6], ["CHR", 1, "shared", [4]], ["CA", 2, 5, 6], ["FU", 9, [0, 1, 2, 3]], ["SP", 9, 0, 131712, [32], 1], ["AN", 9, 0, 5], ["AN", 9, 1, 6], ["FU", 6, [0, 1]], ["AN", 6, 0, 5], ["FU", 6, [1, 2]], ["AN", 6, 1, 4], ["FU", 6, [2, 3]], ["AN", 6, 2, 6], ["FU", 4, [0, 1]], ["SP", 4, 0, 4, [2], 1], ["AN", 4, 1, 2], ["FFSP", 4, 0, [3, 2], 1, 1], ["AN", 4, 1, 6], ["FU", 2, [0, 1]], ["SP", 2, 0, 4, [1], 1], ["AN", 2, 1, 2], ["FFSP", 2, 0, [3, 2], 1, 1], ["AN", 2, 1, 6], ["PR", 5, 0, "auto_unroll_max_step$64"]]]], "r": [[2.18334e-05, 2.18129e-05, 2.18208e-05], 0, 25.179, 1662031387], "v": "v0.6"}
{"i": [["[\"fused_pointwise_conv_bias_add_sigmoid_mul\", 14, 14, 28, 672, 1]", "cuda -keys=cuda,gpu -max_num_threads=1024 -model=unknown -thread_warp_size=32", [-1, 16, 64, 49152, 2147483647, 1024, 8, 32], "", 0, []], [[], [["CI", 5], ["CHW", 3, "local"], ["SP", 3, 0, 1, [1, 1, 1, 1], 1], ["SP", 3, 5, 672, [2, 42, 1, 2], 1], ["SP", 3, 10, 28, [1, 28], 1], ["RE", 3, [0, 5, 1, 6, 2, 7, 10, 11, 3, 8, 12, 4, 9]], ["FSP", 4, 0, 2, 3], ["FSP", 4, 4, 3, 3], ["RE", 4, [0, 4, 1, 5, 2, 6, 3, 7]], ["CA", 3, 4, 5], ["CHR", 2, "shared", [3]], ["CA", 3, 4, 6], ["CHR", 1, "shared", [4]], ["CA", 2, 5, 6], ["FU", 9, [0, 1, 2, 3]], ["SP", 9, 0, 131712, [32], 1], ["AN", 9, 0, 5], ["AN", 9, 1, 6], ["FU", 6, [0, 1]], ["AN", 6, 0, 5], ["FU", 6, [1, 2]], ["AN", 6, 1, 4], ["FU", 6, [2, 3]], ["AN", 6, 2, 6], ["FU", 4, [0, 1]], ["SP", 4, 0, 56, [4], 1], ["AN", 4, 1, 2], ["FFSP", 4, 0, [3, 2], 1, 1], ["AN", 4, 1, 6], ["FU", 2, [0, 1]], ["SP", 2, 0, 28, [7], 1], ["AN", 2, 1, 2], ["FFSP", 2, 0, [3, 2], 1, 1], ["AN", 2, 1, 6], ["PR", 5, 0, "auto_unroll_max_step$1024"]]]], "r": [[1.71066e-05, 1.71023e-05, 1.71095e-05], 0, 25.2157, 1662031387], "v": "v0.6"}
{"i": [["[\"fused_pointwise_conv_bias_add_sigmoid_mul\", 14, 14, 28, 672, 1]", "cuda -keys=cuda,gpu -max_num_threads=1024 -model=unknown -thread_warp_size=32", [-1, 16, 64, 49152, 2147483647, 1024, 8, 32], "", 0, []], [[], [["CI", 5], ["CHW", 3, "local"], ["SP", 3, 0, 1, [1, 1, 1, 1], 1], ["SP", 3, 5, 672, [1, 112, 3, 1], 1], ["SP", 3, 10, 28, [2, 1], 1], ["RE", 3, [0, 5, 1, 6, 2, 7, 10, 11, 3, 8, 12, 4, 9]], ["FSP", 4, 0, 2, 3], ["FSP", 4, 4, 3, 3], ["RE", 4, [0, 4, 1, 5, 2, 6, 3, 7]], ["CA", 3, 4, 5], ["CHR", 2, "shared", [3]], ["CA", 3, 4, 6], ["CHR", 1, "shared", [4]], ["CA", 2, 5, 6], ["FU", 9, [0, 1, 2, 3]], ["SP", 9, 0, 131712, [32], 1], ["AN", 9, 0, 5], ["AN", 9, 1, 6], ["FU", 6, [0, 1]], ["AN", 6, 0, 5], ["FU", 6, [1, 2]], ["AN", 6, 1, 4], ["FU", 6, [2, 3]], ["AN", 6, 2, 6], ["FU", 4, [0, 1]], ["SP", 4, 0, 3, [3], 1], ["AN", 4, 1, 2], ["FFSP", 4, 0, [3, 2], 1, 1], ["AN", 4, 1, 6], ["FU", 2, [0, 1]], ["SP", 2, 0, 1, [1], 1], ["AN", 2, 1, 2], ["FFSP", 2, 0, [3, 2], 1, 1], ["AN", 2, 1, 6], ["PR", 5, 0, "auto_unroll_max_step$16"]]]], "r": [[1.99378e-05, 1.99652e-05, 1.99415e-05], 0, 25.129, 1662031388], "v": "v0.6"}
{"i": [["[\"fused_pointwise_conv_bias_add_sigmoid_mul\", 14, 14, 28, 672, 1]", "cuda -keys=cuda,gpu -max_num_threads=1024 -model=unknown -thread_warp_size=32", [-1, 16, 64, 49152, 2147483647, 1024, 8, 32], "", 0, []], [[], [["CI", 5], ["CHW", 3, "local"], ["SP", 3, 0, 1, [1, 1, 1, 1], 1], ["SP", 3, 5, 672, [1, 112, 1, 1], 1], ["SP", 3, 10, 28, [1, 2], 1], ["RE", 3, [0, 5, 1, 6, 2, 7, 10, 11, 3, 8, 12, 4, 9]], ["FSP", 4, 0, 2, 3], ["FSP", 4, 4, 3, 3], ["RE", 4, [0, 4, 1, 5, 2, 6, 3, 7]], ["CA", 3, 4, 5], ["CHR", 2, "shared", [3]], ["CA", 3, 4, 6], ["CHR", 1, "shared", [4]], ["CA", 2, 5, 6], ["FU", 9, [0, 1, 2, 3]], ["SP", 9, 0, 131712, [64], 1], ["AN", 9, 0, 5], ["AN", 9, 1, 6], ["FU", 6, [0, 1]], ["AN", 6, 0, 5], ["FU", 6, [1, 2]], ["AN", 6, 1, 4], ["FU", 6, [2, 3]], ["AN", 6, 2, 6], ["FU", 4, [0, 1]], ["SP", 4, 0, 4, [1], 1], ["AN", 4, 1, 2], ["FFSP", 4, 0, [3, 2], 1, 1], ["AN", 4, 1, 6], ["FU", 2, [0, 1]], ["SP", 2, 0, 4, [2], 1], ["AN", 2, 1, 2], ["FFSP", 2, 0, [3, 2], 1, 1], ["AN", 2, 1, 6], ["PR", 5, 0, "auto_unroll_max_step$64"]]]], "r": [[1.45774e-05, 1.45894e-05, 1.45846e-05], 0, 25.0928, 1662031389], "v": "v0.6"}
