python/models/efficientnet/kernel_configs/efficient_reduce_mean_112_112_32.log
{"i": [["[\"reduce_mean\", 112, 112, 32]", "cuda -keys=cuda,gpu -max_num_threads=1024 -model=unknown -thread_warp_size=32", [-1, 16, 64, 49152, 2147483647, 1024, 8, 32], "", 0, []], [[], [["FU", 1, [2, 3]], ["SP", 2, 1, 32, [16], 1], ["AN", 2, 2, 6], ["FSP", 1, 2, 1, 1], ["AN", 1, 3, 6], ["CA", 1, 2, 1], ["FU", 2, [0, 1]], ["AN", 2, 0, 5], ["PR", 1, 0, "auto_unroll_max_step$1024"]]]], "r": [[0.000193875, 0.000193883, 0.00019398, 0.000193904, 0.000193898, 0.000193884, 0.000193873, 0.00019389, 0.000193877, 0.000193878], 0, 13.0883, 1649336920], "v": "v0.6"}
{"i": [["[\"reduce_mean\", 112, 112, 32]", "cuda -keys=cuda,gpu -max_num_threads=1024 -model=unknown -thread_warp_size=32", [-1, 16, 64, 49152, 2147483647, 1024, 8, 32], "", 0, []], [[], [["FU", 2, [0, 1]], ["AN", 2, 0, 6], ["FU", 1, [0, 1]], ["AN", 1, 0, 6], ["PR", 1, 0, "auto_unroll_max_step$1024"]]]], "r": [[9.01992e-05, 9.02143e-05, 9.01948e-05, 9.01316e-05, 9.01067e-05, 9.01883e-05, 9.02523e-05, 9.02372e-05, 9.02548e-05, 9.02644e-05], 0, 27.8139, 1649336936], "v": "v0.6"}
{"i": [["[\"reduce_mean\", 112, 112, 32]", "cuda -keys=cuda,gpu -max_num_threads=1024 -model=unknown -thread_warp_size=32", [-1, 16, 64, 49152, 2147483647, 1024, 8, 32], "", 0, []], [[], [["FU", 2, [0, 1]], ["AN", 2, 0, 6], ["FU", 1, [0, 1]], ["AN", 1, 0, 6], ["PR", 1, 0, "auto_unroll_max_step$64"]]]], "r": [[9.02458e-05, 9.01809e-05, 9.01877e-05, 9.02297e-05, 9.01941e-05, 9.0236e-05, 9.02914e-05, 9.02728e-05, 9.02735e-05, 9.02591e-05], 0, 38.6903, 1649336947], "v": "v0.6"}
{"i": [["[\"reduce_mean\", 112, 112, 32]", "cuda -keys=cuda,gpu -max_num_threads=1024 -model=unknown -thread_warp_size=32", [-1, 16, 64, 49152, 2147483647, 1024, 8, 32], "", 0, []], [[], [["FU", 1, [2, 3]], ["SP", 2, 1, 32, [8], 1], ["AN", 2, 2, 6], ["FSP", 1, 2, 1, 1], ["AN", 1, 3, 6], ["CA", 1, 2, 1], ["FU", 2, [0, 1]], ["AN", 2, 0, 5], ["PR", 1, 0, "auto_unroll_max_step$0"]]]], "r": [[0.000138651, 0.000138728, 0.000138706, 0.000138688, 0.000138669, 0.000138662, 0.000138682, 0.000138619, 0.000138639, 0.000138663], 0, 49.7159, 1649336958], "v": "v0.6"}
{"i": [["[\"reduce_mean\", 112, 112, 32]", "cuda -keys=cuda,gpu -max_num_threads=1024 -model=unknown -thread_warp_size=32", [-1, 16, 64, 49152, 2147483647, 1024, 8, 32], "", 0, []], [[], [["FU", 1, [2, 3]], ["SP", 2, 1, 32, [32], 1], ["AN", 2, 2, 6], ["FSP", 1, 2, 1, 1], ["AN", 1, 3, 6], ["CA", 1, 2, 1], ["FU", 2, [0, 1]], ["AN", 2, 0, 5], ["PR", 1, 0, "auto_unroll_max_step$0"]]]], "r": [[0.000359281, 0.00035944, 0.000359499, 0.000359601, 0.000359437, 0.000359586, 0.000359593, 0.000359481, 0.000359397, 0.000359478], 0, 5.85115, 1649336914], "v": "v0.6"}
{"i": [["[\"reduce_mean\", 112, 112, 32]", "cuda -keys=cuda,gpu -max_num_threads=1024 -model=unknown -thread_warp_size=32", [-1, 16, 64, 49152, 2147483647, 1024, 8, 32], "", 0, []], [[], [["FU", 1, [2, 3]], ["SP", 2, 1, 32, [32], 1], ["AN", 2, 2, 6], ["FSP", 1, 2, 1, 1], ["AN", 1, 3, 6], ["CA", 1, 2, 1], ["FU", 2, [0, 1]], ["AN", 2, 0, 5], ["PR", 1, 0, "auto_unroll_max_step$16"]]]], "r": [[0.000359273, 0.000359391, 0.000359309, 0.000359438, 0.000359405, 0.0003594, 0.000359364, 0.000359409, 0.000359314, 0.000359403], 0, 16.9469, 1649336925], "v": "v0.6"}
{"i": [["[\"reduce_mean\", 112, 112, 32]", "cuda -keys=cuda,gpu -max_num_threads=1024 -model=unknown -thread_warp_size=32", [-1, 16, 64, 49152, 2147483647, 1024, 8, 32], "", 0, []], [[], [["FU", 2, [0, 1]], ["AN", 2, 0, 6], ["FU", 1, [0, 1]], ["AN", 1, 0, 6], ["PR", 1, 0, "auto_unroll_max_step$512"]]]], "r": [[8.99681e-05, 8.99673e-05, 8.99658e-05, 8.99674e-05, 8.99673e-05, 8.99712e-05, 8.99639e-05, 8.99637e-05, 8.99668e-05, 8.99666e-05], 0, 22.4002, 1649336930], "v": "v0.6"}
{"i": [["[\"reduce_mean\", 112, 112, 32]", "cuda -keys=cuda,gpu -max_num_threads=1024 -model=unknown -thread_warp_size=32", [-1, 16, 64, 49152, 2147483647, 1024, 8, 32], "", 0, []], [[], [["FU", 1, [2, 3]], ["SP", 2, 1, 32, [2], 1], ["AN", 2, 2, 6], ["FSP", 1, 2, 1, 1], ["AN", 1, 3, 6], ["CA", 1, 2, 1], ["FU", 2, [0, 1]], ["AN", 2, 0, 5], ["PR", 1, 0, "auto_unroll_max_step$0"]]]], "r": [[9.52367e-05, 9.52384e-05, 9.51542e-05, 9.5192e-05, 9.52188e-05, 9.51593e-05, 9.52405e-05, 9.52401e-05, 9.52175e-05, 9.52416e-05], 0, 55.1596, 1649336963], "v": "v0.6"}
{"i": [["[\"reduce_mean\", 112, 112, 32]", "cuda -keys=cuda,gpu -max_num_threads=1024 -model=unknown -thread_warp_size=32", [-1, 16, 64, 49152, 2147483647, 1024, 8, 32], "", 0, []], [[], [["FU", 1, [2, 3]], ["SP", 2, 1, 32, [4], 1], ["AN", 2, 2, 6], ["FSP", 1, 2, 1, 1], ["AN", 1, 3, 6], ["CA", 1, 2, 1], ["FU", 2, [0, 1]], ["AN", 2, 0, 5], ["PR", 1, 0, "auto_unroll_max_step$0"]]]], "r": [[0.000125751, 0.000125745, 0.000125752, 0.000125747, 0.000125735, 0.000125749, 0.000125748, 0.000125751, 0.000125758, 0.000125754], 0, 33.2274, 1649336941], "v": "v0.6"}
{"i": [["[\"reduce_mean\", 112, 112, 32]", "cuda -keys=cuda,gpu -max_num_threads=1024 -model=unknown -thread_warp_size=32", [-1, 16, 64, 49152, 2147483647, 1024, 8, 32], "", 0, []], [[], [["FU", 1, [2, 3]], ["SP", 2, 1, 32, [32], 1], ["AN", 2, 2, 6], ["FSP", 1, 2, 1, 1], ["AN", 1, 3, 6], ["CA", 1, 2, 1], ["FU", 2, [0, 1]], ["AN", 2, 0, 5], ["PR", 1, 0, "auto_unroll_max_step$1024"]]]], "r": [[0.000331586, 0.000331575, 0.000331653, 0.000331619, 0.000331596, 0.000331654, 0.000331674, 0.000331653, 0.000331693, 0.000331744], 0, 44.7117, 1649336952], "v": "v0.6"}
{"i": [["[\"reduce_mean\", 112, 112, 32]", "cuda -keys=cuda,gpu -max_num_threads=1024 -model=unknown -thread_warp_size=32", [-1, 16, 64, 49152, 2147483647, 1024, 8, 32], "", 0, []], [[], [["FU", 1, [2, 3]], ["SP", 2, 1, 32, [2], 1], ["AN", 2, 2, 6], ["FSP", 1, 2, 1, 1], ["AN", 1, 3, 6], ["CA", 1, 2, 1], ["FU", 2, [0, 1]], ["AN", 2, 0, 5], ["PR", 1, 0, "auto_unroll_max_step$512"]]]], "r": [[9.50655e-05, 9.51091e-05, 9.50433e-05, 9.50705e-05, 9.50381e-05, 9.50785e-05, 9.50577e-05, 9.50569e-05, 9.49654e-05, 9.50303e-05], 0, 66.0453, 1649336974], "v": "v0.6"}
{"i": [["[\"reduce_mean\", 112, 112, 32]", "cuda -keys=cuda,gpu -max_num_threads=1024 -model=unknown -thread_warp_size=32", [-1, 16, 64, 49152, 2147483647, 1024, 8, 32], "", 0, []], [[], [["FU", 1, [2, 3]], ["SP", 2, 1, 32, [2], 1], ["AN", 2, 2, 6], ["FSP", 1, 2, 1, 1], ["AN", 1, 3, 6], ["CA", 1, 2, 1], ["FU", 2, [0, 1]], ["AN", 2, 0, 5], ["PR", 1, 0, "auto_unroll_max_step$1024"]]]], "r": [[9.50715e-05, 9.50117e-05, 9.49865e-05, 9.49773e-05, 9.49802e-05, 9.50042e-05, 9.50522e-05, 9.50248e-05, 9.51073e-05, 9.50728e-05], 0, 71.4533, 1649336980], "v": "v0.6"}
{"i": [["[\"reduce_mean\", 112, 112, 32]", "cuda -keys=cuda,gpu -max_num_threads=1024 -model=unknown -thread_warp_size=32", [-1, 16, 64, 49152, 2147483647, 1024, 8, 32], "", 0, []], [[], [["FU", 1, [2, 3]], ["SP", 2, 1, 32, [32], 1], ["AN", 2, 2, 6], ["FSP", 1, 2, 1, 1], ["AN", 1, 3, 6], ["CA", 1, 2, 1], ["FU", 2, [0, 1]], ["AN", 2, 0, 5], ["PR", 1, 0, "auto_unroll_max_step$64"]]]], "r": [[0.000359254, 0.000359199, 0.000359303, 0.000359326, 0.00035946, 0.000359286, 0.000359297, 0.000359366, 0.000359355, 0.000359305], 0, 87.9006, 1649336996], "v": "v0.6"}
{"i": [["[\"reduce_mean\", 112, 112, 32]", "cuda -keys=cuda,gpu -max_num_threads=1024 -model=unknown -thread_warp_size=32", [-1, 16, 64, 49152, 2147483647, 1024, 8, 32], "", 0, []], [[], [["FU", 1, [2, 3]], ["SP", 2, 1, 32, [2], 1], ["AN", 2, 2, 6], ["FSP", 1, 2, 1, 1], ["AN", 1, 3, 6], ["CA", 1, 2, 1], ["FU", 2, [0, 1]], ["AN", 2, 0, 5], ["PR", 1, 0, "auto_unroll_max_step$64"]]]], "r": [[9.51582e-05, 9.51299e-05, 9.51753e-05, 9.51608e-05, 9.51571e-05, 9.51549e-05, 9.51838e-05, 9.51502e-05, 9.51569e-05, 9.51624e-05], 0, 60.572, 1649336969], "v": "v0.6"}
{"i": [["[\"reduce_mean\", 112, 112, 32]", "cuda -keys=cuda,gpu -max_num_threads=1024 -model=unknown -thread_warp_size=32", [-1, 16, 64, 49152, 2147483647, 1024, 8, 32], "", 0, []], [[], [["FU", 1, [2, 3]], ["SP", 2, 1, 32, [4], 1], ["AN", 2, 2, 6], ["FSP", 1, 2, 1, 1], ["AN", 1, 3, 6], ["CA", 1, 2, 1], ["FU", 2, [0, 1]], ["AN", 2, 0, 5], ["PR", 1, 0, "auto_unroll_max_step$16"]]]], "r": [[0.000125605, 0.00012562, 0.000125593, 0.000125593, 0.000125602, 0.000125597, 0.00012557, 0.000125599, 0.000125597, 0.000125598], 0, 82.3821, 1649336991], "v": "v0.6"}
{"i": [["[\"reduce_mean\", 112, 112, 32]", "cuda -keys=cuda,gpu -max_num_threads=1024 -model=unknown -thread_warp_size=32", [-1, 16, 64, 49152, 2147483647, 1024, 8, 32], "", 0, []], [[], [["FU", 1, [2, 3]], ["SP", 2, 1, 32, [16], 1], ["AN", 2, 2, 6], ["FSP", 1, 2, 1, 1], ["AN", 1, 3, 6], ["CA", 1, 2, 1], ["FU", 2, [0, 1]], ["AN", 2, 0, 5], ["PR", 1, 0, "auto_unroll_max_step$0"]]]], "r": [[0.000207965, 0.000207956, 0.000207897, 0.0002079, 0.00020793, 0.000208037, 0.000207922, 0.00020789, 0.000207968, 0.000208017], 0, 98.8447, 1649337007], "v": "v0.6"}
{"i": [["[\"reduce_mean\", 112, 112, 32]", "cuda -keys=cuda,gpu -max_num_threads=1024 -model=unknown -thread_warp_size=32", [-1, 16, 64, 49152, 2147483647, 1024, 8, 32], "", 0, []], [[], [["FU", 1, [2, 3]], ["SP", 2, 1, 32, [1], 1], ["AN", 2, 2, 6], ["FSP", 1, 2, 1, 1], ["AN", 1, 3, 6], ["CA", 1, 2, 1], ["FU", 2, [0, 1]], ["AN", 2, 0, 5], ["PR", 1, 0, "auto_unroll_max_step$16"]]]], "r": [[0.000141811, 0.000141812, 0.000141811, 0.000141814, 0.00014181, 0.000141811, 0.000141806, 0.0001418, 0.000141811, 0.00014181], 0, 76.871, 1649336985], "v": "v0.6"}
{"i": [["[\"reduce_mean\", 112, 112, 32]", "cuda -keys=cuda,gpu -max_num_threads=1024 -model=unknown -thread_warp_size=32", [-1, 16, 64, 49152, 2147483647, 1024, 8, 32], "", 0, []], [[], [["FU", 1, [2, 3]], ["SP", 2, 1, 32, [4], 1], ["AN", 2, 2, 6], ["FSP", 1, 2, 1, 1], ["AN", 1, 3, 6], ["CA", 1, 2, 1], ["FU", 2, [0, 1]], ["AN", 2, 0, 5], ["PR", 1, 0, "auto_unroll_max_step$512"]]]], "r": [[0.00012567, 0.000125667, 0.000125667, 0.000125667, 0.000125672, 0.000125698, 0.000125695, 0.000125725, 0.000125777, 0.000125748], 0, 93.306, 1649337002], "v": "v0.6"}
{"i": [["[\"reduce_mean\", 112, 112, 32]", "cuda -keys=cuda,gpu -max_num_threads=1024 -model=unknown -thread_warp_size=32", [-1, 16, 64, 49152, 2147483647, 1024, 8, 32], "", 0, []], [[], [["FU", 1, [2, 3]], ["SP", 2, 1, 32, [4], 1], ["AN", 2, 2, 6], ["FSP", 1, 2, 1, 1], ["AN", 1, 3, 6], ["CA", 1, 2, 1], ["FU", 2, [0, 1]], ["AN", 2, 0, 5], ["PR", 1, 0, "auto_unroll_max_step$1024"]]]], "r": [[0.000125577, 0.000125623, 0.000125638, 0.000125614, 0.000125671, 0.000125653, 0.000125647, 0.00012562, 0.000125699, 0.000125615], 0, 109.74, 1649337018], "v": "v0.6"}
{"i": [["[\"reduce_mean\", 112, 112, 32]", "cuda -keys=cuda,gpu -max_num_threads=1024 -model=unknown -thread_warp_size=32", [-1, 16, 64, 49152, 2147483647, 1024, 8, 32], "", 0, []], [[], [["FU", 1, [2, 3]], ["SP", 2, 1, 32, [16], 1], ["AN", 2, 2, 6], ["FSP", 1, 2, 1, 1], ["AN", 1, 3, 6], ["CA", 1, 2, 1], ["FU", 2, [0, 1]], ["AN", 2, 0, 5], ["PR", 1, 0, "auto_unroll_max_step$16"]]]], "r": [[0.000208153, 0.000208098, 0.000208075, 0.000208102, 0.000208137, 0.000208138, 0.000208157, 0.000208161, 0.000208132, 0.000207983], 0, 104.357, 1649337013], "v": "v0.6"}
{"i": [["[\"reduce_mean\", 112, 112, 32]", "cuda -keys=cuda,gpu -max_num_threads=1024 -model=unknown -thread_warp_size=32", [-1, 16, 64, 49152, 2147483647, 1024, 8, 32], "", 0, []], [[], [["FU", 1, [2, 3]], ["SP", 2, 1, 32, [4], 1], ["AN", 2, 2, 6], ["FSP", 1, 2, 1, 1], ["AN", 1, 3, 6], ["CA", 1, 2, 1], ["FU", 2, [0, 1]], ["AN", 2, 0, 5], ["PR", 1, 0, "auto_unroll_max_step$512"]]]], "r": [[0.000125681, 0.000125683, 0.000125679, 0.000125677, 0.000125683, 0.000125679, 0.000125679, 0.000125671, 0.000125669, 0.000125683], 0, 9.59664, 1649338270], "v": "v0.6"}
{"i": [["[\"reduce_mean\", 112, 112, 32]", "cuda -keys=cuda,gpu -max_num_threads=1024 -model=unknown -thread_warp_size=32", [-1, 16, 64, 49152, 2147483647, 1024, 8, 32], "", 0, []], [[], [["FU", 1, [2, 3]], ["SP", 2, 1, 32, [32], 1], ["AN", 2, 2, 6], ["FSP", 1, 2, 1, 1], ["AN", 1, 3, 6], ["CA", 1, 2, 1], ["FU", 2, [0, 1]], ["AN", 2, 0, 5], ["PR", 1, 0, "auto_unroll_max_step$0"]]]], "r": [[0.000360155, 0.000359332, 0.000359357, 0.000359421, 0.000359397, 0.00035945, 0.000359419, 0.00035938, 0.000359384, 0.000359482], 0, 4.14383, 1649338264], "v": "v0.6"}
{"i": [["[\"reduce_mean\", 112, 112, 32]", "cuda -keys=cuda,gpu -max_num_threads=1024 -model=unknown -thread_warp_size=32", [-1, 16, 64, 49152, 2147483647, 1024, 8, 32], "", 0, []], [[], [["FU", 1, [2, 3]], ["SP", 2, 1, 32, [1], 1], ["AN", 2, 2, 6], ["FSP", 1, 2, 1, 1], ["AN", 1, 3, 6], ["CA", 1, 2, 1], ["FU", 2, [0, 1]], ["AN", 2, 0, 5], ["PR", 1, 0, "auto_unroll_max_step$0"]]]], "r": [[0.000141877, 0.00014198, 0.000141961, 0.000141842, 0.000141976, 0.000141856, 0.00014195, 0.000141943, 0.000141956, 0.000141912], 0, 53.15, 1649338314], "v": "v0.6"}
{"i": [["[\"reduce_mean\", 112, 112, 32]", "cuda -keys=cuda,gpu -max_num_threads=1024 -model=unknown -thread_warp_size=32", [-1, 16, 64, 49152, 2147483647, 1024, 8, 32], "", 0, []], [[], [["FU", 1, [2, 3]], ["SP", 2, 1, 32, [8], 1], ["AN", 2, 2, 6], ["FSP", 1, 2, 1, 1], ["AN", 1, 3, 6], ["CA", 1, 2, 1], ["FU", 2, [0, 1]], ["AN", 2, 0, 5], ["PR", 1, 0, "auto_unroll_max_step$0"]]]], "r": [[0.000138515, 0.000138506, 0.000138494, 0.000138511, 0.000138496, 0.000138489, 0.000138434, 0.000138494, 0.000138508, 0.000138513], 0, 58.5743, 1649338319], "v": "v0.6"}
{"i": [["[\"reduce_mean\", 112, 112, 32]", "cuda -keys=cuda,gpu -max_num_threads=1024 -model=unknown -thread_warp_size=32", [-1, 16, 64, 49152, 2147483647, 1024, 8, 32], "", 0, []], [[], [["FU", 1, [2, 3]], ["SP", 2, 1, 32, [32], 1], ["AN", 2, 2, 6], ["FSP", 1, 2, 1, 1], ["AN", 1, 3, 6], ["CA", 1, 2, 1], ["FU", 2, [0, 1]], ["AN", 2, 0, 5], ["PR", 1, 0, "auto_unroll_max_step$512"]]]], "r": [[0.00033176, 0.000331771, 0.000331801, 0.0003318, 0.0003318, 0.000331787, 0.000331701, 0.000331668, 0.000331703, 0.000331705], 0, 21.0839, 1649338281], "v": "v0.6"}
{"i": [["[\"reduce_mean\", 112, 112, 32]", "cuda -keys=cuda,gpu -max_num_threads=1024 -model=unknown -thread_warp_size=32", [-1, 16, 64, 49152, 2147483647, 1024, 8, 32], "", 0, []], [[], [["FU", 1, [2, 3]], ["SP", 2, 1, 32, [8], 1], ["AN", 2, 2, 6], ["FSP", 1, 2, 1, 1], ["AN", 1, 3, 6], ["CA", 1, 2, 1], ["FU", 2, [0, 1]], ["AN", 2, 0, 5], ["PR", 1, 0, "auto_unroll_max_step$512"]]]], "r": [[0.000138465, 0.000138462, 0.000138466, 0.00013848, 0.000138454, 0.000138452, 0.000138449, 0.000138453, 0.000138448, 0.00013846], 0, 80.5796, 1649338341], "v": "v0.6"}
{"i": [["[\"reduce_mean\", 112, 112, 32]", "cuda -keys=cuda,gpu -max_num_threads=1024 -model=unknown -thread_warp_size=32", [-1, 16, 64, 49152, 2147483647, 1024, 8, 32], "", 0, []], [[], [["FU", 2, [0, 1]], ["AN", 2, 0, 6], ["FU", 1, [0, 1]], ["AN", 1, 0, 6], ["PR", 1, 0, "auto_unroll_max_step$0"]]]], "r": [[9.01882e-05, 9.01868e-05, 9.01858e-05, 9.01844e-05, 9.01803e-05, 9.01784e-05, 9.01731e-05, 9.01857e-05, 9.01893e-05, 9.01887e-05], 0, 86.0658, 1649338346], "v": "v0.6"}
{"i": [["[\"reduce_mean\", 112, 112, 32]", "cuda -keys=cuda,gpu -max_num_threads=1024 -model=unknown -thread_warp_size=32", [-1, 16, 64, 49152, 2147483647, 1024, 8, 32], "", 0, []], [[], [["FU", 1, [2, 3]], ["SP", 2, 1, 32, [32], 1], ["AN", 2, 2, 6], ["FSP", 1, 2, 1, 1], ["AN", 1, 3, 6], ["CA", 1, 2, 1], ["FU", 2, [0, 1]], ["AN", 2, 0, 5], ["PR", 1, 0, "auto_unroll_max_step$16"]]]], "r": [[0.000359572, 0.000359452, 0.000359486, 0.000359573, 0.000359534, 0.000359577, 0.000359646, 0.000359578, 0.000359445, 0.000359459], 0, 42.3307, 1649338303], "v": "v0.6"}
{"i": [["[\"reduce_mean\", 112, 112, 32]", "cuda -keys=cuda,gpu -max_num_threads=1024 -model=unknown -thread_warp_size=32", [-1, 16, 64, 49152, 2147483647, 1024, 8, 32], "", 0, []], [[], [["FU", 1, [2, 3]], ["SP", 2, 1, 32, [1], 1], ["AN", 2, 2, 6], ["FSP", 1, 2, 1, 1], ["AN", 1, 3, 6], ["CA", 1, 2, 1], ["FU", 2, [0, 1]], ["AN", 2, 0, 5], ["PR", 1, 0, "auto_unroll_max_step$512"]]]], "r": [[0.000141712, 0.000141716, 0.000141703, 0.00014171, 0.000141696, 0.000141727, 0.000141707, 0.000141703, 0.000141694, 0.000141705], 0, 91.3898, 1649338352], "v": "v0.6"}
{"i": [["[\"reduce_mean\", 112, 112, 32]", "cuda -keys=cuda,gpu -max_num_threads=1024 -model=unknown -thread_warp_size=32", [-1, 16, 64, 49152, 2147483647, 1024, 8, 32], "", 0, []], [[], [["FU", 1, [2, 3]], ["SP", 2, 1, 32, [16], 1], ["AN", 2, 2, 6], ["FSP", 1, 2, 1, 1], ["AN", 1, 3, 6], ["CA", 1, 2, 1], ["FU", 2, [0, 1]], ["AN", 2, 0, 5], ["PR", 1, 0, "auto_unroll_max_step$512"]]]], "r": [[0.000207883, 0.000207928, 0.000207889, 0.000207926, 0.000207876, 0.000207884, 0.000207878, 0.000207871, 0.000207888, 0.000207874], 0, 31.4077, 1649338292], "v": "v0.6"}
{"i": [["[\"reduce_mean\", 112, 112, 32]", "cuda -keys=cuda,gpu -max_num_threads=1024 -model=unknown -thread_warp_size=32", [-1, 16, 64, 49152, 2147483647, 1024, 8, 32], "", 0, []], [[], [["FU", 1, [2, 3]], ["SP", 2, 1, 32, [4], 1], ["AN", 2, 2, 6], ["FSP", 1, 2, 1, 1], ["AN", 1, 3, 6], ["CA", 1, 2, 1], ["FU", 2, [0, 1]], ["AN", 2, 0, 5], ["PR", 1, 0, "auto_unroll_max_step$0"]]]], "r": [[0.000125567, 0.000125602, 0.000125624, 0.000125616, 0.000125583, 0.000125574, 0.000125611, 0.000125602, 0.000125587, 0.000125645], 0, 15.0389, 1649338275], "v": "v0.6"}
{"i": [["[\"reduce_mean\", 112, 112, 32]", "cuda -keys=cuda,gpu -max_num_threads=1024 -model=unknown -thread_warp_size=32", [-1, 16, 64, 49152, 2147483647, 1024, 8, 32], "", 0, []], [[], [["FU", 1, [2, 3]], ["SP", 2, 1, 32, [4], 1], ["AN", 2, 2, 6], ["FSP", 1, 2, 1, 1], ["AN", 1, 3, 6], ["CA", 1, 2, 1], ["FU", 2, [0, 1]], ["AN", 2, 0, 5], ["PR", 1, 0, "auto_unroll_max_step$64"]]]], "r": [[0.00012568, 0.000125636, 0.000125679, 0.000125631, 0.000125638, 0.000125697, 0.000125683, 0.000125656, 0.000125673, 0.000125626], 0, 36.8067, 1649338297], "v": "v0.6"}
{"i": [["[\"reduce_mean\", 112, 112, 32]", "cuda -keys=cuda,gpu -max_num_threads=1024 -model=unknown -thread_warp_size=32", [-1, 16, 64, 49152, 2147483647, 1024, 8, 32], "", 0, []], [[], [["FU", 2, [0, 1]], ["AN", 2, 0, 6], ["FU", 1, [0, 1]], ["AN", 1, 0, 6], ["PR", 1, 0, "auto_unroll_max_step$16"]]]], "r": [[8.99473e-05, 8.99503e-05, 9.00376e-05, 9.00214e-05, 8.99467e-05, 8.99498e-05, 8.99568e-05, 8.99528e-05, 8.99461e-05, 8.9976e-05], 0, 124.156, 1649338385], "v": "v0.6"}
{"i": [["[\"reduce_mean\", 112, 112, 32]", "cuda -keys=cuda,gpu -max_num_threads=1024 -model=unknown -thread_warp_size=32", [-1, 16, 64, 49152, 2147483647, 1024, 8, 32], "", 0, []], [[], [["FU", 1, [2, 3]], ["SP", 2, 1, 32, [16], 1], ["AN", 2, 2, 6], ["FSP", 1, 2, 1, 1], ["AN", 1, 3, 6], ["CA", 1, 2, 1], ["FU", 2, [0, 1]], ["AN", 2, 0, 5], ["PR", 1, 0, "auto_unroll_max_step$0"]]]], "r": [[0.00020805, 0.000208033, 0.000208033, 0.000208034, 0.000208036, 0.000208033, 0.000208081, 0.000208046, 0.000208063, 0.00020805], 0, 64.1446, 1649338324], "v": "v0.6"}
{"i": [["[\"reduce_mean\", 112, 112, 32]", "cuda -keys=cuda,gpu -max_num_threads=1024 -model=unknown -thread_warp_size=32", [-1, 16, 64, 49152, 2147483647, 1024, 8, 32], "", 0, []], [[], [["FU", 1, [2, 3]], ["SP", 2, 1, 32, [1], 1], ["AN", 2, 2, 6], ["FSP", 1, 2, 1, 1], ["AN", 1, 3, 6], ["CA", 1, 2, 1], ["FU", 2, [0, 1]], ["AN", 2, 0, 5], ["PR", 1, 0, "auto_unroll_max_step$64"]]]], "r": [[0.00014192, 0.000141922, 0.00014192, 0.000141917, 0.000141924, 0.000141923, 0.000141925, 0.000141923, 0.000141923, 0.000141921], 0, 151.213, 1649338412], "v": "v0.6"}
{"i": [["[\"reduce_mean\", 112, 112, 32]", "cuda -keys=cuda,gpu -max_num_threads=1024 -model=unknown -thread_warp_size=32", [-1, 16, 64, 49152, 2147483647, 1024, 8, 32], "", 0, []], [[], [["FU", 1, [2, 3]], ["SP", 2, 1, 32, [16], 1], ["AN", 2, 2, 6], ["FSP", 1, 2, 1, 1], ["AN", 1, 3, 6], ["CA", 1, 2, 1], ["FU", 2, [0, 1]], ["AN", 2, 0, 5], ["PR", 1, 0, "auto_unroll_max_step$16"]]]], "r": [[0.000208022, 0.00020798, 0.000208062, 0.00020804, 0.000207999, 0.000208087, 0.000208061, 0.00020801, 0.000208032, 0.000208032], 0, 102.415, 1649338363], "v": "v0.6"}
{"i": [["[\"reduce_mean\", 112, 112, 32]", "cuda -keys=cuda,gpu -max_num_threads=1024 -model=unknown -thread_warp_size=32", [-1, 16, 64, 49152, 2147483647, 1024, 8, 32], "", 0, []], [[], [["FU", 1, [2, 3]], ["SP", 2, 1, 32, [2], 1], ["AN", 2, 2, 6], ["FSP", 1, 2, 1, 1], ["AN", 1, 3, 6], ["CA", 1, 2, 1], ["FU", 2, [0, 1]], ["AN", 2, 0, 5], ["PR", 1, 0, "auto_unroll_max_step$0"]]]], "r": [[9.52097e-05, 9.51901e-05, 9.52047e-05, 9.52221e-05, 9.51634e-05, 9.52513e-05, 9.52567e-05, 9.52482e-05, 9.52531e-05, 9.52094e-05], 0, 47.7225, 1649338308], "v": "v0.6"}
{"i": [["[\"reduce_mean\", 112, 112, 32]", "cuda -keys=cuda,gpu -max_num_threads=1024 -model=unknown -thread_warp_size=32", [-1, 16, 64, 49152, 2147483647, 1024, 8, 32], "", 0, []], [[], [["FU", 2, [0, 1]], ["AN", 2, 0, 6], ["FU", 1, [0, 1]], ["AN", 1, 0, 6], ["PR", 1, 0, "auto_unroll_max_step$1024"]]]], "r": [[9.01661e-05, 9.0229e-05, 9.02554e-05, 9.02922e-05, 9.03939e-05, 9.03022e-05, 9.02961e-05, 9.02579e-05, 9.02224e-05, 9.02262e-05], 0, 25.8868, 1649338286], "v": "v0.6"}
{"i": [["[\"reduce_mean\", 112, 112, 32]", "cuda -keys=cuda,gpu -max_num_threads=1024 -model=unknown -thread_warp_size=32", [-1, 16, 64, 49152, 2147483647, 1024, 8, 32], "", 0, []], [[], [["FU", 1, [2, 3]], ["SP", 2, 1, 32, [8], 1], ["AN", 2, 2, 6], ["FSP", 1, 2, 1, 1], ["AN", 1, 3, 6], ["CA", 1, 2, 1], ["FU", 2, [0, 1]], ["AN", 2, 0, 5], ["PR", 1, 0, "auto_unroll_max_step$64"]]]], "r": [[0.000138459, 0.000138493, 0.000138478, 0.000138498, 0.000138487, 0.000138441, 0.000138459, 0.000138487, 0.000138453, 0.000138502], 0, 107.814, 1649338368], "v": "v0.6"}
{"i": [["[\"reduce_mean\", 112, 112, 32]", "cuda -keys=cuda,gpu -max_num_threads=1024 -model=unknown -thread_warp_size=32", [-1, 16, 64, 49152, 2147483647, 1024, 8, 32], "", 0, []], [[], [["FU", 2, [0, 1]], ["AN", 2, 0, 6], ["FU", 1, [0, 1]], ["AN", 1, 0, 6], ["PR", 1, 0, "auto_unroll_max_step$512"]]]], "r": [[9.01125e-05, 9.00792e-05, 9.00913e-05, 9.01116e-05, 9.01158e-05, 9.01189e-05, 9.01076e-05, 9.0079e-05, 9.00815e-05, 9.00652e-05], 0, 118.778, 1649338379], "v": "v0.6"}
{"i": [["[\"reduce_mean\", 112, 112, 32]", "cuda -keys=cuda,gpu -max_num_threads=1024 -model=unknown -thread_warp_size=32", [-1, 16, 64, 49152, 2147483647, 1024, 8, 32], "", 0, []], [[], [["FU", 1, [2, 3]], ["SP", 2, 1, 32, [8], 1], ["AN", 2, 2, 6], ["FSP", 1, 2, 1, 1], ["AN", 1, 3, 6], ["CA", 1, 2, 1], ["FU", 2, [0, 1]], ["AN", 2, 0, 5], ["PR", 1, 0, "auto_unroll_max_step$1024"]]]], "r": [[0.000138582, 0.000138581, 0.00013858, 0.000138581, 0.000138588, 0.000138582, 0.000138585, 0.000138585, 0.000138583, 0.000138584], 0, 172.997, 1649338433], "v": "v0.6"}
{"i": [["[\"reduce_mean\", 112, 112, 32]", "cuda -keys=cuda,gpu -max_num_threads=1024 -model=unknown -thread_warp_size=32", [-1, 16, 64, 49152, 2147483647, 1024, 8, 32], "", 0, []], [[], [["FU", 1, [2, 3]], ["SP", 2, 1, 32, [16], 1], ["AN", 2, 2, 6], ["FSP", 1, 2, 1, 1], ["AN", 1, 3, 6], ["CA", 1, 2, 1], ["FU", 2, [0, 1]], ["AN", 2, 0, 5], ["PR", 1, 0, "auto_unroll_max_step$1024"]]]], "r": [[0.000193997, 0.000193969, 0.000194029, 0.000193909, 0.000193978, 0.000194087, 0.000194063, 0.00019408, 0.000194022, 0.000194125], 0, 76.7712, 1649338335], "v": "v0.6"}
{"i": [["[\"reduce_mean\", 112, 112, 32]", "cuda -keys=cuda,gpu -max_num_threads=1024 -model=unknown -thread_warp_size=32", [-1, 16, 64, 49152, 2147483647, 1024, 8, 32], "", 0, []], [[], [["FU", 1, [2, 3]], ["SP", 2, 1, 32, [32], 1], ["AN", 2, 2, 6], ["FSP", 1, 2, 1, 1], ["AN", 1, 3, 6], ["CA", 1, 2, 1], ["FU", 2, [0, 1]], ["AN", 2, 0, 5], ["PR", 1, 0, "auto_unroll_max_step$1024"]]]], "r": [[0.000331601, 0.000331618, 0.000331634, 0.00033158, 0.000331602, 0.000331532, 0.00033165, 0.000331589, 0.000331627, 0.00033183], 0, 70.183, 1649338330], "v": "v0.6"}
{"i": [["[\"reduce_mean\", 112, 112, 32]", "cuda -keys=cuda,gpu -max_num_threads=1024 -model=unknown -thread_warp_size=32", [-1, 16, 64, 49152, 2147483647, 1024, 8, 32], "", 0, []], [[], [["FU", 1, [2, 3]], ["SP", 2, 1, 32, [2], 1], ["AN", 2, 2, 6], ["FSP", 1, 2, 1, 1], ["AN", 1, 3, 6], ["CA", 1, 2, 1], ["FU", 2, [0, 1]], ["AN", 2, 0, 5], ["PR", 1, 0, "auto_unroll_max_step$16"]]]], "r": [[9.50383e-05, 9.50579e-05, 9.50261e-05, 9.50484e-05, 9.50302e-05, 9.50725e-05, 9.50664e-05, 9.50545e-05, 9.50686e-05, 9.50576e-05], 0, 156.64, 1649338417], "v": "v0.6"}
{"i": [["[\"reduce_mean\", 112, 112, 32]", "cuda -keys=cuda,gpu -max_num_threads=1024 -model=unknown -thread_warp_size=32", [-1, 16, 64, 49152, 2147483647, 1024, 8, 32], "", 0, []], [[], [["FU", 1, [2, 3]], ["SP", 2, 1, 32, [1], 1], ["AN", 2, 2, 6], ["FSP", 1, 2, 1, 1], ["AN", 1, 3, 6], ["CA", 1, 2, 1], ["FU", 2, [0, 1]], ["AN", 2, 0, 5], ["PR", 1, 0, "auto_unroll_max_step$1024"]]]], "r": [[0.000141719, 0.000141749, 0.000141798, 0.000141749, 0.000141724, 0.000141735, 0.000141689, 0.00014178, 0.000141734, 0.000141699], 0, 140.369, 1649338401], "v": "v0.6"}
{"i": [["[\"reduce_mean\", 112, 112, 32]", "cuda -keys=cuda,gpu -max_num_threads=1024 -model=unknown -thread_warp_size=32", [-1, 16, 64, 49152, 2147483647, 1024, 8, 32], "", 0, []], [[], [["FU", 1, [2, 3]], ["SP", 2, 1, 32, [2], 1], ["AN", 2, 2, 6], ["FSP", 1, 2, 1, 1], ["AN", 1, 3, 6], ["CA", 1, 2, 1], ["FU", 2, [0, 1]], ["AN", 2, 0, 5], ["PR", 1, 0, "auto_unroll_max_step$512"]]]], "r": [[9.50567e-05, 9.50401e-05, 9.50399e-05, 9.50487e-05, 9.50621e-05, 9.50902e-05, 9.50637e-05, 9.50359e-05, 9.50468e-05, 9.50958e-05], 0, 145.793, 1649338406], "v": "v0.6"}
{"i": [["[\"reduce_mean\", 112, 112, 32]", "cuda -keys=cuda,gpu -max_num_threads=1024 -model=unknown -thread_warp_size=32", [-1, 16, 64, 49152, 2147483647, 1024, 8, 32], "", 0, []], [[], [["FU", 1, [2, 3]], ["SP", 2, 1, 32, [8], 1], ["AN", 2, 2, 6], ["FSP", 1, 2, 1, 1], ["AN", 1, 3, 6], ["CA", 1, 2, 1], ["FU", 2, [0, 1]], ["AN", 2, 0, 5], ["PR", 1, 0, "auto_unroll_max_step$16"]]]], "r": [[0.00013843, 0.000138491, 0.000138469, 0.000138421, 0.000138415, 0.000138401, 0.000138432, 0.000138434, 0.000138463, 0.000138436], 0, 189.236, 1649338450], "v": "v0.6"}
{"i": [["[\"reduce_mean\", 112, 112, 32]", "cuda -keys=cuda,gpu -max_num_threads=1024 -model=unknown -thread_warp_size=32", [-1, 16, 64, 49152, 2147483647, 1024, 8, 32], "", 0, []], [[], [["FU", 1, [2, 3]], ["SP", 2, 1, 32, [2], 1], ["AN", 2, 2, 6], ["FSP", 1, 2, 1, 1], ["AN", 1, 3, 6], ["CA", 1, 2, 1], ["FU", 2, [0, 1]], ["AN", 2, 0, 5], ["PR", 1, 0, "auto_unroll_max_step$1024"]]]], "r": [[9.52052e-05, 9.51957e-05, 9.51166e-05, 9.52074e-05, 9.51972e-05, 9.52218e-05, 9.52576e-05, 9.525e-05, 9.51494e-05, 9.52769e-05], 0, 167.585, 1649338428], "v": "v0.6"}
{"i": [["[\"reduce_mean\", 112, 112, 32]", "cuda -keys=cuda,gpu -max_num_threads=1024 -model=unknown -thread_warp_size=32", [-1, 16, 64, 49152, 2147483647, 1024, 8, 32], "", 0, []], [[], [["FU", 1, [2, 3]], ["SP", 2, 1, 32, [32], 1], ["AN", 2, 2, 6], ["FSP", 1, 2, 1, 1], ["AN", 1, 3, 6], ["CA", 1, 2, 1], ["FU", 2, [0, 1]], ["AN", 2, 0, 5], ["PR", 1, 0, "auto_unroll_max_step$64"]]]], "r": [[0.000359475, 0.000359427, 0.000359476, 0.000359439, 0.000359477, 0.000359387, 0.000359363, 0.000359471, 0.000359443, 0.000359481], 0, 162.149, 1649338423], "v": "v0.6"}
{"i": [["[\"reduce_mean\", 112, 112, 32]", "cuda -keys=cuda,gpu -max_num_threads=1024 -model=unknown -thread_warp_size=32", [-1, 16, 64, 49152, 2147483647, 1024, 8, 32], "", 0, []], [[], [["FU", 1, [2, 3]], ["SP", 2, 1, 32, [16], 1], ["AN", 2, 2, 6], ["FSP", 1, 2, 1, 1], ["AN", 1, 3, 6], ["CA", 1, 2, 1], ["FU", 2, [0, 1]], ["AN", 2, 0, 5], ["PR", 1, 0, "auto_unroll_max_step$64"]]]], "r": [[0.000207852, 0.000207905, 0.000207821, 0.00020778, 0.000207805, 0.000207849, 0.000207861, 0.000207855, 0.000207815, 0.000207803], 0, 96.902, 1649338357], "v": "v0.6"}
{"i": [["[\"reduce_mean\", 112, 112, 32]", "cuda -keys=cuda,gpu -max_num_threads=1024 -model=unknown -thread_warp_size=32", [-1, 16, 64, 49152, 2147483647, 1024, 8, 32], "", 0, []], [[], [["FU", 1, [2, 3]], ["SP", 2, 1, 32, [4], 1], ["AN", 2, 2, 6], ["FSP", 1, 2, 1, 1], ["AN", 1, 3, 6], ["CA", 1, 2, 1], ["FU", 2, [0, 1]], ["AN", 2, 0, 5], ["PR", 1, 0, "auto_unroll_max_step$1024"]]]], "r": [[0.000125798, 0.000125764, 0.000125805, 0.000125794, 0.000125759, 0.00012568, 0.000125795, 0.00012578, 0.000125816, 0.000125667], 0, 129.534, 1649338390], "v": "v0.6"}
{"i": [["[\"reduce_mean\", 112, 112, 32]", "cuda -keys=cuda,gpu -max_num_threads=1024 -model=unknown -thread_warp_size=32", [-1, 16, 64, 49152, 2147483647, 1024, 8, 32], "", 0, []], [[], [["FU", 2, [0, 1]], ["AN", 2, 0, 6], ["FU", 1, [0, 1]], ["AN", 1, 0, 6], ["PR", 1, 0, "auto_unroll_max_step$64"]]]], "r": [[9.00142e-05, 9.004e-05, 9.00097e-05, 8.99668e-05, 8.99785e-05, 8.99918e-05, 9.0034e-05, 9.00332e-05, 9.00598e-05, 9.00459e-05], 0, 134.909, 1649338395], "v": "v0.6"}
{"i": [["[\"reduce_mean\", 112, 112, 32]", "cuda -keys=cuda,gpu -max_num_threads=1024 -model=unknown -thread_warp_size=32", [-1, 16, 64, 49152, 2147483647, 1024, 8, 32], "", 0, []], [[], [["FU", 1, [2, 3]], ["SP", 2, 1, 32, [1], 1], ["AN", 2, 2, 6], ["FSP", 1, 2, 1, 1], ["AN", 1, 3, 6], ["CA", 1, 2, 1], ["FU", 2, [0, 1]], ["AN", 2, 0, 5], ["PR", 1, 0, "auto_unroll_max_step$16"]]]], "r": [[0.000141794, 0.000141797, 0.000141796, 0.000141802, 0.000141797, 0.000141797, 0.000141799, 0.000141802, 0.000141803, 0.000141793], 0, 113.266, 1649338374], "v": "v0.6"}
{"i": [["[\"reduce_mean\", 112, 112, 32]", "cuda -keys=cuda,gpu -max_num_threads=1024 -model=unknown -thread_warp_size=32", [-1, 16, 64, 49152, 2147483647, 1024, 8, 32], "", 0, []], [[], [["FU", 1, [2, 3]], ["SP", 2, 1, 32, [4], 1], ["AN", 2, 2, 6], ["FSP", 1, 2, 1, 1], ["AN", 1, 3, 6], ["CA", 1, 2, 1], ["FU", 2, [0, 1]], ["AN", 2, 0, 5], ["PR", 1, 0, "auto_unroll_max_step$16"]]]], "r": [[0.000125683, 0.000125677, 0.000125681, 0.000125673, 0.000125675, 0.000125693, 0.000125681, 0.000125676, 0.000125682, 0.000125687], 0, 183.823, 1649338444], "v": "v0.6"}
{"i": [["[\"reduce_mean\", 112, 112, 32]", "cuda -keys=cuda,gpu -max_num_threads=1024 -model=unknown -thread_warp_size=32", [-1, 16, 64, 49152, 2147483647, 1024, 8, 32], "", 0, []], [[], [["FU", 1, [2, 3]], ["SP", 2, 1, 32, [2], 1], ["AN", 2, 2, 6], ["FSP", 1, 2, 1, 1], ["AN", 1, 3, 6], ["CA", 1, 2, 1], ["FU", 2, [0, 1]], ["AN", 2, 0, 5], ["PR", 1, 0, "auto_unroll_max_step$64"]]]], "r": [[9.51735e-05, 9.51739e-05, 9.51728e-05, 9.51654e-05, 9.51663e-05, 9.52134e-05, 9.51668e-05, 9.51675e-05, 9.51724e-05, 9.51632e-05], 0, 178.456, 1649338439], "v": "v0.6"}
