python/models/efficientnet/kernel_configs/efficient_fused_depthwise_conv_56_56_144_5_5_s(2, 2).log
{"i": [["[\"fused_depthwise_conv2d\", 56, 56, 144, 5, 5, [2, 2]]", "cuda -keys=cuda,gpu -max_num_threads=1024 -model=unknown -thread_warp_size=32", [-1, 16, 64, 49152, 2147483647, 1024, 8, 32], "", 0, []], [[], [["CI", 8], ["CI", 7], ["CI", 5], ["CHW", 3, "local"], ["SP", 3, 0, 1, [1, 1, 1, 1], 1], ["SP", 3, 5, 28, [1, 1, 1, 2], 1], ["SP", 3, 10, 28, [1, 14, 2, 1], 1], ["SP", 3, 15, 144, [1, 4, 3, 2], 1], ["SP", 3, 20, 5, [1, 5], 1], ["SP", 3, 23, 5, [5, 1], 1], ["RE", 3, [0, 5, 10, 15, 1, 6, 11, 16, 2, 7, 12, 17, 20, 23, 21, 24, 3, 8, 13, 18, 22, 25, 4, 9, 14, 19]], ["FSP", 4, 0, 4, 3], ["FSP", 4, 4, 5, 3], ["FSP", 4, 8, 6, 3], ["FSP", 4, 12, 7, 3], ["RE", 4, [0, 4, 8, 12, 1, 5, 9, 13, 2, 6, 10, 14, 3, 7, 11, 15]], ["CA", 3, 4, 11], ["CHR", 2, "shared", [3]], ["CA", 3, 4, 13], ["CHR", 1, "shared", [4]], ["CA", 2, 5, 13], ["CI", 1], ["FU", 12, [0, 1, 2, 3]], ["SP", 12, 0, 112896, [32], 1], ["AN", 12, 0, 5], ["AN", 12, 1, 6], ["FU", 6, [0, 1, 2, 3]], ["AN", 6, 0, 5], ["FU", 6, [1, 2, 3, 4]], ["AN", 6, 1, 4], ["FU", 6, [2, 3, 4, 5]], ["AN", 6, 2, 6], ["FU", 4, [0, 1, 2, 3]], ["SP", 4, 0, 6, [1], 1], ["AN", 4, 1, 2], ["FFSP", 4, 0, [7, 6, 5, 4], 1, 1], ["AN", 4, 1, 6], ["FU", 2, [0, 1, 2, 3]], ["SP", 2, 0, 54, [1], 1], ["AN", 2, 1, 2], ["FFSP", 2, 0, [7, 6, 5, 4], 1, 1], ["AN", 2, 1, 6], ["PR", 5, 0, "auto_unroll_max_step$0"]]]], "r": [[5.53137e-05, 5.53099e-05, 5.53123e-05, 5.53131e-05, 5.53121e-05, 5.53101e-05, 5.53113e-05, 5.53133e-05, 5.53128e-05, 5.53122e-05], 0, 60.7369, 1649140428], "v": "v0.6"}
{"i": [["[\"fused_depthwise_conv2d\", 56, 56, 144, 5, 5, [2, 2]]", "cuda -keys=cuda,gpu -max_num_threads=1024 -model=unknown -thread_warp_size=32", [-1, 16, 64, 49152, 2147483647, 1024, 8, 32], "", 0, []], [[], [["CI", 8], ["CI", 7], ["CI", 5], ["CHW", 3, "local"], ["SP", 3, 0, 1, [1, 1, 1, 1], 1], ["SP", 3, 5, 28, [1, 14, 1, 2], 1], ["SP", 3, 10, 28, [1, 1, 4, 1], 1], ["SP", 3, 15, 144, [3, 8, 1, 1], 1], ["SP", 3, 20, 5, [5, 1], 1], ["SP", 3, 23, 5, [1, 1], 1], ["RE", 3, [0, 5, 10, 15, 1, 6, 11, 16, 2, 7, 12, 17, 20, 23, 21, 24, 3, 8, 13, 18, 22, 25, 4, 9, 14, 19]], ["FSP", 4, 0, 4, 3], ["FSP", 4, 4, 5, 3], ["FSP", 4, 8, 6, 3], ["FSP", 4, 12, 7, 3], ["RE", 4, [0, 4, 8, 12, 1, 5, 9, 13, 2, 6, 10, 14, 3, 7, 11, 15]], ["CA", 3, 4, 11], ["CHR", 2, "shared", [3]], ["CA", 3, 4, 13], ["CHR", 1, "shared", [4]], ["CA", 2, 5, 13], ["CI", 1], ["FU", 12, [0, 1, 2, 3]], ["SP", 12, 0, 112896, [64], 1], ["AN", 12, 0, 5], ["AN", 12, 1, 6], ["FU", 6, [0, 1, 2, 3]], ["AN", 6, 0, 5], ["FU", 6, [1, 2, 3, 4]], ["AN", 6, 1, 4], ["FU", 6, [2, 3, 4, 5]], ["AN", 6, 2, 6], ["FU", 4, [0, 1, 2, 3]], ["SP", 4, 0, 5, [1], 1], ["AN", 4, 1, 2], ["FFSP", 4, 0, [7, 6, 5, 4], 1, 1], ["AN", 4, 1, 6], ["FU", 2, [0, 1, 2, 3]], ["SP", 2, 0, 21, [1], 1], ["AN", 2, 1, 2], ["FFSP", 2, 0, [7, 6, 5, 4], 1, 1], ["AN", 2, 1, 6], ["PR", 5, 0, "auto_unroll_max_step$64"]]]], "r": [[0.000134748, 0.000134744, 0.000134751, 0.000134755, 0.000134749, 0.000134742, 0.000134748, 0.000134748, 0.000134744, 0.000134743], 0, 22.8863, 1649140390], "v": "v0.6"}
{"i": [["[\"fused_depthwise_conv2d\", 56, 56, 144, 5, 5, [2, 2]]", "cuda -keys=cuda,gpu -max_num_threads=1024 -model=unknown -thread_warp_size=32", [-1, 16, 64, 49152, 2147483647, 1024, 8, 32], "", 0, []], [[], [["CI", 8], ["CI", 7], ["CI", 5], ["CHW", 3, "local"], ["SP", 3, 0, 1, [1, 1, 1, 1], 1], ["SP", 3, 5, 28, [2, 14, 1, 1], 1], ["SP", 3, 10, 28, [1, 1, 2, 1], 1], ["SP", 3, 15, 144, [3, 8, 1, 1], 1], ["SP", 3, 20, 5, [5, 1], 1], ["SP", 3, 23, 5, [1, 1], 1], ["RE", 3, [0, 5, 10, 15, 1, 6, 11, 16, 2, 7, 12, 17, 20, 23, 21, 24, 3, 8, 13, 18, 22, 25, 4, 9, 14, 19]], ["FSP", 4, 0, 4, 3], ["FSP", 4, 4, 5, 3], ["FSP", 4, 8, 6, 3], ["FSP", 4, 12, 7, 3], ["RE", 4, [0, 4, 8, 12, 1, 5, 9, 13, 2, 6, 10, 14, 3, 7, 11, 15]], ["CA", 3, 4, 11], ["CHR", 2, "shared", [3]], ["CA", 3, 4, 13], ["CHR", 1, "shared", [4]], ["CA", 2, 5, 13], ["CI", 1], ["FU", 12, [0, 1, 2, 3]], ["SP", 12, 0, 112896, [32], 1], ["AN", 12, 0, 5], ["AN", 12, 1, 6], ["FU", 6, [0, 1, 2, 3]], ["AN", 6, 0, 5], ["FU", 6, [1, 2, 3, 4]], ["AN", 6, 1, 4], ["FU", 6, [2, 3, 4, 5]], ["AN", 6, 2, 6], ["FU", 4, [0, 1, 2, 3]], ["SP", 4, 0, 5, [1], 1], ["AN", 4, 1, 2], ["FFSP", 4, 0, [7, 6, 5, 4], 1, 1], ["AN", 4, 1, 6], ["FU", 2, [0, 1, 2, 3]], ["SP", 2, 0, 21, [7], 1], ["AN", 2, 1, 2], ["FFSP", 2, 0, [7, 6, 5, 4], 1, 1], ["AN", 2, 1, 6], ["PR", 5, 0, "auto_unroll_max_step$64"]]]], "r": [[1.9246e-05, 1.92466e-05, 1.92467e-05, 1.92484e-05, 1.92475e-05, 1.92483e-05, 1.92471e-05, 1.9246e-05, 1.92465e-05, 1.92474e-05], 0, 19.6015, 1649140385], "v": "v0.6"}
{"i": [["[\"fused_depthwise_conv2d\", 56, 56, 144, 5, 5, [2, 2]]", "cuda -keys=cuda,gpu -max_num_threads=1024 -model=unknown -thread_warp_size=32", [-1, 16, 64, 49152, 2147483647, 1024, 8, 32], "", 0, []], [[], [["CI", 8], ["CI", 7], ["CI", 5], ["CHW", 3, "local"], ["SP", 3, 0, 1, [1, 1, 1, 1], 1], ["SP", 3, 5, 28, [1, 1, 1, 28], 1], ["SP", 3, 10, 28, [1, 2, 1, 1], 1], ["SP", 3, 15, 144, [1, 24, 1, 2], 1], ["SP", 3, 20, 5, [5, 1], 1], ["SP", 3, 23, 5, [1, 1], 1], ["RE", 3, [0, 5, 10, 15, 1, 6, 11, 16, 2, 7, 12, 17, 20, 23, 21, 24, 3, 8, 13, 18, 22, 25, 4, 9, 14, 19]], ["FSP", 4, 0, 4, 3], ["FSP", 4, 4, 5, 3], ["FSP", 4, 8, 6, 3], ["FSP", 4, 12, 7, 3], ["RE", 4, [0, 4, 8, 12, 1, 5, 9, 13, 2, 6, 10, 14, 3, 7, 11, 15]], ["CA", 3, 4, 11], ["CHR", 2, "shared", [3]], ["CA", 3, 4, 13], ["CHR", 1, "shared", [4]], ["CA", 2, 5, 13], ["CI", 1], ["FU", 12, [0, 1, 2, 3]], ["SP", 12, 0, 112896, [1], 1], ["AN", 12, 0, 5], ["AN", 12, 1, 6], ["FU", 6, [0, 1, 2, 3]], ["AN", 6, 0, 5], ["FU", 6, [1, 2, 3, 4]], ["AN", 6, 1, 4], ["FU", 6, [2, 3, 4, 5]], ["AN", 6, 2, 6], ["FU", 4, [0, 1, 2, 3]], ["SP", 4, 0, 10, [1], 1], ["AN", 4, 1, 2], ["FFSP", 4, 0, [7, 6, 5, 4], 1, 1], ["AN", 4, 1, 6], ["FU", 2, [0, 1, 2, 3]], ["SP", 2, 0, 62, [1], 1], ["AN", 2, 1, 2], ["FFSP", 2, 0, [7, 6, 5, 4], 1, 1], ["AN", 2, 1, 6], ["PR", 5, 0, "auto_unroll_max_step$16"]]]], "r": [[0.000279914, 0.000279915, 0.000279894, 0.000279898, 0.000279905, 0.00027989, 0.000279887, 0.000279879, 0.00027988, 0.000279879], 0, 6.96475, 1649140374], "v": "v0.6"}
{"i": [["[\"fused_depthwise_conv2d\", 56, 56, 144, 5, 5, [2, 2]]", "cuda -keys=cuda,gpu -max_num_threads=1024 -model=unknown -thread_warp_size=32", [-1, 16, 64, 49152, 2147483647, 1024, 8, 32], "", 0, []], [[], [["CI", 8], ["CI", 7], ["CI", 5], ["CHW", 3, "local"], ["SP", 3, 0, 1, [1, 1, 1, 1], 1], ["SP", 3, 5, 28, [1, 2, 1, 1], 1], ["SP", 3, 10, 28, [1, 1, 1, 1], 1], ["SP", 3, 15, 144, [1, 36, 4, 1], 1], ["SP", 3, 20, 5, [1, 1], 1], ["SP", 3, 23, 5, [5, 1], 1], ["RE", 3, [0, 5, 10, 15, 1, 6, 11, 16, 2, 7, 12, 17, 20, 23, 21, 24, 3, 8, 13, 18, 22, 25, 4, 9, 14, 19]], ["FSP", 4, 0, 4, 3], ["FSP", 4, 4, 5, 3], ["FSP", 4, 8, 6, 3], ["FSP", 4, 12, 7, 3], ["RE", 4, [0, 4, 8, 12, 1, 5, 9, 13, 2, 6, 10, 14, 3, 7, 11, 15]], ["CA", 3, 4, 11], ["CHR", 2, "shared", [3]], ["CA", 3, 4, 13], ["CHR", 1, "shared", [4]], ["CA", 2, 5, 13], ["CI", 1], ["FU", 12, [0, 1, 2, 3]], ["SP", 12, 0, 112896, [32], 1], ["AN", 12, 0, 5], ["AN", 12, 1, 6], ["FU", 6, [0, 1, 2, 3]], ["AN", 6, 0, 5], ["FU", 6, [1, 2, 3, 4]], ["AN", 6, 1, 4], ["FU", 6, [2, 3, 4, 5]], ["AN", 6, 2, 6], ["FU", 4, [0, 1, 2, 3]], ["SP", 4, 0, 20, [1], 1], ["AN", 4, 1, 2], ["FFSP", 4, 0, [7, 6, 5, 4], 1, 1], ["AN", 4, 1, 6], ["FU", 2, [0, 1, 2, 3]], ["SP", 2, 0, 20, [20], 1], ["AN", 2, 1, 2], ["FFSP", 2, 0, [7, 6, 5, 4], 1, 1], ["AN", 2, 1, 6], ["PR", 5, 0, "auto_unroll_max_step$1024"]]]], "r": [[2.56022e-05, 2.55997e-05, 2.55972e-05, 2.56012e-05, 2.55982e-05, 2.55975e-05, 2.55992e-05, 2.55999e-05, 2.55981e-05, 2.55992e-05], 0, 56.6758, 1649140417], "v": "v0.6"}
{"i": [["[\"fused_depthwise_conv2d\", 56, 56, 144, 5, 5, [2, 2]]", "cuda -keys=cuda,gpu -max_num_threads=1024 -model=unknown -thread_warp_size=32", [-1, 16, 64, 49152, 2147483647, 1024, 8, 32], "", 0, []], [[], [["CI", 8], ["CI", 7], ["CI", 5], ["CHW", 3, "local"], ["SP", 3, 0, 1, [1, 1, 1, 1], 1], ["SP", 3, 5, 28, [2, 1, 1, 2], 1], ["SP", 3, 10, 28, [1, 7, 2, 1], 1], ["SP", 3, 15, 144, [3, 8, 1, 2], 1], ["SP", 3, 20, 5, [1, 1], 1], ["SP", 3, 23, 5, [1, 1], 1], ["RE", 3, [0, 5, 10, 15, 1, 6, 11, 16, 2, 7, 12, 17, 20, 23, 21, 24, 3, 8, 13, 18, 22, 25, 4, 9, 14, 19]], ["FSP", 4, 0, 4, 3], ["FSP", 4, 4, 5, 3], ["FSP", 4, 8, 6, 3], ["FSP", 4, 12, 7, 3], ["RE", 4, [0, 4, 8, 12, 1, 5, 9, 13, 2, 6, 10, 14, 3, 7, 11, 15]], ["CA", 3, 4, 11], ["CHR", 2, "shared", [3]], ["CA", 3, 4, 13], ["CHR", 1, "shared", [4]], ["CA", 2, 5, 13], ["CI", 1], ["FU", 12, [0, 1, 2, 3]], ["SP", 12, 0, 112896, [4], 1], ["AN", 12, 0, 5], ["AN", 12, 1, 6], ["FU", 6, [0, 1, 2, 3]], ["AN", 6, 0, 5], ["FU", 6, [1, 2, 3, 4]], ["AN", 6, 1, 4], ["FU", 6, [2, 3, 4, 5]], ["AN", 6, 2, 6], ["FU", 4, [0, 1, 2, 3]], ["SP", 4, 0, 2, [1], 1], ["AN", 4, 1, 2], ["FFSP", 4, 0, [7, 6, 5, 4], 1, 1], ["AN", 4, 1, 6], ["FU", 2, [0, 1, 2, 3]], ["SP", 2, 0, 18, [1], 1], ["AN", 2, 1, 2], ["FFSP", 2, 0, [7, 6, 5, 4], 1, 1], ["AN", 2, 1, 6], ["PR", 5, 0, "auto_unroll_max_step$64"]]]], "r": [[0.00106344, 0.00106359, 0.00106348, 0.00106364, 0.00106354, 0.00106349, 0.00106357, 0.00106348, 0.00106357, 0.00106352], 0, 34.5501, 1649140402], "v": "v0.6"}
{"i": [["[\"fused_depthwise_conv2d\", 56, 56, 144, 5, 5, [2, 2]]", "cuda -keys=cuda,gpu -max_num_threads=1024 -model=unknown -thread_warp_size=32", [-1, 16, 64, 49152, 2147483647, 1024, 8, 32], "", 0, []], [[], [["CI", 8], ["CI", 7], ["CI", 5], ["CHW", 3, "local"], ["SP", 3, 0, 1, [1, 1, 1, 1], 1], ["SP", 3, 5, 28, [7, 1, 2, 1], 1], ["SP", 3, 10, 28, [1, 14, 2, 1], 1], ["SP", 3, 15, 144, [1, 4, 1, 1], 1], ["SP", 3, 20, 5, [5, 1], 1], ["SP", 3, 23, 5, [1, 5], 1], ["RE", 3, [0, 5, 10, 15, 1, 6, 11, 16, 2, 7, 12, 17, 20, 23, 21, 24, 3, 8, 13, 18, 22, 25, 4, 9, 14, 19]], ["FSP", 4, 0, 4, 3], ["FSP", 4, 4, 5, 3], ["FSP", 4, 8, 6, 3], ["FSP", 4, 12, 7, 3], ["RE", 4, [0, 4, 8, 12, 1, 5, 9, 13, 2, 6, 10, 14, 3, 7, 11, 15]], ["CA", 3, 4, 11], ["CHR", 2, "shared", [3]], ["CA", 3, 4, 13], ["CHR", 1, "shared", [4]], ["CA", 2, 5, 13], ["CI", 1], ["FU", 12, [0, 1, 2, 3]], ["SP", 12, 0, 112896, [32], 1], ["AN", 12, 0, 5], ["AN", 12, 1, 6], ["FU", 6, [0, 1, 2, 3]], ["AN", 6, 0, 5], ["FU", 6, [1, 2, 3, 4]], ["AN", 6, 1, 4], ["FU", 6, [2, 3, 4, 5]], ["AN", 6, 2, 6], ["FU", 4, [0, 1, 2, 3]], ["SP", 4, 0, 25, [1], 1], ["AN", 4, 1, 2], ["FFSP", 4, 0, [7, 6, 5, 4], 1, 1], ["AN", 4, 1, 6], ["FU", 2, [0, 1, 2, 3]], ["SP", 2, 0, 35, [5], 1], ["AN", 2, 1, 2], ["FFSP", 2, 0, [7, 6, 5, 4], 1, 1], ["AN", 2, 1, 6], ["PR", 5, 0, "auto_unroll_max_step$512"]]]], "r": [[1.91007e-05, 1.9105e-05, 1.91027e-05, 1.90993e-05, 1.91027e-05, 1.91022e-05, 1.91034e-05, 1.91005e-05, 1.91011e-05, 1.91011e-05], 0, 48.9275, 1649140412], "v": "v0.6"}
{"i": [["[\"fused_depthwise_conv2d\", 56, 56, 144, 5, 5, [2, 2]]", "cuda -keys=cuda,gpu -max_num_threads=1024 -model=unknown -thread_warp_size=32", [-1, 16, 64, 49152, 2147483647, 1024, 8, 32], "", 0, []], [[], [["CI", 8], ["CI", 7], ["CI", 5], ["CHW", 3, "local"], ["SP", 3, 0, 1, [1, 1, 1, 1], 1], ["SP", 3, 5, 28, [1, 4, 1, 1], 1], ["SP", 3, 10, 28, [1, 2, 1, 2], 1], ["SP", 3, 15, 144, [2, 4, 3, 1], 1], ["SP", 3, 20, 5, [1, 5], 1], ["SP", 3, 23, 5, [5, 1], 1], ["RE", 3, [0, 5, 10, 15, 1, 6, 11, 16, 2, 7, 12, 17, 20, 23, 21, 24, 3, 8, 13, 18, 22, 25, 4, 9, 14, 19]], ["FSP", 4, 0, 4, 3], ["FSP", 4, 4, 5, 3], ["FSP", 4, 8, 6, 3], ["FSP", 4, 12, 7, 3], ["RE", 4, [0, 4, 8, 12, 1, 5, 9, 13, 2, 6, 10, 14, 3, 7, 11, 15]], ["CA", 3, 4, 11], ["CHR", 2, "shared", [3]], ["CA", 3, 4, 13], ["CHR", 1, "shared", [4]], ["CA", 2, 5, 13], ["CI", 1], ["FU", 12, [0, 1, 2, 3]], ["SP", 12, 0, 112896, [32], 1], ["AN", 12, 0, 5], ["AN", 12, 1, 6], ["FU", 6, [0, 1, 2, 3]], ["AN", 6, 0, 5], ["FU", 6, [1, 2, 3, 4]], ["AN", 6, 1, 4], ["FU", 6, [2, 3, 4, 5]], ["AN", 6, 2, 6], ["FU", 4, [0, 1, 2, 3]], ["SP", 4, 0, 75, [1], 1], ["AN", 4, 1, 2], ["FFSP", 4, 0, [7, 6, 5, 4], 1, 1], ["AN", 4, 1, 6], ["FU", 2, [0, 1, 2, 3]], ["SP", 2, 0, 105, [35], 1], ["AN", 2, 1, 2], ["FFSP", 2, 0, [7, 6, 5, 4], 1, 1], ["AN", 2, 1, 6], ["PR", 5, 0, "auto_unroll_max_step$64"]]]], "r": [[4.39701e-05, 4.3967e-05, 4.39698e-05, 4.39668e-05, 4.39709e-05, 4.39757e-05, 4.39733e-05, 4.39745e-05, 4.39718e-05, 4.39714e-05], 0, 43.4282, 1649140407], "v": "v0.6"}
{"i": [["[\"fused_depthwise_conv2d\", 56, 56, 144, 5, 5, [2, 2]]", "cuda -keys=cuda,gpu -max_num_threads=1024 -model=unknown -thread_warp_size=32", [-1, 16, 64, 49152, 2147483647, 1024, 8, 32], "", 0, []], [[], [["CI", 8], ["CI", 7], ["CI", 5], ["CHW", 3, "local"], ["SP", 3, 0, 1, [1, 1, 1, 1], 1], ["SP", 3, 5, 28, [1, 1, 1, 14], 1], ["SP", 3, 10, 28, [2, 2, 1, 1], 1], ["SP", 3, 15, 144, [2, 3, 2, 2], 1], ["SP", 3, 20, 5, [1, 1], 1], ["SP", 3, 23, 5, [5, 1], 1], ["RE", 3, [0, 5, 10, 15, 1, 6, 11, 16, 2, 7, 12, 17, 20, 23, 21, 24, 3, 8, 13, 18, 22, 25, 4, 9, 14, 19]], ["FSP", 4, 0, 4, 3], ["FSP", 4, 4, 5, 3], ["FSP", 4, 8, 6, 3], ["FSP", 4, 12, 7, 3], ["RE", 4, [0, 4, 8, 12, 1, 5, 9, 13, 2, 6, 10, 14, 3, 7, 11, 15]], ["CA", 3, 4, 11], ["CHR", 2, "shared", [3]], ["CA", 3, 4, 13], ["CHR", 1, "shared", [4]], ["CA", 2, 5, 13], ["CI", 1], ["FU", 12, [0, 1, 2, 3]], ["SP", 12, 0, 112896, [32], 1], ["AN", 12, 0, 5], ["AN", 12, 1, 6], ["FU", 6, [0, 1, 2, 3]], ["AN", 6, 0, 5], ["FU", 6, [1, 2, 3, 4]], ["AN", 6, 1, 4], ["FU", 6, [2, 3, 4, 5]], ["AN", 6, 2, 6], ["FU", 4, [0, 1, 2, 3]], ["SP", 4, 0, 20, [1], 1], ["AN", 4, 1, 2], ["FFSP", 4, 0, [7, 6, 5, 4], 1, 1], ["AN", 4, 1, 6], ["FU", 2, [0, 1, 2, 3]], ["SP", 2, 0, 20, [2], 1], ["AN", 2, 1, 2], ["FFSP", 2, 0, [7, 6, 5, 4], 1, 1], ["AN", 2, 1, 6], ["PR", 5, 0, "auto_unroll_max_step$512"]]]], "r": [[0.000993042, 0.000993041, 0.000993048, 0.000993065, 0.000993032, 0.000993057, 0.000993034, 0.000993041, 0.00099305, 0.000993041], 0, 30.1692, 1649140396], "v": "v0.6"}
{"i": [["[\"fused_depthwise_conv2d\", 56, 56, 144, 5, 5, [2, 2]]", "cuda -keys=cuda,gpu -max_num_threads=1024 -model=unknown -thread_warp_size=32", [-1, 16, 64, 49152, 2147483647, 1024, 8, 32], "", 0, []], [[], [["CI", 8], ["CI", 7], ["CI", 5], ["CHW", 3, "local"], ["SP", 3, 0, 1, [1, 1, 1, 1], 1], ["SP", 3, 5, 28, [1, 2, 1, 14], 1], ["SP", 3, 10, 28, [1, 7, 1, 1], 1], ["SP", 3, 15, 144, [1, 2, 6, 1], 1], ["SP", 3, 20, 5, [1, 5], 1], ["SP", 3, 23, 5, [1, 1], 1], ["RE", 3, [0, 5, 10, 15, 1, 6, 11, 16, 2, 7, 12, 17, 20, 23, 21, 24, 3, 8, 13, 18, 22, 25, 4, 9, 14, 19]], ["FSP", 4, 0, 4, 3], ["FSP", 4, 4, 5, 3], ["FSP", 4, 8, 6, 3], ["FSP", 4, 12, 7, 3], ["RE", 4, [0, 4, 8, 12, 1, 5, 9, 13, 2, 6, 10, 14, 3, 7, 11, 15]], ["CA", 3, 4, 11], ["CHR", 2, "shared", [3]], ["CA", 3, 4, 13], ["CHR", 1, "shared", [4]], ["CA", 2, 5, 13], ["CI", 1], ["FU", 12, [0, 1, 2, 3]], ["SP", 12, 0, 112896, [32], 1], ["AN", 12, 0, 5], ["AN", 12, 1, 6], ["FU", 6, [0, 1, 2, 3]], ["AN", 6, 0, 5], ["FU", 6, [1, 2, 3, 4]], ["AN", 6, 1, 4], ["FU", 6, [2, 3, 4, 5]], ["AN", 6, 2, 6], ["FU", 4, [0, 1, 2, 3]], ["SP", 4, 0, 5, [1], 1], ["AN", 4, 1, 2], ["FFSP", 4, 0, [7, 6, 5, 4], 1, 1], ["AN", 4, 1, 6], ["FU", 2, [0, 1, 2, 3]], ["SP", 2, 0, 31, [1], 1], ["AN", 2, 1, 2], ["FFSP", 2, 0, [7, 6, 5, 4], 1, 1], ["AN", 2, 1, 6], ["PR", 5, 0, "auto_unroll_max_step$64"]]]], "r": [[0.000482905, 0.000482896, 0.00048291, 0.000482932, 0.000482909, 0.000482906, 0.000482908, 0.000482909, 0.000482904, 0.000482904], 0, 12.4519, 1649140380], "v": "v0.6"}
{"i": [["[\"fused_depthwise_conv2d\", 56, 56, 144, 5, 5, [2, 2]]", "cuda -keys=cuda,gpu -max_num_threads=1024 -model=unknown -thread_warp_size=32", [-1, 16, 64, 49152, 2147483647, 1024, 8, 32], "", 0, []], [[], [["CI", 8], ["CI", 7], ["CI", 5], ["CHW", 3, "local"], ["SP", 3, 0, 1, [1, 1, 1, 1], 1], ["SP", 3, 5, 28, [1, 28, 1, 1], 1], ["SP", 3, 10, 28, [1, 1, 1, 1], 1], ["SP", 3, 15, 144, [1, 3, 16, 3], 1], ["SP", 3, 20, 5, [1, 5], 1], ["SP", 3, 23, 5, [1, 1], 1], ["RE", 3, [0, 5, 10, 15, 1, 6, 11, 16, 2, 7, 12, 17, 20, 23, 21, 24, 3, 8, 13, 18, 22, 25, 4, 9, 14, 19]], ["FSP", 4, 0, 4, 3], ["FSP", 4, 4, 5, 3], ["FSP", 4, 8, 6, 3], ["FSP", 4, 12, 7, 3], ["RE", 4, [0, 4, 8, 12, 1, 5, 9, 13, 2, 6, 10, 14, 3, 7, 11, 15]], ["CA", 3, 4, 11], ["CHR", 2, "shared", [3]], ["CA", 3, 4, 13], ["CHR", 1, "shared", [4]], ["CA", 2, 5, 13], ["CI", 1], ["FU", 12, [0, 1, 2, 3]], ["SP", 12, 0, 112896, [32], 1], ["AN", 12, 0, 5], ["AN", 12, 1, 6], ["FU", 6, [0, 1, 2, 3]], ["AN", 6, 0, 5], ["FU", 6, [1, 2, 3, 4]], ["AN", 6, 1, 4], ["FU", 6, [2, 3, 4, 5]], ["AN", 6, 2, 6], ["FU", 4, [0, 1, 2, 3]], ["SP", 4, 0, 80, [1], 1], ["AN", 4, 1, 2], ["FFSP", 4, 0, [7, 6, 5, 4], 1, 1], ["AN", 4, 1, 6], ["FU", 2, [0, 1, 2, 3]], ["SP", 2, 0, 80, [1], 1], ["AN", 2, 1, 2], ["FFSP", 2, 0, [7, 6, 5, 4], 1, 1], ["AN", 2, 1, 6], ["PR", 5, 0, "auto_unroll_max_step$0"]]]], "r": [[0.000197063, 0.000197064, 0.000197064, 0.000197075, 0.000197063, 0.00019706, 0.000197069, 0.000197061, 0.000197071, 0.000197067], 0, 55.5254, 1649140423], "v": "v0.6"}
{"i": [["[\"fused_depthwise_conv2d\", 56, 56, 144, 5, 5, [2, 2]]", "cuda -keys=cuda,gpu -max_num_threads=1024 -model=unknown -thread_warp_size=32", [-1, 16, 64, 49152, 2147483647, 1024, 8, 32], "", 0, []], [[], [["CI", 8], ["CI", 7], ["CI", 5], ["CHW", 3, "local"], ["SP", 3, 0, 1, [1, 1, 1, 1], 1], ["SP", 3, 5, 28, [1, 14, 1, 2], 1], ["SP", 3, 10, 28, [2, 1, 1, 2], 1], ["SP", 3, 15, 144, [1, 3, 2, 2], 1], ["SP", 3, 20, 5, [1, 1], 1], ["SP", 3, 23, 5, [1, 1], 1], ["RE", 3, [0, 5, 10, 15, 1, 6, 11, 16, 2, 7, 12, 17, 20, 23, 21, 24, 3, 8, 13, 18, 22, 25, 4, 9, 14, 19]], ["FSP", 4, 0, 4, 3], ["FSP", 4, 4, 5, 3], ["FSP", 4, 8, 6, 3], ["FSP", 4, 12, 7, 3], ["RE", 4, [0, 4, 8, 12, 1, 5, 9, 13, 2, 6, 10, 14, 3, 7, 11, 15]], ["CA", 3, 4, 11], ["CHR", 2, "shared", [3]], ["CA", 3, 4, 13], ["CHR", 1, "shared", [4]], ["CA", 2, 5, 13], ["CI", 1], ["FU", 12, [0, 1, 2, 3]], ["SP", 12, 0, 112896, [64], 1], ["AN", 12, 0, 5], ["AN", 12, 1, 6], ["FU", 6, [0, 1, 2, 3]], ["AN", 6, 0, 5], ["FU", 6, [1, 2, 3, 4]], ["AN", 6, 1, 4], ["FU", 6, [2, 3, 4, 5]], ["AN", 6, 2, 6], ["FU", 4, [0, 1, 2, 3]], ["SP", 4, 0, 4, [2], 1], ["AN", 4, 1, 2], ["FFSP", 4, 0, [7, 6, 5, 4], 1, 1], ["AN", 4, 1, 6], ["FU", 2, [0, 1, 2, 3]], ["SP", 2, 0, 36, [1], 1], ["AN", 2, 1, 2], ["FFSP", 2, 0, [7, 6, 5, 4], 1, 1], ["AN", 2, 1, 6], ["PR", 5, 0, "auto_unroll_max_step$64"]]]], "r": [[0.000731246, 0.000731252, 0.000731266, 0.000731304, 0.000731272, 0.000731266, 0.000731255, 0.000731259, 0.00073125, 0.000731257], 0, 71.6301, 1649140439], "v": "v0.6"}
{"i": [["[\"fused_depthwise_conv2d\", 56, 56, 144, 5, 5, [2, 2]]", "cuda -keys=cuda,gpu -max_num_threads=1024 -model=unknown -thread_warp_size=32", [-1, 16, 64, 49152, 2147483647, 1024, 8, 32], "", 0, []], [[], [["CI", 8], ["CI", 7], ["CI", 5], ["CHW", 3, "local"], ["SP", 3, 0, 1, [1, 1, 1, 1], 1], ["SP", 3, 5, 28, [1, 2, 2, 1], 1], ["SP", 3, 10, 28, [2, 1, 1, 1], 1], ["SP", 3, 15, 144, [1, 48, 1, 3], 1], ["SP", 3, 20, 5, [5, 1], 1], ["SP", 3, 23, 5, [1, 1], 1], ["RE", 3, [0, 5, 10, 15, 1, 6, 11, 16, 2, 7, 12, 17, 20, 23, 21, 24, 3, 8, 13, 18, 22, 25, 4, 9, 14, 19]], ["FSP", 4, 0, 4, 3], ["FSP", 4, 4, 5, 3], ["FSP", 4, 8, 6, 3], ["FSP", 4, 12, 7, 3], ["RE", 4, [0, 4, 8, 12, 1, 5, 9, 13, 2, 6, 10, 14, 3, 7, 11, 15]], ["CA", 3, 4, 11], ["CHR", 2, "shared", [3]], ["CA", 3, 4, 13], ["CHR", 1, "shared", [4]], ["CA", 2, 5, 13], ["CI", 1], ["FU", 12, [0, 1, 2, 3]], ["SP", 12, 0, 112896, [32], 1], ["AN", 12, 0, 5], ["AN", 12, 1, 6], ["FU", 6, [0, 1, 2, 3]], ["AN", 6, 0, 5], ["FU", 6, [1, 2, 3, 4]], ["AN", 6, 1, 4], ["FU", 6, [2, 3, 4, 5]], ["AN", 6, 2, 6], ["FU", 4, [0, 1, 2, 3]], ["SP", 4, 0, 5, [5], 1], ["AN", 4, 1, 2], ["FFSP", 4, 0, [7, 6, 5, 4], 1, 1], ["AN", 4, 1, 6], ["FU", 2, [0, 1, 2, 3]], ["SP", 2, 0, 7, [1], 1], ["AN", 2, 1, 2], ["FFSP", 2, 0, [7, 6, 5, 4], 1, 1], ["AN", 2, 1, 6], ["PR", 5, 0, "auto_unroll_max_step$0"]]]], "r": [[7.10567e-05, 7.1047e-05, 7.10443e-05, 7.10465e-05, 7.10425e-05, 7.10479e-05, 7.10518e-05, 7.10524e-05, 7.10458e-05, 7.1052e-05], 0, 66.2476, 1649140434], "v": "v0.6"}
{"i": [["[\"fused_depthwise_conv2d\", 56, 56, 144, 5, 5, [2, 2]]", "cuda -keys=cuda,gpu -max_num_threads=1024 -model=unknown -thread_warp_size=32", [-1, 16, 64, 49152, 2147483647, 1024, 8, 32], "", 0, []], [[], [["CI", 8], ["CI", 7], ["CI", 5], ["CHW", 3, "local"], ["SP", 3, 0, 1, [1, 1, 1, 1], 1], ["SP", 3, 5, 28, [1, 1, 2, 2], 1], ["SP", 3, 10, 28, [2, 1, 2, 1], 1], ["SP", 3, 15, 144, [1, 144, 1, 1], 1], ["SP", 3, 20, 5, [1, 1], 1], ["SP", 3, 23, 5, [5, 1], 1], ["RE", 3, [0, 5, 10, 15, 1, 6, 11, 16, 2, 7, 12, 17, 20, 23, 21, 24, 3, 8, 13, 18, 22, 25, 4, 9, 14, 19]], ["FSP", 4, 0, 4, 3], ["FSP", 4, 4, 5, 3], ["FSP", 4, 8, 6, 3], ["FSP", 4, 12, 7, 3], ["RE", 4, [0, 4, 8, 12, 1, 5, 9, 13, 2, 6, 10, 14, 3, 7, 11, 15]], ["CA", 3, 4, 11], ["CHR", 2, "shared", [3]], ["CA", 3, 4, 13], ["CHR", 1, "shared", [4]], ["CA", 2, 5, 13], ["CI", 1], ["FU", 12, [0, 1, 2, 3]], ["SP", 12, 0, 112896, [32], 1], ["AN", 12, 0, 5], ["AN", 12, 1, 6], ["FU", 6, [0, 1, 2, 3]], ["AN", 6, 0, 5], ["FU", 6, [1, 2, 3, 4]], ["AN", 6, 1, 4], ["FU", 6, [2, 3, 4, 5]], ["AN", 6, 2, 6], ["FU", 4, [0, 1, 2, 3]], ["SP", 4, 0, 1, [1], 1], ["AN", 4, 1, 2], ["FFSP", 4, 0, [7, 6, 5, 4], 1, 1], ["AN", 4, 1, 6], ["FU", 2, [0, 1, 2, 3]], ["SP", 2, 0, 21, [1], 1], ["AN", 2, 1, 2], ["FFSP", 2, 0, [7, 6, 5, 4], 1, 1], ["AN", 2, 1, 6], ["PR", 5, 0, "auto_unroll_max_step$512"]]]], "r": [[1.75938e-05, 1.75944e-05, 1.75938e-05, 1.75934e-05, 1.75941e-05, 1.75945e-05, 1.7595e-05, 1.75946e-05, 1.75948e-05, 1.75935e-05], 0, 92.2005, 1649140459], "v": "v0.6"}
{"i": [["[\"fused_depthwise_conv2d\", 56, 56, 144, 5, 5, [2, 2]]", "cuda -keys=cuda,gpu -max_num_threads=1024 -model=unknown -thread_warp_size=32", [-1, 16, 64, 49152, 2147483647, 1024, 8, 32], "", 0, []], [[], [["CI", 8], ["CI", 7], ["CI", 5], ["CHW", 3, "local"], ["SP", 3, 0, 1, [1, 1, 1, 1], 1], ["SP", 3, 5, 28, [1, 1, 1, 2], 1], ["SP", 3, 10, 28, [2, 14, 1, 1], 1], ["SP", 3, 15, 144, [2, 4, 2, 1], 1], ["SP", 3, 20, 5, [1, 5], 1], ["SP", 3, 23, 5, [1, 5], 1], ["RE", 3, [0, 5, 10, 15, 1, 6, 11, 16, 2, 7, 12, 17, 20, 23, 21, 24, 3, 8, 13, 18, 22, 25, 4, 9, 14, 19]], ["FSP", 4, 0, 4, 3], ["FSP", 4, 4, 5, 3], ["FSP", 4, 8, 6, 3], ["FSP", 4, 12, 7, 3], ["RE", 4, [0, 4, 8, 12, 1, 5, 9, 13, 2, 6, 10, 14, 3, 7, 11, 15]], ["CA", 3, 4, 11], ["CHR", 2, "shared", [3]], ["CA", 3, 4, 13], ["CHR", 1, "shared", [4]], ["CA", 2, 5, 13], ["CI", 1], ["FU", 12, [0, 1, 2, 3]], ["SP", 12, 0, 112896, [32], 1], ["AN", 12, 0, 5], ["AN", 12, 1, 6], ["FU", 6, [0, 1, 2, 3]], ["AN", 6, 0, 5], ["FU", 6, [1, 2, 3, 4]], ["AN", 6, 1, 4], ["FU", 6, [2, 3, 4, 5]], ["AN", 6, 2, 6], ["FU", 4, [0, 1, 2, 3]], ["SP", 4, 0, 50, [1], 1], ["AN", 4, 1, 2], ["FFSP", 4, 0, [7, 6, 5, 4], 1, 1], ["AN", 4, 1, 6], ["FU", 2, [0, 1, 2, 3]], ["SP", 2, 0, 70, [1], 1], ["AN", 2, 1, 2], ["FFSP", 2, 0, [7, 6, 5, 4], 1, 1], ["AN", 2, 1, 6], ["PR", 5, 0, "auto_unroll_max_step$1024"]]]], "r": [[1.6387e-05, 1.63859e-05, 1.63854e-05, 1.63858e-05, 1.63865e-05, 1.63862e-05, 1.63846e-05, 1.63864e-05, 1.63858e-05, 1.63865e-05], 0, 78.9026, 1649140444], "v": "v0.6"}
{"i": [["[\"fused_depthwise_conv2d\", 56, 56, 144, 5, 5, [2, 2]]", "cuda -keys=cuda,gpu -max_num_threads=1024 -model=unknown -thread_warp_size=32", [-1, 16, 64, 49152, 2147483647, 1024, 8, 32], "", 0, []], [[], [["CI", 8], ["CI", 7], ["CI", 5], ["CHW", 3, "local"], ["SP", 3, 0, 1, [1, 1, 1, 1], 1], ["SP", 3, 5, 28, [1, 1, 1, 4], 1], ["SP", 3, 10, 28, [1, 7, 1, 1], 1], ["SP", 3, 15, 144, [4, 9, 2, 1], 1], ["SP", 3, 20, 5, [5, 1], 1], ["SP", 3, 23, 5, [1, 1], 1], ["RE", 3, [0, 5, 10, 15, 1, 6, 11, 16, 2, 7, 12, 17, 20, 23, 21, 24, 3, 8, 13, 18, 22, 25, 4, 9, 14, 19]], ["FSP", 4, 0, 4, 3], ["FSP", 4, 4, 5, 3], ["FSP", 4, 8, 6, 3], ["FSP", 4, 12, 7, 3], ["RE", 4, [0, 4, 8, 12, 1, 5, 9, 13, 2, 6, 10, 14, 3, 7, 11, 15]], ["CA", 3, 4, 11], ["CHR", 2, "shared", [3]], ["CA", 3, 4, 13], ["CHR", 1, "shared", [4]], ["CA", 2, 5, 13], ["CI", 1], ["FU", 12, [0, 1, 2, 3]], ["SP", 12, 0, 112896, [32], 1], ["AN", 12, 0, 5], ["AN", 12, 1, 6], ["FU", 6, [0, 1, 2, 3]], ["AN", 6, 0, 5], ["FU", 6, [1, 2, 3, 4]], ["AN", 6, 1, 4], ["FU", 6, [2, 3, 4, 5]], ["AN", 6, 2, 6], ["FU", 4, [0, 1, 2, 3]], ["SP", 4, 0, 10, [5], 1], ["AN", 4, 1, 2], ["FFSP", 4, 0, [7, 6, 5, 4], 1, 1], ["AN", 4, 1, 6], ["FU", 2, [0, 1, 2, 3]], ["SP", 2, 0, 22, [1], 1], ["AN", 2, 1, 2], ["FFSP", 2, 0, [7, 6, 5, 4], 1, 1], ["AN", 2, 1, 6], ["PR", 5, 0, "auto_unroll_max_step$0"]]]], "r": [[0.000199901, 0.000199897, 0.000199907, 0.000199907, 0.000199893, 0.000199893, 0.000199898, 0.000199901, 0.000199896, 0.000199896], 0, 97.233, 1649140465], "v": "v0.6"}
{"i": [["[\"fused_depthwise_conv2d\", 56, 56, 144, 5, 5, [2, 2]]", "cuda -keys=cuda,gpu -max_num_threads=1024 -model=unknown -thread_warp_size=32", [-1, 16, 64, 49152, 2147483647, 1024, 8, 32], "", 0, []], [[], [["CI", 8], ["CI", 7], ["CI", 5], ["CHW", 3, "local"], ["SP", 3, 0, 1, [1, 1, 1, 1], 1], ["SP", 3, 5, 28, [1, 2, 1, 1], 1], ["SP", 3, 10, 28, [1, 14, 2, 1], 1], ["SP", 3, 15, 144, [1, 2, 12, 1], 1], ["SP", 3, 20, 5, [1, 5], 1], ["SP", 3, 23, 5, [5, 1], 1], ["RE", 3, [0, 5, 10, 15, 1, 6, 11, 16, 2, 7, 12, 17, 20, 23, 21, 24, 3, 8, 13, 18, 22, 25, 4, 9, 14, 19]], ["FSP", 4, 0, 4, 3], ["FSP", 4, 4, 5, 3], ["FSP", 4, 8, 6, 3], ["FSP", 4, 12, 7, 3], ["RE", 4, [0, 4, 8, 12, 1, 5, 9, 13, 2, 6, 10, 14, 3, 7, 11, 15]], ["CA", 3, 4, 11], ["CHR", 2, "shared", [3]], ["CA", 3, 4, 13], ["CHR", 1, "shared", [4]], ["CA", 2, 5, 13], ["CI", 1], ["FU", 12, [0, 1, 2, 3]], ["SP", 12, 0, 112896, [32], 1], ["AN", 12, 0, 5], ["AN", 12, 1, 6], ["FU", 6, [0, 1, 2, 3]], ["AN", 6, 0, 5], ["FU", 6, [1, 2, 3, 4]], ["AN", 6, 1, 4], ["FU", 6, [2, 3, 4, 5]], ["AN", 6, 2, 6], ["FU", 4, [0, 1, 2, 3]], ["SP", 4, 0, 15, [3], 1], ["AN", 4, 1, 2], ["FFSP", 4, 0, [7, 6, 5, 4], 1, 1], ["AN", 4, 1, 6], ["FU", 2, [0, 1, 2, 3]], ["SP", 2, 0, 45, [1], 1], ["AN", 2, 1, 2], ["FFSP", 2, 0, [7, 6, 5, 4], 1, 1], ["AN", 2, 1, 6], ["PR", 5, 0, "auto_unroll_max_step$0"]]]], "r": [[5.892e-05, 5.89189e-05, 5.89207e-05, 5.89198e-05, 5.89194e-05, 5.89198e-05, 5.8919e-05, 5.89191e-05, 5.89196e-05, 5.89189e-05], 0, 82.3099, 1649140450], "v": "v0.6"}
{"i": [["[\"fused_depthwise_conv2d\", 56, 56, 144, 5, 5, [2, 2]]", "cuda -keys=cuda,gpu -max_num_threads=1024 -model=unknown -thread_warp_size=32", [-1, 16, 64, 49152, 2147483647, 1024, 8, 32], "", 0, []], [[], [["CI", 8], ["CI", 7], ["CI", 5], ["CHW", 3, "local"], ["SP", 3, 0, 1, [1, 1, 1, 1], 1], ["SP", 3, 5, 28, [1, 14, 1, 1], 1], ["SP", 3, 10, 28, [1, 1, 1, 1], 1], ["SP", 3, 15, 144, [3, 4, 2, 1], 1], ["SP", 3, 20, 5, [1, 5], 1], ["SP", 3, 23, 5, [1, 1], 1], ["RE", 3, [0, 5, 10, 15, 1, 6, 11, 16, 2, 7, 12, 17, 20, 23, 21, 24, 3, 8, 13, 18, 22, 25, 4, 9, 14, 19]], ["FSP", 4, 0, 4, 3], ["FSP", 4, 4, 5, 3], ["FSP", 4, 8, 6, 3], ["FSP", 4, 12, 7, 3], ["RE", 4, [0, 4, 8, 12, 1, 5, 9, 13, 2, 6, 10, 14, 3, 7, 11, 15]], ["CA", 3, 4, 11], ["CHR", 2, "shared", [3]], ["CA", 3, 4, 13], ["CHR", 1, "shared", [4]], ["CA", 2, 5, 13], ["CI", 1], ["FU", 12, [0, 1, 2, 3]], ["SP", 12, 0, 112896, [32], 1], ["AN", 12, 0, 5], ["AN", 12, 1, 6], ["FU", 6, [0, 1, 2, 3]], ["AN", 6, 0, 5], ["FU", 6, [1, 2, 3, 4]], ["AN", 6, 1, 4], ["FU", 6, [2, 3, 4, 5]], ["AN", 6, 2, 6], ["FU", 4, [0, 1, 2, 3]], ["SP", 4, 0, 10, [10], 1], ["AN", 4, 1, 2], ["FFSP", 4, 0, [7, 6, 5, 4], 1, 1], ["AN", 4, 1, 6], ["FU", 2, [0, 1, 2, 3]], ["SP", 2, 0, 10, [5], 1], ["AN", 2, 1, 2], ["FFSP", 2, 0, [7, 6, 5, 4], 1, 1], ["AN", 2, 1, 6], ["PR", 5, 0, "auto_unroll_max_step$1024"]]]], "r": [[1.85649e-05, 1.85677e-05, 1.85668e-05, 1.85661e-05, 1.85662e-05, 1.85645e-05, 1.85641e-05, 1.8567e-05, 1.8565e-05, 1.85679e-05], 0, 88.5396, 1649140455], "v": "v0.6"}
{"i": [["[\"fused_depthwise_conv2d\", 56, 56, 144, 5, 5, [2, 2]]", "cuda -keys=cuda,gpu -max_num_threads=1024 -model=unknown -thread_warp_size=32", [-1, 16, 64, 49152, 2147483647, 1024, 8, 32], "", 0, []], [[], [["CI", 8], ["CI", 7], ["CI", 5], ["CHW", 3, "local"], ["SP", 3, 0, 1, [1, 1, 1, 1], 1], ["SP", 3, 5, 28, [1, 14, 1, 1], 1], ["SP", 3, 10, 28, [14, 2, 1, 1], 1], ["SP", 3, 15, 144, [1, 2, 1, 2], 1], ["SP", 3, 20, 5, [1, 5], 1], ["SP", 3, 23, 5, [1, 5], 1], ["RE", 3, [0, 5, 10, 15, 1, 6, 11, 16, 2, 7, 12, 17, 20, 23, 21, 24, 3, 8, 13, 18, 22, 25, 4, 9, 14, 19]], ["FSP", 4, 0, 4, 3], ["FSP", 4, 4, 5, 3], ["FSP", 4, 8, 6, 3], ["FSP", 4, 12, 7, 3], ["RE", 4, [0, 4, 8, 12, 1, 5, 9, 13, 2, 6, 10, 14, 3, 7, 11, 15]], ["CA", 3, 4, 11], ["CHR", 2, "shared", [3]], ["CA", 3, 4, 13], ["CHR", 1, "shared", [4]], ["CA", 2, 5, 13], ["CI", 1], ["FU", 12, [0, 1, 2, 3]], ["SP", 12, 0, 112896, [32], 1], ["AN", 12, 0, 5], ["AN", 12, 1, 6], ["FU", 6, [0, 1, 2, 3]], ["AN", 6, 0, 5], ["FU", 6, [1, 2, 3, 4]], ["AN", 6, 1, 4], ["FU", 6, [2, 3, 4, 5]], ["AN", 6, 2, 6], ["FU", 4, [0, 1, 2, 3]], ["SP", 4, 0, 10, [1], 1], ["AN", 4, 1, 2], ["FFSP", 4, 0, [7, 6, 5, 4], 1, 1], ["AN", 4, 1, 6], ["FU", 2, [0, 1, 2, 3]], ["SP", 2, 0, 14, [1], 1], ["AN", 2, 1, 2], ["FFSP", 2, 0, [7, 6, 5, 4], 1, 1], ["AN", 2, 1, 6], ["PR", 5, 0, "auto_unroll_max_step$0"]]]], "r": [[4.56583e-05, 4.56629e-05, 4.56609e-05, 4.56645e-05, 4.56574e-05, 4.56589e-05, 4.5658e-05, 4.56592e-05, 4.56564e-05, 4.56583e-05], 0, 117.271, 1649140485], "v": "v0.6"}
{"i": [["[\"fused_depthwise_conv2d\", 56, 56, 144, 5, 5, [2, 2]]", "cuda -keys=cuda,gpu -max_num_threads=1024 -model=unknown -thread_warp_size=32", [-1, 16, 64, 49152, 2147483647, 1024, 8, 32], "", 0, []], [[], [["CI", 8], ["CI", 7], ["CI", 5], ["CHW", 3, "local"], ["SP", 3, 0, 1, [1, 1, 1, 1], 1], ["SP", 3, 5, 28, [1, 1, 1, 2], 1], ["SP", 3, 10, 28, [2, 14, 1, 1], 1], ["SP", 3, 15, 144, [2, 4, 2, 1], 1], ["SP", 3, 20, 5, [1, 5], 1], ["SP", 3, 23, 5, [5, 1], 1], ["RE", 3, [0, 5, 10, 15, 1, 6, 11, 16, 2, 7, 12, 17, 20, 23, 21, 24, 3, 8, 13, 18, 22, 25, 4, 9, 14, 19]], ["FSP", 4, 0, 4, 3], ["FSP", 4, 4, 5, 3], ["FSP", 4, 8, 6, 3], ["FSP", 4, 12, 7, 3], ["RE", 4, [0, 4, 8, 12, 1, 5, 9, 13, 2, 6, 10, 14, 3, 7, 11, 15]], ["CA", 3, 4, 11], ["CHR", 2, "shared", [3]], ["CA", 3, 4, 13], ["CHR", 1, "shared", [4]], ["CA", 2, 5, 13], ["CI", 1], ["FU", 12, [0, 1, 2, 3]], ["SP", 12, 0, 112896, [32], 1], ["AN", 12, 0, 5], ["AN", 12, 1, 6], ["FU", 6, [0, 1, 2, 3]], ["AN", 6, 0, 5], ["FU", 6, [1, 2, 3, 4]], ["AN", 6, 1, 4], ["FU", 6, [2, 3, 4, 5]], ["AN", 6, 2, 6], ["FU", 4, [0, 1, 2, 3]], ["SP", 4, 0, 50, [1], 1], ["AN", 4, 1, 2], ["FFSP", 4, 0, [7, 6, 5, 4], 1, 1], ["AN", 4, 1, 6], ["FU", 2, [0, 1, 2, 3]], ["SP", 2, 0, 70, [1], 1], ["AN", 2, 1, 2], ["FFSP", 2, 0, [7, 6, 5, 4], 1, 1], ["AN", 2, 1, 6], ["PR", 5, 0, "auto_unroll_max_step$1024"]]]], "r": [[1.63668e-05, 1.63658e-05, 1.63672e-05, 1.63662e-05, 1.6367e-05, 1.6367e-05, 1.63667e-05, 1.63674e-05, 1.63661e-05, 1.6367e-05], 0, 109.292, 1649140475], "v": "v0.6"}
{"i": [["[\"fused_depthwise_conv2d\", 56, 56, 144, 5, 5, [2, 2]]", "cuda -keys=cuda,gpu -max_num_threads=1024 -model=unknown -thread_warp_size=32", [-1, 16, 64, 49152, 2147483647, 1024, 8, 32], "", 0, []], [[], [["CI", 8], ["CI", 7], ["CI", 5], ["CHW", 3, "local"], ["SP", 3, 0, 1, [1, 1, 1, 1], 1], ["SP", 3, 5, 28, [1, 2, 1, 1], 1], ["SP", 3, 10, 28, [1, 14, 2, 1], 1], ["SP", 3, 15, 144, [2, 3, 1, 3], 1], ["SP", 3, 20, 5, [5, 1], 1], ["SP", 3, 23, 5, [1, 5], 1], ["RE", 3, [0, 5, 10, 15, 1, 6, 11, 16, 2, 7, 12, 17, 20, 23, 21, 24, 3, 8, 13, 18, 22, 25, 4, 9, 14, 19]], ["FSP", 4, 0, 4, 3], ["FSP", 4, 4, 5, 3], ["FSP", 4, 8, 6, 3], ["FSP", 4, 12, 7, 3], ["RE", 4, [0, 4, 8, 12, 1, 5, 9, 13, 2, 6, 10, 14, 3, 7, 11, 15]], ["CA", 3, 4, 11], ["CHR", 2, "shared", [3]], ["CA", 3, 4, 13], ["CHR", 1, "shared", [4]], ["CA", 2, 5, 13], ["CI", 1], ["FU", 12, [0, 1, 2, 3]], ["SP", 12, 0, 112896, [32], 1], ["AN", 12, 0, 5], ["AN", 12, 1, 6], ["FU", 6, [0, 1, 2, 3]], ["AN", 6, 0, 5], ["FU", 6, [1, 2, 3, 4]], ["AN", 6, 1, 4], ["FU", 6, [2, 3, 4, 5]], ["AN", 6, 2, 6], ["FU", 4, [0, 1, 2, 3]], ["SP", 4, 0, 75, [15], 1], ["AN", 4, 1, 2], ["FFSP", 4, 0, [7, 6, 5, 4], 1, 1], ["AN", 4, 1, 6], ["FU", 2, [0, 1, 2, 3]], ["SP", 2, 0, 105, [1], 1], ["AN", 2, 1, 2], ["FFSP", 2, 0, [7, 6, 5, 4], 1, 1], ["AN", 2, 1, 6], ["PR", 5, 0, "auto_unroll_max_step$1024"]]]], "r": [[1.6305e-05, 1.63039e-05, 1.63039e-05, 1.63048e-05, 1.63034e-05, 1.63031e-05, 1.63024e-05, 1.63043e-05, 1.63047e-05, 1.63022e-05], 0, 113.917, 1649140480], "v": "v0.6"}
{"i": [["[\"fused_depthwise_conv2d\", 56, 56, 144, 5, 5, [2, 2]]", "cuda -keys=cuda,gpu -max_num_threads=1024 -model=unknown -thread_warp_size=32", [-1, 16, 64, 49152, 2147483647, 1024, 8, 32], "", 0, []], [[], [["CI", 8], ["CI", 7], ["CI", 5], ["CHW", 3, "local"], ["SP", 3, 0, 1, [1, 1, 1, 1], 1], ["SP", 3, 5, 28, [2, 1, 1, 1], 1], ["SP", 3, 10, 28, [1, 7, 1, 1], 1], ["SP", 3, 15, 144, [1, 3, 1, 3], 1], ["SP", 3, 20, 5, [5, 1], 1], ["SP", 3, 23, 5, [1, 5], 1], ["RE", 3, [0, 5, 10, 15, 1, 6, 11, 16, 2, 7, 12, 17, 20, 23, 21, 24, 3, 8, 13, 18, 22, 25, 4, 9, 14, 19]], ["FSP", 4, 0, 4, 3], ["FSP", 4, 4, 5, 3], ["FSP", 4, 8, 6, 3], ["FSP", 4, 12, 7, 3], ["RE", 4, [0, 4, 8, 12, 1, 5, 9, 13, 2, 6, 10, 14, 3, 7, 11, 15]], ["CA", 3, 4, 11], ["CHR", 2, "shared", [3]], ["CA", 3, 4, 13], ["CHR", 1, "shared", [4]], ["CA", 2, 5, 13], ["CI", 1], ["FU", 12, [0, 1, 2, 3]], ["SP", 12, 0, 112896, [32], 1], ["AN", 12, 0, 5], ["AN", 12, 1, 6], ["FU", 6, [0, 1, 2, 3]], ["AN", 6, 0, 5], ["FU", 6, [1, 2, 3, 4]], ["AN", 6, 1, 4], ["FU", 6, [2, 3, 4, 5]], ["AN", 6, 2, 6], ["FU", 4, [0, 1, 2, 3]], ["SP", 4, 0, 15, [15], 1], ["AN", 4, 1, 2], ["FFSP", 4, 0, [7, 6, 5, 4], 1, 1], ["AN", 4, 1, 6], ["FU", 2, [0, 1, 2, 3]], ["SP", 2, 0, 15, [1], 1], ["AN", 2, 1, 2], ["FFSP", 2, 0, [7, 6, 5, 4], 1, 1], ["AN", 2, 1, 6], ["PR", 5, 0, "auto_unroll_max_step$64"]]]], "r": [[1.64238e-05, 1.64221e-05, 1.64225e-05, 1.64217e-05, 1.64215e-05, 1.64217e-05, 1.64201e-05, 1.64178e-05, 1.64225e-05, 1.64199e-05], 0, 103.316, 1649140470], "v": "v0.6"}
{"i": [["[\"fused_depthwise_conv2d\", 56, 56, 144, 5, 5, [2, 2]]", "cuda -keys=cuda,gpu -max_num_threads=1024 -model=unknown -thread_warp_size=32", [-1, 16, 64, 49152, 2147483647, 1024, 8, 32], "", 0, []], [[], [["CI", 8], ["CI", 7], ["CI", 5], ["CHW", 3, "local"], ["SP", 3, 0, 1, [1, 1, 1, 1], 1], ["SP", 3, 5, 28, [1, 28, 1, 1], 1], ["SP", 3, 10, 28, [1, 2, 1, 1], 1], ["SP", 3, 15, 144, [4, 1, 4, 1], 1], ["SP", 3, 20, 5, [1, 1], 1], ["SP", 3, 23, 5, [1, 5], 1], ["RE", 3, [0, 5, 10, 15, 1, 6, 11, 16, 2, 7, 12, 17, 20, 23, 21, 24, 3, 8, 13, 18, 22, 25, 4, 9, 14, 19]], ["FSP", 4, 0, 4, 3], ["FSP", 4, 4, 5, 3], ["FSP", 4, 8, 6, 3], ["FSP", 4, 12, 7, 3], ["RE", 4, [0, 4, 8, 12, 1, 5, 9, 13, 2, 6, 10, 14, 3, 7, 11, 15]], ["CA", 3, 4, 11], ["CHR", 2, "shared", [3]], ["CA", 3, 4, 13], ["CHR", 1, "shared", [4]], ["CA", 2, 5, 13], ["CI", 1], ["FU", 12, [0, 1, 2, 3]], ["SP", 12, 0, 112896, [32], 1], ["AN", 12, 0, 5], ["AN", 12, 1, 6], ["FU", 6, [0, 1, 2, 3]], ["AN", 6, 0, 5], ["FU", 6, [1, 2, 3, 4]], ["AN", 6, 1, 4], ["FU", 6, [2, 3, 4, 5]], ["AN", 6, 2, 6], ["FU", 4, [0, 1, 2, 3]], ["SP", 4, 0, 20, [4], 1], ["AN", 4, 1, 2], ["FFSP", 4, 0, [7, 6, 5, 4], 1, 1], ["AN", 4, 1, 6], ["FU", 2, [0, 1, 2, 3]], ["SP", 2, 0, 20, [10], 1], ["AN", 2, 1, 2], ["FFSP", 2, 0, [7, 6, 5, 4], 1, 1], ["AN", 2, 1, 6], ["PR", 5, 0, "auto_unroll_max_step$64"]]]], "r": [[4.18093e-05, 4.18106e-05, 4.18165e-05, 4.18098e-05, 4.18149e-05, 4.18152e-05, 4.1811e-05, 4.18084e-05, 4.18177e-05, 4.18178e-05], 0, 122.96, 1649140491], "v": "v0.6"}
{"i": [["[\"fused_depthwise_conv2d\", 56, 56, 144, 5, 5, [2, 2]]", "cuda -keys=cuda,gpu -max_num_threads=1024 -model=unknown -thread_warp_size=32", [-1, 16, 64, 49152, 2147483647, 1024, 8, 32], "", 0, []], [[], [["CI", 8], ["CI", 7], ["CI", 5], ["CHW", 3, "local"], ["SP", 3, 0, 1, [1, 1, 1, 1], 1], ["SP", 3, 5, 28, [1, 4, 1, 1], 1], ["SP", 3, 10, 28, [2, 2, 1, 1], 1], ["SP", 3, 15, 144, [2, 9, 1, 1], 1], ["SP", 3, 20, 5, [5, 1], 1], ["SP", 3, 23, 5, [1, 5], 1], ["RE", 3, [0, 5, 10, 15, 1, 6, 11, 16, 2, 7, 12, 17, 20, 23, 21, 24, 3, 8, 13, 18, 22, 25, 4, 9, 14, 19]], ["FSP", 4, 0, 4, 3], ["FSP", 4, 4, 5, 3], ["FSP", 4, 8, 6, 3], ["FSP", 4, 12, 7, 3], ["RE", 4, [0, 4, 8, 12, 1, 5, 9, 13, 2, 6, 10, 14, 3, 7, 11, 15]], ["CA", 3, 4, 11], ["CHR", 2, "shared", [3]], ["CA", 3, 4, 13], ["CHR", 1, "shared", [4]], ["CA", 2, 5, 13], ["CI", 1], ["FU", 12, [0, 1, 2, 3]], ["SP", 12, 0, 112896, [32], 1], ["AN", 12, 0, 5], ["AN", 12, 1, 6], ["FU", 6, [0, 1, 2, 3]], ["AN", 6, 0, 5], ["FU", 6, [1, 2, 3, 4]], ["AN", 6, 1, 4], ["FU", 6, [2, 3, 4, 5]], ["AN", 6, 2, 6], ["FU", 4, [0, 1, 2, 3]], ["SP", 4, 0, 25, [5], 1], ["AN", 4, 1, 2], ["FFSP", 4, 0, [7, 6, 5, 4], 1, 1], ["AN", 4, 1, 6], ["FU", 2, [0, 1, 2, 3]], ["SP", 2, 0, 25, [1], 1], ["AN", 2, 1, 2], ["FFSP", 2, 0, [7, 6, 5, 4], 1, 1], ["AN", 2, 1, 6], ["PR", 5, 0, "auto_unroll_max_step$0"]]]], "r": [[1.89191e-05, 1.8921e-05, 1.89229e-05, 1.89207e-05, 1.89224e-05, 1.89219e-05, 1.89236e-05, 1.89245e-05, 1.89195e-05, 1.89193e-05], 0, 139.102, 1649140507], "v": "v0.6"}
{"i": [["[\"fused_depthwise_conv2d\", 56, 56, 144, 5, 5, [2, 2]]", "cuda -keys=cuda,gpu -max_num_threads=1024 -model=unknown -thread_warp_size=32", [-1, 16, 64, 49152, 2147483647, 1024, 8, 32], "", 0, []], [[], [["CI", 8], ["CI", 7], ["CI", 5], ["CHW", 3, "local"], ["SP", 3, 0, 1, [1, 1, 1, 1], 1], ["SP", 3, 5, 28, [1, 28, 1, 1], 1], ["SP", 3, 10, 28, [1, 1, 1, 1], 1], ["SP", 3, 15, 144, [1, 9, 8, 2], 1], ["SP", 3, 20, 5, [1, 5], 1], ["SP", 3, 23, 5, [1, 1], 1], ["RE", 3, [0, 5, 10, 15, 1, 6, 11, 16, 2, 7, 12, 17, 20, 23, 21, 24, 3, 8, 13, 18, 22, 25, 4, 9, 14, 19]], ["FSP", 4, 0, 4, 3], ["FSP", 4, 4, 5, 3], ["FSP", 4, 8, 6, 3], ["FSP", 4, 12, 7, 3], ["RE", 4, [0, 4, 8, 12, 1, 5, 9, 13, 2, 6, 10, 14, 3, 7, 11, 15]], ["CA", 3, 4, 11], ["CHR", 2, "shared", [3]], ["CA", 3, 4, 13], ["CHR", 1, "shared", [4]], ["CA", 2, 5, 13], ["CI", 1], ["FU", 12, [0, 1, 2, 3]], ["SP", 12, 0, 112896, [64], 1], ["AN", 12, 0, 5], ["AN", 12, 1, 6], ["FU", 6, [0, 1, 2, 3]], ["AN", 6, 0, 5], ["FU", 6, [1, 2, 3, 4]], ["AN", 6, 1, 4], ["FU", 6, [2, 3, 4, 5]], ["AN", 6, 2, 6], ["FU", 4, [0, 1, 2, 3]], ["SP", 4, 0, 80, [16], 1], ["AN", 4, 1, 2], ["FFSP", 4, 0, [7, 6, 5, 4], 1, 1], ["AN", 4, 1, 6], ["FU", 2, [0, 1, 2, 3]], ["SP", 2, 0, 80, [1], 1], ["AN", 2, 1, 2], ["FFSP", 2, 0, [7, 6, 5, 4], 1, 1], ["AN", 2, 1, 6], ["PR", 5, 0, "auto_unroll_max_step$0"]]]], "r": [[7.57225e-05, 7.57227e-05, 7.57246e-05, 7.57282e-05, 7.57235e-05, 7.5724e-05, 7.57219e-05, 7.57223e-05, 7.57211e-05, 7.57232e-05], 0, 160.738, 1649140529], "v": "v0.6"}
{"i": [["[\"fused_depthwise_conv2d\", 56, 56, 144, 5, 5, [2, 2]]", "cuda -keys=cuda,gpu -max_num_threads=1024 -model=unknown -thread_warp_size=32", [-1, 16, 64, 49152, 2147483647, 1024, 8, 32], "", 0, []], [[], [["CI", 8], ["CI", 7], ["CI", 5], ["CHW", 3, "local"], ["SP", 3, 0, 1, [1, 1, 1, 1], 1], ["SP", 3, 5, 28, [2, 7, 2, 1], 1], ["SP", 3, 10, 28, [1, 1, 1, 4], 1], ["SP", 3, 15, 144, [1, 4, 4, 1], 1], ["SP", 3, 20, 5, [1, 1], 1], ["SP", 3, 23, 5, [1, 1], 1], ["RE", 3, [0, 5, 10, 15, 1, 6, 11, 16, 2, 7, 12, 17, 20, 23, 21, 24, 3, 8, 13, 18, 22, 25, 4, 9, 14, 19]], ["FSP", 4, 0, 4, 3], ["FSP", 4, 4, 5, 3], ["FSP", 4, 8, 6, 3], ["FSP", 4, 12, 7, 3], ["RE", 4, [0, 4, 8, 12, 1, 5, 9, 13, 2, 6, 10, 14, 3, 7, 11, 15]], ["CA", 3, 4, 11], ["CHR", 2, "shared", [3]], ["CA", 3, 4, 13], ["CHR", 1, "shared", [4]], ["CA", 2, 5, 13], ["CI", 1], ["FU", 12, [0, 1, 2, 3]], ["SP", 12, 0, 112896, [8], 1], ["AN", 12, 0, 5], ["AN", 12, 1, 6], ["FU", 6, [0, 1, 2, 3]], ["AN", 6, 0, 5], ["FU", 6, [1, 2, 3, 4]], ["AN", 6, 1, 4], ["FU", 6, [2, 3, 4, 5]], ["AN", 6, 2, 6], ["FU", 4, [0, 1, 2, 3]], ["SP", 4, 0, 4, [1], 1], ["AN", 4, 1, 2], ["FFSP", 4, 0, [7, 6, 5, 4], 1, 1], ["AN", 4, 1, 6], ["FU", 2, [0, 1, 2, 3]], ["SP", 2, 0, 84, [1], 1], ["AN", 2, 1, 2], ["FFSP", 2, 0, [7, 6, 5, 4], 1, 1], ["AN", 2, 1, 6], ["PR", 5, 0, "auto_unroll_max_step$0"]]]], "r": [[0.00124985, 0.00124987, 0.00124988, 0.00124992, 0.00124986, 0.00124987, 0.00124986, 0.00124989, 0.00124986, 0.00124987], 0, 128.09, 1649140496], "v": "v0.6"}
{"i": [["[\"fused_depthwise_conv2d\", 56, 56, 144, 5, 5, [2, 2]]", "cuda -keys=cuda,gpu -max_num_threads=1024 -model=unknown -thread_warp_size=32", [-1, 16, 64, 49152, 2147483647, 1024, 8, 32], "", 0, []], [[], [["CI", 8], ["CI", 7], ["CI", 5], ["CHW", 3, "local"], ["SP", 3, 0, 1, [1, 1, 1, 1], 1], ["SP", 3, 5, 28, [1, 2, 2, 1], 1], ["SP", 3, 10, 28, [2, 1, 1, 1], 1], ["SP", 3, 15, 144, [1, 144, 1, 1], 1], ["SP", 3, 20, 5, [5, 1], 1], ["SP", 3, 23, 5, [1, 1], 1], ["RE", 3, [0, 5, 10, 15, 1, 6, 11, 16, 2, 7, 12, 17, 20, 23, 21, 24, 3, 8, 13, 18, 22, 25, 4, 9, 14, 19]], ["FSP", 4, 0, 4, 3], ["FSP", 4, 4, 5, 3], ["FSP", 4, 8, 6, 3], ["FSP", 4, 12, 7, 3], ["RE", 4, [0, 4, 8, 12, 1, 5, 9, 13, 2, 6, 10, 14, 3, 7, 11, 15]], ["CA", 3, 4, 11], ["CHR", 2, "shared", [3]], ["CA", 3, 4, 13], ["CHR", 1, "shared", [4]], ["CA", 2, 5, 13], ["CI", 1], ["FU", 12, [0, 1, 2, 3]], ["SP", 12, 0, 112896, [32], 1], ["AN", 12, 0, 5], ["AN", 12, 1, 6], ["FU", 6, [0, 1, 2, 3]], ["AN", 6, 0, 5], ["FU", 6, [1, 2, 3, 4]], ["AN", 6, 1, 4], ["FU", 6, [2, 3, 4, 5]], ["AN", 6, 2, 6], ["FU", 4, [0, 1, 2, 3]], ["SP", 4, 0, 5, [1], 1], ["AN", 4, 1, 2], ["FFSP", 4, 0, [7, 6, 5, 4], 1, 1], ["AN", 4, 1, 6], ["FU", 2, [0, 1, 2, 3]], ["SP", 2, 0, 7, [7], 1], ["AN", 2, 1, 2], ["FFSP", 2, 0, [7, 6, 5, 4], 1, 1], ["AN", 2, 1, 6], ["PR", 5, 0, "auto_unroll_max_step$1024"]]]], "r": [[1.73219e-05, 1.73214e-05, 1.73212e-05, 1.73207e-05, 1.73213e-05, 1.73227e-05, 1.73237e-05, 1.73244e-05, 1.7324e-05, 1.73258e-05], 0, 183.979, 1649140550], "v": "v0.6"}
{"i": [["[\"fused_depthwise_conv2d\", 56, 56, 144, 5, 5, [2, 2]]", "cuda -keys=cuda,gpu -max_num_threads=1024 -model=unknown -thread_warp_size=32", [-1, 16, 64, 49152, 2147483647, 1024, 8, 32], "", 0, []], [[], [["CI", 8], ["CI", 7], ["CI", 5], ["CHW", 3, "local"], ["SP", 3, 0, 1, [1, 1, 1, 1], 1], ["SP", 3, 5, 28, [1, 2, 1, 1], 1], ["SP", 3, 10, 28, [1, 1, 14, 2], 1], ["SP", 3, 15, 144, [1, 18, 1, 2], 1], ["SP", 3, 20, 5, [1, 1], 1], ["SP", 3, 23, 5, [1, 1], 1], ["RE", 3, [0, 5, 10, 15, 1, 6, 11, 16, 2, 7, 12, 17, 20, 23, 21, 24, 3, 8, 13, 18, 22, 25, 4, 9, 14, 19]], ["FSP", 4, 0, 4, 3], ["FSP", 4, 4, 5, 3], ["FSP", 4, 8, 6, 3], ["FSP", 4, 12, 7, 3], ["RE", 4, [0, 4, 8, 12, 1, 5, 9, 13, 2, 6, 10, 14, 3, 7, 11, 15]], ["CA", 3, 4, 11], ["CHR", 2, "shared", [3]], ["CA", 3, 4, 13], ["CHR", 1, "shared", [4]], ["CA", 2, 5, 13], ["CI", 1], ["FU", 12, [0, 1, 2, 3]], ["SP", 12, 0, 112896, [64], 1], ["AN", 12, 0, 5], ["AN", 12, 1, 6], ["FU", 6, [0, 1, 2, 3]], ["AN", 6, 0, 5], ["FU", 6, [1, 2, 3, 4]], ["AN", 6, 1, 4], ["FU", 6, [2, 3, 4, 5]], ["AN", 6, 2, 6], ["FU", 4, [0, 1, 2, 3]], ["SP", 4, 0, 10, [1], 1], ["AN", 4, 1, 2], ["FFSP", 4, 0, [7, 6, 5, 4], 1, 1], ["AN", 4, 1, 6], ["FU", 2, [0, 1, 2, 3]], ["SP", 2, 0, 118, [2], 1], ["AN", 2, 1, 2], ["FFSP", 2, 0, [7, 6, 5, 4], 1, 1], ["AN", 2, 1, 6], ["PR", 5, 0, "auto_unroll_max_step$16"]]]], "r": [[0.000718505, 0.000718478, 0.000718457, 0.000718504, 0.00071845, 0.000718434, 0.000718494, 0.00071844, 0.00071841, 0.000718424], 0, 133.916, 1649140502], "v": "v0.6"}
{"i": [["[\"fused_depthwise_conv2d\", 56, 56, 144, 5, 5, [2, 2]]", "cuda -keys=cuda,gpu -max_num_threads=1024 -model=unknown -thread_warp_size=32", [-1, 16, 64, 49152, 2147483647, 1024, 8, 32], "", 0, []], [[], [["CI", 8], ["CI", 7], ["CI", 5], ["CHW", 3, "local"], ["SP", 3, 0, 1, [1, 1, 1, 1], 1], ["SP", 3, 5, 28, [1, 2, 2, 1], 1], ["SP", 3, 10, 28, [2, 1, 2, 1], 1], ["SP", 3, 15, 144, [4, 36, 1, 1], 1], ["SP", 3, 20, 5, [1, 1], 1], ["SP", 3, 23, 5, [1, 1], 1], ["RE", 3, [0, 5, 10, 15, 1, 6, 11, 16, 2, 7, 12, 17, 20, 23, 21, 24, 3, 8, 13, 18, 22, 25, 4, 9, 14, 19]], ["FSP", 4, 0, 4, 3], ["FSP", 4, 4, 5, 3], ["FSP", 4, 8, 6, 3], ["FSP", 4, 12, 7, 3], ["RE", 4, [0, 4, 8, 12, 1, 5, 9, 13, 2, 6, 10, 14, 3, 7, 11, 15]], ["CA", 3, 4, 11], ["CHR", 2, "shared", [3]], ["CA", 3, 4, 13], ["CHR", 1, "shared", [4]], ["CA", 2, 5, 13], ["CI", 1], ["FU", 12, [0, 1, 2, 3]], ["SP", 12, 0, 112896, [32], 1], ["AN", 12, 0, 5], ["AN", 12, 1, 6], ["FU", 6, [0, 1, 2, 3]], ["AN", 6, 0, 5], ["FU", 6, [1, 2, 3, 4]], ["AN", 6, 1, 4], ["FU", 6, [2, 3, 4, 5]], ["AN", 6, 2, 6], ["FU", 4, [0, 1, 2, 3]], ["SP", 4, 0, 1, [1], 1], ["AN", 4, 1, 2], ["FFSP", 4, 0, [7, 6, 5, 4], 1, 1], ["AN", 4, 1, 6], ["FU", 2, [0, 1, 2, 3]], ["SP", 2, 0, 21, [1], 1], ["AN", 2, 1, 2], ["FFSP", 2, 0, [7, 6, 5, 4], 1, 1], ["AN", 2, 1, 6], ["PR", 5, 0, "auto_unroll_max_step$16"]]]], "r": [[0.000514745, 0.000514859, 0.000514813, 0.000514726, 0.000514904, 0.000514758, 0.000514821, 0.000514752, 0.000514829, 0.000514915], 0, 144.459, 1649140513], "v": "v0.6"}
{"i": [["[\"fused_depthwise_conv2d\", 56, 56, 144, 5, 5, [2, 2]]", "cuda -keys=cuda,gpu -max_num_threads=1024 -model=unknown -thread_warp_size=32", [-1, 16, 64, 49152, 2147483647, 1024, 8, 32], "", 0, []], [[], [["CI", 8], ["CI", 7], ["CI", 5], ["CHW", 3, "local"], ["SP", 3, 0, 1, [1, 1, 1, 1], 1], ["SP", 3, 5, 28, [1, 2, 1, 1], 1], ["SP", 3, 10, 28, [1, 1, 1, 1], 1], ["SP", 3, 15, 144, [1, 36, 4, 1], 1], ["SP", 3, 20, 5, [1, 1], 1], ["SP", 3, 23, 5, [5, 1], 1], ["RE", 3, [0, 5, 10, 15, 1, 6, 11, 16, 2, 7, 12, 17, 20, 23, 21, 24, 3, 8, 13, 18, 22, 25, 4, 9, 14, 19]], ["FSP", 4, 0, 4, 3], ["FSP", 4, 4, 5, 3], ["FSP", 4, 8, 6, 3], ["FSP", 4, 12, 7, 3], ["RE", 4, [0, 4, 8, 12, 1, 5, 9, 13, 2, 6, 10, 14, 3, 7, 11, 15]], ["CA", 3, 4, 11], ["CHR", 2, "shared", [3]], ["CA", 3, 4, 13], ["CHR", 1, "shared", [4]], ["CA", 2, 5, 13], ["CI", 1], ["FU", 12, [0, 1, 2, 3]], ["SP", 12, 0, 112896, [32], 1], ["AN", 12, 0, 5], ["AN", 12, 1, 6], ["FU", 6, [0, 1, 2, 3]], ["AN", 6, 0, 5], ["FU", 6, [1, 2, 3, 4]], ["AN", 6, 1, 4], ["FU", 6, [2, 3, 4, 5]], ["AN", 6, 2, 6], ["FU", 4, [0, 1, 2, 3]], ["SP", 4, 0, 20, [1], 1], ["AN", 4, 1, 2], ["FFSP", 4, 0, [7, 6, 5, 4], 1, 1], ["AN", 4, 1, 6], ["FU", 2, [0, 1, 2, 3]], ["SP", 2, 0, 20, [1], 1], ["AN", 2, 1, 2], ["FFSP", 2, 0, [7, 6, 5, 4], 1, 1], ["AN", 2, 1, 6], ["PR", 5, 0, "auto_unroll_max_step$1024"]]]], "r": [[1.61077e-05, 1.61063e-05, 1.61056e-05, 1.61069e-05, 1.61065e-05, 1.61049e-05, 1.61071e-05, 1.6106e-05, 1.61075e-05, 1.6108e-05], 0, 172.581, 1649140539], "v": "v0.6"}
{"i": [["[\"fused_depthwise_conv2d\", 56, 56, 144, 5, 5, [2, 2]]", "cuda -keys=cuda,gpu -max_num_threads=1024 -model=unknown -thread_warp_size=32", [-1, 16, 64, 49152, 2147483647, 1024, 8, 32], "", 0, []], [[], [["CI", 8], ["CI", 7], ["CI", 5], ["CHW", 3, "local"], ["SP", 3, 0, 1, [1, 1, 1, 1], 1], ["SP", 3, 5, 28, [2, 1, 1, 1], 1], ["SP", 3, 10, 28, [1, 14, 2, 1], 1], ["SP", 3, 15, 144, [1, 6, 1, 3], 1], ["SP", 3, 20, 5, [5, 1], 1], ["SP", 3, 23, 5, [1, 5], 1], ["RE", 3, [0, 5, 10, 15, 1, 6, 11, 16, 2, 7, 12, 17, 20, 23, 21, 24, 3, 8, 13, 18, 22, 25, 4, 9, 14, 19]], ["FSP", 4, 0, 4, 3], ["FSP", 4, 4, 5, 3], ["FSP", 4, 8, 6, 3], ["FSP", 4, 12, 7, 3], ["RE", 4, [0, 4, 8, 12, 1, 5, 9, 13, 2, 6, 10, 14, 3, 7, 11, 15]], ["CA", 3, 4, 11], ["CHR", 2, "shared", [3]], ["CA", 3, 4, 13], ["CHR", 1, "shared", [4]], ["CA", 2, 5, 13], ["CI", 1], ["FU", 12, [0, 1, 2, 3]], ["SP", 12, 0, 112896, [32], 1], ["AN", 12, 0, 5], ["AN", 12, 1, 6], ["FU", 6, [0, 1, 2, 3]], ["AN", 6, 0, 5], ["FU", 6, [1, 2, 3, 4]], ["AN", 6, 1, 4], ["FU", 6, [2, 3, 4, 5]], ["AN", 6, 2, 6], ["FU", 4, [0, 1, 2, 3]], ["SP", 4, 0, 75, [1], 1], ["AN", 4, 1, 2], ["FFSP", 4, 0, [7, 6, 5, 4], 1, 1], ["AN", 4, 1, 6], ["FU", 2, [0, 1, 2, 3]], ["SP", 2, 0, 105, [1], 1], ["AN", 2, 1, 2], ["FFSP", 2, 0, [7, 6, 5, 4], 1, 1], ["AN", 2, 1, 6], ["PR", 5, 0, "auto_unroll_max_step$1024"]]]], "r": [[1.53848e-05, 1.53871e-05, 1.53849e-05, 1.53857e-05, 1.53865e-05, 1.53868e-05, 1.53862e-05, 1.53875e-05, 1.53865e-05, 1.53866e-05], 0, 197.922, 1649140565], "v": "v0.6"}
{"i": [["[\"fused_depthwise_conv2d\", 56, 56, 144, 5, 5, [2, 2]]", "cuda -keys=cuda,gpu -max_num_threads=1024 -model=unknown -thread_warp_size=32", [-1, 16, 64, 49152, 2147483647, 1024, 8, 32], "", 0, []], [[], [["CI", 8], ["CI", 7], ["CI", 5], ["CHW", 3, "local"], ["SP", 3, 0, 1, [1, 1, 1, 1], 1], ["SP", 3, 5, 28, [1, 2, 1, 2], 1], ["SP", 3, 10, 28, [1, 7, 1, 1], 1], ["SP", 3, 15, 144, [1, 3, 12, 1], 1], ["SP", 3, 20, 5, [1, 5], 1], ["SP", 3, 23, 5, [5, 1], 1], ["RE", 3, [0, 5, 10, 15, 1, 6, 11, 16, 2, 7, 12, 17, 20, 23, 21, 24, 3, 8, 13, 18, 22, 25, 4, 9, 14, 19]], ["FSP", 4, 0, 4, 3], ["FSP", 4, 4, 5, 3], ["FSP", 4, 8, 6, 3], ["FSP", 4, 12, 7, 3], ["RE", 4, [0, 4, 8, 12, 1, 5, 9, 13, 2, 6, 10, 14, 3, 7, 11, 15]], ["CA", 3, 4, 11], ["CHR", 2, "shared", [3]], ["CA", 3, 4, 13], ["CHR", 1, "shared", [4]], ["CA", 2, 5, 13], ["CI", 1], ["FU", 12, [0, 1, 2, 3]], ["SP", 12, 0, 112896, [32], 1], ["AN", 12, 0, 5], ["AN", 12, 1, 6], ["FU", 6, [0, 1, 2, 3]], ["AN", 6, 0, 5], ["FU", 6, [1, 2, 3, 4]], ["AN", 6, 1, 4], ["FU", 6, [2, 3, 4, 5]], ["AN", 6, 2, 6], ["FU", 4, [0, 1, 2, 3]], ["SP", 4, 0, 300, [6], 1], ["AN", 4, 1, 2], ["FFSP", 4, 0, [7, 6, 5, 4], 1, 1], ["AN", 4, 1, 6], ["FU", 2, [0, 1, 2, 3]], ["SP", 2, 0, 420, [1], 1], ["AN", 2, 1, 2], ["FFSP", 2, 0, [7, 6, 5, 4], 1, 1], ["AN", 2, 1, 6], ["PR", 5, 0, "auto_unroll_max_step$1024"]]]], "r": [[2.08628e-05, 2.08634e-05, 2.08649e-05, 2.08615e-05, 2.08642e-05, 2.08621e-05, 2.08636e-05, 2.08618e-05, 2.08625e-05, 2.08655e-05], 0, 153.829, 1649140518], "v": "v0.6"}
{"i": [["[\"fused_depthwise_conv2d\", 56, 56, 144, 5, 5, [2, 2]]", "cuda -keys=cuda,gpu -max_num_threads=1024 -model=unknown -thread_warp_size=32", [-1, 16, 64, 49152, 2147483647, 1024, 8, 32], "", 0, []], [[], [["CI", 8], ["CI", 7], ["CI", 5], ["CHW", 3, "local"], ["SP", 3, 0, 1, [1, 1, 1, 1], 1], ["SP", 3, 5, 28, [1, 14, 1, 2], 1], ["SP", 3, 10, 28, [2, 1, 1, 2], 1], ["SP", 3, 15, 144, [1, 6, 2, 2], 1], ["SP", 3, 20, 5, [1, 1], 1], ["SP", 3, 23, 5, [1, 1], 1], ["RE", 3, [0, 5, 10, 15, 1, 6, 11, 16, 2, 7, 12, 17, 20, 23, 21, 24, 3, 8, 13, 18, 22, 25, 4, 9, 14, 19]], ["FSP", 4, 0, 4, 3], ["FSP", 4, 4, 5, 3], ["FSP", 4, 8, 6, 3], ["FSP", 4, 12, 7, 3], ["RE", 4, [0, 4, 8, 12, 1, 5, 9, 13, 2, 6, 10, 14, 3, 7, 11, 15]], ["CA", 3, 4, 11], ["CHR", 2, "shared", [3]], ["CA", 3, 4, 13], ["CHR", 1, "shared", [4]], ["CA", 2, 5, 13], ["CI", 1], ["FU", 12, [0, 1, 2, 3]], ["SP", 12, 0, 112896, [32], 1], ["AN", 12, 0, 5], ["AN", 12, 1, 6], ["FU", 6, [0, 1, 2, 3]], ["AN", 6, 0, 5], ["FU", 6, [1, 2, 3, 4]], ["AN", 6, 1, 4], ["FU", 6, [2, 3, 4, 5]], ["AN", 6, 2, 6], ["FU", 4, [0, 1, 2, 3]], ["SP", 4, 0, 4, [2], 1], ["AN", 4, 1, 2], ["FFSP", 4, 0, [7, 6, 5, 4], 1, 1], ["AN", 4, 1, 6], ["FU", 2, [0, 1, 2, 3]], ["SP", 2, 0, 36, [4], 1], ["AN", 2, 1, 2], ["FFSP", 2, 0, [7, 6, 5, 4], 1, 1], ["AN", 2, 1, 6], ["PR", 5, 0, "auto_unroll_max_step$64"]]]], "r": [[0.000599674, 0.000599678, 0.000599814, 0.000599801, 0.000599687, 0.000599743, 0.000599668, 0.000599614, 0.000599671, 0.000599753], 0, 155.178, 1649140524], "v": "v0.6"}
{"i": [["[\"fused_depthwise_conv2d\", 56, 56, 144, 5, 5, [2, 2]]", "cuda -keys=cuda,gpu -max_num_threads=1024 -model=unknown -thread_warp_size=32", [-1, 16, 64, 49152, 2147483647, 1024, 8, 32], "", 0, []], [[], [["CI", 8], ["CI", 7], ["CI", 5], ["CHW", 3, "local"], ["SP", 3, 0, 1, [1, 1, 1, 1], 1], ["SP", 3, 5, 28, [1, 2, 1, 1], 1], ["SP", 3, 10, 28, [1, 4, 1, 1], 1], ["SP", 3, 15, 144, [1, 12, 12, 1], 1], ["SP", 3, 20, 5, [1, 1], 1], ["SP", 3, 23, 5, [5, 1], 1], ["RE", 3, [0, 5, 10, 15, 1, 6, 11, 16, 2, 7, 12, 17, 20, 23, 21, 24, 3, 8, 13, 18, 22, 25, 4, 9, 14, 19]], ["FSP", 4, 0, 4, 3], ["FSP", 4, 4, 5, 3], ["FSP", 4, 8, 6, 3], ["FSP", 4, 12, 7, 3], ["RE", 4, [0, 4, 8, 12, 1, 5, 9, 13, 2, 6, 10, 14, 3, 7, 11, 15]], ["CA", 3, 4, 11], ["CHR", 2, "shared", [3]], ["CA", 3, 4, 13], ["CHR", 1, "shared", [4]], ["CA", 2, 5, 13], ["CI", 1], ["FU", 12, [0, 1, 2, 3]], ["SP", 12, 0, 112896, [32], 1], ["AN", 12, 0, 5], ["AN", 12, 1, 6], ["FU", 6, [0, 1, 2, 3]], ["AN", 6, 0, 5], ["FU", 6, [1, 2, 3, 4]], ["AN", 6, 1, 4], ["FU", 6, [2, 3, 4, 5]], ["AN", 6, 2, 6], ["FU", 4, [0, 1, 2, 3]], ["SP", 4, 0, 20, [1], 1], ["AN", 4, 1, 2], ["FFSP", 4, 0, [7, 6, 5, 4], 1, 1], ["AN", 4, 1, 6], ["FU", 2, [0, 1, 2, 3]], ["SP", 2, 0, 20, [1], 1], ["AN", 2, 1, 2], ["FFSP", 2, 0, [7, 6, 5, 4], 1, 1], ["AN", 2, 1, 6], ["PR", 5, 0, "auto_unroll_max_step$1024"]]]], "r": [[2.03691e-05, 2.03683e-05, 2.03695e-05, 2.03697e-05, 2.03697e-05, 2.03658e-05, 2.03649e-05, 2.03669e-05, 2.03666e-05, 2.03682e-05], 0, 169.387, 1649140534], "v": "v0.6"}
{"i": [["[\"fused_depthwise_conv2d\", 56, 56, 144, 5, 5, [2, 2]]", "cuda -keys=cuda,gpu -max_num_threads=1024 -model=unknown -thread_warp_size=32", [-1, 16, 64, 49152, 2147483647, 1024, 8, 32], "", 0, []], [[], [["CI", 8], ["CI", 7], ["CI", 5], ["CHW", 3, "local"], ["SP", 3, 0, 1, [1, 1, 1, 1], 1], ["SP", 3, 5, 28, [1, 7, 2, 1], 1], ["SP", 3, 10, 28, [1, 14, 2, 1], 1], ["SP", 3, 15, 144, [1, 1, 1, 6], 1], ["SP", 3, 20, 5, [5, 1], 1], ["SP", 3, 23, 5, [5, 1], 1], ["RE", 3, [0, 5, 10, 15, 1, 6, 11, 16, 2, 7, 12, 17, 20, 23, 21, 24, 3, 8, 13, 18, 22, 25, 4, 9, 14, 19]], ["FSP", 4, 0, 4, 3], ["FSP", 4, 4, 5, 3], ["FSP", 4, 8, 6, 3], ["FSP", 4, 12, 7, 3], ["RE", 4, [0, 4, 8, 12, 1, 5, 9, 13, 2, 6, 10, 14, 3, 7, 11, 15]], ["CA", 3, 4, 11], ["CHR", 2, "shared", [3]], ["CA", 3, 4, 13], ["CHR", 1, "shared", [4]], ["CA", 2, 5, 13], ["CI", 1], ["FU", 12, [0, 1, 2, 3]], ["SP", 12, 0, 112896, [32], 1], ["AN", 12, 0, 5], ["AN", 12, 1, 6], ["FU", 6, [0, 1, 2, 3]], ["AN", 6, 0, 5], ["FU", 6, [1, 2, 3, 4]], ["AN", 6, 1, 4], ["FU", 6, [2, 3, 4, 5]], ["AN", 6, 2, 6], ["FU", 4, [0, 1, 2, 3]], ["SP", 4, 0, 150, [1], 1], ["AN", 4, 1, 2], ["FFSP", 4, 0, [7, 6, 5, 4], 1, 1], ["AN", 4, 1, 6], ["FU", 2, [0, 1, 2, 3]], ["SP", 2, 0, 294, [1], 1], ["AN", 2, 1, 2], ["FFSP", 2, 0, [7, 6, 5, 4], 1, 1], ["AN", 2, 1, 6], ["PR", 5, 0, "auto_unroll_max_step$16"]]]], "r": [[4.36581e-05, 4.36562e-05, 4.366e-05, 4.36568e-05, 4.36567e-05, 4.36585e-05, 4.36585e-05, 4.36555e-05, 4.36563e-05, 4.36571e-05], 0, 191.5, 1649140560], "v": "v0.6"}
{"i": [["[\"fused_depthwise_conv2d\", 56, 56, 144, 5, 5, [2, 2]]", "cuda -keys=cuda,gpu -max_num_threads=1024 -model=unknown -thread_warp_size=32", [-1, 16, 64, 49152, 2147483647, 1024, 8, 32], "", 0, []], [[], [["CI", 8], ["CI", 7], ["CI", 5], ["CHW", 3, "local"], ["SP", 3, 0, 1, [1, 1, 1, 1], 1], ["SP", 3, 5, 28, [2, 1, 7, 1], 1], ["SP", 3, 10, 28, [1, 2, 2, 1], 1], ["SP", 3, 15, 144, [1, 16, 1, 1], 1], ["SP", 3, 20, 5, [1, 5], 1], ["SP", 3, 23, 5, [5, 1], 1], ["RE", 3, [0, 5, 10, 15, 1, 6, 11, 16, 2, 7, 12, 17, 20, 23, 21, 24, 3, 8, 13, 18, 22, 25, 4, 9, 14, 19]], ["FSP", 4, 0, 4, 3], ["FSP", 4, 4, 5, 3], ["FSP", 4, 8, 6, 3], ["FSP", 4, 12, 7, 3], ["RE", 4, [0, 4, 8, 12, 1, 5, 9, 13, 2, 6, 10, 14, 3, 7, 11, 15]], ["CA", 3, 4, 11], ["CHR", 2, "shared", [3]], ["CA", 3, 4, 13], ["CHR", 1, "shared", [4]], ["CA", 2, 5, 13], ["CI", 1], ["FU", 12, [0, 1, 2, 3]], ["SP", 12, 0, 112896, [32], 1], ["AN", 12, 0, 5], ["AN", 12, 1, 6], ["FU", 6, [0, 1, 2, 3]], ["AN", 6, 0, 5], ["FU", 6, [1, 2, 3, 4]], ["AN", 6, 1, 4], ["FU", 6, [2, 3, 4, 5]], ["AN", 6, 2, 6], ["FU", 4, [0, 1, 2, 3]], ["SP", 4, 0, 25, [1], 1], ["AN", 4, 1, 2], ["FFSP", 4, 0, [7, 6, 5, 4], 1, 1], ["AN", 4, 1, 6], ["FU", 2, [0, 1, 2, 3]], ["SP", 2, 0, 119, [7], 1], ["AN", 2, 1, 2], ["FFSP", 2, 0, [7, 6, 5, 4], 1, 1], ["AN", 2, 1, 6], ["PR", 5, 0, "auto_unroll_max_step$16"]]]], "r": [[3.28719e-05, 3.28723e-05, 3.28691e-05, 3.28667e-05, 3.28722e-05, 3.28677e-05, 3.28705e-05, 3.287e-05, 3.28718e-05, 3.28717e-05], 0, 186.446, 1649140555], "v": "v0.6"}
{"i": [["[\"fused_depthwise_conv2d\", 56, 56, 144, 5, 5, [2, 2]]", "cuda -keys=cuda,gpu -max_num_threads=1024 -model=unknown -thread_warp_size=32", [-1, 16, 64, 49152, 2147483647, 1024, 8, 32], "", 0, []], [[], [["CI", 8], ["CI", 7], ["CI", 5], ["CHW", 3, "local"], ["SP", 3, 0, 1, [1, 1, 1, 1], 1], ["SP", 3, 5, 28, [1, 2, 1, 2], 1], ["SP", 3, 10, 28, [1, 7, 1, 1], 1], ["SP", 3, 15, 144, [1, 3, 12, 1], 1], ["SP", 3, 20, 5, [1, 5], 1], ["SP", 3, 23, 5, [5, 1], 1], ["RE", 3, [0, 5, 10, 15, 1, 6, 11, 16, 2, 7, 12, 17, 20, 23, 21, 24, 3, 8, 13, 18, 22, 25, 4, 9, 14, 19]], ["FSP", 4, 0, 4, 3], ["FSP", 4, 4, 5, 3], ["FSP", 4, 8, 6, 3], ["FSP", 4, 12, 7, 3], ["RE", 4, [0, 4, 8, 12, 1, 5, 9, 13, 2, 6, 10, 14, 3, 7, 11, 15]], ["CA", 3, 4, 11], ["CHR", 2, "shared", [3]], ["CA", 3, 4, 13], ["CHR", 1, "shared", [4]], ["CA", 2, 5, 13], ["CI", 1], ["FU", 12, [0, 1, 2, 3]], ["SP", 12, 0, 112896, [64], 1], ["AN", 12, 0, 5], ["AN", 12, 1, 6], ["FU", 6, [0, 1, 2, 3]], ["AN", 6, 0, 5], ["FU", 6, [1, 2, 3, 4]], ["AN", 6, 1, 4], ["FU", 6, [2, 3, 4, 5]], ["AN", 6, 2, 6], ["FU", 4, [0, 1, 2, 3]], ["SP", 4, 0, 300, [6], 1], ["AN", 4, 1, 2], ["FFSP", 4, 0, [7, 6, 5, 4], 1, 1], ["AN", 4, 1, 6], ["FU", 2, [0, 1, 2, 3]], ["SP", 2, 0, 420, [1], 1], ["AN", 2, 1, 2], ["FFSP", 2, 0, [7, 6, 5, 4], 1, 1], ["AN", 2, 1, 6], ["PR", 5, 0, "auto_unroll_max_step$1024"]]]], "r": [[1.96047e-05, 1.9602e-05, 1.96031e-05, 1.96039e-05, 1.96038e-05, 1.96044e-05, 1.96039e-05, 1.9604e-05, 1.96048e-05, 1.96049e-05], 0, 210.851, 1649140575], "v": "v0.6"}
{"i": [["[\"fused_depthwise_conv2d\", 56, 56, 144, 5, 5, [2, 2]]", "cuda -keys=cuda,gpu -max_num_threads=1024 -model=unknown -thread_warp_size=32", [-1, 16, 64, 49152, 2147483647, 1024, 8, 32], "", 0, []], [[], [["CI", 8], ["CI", 7], ["CI", 5], ["CHW", 3, "local"], ["SP", 3, 0, 1, [1, 1, 1, 1], 1], ["SP", 3, 5, 28, [2, 1, 1, 1], 1], ["SP", 3, 10, 28, [1, 4, 1, 7], 1], ["SP", 3, 15, 144, [1, 48, 1, 1], 1], ["SP", 3, 20, 5, [1, 1], 1], ["SP", 3, 23, 5, [1, 5], 1], ["RE", 3, [0, 5, 10, 15, 1, 6, 11, 16, 2, 7, 12, 17, 20, 23, 21, 24, 3, 8, 13, 18, 22, 25, 4, 9, 14, 19]], ["FSP", 4, 0, 4, 3], ["FSP", 4, 4, 5, 3], ["FSP", 4, 8, 6, 3], ["FSP", 4, 12, 7, 3], ["RE", 4, [0, 4, 8, 12, 1, 5, 9, 13, 2, 6, 10, 14, 3, 7, 11, 15]], ["CA", 3, 4, 11], ["CHR", 2, "shared", [3]], ["CA", 3, 4, 13], ["CHR", 1, "shared", [4]], ["CA", 2, 5, 13], ["CI", 1], ["FU", 12, [0, 1, 2, 3]], ["SP", 12, 0, 112896, [32], 1], ["AN", 12, 0, 5], ["AN", 12, 1, 6], ["FU", 6, [0, 1, 2, 3]], ["AN", 6, 0, 5], ["FU", 6, [1, 2, 3, 4]], ["AN", 6, 1, 4], ["FU", 6, [2, 3, 4, 5]], ["AN", 6, 2, 6], ["FU", 4, [0, 1, 2, 3]], ["SP", 4, 0, 5, [1], 1], ["AN", 4, 1, 2], ["FFSP", 4, 0, [7, 6, 5, 4], 1, 1], ["AN", 4, 1, 6], ["FU", 2, [0, 1, 2, 3]], ["SP", 2, 0, 17, [1], 1], ["AN", 2, 1, 2], ["FFSP", 2, 0, [7, 6, 5, 4], 1, 1], ["AN", 2, 1, 6], ["PR", 5, 0, "auto_unroll_max_step$0"]]]], "r": [[6.99847e-05, 6.99759e-05, 6.99793e-05, 6.99775e-05, 6.99783e-05, 6.99773e-05, 6.99799e-05, 6.99802e-05, 6.9976e-05, 6.9977e-05], 0, 175.683, 1649140545], "v": "v0.6"}
{"i": [["[\"fused_depthwise_conv2d\", 56, 56, 144, 5, 5, [2, 2]]", "cuda -keys=cuda,gpu -max_num_threads=1024 -model=unknown -thread_warp_size=32", [-1, 16, 64, 49152, 2147483647, 1024, 8, 32], "", 0, []], [[], [["CI", 8], ["CI", 7], ["CI", 5], ["CHW", 3, "local"], ["SP", 3, 0, 1, [1, 1, 1, 1], 1], ["SP", 3, 5, 28, [1, 2, 1, 1], 1], ["SP", 3, 10, 28, [1, 1, 1, 1], 1], ["SP", 3, 15, 144, [1, 36, 4, 1], 1], ["SP", 3, 20, 5, [1, 1], 1], ["SP", 3, 23, 5, [1, 5], 1], ["RE", 3, [0, 5, 10, 15, 1, 6, 11, 16, 2, 7, 12, 17, 20, 23, 21, 24, 3, 8, 13, 18, 22, 25, 4, 9, 14, 19]], ["FSP", 4, 0, 4, 3], ["FSP", 4, 4, 5, 3], ["FSP", 4, 8, 6, 3], ["FSP", 4, 12, 7, 3], ["RE", 4, [0, 4, 8, 12, 1, 5, 9, 13, 2, 6, 10, 14, 3, 7, 11, 15]], ["CA", 3, 4, 11], ["CHR", 2, "shared", [3]], ["CA", 3, 4, 13], ["CHR", 1, "shared", [4]], ["CA", 2, 5, 13], ["CI", 1], ["FU", 12, [0, 1, 2, 3]], ["SP", 12, 0, 112896, [32], 1], ["AN", 12, 0, 5], ["AN", 12, 1, 6], ["FU", 6, [0, 1, 2, 3]], ["AN", 6, 0, 5], ["FU", 6, [1, 2, 3, 4]], ["AN", 6, 1, 4], ["FU", 6, [2, 3, 4, 5]], ["AN", 6, 2, 6], ["FU", 4, [0, 1, 2, 3]], ["SP", 4, 0, 20, [1], 1], ["AN", 4, 1, 2], ["FFSP", 4, 0, [7, 6, 5, 4], 1, 1], ["AN", 4, 1, 6], ["FU", 2, [0, 1, 2, 3]], ["SP", 2, 0, 20, [1], 1], ["AN", 2, 1, 2], ["FFSP", 2, 0, [7, 6, 5, 4], 1, 1], ["AN", 2, 1, 6], ["PR", 5, 0, "auto_unroll_max_step$512"]]]], "r": [[1.59898e-05, 1.59905e-05, 1.5989e-05, 1.59895e-05, 1.599e-05, 1.59895e-05, 1.59899e-05, 1.59894e-05, 1.59898e-05, 1.59897e-05], 0, 202.786, 1649140570], "v": "v0.6"}
{"i": [["[\"fused_depthwise_conv2d\", 56, 56, 144, 5, 5, [2, 2]]", "cuda -keys=cuda,gpu -max_num_threads=1024 -model=unknown -thread_warp_size=32", [-1, 16, 64, 49152, 2147483647, 1024, 8, 32], "", 0, []], [[], [["CI", 8], ["CI", 7], ["CI", 5], ["CHW", 3, "local"], ["SP", 3, 0, 1, [1, 1, 1, 1], 1], ["SP", 3, 5, 28, [1, 14, 1, 1], 1], ["SP", 3, 10, 28, [1, 14, 1, 1], 1], ["SP", 3, 15, 144, [1, 2, 1, 2], 1], ["SP", 3, 20, 5, [1, 1], 1], ["SP", 3, 23, 5, [1, 5], 1], ["RE", 3, [0, 5, 10, 15, 1, 6, 11, 16, 2, 7, 12, 17, 20, 23, 21, 24, 3, 8, 13, 18, 22, 25, 4, 9, 14, 19]], ["FSP", 4, 0, 4, 3], ["FSP", 4, 4, 5, 3], ["FSP", 4, 8, 6, 3], ["FSP", 4, 12, 7, 3], ["RE", 4, [0, 4, 8, 12, 1, 5, 9, 13, 2, 6, 10, 14, 3, 7, 11, 15]], ["CA", 3, 4, 11], ["CHR", 2, "shared", [3]], ["CA", 3, 4, 13], ["CHR", 1, "shared", [4]], ["CA", 2, 5, 13], ["CI", 1], ["FU", 12, [0, 1, 2, 3]], ["SP", 12, 0, 112896, [32], 1], ["AN", 12, 0, 5], ["AN", 12, 1, 6], ["FU", 6, [0, 1, 2, 3]], ["AN", 6, 0, 5], ["FU", 6, [1, 2, 3, 4]], ["AN", 6, 1, 4], ["FU", 6, [2, 3, 4, 5]], ["AN", 6, 2, 6], ["FU", 4, [0, 1, 2, 3]], ["SP", 4, 0, 10, [1], 1], ["AN", 4, 1, 2], ["FFSP", 4, 0, [7, 6, 5, 4], 1, 1], ["AN", 4, 1, 6], ["FU", 2, [0, 1, 2, 3]], ["SP", 2, 0, 14, [1], 1], ["AN", 2, 1, 2], ["FFSP", 2, 0, [7, 6, 5, 4], 1, 1], ["AN", 2, 1, 6], ["PR", 5, 0, "auto_unroll_max_step$0"]]]], "r": [[2.45369e-05, 2.45357e-05, 2.45363e-05, 2.45343e-05, 2.45362e-05, 2.45392e-05, 2.45363e-05, 2.45345e-05, 2.45334e-05, 2.45383e-05], 0, 211.237, 1649140580], "v": "v0.6"}
{"i": [["[\"fused_depthwise_conv2d\", 56, 56, 144, 5, 5, [2, 2]]", "cuda -keys=cuda,gpu -max_num_threads=1024 -model=unknown -thread_warp_size=32", [-1, 16, 64, 49152, 2147483647, 1024, 8, 32], "", 0, []], [[], [["CI", 8], ["CI", 7], ["CI", 5], ["CHW", 3, "local"], ["SP", 3, 0, 1, [1, 1, 1, 1], 1], ["SP", 3, 5, 28, [1, 14, 2, 1], 1], ["SP", 3, 10, 28, [1, 1, 1, 1], 1], ["SP", 3, 15, 144, [1, 36, 2, 2], 1], ["SP", 3, 20, 5, [1, 5], 1], ["SP", 3, 23, 5, [1, 1], 1], ["RE", 3, [0, 5, 10, 15, 1, 6, 11, 16, 2, 7, 12, 17, 20, 23, 21, 24, 3, 8, 13, 18, 22, 25, 4, 9, 14, 19]], ["FSP", 4, 0, 4, 3], ["FSP", 4, 4, 5, 3], ["FSP", 4, 8, 6, 3], ["FSP", 4, 12, 7, 3], ["RE", 4, [0, 4, 8, 12, 1, 5, 9, 13, 2, 6, 10, 14, 3, 7, 11, 15]], ["CA", 3, 4, 11], ["CHR", 2, "shared", [3]], ["CA", 3, 4, 13], ["CHR", 1, "shared", [4]], ["CA", 2, 5, 13], ["CI", 1], ["FU", 12, [0, 1, 2, 3]], ["SP", 12, 0, 112896, [32], 1], ["AN", 12, 0, 5], ["AN", 12, 1, 6], ["FU", 6, [0, 1, 2, 3]], ["AN", 6, 0, 5], ["FU", 6, [1, 2, 3, 4]], ["AN", 6, 1, 4], ["FU", 6, [2, 3, 4, 5]], ["AN", 6, 2, 6], ["FU", 4, [0, 1, 2, 3]], ["SP", 4, 0, 80, [1], 1], ["AN", 4, 1, 2], ["FFSP", 4, 0, [7, 6, 5, 4], 1, 1], ["AN", 4, 1, 6], ["FU", 2, [0, 1, 2, 3]], ["SP", 2, 0, 80, [10], 1], ["AN", 2, 1, 2], ["FFSP", 2, 0, [7, 6, 5, 4], 1, 1], ["AN", 2, 1, 6], ["PR", 5, 0, "auto_unroll_max_step$0"]]]], "r": [[2.85865e-05, 2.85869e-05, 2.85859e-05, 2.85856e-05, 2.85856e-05, 2.85854e-05, 2.85862e-05, 2.85843e-05, 2.85882e-05, 2.85859e-05], 0, 212.128, 1649140585], "v": "v0.6"}
