python/models/efficientnet/kernel_configs/efficient_se_module_sigmoid_48_1.log
{"i": [["[\"se_module_sigmoid\", 48, 1]", "cuda -keys=cuda,gpu -max_num_threads=1024 -model=unknown -thread_warp_size=32", [-1, 16, 64, 49152, 2147483647, 1024, 8, 32], "", 0, []], [[], [["FU", 1, [0, 1]], ["SP", 1, 0, 48, [3], 1], ["AN", 1, 0, 5], ["AN", 1, 1, 6]]]], "r": [[3.121e-06, 3.16992e-06, 3.15377e-06], 0, 0.640358, 1681270105], "v": "v0.6"}
{"i": [["[\"se_module_sigmoid\", 48, 1]", "cuda -keys=cuda,gpu -max_num_threads=1024 -model=unknown -thread_warp_size=32", [-1, 16, 64, 49152, 2147483647, 1024, 8, 32], "", 0, []], [[], [["FU", 1, [0, 1]], ["SP", 1, 0, 48, [2], 1], ["AN", 1, 0, 5], ["AN", 1, 1, 6]]]], "r": [[3.11645e-06, 3.15478e-06, 3.14404e-06], 0, 1.0881, 1681270105], "v": "v0.6"}
{"i": [["[\"se_module_sigmoid\", 48, 1]", "cuda -keys=cuda,gpu -max_num_threads=1024 -model=unknown -thread_warp_size=32", [-1, 16, 64, 49152, 2147483647, 1024, 8, 32], "", 0, []], [[], [["FU", 1, [0, 1]], ["SP", 1, 0, 48, [48], 1], ["AN", 1, 0, 5], ["AN", 1, 1, 6]]]], "r": [[3.06128e-06, 3.11914e-06, 3.02145e-06], 0, 2.31975, 1681270106], "v": "v0.6"}
{"i": [["[\"se_module_sigmoid\", 48, 1]", "cuda -keys=cuda,gpu -max_num_threads=1024 -model=unknown -thread_warp_size=32", [-1, 16, 64, 49152, 2147483647, 1024, 8, 32], "", 0, []], [[], [["FU", 1, [0, 1]], ["SP", 1, 0, 48, [8], 1], ["AN", 1, 0, 5], ["AN", 1, 1, 6]]]], "r": [[3.19407e-06, 3.15895e-06, 3.12628e-06], 0, 2.68789, 1681270107], "v": "v0.6"}
{"i": [["[\"se_module_sigmoid\", 48, 1]", "cuda -keys=cuda,gpu -max_num_threads=1024 -model=unknown -thread_warp_size=32", [-1, 16, 64, 49152, 2147483647, 1024, 8, 32], "", 0, []], [[], [["FU", 1, [0, 1]], ["SP", 1, 0, 48, [16], 1], ["AN", 1, 0, 5], ["AN", 1, 1, 6]]]], "r": [[3.13277e-06, 3.09383e-06, 3.03787e-06], 0, 1.83909, 1681270106], "v": "v0.6"}
{"i": [["[\"se_module_sigmoid\", 48, 1]", "cuda -keys=cuda,gpu -max_num_threads=1024 -model=unknown -thread_warp_size=32", [-1, 16, 64, 49152, 2147483647, 1024, 8, 32], "", 0, []], [[], [["FU", 1, [0, 1]], ["SP", 1, 0, 48, [4], 1], ["AN", 1, 0, 5], ["AN", 1, 1, 6]]]], "r": [[3.10678e-06, 3.10103e-06, 3.19138e-06], 0, 4.83196, 1681270109], "v": "v0.6"}
{"i": [["[\"se_module_sigmoid\", 48, 1]", "cuda -keys=cuda,gpu -max_num_threads=1024 -model=unknown -thread_warp_size=32", [-1, 16, 64, 49152, 2147483647, 1024, 8, 32], "", 0, []], [[], [["FU", 1, [0, 1]], ["SP", 1, 0, 48, [24], 1], ["AN", 1, 0, 5], ["AN", 1, 1, 6]]]], "r": [[3.15861e-06, 3.16187e-06, 3.10519e-06], 0, 3.06298, 1681270107], "v": "v0.6"}
{"i": [["[\"se_module_sigmoid\", 48, 1]", "cuda -keys=cuda,gpu -max_num_threads=1024 -model=unknown -thread_warp_size=32", [-1, 16, 64, 49152, 2147483647, 1024, 8, 32], "", 0, []], [[], [["FU", 1, [0, 1]], ["SP", 1, 0, 48, [6], 1], ["AN", 1, 0, 5], ["AN", 1, 1, 6]]]], "r": [[3.5368e-06, 3.26536e-06, 3.15507e-06], 0, 1.43385, 1681270105], "v": "v0.6"}
{"i": [["[\"se_module_sigmoid\", 48, 1]", "cuda -keys=cuda,gpu -max_num_threads=1024 -model=unknown -thread_warp_size=32", [-1, 16, 64, 49152, 2147483647, 1024, 8, 32], "", 0, []], [[], [["FU", 1, [0, 1]], ["SP", 1, 0, 48, [32], 1], ["AN", 1, 0, 5], ["AN", 1, 1, 6]]]], "r": [[3.19275e-06, 3.13511e-06, 3.11793e-06], 0, 4.2769, 1681270108], "v": "v0.6"}
{"i": [["[\"se_module_sigmoid\", 48, 1]", "cuda -keys=cuda,gpu -max_num_threads=1024 -model=unknown -thread_warp_size=32", [-1, 16, 64, 49152, 2147483647, 1024, 8, 32], "", 0, []], [[], [["FU", 1, [0, 1]], ["SP", 1, 0, 48, [1], 1], ["AN", 1, 0, 5], ["AN", 1, 1, 6]]]], "r": [[3.13065e-06, 3.18986e-06, 3.13066e-06], 0, 3.88418, 1681270108], "v": "v0.6"}
{"i": [["[\"se_module_sigmoid\", 48, 1]", "cuda -keys=cuda,gpu -max_num_threads=1024 -model=unknown -thread_warp_size=32", [-1, 16, 64, 49152, 2147483647, 1024, 8, 32], "", 0, []], [[], [["FU", 1, [0, 1]], ["SP", 1, 0, 48, [12], 1], ["AN", 1, 0, 5], ["AN", 1, 1, 6]]]], "r": [[3.16601e-06, 3.11505e-06, 3.10024e-06], 0, 3.50079, 1681270108], "v": "v0.6"}
