python/models/efficientnet/kernel_configs/efficient_swish_shortcut_add_1_112_112_32.log
{"i": [["[\"shortcut_add\", 1, 112, 112, 32]", "cuda -keys=cuda,gpu -max_num_threads=1024 -model=unknown -thread_warp_size=32", [-1, 16, 64, 49152, 2147483647, 1024, 8, 32], "", 0, []], [[], [["FU", 2, [0, 1, 2, 3]], ["SP", 2, 0, 401408, [56], 1], ["AN", 2, 0, 5], ["AN", 2, 1, 6]]]], "r": [[8.03069e-06, 8.02715e-06, 8.03134e-06], 0, 1.5283, 1681132770], "v": "v0.6"}
{"i": [["[\"shortcut_add\", 1, 112, 112, 32]", "cuda -keys=cuda,gpu -max_num_threads=1024 -model=unknown -thread_warp_size=32", [-1, 16, 64, 49152, 2147483647, 1024, 8, 32], "", 0, []], [[], [["FU", 2, [0, 1, 2, 3]], ["SP", 2, 0, 401408, [14], 1], ["AN", 2, 0, 5], ["AN", 2, 1, 6]]]], "r": [[2.40142e-05, 2.40287e-05, 2.40213e-05], 0, 1.9705, 1681132770], "v": "v0.6"}
{"i": [["[\"shortcut_add\", 1, 112, 112, 32]", "cuda -keys=cuda,gpu -max_num_threads=1024 -model=unknown -thread_warp_size=32", [-1, 16, 64, 49152, 2147483647, 1024, 8, 32], "", 0, []], [[], [["FU", 2, [0, 1, 2, 3]], ["SP", 2, 0, 401408, [28], 1], ["AN", 2, 0, 5], ["AN", 2, 1, 6]]]], "r": [[1.33731e-05, 1.33687e-05, 1.33716e-05], 0, 0.678956, 1681132769], "v": "v0.6"}
{"i": [["[\"shortcut_add\", 1, 112, 112, 32]", "cuda -keys=cuda,gpu -max_num_threads=1024 -model=unknown -thread_warp_size=32", [-1, 16, 64, 49152, 2147483647, 1024, 8, 32], "", 0, []], [[], [["FU", 2, [0, 1, 2, 3]], ["SP", 2, 0, 401408, [16], 1], ["AN", 2, 0, 5], ["AN", 2, 1, 6]]]], "r": [[2.14123e-05, 2.14224e-05, 2.14163e-05], 0, 3.29844, 1681132772], "v": "v0.6"}
{"i": [["[\"shortcut_add\", 1, 112, 112, 32]", "cuda -keys=cuda,gpu -max_num_threads=1024 -model=unknown -thread_warp_size=32", [-1, 16, 64, 49152, 2147483647, 1024, 8, 32], "", 0, []], [[], [["FU", 2, [0, 1, 2, 3]], ["SP", 2, 0, 401408, [4], 1], ["AN", 2, 0, 5], ["AN", 2, 1, 6]]]], "r": [[7.70287e-05, 7.70282e-05, 7.70399e-05], 0, 2.37478, 1681132771], "v": "v0.6"}
{"i": [["[\"shortcut_add\", 1, 112, 112, 32]", "cuda -keys=cuda,gpu -max_num_threads=1024 -model=unknown -thread_warp_size=32", [-1, 16, 64, 49152, 2147483647, 1024, 8, 32], "", 0, []], [[], [["FU", 2, [0, 1, 2, 3]], ["SP", 2, 0, 401408, [64], 1], ["AN", 2, 0, 5], ["AN", 2, 1, 6]]]], "r": [[7.22314e-06, 7.22176e-06, 7.22216e-06], 0, 1.07958, 1681132769], "v": "v0.6"}
{"i": [["[\"shortcut_add\", 1, 112, 112, 32]", "cuda -keys=cuda,gpu -max_num_threads=1024 -model=unknown -thread_warp_size=32", [-1, 16, 64, 49152, 2147483647, 1024, 8, 32], "", 0, []], [[], [["FU", 2, [0, 1, 2, 3]], ["SP", 2, 0, 401408, [49], 1], ["AN", 2, 0, 5], ["AN", 2, 1, 6]]]], "r": [[8.61842e-06, 8.61498e-06, 8.61605e-06], 0, 4.59507, 1681132773], "v": "v0.6"}
{"i": [["[\"shortcut_add\", 1, 112, 112, 32]", "cuda -keys=cuda,gpu -max_num_threads=1024 -model=unknown -thread_warp_size=32", [-1, 16, 64, 49152, 2147483647, 1024, 8, 32], "", 0, []], [[], [["FU", 2, [0, 1, 2, 3]], ["SP", 2, 0, 401408, [8], 1], ["AN", 2, 0, 5], ["AN", 2, 1, 6]]]], "r": [[3.99995e-05, 4.00137e-05, 4.00078e-05], 0, 4.14746, 1681132773], "v": "v0.6"}
{"i": [["[\"shortcut_add\", 1, 112, 112, 32]", "cuda -keys=cuda,gpu -max_num_threads=1024 -model=unknown -thread_warp_size=32", [-1, 16, 64, 49152, 2147483647, 1024, 8, 32], "", 0, []], [[], [["FU", 2, [0, 1, 2, 3]], ["SP", 2, 0, 401408, [1], 1], ["AN", 2, 0, 5], ["AN", 2, 1, 6]]]], "r": [[0.000300209, 0.00030023, 0.000300192], 0, 4.95728, 1681132773], "v": "v0.6"}
{"i": [["[\"shortcut_add\", 1, 112, 112, 32]", "cuda -keys=cuda,gpu -max_num_threads=1024 -model=unknown -thread_warp_size=32", [-1, 16, 64, 49152, 2147483647, 1024, 8, 32], "", 0, []], [[], [["FU", 2, [0, 1, 2, 3]], ["SP", 2, 0, 401408, [32], 1], ["AN", 2, 0, 5], ["AN", 2, 1, 6]]]], "r": [[1.20355e-05, 1.2046e-05, 1.20459e-05], 0, 2.83797, 1681132771], "v": "v0.6"}
{"i": [["[\"shortcut_add\", 1, 112, 112, 32]", "cuda -keys=cuda,gpu -max_num_threads=1024 -model=unknown -thread_warp_size=32", [-1, 16, 64, 49152, 2147483647, 1024, 8, 32], "", 0, []], [[], [["FU", 2, [0, 1, 2, 3]], ["SP", 2, 0, 401408, [7], 1], ["AN", 2, 0, 5], ["AN", 2, 1, 6]]]], "r": [[4.51972e-05, 4.52004e-05, 4.51982e-05], 0, 3.70142, 1681132772], "v": "v0.6"}
{"i": [["[\"shortcut_add\", 1, 112, 112, 32]", "cuda -keys=cuda,gpu -max_num_threads=1024 -model=unknown -thread_warp_size=32", [-1, 16, 64, 49152, 2147483647, 1024, 8, 32], "", 0, []], [[], [["FU", 2, [0, 1, 2, 3]], ["SP", 2, 0, 401408, [2], 1], ["AN", 2, 0, 5], ["AN", 2, 1, 6]]]], "r": [[0.0001514, 0.000151398, 0.000151383], 0, 5.42843, 1681132774], "v": "v0.6"}
