python/models/efficientnet/kernel_configs/efficient_se_module_sigmoid_96_1.log
{"i": [["[\"se_module_sigmoid\", 96, 1]", "cuda -keys=cuda,gpu -max_num_threads=1024 -model=unknown -thread_warp_size=32", [-1, 16, 64, 49152, 2147483647, 1024, 8, 32], "", 0, []], [[], [["FU", 1, [0, 1]], ["SP", 1, 0, 96, [24], 1], ["AN", 1, 0, 5], ["AN", 1, 1, 6]]]], "r": [[3.60976e-06, 3.4819e-06, 3.47433e-06], 0, 1.38582, 1681269522], "v": "v0.6"}
{"i": [["[\"se_module_sigmoid\", 96, 1]", "cuda -keys=cuda,gpu -max_num_threads=1024 -model=unknown -thread_warp_size=32", [-1, 16, 64, 49152, 2147483647, 1024, 8, 32], "", 0, []], [[], [["FU", 1, [0, 1]], ["SP", 1, 0, 96, [3], 1], ["AN", 1, 0, 5], ["AN", 1, 1, 6]]]], "r": [[3.52907e-06, 3.50997e-06, 3.57557e-06], 0, 0.596761, 1681269521], "v": "v0.6"}
{"i": [["[\"se_module_sigmoid\", 96, 1]", "cuda -keys=cuda,gpu -max_num_threads=1024 -model=unknown -thread_warp_size=32", [-1, 16, 64, 49152, 2147483647, 1024, 8, 32], "", 0, []], [[], [["FU", 1, [0, 1]], ["SP", 1, 0, 96, [2], 1], ["AN", 1, 0, 5], ["AN", 1, 1, 6]]]], "r": [[3.82824e-06, 3.71116e-06, 3.71153e-06], 0, 0.971585, 1681269521], "v": "v0.6"}
{"i": [["[\"se_module_sigmoid\", 96, 1]", "cuda -keys=cuda,gpu -max_num_threads=1024 -model=unknown -thread_warp_size=32", [-1, 16, 64, 49152, 2147483647, 1024, 8, 32], "", 0, []], [[], [["FU", 1, [0, 1]], ["SP", 1, 0, 96, [4], 1], ["AN", 1, 0, 5], ["AN", 1, 1, 6]]]], "r": [[3.75833e-06, 3.6616e-06, 3.66118e-06], 0, 2.54719, 1681269523], "v": "v0.6"}
{"i": [["[\"se_module_sigmoid\", 96, 1]", "cuda -keys=cuda,gpu -max_num_threads=1024 -model=unknown -thread_warp_size=32", [-1, 16, 64, 49152, 2147483647, 1024, 8, 32], "", 0, []], [[], [["FU", 1, [0, 1]], ["SP", 1, 0, 96, [8], 1], ["AN", 1, 0, 5], ["AN", 1, 1, 6]]]], "r": [[3.6703e-06, 3.58589e-06, 3.56257e-06], 0, 1.74857, 1681269522], "v": "v0.6"}
{"i": [["[\"se_module_sigmoid\", 96, 1]", "cuda -keys=cuda,gpu -max_num_threads=1024 -model=unknown -thread_warp_size=32", [-1, 16, 64, 49152, 2147483647, 1024, 8, 32], "", 0, []], [[], [["FU", 1, [0, 1]], ["SP", 1, 0, 96, [6], 1], ["AN", 1, 0, 5], ["AN", 1, 1, 6]]]], "r": [[3.77269e-06, 3.65011e-06, 3.64311e-06], 0, 2.89431, 1681269523], "v": "v0.6"}
{"i": [["[\"se_module_sigmoid\", 96, 1]", "cuda -keys=cuda,gpu -max_num_threads=1024 -model=unknown -thread_warp_size=32", [-1, 16, 64, 49152, 2147483647, 1024, 8, 32], "", 0, []], [[], [["FU", 1, [0, 1]], ["SP", 1, 0, 96, [32], 1], ["AN", 1, 0, 5], ["AN", 1, 1, 6]]]], "r": [[3.78272e-06, 3.65486e-06, 3.66677e-06], 0, 3.26227, 1681269523], "v": "v0.6"}
{"i": [["[\"se_module_sigmoid\", 96, 1]", "cuda -keys=cuda,gpu -max_num_threads=1024 -model=unknown -thread_warp_size=32", [-1, 16, 64, 49152, 2147483647, 1024, 8, 32], "", 0, []], [[], [["FU", 1, [0, 1]], ["SP", 1, 0, 96, [48], 1], ["AN", 1, 0, 5], ["AN", 1, 1, 6]]]], "r": [[3.63259e-06, 3.60373e-06, 3.49281e-06], 0, 2.1312, 1681269522], "v": "v0.6"}
{"i": [["[\"se_module_sigmoid\", 96, 1]", "cuda -keys=cuda,gpu -max_num_threads=1024 -model=unknown -thread_warp_size=32", [-1, 16, 64, 49152, 2147483647, 1024, 8, 32], "", 0, []], [[], [["FU", 1, [0, 1]], ["SP", 1, 0, 96, [16], 1], ["AN", 1, 0, 5], ["AN", 1, 1, 6]]]], "r": [[3.80436e-06, 3.62333e-06, 3.61853e-06], 0, 3.66129, 1681269524], "v": "v0.6"}
{"i": [["[\"se_module_sigmoid\", 96, 1]", "cuda -keys=cuda,gpu -max_num_threads=1024 -model=unknown -thread_warp_size=32", [-1, 16, 64, 49152, 2147483647, 1024, 8, 32], "", 0, []], [[], [["FU", 1, [0, 1]], ["SP", 1, 0, 96, [12], 1], ["AN", 1, 0, 5], ["AN", 1, 1, 6]]]], "r": [[3.53292e-06, 3.51671e-06, 3.50709e-06], 0, 4.0322, 1681269524], "v": "v0.6"}
{"i": [["[\"se_module_sigmoid\", 96, 1]", "cuda -keys=cuda,gpu -max_num_threads=1024 -model=unknown -thread_warp_size=32", [-1, 16, 64, 49152, 2147483647, 1024, 8, 32], "", 0, []], [[], [["FU", 1, [0, 1]], ["SP", 1, 0, 96, [24], 1], ["AN", 1, 0, 5], ["AN", 1, 1, 6]]]], "r": [[3.14206e-06, 3.07329e-06, 3.15081e-06], 0, 0.658983, 1681269869], "v": "v0.6"}
{"i": [["[\"se_module_sigmoid\", 96, 1]", "cuda -keys=cuda,gpu -max_num_threads=1024 -model=unknown -thread_warp_size=32", [-1, 16, 64, 49152, 2147483647, 1024, 8, 32], "", 0, []], [[], [["FU", 1, [0, 1]], ["SP", 1, 0, 96, [1], 1], ["AN", 1, 0, 5], ["AN", 1, 1, 6]]]], "r": [[3.09271e-06, 3.09488e-06, 3.08593e-06], 0, 3.12714, 1681269872], "v": "v0.6"}
{"i": [["[\"se_module_sigmoid\", 96, 1]", "cuda -keys=cuda,gpu -max_num_threads=1024 -model=unknown -thread_warp_size=32", [-1, 16, 64, 49152, 2147483647, 1024, 8, 32], "", 0, []], [[], [["FU", 1, [0, 1]], ["SP", 1, 0, 96, [2], 1], ["AN", 1, 0, 5], ["AN", 1, 1, 6]]]], "r": [[3.13989e-06, 3.19096e-06, 3.15196e-06], 0, 1.89896, 1681269871], "v": "v0.6"}
{"i": [["[\"se_module_sigmoid\", 96, 1]", "cuda -keys=cuda,gpu -max_num_threads=1024 -model=unknown -thread_warp_size=32", [-1, 16, 64, 49152, 2147483647, 1024, 8, 32], "", 0, []], [[], [["FU", 1, [0, 1]], ["SP", 1, 0, 96, [3], 1], ["AN", 1, 0, 5], ["AN", 1, 1, 6]]]], "r": [[3.05697e-06, 3.1086e-06, 3.05987e-06], 0, 1.09172, 1681269870], "v": "v0.6"}
{"i": [["[\"se_module_sigmoid\", 96, 1]", "cuda -keys=cuda,gpu -max_num_threads=1024 -model=unknown -thread_warp_size=32", [-1, 16, 64, 49152, 2147483647, 1024, 8, 32], "", 0, []], [[], [["FU", 1, [0, 1]], ["SP", 1, 0, 96, [32], 1], ["AN", 1, 0, 5], ["AN", 1, 1, 6]]]], "r": [[3.09185e-06, 3.08173e-06, 3.11748e-06], 0, 1.49457, 1681269870], "v": "v0.6"}
{"i": [["[\"se_module_sigmoid\", 96, 1]", "cuda -keys=cuda,gpu -max_num_threads=1024 -model=unknown -thread_warp_size=32", [-1, 16, 64, 49152, 2147483647, 1024, 8, 32], "", 0, []], [[], [["FU", 1, [0, 1]], ["SP", 1, 0, 96, [12], 1], ["AN", 1, 0, 5], ["AN", 1, 1, 6]]]], "r": [[3.31679e-06, 3.10514e-06, 3.09858e-06], 0, 2.71447, 1681269871], "v": "v0.6"}
{"i": [["[\"se_module_sigmoid\", 96, 1]", "cuda -keys=cuda,gpu -max_num_threads=1024 -model=unknown -thread_warp_size=32", [-1, 16, 64, 49152, 2147483647, 1024, 8, 32], "", 0, []], [[], [["FU", 1, [0, 1]], ["SP", 1, 0, 96, [6], 1], ["AN", 1, 0, 5], ["AN", 1, 1, 6]]]], "r": [[3.13485e-06, 3.14349e-06, 3.1405e-06], 0, 2.29851, 1681269871], "v": "v0.6"}
{"i": [["[\"se_module_sigmoid\", 96, 1]", "cuda -keys=cuda,gpu -max_num_threads=1024 -model=unknown -thread_warp_size=32", [-1, 16, 64, 49152, 2147483647, 1024, 8, 32], "", 0, []], [[], [["FU", 1, [0, 1]], ["SP", 1, 0, 96, [8], 1], ["AN", 1, 0, 5], ["AN", 1, 1, 6]]]], "r": [[3.10192e-06, 3.12987e-06, 3.14438e-06], 0, 3.51473, 1681269872], "v": "v0.6"}
{"i": [["[\"se_module_sigmoid\", 96, 1]", "cuda -keys=cuda,gpu -max_num_threads=1024 -model=unknown -thread_warp_size=32", [-1, 16, 64, 49152, 2147483647, 1024, 8, 32], "", 0, []], [[], [["FU", 1, [0, 1]], ["SP", 1, 0, 96, [16], 1], ["AN", 1, 0, 5], ["AN", 1, 1, 6]]]], "r": [[3.18262e-06, 3.0923e-06, 3.07709e-06], 0, 3.95197, 1681269873], "v": "v0.6"}
{"i": [["[\"se_module_sigmoid\", 96, 1]", "cuda -keys=cuda,gpu -max_num_threads=1024 -model=unknown -thread_warp_size=32", [-1, 16, 64, 49152, 2147483647, 1024, 8, 32], "", 0, []], [[], [["FU", 1, [0, 1]], ["SP", 1, 0, 96, [48], 1], ["AN", 1, 0, 5], ["AN", 1, 1, 6]]]], "r": [[3.19255e-06, 3.14269e-06, 3.13016e-06], 0, 4.74794, 1681269874], "v": "v0.6"}
{"i": [["[\"se_module_sigmoid\", 96, 1]", "cuda -keys=cuda,gpu -max_num_threads=1024 -model=unknown -thread_warp_size=32", [-1, 16, 64, 49152, 2147483647, 1024, 8, 32], "", 0, []], [[], [["FU", 1, [0, 1]], ["SP", 1, 0, 96, [4], 1], ["AN", 1, 0, 5], ["AN", 1, 1, 6]]]], "r": [[3.10187e-06, 3.09136e-06, 3.13579e-06], 0, 4.37394, 1681269873], "v": "v0.6"}
