python/models/efficientnet/kernel_configs/efficient_fused_pointwise_conv_bias_add_sigmoid_mul_28_28_10_240_1.log
{"i": [["[\"fused_pointwise_conv_bias_add_sigmoid_mul\", 28, 28, 10, 240, 1]", "cuda -keys=cuda,gpu -max_num_threads=1024 -model=unknown -thread_warp_size=32", [-1, 16, 64, 49152, 2147483647, 1024, 8, 32], "", 0, []], [[], [["CI", 5], ["CHW", 3, "local"], ["SP", 3, 0, 1, [1, 1, 1, 1], 1], ["SP", 3, 5, 240, [1, 80, 1, 3], 1], ["SP", 3, 10, 10, [1, 2], 1], ["RE", 3, [0, 5, 1, 6, 2, 7, 10, 11, 3, 8, 12, 4, 9]], ["FSP", 4, 0, 2, 3], ["FSP", 4, 4, 3, 3], ["RE", 4, [0, 4, 1, 5, 2, 6, 3, 7]], ["CA", 3, 4, 5], ["CHR", 2, "shared", [3]], ["CA", 3, 4, 6], ["CHR", 1, "shared", [4]], ["CA", 2, 5, 6], ["FU", 9, [0, 1, 2, 3]], ["SP", 9, 0, 188160, [2], 1], ["AN", 9, 0, 5], ["AN", 9, 1, 6], ["FU", 6, [0, 1]], ["AN", 6, 0, 5], ["FU", 6, [1, 2]], ["AN", 6, 1, 4], ["FU", 6, [2, 3]], ["AN", 6, 2, 6], ["FU", 4, [0, 1]], ["SP", 4, 0, 6, [1], 1], ["AN", 4, 1, 2], ["FFSP", 4, 0, [3, 2], 1, 1], ["AN", 4, 1, 6], ["FU", 2, [0, 1]], ["SP", 2, 0, 2, [1], 1], ["AN", 2, 1, 2], ["FFSP", 2, 0, [3, 2], 1, 1], ["AN", 2, 1, 6], ["PR", 5, 0, "auto_unroll_max_step$1024"]]]], "r": [[0.000141392, 0.000141398, 0.000141366], 0, 0.977849, 1662025916], "v": "v0.6"}
{"i": [["[\"fused_pointwise_conv_bias_add_sigmoid_mul\", 28, 28, 10, 240, 1]", "cuda -keys=cuda,gpu -max_num_threads=1024 -model=unknown -thread_warp_size=32", [-1, 16, 64, 49152, 2147483647, 1024, 8, 32], "", 0, []], [[], [["CI", 5], ["CHW", 3, "local"], ["SP", 3, 0, 1, [1, 1, 1, 1], 1], ["SP", 3, 5, 240, [1, 40, 2, 1], 1], ["SP", 3, 10, 10, [1, 5], 1], ["RE", 3, [0, 5, 1, 6, 2, 7, 10, 11, 3, 8, 12, 4, 9]], ["FSP", 4, 0, 2, 3], ["FSP", 4, 4, 3, 3], ["RE", 4, [0, 4, 1, 5, 2, 6, 3, 7]], ["CA", 3, 4, 5], ["CHR", 2, "shared", [3]], ["CA", 3, 4, 6], ["CHR", 1, "shared", [4]], ["CA", 2, 5, 6], ["FU", 9, [0, 1, 2, 3]], ["SP", 9, 0, 188160, [4], 1], ["AN", 9, 0, 5], ["AN", 9, 1, 6], ["FU", 6, [0, 1]], ["AN", 6, 0, 5], ["FU", 6, [1, 2]], ["AN", 6, 1, 4], ["FU", 6, [2, 3]], ["AN", 6, 2, 6], ["FU", 4, [0, 1]], ["SP", 4, 0, 10, [1], 1], ["AN", 4, 1, 2], ["FFSP", 4, 0, [3, 2], 1, 1], ["AN", 4, 1, 6], ["FU", 2, [0, 1]], ["SP", 2, 0, 5, [1], 1], ["AN", 2, 1, 2], ["FFSP", 2, 0, [3, 2], 1, 1], ["AN", 2, 1, 6], ["PR", 5, 0, "auto_unroll_max_step$1024"]]]], "r": [[7.636e-05, 7.63523e-05, 7.63355e-05], 0, 2.49441, 1662025918], "v": "v0.6"}
{"i": [["[\"fused_pointwise_conv_bias_add_sigmoid_mul\", 28, 28, 10, 240, 1]", "cuda -keys=cuda,gpu -max_num_threads=1024 -model=unknown -thread_warp_size=32", [-1, 16, 64, 49152, 2147483647, 1024, 8, 32], "", 0, []], [[], [["CI", 5], ["CHW", 3, "local"], ["SP", 3, 0, 1, [1, 1, 1, 1], 1], ["SP", 3, 5, 240, [1, 4, 1, 60], 1], ["SP", 3, 10, 10, [10, 1], 1], ["RE", 3, [0, 5, 1, 6, 2, 7, 10, 11, 3, 8, 12, 4, 9]], ["FSP", 4, 0, 2, 3], ["FSP", 4, 4, 3, 3], ["RE", 4, [0, 4, 1, 5, 2, 6, 3, 7]], ["CA", 3, 4, 5], ["CHR", 2, "shared", [3]], ["CA", 3, 4, 6], ["CHR", 1, "shared", [4]], ["CA", 2, 5, 6], ["FU", 9, [0, 1, 2, 3]], ["SP", 9, 0, 188160, [32], 1], ["AN", 9, 0, 5], ["AN", 9, 1, 6], ["FU", 6, [0, 1]], ["AN", 6, 0, 5], ["FU", 6, [1, 2]], ["AN", 6, 1, 4], ["FU", 6, [2, 3]], ["AN", 6, 2, 6], ["FU", 4, [0, 1]], ["SP", 4, 0, 4, [1], 1], ["AN", 4, 1, 2], ["FFSP", 4, 0, [3, 2], 1, 1], ["AN", 4, 1, 6], ["FU", 2, [0, 1]], ["SP", 2, 0, 2, [1], 1], ["AN", 2, 1, 2], ["FFSP", 2, 0, [3, 2], 1, 1], ["AN", 2, 1, 6], ["PR", 5, 0, "auto_unroll_max_step$0"]]]], "r": [[2.95793e-05, 2.95809e-05, 2.95869e-05], 0, 1.38276, 1662025917], "v": "v0.6"}
{"i": [["[\"fused_pointwise_conv_bias_add_sigmoid_mul\", 28, 28, 10, 240, 1]", "cuda -keys=cuda,gpu -max_num_threads=1024 -model=unknown -thread_warp_size=32", [-1, 16, 64, 49152, 2147483647, 1024, 8, 32], "", 0, []], [[], [["CI", 5], ["CHW", 3, "local"], ["SP", 3, 0, 1, [1, 1, 1, 1], 1], ["SP", 3, 5, 240, [2, 2, 1, 60], 1], ["SP", 3, 10, 10, [1, 1], 1], ["RE", 3, [0, 5, 1, 6, 2, 7, 10, 11, 3, 8, 12, 4, 9]], ["FSP", 4, 0, 2, 3], ["FSP", 4, 4, 3, 3], ["RE", 4, [0, 4, 1, 5, 2, 6, 3, 7]], ["CA", 3, 4, 5], ["CHR", 2, "shared", [3]], ["CA", 3, 4, 6], ["CHR", 1, "shared", [4]], ["CA", 2, 5, 6], ["FU", 9, [0, 1, 2, 3]], ["SP", 9, 0, 188160, [32], 1], ["AN", 9, 0, 5], ["AN", 9, 1, 6], ["FU", 6, [0, 1]], ["AN", 6, 0, 5], ["FU", 6, [1, 2]], ["AN", 6, 1, 4], ["FU", 6, [2, 3]], ["AN", 6, 2, 6], ["FU", 4, [0, 1]], ["SP", 4, 0, 4, [1], 1], ["AN", 4, 1, 2], ["FFSP", 4, 0, [3, 2], 1, 1], ["AN", 4, 1, 6], ["FU", 2, [0, 1]], ["SP", 2, 0, 2, [2], 1], ["AN", 2, 1, 2], ["FFSP", 2, 0, [3, 2], 1, 1], ["AN", 2, 1, 6], ["PR", 5, 0, "auto_unroll_max_step$1024"]]]], "r": [[4.87135e-05, 4.87399e-05, 4.87188e-05], 0, 4.46395, 1662025920], "v": "v0.6"}
{"i": [["[\"fused_pointwise_conv_bias_add_sigmoid_mul\", 28, 28, 10, 240, 1]", "cuda -keys=cuda,gpu -max_num_threads=1024 -model=unknown -thread_warp_size=32", [-1, 16, 64, 49152, 2147483647, 1024, 8, 32], "", 0, []], [[], [["CI", 5], ["CHW", 3, "local"], ["SP", 3, 0, 1, [1, 1, 1, 1], 1], ["SP", 3, 5, 240, [1, 24, 1, 1], 1], ["SP", 3, 10, 10, [1, 5], 1], ["RE", 3, [0, 5, 1, 6, 2, 7, 10, 11, 3, 8, 12, 4, 9]], ["FSP", 4, 0, 2, 3], ["FSP", 4, 4, 3, 3], ["RE", 4, [0, 4, 1, 5, 2, 6, 3, 7]], ["CA", 3, 4, 5], ["CHR", 2, "shared", [3]], ["CA", 3, 4, 6], ["CHR", 1, "shared", [4]], ["CA", 2, 5, 6], ["FU", 9, [0, 1, 2, 3]], ["SP", 9, 0, 188160, [2], 1], ["AN", 9, 0, 5], ["AN", 9, 1, 6], ["FU", 6, [0, 1]], ["AN", 6, 0, 5], ["FU", 6, [1, 2]], ["AN", 6, 1, 4], ["FU", 6, [2, 3]], ["AN", 6, 2, 6], ["FU", 4, [0, 1]], ["SP", 4, 0, 1, [1], 1], ["AN", 4, 1, 2], ["FFSP", 4, 0, [3, 2], 1, 1], ["AN", 4, 1, 6], ["FU", 2, [0, 1]], ["SP", 2, 0, 1, [1], 1], ["AN", 2, 1, 2], ["FFSP", 2, 0, [3, 2], 1, 1], ["AN", 2, 1, 6], ["PR", 5, 0, "auto_unroll_max_step$16"]]]], "r": [[0.000141102, 0.000141097, 0.000141113], 0, 3.56046, 1662025919], "v": "v0.6"}
{"i": [["[\"fused_pointwise_conv_bias_add_sigmoid_mul\", 28, 28, 10, 240, 1]", "cuda -keys=cuda,gpu -max_num_threads=1024 -model=unknown -thread_warp_size=32", [-1, 16, 64, 49152, 2147483647, 1024, 8, 32], "", 0, []], [[], [["CI", 5], ["CHW", 3, "local"], ["SP", 3, 0, 1, [1, 1, 1, 1], 1], ["SP", 3, 5, 240, [1, 6, 1, 1], 1], ["SP", 3, 10, 10, [2, 5], 1], ["RE", 3, [0, 5, 1, 6, 2, 7, 10, 11, 3, 8, 12, 4, 9]], ["FSP", 4, 0, 2, 3], ["FSP", 4, 4, 3, 3], ["RE", 4, [0, 4, 1, 5, 2, 6, 3, 7]], ["CA", 3, 4, 5], ["CHR", 2, "shared", [3]], ["CA", 3, 4, 6], ["CHR", 1, "shared", [4]], ["CA", 2, 5, 6], ["FU", 9, [0, 1, 2, 3]], ["SP", 9, 0, 188160, [32], 1], ["AN", 9, 0, 5], ["AN", 9, 1, 6], ["FU", 6, [0, 1]], ["AN", 6, 0, 5], ["FU", 6, [1, 2]], ["AN", 6, 1, 4], ["FU", 6, [2, 3]], ["AN", 6, 2, 6], ["FU", 4, [0, 1]], ["SP", 4, 0, 5, [1], 1], ["AN", 4, 1, 2], ["FFSP", 4, 0, [3, 2], 1, 1], ["AN", 4, 1, 6], ["FU", 2, [0, 1]], ["SP", 2, 0, 5, [5], 1], ["AN", 2, 1, 2], ["FFSP", 2, 0, [3, 2], 1, 1], ["AN", 2, 1, 6], ["PR", 5, 0, "auto_unroll_max_step$0"]]]], "r": [[1.83134e-05, 1.83128e-05, 1.83155e-05], 0, 5.30054, 1662025921], "v": "v0.6"}
{"i": [["[\"fused_pointwise_conv_bias_add_sigmoid_mul\", 28, 28, 10, 240, 1]", "cuda -keys=cuda,gpu -max_num_threads=1024 -model=unknown -thread_warp_size=32", [-1, 16, 64, 49152, 2147483647, 1024, 8, 32], "", 0, []], [[], [["CI", 5], ["CHW", 3, "local"], ["SP", 3, 0, 1, [1, 1, 1, 1], 1], ["SP", 3, 5, 240, [1, 48, 1, 5], 1], ["SP", 3, 10, 10, [10, 1], 1], ["RE", 3, [0, 5, 1, 6, 2, 7, 10, 11, 3, 8, 12, 4, 9]], ["FSP", 4, 0, 2, 3], ["FSP", 4, 4, 3, 3], ["RE", 4, [0, 4, 1, 5, 2, 6, 3, 7]], ["CA", 3, 4, 5], ["CHR", 2, "shared", [3]], ["CA", 3, 4, 6], ["CHR", 1, "shared", [4]], ["CA", 2, 5, 6], ["FU", 9, [0, 1, 2, 3]], ["SP", 9, 0, 188160, [64], 1], ["AN", 9, 0, 5], ["AN", 9, 1, 6], ["FU", 6, [0, 1]], ["AN", 6, 0, 5], ["FU", 6, [1, 2]], ["AN", 6, 1, 4], ["FU", 6, [2, 3]], ["AN", 6, 2, 6], ["FU", 4, [0, 1]], ["SP", 4, 0, 50, [1], 1], ["AN", 4, 1, 2], ["FFSP", 4, 0, [3, 2], 1, 1], ["AN", 4, 1, 6], ["FU", 2, [0, 1]], ["SP", 2, 0, 10, [1], 1], ["AN", 2, 1, 2], ["FFSP", 2, 0, [3, 2], 1, 1], ["AN", 2, 1, 6], ["PR", 5, 0, "auto_unroll_max_step$512"]]]], "r": [[1.47573e-05, 1.47736e-05, 1.47767e-05], 0, 3.01257, 1662025919], "v": "v0.6"}
{"i": [["[\"fused_pointwise_conv_bias_add_sigmoid_mul\", 28, 28, 10, 240, 1]", "cuda -keys=cuda,gpu -max_num_threads=1024 -model=unknown -thread_warp_size=32", [-1, 16, 64, 49152, 2147483647, 1024, 8, 32], "", 0, []], [[], [["CI", 5], ["CHW", 3, "local"], ["SP", 3, 0, 1, [1, 1, 1, 1], 1], ["SP", 3, 5, 240, [1, 240, 1, 1], 1], ["SP", 3, 10, 10, [10, 1], 1], ["RE", 3, [0, 5, 1, 6, 2, 7, 10, 11, 3, 8, 12, 4, 9]], ["FSP", 4, 0, 2, 3], ["FSP", 4, 4, 3, 3], ["RE", 4, [0, 4, 1, 5, 2, 6, 3, 7]], ["CA", 3, 4, 5], ["CHR", 2, "shared", [3]], ["CA", 3, 4, 6], ["CHR", 1, "shared", [4]], ["CA", 2, 5, 6], ["FU", 9, [0, 1, 2, 3]], ["SP", 9, 0, 188160, [32], 1], ["AN", 9, 0, 5], ["AN", 9, 1, 6], ["FU", 6, [0, 1]], ["AN", 6, 0, 5], ["FU", 6, [1, 2]], ["AN", 6, 1, 4], ["FU", 6, [2, 3]], ["AN", 6, 2, 6], ["FU", 4, [0, 1]], ["SP", 4, 0, 50, [1], 1], ["AN", 4, 1, 2], ["FFSP", 4, 0, [3, 2], 1, 1], ["AN", 4, 1, 6], ["FU", 2, [0, 1]], ["SP", 2, 0, 10, [5], 1], ["AN", 2, 1, 2], ["FFSP", 2, 0, [3, 2], 1, 1], ["AN", 2, 1, 6], ["PR", 5, 0, "auto_unroll_max_step$512"]]]], "r": [[1.85928e-05, 1.85965e-05, 1.86113e-05], 0, 4.74054, 1662025921], "v": "v0.6"}
{"i": [["[\"fused_pointwise_conv_bias_add_sigmoid_mul\", 28, 28, 10, 240, 1]", "cuda -keys=cuda,gpu -max_num_threads=1024 -model=unknown -thread_warp_size=32", [-1, 16, 64, 49152, 2147483647, 1024, 8, 32], "", 0, []], [[], [["CI", 5], ["CHW", 3, "local"], ["SP", 3, 0, 1, [1, 1, 1, 1], 1], ["SP", 3, 5, 240, [1, 40, 1, 1], 1], ["SP", 3, 10, 10, [1, 10], 1], ["RE", 3, [0, 5, 1, 6, 2, 7, 10, 11, 3, 8, 12, 4, 9]], ["FSP", 4, 0, 2, 3], ["FSP", 4, 4, 3, 3], ["RE", 4, [0, 4, 1, 5, 2, 6, 3, 7]], ["CA", 3, 4, 5], ["CHR", 2, "shared", [3]], ["CA", 3, 4, 6], ["CHR", 1, "shared", [4]], ["CA", 2, 5, 6], ["FU", 9, [0, 1, 2, 3]], ["SP", 9, 0, 188160, [64], 1], ["AN", 9, 0, 5], ["AN", 9, 1, 6], ["FU", 6, [0, 1]], ["AN", 6, 0, 5], ["FU", 6, [1, 2]], ["AN", 6, 1, 4], ["FU", 6, [2, 3]], ["AN", 6, 2, 6], ["FU", 4, [0, 1]], ["SP", 4, 0, 2, [2], 1], ["AN", 4, 1, 2], ["FFSP", 4, 0, [3, 2], 1, 1], ["AN", 4, 1, 6], ["FU", 2, [0, 1]], ["SP", 2, 0, 2, [1], 1], ["AN", 2, 1, 2], ["FFSP", 2, 0, [3, 2], 1, 1], ["AN", 2, 1, 6], ["PR", 5, 0, "auto_unroll_max_step$512"]]]], "r": [[1.45342e-05, 1.45374e-05, 1.45374e-05], 0, 1.86194, 1662025918], "v": "v0.6"}
{"i": [["[\"fused_pointwise_conv_bias_add_sigmoid_mul\", 28, 28, 10, 240, 1]", "cuda -keys=cuda,gpu -max_num_threads=1024 -model=unknown -thread_warp_size=32", [-1, 16, 64, 49152, 2147483647, 1024, 8, 32], "", 0, []], [[], [["CI", 5], ["CHW", 3, "local"], ["SP", 3, 0, 1, [1, 1, 1, 1], 1], ["SP", 3, 5, 240, [10, 8, 3, 1], 1], ["SP", 3, 10, 10, [5, 2], 1], ["RE", 3, [0, 5, 1, 6, 2, 7, 10, 11, 3, 8, 12, 4, 9]], ["FSP", 4, 0, 2, 3], ["FSP", 4, 4, 3, 3], ["RE", 4, [0, 4, 1, 5, 2, 6, 3, 7]], ["CA", 3, 4, 5], ["CHR", 2, "shared", [3]], ["CA", 3, 4, 6], ["CHR", 1, "shared", [4]], ["CA", 2, 5, 6], ["FU", 9, [0, 1, 2, 3]], ["SP", 9, 0, 188160, [8], 1], ["AN", 9, 0, 5], ["AN", 9, 1, 6], ["FU", 6, [0, 1]], ["AN", 6, 0, 5], ["FU", 6, [1, 2]], ["AN", 6, 1, 4], ["FU", 6, [2, 3]], ["AN", 6, 2, 6], ["FU", 4, [0, 1]], ["SP", 4, 0, 30, [1], 1], ["AN", 4, 1, 2], ["FFSP", 4, 0, [3, 2], 1, 1], ["AN", 4, 1, 6], ["FU", 2, [0, 1]], ["SP", 2, 0, 10, [1], 1], ["AN", 2, 1, 2], ["FFSP", 2, 0, [3, 2], 1, 1], ["AN", 2, 1, 6], ["PR", 5, 0, "auto_unroll_max_step$1024"]]]], "r": [[4.74959e-05, 4.75698e-05, 4.75767e-05], 0, 7.77533, 1662025923], "v": "v0.6"}
{"i": [["[\"fused_pointwise_conv_bias_add_sigmoid_mul\", 28, 28, 10, 240, 1]", "cuda -keys=cuda,gpu -max_num_threads=1024 -model=unknown -thread_warp_size=32", [-1, 16, 64, 49152, 2147483647, 1024, 8, 32], "", 0, []], [[], [["CI", 5], ["CHW", 3, "local"], ["SP", 3, 0, 1, [1, 1, 1, 1], 1], ["SP", 3, 5, 240, [1, 8, 1, 30], 1], ["SP", 3, 10, 10, [2, 1], 1], ["RE", 3, [0, 5, 1, 6, 2, 7, 10, 11, 3, 8, 12, 4, 9]], ["FSP", 4, 0, 2, 3], ["FSP", 4, 4, 3, 3], ["RE", 4, [0, 4, 1, 5, 2, 6, 3, 7]], ["CA", 3, 4, 5], ["CHR", 2, "shared", [3]], ["CA", 3, 4, 6], ["CHR", 1, "shared", [4]], ["CA", 2, 5, 6], ["FU", 9, [0, 1, 2, 3]], ["SP", 9, 0, 188160, [32], 1], ["AN", 9, 0, 5], ["AN", 9, 1, 6], ["FU", 6, [0, 1]], ["AN", 6, 0, 5], ["FU", 6, [1, 2]], ["AN", 6, 1, 4], ["FU", 6, [2, 3]], ["AN", 6, 2, 6], ["FU", 4, [0, 1]], ["SP", 4, 0, 2, [2], 1], ["AN", 4, 1, 2], ["FFSP", 4, 0, [3, 2], 1, 1], ["AN", 4, 1, 6], ["FU", 2, [0, 1]], ["SP", 2, 0, 2, [1], 1], ["AN", 2, 1, 2], ["FFSP", 2, 0, [3, 2], 1, 1], ["AN", 2, 1, 6], ["PR", 5, 0, "auto_unroll_max_step$512"]]]], "r": [[3.59458e-05, 3.59676e-05, 3.59666e-05], 0, 6.25369, 1662025922], "v": "v0.6"}
{"i": [["[\"fused_pointwise_conv_bias_add_sigmoid_mul\", 28, 28, 10, 240, 1]", "cuda -keys=cuda,gpu -max_num_threads=1024 -model=unknown -thread_warp_size=32", [-1, 16, 64, 49152, 2147483647, 1024, 8, 32], "", 0, []], [[], [["CI", 5], ["CHW", 3, "local"], ["SP", 3, 0, 1, [1, 1, 1, 1], 1], ["SP", 3, 5, 240, [1, 60, 2, 1], 1], ["SP", 3, 10, 10, [1, 10], 1], ["RE", 3, [0, 5, 1, 6, 2, 7, 10, 11, 3, 8, 12, 4, 9]], ["FSP", 4, 0, 2, 3], ["FSP", 4, 4, 3, 3], ["RE", 4, [0, 4, 1, 5, 2, 6, 3, 7]], ["CA", 3, 4, 5], ["CHR", 2, "shared", [3]], ["CA", 3, 4, 6], ["CHR", 1, "shared", [4]], ["CA", 2, 5, 6], ["FU", 9, [0, 1, 2, 3]], ["SP", 9, 0, 188160, [32], 1], ["AN", 9, 0, 5], ["AN", 9, 1, 6], ["FU", 6, [0, 1]], ["AN", 6, 0, 5], ["FU", 6, [1, 2]], ["AN", 6, 1, 4], ["FU", 6, [2, 3]], ["AN", 6, 2, 6], ["FU", 4, [0, 1]], ["SP", 4, 0, 4, [2], 1], ["AN", 4, 1, 2], ["FFSP", 4, 0, [3, 2], 1, 1], ["AN", 4, 1, 6], ["FU", 2, [0, 1]], ["SP", 2, 0, 2, [1], 1], ["AN", 2, 1, 2], ["FFSP", 2, 0, [3, 2], 1, 1], ["AN", 2, 1, 6], ["PR", 5, 0, "auto_unroll_max_step$1024"]]]], "r": [[1.9057e-05, 1.9071e-05, 1.90688e-05], 0, 8.90935, 1662025925], "v": "v0.6"}
{"i": [["[\"fused_pointwise_conv_bias_add_sigmoid_mul\", 28, 28, 10, 240, 1]", "cuda -keys=cuda,gpu -max_num_threads=1024 -model=unknown -thread_warp_size=32", [-1, 16, 64, 49152, 2147483647, 1024, 8, 32], "", 0, []], [[], [["CI", 5], ["CHW", 3, "local"], ["SP", 3, 0, 1, [1, 1, 1, 1], 1], ["SP", 3, 5, 240, [2, 60, 2, 1], 1], ["SP", 3, 10, 10, [2, 5], 1], ["RE", 3, [0, 5, 1, 6, 2, 7, 10, 11, 3, 8, 12, 4, 9]], ["FSP", 4, 0, 2, 3], ["FSP", 4, 4, 3, 3], ["RE", 4, [0, 4, 1, 5, 2, 6, 3, 7]], ["CA", 3, 4, 5], ["CHR", 2, "shared", [3]], ["CA", 3, 4, 6], ["CHR", 1, "shared", [4]], ["CA", 2, 5, 6], ["FU", 9, [0, 1, 2, 3]], ["SP", 9, 0, 188160, [32], 1], ["AN", 9, 0, 5], ["AN", 9, 1, 6], ["FU", 6, [0, 1]], ["AN", 6, 0, 5], ["FU", 6, [1, 2]], ["AN", 6, 1, 4], ["FU", 6, [2, 3]], ["AN", 6, 2, 6], ["FU", 4, [0, 1]], ["SP", 4, 0, 20, [1], 1], ["AN", 4, 1, 2], ["FFSP", 4, 0, [3, 2], 1, 1], ["AN", 4, 1, 6], ["FU", 2, [0, 1]], ["SP", 2, 0, 10, [1], 1], ["AN", 2, 1, 2], ["FFSP", 2, 0, [3, 2], 1, 1], ["AN", 2, 1, 6], ["PR", 5, 0, "auto_unroll_max_step$16"]]]], "r": [[1.80454e-05, 1.80468e-05, 1.80449e-05], 0, 7.77604, 1662025924], "v": "v0.6"}
{"i": [["[\"fused_pointwise_conv_bias_add_sigmoid_mul\", 28, 28, 10, 240, 1]", "cuda -keys=cuda,gpu -max_num_threads=1024 -model=unknown -thread_warp_size=32", [-1, 16, 64, 49152, 2147483647, 1024, 8, 32], "", 0, []], [[], [["CI", 5], ["CHW", 3, "local"], ["SP", 3, 0, 1, [1, 1, 1, 1], 1], ["SP", 3, 5, 240, [3, 80, 1, 1], 1], ["SP", 3, 10, 10, [2, 1], 1], ["RE", 3, [0, 5, 1, 6, 2, 7, 10, 11, 3, 8, 12, 4, 9]], ["FSP", 4, 0, 2, 3], ["FSP", 4, 4, 3, 3], ["RE", 4, [0, 4, 1, 5, 2, 6, 3, 7]], ["CA", 3, 4, 5], ["CHR", 2, "shared", [3]], ["CA", 3, 4, 6], ["CHR", 1, "shared", [4]], ["CA", 2, 5, 6], ["FU", 9, [0, 1, 2, 3]], ["SP", 9, 0, 188160, [32], 1], ["AN", 9, 0, 5], ["AN", 9, 1, 6], ["FU", 6, [0, 1]], ["AN", 6, 0, 5], ["FU", 6, [1, 2]], ["AN", 6, 1, 4], ["FU", 6, [2, 3]], ["AN", 6, 2, 6], ["FU", 4, [0, 1]], ["SP", 4, 0, 2, [1], 1], ["AN", 4, 1, 2], ["FFSP", 4, 0, [3, 2], 1, 1], ["AN", 4, 1, 6], ["FU", 2, [0, 1]], ["SP", 2, 0, 2, [2], 1], ["AN", 2, 1, 2], ["FFSP", 2, 0, [3, 2], 1, 1], ["AN", 2, 1, 6], ["PR", 5, 0, "auto_unroll_max_step$512"]]]], "r": [[1.9496e-05, 1.9494e-05, 1.94901e-05], 0, 6.55954, 1662025922], "v": "v0.6"}
{"i": [["[\"fused_pointwise_conv_bias_add_sigmoid_mul\", 28, 28, 10, 240, 1]", "cuda -keys=cuda,gpu -max_num_threads=1024 -model=unknown -thread_warp_size=32", [-1, 16, 64, 49152, 2147483647, 1024, 8, 32], "", 0, []], [[], [["CI", 5], ["CHW", 3, "local"], ["SP", 3, 0, 1, [1, 1, 1, 1], 1], ["SP", 3, 5, 240, [1, 80, 3, 1], 1], ["SP", 3, 10, 10, [1, 1], 1], ["RE", 3, [0, 5, 1, 6, 2, 7, 10, 11, 3, 8, 12, 4, 9]], ["FSP", 4, 0, 2, 3], ["FSP", 4, 4, 3, 3], ["RE", 4, [0, 4, 1, 5, 2, 6, 3, 7]], ["CA", 3, 4, 5], ["CHR", 2, "shared", [3]], ["CA", 3, 4, 6], ["CHR", 1, "shared", [4]], ["CA", 2, 5, 6], ["FU", 9, [0, 1, 2, 3]], ["SP", 9, 0, 188160, [32], 1], ["AN", 9, 0, 5], ["AN", 9, 1, 6], ["FU", 6, [0, 1]], ["AN", 6, 0, 5], ["FU", 6, [1, 2]], ["AN", 6, 1, 4], ["FU", 6, [2, 3]], ["AN", 6, 2, 6], ["FU", 4, [0, 1]], ["SP", 4, 0, 1, [1], 1], ["AN", 4, 1, 2], ["FFSP", 4, 0, [3, 2], 1, 1], ["AN", 4, 1, 6], ["FU", 2, [0, 1]], ["SP", 2, 0, 1, [1], 1], ["AN", 2, 1, 2], ["FFSP", 2, 0, [3, 2], 1, 1], ["AN", 2, 1, 6], ["PR", 5, 0, "auto_unroll_max_step$64"]]]], "r": [[1.97266e-05, 1.97268e-05, 1.97276e-05], 0, 9.50025, 1662025925], "v": "v0.6"}
{"i": [["[\"fused_pointwise_conv_bias_add_sigmoid_mul\", 28, 28, 10, 240, 1]", "cuda -keys=cuda,gpu -max_num_threads=1024 -model=unknown -thread_warp_size=32", [-1, 16, 64, 49152, 2147483647, 1024, 8, 32], "", 0, []], [[], [["CI", 5], ["CHW", 3, "local"], ["SP", 3, 0, 1, [1, 1, 1, 1], 1], ["SP", 3, 5, 240, [1, 40, 3, 2], 1], ["SP", 3, 10, 10, [5, 2], 1], ["RE", 3, [0, 5, 1, 6, 2, 7, 10, 11, 3, 8, 12, 4, 9]], ["FSP", 4, 0, 2, 3], ["FSP", 4, 4, 3, 3], ["RE", 4, [0, 4, 1, 5, 2, 6, 3, 7]], ["CA", 3, 4, 5], ["CHR", 2, "shared", [3]], ["CA", 3, 4, 6], ["CHR", 1, "shared", [4]], ["CA", 2, 5, 6], ["FU", 9, [0, 1, 2, 3]], ["SP", 9, 0, 188160, [32], 1], ["AN", 9, 0, 5], ["AN", 9, 1, 6], ["FU", 6, [0, 1]], ["AN", 6, 0, 5], ["FU", 6, [1, 2]], ["AN", 6, 1, 4], ["FU", 6, [2, 3]], ["AN", 6, 2, 6], ["FU", 4, [0, 1]], ["SP", 4, 0, 30, [1], 1], ["AN", 4, 1, 2], ["FFSP", 4, 0, [3, 2], 1, 1], ["AN", 4, 1, 6], ["FU", 2, [0, 1]], ["SP", 2, 0, 10, [1], 1], ["AN", 2, 1, 2], ["FFSP", 2, 0, [3, 2], 1, 1], ["AN", 2, 1, 6], ["PR", 5, 0, "auto_unroll_max_step$1024"]]]], "r": [[1.89118e-05, 1.89122e-05, 1.89115e-05], 0, 8.39955, 1662025924], "v": "v0.6"}
{"i": [["[\"fused_pointwise_conv_bias_add_sigmoid_mul\", 28, 28, 10, 240, 1]", "cuda -keys=cuda,gpu -max_num_threads=1024 -model=unknown -thread_warp_size=32", [-1, 16, 64, 49152, 2147483647, 1024, 8, 32], "", 0, []], [[], [["CI", 5], ["CHW", 3, "local"], ["SP", 3, 0, 1, [1, 1, 1, 1], 1], ["SP", 3, 5, 240, [1, 80, 1, 1], 1], ["SP", 3, 10, 10, [2, 1], 1], ["RE", 3, [0, 5, 1, 6, 2, 7, 10, 11, 3, 8, 12, 4, 9]], ["FSP", 4, 0, 2, 3], ["FSP", 4, 4, 3, 3], ["RE", 4, [0, 4, 1, 5, 2, 6, 3, 7]], ["CA", 3, 4, 5], ["CHR", 2, "shared", [3]], ["CA", 3, 4, 6], ["CHR", 1, "shared", [4]], ["CA", 2, 5, 6], ["FU", 9, [0, 1, 2, 3]], ["SP", 9, 0, 188160, [32], 1], ["AN", 9, 0, 5], ["AN", 9, 1, 6], ["FU", 6, [0, 1]], ["AN", 6, 0, 5], ["FU", 6, [1, 2]], ["AN", 6, 1, 4], ["FU", 6, [2, 3]], ["AN", 6, 2, 6], ["FU", 4, [0, 1]], ["SP", 4, 0, 1, [1], 1], ["AN", 4, 1, 2], ["FFSP", 4, 0, [3, 2], 1, 1], ["AN", 4, 1, 6], ["FU", 2, [0, 1]], ["SP", 2, 0, 1, [1], 1], ["AN", 2, 1, 2], ["FFSP", 2, 0, [3, 2], 1, 1], ["AN", 2, 1, 6], ["PR", 5, 0, "auto_unroll_max_step$64"]]]], "r": [[1.91288e-05, 1.91364e-05, 1.9129e-05], 0, 10.0112, 1662025926], "v": "v0.6"}
{"i": [["[\"fused_pointwise_conv_bias_add_sigmoid_mul\", 28, 28, 10, 240, 1]", "cuda -keys=cuda,gpu -max_num_threads=1024 -model=unknown -thread_warp_size=32", [-1, 16, 64, 49152, 2147483647, 1024, 8, 32], "", 0, []], [[], [["CI", 5], ["CHW", 3, "local"], ["SP", 3, 0, 1, [1, 1, 1, 1], 1], ["SP", 3, 5, 240, [4, 60, 1, 1], 1], ["SP", 3, 10, 10, [5, 2], 1], ["RE", 3, [0, 5, 1, 6, 2, 7, 10, 11, 3, 8, 12, 4, 9]], ["FSP", 4, 0, 2, 3], ["FSP", 4, 4, 3, 3], ["RE", 4, [0, 4, 1, 5, 2, 6, 3, 7]], ["CA", 3, 4, 5], ["CHR", 2, "shared", [3]], ["CA", 3, 4, 6], ["CHR", 1, "shared", [4]], ["CA", 2, 5, 6], ["FU", 9, [0, 1, 2, 3]], ["SP", 9, 0, 188160, [16], 1], ["AN", 9, 0, 5], ["AN", 9, 1, 6], ["FU", 6, [0, 1]], ["AN", 6, 0, 5], ["FU", 6, [1, 2]], ["AN", 6, 1, 4], ["FU", 6, [2, 3]], ["AN", 6, 2, 6], ["FU", 4, [0, 1]], ["SP", 4, 0, 10, [1], 1], ["AN", 4, 1, 2], ["FFSP", 4, 0, [3, 2], 1, 1], ["AN", 4, 1, 6], ["FU", 2, [0, 1]], ["SP", 2, 0, 10, [1], 1], ["AN", 2, 1, 2], ["FFSP", 2, 0, [3, 2], 1, 1], ["AN", 2, 1, 6], ["PR", 5, 0, "auto_unroll_max_step$512"]]]], "r": [[2.61635e-05, 2.61634e-05, 2.6162e-05], 0, 10.6343, 1662025926], "v": "v0.6"}
{"i": [["[\"fused_pointwise_conv_bias_add_sigmoid_mul\", 28, 28, 10, 240, 1]", "cuda -keys=cuda,gpu -max_num_threads=1024 -model=unknown -thread_warp_size=32", [-1, 16, 64, 49152, 2147483647, 1024, 8, 32], "", 0, []], [[], [["CI", 5], ["CHW", 3, "local"], ["SP", 3, 0, 1, [1, 1, 1, 1], 1], ["SP", 3, 5, 240, [1, 80, 1, 1], 1], ["SP", 3, 10, 10, [10, 1], 1], ["RE", 3, [0, 5, 1, 6, 2, 7, 10, 11, 3, 8, 12, 4, 9]], ["FSP", 4, 0, 2, 3], ["FSP", 4, 4, 3, 3], ["RE", 4, [0, 4, 1, 5, 2, 6, 3, 7]], ["CA", 3, 4, 5], ["CHR", 2, "shared", [3]], ["CA", 3, 4, 6], ["CHR", 1, "shared", [4]], ["CA", 2, 5, 6], ["FU", 9, [0, 1, 2, 3]], ["SP", 9, 0, 188160, [64], 1], ["AN", 9, 0, 5], ["AN", 9, 1, 6], ["FU", 6, [0, 1]], ["AN", 6, 0, 5], ["FU", 6, [1, 2]], ["AN", 6, 1, 4], ["FU", 6, [2, 3]], ["AN", 6, 2, 6], ["FU", 4, [0, 1]], ["SP", 4, 0, 10, [1], 1], ["AN", 4, 1, 2], ["FFSP", 4, 0, [3, 2], 1, 1], ["AN", 4, 1, 6], ["FU", 2, [0, 1]], ["SP", 2, 0, 10, [1], 1], ["AN", 2, 1, 2], ["FFSP", 2, 0, [3, 2], 1, 1], ["AN", 2, 1, 6], ["PR", 5, 0, "auto_unroll_max_step$16"]]]], "r": [[1.45323e-05, 1.45328e-05, 1.45345e-05], 0, 11.7201, 1662025928], "v": "v0.6"}
{"i": [["[\"fused_pointwise_conv_bias_add_sigmoid_mul\", 28, 28, 10, 240, 1]", "cuda -keys=cuda,gpu -max_num_threads=1024 -model=unknown -thread_warp_size=32", [-1, 16, 64, 49152, 2147483647, 1024, 8, 32], "", 0, []], [[], [["CI", 5], ["CHW", 3, "local"], ["SP", 3, 0, 1, [1, 1, 1, 1], 1], ["SP", 3, 5, 240, [2, 40, 1, 1], 1], ["SP", 3, 10, 10, [5, 1], 1], ["RE", 3, [0, 5, 1, 6, 2, 7, 10, 11, 3, 8, 12, 4, 9]], ["FSP", 4, 0, 2, 3], ["FSP", 4, 4, 3, 3], ["RE", 4, [0, 4, 1, 5, 2, 6, 3, 7]], ["CA", 3, 4, 5], ["CHR", 2, "shared", [3]], ["CA", 3, 4, 6], ["CHR", 1, "shared", [4]], ["CA", 2, 5, 6], ["FU", 9, [0, 1, 2, 3]], ["SP", 9, 0, 188160, [32], 1], ["AN", 9, 0, 5], ["AN", 9, 1, 6], ["FU", 6, [0, 1]], ["AN", 6, 0, 5], ["FU", 6, [1, 2]], ["AN", 6, 1, 4], ["FU", 6, [2, 3]], ["AN", 6, 2, 6], ["FU", 4, [0, 1]], ["SP", 4, 0, 5, [1], 1], ["AN", 4, 1, 2], ["FFSP", 4, 0, [3, 2], 1, 1], ["AN", 4, 1, 6], ["FU", 2, [0, 1]], ["SP", 2, 0, 5, [1], 1], ["AN", 2, 1, 2], ["FFSP", 2, 0, [3, 2], 1, 1], ["AN", 2, 1, 6], ["PR", 5, 0, "auto_unroll_max_step$1024"]]]], "r": [[1.87716e-05, 1.87669e-05, 1.87696e-05], 0, 11.1986, 1662025927], "v": "v0.6"}
{"i": [["[\"fused_pointwise_conv_bias_add_sigmoid_mul\", 28, 28, 10, 240, 1]", "cuda -keys=cuda,gpu -max_num_threads=1024 -model=unknown -thread_warp_size=32", [-1, 16, 64, 49152, 2147483647, 1024, 8, 32], "", 0, []], [[], [["CI", 5], ["CHW", 3, "local"], ["SP", 3, 0, 1, [1, 1, 1, 1], 1], ["SP", 3, 5, 240, [1, 48, 1, 5], 1], ["SP", 3, 10, 10, [2, 5], 1], ["RE", 3, [0, 5, 1, 6, 2, 7, 10, 11, 3, 8, 12, 4, 9]], ["FSP", 4, 0, 2, 3], ["FSP", 4, 4, 3, 3], ["RE", 4, [0, 4, 1, 5, 2, 6, 3, 7]], ["CA", 3, 4, 5], ["CHR", 2, "shared", [3]], ["CA", 3, 4, 6], ["CHR", 1, "shared", [4]], ["CA", 2, 5, 6], ["FU", 9, [0, 1, 2, 3]], ["SP", 9, 0, 188160, [32], 1], ["AN", 9, 0, 5], ["AN", 9, 1, 6], ["FU", 6, [0, 1]], ["AN", 6, 0, 5], ["FU", 6, [1, 2]], ["AN", 6, 1, 4], ["FU", 6, [2, 3]], ["AN", 6, 2, 6], ["FU", 4, [0, 1]], ["SP", 4, 0, 25, [1], 1], ["AN", 4, 1, 2], ["FFSP", 4, 0, [3, 2], 1, 1], ["AN", 4, 1, 6], ["FU", 2, [0, 1]], ["SP", 2, 0, 5, [5], 1], ["AN", 2, 1, 2], ["FFSP", 2, 0, [3, 2], 1, 1], ["AN", 2, 1, 6], ["PR", 5, 0, "auto_unroll_max_step$512"]]]], "r": [[1.86505e-05, 1.86501e-05, 1.8651e-05], 0, 7.28516, 1662029075], "v": "v0.6"}
{"i": [["[\"fused_pointwise_conv_bias_add_sigmoid_mul\", 28, 28, 10, 240, 1]", "cuda -keys=cuda,gpu -max_num_threads=1024 -model=unknown -thread_warp_size=32", [-1, 16, 64, 49152, 2147483647, 1024, 8, 32], "", 0, []], [[], [["CI", 5], ["CHW", 3, "local"], ["SP", 3, 0, 1, [1, 1, 1, 1], 1], ["SP", 3, 5, 240, [1, 40, 1, 6], 1], ["SP", 3, 10, 10, [5, 2], 1], ["RE", 3, [0, 5, 1, 6, 2, 7, 10, 11, 3, 8, 12, 4, 9]], ["FSP", 4, 0, 2, 3], ["FSP", 4, 4, 3, 3], ["RE", 4, [0, 4, 1, 5, 2, 6, 3, 7]], ["CA", 3, 4, 5], ["CHR", 2, "shared", [3]], ["CA", 3, 4, 6], ["CHR", 1, "shared", [4]], ["CA", 2, 5, 6], ["FU", 9, [0, 1, 2, 3]], ["SP", 9, 0, 188160, [32], 1], ["AN", 9, 0, 5], ["AN", 9, 1, 6], ["FU", 6, [0, 1]], ["AN", 6, 0, 5], ["FU", 6, [1, 2]], ["AN", 6, 1, 4], ["FU", 6, [2, 3]], ["AN", 6, 2, 6], ["FU", 4, [0, 1]], ["SP", 4, 0, 60, [1], 1], ["AN", 4, 1, 2], ["FFSP", 4, 0, [3, 2], 1, 1], ["AN", 4, 1, 6], ["FU", 2, [0, 1]], ["SP", 2, 0, 10, [1], 1], ["AN", 2, 1, 2], ["FFSP", 2, 0, [3, 2], 1, 1], ["AN", 2, 1, 6], ["PR", 5, 0, "auto_unroll_max_step$1024"]]]], "r": [[1.82153e-05, 1.82138e-05, 1.82172e-05], 0, 6.81247, 1662029074], "v": "v0.6"}
{"i": [["[\"fused_pointwise_conv_bias_add_sigmoid_mul\", 28, 28, 10, 240, 1]", "cuda -keys=cuda,gpu -max_num_threads=1024 -model=unknown -thread_warp_size=32", [-1, 16, 64, 49152, 2147483647, 1024, 8, 32], "", 0, []], [[], [["CI", 5], ["CHW", 3, "local"], ["SP", 3, 0, 1, [1, 1, 1, 1], 1], ["SP", 3, 5, 240, [1, 40, 3, 1], 1], ["SP", 3, 10, 10, [2, 5], 1], ["RE", 3, [0, 5, 1, 6, 2, 7, 10, 11, 3, 8, 12, 4, 9]], ["FSP", 4, 0, 2, 3], ["FSP", 4, 4, 3, 3], ["RE", 4, [0, 4, 1, 5, 2, 6, 3, 7]], ["CA", 3, 4, 5], ["CHR", 2, "shared", [3]], ["CA", 3, 4, 6], ["CHR", 1, "shared", [4]], ["CA", 2, 5, 6], ["FU", 9, [0, 1, 2, 3]], ["SP", 9, 0, 188160, [2], 1], ["AN", 9, 0, 5], ["AN", 9, 1, 6], ["FU", 6, [0, 1]], ["AN", 6, 0, 5], ["FU", 6, [1, 2]], ["AN", 6, 1, 4], ["FU", 6, [2, 3]], ["AN", 6, 2, 6], ["FU", 4, [0, 1]], ["SP", 4, 0, 30, [1], 1], ["AN", 4, 1, 2], ["FFSP", 4, 0, [3, 2], 1, 1], ["AN", 4, 1, 6], ["FU", 2, [0, 1]], ["SP", 2, 0, 10, [2], 1], ["AN", 2, 1, 2], ["FFSP", 2, 0, [3, 2], 1, 1], ["AN", 2, 1, 6], ["PR", 5, 0, "auto_unroll_max_step$512"]]]], "r": [[0.000136328, 0.000136324, 0.000136299], 0, 10.2336, 1662029078], "v": "v0.6"}
{"i": [["[\"fused_pointwise_conv_bias_add_sigmoid_mul\", 28, 28, 10, 240, 1]", "cuda -keys=cuda,gpu -max_num_threads=1024 -model=unknown -thread_warp_size=32", [-1, 16, 64, 49152, 2147483647, 1024, 8, 32], "", 0, []], [[], [["CI", 5], ["CHW", 3, "local"], ["SP", 3, 0, 1, [1, 1, 1, 1], 1], ["SP", 3, 5, 240, [4, 60, 1, 1], 1], ["SP", 3, 10, 10, [2, 5], 1], ["RE", 3, [0, 5, 1, 6, 2, 7, 10, 11, 3, 8, 12, 4, 9]], ["FSP", 4, 0, 2, 3], ["FSP", 4, 4, 3, 3], ["RE", 4, [0, 4, 1, 5, 2, 6, 3, 7]], ["CA", 3, 4, 5], ["CHR", 2, "shared", [3]], ["CA", 3, 4, 6], ["CHR", 1, "shared", [4]], ["CA", 2, 5, 6], ["FU", 9, [0, 1, 2, 3]], ["SP", 9, 0, 188160, [2], 1], ["AN", 9, 0, 5], ["AN", 9, 1, 6], ["FU", 6, [0, 1]], ["AN", 6, 0, 5], ["FU", 6, [1, 2]], ["AN", 6, 1, 4], ["FU", 6, [2, 3]], ["AN", 6, 2, 6], ["FU", 4, [0, 1]], ["SP", 4, 0, 10, [2], 1], ["AN", 4, 1, 2], ["FFSP", 4, 0, [3, 2], 1, 1], ["AN", 4, 1, 6], ["FU", 2, [0, 1]], ["SP", 2, 0, 10, [5], 1], ["AN", 2, 1, 2], ["FFSP", 2, 0, [3, 2], 1, 1], ["AN", 2, 1, 6], ["PR", 5, 0, "auto_unroll_max_step$0"]]]], "r": [[0.000135386, 0.000135388, 0.000135382], 0, 5.48626, 1662029073], "v": "v0.6"}
{"i": [["[\"fused_pointwise_conv_bias_add_sigmoid_mul\", 28, 28, 10, 240, 1]", "cuda -keys=cuda,gpu -max_num_threads=1024 -model=unknown -thread_warp_size=32", [-1, 16, 64, 49152, 2147483647, 1024, 8, 32], "", 0, []], [[], [["CI", 5], ["CHW", 3, "local"], ["SP", 3, 0, 1, [1, 1, 1, 1], 1], ["SP", 3, 5, 240, [10, 4, 1, 2], 1], ["SP", 3, 10, 10, [1, 2], 1], ["RE", 3, [0, 5, 1, 6, 2, 7, 10, 11, 3, 8, 12, 4, 9]], ["FSP", 4, 0, 2, 3], ["FSP", 4, 4, 3, 3], ["RE", 4, [0, 4, 1, 5, 2, 6, 3, 7]], ["CA", 3, 4, 5], ["CHR", 2, "shared", [3]], ["CA", 3, 4, 6], ["CHR", 1, "shared", [4]], ["CA", 2, 5, 6], ["FU", 9, [0, 1, 2, 3]], ["SP", 9, 0, 188160, [32], 1], ["AN", 9, 0, 5], ["AN", 9, 1, 6], ["FU", 6, [0, 1]], ["AN", 6, 0, 5], ["FU", 6, [1, 2]], ["AN", 6, 1, 4], ["FU", 6, [2, 3]], ["AN", 6, 2, 6], ["FU", 4, [0, 1]], ["SP", 4, 0, 12, [1], 1], ["AN", 4, 1, 2], ["FFSP", 4, 0, [3, 2], 1, 1], ["AN", 4, 1, 6], ["FU", 2, [0, 1]], ["SP", 2, 0, 2, [1], 1], ["AN", 2, 1, 2], ["FFSP", 2, 0, [3, 2], 1, 1], ["AN", 2, 1, 6], ["PR", 5, 0, "auto_unroll_max_step$0"]]]], "r": [[3.20608e-05, 3.20703e-05, 3.20741e-05], 0, 2.3454, 1662029069], "v": "v0.6"}
{"i": [["[\"fused_pointwise_conv_bias_add_sigmoid_mul\", 28, 28, 10, 240, 1]", "cuda -keys=cuda,gpu -max_num_threads=1024 -model=unknown -thread_warp_size=32", [-1, 16, 64, 49152, 2147483647, 1024, 8, 32], "", 0, []], [[], [["CI", 5], ["CHW", 3, "local"], ["SP", 3, 0, 1, [1, 1, 1, 1], 1], ["SP", 3, 5, 240, [1, 120, 1, 2], 1], ["SP", 3, 10, 10, [2, 1], 1], ["RE", 3, [0, 5, 1, 6, 2, 7, 10, 11, 3, 8, 12, 4, 9]], ["FSP", 4, 0, 2, 3], ["FSP", 4, 4, 3, 3], ["RE", 4, [0, 4, 1, 5, 2, 6, 3, 7]], ["CA", 3, 4, 5], ["CHR", 2, "shared", [3]], ["CA", 3, 4, 6], ["CHR", 1, "shared", [4]], ["CA", 2, 5, 6], ["FU", 9, [0, 1, 2, 3]], ["SP", 9, 0, 188160, [1], 1], ["AN", 9, 0, 5], ["AN", 9, 1, 6], ["FU", 6, [0, 1]], ["AN", 6, 0, 5], ["FU", 6, [1, 2]], ["AN", 6, 1, 4], ["FU", 6, [2, 3]], ["AN", 6, 2, 6], ["FU", 4, [0, 1]], ["SP", 4, 0, 4, [1], 1], ["AN", 4, 1, 2], ["FFSP", 4, 0, [3, 2], 1, 1], ["AN", 4, 1, 6], ["FU", 2, [0, 1]], ["SP", 2, 0, 2, [1], 1], ["AN", 2, 1, 2], ["FFSP", 2, 0, [3, 2], 1, 1], ["AN", 2, 1, 6], ["PR", 5, 0, "auto_unroll_max_step$16"]]]], "r": [[0.000261425, 0.000261413, 0.000261404], 0, 1.74431, 1662029069], "v": "v0.6"}
{"i": [["[\"fused_pointwise_conv_bias_add_sigmoid_mul\", 28, 28, 10, 240, 1]", "cuda -keys=cuda,gpu -max_num_threads=1024 -model=unknown -thread_warp_size=32", [-1, 16, 64, 49152, 2147483647, 1024, 8, 32], "", 0, []], [[], [["CI", 5], ["CHW", 3, "local"], ["SP", 3, 0, 1, [1, 1, 1, 1], 1], ["SP", 3, 5, 240, [2, 120, 1, 1], 1], ["SP", 3, 10, 10, [1, 10], 1], ["RE", 3, [0, 5, 1, 6, 2, 7, 10, 11, 3, 8, 12, 4, 9]], ["FSP", 4, 0, 2, 3], ["FSP", 4, 4, 3, 3], ["RE", 4, [0, 4, 1, 5, 2, 6, 3, 7]], ["CA", 3, 4, 5], ["CHR", 2, "shared", [3]], ["CA", 3, 4, 6], ["CHR", 1, "shared", [4]], ["CA", 2, 5, 6], ["FU", 9, [0, 1, 2, 3]], ["SP", 9, 0, 188160, [16], 1], ["AN", 9, 0, 5], ["AN", 9, 1, 6], ["FU", 6, [0, 1]], ["AN", 6, 0, 5], ["FU", 6, [1, 2]], ["AN", 6, 1, 4], ["FU", 6, [2, 3]], ["AN", 6, 2, 6], ["FU", 4, [0, 1]], ["SP", 4, 0, 20, [1], 1], ["AN", 4, 1, 2], ["FFSP", 4, 0, [3, 2], 1, 1], ["AN", 4, 1, 6], ["FU", 2, [0, 1]], ["SP", 2, 0, 10, [1], 1], ["AN", 2, 1, 2], ["FFSP", 2, 0, [3, 2], 1, 1], ["AN", 2, 1, 6], ["PR", 5, 0, "auto_unroll_max_step$1024"]]]], "r": [[2.59021e-05, 2.59075e-05, 2.59067e-05], 0, 7.70684, 1662029075], "v": "v0.6"}
{"i": [["[\"fused_pointwise_conv_bias_add_sigmoid_mul\", 28, 28, 10, 240, 1]", "cuda -keys=cuda,gpu -max_num_threads=1024 -model=unknown -thread_warp_size=32", [-1, 16, 64, 49152, 2147483647, 1024, 8, 32], "", 0, []], [[], [["CI", 5], ["CHW", 3, "local"], ["SP", 3, 0, 1, [1, 1, 1, 1], 1], ["SP", 3, 5, 240, [4, 60, 1, 1], 1], ["SP", 3, 10, 10, [1, 2], 1], ["RE", 3, [0, 5, 1, 6, 2, 7, 10, 11, 3, 8, 12, 4, 9]], ["FSP", 4, 0, 2, 3], ["FSP", 4, 4, 3, 3], ["RE", 4, [0, 4, 1, 5, 2, 6, 3, 7]], ["CA", 3, 4, 5], ["CHR", 2, "shared", [3]], ["CA", 3, 4, 6], ["CHR", 1, "shared", [4]], ["CA", 2, 5, 6], ["FU", 9, [0, 1, 2, 3]], ["SP", 9, 0, 188160, [32], 1], ["AN", 9, 0, 5], ["AN", 9, 1, 6], ["FU", 6, [0, 1]], ["AN", 6, 0, 5], ["FU", 6, [1, 2]], ["AN", 6, 1, 4], ["FU", 6, [2, 3]], ["AN", 6, 2, 6], ["FU", 4, [0, 1]], ["SP", 4, 0, 2, [1], 1], ["AN", 4, 1, 2], ["FFSP", 4, 0, [3, 2], 1, 1], ["AN", 4, 1, 6], ["FU", 2, [0, 1]], ["SP", 2, 0, 2, [1], 1], ["AN", 2, 1, 2], ["FFSP", 2, 0, [3, 2], 1, 1], ["AN", 2, 1, 6], ["PR", 5, 0, "auto_unroll_max_step$16"]]]], "r": [[1.85885e-05, 1.85911e-05, 1.85879e-05], 0, 3.86372, 1662029071], "v": "v0.6"}
{"i": [["[\"fused_pointwise_conv_bias_add_sigmoid_mul\", 28, 28, 10, 240, 1]", "cuda -keys=cuda,gpu -max_num_threads=1024 -model=unknown -thread_warp_size=32", [-1, 16, 64, 49152, 2147483647, 1024, 8, 32], "", 0, []], [[], [["CI", 5], ["CHW", 3, "local"], ["SP", 3, 0, 1, [1, 1, 1, 1], 1], ["SP", 3, 5, 240, [1, 60, 1, 1], 1], ["SP", 3, 10, 10, [10, 1], 1], ["RE", 3, [0, 5, 1, 6, 2, 7, 10, 11, 3, 8, 12, 4, 9]], ["FSP", 4, 0, 2, 3], ["FSP", 4, 4, 3, 3], ["RE", 4, [0, 4, 1, 5, 2, 6, 3, 7]], ["CA", 3, 4, 5], ["CHR", 2, "shared", [3]], ["CA", 3, 4, 6], ["CHR", 1, "shared", [4]], ["CA", 2, 5, 6], ["FU", 9, [0, 1, 2, 3]], ["SP", 9, 0, 188160, [32], 1], ["AN", 9, 0, 5], ["AN", 9, 1, 6], ["FU", 6, [0, 1]], ["AN", 6, 0, 5], ["FU", 6, [1, 2]], ["AN", 6, 1, 4], ["FU", 6, [2, 3]], ["AN", 6, 2, 6], ["FU", 4, [0, 1]], ["SP", 4, 0, 10, [2], 1], ["AN", 4, 1, 2], ["FFSP", 4, 0, [3, 2], 1, 1], ["AN", 4, 1, 6], ["FU", 2, [0, 1]], ["SP", 2, 0, 10, [5], 1], ["AN", 2, 1, 2], ["FFSP", 2, 0, [3, 2], 1, 1], ["AN", 2, 1, 6], ["PR", 5, 0, "auto_unroll_max_step$64"]]]], "r": [[1.75789e-05, 1.7585e-05, 1.75797e-05], 0, 3.20497, 1662029070], "v": "v0.6"}
{"i": [["[\"fused_pointwise_conv_bias_add_sigmoid_mul\", 28, 28, 10, 240, 1]", "cuda -keys=cuda,gpu -max_num_threads=1024 -model=unknown -thread_warp_size=32", [-1, 16, 64, 49152, 2147483647, 1024, 8, 32], "", 0, []], [[], [["CI", 5], ["CHW", 3, "local"], ["SP", 3, 0, 1, [1, 1, 1, 1], 1], ["SP", 3, 5, 240, [1, 4, 1, 2], 1], ["SP", 3, 10, 10, [1, 1], 1], ["RE", 3, [0, 5, 1, 6, 2, 7, 10, 11, 3, 8, 12, 4, 9]], ["FSP", 4, 0, 2, 3], ["FSP", 4, 4, 3, 3], ["RE", 4, [0, 4, 1, 5, 2, 6, 3, 7]], ["CA", 3, 4, 5], ["CHR", 2, "shared", [3]], ["CA", 3, 4, 6], ["CHR", 1, "shared", [4]], ["CA", 2, 5, 6], ["FU", 9, [0, 1, 2, 3]], ["SP", 9, 0, 188160, [64], 1], ["AN", 9, 0, 5], ["AN", 9, 1, 6], ["FU", 6, [0, 1]], ["AN", 6, 0, 5], ["FU", 6, [1, 2]], ["AN", 6, 1, 4], ["FU", 6, [2, 3]], ["AN", 6, 2, 6], ["FU", 4, [0, 1]], ["SP", 4, 0, 2, [1], 1], ["AN", 4, 1, 2], ["FFSP", 4, 0, [3, 2], 1, 1], ["AN", 4, 1, 6], ["FU", 2, [0, 1]], ["SP", 2, 0, 1, [1], 1], ["AN", 2, 1, 2], ["FFSP", 2, 0, [3, 2], 1, 1], ["AN", 2, 1, 6], ["PR", 5, 0, "auto_unroll_max_step$1024"]]]], "r": [[1.5e-05, 1.49999e-05, 1.50011e-05], 0, 5.23922, 1662029072], "v": "v0.6"}
{"i": [["[\"fused_pointwise_conv_bias_add_sigmoid_mul\", 28, 28, 10, 240, 1]", "cuda -keys=cuda,gpu -max_num_threads=1024 -model=unknown -thread_warp_size=32", [-1, 16, 64, 49152, 2147483647, 1024, 8, 32], "", 0, []], [[], [["CI", 5], ["CHW", 3, "local"], ["SP", 3, 0, 1, [1, 1, 1, 1], 1], ["SP", 3, 5, 240, [1, 120, 1, 1], 1], ["SP", 3, 10, 10, [1, 1], 1], ["RE", 3, [0, 5, 1, 6, 2, 7, 10, 11, 3, 8, 12, 4, 9]], ["FSP", 4, 0, 2, 3], ["FSP", 4, 4, 3, 3], ["RE", 4, [0, 4, 1, 5, 2, 6, 3, 7]], ["CA", 3, 4, 5], ["CHR", 2, "shared", [3]], ["CA", 3, 4, 6], ["CHR", 1, "shared", [4]], ["CA", 2, 5, 6], ["FU", 9, [0, 1, 2, 3]], ["SP", 9, 0, 188160, [32], 1], ["AN", 9, 0, 5], ["AN", 9, 1, 6], ["FU", 6, [0, 1]], ["AN", 6, 0, 5], ["FU", 6, [1, 2]], ["AN", 6, 1, 4], ["FU", 6, [2, 3]], ["AN", 6, 2, 6], ["FU", 4, [0, 1]], ["SP", 4, 0, 4, [4], 1], ["AN", 4, 1, 2], ["FFSP", 4, 0, [3, 2], 1, 1], ["AN", 4, 1, 6], ["FU", 2, [0, 1]], ["SP", 2, 0, 2, [1], 1], ["AN", 2, 1, 2], ["FFSP", 2, 0, [3, 2], 1, 1], ["AN", 2, 1, 6], ["PR", 5, 0, "auto_unroll_max_step$64"]]]], "r": [[1.91974e-05, 1.91993e-05, 1.91956e-05], 0, 2.63191, 1662029070], "v": "v0.6"}
{"i": [["[\"fused_pointwise_conv_bias_add_sigmoid_mul\", 28, 28, 10, 240, 1]", "cuda -keys=cuda,gpu -max_num_threads=1024 -model=unknown -thread_warp_size=32", [-1, 16, 64, 49152, 2147483647, 1024, 8, 32], "", 0, []], [[], [["CI", 5], ["CHW", 3, "local"], ["SP", 3, 0, 1, [1, 1, 1, 1], 1], ["SP", 3, 5, 240, [2, 40, 1, 1], 1], ["SP", 3, 10, 10, [2, 1], 1], ["RE", 3, [0, 5, 1, 6, 2, 7, 10, 11, 3, 8, 12, 4, 9]], ["FSP", 4, 0, 2, 3], ["FSP", 4, 4, 3, 3], ["RE", 4, [0, 4, 1, 5, 2, 6, 3, 7]], ["CA", 3, 4, 5], ["CHR", 2, "shared", [3]], ["CA", 3, 4, 6], ["CHR", 1, "shared", [4]], ["CA", 2, 5, 6], ["FU", 9, [0, 1, 2, 3]], ["SP", 9, 0, 188160, [64], 1], ["AN", 9, 0, 5], ["AN", 9, 1, 6], ["FU", 6, [0, 1]], ["AN", 6, 0, 5], ["FU", 6, [1, 2]], ["AN", 6, 1, 4], ["FU", 6, [2, 3]], ["AN", 6, 2, 6], ["FU", 4, [0, 1]], ["SP", 4, 0, 2, [1], 1], ["AN", 4, 1, 2], ["FFSP", 4, 0, [3, 2], 1, 1], ["AN", 4, 1, 6], ["FU", 2, [0, 1]], ["SP", 2, 0, 2, [1], 1], ["AN", 2, 1, 2], ["FFSP", 2, 0, [3, 2], 1, 1], ["AN", 2, 1, 6], ["PR", 5, 0, "auto_unroll_max_step$1024"]]]], "r": [[1.47117e-05, 1.47107e-05, 1.47136e-05], 0, 5.95291, 1662029074], "v": "v0.6"}
{"i": [["[\"fused_pointwise_conv_bias_add_sigmoid_mul\", 28, 28, 10, 240, 1]", "cuda -keys=cuda,gpu -max_num_threads=1024 -model=unknown -thread_warp_size=32", [-1, 16, 64, 49152, 2147483647, 1024, 8, 32], "", 0, []], [[], [["CI", 5], ["CHW", 3, "local"], ["SP", 3, 0, 1, [1, 1, 1, 1], 1], ["SP", 3, 5, 240, [1, 240, 1, 1], 1], ["SP", 3, 10, 10, [5, 1], 1], ["RE", 3, [0, 5, 1, 6, 2, 7, 10, 11, 3, 8, 12, 4, 9]], ["FSP", 4, 0, 2, 3], ["FSP", 4, 4, 3, 3], ["RE", 4, [0, 4, 1, 5, 2, 6, 3, 7]], ["CA", 3, 4, 5], ["CHR", 2, "shared", [3]], ["CA", 3, 4, 6], ["CHR", 1, "shared", [4]], ["CA", 2, 5, 6], ["FU", 9, [0, 1, 2, 3]], ["SP", 9, 0, 188160, [32], 1], ["AN", 9, 0, 5], ["AN", 9, 1, 6], ["FU", 6, [0, 1]], ["AN", 6, 0, 5], ["FU", 6, [1, 2]], ["AN", 6, 1, 4], ["FU", 6, [2, 3]], ["AN", 6, 2, 6], ["FU", 4, [0, 1]], ["SP", 4, 0, 30, [6], 1], ["AN", 4, 1, 2], ["FFSP", 4, 0, [3, 2], 1, 1], ["AN", 4, 1, 6], ["FU", 2, [0, 1]], ["SP", 2, 0, 5, [1], 1], ["AN", 2, 1, 2], ["FFSP", 2, 0, [3, 2], 1, 1], ["AN", 2, 1, 6], ["PR", 5, 0, "auto_unroll_max_step$64"]]]], "r": [[1.79105e-05, 1.79201e-05, 1.79307e-05], 0, 8.94292, 1662029077], "v": "v0.6"}
{"i": [["[\"fused_pointwise_conv_bias_add_sigmoid_mul\", 28, 28, 10, 240, 1]", "cuda -keys=cuda,gpu -max_num_threads=1024 -model=unknown -thread_warp_size=32", [-1, 16, 64, 49152, 2147483647, 1024, 8, 32], "", 0, []], [[], [["CI", 5], ["CHW", 3, "local"], ["SP", 3, 0, 1, [1, 1, 1, 1], 1], ["SP", 3, 5, 240, [1, 40, 2, 3], 1], ["SP", 3, 10, 10, [2, 1], 1], ["RE", 3, [0, 5, 1, 6, 2, 7, 10, 11, 3, 8, 12, 4, 9]], ["FSP", 4, 0, 2, 3], ["FSP", 4, 4, 3, 3], ["RE", 4, [0, 4, 1, 5, 2, 6, 3, 7]], ["CA", 3, 4, 5], ["CHR", 2, "shared", [3]], ["CA", 3, 4, 6], ["CHR", 1, "shared", [4]], ["CA", 2, 5, 6], ["FU", 9, [0, 1, 2, 3]], ["SP", 9, 0, 188160, [32], 1], ["AN", 9, 0, 5], ["AN", 9, 1, 6], ["FU", 6, [0, 1]], ["AN", 6, 0, 5], ["FU", 6, [1, 2]], ["AN", 6, 1, 4], ["FU", 6, [2, 3]], ["AN", 6, 2, 6], ["FU", 4, [0, 1]], ["SP", 4, 0, 60, [1], 1], ["AN", 4, 1, 2], ["FFSP", 4, 0, [3, 2], 1, 1], ["AN", 4, 1, 6], ["FU", 2, [0, 1]], ["SP", 2, 0, 10, [1], 1], ["AN", 2, 1, 2], ["FFSP", 2, 0, [3, 2], 1, 1], ["AN", 2, 1, 6], ["PR", 5, 0, "auto_unroll_max_step$16"]]]], "r": [[2.00906e-05, 2.00929e-05, 2.00963e-05], 0, 9.51775, 1662029077], "v": "v0.6"}
{"i": [["[\"fused_pointwise_conv_bias_add_sigmoid_mul\", 28, 28, 10, 240, 1]", "cuda -keys=cuda,gpu -max_num_threads=1024 -model=unknown -thread_warp_size=32", [-1, 16, 64, 49152, 2147483647, 1024, 8, 32], "", 0, []], [[], [["CI", 5], ["CHW", 3, "local"], ["SP", 3, 0, 1, [1, 1, 1, 1], 1], ["SP", 3, 5, 240, [1, 40, 2, 3], 1], ["SP", 3, 10, 10, [5, 2], 1], ["RE", 3, [0, 5, 1, 6, 2, 7, 10, 11, 3, 8, 12, 4, 9]], ["FSP", 4, 0, 2, 3], ["FSP", 4, 4, 3, 3], ["RE", 4, [0, 4, 1, 5, 2, 6, 3, 7]], ["CA", 3, 4, 5], ["CHR", 2, "shared", [3]], ["CA", 3, 4, 6], ["CHR", 1, "shared", [4]], ["CA", 2, 5, 6], ["FU", 9, [0, 1, 2, 3]], ["SP", 9, 0, 188160, [8], 1], ["AN", 9, 0, 5], ["AN", 9, 1, 6], ["FU", 6, [0, 1]], ["AN", 6, 0, 5], ["FU", 6, [1, 2]], ["AN", 6, 1, 4], ["FU", 6, [2, 3]], ["AN", 6, 2, 6], ["FU", 4, [0, 1]], ["SP", 4, 0, 60, [1], 1], ["AN", 4, 1, 2], ["FFSP", 4, 0, [3, 2], 1, 1], ["AN", 4, 1, 6], ["FU", 2, [0, 1]], ["SP", 2, 0, 10, [1], 1], ["AN", 2, 1, 2], ["FFSP", 2, 0, [3, 2], 1, 1], ["AN", 2, 1, 6], ["PR", 5, 0, "auto_unroll_max_step$16"]]]], "r": [[4.1422e-05, 4.1435e-05, 4.14433e-05], 0, 8.18071, 1662029076], "v": "v0.6"}
{"i": [["[\"fused_pointwise_conv_bias_add_sigmoid_mul\", 28, 28, 10, 240, 1]", "cuda -keys=cuda,gpu -max_num_threads=1024 -model=unknown -thread_warp_size=32", [-1, 16, 64, 49152, 2147483647, 1024, 8, 32], "", 0, []], [[], [["CI", 5], ["CHW", 3, "local"], ["SP", 3, 0, 1, [1, 1, 1, 1], 1], ["SP", 3, 5, 240, [10, 4, 2, 3], 1], ["SP", 3, 10, 10, [10, 1], 1], ["RE", 3, [0, 5, 1, 6, 2, 7, 10, 11, 3, 8, 12, 4, 9]], ["FSP", 4, 0, 2, 3], ["FSP", 4, 4, 3, 3], ["RE", 4, [0, 4, 1, 5, 2, 6, 3, 7]], ["CA", 3, 4, 5], ["CHR", 2, "shared", [3]], ["CA", 3, 4, 6], ["CHR", 1, "shared", [4]], ["CA", 2, 5, 6], ["FU", 9, [0, 1, 2, 3]], ["SP", 9, 0, 188160, [32], 1], ["AN", 9, 0, 5], ["AN", 9, 1, 6], ["FU", 6, [0, 1]], ["AN", 6, 0, 5], ["FU", 6, [1, 2]], ["AN", 6, 1, 4], ["FU", 6, [2, 3]], ["AN", 6, 2, 6], ["FU", 4, [0, 1]], ["SP", 4, 0, 2, [1], 1], ["AN", 4, 1, 2], ["FFSP", 4, 0, [3, 2], 1, 1], ["AN", 4, 1, 6], ["FU", 2, [0, 1]], ["SP", 2, 0, 1, [1], 1], ["AN", 2, 1, 2], ["FFSP", 2, 0, [3, 2], 1, 1], ["AN", 2, 1, 6], ["PR", 5, 0, "auto_unroll_max_step$1024"]]]], "r": [[2.6763e-05, 2.67646e-05, 2.67663e-05], 0, 12.4885, 1662029079], "v": "v0.6"}
{"i": [["[\"fused_pointwise_conv_bias_add_sigmoid_mul\", 28, 28, 10, 240, 1]", "cuda -keys=cuda,gpu -max_num_threads=1024 -model=unknown -thread_warp_size=32", [-1, 16, 64, 49152, 2147483647, 1024, 8, 32], "", 0, []], [[], [["CI", 5], ["CHW", 3, "local"], ["SP", 3, 0, 1, [1, 1, 1, 1], 1], ["SP", 3, 5, 240, [1, 40, 1, 1], 1], ["SP", 3, 10, 10, [1, 10], 1], ["RE", 3, [0, 5, 1, 6, 2, 7, 10, 11, 3, 8, 12, 4, 9]], ["FSP", 4, 0, 2, 3], ["FSP", 4, 4, 3, 3], ["RE", 4, [0, 4, 1, 5, 2, 6, 3, 7]], ["CA", 3, 4, 5], ["CHR", 2, "shared", [3]], ["CA", 3, 4, 6], ["CHR", 1, "shared", [4]], ["CA", 2, 5, 6], ["FU", 9, [0, 1, 2, 3]], ["SP", 9, 0, 188160, [64], 1], ["AN", 9, 0, 5], ["AN", 9, 1, 6], ["FU", 6, [0, 1]], ["AN", 6, 0, 5], ["FU", 6, [1, 2]], ["AN", 6, 1, 4], ["FU", 6, [2, 3]], ["AN", 6, 2, 6], ["FU", 4, [0, 1]], ["SP", 4, 0, 10, [1], 1], ["AN", 4, 1, 2], ["FFSP", 4, 0, [3, 2], 1, 1], ["AN", 4, 1, 6], ["FU", 2, [0, 1]], ["SP", 2, 0, 10, [1], 1], ["AN", 2, 1, 2], ["FFSP", 2, 0, [3, 2], 1, 1], ["AN", 2, 1, 6], ["PR", 5, 0, "auto_unroll_max_step$0"]]]], "r": [[1.46935e-05, 1.46884e-05, 1.46968e-05], 0, 13.093, 1662029081], "v": "v0.6"}
{"i": [["[\"fused_pointwise_conv_bias_add_sigmoid_mul\", 28, 28, 10, 240, 1]", "cuda -keys=cuda,gpu -max_num_threads=1024 -model=unknown -thread_warp_size=32", [-1, 16, 64, 49152, 2147483647, 1024, 8, 32], "", 0, []], [[], [["CI", 5], ["CHW", 3, "local"], ["SP", 3, 0, 1, [1, 1, 1, 1], 1], ["SP", 3, 5, 240, [4, 60, 1, 1], 1], ["SP", 3, 10, 10, [10, 1], 1], ["RE", 3, [0, 5, 1, 6, 2, 7, 10, 11, 3, 8, 12, 4, 9]], ["FSP", 4, 0, 2, 3], ["FSP", 4, 4, 3, 3], ["RE", 4, [0, 4, 1, 5, 2, 6, 3, 7]], ["CA", 3, 4, 5], ["CHR", 2, "shared", [3]], ["CA", 3, 4, 6], ["CHR", 1, "shared", [4]], ["CA", 2, 5, 6], ["FU", 9, [0, 1, 2, 3]], ["SP", 9, 0, 188160, [32], 1], ["AN", 9, 0, 5], ["AN", 9, 1, 6], ["FU", 6, [0, 1]], ["AN", 6, 0, 5], ["FU", 6, [1, 2]], ["AN", 6, 1, 4], ["FU", 6, [2, 3]], ["AN", 6, 2, 6], ["FU", 4, [0, 1]], ["SP", 4, 0, 10, [1], 1], ["AN", 4, 1, 2], ["FFSP", 4, 0, [3, 2], 1, 1], ["AN", 4, 1, 6], ["FU", 2, [0, 1]], ["SP", 2, 0, 10, [1], 1], ["AN", 2, 1, 2], ["FFSP", 2, 0, [3, 2], 1, 1], ["AN", 2, 1, 6], ["PR", 5, 0, "auto_unroll_max_step$0"]]]], "r": [[1.80064e-05, 1.80022e-05, 1.79991e-05], 0, 14.8499, 1662029083], "v": "v0.6"}
{"i": [["[\"fused_pointwise_conv_bias_add_sigmoid_mul\", 28, 28, 10, 240, 1]", "cuda -keys=cuda,gpu -max_num_threads=1024 -model=unknown -thread_warp_size=32", [-1, 16, 64, 49152, 2147483647, 1024, 8, 32], "", 0, []], [[], [["CI", 5], ["CHW", 3, "local"], ["SP", 3, 0, 1, [1, 1, 1, 1], 1], ["SP", 3, 5, 240, [1, 16, 15, 1], 1], ["SP", 3, 10, 10, [1, 10], 1], ["RE", 3, [0, 5, 1, 6, 2, 7, 10, 11, 3, 8, 12, 4, 9]], ["FSP", 4, 0, 2, 3], ["FSP", 4, 4, 3, 3], ["RE", 4, [0, 4, 1, 5, 2, 6, 3, 7]], ["CA", 3, 4, 5], ["CHR", 2, "shared", [3]], ["CA", 3, 4, 6], ["CHR", 1, "shared", [4]], ["CA", 2, 5, 6], ["FU", 9, [0, 1, 2, 3]], ["SP", 9, 0, 188160, [1], 1], ["AN", 9, 0, 5], ["AN", 9, 1, 6], ["FU", 6, [0, 1]], ["AN", 6, 0, 5], ["FU", 6, [1, 2]], ["AN", 6, 1, 4], ["FU", 6, [2, 3]], ["AN", 6, 2, 6], ["FU", 4, [0, 1]], ["SP", 4, 0, 20, [1], 1], ["AN", 4, 1, 2], ["FFSP", 4, 0, [3, 2], 1, 1], ["AN", 4, 1, 6], ["FU", 2, [0, 1]], ["SP", 2, 0, 10, [1], 1], ["AN", 2, 1, 2], ["FFSP", 2, 0, [3, 2], 1, 1], ["AN", 2, 1, 6], ["PR", 5, 0, "auto_unroll_max_step$1024"]]]], "r": [[0.000263178, 0.00026317, 0.000263203], 0, 11.4337, 1662029079], "v": "v0.6"}
{"i": [["[\"fused_pointwise_conv_bias_add_sigmoid_mul\", 28, 28, 10, 240, 1]", "cuda -keys=cuda,gpu -max_num_threads=1024 -model=unknown -thread_warp_size=32", [-1, 16, 64, 49152, 2147483647, 1024, 8, 32], "", 0, []], [[], [["CI", 5], ["CHW", 3, "local"], ["SP", 3, 0, 1, [1, 1, 1, 1], 1], ["SP", 3, 5, 240, [1, 80, 1, 3], 1], ["SP", 3, 10, 10, [10, 1], 1], ["RE", 3, [0, 5, 1, 6, 2, 7, 10, 11, 3, 8, 12, 4, 9]], ["FSP", 4, 0, 2, 3], ["FSP", 4, 4, 3, 3], ["RE", 4, [0, 4, 1, 5, 2, 6, 3, 7]], ["CA", 3, 4, 5], ["CHR", 2, "shared", [3]], ["CA", 3, 4, 6], ["CHR", 1, "shared", [4]], ["CA", 2, 5, 6], ["FU", 9, [0, 1, 2, 3]], ["SP", 9, 0, 188160, [32], 1], ["AN", 9, 0, 5], ["AN", 9, 1, 6], ["FU", 6, [0, 1]], ["AN", 6, 0, 5], ["FU", 6, [1, 2]], ["AN", 6, 1, 4], ["FU", 6, [2, 3]], ["AN", 6, 2, 6], ["FU", 4, [0, 1]], ["SP", 4, 0, 5, [1], 1], ["AN", 4, 1, 2], ["FFSP", 4, 0, [3, 2], 1, 1], ["AN", 4, 1, 6], ["FU", 2, [0, 1]], ["SP", 2, 0, 5, [5], 1], ["AN", 2, 1, 2], ["FFSP", 2, 0, [3, 2], 1, 1], ["AN", 2, 1, 6], ["PR", 5, 0, "auto_unroll_max_step$16"]]]], "r": [[1.82028e-05, 1.82131e-05, 1.82157e-05], 0, 11.8422, 1662029080], "v": "v0.6"}
{"i": [["[\"fused_pointwise_conv_bias_add_sigmoid_mul\", 28, 28, 10, 240, 1]", "cuda -keys=cuda,gpu -max_num_threads=1024 -model=unknown -thread_warp_size=32", [-1, 16, 64, 49152, 2147483647, 1024, 8, 32], "", 0, []], [[], [["CI", 5], ["CHW", 3, "local"], ["SP", 3, 0, 1, [1, 1, 1, 1], 1], ["SP", 3, 5, 240, [5, 48, 1, 1], 1], ["SP", 3, 10, 10, [10, 1], 1], ["RE", 3, [0, 5, 1, 6, 2, 7, 10, 11, 3, 8, 12, 4, 9]], ["FSP", 4, 0, 2, 3], ["FSP", 4, 4, 3, 3], ["RE", 4, [0, 4, 1, 5, 2, 6, 3, 7]], ["CA", 3, 4, 5], ["CHR", 2, "shared", [3]], ["CA", 3, 4, 6], ["CHR", 1, "shared", [4]], ["CA", 2, 5, 6], ["FU", 9, [0, 1, 2, 3]], ["SP", 9, 0, 188160, [4], 1], ["AN", 9, 0, 5], ["AN", 9, 1, 6], ["FU", 6, [0, 1]], ["AN", 6, 0, 5], ["FU", 6, [1, 2]], ["AN", 6, 1, 4], ["FU", 6, [2, 3]], ["AN", 6, 2, 6], ["FU", 4, [0, 1]], ["SP", 4, 0, 10, [1], 1], ["AN", 4, 1, 2], ["FFSP", 4, 0, [3, 2], 1, 1], ["AN", 4, 1, 6], ["FU", 2, [0, 1]], ["SP", 2, 0, 10, [1], 1], ["AN", 2, 1, 2], ["FFSP", 2, 0, [3, 2], 1, 1], ["AN", 2, 1, 6], ["PR", 5, 0, "auto_unroll_max_step$1024"]]]], "r": [[7.26383e-05, 7.26355e-05, 7.2643e-05], 0, 13.8121, 1662029081], "v": "v0.6"}
{"i": [["[\"fused_pointwise_conv_bias_add_sigmoid_mul\", 28, 28, 10, 240, 1]", "cuda -keys=cuda,gpu -max_num_threads=1024 -model=unknown -thread_warp_size=32", [-1, 16, 64, 49152, 2147483647, 1024, 8, 32], "", 0, []], [[], [["CI", 5], ["CHW", 3, "local"], ["SP", 3, 0, 1, [1, 1, 1, 1], 1], ["SP", 3, 5, 240, [1, 8, 5, 6], 1], ["SP", 3, 10, 10, [5, 1], 1], ["RE", 3, [0, 5, 1, 6, 2, 7, 10, 11, 3, 8, 12, 4, 9]], ["FSP", 4, 0, 2, 3], ["FSP", 4, 4, 3, 3], ["RE", 4, [0, 4, 1, 5, 2, 6, 3, 7]], ["CA", 3, 4, 5], ["CHR", 2, "shared", [3]], ["CA", 3, 4, 6], ["CHR", 1, "shared", [4]], ["CA", 2, 5, 6], ["FU", 9, [0, 1, 2, 3]], ["SP", 9, 0, 188160, [32], 1], ["AN", 9, 0, 5], ["AN", 9, 1, 6], ["FU", 6, [0, 1]], ["AN", 6, 0, 5], ["FU", 6, [1, 2]], ["AN", 6, 1, 4], ["FU", 6, [2, 3]], ["AN", 6, 2, 6], ["FU", 4, [0, 1]], ["SP", 4, 0, 30, [1], 1], ["AN", 4, 1, 2], ["FFSP", 4, 0, [3, 2], 1, 1], ["AN", 4, 1, 6], ["FU", 2, [0, 1]], ["SP", 2, 0, 5, [1], 1], ["AN", 2, 1, 2], ["FFSP", 2, 0, [3, 2], 1, 1], ["AN", 2, 1, 6], ["PR", 5, 0, "auto_unroll_max_step$64"]]]], "r": [[2.48378e-05, 2.48548e-05, 2.48462e-05], 0, 12.7241, 1662029080], "v": "v0.6"}
{"i": [["[\"fused_pointwise_conv_bias_add_sigmoid_mul\", 28, 28, 10, 240, 1]", "cuda -keys=cuda,gpu -max_num_threads=1024 -model=unknown -thread_warp_size=32", [-1, 16, 64, 49152, 2147483647, 1024, 8, 32], "", 0, []], [[], [["CI", 5], ["CHW", 3, "local"], ["SP", 3, 0, 1, [1, 1, 1, 1], 1], ["SP", 3, 5, 240, [1, 40, 1, 6], 1], ["SP", 3, 10, 10, [5, 1], 1], ["RE", 3, [0, 5, 1, 6, 2, 7, 10, 11, 3, 8, 12, 4, 9]], ["FSP", 4, 0, 2, 3], ["FSP", 4, 4, 3, 3], ["RE", 4, [0, 4, 1, 5, 2, 6, 3, 7]], ["CA", 3, 4, 5], ["CHR", 2, "shared", [3]], ["CA", 3, 4, 6], ["CHR", 1, "shared", [4]], ["CA", 2, 5, 6], ["FU", 9, [0, 1, 2, 3]], ["SP", 9, 0, 188160, [32], 1], ["AN", 9, 0, 5], ["AN", 9, 1, 6], ["FU", 6, [0, 1]], ["AN", 6, 0, 5], ["FU", 6, [1, 2]], ["AN", 6, 1, 4], ["FU", 6, [2, 3]], ["AN", 6, 2, 6], ["FU", 4, [0, 1]], ["SP", 4, 0, 30, [1], 1], ["AN", 4, 1, 2], ["FFSP", 4, 0, [3, 2], 1, 1], ["AN", 4, 1, 6], ["FU", 2, [0, 1]], ["SP", 2, 0, 5, [1], 1], ["AN", 2, 1, 2], ["FFSP", 2, 0, [3, 2], 1, 1], ["AN", 2, 1, 6], ["PR", 5, 0, "auto_unroll_max_step$512"]]]], "r": [[2.06354e-05, 2.06281e-05, 2.06363e-05], 0, 16.0837, 1662029084], "v": "v0.6"}
{"i": [["[\"fused_pointwise_conv_bias_add_sigmoid_mul\", 28, 28, 10, 240, 1]", "cuda -keys=cuda,gpu -max_num_threads=1024 -model=unknown -thread_warp_size=32", [-1, 16, 64, 49152, 2147483647, 1024, 8, 32], "", 0, []], [[], [["CI", 5], ["CHW", 3, "local"], ["SP", 3, 0, 1, [1, 1, 1, 1], 1], ["SP", 3, 5, 240, [1, 40, 3, 1], 1], ["SP", 3, 10, 10, [1, 10], 1], ["RE", 3, [0, 5, 1, 6, 2, 7, 10, 11, 3, 8, 12, 4, 9]], ["FSP", 4, 0, 2, 3], ["FSP", 4, 4, 3, 3], ["RE", 4, [0, 4, 1, 5, 2, 6, 3, 7]], ["CA", 3, 4, 5], ["CHR", 2, "shared", [3]], ["CA", 3, 4, 6], ["CHR", 1, "shared", [4]], ["CA", 2, 5, 6], ["FU", 9, [0, 1, 2, 3]], ["SP", 9, 0, 188160, [2], 1], ["AN", 9, 0, 5], ["AN", 9, 1, 6], ["FU", 6, [0, 1]], ["AN", 6, 0, 5], ["FU", 6, [1, 2]], ["AN", 6, 1, 4], ["FU", 6, [2, 3]], ["AN", 6, 2, 6], ["FU", 4, [0, 1]], ["SP", 4, 0, 30, [1], 1], ["AN", 4, 1, 2], ["FFSP", 4, 0, [3, 2], 1, 1], ["AN", 4, 1, 6], ["FU", 2, [0, 1]], ["SP", 2, 0, 10, [2], 1], ["AN", 2, 1, 2], ["FFSP", 2, 0, [3, 2], 1, 1], ["AN", 2, 1, 6], ["PR", 5, 0, "auto_unroll_max_step$512"]]]], "r": [[0.000136187, 0.000136176, 0.000136164], 0, 14.3716, 1662029082], "v": "v0.6"}
{"i": [["[\"fused_pointwise_conv_bias_add_sigmoid_mul\", 28, 28, 10, 240, 1]", "cuda -keys=cuda,gpu -max_num_threads=1024 -model=unknown -thread_warp_size=32", [-1, 16, 64, 49152, 2147483647, 1024, 8, 32], "", 0, []], [[], [["CI", 5], ["CHW", 3, "local"], ["SP", 3, 0, 1, [1, 1, 1, 1], 1], ["SP", 3, 5, 240, [1, 40, 2, 3], 1], ["SP", 3, 10, 10, [5, 1], 1], ["RE", 3, [0, 5, 1, 6, 2, 7, 10, 11, 3, 8, 12, 4, 9]], ["FSP", 4, 0, 2, 3], ["FSP", 4, 4, 3, 3], ["RE", 4, [0, 4, 1, 5, 2, 6, 3, 7]], ["CA", 3, 4, 5], ["CHR", 2, "shared", [3]], ["CA", 3, 4, 6], ["CHR", 1, "shared", [4]], ["CA", 2, 5, 6], ["FU", 9, [0, 1, 2, 3]], ["SP", 9, 0, 188160, [32], 1], ["AN", 9, 0, 5], ["AN", 9, 1, 6], ["FU", 6, [0, 1]], ["AN", 6, 0, 5], ["FU", 6, [1, 2]], ["AN", 6, 1, 4], ["FU", 6, [2, 3]], ["AN", 6, 2, 6], ["FU", 4, [0, 1]], ["SP", 4, 0, 60, [1], 1], ["AN", 4, 1, 2], ["FFSP", 4, 0, [3, 2], 1, 1], ["AN", 4, 1, 6], ["FU", 2, [0, 1]], ["SP", 2, 0, 10, [2], 1], ["AN", 2, 1, 2], ["FFSP", 2, 0, [3, 2], 1, 1], ["AN", 2, 1, 6], ["PR", 5, 0, "auto_unroll_max_step$16"]]]], "r": [[2.0375e-05, 2.03676e-05, 2.03804e-05], 0, 15.3523, 1662029083], "v": "v0.6"}
{"i": [["[\"fused_pointwise_conv_bias_add_sigmoid_mul\", 28, 28, 10, 240, 1]", "cuda -keys=cuda,gpu -max_num_threads=1024 -model=unknown -thread_warp_size=32", [-1, 16, 64, 49152, 2147483647, 1024, 8, 32], "", 0, []], [[], [["CI", 5], ["CHW", 3, "local"], ["SP", 3, 0, 1, [1, 1, 1, 1], 1], ["SP", 3, 5, 240, [1, 240, 1, 1], 1], ["SP", 3, 10, 10, [1, 1], 1], ["RE", 3, [0, 5, 1, 6, 2, 7, 10, 11, 3, 8, 12, 4, 9]], ["FSP", 4, 0, 2, 3], ["FSP", 4, 4, 3, 3], ["RE", 4, [0, 4, 1, 5, 2, 6, 3, 7]], ["CA", 3, 4, 5], ["CHR", 2, "shared", [3]], ["CA", 3, 4, 6], ["CHR", 1, "shared", [4]], ["CA", 2, 5, 6], ["FU", 9, [0, 1, 2, 3]], ["SP", 9, 0, 188160, [32], 1], ["AN", 9, 0, 5], ["AN", 9, 1, 6], ["FU", 6, [0, 1]], ["AN", 6, 0, 5], ["FU", 6, [1, 2]], ["AN", 6, 1, 4], ["FU", 6, [2, 3]], ["AN", 6, 2, 6], ["FU", 4, [0, 1]], ["SP", 4, 0, 1, [1], 1], ["AN", 4, 1, 2], ["FFSP", 4, 0, [3, 2], 1, 1], ["AN", 4, 1, 6], ["FU", 2, [0, 1]], ["SP", 2, 0, 1, [1], 1], ["AN", 2, 1, 2], ["FFSP", 2, 0, [3, 2], 1, 1], ["AN", 2, 1, 6], ["PR", 5, 0, "auto_unroll_max_step$0"]]]], "r": [[1.85789e-05, 1.85793e-05, 1.85783e-05], 0, 16.9606, 1662029085], "v": "v0.6"}
{"i": [["[\"fused_pointwise_conv_bias_add_sigmoid_mul\", 28, 28, 10, 240, 1]", "cuda -keys=cuda,gpu -max_num_threads=1024 -model=unknown -thread_warp_size=32", [-1, 16, 64, 49152, 2147483647, 1024, 8, 32], "", 0, []], [[], [["CI", 5], ["CHW", 3, "local"], ["SP", 3, 0, 1, [1, 1, 1, 1], 1], ["SP", 3, 5, 240, [1, 20, 4, 3], 1], ["SP", 3, 10, 10, [1, 5], 1], ["RE", 3, [0, 5, 1, 6, 2, 7, 10, 11, 3, 8, 12, 4, 9]], ["FSP", 4, 0, 2, 3], ["FSP", 4, 4, 3, 3], ["RE", 4, [0, 4, 1, 5, 2, 6, 3, 7]], ["CA", 3, 4, 5], ["CHR", 2, "shared", [3]], ["CA", 3, 4, 6], ["CHR", 1, "shared", [4]], ["CA", 2, 5, 6], ["FU", 9, [0, 1, 2, 3]], ["SP", 9, 0, 188160, [32], 1], ["AN", 9, 0, 5], ["AN", 9, 1, 6], ["FU", 6, [0, 1]], ["AN", 6, 0, 5], ["FU", 6, [1, 2]], ["AN", 6, 1, 4], ["FU", 6, [2, 3]], ["AN", 6, 2, 6], ["FU", 4, [0, 1]], ["SP", 4, 0, 4, [1], 1], ["AN", 4, 1, 2], ["FFSP", 4, 0, [3, 2], 1, 1], ["AN", 4, 1, 6], ["FU", 2, [0, 1]], ["SP", 2, 0, 1, [1], 1], ["AN", 2, 1, 2], ["FFSP", 2, 0, [3, 2], 1, 1], ["AN", 2, 1, 6], ["PR", 5, 0, "auto_unroll_max_step$1024"]]]], "r": [[2.0479e-05, 2.04778e-05, 2.04755e-05], 0, 16.7766, 1662029084], "v": "v0.6"}
{"i": [["[\"fused_pointwise_conv_bias_add_sigmoid_mul\", 28, 28, 10, 240, 1]", "cuda -keys=cuda,gpu -max_num_threads=1024 -model=unknown -thread_warp_size=32", [-1, 16, 64, 49152, 2147483647, 1024, 8, 32], "", 0, []], [[], [["CI", 5], ["CHW", 3, "local"], ["SP", 3, 0, 1, [1, 1, 1, 1], 1], ["SP", 3, 5, 240, [1, 80, 1, 3], 1], ["SP", 3, 10, 10, [1, 1], 1], ["RE", 3, [0, 5, 1, 6, 2, 7, 10, 11, 3, 8, 12, 4, 9]], ["FSP", 4, 0, 2, 3], ["FSP", 4, 4, 3, 3], ["RE", 4, [0, 4, 1, 5, 2, 6, 3, 7]], ["CA", 3, 4, 5], ["CHR", 2, "shared", [3]], ["CA", 3, 4, 6], ["CHR", 1, "shared", [4]], ["CA", 2, 5, 6], ["FU", 9, [0, 1, 2, 3]], ["SP", 9, 0, 188160, [32], 1], ["AN", 9, 0, 5], ["AN", 9, 1, 6], ["FU", 6, [0, 1]], ["AN", 6, 0, 5], ["FU", 6, [1, 2]], ["AN", 6, 1, 4], ["FU", 6, [2, 3]], ["AN", 6, 2, 6], ["FU", 4, [0, 1]], ["SP", 4, 0, 6, [2], 1], ["AN", 4, 1, 2], ["FFSP", 4, 0, [3, 2], 1, 1], ["AN", 4, 1, 6], ["FU", 2, [0, 1]], ["SP", 2, 0, 2, [2], 1], ["AN", 2, 1, 2], ["FFSP", 2, 0, [3, 2], 1, 1], ["AN", 2, 1, 6], ["PR", 5, 0, "auto_unroll_max_step$1024"]]]], "r": [[1.9401e-05, 1.9398e-05, 1.93985e-05], 0, 20.7868, 1662029089], "v": "v0.6"}
{"i": [["[\"fused_pointwise_conv_bias_add_sigmoid_mul\", 28, 28, 10, 240, 1]", "cuda -keys=cuda,gpu -max_num_threads=1024 -model=unknown -thread_warp_size=32", [-1, 16, 64, 49152, 2147483647, 1024, 8, 32], "", 0, []], [[], [["CI", 5], ["CHW", 3, "local"], ["SP", 3, 0, 1, [1, 1, 1, 1], 1], ["SP", 3, 5, 240, [1, 60, 2, 1], 1], ["SP", 3, 10, 10, [1, 1], 1], ["RE", 3, [0, 5, 1, 6, 2, 7, 10, 11, 3, 8, 12, 4, 9]], ["FSP", 4, 0, 2, 3], ["FSP", 4, 4, 3, 3], ["RE", 4, [0, 4, 1, 5, 2, 6, 3, 7]], ["CA", 3, 4, 5], ["CHR", 2, "shared", [3]], ["CA", 3, 4, 6], ["CHR", 1, "shared", [4]], ["CA", 2, 5, 6], ["FU", 9, [0, 1, 2, 3]], ["SP", 9, 0, 188160, [4], 1], ["AN", 9, 0, 5], ["AN", 9, 1, 6], ["FU", 6, [0, 1]], ["AN", 6, 0, 5], ["FU", 6, [1, 2]], ["AN", 6, 1, 4], ["FU", 6, [2, 3]], ["AN", 6, 2, 6], ["FU", 4, [0, 1]], ["SP", 4, 0, 20, [1], 1], ["AN", 4, 1, 2], ["FFSP", 4, 0, [3, 2], 1, 1], ["AN", 4, 1, 6], ["FU", 2, [0, 1]], ["SP", 2, 0, 10, [1], 1], ["AN", 2, 1, 2], ["FFSP", 2, 0, [3, 2], 1, 1], ["AN", 2, 1, 6], ["PR", 5, 0, "auto_unroll_max_step$64"]]]], "r": [[7.41622e-05, 7.41463e-05, 7.41518e-05], 0, 18.9636, 1662029087], "v": "v0.6"}
{"i": [["[\"fused_pointwise_conv_bias_add_sigmoid_mul\", 28, 28, 10, 240, 1]", "cuda -keys=cuda,gpu -max_num_threads=1024 -model=unknown -thread_warp_size=32", [-1, 16, 64, 49152, 2147483647, 1024, 8, 32], "", 0, []], [[], [["CI", 5], ["CHW", 3, "local"], ["SP", 3, 0, 1, [1, 1, 1, 1], 1], ["SP", 3, 5, 240, [1, 40, 1, 6], 1], ["SP", 3, 10, 10, [1, 5], 1], ["RE", 3, [0, 5, 1, 6, 2, 7, 10, 11, 3, 8, 12, 4, 9]], ["FSP", 4, 0, 2, 3], ["FSP", 4, 4, 3, 3], ["RE", 4, [0, 4, 1, 5, 2, 6, 3, 7]], ["CA", 3, 4, 5], ["CHR", 2, "shared", [3]], ["CA", 3, 4, 6], ["CHR", 1, "shared", [4]], ["CA", 2, 5, 6], ["FU", 9, [0, 1, 2, 3]], ["SP", 9, 0, 188160, [64], 1], ["AN", 9, 0, 5], ["AN", 9, 1, 6], ["FU", 6, [0, 1]], ["AN", 6, 0, 5], ["FU", 6, [1, 2]], ["AN", 6, 1, 4], ["FU", 6, [2, 3]], ["AN", 6, 2, 6], ["FU", 4, [0, 1]], ["SP", 4, 0, 30, [1], 1], ["AN", 4, 1, 2], ["FFSP", 4, 0, [3, 2], 1, 1], ["AN", 4, 1, 6], ["FU", 2, [0, 1]], ["SP", 2, 0, 5, [1], 1], ["AN", 2, 1, 2], ["FFSP", 2, 0, [3, 2], 1, 1], ["AN", 2, 1, 6], ["PR", 5, 0, "auto_unroll_max_step$64"]]]], "r": [[1.62604e-05, 1.62602e-05, 1.62607e-05], 0, 19.5901, 1662029087], "v": "v0.6"}
{"i": [["[\"fused_pointwise_conv_bias_add_sigmoid_mul\", 28, 28, 10, 240, 1]", "cuda -keys=cuda,gpu -max_num_threads=1024 -model=unknown -thread_warp_size=32", [-1, 16, 64, 49152, 2147483647, 1024, 8, 32], "", 0, []], [[], [["CI", 5], ["CHW", 3, "local"], ["SP", 3, 0, 1, [1, 1, 1, 1], 1], ["SP", 3, 5, 240, [3, 40, 2, 1], 1], ["SP", 3, 10, 10, [1, 5], 1], ["RE", 3, [0, 5, 1, 6, 2, 7, 10, 11, 3, 8, 12, 4, 9]], ["FSP", 4, 0, 2, 3], ["FSP", 4, 4, 3, 3], ["RE", 4, [0, 4, 1, 5, 2, 6, 3, 7]], ["CA", 3, 4, 5], ["CHR", 2, "shared", [3]], ["CA", 3, 4, 6], ["CHR", 1, "shared", [4]], ["CA", 2, 5, 6], ["FU", 9, [0, 1, 2, 3]], ["SP", 9, 0, 188160, [1], 1], ["AN", 9, 0, 5], ["AN", 9, 1, 6], ["FU", 6, [0, 1]], ["AN", 6, 0, 5], ["FU", 6, [1, 2]], ["AN", 6, 1, 4], ["FU", 6, [2, 3]], ["AN", 6, 2, 6], ["FU", 4, [0, 1]], ["SP", 4, 0, 10, [1], 1], ["AN", 4, 1, 2], ["FFSP", 4, 0, [3, 2], 1, 1], ["AN", 4, 1, 6], ["FU", 2, [0, 1]], ["SP", 2, 0, 5, [1], 1], ["AN", 2, 1, 2], ["FFSP", 2, 0, [3, 2], 1, 1], ["AN", 2, 1, 6], ["PR", 5, 0, "auto_unroll_max_step$512"]]]], "r": [[0.000263086, 0.000263094, 0.000263105], 0, 18.4033, 1662029086], "v": "v0.6"}
{"i": [["[\"fused_pointwise_conv_bias_add_sigmoid_mul\", 28, 28, 10, 240, 1]", "cuda -keys=cuda,gpu -max_num_threads=1024 -model=unknown -thread_warp_size=32", [-1, 16, 64, 49152, 2147483647, 1024, 8, 32], "", 0, []], [[], [["CI", 5], ["CHW", 3, "local"], ["SP", 3, 0, 1, [1, 1, 1, 1], 1], ["SP", 3, 5, 240, [1, 48, 1, 5], 1], ["SP", 3, 10, 10, [10, 1], 1], ["RE", 3, [0, 5, 1, 6, 2, 7, 10, 11, 3, 8, 12, 4, 9]], ["FSP", 4, 0, 2, 3], ["FSP", 4, 4, 3, 3], ["RE", 4, [0, 4, 1, 5, 2, 6, 3, 7]], ["CA", 3, 4, 5], ["CHR", 2, "shared", [3]], ["CA", 3, 4, 6], ["CHR", 1, "shared", [4]], ["CA", 2, 5, 6], ["FU", 9, [0, 1, 2, 3]], ["SP", 9, 0, 188160, [32], 1], ["AN", 9, 0, 5], ["AN", 9, 1, 6], ["FU", 6, [0, 1]], ["AN", 6, 0, 5], ["FU", 6, [1, 2]], ["AN", 6, 1, 4], ["FU", 6, [2, 3]], ["AN", 6, 2, 6], ["FU", 4, [0, 1]], ["SP", 4, 0, 10, [1], 1], ["AN", 4, 1, 2], ["FFSP", 4, 0, [3, 2], 1, 1], ["AN", 4, 1, 6], ["FU", 2, [0, 1]], ["SP", 2, 0, 10, [1], 1], ["AN", 2, 1, 2], ["FFSP", 2, 0, [3, 2], 1, 1], ["AN", 2, 1, 6], ["PR", 5, 0, "auto_unroll_max_step$16"]]]], "r": [[1.78051e-05, 1.78016e-05, 1.7803e-05], 0, 21.8668, 1662029090], "v": "v0.6"}
{"i": [["[\"fused_pointwise_conv_bias_add_sigmoid_mul\", 28, 28, 10, 240, 1]", "cuda -keys=cuda,gpu -max_num_threads=1024 -model=unknown -thread_warp_size=32", [-1, 16, 64, 49152, 2147483647, 1024, 8, 32], "", 0, []], [[], [["CI", 5], ["CHW", 3, "local"], ["SP", 3, 0, 1, [1, 1, 1, 1], 1], ["SP", 3, 5, 240, [1, 80, 3, 1], 1], ["SP", 3, 10, 10, [1, 2], 1], ["RE", 3, [0, 5, 1, 6, 2, 7, 10, 11, 3, 8, 12, 4, 9]], ["FSP", 4, 0, 2, 3], ["FSP", 4, 4, 3, 3], ["RE", 4, [0, 4, 1, 5, 2, 6, 3, 7]], ["CA", 3, 4, 5], ["CHR", 2, "shared", [3]], ["CA", 3, 4, 6], ["CHR", 1, "shared", [4]], ["CA", 2, 5, 6], ["FU", 9, [0, 1, 2, 3]], ["SP", 9, 0, 188160, [32], 1], ["AN", 9, 0, 5], ["AN", 9, 1, 6], ["FU", 6, [0, 1]], ["AN", 6, 0, 5], ["FU", 6, [1, 2]], ["AN", 6, 1, 4], ["FU", 6, [2, 3]], ["AN", 6, 2, 6], ["FU", 4, [0, 1]], ["SP", 4, 0, 12, [1], 1], ["AN", 4, 1, 2], ["FFSP", 4, 0, [3, 2], 1, 1], ["AN", 4, 1, 6], ["FU", 2, [0, 1]], ["SP", 2, 0, 2, [2], 1], ["AN", 2, 1, 2], ["FFSP", 2, 0, [3, 2], 1, 1], ["AN", 2, 1, 6], ["PR", 5, 0, "auto_unroll_max_step$0"]]]], "r": [[1.91107e-05, 1.91137e-05, 1.91119e-05], 0, 23.341, 1662029091], "v": "v0.6"}
{"i": [["[\"fused_pointwise_conv_bias_add_sigmoid_mul\", 28, 28, 10, 240, 1]", "cuda -keys=cuda,gpu -max_num_threads=1024 -model=unknown -thread_warp_size=32", [-1, 16, 64, 49152, 2147483647, 1024, 8, 32], "", 0, []], [[], [["CI", 5], ["CHW", 3, "local"], ["SP", 3, 0, 1, [1, 1, 1, 1], 1], ["SP", 3, 5, 240, [1, 40, 2, 1], 1], ["SP", 3, 10, 10, [10, 1], 1], ["RE", 3, [0, 5, 1, 6, 2, 7, 10, 11, 3, 8, 12, 4, 9]], ["FSP", 4, 0, 2, 3], ["FSP", 4, 4, 3, 3], ["RE", 4, [0, 4, 1, 5, 2, 6, 3, 7]], ["CA", 3, 4, 5], ["CHR", 2, "shared", [3]], ["CA", 3, 4, 6], ["CHR", 1, "shared", [4]], ["CA", 2, 5, 6], ["FU", 9, [0, 1, 2, 3]], ["SP", 9, 0, 188160, [8], 1], ["AN", 9, 0, 5], ["AN", 9, 1, 6], ["FU", 6, [0, 1]], ["AN", 6, 0, 5], ["FU", 6, [1, 2]], ["AN", 6, 1, 4], ["FU", 6, [2, 3]], ["AN", 6, 2, 6], ["FU", 4, [0, 1]], ["SP", 4, 0, 60, [1], 1], ["AN", 4, 1, 2], ["FFSP", 4, 0, [3, 2], 1, 1], ["AN", 4, 1, 6], ["FU", 2, [0, 1]], ["SP", 2, 0, 10, [1], 1], ["AN", 2, 1, 2], ["FFSP", 2, 0, [3, 2], 1, 1], ["AN", 2, 1, 6], ["PR", 5, 0, "auto_unroll_max_step$16"]]]], "r": [[4.22217e-05, 4.22525e-05, 4.22447e-05], 0, 22.3897, 1662029090], "v": "v0.6"}
{"i": [["[\"fused_pointwise_conv_bias_add_sigmoid_mul\", 28, 28, 10, 240, 1]", "cuda -keys=cuda,gpu -max_num_threads=1024 -model=unknown -thread_warp_size=32", [-1, 16, 64, 49152, 2147483647, 1024, 8, 32], "", 0, []], [[], [["CI", 5], ["CHW", 3, "local"], ["SP", 3, 0, 1, [1, 1, 1, 1], 1], ["SP", 3, 5, 240, [1, 60, 1, 1], 1], ["SP", 3, 10, 10, [10, 1], 1], ["RE", 3, [0, 5, 1, 6, 2, 7, 10, 11, 3, 8, 12, 4, 9]], ["FSP", 4, 0, 2, 3], ["FSP", 4, 4, 3, 3], ["RE", 4, [0, 4, 1, 5, 2, 6, 3, 7]], ["CA", 3, 4, 5], ["CHR", 2, "shared", [3]], ["CA", 3, 4, 6], ["CHR", 1, "shared", [4]], ["CA", 2, 5, 6], ["FU", 9, [0, 1, 2, 3]], ["SP", 9, 0, 188160, [16], 1], ["AN", 9, 0, 5], ["AN", 9, 1, 6], ["FU", 6, [0, 1]], ["AN", 6, 0, 5], ["FU", 6, [1, 2]], ["AN", 6, 1, 4], ["FU", 6, [2, 3]], ["AN", 6, 2, 6], ["FU", 4, [0, 1]], ["SP", 4, 0, 10, [1], 1], ["AN", 4, 1, 2], ["FFSP", 4, 0, [3, 2], 1, 1], ["AN", 4, 1, 6], ["FU", 2, [0, 1]], ["SP", 2, 0, 10, [2], 1], ["AN", 2, 1, 2], ["FFSP", 2, 0, [3, 2], 1, 1], ["AN", 2, 1, 6], ["PR", 5, 0, "auto_unroll_max_step$64"]]]], "r": [[2.5613e-05, 2.56137e-05, 2.56154e-05], 0, 20.0851, 1662029088], "v": "v0.6"}
{"i": [["[\"fused_pointwise_conv_bias_add_sigmoid_mul\", 28, 28, 10, 240, 1]", "cuda -keys=cuda,gpu -max_num_threads=1024 -model=unknown -thread_warp_size=32", [-1, 16, 64, 49152, 2147483647, 1024, 8, 32], "", 0, []], [[], [["CI", 5], ["CHW", 3, "local"], ["SP", 3, 0, 1, [1, 1, 1, 1], 1], ["SP", 3, 5, 240, [1, 4, 1, 15], 1], ["SP", 3, 10, 10, [2, 5], 1], ["RE", 3, [0, 5, 1, 6, 2, 7, 10, 11, 3, 8, 12, 4, 9]], ["FSP", 4, 0, 2, 3], ["FSP", 4, 4, 3, 3], ["RE", 4, [0, 4, 1, 5, 2, 6, 3, 7]], ["CA", 3, 4, 5], ["CHR", 2, "shared", [3]], ["CA", 3, 4, 6], ["CHR", 1, "shared", [4]], ["CA", 2, 5, 6], ["FU", 9, [0, 1, 2, 3]], ["SP", 9, 0, 188160, [4], 1], ["AN", 9, 0, 5], ["AN", 9, 1, 6], ["FU", 6, [0, 1]], ["AN", 6, 0, 5], ["FU", 6, [1, 2]], ["AN", 6, 1, 4], ["FU", 6, [2, 3]], ["AN", 6, 2, 6], ["FU", 4, [0, 1]], ["SP", 4, 0, 10, [1], 1], ["AN", 4, 1, 2], ["FFSP", 4, 0, [3, 2], 1, 1], ["AN", 4, 1, 6], ["FU", 2, [0, 1]], ["SP", 2, 0, 10, [1], 1], ["AN", 2, 1, 2], ["FFSP", 2, 0, [3, 2], 1, 1], ["AN", 2, 1, 6], ["PR", 5, 0, "auto_unroll_max_step$0"]]]], "r": [[8.05036e-05, 8.05088e-05, 8.05148e-05], 0, 17.7341, 1662029086], "v": "v0.6"}
