python/models/efficientnet/kernel_configs/efficient_fused_pointwise_conv_bias_add_sigmoid_mul_7_7_48_1152_1.log
{"i": [["[\"fused_pointwise_conv_bias_add_sigmoid_mul\", 7, 7, 48, 1152, 1]", "cuda -keys=cuda,gpu -max_num_threads=1024 -model=unknown -thread_warp_size=32", [-1, 16, 64, 49152, 2147483647, 1024, 8, 32], "", 0, []], [[], [["CI", 5], ["CHW", 3, "local"], ["SP", 3, 0, 1, [1, 1, 1, 1], 1], ["SP", 3, 5, 1152, [6, 64, 1, 3], 1], ["SP", 3, 10, 48, [1, 8], 1], ["RE", 3, [0, 5, 1, 6, 2, 7, 10, 11, 3, 8, 12, 4, 9]], ["FSP", 4, 0, 2, 3], ["FSP", 4, 4, 3, 3], ["RE", 4, [0, 4, 1, 5, 2, 6, 3, 7]], ["CA", 3, 4, 5], ["CHR", 2, "shared", [3]], ["CA", 3, 4, 6], ["CHR", 1, "shared", [4]], ["CA", 2, 5, 6], ["FU", 9, [0, 1, 2, 3]], ["SP", 9, 0, 56448, [32], 1], ["AN", 9, 0, 5], ["AN", 9, 1, 6], ["FU", 6, [0, 1]], ["AN", 6, 0, 5], ["FU", 6, [1, 2]], ["AN", 6, 1, 4], ["FU", 6, [2, 3]], ["AN", 6, 2, 6], ["FU", 4, [0, 1]], ["SP", 4, 0, 24, [1], 1], ["AN", 4, 1, 2], ["FFSP", 4, 0, [3, 2], 1, 1], ["AN", 4, 1, 6], ["FU", 2, [0, 1]], ["SP", 2, 0, 8, [1], 1], ["AN", 2, 1, 2], ["FFSP", 2, 0, [3, 2], 1, 1], ["AN", 2, 1, 6], ["PR", 5, 0, "auto_unroll_max_step$0"]]]], "r": [[3.16242e-05, 3.1653e-05, 3.16516e-05], 0, 2.46118, 1662032120], "v": "v0.6"}
{"i": [["[\"fused_pointwise_conv_bias_add_sigmoid_mul\", 7, 7, 48, 1152, 1]", "cuda -keys=cuda,gpu -max_num_threads=1024 -model=unknown -thread_warp_size=32", [-1, 16, 64, 49152, 2147483647, 1024, 8, 32], "", 0, []], [[], [["CI", 5], ["CHW", 3, "local"], ["SP", 3, 0, 1, [1, 1, 1, 1], 1], ["SP", 3, 5, 1152, [2, 32, 1, 2], 1], ["SP", 3, 10, 48, [1, 48], 1], ["RE", 3, [0, 5, 1, 6, 2, 7, 10, 11, 3, 8, 12, 4, 9]], ["FSP", 4, 0, 2, 3], ["FSP", 4, 4, 3, 3], ["RE", 4, [0, 4, 1, 5, 2, 6, 3, 7]], ["CA", 3, 4, 5], ["CHR", 2, "shared", [3]], ["CA", 3, 4, 6], ["CHR", 1, "shared", [4]], ["CA", 2, 5, 6], ["FU", 9, [0, 1, 2, 3]], ["SP", 9, 0, 56448, [64], 1], ["AN", 9, 0, 5], ["AN", 9, 1, 6], ["FU", 6, [0, 1]], ["AN", 6, 0, 5], ["FU", 6, [1, 2]], ["AN", 6, 1, 4], ["FU", 6, [2, 3]], ["AN", 6, 2, 6], ["FU", 4, [0, 1]], ["SP", 4, 0, 32, [1], 1], ["AN", 4, 1, 2], ["FFSP", 4, 0, [3, 2], 1, 1], ["AN", 4, 1, 6], ["FU", 2, [0, 1]], ["SP", 2, 0, 16, [16], 1], ["AN", 2, 1, 2], ["FFSP", 2, 0, [3, 2], 1, 1], ["AN", 2, 1, 6], ["PR", 5, 0, "auto_unroll_max_step$1024"]]]], "r": [[1.47666e-05, 1.47755e-05, 1.47673e-05], 0, 4.63763, 1662032121], "v": "v0.6"}
{"i": [["[\"fused_pointwise_conv_bias_add_sigmoid_mul\", 7, 7, 48, 1152, 1]", "cuda -keys=cuda,gpu -max_num_threads=1024 -model=unknown -thread_warp_size=32", [-1, 16, 64, 49152, 2147483647, 1024, 8, 32], "", 0, []], [[], [["CI", 5], ["CHW", 3, "local"], ["SP", 3, 0, 1, [1, 1, 1, 1], 1], ["SP", 3, 5, 1152, [1, 192, 1, 1], 1], ["SP", 3, 10, 48, [4, 4], 1], ["RE", 3, [0, 5, 1, 6, 2, 7, 10, 11, 3, 8, 12, 4, 9]], ["FSP", 4, 0, 2, 3], ["FSP", 4, 4, 3, 3], ["RE", 4, [0, 4, 1, 5, 2, 6, 3, 7]], ["CA", 3, 4, 5], ["CHR", 2, "shared", [3]], ["CA", 3, 4, 6], ["CHR", 1, "shared", [4]], ["CA", 2, 5, 6], ["FU", 9, [0, 1, 2, 3]], ["SP", 9, 0, 56448, [64], 1], ["AN", 9, 0, 5], ["AN", 9, 1, 6], ["FU", 6, [0, 1]], ["AN", 6, 0, 5], ["FU", 6, [1, 2]], ["AN", 6, 1, 4], ["FU", 6, [2, 3]], ["AN", 6, 2, 6], ["FU", 4, [0, 1]], ["SP", 4, 0, 16, [1], 1], ["AN", 4, 1, 2], ["FFSP", 4, 0, [3, 2], 1, 1], ["AN", 4, 1, 6], ["FU", 2, [0, 1]], ["SP", 2, 0, 16, [1], 1], ["AN", 2, 1, 2], ["FFSP", 2, 0, [3, 2], 1, 1], ["AN", 2, 1, 6], ["PR", 5, 0, "auto_unroll_max_step$16"]]]], "r": [[1.46151e-05, 1.46261e-05, 1.46182e-05], 0, 5.80883, 1662032123], "v": "v0.6"}
{"i": [["[\"fused_pointwise_conv_bias_add_sigmoid_mul\", 7, 7, 48, 1152, 1]", "cuda -keys=cuda,gpu -max_num_threads=1024 -model=unknown -thread_warp_size=32", [-1, 16, 64, 49152, 2147483647, 1024, 8, 32], "", 0, []], [[], [["CI", 5], ["CHW", 3, "local"], ["SP", 3, 0, 1, [1, 1, 1, 1], 1], ["SP", 3, 5, 1152, [2, 48, 1, 4], 1], ["SP", 3, 10, 48, [1, 8], 1], ["RE", 3, [0, 5, 1, 6, 2, 7, 10, 11, 3, 8, 12, 4, 9]], ["FSP", 4, 0, 2, 3], ["FSP", 4, 4, 3, 3], ["RE", 4, [0, 4, 1, 5, 2, 6, 3, 7]], ["CA", 3, 4, 5], ["CHR", 2, "shared", [3]], ["CA", 3, 4, 6], ["CHR", 1, "shared", [4]], ["CA", 2, 5, 6], ["FU", 9, [0, 1, 2, 3]], ["SP", 9, 0, 56448, [8], 1], ["AN", 9, 0, 5], ["AN", 9, 1, 6], ["FU", 6, [0, 1]], ["AN", 6, 0, 5], ["FU", 6, [1, 2]], ["AN", 6, 1, 4], ["FU", 6, [2, 3]], ["AN", 6, 2, 6], ["FU", 4, [0, 1]], ["SP", 4, 0, 16, [1], 1], ["AN", 4, 1, 2], ["FFSP", 4, 0, [3, 2], 1, 1], ["AN", 4, 1, 6], ["FU", 2, [0, 1]], ["SP", 2, 0, 4, [2], 1], ["AN", 2, 1, 2], ["FFSP", 2, 0, [3, 2], 1, 1], ["AN", 2, 1, 6], ["PR", 5, 0, "auto_unroll_max_step$512"]]]], "r": [[4.13527e-05, 4.13764e-05, 4.13759e-05], 0, 6.73478, 1662032124], "v": "v0.6"}
{"i": [["[\"fused_pointwise_conv_bias_add_sigmoid_mul\", 7, 7, 48, 1152, 1]", "cuda -keys=cuda,gpu -max_num_threads=1024 -model=unknown -thread_warp_size=32", [-1, 16, 64, 49152, 2147483647, 1024, 8, 32], "", 0, []], [[], [["CI", 5], ["CHW", 3, "local"], ["SP", 3, 0, 1, [1, 1, 1, 1], 1], ["SP", 3, 5, 1152, [1, 2, 1, 64], 1], ["SP", 3, 10, 48, [1, 48], 1], ["RE", 3, [0, 5, 1, 6, 2, 7, 10, 11, 3, 8, 12, 4, 9]], ["FSP", 4, 0, 2, 3], ["FSP", 4, 4, 3, 3], ["RE", 4, [0, 4, 1, 5, 2, 6, 3, 7]], ["CA", 3, 4, 5], ["CHR", 2, "shared", [3]], ["CA", 3, 4, 6], ["CHR", 1, "shared", [4]], ["CA", 2, 5, 6], ["FU", 9, [0, 1, 2, 3]], ["SP", 9, 0, 56448, [64], 1], ["AN", 9, 0, 5], ["AN", 9, 1, 6], ["FU", 6, [0, 1]], ["AN", 6, 0, 5], ["FU", 6, [1, 2]], ["AN", 6, 1, 4], ["FU", 6, [2, 3]], ["AN", 6, 2, 6], ["FU", 4, [0, 1]], ["SP", 4, 0, 192, [1], 1], ["AN", 4, 1, 2], ["FFSP", 4, 0, [3, 2], 1, 1], ["AN", 4, 1, 6], ["FU", 2, [0, 1]], ["SP", 2, 0, 48, [1], 1], ["AN", 2, 1, 2], ["FFSP", 2, 0, [3, 2], 1, 1], ["AN", 2, 1, 6], ["PR", 5, 0, "auto_unroll_max_step$512"]]]], "r": [[0.000195168, 0.000195169, 0.000195167], 0, 4.63356, 1662032122], "v": "v0.6"}
{"i": [["[\"fused_pointwise_conv_bias_add_sigmoid_mul\", 7, 7, 48, 1152, 1]", "cuda -keys=cuda,gpu -max_num_threads=1024 -model=unknown -thread_warp_size=32", [-1, 16, 64, 49152, 2147483647, 1024, 8, 32], "", 0, []], [[], [["CI", 5], ["CHW", 3, "local"], ["SP", 3, 0, 1, [1, 1, 1, 1], 1], ["SP", 3, 5, 1152, [1, 48, 24, 1], 1], ["SP", 3, 10, 48, [2, 1], 1], ["RE", 3, [0, 5, 1, 6, 2, 7, 10, 11, 3, 8, 12, 4, 9]], ["FSP", 4, 0, 2, 3], ["FSP", 4, 4, 3, 3], ["RE", 4, [0, 4, 1, 5, 2, 6, 3, 7]], ["CA", 3, 4, 5], ["CHR", 2, "shared", [3]], ["CA", 3, 4, 6], ["CHR", 1, "shared", [4]], ["CA", 2, 5, 6], ["FU", 9, [0, 1, 2, 3]], ["SP", 9, 0, 56448, [32], 1], ["AN", 9, 0, 5], ["AN", 9, 1, 6], ["FU", 6, [0, 1]], ["AN", 6, 0, 5], ["FU", 6, [1, 2]], ["AN", 6, 1, 4], ["FU", 6, [2, 3]], ["AN", 6, 2, 6], ["FU", 4, [0, 1]], ["SP", 4, 0, 192, [1], 1], ["AN", 4, 1, 2], ["FFSP", 4, 0, [3, 2], 1, 1], ["AN", 4, 1, 6], ["FU", 2, [0, 1]], ["SP", 2, 0, 8, [1], 1], ["AN", 2, 1, 2], ["FFSP", 2, 0, [3, 2], 1, 1], ["AN", 2, 1, 6], ["PR", 5, 0, "auto_unroll_max_step$0"]]]], "r": [[8.05747e-05, 5.60212e-05, 5.60155e-05], 0, 1.98694, 1662032119], "v": "v0.6"}
{"i": [["[\"fused_pointwise_conv_bias_add_sigmoid_mul\", 7, 7, 48, 1152, 1]", "cuda -keys=cuda,gpu -max_num_threads=1024 -model=unknown -thread_warp_size=32", [-1, 16, 64, 49152, 2147483647, 1024, 8, 32], "", 0, []], [[], [["CI", 5], ["CHW", 3, "local"], ["SP", 3, 0, 1, [1, 1, 1, 1], 1], ["SP", 3, 5, 1152, [4, 72, 1, 1], 1], ["SP", 3, 10, 48, [1, 2], 1], ["RE", 3, [0, 5, 1, 6, 2, 7, 10, 11, 3, 8, 12, 4, 9]], ["FSP", 4, 0, 2, 3], ["FSP", 4, 4, 3, 3], ["RE", 4, [0, 4, 1, 5, 2, 6, 3, 7]], ["CA", 3, 4, 5], ["CHR", 2, "shared", [3]], ["CA", 3, 4, 6], ["CHR", 1, "shared", [4]], ["CA", 2, 5, 6], ["FU", 9, [0, 1, 2, 3]], ["SP", 9, 0, 56448, [2], 1], ["AN", 9, 0, 5], ["AN", 9, 1, 6], ["FU", 6, [0, 1]], ["AN", 6, 0, 5], ["FU", 6, [1, 2]], ["AN", 6, 1, 4], ["FU", 6, [2, 3]], ["AN", 6, 2, 6], ["FU", 4, [0, 1]], ["SP", 4, 0, 2, [2], 1], ["AN", 4, 1, 2], ["FFSP", 4, 0, [3, 2], 1, 1], ["AN", 4, 1, 6], ["FU", 2, [0, 1]], ["SP", 2, 0, 2, [1], 1], ["AN", 2, 1, 2], ["FFSP", 2, 0, [3, 2], 1, 1], ["AN", 2, 1, 6], ["PR", 5, 0, "auto_unroll_max_step$0"]]]], "r": [[5.93995e-05, 5.93893e-05, 5.94005e-05], 0, 5.12111, 1662032122], "v": "v0.6"}
{"i": [["[\"fused_pointwise_conv_bias_add_sigmoid_mul\", 7, 7, 48, 1152, 1]", "cuda -keys=cuda,gpu -max_num_threads=1024 -model=unknown -thread_warp_size=32", [-1, 16, 64, 49152, 2147483647, 1024, 8, 32], "", 0, []], [[], [["CI", 5], ["CHW", 3, "local"], ["SP", 3, 0, 1, [1, 1, 1, 1], 1], ["SP", 3, 5, 1152, [1, 384, 1, 3], 1], ["SP", 3, 10, 48, [1, 2], 1], ["RE", 3, [0, 5, 1, 6, 2, 7, 10, 11, 3, 8, 12, 4, 9]], ["FSP", 4, 0, 2, 3], ["FSP", 4, 4, 3, 3], ["RE", 4, [0, 4, 1, 5, 2, 6, 3, 7]], ["CA", 3, 4, 5], ["CHR", 2, "shared", [3]], ["CA", 3, 4, 6], ["CHR", 1, "shared", [4]], ["CA", 2, 5, 6], ["FU", 9, [0, 1, 2, 3]], ["SP", 9, 0, 56448, [16], 1], ["AN", 9, 0, 5], ["AN", 9, 1, 6], ["FU", 6, [0, 1]], ["AN", 6, 0, 5], ["FU", 6, [1, 2]], ["AN", 6, 1, 4], ["FU", 6, [2, 3]], ["AN", 6, 2, 6], ["FU", 4, [0, 1]], ["SP", 4, 0, 6, [1], 1], ["AN", 4, 1, 2], ["FFSP", 4, 0, [3, 2], 1, 1], ["AN", 4, 1, 6], ["FU", 2, [0, 1]], ["SP", 2, 0, 2, [1], 1], ["AN", 2, 1, 2], ["FFSP", 2, 0, [3, 2], 1, 1], ["AN", 2, 1, 6], ["PR", 5, 0, "auto_unroll_max_step$512"]]]], "r": [[2.60071e-05, 2.60009e-05, 2.60001e-05], 0, 10.9144, 1662032128], "v": "v0.6"}
{"i": [["[\"fused_pointwise_conv_bias_add_sigmoid_mul\", 7, 7, 48, 1152, 1]", "cuda -keys=cuda,gpu -max_num_threads=1024 -model=unknown -thread_warp_size=32", [-1, 16, 64, 49152, 2147483647, 1024, 8, 32], "", 0, []], [[], [["CI", 5], ["CHW", 3, "local"], ["SP", 3, 0, 1, [1, 1, 1, 1], 1], ["SP", 3, 5, 1152, [3, 32, 1, 3], 1], ["SP", 3, 10, 48, [1, 4], 1], ["RE", 3, [0, 5, 1, 6, 2, 7, 10, 11, 3, 8, 12, 4, 9]], ["FSP", 4, 0, 2, 3], ["FSP", 4, 4, 3, 3], ["RE", 4, [0, 4, 1, 5, 2, 6, 3, 7]], ["CA", 3, 4, 5], ["CHR", 2, "shared", [3]], ["CA", 3, 4, 6], ["CHR", 1, "shared", [4]], ["CA", 2, 5, 6], ["FU", 9, [0, 1, 2, 3]], ["SP", 9, 0, 56448, [32], 1], ["AN", 9, 0, 5], ["AN", 9, 1, 6], ["FU", 6, [0, 1]], ["AN", 6, 0, 5], ["FU", 6, [1, 2]], ["AN", 6, 1, 4], ["FU", 6, [2, 3]], ["AN", 6, 2, 6], ["FU", 4, [0, 1]], ["SP", 4, 0, 12, [2], 1], ["AN", 4, 1, 2], ["FFSP", 4, 0, [3, 2], 1, 1], ["AN", 4, 1, 6], ["FU", 2, [0, 1]], ["SP", 2, 0, 4, [1], 1], ["AN", 2, 1, 2], ["FFSP", 2, 0, [3, 2], 1, 1], ["AN", 2, 1, 6], ["PR", 5, 0, "auto_unroll_max_step$1024"]]]], "r": [[2.74544e-05, 2.74426e-05, 2.74436e-05], 0, 8.3181, 1662032125], "v": "v0.6"}
{"i": [["[\"fused_pointwise_conv_bias_add_sigmoid_mul\", 7, 7, 48, 1152, 1]", "cuda -keys=cuda,gpu -max_num_threads=1024 -model=unknown -thread_warp_size=32", [-1, 16, 64, 49152, 2147483647, 1024, 8, 32], "", 0, []], [[], [["CI", 5], ["CHW", 3, "local"], ["SP", 3, 0, 1, [1, 1, 1, 1], 1], ["SP", 3, 5, 1152, [8, 36, 1, 1], 1], ["SP", 3, 10, 48, [2, 2], 1], ["RE", 3, [0, 5, 1, 6, 2, 7, 10, 11, 3, 8, 12, 4, 9]], ["FSP", 4, 0, 2, 3], ["FSP", 4, 4, 3, 3], ["RE", 4, [0, 4, 1, 5, 2, 6, 3, 7]], ["CA", 3, 4, 5], ["CHR", 2, "shared", [3]], ["CA", 3, 4, 6], ["CHR", 1, "shared", [4]], ["CA", 2, 5, 6], ["FU", 9, [0, 1, 2, 3]], ["SP", 9, 0, 56448, [32], 1], ["AN", 9, 0, 5], ["AN", 9, 1, 6], ["FU", 6, [0, 1]], ["AN", 6, 0, 5], ["FU", 6, [1, 2]], ["AN", 6, 1, 4], ["FU", 6, [2, 3]], ["AN", 6, 2, 6], ["FU", 4, [0, 1]], ["SP", 4, 0, 4, [1], 1], ["AN", 4, 1, 2], ["FFSP", 4, 0, [3, 2], 1, 1], ["AN", 4, 1, 6], ["FU", 2, [0, 1]], ["SP", 2, 0, 4, [1], 1], ["AN", 2, 1, 2], ["FFSP", 2, 0, [3, 2], 1, 1], ["AN", 2, 1, 6], ["PR", 5, 0, "auto_unroll_max_step$1024"]]]], "r": [[2.9819e-05, 2.98162e-05, 2.98142e-05], 0, 12.3397, 1662032129], "v": "v0.6"}
{"i": [["[\"fused_pointwise_conv_bias_add_sigmoid_mul\", 7, 7, 48, 1152, 1]", "cuda -keys=cuda,gpu -max_num_threads=1024 -model=unknown -thread_warp_size=32", [-1, 16, 64, 49152, 2147483647, 1024, 8, 32], "", 0, []], [[], [["CI", 5], ["CHW", 3, "local"], ["SP", 3, 0, 1, [1, 1, 1, 1], 1], ["SP", 3, 5, 1152, [2, 32, 9, 1], 1], ["SP", 3, 10, 48, [12, 1], 1], ["RE", 3, [0, 5, 1, 6, 2, 7, 10, 11, 3, 8, 12, 4, 9]], ["FSP", 4, 0, 2, 3], ["FSP", 4, 4, 3, 3], ["RE", 4, [0, 4, 1, 5, 2, 6, 3, 7]], ["CA", 3, 4, 5], ["CHR", 2, "shared", [3]], ["CA", 3, 4, 6], ["CHR", 1, "shared", [4]], ["CA", 2, 5, 6], ["FU", 9, [0, 1, 2, 3]], ["SP", 9, 0, 56448, [2], 1], ["AN", 9, 0, 5], ["AN", 9, 1, 6], ["FU", 6, [0, 1]], ["AN", 6, 0, 5], ["FU", 6, [1, 2]], ["AN", 6, 1, 4], ["FU", 6, [2, 3]], ["AN", 6, 2, 6], ["FU", 4, [0, 1]], ["SP", 4, 0, 108, [4], 1], ["AN", 4, 1, 2], ["FFSP", 4, 0, [3, 2], 1, 1], ["AN", 4, 1, 6], ["FU", 2, [0, 1]], ["SP", 2, 0, 12, [1], 1], ["AN", 2, 1, 2], ["FFSP", 2, 0, [3, 2], 1, 1], ["AN", 2, 1, 6], ["PR", 5, 0, "auto_unroll_max_step$64"]]]], "r": [[5.99558e-05, 5.99603e-05, 5.99625e-05], 0, 6.92766, 1662032124], "v": "v0.6"}
{"i": [["[\"fused_pointwise_conv_bias_add_sigmoid_mul\", 7, 7, 48, 1152, 1]", "cuda -keys=cuda,gpu -max_num_threads=1024 -model=unknown -thread_warp_size=32", [-1, 16, 64, 49152, 2147483647, 1024, 8, 32], "", 0, []], [[], [["CI", 5], ["CHW", 3, "local"], ["SP", 3, 0, 1, [1, 1, 1, 1], 1], ["SP", 3, 5, 1152, [2, 32, 3, 6], 1], ["SP", 3, 10, 48, [1, 1], 1], ["RE", 3, [0, 5, 1, 6, 2, 7, 10, 11, 3, 8, 12, 4, 9]], ["FSP", 4, 0, 2, 3], ["FSP", 4, 4, 3, 3], ["RE", 4, [0, 4, 1, 5, 2, 6, 3, 7]], ["CA", 3, 4, 5], ["CHR", 2, "shared", [3]], ["CA", 3, 4, 6], ["CHR", 1, "shared", [4]], ["CA", 2, 5, 6], ["FU", 9, [0, 1, 2, 3]], ["SP", 9, 0, 56448, [32], 1], ["AN", 9, 0, 5], ["AN", 9, 1, 6], ["FU", 6, [0, 1]], ["AN", 6, 0, 5], ["FU", 6, [1, 2]], ["AN", 6, 1, 4], ["FU", 6, [2, 3]], ["AN", 6, 2, 6], ["FU", 4, [0, 1]], ["SP", 4, 0, 144, [1], 1], ["AN", 4, 1, 2], ["FFSP", 4, 0, [3, 2], 1, 1], ["AN", 4, 1, 6], ["FU", 2, [0, 1]], ["SP", 2, 0, 8, [1], 1], ["AN", 2, 1, 2], ["FFSP", 2, 0, [3, 2], 1, 1], ["AN", 2, 1, 6], ["PR", 5, 0, "auto_unroll_max_step$16"]]]], "r": [[7.50108e-05, 7.50114e-05, 7.50151e-05], 0, 8.98524, 1662032126], "v": "v0.6"}
{"i": [["[\"fused_pointwise_conv_bias_add_sigmoid_mul\", 7, 7, 48, 1152, 1]", "cuda -keys=cuda,gpu -max_num_threads=1024 -model=unknown -thread_warp_size=32", [-1, 16, 64, 49152, 2147483647, 1024, 8, 32], "", 0, []], [[], [["CI", 5], ["CHW", 3, "local"], ["SP", 3, 0, 1, [1, 1, 1, 1], 1], ["SP", 3, 5, 1152, [1, 32, 1, 4], 1], ["SP", 3, 10, 48, [12, 4], 1], ["RE", 3, [0, 5, 1, 6, 2, 7, 10, 11, 3, 8, 12, 4, 9]], ["FSP", 4, 0, 2, 3], ["FSP", 4, 4, 3, 3], ["RE", 4, [0, 4, 1, 5, 2, 6, 3, 7]], ["CA", 3, 4, 5], ["CHR", 2, "shared", [3]], ["CA", 3, 4, 6], ["CHR", 1, "shared", [4]], ["CA", 2, 5, 6], ["FU", 9, [0, 1, 2, 3]], ["SP", 9, 0, 56448, [32], 1], ["AN", 9, 0, 5], ["AN", 9, 1, 6], ["FU", 6, [0, 1]], ["AN", 6, 0, 5], ["FU", 6, [1, 2]], ["AN", 6, 1, 4], ["FU", 6, [2, 3]], ["AN", 6, 2, 6], ["FU", 4, [0, 1]], ["SP", 4, 0, 192, [1], 1], ["AN", 4, 1, 2], ["FFSP", 4, 0, [3, 2], 1, 1], ["AN", 4, 1, 6], ["FU", 2, [0, 1]], ["SP", 2, 0, 48, [1], 1], ["AN", 2, 1, 2], ["FFSP", 2, 0, [3, 2], 1, 1], ["AN", 2, 1, 6], ["PR", 5, 0, "auto_unroll_max_step$512"]]]], "r": [[1.62368e-05, 1.62367e-05, 1.62376e-05], 0, 10.5025, 1662032128], "v": "v0.6"}
{"i": [["[\"fused_pointwise_conv_bias_add_sigmoid_mul\", 7, 7, 48, 1152, 1]", "cuda -keys=cuda,gpu -max_num_threads=1024 -model=unknown -thread_warp_size=32", [-1, 16, 64, 49152, 2147483647, 1024, 8, 32], "", 0, []], [[], [["CI", 5], ["CHW", 3, "local"], ["SP", 3, 0, 1, [1, 1, 1, 1], 1], ["SP", 3, 5, 1152, [1, 96, 1, 3], 1], ["SP", 3, 10, 48, [1, 3], 1], ["RE", 3, [0, 5, 1, 6, 2, 7, 10, 11, 3, 8, 12, 4, 9]], ["FSP", 4, 0, 2, 3], ["FSP", 4, 4, 3, 3], ["RE", 4, [0, 4, 1, 5, 2, 6, 3, 7]], ["CA", 3, 4, 5], ["CHR", 2, "shared", [3]], ["CA", 3, 4, 6], ["CHR", 1, "shared", [4]], ["CA", 2, 5, 6], ["FU", 9, [0, 1, 2, 3]], ["SP", 9, 0, 56448, [32], 1], ["AN", 9, 0, 5], ["AN", 9, 1, 6], ["FU", 6, [0, 1]], ["AN", 6, 0, 5], ["FU", 6, [1, 2]], ["AN", 6, 1, 4], ["FU", 6, [2, 3]], ["AN", 6, 2, 6], ["FU", 4, [0, 1]], ["SP", 4, 0, 36, [1], 1], ["AN", 4, 1, 2], ["FFSP", 4, 0, [3, 2], 1, 1], ["AN", 4, 1, 6], ["FU", 2, [0, 1]], ["SP", 2, 0, 12, [1], 1], ["AN", 2, 1, 2], ["FFSP", 2, 0, [3, 2], 1, 1], ["AN", 2, 1, 6], ["PR", 5, 0, "auto_unroll_max_step$1024"]]]], "r": [[2.12419e-05, 2.12484e-05, 2.12416e-05], 0, 12.0699, 1662032130], "v": "v0.6"}
{"i": [["[\"fused_pointwise_conv_bias_add_sigmoid_mul\", 7, 7, 48, 1152, 1]", "cuda -keys=cuda,gpu -max_num_threads=1024 -model=unknown -thread_warp_size=32", [-1, 16, 64, 49152, 2147483647, 1024, 8, 32], "", 0, []], [[], [["CI", 5], ["CHW", 3, "local"], ["SP", 3, 0, 1, [1, 1, 1, 1], 1], ["SP", 3, 5, 1152, [2, 576, 1, 1], 1], ["SP", 3, 10, 48, [1, 2], 1], ["RE", 3, [0, 5, 1, 6, 2, 7, 10, 11, 3, 8, 12, 4, 9]], ["FSP", 4, 0, 2, 3], ["FSP", 4, 4, 3, 3], ["RE", 4, [0, 4, 1, 5, 2, 6, 3, 7]], ["CA", 3, 4, 5], ["CHR", 2, "shared", [3]], ["CA", 3, 4, 6], ["CHR", 1, "shared", [4]], ["CA", 2, 5, 6], ["FU", 9, [0, 1, 2, 3]], ["SP", 9, 0, 56448, [16], 1], ["AN", 9, 0, 5], ["AN", 9, 1, 6], ["FU", 6, [0, 1]], ["AN", 6, 0, 5], ["FU", 6, [1, 2]], ["AN", 6, 1, 4], ["FU", 6, [2, 3]], ["AN", 6, 2, 6], ["FU", 4, [0, 1]], ["SP", 4, 0, 6, [1], 1], ["AN", 4, 1, 2], ["FFSP", 4, 0, [3, 2], 1, 1], ["AN", 4, 1, 6], ["FU", 2, [0, 1]], ["SP", 2, 0, 2, [1], 1], ["AN", 2, 1, 2], ["FFSP", 2, 0, [3, 2], 1, 1], ["AN", 2, 1, 6], ["PR", 5, 0, "auto_unroll_max_step$512"]]]], "r": [[2.65403e-05, 2.65385e-05, 2.65403e-05], 0, 13.7698, 1662032131], "v": "v0.6"}
{"i": [["[\"fused_pointwise_conv_bias_add_sigmoid_mul\", 7, 7, 48, 1152, 1]", "cuda -keys=cuda,gpu -max_num_threads=1024 -model=unknown -thread_warp_size=32", [-1, 16, 64, 49152, 2147483647, 1024, 8, 32], "", 0, []], [[], [["CI", 5], ["CHW", 3, "local"], ["SP", 3, 0, 1, [1, 1, 1, 1], 1], ["SP", 3, 5, 1152, [2, 288, 1, 2], 1], ["SP", 3, 10, 48, [8, 1], 1], ["RE", 3, [0, 5, 1, 6, 2, 7, 10, 11, 3, 8, 12, 4, 9]], ["FSP", 4, 0, 2, 3], ["FSP", 4, 4, 3, 3], ["RE", 4, [0, 4, 1, 5, 2, 6, 3, 7]], ["CA", 3, 4, 5], ["CHR", 2, "shared", [3]], ["CA", 3, 4, 6], ["CHR", 1, "shared", [4]], ["CA", 2, 5, 6], ["FU", 9, [0, 1, 2, 3]], ["SP", 9, 0, 56448, [4], 1], ["AN", 9, 0, 5], ["AN", 9, 1, 6], ["FU", 6, [0, 1]], ["AN", 6, 0, 5], ["FU", 6, [1, 2]], ["AN", 6, 1, 4], ["FU", 6, [2, 3]], ["AN", 6, 2, 6], ["FU", 4, [0, 1]], ["SP", 4, 0, 16, [2], 1], ["AN", 4, 1, 2], ["FFSP", 4, 0, [3, 2], 1, 1], ["AN", 4, 1, 6], ["FU", 2, [0, 1]], ["SP", 2, 0, 8, [4], 1], ["AN", 2, 1, 2], ["FFSP", 2, 0, [3, 2], 1, 1], ["AN", 2, 1, 6], ["PR", 5, 0, "auto_unroll_max_step$64"]]]], "r": [[3.95003e-05, 3.95273e-05, 3.95246e-05], 0, 13.81, 1662032132], "v": "v0.6"}
{"i": [["[\"fused_pointwise_conv_bias_add_sigmoid_mul\", 7, 7, 48, 1152, 1]", "cuda -keys=cuda,gpu -max_num_threads=1024 -model=unknown -thread_warp_size=32", [-1, 16, 64, 49152, 2147483647, 1024, 8, 32], "", 0, []], [[], [["CI", 5], ["CHW", 3, "local"], ["SP", 3, 0, 1, [1, 1, 1, 1], 1], ["SP", 3, 5, 1152, [2, 32, 3, 6], 1], ["SP", 3, 10, 48, [8, 1], 1], ["RE", 3, [0, 5, 1, 6, 2, 7, 10, 11, 3, 8, 12, 4, 9]], ["FSP", 4, 0, 2, 3], ["FSP", 4, 4, 3, 3], ["RE", 4, [0, 4, 1, 5, 2, 6, 3, 7]], ["CA", 3, 4, 5], ["CHR", 2, "shared", [3]], ["CA", 3, 4, 6], ["CHR", 1, "shared", [4]], ["CA", 2, 5, 6], ["FU", 9, [0, 1, 2, 3]], ["SP", 9, 0, 56448, [32], 1], ["AN", 9, 0, 5], ["AN", 9, 1, 6], ["FU", 6, [0, 1]], ["AN", 6, 0, 5], ["FU", 6, [1, 2]], ["AN", 6, 1, 4], ["FU", 6, [2, 3]], ["AN", 6, 2, 6], ["FU", 4, [0, 1]], ["SP", 4, 0, 144, [1], 1], ["AN", 4, 1, 2], ["FFSP", 4, 0, [3, 2], 1, 1], ["AN", 4, 1, 6], ["FU", 2, [0, 1]], ["SP", 2, 0, 8, [1], 1], ["AN", 2, 1, 2], ["FFSP", 2, 0, [3, 2], 1, 1], ["AN", 2, 1, 6], ["PR", 5, 0, "auto_unroll_max_step$16"]]]], "r": [[5.30484e-05, 5.30782e-05, 5.30741e-05], 0, 12.539, 1662032130], "v": "v0.6"}
{"i": [["[\"fused_pointwise_conv_bias_add_sigmoid_mul\", 7, 7, 48, 1152, 1]", "cuda -keys=cuda,gpu -max_num_threads=1024 -model=unknown -thread_warp_size=32", [-1, 16, 64, 49152, 2147483647, 1024, 8, 32], "", 0, []], [[], [["CI", 5], ["CHW", 3, "local"], ["SP", 3, 0, 1, [1, 1, 1, 1], 1], ["SP", 3, 5, 1152, [2, 32, 1, 3], 1], ["SP", 3, 10, 48, [1, 2], 1], ["RE", 3, [0, 5, 1, 6, 2, 7, 10, 11, 3, 8, 12, 4, 9]], ["FSP", 4, 0, 2, 3], ["FSP", 4, 4, 3, 3], ["RE", 4, [0, 4, 1, 5, 2, 6, 3, 7]], ["CA", 3, 4, 5], ["CHR", 2, "shared", [3]], ["CA", 3, 4, 6], ["CHR", 1, "shared", [4]], ["CA", 2, 5, 6], ["FU", 9, [0, 1, 2, 3]], ["SP", 9, 0, 56448, [16], 1], ["AN", 9, 0, 5], ["AN", 9, 1, 6], ["FU", 6, [0, 1]], ["AN", 6, 0, 5], ["FU", 6, [1, 2]], ["AN", 6, 1, 4], ["FU", 6, [2, 3]], ["AN", 6, 2, 6], ["FU", 4, [0, 1]], ["SP", 4, 0, 6, [1], 1], ["AN", 4, 1, 2], ["FFSP", 4, 0, [3, 2], 1, 1], ["AN", 4, 1, 6], ["FU", 2, [0, 1]], ["SP", 2, 0, 2, [1], 1], ["AN", 2, 1, 2], ["FFSP", 2, 0, [3, 2], 1, 1], ["AN", 2, 1, 6], ["PR", 5, 0, "auto_unroll_max_step$512"]]]], "r": [[2.75562e-05, 2.7551e-05, 2.75573e-05], 0, 12.7397, 1662032131], "v": "v0.6"}
{"i": [["[\"fused_pointwise_conv_bias_add_sigmoid_mul\", 7, 7, 48, 1152, 1]", "cuda -keys=cuda,gpu -max_num_threads=1024 -model=unknown -thread_warp_size=32", [-1, 16, 64, 49152, 2147483647, 1024, 8, 32], "", 0, []], [[], [["CI", 5], ["CHW", 3, "local"], ["SP", 3, 0, 1, [1, 1, 1, 1], 1], ["SP", 3, 5, 1152, [8, 48, 3, 1], 1], ["SP", 3, 10, 48, [2, 3], 1], ["RE", 3, [0, 5, 1, 6, 2, 7, 10, 11, 3, 8, 12, 4, 9]], ["FSP", 4, 0, 2, 3], ["FSP", 4, 4, 3, 3], ["RE", 4, [0, 4, 1, 5, 2, 6, 3, 7]], ["CA", 3, 4, 5], ["CHR", 2, "shared", [3]], ["CA", 3, 4, 6], ["CHR", 1, "shared", [4]], ["CA", 2, 5, 6], ["FU", 9, [0, 1, 2, 3]], ["SP", 9, 0, 56448, [32], 1], ["AN", 9, 0, 5], ["AN", 9, 1, 6], ["FU", 6, [0, 1]], ["AN", 6, 0, 5], ["FU", 6, [1, 2]], ["AN", 6, 1, 4], ["FU", 6, [2, 3]], ["AN", 6, 2, 6], ["FU", 4, [0, 1]], ["SP", 4, 0, 18, [3], 1], ["AN", 4, 1, 2], ["FFSP", 4, 0, [3, 2], 1, 1], ["AN", 4, 1, 6], ["FU", 2, [0, 1]], ["SP", 2, 0, 6, [2], 1], ["AN", 2, 1, 2], ["FFSP", 2, 0, [3, 2], 1, 1], ["AN", 2, 1, 6], ["PR", 5, 0, "auto_unroll_max_step$1024"]]]], "r": [[3.74975e-05, 3.75097e-05, 3.75167e-05], 0, 9.568, 1662032127], "v": "v0.6"}
{"i": [["[\"fused_pointwise_conv_bias_add_sigmoid_mul\", 7, 7, 48, 1152, 1]", "cuda -keys=cuda,gpu -max_num_threads=1024 -model=unknown -thread_warp_size=32", [-1, 16, 64, 49152, 2147483647, 1024, 8, 32], "", 0, []], [[], [["CI", 5], ["CHW", 3, "local"], ["SP", 3, 0, 1, [1, 1, 1, 1], 1], ["SP", 3, 5, 1152, [2, 64, 1, 1], 1], ["SP", 3, 10, 48, [8, 2], 1], ["RE", 3, [0, 5, 1, 6, 2, 7, 10, 11, 3, 8, 12, 4, 9]], ["FSP", 4, 0, 2, 3], ["FSP", 4, 4, 3, 3], ["RE", 4, [0, 4, 1, 5, 2, 6, 3, 7]], ["CA", 3, 4, 5], ["CHR", 2, "shared", [3]], ["CA", 3, 4, 6], ["CHR", 1, "shared", [4]], ["CA", 2, 5, 6], ["FU", 9, [0, 1, 2, 3]], ["SP", 9, 0, 56448, [32], 1], ["AN", 9, 0, 5], ["AN", 9, 1, 6], ["FU", 6, [0, 1]], ["AN", 6, 0, 5], ["FU", 6, [1, 2]], ["AN", 6, 1, 4], ["FU", 6, [2, 3]], ["AN", 6, 2, 6], ["FU", 4, [0, 1]], ["SP", 4, 0, 32, [2], 1], ["AN", 4, 1, 2], ["FFSP", 4, 0, [3, 2], 1, 1], ["AN", 4, 1, 6], ["FU", 2, [0, 1]], ["SP", 2, 0, 16, [1], 1], ["AN", 2, 1, 2], ["FFSP", 2, 0, [3, 2], 1, 1], ["AN", 2, 1, 6], ["PR", 5, 0, "auto_unroll_max_step$1024"]]]], "r": [[1.50124e-05, 1.50133e-05, 1.50118e-05], 0, 16.7658, 1662032135], "v": "v0.6"}
{"i": [["[\"fused_pointwise_conv_bias_add_sigmoid_mul\", 7, 7, 48, 1152, 1]", "cuda -keys=cuda,gpu -max_num_threads=1024 -model=unknown -thread_warp_size=32", [-1, 16, 64, 49152, 2147483647, 1024, 8, 32], "", 0, []], [[], [["CI", 5], ["CHW", 3, "local"], ["SP", 3, 0, 1, [1, 1, 1, 1], 1], ["SP", 3, 5, 1152, [3, 32, 1, 3], 1], ["SP", 3, 10, 48, [1, 1], 1], ["RE", 3, [0, 5, 1, 6, 2, 7, 10, 11, 3, 8, 12, 4, 9]], ["FSP", 4, 0, 2, 3], ["FSP", 4, 4, 3, 3], ["RE", 4, [0, 4, 1, 5, 2, 6, 3, 7]], ["CA", 3, 4, 5], ["CHR", 2, "shared", [3]], ["CA", 3, 4, 6], ["CHR", 1, "shared", [4]], ["CA", 2, 5, 6], ["FU", 9, [0, 1, 2, 3]], ["SP", 9, 0, 56448, [32], 1], ["AN", 9, 0, 5], ["AN", 9, 1, 6], ["FU", 6, [0, 1]], ["AN", 6, 0, 5], ["FU", 6, [1, 2]], ["AN", 6, 1, 4], ["FU", 6, [2, 3]], ["AN", 6, 2, 6], ["FU", 4, [0, 1]], ["SP", 4, 0, 12, [1], 1], ["AN", 4, 1, 2], ["FFSP", 4, 0, [3, 2], 1, 1], ["AN", 4, 1, 6], ["FU", 2, [0, 1]], ["SP", 2, 0, 4, [1], 1], ["AN", 2, 1, 2], ["FFSP", 2, 0, [3, 2], 1, 1], ["AN", 2, 1, 6], ["PR", 5, 0, "auto_unroll_max_step$1024"]]]], "r": [[2.37259e-05, 2.37153e-05, 2.37158e-05], 0, 18.924, 1662032136], "v": "v0.6"}
{"i": [["[\"fused_pointwise_conv_bias_add_sigmoid_mul\", 7, 7, 48, 1152, 1]", "cuda -keys=cuda,gpu -max_num_threads=1024 -model=unknown -thread_warp_size=32", [-1, 16, 64, 49152, 2147483647, 1024, 8, 32], "", 0, []], [[], [["CI", 5], ["CHW", 3, "local"], ["SP", 3, 0, 1, [1, 1, 1, 1], 1], ["SP", 3, 5, 1152, [3, 32, 3, 1], 1], ["SP", 3, 10, 48, [1, 2], 1], ["RE", 3, [0, 5, 1, 6, 2, 7, 10, 11, 3, 8, 12, 4, 9]], ["FSP", 4, 0, 2, 3], ["FSP", 4, 4, 3, 3], ["RE", 4, [0, 4, 1, 5, 2, 6, 3, 7]], ["CA", 3, 4, 5], ["CHR", 2, "shared", [3]], ["CA", 3, 4, 6], ["CHR", 1, "shared", [4]], ["CA", 2, 5, 6], ["FU", 9, [0, 1, 2, 3]], ["SP", 9, 0, 56448, [49], 1], ["AN", 9, 0, 5], ["AN", 9, 1, 6], ["FU", 6, [0, 1]], ["AN", 6, 0, 5], ["FU", 6, [1, 2]], ["AN", 6, 1, 4], ["FU", 6, [2, 3]], ["AN", 6, 2, 6], ["FU", 4, [0, 1]], ["SP", 4, 0, 36, [36], 1], ["AN", 4, 1, 2], ["FFSP", 4, 0, [3, 2], 1, 1], ["AN", 4, 1, 6], ["FU", 2, [0, 1]], ["SP", 2, 0, 12, [1], 1], ["AN", 2, 1, 2], ["FFSP", 2, 0, [3, 2], 1, 1], ["AN", 2, 1, 6], ["PR", 5, 0, "auto_unroll_max_step$16"]]]], "r": [[0.000106093, 0.000106092, 0.000106092], 0, 14.5821, 1662032133], "v": "v0.6"}
{"i": [["[\"fused_pointwise_conv_bias_add_sigmoid_mul\", 7, 7, 48, 1152, 1]", "cuda -keys=cuda,gpu -max_num_threads=1024 -model=unknown -thread_warp_size=32", [-1, 16, 64, 49152, 2147483647, 1024, 8, 32], "", 0, []], [[], [["CI", 5], ["CHW", 3, "local"], ["SP", 3, 0, 1, [1, 1, 1, 1], 1], ["SP", 3, 5, 1152, [1, 144, 4, 1], 1], ["SP", 3, 10, 48, [2, 2], 1], ["RE", 3, [0, 5, 1, 6, 2, 7, 10, 11, 3, 8, 12, 4, 9]], ["FSP", 4, 0, 2, 3], ["FSP", 4, 4, 3, 3], ["RE", 4, [0, 4, 1, 5, 2, 6, 3, 7]], ["CA", 3, 4, 5], ["CHR", 2, "shared", [3]], ["CA", 3, 4, 6], ["CHR", 1, "shared", [4]], ["CA", 2, 5, 6], ["FU", 9, [0, 1, 2, 3]], ["SP", 9, 0, 56448, [32], 1], ["AN", 9, 0, 5], ["AN", 9, 1, 6], ["FU", 6, [0, 1]], ["AN", 6, 0, 5], ["FU", 6, [1, 2]], ["AN", 6, 1, 4], ["FU", 6, [2, 3]], ["AN", 6, 2, 6], ["FU", 4, [0, 1]], ["SP", 4, 0, 16, [1], 1], ["AN", 4, 1, 2], ["FFSP", 4, 0, [3, 2], 1, 1], ["AN", 4, 1, 6], ["FU", 2, [0, 1]], ["SP", 2, 0, 4, [1], 1], ["AN", 2, 1, 2], ["FFSP", 2, 0, [3, 2], 1, 1], ["AN", 2, 1, 6], ["PR", 5, 0, "auto_unroll_max_step$64"]]]], "r": [[2.50443e-05, 2.50505e-05, 2.50421e-05], 0, 16.101, 1662032134], "v": "v0.6"}
{"i": [["[\"fused_pointwise_conv_bias_add_sigmoid_mul\", 7, 7, 48, 1152, 1]", "cuda -keys=cuda,gpu -max_num_threads=1024 -model=unknown -thread_warp_size=32", [-1, 16, 64, 49152, 2147483647, 1024, 8, 32], "", 0, []], [[], [["CI", 5], ["CHW", 3, "local"], ["SP", 3, 0, 1, [1, 1, 1, 1], 1], ["SP", 3, 5, 1152, [4, 32, 1, 1], 1], ["SP", 3, 10, 48, [4, 1], 1], ["RE", 3, [0, 5, 1, 6, 2, 7, 10, 11, 3, 8, 12, 4, 9]], ["FSP", 4, 0, 2, 3], ["FSP", 4, 4, 3, 3], ["RE", 4, [0, 4, 1, 5, 2, 6, 3, 7]], ["CA", 3, 4, 5], ["CHR", 2, "shared", [3]], ["CA", 3, 4, 6], ["CHR", 1, "shared", [4]], ["CA", 2, 5, 6], ["FU", 9, [0, 1, 2, 3]], ["SP", 9, 0, 56448, [1], 1], ["AN", 9, 0, 5], ["AN", 9, 1, 6], ["FU", 6, [0, 1]], ["AN", 6, 0, 5], ["FU", 6, [1, 2]], ["AN", 6, 1, 4], ["FU", 6, [2, 3]], ["AN", 6, 2, 6], ["FU", 4, [0, 1]], ["SP", 4, 0, 16, [1], 1], ["AN", 4, 1, 2], ["FFSP", 4, 0, [3, 2], 1, 1], ["AN", 4, 1, 6], ["FU", 2, [0, 1]], ["SP", 2, 0, 16, [4], 1], ["AN", 2, 1, 2], ["FFSP", 2, 0, [3, 2], 1, 1], ["AN", 2, 1, 6], ["PR", 5, 0, "auto_unroll_max_step$16"]]]], "r": [[9.29876e-05, 9.29984e-05, 9.29981e-05], 0, 15.1137, 1662032133], "v": "v0.6"}
{"i": [["[\"fused_pointwise_conv_bias_add_sigmoid_mul\", 7, 7, 48, 1152, 1]", "cuda -keys=cuda,gpu -max_num_threads=1024 -model=unknown -thread_warp_size=32", [-1, 16, 64, 49152, 2147483647, 1024, 8, 32], "", 0, []], [[], [["CI", 5], ["CHW", 3, "local"], ["SP", 3, 0, 1, [1, 1, 1, 1], 1], ["SP", 3, 5, 1152, [1, 36, 2, 2], 1], ["SP", 3, 10, 48, [1, 4], 1], ["RE", 3, [0, 5, 1, 6, 2, 7, 10, 11, 3, 8, 12, 4, 9]], ["FSP", 4, 0, 2, 3], ["FSP", 4, 4, 3, 3], ["RE", 4, [0, 4, 1, 5, 2, 6, 3, 7]], ["CA", 3, 4, 5], ["CHR", 2, "shared", [3]], ["CA", 3, 4, 6], ["CHR", 1, "shared", [4]], ["CA", 2, 5, 6], ["FU", 9, [0, 1, 2, 3]], ["SP", 9, 0, 56448, [64], 1], ["AN", 9, 0, 5], ["AN", 9, 1, 6], ["FU", 6, [0, 1]], ["AN", 6, 0, 5], ["FU", 6, [1, 2]], ["AN", 6, 1, 4], ["FU", 6, [2, 3]], ["AN", 6, 2, 6], ["FU", 4, [0, 1]], ["SP", 4, 0, 16, [2], 1], ["AN", 4, 1, 2], ["FFSP", 4, 0, [3, 2], 1, 1], ["AN", 4, 1, 6], ["FU", 2, [0, 1]], ["SP", 2, 0, 4, [1], 1], ["AN", 2, 1, 2], ["FFSP", 2, 0, [3, 2], 1, 1], ["AN", 2, 1, 6], ["PR", 5, 0, "auto_unroll_max_step$16"]]]], "r": [[1.96637e-05, 1.96639e-05, 1.96638e-05], 0, 15.7446, 1662032134], "v": "v0.6"}
{"i": [["[\"fused_pointwise_conv_bias_add_sigmoid_mul\", 7, 7, 48, 1152, 1]", "cuda -keys=cuda,gpu -max_num_threads=1024 -model=unknown -thread_warp_size=32", [-1, 16, 64, 49152, 2147483647, 1024, 8, 32], "", 0, []], [[], [["CI", 5], ["CHW", 3, "local"], ["SP", 3, 0, 1, [1, 1, 1, 1], 1], ["SP", 3, 5, 1152, [4, 48, 1, 1], 1], ["SP", 3, 10, 48, [6, 1], 1], ["RE", 3, [0, 5, 1, 6, 2, 7, 10, 11, 3, 8, 12, 4, 9]], ["FSP", 4, 0, 2, 3], ["FSP", 4, 4, 3, 3], ["RE", 4, [0, 4, 1, 5, 2, 6, 3, 7]], ["CA", 3, 4, 5], ["CHR", 2, "shared", [3]], ["CA", 3, 4, 6], ["CHR", 1, "shared", [4]], ["CA", 2, 5, 6], ["FU", 9, [0, 1, 2, 3]], ["SP", 9, 0, 56448, [32], 1], ["AN", 9, 0, 5], ["AN", 9, 1, 6], ["FU", 6, [0, 1]], ["AN", 6, 0, 5], ["FU", 6, [1, 2]], ["AN", 6, 1, 4], ["FU", 6, [2, 3]], ["AN", 6, 2, 6], ["FU", 4, [0, 1]], ["SP", 4, 0, 6, [1], 1], ["AN", 4, 1, 2], ["FFSP", 4, 0, [3, 2], 1, 1], ["AN", 4, 1, 6], ["FU", 2, [0, 1]], ["SP", 2, 0, 6, [2], 1], ["AN", 2, 1, 2], ["FFSP", 2, 0, [3, 2], 1, 1], ["AN", 2, 1, 6], ["PR", 5, 0, "auto_unroll_max_step$16"]]]], "r": [[2.77061e-05, 2.77048e-05, 2.77048e-05], 0, 18.5205, 1662032137], "v": "v0.6"}
{"i": [["[\"fused_pointwise_conv_bias_add_sigmoid_mul\", 7, 7, 48, 1152, 1]", "cuda -keys=cuda,gpu -max_num_threads=1024 -model=unknown -thread_warp_size=32", [-1, 16, 64, 49152, 2147483647, 1024, 8, 32], "", 0, []], [[], [["CI", 5], ["CHW", 3, "local"], ["SP", 3, 0, 1, [1, 1, 1, 1], 1], ["SP", 3, 5, 1152, [1, 8, 1, 1], 1], ["SP", 3, 10, 48, [12, 1], 1], ["RE", 3, [0, 5, 1, 6, 2, 7, 10, 11, 3, 8, 12, 4, 9]], ["FSP", 4, 0, 2, 3], ["FSP", 4, 4, 3, 3], ["RE", 4, [0, 4, 1, 5, 2, 6, 3, 7]], ["CA", 3, 4, 5], ["CHR", 2, "shared", [3]], ["CA", 3, 4, 6], ["CHR", 1, "shared", [4]], ["CA", 2, 5, 6], ["FU", 9, [0, 1, 2, 3]], ["SP", 9, 0, 56448, [32], 1], ["AN", 9, 0, 5], ["AN", 9, 1, 6], ["FU", 6, [0, 1]], ["AN", 6, 0, 5], ["FU", 6, [1, 2]], ["AN", 6, 1, 4], ["FU", 6, [2, 3]], ["AN", 6, 2, 6], ["FU", 4, [0, 1]], ["SP", 4, 0, 12, [1], 1], ["AN", 4, 1, 2], ["FFSP", 4, 0, [3, 2], 1, 1], ["AN", 4, 1, 6], ["FU", 2, [0, 1]], ["SP", 2, 0, 12, [1], 1], ["AN", 2, 1, 2], ["FFSP", 2, 0, [3, 2], 1, 1], ["AN", 2, 1, 6], ["PR", 5, 0, "auto_unroll_max_step$512"]]]], "r": [[1.4188e-05, 1.41824e-05, 1.41866e-05], 0, 19.8478, 1662032138], "v": "v0.6"}
{"i": [["[\"fused_pointwise_conv_bias_add_sigmoid_mul\", 7, 7, 48, 1152, 1]", "cuda -keys=cuda,gpu -max_num_threads=1024 -model=unknown -thread_warp_size=32", [-1, 16, 64, 49152, 2147483647, 1024, 8, 32], "", 0, []], [[], [["CI", 5], ["CHW", 3, "local"], ["SP", 3, 0, 1, [1, 1, 1, 1], 1], ["SP", 3, 5, 1152, [2, 96, 1, 3], 1], ["SP", 3, 10, 48, [2, 6], 1], ["RE", 3, [0, 5, 1, 6, 2, 7, 10, 11, 3, 8, 12, 4, 9]], ["FSP", 4, 0, 2, 3], ["FSP", 4, 4, 3, 3], ["RE", 4, [0, 4, 1, 5, 2, 6, 3, 7]], ["CA", 3, 4, 5], ["CHR", 2, "shared", [3]], ["CA", 3, 4, 6], ["CHR", 1, "shared", [4]], ["CA", 2, 5, 6], ["FU", 9, [0, 1, 2, 3]], ["SP", 9, 0, 56448, [32], 1], ["AN", 9, 0, 5], ["AN", 9, 1, 6], ["FU", 6, [0, 1]], ["AN", 6, 0, 5], ["FU", 6, [1, 2]], ["AN", 6, 1, 4], ["FU", 6, [2, 3]], ["AN", 6, 2, 6], ["FU", 4, [0, 1]], ["SP", 4, 0, 36, [1], 1], ["AN", 4, 1, 2], ["FFSP", 4, 0, [3, 2], 1, 1], ["AN", 4, 1, 6], ["FU", 2, [0, 1]], ["SP", 2, 0, 12, [6], 1], ["AN", 2, 1, 2], ["FFSP", 2, 0, [3, 2], 1, 1], ["AN", 2, 1, 6], ["PR", 5, 0, "auto_unroll_max_step$16"]]]], "r": [[3.33269e-05, 3.33679e-05, 3.33594e-05], 0, 17.3706, 1662032135], "v": "v0.6"}
{"i": [["[\"fused_pointwise_conv_bias_add_sigmoid_mul\", 7, 7, 48, 1152, 1]", "cuda -keys=cuda,gpu -max_num_threads=1024 -model=unknown -thread_warp_size=32", [-1, 16, 64, 49152, 2147483647, 1024, 8, 32], "", 0, []], [[], [["CI", 5], ["CHW", 3, "local"], ["SP", 3, 0, 1, [1, 1, 1, 1], 1], ["SP", 3, 5, 1152, [3, 96, 1, 1], 1], ["SP", 3, 10, 48, [1, 2], 1], ["RE", 3, [0, 5, 1, 6, 2, 7, 10, 11, 3, 8, 12, 4, 9]], ["FSP", 4, 0, 2, 3], ["FSP", 4, 4, 3, 3], ["RE", 4, [0, 4, 1, 5, 2, 6, 3, 7]], ["CA", 3, 4, 5], ["CHR", 2, "shared", [3]], ["CA", 3, 4, 6], ["CHR", 1, "shared", [4]], ["CA", 2, 5, 6], ["FU", 9, [0, 1, 2, 3]], ["SP", 9, 0, 56448, [32], 1], ["AN", 9, 0, 5], ["AN", 9, 1, 6], ["FU", 6, [0, 1]], ["AN", 6, 0, 5], ["FU", 6, [1, 2]], ["AN", 6, 1, 4], ["FU", 6, [2, 3]], ["AN", 6, 2, 6], ["FU", 4, [0, 1]], ["SP", 4, 0, 2, [1], 1], ["AN", 4, 1, 2], ["FFSP", 4, 0, [3, 2], 1, 1], ["AN", 4, 1, 6], ["FU", 2, [0, 1]], ["SP", 2, 0, 2, [1], 1], ["AN", 2, 1, 2], ["FFSP", 2, 0, [3, 2], 1, 1], ["AN", 2, 1, 6], ["PR", 5, 0, "auto_unroll_max_step$1024"]]]], "r": [[1.94055e-05, 1.94062e-05, 1.94037e-05], 0, 21.1636, 1662032139], "v": "v0.6"}
{"i": [["[\"fused_pointwise_conv_bias_add_sigmoid_mul\", 7, 7, 48, 1152, 1]", "cuda -keys=cuda,gpu -max_num_threads=1024 -model=unknown -thread_warp_size=32", [-1, 16, 64, 49152, 2147483647, 1024, 8, 32], "", 0, []], [[], [["CI", 5], ["CHW", 3, "local"], ["SP", 3, 0, 1, [1, 1, 1, 1], 1], ["SP", 3, 5, 1152, [4, 9, 4, 2], 1], ["SP", 3, 10, 48, [2, 6], 1], ["RE", 3, [0, 5, 1, 6, 2, 7, 10, 11, 3, 8, 12, 4, 9]], ["FSP", 4, 0, 2, 3], ["FSP", 4, 4, 3, 3], ["RE", 4, [0, 4, 1, 5, 2, 6, 3, 7]], ["CA", 3, 4, 5], ["CHR", 2, "shared", [3]], ["CA", 3, 4, 6], ["CHR", 1, "shared", [4]], ["CA", 2, 5, 6], ["FU", 9, [0, 1, 2, 3]], ["SP", 9, 0, 56448, [32], 1], ["AN", 9, 0, 5], ["AN", 9, 1, 6], ["FU", 6, [0, 1]], ["AN", 6, 0, 5], ["FU", 6, [1, 2]], ["AN", 6, 1, 4], ["FU", 6, [2, 3]], ["AN", 6, 2, 6], ["FU", 4, [0, 1]], ["SP", 4, 0, 24, [1], 1], ["AN", 4, 1, 2], ["FFSP", 4, 0, [3, 2], 1, 1], ["AN", 4, 1, 6], ["FU", 2, [0, 1]], ["SP", 2, 0, 12, [1], 1], ["AN", 2, 1, 2], ["FFSP", 2, 0, [3, 2], 1, 1], ["AN", 2, 1, 6], ["PR", 5, 0, "auto_unroll_max_step$16"]]]], "r": [[0.000116073, 0.000116061, 0.000116072], 0, 19.2669, 1662032137], "v": "v0.6"}
{"i": [["[\"fused_pointwise_conv_bias_add_sigmoid_mul\", 7, 7, 48, 1152, 1]", "cuda -keys=cuda,gpu -max_num_threads=1024 -model=unknown -thread_warp_size=32", [-1, 16, 64, 49152, 2147483647, 1024, 8, 32], "", 0, []], [[], [["CI", 5], ["CHW", 3, "local"], ["SP", 3, 0, 1, [1, 1, 1, 1], 1], ["SP", 3, 5, 1152, [6, 64, 1, 3], 1], ["SP", 3, 10, 48, [1, 2], 1], ["RE", 3, [0, 5, 1, 6, 2, 7, 10, 11, 3, 8, 12, 4, 9]], ["FSP", 4, 0, 2, 3], ["FSP", 4, 4, 3, 3], ["RE", 4, [0, 4, 1, 5, 2, 6, 3, 7]], ["CA", 3, 4, 5], ["CHR", 2, "shared", [3]], ["CA", 3, 4, 6], ["CHR", 1, "shared", [4]], ["CA", 2, 5, 6], ["FU", 9, [0, 1, 2, 3]], ["SP", 9, 0, 56448, [64], 1], ["AN", 9, 0, 5], ["AN", 9, 1, 6], ["FU", 6, [0, 1]], ["AN", 6, 0, 5], ["FU", 6, [1, 2]], ["AN", 6, 1, 4], ["FU", 6, [2, 3]], ["AN", 6, 2, 6], ["FU", 4, [0, 1]], ["SP", 4, 0, 24, [1], 1], ["AN", 4, 1, 2], ["FFSP", 4, 0, [3, 2], 1, 1], ["AN", 4, 1, 6], ["FU", 2, [0, 1]], ["SP", 2, 0, 8, [1], 1], ["AN", 2, 1, 2], ["FFSP", 2, 0, [3, 2], 1, 1], ["AN", 2, 1, 6], ["PR", 5, 0, "auto_unroll_max_step$16"]]]], "r": [[3.86341e-05, 3.86597e-05, 3.86586e-05], 0, 23.2837, 1662032142], "v": "v0.6"}
{"i": [["[\"fused_pointwise_conv_bias_add_sigmoid_mul\", 7, 7, 48, 1152, 1]", "cuda -keys=cuda,gpu -max_num_threads=1024 -model=unknown -thread_warp_size=32", [-1, 16, 64, 49152, 2147483647, 1024, 8, 32], "", 0, []], [[], [["CI", 5], ["CHW", 3, "local"], ["SP", 3, 0, 1, [1, 1, 1, 1], 1], ["SP", 3, 5, 1152, [1, 36, 1, 32], 1], ["SP", 3, 10, 48, [2, 2], 1], ["RE", 3, [0, 5, 1, 6, 2, 7, 10, 11, 3, 8, 12, 4, 9]], ["FSP", 4, 0, 2, 3], ["FSP", 4, 4, 3, 3], ["RE", 4, [0, 4, 1, 5, 2, 6, 3, 7]], ["CA", 3, 4, 5], ["CHR", 2, "shared", [3]], ["CA", 3, 4, 6], ["CHR", 1, "shared", [4]], ["CA", 2, 5, 6], ["FU", 9, [0, 1, 2, 3]], ["SP", 9, 0, 56448, [32], 1], ["AN", 9, 0, 5], ["AN", 9, 1, 6], ["FU", 6, [0, 1]], ["AN", 6, 0, 5], ["FU", 6, [1, 2]], ["AN", 6, 1, 4], ["FU", 6, [2, 3]], ["AN", 6, 2, 6], ["FU", 4, [0, 1]], ["SP", 4, 0, 128, [1], 1], ["AN", 4, 1, 2], ["FFSP", 4, 0, [3, 2], 1, 1], ["AN", 4, 1, 6], ["FU", 2, [0, 1]], ["SP", 2, 0, 4, [1], 1], ["AN", 2, 1, 2], ["FFSP", 2, 0, [3, 2], 1, 1], ["AN", 2, 1, 6], ["PR", 5, 0, "auto_unroll_max_step$64"]]]], "r": [[7.45549e-05, 7.45855e-05, 7.4552e-05], 0, 22.2306, 1662032140], "v": "v0.6"}
{"i": [["[\"fused_pointwise_conv_bias_add_sigmoid_mul\", 7, 7, 48, 1152, 1]", "cuda -keys=cuda,gpu -max_num_threads=1024 -model=unknown -thread_warp_size=32", [-1, 16, 64, 49152, 2147483647, 1024, 8, 32], "", 0, []], [[], [["CI", 5], ["CHW", 3, "local"], ["SP", 3, 0, 1, [1, 1, 1, 1], 1], ["SP", 3, 5, 1152, [1, 384, 3, 1], 1], ["SP", 3, 10, 48, [3, 1], 1], ["RE", 3, [0, 5, 1, 6, 2, 7, 10, 11, 3, 8, 12, 4, 9]], ["FSP", 4, 0, 2, 3], ["FSP", 4, 4, 3, 3], ["RE", 4, [0, 4, 1, 5, 2, 6, 3, 7]], ["CA", 3, 4, 5], ["CHR", 2, "shared", [3]], ["CA", 3, 4, 6], ["CHR", 1, "shared", [4]], ["CA", 2, 5, 6], ["FU", 9, [0, 1, 2, 3]], ["SP", 9, 0, 56448, [32], 1], ["AN", 9, 0, 5], ["AN", 9, 1, 6], ["FU", 6, [0, 1]], ["AN", 6, 0, 5], ["FU", 6, [1, 2]], ["AN", 6, 1, 4], ["FU", 6, [2, 3]], ["AN", 6, 2, 6], ["FU", 4, [0, 1]], ["SP", 4, 0, 9, [1], 1], ["AN", 4, 1, 2], ["FFSP", 4, 0, [3, 2], 1, 1], ["AN", 4, 1, 6], ["FU", 2, [0, 1]], ["SP", 2, 0, 3, [1], 1], ["AN", 2, 1, 2], ["FFSP", 2, 0, [3, 2], 1, 1], ["AN", 2, 1, 6], ["PR", 5, 0, "auto_unroll_max_step$512"]]]], "r": [[2.1911e-05, 2.19134e-05, 2.19157e-05], 0, 20.4835, 1662032139], "v": "v0.6"}
{"i": [["[\"fused_pointwise_conv_bias_add_sigmoid_mul\", 7, 7, 48, 1152, 1]", "cuda -keys=cuda,gpu -max_num_threads=1024 -model=unknown -thread_warp_size=32", [-1, 16, 64, 49152, 2147483647, 1024, 8, 32], "", 0, []], [[], [["CI", 5], ["CHW", 3, "local"], ["SP", 3, 0, 1, [1, 1, 1, 1], 1], ["SP", 3, 5, 1152, [1, 288, 1, 4], 1], ["SP", 3, 10, 48, [1, 4], 1], ["RE", 3, [0, 5, 1, 6, 2, 7, 10, 11, 3, 8, 12, 4, 9]], ["FSP", 4, 0, 2, 3], ["FSP", 4, 4, 3, 3], ["RE", 4, [0, 4, 1, 5, 2, 6, 3, 7]], ["CA", 3, 4, 5], ["CHR", 2, "shared", [3]], ["CA", 3, 4, 6], ["CHR", 1, "shared", [4]], ["CA", 2, 5, 6], ["FU", 9, [0, 1, 2, 3]], ["SP", 9, 0, 56448, [2], 1], ["AN", 9, 0, 5], ["AN", 9, 1, 6], ["FU", 6, [0, 1]], ["AN", 6, 0, 5], ["FU", 6, [1, 2]], ["AN", 6, 1, 4], ["FU", 6, [2, 3]], ["AN", 6, 2, 6], ["FU", 4, [0, 1]], ["SP", 4, 0, 16, [1], 1], ["AN", 4, 1, 2], ["FFSP", 4, 0, [3, 2], 1, 1], ["AN", 4, 1, 6], ["FU", 2, [0, 1]], ["SP", 2, 0, 4, [1], 1], ["AN", 2, 1, 2], ["FFSP", 2, 0, [3, 2], 1, 1], ["AN", 2, 1, 6], ["PR", 5, 0, "auto_unroll_max_step$64"]]]], "r": [[6.17964e-05, 6.1791e-05, 6.17968e-05], 0, 22.6775, 1662032141], "v": "v0.6"}
{"i": [["[\"fused_pointwise_conv_bias_add_sigmoid_mul\", 7, 7, 48, 1152, 1]", "cuda -keys=cuda,gpu -max_num_threads=1024 -model=unknown -thread_warp_size=32", [-1, 16, 64, 49152, 2147483647, 1024, 8, 32], "", 0, []], [[], [["CI", 5], ["CHW", 3, "local"], ["SP", 3, 0, 1, [1, 1, 1, 1], 1], ["SP", 3, 5, 1152, [1, 288, 2, 1], 1], ["SP", 3, 10, 48, [6, 1], 1], ["RE", 3, [0, 5, 1, 6, 2, 7, 10, 11, 3, 8, 12, 4, 9]], ["FSP", 4, 0, 2, 3], ["FSP", 4, 4, 3, 3], ["RE", 4, [0, 4, 1, 5, 2, 6, 3, 7]], ["CA", 3, 4, 5], ["CHR", 2, "shared", [3]], ["CA", 3, 4, 6], ["CHR", 1, "shared", [4]], ["CA", 2, 5, 6], ["FU", 9, [0, 1, 2, 3]], ["SP", 9, 0, 56448, [32], 1], ["AN", 9, 0, 5], ["AN", 9, 1, 6], ["FU", 6, [0, 1]], ["AN", 6, 0, 5], ["FU", 6, [1, 2]], ["AN", 6, 1, 4], ["FU", 6, [2, 3]], ["AN", 6, 2, 6], ["FU", 4, [0, 1]], ["SP", 4, 0, 12, [1], 1], ["AN", 4, 1, 2], ["FFSP", 4, 0, [3, 2], 1, 1], ["AN", 4, 1, 6], ["FU", 2, [0, 1]], ["SP", 2, 0, 6, [1], 1], ["AN", 2, 1, 2], ["FFSP", 2, 0, [3, 2], 1, 1], ["AN", 2, 1, 6], ["PR", 5, 0, "auto_unroll_max_step$64"]]]], "r": [[1.99072e-05, 1.99069e-05, 1.99069e-05], 0, 24.9979, 1662032143], "v": "v0.6"}
{"i": [["[\"fused_pointwise_conv_bias_add_sigmoid_mul\", 7, 7, 48, 1152, 1]", "cuda -keys=cuda,gpu -max_num_threads=1024 -model=unknown -thread_warp_size=32", [-1, 16, 64, 49152, 2147483647, 1024, 8, 32], "", 0, []], [[], [["CI", 5], ["CHW", 3, "local"], ["SP", 3, 0, 1, [1, 1, 1, 1], 1], ["SP", 3, 5, 1152, [1, 64, 3, 2], 1], ["SP", 3, 10, 48, [8, 3], 1], ["RE", 3, [0, 5, 1, 6, 2, 7, 10, 11, 3, 8, 12, 4, 9]], ["FSP", 4, 0, 2, 3], ["FSP", 4, 4, 3, 3], ["RE", 4, [0, 4, 1, 5, 2, 6, 3, 7]], ["CA", 3, 4, 5], ["CHR", 2, "shared", [3]], ["CA", 3, 4, 6], ["CHR", 1, "shared", [4]], ["CA", 2, 5, 6], ["FU", 9, [0, 1, 2, 3]], ["SP", 9, 0, 56448, [64], 1], ["AN", 9, 0, 5], ["AN", 9, 1, 6], ["FU", 6, [0, 1]], ["AN", 6, 0, 5], ["FU", 6, [1, 2]], ["AN", 6, 1, 4], ["FU", 6, [2, 3]], ["AN", 6, 2, 6], ["FU", 4, [0, 1]], ["SP", 4, 0, 144, [3], 1], ["AN", 4, 1, 2], ["FFSP", 4, 0, [3, 2], 1, 1], ["AN", 4, 1, 6], ["FU", 2, [0, 1]], ["SP", 2, 0, 24, [1], 1], ["AN", 2, 1, 2], ["FFSP", 2, 0, [3, 2], 1, 1], ["AN", 2, 1, 6], ["PR", 5, 0, "auto_unroll_max_step$64"]]]], "r": [[1.66078e-05, 1.65967e-05, 1.66039e-05], 0, 23.8912, 1662032142], "v": "v0.6"}
{"i": [["[\"fused_pointwise_conv_bias_add_sigmoid_mul\", 7, 7, 48, 1152, 1]", "cuda -keys=cuda,gpu -max_num_threads=1024 -model=unknown -thread_warp_size=32", [-1, 16, 64, 49152, 2147483647, 1024, 8, 32], "", 0, []], [[], [["CI", 5], ["CHW", 3, "local"], ["SP", 3, 0, 1, [1, 1, 1, 1], 1], ["SP", 3, 5, 1152, [1, 48, 2, 3], 1], ["SP", 3, 10, 48, [1, 16], 1], ["RE", 3, [0, 5, 1, 6, 2, 7, 10, 11, 3, 8, 12, 4, 9]], ["FSP", 4, 0, 2, 3], ["FSP", 4, 4, 3, 3], ["RE", 4, [0, 4, 1, 5, 2, 6, 3, 7]], ["CA", 3, 4, 5], ["CHR", 2, "shared", [3]], ["CA", 3, 4, 6], ["CHR", 1, "shared", [4]], ["CA", 2, 5, 6], ["FU", 9, [0, 1, 2, 3]], ["SP", 9, 0, 56448, [32], 1], ["AN", 9, 0, 5], ["AN", 9, 1, 6], ["FU", 6, [0, 1]], ["AN", 6, 0, 5], ["FU", 6, [1, 2]], ["AN", 6, 1, 4], ["FU", 6, [2, 3]], ["AN", 6, 2, 6], ["FU", 4, [0, 1]], ["SP", 4, 0, 96, [1], 1], ["AN", 4, 1, 2], ["FFSP", 4, 0, [3, 2], 1, 1], ["AN", 4, 1, 6], ["FU", 2, [0, 1]], ["SP", 2, 0, 16, [1], 1], ["AN", 2, 1, 2], ["FFSP", 2, 0, [3, 2], 1, 1], ["AN", 2, 1, 6], ["PR", 5, 0, "auto_unroll_max_step$512"]]]], "r": [[2.00784e-05, 2.00883e-05, 2.00765e-05], 0, 25.8961, 1662032144], "v": "v0.6"}
{"i": [["[\"fused_pointwise_conv_bias_add_sigmoid_mul\", 7, 7, 48, 1152, 1]", "cuda -keys=cuda,gpu -max_num_threads=1024 -model=unknown -thread_warp_size=32", [-1, 16, 64, 49152, 2147483647, 1024, 8, 32], "", 0, []], [[], [["CI", 5], ["CHW", 3, "local"], ["SP", 3, 0, 1, [1, 1, 1, 1], 1], ["SP", 3, 5, 1152, [3, 32, 3, 4], 1], ["SP", 3, 10, 48, [1, 4], 1], ["RE", 3, [0, 5, 1, 6, 2, 7, 10, 11, 3, 8, 12, 4, 9]], ["FSP", 4, 0, 2, 3], ["FSP", 4, 4, 3, 3], ["RE", 4, [0, 4, 1, 5, 2, 6, 3, 7]], ["CA", 3, 4, 5], ["CHR", 2, "shared", [3]], ["CA", 3, 4, 6], ["CHR", 1, "shared", [4]], ["CA", 2, 5, 6], ["FU", 9, [0, 1, 2, 3]], ["SP", 9, 0, 56448, [48], 1], ["AN", 9, 0, 5], ["AN", 9, 1, 6], ["FU", 6, [0, 1]], ["AN", 6, 0, 5], ["FU", 6, [1, 2]], ["AN", 6, 1, 4], ["FU", 6, [2, 3]], ["AN", 6, 2, 6], ["FU", 4, [0, 1]], ["SP", 4, 0, 48, [2], 1], ["AN", 4, 1, 2], ["FFSP", 4, 0, [3, 2], 1, 1], ["AN", 4, 1, 6], ["FU", 2, [0, 1]], ["SP", 2, 0, 4, [1], 1], ["AN", 2, 1, 2], ["FFSP", 2, 0, [3, 2], 1, 1], ["AN", 2, 1, 6], ["PR", 5, 0, "auto_unroll_max_step$16"]]]], "r": [[3.42956e-05, 3.43175e-05, 3.43154e-05], 0, 24.6482, 1662032143], "v": "v0.6"}
{"i": [["[\"fused_pointwise_conv_bias_add_sigmoid_mul\", 7, 7, 48, 1152, 1]", "cuda -keys=cuda,gpu -max_num_threads=1024 -model=unknown -thread_warp_size=32", [-1, 16, 64, 49152, 2147483647, 1024, 8, 32], "", 0, []], [[], [["CI", 5], ["CHW", 3, "local"], ["SP", 3, 0, 1, [1, 1, 1, 1], 1], ["SP", 3, 5, 1152, [1, 48, 1, 6], 1], ["SP", 3, 10, 48, [3, 1], 1], ["RE", 3, [0, 5, 1, 6, 2, 7, 10, 11, 3, 8, 12, 4, 9]], ["FSP", 4, 0, 2, 3], ["FSP", 4, 4, 3, 3], ["RE", 4, [0, 4, 1, 5, 2, 6, 3, 7]], ["CA", 3, 4, 5], ["CHR", 2, "shared", [3]], ["CA", 3, 4, 6], ["CHR", 1, "shared", [4]], ["CA", 2, 5, 6], ["FU", 9, [0, 1, 2, 3]], ["SP", 9, 0, 56448, [32], 1], ["AN", 9, 0, 5], ["AN", 9, 1, 6], ["FU", 6, [0, 1]], ["AN", 6, 0, 5], ["FU", 6, [1, 2]], ["AN", 6, 1, 4], ["FU", 6, [2, 3]], ["AN", 6, 2, 6], ["FU", 4, [0, 1]], ["SP", 4, 0, 9, [1], 1], ["AN", 4, 1, 2], ["FFSP", 4, 0, [3, 2], 1, 1], ["AN", 4, 1, 6], ["FU", 2, [0, 1]], ["SP", 2, 0, 3, [1], 1], ["AN", 2, 1, 2], ["FFSP", 2, 0, [3, 2], 1, 1], ["AN", 2, 1, 6], ["PR", 5, 0, "auto_unroll_max_step$0"]]]], "r": [[2.86894e-05, 2.86865e-05, 2.86882e-05], 0, 21.3993, 1662032140], "v": "v0.6"}
{"i": [["[\"fused_pointwise_conv_bias_add_sigmoid_mul\", 7, 7, 48, 1152, 1]", "cuda -keys=cuda,gpu -max_num_threads=1024 -model=unknown -thread_warp_size=32", [-1, 16, 64, 49152, 2147483647, 1024, 8, 32], "", 0, []], [[], [["CI", 5], ["CHW", 3, "local"], ["SP", 3, 0, 1, [1, 1, 1, 1], 1], ["SP", 3, 5, 1152, [2, 48, 1, 3], 1], ["SP", 3, 10, 48, [3, 1], 1], ["RE", 3, [0, 5, 1, 6, 2, 7, 10, 11, 3, 8, 12, 4, 9]], ["FSP", 4, 0, 2, 3], ["FSP", 4, 4, 3, 3], ["RE", 4, [0, 4, 1, 5, 2, 6, 3, 7]], ["CA", 3, 4, 5], ["CHR", 2, "shared", [3]], ["CA", 3, 4, 6], ["CHR", 1, "shared", [4]], ["CA", 2, 5, 6], ["FU", 9, [0, 1, 2, 3]], ["SP", 9, 0, 56448, [4], 1], ["AN", 9, 0, 5], ["AN", 9, 1, 6], ["FU", 6, [0, 1]], ["AN", 6, 0, 5], ["FU", 6, [1, 2]], ["AN", 6, 1, 4], ["FU", 6, [2, 3]], ["AN", 6, 2, 6], ["FU", 4, [0, 1]], ["SP", 4, 0, 9, [1], 1], ["AN", 4, 1, 2], ["FFSP", 4, 0, [3, 2], 1, 1], ["AN", 4, 1, 6], ["FU", 2, [0, 1]], ["SP", 2, 0, 3, [1], 1], ["AN", 2, 1, 2], ["FFSP", 2, 0, [3, 2], 1, 1], ["AN", 2, 1, 6], ["PR", 5, 0, "auto_unroll_max_step$0"]]]], "r": [[4.56441e-05, 4.569e-05, 4.56876e-05], 0, 25.7523, 1662032145], "v": "v0.6"}
{"i": [["[\"fused_pointwise_conv_bias_add_sigmoid_mul\", 7, 7, 48, 1152, 1]", "cuda -keys=cuda,gpu -max_num_threads=1024 -model=unknown -thread_warp_size=32", [-1, 16, 64, 49152, 2147483647, 1024, 8, 32], "", 0, []], [[], [["CI", 5], ["CHW", 3, "local"], ["SP", 3, 0, 1, [1, 1, 1, 1], 1], ["SP", 3, 5, 1152, [2, 32, 9, 1], 1], ["SP", 3, 10, 48, [6, 1], 1], ["RE", 3, [0, 5, 1, 6, 2, 7, 10, 11, 3, 8, 12, 4, 9]], ["FSP", 4, 0, 2, 3], ["FSP", 4, 4, 3, 3], ["RE", 4, [0, 4, 1, 5, 2, 6, 3, 7]], ["CA", 3, 4, 5], ["CHR", 2, "shared", [3]], ["CA", 3, 4, 6], ["CHR", 1, "shared", [4]], ["CA", 2, 5, 6], ["FU", 9, [0, 1, 2, 3]], ["SP", 9, 0, 56448, [32], 1], ["AN", 9, 0, 5], ["AN", 9, 1, 6], ["FU", 6, [0, 1]], ["AN", 6, 0, 5], ["FU", 6, [1, 2]], ["AN", 6, 1, 4], ["FU", 6, [2, 3]], ["AN", 6, 2, 6], ["FU", 4, [0, 1]], ["SP", 4, 0, 108, [1], 1], ["AN", 4, 1, 2], ["FFSP", 4, 0, [3, 2], 1, 1], ["AN", 4, 1, 6], ["FU", 2, [0, 1]], ["SP", 2, 0, 12, [1], 1], ["AN", 2, 1, 2], ["FFSP", 2, 0, [3, 2], 1, 1], ["AN", 2, 1, 6], ["PR", 5, 0, "auto_unroll_max_step$0"]]]], "r": [[6.25203e-05, 6.25201e-05, 6.25175e-05], 0, 25.3696, 1662032145], "v": "v0.6"}
{"i": [["[\"fused_pointwise_conv_bias_add_sigmoid_mul\", 7, 7, 48, 1152, 1]", "cuda -keys=cuda,gpu -max_num_threads=1024 -model=unknown -thread_warp_size=32", [-1, 16, 64, 49152, 2147483647, 1024, 8, 32], "", 0, []], [[], [["CI", 5], ["CHW", 3, "local"], ["SP", 3, 0, 1, [1, 1, 1, 1], 1], ["SP", 3, 5, 1152, [4, 36, 1, 2], 1], ["SP", 3, 10, 48, [4, 3], 1], ["RE", 3, [0, 5, 1, 6, 2, 7, 10, 11, 3, 8, 12, 4, 9]], ["FSP", 4, 0, 2, 3], ["FSP", 4, 4, 3, 3], ["RE", 4, [0, 4, 1, 5, 2, 6, 3, 7]], ["CA", 3, 4, 5], ["CHR", 2, "shared", [3]], ["CA", 3, 4, 6], ["CHR", 1, "shared", [4]], ["CA", 2, 5, 6], ["FU", 9, [0, 1, 2, 3]], ["SP", 9, 0, 56448, [32], 1], ["AN", 9, 0, 5], ["AN", 9, 1, 6], ["FU", 6, [0, 1]], ["AN", 6, 0, 5], ["FU", 6, [1, 2]], ["AN", 6, 1, 4], ["FU", 6, [2, 3]], ["AN", 6, 2, 6], ["FU", 4, [0, 1]], ["SP", 4, 0, 24, [1], 1], ["AN", 4, 1, 2], ["FFSP", 4, 0, [3, 2], 1, 1], ["AN", 4, 1, 6], ["FU", 2, [0, 1]], ["SP", 2, 0, 12, [6], 1], ["AN", 2, 1, 2], ["FFSP", 2, 0, [3, 2], 1, 1], ["AN", 2, 1, 6], ["PR", 5, 0, "auto_unroll_max_step$16"]]]], "r": [[3.94805e-05, 3.95029e-05, 3.94983e-05], 0, 25.3082, 1662032146], "v": "v0.6"}
{"i": [["[\"fused_pointwise_conv_bias_add_sigmoid_mul\", 7, 7, 48, 1152, 1]", "cuda -keys=cuda,gpu -max_num_threads=1024 -model=unknown -thread_warp_size=32", [-1, 16, 64, 49152, 2147483647, 1024, 8, 32], "", 0, []], [[], [["CI", 5], ["CHW", 3, "local"], ["SP", 3, 0, 1, [1, 1, 1, 1], 1], ["SP", 3, 5, 1152, [4, 288, 1, 1], 1], ["SP", 3, 10, 48, [2, 4], 1], ["RE", 3, [0, 5, 1, 6, 2, 7, 10, 11, 3, 8, 12, 4, 9]], ["FSP", 4, 0, 2, 3], ["FSP", 4, 4, 3, 3], ["RE", 4, [0, 4, 1, 5, 2, 6, 3, 7]], ["CA", 3, 4, 5], ["CHR", 2, "shared", [3]], ["CA", 3, 4, 6], ["CHR", 1, "shared", [4]], ["CA", 2, 5, 6], ["FU", 9, [0, 1, 2, 3]], ["SP", 9, 0, 56448, [1], 1], ["AN", 9, 0, 5], ["AN", 9, 1, 6], ["FU", 6, [0, 1]], ["AN", 6, 0, 5], ["FU", 6, [1, 2]], ["AN", 6, 1, 4], ["FU", 6, [2, 3]], ["AN", 6, 2, 6], ["FU", 4, [0, 1]], ["SP", 4, 0, 8, [1], 1], ["AN", 4, 1, 2], ["FFSP", 4, 0, [3, 2], 1, 1], ["AN", 4, 1, 6], ["FU", 2, [0, 1]], ["SP", 2, 0, 8, [1], 1], ["AN", 2, 1, 2], ["FFSP", 2, 0, [3, 2], 1, 1], ["AN", 2, 1, 6], ["PR", 5, 0, "auto_unroll_max_step$0"]]]], "r": [[9.63849e-05, 9.63719e-05, 9.63699e-05], 0, 25.2897, 1662032146], "v": "v0.6"}
{"i": [["[\"fused_pointwise_conv_bias_add_sigmoid_mul\", 7, 7, 48, 1152, 1]", "cuda -keys=cuda,gpu -max_num_threads=1024 -model=unknown -thread_warp_size=32", [-1, 16, 64, 49152, 2147483647, 1024, 8, 32], "", 0, []], [[], [["CI", 5], ["CHW", 3, "local"], ["SP", 3, 0, 1, [1, 1, 1, 1], 1], ["SP", 3, 5, 1152, [1, 4, 48, 2], 1], ["SP", 3, 10, 48, [3, 2], 1], ["RE", 3, [0, 5, 1, 6, 2, 7, 10, 11, 3, 8, 12, 4, 9]], ["FSP", 4, 0, 2, 3], ["FSP", 4, 4, 3, 3], ["RE", 4, [0, 4, 1, 5, 2, 6, 3, 7]], ["CA", 3, 4, 5], ["CHR", 2, "shared", [3]], ["CA", 3, 4, 6], ["CHR", 1, "shared", [4]], ["CA", 2, 5, 6], ["FU", 9, [0, 1, 2, 3]], ["SP", 9, 0, 56448, [4], 1], ["AN", 9, 0, 5], ["AN", 9, 1, 6], ["FU", 6, [0, 1]], ["AN", 6, 0, 5], ["FU", 6, [1, 2]], ["AN", 6, 1, 4], ["FU", 6, [2, 3]], ["AN", 6, 2, 6], ["FU", 4, [0, 1]], ["SP", 4, 0, 36, [1], 1], ["AN", 4, 1, 2], ["FFSP", 4, 0, [3, 2], 1, 1], ["AN", 4, 1, 6], ["FU", 2, [0, 1]], ["SP", 2, 0, 6, [1], 1], ["AN", 2, 1, 2], ["FFSP", 2, 0, [3, 2], 1, 1], ["AN", 2, 1, 6], ["PR", 5, 0, "auto_unroll_max_step$1024"]]]], "r": [[0.000314828, 0.000314759, 0.000314827], 0, 30.8695, 1662032148], "v": "v0.6"}
{"i": [["[\"fused_pointwise_conv_bias_add_sigmoid_mul\", 7, 7, 48, 1152, 1]", "cuda -keys=cuda,gpu -max_num_threads=1024 -model=unknown -thread_warp_size=32", [-1, 16, 64, 49152, 2147483647, 1024, 8, 32], "", 0, []], [[], [["CI", 5], ["CHW", 3, "local"], ["SP", 3, 0, 1, [1, 1, 1, 1], 1], ["SP", 3, 5, 1152, [4, 144, 1, 1], 1], ["SP", 3, 10, 48, [4, 1], 1], ["RE", 3, [0, 5, 1, 6, 2, 7, 10, 11, 3, 8, 12, 4, 9]], ["FSP", 4, 0, 2, 3], ["FSP", 4, 4, 3, 3], ["RE", 4, [0, 4, 1, 5, 2, 6, 3, 7]], ["CA", 3, 4, 5], ["CHR", 2, "shared", [3]], ["CA", 3, 4, 6], ["CHR", 1, "shared", [4]], ["CA", 2, 5, 6], ["FU", 9, [0, 1, 2, 3]], ["SP", 9, 0, 56448, [16], 1], ["AN", 9, 0, 5], ["AN", 9, 1, 6], ["FU", 6, [0, 1]], ["AN", 6, 0, 5], ["FU", 6, [1, 2]], ["AN", 6, 1, 4], ["FU", 6, [2, 3]], ["AN", 6, 2, 6], ["FU", 4, [0, 1]], ["SP", 4, 0, 4, [1], 1], ["AN", 4, 1, 2], ["FFSP", 4, 0, [3, 2], 1, 1], ["AN", 4, 1, 6], ["FU", 2, [0, 1]], ["SP", 2, 0, 4, [1], 1], ["AN", 2, 1, 2], ["FFSP", 2, 0, [3, 2], 1, 1], ["AN", 2, 1, 6], ["PR", 5, 0, "auto_unroll_max_step$512"]]]], "r": [[2.75466e-05, 2.75389e-05, 2.7545e-05], 0, 26.6567, 1662032149], "v": "v0.6"}
{"i": [["[\"fused_pointwise_conv_bias_add_sigmoid_mul\", 7, 7, 48, 1152, 1]", "cuda -keys=cuda,gpu -max_num_threads=1024 -model=unknown -thread_warp_size=32", [-1, 16, 64, 49152, 2147483647, 1024, 8, 32], "", 0, []], [[], [["CI", 5], ["CHW", 3, "local"], ["SP", 3, 0, 1, [1, 1, 1, 1], 1], ["SP", 3, 5, 1152, [2, 36, 8, 1], 1], ["SP", 3, 10, 48, [1, 3], 1], ["RE", 3, [0, 5, 1, 6, 2, 7, 10, 11, 3, 8, 12, 4, 9]], ["FSP", 4, 0, 2, 3], ["FSP", 4, 4, 3, 3], ["RE", 4, [0, 4, 1, 5, 2, 6, 3, 7]], ["CA", 3, 4, 5], ["CHR", 2, "shared", [3]], ["CA", 3, 4, 6], ["CHR", 1, "shared", [4]], ["CA", 2, 5, 6], ["FU", 9, [0, 1, 2, 3]], ["SP", 9, 0, 56448, [1], 1], ["AN", 9, 0, 5], ["AN", 9, 1, 6], ["FU", 6, [0, 1]], ["AN", 6, 0, 5], ["FU", 6, [1, 2]], ["AN", 6, 1, 4], ["FU", 6, [2, 3]], ["AN", 6, 2, 6], ["FU", 4, [0, 1]], ["SP", 4, 0, 24, [1], 1], ["AN", 4, 1, 2], ["FFSP", 4, 0, [3, 2], 1, 1], ["AN", 4, 1, 6], ["FU", 2, [0, 1]], ["SP", 2, 0, 3, [3], 1], ["AN", 2, 1, 2], ["FFSP", 2, 0, [3, 2], 1, 1], ["AN", 2, 1, 6], ["PR", 5, 0, "auto_unroll_max_step$512"]]]], "r": [[0.000110507, 0.000110491, 0.000110477], 0, 26.4257, 1662032149], "v": "v0.6"}
{"i": [["[\"fused_pointwise_conv_bias_add_sigmoid_mul\", 7, 7, 48, 1152, 1]", "cuda -keys=cuda,gpu -max_num_threads=1024 -model=unknown -thread_warp_size=32", [-1, 16, 64, 49152, 2147483647, 1024, 8, 32], "", 0, []], [[], [["CI", 5], ["CHW", 3, "local"], ["SP", 3, 0, 1, [1, 1, 1, 1], 1], ["SP", 3, 5, 1152, [1, 96, 2, 2], 1], ["SP", 3, 10, 48, [2, 12], 1], ["RE", 3, [0, 5, 1, 6, 2, 7, 10, 11, 3, 8, 12, 4, 9]], ["FSP", 4, 0, 2, 3], ["FSP", 4, 4, 3, 3], ["RE", 4, [0, 4, 1, 5, 2, 6, 3, 7]], ["CA", 3, 4, 5], ["CHR", 2, "shared", [3]], ["CA", 3, 4, 6], ["CHR", 1, "shared", [4]], ["CA", 2, 5, 6], ["FU", 9, [0, 1, 2, 3]], ["SP", 9, 0, 56448, [32], 1], ["AN", 9, 0, 5], ["AN", 9, 1, 6], ["FU", 6, [0, 1]], ["AN", 6, 0, 5], ["FU", 6, [1, 2]], ["AN", 6, 1, 4], ["FU", 6, [2, 3]], ["AN", 6, 2, 6], ["FU", 4, [0, 1]], ["SP", 4, 0, 96, [1], 1], ["AN", 4, 1, 2], ["FFSP", 4, 0, [3, 2], 1, 1], ["AN", 4, 1, 6], ["FU", 2, [0, 1]], ["SP", 2, 0, 24, [1], 1], ["AN", 2, 1, 2], ["FFSP", 2, 0, [3, 2], 1, 1], ["AN", 2, 1, 6], ["PR", 5, 0, "auto_unroll_max_step$0"]]]], "r": [[2.59927e-05, 2.59795e-05, 2.59787e-05], 0, 26.5132, 1662032150], "v": "v0.6"}
{"i": [["[\"fused_pointwise_conv_bias_add_sigmoid_mul\", 7, 7, 48, 1152, 1]", "cuda -keys=cuda,gpu -max_num_threads=1024 -model=unknown -thread_warp_size=32", [-1, 16, 64, 49152, 2147483647, 1024, 8, 32], "", 0, []], [[], [["CI", 5], ["CHW", 3, "local"], ["SP", 3, 0, 1, [1, 1, 1, 1], 1], ["SP", 3, 5, 1152, [1, 192, 2, 1], 1], ["SP", 3, 10, 48, [1, 6], 1], ["RE", 3, [0, 5, 1, 6, 2, 7, 10, 11, 3, 8, 12, 4, 9]], ["FSP", 4, 0, 2, 3], ["FSP", 4, 4, 3, 3], ["RE", 4, [0, 4, 1, 5, 2, 6, 3, 7]], ["CA", 3, 4, 5], ["CHR", 2, "shared", [3]], ["CA", 3, 4, 6], ["CHR", 1, "shared", [4]], ["CA", 2, 5, 6], ["FU", 9, [0, 1, 2, 3]], ["SP", 9, 0, 56448, [32], 1], ["AN", 9, 0, 5], ["AN", 9, 1, 6], ["FU", 6, [0, 1]], ["AN", 6, 0, 5], ["FU", 6, [1, 2]], ["AN", 6, 1, 4], ["FU", 6, [2, 3]], ["AN", 6, 2, 6], ["FU", 4, [0, 1]], ["SP", 4, 0, 24, [1], 1], ["AN", 4, 1, 2], ["FFSP", 4, 0, [3, 2], 1, 1], ["AN", 4, 1, 6], ["FU", 2, [0, 1]], ["SP", 2, 0, 12, [1], 1], ["AN", 2, 1, 2], ["FFSP", 2, 0, [3, 2], 1, 1], ["AN", 2, 1, 6], ["PR", 5, 0, "auto_unroll_max_step$64"]]]], "r": [[1.86199e-05, 1.86113e-05, 1.86213e-05], 0, 26.2661, 1662032150], "v": "v0.6"}
{"i": [["[\"fused_pointwise_conv_bias_add_sigmoid_mul\", 7, 7, 48, 1152, 1]", "cuda -keys=cuda,gpu -max_num_threads=1024 -model=unknown -thread_warp_size=32", [-1, 16, 64, 49152, 2147483647, 1024, 8, 32], "", 0, []], [[], [["CI", 5], ["CHW", 3, "local"], ["SP", 3, 0, 1, [1, 1, 1, 1], 1], ["SP", 3, 5, 1152, [1, 48, 4, 1], 1], ["SP", 3, 10, 48, [1, 6], 1], ["RE", 3, [0, 5, 1, 6, 2, 7, 10, 11, 3, 8, 12, 4, 9]], ["FSP", 4, 0, 2, 3], ["FSP", 4, 4, 3, 3], ["RE", 4, [0, 4, 1, 5, 2, 6, 3, 7]], ["CA", 3, 4, 5], ["CHR", 2, "shared", [3]], ["CA", 3, 4, 6], ["CHR", 1, "shared", [4]], ["CA", 2, 5, 6], ["FU", 9, [0, 1, 2, 3]], ["SP", 9, 0, 56448, [32], 1], ["AN", 9, 0, 5], ["AN", 9, 1, 6], ["FU", 6, [0, 1]], ["AN", 6, 0, 5], ["FU", 6, [1, 2]], ["AN", 6, 1, 4], ["FU", 6, [2, 3]], ["AN", 6, 2, 6], ["FU", 4, [0, 1]], ["SP", 4, 0, 24, [3], 1], ["AN", 4, 1, 2], ["FFSP", 4, 0, [3, 2], 1, 1], ["AN", 4, 1, 6], ["FU", 2, [0, 1]], ["SP", 2, 0, 6, [3], 1], ["AN", 2, 1, 2], ["FFSP", 2, 0, [3, 2], 1, 1], ["AN", 2, 1, 6], ["PR", 5, 0, "auto_unroll_max_step$512"]]]], "r": [[2.12664e-05, 2.12681e-05, 2.1282e-05], 0, 26.1367, 1662032151], "v": "v0.6"}
{"i": [["[\"fused_pointwise_conv_bias_add_sigmoid_mul\", 7, 7, 48, 1152, 1]", "cuda -keys=cuda,gpu -max_num_threads=1024 -model=unknown -thread_warp_size=32", [-1, 16, 64, 49152, 2147483647, 1024, 8, 32], "", 0, []], [[], [["CI", 5], ["CHW", 3, "local"], ["SP", 3, 0, 1, [1, 1, 1, 1], 1], ["SP", 3, 5, 1152, [1, 288, 1, 4], 1], ["SP", 3, 10, 48, [1, 1], 1], ["RE", 3, [0, 5, 1, 6, 2, 7, 10, 11, 3, 8, 12, 4, 9]], ["FSP", 4, 0, 2, 3], ["FSP", 4, 4, 3, 3], ["RE", 4, [0, 4, 1, 5, 2, 6, 3, 7]], ["CA", 3, 4, 5], ["CHR", 2, "shared", [3]], ["CA", 3, 4, 6], ["CHR", 1, "shared", [4]], ["CA", 2, 5, 6], ["FU", 9, [0, 1, 2, 3]], ["SP", 9, 0, 56448, [32], 1], ["AN", 9, 0, 5], ["AN", 9, 1, 6], ["FU", 6, [0, 1]], ["AN", 6, 0, 5], ["FU", 6, [1, 2]], ["AN", 6, 1, 4], ["FU", 6, [2, 3]], ["AN", 6, 2, 6], ["FU", 4, [0, 1]], ["SP", 4, 0, 16, [1], 1], ["AN", 4, 1, 2], ["FFSP", 4, 0, [3, 2], 1, 1], ["AN", 4, 1, 6], ["FU", 2, [0, 1]], ["SP", 2, 0, 4, [1], 1], ["AN", 2, 1, 2], ["FFSP", 2, 0, [3, 2], 1, 1], ["AN", 2, 1, 6], ["PR", 5, 0, "auto_unroll_max_step$1024"]]]], "r": [[3.19961e-05, 3.20215e-05, 3.20164e-05], 0, 26.268, 1662032152], "v": "v0.6"}
{"i": [["[\"fused_pointwise_conv_bias_add_sigmoid_mul\", 7, 7, 48, 1152, 1]", "cuda -keys=cuda,gpu -max_num_threads=1024 -model=unknown -thread_warp_size=32", [-1, 16, 64, 49152, 2147483647, 1024, 8, 32], "", 0, []], [[], [["CI", 5], ["CHW", 3, "local"], ["SP", 3, 0, 1, [1, 1, 1, 1], 1], ["SP", 3, 5, 1152, [2, 32, 1, 2], 1], ["SP", 3, 10, 48, [1, 16], 1], ["RE", 3, [0, 5, 1, 6, 2, 7, 10, 11, 3, 8, 12, 4, 9]], ["FSP", 4, 0, 2, 3], ["FSP", 4, 4, 3, 3], ["RE", 4, [0, 4, 1, 5, 2, 6, 3, 7]], ["CA", 3, 4, 5], ["CHR", 2, "shared", [3]], ["CA", 3, 4, 6], ["CHR", 1, "shared", [4]], ["CA", 2, 5, 6], ["FU", 9, [0, 1, 2, 3]], ["SP", 9, 0, 56448, [32], 1], ["AN", 9, 0, 5], ["AN", 9, 1, 6], ["FU", 6, [0, 1]], ["AN", 6, 0, 5], ["FU", 6, [1, 2]], ["AN", 6, 1, 4], ["FU", 6, [2, 3]], ["AN", 6, 2, 6], ["FU", 4, [0, 1]], ["SP", 4, 0, 32, [1], 1], ["AN", 4, 1, 2], ["FFSP", 4, 0, [3, 2], 1, 1], ["AN", 4, 1, 6], ["FU", 2, [0, 1]], ["SP", 2, 0, 16, [1], 1], ["AN", 2, 1, 2], ["FFSP", 2, 0, [3, 2], 1, 1], ["AN", 2, 1, 6], ["PR", 5, 0, "auto_unroll_max_step$64"]]]], "r": [[1.92597e-05, 1.92608e-05, 1.92598e-05], 0, 26.0328, 1662032152], "v": "v0.6"}
{"i": [["[\"fused_pointwise_conv_bias_add_sigmoid_mul\", 7, 7, 48, 1152, 1]", "cuda -keys=cuda,gpu -max_num_threads=1024 -model=unknown -thread_warp_size=32", [-1, 16, 64, 49152, 2147483647, 1024, 8, 32], "", 0, []], [[], [["CI", 5], ["CHW", 3, "local"], ["SP", 3, 0, 1, [1, 1, 1, 1], 1], ["SP", 3, 5, 1152, [4, 9, 1, 2], 1], ["SP", 3, 10, 48, [24, 1], 1], ["RE", 3, [0, 5, 1, 6, 2, 7, 10, 11, 3, 8, 12, 4, 9]], ["FSP", 4, 0, 2, 3], ["FSP", 4, 4, 3, 3], ["RE", 4, [0, 4, 1, 5, 2, 6, 3, 7]], ["CA", 3, 4, 5], ["CHR", 2, "shared", [3]], ["CA", 3, 4, 6], ["CHR", 1, "shared", [4]], ["CA", 2, 5, 6], ["FU", 9, [0, 1, 2, 3]], ["SP", 9, 0, 56448, [32], 1], ["AN", 9, 0, 5], ["AN", 9, 1, 6], ["FU", 6, [0, 1]], ["AN", 6, 0, 5], ["FU", 6, [1, 2]], ["AN", 6, 1, 4], ["FU", 6, [2, 3]], ["AN", 6, 2, 6], ["FU", 4, [0, 1]], ["SP", 4, 0, 48, [1], 1], ["AN", 4, 1, 2], ["FFSP", 4, 0, [3, 2], 1, 1], ["AN", 4, 1, 6], ["FU", 2, [0, 1]], ["SP", 2, 0, 24, [8], 1], ["AN", 2, 1, 2], ["FFSP", 2, 0, [3, 2], 1, 1], ["AN", 2, 1, 6], ["PR", 5, 0, "auto_unroll_max_step$16"]]]], "r": [[3.93765e-05, 3.93944e-05, 3.93944e-05], 0, 25.9047, 1662032153], "v": "v0.6"}
{"i": [["[\"fused_pointwise_conv_bias_add_sigmoid_mul\", 7, 7, 48, 1152, 1]", "cuda -keys=cuda,gpu -max_num_threads=1024 -model=unknown -thread_warp_size=32", [-1, 16, 64, 49152, 2147483647, 1024, 8, 32], "", 0, []], [[], [["CI", 5], ["CHW", 3, "local"], ["SP", 3, 0, 1, [1, 1, 1, 1], 1], ["SP", 3, 5, 1152, [2, 32, 9, 1], 1], ["SP", 3, 10, 48, [4, 2], 1], ["RE", 3, [0, 5, 1, 6, 2, 7, 10, 11, 3, 8, 12, 4, 9]], ["FSP", 4, 0, 2, 3], ["FSP", 4, 4, 3, 3], ["RE", 4, [0, 4, 1, 5, 2, 6, 3, 7]], ["CA", 3, 4, 5], ["CHR", 2, "shared", [3]], ["CA", 3, 4, 6], ["CHR", 1, "shared", [4]], ["CA", 2, 5, 6], ["FU", 9, [0, 1, 2, 3]], ["SP", 9, 0, 56448, [32], 1], ["AN", 9, 0, 5], ["AN", 9, 1, 6], ["FU", 6, [0, 1]], ["AN", 6, 0, 5], ["FU", 6, [1, 2]], ["AN", 6, 1, 4], ["FU", 6, [2, 3]], ["AN", 6, 2, 6], ["FU", 4, [0, 1]], ["SP", 4, 0, 144, [1], 1], ["AN", 4, 1, 2], ["FFSP", 4, 0, [3, 2], 1, 1], ["AN", 4, 1, 6], ["FU", 2, [0, 1]], ["SP", 2, 0, 16, [1], 1], ["AN", 2, 1, 2], ["FFSP", 2, 0, [3, 2], 1, 1], ["AN", 2, 1, 6], ["PR", 5, 0, "auto_unroll_max_step$64"]]]], "r": [[7.34022e-05, 7.33977e-05, 7.34003e-05], 0, 25.9196, 1662032154], "v": "v0.6"}
{"i": [["[\"fused_pointwise_conv_bias_add_sigmoid_mul\", 7, 7, 48, 1152, 1]", "cuda -keys=cuda,gpu -max_num_threads=1024 -model=unknown -thread_warp_size=32", [-1, 16, 64, 49152, 2147483647, 1024, 8, 32], "", 0, []], [[], [["CI", 5], ["CHW", 3, "local"], ["SP", 3, 0, 1, [1, 1, 1, 1], 1], ["SP", 3, 5, 1152, [2, 576, 1, 1], 1], ["SP", 3, 10, 48, [2, 1], 1], ["RE", 3, [0, 5, 1, 6, 2, 7, 10, 11, 3, 8, 12, 4, 9]], ["FSP", 4, 0, 2, 3], ["FSP", 4, 4, 3, 3], ["RE", 4, [0, 4, 1, 5, 2, 6, 3, 7]], ["CA", 3, 4, 5], ["CHR", 2, "shared", [3]], ["CA", 3, 4, 6], ["CHR", 1, "shared", [4]], ["CA", 2, 5, 6], ["FU", 9, [0, 1, 2, 3]], ["SP", 9, 0, 56448, [1], 1], ["AN", 9, 0, 5], ["AN", 9, 1, 6], ["FU", 6, [0, 1]], ["AN", 6, 0, 5], ["FU", 6, [1, 2]], ["AN", 6, 1, 4], ["FU", 6, [2, 3]], ["AN", 6, 2, 6], ["FU", 4, [0, 1]], ["SP", 4, 0, 16, [1], 1], ["AN", 4, 1, 2], ["FFSP", 4, 0, [3, 2], 1, 1], ["AN", 4, 1, 6], ["FU", 2, [0, 1]], ["SP", 2, 0, 4, [4], 1], ["AN", 2, 1, 2], ["FFSP", 2, 0, [3, 2], 1, 1], ["AN", 2, 1, 6], ["PR", 5, 0, "auto_unroll_max_step$64"]]]], "r": [[9.71503e-05, 9.71564e-05, 9.71736e-05], 0, 25.7231, 1662032154], "v": "v0.6"}
{"i": [["[\"fused_pointwise_conv_bias_add_sigmoid_mul\", 7, 7, 48, 1152, 1]", "cuda -keys=cuda,gpu -max_num_threads=1024 -model=unknown -thread_warp_size=32", [-1, 16, 64, 49152, 2147483647, 1024, 8, 32], "", 0, []], [[], [["CI", 5], ["CHW", 3, "local"], ["SP", 3, 0, 1, [1, 1, 1, 1], 1], ["SP", 3, 5, 1152, [2, 32, 1, 2], 1], ["SP", 3, 10, 48, [1, 16], 1], ["RE", 3, [0, 5, 1, 6, 2, 7, 10, 11, 3, 8, 12, 4, 9]], ["FSP", 4, 0, 2, 3], ["FSP", 4, 4, 3, 3], ["RE", 4, [0, 4, 1, 5, 2, 6, 3, 7]], ["CA", 3, 4, 5], ["CHR", 2, "shared", [3]], ["CA", 3, 4, 6], ["CHR", 1, "shared", [4]], ["CA", 2, 5, 6], ["FU", 9, [0, 1, 2, 3]], ["SP", 9, 0, 56448, [32], 1], ["AN", 9, 0, 5], ["AN", 9, 1, 6], ["FU", 6, [0, 1]], ["AN", 6, 0, 5], ["FU", 6, [1, 2]], ["AN", 6, 1, 4], ["FU", 6, [2, 3]], ["AN", 6, 2, 6], ["FU", 4, [0, 1]], ["SP", 4, 0, 32, [1], 1], ["AN", 4, 1, 2], ["FFSP", 4, 0, [3, 2], 1, 1], ["AN", 4, 1, 6], ["FU", 2, [0, 1]], ["SP", 2, 0, 16, [1], 1], ["AN", 2, 1, 2], ["FFSP", 2, 0, [3, 2], 1, 1], ["AN", 2, 1, 6], ["PR", 5, 0, "auto_unroll_max_step$1024"]]]], "r": [[1.73709e-05, 1.73598e-05, 1.73741e-05], 0, 26.153, 1662032155], "v": "v0.6"}
{"i": [["[\"fused_pointwise_conv_bias_add_sigmoid_mul\", 7, 7, 48, 1152, 1]", "cuda -keys=cuda,gpu -max_num_threads=1024 -model=unknown -thread_warp_size=32", [-1, 16, 64, 49152, 2147483647, 1024, 8, 32], "", 0, []], [[], [["CI", 5], ["CHW", 3, "local"], ["SP", 3, 0, 1, [1, 1, 1, 1], 1], ["SP", 3, 5, 1152, [2, 288, 1, 2], 1], ["SP", 3, 10, 48, [8, 1], 1], ["RE", 3, [0, 5, 1, 6, 2, 7, 10, 11, 3, 8, 12, 4, 9]], ["FSP", 4, 0, 2, 3], ["FSP", 4, 4, 3, 3], ["RE", 4, [0, 4, 1, 5, 2, 6, 3, 7]], ["CA", 3, 4, 5], ["CHR", 2, "shared", [3]], ["CA", 3, 4, 6], ["CHR", 1, "shared", [4]], ["CA", 2, 5, 6], ["FU", 9, [0, 1, 2, 3]], ["SP", 9, 0, 56448, [8], 1], ["AN", 9, 0, 5], ["AN", 9, 1, 6], ["FU", 6, [0, 1]], ["AN", 6, 0, 5], ["FU", 6, [1, 2]], ["AN", 6, 1, 4], ["FU", 6, [2, 3]], ["AN", 6, 2, 6], ["FU", 4, [0, 1]], ["SP", 4, 0, 16, [4], 1], ["AN", 4, 1, 2], ["FFSP", 4, 0, [3, 2], 1, 1], ["AN", 4, 1, 6], ["FU", 2, [0, 1]], ["SP", 2, 0, 8, [1], 1], ["AN", 2, 1, 2], ["FFSP", 2, 0, [3, 2], 1, 1], ["AN", 2, 1, 6], ["PR", 5, 0, "auto_unroll_max_step$64"]]]], "r": [[2.91667e-05, 2.91637e-05, 2.91568e-05], 0, 25.8283, 1662032155], "v": "v0.6"}
