python/models/efficientnet/kernel_configs/efficient_se_module_mul_48_1.log
{"i": [["[\"se_module_mul\", 48, 1]", "cuda -keys=cuda,gpu -max_num_threads=1024 -model=unknown -thread_warp_size=32", [-1, 16, 64, 49152, 2147483647, 1024, 8, 32], "", 0, []], [[], [["FU", 2, [0, 1]], ["SP", 2, 0, 48, [3], 1], ["AN", 2, 0, 5], ["AN", 2, 1, 6]]]], "r": [[2.81397e-06, 2.80523e-06, 2.75496e-06], 0, 1.81629, 1681270428], "v": "v0.6"}
{"i": [["[\"se_module_mul\", 48, 1]", "cuda -keys=cuda,gpu -max_num_threads=1024 -model=unknown -thread_warp_size=32", [-1, 16, 64, 49152, 2147483647, 1024, 8, 32], "", 0, []], [[], [["FU", 2, [0, 1]], ["SP", 2, 0, 48, [6], 1], ["AN", 2, 0, 5], ["AN", 2, 1, 6]]]], "r": [[2.85392e-06, 2.80781e-06, 2.78361e-06], 0, 1.46627, 1681270427], "v": "v0.6"}
{"i": [["[\"se_module_mul\", 48, 1]", "cuda -keys=cuda,gpu -max_num_threads=1024 -model=unknown -thread_warp_size=32", [-1, 16, 64, 49152, 2147483647, 1024, 8, 32], "", 0, []], [[], [["FU", 2, [0, 1]], ["SP", 2, 0, 48, [48], 1], ["AN", 2, 0, 5], ["AN", 2, 1, 6]]]], "r": [[2.78552e-06, 2.76792e-06, 2.79862e-06], 0, 2.98733, 1681270429], "v": "v0.6"}
{"i": [["[\"se_module_mul\", 48, 1]", "cuda -keys=cuda,gpu -max_num_threads=1024 -model=unknown -thread_warp_size=32", [-1, 16, 64, 49152, 2147483647, 1024, 8, 32], "", 0, []], [[], [["FU", 2, [0, 1]], ["SP", 2, 0, 48, [8], 1], ["AN", 2, 0, 5], ["AN", 2, 1, 6]]]], "r": [[2.86577e-06, 2.80003e-06, 2.81296e-06], 0, 2.24117, 1681270428], "v": "v0.6"}
{"i": [["[\"se_module_mul\", 48, 1]", "cuda -keys=cuda,gpu -max_num_threads=1024 -model=unknown -thread_warp_size=32", [-1, 16, 64, 49152, 2147483647, 1024, 8, 32], "", 0, []], [[], [["FU", 2, [0, 1]], ["SP", 2, 0, 48, [1], 1], ["AN", 2, 0, 5], ["AN", 2, 1, 6]]]], "r": [[2.82933e-06, 2.87522e-06, 2.81553e-06], 0, 2.61504, 1681270429], "v": "v0.6"}
{"i": [["[\"se_module_mul\", 48, 1]", "cuda -keys=cuda,gpu -max_num_threads=1024 -model=unknown -thread_warp_size=32", [-1, 16, 64, 49152, 2147483647, 1024, 8, 32], "", 0, []], [[], [["FU", 2, [0, 1]], ["SP", 2, 0, 48, [2], 1], ["AN", 2, 0, 5], ["AN", 2, 1, 6]]]], "r": [[2.8391e-06, 2.84936e-06, 2.84338e-06], 0, 0.625779, 1681270427], "v": "v0.6"}
{"i": [["[\"se_module_mul\", 48, 1]", "cuda -keys=cuda,gpu -max_num_threads=1024 -model=unknown -thread_warp_size=32", [-1, 16, 64, 49152, 2147483647, 1024, 8, 32], "", 0, []], [[], [["FU", 2, [0, 1]], ["SP", 2, 0, 48, [32], 1], ["AN", 2, 0, 5], ["AN", 2, 1, 6]]]], "r": [[2.85044e-06, 2.81634e-06, 2.80279e-06], 0, 1.1008, 1681270427], "v": "v0.6"}
{"i": [["[\"se_module_mul\", 48, 1]", "cuda -keys=cuda,gpu -max_num_threads=1024 -model=unknown -thread_warp_size=32", [-1, 16, 64, 49152, 2147483647, 1024, 8, 32], "", 0, []], [[], [["FU", 2, [0, 1]], ["SP", 2, 0, 48, [4], 1], ["AN", 2, 0, 5], ["AN", 2, 1, 6]]]], "r": [[2.78308e-06, 2.82761e-06, 2.79091e-06], 0, 3.79744, 1681270430], "v": "v0.6"}
{"i": [["[\"se_module_mul\", 48, 1]", "cuda -keys=cuda,gpu -max_num_threads=1024 -model=unknown -thread_warp_size=32", [-1, 16, 64, 49152, 2147483647, 1024, 8, 32], "", 0, []], [[], [["FU", 2, [0, 1]], ["SP", 2, 0, 48, [24], 1], ["AN", 2, 0, 5], ["AN", 2, 1, 6]]]], "r": [[2.84063e-06, 2.83049e-06, 2.83736e-06], 0, 4.13239, 1681270430], "v": "v0.6"}
{"i": [["[\"se_module_mul\", 48, 1]", "cuda -keys=cuda,gpu -max_num_threads=1024 -model=unknown -thread_warp_size=32", [-1, 16, 64, 49152, 2147483647, 1024, 8, 32], "", 0, []], [[], [["FU", 2, [0, 1]], ["SP", 2, 0, 48, [16], 1], ["AN", 2, 0, 5], ["AN", 2, 1, 6]]]], "r": [[2.74992e-06, 2.76528e-06, 2.74997e-06], 0, 3.44065, 1681270429], "v": "v0.6"}
{"i": [["[\"se_module_mul\", 48, 1]", "cuda -keys=cuda,gpu -max_num_threads=1024 -model=unknown -thread_warp_size=32", [-1, 16, 64, 49152, 2147483647, 1024, 8, 32], "", 0, []], [[], [["FU", 2, [0, 1]], ["SP", 2, 0, 48, [12], 1], ["AN", 2, 0, 5], ["AN", 2, 1, 6]]]], "r": [[2.76996e-06, 2.76386e-06, 2.7806e-06], 0, 4.50606, 1681270431], "v": "v0.6"}
