python/models/efficientnet/kernel_configs/efficient_se_module_sigmoid_144_1.log
{"i": [["[\"se_module_sigmoid\", 144, 1]", "cuda -keys=cuda,gpu -max_num_threads=1024 -model=unknown -thread_warp_size=32", [-1, 16, 64, 49152, 2147483647, 1024, 8, 32], "", 0, []], [[], [["FU", 1, [0, 1]], ["SP", 1, 0, 144, [12], 1], ["AN", 1, 0, 5], ["AN", 1, 1, 6]]]], "r": [[2.83247e-06, 2.82298e-06, 2.76204e-06], 0, 1.03315, 1681269911], "v": "v0.6"}
{"i": [["[\"se_module_sigmoid\", 144, 1]", "cuda -keys=cuda,gpu -max_num_threads=1024 -model=unknown -thread_warp_size=32", [-1, 16, 64, 49152, 2147483647, 1024, 8, 32], "", 0, []], [[], [["FU", 1, [0, 1]], ["SP", 1, 0, 144, [4], 1], ["AN", 1, 0, 5], ["AN", 1, 1, 6]]]], "r": [[2.81786e-06, 2.82246e-06, 2.82733e-06], 0, 1.42765, 1681269911], "v": "v0.6"}
{"i": [["[\"se_module_sigmoid\", 144, 1]", "cuda -keys=cuda,gpu -max_num_threads=1024 -model=unknown -thread_warp_size=32", [-1, 16, 64, 49152, 2147483647, 1024, 8, 32], "", 0, []], [[], [["FU", 1, [0, 1]], ["SP", 1, 0, 144, [24], 1], ["AN", 1, 0, 5], ["AN", 1, 1, 6]]]], "r": [[2.79439e-06, 2.78044e-06, 2.72398e-06], 0, 0.646683, 1681269910], "v": "v0.6"}
{"i": [["[\"se_module_sigmoid\", 144, 1]", "cuda -keys=cuda,gpu -max_num_threads=1024 -model=unknown -thread_warp_size=32", [-1, 16, 64, 49152, 2147483647, 1024, 8, 32], "", 0, []], [[], [["FU", 1, [0, 1]], ["SP", 1, 0, 144, [6], 1], ["AN", 1, 0, 5], ["AN", 1, 1, 6]]]], "r": [[4.20518e-06, 4.06924e-06, 4.03523e-06], 0, 2.68722, 1681269912], "v": "v0.6"}
{"i": [["[\"se_module_sigmoid\", 144, 1]", "cuda -keys=cuda,gpu -max_num_threads=1024 -model=unknown -thread_warp_size=32", [-1, 16, 64, 49152, 2147483647, 1024, 8, 32], "", 0, []], [[], [["FU", 1, [0, 1]], ["SP", 1, 0, 144, [16], 1], ["AN", 1, 0, 5], ["AN", 1, 1, 6]]]], "r": [[2.70185e-06, 2.74593e-06, 2.75342e-06], 0, 2.2559, 1681269912], "v": "v0.6"}
{"i": [["[\"se_module_sigmoid\", 144, 1]", "cuda -keys=cuda,gpu -max_num_threads=1024 -model=unknown -thread_warp_size=32", [-1, 16, 64, 49152, 2147483647, 1024, 8, 32], "", 0, []], [[], [["FU", 1, [0, 1]], ["SP", 1, 0, 144, [2], 1], ["AN", 1, 0, 5], ["AN", 1, 1, 6]]]], "r": [[2.74599e-06, 2.73518e-06, 2.72842e-06], 0, 3.0333, 1681269913], "v": "v0.6"}
{"i": [["[\"se_module_sigmoid\", 144, 1]", "cuda -keys=cuda,gpu -max_num_threads=1024 -model=unknown -thread_warp_size=32", [-1, 16, 64, 49152, 2147483647, 1024, 8, 32], "", 0, []], [[], [["FU", 1, [0, 1]], ["SP", 1, 0, 144, [64], 1], ["AN", 1, 0, 5], ["AN", 1, 1, 6]]]], "r": [[2.73944e-06, 2.81611e-06, 2.76071e-06], 0, 1.87101, 1681269912], "v": "v0.6"}
{"i": [["[\"se_module_sigmoid\", 144, 1]", "cuda -keys=cuda,gpu -max_num_threads=1024 -model=unknown -thread_warp_size=32", [-1, 16, 64, 49152, 2147483647, 1024, 8, 32], "", 0, []], [[], [["FU", 1, [0, 1]], ["SP", 1, 0, 144, [18], 1], ["AN", 1, 0, 5], ["AN", 1, 1, 6]]]], "r": [[2.76457e-06, 2.74215e-06, 2.75865e-06], 0, 3.81954, 1681269914], "v": "v0.6"}
{"i": [["[\"se_module_sigmoid\", 144, 1]", "cuda -keys=cuda,gpu -max_num_threads=1024 -model=unknown -thread_warp_size=32", [-1, 16, 64, 49152, 2147483647, 1024, 8, 32], "", 0, []], [[], [["FU", 1, [0, 1]], ["SP", 1, 0, 144, [1], 1], ["AN", 1, 0, 5], ["AN", 1, 1, 6]]]], "r": [[2.85144e-06, 2.85053e-06, 2.86707e-06], 0, 3.37019, 1681269913], "v": "v0.6"}
{"i": [["[\"se_module_sigmoid\", 144, 1]", "cuda -keys=cuda,gpu -max_num_threads=1024 -model=unknown -thread_warp_size=32", [-1, 16, 64, 49152, 2147483647, 1024, 8, 32], "", 0, []], [[], [["FU", 1, [0, 1]], ["SP", 1, 0, 144, [32], 1], ["AN", 1, 0, 5], ["AN", 1, 1, 6]]]], "r": [[2.75091e-06, 2.78945e-06, 2.77361e-06], 0, 4.24479, 1681269914], "v": "v0.6"}
{"i": [["[\"se_module_sigmoid\", 144, 1]", "cuda -keys=cuda,gpu -max_num_threads=1024 -model=unknown -thread_warp_size=32", [-1, 16, 64, 49152, 2147483647, 1024, 8, 32], "", 0, []], [[], [["FU", 1, [0, 1]], ["SP", 1, 0, 144, [36], 1], ["AN", 1, 0, 5], ["AN", 1, 1, 6]]]], "r": [[2.79774e-06, 2.78478e-06, 2.79666e-06], 0, 4.64659, 1681269914], "v": "v0.6"}
{"i": [["[\"se_module_sigmoid\", 144, 1]", "cuda -keys=cuda,gpu -max_num_threads=1024 -model=unknown -thread_warp_size=32", [-1, 16, 64, 49152, 2147483647, 1024, 8, 32], "", 0, []], [[], [["FU", 1, [0, 1]], ["SP", 1, 0, 144, [8], 1], ["AN", 1, 0, 5], ["AN", 1, 1, 6]]]], "r": [[2.70145e-06, 2.71138e-06, 2.76856e-06], 0, 5.84112, 1681269916], "v": "v0.6"}
{"i": [["[\"se_module_sigmoid\", 144, 1]", "cuda -keys=cuda,gpu -max_num_threads=1024 -model=unknown -thread_warp_size=32", [-1, 16, 64, 49152, 2147483647, 1024, 8, 32], "", 0, []], [[], [["FU", 1, [0, 1]], ["SP", 1, 0, 144, [48], 1], ["AN", 1, 0, 5], ["AN", 1, 1, 6]]]], "r": [[2.74455e-06, 2.75725e-06, 2.69278e-06], 0, 5.07451, 1681269915], "v": "v0.6"}
{"i": [["[\"se_module_sigmoid\", 144, 1]", "cuda -keys=cuda,gpu -max_num_threads=1024 -model=unknown -thread_warp_size=32", [-1, 16, 64, 49152, 2147483647, 1024, 8, 32], "", 0, []], [[], [["FU", 1, [0, 1]], ["SP", 1, 0, 144, [9], 1], ["AN", 1, 0, 5], ["AN", 1, 1, 6]]]], "r": [[2.79437e-06, 2.82239e-06, 2.82359e-06], 0, 5.46389, 1681269915], "v": "v0.6"}
{"i": [["[\"se_module_sigmoid\", 144, 1]", "cuda -keys=cuda,gpu -max_num_threads=1024 -model=unknown -thread_warp_size=32", [-1, 16, 64, 49152, 2147483647, 1024, 8, 32], "", 0, []], [[], [["FU", 1, [0, 1]], ["SP", 1, 0, 144, [3], 1], ["AN", 1, 0, 5], ["AN", 1, 1, 6]]]], "r": [[2.86552e-06, 2.81173e-06, 2.82453e-06], 0, 6.24754, 1681269916], "v": "v0.6"}
