python/models/efficientnet/kernel_configs/efficient_se_module_sigmoid_8_1.log
{"i": [["[\"se_module_sigmoid\", 8, 1]", "cuda -keys=cuda,gpu -max_num_threads=1024 -model=unknown -thread_warp_size=32", [-1, 16, 64, 49152, 2147483647, 1024, 8, 32], "", 0, []], [[], [["FU", 1, [0, 1]], ["AN", 1, 0, 6]]]], "r": [[3.69313e-06, 3.56521e-06, 3.5457e-06], 0, 0.627516, 1681269321], "v": "v0.6"}
{"i": [["[\"se_module_sigmoid\", 8, 1]", "cuda -keys=cuda,gpu -max_num_threads=1024 -model=unknown -thread_warp_size=32", [-1, 16, 64, 49152, 2147483647, 1024, 8, 32], "", 0, []], [[], [["FU", 1, [0, 1]], ["AN", 1, 0, 6]]]], "r": [[2.67153e-06, 2.64331e-06, 2.65128e-06], 0, 0.618642, 1681269851], "v": "v0.6"}
