python/models/efficientnet/kernel_configs/efficientnet-b0_autotvm.log
{"input": ["cuda -keys=cuda,gpu -max_num_threads=1024 -model=unknown -thread_warp_size=32", "dense_small_batch.gpu", [["TENSOR", [1, 1280], "float32"], ["TENSOR", [1000, 1280], "float32"], null, "float32"], {}], "config": {"index": 8, "code_hash": null, "entity": [["tile_k", "sp", [-1, 32]]]}, "result": [[4.983519409781906e-06], 0, 1.448854923248291, 1663087199.7592137], "version": 0.2, "tvm_version": "0.8.0"}
{"input": ["cuda -keys=cuda,gpu -max_num_threads=1024 -model=unknown -thread_warp_size=32", "conv2d_nhwc.gpu", [["TENSOR", [1, 7, 7, 320], "float32"], ["TENSOR", [1, 1, 320, 1280], "float32"], [1, 1], [0, 0, 0, 0], [1, 1], "float32"], {}], "config": {"index": 1242, "code_hash": null, "entity": [["tile_n", "ot", 2], ["tile_c", "ot", 2], ["num_thread_n", "ot", 4], ["num_thread_c", "ot", 8], ["vthread_n", "ot", 2], ["vthread_c", "ot", 2], ["step", "ot", 64], ["vectorize", "ot", 1]]}, "result": [[8.695574963976945e-05], 0, 1.6819899082183838, 1663087231.8304925], "version": 0.2, "tvm_version": "0.8.0"}
{"input": ["cuda -keys=cuda,gpu -max_num_threads=1024 -model=unknown -thread_warp_size=32", "conv2d_nhwc.gpu", [["TENSOR", [1, 7, 7, 1152], "float32"], ["TENSOR", [1, 1, 1152, 320], "float32"], [1, 1], [0, 0, 0, 0], [1, 1], "float32"], {}], "config": {"index": 1001, "code_hash": null, "entity": [["tile_n", "ot", 8], ["tile_c", "ot", 2], ["num_thread_n", "ot", 4], ["num_thread_c", "ot", 8], ["vthread_n", "ot", 1], ["vthread_c", "ot", 1], ["step", "ot", 64], ["vectorize", "ot", 1]]}, "result": [[0.00021462008325952167], 0, 1.5783212184906006, 1663087240.3035839], "version": 0.2, "tvm_version": "0.8.0"}
{"input": ["cuda -keys=cuda,gpu -max_num_threads=1024 -model=unknown -thread_warp_size=32", "conv2d_nhwc.gpu", [["TENSOR", [1, 7, 7, 1152], "float32"], ["TENSOR", [1, 1, 1152, 192], "float32"], [1, 1], [0, 0, 0, 0], [1, 1], "float32"], {}], "config": {"index": 724, "code_hash": null, "entity": [["tile_n", "ot", 4], ["tile_c", "ot", 4], ["num_thread_n", "ot", 16], ["num_thread_c", "ot", 16], ["vthread_n", "ot", 1], ["vthread_c", "ot", 1], ["step", "ot", 32], ["vectorize", "ot", 1]]}, "result": [[0.00036127553800298064], 0, 1.475975513458252, 1663087254.353684], "version": 0.2, "tvm_version": "0.8.0"}
{"input": ["cuda -keys=cuda,gpu -max_num_threads=1024 -model=unknown -thread_warp_size=32", "conv2d_nhwc.gpu", [["TENSOR", [1, 1, 1, 48], "float32"], ["TENSOR", [1, 1, 48, 1152], "float32"], [1, 1], [0, 0, 0, 0], [1, 1], "float32"], {}], "config": {"index": 1256, "code_hash": null, "entity": [["tile_n", "ot", 8], ["tile_c", "ot", 4], ["num_thread_n", "ot", 8], ["num_thread_c", "ot", 8], ["vthread_n", "ot", 2], ["vthread_c", "ot", 2], ["step", "ot", 64], ["vectorize", "ot", 1]]}, "result": [[6.192516494986952e-06], 0, 1.4283852577209473, 1663087263.4736955], "version": 0.2, "tvm_version": "0.8.0"}
{"input": ["cuda -keys=cuda,gpu -max_num_threads=1024 -model=unknown -thread_warp_size=32", "conv2d_nhwc.gpu", [["TENSOR", [1, 1, 1, 1152], "float32"], ["TENSOR", [1, 1, 1152, 48], "float32"], [1, 1], [0, 0, 0, 0], [1, 1], "float32"], {}], "config": {"index": 1388, "code_hash": null, "entity": [["tile_n", "ot", 8], ["tile_c", "ot", 2], ["num_thread_n", "ot", 8], ["num_thread_c", "ot", 4], ["vthread_n", "ot", 2], ["vthread_c", "ot", 1], ["step", "ot", 16], ["vectorize", "ot", 2]]}, "result": [[5.0146733222175904e-05], 0, 1.4732189178466797, 1663087407.7666438], "version": 0.2, "tvm_version": "0.8.0"}
{"input": ["cuda -keys=cuda,gpu -max_num_threads=1024 -model=unknown -thread_warp_size=32", "conv2d_nhwc.gpu", [["TENSOR", [1, 7, 7, 192], "float32"], ["TENSOR", [1, 1, 192, 1152], "float32"], [1, 1], [0, 0, 0, 0], [1, 1], "float32"], {}], "config": {"index": 839, "code_hash": null, "entity": [["tile_n", "ot", 8], ["tile_c", "ot", 2], ["num_thread_n", "ot", 4], ["num_thread_c", "ot", 8], ["vthread_n", "ot", 1], ["vthread_c", "ot", 2], ["step", "ot", 32], ["vectorize", "ot", 1]]}, "result": [[5.707258961593172e-05], 0, 1.4954111576080322, 1663087417.5002534], "version": 0.2, "tvm_version": "0.8.0"}
{"input": ["cuda -keys=cuda,gpu -max_num_threads=1024 -model=unknown -thread_warp_size=32", "conv2d_nhwc.gpu", [["TENSOR", [1, 7, 7, 672], "float32"], ["TENSOR", [1, 1, 672, 192], "float32"], [1, 1], [0, 0, 0, 0], [1, 1], "float32"], {}], "config": {"index": 1260, "code_hash": null, "entity": [["tile_n", "ot", 2], ["tile_c", "ot", 2], ["num_thread_n", "ot", 16], ["num_thread_c", "ot", 8], ["vthread_n", "ot", 2], ["vthread_c", "ot", 2], ["step", "ot", 64], ["vectorize", "ot", 1]]}, "result": [[0.00024418496273917424], 0, 1.484032154083252, 1663087427.350469], "version": 0.2, "tvm_version": "0.8.0"}
{"input": ["cuda -keys=cuda,gpu -max_num_threads=1024 -model=unknown -thread_warp_size=32", "conv2d_nhwc.gpu", [["TENSOR", [1, 14, 14, 672], "float32"], ["TENSOR", [1, 1, 672, 112], "float32"], [1, 1], [0, 0, 0, 0], [1, 1], "float32"], {}], "config": {"index": 344, "code_hash": null, "entity": [["tile_n", "ot", 8], ["tile_c", "ot", 2], ["num_thread_n", "ot", 16], ["num_thread_c", "ot", 4], ["vthread_n", "ot", 1], ["vthread_c", "ot", 1], ["step", "ot", 3], ["vectorize", "ot", 1]]}, "result": [[0.0005529990661764706], 0, 1.021270751953125, 1663087433.1930013], "version": 0.2, "tvm_version": "0.8.0"}
{"input": ["cuda -keys=cuda,gpu -max_num_threads=1024 -model=unknown -thread_warp_size=32", "conv2d_nhwc.gpu", [["TENSOR", [1, 1, 1, 28], "float32"], ["TENSOR", [1, 1, 28, 672], "float32"], [1, 1], [0, 0, 0, 0], [1, 1], "float32"], {}], "config": {"index": 1396, "code_hash": null, "entity": [["tile_n", "ot", 4], ["tile_c", "ot", 2], ["num_thread_n", "ot", 16], ["num_thread_c", "ot", 4], ["vthread_n", "ot", 2], ["vthread_c", "ot", 1], ["step", "ot", 16], ["vectorize", "ot", 2]]}, "result": [[4.755936412244637e-06], 0, 1.4507660865783691, 1663087438.684695], "version": 0.2, "tvm_version": "0.8.0"}
{"input": ["cuda -keys=cuda,gpu -max_num_threads=1024 -model=unknown -thread_warp_size=32", "conv2d_nhwc.gpu", [["TENSOR", [1, 1, 1, 672], "float32"], ["TENSOR", [1, 1, 672, 28], "float32"], [1, 1], [0, 0, 0, 0], [1, 1], "float32"], {}], "config": {"index": 351, "code_hash": null, "entity": [["tile_n", "ot", 2], ["tile_c", "ot", 2], ["num_thread_n", "ot", 4], ["num_thread_c", "ot", 8], ["vthread_n", "ot", 1], ["vthread_c", "ot", 1], ["step", "ot", 3], ["vectorize", "ot", 1]]}, "result": [[8.295343485733928e-05], 0, 1.4669485092163086, 1663087443.4528449], "version": 0.2, "tvm_version": "0.8.0"}
{"input": ["cuda -keys=cuda,gpu -max_num_threads=1024 -model=unknown -thread_warp_size=32", "conv2d_nhwc.gpu", [["TENSOR", [1, 14, 14, 112], "float32"], ["TENSOR", [1, 1, 112, 672], "float32"], [1, 1], [0, 0, 0, 0], [1, 1], "float32"], {}], "config": {"index": 1035, "code_hash": null, "entity": [["tile_n", "ot", 2], ["tile_c", "ot", 2], ["num_thread_n", "ot", 8], ["num_thread_c", "ot", 16], ["vthread_n", "ot", 1], ["vthread_c", "ot", 1], ["step", "ot", 64], ["vectorize", "ot", 1]]}, "result": [[8.821598355263157e-05], 0, 1.537520170211792, 1663087454.9581683], "version": 0.2, "tvm_version": "0.8.0"}
{"input": ["cuda -keys=cuda,gpu -max_num_threads=1024 -model=unknown -thread_warp_size=32", "conv2d_nhwc.gpu", [["TENSOR", [1, 14, 14, 480], "float32"], ["TENSOR", [1, 1, 480, 112], "float32"], [1, 1], [0, 0, 0, 0], [1, 1], "float32"], {}], "config": {"index": 428, "code_hash": null, "entity": [["tile_n", "ot", 8], ["tile_c", "ot", 4], ["num_thread_n", "ot", 16], ["num_thread_c", "ot", 4], ["vthread_n", "ot", 2], ["vthread_c", "ot", 1], ["step", "ot", 3], ["vectorize", "ot", 1]]}, "result": [[0.0005762083524904214], 0, 1.0166351795196533, 1663087458.9264336], "version": 0.2, "tvm_version": "0.8.0"}
{"input": ["cuda -keys=cuda,gpu -max_num_threads=1024 -model=unknown -thread_warp_size=32", "conv2d_nhwc.gpu", [["TENSOR", [1, 14, 14, 480], "float32"], ["TENSOR", [1, 1, 480, 80], "float32"], [1, 1], [0, 0, 0, 0], [1, 1], "float32"], {}], "config": {"index": 171, "code_hash": null, "entity": [["tile_n", "ot", 2], ["tile_c", "ot", 2], ["num_thread_n", "ot", 8], ["num_thread_c", "ot", 4], ["vthread_n", "ot", 1], ["vthread_c", "ot", 2], ["step", "ot", 16], ["vectorize", "ot", 1]]}, "result": [[0.00026940400111234703], 0, 1.407184362411499, 1663087461.1371636], "version": 0.2, "tvm_version": "0.8.0"}
{"input": ["cuda -keys=cuda,gpu -max_num_threads=1024 -model=unknown -thread_warp_size=32", "conv2d_nhwc.gpu", [["TENSOR", [1, 1, 1, 20], "float32"], ["TENSOR", [1, 1, 20, 480], "float32"], [1, 1], [0, 0, 0, 0], [1, 1], "float32"], {}], "config": {"index": 767, "code_hash": null, "entity": [["tile_n", "ot", 8], ["tile_c", "ot", 2], ["num_thread_n", "ot", 8], ["num_thread_c", "ot", 8], ["vthread_n", "ot", 2], ["vthread_c", "ot", 1], ["step", "ot", 32], ["vectorize", "ot", 1]]}, "result": [[3.0299194338911283e-06], 0, 1.3546528816223145, 1663087467.865862], "version": 0.2, "tvm_version": "0.8.0"}
{"input": ["cuda -keys=cuda,gpu -max_num_threads=1024 -model=unknown -thread_warp_size=32", "conv2d_nhwc.gpu", [["TENSOR", [1, 1, 1, 480], "float32"], ["TENSOR", [1, 1, 480, 20], "float32"], [1, 1], [0, 0, 0, 0], [1, 1], "float32"], {}], "config": {"index": 694, "code_hash": null, "entity": [["tile_n", "ot", 4], ["tile_c", "ot", 2], ["num_thread_n", "ot", 16], ["num_thread_c", "ot", 8], ["vthread_n", "ot", 1], ["vthread_c", "ot", 1], ["step", "ot", 32], ["vectorize", "ot", 1]]}, "result": [[3.286109075907591e-05], 0, 1.4468209743499756, 1663087481.6098778], "version": 0.2, "tvm_version": "0.8.0"}
{"input": ["cuda -keys=cuda,gpu -max_num_threads=1024 -model=unknown -thread_warp_size=32", "conv2d_nhwc.gpu", [["TENSOR", [1, 14, 14, 80], "float32"], ["TENSOR", [1, 1, 80, 480], "float32"], [1, 1], [0, 0, 0, 0], [1, 1], "float32"], {}], "config": {"index": 1099, "code_hash": null, "entity": [["tile_n", "ot", 4], ["tile_c", "ot", 2], ["num_thread_n", "ot", 16], ["num_thread_c", "ot", 8], ["vthread_n", "ot", 2], ["vthread_c", "ot", 1], ["step", "ot", 64], ["vectorize", "ot", 1]]}, "result": [[8.35778957033957e-05], 0, 1.39725923538208, 1663087487.2087817], "version": 0.2, "tvm_version": "0.8.0"}
{"input": ["cuda -keys=cuda,gpu -max_num_threads=1024 -model=unknown -thread_warp_size=32", "conv2d_nhwc.gpu", [["TENSOR", [1, 14, 14, 240], "float32"], ["TENSOR", [1, 1, 240, 80], "float32"], [1, 1], [0, 0, 0, 0], [1, 1], "float32"], {}], "config": {"index": 23, "code_hash": null, "entity": [["tile_n", "ot", 8], ["tile_c", "ot", 4], ["num_thread_n", "ot", 16], ["num_thread_c", "ot", 4], ["vthread_n", "ot", 1], ["vthread_c", "ot", 1], ["step", "ot", 16], ["vectorize", "ot", 1]]}, "result": [[0.00014510757254196642], 0, 1.5177264213562012, 1663087492.0762951], "version": 0.2, "tvm_version": "0.8.0"}
{"input": ["cuda -keys=cuda,gpu -max_num_threads=1024 -model=unknown -thread_warp_size=32", "conv2d_nhwc.gpu", [["TENSOR", [1, 28, 28, 240], "float32"], ["TENSOR", [1, 1, 240, 40], "float32"], [1, 1], [0, 0, 0, 0], [1, 1], "float32"], {}], "config": {"index": 1091, "code_hash": null, "entity": [["tile_n", "ot", 8], ["tile_c", "ot", 2], ["num_thread_n", "ot", 8], ["num_thread_c", "ot", 8], ["vthread_n", "ot", 2], ["vthread_c", "ot", 1], ["step", "ot", 64], ["vectorize", "ot", 1]]}, "result": [[0.0006320934453781513], 0, 1.0648915767669678, 1663087496.502611], "version": 0.2, "tvm_version": "0.8.0"}
{"input": ["cuda -keys=cuda,gpu -max_num_threads=1024 -model=unknown -thread_warp_size=32", "conv2d_nhwc.gpu", [["TENSOR", [1, 1, 1, 10], "float32"], ["TENSOR", [1, 1, 10, 240], "float32"], [1, 1], [0, 0, 0, 0], [1, 1], "float32"], {}], "config": {"index": 1233, "code_hash": null, "entity": [["tile_n", "ot", 2], ["tile_c", "ot", 2], ["num_thread_n", "ot", 16], ["num_thread_c", "ot", 4], ["vthread_n", "ot", 2], ["vthread_c", "ot", 2], ["step", "ot", 64], ["vectorize", "ot", 1]]}, "result": [[2.880779248330231e-06], 0, 1.3818256855010986, 1663087502.8616269], "version": 0.2, "tvm_version": "0.8.0"}
{"input": ["cuda -keys=cuda,gpu -max_num_threads=1024 -model=unknown -thread_warp_size=32", "conv2d_nhwc.gpu", [["TENSOR", [1, 1, 1, 240], "float32"], ["TENSOR", [1, 1, 240, 10], "float32"], [1, 1], [0, 0, 0, 0], [1, 1], "float32"], {}], "config": {"index": 118, "code_hash": null, "entity": [["tile_n", "ot", 4], ["tile_c", "ot", 2], ["num_thread_n", "ot", 8], ["num_thread_c", "ot", 8], ["vthread_n", "ot", 2], ["vthread_c", "ot", 1], ["step", "ot", 16], ["vectorize", "ot", 1]]}, "result": [[1.8158256431852987e-05], 0, 1.3774940967559814, 1663087506.2375722], "version": 0.2, "tvm_version": "0.8.0"}
{"input": ["cuda -keys=cuda,gpu -max_num_threads=1024 -model=unknown -thread_warp_size=32", "conv2d_nhwc.gpu", [["TENSOR", [1, 28, 28, 40], "float32"], ["TENSOR", [1, 1, 40, 240], "float32"], [1, 1], [0, 0, 0, 0], [1, 1], "float32"], {}], "config": {"index": 1116, "code_hash": null, "entity": [["tile_n", "ot", 2], ["tile_c", "ot", 2], ["num_thread_n", "ot", 8], ["num_thread_c", "ot", 16], ["vthread_n", "ot", 2], ["vthread_c", "ot", 1], ["step", "ot", 64], ["vectorize", "ot", 1]]}, "result": [[8.380567732962448e-05], 0, 1.4839487075805664, 1663087517.6041644], "version": 0.2, "tvm_version": "0.8.0"}
{"input": ["cuda -keys=cuda,gpu -max_num_threads=1024 -model=unknown -thread_warp_size=32", "conv2d_nhwc.gpu", [["TENSOR", [1, 28, 28, 144], "float32"], ["TENSOR", [1, 1, 144, 40], "float32"], [1, 1], [0, 0, 0, 0], [1, 1], "float32"], {}], "config": {"index": 389, "code_hash": null, "entity": [["tile_n", "ot", 8], ["tile_c", "ot", 2], ["num_thread_n", "ot", 8], ["num_thread_c", "ot", 16], ["vthread_n", "ot", 1], ["vthread_c", "ot", 1], ["step", "ot", 3], ["vectorize", "ot", 1]]}, "result": [[0.0003826624489795918], 0, 1.0417687892913818, 1663087525.552014], "version": 0.2, "tvm_version": "0.8.0"}
{"input": ["cuda -keys=cuda,gpu -max_num_threads=1024 -model=unknown -thread_warp_size=32", "conv2d_nhwc.gpu", [["TENSOR", [1, 56, 56, 144], "float32"], ["TENSOR", [1, 1, 144, 24], "float32"], [1, 1], [0, 0, 0, 0], [1, 1], "float32"], {}], "config": {"index": 64, "code_hash": null, "entity": [["tile_n", "ot", 4], ["tile_c", "ot", 2], ["num_thread_n", "ot", 8], ["num_thread_c", "ot", 16], ["vthread_n", "ot", 1], ["vthread_c", "ot", 1], ["step", "ot", 16], ["vectorize", "ot", 1]]}, "result": [[0.0004910289379084968], 0, 1.0946111679077148, 1663087532.302595], "version": 0.2, "tvm_version": "0.8.0"}
{"input": ["cuda -keys=cuda,gpu -max_num_threads=1024 -model=unknown -thread_warp_size=32", "conv2d_nhwc.gpu", [["TENSOR", [1, 1, 1, 6], "float32"], ["TENSOR", [1, 1, 6, 144], "float32"], [1, 1], [0, 0, 0, 0], [1, 1], "float32"], {}], "config": {"index": 427, "code_hash": null, "entity": [["tile_n", "ot", 4], ["tile_c", "ot", 4], ["num_thread_n", "ot", 16], ["num_thread_c", "ot", 4], ["vthread_n", "ot", 2], ["vthread_c", "ot", 1], ["step", "ot", 3], ["vectorize", "ot", 1]]}, "result": [[2.9179675239790213e-06], 0, 1.2575857639312744, 1663087541.8021529], "version": 0.2, "tvm_version": "0.8.0"}
{"input": ["cuda -keys=cuda,gpu -max_num_threads=1024 -model=unknown -thread_warp_size=32", "conv2d_nhwc.gpu", [["TENSOR", [1, 1, 1, 144], "float32"], ["TENSOR", [1, 1, 144, 6], "float32"], [1, 1], [0, 0, 0, 0], [1, 1], "float32"], {}], "config": {"index": 95, "code_hash": null, "entity": [["tile_n", "ot", 8], ["tile_c", "ot", 4], ["num_thread_n", "ot", 8], ["num_thread_c", "ot", 4], ["vthread_n", "ot", 2], ["vthread_c", "ot", 1], ["step", "ot", 16], ["vectorize", "ot", 1]]}, "result": [[1.4022978861498153e-05], 0, 1.4526376724243164, 1663087552.8513246], "version": 0.2, "tvm_version": "0.8.0"}
{"input": ["cuda -keys=cuda,gpu -max_num_threads=1024 -model=unknown -thread_warp_size=32", "conv2d_nhwc.gpu", [["TENSOR", [1, 56, 56, 24], "float32"], ["TENSOR", [1, 1, 24, 144], "float32"], [1, 1], [0, 0, 0, 0], [1, 1], "float32"], {}], "config": {"index": 29, "code_hash": null, "entity": [["tile_n", "ot", 8], ["tile_c", "ot", 2], ["num_thread_n", "ot", 4], ["num_thread_c", "ot", 8], ["vthread_n", "ot", 1], ["vthread_c", "ot", 1], ["step", "ot", 16], ["vectorize", "ot", 1]]}, "result": [[5.645674055829228e-05], 0, 1.533341646194458, 1663087559.0735972], "version": 0.2, "tvm_version": "0.8.0"}
{"input": ["cuda -keys=cuda,gpu -max_num_threads=1024 -model=unknown -thread_warp_size=32", "conv2d_nhwc.gpu", [["TENSOR", [1, 56, 56, 96], "float32"], ["TENSOR", [1, 1, 96, 24], "float32"], [1, 1], [0, 0, 0, 0], [1, 1], "float32"], {}], "config": {"index": 326, "code_hash": null, "entity": [["tile_n", "ot", 8], ["tile_c", "ot", 2], ["num_thread_n", "ot", 4], ["num_thread_c", "ot", 4], ["vthread_n", "ot", 1], ["vthread_c", "ot", 1], ["step", "ot", 3], ["vectorize", "ot", 1]]}, "result": [[0.00036301777245508984], 0, 1.4578912258148193, 1663087567.0699525], "version": 0.2, "tvm_version": "0.8.0"}
{"input": ["cuda -keys=cuda,gpu -max_num_threads=1024 -model=unknown -thread_warp_size=32", "conv2d_nhwc.gpu", [["TENSOR", [1, 1, 1, 4], "float32"], ["TENSOR", [1, 1, 4, 96], "float32"], [1, 1], [0, 0, 0, 0], [1, 1], "float32"], {}], "config": {"index": 388, "code_hash": null, "entity": [["tile_n", "ot", 4], ["tile_c", "ot", 2], ["num_thread_n", "ot", 8], ["num_thread_c", "ot", 16], ["vthread_n", "ot", 1], ["vthread_c", "ot", 1], ["step", "ot", 3], ["vectorize", "ot", 1]]}, "result": [[2.6575683994528043e-06], 0, 1.2788059711456299, 1663087569.7479212], "version": 0.2, "tvm_version": "0.8.0"}
{"input": ["cuda -keys=cuda,gpu -max_num_threads=1024 -model=unknown -thread_warp_size=32", "conv2d_nhwc.gpu", [["TENSOR", [1, 1, 1, 96], "float32"], ["TENSOR", [1, 1, 96, 4], "float32"], [1, 1], [0, 0, 0, 0], [1, 1], "float32"], {}], "config": {"index": 9, "code_hash": null, "entity": [["tile_n", "ot", 2], ["tile_c", "ot", 2], ["num_thread_n", "ot", 8], ["num_thread_c", "ot", 4], ["vthread_n", "ot", 1], ["vthread_c", "ot", 1], ["step", "ot", 16], ["vectorize", "ot", 1]]}, "result": [[7.738859785062156e-06], 0, 1.4753077030181885, 1663087592.4791164], "version": 0.2, "tvm_version": "0.8.0"}
{"input": ["cuda -keys=cuda,gpu -max_num_threads=1024 -model=unknown -thread_warp_size=32", "conv2d_nhwc.gpu", [["TENSOR", [1, 112, 112, 16], "float32"], ["TENSOR", [1, 1, 16, 96], "float32"], [1, 1], [0, 0, 0, 0], [1, 1], "float32"], {}], "config": {"index": 1000, "code_hash": null, "entity": [["tile_n", "ot", 4], ["tile_c", "ot", 2], ["num_thread_n", "ot", 4], ["num_thread_c", "ot", 8], ["vthread_n", "ot", 1], ["vthread_c", "ot", 1], ["step", "ot", 64], ["vectorize", "ot", 1]]}, "result": [[6.911865788720298e-05], 0, 1.5072364807128906, 1663087599.9105136], "version": 0.2, "tvm_version": "0.8.0"}
{"input": ["cuda -keys=cuda,gpu -max_num_threads=1024 -model=unknown -thread_warp_size=32", "conv2d_nhwc.gpu", [["TENSOR", [1, 112, 112, 32], "float32"], ["TENSOR", [1, 1, 32, 16], "float32"], [1, 1], [0, 0, 0, 0], [1, 1], "float32"], {}], "config": {"index": 846, "code_hash": null, "entity": [["tile_n", "ot", 2], ["tile_c", "ot", 2], ["num_thread_n", "ot", 8], ["num_thread_c", "ot", 8], ["vthread_n", "ot", 1], ["vthread_c", "ot", 2], ["step", "ot", 32], ["vectorize", "ot", 1]]}, "result": [[0.00010502881494352736], 0, 1.529893398284912, 1663087612.4089985], "version": 0.2, "tvm_version": "0.8.0"}
{"input": ["cuda -keys=cuda,gpu -max_num_threads=1024 -model=unknown -thread_warp_size=32", "conv2d_nhwc.gpu", [["TENSOR", [1, 1, 1, 8], "float32"], ["TENSOR", [1, 1, 8, 32], "float32"], [1, 1], [0, 0, 0, 0], [1, 1], "float32"], {}], "config": {"index": 202, "code_hash": null, "entity": [["tile_n", "ot", 4], ["tile_c", "ot", 4], ["num_thread_n", "ot", 8], ["num_thread_c", "ot", 8], ["vthread_n", "ot", 1], ["vthread_c", "ot", 2], ["step", "ot", 16], ["vectorize", "ot", 1]]}, "result": [[2.399502953162076e-06], 0, 1.2609155178070068, 1663087616.7681365], "version": 0.2, "tvm_version": "0.8.0"}
{"input": ["cuda -keys=cuda,gpu -max_num_threads=1024 -model=unknown -thread_warp_size=32", "conv2d_nhwc.gpu", [["TENSOR", [1, 1, 1, 32], "float32"], ["TENSOR", [1, 1, 32, 8], "float32"], [1, 1], [0, 0, 0, 0], [1, 1], "float32"], {}], "config": {"index": 884, "code_hash": null, "entity": [["tile_n", "ot", 8], ["tile_c", "ot", 2], ["num_thread_n", "ot", 16], ["num_thread_c", "ot", 16], ["vthread_n", "ot", 1], ["vthread_c", "ot", 2], ["step", "ot", 32], ["vectorize", "ot", 1]]}, "result": [[3.661160952233197e-06], 0, 1.3966035842895508, 1663087623.7678216], "version": 0.2, "tvm_version": "0.8.0"}
{"input": ["cuda -keys=cuda,gpu -max_num_threads=1024 -model=unknown -thread_warp_size=32", "conv2d_nhwc.gpu", [["TENSOR", [1, 224, 224, 3], "float32"], ["TENSOR", [3, 3, 3, 32], "float32"], [2, 2], [0, 0, 1, 1], [1, 1], "float32"], {}], "config": {"index": 389, "code_hash": null, "entity": [["tile_n", "ot", 8], ["tile_c", "ot", 2], ["num_thread_n", "ot", 8], ["num_thread_c", "ot", 16], ["vthread_n", "ot", 1], ["vthread_c", "ot", 1], ["step", "ot", 3], ["vectorize", "ot", 1]]}, "result": [[0.0002740273265536723], 0, 1.4230968952178955, 1663087627.172775], "version": 0.2, "tvm_version": "0.8.0"}
