python/models/efficientnet/kernel_configs/efficient_se_module_mul_240_1.log
{"i": [["[\"se_module_mul\", 240, 1]", "cuda -keys=cuda,gpu -max_num_threads=1024 -model=unknown -thread_warp_size=32", [-1, 16, 64, 49152, 2147483647, 1024, 8, 32], "", 0, []], [[], [["FU", 2, [0, 1]], ["SP", 2, 0, 240, [40], 1], ["AN", 2, 0, 5], ["AN", 2, 1, 6]]]], "r": [[2.75581e-06, 2.76597e-06, 2.80127e-06], 0, 2.24837, 1681270258], "v": "v0.6"}
{"i": [["[\"se_module_mul\", 240, 1]", "cuda -keys=cuda,gpu -max_num_threads=1024 -model=unknown -thread_warp_size=32", [-1, 16, 64, 49152, 2147483647, 1024, 8, 32], "", 0, []], [[], [["FU", 2, [0, 1]], ["SP", 2, 0, 240, [10], 1], ["AN", 2, 0, 5], ["AN", 2, 1, 6]]]], "r": [[2.75126e-06, 2.74575e-06, 2.78198e-06], 0, 0.6671, 1681270257], "v": "v0.6"}
{"i": [["[\"se_module_mul\", 240, 1]", "cuda -keys=cuda,gpu -max_num_threads=1024 -model=unknown -thread_warp_size=32", [-1, 16, 64, 49152, 2147483647, 1024, 8, 32], "", 0, []], [[], [["FU", 2, [0, 1]], ["SP", 2, 0, 240, [60], 1], ["AN", 2, 0, 5], ["AN", 2, 1, 6]]]], "r": [[2.73016e-06, 2.78033e-06, 2.80292e-06], 0, 1.86876, 1681270258], "v": "v0.6"}
{"i": [["[\"se_module_mul\", 240, 1]", "cuda -keys=cuda,gpu -max_num_threads=1024 -model=unknown -thread_warp_size=32", [-1, 16, 64, 49152, 2147483647, 1024, 8, 32], "", 0, []], [[], [["FU", 2, [0, 1]], ["SP", 2, 0, 240, [12], 1], ["AN", 2, 0, 5], ["AN", 2, 1, 6]]]], "r": [[2.72018e-06, 2.72713e-06, 2.74923e-06], 0, 1.48414, 1681270258], "v": "v0.6"}
{"i": [["[\"se_module_mul\", 240, 1]", "cuda -keys=cuda,gpu -max_num_threads=1024 -model=unknown -thread_warp_size=32", [-1, 16, 64, 49152, 2147483647, 1024, 8, 32], "", 0, []], [[], [["FU", 2, [0, 1]], ["SP", 2, 0, 240, [2], 1], ["AN", 2, 0, 5], ["AN", 2, 1, 6]]]], "r": [[2.77788e-06, 2.74744e-06, 2.71862e-06], 0, 2.67115, 1681270259], "v": "v0.6"}
{"i": [["[\"se_module_mul\", 240, 1]", "cuda -keys=cuda,gpu -max_num_threads=1024 -model=unknown -thread_warp_size=32", [-1, 16, 64, 49152, 2147483647, 1024, 8, 32], "", 0, []], [[], [["FU", 2, [0, 1]], ["SP", 2, 0, 240, [1], 1], ["AN", 2, 0, 5], ["AN", 2, 1, 6]]]], "r": [[2.91493e-06, 2.9153e-06, 2.91413e-06], 0, 1.06002, 1681270257], "v": "v0.6"}
{"i": [["[\"se_module_mul\", 240, 1]", "cuda -keys=cuda,gpu -max_num_threads=1024 -model=unknown -thread_warp_size=32", [-1, 16, 64, 49152, 2147483647, 1024, 8, 32], "", 0, []], [[], [["FU", 2, [0, 1]], ["SP", 2, 0, 240, [24], 1], ["AN", 2, 0, 5], ["AN", 2, 1, 6]]]], "r": [[2.7684e-06, 2.76463e-06, 2.80885e-06], 0, 5.10451, 1681270261], "v": "v0.6"}
{"i": [["[\"se_module_mul\", 240, 1]", "cuda -keys=cuda,gpu -max_num_threads=1024 -model=unknown -thread_warp_size=32", [-1, 16, 64, 49152, 2147483647, 1024, 8, 32], "", 0, []], [[], [["FU", 2, [0, 1]], ["SP", 2, 0, 240, [8], 1], ["AN", 2, 0, 5], ["AN", 2, 1, 6]]]], "r": [[2.8362e-06, 2.84152e-06, 2.80395e-06], 0, 4.30169, 1681270260], "v": "v0.6"}
{"i": [["[\"se_module_mul\", 240, 1]", "cuda -keys=cuda,gpu -max_num_threads=1024 -model=unknown -thread_warp_size=32", [-1, 16, 64, 49152, 2147483647, 1024, 8, 32], "", 0, []], [[], [["FU", 2, [0, 1]], ["SP", 2, 0, 240, [6], 1], ["AN", 2, 0, 5], ["AN", 2, 1, 6]]]], "r": [[2.82033e-06, 2.74927e-06, 2.7711e-06], 0, 3.4686, 1681270260], "v": "v0.6"}
{"i": [["[\"se_module_mul\", 240, 1]", "cuda -keys=cuda,gpu -max_num_threads=1024 -model=unknown -thread_warp_size=32", [-1, 16, 64, 49152, 2147483647, 1024, 8, 32], "", 0, []], [[], [["FU", 2, [0, 1]], ["SP", 2, 0, 240, [3], 1], ["AN", 2, 0, 5], ["AN", 2, 1, 6]]]], "r": [[2.76917e-06, 2.83069e-06, 2.80919e-06], 0, 3.92806, 1681270260], "v": "v0.6"}
{"i": [["[\"se_module_mul\", 240, 1]", "cuda -keys=cuda,gpu -max_num_threads=1024 -model=unknown -thread_warp_size=32", [-1, 16, 64, 49152, 2147483647, 1024, 8, 32], "", 0, []], [[], [["FU", 2, [0, 1]], ["SP", 2, 0, 240, [30], 1], ["AN", 2, 0, 5], ["AN", 2, 1, 6]]]], "r": [[2.83907e-06, 2.80239e-06, 2.80685e-06], 0, 3.09301, 1681270259], "v": "v0.6"}
{"i": [["[\"se_module_mul\", 240, 1]", "cuda -keys=cuda,gpu -max_num_threads=1024 -model=unknown -thread_warp_size=32", [-1, 16, 64, 49152, 2147483647, 1024, 8, 32], "", 0, []], [[], [["FU", 2, [0, 1]], ["SP", 2, 0, 240, [15], 1], ["AN", 2, 0, 5], ["AN", 2, 1, 6]]]], "r": [[2.72863e-06, 2.74565e-06, 2.72393e-06], 0, 4.719, 1681270261], "v": "v0.6"}
{"i": [["[\"se_module_mul\", 240, 1]", "cuda -keys=cuda,gpu -max_num_threads=1024 -model=unknown -thread_warp_size=32", [-1, 16, 64, 49152, 2147483647, 1024, 8, 32], "", 0, []], [[], [["FU", 2, [0, 1]], ["SP", 2, 0, 240, [5], 1], ["AN", 2, 0, 5], ["AN", 2, 1, 6]]]], "r": [[2.7695e-06, 2.81203e-06, 2.73476e-06], 0, 6.28682, 1681270263], "v": "v0.6"}
{"i": [["[\"se_module_mul\", 240, 1]", "cuda -keys=cuda,gpu -max_num_threads=1024 -model=unknown -thread_warp_size=32", [-1, 16, 64, 49152, 2147483647, 1024, 8, 32], "", 0, []], [[], [["FU", 2, [0, 1]], ["SP", 2, 0, 240, [4], 1], ["AN", 2, 0, 5], ["AN", 2, 1, 6]]]], "r": [[2.73463e-06, 2.72501e-06, 2.74682e-06], 0, 5.81432, 1681270262], "v": "v0.6"}
{"i": [["[\"se_module_mul\", 240, 1]", "cuda -keys=cuda,gpu -max_num_threads=1024 -model=unknown -thread_warp_size=32", [-1, 16, 64, 49152, 2147483647, 1024, 8, 32], "", 0, []], [[], [["FU", 2, [0, 1]], ["SP", 2, 0, 240, [16], 1], ["AN", 2, 0, 5], ["AN", 2, 1, 6]]]], "r": [[2.77656e-06, 2.81008e-06, 2.78146e-06], 0, 5.45826, 1681270262], "v": "v0.6"}
{"i": [["[\"se_module_mul\", 240, 1]", "cuda -keys=cuda,gpu -max_num_threads=1024 -model=unknown -thread_warp_size=32", [-1, 16, 64, 49152, 2147483647, 1024, 8, 32], "", 0, []], [[], [["FU", 2, [0, 1]], ["SP", 2, 0, 240, [32], 1], ["AN", 2, 0, 5], ["AN", 2, 1, 6]]]], "r": [[2.7619e-06, 2.79132e-06, 2.69565e-06], 0, 7.08691, 1681270263], "v": "v0.6"}
{"i": [["[\"se_module_mul\", 240, 1]", "cuda -keys=cuda,gpu -max_num_threads=1024 -model=unknown -thread_warp_size=32", [-1, 16, 64, 49152, 2147483647, 1024, 8, 32], "", 0, []], [[], [["FU", 2, [0, 1]], ["SP", 2, 0, 240, [48], 1], ["AN", 2, 0, 5], ["AN", 2, 1, 6]]]], "r": [[2.79216e-06, 2.80462e-06, 2.75377e-06], 0, 6.69104, 1681270263], "v": "v0.6"}
{"i": [["[\"se_module_mul\", 240, 1]", "cuda -keys=cuda,gpu -max_num_threads=1024 -model=unknown -thread_warp_size=32", [-1, 16, 64, 49152, 2147483647, 1024, 8, 32], "", 0, []], [[], [["FU", 2, [0, 1]], ["SP", 2, 0, 240, [20], 1], ["AN", 2, 0, 5], ["AN", 2, 1, 6]]]], "r": [[2.77115e-06, 2.77614e-06, 2.80536e-06], 0, 7.46166, 1681270264], "v": "v0.6"}
