python/models/efficientnet/kernel_configs/efficient_se_module_mul_96_1.log
{"i": [["[\"se_module_mul\", 96, 1]", "cuda -keys=cuda,gpu -max_num_threads=1024 -model=unknown -thread_warp_size=32", [-1, 16, 64, 49152, 2147483647, 1024, 8, 32], "", 0, []], [[], [["FU", 2, [0, 1]], ["SP", 2, 0, 96, [2], 1], ["AN", 2, 0, 5], ["AN", 2, 1, 6]]]], "r": [[2.82169e-06, 2.89548e-06, 2.91646e-06], 0, 2.39414, 1681270165], "v": "v0.6"}
{"i": [["[\"se_module_mul\", 96, 1]", "cuda -keys=cuda,gpu -max_num_threads=1024 -model=unknown -thread_warp_size=32", [-1, 16, 64, 49152, 2147483647, 1024, 8, 32], "", 0, []], [[], [["FU", 2, [0, 1]], ["SP", 2, 0, 96, [32], 1], ["AN", 2, 0, 5], ["AN", 2, 1, 6]]]], "r": [[2.78372e-06, 2.83879e-06, 2.83854e-06], 0, 1.14508, 1681270163], "v": "v0.6"}
{"i": [["[\"se_module_mul\", 96, 1]", "cuda -keys=cuda,gpu -max_num_threads=1024 -model=unknown -thread_warp_size=32", [-1, 16, 64, 49152, 2147483647, 1024, 8, 32], "", 0, []], [[], [["FU", 2, [0, 1]], ["SP", 2, 0, 96, [6], 1], ["AN", 2, 0, 5], ["AN", 2, 1, 6]]]], "r": [[2.86415e-06, 2.82733e-06, 2.83705e-06], 0, 0.70938, 1681270163], "v": "v0.6"}
{"i": [["[\"se_module_mul\", 96, 1]", "cuda -keys=cuda,gpu -max_num_threads=1024 -model=unknown -thread_warp_size=32", [-1, 16, 64, 49152, 2147483647, 1024, 8, 32], "", 0, []], [[], [["FU", 2, [0, 1]], ["SP", 2, 0, 96, [48], 1], ["AN", 2, 0, 5], ["AN", 2, 1, 6]]]], "r": [[2.86577e-06, 2.83151e-06, 2.81774e-06], 0, 1.52651, 1681270164], "v": "v0.6"}
{"i": [["[\"se_module_mul\", 96, 1]", "cuda -keys=cuda,gpu -max_num_threads=1024 -model=unknown -thread_warp_size=32", [-1, 16, 64, 49152, 2147483647, 1024, 8, 32], "", 0, []], [[], [["FU", 2, [0, 1]], ["SP", 2, 0, 96, [12], 1], ["AN", 2, 0, 5], ["AN", 2, 1, 6]]]], "r": [[3.0681e-06, 3.01533e-06, 2.97835e-06], 0, 3.2035, 1681270165], "v": "v0.6"}
{"i": [["[\"se_module_mul\", 96, 1]", "cuda -keys=cuda,gpu -max_num_threads=1024 -model=unknown -thread_warp_size=32", [-1, 16, 64, 49152, 2147483647, 1024, 8, 32], "", 0, []], [[], [["FU", 2, [0, 1]], ["SP", 2, 0, 96, [8], 1], ["AN", 2, 0, 5], ["AN", 2, 1, 6]]]], "r": [[2.94803e-06, 2.86215e-06, 2.86742e-06], 0, 2.80055, 1681270165], "v": "v0.6"}
{"i": [["[\"se_module_mul\", 96, 1]", "cuda -keys=cuda,gpu -max_num_threads=1024 -model=unknown -thread_warp_size=32", [-1, 16, 64, 49152, 2147483647, 1024, 8, 32], "", 0, []], [[], [["FU", 2, [0, 1]], ["SP", 2, 0, 96, [4], 1], ["AN", 2, 0, 5], ["AN", 2, 1, 6]]]], "r": [[2.82882e-06, 2.92872e-06, 3.87835e-06], 0, 1.93327, 1681270164], "v": "v0.6"}
{"i": [["[\"se_module_mul\", 96, 1]", "cuda -keys=cuda,gpu -max_num_threads=1024 -model=unknown -thread_warp_size=32", [-1, 16, 64, 49152, 2147483647, 1024, 8, 32], "", 0, []], [[], [["FU", 2, [0, 1]], ["SP", 2, 0, 96, [3], 1], ["AN", 2, 0, 5], ["AN", 2, 1, 6]]]], "r": [[2.83578e-06, 2.81989e-06, 2.84545e-06], 0, 3.67593, 1681270166], "v": "v0.6"}
{"i": [["[\"se_module_mul\", 96, 1]", "cuda -keys=cuda,gpu -max_num_threads=1024 -model=unknown -thread_warp_size=32", [-1, 16, 64, 49152, 2147483647, 1024, 8, 32], "", 0, []], [[], [["FU", 2, [0, 1]], ["SP", 2, 0, 96, [1], 1], ["AN", 2, 0, 5], ["AN", 2, 1, 6]]]], "r": [[2.819e-06, 2.82999e-06, 2.85196e-06], 0, 4.86807, 1681270167], "v": "v0.6"}
{"i": [["[\"se_module_mul\", 96, 1]", "cuda -keys=cuda,gpu -max_num_threads=1024 -model=unknown -thread_warp_size=32", [-1, 16, 64, 49152, 2147483647, 1024, 8, 32], "", 0, []], [[], [["FU", 2, [0, 1]], ["SP", 2, 0, 96, [16], 1], ["AN", 2, 0, 5], ["AN", 2, 1, 6]]]], "r": [[3.00534e-06, 2.87839e-06, 2.87772e-06], 0, 4.43502, 1681270167], "v": "v0.6"}
{"i": [["[\"se_module_mul\", 96, 1]", "cuda -keys=cuda,gpu -max_num_threads=1024 -model=unknown -thread_warp_size=32", [-1, 16, 64, 49152, 2147483647, 1024, 8, 32], "", 0, []], [[], [["FU", 2, [0, 1]], ["SP", 2, 0, 96, [24], 1], ["AN", 2, 0, 5], ["AN", 2, 1, 6]]]], "r": [[2.8843e-06, 2.85565e-06, 2.85422e-06], 0, 4.00314, 1681270166], "v": "v0.6"}
