python/models/efficientnet/kernel_configs/efficient_pointwise_conv_56_56_24_144.log
{"i": [["[\"pointwise_conv2d\", 56, 56, 24, 144]", "cuda -keys=cuda,gpu -max_num_threads=1024 -model=unknown -thread_warp_size=32", [-1, 16, 64, 49152, 2147483647, 1024, 8, 32], "", 0, []], [[], [["CHW", 2, "local"], ["SP", 2, 0, 3136, [1, 1, 2, 14], 1], ["SP", 2, 5, 144, [1, 36, 1, 1], 1], ["SP", 2, 10, 24, [1, 4], 1], ["RE", 2, [0, 5, 1, 6, 2, 7, 10, 11, 3, 8, 12, 4, 9]], ["FSP", 3, 0, 1, 3], ["FSP", 3, 4, 2, 3], ["RE", 3, [0, 4, 1, 5, 2, 6, 3, 7]], ["CA", 2, 3, 5], ["CHR", 1, "shared", [2]], ["CA", 2, 3, 6], ["CHR", 0, "shared", [3]], ["CA", 1, 4, 6], ["FU", 5, [0, 1]], ["AN", 5, 0, 5], ["FU", 5, [1, 2]], ["AN", 5, 1, 4], ["FU", 5, [2, 3]], ["AN", 5, 2, 6], ["FU", 3, [0, 1]], ["SP", 3, 0, 4, [4], 1], ["AN", 3, 1, 2], ["FFSP", 3, 0, [2, 1], 1, 1], ["AN", 3, 1, 6], ["FU", 1, [0, 1]], ["SP", 1, 0, 112, [14], 1], ["AN", 1, 1, 2], ["FFSP", 1, 0, [2, 1], 1, 1], ["AN", 1, 1, 6], ["PR", 4, 0, "auto_unroll_max_step$1024"]]]], "r": [[8.97625e-06, 8.97423e-06, 8.97221e-06, 8.97355e-06, 8.97485e-06, 8.97227e-06, 8.97875e-06, 8.97126e-06, 8.97415e-06, 8.97253e-06, 8.97238e-06, 8.97219e-06, 8.96959e-06, 8.97256e-06, 8.97251e-06, 8.97213e-06, 8.97391e-06, 8.97136e-06, 8.96871e-06, 8.9692e-06], 0, 9.44366, 1647786622], "v": "v0.6"}
{"i": [["[\"pointwise_conv2d\", 56, 56, 24, 144]", "cuda -keys=cuda,gpu -max_num_threads=1024 -model=unknown -thread_warp_size=32", [-1, 16, 64, 49152, 2147483647, 1024, 8, 32], "", 0, []], [[], [["CHW", 2, "local"], ["SP", 2, 0, 3136, [2, 49, 1, 2], 1], ["SP", 2, 5, 144, [1, 6, 1, 8], 1], ["SP", 2, 10, 24, [1, 1], 1], ["RE", 2, [0, 5, 1, 6, 2, 7, 10, 11, 3, 8, 12, 4, 9]], ["FSP", 3, 0, 1, 3], ["FSP", 3, 4, 2, 3], ["RE", 3, [0, 4, 1, 5, 2, 6, 3, 7]], ["CA", 2, 3, 5], ["CHR", 1, "shared", [2]], ["CA", 2, 3, 6], ["CHR", 0, "shared", [3]], ["CA", 1, 4, 6], ["FU", 5, [0, 1]], ["AN", 5, 0, 5], ["FU", 5, [1, 2]], ["AN", 5, 1, 4], ["FU", 5, [2, 3]], ["AN", 5, 2, 6], ["FU", 3, [0, 1]], ["SP", 3, 0, 8, [1], 1], ["AN", 3, 1, 2], ["FFSP", 3, 0, [2, 1], 1, 1], ["AN", 3, 1, 6], ["FU", 1, [0, 1]], ["SP", 1, 0, 2, [2], 1], ["AN", 1, 1, 2], ["FFSP", 1, 0, [2, 1], 1, 1], ["AN", 1, 1, 6], ["PR", 4, 0, "auto_unroll_max_step$1024"]]]], "r": [[2.32938e-05, 2.33009e-05, 2.33002e-05, 2.32976e-05, 2.32958e-05, 2.32937e-05, 2.32975e-05, 2.32954e-05, 2.32967e-05, 2.32998e-05, 2.32978e-05, 2.32971e-05, 2.32983e-05, 2.32945e-05, 2.32964e-05, 2.33004e-05, 2.32973e-05, 2.32962e-05, 2.32999e-05, 2.32947e-05], 0, 18.3996, 1647786631], "v": "v0.6"}
{"i": [["[\"pointwise_conv2d\", 56, 56, 24, 144]", "cuda -keys=cuda,gpu -max_num_threads=1024 -model=unknown -thread_warp_size=32", [-1, 16, 64, 49152, 2147483647, 1024, 8, 32], "", 0, []], [[], [["CHW", 2, "local"], ["SP", 2, 0, 3136, [2, 4, 1, 7], 1], ["SP", 2, 5, 144, [1, 36, 4, 1], 1], ["SP", 2, 10, 24, [4, 6], 1], ["RE", 2, [0, 5, 1, 6, 2, 7, 10, 11, 3, 8, 12, 4, 9]], ["FSP", 3, 0, 1, 3], ["FSP", 3, 4, 2, 3], ["RE", 3, [0, 4, 1, 5, 2, 6, 3, 7]], ["CA", 2, 3, 5], ["CHR", 1, "shared", [2]], ["CA", 2, 3, 6], ["CHR", 0, "shared", [3]], ["CA", 1, 4, 6], ["FU", 5, [0, 1]], ["AN", 5, 0, 5], ["FU", 5, [1, 2]], ["AN", 5, 1, 4], ["FU", 5, [2, 3]], ["AN", 5, 2, 6], ["FU", 3, [0, 1]], ["SP", 3, 0, 96, [1], 1], ["AN", 3, 1, 2], ["FFSP", 3, 0, [2, 1], 1, 1], ["AN", 3, 1, 6], ["FU", 1, [0, 1]], ["SP", 1, 0, 168, [1], 1], ["AN", 1, 1, 2], ["FFSP", 1, 0, [2, 1], 1, 1], ["AN", 1, 1, 6], ["PR", 4, 0, "auto_unroll_max_step$0"]]]], "r": [[1.74892e-05, 1.74901e-05, 1.7488e-05, 1.74882e-05, 1.74893e-05, 1.7488e-05, 1.74893e-05, 1.74881e-05, 1.74876e-05, 1.74866e-05, 1.74881e-05, 1.74893e-05, 1.74882e-05, 1.74881e-05, 1.74872e-05, 1.74869e-05, 1.74871e-05, 1.74867e-05, 1.74892e-05, 1.74866e-05], 0, 44.8181, 1647786659], "v": "v0.6"}
{"i": [["[\"pointwise_conv2d\", 56, 56, 24, 144]", "cuda -keys=cuda,gpu -max_num_threads=1024 -model=unknown -thread_warp_size=32", [-1, 16, 64, 49152, 2147483647, 1024, 8, 32], "", 0, []], [[], [["CHW", 2, "local"], ["SP", 2, 0, 3136, [4, 14, 28, 1], 1], ["SP", 2, 5, 144, [2, 6, 1, 1], 1], ["SP", 2, 10, 24, [1, 6], 1], ["RE", 2, [0, 5, 1, 6, 2, 7, 10, 11, 3, 8, 12, 4, 9]], ["FSP", 3, 0, 1, 3], ["FSP", 3, 4, 2, 3], ["RE", 3, [0, 4, 1, 5, 2, 6, 3, 7]], ["CA", 2, 3, 5], ["CHR", 1, "shared", [2]], ["CA", 2, 3, 6], ["CHR", 0, "shared", [3]], ["CA", 1, 4, 6], ["FU", 5, [0, 1]], ["AN", 5, 0, 5], ["FU", 5, [1, 2]], ["AN", 5, 1, 4], ["FU", 5, [2, 3]], ["AN", 5, 2, 6], ["FU", 3, [0, 1]], ["SP", 3, 0, 3, [3], 1], ["AN", 3, 1, 2], ["FFSP", 3, 0, [2, 1], 1, 1], ["AN", 3, 1, 6], ["FU", 1, [0, 1]], ["SP", 1, 0, 84, [1], 1], ["AN", 1, 1, 2], ["FFSP", 1, 0, [2, 1], 1, 1], ["AN", 1, 1, 6], ["PR", 4, 0, "auto_unroll_max_step$0"]]]], "r": [[5.67798e-05, 5.67814e-05, 5.67826e-05, 5.67761e-05, 5.67769e-05, 5.67704e-05, 5.67799e-05, 5.67807e-05, 5.67866e-05, 5.67969e-05, 5.67859e-05, 5.67838e-05, 5.67902e-05, 5.6788e-05, 5.6793e-05, 5.67862e-05, 5.67846e-05, 5.67863e-05, 5.6792e-05, 5.67848e-05], 0, 64.0451, 1647786678], "v": "v0.6"}
{"i": [["[\"pointwise_conv2d\", 56, 56, 24, 144]", "cuda -keys=cuda,gpu -max_num_threads=1024 -model=unknown -thread_warp_size=32", [-1, 16, 64, 49152, 2147483647, 1024, 8, 32], "", 0, []], [[], [["CHW", 2, "local"], ["SP", 2, 0, 3136, [2, 28, 1, 7], 1], ["SP", 2, 5, 144, [3, 2, 1, 3], 1], ["SP", 2, 10, 24, [6, 1], 1], ["RE", 2, [0, 5, 1, 6, 2, 7, 10, 11, 3, 8, 12, 4, 9]], ["FSP", 3, 0, 1, 3], ["FSP", 3, 4, 2, 3], ["RE", 3, [0, 4, 1, 5, 2, 6, 3, 7]], ["CA", 2, 3, 5], ["CHR", 1, "shared", [2]], ["CA", 2, 3, 6], ["CHR", 0, "shared", [3]], ["CA", 1, 4, 6], ["FU", 5, [0, 1]], ["AN", 5, 0, 5], ["FU", 5, [1, 2]], ["AN", 5, 1, 4], ["FU", 5, [2, 3]], ["AN", 5, 2, 6], ["FU", 3, [0, 1]], ["SP", 3, 0, 18, [1], 1], ["AN", 3, 1, 2], ["FFSP", 3, 0, [2, 1], 1, 1], ["AN", 3, 1, 6], ["FU", 1, [0, 1]], ["SP", 1, 0, 84, [1], 1], ["AN", 1, 1, 2], ["FFSP", 1, 0, [2, 1], 1, 1], ["AN", 1, 1, 6], ["PR", 4, 0, "auto_unroll_max_step$16"]]]], "r": [[2.32424e-05, 2.32407e-05, 2.32425e-05, 2.32416e-05, 2.32408e-05, 2.32402e-05, 2.32403e-05, 2.32422e-05, 2.32405e-05, 2.32397e-05, 2.324e-05, 2.32399e-05, 2.3241e-05, 2.32401e-05, 2.32383e-05, 2.32385e-05, 2.32395e-05, 2.32372e-05, 2.32368e-05, 2.32377e-05], 0, 53.9886, 1647786668], "v": "v0.6"}
{"i": [["[\"pointwise_conv2d\", 56, 56, 24, 144]", "cuda -keys=cuda,gpu -max_num_threads=1024 -model=unknown -thread_warp_size=32", [-1, 16, 64, 49152, 2147483647, 1024, 8, 32], "", 0, []], [[], [["CHW", 2, "local"], ["SP", 2, 0, 3136, [2, 49, 2, 1], 1], ["SP", 2, 5, 144, [3, 2, 2, 12], 1], ["SP", 2, 10, 24, [1, 3], 1], ["RE", 2, [0, 5, 1, 6, 2, 7, 10, 11, 3, 8, 12, 4, 9]], ["FSP", 3, 0, 1, 3], ["FSP", 3, 4, 2, 3], ["RE", 3, [0, 4, 1, 5, 2, 6, 3, 7]], ["CA", 2, 3, 5], ["CHR", 1, "shared", [2]], ["CA", 2, 3, 6], ["CHR", 0, "shared", [3]], ["CA", 1, 4, 6], ["FU", 5, [0, 1]], ["AN", 5, 0, 5], ["FU", 5, [1, 2]], ["AN", 5, 1, 4], ["FU", 5, [2, 3]], ["AN", 5, 2, 6], ["FU", 3, [0, 1]], ["SP", 3, 0, 288, [1], 1], ["AN", 3, 1, 2], ["FFSP", 3, 0, [2, 1], 1, 1], ["AN", 3, 1, 6], ["FU", 1, [0, 1]], ["SP", 1, 0, 24, [1], 1], ["AN", 1, 1, 2], ["FFSP", 1, 0, [2, 1], 1, 1], ["AN", 1, 1, 6], ["PR", 4, 0, "auto_unroll_max_step$64"]]]], "r": [[8.82366e-05, 8.82364e-05, 8.82247e-05, 8.82091e-05, 8.82303e-05, 8.82301e-05, 8.82323e-05, 8.82353e-05, 8.82276e-05, 8.82347e-05, 8.82354e-05, 8.82203e-05, 8.82376e-05, 8.82338e-05, 8.82379e-05, 8.8249e-05, 8.82564e-05, 8.82337e-05, 8.82473e-05, 8.82321e-05], 0, 27.7312, 1647786641], "v": "v0.6"}
{"i": [["[\"pointwise_conv2d\", 56, 56, 24, 144]", "cuda -keys=cuda,gpu -max_num_threads=1024 -model=unknown -thread_warp_size=32", [-1, 16, 64, 49152, 2147483647, 1024, 8, 32], "", 0, []], [[], [["CHW", 2, "local"], ["SP", 2, 0, 3136, [1, 224, 7, 1], 1], ["SP", 2, 5, 144, [1, 1, 8, 3], 1], ["SP", 2, 10, 24, [1, 1], 1], ["RE", 2, [0, 5, 1, 6, 2, 7, 10, 11, 3, 8, 12, 4, 9]], ["FSP", 3, 0, 1, 3], ["FSP", 3, 4, 2, 3], ["RE", 3, [0, 4, 1, 5, 2, 6, 3, 7]], ["CA", 2, 3, 5], ["CHR", 1, "shared", [2]], ["CA", 2, 3, 6], ["CHR", 0, "shared", [3]], ["CA", 1, 4, 6], ["FU", 5, [0, 1]], ["AN", 5, 0, 5], ["FU", 5, [1, 2]], ["AN", 5, 1, 4], ["FU", 5, [2, 3]], ["AN", 5, 2, 6], ["FU", 3, [0, 1]], ["SP", 3, 0, 72, [36], 1], ["AN", 3, 1, 2], ["FFSP", 3, 0, [2, 1], 1, 1], ["AN", 3, 1, 6], ["FU", 1, [0, 1]], ["SP", 1, 0, 21, [1], 1], ["AN", 1, 1, 2], ["FFSP", 1, 0, [2, 1], 1, 1], ["AN", 1, 1, 6], ["PR", 4, 0, "auto_unroll_max_step$0"]]]], "r": [[8.76537e-05, 8.75859e-05, 8.76026e-05, 8.76197e-05, 8.76324e-05, 8.76323e-05, 8.76291e-05, 8.76113e-05, 8.75996e-05, 8.76102e-05, 8.76384e-05, 8.76253e-05, 8.76318e-05, 8.76396e-05, 8.76423e-05, 8.76104e-05, 8.76176e-05, 8.76233e-05, 8.76183e-05, 8.76242e-05], 0, 93.0487, 1647786707], "v": "v0.6"}
{"i": [["[\"pointwise_conv2d\", 56, 56, 24, 144]", "cuda -keys=cuda,gpu -max_num_threads=1024 -model=unknown -thread_warp_size=32", [-1, 16, 64, 49152, 2147483647, 1024, 8, 32], "", 0, []], [[], [["CHW", 2, "local"], ["SP", 2, 0, 3136, [1, 8, 7, 7], 1], ["SP", 2, 5, 144, [1, 16, 3, 1], 1], ["SP", 2, 10, 24, [3, 8], 1], ["RE", 2, [0, 5, 1, 6, 2, 7, 10, 11, 3, 8, 12, 4, 9]], ["FSP", 3, 0, 1, 3], ["FSP", 3, 4, 2, 3], ["RE", 3, [0, 4, 1, 5, 2, 6, 3, 7]], ["CA", 2, 3, 5], ["CHR", 1, "shared", [2]], ["CA", 2, 3, 6], ["CHR", 0, "shared", [3]], ["CA", 1, 4, 6], ["FU", 5, [0, 1]], ["AN", 5, 0, 5], ["FU", 5, [1, 2]], ["AN", 5, 1, 4], ["FU", 5, [2, 3]], ["AN", 5, 2, 6], ["FU", 3, [0, 1]], ["SP", 3, 0, 72, [1], 1], ["AN", 3, 1, 2], ["FFSP", 3, 0, [2, 1], 1, 1], ["AN", 3, 1, 6], ["FU", 1, [0, 1]], ["SP", 1, 0, 1176, [1], 1], ["AN", 1, 1, 2], ["FFSP", 1, 0, [2, 1], 1, 1], ["AN", 1, 1, 6], ["PR", 4, 0, "auto_unroll_max_step$16"]]]], "r": [[1.94932e-05, 1.94909e-05, 1.94933e-05, 1.94912e-05, 1.94946e-05, 1.94907e-05, 1.94888e-05, 1.94913e-05, 1.94912e-05, 1.94918e-05, 1.94902e-05, 1.94912e-05, 1.94933e-05, 1.949e-05, 1.94959e-05, 1.94934e-05, 1.94949e-05, 1.94902e-05, 1.94947e-05, 1.94937e-05], 0, 73.0825, 1647786687], "v": "v0.6"}
{"i": [["[\"pointwise_conv2d\", 56, 56, 24, 144]", "cuda -keys=cuda,gpu -max_num_threads=1024 -model=unknown -thread_warp_size=32", [-1, 16, 64, 49152, 2147483647, 1024, 8, 32], "", 0, []], [[], [["CHW", 2, "local"], ["SP", 2, 0, 3136, [1, 56, 4, 1], 1], ["SP", 2, 5, 144, [1, 2, 2, 9], 1], ["SP", 2, 10, 24, [4, 1], 1], ["RE", 2, [0, 5, 1, 6, 2, 7, 10, 11, 3, 8, 12, 4, 9]], ["FSP", 3, 0, 1, 3], ["FSP", 3, 4, 2, 3], ["RE", 3, [0, 4, 1, 5, 2, 6, 3, 7]], ["CA", 2, 3, 5], ["CHR", 1, "shared", [2]], ["CA", 2, 3, 6], ["CHR", 0, "shared", [3]], ["CA", 1, 4, 6], ["FU", 5, [0, 1]], ["AN", 5, 0, 5], ["FU", 5, [1, 2]], ["AN", 5, 1, 4], ["FU", 5, [2, 3]], ["AN", 5, 2, 6], ["FU", 3, [0, 1]], ["SP", 3, 0, 72, [4], 1], ["AN", 3, 1, 2], ["FFSP", 3, 0, [2, 1], 1, 1], ["AN", 3, 1, 6], ["FU", 1, [0, 1]], ["SP", 1, 0, 16, [1], 1], ["AN", 1, 1, 2], ["FFSP", 1, 0, [2, 1], 1, 1], ["AN", 1, 1, 6], ["PR", 4, 0, "auto_unroll_max_step$0"]]]], "r": [[2.23373e-05, 2.23374e-05, 2.23376e-05, 2.23381e-05, 2.23361e-05, 2.23335e-05, 2.23341e-05, 2.23351e-05, 2.23355e-05, 2.2334e-05, 2.23376e-05, 2.23368e-05, 2.23366e-05, 2.23368e-05, 2.2336e-05, 2.23366e-05, 2.23347e-05, 2.23331e-05, 2.23349e-05, 2.23377e-05], 0, 122.129, 1647786736], "v": "v0.6"}
{"i": [["[\"pointwise_conv2d\", 56, 56, 24, 144]", "cuda -keys=cuda,gpu -max_num_threads=1024 -model=unknown -thread_warp_size=32", [-1, 16, 64, 49152, 2147483647, 1024, 8, 32], "", 0, []], [[], [["CHW", 2, "local"], ["SP", 2, 0, 3136, [1, 56, 2, 7], 1], ["SP", 2, 5, 144, [2, 1, 9, 1], 1], ["SP", 2, 10, 24, [12, 1], 1], ["RE", 2, [0, 5, 1, 6, 2, 7, 10, 11, 3, 8, 12, 4, 9]], ["FSP", 3, 0, 1, 3], ["FSP", 3, 4, 2, 3], ["RE", 3, [0, 4, 1, 5, 2, 6, 3, 7]], ["CA", 2, 3, 5], ["CHR", 1, "shared", [2]], ["CA", 2, 3, 6], ["CHR", 0, "shared", [3]], ["CA", 1, 4, 6], ["FU", 5, [0, 1]], ["AN", 5, 0, 5], ["FU", 5, [1, 2]], ["AN", 5, 1, 4], ["FU", 5, [2, 3]], ["AN", 5, 2, 6], ["FU", 3, [0, 1]], ["SP", 3, 0, 108, [3], 1], ["AN", 3, 1, 2], ["FFSP", 3, 0, [2, 1], 1, 1], ["AN", 3, 1, 6], ["FU", 1, [0, 1]], ["SP", 1, 0, 168, [1], 1], ["AN", 1, 1, 2], ["FFSP", 1, 0, [2, 1], 1, 1], ["AN", 1, 1, 6], ["PR", 4, 0, "auto_unroll_max_step$64"]]]], "r": [[6.50899e-05, 6.50871e-05, 6.50875e-05, 6.50832e-05, 6.50901e-05, 6.50945e-05, 6.50801e-05, 6.50788e-05, 6.50797e-05, 6.50863e-05, 6.50951e-05, 6.50955e-05, 6.509e-05, 6.50865e-05, 6.50869e-05, 6.50805e-05, 6.5077e-05, 6.50698e-05, 6.50762e-05, 6.50749e-05], 0, 103.208, 1647786717], "v": "v0.6"}
{"i": [["[\"pointwise_conv2d\", 56, 56, 24, 144]", "cuda -keys=cuda,gpu -max_num_threads=1024 -model=unknown -thread_warp_size=32", [-1, 16, 64, 49152, 2147483647, 1024, 8, 32], "", 0, []], [[], [["CHW", 2, "local"], ["SP", 2, 0, 3136, [1, 49, 2, 2], 1], ["SP", 2, 5, 144, [2, 1, 1, 36], 1], ["SP", 2, 10, 24, [24, 1], 1], ["RE", 2, [0, 5, 1, 6, 2, 7, 10, 11, 3, 8, 12, 4, 9]], ["FSP", 3, 0, 1, 3], ["FSP", 3, 4, 2, 3], ["RE", 3, [0, 4, 1, 5, 2, 6, 3, 7]], ["CA", 2, 3, 5], ["CHR", 1, "shared", [2]], ["CA", 2, 3, 6], ["CHR", 0, "shared", [3]], ["CA", 1, 4, 6], ["FU", 5, [0, 1]], ["AN", 5, 0, 5], ["FU", 5, [1, 2]], ["AN", 5, 1, 4], ["FU", 5, [2, 3]], ["AN", 5, 2, 6], ["FU", 3, [0, 1]], ["SP", 3, 0, 864, [36], 1], ["AN", 3, 1, 2], ["FFSP", 3, 0, [2, 1], 1, 1], ["AN", 3, 1, 6], ["FU", 1, [0, 1]], ["SP", 1, 0, 96, [1], 1], ["AN", 1, 1, 2], ["FFSP", 1, 0, [2, 1], 1, 1], ["AN", 1, 1, 6], ["PR", 4, 0, "auto_unroll_max_step$1024"]]]], "r": [[6.89866e-05, 6.89921e-05, 6.90096e-05, 6.89999e-05, 6.89888e-05, 6.89865e-05, 6.89951e-05, 6.89918e-05, 6.89473e-05, 6.88775e-05, 6.88742e-05, 6.88742e-05, 6.8875e-05, 6.88705e-05, 6.88737e-05, 6.88734e-05, 6.88751e-05, 6.88717e-05, 6.88799e-05, 6.88759e-05], 0, 113.674, 1647786727], "v": "v0.6"}
{"i": [["[\"pointwise_conv2d\", 56, 56, 24, 144]", "cuda -keys=cuda,gpu -max_num_threads=1024 -model=unknown -thread_warp_size=32", [-1, 16, 64, 49152, 2147483647, 1024, 8, 32], "", 0, []], [[], [["CHW", 2, "local"], ["SP", 2, 0, 3136, [1, 2, 2, 1], 1], ["SP", 2, 5, 144, [2, 18, 1, 4], 1], ["SP", 2, 10, 24, [1, 2], 1], ["RE", 2, [0, 5, 1, 6, 2, 7, 10, 11, 3, 8, 12, 4, 9]], ["FSP", 3, 0, 1, 3], ["FSP", 3, 4, 2, 3], ["RE", 3, [0, 4, 1, 5, 2, 6, 3, 7]], ["CA", 2, 3, 5], ["CHR", 1, "shared", [2]], ["CA", 2, 3, 6], ["CHR", 0, "shared", [3]], ["CA", 1, 4, 6], ["FU", 5, [0, 1]], ["AN", 5, 0, 5], ["FU", 5, [1, 2]], ["AN", 5, 1, 4], ["FU", 5, [2, 3]], ["AN", 5, 2, 6], ["FU", 3, [0, 1]], ["SP", 3, 0, 8, [1], 1], ["AN", 3, 1, 2], ["FFSP", 3, 0, [2, 1], 1, 1], ["AN", 3, 1, 6], ["FU", 1, [0, 1]], ["SP", 1, 0, 8, [1], 1], ["AN", 1, 1, 2], ["FFSP", 1, 0, [2, 1], 1, 1], ["AN", 1, 1, 6], ["PR", 4, 0, "auto_unroll_max_step$16"]]]], "r": [[1.25271e-05, 1.25252e-05, 1.25138e-05, 1.2528e-05, 1.2537e-05, 1.25187e-05, 1.25213e-05, 1.25173e-05, 1.2533e-05, 1.25298e-05, 1.25164e-05, 1.25176e-05, 1.25332e-05, 1.25273e-05, 1.25383e-05, 1.25344e-05, 1.25218e-05, 1.25393e-05, 1.25404e-05, 1.2539e-05], 0, 35.904, 1647786650], "v": "v0.6"}
{"i": [["[\"pointwise_conv2d\", 56, 56, 24, 144]", "cuda -keys=cuda,gpu -max_num_threads=1024 -model=unknown -thread_warp_size=32", [-1, 16, 64, 49152, 2147483647, 1024, 8, 32], "", 0, []], [[], [["CHW", 2, "local"], ["SP", 2, 0, 3136, [1, 196, 8, 1], 1], ["SP", 2, 5, 144, [3, 3, 2, 1], 1], ["SP", 2, 10, 24, [2, 1], 1], ["RE", 2, [0, 5, 1, 6, 2, 7, 10, 11, 3, 8, 12, 4, 9]], ["FSP", 3, 0, 1, 3], ["FSP", 3, 4, 2, 3], ["RE", 3, [0, 4, 1, 5, 2, 6, 3, 7]], ["CA", 2, 3, 5], ["CHR", 1, "shared", [2]], ["CA", 2, 3, 6], ["CHR", 0, "shared", [3]], ["CA", 1, 4, 6], ["FU", 5, [0, 1]], ["AN", 5, 0, 5], ["FU", 5, [1, 2]], ["AN", 5, 1, 4], ["FU", 5, [2, 3]], ["AN", 5, 2, 6], ["FU", 3, [0, 1]], ["SP", 3, 0, 4, [2], 1], ["AN", 3, 1, 2], ["FFSP", 3, 0, [2, 1], 1, 1], ["AN", 3, 1, 6], ["FU", 1, [0, 1]], ["SP", 1, 0, 16, [4], 1], ["AN", 1, 1, 2], ["FFSP", 1, 0, [2, 1], 1, 1], ["AN", 1, 1, 6], ["PR", 4, 0, "auto_unroll_max_step$1024"]]]], "r": [[5.13197e-05, 5.13095e-05, 5.13082e-05, 5.1312e-05, 5.13077e-05, 5.131e-05, 5.13191e-05, 5.13231e-05, 5.13229e-05, 5.13227e-05, 5.13192e-05, 5.13207e-05, 5.13165e-05, 5.13113e-05, 5.1305e-05, 5.1315e-05, 5.13059e-05, 5.13166e-05, 5.13166e-05, 5.13139e-05], 0, 142.077, 1647786756], "v": "v0.6"}
{"i": [["[\"pointwise_conv2d\", 56, 56, 24, 144]", "cuda -keys=cuda,gpu -max_num_threads=1024 -model=unknown -thread_warp_size=32", [-1, 16, 64, 49152, 2147483647, 1024, 8, 32], "", 0, []], [[], [["CHW", 2, "local"], ["SP", 2, 0, 3136, [1, 28, 14, 1], 1], ["SP", 2, 5, 144, [2, 4, 1, 1], 1], ["SP", 2, 10, 24, [12, 2], 1], ["RE", 2, [0, 5, 1, 6, 2, 7, 10, 11, 3, 8, 12, 4, 9]], ["FSP", 3, 0, 1, 3], ["FSP", 3, 4, 2, 3], ["RE", 3, [0, 4, 1, 5, 2, 6, 3, 7]], ["CA", 2, 3, 5], ["CHR", 1, "shared", [2]], ["CA", 2, 3, 6], ["CHR", 0, "shared", [3]], ["CA", 1, 4, 6], ["FU", 5, [0, 1]], ["AN", 5, 0, 5], ["FU", 5, [1, 2]], ["AN", 5, 1, 4], ["FU", 5, [2, 3]], ["AN", 5, 2, 6], ["FU", 3, [0, 1]], ["SP", 3, 0, 48, [1], 1], ["AN", 3, 1, 2], ["FFSP", 3, 0, [2, 1], 1, 1], ["AN", 3, 1, 6], ["FU", 1, [0, 1]], ["SP", 1, 0, 336, [56], 1], ["AN", 1, 1, 2], ["FFSP", 1, 0, [2, 1], 1, 1], ["AN", 1, 1, 6], ["PR", 4, 0, "auto_unroll_max_step$1024"]]]], "r": [[1.41296e-05, 1.41303e-05, 1.41296e-05, 1.41298e-05, 1.41326e-05, 1.41217e-05, 1.41212e-05, 1.41231e-05, 1.41234e-05, 1.41241e-05, 1.41233e-05, 1.41229e-05, 1.41224e-05, 1.41218e-05, 1.41233e-05, 1.41238e-05, 1.4123e-05, 1.41215e-05, 1.41213e-05, 1.41231e-05], 0, 233.793, 1647786847], "v": "v0.6"}
{"i": [["[\"pointwise_conv2d\", 56, 56, 24, 144]", "cuda -keys=cuda,gpu -max_num_threads=1024 -model=unknown -thread_warp_size=32", [-1, 16, 64, 49152, 2147483647, 1024, 8, 32], "", 0, []], [[], [["CHW", 2, "local"], ["SP", 2, 0, 3136, [7, 8, 1, 4], 1], ["SP", 2, 5, 144, [1, 6, 1, 2], 1], ["SP", 2, 10, 24, [2, 2], 1], ["RE", 2, [0, 5, 1, 6, 2, 7, 10, 11, 3, 8, 12, 4, 9]], ["FSP", 3, 0, 1, 3], ["FSP", 3, 4, 2, 3], ["RE", 3, [0, 4, 1, 5, 2, 6, 3, 7]], ["CA", 2, 3, 5], ["CHR", 1, "shared", [2]], ["CA", 2, 3, 6], ["CHR", 0, "shared", [3]], ["CA", 1, 4, 6], ["FU", 5, [0, 1]], ["AN", 5, 0, 5], ["FU", 5, [1, 2]], ["AN", 5, 1, 4], ["FU", 5, [2, 3]], ["AN", 5, 2, 6], ["FU", 3, [0, 1]], ["SP", 3, 0, 8, [8], 1], ["AN", 3, 1, 2], ["FFSP", 3, 0, [2, 1], 1, 1], ["AN", 3, 1, 6], ["FU", 1, [0, 1]], ["SP", 1, 0, 16, [1], 1], ["AN", 1, 1, 2], ["FFSP", 1, 0, [2, 1], 1, 1], ["AN", 1, 1, 6], ["PR", 4, 0, "auto_unroll_max_step$1024"]]]], "r": [[1.08059e-05, 1.08047e-05, 1.08041e-05, 1.0805e-05, 1.08038e-05, 1.08049e-05, 1.08067e-05, 1.08046e-05, 1.08049e-05, 1.08077e-05, 1.08076e-05, 1.08077e-05, 1.08095e-05, 1.08082e-05, 1.08072e-05, 1.08068e-05, 1.08044e-05, 1.08077e-05, 1.08065e-05, 1.08073e-05], 0, 165.997, 1647786780], "v": "v0.6"}
{"i": [["[\"pointwise_conv2d\", 56, 56, 24, 144]", "cuda -keys=cuda,gpu -max_num_threads=1024 -model=unknown -thread_warp_size=32", [-1, 16, 64, 49152, 2147483647, 1024, 8, 32], "", 0, []], [[], [["CHW", 2, "local"], ["SP", 2, 0, 3136, [2, 28, 1, 7], 1], ["SP", 2, 5, 144, [3, 2, 1, 3], 1], ["SP", 2, 10, 24, [6, 1], 1], ["RE", 2, [0, 5, 1, 6, 2, 7, 10, 11, 3, 8, 12, 4, 9]], ["FSP", 3, 0, 1, 3], ["FSP", 3, 4, 2, 3], ["RE", 3, [0, 4, 1, 5, 2, 6, 3, 7]], ["CA", 2, 3, 5], ["CHR", 1, "shared", [2]], ["CA", 2, 3, 6], ["CHR", 0, "shared", [3]], ["CA", 1, 4, 6], ["FU", 5, [0, 1]], ["AN", 5, 0, 5], ["FU", 5, [1, 2]], ["AN", 5, 1, 4], ["FU", 5, [2, 3]], ["AN", 5, 2, 6], ["FU", 3, [0, 1]], ["SP", 3, 0, 18, [3], 1], ["AN", 3, 1, 2], ["FFSP", 3, 0, [2, 1], 1, 1], ["AN", 3, 1, 6], ["FU", 1, [0, 1]], ["SP", 1, 0, 84, [1], 1], ["AN", 1, 1, 2], ["FFSP", 1, 0, [2, 1], 1, 1], ["AN", 1, 1, 6], ["PR", 4, 0, "auto_unroll_max_step$16"]]]], "r": [[2.3731e-05, 2.37295e-05, 2.37286e-05, 2.37295e-05, 2.37301e-05, 2.37291e-05, 2.37287e-05, 2.37296e-05, 2.373e-05, 2.37313e-05, 2.37298e-05, 2.37285e-05, 2.37295e-05, 2.373e-05, 2.37289e-05, 2.37285e-05, 2.37298e-05, 2.37299e-05, 2.37303e-05, 2.37306e-05], 0, 151.136, 1647786765], "v": "v0.6"}
{"i": [["[\"pointwise_conv2d\", 56, 56, 24, 144]", "cuda -keys=cuda,gpu -max_num_threads=1024 -model=unknown -thread_warp_size=32", [-1, 16, 64, 49152, 2147483647, 1024, 8, 32], "", 0, []], [[], [["CHW", 2, "local"], ["SP", 2, 0, 3136, [1, 196, 8, 1], 1], ["SP", 2, 5, 144, [9, 1, 2, 1], 1], ["SP", 2, 10, 24, [1, 1], 1], ["RE", 2, [0, 5, 1, 6, 2, 7, 10, 11, 3, 8, 12, 4, 9]], ["FSP", 3, 0, 1, 3], ["FSP", 3, 4, 2, 3], ["RE", 3, [0, 4, 1, 5, 2, 6, 3, 7]], ["CA", 2, 3, 5], ["CHR", 1, "shared", [2]], ["CA", 2, 3, 6], ["CHR", 0, "shared", [3]], ["CA", 1, 4, 6], ["FU", 5, [0, 1]], ["AN", 5, 0, 5], ["FU", 5, [1, 2]], ["AN", 5, 1, 4], ["FU", 5, [2, 3]], ["AN", 5, 2, 6], ["FU", 3, [0, 1]], ["SP", 3, 0, 4, [1], 1], ["AN", 3, 1, 2], ["FFSP", 3, 0, [2, 1], 1, 1], ["AN", 3, 1, 6], ["FU", 1, [0, 1]], ["SP", 1, 0, 16, [4], 1], ["AN", 1, 1, 2], ["FFSP", 1, 0, [2, 1], 1, 1], ["AN", 1, 1, 6], ["PR", 4, 0, "auto_unroll_max_step$1024"]]]], "r": [[8.74764e-05, 8.74786e-05, 8.74643e-05, 8.74696e-05, 8.74711e-05, 8.74759e-05, 8.74731e-05, 8.74789e-05, 8.7478e-05, 8.74727e-05, 8.74702e-05, 8.74745e-05, 8.74735e-05, 8.74753e-05, 8.74738e-05, 8.74741e-05, 8.74772e-05, 8.74783e-05, 8.74809e-05, 8.74756e-05], 0, 205.349, 1647786819], "v": "v0.6"}
{"i": [["[\"pointwise_conv2d\", 56, 56, 24, 144]", "cuda -keys=cuda,gpu -max_num_threads=1024 -model=unknown -thread_warp_size=32", [-1, 16, 64, 49152, 2147483647, 1024, 8, 32], "", 0, []], [[], [["CHW", 2, "local"], ["SP", 2, 0, 3136, [1, 196, 1, 1], 1], ["SP", 2, 5, 144, [1, 4, 4, 3], 1], ["SP", 2, 10, 24, [3, 8], 1], ["RE", 2, [0, 5, 1, 6, 2, 7, 10, 11, 3, 8, 12, 4, 9]], ["FSP", 3, 0, 1, 3], ["FSP", 3, 4, 2, 3], ["RE", 3, [0, 4, 1, 5, 2, 6, 3, 7]], ["CA", 2, 3, 5], ["CHR", 1, "shared", [2]], ["CA", 2, 3, 6], ["CHR", 0, "shared", [3]], ["CA", 1, 4, 6], ["FU", 5, [0, 1]], ["AN", 5, 0, 5], ["FU", 5, [1, 2]], ["AN", 5, 1, 4], ["FU", 5, [2, 3]], ["AN", 5, 2, 6], ["FU", 3, [0, 1]], ["SP", 3, 0, 288, [1], 1], ["AN", 3, 1, 2], ["FFSP", 3, 0, [2, 1], 1, 1], ["AN", 3, 1, 6], ["FU", 1, [0, 1]], ["SP", 1, 0, 24, [1], 1], ["AN", 1, 1, 2], ["FFSP", 1, 0, [2, 1], 1, 1], ["AN", 1, 1, 6], ["PR", 4, 0, "auto_unroll_max_step$512"]]]], "r": [[3.11006e-05, 3.10995e-05, 3.10987e-05, 3.1098e-05, 3.10986e-05, 3.10976e-05, 3.10983e-05, 3.11011e-05, 3.10989e-05, 3.1097e-05, 3.10992e-05, 3.11011e-05, 3.11008e-05, 3.11004e-05, 3.10981e-05, 3.10989e-05, 3.10999e-05, 3.10994e-05, 3.11009e-05, 3.10988e-05], 0, 251.233, 1647786865], "v": "v0.6"}
{"i": [["[\"pointwise_conv2d\", 56, 56, 24, 144]", "cuda -keys=cuda,gpu -max_num_threads=1024 -model=unknown -thread_warp_size=32", [-1, 16, 64, 49152, 2147483647, 1024, 8, 32], "", 0, []], [[], [["CHW", 2, "local"], ["SP", 2, 0, 3136, [1, 14, 8, 7], 1], ["SP", 2, 5, 144, [1, 2, 1, 18], 1], ["SP", 2, 10, 24, [2, 1], 1], ["RE", 2, [0, 5, 1, 6, 2, 7, 10, 11, 3, 8, 12, 4, 9]], ["FSP", 3, 0, 1, 3], ["FSP", 3, 4, 2, 3], ["RE", 3, [0, 4, 1, 5, 2, 6, 3, 7]], ["CA", 2, 3, 5], ["CHR", 1, "shared", [2]], ["CA", 2, 3, 6], ["CHR", 0, "shared", [3]], ["CA", 1, 4, 6], ["FU", 5, [0, 1]], ["AN", 5, 0, 5], ["FU", 5, [1, 2]], ["AN", 5, 1, 4], ["FU", 5, [2, 3]], ["AN", 5, 2, 6], ["FU", 3, [0, 1]], ["SP", 3, 0, 8, [1], 1], ["AN", 3, 1, 2], ["FFSP", 3, 0, [2, 1], 1, 1], ["AN", 3, 1, 6], ["FU", 1, [0, 1]], ["SP", 1, 0, 224, [1], 1], ["AN", 1, 1, 2], ["FFSP", 1, 0, [2, 1], 1, 1], ["AN", 1, 1, 6], ["PR", 4, 0, "auto_unroll_max_step$64"]]]], "r": [[0.000293248, 0.000293245, 0.000293253, 0.000293257, 0.000293256, 0.000293246, 0.000293248, 0.000293253, 0.000293256, 0.000293267, 0.000293248, 0.00029324, 0.000293257, 0.000293259, 0.000293255, 0.000293253, 0.000293254, 0.000293264, 0.000293252, 0.000293255], 0, 195.565, 1647786809], "v": "v0.6"}
{"i": [["[\"pointwise_conv2d\", 56, 56, 24, 144]", "cuda -keys=cuda,gpu -max_num_threads=1024 -model=unknown -thread_warp_size=32", [-1, 16, 64, 49152, 2147483647, 1024, 8, 32], "", 0, []], [[], [["CHW", 2, "local"], ["SP", 2, 0, 3136, [2, 14, 28, 4], 1], ["SP", 2, 5, 144, [1, 4, 9, 2], 1], ["SP", 2, 10, 24, [2, 1], 1], ["RE", 2, [0, 5, 1, 6, 2, 7, 10, 11, 3, 8, 12, 4, 9]], ["FSP", 3, 0, 1, 3], ["FSP", 3, 4, 2, 3], ["RE", 3, [0, 4, 1, 5, 2, 6, 3, 7]], ["CA", 2, 3, 5], ["CHR", 1, "shared", [2]], ["CA", 2, 3, 6], ["CHR", 0, "shared", [3]], ["CA", 1, 4, 6], ["FU", 5, [0, 1]], ["AN", 5, 0, 5], ["FU", 5, [1, 2]], ["AN", 5, 1, 4], ["FU", 5, [2, 3]], ["AN", 5, 2, 6], ["FU", 3, [0, 1]], ["SP", 3, 0, 36, [3], 1], ["AN", 3, 1, 2], ["FFSP", 3, 0, [2, 1], 1, 1], ["AN", 3, 1, 6], ["FU", 1, [0, 1]], ["SP", 1, 0, 224, [1], 1], ["AN", 1, 1, 2], ["FFSP", 1, 0, [2, 1], 1, 1], ["AN", 1, 1, 6], ["PR", 4, 0, "auto_unroll_max_step$1024"]]]], "r": [[0.00106512, 0.00106823, 0.00106723, 0.00106782, 0.00106871, 0.00106782, 0.00106969, 0.0010692, 0.0010699, 0.00106854, 0.0010686, 0.00106812, 0.00106933, 0.00106944, 0.00106962, 0.00106753, 0.00106938, 0.00106778, 0.00106873, 0.00106828], 0, 158.16, 1647786771], "v": "v0.6"}
{"i": [["[\"pointwise_conv2d\", 56, 56, 24, 144]", "cuda -keys=cuda,gpu -max_num_threads=1024 -model=unknown -thread_warp_size=32", [-1, 16, 64, 49152, 2147483647, 1024, 8, 32], "", 0, []], [[], [["CHW", 2, "local"], ["SP", 2, 0, 3136, [4, 14, 1, 1], 1], ["SP", 2, 5, 144, [1, 6, 8, 3], 1], ["SP", 2, 10, 24, [8, 3], 1], ["RE", 2, [0, 5, 1, 6, 2, 7, 10, 11, 3, 8, 12, 4, 9]], ["FSP", 3, 0, 1, 3], ["FSP", 3, 4, 2, 3], ["RE", 3, [0, 4, 1, 5, 2, 6, 3, 7]], ["CA", 2, 3, 5], ["CHR", 1, "shared", [2]], ["CA", 2, 3, 6], ["CHR", 0, "shared", [3]], ["CA", 1, 4, 6], ["FU", 5, [0, 1]], ["AN", 5, 0, 5], ["FU", 5, [1, 2]], ["AN", 5, 1, 4], ["FU", 5, [2, 3]], ["AN", 5, 2, 6], ["FU", 3, [0, 1]], ["SP", 3, 0, 288, [1], 1], ["AN", 3, 1, 2], ["FFSP", 3, 0, [2, 1], 1, 1], ["AN", 3, 1, 6], ["FU", 1, [0, 1]], ["SP", 1, 0, 24, [1], 1], ["AN", 1, 1, 2], ["FFSP", 1, 0, [2, 1], 1, 1], ["AN", 1, 1, 6], ["PR", 4, 0, "auto_unroll_max_step$512"]]]], "r": [[2.4596e-05, 2.4589e-05, 2.45852e-05, 2.45823e-05, 2.45861e-05, 2.4584e-05, 2.45814e-05, 2.45859e-05, 2.45847e-05, 2.45845e-05, 2.45856e-05, 2.45862e-05, 2.45857e-05, 2.45847e-05, 2.45844e-05, 2.45807e-05, 2.45807e-05, 2.45796e-05, 2.45793e-05, 2.458e-05], 0, 277.078, 1647786891], "v": "v0.6"}
{"i": [["[\"pointwise_conv2d\", 56, 56, 24, 144]", "cuda -keys=cuda,gpu -max_num_threads=1024 -model=unknown -thread_warp_size=32", [-1, 16, 64, 49152, 2147483647, 1024, 8, 32], "", 0, []], [[], [["CHW", 2, "local"], ["SP", 2, 0, 3136, [1, 14, 14, 1], 1], ["SP", 2, 5, 144, [2, 12, 1, 6], 1], ["SP", 2, 10, 24, [1, 12], 1], ["RE", 2, [0, 5, 1, 6, 2, 7, 10, 11, 3, 8, 12, 4, 9]], ["FSP", 3, 0, 1, 3], ["FSP", 3, 4, 2, 3], ["RE", 3, [0, 4, 1, 5, 2, 6, 3, 7]], ["CA", 2, 3, 5], ["CHR", 1, "shared", [2]], ["CA", 2, 3, 6], ["CHR", 0, "shared", [3]], ["CA", 1, 4, 6], ["FU", 5, [0, 1]], ["AN", 5, 0, 5], ["FU", 5, [1, 2]], ["AN", 5, 1, 4], ["FU", 5, [2, 3]], ["AN", 5, 2, 6], ["FU", 3, [0, 1]], ["SP", 3, 0, 72, [1], 1], ["AN", 3, 1, 2], ["FFSP", 3, 0, [2, 1], 1, 1], ["AN", 3, 1, 6], ["FU", 1, [0, 1]], ["SP", 1, 0, 84, [1], 1], ["AN", 1, 1, 2], ["FFSP", 1, 0, [2, 1], 1, 1], ["AN", 1, 1, 6], ["PR", 4, 0, "auto_unroll_max_step$16"]]]], "r": [[5.68155e-05, 5.68013e-05, 5.6793e-05, 5.68017e-05, 5.67904e-05, 5.67964e-05, 5.68036e-05, 5.68e-05, 5.67983e-05, 5.68166e-05, 5.67952e-05, 5.67755e-05, 5.6809e-05, 5.68071e-05, 5.67836e-05, 5.68113e-05, 5.67904e-05, 5.68073e-05, 5.67872e-05, 5.68086e-05], 0, 260.986, 1647786875], "v": "v0.6"}
{"i": [["[\"pointwise_conv2d\", 56, 56, 24, 144]", "cuda -keys=cuda,gpu -max_num_threads=1024 -model=unknown -thread_warp_size=32", [-1, 16, 64, 49152, 2147483647, 1024, 8, 32], "", 0, []], [[], [["CHW", 2, "local"], ["SP", 2, 0, 3136, [2, 8, 14, 1], 1], ["SP", 2, 5, 144, [1, 72, 1, 2], 1], ["SP", 2, 10, 24, [4, 1], 1], ["RE", 2, [0, 5, 1, 6, 2, 7, 10, 11, 3, 8, 12, 4, 9]], ["FSP", 3, 0, 1, 3], ["FSP", 3, 4, 2, 3], ["RE", 3, [0, 4, 1, 5, 2, 6, 3, 7]], ["CA", 2, 3, 5], ["CHR", 1, "shared", [2]], ["CA", 2, 3, 6], ["CHR", 0, "shared", [3]], ["CA", 1, 4, 6], ["FU", 5, [0, 1]], ["AN", 5, 0, 5], ["FU", 5, [1, 2]], ["AN", 5, 1, 4], ["FU", 5, [2, 3]], ["AN", 5, 2, 6], ["FU", 3, [0, 1]], ["SP", 3, 0, 24, [2], 1], ["AN", 3, 1, 2], ["FFSP", 3, 0, [2, 1], 1, 1], ["AN", 3, 1, 6], ["FU", 1, [0, 1]], ["SP", 1, 0, 56, [1], 1], ["AN", 1, 1, 2], ["FFSP", 1, 0, [2, 1], 1, 1], ["AN", 1, 1, 6], ["PR", 4, 0, "auto_unroll_max_step$64"]]]], "r": [[2.79509e-05, 2.79516e-05, 2.79515e-05, 2.79541e-05, 2.79536e-05, 2.79533e-05, 2.79522e-05, 2.79537e-05, 2.79522e-05, 2.79512e-05, 2.79527e-05, 2.79527e-05, 2.79521e-05, 2.79536e-05, 2.79496e-05, 2.79498e-05, 2.79529e-05, 2.7951e-05, 2.79474e-05, 2.79515e-05], 0, 185.215, 1647786799], "v": "v0.6"}
{"i": [["[\"pointwise_conv2d\", 56, 56, 24, 144]", "cuda -keys=cuda,gpu -max_num_threads=1024 -model=unknown -thread_warp_size=32", [-1, 16, 64, 49152, 2147483647, 1024, 8, 32], "", 0, []], [[], [["CHW", 2, "local"], ["SP", 2, 0, 3136, [2, 49, 1, 2], 1], ["SP", 2, 5, 144, [1, 6, 1, 8], 1], ["SP", 2, 10, 24, [1, 1], 1], ["RE", 2, [0, 5, 1, 6, 2, 7, 10, 11, 3, 8, 12, 4, 9]], ["FSP", 3, 0, 1, 3], ["FSP", 3, 4, 2, 3], ["RE", 3, [0, 4, 1, 5, 2, 6, 3, 7]], ["CA", 2, 3, 5], ["CHR", 1, "shared", [2]], ["CA", 2, 3, 6], ["CHR", 0, "shared", [3]], ["CA", 1, 4, 6], ["FU", 5, [0, 1]], ["AN", 5, 0, 5], ["FU", 5, [1, 2]], ["AN", 5, 1, 4], ["FU", 5, [2, 3]], ["AN", 5, 2, 6], ["FU", 3, [0, 1]], ["SP", 3, 0, 8, [1], 1], ["AN", 3, 1, 2], ["FFSP", 3, 0, [2, 1], 1, 1], ["AN", 3, 1, 6], ["FU", 1, [0, 1]], ["SP", 1, 0, 2, [1], 1], ["AN", 1, 1, 2], ["FFSP", 1, 0, [2, 1], 1, 1], ["AN", 1, 1, 6], ["PR", 4, 0, "auto_unroll_max_step$0"]]]], "r": [[2.14623e-05, 2.14614e-05, 2.14617e-05, 2.14614e-05, 2.14606e-05, 2.14592e-05, 2.14604e-05, 2.14593e-05, 2.1461e-05, 2.14599e-05, 2.14599e-05, 2.14617e-05, 2.14611e-05, 2.1462e-05, 2.14625e-05, 2.14633e-05, 2.14617e-05, 2.14613e-05, 2.14633e-05, 2.1459e-05], 0, 223.913, 1647786838], "v": "v0.6"}
{"i": [["[\"pointwise_conv2d\", 56, 56, 24, 144]", "cuda -keys=cuda,gpu -max_num_threads=1024 -model=unknown -thread_warp_size=32", [-1, 16, 64, 49152, 2147483647, 1024, 8, 32], "", 0, []], [[], [["CHW", 2, "local"], ["SP", 2, 0, 3136, [1, 7, 8, 8], 1], ["SP", 2, 5, 144, [4, 3, 1, 4], 1], ["SP", 2, 10, 24, [2, 4], 1], ["RE", 2, [0, 5, 1, 6, 2, 7, 10, 11, 3, 8, 12, 4, 9]], ["FSP", 3, 0, 1, 3], ["FSP", 3, 4, 2, 3], ["RE", 3, [0, 4, 1, 5, 2, 6, 3, 7]], ["CA", 2, 3, 5], ["CHR", 1, "shared", [2]], ["CA", 2, 3, 6], ["CHR", 0, "shared", [3]], ["CA", 1, 4, 6], ["FU", 5, [0, 1]], ["AN", 5, 0, 5], ["FU", 5, [1, 2]], ["AN", 5, 1, 4], ["FU", 5, [2, 3]], ["AN", 5, 2, 6], ["FU", 3, [0, 1]], ["SP", 3, 0, 8, [1], 1], ["AN", 3, 1, 2], ["FFSP", 3, 0, [2, 1], 1, 1], ["AN", 3, 1, 6], ["FU", 1, [0, 1]], ["SP", 1, 0, 512, [2], 1], ["AN", 1, 1, 2], ["FFSP", 1, 0, [2, 1], 1, 1], ["AN", 1, 1, 6], ["PR", 4, 0, "auto_unroll_max_step$16"]]]], "r": [[0.000114151, 0.000114126, 0.000114129, 0.000114126, 0.000114121, 0.000114121, 0.000114134, 0.000114127, 0.000114129, 0.00011413, 0.000114122, 0.000114127, 0.000114132, 0.000114137, 0.000114135, 0.000114134, 0.000114138, 0.000114138, 0.000114138, 0.000114143], 0, 176.05, 1647786790], "v": "v0.6"}
{"i": [["[\"pointwise_conv2d\", 56, 56, 24, 144]", "cuda -keys=cuda,gpu -max_num_threads=1024 -model=unknown -thread_warp_size=32", [-1, 16, 64, 49152, 2147483647, 1024, 8, 32], "", 0, []], [[], [["CHW", 2, "local"], ["SP", 2, 0, 3136, [1, 98, 4, 2], 1], ["SP", 2, 5, 144, [1, 6, 2, 1], 1], ["SP", 2, 10, 24, [1, 4], 1], ["RE", 2, [0, 5, 1, 6, 2, 7, 10, 11, 3, 8, 12, 4, 9]], ["FSP", 3, 0, 1, 3], ["FSP", 3, 4, 2, 3], ["RE", 3, [0, 4, 1, 5, 2, 6, 3, 7]], ["CA", 2, 3, 5], ["CHR", 1, "shared", [2]], ["CA", 2, 3, 6], ["CHR", 0, "shared", [3]], ["CA", 1, 4, 6], ["FU", 5, [0, 1]], ["AN", 5, 0, 5], ["FU", 5, [1, 2]], ["AN", 5, 1, 4], ["FU", 5, [2, 3]], ["AN", 5, 2, 6], ["FU", 3, [0, 1]], ["SP", 3, 0, 16, [8], 1], ["AN", 3, 1, 2], ["FFSP", 3, 0, [2, 1], 1, 1], ["AN", 3, 1, 6], ["FU", 1, [0, 1]], ["SP", 1, 0, 64, [1], 1], ["AN", 1, 1, 2], ["FFSP", 1, 0, [2, 1], 1, 1], ["AN", 1, 1, 6], ["PR", 4, 0, "auto_unroll_max_step$64"]]]], "r": [[1.60812e-05, 1.60805e-05, 1.60831e-05, 1.60805e-05, 1.60823e-05, 1.6081e-05, 1.60835e-05, 1.60829e-05, 1.6082e-05, 1.60824e-05, 1.60828e-05, 1.60819e-05, 1.60796e-05, 1.60817e-05, 1.60814e-05, 1.60798e-05, 1.60815e-05, 1.60817e-05, 1.60814e-05, 1.60817e-05], 0, 241.468, 1647786855], "v": "v0.6"}
{"i": [["[\"pointwise_conv2d\", 56, 56, 24, 144]", "cuda -keys=cuda,gpu -max_num_threads=1024 -model=unknown -thread_warp_size=32", [-1, 16, 64, 49152, 2147483647, 1024, 8, 32], "", 0, []], [[], [["CHW", 2, "local"], ["SP", 2, 0, 3136, [1, 8, 392, 1], 1], ["SP", 2, 5, 144, [1, 4, 9, 4], 1], ["SP", 2, 10, 24, [1, 1], 1], ["RE", 2, [0, 5, 1, 6, 2, 7, 10, 11, 3, 8, 12, 4, 9]], ["FSP", 3, 0, 1, 3], ["FSP", 3, 4, 2, 3], ["RE", 3, [0, 4, 1, 5, 2, 6, 3, 7]], ["CA", 2, 3, 5], ["CHR", 1, "shared", [2]], ["CA", 2, 3, 6], ["CHR", 0, "shared", [3]], ["CA", 1, 4, 6], ["FU", 5, [0, 1]], ["AN", 5, 0, 5], ["FU", 5, [1, 2]], ["AN", 5, 1, 4], ["FU", 5, [2, 3]], ["AN", 5, 2, 6], ["FU", 3, [0, 1]], ["SP", 3, 0, 72, [1], 1], ["AN", 3, 1, 2], ["FFSP", 3, 0, [2, 1], 1, 1], ["AN", 3, 1, 6], ["FU", 1, [0, 1]], ["SP", 1, 0, 98, [1], 1], ["AN", 1, 1, 2], ["FFSP", 1, 0, [2, 1], 1, 1], ["AN", 1, 1, 6], ["PR", 4, 0, "auto_unroll_max_step$1024"]]]], "r": [[0.00373165, 0.00373156, 0.00373089, 0.0037312, 0.00373063, 0.00372984, 0.00372983, 0.00372951, 0.0037299, 0.00372978, 0.00372916, 0.00372941, 0.00373014, 0.00373074, 0.00373168, 0.0037305, 0.00373097, 0.00373023, 0.00373035, 0.00373116], 0, 267.385, 1647786881], "v": "v0.6"}
{"i": [["[\"pointwise_conv2d\", 56, 56, 24, 144]", "cuda -keys=cuda,gpu -max_num_threads=1024 -model=unknown -thread_warp_size=32", [-1, 16, 64, 49152, 2147483647, 1024, 8, 32], "", 0, []], [[], [["CHW", 2, "local"], ["SP", 2, 0, 3136, [4, 56, 1, 2], 1], ["SP", 2, 5, 144, [2, 2, 1, 12], 1], ["SP", 2, 10, 24, [1, 1], 1], ["RE", 2, [0, 5, 1, 6, 2, 7, 10, 11, 3, 8, 12, 4, 9]], ["FSP", 3, 0, 1, 3], ["FSP", 3, 4, 2, 3], ["RE", 3, [0, 4, 1, 5, 2, 6, 3, 7]], ["CA", 2, 3, 5], ["CHR", 1, "shared", [2]], ["CA", 2, 3, 6], ["CHR", 0, "shared", [3]], ["CA", 1, 4, 6], ["FU", 5, [0, 1]], ["AN", 5, 0, 5], ["FU", 5, [1, 2]], ["AN", 5, 1, 4], ["FU", 5, [2, 3]], ["AN", 5, 2, 6], ["FU", 3, [0, 1]], ["SP", 3, 0, 12, [6], 1], ["AN", 3, 1, 2], ["FFSP", 3, 0, [2, 1], 1, 1], ["AN", 3, 1, 6], ["FU", 1, [0, 1]], ["SP", 1, 0, 2, [2], 1], ["AN", 1, 1, 2], ["FFSP", 1, 0, [2, 1], 1, 1], ["AN", 1, 1, 6], ["PR", 4, 0, "auto_unroll_max_step$512"]]]], "r": [[4.34844e-05, 4.34829e-05, 4.34822e-05, 4.34821e-05, 4.34811e-05, 4.34841e-05, 4.34834e-05, 4.34847e-05, 4.34842e-05, 4.34822e-05, 4.34822e-05, 4.34824e-05, 4.34823e-05, 4.34829e-05, 4.34825e-05, 4.34879e-05, 4.34891e-05, 4.34888e-05, 4.34863e-05, 4.3489e-05], 0, 351.768, 1647786965], "v": "v0.6"}
{"i": [["[\"pointwise_conv2d\", 56, 56, 24, 144]", "cuda -keys=cuda,gpu -max_num_threads=1024 -model=unknown -thread_warp_size=32", [-1, 16, 64, 49152, 2147483647, 1024, 8, 32], "", 0, []], [[], [["CHW", 2, "local"], ["SP", 2, 0, 3136, [1, 16, 14, 14], 1], ["SP", 2, 5, 144, [8, 3, 2, 3], 1], ["SP", 2, 10, 24, [1, 2], 1], ["RE", 2, [0, 5, 1, 6, 2, 7, 10, 11, 3, 8, 12, 4, 9]], ["FSP", 3, 0, 1, 3], ["FSP", 3, 4, 2, 3], ["RE", 3, [0, 4, 1, 5, 2, 6, 3, 7]], ["CA", 2, 3, 5], ["CHR", 1, "shared", [2]], ["CA", 2, 3, 6], ["CHR", 0, "shared", [3]], ["CA", 1, 4, 6], ["FU", 5, [0, 1]], ["AN", 5, 0, 5], ["FU", 5, [1, 2]], ["AN", 5, 1, 4], ["FU", 5, [2, 3]], ["AN", 5, 2, 6], ["FU", 3, [0, 1]], ["SP", 3, 0, 12, [1], 1], ["AN", 3, 1, 2], ["FFSP", 3, 0, [2, 1], 1, 1], ["AN", 3, 1, 6], ["FU", 1, [0, 1]], ["SP", 1, 0, 196, [1], 1], ["AN", 1, 1, 2], ["FFSP", 1, 0, [2, 1], 1, 1], ["AN", 1, 1, 6], ["PR", 4, 0, "auto_unroll_max_step$0"]]]], "r": [[0.00400684, 0.00400672, 0.00400663, 0.00400666, 0.00400691, 0.00400692, 0.00400731, 0.00400676, 0.00400691, 0.00400683, 0.00400688, 0.00400664, 0.00400651, 0.0040066, 0.004007, 0.00400682, 0.00400688, 0.00400661, 0.00400692, 0.00400707], 0, 368.231, 1647786982], "v": "v0.6"}
{"i": [["[\"pointwise_conv2d\", 56, 56, 24, 144]", "cuda -keys=cuda,gpu -max_num_threads=1024 -model=unknown -thread_warp_size=32", [-1, 16, 64, 49152, 2147483647, 1024, 8, 32], "", 0, []], [[], [["CHW", 2, "local"], ["SP", 2, 0, 3136, [1, 32, 2, 49], 1], ["SP", 2, 5, 144, [1, 6, 1, 24], 1], ["SP", 2, 10, 24, [1, 3], 1], ["RE", 2, [0, 5, 1, 6, 2, 7, 10, 11, 3, 8, 12, 4, 9]], ["FSP", 3, 0, 1, 3], ["FSP", 3, 4, 2, 3], ["RE", 3, [0, 4, 1, 5, 2, 6, 3, 7]], ["CA", 2, 3, 5], ["CHR", 1, "shared", [2]], ["CA", 2, 3, 6], ["CHR", 0, "shared", [3]], ["CA", 1, 4, 6], ["FU", 5, [0, 1]], ["AN", 5, 0, 5], ["FU", 5, [1, 2]], ["AN", 5, 1, 4], ["FU", 5, [2, 3]], ["AN", 5, 2, 6], ["FU", 3, [0, 1]], ["SP", 3, 0, 72, [1], 1], ["AN", 3, 1, 2], ["FFSP", 3, 0, [2, 1], 1, 1], ["AN", 3, 1, 6], ["FU", 1, [0, 1]], ["SP", 1, 0, 294, [3], 1], ["AN", 1, 1, 2], ["FFSP", 1, 0, [2, 1], 1, 1], ["AN", 1, 1, 6], ["PR", 4, 0, "auto_unroll_max_step$64"]]]], "r": [[0.00195686, 0.00195699, 0.001957, 0.00195677, 0.00195677, 0.00195698, 0.00195741, 0.00195683, 0.00195685, 0.00195695, 0.00195715, 0.00195695, 0.00195689, 0.00195695, 0.00195712, 0.00195711, 0.00195685, 0.00195683, 0.001957, 0.00195723], 0, 323.405, 1647786937], "v": "v0.6"}
{"i": [["[\"pointwise_conv2d\", 56, 56, 24, 144]", "cuda -keys=cuda,gpu -max_num_threads=1024 -model=unknown -thread_warp_size=32", [-1, 16, 64, 49152, 2147483647, 1024, 8, 32], "", 0, []], [[], [["CHW", 2, "local"], ["SP", 2, 0, 3136, [1, 98, 4, 1], 1], ["SP", 2, 5, 144, [1, 8, 3, 1], 1], ["SP", 2, 10, 24, [1, 4], 1], ["RE", 2, [0, 5, 1, 6, 2, 7, 10, 11, 3, 8, 12, 4, 9]], ["FSP", 3, 0, 1, 3], ["FSP", 3, 4, 2, 3], ["RE", 3, [0, 4, 1, 5, 2, 6, 3, 7]], ["CA", 2, 3, 5], ["CHR", 1, "shared", [2]], ["CA", 2, 3, 6], ["CHR", 0, "shared", [3]], ["CA", 1, 4, 6], ["FU", 5, [0, 1]], ["AN", 5, 0, 5], ["FU", 5, [1, 2]], ["AN", 5, 1, 4], ["FU", 5, [2, 3]], ["AN", 5, 2, 6], ["FU", 3, [0, 1]], ["SP", 3, 0, 12, [1], 1], ["AN", 3, 1, 2], ["FFSP", 3, 0, [2, 1], 1, 1], ["AN", 3, 1, 6], ["FU", 1, [0, 1]], ["SP", 1, 0, 16, [1], 1], ["AN", 1, 1, 2], ["FFSP", 1, 0, [2, 1], 1, 1], ["AN", 1, 1, 6], ["PR", 4, 0, "auto_unroll_max_step$64"]]]], "r": [[1.24481e-05, 1.24485e-05, 1.2461e-05, 1.24641e-05, 1.2461e-05, 1.24689e-05, 1.24732e-05, 1.24711e-05, 1.24616e-05, 1.24608e-05, 1.24877e-05, 1.24733e-05, 1.24732e-05, 1.24663e-05, 1.24759e-05, 1.24661e-05, 1.24708e-05, 1.24617e-05, 1.24744e-05, 1.2461e-05], 0, 341.719, 1647786956], "v": "v0.6"}
{"i": [["[\"pointwise_conv2d\", 56, 56, 24, 144]", "cuda -keys=cuda,gpu -max_num_threads=1024 -model=unknown -thread_warp_size=32", [-1, 16, 64, 49152, 2147483647, 1024, 8, 32], "", 0, []], [[], [["CHW", 2, "local"], ["SP", 2, 0, 3136, [2, 16, 7, 2], 1], ["SP", 2, 5, 144, [1, 9, 4, 1], 1], ["SP", 2, 10, 24, [8, 3], 1], ["RE", 2, [0, 5, 1, 6, 2, 7, 10, 11, 3, 8, 12, 4, 9]], ["FSP", 3, 0, 1, 3], ["FSP", 3, 4, 2, 3], ["RE", 3, [0, 4, 1, 5, 2, 6, 3, 7]], ["CA", 2, 3, 5], ["CHR", 1, "shared", [2]], ["CA", 2, 3, 6], ["CHR", 0, "shared", [3]], ["CA", 1, 4, 6], ["FU", 5, [0, 1]], ["AN", 5, 0, 5], ["FU", 5, [1, 2]], ["AN", 5, 1, 4], ["FU", 5, [2, 3]], ["AN", 5, 2, 6], ["FU", 3, [0, 1]], ["SP", 3, 0, 48, [1], 1], ["AN", 3, 1, 2], ["FFSP", 3, 0, [2, 1], 1, 1], ["AN", 3, 1, 6], ["FU", 1, [0, 1]], ["SP", 1, 0, 336, [1], 1], ["AN", 1, 1, 2], ["FFSP", 1, 0, [2, 1], 1, 1], ["AN", 1, 1, 6], ["PR", 4, 0, "auto_unroll_max_step$16"]]]], "r": [[3.55007e-05, 3.54997e-05, 3.54953e-05, 3.55064e-05, 3.55006e-05, 3.54995e-05, 3.54983e-05, 3.55059e-05, 3.55026e-05, 3.55043e-05, 3.55014e-05, 3.55026e-05, 3.55032e-05, 3.55017e-05, 3.55048e-05, 3.55036e-05, 3.54982e-05, 3.54998e-05, 3.54969e-05, 3.54907e-05], 0, 214.847, 1647786829], "v": "v0.6"}
{"i": [["[\"pointwise_conv2d\", 56, 56, 24, 144]", "cuda -keys=cuda,gpu -max_num_threads=1024 -model=unknown -thread_warp_size=32", [-1, 16, 64, 49152, 2147483647, 1024, 8, 32], "", 0, []], [[], [["CHW", 2, "local"], ["SP", 2, 0, 3136, [4, 7, 2, 2], 1], ["SP", 2, 5, 144, [1, 4, 3, 12], 1], ["SP", 2, 10, 24, [2, 3], 1], ["RE", 2, [0, 5, 1, 6, 2, 7, 10, 11, 3, 8, 12, 4, 9]], ["FSP", 3, 0, 1, 3], ["FSP", 3, 4, 2, 3], ["RE", 3, [0, 4, 1, 5, 2, 6, 3, 7]], ["CA", 2, 3, 5], ["CHR", 1, "shared", [2]], ["CA", 2, 3, 6], ["CHR", 0, "shared", [3]], ["CA", 1, 4, 6], ["FU", 5, [0, 1]], ["AN", 5, 0, 5], ["FU", 5, [1, 2]], ["AN", 5, 1, 4], ["FU", 5, [2, 3]], ["AN", 5, 2, 6], ["FU", 3, [0, 1]], ["SP", 3, 0, 72, [9], 1], ["AN", 3, 1, 2], ["FFSP", 3, 0, [2, 1], 1, 1], ["AN", 3, 1, 6], ["FU", 1, [0, 1]], ["SP", 1, 0, 24, [1], 1], ["AN", 1, 1, 2], ["FFSP", 1, 0, [2, 1], 1, 1], ["AN", 1, 1, 6], ["PR", 4, 0, "auto_unroll_max_step$16"]]]], "r": [[6.89037e-05, 6.88881e-05, 6.8891e-05, 6.88988e-05, 6.88976e-05, 6.88908e-05, 6.88911e-05, 6.88865e-05, 6.88833e-05, 6.8881e-05, 6.88744e-05, 6.88879e-05, 6.89017e-05, 6.88916e-05, 6.8881e-05, 6.88844e-05, 6.88921e-05, 6.88849e-05, 6.88895e-05, 6.88805e-05], 0, 370.73, 1647786992], "v": "v0.6"}
{"i": [["[\"pointwise_conv2d\", 56, 56, 24, 144]", "cuda -keys=cuda,gpu -max_num_threads=1024 -model=unknown -thread_warp_size=32", [-1, 16, 64, 49152, 2147483647, 1024, 8, 32], "", 0, []], [[], [["CHW", 2, "local"], ["SP", 2, 0, 3136, [2, 98, 1, 4], 1], ["SP", 2, 5, 144, [1, 8, 1, 3], 1], ["SP", 2, 10, 24, [1, 8], 1], ["RE", 2, [0, 5, 1, 6, 2, 7, 10, 11, 3, 8, 12, 4, 9]], ["FSP", 3, 0, 1, 3], ["FSP", 3, 4, 2, 3], ["RE", 3, [0, 4, 1, 5, 2, 6, 3, 7]], ["CA", 2, 3, 5], ["CHR", 1, "shared", [2]], ["CA", 2, 3, 6], ["CHR", 0, "shared", [3]], ["CA", 1, 4, 6], ["FU", 5, [0, 1]], ["AN", 5, 0, 5], ["FU", 5, [1, 2]], ["AN", 5, 1, 4], ["FU", 5, [2, 3]], ["AN", 5, 2, 6], ["FU", 3, [0, 1]], ["SP", 3, 0, 24, [6], 1], ["AN", 3, 1, 2], ["FFSP", 3, 0, [2, 1], 1, 1], ["AN", 3, 1, 6], ["FU", 1, [0, 1]], ["SP", 1, 0, 32, [16], 1], ["AN", 1, 1, 2], ["FFSP", 1, 0, [2, 1], 1, 1], ["AN", 1, 1, 6], ["PR", 4, 0, "auto_unroll_max_step$1024"]]]], "r": [[2.7035e-05, 2.70319e-05, 2.703e-05, 2.70344e-05, 2.70332e-05, 2.70339e-05, 2.70341e-05, 2.70338e-05, 2.70317e-05, 2.70336e-05, 2.70384e-05, 2.70351e-05, 2.70334e-05, 2.70371e-05, 2.70379e-05, 2.70385e-05, 2.70348e-05, 2.70357e-05, 2.70367e-05, 2.70352e-05], 0, 371.144, 1647787001], "v": "v0.6"}
{"i": [["[\"pointwise_conv2d\", 56, 56, 24, 144]", "cuda -keys=cuda,gpu -max_num_threads=1024 -model=unknown -thread_warp_size=32", [-1, 16, 64, 49152, 2147483647, 1024, 8, 32], "", 0, []], [[], [["CHW", 2, "local"], ["SP", 2, 0, 3136, [4, 2, 1, 4], 1], ["SP", 2, 5, 144, [1, 16, 1, 9], 1], ["SP", 2, 10, 24, [3, 4], 1], ["RE", 2, [0, 5, 1, 6, 2, 7, 10, 11, 3, 8, 12, 4, 9]], ["FSP", 3, 0, 1, 3], ["FSP", 3, 4, 2, 3], ["RE", 3, [0, 4, 1, 5, 2, 6, 3, 7]], ["CA", 2, 3, 5], ["CHR", 1, "shared", [2]], ["CA", 2, 3, 6], ["CHR", 0, "shared", [3]], ["CA", 1, 4, 6], ["FU", 5, [0, 1]], ["AN", 5, 0, 5], ["FU", 5, [1, 2]], ["AN", 5, 1, 4], ["FU", 5, [2, 3]], ["AN", 5, 2, 6], ["FU", 3, [0, 1]], ["SP", 3, 0, 36, [2], 1], ["AN", 3, 1, 2], ["FFSP", 3, 0, [2, 1], 1, 1], ["AN", 3, 1, 6], ["FU", 1, [0, 1]], ["SP", 1, 0, 48, [1], 1], ["AN", 1, 1, 2], ["FFSP", 1, 0, [2, 1], 1, 1], ["AN", 1, 1, 6], ["PR", 4, 0, "auto_unroll_max_step$512"]]]], "r": [[1.96195e-05, 1.96166e-05, 1.96164e-05, 1.96156e-05, 1.96168e-05, 1.96167e-05, 1.96149e-05, 1.96186e-05, 1.96157e-05, 1.96169e-05, 1.96199e-05, 1.96187e-05, 1.96172e-05, 1.96171e-05, 1.96193e-05, 1.96158e-05, 1.96184e-05, 1.9619e-05, 1.96172e-05, 1.96196e-05], 0, 369.907, 1647787010], "v": "v0.6"}
{"i": [["[\"pointwise_conv2d\", 56, 56, 24, 144]", "cuda -keys=cuda,gpu -max_num_threads=1024 -model=unknown -thread_warp_size=32", [-1, 16, 64, 49152, 2147483647, 1024, 8, 32], "", 0, []], [[], [["CHW", 2, "local"], ["SP", 2, 0, 3136, [2, 32, 1, 1], 1], ["SP", 2, 5, 144, [1, 3, 16, 3], 1], ["SP", 2, 10, 24, [1, 4], 1], ["RE", 2, [0, 5, 1, 6, 2, 7, 10, 11, 3, 8, 12, 4, 9]], ["FSP", 3, 0, 1, 3], ["FSP", 3, 4, 2, 3], ["RE", 3, [0, 4, 1, 5, 2, 6, 3, 7]], ["CA", 2, 3, 5], ["CHR", 1, "shared", [2]], ["CA", 2, 3, 6], ["CHR", 0, "shared", [3]], ["CA", 1, 4, 6], ["FU", 5, [0, 1]], ["AN", 5, 0, 5], ["FU", 5, [1, 2]], ["AN", 5, 1, 4], ["FU", 5, [2, 3]], ["AN", 5, 2, 6], ["FU", 3, [0, 1]], ["SP", 3, 0, 384, [1], 1], ["AN", 3, 1, 2], ["FFSP", 3, 0, [2, 1], 1, 1], ["AN", 3, 1, 6], ["FU", 1, [0, 1]], ["SP", 1, 0, 8, [1], 1], ["AN", 1, 1, 2], ["FFSP", 1, 0, [2, 1], 1, 1], ["AN", 1, 1, 6], ["PR", 4, 0, "auto_unroll_max_step$64"]]]], "r": [[3.60522e-05, 3.60518e-05, 3.60538e-05, 3.60552e-05, 3.60542e-05, 3.60512e-05, 3.60553e-05, 3.60491e-05, 3.60536e-05, 3.60551e-05, 3.60544e-05, 3.60526e-05, 3.60523e-05, 3.60538e-05, 3.60521e-05, 3.60506e-05, 3.60468e-05, 3.60486e-05, 3.60491e-05, 3.60469e-05], 0, 370.654, 1647787020], "v": "v0.6"}
{"i": [["[\"pointwise_conv2d\", 56, 56, 24, 144]", "cuda -keys=cuda,gpu -max_num_threads=1024 -model=unknown -thread_warp_size=32", [-1, 16, 64, 49152, 2147483647, 1024, 8, 32], "", 0, []], [[], [["CHW", 2, "local"], ["SP", 2, 0, 3136, [1, 112, 1, 2], 1], ["SP", 2, 5, 144, [6, 2, 1, 1], 1], ["SP", 2, 10, 24, [1, 6], 1], ["RE", 2, [0, 5, 1, 6, 2, 7, 10, 11, 3, 8, 12, 4, 9]], ["FSP", 3, 0, 1, 3], ["FSP", 3, 4, 2, 3], ["RE", 3, [0, 4, 1, 5, 2, 6, 3, 7]], ["CA", 2, 3, 5], ["CHR", 1, "shared", [2]], ["CA", 2, 3, 6], ["CHR", 0, "shared", [3]], ["CA", 1, 4, 6], ["FU", 5, [0, 1]], ["AN", 5, 0, 5], ["FU", 5, [1, 2]], ["AN", 5, 1, 4], ["FU", 5, [2, 3]], ["AN", 5, 2, 6], ["FU", 3, [0, 1]], ["SP", 3, 0, 36, [1], 1], ["AN", 3, 1, 2], ["FFSP", 3, 0, [2, 1], 1, 1], ["AN", 3, 1, 6], ["FU", 1, [0, 1]], ["SP", 1, 0, 12, [12], 1], ["AN", 1, 1, 2], ["FFSP", 1, 0, [2, 1], 1, 1], ["AN", 1, 1, 6], ["PR", 4, 0, "auto_unroll_max_step$1024"]]]], "r": [[1.38436e-05, 1.38431e-05, 1.38447e-05, 1.38448e-05, 1.38413e-05, 1.38412e-05, 1.38427e-05, 1.38445e-05, 1.38445e-05, 1.38427e-05, 1.38419e-05, 1.38433e-05, 1.38457e-05, 1.38455e-05, 1.38412e-05, 1.38428e-05, 1.3841e-05, 1.38393e-05, 1.38427e-05, 1.38421e-05], 0, 370.535, 1647787028], "v": "v0.6"}
{"i": [["[\"pointwise_conv2d\", 56, 56, 24, 144]", "cuda -keys=cuda,gpu -max_num_threads=1024 -model=unknown -thread_warp_size=32", [-1, 16, 64, 49152, 2147483647, 1024, 8, 32], "", 0, []], [[], [["CHW", 2, "local"], ["SP", 2, 0, 3136, [1, 7, 2, 7], 1], ["SP", 2, 5, 144, [8, 9, 1, 2], 1], ["SP", 2, 10, 24, [2, 6], 1], ["RE", 2, [0, 5, 1, 6, 2, 7, 10, 11, 3, 8, 12, 4, 9]], ["FSP", 3, 0, 1, 3], ["FSP", 3, 4, 2, 3], ["RE", 3, [0, 4, 1, 5, 2, 6, 3, 7]], ["CA", 2, 3, 5], ["CHR", 1, "shared", [2]], ["CA", 2, 3, 6], ["CHR", 0, "shared", [3]], ["CA", 1, 4, 6], ["FU", 5, [0, 1]], ["AN", 5, 0, 5], ["FU", 5, [1, 2]], ["AN", 5, 1, 4], ["FU", 5, [2, 3]], ["AN", 5, 2, 6], ["FU", 3, [0, 1]], ["SP", 3, 0, 48, [1], 1], ["AN", 3, 1, 2], ["FFSP", 3, 0, [2, 1], 1, 1], ["AN", 3, 1, 6], ["FU", 1, [0, 1]], ["SP", 1, 0, 168, [1], 1], ["AN", 1, 1, 2], ["FFSP", 1, 0, [2, 1], 1, 1], ["AN", 1, 1, 6], ["PR", 4, 0, "auto_unroll_max_step$1024"]]]], "r": [[2.05237e-05, 2.05236e-05, 2.05245e-05, 2.05271e-05, 2.05242e-05, 2.05332e-05, 2.05314e-05, 2.05325e-05, 2.05347e-05, 2.05313e-05, 2.05312e-05, 2.05292e-05, 2.05336e-05, 2.05304e-05, 2.05307e-05, 2.05256e-05, 2.05316e-05, 2.05325e-05, 2.05339e-05, 2.05295e-05], 0, 372.122, 1647787038], "v": "v0.6"}
{"i": [["[\"pointwise_conv2d\", 56, 56, 24, 144]", "cuda -keys=cuda,gpu -max_num_threads=1024 -model=unknown -thread_warp_size=32", [-1, 16, 64, 49152, 2147483647, 1024, 8, 32], "", 0, []], [[], [["CHW", 2, "local"], ["SP", 2, 0, 3136, [1, 28, 7, 1], 1], ["SP", 2, 5, 144, [1, 6, 24, 1], 1], ["SP", 2, 10, 24, [12, 2], 1], ["RE", 2, [0, 5, 1, 6, 2, 7, 10, 11, 3, 8, 12, 4, 9]], ["FSP", 3, 0, 1, 3], ["FSP", 3, 4, 2, 3], ["RE", 3, [0, 4, 1, 5, 2, 6, 3, 7]], ["CA", 2, 3, 5], ["CHR", 1, "shared", [2]], ["CA", 2, 3, 6], ["CHR", 0, "shared", [3]], ["CA", 1, 4, 6], ["FU", 5, [0, 1]], ["AN", 5, 0, 5], ["FU", 5, [1, 2]], ["AN", 5, 1, 4], ["FU", 5, [2, 3]], ["AN", 5, 2, 6], ["FU", 3, [0, 1]], ["SP", 3, 0, 24, [1], 1], ["AN", 3, 1, 2], ["FFSP", 3, 0, [2, 1], 1, 1], ["AN", 3, 1, 6], ["FU", 1, [0, 1]], ["SP", 1, 0, 7, [1], 1], ["AN", 1, 1, 2], ["FFSP", 1, 0, [2, 1], 1, 1], ["AN", 1, 1, 6], ["PR", 4, 0, "auto_unroll_max_step$0"]]]], "r": [[8.84576e-05, 8.84401e-05, 8.84587e-05, 8.8463e-05, 8.8462e-05, 8.84612e-05, 8.84592e-05, 8.84543e-05, 8.8458e-05, 8.84552e-05, 8.84542e-05, 8.84597e-05, 8.84625e-05, 8.84524e-05, 8.84649e-05, 8.84602e-05, 8.84497e-05, 8.84521e-05, 8.84467e-05, 8.84521e-05], 0, 370.387, 1647787048], "v": "v0.6"}
{"i": [["[\"pointwise_conv2d\", 56, 56, 24, 144]", "cuda -keys=cuda,gpu -max_num_threads=1024 -model=unknown -thread_warp_size=32", [-1, 16, 64, 49152, 2147483647, 1024, 8, 32], "", 0, []], [[], [["CHW", 2, "local"], ["SP", 2, 0, 3136, [1, 16, 2, 7], 1], ["SP", 2, 5, 144, [3, 48, 1, 1], 1], ["SP", 2, 10, 24, [4, 6], 1], ["RE", 2, [0, 5, 1, 6, 2, 7, 10, 11, 3, 8, 12, 4, 9]], ["FSP", 3, 0, 1, 3], ["FSP", 3, 4, 2, 3], ["RE", 3, [0, 4, 1, 5, 2, 6, 3, 7]], ["CA", 2, 3, 5], ["CHR", 1, "shared", [2]], ["CA", 2, 3, 6], ["CHR", 0, "shared", [3]], ["CA", 1, 4, 6], ["FU", 5, [0, 1]], ["AN", 5, 0, 5], ["FU", 5, [1, 2]], ["AN", 5, 1, 4], ["FU", 5, [2, 3]], ["AN", 5, 2, 6], ["FU", 3, [0, 1]], ["SP", 3, 0, 24, [8], 1], ["AN", 3, 1, 2], ["FFSP", 3, 0, [2, 1], 1, 1], ["AN", 3, 1, 6], ["FU", 1, [0, 1]], ["SP", 1, 0, 336, [2], 1], ["AN", 1, 1, 2], ["FFSP", 1, 0, [2, 1], 1, 1], ["AN", 1, 1, 6], ["PR", 4, 0, "auto_unroll_max_step$0"]]]], "r": [[1.78298e-05, 1.78274e-05, 1.78277e-05, 1.78297e-05, 1.78303e-05, 1.78304e-05, 1.78282e-05, 1.78286e-05, 1.78299e-05, 1.78285e-05, 1.78296e-05, 1.78273e-05, 1.78292e-05, 1.78301e-05, 1.78302e-05, 1.78305e-05, 1.783e-05, 1.78319e-05, 1.78316e-05, 1.78297e-05], 0, 370.25, 1647787057], "v": "v0.6"}
{"i": [["[\"pointwise_conv2d\", 56, 56, 24, 144]", "cuda -keys=cuda,gpu -max_num_threads=1024 -model=unknown -thread_warp_size=32", [-1, 16, 64, 49152, 2147483647, 1024, 8, 32], "", 0, []], [[], [["CHW", 2, "local"], ["SP", 2, 0, 3136, [1, 14, 32, 1], 1], ["SP", 2, 5, 144, [1, 4, 1, 6], 1], ["SP", 2, 10, 24, [2, 1], 1], ["RE", 2, [0, 5, 1, 6, 2, 7, 10, 11, 3, 8, 12, 4, 9]], ["FSP", 3, 0, 1, 3], ["FSP", 3, 4, 2, 3], ["RE", 3, [0, 4, 1, 5, 2, 6, 3, 7]], ["CA", 2, 3, 5], ["CHR", 1, "shared", [2]], ["CA", 2, 3, 6], ["CHR", 0, "shared", [3]], ["CA", 1, 4, 6], ["FU", 5, [0, 1]], ["AN", 5, 0, 5], ["FU", 5, [1, 2]], ["AN", 5, 1, 4], ["FU", 5, [2, 3]], ["AN", 5, 2, 6], ["FU", 3, [0, 1]], ["SP", 3, 0, 12, [1], 1], ["AN", 3, 1, 2], ["FFSP", 3, 0, [2, 1], 1, 1], ["AN", 3, 1, 6], ["FU", 1, [0, 1]], ["SP", 1, 0, 64, [1], 1], ["AN", 1, 1, 2], ["FFSP", 1, 0, [2, 1], 1, 1], ["AN", 1, 1, 6], ["PR", 4, 0, "auto_unroll_max_step$512"]]]], "r": [[2.08644e-05, 2.08663e-05, 2.08643e-05, 2.08677e-05, 2.08669e-05, 2.08641e-05, 2.08661e-05, 2.08654e-05, 2.08686e-05, 2.08677e-05, 2.08666e-05, 2.0868e-05, 2.08684e-05, 2.08688e-05, 2.08651e-05, 2.08664e-05, 2.08658e-05, 2.08667e-05, 2.08706e-05, 2.08724e-05], 0, 369.468, 1647787066], "v": "v0.6"}
{"i": [["[\"pointwise_conv2d\", 56, 56, 24, 144]", "cuda -keys=cuda,gpu -max_num_threads=1024 -model=unknown -thread_warp_size=32", [-1, 16, 64, 49152, 2147483647, 1024, 8, 32], "", 0, []], [[], [["CHW", 2, "local"], ["SP", 2, 0, 3136, [1, 4, 1, 2], 1], ["SP", 2, 5, 144, [6, 12, 2, 1], 1], ["SP", 2, 10, 24, [8, 3], 1], ["RE", 2, [0, 5, 1, 6, 2, 7, 10, 11, 3, 8, 12, 4, 9]], ["FSP", 3, 0, 1, 3], ["FSP", 3, 4, 2, 3], ["RE", 3, [0, 4, 1, 5, 2, 6, 3, 7]], ["CA", 2, 3, 5], ["CHR", 1, "shared", [2]], ["CA", 2, 3, 6], ["CHR", 0, "shared", [3]], ["CA", 1, 4, 6], ["FU", 5, [0, 1]], ["AN", 5, 0, 5], ["FU", 5, [1, 2]], ["AN", 5, 1, 4], ["FU", 5, [2, 3]], ["AN", 5, 2, 6], ["FU", 3, [0, 1]], ["SP", 3, 0, 48, [1], 1], ["AN", 3, 1, 2], ["FFSP", 3, 0, [2, 1], 1, 1], ["AN", 3, 1, 6], ["FU", 1, [0, 1]], ["SP", 1, 0, 48, [3], 1], ["AN", 1, 1, 2], ["FFSP", 1, 0, [2, 1], 1, 1], ["AN", 1, 1, 6], ["PR", 4, 0, "auto_unroll_max_step$1024"]]]], "r": [[1.00732e-05, 1.00714e-05, 1.00746e-05, 1.00747e-05, 1.00759e-05, 1.0076e-05, 1.00778e-05, 1.00789e-05, 1.00769e-05, 1.00759e-05, 1.00772e-05, 1.00764e-05, 1.00772e-05, 1.0076e-05, 1.00746e-05, 1.00794e-05, 1.0076e-05, 1.00793e-05, 1.00763e-05, 1.00778e-05], 0, 368.386, 1647787074], "v": "v0.6"}
{"i": [["[\"pointwise_conv2d\", 56, 56, 24, 144]", "cuda -keys=cuda,gpu -max_num_threads=1024 -model=unknown -thread_warp_size=32", [-1, 16, 64, 49152, 2147483647, 1024, 8, 32], "", 0, []], [[], [["CHW", 2, "local"], ["SP", 2, 0, 3136, [1, 14, 4, 28], 1], ["SP", 2, 5, 144, [3, 12, 4, 1], 1], ["SP", 2, 10, 24, [2, 2], 1], ["RE", 2, [0, 5, 1, 6, 2, 7, 10, 11, 3, 8, 12, 4, 9]], ["FSP", 3, 0, 1, 3], ["FSP", 3, 4, 2, 3], ["RE", 3, [0, 4, 1, 5, 2, 6, 3, 7]], ["CA", 2, 3, 5], ["CHR", 1, "shared", [2]], ["CA", 2, 3, 6], ["CHR", 0, "shared", [3]], ["CA", 1, 4, 6], ["FU", 5, [0, 1]], ["AN", 5, 0, 5], ["FU", 5, [1, 2]], ["AN", 5, 1, 4], ["FU", 5, [2, 3]], ["AN", 5, 2, 6], ["FU", 3, [0, 1]], ["SP", 3, 0, 48, [1], 1], ["AN", 3, 1, 2], ["FFSP", 3, 0, [2, 1], 1, 1], ["AN", 3, 1, 6], ["FU", 1, [0, 1]], ["SP", 1, 0, 448, [1], 1], ["AN", 1, 1, 2], ["FFSP", 1, 0, [2, 1], 1, 1], ["AN", 1, 1, 6], ["PR", 4, 0, "auto_unroll_max_step$16"]]]], "r": [[0.000517002, 0.000516926, 0.000516964, 0.000516885, 0.000517013, 0.000517023, 0.000516931, 0.000516941, 0.000516996, 0.00051688, 0.000517145, 0.000516897, 0.000516993, 0.000516937, 0.000517221, 0.000517069, 0.000517029, 0.000517099, 0.000517016, 0.000516806], 0, 364.342, 1647787091], "v": "v0.6"}
{"i": [["[\"pointwise_conv2d\", 56, 56, 24, 144]", "cuda -keys=cuda,gpu -max_num_threads=1024 -model=unknown -thread_warp_size=32", [-1, 16, 64, 49152, 2147483647, 1024, 8, 32], "", 0, []], [[], [["CHW", 2, "local"], ["SP", 2, 0, 3136, [1, 98, 4, 4], 1], ["SP", 2, 5, 144, [1, 1, 3, 2], 1], ["SP", 2, 10, 24, [2, 2], 1], ["RE", 2, [0, 5, 1, 6, 2, 7, 10, 11, 3, 8, 12, 4, 9]], ["FSP", 3, 0, 1, 3], ["FSP", 3, 4, 2, 3], ["RE", 3, [0, 4, 1, 5, 2, 6, 3, 7]], ["CA", 2, 3, 5], ["CHR", 1, "shared", [2]], ["CA", 2, 3, 6], ["CHR", 0, "shared", [3]], ["CA", 1, 4, 6], ["FU", 5, [0, 1]], ["AN", 5, 0, 5], ["FU", 5, [1, 2]], ["AN", 5, 1, 4], ["FU", 5, [2, 3]], ["AN", 5, 2, 6], ["FU", 3, [0, 1]], ["SP", 3, 0, 24, [1], 1], ["AN", 3, 1, 2], ["FFSP", 3, 0, [2, 1], 1, 1], ["AN", 3, 1, 6], ["FU", 1, [0, 1]], ["SP", 1, 0, 64, [1], 1], ["AN", 1, 1, 2], ["FFSP", 1, 0, [2, 1], 1, 1], ["AN", 1, 1, 6], ["PR", 4, 0, "auto_unroll_max_step$1024"]]]], "r": [[3.53225e-05, 3.53189e-05, 3.53212e-05, 3.53202e-05, 3.53234e-05, 3.53218e-05, 3.53189e-05, 3.53159e-05, 3.53228e-05, 3.53182e-05, 3.53139e-05, 3.53177e-05, 3.53185e-05, 3.53179e-05, 3.53208e-05, 3.53218e-05, 3.53232e-05, 3.53191e-05, 3.5318e-05, 3.53224e-05], 0, 365.02, 1647787100], "v": "v0.6"}
{"i": [["[\"pointwise_conv2d\", 56, 56, 24, 144]", "cuda -keys=cuda,gpu -max_num_threads=1024 -model=unknown -thread_warp_size=32", [-1, 16, 64, 49152, 2147483647, 1024, 8, 32], "", 0, []], [[], [["CHW", 2, "local"], ["SP", 2, 0, 3136, [1, 56, 4, 2], 1], ["SP", 2, 5, 144, [1, 2, 2, 9], 1], ["SP", 2, 10, 24, [4, 1], 1], ["RE", 2, [0, 5, 1, 6, 2, 7, 10, 11, 3, 8, 12, 4, 9]], ["FSP", 3, 0, 1, 3], ["FSP", 3, 4, 2, 3], ["RE", 3, [0, 4, 1, 5, 2, 6, 3, 7]], ["CA", 2, 3, 5], ["CHR", 1, "shared", [2]], ["CA", 2, 3, 6], ["CHR", 0, "shared", [3]], ["CA", 1, 4, 6], ["FU", 5, [0, 1]], ["AN", 5, 0, 5], ["FU", 5, [1, 2]], ["AN", 5, 1, 4], ["FU", 5, [2, 3]], ["AN", 5, 2, 6], ["FU", 3, [0, 1]], ["SP", 3, 0, 72, [1], 1], ["AN", 3, 1, 2], ["FFSP", 3, 0, [2, 1], 1, 1], ["AN", 3, 1, 6], ["FU", 1, [0, 1]], ["SP", 1, 0, 16, [1], 1], ["AN", 1, 1, 2], ["FFSP", 1, 0, [2, 1], 1, 1], ["AN", 1, 1, 6], ["PR", 4, 0, "auto_unroll_max_step$0"]]]], "r": [[3.51228e-05, 3.51259e-05, 3.51245e-05, 3.51182e-05, 3.51221e-05, 3.5122e-05, 3.51216e-05, 3.51235e-05, 3.51222e-05, 3.51248e-05, 3.51199e-05, 3.51213e-05, 3.51212e-05, 3.5124e-05, 3.51254e-05, 3.51243e-05, 3.51216e-05, 3.51212e-05, 3.51204e-05, 3.51196e-05], 0, 363.426, 1647787119], "v": "v0.6"}
{"i": [["[\"pointwise_conv2d\", 56, 56, 24, 144]", "cuda -keys=cuda,gpu -max_num_threads=1024 -model=unknown -thread_warp_size=32", [-1, 16, 64, 49152, 2147483647, 1024, 8, 32], "", 0, []], [[], [["CHW", 2, "local"], ["SP", 2, 0, 3136, [1, 4, 7, 2], 1], ["SP", 2, 5, 144, [2, 72, 1, 1], 1], ["SP", 2, 10, 24, [6, 4], 1], ["RE", 2, [0, 5, 1, 6, 2, 7, 10, 11, 3, 8, 12, 4, 9]], ["FSP", 3, 0, 1, 3], ["FSP", 3, 4, 2, 3], ["RE", 3, [0, 4, 1, 5, 2, 6, 3, 7]], ["CA", 2, 3, 5], ["CHR", 1, "shared", [2]], ["CA", 2, 3, 6], ["CHR", 0, "shared", [3]], ["CA", 1, 4, 6], ["FU", 5, [0, 1]], ["AN", 5, 0, 5], ["FU", 5, [1, 2]], ["AN", 5, 1, 4], ["FU", 5, [2, 3]], ["AN", 5, 2, 6], ["FU", 3, [0, 1]], ["SP", 3, 0, 48, [1], 1], ["AN", 3, 1, 2], ["FFSP", 3, 0, [2, 1], 1, 1], ["AN", 3, 1, 6], ["FU", 1, [0, 1]], ["SP", 1, 0, 336, [8], 1], ["AN", 1, 1, 2], ["FFSP", 1, 0, [2, 1], 1, 1], ["AN", 1, 1, 6], ["PR", 4, 0, "auto_unroll_max_step$16"]]]], "r": [[7.32563e-06, 7.32442e-06, 7.32523e-06, 7.32413e-06, 7.32254e-06, 7.32379e-06, 7.32649e-06, 7.32331e-06, 7.32439e-06, 7.32494e-06, 7.32329e-06, 7.32344e-06, 7.32396e-06, 7.32359e-06, 7.3242e-06, 7.32371e-06, 7.32595e-06, 7.32642e-06, 7.3241e-06, 7.32416e-06], 0, 361.468, 1647787126], "v": "v0.6"}
{"i": [["[\"pointwise_conv2d\", 56, 56, 24, 144]", "cuda -keys=cuda,gpu -max_num_threads=1024 -model=unknown -thread_warp_size=32", [-1, 16, 64, 49152, 2147483647, 1024, 8, 32], "", 0, []], [[], [["CHW", 2, "local"], ["SP", 2, 0, 3136, [1, 49, 2, 4], 1], ["SP", 2, 5, 144, [1, 3, 8, 1], 1], ["SP", 2, 10, 24, [3, 8], 1], ["RE", 2, [0, 5, 1, 6, 2, 7, 10, 11, 3, 8, 12, 4, 9]], ["FSP", 3, 0, 1, 3], ["FSP", 3, 4, 2, 3], ["RE", 3, [0, 4, 1, 5, 2, 6, 3, 7]], ["CA", 2, 3, 5], ["CHR", 1, "shared", [2]], ["CA", 2, 3, 6], ["CHR", 0, "shared", [3]], ["CA", 1, 4, 6], ["FU", 5, [0, 1]], ["AN", 5, 0, 5], ["FU", 5, [1, 2]], ["AN", 5, 1, 4], ["FU", 5, [2, 3]], ["AN", 5, 2, 6], ["FU", 3, [0, 1]], ["SP", 3, 0, 576, [1], 1], ["AN", 3, 1, 2], ["FFSP", 3, 0, [2, 1], 1, 1], ["AN", 3, 1, 6], ["FU", 1, [0, 1]], ["SP", 1, 0, 192, [12], 1], ["AN", 1, 1, 2], ["FFSP", 1, 0, [2, 1], 1, 1], ["AN", 1, 1, 6], ["PR", 4, 0, "auto_unroll_max_step$16"]]]], "r": [[2.31817e-05, 2.3182e-05, 2.31812e-05, 2.31815e-05, 2.31844e-05, 2.31877e-05, 2.3182e-05, 2.31844e-05, 2.31816e-05, 2.31795e-05, 2.31853e-05, 2.31845e-05, 2.31831e-05, 2.31844e-05, 2.31832e-05, 2.31824e-05, 2.31848e-05, 2.31836e-05, 2.31862e-05, 2.31818e-05], 0, 364.484, 1647787135], "v": "v0.6"}
{"i": [["[\"pointwise_conv2d\", 56, 56, 24, 144]", "cuda -keys=cuda,gpu -max_num_threads=1024 -model=unknown -thread_warp_size=32", [-1, 16, 64, 49152, 2147483647, 1024, 8, 32], "", 0, []], [[], [["CHW", 2, "local"], ["SP", 2, 0, 3136, [2, 28, 7, 1], 1], ["SP", 2, 5, 144, [2, 3, 1, 12], 1], ["SP", 2, 10, 24, [1, 8], 1], ["RE", 2, [0, 5, 1, 6, 2, 7, 10, 11, 3, 8, 12, 4, 9]], ["FSP", 3, 0, 1, 3], ["FSP", 3, 4, 2, 3], ["RE", 3, [0, 4, 1, 5, 2, 6, 3, 7]], ["CA", 2, 3, 5], ["CHR", 1, "shared", [2]], ["CA", 2, 3, 6], ["CHR", 0, "shared", [3]], ["CA", 1, 4, 6], ["FU", 5, [0, 1]], ["AN", 5, 0, 5], ["FU", 5, [1, 2]], ["AN", 5, 1, 4], ["FU", 5, [2, 3]], ["AN", 5, 2, 6], ["FU", 3, [0, 1]], ["SP", 3, 0, 12, [1], 1], ["AN", 3, 1, 2], ["FFSP", 3, 0, [2, 1], 1, 1], ["AN", 3, 1, 6], ["FU", 1, [0, 1]], ["SP", 1, 0, 7, [1], 1], ["AN", 1, 1, 2], ["FFSP", 1, 0, [2, 1], 1, 1], ["AN", 1, 1, 6], ["PR", 4, 0, "auto_unroll_max_step$1024"]]]], "r": [[6.16336e-05, 6.1643e-05, 6.16366e-05, 6.16448e-05, 6.16434e-05, 6.16444e-05, 6.16388e-05, 6.16469e-05, 6.16352e-05, 6.16379e-05, 6.16474e-05, 6.16346e-05, 6.16447e-05, 6.16464e-05, 6.16396e-05, 6.16347e-05, 6.16401e-05, 6.16374e-05, 6.16365e-05, 6.16392e-05], 0, 367.143, 1647787145], "v": "v0.6"}
{"i": [["[\"pointwise_conv2d\", 56, 56, 24, 144]", "cuda -keys=cuda,gpu -max_num_threads=1024 -model=unknown -thread_warp_size=32", [-1, 16, 64, 49152, 2147483647, 1024, 8, 32], "", 0, []], [[], [["CHW", 2, "local"], ["SP", 2, 0, 3136, [1, 7, 8, 8], 1], ["SP", 2, 5, 144, [4, 12, 1, 1], 1], ["SP", 2, 10, 24, [1, 12], 1], ["RE", 2, [0, 5, 1, 6, 2, 7, 10, 11, 3, 8, 12, 4, 9]], ["FSP", 3, 0, 1, 3], ["FSP", 3, 4, 2, 3], ["RE", 3, [0, 4, 1, 5, 2, 6, 3, 7]], ["CA", 2, 3, 5], ["CHR", 1, "shared", [2]], ["CA", 2, 3, 6], ["CHR", 0, "shared", [3]], ["CA", 1, 4, 6], ["FU", 5, [0, 1]], ["AN", 5, 0, 5], ["FU", 5, [1, 2]], ["AN", 5, 1, 4], ["FU", 5, [2, 3]], ["AN", 5, 2, 6], ["FU", 3, [0, 1]], ["SP", 3, 0, 8, [4], 1], ["AN", 3, 1, 2], ["FFSP", 3, 0, [2, 1], 1, 1], ["AN", 3, 1, 6], ["FU", 1, [0, 1]], ["SP", 1, 0, 512, [1], 1], ["AN", 1, 1, 2], ["FFSP", 1, 0, [2, 1], 1, 1], ["AN", 1, 1, 6], ["PR", 4, 0, "auto_unroll_max_step$16"]]]], "r": [[3.25151e-05, 3.25154e-05, 3.25155e-05, 3.25139e-05, 3.25162e-05, 3.25141e-05, 3.25144e-05, 3.25145e-05, 3.25131e-05, 3.25121e-05, 3.25118e-05, 3.25136e-05, 3.25139e-05, 3.25136e-05, 3.25141e-05, 3.25123e-05, 3.25133e-05, 3.25113e-05, 3.25138e-05, 3.25121e-05], 0, 365.844, 1647787155], "v": "v0.6"}
{"i": [["[\"pointwise_conv2d\", 56, 56, 24, 144]", "cuda -keys=cuda,gpu -max_num_threads=1024 -model=unknown -thread_warp_size=32", [-1, 16, 64, 49152, 2147483647, 1024, 8, 32], "", 0, []], [[], [["CHW", 2, "local"], ["SP", 2, 0, 3136, [7, 8, 1, 4], 1], ["SP", 2, 5, 144, [1, 6, 1, 1], 1], ["SP", 2, 10, 24, [4, 1], 1], ["RE", 2, [0, 5, 1, 6, 2, 7, 10, 11, 3, 8, 12, 4, 9]], ["FSP", 3, 0, 1, 3], ["FSP", 3, 4, 2, 3], ["RE", 3, [0, 4, 1, 5, 2, 6, 3, 7]], ["CA", 2, 3, 5], ["CHR", 1, "shared", [2]], ["CA", 2, 3, 6], ["CHR", 0, "shared", [3]], ["CA", 1, 4, 6], ["FU", 5, [0, 1]], ["AN", 5, 0, 5], ["FU", 5, [1, 2]], ["AN", 5, 1, 4], ["FU", 5, [2, 3]], ["AN", 5, 2, 6], ["FU", 3, [0, 1]], ["SP", 3, 0, 8, [1], 1], ["AN", 3, 1, 2], ["FFSP", 3, 0, [2, 1], 1, 1], ["AN", 3, 1, 6], ["FU", 1, [0, 1]], ["SP", 1, 0, 16, [1], 1], ["AN", 1, 1, 2], ["FFSP", 1, 0, [2, 1], 1, 1], ["AN", 1, 1, 6], ["PR", 4, 0, "auto_unroll_max_step$1024"]]]], "r": [[1.11282e-05, 1.11283e-05, 1.11281e-05, 1.11277e-05, 1.1129e-05, 1.11275e-05, 1.11268e-05, 1.11278e-05, 1.11282e-05, 1.11313e-05, 1.1133e-05, 1.1134e-05, 1.11353e-05, 1.11353e-05, 1.11336e-05, 1.11343e-05, 1.11323e-05, 1.11339e-05, 1.11333e-05, 1.11321e-05], 0, 365.506, 1647787163], "v": "v0.6"}
{"i": [["[\"pointwise_conv2d\", 56, 56, 24, 144]", "cuda -keys=cuda,gpu -max_num_threads=1024 -model=unknown -thread_warp_size=32", [-1, 16, 64, 49152, 2147483647, 1024, 8, 32], "", 0, []], [[], [["CHW", 2, "local"], ["SP", 2, 0, 3136, [2, 56, 1, 2], 1], ["SP", 2, 5, 144, [2, 6, 6, 2], 1], ["SP", 2, 10, 24, [3, 4], 1], ["RE", 2, [0, 5, 1, 6, 2, 7, 10, 11, 3, 8, 12, 4, 9]], ["FSP", 3, 0, 1, 3], ["FSP", 3, 4, 2, 3], ["RE", 3, [0, 4, 1, 5, 2, 6, 3, 7]], ["CA", 2, 3, 5], ["CHR", 1, "shared", [2]], ["CA", 2, 3, 6], ["CHR", 0, "shared", [3]], ["CA", 1, 4, 6], ["FU", 5, [0, 1]], ["AN", 5, 0, 5], ["FU", 5, [1, 2]], ["AN", 5, 1, 4], ["FU", 5, [2, 3]], ["AN", 5, 2, 6], ["FU", 3, [0, 1]], ["SP", 3, 0, 144, [1], 1], ["AN", 3, 1, 2], ["FFSP", 3, 0, [2, 1], 1, 1], ["AN", 3, 1, 6], ["FU", 1, [0, 1]], ["SP", 1, 0, 24, [4], 1], ["AN", 1, 1, 2], ["FFSP", 1, 0, [2, 1], 1, 1], ["AN", 1, 1, 6], ["PR", 4, 0, "auto_unroll_max_step$1024"]]]], "r": [[5.1268e-05, 5.12689e-05, 5.127e-05, 5.12677e-05, 5.12663e-05, 5.12656e-05, 5.12676e-05, 5.12699e-05, 5.12684e-05, 5.12682e-05, 5.12703e-05, 5.12696e-05, 5.12713e-05, 5.12693e-05, 5.12695e-05, 5.1267e-05, 5.12621e-05, 5.12685e-05, 5.12682e-05, 5.1269e-05], 0, 364.944, 1647787173], "v": "v0.6"}
