python/models/efficientnet/kernel_configs/efficient_swish_shortcut_add_1_14_14_240.log
{"i": [["[\"shortcut_add\", 1, 14, 14, 240]", "cuda -keys=cuda,gpu -max_num_threads=1024 -model=unknown -thread_warp_size=32", [-1, 16, 64, 49152, 2147483647, 1024, 8, 32], "", 0, []], [[], [["FU", 2, [0, 1, 2, 3]], ["SP", 2, 0, 47040, [1], 1], ["AN", 2, 0, 5], ["AN", 2, 1, 6]]]], "r": [[3.74942e-05, 3.75007e-05, 3.74898e-05], 0, 3.71236, 1681132965], "v": "v0.6"}
{"i": [["[\"shortcut_add\", 1, 14, 14, 240]", "cuda -keys=cuda,gpu -max_num_threads=1024 -model=unknown -thread_warp_size=32", [-1, 16, 64, 49152, 2147483647, 1024, 8, 32], "", 0, []], [[], [["FU", 2, [0, 1, 2, 3]], ["SP", 2, 0, 47040, [21], 1], ["AN", 2, 0, 5], ["AN", 2, 1, 6]]]], "r": [[4.33392e-06, 4.34367e-06, 4.34603e-06], 0, 2.96097, 1681132964], "v": "v0.6"}
{"i": [["[\"shortcut_add\", 1, 14, 14, 240]", "cuda -keys=cuda,gpu -max_num_threads=1024 -model=unknown -thread_warp_size=32", [-1, 16, 64, 49152, 2147483647, 1024, 8, 32], "", 0, []], [[], [["FU", 2, [0, 1, 2, 3]], ["SP", 2, 0, 47040, [40], 1], ["AN", 2, 0, 5], ["AN", 2, 1, 6]]]], "r": [[3.48541e-06, 3.48283e-06, 3.48176e-06], 0, 1.06317, 1681132962], "v": "v0.6"}
{"i": [["[\"shortcut_add\", 1, 14, 14, 240]", "cuda -keys=cuda,gpu -max_num_threads=1024 -model=unknown -thread_warp_size=32", [-1, 16, 64, 49152, 2147483647, 1024, 8, 32], "", 0, []], [[], [["FU", 2, [0, 1, 2, 3]], ["SP", 2, 0, 47040, [2], 1], ["AN", 2, 0, 5], ["AN", 2, 1, 6]]]], "r": [[2.01389e-05, 2.01394e-05, 2.01396e-05], 0, 0.684536, 1681132962], "v": "v0.6"}
{"i": [["[\"shortcut_add\", 1, 14, 14, 240]", "cuda -keys=cuda,gpu -max_num_threads=1024 -model=unknown -thread_warp_size=32", [-1, 16, 64, 49152, 2147483647, 1024, 8, 32], "", 0, []], [[], [["FU", 2, [0, 1, 2, 3]], ["SP", 2, 0, 47040, [20], 1], ["AN", 2, 0, 5], ["AN", 2, 1, 6]]]], "r": [[4.3935e-06, 4.39726e-06, 4.39799e-06], 0, 3.24809, 1681132965], "v": "v0.6"}
{"i": [["[\"shortcut_add\", 1, 14, 14, 240]", "cuda -keys=cuda,gpu -max_num_threads=1024 -model=unknown -thread_warp_size=32", [-1, 16, 64, 49152, 2147483647, 1024, 8, 32], "", 0, []], [[], [["FU", 2, [0, 1, 2, 3]], ["SP", 2, 0, 47040, [60], 1], ["AN", 2, 0, 5], ["AN", 2, 1, 6]]]], "r": [[3.57807e-06, 3.60111e-06, 3.58028e-06], 0, 1.82463, 1681132963], "v": "v0.6"}
{"i": [["[\"shortcut_add\", 1, 14, 14, 240]", "cuda -keys=cuda,gpu -max_num_threads=1024 -model=unknown -thread_warp_size=32", [-1, 16, 64, 49152, 2147483647, 1024, 8, 32], "", 0, []], [[], [["FU", 2, [0, 1, 2, 3]], ["SP", 2, 0, 47040, [24], 1], ["AN", 2, 0, 5], ["AN", 2, 1, 6]]]], "r": [[4.13661e-06, 4.13803e-06, 4.13878e-06], 0, 2.58192, 1681132964], "v": "v0.6"}
{"i": [["[\"shortcut_add\", 1, 14, 14, 240]", "cuda -keys=cuda,gpu -max_num_threads=1024 -model=unknown -thread_warp_size=32", [-1, 16, 64, 49152, 2147483647, 1024, 8, 32], "", 0, []], [[], [["FU", 2, [0, 1, 2, 3]], ["SP", 2, 0, 47040, [10], 1], ["AN", 2, 0, 5], ["AN", 2, 1, 6]]]], "r": [[6.12514e-06, 6.1264e-06, 6.13218e-06], 0, 2.17338, 1681132964], "v": "v0.6"}
{"i": [["[\"shortcut_add\", 1, 14, 14, 240]", "cuda -keys=cuda,gpu -max_num_threads=1024 -model=unknown -thread_warp_size=32", [-1, 16, 64, 49152, 2147483647, 1024, 8, 32], "", 0, []], [[], [["FU", 2, [0, 1, 2, 3]], ["SP", 2, 0, 47040, [64], 1], ["AN", 2, 0, 5], ["AN", 2, 1, 6]]]], "r": [[3.35543e-06, 3.35454e-06, 3.3535e-06], 0, 4.05738, 1681132966], "v": "v0.6"}
{"i": [["[\"shortcut_add\", 1, 14, 14, 240]", "cuda -keys=cuda,gpu -max_num_threads=1024 -model=unknown -thread_warp_size=32", [-1, 16, 64, 49152, 2147483647, 1024, 8, 32], "", 0, []], [[], [["FU", 2, [0, 1, 2, 3]], ["SP", 2, 0, 47040, [49], 1], ["AN", 2, 0, 5], ["AN", 2, 1, 6]]]], "r": [[4.11559e-06, 4.1448e-06, 4.13462e-06], 0, 1.4595, 1681132963], "v": "v0.6"}
{"i": [["[\"shortcut_add\", 1, 14, 14, 240]", "cuda -keys=cuda,gpu -max_num_threads=1024 -model=unknown -thread_warp_size=32", [-1, 16, 64, 49152, 2147483647, 1024, 8, 32], "", 0, []], [[], [["FU", 2, [0, 1, 2, 3]], ["SP", 2, 0, 47040, [35], 1], ["AN", 2, 0, 5], ["AN", 2, 1, 6]]]], "r": [[3.65726e-06, 3.65579e-06, 3.65392e-06], 0, 4.79444, 1681132966], "v": "v0.6"}
{"i": [["[\"shortcut_add\", 1, 14, 14, 240]", "cuda -keys=cuda,gpu -max_num_threads=1024 -model=unknown -thread_warp_size=32", [-1, 16, 64, 49152, 2147483647, 1024, 8, 32], "", 0, []], [[], [["FU", 2, [0, 1, 2, 3]], ["SP", 2, 0, 47040, [4], 1], ["AN", 2, 0, 5], ["AN", 2, 1, 6]]]], "r": [[1.14482e-05, 1.14467e-05, 1.14431e-05], 0, 4.41067, 1681132966], "v": "v0.6"}
{"i": [["[\"shortcut_add\", 1, 14, 14, 240]", "cuda -keys=cuda,gpu -max_num_threads=1024 -model=unknown -thread_warp_size=32", [-1, 16, 64, 49152, 2147483647, 1024, 8, 32], "", 0, []], [[], [["FU", 2, [0, 1, 2, 3]], ["SP", 2, 0, 47040, [48], 1], ["AN", 2, 0, 5], ["AN", 2, 1, 6]]]], "r": [[3.44091e-06, 3.43821e-06, 3.43749e-06], 0, 5.19438, 1681132967], "v": "v0.6"}
{"i": [["[\"shortcut_add\", 1, 14, 14, 240]", "cuda -keys=cuda,gpu -max_num_threads=1024 -model=unknown -thread_warp_size=32", [-1, 16, 64, 49152, 2147483647, 1024, 8, 32], "", 0, []], [[], [["FU", 2, [0, 1, 2, 3]], ["SP", 2, 0, 47040, [30], 1], ["AN", 2, 0, 5], ["AN", 2, 1, 6]]]], "r": [[3.75405e-06, 3.75506e-06, 3.75385e-06], 0, 6.70521, 1681132968], "v": "v0.6"}
{"i": [["[\"shortcut_add\", 1, 14, 14, 240]", "cuda -keys=cuda,gpu -max_num_threads=1024 -model=unknown -thread_warp_size=32", [-1, 16, 64, 49152, 2147483647, 1024, 8, 32], "", 0, []], [[], [["FU", 2, [0, 1, 2, 3]], ["SP", 2, 0, 47040, [42], 1], ["AN", 2, 0, 5], ["AN", 2, 1, 6]]]], "r": [[3.55279e-06, 3.55216e-06, 3.55144e-06], 0, 5.56965, 1681132967], "v": "v0.6"}
{"i": [["[\"shortcut_add\", 1, 14, 14, 240]", "cuda -keys=cuda,gpu -max_num_threads=1024 -model=unknown -thread_warp_size=32", [-1, 16, 64, 49152, 2147483647, 1024, 8, 32], "", 0, []], [[], [["FU", 2, [0, 1, 2, 3]], ["SP", 2, 0, 47040, [28], 1], ["AN", 2, 0, 5], ["AN", 2, 1, 6]]]], "r": [[3.8699e-06, 3.87052e-06, 3.86884e-06], 0, 7.14429, 1681132969], "v": "v0.6"}
{"i": [["[\"shortcut_add\", 1, 14, 14, 240]", "cuda -keys=cuda,gpu -max_num_threads=1024 -model=unknown -thread_warp_size=32", [-1, 16, 64, 49152, 2147483647, 1024, 8, 32], "", 0, []], [[], [["FU", 2, [0, 1, 2, 3]], ["SP", 2, 0, 47040, [32], 1], ["AN", 2, 0, 5], ["AN", 2, 1, 6]]]], "r": [[3.67599e-06, 3.67247e-06, 3.67313e-06], 0, 6.31477, 1681132968], "v": "v0.6"}
{"i": [["[\"shortcut_add\", 1, 14, 14, 240]", "cuda -keys=cuda,gpu -max_num_threads=1024 -model=unknown -thread_warp_size=32", [-1, 16, 64, 49152, 2147483647, 1024, 8, 32], "", 0, []], [[], [["FU", 2, [0, 1, 2, 3]], ["SP", 2, 0, 47040, [5], 1], ["AN", 2, 0, 5], ["AN", 2, 1, 6]]]], "r": [[9.65948e-06, 9.65751e-06, 9.65849e-06], 0, 5.96273, 1681132968], "v": "v0.6"}
{"i": [["[\"shortcut_add\", 1, 14, 14, 240]", "cuda -keys=cuda,gpu -max_num_threads=1024 -model=unknown -thread_warp_size=32", [-1, 16, 64, 49152, 2147483647, 1024, 8, 32], "", 0, []], [[], [["FU", 2, [0, 1, 2, 3]], ["SP", 2, 0, 47040, [6], 1], ["AN", 2, 0, 5], ["AN", 2, 1, 6]]]], "r": [[8.56805e-06, 8.56836e-06, 8.56955e-06], 0, 8.58137, 1681132970], "v": "v0.6"}
{"i": [["[\"shortcut_add\", 1, 14, 14, 240]", "cuda -keys=cuda,gpu -max_num_threads=1024 -model=unknown -thread_warp_size=32", [-1, 16, 64, 49152, 2147483647, 1024, 8, 32], "", 0, []], [[], [["FU", 2, [0, 1, 2, 3]], ["SP", 2, 0, 47040, [16], 1], ["AN", 2, 0, 5], ["AN", 2, 1, 6]]]], "r": [[4.96939e-06, 4.9704e-06, 4.97468e-06], 0, 7.85335, 1681132969], "v": "v0.6"}
{"i": [["[\"shortcut_add\", 1, 14, 14, 240]", "cuda -keys=cuda,gpu -max_num_threads=1024 -model=unknown -thread_warp_size=32", [-1, 16, 64, 49152, 2147483647, 1024, 8, 32], "", 0, []], [[], [["FU", 2, [0, 1, 2, 3]], ["SP", 2, 0, 47040, [7], 1], ["AN", 2, 0, 5], ["AN", 2, 1, 6]]]], "r": [[7.65114e-06, 7.65845e-06, 7.65128e-06], 0, 9.69782, 1681132971], "v": "v0.6"}
{"i": [["[\"shortcut_add\", 1, 14, 14, 240]", "cuda -keys=cuda,gpu -max_num_threads=1024 -model=unknown -thread_warp_size=32", [-1, 16, 64, 49152, 2147483647, 1024, 8, 32], "", 0, []], [[], [["FU", 2, [0, 1, 2, 3]], ["SP", 2, 0, 47040, [15], 1], ["AN", 2, 0, 5], ["AN", 2, 1, 6]]]], "r": [[4.91503e-06, 4.91492e-06, 4.91646e-06], 0, 7.46575, 1681132969], "v": "v0.6"}
{"i": [["[\"shortcut_add\", 1, 14, 14, 240]", "cuda -keys=cuda,gpu -max_num_threads=1024 -model=unknown -thread_warp_size=32", [-1, 16, 64, 49152, 2147483647, 1024, 8, 32], "", 0, []], [[], [["FU", 2, [0, 1, 2, 3]], ["SP", 2, 0, 47040, [3], 1], ["AN", 2, 0, 5], ["AN", 2, 1, 6]]]], "r": [[1.43293e-05, 1.43285e-05, 1.43281e-05], 0, 8.92638, 1681132971], "v": "v0.6"}
{"i": [["[\"shortcut_add\", 1, 14, 14, 240]", "cuda -keys=cuda,gpu -max_num_threads=1024 -model=unknown -thread_warp_size=32", [-1, 16, 64, 49152, 2147483647, 1024, 8, 32], "", 0, []], [[], [["FU", 2, [0, 1, 2, 3]], ["SP", 2, 0, 47040, [8], 1], ["AN", 2, 0, 5], ["AN", 2, 1, 6]]]], "r": [[7.03704e-06, 7.03555e-06, 7.0411e-06], 0, 8.23823, 1681132970], "v": "v0.6"}
{"i": [["[\"shortcut_add\", 1, 14, 14, 240]", "cuda -keys=cuda,gpu -max_num_threads=1024 -model=unknown -thread_warp_size=32", [-1, 16, 64, 49152, 2147483647, 1024, 8, 32], "", 0, []], [[], [["FU", 2, [0, 1, 2, 3]], ["SP", 2, 0, 47040, [14], 1], ["AN", 2, 0, 5], ["AN", 2, 1, 6]]]], "r": [[5.20676e-06, 5.21077e-06, 5.21242e-06], 0, 9.32516, 1681132971], "v": "v0.6"}
{"i": [["[\"shortcut_add\", 1, 14, 14, 240]", "cuda -keys=cuda,gpu -max_num_threads=1024 -model=unknown -thread_warp_size=32", [-1, 16, 64, 49152, 2147483647, 1024, 8, 32], "", 0, []], [[], [["FU", 2, [0, 1, 2, 3]], ["SP", 2, 0, 47040, [56], 1], ["AN", 2, 0, 5], ["AN", 2, 1, 6]]]], "r": [[3.52217e-06, 3.52149e-06, 3.52101e-06], 0, 10.4023, 1681132972], "v": "v0.6"}
{"i": [["[\"shortcut_add\", 1, 14, 14, 240]", "cuda -keys=cuda,gpu -max_num_threads=1024 -model=unknown -thread_warp_size=32", [-1, 16, 64, 49152, 2147483647, 1024, 8, 32], "", 0, []], [[], [["FU", 2, [0, 1, 2, 3]], ["SP", 2, 0, 47040, [12], 1], ["AN", 2, 0, 5], ["AN", 2, 1, 6]]]], "r": [[5.71757e-06, 5.70873e-06, 5.72257e-06], 0, 10.0292, 1681132972], "v": "v0.6"}
