python/models/efficientnet/kernel_configs/efficient_se_module_mul_1152_1.log
{"i": [["[\"se_module_mul\", 1152, 1]", "cuda -keys=cuda,gpu -max_num_threads=1024 -model=unknown -thread_warp_size=32", [-1, 16, 64, 49152, 2147483647, 1024, 8, 32], "", 0, []], [[], [["FU", 2, [0, 1]], ["SP", 2, 0, 1152, [2], 1], ["AN", 2, 0, 5], ["AN", 2, 1, 6]]]], "r": [[3.19202e-06, 3.19942e-06, 3.19988e-06], 0, 2.56086, 1681270397], "v": "v0.6"}
{"i": [["[\"se_module_mul\", 1152, 1]", "cuda -keys=cuda,gpu -max_num_threads=1024 -model=unknown -thread_warp_size=32", [-1, 16, 64, 49152, 2147483647, 1024, 8, 32], "", 0, []], [[], [["FU", 2, [0, 1]], ["SP", 2, 0, 1152, [32], 1], ["AN", 2, 0, 5], ["AN", 2, 1, 6]]]], "r": [[2.837e-06, 2.84441e-06, 2.81638e-06], 0, 2.21206, 1681270397], "v": "v0.6"}
{"i": [["[\"se_module_mul\", 1152, 1]", "cuda -keys=cuda,gpu -max_num_threads=1024 -model=unknown -thread_warp_size=32", [-1, 16, 64, 49152, 2147483647, 1024, 8, 32], "", 0, []], [[], [["FU", 2, [0, 1]], ["SP", 2, 0, 1152, [6], 1], ["AN", 2, 0, 5], ["AN", 2, 1, 6]]]], "r": [[2.83584e-06, 2.87003e-06, 2.85813e-06], 0, 3.34329, 1681270398], "v": "v0.6"}
{"i": [["[\"se_module_mul\", 1152, 1]", "cuda -keys=cuda,gpu -max_num_threads=1024 -model=unknown -thread_warp_size=32", [-1, 16, 64, 49152, 2147483647, 1024, 8, 32], "", 0, []], [[], [["FU", 2, [0, 1]], ["SP", 2, 0, 1152, [8], 1], ["AN", 2, 0, 5], ["AN", 2, 1, 6]]]], "r": [[3.04531e-06, 2.9977e-06, 2.95676e-06], 0, 1.0385, 1681270395], "v": "v0.6"}
{"i": [["[\"se_module_mul\", 1152, 1]", "cuda -keys=cuda,gpu -max_num_threads=1024 -model=unknown -thread_warp_size=32", [-1, 16, 64, 49152, 2147483647, 1024, 8, 32], "", 0, []], [[], [["FU", 2, [0, 1]], ["SP", 2, 0, 1152, [9], 1], ["AN", 2, 0, 5], ["AN", 2, 1, 6]]]], "r": [[2.93099e-06, 2.9333e-06, 2.89396e-06], 0, 0.689577, 1681270395], "v": "v0.6"}
{"i": [["[\"se_module_mul\", 1152, 1]", "cuda -keys=cuda,gpu -max_num_threads=1024 -model=unknown -thread_warp_size=32", [-1, 16, 64, 49152, 2147483647, 1024, 8, 32], "", 0, []], [[], [["FU", 2, [0, 1]], ["SP", 2, 0, 1152, [1], 1], ["AN", 2, 0, 5], ["AN", 2, 1, 6]]]], "r": [[3.46362e-06, 3.46275e-06, 3.46397e-06], 0, 1.39754, 1681270396], "v": "v0.6"}
{"i": [["[\"se_module_mul\", 1152, 1]", "cuda -keys=cuda,gpu -max_num_threads=1024 -model=unknown -thread_warp_size=32", [-1, 16, 64, 49152, 2147483647, 1024, 8, 32], "", 0, []], [[], [["FU", 2, [0, 1]], ["SP", 2, 0, 1152, [36], 1], ["AN", 2, 0, 5], ["AN", 2, 1, 6]]]], "r": [[2.85997e-06, 2.89523e-06, 2.85427e-06], 0, 2.98965, 1681270397], "v": "v0.6"}
{"i": [["[\"se_module_mul\", 1152, 1]", "cuda -keys=cuda,gpu -max_num_threads=1024 -model=unknown -thread_warp_size=32", [-1, 16, 64, 49152, 2147483647, 1024, 8, 32], "", 0, []], [[], [["FU", 2, [0, 1]], ["SP", 2, 0, 1152, [12], 1], ["AN", 2, 0, 5], ["AN", 2, 1, 6]]]], "r": [[2.87283e-06, 2.83216e-06, 2.85027e-06], 0, 1.85091, 1681270396], "v": "v0.6"}
{"i": [["[\"se_module_mul\", 1152, 1]", "cuda -keys=cuda,gpu -max_num_threads=1024 -model=unknown -thread_warp_size=32", [-1, 16, 64, 49152, 2147483647, 1024, 8, 32], "", 0, []], [[], [["FU", 2, [0, 1]], ["SP", 2, 0, 1152, [16], 1], ["AN", 2, 0, 5], ["AN", 2, 1, 6]]]], "r": [[2.95158e-06, 2.96142e-06, 2.94561e-06], 0, 4.90467, 1681270399], "v": "v0.6"}
{"i": [["[\"se_module_mul\", 1152, 1]", "cuda -keys=cuda,gpu -max_num_threads=1024 -model=unknown -thread_warp_size=32", [-1, 16, 64, 49152, 2147483647, 1024, 8, 32], "", 0, []], [[], [["FU", 2, [0, 1]], ["SP", 2, 0, 1152, [64], 1], ["AN", 2, 0, 5], ["AN", 2, 1, 6]]]], "r": [[2.84828e-06, 2.83318e-06, 2.79842e-06], 0, 3.71617, 1681270398], "v": "v0.6"}
{"i": [["[\"se_module_mul\", 1152, 1]", "cuda -keys=cuda,gpu -max_num_threads=1024 -model=unknown -thread_warp_size=32", [-1, 16, 64, 49152, 2147483647, 1024, 8, 32], "", 0, []], [[], [["FU", 2, [0, 1]], ["SP", 2, 0, 1152, [48], 1], ["AN", 2, 0, 5], ["AN", 2, 1, 6]]]], "r": [[4.3767e-06, 4.36189e-06, 4.32083e-06], 0, 4.1226, 1681270399], "v": "v0.6"}
{"i": [["[\"se_module_mul\", 1152, 1]", "cuda -keys=cuda,gpu -max_num_threads=1024 -model=unknown -thread_warp_size=32", [-1, 16, 64, 49152, 2147483647, 1024, 8, 32], "", 0, []], [[], [["FU", 2, [0, 1]], ["SP", 2, 0, 1152, [18], 1], ["AN", 2, 0, 5], ["AN", 2, 1, 6]]]], "r": [[2.88772e-06, 2.87365e-06, 2.86315e-06], 0, 5.65052, 1681270400], "v": "v0.6"}
{"i": [["[\"se_module_mul\", 1152, 1]", "cuda -keys=cuda,gpu -max_num_threads=1024 -model=unknown -thread_warp_size=32", [-1, 16, 64, 49152, 2147483647, 1024, 8, 32], "", 0, []], [[], [["FU", 2, [0, 1]], ["SP", 2, 0, 1152, [4], 1], ["AN", 2, 0, 5], ["AN", 2, 1, 6]]]], "r": [[2.84084e-06, 2.87602e-06, 2.83009e-06], 0, 4.51699, 1681270399], "v": "v0.6"}
{"i": [["[\"se_module_mul\", 1152, 1]", "cuda -keys=cuda,gpu -max_num_threads=1024 -model=unknown -thread_warp_size=32", [-1, 16, 64, 49152, 2147483647, 1024, 8, 32], "", 0, []], [[], [["FU", 2, [0, 1]], ["SP", 2, 0, 1152, [24], 1], ["AN", 2, 0, 5], ["AN", 2, 1, 6]]]], "r": [[2.88007e-06, 2.91654e-06, 2.88715e-06], 0, 5.28112, 1681270400], "v": "v0.6"}
{"i": [["[\"se_module_mul\", 1152, 1]", "cuda -keys=cuda,gpu -max_num_threads=1024 -model=unknown -thread_warp_size=32", [-1, 16, 64, 49152, 2147483647, 1024, 8, 32], "", 0, []], [[], [["FU", 2, [0, 1]], ["SP", 2, 0, 1152, [3], 1], ["AN", 2, 0, 5], ["AN", 2, 1, 6]]]], "r": [[2.88963e-06, 2.89066e-06, 2.89299e-06], 0, 6.02039, 1681270401], "v": "v0.6"}
