python/models/efficientnet/kernel_configs/efficient_fused_pointwise_conv_bias_add_sigmoid_480_20_1.log
{"i": [["[\"fused_pointwise_conv_bias_add_sigmoid\", 480, 20, 1]", "cuda -keys=cuda,gpu -max_num_threads=1024 -model=unknown -thread_warp_size=32", [-1, 16, 64, 49152, 2147483647, 1024, 8, 32], "", 0, []], [[], [["CI", 4], ["SP", 2, 0, 1, [1, 1, 1, 1], 1], ["SP", 2, 5, 20, [2, 10, 1, 1], 1], ["SP", 2, 10, 480, [60, 8], 1], ["RE", 2, [0, 5, 1, 6, 2, 7, 10, 11, 3, 8, 12, 4, 9]], ["FSP", 5, 0, 1, 3], ["FSP", 5, 4, 2, 3], ["RE", 5, [0, 4, 1, 5, 2, 6, 3, 7]], ["CA", 2, 5, 5], ["CHR", 1, "shared", [2]], ["CA", 2, 3, 6], ["CHR", 0, "shared", [3]], ["CA", 1, 4, 6], ["FU", 7, [0, 1]], ["AN", 7, 0, 5], ["FU", 7, [1, 2]], ["AN", 7, 1, 4], ["FU", 7, [2, 3]], ["AN", 7, 2, 6], ["FU", 3, [0, 1]], ["SP", 3, 0, 480, [1], 1], ["AN", 3, 1, 2], ["FFSP", 3, 0, [2, 1], 1, 1], ["AN", 3, 1, 6], ["FU", 1, [0, 1]], ["SP", 1, 0, 480, [1], 1], ["AN", 1, 1, 2], ["FFSP", 1, 0, [2, 1], 1, 1], ["AN", 1, 1, 6], ["PR", 4, 0, "auto_unroll_max_step$1024"]]]], "r": [[2.15161e-05, 2.15247e-05, 2.15196e-05], 0, 12.0087, 1662035896], "v": "v0.6"}
{"i": [["[\"fused_pointwise_conv_bias_add_sigmoid\", 480, 20, 1]", "cuda -keys=cuda,gpu -max_num_threads=1024 -model=unknown -thread_warp_size=32", [-1, 16, 64, 49152, 2147483647, 1024, 8, 32], "", 0, []], [[], [["CI", 4], ["SP", 2, 0, 1, [1, 1, 1, 1], 1], ["SP", 2, 5, 20, [1, 2, 10, 1], 1], ["SP", 2, 10, 480, [5, 2], 1], ["RE", 2, [0, 5, 1, 6, 2, 7, 10, 11, 3, 8, 12, 4, 9]], ["FSP", 5, 0, 1, 3], ["FSP", 5, 4, 2, 3], ["RE", 5, [0, 4, 1, 5, 2, 6, 3, 7]], ["CA", 2, 5, 5], ["CHR", 1, "shared", [2]], ["CA", 2, 3, 6], ["CHR", 0, "shared", [3]], ["CA", 1, 4, 6], ["FU", 7, [0, 1]], ["AN", 7, 0, 5], ["FU", 7, [1, 2]], ["AN", 7, 1, 4], ["FU", 7, [2, 3]], ["AN", 7, 2, 6], ["FU", 3, [0, 1]], ["SP", 3, 0, 1200, [2], 1], ["AN", 3, 1, 2], ["FFSP", 3, 0, [2, 1], 1, 1], ["AN", 3, 1, 6], ["FU", 1, [0, 1]], ["SP", 1, 0, 120, [1], 1], ["AN", 1, 1, 2], ["FFSP", 1, 0, [2, 1], 1, 1], ["AN", 1, 1, 6], ["PR", 4, 0, "auto_unroll_max_step$64"]]]], "r": [[9.33405e-05, 9.33326e-05, 9.33369e-05], 0, 5.04179, 1662035893], "v": "v0.6"}
{"i": [["[\"fused_pointwise_conv_bias_add_sigmoid\", 480, 20, 1]", "cuda -keys=cuda,gpu -max_num_threads=1024 -model=unknown -thread_warp_size=32", [-1, 16, 64, 49152, 2147483647, 1024, 8, 32], "", 0, []], [[], [["CI", 4], ["SP", 2, 0, 1, [1, 1, 1, 1], 1], ["SP", 2, 5, 20, [2, 10, 1, 1], 1], ["SP", 2, 10, 480, [80, 2], 1], ["RE", 2, [0, 5, 1, 6, 2, 7, 10, 11, 3, 8, 12, 4, 9]], ["FSP", 5, 0, 1, 3], ["FSP", 5, 4, 2, 3], ["RE", 5, [0, 4, 1, 5, 2, 6, 3, 7]], ["CA", 2, 5, 5], ["CHR", 1, "shared", [2]], ["CA", 2, 3, 6], ["CHR", 0, "shared", [3]], ["CA", 1, 4, 6], ["FU", 7, [0, 1]], ["AN", 7, 0, 5], ["FU", 7, [1, 2]], ["AN", 7, 1, 4], ["FU", 7, [2, 3]], ["AN", 7, 2, 6], ["FU", 3, [0, 1]], ["SP", 3, 0, 160, [1], 1], ["AN", 3, 1, 2], ["FFSP", 3, 0, [2, 1], 1, 1], ["AN", 3, 1, 6], ["FU", 1, [0, 1]], ["SP", 1, 0, 160, [1], 1], ["AN", 1, 1, 2], ["FFSP", 1, 0, [2, 1], 1, 1], ["AN", 1, 1, 6], ["PR", 4, 0, "auto_unroll_max_step$16"]]]], "r": [[2.55386e-05, 2.55534e-05, 2.55538e-05], 0, 2.61837, 1662035890], "v": "v0.6"}
{"i": [["[\"fused_pointwise_conv_bias_add_sigmoid\", 480, 20, 1]", "cuda -keys=cuda,gpu -max_num_threads=1024 -model=unknown -thread_warp_size=32", [-1, 16, 64, 49152, 2147483647, 1024, 8, 32], "", 0, []], [[], [["CI", 4], ["SP", 2, 0, 1, [1, 1, 1, 1], 1], ["SP", 2, 5, 20, [2, 1, 10, 1], 1], ["SP", 2, 10, 480, [30, 8], 1], ["RE", 2, [0, 5, 1, 6, 2, 7, 10, 11, 3, 8, 12, 4, 9]], ["FSP", 5, 0, 1, 3], ["FSP", 5, 4, 2, 3], ["RE", 5, [0, 4, 1, 5, 2, 6, 3, 7]], ["CA", 2, 5, 5], ["CHR", 1, "shared", [2]], ["CA", 2, 3, 6], ["CHR", 0, "shared", [3]], ["CA", 1, 4, 6], ["FU", 7, [0, 1]], ["AN", 7, 0, 5], ["FU", 7, [1, 2]], ["AN", 7, 1, 4], ["FU", 7, [2, 3]], ["AN", 7, 2, 6], ["FU", 3, [0, 1]], ["SP", 3, 0, 120, [1], 1], ["AN", 3, 1, 2], ["FFSP", 3, 0, [2, 1], 1, 1], ["AN", 3, 1, 6], ["FU", 1, [0, 1]], ["SP", 1, 0, 24, [1], 1], ["AN", 1, 1, 2], ["FFSP", 1, 0, [2, 1], 1, 1], ["AN", 1, 1, 6], ["PR", 4, 0, "auto_unroll_max_step$512"]]]], "r": [[0.000223594, 0.000223606, 0.000223596], 0, 2.76944, 1662035890], "v": "v0.6"}
{"i": [["[\"fused_pointwise_conv_bias_add_sigmoid\", 480, 20, 1]", "cuda -keys=cuda,gpu -max_num_threads=1024 -model=unknown -thread_warp_size=32", [-1, 16, 64, 49152, 2147483647, 1024, 8, 32], "", 0, []], [[], [["CI", 4], ["SP", 2, 0, 1, [1, 1, 1, 1], 1], ["SP", 2, 5, 20, [2, 2, 5, 1], 1], ["SP", 2, 10, 480, [10, 3], 1], ["RE", 2, [0, 5, 1, 6, 2, 7, 10, 11, 3, 8, 12, 4, 9]], ["FSP", 5, 0, 1, 3], ["FSP", 5, 4, 2, 3], ["RE", 5, [0, 4, 1, 5, 2, 6, 3, 7]], ["CA", 2, 5, 5], ["CHR", 1, "shared", [2]], ["CA", 2, 3, 6], ["CHR", 0, "shared", [3]], ["CA", 1, 4, 6], ["FU", 7, [0, 1]], ["AN", 7, 0, 5], ["FU", 7, [1, 2]], ["AN", 7, 1, 4], ["FU", 7, [2, 3]], ["AN", 7, 2, 6], ["FU", 3, [0, 1]], ["SP", 3, 0, 2400, [1], 1], ["AN", 3, 1, 2], ["FFSP", 3, 0, [2, 1], 1, 1], ["AN", 3, 1, 6], ["FU", 1, [0, 1]], ["SP", 1, 0, 480, [1], 1], ["AN", 1, 1, 2], ["FFSP", 1, 0, [2, 1], 1, 1], ["AN", 1, 1, 6], ["PR", 4, 0, "auto_unroll_max_step$0"]]]], "r": [[0.000120542, 0.000120543, 0.000120501], 0, 9.94231, 1662035898], "v": "v0.6"}
{"i": [["[\"fused_pointwise_conv_bias_add_sigmoid\", 480, 20, 1]", "cuda -keys=cuda,gpu -max_num_threads=1024 -model=unknown -thread_warp_size=32", [-1, 16, 64, 49152, 2147483647, 1024, 8, 32], "", 0, []], [[], [["CI", 4], ["SP", 2, 0, 1, [1, 1, 1, 1], 1], ["SP", 2, 5, 20, [5, 1, 1, 2], 1], ["SP", 2, 10, 480, [2, 16], 1], ["RE", 2, [0, 5, 1, 6, 2, 7, 10, 11, 3, 8, 12, 4, 9]], ["FSP", 5, 0, 1, 3], ["FSP", 5, 4, 2, 3], ["RE", 5, [0, 4, 1, 5, 2, 6, 3, 7]], ["CA", 2, 5, 5], ["CHR", 1, "shared", [2]], ["CA", 2, 3, 6], ["CHR", 0, "shared", [3]], ["CA", 1, 4, 6], ["FU", 7, [0, 1]], ["AN", 7, 0, 5], ["FU", 7, [1, 2]], ["AN", 7, 1, 4], ["FU", 7, [2, 3]], ["AN", 7, 2, 6], ["FU", 3, [0, 1]], ["SP", 3, 0, 128, [1], 1], ["AN", 3, 1, 2], ["FFSP", 3, 0, [2, 1], 1, 1], ["AN", 3, 1, 6], ["FU", 1, [0, 1]], ["SP", 1, 0, 32, [4], 1], ["AN", 1, 1, 2], ["FFSP", 1, 0, [2, 1], 1, 1], ["AN", 1, 1, 6], ["PR", 4, 0, "auto_unroll_max_step$0"]]]], "r": [[0.000204523, 0.000204534, 0.000204521], 0, 8.557, 1662035896], "v": "v0.6"}
{"i": [["[\"fused_pointwise_conv_bias_add_sigmoid\", 480, 20, 1]", "cuda -keys=cuda,gpu -max_num_threads=1024 -model=unknown -thread_warp_size=32", [-1, 16, 64, 49152, 2147483647, 1024, 8, 32], "", 0, []], [[], [["CI", 4], ["SP", 2, 0, 1, [1, 1, 1, 1], 1], ["SP", 2, 5, 20, [2, 1, 5, 1], 1], ["SP", 2, 10, 480, [15, 4], 1], ["RE", 2, [0, 5, 1, 6, 2, 7, 10, 11, 3, 8, 12, 4, 9]], ["FSP", 5, 0, 1, 3], ["FSP", 5, 4, 2, 3], ["RE", 5, [0, 4, 1, 5, 2, 6, 3, 7]], ["CA", 2, 5, 5], ["CHR", 1, "shared", [2]], ["CA", 2, 3, 6], ["CHR", 0, "shared", [3]], ["CA", 1, 4, 6], ["FU", 7, [0, 1]], ["AN", 7, 0, 5], ["FU", 7, [1, 2]], ["AN", 7, 1, 4], ["FU", 7, [2, 3]], ["AN", 7, 2, 6], ["FU", 3, [0, 1]], ["SP", 3, 0, 300, [1], 1], ["AN", 3, 1, 2], ["FFSP", 3, 0, [2, 1], 1, 1], ["AN", 3, 1, 6], ["FU", 1, [0, 1]], ["SP", 1, 0, 60, [1], 1], ["AN", 1, 1, 2], ["FFSP", 1, 0, [2, 1], 1, 1], ["AN", 1, 1, 6], ["PR", 4, 0, "auto_unroll_max_step$512"]]]], "r": [[0.000211709, 0.000211708, 0.000211705], 0, 9.25244, 1662035897], "v": "v0.6"}
{"i": [["[\"fused_pointwise_conv_bias_add_sigmoid\", 480, 20, 1]", "cuda -keys=cuda,gpu -max_num_threads=1024 -model=unknown -thread_warp_size=32", [-1, 16, 64, 49152, 2147483647, 1024, 8, 32], "", 0, []], [[], [["CI", 4], ["SP", 2, 0, 1, [1, 1, 1, 1], 1], ["SP", 2, 5, 20, [10, 1, 1, 2], 1], ["SP", 2, 10, 480, [1, 2], 1], ["RE", 2, [0, 5, 1, 6, 2, 7, 10, 11, 3, 8, 12, 4, 9]], ["FSP", 5, 0, 1, 3], ["FSP", 5, 4, 2, 3], ["RE", 5, [0, 4, 1, 5, 2, 6, 3, 7]], ["CA", 2, 5, 5], ["CHR", 1, "shared", [2]], ["CA", 2, 3, 6], ["CHR", 0, "shared", [3]], ["CA", 1, 4, 6], ["FU", 7, [0, 1]], ["AN", 7, 0, 5], ["FU", 7, [1, 2]], ["AN", 7, 1, 4], ["FU", 7, [2, 3]], ["AN", 7, 2, 6], ["FU", 3, [0, 1]], ["SP", 3, 0, 120, [1], 1], ["AN", 3, 1, 2], ["FFSP", 3, 0, [2, 1], 1, 1], ["AN", 3, 1, 6], ["FU", 1, [0, 1]], ["SP", 1, 0, 6, [1], 1], ["AN", 1, 1, 2], ["FFSP", 1, 0, [2, 1], 1, 1], ["AN", 1, 1, 6], ["PR", 4, 0, "auto_unroll_max_step$16"]]]], "r": [[0.000377774, 0.000377798, 0.000377806], 0, 6.06394, 1662035894], "v": "v0.6"}
{"i": [["[\"fused_pointwise_conv_bias_add_sigmoid\", 480, 20, 1]", "cuda -keys=cuda,gpu -max_num_threads=1024 -model=unknown -thread_warp_size=32", [-1, 16, 64, 49152, 2147483647, 1024, 8, 32], "", 0, []], [[], [["CI", 4], ["SP", 2, 0, 1, [1, 1, 1, 1], 1], ["SP", 2, 5, 20, [1, 1, 2, 5], 1], ["SP", 2, 10, 480, [2, 4], 1], ["RE", 2, [0, 5, 1, 6, 2, 7, 10, 11, 3, 8, 12, 4, 9]], ["FSP", 5, 0, 1, 3], ["FSP", 5, 4, 2, 3], ["RE", 5, [0, 4, 1, 5, 2, 6, 3, 7]], ["CA", 2, 5, 5], ["CHR", 1, "shared", [2]], ["CA", 2, 3, 6], ["CHR", 0, "shared", [3]], ["CA", 1, 4, 6], ["FU", 7, [0, 1]], ["AN", 7, 0, 5], ["FU", 7, [1, 2]], ["AN", 7, 1, 4], ["FU", 7, [2, 3]], ["AN", 7, 2, 6], ["FU", 3, [0, 1]], ["SP", 3, 0, 240, [1], 1], ["AN", 3, 1, 2], ["FFSP", 3, 0, [2, 1], 1, 1], ["AN", 3, 1, 6], ["FU", 1, [0, 1]], ["SP", 1, 0, 24, [1], 1], ["AN", 1, 1, 2], ["FFSP", 1, 0, [2, 1], 1, 1], ["AN", 1, 1, 6], ["PR", 4, 0, "auto_unroll_max_step$0"]]]], "r": [[0.000180184, 0.000180154, 0.000180102], 0, 3.53887, 1662035891], "v": "v0.6"}
{"i": [["[\"fused_pointwise_conv_bias_add_sigmoid\", 480, 20, 1]", "cuda -keys=cuda,gpu -max_num_threads=1024 -model=unknown -thread_warp_size=32", [-1, 16, 64, 49152, 2147483647, 1024, 8, 32], "", 0, []], [[], [["CI", 4], ["SP", 2, 0, 1, [1, 1, 1, 1], 1], ["SP", 2, 5, 20, [5, 2, 1, 1], 1], ["SP", 2, 10, 480, [1, 2], 1], ["RE", 2, [0, 5, 1, 6, 2, 7, 10, 11, 3, 8, 12, 4, 9]], ["FSP", 5, 0, 1, 3], ["FSP", 5, 4, 2, 3], ["RE", 5, [0, 4, 1, 5, 2, 6, 3, 7]], ["CA", 2, 5, 5], ["CHR", 1, "shared", [2]], ["CA", 2, 3, 6], ["CHR", 0, "shared", [3]], ["CA", 1, 4, 6], ["FU", 7, [0, 1]], ["AN", 7, 0, 5], ["FU", 7, [1, 2]], ["AN", 7, 1, 4], ["FU", 7, [2, 3]], ["AN", 7, 2, 6], ["FU", 3, [0, 1]], ["SP", 3, 0, 2, [1], 1], ["AN", 3, 1, 2], ["FFSP", 3, 0, [2, 1], 1, 1], ["AN", 3, 1, 6], ["FU", 1, [0, 1]], ["SP", 1, 0, 2, [1], 1], ["AN", 1, 1, 2], ["FFSP", 1, 0, [2, 1], 1, 1], ["AN", 1, 1, 6], ["PR", 4, 0, "auto_unroll_max_step$16"]]]], "r": [[9.3058e-05, 9.30654e-05, 9.30709e-05], 0, 4.07109, 1662035892], "v": "v0.6"}
{"i": [["[\"fused_pointwise_conv_bias_add_sigmoid\", 480, 20, 1]", "cuda -keys=cuda,gpu -max_num_threads=1024 -model=unknown -thread_warp_size=32", [-1, 16, 64, 49152, 2147483647, 1024, 8, 32], "", 0, []], [[], [["CI", 4], ["SP", 2, 0, 1, [1, 1, 1, 1], 1], ["SP", 2, 5, 20, [1, 2, 1, 1], 1], ["SP", 2, 10, 480, [24, 2], 1], ["RE", 2, [0, 5, 1, 6, 2, 7, 10, 11, 3, 8, 12, 4, 9]], ["FSP", 5, 0, 1, 3], ["FSP", 5, 4, 2, 3], ["RE", 5, [0, 4, 1, 5, 2, 6, 3, 7]], ["CA", 2, 5, 5], ["CHR", 1, "shared", [2]], ["CA", 2, 3, 6], ["CHR", 0, "shared", [3]], ["CA", 1, 4, 6], ["FU", 7, [0, 1]], ["AN", 7, 0, 5], ["FU", 7, [1, 2]], ["AN", 7, 1, 4], ["FU", 7, [2, 3]], ["AN", 7, 2, 6], ["FU", 3, [0, 1]], ["SP", 3, 0, 48, [1], 1], ["AN", 3, 1, 2], ["FFSP", 3, 0, [2, 1], 1, 1], ["AN", 3, 1, 6], ["FU", 1, [0, 1]], ["SP", 1, 0, 48, [1], 1], ["AN", 1, 1, 2], ["FFSP", 1, 0, [2, 1], 1, 1], ["AN", 1, 1, 6], ["PR", 4, 0, "auto_unroll_max_step$1024"]]]], "r": [[2.1864e-05, 2.18744e-05, 2.18731e-05], 0, 3.07452, 1662035891], "v": "v0.6"}
{"i": [["[\"fused_pointwise_conv_bias_add_sigmoid\", 480, 20, 1]", "cuda -keys=cuda,gpu -max_num_threads=1024 -model=unknown -thread_warp_size=32", [-1, 16, 64, 49152, 2147483647, 1024, 8, 32], "", 0, []], [[], [["CI", 4], ["SP", 2, 0, 1, [1, 1, 1, 1], 1], ["SP", 2, 5, 20, [1, 1, 2, 5], 1], ["SP", 2, 10, 480, [2, 1], 1], ["RE", 2, [0, 5, 1, 6, 2, 7, 10, 11, 3, 8, 12, 4, 9]], ["FSP", 5, 0, 1, 3], ["FSP", 5, 4, 2, 3], ["RE", 5, [0, 4, 1, 5, 2, 6, 3, 7]], ["CA", 2, 5, 5], ["CHR", 1, "shared", [2]], ["CA", 2, 3, 6], ["CHR", 0, "shared", [3]], ["CA", 1, 4, 6], ["FU", 7, [0, 1]], ["AN", 7, 0, 5], ["FU", 7, [1, 2]], ["AN", 7, 1, 4], ["FU", 7, [2, 3]], ["AN", 7, 2, 6], ["FU", 3, [0, 1]], ["SP", 3, 0, 800, [1], 1], ["AN", 3, 1, 2], ["FFSP", 3, 0, [2, 1], 1, 1], ["AN", 3, 1, 6], ["FU", 1, [0, 1]], ["SP", 1, 0, 80, [1], 1], ["AN", 1, 1, 2], ["FFSP", 1, 0, [2, 1], 1, 1], ["AN", 1, 1, 6], ["PR", 4, 0, "auto_unroll_max_step$512"]]]], "r": [[0.000191088, 0.000191086, 0.000191082], 0, 6.54745, 1662035894], "v": "v0.6"}
{"i": [["[\"fused_pointwise_conv_bias_add_sigmoid\", 480, 20, 1]", "cuda -keys=cuda,gpu -max_num_threads=1024 -model=unknown -thread_warp_size=32", [-1, 16, 64, 49152, 2147483647, 1024, 8, 32], "", 0, []], [[], [["CI", 4], ["SP", 2, 0, 1, [1, 1, 1, 1], 1], ["SP", 2, 5, 20, [1, 10, 2, 1], 1], ["SP", 2, 10, 480, [160, 3], 1], ["RE", 2, [0, 5, 1, 6, 2, 7, 10, 11, 3, 8, 12, 4, 9]], ["FSP", 5, 0, 1, 3], ["FSP", 5, 4, 2, 3], ["RE", 5, [0, 4, 1, 5, 2, 6, 3, 7]], ["CA", 2, 5, 5], ["CHR", 1, "shared", [2]], ["CA", 2, 3, 6], ["CHR", 0, "shared", [3]], ["CA", 1, 4, 6], ["FU", 7, [0, 1]], ["AN", 7, 0, 5], ["FU", 7, [1, 2]], ["AN", 7, 1, 4], ["FU", 7, [2, 3]], ["AN", 7, 2, 6], ["FU", 3, [0, 1]], ["SP", 3, 0, 4800, [1], 1], ["AN", 3, 1, 2], ["FFSP", 3, 0, [2, 1], 1, 1], ["AN", 3, 1, 6], ["FU", 1, [0, 1]], ["SP", 1, 0, 480, [10], 1], ["AN", 1, 1, 2], ["FFSP", 1, 0, [2, 1], 1, 1], ["AN", 1, 1, 6], ["PR", 4, 0, "auto_unroll_max_step$0"]]]], "r": [[2.5552e-05, 2.55629e-05, 2.55626e-05], 0, 5.24818, 1662035893], "v": "v0.6"}
{"i": [["[\"fused_pointwise_conv_bias_add_sigmoid\", 480, 20, 1]", "cuda -keys=cuda,gpu -max_num_threads=1024 -model=unknown -thread_warp_size=32", [-1, 16, 64, 49152, 2147483647, 1024, 8, 32], "", 0, []], [[], [["CI", 4], ["SP", 2, 0, 1, [1, 1, 1, 1], 1], ["SP", 2, 5, 20, [2, 2, 1, 1], 1], ["SP", 2, 10, 480, [1, 24], 1], ["RE", 2, [0, 5, 1, 6, 2, 7, 10, 11, 3, 8, 12, 4, 9]], ["FSP", 5, 0, 1, 3], ["FSP", 5, 4, 2, 3], ["RE", 5, [0, 4, 1, 5, 2, 6, 3, 7]], ["CA", 2, 5, 5], ["CHR", 1, "shared", [2]], ["CA", 2, 3, 6], ["CHR", 0, "shared", [3]], ["CA", 1, 4, 6], ["FU", 7, [0, 1]], ["AN", 7, 0, 5], ["FU", 7, [1, 2]], ["AN", 7, 1, 4], ["FU", 7, [2, 3]], ["AN", 7, 2, 6], ["FU", 3, [0, 1]], ["SP", 3, 0, 24, [3], 1], ["AN", 3, 1, 2], ["FFSP", 3, 0, [2, 1], 1, 1], ["AN", 3, 1, 6], ["FU", 1, [0, 1]], ["SP", 1, 0, 24, [1], 1], ["AN", 1, 1, 2], ["FFSP", 1, 0, [2, 1], 1, 1], ["AN", 1, 1, 6], ["PR", 4, 0, "auto_unroll_max_step$512"]]]], "r": [[8.87922e-05, 8.87857e-05, 8.87938e-05], 0, 11.2184, 1662035899], "v": "v0.6"}
{"i": [["[\"fused_pointwise_conv_bias_add_sigmoid\", 480, 20, 1]", "cuda -keys=cuda,gpu -max_num_threads=1024 -model=unknown -thread_warp_size=32", [-1, 16, 64, 49152, 2147483647, 1024, 8, 32], "", 0, []], [[], [["CI", 4], ["SP", 2, 0, 1, [1, 1, 1, 1], 1], ["SP", 2, 5, 20, [5, 1, 1, 1], 1], ["SP", 2, 10, 480, [20, 6], 1], ["RE", 2, [0, 5, 1, 6, 2, 7, 10, 11, 3, 8, 12, 4, 9]], ["FSP", 5, 0, 1, 3], ["FSP", 5, 4, 2, 3], ["RE", 5, [0, 4, 1, 5, 2, 6, 3, 7]], ["CA", 2, 5, 5], ["CHR", 1, "shared", [2]], ["CA", 2, 3, 6], ["CHR", 0, "shared", [3]], ["CA", 1, 4, 6], ["FU", 7, [0, 1]], ["AN", 7, 0, 5], ["FU", 7, [1, 2]], ["AN", 7, 1, 4], ["FU", 7, [2, 3]], ["AN", 7, 2, 6], ["FU", 3, [0, 1]], ["SP", 3, 0, 120, [1], 1], ["AN", 3, 1, 2], ["FFSP", 3, 0, [2, 1], 1, 1], ["AN", 3, 1, 6], ["FU", 1, [0, 1]], ["SP", 1, 0, 120, [1], 1], ["AN", 1, 1, 2], ["FFSP", 1, 0, [2, 1], 1, 1], ["AN", 1, 1, 6], ["PR", 4, 0, "auto_unroll_max_step$512"]]]], "r": [[0.000167732, 0.000167725, 0.000167733], 0, 13.3981, 1662035901], "v": "v0.6"}
{"i": [["[\"fused_pointwise_conv_bias_add_sigmoid\", 480, 20, 1]", "cuda -keys=cuda,gpu -max_num_threads=1024 -model=unknown -thread_warp_size=32", [-1, 16, 64, 49152, 2147483647, 1024, 8, 32], "", 0, []], [[], [["CI", 4], ["SP", 2, 0, 1, [1, 1, 1, 1], 1], ["SP", 2, 5, 20, [1, 10, 1, 1], 1], ["SP", 2, 10, 480, [160, 1], 1], ["RE", 2, [0, 5, 1, 6, 2, 7, 10, 11, 3, 8, 12, 4, 9]], ["FSP", 5, 0, 1, 3], ["FSP", 5, 4, 2, 3], ["RE", 5, [0, 4, 1, 5, 2, 6, 3, 7]], ["CA", 2, 5, 5], ["CHR", 1, "shared", [2]], ["CA", 2, 3, 6], ["CHR", 0, "shared", [3]], ["CA", 1, 4, 6], ["FU", 7, [0, 1]], ["AN", 7, 0, 5], ["FU", 7, [1, 2]], ["AN", 7, 1, 4], ["FU", 7, [2, 3]], ["AN", 7, 2, 6], ["FU", 3, [0, 1]], ["SP", 3, 0, 160, [1], 1], ["AN", 3, 1, 2], ["FFSP", 3, 0, [2, 1], 1, 1], ["AN", 3, 1, 6], ["FU", 1, [0, 1]], ["SP", 1, 0, 160, [2], 1], ["AN", 1, 1, 2], ["FFSP", 1, 0, [2, 1], 1, 1], ["AN", 1, 1, 6], ["PR", 4, 0, "auto_unroll_max_step$0"]]]], "r": [[1.6278e-05, 1.62934e-05, 1.6284e-05], 0, 9.97752, 1662035898], "v": "v0.6"}
{"i": [["[\"fused_pointwise_conv_bias_add_sigmoid\", 480, 20, 1]", "cuda -keys=cuda,gpu -max_num_threads=1024 -model=unknown -thread_warp_size=32", [-1, 16, 64, 49152, 2147483647, 1024, 8, 32], "", 0, []], [[], [["CI", 4], ["SP", 2, 0, 1, [1, 1, 1, 1], 1], ["SP", 2, 5, 20, [1, 1, 2, 10], 1], ["SP", 2, 10, 480, [10, 4], 1], ["RE", 2, [0, 5, 1, 6, 2, 7, 10, 11, 3, 8, 12, 4, 9]], ["FSP", 5, 0, 1, 3], ["FSP", 5, 4, 2, 3], ["RE", 5, [0, 4, 1, 5, 2, 6, 3, 7]], ["CA", 2, 5, 5], ["CHR", 1, "shared", [2]], ["CA", 2, 3, 6], ["CHR", 0, "shared", [3]], ["CA", 1, 4, 6], ["FU", 7, [0, 1]], ["AN", 7, 0, 5], ["FU", 7, [1, 2]], ["AN", 7, 1, 4], ["FU", 7, [2, 3]], ["AN", 7, 2, 6], ["FU", 3, [0, 1]], ["SP", 3, 0, 800, [1], 1], ["AN", 3, 1, 2], ["FFSP", 3, 0, [2, 1], 1, 1], ["AN", 3, 1, 6], ["FU", 1, [0, 1]], ["SP", 1, 0, 40, [1], 1], ["AN", 1, 1, 2], ["FFSP", 1, 0, [2, 1], 1, 1], ["AN", 1, 1, 6], ["PR", 4, 0, "auto_unroll_max_step$0"]]]], "r": [[0.000394839, 0.000394889, 0.000394875], 0, 14.5908, 1662035903], "v": "v0.6"}
{"i": [["[\"fused_pointwise_conv_bias_add_sigmoid\", 480, 20, 1]", "cuda -keys=cuda,gpu -max_num_threads=1024 -model=unknown -thread_warp_size=32", [-1, 16, 64, 49152, 2147483647, 1024, 8, 32], "", 0, []], [[], [["CI", 4], ["SP", 2, 0, 1, [1, 1, 1, 1], 1], ["SP", 2, 5, 20, [2, 5, 1, 2], 1], ["SP", 2, 10, 480, [1, 2], 1], ["RE", 2, [0, 5, 1, 6, 2, 7, 10, 11, 3, 8, 12, 4, 9]], ["FSP", 5, 0, 1, 3], ["FSP", 5, 4, 2, 3], ["RE", 5, [0, 4, 1, 5, 2, 6, 3, 7]], ["CA", 2, 5, 5], ["CHR", 1, "shared", [2]], ["CA", 2, 3, 6], ["CHR", 0, "shared", [3]], ["CA", 1, 4, 6], ["FU", 7, [0, 1]], ["AN", 7, 0, 5], ["FU", 7, [1, 2]], ["AN", 7, 1, 4], ["FU", 7, [2, 3]], ["AN", 7, 2, 6], ["FU", 3, [0, 1]], ["SP", 3, 0, 2, [2], 1], ["AN", 3, 1, 2], ["FFSP", 3, 0, [2, 1], 1, 1], ["AN", 3, 1, 6], ["FU", 1, [0, 1]], ["SP", 1, 0, 2, [1], 1], ["AN", 1, 1, 2], ["FFSP", 1, 0, [2, 1], 1, 1], ["AN", 1, 1, 6], ["PR", 4, 0, "auto_unroll_max_step$512"]]]], "r": [[7.19973e-05, 7.19963e-05, 7.19966e-05], 0, 11.258, 1662035899], "v": "v0.6"}
{"i": [["[\"fused_pointwise_conv_bias_add_sigmoid\", 480, 20, 1]", "cuda -keys=cuda,gpu -max_num_threads=1024 -model=unknown -thread_warp_size=32", [-1, 16, 64, 49152, 2147483647, 1024, 8, 32], "", 0, []], [[], [["CI", 4], ["SP", 2, 0, 1, [1, 1, 1, 1], 1], ["SP", 2, 5, 20, [2, 1, 1, 1], 1], ["SP", 2, 10, 480, [8, 60], 1], ["RE", 2, [0, 5, 1, 6, 2, 7, 10, 11, 3, 8, 12, 4, 9]], ["FSP", 5, 0, 1, 3], ["FSP", 5, 4, 2, 3], ["RE", 5, [0, 4, 1, 5, 2, 6, 3, 7]], ["CA", 2, 5, 5], ["CHR", 1, "shared", [2]], ["CA", 2, 3, 6], ["CHR", 0, "shared", [3]], ["CA", 1, 4, 6], ["FU", 7, [0, 1]], ["AN", 7, 0, 5], ["FU", 7, [1, 2]], ["AN", 7, 1, 4], ["FU", 7, [2, 3]], ["AN", 7, 2, 6], ["FU", 3, [0, 1]], ["SP", 3, 0, 480, [1], 1], ["AN", 3, 1, 2], ["FFSP", 3, 0, [2, 1], 1, 1], ["AN", 3, 1, 6], ["FU", 1, [0, 1]], ["SP", 1, 0, 480, [1], 1], ["AN", 1, 1, 2], ["FFSP", 1, 0, [2, 1], 1, 1], ["AN", 1, 1, 6], ["PR", 4, 0, "auto_unroll_max_step$0"]]]], "r": [[3.36918e-05, 3.3704e-05, 3.37088e-05], 0, 16.14, 1662035905], "v": "v0.6"}
{"i": [["[\"fused_pointwise_conv_bias_add_sigmoid\", 480, 20, 1]", "cuda -keys=cuda,gpu -max_num_threads=1024 -model=unknown -thread_warp_size=32", [-1, 16, 64, 49152, 2147483647, 1024, 8, 32], "", 0, []], [[], [["CI", 4], ["SP", 2, 0, 1, [1, 1, 1, 1], 1], ["SP", 2, 5, 20, [4, 1, 5, 1], 1], ["SP", 2, 10, 480, [120, 1], 1], ["RE", 2, [0, 5, 1, 6, 2, 7, 10, 11, 3, 8, 12, 4, 9]], ["FSP", 5, 0, 1, 3], ["FSP", 5, 4, 2, 3], ["RE", 5, [0, 4, 1, 5, 2, 6, 3, 7]], ["CA", 2, 5, 5], ["CHR", 1, "shared", [2]], ["CA", 2, 3, 6], ["CHR", 0, "shared", [3]], ["CA", 1, 4, 6], ["FU", 7, [0, 1]], ["AN", 7, 0, 5], ["FU", 7, [1, 2]], ["AN", 7, 1, 4], ["FU", 7, [2, 3]], ["AN", 7, 2, 6], ["FU", 3, [0, 1]], ["SP", 3, 0, 2400, [1], 1], ["AN", 3, 1, 2], ["FFSP", 3, 0, [2, 1], 1, 1], ["AN", 3, 1, 6], ["FU", 1, [0, 1]], ["SP", 1, 0, 120, [1], 1], ["AN", 1, 1, 2], ["FFSP", 1, 0, [2, 1], 1, 1], ["AN", 1, 1, 6], ["PR", 4, 0, "auto_unroll_max_step$512"]]]], "r": [[0.000423659, 0.000423662, 0.000423692], 0, 15.4072, 1662035904], "v": "v0.6"}
{"i": [["[\"fused_pointwise_conv_bias_add_sigmoid\", 480, 20, 1]", "cuda -keys=cuda,gpu -max_num_threads=1024 -model=unknown -thread_warp_size=32", [-1, 16, 64, 49152, 2147483647, 1024, 8, 32], "", 0, []], [[], [["CI", 4], ["SP", 2, 0, 1, [1, 1, 1, 1], 1], ["SP", 2, 5, 20, [1, 4, 5, 1], 1], ["SP", 2, 10, 480, [1, 32], 1], ["RE", 2, [0, 5, 1, 6, 2, 7, 10, 11, 3, 8, 12, 4, 9]], ["FSP", 5, 0, 1, 3], ["FSP", 5, 4, 2, 3], ["RE", 5, [0, 4, 1, 5, 2, 6, 3, 7]], ["CA", 2, 5, 5], ["CHR", 1, "shared", [2]], ["CA", 2, 3, 6], ["CHR", 0, "shared", [3]], ["CA", 1, 4, 6], ["FU", 7, [0, 1]], ["AN", 7, 0, 5], ["FU", 7, [1, 2]], ["AN", 7, 1, 4], ["FU", 7, [2, 3]], ["AN", 7, 2, 6], ["FU", 3, [0, 1]], ["SP", 3, 0, 80, [1], 1], ["AN", 3, 1, 2], ["FFSP", 3, 0, [2, 1], 1, 1], ["AN", 3, 1, 6], ["FU", 1, [0, 1]], ["SP", 1, 0, 16, [1], 1], ["AN", 1, 1, 2], ["FFSP", 1, 0, [2, 1], 1, 1], ["AN", 1, 1, 6], ["PR", 4, 0, "auto_unroll_max_step$512"]]]], "r": [[6.09062e-05, 6.0915e-05, 6.09237e-05], 0, 14.0918, 1662035902], "v": "v0.6"}
{"i": [["[\"fused_pointwise_conv_bias_add_sigmoid\", 480, 20, 1]", "cuda -keys=cuda,gpu -max_num_threads=1024 -model=unknown -thread_warp_size=32", [-1, 16, 64, 49152, 2147483647, 1024, 8, 32], "", 0, []], [[], [["CI", 4], ["SP", 2, 0, 1, [1, 1, 1, 1], 1], ["SP", 2, 5, 20, [1, 1, 4, 5], 1], ["SP", 2, 10, 480, [24, 2], 1], ["RE", 2, [0, 5, 1, 6, 2, 7, 10, 11, 3, 8, 12, 4, 9]], ["FSP", 5, 0, 1, 3], ["FSP", 5, 4, 2, 3], ["RE", 5, [0, 4, 1, 5, 2, 6, 3, 7]], ["CA", 2, 5, 5], ["CHR", 1, "shared", [2]], ["CA", 2, 3, 6], ["CHR", 0, "shared", [3]], ["CA", 1, 4, 6], ["FU", 7, [0, 1]], ["AN", 7, 0, 5], ["FU", 7, [1, 2]], ["AN", 7, 1, 4], ["FU", 7, [2, 3]], ["AN", 7, 2, 6], ["FU", 3, [0, 1]], ["SP", 3, 0, 240, [1], 1], ["AN", 3, 1, 2], ["FFSP", 3, 0, [2, 1], 1, 1], ["AN", 3, 1, 6], ["FU", 1, [0, 1]], ["SP", 1, 0, 48, [1], 1], ["AN", 1, 1, 2], ["FFSP", 1, 0, [2, 1], 1, 1], ["AN", 1, 1, 6], ["PR", 4, 0, "auto_unroll_max_step$0"]]]], "r": [[0.000396386, 0.000396444, 0.000396386], 0, 17.6741, 1662035906], "v": "v0.6"}
{"i": [["[\"fused_pointwise_conv_bias_add_sigmoid\", 480, 20, 1]", "cuda -keys=cuda,gpu -max_num_threads=1024 -model=unknown -thread_warp_size=32", [-1, 16, 64, 49152, 2147483647, 1024, 8, 32], "", 0, []], [[], [["CI", 4], ["SP", 2, 0, 1, [1, 1, 1, 1], 1], ["SP", 2, 5, 20, [5, 1, 2, 1], 1], ["SP", 2, 10, 480, [8, 15], 1], ["RE", 2, [0, 5, 1, 6, 2, 7, 10, 11, 3, 8, 12, 4, 9]], ["FSP", 5, 0, 1, 3], ["FSP", 5, 4, 2, 3], ["RE", 5, [0, 4, 1, 5, 2, 6, 3, 7]], ["CA", 2, 5, 5], ["CHR", 1, "shared", [2]], ["CA", 2, 3, 6], ["CHR", 0, "shared", [3]], ["CA", 1, 4, 6], ["FU", 7, [0, 1]], ["AN", 7, 0, 5], ["FU", 7, [1, 2]], ["AN", 7, 1, 4], ["FU", 7, [2, 3]], ["AN", 7, 2, 6], ["FU", 3, [0, 1]], ["SP", 3, 0, 240, [1], 1], ["AN", 3, 1, 2], ["FFSP", 3, 0, [2, 1], 1, 1], ["AN", 3, 1, 6], ["FU", 1, [0, 1]], ["SP", 1, 0, 120, [1], 1], ["AN", 1, 1, 2], ["FFSP", 1, 0, [2, 1], 1, 1], ["AN", 1, 1, 6], ["PR", 4, 0, "auto_unroll_max_step$64"]]]], "r": [[0.000432567, 0.00043256, 0.000432518], 0, 18.2965, 1662035907], "v": "v0.6"}
{"i": [["[\"fused_pointwise_conv_bias_add_sigmoid\", 480, 20, 1]", "cuda -keys=cuda,gpu -max_num_threads=1024 -model=unknown -thread_warp_size=32", [-1, 16, 64, 49152, 2147483647, 1024, 8, 32], "", 0, []], [[], [["CI", 4], ["SP", 2, 0, 1, [1, 1, 1, 1], 1], ["SP", 2, 5, 20, [2, 2, 5, 1], 1], ["SP", 2, 10, 480, [1, 48], 1], ["RE", 2, [0, 5, 1, 6, 2, 7, 10, 11, 3, 8, 12, 4, 9]], ["FSP", 5, 0, 1, 3], ["FSP", 5, 4, 2, 3], ["RE", 5, [0, 4, 1, 5, 2, 6, 3, 7]], ["CA", 2, 5, 5], ["CHR", 1, "shared", [2]], ["CA", 2, 3, 6], ["CHR", 0, "shared", [3]], ["CA", 1, 4, 6], ["FU", 7, [0, 1]], ["AN", 7, 0, 5], ["FU", 7, [1, 2]], ["AN", 7, 1, 4], ["FU", 7, [2, 3]], ["AN", 7, 2, 6], ["FU", 3, [0, 1]], ["SP", 3, 0, 240, [1], 1], ["AN", 3, 1, 2], ["FFSP", 3, 0, [2, 1], 1, 1], ["AN", 3, 1, 6], ["FU", 1, [0, 1]], ["SP", 1, 0, 48, [1], 1], ["AN", 1, 1, 2], ["FFSP", 1, 0, [2, 1], 1, 1], ["AN", 1, 1, 6], ["PR", 4, 0, "auto_unroll_max_step$16"]]]], "r": [[0.000119082, 0.000119081, 0.000119072], 0, 18.9748, 1662035908], "v": "v0.6"}
{"i": [["[\"fused_pointwise_conv_bias_add_sigmoid\", 480, 20, 1]", "cuda -keys=cuda,gpu -max_num_threads=1024 -model=unknown -thread_warp_size=32", [-1, 16, 64, 49152, 2147483647, 1024, 8, 32], "", 0, []], [[], [["CI", 4], ["SP", 2, 0, 1, [1, 1, 1, 1], 1], ["SP", 2, 5, 20, [1, 1, 10, 2], 1], ["SP", 2, 10, 480, [1, 4], 1], ["RE", 2, [0, 5, 1, 6, 2, 7, 10, 11, 3, 8, 12, 4, 9]], ["FSP", 5, 0, 1, 3], ["FSP", 5, 4, 2, 3], ["RE", 5, [0, 4, 1, 5, 2, 6, 3, 7]], ["CA", 2, 5, 5], ["CHR", 1, "shared", [2]], ["CA", 2, 3, 6], ["CHR", 0, "shared", [3]], ["CA", 1, 4, 6], ["FU", 7, [0, 1]], ["AN", 7, 0, 5], ["FU", 7, [1, 2]], ["AN", 7, 1, 4], ["FU", 7, [2, 3]], ["AN", 7, 2, 6], ["FU", 3, [0, 1]], ["SP", 3, 0, 80, [1], 1], ["AN", 3, 1, 2], ["FFSP", 3, 0, [2, 1], 1, 1], ["AN", 3, 1, 6], ["FU", 1, [0, 1]], ["SP", 1, 0, 4, [1], 1], ["AN", 1, 1, 2], ["FFSP", 1, 0, [2, 1], 1, 1], ["AN", 1, 1, 6], ["PR", 4, 0, "auto_unroll_max_step$1024"]]]], "r": [[0.000384926, 0.000384873, 0.000384866], 0, 20.069, 1662035909], "v": "v0.6"}
{"i": [["[\"fused_pointwise_conv_bias_add_sigmoid\", 480, 20, 1]", "cuda -keys=cuda,gpu -max_num_threads=1024 -model=unknown -thread_warp_size=32", [-1, 16, 64, 49152, 2147483647, 1024, 8, 32], "", 0, []], [[], [["CI", 4], ["SP", 2, 0, 1, [1, 1, 1, 1], 1], ["SP", 2, 5, 20, [2, 5, 1, 1], 1], ["SP", 2, 10, 480, [40, 4], 1], ["RE", 2, [0, 5, 1, 6, 2, 7, 10, 11, 3, 8, 12, 4, 9]], ["FSP", 5, 0, 1, 3], ["FSP", 5, 4, 2, 3], ["RE", 5, [0, 4, 1, 5, 2, 6, 3, 7]], ["CA", 2, 5, 5], ["CHR", 1, "shared", [2]], ["CA", 2, 3, 6], ["CHR", 0, "shared", [3]], ["CA", 1, 4, 6], ["FU", 7, [0, 1]], ["AN", 7, 0, 5], ["FU", 7, [1, 2]], ["AN", 7, 1, 4], ["FU", 7, [2, 3]], ["AN", 7, 2, 6], ["FU", 3, [0, 1]], ["SP", 3, 0, 160, [1], 1], ["AN", 3, 1, 2], ["FFSP", 3, 0, [2, 1], 1, 1], ["AN", 3, 1, 6], ["FU", 1, [0, 1]], ["SP", 1, 0, 160, [1], 1], ["AN", 1, 1, 2], ["FFSP", 1, 0, [2, 1], 1, 1], ["AN", 1, 1, 6], ["PR", 4, 0, "auto_unroll_max_step$16"]]]], "r": [[7.31124e-05, 7.31126e-05, 7.3113e-05], 0, 16.7408, 1662035905], "v": "v0.6"}
{"i": [["[\"fused_pointwise_conv_bias_add_sigmoid\", 480, 20, 1]", "cuda -keys=cuda,gpu -max_num_threads=1024 -model=unknown -thread_warp_size=32", [-1, 16, 64, 49152, 2147483647, 1024, 8, 32], "", 0, []], [[], [["CI", 4], ["SP", 2, 0, 1, [1, 1, 1, 1], 1], ["SP", 2, 5, 20, [1, 5, 1, 4], 1], ["SP", 2, 10, 480, [80, 6], 1], ["RE", 2, [0, 5, 1, 6, 2, 7, 10, 11, 3, 8, 12, 4, 9]], ["FSP", 5, 0, 1, 3], ["FSP", 5, 4, 2, 3], ["RE", 5, [0, 4, 1, 5, 2, 6, 3, 7]], ["CA", 2, 5, 5], ["CHR", 1, "shared", [2]], ["CA", 2, 3, 6], ["CHR", 0, "shared", [3]], ["CA", 1, 4, 6], ["FU", 7, [0, 1]], ["AN", 7, 0, 5], ["FU", 7, [1, 2]], ["AN", 7, 1, 4], ["FU", 7, [2, 3]], ["AN", 7, 2, 6], ["FU", 3, [0, 1]], ["SP", 3, 0, 1920, [1], 1], ["AN", 3, 1, 2], ["FFSP", 3, 0, [2, 1], 1, 1], ["AN", 3, 1, 6], ["FU", 1, [0, 1]], ["SP", 1, 0, 480, [1], 1], ["AN", 1, 1, 2], ["FFSP", 1, 0, [2, 1], 1, 1], ["AN", 1, 1, 6], ["PR", 4, 0, "auto_unroll_max_step$64"]]]], "r": [[4.32857e-05, 4.32936e-05, 4.32981e-05], 0, 19.608, 1662035908], "v": "v0.6"}
{"i": [["[\"fused_pointwise_conv_bias_add_sigmoid\", 480, 20, 1]", "cuda -keys=cuda,gpu -max_num_threads=1024 -model=unknown -thread_warp_size=32", [-1, 16, 64, 49152, 2147483647, 1024, 8, 32], "", 0, []], [[], [["CI", 4], ["SP", 2, 0, 1, [1, 1, 1, 1], 1], ["SP", 2, 5, 20, [2, 1, 1, 10], 1], ["SP", 2, 10, 480, [120, 2], 1], ["RE", 2, [0, 5, 1, 6, 2, 7, 10, 11, 3, 8, 12, 4, 9]], ["FSP", 5, 0, 1, 3], ["FSP", 5, 4, 2, 3], ["RE", 5, [0, 4, 1, 5, 2, 6, 3, 7]], ["CA", 2, 5, 5], ["CHR", 1, "shared", [2]], ["CA", 2, 3, 6], ["CHR", 0, "shared", [3]], ["CA", 1, 4, 6], ["FU", 7, [0, 1]], ["AN", 7, 0, 5], ["FU", 7, [1, 2]], ["AN", 7, 1, 4], ["FU", 7, [2, 3]], ["AN", 7, 2, 6], ["FU", 3, [0, 1]], ["SP", 3, 0, 240, [1], 1], ["AN", 3, 1, 2], ["FFSP", 3, 0, [2, 1], 1, 1], ["AN", 3, 1, 6], ["FU", 1, [0, 1]], ["SP", 1, 0, 240, [1], 1], ["AN", 1, 1, 2], ["FFSP", 1, 0, [2, 1], 1, 1], ["AN", 1, 1, 6], ["PR", 4, 0, "auto_unroll_max_step$0"]]]], "r": [[0.000402601, 0.000402643, 0.000402635], 0, 20.5645, 1662035909], "v": "v0.6"}
{"i": [["[\"fused_pointwise_conv_bias_add_sigmoid\", 480, 20, 1]", "cuda -keys=cuda,gpu -max_num_threads=1024 -model=unknown -thread_warp_size=32", [-1, 16, 64, 49152, 2147483647, 1024, 8, 32], "", 0, []], [[], [["CI", 4], ["SP", 2, 0, 1, [1, 1, 1, 1], 1], ["SP", 2, 5, 20, [1, 5, 2, 1], 1], ["SP", 2, 10, 480, [480, 1], 1], ["RE", 2, [0, 5, 1, 6, 2, 7, 10, 11, 3, 8, 12, 4, 9]], ["FSP", 5, 0, 1, 3], ["FSP", 5, 4, 2, 3], ["RE", 5, [0, 4, 1, 5, 2, 6, 3, 7]], ["CA", 2, 5, 5], ["CHR", 1, "shared", [2]], ["CA", 2, 3, 6], ["CHR", 0, "shared", [3]], ["CA", 1, 4, 6], ["FU", 7, [0, 1]], ["AN", 7, 0, 5], ["FU", 7, [1, 2]], ["AN", 7, 1, 4], ["FU", 7, [2, 3]], ["AN", 7, 2, 6], ["FU", 3, [0, 1]], ["SP", 3, 0, 960, [1], 1], ["AN", 3, 1, 2], ["FFSP", 3, 0, [2, 1], 1, 1], ["AN", 3, 1, 6], ["FU", 1, [0, 1]], ["SP", 1, 0, 480, [1], 1], ["AN", 1, 1, 2], ["FFSP", 1, 0, [2, 1], 1, 1], ["AN", 1, 1, 6], ["PR", 4, 0, "auto_unroll_max_step$512"]]]], "r": [[7.03485e-05, 7.03434e-05, 7.0345e-05], 0, 21.7257, 1662035911], "v": "v0.6"}
{"i": [["[\"fused_pointwise_conv_bias_add_sigmoid\", 480, 20, 1]", "cuda -keys=cuda,gpu -max_num_threads=1024 -model=unknown -thread_warp_size=32", [-1, 16, 64, 49152, 2147483647, 1024, 8, 32], "", 0, []], [[], [["CI", 4], ["SP", 2, 0, 1, [1, 1, 1, 1], 1], ["SP", 2, 5, 20, [1, 2, 5, 1], 1], ["SP", 2, 10, 480, [24, 2], 1], ["RE", 2, [0, 5, 1, 6, 2, 7, 10, 11, 3, 8, 12, 4, 9]], ["FSP", 5, 0, 1, 3], ["FSP", 5, 4, 2, 3], ["RE", 5, [0, 4, 1, 5, 2, 6, 3, 7]], ["CA", 2, 5, 5], ["CHR", 1, "shared", [2]], ["CA", 2, 3, 6], ["CHR", 0, "shared", [3]], ["CA", 1, 4, 6], ["FU", 7, [0, 1]], ["AN", 7, 0, 5], ["FU", 7, [1, 2]], ["AN", 7, 1, 4], ["FU", 7, [2, 3]], ["AN", 7, 2, 6], ["FU", 3, [0, 1]], ["SP", 3, 0, 240, [1], 1], ["AN", 3, 1, 2], ["FFSP", 3, 0, [2, 1], 1, 1], ["AN", 3, 1, 6], ["FU", 1, [0, 1]], ["SP", 1, 0, 48, [1], 1], ["AN", 1, 1, 2], ["FFSP", 1, 0, [2, 1], 1, 1], ["AN", 1, 1, 6], ["PR", 4, 0, "auto_unroll_max_step$64"]]]], "r": [[0.00017436, 0.000174347, 0.000174352], 0, 21.2968, 1662035910], "v": "v0.6"}
{"i": [["[\"fused_pointwise_conv_bias_add_sigmoid\", 480, 20, 1]", "cuda -keys=cuda,gpu -max_num_threads=1024 -model=unknown -thread_warp_size=32", [-1, 16, 64, 49152, 2147483647, 1024, 8, 32], "", 0, []], [[], [["CI", 4], ["SP", 2, 0, 1, [1, 1, 1, 1], 1], ["SP", 2, 5, 20, [5, 1, 2, 1], 1], ["SP", 2, 10, 480, [1, 2], 1], ["RE", 2, [0, 5, 1, 6, 2, 7, 10, 11, 3, 8, 12, 4, 9]], ["FSP", 5, 0, 1, 3], ["FSP", 5, 4, 2, 3], ["RE", 5, [0, 4, 1, 5, 2, 6, 3, 7]], ["CA", 2, 5, 5], ["CHR", 1, "shared", [2]], ["CA", 2, 3, 6], ["CHR", 0, "shared", [3]], ["CA", 1, 4, 6], ["FU", 7, [0, 1]], ["AN", 7, 0, 5], ["FU", 7, [1, 2]], ["AN", 7, 1, 4], ["FU", 7, [2, 3]], ["AN", 7, 2, 6], ["FU", 3, [0, 1]], ["SP", 3, 0, 2, [1], 1], ["AN", 3, 1, 2], ["FFSP", 3, 0, [2, 1], 1, 1], ["AN", 3, 1, 6], ["FU", 1, [0, 1]], ["SP", 1, 0, 2, [1], 1], ["AN", 1, 1, 2], ["FFSP", 1, 0, [2, 1], 1, 1], ["AN", 1, 1, 6], ["PR", 4, 0, "auto_unroll_max_step$16"]]]], "r": [[0.000191126, 0.000191132, 0.000191126], 0, 22.3864, 1662035911], "v": "v0.6"}
{"i": [["[\"fused_pointwise_conv_bias_add_sigmoid\", 480, 20, 1]", "cuda -keys=cuda,gpu -max_num_threads=1024 -model=unknown -thread_warp_size=32", [-1, 16, 64, 49152, 2147483647, 1024, 8, 32], "", 0, []], [[], [["CI", 4], ["SP", 2, 0, 1, [1, 1, 1, 1], 1], ["SP", 2, 5, 20, [2, 1, 10, 1], 1], ["SP", 2, 10, 480, [480, 1], 1], ["RE", 2, [0, 5, 1, 6, 2, 7, 10, 11, 3, 8, 12, 4, 9]], ["FSP", 5, 0, 1, 3], ["FSP", 5, 4, 2, 3], ["RE", 5, [0, 4, 1, 5, 2, 6, 3, 7]], ["CA", 2, 5, 5], ["CHR", 1, "shared", [2]], ["CA", 2, 3, 6], ["CHR", 0, "shared", [3]], ["CA", 1, 4, 6], ["FU", 7, [0, 1]], ["AN", 7, 0, 5], ["FU", 7, [1, 2]], ["AN", 7, 1, 4], ["FU", 7, [2, 3]], ["AN", 7, 2, 6], ["FU", 3, [0, 1]], ["SP", 3, 0, 4800, [1], 1], ["AN", 3, 1, 2], ["FFSP", 3, 0, [2, 1], 1, 1], ["AN", 3, 1, 6], ["FU", 1, [0, 1]], ["SP", 1, 0, 480, [1], 1], ["AN", 1, 1, 2], ["FFSP", 1, 0, [2, 1], 1, 1], ["AN", 1, 1, 6], ["PR", 4, 0, "auto_unroll_max_step$64"]]]], "r": [[0.000298589, 0.000298609, 0.000298599], 0, 22.8276, 1662035912], "v": "v0.6"}
{"i": [["[\"fused_pointwise_conv_bias_add_sigmoid\", 480, 20, 1]", "cuda -keys=cuda,gpu -max_num_threads=1024 -model=unknown -thread_warp_size=32", [-1, 16, 64, 49152, 2147483647, 1024, 8, 32], "", 0, []], [[], [["CI", 4], ["SP", 2, 0, 1, [1, 1, 1, 1], 1], ["SP", 2, 5, 20, [1, 4, 1, 5], 1], ["SP", 2, 10, 480, [1, 1], 1], ["RE", 2, [0, 5, 1, 6, 2, 7, 10, 11, 3, 8, 12, 4, 9]], ["FSP", 5, 0, 1, 3], ["FSP", 5, 4, 2, 3], ["RE", 5, [0, 4, 1, 5, 2, 6, 3, 7]], ["CA", 2, 5, 5], ["CHR", 1, "shared", [2]], ["CA", 2, 3, 6], ["CHR", 0, "shared", [3]], ["CA", 1, 4, 6], ["FU", 7, [0, 1]], ["AN", 7, 0, 5], ["FU", 7, [1, 2]], ["AN", 7, 1, 4], ["FU", 7, [2, 3]], ["AN", 7, 2, 6], ["FU", 3, [0, 1]], ["SP", 3, 0, 3, [1], 1], ["AN", 3, 1, 2], ["FFSP", 3, 0, [2, 1], 1, 1], ["AN", 3, 1, 6], ["FU", 1, [0, 1]], ["SP", 1, 0, 3, [3], 1], ["AN", 1, 1, 2], ["FFSP", 1, 0, [2, 1], 1, 1], ["AN", 1, 1, 6], ["PR", 4, 0, "auto_unroll_max_step$16"]]]], "r": [[0.00014, 0.000139977, 0.000139961], 0, 23.4892, 1662035912], "v": "v0.6"}
{"i": [["[\"fused_pointwise_conv_bias_add_sigmoid\", 480, 20, 1]", "cuda -keys=cuda,gpu -max_num_threads=1024 -model=unknown -thread_warp_size=32", [-1, 16, 64, 49152, 2147483647, 1024, 8, 32], "", 0, []], [[], [["CI", 4], ["SP", 2, 0, 1, [1, 1, 1, 1], 1], ["SP", 2, 5, 20, [2, 1, 1, 10], 1], ["SP", 2, 10, 480, [5, 4], 1], ["RE", 2, [0, 5, 1, 6, 2, 7, 10, 11, 3, 8, 12, 4, 9]], ["FSP", 5, 0, 1, 3], ["FSP", 5, 4, 2, 3], ["RE", 5, [0, 4, 1, 5, 2, 6, 3, 7]], ["CA", 2, 5, 5], ["CHR", 1, "shared", [2]], ["CA", 2, 3, 6], ["CHR", 0, "shared", [3]], ["CA", 1, 4, 6], ["FU", 7, [0, 1]], ["AN", 7, 0, 5], ["FU", 7, [1, 2]], ["AN", 7, 1, 4], ["FU", 7, [2, 3]], ["AN", 7, 2, 6], ["FU", 3, [0, 1]], ["SP", 3, 0, 200, [1], 1], ["AN", 3, 1, 2], ["FFSP", 3, 0, [2, 1], 1, 1], ["AN", 3, 1, 6], ["FU", 1, [0, 1]], ["SP", 1, 0, 20, [1], 1], ["AN", 1, 1, 2], ["FFSP", 1, 0, [2, 1], 1, 1], ["AN", 1, 1, 6], ["PR", 4, 0, "auto_unroll_max_step$64"]]]], "r": [[0.00039136, 0.000391352, 0.000391389], 0, 24.444, 1662035913], "v": "v0.6"}
{"i": [["[\"fused_pointwise_conv_bias_add_sigmoid\", 480, 20, 1]", "cuda -keys=cuda,gpu -max_num_threads=1024 -model=unknown -thread_warp_size=32", [-1, 16, 64, 49152, 2147483647, 1024, 8, 32], "", 0, []], [[], [["CI", 4], ["SP", 2, 0, 1, [1, 1, 1, 1], 1], ["SP", 2, 5, 20, [1, 1, 1, 10], 1], ["SP", 2, 10, 480, [20, 1], 1], ["RE", 2, [0, 5, 1, 6, 2, 7, 10, 11, 3, 8, 12, 4, 9]], ["FSP", 5, 0, 1, 3], ["FSP", 5, 4, 2, 3], ["RE", 5, [0, 4, 1, 5, 2, 6, 3, 7]], ["CA", 2, 5, 5], ["CHR", 1, "shared", [2]], ["CA", 2, 3, 6], ["CHR", 0, "shared", [3]], ["CA", 1, 4, 6], ["FU", 7, [0, 1]], ["AN", 7, 0, 5], ["FU", 7, [1, 2]], ["AN", 7, 1, 4], ["FU", 7, [2, 3]], ["AN", 7, 2, 6], ["FU", 3, [0, 1]], ["SP", 3, 0, 200, [1], 1], ["AN", 3, 1, 2], ["FFSP", 3, 0, [2, 1], 1, 1], ["AN", 3, 1, 6], ["FU", 1, [0, 1]], ["SP", 1, 0, 20, [1], 1], ["AN", 1, 1, 2], ["FFSP", 1, 0, [2, 1], 1, 1], ["AN", 1, 1, 6], ["PR", 4, 0, "auto_unroll_max_step$1024"]]]], "r": [[0.000185426, 0.000185432, 0.000185432], 0, 26.1699, 1662035915], "v": "v0.6"}
{"i": [["[\"fused_pointwise_conv_bias_add_sigmoid\", 480, 20, 1]", "cuda -keys=cuda,gpu -max_num_threads=1024 -model=unknown -thread_warp_size=32", [-1, 16, 64, 49152, 2147483647, 1024, 8, 32], "", 0, []], [[], [["CI", 4], ["SP", 2, 0, 1, [1, 1, 1, 1], 1], ["SP", 2, 5, 20, [1, 5, 2, 2], 1], ["SP", 2, 10, 480, [5, 24], 1], ["RE", 2, [0, 5, 1, 6, 2, 7, 10, 11, 3, 8, 12, 4, 9]], ["FSP", 5, 0, 1, 3], ["FSP", 5, 4, 2, 3], ["RE", 5, [0, 4, 1, 5, 2, 6, 3, 7]], ["CA", 2, 5, 5], ["CHR", 1, "shared", [2]], ["CA", 2, 3, 6], ["CHR", 0, "shared", [3]], ["CA", 1, 4, 6], ["FU", 7, [0, 1]], ["AN", 7, 0, 5], ["FU", 7, [1, 2]], ["AN", 7, 1, 4], ["FU", 7, [2, 3]], ["AN", 7, 2, 6], ["FU", 3, [0, 1]], ["SP", 3, 0, 480, [1], 1], ["AN", 3, 1, 2], ["FFSP", 3, 0, [2, 1], 1, 1], ["AN", 3, 1, 6], ["FU", 1, [0, 1]], ["SP", 1, 0, 120, [1], 1], ["AN", 1, 1, 2], ["FFSP", 1, 0, [2, 1], 1, 1], ["AN", 1, 1, 6], ["PR", 4, 0, "auto_unroll_max_step$1024"]]]], "r": [[3.54822e-05, 3.54957e-05, 3.54848e-05], 0, 28.7649, 1662035916], "v": "v0.6"}
{"i": [["[\"fused_pointwise_conv_bias_add_sigmoid\", 480, 20, 1]", "cuda -keys=cuda,gpu -max_num_threads=1024 -model=unknown -thread_warp_size=32", [-1, 16, 64, 49152, 2147483647, 1024, 8, 32], "", 0, []], [[], [["CI", 4], ["SP", 2, 0, 1, [1, 1, 1, 1], 1], ["SP", 2, 5, 20, [5, 4, 1, 1], 1], ["SP", 2, 10, 480, [15, 32], 1], ["RE", 2, [0, 5, 1, 6, 2, 7, 10, 11, 3, 8, 12, 4, 9]], ["FSP", 5, 0, 1, 3], ["FSP", 5, 4, 2, 3], ["RE", 5, [0, 4, 1, 5, 2, 6, 3, 7]], ["CA", 2, 5, 5], ["CHR", 1, "shared", [2]], ["CA", 2, 3, 6], ["CHR", 0, "shared", [3]], ["CA", 1, 4, 6], ["FU", 7, [0, 1]], ["AN", 7, 0, 5], ["FU", 7, [1, 2]], ["AN", 7, 1, 4], ["FU", 7, [2, 3]], ["AN", 7, 2, 6], ["FU", 3, [0, 1]], ["SP", 3, 0, 2400, [1], 1], ["AN", 3, 1, 2], ["FFSP", 3, 0, [2, 1], 1, 1], ["AN", 3, 1, 6], ["FU", 1, [0, 1]], ["SP", 1, 0, 480, [1], 1], ["AN", 1, 1, 2], ["FFSP", 1, 0, [2, 1], 1, 1], ["AN", 1, 1, 6], ["PR", 4, 0, "auto_unroll_max_step$16"]]]], "r": [[5.5628e-05, 5.56183e-05, 5.56314e-05], 0, 26.4954, 1662035915], "v": "v0.6"}
{"i": [["[\"fused_pointwise_conv_bias_add_sigmoid\", 480, 20, 1]", "cuda -keys=cuda,gpu -max_num_threads=1024 -model=unknown -thread_warp_size=32", [-1, 16, 64, 49152, 2147483647, 1024, 8, 32], "", 0, []], [[], [["CI", 4], ["SP", 2, 0, 1, [1, 1, 1, 1], 1], ["SP", 2, 5, 20, [2, 1, 1, 10], 1], ["SP", 2, 10, 480, [4, 40], 1], ["RE", 2, [0, 5, 1, 6, 2, 7, 10, 11, 3, 8, 12, 4, 9]], ["FSP", 5, 0, 1, 3], ["FSP", 5, 4, 2, 3], ["RE", 5, [0, 4, 1, 5, 2, 6, 3, 7]], ["CA", 2, 5, 5], ["CHR", 1, "shared", [2]], ["CA", 2, 3, 6], ["CHR", 0, "shared", [3]], ["CA", 1, 4, 6], ["FU", 7, [0, 1]], ["AN", 7, 0, 5], ["FU", 7, [1, 2]], ["AN", 7, 1, 4], ["FU", 7, [2, 3]], ["AN", 7, 2, 6], ["FU", 3, [0, 1]], ["SP", 3, 0, 800, [1], 1], ["AN", 3, 1, 2], ["FFSP", 3, 0, [2, 1], 1, 1], ["AN", 3, 1, 6], ["FU", 1, [0, 1]], ["SP", 1, 0, 160, [1], 1], ["AN", 1, 1, 2], ["FFSP", 1, 0, [2, 1], 1, 1], ["AN", 1, 1, 6], ["PR", 4, 0, "auto_unroll_max_step$64"]]]], "r": [[0.000253871, 0.00025388, 0.000253907], 0, 25.0382, 1662035914], "v": "v0.6"}
{"i": [["[\"fused_pointwise_conv_bias_add_sigmoid\", 480, 20, 1]", "cuda -keys=cuda,gpu -max_num_threads=1024 -model=unknown -thread_warp_size=32", [-1, 16, 64, 49152, 2147483647, 1024, 8, 32], "", 0, []], [[], [["CI", 4], ["SP", 2, 0, 1, [1, 1, 1, 1], 1], ["SP", 2, 5, 20, [1, 1, 2, 10], 1], ["SP", 2, 10, 480, [5, 48], 1], ["RE", 2, [0, 5, 1, 6, 2, 7, 10, 11, 3, 8, 12, 4, 9]], ["FSP", 5, 0, 1, 3], ["FSP", 5, 4, 2, 3], ["RE", 5, [0, 4, 1, 5, 2, 6, 3, 7]], ["CA", 2, 5, 5], ["CHR", 1, "shared", [2]], ["CA", 2, 3, 6], ["CHR", 0, "shared", [3]], ["CA", 1, 4, 6], ["FU", 7, [0, 1]], ["AN", 7, 0, 5], ["FU", 7, [1, 2]], ["AN", 7, 1, 4], ["FU", 7, [2, 3]], ["AN", 7, 2, 6], ["FU", 3, [0, 1]], ["SP", 3, 0, 800, [1], 1], ["AN", 3, 1, 2], ["FFSP", 3, 0, [2, 1], 1, 1], ["AN", 3, 1, 6], ["FU", 1, [0, 1]], ["SP", 1, 0, 40, [1], 1], ["AN", 1, 1, 2], ["FFSP", 1, 0, [2, 1], 1, 1], ["AN", 1, 1, 6], ["PR", 4, 0, "auto_unroll_max_step$512"]]]], "r": [[0.000420516, 0.000420487, 0.000420526], 0, 30.5887, 1662035918], "v": "v0.6"}
{"i": [["[\"fused_pointwise_conv_bias_add_sigmoid\", 480, 20, 1]", "cuda -keys=cuda,gpu -max_num_threads=1024 -model=unknown -thread_warp_size=32", [-1, 16, 64, 49152, 2147483647, 1024, 8, 32], "", 0, []], [[], [["CI", 4], ["SP", 2, 0, 1, [1, 1, 1, 1], 1], ["SP", 2, 5, 20, [1, 5, 4, 1], 1], ["SP", 2, 10, 480, [1, 24], 1], ["RE", 2, [0, 5, 1, 6, 2, 7, 10, 11, 3, 8, 12, 4, 9]], ["FSP", 5, 0, 1, 3], ["FSP", 5, 4, 2, 3], ["RE", 5, [0, 4, 1, 5, 2, 6, 3, 7]], ["CA", 2, 5, 5], ["CHR", 1, "shared", [2]], ["CA", 2, 3, 6], ["CHR", 0, "shared", [3]], ["CA", 1, 4, 6], ["FU", 7, [0, 1]], ["AN", 7, 0, 5], ["FU", 7, [1, 2]], ["AN", 7, 1, 4], ["FU", 7, [2, 3]], ["AN", 7, 2, 6], ["FU", 3, [0, 1]], ["SP", 3, 0, 96, [1], 1], ["AN", 3, 1, 2], ["FFSP", 3, 0, [2, 1], 1, 1], ["AN", 3, 1, 6], ["FU", 1, [0, 1]], ["SP", 1, 0, 24, [8], 1], ["AN", 1, 1, 2], ["FFSP", 1, 0, [2, 1], 1, 1], ["AN", 1, 1, 6], ["PR", 4, 0, "auto_unroll_max_step$512"]]]], "r": [[4.3643e-05, 4.3644e-05, 4.36429e-05], 0, 28.791, 1662035917], "v": "v0.6"}
{"i": [["[\"fused_pointwise_conv_bias_add_sigmoid\", 480, 20, 1]", "cuda -keys=cuda,gpu -max_num_threads=1024 -model=unknown -thread_warp_size=32", [-1, 16, 64, 49152, 2147483647, 1024, 8, 32], "", 0, []], [[], [["CI", 4], ["SP", 2, 0, 1, [1, 1, 1, 1], 1], ["SP", 2, 5, 20, [2, 1, 1, 5], 1], ["SP", 2, 10, 480, [4, 8], 1], ["RE", 2, [0, 5, 1, 6, 2, 7, 10, 11, 3, 8, 12, 4, 9]], ["FSP", 5, 0, 1, 3], ["FSP", 5, 4, 2, 3], ["RE", 5, [0, 4, 1, 5, 2, 6, 3, 7]], ["CA", 2, 5, 5], ["CHR", 1, "shared", [2]], ["CA", 2, 3, 6], ["CHR", 0, "shared", [3]], ["CA", 1, 4, 6], ["FU", 7, [0, 1]], ["AN", 7, 0, 5], ["FU", 7, [1, 2]], ["AN", 7, 1, 4], ["FU", 7, [2, 3]], ["AN", 7, 2, 6], ["FU", 3, [0, 1]], ["SP", 3, 0, 320, [1], 1], ["AN", 3, 1, 2], ["FFSP", 3, 0, [2, 1], 1, 1], ["AN", 3, 1, 6], ["FU", 1, [0, 1]], ["SP", 1, 0, 16, [1], 1], ["AN", 1, 1, 2], ["FFSP", 1, 0, [2, 1], 1, 1], ["AN", 1, 1, 6], ["PR", 4, 0, "auto_unroll_max_step$16"]]]], "r": [[0.000209752, 0.000209772, 0.000209742], 0, 27.9213, 1662035917], "v": "v0.6"}
{"i": [["[\"fused_pointwise_conv_bias_add_sigmoid\", 480, 20, 1]", "cuda -keys=cuda,gpu -max_num_threads=1024 -model=unknown -thread_warp_size=32", [-1, 16, 64, 49152, 2147483647, 1024, 8, 32], "", 0, []], [[], [["CI", 4], ["SP", 2, 0, 1, [1, 1, 1, 1], 1], ["SP", 2, 5, 20, [1, 5, 1, 4], 1], ["SP", 2, 10, 480, [80, 1], 1], ["RE", 2, [0, 5, 1, 6, 2, 7, 10, 11, 3, 8, 12, 4, 9]], ["FSP", 5, 0, 1, 3], ["FSP", 5, 4, 2, 3], ["RE", 5, [0, 4, 1, 5, 2, 6, 3, 7]], ["CA", 2, 5, 5], ["CHR", 1, "shared", [2]], ["CA", 2, 3, 6], ["CHR", 0, "shared", [3]], ["CA", 1, 4, 6], ["FU", 7, [0, 1]], ["AN", 7, 0, 5], ["FU", 7, [1, 2]], ["AN", 7, 1, 4], ["FU", 7, [2, 3]], ["AN", 7, 2, 6], ["FU", 3, [0, 1]], ["SP", 3, 0, 160, [1], 1], ["AN", 3, 1, 2], ["FFSP", 3, 0, [2, 1], 1, 1], ["AN", 3, 1, 6], ["FU", 1, [0, 1]], ["SP", 1, 0, 160, [1], 1], ["AN", 1, 1, 2], ["FFSP", 1, 0, [2, 1], 1, 1], ["AN", 1, 1, 6], ["PR", 4, 0, "auto_unroll_max_step$512"]]]], "r": [[3.99521e-05, 3.99495e-05, 3.99529e-05], 0, 29.9288, 1662035919], "v": "v0.6"}
{"i": [["[\"fused_pointwise_conv_bias_add_sigmoid\", 480, 20, 1]", "cuda -keys=cuda,gpu -max_num_threads=1024 -model=unknown -thread_warp_size=32", [-1, 16, 64, 49152, 2147483647, 1024, 8, 32], "", 0, []], [[], [["CI", 4], ["SP", 2, 0, 1, [1, 1, 1, 1], 1], ["SP", 2, 5, 20, [1, 1, 1, 20], 1], ["SP", 2, 10, 480, [60, 2], 1], ["RE", 2, [0, 5, 1, 6, 2, 7, 10, 11, 3, 8, 12, 4, 9]], ["FSP", 5, 0, 1, 3], ["FSP", 5, 4, 2, 3], ["RE", 5, [0, 4, 1, 5, 2, 6, 3, 7]], ["CA", 2, 5, 5], ["CHR", 1, "shared", [2]], ["CA", 2, 3, 6], ["CHR", 0, "shared", [3]], ["CA", 1, 4, 6], ["FU", 7, [0, 1]], ["AN", 7, 0, 5], ["FU", 7, [1, 2]], ["AN", 7, 1, 4], ["FU", 7, [2, 3]], ["AN", 7, 2, 6], ["FU", 3, [0, 1]], ["SP", 3, 0, 2400, [4], 1], ["AN", 3, 1, 2], ["FFSP", 3, 0, [2, 1], 1, 1], ["AN", 3, 1, 6], ["FU", 1, [0, 1]], ["SP", 1, 0, 120, [1], 1], ["AN", 1, 1, 2], ["FFSP", 1, 0, [2, 1], 1, 1], ["AN", 1, 1, 6], ["PR", 4, 0, "auto_unroll_max_step$0"]]]], "r": [[0.000284938, 0.000284933, 0.000285114], 0, 33.4045, 1662035923], "v": "v0.6"}
{"i": [["[\"fused_pointwise_conv_bias_add_sigmoid\", 480, 20, 1]", "cuda -keys=cuda,gpu -max_num_threads=1024 -model=unknown -thread_warp_size=32", [-1, 16, 64, 49152, 2147483647, 1024, 8, 32], "", 0, []], [[], [["CI", 4], ["SP", 2, 0, 1, [1, 1, 1, 1], 1], ["SP", 2, 5, 20, [1, 5, 1, 4], 1], ["SP", 2, 10, 480, [12, 1], 1], ["RE", 2, [0, 5, 1, 6, 2, 7, 10, 11, 3, 8, 12, 4, 9]], ["FSP", 5, 0, 1, 3], ["FSP", 5, 4, 2, 3], ["RE", 5, [0, 4, 1, 5, 2, 6, 3, 7]], ["CA", 2, 5, 5], ["CHR", 1, "shared", [2]], ["CA", 2, 3, 6], ["CHR", 0, "shared", [3]], ["CA", 1, 4, 6], ["FU", 7, [0, 1]], ["AN", 7, 0, 5], ["FU", 7, [1, 2]], ["AN", 7, 1, 4], ["FU", 7, [2, 3]], ["AN", 7, 2, 6], ["FU", 3, [0, 1]], ["SP", 3, 0, 480, [1], 1], ["AN", 3, 1, 2], ["FFSP", 3, 0, [2, 1], 1, 1], ["AN", 3, 1, 6], ["FU", 1, [0, 1]], ["SP", 1, 0, 120, [1], 1], ["AN", 1, 1, 2], ["FFSP", 1, 0, [2, 1], 1, 1], ["AN", 1, 1, 6], ["PR", 4, 0, "auto_unroll_max_step$1024"]]]], "r": [[4.80604e-05, 4.80479e-05, 4.8057e-05], 0, 33.2147, 1662035924], "v": "v0.6"}
{"i": [["[\"fused_pointwise_conv_bias_add_sigmoid\", 480, 20, 1]", "cuda -keys=cuda,gpu -max_num_threads=1024 -model=unknown -thread_warp_size=32", [-1, 16, 64, 49152, 2147483647, 1024, 8, 32], "", 0, []], [[], [["CI", 4], ["SP", 2, 0, 1, [1, 1, 1, 1], 1], ["SP", 2, 5, 20, [1, 2, 1, 5], 1], ["SP", 2, 10, 480, [12, 2], 1], ["RE", 2, [0, 5, 1, 6, 2, 7, 10, 11, 3, 8, 12, 4, 9]], ["FSP", 5, 0, 1, 3], ["FSP", 5, 4, 2, 3], ["RE", 5, [0, 4, 1, 5, 2, 6, 3, 7]], ["CA", 2, 5, 5], ["CHR", 1, "shared", [2]], ["CA", 2, 3, 6], ["CHR", 0, "shared", [3]], ["CA", 1, 4, 6], ["FU", 7, [0, 1]], ["AN", 7, 0, 5], ["FU", 7, [1, 2]], ["AN", 7, 1, 4], ["FU", 7, [2, 3]], ["AN", 7, 2, 6], ["FU", 3, [0, 1]], ["SP", 3, 0, 20, [2], 1], ["AN", 3, 1, 2], ["FFSP", 3, 0, [2, 1], 1, 1], ["AN", 3, 1, 6], ["FU", 1, [0, 1]], ["SP", 1, 0, 4, [1], 1], ["AN", 1, 1, 2], ["FFSP", 1, 0, [2, 1], 1, 1], ["AN", 1, 1, 6], ["PR", 4, 0, "auto_unroll_max_step$1024"]]]], "r": [[6.25924e-05, 6.25922e-05, 6.25855e-05], 0, 33.448, 1662035925], "v": "v0.6"}
{"i": [["[\"fused_pointwise_conv_bias_add_sigmoid\", 480, 20, 1]", "cuda -keys=cuda,gpu -max_num_threads=1024 -model=unknown -thread_warp_size=32", [-1, 16, 64, 49152, 2147483647, 1024, 8, 32], "", 0, []], [[], [["CI", 4], ["SP", 2, 0, 1, [1, 1, 1, 1], 1], ["SP", 2, 5, 20, [2, 1, 5, 1], 1], ["SP", 2, 10, 480, [1, 1], 1], ["RE", 2, [0, 5, 1, 6, 2, 7, 10, 11, 3, 8, 12, 4, 9]], ["FSP", 5, 0, 1, 3], ["FSP", 5, 4, 2, 3], ["RE", 5, [0, 4, 1, 5, 2, 6, 3, 7]], ["CA", 2, 5, 5], ["CHR", 1, "shared", [2]], ["CA", 2, 3, 6], ["CHR", 0, "shared", [3]], ["CA", 1, 4, 6], ["FU", 7, [0, 1]], ["AN", 7, 0, 5], ["FU", 7, [1, 2]], ["AN", 7, 1, 4], ["FU", 7, [2, 3]], ["AN", 7, 2, 6], ["FU", 3, [0, 1]], ["SP", 3, 0, 50, [1], 1], ["AN", 3, 1, 2], ["FFSP", 3, 0, [2, 1], 1, 1], ["AN", 3, 1, 6], ["FU", 1, [0, 1]], ["SP", 1, 0, 10, [1], 1], ["AN", 1, 1, 2], ["FFSP", 1, 0, [2, 1], 1, 1], ["AN", 1, 1, 6], ["PR", 4, 0, "auto_unroll_max_step$64"]]]], "r": [[0.000158083, 0.000158096, 0.000158083], 0, 33.38, 1662035925], "v": "v0.6"}
{"i": [["[\"fused_pointwise_conv_bias_add_sigmoid\", 480, 20, 1]", "cuda -keys=cuda,gpu -max_num_threads=1024 -model=unknown -thread_warp_size=32", [-1, 16, 64, 49152, 2147483647, 1024, 8, 32], "", 0, []], [[], [["CI", 4], ["SP", 2, 0, 1, [1, 1, 1, 1], 1], ["SP", 2, 5, 20, [1, 2, 5, 2], 1], ["SP", 2, 10, 480, [10, 6], 1], ["RE", 2, [0, 5, 1, 6, 2, 7, 10, 11, 3, 8, 12, 4, 9]], ["FSP", 5, 0, 1, 3], ["FSP", 5, 4, 2, 3], ["RE", 5, [0, 4, 1, 5, 2, 6, 3, 7]], ["CA", 2, 5, 5], ["CHR", 1, "shared", [2]], ["CA", 2, 3, 6], ["CHR", 0, "shared", [3]], ["CA", 1, 4, 6], ["FU", 7, [0, 1]], ["AN", 7, 0, 5], ["FU", 7, [1, 2]], ["AN", 7, 1, 4], ["FU", 7, [2, 3]], ["AN", 7, 2, 6], ["FU", 3, [0, 1]], ["SP", 3, 0, 600, [1], 1], ["AN", 3, 1, 2], ["FFSP", 3, 0, [2, 1], 1, 1], ["AN", 3, 1, 6], ["FU", 1, [0, 1]], ["SP", 1, 0, 60, [1], 1], ["AN", 1, 1, 2], ["FFSP", 1, 0, [2, 1], 1, 1], ["AN", 1, 1, 6], ["PR", 4, 0, "auto_unroll_max_step$16"]]]], "r": [[0.000113926, 0.000113922, 0.000113921], 0, 33.418, 1662035926], "v": "v0.6"}
{"i": [["[\"fused_pointwise_conv_bias_add_sigmoid\", 480, 20, 1]", "cuda -keys=cuda,gpu -max_num_threads=1024 -model=unknown -thread_warp_size=32", [-1, 16, 64, 49152, 2147483647, 1024, 8, 32], "", 0, []], [[], [["CI", 4], ["SP", 2, 0, 1, [1, 1, 1, 1], 1], ["SP", 2, 5, 20, [1, 1, 5, 4], 1], ["SP", 2, 10, 480, [32, 15], 1], ["RE", 2, [0, 5, 1, 6, 2, 7, 10, 11, 3, 8, 12, 4, 9]], ["FSP", 5, 0, 1, 3], ["FSP", 5, 4, 2, 3], ["RE", 5, [0, 4, 1, 5, 2, 6, 3, 7]], ["CA", 2, 5, 5], ["CHR", 1, "shared", [2]], ["CA", 2, 3, 6], ["CHR", 0, "shared", [3]], ["CA", 1, 4, 6], ["FU", 7, [0, 1]], ["AN", 7, 0, 5], ["FU", 7, [1, 2]], ["AN", 7, 1, 4], ["FU", 7, [2, 3]], ["AN", 7, 2, 6], ["FU", 3, [0, 1]], ["SP", 3, 0, 9600, [1], 1], ["AN", 3, 1, 2], ["FFSP", 3, 0, [2, 1], 1, 1], ["AN", 3, 1, 6], ["FU", 1, [0, 1]], ["SP", 1, 0, 480, [1], 1], ["AN", 1, 1, 2], ["FFSP", 1, 0, [2, 1], 1, 1], ["AN", 1, 1, 6], ["PR", 4, 0, "auto_unroll_max_step$1024"]]]], "r": [[0.000182596, 0.000182609, 0.000182595], 0, 34.3198, 1662035926], "v": "v0.6"}
{"i": [["[\"fused_pointwise_conv_bias_add_sigmoid\", 480, 20, 1]", "cuda -keys=cuda,gpu -max_num_threads=1024 -model=unknown -thread_warp_size=32", [-1, 16, 64, 49152, 2147483647, 1024, 8, 32], "", 0, []], [[], [["CI", 4], ["SP", 2, 0, 1, [1, 1, 1, 1], 1], ["SP", 2, 5, 20, [1, 1, 4, 1], 1], ["SP", 2, 10, 480, [40, 6], 1], ["RE", 2, [0, 5, 1, 6, 2, 7, 10, 11, 3, 8, 12, 4, 9]], ["FSP", 5, 0, 1, 3], ["FSP", 5, 4, 2, 3], ["RE", 5, [0, 4, 1, 5, 2, 6, 3, 7]], ["CA", 2, 5, 5], ["CHR", 1, "shared", [2]], ["CA", 2, 3, 6], ["CHR", 0, "shared", [3]], ["CA", 1, 4, 6], ["FU", 7, [0, 1]], ["AN", 7, 0, 5], ["FU", 7, [1, 2]], ["AN", 7, 1, 4], ["FU", 7, [2, 3]], ["AN", 7, 2, 6], ["FU", 3, [0, 1]], ["SP", 3, 0, 960, [1], 1], ["AN", 3, 1, 2], ["FFSP", 3, 0, [2, 1], 1, 1], ["AN", 3, 1, 6], ["FU", 1, [0, 1]], ["SP", 1, 0, 240, [1], 1], ["AN", 1, 1, 2], ["FFSP", 1, 0, [2, 1], 1, 1], ["AN", 1, 1, 6], ["PR", 4, 0, "auto_unroll_max_step$1024"]]]], "r": [[5.40146e-05, 5.40183e-05, 5.40154e-05], 0, 37.7966, 1662035928], "v": "v0.6"}
{"i": [["[\"fused_pointwise_conv_bias_add_sigmoid\", 480, 20, 1]", "cuda -keys=cuda,gpu -max_num_threads=1024 -model=unknown -thread_warp_size=32", [-1, 16, 64, 49152, 2147483647, 1024, 8, 32], "", 0, []], [[], [["CI", 4], ["SP", 2, 0, 1, [1, 1, 1, 1], 1], ["SP", 2, 5, 20, [2, 10, 1, 1], 1], ["SP", 2, 10, 480, [5, 48], 1], ["RE", 2, [0, 5, 1, 6, 2, 7, 10, 11, 3, 8, 12, 4, 9]], ["FSP", 5, 0, 1, 3], ["FSP", 5, 4, 2, 3], ["RE", 5, [0, 4, 1, 5, 2, 6, 3, 7]], ["CA", 2, 5, 5], ["CHR", 1, "shared", [2]], ["CA", 2, 3, 6], ["CHR", 0, "shared", [3]], ["CA", 1, 4, 6], ["FU", 7, [0, 1]], ["AN", 7, 0, 5], ["FU", 7, [1, 2]], ["AN", 7, 1, 4], ["FU", 7, [2, 3]], ["AN", 7, 2, 6], ["FU", 3, [0, 1]], ["SP", 3, 0, 240, [1], 1], ["AN", 3, 1, 2], ["FFSP", 3, 0, [2, 1], 1, 1], ["AN", 3, 1, 6], ["FU", 1, [0, 1]], ["SP", 1, 0, 240, [4], 1], ["AN", 1, 1, 2], ["FFSP", 1, 0, [2, 1], 1, 1], ["AN", 1, 1, 6], ["PR", 4, 0, "auto_unroll_max_step$512"]]]], "r": [[2.27702e-05, 2.27808e-05, 2.27807e-05], 0, 34.8142, 1662035928], "v": "v0.6"}
{"i": [["[\"fused_pointwise_conv_bias_add_sigmoid\", 480, 20, 1]", "cuda -keys=cuda,gpu -max_num_threads=1024 -model=unknown -thread_warp_size=32", [-1, 16, 64, 49152, 2147483647, 1024, 8, 32], "", 0, []], [[], [["CI", 4], ["SP", 2, 0, 1, [1, 1, 1, 1], 1], ["SP", 2, 5, 20, [2, 1, 10, 1], 1], ["SP", 2, 10, 480, [20, 8], 1], ["RE", 2, [0, 5, 1, 6, 2, 7, 10, 11, 3, 8, 12, 4, 9]], ["FSP", 5, 0, 1, 3], ["FSP", 5, 4, 2, 3], ["RE", 5, [0, 4, 1, 5, 2, 6, 3, 7]], ["CA", 2, 5, 5], ["CHR", 1, "shared", [2]], ["CA", 2, 3, 6], ["CHR", 0, "shared", [3]], ["CA", 1, 4, 6], ["FU", 7, [0, 1]], ["AN", 7, 0, 5], ["FU", 7, [1, 2]], ["AN", 7, 1, 4], ["FU", 7, [2, 3]], ["AN", 7, 2, 6], ["FU", 3, [0, 1]], ["SP", 3, 0, 1600, [1], 1], ["AN", 3, 1, 2], ["FFSP", 3, 0, [2, 1], 1, 1], ["AN", 3, 1, 6], ["FU", 1, [0, 1]], ["SP", 1, 0, 160, [1], 1], ["AN", 1, 1, 2], ["FFSP", 1, 0, [2, 1], 1, 1], ["AN", 1, 1, 6], ["PR", 4, 0, "auto_unroll_max_step$0"]]]], "r": [[0.000217987, 0.000217969, 0.000217996], 0, 33.757, 1662035929], "v": "v0.6"}
{"i": [["[\"fused_pointwise_conv_bias_add_sigmoid\", 480, 20, 1]", "cuda -keys=cuda,gpu -max_num_threads=1024 -model=unknown -thread_warp_size=32", [-1, 16, 64, 49152, 2147483647, 1024, 8, 32], "", 0, []], [[], [["CI", 4], ["SP", 2, 0, 1, [1, 1, 1, 1], 1], ["SP", 2, 5, 20, [1, 2, 1, 5], 1], ["SP", 2, 10, 480, [2, 12], 1], ["RE", 2, [0, 5, 1, 6, 2, 7, 10, 11, 3, 8, 12, 4, 9]], ["FSP", 5, 0, 1, 3], ["FSP", 5, 4, 2, 3], ["RE", 5, [0, 4, 1, 5, 2, 6, 3, 7]], ["CA", 2, 5, 5], ["CHR", 1, "shared", [2]], ["CA", 2, 3, 6], ["CHR", 0, "shared", [3]], ["CA", 1, 4, 6], ["FU", 7, [0, 1]], ["AN", 7, 0, 5], ["FU", 7, [1, 2]], ["AN", 7, 1, 4], ["FU", 7, [2, 3]], ["AN", 7, 2, 6], ["FU", 3, [0, 1]], ["SP", 3, 0, 120, [1], 1], ["AN", 3, 1, 2], ["FFSP", 3, 0, [2, 1], 1, 1], ["AN", 3, 1, 6], ["FU", 1, [0, 1]], ["SP", 1, 0, 24, [1], 1], ["AN", 1, 1, 2], ["FFSP", 1, 0, [2, 1], 1, 1], ["AN", 1, 1, 6], ["PR", 4, 0, "auto_unroll_max_step$16"]]]], "r": [[0.000178934, 0.00017894, 0.000178932], 0, 33.6801, 1662035930], "v": "v0.6"}
{"i": [["[\"fused_pointwise_conv_bias_add_sigmoid\", 480, 20, 1]", "cuda -keys=cuda,gpu -max_num_threads=1024 -model=unknown -thread_warp_size=32", [-1, 16, 64, 49152, 2147483647, 1024, 8, 32], "", 0, []], [[], [["CI", 4], ["SP", 2, 0, 1, [1, 1, 1, 1], 1], ["SP", 2, 5, 20, [5, 2, 1, 1], 1], ["SP", 2, 10, 480, [10, 48], 1], ["RE", 2, [0, 5, 1, 6, 2, 7, 10, 11, 3, 8, 12, 4, 9]], ["FSP", 5, 0, 1, 3], ["FSP", 5, 4, 2, 3], ["RE", 5, [0, 4, 1, 5, 2, 6, 3, 7]], ["CA", 2, 5, 5], ["CHR", 1, "shared", [2]], ["CA", 2, 3, 6], ["CHR", 0, "shared", [3]], ["CA", 1, 4, 6], ["FU", 7, [0, 1]], ["AN", 7, 0, 5], ["FU", 7, [1, 2]], ["AN", 7, 1, 4], ["FU", 7, [2, 3]], ["AN", 7, 2, 6], ["FU", 3, [0, 1]], ["SP", 3, 0, 240, [1], 1], ["AN", 3, 1, 2], ["FFSP", 3, 0, [2, 1], 1, 1], ["AN", 3, 1, 6], ["FU", 1, [0, 1]], ["SP", 1, 0, 240, [4], 1], ["AN", 1, 1, 2], ["FFSP", 1, 0, [2, 1], 1, 1], ["AN", 1, 1, 6], ["PR", 4, 0, "auto_unroll_max_step$64"]]]], "r": [[0.000170048, 0.000170091, 0.000170065], 0, 33.6199, 1662035931], "v": "v0.6"}
{"i": [["[\"fused_pointwise_conv_bias_add_sigmoid\", 480, 20, 1]", "cuda -keys=cuda,gpu -max_num_threads=1024 -model=unknown -thread_warp_size=32", [-1, 16, 64, 49152, 2147483647, 1024, 8, 32], "", 0, []], [[], [["CI", 4], ["SP", 2, 0, 1, [1, 1, 1, 1], 1], ["SP", 2, 5, 20, [5, 1, 4, 1], 1], ["SP", 2, 10, 480, [24, 10], 1], ["RE", 2, [0, 5, 1, 6, 2, 7, 10, 11, 3, 8, 12, 4, 9]], ["FSP", 5, 0, 1, 3], ["FSP", 5, 4, 2, 3], ["RE", 5, [0, 4, 1, 5, 2, 6, 3, 7]], ["CA", 2, 5, 5], ["CHR", 1, "shared", [2]], ["CA", 2, 3, 6], ["CHR", 0, "shared", [3]], ["CA", 1, 4, 6], ["FU", 7, [0, 1]], ["AN", 7, 0, 5], ["FU", 7, [1, 2]], ["AN", 7, 1, 4], ["FU", 7, [2, 3]], ["AN", 7, 2, 6], ["FU", 3, [0, 1]], ["SP", 3, 0, 960, [4], 1], ["AN", 3, 1, 2], ["FFSP", 3, 0, [2, 1], 1, 1], ["AN", 3, 1, 6], ["FU", 1, [0, 1]], ["SP", 1, 0, 240, [1], 1], ["AN", 1, 1, 2], ["FFSP", 1, 0, [2, 1], 1, 1], ["AN", 1, 1, 6], ["PR", 4, 0, "auto_unroll_max_step$16"]]]], "r": [[0.000114633, 0.000114628, 0.000114626], 0, 34.1042, 1662035932], "v": "v0.6"}
{"i": [["[\"fused_pointwise_conv_bias_add_sigmoid\", 480, 20, 1]", "cuda -keys=cuda,gpu -max_num_threads=1024 -model=unknown -thread_warp_size=32", [-1, 16, 64, 49152, 2147483647, 1024, 8, 32], "", 0, []], [[], [["CI", 4], ["SP", 2, 0, 1, [1, 1, 1, 1], 1], ["SP", 2, 5, 20, [2, 1, 5, 1], 1], ["SP", 2, 10, 480, [40, 12], 1], ["RE", 2, [0, 5, 1, 6, 2, 7, 10, 11, 3, 8, 12, 4, 9]], ["FSP", 5, 0, 1, 3], ["FSP", 5, 4, 2, 3], ["RE", 5, [0, 4, 1, 5, 2, 6, 3, 7]], ["CA", 2, 5, 5], ["CHR", 1, "shared", [2]], ["CA", 2, 3, 6], ["CHR", 0, "shared", [3]], ["CA", 1, 4, 6], ["FU", 7, [0, 1]], ["AN", 7, 0, 5], ["FU", 7, [1, 2]], ["AN", 7, 1, 4], ["FU", 7, [2, 3]], ["AN", 7, 2, 6], ["FU", 3, [0, 1]], ["SP", 3, 0, 240, [1], 1], ["AN", 3, 1, 2], ["FFSP", 3, 0, [2, 1], 1, 1], ["AN", 3, 1, 6], ["FU", 1, [0, 1]], ["SP", 1, 0, 48, [1], 1], ["AN", 1, 1, 2], ["FFSP", 1, 0, [2, 1], 1, 1], ["AN", 1, 1, 6], ["PR", 4, 0, "auto_unroll_max_step$64"]]]], "r": [[0.000310413, 0.000310458, 0.000310449], 0, 34.1846, 1662035932], "v": "v0.6"}
{"i": [["[\"fused_pointwise_conv_bias_add_sigmoid\", 480, 20, 1]", "cuda -keys=cuda,gpu -max_num_threads=1024 -model=unknown -thread_warp_size=32", [-1, 16, 64, 49152, 2147483647, 1024, 8, 32], "", 0, []], [[], [["CI", 4], ["SP", 2, 0, 1, [1, 1, 1, 1], 1], ["SP", 2, 5, 20, [2, 1, 5, 2], 1], ["SP", 2, 10, 480, [2, 3], 1], ["RE", 2, [0, 5, 1, 6, 2, 7, 10, 11, 3, 8, 12, 4, 9]], ["FSP", 5, 0, 1, 3], ["FSP", 5, 4, 2, 3], ["RE", 5, [0, 4, 1, 5, 2, 6, 3, 7]], ["CA", 2, 5, 5], ["CHR", 1, "shared", [2]], ["CA", 2, 3, 6], ["CHR", 0, "shared", [3]], ["CA", 1, 4, 6], ["FU", 7, [0, 1]], ["AN", 7, 0, 5], ["FU", 7, [1, 2]], ["AN", 7, 1, 4], ["FU", 7, [2, 3]], ["AN", 7, 2, 6], ["FU", 3, [0, 1]], ["SP", 3, 0, 120, [1], 1], ["AN", 3, 1, 2], ["FFSP", 3, 0, [2, 1], 1, 1], ["AN", 3, 1, 6], ["FU", 1, [0, 1]], ["SP", 1, 0, 6, [1], 1], ["AN", 1, 1, 2], ["FFSP", 1, 0, [2, 1], 1, 1], ["AN", 1, 1, 6], ["PR", 4, 0, "auto_unroll_max_step$512"]]]], "r": [[0.000403279, 0.000403255, 0.000403219], 0, 34.1176, 1662035933], "v": "v0.6"}
{"i": [["[\"fused_pointwise_conv_bias_add_sigmoid\", 480, 20, 1]", "cuda -keys=cuda,gpu -max_num_threads=1024 -model=unknown -thread_warp_size=32", [-1, 16, 64, 49152, 2147483647, 1024, 8, 32], "", 0, []], [[], [["CI", 4], ["SP", 2, 0, 1, [1, 1, 1, 1], 1], ["SP", 2, 5, 20, [1, 1, 1, 20], 1], ["SP", 2, 10, 480, [15, 4], 1], ["RE", 2, [0, 5, 1, 6, 2, 7, 10, 11, 3, 8, 12, 4, 9]], ["FSP", 5, 0, 1, 3], ["FSP", 5, 4, 2, 3], ["RE", 5, [0, 4, 1, 5, 2, 6, 3, 7]], ["CA", 2, 5, 5], ["CHR", 1, "shared", [2]], ["CA", 2, 3, 6], ["CHR", 0, "shared", [3]], ["CA", 1, 4, 6], ["FU", 7, [0, 1]], ["AN", 7, 0, 5], ["FU", 7, [1, 2]], ["AN", 7, 1, 4], ["FU", 7, [2, 3]], ["AN", 7, 2, 6], ["FU", 3, [0, 1]], ["SP", 3, 0, 60, [1], 1], ["AN", 3, 1, 2], ["FFSP", 3, 0, [2, 1], 1, 1], ["AN", 3, 1, 6], ["FU", 1, [0, 1]], ["SP", 1, 0, 60, [2], 1], ["AN", 1, 1, 2], ["FFSP", 1, 0, [2, 1], 1, 1], ["AN", 1, 1, 6], ["PR", 4, 0, "auto_unroll_max_step$0"]]]], "r": [[0.000400552, 0.000400582, 0.00040059], 0, 33.3269, 1662035935], "v": "v0.6"}
{"i": [["[\"fused_pointwise_conv_bias_add_sigmoid\", 480, 20, 1]", "cuda -keys=cuda,gpu -max_num_threads=1024 -model=unknown -thread_warp_size=32", [-1, 16, 64, 49152, 2147483647, 1024, 8, 32], "", 0, []], [[], [["CI", 4], ["SP", 2, 0, 1, [1, 1, 1, 1], 1], ["SP", 2, 5, 20, [1, 1, 2, 5], 1], ["SP", 2, 10, 480, [120, 1], 1], ["RE", 2, [0, 5, 1, 6, 2, 7, 10, 11, 3, 8, 12, 4, 9]], ["FSP", 5, 0, 1, 3], ["FSP", 5, 4, 2, 3], ["RE", 5, [0, 4, 1, 5, 2, 6, 3, 7]], ["CA", 2, 5, 5], ["CHR", 1, "shared", [2]], ["CA", 2, 3, 6], ["CHR", 0, "shared", [3]], ["CA", 1, 4, 6], ["FU", 7, [0, 1]], ["AN", 7, 0, 5], ["FU", 7, [1, 2]], ["AN", 7, 1, 4], ["FU", 7, [2, 3]], ["AN", 7, 2, 6], ["FU", 3, [0, 1]], ["SP", 3, 0, 600, [1], 1], ["AN", 3, 1, 2], ["FFSP", 3, 0, [2, 1], 1, 1], ["AN", 3, 1, 6], ["FU", 1, [0, 1]], ["SP", 1, 0, 120, [1], 1], ["AN", 1, 1, 2], ["FFSP", 1, 0, [2, 1], 1, 1], ["AN", 1, 1, 6], ["PR", 4, 0, "auto_unroll_max_step$64"]]]], "r": [[0.000319632, 0.000319639, 0.000319618], 0, 33.1011, 1662035935], "v": "v0.6"}
{"i": [["[\"fused_pointwise_conv_bias_add_sigmoid\", 480, 20, 1]", "cuda -keys=cuda,gpu -max_num_threads=1024 -model=unknown -thread_warp_size=32", [-1, 16, 64, 49152, 2147483647, 1024, 8, 32], "", 0, []], [[], [["CI", 4], ["SP", 2, 0, 1, [1, 1, 1, 1], 1], ["SP", 2, 5, 20, [5, 2, 1, 2], 1], ["SP", 2, 10, 480, [32, 15], 1], ["RE", 2, [0, 5, 1, 6, 2, 7, 10, 11, 3, 8, 12, 4, 9]], ["FSP", 5, 0, 1, 3], ["FSP", 5, 4, 2, 3], ["RE", 5, [0, 4, 1, 5, 2, 6, 3, 7]], ["CA", 2, 5, 5], ["CHR", 1, "shared", [2]], ["CA", 2, 3, 6], ["CHR", 0, "shared", [3]], ["CA", 1, 4, 6], ["FU", 7, [0, 1]], ["AN", 7, 0, 5], ["FU", 7, [1, 2]], ["AN", 7, 1, 4], ["FU", 7, [2, 3]], ["AN", 7, 2, 6], ["FU", 3, [0, 1]], ["SP", 3, 0, 16, [2], 1], ["AN", 3, 1, 2], ["FFSP", 3, 0, [2, 1], 1, 1], ["AN", 3, 1, 6], ["FU", 1, [0, 1]], ["SP", 1, 0, 8, [1], 1], ["AN", 1, 1, 2], ["FFSP", 1, 0, [2, 1], 1, 1], ["AN", 1, 1, 6], ["PR", 4, 0, "auto_unroll_max_step$1024"]]]], "r": [[7.78344e-05, 7.78373e-05, 7.78353e-05], 0, 33.2362, 1662035936], "v": "v0.6"}
{"i": [["[\"fused_pointwise_conv_bias_add_sigmoid\", 480, 20, 1]", "cuda -keys=cuda,gpu -max_num_threads=1024 -model=unknown -thread_warp_size=32", [-1, 16, 64, 49152, 2147483647, 1024, 8, 32], "", 0, []], [[], [["CI", 4], ["SP", 2, 0, 1, [1, 1, 1, 1], 1], ["SP", 2, 5, 20, [2, 5, 1, 2], 1], ["SP", 2, 10, 480, [60, 4], 1], ["RE", 2, [0, 5, 1, 6, 2, 7, 10, 11, 3, 8, 12, 4, 9]], ["FSP", 5, 0, 1, 3], ["FSP", 5, 4, 2, 3], ["RE", 5, [0, 4, 1, 5, 2, 6, 3, 7]], ["CA", 2, 5, 5], ["CHR", 1, "shared", [2]], ["CA", 2, 3, 6], ["CHR", 0, "shared", [3]], ["CA", 1, 4, 6], ["FU", 7, [0, 1]], ["AN", 7, 0, 5], ["FU", 7, [1, 2]], ["AN", 7, 1, 4], ["FU", 7, [2, 3]], ["AN", 7, 2, 6], ["FU", 3, [0, 1]], ["SP", 3, 0, 480, [1], 1], ["AN", 3, 1, 2], ["FFSP", 3, 0, [2, 1], 1, 1], ["AN", 3, 1, 6], ["FU", 1, [0, 1]], ["SP", 1, 0, 240, [1], 1], ["AN", 1, 1, 2], ["FFSP", 1, 0, [2, 1], 1, 1], ["AN", 1, 1, 6], ["PR", 4, 0, "auto_unroll_max_step$0"]]]], "r": [[4.33178e-05, 4.33134e-05, 4.33116e-05], 0, 32.6382, 1662035937], "v": "v0.6"}
{"i": [["[\"fused_pointwise_conv_bias_add_sigmoid\", 480, 20, 1]", "cuda -keys=cuda,gpu -max_num_threads=1024 -model=unknown -thread_warp_size=32", [-1, 16, 64, 49152, 2147483647, 1024, 8, 32], "", 0, []], [[], [["CI", 4], ["SP", 2, 0, 1, [1, 1, 1, 1], 1], ["SP", 2, 5, 20, [2, 1, 2, 1], 1], ["SP", 2, 10, 480, [20, 3], 1], ["RE", 2, [0, 5, 1, 6, 2, 7, 10, 11, 3, 8, 12, 4, 9]], ["FSP", 5, 0, 1, 3], ["FSP", 5, 4, 2, 3], ["RE", 5, [0, 4, 1, 5, 2, 6, 3, 7]], ["CA", 2, 5, 5], ["CHR", 1, "shared", [2]], ["CA", 2, 3, 6], ["CHR", 0, "shared", [3]], ["CA", 1, 4, 6], ["FU", 7, [0, 1]], ["AN", 7, 0, 5], ["FU", 7, [1, 2]], ["AN", 7, 1, 4], ["FU", 7, [2, 3]], ["AN", 7, 2, 6], ["FU", 3, [0, 1]], ["SP", 3, 0, 120, [1], 1], ["AN", 3, 1, 2], ["FFSP", 3, 0, [2, 1], 1, 1], ["AN", 3, 1, 6], ["FU", 1, [0, 1]], ["SP", 1, 0, 60, [1], 1], ["AN", 1, 1, 2], ["FFSP", 1, 0, [2, 1], 1, 1], ["AN", 1, 1, 6], ["PR", 4, 0, "auto_unroll_max_step$64"]]]], "r": [[0.000124377, 0.000124357, 0.000124313], 0, 33.1562, 1662035938], "v": "v0.6"}
{"i": [["[\"fused_pointwise_conv_bias_add_sigmoid\", 480, 20, 1]", "cuda -keys=cuda,gpu -max_num_threads=1024 -model=unknown -thread_warp_size=32", [-1, 16, 64, 49152, 2147483647, 1024, 8, 32], "", 0, []], [[], [["CI", 4], ["SP", 2, 0, 1, [1, 1, 1, 1], 1], ["SP", 2, 5, 20, [4, 1, 5, 1], 1], ["SP", 2, 10, 480, [160, 1], 1], ["RE", 2, [0, 5, 1, 6, 2, 7, 10, 11, 3, 8, 12, 4, 9]], ["FSP", 5, 0, 1, 3], ["FSP", 5, 4, 2, 3], ["RE", 5, [0, 4, 1, 5, 2, 6, 3, 7]], ["CA", 2, 5, 5], ["CHR", 1, "shared", [2]], ["CA", 2, 3, 6], ["CHR", 0, "shared", [3]], ["CA", 1, 4, 6], ["FU", 7, [0, 1]], ["AN", 7, 0, 5], ["FU", 7, [1, 2]], ["AN", 7, 1, 4], ["FU", 7, [2, 3]], ["AN", 7, 2, 6], ["FU", 3, [0, 1]], ["SP", 3, 0, 800, [1], 1], ["AN", 3, 1, 2], ["FFSP", 3, 0, [2, 1], 1, 1], ["AN", 3, 1, 6], ["FU", 1, [0, 1]], ["SP", 1, 0, 160, [1], 1], ["AN", 1, 1, 2], ["FFSP", 1, 0, [2, 1], 1, 1], ["AN", 1, 1, 6], ["PR", 4, 0, "auto_unroll_max_step$0"]]]], "r": [[0.000292279, 0.000292271, 0.000292139], 0, 33.2807, 1662035939], "v": "v0.6"}
