python/models/efficientnet/kernel_configs/efficient_fused_pointwise_conv_bias_add_sigmoid_32_8_1.log
{"i": [["[\"fused_pointwise_conv_bias_add_sigmoid\", 32, 8, 1]", "cuda -keys=cuda,gpu -max_num_threads=1024 -model=unknown -thread_warp_size=32", [-1, 16, 64, 49152, 2147483647, 1024, 8, 32], "", 0, []], [[], [["CI", 4], ["SP", 2, 0, 1, [1, 1, 1, 1], 1], ["SP", 2, 5, 8, [8, 1, 1, 1], 1], ["SP", 2, 10, 32, [16, 2], 1], ["RE", 2, [0, 5, 1, 6, 2, 7, 10, 11, 3, 8, 12, 4, 9]], ["FSP", 5, 0, 1, 3], ["FSP", 5, 4, 2, 3], ["RE", 5, [0, 4, 1, 5, 2, 6, 3, 7]], ["CA", 2, 5, 5], ["CHR", 1, "shared", [2]], ["CA", 2, 3, 6], ["CHR", 0, "shared", [3]], ["CA", 1, 4, 6], ["FU", 7, [0, 1]], ["AN", 7, 0, 5], ["FU", 7, [1, 2]], ["AN", 7, 1, 4], ["FU", 7, [2, 3]], ["AN", 7, 2, 6], ["FU", 3, [0, 1]], ["SP", 3, 0, 32, [1], 1], ["AN", 3, 1, 2], ["FFSP", 3, 0, [2, 1], 1, 1], ["AN", 3, 1, 6], ["FU", 1, [0, 1]], ["SP", 1, 0, 32, [1], 1], ["AN", 1, 1, 2], ["FFSP", 1, 0, [2, 1], 1, 1], ["AN", 1, 1, 6], ["PR", 4, 0, "auto_unroll_max_step$1024"]]]], "r": [[1.04884e-05, 1.04878e-05, 1.04895e-05], 0, 4.66511, 1662032902], "v": "v0.6"}
{"i": [["[\"fused_pointwise_conv_bias_add_sigmoid\", 32, 8, 1]", "cuda -keys=cuda,gpu -max_num_threads=1024 -model=unknown -thread_warp_size=32", [-1, 16, 64, 49152, 2147483647, 1024, 8, 32], "", 0, []], [[], [["CI", 4], ["SP", 2, 0, 1, [1, 1, 1, 1], 1], ["SP", 2, 5, 8, [2, 2, 1, 1], 1], ["SP", 2, 10, 32, [1, 1], 1], ["RE", 2, [0, 5, 1, 6, 2, 7, 10, 11, 3, 8, 12, 4, 9]], ["FSP", 5, 0, 1, 3], ["FSP", 5, 4, 2, 3], ["RE", 5, [0, 4, 1, 5, 2, 6, 3, 7]], ["CA", 2, 5, 5], ["CHR", 1, "shared", [2]], ["CA", 2, 3, 6], ["CHR", 0, "shared", [3]], ["CA", 1, 4, 6], ["FU", 7, [0, 1]], ["AN", 7, 0, 5], ["FU", 7, [1, 2]], ["AN", 7, 1, 4], ["FU", 7, [2, 3]], ["AN", 7, 2, 6], ["FU", 3, [0, 1]], ["SP", 3, 0, 2, [1], 1], ["AN", 3, 1, 2], ["FFSP", 3, 0, [2, 1], 1, 1], ["AN", 3, 1, 6], ["FU", 1, [0, 1]], ["SP", 1, 0, 1, [1], 1], ["AN", 1, 1, 2], ["FFSP", 1, 0, [2, 1], 1, 1], ["AN", 1, 1, 6], ["PR", 4, 0, "auto_unroll_max_step$512"]]]], "r": [[8.44333e-06, 8.44245e-06, 8.44197e-06], 0, 11.2554, 1662032910], "v": "v0.6"}
{"i": [["[\"fused_pointwise_conv_bias_add_sigmoid\", 32, 8, 1]", "cuda -keys=cuda,gpu -max_num_threads=1024 -model=unknown -thread_warp_size=32", [-1, 16, 64, 49152, 2147483647, 1024, 8, 32], "", 0, []], [[], [["CI", 4], ["SP", 2, 0, 1, [1, 1, 1, 1], 1], ["SP", 2, 5, 8, [1, 1, 2, 4], 1], ["SP", 2, 10, 32, [1, 4], 1], ["RE", 2, [0, 5, 1, 6, 2, 7, 10, 11, 3, 8, 12, 4, 9]], ["FSP", 5, 0, 1, 3], ["FSP", 5, 4, 2, 3], ["RE", 5, [0, 4, 1, 5, 2, 6, 3, 7]], ["CA", 2, 5, 5], ["CHR", 1, "shared", [2]], ["CA", 2, 3, 6], ["CHR", 0, "shared", [3]], ["CA", 1, 4, 6], ["FU", 7, [0, 1]], ["AN", 7, 0, 5], ["FU", 7, [1, 2]], ["AN", 7, 1, 4], ["FU", 7, [2, 3]], ["AN", 7, 2, 6], ["FU", 3, [0, 1]], ["SP", 3, 0, 32, [1], 1], ["AN", 3, 1, 2], ["FFSP", 3, 0, [2, 1], 1, 1], ["AN", 3, 1, 6], ["FU", 1, [0, 1]], ["SP", 1, 0, 4, [1], 1], ["AN", 1, 1, 2], ["FFSP", 1, 0, [2, 1], 1, 1], ["AN", 1, 1, 6], ["PR", 4, 0, "auto_unroll_max_step$1024"]]]], "r": [[1.29714e-05, 1.29733e-05, 1.29726e-05], 0, 5.1223, 1662032903], "v": "v0.6"}
{"i": [["[\"fused_pointwise_conv_bias_add_sigmoid\", 32, 8, 1]", "cuda -keys=cuda,gpu -max_num_threads=1024 -model=unknown -thread_warp_size=32", [-1, 16, 64, 49152, 2147483647, 1024, 8, 32], "", 0, []], [[], [["CI", 4], ["SP", 2, 0, 1, [1, 1, 1, 1], 1], ["SP", 2, 5, 8, [1, 4, 1, 1], 1], ["SP", 2, 10, 32, [1, 2], 1], ["RE", 2, [0, 5, 1, 6, 2, 7, 10, 11, 3, 8, 12, 4, 9]], ["FSP", 5, 0, 1, 3], ["FSP", 5, 4, 2, 3], ["RE", 5, [0, 4, 1, 5, 2, 6, 3, 7]], ["CA", 2, 5, 5], ["CHR", 1, "shared", [2]], ["CA", 2, 3, 6], ["CHR", 0, "shared", [3]], ["CA", 1, 4, 6], ["FU", 7, [0, 1]], ["AN", 7, 0, 5], ["FU", 7, [1, 2]], ["AN", 7, 1, 4], ["FU", 7, [2, 3]], ["AN", 7, 2, 6], ["FU", 3, [0, 1]], ["SP", 3, 0, 16, [1], 1], ["AN", 3, 1, 2], ["FFSP", 3, 0, [2, 1], 1, 1], ["AN", 3, 1, 6], ["FU", 1, [0, 1]], ["SP", 1, 0, 16, [1], 1], ["AN", 1, 1, 2], ["FFSP", 1, 0, [2, 1], 1, 1], ["AN", 1, 1, 6], ["PR", 4, 0, "auto_unroll_max_step$64"]]]], "r": [[6.32115e-06, 6.32133e-06, 6.32032e-06], 0, 3.27829, 1662032901], "v": "v0.6"}
{"i": [["[\"fused_pointwise_conv_bias_add_sigmoid\", 32, 8, 1]", "cuda -keys=cuda,gpu -max_num_threads=1024 -model=unknown -thread_warp_size=32", [-1, 16, 64, 49152, 2147483647, 1024, 8, 32], "", 0, []], [[], [["CI", 4], ["SP", 2, 0, 1, [1, 1, 1, 1], 1], ["SP", 2, 5, 8, [4, 1, 1, 1], 1], ["SP", 2, 10, 32, [8, 2], 1], ["RE", 2, [0, 5, 1, 6, 2, 7, 10, 11, 3, 8, 12, 4, 9]], ["FSP", 5, 0, 1, 3], ["FSP", 5, 4, 2, 3], ["RE", 5, [0, 4, 1, 5, 2, 6, 3, 7]], ["CA", 2, 5, 5], ["CHR", 1, "shared", [2]], ["CA", 2, 3, 6], ["CHR", 0, "shared", [3]], ["CA", 1, 4, 6], ["FU", 7, [0, 1]], ["AN", 7, 0, 5], ["FU", 7, [1, 2]], ["AN", 7, 1, 4], ["FU", 7, [2, 3]], ["AN", 7, 2, 6], ["FU", 3, [0, 1]], ["SP", 3, 0, 16, [1], 1], ["AN", 3, 1, 2], ["FFSP", 3, 0, [2, 1], 1, 1], ["AN", 3, 1, 6], ["FU", 1, [0, 1]], ["SP", 1, 0, 16, [1], 1], ["AN", 1, 1, 2], ["FFSP", 1, 0, [2, 1], 1, 1], ["AN", 1, 1, 6], ["PR", 4, 0, "auto_unroll_max_step$64"]]]], "r": [[9.92141e-06, 9.91789e-06, 9.92373e-06], 0, 8.63225, 1662032907], "v": "v0.6"}
{"i": [["[\"fused_pointwise_conv_bias_add_sigmoid\", 32, 8, 1]", "cuda -keys=cuda,gpu -max_num_threads=1024 -model=unknown -thread_warp_size=32", [-1, 16, 64, 49152, 2147483647, 1024, 8, 32], "", 0, []], [[], [["CI", 4], ["SP", 2, 0, 1, [1, 1, 1, 1], 1], ["SP", 2, 5, 8, [1, 1, 2, 4], 1], ["SP", 2, 10, 32, [1, 4], 1], ["RE", 2, [0, 5, 1, 6, 2, 7, 10, 11, 3, 8, 12, 4, 9]], ["FSP", 5, 0, 1, 3], ["FSP", 5, 4, 2, 3], ["RE", 5, [0, 4, 1, 5, 2, 6, 3, 7]], ["CA", 2, 5, 5], ["CHR", 1, "shared", [2]], ["CA", 2, 3, 6], ["CHR", 0, "shared", [3]], ["CA", 1, 4, 6], ["FU", 7, [0, 1]], ["AN", 7, 0, 5], ["FU", 7, [1, 2]], ["AN", 7, 1, 4], ["FU", 7, [2, 3]], ["AN", 7, 2, 6], ["FU", 3, [0, 1]], ["SP", 3, 0, 32, [1], 1], ["AN", 3, 1, 2], ["FFSP", 3, 0, [2, 1], 1, 1], ["AN", 3, 1, 6], ["FU", 1, [0, 1]], ["SP", 1, 0, 4, [1], 1], ["AN", 1, 1, 2], ["FFSP", 1, 0, [2, 1], 1, 1], ["AN", 1, 1, 6], ["PR", 4, 0, "auto_unroll_max_step$0"]]]], "r": [[1.276e-05, 1.27617e-05, 1.27611e-05], 0, 5.63351, 1662032904], "v": "v0.6"}
{"i": [["[\"fused_pointwise_conv_bias_add_sigmoid\", 32, 8, 1]", "cuda -keys=cuda,gpu -max_num_threads=1024 -model=unknown -thread_warp_size=32", [-1, 16, 64, 49152, 2147483647, 1024, 8, 32], "", 0, []], [[], [["CI", 4], ["SP", 2, 0, 1, [1, 1, 1, 1], 1], ["SP", 2, 5, 8, [2, 1, 1, 2], 1], ["SP", 2, 10, 32, [1, 1], 1], ["RE", 2, [0, 5, 1, 6, 2, 7, 10, 11, 3, 8, 12, 4, 9]], ["FSP", 5, 0, 1, 3], ["FSP", 5, 4, 2, 3], ["RE", 5, [0, 4, 1, 5, 2, 6, 3, 7]], ["CA", 2, 5, 5], ["CHR", 1, "shared", [2]], ["CA", 2, 3, 6], ["CHR", 0, "shared", [3]], ["CA", 1, 4, 6], ["FU", 7, [0, 1]], ["AN", 7, 0, 5], ["FU", 7, [1, 2]], ["AN", 7, 1, 4], ["FU", 7, [2, 3]], ["AN", 7, 2, 6], ["FU", 3, [0, 1]], ["SP", 3, 0, 2, [2], 1], ["AN", 3, 1, 2], ["FFSP", 3, 0, [2, 1], 1, 1], ["AN", 3, 1, 6], ["FU", 1, [0, 1]], ["SP", 1, 0, 1, [1], 1], ["AN", 1, 1, 2], ["FFSP", 1, 0, [2, 1], 1, 1], ["AN", 1, 1, 6], ["PR", 4, 0, "auto_unroll_max_step$0"]]]], "r": [[9.97191e-06, 9.97205e-06, 9.97383e-06], 0, 2.80624, 1662032900], "v": "v0.6"}
{"i": [["[\"fused_pointwise_conv_bias_add_sigmoid\", 32, 8, 1]", "cuda -keys=cuda,gpu -max_num_threads=1024 -model=unknown -thread_warp_size=32", [-1, 16, 64, 49152, 2147483647, 1024, 8, 32], "", 0, []], [[], [["CI", 4], ["SP", 2, 0, 1, [1, 1, 1, 1], 1], ["SP", 2, 5, 8, [2, 2, 1, 2], 1], ["SP", 2, 10, 32, [16, 1], 1], ["RE", 2, [0, 5, 1, 6, 2, 7, 10, 11, 3, 8, 12, 4, 9]], ["FSP", 5, 0, 1, 3], ["FSP", 5, 4, 2, 3], ["RE", 5, [0, 4, 1, 5, 2, 6, 3, 7]], ["CA", 2, 5, 5], ["CHR", 1, "shared", [2]], ["CA", 2, 3, 6], ["CHR", 0, "shared", [3]], ["CA", 1, 4, 6], ["FU", 7, [0, 1]], ["AN", 7, 0, 5], ["FU", 7, [1, 2]], ["AN", 7, 1, 4], ["FU", 7, [2, 3]], ["AN", 7, 2, 6], ["FU", 3, [0, 1]], ["SP", 3, 0, 32, [4], 1], ["AN", 3, 1, 2], ["FFSP", 3, 0, [2, 1], 1, 1], ["AN", 3, 1, 6], ["FU", 1, [0, 1]], ["SP", 1, 0, 16, [1], 1], ["AN", 1, 1, 2], ["FFSP", 1, 0, [2, 1], 1, 1], ["AN", 1, 1, 6], ["PR", 4, 0, "auto_unroll_max_step$512"]]]], "r": [[6.72826e-06, 6.72773e-06, 6.72769e-06], 0, 3.69923, 1662032902], "v": "v0.6"}
{"i": [["[\"fused_pointwise_conv_bias_add_sigmoid\", 32, 8, 1]", "cuda -keys=cuda,gpu -max_num_threads=1024 -model=unknown -thread_warp_size=32", [-1, 16, 64, 49152, 2147483647, 1024, 8, 32], "", 0, []], [[], [["CI", 4], ["SP", 2, 0, 1, [1, 1, 1, 1], 1], ["SP", 2, 5, 8, [8, 1, 1, 1], 1], ["SP", 2, 10, 32, [32, 1], 1], ["RE", 2, [0, 5, 1, 6, 2, 7, 10, 11, 3, 8, 12, 4, 9]], ["FSP", 5, 0, 1, 3], ["FSP", 5, 4, 2, 3], ["RE", 5, [0, 4, 1, 5, 2, 6, 3, 7]], ["CA", 2, 5, 5], ["CHR", 1, "shared", [2]], ["CA", 2, 3, 6], ["CHR", 0, "shared", [3]], ["CA", 1, 4, 6], ["FU", 7, [0, 1]], ["AN", 7, 0, 5], ["FU", 7, [1, 2]], ["AN", 7, 1, 4], ["FU", 7, [2, 3]], ["AN", 7, 2, 6], ["FU", 3, [0, 1]], ["SP", 3, 0, 16, [1], 1], ["AN", 3, 1, 2], ["FFSP", 3, 0, [2, 1], 1, 1], ["AN", 3, 1, 6], ["FU", 1, [0, 1]], ["SP", 1, 0, 16, [1], 1], ["AN", 1, 1, 2], ["FFSP", 1, 0, [2, 1], 1, 1], ["AN", 1, 1, 6], ["PR", 4, 0, "auto_unroll_max_step$16"]]]], "r": [[1.02905e-05, 1.03028e-05, 1.02973e-05], 0, 6.80739, 1662032905], "v": "v0.6"}
{"i": [["[\"fused_pointwise_conv_bias_add_sigmoid\", 32, 8, 1]", "cuda -keys=cuda,gpu -max_num_threads=1024 -model=unknown -thread_warp_size=32", [-1, 16, 64, 49152, 2147483647, 1024, 8, 32], "", 0, []], [[], [["CI", 4], ["SP", 2, 0, 1, [1, 1, 1, 1], 1], ["SP", 2, 5, 8, [4, 2, 1, 1], 1], ["SP", 2, 10, 32, [8, 4], 1], ["RE", 2, [0, 5, 1, 6, 2, 7, 10, 11, 3, 8, 12, 4, 9]], ["FSP", 5, 0, 1, 3], ["FSP", 5, 4, 2, 3], ["RE", 5, [0, 4, 1, 5, 2, 6, 3, 7]], ["CA", 2, 5, 5], ["CHR", 1, "shared", [2]], ["CA", 2, 3, 6], ["CHR", 0, "shared", [3]], ["CA", 1, 4, 6], ["FU", 7, [0, 1]], ["AN", 7, 0, 5], ["FU", 7, [1, 2]], ["AN", 7, 1, 4], ["FU", 7, [2, 3]], ["AN", 7, 2, 6], ["FU", 3, [0, 1]], ["SP", 3, 0, 8, [1], 1], ["AN", 3, 1, 2], ["FFSP", 3, 0, [2, 1], 1, 1], ["AN", 3, 1, 6], ["FU", 1, [0, 1]], ["SP", 1, 0, 8, [1], 1], ["AN", 1, 1, 2], ["FFSP", 1, 0, [2, 1], 1, 1], ["AN", 1, 1, 6], ["PR", 4, 0, "auto_unroll_max_step$16"]]]], "r": [[7.90514e-06, 7.90344e-06, 7.90204e-06], 0, 2.15345, 1662032900], "v": "v0.6"}
{"i": [["[\"fused_pointwise_conv_bias_add_sigmoid\", 32, 8, 1]", "cuda -keys=cuda,gpu -max_num_threads=1024 -model=unknown -thread_warp_size=32", [-1, 16, 64, 49152, 2147483647, 1024, 8, 32], "", 0, []], [[], [["CI", 4], ["SP", 2, 0, 1, [1, 1, 1, 1], 1], ["SP", 2, 5, 8, [1, 2, 4, 1], 1], ["SP", 2, 10, 32, [16, 1], 1], ["RE", 2, [0, 5, 1, 6, 2, 7, 10, 11, 3, 8, 12, 4, 9]], ["FSP", 5, 0, 1, 3], ["FSP", 5, 4, 2, 3], ["RE", 5, [0, 4, 1, 5, 2, 6, 3, 7]], ["CA", 2, 5, 5], ["CHR", 1, "shared", [2]], ["CA", 2, 3, 6], ["CHR", 0, "shared", [3]], ["CA", 1, 4, 6], ["FU", 7, [0, 1]], ["AN", 7, 0, 5], ["FU", 7, [1, 2]], ["AN", 7, 1, 4], ["FU", 7, [2, 3]], ["AN", 7, 2, 6], ["FU", 3, [0, 1]], ["SP", 3, 0, 64, [1], 1], ["AN", 3, 1, 2], ["FFSP", 3, 0, [2, 1], 1, 1], ["AN", 3, 1, 6], ["FU", 1, [0, 1]], ["SP", 1, 0, 16, [4], 1], ["AN", 1, 1, 2], ["FFSP", 1, 0, [2, 1], 1, 1], ["AN", 1, 1, 6], ["PR", 4, 0, "auto_unroll_max_step$0"]]]], "r": [[7.44033e-06, 7.43936e-06, 7.44055e-06], 0, 7.88169, 1662032906], "v": "v0.6"}
{"i": [["[\"fused_pointwise_conv_bias_add_sigmoid\", 32, 8, 1]", "cuda -keys=cuda,gpu -max_num_threads=1024 -model=unknown -thread_warp_size=32", [-1, 16, 64, 49152, 2147483647, 1024, 8, 32], "", 0, []], [[], [["CI", 4], ["SP", 2, 0, 1, [1, 1, 1, 1], 1], ["SP", 2, 5, 8, [1, 2, 2, 1], 1], ["SP", 2, 10, 32, [32, 1], 1], ["RE", 2, [0, 5, 1, 6, 2, 7, 10, 11, 3, 8, 12, 4, 9]], ["FSP", 5, 0, 1, 3], ["FSP", 5, 4, 2, 3], ["RE", 5, [0, 4, 1, 5, 2, 6, 3, 7]], ["CA", 2, 5, 5], ["CHR", 1, "shared", [2]], ["CA", 2, 3, 6], ["CHR", 0, "shared", [3]], ["CA", 1, 4, 6], ["FU", 7, [0, 1]], ["AN", 7, 0, 5], ["FU", 7, [1, 2]], ["AN", 7, 1, 4], ["FU", 7, [2, 3]], ["AN", 7, 2, 6], ["FU", 3, [0, 1]], ["SP", 3, 0, 64, [1], 1], ["AN", 3, 1, 2], ["FFSP", 3, 0, [2, 1], 1, 1], ["AN", 3, 1, 6], ["FU", 1, [0, 1]], ["SP", 1, 0, 32, [2], 1], ["AN", 1, 1, 2], ["FFSP", 1, 0, [2, 1], 1, 1], ["AN", 1, 1, 6], ["PR", 4, 0, "auto_unroll_max_step$1024"]]]], "r": [[6.27381e-06, 6.27496e-06, 6.27549e-06], 0, 5.16284, 1662032903], "v": "v0.6"}
{"i": [["[\"fused_pointwise_conv_bias_add_sigmoid\", 32, 8, 1]", "cuda -keys=cuda,gpu -max_num_threads=1024 -model=unknown -thread_warp_size=32", [-1, 16, 64, 49152, 2147483647, 1024, 8, 32], "", 0, []], [[], [["CI", 4], ["SP", 2, 0, 1, [1, 1, 1, 1], 1], ["SP", 2, 5, 8, [1, 8, 1, 1], 1], ["SP", 2, 10, 32, [2, 8], 1], ["RE", 2, [0, 5, 1, 6, 2, 7, 10, 11, 3, 8, 12, 4, 9]], ["FSP", 5, 0, 1, 3], ["FSP", 5, 4, 2, 3], ["RE", 5, [0, 4, 1, 5, 2, 6, 3, 7]], ["CA", 2, 5, 5], ["CHR", 1, "shared", [2]], ["CA", 2, 3, 6], ["CHR", 0, "shared", [3]], ["CA", 1, 4, 6], ["FU", 7, [0, 1]], ["AN", 7, 0, 5], ["FU", 7, [1, 2]], ["AN", 7, 1, 4], ["FU", 7, [2, 3]], ["AN", 7, 2, 6], ["FU", 3, [0, 1]], ["SP", 3, 0, 16, [1], 1], ["AN", 3, 1, 2], ["FFSP", 3, 0, [2, 1], 1, 1], ["AN", 3, 1, 6], ["FU", 1, [0, 1]], ["SP", 1, 0, 16, [1], 1], ["AN", 1, 1, 2], ["FFSP", 1, 0, [2, 1], 1, 1], ["AN", 1, 1, 6], ["PR", 4, 0, "auto_unroll_max_step$512"]]]], "r": [[5.30104e-06, 5.30923e-06, 5.2992e-06], 0, 7.13923, 1662032906], "v": "v0.6"}
{"i": [["[\"fused_pointwise_conv_bias_add_sigmoid\", 32, 8, 1]", "cuda -keys=cuda,gpu -max_num_threads=1024 -model=unknown -thread_warp_size=32", [-1, 16, 64, 49152, 2147483647, 1024, 8, 32], "", 0, []], [[], [["CI", 4], ["SP", 2, 0, 1, [1, 1, 1, 1], 1], ["SP", 2, 5, 8, [8, 1, 1, 1], 1], ["SP", 2, 10, 32, [1, 16], 1], ["RE", 2, [0, 5, 1, 6, 2, 7, 10, 11, 3, 8, 12, 4, 9]], ["FSP", 5, 0, 1, 3], ["FSP", 5, 4, 2, 3], ["RE", 5, [0, 4, 1, 5, 2, 6, 3, 7]], ["CA", 2, 5, 5], ["CHR", 1, "shared", [2]], ["CA", 2, 3, 6], ["CHR", 0, "shared", [3]], ["CA", 1, 4, 6], ["FU", 7, [0, 1]], ["AN", 7, 0, 5], ["FU", 7, [1, 2]], ["AN", 7, 1, 4], ["FU", 7, [2, 3]], ["AN", 7, 2, 6], ["FU", 3, [0, 1]], ["SP", 3, 0, 16, [1], 1], ["AN", 3, 1, 2], ["FFSP", 3, 0, [2, 1], 1, 1], ["AN", 3, 1, 6], ["FU", 1, [0, 1]], ["SP", 1, 0, 16, [1], 1], ["AN", 1, 1, 2], ["FFSP", 1, 0, [2, 1], 1, 1], ["AN", 1, 1, 6], ["PR", 4, 0, "auto_unroll_max_step$16"]]]], "r": [[1.34017e-05, 1.34e-05, 1.34021e-05], 0, 8.77415, 1662032907], "v": "v0.6"}
{"i": [["[\"fused_pointwise_conv_bias_add_sigmoid\", 32, 8, 1]", "cuda -keys=cuda,gpu -max_num_threads=1024 -model=unknown -thread_warp_size=32", [-1, 16, 64, 49152, 2147483647, 1024, 8, 32], "", 0, []], [[], [["CI", 4], ["SP", 2, 0, 1, [1, 1, 1, 1], 1], ["SP", 2, 5, 8, [1, 1, 1, 1], 1], ["SP", 2, 10, 32, [1, 2], 1], ["RE", 2, [0, 5, 1, 6, 2, 7, 10, 11, 3, 8, 12, 4, 9]], ["FSP", 5, 0, 1, 3], ["FSP", 5, 4, 2, 3], ["RE", 5, [0, 4, 1, 5, 2, 6, 3, 7]], ["CA", 2, 5, 5], ["CHR", 1, "shared", [2]], ["CA", 2, 3, 6], ["CHR", 0, "shared", [3]], ["CA", 1, 4, 6], ["FU", 7, [0, 1]], ["AN", 7, 0, 5], ["FU", 7, [1, 2]], ["AN", 7, 1, 4], ["FU", 7, [2, 3]], ["AN", 7, 2, 6], ["FU", 3, [0, 1]], ["SP", 3, 0, 4, [4], 1], ["AN", 3, 1, 2], ["FFSP", 3, 0, [2, 1], 1, 1], ["AN", 3, 1, 6], ["FU", 1, [0, 1]], ["SP", 1, 0, 4, [1], 1], ["AN", 1, 1, 2], ["FFSP", 1, 0, [2, 1], 1, 1], ["AN", 1, 1, 6], ["PR", 4, 0, "auto_unroll_max_step$16"]]]], "r": [[8.28734e-06, 8.28796e-06, 8.28749e-06], 0, 5.9767, 1662032904], "v": "v0.6"}
{"i": [["[\"fused_pointwise_conv_bias_add_sigmoid\", 32, 8, 1]", "cuda -keys=cuda,gpu -max_num_threads=1024 -model=unknown -thread_warp_size=32", [-1, 16, 64, 49152, 2147483647, 1024, 8, 32], "", 0, []], [[], [["CI", 4], ["SP", 2, 0, 1, [1, 1, 1, 1], 1], ["SP", 2, 5, 8, [1, 1, 2, 4], 1], ["SP", 2, 10, 32, [8, 1], 1], ["RE", 2, [0, 5, 1, 6, 2, 7, 10, 11, 3, 8, 12, 4, 9]], ["FSP", 5, 0, 1, 3], ["FSP", 5, 4, 2, 3], ["RE", 5, [0, 4, 1, 5, 2, 6, 3, 7]], ["CA", 2, 5, 5], ["CHR", 1, "shared", [2]], ["CA", 2, 3, 6], ["CHR", 0, "shared", [3]], ["CA", 1, 4, 6], ["FU", 7, [0, 1]], ["AN", 7, 0, 5], ["FU", 7, [1, 2]], ["AN", 7, 1, 4], ["FU", 7, [2, 3]], ["AN", 7, 2, 6], ["FU", 3, [0, 1]], ["SP", 3, 0, 64, [1], 1], ["AN", 3, 1, 2], ["FFSP", 3, 0, [2, 1], 1, 1], ["AN", 3, 1, 6], ["FU", 1, [0, 1]], ["SP", 1, 0, 8, [1], 1], ["AN", 1, 1, 2], ["FFSP", 1, 0, [2, 1], 1, 1], ["AN", 1, 1, 6], ["PR", 4, 0, "auto_unroll_max_step$1024"]]]], "r": [[1.42905e-05, 1.43001e-05, 1.43015e-05], 0, 9.7533, 1662032908], "v": "v0.6"}
{"i": [["[\"fused_pointwise_conv_bias_add_sigmoid\", 32, 8, 1]", "cuda -keys=cuda,gpu -max_num_threads=1024 -model=unknown -thread_warp_size=32", [-1, 16, 64, 49152, 2147483647, 1024, 8, 32], "", 0, []], [[], [["CI", 4], ["SP", 2, 0, 1, [1, 1, 1, 1], 1], ["SP", 2, 5, 8, [4, 1, 1, 2], 1], ["SP", 2, 10, 32, [16, 1], 1], ["RE", 2, [0, 5, 1, 6, 2, 7, 10, 11, 3, 8, 12, 4, 9]], ["FSP", 5, 0, 1, 3], ["FSP", 5, 4, 2, 3], ["RE", 5, [0, 4, 1, 5, 2, 6, 3, 7]], ["CA", 2, 5, 5], ["CHR", 1, "shared", [2]], ["CA", 2, 3, 6], ["CHR", 0, "shared", [3]], ["CA", 1, 4, 6], ["FU", 7, [0, 1]], ["AN", 7, 0, 5], ["FU", 7, [1, 2]], ["AN", 7, 1, 4], ["FU", 7, [2, 3]], ["AN", 7, 2, 6], ["FU", 3, [0, 1]], ["SP", 3, 0, 4, [1], 1], ["AN", 3, 1, 2], ["FFSP", 3, 0, [2, 1], 1, 1], ["AN", 3, 1, 6], ["FU", 1, [0, 1]], ["SP", 1, 0, 2, [2], 1], ["AN", 1, 1, 2], ["FFSP", 1, 0, [2, 1], 1, 1], ["AN", 1, 1, 6], ["PR", 4, 0, "auto_unroll_max_step$512"]]]], "r": [[1.37224e-05, 1.37241e-05, 1.37307e-05], 0, 12.3683, 1662032911], "v": "v0.6"}
{"i": [["[\"fused_pointwise_conv_bias_add_sigmoid\", 32, 8, 1]", "cuda -keys=cuda,gpu -max_num_threads=1024 -model=unknown -thread_warp_size=32", [-1, 16, 64, 49152, 2147483647, 1024, 8, 32], "", 0, []], [[], [["CI", 4], ["SP", 2, 0, 1, [1, 1, 1, 1], 1], ["SP", 2, 5, 8, [4, 1, 2, 1], 1], ["SP", 2, 10, 32, [4, 1], 1], ["RE", 2, [0, 5, 1, 6, 2, 7, 10, 11, 3, 8, 12, 4, 9]], ["FSP", 5, 0, 1, 3], ["FSP", 5, 4, 2, 3], ["RE", 5, [0, 4, 1, 5, 2, 6, 3, 7]], ["CA", 2, 5, 5], ["CHR", 1, "shared", [2]], ["CA", 2, 3, 6], ["CHR", 0, "shared", [3]], ["CA", 1, 4, 6], ["FU", 7, [0, 1]], ["AN", 7, 0, 5], ["FU", 7, [1, 2]], ["AN", 7, 1, 4], ["FU", 7, [2, 3]], ["AN", 7, 2, 6], ["FU", 3, [0, 1]], ["SP", 3, 0, 4, [1], 1], ["AN", 3, 1, 2], ["FFSP", 3, 0, [2, 1], 1, 1], ["AN", 3, 1, 6], ["FU", 1, [0, 1]], ["SP", 1, 0, 4, [2], 1], ["AN", 1, 1, 2], ["FFSP", 1, 0, [2, 1], 1, 1], ["AN", 1, 1, 6], ["PR", 4, 0, "auto_unroll_max_step$0"]]]], "r": [[1.26555e-05, 1.26546e-05, 1.26548e-05], 0, 11.584, 1662032910], "v": "v0.6"}
{"i": [["[\"fused_pointwise_conv_bias_add_sigmoid\", 32, 8, 1]", "cuda -keys=cuda,gpu -max_num_threads=1024 -model=unknown -thread_warp_size=32", [-1, 16, 64, 49152, 2147483647, 1024, 8, 32], "", 0, []], [[], [["CI", 4], ["SP", 2, 0, 1, [1, 1, 1, 1], 1], ["SP", 2, 5, 8, [1, 1, 2, 2], 1], ["SP", 2, 10, 32, [1, 2], 1], ["RE", 2, [0, 5, 1, 6, 2, 7, 10, 11, 3, 8, 12, 4, 9]], ["FSP", 5, 0, 1, 3], ["FSP", 5, 4, 2, 3], ["RE", 5, [0, 4, 1, 5, 2, 6, 3, 7]], ["CA", 2, 5, 5], ["CHR", 1, "shared", [2]], ["CA", 2, 3, 6], ["CHR", 0, "shared", [3]], ["CA", 1, 4, 6], ["FU", 7, [0, 1]], ["AN", 7, 0, 5], ["FU", 7, [1, 2]], ["AN", 7, 1, 4], ["FU", 7, [2, 3]], ["AN", 7, 2, 6], ["FU", 3, [0, 1]], ["SP", 3, 0, 8, [1], 1], ["AN", 3, 1, 2], ["FFSP", 3, 0, [2, 1], 1, 1], ["AN", 3, 1, 6], ["FU", 1, [0, 1]], ["SP", 1, 0, 2, [1], 1], ["AN", 1, 1, 2], ["FFSP", 1, 0, [2, 1], 1, 1], ["AN", 1, 1, 6], ["PR", 4, 0, "auto_unroll_max_step$512"]]]], "r": [[9.9323e-06, 9.92523e-06, 9.92452e-06], 0, 10.0281, 1662032909], "v": "v0.6"}
{"i": [["[\"fused_pointwise_conv_bias_add_sigmoid\", 32, 8, 1]", "cuda -keys=cuda,gpu -max_num_threads=1024 -model=unknown -thread_warp_size=32", [-1, 16, 64, 49152, 2147483647, 1024, 8, 32], "", 0, []], [[], [["CI", 4], ["SP", 2, 0, 1, [1, 1, 1, 1], 1], ["SP", 2, 5, 8, [1, 1, 1, 1], 1], ["SP", 2, 10, 32, [16, 2], 1], ["RE", 2, [0, 5, 1, 6, 2, 7, 10, 11, 3, 8, 12, 4, 9]], ["FSP", 5, 0, 1, 3], ["FSP", 5, 4, 2, 3], ["RE", 5, [0, 4, 1, 5, 2, 6, 3, 7]], ["CA", 2, 5, 5], ["CHR", 1, "shared", [2]], ["CA", 2, 3, 6], ["CHR", 0, "shared", [3]], ["CA", 1, 4, 6], ["FU", 7, [0, 1]], ["AN", 7, 0, 5], ["FU", 7, [1, 2]], ["AN", 7, 1, 4], ["FU", 7, [2, 3]], ["AN", 7, 2, 6], ["FU", 3, [0, 1]], ["SP", 3, 0, 16, [4], 1], ["AN", 3, 1, 2], ["FFSP", 3, 0, [2, 1], 1, 1], ["AN", 3, 1, 6], ["FU", 1, [0, 1]], ["SP", 1, 0, 8, [1], 1], ["AN", 1, 1, 2], ["FFSP", 1, 0, [2, 1], 1, 1], ["AN", 1, 1, 6], ["PR", 4, 0, "auto_unroll_max_step$1024"]]]], "r": [[5.62372e-06, 5.6242e-06, 5.62596e-06], 0, 10.4341, 1662032909], "v": "v0.6"}
{"i": [["[\"fused_pointwise_conv_bias_add_sigmoid\", 32, 8, 1]", "cuda -keys=cuda,gpu -max_num_threads=1024 -model=unknown -thread_warp_size=32", [-1, 16, 64, 49152, 2147483647, 1024, 8, 32], "", 0, []], [[], [["CI", 4], ["SP", 2, 0, 1, [1, 1, 1, 1], 1], ["SP", 2, 5, 8, [1, 4, 1, 1], 1], ["SP", 2, 10, 32, [8, 4], 1], ["RE", 2, [0, 5, 1, 6, 2, 7, 10, 11, 3, 8, 12, 4, 9]], ["FSP", 5, 0, 1, 3], ["FSP", 5, 4, 2, 3], ["RE", 5, [0, 4, 1, 5, 2, 6, 3, 7]], ["CA", 2, 5, 5], ["CHR", 1, "shared", [2]], ["CA", 2, 3, 6], ["CHR", 0, "shared", [3]], ["CA", 1, 4, 6], ["FU", 7, [0, 1]], ["AN", 7, 0, 5], ["FU", 7, [1, 2]], ["AN", 7, 1, 4], ["FU", 7, [2, 3]], ["AN", 7, 2, 6], ["FU", 3, [0, 1]], ["SP", 3, 0, 64, [1], 1], ["AN", 3, 1, 2], ["FFSP", 3, 0, [2, 1], 1, 1], ["AN", 3, 1, 6], ["FU", 1, [0, 1]], ["SP", 1, 0, 32, [1], 1], ["AN", 1, 1, 2], ["FFSP", 1, 0, [2, 1], 1, 1], ["AN", 1, 1, 6], ["PR", 4, 0, "auto_unroll_max_step$0"]]]], "r": [[5.60878e-06, 5.60806e-06, 5.60865e-06], 0, 12.8006, 1662032911], "v": "v0.6"}
{"i": [["[\"fused_pointwise_conv_bias_add_sigmoid\", 32, 8, 1]", "cuda -keys=cuda,gpu -max_num_threads=1024 -model=unknown -thread_warp_size=32", [-1, 16, 64, 49152, 2147483647, 1024, 8, 32], "", 0, []], [[], [["CI", 4], ["SP", 2, 0, 1, [1, 1, 1, 1], 1], ["SP", 2, 5, 8, [1, 1, 2, 2], 1], ["SP", 2, 10, 32, [16, 1], 1], ["RE", 2, [0, 5, 1, 6, 2, 7, 10, 11, 3, 8, 12, 4, 9]], ["FSP", 5, 0, 1, 3], ["FSP", 5, 4, 2, 3], ["RE", 5, [0, 4, 1, 5, 2, 6, 3, 7]], ["CA", 2, 5, 5], ["CHR", 1, "shared", [2]], ["CA", 2, 3, 6], ["CHR", 0, "shared", [3]], ["CA", 1, 4, 6], ["FU", 7, [0, 1]], ["AN", 7, 0, 5], ["FU", 7, [1, 2]], ["AN", 7, 1, 4], ["FU", 7, [2, 3]], ["AN", 7, 2, 6], ["FU", 3, [0, 1]], ["SP", 3, 0, 64, [4], 1], ["AN", 3, 1, 2], ["FFSP", 3, 0, [2, 1], 1, 1], ["AN", 3, 1, 6], ["FU", 1, [0, 1]], ["SP", 1, 0, 16, [4], 1], ["AN", 1, 1, 2], ["FFSP", 1, 0, [2, 1], 1, 1], ["AN", 1, 1, 6], ["PR", 4, 0, "auto_unroll_max_step$1024"]]]], "r": [[8.12429e-06, 8.12385e-06, 8.12435e-06], 0, 14.963, 1662032914], "v": "v0.6"}
{"i": [["[\"fused_pointwise_conv_bias_add_sigmoid\", 32, 8, 1]", "cuda -keys=cuda,gpu -max_num_threads=1024 -model=unknown -thread_warp_size=32", [-1, 16, 64, 49152, 2147483647, 1024, 8, 32], "", 0, []], [[], [["CI", 4], ["SP", 2, 0, 1, [1, 1, 1, 1], 1], ["SP", 2, 5, 8, [2, 1, 2, 2], 1], ["SP", 2, 10, 32, [8, 2], 1], ["RE", 2, [0, 5, 1, 6, 2, 7, 10, 11, 3, 8, 12, 4, 9]], ["FSP", 5, 0, 1, 3], ["FSP", 5, 4, 2, 3], ["RE", 5, [0, 4, 1, 5, 2, 6, 3, 7]], ["CA", 2, 5, 5], ["CHR", 1, "shared", [2]], ["CA", 2, 3, 6], ["CHR", 0, "shared", [3]], ["CA", 1, 4, 6], ["FU", 7, [0, 1]], ["AN", 7, 0, 5], ["FU", 7, [1, 2]], ["AN", 7, 1, 4], ["FU", 7, [2, 3]], ["AN", 7, 2, 6], ["FU", 3, [0, 1]], ["SP", 3, 0, 64, [1], 1], ["AN", 3, 1, 2], ["FFSP", 3, 0, [2, 1], 1, 1], ["AN", 3, 1, 6], ["FU", 1, [0, 1]], ["SP", 1, 0, 16, [2], 1], ["AN", 1, 1, 2], ["FFSP", 1, 0, [2, 1], 1, 1], ["AN", 1, 1, 6], ["PR", 4, 0, "auto_unroll_max_step$16"]]]], "r": [[1.33059e-05, 1.33054e-05, 1.33047e-05], 0, 13.4107, 1662032912], "v": "v0.6"}
{"i": [["[\"fused_pointwise_conv_bias_add_sigmoid\", 32, 8, 1]", "cuda -keys=cuda,gpu -max_num_threads=1024 -model=unknown -thread_warp_size=32", [-1, 16, 64, 49152, 2147483647, 1024, 8, 32], "", 0, []], [[], [["CI", 4], ["SP", 2, 0, 1, [1, 1, 1, 1], 1], ["SP", 2, 5, 8, [1, 2, 4, 1], 1], ["SP", 2, 10, 32, [1, 1], 1], ["RE", 2, [0, 5, 1, 6, 2, 7, 10, 11, 3, 8, 12, 4, 9]], ["FSP", 5, 0, 1, 3], ["FSP", 5, 4, 2, 3], ["RE", 5, [0, 4, 1, 5, 2, 6, 3, 7]], ["CA", 2, 5, 5], ["CHR", 1, "shared", [2]], ["CA", 2, 3, 6], ["CHR", 0, "shared", [3]], ["CA", 1, 4, 6], ["FU", 7, [0, 1]], ["AN", 7, 0, 5], ["FU", 7, [1, 2]], ["AN", 7, 1, 4], ["FU", 7, [2, 3]], ["AN", 7, 2, 6], ["FU", 3, [0, 1]], ["SP", 3, 0, 8, [1], 1], ["AN", 3, 1, 2], ["FFSP", 3, 0, [2, 1], 1, 1], ["AN", 3, 1, 6], ["FU", 1, [0, 1]], ["SP", 1, 0, 1, [1], 1], ["AN", 1, 1, 2], ["FFSP", 1, 0, [2, 1], 1, 1], ["AN", 1, 1, 6], ["PR", 4, 0, "auto_unroll_max_step$512"]]]], "r": [[1.00565e-05, 1.00564e-05, 1.00577e-05], 0, 14.5459, 1662032913], "v": "v0.6"}
{"i": [["[\"fused_pointwise_conv_bias_add_sigmoid\", 32, 8, 1]", "cuda -keys=cuda,gpu -max_num_threads=1024 -model=unknown -thread_warp_size=32", [-1, 16, 64, 49152, 2147483647, 1024, 8, 32], "", 0, []], [[], [["CI", 4], ["SP", 2, 0, 1, [1, 1, 1, 1], 1], ["SP", 2, 5, 8, [4, 1, 1, 2], 1], ["SP", 2, 10, 32, [4, 1], 1], ["RE", 2, [0, 5, 1, 6, 2, 7, 10, 11, 3, 8, 12, 4, 9]], ["FSP", 5, 0, 1, 3], ["FSP", 5, 4, 2, 3], ["RE", 5, [0, 4, 1, 5, 2, 6, 3, 7]], ["CA", 2, 5, 5], ["CHR", 1, "shared", [2]], ["CA", 2, 3, 6], ["CHR", 0, "shared", [3]], ["CA", 1, 4, 6], ["FU", 7, [0, 1]], ["AN", 7, 0, 5], ["FU", 7, [1, 2]], ["AN", 7, 1, 4], ["FU", 7, [2, 3]], ["AN", 7, 2, 6], ["FU", 3, [0, 1]], ["SP", 3, 0, 8, [1], 1], ["AN", 3, 1, 2], ["FFSP", 3, 0, [2, 1], 1, 1], ["AN", 3, 1, 6], ["FU", 1, [0, 1]], ["SP", 1, 0, 4, [4], 1], ["AN", 1, 1, 2], ["FFSP", 1, 0, [2, 1], 1, 1], ["AN", 1, 1, 6], ["PR", 4, 0, "auto_unroll_max_step$0"]]]], "r": [[1.19139e-05, 1.19017e-05, 1.19062e-05], 0, 15.6525, 1662032914], "v": "v0.6"}
{"i": [["[\"fused_pointwise_conv_bias_add_sigmoid\", 32, 8, 1]", "cuda -keys=cuda,gpu -max_num_threads=1024 -model=unknown -thread_warp_size=32", [-1, 16, 64, 49152, 2147483647, 1024, 8, 32], "", 0, []], [[], [["CI", 4], ["SP", 2, 0, 1, [1, 1, 1, 1], 1], ["SP", 2, 5, 8, [1, 4, 1, 2], 1], ["SP", 2, 10, 32, [32, 1], 1], ["RE", 2, [0, 5, 1, 6, 2, 7, 10, 11, 3, 8, 12, 4, 9]], ["FSP", 5, 0, 1, 3], ["FSP", 5, 4, 2, 3], ["RE", 5, [0, 4, 1, 5, 2, 6, 3, 7]], ["CA", 2, 5, 5], ["CHR", 1, "shared", [2]], ["CA", 2, 3, 6], ["CHR", 0, "shared", [3]], ["CA", 1, 4, 6], ["FU", 7, [0, 1]], ["AN", 7, 0, 5], ["FU", 7, [1, 2]], ["AN", 7, 1, 4], ["FU", 7, [2, 3]], ["AN", 7, 2, 6], ["FU", 3, [0, 1]], ["SP", 3, 0, 8, [4], 1], ["AN", 3, 1, 2], ["FFSP", 3, 0, [2, 1], 1, 1], ["AN", 3, 1, 6], ["FU", 1, [0, 1]], ["SP", 1, 0, 4, [4], 1], ["AN", 1, 1, 2], ["FFSP", 1, 0, [2, 1], 1, 1], ["AN", 1, 1, 6], ["PR", 4, 0, "auto_unroll_max_step$512"]]]], "r": [[5.39376e-06, 5.3929e-06, 5.39368e-06], 0, 16.8335, 1662032915], "v": "v0.6"}
{"i": [["[\"fused_pointwise_conv_bias_add_sigmoid\", 32, 8, 1]", "cuda -keys=cuda,gpu -max_num_threads=1024 -model=unknown -thread_warp_size=32", [-1, 16, 64, 49152, 2147483647, 1024, 8, 32], "", 0, []], [[], [["CI", 4], ["SP", 2, 0, 1, [1, 1, 1, 1], 1], ["SP", 2, 5, 8, [1, 2, 1, 2], 1], ["SP", 2, 10, 32, [8, 4], 1], ["RE", 2, [0, 5, 1, 6, 2, 7, 10, 11, 3, 8, 12, 4, 9]], ["FSP", 5, 0, 1, 3], ["FSP", 5, 4, 2, 3], ["RE", 5, [0, 4, 1, 5, 2, 6, 3, 7]], ["CA", 2, 5, 5], ["CHR", 1, "shared", [2]], ["CA", 2, 3, 6], ["CHR", 0, "shared", [3]], ["CA", 1, 4, 6], ["FU", 7, [0, 1]], ["AN", 7, 0, 5], ["FU", 7, [1, 2]], ["AN", 7, 1, 4], ["FU", 7, [2, 3]], ["AN", 7, 2, 6], ["FU", 3, [0, 1]], ["SP", 3, 0, 32, [2], 1], ["AN", 3, 1, 2], ["FFSP", 3, 0, [2, 1], 1, 1], ["AN", 3, 1, 6], ["FU", 1, [0, 1]], ["SP", 1, 0, 16, [4], 1], ["AN", 1, 1, 2], ["FFSP", 1, 0, [2, 1], 1, 1], ["AN", 1, 1, 6], ["PR", 4, 0, "auto_unroll_max_step$0"]]]], "r": [[6.12295e-06, 6.12532e-06, 6.12397e-06], 0, 16.117, 1662032915], "v": "v0.6"}
{"i": [["[\"fused_pointwise_conv_bias_add_sigmoid\", 32, 8, 1]", "cuda -keys=cuda,gpu -max_num_threads=1024 -model=unknown -thread_warp_size=32", [-1, 16, 64, 49152, 2147483647, 1024, 8, 32], "", 0, []], [[], [["CI", 4], ["SP", 2, 0, 1, [1, 1, 1, 1], 1], ["SP", 2, 5, 8, [1, 1, 1, 4], 1], ["SP", 2, 10, 32, [16, 1], 1], ["RE", 2, [0, 5, 1, 6, 2, 7, 10, 11, 3, 8, 12, 4, 9]], ["FSP", 5, 0, 1, 3], ["FSP", 5, 4, 2, 3], ["RE", 5, [0, 4, 1, 5, 2, 6, 3, 7]], ["CA", 2, 5, 5], ["CHR", 1, "shared", [2]], ["CA", 2, 3, 6], ["CHR", 0, "shared", [3]], ["CA", 1, 4, 6], ["FU", 7, [0, 1]], ["AN", 7, 0, 5], ["FU", 7, [1, 2]], ["AN", 7, 1, 4], ["FU", 7, [2, 3]], ["AN", 7, 2, 6], ["FU", 3, [0, 1]], ["SP", 3, 0, 64, [1], 1], ["AN", 3, 1, 2], ["FFSP", 3, 0, [2, 1], 1, 1], ["AN", 3, 1, 6], ["FU", 1, [0, 1]], ["SP", 1, 0, 16, [1], 1], ["AN", 1, 1, 2], ["FFSP", 1, 0, [2, 1], 1, 1], ["AN", 1, 1, 6], ["PR", 4, 0, "auto_unroll_max_step$512"]]]], "r": [[1.00301e-05, 1.00367e-05, 1.00369e-05], 0, 17.9807, 1662032917], "v": "v0.6"}
{"i": [["[\"fused_pointwise_conv_bias_add_sigmoid\", 32, 8, 1]", "cuda -keys=cuda,gpu -max_num_threads=1024 -model=unknown -thread_warp_size=32", [-1, 16, 64, 49152, 2147483647, 1024, 8, 32], "", 0, []], [[], [["CI", 4], ["SP", 2, 0, 1, [1, 1, 1, 1], 1], ["SP", 2, 5, 8, [1, 1, 4, 1], 1], ["SP", 2, 10, 32, [4, 1], 1], ["RE", 2, [0, 5, 1, 6, 2, 7, 10, 11, 3, 8, 12, 4, 9]], ["FSP", 5, 0, 1, 3], ["FSP", 5, 4, 2, 3], ["RE", 5, [0, 4, 1, 5, 2, 6, 3, 7]], ["CA", 2, 5, 5], ["CHR", 1, "shared", [2]], ["CA", 2, 3, 6], ["CHR", 0, "shared", [3]], ["CA", 1, 4, 6], ["FU", 7, [0, 1]], ["AN", 7, 0, 5], ["FU", 7, [1, 2]], ["AN", 7, 1, 4], ["FU", 7, [2, 3]], ["AN", 7, 2, 6], ["FU", 3, [0, 1]], ["SP", 3, 0, 64, [2], 1], ["AN", 3, 1, 2], ["FFSP", 3, 0, [2, 1], 1, 1], ["AN", 3, 1, 6], ["FU", 1, [0, 1]], ["SP", 1, 0, 32, [8], 1], ["AN", 1, 1, 2], ["FFSP", 1, 0, [2, 1], 1, 1], ["AN", 1, 1, 6], ["PR", 4, 0, "auto_unroll_max_step$0"]]]], "r": [[8.84654e-06, 8.84552e-06, 8.84758e-06], 0, 13.6231, 1662032913], "v": "v0.6"}
{"i": [["[\"fused_pointwise_conv_bias_add_sigmoid\", 32, 8, 1]", "cuda -keys=cuda,gpu -max_num_threads=1024 -model=unknown -thread_warp_size=32", [-1, 16, 64, 49152, 2147483647, 1024, 8, 32], "", 0, []], [[], [["CI", 4], ["SP", 2, 0, 1, [1, 1, 1, 1], 1], ["SP", 2, 5, 8, [1, 2, 1, 1], 1], ["SP", 2, 10, 32, [16, 1], 1], ["RE", 2, [0, 5, 1, 6, 2, 7, 10, 11, 3, 8, 12, 4, 9]], ["FSP", 5, 0, 1, 3], ["FSP", 5, 4, 2, 3], ["RE", 5, [0, 4, 1, 5, 2, 6, 3, 7]], ["CA", 2, 5, 5], ["CHR", 1, "shared", [2]], ["CA", 2, 3, 6], ["CHR", 0, "shared", [3]], ["CA", 1, 4, 6], ["FU", 7, [0, 1]], ["AN", 7, 0, 5], ["FU", 7, [1, 2]], ["AN", 7, 1, 4], ["FU", 7, [2, 3]], ["AN", 7, 2, 6], ["FU", 3, [0, 1]], ["SP", 3, 0, 16, [2], 1], ["AN", 3, 1, 2], ["FFSP", 3, 0, [2, 1], 1, 1], ["AN", 3, 1, 6], ["FU", 1, [0, 1]], ["SP", 1, 0, 16, [1], 1], ["AN", 1, 1, 2], ["FFSP", 1, 0, [2, 1], 1, 1], ["AN", 1, 1, 6], ["PR", 4, 0, "auto_unroll_max_step$1024"]]]], "r": [[5.73338e-06, 5.73424e-06, 5.73385e-06], 0, 17.2296, 1662032916], "v": "v0.6"}
{"i": [["[\"fused_pointwise_conv_bias_add_sigmoid\", 32, 8, 1]", "cuda -keys=cuda,gpu -max_num_threads=1024 -model=unknown -thread_warp_size=32", [-1, 16, 64, 49152, 2147483647, 1024, 8, 32], "", 0, []], [[], [["CI", 4], ["SP", 2, 0, 1, [1, 1, 1, 1], 1], ["SP", 2, 5, 8, [1, 2, 1, 2], 1], ["SP", 2, 10, 32, [1, 1], 1], ["RE", 2, [0, 5, 1, 6, 2, 7, 10, 11, 3, 8, 12, 4, 9]], ["FSP", 5, 0, 1, 3], ["FSP", 5, 4, 2, 3], ["RE", 5, [0, 4, 1, 5, 2, 6, 3, 7]], ["CA", 2, 5, 5], ["CHR", 1, "shared", [2]], ["CA", 2, 3, 6], ["CHR", 0, "shared", [3]], ["CA", 1, 4, 6], ["FU", 7, [0, 1]], ["AN", 7, 0, 5], ["FU", 7, [1, 2]], ["AN", 7, 1, 4], ["FU", 7, [2, 3]], ["AN", 7, 2, 6], ["FU", 3, [0, 1]], ["SP", 3, 0, 4, [1], 1], ["AN", 3, 1, 2], ["FFSP", 3, 0, [2, 1], 1, 1], ["AN", 3, 1, 6], ["FU", 1, [0, 1]], ["SP", 1, 0, 2, [1], 1], ["AN", 1, 1, 2], ["FFSP", 1, 0, [2, 1], 1, 1], ["AN", 1, 1, 6], ["PR", 4, 0, "auto_unroll_max_step$64"]]]], "r": [[8.59559e-06, 8.59652e-06, 8.59555e-06], 0, 19.498, 1662032918], "v": "v0.6"}
{"i": [["[\"fused_pointwise_conv_bias_add_sigmoid\", 32, 8, 1]", "cuda -keys=cuda,gpu -max_num_threads=1024 -model=unknown -thread_warp_size=32", [-1, 16, 64, 49152, 2147483647, 1024, 8, 32], "", 0, []], [[], [["CI", 4], ["SP", 2, 0, 1, [1, 1, 1, 1], 1], ["SP", 2, 5, 8, [2, 1, 1, 1], 1], ["SP", 2, 10, 32, [32, 1], 1], ["RE", 2, [0, 5, 1, 6, 2, 7, 10, 11, 3, 8, 12, 4, 9]], ["FSP", 5, 0, 1, 3], ["FSP", 5, 4, 2, 3], ["RE", 5, [0, 4, 1, 5, 2, 6, 3, 7]], ["CA", 2, 5, 5], ["CHR", 1, "shared", [2]], ["CA", 2, 3, 6], ["CHR", 0, "shared", [3]], ["CA", 1, 4, 6], ["FU", 7, [0, 1]], ["AN", 7, 0, 5], ["FU", 7, [1, 2]], ["AN", 7, 1, 4], ["FU", 7, [2, 3]], ["AN", 7, 2, 6], ["FU", 3, [0, 1]], ["SP", 3, 0, 32, [1], 1], ["AN", 3, 1, 2], ["FFSP", 3, 0, [2, 1], 1, 1], ["AN", 3, 1, 6], ["FU", 1, [0, 1]], ["SP", 1, 0, 32, [1], 1], ["AN", 1, 1, 2], ["FFSP", 1, 0, [2, 1], 1, 1], ["AN", 1, 1, 6], ["PR", 4, 0, "auto_unroll_max_step$512"]]]], "r": [[6.81247e-06, 6.81314e-06, 6.81463e-06], 0, 18.3131, 1662032917], "v": "v0.6"}
{"i": [["[\"fused_pointwise_conv_bias_add_sigmoid\", 32, 8, 1]", "cuda -keys=cuda,gpu -max_num_threads=1024 -model=unknown -thread_warp_size=32", [-1, 16, 64, 49152, 2147483647, 1024, 8, 32], "", 0, []], [[], [["CI", 4], ["SP", 2, 0, 1, [1, 1, 1, 1], 1], ["SP", 2, 5, 8, [1, 1, 1, 1], 1], ["SP", 2, 10, 32, [32, 1], 1], ["RE", 2, [0, 5, 1, 6, 2, 7, 10, 11, 3, 8, 12, 4, 9]], ["FSP", 5, 0, 1, 3], ["FSP", 5, 4, 2, 3], ["RE", 5, [0, 4, 1, 5, 2, 6, 3, 7]], ["CA", 2, 5, 5], ["CHR", 1, "shared", [2]], ["CA", 2, 3, 6], ["CHR", 0, "shared", [3]], ["CA", 1, 4, 6], ["FU", 7, [0, 1]], ["AN", 7, 0, 5], ["FU", 7, [1, 2]], ["AN", 7, 1, 4], ["FU", 7, [2, 3]], ["AN", 7, 2, 6], ["FU", 3, [0, 1]], ["SP", 3, 0, 32, [1], 1], ["AN", 3, 1, 2], ["FFSP", 3, 0, [2, 1], 1, 1], ["AN", 3, 1, 6], ["FU", 1, [0, 1]], ["SP", 1, 0, 32, [1], 1], ["AN", 1, 1, 2], ["FFSP", 1, 0, [2, 1], 1, 1], ["AN", 1, 1, 6], ["PR", 4, 0, "auto_unroll_max_step$16"]]]], "r": [[6.18782e-06, 6.18795e-06, 6.18836e-06], 0, 18.6678, 1662032918], "v": "v0.6"}
{"i": [["[\"fused_pointwise_conv_bias_add_sigmoid\", 32, 8, 1]", "cuda -keys=cuda,gpu -max_num_threads=1024 -model=unknown -thread_warp_size=32", [-1, 16, 64, 49152, 2147483647, 1024, 8, 32], "", 0, []], [[], [["CI", 4], ["SP", 2, 0, 1, [1, 1, 1, 1], 1], ["SP", 2, 5, 8, [1, 8, 1, 1], 1], ["SP", 2, 10, 32, [1, 4], 1], ["RE", 2, [0, 5, 1, 6, 2, 7, 10, 11, 3, 8, 12, 4, 9]], ["FSP", 5, 0, 1, 3], ["FSP", 5, 4, 2, 3], ["RE", 5, [0, 4, 1, 5, 2, 6, 3, 7]], ["CA", 2, 5, 5], ["CHR", 1, "shared", [2]], ["CA", 2, 3, 6], ["CHR", 0, "shared", [3]], ["CA", 1, 4, 6], ["FU", 7, [0, 1]], ["AN", 7, 0, 5], ["FU", 7, [1, 2]], ["AN", 7, 1, 4], ["FU", 7, [2, 3]], ["AN", 7, 2, 6], ["FU", 3, [0, 1]], ["SP", 3, 0, 16, [2], 1], ["AN", 3, 1, 2], ["FFSP", 3, 0, [2, 1], 1, 1], ["AN", 3, 1, 6], ["FU", 1, [0, 1]], ["SP", 1, 0, 16, [1], 1], ["AN", 1, 1, 2], ["FFSP", 1, 0, [2, 1], 1, 1], ["AN", 1, 1, 6], ["PR", 4, 0, "auto_unroll_max_step$512"]]]], "r": [[5.25373e-06, 5.25567e-06, 5.25437e-06], 0, 21.0856, 1662032920], "v": "v0.6"}
{"i": [["[\"fused_pointwise_conv_bias_add_sigmoid\", 32, 8, 1]", "cuda -keys=cuda,gpu -max_num_threads=1024 -model=unknown -thread_warp_size=32", [-1, 16, 64, 49152, 2147483647, 1024, 8, 32], "", 0, []], [[], [["CI", 4], ["SP", 2, 0, 1, [1, 1, 1, 1], 1], ["SP", 2, 5, 8, [1, 4, 1, 1], 1], ["SP", 2, 10, 32, [1, 16], 1], ["RE", 2, [0, 5, 1, 6, 2, 7, 10, 11, 3, 8, 12, 4, 9]], ["FSP", 5, 0, 1, 3], ["FSP", 5, 4, 2, 3], ["RE", 5, [0, 4, 1, 5, 2, 6, 3, 7]], ["CA", 2, 5, 5], ["CHR", 1, "shared", [2]], ["CA", 2, 3, 6], ["CHR", 0, "shared", [3]], ["CA", 1, 4, 6], ["FU", 7, [0, 1]], ["AN", 7, 0, 5], ["FU", 7, [1, 2]], ["AN", 7, 1, 4], ["FU", 7, [2, 3]], ["AN", 7, 2, 6], ["FU", 3, [0, 1]], ["SP", 3, 0, 16, [1], 1], ["AN", 3, 1, 2], ["FFSP", 3, 0, [2, 1], 1, 1], ["AN", 3, 1, 6], ["FU", 1, [0, 1]], ["SP", 1, 0, 16, [1], 1], ["AN", 1, 1, 2], ["FFSP", 1, 0, [2, 1], 1, 1], ["AN", 1, 1, 6], ["PR", 4, 0, "auto_unroll_max_step$512"]]]], "r": [[5.46312e-06, 5.46979e-06, 5.46622e-06], 0, 21.6821, 1662032921], "v": "v0.6"}
{"i": [["[\"fused_pointwise_conv_bias_add_sigmoid\", 32, 8, 1]", "cuda -keys=cuda,gpu -max_num_threads=1024 -model=unknown -thread_warp_size=32", [-1, 16, 64, 49152, 2147483647, 1024, 8, 32], "", 0, []], [[], [["CI", 4], ["SP", 2, 0, 1, [1, 1, 1, 1], 1], ["SP", 2, 5, 8, [1, 1, 4, 1], 1], ["SP", 2, 10, 32, [1, 32], 1], ["RE", 2, [0, 5, 1, 6, 2, 7, 10, 11, 3, 8, 12, 4, 9]], ["FSP", 5, 0, 1, 3], ["FSP", 5, 4, 2, 3], ["RE", 5, [0, 4, 1, 5, 2, 6, 3, 7]], ["CA", 2, 5, 5], ["CHR", 1, "shared", [2]], ["CA", 2, 3, 6], ["CHR", 0, "shared", [3]], ["CA", 1, 4, 6], ["FU", 7, [0, 1]], ["AN", 7, 0, 5], ["FU", 7, [1, 2]], ["AN", 7, 1, 4], ["FU", 7, [2, 3]], ["AN", 7, 2, 6], ["FU", 3, [0, 1]], ["SP", 3, 0, 128, [4], 1], ["AN", 3, 1, 2], ["FFSP", 3, 0, [2, 1], 1, 1], ["AN", 3, 1, 6], ["FU", 1, [0, 1]], ["SP", 1, 0, 32, [1], 1], ["AN", 1, 1, 2], ["FFSP", 1, 0, [2, 1], 1, 1], ["AN", 1, 1, 6], ["PR", 4, 0, "auto_unroll_max_step$0"]]]], "r": [[8.27134e-06, 8.27594e-06, 8.2725e-06], 0, 20.0041, 1662032919], "v": "v0.6"}
{"i": [["[\"fused_pointwise_conv_bias_add_sigmoid\", 32, 8, 1]", "cuda -keys=cuda,gpu -max_num_threads=1024 -model=unknown -thread_warp_size=32", [-1, 16, 64, 49152, 2147483647, 1024, 8, 32], "", 0, []], [[], [["CI", 4], ["SP", 2, 0, 1, [1, 1, 1, 1], 1], ["SP", 2, 5, 8, [2, 2, 1, 2], 1], ["SP", 2, 10, 32, [4, 2], 1], ["RE", 2, [0, 5, 1, 6, 2, 7, 10, 11, 3, 8, 12, 4, 9]], ["FSP", 5, 0, 1, 3], ["FSP", 5, 4, 2, 3], ["RE", 5, [0, 4, 1, 5, 2, 6, 3, 7]], ["CA", 2, 5, 5], ["CHR", 1, "shared", [2]], ["CA", 2, 3, 6], ["CHR", 0, "shared", [3]], ["CA", 1, 4, 6], ["FU", 7, [0, 1]], ["AN", 7, 0, 5], ["FU", 7, [1, 2]], ["AN", 7, 1, 4], ["FU", 7, [2, 3]], ["AN", 7, 2, 6], ["FU", 3, [0, 1]], ["SP", 3, 0, 16, [1], 1], ["AN", 3, 1, 2], ["FFSP", 3, 0, [2, 1], 1, 1], ["AN", 3, 1, 6], ["FU", 1, [0, 1]], ["SP", 1, 0, 8, [2], 1], ["AN", 1, 1, 2], ["FFSP", 1, 0, [2, 1], 1, 1], ["AN", 1, 1, 6], ["PR", 4, 0, "auto_unroll_max_step$512"]]]], "r": [[7.92454e-06, 7.92443e-06, 7.92327e-06], 0, 24.1365, 1662032923], "v": "v0.6"}
{"i": [["[\"fused_pointwise_conv_bias_add_sigmoid\", 32, 8, 1]", "cuda -keys=cuda,gpu -max_num_threads=1024 -model=unknown -thread_warp_size=32", [-1, 16, 64, 49152, 2147483647, 1024, 8, 32], "", 0, []], [[], [["CI", 4], ["SP", 2, 0, 1, [1, 1, 1, 1], 1], ["SP", 2, 5, 8, [1, 8, 1, 1], 1], ["SP", 2, 10, 32, [4, 8], 1], ["RE", 2, [0, 5, 1, 6, 2, 7, 10, 11, 3, 8, 12, 4, 9]], ["FSP", 5, 0, 1, 3], ["FSP", 5, 4, 2, 3], ["RE", 5, [0, 4, 1, 5, 2, 6, 3, 7]], ["CA", 2, 5, 5], ["CHR", 1, "shared", [2]], ["CA", 2, 3, 6], ["CHR", 0, "shared", [3]], ["CA", 1, 4, 6], ["FU", 7, [0, 1]], ["AN", 7, 0, 5], ["FU", 7, [1, 2]], ["AN", 7, 1, 4], ["FU", 7, [2, 3]], ["AN", 7, 2, 6], ["FU", 3, [0, 1]], ["SP", 3, 0, 8, [4], 1], ["AN", 3, 1, 2], ["FFSP", 3, 0, [2, 1], 1, 1], ["AN", 3, 1, 6], ["FU", 1, [0, 1]], ["SP", 1, 0, 8, [1], 1], ["AN", 1, 1, 2], ["FFSP", 1, 0, [2, 1], 1, 1], ["AN", 1, 1, 6], ["PR", 4, 0, "auto_unroll_max_step$1024"]]]], "r": [[4.61945e-06, 4.61906e-06, 4.61913e-06], 0, 20.4153, 1662032919], "v": "v0.6"}
{"i": [["[\"fused_pointwise_conv_bias_add_sigmoid\", 32, 8, 1]", "cuda -keys=cuda,gpu -max_num_threads=1024 -model=unknown -thread_warp_size=32", [-1, 16, 64, 49152, 2147483647, 1024, 8, 32], "", 0, []], [[], [["CI", 4], ["SP", 2, 0, 1, [1, 1, 1, 1], 1], ["SP", 2, 5, 8, [1, 1, 1, 8], 1], ["SP", 2, 10, 32, [1, 2], 1], ["RE", 2, [0, 5, 1, 6, 2, 7, 10, 11, 3, 8, 12, 4, 9]], ["FSP", 5, 0, 1, 3], ["FSP", 5, 4, 2, 3], ["RE", 5, [0, 4, 1, 5, 2, 6, 3, 7]], ["CA", 2, 5, 5], ["CHR", 1, "shared", [2]], ["CA", 2, 3, 6], ["CHR", 0, "shared", [3]], ["CA", 1, 4, 6], ["FU", 7, [0, 1]], ["AN", 7, 0, 5], ["FU", 7, [1, 2]], ["AN", 7, 1, 4], ["FU", 7, [2, 3]], ["AN", 7, 2, 6], ["FU", 3, [0, 1]], ["SP", 3, 0, 16, [1], 1], ["AN", 3, 1, 2], ["FFSP", 3, 0, [2, 1], 1, 1], ["AN", 3, 1, 6], ["FU", 1, [0, 1]], ["SP", 1, 0, 2, [1], 1], ["AN", 1, 1, 2], ["FFSP", 1, 0, [2, 1], 1, 1], ["AN", 1, 1, 6], ["PR", 4, 0, "auto_unroll_max_step$512"]]]], "r": [[1.1521e-05, 1.15206e-05, 1.15203e-05], 0, 23.5627, 1662032923], "v": "v0.6"}
{"i": [["[\"fused_pointwise_conv_bias_add_sigmoid\", 32, 8, 1]", "cuda -keys=cuda,gpu -max_num_threads=1024 -model=unknown -thread_warp_size=32", [-1, 16, 64, 49152, 2147483647, 1024, 8, 32], "", 0, []], [[], [["CI", 4], ["SP", 2, 0, 1, [1, 1, 1, 1], 1], ["SP", 2, 5, 8, [2, 1, 1, 2], 1], ["SP", 2, 10, 32, [1, 32], 1], ["RE", 2, [0, 5, 1, 6, 2, 7, 10, 11, 3, 8, 12, 4, 9]], ["FSP", 5, 0, 1, 3], ["FSP", 5, 4, 2, 3], ["RE", 5, [0, 4, 1, 5, 2, 6, 3, 7]], ["CA", 2, 5, 5], ["CHR", 1, "shared", [2]], ["CA", 2, 3, 6], ["CHR", 0, "shared", [3]], ["CA", 1, 4, 6], ["FU", 7, [0, 1]], ["AN", 7, 0, 5], ["FU", 7, [1, 2]], ["AN", 7, 1, 4], ["FU", 7, [2, 3]], ["AN", 7, 2, 6], ["FU", 3, [0, 1]], ["SP", 3, 0, 32, [1], 1], ["AN", 3, 1, 2], ["FFSP", 3, 0, [2, 1], 1, 1], ["AN", 3, 1, 6], ["FU", 1, [0, 1]], ["SP", 1, 0, 16, [4], 1], ["AN", 1, 1, 2], ["FFSP", 1, 0, [2, 1], 1, 1], ["AN", 1, 1, 6], ["PR", 4, 0, "auto_unroll_max_step$64"]]]], "r": [[8.03272e-06, 8.03283e-06, 8.03135e-06], 0, 22.9521, 1662032922], "v": "v0.6"}
{"i": [["[\"fused_pointwise_conv_bias_add_sigmoid\", 32, 8, 1]", "cuda -keys=cuda,gpu -max_num_threads=1024 -model=unknown -thread_warp_size=32", [-1, 16, 64, 49152, 2147483647, 1024, 8, 32], "", 0, []], [[], [["CI", 4], ["SP", 2, 0, 1, [1, 1, 1, 1], 1], ["SP", 2, 5, 8, [1, 1, 2, 1], 1], ["SP", 2, 10, 32, [32, 1], 1], ["RE", 2, [0, 5, 1, 6, 2, 7, 10, 11, 3, 8, 12, 4, 9]], ["FSP", 5, 0, 1, 3], ["FSP", 5, 4, 2, 3], ["RE", 5, [0, 4, 1, 5, 2, 6, 3, 7]], ["CA", 2, 5, 5], ["CHR", 1, "shared", [2]], ["CA", 2, 3, 6], ["CHR", 0, "shared", [3]], ["CA", 1, 4, 6], ["FU", 7, [0, 1]], ["AN", 7, 0, 5], ["FU", 7, [1, 2]], ["AN", 7, 1, 4], ["FU", 7, [2, 3]], ["AN", 7, 2, 6], ["FU", 3, [0, 1]], ["SP", 3, 0, 64, [1], 1], ["AN", 3, 1, 2], ["FFSP", 3, 0, [2, 1], 1, 1], ["AN", 3, 1, 6], ["FU", 1, [0, 1]], ["SP", 1, 0, 32, [1], 1], ["AN", 1, 1, 2], ["FFSP", 1, 0, [2, 1], 1, 1], ["AN", 1, 1, 6], ["PR", 4, 0, "auto_unroll_max_step$64"]]]], "r": [[6.52176e-06, 6.52152e-06, 6.52175e-06], 0, 24.1929, 1662032924], "v": "v0.6"}
{"i": [["[\"fused_pointwise_conv_bias_add_sigmoid\", 32, 8, 1]", "cuda -keys=cuda,gpu -max_num_threads=1024 -model=unknown -thread_warp_size=32", [-1, 16, 64, 49152, 2147483647, 1024, 8, 32], "", 0, []], [[], [["CI", 4], ["SP", 2, 0, 1, [1, 1, 1, 1], 1], ["SP", 2, 5, 8, [8, 1, 1, 1], 1], ["SP", 2, 10, 32, [1, 4], 1], ["RE", 2, [0, 5, 1, 6, 2, 7, 10, 11, 3, 8, 12, 4, 9]], ["FSP", 5, 0, 1, 3], ["FSP", 5, 4, 2, 3], ["RE", 5, [0, 4, 1, 5, 2, 6, 3, 7]], ["CA", 2, 5, 5], ["CHR", 1, "shared", [2]], ["CA", 2, 3, 6], ["CHR", 0, "shared", [3]], ["CA", 1, 4, 6], ["FU", 7, [0, 1]], ["AN", 7, 0, 5], ["FU", 7, [1, 2]], ["AN", 7, 1, 4], ["FU", 7, [2, 3]], ["AN", 7, 2, 6], ["FU", 3, [0, 1]], ["SP", 3, 0, 16, [2], 1], ["AN", 3, 1, 2], ["FFSP", 3, 0, [2, 1], 1, 1], ["AN", 3, 1, 6], ["FU", 1, [0, 1]], ["SP", 1, 0, 4, [1], 1], ["AN", 1, 1, 2], ["FFSP", 1, 0, [2, 1], 1, 1], ["AN", 1, 1, 6], ["PR", 4, 0, "auto_unroll_max_step$1024"]]]], "r": [[1.24063e-05, 1.24066e-05, 1.24062e-05], 0, 24.1582, 1662032924], "v": "v0.6"}
{"i": [["[\"fused_pointwise_conv_bias_add_sigmoid\", 32, 8, 1]", "cuda -keys=cuda,gpu -max_num_threads=1024 -model=unknown -thread_warp_size=32", [-1, 16, 64, 49152, 2147483647, 1024, 8, 32], "", 0, []], [[], [["CI", 4], ["SP", 2, 0, 1, [1, 1, 1, 1], 1], ["SP", 2, 5, 8, [2, 1, 2, 2], 1], ["SP", 2, 10, 32, [2, 2], 1], ["RE", 2, [0, 5, 1, 6, 2, 7, 10, 11, 3, 8, 12, 4, 9]], ["FSP", 5, 0, 1, 3], ["FSP", 5, 4, 2, 3], ["RE", 5, [0, 4, 1, 5, 2, 6, 3, 7]], ["CA", 2, 5, 5], ["CHR", 1, "shared", [2]], ["CA", 2, 3, 6], ["CHR", 0, "shared", [3]], ["CA", 1, 4, 6], ["FU", 7, [0, 1]], ["AN", 7, 0, 5], ["FU", 7, [1, 2]], ["AN", 7, 1, 4], ["FU", 7, [2, 3]], ["AN", 7, 2, 6], ["FU", 3, [0, 1]], ["SP", 3, 0, 16, [1], 1], ["AN", 3, 1, 2], ["FFSP", 3, 0, [2, 1], 1, 1], ["AN", 3, 1, 6], ["FU", 1, [0, 1]], ["SP", 1, 0, 4, [4], 1], ["AN", 1, 1, 2], ["FFSP", 1, 0, [2, 1], 1, 1], ["AN", 1, 1, 6], ["PR", 4, 0, "auto_unroll_max_step$64"]]]], "r": [[1.20365e-05, 1.20401e-05, 1.20356e-05], 0, 24.0619, 1662032925], "v": "v0.6"}
{"i": [["[\"fused_pointwise_conv_bias_add_sigmoid\", 32, 8, 1]", "cuda -keys=cuda,gpu -max_num_threads=1024 -model=unknown -thread_warp_size=32", [-1, 16, 64, 49152, 2147483647, 1024, 8, 32], "", 0, []], [[], [["CI", 4], ["SP", 2, 0, 1, [1, 1, 1, 1], 1], ["SP", 2, 5, 8, [2, 1, 2, 2], 1], ["SP", 2, 10, 32, [1, 8], 1], ["RE", 2, [0, 5, 1, 6, 2, 7, 10, 11, 3, 8, 12, 4, 9]], ["FSP", 5, 0, 1, 3], ["FSP", 5, 4, 2, 3], ["RE", 5, [0, 4, 1, 5, 2, 6, 3, 7]], ["CA", 2, 5, 5], ["CHR", 1, "shared", [2]], ["CA", 2, 3, 6], ["CHR", 0, "shared", [3]], ["CA", 1, 4, 6], ["FU", 7, [0, 1]], ["AN", 7, 0, 5], ["FU", 7, [1, 2]], ["AN", 7, 1, 4], ["FU", 7, [2, 3]], ["AN", 7, 2, 6], ["FU", 3, [0, 1]], ["SP", 3, 0, 64, [1], 1], ["AN", 3, 1, 2], ["FFSP", 3, 0, [2, 1], 1, 1], ["AN", 3, 1, 6], ["FU", 1, [0, 1]], ["SP", 1, 0, 16, [1], 1], ["AN", 1, 1, 2], ["FFSP", 1, 0, [2, 1], 1, 1], ["AN", 1, 1, 6], ["PR", 4, 0, "auto_unroll_max_step$0"]]]], "r": [[1.44353e-05, 1.44479e-05, 1.44475e-05], 0, 24.175, 1662032925], "v": "v0.6"}
{"i": [["[\"fused_pointwise_conv_bias_add_sigmoid\", 32, 8, 1]", "cuda -keys=cuda,gpu -max_num_threads=1024 -model=unknown -thread_warp_size=32", [-1, 16, 64, 49152, 2147483647, 1024, 8, 32], "", 0, []], [[], [["CI", 4], ["SP", 2, 0, 1, [1, 1, 1, 1], 1], ["SP", 2, 5, 8, [1, 1, 8, 1], 1], ["SP", 2, 10, 32, [2, 16], 1], ["RE", 2, [0, 5, 1, 6, 2, 7, 10, 11, 3, 8, 12, 4, 9]], ["FSP", 5, 0, 1, 3], ["FSP", 5, 4, 2, 3], ["RE", 5, [0, 4, 1, 5, 2, 6, 3, 7]], ["CA", 2, 5, 5], ["CHR", 1, "shared", [2]], ["CA", 2, 3, 6], ["CHR", 0, "shared", [3]], ["CA", 1, 4, 6], ["FU", 7, [0, 1]], ["AN", 7, 0, 5], ["FU", 7, [1, 2]], ["AN", 7, 1, 4], ["FU", 7, [2, 3]], ["AN", 7, 2, 6], ["FU", 3, [0, 1]], ["SP", 3, 0, 256, [1], 1], ["AN", 3, 1, 2], ["FFSP", 3, 0, [2, 1], 1, 1], ["AN", 3, 1, 6], ["FU", 1, [0, 1]], ["SP", 1, 0, 32, [1], 1], ["AN", 1, 1, 2], ["FFSP", 1, 0, [2, 1], 1, 1], ["AN", 1, 1, 6], ["PR", 4, 0, "auto_unroll_max_step$0"]]]], "r": [[1.03547e-05, 1.03556e-05, 1.03552e-05], 0, 24.1294, 1662032926], "v": "v0.6"}
{"i": [["[\"fused_pointwise_conv_bias_add_sigmoid\", 32, 8, 1]", "cuda -keys=cuda,gpu -max_num_threads=1024 -model=unknown -thread_warp_size=32", [-1, 16, 64, 49152, 2147483647, 1024, 8, 32], "", 0, []], [[], [["CI", 4], ["SP", 2, 0, 1, [1, 1, 1, 1], 1], ["SP", 2, 5, 8, [1, 2, 1, 2], 1], ["SP", 2, 10, 32, [2, 4], 1], ["RE", 2, [0, 5, 1, 6, 2, 7, 10, 11, 3, 8, 12, 4, 9]], ["FSP", 5, 0, 1, 3], ["FSP", 5, 4, 2, 3], ["RE", 5, [0, 4, 1, 5, 2, 6, 3, 7]], ["CA", 2, 5, 5], ["CHR", 1, "shared", [2]], ["CA", 2, 3, 6], ["CHR", 0, "shared", [3]], ["CA", 1, 4, 6], ["FU", 7, [0, 1]], ["AN", 7, 0, 5], ["FU", 7, [1, 2]], ["AN", 7, 1, 4], ["FU", 7, [2, 3]], ["AN", 7, 2, 6], ["FU", 3, [0, 1]], ["SP", 3, 0, 16, [2], 1], ["AN", 3, 1, 2], ["FFSP", 3, 0, [2, 1], 1, 1], ["AN", 3, 1, 6], ["FU", 1, [0, 1]], ["SP", 1, 0, 8, [2], 1], ["AN", 1, 1, 2], ["FFSP", 1, 0, [2, 1], 1, 1], ["AN", 1, 1, 6], ["PR", 4, 0, "auto_unroll_max_step$512"]]]], "r": [[6.58403e-06, 6.58391e-06, 6.58362e-06], 0, 24.037, 1662032927], "v": "v0.6"}
{"i": [["[\"fused_pointwise_conv_bias_add_sigmoid\", 32, 8, 1]", "cuda -keys=cuda,gpu -max_num_threads=1024 -model=unknown -thread_warp_size=32", [-1, 16, 64, 49152, 2147483647, 1024, 8, 32], "", 0, []], [[], [["CI", 4], ["SP", 2, 0, 1, [1, 1, 1, 1], 1], ["SP", 2, 5, 8, [1, 2, 1, 2], 1], ["SP", 2, 10, 32, [1, 32], 1], ["RE", 2, [0, 5, 1, 6, 2, 7, 10, 11, 3, 8, 12, 4, 9]], ["FSP", 5, 0, 1, 3], ["FSP", 5, 4, 2, 3], ["RE", 5, [0, 4, 1, 5, 2, 6, 3, 7]], ["CA", 2, 5, 5], ["CHR", 1, "shared", [2]], ["CA", 2, 3, 6], ["CHR", 0, "shared", [3]], ["CA", 1, 4, 6], ["FU", 7, [0, 1]], ["AN", 7, 0, 5], ["FU", 7, [1, 2]], ["AN", 7, 1, 4], ["FU", 7, [2, 3]], ["AN", 7, 2, 6], ["FU", 3, [0, 1]], ["SP", 3, 0, 16, [1], 1], ["AN", 3, 1, 2], ["FFSP", 3, 0, [2, 1], 1, 1], ["AN", 3, 1, 6], ["FU", 1, [0, 1]], ["SP", 1, 0, 8, [1], 1], ["AN", 1, 1, 2], ["FFSP", 1, 0, [2, 1], 1, 1], ["AN", 1, 1, 6], ["PR", 4, 0, "auto_unroll_max_step$1024"]]]], "r": [[6.48364e-06, 6.48356e-06, 6.4837e-06], 0, 24.0305, 1662032927], "v": "v0.6"}
{"i": [["[\"fused_pointwise_conv_bias_add_sigmoid\", 32, 8, 1]", "cuda -keys=cuda,gpu -max_num_threads=1024 -model=unknown -thread_warp_size=32", [-1, 16, 64, 49152, 2147483647, 1024, 8, 32], "", 0, []], [[], [["CI", 4], ["SP", 2, 0, 1, [1, 1, 1, 1], 1], ["SP", 2, 5, 8, [1, 1, 2, 4], 1], ["SP", 2, 10, 32, [1, 32], 1], ["RE", 2, [0, 5, 1, 6, 2, 7, 10, 11, 3, 8, 12, 4, 9]], ["FSP", 5, 0, 1, 3], ["FSP", 5, 4, 2, 3], ["RE", 5, [0, 4, 1, 5, 2, 6, 3, 7]], ["CA", 2, 5, 5], ["CHR", 1, "shared", [2]], ["CA", 2, 3, 6], ["CHR", 0, "shared", [3]], ["CA", 1, 4, 6], ["FU", 7, [0, 1]], ["AN", 7, 0, 5], ["FU", 7, [1, 2]], ["AN", 7, 1, 4], ["FU", 7, [2, 3]], ["AN", 7, 2, 6], ["FU", 3, [0, 1]], ["SP", 3, 0, 128, [1], 1], ["AN", 3, 1, 2], ["FFSP", 3, 0, [2, 1], 1, 1], ["AN", 3, 1, 6], ["FU", 1, [0, 1]], ["SP", 1, 0, 32, [1], 1], ["AN", 1, 1, 2], ["FFSP", 1, 0, [2, 1], 1, 1], ["AN", 1, 1, 6], ["PR", 4, 0, "auto_unroll_max_step$0"]]]], "r": [[1.01826e-05, 1.0181e-05, 1.01807e-05], 0, 24.038, 1662032928], "v": "v0.6"}
{"i": [["[\"fused_pointwise_conv_bias_add_sigmoid\", 32, 8, 1]", "cuda -keys=cuda,gpu -max_num_threads=1024 -model=unknown -thread_warp_size=32", [-1, 16, 64, 49152, 2147483647, 1024, 8, 32], "", 0, []], [[], [["CI", 4], ["SP", 2, 0, 1, [1, 1, 1, 1], 1], ["SP", 2, 5, 8, [4, 1, 2, 1], 1], ["SP", 2, 10, 32, [2, 16], 1], ["RE", 2, [0, 5, 1, 6, 2, 7, 10, 11, 3, 8, 12, 4, 9]], ["FSP", 5, 0, 1, 3], ["FSP", 5, 4, 2, 3], ["RE", 5, [0, 4, 1, 5, 2, 6, 3, 7]], ["CA", 2, 5, 5], ["CHR", 1, "shared", [2]], ["CA", 2, 3, 6], ["CHR", 0, "shared", [3]], ["CA", 1, 4, 6], ["FU", 7, [0, 1]], ["AN", 7, 0, 5], ["FU", 7, [1, 2]], ["AN", 7, 1, 4], ["FU", 7, [2, 3]], ["AN", 7, 2, 6], ["FU", 3, [0, 1]], ["SP", 3, 0, 256, [2], 1], ["AN", 3, 1, 2], ["FFSP", 3, 0, [2, 1], 1, 1], ["AN", 3, 1, 6], ["FU", 1, [0, 1]], ["SP", 1, 0, 32, [1], 1], ["AN", 1, 1, 2], ["FFSP", 1, 0, [2, 1], 1, 1], ["AN", 1, 1, 6], ["PR", 4, 0, "auto_unroll_max_step$0"]]]], "r": [[1.04974e-05, 1.04963e-05, 1.04967e-05], 0, 24.0653, 1662032928], "v": "v0.6"}
{"i": [["[\"fused_pointwise_conv_bias_add_sigmoid\", 32, 8, 1]", "cuda -keys=cuda,gpu -max_num_threads=1024 -model=unknown -thread_warp_size=32", [-1, 16, 64, 49152, 2147483647, 1024, 8, 32], "", 0, []], [[], [["CI", 4], ["SP", 2, 0, 1, [1, 1, 1, 1], 1], ["SP", 2, 5, 8, [1, 1, 2, 2], 1], ["SP", 2, 10, 32, [2, 16], 1], ["RE", 2, [0, 5, 1, 6, 2, 7, 10, 11, 3, 8, 12, 4, 9]], ["FSP", 5, 0, 1, 3], ["FSP", 5, 4, 2, 3], ["RE", 5, [0, 4, 1, 5, 2, 6, 3, 7]], ["CA", 2, 5, 5], ["CHR", 1, "shared", [2]], ["CA", 2, 3, 6], ["CHR", 0, "shared", [3]], ["CA", 1, 4, 6], ["FU", 7, [0, 1]], ["AN", 7, 0, 5], ["FU", 7, [1, 2]], ["AN", 7, 1, 4], ["FU", 7, [2, 3]], ["AN", 7, 2, 6], ["FU", 3, [0, 1]], ["SP", 3, 0, 128, [1], 1], ["AN", 3, 1, 2], ["FFSP", 3, 0, [2, 1], 1, 1], ["AN", 3, 1, 6], ["FU", 1, [0, 1]], ["SP", 1, 0, 16, [1], 1], ["AN", 1, 1, 2], ["FFSP", 1, 0, [2, 1], 1, 1], ["AN", 1, 1, 6], ["PR", 4, 0, "auto_unroll_max_step$64"]]]], "r": [[7.82792e-06, 7.82664e-06, 7.82764e-06], 0, 24.1167, 1662032929], "v": "v0.6"}
{"i": [["[\"fused_pointwise_conv_bias_add_sigmoid\", 32, 8, 1]", "cuda -keys=cuda,gpu -max_num_threads=1024 -model=unknown -thread_warp_size=32", [-1, 16, 64, 49152, 2147483647, 1024, 8, 32], "", 0, []], [[], [["CI", 4], ["SP", 2, 0, 1, [1, 1, 1, 1], 1], ["SP", 2, 5, 8, [1, 2, 2, 2], 1], ["SP", 2, 10, 32, [4, 1], 1], ["RE", 2, [0, 5, 1, 6, 2, 7, 10, 11, 3, 8, 12, 4, 9]], ["FSP", 5, 0, 1, 3], ["FSP", 5, 4, 2, 3], ["RE", 5, [0, 4, 1, 5, 2, 6, 3, 7]], ["CA", 2, 5, 5], ["CHR", 1, "shared", [2]], ["CA", 2, 3, 6], ["CHR", 0, "shared", [3]], ["CA", 1, 4, 6], ["FU", 7, [0, 1]], ["AN", 7, 0, 5], ["FU", 7, [1, 2]], ["AN", 7, 1, 4], ["FU", 7, [2, 3]], ["AN", 7, 2, 6], ["FU", 3, [0, 1]], ["SP", 3, 0, 8, [1], 1], ["AN", 3, 1, 2], ["FFSP", 3, 0, [2, 1], 1, 1], ["AN", 3, 1, 6], ["FU", 1, [0, 1]], ["SP", 1, 0, 4, [4], 1], ["AN", 1, 1, 2], ["FFSP", 1, 0, [2, 1], 1, 1], ["AN", 1, 1, 6], ["PR", 4, 0, "auto_unroll_max_step$1024"]]]], "r": [[8.04103e-06, 8.04615e-06, 8.03396e-06], 0, 24.1281, 1662032930], "v": "v0.6"}
{"i": [["[\"fused_pointwise_conv_bias_add_sigmoid\", 32, 8, 1]", "cuda -keys=cuda,gpu -max_num_threads=1024 -model=unknown -thread_warp_size=32", [-1, 16, 64, 49152, 2147483647, 1024, 8, 32], "", 0, []], [[], [["CI", 4], ["SP", 2, 0, 1, [1, 1, 1, 1], 1], ["SP", 2, 5, 8, [2, 1, 2, 2], 1], ["SP", 2, 10, 32, [32, 1], 1], ["RE", 2, [0, 5, 1, 6, 2, 7, 10, 11, 3, 8, 12, 4, 9]], ["FSP", 5, 0, 1, 3], ["FSP", 5, 4, 2, 3], ["RE", 5, [0, 4, 1, 5, 2, 6, 3, 7]], ["CA", 2, 5, 5], ["CHR", 1, "shared", [2]], ["CA", 2, 3, 6], ["CHR", 0, "shared", [3]], ["CA", 1, 4, 6], ["FU", 7, [0, 1]], ["AN", 7, 0, 5], ["FU", 7, [1, 2]], ["AN", 7, 1, 4], ["FU", 7, [2, 3]], ["AN", 7, 2, 6], ["FU", 3, [0, 1]], ["SP", 3, 0, 128, [1], 1], ["AN", 3, 1, 2], ["FFSP", 3, 0, [2, 1], 1, 1], ["AN", 3, 1, 6], ["FU", 1, [0, 1]], ["SP", 1, 0, 32, [1], 1], ["AN", 1, 1, 2], ["FFSP", 1, 0, [2, 1], 1, 1], ["AN", 1, 1, 6], ["PR", 4, 0, "auto_unroll_max_step$64"]]]], "r": [[1.01516e-05, 1.0149e-05, 1.01499e-05], 0, 24.0668, 1662032930], "v": "v0.6"}
{"i": [["[\"fused_pointwise_conv_bias_add_sigmoid\", 32, 8, 1]", "cuda -keys=cuda,gpu -max_num_threads=1024 -model=unknown -thread_warp_size=32", [-1, 16, 64, 49152, 2147483647, 1024, 8, 32], "", 0, []], [[], [["CI", 4], ["SP", 2, 0, 1, [1, 1, 1, 1], 1], ["SP", 2, 5, 8, [2, 2, 2, 1], 1], ["SP", 2, 10, 32, [1, 4], 1], ["RE", 2, [0, 5, 1, 6, 2, 7, 10, 11, 3, 8, 12, 4, 9]], ["FSP", 5, 0, 1, 3], ["FSP", 5, 4, 2, 3], ["RE", 5, [0, 4, 1, 5, 2, 6, 3, 7]], ["CA", 2, 5, 5], ["CHR", 1, "shared", [2]], ["CA", 2, 3, 6], ["CHR", 0, "shared", [3]], ["CA", 1, 4, 6], ["FU", 7, [0, 1]], ["AN", 7, 0, 5], ["FU", 7, [1, 2]], ["AN", 7, 1, 4], ["FU", 7, [2, 3]], ["AN", 7, 2, 6], ["FU", 3, [0, 1]], ["SP", 3, 0, 8, [1], 1], ["AN", 3, 1, 2], ["FFSP", 3, 0, [2, 1], 1, 1], ["AN", 3, 1, 6], ["FU", 1, [0, 1]], ["SP", 1, 0, 4, [1], 1], ["AN", 1, 1, 2], ["FFSP", 1, 0, [2, 1], 1, 1], ["AN", 1, 1, 6], ["PR", 4, 0, "auto_unroll_max_step$16"]]]], "r": [[9.71851e-06, 9.71973e-06, 9.71853e-06], 0, 24.0463, 1662032931], "v": "v0.6"}
{"i": [["[\"fused_pointwise_conv_bias_add_sigmoid\", 32, 8, 1]", "cuda -keys=cuda,gpu -max_num_threads=1024 -model=unknown -thread_warp_size=32", [-1, 16, 64, 49152, 2147483647, 1024, 8, 32], "", 0, []], [[], [["CI", 4], ["SP", 2, 0, 1, [1, 1, 1, 1], 1], ["SP", 2, 5, 8, [2, 1, 1, 2], 1], ["SP", 2, 10, 32, [8, 2], 1], ["RE", 2, [0, 5, 1, 6, 2, 7, 10, 11, 3, 8, 12, 4, 9]], ["FSP", 5, 0, 1, 3], ["FSP", 5, 4, 2, 3], ["RE", 5, [0, 4, 1, 5, 2, 6, 3, 7]], ["CA", 2, 5, 5], ["CHR", 1, "shared", [2]], ["CA", 2, 3, 6], ["CHR", 0, "shared", [3]], ["CA", 1, 4, 6], ["FU", 7, [0, 1]], ["AN", 7, 0, 5], ["FU", 7, [1, 2]], ["AN", 7, 1, 4], ["FU", 7, [2, 3]], ["AN", 7, 2, 6], ["FU", 3, [0, 1]], ["SP", 3, 0, 32, [1], 1], ["AN", 3, 1, 2], ["FFSP", 3, 0, [2, 1], 1, 1], ["AN", 3, 1, 6], ["FU", 1, [0, 1]], ["SP", 1, 0, 16, [1], 1], ["AN", 1, 1, 2], ["FFSP", 1, 0, [2, 1], 1, 1], ["AN", 1, 1, 6], ["PR", 4, 0, "auto_unroll_max_step$512"]]]], "r": [[9.63394e-06, 9.63292e-06, 9.63303e-06], 0, 23.9586, 1662032931], "v": "v0.6"}
{"i": [["[\"fused_pointwise_conv_bias_add_sigmoid\", 32, 8, 1]", "cuda -keys=cuda,gpu -max_num_threads=1024 -model=unknown -thread_warp_size=32", [-1, 16, 64, 49152, 2147483647, 1024, 8, 32], "", 0, []], [[], [["CI", 4], ["SP", 2, 0, 1, [1, 1, 1, 1], 1], ["SP", 2, 5, 8, [4, 1, 1, 1], 1], ["SP", 2, 10, 32, [8, 1], 1], ["RE", 2, [0, 5, 1, 6, 2, 7, 10, 11, 3, 8, 12, 4, 9]], ["FSP", 5, 0, 1, 3], ["FSP", 5, 4, 2, 3], ["RE", 5, [0, 4, 1, 5, 2, 6, 3, 7]], ["CA", 2, 5, 5], ["CHR", 1, "shared", [2]], ["CA", 2, 3, 6], ["CHR", 0, "shared", [3]], ["CA", 1, 4, 6], ["FU", 7, [0, 1]], ["AN", 7, 0, 5], ["FU", 7, [1, 2]], ["AN", 7, 1, 4], ["FU", 7, [2, 3]], ["AN", 7, 2, 6], ["FU", 3, [0, 1]], ["SP", 3, 0, 1, [1], 1], ["AN", 3, 1, 2], ["FFSP", 3, 0, [2, 1], 1, 1], ["AN", 3, 1, 6], ["FU", 1, [0, 1]], ["SP", 1, 0, 1, [1], 1], ["AN", 1, 1, 2], ["FFSP", 1, 0, [2, 1], 1, 1], ["AN", 1, 1, 6], ["PR", 4, 0, "auto_unroll_max_step$0"]]]], "r": [[1.00666e-05, 1.0066e-05, 1.00652e-05], 0, 23.872, 1662032932], "v": "v0.6"}
{"i": [["[\"fused_pointwise_conv_bias_add_sigmoid\", 32, 8, 1]", "cuda -keys=cuda,gpu -max_num_threads=1024 -model=unknown -thread_warp_size=32", [-1, 16, 64, 49152, 2147483647, 1024, 8, 32], "", 0, []], [[], [["CI", 4], ["SP", 2, 0, 1, [1, 1, 1, 1], 1], ["SP", 2, 5, 8, [1, 4, 1, 1], 1], ["SP", 2, 10, 32, [2, 16], 1], ["RE", 2, [0, 5, 1, 6, 2, 7, 10, 11, 3, 8, 12, 4, 9]], ["FSP", 5, 0, 1, 3], ["FSP", 5, 4, 2, 3], ["RE", 5, [0, 4, 1, 5, 2, 6, 3, 7]], ["CA", 2, 5, 5], ["CHR", 1, "shared", [2]], ["CA", 2, 3, 6], ["CHR", 0, "shared", [3]], ["CA", 1, 4, 6], ["FU", 7, [0, 1]], ["AN", 7, 0, 5], ["FU", 7, [1, 2]], ["AN", 7, 1, 4], ["FU", 7, [2, 3]], ["AN", 7, 2, 6], ["FU", 3, [0, 1]], ["SP", 3, 0, 16, [1], 1], ["AN", 3, 1, 2], ["FFSP", 3, 0, [2, 1], 1, 1], ["AN", 3, 1, 6], ["FU", 1, [0, 1]], ["SP", 1, 0, 16, [1], 1], ["AN", 1, 1, 2], ["FFSP", 1, 0, [2, 1], 1, 1], ["AN", 1, 1, 6], ["PR", 4, 0, "auto_unroll_max_step$64"]]]], "r": [[5.18959e-06, 5.18869e-06, 5.18871e-06], 0, 23.8401, 1662032932], "v": "v0.6"}
{"i": [["[\"fused_pointwise_conv_bias_add_sigmoid\", 32, 8, 1]", "cuda -keys=cuda,gpu -max_num_threads=1024 -model=unknown -thread_warp_size=32", [-1, 16, 64, 49152, 2147483647, 1024, 8, 32], "", 0, []], [[], [["CI", 4], ["SP", 2, 0, 1, [1, 1, 1, 1], 1], ["SP", 2, 5, 8, [1, 1, 4, 1], 1], ["SP", 2, 10, 32, [4, 1], 1], ["RE", 2, [0, 5, 1, 6, 2, 7, 10, 11, 3, 8, 12, 4, 9]], ["FSP", 5, 0, 1, 3], ["FSP", 5, 4, 2, 3], ["RE", 5, [0, 4, 1, 5, 2, 6, 3, 7]], ["CA", 2, 5, 5], ["CHR", 1, "shared", [2]], ["CA", 2, 3, 6], ["CHR", 0, "shared", [3]], ["CA", 1, 4, 6], ["FU", 7, [0, 1]], ["AN", 7, 0, 5], ["FU", 7, [1, 2]], ["AN", 7, 1, 4], ["FU", 7, [2, 3]], ["AN", 7, 2, 6], ["FU", 3, [0, 1]], ["SP", 3, 0, 16, [1], 1], ["AN", 3, 1, 2], ["FFSP", 3, 0, [2, 1], 1, 1], ["AN", 3, 1, 6], ["FU", 1, [0, 1]], ["SP", 1, 0, 4, [1], 1], ["AN", 1, 1, 2], ["FFSP", 1, 0, [2, 1], 1, 1], ["AN", 1, 1, 6], ["PR", 4, 0, "auto_unroll_max_step$1024"]]]], "r": [[1.05301e-05, 1.05297e-05, 1.053e-05], 0, 23.8159, 1662032933], "v": "v0.6"}
{"i": [["[\"fused_pointwise_conv_bias_add_sigmoid\", 32, 8, 1]", "cuda -keys=cuda,gpu -max_num_threads=1024 -model=unknown -thread_warp_size=32", [-1, 16, 64, 49152, 2147483647, 1024, 8, 32], "", 0, []], [[], [["CI", 4], ["SP", 2, 0, 1, [1, 1, 1, 1], 1], ["SP", 2, 5, 8, [1, 2, 4, 1], 1], ["SP", 2, 10, 32, [2, 16], 1], ["RE", 2, [0, 5, 1, 6, 2, 7, 10, 11, 3, 8, 12, 4, 9]], ["FSP", 5, 0, 1, 3], ["FSP", 5, 4, 2, 3], ["RE", 5, [0, 4, 1, 5, 2, 6, 3, 7]], ["CA", 2, 5, 5], ["CHR", 1, "shared", [2]], ["CA", 2, 3, 6], ["CHR", 0, "shared", [3]], ["CA", 1, 4, 6], ["FU", 7, [0, 1]], ["AN", 7, 0, 5], ["FU", 7, [1, 2]], ["AN", 7, 1, 4], ["FU", 7, [2, 3]], ["AN", 7, 2, 6], ["FU", 3, [0, 1]], ["SP", 3, 0, 128, [4], 1], ["AN", 3, 1, 2], ["FFSP", 3, 0, [2, 1], 1, 1], ["AN", 3, 1, 6], ["FU", 1, [0, 1]], ["SP", 1, 0, 32, [1], 1], ["AN", 1, 1, 2], ["FFSP", 1, 0, [2, 1], 1, 1], ["AN", 1, 1, 6], ["PR", 4, 0, "auto_unroll_max_step$512"]]]], "r": [[6.4266e-06, 6.43759e-06, 6.42746e-06], 0, 23.8213, 1662032934], "v": "v0.6"}
{"i": [["[\"fused_pointwise_conv_bias_add_sigmoid\", 32, 8, 1]", "cuda -keys=cuda,gpu -max_num_threads=1024 -model=unknown -thread_warp_size=32", [-1, 16, 64, 49152, 2147483647, 1024, 8, 32], "", 0, []], [[], [["CI", 4], ["SP", 2, 0, 1, [1, 1, 1, 1], 1], ["SP", 2, 5, 8, [1, 1, 1, 2], 1], ["SP", 2, 10, 32, [1, 16], 1], ["RE", 2, [0, 5, 1, 6, 2, 7, 10, 11, 3, 8, 12, 4, 9]], ["FSP", 5, 0, 1, 3], ["FSP", 5, 4, 2, 3], ["RE", 5, [0, 4, 1, 5, 2, 6, 3, 7]], ["CA", 2, 5, 5], ["CHR", 1, "shared", [2]], ["CA", 2, 3, 6], ["CHR", 0, "shared", [3]], ["CA", 1, 4, 6], ["FU", 7, [0, 1]], ["AN", 7, 0, 5], ["FU", 7, [1, 2]], ["AN", 7, 1, 4], ["FU", 7, [2, 3]], ["AN", 7, 2, 6], ["FU", 3, [0, 1]], ["SP", 3, 0, 32, [2], 1], ["AN", 3, 1, 2], ["FFSP", 3, 0, [2, 1], 1, 1], ["AN", 3, 1, 6], ["FU", 1, [0, 1]], ["SP", 1, 0, 16, [1], 1], ["AN", 1, 1, 2], ["FFSP", 1, 0, [2, 1], 1, 1], ["AN", 1, 1, 6], ["PR", 4, 0, "auto_unroll_max_step$16"]]]], "r": [[6.98703e-06, 6.98706e-06, 6.98669e-06], 0, 23.6864, 1662032934], "v": "v0.6"}
{"i": [["[\"fused_pointwise_conv_bias_add_sigmoid\", 32, 8, 1]", "cuda -keys=cuda,gpu -max_num_threads=1024 -model=unknown -thread_warp_size=32", [-1, 16, 64, 49152, 2147483647, 1024, 8, 32], "", 0, []], [[], [["CI", 4], ["SP", 2, 0, 1, [1, 1, 1, 1], 1], ["SP", 2, 5, 8, [1, 1, 8, 1], 1], ["SP", 2, 10, 32, [8, 2], 1], ["RE", 2, [0, 5, 1, 6, 2, 7, 10, 11, 3, 8, 12, 4, 9]], ["FSP", 5, 0, 1, 3], ["FSP", 5, 4, 2, 3], ["RE", 5, [0, 4, 1, 5, 2, 6, 3, 7]], ["CA", 2, 5, 5], ["CHR", 1, "shared", [2]], ["CA", 2, 3, 6], ["CHR", 0, "shared", [3]], ["CA", 1, 4, 6], ["FU", 7, [0, 1]], ["AN", 7, 0, 5], ["FU", 7, [1, 2]], ["AN", 7, 1, 4], ["FU", 7, [2, 3]], ["AN", 7, 2, 6], ["FU", 3, [0, 1]], ["SP", 3, 0, 64, [1], 1], ["AN", 3, 1, 2], ["FFSP", 3, 0, [2, 1], 1, 1], ["AN", 3, 1, 6], ["FU", 1, [0, 1]], ["SP", 1, 0, 8, [4], 1], ["AN", 1, 1, 2], ["FFSP", 1, 0, [2, 1], 1, 1], ["AN", 1, 1, 6], ["PR", 4, 0, "auto_unroll_max_step$0"]]]], "r": [[1.0834e-05, 1.08339e-05, 1.08338e-05], 0, 23.6653, 1662032935], "v": "v0.6"}
{"i": [["[\"fused_pointwise_conv_bias_add_sigmoid\", 32, 8, 1]", "cuda -keys=cuda,gpu -max_num_threads=1024 -model=unknown -thread_warp_size=32", [-1, 16, 64, 49152, 2147483647, 1024, 8, 32], "", 0, []], [[], [["CI", 4], ["SP", 2, 0, 1, [1, 1, 1, 1], 1], ["SP", 2, 5, 8, [1, 2, 4, 1], 1], ["SP", 2, 10, 32, [8, 2], 1], ["RE", 2, [0, 5, 1, 6, 2, 7, 10, 11, 3, 8, 12, 4, 9]], ["FSP", 5, 0, 1, 3], ["FSP", 5, 4, 2, 3], ["RE", 5, [0, 4, 1, 5, 2, 6, 3, 7]], ["CA", 2, 5, 5], ["CHR", 1, "shared", [2]], ["CA", 2, 3, 6], ["CHR", 0, "shared", [3]], ["CA", 1, 4, 6], ["FU", 7, [0, 1]], ["AN", 7, 0, 5], ["FU", 7, [1, 2]], ["AN", 7, 1, 4], ["FU", 7, [2, 3]], ["AN", 7, 2, 6], ["FU", 3, [0, 1]], ["SP", 3, 0, 64, [1], 1], ["AN", 3, 1, 2], ["FFSP", 3, 0, [2, 1], 1, 1], ["AN", 3, 1, 6], ["FU", 1, [0, 1]], ["SP", 1, 0, 16, [1], 1], ["AN", 1, 1, 2], ["FFSP", 1, 0, [2, 1], 1, 1], ["AN", 1, 1, 6], ["PR", 4, 0, "auto_unroll_max_step$0"]]]], "r": [[7.25047e-06, 7.24969e-06, 7.24918e-06], 0, 23.6654, 1662032935], "v": "v0.6"}
{"i": [["[\"fused_pointwise_conv_bias_add_sigmoid\", 32, 8, 1]", "cuda -keys=cuda,gpu -max_num_threads=1024 -model=unknown -thread_warp_size=32", [-1, 16, 64, 49152, 2147483647, 1024, 8, 32], "", 0, []], [[], [["CI", 4], ["SP", 2, 0, 1, [1, 1, 1, 1], 1], ["SP", 2, 5, 8, [4, 2, 1, 1], 1], ["SP", 2, 10, 32, [1, 32], 1], ["RE", 2, [0, 5, 1, 6, 2, 7, 10, 11, 3, 8, 12, 4, 9]], ["FSP", 5, 0, 1, 3], ["FSP", 5, 4, 2, 3], ["RE", 5, [0, 4, 1, 5, 2, 6, 3, 7]], ["CA", 2, 5, 5], ["CHR", 1, "shared", [2]], ["CA", 2, 3, 6], ["CHR", 0, "shared", [3]], ["CA", 1, 4, 6], ["FU", 7, [0, 1]], ["AN", 7, 0, 5], ["FU", 7, [1, 2]], ["AN", 7, 1, 4], ["FU", 7, [2, 3]], ["AN", 7, 2, 6], ["FU", 3, [0, 1]], ["SP", 3, 0, 32, [1], 1], ["AN", 3, 1, 2], ["FFSP", 3, 0, [2, 1], 1, 1], ["AN", 3, 1, 6], ["FU", 1, [0, 1]], ["SP", 1, 0, 32, [1], 1], ["AN", 1, 1, 2], ["FFSP", 1, 0, [2, 1], 1, 1], ["AN", 1, 1, 6], ["PR", 4, 0, "auto_unroll_max_step$512"]]]], "r": [[7.12627e-06, 7.12472e-06, 7.12524e-06], 0, 23.8164, 1662032936], "v": "v0.6"}
{"i": [["[\"fused_pointwise_conv_bias_add_sigmoid\", 32, 8, 1]", "cuda -keys=cuda,gpu -max_num_threads=1024 -model=unknown -thread_warp_size=32", [-1, 16, 64, 49152, 2147483647, 1024, 8, 32], "", 0, []], [[], [["CI", 4], ["SP", 2, 0, 1, [1, 1, 1, 1], 1], ["SP", 2, 5, 8, [1, 1, 4, 1], 1], ["SP", 2, 10, 32, [1, 4], 1], ["RE", 2, [0, 5, 1, 6, 2, 7, 10, 11, 3, 8, 12, 4, 9]], ["FSP", 5, 0, 1, 3], ["FSP", 5, 4, 2, 3], ["RE", 5, [0, 4, 1, 5, 2, 6, 3, 7]], ["CA", 2, 5, 5], ["CHR", 1, "shared", [2]], ["CA", 2, 3, 6], ["CHR", 0, "shared", [3]], ["CA", 1, 4, 6], ["FU", 7, [0, 1]], ["AN", 7, 0, 5], ["FU", 7, [1, 2]], ["AN", 7, 1, 4], ["FU", 7, [2, 3]], ["AN", 7, 2, 6], ["FU", 3, [0, 1]], ["SP", 3, 0, 16, [1], 1], ["AN", 3, 1, 2], ["FFSP", 3, 0, [2, 1], 1, 1], ["AN", 3, 1, 6], ["FU", 1, [0, 1]], ["SP", 1, 0, 4, [1], 1], ["AN", 1, 1, 2], ["FFSP", 1, 0, [2, 1], 1, 1], ["AN", 1, 1, 6], ["PR", 4, 0, "auto_unroll_max_step$64"]]]], "r": [[1.05141e-05, 1.05142e-05, 1.05134e-05], 0, 23.5988, 1662032936], "v": "v0.6"}
