python/models/efficientnet/kernel_configs/efficient_swish_shortcut_add_1_7_7_1152.log
{"i": [["[\"shortcut_add\", 1, 7, 7, 1152]", "cuda -keys=cuda,gpu -max_num_threads=1024 -model=unknown -thread_warp_size=32", [-1, 16, 64, 49152, 2147483647, 1024, 8, 32], "", 0, []], [[], [["FU", 2, [0, 1, 2, 3]], ["SP", 2, 0, 56448, [12], 1], ["AN", 2, 0, 5], ["AN", 2, 1, 6]]]], "r": [[6.35587e-06, 6.36264e-06, 6.36262e-06], 0, 1.06138, 1681133160], "v": "v0.6"}
{"i": [["[\"shortcut_add\", 1, 7, 7, 1152]", "cuda -keys=cuda,gpu -max_num_threads=1024 -model=unknown -thread_warp_size=32", [-1, 16, 64, 49152, 2147483647, 1024, 8, 32], "", 0, []], [[], [["FU", 2, [0, 1, 2, 3]], ["SP", 2, 0, 56448, [48], 1], ["AN", 2, 0, 5], ["AN", 2, 1, 6]]]], "r": [[3.59439e-06, 3.61104e-06, 3.61197e-06], 0, 3.11678, 1681133162], "v": "v0.6"}
{"i": [["[\"shortcut_add\", 1, 7, 7, 1152]", "cuda -keys=cuda,gpu -max_num_threads=1024 -model=unknown -thread_warp_size=32", [-1, 16, 64, 49152, 2147483647, 1024, 8, 32], "", 0, []], [[], [["FU", 2, [0, 1, 2, 3]], ["SP", 2, 0, 56448, [63], 1], ["AN", 2, 0, 5], ["AN", 2, 1, 6]]]], "r": [[3.34978e-06, 3.34947e-06, 3.34932e-06], 0, 2.71858, 1681133161], "v": "v0.6"}
{"i": [["[\"shortcut_add\", 1, 7, 7, 1152]", "cuda -keys=cuda,gpu -max_num_threads=1024 -model=unknown -thread_warp_size=32", [-1, 16, 64, 49152, 2147483647, 1024, 8, 32], "", 0, []], [[], [["FU", 2, [0, 1, 2, 3]], ["SP", 2, 0, 56448, [56], 1], ["AN", 2, 0, 5], ["AN", 2, 1, 6]]]], "r": [[3.45526e-06, 3.45474e-06, 3.45357e-06], 0, 1.5145, 1681133160], "v": "v0.6"}
{"i": [["[\"shortcut_add\", 1, 7, 7, 1152]", "cuda -keys=cuda,gpu -max_num_threads=1024 -model=unknown -thread_warp_size=32", [-1, 16, 64, 49152, 2147483647, 1024, 8, 32], "", 0, []], [[], [["FU", 2, [0, 1, 2, 3]], ["SP", 2, 0, 56448, [9], 1], ["AN", 2, 0, 5], ["AN", 2, 1, 6]]]], "r": [[7.30452e-06, 7.30298e-06, 7.31503e-06], 0, 1.91388, 1681133161], "v": "v0.6"}
{"i": [["[\"shortcut_add\", 1, 7, 7, 1152]", "cuda -keys=cuda,gpu -max_num_threads=1024 -model=unknown -thread_warp_size=32", [-1, 16, 64, 49152, 2147483647, 1024, 8, 32], "", 0, []], [[], [["FU", 2, [0, 1, 2, 3]], ["SP", 2, 0, 56448, [28], 1], ["AN", 2, 0, 5], ["AN", 2, 1, 6]]]], "r": [[4.03855e-06, 4.03962e-06, 4.03939e-06], 0, 0.703632, 1681133159], "v": "v0.6"}
{"i": [["[\"shortcut_add\", 1, 7, 7, 1152]", "cuda -keys=cuda,gpu -max_num_threads=1024 -model=unknown -thread_warp_size=32", [-1, 16, 64, 49152, 2147483647, 1024, 8, 32], "", 0, []], [[], [["FU", 2, [0, 1, 2, 3]], ["SP", 2, 0, 56448, [8], 1], ["AN", 2, 0, 5], ["AN", 2, 1, 6]]]], "r": [[7.91145e-06, 7.91136e-06, 7.9133e-06], 0, 4.32361, 1681133163], "v": "v0.6"}
{"i": [["[\"shortcut_add\", 1, 7, 7, 1152]", "cuda -keys=cuda,gpu -max_num_threads=1024 -model=unknown -thread_warp_size=32", [-1, 16, 64, 49152, 2147483647, 1024, 8, 32], "", 0, []], [[], [["FU", 2, [0, 1, 2, 3]], ["SP", 2, 0, 56448, [36], 1], ["AN", 2, 0, 5], ["AN", 2, 1, 6]]]], "r": [[3.7921e-06, 3.80297e-06, 3.80552e-06], 0, 3.89012, 1681133163], "v": "v0.6"}
{"i": [["[\"shortcut_add\", 1, 7, 7, 1152]", "cuda -keys=cuda,gpu -max_num_threads=1024 -model=unknown -thread_warp_size=32", [-1, 16, 64, 49152, 2147483647, 1024, 8, 32], "", 0, []], [[], [["FU", 2, [0, 1, 2, 3]], ["SP", 2, 0, 56448, [49], 1], ["AN", 2, 0, 5], ["AN", 2, 1, 6]]]], "r": [[3.49103e-06, 3.49203e-06, 3.48976e-06], 0, 2.31215, 1681133161], "v": "v0.6"}
{"i": [["[\"shortcut_add\", 1, 7, 7, 1152]", "cuda -keys=cuda,gpu -max_num_threads=1024 -model=unknown -thread_warp_size=32", [-1, 16, 64, 49152, 2147483647, 1024, 8, 32], "", 0, []], [[], [["FU", 2, [0, 1, 2, 3]], ["SP", 2, 0, 56448, [1], 1], ["AN", 2, 0, 5], ["AN", 2, 1, 6]]]], "r": [[4.44785e-05, 4.44786e-05, 4.44813e-05], 0, 3.49475, 1681133162], "v": "v0.6"}
{"i": [["[\"shortcut_add\", 1, 7, 7, 1152]", "cuda -keys=cuda,gpu -max_num_threads=1024 -model=unknown -thread_warp_size=32", [-1, 16, 64, 49152, 2147483647, 1024, 8, 32], "", 0, []], [[], [["FU", 2, [0, 1, 2, 3]], ["SP", 2, 0, 56448, [3], 1], ["AN", 2, 0, 5], ["AN", 2, 1, 6]]]], "r": [[1.67547e-05, 1.67518e-05, 1.67557e-05], 0, 5.94603, 1681133165], "v": "v0.6"}
{"i": [["[\"shortcut_add\", 1, 7, 7, 1152]", "cuda -keys=cuda,gpu -max_num_threads=1024 -model=unknown -thread_warp_size=32", [-1, 16, 64, 49152, 2147483647, 1024, 8, 32], "", 0, []], [[], [["FU", 2, [0, 1, 2, 3]], ["SP", 2, 0, 56448, [2], 1], ["AN", 2, 0, 5], ["AN", 2, 1, 6]]]], "r": [[2.37804e-05, 2.37749e-05, 2.37752e-05], 0, 4.71356, 1681133163], "v": "v0.6"}
{"i": [["[\"shortcut_add\", 1, 7, 7, 1152]", "cuda -keys=cuda,gpu -max_num_threads=1024 -model=unknown -thread_warp_size=32", [-1, 16, 64, 49152, 2147483647, 1024, 8, 32], "", 0, []], [[], [["FU", 2, [0, 1, 2, 3]], ["SP", 2, 0, 56448, [64], 1], ["AN", 2, 0, 5], ["AN", 2, 1, 6]]]], "r": [[3.27373e-06, 3.2784e-06, 3.28012e-06], 0, 7.50684, 1681133166], "v": "v0.6"}
{"i": [["[\"shortcut_add\", 1, 7, 7, 1152]", "cuda -keys=cuda,gpu -max_num_threads=1024 -model=unknown -thread_warp_size=32", [-1, 16, 64, 49152, 2147483647, 1024, 8, 32], "", 0, []], [[], [["FU", 2, [0, 1, 2, 3]], ["SP", 2, 0, 56448, [24], 1], ["AN", 2, 0, 5], ["AN", 2, 1, 6]]]], "r": [[4.45134e-06, 4.45336e-06, 4.45195e-06], 0, 6.75836, 1681133165], "v": "v0.6"}
{"i": [["[\"shortcut_add\", 1, 7, 7, 1152]", "cuda -keys=cuda,gpu -max_num_threads=1024 -model=unknown -thread_warp_size=32", [-1, 16, 64, 49152, 2147483647, 1024, 8, 32], "", 0, []], [[], [["FU", 2, [0, 1, 2, 3]], ["SP", 2, 0, 56448, [32], 1], ["AN", 2, 0, 5], ["AN", 2, 1, 6]]]], "r": [[4.10689e-06, 4.10983e-06, 4.11201e-06], 0, 7.93537, 1681133167], "v": "v0.6"}
{"i": [["[\"shortcut_add\", 1, 7, 7, 1152]", "cuda -keys=cuda,gpu -max_num_threads=1024 -model=unknown -thread_warp_size=32", [-1, 16, 64, 49152, 2147483647, 1024, 8, 32], "", 0, []], [[], [["FU", 2, [0, 1, 2, 3]], ["SP", 2, 0, 56448, [42], 1], ["AN", 2, 0, 5], ["AN", 2, 1, 6]]]], "r": [[3.57987e-06, 3.58041e-06, 3.57919e-06], 0, 5.49299, 1681133164], "v": "v0.6"}
{"i": [["[\"shortcut_add\", 1, 7, 7, 1152]", "cuda -keys=cuda,gpu -max_num_threads=1024 -model=unknown -thread_warp_size=32", [-1, 16, 64, 49152, 2147483647, 1024, 8, 32], "", 0, []], [[], [["FU", 2, [0, 1, 2, 3]], ["SP", 2, 0, 56448, [6], 1], ["AN", 2, 0, 5], ["AN", 2, 1, 6]]]], "r": [[9.68604e-06, 9.68857e-06, 9.68294e-06], 0, 7.05917, 1681133166], "v": "v0.6"}
{"i": [["[\"shortcut_add\", 1, 7, 7, 1152]", "cuda -keys=cuda,gpu -max_num_threads=1024 -model=unknown -thread_warp_size=32", [-1, 16, 64, 49152, 2147483647, 1024, 8, 32], "", 0, []], [[], [["FU", 2, [0, 1, 2, 3]], ["SP", 2, 0, 56448, [14], 1], ["AN", 2, 0, 5], ["AN", 2, 1, 6]]]], "r": [[5.56932e-06, 5.57123e-06, 5.57686e-06], 0, 5.09783, 1681133164], "v": "v0.6"}
{"i": [["[\"shortcut_add\", 1, 7, 7, 1152]", "cuda -keys=cuda,gpu -max_num_threads=1024 -model=unknown -thread_warp_size=32", [-1, 16, 64, 49152, 2147483647, 1024, 8, 32], "", 0, []], [[], [["FU", 2, [0, 1, 2, 3]], ["SP", 2, 0, 56448, [18], 1], ["AN", 2, 0, 5], ["AN", 2, 1, 6]]]], "r": [[4.99336e-06, 4.99628e-06, 4.99834e-06], 0, 6.30696, 1681133165], "v": "v0.6"}
{"i": [["[\"shortcut_add\", 1, 7, 7, 1152]", "cuda -keys=cuda,gpu -max_num_threads=1024 -model=unknown -thread_warp_size=32", [-1, 16, 64, 49152, 2147483647, 1024, 8, 32], "", 0, []], [[], [["FU", 2, [0, 1, 2, 3]], ["SP", 2, 0, 56448, [4], 1], ["AN", 2, 0, 5], ["AN", 2, 1, 6]]]], "r": [[1.31383e-05, 1.31398e-05, 1.31428e-05], 0, 9.50462, 1681133168], "v": "v0.6"}
{"i": [["[\"shortcut_add\", 1, 7, 7, 1152]", "cuda -keys=cuda,gpu -max_num_threads=1024 -model=unknown -thread_warp_size=32", [-1, 16, 64, 49152, 2147483647, 1024, 8, 32], "", 0, []], [[], [["FU", 2, [0, 1, 2, 3]], ["SP", 2, 0, 56448, [7], 1], ["AN", 2, 0, 5], ["AN", 2, 1, 6]]]], "r": [[8.69482e-06, 8.69337e-06, 8.69478e-06], 0, 9.08899, 1681133168], "v": "v0.6"}
{"i": [["[\"shortcut_add\", 1, 7, 7, 1152]", "cuda -keys=cuda,gpu -max_num_threads=1024 -model=unknown -thread_warp_size=32", [-1, 16, 64, 49152, 2147483647, 1024, 8, 32], "", 0, []], [[], [["FU", 2, [0, 1, 2, 3]], ["SP", 2, 0, 56448, [16], 1], ["AN", 2, 0, 5], ["AN", 2, 1, 6]]]], "r": [[5.39142e-06, 5.39571e-06, 5.39873e-06], 0, 8.7361, 1681133168], "v": "v0.6"}
{"i": [["[\"shortcut_add\", 1, 7, 7, 1152]", "cuda -keys=cuda,gpu -max_num_threads=1024 -model=unknown -thread_warp_size=32", [-1, 16, 64, 49152, 2147483647, 1024, 8, 32], "", 0, []], [[], [["FU", 2, [0, 1, 2, 3]], ["SP", 2, 0, 56448, [21], 1], ["AN", 2, 0, 5], ["AN", 2, 1, 6]]]], "r": [[4.67297e-06, 4.68344e-06, 4.68271e-06], 0, 8.2757, 1681133167], "v": "v0.6"}
