python/models/efficientnet/kernel_configs/efficient_fused_pointwise_conv_bias_add_sigmoid_mul_112_112_8_32_1.log
{"i": [["[\"fused_pointwise_conv_bias_add_sigmoid_mul\", 112, 112, 8, 32, 1]", "cuda -keys=cuda,gpu -max_num_threads=1024 -model=unknown -thread_warp_size=32", [-1, 16, 64, 49152, 2147483647, 1024, 8, 32], "", 0, []], [[], [["CI", 5], ["CHW", 3, "local"], ["SP", 3, 0, 1, [1, 1, 1, 1], 1], ["SP", 3, 5, 32, [8, 4, 1, 1], 1], ["SP", 3, 10, 8, [8, 1], 1], ["RE", 3, [0, 5, 1, 6, 2, 7, 10, 11, 3, 8, 12, 4, 9]], ["FSP", 4, 0, 2, 3], ["FSP", 4, 4, 3, 3], ["RE", 4, [0, 4, 1, 5, 2, 6, 3, 7]], ["CA", 3, 4, 5], ["CHR", 2, "shared", [3]], ["CA", 3, 4, 6], ["CHR", 1, "shared", [4]], ["CA", 2, 5, 6], ["FU", 9, [0, 1, 2, 3]], ["SP", 9, 0, 401408, [2], 1], ["AN", 9, 0, 5], ["AN", 9, 1, 6], ["FU", 6, [0, 1]], ["AN", 6, 0, 5], ["FU", 6, [1, 2]], ["AN", 6, 1, 4], ["FU", 6, [2, 3]], ["AN", 6, 2, 6], ["FU", 4, [0, 1]], ["SP", 4, 0, 2, [2], 1], ["AN", 4, 1, 2], ["FFSP", 4, 0, [3, 2], 1, 1], ["AN", 4, 1, 6], ["FU", 2, [0, 1]], ["SP", 2, 0, 2, [1], 1], ["AN", 2, 1, 2], ["FFSP", 2, 0, [3, 2], 1, 1], ["AN", 2, 1, 6], ["PR", 5, 0, "auto_unroll_max_step$64"]]]], "r": [[0.000289481, 0.00028945, 0.000289486], 0, 2.13851, 1662025833], "v": "v0.6"}
{"i": [["[\"fused_pointwise_conv_bias_add_sigmoid_mul\", 112, 112, 8, 32, 1]", "cuda -keys=cuda,gpu -max_num_threads=1024 -model=unknown -thread_warp_size=32", [-1, 16, 64, 49152, 2147483647, 1024, 8, 32], "", 0, []], [[], [["CI", 5], ["CHW", 3, "local"], ["SP", 3, 0, 1, [1, 1, 1, 1], 1], ["SP", 3, 5, 32, [1, 2, 2, 4], 1], ["SP", 3, 10, 8, [8, 1], 1], ["RE", 3, [0, 5, 1, 6, 2, 7, 10, 11, 3, 8, 12, 4, 9]], ["FSP", 4, 0, 2, 3], ["FSP", 4, 4, 3, 3], ["RE", 4, [0, 4, 1, 5, 2, 6, 3, 7]], ["CA", 3, 4, 5], ["CHR", 2, "shared", [3]], ["CA", 3, 4, 6], ["CHR", 1, "shared", [4]], ["CA", 2, 5, 6], ["FU", 9, [0, 1, 2, 3]], ["SP", 9, 0, 401408, [32], 1], ["AN", 9, 0, 5], ["AN", 9, 1, 6], ["FU", 6, [0, 1]], ["AN", 6, 0, 5], ["FU", 6, [1, 2]], ["AN", 6, 1, 4], ["FU", 6, [2, 3]], ["AN", 6, 2, 6], ["FU", 4, [0, 1]], ["SP", 4, 0, 64, [1], 1], ["AN", 4, 1, 2], ["FFSP", 4, 0, [3, 2], 1, 1], ["AN", 4, 1, 6], ["FU", 2, [0, 1]], ["SP", 2, 0, 8, [1], 1], ["AN", 2, 1, 2], ["FFSP", 2, 0, [3, 2], 1, 1], ["AN", 2, 1, 6], ["PR", 5, 0, "auto_unroll_max_step$16"]]]], "r": [[2.86835e-05, 2.86842e-05, 2.86833e-05], 0, 0.91527, 1662025832], "v": "v0.6"}
{"i": [["[\"fused_pointwise_conv_bias_add_sigmoid_mul\", 112, 112, 8, 32, 1]", "cuda -keys=cuda,gpu -max_num_threads=1024 -model=unknown -thread_warp_size=32", [-1, 16, 64, 49152, 2147483647, 1024, 8, 32], "", 0, []], [[], [["CI", 5], ["CHW", 3, "local"], ["SP", 3, 0, 1, [1, 1, 1, 1], 1], ["SP", 3, 5, 32, [1, 4, 4, 1], 1], ["SP", 3, 10, 8, [1, 8], 1], ["RE", 3, [0, 5, 1, 6, 2, 7, 10, 11, 3, 8, 12, 4, 9]], ["FSP", 4, 0, 2, 3], ["FSP", 4, 4, 3, 3], ["RE", 4, [0, 4, 1, 5, 2, 6, 3, 7]], ["CA", 3, 4, 5], ["CHR", 2, "shared", [3]], ["CA", 3, 4, 6], ["CHR", 1, "shared", [4]], ["CA", 2, 5, 6], ["FU", 9, [0, 1, 2, 3]], ["SP", 9, 0, 401408, [64], 1], ["AN", 9, 0, 5], ["AN", 9, 1, 6], ["FU", 6, [0, 1]], ["AN", 6, 0, 5], ["FU", 6, [1, 2]], ["AN", 6, 1, 4], ["FU", 6, [2, 3]], ["AN", 6, 2, 6], ["FU", 4, [0, 1]], ["SP", 4, 0, 32, [4], 1], ["AN", 4, 1, 2], ["FFSP", 4, 0, [3, 2], 1, 1], ["AN", 4, 1, 6], ["FU", 2, [0, 1]], ["SP", 2, 0, 8, [1], 1], ["AN", 2, 1, 2], ["FFSP", 2, 0, [3, 2], 1, 1], ["AN", 2, 1, 6], ["PR", 5, 0, "auto_unroll_max_step$64"]]]], "r": [[1.84115e-05, 1.84091e-05, 1.8411e-05], 0, 6.71056, 1662025838], "v": "v0.6"}
{"i": [["[\"fused_pointwise_conv_bias_add_sigmoid_mul\", 112, 112, 8, 32, 1]", "cuda -keys=cuda,gpu -max_num_threads=1024 -model=unknown -thread_warp_size=32", [-1, 16, 64, 49152, 2147483647, 1024, 8, 32], "", 0, []], [[], [["CI", 5], ["CHW", 3, "local"], ["SP", 3, 0, 1, [1, 1, 1, 1], 1], ["SP", 3, 5, 32, [1, 1, 32, 1], 1], ["SP", 3, 10, 8, [1, 1], 1], ["RE", 3, [0, 5, 1, 6, 2, 7, 10, 11, 3, 8, 12, 4, 9]], ["FSP", 4, 0, 2, 3], ["FSP", 4, 4, 3, 3], ["RE", 4, [0, 4, 1, 5, 2, 6, 3, 7]], ["CA", 3, 4, 5], ["CHR", 2, "shared", [3]], ["CA", 3, 4, 6], ["CHR", 1, "shared", [4]], ["CA", 2, 5, 6], ["FU", 9, [0, 1, 2, 3]], ["SP", 9, 0, 401408, [32], 1], ["AN", 9, 0, 5], ["AN", 9, 1, 6], ["FU", 6, [0, 1]], ["AN", 6, 0, 5], ["FU", 6, [1, 2]], ["AN", 6, 1, 4], ["FU", 6, [2, 3]], ["AN", 6, 2, 6], ["FU", 4, [0, 1]], ["SP", 4, 0, 16, [1], 1], ["AN", 4, 1, 2], ["FFSP", 4, 0, [3, 2], 1, 1], ["AN", 4, 1, 6], ["FU", 2, [0, 1]], ["SP", 2, 0, 1, [1], 1], ["AN", 2, 1, 2], ["FFSP", 2, 0, [3, 2], 1, 1], ["AN", 2, 1, 6], ["PR", 5, 0, "auto_unroll_max_step$1024"]]]], "r": [[3.25677e-05, 3.25891e-05, 3.2592e-05], 0, 1.81141, 1662025833], "v": "v0.6"}
{"i": [["[\"fused_pointwise_conv_bias_add_sigmoid_mul\", 112, 112, 8, 32, 1]", "cuda -keys=cuda,gpu -max_num_threads=1024 -model=unknown -thread_warp_size=32", [-1, 16, 64, 49152, 2147483647, 1024, 8, 32], "", 0, []], [[], [["CI", 5], ["CHW", 3, "local"], ["SP", 3, 0, 1, [1, 1, 1, 1], 1], ["SP", 3, 5, 32, [1, 1, 1, 8], 1], ["SP", 3, 10, 8, [2, 4], 1], ["RE", 3, [0, 5, 1, 6, 2, 7, 10, 11, 3, 8, 12, 4, 9]], ["FSP", 4, 0, 2, 3], ["FSP", 4, 4, 3, 3], ["RE", 4, [0, 4, 1, 5, 2, 6, 3, 7]], ["CA", 3, 4, 5], ["CHR", 2, "shared", [3]], ["CA", 3, 4, 6], ["CHR", 1, "shared", [4]], ["CA", 2, 5, 6], ["FU", 9, [0, 1, 2, 3]], ["SP", 9, 0, 401408, [32], 1], ["AN", 9, 0, 5], ["AN", 9, 1, 6], ["FU", 6, [0, 1]], ["AN", 6, 0, 5], ["FU", 6, [1, 2]], ["AN", 6, 1, 4], ["FU", 6, [2, 3]], ["AN", 6, 2, 6], ["FU", 4, [0, 1]], ["SP", 4, 0, 64, [1], 1], ["AN", 4, 1, 2], ["FFSP", 4, 0, [3, 2], 1, 1], ["AN", 4, 1, 6], ["FU", 2, [0, 1]], ["SP", 2, 0, 8, [2], 1], ["AN", 2, 1, 2], ["FFSP", 2, 0, [3, 2], 1, 1], ["AN", 2, 1, 6], ["PR", 5, 0, "auto_unroll_max_step$64"]]]], "r": [[2.85123e-05, 2.85094e-05, 2.85113e-05], 0, 2.67626, 1662025834], "v": "v0.6"}
{"i": [["[\"fused_pointwise_conv_bias_add_sigmoid_mul\", 112, 112, 8, 32, 1]", "cuda -keys=cuda,gpu -max_num_threads=1024 -model=unknown -thread_warp_size=32", [-1, 16, 64, 49152, 2147483647, 1024, 8, 32], "", 0, []], [[], [["CI", 5], ["CHW", 3, "local"], ["SP", 3, 0, 1, [1, 1, 1, 1], 1], ["SP", 3, 5, 32, [4, 4, 1, 1], 1], ["SP", 3, 10, 8, [4, 1], 1], ["RE", 3, [0, 5, 1, 6, 2, 7, 10, 11, 3, 8, 12, 4, 9]], ["FSP", 4, 0, 2, 3], ["FSP", 4, 4, 3, 3], ["RE", 4, [0, 4, 1, 5, 2, 6, 3, 7]], ["CA", 3, 4, 5], ["CHR", 2, "shared", [3]], ["CA", 3, 4, 6], ["CHR", 1, "shared", [4]], ["CA", 2, 5, 6], ["FU", 9, [0, 1, 2, 3]], ["SP", 9, 0, 401408, [14], 1], ["AN", 9, 0, 5], ["AN", 9, 1, 6], ["FU", 6, [0, 1]], ["AN", 6, 0, 5], ["FU", 6, [1, 2]], ["AN", 6, 1, 4], ["FU", 6, [2, 3]], ["AN", 6, 2, 6], ["FU", 4, [0, 1]], ["SP", 4, 0, 4, [1], 1], ["AN", 4, 1, 2], ["FFSP", 4, 0, [3, 2], 1, 1], ["AN", 4, 1, 6], ["FU", 2, [0, 1]], ["SP", 2, 0, 4, [1], 1], ["AN", 2, 1, 2], ["FFSP", 2, 0, [3, 2], 1, 1], ["AN", 2, 1, 6], ["PR", 5, 0, "auto_unroll_max_step$512"]]]], "r": [[5.0589e-05, 5.06076e-05, 5.06069e-05], 0, 3.32223, 1662025835], "v": "v0.6"}
{"i": [["[\"fused_pointwise_conv_bias_add_sigmoid_mul\", 112, 112, 8, 32, 1]", "cuda -keys=cuda,gpu -max_num_threads=1024 -model=unknown -thread_warp_size=32", [-1, 16, 64, 49152, 2147483647, 1024, 8, 32], "", 0, []], [[], [["CI", 5], ["CHW", 3, "local"], ["SP", 3, 0, 1, [1, 1, 1, 1], 1], ["SP", 3, 5, 32, [4, 4, 1, 1], 1], ["SP", 3, 10, 8, [1, 8], 1], ["RE", 3, [0, 5, 1, 6, 2, 7, 10, 11, 3, 8, 12, 4, 9]], ["FSP", 4, 0, 2, 3], ["FSP", 4, 4, 3, 3], ["RE", 4, [0, 4, 1, 5, 2, 6, 3, 7]], ["CA", 3, 4, 5], ["CHR", 2, "shared", [3]], ["CA", 3, 4, 6], ["CHR", 1, "shared", [4]], ["CA", 2, 5, 6], ["FU", 9, [0, 1, 2, 3]], ["SP", 9, 0, 401408, [32], 1], ["AN", 9, 0, 5], ["AN", 9, 1, 6], ["FU", 6, [0, 1]], ["AN", 6, 0, 5], ["FU", 6, [1, 2]], ["AN", 6, 1, 4], ["FU", 6, [2, 3]], ["AN", 6, 2, 6], ["FU", 4, [0, 1]], ["SP", 4, 0, 2, [2], 1], ["AN", 4, 1, 2], ["FFSP", 4, 0, [3, 2], 1, 1], ["AN", 4, 1, 6], ["FU", 2, [0, 1]], ["SP", 2, 0, 2, [2], 1], ["AN", 2, 1, 2], ["FFSP", 2, 0, [3, 2], 1, 1], ["AN", 2, 1, 6], ["PR", 5, 0, "auto_unroll_max_step$0"]]]], "r": [[2.78697e-05, 2.78757e-05, 2.78701e-05], 0, 5.04305, 1662025836], "v": "v0.6"}
{"i": [["[\"fused_pointwise_conv_bias_add_sigmoid_mul\", 112, 112, 8, 32, 1]", "cuda -keys=cuda,gpu -max_num_threads=1024 -model=unknown -thread_warp_size=32", [-1, 16, 64, 49152, 2147483647, 1024, 8, 32], "", 0, []], [[], [["CI", 5], ["CHW", 3, "local"], ["SP", 3, 0, 1, [1, 1, 1, 1], 1], ["SP", 3, 5, 32, [4, 1, 4, 2], 1], ["SP", 3, 10, 8, [8, 1], 1], ["RE", 3, [0, 5, 1, 6, 2, 7, 10, 11, 3, 8, 12, 4, 9]], ["FSP", 4, 0, 2, 3], ["FSP", 4, 4, 3, 3], ["RE", 4, [0, 4, 1, 5, 2, 6, 3, 7]], ["CA", 3, 4, 5], ["CHR", 2, "shared", [3]], ["CA", 3, 4, 6], ["CHR", 1, "shared", [4]], ["CA", 2, 5, 6], ["FU", 9, [0, 1, 2, 3]], ["SP", 9, 0, 401408, [32], 1], ["AN", 9, 0, 5], ["AN", 9, 1, 6], ["FU", 6, [0, 1]], ["AN", 6, 0, 5], ["FU", 6, [1, 2]], ["AN", 6, 1, 4], ["FU", 6, [2, 3]], ["AN", 6, 2, 6], ["FU", 4, [0, 1]], ["SP", 4, 0, 8, [1], 1], ["AN", 4, 1, 2], ["FFSP", 4, 0, [3, 2], 1, 1], ["AN", 4, 1, 6], ["FU", 2, [0, 1]], ["SP", 2, 0, 1, [1], 1], ["AN", 2, 1, 2], ["FFSP", 2, 0, [3, 2], 1, 1], ["AN", 2, 1, 6], ["PR", 5, 0, "auto_unroll_max_step$0"]]]], "r": [[3.14729e-05, 3.1495e-05, 3.14976e-05], 0, 3.82663, 1662025835], "v": "v0.6"}
{"i": [["[\"fused_pointwise_conv_bias_add_sigmoid_mul\", 112, 112, 8, 32, 1]", "cuda -keys=cuda,gpu -max_num_threads=1024 -model=unknown -thread_warp_size=32", [-1, 16, 64, 49152, 2147483647, 1024, 8, 32], "", 0, []], [[], [["CI", 5], ["CHW", 3, "local"], ["SP", 3, 0, 1, [1, 1, 1, 1], 1], ["SP", 3, 5, 32, [4, 4, 2, 1], 1], ["SP", 3, 10, 8, [2, 1], 1], ["RE", 3, [0, 5, 1, 6, 2, 7, 10, 11, 3, 8, 12, 4, 9]], ["FSP", 4, 0, 2, 3], ["FSP", 4, 4, 3, 3], ["RE", 4, [0, 4, 1, 5, 2, 6, 3, 7]], ["CA", 3, 4, 5], ["CHR", 2, "shared", [3]], ["CA", 3, 4, 6], ["CHR", 1, "shared", [4]], ["CA", 2, 5, 6], ["FU", 9, [0, 1, 2, 3]], ["SP", 9, 0, 401408, [16], 1], ["AN", 9, 0, 5], ["AN", 9, 1, 6], ["FU", 6, [0, 1]], ["AN", 6, 0, 5], ["FU", 6, [1, 2]], ["AN", 6, 1, 4], ["FU", 6, [2, 3]], ["AN", 6, 2, 6], ["FU", 4, [0, 1]], ["SP", 4, 0, 4, [1], 1], ["AN", 4, 1, 2], ["FFSP", 4, 0, [3, 2], 1, 1], ["AN", 4, 1, 6], ["FU", 2, [0, 1]], ["SP", 2, 0, 2, [1], 1], ["AN", 2, 1, 2], ["FFSP", 2, 0, [3, 2], 1, 1], ["AN", 2, 1, 6], ["PR", 5, 0, "auto_unroll_max_step$1024"]]]], "r": [[4.62143e-05, 4.62345e-05, 4.62347e-05], 0, 5.53264, 1662025837], "v": "v0.6"}
{"i": [["[\"fused_pointwise_conv_bias_add_sigmoid_mul\", 112, 112, 8, 32, 1]", "cuda -keys=cuda,gpu -max_num_threads=1024 -model=unknown -thread_warp_size=32", [-1, 16, 64, 49152, 2147483647, 1024, 8, 32], "", 0, []], [[], [["CI", 5], ["CHW", 3, "local"], ["SP", 3, 0, 1, [1, 1, 1, 1], 1], ["SP", 3, 5, 32, [4, 1, 8, 1], 1], ["SP", 3, 10, 8, [2, 4], 1], ["RE", 3, [0, 5, 1, 6, 2, 7, 10, 11, 3, 8, 12, 4, 9]], ["FSP", 4, 0, 2, 3], ["FSP", 4, 4, 3, 3], ["RE", 4, [0, 4, 1, 5, 2, 6, 3, 7]], ["CA", 3, 4, 5], ["CHR", 2, "shared", [3]], ["CA", 3, 4, 6], ["CHR", 1, "shared", [4]], ["CA", 2, 5, 6], ["FU", 9, [0, 1, 2, 3]], ["SP", 9, 0, 401408, [32], 1], ["AN", 9, 0, 5], ["AN", 9, 1, 6], ["FU", 6, [0, 1]], ["AN", 6, 0, 5], ["FU", 6, [1, 2]], ["AN", 6, 1, 4], ["FU", 6, [2, 3]], ["AN", 6, 2, 6], ["FU", 4, [0, 1]], ["SP", 4, 0, 16, [2], 1], ["AN", 4, 1, 2], ["FFSP", 4, 0, [3, 2], 1, 1], ["AN", 4, 1, 6], ["FU", 2, [0, 1]], ["SP", 2, 0, 2, [1], 1], ["AN", 2, 1, 2], ["FFSP", 2, 0, [3, 2], 1, 1], ["AN", 2, 1, 6], ["PR", 5, 0, "auto_unroll_max_step$0"]]]], "r": [[3.16758e-05, 3.17071e-05, 3.17069e-05], 0, 8.59537, 1662025840], "v": "v0.6"}
{"i": [["[\"fused_pointwise_conv_bias_add_sigmoid_mul\", 112, 112, 8, 32, 1]", "cuda -keys=cuda,gpu -max_num_threads=1024 -model=unknown -thread_warp_size=32", [-1, 16, 64, 49152, 2147483647, 1024, 8, 32], "", 0, []], [[], [["CI", 5], ["CHW", 3, "local"], ["SP", 3, 0, 1, [1, 1, 1, 1], 1], ["SP", 3, 5, 32, [2, 2, 4, 1], 1], ["SP", 3, 10, 8, [4, 1], 1], ["RE", 3, [0, 5, 1, 6, 2, 7, 10, 11, 3, 8, 12, 4, 9]], ["FSP", 4, 0, 2, 3], ["FSP", 4, 4, 3, 3], ["RE", 4, [0, 4, 1, 5, 2, 6, 3, 7]], ["CA", 3, 4, 5], ["CHR", 2, "shared", [3]], ["CA", 3, 4, 6], ["CHR", 1, "shared", [4]], ["CA", 2, 5, 6], ["FU", 9, [0, 1, 2, 3]], ["SP", 9, 0, 401408, [32], 1], ["AN", 9, 0, 5], ["AN", 9, 1, 6], ["FU", 6, [0, 1]], ["AN", 6, 0, 5], ["FU", 6, [1, 2]], ["AN", 6, 1, 4], ["FU", 6, [2, 3]], ["AN", 6, 2, 6], ["FU", 4, [0, 1]], ["SP", 4, 0, 16, [4], 1], ["AN", 4, 1, 2], ["FFSP", 4, 0, [3, 2], 1, 1], ["AN", 4, 1, 6], ["FU", 2, [0, 1]], ["SP", 2, 0, 4, [1], 1], ["AN", 2, 1, 2], ["FFSP", 2, 0, [3, 2], 1, 1], ["AN", 2, 1, 6], ["PR", 5, 0, "auto_unroll_max_step$512"]]]], "r": [[2.83361e-05, 2.83372e-05, 2.83337e-05], 0, 7.85335, 1662025839], "v": "v0.6"}
{"i": [["[\"fused_pointwise_conv_bias_add_sigmoid_mul\", 112, 112, 8, 32, 1]", "cuda -keys=cuda,gpu -max_num_threads=1024 -model=unknown -thread_warp_size=32", [-1, 16, 64, 49152, 2147483647, 1024, 8, 32], "", 0, []], [[], [["CI", 5], ["CHW", 3, "local"], ["SP", 3, 0, 1, [1, 1, 1, 1], 1], ["SP", 3, 5, 32, [1, 1, 1, 4], 1], ["SP", 3, 10, 8, [1, 8], 1], ["RE", 3, [0, 5, 1, 6, 2, 7, 10, 11, 3, 8, 12, 4, 9]], ["FSP", 4, 0, 2, 3], ["FSP", 4, 4, 3, 3], ["RE", 4, [0, 4, 1, 5, 2, 6, 3, 7]], ["CA", 3, 4, 5], ["CHR", 2, "shared", [3]], ["CA", 3, 4, 6], ["CHR", 1, "shared", [4]], ["CA", 2, 5, 6], ["FU", 9, [0, 1, 2, 3]], ["SP", 9, 0, 401408, [4], 1], ["AN", 9, 0, 5], ["AN", 9, 1, 6], ["FU", 6, [0, 1]], ["AN", 6, 0, 5], ["FU", 6, [1, 2]], ["AN", 6, 1, 4], ["FU", 6, [2, 3]], ["AN", 6, 2, 6], ["FU", 4, [0, 1]], ["SP", 4, 0, 32, [1], 1], ["AN", 4, 1, 2], ["FFSP", 4, 0, [3, 2], 1, 1], ["AN", 4, 1, 6], ["FU", 2, [0, 1]], ["SP", 2, 0, 8, [1], 1], ["AN", 2, 1, 2], ["FFSP", 2, 0, [3, 2], 1, 1], ["AN", 2, 1, 6], ["PR", 5, 0, "auto_unroll_max_step$512"]]]], "r": [[0.00014985, 0.000149843, 0.00014985], 0, 4.4237, 1662025836], "v": "v0.6"}
{"i": [["[\"fused_pointwise_conv_bias_add_sigmoid_mul\", 112, 112, 8, 32, 1]", "cuda -keys=cuda,gpu -max_num_threads=1024 -model=unknown -thread_warp_size=32", [-1, 16, 64, 49152, 2147483647, 1024, 8, 32], "", 0, []], [[], [["CI", 5], ["CHW", 3, "local"], ["SP", 3, 0, 1, [1, 1, 1, 1], 1], ["SP", 3, 5, 32, [1, 1, 4, 1], 1], ["SP", 3, 10, 8, [4, 1], 1], ["RE", 3, [0, 5, 1, 6, 2, 7, 10, 11, 3, 8, 12, 4, 9]], ["FSP", 4, 0, 2, 3], ["FSP", 4, 4, 3, 3], ["RE", 4, [0, 4, 1, 5, 2, 6, 3, 7]], ["CA", 3, 4, 5], ["CHR", 2, "shared", [3]], ["CA", 3, 4, 6], ["CHR", 1, "shared", [4]], ["CA", 2, 5, 6], ["FU", 9, [0, 1, 2, 3]], ["SP", 9, 0, 401408, [32], 1], ["AN", 9, 0, 5], ["AN", 9, 1, 6], ["FU", 6, [0, 1]], ["AN", 6, 0, 5], ["FU", 6, [1, 2]], ["AN", 6, 1, 4], ["FU", 6, [2, 3]], ["AN", 6, 2, 6], ["FU", 4, [0, 1]], ["SP", 4, 0, 4, [1], 1], ["AN", 4, 1, 2], ["FFSP", 4, 0, [3, 2], 1, 1], ["AN", 4, 1, 6], ["FU", 2, [0, 1]], ["SP", 2, 0, 4, [1], 1], ["AN", 2, 1, 2], ["FFSP", 2, 0, [3, 2], 1, 1], ["AN", 2, 1, 6], ["PR", 5, 0, "auto_unroll_max_step$64"]]]], "r": [[2.7449e-05, 2.74505e-05, 2.74525e-05], 0, 10.7242, 1662025842], "v": "v0.6"}
{"i": [["[\"fused_pointwise_conv_bias_add_sigmoid_mul\", 112, 112, 8, 32, 1]", "cuda -keys=cuda,gpu -max_num_threads=1024 -model=unknown -thread_warp_size=32", [-1, 16, 64, 49152, 2147483647, 1024, 8, 32], "", 0, []], [[], [["CI", 5], ["CHW", 3, "local"], ["SP", 3, 0, 1, [1, 1, 1, 1], 1], ["SP", 3, 5, 32, [1, 2, 2, 8], 1], ["SP", 3, 10, 8, [2, 1], 1], ["RE", 3, [0, 5, 1, 6, 2, 7, 10, 11, 3, 8, 12, 4, 9]], ["FSP", 4, 0, 2, 3], ["FSP", 4, 4, 3, 3], ["RE", 4, [0, 4, 1, 5, 2, 6, 3, 7]], ["CA", 3, 4, 5], ["CHR", 2, "shared", [3]], ["CA", 3, 4, 6], ["CHR", 1, "shared", [4]], ["CA", 2, 5, 6], ["FU", 9, [0, 1, 2, 3]], ["SP", 9, 0, 401408, [32], 1], ["AN", 9, 0, 5], ["AN", 9, 1, 6], ["FU", 6, [0, 1]], ["AN", 6, 0, 5], ["FU", 6, [1, 2]], ["AN", 6, 1, 4], ["FU", 6, [2, 3]], ["AN", 6, 2, 6], ["FU", 4, [0, 1]], ["SP", 4, 0, 16, [1], 1], ["AN", 4, 1, 2], ["FFSP", 4, 0, [3, 2], 1, 1], ["AN", 4, 1, 6], ["FU", 2, [0, 1]], ["SP", 2, 0, 1, [1], 1], ["AN", 2, 1, 2], ["FFSP", 2, 0, [3, 2], 1, 1], ["AN", 2, 1, 6], ["PR", 5, 0, "auto_unroll_max_step$16"]]]], "r": [[3.02539e-05, 3.02588e-05, 3.02476e-05], 0, 9.5381, 1662025841], "v": "v0.6"}
{"i": [["[\"fused_pointwise_conv_bias_add_sigmoid_mul\", 112, 112, 8, 32, 1]", "cuda -keys=cuda,gpu -max_num_threads=1024 -model=unknown -thread_warp_size=32", [-1, 16, 64, 49152, 2147483647, 1024, 8, 32], "", 0, []], [[], [["CI", 5], ["CHW", 3, "local"], ["SP", 3, 0, 1, [1, 1, 1, 1], 1], ["SP", 3, 5, 32, [4, 4, 1, 2], 1], ["SP", 3, 10, 8, [1, 4], 1], ["RE", 3, [0, 5, 1, 6, 2, 7, 10, 11, 3, 8, 12, 4, 9]], ["FSP", 4, 0, 2, 3], ["FSP", 4, 4, 3, 3], ["RE", 4, [0, 4, 1, 5, 2, 6, 3, 7]], ["CA", 3, 4, 5], ["CHR", 2, "shared", [3]], ["CA", 3, 4, 6], ["CHR", 1, "shared", [4]], ["CA", 2, 5, 6], ["FU", 9, [0, 1, 2, 3]], ["SP", 9, 0, 401408, [32], 1], ["AN", 9, 0, 5], ["AN", 9, 1, 6], ["FU", 6, [0, 1]], ["AN", 6, 0, 5], ["FU", 6, [1, 2]], ["AN", 6, 1, 4], ["FU", 6, [2, 3]], ["AN", 6, 2, 6], ["FU", 4, [0, 1]], ["SP", 4, 0, 8, [1], 1], ["AN", 4, 1, 2], ["FFSP", 4, 0, [3, 2], 1, 1], ["AN", 4, 1, 6], ["FU", 2, [0, 1]], ["SP", 2, 0, 4, [1], 1], ["AN", 2, 1, 2], ["FFSP", 2, 0, [3, 2], 1, 1], ["AN", 2, 1, 6], ["PR", 5, 0, "auto_unroll_max_step$0"]]]], "r": [[2.86174e-05, 2.86175e-05, 2.86161e-05], 0, 7.21011, 1662025839], "v": "v0.6"}
{"i": [["[\"fused_pointwise_conv_bias_add_sigmoid_mul\", 112, 112, 8, 32, 1]", "cuda -keys=cuda,gpu -max_num_threads=1024 -model=unknown -thread_warp_size=32", [-1, 16, 64, 49152, 2147483647, 1024, 8, 32], "", 0, []], [[], [["CI", 5], ["CHW", 3, "local"], ["SP", 3, 0, 1, [1, 1, 1, 1], 1], ["SP", 3, 5, 32, [1, 1, 1, 8], 1], ["SP", 3, 10, 8, [8, 1], 1], ["RE", 3, [0, 5, 1, 6, 2, 7, 10, 11, 3, 8, 12, 4, 9]], ["FSP", 4, 0, 2, 3], ["FSP", 4, 4, 3, 3], ["RE", 4, [0, 4, 1, 5, 2, 6, 3, 7]], ["CA", 3, 4, 5], ["CHR", 2, "shared", [3]], ["CA", 3, 4, 6], ["CHR", 1, "shared", [4]], ["CA", 2, 5, 6], ["FU", 9, [0, 1, 2, 3]], ["SP", 9, 0, 401408, [2], 1], ["AN", 9, 0, 5], ["AN", 9, 1, 6], ["FU", 6, [0, 1]], ["AN", 6, 0, 5], ["FU", 6, [1, 2]], ["AN", 6, 1, 4], ["FU", 6, [2, 3]], ["AN", 6, 2, 6], ["FU", 4, [0, 1]], ["SP", 4, 0, 128, [1], 1], ["AN", 4, 1, 2], ["FFSP", 4, 0, [3, 2], 1, 1], ["AN", 4, 1, 6], ["FU", 2, [0, 1]], ["SP", 2, 0, 4, [1], 1], ["AN", 2, 1, 2], ["FFSP", 2, 0, [3, 2], 1, 1], ["AN", 2, 1, 6], ["PR", 5, 0, "auto_unroll_max_step$64"]]]], "r": [[0.000289705, 0.000289677, 0.000289665], 0, 6.07535, 1662025838], "v": "v0.6"}
{"i": [["[\"fused_pointwise_conv_bias_add_sigmoid_mul\", 112, 112, 8, 32, 1]", "cuda -keys=cuda,gpu -max_num_threads=1024 -model=unknown -thread_warp_size=32", [-1, 16, 64, 49152, 2147483647, 1024, 8, 32], "", 0, []], [[], [["CI", 5], ["CHW", 3, "local"], ["SP", 3, 0, 1, [1, 1, 1, 1], 1], ["SP", 3, 5, 32, [1, 16, 1, 1], 1], ["SP", 3, 10, 8, [4, 1], 1], ["RE", 3, [0, 5, 1, 6, 2, 7, 10, 11, 3, 8, 12, 4, 9]], ["FSP", 4, 0, 2, 3], ["FSP", 4, 4, 3, 3], ["RE", 4, [0, 4, 1, 5, 2, 6, 3, 7]], ["CA", 3, 4, 5], ["CHR", 2, "shared", [3]], ["CA", 3, 4, 6], ["CHR", 1, "shared", [4]], ["CA", 2, 5, 6], ["FU", 9, [0, 1, 2, 3]], ["SP", 9, 0, 401408, [32], 1], ["AN", 9, 0, 5], ["AN", 9, 1, 6], ["FU", 6, [0, 1]], ["AN", 6, 0, 5], ["FU", 6, [1, 2]], ["AN", 6, 1, 4], ["FU", 6, [2, 3]], ["AN", 6, 2, 6], ["FU", 4, [0, 1]], ["SP", 4, 0, 4, [1], 1], ["AN", 4, 1, 2], ["FFSP", 4, 0, [3, 2], 1, 1], ["AN", 4, 1, 6], ["FU", 2, [0, 1]], ["SP", 2, 0, 2, [1], 1], ["AN", 2, 1, 2], ["FFSP", 2, 0, [3, 2], 1, 1], ["AN", 2, 1, 6], ["PR", 5, 0, "auto_unroll_max_step$16"]]]], "r": [[2.7465e-05, 2.74625e-05, 2.74645e-05], 0, 8.95021, 1662025840], "v": "v0.6"}
{"i": [["[\"fused_pointwise_conv_bias_add_sigmoid_mul\", 112, 112, 8, 32, 1]", "cuda -keys=cuda,gpu -max_num_threads=1024 -model=unknown -thread_warp_size=32", [-1, 16, 64, 49152, 2147483647, 1024, 8, 32], "", 0, []], [[], [["CI", 5], ["CHW", 3, "local"], ["SP", 3, 0, 1, [1, 1, 1, 1], 1], ["SP", 3, 5, 32, [1, 1, 8, 1], 1], ["SP", 3, 10, 8, [2, 2], 1], ["RE", 3, [0, 5, 1, 6, 2, 7, 10, 11, 3, 8, 12, 4, 9]], ["FSP", 4, 0, 2, 3], ["FSP", 4, 4, 3, 3], ["RE", 4, [0, 4, 1, 5, 2, 6, 3, 7]], ["CA", 3, 4, 5], ["CHR", 2, "shared", [3]], ["CA", 3, 4, 6], ["CHR", 1, "shared", [4]], ["CA", 2, 5, 6], ["FU", 9, [0, 1, 2, 3]], ["SP", 9, 0, 401408, [64], 1], ["AN", 9, 0, 5], ["AN", 9, 1, 6], ["FU", 6, [0, 1]], ["AN", 6, 0, 5], ["FU", 6, [1, 2]], ["AN", 6, 1, 4], ["FU", 6, [2, 3]], ["AN", 6, 2, 6], ["FU", 4, [0, 1]], ["SP", 4, 0, 32, [1], 1], ["AN", 4, 1, 2], ["FFSP", 4, 0, [3, 2], 1, 1], ["AN", 4, 1, 6], ["FU", 2, [0, 1]], ["SP", 2, 0, 4, [4], 1], ["AN", 2, 1, 2], ["FFSP", 2, 0, [3, 2], 1, 1], ["AN", 2, 1, 6], ["PR", 5, 0, "auto_unroll_max_step$16"]]]], "r": [[2.02811e-05, 2.02705e-05, 2.02557e-05], 0, 11.1917, 1662025843], "v": "v0.6"}
{"i": [["[\"fused_pointwise_conv_bias_add_sigmoid_mul\", 112, 112, 8, 32, 1]", "cuda -keys=cuda,gpu -max_num_threads=1024 -model=unknown -thread_warp_size=32", [-1, 16, 64, 49152, 2147483647, 1024, 8, 32], "", 0, []], [[], [["CI", 5], ["CHW", 3, "local"], ["SP", 3, 0, 1, [1, 1, 1, 1], 1], ["SP", 3, 5, 32, [4, 1, 2, 1], 1], ["SP", 3, 10, 8, [1, 2], 1], ["RE", 3, [0, 5, 1, 6, 2, 7, 10, 11, 3, 8, 12, 4, 9]], ["FSP", 4, 0, 2, 3], ["FSP", 4, 4, 3, 3], ["RE", 4, [0, 4, 1, 5, 2, 6, 3, 7]], ["CA", 3, 4, 5], ["CHR", 2, "shared", [3]], ["CA", 3, 4, 6], ["CHR", 1, "shared", [4]], ["CA", 2, 5, 6], ["FU", 9, [0, 1, 2, 3]], ["SP", 9, 0, 401408, [32], 1], ["AN", 9, 0, 5], ["AN", 9, 1, 6], ["FU", 6, [0, 1]], ["AN", 6, 0, 5], ["FU", 6, [1, 2]], ["AN", 6, 1, 4], ["FU", 6, [2, 3]], ["AN", 6, 2, 6], ["FU", 4, [0, 1]], ["SP", 4, 0, 4, [1], 1], ["AN", 4, 1, 2], ["FFSP", 4, 0, [3, 2], 1, 1], ["AN", 4, 1, 6], ["FU", 2, [0, 1]], ["SP", 2, 0, 2, [1], 1], ["AN", 2, 1, 2], ["FFSP", 2, 0, [3, 2], 1, 1], ["AN", 2, 1, 6], ["PR", 5, 0, "auto_unroll_max_step$16"]]]], "r": [[2.82089e-05, 2.82071e-05, 2.82032e-05], 0, 11.7946, 1662025843], "v": "v0.6"}
{"i": [["[\"fused_pointwise_conv_bias_add_sigmoid_mul\", 112, 112, 8, 32, 1]", "cuda -keys=cuda,gpu -max_num_threads=1024 -model=unknown -thread_warp_size=32", [-1, 16, 64, 49152, 2147483647, 1024, 8, 32], "", 0, []], [[], [["CI", 5], ["CHW", 3, "local"], ["SP", 3, 0, 1, [1, 1, 1, 1], 1], ["SP", 3, 5, 32, [1, 1, 1, 32], 1], ["SP", 3, 10, 8, [1, 1], 1], ["RE", 3, [0, 5, 1, 6, 2, 7, 10, 11, 3, 8, 12, 4, 9]], ["FSP", 4, 0, 2, 3], ["FSP", 4, 4, 3, 3], ["RE", 4, [0, 4, 1, 5, 2, 6, 3, 7]], ["CA", 3, 4, 5], ["CHR", 2, "shared", [3]], ["CA", 3, 4, 6], ["CHR", 1, "shared", [4]], ["CA", 2, 5, 6], ["FU", 9, [0, 1, 2, 3]], ["SP", 9, 0, 401408, [32], 1], ["AN", 9, 0, 5], ["AN", 9, 1, 6], ["FU", 6, [0, 1]], ["AN", 6, 0, 5], ["FU", 6, [1, 2]], ["AN", 6, 1, 4], ["FU", 6, [2, 3]], ["AN", 6, 2, 6], ["FU", 4, [0, 1]], ["SP", 4, 0, 32, [1], 1], ["AN", 4, 1, 2], ["FFSP", 4, 0, [3, 2], 1, 1], ["AN", 4, 1, 6], ["FU", 2, [0, 1]], ["SP", 2, 0, 1, [1], 1], ["AN", 2, 1, 2], ["FFSP", 2, 0, [3, 2], 1, 1], ["AN", 2, 1, 6], ["PR", 5, 0, "auto_unroll_max_step$64"]]]], "r": [[3.18541e-05, 3.18832e-05, 3.18798e-05], 0, 10.115, 1662025842], "v": "v0.6"}
{"i": [["[\"fused_pointwise_conv_bias_add_sigmoid_mul\", 112, 112, 8, 32, 1]", "cuda -keys=cuda,gpu -max_num_threads=1024 -model=unknown -thread_warp_size=32", [-1, 16, 64, 49152, 2147483647, 1024, 8, 32], "", 0, []], [[], [["CI", 5], ["CHW", 3, "local"], ["SP", 3, 0, 1, [1, 1, 1, 1], 1], ["SP", 3, 5, 32, [4, 1, 1, 4], 1], ["SP", 3, 10, 8, [2, 1], 1], ["RE", 3, [0, 5, 1, 6, 2, 7, 10, 11, 3, 8, 12, 4, 9]], ["FSP", 4, 0, 2, 3], ["FSP", 4, 4, 3, 3], ["RE", 4, [0, 4, 1, 5, 2, 6, 3, 7]], ["CA", 3, 4, 5], ["CHR", 2, "shared", [3]], ["CA", 3, 4, 6], ["CHR", 1, "shared", [4]], ["CA", 2, 5, 6], ["FU", 9, [0, 1, 2, 3]], ["SP", 9, 0, 401408, [32], 1], ["AN", 9, 0, 5], ["AN", 9, 1, 6], ["FU", 6, [0, 1]], ["AN", 6, 0, 5], ["FU", 6, [1, 2]], ["AN", 6, 1, 4], ["FU", 6, [2, 3]], ["AN", 6, 2, 6], ["FU", 4, [0, 1]], ["SP", 4, 0, 8, [1], 1], ["AN", 4, 1, 2], ["FFSP", 4, 0, [3, 2], 1, 1], ["AN", 4, 1, 6], ["FU", 2, [0, 1]], ["SP", 2, 0, 2, [1], 1], ["AN", 2, 1, 2], ["FFSP", 2, 0, [3, 2], 1, 1], ["AN", 2, 1, 6], ["PR", 5, 0, "auto_unroll_max_step$16"]]]], "r": [[3.1319e-05, 3.13374e-05, 3.13327e-05], 0, 2.94009, 1662026016], "v": "v0.6"}
{"i": [["[\"fused_pointwise_conv_bias_add_sigmoid_mul\", 112, 112, 8, 32, 1]", "cuda -keys=cuda,gpu -max_num_threads=1024 -model=unknown -thread_warp_size=32", [-1, 16, 64, 49152, 2147483647, 1024, 8, 32], "", 0, []], [[], [["CI", 5], ["CHW", 3, "local"], ["SP", 3, 0, 1, [1, 1, 1, 1], 1], ["SP", 3, 5, 32, [1, 2, 2, 1], 1], ["SP", 3, 10, 8, [2, 4], 1], ["RE", 3, [0, 5, 1, 6, 2, 7, 10, 11, 3, 8, 12, 4, 9]], ["FSP", 4, 0, 2, 3], ["FSP", 4, 4, 3, 3], ["RE", 4, [0, 4, 1, 5, 2, 6, 3, 7]], ["CA", 3, 4, 5], ["CHR", 2, "shared", [3]], ["CA", 3, 4, 6], ["CHR", 1, "shared", [4]], ["CA", 2, 5, 6], ["FU", 9, [0, 1, 2, 3]], ["SP", 9, 0, 401408, [32], 1], ["AN", 9, 0, 5], ["AN", 9, 1, 6], ["FU", 6, [0, 1]], ["AN", 6, 0, 5], ["FU", 6, [1, 2]], ["AN", 6, 1, 4], ["FU", 6, [2, 3]], ["AN", 6, 2, 6], ["FU", 4, [0, 1]], ["SP", 4, 0, 16, [4], 1], ["AN", 4, 1, 2], ["FFSP", 4, 0, [3, 2], 1, 1], ["AN", 4, 1, 6], ["FU", 2, [0, 1]], ["SP", 2, 0, 8, [2], 1], ["AN", 2, 1, 2], ["FFSP", 2, 0, [3, 2], 1, 1], ["AN", 2, 1, 6], ["PR", 5, 0, "auto_unroll_max_step$64"]]]], "r": [[2.8204e-05, 2.82245e-05, 2.82164e-05], 0, 2.41689, 1662026015], "v": "v0.6"}
{"i": [["[\"fused_pointwise_conv_bias_add_sigmoid_mul\", 112, 112, 8, 32, 1]", "cuda -keys=cuda,gpu -max_num_threads=1024 -model=unknown -thread_warp_size=32", [-1, 16, 64, 49152, 2147483647, 1024, 8, 32], "", 0, []], [[], [["CI", 5], ["CHW", 3, "local"], ["SP", 3, 0, 1, [1, 1, 1, 1], 1], ["SP", 3, 5, 32, [4, 1, 2, 1], 1], ["SP", 3, 10, 8, [1, 8], 1], ["RE", 3, [0, 5, 1, 6, 2, 7, 10, 11, 3, 8, 12, 4, 9]], ["FSP", 4, 0, 2, 3], ["FSP", 4, 4, 3, 3], ["RE", 4, [0, 4, 1, 5, 2, 6, 3, 7]], ["CA", 3, 4, 5], ["CHR", 2, "shared", [3]], ["CA", 3, 4, 6], ["CHR", 1, "shared", [4]], ["CA", 2, 5, 6], ["FU", 9, [0, 1, 2, 3]], ["SP", 9, 0, 401408, [32], 1], ["AN", 9, 0, 5], ["AN", 9, 1, 6], ["FU", 6, [0, 1]], ["AN", 6, 0, 5], ["FU", 6, [1, 2]], ["AN", 6, 1, 4], ["FU", 6, [2, 3]], ["AN", 6, 2, 6], ["FU", 4, [0, 1]], ["SP", 4, 0, 16, [1], 1], ["AN", 4, 1, 2], ["FFSP", 4, 0, [3, 2], 1, 1], ["AN", 4, 1, 6], ["FU", 2, [0, 1]], ["SP", 2, 0, 8, [1], 1], ["AN", 2, 1, 2], ["FFSP", 2, 0, [3, 2], 1, 1], ["AN", 2, 1, 6], ["PR", 5, 0, "auto_unroll_max_step$16"]]]], "r": [[2.87632e-05, 2.87567e-05, 2.87669e-05], 0, 2.20111, 1662026015], "v": "v0.6"}
{"i": [["[\"fused_pointwise_conv_bias_add_sigmoid_mul\", 112, 112, 8, 32, 1]", "cuda -keys=cuda,gpu -max_num_threads=1024 -model=unknown -thread_warp_size=32", [-1, 16, 64, 49152, 2147483647, 1024, 8, 32], "", 0, []], [[], [["CI", 5], ["CHW", 3, "local"], ["SP", 3, 0, 1, [1, 1, 1, 1], 1], ["SP", 3, 5, 32, [4, 1, 4, 1], 1], ["SP", 3, 10, 8, [1, 4], 1], ["RE", 3, [0, 5, 1, 6, 2, 7, 10, 11, 3, 8, 12, 4, 9]], ["FSP", 4, 0, 2, 3], ["FSP", 4, 4, 3, 3], ["RE", 4, [0, 4, 1, 5, 2, 6, 3, 7]], ["CA", 3, 4, 5], ["CHR", 2, "shared", [3]], ["CA", 3, 4, 6], ["CHR", 1, "shared", [4]], ["CA", 2, 5, 6], ["FU", 9, [0, 1, 2, 3]], ["SP", 9, 0, 401408, [64], 1], ["AN", 9, 0, 5], ["AN", 9, 1, 6], ["FU", 6, [0, 1]], ["AN", 6, 0, 5], ["FU", 6, [1, 2]], ["AN", 6, 1, 4], ["FU", 6, [2, 3]], ["AN", 6, 2, 6], ["FU", 4, [0, 1]], ["SP", 4, 0, 32, [1], 1], ["AN", 4, 1, 2], ["FFSP", 4, 0, [3, 2], 1, 1], ["AN", 4, 1, 6], ["FU", 2, [0, 1]], ["SP", 2, 0, 8, [1], 1], ["AN", 2, 1, 2], ["FFSP", 2, 0, [3, 2], 1, 1], ["AN", 2, 1, 6], ["PR", 5, 0, "auto_unroll_max_step$1024"]]]], "r": [[2.12027e-05, 2.12037e-05, 2.12047e-05], 0, 9.62143, 1662026022], "v": "v0.6"}
{"i": [["[\"fused_pointwise_conv_bias_add_sigmoid_mul\", 112, 112, 8, 32, 1]", "cuda -keys=cuda,gpu -max_num_threads=1024 -model=unknown -thread_warp_size=32", [-1, 16, 64, 49152, 2147483647, 1024, 8, 32], "", 0, []], [[], [["CI", 5], ["CHW", 3, "local"], ["SP", 3, 0, 1, [1, 1, 1, 1], 1], ["SP", 3, 5, 32, [2, 2, 2, 1], 1], ["SP", 3, 10, 8, [1, 2], 1], ["RE", 3, [0, 5, 1, 6, 2, 7, 10, 11, 3, 8, 12, 4, 9]], ["FSP", 4, 0, 2, 3], ["FSP", 4, 4, 3, 3], ["RE", 4, [0, 4, 1, 5, 2, 6, 3, 7]], ["CA", 3, 4, 5], ["CHR", 2, "shared", [3]], ["CA", 3, 4, 6], ["CHR", 1, "shared", [4]], ["CA", 2, 5, 6], ["FU", 9, [0, 1, 2, 3]], ["SP", 9, 0, 401408, [32], 1], ["AN", 9, 0, 5], ["AN", 9, 1, 6], ["FU", 6, [0, 1]], ["AN", 6, 0, 5], ["FU", 6, [1, 2]], ["AN", 6, 1, 4], ["FU", 6, [2, 3]], ["AN", 6, 2, 6], ["FU", 4, [0, 1]], ["SP", 4, 0, 4, [1], 1], ["AN", 4, 1, 2], ["FFSP", 4, 0, [3, 2], 1, 1], ["AN", 4, 1, 6], ["FU", 2, [0, 1]], ["SP", 2, 0, 2, [1], 1], ["AN", 2, 1, 2], ["FFSP", 2, 0, [3, 2], 1, 1], ["AN", 2, 1, 6], ["PR", 5, 0, "auto_unroll_max_step$64"]]]], "r": [[2.86609e-05, 2.86663e-05, 2.86604e-05], 0, 5.32891, 1662026018], "v": "v0.6"}
{"i": [["[\"fused_pointwise_conv_bias_add_sigmoid_mul\", 112, 112, 8, 32, 1]", "cuda -keys=cuda,gpu -max_num_threads=1024 -model=unknown -thread_warp_size=32", [-1, 16, 64, 49152, 2147483647, 1024, 8, 32], "", 0, []], [[], [["CI", 5], ["CHW", 3, "local"], ["SP", 3, 0, 1, [1, 1, 1, 1], 1], ["SP", 3, 5, 32, [2, 2, 2, 2], 1], ["SP", 3, 10, 8, [4, 2], 1], ["RE", 3, [0, 5, 1, 6, 2, 7, 10, 11, 3, 8, 12, 4, 9]], ["FSP", 4, 0, 2, 3], ["FSP", 4, 4, 3, 3], ["RE", 4, [0, 4, 1, 5, 2, 6, 3, 7]], ["CA", 3, 4, 5], ["CHR", 2, "shared", [3]], ["CA", 3, 4, 6], ["CHR", 1, "shared", [4]], ["CA", 2, 5, 6], ["FU", 9, [0, 1, 2, 3]], ["SP", 9, 0, 401408, [2], 1], ["AN", 9, 0, 5], ["AN", 9, 1, 6], ["FU", 6, [0, 1]], ["AN", 6, 0, 5], ["FU", 6, [1, 2]], ["AN", 6, 1, 4], ["FU", 6, [2, 3]], ["AN", 6, 2, 6], ["FU", 4, [0, 1]], ["SP", 4, 0, 32, [1], 1], ["AN", 4, 1, 2], ["FFSP", 4, 0, [3, 2], 1, 1], ["AN", 4, 1, 6], ["FU", 2, [0, 1]], ["SP", 2, 0, 8, [1], 1], ["AN", 2, 1, 2], ["FFSP", 2, 0, [3, 2], 1, 1], ["AN", 2, 1, 6], ["PR", 5, 0, "auto_unroll_max_step$64"]]]], "r": [[0.000290364, 0.000290347, 0.000290369], 0, 1.68012, 1662026014], "v": "v0.6"}
{"i": [["[\"fused_pointwise_conv_bias_add_sigmoid_mul\", 112, 112, 8, 32, 1]", "cuda -keys=cuda,gpu -max_num_threads=1024 -model=unknown -thread_warp_size=32", [-1, 16, 64, 49152, 2147483647, 1024, 8, 32], "", 0, []], [[], [["CI", 5], ["CHW", 3, "local"], ["SP", 3, 0, 1, [1, 1, 1, 1], 1], ["SP", 3, 5, 32, [2, 1, 1, 8], 1], ["SP", 3, 10, 8, [1, 1], 1], ["RE", 3, [0, 5, 1, 6, 2, 7, 10, 11, 3, 8, 12, 4, 9]], ["FSP", 4, 0, 2, 3], ["FSP", 4, 4, 3, 3], ["RE", 4, [0, 4, 1, 5, 2, 6, 3, 7]], ["CA", 3, 4, 5], ["CHR", 2, "shared", [3]], ["CA", 3, 4, 6], ["CHR", 1, "shared", [4]], ["CA", 2, 5, 6], ["FU", 9, [0, 1, 2, 3]], ["SP", 9, 0, 401408, [32], 1], ["AN", 9, 0, 5], ["AN", 9, 1, 6], ["FU", 6, [0, 1]], ["AN", 6, 0, 5], ["FU", 6, [1, 2]], ["AN", 6, 1, 4], ["FU", 6, [2, 3]], ["AN", 6, 2, 6], ["FU", 4, [0, 1]], ["SP", 4, 0, 8, [1], 1], ["AN", 4, 1, 2], ["FFSP", 4, 0, [3, 2], 1, 1], ["AN", 4, 1, 6], ["FU", 2, [0, 1]], ["SP", 2, 0, 1, [1], 1], ["AN", 2, 1, 2], ["FFSP", 2, 0, [3, 2], 1, 1], ["AN", 2, 1, 6], ["PR", 5, 0, "auto_unroll_max_step$64"]]]], "r": [[3.06974e-05, 3.07233e-05, 3.07379e-05], 0, 8.92093, 1662026022], "v": "v0.6"}
{"i": [["[\"fused_pointwise_conv_bias_add_sigmoid_mul\", 112, 112, 8, 32, 1]", "cuda -keys=cuda,gpu -max_num_threads=1024 -model=unknown -thread_warp_size=32", [-1, 16, 64, 49152, 2147483647, 1024, 8, 32], "", 0, []], [[], [["CI", 5], ["CHW", 3, "local"], ["SP", 3, 0, 1, [1, 1, 1, 1], 1], ["SP", 3, 5, 32, [1, 8, 4, 1], 1], ["SP", 3, 10, 8, [2, 4], 1], ["RE", 3, [0, 5, 1, 6, 2, 7, 10, 11, 3, 8, 12, 4, 9]], ["FSP", 4, 0, 2, 3], ["FSP", 4, 4, 3, 3], ["RE", 4, [0, 4, 1, 5, 2, 6, 3, 7]], ["CA", 3, 4, 5], ["CHR", 2, "shared", [3]], ["CA", 3, 4, 6], ["CHR", 1, "shared", [4]], ["CA", 2, 5, 6], ["FU", 9, [0, 1, 2, 3]], ["SP", 9, 0, 401408, [8], 1], ["AN", 9, 0, 5], ["AN", 9, 1, 6], ["FU", 6, [0, 1]], ["AN", 6, 0, 5], ["FU", 6, [1, 2]], ["AN", 6, 1, 4], ["FU", 6, [2, 3]], ["AN", 6, 2, 6], ["FU", 4, [0, 1]], ["SP", 4, 0, 32, [1], 1], ["AN", 4, 1, 2], ["FFSP", 4, 0, [3, 2], 1, 1], ["AN", 4, 1, 6], ["FU", 2, [0, 1]], ["SP", 2, 0, 8, [1], 1], ["AN", 2, 1, 2], ["FFSP", 2, 0, [3, 2], 1, 1], ["AN", 2, 1, 6], ["PR", 5, 0, "auto_unroll_max_step$1024"]]]], "r": [[7.93983e-05, 7.94043e-05, 7.94062e-05], 0, 3.77721, 1662026016], "v": "v0.6"}
{"i": [["[\"fused_pointwise_conv_bias_add_sigmoid_mul\", 112, 112, 8, 32, 1]", "cuda -keys=cuda,gpu -max_num_threads=1024 -model=unknown -thread_warp_size=32", [-1, 16, 64, 49152, 2147483647, 1024, 8, 32], "", 0, []], [[], [["CI", 5], ["CHW", 3, "local"], ["SP", 3, 0, 1, [1, 1, 1, 1], 1], ["SP", 3, 5, 32, [8, 4, 1, 1], 1], ["SP", 3, 10, 8, [2, 1], 1], ["RE", 3, [0, 5, 1, 6, 2, 7, 10, 11, 3, 8, 12, 4, 9]], ["FSP", 4, 0, 2, 3], ["FSP", 4, 4, 3, 3], ["RE", 4, [0, 4, 1, 5, 2, 6, 3, 7]], ["CA", 3, 4, 5], ["CHR", 2, "shared", [3]], ["CA", 3, 4, 6], ["CHR", 1, "shared", [4]], ["CA", 2, 5, 6], ["FU", 9, [0, 1, 2, 3]], ["SP", 9, 0, 401408, [32], 1], ["AN", 9, 0, 5], ["AN", 9, 1, 6], ["FU", 6, [0, 1]], ["AN", 6, 0, 5], ["FU", 6, [1, 2]], ["AN", 6, 1, 4], ["FU", 6, [2, 3]], ["AN", 6, 2, 6], ["FU", 4, [0, 1]], ["SP", 4, 0, 2, [2], 1], ["AN", 4, 1, 2], ["FFSP", 4, 0, [3, 2], 1, 1], ["AN", 4, 1, 6], ["FU", 2, [0, 1]], ["SP", 2, 0, 2, [1], 1], ["AN", 2, 1, 2], ["FFSP", 2, 0, [3, 2], 1, 1], ["AN", 2, 1, 6], ["PR", 5, 0, "auto_unroll_max_step$64"]]]], "r": [[2.80217e-05, 2.80178e-05, 2.80208e-05], 0, 5.79815, 1662026019], "v": "v0.6"}
{"i": [["[\"fused_pointwise_conv_bias_add_sigmoid_mul\", 112, 112, 8, 32, 1]", "cuda -keys=cuda,gpu -max_num_threads=1024 -model=unknown -thread_warp_size=32", [-1, 16, 64, 49152, 2147483647, 1024, 8, 32], "", 0, []], [[], [["CI", 5], ["CHW", 3, "local"], ["SP", 3, 0, 1, [1, 1, 1, 1], 1], ["SP", 3, 5, 32, [2, 2, 1, 4], 1], ["SP", 3, 10, 8, [1, 2], 1], ["RE", 3, [0, 5, 1, 6, 2, 7, 10, 11, 3, 8, 12, 4, 9]], ["FSP", 4, 0, 2, 3], ["FSP", 4, 4, 3, 3], ["RE", 4, [0, 4, 1, 5, 2, 6, 3, 7]], ["CA", 3, 4, 5], ["CHR", 2, "shared", [3]], ["CA", 3, 4, 6], ["CHR", 1, "shared", [4]], ["CA", 2, 5, 6], ["FU", 9, [0, 1, 2, 3]], ["SP", 9, 0, 401408, [32], 1], ["AN", 9, 0, 5], ["AN", 9, 1, 6], ["FU", 6, [0, 1]], ["AN", 6, 0, 5], ["FU", 6, [1, 2]], ["AN", 6, 1, 4], ["FU", 6, [2, 3]], ["AN", 6, 2, 6], ["FU", 4, [0, 1]], ["SP", 4, 0, 8, [1], 1], ["AN", 4, 1, 2], ["FFSP", 4, 0, [3, 2], 1, 1], ["AN", 4, 1, 6], ["FU", 2, [0, 1]], ["SP", 2, 0, 2, [1], 1], ["AN", 2, 1, 2], ["FFSP", 2, 0, [3, 2], 1, 1], ["AN", 2, 1, 6], ["PR", 5, 0, "auto_unroll_max_step$0"]]]], "r": [[2.89197e-05, 2.8922e-05, 2.89166e-05], 0, 4.73758, 1662026018], "v": "v0.6"}
{"i": [["[\"fused_pointwise_conv_bias_add_sigmoid_mul\", 112, 112, 8, 32, 1]", "cuda -keys=cuda,gpu -max_num_threads=1024 -model=unknown -thread_warp_size=32", [-1, 16, 64, 49152, 2147483647, 1024, 8, 32], "", 0, []], [[], [["CI", 5], ["CHW", 3, "local"], ["SP", 3, 0, 1, [1, 1, 1, 1], 1], ["SP", 3, 5, 32, [1, 32, 1, 1], 1], ["SP", 3, 10, 8, [4, 2], 1], ["RE", 3, [0, 5, 1, 6, 2, 7, 10, 11, 3, 8, 12, 4, 9]], ["FSP", 4, 0, 2, 3], ["FSP", 4, 4, 3, 3], ["RE", 4, [0, 4, 1, 5, 2, 6, 3, 7]], ["CA", 3, 4, 5], ["CHR", 2, "shared", [3]], ["CA", 3, 4, 6], ["CHR", 1, "shared", [4]], ["CA", 2, 5, 6], ["FU", 9, [0, 1, 2, 3]], ["SP", 9, 0, 401408, [32], 1], ["AN", 9, 0, 5], ["AN", 9, 1, 6], ["FU", 6, [0, 1]], ["AN", 6, 0, 5], ["FU", 6, [1, 2]], ["AN", 6, 1, 4], ["FU", 6, [2, 3]], ["AN", 6, 2, 6], ["FU", 4, [0, 1]], ["SP", 4, 0, 8, [1], 1], ["AN", 4, 1, 2], ["FFSP", 4, 0, [3, 2], 1, 1], ["AN", 4, 1, 6], ["FU", 2, [0, 1]], ["SP", 2, 0, 8, [1], 1], ["AN", 2, 1, 2], ["FFSP", 2, 0, [3, 2], 1, 1], ["AN", 2, 1, 6], ["PR", 5, 0, "auto_unroll_max_step$0"]]]], "r": [[2.71587e-05, 2.71594e-05, 2.71563e-05], 0, 6.39695, 1662026019], "v": "v0.6"}
{"i": [["[\"fused_pointwise_conv_bias_add_sigmoid_mul\", 112, 112, 8, 32, 1]", "cuda -keys=cuda,gpu -max_num_threads=1024 -model=unknown -thread_warp_size=32", [-1, 16, 64, 49152, 2147483647, 1024, 8, 32], "", 0, []], [[], [["CI", 5], ["CHW", 3, "local"], ["SP", 3, 0, 1, [1, 1, 1, 1], 1], ["SP", 3, 5, 32, [1, 16, 1, 2], 1], ["SP", 3, 10, 8, [2, 1], 1], ["RE", 3, [0, 5, 1, 6, 2, 7, 10, 11, 3, 8, 12, 4, 9]], ["FSP", 4, 0, 2, 3], ["FSP", 4, 4, 3, 3], ["RE", 4, [0, 4, 1, 5, 2, 6, 3, 7]], ["CA", 3, 4, 5], ["CHR", 2, "shared", [3]], ["CA", 3, 4, 6], ["CHR", 1, "shared", [4]], ["CA", 2, 5, 6], ["FU", 9, [0, 1, 2, 3]], ["SP", 9, 0, 401408, [32], 1], ["AN", 9, 0, 5], ["AN", 9, 1, 6], ["FU", 6, [0, 1]], ["AN", 6, 0, 5], ["FU", 6, [1, 2]], ["AN", 6, 1, 4], ["FU", 6, [2, 3]], ["AN", 6, 2, 6], ["FU", 4, [0, 1]], ["SP", 4, 0, 8, [1], 1], ["AN", 4, 1, 2], ["FFSP", 4, 0, [3, 2], 1, 1], ["AN", 4, 1, 6], ["FU", 2, [0, 1]], ["SP", 2, 0, 4, [1], 1], ["AN", 2, 1, 2], ["FFSP", 2, 0, [3, 2], 1, 1], ["AN", 2, 1, 6], ["PR", 5, 0, "auto_unroll_max_step$512"]]]], "r": [[2.70938e-05, 2.71026e-05, 2.7097e-05], 0, 17.1406, 1662026030], "v": "v0.6"}
{"i": [["[\"fused_pointwise_conv_bias_add_sigmoid_mul\", 112, 112, 8, 32, 1]", "cuda -keys=cuda,gpu -max_num_threads=1024 -model=unknown -thread_warp_size=32", [-1, 16, 64, 49152, 2147483647, 1024, 8, 32], "", 0, []], [[], [["CI", 5], ["CHW", 3, "local"], ["SP", 3, 0, 1, [1, 1, 1, 1], 1], ["SP", 3, 5, 32, [1, 1, 2, 8], 1], ["SP", 3, 10, 8, [1, 1], 1], ["RE", 3, [0, 5, 1, 6, 2, 7, 10, 11, 3, 8, 12, 4, 9]], ["FSP", 4, 0, 2, 3], ["FSP", 4, 4, 3, 3], ["RE", 4, [0, 4, 1, 5, 2, 6, 3, 7]], ["CA", 3, 4, 5], ["CHR", 2, "shared", [3]], ["CA", 3, 4, 6], ["CHR", 1, "shared", [4]], ["CA", 2, 5, 6], ["FU", 9, [0, 1, 2, 3]], ["SP", 9, 0, 401408, [32], 1], ["AN", 9, 0, 5], ["AN", 9, 1, 6], ["FU", 6, [0, 1]], ["AN", 6, 0, 5], ["FU", 6, [1, 2]], ["AN", 6, 1, 4], ["FU", 6, [2, 3]], ["AN", 6, 2, 6], ["FU", 4, [0, 1]], ["SP", 4, 0, 16, [1], 1], ["AN", 4, 1, 2], ["FFSP", 4, 0, [3, 2], 1, 1], ["AN", 4, 1, 6], ["FU", 2, [0, 1]], ["SP", 2, 0, 1, [1], 1], ["AN", 2, 1, 2], ["FFSP", 2, 0, [3, 2], 1, 1], ["AN", 2, 1, 6], ["PR", 5, 0, "auto_unroll_max_step$0"]]]], "r": [[3.14795e-05, 3.14878e-05, 3.14837e-05], 0, 7.24686, 1662026020], "v": "v0.6"}
{"i": [["[\"fused_pointwise_conv_bias_add_sigmoid_mul\", 112, 112, 8, 32, 1]", "cuda -keys=cuda,gpu -max_num_threads=1024 -model=unknown -thread_warp_size=32", [-1, 16, 64, 49152, 2147483647, 1024, 8, 32], "", 0, []], [[], [["CI", 5], ["CHW", 3, "local"], ["SP", 3, 0, 1, [1, 1, 1, 1], 1], ["SP", 3, 5, 32, [4, 8, 1, 1], 1], ["SP", 3, 10, 8, [1, 8], 1], ["RE", 3, [0, 5, 1, 6, 2, 7, 10, 11, 3, 8, 12, 4, 9]], ["FSP", 4, 0, 2, 3], ["FSP", 4, 4, 3, 3], ["RE", 4, [0, 4, 1, 5, 2, 6, 3, 7]], ["CA", 3, 4, 5], ["CHR", 2, "shared", [3]], ["CA", 3, 4, 6], ["CHR", 1, "shared", [4]], ["CA", 2, 5, 6], ["FU", 9, [0, 1, 2, 3]], ["SP", 9, 0, 401408, [64], 1], ["AN", 9, 0, 5], ["AN", 9, 1, 6], ["FU", 6, [0, 1]], ["AN", 6, 0, 5], ["FU", 6, [1, 2]], ["AN", 6, 1, 4], ["FU", 6, [2, 3]], ["AN", 6, 2, 6], ["FU", 4, [0, 1]], ["SP", 4, 0, 8, [4], 1], ["AN", 4, 1, 2], ["FFSP", 4, 0, [3, 2], 1, 1], ["AN", 4, 1, 6], ["FU", 2, [0, 1]], ["SP", 2, 0, 8, [1], 1], ["AN", 2, 1, 2], ["FFSP", 2, 0, [3, 2], 1, 1], ["AN", 2, 1, 6], ["PR", 5, 0, "auto_unroll_max_step$0"]]]], "r": [[1.82007e-05, 1.81997e-05, 1.82025e-05], 0, 10.7152, 1662026024], "v": "v0.6"}
{"i": [["[\"fused_pointwise_conv_bias_add_sigmoid_mul\", 112, 112, 8, 32, 1]", "cuda -keys=cuda,gpu -max_num_threads=1024 -model=unknown -thread_warp_size=32", [-1, 16, 64, 49152, 2147483647, 1024, 8, 32], "", 0, []], [[], [["CI", 5], ["CHW", 3, "local"], ["SP", 3, 0, 1, [1, 1, 1, 1], 1], ["SP", 3, 5, 32, [4, 1, 2, 2], 1], ["SP", 3, 10, 8, [1, 8], 1], ["RE", 3, [0, 5, 1, 6, 2, 7, 10, 11, 3, 8, 12, 4, 9]], ["FSP", 4, 0, 2, 3], ["FSP", 4, 4, 3, 3], ["RE", 4, [0, 4, 1, 5, 2, 6, 3, 7]], ["CA", 3, 4, 5], ["CHR", 2, "shared", [3]], ["CA", 3, 4, 6], ["CHR", 1, "shared", [4]], ["CA", 2, 5, 6], ["FU", 9, [0, 1, 2, 3]], ["SP", 9, 0, 401408, [32], 1], ["AN", 9, 0, 5], ["AN", 9, 1, 6], ["FU", 6, [0, 1]], ["AN", 6, 0, 5], ["FU", 6, [1, 2]], ["AN", 6, 1, 4], ["FU", 6, [2, 3]], ["AN", 6, 2, 6], ["FU", 4, [0, 1]], ["SP", 4, 0, 16, [4], 1], ["AN", 4, 1, 2], ["FFSP", 4, 0, [3, 2], 1, 1], ["AN", 4, 1, 6], ["FU", 2, [0, 1]], ["SP", 2, 0, 8, [1], 1], ["AN", 2, 1, 2], ["FFSP", 2, 0, [3, 2], 1, 1], ["AN", 2, 1, 6], ["PR", 5, 0, "auto_unroll_max_step$1024"]]]], "r": [[2.99673e-05, 2.99748e-05, 2.99796e-05], 0, 8.38133, 1662026021], "v": "v0.6"}
{"i": [["[\"fused_pointwise_conv_bias_add_sigmoid_mul\", 112, 112, 8, 32, 1]", "cuda -keys=cuda,gpu -max_num_threads=1024 -model=unknown -thread_warp_size=32", [-1, 16, 64, 49152, 2147483647, 1024, 8, 32], "", 0, []], [[], [["CI", 5], ["CHW", 3, "local"], ["SP", 3, 0, 1, [1, 1, 1, 1], 1], ["SP", 3, 5, 32, [4, 2, 2, 1], 1], ["SP", 3, 10, 8, [1, 4], 1], ["RE", 3, [0, 5, 1, 6, 2, 7, 10, 11, 3, 8, 12, 4, 9]], ["FSP", 4, 0, 2, 3], ["FSP", 4, 4, 3, 3], ["RE", 4, [0, 4, 1, 5, 2, 6, 3, 7]], ["CA", 3, 4, 5], ["CHR", 2, "shared", [3]], ["CA", 3, 4, 6], ["CHR", 1, "shared", [4]], ["CA", 2, 5, 6], ["FU", 9, [0, 1, 2, 3]], ["SP", 9, 0, 401408, [32], 1], ["AN", 9, 0, 5], ["AN", 9, 1, 6], ["FU", 6, [0, 1]], ["AN", 6, 0, 5], ["FU", 6, [1, 2]], ["AN", 6, 1, 4], ["FU", 6, [2, 3]], ["AN", 6, 2, 6], ["FU", 4, [0, 1]], ["SP", 4, 0, 8, [2], 1], ["AN", 4, 1, 2], ["FFSP", 4, 0, [3, 2], 1, 1], ["AN", 4, 1, 6], ["FU", 2, [0, 1]], ["SP", 2, 0, 4, [4], 1], ["AN", 2, 1, 2], ["FFSP", 2, 0, [3, 2], 1, 1], ["AN", 2, 1, 6], ["PR", 5, 0, "auto_unroll_max_step$16"]]]], "r": [[2.93044e-05, 2.92996e-05, 2.92995e-05], 0, 7.77157, 1662026021], "v": "v0.6"}
{"i": [["[\"fused_pointwise_conv_bias_add_sigmoid_mul\", 112, 112, 8, 32, 1]", "cuda -keys=cuda,gpu -max_num_threads=1024 -model=unknown -thread_warp_size=32", [-1, 16, 64, 49152, 2147483647, 1024, 8, 32], "", 0, []], [[], [["CI", 5], ["CHW", 3, "local"], ["SP", 3, 0, 1, [1, 1, 1, 1], 1], ["SP", 3, 5, 32, [2, 1, 4, 2], 1], ["SP", 3, 10, 8, [1, 1], 1], ["RE", 3, [0, 5, 1, 6, 2, 7, 10, 11, 3, 8, 12, 4, 9]], ["FSP", 4, 0, 2, 3], ["FSP", 4, 4, 3, 3], ["RE", 4, [0, 4, 1, 5, 2, 6, 3, 7]], ["CA", 3, 4, 5], ["CHR", 2, "shared", [3]], ["CA", 3, 4, 6], ["CHR", 1, "shared", [4]], ["CA", 2, 5, 6], ["FU", 9, [0, 1, 2, 3]], ["SP", 9, 0, 401408, [32], 1], ["AN", 9, 0, 5], ["AN", 9, 1, 6], ["FU", 6, [0, 1]], ["AN", 6, 0, 5], ["FU", 6, [1, 2]], ["AN", 6, 1, 4], ["FU", 6, [2, 3]], ["AN", 6, 2, 6], ["FU", 4, [0, 1]], ["SP", 4, 0, 8, [1], 1], ["AN", 4, 1, 2], ["FFSP", 4, 0, [3, 2], 1, 1], ["AN", 4, 1, 6], ["FU", 2, [0, 1]], ["SP", 2, 0, 2, [1], 1], ["AN", 2, 1, 2], ["FFSP", 2, 0, [3, 2], 1, 1], ["AN", 2, 1, 6], ["PR", 5, 0, "auto_unroll_max_step$64"]]]], "r": [[3.12468e-05, 3.12729e-05, 3.12666e-05], 0, 13.6363, 1662026027], "v": "v0.6"}
{"i": [["[\"fused_pointwise_conv_bias_add_sigmoid_mul\", 112, 112, 8, 32, 1]", "cuda -keys=cuda,gpu -max_num_threads=1024 -model=unknown -thread_warp_size=32", [-1, 16, 64, 49152, 2147483647, 1024, 8, 32], "", 0, []], [[], [["CI", 5], ["CHW", 3, "local"], ["SP", 3, 0, 1, [1, 1, 1, 1], 1], ["SP", 3, 5, 32, [8, 1, 1, 1], 1], ["SP", 3, 10, 8, [8, 1], 1], ["RE", 3, [0, 5, 1, 6, 2, 7, 10, 11, 3, 8, 12, 4, 9]], ["FSP", 4, 0, 2, 3], ["FSP", 4, 4, 3, 3], ["RE", 4, [0, 4, 1, 5, 2, 6, 3, 7]], ["CA", 3, 4, 5], ["CHR", 2, "shared", [3]], ["CA", 3, 4, 6], ["CHR", 1, "shared", [4]], ["CA", 2, 5, 6], ["FU", 9, [0, 1, 2, 3]], ["SP", 9, 0, 401408, [64], 1], ["AN", 9, 0, 5], ["AN", 9, 1, 6], ["FU", 6, [0, 1]], ["AN", 6, 0, 5], ["FU", 6, [1, 2]], ["AN", 6, 1, 4], ["FU", 6, [2, 3]], ["AN", 6, 2, 6], ["FU", 4, [0, 1]], ["SP", 4, 0, 8, [1], 1], ["AN", 4, 1, 2], ["FFSP", 4, 0, [3, 2], 1, 1], ["AN", 4, 1, 6], ["FU", 2, [0, 1]], ["SP", 2, 0, 2, [1], 1], ["AN", 2, 1, 2], ["FFSP", 2, 0, [3, 2], 1, 1], ["AN", 2, 1, 6], ["PR", 5, 0, "auto_unroll_max_step$0"]]]], "r": [[1.9739e-05, 1.97406e-05, 1.9739e-05], 0, 11.3345, 1662026024], "v": "v0.6"}
{"i": [["[\"fused_pointwise_conv_bias_add_sigmoid_mul\", 112, 112, 8, 32, 1]", "cuda -keys=cuda,gpu -max_num_threads=1024 -model=unknown -thread_warp_size=32", [-1, 16, 64, 49152, 2147483647, 1024, 8, 32], "", 0, []], [[], [["CI", 5], ["CHW", 3, "local"], ["SP", 3, 0, 1, [1, 1, 1, 1], 1], ["SP", 3, 5, 32, [1, 4, 2, 2], 1], ["SP", 3, 10, 8, [1, 4], 1], ["RE", 3, [0, 5, 1, 6, 2, 7, 10, 11, 3, 8, 12, 4, 9]], ["FSP", 4, 0, 2, 3], ["FSP", 4, 4, 3, 3], ["RE", 4, [0, 4, 1, 5, 2, 6, 3, 7]], ["CA", 3, 4, 5], ["CHR", 2, "shared", [3]], ["CA", 3, 4, 6], ["CHR", 1, "shared", [4]], ["CA", 2, 5, 6], ["FU", 9, [0, 1, 2, 3]], ["SP", 9, 0, 401408, [8], 1], ["AN", 9, 0, 5], ["AN", 9, 1, 6], ["FU", 6, [0, 1]], ["AN", 6, 0, 5], ["FU", 6, [1, 2]], ["AN", 6, 1, 4], ["FU", 6, [2, 3]], ["AN", 6, 2, 6], ["FU", 4, [0, 1]], ["SP", 4, 0, 16, [4], 1], ["AN", 4, 1, 2], ["FFSP", 4, 0, [3, 2], 1, 1], ["AN", 4, 1, 6], ["FU", 2, [0, 1]], ["SP", 2, 0, 8, [1], 1], ["AN", 2, 1, 2], ["FFSP", 2, 0, [3, 2], 1, 1], ["AN", 2, 1, 6], ["PR", 5, 0, "auto_unroll_max_step$64"]]]], "r": [[7.95754e-05, 7.95753e-05, 7.95794e-05], 0, 11.9472, 1662026025], "v": "v0.6"}
{"i": [["[\"fused_pointwise_conv_bias_add_sigmoid_mul\", 112, 112, 8, 32, 1]", "cuda -keys=cuda,gpu -max_num_threads=1024 -model=unknown -thread_warp_size=32", [-1, 16, 64, 49152, 2147483647, 1024, 8, 32], "", 0, []], [[], [["CI", 5], ["CHW", 3, "local"], ["SP", 3, 0, 1, [1, 1, 1, 1], 1], ["SP", 3, 5, 32, [1, 1, 2, 16], 1], ["SP", 3, 10, 8, [2, 2], 1], ["RE", 3, [0, 5, 1, 6, 2, 7, 10, 11, 3, 8, 12, 4, 9]], ["FSP", 4, 0, 2, 3], ["FSP", 4, 4, 3, 3], ["RE", 4, [0, 4, 1, 5, 2, 6, 3, 7]], ["CA", 3, 4, 5], ["CHR", 2, "shared", [3]], ["CA", 3, 4, 6], ["CHR", 1, "shared", [4]], ["CA", 2, 5, 6], ["FU", 9, [0, 1, 2, 3]], ["SP", 9, 0, 401408, [4], 1], ["AN", 9, 0, 5], ["AN", 9, 1, 6], ["FU", 6, [0, 1]], ["AN", 6, 0, 5], ["FU", 6, [1, 2]], ["AN", 6, 1, 4], ["FU", 6, [2, 3]], ["AN", 6, 2, 6], ["FU", 4, [0, 1]], ["SP", 4, 0, 128, [4], 1], ["AN", 4, 1, 2], ["FFSP", 4, 0, [3, 2], 1, 1], ["AN", 4, 1, 6], ["FU", 2, [0, 1]], ["SP", 2, 0, 4, [1], 1], ["AN", 2, 1, 2], ["FFSP", 2, 0, [3, 2], 1, 1], ["AN", 2, 1, 6], ["PR", 5, 0, "auto_unroll_max_step$512"]]]], "r": [[0.000153437, 0.000153437, 0.00015344], 0, 4.36896, 1662026017], "v": "v0.6"}
{"i": [["[\"fused_pointwise_conv_bias_add_sigmoid_mul\", 112, 112, 8, 32, 1]", "cuda -keys=cuda,gpu -max_num_threads=1024 -model=unknown -thread_warp_size=32", [-1, 16, 64, 49152, 2147483647, 1024, 8, 32], "", 0, []], [[], [["CI", 5], ["CHW", 3, "local"], ["SP", 3, 0, 1, [1, 1, 1, 1], 1], ["SP", 3, 5, 32, [1, 1, 4, 8], 1], ["SP", 3, 10, 8, [8, 1], 1], ["RE", 3, [0, 5, 1, 6, 2, 7, 10, 11, 3, 8, 12, 4, 9]], ["FSP", 4, 0, 2, 3], ["FSP", 4, 4, 3, 3], ["RE", 4, [0, 4, 1, 5, 2, 6, 3, 7]], ["CA", 3, 4, 5], ["CHR", 2, "shared", [3]], ["CA", 3, 4, 6], ["CHR", 1, "shared", [4]], ["CA", 2, 5, 6], ["FU", 9, [0, 1, 2, 3]], ["SP", 9, 0, 401408, [32], 1], ["AN", 9, 0, 5], ["AN", 9, 1, 6], ["FU", 6, [0, 1]], ["AN", 6, 0, 5], ["FU", 6, [1, 2]], ["AN", 6, 1, 4], ["FU", 6, [2, 3]], ["AN", 6, 2, 6], ["FU", 4, [0, 1]], ["SP", 4, 0, 64, [1], 1], ["AN", 4, 1, 2], ["FFSP", 4, 0, [3, 2], 1, 1], ["AN", 4, 1, 6], ["FU", 2, [0, 1]], ["SP", 2, 0, 8, [1], 1], ["AN", 2, 1, 2], ["FFSP", 2, 0, [3, 2], 1, 1], ["AN", 2, 1, 6], ["PR", 5, 0, "auto_unroll_max_step$512"]]]], "r": [[3.10992e-05, 3.11047e-05, 3.11038e-05], 0, 18.6956, 1662026032], "v": "v0.6"}
{"i": [["[\"fused_pointwise_conv_bias_add_sigmoid_mul\", 112, 112, 8, 32, 1]", "cuda -keys=cuda,gpu -max_num_threads=1024 -model=unknown -thread_warp_size=32", [-1, 16, 64, 49152, 2147483647, 1024, 8, 32], "", 0, []], [[], [["CI", 5], ["CHW", 3, "local"], ["SP", 3, 0, 1, [1, 1, 1, 1], 1], ["SP", 3, 5, 32, [1, 8, 1, 2], 1], ["SP", 3, 10, 8, [1, 2], 1], ["RE", 3, [0, 5, 1, 6, 2, 7, 10, 11, 3, 8, 12, 4, 9]], ["FSP", 4, 0, 2, 3], ["FSP", 4, 4, 3, 3], ["RE", 4, [0, 4, 1, 5, 2, 6, 3, 7]], ["CA", 3, 4, 5], ["CHR", 2, "shared", [3]], ["CA", 3, 4, 6], ["CHR", 1, "shared", [4]], ["CA", 2, 5, 6], ["FU", 9, [0, 1, 2, 3]], ["SP", 9, 0, 401408, [32], 1], ["AN", 9, 0, 5], ["AN", 9, 1, 6], ["FU", 6, [0, 1]], ["AN", 6, 0, 5], ["FU", 6, [1, 2]], ["AN", 6, 1, 4], ["FU", 6, [2, 3]], ["AN", 6, 2, 6], ["FU", 4, [0, 1]], ["SP", 4, 0, 4, [1], 1], ["AN", 4, 1, 2], ["FFSP", 4, 0, [3, 2], 1, 1], ["AN", 4, 1, 6], ["FU", 2, [0, 1]], ["SP", 2, 0, 2, [1], 1], ["AN", 2, 1, 2], ["FFSP", 2, 0, [3, 2], 1, 1], ["AN", 2, 1, 6], ["PR", 5, 0, "auto_unroll_max_step$16"]]]], "r": [[2.80052e-05, 2.7991e-05, 2.79864e-05], 0, 10.2671, 1662026023], "v": "v0.6"}
{"i": [["[\"fused_pointwise_conv_bias_add_sigmoid_mul\", 112, 112, 8, 32, 1]", "cuda -keys=cuda,gpu -max_num_threads=1024 -model=unknown -thread_warp_size=32", [-1, 16, 64, 49152, 2147483647, 1024, 8, 32], "", 0, []], [[], [["CI", 5], ["CHW", 3, "local"], ["SP", 3, 0, 1, [1, 1, 1, 1], 1], ["SP", 3, 5, 32, [8, 2, 2, 1], 1], ["SP", 3, 10, 8, [1, 4], 1], ["RE", 3, [0, 5, 1, 6, 2, 7, 10, 11, 3, 8, 12, 4, 9]], ["FSP", 4, 0, 2, 3], ["FSP", 4, 4, 3, 3], ["RE", 4, [0, 4, 1, 5, 2, 6, 3, 7]], ["CA", 3, 4, 5], ["CHR", 2, "shared", [3]], ["CA", 3, 4, 6], ["CHR", 1, "shared", [4]], ["CA", 2, 5, 6], ["FU", 9, [0, 1, 2, 3]], ["SP", 9, 0, 401408, [32], 1], ["AN", 9, 0, 5], ["AN", 9, 1, 6], ["FU", 6, [0, 1]], ["AN", 6, 0, 5], ["FU", 6, [1, 2]], ["AN", 6, 1, 4], ["FU", 6, [2, 3]], ["AN", 6, 2, 6], ["FU", 4, [0, 1]], ["SP", 4, 0, 8, [1], 1], ["AN", 4, 1, 2], ["FFSP", 4, 0, [3, 2], 1, 1], ["AN", 4, 1, 6], ["FU", 2, [0, 1]], ["SP", 2, 0, 4, [4], 1], ["AN", 2, 1, 2], ["FFSP", 2, 0, [3, 2], 1, 1], ["AN", 2, 1, 6], ["PR", 5, 0, "auto_unroll_max_step$1024"]]]], "r": [[2.99357e-05, 2.99399e-05, 2.99377e-05], 0, 15.66, 1662026028], "v": "v0.6"}
{"i": [["[\"fused_pointwise_conv_bias_add_sigmoid_mul\", 112, 112, 8, 32, 1]", "cuda -keys=cuda,gpu -max_num_threads=1024 -model=unknown -thread_warp_size=32", [-1, 16, 64, 49152, 2147483647, 1024, 8, 32], "", 0, []], [[], [["CI", 5], ["CHW", 3, "local"], ["SP", 3, 0, 1, [1, 1, 1, 1], 1], ["SP", 3, 5, 32, [1, 4, 2, 2], 1], ["SP", 3, 10, 8, [1, 8], 1], ["RE", 3, [0, 5, 1, 6, 2, 7, 10, 11, 3, 8, 12, 4, 9]], ["FSP", 4, 0, 2, 3], ["FSP", 4, 4, 3, 3], ["RE", 4, [0, 4, 1, 5, 2, 6, 3, 7]], ["CA", 3, 4, 5], ["CHR", 2, "shared", [3]], ["CA", 3, 4, 6], ["CHR", 1, "shared", [4]], ["CA", 2, 5, 6], ["FU", 9, [0, 1, 2, 3]], ["SP", 9, 0, 401408, [32], 1], ["AN", 9, 0, 5], ["AN", 9, 1, 6], ["FU", 6, [0, 1]], ["AN", 6, 0, 5], ["FU", 6, [1, 2]], ["AN", 6, 1, 4], ["FU", 6, [2, 3]], ["AN", 6, 2, 6], ["FU", 4, [0, 1]], ["SP", 4, 0, 32, [1], 1], ["AN", 4, 1, 2], ["FFSP", 4, 0, [3, 2], 1, 1], ["AN", 4, 1, 6], ["FU", 2, [0, 1]], ["SP", 2, 0, 8, [1], 1], ["AN", 2, 1, 2], ["FFSP", 2, 0, [3, 2], 1, 1], ["AN", 2, 1, 6], ["PR", 5, 0, "auto_unroll_max_step$0"]]]], "r": [[2.83972e-05, 2.83987e-05, 2.83874e-05], 0, 14.3225, 1662026027], "v": "v0.6"}
{"i": [["[\"fused_pointwise_conv_bias_add_sigmoid_mul\", 112, 112, 8, 32, 1]", "cuda -keys=cuda,gpu -max_num_threads=1024 -model=unknown -thread_warp_size=32", [-1, 16, 64, 49152, 2147483647, 1024, 8, 32], "", 0, []], [[], [["CI", 5], ["CHW", 3, "local"], ["SP", 3, 0, 1, [1, 1, 1, 1], 1], ["SP", 3, 5, 32, [4, 1, 4, 2], 1], ["SP", 3, 10, 8, [4, 1], 1], ["RE", 3, [0, 5, 1, 6, 2, 7, 10, 11, 3, 8, 12, 4, 9]], ["FSP", 4, 0, 2, 3], ["FSP", 4, 4, 3, 3], ["RE", 4, [0, 4, 1, 5, 2, 6, 3, 7]], ["CA", 3, 4, 5], ["CHR", 2, "shared", [3]], ["CA", 3, 4, 6], ["CHR", 1, "shared", [4]], ["CA", 2, 5, 6], ["FU", 9, [0, 1, 2, 3]], ["SP", 9, 0, 401408, [4], 1], ["AN", 9, 0, 5], ["AN", 9, 1, 6], ["FU", 6, [0, 1]], ["AN", 6, 0, 5], ["FU", 6, [1, 2]], ["AN", 6, 1, 4], ["FU", 6, [2, 3]], ["AN", 6, 2, 6], ["FU", 4, [0, 1]], ["SP", 4, 0, 32, [1], 1], ["AN", 4, 1, 2], ["FFSP", 4, 0, [3, 2], 1, 1], ["AN", 4, 1, 6], ["FU", 2, [0, 1]], ["SP", 2, 0, 4, [2], 1], ["AN", 2, 1, 2], ["FFSP", 2, 0, [3, 2], 1, 1], ["AN", 2, 1, 6], ["PR", 5, 0, "auto_unroll_max_step$16"]]]], "r": [[0.000153404, 0.000153409, 0.000153406], 0, 16.74, 1662026030], "v": "v0.6"}
{"i": [["[\"fused_pointwise_conv_bias_add_sigmoid_mul\", 112, 112, 8, 32, 1]", "cuda -keys=cuda,gpu -max_num_threads=1024 -model=unknown -thread_warp_size=32", [-1, 16, 64, 49152, 2147483647, 1024, 8, 32], "", 0, []], [[], [["CI", 5], ["CHW", 3, "local"], ["SP", 3, 0, 1, [1, 1, 1, 1], 1], ["SP", 3, 5, 32, [2, 2, 1, 4], 1], ["SP", 3, 10, 8, [8, 1], 1], ["RE", 3, [0, 5, 1, 6, 2, 7, 10, 11, 3, 8, 12, 4, 9]], ["FSP", 4, 0, 2, 3], ["FSP", 4, 4, 3, 3], ["RE", 4, [0, 4, 1, 5, 2, 6, 3, 7]], ["CA", 3, 4, 5], ["CHR", 2, "shared", [3]], ["CA", 3, 4, 6], ["CHR", 1, "shared", [4]], ["CA", 2, 5, 6], ["FU", 9, [0, 1, 2, 3]], ["SP", 9, 0, 401408, [32], 1], ["AN", 9, 0, 5], ["AN", 9, 1, 6], ["FU", 6, [0, 1]], ["AN", 6, 0, 5], ["FU", 6, [1, 2]], ["AN", 6, 1, 4], ["FU", 6, [2, 3]], ["AN", 6, 2, 6], ["FU", 4, [0, 1]], ["SP", 4, 0, 32, [1], 1], ["AN", 4, 1, 2], ["FFSP", 4, 0, [3, 2], 1, 1], ["AN", 4, 1, 6], ["FU", 2, [0, 1]], ["SP", 2, 0, 8, [1], 1], ["AN", 2, 1, 2], ["FFSP", 2, 0, [3, 2], 1, 1], ["AN", 2, 1, 6], ["PR", 5, 0, "auto_unroll_max_step$64"]]]], "r": [[2.8819e-05, 2.88182e-05, 2.88183e-05], 0, 12.6664, 1662026026], "v": "v0.6"}
{"i": [["[\"fused_pointwise_conv_bias_add_sigmoid_mul\", 112, 112, 8, 32, 1]", "cuda -keys=cuda,gpu -max_num_threads=1024 -model=unknown -thread_warp_size=32", [-1, 16, 64, 49152, 2147483647, 1024, 8, 32], "", 0, []], [[], [["CI", 5], ["CHW", 3, "local"], ["SP", 3, 0, 1, [1, 1, 1, 1], 1], ["SP", 3, 5, 32, [1, 1, 8, 1], 1], ["SP", 3, 10, 8, [1, 2], 1], ["RE", 3, [0, 5, 1, 6, 2, 7, 10, 11, 3, 8, 12, 4, 9]], ["FSP", 4, 0, 2, 3], ["FSP", 4, 4, 3, 3], ["RE", 4, [0, 4, 1, 5, 2, 6, 3, 7]], ["CA", 3, 4, 5], ["CHR", 2, "shared", [3]], ["CA", 3, 4, 6], ["CHR", 1, "shared", [4]], ["CA", 2, 5, 6], ["FU", 9, [0, 1, 2, 3]], ["SP", 9, 0, 401408, [32], 1], ["AN", 9, 0, 5], ["AN", 9, 1, 6], ["FU", 6, [0, 1]], ["AN", 6, 0, 5], ["FU", 6, [1, 2]], ["AN", 6, 1, 4], ["FU", 6, [2, 3]], ["AN", 6, 2, 6], ["FU", 4, [0, 1]], ["SP", 4, 0, 16, [1], 1], ["AN", 4, 1, 2], ["FFSP", 4, 0, [3, 2], 1, 1], ["AN", 4, 1, 6], ["FU", 2, [0, 1]], ["SP", 2, 0, 2, [2], 1], ["AN", 2, 1, 2], ["FFSP", 2, 0, [3, 2], 1, 1], ["AN", 2, 1, 6], ["PR", 5, 0, "auto_unroll_max_step$64"]]]], "r": [[2.90233e-05, 2.90232e-05, 2.90212e-05], 0, 21.3827, 1662026035], "v": "v0.6"}
{"i": [["[\"fused_pointwise_conv_bias_add_sigmoid_mul\", 112, 112, 8, 32, 1]", "cuda -keys=cuda,gpu -max_num_threads=1024 -model=unknown -thread_warp_size=32", [-1, 16, 64, 49152, 2147483647, 1024, 8, 32], "", 0, []], [[], [["CI", 5], ["CHW", 3, "local"], ["SP", 3, 0, 1, [1, 1, 1, 1], 1], ["SP", 3, 5, 32, [4, 2, 1, 4], 1], ["SP", 3, 10, 8, [4, 1], 1], ["RE", 3, [0, 5, 1, 6, 2, 7, 10, 11, 3, 8, 12, 4, 9]], ["FSP", 4, 0, 2, 3], ["FSP", 4, 4, 3, 3], ["RE", 4, [0, 4, 1, 5, 2, 6, 3, 7]], ["CA", 3, 4, 5], ["CHR", 2, "shared", [3]], ["CA", 3, 4, 6], ["CHR", 1, "shared", [4]], ["CA", 2, 5, 6], ["FU", 9, [0, 1, 2, 3]], ["SP", 9, 0, 401408, [32], 1], ["AN", 9, 0, 5], ["AN", 9, 1, 6], ["FU", 6, [0, 1]], ["AN", 6, 0, 5], ["FU", 6, [1, 2]], ["AN", 6, 1, 4], ["FU", 6, [2, 3]], ["AN", 6, 2, 6], ["FU", 4, [0, 1]], ["SP", 4, 0, 16, [1], 1], ["AN", 4, 1, 2], ["FFSP", 4, 0, [3, 2], 1, 1], ["AN", 4, 1, 6], ["FU", 2, [0, 1]], ["SP", 2, 0, 4, [1], 1], ["AN", 2, 1, 2], ["FFSP", 2, 0, [3, 2], 1, 1], ["AN", 2, 1, 6], ["PR", 5, 0, "auto_unroll_max_step$512"]]]], "r": [[2.99077e-05, 2.99046e-05, 2.99019e-05], 0, 13.233, 1662026026], "v": "v0.6"}
{"i": [["[\"fused_pointwise_conv_bias_add_sigmoid_mul\", 112, 112, 8, 32, 1]", "cuda -keys=cuda,gpu -max_num_threads=1024 -model=unknown -thread_warp_size=32", [-1, 16, 64, 49152, 2147483647, 1024, 8, 32], "", 0, []], [[], [["CI", 5], ["CHW", 3, "local"], ["SP", 3, 0, 1, [1, 1, 1, 1], 1], ["SP", 3, 5, 32, [1, 1, 8, 1], 1], ["SP", 3, 10, 8, [4, 1], 1], ["RE", 3, [0, 5, 1, 6, 2, 7, 10, 11, 3, 8, 12, 4, 9]], ["FSP", 4, 0, 2, 3], ["FSP", 4, 4, 3, 3], ["RE", 4, [0, 4, 1, 5, 2, 6, 3, 7]], ["CA", 3, 4, 5], ["CHR", 2, "shared", [3]], ["CA", 3, 4, 6], ["CHR", 1, "shared", [4]], ["CA", 2, 5, 6], ["FU", 9, [0, 1, 2, 3]], ["SP", 9, 0, 401408, [32], 1], ["AN", 9, 0, 5], ["AN", 9, 1, 6], ["FU", 6, [0, 1]], ["AN", 6, 0, 5], ["FU", 6, [1, 2]], ["AN", 6, 1, 4], ["FU", 6, [2, 3]], ["AN", 6, 2, 6], ["FU", 4, [0, 1]], ["SP", 4, 0, 32, [1], 1], ["AN", 4, 1, 2], ["FFSP", 4, 0, [3, 2], 1, 1], ["AN", 4, 1, 6], ["FU", 2, [0, 1]], ["SP", 2, 0, 4, [1], 1], ["AN", 2, 1, 2], ["FFSP", 2, 0, [3, 2], 1, 1], ["AN", 2, 1, 6], ["PR", 5, 0, "auto_unroll_max_step$1024"]]]], "r": [[2.89509e-05, 2.89519e-05, 2.89481e-05], 0, 20.2997, 1662026033], "v": "v0.6"}
{"i": [["[\"fused_pointwise_conv_bias_add_sigmoid_mul\", 112, 112, 8, 32, 1]", "cuda -keys=cuda,gpu -max_num_threads=1024 -model=unknown -thread_warp_size=32", [-1, 16, 64, 49152, 2147483647, 1024, 8, 32], "", 0, []], [[], [["CI", 5], ["CHW", 3, "local"], ["SP", 3, 0, 1, [1, 1, 1, 1], 1], ["SP", 3, 5, 32, [4, 1, 1, 2], 1], ["SP", 3, 10, 8, [4, 2], 1], ["RE", 3, [0, 5, 1, 6, 2, 7, 10, 11, 3, 8, 12, 4, 9]], ["FSP", 4, 0, 2, 3], ["FSP", 4, 4, 3, 3], ["RE", 4, [0, 4, 1, 5, 2, 6, 3, 7]], ["CA", 3, 4, 5], ["CHR", 2, "shared", [3]], ["CA", 3, 4, 6], ["CHR", 1, "shared", [4]], ["CA", 2, 5, 6], ["FU", 9, [0, 1, 2, 3]], ["SP", 9, 0, 401408, [64], 1], ["AN", 9, 0, 5], ["AN", 9, 1, 6], ["FU", 6, [0, 1]], ["AN", 6, 0, 5], ["FU", 6, [1, 2]], ["AN", 6, 1, 4], ["FU", 6, [2, 3]], ["AN", 6, 2, 6], ["FU", 4, [0, 1]], ["SP", 4, 0, 32, [1], 1], ["AN", 4, 1, 2], ["FFSP", 4, 0, [3, 2], 1, 1], ["AN", 4, 1, 6], ["FU", 2, [0, 1]], ["SP", 2, 0, 8, [1], 1], ["AN", 2, 1, 2], ["FFSP", 2, 0, [3, 2], 1, 1], ["AN", 2, 1, 6], ["PR", 5, 0, "auto_unroll_max_step$0"]]]], "r": [[2.01586e-05, 2.01649e-05, 2.01567e-05], 0, 19.728, 1662026033], "v": "v0.6"}
{"i": [["[\"fused_pointwise_conv_bias_add_sigmoid_mul\", 112, 112, 8, 32, 1]", "cuda -keys=cuda,gpu -max_num_threads=1024 -model=unknown -thread_warp_size=32", [-1, 16, 64, 49152, 2147483647, 1024, 8, 32], "", 0, []], [[], [["CI", 5], ["CHW", 3, "local"], ["SP", 3, 0, 1, [1, 1, 1, 1], 1], ["SP", 3, 5, 32, [4, 1, 4, 1], 1], ["SP", 3, 10, 8, [1, 4], 1], ["RE", 3, [0, 5, 1, 6, 2, 7, 10, 11, 3, 8, 12, 4, 9]], ["FSP", 4, 0, 2, 3], ["FSP", 4, 4, 3, 3], ["RE", 4, [0, 4, 1, 5, 2, 6, 3, 7]], ["CA", 3, 4, 5], ["CHR", 2, "shared", [3]], ["CA", 3, 4, 6], ["CHR", 1, "shared", [4]], ["CA", 2, 5, 6], ["FU", 9, [0, 1, 2, 3]], ["SP", 9, 0, 401408, [64], 1], ["AN", 9, 0, 5], ["AN", 9, 1, 6], ["FU", 6, [0, 1]], ["AN", 6, 0, 5], ["FU", 6, [1, 2]], ["AN", 6, 1, 4], ["FU", 6, [2, 3]], ["AN", 6, 2, 6], ["FU", 4, [0, 1]], ["SP", 4, 0, 16, [1], 1], ["AN", 4, 1, 2], ["FFSP", 4, 0, [3, 2], 1, 1], ["AN", 4, 1, 6], ["FU", 2, [0, 1]], ["SP", 2, 0, 4, [1], 1], ["AN", 2, 1, 2], ["FFSP", 2, 0, [3, 2], 1, 1], ["AN", 2, 1, 6], ["PR", 5, 0, "auto_unroll_max_step$16"]]]], "r": [[2.19445e-05, 2.19308e-05, 2.19206e-05], 0, 19.1814, 1662026032], "v": "v0.6"}
{"i": [["[\"fused_pointwise_conv_bias_add_sigmoid_mul\", 112, 112, 8, 32, 1]", "cuda -keys=cuda,gpu -max_num_threads=1024 -model=unknown -thread_warp_size=32", [-1, 16, 64, 49152, 2147483647, 1024, 8, 32], "", 0, []], [[], [["CI", 5], ["CHW", 3, "local"], ["SP", 3, 0, 1, [1, 1, 1, 1], 1], ["SP", 3, 5, 32, [2, 1, 2, 1], 1], ["SP", 3, 10, 8, [1, 8], 1], ["RE", 3, [0, 5, 1, 6, 2, 7, 10, 11, 3, 8, 12, 4, 9]], ["FSP", 4, 0, 2, 3], ["FSP", 4, 4, 3, 3], ["RE", 4, [0, 4, 1, 5, 2, 6, 3, 7]], ["CA", 3, 4, 5], ["CHR", 2, "shared", [3]], ["CA", 3, 4, 6], ["CHR", 1, "shared", [4]], ["CA", 2, 5, 6], ["FU", 9, [0, 1, 2, 3]], ["SP", 9, 0, 401408, [32], 1], ["AN", 9, 0, 5], ["AN", 9, 1, 6], ["FU", 6, [0, 1]], ["AN", 6, 0, 5], ["FU", 6, [1, 2]], ["AN", 6, 1, 4], ["FU", 6, [2, 3]], ["AN", 6, 2, 6], ["FU", 4, [0, 1]], ["SP", 4, 0, 16, [1], 1], ["AN", 4, 1, 2], ["FFSP", 4, 0, [3, 2], 1, 1], ["AN", 4, 1, 6], ["FU", 2, [0, 1]], ["SP", 2, 0, 8, [1], 1], ["AN", 2, 1, 2], ["FFSP", 2, 0, [3, 2], 1, 1], ["AN", 2, 1, 6], ["PR", 5, 0, "auto_unroll_max_step$16"]]]], "r": [[2.79757e-05, 2.79742e-05, 2.79729e-05], 0, 16.086, 1662026029], "v": "v0.6"}
{"i": [["[\"fused_pointwise_conv_bias_add_sigmoid_mul\", 112, 112, 8, 32, 1]", "cuda -keys=cuda,gpu -max_num_threads=1024 -model=unknown -thread_warp_size=32", [-1, 16, 64, 49152, 2147483647, 1024, 8, 32], "", 0, []], [[], [["CI", 5], ["CHW", 3, "local"], ["SP", 3, 0, 1, [1, 1, 1, 1], 1], ["SP", 3, 5, 32, [4, 1, 1, 4], 1], ["SP", 3, 10, 8, [1, 1], 1], ["RE", 3, [0, 5, 1, 6, 2, 7, 10, 11, 3, 8, 12, 4, 9]], ["FSP", 4, 0, 2, 3], ["FSP", 4, 4, 3, 3], ["RE", 4, [0, 4, 1, 5, 2, 6, 3, 7]], ["CA", 3, 4, 5], ["CHR", 2, "shared", [3]], ["CA", 3, 4, 6], ["CHR", 1, "shared", [4]], ["CA", 2, 5, 6], ["FU", 9, [0, 1, 2, 3]], ["SP", 9, 0, 401408, [32], 1], ["AN", 9, 0, 5], ["AN", 9, 1, 6], ["FU", 6, [0, 1]], ["AN", 6, 0, 5], ["FU", 6, [1, 2]], ["AN", 6, 1, 4], ["FU", 6, [2, 3]], ["AN", 6, 2, 6], ["FU", 4, [0, 1]], ["SP", 4, 0, 16, [1], 1], ["AN", 4, 1, 2], ["FFSP", 4, 0, [3, 2], 1, 1], ["AN", 4, 1, 6], ["FU", 2, [0, 1]], ["SP", 2, 0, 1, [1], 1], ["AN", 2, 1, 2], ["FFSP", 2, 0, [3, 2], 1, 1], ["AN", 2, 1, 6], ["PR", 5, 0, "auto_unroll_max_step$64"]]]], "r": [[3.07068e-05, 3.07327e-05, 3.0723e-05], 0, 14.9985, 1662026028], "v": "v0.6"}
{"i": [["[\"fused_pointwise_conv_bias_add_sigmoid_mul\", 112, 112, 8, 32, 1]", "cuda -keys=cuda,gpu -max_num_threads=1024 -model=unknown -thread_warp_size=32", [-1, 16, 64, 49152, 2147483647, 1024, 8, 32], "", 0, []], [[], [["CI", 5], ["CHW", 3, "local"], ["SP", 3, 0, 1, [1, 1, 1, 1], 1], ["SP", 3, 5, 32, [1, 2, 2, 2], 1], ["SP", 3, 10, 8, [2, 2], 1], ["RE", 3, [0, 5, 1, 6, 2, 7, 10, 11, 3, 8, 12, 4, 9]], ["FSP", 4, 0, 2, 3], ["FSP", 4, 4, 3, 3], ["RE", 4, [0, 4, 1, 5, 2, 6, 3, 7]], ["CA", 3, 4, 5], ["CHR", 2, "shared", [3]], ["CA", 3, 4, 6], ["CHR", 1, "shared", [4]], ["CA", 2, 5, 6], ["FU", 9, [0, 1, 2, 3]], ["SP", 9, 0, 401408, [2], 1], ["AN", 9, 0, 5], ["AN", 9, 1, 6], ["FU", 6, [0, 1]], ["AN", 6, 0, 5], ["FU", 6, [1, 2]], ["AN", 6, 1, 4], ["FU", 6, [2, 3]], ["AN", 6, 2, 6], ["FU", 4, [0, 1]], ["SP", 4, 0, 16, [1], 1], ["AN", 4, 1, 2], ["FFSP", 4, 0, [3, 2], 1, 1], ["AN", 4, 1, 6], ["FU", 2, [0, 1]], ["SP", 2, 0, 4, [1], 1], ["AN", 2, 1, 2], ["FFSP", 2, 0, [3, 2], 1, 1], ["AN", 2, 1, 6], ["PR", 5, 0, "auto_unroll_max_step$0"]]]], "r": [[0.00028926, 0.000289235, 0.000289248], 0, 17.8623, 1662026031], "v": "v0.6"}
{"i": [["[\"fused_pointwise_conv_bias_add_sigmoid_mul\", 112, 112, 8, 32, 1]", "cuda -keys=cuda,gpu -max_num_threads=1024 -model=unknown -thread_warp_size=32", [-1, 16, 64, 49152, 2147483647, 1024, 8, 32], "", 0, []], [[], [["CI", 5], ["CHW", 3, "local"], ["SP", 3, 0, 1, [1, 1, 1, 1], 1], ["SP", 3, 5, 32, [2, 1, 8, 1], 1], ["SP", 3, 10, 8, [2, 1], 1], ["RE", 3, [0, 5, 1, 6, 2, 7, 10, 11, 3, 8, 12, 4, 9]], ["FSP", 4, 0, 2, 3], ["FSP", 4, 4, 3, 3], ["RE", 4, [0, 4, 1, 5, 2, 6, 3, 7]], ["CA", 3, 4, 5], ["CHR", 2, "shared", [3]], ["CA", 3, 4, 6], ["CHR", 1, "shared", [4]], ["CA", 2, 5, 6], ["FU", 9, [0, 1, 2, 3]], ["SP", 9, 0, 401408, [8], 1], ["AN", 9, 0, 5], ["AN", 9, 1, 6], ["FU", 6, [0, 1]], ["AN", 6, 0, 5], ["FU", 6, [1, 2]], ["AN", 6, 1, 4], ["FU", 6, [2, 3]], ["AN", 6, 2, 6], ["FU", 4, [0, 1]], ["SP", 4, 0, 16, [1], 1], ["AN", 4, 1, 2], ["FFSP", 4, 0, [3, 2], 1, 1], ["AN", 4, 1, 6], ["FU", 2, [0, 1]], ["SP", 2, 0, 2, [1], 1], ["AN", 2, 1, 2], ["FFSP", 2, 0, [3, 2], 1, 1], ["AN", 2, 1, 6], ["PR", 5, 0, "auto_unroll_max_step$0"]]]], "r": [[8.31129e-05, 8.31102e-05, 8.30933e-05], 0, 20.9345, 1662026034], "v": "v0.6"}
{"i": [["[\"fused_pointwise_conv_bias_add_sigmoid_mul\", 112, 112, 8, 32, 1]", "cuda -keys=cuda,gpu -max_num_threads=1024 -model=unknown -thread_warp_size=32", [-1, 16, 64, 49152, 2147483647, 1024, 8, 32], "", 0, []], [[], [["CI", 5], ["CHW", 3, "local"], ["SP", 3, 0, 1, [1, 1, 1, 1], 1], ["SP", 3, 5, 32, [1, 4, 4, 2], 1], ["SP", 3, 10, 8, [4, 1], 1], ["RE", 3, [0, 5, 1, 6, 2, 7, 10, 11, 3, 8, 12, 4, 9]], ["FSP", 4, 0, 2, 3], ["FSP", 4, 4, 3, 3], ["RE", 4, [0, 4, 1, 5, 2, 6, 3, 7]], ["CA", 3, 4, 5], ["CHR", 2, "shared", [3]], ["CA", 3, 4, 6], ["CHR", 1, "shared", [4]], ["CA", 2, 5, 6], ["FU", 9, [0, 1, 2, 3]], ["SP", 9, 0, 401408, [64], 1], ["AN", 9, 0, 5], ["AN", 9, 1, 6], ["FU", 6, [0, 1]], ["AN", 6, 0, 5], ["FU", 6, [1, 2]], ["AN", 6, 1, 4], ["FU", 6, [2, 3]], ["AN", 6, 2, 6], ["FU", 4, [0, 1]], ["SP", 4, 0, 64, [1], 1], ["AN", 4, 1, 2], ["FFSP", 4, 0, [3, 2], 1, 1], ["AN", 4, 1, 6], ["FU", 2, [0, 1]], ["SP", 2, 0, 8, [1], 1], ["AN", 2, 1, 2], ["FFSP", 2, 0, [3, 2], 1, 1], ["AN", 2, 1, 6], ["PR", 5, 0, "auto_unroll_max_step$512"]]]], "r": [[1.91286e-05, 1.91239e-05, 1.91274e-05], 0, 21.9885, 1662026035], "v": "v0.6"}
