python/models/efficientnet/kernel_configs/efficient_se_module_mul_144_1.log
{"i": [["[\"se_module_mul\", 144, 1]", "cuda -keys=cuda,gpu -max_num_threads=1024 -model=unknown -thread_warp_size=32", [-1, 16, 64, 49152, 2147483647, 1024, 8, 32], "", 0, []], [[], [["FU", 2, [0, 1]], ["SP", 2, 0, 144, [9], 1], ["AN", 2, 0, 5], ["AN", 2, 1, 6]]]], "r": [[2.97293e-06, 2.813e-06, 2.84273e-06], 0, 1.06336, 1681270209], "v": "v0.6"}
{"i": [["[\"se_module_mul\", 144, 1]", "cuda -keys=cuda,gpu -max_num_threads=1024 -model=unknown -thread_warp_size=32", [-1, 16, 64, 49152, 2147483647, 1024, 8, 32], "", 0, []], [[], [["FU", 2, [0, 1]], ["SP", 2, 0, 144, [8], 1], ["AN", 2, 0, 5], ["AN", 2, 1, 6]]]], "r": [[2.90527e-06, 2.87836e-06, 2.87128e-06], 0, 3.4562, 1681270212], "v": "v0.6"}
{"i": [["[\"se_module_mul\", 144, 1]", "cuda -keys=cuda,gpu -max_num_threads=1024 -model=unknown -thread_warp_size=32", [-1, 16, 64, 49152, 2147483647, 1024, 8, 32], "", 0, []], [[], [["FU", 2, [0, 1]], ["SP", 2, 0, 144, [18], 1], ["AN", 2, 0, 5], ["AN", 2, 1, 6]]]], "r": [[2.86494e-06, 2.83082e-06, 2.84184e-06], 0, 0.675304, 1681270209], "v": "v0.6"}
{"i": [["[\"se_module_mul\", 144, 1]", "cuda -keys=cuda,gpu -max_num_threads=1024 -model=unknown -thread_warp_size=32", [-1, 16, 64, 49152, 2147483647, 1024, 8, 32], "", 0, []], [[], [["FU", 2, [0, 1]], ["SP", 2, 0, 144, [64], 1], ["AN", 2, 0, 5], ["AN", 2, 1, 6]]]], "r": [[2.95093e-06, 2.81639e-06, 2.85807e-06], 0, 1.87263, 1681270210], "v": "v0.6"}
{"i": [["[\"se_module_mul\", 144, 1]", "cuda -keys=cuda,gpu -max_num_threads=1024 -model=unknown -thread_warp_size=32", [-1, 16, 64, 49152, 2147483647, 1024, 8, 32], "", 0, []], [[], [["FU", 2, [0, 1]], ["SP", 2, 0, 144, [4], 1], ["AN", 2, 0, 5], ["AN", 2, 1, 6]]]], "r": [[4.38003e-06, 4.40106e-06, 4.32897e-06], 0, 1.47533, 1681270210], "v": "v0.6"}
{"i": [["[\"se_module_mul\", 144, 1]", "cuda -keys=cuda,gpu -max_num_threads=1024 -model=unknown -thread_warp_size=32", [-1, 16, 64, 49152, 2147483647, 1024, 8, 32], "", 0, []], [[], [["FU", 2, [0, 1]], ["SP", 2, 0, 144, [12], 1], ["AN", 2, 0, 5], ["AN", 2, 1, 6]]]], "r": [[2.83722e-06, 2.81497e-06, 2.85674e-06], 0, 2.26431, 1681270211], "v": "v0.6"}
{"i": [["[\"se_module_mul\", 144, 1]", "cuda -keys=cuda,gpu -max_num_threads=1024 -model=unknown -thread_warp_size=32", [-1, 16, 64, 49152, 2147483647, 1024, 8, 32], "", 0, []], [[], [["FU", 2, [0, 1]], ["SP", 2, 0, 144, [48], 1], ["AN", 2, 0, 5], ["AN", 2, 1, 6]]]], "r": [[2.87013e-06, 2.8338e-06, 2.82275e-06], 0, 3.08066, 1681270211], "v": "v0.6"}
{"i": [["[\"se_module_mul\", 144, 1]", "cuda -keys=cuda,gpu -max_num_threads=1024 -model=unknown -thread_warp_size=32", [-1, 16, 64, 49152, 2147483647, 1024, 8, 32], "", 0, []], [[], [["FU", 2, [0, 1]], ["SP", 2, 0, 144, [36], 1], ["AN", 2, 0, 5], ["AN", 2, 1, 6]]]], "r": [[2.83022e-06, 2.82117e-06, 2.80447e-06], 0, 2.73736, 1681270211], "v": "v0.6"}
{"i": [["[\"se_module_mul\", 144, 1]", "cuda -keys=cuda,gpu -max_num_threads=1024 -model=unknown -thread_warp_size=32", [-1, 16, 64, 49152, 2147483647, 1024, 8, 32], "", 0, []], [[], [["FU", 2, [0, 1]], ["SP", 2, 0, 144, [32], 1], ["AN", 2, 0, 5], ["AN", 2, 1, 6]]]], "r": [[2.80862e-06, 2.77845e-06, 2.80249e-06], 0, 4.62263, 1681270213], "v": "v0.6"}
{"i": [["[\"se_module_mul\", 144, 1]", "cuda -keys=cuda,gpu -max_num_threads=1024 -model=unknown -thread_warp_size=32", [-1, 16, 64, 49152, 2147483647, 1024, 8, 32], "", 0, []], [[], [["FU", 2, [0, 1]], ["SP", 2, 0, 144, [3], 1], ["AN", 2, 0, 5], ["AN", 2, 1, 6]]]], "r": [[4.33053e-06, 4.33091e-06, 4.30661e-06], 0, 4.24076, 1681270213], "v": "v0.6"}
{"i": [["[\"se_module_mul\", 144, 1]", "cuda -keys=cuda,gpu -max_num_threads=1024 -model=unknown -thread_warp_size=32", [-1, 16, 64, 49152, 2147483647, 1024, 8, 32], "", 0, []], [[], [["FU", 2, [0, 1]], ["SP", 2, 0, 144, [6], 1], ["AN", 2, 0, 5], ["AN", 2, 1, 6]]]], "r": [[2.82721e-06, 2.84448e-06, 2.82195e-06], 0, 5.06104, 1681270213], "v": "v0.6"}
{"i": [["[\"se_module_mul\", 144, 1]", "cuda -keys=cuda,gpu -max_num_threads=1024 -model=unknown -thread_warp_size=32", [-1, 16, 64, 49152, 2147483647, 1024, 8, 32], "", 0, []], [[], [["FU", 2, [0, 1]], ["SP", 2, 0, 144, [16], 1], ["AN", 2, 0, 5], ["AN", 2, 1, 6]]]], "r": [[4.10057e-06, 4.09719e-06, 4.04736e-06], 0, 6.33812, 1681270215], "v": "v0.6"}
{"i": [["[\"se_module_mul\", 144, 1]", "cuda -keys=cuda,gpu -max_num_threads=1024 -model=unknown -thread_warp_size=32", [-1, 16, 64, 49152, 2147483647, 1024, 8, 32], "", 0, []], [[], [["FU", 2, [0, 1]], ["SP", 2, 0, 144, [1], 1], ["AN", 2, 0, 5], ["AN", 2, 1, 6]]]], "r": [[2.79665e-06, 2.83351e-06, 2.79959e-06], 0, 3.88029, 1681270212], "v": "v0.6"}
{"i": [["[\"se_module_mul\", 144, 1]", "cuda -keys=cuda,gpu -max_num_threads=1024 -model=unknown -thread_warp_size=32", [-1, 16, 64, 49152, 2147483647, 1024, 8, 32], "", 0, []], [[], [["FU", 2, [0, 1]], ["SP", 2, 0, 144, [24], 1], ["AN", 2, 0, 5], ["AN", 2, 1, 6]]]], "r": [[2.82227e-06, 2.83713e-06, 2.83625e-06], 0, 5.80944, 1681270214], "v": "v0.6"}
{"i": [["[\"se_module_mul\", 144, 1]", "cuda -keys=cuda,gpu -max_num_threads=1024 -model=unknown -thread_warp_size=32", [-1, 16, 64, 49152, 2147483647, 1024, 8, 32], "", 0, []], [[], [["FU", 2, [0, 1]], ["SP", 2, 0, 144, [2], 1], ["AN", 2, 0, 5], ["AN", 2, 1, 6]]]], "r": [[2.92244e-06, 2.98262e-06, 3.03216e-06], 0, 5.46627, 1681270214], "v": "v0.6"}
