python/models/efficientnet/kernel_configs/efficient_pointwise_conv2d_bn_short_cut_add_7_7_1152_192_4.log
{"i": [["[\"pointwise_conv2d_bn_short_cut_add\", 7, 7, 1152, 192, 4]", "cuda -keys=cuda,gpu -max_num_threads=1024 -model=unknown -thread_warp_size=32", [-1, 16, 64, 49152, 2147483647, 1024, 8, 32], "", 0, []], [[], [["CI", 4], ["SP", 2, 0, 4, [2, 2, 1, 1], 1], ["SP", 2, 5, 7, [7, 1, 1, 1], 1], ["SP", 2, 10, 7, [1, 1, 1, 7], 1], ["SP", 2, 15, 192, [1, 3, 8, 8], 1], ["SP", 2, 20, 1152, [1, 18], 1], ["RE", 2, [0, 5, 10, 15, 1, 6, 11, 16, 2, 7, 12, 17, 20, 21, 3, 8, 13, 18, 22, 4, 9, 14, 19]], ["FSP", 7, 0, 1, 3], ["FSP", 7, 4, 2, 3], ["FSP", 7, 8, 3, 3], ["FSP", 7, 12, 4, 3], ["RE", 7, [0, 4, 8, 12, 1, 5, 9, 13, 2, 6, 10, 14, 3, 7, 11, 15]], ["CA", 2, 7, 11], ["CHR", 1, "shared", [2]], ["CA", 2, 3, 12], ["CHR", 0, "shared", [3]], ["CA", 1, 4, 12], ["FU", 9, [0, 1, 2, 3]], ["AN", 9, 0, 5], ["FU", 9, [1, 2, 3, 4]], ["AN", 9, 1, 4], ["FU", 9, [2, 3, 4, 5]], ["AN", 9, 2, 6], ["FU", 3, [0, 1]], ["SP", 3, 0, 64, [1], 1], ["AN", 3, 1, 2], ["FFSP", 3, 0, [4, 3, 2, 1], 1, 1], ["AN", 3, 1, 6], ["FU", 1, [0, 1, 2, 3]], ["SP", 1, 0, 7, [1], 1], ["AN", 1, 1, 2], ["FFSP", 1, 0, [4, 3, 2, 1], 1, 1], ["AN", 1, 1, 6], ["PR", 4, 0, "auto_unroll_max_step$16"]]]], "r": [[0.0482368, 0.0482122, 0.0482385], 0, 19.0299, 1661980258], "v": "v0.6"}
{"i": [["[\"pointwise_conv2d_bn_short_cut_add\", 7, 7, 1152, 192, 4]", "cuda -keys=cuda,gpu -max_num_threads=1024 -model=unknown -thread_warp_size=32", [-1, 16, 64, 49152, 2147483647, 1024, 8, 32], "", 0, []], [[], [["CI", 4], ["SP", 2, 0, 4, [2, 1, 2, 1], 1], ["SP", 2, 5, 7, [1, 7, 1, 1], 1], ["SP", 2, 10, 7, [1, 1, 1, 7], 1], ["SP", 2, 15, 192, [1, 8, 2, 3], 1], ["SP", 2, 20, 1152, [2, 2], 1], ["RE", 2, [0, 5, 10, 15, 1, 6, 11, 16, 2, 7, 12, 17, 20, 21, 3, 8, 13, 18, 22, 4, 9, 14, 19]], ["FSP", 7, 0, 1, 3], ["FSP", 7, 4, 2, 3], ["FSP", 7, 8, 3, 3], ["FSP", 7, 12, 4, 3], ["RE", 7, [0, 4, 8, 12, 1, 5, 9, 13, 2, 6, 10, 14, 3, 7, 11, 15]], ["CA", 2, 7, 11], ["CHR", 1, "shared", [2]], ["CA", 2, 3, 12], ["CHR", 0, "shared", [3]], ["CA", 1, 4, 12], ["FU", 9, [0, 1, 2, 3]], ["AN", 9, 0, 5], ["FU", 9, [1, 2, 3, 4]], ["AN", 9, 1, 4], ["FU", 9, [2, 3, 4, 5]], ["AN", 9, 2, 6], ["FU", 3, [0, 1]], ["SP", 3, 0, 24, [1], 1], ["AN", 3, 1, 2], ["FFSP", 3, 0, [4, 3, 2, 1], 1, 1], ["AN", 3, 1, 6], ["FU", 1, [0, 1, 2, 3]], ["SP", 1, 0, 56, [1], 1], ["AN", 1, 1, 2], ["FFSP", 1, 0, [4, 3, 2, 1], 1, 1], ["AN", 1, 1, 6], ["PR", 4, 0, "auto_unroll_max_step$0"]]]], "r": [[0.00089031, 0.000890506, 0.00089027], 0, 4.95691, 1661980246], "v": "v0.6"}
{"i": [["[\"pointwise_conv2d_bn_short_cut_add\", 7, 7, 1152, 192, 4]", "cuda -keys=cuda,gpu -max_num_threads=1024 -model=unknown -thread_warp_size=32", [-1, 16, 64, 49152, 2147483647, 1024, 8, 32], "", 0, []], [[], [["CI", 4], ["SP", 2, 0, 4, [1, 1, 1, 2], 1], ["SP", 2, 5, 7, [1, 1, 1, 7], 1], ["SP", 2, 10, 7, [1, 7, 1, 1], 1], ["SP", 2, 15, 192, [8, 8, 1, 3], 1], ["SP", 2, 20, 1152, [8, 4], 1], ["RE", 2, [0, 5, 10, 15, 1, 6, 11, 16, 2, 7, 12, 17, 20, 21, 3, 8, 13, 18, 22, 4, 9, 14, 19]], ["FSP", 7, 0, 1, 3], ["FSP", 7, 4, 2, 3], ["FSP", 7, 8, 3, 3], ["FSP", 7, 12, 4, 3], ["RE", 7, [0, 4, 8, 12, 1, 5, 9, 13, 2, 6, 10, 14, 3, 7, 11, 15]], ["CA", 2, 7, 11], ["CHR", 1, "shared", [2]], ["CA", 2, 3, 12], ["CHR", 0, "shared", [3]], ["CA", 1, 4, 12], ["FU", 9, [0, 1, 2, 3]], ["AN", 9, 0, 5], ["FU", 9, [1, 2, 3, 4]], ["AN", 9, 1, 4], ["FU", 9, [2, 3, 4, 5]], ["AN", 9, 2, 6], ["FU", 3, [0, 1]], ["SP", 3, 0, 96, [1], 1], ["AN", 3, 1, 2], ["FFSP", 3, 0, [4, 3, 2, 1], 1, 1], ["AN", 3, 1, 6], ["FU", 1, [0, 1, 2, 3]], ["SP", 1, 0, 64, [2], 1], ["AN", 1, 1, 2], ["FFSP", 1, 0, [4, 3, 2, 1], 1, 1], ["AN", 1, 1, 6], ["PR", 4, 0, "auto_unroll_max_step$512"]]]], "r": [[0.00295601, 0.00295416, 0.00295727], 0, 7.39318, 1661980247], "v": "v0.6"}
{"i": [["[\"pointwise_conv2d_bn_short_cut_add\", 7, 7, 1152, 192, 4]", "cuda -keys=cuda,gpu -max_num_threads=1024 -model=unknown -thread_warp_size=32", [-1, 16, 64, 49152, 2147483647, 1024, 8, 32], "", 0, []], [[], [["CI", 4], ["SP", 2, 0, 4, [1, 2, 1, 1], 1], ["SP", 2, 5, 7, [1, 1, 7, 1], 1], ["SP", 2, 10, 7, [7, 1, 1, 1], 1], ["SP", 2, 15, 192, [1, 48, 4, 1], 1], ["SP", 2, 20, 1152, [8, 3], 1], ["RE", 2, [0, 5, 10, 15, 1, 6, 11, 16, 2, 7, 12, 17, 20, 21, 3, 8, 13, 18, 22, 4, 9, 14, 19]], ["FSP", 7, 0, 1, 3], ["FSP", 7, 4, 2, 3], ["FSP", 7, 8, 3, 3], ["FSP", 7, 12, 4, 3], ["RE", 7, [0, 4, 8, 12, 1, 5, 9, 13, 2, 6, 10, 14, 3, 7, 11, 15]], ["CA", 2, 7, 11], ["CHR", 1, "shared", [2]], ["CA", 2, 3, 12], ["CHR", 0, "shared", [3]], ["CA", 1, 4, 12], ["FU", 9, [0, 1, 2, 3]], ["AN", 9, 0, 5], ["FU", 9, [1, 2, 3, 4]], ["AN", 9, 1, 4], ["FU", 9, [2, 3, 4, 5]], ["AN", 9, 2, 6], ["FU", 3, [0, 1]], ["SP", 3, 0, 96, [1], 1], ["AN", 3, 1, 2], ["FFSP", 3, 0, [4, 3, 2, 1], 1, 1], ["AN", 3, 1, 6], ["FU", 1, [0, 1, 2, 3]], ["SP", 1, 0, 168, [56], 1], ["AN", 1, 1, 2], ["FFSP", 1, 0, [4, 3, 2, 1], 1, 1], ["AN", 1, 1, 6], ["PR", 4, 0, "auto_unroll_max_step$1024"]]]], "r": [[0.00227841, 0.0023765, 0.00240626], 0, 15.084, 1661980256], "v": "v0.6"}
{"i": [["[\"pointwise_conv2d_bn_short_cut_add\", 7, 7, 1152, 192, 4]", "cuda -keys=cuda,gpu -max_num_threads=1024 -model=unknown -thread_warp_size=32", [-1, 16, 64, 49152, 2147483647, 1024, 8, 32], "", 0, []], [[], [["CI", 4], ["SP", 2, 0, 4, [1, 1, 2, 2], 1], ["SP", 2, 5, 7, [1, 7, 1, 1], 1], ["SP", 2, 10, 7, [1, 1, 1, 1], 1], ["SP", 2, 15, 192, [2, 12, 1, 4], 1], ["SP", 2, 20, 1152, [8, 9], 1], ["RE", 2, [0, 5, 10, 15, 1, 6, 11, 16, 2, 7, 12, 17, 20, 21, 3, 8, 13, 18, 22, 4, 9, 14, 19]], ["FSP", 7, 0, 1, 3], ["FSP", 7, 4, 2, 3], ["FSP", 7, 8, 3, 3], ["FSP", 7, 12, 4, 3], ["RE", 7, [0, 4, 8, 12, 1, 5, 9, 13, 2, 6, 10, 14, 3, 7, 11, 15]], ["CA", 2, 7, 11], ["CHR", 1, "shared", [2]], ["CA", 2, 3, 12], ["CHR", 0, "shared", [3]], ["CA", 1, 4, 12], ["FU", 9, [0, 1, 2, 3]], ["AN", 9, 0, 5], ["FU", 9, [1, 2, 3, 4]], ["AN", 9, 1, 4], ["FU", 9, [2, 3, 4, 5]], ["AN", 9, 2, 6], ["FU", 3, [0, 1]], ["SP", 3, 0, 72, [1], 1], ["AN", 3, 1, 2], ["FFSP", 3, 0, [4, 3, 2, 1], 1, 1], ["AN", 3, 1, 6], ["FU", 1, [0, 1, 2, 3]], ["SP", 1, 0, 288, [1], 1], ["AN", 1, 1, 2], ["FFSP", 1, 0, [4, 3, 2, 1], 1, 1], ["AN", 1, 1, 6], ["PR", 4, 0, "auto_unroll_max_step$16"]]]], "r": [[0.00041804, 0.000418055, 0.000418066], 0, 17.2986, 1661980260], "v": "v0.6"}
{"i": [["[\"pointwise_conv2d_bn_short_cut_add\", 7, 7, 1152, 192, 4]", "cuda -keys=cuda,gpu -max_num_threads=1024 -model=unknown -thread_warp_size=32", [-1, 16, 64, 49152, 2147483647, 1024, 8, 32], "", 0, []], [[], [["CI", 4], ["SP", 2, 0, 4, [1, 1, 1, 4], 1], ["SP", 2, 5, 7, [1, 1, 7, 1], 1], ["SP", 2, 10, 7, [1, 7, 1, 1], 1], ["SP", 2, 15, 192, [2, 2, 12, 1], 1], ["SP", 2, 20, 1152, [2, 2], 1], ["RE", 2, [0, 5, 10, 15, 1, 6, 11, 16, 2, 7, 12, 17, 20, 21, 3, 8, 13, 18, 22, 4, 9, 14, 19]], ["FSP", 7, 0, 1, 3], ["FSP", 7, 4, 2, 3], ["FSP", 7, 8, 3, 3], ["FSP", 7, 12, 4, 3], ["RE", 7, [0, 4, 8, 12, 1, 5, 9, 13, 2, 6, 10, 14, 3, 7, 11, 15]], ["CA", 2, 7, 11], ["CHR", 1, "shared", [2]], ["CA", 2, 3, 12], ["CHR", 0, "shared", [3]], ["CA", 1, 4, 12], ["FU", 9, [0, 1, 2, 3]], ["AN", 9, 0, 5], ["FU", 9, [1, 2, 3, 4]], ["AN", 9, 1, 4], ["FU", 9, [2, 3, 4, 5]], ["AN", 9, 2, 6], ["FU", 3, [0, 1]], ["SP", 3, 0, 12, [1], 1], ["AN", 3, 1, 2], ["FFSP", 3, 0, [4, 3, 2, 1], 1, 1], ["AN", 3, 1, 6], ["FU", 1, [0, 1, 2, 3]], ["SP", 1, 0, 112, [4], 1], ["AN", 1, 1, 2], ["FFSP", 1, 0, [4, 3, 2, 1], 1, 1], ["AN", 1, 1, 6], ["PR", 4, 0, "auto_unroll_max_step$16"]]]], "r": [[0.0167795, 0.0147195, 0.0140452], 0, 15.4301, 1661980257], "v": "v0.6"}
{"i": [["[\"pointwise_conv2d_bn_short_cut_add\", 7, 7, 1152, 192, 4]", "cuda -keys=cuda,gpu -max_num_threads=1024 -model=unknown -thread_warp_size=32", [-1, 16, 64, 49152, 2147483647, 1024, 8, 32], "", 0, []], [[], [["CI", 4], ["SP", 2, 0, 4, [1, 1, 1, 2], 1], ["SP", 2, 5, 7, [1, 7, 1, 1], 1], ["SP", 2, 10, 7, [1, 1, 1, 1], 1], ["SP", 2, 15, 192, [2, 2, 8, 6], 1], ["SP", 2, 20, 1152, [2, 8], 1], ["RE", 2, [0, 5, 10, 15, 1, 6, 11, 16, 2, 7, 12, 17, 20, 21, 3, 8, 13, 18, 22, 4, 9, 14, 19]], ["FSP", 7, 0, 1, 3], ["FSP", 7, 4, 2, 3], ["FSP", 7, 8, 3, 3], ["FSP", 7, 12, 4, 3], ["RE", 7, [0, 4, 8, 12, 1, 5, 9, 13, 2, 6, 10, 14, 3, 7, 11, 15]], ["CA", 2, 7, 11], ["CHR", 1, "shared", [2]], ["CA", 2, 3, 12], ["CHR", 0, "shared", [3]], ["CA", 1, 4, 12], ["FU", 9, [0, 1, 2, 3]], ["AN", 9, 0, 5], ["FU", 9, [1, 2, 3, 4]], ["AN", 9, 1, 4], ["FU", 9, [2, 3, 4, 5]], ["AN", 9, 2, 6], ["FU", 3, [0, 1]], ["SP", 3, 0, 768, [1], 1], ["AN", 3, 1, 2], ["FFSP", 3, 0, [4, 3, 2, 1], 1, 1], ["AN", 3, 1, 6], ["FU", 1, [0, 1, 2, 3]], ["SP", 1, 0, 32, [1], 1], ["AN", 1, 1, 2], ["FFSP", 1, 0, [4, 3, 2, 1], 1, 1], ["AN", 1, 1, 6], ["PR", 4, 0, "auto_unroll_max_step$16"]]]], "r": [[0.00135052, 0.00135041, 0.00135052], 0, 4.6166, 1661980246], "v": "v0.6"}
{"i": [["[\"pointwise_conv2d_bn_short_cut_add\", 7, 7, 1152, 192, 4]", "cuda -keys=cuda,gpu -max_num_threads=1024 -model=unknown -thread_warp_size=32", [-1, 16, 64, 49152, 2147483647, 1024, 8, 32], "", 0, []], [[], [["CI", 4], ["SP", 2, 0, 4, [1, 1, 1, 2], 1], ["SP", 2, 5, 7, [7, 1, 1, 1], 1], ["SP", 2, 10, 7, [1, 1, 7, 1], 1], ["SP", 2, 15, 192, [1, 8, 1, 2], 1], ["SP", 2, 20, 1152, [6, 16], 1], ["RE", 2, [0, 5, 10, 15, 1, 6, 11, 16, 2, 7, 12, 17, 20, 21, 3, 8, 13, 18, 22, 4, 9, 14, 19]], ["FSP", 7, 0, 1, 3], ["FSP", 7, 4, 2, 3], ["FSP", 7, 8, 3, 3], ["FSP", 7, 12, 4, 3], ["RE", 7, [0, 4, 8, 12, 1, 5, 9, 13, 2, 6, 10, 14, 3, 7, 11, 15]], ["CA", 2, 7, 11], ["CHR", 1, "shared", [2]], ["CA", 2, 3, 12], ["CHR", 0, "shared", [3]], ["CA", 1, 4, 12], ["FU", 9, [0, 1, 2, 3]], ["AN", 9, 0, 5], ["FU", 9, [1, 2, 3, 4]], ["AN", 9, 1, 4], ["FU", 9, [2, 3, 4, 5]], ["AN", 9, 2, 6], ["FU", 3, [0, 1]], ["SP", 3, 0, 192, [3], 1], ["AN", 3, 1, 2], ["FFSP", 3, 0, [4, 3, 2, 1], 1, 1], ["AN", 3, 1, 6], ["FU", 1, [0, 1, 2, 3]], ["SP", 1, 0, 192, [1], 1], ["AN", 1, 1, 2], ["FFSP", 1, 0, [4, 3, 2, 1], 1, 1], ["AN", 1, 1, 6], ["PR", 4, 0, "auto_unroll_max_step$512"]]]], "r": [[0.00106813, 0.00106813, 0.00106812], 0, 14.2131, 1661980254], "v": "v0.6"}
{"i": [["[\"pointwise_conv2d_bn_short_cut_add\", 7, 7, 1152, 192, 4]", "cuda -keys=cuda,gpu -max_num_threads=1024 -model=unknown -thread_warp_size=32", [-1, 16, 64, 49152, 2147483647, 1024, 8, 32], "", 0, []], [[], [["CI", 4], ["SP", 2, 0, 4, [2, 2, 1, 1], 1], ["SP", 2, 5, 7, [1, 7, 1, 1], 1], ["SP", 2, 10, 7, [1, 7, 1, 1], 1], ["SP", 2, 15, 192, [1, 4, 16, 1], 1], ["SP", 2, 20, 1152, [12, 1], 1], ["RE", 2, [0, 5, 10, 15, 1, 6, 11, 16, 2, 7, 12, 17, 20, 21, 3, 8, 13, 18, 22, 4, 9, 14, 19]], ["FSP", 7, 0, 1, 3], ["FSP", 7, 4, 2, 3], ["FSP", 7, 8, 3, 3], ["FSP", 7, 12, 4, 3], ["RE", 7, [0, 4, 8, 12, 1, 5, 9, 13, 2, 6, 10, 14, 3, 7, 11, 15]], ["CA", 2, 7, 11], ["CHR", 1, "shared", [2]], ["CA", 2, 3, 12], ["CHR", 0, "shared", [3]], ["CA", 1, 4, 12], ["FU", 9, [0, 1, 2, 3]], ["AN", 9, 0, 5], ["FU", 9, [1, 2, 3, 4]], ["AN", 9, 1, 4], ["FU", 9, [2, 3, 4, 5]], ["AN", 9, 2, 6], ["FU", 3, [0, 1]], ["SP", 3, 0, 96, [1], 1], ["AN", 3, 1, 2], ["FFSP", 3, 0, [4, 3, 2, 1], 1, 1], ["AN", 3, 1, 6], ["FU", 1, [0, 1, 2, 3]], ["SP", 1, 0, 12, [1], 1], ["AN", 1, 1, 2], ["FFSP", 1, 0, [4, 3, 2, 1], 1, 1], ["AN", 1, 1, 6], ["PR", 4, 0, "auto_unroll_max_step$1024"]]]], "r": [[0.000738235, 0.000738314, 0.000738312], 0, 16.9582, 1661980259], "v": "v0.6"}
{"i": [["[\"pointwise_conv2d_bn_short_cut_add\", 7, 7, 1152, 192, 4]", "cuda -keys=cuda,gpu -max_num_threads=1024 -model=unknown -thread_warp_size=32", [-1, 16, 64, 49152, 2147483647, 1024, 8, 32], "", 0, []], [[], [["CI", 4], ["SP", 2, 0, 4, [1, 1, 1, 4], 1], ["SP", 2, 5, 7, [1, 1, 7, 1], 1], ["SP", 2, 10, 7, [1, 1, 1, 7], 1], ["SP", 2, 15, 192, [6, 8, 4, 1], 1], ["SP", 2, 20, 1152, [2, 2], 1], ["RE", 2, [0, 5, 10, 15, 1, 6, 11, 16, 2, 7, 12, 17, 20, 21, 3, 8, 13, 18, 22, 4, 9, 14, 19]], ["FSP", 7, 0, 1, 3], ["FSP", 7, 4, 2, 3], ["FSP", 7, 8, 3, 3], ["FSP", 7, 12, 4, 3], ["RE", 7, [0, 4, 8, 12, 1, 5, 9, 13, 2, 6, 10, 14, 3, 7, 11, 15]], ["CA", 2, 7, 11], ["CHR", 1, "shared", [2]], ["CA", 2, 3, 12], ["CHR", 0, "shared", [3]], ["CA", 1, 4, 12], ["FU", 9, [0, 1, 2, 3]], ["AN", 9, 0, 5], ["FU", 9, [1, 2, 3, 4]], ["AN", 9, 1, 4], ["FU", 9, [2, 3, 4, 5]], ["AN", 9, 2, 6], ["FU", 3, [0, 1]], ["SP", 3, 0, 12, [1], 1], ["AN", 3, 1, 2], ["FFSP", 3, 0, [4, 3, 2, 1], 1, 1], ["AN", 3, 1, 6], ["FU", 1, [0, 1, 2, 3]], ["SP", 1, 0, 112, [1], 1], ["AN", 1, 1, 2], ["FFSP", 1, 0, [4, 3, 2, 1], 1, 1], ["AN", 1, 1, 6], ["PR", 4, 0, "auto_unroll_max_step$16"]]]], "r": [[0.438627, 0.438082, 0.435119], 0, 13.5478, 1661980253], "v": "v0.6"}
{"i": [["[\"pointwise_conv2d_bn_short_cut_add\", 7, 7, 1152, 192, 4]", "cuda -keys=cuda,gpu -max_num_threads=1024 -model=unknown -thread_warp_size=32", [-1, 16, 64, 49152, 2147483647, 1024, 8, 32], "", 0, []], [[], [["CI", 4], ["SP", 2, 0, 4, [1, 2, 1, 2], 1], ["SP", 2, 5, 7, [1, 1, 1, 1], 1], ["SP", 2, 10, 7, [1, 7, 1, 1], 1], ["SP", 2, 15, 192, [1, 16, 1, 2], 1], ["SP", 2, 20, 1152, [8, 8], 1], ["RE", 2, [0, 5, 10, 15, 1, 6, 11, 16, 2, 7, 12, 17, 20, 21, 3, 8, 13, 18, 22, 4, 9, 14, 19]], ["FSP", 7, 0, 1, 3], ["FSP", 7, 4, 2, 3], ["FSP", 7, 8, 3, 3], ["FSP", 7, 12, 4, 3], ["RE", 7, [0, 4, 8, 12, 1, 5, 9, 13, 2, 6, 10, 14, 3, 7, 11, 15]], ["CA", 2, 7, 11], ["CHR", 1, "shared", [2]], ["CA", 2, 3, 12], ["CHR", 0, "shared", [3]], ["CA", 1, 4, 12], ["FU", 9, [0, 1, 2, 3]], ["AN", 9, 0, 5], ["FU", 9, [1, 2, 3, 4]], ["AN", 9, 1, 4], ["FU", 9, [2, 3, 4, 5]], ["AN", 9, 2, 6], ["FU", 3, [0, 1]], ["SP", 3, 0, 128, [1], 1], ["AN", 3, 1, 2], ["FFSP", 3, 0, [4, 3, 2, 1], 1, 1], ["AN", 3, 1, 6], ["FU", 1, [0, 1, 2, 3]], ["SP", 1, 0, 128, [1], 1], ["AN", 1, 1, 2], ["FFSP", 1, 0, [4, 3, 2, 1], 1, 1], ["AN", 1, 1, 6], ["PR", 4, 0, "auto_unroll_max_step$1024"]]]], "r": [[0.000126798, 0.000126836, 0.000126821], 0, 15.1421, 1661980257], "v": "v0.6"}
{"i": [["[\"pointwise_conv2d_bn_short_cut_add\", 7, 7, 1152, 192, 4]", "cuda -keys=cuda,gpu -max_num_threads=1024 -model=unknown -thread_warp_size=32", [-1, 16, 64, 49152, 2147483647, 1024, 8, 32], "", 0, []], [[], [["CI", 4], ["SP", 2, 0, 4, [1, 2, 1, 1], 1], ["SP", 2, 5, 7, [1, 1, 7, 1], 1], ["SP", 2, 10, 7, [1, 1, 7, 1], 1], ["SP", 2, 15, 192, [2, 8, 1, 4], 1], ["SP", 2, 20, 1152, [8, 1], 1], ["RE", 2, [0, 5, 10, 15, 1, 6, 11, 16, 2, 7, 12, 17, 20, 21, 3, 8, 13, 18, 22, 4, 9, 14, 19]], ["FSP", 7, 0, 1, 3], ["FSP", 7, 4, 2, 3], ["FSP", 7, 8, 3, 3], ["FSP", 7, 12, 4, 3], ["RE", 7, [0, 4, 8, 12, 1, 5, 9, 13, 2, 6, 10, 14, 3, 7, 11, 15]], ["CA", 2, 7, 11], ["CHR", 1, "shared", [2]], ["CA", 2, 3, 12], ["CHR", 0, "shared", [3]], ["CA", 1, 4, 12], ["FU", 9, [0, 1, 2, 3]], ["AN", 9, 0, 5], ["FU", 9, [1, 2, 3, 4]], ["AN", 9, 1, 4], ["FU", 9, [2, 3, 4, 5]], ["AN", 9, 2, 6], ["FU", 3, [0, 1]], ["SP", 3, 0, 32, [1], 1], ["AN", 3, 1, 2], ["FFSP", 3, 0, [4, 3, 2, 1], 1, 1], ["AN", 3, 1, 6], ["FU", 1, [0, 1, 2, 3]], ["SP", 1, 0, 56, [28], 1], ["AN", 1, 1, 2], ["FFSP", 1, 0, [4, 3, 2, 1], 1, 1], ["AN", 1, 1, 6], ["PR", 4, 0, "auto_unroll_max_step$512"]]]], "r": [[0.0117041, 0.0116859, 0.0117349], 0, 4.37009, 1661980245], "v": "v0.6"}
{"i": [["[\"pointwise_conv2d_bn_short_cut_add\", 7, 7, 1152, 192, 4]", "cuda -keys=cuda,gpu -max_num_threads=1024 -model=unknown -thread_warp_size=32", [-1, 16, 64, 49152, 2147483647, 1024, 8, 32], "", 0, []], [[], [["CI", 4], ["SP", 2, 0, 4, [1, 4, 1, 1], 1], ["SP", 2, 5, 7, [1, 1, 1, 1], 1], ["SP", 2, 10, 7, [1, 7, 1, 1], 1], ["SP", 2, 15, 192, [1, 16, 1, 3], 1], ["SP", 2, 20, 1152, [32, 1], 1], ["RE", 2, [0, 5, 10, 15, 1, 6, 11, 16, 2, 7, 12, 17, 20, 21, 3, 8, 13, 18, 22, 4, 9, 14, 19]], ["FSP", 7, 0, 1, 3], ["FSP", 7, 4, 2, 3], ["FSP", 7, 8, 3, 3], ["FSP", 7, 12, 4, 3], ["RE", 7, [0, 4, 8, 12, 1, 5, 9, 13, 2, 6, 10, 14, 3, 7, 11, 15]], ["CA", 2, 7, 11], ["CHR", 1, "shared", [2]], ["CA", 2, 3, 12], ["CHR", 0, "shared", [3]], ["CA", 1, 4, 12], ["FU", 9, [0, 1, 2, 3]], ["AN", 9, 0, 5], ["FU", 9, [1, 2, 3, 4]], ["AN", 9, 1, 4], ["FU", 9, [2, 3, 4, 5]], ["AN", 9, 2, 6], ["FU", 3, [0, 1]], ["SP", 3, 0, 96, [1], 1], ["AN", 3, 1, 2], ["FFSP", 3, 0, [4, 3, 2, 1], 1, 1], ["AN", 3, 1, 6], ["FU", 1, [0, 1, 2, 3]], ["SP", 1, 0, 32, [16], 1], ["AN", 1, 1, 2], ["FFSP", 1, 0, [4, 3, 2, 1], 1, 1], ["AN", 1, 1, 6], ["PR", 4, 0, "auto_unroll_max_step$64"]]]], "r": [[0.00031918, 0.000319187, 0.000319213], 0, 17.2189, 1661980260], "v": "v0.6"}
{"i": [["[\"pointwise_conv2d_bn_short_cut_add\", 7, 7, 1152, 192, 4]", "cuda -keys=cuda,gpu -max_num_threads=1024 -model=unknown -thread_warp_size=32", [-1, 16, 64, 49152, 2147483647, 1024, 8, 32], "", 0, []], [[], [["CI", 4], ["SP", 2, 0, 4, [1, 1, 2, 1], 1], ["SP", 2, 5, 7, [1, 1, 1, 1], 1], ["SP", 2, 10, 7, [1, 7, 1, 1], 1], ["SP", 2, 15, 192, [2, 32, 1, 1], 1], ["SP", 2, 20, 1152, [8, 1], 1], ["RE", 2, [0, 5, 10, 15, 1, 6, 11, 16, 2, 7, 12, 17, 20, 21, 3, 8, 13, 18, 22, 4, 9, 14, 19]], ["FSP", 7, 0, 1, 3], ["FSP", 7, 4, 2, 3], ["FSP", 7, 8, 3, 3], ["FSP", 7, 12, 4, 3], ["RE", 7, [0, 4, 8, 12, 1, 5, 9, 13, 2, 6, 10, 14, 3, 7, 11, 15]], ["CA", 2, 7, 11], ["CHR", 1, "shared", [2]], ["CA", 2, 3, 12], ["CHR", 0, "shared", [3]], ["CA", 1, 4, 12], ["FU", 9, [0, 1, 2, 3]], ["AN", 9, 0, 5], ["FU", 9, [1, 2, 3, 4]], ["AN", 9, 1, 4], ["FU", 9, [2, 3, 4, 5]], ["AN", 9, 2, 6], ["FU", 3, [0, 1]], ["SP", 3, 0, 8, [2], 1], ["AN", 3, 1, 2], ["FFSP", 3, 0, [4, 3, 2, 1], 1, 1], ["AN", 3, 1, 6], ["FU", 1, [0, 1, 2, 3]], ["SP", 1, 0, 32, [16], 1], ["AN", 1, 1, 2], ["FFSP", 1, 0, [4, 3, 2, 1], 1, 1], ["AN", 1, 1, 6], ["PR", 4, 0, "auto_unroll_max_step$16"]]]], "r": [[0.000213913, 0.000220138, 0.000220139], 0, 18.6894, 1661980262], "v": "v0.6"}
{"i": [["[\"pointwise_conv2d_bn_short_cut_add\", 7, 7, 1152, 192, 4]", "cuda -keys=cuda,gpu -max_num_threads=1024 -model=unknown -thread_warp_size=32", [-1, 16, 64, 49152, 2147483647, 1024, 8, 32], "", 0, []], [[], [["CI", 4], ["SP", 2, 0, 4, [1, 1, 1, 2], 1], ["SP", 2, 5, 7, [1, 1, 1, 7], 1], ["SP", 2, 10, 7, [1, 7, 1, 1], 1], ["SP", 2, 15, 192, [8, 8, 1, 3], 1], ["SP", 2, 20, 1152, [8, 4], 1], ["RE", 2, [0, 5, 10, 15, 1, 6, 11, 16, 2, 7, 12, 17, 20, 21, 3, 8, 13, 18, 22, 4, 9, 14, 19]], ["FSP", 7, 0, 1, 3], ["FSP", 7, 4, 2, 3], ["FSP", 7, 8, 3, 3], ["FSP", 7, 12, 4, 3], ["RE", 7, [0, 4, 8, 12, 1, 5, 9, 13, 2, 6, 10, 14, 3, 7, 11, 15]], ["CA", 2, 7, 11], ["CHR", 1, "shared", [2]], ["CA", 2, 3, 12], ["CHR", 0, "shared", [3]], ["CA", 1, 4, 12], ["FU", 9, [0, 1, 2, 3]], ["AN", 9, 0, 5], ["FU", 9, [1, 2, 3, 4]], ["AN", 9, 1, 4], ["FU", 9, [2, 3, 4, 5]], ["AN", 9, 2, 6], ["FU", 3, [0, 1]], ["SP", 3, 0, 96, [1], 1], ["AN", 3, 1, 2], ["FFSP", 3, 0, [4, 3, 2, 1], 1, 1], ["AN", 3, 1, 6], ["FU", 1, [0, 1, 2, 3]], ["SP", 1, 0, 64, [1], 1], ["AN", 1, 1, 2], ["FFSP", 1, 0, [4, 3, 2, 1], 1, 1], ["AN", 1, 1, 6], ["PR", 4, 0, "auto_unroll_max_step$512"]]]], "r": [[0.00265812, 0.00265845, 0.00265816], 0, 20.0758, 1661980261], "v": "v0.6"}
{"i": [["[\"pointwise_conv2d_bn_short_cut_add\", 7, 7, 1152, 192, 4]", "cuda -keys=cuda,gpu -max_num_threads=1024 -model=unknown -thread_warp_size=32", [-1, 16, 64, 49152, 2147483647, 1024, 8, 32], "", 0, []], [[], [["CI", 4], ["SP", 2, 0, 4, [1, 1, 1, 2], 1], ["SP", 2, 5, 7, [1, 1, 1, 1], 1], ["SP", 2, 10, 7, [1, 1, 7, 1], 1], ["SP", 2, 15, 192, [2, 2, 8, 6], 1], ["SP", 2, 20, 1152, [2, 8], 1], ["RE", 2, [0, 5, 10, 15, 1, 6, 11, 16, 2, 7, 12, 17, 20, 21, 3, 8, 13, 18, 22, 4, 9, 14, 19]], ["FSP", 7, 0, 1, 3], ["FSP", 7, 4, 2, 3], ["FSP", 7, 8, 3, 3], ["FSP", 7, 12, 4, 3], ["RE", 7, [0, 4, 8, 12, 1, 5, 9, 13, 2, 6, 10, 14, 3, 7, 11, 15]], ["CA", 2, 7, 11], ["CHR", 1, "shared", [2]], ["CA", 2, 3, 12], ["CHR", 0, "shared", [3]], ["CA", 1, 4, 12], ["FU", 9, [0, 1, 2, 3]], ["AN", 9, 0, 5], ["FU", 9, [1, 2, 3, 4]], ["AN", 9, 1, 4], ["FU", 9, [2, 3, 4, 5]], ["AN", 9, 2, 6], ["FU", 3, [0, 1]], ["SP", 3, 0, 768, [1], 1], ["AN", 3, 1, 2], ["FFSP", 3, 0, [4, 3, 2, 1], 1, 1], ["AN", 3, 1, 6], ["FU", 1, [0, 1, 2, 3]], ["SP", 1, 0, 32, [1], 1], ["AN", 1, 1, 2], ["FFSP", 1, 0, [4, 3, 2, 1], 1, 1], ["AN", 1, 1, 6], ["PR", 4, 0, "auto_unroll_max_step$64"]]]], "r": [[0.0083517, 0.00833401, 0.00833828], 0, 20.8313, 1661980263], "v": "v0.6"}
{"i": [["[\"pointwise_conv2d_bn_short_cut_add\", 7, 7, 1152, 192, 4]", "cuda -keys=cuda,gpu -max_num_threads=1024 -model=unknown -thread_warp_size=32", [-1, 16, 64, 49152, 2147483647, 1024, 8, 32], "", 0, []], [[], [["CI", 4], ["SP", 2, 0, 4, [1, 1, 1, 2], 1], ["SP", 2, 5, 7, [7, 1, 1, 1], 1], ["SP", 2, 10, 7, [1, 1, 7, 1], 1], ["SP", 2, 15, 192, [2, 2, 8, 6], 1], ["SP", 2, 20, 1152, [2, 8], 1], ["RE", 2, [0, 5, 10, 15, 1, 6, 11, 16, 2, 7, 12, 17, 20, 21, 3, 8, 13, 18, 22, 4, 9, 14, 19]], ["FSP", 7, 0, 1, 3], ["FSP", 7, 4, 2, 3], ["FSP", 7, 8, 3, 3], ["FSP", 7, 12, 4, 3], ["RE", 7, [0, 4, 8, 12, 1, 5, 9, 13, 2, 6, 10, 14, 3, 7, 11, 15]], ["CA", 2, 7, 11], ["CHR", 1, "shared", [2]], ["CA", 2, 3, 12], ["CHR", 0, "shared", [3]], ["CA", 1, 4, 12], ["FU", 9, [0, 1, 2, 3]], ["AN", 9, 0, 5], ["FU", 9, [1, 2, 3, 4]], ["AN", 9, 1, 4], ["FU", 9, [2, 3, 4, 5]], ["AN", 9, 2, 6], ["FU", 3, [0, 1]], ["SP", 3, 0, 768, [1], 1], ["AN", 3, 1, 2], ["FFSP", 3, 0, [4, 3, 2, 1], 1, 1], ["AN", 3, 1, 6], ["FU", 1, [0, 1, 2, 3]], ["SP", 1, 0, 32, [1], 1], ["AN", 1, 1, 2], ["FFSP", 1, 0, [4, 3, 2, 1], 1, 1], ["AN", 1, 1, 6], ["PR", 4, 0, "auto_unroll_max_step$64"]]]], "r": [[0.0267179, 0.0266929, 0.0236617], 0, 23.0655, 1661980265], "v": "v0.6"}
{"i": [["[\"pointwise_conv2d_bn_short_cut_add\", 7, 7, 1152, 192, 4]", "cuda -keys=cuda,gpu -max_num_threads=1024 -model=unknown -thread_warp_size=32", [-1, 16, 64, 49152, 2147483647, 1024, 8, 32], "", 0, []], [[], [["CI", 4], ["SP", 2, 0, 4, [1, 2, 1, 2], 1], ["SP", 2, 5, 7, [1, 7, 1, 1], 1], ["SP", 2, 10, 7, [1, 1, 1, 7], 1], ["SP", 2, 15, 192, [1, 8, 1, 8], 1], ["SP", 2, 20, 1152, [6, 6], 1], ["RE", 2, [0, 5, 10, 15, 1, 6, 11, 16, 2, 7, 12, 17, 20, 21, 3, 8, 13, 18, 22, 4, 9, 14, 19]], ["FSP", 7, 0, 1, 3], ["FSP", 7, 4, 2, 3], ["FSP", 7, 8, 3, 3], ["FSP", 7, 12, 4, 3], ["RE", 7, [0, 4, 8, 12, 1, 5, 9, 13, 2, 6, 10, 14, 3, 7, 11, 15]], ["CA", 2, 7, 11], ["CHR", 1, "shared", [2]], ["CA", 2, 3, 12], ["CHR", 0, "shared", [3]], ["CA", 1, 4, 12], ["FU", 9, [0, 1, 2, 3]], ["AN", 9, 0, 5], ["FU", 9, [1, 2, 3, 4]], ["AN", 9, 1, 4], ["FU", 9, [2, 3, 4, 5]], ["AN", 9, 2, 6], ["FU", 3, [0, 1]], ["SP", 3, 0, 288, [1], 1], ["AN", 3, 1, 2], ["FFSP", 3, 0, [4, 3, 2, 1], 1, 1], ["AN", 3, 1, 6], ["FU", 1, [0, 1, 2, 3]], ["SP", 1, 0, 504, [1], 1], ["AN", 1, 1, 2], ["FFSP", 1, 0, [4, 3, 2, 1], 1, 1], ["AN", 1, 1, 6], ["PR", 4, 0, "auto_unroll_max_step$16"]]]], "r": [[0.00055977, 0.0005599, 0.00056], 0, 20.1385, 1661980263], "v": "v0.6"}
{"i": [["[\"pointwise_conv2d_bn_short_cut_add\", 7, 7, 1152, 192, 4]", "cuda -keys=cuda,gpu -max_num_threads=1024 -model=unknown -thread_warp_size=32", [-1, 16, 64, 49152, 2147483647, 1024, 8, 32], "", 0, []], [[], [["CI", 4], ["SP", 2, 0, 4, [1, 2, 1, 1], 1], ["SP", 2, 5, 7, [1, 1, 1, 7], 1], ["SP", 2, 10, 7, [1, 1, 7, 1], 1], ["SP", 2, 15, 192, [1, 8, 1, 24], 1], ["SP", 2, 20, 1152, [4, 4], 1], ["RE", 2, [0, 5, 10, 15, 1, 6, 11, 16, 2, 7, 12, 17, 20, 21, 3, 8, 13, 18, 22, 4, 9, 14, 19]], ["FSP", 7, 0, 1, 3], ["FSP", 7, 4, 2, 3], ["FSP", 7, 8, 3, 3], ["FSP", 7, 12, 4, 3], ["RE", 7, [0, 4, 8, 12, 1, 5, 9, 13, 2, 6, 10, 14, 3, 7, 11, 15]], ["CA", 2, 7, 11], ["CHR", 1, "shared", [2]], ["CA", 2, 3, 12], ["CHR", 0, "shared", [3]], ["CA", 1, 4, 12], ["FU", 9, [0, 1, 2, 3]], ["AN", 9, 0, 5], ["FU", 9, [1, 2, 3, 4]], ["AN", 9, 1, 4], ["FU", 9, [2, 3, 4, 5]], ["AN", 9, 2, 6], ["FU", 3, [0, 1]], ["SP", 3, 0, 16, [1], 1], ["AN", 3, 1, 2], ["FFSP", 3, 0, [4, 3, 2, 1], 1, 1], ["AN", 3, 1, 6], ["FU", 1, [0, 1, 2, 3]], ["SP", 1, 0, 784, [1], 1], ["AN", 1, 1, 2], ["FFSP", 1, 0, [4, 3, 2, 1], 1, 1], ["AN", 1, 1, 6], ["PR", 4, 0, "auto_unroll_max_step$0"]]]], "r": [[0.00324581, 0.00324584, 0.00324578], 0, 22.6661, 1661980265], "v": "v0.6"}
{"i": [["[\"pointwise_conv2d_bn_short_cut_add\", 7, 7, 1152, 192, 4]", "cuda -keys=cuda,gpu -max_num_threads=1024 -model=unknown -thread_warp_size=32", [-1, 16, 64, 49152, 2147483647, 1024, 8, 32], "", 0, []], [[], [["CI", 4], ["SP", 2, 0, 4, [1, 4, 1, 1], 1], ["SP", 2, 5, 7, [1, 1, 1, 1], 1], ["SP", 2, 10, 7, [1, 1, 1, 1], 1], ["SP", 2, 15, 192, [1, 16, 1, 3], 1], ["SP", 2, 20, 1152, [8, 4], 1], ["RE", 2, [0, 5, 10, 15, 1, 6, 11, 16, 2, 7, 12, 17, 20, 21, 3, 8, 13, 18, 22, 4, 9, 14, 19]], ["FSP", 7, 0, 1, 3], ["FSP", 7, 4, 2, 3], ["FSP", 7, 8, 3, 3], ["FSP", 7, 12, 4, 3], ["RE", 7, [0, 4, 8, 12, 1, 5, 9, 13, 2, 6, 10, 14, 3, 7, 11, 15]], ["CA", 2, 7, 11], ["CHR", 1, "shared", [2]], ["CA", 2, 3, 12], ["CHR", 0, "shared", [3]], ["CA", 1, 4, 12], ["FU", 9, [0, 1, 2, 3]], ["AN", 9, 0, 5], ["FU", 9, [1, 2, 3, 4]], ["AN", 9, 1, 4], ["FU", 9, [2, 3, 4, 5]], ["AN", 9, 2, 6], ["FU", 3, [0, 1]], ["SP", 3, 0, 96, [1], 1], ["AN", 3, 1, 2], ["FFSP", 3, 0, [4, 3, 2, 1], 1, 1], ["AN", 3, 1, 6], ["FU", 1, [0, 1, 2, 3]], ["SP", 1, 0, 32, [1], 1], ["AN", 1, 1, 2], ["FFSP", 1, 0, [4, 3, 2, 1], 1, 1], ["AN", 1, 1, 6], ["PR", 4, 0, "auto_unroll_max_step$64"]]]], "r": [[0.000106493, 0.000106511, 0.000106494], 0, 23.2404, 1661980267], "v": "v0.6"}
{"i": [["[\"pointwise_conv2d_bn_short_cut_add\", 7, 7, 1152, 192, 4]", "cuda -keys=cuda,gpu -max_num_threads=1024 -model=unknown -thread_warp_size=32", [-1, 16, 64, 49152, 2147483647, 1024, 8, 32], "", 0, []], [[], [["CI", 4], ["SP", 2, 0, 4, [1, 1, 2, 1], 1], ["SP", 2, 5, 7, [1, 7, 1, 1], 1], ["SP", 2, 10, 7, [1, 1, 1, 7], 1], ["SP", 2, 15, 192, [1, 8, 2, 3], 1], ["SP", 2, 20, 1152, [2, 2], 1], ["RE", 2, [0, 5, 10, 15, 1, 6, 11, 16, 2, 7, 12, 17, 20, 21, 3, 8, 13, 18, 22, 4, 9, 14, 19]], ["FSP", 7, 0, 1, 3], ["FSP", 7, 4, 2, 3], ["FSP", 7, 8, 3, 3], ["FSP", 7, 12, 4, 3], ["RE", 7, [0, 4, 8, 12, 1, 5, 9, 13, 2, 6, 10, 14, 3, 7, 11, 15]], ["CA", 2, 7, 11], ["CHR", 1, "shared", [2]], ["CA", 2, 3, 12], ["CHR", 0, "shared", [3]], ["CA", 1, 4, 12], ["FU", 9, [0, 1, 2, 3]], ["AN", 9, 0, 5], ["FU", 9, [1, 2, 3, 4]], ["AN", 9, 1, 4], ["FU", 9, [2, 3, 4, 5]], ["AN", 9, 2, 6], ["FU", 3, [0, 1]], ["SP", 3, 0, 24, [3], 1], ["AN", 3, 1, 2], ["FFSP", 3, 0, [4, 3, 2, 1], 1, 1], ["AN", 3, 1, 6], ["FU", 1, [0, 1, 2, 3]], ["SP", 1, 0, 56, [1], 1], ["AN", 1, 1, 2], ["FFSP", 1, 0, [4, 3, 2, 1], 1, 1], ["AN", 1, 1, 6], ["PR", 4, 0, "auto_unroll_max_step$0"]]]], "r": [[0.000282347, 0.000282318, 0.000282371], 0, 24.0208, 1661980268], "v": "v0.6"}
{"i": [["[\"pointwise_conv2d_bn_short_cut_add\", 7, 7, 1152, 192, 4]", "cuda -keys=cuda,gpu -max_num_threads=1024 -model=unknown -thread_warp_size=32", [-1, 16, 64, 49152, 2147483647, 1024, 8, 32], "", 0, []], [[], [["CI", 4], ["SP", 2, 0, 4, [1, 1, 1, 2], 1], ["SP", 2, 5, 7, [1, 7, 1, 1], 1], ["SP", 2, 10, 7, [1, 7, 1, 1], 1], ["SP", 2, 15, 192, [1, 2, 16, 6], 1], ["SP", 2, 20, 1152, [1, 8], 1], ["RE", 2, [0, 5, 10, 15, 1, 6, 11, 16, 2, 7, 12, 17, 20, 21, 3, 8, 13, 18, 22, 4, 9, 14, 19]], ["FSP", 7, 0, 1, 3], ["FSP", 7, 4, 2, 3], ["FSP", 7, 8, 3, 3], ["FSP", 7, 12, 4, 3], ["RE", 7, [0, 4, 8, 12, 1, 5, 9, 13, 2, 6, 10, 14, 3, 7, 11, 15]], ["CA", 2, 7, 11], ["CHR", 1, "shared", [2]], ["CA", 2, 3, 12], ["CHR", 0, "shared", [3]], ["CA", 1, 4, 12], ["FU", 9, [0, 1, 2, 3]], ["AN", 9, 0, 5], ["FU", 9, [1, 2, 3, 4]], ["AN", 9, 1, 4], ["FU", 9, [2, 3, 4, 5]], ["AN", 9, 2, 6], ["FU", 3, [0, 1]], ["SP", 3, 0, 768, [1], 1], ["AN", 3, 1, 2], ["FFSP", 3, 0, [4, 3, 2, 1], 1, 1], ["AN", 3, 1, 6], ["FU", 1, [0, 1, 2, 3]], ["SP", 1, 0, 32, [1], 1], ["AN", 1, 1, 2], ["FFSP", 1, 0, [4, 3, 2, 1], 1, 1], ["AN", 1, 1, 6], ["PR", 4, 0, "auto_unroll_max_step$64"]]]], "r": [[0.00104357, 0.0010434, 0.00104331], 0, 23.394, 1661980266], "v": "v0.6"}
{"i": [["[\"pointwise_conv2d_bn_short_cut_add\", 7, 7, 1152, 192, 4]", "cuda -keys=cuda,gpu -max_num_threads=1024 -model=unknown -thread_warp_size=32", [-1, 16, 64, 49152, 2147483647, 1024, 8, 32], "", 0, []], [[], [["CI", 4], ["SP", 2, 0, 4, [4, 1, 1, 1], 1], ["SP", 2, 5, 7, [1, 1, 1, 1], 1], ["SP", 2, 10, 7, [1, 7, 1, 1], 1], ["SP", 2, 15, 192, [1, 12, 2, 8], 1], ["SP", 2, 20, 1152, [4, 2], 1], ["RE", 2, [0, 5, 10, 15, 1, 6, 11, 16, 2, 7, 12, 17, 20, 21, 3, 8, 13, 18, 22, 4, 9, 14, 19]], ["FSP", 7, 0, 1, 3], ["FSP", 7, 4, 2, 3], ["FSP", 7, 8, 3, 3], ["FSP", 7, 12, 4, 3], ["RE", 7, [0, 4, 8, 12, 1, 5, 9, 13, 2, 6, 10, 14, 3, 7, 11, 15]], ["CA", 2, 7, 11], ["CHR", 1, "shared", [2]], ["CA", 2, 3, 12], ["CHR", 0, "shared", [3]], ["CA", 1, 4, 12], ["FU", 9, [0, 1, 2, 3]], ["AN", 9, 0, 5], ["FU", 9, [1, 2, 3, 4]], ["AN", 9, 1, 4], ["FU", 9, [2, 3, 4, 5]], ["AN", 9, 2, 6], ["FU", 3, [0, 1]], ["SP", 3, 0, 128, [1], 1], ["AN", 3, 1, 2], ["FFSP", 3, 0, [4, 3, 2, 1], 1, 1], ["AN", 3, 1, 6], ["FU", 1, [0, 1, 2, 3]], ["SP", 1, 0, 8, [2], 1], ["AN", 1, 1, 2], ["FFSP", 1, 0, [4, 3, 2, 1], 1, 1], ["AN", 1, 1, 6], ["PR", 4, 0, "auto_unroll_max_step$16"]]]], "r": [[0.000578747, 0.000578762, 0.000578744], 0, 22.5114, 1661980266], "v": "v0.6"}
{"i": [["[\"pointwise_conv2d_bn_short_cut_add\", 7, 7, 1152, 192, 4]", "cuda -keys=cuda,gpu -max_num_threads=1024 -model=unknown -thread_warp_size=32", [-1, 16, 64, 49152, 2147483647, 1024, 8, 32], "", 0, []], [[], [["CI", 4], ["SP", 2, 0, 4, [1, 1, 4, 1], 1], ["SP", 2, 5, 7, [1, 1, 1, 1], 1], ["SP", 2, 10, 7, [1, 1, 1, 7], 1], ["SP", 2, 15, 192, [1, 32, 1, 6], 1], ["SP", 2, 20, 1152, [2, 24], 1], ["RE", 2, [0, 5, 10, 15, 1, 6, 11, 16, 2, 7, 12, 17, 20, 21, 3, 8, 13, 18, 22, 4, 9, 14, 19]], ["FSP", 7, 0, 1, 3], ["FSP", 7, 4, 2, 3], ["FSP", 7, 8, 3, 3], ["FSP", 7, 12, 4, 3], ["RE", 7, [0, 4, 8, 12, 1, 5, 9, 13, 2, 6, 10, 14, 3, 7, 11, 15]], ["CA", 2, 7, 11], ["CHR", 1, "shared", [2]], ["CA", 2, 3, 12], ["CHR", 0, "shared", [3]], ["CA", 1, 4, 12], ["FU", 9, [0, 1, 2, 3]], ["AN", 9, 0, 5], ["FU", 9, [1, 2, 3, 4]], ["AN", 9, 1, 4], ["FU", 9, [2, 3, 4, 5]], ["AN", 9, 2, 6], ["FU", 3, [0, 1]], ["SP", 3, 0, 96, [1], 1], ["AN", 3, 1, 2], ["FFSP", 3, 0, [4, 3, 2, 1], 1, 1], ["AN", 3, 1, 6], ["FU", 1, [0, 1, 2, 3]], ["SP", 1, 0, 1344, [1], 1], ["AN", 1, 1, 2], ["FFSP", 1, 0, [4, 3, 2, 1], 1, 1], ["AN", 1, 1, 6], ["PR", 4, 0, "auto_unroll_max_step$512"]]]], "r": [[0.000985544, 0.000985685, 0.000985568], 0, 27.6155, 1661980270], "v": "v0.6"}
{"i": [["[\"pointwise_conv2d_bn_short_cut_add\", 7, 7, 1152, 192, 4]", "cuda -keys=cuda,gpu -max_num_threads=1024 -model=unknown -thread_warp_size=32", [-1, 16, 64, 49152, 2147483647, 1024, 8, 32], "", 0, []], [[], [["CI", 4], ["SP", 2, 0, 4, [1, 1, 1, 1], 1], ["SP", 2, 5, 7, [1, 7, 1, 1], 1], ["SP", 2, 10, 7, [1, 1, 1, 1], 1], ["SP", 2, 15, 192, [1, 16, 3, 1], 1], ["SP", 2, 20, 1152, [4, 3], 1], ["RE", 2, [0, 5, 10, 15, 1, 6, 11, 16, 2, 7, 12, 17, 20, 21, 3, 8, 13, 18, 22, 4, 9, 14, 19]], ["FSP", 7, 0, 1, 3], ["FSP", 7, 4, 2, 3], ["FSP", 7, 8, 3, 3], ["FSP", 7, 12, 4, 3], ["RE", 7, [0, 4, 8, 12, 1, 5, 9, 13, 2, 6, 10, 14, 3, 7, 11, 15]], ["CA", 2, 7, 11], ["CHR", 1, "shared", [2]], ["CA", 2, 3, 12], ["CHR", 0, "shared", [3]], ["CA", 1, 4, 12], ["FU", 9, [0, 1, 2, 3]], ["AN", 9, 0, 5], ["FU", 9, [1, 2, 3, 4]], ["AN", 9, 1, 4], ["FU", 9, [2, 3, 4, 5]], ["AN", 9, 2, 6], ["FU", 3, [0, 1]], ["SP", 3, 0, 216, [2], 1], ["AN", 3, 1, 2], ["FFSP", 3, 0, [4, 3, 2, 1], 1, 1], ["AN", 3, 1, 6], ["FU", 1, [0, 1, 2, 3]], ["SP", 1, 0, 72, [1], 1], ["AN", 1, 1, 2], ["FFSP", 1, 0, [4, 3, 2, 1], 1, 1], ["AN", 1, 1, 6], ["PR", 4, 0, "auto_unroll_max_step$0"]]]], "r": [[6.08344e-05, 6.08225e-05, 6.0815e-05], 0, 24.0521, 1661980268], "v": "v0.6"}
{"i": [["[\"pointwise_conv2d_bn_short_cut_add\", 7, 7, 1152, 192, 4]", "cuda -keys=cuda,gpu -max_num_threads=1024 -model=unknown -thread_warp_size=32", [-1, 16, 64, 49152, 2147483647, 1024, 8, 32], "", 0, []], [[], [["CI", 4], ["SP", 2, 0, 4, [2, 2, 1, 1], 1], ["SP", 2, 5, 7, [1, 1, 1, 1], 1], ["SP", 2, 10, 7, [1, 1, 1, 1], 1], ["SP", 2, 15, 192, [4, 3, 1, 4], 1], ["SP", 2, 20, 1152, [16, 4], 1], ["RE", 2, [0, 5, 10, 15, 1, 6, 11, 16, 2, 7, 12, 17, 20, 21, 3, 8, 13, 18, 22, 4, 9, 14, 19]], ["FSP", 7, 0, 1, 3], ["FSP", 7, 4, 2, 3], ["FSP", 7, 8, 3, 3], ["FSP", 7, 12, 4, 3], ["RE", 7, [0, 4, 8, 12, 1, 5, 9, 13, 2, 6, 10, 14, 3, 7, 11, 15]], ["CA", 2, 7, 11], ["CHR", 1, "shared", [2]], ["CA", 2, 3, 12], ["CHR", 0, "shared", [3]], ["CA", 1, 4, 12], ["FU", 9, [0, 1, 2, 3]], ["AN", 9, 0, 5], ["FU", 9, [1, 2, 3, 4]], ["AN", 9, 1, 4], ["FU", 9, [2, 3, 4, 5]], ["AN", 9, 2, 6], ["FU", 3, [0, 1]], ["SP", 3, 0, 256, [1], 1], ["AN", 3, 1, 2], ["FFSP", 3, 0, [4, 3, 2, 1], 1, 1], ["AN", 3, 1, 6], ["FU", 1, [0, 1, 2, 3]], ["SP", 1, 0, 128, [1], 1], ["AN", 1, 1, 2], ["FFSP", 1, 0, [4, 3, 2, 1], 1, 1], ["AN", 1, 1, 6], ["PR", 4, 0, "auto_unroll_max_step$512"]]]], "r": [[0.000501107, 0.000501108, 0.000501122], 0, 33.4554, 1661980272], "v": "v0.6"}
{"i": [["[\"pointwise_conv2d_bn_short_cut_add\", 7, 7, 1152, 192, 4]", "cuda -keys=cuda,gpu -max_num_threads=1024 -model=unknown -thread_warp_size=32", [-1, 16, 64, 49152, 2147483647, 1024, 8, 32], "", 0, []], [[], [["CI", 4], ["SP", 2, 0, 4, [1, 2, 2, 1], 1], ["SP", 2, 5, 7, [1, 1, 1, 1], 1], ["SP", 2, 10, 7, [1, 7, 1, 1], 1], ["SP", 2, 15, 192, [1, 2, 32, 3], 1], ["SP", 2, 20, 1152, [9, 1], 1], ["RE", 2, [0, 5, 10, 15, 1, 6, 11, 16, 2, 7, 12, 17, 20, 21, 3, 8, 13, 18, 22, 4, 9, 14, 19]], ["FSP", 7, 0, 1, 3], ["FSP", 7, 4, 2, 3], ["FSP", 7, 8, 3, 3], ["FSP", 7, 12, 4, 3], ["RE", 7, [0, 4, 8, 12, 1, 5, 9, 13, 2, 6, 10, 14, 3, 7, 11, 15]], ["CA", 2, 7, 11], ["CHR", 1, "shared", [2]], ["CA", 2, 3, 12], ["CHR", 0, "shared", [3]], ["CA", 1, 4, 12], ["FU", 9, [0, 1, 2, 3]], ["AN", 9, 0, 5], ["FU", 9, [1, 2, 3, 4]], ["AN", 9, 1, 4], ["FU", 9, [2, 3, 4, 5]], ["AN", 9, 2, 6], ["FU", 3, [0, 1]], ["SP", 3, 0, 432, [1], 1], ["AN", 3, 1, 2], ["FFSP", 3, 0, [4, 3, 2, 1], 1, 1], ["AN", 3, 1, 6], ["FU", 1, [0, 1, 2, 3]], ["SP", 1, 0, 18, [1], 1], ["AN", 1, 1, 2], ["FFSP", 1, 0, [4, 3, 2, 1], 1, 1], ["AN", 1, 1, 6], ["PR", 4, 0, "auto_unroll_max_step$16"]]]], "r": [[0.00137346, 0.00137341, 0.00137344], 0, 27.6084, 1661980271], "v": "v0.6"}
{"i": [["[\"pointwise_conv2d_bn_short_cut_add\", 7, 7, 1152, 192, 4]", "cuda -keys=cuda,gpu -max_num_threads=1024 -model=unknown -thread_warp_size=32", [-1, 16, 64, 49152, 2147483647, 1024, 8, 32], "", 0, []], [[], [["CI", 4], ["SP", 2, 0, 4, [1, 1, 1, 2], 1], ["SP", 2, 5, 7, [1, 7, 1, 1], 1], ["SP", 2, 10, 7, [1, 1, 1, 7], 1], ["SP", 2, 15, 192, [1, 4, 8, 1], 1], ["SP", 2, 20, 1152, [6, 8], 1], ["RE", 2, [0, 5, 10, 15, 1, 6, 11, 16, 2, 7, 12, 17, 20, 21, 3, 8, 13, 18, 22, 4, 9, 14, 19]], ["FSP", 7, 0, 1, 3], ["FSP", 7, 4, 2, 3], ["FSP", 7, 8, 3, 3], ["FSP", 7, 12, 4, 3], ["RE", 7, [0, 4, 8, 12, 1, 5, 9, 13, 2, 6, 10, 14, 3, 7, 11, 15]], ["CA", 2, 7, 11], ["CHR", 1, "shared", [2]], ["CA", 2, 3, 12], ["CHR", 0, "shared", [3]], ["CA", 1, 4, 12], ["FU", 9, [0, 1, 2, 3]], ["AN", 9, 0, 5], ["FU", 9, [1, 2, 3, 4]], ["AN", 9, 1, 4], ["FU", 9, [2, 3, 4, 5]], ["AN", 9, 2, 6], ["FU", 3, [0, 1]], ["SP", 3, 0, 144, [1], 1], ["AN", 3, 1, 2], ["FFSP", 3, 0, [4, 3, 2, 1], 1, 1], ["AN", 3, 1, 6], ["FU", 1, [0, 1, 2, 3]], ["SP", 1, 0, 672, [1], 1], ["AN", 1, 1, 2], ["FFSP", 1, 0, [4, 3, 2, 1], 1, 1], ["AN", 1, 1, 6], ["PR", 4, 0, "auto_unroll_max_step$1024"]]]], "r": [[0.000888076, 0.000887986, 0.000888069], 0, 32.0842, 1661980273], "v": "v0.6"}
{"i": [["[\"pointwise_conv2d_bn_short_cut_add\", 7, 7, 1152, 192, 4]", "cuda -keys=cuda,gpu -max_num_threads=1024 -model=unknown -thread_warp_size=32", [-1, 16, 64, 49152, 2147483647, 1024, 8, 32], "", 0, []], [[], [["CI", 4], ["SP", 2, 0, 4, [1, 2, 1, 1], 1], ["SP", 2, 5, 7, [7, 1, 1, 1], 1], ["SP", 2, 10, 7, [1, 1, 1, 7], 1], ["SP", 2, 15, 192, [1, 8, 4, 3], 1], ["SP", 2, 20, 1152, [3, 3], 1], ["RE", 2, [0, 5, 10, 15, 1, 6, 11, 16, 2, 7, 12, 17, 20, 21, 3, 8, 13, 18, 22, 4, 9, 14, 19]], ["FSP", 7, 0, 1, 3], ["FSP", 7, 4, 2, 3], ["FSP", 7, 8, 3, 3], ["FSP", 7, 12, 4, 3], ["RE", 7, [0, 4, 8, 12, 1, 5, 9, 13, 2, 6, 10, 14, 3, 7, 11, 15]], ["CA", 2, 7, 11], ["CHR", 1, "shared", [2]], ["CA", 2, 3, 12], ["CHR", 0, "shared", [3]], ["CA", 1, 4, 12], ["FU", 9, [0, 1, 2, 3]], ["AN", 9, 0, 5], ["FU", 9, [1, 2, 3, 4]], ["AN", 9, 1, 4], ["FU", 9, [2, 3, 4, 5]], ["AN", 9, 2, 6], ["FU", 3, [0, 1]], ["SP", 3, 0, 108, [1], 1], ["AN", 3, 1, 2], ["FFSP", 3, 0, [4, 3, 2, 1], 1, 1], ["AN", 3, 1, 6], ["FU", 1, [0, 1, 2, 3]], ["SP", 1, 0, 9, [1], 1], ["AN", 1, 1, 2], ["FFSP", 1, 0, [4, 3, 2, 1], 1, 1], ["AN", 1, 1, 6], ["PR", 4, 0, "auto_unroll_max_step$1024"]]]], "r": [[0.00297927, 0.00297819, 0.00297774], 0, 27.2889, 1661980269], "v": "v0.6"}
{"i": [["[\"pointwise_conv2d_bn_short_cut_add\", 7, 7, 1152, 192, 4]", "cuda -keys=cuda,gpu -max_num_threads=1024 -model=unknown -thread_warp_size=32", [-1, 16, 64, 49152, 2147483647, 1024, 8, 32], "", 0, []], [[], [["CI", 4], ["SP", 2, 0, 4, [1, 2, 2, 1], 1], ["SP", 2, 5, 7, [1, 7, 1, 1], 1], ["SP", 2, 10, 7, [1, 1, 1, 1], 1], ["SP", 2, 15, 192, [1, 8, 4, 2], 1], ["SP", 2, 20, 1152, [2, 18], 1], ["RE", 2, [0, 5, 10, 15, 1, 6, 11, 16, 2, 7, 12, 17, 20, 21, 3, 8, 13, 18, 22, 4, 9, 14, 19]], ["FSP", 7, 0, 1, 3], ["FSP", 7, 4, 2, 3], ["FSP", 7, 8, 3, 3], ["FSP", 7, 12, 4, 3], ["RE", 7, [0, 4, 8, 12, 1, 5, 9, 13, 2, 6, 10, 14, 3, 7, 11, 15]], ["CA", 2, 7, 11], ["CHR", 1, "shared", [2]], ["CA", 2, 3, 12], ["CHR", 0, "shared", [3]], ["CA", 1, 4, 12], ["FU", 9, [0, 1, 2, 3]], ["AN", 9, 0, 5], ["FU", 9, [1, 2, 3, 4]], ["AN", 9, 1, 4], ["FU", 9, [2, 3, 4, 5]], ["AN", 9, 2, 6], ["FU", 3, [0, 1]], ["SP", 3, 0, 288, [1], 1], ["AN", 3, 1, 2], ["FFSP", 3, 0, [4, 3, 2, 1], 1, 1], ["AN", 3, 1, 6], ["FU", 1, [0, 1, 2, 3]], ["SP", 1, 0, 504, [56], 1], ["AN", 1, 1, 2], ["FFSP", 1, 0, [4, 3, 2, 1], 1, 1], ["AN", 1, 1, 6], ["PR", 4, 0, "auto_unroll_max_step$0"]]]], "r": [[0.000638873, 0.000638685, 0.000638724], 0, 30.8681, 1661980275], "v": "v0.6"}
{"i": [["[\"pointwise_conv2d_bn_short_cut_add\", 7, 7, 1152, 192, 4]", "cuda -keys=cuda,gpu -max_num_threads=1024 -model=unknown -thread_warp_size=32", [-1, 16, 64, 49152, 2147483647, 1024, 8, 32], "", 0, []], [[], [["CI", 4], ["SP", 2, 0, 4, [1, 1, 1, 2], 1], ["SP", 2, 5, 7, [1, 7, 1, 1], 1], ["SP", 2, 10, 7, [1, 7, 1, 1], 1], ["SP", 2, 15, 192, [2, 2, 8, 6], 1], ["SP", 2, 20, 1152, [1, 8], 1], ["RE", 2, [0, 5, 10, 15, 1, 6, 11, 16, 2, 7, 12, 17, 20, 21, 3, 8, 13, 18, 22, 4, 9, 14, 19]], ["FSP", 7, 0, 1, 3], ["FSP", 7, 4, 2, 3], ["FSP", 7, 8, 3, 3], ["FSP", 7, 12, 4, 3], ["RE", 7, [0, 4, 8, 12, 1, 5, 9, 13, 2, 6, 10, 14, 3, 7, 11, 15]], ["CA", 2, 7, 11], ["CHR", 1, "shared", [2]], ["CA", 2, 3, 12], ["CHR", 0, "shared", [3]], ["CA", 1, 4, 12], ["FU", 9, [0, 1, 2, 3]], ["AN", 9, 0, 5], ["FU", 9, [1, 2, 3, 4]], ["AN", 9, 1, 4], ["FU", 9, [2, 3, 4, 5]], ["AN", 9, 2, 6], ["FU", 3, [0, 1]], ["SP", 3, 0, 768, [1], 1], ["AN", 3, 1, 2], ["FFSP", 3, 0, [4, 3, 2, 1], 1, 1], ["AN", 3, 1, 6], ["FU", 1, [0, 1, 2, 3]], ["SP", 1, 0, 32, [1], 1], ["AN", 1, 1, 2], ["FFSP", 1, 0, [4, 3, 2, 1], 1, 1], ["AN", 1, 1, 6], ["PR", 4, 0, "auto_unroll_max_step$64"]]]], "r": [[0.00104995, 0.00104998, 0.00104995], 0, 30.9277, 1661980274], "v": "v0.6"}
{"i": [["[\"pointwise_conv2d_bn_short_cut_add\", 7, 7, 1152, 192, 4]", "cuda -keys=cuda,gpu -max_num_threads=1024 -model=unknown -thread_warp_size=32", [-1, 16, 64, 49152, 2147483647, 1024, 8, 32], "", 0, []], [[], [["CI", 4], ["SP", 2, 0, 4, [4, 1, 1, 1], 1], ["SP", 2, 5, 7, [1, 1, 1, 1], 1], ["SP", 2, 10, 7, [1, 7, 1, 1], 1], ["SP", 2, 15, 192, [1, 12, 2, 8], 1], ["SP", 2, 20, 1152, [8, 1], 1], ["RE", 2, [0, 5, 10, 15, 1, 6, 11, 16, 2, 7, 12, 17, 20, 21, 3, 8, 13, 18, 22, 4, 9, 14, 19]], ["FSP", 7, 0, 1, 3], ["FSP", 7, 4, 2, 3], ["FSP", 7, 8, 3, 3], ["FSP", 7, 12, 4, 3], ["RE", 7, [0, 4, 8, 12, 1, 5, 9, 13, 2, 6, 10, 14, 3, 7, 11, 15]], ["CA", 2, 7, 11], ["CHR", 1, "shared", [2]], ["CA", 2, 3, 12], ["CHR", 0, "shared", [3]], ["CA", 1, 4, 12], ["FU", 9, [0, 1, 2, 3]], ["AN", 9, 0, 5], ["FU", 9, [1, 2, 3, 4]], ["AN", 9, 1, 4], ["FU", 9, [2, 3, 4, 5]], ["AN", 9, 2, 6], ["FU", 3, [0, 1]], ["SP", 3, 0, 128, [1], 1], ["AN", 3, 1, 2], ["FFSP", 3, 0, [4, 3, 2, 1], 1, 1], ["AN", 3, 1, 6], ["FU", 1, [0, 1, 2, 3]], ["SP", 1, 0, 8, [1], 1], ["AN", 1, 1, 2], ["FFSP", 1, 0, [4, 3, 2, 1], 1, 1], ["AN", 1, 1, 6], ["PR", 4, 0, "auto_unroll_max_step$16"]]]], "r": [[0.000977088, 0.000977194, 0.000977109], 0, 31.4175, 1661980276], "v": "v0.6"}
{"i": [["[\"pointwise_conv2d_bn_short_cut_add\", 7, 7, 1152, 192, 4]", "cuda -keys=cuda,gpu -max_num_threads=1024 -model=unknown -thread_warp_size=32", [-1, 16, 64, 49152, 2147483647, 1024, 8, 32], "", 0, []], [[], [["CI", 4], ["SP", 2, 0, 4, [1, 1, 1, 2], 1], ["SP", 2, 5, 7, [1, 1, 1, 1], 1], ["SP", 2, 10, 7, [1, 7, 1, 1], 1], ["SP", 2, 15, 192, [8, 8, 1, 3], 1], ["SP", 2, 20, 1152, [8, 4], 1], ["RE", 2, [0, 5, 10, 15, 1, 6, 11, 16, 2, 7, 12, 17, 20, 21, 3, 8, 13, 18, 22, 4, 9, 14, 19]], ["FSP", 7, 0, 1, 3], ["FSP", 7, 4, 2, 3], ["FSP", 7, 8, 3, 3], ["FSP", 7, 12, 4, 3], ["RE", 7, [0, 4, 8, 12, 1, 5, 9, 13, 2, 6, 10, 14, 3, 7, 11, 15]], ["CA", 2, 7, 11], ["CHR", 1, "shared", [2]], ["CA", 2, 3, 12], ["CHR", 0, "shared", [3]], ["CA", 1, 4, 12], ["FU", 9, [0, 1, 2, 3]], ["AN", 9, 0, 5], ["FU", 9, [1, 2, 3, 4]], ["AN", 9, 1, 4], ["FU", 9, [2, 3, 4, 5]], ["AN", 9, 2, 6], ["FU", 3, [0, 1]], ["SP", 3, 0, 96, [6], 1], ["AN", 3, 1, 2], ["FFSP", 3, 0, [4, 3, 2, 1], 1, 1], ["AN", 3, 1, 6], ["FU", 1, [0, 1, 2, 3]], ["SP", 1, 0, 64, [1], 1], ["AN", 1, 1, 2], ["FFSP", 1, 0, [4, 3, 2, 1], 1, 1], ["AN", 1, 1, 6], ["PR", 4, 0, "auto_unroll_max_step$64"]]]], "r": [[0.000775934, 0.000775992, 0.000775999], 0, 31.9639, 1661980276], "v": "v0.6"}
{"i": [["[\"pointwise_conv2d_bn_short_cut_add\", 7, 7, 1152, 192, 4]", "cuda -keys=cuda,gpu -max_num_threads=1024 -model=unknown -thread_warp_size=32", [-1, 16, 64, 49152, 2147483647, 1024, 8, 32], "", 0, []], [[], [["CI", 4], ["SP", 2, 0, 4, [1, 2, 2, 1], 1], ["SP", 2, 5, 7, [1, 1, 1, 1], 1], ["SP", 2, 10, 7, [1, 1, 1, 1], 1], ["SP", 2, 15, 192, [6, 16, 1, 1], 1], ["SP", 2, 20, 1152, [2, 24], 1], ["RE", 2, [0, 5, 10, 15, 1, 6, 11, 16, 2, 7, 12, 17, 20, 21, 3, 8, 13, 18, 22, 4, 9, 14, 19]], ["FSP", 7, 0, 1, 3], ["FSP", 7, 4, 2, 3], ["FSP", 7, 8, 3, 3], ["FSP", 7, 12, 4, 3], ["RE", 7, [0, 4, 8, 12, 1, 5, 9, 13, 2, 6, 10, 14, 3, 7, 11, 15]], ["CA", 2, 7, 11], ["CHR", 1, "shared", [2]], ["CA", 2, 3, 12], ["CHR", 0, "shared", [3]], ["CA", 1, 4, 12], ["FU", 9, [0, 1, 2, 3]], ["AN", 9, 0, 5], ["FU", 9, [1, 2, 3, 4]], ["AN", 9, 1, 4], ["FU", 9, [2, 3, 4, 5]], ["AN", 9, 2, 6], ["FU", 3, [0, 1]], ["SP", 3, 0, 8, [1], 1], ["AN", 3, 1, 2], ["FFSP", 3, 0, [4, 3, 2, 1], 1, 1], ["AN", 3, 1, 6], ["FU", 1, [0, 1, 2, 3]], ["SP", 1, 0, 32, [1], 1], ["AN", 1, 1, 2], ["FFSP", 1, 0, [4, 3, 2, 1], 1, 1], ["AN", 1, 1, 6], ["PR", 4, 0, "auto_unroll_max_step$64"]]]], "r": [[0.000246991, 0.000247002, 0.000247003], 0, 33.5179, 1661980278], "v": "v0.6"}
{"i": [["[\"pointwise_conv2d_bn_short_cut_add\", 7, 7, 1152, 192, 4]", "cuda -keys=cuda,gpu -max_num_threads=1024 -model=unknown -thread_warp_size=32", [-1, 16, 64, 49152, 2147483647, 1024, 8, 32], "", 0, []], [[], [["CI", 4], ["SP", 2, 0, 4, [1, 1, 2, 1], 1], ["SP", 2, 5, 7, [1, 1, 1, 1], 1], ["SP", 2, 10, 7, [1, 7, 1, 1], 1], ["SP", 2, 15, 192, [1, 32, 2, 1], 1], ["SP", 2, 20, 1152, [3, 16], 1], ["RE", 2, [0, 5, 10, 15, 1, 6, 11, 16, 2, 7, 12, 17, 20, 21, 3, 8, 13, 18, 22, 4, 9, 14, 19]], ["FSP", 7, 0, 1, 3], ["FSP", 7, 4, 2, 3], ["FSP", 7, 8, 3, 3], ["FSP", 7, 12, 4, 3], ["RE", 7, [0, 4, 8, 12, 1, 5, 9, 13, 2, 6, 10, 14, 3, 7, 11, 15]], ["CA", 2, 7, 11], ["CHR", 1, "shared", [2]], ["CA", 2, 3, 12], ["CHR", 0, "shared", [3]], ["CA", 1, 4, 12], ["FU", 9, [0, 1, 2, 3]], ["AN", 9, 0, 5], ["FU", 9, [1, 2, 3, 4]], ["AN", 9, 1, 4], ["FU", 9, [2, 3, 4, 5]], ["AN", 9, 2, 6], ["FU", 3, [0, 1]], ["SP", 3, 0, 96, [1], 1], ["AN", 3, 1, 2], ["FFSP", 3, 0, [4, 3, 2, 1], 1, 1], ["AN", 3, 1, 6], ["FU", 1, [0, 1, 2, 3]], ["SP", 1, 0, 96, [12], 1], ["AN", 1, 1, 2], ["FFSP", 1, 0, [4, 3, 2, 1], 1, 1], ["AN", 1, 1, 6], ["PR", 4, 0, "auto_unroll_max_step$64"]]]], "r": [[0.000183238, 0.000183297, 0.000183274], 0, 32.5028, 1661980277], "v": "v0.6"}
{"i": [["[\"pointwise_conv2d_bn_short_cut_add\", 7, 7, 1152, 192, 4]", "cuda -keys=cuda,gpu -max_num_threads=1024 -model=unknown -thread_warp_size=32", [-1, 16, 64, 49152, 2147483647, 1024, 8, 32], "", 0, []], [[], [["CI", 4], ["SP", 2, 0, 4, [1, 2, 1, 1], 1], ["SP", 2, 5, 7, [1, 7, 1, 1], 1], ["SP", 2, 10, 7, [1, 1, 1, 7], 1], ["SP", 2, 15, 192, [3, 16, 2, 1], 1], ["SP", 2, 20, 1152, [1, 9], 1], ["RE", 2, [0, 5, 10, 15, 1, 6, 11, 16, 2, 7, 12, 17, 20, 21, 3, 8, 13, 18, 22, 4, 9, 14, 19]], ["FSP", 7, 0, 1, 3], ["FSP", 7, 4, 2, 3], ["FSP", 7, 8, 3, 3], ["FSP", 7, 12, 4, 3], ["RE", 7, [0, 4, 8, 12, 1, 5, 9, 13, 2, 6, 10, 14, 3, 7, 11, 15]], ["CA", 2, 7, 11], ["CHR", 1, "shared", [2]], ["CA", 2, 3, 12], ["CHR", 0, "shared", [3]], ["CA", 1, 4, 12], ["FU", 9, [0, 1, 2, 3]], ["AN", 9, 0, 5], ["FU", 9, [1, 2, 3, 4]], ["AN", 9, 1, 4], ["FU", 9, [2, 3, 4, 5]], ["AN", 9, 2, 6], ["FU", 3, [0, 1]], ["SP", 3, 0, 18, [1], 1], ["AN", 3, 1, 2], ["FFSP", 3, 0, [4, 3, 2, 1], 1, 1], ["AN", 3, 1, 6], ["FU", 1, [0, 1, 2, 3]], ["SP", 1, 0, 126, [1], 1], ["AN", 1, 1, 2], ["FFSP", 1, 0, [4, 3, 2, 1], 1, 1], ["AN", 1, 1, 6], ["PR", 4, 0, "auto_unroll_max_step$16"]]]], "r": [[0.000337155, 0.000337146, 0.000337133], 0, 33.2192, 1661980278], "v": "v0.6"}
{"i": [["[\"pointwise_conv2d_bn_short_cut_add\", 7, 7, 1152, 192, 4]", "cuda -keys=cuda,gpu -max_num_threads=1024 -model=unknown -thread_warp_size=32", [-1, 16, 64, 49152, 2147483647, 1024, 8, 32], "", 0, []], [[], [["CI", 4], ["SP", 2, 0, 4, [2, 2, 1, 1], 1], ["SP", 2, 5, 7, [1, 1, 7, 1], 1], ["SP", 2, 10, 7, [1, 7, 1, 1], 1], ["SP", 2, 15, 192, [2, 4, 6, 2], 1], ["SP", 2, 20, 1152, [6, 3], 1], ["RE", 2, [0, 5, 10, 15, 1, 6, 11, 16, 2, 7, 12, 17, 20, 21, 3, 8, 13, 18, 22, 4, 9, 14, 19]], ["FSP", 7, 0, 1, 3], ["FSP", 7, 4, 2, 3], ["FSP", 7, 8, 3, 3], ["FSP", 7, 12, 4, 3], ["RE", 7, [0, 4, 8, 12, 1, 5, 9, 13, 2, 6, 10, 14, 3, 7, 11, 15]], ["CA", 2, 7, 11], ["CHR", 1, "shared", [2]], ["CA", 2, 3, 12], ["CHR", 0, "shared", [3]], ["CA", 1, 4, 12], ["FU", 9, [0, 1, 2, 3]], ["AN", 9, 0, 5], ["FU", 9, [1, 2, 3, 4]], ["AN", 9, 1, 4], ["FU", 9, [2, 3, 4, 5]], ["AN", 9, 2, 6], ["FU", 3, [0, 1]], ["SP", 3, 0, 216, [1], 1], ["AN", 3, 1, 2], ["FFSP", 3, 0, [4, 3, 2, 1], 1, 1], ["AN", 3, 1, 6], ["FU", 1, [0, 1, 2, 3]], ["SP", 1, 0, 126, [1], 1], ["AN", 1, 1, 2], ["FFSP", 1, 0, [4, 3, 2, 1], 1, 1], ["AN", 1, 1, 6], ["PR", 4, 0, "auto_unroll_max_step$1024"]]]], "r": [[0.00476822, 0.00476783, 0.00476743], 0, 37.1494, 1661980279], "v": "v0.6"}
{"i": [["[\"pointwise_conv2d_bn_short_cut_add\", 7, 7, 1152, 192, 4]", "cuda -keys=cuda,gpu -max_num_threads=1024 -model=unknown -thread_warp_size=32", [-1, 16, 64, 49152, 2147483647, 1024, 8, 32], "", 0, []], [[], [["CI", 4], ["SP", 2, 0, 4, [4, 1, 1, 1], 1], ["SP", 2, 5, 7, [1, 1, 1, 1], 1], ["SP", 2, 10, 7, [1, 1, 1, 1], 1], ["SP", 2, 15, 192, [1, 16, 1, 3], 1], ["SP", 2, 20, 1152, [2, 36], 1], ["RE", 2, [0, 5, 10, 15, 1, 6, 11, 16, 2, 7, 12, 17, 20, 21, 3, 8, 13, 18, 22, 4, 9, 14, 19]], ["FSP", 7, 0, 1, 3], ["FSP", 7, 4, 2, 3], ["FSP", 7, 8, 3, 3], ["FSP", 7, 12, 4, 3], ["RE", 7, [0, 4, 8, 12, 1, 5, 9, 13, 2, 6, 10, 14, 3, 7, 11, 15]], ["CA", 2, 7, 11], ["CHR", 1, "shared", [2]], ["CA", 2, 3, 12], ["CHR", 0, "shared", [3]], ["CA", 1, 4, 12], ["FU", 9, [0, 1, 2, 3]], ["AN", 9, 0, 5], ["FU", 9, [1, 2, 3, 4]], ["AN", 9, 1, 4], ["FU", 9, [2, 3, 4, 5]], ["AN", 9, 2, 6], ["FU", 3, [0, 1]], ["SP", 3, 0, 216, [1], 1], ["AN", 3, 1, 2], ["FFSP", 3, 0, [4, 3, 2, 1], 1, 1], ["AN", 3, 1, 6], ["FU", 1, [0, 1, 2, 3]], ["SP", 1, 0, 72, [1], 1], ["AN", 1, 1, 2], ["FFSP", 1, 0, [4, 3, 2, 1], 1, 1], ["AN", 1, 1, 6], ["PR", 4, 0, "auto_unroll_max_step$0"]]]], "r": [[0.000157268, 0.000157278, 0.000157288], 0, 35.1748, 1661980280], "v": "v0.6"}
{"i": [["[\"pointwise_conv2d_bn_short_cut_add\", 7, 7, 1152, 192, 4]", "cuda -keys=cuda,gpu -max_num_threads=1024 -model=unknown -thread_warp_size=32", [-1, 16, 64, 49152, 2147483647, 1024, 8, 32], "", 0, []], [[], [["CI", 4], ["SP", 2, 0, 4, [1, 2, 1, 2], 1], ["SP", 2, 5, 7, [1, 7, 1, 1], 1], ["SP", 2, 10, 7, [1, 1, 1, 7], 1], ["SP", 2, 15, 192, [1, 4, 1, 16], 1], ["SP", 2, 20, 1152, [6, 6], 1], ["RE", 2, [0, 5, 10, 15, 1, 6, 11, 16, 2, 7, 12, 17, 20, 21, 3, 8, 13, 18, 22, 4, 9, 14, 19]], ["FSP", 7, 0, 1, 3], ["FSP", 7, 4, 2, 3], ["FSP", 7, 8, 3, 3], ["FSP", 7, 12, 4, 3], ["RE", 7, [0, 4, 8, 12, 1, 5, 9, 13, 2, 6, 10, 14, 3, 7, 11, 15]], ["CA", 2, 7, 11], ["CHR", 1, "shared", [2]], ["CA", 2, 3, 12], ["CHR", 0, "shared", [3]], ["CA", 1, 4, 12], ["FU", 9, [0, 1, 2, 3]], ["AN", 9, 0, 5], ["FU", 9, [1, 2, 3, 4]], ["AN", 9, 1, 4], ["FU", 9, [2, 3, 4, 5]], ["AN", 9, 2, 6], ["FU", 3, [0, 1]], ["SP", 3, 0, 288, [1], 1], ["AN", 3, 1, 2], ["FFSP", 3, 0, [4, 3, 2, 1], 1, 1], ["AN", 3, 1, 6], ["FU", 1, [0, 1, 2, 3]], ["SP", 1, 0, 504, [1], 1], ["AN", 1, 1, 2], ["FFSP", 1, 0, [4, 3, 2, 1], 1, 1], ["AN", 1, 1, 6], ["PR", 4, 0, "auto_unroll_max_step$16"]]]], "r": [[0.00126351, 0.00126376, 0.00126362], 0, 37.1016, 1661980281], "v": "v0.6"}
{"i": [["[\"pointwise_conv2d_bn_short_cut_add\", 7, 7, 1152, 192, 4]", "cuda -keys=cuda,gpu -max_num_threads=1024 -model=unknown -thread_warp_size=32", [-1, 16, 64, 49152, 2147483647, 1024, 8, 32], "", 0, []], [[], [["CI", 4], ["SP", 2, 0, 4, [1, 1, 2, 2], 1], ["SP", 2, 5, 7, [1, 1, 7, 1], 1], ["SP", 2, 10, 7, [1, 1, 1, 1], 1], ["SP", 2, 15, 192, [2, 12, 1, 1], 1], ["SP", 2, 20, 1152, [8, 9], 1], ["RE", 2, [0, 5, 10, 15, 1, 6, 11, 16, 2, 7, 12, 17, 20, 21, 3, 8, 13, 18, 22, 4, 9, 14, 19]], ["FSP", 7, 0, 1, 3], ["FSP", 7, 4, 2, 3], ["FSP", 7, 8, 3, 3], ["FSP", 7, 12, 4, 3], ["RE", 7, [0, 4, 8, 12, 1, 5, 9, 13, 2, 6, 10, 14, 3, 7, 11, 15]], ["CA", 2, 7, 11], ["CHR", 1, "shared", [2]], ["CA", 2, 3, 12], ["CHR", 0, "shared", [3]], ["CA", 1, 4, 12], ["FU", 9, [0, 1, 2, 3]], ["AN", 9, 0, 5], ["FU", 9, [1, 2, 3, 4]], ["AN", 9, 1, 4], ["FU", 9, [2, 3, 4, 5]], ["AN", 9, 2, 6], ["FU", 3, [0, 1]], ["SP", 3, 0, 72, [1], 1], ["AN", 3, 1, 2], ["FFSP", 3, 0, [4, 3, 2, 1], 1, 1], ["AN", 3, 1, 6], ["FU", 1, [0, 1, 2, 3]], ["SP", 1, 0, 288, [1], 1], ["AN", 1, 1, 2], ["FFSP", 1, 0, [4, 3, 2, 1], 1, 1], ["AN", 1, 1, 6], ["PR", 4, 0, "auto_unroll_max_step$16"]]]], "r": [[0.000293584, 0.000293591, 0.000293596], 0, 37.2546, 1661980282], "v": "v0.6"}
{"i": [["[\"pointwise_conv2d_bn_short_cut_add\", 7, 7, 1152, 192, 4]", "cuda -keys=cuda,gpu -max_num_threads=1024 -model=unknown -thread_warp_size=32", [-1, 16, 64, 49152, 2147483647, 1024, 8, 32], "", 0, []], [[], [["CI", 4], ["SP", 2, 0, 4, [4, 1, 1, 1], 1], ["SP", 2, 5, 7, [1, 1, 1, 1], 1], ["SP", 2, 10, 7, [1, 7, 1, 1], 1], ["SP", 2, 15, 192, [2, 12, 1, 4], 1], ["SP", 2, 20, 1152, [16, 1], 1], ["RE", 2, [0, 5, 10, 15, 1, 6, 11, 16, 2, 7, 12, 17, 20, 21, 3, 8, 13, 18, 22, 4, 9, 14, 19]], ["FSP", 7, 0, 1, 3], ["FSP", 7, 4, 2, 3], ["FSP", 7, 8, 3, 3], ["FSP", 7, 12, 4, 3], ["RE", 7, [0, 4, 8, 12, 1, 5, 9, 13, 2, 6, 10, 14, 3, 7, 11, 15]], ["CA", 2, 7, 11], ["CHR", 1, "shared", [2]], ["CA", 2, 3, 12], ["CHR", 0, "shared", [3]], ["CA", 1, 4, 12], ["FU", 9, [0, 1, 2, 3]], ["AN", 9, 0, 5], ["FU", 9, [1, 2, 3, 4]], ["AN", 9, 1, 4], ["FU", 9, [2, 3, 4, 5]], ["AN", 9, 2, 6], ["FU", 3, [0, 1]], ["SP", 3, 0, 32, [1], 1], ["AN", 3, 1, 2], ["FFSP", 3, 0, [4, 3, 2, 1], 1, 1], ["AN", 3, 1, 6], ["FU", 1, [0, 1, 2, 3]], ["SP", 1, 0, 16, [1], 1], ["AN", 1, 1, 2], ["FFSP", 1, 0, [4, 3, 2, 1], 1, 1], ["AN", 1, 1, 6], ["PR", 4, 0, "auto_unroll_max_step$512"]]]], "r": [[0.000225831, 0.000238183, 0.000238197], 0, 27.8134, 1661980271], "v": "v0.6"}
{"i": [["[\"pointwise_conv2d_bn_short_cut_add\", 7, 7, 1152, 192, 4]", "cuda -keys=cuda,gpu -max_num_threads=1024 -model=unknown -thread_warp_size=32", [-1, 16, 64, 49152, 2147483647, 1024, 8, 32], "", 0, []], [[], [["CI", 4], ["SP", 2, 0, 4, [1, 1, 4, 1], 1], ["SP", 2, 5, 7, [1, 1, 1, 1], 1], ["SP", 2, 10, 7, [1, 1, 7, 1], 1], ["SP", 2, 15, 192, [12, 8, 1, 2], 1], ["SP", 2, 20, 1152, [16, 3], 1], ["RE", 2, [0, 5, 10, 15, 1, 6, 11, 16, 2, 7, 12, 17, 20, 21, 3, 8, 13, 18, 22, 4, 9, 14, 19]], ["FSP", 7, 0, 1, 3], ["FSP", 7, 4, 2, 3], ["FSP", 7, 8, 3, 3], ["FSP", 7, 12, 4, 3], ["RE", 7, [0, 4, 8, 12, 1, 5, 9, 13, 2, 6, 10, 14, 3, 7, 11, 15]], ["CA", 2, 7, 11], ["CHR", 1, "shared", [2]], ["CA", 2, 3, 12], ["CHR", 0, "shared", [3]], ["CA", 1, 4, 12], ["FU", 9, [0, 1, 2, 3]], ["AN", 9, 0, 5], ["FU", 9, [1, 2, 3, 4]], ["AN", 9, 1, 4], ["FU", 9, [2, 3, 4, 5]], ["AN", 9, 2, 6], ["FU", 3, [0, 1]], ["SP", 3, 0, 96, [1], 1], ["AN", 3, 1, 2], ["FFSP", 3, 0, [4, 3, 2, 1], 1, 1], ["AN", 3, 1, 6], ["FU", 1, [0, 1, 2, 3]], ["SP", 1, 0, 1344, [1], 1], ["AN", 1, 1, 2], ["FFSP", 1, 0, [4, 3, 2, 1], 1, 1], ["AN", 1, 1, 6], ["PR", 4, 0, "auto_unroll_max_step$512"]]]], "r": [[0.00433496, 0.00433485, 0.00433298], 0, 40.471, 1661980283], "v": "v0.6"}
{"i": [["[\"pointwise_conv2d_bn_short_cut_add\", 7, 7, 1152, 192, 4]", "cuda -keys=cuda,gpu -max_num_threads=1024 -model=unknown -thread_warp_size=32", [-1, 16, 64, 49152, 2147483647, 1024, 8, 32], "", 0, []], [[], [["CI", 4], ["SP", 2, 0, 4, [1, 2, 2, 1], 1], ["SP", 2, 5, 7, [1, 1, 1, 1], 1], ["SP", 2, 10, 7, [1, 1, 7, 1], 1], ["SP", 2, 15, 192, [1, 8, 4, 2], 1], ["SP", 2, 20, 1152, [2, 18], 1], ["RE", 2, [0, 5, 10, 15, 1, 6, 11, 16, 2, 7, 12, 17, 20, 21, 3, 8, 13, 18, 22, 4, 9, 14, 19]], ["FSP", 7, 0, 1, 3], ["FSP", 7, 4, 2, 3], ["FSP", 7, 8, 3, 3], ["FSP", 7, 12, 4, 3], ["RE", 7, [0, 4, 8, 12, 1, 5, 9, 13, 2, 6, 10, 14, 3, 7, 11, 15]], ["CA", 2, 7, 11], ["CHR", 1, "shared", [2]], ["CA", 2, 3, 12], ["CHR", 0, "shared", [3]], ["CA", 1, 4, 12], ["FU", 9, [0, 1, 2, 3]], ["AN", 9, 0, 5], ["FU", 9, [1, 2, 3, 4]], ["AN", 9, 1, 4], ["FU", 9, [2, 3, 4, 5]], ["AN", 9, 2, 6], ["FU", 3, [0, 1]], ["SP", 3, 0, 288, [1], 1], ["AN", 3, 1, 2], ["FFSP", 3, 0, [4, 3, 2, 1], 1, 1], ["AN", 3, 1, 6], ["FU", 1, [0, 1, 2, 3]], ["SP", 1, 0, 504, [1], 1], ["AN", 1, 1, 2], ["FFSP", 1, 0, [4, 3, 2, 1], 1, 1], ["AN", 1, 1, 6], ["PR", 4, 0, "auto_unroll_max_step$0"]]]], "r": [[0.000556569, 0.000556554, 0.000556617], 0, 38.29, 1661980283], "v": "v0.6"}
{"i": [["[\"pointwise_conv2d_bn_short_cut_add\", 7, 7, 1152, 192, 4]", "cuda -keys=cuda,gpu -max_num_threads=1024 -model=unknown -thread_warp_size=32", [-1, 16, 64, 49152, 2147483647, 1024, 8, 32], "", 0, []], [[], [["CI", 4], ["SP", 2, 0, 4, [1, 1, 2, 2], 1], ["SP", 2, 5, 7, [1, 7, 1, 1], 1], ["SP", 2, 10, 7, [1, 1, 7, 1], 1], ["SP", 2, 15, 192, [2, 16, 6, 1], 1], ["SP", 2, 20, 1152, [6, 2], 1], ["RE", 2, [0, 5, 10, 15, 1, 6, 11, 16, 2, 7, 12, 17, 20, 21, 3, 8, 13, 18, 22, 4, 9, 14, 19]], ["FSP", 7, 0, 1, 3], ["FSP", 7, 4, 2, 3], ["FSP", 7, 8, 3, 3], ["FSP", 7, 12, 4, 3], ["RE", 7, [0, 4, 8, 12, 1, 5, 9, 13, 2, 6, 10, 14, 3, 7, 11, 15]], ["CA", 2, 7, 11], ["CHR", 1, "shared", [2]], ["CA", 2, 3, 12], ["CHR", 0, "shared", [3]], ["CA", 1, 4, 12], ["FU", 9, [0, 1, 2, 3]], ["AN", 9, 0, 5], ["FU", 9, [1, 2, 3, 4]], ["AN", 9, 1, 4], ["FU", 9, [2, 3, 4, 5]], ["AN", 9, 2, 6], ["FU", 3, [0, 1]], ["SP", 3, 0, 72, [12], 1], ["AN", 3, 1, 2], ["FFSP", 3, 0, [4, 3, 2, 1], 1, 1], ["AN", 3, 1, 6], ["FU", 1, [0, 1, 2, 3]], ["SP", 1, 0, 336, [1], 1], ["AN", 1, 1, 2], ["FFSP", 1, 0, [4, 3, 2, 1], 1, 1], ["AN", 1, 1, 6], ["PR", 4, 0, "auto_unroll_max_step$1024"]]]], "r": [[0.00191382, 0.00191323, 0.00191134], 0, 39.2591, 1661980284], "v": "v0.6"}
{"i": [["[\"pointwise_conv2d_bn_short_cut_add\", 7, 7, 1152, 192, 4]", "cuda -keys=cuda,gpu -max_num_threads=1024 -model=unknown -thread_warp_size=32", [-1, 16, 64, 49152, 2147483647, 1024, 8, 32], "", 0, []], [[], [["CI", 4], ["SP", 2, 0, 4, [1, 2, 1, 2], 1], ["SP", 2, 5, 7, [1, 1, 1, 1], 1], ["SP", 2, 10, 7, [7, 1, 1, 1], 1], ["SP", 2, 15, 192, [1, 2, 1, 48], 1], ["SP", 2, 20, 1152, [1, 48], 1], ["RE", 2, [0, 5, 10, 15, 1, 6, 11, 16, 2, 7, 12, 17, 20, 21, 3, 8, 13, 18, 22, 4, 9, 14, 19]], ["FSP", 7, 0, 1, 3], ["FSP", 7, 4, 2, 3], ["FSP", 7, 8, 3, 3], ["FSP", 7, 12, 4, 3], ["RE", 7, [0, 4, 8, 12, 1, 5, 9, 13, 2, 6, 10, 14, 3, 7, 11, 15]], ["CA", 2, 7, 11], ["CHR", 1, "shared", [2]], ["CA", 2, 3, 12], ["CHR", 0, "shared", [3]], ["CA", 1, 4, 12], ["FU", 9, [0, 1, 2, 3]], ["AN", 9, 0, 5], ["FU", 9, [1, 2, 3, 4]], ["AN", 9, 1, 4], ["FU", 9, [2, 3, 4, 5]], ["AN", 9, 2, 6], ["FU", 3, [0, 1]], ["SP", 3, 0, 144, [1], 1], ["AN", 3, 1, 2], ["FFSP", 3, 0, [4, 3, 2, 1], 1, 1], ["AN", 3, 1, 6], ["FU", 1, [0, 1, 2, 3]], ["SP", 1, 0, 672, [4], 1], ["AN", 1, 1, 2], ["FFSP", 1, 0, [4, 3, 2, 1], 1, 1], ["AN", 1, 1, 6], ["PR", 4, 0, "auto_unroll_max_step$64"]]]], "r": [[0.00620412, 0.00620394, 0.00620408], 0, 34.0456, 1661980285], "v": "v0.6"}
{"i": [["[\"pointwise_conv2d_bn_short_cut_add\", 7, 7, 1152, 192, 4]", "cuda -keys=cuda,gpu -max_num_threads=1024 -model=unknown -thread_warp_size=32", [-1, 16, 64, 49152, 2147483647, 1024, 8, 32], "", 0, []], [[], [["CI", 4], ["SP", 2, 0, 4, [2, 1, 1, 1], 1], ["SP", 2, 5, 7, [1, 1, 1, 7], 1], ["SP", 2, 10, 7, [1, 7, 1, 1], 1], ["SP", 2, 15, 192, [1, 24, 1, 8], 1], ["SP", 2, 20, 1152, [1, 16], 1], ["RE", 2, [0, 5, 10, 15, 1, 6, 11, 16, 2, 7, 12, 17, 20, 21, 3, 8, 13, 18, 22, 4, 9, 14, 19]], ["FSP", 7, 0, 1, 3], ["FSP", 7, 4, 2, 3], ["FSP", 7, 8, 3, 3], ["FSP", 7, 12, 4, 3], ["RE", 7, [0, 4, 8, 12, 1, 5, 9, 13, 2, 6, 10, 14, 3, 7, 11, 15]], ["CA", 2, 7, 11], ["CHR", 1, "shared", [2]], ["CA", 2, 3, 12], ["CHR", 0, "shared", [3]], ["CA", 1, 4, 12], ["FU", 9, [0, 1, 2, 3]], ["AN", 9, 0, 5], ["FU", 9, [1, 2, 3, 4]], ["AN", 9, 1, 4], ["FU", 9, [2, 3, 4, 5]], ["AN", 9, 2, 6], ["FU", 3, [0, 1]], ["SP", 3, 0, 256, [1], 1], ["AN", 3, 1, 2], ["FFSP", 3, 0, [4, 3, 2, 1], 1, 1], ["AN", 3, 1, 6], ["FU", 1, [0, 1, 2, 3]], ["SP", 1, 0, 224, [1], 1], ["AN", 1, 1, 2], ["FFSP", 1, 0, [4, 3, 2, 1], 1, 1], ["AN", 1, 1, 6], ["PR", 4, 0, "auto_unroll_max_step$512"]]]], "r": [[0.00120271, 0.00120339, 0.00120323], 0, 32.1699, 1661980286], "v": "v0.6"}
{"i": [["[\"pointwise_conv2d_bn_short_cut_add\", 7, 7, 1152, 192, 4]", "cuda -keys=cuda,gpu -max_num_threads=1024 -model=unknown -thread_warp_size=32", [-1, 16, 64, 49152, 2147483647, 1024, 8, 32], "", 0, []], [[], [["CI", 4], ["SP", 2, 0, 4, [4, 1, 1, 1], 1], ["SP", 2, 5, 7, [1, 7, 1, 1], 1], ["SP", 2, 10, 7, [1, 1, 1, 1], 1], ["SP", 2, 15, 192, [1, 2, 1, 24], 1], ["SP", 2, 20, 1152, [24, 3], 1], ["RE", 2, [0, 5, 10, 15, 1, 6, 11, 16, 2, 7, 12, 17, 20, 21, 3, 8, 13, 18, 22, 4, 9, 14, 19]], ["FSP", 7, 0, 1, 3], ["FSP", 7, 4, 2, 3], ["FSP", 7, 8, 3, 3], ["FSP", 7, 12, 4, 3], ["RE", 7, [0, 4, 8, 12, 1, 5, 9, 13, 2, 6, 10, 14, 3, 7, 11, 15]], ["CA", 2, 7, 11], ["CHR", 1, "shared", [2]], ["CA", 2, 3, 12], ["CHR", 0, "shared", [3]], ["CA", 1, 4, 12], ["FU", 9, [0, 1, 2, 3]], ["AN", 9, 0, 5], ["FU", 9, [1, 2, 3, 4]], ["AN", 9, 1, 4], ["FU", 9, [2, 3, 4, 5]], ["AN", 9, 2, 6], ["FU", 3, [0, 1]], ["SP", 3, 0, 216, [24], 1], ["AN", 3, 1, 2], ["FFSP", 3, 0, [4, 3, 2, 1], 1, 1], ["AN", 3, 1, 6], ["FU", 1, [0, 1, 2, 3]], ["SP", 1, 0, 72, [1], 1], ["AN", 1, 1, 2], ["FFSP", 1, 0, [4, 3, 2, 1], 1, 1], ["AN", 1, 1, 6], ["PR", 4, 0, "auto_unroll_max_step$0"]]]], "r": [[0.000645068, 0.000649402, 0.000649386], 0, 31.5601, 1661980286], "v": "v0.6"}
{"i": [["[\"pointwise_conv2d_bn_short_cut_add\", 7, 7, 1152, 192, 4]", "cuda -keys=cuda,gpu -max_num_threads=1024 -model=unknown -thread_warp_size=32", [-1, 16, 64, 49152, 2147483647, 1024, 8, 32], "", 0, []], [[], [["CI", 4], ["SP", 2, 0, 4, [4, 1, 1, 1], 1], ["SP", 2, 5, 7, [1, 1, 1, 1], 1], ["SP", 2, 10, 7, [1, 1, 1, 7], 1], ["SP", 2, 15, 192, [1, 12, 2, 8], 1], ["SP", 2, 20, 1152, [4, 2], 1], ["RE", 2, [0, 5, 10, 15, 1, 6, 11, 16, 2, 7, 12, 17, 20, 21, 3, 8, 13, 18, 22, 4, 9, 14, 19]], ["FSP", 7, 0, 1, 3], ["FSP", 7, 4, 2, 3], ["FSP", 7, 8, 3, 3], ["FSP", 7, 12, 4, 3], ["RE", 7, [0, 4, 8, 12, 1, 5, 9, 13, 2, 6, 10, 14, 3, 7, 11, 15]], ["CA", 2, 7, 11], ["CHR", 1, "shared", [2]], ["CA", 2, 3, 12], ["CHR", 0, "shared", [3]], ["CA", 1, 4, 12], ["FU", 9, [0, 1, 2, 3]], ["AN", 9, 0, 5], ["FU", 9, [1, 2, 3, 4]], ["AN", 9, 1, 4], ["FU", 9, [2, 3, 4, 5]], ["AN", 9, 2, 6], ["FU", 3, [0, 1]], ["SP", 3, 0, 128, [1], 1], ["AN", 3, 1, 2], ["FFSP", 3, 0, [4, 3, 2, 1], 1, 1], ["AN", 3, 1, 6], ["FU", 1, [0, 1, 2, 3]], ["SP", 1, 0, 8, [1], 1], ["AN", 1, 1, 2], ["FFSP", 1, 0, [4, 3, 2, 1], 1, 1], ["AN", 1, 1, 6], ["PR", 4, 0, "auto_unroll_max_step$16"]]]], "r": [[0.00226292, 0.00226185, 0.00226133], 0, 32.4011, 1661980287], "v": "v0.6"}
{"i": [["[\"pointwise_conv2d_bn_short_cut_add\", 7, 7, 1152, 192, 4]", "cuda -keys=cuda,gpu -max_num_threads=1024 -model=unknown -thread_warp_size=32", [-1, 16, 64, 49152, 2147483647, 1024, 8, 32], "", 0, []], [[], [["CI", 4], ["SP", 2, 0, 4, [1, 2, 1, 2], 1], ["SP", 2, 5, 7, [1, 1, 7, 1], 1], ["SP", 2, 10, 7, [1, 1, 1, 1], 1], ["SP", 2, 15, 192, [1, 24, 8, 1], 1], ["SP", 2, 20, 1152, [3, 8], 1], ["RE", 2, [0, 5, 10, 15, 1, 6, 11, 16, 2, 7, 12, 17, 20, 21, 3, 8, 13, 18, 22, 4, 9, 14, 19]], ["FSP", 7, 0, 1, 3], ["FSP", 7, 4, 2, 3], ["FSP", 7, 8, 3, 3], ["FSP", 7, 12, 4, 3], ["RE", 7, [0, 4, 8, 12, 1, 5, 9, 13, 2, 6, 10, 14, 3, 7, 11, 15]], ["CA", 2, 7, 11], ["CHR", 1, "shared", [2]], ["CA", 2, 3, 12], ["CHR", 0, "shared", [3]], ["CA", 1, 4, 12], ["FU", 9, [0, 1, 2, 3]], ["AN", 9, 0, 5], ["FU", 9, [1, 2, 3, 4]], ["AN", 9, 1, 4], ["FU", 9, [2, 3, 4, 5]], ["AN", 9, 2, 6], ["FU", 3, [0, 1]], ["SP", 3, 0, 192, [1], 1], ["AN", 3, 1, 2], ["FFSP", 3, 0, [4, 3, 2, 1], 1, 1], ["AN", 3, 1, 6], ["FU", 1, [0, 1, 2, 3]], ["SP", 1, 0, 336, [1], 1], ["AN", 1, 1, 2], ["FFSP", 1, 0, [4, 3, 2, 1], 1, 1], ["AN", 1, 1, 6], ["PR", 4, 0, "auto_unroll_max_step$512"]]]], "r": [[0.000538064, 0.000538111, 0.000538117], 0, 32.1037, 1661980288], "v": "v0.6"}
{"i": [["[\"pointwise_conv2d_bn_short_cut_add\", 7, 7, 1152, 192, 4]", "cuda -keys=cuda,gpu -max_num_threads=1024 -model=unknown -thread_warp_size=32", [-1, 16, 64, 49152, 2147483647, 1024, 8, 32], "", 0, []], [[], [["CI", 4], ["SP", 2, 0, 4, [1, 1, 1, 2], 1], ["SP", 2, 5, 7, [7, 1, 1, 1], 1], ["SP", 2, 10, 7, [1, 7, 1, 1], 1], ["SP", 2, 15, 192, [1, 8, 1, 2], 1], ["SP", 2, 20, 1152, [6, 16], 1], ["RE", 2, [0, 5, 10, 15, 1, 6, 11, 16, 2, 7, 12, 17, 20, 21, 3, 8, 13, 18, 22, 4, 9, 14, 19]], ["FSP", 7, 0, 1, 3], ["FSP", 7, 4, 2, 3], ["FSP", 7, 8, 3, 3], ["FSP", 7, 12, 4, 3], ["RE", 7, [0, 4, 8, 12, 1, 5, 9, 13, 2, 6, 10, 14, 3, 7, 11, 15]], ["CA", 2, 7, 11], ["CHR", 1, "shared", [2]], ["CA", 2, 3, 12], ["CHR", 0, "shared", [3]], ["CA", 1, 4, 12], ["FU", 9, [0, 1, 2, 3]], ["AN", 9, 0, 5], ["FU", 9, [1, 2, 3, 4]], ["AN", 9, 1, 4], ["FU", 9, [2, 3, 4, 5]], ["AN", 9, 2, 6], ["FU", 3, [0, 1]], ["SP", 3, 0, 192, [1], 1], ["AN", 3, 1, 2], ["FFSP", 3, 0, [4, 3, 2, 1], 1, 1], ["AN", 3, 1, 6], ["FU", 1, [0, 1, 2, 3]], ["SP", 1, 0, 192, [1], 1], ["AN", 1, 1, 2], ["FFSP", 1, 0, [4, 3, 2, 1], 1, 1], ["AN", 1, 1, 6], ["PR", 4, 0, "auto_unroll_max_step$512"]]]], "r": [[0.000103874, 0.000103908, 0.000103912], 0, 32.2128, 1661980288], "v": "v0.6"}
{"i": [["[\"pointwise_conv2d_bn_short_cut_add\", 7, 7, 1152, 192, 4]", "cuda -keys=cuda,gpu -max_num_threads=1024 -model=unknown -thread_warp_size=32", [-1, 16, 64, 49152, 2147483647, 1024, 8, 32], "", 0, []], [[], [["CI", 4], ["SP", 2, 0, 4, [1, 1, 1, 2], 1], ["SP", 2, 5, 7, [1, 1, 1, 7], 1], ["SP", 2, 10, 7, [1, 7, 1, 1], 1], ["SP", 2, 15, 192, [8, 8, 1, 3], 1], ["SP", 2, 20, 1152, [8, 4], 1], ["RE", 2, [0, 5, 10, 15, 1, 6, 11, 16, 2, 7, 12, 17, 20, 21, 3, 8, 13, 18, 22, 4, 9, 14, 19]], ["FSP", 7, 0, 1, 3], ["FSP", 7, 4, 2, 3], ["FSP", 7, 8, 3, 3], ["FSP", 7, 12, 4, 3], ["RE", 7, [0, 4, 8, 12, 1, 5, 9, 13, 2, 6, 10, 14, 3, 7, 11, 15]], ["CA", 2, 7, 11], ["CHR", 1, "shared", [2]], ["CA", 2, 3, 12], ["CHR", 0, "shared", [3]], ["CA", 1, 4, 12], ["FU", 9, [0, 1, 2, 3]], ["AN", 9, 0, 5], ["FU", 9, [1, 2, 3, 4]], ["AN", 9, 1, 4], ["FU", 9, [2, 3, 4, 5]], ["AN", 9, 2, 6], ["FU", 3, [0, 1]], ["SP", 3, 0, 96, [1], 1], ["AN", 3, 1, 2], ["FFSP", 3, 0, [4, 3, 2, 1], 1, 1], ["AN", 3, 1, 6], ["FU", 1, [0, 1, 2, 3]], ["SP", 1, 0, 64, [1], 1], ["AN", 1, 1, 2], ["FFSP", 1, 0, [4, 3, 2, 1], 1, 1], ["AN", 1, 1, 6], ["PR", 4, 0, "auto_unroll_max_step$64"]]]], "r": [[0.0024583, 0.002459, 0.00246028], 0, 32.3201, 1661980290], "v": "v0.6"}
