python/models/efficientnet/kernel_configs/efficient_reduce_mean_14_14_672.log
{"i": [["[\"reduce_mean\", 14, 14, 672]", "cuda -keys=cuda,gpu -max_num_threads=1024 -model=unknown -thread_warp_size=32", [-1, 16, 64, 49152, 2147483647, 1024, 8, 32], "", 0, []], [[], [["FU", 1, [2, 3]], ["SP", 2, 1, 672, [28], 1], ["AN", 2, 2, 6], ["FSP", 1, 2, 1, 1], ["AN", 1, 3, 6], ["CA", 1, 2, 1], ["FU", 2, [0, 1]], ["AN", 2, 0, 5], ["PR", 1, 0, "auto_unroll_max_step$64"]]]], "r": [[1.09415e-05, 1.09411e-05, 1.09416e-05, 1.09413e-05, 1.09413e-05, 1.09412e-05, 1.09413e-05, 1.09413e-05, 1.09414e-05, 1.09415e-05], 0, 5.39724, 1649337547], "v": "v0.6"}
{"i": [["[\"reduce_mean\", 14, 14, 672]", "cuda -keys=cuda,gpu -max_num_threads=1024 -model=unknown -thread_warp_size=32", [-1, 16, 64, 49152, 2147483647, 1024, 8, 32], "", 0, []], [[], [["FU", 2, [0, 1]], ["SP", 2, 0, 672, [2], 1], ["AN", 2, 0, 5], ["AN", 2, 1, 6], ["FU", 1, [0, 1]], ["SP", 1, 0, 672, [32], 1], ["AN", 1, 0, 5], ["AN", 1, 1, 6], ["PR", 1, 0, "auto_unroll_max_step$1024"]]]], "r": [[7.54169e-06, 7.53585e-06, 7.46618e-06, 7.44382e-06, 7.42854e-06, 7.45183e-06, 7.44341e-06, 7.50986e-06, 7.50533e-06, 7.44752e-06], 0, 9.46733, 1649337551], "v": "v0.6"}
{"i": [["[\"reduce_mean\", 14, 14, 672]", "cuda -keys=cuda,gpu -max_num_threads=1024 -model=unknown -thread_warp_size=32", [-1, 16, 64, 49152, 2147483647, 1024, 8, 32], "", 0, []], [[], [["FU", 2, [0, 1]], ["SP", 2, 0, 672, [48], 1], ["AN", 2, 0, 5], ["AN", 2, 1, 6], ["FU", 1, [0, 1]], ["SP", 1, 0, 672, [32], 1], ["AN", 1, 0, 5], ["AN", 1, 1, 6], ["PR", 1, 0, "auto_unroll_max_step$64"]]]], "r": [[7.32975e-06, 7.32914e-06, 7.34083e-06, 7.32731e-06, 7.32833e-06, 7.33789e-06, 7.3329e-06, 7.33287e-06, 7.33467e-06, 7.339e-06], 0, 30.2513, 1649337572], "v": "v0.6"}
{"i": [["[\"reduce_mean\", 14, 14, 672]", "cuda -keys=cuda,gpu -max_num_threads=1024 -model=unknown -thread_warp_size=32", [-1, 16, 64, 49152, 2147483647, 1024, 8, 32], "", 0, []], [[], [["FU", 2, [0, 1]], ["SP", 2, 0, 672, [48], 1], ["AN", 2, 0, 5], ["AN", 2, 1, 6], ["FU", 1, [0, 1]], ["SP", 1, 0, 672, [16], 1], ["AN", 1, 0, 5], ["AN", 1, 1, 6], ["PR", 1, 0, "auto_unroll_max_step$16"]]]], "r": [[7.41529e-06, 7.41481e-06, 7.41539e-06, 7.41518e-06, 7.41474e-06, 7.41464e-06, 7.4149e-06, 7.41454e-06, 7.41541e-06, 7.41518e-06], 0, 21.8468, 1649337564], "v": "v0.6"}
{"i": [["[\"reduce_mean\", 14, 14, 672]", "cuda -keys=cuda,gpu -max_num_threads=1024 -model=unknown -thread_warp_size=32", [-1, 16, 64, 49152, 2147483647, 1024, 8, 32], "", 0, []], [[], [["FU", 2, [0, 1]], ["SP", 2, 0, 672, [1], 1], ["AN", 2, 0, 5], ["AN", 2, 1, 6], ["FU", 1, [0, 1]], ["SP", 1, 0, 672, [32], 1], ["AN", 1, 0, 5], ["AN", 1, 1, 6], ["PR", 1, 0, "auto_unroll_max_step$1024"]]]], "r": [[7.72029e-06, 7.7204e-06, 7.72046e-06, 7.72001e-06, 7.71991e-06, 7.71969e-06, 7.7197e-06, 7.72016e-06, 7.71971e-06, 7.72089e-06], 0, 17.7283, 1649337560], "v": "v0.6"}
{"i": [["[\"reduce_mean\", 14, 14, 672]", "cuda -keys=cuda,gpu -max_num_threads=1024 -model=unknown -thread_warp_size=32", [-1, 16, 64, 49152, 2147483647, 1024, 8, 32], "", 0, []], [[], [["FU", 2, [0, 1]], ["SP", 2, 0, 672, [56], 1], ["AN", 2, 0, 5], ["AN", 2, 1, 6], ["FU", 1, [0, 1]], ["SP", 1, 0, 672, [48], 1], ["AN", 1, 0, 5], ["AN", 1, 1, 6], ["PR", 1, 0, "auto_unroll_max_step$512"]]]], "r": [[8.06018e-06, 8.06017e-06, 8.06034e-06, 8.06025e-06, 8.06036e-06, 8.06049e-06, 8.06043e-06, 8.06045e-06, 8.06037e-06, 8.06055e-06], 0, 26.0494, 1649337568], "v": "v0.6"}
{"i": [["[\"reduce_mean\", 14, 14, 672]", "cuda -keys=cuda,gpu -max_num_threads=1024 -model=unknown -thread_warp_size=32", [-1, 16, 64, 49152, 2147483647, 1024, 8, 32], "", 0, []], [[], [["FU", 2, [0, 1]], ["SP", 2, 0, 672, [6], 1], ["AN", 2, 0, 5], ["AN", 2, 1, 6], ["FU", 1, [0, 1]], ["SP", 1, 0, 672, [32], 1], ["AN", 1, 0, 5], ["AN", 1, 1, 6], ["PR", 1, 0, "auto_unroll_max_step$64"]]]], "r": [[7.55199e-06, 7.54586e-06, 7.54075e-06, 7.54136e-06, 7.55435e-06, 7.54123e-06, 7.5447e-06, 7.53885e-06, 7.55151e-06, 7.55328e-06], 0, 13.6503, 1649337555], "v": "v0.6"}
{"i": [["[\"reduce_mean\", 14, 14, 672]", "cuda -keys=cuda,gpu -max_num_threads=1024 -model=unknown -thread_warp_size=32", [-1, 16, 64, 49152, 2147483647, 1024, 8, 32], "", 0, []], [[], [["FU", 2, [0, 1]], ["SP", 2, 0, 672, [2], 1], ["AN", 2, 0, 5], ["AN", 2, 1, 6], ["FU", 1, [0, 1]], ["SP", 1, 0, 672, [16], 1], ["AN", 1, 0, 5], ["AN", 1, 1, 6], ["PR", 1, 0, "auto_unroll_max_step$64"]]]], "r": [[7.67265e-06, 7.67216e-06, 7.67004e-06, 7.67085e-06, 7.67236e-06, 7.67386e-06, 7.66793e-06, 7.67161e-06, 7.66955e-06, 7.67152e-06], 0, 35.8787, 1649337578], "v": "v0.6"}
{"i": [["[\"reduce_mean\", 14, 14, 672]", "cuda -keys=cuda,gpu -max_num_threads=1024 -model=unknown -thread_warp_size=32", [-1, 16, 64, 49152, 2147483647, 1024, 8, 32], "", 0, []], [[], [["FU", 1, [2, 3]], ["SP", 2, 1, 672, [24], 1], ["AN", 2, 2, 6], ["FSP", 1, 2, 1, 1], ["AN", 1, 3, 6], ["CA", 1, 2, 1], ["FU", 2, [0, 1]], ["AN", 2, 0, 5], ["PR", 1, 0, "auto_unroll_max_step$0"]]]], "r": [[1.65016e-05, 1.65033e-05, 1.65019e-05, 1.65012e-05, 1.65039e-05, 1.65035e-05, 1.65032e-05, 1.6501e-05, 1.65027e-05, 1.65026e-05], 0, 44.8993, 1649337587], "v": "v0.6"}
{"i": [["[\"reduce_mean\", 14, 14, 672]", "cuda -keys=cuda,gpu -max_num_threads=1024 -model=unknown -thread_warp_size=32", [-1, 16, 64, 49152, 2147483647, 1024, 8, 32], "", 0, []], [[], [["FU", 1, [2, 3]], ["SP", 2, 1, 672, [14], 1], ["AN", 2, 2, 6], ["FSP", 1, 2, 1, 1], ["AN", 1, 3, 6], ["CA", 1, 2, 1], ["FU", 2, [0, 1]], ["AN", 2, 0, 5], ["PR", 1, 0, "auto_unroll_max_step$64"]]]], "r": [[7.04953e-06, 7.0483e-06, 7.04808e-06, 7.04584e-06, 7.04247e-06, 7.04438e-06, 7.04941e-06, 7.05278e-06, 7.04778e-06, 7.05079e-06], 0, 39.9592, 1649337582], "v": "v0.6"}
{"i": [["[\"reduce_mean\", 14, 14, 672]", "cuda -keys=cuda,gpu -max_num_threads=1024 -model=unknown -thread_warp_size=32", [-1, 16, 64, 49152, 2147483647, 1024, 8, 32], "", 0, []], [[], [["FU", 2, [0, 1]], ["SP", 2, 0, 672, [8], 1], ["AN", 2, 0, 5], ["AN", 2, 1, 6], ["FU", 1, [0, 1]], ["SP", 1, 0, 672, [8], 1], ["AN", 1, 0, 5], ["AN", 1, 1, 6], ["PR", 1, 0, "auto_unroll_max_step$1024"]]]], "r": [[7.85847e-06, 7.61386e-06, 7.61585e-06, 7.6153e-06, 7.61174e-06, 7.61223e-06, 7.61483e-06, 7.61637e-06, 7.61363e-06, 7.61664e-06], 0, 57.4888, 1649337599], "v": "v0.6"}
{"i": [["[\"reduce_mean\", 14, 14, 672]", "cuda -keys=cuda,gpu -max_num_threads=1024 -model=unknown -thread_warp_size=32", [-1, 16, 64, 49152, 2147483647, 1024, 8, 32], "", 0, []], [[], [["FU", 2, [0, 1]], ["SP", 2, 0, 672, [1], 1], ["AN", 2, 0, 5], ["AN", 2, 1, 6], ["FU", 1, [0, 1]], ["SP", 1, 0, 672, [32], 1], ["AN", 1, 0, 5], ["AN", 1, 1, 6], ["PR", 1, 0, "auto_unroll_max_step$64"]]]], "r": [[7.71171e-06, 7.707e-06, 7.71068e-06, 7.71905e-06, 7.70872e-06, 7.7071e-06, 7.71126e-06, 7.70591e-06, 7.71201e-06, 7.71605e-06], 0, 61.5045, 1649337603], "v": "v0.6"}
{"i": [["[\"reduce_mean\", 14, 14, 672]", "cuda -keys=cuda,gpu -max_num_threads=1024 -model=unknown -thread_warp_size=32", [-1, 16, 64, 49152, 2147483647, 1024, 8, 32], "", 0, []], [[], [["FU", 1, [2, 3]], ["SP", 2, 1, 672, [16], 1], ["AN", 2, 2, 6], ["FSP", 1, 2, 1, 1], ["AN", 1, 3, 6], ["CA", 1, 2, 1], ["FU", 2, [0, 1]], ["AN", 2, 0, 5], ["PR", 1, 0, "auto_unroll_max_step$64"]]]], "r": [[7.4451e-06, 7.44637e-06, 7.4456e-06, 7.4487e-06, 7.44586e-06, 7.44759e-06, 7.44938e-06, 7.45056e-06, 7.44884e-06, 7.44874e-06], 0, 49.1369, 1649337591], "v": "v0.6"}
{"i": [["[\"reduce_mean\", 14, 14, 672]", "cuda -keys=cuda,gpu -max_num_threads=1024 -model=unknown -thread_warp_size=32", [-1, 16, 64, 49152, 2147483647, 1024, 8, 32], "", 0, []], [[], [["FU", 2, [0, 1]], ["SP", 2, 0, 672, [32], 1], ["AN", 2, 0, 5], ["AN", 2, 1, 6], ["FU", 1, [0, 1]], ["SP", 1, 0, 672, [8], 1], ["AN", 1, 0, 5], ["AN", 1, 1, 6], ["PR", 1, 0, "auto_unroll_max_step$16"]]]], "r": [[7.49678e-06, 7.49675e-06, 7.49679e-06, 7.49717e-06, 7.49731e-06, 7.49738e-06, 7.49733e-06, 7.49712e-06, 7.49676e-06, 7.49694e-06], 0, 53.2508, 1649337595], "v": "v0.6"}
{"i": [["[\"reduce_mean\", 14, 14, 672]", "cuda -keys=cuda,gpu -max_num_threads=1024 -model=unknown -thread_warp_size=32", [-1, 16, 64, 49152, 2147483647, 1024, 8, 32], "", 0, []], [[], [["FU", 2, [0, 1]], ["SP", 2, 0, 672, [16], 1], ["AN", 2, 0, 5], ["AN", 2, 1, 6], ["FU", 1, [0, 1]], ["SP", 1, 0, 672, [32], 1], ["AN", 1, 0, 5], ["AN", 1, 1, 6], ["PR", 1, 0, "auto_unroll_max_step$64"]]]], "r": [[7.2294e-06, 7.27083e-06, 7.28932e-06, 7.25122e-06, 7.25352e-06, 7.21856e-06, 7.23103e-06, 7.2404e-06, 7.25108e-06, 7.21671e-06], 0, 69.782, 1649337612], "v": "v0.6"}
{"i": [["[\"reduce_mean\", 14, 14, 672]", "cuda -keys=cuda,gpu -max_num_threads=1024 -model=unknown -thread_warp_size=32", [-1, 16, 64, 49152, 2147483647, 1024, 8, 32], "", 0, []], [[], [["FU", 1, [2, 3]], ["SP", 2, 1, 672, [32], 1], ["AN", 2, 2, 6], ["FSP", 1, 2, 1, 1], ["AN", 1, 3, 6], ["CA", 1, 2, 1], ["FU", 2, [0, 1]], ["AN", 2, 0, 5], ["PR", 1, 0, "auto_unroll_max_step$64"]]]], "r": [[1.41538e-05, 1.41519e-05, 1.4152e-05, 1.41522e-05, 1.41577e-05, 1.41538e-05, 1.41547e-05, 1.41528e-05, 1.4154e-05, 1.41561e-05], 0, 74.5001, 1649337616], "v": "v0.6"}
{"i": [["[\"reduce_mean\", 14, 14, 672]", "cuda -keys=cuda,gpu -max_num_threads=1024 -model=unknown -thread_warp_size=32", [-1, 16, 64, 49152, 2147483647, 1024, 8, 32], "", 0, []], [[], [["FU", 2, [0, 1]], ["SP", 2, 0, 672, [32], 1], ["AN", 2, 0, 5], ["AN", 2, 1, 6], ["FU", 1, [0, 1]], ["SP", 1, 0, 672, [1], 1], ["AN", 1, 0, 5], ["AN", 1, 1, 6], ["PR", 1, 0, "auto_unroll_max_step$512"]]]], "r": [[8.92643e-06, 8.92722e-06, 8.92679e-06, 8.92652e-06, 8.92696e-06, 8.92646e-06, 8.92602e-06, 8.92771e-06, 8.92659e-06, 8.9256e-06], 0, 78.758, 1649337621], "v": "v0.6"}
{"i": [["[\"reduce_mean\", 14, 14, 672]", "cuda -keys=cuda,gpu -max_num_threads=1024 -model=unknown -thread_warp_size=32", [-1, 16, 64, 49152, 2147483647, 1024, 8, 32], "", 0, []], [[], [["FU", 2, [0, 1]], ["SP", 2, 0, 672, [16], 1], ["AN", 2, 0, 5], ["AN", 2, 1, 6], ["FU", 1, [0, 1]], ["SP", 1, 0, 672, [8], 1], ["AN", 1, 0, 5], ["AN", 1, 1, 6], ["PR", 1, 0, "auto_unroll_max_step$1024"]]]], "r": [[7.51289e-06, 7.51402e-06, 7.51301e-06, 7.5129e-06, 7.51215e-06, 7.51474e-06, 7.51222e-06, 7.51214e-06, 7.51134e-06, 7.51046e-06], 0, 65.676, 1649337608], "v": "v0.6"}
{"i": [["[\"reduce_mean\", 14, 14, 672]", "cuda -keys=cuda,gpu -max_num_threads=1024 -model=unknown -thread_warp_size=32", [-1, 16, 64, 49152, 2147483647, 1024, 8, 32], "", 0, []], [[], [["FU", 2, [0, 1]], ["SP", 2, 0, 672, [32], 1], ["AN", 2, 0, 5], ["AN", 2, 1, 6], ["FU", 1, [0, 1]], ["SP", 1, 0, 672, [32], 1], ["AN", 1, 0, 5], ["AN", 1, 1, 6], ["PR", 1, 0, "auto_unroll_max_step$512"]]]], "r": [[1.03762e-05, 1.03489e-05, 8.77894e-06, 8.63987e-06, 8.6323e-06, 8.64323e-06, 8.63448e-06, 8.64176e-06, 8.6012e-06, 8.58558e-06], 0, 44.1428, 1649343902], "v": "v0.6"}
{"i": [["[\"reduce_mean\", 14, 14, 672]", "cuda -keys=cuda,gpu -max_num_threads=1024 -model=unknown -thread_warp_size=32", [-1, 16, 64, 49152, 2147483647, 1024, 8, 32], "", 0, []], [[], [["FU", 2, [0, 1]], ["SP", 2, 0, 672, [1], 1], ["AN", 2, 0, 5], ["AN", 2, 1, 6], ["FU", 1, [0, 1]], ["SP", 1, 0, 672, [16], 1], ["AN", 1, 0, 5], ["AN", 1, 1, 6], ["PR", 1, 0, "auto_unroll_max_step$512"]]]], "r": [[1.10287e-05, 1.10235e-05, 1.10271e-05, 1.0716e-05, 9.18774e-06, 9.18839e-06, 9.19456e-06, 9.18819e-06, 9.1916e-06, 9.1873e-06], 0, 16.0582, 1649343874], "v": "v0.6"}
{"i": [["[\"reduce_mean\", 14, 14, 672]", "cuda -keys=cuda,gpu -max_num_threads=1024 -model=unknown -thread_warp_size=32", [-1, 16, 64, 49152, 2147483647, 1024, 8, 32], "", 0, []], [[], [["FU", 2, [0, 1]], ["SP", 2, 0, 672, [4], 1], ["AN", 2, 0, 5], ["AN", 2, 1, 6], ["FU", 1, [0, 1]], ["SP", 1, 0, 672, [32], 1], ["AN", 1, 0, 5], ["AN", 1, 1, 6], ["PR", 1, 0, "auto_unroll_max_step$16"]]]], "r": [[9.04571e-06, 9.00205e-06, 9.00049e-06, 9.00021e-06, 8.74567e-06, 8.58023e-06, 8.57996e-06, 8.58111e-06, 8.57721e-06, 8.86078e-06], 0, 6.31825, 1649343864], "v": "v0.6"}
{"i": [["[\"reduce_mean\", 14, 14, 672]", "cuda -keys=cuda,gpu -max_num_threads=1024 -model=unknown -thread_warp_size=32", [-1, 16, 64, 49152, 2147483647, 1024, 8, 32], "", 0, []], [[], [["FU", 2, [0, 1]], ["SP", 2, 0, 672, [56], 1], ["AN", 2, 0, 5], ["AN", 2, 1, 6], ["FU", 1, [0, 1]], ["SP", 1, 0, 672, [16], 1], ["AN", 1, 0, 5], ["AN", 1, 1, 6], ["PR", 1, 0, "auto_unroll_max_step$512"]]]], "r": [[8.73833e-06, 8.7566e-06, 8.38723e-06, 8.36242e-06, 8.36246e-06, 8.35753e-06, 8.36067e-06, 8.40578e-06, 8.43374e-06, 8.42027e-06], 0, 54.9886, 1649343913], "v": "v0.6"}
{"i": [["[\"reduce_mean\", 14, 14, 672]", "cuda -keys=cuda,gpu -max_num_threads=1024 -model=unknown -thread_warp_size=32", [-1, 16, 64, 49152, 2147483647, 1024, 8, 32], "", 0, []], [[], [["FU", 2, [0, 1]], ["SP", 2, 0, 672, [8], 1], ["AN", 2, 0, 5], ["AN", 2, 1, 6], ["FU", 1, [0, 1]], ["SP", 1, 0, 672, [16], 1], ["AN", 1, 0, 5], ["AN", 1, 1, 6], ["PR", 1, 0, "auto_unroll_max_step$16"]]]], "r": [[1.02147e-05, 1.02193e-05, 1.02209e-05, 8.87566e-06, 8.38992e-06, 8.3866e-06, 8.38451e-06, 8.38794e-06, 8.38665e-06, 8.64953e-06], 0, 11.1779, 1649343869], "v": "v0.6"}
{"i": [["[\"reduce_mean\", 14, 14, 672]", "cuda -keys=cuda,gpu -max_num_threads=1024 -model=unknown -thread_warp_size=32", [-1, 16, 64, 49152, 2147483647, 1024, 8, 32], "", 0, []], [[], [["FU", 2, [0, 1]], ["SP", 2, 0, 672, [32], 1], ["AN", 2, 0, 5], ["AN", 2, 1, 6], ["FU", 1, [0, 1]], ["SP", 1, 0, 672, [4], 1], ["AN", 1, 0, 5], ["AN", 1, 1, 6], ["PR", 1, 0, "auto_unroll_max_step$64"]]]], "r": [[9.08715e-06, 9.01553e-06, 9.01298e-06, 9.02117e-06, 9.01566e-06, 9.02312e-06, 8.99622e-06, 8.67229e-06, 8.66876e-06, 8.66693e-06], 0, 59.2918, 1649343917], "v": "v0.6"}
{"i": [["[\"reduce_mean\", 14, 14, 672]", "cuda -keys=cuda,gpu -max_num_threads=1024 -model=unknown -thread_warp_size=32", [-1, 16, 64, 49152, 2147483647, 1024, 8, 32], "", 0, []], [[], [["FU", 2, [0, 1]], ["SP", 2, 0, 672, [16], 1], ["AN", 2, 0, 5], ["AN", 2, 1, 6], ["FU", 1, [0, 1]], ["SP", 1, 0, 672, [16], 1], ["AN", 1, 0, 5], ["AN", 1, 1, 6], ["PR", 1, 0, "auto_unroll_max_step$0"]]]], "r": [[8.87979e-06, 8.88041e-06, 8.87365e-06, 8.88097e-06, 8.88002e-06, 8.56553e-06, 8.44897e-06, 8.4522e-06, 8.45725e-06, 8.45019e-06], 0, 26.0904, 1649343884], "v": "v0.6"}
{"i": [["[\"reduce_mean\", 14, 14, 672]", "cuda -keys=cuda,gpu -max_num_threads=1024 -model=unknown -thread_warp_size=32", [-1, 16, 64, 49152, 2147483647, 1024, 8, 32], "", 0, []], [[], [["FU", 1, [2, 3]], ["SP", 2, 1, 672, [1], 1], ["AN", 2, 2, 6], ["FSP", 1, 2, 1, 1], ["AN", 1, 3, 6], ["CA", 1, 2, 1], ["FU", 2, [0, 1]], ["AN", 2, 0, 5], ["PR", 1, 0, "auto_unroll_max_step$1024"]]]], "r": [[6.97856e-06, 7.01988e-06, 7.01936e-06, 7.01185e-06, 7.00863e-06, 7.00381e-06, 6.68497e-06, 6.69659e-06, 6.68696e-06, 6.68723e-06], 0, 39.31, 1649343897], "v": "v0.6"}
{"i": [["[\"reduce_mean\", 14, 14, 672]", "cuda -keys=cuda,gpu -max_num_threads=1024 -model=unknown -thread_warp_size=32", [-1, 16, 64, 49152, 2147483647, 1024, 8, 32], "", 0, []], [[], [["FU", 2, [0, 1]], ["SP", 2, 0, 672, [32], 1], ["AN", 2, 0, 5], ["AN", 2, 1, 6], ["FU", 1, [0, 1]], ["SP", 1, 0, 672, [21], 1], ["AN", 1, 0, 5], ["AN", 1, 1, 6], ["PR", 1, 0, "auto_unroll_max_step$0"]]]], "r": [[9.07596e-06, 9.02711e-06, 9.0251e-06, 9.0258e-06, 9.0268e-06, 9.02671e-06, 9.0272e-06, 9.02683e-06, 8.92013e-06, 8.91916e-06], 0, 30.2744, 1649343888], "v": "v0.6"}
{"i": [["[\"reduce_mean\", 14, 14, 672]", "cuda -keys=cuda,gpu -max_num_threads=1024 -model=unknown -thread_warp_size=32", [-1, 16, 64, 49152, 2147483647, 1024, 8, 32], "", 0, []], [[], [["FU", 2, [0, 1]], ["SP", 2, 0, 672, [1], 1], ["AN", 2, 0, 5], ["AN", 2, 1, 6], ["FU", 1, [0, 1]], ["SP", 1, 0, 672, [32], 1], ["AN", 1, 0, 5], ["AN", 1, 1, 6], ["PR", 1, 0, "auto_unroll_max_step$16"]]]], "r": [[1.03504e-05, 1.00291e-05, 9.31319e-06, 9.31558e-06, 9.318e-06, 9.30786e-06, 9.31005e-06, 9.47848e-06, 9.54543e-06, 9.54109e-06], 0, 85.5123, 1649343944], "v": "v0.6"}
{"i": [["[\"reduce_mean\", 14, 14, 672]", "cuda -keys=cuda,gpu -max_num_threads=1024 -model=unknown -thread_warp_size=32", [-1, 16, 64, 49152, 2147483647, 1024, 8, 32], "", 0, []], [[], [["FU", 2, [0, 1]], ["SP", 2, 0, 672, [4], 1], ["AN", 2, 0, 5], ["AN", 2, 1, 6], ["FU", 1, [0, 1]], ["SP", 1, 0, 672, [16], 1], ["AN", 1, 0, 5], ["AN", 1, 1, 6], ["PR", 1, 0, "auto_unroll_max_step$512"]]]], "r": [[9.45849e-06, 9.44137e-06, 9.46343e-06, 9.44866e-06, 8.79833e-06, 8.72921e-06, 8.72866e-06, 8.73017e-06, 8.73471e-06, 8.85882e-06], 0, 64.6078, 1649343923], "v": "v0.6"}
{"i": [["[\"reduce_mean\", 14, 14, 672]", "cuda -keys=cuda,gpu -max_num_threads=1024 -model=unknown -thread_warp_size=32", [-1, 16, 64, 49152, 2147483647, 1024, 8, 32], "", 0, []], [[], [["FU", 2, [0, 1]], ["SP", 2, 0, 672, [4], 1], ["AN", 2, 0, 5], ["AN", 2, 1, 6], ["FU", 1, [0, 1]], ["SP", 1, 0, 672, [1], 1], ["AN", 1, 0, 5], ["AN", 1, 1, 6], ["PR", 1, 0, "auto_unroll_max_step$16"]]]], "r": [[1.06253e-05, 1.04731e-05, 1.03957e-05, 1.03891e-05, 1.03895e-05, 1.07285e-05, 1.15574e-05, 1.15555e-05, 1.15585e-05, 1.15502e-05], 0, 80.3667, 1649343939], "v": "v0.6"}
{"i": [["[\"reduce_mean\", 14, 14, 672]", "cuda -keys=cuda,gpu -max_num_threads=1024 -model=unknown -thread_warp_size=32", [-1, 16, 64, 49152, 2147483647, 1024, 8, 32], "", 0, []], [[], [["FU", 2, [0, 1]], ["SP", 2, 0, 672, [16], 1], ["AN", 2, 0, 5], ["AN", 2, 1, 6], ["FU", 1, [0, 1]], ["SP", 1, 0, 672, [24], 1], ["AN", 1, 0, 5], ["AN", 1, 1, 6], ["PR", 1, 0, "auto_unroll_max_step$64"]]]], "r": [[8.57734e-06, 8.42611e-06, 8.42767e-06, 8.42803e-06, 8.42986e-06, 8.52252e-06, 8.53608e-06, 8.53709e-06, 8.54185e-06, 8.53791e-06], 0, 70.019, 1649343928], "v": "v0.6"}
{"i": [["[\"reduce_mean\", 14, 14, 672]", "cuda -keys=cuda,gpu -max_num_threads=1024 -model=unknown -thread_warp_size=32", [-1, 16, 64, 49152, 2147483647, 1024, 8, 32], "", 0, []], [[], [["FU", 2, [0, 1]], ["SP", 2, 0, 672, [2], 1], ["AN", 2, 0, 5], ["AN", 2, 1, 6], ["FU", 1, [0, 1]], ["SP", 1, 0, 672, [32], 1], ["AN", 1, 0, 5], ["AN", 1, 1, 6], ["PR", 1, 0, "auto_unroll_max_step$64"]]]], "r": [[9.26526e-06, 9.2706e-06, 9.27107e-06, 9.26592e-06, 9.26816e-06, 8.4931e-06, 8.49462e-06, 8.49135e-06, 8.49266e-06, 8.48946e-06], 0, 89.9729, 1649343948], "v": "v0.6"}
{"i": [["[\"reduce_mean\", 14, 14, 672]", "cuda -keys=cuda,gpu -max_num_threads=1024 -model=unknown -thread_warp_size=32", [-1, 16, 64, 49152, 2147483647, 1024, 8, 32], "", 0, []], [[], [["FU", 2, [0, 1]], ["SP", 2, 0, 672, [32], 1], ["AN", 2, 0, 5], ["AN", 2, 1, 6], ["FU", 1, [0, 1]], ["SP", 1, 0, 672, [48], 1], ["AN", 1, 0, 5], ["AN", 1, 1, 6], ["PR", 1, 0, "auto_unroll_max_step$16"]]]], "r": [[9.60097e-06, 9.63991e-06, 9.4352e-06, 9.4409e-06, 9.43456e-06, 9.4336e-06, 9.39343e-06, 9.10095e-06, 9.10199e-06, 9.10528e-06], 0, 100.391, 1649343959], "v": "v0.6"}
{"i": [["[\"reduce_mean\", 14, 14, 672]", "cuda -keys=cuda,gpu -max_num_threads=1024 -model=unknown -thread_warp_size=32", [-1, 16, 64, 49152, 2147483647, 1024, 8, 32], "", 0, []], [[], [["FU", 2, [0, 1]], ["SP", 2, 0, 672, [32], 1], ["AN", 2, 0, 5], ["AN", 2, 1, 6], ["FU", 1, [0, 1]], ["SP", 1, 0, 672, [1], 1], ["AN", 1, 0, 5], ["AN", 1, 1, 6], ["PR", 1, 0, "auto_unroll_max_step$0"]]]], "r": [[1.08672e-05, 1.04813e-05, 1.04792e-05, 1.04957e-05, 1.04836e-05, 1.05129e-05, 1.05305e-05, 1.05314e-05, 1.05244e-05, 1.05214e-05], 0, 95.0658, 1649343954], "v": "v0.6"}
{"i": [["[\"reduce_mean\", 14, 14, 672]", "cuda -keys=cuda,gpu -max_num_threads=1024 -model=unknown -thread_warp_size=32", [-1, 16, 64, 49152, 2147483647, 1024, 8, 32], "", 0, []], [[], [["FU", 2, [0, 1]], ["SP", 2, 0, 672, [32], 1], ["AN", 2, 0, 5], ["AN", 2, 1, 6], ["FU", 1, [0, 1]], ["SP", 1, 0, 672, [2], 1], ["AN", 1, 0, 5], ["AN", 1, 1, 6], ["PR", 1, 0, "auto_unroll_max_step$1024"]]]], "r": [[1.13293e-05, 1.133e-05, 1.13295e-05, 1.01266e-05, 9.86897e-06, 9.86155e-06, 9.83963e-06, 9.85634e-06, 9.84233e-06, 9.70434e-06], 0, 74.9744, 1649343933], "v": "v0.6"}
{"i": [["[\"reduce_mean\", 14, 14, 672]", "cuda -keys=cuda,gpu -max_num_threads=1024 -model=unknown -thread_warp_size=32", [-1, 16, 64, 49152, 2147483647, 1024, 8, 32], "", 0, []], [[], [["FU", 2, [0, 1]], ["SP", 2, 0, 672, [8], 1], ["AN", 2, 0, 5], ["AN", 2, 1, 6], ["FU", 1, [0, 1]], ["SP", 1, 0, 672, [8], 1], ["AN", 1, 0, 5], ["AN", 1, 1, 6], ["PR", 1, 0, "auto_unroll_max_step$0"]]]], "r": [[9.25913e-06, 9.25976e-06, 9.26348e-06, 9.25939e-06, 9.26341e-06, 9.26543e-06, 9.28983e-06, 8.69005e-06, 8.68441e-06, 8.69367e-06], 0, 118.602, 1649343977], "v": "v0.6"}
{"i": [["[\"reduce_mean\", 14, 14, 672]", "cuda -keys=cuda,gpu -max_num_threads=1024 -model=unknown -thread_warp_size=32", [-1, 16, 64, 49152, 2147483647, 1024, 8, 32], "", 0, []], [[], [["FU", 2, [0, 1]], ["SP", 2, 0, 672, [32], 1], ["AN", 2, 0, 5], ["AN", 2, 1, 6], ["FU", 1, [0, 1]], ["SP", 1, 0, 672, [12], 1], ["AN", 1, 0, 5], ["AN", 1, 1, 6], ["PR", 1, 0, "auto_unroll_max_step$1024"]]]], "r": [[9.10838e-06, 9.10799e-06, 8.94373e-06, 8.91261e-06, 8.91652e-06, 8.92465e-06, 8.92189e-06, 8.91997e-06, 8.66667e-06, 8.6258e-06], 0, 114.328, 1649343973], "v": "v0.6"}
{"i": [["[\"reduce_mean\", 14, 14, 672]", "cuda -keys=cuda,gpu -max_num_threads=1024 -model=unknown -thread_warp_size=32", [-1, 16, 64, 49152, 2147483647, 1024, 8, 32], "", 0, []], [[], [["FU", 2, [0, 1]], ["SP", 2, 0, 672, [2], 1], ["AN", 2, 0, 5], ["AN", 2, 1, 6], ["FU", 1, [0, 1]], ["SP", 1, 0, 672, [24], 1], ["AN", 1, 0, 5], ["AN", 1, 1, 6], ["PR", 1, 0, "auto_unroll_max_step$512"]]]], "r": [[9.80805e-06, 9.75579e-06, 9.75645e-06, 9.67697e-06, 9.40173e-06, 9.40316e-06, 9.40234e-06, 9.40264e-06, 9.40745e-06, 9.17108e-06], 0, 134.348, 1649343993], "v": "v0.6"}
{"i": [["[\"reduce_mean\", 14, 14, 672]", "cuda -keys=cuda,gpu -max_num_threads=1024 -model=unknown -thread_warp_size=32", [-1, 16, 64, 49152, 2147483647, 1024, 8, 32], "", 0, []], [[], [["FU", 2, [0, 1]], ["SP", 2, 0, 672, [2], 1], ["AN", 2, 0, 5], ["AN", 2, 1, 6], ["FU", 1, [0, 1]], ["SP", 1, 0, 672, [7], 1], ["AN", 1, 0, 5], ["AN", 1, 1, 6], ["PR", 1, 0, "auto_unroll_max_step$64"]]]], "r": [[9.28988e-06, 9.25663e-06, 9.26548e-06, 9.25438e-06, 9.23357e-06, 9.25127e-06, 9.24954e-06, 9.26404e-06, 9.25743e-06, 9.27013e-06], 0, 105.698, 1649343964], "v": "v0.6"}
{"i": [["[\"reduce_mean\", 14, 14, 672]", "cuda -keys=cuda,gpu -max_num_threads=1024 -model=unknown -thread_warp_size=32", [-1, 16, 64, 49152, 2147483647, 1024, 8, 32], "", 0, []], [[], [["FU", 2, [0, 1]], ["SP", 2, 0, 672, [16], 1], ["AN", 2, 0, 5], ["AN", 2, 1, 6], ["FU", 1, [0, 1]], ["SP", 1, 0, 672, [56], 1], ["AN", 1, 0, 5], ["AN", 1, 1, 6], ["PR", 1, 0, "auto_unroll_max_step$16"]]]], "r": [[1.52982e-05, 1.52624e-05, 1.5301e-05, 1.52677e-05, 1.52982e-05, 1.37119e-05, 9.11113e-06, 9.11361e-06, 9.11364e-06, 9.11351e-06], 0, 149.52, 1649344008], "v": "v0.6"}
{"i": [["[\"reduce_mean\", 14, 14, 672]", "cuda -keys=cuda,gpu -max_num_threads=1024 -model=unknown -thread_warp_size=32", [-1, 16, 64, 49152, 2147483647, 1024, 8, 32], "", 0, []], [[], [["FU", 2, [0, 1]], ["SP", 2, 0, 672, [32], 1], ["AN", 2, 0, 5], ["AN", 2, 1, 6], ["FU", 1, [0, 1]], ["SP", 1, 0, 672, [28], 1], ["AN", 1, 0, 5], ["AN", 1, 1, 6], ["PR", 1, 0, "auto_unroll_max_step$512"]]]], "r": [[8.88172e-06, 8.89141e-06, 9.02166e-06, 9.02877e-06, 9.02643e-06, 9.0249e-06, 9.02381e-06, 9.02471e-06, 9.02613e-06, 9.01869e-06], 0, 109.2, 1649343968], "v": "v0.6"}
{"i": [["[\"reduce_mean\", 14, 14, 672]", "cuda -keys=cuda,gpu -max_num_threads=1024 -model=unknown -thread_warp_size=32", [-1, 16, 64, 49152, 2147483647, 1024, 8, 32], "", 0, []], [[], [["FU", 2, [0, 1]], ["SP", 2, 0, 672, [32], 1], ["AN", 2, 0, 5], ["AN", 2, 1, 6], ["FU", 1, [0, 1]], ["SP", 1, 0, 672, [2], 1], ["AN", 1, 0, 5], ["AN", 1, 1, 6], ["PR", 1, 0, "auto_unroll_max_step$64"]]]], "r": [[1.02931e-05, 1.06263e-05, 1.06252e-05, 1.06237e-05, 1.06276e-05, 1.06383e-05, 9.85694e-06, 9.84669e-06, 9.8545e-06, 9.85216e-06], 0, 139.618, 1649343998], "v": "v0.6"}
{"i": [["[\"reduce_mean\", 14, 14, 672]", "cuda -keys=cuda,gpu -max_num_threads=1024 -model=unknown -thread_warp_size=32", [-1, 16, 64, 49152, 2147483647, 1024, 8, 32], "", 0, []], [[], [["FU", 2, [0, 1]], ["SP", 2, 0, 672, [16], 1], ["AN", 2, 0, 5], ["AN", 2, 1, 6], ["FU", 1, [0, 1]], ["SP", 1, 0, 672, [2], 1], ["AN", 1, 0, 5], ["AN", 1, 1, 6], ["PR", 1, 0, "auto_unroll_max_step$16"]]]], "r": [[1.0047e-05, 1.00408e-05, 1.00451e-05, 9.83737e-06, 9.20105e-06, 9.19102e-06, 9.19497e-06, 9.1965e-06, 9.19575e-06, 9.28768e-06], 0, 123.214, 1649343982], "v": "v0.6"}
{"i": [["[\"reduce_mean\", 14, 14, 672]", "cuda -keys=cuda,gpu -max_num_threads=1024 -model=unknown -thread_warp_size=32", [-1, 16, 64, 49152, 2147483647, 1024, 8, 32], "", 0, []], [[], [["FU", 2, [0, 1]], ["SP", 2, 0, 672, [1], 1], ["AN", 2, 0, 5], ["AN", 2, 1, 6], ["FU", 1, [0, 1]], ["SP", 1, 0, 672, [32], 1], ["AN", 1, 0, 5], ["AN", 1, 1, 6], ["PR", 1, 0, "auto_unroll_max_step$64"]]]], "r": [[1.42223e-05, 1.42404e-05, 1.4232e-05, 1.42373e-05, 1.42353e-05, 1.42379e-05, 1.42207e-05, 1.42213e-05, 1.09561e-05, 9.16449e-06], 0, 165.339, 1649344024], "v": "v0.6"}
{"i": [["[\"reduce_mean\", 14, 14, 672]", "cuda -keys=cuda,gpu -max_num_threads=1024 -model=unknown -thread_warp_size=32", [-1, 16, 64, 49152, 2147483647, 1024, 8, 32], "", 0, []], [[], [["FU", 2, [0, 1]], ["SP", 2, 0, 672, [14], 1], ["AN", 2, 0, 5], ["AN", 2, 1, 6], ["FU", 1, [0, 1]], ["SP", 1, 0, 672, [8], 1], ["AN", 1, 0, 5], ["AN", 1, 1, 6], ["PR", 1, 0, "auto_unroll_max_step$64"]]]], "r": [[1.40046e-05, 1.40408e-05, 1.40056e-05, 1.40377e-05, 1.4004e-05, 1.40395e-05, 1.40075e-05, 1.40452e-05, 1.40138e-05, 1.40396e-05], 0, 144.428, 1649344003], "v": "v0.6"}
{"i": [["[\"reduce_mean\", 14, 14, 672]", "cuda -keys=cuda,gpu -max_num_threads=1024 -model=unknown -thread_warp_size=32", [-1, 16, 64, 49152, 2147483647, 1024, 8, 32], "", 0, []], [[], [["FU", 2, [0, 1]], ["SP", 2, 0, 672, [1], 1], ["AN", 2, 0, 5], ["AN", 2, 1, 6], ["FU", 1, [0, 1]], ["SP", 1, 0, 672, [1], 1], ["AN", 1, 0, 5], ["AN", 1, 1, 6], ["PR", 1, 0, "auto_unroll_max_step$16"]]]], "r": [[1.13904e-05, 1.13836e-05, 1.13944e-05, 1.13819e-05, 1.13891e-05, 1.12186e-05, 1.12061e-05, 1.12126e-05, 1.12002e-05, 1.12019e-05], 0, 154.647, 1649344013], "v": "v0.6"}
{"i": [["[\"reduce_mean\", 14, 14, 672]", "cuda -keys=cuda,gpu -max_num_threads=1024 -model=unknown -thread_warp_size=32", [-1, 16, 64, 49152, 2147483647, 1024, 8, 32], "", 0, []], [[], [["FU", 2, [0, 1]], ["SP", 2, 0, 672, [48], 1], ["AN", 2, 0, 5], ["AN", 2, 1, 6], ["FU", 1, [0, 1]], ["SP", 1, 0, 672, [32], 1], ["AN", 1, 0, 5], ["AN", 1, 1, 6], ["PR", 1, 0, "auto_unroll_max_step$512"]]]], "r": [[8.74245e-06, 8.60571e-06, 8.60136e-06, 8.60117e-06, 8.60142e-06, 9.12649e-06, 9.36714e-06, 9.37671e-06, 9.36526e-06, 9.36657e-06], 0, 128.654, 1649343987], "v": "v0.6"}
{"i": [["[\"reduce_mean\", 14, 14, 672]", "cuda -keys=cuda,gpu -max_num_threads=1024 -model=unknown -thread_warp_size=32", [-1, 16, 64, 49152, 2147483647, 1024, 8, 32], "", 0, []], [[], [["FU", 2, [0, 1]], ["SP", 2, 0, 672, [32], 1], ["AN", 2, 0, 5], ["AN", 2, 1, 6], ["FU", 1, [0, 1]], ["SP", 1, 0, 672, [16], 1], ["AN", 1, 0, 5], ["AN", 1, 1, 6], ["PR", 1, 0, "auto_unroll_max_step$16"]]]], "r": [[8.68459e-06, 8.54548e-06, 8.548e-06, 8.5459e-06, 8.56423e-06, 8.54579e-06, 8.54328e-06, 8.5488e-06, 8.55068e-06, 8.54019e-06], 0, 170.709, 1649344029], "v": "v0.6"}
{"i": [["[\"reduce_mean\", 14, 14, 672]", "cuda -keys=cuda,gpu -max_num_threads=1024 -model=unknown -thread_warp_size=32", [-1, 16, 64, 49152, 2147483647, 1024, 8, 32], "", 0, []], [[], [["FU", 2, [0, 1]], ["SP", 2, 0, 672, [8], 1], ["AN", 2, 0, 5], ["AN", 2, 1, 6], ["FU", 1, [0, 1]], ["SP", 1, 0, 672, [8], 1], ["AN", 1, 0, 5], ["AN", 1, 1, 6], ["PR", 1, 0, "auto_unroll_max_step$64"]]]], "r": [[8.57847e-06, 8.57903e-06, 8.58457e-06, 8.56752e-06, 8.7153e-06, 8.86773e-06, 8.86829e-06, 8.86325e-06, 8.86469e-06, 8.85141e-06], 0, 160.374, 1649344019], "v": "v0.6"}
{"i": [["[\"reduce_mean\", 14, 14, 672]", "cuda -keys=cuda,gpu -max_num_threads=1024 -model=unknown -thread_warp_size=32", [-1, 16, 64, 49152, 2147483647, 1024, 8, 32], "", 0, []], [[], [["FU", 1, [2, 3]], ["SP", 2, 1, 672, [8], 1], ["AN", 2, 2, 6], ["FSP", 1, 2, 1, 1], ["AN", 1, 3, 6], ["CA", 1, 2, 1], ["FU", 2, [0, 1]], ["AN", 2, 0, 5], ["PR", 1, 0, "auto_unroll_max_step$0"]]]], "r": [[8.98655e-06, 8.98998e-06, 8.97621e-06, 8.98751e-06, 8.54146e-06, 8.53828e-06, 8.53736e-06, 8.54694e-06, 8.54198e-06, 8.68967e-06], 0, 180.571, 1649344039], "v": "v0.6"}
{"i": [["[\"reduce_mean\", 14, 14, 672]", "cuda -keys=cuda,gpu -max_num_threads=1024 -model=unknown -thread_warp_size=32", [-1, 16, 64, 49152, 2147483647, 1024, 8, 32], "", 0, []], [[], [["FU", 1, [2, 3]], ["SP", 2, 1, 672, [32], 1], ["AN", 2, 2, 6], ["FSP", 1, 2, 1, 1], ["AN", 1, 3, 6], ["CA", 1, 2, 1], ["FU", 2, [0, 1]], ["AN", 2, 0, 5], ["PR", 1, 0, "auto_unroll_max_step$0"]]]], "r": [[1.94884e-05, 1.94873e-05, 1.94934e-05, 1.94858e-05, 1.7666e-05, 1.59204e-05, 1.59265e-05, 1.59241e-05, 1.59197e-05, 1.5924e-05], 0, 175.822, 1649344035], "v": "v0.6"}
{"i": [["[\"reduce_mean\", 14, 14, 672]", "cuda -keys=cuda,gpu -max_num_threads=1024 -model=unknown -thread_warp_size=32", [-1, 16, 64, 49152, 2147483647, 1024, 8, 32], "", 0, []], [[], [["FU", 2, [0, 1]], ["SP", 2, 0, 672, [8], 1], ["AN", 2, 0, 5], ["AN", 2, 1, 6], ["FU", 1, [0, 1]], ["SP", 1, 0, 672, [1], 1], ["AN", 1, 0, 5], ["AN", 1, 1, 6], ["PR", 1, 0, "auto_unroll_max_step$0"]]]], "r": [[1.12296e-05, 1.12257e-05, 1.12378e-05, 1.12101e-05, 1.12095e-05, 1.12177e-05, 1.12221e-05, 1.11884e-05, 1.10619e-05, 1.10634e-05], 0, 186.188, 1649344045], "v": "v0.6"}
{"i": [["[\"reduce_mean\", 14, 14, 672]", "cuda -keys=cuda,gpu -max_num_threads=1024 -model=unknown -thread_warp_size=32", [-1, 16, 64, 49152, 2147483647, 1024, 8, 32], "", 0, []], [[], [["FU", 2, [0, 1]], ["SP", 2, 0, 672, [1], 1], ["AN", 2, 0, 5], ["AN", 2, 1, 6], ["FU", 1, [0, 1]], ["SP", 1, 0, 672, [4], 1], ["AN", 1, 0, 5], ["AN", 1, 1, 6], ["PR", 1, 0, "auto_unroll_max_step$512"]]]], "r": [[9.80216e-06, 9.7987e-06, 9.78139e-06, 9.32586e-06, 9.31635e-06, 9.31822e-06, 9.32035e-06, 9.31619e-06, 9.32774e-06, 9.30294e-06], 0, 191.512, 1649344050], "v": "v0.6"}
{"i": [["[\"reduce_mean\", 14, 14, 672]", "cuda -keys=cuda,gpu -max_num_threads=1024 -model=unknown -thread_warp_size=32", [-1, 16, 64, 49152, 2147483647, 1024, 8, 32], "", 0, []], [[], [["FU", 2, [0, 1]], ["SP", 2, 0, 672, [32], 1], ["AN", 2, 0, 5], ["AN", 2, 1, 6], ["FU", 1, [0, 1]], ["SP", 1, 0, 672, [4], 1], ["AN", 1, 0, 5], ["AN", 1, 1, 6], ["PR", 1, 0, "auto_unroll_max_step$16"]]]], "r": [[9.26051e-06, 9.25358e-06, 9.2499e-06, 9.26432e-06, 9.25206e-06, 9.26487e-06, 9.07739e-06, 9.02102e-06, 9.0281e-06, 9.02797e-06], 0, 197.103, 1649344056], "v": "v0.6"}
{"i": [["[\"reduce_mean\", 14, 14, 672]", "cuda -keys=cuda,gpu -max_num_threads=1024 -model=unknown -thread_warp_size=32", [-1, 16, 64, 49152, 2147483647, 1024, 8, 32], "", 0, []], [[], [["FU", 2, [0, 1]], ["SP", 2, 0, 672, [16], 1], ["AN", 2, 0, 5], ["AN", 2, 1, 6], ["FU", 1, [0, 1]], ["SP", 1, 0, 672, [42], 1], ["AN", 1, 0, 5], ["AN", 1, 1, 6], ["PR", 1, 0, "auto_unroll_max_step$16"]]]], "r": [[9.27345e-06, 9.33061e-06, 9.27233e-06, 9.27235e-06, 9.26791e-06, 9.22267e-06, 9.22191e-06, 9.22195e-06, 9.2211e-06, 9.22236e-06], 0, 21.0148, 1649343879], "v": "v0.6"}
{"i": [["[\"reduce_mean\", 14, 14, 672]", "cuda -keys=cuda,gpu -max_num_threads=1024 -model=unknown -thread_warp_size=32", [-1, 16, 64, 49152, 2147483647, 1024, 8, 32], "", 0, []], [[], [["FU", 2, [0, 1]], ["SP", 2, 0, 672, [2], 1], ["AN", 2, 0, 5], ["AN", 2, 1, 6], ["FU", 1, [0, 1]], ["SP", 1, 0, 672, [56], 1], ["AN", 1, 0, 5], ["AN", 1, 1, 6], ["PR", 1, 0, "auto_unroll_max_step$16"]]]], "r": [[9.90675e-06, 9.91164e-06, 9.89936e-06, 9.91648e-06, 9.89344e-06, 9.89661e-06, 9.88721e-06, 9.89583e-06, 9.88992e-06, 9.88889e-06], 0, 33.364, 1649343892], "v": "v0.6"}
{"i": [["[\"reduce_mean\", 14, 14, 672]", "cuda -keys=cuda,gpu -max_num_threads=1024 -model=unknown -thread_warp_size=32", [-1, 16, 64, 49152, 2147483647, 1024, 8, 32], "", 0, []], [[], [["FU", 2, [0, 1]], ["SP", 2, 0, 672, [21], 1], ["AN", 2, 0, 5], ["AN", 2, 1, 6], ["FU", 1, [0, 1]], ["SP", 1, 0, 672, [32], 1], ["AN", 1, 0, 5], ["AN", 1, 1, 6], ["PR", 1, 0, "auto_unroll_max_step$64"]]]], "r": [[8.67879e-06, 8.6782e-06, 8.67897e-06, 8.67781e-06, 8.63831e-06, 8.53943e-06, 8.53881e-06, 8.54153e-06, 8.53974e-06, 8.60033e-06], 0, 49.2034, 1649343908], "v": "v0.6"}
{"i": [["[\"reduce_mean\", 14, 14, 672]", "cuda -keys=cuda,gpu -max_num_threads=1024 -model=unknown -thread_warp_size=32", [-1, 16, 64, 49152, 2147483647, 1024, 8, 32], "", 0, []], [[], [["FU", 2, [0, 1]], ["SP", 2, 0, 672, [16], 1], ["AN", 2, 0, 5], ["AN", 2, 1, 6], ["FU", 1, [0, 1]], ["SP", 1, 0, 672, [2], 1], ["AN", 1, 0, 5], ["AN", 1, 1, 6], ["PR", 1, 0, "auto_unroll_max_step$512"]]]], "r": [[1.39141e-05, 1.39183e-05, 1.39411e-05, 1.39208e-05, 1.39234e-05, 1.39147e-05, 1.39294e-05, 1.15019e-05, 9.27921e-06, 9.27854e-06], 0, 202.016, 1649344061], "v": "v0.6"}
{"i": [["[\"reduce_mean\", 14, 14, 672]", "cuda -keys=cuda,gpu -max_num_threads=1024 -model=unknown -thread_warp_size=32", [-1, 16, 64, 49152, 2147483647, 1024, 8, 32], "", 0, []], [[], [["FU", 2, [0, 1]], ["SP", 2, 0, 672, [8], 1], ["AN", 2, 0, 5], ["AN", 2, 1, 6], ["FU", 1, [0, 1]], ["SP", 1, 0, 672, [8], 1], ["AN", 1, 0, 5], ["AN", 1, 1, 6], ["PR", 1, 0, "auto_unroll_max_step$1024"]]]], "r": [[9.3771e-06, 9.07285e-06, 9.11256e-06, 9.05668e-06, 9.0624e-06, 9.05824e-06, 8.85809e-06, 8.78081e-06, 8.77725e-06, 8.78134e-06], 0, 202.398, 1649344066], "v": "v0.6"}
{"i": [["[\"reduce_mean\", 14, 14, 672]", "cuda -keys=cuda,gpu -max_num_threads=1024 -model=unknown -thread_warp_size=32", [-1, 16, 64, 49152, 2147483647, 1024, 8, 32], "", 0, []], [[], [["FU", 1, [2, 3]], ["SP", 2, 1, 672, [3], 1], ["AN", 2, 2, 6], ["FSP", 1, 2, 1, 1], ["AN", 1, 3, 6], ["CA", 1, 2, 1], ["FU", 2, [0, 1]], ["AN", 2, 0, 5], ["PR", 1, 0, "auto_unroll_max_step$16"]]]], "r": [[7.02514e-06, 7.03228e-06, 7.02145e-06, 7.0242e-06, 7.0307e-06, 7.56544e-06, 7.7172e-06, 7.73273e-06, 7.72208e-06, 7.72011e-06], 0, 202.798, 1649344072], "v": "v0.6"}
{"i": [["[\"reduce_mean\", 14, 14, 672]", "cuda -keys=cuda,gpu -max_num_threads=1024 -model=unknown -thread_warp_size=32", [-1, 16, 64, 49152, 2147483647, 1024, 8, 32], "", 0, []], [[], [["FU", 2, [0, 1]], ["SP", 2, 0, 672, [42], 1], ["AN", 2, 0, 5], ["AN", 2, 1, 6], ["FU", 1, [0, 1]], ["SP", 1, 0, 672, [2], 1], ["AN", 1, 0, 5], ["AN", 1, 1, 6], ["PR", 1, 0, "auto_unroll_max_step$512"]]]], "r": [[1.0404e-05, 1.04055e-05, 1.04113e-05, 9.64726e-06, 9.43932e-06, 9.43815e-06, 9.43931e-06, 9.44708e-06, 9.5872e-06, 1.04468e-05], 0, 203.195, 1649344077], "v": "v0.6"}
{"i": [["[\"reduce_mean\", 14, 14, 672]", "cuda -keys=cuda,gpu -max_num_threads=1024 -model=unknown -thread_warp_size=32", [-1, 16, 64, 49152, 2147483647, 1024, 8, 32], "", 0, []], [[], [["FU", 2, [0, 1]], ["SP", 2, 0, 672, [16], 1], ["AN", 2, 0, 5], ["AN", 2, 1, 6], ["FU", 1, [0, 1]], ["SP", 1, 0, 672, [16], 1], ["AN", 1, 0, 5], ["AN", 1, 1, 6], ["PR", 1, 0, "auto_unroll_max_step$16"]]]], "r": [[8.85001e-06, 8.95295e-06, 8.85271e-06, 8.71181e-06, 8.71343e-06, 8.70871e-06, 8.71046e-06, 8.71333e-06, 8.63252e-06, 8.59713e-06], 0, 202.951, 1649344082], "v": "v0.6"}
{"i": [["[\"reduce_mean\", 14, 14, 672]", "cuda -keys=cuda,gpu -max_num_threads=1024 -model=unknown -thread_warp_size=32", [-1, 16, 64, 49152, 2147483647, 1024, 8, 32], "", 0, []], [[], [["FU", 2, [0, 1]], ["SP", 2, 0, 672, [32], 1], ["AN", 2, 0, 5], ["AN", 2, 1, 6], ["FU", 1, [0, 1]], ["SP", 1, 0, 672, [56], 1], ["AN", 1, 0, 5], ["AN", 1, 1, 6], ["PR", 1, 0, "auto_unroll_max_step$16"]]]], "r": [[1.57515e-05, 1.57876e-05, 1.57531e-05, 1.57892e-05, 1.57473e-05, 1.57869e-05, 1.57447e-05, 1.57847e-05, 1.57444e-05, 1.57813e-05], 0, 203.107, 1649344087], "v": "v0.6"}
{"i": [["[\"reduce_mean\", 14, 14, 672]", "cuda -keys=cuda,gpu -max_num_threads=1024 -model=unknown -thread_warp_size=32", [-1, 16, 64, 49152, 2147483647, 1024, 8, 32], "", 0, []], [[], [["FU", 2, [0, 1]], ["SP", 2, 0, 672, [14], 1], ["AN", 2, 0, 5], ["AN", 2, 1, 6], ["FU", 1, [0, 1]], ["SP", 1, 0, 672, [32], 1], ["AN", 1, 0, 5], ["AN", 1, 1, 6], ["PR", 1, 0, "auto_unroll_max_step$512"]]]], "r": [[1.38736e-05, 1.38767e-05, 1.38763e-05, 1.38767e-05, 1.38762e-05, 1.38758e-05, 8.53288e-06, 8.53322e-06, 8.53337e-06, 8.53392e-06], 0, 203.79, 1649344092], "v": "v0.6"}
{"i": [["[\"reduce_mean\", 14, 14, 672]", "cuda -keys=cuda,gpu -max_num_threads=1024 -model=unknown -thread_warp_size=32", [-1, 16, 64, 49152, 2147483647, 1024, 8, 32], "", 0, []], [[], [["FU", 1, [2, 3]], ["SP", 2, 1, 672, [2], 1], ["AN", 2, 2, 6], ["FSP", 1, 2, 1, 1], ["AN", 1, 3, 6], ["CA", 1, 2, 1], ["FU", 2, [0, 1]], ["AN", 2, 0, 5], ["PR", 1, 0, "auto_unroll_max_step$0"]]]], "r": [[6.04648e-06, 5.97554e-06, 5.97724e-06, 5.9746e-06, 5.98253e-06, 5.98035e-06, 6.33363e-06, 6.54661e-06, 6.54331e-06, 6.55095e-06], 0, 206.035, 1649344098], "v": "v0.6"}
{"i": [["[\"reduce_mean\", 14, 14, 672]", "cuda -keys=cuda,gpu -max_num_threads=1024 -model=unknown -thread_warp_size=32", [-1, 16, 64, 49152, 2147483647, 1024, 8, 32], "", 0, []], [[], [["FU", 2, [0, 1]], ["SP", 2, 0, 672, [2], 1], ["AN", 2, 0, 5], ["AN", 2, 1, 6], ["FU", 1, [0, 1]], ["SP", 1, 0, 672, [1], 1], ["AN", 1, 0, 5], ["AN", 1, 1, 6], ["PR", 1, 0, "auto_unroll_max_step$0"]]]], "r": [[1.41376e-05, 1.41392e-05, 1.41394e-05, 1.41363e-05, 1.28813e-05, 1.06943e-05, 1.06873e-05, 1.06964e-05, 1.06907e-05, 1.06967e-05], 0, 205.341, 1649344102], "v": "v0.6"}
{"i": [["[\"reduce_mean\", 14, 14, 672]", "cuda -keys=cuda,gpu -max_num_threads=1024 -model=unknown -thread_warp_size=32", [-1, 16, 64, 49152, 2147483647, 1024, 8, 32], "", 0, []], [[], [["FU", 2, [0, 1]], ["SP", 2, 0, 672, [8], 1], ["AN", 2, 0, 5], ["AN", 2, 1, 6], ["FU", 1, [0, 1]], ["SP", 1, 0, 672, [4], 1], ["AN", 1, 0, 5], ["AN", 1, 1, 6], ["PR", 1, 0, "auto_unroll_max_step$64"]]]], "r": [[9.13238e-06, 9.07958e-06, 9.07917e-06, 9.07021e-06, 8.8366e-06, 8.83641e-06, 8.83655e-06, 8.83659e-06, 8.83712e-06, 8.90725e-06], 0, 205.916, 1649344108], "v": "v0.6"}
{"i": [["[\"reduce_mean\", 14, 14, 672]", "cuda -keys=cuda,gpu -max_num_threads=1024 -model=unknown -thread_warp_size=32", [-1, 16, 64, 49152, 2147483647, 1024, 8, 32], "", 0, []], [[], [["FU", 2, [0, 1]], ["SP", 2, 0, 672, [7], 1], ["AN", 2, 0, 5], ["AN", 2, 1, 6], ["FU", 1, [0, 1]], ["SP", 1, 0, 672, [8], 1], ["AN", 1, 0, 5], ["AN", 1, 1, 6], ["PR", 1, 0, "auto_unroll_max_step$16"]]]], "r": [[9.3985e-06, 9.36774e-06, 9.3675e-06, 8.78914e-06, 8.60079e-06, 8.60164e-06, 8.60496e-06, 8.60007e-06, 8.89732e-06, 9.95418e-06], 0, 205.824, 1649344113], "v": "v0.6"}
{"i": [["[\"reduce_mean\", 14, 14, 672]", "cuda -keys=cuda,gpu -max_num_threads=1024 -model=unknown -thread_warp_size=32", [-1, 16, 64, 49152, 2147483647, 1024, 8, 32], "", 0, []], [[], [["FU", 2, [0, 1]], ["SP", 2, 0, 672, [32], 1], ["AN", 2, 0, 5], ["AN", 2, 1, 6], ["FU", 1, [0, 1]], ["SP", 1, 0, 672, [21], 1], ["AN", 1, 0, 5], ["AN", 1, 1, 6], ["PR", 1, 0, "auto_unroll_max_step$64"]]]], "r": [[9.04617e-06, 8.93659e-06, 8.93746e-06, 8.93708e-06, 8.59646e-06, 8.59518e-06, 8.59604e-06, 8.59531e-06, 8.73448e-06, 9.41026e-06], 0, 205.218, 1649344118], "v": "v0.6"}
{"i": [["[\"reduce_mean\", 14, 14, 672]", "cuda -keys=cuda,gpu -max_num_threads=1024 -model=unknown -thread_warp_size=32", [-1, 16, 64, 49152, 2147483647, 1024, 8, 32], "", 0, []], [[], [["FU", 2, [0, 1]], ["SP", 2, 0, 672, [8], 1], ["AN", 2, 0, 5], ["AN", 2, 1, 6], ["FU", 1, [0, 1]], ["SP", 1, 0, 672, [32], 1], ["AN", 1, 0, 5], ["AN", 1, 1, 6], ["PR", 1, 0, "auto_unroll_max_step$512"]]]], "r": [[8.50954e-06, 8.41502e-06, 8.41511e-06, 8.41533e-06, 8.33653e-06, 8.24387e-06, 8.24352e-06, 8.24272e-06, 8.24321e-06, 8.2298e-06], 0, 206.285, 1649344124], "v": "v0.6"}
{"i": [["[\"reduce_mean\", 14, 14, 672]", "cuda -keys=cuda,gpu -max_num_threads=1024 -model=unknown -thread_warp_size=32", [-1, 16, 64, 49152, 2147483647, 1024, 8, 32], "", 0, []], [[], [["FU", 2, [0, 1]], ["SP", 2, 0, 672, [1], 1], ["AN", 2, 0, 5], ["AN", 2, 1, 6], ["FU", 1, [0, 1]], ["SP", 1, 0, 672, [48], 1], ["AN", 1, 0, 5], ["AN", 1, 1, 6], ["PR", 1, 0, "auto_unroll_max_step$0"]]]], "r": [[9.99373e-06, 9.5921e-06, 9.69815e-06, 9.61054e-06, 9.60533e-06, 9.64602e-06, 9.99948e-06, 1.00109e-05, 1.00032e-05, 1.00041e-05], 0, 206.21, 1649344129], "v": "v0.6"}
{"i": [["[\"reduce_mean\", 14, 14, 672]", "cuda -keys=cuda,gpu -max_num_threads=1024 -model=unknown -thread_warp_size=32", [-1, 16, 64, 49152, 2147483647, 1024, 8, 32], "", 0, []], [[], [["FU", 1, [2, 3]], ["SP", 2, 1, 672, [32], 1], ["AN", 2, 2, 6], ["FSP", 1, 2, 1, 1], ["AN", 1, 3, 6], ["CA", 1, 2, 1], ["FU", 2, [0, 1]], ["AN", 2, 0, 5], ["PR", 1, 0, "auto_unroll_max_step$64"]]]], "r": [[3.03401e-05, 3.03426e-05, 3.03386e-05, 3.03493e-05, 3.03516e-05, 3.03478e-05, 3.0448e-05, 3.03322e-05, 3.03382e-05, 3.0345e-05], 0, 205.701, 1649344134], "v": "v0.6"}
{"i": [["[\"reduce_mean\", 14, 14, 672]", "cuda -keys=cuda,gpu -max_num_threads=1024 -model=unknown -thread_warp_size=32", [-1, 16, 64, 49152, 2147483647, 1024, 8, 32], "", 0, []], [[], [["FU", 2, [0, 1]], ["SP", 2, 0, 672, [1], 1], ["AN", 2, 0, 5], ["AN", 2, 1, 6], ["FU", 1, [0, 1]], ["SP", 1, 0, 672, [2], 1], ["AN", 1, 0, 5], ["AN", 1, 1, 6], ["PR", 1, 0, "auto_unroll_max_step$64"]]]], "r": [[1.79756e-05, 1.79146e-05, 1.7908e-05, 1.79126e-05, 1.79863e-05, 1.79068e-05, 1.79272e-05, 1.79747e-05, 1.79055e-05, 1.79214e-05], 0, 205.603, 1649344139], "v": "v0.6"}
{"i": [["[\"reduce_mean\", 14, 14, 672]", "cuda -keys=cuda,gpu -max_num_threads=1024 -model=unknown -thread_warp_size=32", [-1, 16, 64, 49152, 2147483647, 1024, 8, 32], "", 0, []], [[], [["FU", 2, [0, 1]], ["SP", 2, 0, 672, [32], 1], ["AN", 2, 0, 5], ["AN", 2, 1, 6], ["FU", 1, [0, 1]], ["SP", 1, 0, 672, [8], 1], ["AN", 1, 0, 5], ["AN", 1, 1, 6], ["PR", 1, 0, "auto_unroll_max_step$64"]]]], "r": [[1.59324e-05, 1.58795e-05, 1.59414e-05, 1.58586e-05, 1.59239e-05, 1.58712e-05, 1.59319e-05, 1.5871e-05, 1.58638e-05, 1.59371e-05], 0, 204.883, 1649344143], "v": "v0.6"}
{"i": [["[\"reduce_mean\", 14, 14, 672]", "cuda -keys=cuda,gpu -max_num_threads=1024 -model=unknown -thread_warp_size=32", [-1, 16, 64, 49152, 2147483647, 1024, 8, 32], "", 0, []], [[], [["FU", 2, [0, 1]], ["SP", 2, 0, 672, [32], 1], ["AN", 2, 0, 5], ["AN", 2, 1, 6], ["FU", 1, [0, 1]], ["SP", 1, 0, 672, [32], 1], ["AN", 1, 0, 5], ["AN", 1, 1, 6], ["PR", 1, 0, "auto_unroll_max_step$16"]]]], "r": [[1.51471e-05, 1.52114e-05, 1.51488e-05, 1.52079e-05, 1.52088e-05, 1.51465e-05, 1.52112e-05, 1.51478e-05, 1.52144e-05, 1.51416e-05], 0, 204.155, 1649344148], "v": "v0.6"}
{"i": [["[\"reduce_mean\", 14, 14, 672]", "cuda -keys=cuda,gpu -max_num_threads=1024 -model=unknown -thread_warp_size=32", [-1, 16, 64, 49152, 2147483647, 1024, 8, 32], "", 0, []], [[], [["FU", 1, [2, 3]], ["SP", 2, 1, 672, [32], 1], ["AN", 2, 2, 6], ["FSP", 1, 2, 1, 1], ["AN", 1, 3, 6], ["CA", 1, 2, 1], ["FU", 2, [0, 1]], ["AN", 2, 0, 5], ["PR", 1, 0, "auto_unroll_max_step$16"]]]], "r": [[3.05846e-05, 3.05828e-05, 3.0583e-05, 3.05841e-05, 3.05815e-05, 3.05835e-05, 3.0696e-05, 3.05841e-05, 3.05829e-05, 3.05838e-05], 0, 204.826, 1649344153], "v": "v0.6"}
{"i": [["[\"reduce_mean\", 14, 14, 672]", "cuda -keys=cuda,gpu -max_num_threads=1024 -model=unknown -thread_warp_size=32", [-1, 16, 64, 49152, 2147483647, 1024, 8, 32], "", 0, []], [[], [["FU", 2, [0, 1]], ["SP", 2, 0, 672, [32], 1], ["AN", 2, 0, 5], ["AN", 2, 1, 6], ["FU", 1, [0, 1]], ["SP", 1, 0, 672, [32], 1], ["AN", 1, 0, 5], ["AN", 1, 1, 6], ["PR", 1, 0, "auto_unroll_max_step$0"]]]], "r": [[1.5086e-05, 1.50199e-05, 1.50699e-05, 1.49963e-05, 1.50594e-05, 1.49969e-05, 1.50616e-05, 1.50632e-05, 1.5e-05, 1.50711e-05], 0, 204.071, 1649344157], "v": "v0.6"}
{"i": [["[\"reduce_mean\", 14, 14, 672]", "cuda -keys=cuda,gpu -max_num_threads=1024 -model=unknown -thread_warp_size=32", [-1, 16, 64, 49152, 2147483647, 1024, 8, 32], "", 0, []], [[], [["FU", 2, [0, 1]], ["SP", 2, 0, 672, [1], 1], ["AN", 2, 0, 5], ["AN", 2, 1, 6], ["FU", 1, [0, 1]], ["SP", 1, 0, 672, [16], 1], ["AN", 1, 0, 5], ["AN", 1, 1, 6], ["PR", 1, 0, "auto_unroll_max_step$0"]]]], "r": [[1.62206e-05, 1.62213e-05, 1.62892e-05, 1.62212e-05, 1.62882e-05, 1.62217e-05, 1.62895e-05, 1.62228e-05, 1.6222e-05, 1.62894e-05], 0, 9.89323, 1649344177], "v": "v0.6"}
{"i": [["[\"reduce_mean\", 14, 14, 672]", "cuda -keys=cuda,gpu -max_num_threads=1024 -model=unknown -thread_warp_size=32", [-1, 16, 64, 49152, 2147483647, 1024, 8, 32], "", 0, []], [[], [["FU", 2, [0, 1]], ["SP", 2, 0, 672, [21], 1], ["AN", 2, 0, 5], ["AN", 2, 1, 6], ["FU", 1, [0, 1]], ["SP", 1, 0, 672, [2], 1], ["AN", 1, 0, 5], ["AN", 1, 1, 6], ["PR", 1, 0, "auto_unroll_max_step$64"]]]], "r": [[1.78425e-05, 1.77663e-05, 1.77764e-05, 1.7767e-05, 1.78315e-05, 1.77634e-05, 1.77699e-05, 1.78349e-05, 1.77607e-05, 1.77651e-05], 0, 14.7441, 1649344182], "v": "v0.6"}
{"i": [["[\"reduce_mean\", 14, 14, 672]", "cuda -keys=cuda,gpu -max_num_threads=1024 -model=unknown -thread_warp_size=32", [-1, 16, 64, 49152, 2147483647, 1024, 8, 32], "", 0, []], [[], [["FU", 2, [0, 1]], ["SP", 2, 0, 672, [4], 1], ["AN", 2, 0, 5], ["AN", 2, 1, 6], ["FU", 1, [0, 1]], ["SP", 1, 0, 672, [42], 1], ["AN", 1, 0, 5], ["AN", 1, 1, 6], ["PR", 1, 0, "auto_unroll_max_step$0"]]]], "r": [[1.6934e-05, 1.69394e-05, 1.70024e-05, 1.69344e-05, 1.69356e-05, 1.70062e-05, 1.69341e-05, 1.70046e-05, 1.69356e-05, 1.69395e-05], 0, 42.5805, 1649344210], "v": "v0.6"}
{"i": [["[\"reduce_mean\", 14, 14, 672]", "cuda -keys=cuda,gpu -max_num_threads=1024 -model=unknown -thread_warp_size=32", [-1, 16, 64, 49152, 2147483647, 1024, 8, 32], "", 0, []], [[], [["FU", 2, [0, 1]], ["SP", 2, 0, 672, [4], 1], ["AN", 2, 0, 5], ["AN", 2, 1, 6], ["FU", 1, [0, 1]], ["SP", 1, 0, 672, [32], 1], ["AN", 1, 0, 5], ["AN", 1, 1, 6], ["PR", 1, 0, "auto_unroll_max_step$1024"]]]], "r": [[1.55389e-05, 1.56137e-05, 1.5543e-05, 1.56063e-05, 1.55387e-05, 1.56067e-05, 1.55403e-05, 1.56066e-05, 1.56078e-05, 1.55395e-05], 0, 38.0608, 1649344205], "v": "v0.6"}
{"i": [["[\"reduce_mean\", 14, 14, 672]", "cuda -keys=cuda,gpu -max_num_threads=1024 -model=unknown -thread_warp_size=32", [-1, 16, 64, 49152, 2147483647, 1024, 8, 32], "", 0, []], [[], [["FU", 1, [2, 3]], ["SP", 2, 1, 672, [2], 1], ["AN", 2, 2, 6], ["FSP", 1, 2, 1, 1], ["AN", 1, 3, 6], ["CA", 1, 2, 1], ["FU", 2, [0, 1]], ["AN", 2, 0, 5], ["PR", 1, 0, "auto_unroll_max_step$64"]]]], "r": [[1.09161e-05, 1.09138e-05, 1.0919e-05, 1.09108e-05, 1.09182e-05, 1.09134e-05, 1.09075e-05, 1.09125e-05, 1.09177e-05, 1.09102e-05], 0, 20.1629, 1649344187], "v": "v0.6"}
{"i": [["[\"reduce_mean\", 14, 14, 672]", "cuda -keys=cuda,gpu -max_num_threads=1024 -model=unknown -thread_warp_size=32", [-1, 16, 64, 49152, 2147483647, 1024, 8, 32], "", 0, []], [[], [["FU", 2, [0, 1]], ["SP", 2, 0, 672, [2], 1], ["AN", 2, 0, 5], ["AN", 2, 1, 6], ["FU", 1, [0, 1]], ["SP", 1, 0, 672, [21], 1], ["AN", 1, 0, 5], ["AN", 1, 1, 6], ["PR", 1, 0, "auto_unroll_max_step$0"]]]], "r": [[1.59126e-05, 1.58402e-05, 1.58382e-05, 1.59134e-05, 1.58451e-05, 1.58991e-05, 1.5844e-05, 1.59156e-05, 1.58422e-05, 1.59082e-05], 0, 5.21635, 1649344172], "v": "v0.6"}
{"i": [["[\"reduce_mean\", 14, 14, 672]", "cuda -keys=cuda,gpu -max_num_threads=1024 -model=unknown -thread_warp_size=32", [-1, 16, 64, 49152, 2147483647, 1024, 8, 32], "", 0, []], [[], [["FU", 1, [2, 3]], ["SP", 2, 1, 672, [14], 1], ["AN", 2, 2, 6], ["FSP", 1, 2, 1, 1], ["AN", 1, 3, 6], ["CA", 1, 2, 1], ["FU", 2, [0, 1]], ["AN", 2, 0, 5], ["PR", 1, 0, "auto_unroll_max_step$0"]]]], "r": [[1.54417e-05, 1.54978e-05, 1.54525e-05, 1.55004e-05, 1.54324e-05, 1.55198e-05, 1.54635e-05, 1.55183e-05, 1.54477e-05, 1.55155e-05], 0, 29.2242, 1649344196], "v": "v0.6"}
{"i": [["[\"reduce_mean\", 14, 14, 672]", "cuda -keys=cuda,gpu -max_num_threads=1024 -model=unknown -thread_warp_size=32", [-1, 16, 64, 49152, 2147483647, 1024, 8, 32], "", 0, []], [[], [["FU", 2, [0, 1]], ["SP", 2, 0, 672, [16], 1], ["AN", 2, 0, 5], ["AN", 2, 1, 6], ["FU", 1, [0, 1]], ["SP", 1, 0, 672, [1], 1], ["AN", 1, 0, 5], ["AN", 1, 1, 6], ["PR", 1, 0, "auto_unroll_max_step$512"]]]], "r": [[1.99006e-05, 1.99084e-05, 1.99158e-05, 1.99101e-05, 1.99048e-05, 1.99755e-05, 1.98911e-05, 1.98796e-05, 1.98908e-05, 1.98825e-05], 0, 47.8202, 1649344215], "v": "v0.6"}
{"i": [["[\"reduce_mean\", 14, 14, 672]", "cuda -keys=cuda,gpu -max_num_threads=1024 -model=unknown -thread_warp_size=32", [-1, 16, 64, 49152, 2147483647, 1024, 8, 32], "", 0, []], [[], [["FU", 2, [0, 1]], ["SP", 2, 0, 672, [1], 1], ["AN", 2, 0, 5], ["AN", 2, 1, 6], ["FU", 1, [0, 1]], ["SP", 1, 0, 672, [7], 1], ["AN", 1, 0, 5], ["AN", 1, 1, 6], ["PR", 1, 0, "auto_unroll_max_step$64"]]]], "r": [[1.7504e-05, 1.74893e-05, 1.75661e-05, 1.74951e-05, 1.7498e-05, 1.75462e-05, 1.7498e-05, 1.74968e-05, 1.74808e-05, 1.75679e-05], 0, 70.9342, 1649344238], "v": "v0.6"}
{"i": [["[\"reduce_mean\", 14, 14, 672]", "cuda -keys=cuda,gpu -max_num_threads=1024 -model=unknown -thread_warp_size=32", [-1, 16, 64, 49152, 2147483647, 1024, 8, 32], "", 0, []], [[], [["FU", 2, [0, 1]], ["SP", 2, 0, 672, [48], 1], ["AN", 2, 0, 5], ["AN", 2, 1, 6], ["FU", 1, [0, 1]], ["SP", 1, 0, 672, [21], 1], ["AN", 1, 0, 5], ["AN", 1, 1, 6], ["PR", 1, 0, "auto_unroll_max_step$512"]]]], "r": [[1.53907e-05, 1.53186e-05, 1.53862e-05, 1.53203e-05, 1.53854e-05, 1.5313e-05, 1.53776e-05, 1.5314e-05, 1.53786e-05, 1.53097e-05], 0, 24.3727, 1649344192], "v": "v0.6"}
{"i": [["[\"reduce_mean\", 14, 14, 672]", "cuda -keys=cuda,gpu -max_num_threads=1024 -model=unknown -thread_warp_size=32", [-1, 16, 64, 49152, 2147483647, 1024, 8, 32], "", 0, []], [[], [["FU", 2, [0, 1]], ["SP", 2, 0, 672, [4], 1], ["AN", 2, 0, 5], ["AN", 2, 1, 6], ["FU", 1, [0, 1]], ["SP", 1, 0, 672, [32], 1], ["AN", 1, 0, 5], ["AN", 1, 1, 6], ["PR", 1, 0, "auto_unroll_max_step$512"]]]], "r": [[1.59036e-05, 1.59782e-05, 1.59074e-05, 1.59692e-05, 1.59038e-05, 1.59755e-05, 1.59114e-05, 1.59742e-05, 1.59138e-05, 1.59768e-05], 0, 33.3891, 1649344201], "v": "v0.6"}
{"i": [["[\"reduce_mean\", 14, 14, 672]", "cuda -keys=cuda,gpu -max_num_threads=1024 -model=unknown -thread_warp_size=32", [-1, 16, 64, 49152, 2147483647, 1024, 8, 32], "", 0, []], [[], [["FU", 2, [0, 1]], ["SP", 2, 0, 672, [2], 1], ["AN", 2, 0, 5], ["AN", 2, 1, 6], ["FU", 1, [0, 1]], ["SP", 1, 0, 672, [14], 1], ["AN", 1, 0, 5], ["AN", 1, 1, 6], ["PR", 1, 0, "auto_unroll_max_step$1024"]]]], "r": [[1.62559e-05, 1.60699e-05, 1.61382e-05, 1.60709e-05, 1.61403e-05, 1.61876e-05, 1.62524e-05, 1.618e-05, 1.62557e-05, 1.61818e-05], 0, 80.498, 1649344248], "v": "v0.6"}
{"i": [["[\"reduce_mean\", 14, 14, 672]", "cuda -keys=cuda,gpu -max_num_threads=1024 -model=unknown -thread_warp_size=32", [-1, 16, 64, 49152, 2147483647, 1024, 8, 32], "", 0, []], [[], [["FU", 2, [0, 1]], ["SP", 2, 0, 672, [6], 1], ["AN", 2, 0, 5], ["AN", 2, 1, 6], ["FU", 1, [0, 1]], ["SP", 1, 0, 672, [2], 1], ["AN", 1, 0, 5], ["AN", 1, 1, 6], ["PR", 1, 0, "auto_unroll_max_step$1024"]]]], "r": [[1.71601e-05, 1.71811e-05, 1.71687e-05, 1.71681e-05, 1.70836e-05, 1.71731e-05, 1.71904e-05, 1.71661e-05, 1.7089e-05, 1.71637e-05], 0, 65.5638, 1649344233], "v": "v0.6"}
{"i": [["[\"reduce_mean\", 14, 14, 672]", "cuda -keys=cuda,gpu -max_num_threads=1024 -model=unknown -thread_warp_size=32", [-1, 16, 64, 49152, 2147483647, 1024, 8, 32], "", 0, []], [[], [["FU", 2, [0, 1]], ["SP", 2, 0, 672, [8], 1], ["AN", 2, 0, 5], ["AN", 2, 1, 6], ["FU", 1, [0, 1]], ["SP", 1, 0, 672, [2], 1], ["AN", 1, 0, 5], ["AN", 1, 1, 6], ["PR", 1, 0, "auto_unroll_max_step$512"]]]], "r": [[1.69731e-05, 1.71509e-05, 1.71025e-05, 1.71626e-05, 1.69732e-05, 1.70959e-05, 1.7162e-05, 1.70893e-05, 1.70831e-05, 1.71564e-05], 0, 57.5115, 1649344225], "v": "v0.6"}
{"i": [["[\"reduce_mean\", 14, 14, 672]", "cuda -keys=cuda,gpu -max_num_threads=1024 -model=unknown -thread_warp_size=32", [-1, 16, 64, 49152, 2147483647, 1024, 8, 32], "", 0, []], [[], [["FU", 1, [2, 3]], ["SP", 2, 1, 672, [2], 1], ["AN", 2, 2, 6], ["FSP", 1, 2, 1, 1], ["AN", 1, 3, 6], ["CA", 1, 2, 1], ["FU", 2, [0, 1]], ["AN", 2, 0, 5], ["PR", 1, 0, "auto_unroll_max_step$16"]]]], "r": [[1.0391e-05, 1.03729e-05, 1.03869e-05, 1.0381e-05, 1.0383e-05, 1.03808e-05, 1.03812e-05, 1.03817e-05, 1.03788e-05, 1.0378e-05], 0, 75.9421, 1649344243], "v": "v0.6"}
{"i": [["[\"reduce_mean\", 14, 14, 672]", "cuda -keys=cuda,gpu -max_num_threads=1024 -model=unknown -thread_warp_size=32", [-1, 16, 64, 49152, 2147483647, 1024, 8, 32], "", 0, []], [[], [["FU", 2, [0, 1]], ["SP", 2, 0, 672, [1], 1], ["AN", 2, 0, 5], ["AN", 2, 1, 6], ["FU", 1, [0, 1]], ["SP", 1, 0, 672, [8], 1], ["AN", 1, 0, 5], ["AN", 1, 1, 6], ["PR", 1, 0, "auto_unroll_max_step$16"]]]], "r": [[1.65633e-05, 1.64868e-05, 1.65584e-05, 1.64881e-05, 1.64873e-05, 1.65607e-05, 1.64844e-05, 1.65602e-05, 1.64971e-05, 1.64904e-05], 0, 61.7467, 1649344229], "v": "v0.6"}
{"i": [["[\"reduce_mean\", 14, 14, 672]", "cuda -keys=cuda,gpu -max_num_threads=1024 -model=unknown -thread_warp_size=32", [-1, 16, 64, 49152, 2147483647, 1024, 8, 32], "", 0, []], [[], [["FU", 2, [0, 1]], ["SP", 2, 0, 672, [16], 1], ["AN", 2, 0, 5], ["AN", 2, 1, 6], ["FU", 1, [0, 1]], ["SP", 1, 0, 672, [4], 1], ["AN", 1, 0, 5], ["AN", 1, 1, 6], ["PR", 1, 0, "auto_unroll_max_step$0"]]]], "r": [[1.6545e-05, 1.64745e-05, 1.65393e-05, 1.64729e-05, 1.64781e-05, 1.65403e-05, 1.64827e-05, 1.64267e-05, 1.64786e-05, 1.64716e-05], 0, 84.9503, 1649344253], "v": "v0.6"}
{"i": [["[\"reduce_mean\", 14, 14, 672]", "cuda -keys=cuda,gpu -max_num_threads=1024 -model=unknown -thread_warp_size=32", [-1, 16, 64, 49152, 2147483647, 1024, 8, 32], "", 0, []], [[], [["FU", 2, [0, 1]], ["SP", 2, 0, 672, [6], 1], ["AN", 2, 0, 5], ["AN", 2, 1, 6], ["FU", 1, [0, 1]], ["SP", 1, 0, 672, [1], 1], ["AN", 1, 0, 5], ["AN", 1, 1, 6], ["PR", 1, 0, "auto_unroll_max_step$512"]]]], "r": [[1.94086e-05, 1.94075e-05, 1.94863e-05, 1.94137e-05, 1.50363e-05, 1.15965e-05, 1.15826e-05, 1.15849e-05, 1.15715e-05, 1.15715e-05], 0, 90.4546, 1649344258], "v": "v0.6"}
{"i": [["[\"reduce_mean\", 14, 14, 672]", "cuda -keys=cuda,gpu -max_num_threads=1024 -model=unknown -thread_warp_size=32", [-1, 16, 64, 49152, 2147483647, 1024, 8, 32], "", 0, []], [[], [["FU", 1, [2, 3]], ["SP", 2, 1, 672, [7], 1], ["AN", 2, 2, 6], ["FSP", 1, 2, 1, 1], ["AN", 1, 3, 6], ["CA", 1, 2, 1], ["FU", 2, [0, 1]], ["AN", 2, 0, 5], ["PR", 1, 0, "auto_unroll_max_step$0"]]]], "r": [[6.30531e-06, 6.30487e-06, 6.30438e-06, 6.30622e-06, 6.30465e-06, 6.32723e-06, 6.26924e-06, 6.2696e-06, 6.26963e-06, 6.27011e-06], 0, 100.494, 1649344268], "v": "v0.6"}
{"i": [["[\"reduce_mean\", 14, 14, 672]", "cuda -keys=cuda,gpu -max_num_threads=1024 -model=unknown -thread_warp_size=32", [-1, 16, 64, 49152, 2147483647, 1024, 8, 32], "", 0, []], [[], [["FU", 2, [0, 1]], ["SP", 2, 0, 672, [1], 1], ["AN", 2, 0, 5], ["AN", 2, 1, 6], ["FU", 1, [0, 1]], ["SP", 1, 0, 672, [56], 1], ["AN", 1, 0, 5], ["AN", 1, 1, 6], ["PR", 1, 0, "auto_unroll_max_step$16"]]]], "r": [[1.85504e-05, 1.84848e-05, 1.84845e-05, 1.84722e-05, 1.85485e-05, 1.84871e-05, 1.84901e-05, 1.84844e-05, 1.84791e-05, 1.8551e-05], 0, 52.5803, 1649344220], "v": "v0.6"}
{"i": [["[\"reduce_mean\", 14, 14, 672]", "cuda -keys=cuda,gpu -max_num_threads=1024 -model=unknown -thread_warp_size=32", [-1, 16, 64, 49152, 2147483647, 1024, 8, 32], "", 0, []], [[], [["FU", 2, [0, 1]], ["SP", 2, 0, 672, [56], 1], ["AN", 2, 0, 5], ["AN", 2, 1, 6], ["FU", 1, [0, 1]], ["SP", 1, 0, 672, [12], 1], ["AN", 1, 0, 5], ["AN", 1, 1, 6], ["PR", 1, 0, "auto_unroll_max_step$512"]]]], "r": [[8.63789e-06, 8.6227e-06, 8.62046e-06, 8.62182e-06, 8.62425e-06, 8.93745e-06, 8.96561e-06, 8.96628e-06, 8.96944e-06, 8.96277e-06], 0, 122.586, 1649344290], "v": "v0.6"}
{"i": [["[\"reduce_mean\", 14, 14, 672]", "cuda -keys=cuda,gpu -max_num_threads=1024 -model=unknown -thread_warp_size=32", [-1, 16, 64, 49152, 2147483647, 1024, 8, 32], "", 0, []], [[], [["FU", 2, [0, 1]], ["SP", 2, 0, 672, [32], 1], ["AN", 2, 0, 5], ["AN", 2, 1, 6], ["FU", 1, [0, 1]], ["SP", 1, 0, 672, [4], 1], ["AN", 1, 0, 5], ["AN", 1, 1, 6], ["PR", 1, 0, "auto_unroll_max_step$1024"]]]], "r": [[9.57661e-06, 9.57514e-06, 9.57418e-06, 9.57304e-06, 9.41183e-06, 9.21262e-06, 9.22169e-06, 9.21171e-06, 9.21654e-06, 9.22065e-06], 0, 144.64, 1649344312], "v": "v0.6"}
{"i": [["[\"reduce_mean\", 14, 14, 672]", "cuda -keys=cuda,gpu -max_num_threads=1024 -model=unknown -thread_warp_size=32", [-1, 16, 64, 49152, 2147483647, 1024, 8, 32], "", 0, []], [[], [["FU", 1, [2, 3]], ["SP", 2, 1, 672, [16], 1], ["AN", 2, 2, 6], ["FSP", 1, 2, 1, 1], ["AN", 1, 3, 6], ["CA", 1, 2, 1], ["FU", 2, [0, 1]], ["AN", 2, 0, 5], ["PR", 1, 0, "auto_unroll_max_step$0"]]]], "r": [[1.3831e-05, 1.436e-05, 1.46134e-05, 1.46062e-05, 1.46059e-05, 1.45872e-05, 1.44007e-05, 1.38059e-05, 1.38071e-05, 1.38085e-05], 0, 116.747, 1649344285], "v": "v0.6"}
{"i": [["[\"reduce_mean\", 14, 14, 672]", "cuda -keys=cuda,gpu -max_num_threads=1024 -model=unknown -thread_warp_size=32", [-1, 16, 64, 49152, 2147483647, 1024, 8, 32], "", 0, []], [[], [["FU", 2, [0, 1]], ["SP", 2, 0, 672, [48], 1], ["AN", 2, 0, 5], ["AN", 2, 1, 6], ["FU", 1, [0, 1]], ["SP", 1, 0, 672, [1], 1], ["AN", 1, 0, 5], ["AN", 1, 1, 6], ["PR", 1, 0, "auto_unroll_max_step$16"]]]], "r": [[1.09424e-05, 1.09386e-05, 1.09432e-05, 1.09419e-05, 1.087e-05, 1.08071e-05, 1.08055e-05, 1.08013e-05, 1.08024e-05, 1.06012e-05], 0, 95.5778, 1649344263], "v": "v0.6"}
{"i": [["[\"reduce_mean\", 14, 14, 672]", "cuda -keys=cuda,gpu -max_num_threads=1024 -model=unknown -thread_warp_size=32", [-1, 16, 64, 49152, 2147483647, 1024, 8, 32], "", 0, []], [[], [["FU", 2, [0, 1]], ["SP", 2, 0, 672, [7], 1], ["AN", 2, 0, 5], ["AN", 2, 1, 6], ["FU", 1, [0, 1]], ["SP", 1, 0, 672, [32], 1], ["AN", 1, 0, 5], ["AN", 1, 1, 6], ["PR", 1, 0, "auto_unroll_max_step$1024"]]]], "r": [[1.04572e-05, 9.55749e-06, 9.49365e-06, 9.49268e-06, 9.49543e-06, 9.49138e-06, 9.49681e-06, 9.52357e-06, 9.49192e-06, 9.48967e-06], 0, 111.082, 1649344279], "v": "v0.6"}
{"i": [["[\"reduce_mean\", 14, 14, 672]", "cuda -keys=cuda,gpu -max_num_threads=1024 -model=unknown -thread_warp_size=32", [-1, 16, 64, 49152, 2147483647, 1024, 8, 32], "", 0, []], [[], [["FU", 1, [2, 3]], ["SP", 2, 1, 672, [24], 1], ["AN", 2, 2, 6], ["FSP", 1, 2, 1, 1], ["AN", 1, 3, 6], ["CA", 1, 2, 1], ["FU", 2, [0, 1]], ["AN", 2, 0, 5], ["PR", 1, 0, "auto_unroll_max_step$0"]]]], "r": [[2.00763e-05, 2.01447e-05, 2.00772e-05, 2.00756e-05, 2.00751e-05, 2.00764e-05, 1.99944e-05, 1.95482e-05, 1.95469e-05, 1.95475e-05], 0, 133.235, 1649344301], "v": "v0.6"}
{"i": [["[\"reduce_mean\", 14, 14, 672]", "cuda -keys=cuda,gpu -max_num_threads=1024 -model=unknown -thread_warp_size=32", [-1, 16, 64, 49152, 2147483647, 1024, 8, 32], "", 0, []], [[], [["FU", 2, [0, 1]], ["SP", 2, 0, 672, [12], 1], ["AN", 2, 0, 5], ["AN", 2, 1, 6], ["FU", 1, [0, 1]], ["SP", 1, 0, 672, [1], 1], ["AN", 1, 0, 5], ["AN", 1, 1, 6], ["PR", 1, 0, "auto_unroll_max_step$0"]]]], "r": [[1.17501e-05, 1.12538e-05, 1.11886e-05, 1.11864e-05, 1.11789e-05, 1.11879e-05, 1.10756e-05, 1.07625e-05, 1.07374e-05, 1.07433e-05], 0, 105.934, 1649344274], "v": "v0.6"}
{"i": [["[\"reduce_mean\", 14, 14, 672]", "cuda -keys=cuda,gpu -max_num_threads=1024 -model=unknown -thread_warp_size=32", [-1, 16, 64, 49152, 2147483647, 1024, 8, 32], "", 0, []], [[], [["FU", 2, [0, 1]], ["SP", 2, 0, 672, [2], 1], ["AN", 2, 0, 5], ["AN", 2, 1, 6], ["FU", 1, [0, 1]], ["SP", 1, 0, 672, [1], 1], ["AN", 1, 0, 5], ["AN", 1, 1, 6], ["PR", 1, 0, "auto_unroll_max_step$512"]]]], "r": [[1.3257e-05, 1.13446e-05, 1.1044e-05, 1.10416e-05, 1.10443e-05, 1.10484e-05, 1.1046e-05, 1.15292e-05, 1.16451e-05, 1.16294e-05], 0, 170.276, 1649344338], "v": "v0.6"}
{"i": [["[\"reduce_mean\", 14, 14, 672]", "cuda -keys=cuda,gpu -max_num_threads=1024 -model=unknown -thread_warp_size=32", [-1, 16, 64, 49152, 2147483647, 1024, 8, 32], "", 0, []], [[], [["FU", 2, [0, 1]], ["SP", 2, 0, 672, [8], 1], ["AN", 2, 0, 5], ["AN", 2, 1, 6], ["FU", 1, [0, 1]], ["SP", 1, 0, 672, [16], 1], ["AN", 1, 0, 5], ["AN", 1, 1, 6], ["PR", 1, 0, "auto_unroll_max_step$0"]]]], "r": [[9.29574e-06, 9.29587e-06, 9.2947e-06, 8.9656e-06, 8.58483e-06, 8.58516e-06, 8.58303e-06, 8.58742e-06, 8.58556e-06, 8.40704e-06], 0, 127.665, 1649344296], "v": "v0.6"}
{"i": [["[\"reduce_mean\", 14, 14, 672]", "cuda -keys=cuda,gpu -max_num_threads=1024 -model=unknown -thread_warp_size=32", [-1, 16, 64, 49152, 2147483647, 1024, 8, 32], "", 0, []], [[], [["FU", 1, [2, 3]], ["SP", 2, 1, 672, [48], 1], ["AN", 2, 2, 6], ["FSP", 1, 2, 1, 1], ["AN", 1, 3, 6], ["CA", 1, 2, 1], ["FU", 2, [0, 1]], ["AN", 2, 0, 5], ["PR", 1, 0, "auto_unroll_max_step$16"]]]], "r": [[3.1562e-05, 2.71487e-05, 2.71519e-05, 2.71549e-05, 2.71455e-05, 2.71503e-05, 2.73551e-05, 2.80086e-05, 2.80085e-05, 2.8009e-05], 0, 149.21, 1649344317], "v": "v0.6"}
{"i": [["[\"reduce_mean\", 14, 14, 672]", "cuda -keys=cuda,gpu -max_num_threads=1024 -model=unknown -thread_warp_size=32", [-1, 16, 64, 49152, 2147483647, 1024, 8, 32], "", 0, []], [[], [["FU", 1, [2, 3]], ["SP", 2, 1, 672, [8], 1], ["AN", 2, 2, 6], ["FSP", 1, 2, 1, 1], ["AN", 1, 3, 6], ["CA", 1, 2, 1], ["FU", 2, [0, 1]], ["AN", 2, 0, 5], ["PR", 1, 0, "auto_unroll_max_step$16"]]]], "r": [[8.63219e-06, 8.61127e-06, 8.58695e-06, 8.58737e-06, 8.58688e-06, 8.58698e-06, 8.84968e-06, 8.91908e-06, 8.9192e-06, 8.91936e-06], 0, 138.842, 1649344307], "v": "v0.6"}
{"i": [["[\"reduce_mean\", 14, 14, 672]", "cuda -keys=cuda,gpu -max_num_threads=1024 -model=unknown -thread_warp_size=32", [-1, 16, 64, 49152, 2147483647, 1024, 8, 32], "", 0, []], [[], [["FU", 2, [0, 1]], ["SP", 2, 0, 672, [8], 1], ["AN", 2, 0, 5], ["AN", 2, 1, 6], ["FU", 1, [0, 1]], ["SP", 1, 0, 672, [4], 1], ["AN", 1, 0, 5], ["AN", 1, 1, 6], ["PR", 1, 0, "auto_unroll_max_step$512"]]]], "r": [[1.29505e-05, 1.29571e-05, 1.29557e-05, 1.2962e-05, 1.2964e-05, 1.28942e-05, 8.93173e-06, 8.93459e-06, 8.93712e-06, 8.94434e-06], 0, 160.033, 1649344328], "v": "v0.6"}
{"i": [["[\"reduce_mean\", 14, 14, 672]", "cuda -keys=cuda,gpu -max_num_threads=1024 -model=unknown -thread_warp_size=32", [-1, 16, 64, 49152, 2147483647, 1024, 8, 32], "", 0, []], [[], [["FU", 2, [0, 1]], ["SP", 2, 0, 672, [1], 1], ["AN", 2, 0, 5], ["AN", 2, 1, 6], ["FU", 1, [0, 1]], ["SP", 1, 0, 672, [2], 1], ["AN", 1, 0, 5], ["AN", 1, 1, 6], ["PR", 1, 0, "auto_unroll_max_step$512"]]]], "r": [[1.04087e-05, 1.01383e-05, 1.01517e-05, 1.01547e-05, 1.0157e-05, 1.01631e-05, 1.03059e-05, 1.02852e-05, 1.02806e-05, 1.02793e-05], 0, 175.622, 1649344344], "v": "v0.6"}
{"i": [["[\"reduce_mean\", 14, 14, 672]", "cuda -keys=cuda,gpu -max_num_threads=1024 -model=unknown -thread_warp_size=32", [-1, 16, 64, 49152, 2147483647, 1024, 8, 32], "", 0, []], [[], [["FU", 2, [0, 1]], ["SP", 2, 0, 672, [1], 1], ["AN", 2, 0, 5], ["AN", 2, 1, 6], ["FU", 1, [0, 1]], ["SP", 1, 0, 672, [56], 1], ["AN", 1, 0, 5], ["AN", 1, 1, 6], ["PR", 1, 0, "auto_unroll_max_step$512"]]]], "r": [[1.02905e-05, 1.02947e-05, 1.02975e-05, 1.02907e-05, 1.02988e-05, 9.62651e-06, 9.62265e-06, 9.61756e-06, 9.63229e-06, 1.09987e-05], 0, 185.535, 1649344354], "v": "v0.6"}
{"i": [["[\"reduce_mean\", 14, 14, 672]", "cuda -keys=cuda,gpu -max_num_threads=1024 -model=unknown -thread_warp_size=32", [-1, 16, 64, 49152, 2147483647, 1024, 8, 32], "", 0, []], [[], [["FU", 2, [0, 1]], ["SP", 2, 0, 672, [1], 1], ["AN", 2, 0, 5], ["AN", 2, 1, 6], ["FU", 1, [0, 1]], ["SP", 1, 0, 672, [12], 1], ["AN", 1, 0, 5], ["AN", 1, 1, 6], ["PR", 1, 0, "auto_unroll_max_step$0"]]]], "r": [[9.17208e-06, 9.17264e-06, 9.17087e-06, 9.17107e-06, 9.17315e-06, 9.46247e-06, 9.42793e-06, 9.42845e-06, 9.43032e-06, 9.42901e-06], 0, 154.515, 1649344323], "v": "v0.6"}
{"i": [["[\"reduce_mean\", 14, 14, 672]", "cuda -keys=cuda,gpu -max_num_threads=1024 -model=unknown -thread_warp_size=32", [-1, 16, 64, 49152, 2147483647, 1024, 8, 32], "", 0, []], [[], [["FU", 2, [0, 1]], ["SP", 2, 0, 672, [2], 1], ["AN", 2, 0, 5], ["AN", 2, 1, 6], ["FU", 1, [0, 1]], ["SP", 1, 0, 672, [24], 1], ["AN", 1, 0, 5], ["AN", 1, 1, 6], ["PR", 1, 0, "auto_unroll_max_step$1024"]]]], "r": [[1.51006e-05, 1.5053e-05, 1.50972e-05, 1.51019e-05, 1.51033e-05, 1.50479e-05, 1.51027e-05, 1.51016e-05, 1.51052e-05, 1.50447e-05], 0, 190.608, 1649344359], "v": "v0.6"}
