python/models/efficientnet/kernel_configs/efficient_se_module_sigmoid_32_1.log
{"i": [["[\"se_module_sigmoid\", 32, 1]", "cuda -keys=cuda,gpu -max_num_threads=1024 -model=unknown -thread_warp_size=32", [-1, 16, 64, 49152, 2147483647, 1024, 8, 32], "", 0, []], [[], [["FU", 1, [0, 1]], ["AN", 1, 0, 6]]]], "r": [[3.49396e-06, 3.48707e-06, 3.53611e-06], 0, 0.574254, 1681240460], "v": "v0.6"}
{"i": [["[\"se_module_sigmoid\", 32, 1]", "cuda -keys=cuda,gpu -max_num_threads=1024 -model=unknown -thread_warp_size=32", [-1, 16, 64, 49152, 2147483647, 1024, 8, 32], "", 0, []], [[], [["FU", 1, [0, 1]], ["AN", 1, 0, 6]]]], "r": [[3.69206e-06, 3.58673e-06, 3.54796e-06], 0, 0.609349, 1681269301], "v": "v0.6"}
{"i": [["[\"se_module_sigmoid\", 32, 1]", "cuda -keys=cuda,gpu -max_num_threads=1024 -model=unknown -thread_warp_size=32", [-1, 16, 64, 49152, 2147483647, 1024, 8, 32], "", 0, []], [[], [["FU", 1, [0, 1]], ["AN", 1, 0, 6]]]], "r": [[6.52104e-06, 6.51278e-06, 6.54068e-06], 0, 0.628448, 1681269837], "v": "v0.6"}
