python/models/efficientnet/kernel_configs/efficient_fused_pointwise_conv_bias_add_sigmoid_mul_14_14_20_480_1.log
{"i": [["[\"fused_pointwise_conv_bias_add_sigmoid_mul\", 14, 14, 20, 480, 1]", "cuda -keys=cuda,gpu -max_num_threads=1024 -model=unknown -thread_warp_size=32", [-1, 16, 64, 49152, 2147483647, 1024, 8, 32], "", 0, []], [[], [["CI", 5], ["CHW", 3, "local"], ["SP", 3, 0, 1, [1, 1, 1, 1], 1], ["SP", 3, 5, 480, [1, 48, 2, 5], 1], ["SP", 3, 10, 20, [2, 10], 1], ["RE", 3, [0, 5, 1, 6, 2, 7, 10, 11, 3, 8, 12, 4, 9]], ["FSP", 4, 0, 2, 3], ["FSP", 4, 4, 3, 3], ["RE", 4, [0, 4, 1, 5, 2, 6, 3, 7]], ["CA", 3, 4, 5], ["CHR", 2, "shared", [3]], ["CA", 3, 4, 6], ["CHR", 1, "shared", [4]], ["CA", 2, 5, 6], ["FU", 9, [0, 1, 2, 3]], ["SP", 9, 0, 94080, [32], 1], ["AN", 9, 0, 5], ["AN", 9, 1, 6], ["FU", 6, [0, 1]], ["AN", 6, 0, 5], ["FU", 6, [1, 2]], ["AN", 6, 1, 4], ["FU", 6, [2, 3]], ["AN", 6, 2, 6], ["FU", 4, [0, 1]], ["SP", 4, 0, 40, [1], 1], ["AN", 4, 1, 2], ["FFSP", 4, 0, [3, 2], 1, 1], ["AN", 4, 1, 6], ["FU", 2, [0, 1]], ["SP", 2, 0, 20, [1], 1], ["AN", 2, 1, 2], ["FFSP", 2, 0, [3, 2], 1, 1], ["AN", 2, 1, 6], ["PR", 5, 0, "auto_unroll_max_step$64"]]]], "r": [[1.67711e-05, 1.6768e-05, 1.67698e-05], 0, 7.60199, 1662030623], "v": "v0.6"}
{"i": [["[\"fused_pointwise_conv_bias_add_sigmoid_mul\", 14, 14, 20, 480, 1]", "cuda -keys=cuda,gpu -max_num_threads=1024 -model=unknown -thread_warp_size=32", [-1, 16, 64, 49152, 2147483647, 1024, 8, 32], "", 0, []], [[], [["CI", 5], ["CHW", 3, "local"], ["SP", 3, 0, 1, [1, 1, 1, 1], 1], ["SP", 3, 5, 480, [1, 40, 2, 2], 1], ["SP", 3, 10, 20, [10, 1], 1], ["RE", 3, [0, 5, 1, 6, 2, 7, 10, 11, 3, 8, 12, 4, 9]], ["FSP", 4, 0, 2, 3], ["FSP", 4, 4, 3, 3], ["RE", 4, [0, 4, 1, 5, 2, 6, 3, 7]], ["CA", 3, 4, 5], ["CHR", 2, "shared", [3]], ["CA", 3, 4, 6], ["CHR", 1, "shared", [4]], ["CA", 2, 5, 6], ["FU", 9, [0, 1, 2, 3]], ["SP", 9, 0, 94080, [4], 1], ["AN", 9, 0, 5], ["AN", 9, 1, 6], ["FU", 6, [0, 1]], ["AN", 6, 0, 5], ["FU", 6, [1, 2]], ["AN", 6, 1, 4], ["FU", 6, [2, 3]], ["AN", 6, 2, 6], ["FU", 4, [0, 1]], ["SP", 4, 0, 4, [1], 1], ["AN", 4, 1, 2], ["FFSP", 4, 0, [3, 2], 1, 1], ["AN", 4, 1, 6], ["FU", 2, [0, 1]], ["SP", 2, 0, 1, [1], 1], ["AN", 2, 1, 2], ["FFSP", 2, 0, [3, 2], 1, 1], ["AN", 2, 1, 6], ["PR", 5, 0, "auto_unroll_max_step$512"]]]], "r": [[4.39725e-05, 4.39656e-05, 4.39839e-05], 0, 3.75674, 1662030619], "v": "v0.6"}
{"i": [["[\"fused_pointwise_conv_bias_add_sigmoid_mul\", 14, 14, 20, 480, 1]", "cuda -keys=cuda,gpu -max_num_threads=1024 -model=unknown -thread_warp_size=32", [-1, 16, 64, 49152, 2147483647, 1024, 8, 32], "", 0, []], [[], [["CI", 5], ["CHW", 3, "local"], ["SP", 3, 0, 1, [1, 1, 1, 1], 1], ["SP", 3, 5, 480, [8, 5, 6, 2], 1], ["SP", 3, 10, 20, [2, 2], 1], ["RE", 3, [0, 5, 1, 6, 2, 7, 10, 11, 3, 8, 12, 4, 9]], ["FSP", 4, 0, 2, 3], ["FSP", 4, 4, 3, 3], ["RE", 4, [0, 4, 1, 5, 2, 6, 3, 7]], ["CA", 3, 4, 5], ["CHR", 2, "shared", [3]], ["CA", 3, 4, 6], ["CHR", 1, "shared", [4]], ["CA", 2, 5, 6], ["FU", 9, [0, 1, 2, 3]], ["SP", 9, 0, 94080, [1], 1], ["AN", 9, 0, 5], ["AN", 9, 1, 6], ["FU", 6, [0, 1]], ["AN", 6, 0, 5], ["FU", 6, [1, 2]], ["AN", 6, 1, 4], ["FU", 6, [2, 3]], ["AN", 6, 2, 6], ["FU", 4, [0, 1]], ["SP", 4, 0, 48, [1], 1], ["AN", 4, 1, 2], ["FFSP", 4, 0, [3, 2], 1, 1], ["AN", 4, 1, 6], ["FU", 2, [0, 1]], ["SP", 2, 0, 4, [2], 1], ["AN", 2, 1, 2], ["FFSP", 2, 0, [3, 2], 1, 1], ["AN", 2, 1, 6], ["PR", 5, 0, "auto_unroll_max_step$64"]]]], "r": [[0.000193642, 0.000193633, 0.000193632], 0, 8.2642, 1662030623], "v": "v0.6"}
{"i": [["[\"fused_pointwise_conv_bias_add_sigmoid_mul\", 14, 14, 20, 480, 1]", "cuda -keys=cuda,gpu -max_num_threads=1024 -model=unknown -thread_warp_size=32", [-1, 16, 64, 49152, 2147483647, 1024, 8, 32], "", 0, []], [[], [["CI", 5], ["CHW", 3, "local"], ["SP", 3, 0, 1, [1, 1, 1, 1], 1], ["SP", 3, 5, 480, [1, 48, 5, 1], 1], ["SP", 3, 10, 20, [1, 2], 1], ["RE", 3, [0, 5, 1, 6, 2, 7, 10, 11, 3, 8, 12, 4, 9]], ["FSP", 4, 0, 2, 3], ["FSP", 4, 4, 3, 3], ["RE", 4, [0, 4, 1, 5, 2, 6, 3, 7]], ["CA", 3, 4, 5], ["CHR", 2, "shared", [3]], ["CA", 3, 4, 6], ["CHR", 1, "shared", [4]], ["CA", 2, 5, 6], ["FU", 9, [0, 1, 2, 3]], ["SP", 9, 0, 94080, [4], 1], ["AN", 9, 0, 5], ["AN", 9, 1, 6], ["FU", 6, [0, 1]], ["AN", 6, 0, 5], ["FU", 6, [1, 2]], ["AN", 6, 1, 4], ["FU", 6, [2, 3]], ["AN", 6, 2, 6], ["FU", 4, [0, 1]], ["SP", 4, 0, 20, [1], 1], ["AN", 4, 1, 2], ["FFSP", 4, 0, [3, 2], 1, 1], ["AN", 4, 1, 6], ["FU", 2, [0, 1]], ["SP", 2, 0, 4, [1], 1], ["AN", 2, 1, 2], ["FFSP", 2, 0, [3, 2], 1, 1], ["AN", 2, 1, 6], ["PR", 5, 0, "auto_unroll_max_step$0"]]]], "r": [[5.52194e-05, 5.52345e-05, 5.52327e-05], 0, 2.43909, 1662030618], "v": "v0.6"}
{"i": [["[\"fused_pointwise_conv_bias_add_sigmoid_mul\", 14, 14, 20, 480, 1]", "cuda -keys=cuda,gpu -max_num_threads=1024 -model=unknown -thread_warp_size=32", [-1, 16, 64, 49152, 2147483647, 1024, 8, 32], "", 0, []], [[], [["CI", 5], ["CHW", 3, "local"], ["SP", 3, 0, 1, [1, 1, 1, 1], 1], ["SP", 3, 5, 480, [1, 40, 2, 2], 1], ["SP", 3, 10, 20, [1, 1], 1], ["RE", 3, [0, 5, 1, 6, 2, 7, 10, 11, 3, 8, 12, 4, 9]], ["FSP", 4, 0, 2, 3], ["FSP", 4, 4, 3, 3], ["RE", 4, [0, 4, 1, 5, 2, 6, 3, 7]], ["CA", 3, 4, 5], ["CHR", 2, "shared", [3]], ["CA", 3, 4, 6], ["CHR", 1, "shared", [4]], ["CA", 2, 5, 6], ["FU", 9, [0, 1, 2, 3]], ["SP", 9, 0, 94080, [1], 1], ["AN", 9, 0, 5], ["AN", 9, 1, 6], ["FU", 6, [0, 1]], ["AN", 6, 0, 5], ["FU", 6, [1, 2]], ["AN", 6, 1, 4], ["FU", 6, [2, 3]], ["AN", 6, 2, 6], ["FU", 4, [0, 1]], ["SP", 4, 0, 4, [1], 1], ["AN", 4, 1, 2], ["FFSP", 4, 0, [3, 2], 1, 1], ["AN", 4, 1, 6], ["FU", 2, [0, 1]], ["SP", 2, 0, 1, [1], 1], ["AN", 2, 1, 2], ["FFSP", 2, 0, [3, 2], 1, 1], ["AN", 2, 1, 6], ["PR", 5, 0, "auto_unroll_max_step$512"]]]], "r": [[0.000139315, 0.000139313, 0.00013931], 0, 3.05728, 1662030618], "v": "v0.6"}
{"i": [["[\"fused_pointwise_conv_bias_add_sigmoid_mul\", 14, 14, 20, 480, 1]", "cuda -keys=cuda,gpu -max_num_threads=1024 -model=unknown -thread_warp_size=32", [-1, 16, 64, 49152, 2147483647, 1024, 8, 32], "", 0, []], [[], [["CI", 5], ["CHW", 3, "local"], ["SP", 3, 0, 1, [1, 1, 1, 1], 1], ["SP", 3, 5, 480, [1, 40, 6, 2], 1], ["SP", 3, 10, 20, [2, 2], 1], ["RE", 3, [0, 5, 1, 6, 2, 7, 10, 11, 3, 8, 12, 4, 9]], ["FSP", 4, 0, 2, 3], ["FSP", 4, 4, 3, 3], ["RE", 4, [0, 4, 1, 5, 2, 6, 3, 7]], ["CA", 3, 4, 5], ["CHR", 2, "shared", [3]], ["CA", 3, 4, 6], ["CHR", 1, "shared", [4]], ["CA", 2, 5, 6], ["FU", 9, [0, 1, 2, 3]], ["SP", 9, 0, 94080, [64], 1], ["AN", 9, 0, 5], ["AN", 9, 1, 6], ["FU", 6, [0, 1]], ["AN", 6, 0, 5], ["FU", 6, [1, 2]], ["AN", 6, 1, 4], ["FU", 6, [2, 3]], ["AN", 6, 2, 6], ["FU", 4, [0, 1]], ["SP", 4, 0, 48, [1], 1], ["AN", 4, 1, 2], ["FFSP", 4, 0, [3, 2], 1, 1], ["AN", 4, 1, 6], ["FU", 2, [0, 1]], ["SP", 2, 0, 4, [4], 1], ["AN", 2, 1, 2], ["FFSP", 2, 0, [3, 2], 1, 1], ["AN", 2, 1, 6], ["PR", 5, 0, "auto_unroll_max_step$64"]]]], "r": [[2.0358e-05, 2.03595e-05, 2.03602e-05], 0, 4.74445, 1662030620], "v": "v0.6"}
{"i": [["[\"fused_pointwise_conv_bias_add_sigmoid_mul\", 14, 14, 20, 480, 1]", "cuda -keys=cuda,gpu -max_num_threads=1024 -model=unknown -thread_warp_size=32", [-1, 16, 64, 49152, 2147483647, 1024, 8, 32], "", 0, []], [[], [["CI", 5], ["CHW", 3, "local"], ["SP", 3, 0, 1, [1, 1, 1, 1], 1], ["SP", 3, 5, 480, [6, 80, 1, 1], 1], ["SP", 3, 10, 20, [5, 2], 1], ["RE", 3, [0, 5, 1, 6, 2, 7, 10, 11, 3, 8, 12, 4, 9]], ["FSP", 4, 0, 2, 3], ["FSP", 4, 4, 3, 3], ["RE", 4, [0, 4, 1, 5, 2, 6, 3, 7]], ["CA", 3, 4, 5], ["CHR", 2, "shared", [3]], ["CA", 3, 4, 6], ["CHR", 1, "shared", [4]], ["CA", 2, 5, 6], ["FU", 9, [0, 1, 2, 3]], ["SP", 9, 0, 94080, [32], 1], ["AN", 9, 0, 5], ["AN", 9, 1, 6], ["FU", 6, [0, 1]], ["AN", 6, 0, 5], ["FU", 6, [1, 2]], ["AN", 6, 1, 4], ["FU", 6, [2, 3]], ["AN", 6, 2, 6], ["FU", 4, [0, 1]], ["SP", 4, 0, 20, [1], 1], ["AN", 4, 1, 2], ["FFSP", 4, 0, [3, 2], 1, 1], ["AN", 4, 1, 6], ["FU", 2, [0, 1]], ["SP", 2, 0, 20, [2], 1], ["AN", 2, 1, 2], ["FFSP", 2, 0, [3, 2], 1, 1], ["AN", 2, 1, 6], ["PR", 5, 0, "auto_unroll_max_step$0"]]]], "r": [[1.59347e-05, 1.59337e-05, 1.59253e-05], 0, 5.34565, 1662030621], "v": "v0.6"}
{"i": [["[\"fused_pointwise_conv_bias_add_sigmoid_mul\", 14, 14, 20, 480, 1]", "cuda -keys=cuda,gpu -max_num_threads=1024 -model=unknown -thread_warp_size=32", [-1, 16, 64, 49152, 2147483647, 1024, 8, 32], "", 0, []], [[], [["CI", 5], ["CHW", 3, "local"], ["SP", 3, 0, 1, [1, 1, 1, 1], 1], ["SP", 3, 5, 480, [1, 120, 4, 1], 1], ["SP", 3, 10, 20, [4, 5], 1], ["RE", 3, [0, 5, 1, 6, 2, 7, 10, 11, 3, 8, 12, 4, 9]], ["FSP", 4, 0, 2, 3], ["FSP", 4, 4, 3, 3], ["RE", 4, [0, 4, 1, 5, 2, 6, 3, 7]], ["CA", 3, 4, 5], ["CHR", 2, "shared", [3]], ["CA", 3, 4, 6], ["CHR", 1, "shared", [4]], ["CA", 2, 5, 6], ["FU", 9, [0, 1, 2, 3]], ["SP", 9, 0, 94080, [4], 1], ["AN", 9, 0, 5], ["AN", 9, 1, 6], ["FU", 6, [0, 1]], ["AN", 6, 0, 5], ["FU", 6, [1, 2]], ["AN", 6, 1, 4], ["FU", 6, [2, 3]], ["AN", 6, 2, 6], ["FU", 4, [0, 1]], ["SP", 4, 0, 80, [1], 1], ["AN", 4, 1, 2], ["FFSP", 4, 0, [3, 2], 1, 1], ["AN", 4, 1, 6], ["FU", 2, [0, 1]], ["SP", 2, 0, 20, [1], 1], ["AN", 2, 1, 2], ["FFSP", 2, 0, [3, 2], 1, 1], ["AN", 2, 1, 6], ["PR", 5, 0, "auto_unroll_max_step$64"]]]], "r": [[4.25194e-05, 4.24434e-05, 4.24441e-05], 0, 1.66518, 1662030617], "v": "v0.6"}
{"i": [["[\"fused_pointwise_conv_bias_add_sigmoid_mul\", 14, 14, 20, 480, 1]", "cuda -keys=cuda,gpu -max_num_threads=1024 -model=unknown -thread_warp_size=32", [-1, 16, 64, 49152, 2147483647, 1024, 8, 32], "", 0, []], [[], [["CI", 5], ["CHW", 3, "local"], ["SP", 3, 0, 1, [1, 1, 1, 1], 1], ["SP", 3, 5, 480, [1, 4, 5, 24], 1], ["SP", 3, 10, 20, [1, 4], 1], ["RE", 3, [0, 5, 1, 6, 2, 7, 10, 11, 3, 8, 12, 4, 9]], ["FSP", 4, 0, 2, 3], ["FSP", 4, 4, 3, 3], ["RE", 4, [0, 4, 1, 5, 2, 6, 3, 7]], ["CA", 3, 4, 5], ["CHR", 2, "shared", [3]], ["CA", 3, 4, 6], ["CHR", 1, "shared", [4]], ["CA", 2, 5, 6], ["FU", 9, [0, 1, 2, 3]], ["SP", 9, 0, 94080, [32], 1], ["AN", 9, 0, 5], ["AN", 9, 1, 6], ["FU", 6, [0, 1]], ["AN", 6, 0, 5], ["FU", 6, [1, 2]], ["AN", 6, 1, 4], ["FU", 6, [2, 3]], ["AN", 6, 2, 6], ["FU", 4, [0, 1]], ["SP", 4, 0, 40, [1], 1], ["AN", 4, 1, 2], ["FFSP", 4, 0, [3, 2], 1, 1], ["AN", 4, 1, 6], ["FU", 2, [0, 1]], ["SP", 2, 0, 4, [2], 1], ["AN", 2, 1, 2], ["FFSP", 2, 0, [3, 2], 1, 1], ["AN", 2, 1, 6], ["PR", 5, 0, "auto_unroll_max_step$16"]]]], "r": [[6.40003e-05, 6.39881e-05, 6.39725e-05], 0, 9.92289, 1662030626], "v": "v0.6"}
{"i": [["[\"fused_pointwise_conv_bias_add_sigmoid_mul\", 14, 14, 20, 480, 1]", "cuda -keys=cuda,gpu -max_num_threads=1024 -model=unknown -thread_warp_size=32", [-1, 16, 64, 49152, 2147483647, 1024, 8, 32], "", 0, []], [[], [["CI", 5], ["CHW", 3, "local"], ["SP", 3, 0, 1, [1, 1, 1, 1], 1], ["SP", 3, 5, 480, [4, 60, 2, 1], 1], ["SP", 3, 10, 20, [1, 5], 1], ["RE", 3, [0, 5, 1, 6, 2, 7, 10, 11, 3, 8, 12, 4, 9]], ["FSP", 4, 0, 2, 3], ["FSP", 4, 4, 3, 3], ["RE", 4, [0, 4, 1, 5, 2, 6, 3, 7]], ["CA", 3, 4, 5], ["CHR", 2, "shared", [3]], ["CA", 3, 4, 6], ["CHR", 1, "shared", [4]], ["CA", 2, 5, 6], ["FU", 9, [0, 1, 2, 3]], ["SP", 9, 0, 94080, [32], 1], ["AN", 9, 0, 5], ["AN", 9, 1, 6], ["FU", 6, [0, 1]], ["AN", 6, 0, 5], ["FU", 6, [1, 2]], ["AN", 6, 1, 4], ["FU", 6, [2, 3]], ["AN", 6, 2, 6], ["FU", 4, [0, 1]], ["SP", 4, 0, 40, [1], 1], ["AN", 4, 1, 2], ["FFSP", 4, 0, [3, 2], 1, 1], ["AN", 4, 1, 6], ["FU", 2, [0, 1]], ["SP", 2, 0, 20, [1], 1], ["AN", 2, 1, 2], ["FFSP", 2, 0, [3, 2], 1, 1], ["AN", 2, 1, 6], ["PR", 5, 0, "auto_unroll_max_step$16"]]]], "r": [[1.785e-05, 1.78474e-05, 1.78484e-05], 0, 4.92064, 1662030620], "v": "v0.6"}
{"i": [["[\"fused_pointwise_conv_bias_add_sigmoid_mul\", 14, 14, 20, 480, 1]", "cuda -keys=cuda,gpu -max_num_threads=1024 -model=unknown -thread_warp_size=32", [-1, 16, 64, 49152, 2147483647, 1024, 8, 32], "", 0, []], [[], [["CI", 5], ["CHW", 3, "local"], ["SP", 3, 0, 1, [1, 1, 1, 1], 1], ["SP", 3, 5, 480, [1, 40, 1, 2], 1], ["SP", 3, 10, 20, [1, 1], 1], ["RE", 3, [0, 5, 1, 6, 2, 7, 10, 11, 3, 8, 12, 4, 9]], ["FSP", 4, 0, 2, 3], ["FSP", 4, 4, 3, 3], ["RE", 4, [0, 4, 1, 5, 2, 6, 3, 7]], ["CA", 3, 4, 5], ["CHR", 2, "shared", [3]], ["CA", 3, 4, 6], ["CHR", 1, "shared", [4]], ["CA", 2, 5, 6], ["FU", 9, [0, 1, 2, 3]], ["SP", 9, 0, 94080, [32], 1], ["AN", 9, 0, 5], ["AN", 9, 1, 6], ["FU", 6, [0, 1]], ["AN", 6, 0, 5], ["FU", 6, [1, 2]], ["AN", 6, 1, 4], ["FU", 6, [2, 3]], ["AN", 6, 2, 6], ["FU", 4, [0, 1]], ["SP", 4, 0, 40, [1], 1], ["AN", 4, 1, 2], ["FFSP", 4, 0, [3, 2], 1, 1], ["AN", 4, 1, 6], ["FU", 2, [0, 1]], ["SP", 2, 0, 20, [1], 1], ["AN", 2, 1, 2], ["FFSP", 2, 0, [3, 2], 1, 1], ["AN", 2, 1, 6], ["PR", 5, 0, "auto_unroll_max_step$1024"]]]], "r": [[1.63852e-05, 1.63726e-05, 1.63812e-05], 0, 6.55675, 1662030622], "v": "v0.6"}
{"i": [["[\"fused_pointwise_conv_bias_add_sigmoid_mul\", 14, 14, 20, 480, 1]", "cuda -keys=cuda,gpu -max_num_threads=1024 -model=unknown -thread_warp_size=32", [-1, 16, 64, 49152, 2147483647, 1024, 8, 32], "", 0, []], [[], [["CI", 5], ["CHW", 3, "local"], ["SP", 3, 0, 1, [1, 1, 1, 1], 1], ["SP", 3, 5, 480, [3, 80, 1, 2], 1], ["SP", 3, 10, 20, [5, 1], 1], ["RE", 3, [0, 5, 1, 6, 2, 7, 10, 11, 3, 8, 12, 4, 9]], ["FSP", 4, 0, 2, 3], ["FSP", 4, 4, 3, 3], ["RE", 4, [0, 4, 1, 5, 2, 6, 3, 7]], ["CA", 3, 4, 5], ["CHR", 2, "shared", [3]], ["CA", 3, 4, 6], ["CHR", 1, "shared", [4]], ["CA", 2, 5, 6], ["FU", 9, [0, 1, 2, 3]], ["SP", 9, 0, 94080, [32], 1], ["AN", 9, 0, 5], ["AN", 9, 1, 6], ["FU", 6, [0, 1]], ["AN", 6, 0, 5], ["FU", 6, [1, 2]], ["AN", 6, 1, 4], ["FU", 6, [2, 3]], ["AN", 6, 2, 6], ["FU", 4, [0, 1]], ["SP", 4, 0, 10, [1], 1], ["AN", 4, 1, 2], ["FFSP", 4, 0, [3, 2], 1, 1], ["AN", 4, 1, 6], ["FU", 2, [0, 1]], ["SP", 2, 0, 5, [1], 1], ["AN", 2, 1, 2], ["FFSP", 2, 0, [3, 2], 1, 1], ["AN", 2, 1, 6], ["PR", 5, 0, "auto_unroll_max_step$0"]]]], "r": [[1.87372e-05, 1.87326e-05, 1.8734e-05], 0, 8.76323, 1662030625], "v": "v0.6"}
{"i": [["[\"fused_pointwise_conv_bias_add_sigmoid_mul\", 14, 14, 20, 480, 1]", "cuda -keys=cuda,gpu -max_num_threads=1024 -model=unknown -thread_warp_size=32", [-1, 16, 64, 49152, 2147483647, 1024, 8, 32], "", 0, []], [[], [["CI", 5], ["CHW", 3, "local"], ["SP", 3, 0, 1, [1, 1, 1, 1], 1], ["SP", 3, 5, 480, [2, 40, 3, 2], 1], ["SP", 3, 10, 20, [1, 5], 1], ["RE", 3, [0, 5, 1, 6, 2, 7, 10, 11, 3, 8, 12, 4, 9]], ["FSP", 4, 0, 2, 3], ["FSP", 4, 4, 3, 3], ["RE", 4, [0, 4, 1, 5, 2, 6, 3, 7]], ["CA", 3, 4, 5], ["CHR", 2, "shared", [3]], ["CA", 3, 4, 6], ["CHR", 1, "shared", [4]], ["CA", 2, 5, 6], ["FU", 9, [0, 1, 2, 3]], ["SP", 9, 0, 94080, [8], 1], ["AN", 9, 0, 5], ["AN", 9, 1, 6], ["FU", 6, [0, 1]], ["AN", 6, 0, 5], ["FU", 6, [1, 2]], ["AN", 6, 1, 4], ["FU", 6, [2, 3]], ["AN", 6, 2, 6], ["FU", 4, [0, 1]], ["SP", 4, 0, 60, [1], 1], ["AN", 4, 1, 2], ["FFSP", 4, 0, [3, 2], 1, 1], ["AN", 4, 1, 6], ["FU", 2, [0, 1]], ["SP", 2, 0, 10, [1], 1], ["AN", 2, 1, 2], ["FFSP", 2, 0, [3, 2], 1, 1], ["AN", 2, 1, 6], ["PR", 5, 0, "auto_unroll_max_step$0"]]]], "r": [[3.1419e-05, 3.14277e-05, 3.14297e-05], 0, 3.94052, 1662030619], "v": "v0.6"}
{"i": [["[\"fused_pointwise_conv_bias_add_sigmoid_mul\", 14, 14, 20, 480, 1]", "cuda -keys=cuda,gpu -max_num_threads=1024 -model=unknown -thread_warp_size=32", [-1, 16, 64, 49152, 2147483647, 1024, 8, 32], "", 0, []], [[], [["CI", 5], ["CHW", 3, "local"], ["SP", 3, 0, 1, [1, 1, 1, 1], 1], ["SP", 3, 5, 480, [1, 60, 2, 2], 1], ["SP", 3, 10, 20, [4, 1], 1], ["RE", 3, [0, 5, 1, 6, 2, 7, 10, 11, 3, 8, 12, 4, 9]], ["FSP", 4, 0, 2, 3], ["FSP", 4, 4, 3, 3], ["RE", 4, [0, 4, 1, 5, 2, 6, 3, 7]], ["CA", 3, 4, 5], ["CHR", 2, "shared", [3]], ["CA", 3, 4, 6], ["CHR", 1, "shared", [4]], ["CA", 2, 5, 6], ["FU", 9, [0, 1, 2, 3]], ["SP", 9, 0, 94080, [32], 1], ["AN", 9, 0, 5], ["AN", 9, 1, 6], ["FU", 6, [0, 1]], ["AN", 6, 0, 5], ["FU", 6, [1, 2]], ["AN", 6, 1, 4], ["FU", 6, [2, 3]], ["AN", 6, 2, 6], ["FU", 4, [0, 1]], ["SP", 4, 0, 8, [2], 1], ["AN", 4, 1, 2], ["FFSP", 4, 0, [3, 2], 1, 1], ["AN", 4, 1, 6], ["FU", 2, [0, 1]], ["SP", 2, 0, 2, [1], 1], ["AN", 2, 1, 2], ["FFSP", 2, 0, [3, 2], 1, 1], ["AN", 2, 1, 6], ["PR", 5, 0, "auto_unroll_max_step$1024"]]]], "r": [[1.71412e-05, 1.71381e-05, 1.71361e-05], 0, 10.4121, 1662030626], "v": "v0.6"}
{"i": [["[\"fused_pointwise_conv_bias_add_sigmoid_mul\", 14, 14, 20, 480, 1]", "cuda -keys=cuda,gpu -max_num_threads=1024 -model=unknown -thread_warp_size=32", [-1, 16, 64, 49152, 2147483647, 1024, 8, 32], "", 0, []], [[], [["CI", 5], ["CHW", 3, "local"], ["SP", 3, 0, 1, [1, 1, 1, 1], 1], ["SP", 3, 5, 480, [5, 32, 1, 3], 1], ["SP", 3, 10, 20, [4, 5], 1], ["RE", 3, [0, 5, 1, 6, 2, 7, 10, 11, 3, 8, 12, 4, 9]], ["FSP", 4, 0, 2, 3], ["FSP", 4, 4, 3, 3], ["RE", 4, [0, 4, 1, 5, 2, 6, 3, 7]], ["CA", 3, 4, 5], ["CHR", 2, "shared", [3]], ["CA", 3, 4, 6], ["CHR", 1, "shared", [4]], ["CA", 2, 5, 6], ["FU", 9, [0, 1, 2, 3]], ["SP", 9, 0, 94080, [32], 1], ["AN", 9, 0, 5], ["AN", 9, 1, 6], ["FU", 6, [0, 1]], ["AN", 6, 0, 5], ["FU", 6, [1, 2]], ["AN", 6, 1, 4], ["FU", 6, [2, 3]], ["AN", 6, 2, 6], ["FU", 4, [0, 1]], ["SP", 4, 0, 12, [1], 1], ["AN", 4, 1, 2], ["FFSP", 4, 0, [3, 2], 1, 1], ["AN", 4, 1, 6], ["FU", 2, [0, 1]], ["SP", 2, 0, 4, [4], 1], ["AN", 2, 1, 2], ["FFSP", 2, 0, [3, 2], 1, 1], ["AN", 2, 1, 6], ["PR", 5, 0, "auto_unroll_max_step$0"]]]], "r": [[2.00344e-05, 2.00382e-05, 2.00398e-05], 0, 9.33383, 1662030625], "v": "v0.6"}
{"i": [["[\"fused_pointwise_conv_bias_add_sigmoid_mul\", 14, 14, 20, 480, 1]", "cuda -keys=cuda,gpu -max_num_threads=1024 -model=unknown -thread_warp_size=32", [-1, 16, 64, 49152, 2147483647, 1024, 8, 32], "", 0, []], [[], [["CI", 5], ["CHW", 3, "local"], ["SP", 3, 0, 1, [1, 1, 1, 1], 1], ["SP", 3, 5, 480, [2, 40, 1, 3], 1], ["SP", 3, 10, 20, [5, 4], 1], ["RE", 3, [0, 5, 1, 6, 2, 7, 10, 11, 3, 8, 12, 4, 9]], ["FSP", 4, 0, 2, 3], ["FSP", 4, 4, 3, 3], ["RE", 4, [0, 4, 1, 5, 2, 6, 3, 7]], ["CA", 3, 4, 5], ["CHR", 2, "shared", [3]], ["CA", 3, 4, 6], ["CHR", 1, "shared", [4]], ["CA", 2, 5, 6], ["FU", 9, [0, 1, 2, 3]], ["SP", 9, 0, 94080, [32], 1], ["AN", 9, 0, 5], ["AN", 9, 1, 6], ["FU", 6, [0, 1]], ["AN", 6, 0, 5], ["FU", 6, [1, 2]], ["AN", 6, 1, 4], ["FU", 6, [2, 3]], ["AN", 6, 2, 6], ["FU", 4, [0, 1]], ["SP", 4, 0, 60, [1], 1], ["AN", 4, 1, 2], ["FFSP", 4, 0, [3, 2], 1, 1], ["AN", 4, 1, 6], ["FU", 2, [0, 1]], ["SP", 2, 0, 20, [1], 1], ["AN", 2, 1, 2], ["FFSP", 2, 0, [3, 2], 1, 1], ["AN", 2, 1, 6], ["PR", 5, 0, "auto_unroll_max_step$64"]]]], "r": [[2.22342e-05, 2.22339e-05, 2.22346e-05], 0, 6.0775, 1662030622], "v": "v0.6"}
{"i": [["[\"fused_pointwise_conv_bias_add_sigmoid_mul\", 14, 14, 20, 480, 1]", "cuda -keys=cuda,gpu -max_num_threads=1024 -model=unknown -thread_warp_size=32", [-1, 16, 64, 49152, 2147483647, 1024, 8, 32], "", 0, []], [[], [["CI", 5], ["CHW", 3, "local"], ["SP", 3, 0, 1, [1, 1, 1, 1], 1], ["SP", 3, 5, 480, [1, 24, 2, 2], 1], ["SP", 3, 10, 20, [2, 10], 1], ["RE", 3, [0, 5, 1, 6, 2, 7, 10, 11, 3, 8, 12, 4, 9]], ["FSP", 4, 0, 2, 3], ["FSP", 4, 4, 3, 3], ["RE", 4, [0, 4, 1, 5, 2, 6, 3, 7]], ["CA", 3, 4, 5], ["CHR", 2, "shared", [3]], ["CA", 3, 4, 6], ["CHR", 1, "shared", [4]], ["CA", 2, 5, 6], ["FU", 9, [0, 1, 2, 3]], ["SP", 9, 0, 94080, [32], 1], ["AN", 9, 0, 5], ["AN", 9, 1, 6], ["FU", 6, [0, 1]], ["AN", 6, 0, 5], ["FU", 6, [1, 2]], ["AN", 6, 1, 4], ["FU", 6, [2, 3]], ["AN", 6, 2, 6], ["FU", 4, [0, 1]], ["SP", 4, 0, 40, [1], 1], ["AN", 4, 1, 2], ["FFSP", 4, 0, [3, 2], 1, 1], ["AN", 4, 1, 6], ["FU", 2, [0, 1]], ["SP", 2, 0, 20, [1], 1], ["AN", 2, 1, 2], ["FFSP", 2, 0, [3, 2], 1, 1], ["AN", 2, 1, 6], ["PR", 5, 0, "auto_unroll_max_step$64"]]]], "r": [[1.98962e-05, 1.98915e-05, 1.98904e-05], 0, 8.21672, 1662030624], "v": "v0.6"}
{"i": [["[\"fused_pointwise_conv_bias_add_sigmoid_mul\", 14, 14, 20, 480, 1]", "cuda -keys=cuda,gpu -max_num_threads=1024 -model=unknown -thread_warp_size=32", [-1, 16, 64, 49152, 2147483647, 1024, 8, 32], "", 0, []], [[], [["CI", 5], ["CHW", 3, "local"], ["SP", 3, 0, 1, [1, 1, 1, 1], 1], ["SP", 3, 5, 480, [2, 60, 1, 1], 1], ["SP", 3, 10, 20, [4, 1], 1], ["RE", 3, [0, 5, 1, 6, 2, 7, 10, 11, 3, 8, 12, 4, 9]], ["FSP", 4, 0, 2, 3], ["FSP", 4, 4, 3, 3], ["RE", 4, [0, 4, 1, 5, 2, 6, 3, 7]], ["CA", 3, 4, 5], ["CHR", 2, "shared", [3]], ["CA", 3, 4, 6], ["CHR", 1, "shared", [4]], ["CA", 2, 5, 6], ["FU", 9, [0, 1, 2, 3]], ["SP", 9, 0, 94080, [32], 1], ["AN", 9, 0, 5], ["AN", 9, 1, 6], ["FU", 6, [0, 1]], ["AN", 6, 0, 5], ["FU", 6, [1, 2]], ["AN", 6, 1, 4], ["FU", 6, [2, 3]], ["AN", 6, 2, 6], ["FU", 4, [0, 1]], ["SP", 4, 0, 4, [4], 1], ["AN", 4, 1, 2], ["FFSP", 4, 0, [3, 2], 1, 1], ["AN", 4, 1, 6], ["FU", 2, [0, 1]], ["SP", 2, 0, 4, [1], 1], ["AN", 2, 1, 2], ["FFSP", 2, 0, [3, 2], 1, 1], ["AN", 2, 1, 6], ["PR", 5, 0, "auto_unroll_max_step$64"]]]], "r": [[1.49816e-05, 1.49812e-05, 1.49845e-05], 0, 11.9319, 1662030628], "v": "v0.6"}
{"i": [["[\"fused_pointwise_conv_bias_add_sigmoid_mul\", 14, 14, 20, 480, 1]", "cuda -keys=cuda,gpu -max_num_threads=1024 -model=unknown -thread_warp_size=32", [-1, 16, 64, 49152, 2147483647, 1024, 8, 32], "", 0, []], [[], [["CI", 5], ["CHW", 3, "local"], ["SP", 3, 0, 1, [1, 1, 1, 1], 1], ["SP", 3, 5, 480, [5, 32, 1, 3], 1], ["SP", 3, 10, 20, [1, 1], 1], ["RE", 3, [0, 5, 1, 6, 2, 7, 10, 11, 3, 8, 12, 4, 9]], ["FSP", 4, 0, 2, 3], ["FSP", 4, 4, 3, 3], ["RE", 4, [0, 4, 1, 5, 2, 6, 3, 7]], ["CA", 3, 4, 5], ["CHR", 2, "shared", [3]], ["CA", 3, 4, 6], ["CHR", 1, "shared", [4]], ["CA", 2, 5, 6], ["FU", 9, [0, 1, 2, 3]], ["SP", 9, 0, 94080, [32], 1], ["AN", 9, 0, 5], ["AN", 9, 1, 6], ["FU", 6, [0, 1]], ["AN", 6, 0, 5], ["FU", 6, [1, 2]], ["AN", 6, 1, 4], ["FU", 6, [2, 3]], ["AN", 6, 2, 6], ["FU", 4, [0, 1]], ["SP", 4, 0, 12, [1], 1], ["AN", 4, 1, 2], ["FFSP", 4, 0, [3, 2], 1, 1], ["AN", 4, 1, 6], ["FU", 2, [0, 1]], ["SP", 2, 0, 4, [2], 1], ["AN", 2, 1, 2], ["FFSP", 2, 0, [3, 2], 1, 1], ["AN", 2, 1, 6], ["PR", 5, 0, "auto_unroll_max_step$0"]]]], "r": [[2.50084e-05, 2.50074e-05, 2.50057e-05], 0, 10.8406, 1662030627], "v": "v0.6"}
{"i": [["[\"fused_pointwise_conv_bias_add_sigmoid_mul\", 14, 14, 20, 480, 1]", "cuda -keys=cuda,gpu -max_num_threads=1024 -model=unknown -thread_warp_size=32", [-1, 16, 64, 49152, 2147483647, 1024, 8, 32], "", 0, []], [[], [["CI", 5], ["CHW", 3, "local"], ["SP", 3, 0, 1, [1, 1, 1, 1], 1], ["SP", 3, 5, 480, [2, 40, 3, 2], 1], ["SP", 3, 10, 20, [1, 10], 1], ["RE", 3, [0, 5, 1, 6, 2, 7, 10, 11, 3, 8, 12, 4, 9]], ["FSP", 4, 0, 2, 3], ["FSP", 4, 4, 3, 3], ["RE", 4, [0, 4, 1, 5, 2, 6, 3, 7]], ["CA", 3, 4, 5], ["CHR", 2, "shared", [3]], ["CA", 3, 4, 6], ["CHR", 1, "shared", [4]], ["CA", 2, 5, 6], ["FU", 9, [0, 1, 2, 3]], ["SP", 9, 0, 94080, [8], 1], ["AN", 9, 0, 5], ["AN", 9, 1, 6], ["FU", 6, [0, 1]], ["AN", 6, 0, 5], ["FU", 6, [1, 2]], ["AN", 6, 1, 4], ["FU", 6, [2, 3]], ["AN", 6, 2, 6], ["FU", 4, [0, 1]], ["SP", 4, 0, 60, [1], 1], ["AN", 4, 1, 2], ["FFSP", 4, 0, [3, 2], 1, 1], ["AN", 4, 1, 6], ["FU", 2, [0, 1]], ["SP", 2, 0, 10, [2], 1], ["AN", 2, 1, 2], ["FFSP", 2, 0, [3, 2], 1, 1], ["AN", 2, 1, 6], ["PR", 5, 0, "auto_unroll_max_step$0"]]]], "r": [[2.9133e-05, 2.91443e-05, 2.91319e-05], 0, 11.456, 1662030627], "v": "v0.6"}
{"i": [["[\"fused_pointwise_conv_bias_add_sigmoid_mul\", 14, 14, 20, 480, 1]", "cuda -keys=cuda,gpu -max_num_threads=1024 -model=unknown -thread_warp_size=32", [-1, 16, 64, 49152, 2147483647, 1024, 8, 32], "", 0, []], [[], [["CI", 5], ["CHW", 3, "local"], ["SP", 3, 0, 1, [1, 1, 1, 1], 1], ["SP", 3, 5, 480, [1, 40, 1, 1], 1], ["SP", 3, 10, 20, [1, 20], 1], ["RE", 3, [0, 5, 1, 6, 2, 7, 10, 11, 3, 8, 12, 4, 9]], ["FSP", 4, 0, 2, 3], ["FSP", 4, 4, 3, 3], ["RE", 4, [0, 4, 1, 5, 2, 6, 3, 7]], ["CA", 3, 4, 5], ["CHR", 2, "shared", [3]], ["CA", 3, 4, 6], ["CHR", 1, "shared", [4]], ["CA", 2, 5, 6], ["FU", 9, [0, 1, 2, 3]], ["SP", 9, 0, 94080, [32], 1], ["AN", 9, 0, 5], ["AN", 9, 1, 6], ["FU", 6, [0, 1]], ["AN", 6, 0, 5], ["FU", 6, [1, 2]], ["AN", 6, 1, 4], ["FU", 6, [2, 3]], ["AN", 6, 2, 6], ["FU", 4, [0, 1]], ["SP", 4, 0, 2, [1], 1], ["AN", 4, 1, 2], ["FFSP", 4, 0, [3, 2], 1, 1], ["AN", 4, 1, 6], ["FU", 2, [0, 1]], ["SP", 2, 0, 2, [2], 1], ["AN", 2, 1, 2], ["FFSP", 2, 0, [3, 2], 1, 1], ["AN", 2, 1, 6], ["PR", 5, 0, "auto_unroll_max_step$64"]]]], "r": [[1.43746e-05, 1.43652e-05, 1.43667e-05], 0, 14.4826, 1662030630], "v": "v0.6"}
{"i": [["[\"fused_pointwise_conv_bias_add_sigmoid_mul\", 14, 14, 20, 480, 1]", "cuda -keys=cuda,gpu -max_num_threads=1024 -model=unknown -thread_warp_size=32", [-1, 16, 64, 49152, 2147483647, 1024, 8, 32], "", 0, []], [[], [["CI", 5], ["CHW", 3, "local"], ["SP", 3, 0, 1, [1, 1, 1, 1], 1], ["SP", 3, 5, 480, [2, 48, 1, 1], 1], ["SP", 3, 10, 20, [1, 4], 1], ["RE", 3, [0, 5, 1, 6, 2, 7, 10, 11, 3, 8, 12, 4, 9]], ["FSP", 4, 0, 2, 3], ["FSP", 4, 4, 3, 3], ["RE", 4, [0, 4, 1, 5, 2, 6, 3, 7]], ["CA", 3, 4, 5], ["CHR", 2, "shared", [3]], ["CA", 3, 4, 6], ["CHR", 1, "shared", [4]], ["CA", 2, 5, 6], ["FU", 9, [0, 1, 2, 3]], ["SP", 9, 0, 94080, [32], 1], ["AN", 9, 0, 5], ["AN", 9, 1, 6], ["FU", 6, [0, 1]], ["AN", 6, 0, 5], ["FU", 6, [1, 2]], ["AN", 6, 1, 4], ["FU", 6, [2, 3]], ["AN", 6, 2, 6], ["FU", 4, [0, 1]], ["SP", 4, 0, 40, [5], 1], ["AN", 4, 1, 2], ["FFSP", 4, 0, [3, 2], 1, 1], ["AN", 4, 1, 6], ["FU", 2, [0, 1]], ["SP", 2, 0, 4, [1], 1], ["AN", 2, 1, 2], ["FFSP", 2, 0, [3, 2], 1, 1], ["AN", 2, 1, 6], ["PR", 5, 0, "auto_unroll_max_step$16"]]]], "r": [[1.66859e-05, 1.66868e-05, 1.66786e-05], 0, 14.7883, 1662030631], "v": "v0.6"}
{"i": [["[\"fused_pointwise_conv_bias_add_sigmoid_mul\", 14, 14, 20, 480, 1]", "cuda -keys=cuda,gpu -max_num_threads=1024 -model=unknown -thread_warp_size=32", [-1, 16, 64, 49152, 2147483647, 1024, 8, 32], "", 0, []], [[], [["CI", 5], ["CHW", 3, "local"], ["SP", 3, 0, 1, [1, 1, 1, 1], 1], ["SP", 3, 5, 480, [5, 32, 3, 1], 1], ["SP", 3, 10, 20, [4, 5], 1], ["RE", 3, [0, 5, 1, 6, 2, 7, 10, 11, 3, 8, 12, 4, 9]], ["FSP", 4, 0, 2, 3], ["FSP", 4, 4, 3, 3], ["RE", 4, [0, 4, 1, 5, 2, 6, 3, 7]], ["CA", 3, 4, 5], ["CHR", 2, "shared", [3]], ["CA", 3, 4, 6], ["CHR", 1, "shared", [4]], ["CA", 2, 5, 6], ["FU", 9, [0, 1, 2, 3]], ["SP", 9, 0, 94080, [32], 1], ["AN", 9, 0, 5], ["AN", 9, 1, 6], ["FU", 6, [0, 1]], ["AN", 6, 0, 5], ["FU", 6, [1, 2]], ["AN", 6, 1, 4], ["FU", 6, [2, 3]], ["AN", 6, 2, 6], ["FU", 4, [0, 1]], ["SP", 4, 0, 60, [1], 1], ["AN", 4, 1, 2], ["FFSP", 4, 0, [3, 2], 1, 1], ["AN", 4, 1, 6], ["FU", 2, [0, 1]], ["SP", 2, 0, 20, [5], 1], ["AN", 2, 1, 2], ["FFSP", 2, 0, [3, 2], 1, 1], ["AN", 2, 1, 6], ["PR", 5, 0, "auto_unroll_max_step$1024"]]]], "r": [[1.83897e-05, 1.83992e-05, 1.83946e-05], 0, 13.1713, 1662030629], "v": "v0.6"}
{"i": [["[\"fused_pointwise_conv_bias_add_sigmoid_mul\", 14, 14, 20, 480, 1]", "cuda -keys=cuda,gpu -max_num_threads=1024 -model=unknown -thread_warp_size=32", [-1, 16, 64, 49152, 2147483647, 1024, 8, 32], "", 0, []], [[], [["CI", 5], ["CHW", 3, "local"], ["SP", 3, 0, 1, [1, 1, 1, 1], 1], ["SP", 3, 5, 480, [1, 16, 2, 1], 1], ["SP", 3, 10, 20, [1, 10], 1], ["RE", 3, [0, 5, 1, 6, 2, 7, 10, 11, 3, 8, 12, 4, 9]], ["FSP", 4, 0, 2, 3], ["FSP", 4, 4, 3, 3], ["RE", 4, [0, 4, 1, 5, 2, 6, 3, 7]], ["CA", 3, 4, 5], ["CHR", 2, "shared", [3]], ["CA", 3, 4, 6], ["CHR", 1, "shared", [4]], ["CA", 2, 5, 6], ["FU", 9, [0, 1, 2, 3]], ["SP", 9, 0, 94080, [32], 1], ["AN", 9, 0, 5], ["AN", 9, 1, 6], ["FU", 6, [0, 1]], ["AN", 6, 0, 5], ["FU", 6, [1, 2]], ["AN", 6, 1, 4], ["FU", 6, [2, 3]], ["AN", 6, 2, 6], ["FU", 4, [0, 1]], ["SP", 4, 0, 40, [1], 1], ["AN", 4, 1, 2], ["FFSP", 4, 0, [3, 2], 1, 1], ["AN", 4, 1, 6], ["FU", 2, [0, 1]], ["SP", 2, 0, 20, [1], 1], ["AN", 2, 1, 2], ["FFSP", 2, 0, [3, 2], 1, 1], ["AN", 2, 1, 6], ["PR", 5, 0, "auto_unroll_max_step$64"]]]], "r": [[1.49214e-05, 1.49151e-05, 1.49243e-05], 0, 13.1761, 1662030629], "v": "v0.6"}
{"i": [["[\"fused_pointwise_conv_bias_add_sigmoid_mul\", 14, 14, 20, 480, 1]", "cuda -keys=cuda,gpu -max_num_threads=1024 -model=unknown -thread_warp_size=32", [-1, 16, 64, 49152, 2147483647, 1024, 8, 32], "", 0, []], [[], [["CI", 5], ["CHW", 3, "local"], ["SP", 3, 0, 1, [1, 1, 1, 1], 1], ["SP", 3, 5, 480, [1, 480, 1, 1], 1], ["SP", 3, 10, 20, [4, 1], 1], ["RE", 3, [0, 5, 1, 6, 2, 7, 10, 11, 3, 8, 12, 4, 9]], ["FSP", 4, 0, 2, 3], ["FSP", 4, 4, 3, 3], ["RE", 4, [0, 4, 1, 5, 2, 6, 3, 7]], ["CA", 3, 4, 5], ["CHR", 2, "shared", [3]], ["CA", 3, 4, 6], ["CHR", 1, "shared", [4]], ["CA", 2, 5, 6], ["FU", 9, [0, 1, 2, 3]], ["SP", 9, 0, 94080, [32], 1], ["AN", 9, 0, 5], ["AN", 9, 1, 6], ["FU", 6, [0, 1]], ["AN", 6, 0, 5], ["FU", 6, [1, 2]], ["AN", 6, 1, 4], ["FU", 6, [2, 3]], ["AN", 6, 2, 6], ["FU", 4, [0, 1]], ["SP", 4, 0, 12, [1], 1], ["AN", 4, 1, 2], ["FFSP", 4, 0, [3, 2], 1, 1], ["AN", 4, 1, 6], ["FU", 2, [0, 1]], ["SP", 2, 0, 4, [1], 1], ["AN", 2, 1, 2], ["FFSP", 2, 0, [3, 2], 1, 1], ["AN", 2, 1, 6], ["PR", 5, 0, "auto_unroll_max_step$0"]]]], "r": [[1.54428e-05, 1.54371e-05, 1.54341e-05], 0, 16.5872, 1662030633], "v": "v0.6"}
{"i": [["[\"fused_pointwise_conv_bias_add_sigmoid_mul\", 14, 14, 20, 480, 1]", "cuda -keys=cuda,gpu -max_num_threads=1024 -model=unknown -thread_warp_size=32", [-1, 16, 64, 49152, 2147483647, 1024, 8, 32], "", 0, []], [[], [["CI", 5], ["CHW", 3, "local"], ["SP", 3, 0, 1, [1, 1, 1, 1], 1], ["SP", 3, 5, 480, [1, 4, 5, 12], 1], ["SP", 3, 10, 20, [2, 1], 1], ["RE", 3, [0, 5, 1, 6, 2, 7, 10, 11, 3, 8, 12, 4, 9]], ["FSP", 4, 0, 2, 3], ["FSP", 4, 4, 3, 3], ["RE", 4, [0, 4, 1, 5, 2, 6, 3, 7]], ["CA", 3, 4, 5], ["CHR", 2, "shared", [3]], ["CA", 3, 4, 6], ["CHR", 1, "shared", [4]], ["CA", 2, 5, 6], ["FU", 9, [0, 1, 2, 3]], ["SP", 9, 0, 94080, [32], 1], ["AN", 9, 0, 5], ["AN", 9, 1, 6], ["FU", 6, [0, 1]], ["AN", 6, 0, 5], ["FU", 6, [1, 2]], ["AN", 6, 1, 4], ["FU", 6, [2, 3]], ["AN", 6, 2, 6], ["FU", 4, [0, 1]], ["SP", 4, 0, 20, [1], 1], ["AN", 4, 1, 2], ["FFSP", 4, 0, [3, 2], 1, 1], ["AN", 4, 1, 6], ["FU", 2, [0, 1]], ["SP", 2, 0, 4, [1], 1], ["AN", 2, 1, 2], ["FFSP", 2, 0, [3, 2], 1, 1], ["AN", 2, 1, 6], ["PR", 5, 0, "auto_unroll_max_step$0"]]]], "r": [[9.75917e-05, 9.76016e-05, 9.76037e-05], 0, 13.7815, 1662030630], "v": "v0.6"}
{"i": [["[\"fused_pointwise_conv_bias_add_sigmoid_mul\", 14, 14, 20, 480, 1]", "cuda -keys=cuda,gpu -max_num_threads=1024 -model=unknown -thread_warp_size=32", [-1, 16, 64, 49152, 2147483647, 1024, 8, 32], "", 0, []], [[], [["CI", 5], ["CHW", 3, "local"], ["SP", 3, 0, 1, [1, 1, 1, 1], 1], ["SP", 3, 5, 480, [8, 60, 1, 1], 1], ["SP", 3, 10, 20, [1, 2], 1], ["RE", 3, [0, 5, 1, 6, 2, 7, 10, 11, 3, 8, 12, 4, 9]], ["FSP", 4, 0, 2, 3], ["FSP", 4, 4, 3, 3], ["RE", 4, [0, 4, 1, 5, 2, 6, 3, 7]], ["CA", 3, 4, 5], ["CHR", 2, "shared", [3]], ["CA", 3, 4, 6], ["CHR", 1, "shared", [4]], ["CA", 2, 5, 6], ["FU", 9, [0, 1, 2, 3]], ["SP", 9, 0, 94080, [32], 1], ["AN", 9, 0, 5], ["AN", 9, 1, 6], ["FU", 6, [0, 1]], ["AN", 6, 0, 5], ["FU", 6, [1, 2]], ["AN", 6, 1, 4], ["FU", 6, [2, 3]], ["AN", 6, 2, 6], ["FU", 4, [0, 1]], ["SP", 4, 0, 2, [1], 1], ["AN", 4, 1, 2], ["FFSP", 4, 0, [3, 2], 1, 1], ["AN", 4, 1, 6], ["FU", 2, [0, 1]], ["SP", 2, 0, 2, [1], 1], ["AN", 2, 1, 2], ["FFSP", 2, 0, [3, 2], 1, 1], ["AN", 2, 1, 6], ["PR", 5, 0, "auto_unroll_max_step$64"]]]], "r": [[2.14409e-05, 2.14544e-05, 2.14563e-05], 0, 17.1047, 1662030633], "v": "v0.6"}
{"i": [["[\"fused_pointwise_conv_bias_add_sigmoid_mul\", 14, 14, 20, 480, 1]", "cuda -keys=cuda,gpu -max_num_threads=1024 -model=unknown -thread_warp_size=32", [-1, 16, 64, 49152, 2147483647, 1024, 8, 32], "", 0, []], [[], [["CI", 5], ["CHW", 3, "local"], ["SP", 3, 0, 1, [1, 1, 1, 1], 1], ["SP", 3, 5, 480, [1, 80, 1, 3], 1], ["SP", 3, 10, 20, [10, 2], 1], ["RE", 3, [0, 5, 1, 6, 2, 7, 10, 11, 3, 8, 12, 4, 9]], ["FSP", 4, 0, 2, 3], ["FSP", 4, 4, 3, 3], ["RE", 4, [0, 4, 1, 5, 2, 6, 3, 7]], ["CA", 3, 4, 5], ["CHR", 2, "shared", [3]], ["CA", 3, 4, 6], ["CHR", 1, "shared", [4]], ["CA", 2, 5, 6], ["FU", 9, [0, 1, 2, 3]], ["SP", 9, 0, 94080, [32], 1], ["AN", 9, 0, 5], ["AN", 9, 1, 6], ["FU", 6, [0, 1]], ["AN", 6, 0, 5], ["FU", 6, [1, 2]], ["AN", 6, 1, 4], ["FU", 6, [2, 3]], ["AN", 6, 2, 6], ["FU", 4, [0, 1]], ["SP", 4, 0, 60, [1], 1], ["AN", 4, 1, 2], ["FFSP", 4, 0, [3, 2], 1, 1], ["AN", 4, 1, 6], ["FU", 2, [0, 1]], ["SP", 2, 0, 20, [1], 1], ["AN", 2, 1, 2], ["FFSP", 2, 0, [3, 2], 1, 1], ["AN", 2, 1, 6], ["PR", 5, 0, "auto_unroll_max_step$64"]]]], "r": [[1.57857e-05, 1.57935e-05, 1.57871e-05], 0, 15.4496, 1662030632], "v": "v0.6"}
{"i": [["[\"fused_pointwise_conv_bias_add_sigmoid_mul\", 14, 14, 20, 480, 1]", "cuda -keys=cuda,gpu -max_num_threads=1024 -model=unknown -thread_warp_size=32", [-1, 16, 64, 49152, 2147483647, 1024, 8, 32], "", 0, []], [[], [["CI", 5], ["CHW", 3, "local"], ["SP", 3, 0, 1, [1, 1, 1, 1], 1], ["SP", 3, 5, 480, [2, 40, 1, 3], 1], ["SP", 3, 10, 20, [5, 4], 1], ["RE", 3, [0, 5, 1, 6, 2, 7, 10, 11, 3, 8, 12, 4, 9]], ["FSP", 4, 0, 2, 3], ["FSP", 4, 4, 3, 3], ["RE", 4, [0, 4, 1, 5, 2, 6, 3, 7]], ["CA", 3, 4, 5], ["CHR", 2, "shared", [3]], ["CA", 3, 4, 6], ["CHR", 1, "shared", [4]], ["CA", 2, 5, 6], ["FU", 9, [0, 1, 2, 3]], ["SP", 9, 0, 94080, [4], 1], ["AN", 9, 0, 5], ["AN", 9, 1, 6], ["FU", 6, [0, 1]], ["AN", 6, 0, 5], ["FU", 6, [1, 2]], ["AN", 6, 1, 4], ["FU", 6, [2, 3]], ["AN", 6, 2, 6], ["FU", 4, [0, 1]], ["SP", 4, 0, 60, [1], 1], ["AN", 4, 1, 2], ["FFSP", 4, 0, [3, 2], 1, 1], ["AN", 4, 1, 6], ["FU", 2, [0, 1]], ["SP", 2, 0, 20, [1], 1], ["AN", 2, 1, 2], ["FFSP", 2, 0, [3, 2], 1, 1], ["AN", 2, 1, 6], ["PR", 5, 0, "auto_unroll_max_step$16"]]]], "r": [[4.98928e-05, 4.99471e-05, 4.99539e-05], 0, 15.8838, 1662030632], "v": "v0.6"}
{"i": [["[\"fused_pointwise_conv_bias_add_sigmoid_mul\", 14, 14, 20, 480, 1]", "cuda -keys=cuda,gpu -max_num_threads=1024 -model=unknown -thread_warp_size=32", [-1, 16, 64, 49152, 2147483647, 1024, 8, 32], "", 0, []], [[], [["CI", 5], ["CHW", 3, "local"], ["SP", 3, 0, 1, [1, 1, 1, 1], 1], ["SP", 3, 5, 480, [2, 60, 4, 1], 1], ["SP", 3, 10, 20, [1, 2], 1], ["RE", 3, [0, 5, 1, 6, 2, 7, 10, 11, 3, 8, 12, 4, 9]], ["FSP", 4, 0, 2, 3], ["FSP", 4, 4, 3, 3], ["RE", 4, [0, 4, 1, 5, 2, 6, 3, 7]], ["CA", 3, 4, 5], ["CHR", 2, "shared", [3]], ["CA", 3, 4, 6], ["CHR", 1, "shared", [4]], ["CA", 2, 5, 6], ["FU", 9, [0, 1, 2, 3]], ["SP", 9, 0, 94080, [24], 1], ["AN", 9, 0, 5], ["AN", 9, 1, 6], ["FU", 6, [0, 1]], ["AN", 6, 0, 5], ["FU", 6, [1, 2]], ["AN", 6, 1, 4], ["FU", 6, [2, 3]], ["AN", 6, 2, 6], ["FU", 4, [0, 1]], ["SP", 4, 0, 16, [1], 1], ["AN", 4, 1, 2], ["FFSP", 4, 0, [3, 2], 1, 1], ["AN", 4, 1, 6], ["FU", 2, [0, 1]], ["SP", 2, 0, 2, [1], 1], ["AN", 2, 1, 2], ["FFSP", 2, 0, [3, 2], 1, 1], ["AN", 2, 1, 6], ["PR", 5, 0, "auto_unroll_max_step$64"]]]], "r": [[2.26823e-05, 2.26769e-05, 2.26792e-05], 0, 17.6762, 1662030634], "v": "v0.6"}
{"i": [["[\"fused_pointwise_conv_bias_add_sigmoid_mul\", 14, 14, 20, 480, 1]", "cuda -keys=cuda,gpu -max_num_threads=1024 -model=unknown -thread_warp_size=32", [-1, 16, 64, 49152, 2147483647, 1024, 8, 32], "", 0, []], [[], [["CI", 5], ["CHW", 3, "local"], ["SP", 3, 0, 1, [1, 1, 1, 1], 1], ["SP", 3, 5, 480, [1, 4, 1, 1], 1], ["SP", 3, 10, 20, [2, 2], 1], ["RE", 3, [0, 5, 1, 6, 2, 7, 10, 11, 3, 8, 12, 4, 9]], ["FSP", 4, 0, 2, 3], ["FSP", 4, 4, 3, 3], ["RE", 4, [0, 4, 1, 5, 2, 6, 3, 7]], ["CA", 3, 4, 5], ["CHR", 2, "shared", [3]], ["CA", 3, 4, 6], ["CHR", 1, "shared", [4]], ["CA", 2, 5, 6], ["FU", 9, [0, 1, 2, 3]], ["SP", 9, 0, 94080, [32], 1], ["AN", 9, 0, 5], ["AN", 9, 1, 6], ["FU", 6, [0, 1]], ["AN", 6, 0, 5], ["FU", 6, [1, 2]], ["AN", 6, 1, 4], ["FU", 6, [2, 3]], ["AN", 6, 2, 6], ["FU", 4, [0, 1]], ["SP", 4, 0, 20, [1], 1], ["AN", 4, 1, 2], ["FFSP", 4, 0, [3, 2], 1, 1], ["AN", 4, 1, 6], ["FU", 2, [0, 1]], ["SP", 2, 0, 4, [2], 1], ["AN", 2, 1, 2], ["FFSP", 2, 0, [3, 2], 1, 1], ["AN", 2, 1, 6], ["PR", 5, 0, "auto_unroll_max_step$0"]]]], "r": [[1.5714e-05, 1.57258e-05, 1.57241e-05], 0, 18.1452, 1662030634], "v": "v0.6"}
{"i": [["[\"fused_pointwise_conv_bias_add_sigmoid_mul\", 14, 14, 20, 480, 1]", "cuda -keys=cuda,gpu -max_num_threads=1024 -model=unknown -thread_warp_size=32", [-1, 16, 64, 49152, 2147483647, 1024, 8, 32], "", 0, []], [[], [["CI", 5], ["CHW", 3, "local"], ["SP", 3, 0, 1, [1, 1, 1, 1], 1], ["SP", 3, 5, 480, [1, 40, 12, 1], 1], ["SP", 3, 10, 20, [1, 4], 1], ["RE", 3, [0, 5, 1, 6, 2, 7, 10, 11, 3, 8, 12, 4, 9]], ["FSP", 4, 0, 2, 3], ["FSP", 4, 4, 3, 3], ["RE", 4, [0, 4, 1, 5, 2, 6, 3, 7]], ["CA", 3, 4, 5], ["CHR", 2, "shared", [3]], ["CA", 3, 4, 6], ["CHR", 1, "shared", [4]], ["CA", 2, 5, 6], ["FU", 9, [0, 1, 2, 3]], ["SP", 9, 0, 94080, [32], 1], ["AN", 9, 0, 5], ["AN", 9, 1, 6], ["FU", 6, [0, 1]], ["AN", 6, 0, 5], ["FU", 6, [1, 2]], ["AN", 6, 1, 4], ["FU", 6, [2, 3]], ["AN", 6, 2, 6], ["FU", 4, [0, 1]], ["SP", 4, 0, 48, [1], 1], ["AN", 4, 1, 2], ["FFSP", 4, 0, [3, 2], 1, 1], ["AN", 4, 1, 6], ["FU", 2, [0, 1]], ["SP", 2, 0, 4, [1], 1], ["AN", 2, 1, 2], ["FFSP", 2, 0, [3, 2], 1, 1], ["AN", 2, 1, 6], ["PR", 5, 0, "auto_unroll_max_step$64"]]]], "r": [[2.18259e-05, 2.183e-05, 2.18157e-05], 0, 19.3356, 1662030636], "v": "v0.6"}
{"i": [["[\"fused_pointwise_conv_bias_add_sigmoid_mul\", 14, 14, 20, 480, 1]", "cuda -keys=cuda,gpu -max_num_threads=1024 -model=unknown -thread_warp_size=32", [-1, 16, 64, 49152, 2147483647, 1024, 8, 32], "", 0, []], [[], [["CI", 5], ["CHW", 3, "local"], ["SP", 3, 0, 1, [1, 1, 1, 1], 1], ["SP", 3, 5, 480, [1, 480, 1, 1], 1], ["SP", 3, 10, 20, [5, 1], 1], ["RE", 3, [0, 5, 1, 6, 2, 7, 10, 11, 3, 8, 12, 4, 9]], ["FSP", 4, 0, 2, 3], ["FSP", 4, 4, 3, 3], ["RE", 4, [0, 4, 1, 5, 2, 6, 3, 7]], ["CA", 3, 4, 5], ["CHR", 2, "shared", [3]], ["CA", 3, 4, 6], ["CHR", 1, "shared", [4]], ["CA", 2, 5, 6], ["FU", 9, [0, 1, 2, 3]], ["SP", 9, 0, 94080, [32], 1], ["AN", 9, 0, 5], ["AN", 9, 1, 6], ["FU", 6, [0, 1]], ["AN", 6, 0, 5], ["FU", 6, [1, 2]], ["AN", 6, 1, 4], ["FU", 6, [2, 3]], ["AN", 6, 2, 6], ["FU", 4, [0, 1]], ["SP", 4, 0, 5, [1], 1], ["AN", 4, 1, 2], ["FFSP", 4, 0, [3, 2], 1, 1], ["AN", 4, 1, 6], ["FU", 2, [0, 1]], ["SP", 2, 0, 5, [1], 1], ["AN", 2, 1, 2], ["FFSP", 2, 0, [3, 2], 1, 1], ["AN", 2, 1, 6], ["PR", 5, 0, "auto_unroll_max_step$0"]]]], "r": [[1.58759e-05, 1.58707e-05, 1.58777e-05], 0, 20.7728, 1662030637], "v": "v0.6"}
{"i": [["[\"fused_pointwise_conv_bias_add_sigmoid_mul\", 14, 14, 20, 480, 1]", "cuda -keys=cuda,gpu -max_num_threads=1024 -model=unknown -thread_warp_size=32", [-1, 16, 64, 49152, 2147483647, 1024, 8, 32], "", 0, []], [[], [["CI", 5], ["CHW", 3, "local"], ["SP", 3, 0, 1, [1, 1, 1, 1], 1], ["SP", 3, 5, 480, [1, 40, 4, 1], 1], ["SP", 3, 10, 20, [10, 1], 1], ["RE", 3, [0, 5, 1, 6, 2, 7, 10, 11, 3, 8, 12, 4, 9]], ["FSP", 4, 0, 2, 3], ["FSP", 4, 4, 3, 3], ["RE", 4, [0, 4, 1, 5, 2, 6, 3, 7]], ["CA", 3, 4, 5], ["CHR", 2, "shared", [3]], ["CA", 3, 4, 6], ["CHR", 1, "shared", [4]], ["CA", 2, 5, 6], ["FU", 9, [0, 1, 2, 3]], ["SP", 9, 0, 94080, [8], 1], ["AN", 9, 0, 5], ["AN", 9, 1, 6], ["FU", 6, [0, 1]], ["AN", 6, 0, 5], ["FU", 6, [1, 2]], ["AN", 6, 1, 4], ["FU", 6, [2, 3]], ["AN", 6, 2, 6], ["FU", 4, [0, 1]], ["SP", 4, 0, 40, [1], 1], ["AN", 4, 1, 2], ["FFSP", 4, 0, [3, 2], 1, 1], ["AN", 4, 1, 6], ["FU", 2, [0, 1]], ["SP", 2, 0, 10, [1], 1], ["AN", 2, 1, 2], ["FFSP", 2, 0, [3, 2], 1, 1], ["AN", 2, 1, 6], ["PR", 5, 0, "auto_unroll_max_step$1024"]]]], "r": [[2.81909e-05, 2.81889e-05, 2.81817e-05], 0, 21.308, 1662030638], "v": "v0.6"}
{"i": [["[\"fused_pointwise_conv_bias_add_sigmoid_mul\", 14, 14, 20, 480, 1]", "cuda -keys=cuda,gpu -max_num_threads=1024 -model=unknown -thread_warp_size=32", [-1, 16, 64, 49152, 2147483647, 1024, 8, 32], "", 0, []], [[], [["CI", 5], ["CHW", 3, "local"], ["SP", 3, 0, 1, [1, 1, 1, 1], 1], ["SP", 3, 5, 480, [3, 80, 1, 2], 1], ["SP", 3, 10, 20, [1, 1], 1], ["RE", 3, [0, 5, 1, 6, 2, 7, 10, 11, 3, 8, 12, 4, 9]], ["FSP", 4, 0, 2, 3], ["FSP", 4, 4, 3, 3], ["RE", 4, [0, 4, 1, 5, 2, 6, 3, 7]], ["CA", 3, 4, 5], ["CHR", 2, "shared", [3]], ["CA", 3, 4, 6], ["CHR", 1, "shared", [4]], ["CA", 2, 5, 6], ["FU", 9, [0, 1, 2, 3]], ["SP", 9, 0, 94080, [32], 1], ["AN", 9, 0, 5], ["AN", 9, 1, 6], ["FU", 6, [0, 1]], ["AN", 6, 0, 5], ["FU", 6, [1, 2]], ["AN", 6, 1, 4], ["FU", 6, [2, 3]], ["AN", 6, 2, 6], ["FU", 4, [0, 1]], ["SP", 4, 0, 10, [1], 1], ["AN", 4, 1, 2], ["FFSP", 4, 0, [3, 2], 1, 1], ["AN", 4, 1, 6], ["FU", 2, [0, 1]], ["SP", 2, 0, 5, [1], 1], ["AN", 2, 1, 2], ["FFSP", 2, 0, [3, 2], 1, 1], ["AN", 2, 1, 6], ["PR", 5, 0, "auto_unroll_max_step$0"]]]], "r": [[1.95728e-05, 1.95667e-05, 1.95746e-05], 0, 22.4183, 1662030639], "v": "v0.6"}
{"i": [["[\"fused_pointwise_conv_bias_add_sigmoid_mul\", 14, 14, 20, 480, 1]", "cuda -keys=cuda,gpu -max_num_threads=1024 -model=unknown -thread_warp_size=32", [-1, 16, 64, 49152, 2147483647, 1024, 8, 32], "", 0, []], [[], [["CI", 5], ["CHW", 3, "local"], ["SP", 3, 0, 1, [1, 1, 1, 1], 1], ["SP", 3, 5, 480, [3, 40, 1, 1], 1], ["SP", 3, 10, 20, [10, 2], 1], ["RE", 3, [0, 5, 1, 6, 2, 7, 10, 11, 3, 8, 12, 4, 9]], ["FSP", 4, 0, 2, 3], ["FSP", 4, 4, 3, 3], ["RE", 4, [0, 4, 1, 5, 2, 6, 3, 7]], ["CA", 3, 4, 5], ["CHR", 2, "shared", [3]], ["CA", 3, 4, 6], ["CHR", 1, "shared", [4]], ["CA", 2, 5, 6], ["FU", 9, [0, 1, 2, 3]], ["SP", 9, 0, 94080, [32], 1], ["AN", 9, 0, 5], ["AN", 9, 1, 6], ["FU", 6, [0, 1]], ["AN", 6, 0, 5], ["FU", 6, [1, 2]], ["AN", 6, 1, 4], ["FU", 6, [2, 3]], ["AN", 6, 2, 6], ["FU", 4, [0, 1]], ["SP", 4, 0, 2, [1], 1], ["AN", 4, 1, 2], ["FFSP", 4, 0, [3, 2], 1, 1], ["AN", 4, 1, 6], ["FU", 2, [0, 1]], ["SP", 2, 0, 2, [2], 1], ["AN", 2, 1, 2], ["FFSP", 2, 0, [3, 2], 1, 1], ["AN", 2, 1, 6], ["PR", 5, 0, "auto_unroll_max_step$0"]]]], "r": [[1.71115e-05, 1.7112e-05, 1.71136e-05], 0, 23.6587, 1662030640], "v": "v0.6"}
{"i": [["[\"fused_pointwise_conv_bias_add_sigmoid_mul\", 14, 14, 20, 480, 1]", "cuda -keys=cuda,gpu -max_num_threads=1024 -model=unknown -thread_warp_size=32", [-1, 16, 64, 49152, 2147483647, 1024, 8, 32], "", 0, []], [[], [["CI", 5], ["CHW", 3, "local"], ["SP", 3, 0, 1, [1, 1, 1, 1], 1], ["SP", 3, 5, 480, [3, 40, 1, 1], 1], ["SP", 3, 10, 20, [1, 20], 1], ["RE", 3, [0, 5, 1, 6, 2, 7, 10, 11, 3, 8, 12, 4, 9]], ["FSP", 4, 0, 2, 3], ["FSP", 4, 4, 3, 3], ["RE", 4, [0, 4, 1, 5, 2, 6, 3, 7]], ["CA", 3, 4, 5], ["CHR", 2, "shared", [3]], ["CA", 3, 4, 6], ["CHR", 1, "shared", [4]], ["CA", 2, 5, 6], ["FU", 9, [0, 1, 2, 3]], ["SP", 9, 0, 94080, [1], 1], ["AN", 9, 0, 5], ["AN", 9, 1, 6], ["FU", 6, [0, 1]], ["AN", 6, 0, 5], ["FU", 6, [1, 2]], ["AN", 6, 1, 4], ["FU", 6, [2, 3]], ["AN", 6, 2, 6], ["FU", 4, [0, 1]], ["SP", 4, 0, 2, [1], 1], ["AN", 4, 1, 2], ["FFSP", 4, 0, [3, 2], 1, 1], ["AN", 4, 1, 6], ["FU", 2, [0, 1]], ["SP", 2, 0, 2, [1], 1], ["AN", 2, 1, 2], ["FFSP", 2, 0, [3, 2], 1, 1], ["AN", 2, 1, 6], ["PR", 5, 0, "auto_unroll_max_step$0"]]]], "r": [[0.000138646, 0.000138633, 0.000138657], 0, 22.9834, 1662030639], "v": "v0.6"}
{"i": [["[\"fused_pointwise_conv_bias_add_sigmoid_mul\", 14, 14, 20, 480, 1]", "cuda -keys=cuda,gpu -max_num_threads=1024 -model=unknown -thread_warp_size=32", [-1, 16, 64, 49152, 2147483647, 1024, 8, 32], "", 0, []], [[], [["CI", 5], ["CHW", 3, "local"], ["SP", 3, 0, 1, [1, 1, 1, 1], 1], ["SP", 3, 5, 480, [8, 60, 1, 1], 1], ["SP", 3, 10, 20, [1, 4], 1], ["RE", 3, [0, 5, 1, 6, 2, 7, 10, 11, 3, 8, 12, 4, 9]], ["FSP", 4, 0, 2, 3], ["FSP", 4, 4, 3, 3], ["RE", 4, [0, 4, 1, 5, 2, 6, 3, 7]], ["CA", 3, 4, 5], ["CHR", 2, "shared", [3]], ["CA", 3, 4, 6], ["CHR", 1, "shared", [4]], ["CA", 2, 5, 6], ["FU", 9, [0, 1, 2, 3]], ["SP", 9, 0, 94080, [32], 1], ["AN", 9, 0, 5], ["AN", 9, 1, 6], ["FU", 6, [0, 1]], ["AN", 6, 0, 5], ["FU", 6, [1, 2]], ["AN", 6, 1, 4], ["FU", 6, [2, 3]], ["AN", 6, 2, 6], ["FU", 4, [0, 1]], ["SP", 4, 0, 2, [1], 1], ["AN", 4, 1, 2], ["FFSP", 4, 0, [3, 2], 1, 1], ["AN", 4, 1, 6], ["FU", 2, [0, 1]], ["SP", 2, 0, 2, [1], 1], ["AN", 2, 1, 2], ["FFSP", 2, 0, [3, 2], 1, 1], ["AN", 2, 1, 6], ["PR", 5, 0, "auto_unroll_max_step$0"]]]], "r": [[1.85077e-05, 1.85043e-05, 1.85074e-05], 0, 18.7324, 1662030635], "v": "v0.6"}
{"i": [["[\"fused_pointwise_conv_bias_add_sigmoid_mul\", 14, 14, 20, 480, 1]", "cuda -keys=cuda,gpu -max_num_threads=1024 -model=unknown -thread_warp_size=32", [-1, 16, 64, 49152, 2147483647, 1024, 8, 32], "", 0, []], [[], [["CI", 5], ["CHW", 3, "local"], ["SP", 3, 0, 1, [1, 1, 1, 1], 1], ["SP", 3, 5, 480, [2, 120, 2, 1], 1], ["SP", 3, 10, 20, [5, 4], 1], ["RE", 3, [0, 5, 1, 6, 2, 7, 10, 11, 3, 8, 12, 4, 9]], ["FSP", 4, 0, 2, 3], ["FSP", 4, 4, 3, 3], ["RE", 4, [0, 4, 1, 5, 2, 6, 3, 7]], ["CA", 3, 4, 5], ["CHR", 2, "shared", [3]], ["CA", 3, 4, 6], ["CHR", 1, "shared", [4]], ["CA", 2, 5, 6], ["FU", 9, [0, 1, 2, 3]], ["SP", 9, 0, 94080, [32], 1], ["AN", 9, 0, 5], ["AN", 9, 1, 6], ["FU", 6, [0, 1]], ["AN", 6, 0, 5], ["FU", 6, [1, 2]], ["AN", 6, 1, 4], ["FU", 6, [2, 3]], ["AN", 6, 2, 6], ["FU", 4, [0, 1]], ["SP", 4, 0, 40, [1], 1], ["AN", 4, 1, 2], ["FFSP", 4, 0, [3, 2], 1, 1], ["AN", 4, 1, 6], ["FU", 2, [0, 1]], ["SP", 2, 0, 20, [1], 1], ["AN", 2, 1, 2], ["FFSP", 2, 0, [3, 2], 1, 1], ["AN", 2, 1, 6], ["PR", 5, 0, "auto_unroll_max_step$512"]]]], "r": [[1.50048e-05, 1.49949e-05, 1.50037e-05], 0, 24.2649, 1662030640], "v": "v0.6"}
{"i": [["[\"fused_pointwise_conv_bias_add_sigmoid_mul\", 14, 14, 20, 480, 1]", "cuda -keys=cuda,gpu -max_num_threads=1024 -model=unknown -thread_warp_size=32", [-1, 16, 64, 49152, 2147483647, 1024, 8, 32], "", 0, []], [[], [["CI", 5], ["CHW", 3, "local"], ["SP", 3, 0, 1, [1, 1, 1, 1], 1], ["SP", 3, 5, 480, [2, 60, 1, 1], 1], ["SP", 3, 10, 20, [4, 1], 1], ["RE", 3, [0, 5, 1, 6, 2, 7, 10, 11, 3, 8, 12, 4, 9]], ["FSP", 4, 0, 2, 3], ["FSP", 4, 4, 3, 3], ["RE", 4, [0, 4, 1, 5, 2, 6, 3, 7]], ["CA", 3, 4, 5], ["CHR", 2, "shared", [3]], ["CA", 3, 4, 6], ["CHR", 1, "shared", [4]], ["CA", 2, 5, 6], ["FU", 9, [0, 1, 2, 3]], ["SP", 9, 0, 94080, [32], 1], ["AN", 9, 0, 5], ["AN", 9, 1, 6], ["FU", 6, [0, 1]], ["AN", 6, 0, 5], ["FU", 6, [1, 2]], ["AN", 6, 1, 4], ["FU", 6, [2, 3]], ["AN", 6, 2, 6], ["FU", 4, [0, 1]], ["SP", 4, 0, 4, [1], 1], ["AN", 4, 1, 2], ["FFSP", 4, 0, [3, 2], 1, 1], ["AN", 4, 1, 6], ["FU", 2, [0, 1]], ["SP", 2, 0, 4, [2], 1], ["AN", 2, 1, 2], ["FFSP", 2, 0, [3, 2], 1, 1], ["AN", 2, 1, 6], ["PR", 5, 0, "auto_unroll_max_step$64"]]]], "r": [[1.59412e-05, 1.59395e-05, 1.59401e-05], 0, 21.8357, 1662030638], "v": "v0.6"}
{"i": [["[\"fused_pointwise_conv_bias_add_sigmoid_mul\", 14, 14, 20, 480, 1]", "cuda -keys=cuda,gpu -max_num_threads=1024 -model=unknown -thread_warp_size=32", [-1, 16, 64, 49152, 2147483647, 1024, 8, 32], "", 0, []], [[], [["CI", 5], ["CHW", 3, "local"], ["SP", 3, 0, 1, [1, 1, 1, 1], 1], ["SP", 3, 5, 480, [1, 40, 4, 3], 1], ["SP", 3, 10, 20, [1, 4], 1], ["RE", 3, [0, 5, 1, 6, 2, 7, 10, 11, 3, 8, 12, 4, 9]], ["FSP", 4, 0, 2, 3], ["FSP", 4, 4, 3, 3], ["RE", 4, [0, 4, 1, 5, 2, 6, 3, 7]], ["CA", 3, 4, 5], ["CHR", 2, "shared", [3]], ["CA", 3, 4, 6], ["CHR", 1, "shared", [4]], ["CA", 2, 5, 6], ["FU", 9, [0, 1, 2, 3]], ["SP", 9, 0, 94080, [32], 1], ["AN", 9, 0, 5], ["AN", 9, 1, 6], ["FU", 6, [0, 1]], ["AN", 6, 0, 5], ["FU", 6, [1, 2]], ["AN", 6, 1, 4], ["FU", 6, [2, 3]], ["AN", 6, 2, 6], ["FU", 4, [0, 1]], ["SP", 4, 0, 24, [1], 1], ["AN", 4, 1, 2], ["FFSP", 4, 0, [3, 2], 1, 1], ["AN", 4, 1, 6], ["FU", 2, [0, 1]], ["SP", 2, 0, 4, [1], 1], ["AN", 2, 1, 2], ["FFSP", 2, 0, [3, 2], 1, 1], ["AN", 2, 1, 6], ["PR", 5, 0, "auto_unroll_max_step$0"]]]], "r": [[2.20995e-05, 2.20931e-05, 2.20921e-05], 0, 24.1706, 1662030641], "v": "v0.6"}
{"i": [["[\"fused_pointwise_conv_bias_add_sigmoid_mul\", 14, 14, 20, 480, 1]", "cuda -keys=cuda,gpu -max_num_threads=1024 -model=unknown -thread_warp_size=32", [-1, 16, 64, 49152, 2147483647, 1024, 8, 32], "", 0, []], [[], [["CI", 5], ["CHW", 3, "local"], ["SP", 3, 0, 1, [1, 1, 1, 1], 1], ["SP", 3, 5, 480, [1, 5, 3, 2], 1], ["SP", 3, 10, 20, [1, 20], 1], ["RE", 3, [0, 5, 1, 6, 2, 7, 10, 11, 3, 8, 12, 4, 9]], ["FSP", 4, 0, 2, 3], ["FSP", 4, 4, 3, 3], ["RE", 4, [0, 4, 1, 5, 2, 6, 3, 7]], ["CA", 3, 4, 5], ["CHR", 2, "shared", [3]], ["CA", 3, 4, 6], ["CHR", 1, "shared", [4]], ["CA", 2, 5, 6], ["FU", 9, [0, 1, 2, 3]], ["SP", 9, 0, 94080, [64], 1], ["AN", 9, 0, 5], ["AN", 9, 1, 6], ["FU", 6, [0, 1]], ["AN", 6, 0, 5], ["FU", 6, [1, 2]], ["AN", 6, 1, 4], ["FU", 6, [2, 3]], ["AN", 6, 2, 6], ["FU", 4, [0, 1]], ["SP", 4, 0, 24, [1], 1], ["AN", 4, 1, 2], ["FFSP", 4, 0, [3, 2], 1, 1], ["AN", 4, 1, 6], ["FU", 2, [0, 1]], ["SP", 2, 0, 4, [4], 1], ["AN", 2, 1, 2], ["FFSP", 2, 0, [3, 2], 1, 1], ["AN", 2, 1, 6], ["PR", 5, 0, "auto_unroll_max_step$16"]]]], "r": [[2.09082e-05, 2.09105e-05, 2.09146e-05], 0, 24.1869, 1662030642], "v": "v0.6"}
{"i": [["[\"fused_pointwise_conv_bias_add_sigmoid_mul\", 14, 14, 20, 480, 1]", "cuda -keys=cuda,gpu -max_num_threads=1024 -model=unknown -thread_warp_size=32", [-1, 16, 64, 49152, 2147483647, 1024, 8, 32], "", 0, []], [[], [["CI", 5], ["CHW", 3, "local"], ["SP", 3, 0, 1, [1, 1, 1, 1], 1], ["SP", 3, 5, 480, [1, 80, 1, 3], 1], ["SP", 3, 10, 20, [2, 10], 1], ["RE", 3, [0, 5, 1, 6, 2, 7, 10, 11, 3, 8, 12, 4, 9]], ["FSP", 4, 0, 2, 3], ["FSP", 4, 4, 3, 3], ["RE", 4, [0, 4, 1, 5, 2, 6, 3, 7]], ["CA", 3, 4, 5], ["CHR", 2, "shared", [3]], ["CA", 3, 4, 6], ["CHR", 1, "shared", [4]], ["CA", 2, 5, 6], ["FU", 9, [0, 1, 2, 3]], ["SP", 9, 0, 94080, [32], 1], ["AN", 9, 0, 5], ["AN", 9, 1, 6], ["FU", 6, [0, 1]], ["AN", 6, 0, 5], ["FU", 6, [1, 2]], ["AN", 6, 1, 4], ["FU", 6, [2, 3]], ["AN", 6, 2, 6], ["FU", 4, [0, 1]], ["SP", 4, 0, 60, [1], 1], ["AN", 4, 1, 2], ["FFSP", 4, 0, [3, 2], 1, 1], ["AN", 4, 1, 6], ["FU", 2, [0, 1]], ["SP", 2, 0, 20, [5], 1], ["AN", 2, 1, 2], ["FFSP", 2, 0, [3, 2], 1, 1], ["AN", 2, 1, 6], ["PR", 5, 0, "auto_unroll_max_step$16"]]]], "r": [[1.71181e-05, 1.7136e-05, 1.71181e-05], 0, 24.0489, 1662030642], "v": "v0.6"}
{"i": [["[\"fused_pointwise_conv_bias_add_sigmoid_mul\", 14, 14, 20, 480, 1]", "cuda -keys=cuda,gpu -max_num_threads=1024 -model=unknown -thread_warp_size=32", [-1, 16, 64, 49152, 2147483647, 1024, 8, 32], "", 0, []], [[], [["CI", 5], ["CHW", 3, "local"], ["SP", 3, 0, 1, [1, 1, 1, 1], 1], ["SP", 3, 5, 480, [2, 40, 6, 1], 1], ["SP", 3, 10, 20, [1, 1], 1], ["RE", 3, [0, 5, 1, 6, 2, 7, 10, 11, 3, 8, 12, 4, 9]], ["FSP", 4, 0, 2, 3], ["FSP", 4, 4, 3, 3], ["RE", 4, [0, 4, 1, 5, 2, 6, 3, 7]], ["CA", 3, 4, 5], ["CHR", 2, "shared", [3]], ["CA", 3, 4, 6], ["CHR", 1, "shared", [4]], ["CA", 2, 5, 6], ["FU", 9, [0, 1, 2, 3]], ["SP", 9, 0, 94080, [64], 1], ["AN", 9, 0, 5], ["AN", 9, 1, 6], ["FU", 6, [0, 1]], ["AN", 6, 0, 5], ["FU", 6, [1, 2]], ["AN", 6, 1, 4], ["FU", 6, [2, 3]], ["AN", 6, 2, 6], ["FU", 4, [0, 1]], ["SP", 4, 0, 30, [1], 1], ["AN", 4, 1, 2], ["FFSP", 4, 0, [3, 2], 1, 1], ["AN", 4, 1, 6], ["FU", 2, [0, 1]], ["SP", 2, 0, 5, [1], 1], ["AN", 2, 1, 2], ["FFSP", 2, 0, [3, 2], 1, 1], ["AN", 2, 1, 6], ["PR", 5, 0, "auto_unroll_max_step$512"]]]], "r": [[2.54999e-05, 2.54947e-05, 2.54958e-05], 0, 24.3895, 1662030643], "v": "v0.6"}
{"i": [["[\"fused_pointwise_conv_bias_add_sigmoid_mul\", 14, 14, 20, 480, 1]", "cuda -keys=cuda,gpu -max_num_threads=1024 -model=unknown -thread_warp_size=32", [-1, 16, 64, 49152, 2147483647, 1024, 8, 32], "", 0, []], [[], [["CI", 5], ["CHW", 3, "local"], ["SP", 3, 0, 1, [1, 1, 1, 1], 1], ["SP", 3, 5, 480, [3, 40, 2, 1], 1], ["SP", 3, 10, 20, [1, 10], 1], ["RE", 3, [0, 5, 1, 6, 2, 7, 10, 11, 3, 8, 12, 4, 9]], ["FSP", 4, 0, 2, 3], ["FSP", 4, 4, 3, 3], ["RE", 4, [0, 4, 1, 5, 2, 6, 3, 7]], ["CA", 3, 4, 5], ["CHR", 2, "shared", [3]], ["CA", 3, 4, 6], ["CHR", 1, "shared", [4]], ["CA", 2, 5, 6], ["FU", 9, [0, 1, 2, 3]], ["SP", 9, 0, 94080, [32], 1], ["AN", 9, 0, 5], ["AN", 9, 1, 6], ["FU", 6, [0, 1]], ["AN", 6, 0, 5], ["FU", 6, [1, 2]], ["AN", 6, 1, 4], ["FU", 6, [2, 3]], ["AN", 6, 2, 6], ["FU", 4, [0, 1]], ["SP", 4, 0, 20, [2], 1], ["AN", 4, 1, 2], ["FFSP", 4, 0, [3, 2], 1, 1], ["AN", 4, 1, 6], ["FU", 2, [0, 1]], ["SP", 2, 0, 10, [1], 1], ["AN", 2, 1, 2], ["FFSP", 2, 0, [3, 2], 1, 1], ["AN", 2, 1, 6], ["PR", 5, 0, "auto_unroll_max_step$1024"]]]], "r": [[1.63911e-05, 1.63924e-05, 1.63817e-05], 0, 24.2133, 1662030643], "v": "v0.6"}
{"i": [["[\"fused_pointwise_conv_bias_add_sigmoid_mul\", 14, 14, 20, 480, 1]", "cuda -keys=cuda,gpu -max_num_threads=1024 -model=unknown -thread_warp_size=32", [-1, 16, 64, 49152, 2147483647, 1024, 8, 32], "", 0, []], [[], [["CI", 5], ["CHW", 3, "local"], ["SP", 3, 0, 1, [1, 1, 1, 1], 1], ["SP", 3, 5, 480, [2, 16, 1, 15], 1], ["SP", 3, 10, 20, [2, 1], 1], ["RE", 3, [0, 5, 1, 6, 2, 7, 10, 11, 3, 8, 12, 4, 9]], ["FSP", 4, 0, 2, 3], ["FSP", 4, 4, 3, 3], ["RE", 4, [0, 4, 1, 5, 2, 6, 3, 7]], ["CA", 3, 4, 5], ["CHR", 2, "shared", [3]], ["CA", 3, 4, 6], ["CHR", 1, "shared", [4]], ["CA", 2, 5, 6], ["FU", 9, [0, 1, 2, 3]], ["SP", 9, 0, 94080, [1], 1], ["AN", 9, 0, 5], ["AN", 9, 1, 6], ["FU", 6, [0, 1]], ["AN", 6, 0, 5], ["FU", 6, [1, 2]], ["AN", 6, 1, 4], ["FU", 6, [2, 3]], ["AN", 6, 2, 6], ["FU", 4, [0, 1]], ["SP", 4, 0, 2, [1], 1], ["AN", 4, 1, 2], ["FFSP", 4, 0, [3, 2], 1, 1], ["AN", 4, 1, 6], ["FU", 2, [0, 1]], ["SP", 2, 0, 2, [2], 1], ["AN", 2, 1, 2], ["FFSP", 2, 0, [3, 2], 1, 1], ["AN", 2, 1, 6], ["PR", 5, 0, "auto_unroll_max_step$1024"]]]], "r": [[0.000154754, 0.000154724, 0.000154729], 0, 24.123, 1662030644], "v": "v0.6"}
{"i": [["[\"fused_pointwise_conv_bias_add_sigmoid_mul\", 14, 14, 20, 480, 1]", "cuda -keys=cuda,gpu -max_num_threads=1024 -model=unknown -thread_warp_size=32", [-1, 16, 64, 49152, 2147483647, 1024, 8, 32], "", 0, []], [[], [["CI", 5], ["CHW", 3, "local"], ["SP", 3, 0, 1, [1, 1, 1, 1], 1], ["SP", 3, 5, 480, [1, 48, 10, 1], 1], ["SP", 3, 10, 20, [2, 2], 1], ["RE", 3, [0, 5, 1, 6, 2, 7, 10, 11, 3, 8, 12, 4, 9]], ["FSP", 4, 0, 2, 3], ["FSP", 4, 4, 3, 3], ["RE", 4, [0, 4, 1, 5, 2, 6, 3, 7]], ["CA", 3, 4, 5], ["CHR", 2, "shared", [3]], ["CA", 3, 4, 6], ["CHR", 1, "shared", [4]], ["CA", 2, 5, 6], ["FU", 9, [0, 1, 2, 3]], ["SP", 9, 0, 94080, [4], 1], ["AN", 9, 0, 5], ["AN", 9, 1, 6], ["FU", 6, [0, 1]], ["AN", 6, 0, 5], ["FU", 6, [1, 2]], ["AN", 6, 1, 4], ["FU", 6, [2, 3]], ["AN", 6, 2, 6], ["FU", 4, [0, 1]], ["SP", 4, 0, 20, [1], 1], ["AN", 4, 1, 2], ["FFSP", 4, 0, [3, 2], 1, 1], ["AN", 4, 1, 6], ["FU", 2, [0, 1]], ["SP", 2, 0, 4, [1], 1], ["AN", 2, 1, 2], ["FFSP", 2, 0, [3, 2], 1, 1], ["AN", 2, 1, 6], ["PR", 5, 0, "auto_unroll_max_step$0"]]]], "r": [[4.7359e-05, 4.7377e-05, 4.73651e-05], 0, 24.1695, 1662030645], "v": "v0.6"}
{"i": [["[\"fused_pointwise_conv_bias_add_sigmoid_mul\", 14, 14, 20, 480, 1]", "cuda -keys=cuda,gpu -max_num_threads=1024 -model=unknown -thread_warp_size=32", [-1, 16, 64, 49152, 2147483647, 1024, 8, 32], "", 0, []], [[], [["CI", 5], ["CHW", 3, "local"], ["SP", 3, 0, 1, [1, 1, 1, 1], 1], ["SP", 3, 5, 480, [2, 48, 5, 1], 1], ["SP", 3, 10, 20, [1, 4], 1], ["RE", 3, [0, 5, 1, 6, 2, 7, 10, 11, 3, 8, 12, 4, 9]], ["FSP", 4, 0, 2, 3], ["FSP", 4, 4, 3, 3], ["RE", 4, [0, 4, 1, 5, 2, 6, 3, 7]], ["CA", 3, 4, 5], ["CHR", 2, "shared", [3]], ["CA", 3, 4, 6], ["CHR", 1, "shared", [4]], ["CA", 2, 5, 6], ["FU", 9, [0, 1, 2, 3]], ["SP", 9, 0, 94080, [1], 1], ["AN", 9, 0, 5], ["AN", 9, 1, 6], ["FU", 6, [0, 1]], ["AN", 6, 0, 5], ["FU", 6, [1, 2]], ["AN", 6, 1, 4], ["FU", 6, [2, 3]], ["AN", 6, 2, 6], ["FU", 4, [0, 1]], ["SP", 4, 0, 40, [1], 1], ["AN", 4, 1, 2], ["FFSP", 4, 0, [3, 2], 1, 1], ["AN", 4, 1, 6], ["FU", 2, [0, 1]], ["SP", 2, 0, 4, [1], 1], ["AN", 2, 1, 2], ["FFSP", 2, 0, [3, 2], 1, 1], ["AN", 2, 1, 6], ["PR", 5, 0, "auto_unroll_max_step$16"]]]], "r": [[0.000142351, 0.000142336, 0.000142345], 0, 24.124, 1662030645], "v": "v0.6"}
{"i": [["[\"fused_pointwise_conv_bias_add_sigmoid_mul\", 14, 14, 20, 480, 1]", "cuda -keys=cuda,gpu -max_num_threads=1024 -model=unknown -thread_warp_size=32", [-1, 16, 64, 49152, 2147483647, 1024, 8, 32], "", 0, []], [[], [["CI", 5], ["CHW", 3, "local"], ["SP", 3, 0, 1, [1, 1, 1, 1], 1], ["SP", 3, 5, 480, [1, 80, 1, 3], 1], ["SP", 3, 10, 20, [2, 10], 1], ["RE", 3, [0, 5, 1, 6, 2, 7, 10, 11, 3, 8, 12, 4, 9]], ["FSP", 4, 0, 2, 3], ["FSP", 4, 4, 3, 3], ["RE", 4, [0, 4, 1, 5, 2, 6, 3, 7]], ["CA", 3, 4, 5], ["CHR", 2, "shared", [3]], ["CA", 3, 4, 6], ["CHR", 1, "shared", [4]], ["CA", 2, 5, 6], ["FU", 9, [0, 1, 2, 3]], ["SP", 9, 0, 94080, [32], 1], ["AN", 9, 0, 5], ["AN", 9, 1, 6], ["FU", 6, [0, 1]], ["AN", 6, 0, 5], ["FU", 6, [1, 2]], ["AN", 6, 1, 4], ["FU", 6, [2, 3]], ["AN", 6, 2, 6], ["FU", 4, [0, 1]], ["SP", 4, 0, 60, [1], 1], ["AN", 4, 1, 2], ["FFSP", 4, 0, [3, 2], 1, 1], ["AN", 4, 1, 6], ["FU", 2, [0, 1]], ["SP", 2, 0, 20, [1], 1], ["AN", 2, 1, 2], ["FFSP", 2, 0, [3, 2], 1, 1], ["AN", 2, 1, 6], ["PR", 5, 0, "auto_unroll_max_step$64"]]]], "r": [[1.58303e-05, 1.58286e-05, 1.5839e-05], 0, 24.1011, 1662030646], "v": "v0.6"}
{"i": [["[\"fused_pointwise_conv_bias_add_sigmoid_mul\", 14, 14, 20, 480, 1]", "cuda -keys=cuda,gpu -max_num_threads=1024 -model=unknown -thread_warp_size=32", [-1, 16, 64, 49152, 2147483647, 1024, 8, 32], "", 0, []], [[], [["CI", 5], ["CHW", 3, "local"], ["SP", 3, 0, 1, [1, 1, 1, 1], 1], ["SP", 3, 5, 480, [1, 40, 3, 2], 1], ["SP", 3, 10, 20, [1, 4], 1], ["RE", 3, [0, 5, 1, 6, 2, 7, 10, 11, 3, 8, 12, 4, 9]], ["FSP", 4, 0, 2, 3], ["FSP", 4, 4, 3, 3], ["RE", 4, [0, 4, 1, 5, 2, 6, 3, 7]], ["CA", 3, 4, 5], ["CHR", 2, "shared", [3]], ["CA", 3, 4, 6], ["CHR", 1, "shared", [4]], ["CA", 2, 5, 6], ["FU", 9, [0, 1, 2, 3]], ["SP", 9, 0, 94080, [32], 1], ["AN", 9, 0, 5], ["AN", 9, 1, 6], ["FU", 6, [0, 1]], ["AN", 6, 0, 5], ["FU", 6, [1, 2]], ["AN", 6, 1, 4], ["FU", 6, [2, 3]], ["AN", 6, 2, 6], ["FU", 4, [0, 1]], ["SP", 4, 0, 24, [1], 1], ["AN", 4, 1, 2], ["FFSP", 4, 0, [3, 2], 1, 1], ["AN", 4, 1, 6], ["FU", 2, [0, 1]], ["SP", 2, 0, 4, [4], 1], ["AN", 2, 1, 2], ["FFSP", 2, 0, [3, 2], 1, 1], ["AN", 2, 1, 6], ["PR", 5, 0, "auto_unroll_max_step$16"]]]], "r": [[2.00068e-05, 2.00088e-05, 2.00106e-05], 0, 24.0744, 1662030646], "v": "v0.6"}
{"i": [["[\"fused_pointwise_conv_bias_add_sigmoid_mul\", 14, 14, 20, 480, 1]", "cuda -keys=cuda,gpu -max_num_threads=1024 -model=unknown -thread_warp_size=32", [-1, 16, 64, 49152, 2147483647, 1024, 8, 32], "", 0, []], [[], [["CI", 5], ["CHW", 3, "local"], ["SP", 3, 0, 1, [1, 1, 1, 1], 1], ["SP", 3, 5, 480, [1, 480, 1, 1], 1], ["SP", 3, 10, 20, [10, 1], 1], ["RE", 3, [0, 5, 1, 6, 2, 7, 10, 11, 3, 8, 12, 4, 9]], ["FSP", 4, 0, 2, 3], ["FSP", 4, 4, 3, 3], ["RE", 4, [0, 4, 1, 5, 2, 6, 3, 7]], ["CA", 3, 4, 5], ["CHR", 2, "shared", [3]], ["CA", 3, 4, 6], ["CHR", 1, "shared", [4]], ["CA", 2, 5, 6], ["FU", 9, [0, 1, 2, 3]], ["SP", 9, 0, 94080, [32], 1], ["AN", 9, 0, 5], ["AN", 9, 1, 6], ["FU", 6, [0, 1]], ["AN", 6, 0, 5], ["FU", 6, [1, 2]], ["AN", 6, 1, 4], ["FU", 6, [2, 3]], ["AN", 6, 2, 6], ["FU", 4, [0, 1]], ["SP", 4, 0, 50, [1], 1], ["AN", 4, 1, 2], ["FFSP", 4, 0, [3, 2], 1, 1], ["AN", 4, 1, 6], ["FU", 2, [0, 1]], ["SP", 2, 0, 10, [5], 1], ["AN", 2, 1, 2], ["FFSP", 2, 0, [3, 2], 1, 1], ["AN", 2, 1, 6], ["PR", 5, 0, "auto_unroll_max_step$1024"]]]], "r": [[1.57329e-05, 1.57348e-05, 1.57349e-05], 0, 23.9978, 1662030647], "v": "v0.6"}
{"i": [["[\"fused_pointwise_conv_bias_add_sigmoid_mul\", 14, 14, 20, 480, 1]", "cuda -keys=cuda,gpu -max_num_threads=1024 -model=unknown -thread_warp_size=32", [-1, 16, 64, 49152, 2147483647, 1024, 8, 32], "", 0, []], [[], [["CI", 5], ["CHW", 3, "local"], ["SP", 3, 0, 1, [1, 1, 1, 1], 1], ["SP", 3, 5, 480, [2, 40, 2, 1], 1], ["SP", 3, 10, 20, [4, 5], 1], ["RE", 3, [0, 5, 1, 6, 2, 7, 10, 11, 3, 8, 12, 4, 9]], ["FSP", 4, 0, 2, 3], ["FSP", 4, 4, 3, 3], ["RE", 4, [0, 4, 1, 5, 2, 6, 3, 7]], ["CA", 3, 4, 5], ["CHR", 2, "shared", [3]], ["CA", 3, 4, 6], ["CHR", 1, "shared", [4]], ["CA", 2, 5, 6], ["FU", 9, [0, 1, 2, 3]], ["SP", 9, 0, 94080, [32], 1], ["AN", 9, 0, 5], ["AN", 9, 1, 6], ["FU", 6, [0, 1]], ["AN", 6, 0, 5], ["FU", 6, [1, 2]], ["AN", 6, 1, 4], ["FU", 6, [2, 3]], ["AN", 6, 2, 6], ["FU", 4, [0, 1]], ["SP", 4, 0, 40, [1], 1], ["AN", 4, 1, 2], ["FFSP", 4, 0, [3, 2], 1, 1], ["AN", 4, 1, 6], ["FU", 2, [0, 1]], ["SP", 2, 0, 20, [1], 1], ["AN", 2, 1, 2], ["FFSP", 2, 0, [3, 2], 1, 1], ["AN", 2, 1, 6], ["PR", 5, 0, "auto_unroll_max_step$0"]]]], "r": [[1.94033e-05, 1.94023e-05, 1.94087e-05], 0, 23.9412, 1662030647], "v": "v0.6"}
{"i": [["[\"fused_pointwise_conv_bias_add_sigmoid_mul\", 14, 14, 20, 480, 1]", "cuda -keys=cuda,gpu -max_num_threads=1024 -model=unknown -thread_warp_size=32", [-1, 16, 64, 49152, 2147483647, 1024, 8, 32], "", 0, []], [[], [["CI", 5], ["CHW", 3, "local"], ["SP", 3, 0, 1, [1, 1, 1, 1], 1], ["SP", 3, 5, 480, [2, 60, 1, 2], 1], ["SP", 3, 10, 20, [1, 1], 1], ["RE", 3, [0, 5, 1, 6, 2, 7, 10, 11, 3, 8, 12, 4, 9]], ["FSP", 4, 0, 2, 3], ["FSP", 4, 4, 3, 3], ["RE", 4, [0, 4, 1, 5, 2, 6, 3, 7]], ["CA", 3, 4, 5], ["CHR", 2, "shared", [3]], ["CA", 3, 4, 6], ["CHR", 1, "shared", [4]], ["CA", 2, 5, 6], ["FU", 9, [0, 1, 2, 3]], ["SP", 9, 0, 94080, [2], 1], ["AN", 9, 0, 5], ["AN", 9, 1, 6], ["FU", 6, [0, 1]], ["AN", 6, 0, 5], ["FU", 6, [1, 2]], ["AN", 6, 1, 4], ["FU", 6, [2, 3]], ["AN", 6, 2, 6], ["FU", 4, [0, 1]], ["SP", 4, 0, 2, [1], 1], ["AN", 4, 1, 2], ["FFSP", 4, 0, [3, 2], 1, 1], ["AN", 4, 1, 6], ["FU", 2, [0, 1]], ["SP", 2, 0, 1, [1], 1], ["AN", 2, 1, 2], ["FFSP", 2, 0, [3, 2], 1, 1], ["AN", 2, 1, 6], ["PR", 5, 0, "auto_unroll_max_step$16"]]]], "r": [[7.58148e-05, 7.58186e-05, 7.58128e-05], 0, 24.0744, 1662030648], "v": "v0.6"}
{"i": [["[\"fused_pointwise_conv_bias_add_sigmoid_mul\", 14, 14, 20, 480, 1]", "cuda -keys=cuda,gpu -max_num_threads=1024 -model=unknown -thread_warp_size=32", [-1, 16, 64, 49152, 2147483647, 1024, 8, 32], "", 0, []], [[], [["CI", 5], ["CHW", 3, "local"], ["SP", 3, 0, 1, [1, 1, 1, 1], 1], ["SP", 3, 5, 480, [2, 40, 1, 2], 1], ["SP", 3, 10, 20, [1, 10], 1], ["RE", 3, [0, 5, 1, 6, 2, 7, 10, 11, 3, 8, 12, 4, 9]], ["FSP", 4, 0, 2, 3], ["FSP", 4, 4, 3, 3], ["RE", 4, [0, 4, 1, 5, 2, 6, 3, 7]], ["CA", 3, 4, 5], ["CHR", 2, "shared", [3]], ["CA", 3, 4, 6], ["CHR", 1, "shared", [4]], ["CA", 2, 5, 6], ["FU", 9, [0, 1, 2, 3]], ["SP", 9, 0, 94080, [32], 1], ["AN", 9, 0, 5], ["AN", 9, 1, 6], ["FU", 6, [0, 1]], ["AN", 6, 0, 5], ["FU", 6, [1, 2]], ["AN", 6, 1, 4], ["FU", 6, [2, 3]], ["AN", 6, 2, 6], ["FU", 4, [0, 1]], ["SP", 4, 0, 20, [1], 1], ["AN", 4, 1, 2], ["FFSP", 4, 0, [3, 2], 1, 1], ["AN", 4, 1, 6], ["FU", 2, [0, 1]], ["SP", 2, 0, 10, [5], 1], ["AN", 2, 1, 2], ["FFSP", 2, 0, [3, 2], 1, 1], ["AN", 2, 1, 6], ["PR", 5, 0, "auto_unroll_max_step$512"]]]], "r": [[1.71764e-05, 1.71749e-05, 1.718e-05], 0, 24.0646, 1662030649], "v": "v0.6"}
{"i": [["[\"fused_pointwise_conv_bias_add_sigmoid_mul\", 14, 14, 20, 480, 1]", "cuda -keys=cuda,gpu -max_num_threads=1024 -model=unknown -thread_warp_size=32", [-1, 16, 64, 49152, 2147483647, 1024, 8, 32], "", 0, []], [[], [["CI", 5], ["CHW", 3, "local"], ["SP", 3, 0, 1, [1, 1, 1, 1], 1], ["SP", 3, 5, 480, [3, 32, 5, 1], 1], ["SP", 3, 10, 20, [2, 2], 1], ["RE", 3, [0, 5, 1, 6, 2, 7, 10, 11, 3, 8, 12, 4, 9]], ["FSP", 4, 0, 2, 3], ["FSP", 4, 4, 3, 3], ["RE", 4, [0, 4, 1, 5, 2, 6, 3, 7]], ["CA", 3, 4, 5], ["CHR", 2, "shared", [3]], ["CA", 3, 4, 6], ["CHR", 1, "shared", [4]], ["CA", 2, 5, 6], ["FU", 9, [0, 1, 2, 3]], ["SP", 9, 0, 94080, [2], 1], ["AN", 9, 0, 5], ["AN", 9, 1, 6], ["FU", 6, [0, 1]], ["AN", 6, 0, 5], ["FU", 6, [1, 2]], ["AN", 6, 1, 4], ["FU", 6, [2, 3]], ["AN", 6, 2, 6], ["FU", 4, [0, 1]], ["SP", 4, 0, 20, [1], 1], ["AN", 4, 1, 2], ["FFSP", 4, 0, [3, 2], 1, 1], ["AN", 4, 1, 6], ["FU", 2, [0, 1]], ["SP", 2, 0, 4, [1], 1], ["AN", 2, 1, 2], ["FFSP", 2, 0, [3, 2], 1, 1], ["AN", 2, 1, 6], ["PR", 5, 0, "auto_unroll_max_step$16"]]]], "r": [[7.89275e-05, 7.89285e-05, 7.89286e-05], 0, 24.0061, 1662030649], "v": "v0.6"}
{"i": [["[\"fused_pointwise_conv_bias_add_sigmoid_mul\", 14, 14, 20, 480, 1]", "cuda -keys=cuda,gpu -max_num_threads=1024 -model=unknown -thread_warp_size=32", [-1, 16, 64, 49152, 2147483647, 1024, 8, 32], "", 0, []], [[], [["CI", 5], ["CHW", 3, "local"], ["SP", 3, 0, 1, [1, 1, 1, 1], 1], ["SP", 3, 5, 480, [3, 80, 2, 1], 1], ["SP", 3, 10, 20, [1, 4], 1], ["RE", 3, [0, 5, 1, 6, 2, 7, 10, 11, 3, 8, 12, 4, 9]], ["FSP", 4, 0, 2, 3], ["FSP", 4, 4, 3, 3], ["RE", 4, [0, 4, 1, 5, 2, 6, 3, 7]], ["CA", 3, 4, 5], ["CHR", 2, "shared", [3]], ["CA", 3, 4, 6], ["CHR", 1, "shared", [4]], ["CA", 2, 5, 6], ["FU", 9, [0, 1, 2, 3]], ["SP", 9, 0, 94080, [16], 1], ["AN", 9, 0, 5], ["AN", 9, 1, 6], ["FU", 6, [0, 1]], ["AN", 6, 0, 5], ["FU", 6, [1, 2]], ["AN", 6, 1, 4], ["FU", 6, [2, 3]], ["AN", 6, 2, 6], ["FU", 4, [0, 1]], ["SP", 4, 0, 8, [2], 1], ["AN", 4, 1, 2], ["FFSP", 4, 0, [3, 2], 1, 1], ["AN", 4, 1, 6], ["FU", 2, [0, 1]], ["SP", 2, 0, 4, [1], 1], ["AN", 2, 1, 2], ["FFSP", 2, 0, [3, 2], 1, 1], ["AN", 2, 1, 6], ["PR", 5, 0, "auto_unroll_max_step$1024"]]]], "r": [[2.2673e-05, 2.26665e-05, 2.26753e-05], 0, 24.011, 1662030650], "v": "v0.6"}
