python/models/efficientnet/kernel_configs/efficient_pointwise_conv2d_bn_14_14_480_112_4.log
{"i": [["[\"pointwise_conv2d_bn\", 14, 14, 480, 112, 4]", "cuda -keys=cuda,gpu -max_num_threads=1024 -model=unknown -thread_warp_size=32", [-1, 16, 64, 49152, 2147483647, 1024, 8, 32], "", 0, []], [[], [["CI", 4], ["SP", 2, 0, 4, [2, 1, 1, 2], 1], ["SP", 2, 5, 14, [1, 14, 1, 1], 1], ["SP", 2, 10, 14, [2, 1, 1, 1], 1], ["SP", 2, 15, 112, [1, 7, 2, 2], 1], ["SP", 2, 20, 480, [5, 6], 1], ["RE", 2, [0, 5, 10, 15, 1, 6, 11, 16, 2, 7, 12, 17, 20, 21, 3, 8, 13, 18, 22, 4, 9, 14, 19]], ["FSP", 6, 0, 1, 3], ["FSP", 6, 4, 2, 3], ["FSP", 6, 8, 3, 3], ["FSP", 6, 12, 4, 3], ["RE", 6, [0, 4, 8, 12, 1, 5, 9, 13, 2, 6, 10, 14, 3, 7, 11, 15]], ["CA", 2, 6, 11], ["CHR", 1, "shared", [2]], ["CA", 2, 3, 12], ["CHR", 0, "shared", [3]], ["CA", 1, 4, 12], ["FU", 8, [0, 1, 2, 3]], ["AN", 8, 0, 5], ["FU", 8, [1, 2, 3, 4]], ["AN", 8, 1, 4], ["FU", 8, [2, 3, 4, 5]], ["AN", 8, 2, 6], ["FU", 3, [0, 1]], ["SP", 3, 0, 240, [1], 1], ["AN", 3, 1, 2], ["FFSP", 3, 0, [4, 3, 2, 1], 1, 1], ["AN", 3, 1, 6], ["FU", 1, [0, 1, 2, 3]], ["SP", 1, 0, 240, [1], 1], ["AN", 1, 1, 2], ["FFSP", 1, 0, [4, 3, 2, 1], 1, 1], ["AN", 1, 1, 6], ["PR", 4, 0, "auto_unroll_max_step$512"]]]], "r": [[4.28716e-05, 4.28766e-05, 4.2876e-05], 0, 9.62554, 1661972438], "v": "v0.6"}
{"i": [["[\"pointwise_conv2d_bn\", 14, 14, 480, 112, 4]", "cuda -keys=cuda,gpu -max_num_threads=1024 -model=unknown -thread_warp_size=32", [-1, 16, 64, 49152, 2147483647, 1024, 8, 32], "", 0, []], [[], [["CI", 4], ["SP", 2, 0, 4, [1, 1, 2, 2], 1], ["SP", 2, 5, 14, [1, 7, 1, 2], 1], ["SP", 2, 10, 14, [2, 1, 7, 1], 1], ["SP", 2, 15, 112, [2, 14, 1, 2], 1], ["SP", 2, 20, 480, [1, 1], 1], ["RE", 2, [0, 5, 10, 15, 1, 6, 11, 16, 2, 7, 12, 17, 20, 21, 3, 8, 13, 18, 22, 4, 9, 14, 19]], ["FSP", 6, 0, 1, 3], ["FSP", 6, 4, 2, 3], ["FSP", 6, 8, 3, 3], ["FSP", 6, 12, 4, 3], ["RE", 6, [0, 4, 8, 12, 1, 5, 9, 13, 2, 6, 10, 14, 3, 7, 11, 15]], ["CA", 2, 6, 11], ["CHR", 1, "shared", [2]], ["CA", 2, 3, 12], ["CHR", 0, "shared", [3]], ["CA", 1, 4, 12], ["FU", 8, [0, 1, 2, 3]], ["AN", 8, 0, 5], ["FU", 8, [1, 2, 3, 4]], ["AN", 8, 1, 4], ["FU", 8, [2, 3, 4, 5]], ["AN", 8, 2, 6], ["FU", 3, [0, 1]], ["SP", 3, 0, 3, [1], 1], ["AN", 3, 1, 2], ["FFSP", 3, 0, [4, 3, 2, 1], 1, 1], ["AN", 3, 1, 6], ["FU", 1, [0, 1, 2, 3]], ["SP", 1, 0, 168, [1], 1], ["AN", 1, 1, 2], ["FFSP", 1, 0, [4, 3, 2, 1], 1, 1], ["AN", 1, 1, 6], ["PR", 4, 0, "auto_unroll_max_step$512"]]]], "r": [[0.00500677, 0.00501187, 0.00500976], 0, 9.56591, 1661972436], "v": "v0.6"}
{"i": [["[\"pointwise_conv2d_bn\", 14, 14, 480, 112, 4]", "cuda -keys=cuda,gpu -max_num_threads=1024 -model=unknown -thread_warp_size=32", [-1, 16, 64, 49152, 2147483647, 1024, 8, 32], "", 0, []], [[], [["CI", 4], ["SP", 2, 0, 4, [1, 1, 4, 1], 1], ["SP", 2, 5, 14, [1, 7, 1, 1], 1], ["SP", 2, 10, 14, [1, 1, 2, 1], 1], ["SP", 2, 15, 112, [2, 7, 4, 2], 1], ["SP", 2, 20, 480, [1, 5], 1], ["RE", 2, [0, 5, 10, 15, 1, 6, 11, 16, 2, 7, 12, 17, 20, 21, 3, 8, 13, 18, 22, 4, 9, 14, 19]], ["FSP", 6, 0, 1, 3], ["FSP", 6, 4, 2, 3], ["FSP", 6, 8, 3, 3], ["FSP", 6, 12, 4, 3], ["RE", 6, [0, 4, 8, 12, 1, 5, 9, 13, 2, 6, 10, 14, 3, 7, 11, 15]], ["CA", 2, 6, 11], ["CHR", 1, "shared", [2]], ["CA", 2, 3, 12], ["CHR", 0, "shared", [3]], ["CA", 1, 4, 12], ["FU", 8, [0, 1, 2, 3]], ["AN", 8, 0, 5], ["FU", 8, [1, 2, 3, 4]], ["AN", 8, 1, 4], ["FU", 8, [2, 3, 4, 5]], ["AN", 8, 2, 6], ["FU", 3, [0, 1]], ["SP", 3, 0, 40, [1], 1], ["AN", 3, 1, 2], ["FFSP", 3, 0, [4, 3, 2, 1], 1, 1], ["AN", 3, 1, 6], ["FU", 1, [0, 1, 2, 3]], ["SP", 1, 0, 10, [1], 1], ["AN", 1, 1, 2], ["FFSP", 1, 0, [4, 3, 2, 1], 1, 1], ["AN", 1, 1, 6], ["PR", 4, 0, "auto_unroll_max_step$64"]]]], "r": [[0.000203777, 0.000203783, 0.000203762], 0, 10.5997, 1661972439], "v": "v0.6"}
{"i": [["[\"pointwise_conv2d_bn\", 14, 14, 480, 112, 4]", "cuda -keys=cuda,gpu -max_num_threads=1024 -model=unknown -thread_warp_size=32", [-1, 16, 64, 49152, 2147483647, 1024, 8, 32], "", 0, []], [[], [["CI", 4], ["SP", 2, 0, 4, [1, 2, 1, 1], 1], ["SP", 2, 5, 14, [7, 1, 1, 2], 1], ["SP", 2, 10, 14, [1, 1, 7, 1], 1], ["SP", 2, 15, 112, [1, 28, 2, 1], 1], ["SP", 2, 20, 480, [8, 6], 1], ["RE", 2, [0, 5, 10, 15, 1, 6, 11, 16, 2, 7, 12, 17, 20, 21, 3, 8, 13, 18, 22, 4, 9, 14, 19]], ["FSP", 6, 0, 1, 3], ["FSP", 6, 4, 2, 3], ["FSP", 6, 8, 3, 3], ["FSP", 6, 12, 4, 3], ["RE", 6, [0, 4, 8, 12, 1, 5, 9, 13, 2, 6, 10, 14, 3, 7, 11, 15]], ["CA", 2, 6, 11], ["CHR", 1, "shared", [2]], ["CA", 2, 3, 12], ["CHR", 0, "shared", [3]], ["CA", 1, 4, 12], ["FU", 8, [0, 1, 2, 3]], ["AN", 8, 0, 5], ["FU", 8, [1, 2, 3, 4]], ["AN", 8, 1, 4], ["FU", 8, [2, 3, 4, 5]], ["AN", 8, 2, 6], ["FU", 3, [0, 1]], ["SP", 3, 0, 96, [1], 1], ["AN", 3, 1, 2], ["FFSP", 3, 0, [4, 3, 2, 1], 1, 1], ["AN", 3, 1, 6], ["FU", 1, [0, 1, 2, 3]], ["SP", 1, 0, 96, [1], 1], ["AN", 1, 1, 2], ["FFSP", 1, 0, [4, 3, 2, 1], 1, 1], ["AN", 1, 1, 6], ["PR", 4, 0, "auto_unroll_max_step$64"]]]], "r": [[0.00100282, 0.00100298, 0.00100245], 0, 3.5428, 1661972431], "v": "v0.6"}
{"i": [["[\"pointwise_conv2d_bn\", 14, 14, 480, 112, 4]", "cuda -keys=cuda,gpu -max_num_threads=1024 -model=unknown -thread_warp_size=32", [-1, 16, 64, 49152, 2147483647, 1024, 8, 32], "", 0, []], [[], [["CI", 4], ["SP", 2, 0, 4, [1, 4, 1, 1], 1], ["SP", 2, 5, 14, [7, 1, 1, 1], 1], ["SP", 2, 10, 14, [1, 7, 1, 2], 1], ["SP", 2, 15, 112, [1, 28, 1, 4], 1], ["SP", 2, 20, 480, [5, 3], 1], ["RE", 2, [0, 5, 10, 15, 1, 6, 11, 16, 2, 7, 12, 17, 20, 21, 3, 8, 13, 18, 22, 4, 9, 14, 19]], ["FSP", 6, 0, 1, 3], ["FSP", 6, 4, 2, 3], ["FSP", 6, 8, 3, 3], ["FSP", 6, 12, 4, 3], ["RE", 6, [0, 4, 8, 12, 1, 5, 9, 13, 2, 6, 10, 14, 3, 7, 11, 15]], ["CA", 2, 6, 11], ["CHR", 1, "shared", [2]], ["CA", 2, 3, 12], ["CHR", 0, "shared", [3]], ["CA", 1, 4, 12], ["FU", 8, [0, 1, 2, 3]], ["AN", 8, 0, 5], ["FU", 8, [1, 2, 3, 4]], ["AN", 8, 1, 4], ["FU", 8, [2, 3, 4, 5]], ["AN", 8, 2, 6], ["FU", 3, [0, 1]], ["SP", 3, 0, 60, [1], 1], ["AN", 3, 1, 2], ["FFSP", 3, 0, [4, 3, 2, 1], 1, 1], ["AN", 3, 1, 6], ["FU", 1, [0, 1, 2, 3]], ["SP", 1, 0, 30, [1], 1], ["AN", 1, 1, 2], ["FFSP", 1, 0, [4, 3, 2, 1], 1, 1], ["AN", 1, 1, 6], ["PR", 4, 0, "auto_unroll_max_step$0"]]]], "r": [[0.000557922, 0.000558104, 0.000557912], 0, 5.05238, 1661972433], "v": "v0.6"}
{"i": [["[\"pointwise_conv2d_bn\", 14, 14, 480, 112, 4]", "cuda -keys=cuda,gpu -max_num_threads=1024 -model=unknown -thread_warp_size=32", [-1, 16, 64, 49152, 2147483647, 1024, 8, 32], "", 0, []], [[], [["CI", 4], ["SP", 2, 0, 4, [1, 1, 1, 2], 1], ["SP", 2, 5, 14, [1, 7, 2, 1], 1], ["SP", 2, 10, 14, [7, 1, 2, 1], 1], ["SP", 2, 15, 112, [1, 14, 1, 1], 1], ["SP", 2, 20, 480, [3, 2], 1], ["RE", 2, [0, 5, 10, 15, 1, 6, 11, 16, 2, 7, 12, 17, 20, 21, 3, 8, 13, 18, 22, 4, 9, 14, 19]], ["FSP", 6, 0, 1, 3], ["FSP", 6, 4, 2, 3], ["FSP", 6, 8, 3, 3], ["FSP", 6, 12, 4, 3], ["RE", 6, [0, 4, 8, 12, 1, 5, 9, 13, 2, 6, 10, 14, 3, 7, 11, 15]], ["CA", 2, 6, 11], ["CHR", 1, "shared", [2]], ["CA", 2, 3, 12], ["CHR", 0, "shared", [3]], ["CA", 1, 4, 12], ["FU", 8, [0, 1, 2, 3]], ["AN", 8, 0, 5], ["FU", 8, [1, 2, 3, 4]], ["AN", 8, 1, 4], ["FU", 8, [2, 3, 4, 5]], ["AN", 8, 2, 6], ["FU", 3, [0, 1]], ["SP", 3, 0, 2, [1], 1], ["AN", 3, 1, 2], ["FFSP", 3, 0, [4, 3, 2, 1], 1, 1], ["AN", 3, 1, 6], ["FU", 1, [0, 1, 2, 3]], ["SP", 1, 0, 16, [1], 1], ["AN", 1, 1, 2], ["FFSP", 1, 0, [4, 3, 2, 1], 1, 1], ["AN", 1, 1, 6], ["PR", 4, 0, "auto_unroll_max_step$64"]]]], "r": [[0.000163102, 0.0001631, 0.000163091], 0, 10.8882, 1661972439], "v": "v0.6"}
{"i": [["[\"pointwise_conv2d_bn\", 14, 14, 480, 112, 4]", "cuda -keys=cuda,gpu -max_num_threads=1024 -model=unknown -thread_warp_size=32", [-1, 16, 64, 49152, 2147483647, 1024, 8, 32], "", 0, []], [[], [["CI", 4], ["SP", 2, 0, 4, [1, 1, 1, 1], 1], ["SP", 2, 5, 14, [7, 1, 2, 1], 1], ["SP", 2, 10, 14, [1, 14, 1, 1], 1], ["SP", 2, 15, 112, [2, 14, 2, 2], 1], ["SP", 2, 20, 480, [4, 4], 1], ["RE", 2, [0, 5, 10, 15, 1, 6, 11, 16, 2, 7, 12, 17, 20, 21, 3, 8, 13, 18, 22, 4, 9, 14, 19]], ["FSP", 6, 0, 1, 3], ["FSP", 6, 4, 2, 3], ["FSP", 6, 8, 3, 3], ["FSP", 6, 12, 4, 3], ["RE", 6, [0, 4, 8, 12, 1, 5, 9, 13, 2, 6, 10, 14, 3, 7, 11, 15]], ["CA", 2, 6, 11], ["CHR", 1, "shared", [2]], ["CA", 2, 3, 12], ["CHR", 0, "shared", [3]], ["CA", 1, 4, 12], ["FU", 8, [0, 1, 2, 3]], ["AN", 8, 0, 5], ["FU", 8, [1, 2, 3, 4]], ["AN", 8, 1, 4], ["FU", 8, [2, 3, 4, 5]], ["AN", 8, 2, 6], ["FU", 3, [0, 1]], ["SP", 3, 0, 64, [1], 1], ["AN", 3, 1, 2], ["FFSP", 3, 0, [4, 3, 2, 1], 1, 1], ["AN", 3, 1, 6], ["FU", 1, [0, 1, 2, 3]], ["SP", 1, 0, 224, [1], 1], ["AN", 1, 1, 2], ["FFSP", 1, 0, [4, 3, 2, 1], 1, 1], ["AN", 1, 1, 6], ["PR", 4, 0, "auto_unroll_max_step$16"]]]], "r": [[0.000567137, 0.000567069, 0.000567013], 0, 6.2396, 1661972434], "v": "v0.6"}
{"i": [["[\"pointwise_conv2d_bn\", 14, 14, 480, 112, 4]", "cuda -keys=cuda,gpu -max_num_threads=1024 -model=unknown -thread_warp_size=32", [-1, 16, 64, 49152, 2147483647, 1024, 8, 32], "", 0, []], [[], [["CI", 4], ["SP", 2, 0, 4, [1, 1, 1, 1], 1], ["SP", 2, 5, 14, [1, 1, 14, 1], 1], ["SP", 2, 10, 14, [1, 14, 1, 1], 1], ["SP", 2, 15, 112, [2, 14, 2, 2], 1], ["SP", 2, 20, 480, [4, 4], 1], ["RE", 2, [0, 5, 10, 15, 1, 6, 11, 16, 2, 7, 12, 17, 20, 21, 3, 8, 13, 18, 22, 4, 9, 14, 19]], ["FSP", 6, 0, 1, 3], ["FSP", 6, 4, 2, 3], ["FSP", 6, 8, 3, 3], ["FSP", 6, 12, 4, 3], ["RE", 6, [0, 4, 8, 12, 1, 5, 9, 13, 2, 6, 10, 14, 3, 7, 11, 15]], ["CA", 2, 6, 11], ["CHR", 1, "shared", [2]], ["CA", 2, 3, 12], ["CHR", 0, "shared", [3]], ["CA", 1, 4, 12], ["FU", 8, [0, 1, 2, 3]], ["AN", 8, 0, 5], ["FU", 8, [1, 2, 3, 4]], ["AN", 8, 1, 4], ["FU", 8, [2, 3, 4, 5]], ["AN", 8, 2, 6], ["FU", 3, [0, 1]], ["SP", 3, 0, 64, [2], 1], ["AN", 3, 1, 2], ["FFSP", 3, 0, [4, 3, 2, 1], 1, 1], ["AN", 3, 1, 6], ["FU", 1, [0, 1, 2, 3]], ["SP", 1, 0, 224, [1], 1], ["AN", 1, 1, 2], ["FFSP", 1, 0, [4, 3, 2, 1], 1, 1], ["AN", 1, 1, 6], ["PR", 4, 0, "auto_unroll_max_step$16"]]]], "r": [[0.00106669, 0.00106694, 0.00106689], 0, 3.93183, 1661972432], "v": "v0.6"}
{"i": [["[\"pointwise_conv2d_bn\", 14, 14, 480, 112, 4]", "cuda -keys=cuda,gpu -max_num_threads=1024 -model=unknown -thread_warp_size=32", [-1, 16, 64, 49152, 2147483647, 1024, 8, 32], "", 0, []], [[], [["CI", 4], ["SP", 2, 0, 4, [1, 4, 1, 1], 1], ["SP", 2, 5, 14, [1, 1, 7, 1], 1], ["SP", 2, 10, 14, [1, 14, 1, 1], 1], ["SP", 2, 15, 112, [1, 2, 1, 1], 1], ["SP", 2, 20, 480, [1, 20], 1], ["RE", 2, [0, 5, 10, 15, 1, 6, 11, 16, 2, 7, 12, 17, 20, 21, 3, 8, 13, 18, 22, 4, 9, 14, 19]], ["FSP", 6, 0, 1, 3], ["FSP", 6, 4, 2, 3], ["FSP", 6, 8, 3, 3], ["FSP", 6, 12, 4, 3], ["RE", 6, [0, 4, 8, 12, 1, 5, 9, 13, 2, 6, 10, 14, 3, 7, 11, 15]], ["CA", 2, 6, 11], ["CHR", 1, "shared", [2]], ["CA", 2, 3, 12], ["CHR", 0, "shared", [3]], ["CA", 1, 4, 12], ["FU", 8, [0, 1, 2, 3]], ["AN", 8, 0, 5], ["FU", 8, [1, 2, 3, 4]], ["AN", 8, 1, 4], ["FU", 8, [2, 3, 4, 5]], ["AN", 8, 2, 6], ["FU", 3, [0, 1]], ["SP", 3, 0, 20, [1], 1], ["AN", 3, 1, 2], ["FFSP", 3, 0, [4, 3, 2, 1], 1, 1], ["AN", 3, 1, 6], ["FU", 1, [0, 1, 2, 3]], ["SP", 1, 0, 140, [1], 1], ["AN", 1, 1, 2], ["FFSP", 1, 0, [4, 3, 2, 1], 1, 1], ["AN", 1, 1, 6], ["PR", 4, 0, "auto_unroll_max_step$64"]]]], "r": [[0.00016543, 0.000165398, 0.00016081], 0, 6.31276, 1661972435], "v": "v0.6"}
{"i": [["[\"pointwise_conv2d_bn\", 14, 14, 480, 112, 4]", "cuda -keys=cuda,gpu -max_num_threads=1024 -model=unknown -thread_warp_size=32", [-1, 16, 64, 49152, 2147483647, 1024, 8, 32], "", 0, []], [[], [["CI", 4], ["SP", 2, 0, 4, [4, 1, 1, 1], 1], ["SP", 2, 5, 14, [1, 2, 1, 1], 1], ["SP", 2, 10, 14, [1, 1, 1, 1], 1], ["SP", 2, 15, 112, [1, 4, 1, 1], 1], ["SP", 2, 20, 480, [2, 30], 1], ["RE", 2, [0, 5, 10, 15, 1, 6, 11, 16, 2, 7, 12, 17, 20, 21, 3, 8, 13, 18, 22, 4, 9, 14, 19]], ["FSP", 6, 0, 1, 3], ["FSP", 6, 4, 2, 3], ["FSP", 6, 8, 3, 3], ["FSP", 6, 12, 4, 3], ["RE", 6, [0, 4, 8, 12, 1, 5, 9, 13, 2, 6, 10, 14, 3, 7, 11, 15]], ["CA", 2, 6, 11], ["CHR", 1, "shared", [2]], ["CA", 2, 3, 12], ["CHR", 0, "shared", [3]], ["CA", 1, 4, 12], ["FU", 8, [0, 1, 2, 3]], ["AN", 8, 0, 5], ["FU", 8, [1, 2, 3, 4]], ["AN", 8, 1, 4], ["FU", 8, [2, 3, 4, 5]], ["AN", 8, 2, 6], ["FU", 3, [0, 1]], ["SP", 3, 0, 60, [1], 1], ["AN", 3, 1, 2], ["FFSP", 3, 0, [4, 3, 2, 1], 1, 1], ["AN", 3, 1, 6], ["FU", 1, [0, 1, 2, 3]], ["SP", 1, 0, 60, [1], 1], ["AN", 1, 1, 2], ["FFSP", 1, 0, [4, 3, 2, 1], 1, 1], ["AN", 1, 1, 6], ["PR", 4, 0, "auto_unroll_max_step$1024"]]]], "r": [[6.78888e-05, 6.78603e-05, 6.78536e-05], 0, 7.65074, 1661972436], "v": "v0.6"}
{"i": [["[\"pointwise_conv2d_bn\", 14, 14, 480, 112, 4]", "cuda -keys=cuda,gpu -max_num_threads=1024 -model=unknown -thread_warp_size=32", [-1, 16, 64, 49152, 2147483647, 1024, 8, 32], "", 0, []], [[], [["CI", 4], ["SP", 2, 0, 4, [1, 1, 1, 4], 1], ["SP", 2, 5, 14, [1, 1, 2, 1], 1], ["SP", 2, 10, 14, [2, 1, 1, 1], 1], ["SP", 2, 15, 112, [1, 56, 1, 2], 1], ["SP", 2, 20, 480, [1, 15], 1], ["RE", 2, [0, 5, 10, 15, 1, 6, 11, 16, 2, 7, 12, 17, 20, 21, 3, 8, 13, 18, 22, 4, 9, 14, 19]], ["FSP", 6, 0, 1, 3], ["FSP", 6, 4, 2, 3], ["FSP", 6, 8, 3, 3], ["FSP", 6, 12, 4, 3], ["RE", 6, [0, 4, 8, 12, 1, 5, 9, 13, 2, 6, 10, 14, 3, 7, 11, 15]], ["CA", 2, 6, 11], ["CHR", 1, "shared", [2]], ["CA", 2, 3, 12], ["CHR", 0, "shared", [3]], ["CA", 1, 4, 12], ["FU", 8, [0, 1, 2, 3]], ["AN", 8, 0, 5], ["FU", 8, [1, 2, 3, 4]], ["AN", 8, 1, 4], ["FU", 8, [2, 3, 4, 5]], ["AN", 8, 2, 6], ["FU", 3, [0, 1]], ["SP", 3, 0, 30, [1], 1], ["AN", 3, 1, 2], ["FFSP", 3, 0, [4, 3, 2, 1], 1, 1], ["AN", 3, 1, 6], ["FU", 1, [0, 1, 2, 3]], ["SP", 1, 0, 60, [1], 1], ["AN", 1, 1, 2], ["FFSP", 1, 0, [4, 3, 2, 1], 1, 1], ["AN", 1, 1, 6], ["PR", 4, 0, "auto_unroll_max_step$1024"]]]], "r": [[8.37514e-05, 8.37463e-05, 8.3742e-05], 0, 4.78883, 1661972433], "v": "v0.6"}
{"i": [["[\"pointwise_conv2d_bn\", 14, 14, 480, 112, 4]", "cuda -keys=cuda,gpu -max_num_threads=1024 -model=unknown -thread_warp_size=32", [-1, 16, 64, 49152, 2147483647, 1024, 8, 32], "", 0, []], [[], [["CI", 4], ["SP", 2, 0, 4, [4, 1, 1, 1], 1], ["SP", 2, 5, 14, [2, 1, 1, 1], 1], ["SP", 2, 10, 14, [1, 7, 2, 1], 1], ["SP", 2, 15, 112, [1, 7, 1, 8], 1], ["SP", 2, 20, 480, [1, 24], 1], ["RE", 2, [0, 5, 10, 15, 1, 6, 11, 16, 2, 7, 12, 17, 20, 21, 3, 8, 13, 18, 22, 4, 9, 14, 19]], ["FSP", 6, 0, 1, 3], ["FSP", 6, 4, 2, 3], ["FSP", 6, 8, 3, 3], ["FSP", 6, 12, 4, 3], ["RE", 6, [0, 4, 8, 12, 1, 5, 9, 13, 2, 6, 10, 14, 3, 7, 11, 15]], ["CA", 2, 6, 11], ["CHR", 1, "shared", [2]], ["CA", 2, 3, 12], ["CHR", 0, "shared", [3]], ["CA", 1, 4, 12], ["FU", 8, [0, 1, 2, 3]], ["AN", 8, 0, 5], ["FU", 8, [1, 2, 3, 4]], ["AN", 8, 1, 4], ["FU", 8, [2, 3, 4, 5]], ["AN", 8, 2, 6], ["FU", 3, [0, 1]], ["SP", 3, 0, 96, [3], 1], ["AN", 3, 1, 2], ["FFSP", 3, 0, [4, 3, 2, 1], 1, 1], ["AN", 3, 1, 6], ["FU", 1, [0, 1, 2, 3]], ["SP", 1, 0, 48, [1], 1], ["AN", 1, 1, 2], ["FFSP", 1, 0, [4, 3, 2, 1], 1, 1], ["AN", 1, 1, 6], ["PR", 4, 0, "auto_unroll_max_step$16"]]]], "r": [[0.000460003, 0.000459981, 0.000459938], 0, 8.70537, 1661972437], "v": "v0.6"}
{"i": [["[\"pointwise_conv2d_bn\", 14, 14, 480, 112, 4]", "cuda -keys=cuda,gpu -max_num_threads=1024 -model=unknown -thread_warp_size=32", [-1, 16, 64, 49152, 2147483647, 1024, 8, 32], "", 0, []], [[], [["CI", 4], ["SP", 2, 0, 4, [1, 1, 1, 4], 1], ["SP", 2, 5, 14, [14, 1, 1, 1], 1], ["SP", 2, 10, 14, [1, 1, 1, 1], 1], ["SP", 2, 15, 112, [1, 4, 1, 2], 1], ["SP", 2, 20, 480, [10, 1], 1], ["RE", 2, [0, 5, 10, 15, 1, 6, 11, 16, 2, 7, 12, 17, 20, 21, 3, 8, 13, 18, 22, 4, 9, 14, 19]], ["FSP", 6, 0, 1, 3], ["FSP", 6, 4, 2, 3], ["FSP", 6, 8, 3, 3], ["FSP", 6, 12, 4, 3], ["RE", 6, [0, 4, 8, 12, 1, 5, 9, 13, 2, 6, 10, 14, 3, 7, 11, 15]], ["CA", 2, 6, 11], ["CHR", 1, "shared", [2]], ["CA", 2, 3, 12], ["CHR", 0, "shared", [3]], ["CA", 1, 4, 12], ["FU", 8, [0, 1, 2, 3]], ["AN", 8, 0, 5], ["FU", 8, [1, 2, 3, 4]], ["AN", 8, 1, 4], ["FU", 8, [2, 3, 4, 5]], ["AN", 8, 2, 6], ["FU", 3, [0, 1]], ["SP", 3, 0, 2, [1], 1], ["AN", 3, 1, 2], ["FFSP", 3, 0, [4, 3, 2, 1], 1, 1], ["AN", 3, 1, 6], ["FU", 1, [0, 1, 2, 3]], ["SP", 1, 0, 4, [1], 1], ["AN", 1, 1, 2], ["FFSP", 1, 0, [4, 3, 2, 1], 1, 1], ["AN", 1, 1, 6], ["PR", 4, 0, "auto_unroll_max_step$16"]]]], "r": [[0.000297171, 0.000297147, 0.000297129], 0, 11.2614, 1661972440], "v": "v0.6"}
{"i": [["[\"pointwise_conv2d_bn\", 14, 14, 480, 112, 4]", "cuda -keys=cuda,gpu -max_num_threads=1024 -model=unknown -thread_warp_size=32", [-1, 16, 64, 49152, 2147483647, 1024, 8, 32], "", 0, []], [[], [["CI", 4], ["SP", 2, 0, 4, [1, 1, 1, 1], 1], ["SP", 2, 5, 14, [1, 7, 2, 1], 1], ["SP", 2, 10, 14, [1, 1, 2, 1], 1], ["SP", 2, 15, 112, [2, 8, 7, 1], 1], ["SP", 2, 20, 480, [10, 4], 1], ["RE", 2, [0, 5, 10, 15, 1, 6, 11, 16, 2, 7, 12, 17, 20, 21, 3, 8, 13, 18, 22, 4, 9, 14, 19]], ["FSP", 6, 0, 1, 3], ["FSP", 6, 4, 2, 3], ["FSP", 6, 8, 3, 3], ["FSP", 6, 12, 4, 3], ["RE", 6, [0, 4, 8, 12, 1, 5, 9, 13, 2, 6, 10, 14, 3, 7, 11, 15]], ["CA", 2, 6, 11], ["CHR", 1, "shared", [2]], ["CA", 2, 3, 12], ["CHR", 0, "shared", [3]], ["CA", 1, 4, 12], ["FU", 8, [0, 1, 2, 3]], ["AN", 8, 0, 5], ["FU", 8, [1, 2, 3, 4]], ["AN", 8, 1, 4], ["FU", 8, [2, 3, 4, 5]], ["AN", 8, 2, 6], ["FU", 3, [0, 1]], ["SP", 3, 0, 280, [1], 1], ["AN", 3, 1, 2], ["FFSP", 3, 0, [4, 3, 2, 1], 1, 1], ["AN", 3, 1, 6], ["FU", 1, [0, 1, 2, 3]], ["SP", 1, 0, 160, [1], 1], ["AN", 1, 1, 2], ["FFSP", 1, 0, [4, 3, 2, 1], 1, 1], ["AN", 1, 1, 6], ["PR", 4, 0, "auto_unroll_max_step$16"]]]], "r": [[0.000105259, 0.000105258, 0.000105253], 0, 12.6371, 1661972442], "v": "v0.6"}
{"i": [["[\"pointwise_conv2d_bn\", 14, 14, 480, 112, 4]", "cuda -keys=cuda,gpu -max_num_threads=1024 -model=unknown -thread_warp_size=32", [-1, 16, 64, 49152, 2147483647, 1024, 8, 32], "", 0, []], [[], [["CI", 4], ["SP", 2, 0, 4, [2, 1, 1, 1], 1], ["SP", 2, 5, 14, [1, 7, 1, 1], 1], ["SP", 2, 10, 14, [1, 1, 1, 14], 1], ["SP", 2, 15, 112, [1, 7, 4, 2], 1], ["SP", 2, 20, 480, [4, 8], 1], ["RE", 2, [0, 5, 10, 15, 1, 6, 11, 16, 2, 7, 12, 17, 20, 21, 3, 8, 13, 18, 22, 4, 9, 14, 19]], ["FSP", 6, 0, 1, 3], ["FSP", 6, 4, 2, 3], ["FSP", 6, 8, 3, 3], ["FSP", 6, 12, 4, 3], ["RE", 6, [0, 4, 8, 12, 1, 5, 9, 13, 2, 6, 10, 14, 3, 7, 11, 15]], ["CA", 2, 6, 11], ["CHR", 1, "shared", [2]], ["CA", 2, 3, 12], ["CHR", 0, "shared", [3]], ["CA", 1, 4, 12], ["FU", 8, [0, 1, 2, 3]], ["AN", 8, 0, 5], ["FU", 8, [1, 2, 3, 4]], ["AN", 8, 1, 4], ["FU", 8, [2, 3, 4, 5]], ["AN", 8, 2, 6], ["FU", 3, [0, 1]], ["SP", 3, 0, 256, [1], 1], ["AN", 3, 1, 2], ["FFSP", 3, 0, [4, 3, 2, 1], 1, 1], ["AN", 3, 1, 6], ["FU", 1, [0, 1, 2, 3]], ["SP", 1, 0, 224, [28], 1], ["AN", 1, 1, 2], ["FFSP", 1, 0, [4, 3, 2, 1], 1, 1], ["AN", 1, 1, 6], ["PR", 4, 0, "auto_unroll_max_step$64"]]]], "r": [[0.000606565, 0.000606656, 0.000606984], 0, 16.1054, 1661972445], "v": "v0.6"}
{"i": [["[\"pointwise_conv2d_bn\", 14, 14, 480, 112, 4]", "cuda -keys=cuda,gpu -max_num_threads=1024 -model=unknown -thread_warp_size=32", [-1, 16, 64, 49152, 2147483647, 1024, 8, 32], "", 0, []], [[], [["CI", 4], ["SP", 2, 0, 4, [1, 2, 2, 1], 1], ["SP", 2, 5, 14, [1, 1, 1, 1], 1], ["SP", 2, 10, 14, [1, 7, 2, 1], 1], ["SP", 2, 15, 112, [1, 7, 1, 4], 1], ["SP", 2, 20, 480, [6, 16], 1], ["RE", 2, [0, 5, 10, 15, 1, 6, 11, 16, 2, 7, 12, 17, 20, 21, 3, 8, 13, 18, 22, 4, 9, 14, 19]], ["FSP", 6, 0, 1, 3], ["FSP", 6, 4, 2, 3], ["FSP", 6, 8, 3, 3], ["FSP", 6, 12, 4, 3], ["RE", 6, [0, 4, 8, 12, 1, 5, 9, 13, 2, 6, 10, 14, 3, 7, 11, 15]], ["CA", 2, 6, 11], ["CHR", 1, "shared", [2]], ["CA", 2, 3, 12], ["CHR", 0, "shared", [3]], ["CA", 1, 4, 12], ["FU", 8, [0, 1, 2, 3]], ["AN", 8, 0, 5], ["FU", 8, [1, 2, 3, 4]], ["AN", 8, 1, 4], ["FU", 8, [2, 3, 4, 5]], ["AN", 8, 2, 6], ["FU", 3, [0, 1]], ["SP", 3, 0, 384, [1], 1], ["AN", 3, 1, 2], ["FFSP", 3, 0, [4, 3, 2, 1], 1, 1], ["AN", 3, 1, 6], ["FU", 1, [0, 1, 2, 3]], ["SP", 1, 0, 384, [1], 1], ["AN", 1, 1, 2], ["FFSP", 1, 0, [4, 3, 2, 1], 1, 1], ["AN", 1, 1, 6], ["PR", 4, 0, "auto_unroll_max_step$16"]]]], "r": [[0.000118485, 0.000118454, 0.000118467], 0, 13.1038, 1661972442], "v": "v0.6"}
{"i": [["[\"pointwise_conv2d_bn\", 14, 14, 480, 112, 4]", "cuda -keys=cuda,gpu -max_num_threads=1024 -model=unknown -thread_warp_size=32", [-1, 16, 64, 49152, 2147483647, 1024, 8, 32], "", 0, []], [[], [["CI", 4], ["SP", 2, 0, 4, [1, 1, 1, 1], 1], ["SP", 2, 5, 14, [7, 2, 1, 1], 1], ["SP", 2, 10, 14, [1, 7, 2, 1], 1], ["SP", 2, 15, 112, [1, 28, 2, 1], 1], ["SP", 2, 20, 480, [2, 6], 1], ["RE", 2, [0, 5, 10, 15, 1, 6, 11, 16, 2, 7, 12, 17, 20, 21, 3, 8, 13, 18, 22, 4, 9, 14, 19]], ["FSP", 6, 0, 1, 3], ["FSP", 6, 4, 2, 3], ["FSP", 6, 8, 3, 3], ["FSP", 6, 12, 4, 3], ["RE", 6, [0, 4, 8, 12, 1, 5, 9, 13, 2, 6, 10, 14, 3, 7, 11, 15]], ["CA", 2, 6, 11], ["CHR", 1, "shared", [2]], ["CA", 2, 3, 12], ["CHR", 0, "shared", [3]], ["CA", 1, 4, 12], ["FU", 8, [0, 1, 2, 3]], ["AN", 8, 0, 5], ["FU", 8, [1, 2, 3, 4]], ["AN", 8, 1, 4], ["FU", 8, [2, 3, 4, 5]], ["AN", 8, 2, 6], ["FU", 3, [0, 1]], ["SP", 3, 0, 24, [2], 1], ["AN", 3, 1, 2], ["FFSP", 3, 0, [4, 3, 2, 1], 1, 1], ["AN", 3, 1, 6], ["FU", 1, [0, 1, 2, 3]], ["SP", 1, 0, 24, [1], 1], ["AN", 1, 1, 2], ["FFSP", 1, 0, [4, 3, 2, 1], 1, 1], ["AN", 1, 1, 6], ["PR", 4, 0, "auto_unroll_max_step$64"]]]], "r": [[0.000124588, 0.000124598, 0.000124604], 0, 14.4961, 1661972444], "v": "v0.6"}
{"i": [["[\"pointwise_conv2d_bn\", 14, 14, 480, 112, 4]", "cuda -keys=cuda,gpu -max_num_threads=1024 -model=unknown -thread_warp_size=32", [-1, 16, 64, 49152, 2147483647, 1024, 8, 32], "", 0, []], [[], [["CI", 4], ["SP", 2, 0, 4, [1, 2, 1, 2], 1], ["SP", 2, 5, 14, [1, 14, 1, 1], 1], ["SP", 2, 10, 14, [2, 7, 1, 1], 1], ["SP", 2, 15, 112, [1, 1, 2, 4], 1], ["SP", 2, 20, 480, [6, 1], 1], ["RE", 2, [0, 5, 10, 15, 1, 6, 11, 16, 2, 7, 12, 17, 20, 21, 3, 8, 13, 18, 22, 4, 9, 14, 19]], ["FSP", 6, 0, 1, 3], ["FSP", 6, 4, 2, 3], ["FSP", 6, 8, 3, 3], ["FSP", 6, 12, 4, 3], ["RE", 6, [0, 4, 8, 12, 1, 5, 9, 13, 2, 6, 10, 14, 3, 7, 11, 15]], ["CA", 2, 6, 11], ["CHR", 1, "shared", [2]], ["CA", 2, 3, 12], ["CHR", 0, "shared", [3]], ["CA", 1, 4, 12], ["FU", 8, [0, 1, 2, 3]], ["AN", 8, 0, 5], ["FU", 8, [1, 2, 3, 4]], ["AN", 8, 1, 4], ["FU", 8, [2, 3, 4, 5]], ["AN", 8, 2, 6], ["FU", 3, [0, 1]], ["SP", 3, 0, 24, [1], 1], ["AN", 3, 1, 2], ["FFSP", 3, 0, [4, 3, 2, 1], 1, 1], ["AN", 3, 1, 6], ["FU", 1, [0, 1, 2, 3]], ["SP", 1, 0, 24, [1], 1], ["AN", 1, 1, 2], ["FFSP", 1, 0, [4, 3, 2, 1], 1, 1], ["AN", 1, 1, 6], ["PR", 4, 0, "auto_unroll_max_step$0"]]]], "r": [[0.000149527, 0.000149533, 0.000149545], 0, 13.5609, 1661972443], "v": "v0.6"}
{"i": [["[\"pointwise_conv2d_bn\", 14, 14, 480, 112, 4]", "cuda -keys=cuda,gpu -max_num_threads=1024 -model=unknown -thread_warp_size=32", [-1, 16, 64, 49152, 2147483647, 1024, 8, 32], "", 0, []], [[], [["CI", 4], ["SP", 2, 0, 4, [1, 1, 1, 4], 1], ["SP", 2, 5, 14, [1, 14, 1, 1], 1], ["SP", 2, 10, 14, [2, 1, 1, 7], 1], ["SP", 2, 15, 112, [1, 2, 2, 2], 1], ["SP", 2, 20, 480, [6, 1], 1], ["RE", 2, [0, 5, 10, 15, 1, 6, 11, 16, 2, 7, 12, 17, 20, 21, 3, 8, 13, 18, 22, 4, 9, 14, 19]], ["FSP", 6, 0, 1, 3], ["FSP", 6, 4, 2, 3], ["FSP", 6, 8, 3, 3], ["FSP", 6, 12, 4, 3], ["RE", 6, [0, 4, 8, 12, 1, 5, 9, 13, 2, 6, 10, 14, 3, 7, 11, 15]], ["CA", 2, 6, 11], ["CHR", 1, "shared", [2]], ["CA", 2, 3, 12], ["CHR", 0, "shared", [3]], ["CA", 1, 4, 12], ["FU", 8, [0, 1, 2, 3]], ["AN", 8, 0, 5], ["FU", 8, [1, 2, 3, 4]], ["AN", 8, 1, 4], ["FU", 8, [2, 3, 4, 5]], ["AN", 8, 2, 6], ["FU", 3, [0, 1]], ["SP", 3, 0, 24, [1], 1], ["AN", 3, 1, 2], ["FFSP", 3, 0, [4, 3, 2, 1], 1, 1], ["AN", 3, 1, 6], ["FU", 1, [0, 1, 2, 3]], ["SP", 1, 0, 24, [1], 1], ["AN", 1, 1, 2], ["FFSP", 1, 0, [4, 3, 2, 1], 1, 1], ["AN", 1, 1, 6], ["PR", 4, 0, "auto_unroll_max_step$0"]]]], "r": [[0.000760393, 0.000760432, 0.000760593], 0, 12.3398, 1661972441], "v": "v0.6"}
{"i": [["[\"pointwise_conv2d_bn\", 14, 14, 480, 112, 4]", "cuda -keys=cuda,gpu -max_num_threads=1024 -model=unknown -thread_warp_size=32", [-1, 16, 64, 49152, 2147483647, 1024, 8, 32], "", 0, []], [[], [["CI", 4], ["SP", 2, 0, 4, [1, 1, 1, 4], 1], ["SP", 2, 5, 14, [1, 7, 2, 1], 1], ["SP", 2, 10, 14, [7, 1, 2, 1], 1], ["SP", 2, 15, 112, [1, 7, 1, 1], 1], ["SP", 2, 20, 480, [2, 1], 1], ["RE", 2, [0, 5, 10, 15, 1, 6, 11, 16, 2, 7, 12, 17, 20, 21, 3, 8, 13, 18, 22, 4, 9, 14, 19]], ["FSP", 6, 0, 1, 3], ["FSP", 6, 4, 2, 3], ["FSP", 6, 8, 3, 3], ["FSP", 6, 12, 4, 3], ["RE", 6, [0, 4, 8, 12, 1, 5, 9, 13, 2, 6, 10, 14, 3, 7, 11, 15]], ["CA", 2, 6, 11], ["CHR", 1, "shared", [2]], ["CA", 2, 3, 12], ["CHR", 0, "shared", [3]], ["CA", 1, 4, 12], ["FU", 8, [0, 1, 2, 3]], ["AN", 8, 0, 5], ["FU", 8, [1, 2, 3, 4]], ["AN", 8, 1, 4], ["FU", 8, [2, 3, 4, 5]], ["AN", 8, 2, 6], ["FU", 3, [0, 1]], ["SP", 3, 0, 2, [1], 1], ["AN", 3, 1, 2], ["FFSP", 3, 0, [4, 3, 2, 1], 1, 1], ["AN", 3, 1, 6], ["FU", 1, [0, 1, 2, 3]], ["SP", 1, 0, 16, [1], 1], ["AN", 1, 1, 2], ["FFSP", 1, 0, [4, 3, 2, 1], 1, 1], ["AN", 1, 1, 6], ["PR", 4, 0, "auto_unroll_max_step$0"]]]], "r": [[0.00161919, 0.00161947, 0.0016193], 0, 19.1255, 1661972449], "v": "v0.6"}
{"i": [["[\"pointwise_conv2d_bn\", 14, 14, 480, 112, 4]", "cuda -keys=cuda,gpu -max_num_threads=1024 -model=unknown -thread_warp_size=32", [-1, 16, 64, 49152, 2147483647, 1024, 8, 32], "", 0, []], [[], [["CI", 4], ["SP", 2, 0, 4, [1, 1, 4, 1], 1], ["SP", 2, 5, 14, [2, 7, 1, 1], 1], ["SP", 2, 10, 14, [1, 1, 2, 1], 1], ["SP", 2, 15, 112, [1, 28, 2, 1], 1], ["SP", 2, 20, 480, [12, 5], 1], ["RE", 2, [0, 5, 10, 15, 1, 6, 11, 16, 2, 7, 12, 17, 20, 21, 3, 8, 13, 18, 22, 4, 9, 14, 19]], ["FSP", 6, 0, 1, 3], ["FSP", 6, 4, 2, 3], ["FSP", 6, 8, 3, 3], ["FSP", 6, 12, 4, 3], ["RE", 6, [0, 4, 8, 12, 1, 5, 9, 13, 2, 6, 10, 14, 3, 7, 11, 15]], ["CA", 2, 6, 11], ["CHR", 1, "shared", [2]], ["CA", 2, 3, 12], ["CHR", 0, "shared", [3]], ["CA", 1, 4, 12], ["FU", 8, [0, 1, 2, 3]], ["AN", 8, 0, 5], ["FU", 8, [1, 2, 3, 4]], ["AN", 8, 1, 4], ["FU", 8, [2, 3, 4, 5]], ["AN", 8, 2, 6], ["FU", 3, [0, 1]], ["SP", 3, 0, 120, [1], 1], ["AN", 3, 1, 2], ["FFSP", 3, 0, [4, 3, 2, 1], 1, 1], ["AN", 3, 1, 6], ["FU", 1, [0, 1, 2, 3]], ["SP", 1, 0, 480, [2], 1], ["AN", 1, 1, 2], ["FFSP", 1, 0, [4, 3, 2, 1], 1, 1], ["AN", 1, 1, 6], ["PR", 4, 0, "auto_unroll_max_step$0"]]]], "r": [[0.000108366, 0.000108382, 0.000108371], 0, 16.6394, 1661972446], "v": "v0.6"}
{"i": [["[\"pointwise_conv2d_bn\", 14, 14, 480, 112, 4]", "cuda -keys=cuda,gpu -max_num_threads=1024 -model=unknown -thread_warp_size=32", [-1, 16, 64, 49152, 2147483647, 1024, 8, 32], "", 0, []], [[], [["CI", 4], ["SP", 2, 0, 4, [1, 1, 2, 1], 1], ["SP", 2, 5, 14, [1, 7, 1, 1], 1], ["SP", 2, 10, 14, [1, 1, 1, 1], 1], ["SP", 2, 15, 112, [2, 7, 4, 2], 1], ["SP", 2, 20, 480, [1, 5], 1], ["RE", 2, [0, 5, 10, 15, 1, 6, 11, 16, 2, 7, 12, 17, 20, 21, 3, 8, 13, 18, 22, 4, 9, 14, 19]], ["FSP", 6, 0, 1, 3], ["FSP", 6, 4, 2, 3], ["FSP", 6, 8, 3, 3], ["FSP", 6, 12, 4, 3], ["RE", 6, [0, 4, 8, 12, 1, 5, 9, 13, 2, 6, 10, 14, 3, 7, 11, 15]], ["CA", 2, 6, 11], ["CHR", 1, "shared", [2]], ["CA", 2, 3, 12], ["CHR", 0, "shared", [3]], ["CA", 1, 4, 12], ["FU", 8, [0, 1, 2, 3]], ["AN", 8, 0, 5], ["FU", 8, [1, 2, 3, 4]], ["AN", 8, 1, 4], ["FU", 8, [2, 3, 4, 5]], ["AN", 8, 2, 6], ["FU", 3, [0, 1]], ["SP", 3, 0, 40, [1], 1], ["AN", 3, 1, 2], ["FFSP", 3, 0, [4, 3, 2, 1], 1, 1], ["AN", 3, 1, 6], ["FU", 1, [0, 1, 2, 3]], ["SP", 1, 0, 10, [1], 1], ["AN", 1, 1, 2], ["FFSP", 1, 0, [4, 3, 2, 1], 1, 1], ["AN", 1, 1, 6], ["PR", 4, 0, "auto_unroll_max_step$512"]]]], "r": [[7.30338e-05, 7.30361e-05, 7.30176e-05], 0, 18.3743, 1661972448], "v": "v0.6"}
{"i": [["[\"pointwise_conv2d_bn\", 14, 14, 480, 112, 4]", "cuda -keys=cuda,gpu -max_num_threads=1024 -model=unknown -thread_warp_size=32", [-1, 16, 64, 49152, 2147483647, 1024, 8, 32], "", 0, []], [[], [["CI", 4], ["SP", 2, 0, 4, [1, 4, 1, 1], 1], ["SP", 2, 5, 14, [1, 14, 1, 1], 1], ["SP", 2, 10, 14, [1, 2, 1, 7], 1], ["SP", 2, 15, 112, [2, 1, 2, 1], 1], ["SP", 2, 20, 480, [2, 4], 1], ["RE", 2, [0, 5, 10, 15, 1, 6, 11, 16, 2, 7, 12, 17, 20, 21, 3, 8, 13, 18, 22, 4, 9, 14, 19]], ["FSP", 6, 0, 1, 3], ["FSP", 6, 4, 2, 3], ["FSP", 6, 8, 3, 3], ["FSP", 6, 12, 4, 3], ["RE", 6, [0, 4, 8, 12, 1, 5, 9, 13, 2, 6, 10, 14, 3, 7, 11, 15]], ["CA", 2, 6, 11], ["CHR", 1, "shared", [2]], ["CA", 2, 3, 12], ["CHR", 0, "shared", [3]], ["CA", 1, 4, 12], ["FU", 8, [0, 1, 2, 3]], ["AN", 8, 0, 5], ["FU", 8, [1, 2, 3, 4]], ["AN", 8, 1, 4], ["FU", 8, [2, 3, 4, 5]], ["AN", 8, 2, 6], ["FU", 3, [0, 1]], ["SP", 3, 0, 16, [1], 1], ["AN", 3, 1, 2], ["FFSP", 3, 0, [4, 3, 2, 1], 1, 1], ["AN", 3, 1, 6], ["FU", 1, [0, 1, 2, 3]], ["SP", 1, 0, 112, [1], 1], ["AN", 1, 1, 2], ["FFSP", 1, 0, [4, 3, 2, 1], 1, 1], ["AN", 1, 1, 6], ["PR", 4, 0, "auto_unroll_max_step$0"]]]], "r": [[0.000103141, 0.000103142, 0.00010314], 0, 16.929, 1661972447], "v": "v0.6"}
{"i": [["[\"pointwise_conv2d_bn\", 14, 14, 480, 112, 4]", "cuda -keys=cuda,gpu -max_num_threads=1024 -model=unknown -thread_warp_size=32", [-1, 16, 64, 49152, 2147483647, 1024, 8, 32], "", 0, []], [[], [["CI", 4], ["SP", 2, 0, 4, [1, 1, 2, 1], 1], ["SP", 2, 5, 14, [2, 7, 1, 1], 1], ["SP", 2, 10, 14, [1, 1, 1, 7], 1], ["SP", 2, 15, 112, [2, 4, 1, 14], 1], ["SP", 2, 20, 480, [2, 2], 1], ["RE", 2, [0, 5, 10, 15, 1, 6, 11, 16, 2, 7, 12, 17, 20, 21, 3, 8, 13, 18, 22, 4, 9, 14, 19]], ["FSP", 6, 0, 1, 3], ["FSP", 6, 4, 2, 3], ["FSP", 6, 8, 3, 3], ["FSP", 6, 12, 4, 3], ["RE", 6, [0, 4, 8, 12, 1, 5, 9, 13, 2, 6, 10, 14, 3, 7, 11, 15]], ["CA", 2, 6, 11], ["CHR", 1, "shared", [2]], ["CA", 2, 3, 12], ["CHR", 0, "shared", [3]], ["CA", 1, 4, 12], ["FU", 8, [0, 1, 2, 3]], ["AN", 8, 0, 5], ["FU", 8, [1, 2, 3, 4]], ["AN", 8, 1, 4], ["FU", 8, [2, 3, 4, 5]], ["AN", 8, 2, 6], ["FU", 3, [0, 1]], ["SP", 3, 0, 8, [1], 1], ["AN", 3, 1, 2], ["FFSP", 3, 0, [4, 3, 2, 1], 1, 1], ["AN", 3, 1, 6], ["FU", 1, [0, 1, 2, 3]], ["SP", 1, 0, 28, [1], 1], ["AN", 1, 1, 2], ["FFSP", 1, 0, [4, 3, 2, 1], 1, 1], ["AN", 1, 1, 6], ["PR", 4, 0, "auto_unroll_max_step$16"]]]], "r": [[0.00515588, 0.00515328, 0.00515674], 0, 16.9739, 1661972445], "v": "v0.6"}
{"i": [["[\"pointwise_conv2d_bn\", 14, 14, 480, 112, 4]", "cuda -keys=cuda,gpu -max_num_threads=1024 -model=unknown -thread_warp_size=32", [-1, 16, 64, 49152, 2147483647, 1024, 8, 32], "", 0, []], [[], [["CI", 4], ["SP", 2, 0, 4, [1, 1, 1, 1], 1], ["SP", 2, 5, 14, [7, 2, 1, 1], 1], ["SP", 2, 10, 14, [1, 7, 2, 1], 1], ["SP", 2, 15, 112, [1, 28, 2, 1], 1], ["SP", 2, 20, 480, [2, 6], 1], ["RE", 2, [0, 5, 10, 15, 1, 6, 11, 16, 2, 7, 12, 17, 20, 21, 3, 8, 13, 18, 22, 4, 9, 14, 19]], ["FSP", 6, 0, 1, 3], ["FSP", 6, 4, 2, 3], ["FSP", 6, 8, 3, 3], ["FSP", 6, 12, 4, 3], ["RE", 6, [0, 4, 8, 12, 1, 5, 9, 13, 2, 6, 10, 14, 3, 7, 11, 15]], ["CA", 2, 6, 11], ["CHR", 1, "shared", [2]], ["CA", 2, 3, 12], ["CHR", 0, "shared", [3]], ["CA", 1, 4, 12], ["FU", 8, [0, 1, 2, 3]], ["AN", 8, 0, 5], ["FU", 8, [1, 2, 3, 4]], ["AN", 8, 1, 4], ["FU", 8, [2, 3, 4, 5]], ["AN", 8, 2, 6], ["FU", 3, [0, 1]], ["SP", 3, 0, 24, [24], 1], ["AN", 3, 1, 2], ["FFSP", 3, 0, [4, 3, 2, 1], 1, 1], ["AN", 3, 1, 6], ["FU", 1, [0, 1, 2, 3]], ["SP", 1, 0, 24, [1], 1], ["AN", 1, 1, 2], ["FFSP", 1, 0, [4, 3, 2, 1], 1, 1], ["AN", 1, 1, 6], ["PR", 4, 0, "auto_unroll_max_step$64"]]]], "r": [[0.000198144, 0.000198119, 0.000198158], 0, 21.3225, 1661972451], "v": "v0.6"}
{"i": [["[\"pointwise_conv2d_bn\", 14, 14, 480, 112, 4]", "cuda -keys=cuda,gpu -max_num_threads=1024 -model=unknown -thread_warp_size=32", [-1, 16, 64, 49152, 2147483647, 1024, 8, 32], "", 0, []], [[], [["CI", 4], ["SP", 2, 0, 4, [2, 1, 1, 1], 1], ["SP", 2, 5, 14, [1, 1, 1, 2], 1], ["SP", 2, 10, 14, [7, 2, 1, 1], 1], ["SP", 2, 15, 112, [1, 14, 1, 1], 1], ["SP", 2, 20, 480, [1, 8], 1], ["RE", 2, [0, 5, 10, 15, 1, 6, 11, 16, 2, 7, 12, 17, 20, 21, 3, 8, 13, 18, 22, 4, 9, 14, 19]], ["FSP", 6, 0, 1, 3], ["FSP", 6, 4, 2, 3], ["FSP", 6, 8, 3, 3], ["FSP", 6, 12, 4, 3], ["RE", 6, [0, 4, 8, 12, 1, 5, 9, 13, 2, 6, 10, 14, 3, 7, 11, 15]], ["CA", 2, 6, 11], ["CHR", 1, "shared", [2]], ["CA", 2, 3, 12], ["CHR", 0, "shared", [3]], ["CA", 1, 4, 12], ["FU", 8, [0, 1, 2, 3]], ["AN", 8, 0, 5], ["FU", 8, [1, 2, 3, 4]], ["AN", 8, 1, 4], ["FU", 8, [2, 3, 4, 5]], ["AN", 8, 2, 6], ["FU", 3, [0, 1]], ["SP", 3, 0, 80, [1], 1], ["AN", 3, 1, 2], ["FFSP", 3, 0, [4, 3, 2, 1], 1, 1], ["AN", 3, 1, 6], ["FU", 1, [0, 1, 2, 3]], ["SP", 1, 0, 160, [1], 1], ["AN", 1, 1, 2], ["FFSP", 1, 0, [4, 3, 2, 1], 1, 1], ["AN", 1, 1, 6], ["PR", 4, 0, "auto_unroll_max_step$0"]]]], "r": [[7.04209e-05, 7.08547e-05, 7.12931e-05], 0, 19.4186, 1661972449], "v": "v0.6"}
{"i": [["[\"pointwise_conv2d_bn\", 14, 14, 480, 112, 4]", "cuda -keys=cuda,gpu -max_num_threads=1024 -model=unknown -thread_warp_size=32", [-1, 16, 64, 49152, 2147483647, 1024, 8, 32], "", 0, []], [[], [["CI", 4], ["SP", 2, 0, 4, [1, 1, 4, 1], 1], ["SP", 2, 5, 14, [2, 7, 1, 1], 1], ["SP", 2, 10, 14, [1, 1, 2, 1], 1], ["SP", 2, 15, 112, [1, 28, 2, 1], 1], ["SP", 2, 20, 480, [12, 5], 1], ["RE", 2, [0, 5, 10, 15, 1, 6, 11, 16, 2, 7, 12, 17, 20, 21, 3, 8, 13, 18, 22, 4, 9, 14, 19]], ["FSP", 6, 0, 1, 3], ["FSP", 6, 4, 2, 3], ["FSP", 6, 8, 3, 3], ["FSP", 6, 12, 4, 3], ["RE", 6, [0, 4, 8, 12, 1, 5, 9, 13, 2, 6, 10, 14, 3, 7, 11, 15]], ["CA", 2, 6, 11], ["CHR", 1, "shared", [2]], ["CA", 2, 3, 12], ["CHR", 0, "shared", [3]], ["CA", 1, 4, 12], ["FU", 8, [0, 1, 2, 3]], ["AN", 8, 0, 5], ["FU", 8, [1, 2, 3, 4]], ["AN", 8, 1, 4], ["FU", 8, [2, 3, 4, 5]], ["AN", 8, 2, 6], ["FU", 3, [0, 1]], ["SP", 3, 0, 120, [20], 1], ["AN", 3, 1, 2], ["FFSP", 3, 0, [4, 3, 2, 1], 1, 1], ["AN", 3, 1, 6], ["FU", 1, [0, 1, 2, 3]], ["SP", 1, 0, 480, [40], 1], ["AN", 1, 1, 2], ["FFSP", 1, 0, [4, 3, 2, 1], 1, 1], ["AN", 1, 1, 6], ["PR", 4, 0, "auto_unroll_max_step$0"]]]], "r": [[0.000122838, 0.000122826, 0.000122833], 0, 17.6495, 1661972447], "v": "v0.6"}
{"i": [["[\"pointwise_conv2d_bn\", 14, 14, 480, 112, 4]", "cuda -keys=cuda,gpu -max_num_threads=1024 -model=unknown -thread_warp_size=32", [-1, 16, 64, 49152, 2147483647, 1024, 8, 32], "", 0, []], [[], [["CI", 4], ["SP", 2, 0, 4, [1, 1, 4, 1], 1], ["SP", 2, 5, 14, [1, 2, 1, 1], 1], ["SP", 2, 10, 14, [1, 7, 1, 1], 1], ["SP", 2, 15, 112, [1, 4, 1, 1], 1], ["SP", 2, 20, 480, [24, 1], 1], ["RE", 2, [0, 5, 10, 15, 1, 6, 11, 16, 2, 7, 12, 17, 20, 21, 3, 8, 13, 18, 22, 4, 9, 14, 19]], ["FSP", 6, 0, 1, 3], ["FSP", 6, 4, 2, 3], ["FSP", 6, 8, 3, 3], ["FSP", 6, 12, 4, 3], ["RE", 6, [0, 4, 8, 12, 1, 5, 9, 13, 2, 6, 10, 14, 3, 7, 11, 15]], ["CA", 2, 6, 11], ["CHR", 1, "shared", [2]], ["CA", 2, 3, 12], ["CHR", 0, "shared", [3]], ["CA", 1, 4, 12], ["FU", 8, [0, 1, 2, 3]], ["AN", 8, 0, 5], ["FU", 8, [1, 2, 3, 4]], ["AN", 8, 1, 4], ["FU", 8, [2, 3, 4, 5]], ["AN", 8, 2, 6], ["FU", 3, [0, 1]], ["SP", 3, 0, 48, [1], 1], ["AN", 3, 1, 2], ["FFSP", 3, 0, [4, 3, 2, 1], 1, 1], ["AN", 3, 1, 6], ["FU", 1, [0, 1, 2, 3]], ["SP", 1, 0, 192, [1], 1], ["AN", 1, 1, 2], ["FFSP", 1, 0, [4, 3, 2, 1], 1, 1], ["AN", 1, 1, 6], ["PR", 4, 0, "auto_unroll_max_step$1024"]]]], "r": [[2.6299e-05, 2.63109e-05, 2.63154e-05], 0, 22.694, 1661972453], "v": "v0.6"}
{"i": [["[\"pointwise_conv2d_bn\", 14, 14, 480, 112, 4]", "cuda -keys=cuda,gpu -max_num_threads=1024 -model=unknown -thread_warp_size=32", [-1, 16, 64, 49152, 2147483647, 1024, 8, 32], "", 0, []], [[], [["CI", 4], ["SP", 2, 0, 4, [1, 1, 1, 1], 1], ["SP", 2, 5, 14, [1, 7, 1, 2], 1], ["SP", 2, 10, 14, [1, 1, 7, 2], 1], ["SP", 2, 15, 112, [1, 7, 8, 2], 1], ["SP", 2, 20, 480, [1, 1], 1], ["RE", 2, [0, 5, 10, 15, 1, 6, 11, 16, 2, 7, 12, 17, 20, 21, 3, 8, 13, 18, 22, 4, 9, 14, 19]], ["FSP", 6, 0, 1, 3], ["FSP", 6, 4, 2, 3], ["FSP", 6, 8, 3, 3], ["FSP", 6, 12, 4, 3], ["RE", 6, [0, 4, 8, 12, 1, 5, 9, 13, 2, 6, 10, 14, 3, 7, 11, 15]], ["CA", 2, 6, 11], ["CHR", 1, "shared", [2]], ["CA", 2, 3, 12], ["CHR", 0, "shared", [3]], ["CA", 1, 4, 12], ["FU", 8, [0, 1, 2, 3]], ["AN", 8, 0, 5], ["FU", 8, [1, 2, 3, 4]], ["AN", 8, 1, 4], ["FU", 8, [2, 3, 4, 5]], ["AN", 8, 2, 6], ["FU", 3, [0, 1]], ["SP", 3, 0, 80, [2], 1], ["AN", 3, 1, 2], ["FFSP", 3, 0, [4, 3, 2, 1], 1, 1], ["AN", 3, 1, 6], ["FU", 1, [0, 1, 2, 3]], ["SP", 1, 0, 20, [4], 1], ["AN", 1, 1, 2], ["FFSP", 1, 0, [4, 3, 2, 1], 1, 1], ["AN", 1, 1, 6], ["PR", 4, 0, "auto_unroll_max_step$512"]]]], "r": [[0.0130554, 0.0127368, 0.0106418], 0, 21.5568, 1661972450], "v": "v0.6"}
{"i": [["[\"pointwise_conv2d_bn\", 14, 14, 480, 112, 4]", "cuda -keys=cuda,gpu -max_num_threads=1024 -model=unknown -thread_warp_size=32", [-1, 16, 64, 49152, 2147483647, 1024, 8, 32], "", 0, []], [[], [["CI", 4], ["SP", 2, 0, 4, [1, 1, 2, 2], 1], ["SP", 2, 5, 14, [1, 1, 1, 1], 1], ["SP", 2, 10, 14, [1, 7, 2, 1], 1], ["SP", 2, 15, 112, [2, 7, 1, 2], 1], ["SP", 2, 20, 480, [8, 3], 1], ["RE", 2, [0, 5, 10, 15, 1, 6, 11, 16, 2, 7, 12, 17, 20, 21, 3, 8, 13, 18, 22, 4, 9, 14, 19]], ["FSP", 6, 0, 1, 3], ["FSP", 6, 4, 2, 3], ["FSP", 6, 8, 3, 3], ["FSP", 6, 12, 4, 3], ["RE", 6, [0, 4, 8, 12, 1, 5, 9, 13, 2, 6, 10, 14, 3, 7, 11, 15]], ["CA", 2, 6, 11], ["CHR", 1, "shared", [2]], ["CA", 2, 3, 12], ["CHR", 0, "shared", [3]], ["CA", 1, 4, 12], ["FU", 8, [0, 1, 2, 3]], ["AN", 8, 0, 5], ["FU", 8, [1, 2, 3, 4]], ["AN", 8, 1, 4], ["FU", 8, [2, 3, 4, 5]], ["AN", 8, 2, 6], ["FU", 3, [0, 1]], ["SP", 3, 0, 12, [1], 1], ["AN", 3, 1, 2], ["FFSP", 3, 0, [4, 3, 2, 1], 1, 1], ["AN", 3, 1, 6], ["FU", 1, [0, 1, 2, 3]], ["SP", 1, 0, 168, [1], 1], ["AN", 1, 1, 2], ["FFSP", 1, 0, [4, 3, 2, 1], 1, 1], ["AN", 1, 1, 6], ["PR", 4, 0, "auto_unroll_max_step$64"]]]], "r": [[6.81633e-05, 6.81661e-05, 6.81636e-05], 0, 21.9761, 1661972452], "v": "v0.6"}
{"i": [["[\"pointwise_conv2d_bn\", 14, 14, 480, 112, 4]", "cuda -keys=cuda,gpu -max_num_threads=1024 -model=unknown -thread_warp_size=32", [-1, 16, 64, 49152, 2147483647, 1024, 8, 32], "", 0, []], [[], [["CI", 4], ["SP", 2, 0, 4, [2, 1, 1, 1], 1], ["SP", 2, 5, 14, [1, 2, 1, 7], 1], ["SP", 2, 10, 14, [1, 1, 1, 14], 1], ["SP", 2, 15, 112, [1, 56, 1, 2], 1], ["SP", 2, 20, 480, [12, 1], 1], ["RE", 2, [0, 5, 10, 15, 1, 6, 11, 16, 2, 7, 12, 17, 20, 21, 3, 8, 13, 18, 22, 4, 9, 14, 19]], ["FSP", 6, 0, 1, 3], ["FSP", 6, 4, 2, 3], ["FSP", 6, 8, 3, 3], ["FSP", 6, 12, 4, 3], ["RE", 6, [0, 4, 8, 12, 1, 5, 9, 13, 2, 6, 10, 14, 3, 7, 11, 15]], ["CA", 2, 6, 11], ["CHR", 1, "shared", [2]], ["CA", 2, 3, 12], ["CHR", 0, "shared", [3]], ["CA", 1, 4, 12], ["FU", 8, [0, 1, 2, 3]], ["AN", 8, 0, 5], ["FU", 8, [1, 2, 3, 4]], ["AN", 8, 1, 4], ["FU", 8, [2, 3, 4, 5]], ["AN", 8, 2, 6], ["FU", 3, [0, 1]], ["SP", 3, 0, 12, [1], 1], ["AN", 3, 1, 2], ["FFSP", 3, 0, [4, 3, 2, 1], 1, 1], ["AN", 3, 1, 6], ["FU", 1, [0, 1, 2, 3]], ["SP", 1, 0, 1176, [1], 1], ["AN", 1, 1, 2], ["FFSP", 1, 0, [4, 3, 2, 1], 1, 1], ["AN", 1, 1, 6], ["PR", 4, 0, "auto_unroll_max_step$0"]]]], "r": [[0.00263059, 0.00262998, 0.0026297], 0, 25.3683, 1661972455], "v": "v0.6"}
{"i": [["[\"pointwise_conv2d_bn\", 14, 14, 480, 112, 4]", "cuda -keys=cuda,gpu -max_num_threads=1024 -model=unknown -thread_warp_size=32", [-1, 16, 64, 49152, 2147483647, 1024, 8, 32], "", 0, []], [[], [["CI", 4], ["SP", 2, 0, 4, [4, 1, 1, 1], 1], ["SP", 2, 5, 14, [2, 7, 1, 1], 1], ["SP", 2, 10, 14, [1, 1, 2, 1], 1], ["SP", 2, 15, 112, [1, 28, 2, 1], 1], ["SP", 2, 20, 480, [12, 5], 1], ["RE", 2, [0, 5, 10, 15, 1, 6, 11, 16, 2, 7, 12, 17, 20, 21, 3, 8, 13, 18, 22, 4, 9, 14, 19]], ["FSP", 6, 0, 1, 3], ["FSP", 6, 4, 2, 3], ["FSP", 6, 8, 3, 3], ["FSP", 6, 12, 4, 3], ["RE", 6, [0, 4, 8, 12, 1, 5, 9, 13, 2, 6, 10, 14, 3, 7, 11, 15]], ["CA", 2, 6, 11], ["CHR", 1, "shared", [2]], ["CA", 2, 3, 12], ["CHR", 0, "shared", [3]], ["CA", 1, 4, 12], ["FU", 8, [0, 1, 2, 3]], ["AN", 8, 0, 5], ["FU", 8, [1, 2, 3, 4]], ["AN", 8, 1, 4], ["FU", 8, [2, 3, 4, 5]], ["AN", 8, 2, 6], ["FU", 3, [0, 1]], ["SP", 3, 0, 120, [40], 1], ["AN", 3, 1, 2], ["FFSP", 3, 0, [4, 3, 2, 1], 1, 1], ["AN", 3, 1, 6], ["FU", 1, [0, 1, 2, 3]], ["SP", 1, 0, 480, [1], 1], ["AN", 1, 1, 2], ["FFSP", 1, 0, [4, 3, 2, 1], 1, 1], ["AN", 1, 1, 6], ["PR", 4, 0, "auto_unroll_max_step$0"]]]], "r": [[0.000136834, 0.000136824, 0.000136825], 0, 24.4653, 1661972455], "v": "v0.6"}
{"i": [["[\"pointwise_conv2d_bn\", 14, 14, 480, 112, 4]", "cuda -keys=cuda,gpu -max_num_threads=1024 -model=unknown -thread_warp_size=32", [-1, 16, 64, 49152, 2147483647, 1024, 8, 32], "", 0, []], [[], [["CI", 4], ["SP", 2, 0, 4, [2, 2, 1, 1], 1], ["SP", 2, 5, 14, [1, 7, 1, 1], 1], ["SP", 2, 10, 14, [1, 2, 1, 1], 1], ["SP", 2, 15, 112, [1, 2, 1, 14], 1], ["SP", 2, 20, 480, [5, 1], 1], ["RE", 2, [0, 5, 10, 15, 1, 6, 11, 16, 2, 7, 12, 17, 20, 21, 3, 8, 13, 18, 22, 4, 9, 14, 19]], ["FSP", 6, 0, 1, 3], ["FSP", 6, 4, 2, 3], ["FSP", 6, 8, 3, 3], ["FSP", 6, 12, 4, 3], ["RE", 6, [0, 4, 8, 12, 1, 5, 9, 13, 2, 6, 10, 14, 3, 7, 11, 15]], ["CA", 2, 6, 11], ["CHR", 1, "shared", [2]], ["CA", 2, 3, 12], ["CHR", 0, "shared", [3]], ["CA", 1, 4, 12], ["FU", 8, [0, 1, 2, 3]], ["AN", 8, 0, 5], ["FU", 8, [1, 2, 3, 4]], ["AN", 8, 1, 4], ["FU", 8, [2, 3, 4, 5]], ["AN", 8, 2, 6], ["FU", 3, [0, 1]], ["SP", 3, 0, 140, [1], 1], ["AN", 3, 1, 2], ["FFSP", 3, 0, [4, 3, 2, 1], 1, 1], ["AN", 3, 1, 6], ["FU", 1, [0, 1, 2, 3]], ["SP", 1, 0, 10, [1], 1], ["AN", 1, 1, 2], ["FFSP", 1, 0, [4, 3, 2, 1], 1, 1], ["AN", 1, 1, 6], ["PR", 4, 0, "auto_unroll_max_step$1024"]]]], "r": [[5.55416e-05, 5.55398e-05, 5.55434e-05], 0, 23.8661, 1661972454], "v": "v0.6"}
{"i": [["[\"pointwise_conv2d_bn\", 14, 14, 480, 112, 4]", "cuda -keys=cuda,gpu -max_num_threads=1024 -model=unknown -thread_warp_size=32", [-1, 16, 64, 49152, 2147483647, 1024, 8, 32], "", 0, []], [[], [["CI", 4], ["SP", 2, 0, 4, [2, 1, 1, 1], 1], ["SP", 2, 5, 14, [1, 1, 1, 2], 1], ["SP", 2, 10, 14, [7, 2, 1, 1], 1], ["SP", 2, 15, 112, [1, 14, 1, 1], 1], ["SP", 2, 20, 480, [10, 8], 1], ["RE", 2, [0, 5, 10, 15, 1, 6, 11, 16, 2, 7, 12, 17, 20, 21, 3, 8, 13, 18, 22, 4, 9, 14, 19]], ["FSP", 6, 0, 1, 3], ["FSP", 6, 4, 2, 3], ["FSP", 6, 8, 3, 3], ["FSP", 6, 12, 4, 3], ["RE", 6, [0, 4, 8, 12, 1, 5, 9, 13, 2, 6, 10, 14, 3, 7, 11, 15]], ["CA", 2, 6, 11], ["CHR", 1, "shared", [2]], ["CA", 2, 3, 12], ["CHR", 0, "shared", [3]], ["CA", 1, 4, 12], ["FU", 8, [0, 1, 2, 3]], ["AN", 8, 0, 5], ["FU", 8, [1, 2, 3, 4]], ["AN", 8, 1, 4], ["FU", 8, [2, 3, 4, 5]], ["AN", 8, 2, 6], ["FU", 3, [0, 1]], ["SP", 3, 0, 80, [1], 1], ["AN", 3, 1, 2], ["FFSP", 3, 0, [4, 3, 2, 1], 1, 1], ["AN", 3, 1, 6], ["FU", 1, [0, 1, 2, 3]], ["SP", 1, 0, 160, [1], 1], ["AN", 1, 1, 2], ["FFSP", 1, 0, [4, 3, 2, 1], 1, 1], ["AN", 1, 1, 6], ["PR", 4, 0, "auto_unroll_max_step$0"]]]], "r": [[0.000104356, 0.00010436, 0.000104357], 0, 25.6748, 1661972456], "v": "v0.6"}
{"i": [["[\"pointwise_conv2d_bn\", 14, 14, 480, 112, 4]", "cuda -keys=cuda,gpu -max_num_threads=1024 -model=unknown -thread_warp_size=32", [-1, 16, 64, 49152, 2147483647, 1024, 8, 32], "", 0, []], [[], [["CI", 4], ["SP", 2, 0, 4, [2, 1, 1, 1], 1], ["SP", 2, 5, 14, [1, 7, 1, 1], 1], ["SP", 2, 10, 14, [2, 7, 1, 1], 1], ["SP", 2, 15, 112, [1, 4, 2, 14], 1], ["SP", 2, 20, 480, [24, 1], 1], ["RE", 2, [0, 5, 10, 15, 1, 6, 11, 16, 2, 7, 12, 17, 20, 21, 3, 8, 13, 18, 22, 4, 9, 14, 19]], ["FSP", 6, 0, 1, 3], ["FSP", 6, 4, 2, 3], ["FSP", 6, 8, 3, 3], ["FSP", 6, 12, 4, 3], ["RE", 6, [0, 4, 8, 12, 1, 5, 9, 13, 2, 6, 10, 14, 3, 7, 11, 15]], ["CA", 2, 6, 11], ["CHR", 1, "shared", [2]], ["CA", 2, 3, 12], ["CHR", 0, "shared", [3]], ["CA", 1, 4, 12], ["FU", 8, [0, 1, 2, 3]], ["AN", 8, 0, 5], ["FU", 8, [1, 2, 3, 4]], ["AN", 8, 1, 4], ["FU", 8, [2, 3, 4, 5]], ["AN", 8, 2, 6], ["FU", 3, [0, 1]], ["SP", 3, 0, 672, [3], 1], ["AN", 3, 1, 2], ["FFSP", 3, 0, [4, 3, 2, 1], 1, 1], ["AN", 3, 1, 6], ["FU", 1, [0, 1, 2, 3]], ["SP", 1, 0, 24, [1], 1], ["AN", 1, 1, 2], ["FFSP", 1, 0, [4, 3, 2, 1], 1, 1], ["AN", 1, 1, 6], ["PR", 4, 0, "auto_unroll_max_step$0"]]]], "r": [[0.000388781, 0.000388821, 0.000388811], 0, 23.3716, 1661972453], "v": "v0.6"}
{"i": [["[\"pointwise_conv2d_bn\", 14, 14, 480, 112, 4]", "cuda -keys=cuda,gpu -max_num_threads=1024 -model=unknown -thread_warp_size=32", [-1, 16, 64, 49152, 2147483647, 1024, 8, 32], "", 0, []], [[], [["CI", 4], ["SP", 2, 0, 4, [2, 1, 1, 2], 1], ["SP", 2, 5, 14, [2, 7, 1, 1], 1], ["SP", 2, 10, 14, [1, 1, 1, 7], 1], ["SP", 2, 15, 112, [1, 8, 1, 1], 1], ["SP", 2, 20, 480, [1, 4], 1], ["RE", 2, [0, 5, 10, 15, 1, 6, 11, 16, 2, 7, 12, 17, 20, 21, 3, 8, 13, 18, 22, 4, 9, 14, 19]], ["FSP", 6, 0, 1, 3], ["FSP", 6, 4, 2, 3], ["FSP", 6, 8, 3, 3], ["FSP", 6, 12, 4, 3], ["RE", 6, [0, 4, 8, 12, 1, 5, 9, 13, 2, 6, 10, 14, 3, 7, 11, 15]], ["CA", 2, 6, 11], ["CHR", 1, "shared", [2]], ["CA", 2, 3, 12], ["CHR", 0, "shared", [3]], ["CA", 1, 4, 12], ["FU", 8, [0, 1, 2, 3]], ["AN", 8, 0, 5], ["FU", 8, [1, 2, 3, 4]], ["AN", 8, 1, 4], ["FU", 8, [2, 3, 4, 5]], ["AN", 8, 2, 6], ["FU", 3, [0, 1]], ["SP", 3, 0, 4, [1], 1], ["AN", 3, 1, 2], ["FFSP", 3, 0, [4, 3, 2, 1], 1, 1], ["AN", 3, 1, 6], ["FU", 1, [0, 1, 2, 3]], ["SP", 1, 0, 56, [1], 1], ["AN", 1, 1, 2], ["FFSP", 1, 0, [4, 3, 2, 1], 1, 1], ["AN", 1, 1, 6], ["PR", 4, 0, "auto_unroll_max_step$1024"]]]], "r": [[0.00013235, 0.000132329, 0.000132314], 0, 26.7613, 1661972457], "v": "v0.6"}
{"i": [["[\"pointwise_conv2d_bn\", 14, 14, 480, 112, 4]", "cuda -keys=cuda,gpu -max_num_threads=1024 -model=unknown -thread_warp_size=32", [-1, 16, 64, 49152, 2147483647, 1024, 8, 32], "", 0, []], [[], [["CI", 4], ["SP", 2, 0, 4, [1, 1, 1, 2], 1], ["SP", 2, 5, 14, [1, 2, 1, 1], 1], ["SP", 2, 10, 14, [2, 1, 1, 1], 1], ["SP", 2, 15, 112, [1, 4, 1, 2], 1], ["SP", 2, 20, 480, [1, 15], 1], ["RE", 2, [0, 5, 10, 15, 1, 6, 11, 16, 2, 7, 12, 17, 20, 21, 3, 8, 13, 18, 22, 4, 9, 14, 19]], ["FSP", 6, 0, 1, 3], ["FSP", 6, 4, 2, 3], ["FSP", 6, 8, 3, 3], ["FSP", 6, 12, 4, 3], ["RE", 6, [0, 4, 8, 12, 1, 5, 9, 13, 2, 6, 10, 14, 3, 7, 11, 15]], ["CA", 2, 6, 11], ["CHR", 1, "shared", [2]], ["CA", 2, 3, 12], ["CHR", 0, "shared", [3]], ["CA", 1, 4, 12], ["FU", 8, [0, 1, 2, 3]], ["AN", 8, 0, 5], ["FU", 8, [1, 2, 3, 4]], ["AN", 8, 1, 4], ["FU", 8, [2, 3, 4, 5]], ["AN", 8, 2, 6], ["FU", 3, [0, 1]], ["SP", 3, 0, 30, [2], 1], ["AN", 3, 1, 2], ["FFSP", 3, 0, [4, 3, 2, 1], 1, 1], ["AN", 3, 1, 6], ["FU", 1, [0, 1, 2, 3]], ["SP", 1, 0, 60, [2], 1], ["AN", 1, 1, 2], ["FFSP", 1, 0, [4, 3, 2, 1], 1, 1], ["AN", 1, 1, 6], ["PR", 4, 0, "auto_unroll_max_step$1024"]]]], "r": [[5.92955e-05, 5.92978e-05, 5.92584e-05], 0, 27.1446, 1661972457], "v": "v0.6"}
{"i": [["[\"pointwise_conv2d_bn\", 14, 14, 480, 112, 4]", "cuda -keys=cuda,gpu -max_num_threads=1024 -model=unknown -thread_warp_size=32", [-1, 16, 64, 49152, 2147483647, 1024, 8, 32], "", 0, []], [[], [["CI", 4], ["SP", 2, 0, 4, [4, 1, 1, 1], 1], ["SP", 2, 5, 14, [1, 7, 2, 1], 1], ["SP", 2, 10, 14, [1, 1, 2, 1], 1], ["SP", 2, 15, 112, [2, 8, 7, 1], 1], ["SP", 2, 20, 480, [10, 4], 1], ["RE", 2, [0, 5, 10, 15, 1, 6, 11, 16, 2, 7, 12, 17, 20, 21, 3, 8, 13, 18, 22, 4, 9, 14, 19]], ["FSP", 6, 0, 1, 3], ["FSP", 6, 4, 2, 3], ["FSP", 6, 8, 3, 3], ["FSP", 6, 12, 4, 3], ["RE", 6, [0, 4, 8, 12, 1, 5, 9, 13, 2, 6, 10, 14, 3, 7, 11, 15]], ["CA", 2, 6, 11], ["CHR", 1, "shared", [2]], ["CA", 2, 3, 12], ["CHR", 0, "shared", [3]], ["CA", 1, 4, 12], ["FU", 8, [0, 1, 2, 3]], ["AN", 8, 0, 5], ["FU", 8, [1, 2, 3, 4]], ["AN", 8, 1, 4], ["FU", 8, [2, 3, 4, 5]], ["AN", 8, 2, 6], ["FU", 3, [0, 1]], ["SP", 3, 0, 280, [14], 1], ["AN", 3, 1, 2], ["FFSP", 3, 0, [4, 3, 2, 1], 1, 1], ["AN", 3, 1, 6], ["FU", 1, [0, 1, 2, 3]], ["SP", 1, 0, 160, [1], 1], ["AN", 1, 1, 2], ["FFSP", 1, 0, [4, 3, 2, 1], 1, 1], ["AN", 1, 1, 6], ["PR", 4, 0, "auto_unroll_max_step$16"]]]], "r": [[0.000438575, 0.000439017, 0.000438812], 0, 28.3459, 1661972458], "v": "v0.6"}
{"i": [["[\"pointwise_conv2d_bn\", 14, 14, 480, 112, 4]", "cuda -keys=cuda,gpu -max_num_threads=1024 -model=unknown -thread_warp_size=32", [-1, 16, 64, 49152, 2147483647, 1024, 8, 32], "", 0, []], [[], [["CI", 4], ["SP", 2, 0, 4, [2, 1, 1, 2], 1], ["SP", 2, 5, 14, [1, 7, 2, 1], 1], ["SP", 2, 10, 14, [2, 1, 1, 1], 1], ["SP", 2, 15, 112, [1, 7, 1, 2], 1], ["SP", 2, 20, 480, [10, 6], 1], ["RE", 2, [0, 5, 10, 15, 1, 6, 11, 16, 2, 7, 12, 17, 20, 21, 3, 8, 13, 18, 22, 4, 9, 14, 19]], ["FSP", 6, 0, 1, 3], ["FSP", 6, 4, 2, 3], ["FSP", 6, 8, 3, 3], ["FSP", 6, 12, 4, 3], ["RE", 6, [0, 4, 8, 12, 1, 5, 9, 13, 2, 6, 10, 14, 3, 7, 11, 15]], ["CA", 2, 6, 11], ["CHR", 1, "shared", [2]], ["CA", 2, 3, 12], ["CHR", 0, "shared", [3]], ["CA", 1, 4, 12], ["FU", 8, [0, 1, 2, 3]], ["AN", 8, 0, 5], ["FU", 8, [1, 2, 3, 4]], ["AN", 8, 1, 4], ["FU", 8, [2, 3, 4, 5]], ["AN", 8, 2, 6], ["FU", 3, [0, 1]], ["SP", 3, 0, 240, [1], 1], ["AN", 3, 1, 2], ["FFSP", 3, 0, [4, 3, 2, 1], 1, 1], ["AN", 3, 1, 6], ["FU", 1, [0, 1, 2, 3]], ["SP", 1, 0, 240, [1], 1], ["AN", 1, 1, 2], ["FFSP", 1, 0, [4, 3, 2, 1], 1, 1], ["AN", 1, 1, 6], ["PR", 4, 0, "auto_unroll_max_step$512"]]]], "r": [[9.50498e-05, 9.50167e-05, 9.30849e-05], 0, 29.8682, 1661972459], "v": "v0.6"}
{"i": [["[\"pointwise_conv2d_bn\", 14, 14, 480, 112, 4]", "cuda -keys=cuda,gpu -max_num_threads=1024 -model=unknown -thread_warp_size=32", [-1, 16, 64, 49152, 2147483647, 1024, 8, 32], "", 0, []], [[], [["CI", 4], ["SP", 2, 0, 4, [2, 1, 2, 1], 1], ["SP", 2, 5, 14, [2, 1, 1, 1], 1], ["SP", 2, 10, 14, [1, 2, 1, 1], 1], ["SP", 2, 15, 112, [1, 14, 1, 4], 1], ["SP", 2, 20, 480, [1, 16], 1], ["RE", 2, [0, 5, 10, 15, 1, 6, 11, 16, 2, 7, 12, 17, 20, 21, 3, 8, 13, 18, 22, 4, 9, 14, 19]], ["FSP", 6, 0, 1, 3], ["FSP", 6, 4, 2, 3], ["FSP", 6, 8, 3, 3], ["FSP", 6, 12, 4, 3], ["RE", 6, [0, 4, 8, 12, 1, 5, 9, 13, 2, 6, 10, 14, 3, 7, 11, 15]], ["CA", 2, 6, 11], ["CHR", 1, "shared", [2]], ["CA", 2, 3, 12], ["CHR", 0, "shared", [3]], ["CA", 1, 4, 12], ["FU", 8, [0, 1, 2, 3]], ["AN", 8, 0, 5], ["FU", 8, [1, 2, 3, 4]], ["AN", 8, 1, 4], ["FU", 8, [2, 3, 4, 5]], ["AN", 8, 2, 6], ["FU", 3, [0, 1]], ["SP", 3, 0, 64, [1], 1], ["AN", 3, 1, 2], ["FFSP", 3, 0, [4, 3, 2, 1], 1, 1], ["AN", 3, 1, 6], ["FU", 1, [0, 1, 2, 3]], ["SP", 1, 0, 224, [1], 1], ["AN", 1, 1, 2], ["FFSP", 1, 0, [4, 3, 2, 1], 1, 1], ["AN", 1, 1, 6], ["PR", 4, 0, "auto_unroll_max_step$16"]]]], "r": [[0.000136641, 0.000136655, 0.000136137], 0, 29.8593, 1661972460], "v": "v0.6"}
{"i": [["[\"pointwise_conv2d_bn\", 14, 14, 480, 112, 4]", "cuda -keys=cuda,gpu -max_num_threads=1024 -model=unknown -thread_warp_size=32", [-1, 16, 64, 49152, 2147483647, 1024, 8, 32], "", 0, []], [[], [["CI", 4], ["SP", 2, 0, 4, [1, 1, 2, 2], 1], ["SP", 2, 5, 14, [1, 2, 1, 1], 1], ["SP", 2, 10, 14, [1, 14, 1, 1], 1], ["SP", 2, 15, 112, [2, 4, 7, 1], 1], ["SP", 2, 20, 480, [5, 4], 1], ["RE", 2, [0, 5, 10, 15, 1, 6, 11, 16, 2, 7, 12, 17, 20, 21, 3, 8, 13, 18, 22, 4, 9, 14, 19]], ["FSP", 6, 0, 1, 3], ["FSP", 6, 4, 2, 3], ["FSP", 6, 8, 3, 3], ["FSP", 6, 12, 4, 3], ["RE", 6, [0, 4, 8, 12, 1, 5, 9, 13, 2, 6, 10, 14, 3, 7, 11, 15]], ["CA", 2, 6, 11], ["CHR", 1, "shared", [2]], ["CA", 2, 3, 12], ["CHR", 0, "shared", [3]], ["CA", 1, 4, 12], ["FU", 8, [0, 1, 2, 3]], ["AN", 8, 0, 5], ["FU", 8, [1, 2, 3, 4]], ["AN", 8, 1, 4], ["FU", 8, [2, 3, 4, 5]], ["AN", 8, 2, 6], ["FU", 3, [0, 1]], ["SP", 3, 0, 140, [1], 1], ["AN", 3, 1, 2], ["FFSP", 3, 0, [4, 3, 2, 1], 1, 1], ["AN", 3, 1, 6], ["FU", 1, [0, 1, 2, 3]], ["SP", 1, 0, 20, [1], 1], ["AN", 1, 1, 2], ["FFSP", 1, 0, [4, 3, 2, 1], 1, 1], ["AN", 1, 1, 6], ["PR", 4, 0, "auto_unroll_max_step$0"]]]], "r": [[0.00013127, 0.000131264, 0.000131247], 0, 30.7072, 1661972461], "v": "v0.6"}
{"i": [["[\"pointwise_conv2d_bn\", 14, 14, 480, 112, 4]", "cuda -keys=cuda,gpu -max_num_threads=1024 -model=unknown -thread_warp_size=32", [-1, 16, 64, 49152, 2147483647, 1024, 8, 32], "", 0, []], [[], [["CI", 4], ["SP", 2, 0, 4, [1, 2, 1, 1], 1], ["SP", 2, 5, 14, [1, 2, 1, 1], 1], ["SP", 2, 10, 14, [1, 7, 1, 2], 1], ["SP", 2, 15, 112, [2, 4, 7, 1], 1], ["SP", 2, 20, 480, [5, 4], 1], ["RE", 2, [0, 5, 10, 15, 1, 6, 11, 16, 2, 7, 12, 17, 20, 21, 3, 8, 13, 18, 22, 4, 9, 14, 19]], ["FSP", 6, 0, 1, 3], ["FSP", 6, 4, 2, 3], ["FSP", 6, 8, 3, 3], ["FSP", 6, 12, 4, 3], ["RE", 6, [0, 4, 8, 12, 1, 5, 9, 13, 2, 6, 10, 14, 3, 7, 11, 15]], ["CA", 2, 6, 11], ["CHR", 1, "shared", [2]], ["CA", 2, 3, 12], ["CHR", 0, "shared", [3]], ["CA", 1, 4, 12], ["FU", 8, [0, 1, 2, 3]], ["AN", 8, 0, 5], ["FU", 8, [1, 2, 3, 4]], ["AN", 8, 1, 4], ["FU", 8, [2, 3, 4, 5]], ["AN", 8, 2, 6], ["FU", 3, [0, 1]], ["SP", 3, 0, 140, [1], 1], ["AN", 3, 1, 2], ["FFSP", 3, 0, [4, 3, 2, 1], 1, 1], ["AN", 3, 1, 6], ["FU", 1, [0, 1, 2, 3]], ["SP", 1, 0, 20, [1], 1], ["AN", 1, 1, 2], ["FFSP", 1, 0, [4, 3, 2, 1], 1, 1], ["AN", 1, 1, 6], ["PR", 4, 0, "auto_unroll_max_step$0"]]]], "r": [[4.06467e-05, 4.06414e-05, 4.06368e-05], 0, 30.3906, 1661972461], "v": "v0.6"}
{"i": [["[\"pointwise_conv2d_bn\", 14, 14, 480, 112, 4]", "cuda -keys=cuda,gpu -max_num_threads=1024 -model=unknown -thread_warp_size=32", [-1, 16, 64, 49152, 2147483647, 1024, 8, 32], "", 0, []], [[], [["CI", 4], ["SP", 2, 0, 4, [1, 1, 1, 2], 1], ["SP", 2, 5, 14, [1, 1, 2, 1], 1], ["SP", 2, 10, 14, [2, 1, 1, 1], 1], ["SP", 2, 15, 112, [1, 56, 1, 2], 1], ["SP", 2, 20, 480, [1, 30], 1], ["RE", 2, [0, 5, 10, 15, 1, 6, 11, 16, 2, 7, 12, 17, 20, 21, 3, 8, 13, 18, 22, 4, 9, 14, 19]], ["FSP", 6, 0, 1, 3], ["FSP", 6, 4, 2, 3], ["FSP", 6, 8, 3, 3], ["FSP", 6, 12, 4, 3], ["RE", 6, [0, 4, 8, 12, 1, 5, 9, 13, 2, 6, 10, 14, 3, 7, 11, 15]], ["CA", 2, 6, 11], ["CHR", 1, "shared", [2]], ["CA", 2, 3, 12], ["CHR", 0, "shared", [3]], ["CA", 1, 4, 12], ["FU", 8, [0, 1, 2, 3]], ["AN", 8, 0, 5], ["FU", 8, [1, 2, 3, 4]], ["AN", 8, 1, 4], ["FU", 8, [2, 3, 4, 5]], ["AN", 8, 2, 6], ["FU", 3, [0, 1]], ["SP", 3, 0, 30, [1], 1], ["AN", 3, 1, 2], ["FFSP", 3, 0, [4, 3, 2, 1], 1, 1], ["AN", 3, 1, 6], ["FU", 1, [0, 1, 2, 3]], ["SP", 1, 0, 60, [1], 1], ["AN", 1, 1, 2], ["FFSP", 1, 0, [4, 3, 2, 1], 1, 1], ["AN", 1, 1, 6], ["PR", 4, 0, "auto_unroll_max_step$1024"]]]], "r": [[3.18556e-05, 3.18406e-05, 3.18404e-05], 0, 30.708, 1661972462], "v": "v0.6"}
{"i": [["[\"pointwise_conv2d_bn\", 14, 14, 480, 112, 4]", "cuda -keys=cuda,gpu -max_num_threads=1024 -model=unknown -thread_warp_size=32", [-1, 16, 64, 49152, 2147483647, 1024, 8, 32], "", 0, []], [[], [["CI", 4], ["SP", 2, 0, 4, [1, 4, 1, 1], 1], ["SP", 2, 5, 14, [1, 7, 2, 1], 1], ["SP", 2, 10, 14, [1, 2, 1, 1], 1], ["SP", 2, 15, 112, [1, 1, 56, 1], 1], ["SP", 2, 20, 480, [24, 2], 1], ["RE", 2, [0, 5, 10, 15, 1, 6, 11, 16, 2, 7, 12, 17, 20, 21, 3, 8, 13, 18, 22, 4, 9, 14, 19]], ["FSP", 6, 0, 1, 3], ["FSP", 6, 4, 2, 3], ["FSP", 6, 8, 3, 3], ["FSP", 6, 12, 4, 3], ["RE", 6, [0, 4, 8, 12, 1, 5, 9, 13, 2, 6, 10, 14, 3, 7, 11, 15]], ["CA", 2, 6, 11], ["CHR", 1, "shared", [2]], ["CA", 2, 3, 12], ["CHR", 0, "shared", [3]], ["CA", 1, 4, 12], ["FU", 8, [0, 1, 2, 3]], ["AN", 8, 0, 5], ["FU", 8, [1, 2, 3, 4]], ["AN", 8, 1, 4], ["FU", 8, [2, 3, 4, 5]], ["AN", 8, 2, 6], ["FU", 3, [0, 1]], ["SP", 3, 0, 2688, [1], 1], ["AN", 3, 1, 2], ["FFSP", 3, 0, [4, 3, 2, 1], 1, 1], ["AN", 3, 1, 6], ["FU", 1, [0, 1, 2, 3]], ["SP", 1, 0, 96, [1], 1], ["AN", 1, 1, 2], ["FFSP", 1, 0, [4, 3, 2, 1], 1, 1], ["AN", 1, 1, 6], ["PR", 4, 0, "auto_unroll_max_step$512"]]]], "r": [[0.000369039, 0.000368972, 0.000368875], 0, 31.1256, 1661972463], "v": "v0.6"}
{"i": [["[\"pointwise_conv2d_bn\", 14, 14, 480, 112, 4]", "cuda -keys=cuda,gpu -max_num_threads=1024 -model=unknown -thread_warp_size=32", [-1, 16, 64, 49152, 2147483647, 1024, 8, 32], "", 0, []], [[], [["CI", 4], ["SP", 2, 0, 4, [1, 2, 2, 1], 1], ["SP", 2, 5, 14, [1, 1, 1, 1], 1], ["SP", 2, 10, 14, [1, 1, 1, 7], 1], ["SP", 2, 15, 112, [2, 14, 4, 1], 1], ["SP", 2, 20, 480, [30, 1], 1], ["RE", 2, [0, 5, 10, 15, 1, 6, 11, 16, 2, 7, 12, 17, 20, 21, 3, 8, 13, 18, 22, 4, 9, 14, 19]], ["FSP", 6, 0, 1, 3], ["FSP", 6, 4, 2, 3], ["FSP", 6, 8, 3, 3], ["FSP", 6, 12, 4, 3], ["RE", 6, [0, 4, 8, 12, 1, 5, 9, 13, 2, 6, 10, 14, 3, 7, 11, 15]], ["CA", 2, 6, 11], ["CHR", 1, "shared", [2]], ["CA", 2, 3, 12], ["CHR", 0, "shared", [3]], ["CA", 1, 4, 12], ["FU", 8, [0, 1, 2, 3]], ["AN", 8, 0, 5], ["FU", 8, [1, 2, 3, 4]], ["AN", 8, 1, 4], ["FU", 8, [2, 3, 4, 5]], ["AN", 8, 2, 6], ["FU", 3, [0, 1]], ["SP", 3, 0, 120, [4], 1], ["AN", 3, 1, 2], ["FFSP", 3, 0, [4, 3, 2, 1], 1, 1], ["AN", 3, 1, 6], ["FU", 1, [0, 1, 2, 3]], ["SP", 1, 0, 420, [1], 1], ["AN", 1, 1, 2], ["FFSP", 1, 0, [4, 3, 2, 1], 1, 1], ["AN", 1, 1, 6], ["PR", 4, 0, "auto_unroll_max_step$16"]]]], "r": [[0.000216319, 0.000216317, 0.000216287], 0, 30.4882, 1661972464], "v": "v0.6"}
{"i": [["[\"pointwise_conv2d_bn\", 14, 14, 480, 112, 4]", "cuda -keys=cuda,gpu -max_num_threads=1024 -model=unknown -thread_warp_size=32", [-1, 16, 64, 49152, 2147483647, 1024, 8, 32], "", 0, []], [[], [["CI", 4], ["SP", 2, 0, 4, [1, 4, 1, 1], 1], ["SP", 2, 5, 14, [1, 7, 1, 1], 1], ["SP", 2, 10, 14, [1, 1, 1, 1], 1], ["SP", 2, 15, 112, [2, 2, 14, 1], 1], ["SP", 2, 20, 480, [4, 15], 1], ["RE", 2, [0, 5, 10, 15, 1, 6, 11, 16, 2, 7, 12, 17, 20, 21, 3, 8, 13, 18, 22, 4, 9, 14, 19]], ["FSP", 6, 0, 1, 3], ["FSP", 6, 4, 2, 3], ["FSP", 6, 8, 3, 3], ["FSP", 6, 12, 4, 3], ["RE", 6, [0, 4, 8, 12, 1, 5, 9, 13, 2, 6, 10, 14, 3, 7, 11, 15]], ["CA", 2, 6, 11], ["CHR", 1, "shared", [2]], ["CA", 2, 3, 12], ["CHR", 0, "shared", [3]], ["CA", 1, 4, 12], ["FU", 8, [0, 1, 2, 3]], ["AN", 8, 0, 5], ["FU", 8, [1, 2, 3, 4]], ["AN", 8, 1, 4], ["FU", 8, [2, 3, 4, 5]], ["AN", 8, 2, 6], ["FU", 3, [0, 1]], ["SP", 3, 0, 840, [1], 1], ["AN", 3, 1, 2], ["FFSP", 3, 0, [4, 3, 2, 1], 1, 1], ["AN", 3, 1, 6], ["FU", 1, [0, 1, 2, 3]], ["SP", 1, 0, 60, [1], 1], ["AN", 1, 1, 2], ["FFSP", 1, 0, [4, 3, 2, 1], 1, 1], ["AN", 1, 1, 6], ["PR", 4, 0, "auto_unroll_max_step$16"]]]], "r": [[8.59147e-05, 8.58859e-05, 8.59255e-05], 0, 30.4204, 1661972465], "v": "v0.6"}
{"i": [["[\"pointwise_conv2d_bn\", 14, 14, 480, 112, 4]", "cuda -keys=cuda,gpu -max_num_threads=1024 -model=unknown -thread_warp_size=32", [-1, 16, 64, 49152, 2147483647, 1024, 8, 32], "", 0, []], [[], [["CI", 4], ["SP", 2, 0, 4, [4, 1, 1, 1], 1], ["SP", 2, 5, 14, [1, 14, 1, 1], 1], ["SP", 2, 10, 14, [2, 1, 1, 7], 1], ["SP", 2, 15, 112, [1, 2, 2, 2], 1], ["SP", 2, 20, 480, [6, 1], 1], ["RE", 2, [0, 5, 10, 15, 1, 6, 11, 16, 2, 7, 12, 17, 20, 21, 3, 8, 13, 18, 22, 4, 9, 14, 19]], ["FSP", 6, 0, 1, 3], ["FSP", 6, 4, 2, 3], ["FSP", 6, 8, 3, 3], ["FSP", 6, 12, 4, 3], ["RE", 6, [0, 4, 8, 12, 1, 5, 9, 13, 2, 6, 10, 14, 3, 7, 11, 15]], ["CA", 2, 6, 11], ["CHR", 1, "shared", [2]], ["CA", 2, 3, 12], ["CHR", 0, "shared", [3]], ["CA", 1, 4, 12], ["FU", 8, [0, 1, 2, 3]], ["AN", 8, 0, 5], ["FU", 8, [1, 2, 3, 4]], ["AN", 8, 1, 4], ["FU", 8, [2, 3, 4, 5]], ["AN", 8, 2, 6], ["FU", 3, [0, 1]], ["SP", 3, 0, 24, [1], 1], ["AN", 3, 1, 2], ["FFSP", 3, 0, [4, 3, 2, 1], 1, 1], ["AN", 3, 1, 6], ["FU", 1, [0, 1, 2, 3]], ["SP", 1, 0, 24, [3], 1], ["AN", 1, 1, 2], ["FFSP", 1, 0, [4, 3, 2, 1], 1, 1], ["AN", 1, 1, 6], ["PR", 4, 0, "auto_unroll_max_step$0"]]]], "r": [[0.000577746, 0.000577975, 0.000577917], 0, 30.7018, 1661972465], "v": "v0.6"}
{"i": [["[\"pointwise_conv2d_bn\", 14, 14, 480, 112, 4]", "cuda -keys=cuda,gpu -max_num_threads=1024 -model=unknown -thread_warp_size=32", [-1, 16, 64, 49152, 2147483647, 1024, 8, 32], "", 0, []], [[], [["CI", 4], ["SP", 2, 0, 4, [1, 1, 1, 2], 1], ["SP", 2, 5, 14, [1, 7, 2, 1], 1], ["SP", 2, 10, 14, [7, 1, 2, 1], 1], ["SP", 2, 15, 112, [1, 7, 1, 1], 1], ["SP", 2, 20, 480, [1, 2], 1], ["RE", 2, [0, 5, 10, 15, 1, 6, 11, 16, 2, 7, 12, 17, 20, 21, 3, 8, 13, 18, 22, 4, 9, 14, 19]], ["FSP", 6, 0, 1, 3], ["FSP", 6, 4, 2, 3], ["FSP", 6, 8, 3, 3], ["FSP", 6, 12, 4, 3], ["RE", 6, [0, 4, 8, 12, 1, 5, 9, 13, 2, 6, 10, 14, 3, 7, 11, 15]], ["CA", 2, 6, 11], ["CHR", 1, "shared", [2]], ["CA", 2, 3, 12], ["CHR", 0, "shared", [3]], ["CA", 1, 4, 12], ["FU", 8, [0, 1, 2, 3]], ["AN", 8, 0, 5], ["FU", 8, [1, 2, 3, 4]], ["AN", 8, 1, 4], ["FU", 8, [2, 3, 4, 5]], ["AN", 8, 2, 6], ["FU", 3, [0, 1]], ["SP", 3, 0, 2, [1], 1], ["AN", 3, 1, 2], ["FFSP", 3, 0, [4, 3, 2, 1], 1, 1], ["AN", 3, 1, 6], ["FU", 1, [0, 1, 2, 3]], ["SP", 1, 0, 16, [1], 1], ["AN", 1, 1, 2], ["FFSP", 1, 0, [4, 3, 2, 1], 1, 1], ["AN", 1, 1, 6], ["PR", 4, 0, "auto_unroll_max_step$64"]]]], "r": [[0.000253119, 0.000252988, 0.000252996], 0, 30.2543, 1661972466], "v": "v0.6"}
{"i": [["[\"pointwise_conv2d_bn\", 14, 14, 480, 112, 4]", "cuda -keys=cuda,gpu -max_num_threads=1024 -model=unknown -thread_warp_size=32", [-1, 16, 64, 49152, 2147483647, 1024, 8, 32], "", 0, []], [[], [["CI", 4], ["SP", 2, 0, 4, [1, 2, 1, 2], 1], ["SP", 2, 5, 14, [1, 7, 1, 1], 1], ["SP", 2, 10, 14, [1, 1, 2, 1], 1], ["SP", 2, 15, 112, [1, 7, 1, 8], 1], ["SP", 2, 20, 480, [1, 5], 1], ["RE", 2, [0, 5, 10, 15, 1, 6, 11, 16, 2, 7, 12, 17, 20, 21, 3, 8, 13, 18, 22, 4, 9, 14, 19]], ["FSP", 6, 0, 1, 3], ["FSP", 6, 4, 2, 3], ["FSP", 6, 8, 3, 3], ["FSP", 6, 12, 4, 3], ["RE", 6, [0, 4, 8, 12, 1, 5, 9, 13, 2, 6, 10, 14, 3, 7, 11, 15]], ["CA", 2, 6, 11], ["CHR", 1, "shared", [2]], ["CA", 2, 3, 12], ["CHR", 0, "shared", [3]], ["CA", 1, 4, 12], ["FU", 8, [0, 1, 2, 3]], ["AN", 8, 0, 5], ["FU", 8, [1, 2, 3, 4]], ["AN", 8, 1, 4], ["FU", 8, [2, 3, 4, 5]], ["AN", 8, 2, 6], ["FU", 3, [0, 1]], ["SP", 3, 0, 240, [1], 1], ["AN", 3, 1, 2], ["FFSP", 3, 0, [4, 3, 2, 1], 1, 1], ["AN", 3, 1, 6], ["FU", 1, [0, 1, 2, 3]], ["SP", 1, 0, 120, [1], 1], ["AN", 1, 1, 2], ["FFSP", 1, 0, [4, 3, 2, 1], 1, 1], ["AN", 1, 1, 6], ["PR", 4, 0, "auto_unroll_max_step$0"]]]], "r": [[6.26587e-05, 6.26551e-05, 6.26615e-05], 0, 29.9192, 1661972466], "v": "v0.6"}
{"i": [["[\"pointwise_conv2d_bn\", 14, 14, 480, 112, 4]", "cuda -keys=cuda,gpu -max_num_threads=1024 -model=unknown -thread_warp_size=32", [-1, 16, 64, 49152, 2147483647, 1024, 8, 32], "", 0, []], [[], [["CI", 4], ["SP", 2, 0, 4, [4, 1, 1, 1], 1], ["SP", 2, 5, 14, [1, 1, 2, 1], 1], ["SP", 2, 10, 14, [2, 1, 1, 1], 1], ["SP", 2, 15, 112, [1, 7, 2, 2], 1], ["SP", 2, 20, 480, [10, 6], 1], ["RE", 2, [0, 5, 10, 15, 1, 6, 11, 16, 2, 7, 12, 17, 20, 21, 3, 8, 13, 18, 22, 4, 9, 14, 19]], ["FSP", 6, 0, 1, 3], ["FSP", 6, 4, 2, 3], ["FSP", 6, 8, 3, 3], ["FSP", 6, 12, 4, 3], ["RE", 6, [0, 4, 8, 12, 1, 5, 9, 13, 2, 6, 10, 14, 3, 7, 11, 15]], ["CA", 2, 6, 11], ["CHR", 1, "shared", [2]], ["CA", 2, 3, 12], ["CHR", 0, "shared", [3]], ["CA", 1, 4, 12], ["FU", 8, [0, 1, 2, 3]], ["AN", 8, 0, 5], ["FU", 8, [1, 2, 3, 4]], ["AN", 8, 1, 4], ["FU", 8, [2, 3, 4, 5]], ["AN", 8, 2, 6], ["FU", 3, [0, 1]], ["SP", 3, 0, 240, [1], 1], ["AN", 3, 1, 2], ["FFSP", 3, 0, [4, 3, 2, 1], 1, 1], ["AN", 3, 1, 6], ["FU", 1, [0, 1, 2, 3]], ["SP", 1, 0, 240, [15], 1], ["AN", 1, 1, 2], ["FFSP", 1, 0, [4, 3, 2, 1], 1, 1], ["AN", 1, 1, 6], ["PR", 4, 0, "auto_unroll_max_step$512"]]]], "r": [[0.000736501, 0.000630609, 0.000652085], 0, 35.8378, 1661972471], "v": "v0.6"}
{"i": [["[\"pointwise_conv2d_bn\", 14, 14, 480, 112, 4]", "cuda -keys=cuda,gpu -max_num_threads=1024 -model=unknown -thread_warp_size=32", [-1, 16, 64, 49152, 2147483647, 1024, 8, 32], "", 0, []], [[], [["CI", 4], ["SP", 2, 0, 4, [1, 2, 1, 1], 1], ["SP", 2, 5, 14, [1, 2, 1, 7], 1], ["SP", 2, 10, 14, [7, 2, 1, 1], 1], ["SP", 2, 15, 112, [1, 14, 1, 4], 1], ["SP", 2, 20, 480, [10, 2], 1], ["RE", 2, [0, 5, 10, 15, 1, 6, 11, 16, 2, 7, 12, 17, 20, 21, 3, 8, 13, 18, 22, 4, 9, 14, 19]], ["FSP", 6, 0, 1, 3], ["FSP", 6, 4, 2, 3], ["FSP", 6, 8, 3, 3], ["FSP", 6, 12, 4, 3], ["RE", 6, [0, 4, 8, 12, 1, 5, 9, 13, 2, 6, 10, 14, 3, 7, 11, 15]], ["CA", 2, 6, 11], ["CHR", 1, "shared", [2]], ["CA", 2, 3, 12], ["CHR", 0, "shared", [3]], ["CA", 1, 4, 12], ["FU", 8, [0, 1, 2, 3]], ["AN", 8, 0, 5], ["FU", 8, [1, 2, 3, 4]], ["AN", 8, 1, 4], ["FU", 8, [2, 3, 4, 5]], ["AN", 8, 2, 6], ["FU", 3, [0, 1]], ["SP", 3, 0, 80, [2], 1], ["AN", 3, 1, 2], ["FFSP", 3, 0, [4, 3, 2, 1], 1, 1], ["AN", 3, 1, 6], ["FU", 1, [0, 1, 2, 3]], ["SP", 1, 0, 280, [4], 1], ["AN", 1, 1, 2], ["FFSP", 1, 0, [4, 3, 2, 1], 1, 1], ["AN", 1, 1, 6], ["PR", 4, 0, "auto_unroll_max_step$512"]]]], "r": [[0.000815651, 0.000816572, 0.000816108], 0, 35.1975, 1661972472], "v": "v0.6"}
