python/models/efficientnet/kernel_configs/efficient_reudce_mean_14_14_240.log
{"i": [["[\"reduce_mean\", 14, 14, 240]", "cuda -keys=cuda,gpu -arch=sm_80 -max_num_threads=1024 -model=unknown -thread_warp_size=32", [-1, 16, 64, 49152, 2147483647, 1024, 8, 32], "", 0, []], [[], [["FU", 2, [0, 1]], ["SP", 2, 0, 240, [2], 1], ["AN", 2, 0, 5], ["AN", 2, 1, 6], ["FU", 1, [0, 1]], ["SP", 1, 0, 240, [60], 1], ["AN", 1, 0, 5], ["AN", 1, 1, 6], ["PR", 1, 0, "auto_unroll_max_step$512"]]]], "r": [[8.04269e-06, 8.06324e-06, 8.06385e-06], 0, 3.7893, 1681114914], "v": "v0.6"}
{"i": [["[\"reduce_mean\", 14, 14, 240]", "cuda -keys=cuda,gpu -arch=sm_80 -max_num_threads=1024 -model=unknown -thread_warp_size=32", [-1, 16, 64, 49152, 2147483647, 1024, 8, 32], "", 0, []], [[], [["FU", 2, [0, 1]], ["SP", 2, 0, 240, [1], 1], ["AN", 2, 0, 5], ["AN", 2, 1, 6], ["FU", 1, [0, 1]], ["SP", 1, 0, 240, [8], 1], ["AN", 1, 0, 5], ["AN", 1, 1, 6], ["PR", 1, 0, "auto_unroll_max_step$16"]]]], "r": [[7.4914e-06, 7.50772e-06, 7.50772e-06], 0, 1.4649, 1681114912], "v": "v0.6"}
{"i": [["[\"reduce_mean\", 14, 14, 240]", "cuda -keys=cuda,gpu -arch=sm_80 -max_num_threads=1024 -model=unknown -thread_warp_size=32", [-1, 16, 64, 49152, 2147483647, 1024, 8, 32], "", 0, []], [[], [["FU", 2, [0, 1]], ["SP", 2, 0, 240, [32], 1], ["AN", 2, 0, 5], ["AN", 2, 1, 6], ["FU", 1, [0, 1]], ["SP", 1, 0, 240, [32], 1], ["AN", 1, 0, 5], ["AN", 1, 1, 6], ["PR", 1, 0, "auto_unroll_max_step$64"]]]], "r": [[9.03911e-06, 9.0633e-06, 9.06192e-06], 0, 4.41336, 1681114915], "v": "v0.6"}
{"i": [["[\"reduce_mean\", 14, 14, 240]", "cuda -keys=cuda,gpu -arch=sm_80 -max_num_threads=1024 -model=unknown -thread_warp_size=32", [-1, 16, 64, 49152, 2147483647, 1024, 8, 32], "", 0, []], [[], [["FU", 2, [0, 1]], ["SP", 2, 0, 240, [16], 1], ["AN", 2, 0, 5], ["AN", 2, 1, 6], ["FU", 1, [0, 1]], ["SP", 1, 0, 240, [32], 1], ["AN", 1, 0, 5], ["AN", 1, 1, 6], ["PR", 1, 0, "auto_unroll_max_step$512"]]]], "r": [[8.68325e-06, 8.70601e-06, 8.70668e-06], 0, 5.0978, 1681114916], "v": "v0.6"}
{"i": [["[\"reduce_mean\", 14, 14, 240]", "cuda -keys=cuda,gpu -arch=sm_80 -max_num_threads=1024 -model=unknown -thread_warp_size=32", [-1, 16, 64, 49152, 2147483647, 1024, 8, 32], "", 0, []], [[], [["FU", 2, [0, 1]], ["SP", 2, 0, 240, [2], 1], ["AN", 2, 0, 5], ["AN", 2, 1, 6], ["FU", 1, [0, 1]], ["SP", 1, 0, 240, [16], 1], ["AN", 1, 0, 5], ["AN", 1, 1, 6], ["PR", 1, 0, "auto_unroll_max_step$512"]]]], "r": [[7.24726e-06, 7.24493e-06, 7.24901e-06], 0, 2.65294, 1681114913], "v": "v0.6"}
{"i": [["[\"reduce_mean\", 14, 14, 240]", "cuda -keys=cuda,gpu -arch=sm_80 -max_num_threads=1024 -model=unknown -thread_warp_size=32", [-1, 16, 64, 49152, 2147483647, 1024, 8, 32], "", 0, []], [[], [["FU", 2, [0, 1]], ["SP", 2, 0, 240, [16], 1], ["AN", 2, 0, 5], ["AN", 2, 1, 6], ["FU", 1, [0, 1]], ["SP", 1, 0, 240, [8], 1], ["AN", 1, 0, 5], ["AN", 1, 1, 6], ["PR", 1, 0, "auto_unroll_max_step$0"]]]], "r": [[7.59928e-06, 7.62376e-06, 7.62201e-06], 0, 2.51503, 1681114913], "v": "v0.6"}
{"i": [["[\"reduce_mean\", 14, 14, 240]", "cuda -keys=cuda,gpu -arch=sm_80 -max_num_threads=1024 -model=unknown -thread_warp_size=32", [-1, 16, 64, 49152, 2147483647, 1024, 8, 32], "", 0, []], [[], [["FU", 2, [0, 1]], ["SP", 2, 0, 240, [32], 1], ["AN", 2, 0, 5], ["AN", 2, 1, 6], ["FU", 1, [0, 1]], ["SP", 1, 0, 240, [4], 1], ["AN", 1, 0, 5], ["AN", 1, 1, 6], ["PR", 1, 0, "auto_unroll_max_step$64"]]]], "r": [[7.59753e-06, 7.61735e-06, 7.61968e-06], 0, 4.72263, 1681114915], "v": "v0.6"}
{"i": [["[\"reduce_mean\", 14, 14, 240]", "cuda -keys=cuda,gpu -arch=sm_80 -max_num_threads=1024 -model=unknown -thread_warp_size=32", [-1, 16, 64, 49152, 2147483647, 1024, 8, 32], "", 0, []], [[], [["FU", 2, [0, 1]], ["SP", 2, 0, 240, [8], 1], ["AN", 2, 0, 5], ["AN", 2, 1, 6], ["FU", 1, [0, 1]], ["SP", 1, 0, 240, [4], 1], ["AN", 1, 0, 5], ["AN", 1, 1, 6], ["PR", 1, 0, "auto_unroll_max_step$1024"]]]], "r": [[7.55615e-06, 7.57655e-06, 7.57422e-06], 0, 2.12373, 1681114912], "v": "v0.6"}
{"i": [["[\"reduce_mean\", 14, 14, 240]", "cuda -keys=cuda,gpu -arch=sm_80 -max_num_threads=1024 -model=unknown -thread_warp_size=32", [-1, 16, 64, 49152, 2147483647, 1024, 8, 32], "", 0, []], [[], [["FU", 2, [0, 1]], ["SP", 2, 0, 240, [8], 1], ["AN", 2, 0, 5], ["AN", 2, 1, 6], ["FU", 1, [0, 1]], ["SP", 1, 0, 240, [32], 1], ["AN", 1, 0, 5], ["AN", 1, 1, 6], ["PR", 1, 0, "auto_unroll_max_step$0"]]]], "r": [[8.76624e-06, 8.79301e-06, 8.79168e-06], 0, 8.94022, 1681114919], "v": "v0.6"}
{"i": [["[\"reduce_mean\", 14, 14, 240]", "cuda -keys=cuda,gpu -arch=sm_80 -max_num_threads=1024 -model=unknown -thread_warp_size=32", [-1, 16, 64, 49152, 2147483647, 1024, 8, 32], "", 0, []], [[], [["FU", 2, [0, 1]], ["SP", 2, 0, 240, [16], 1], ["AN", 2, 0, 5], ["AN", 2, 1, 6], ["FU", 1, [0, 1]], ["SP", 1, 0, 240, [1], 1], ["AN", 1, 0, 5], ["AN", 1, 1, 6], ["PR", 1, 0, "auto_unroll_max_step$0"]]]], "r": [[8.74483e-06, 8.74353e-06, 8.74677e-06], 0, 5.97886, 1681114916], "v": "v0.6"}
{"i": [["[\"reduce_mean\", 14, 14, 240]", "cuda -keys=cuda,gpu -arch=sm_80 -max_num_threads=1024 -model=unknown -thread_warp_size=32", [-1, 16, 64, 49152, 2147483647, 1024, 8, 32], "", 0, []], [[], [["FU", 1, [2, 3]], ["SP", 2, 1, 240, [48], 1], ["AN", 2, 2, 6], ["FSP", 1, 2, 1, 1], ["AN", 1, 3, 6], ["CA", 1, 2, 1], ["FU", 2, [0, 1]], ["AN", 2, 0, 5], ["PR", 1, 0, "auto_unroll_max_step$16"]]]], "r": [[2.01934e-05, 2.02103e-05, 2.01949e-05], 0, 7.16102, 1681114918], "v": "v0.6"}
{"i": [["[\"reduce_mean\", 14, 14, 240]", "cuda -keys=cuda,gpu -arch=sm_80 -max_num_threads=1024 -model=unknown -thread_warp_size=32", [-1, 16, 64, 49152, 2147483647, 1024, 8, 32], "", 0, []], [[], [["FU", 2, [0, 1]], ["SP", 2, 0, 240, [32], 1], ["AN", 2, 0, 5], ["AN", 2, 1, 6], ["FU", 1, [0, 1]], ["SP", 1, 0, 240, [3], 1], ["AN", 1, 0, 5], ["AN", 1, 1, 6], ["PR", 1, 0, "auto_unroll_max_step$64"]]]], "r": [[7.76463e-06, 7.78639e-06, 7.78518e-06], 0, 7.37456, 1681114918], "v": "v0.6"}
{"i": [["[\"reduce_mean\", 14, 14, 240]", "cuda -keys=cuda,gpu -arch=sm_80 -max_num_threads=1024 -model=unknown -thread_warp_size=32", [-1, 16, 64, 49152, 2147483647, 1024, 8, 32], "", 0, []], [[], [["FU", 2, [0, 1]], ["SP", 2, 0, 240, [32], 1], ["AN", 2, 0, 5], ["AN", 2, 1, 6], ["FU", 1, [0, 1]], ["SP", 1, 0, 240, [20], 1], ["AN", 1, 0, 5], ["AN", 1, 1, 6], ["PR", 1, 0, "auto_unroll_max_step$1024"]]]], "r": [[7.37723e-06, 7.39646e-06, 7.3953e-06], 0, 9.7107, 1681114920], "v": "v0.6"}
{"i": [["[\"reduce_mean\", 14, 14, 240]", "cuda -keys=cuda,gpu -arch=sm_80 -max_num_threads=1024 -model=unknown -thread_warp_size=32", [-1, 16, 64, 49152, 2147483647, 1024, 8, 32], "", 0, []], [[], [["FU", 2, [0, 1]], ["SP", 2, 0, 240, [8], 1], ["AN", 2, 0, 5], ["AN", 2, 1, 6], ["FU", 1, [0, 1]], ["SP", 1, 0, 240, [8], 1], ["AN", 1, 0, 5], ["AN", 1, 1, 6], ["PR", 1, 0, "auto_unroll_max_step$16"]]]], "r": [[7.49321e-06, 7.52177e-06, 7.5206e-06], 0, 7.23915, 1681114917], "v": "v0.6"}
{"i": [["[\"reduce_mean\", 14, 14, 240]", "cuda -keys=cuda,gpu -arch=sm_80 -max_num_threads=1024 -model=unknown -thread_warp_size=32", [-1, 16, 64, 49152, 2147483647, 1024, 8, 32], "", 0, []], [[], [["FU", 2, [0, 1]], ["SP", 2, 0, 240, [1], 1], ["AN", 2, 0, 5], ["AN", 2, 1, 6], ["FU", 1, [0, 1]], ["SP", 1, 0, 240, [16], 1], ["AN", 1, 0, 5], ["AN", 1, 1, 6], ["PR", 1, 0, "auto_unroll_max_step$512"]]]], "r": [[7.75839e-06, 7.77937e-06, 7.77704e-06], 0, 7.98697, 1681114918], "v": "v0.6"}
{"i": [["[\"reduce_mean\", 14, 14, 240]", "cuda -keys=cuda,gpu -arch=sm_80 -max_num_threads=1024 -model=unknown -thread_warp_size=32", [-1, 16, 64, 49152, 2147483647, 1024, 8, 32], "", 0, []], [[], [["FU", 2, [0, 1]], ["SP", 2, 0, 240, [32], 1], ["AN", 2, 0, 5], ["AN", 2, 1, 6], ["FU", 1, [0, 1]], ["SP", 1, 0, 240, [16], 1], ["AN", 1, 0, 5], ["AN", 1, 1, 6], ["PR", 1, 0, "auto_unroll_max_step$16"]]]], "r": [[7.22249e-06, 7.29944e-06, 7.29551e-06], 0, 3.70406, 1681114914], "v": "v0.6"}
{"i": [["[\"reduce_mean\", 14, 14, 240]", "cuda -keys=cuda,gpu -arch=sm_80 -max_num_threads=1024 -model=unknown -thread_warp_size=32", [-1, 16, 64, 49152, 2147483647, 1024, 8, 32], "", 0, []], [[], [["FU", 1, [2, 3]], ["SP", 2, 1, 240, [12], 1], ["AN", 2, 2, 6], ["FSP", 1, 2, 1, 1], ["AN", 1, 3, 6], ["CA", 1, 2, 1], ["FU", 2, [0, 1]], ["AN", 2, 0, 5], ["PR", 1, 0, "auto_unroll_max_step$64"]]]], "r": [[6.70083e-06, 6.70731e-06, 6.70083e-06], 0, 10.7123, 1681114921], "v": "v0.6"}
{"i": [["[\"reduce_mean\", 14, 14, 240]", "cuda -keys=cuda,gpu -arch=sm_80 -max_num_threads=1024 -model=unknown -thread_warp_size=32", [-1, 16, 64, 49152, 2147483647, 1024, 8, 32], "", 0, []], [[], [["FU", 1, [2, 3]], ["SP", 2, 1, 240, [24], 1], ["AN", 2, 2, 6], ["FSP", 1, 2, 1, 1], ["AN", 1, 3, 6], ["CA", 1, 2, 1], ["FU", 2, [0, 1]], ["AN", 2, 0, 5], ["PR", 1, 0, "auto_unroll_max_step$16"]]]], "r": [[8.54262e-06, 8.55494e-06, 8.55558e-06], 0, 10.1854, 1681114921], "v": "v0.6"}
{"i": [["[\"reduce_mean\", 14, 14, 240]", "cuda -keys=cuda,gpu -arch=sm_80 -max_num_threads=1024 -model=unknown -thread_warp_size=32", [-1, 16, 64, 49152, 2147483647, 1024, 8, 32], "", 0, []], [[], [["FU", 2, [0, 1]], ["SP", 2, 0, 240, [32], 1], ["AN", 2, 0, 5], ["AN", 2, 1, 6], ["FU", 1, [0, 1]], ["SP", 1, 0, 240, [1], 1], ["AN", 1, 0, 5], ["AN", 1, 1, 6], ["PR", 1, 0, "auto_unroll_max_step$0"]]]], "r": [[8.88738e-06, 8.90679e-06, 8.90947e-06], 0, 11.3083, 1681114922], "v": "v0.6"}
{"i": [["[\"reduce_mean\", 14, 14, 240]", "cuda -keys=cuda,gpu -arch=sm_80 -max_num_threads=1024 -model=unknown -thread_warp_size=32", [-1, 16, 64, 49152, 2147483647, 1024, 8, 32], "", 0, []], [[], [["FU", 2, [0, 1]], ["SP", 2, 0, 240, [40], 1], ["AN", 2, 0, 5], ["AN", 2, 1, 6], ["FU", 1, [0, 1]], ["SP", 1, 0, 240, [32], 1], ["AN", 1, 0, 5], ["AN", 1, 1, 6], ["PR", 1, 0, "auto_unroll_max_step$512"]]]], "r": [[8.78415e-06, 8.86361e-06, 8.88227e-06], 0, 12.4822, 1681114923], "v": "v0.6"}
{"i": [["[\"reduce_mean\", 14, 14, 240]", "cuda -keys=cuda,gpu -arch=sm_80 -max_num_threads=1024 -model=unknown -thread_warp_size=32", [-1, 16, 64, 49152, 2147483647, 1024, 8, 32], "", 0, []], [[], [["FU", 2, [0, 1]], ["SP", 2, 0, 240, [32], 1], ["AN", 2, 0, 5], ["AN", 2, 1, 6], ["FU", 1, [0, 1]], ["SP", 1, 0, 240, [8], 1], ["AN", 1, 0, 5], ["AN", 1, 1, 6], ["PR", 1, 0, "auto_unroll_max_step$0"]]]], "r": [[7.44076e-06, 7.46057e-06, 7.45824e-06], 0, 4.97841, 1681114915], "v": "v0.6"}
{"i": [["[\"reduce_mean\", 14, 14, 240]", "cuda -keys=cuda,gpu -arch=sm_80 -max_num_threads=1024 -model=unknown -thread_warp_size=32", [-1, 16, 64, 49152, 2147483647, 1024, 8, 32], "", 0, []], [[], [["FU", 2, [0, 1]], ["SP", 2, 0, 240, [12], 1], ["AN", 2, 0, 5], ["AN", 2, 1, 6], ["FU", 1, [0, 1]], ["SP", 1, 0, 240, [32], 1], ["AN", 1, 0, 5], ["AN", 1, 1, 6], ["PR", 1, 0, "auto_unroll_max_step$512"]]]], "r": [[8.98107e-06, 9.0094e-06, 9.00664e-06], 0, 11.0277, 1681114921], "v": "v0.6"}
{"i": [["[\"reduce_mean\", 14, 14, 240]", "cuda -keys=cuda,gpu -arch=sm_80 -max_num_threads=1024 -model=unknown -thread_warp_size=32", [-1, 16, 64, 49152, 2147483647, 1024, 8, 32], "", 0, []], [[], [["FU", 2, [0, 1]], ["SP", 2, 0, 240, [48], 1], ["AN", 2, 0, 5], ["AN", 2, 1, 6], ["FU", 1, [0, 1]], ["SP", 1, 0, 240, [8], 1], ["AN", 1, 0, 5], ["AN", 1, 1, 6], ["PR", 1, 0, "auto_unroll_max_step$512"]]]], "r": [[7.54943e-06, 7.58389e-06, 7.58026e-06], 0, 11.9629, 1681114923], "v": "v0.6"}
{"i": [["[\"reduce_mean\", 14, 14, 240]", "cuda -keys=cuda,gpu -arch=sm_80 -max_num_threads=1024 -model=unknown -thread_warp_size=32", [-1, 16, 64, 49152, 2147483647, 1024, 8, 32], "", 0, []], [[], [["FU", 2, [0, 1]], ["SP", 2, 0, 240, [4], 1], ["AN", 2, 0, 5], ["AN", 2, 1, 6], ["FU", 1, [0, 1]], ["SP", 1, 0, 240, [16], 1], ["AN", 1, 0, 5], ["AN", 1, 1, 6], ["PR", 1, 0, "auto_unroll_max_step$16"]]]], "r": [[7.12756e-06, 7.14665e-06, 7.14553e-06], 0, 9.75931, 1681114920], "v": "v0.6"}
{"i": [["[\"reduce_mean\", 14, 14, 240]", "cuda -keys=cuda,gpu -arch=sm_80 -max_num_threads=1024 -model=unknown -thread_warp_size=32", [-1, 16, 64, 49152, 2147483647, 1024, 8, 32], "", 0, []], [[], [["FU", 2, [0, 1]], ["SP", 2, 0, 240, [4], 1], ["AN", 2, 0, 5], ["AN", 2, 1, 6], ["FU", 1, [0, 1]], ["SP", 1, 0, 240, [48], 1], ["AN", 1, 0, 5], ["AN", 1, 1, 6], ["PR", 1, 0, "auto_unroll_max_step$0"]]]], "r": [[7.94295e-06, 7.96411e-06, 7.96229e-06], 0, 5.69937, 1681114916], "v": "v0.6"}
{"i": [["[\"reduce_mean\", 14, 14, 240]", "cuda -keys=cuda,gpu -arch=sm_80 -max_num_threads=1024 -model=unknown -thread_warp_size=32", [-1, 16, 64, 49152, 2147483647, 1024, 8, 32], "", 0, []], [[], [["FU", 2, [0, 1]], ["SP", 2, 0, 240, [48], 1], ["AN", 2, 0, 5], ["AN", 2, 1, 6], ["FU", 1, [0, 1]], ["SP", 1, 0, 240, [16], 1], ["AN", 1, 0, 5], ["AN", 1, 1, 6], ["PR", 1, 0, "auto_unroll_max_step$512"]]]], "r": [[7.09273e-06, 7.1489e-06, 7.13093e-06], 0, 12.6624, 1681114923], "v": "v0.6"}
{"i": [["[\"reduce_mean\", 14, 14, 240]", "cuda -keys=cuda,gpu -arch=sm_80 -max_num_threads=1024 -model=unknown -thread_warp_size=32", [-1, 16, 64, 49152, 2147483647, 1024, 8, 32], "", 0, []], [[], [["FU", 2, [0, 1]], ["SP", 2, 0, 240, [32], 1], ["AN", 2, 0, 5], ["AN", 2, 1, 6], ["FU", 1, [0, 1]], ["SP", 1, 0, 240, [8], 1], ["AN", 1, 0, 5], ["AN", 1, 1, 6], ["PR", 1, 0, "auto_unroll_max_step$64"]]]], "r": [[7.47398e-06, 7.53226e-06, 7.53109e-06], 0, 6.42504, 1681114917], "v": "v0.6"}
{"i": [["[\"reduce_mean\", 14, 14, 240]", "cuda -keys=cuda,gpu -arch=sm_80 -max_num_threads=1024 -model=unknown -thread_warp_size=32", [-1, 16, 64, 49152, 2147483647, 1024, 8, 32], "", 0, []], [[], [["FU", 2, [0, 1]], ["SP", 2, 0, 240, [20], 1], ["AN", 2, 0, 5], ["AN", 2, 1, 6], ["FU", 1, [0, 1]], ["SP", 1, 0, 240, [40], 1], ["AN", 1, 0, 5], ["AN", 1, 1, 6], ["PR", 1, 0, "auto_unroll_max_step$0"]]]], "r": [[8.11246e-06, 8.14565e-06, 8.1419e-06], 0, 13.6108, 1681114924], "v": "v0.6"}
{"i": [["[\"reduce_mean\", 14, 14, 240]", "cuda -keys=cuda,gpu -arch=sm_80 -max_num_threads=1024 -model=unknown -thread_warp_size=32", [-1, 16, 64, 49152, 2147483647, 1024, 8, 32], "", 0, []], [[], [["FU", 2, [0, 1]], ["SP", 2, 0, 240, [4], 1], ["AN", 2, 0, 5], ["AN", 2, 1, 6], ["FU", 1, [0, 1]], ["SP", 1, 0, 240, [32], 1], ["AN", 1, 0, 5], ["AN", 1, 1, 6], ["PR", 1, 0, "auto_unroll_max_step$1024"]]]], "r": [[8.83038e-06, 8.84205e-06, 8.84334e-06], 0, 14.7183, 1681114926], "v": "v0.6"}
{"i": [["[\"reduce_mean\", 14, 14, 240]", "cuda -keys=cuda,gpu -arch=sm_80 -max_num_threads=1024 -model=unknown -thread_warp_size=32", [-1, 16, 64, 49152, 2147483647, 1024, 8, 32], "", 0, []], [[], [["FU", 2, [0, 1]], ["SP", 2, 0, 240, [20], 1], ["AN", 2, 0, 5], ["AN", 2, 1, 6], ["FU", 1, [0, 1]], ["SP", 1, 0, 240, [3], 1], ["AN", 1, 0, 5], ["AN", 1, 1, 6], ["PR", 1, 0, "auto_unroll_max_step$16"]]]], "r": [[7.47223e-06, 7.49496e-06, 7.49088e-06], 0, 8.66671, 1681114919], "v": "v0.6"}
{"i": [["[\"reduce_mean\", 14, 14, 240]", "cuda -keys=cuda,gpu -arch=sm_80 -max_num_threads=1024 -model=unknown -thread_warp_size=32", [-1, 16, 64, 49152, 2147483647, 1024, 8, 32], "", 0, []], [[], [["FU", 2, [0, 1]], ["SP", 2, 0, 240, [8], 1], ["AN", 2, 0, 5], ["AN", 2, 1, 6], ["FU", 1, [0, 1]], ["SP", 1, 0, 240, [1], 1], ["AN", 1, 0, 5], ["AN", 1, 1, 6], ["PR", 1, 0, "auto_unroll_max_step$16"]]]], "r": [[8.61231e-06, 8.63506e-06, 8.63439e-06], 0, 8.30787, 1681114919], "v": "v0.6"}
{"i": [["[\"reduce_mean\", 14, 14, 240]", "cuda -keys=cuda,gpu -arch=sm_80 -max_num_threads=1024 -model=unknown -thread_warp_size=32", [-1, 16, 64, 49152, 2147483647, 1024, 8, 32], "", 0, []], [[], [["FU", 1, [2, 3]], ["SP", 2, 1, 240, [1], 1], ["AN", 2, 2, 6], ["FSP", 1, 2, 1, 1], ["AN", 1, 3, 6], ["CA", 1, 2, 1], ["FU", 2, [0, 1]], ["AN", 2, 0, 5], ["PR", 1, 0, "auto_unroll_max_step$512"]]]], "r": [[5.13167e-06, 5.1442e-06, 5.13728e-06], 0, 14.2968, 1681114924], "v": "v0.6"}
{"i": [["[\"reduce_mean\", 14, 14, 240]", "cuda -keys=cuda,gpu -arch=sm_80 -max_num_threads=1024 -model=unknown -thread_warp_size=32", [-1, 16, 64, 49152, 2147483647, 1024, 8, 32], "", 0, []], [[], [["FU", 1, [2, 3]], ["SP", 2, 1, 240, [40], 1], ["AN", 2, 2, 6], ["FSP", 1, 2, 1, 1], ["AN", 1, 3, 6], ["CA", 1, 2, 1], ["FU", 2, [0, 1]], ["AN", 2, 0, 5], ["PR", 1, 0, "auto_unroll_max_step$16"]]]], "r": [[1.70223e-05, 1.7032e-05, 1.70211e-05], 0, 16.1469, 1681114927], "v": "v0.6"}
{"i": [["[\"reduce_mean\", 14, 14, 240]", "cuda -keys=cuda,gpu -arch=sm_80 -max_num_threads=1024 -model=unknown -thread_warp_size=32", [-1, 16, 64, 49152, 2147483647, 1024, 8, 32], "", 0, []], [[], [["FU", 2, [0, 1]], ["SP", 2, 0, 240, [5], 1], ["AN", 2, 0, 5], ["AN", 2, 1, 6], ["FU", 1, [0, 1]], ["SP", 1, 0, 240, [32], 1], ["AN", 1, 0, 5], ["AN", 1, 1, 6], ["PR", 1, 0, "auto_unroll_max_step$0"]]]], "r": [[8.7127e-06, 8.73479e-06, 8.73479e-06], 0, 14.2978, 1681114925], "v": "v0.6"}
{"i": [["[\"reduce_mean\", 14, 14, 240]", "cuda -keys=cuda,gpu -arch=sm_80 -max_num_threads=1024 -model=unknown -thread_warp_size=32", [-1, 16, 64, 49152, 2147483647, 1024, 8, 32], "", 0, []], [[], [["FU", 1, [2, 3]], ["SP", 2, 1, 240, [1], 1], ["AN", 2, 2, 6], ["FSP", 1, 2, 1, 1], ["AN", 1, 3, 6], ["CA", 1, 2, 1], ["FU", 2, [0, 1]], ["AN", 2, 0, 5], ["PR", 1, 0, "auto_unroll_max_step$0"]]]], "r": [[6.0173e-06, 6.02973e-06, 6.03022e-06], 0, 14.4622, 1681114925], "v": "v0.6"}
{"i": [["[\"reduce_mean\", 14, 14, 240]", "cuda -keys=cuda,gpu -arch=sm_80 -max_num_threads=1024 -model=unknown -thread_warp_size=32", [-1, 16, 64, 49152, 2147483647, 1024, 8, 32], "", 0, []], [[], [["FU", 1, [2, 3]], ["SP", 2, 1, 240, [1], 1], ["AN", 2, 2, 6], ["FSP", 1, 2, 1, 1], ["AN", 1, 3, 6], ["CA", 1, 2, 1], ["FU", 2, [0, 1]], ["AN", 2, 0, 5], ["PR", 1, 0, "auto_unroll_max_step$64"]]]], "r": [[6.00389e-06, 6.01631e-06, 6.0183e-06], 0, 3.099, 1681114913], "v": "v0.6"}
{"i": [["[\"reduce_mean\", 14, 14, 240]", "cuda -keys=cuda,gpu -arch=sm_80 -max_num_threads=1024 -model=unknown -thread_warp_size=32", [-1, 16, 64, 49152, 2147483647, 1024, 8, 32], "", 0, []], [[], [["FU", 2, [0, 1]], ["SP", 2, 0, 240, [2], 1], ["AN", 2, 0, 5], ["AN", 2, 1, 6], ["FU", 1, [0, 1]], ["SP", 1, 0, 240, [2], 1], ["AN", 1, 0, 5], ["AN", 1, 1, 6], ["PR", 1, 0, "auto_unroll_max_step$1024"]]]], "r": [[7.37431e-06, 7.39063e-06, 7.39005e-06], 0, 11.6413, 1681114922], "v": "v0.6"}
{"i": [["[\"reduce_mean\", 14, 14, 240]", "cuda -keys=cuda,gpu -arch=sm_80 -max_num_threads=1024 -model=unknown -thread_warp_size=32", [-1, 16, 64, 49152, 2147483647, 1024, 8, 32], "", 0, []], [[], [["FU", 1, [2, 3]], ["SP", 2, 1, 240, [4], 1], ["AN", 2, 2, 6], ["FSP", 1, 2, 1, 1], ["AN", 1, 3, 6], ["CA", 1, 2, 1], ["FU", 2, [0, 1]], ["AN", 2, 0, 5], ["PR", 1, 0, "auto_unroll_max_step$0"]]]], "r": [[4.4705e-06, 4.48041e-06, 4.48005e-06], 0, 13.3023, 1681114924], "v": "v0.6"}
{"i": [["[\"reduce_mean\", 14, 14, 240]", "cuda -keys=cuda,gpu -arch=sm_80 -max_num_threads=1024 -model=unknown -thread_warp_size=32", [-1, 16, 64, 49152, 2147483647, 1024, 8, 32], "", 0, []], [[], [["FU", 2, [0, 1]], ["SP", 2, 0, 240, [16], 1], ["AN", 2, 0, 5], ["AN", 2, 1, 6], ["FU", 1, [0, 1]], ["SP", 1, 0, 240, [1], 1], ["AN", 1, 0, 5], ["AN", 1, 1, 6], ["PR", 1, 0, "auto_unroll_max_step$64"]]]], "r": [[8.91014e-06, 8.95565e-06, 8.95699e-06], 0, 15.4468, 1681114926], "v": "v0.6"}
{"i": [["[\"reduce_mean\", 14, 14, 240]", "cuda -keys=cuda,gpu -arch=sm_80 -max_num_threads=1024 -model=unknown -thread_warp_size=32", [-1, 16, 64, 49152, 2147483647, 1024, 8, 32], "", 0, []], [[], [["FU", 2, [0, 1]], ["SP", 2, 0, 240, [2], 1], ["AN", 2, 0, 5], ["AN", 2, 1, 6], ["FU", 1, [0, 1]], ["SP", 1, 0, 240, [10], 1], ["AN", 1, 0, 5], ["AN", 1, 1, 6], ["PR", 1, 0, "auto_unroll_max_step$512"]]]], "r": [[7.43156e-06, 7.43579e-06, 7.43035e-06], 0, 15.5662, 1681114926], "v": "v0.6"}
{"i": [["[\"reduce_mean\", 14, 14, 240]", "cuda -keys=cuda,gpu -arch=sm_80 -max_num_threads=1024 -model=unknown -thread_warp_size=32", [-1, 16, 64, 49152, 2147483647, 1024, 8, 32], "", 0, []], [[], [["FU", 2, [0, 1]], ["SP", 2, 0, 240, [16], 1], ["AN", 2, 0, 5], ["AN", 2, 1, 6], ["FU", 1, [0, 1]], ["SP", 1, 0, 240, [32], 1], ["AN", 1, 0, 5], ["AN", 1, 1, 6], ["PR", 1, 0, "auto_unroll_max_step$64"]]]], "r": [[8.89056e-06, 8.91681e-06, 8.9182e-06], 0, 16.3788, 1681114927], "v": "v0.6"}
{"i": [["[\"reduce_mean\", 14, 14, 240]", "cuda -keys=cuda,gpu -arch=sm_80 -max_num_threads=1024 -model=unknown -thread_warp_size=32", [-1, 16, 64, 49152, 2147483647, 1024, 8, 32], "", 0, []], [[], [["FU", 1, [2, 3]], ["SP", 2, 1, 240, [48], 1], ["AN", 2, 2, 6], ["FSP", 1, 2, 1, 1], ["AN", 1, 3, 6], ["CA", 1, 2, 1], ["FU", 2, [0, 1]], ["AN", 2, 0, 5], ["PR", 1, 0, "auto_unroll_max_step$64"]]]], "r": [[1.99949e-05, 2.00129e-05, 1.99963e-05], 0, 16.221, 1681114927], "v": "v0.6"}
{"i": [["[\"reduce_mean\", 14, 14, 240]", "cuda -keys=cuda,gpu -arch=sm_80 -max_num_threads=1024 -model=unknown -thread_warp_size=32", [-1, 16, 64, 49152, 2147483647, 1024, 8, 32], "", 0, []], [[], [["FU", 2, [0, 1]], ["SP", 2, 0, 240, [1], 1], ["AN", 2, 0, 5], ["AN", 2, 1, 6], ["FU", 1, [0, 1]], ["SP", 1, 0, 240, [32], 1], ["AN", 1, 0, 5], ["AN", 1, 1, 6], ["PR", 1, 0, "auto_unroll_max_step$64"]]]], "r": [[9.14345e-06, 9.17592e-06, 9.178e-06], 0, 16.1786, 1681114928], "v": "v0.6"}
{"i": [["[\"reduce_mean\", 14, 14, 240]", "cuda -keys=cuda,gpu -arch=sm_80 -max_num_threads=1024 -model=unknown -thread_warp_size=32", [-1, 16, 64, 49152, 2147483647, 1024, 8, 32], "", 0, []], [[], [["FU", 2, [0, 1]], ["SP", 2, 0, 240, [32], 1], ["AN", 2, 0, 5], ["AN", 2, 1, 6], ["FU", 1, [0, 1]], ["SP", 1, 0, 240, [60], 1], ["AN", 1, 0, 5], ["AN", 1, 1, 6], ["PR", 1, 0, "auto_unroll_max_step$16"]]]], "r": [[8.17084e-06, 8.19381e-06, 8.19684e-06], 0, 16.3868, 1681114928], "v": "v0.6"}
{"i": [["[\"reduce_mean\", 14, 14, 240]", "cuda -keys=cuda,gpu -arch=sm_80 -max_num_threads=1024 -model=unknown -thread_warp_size=32", [-1, 16, 64, 49152, 2147483647, 1024, 8, 32], "", 0, []], [[], [["FU", 1, [2, 3]], ["SP", 2, 1, 240, [10], 1], ["AN", 2, 2, 6], ["FSP", 1, 2, 1, 1], ["AN", 1, 3, 6], ["CA", 1, 2, 1], ["FU", 2, [0, 1]], ["AN", 2, 0, 5], ["PR", 1, 0, "auto_unroll_max_step$16"]]]], "r": [[8.51799e-06, 8.53031e-06, 8.52966e-06], 0, 16.2805, 1681114929], "v": "v0.6"}
{"i": [["[\"reduce_mean\", 14, 14, 240]", "cuda -keys=cuda,gpu -arch=sm_80 -max_num_threads=1024 -model=unknown -thread_warp_size=32", [-1, 16, 64, 49152, 2147483647, 1024, 8, 32], "", 0, []], [[], [["FU", 2, [0, 1]], ["SP", 2, 0, 240, [4], 1], ["AN", 2, 0, 5], ["AN", 2, 1, 6], ["FU", 1, [0, 1]], ["SP", 1, 0, 240, [1], 1], ["AN", 1, 0, 5], ["AN", 1, 1, 6], ["PR", 1, 0, "auto_unroll_max_step$0"]]]], "r": [[8.90411e-06, 8.92553e-06, 8.92152e-06], 0, 16.3276, 1681114929], "v": "v0.6"}
{"i": [["[\"reduce_mean\", 14, 14, 240]", "cuda -keys=cuda,gpu -arch=sm_80 -max_num_threads=1024 -model=unknown -thread_warp_size=32", [-1, 16, 64, 49152, 2147483647, 1024, 8, 32], "", 0, []], [[], [["FU", 2, [0, 1]], ["SP", 2, 0, 240, [32], 1], ["AN", 2, 0, 5], ["AN", 2, 1, 6], ["FU", 1, [0, 1]], ["SP", 1, 0, 240, [8], 1], ["AN", 1, 0, 5], ["AN", 1, 1, 6], ["PR", 1, 0, "auto_unroll_max_step$16"]]]], "r": [[7.46627e-06, 7.48817e-06, 7.49267e-06], 0, 16.3241, 1681114929], "v": "v0.6"}
{"i": [["[\"reduce_mean\", 14, 14, 240]", "cuda -keys=cuda,gpu -arch=sm_80 -max_num_threads=1024 -model=unknown -thread_warp_size=32", [-1, 16, 64, 49152, 2147483647, 1024, 8, 32], "", 0, []], [[], [["FU", 2, [0, 1]], ["SP", 2, 0, 240, [40], 1], ["AN", 2, 0, 5], ["AN", 2, 1, 6], ["FU", 1, [0, 1]], ["SP", 1, 0, 240, [16], 1], ["AN", 1, 0, 5], ["AN", 1, 1, 6], ["PR", 1, 0, "auto_unroll_max_step$512"]]]], "r": [[7.01353e-06, 7.02926e-06, 7.02926e-06], 0, 16.3017, 1681114930], "v": "v0.6"}
{"i": [["[\"reduce_mean\", 14, 14, 240]", "cuda -keys=cuda,gpu -arch=sm_80 -max_num_threads=1024 -model=unknown -thread_warp_size=32", [-1, 16, 64, 49152, 2147483647, 1024, 8, 32], "", 0, []], [[], [["FU", 2, [0, 1]], ["SP", 2, 0, 240, [32], 1], ["AN", 2, 0, 5], ["AN", 2, 1, 6], ["FU", 1, [0, 1]], ["SP", 1, 0, 240, [12], 1], ["AN", 1, 0, 5], ["AN", 1, 1, 6], ["PR", 1, 0, "auto_unroll_max_step$512"]]]], "r": [[7.19306e-06, 7.21462e-06, 7.21404e-06], 0, 16.3339, 1681114930], "v": "v0.6"}
{"i": [["[\"reduce_mean\", 14, 14, 240]", "cuda -keys=cuda,gpu -arch=sm_80 -max_num_threads=1024 -model=unknown -thread_warp_size=32", [-1, 16, 64, 49152, 2147483647, 1024, 8, 32], "", 0, []], [[], [["FU", 2, [0, 1]], ["SP", 2, 0, 240, [4], 1], ["AN", 2, 0, 5], ["AN", 2, 1, 6], ["FU", 1, [0, 1]], ["SP", 1, 0, 240, [1], 1], ["AN", 1, 0, 5], ["AN", 1, 1, 6], ["PR", 1, 0, "auto_unroll_max_step$16"]]]], "r": [[8.77494e-06, 8.77561e-06, 8.77628e-06], 0, 16.2441, 1681114931], "v": "v0.6"}
{"i": [["[\"reduce_mean\", 14, 14, 240]", "cuda -keys=cuda,gpu -arch=sm_80 -max_num_threads=1024 -model=unknown -thread_warp_size=32", [-1, 16, 64, 49152, 2147483647, 1024, 8, 32], "", 0, []], [[], [["FU", 2, [0, 1]], ["SP", 2, 0, 240, [8], 1], ["AN", 2, 0, 5], ["AN", 2, 1, 6], ["FU", 1, [0, 1]], ["SP", 1, 0, 240, [2], 1], ["AN", 1, 0, 5], ["AN", 1, 1, 6], ["PR", 1, 0, "auto_unroll_max_step$512"]]]], "r": [[7.32247e-06, 7.33876e-06, 7.33764e-06], 0, 16.3216, 1681114931], "v": "v0.6"}
{"i": [["[\"reduce_mean\", 14, 14, 240]", "cuda -keys=cuda,gpu -arch=sm_80 -max_num_threads=1024 -model=unknown -thread_warp_size=32", [-1, 16, 64, 49152, 2147483647, 1024, 8, 32], "", 0, []], [[], [["FU", 2, [0, 1]], ["SP", 2, 0, 240, [32], 1], ["AN", 2, 0, 5], ["AN", 2, 1, 6], ["FU", 1, [0, 1]], ["SP", 1, 0, 240, [32], 1], ["AN", 1, 0, 5], ["AN", 1, 1, 6], ["PR", 1, 0, "auto_unroll_max_step$16"]]]], "r": [[8.65782e-06, 8.67991e-06, 8.67991e-06], 0, 16.2567, 1681114931], "v": "v0.6"}
{"i": [["[\"reduce_mean\", 14, 14, 240]", "cuda -keys=cuda,gpu -arch=sm_80 -max_num_threads=1024 -model=unknown -thread_warp_size=32", [-1, 16, 64, 49152, 2147483647, 1024, 8, 32], "", 0, []], [[], [["FU", 2, [0, 1]], ["SP", 2, 0, 240, [32], 1], ["AN", 2, 0, 5], ["AN", 2, 1, 6], ["FU", 1, [0, 1]], ["SP", 1, 0, 240, [32], 1], ["AN", 1, 0, 5], ["AN", 1, 1, 6], ["PR", 1, 0, "auto_unroll_max_step$0"]]]], "r": [[8.77205e-06, 8.79279e-06, 8.79084e-06], 0, 16.2942, 1681114932], "v": "v0.6"}
{"i": [["[\"reduce_mean\", 14, 14, 240]", "cuda -keys=cuda,gpu -arch=sm_80 -max_num_threads=1024 -model=unknown -thread_warp_size=32", [-1, 16, 64, 49152, 2147483647, 1024, 8, 32], "", 0, []], [[], [["FU", 2, [0, 1]], ["SP", 2, 0, 240, [32], 1], ["AN", 2, 0, 5], ["AN", 2, 1, 6], ["FU", 1, [0, 1]], ["SP", 1, 0, 240, [32], 1], ["AN", 1, 0, 5], ["AN", 1, 1, 6], ["PR", 1, 0, "auto_unroll_max_step$512"]]]], "r": [[9.0094e-06, 9.10406e-06, 9.09646e-06], 0, 16.2442, 1681114932], "v": "v0.6"}
{"i": [["[\"reduce_mean\", 14, 14, 240]", "cuda -keys=cuda,gpu -arch=sm_80 -max_num_threads=1024 -model=unknown -thread_warp_size=32", [-1, 16, 64, 49152, 2147483647, 1024, 8, 32], "", 0, []], [[], [["FU", 2, [0, 1]], ["SP", 2, 0, 240, [16], 1], ["AN", 2, 0, 5], ["AN", 2, 1, 6], ["FU", 1, [0, 1]], ["SP", 1, 0, 240, [20], 1], ["AN", 1, 0, 5], ["AN", 1, 1, 6], ["PR", 1, 0, "auto_unroll_max_step$64"]]]], "r": [[7.12419e-06, 7.14104e-06, 7.14272e-06], 0, 2.31719, 1681114964], "v": "v0.6"}
{"i": [["[\"reduce_mean\", 14, 14, 240]", "cuda -keys=cuda,gpu -arch=sm_80 -max_num_threads=1024 -model=unknown -thread_warp_size=32", [-1, 16, 64, 49152, 2147483647, 1024, 8, 32], "", 0, []], [[], [["FU", 2, [0, 1]], ["SP", 2, 0, 240, [1], 1], ["AN", 2, 0, 5], ["AN", 2, 1, 6], ["FU", 1, [0, 1]], ["SP", 1, 0, 240, [32], 1], ["AN", 1, 0, 5], ["AN", 1, 1, 6], ["PR", 1, 0, "auto_unroll_max_step$16"]]]], "r": [[8.87536e-06, 8.89954e-06, 8.89954e-06], 0, 1.38123, 1681114962], "v": "v0.6"}
{"i": [["[\"reduce_mean\", 14, 14, 240]", "cuda -keys=cuda,gpu -arch=sm_80 -max_num_threads=1024 -model=unknown -thread_warp_size=32", [-1, 16, 64, 49152, 2147483647, 1024, 8, 32], "", 0, []], [[], [["FU", 1, [2, 3]], ["SP", 2, 1, 240, [4], 1], ["AN", 2, 2, 6], ["FSP", 1, 2, 1, 1], ["AN", 1, 3, 6], ["CA", 1, 2, 1], ["FU", 2, [0, 1]], ["AN", 2, 0, 5], ["PR", 1, 0, "auto_unroll_max_step$16"]]]], "r": [[4.1547e-06, 4.16753e-06, 4.16559e-06], 0, 2.10088, 1681114963], "v": "v0.6"}
{"i": [["[\"reduce_mean\", 14, 14, 240]", "cuda -keys=cuda,gpu -arch=sm_80 -max_num_threads=1024 -model=unknown -thread_warp_size=32", [-1, 16, 64, 49152, 2147483647, 1024, 8, 32], "", 0, []], [[], [["FU", 2, [0, 1]], ["SP", 2, 0, 240, [4], 1], ["AN", 2, 0, 5], ["AN", 2, 1, 6], ["FU", 1, [0, 1]], ["SP", 1, 0, 240, [2], 1], ["AN", 1, 0, 5], ["AN", 1, 1, 6], ["PR", 1, 0, "auto_unroll_max_step$64"]]]], "r": [[7.67516e-06, 7.69511e-06, 7.69451e-06], 0, 3.92145, 1681114965], "v": "v0.6"}
{"i": [["[\"reduce_mean\", 14, 14, 240]", "cuda -keys=cuda,gpu -arch=sm_80 -max_num_threads=1024 -model=unknown -thread_warp_size=32", [-1, 16, 64, 49152, 2147483647, 1024, 8, 32], "", 0, []], [[], [["FU", 2, [0, 1]], ["SP", 2, 0, 240, [48], 1], ["AN", 2, 0, 5], ["AN", 2, 1, 6], ["FU", 1, [0, 1]], ["SP", 1, 0, 240, [10], 1], ["AN", 1, 0, 5], ["AN", 1, 1, 6], ["PR", 1, 0, "auto_unroll_max_step$1024"]]]], "r": [[7.43376e-06, 7.44483e-06, 7.4495e-06], 0, 3.20728, 1681114964], "v": "v0.6"}
{"i": [["[\"reduce_mean\", 14, 14, 240]", "cuda -keys=cuda,gpu -arch=sm_80 -max_num_threads=1024 -model=unknown -thread_warp_size=32", [-1, 16, 64, 49152, 2147483647, 1024, 8, 32], "", 0, []], [[], [["FU", 2, [0, 1]], ["SP", 2, 0, 240, [32], 1], ["AN", 2, 0, 5], ["AN", 2, 1, 6], ["FU", 1, [0, 1]], ["SP", 1, 0, 240, [1], 1], ["AN", 1, 0, 5], ["AN", 1, 1, 6], ["PR", 1, 0, "auto_unroll_max_step$1024"]]]], "r": [[8.59188e-06, 8.61456e-06, 8.61391e-06], 0, 1.86577, 1681114963], "v": "v0.6"}
{"i": [["[\"reduce_mean\", 14, 14, 240]", "cuda -keys=cuda,gpu -arch=sm_80 -max_num_threads=1024 -model=unknown -thread_warp_size=32", [-1, 16, 64, 49152, 2147483647, 1024, 8, 32], "", 0, []], [[], [["FU", 2, [0, 1]], ["SP", 2, 0, 240, [16], 1], ["AN", 2, 0, 5], ["AN", 2, 1, 6], ["FU", 1, [0, 1]], ["SP", 1, 0, 240, [10], 1], ["AN", 1, 0, 5], ["AN", 1, 1, 6], ["PR", 1, 0, "auto_unroll_max_step$1024"]]]], "r": [[7.43987e-06, 7.45616e-06, 7.4584e-06], 0, 3.5088, 1681114965], "v": "v0.6"}
{"i": [["[\"reduce_mean\", 14, 14, 240]", "cuda -keys=cuda,gpu -arch=sm_80 -max_num_threads=1024 -model=unknown -thread_warp_size=32", [-1, 16, 64, 49152, 2147483647, 1024, 8, 32], "", 0, []], [[], [["FU", 2, [0, 1]], ["SP", 2, 0, 240, [12], 1], ["AN", 2, 0, 5], ["AN", 2, 1, 6], ["FU", 1, [0, 1]], ["SP", 1, 0, 240, [48], 1], ["AN", 1, 0, 5], ["AN", 1, 1, 6], ["PR", 1, 0, "auto_unroll_max_step$512"]]]], "r": [[7.96904e-06, 7.99158e-06, 7.99346e-06], 0, 4.60008, 1681114966], "v": "v0.6"}
{"i": [["[\"reduce_mean\", 14, 14, 240]", "cuda -keys=cuda,gpu -arch=sm_80 -max_num_threads=1024 -model=unknown -thread_warp_size=32", [-1, 16, 64, 49152, 2147483647, 1024, 8, 32], "", 0, []], [[], [["FU", 2, [0, 1]], ["SP", 2, 0, 240, [48], 1], ["AN", 2, 0, 5], ["AN", 2, 1, 6], ["FU", 1, [0, 1]], ["SP", 1, 0, 240, [2], 1], ["AN", 1, 0, 5], ["AN", 1, 1, 6], ["PR", 1, 0, "auto_unroll_max_step$512"]]]], "r": [[7.39718e-06, 7.41234e-06, 7.41291e-06], 0, 6.3609, 1681114968], "v": "v0.6"}
{"i": [["[\"reduce_mean\", 14, 14, 240]", "cuda -keys=cuda,gpu -arch=sm_80 -max_num_threads=1024 -model=unknown -thread_warp_size=32", [-1, 16, 64, 49152, 2147483647, 1024, 8, 32], "", 0, []], [[], [["FU", 1, [2, 3]], ["SP", 2, 1, 240, [8], 1], ["AN", 2, 2, 6], ["FSP", 1, 2, 1, 1], ["AN", 1, 3, 6], ["CA", 1, 2, 1], ["FU", 2, [0, 1]], ["AN", 2, 0, 5], ["PR", 1, 0, "auto_unroll_max_step$0"]]]], "r": [[6.91186e-06, 6.92534e-06, 6.92422e-06], 0, 5.64322, 1681114967], "v": "v0.6"}
{"i": [["[\"reduce_mean\", 14, 14, 240]", "cuda -keys=cuda,gpu -arch=sm_80 -max_num_threads=1024 -model=unknown -thread_warp_size=32", [-1, 16, 64, 49152, 2147483647, 1024, 8, 32], "", 0, []], [[], [["FU", 2, [0, 1]], ["SP", 2, 0, 240, [20], 1], ["AN", 2, 0, 5], ["AN", 2, 1, 6], ["FU", 1, [0, 1]], ["SP", 1, 0, 240, [40], 1], ["AN", 1, 0, 5], ["AN", 1, 1, 6], ["PR", 1, 0, "auto_unroll_max_step$1024"]]]], "r": [[8.15571e-06, 8.25811e-06, 8.25811e-06], 0, 5.99686, 1681114967], "v": "v0.6"}
{"i": [["[\"reduce_mean\", 14, 14, 240]", "cuda -keys=cuda,gpu -arch=sm_80 -max_num_threads=1024 -model=unknown -thread_warp_size=32", [-1, 16, 64, 49152, 2147483647, 1024, 8, 32], "", 0, []], [[], [["FU", 2, [0, 1]], ["SP", 2, 0, 240, [5], 1], ["AN", 2, 0, 5], ["AN", 2, 1, 6], ["FU", 1, [0, 1]], ["SP", 1, 0, 240, [8], 1], ["AN", 1, 0, 5], ["AN", 1, 1, 6], ["PR", 1, 0, "auto_unroll_max_step$16"]]]], "r": [[7.13361e-06, 7.14877e-06, 7.14818e-06], 0, 5.44261, 1681114967], "v": "v0.6"}
{"i": [["[\"reduce_mean\", 14, 14, 240]", "cuda -keys=cuda,gpu -arch=sm_80 -max_num_threads=1024 -model=unknown -thread_warp_size=32", [-1, 16, 64, 49152, 2147483647, 1024, 8, 32], "", 0, []], [[], [["FU", 2, [0, 1]], ["SP", 2, 0, 240, [48], 1], ["AN", 2, 0, 5], ["AN", 2, 1, 6], ["FU", 1, [0, 1]], ["SP", 1, 0, 240, [10], 1], ["AN", 1, 0, 5], ["AN", 1, 1, 6], ["PR", 1, 0, "auto_unroll_max_step$16"]]]], "r": [[7.1079e-06, 7.12362e-06, 7.12306e-06], 0, 2.78756, 1681114964], "v": "v0.6"}
{"i": [["[\"reduce_mean\", 14, 14, 240]", "cuda -keys=cuda,gpu -arch=sm_80 -max_num_threads=1024 -model=unknown -thread_warp_size=32", [-1, 16, 64, 49152, 2147483647, 1024, 8, 32], "", 0, []], [[], [["FU", 1, [2, 3]], ["SP", 2, 1, 240, [2], 1], ["AN", 2, 2, 6], ["FSP", 1, 2, 1, 1], ["AN", 1, 3, 6], ["CA", 1, 2, 1], ["FU", 2, [0, 1]], ["AN", 2, 0, 5], ["PR", 1, 0, "auto_unroll_max_step$16"]]]], "r": [[4.22351e-06, 4.24412e-06, 4.24723e-06], 0, 10.783, 1681114972], "v": "v0.6"}
{"i": [["[\"reduce_mean\", 14, 14, 240]", "cuda -keys=cuda,gpu -arch=sm_80 -max_num_threads=1024 -model=unknown -thread_warp_size=32", [-1, 16, 64, 49152, 2147483647, 1024, 8, 32], "", 0, []], [[], [["FU", 1, [2, 3]], ["SP", 2, 1, 240, [12], 1], ["AN", 2, 2, 6], ["FSP", 1, 2, 1, 1], ["AN", 1, 3, 6], ["CA", 1, 2, 1], ["FU", 2, [0, 1]], ["AN", 2, 0, 5], ["PR", 1, 0, "auto_unroll_max_step$16"]]]], "r": [[8.4493e-06, 8.46031e-06, 8.46096e-06], 0, 7.14036, 1681114969], "v": "v0.6"}
{"i": [["[\"reduce_mean\", 14, 14, 240]", "cuda -keys=cuda,gpu -arch=sm_80 -max_num_threads=1024 -model=unknown -thread_warp_size=32", [-1, 16, 64, 49152, 2147483647, 1024, 8, 32], "", 0, []], [[], [["FU", 2, [0, 1]], ["SP", 2, 0, 240, [5], 1], ["AN", 2, 0, 5], ["AN", 2, 1, 6], ["FU", 1, [0, 1]], ["SP", 1, 0, 240, [16], 1], ["AN", 1, 0, 5], ["AN", 1, 1, 6], ["PR", 1, 0, "auto_unroll_max_step$0"]]]], "r": [[7.32011e-06, 7.34343e-06, 7.3376e-06], 0, 6.7655, 1681114968], "v": "v0.6"}
{"i": [["[\"reduce_mean\", 14, 14, 240]", "cuda -keys=cuda,gpu -arch=sm_80 -max_num_threads=1024 -model=unknown -thread_warp_size=32", [-1, 16, 64, 49152, 2147483647, 1024, 8, 32], "", 0, []], [[], [["FU", 2, [0, 1]], ["SP", 2, 0, 240, [6], 1], ["AN", 2, 0, 5], ["AN", 2, 1, 6], ["FU", 1, [0, 1]], ["SP", 1, 0, 240, [8], 1], ["AN", 1, 0, 5], ["AN", 1, 1, 6], ["PR", 1, 0, "auto_unroll_max_step$0"]]]], "r": [[7.31742e-06, 7.34662e-06, 7.3455e-06], 0, 11.8559, 1681114973], "v": "v0.6"}
{"i": [["[\"reduce_mean\", 14, 14, 240]", "cuda -keys=cuda,gpu -arch=sm_80 -max_num_threads=1024 -model=unknown -thread_warp_size=32", [-1, 16, 64, 49152, 2147483647, 1024, 8, 32], "", 0, []], [[], [["FU", 2, [0, 1]], ["SP", 2, 0, 240, [10], 1], ["AN", 2, 0, 5], ["AN", 2, 1, 6], ["FU", 1, [0, 1]], ["SP", 1, 0, 240, [4], 1], ["AN", 1, 0, 5], ["AN", 1, 1, 6], ["PR", 1, 0, "auto_unroll_max_step$512"]]]], "r": [[7.45707e-06, 7.49612e-06, 7.49904e-06], 0, 4.85859, 1681114966], "v": "v0.6"}
{"i": [["[\"reduce_mean\", 14, 14, 240]", "cuda -keys=cuda,gpu -arch=sm_80 -max_num_threads=1024 -model=unknown -thread_warp_size=32", [-1, 16, 64, 49152, 2147483647, 1024, 8, 32], "", 0, []], [[], [["FU", 2, [0, 1]], ["SP", 2, 0, 240, [40], 1], ["AN", 2, 0, 5], ["AN", 2, 1, 6], ["FU", 1, [0, 1]], ["SP", 1, 0, 240, [2], 1], ["AN", 1, 0, 5], ["AN", 1, 1, 6], ["PR", 1, 0, "auto_unroll_max_step$16"]]]], "r": [[7.66912e-06, 7.66368e-06, 7.66972e-06], 0, 11.1521, 1681114973], "v": "v0.6"}
{"i": [["[\"reduce_mean\", 14, 14, 240]", "cuda -keys=cuda,gpu -arch=sm_80 -max_num_threads=1024 -model=unknown -thread_warp_size=32", [-1, 16, 64, 49152, 2147483647, 1024, 8, 32], "", 0, []], [[], [["FU", 2, [0, 1]], ["SP", 2, 0, 240, [32], 1], ["AN", 2, 0, 5], ["AN", 2, 1, 6], ["FU", 1, [0, 1]], ["SP", 1, 0, 240, [16], 1], ["AN", 1, 0, 5], ["AN", 1, 1, 6], ["PR", 1, 0, "auto_unroll_max_step$0"]]]], "r": [[7.22361e-06, 7.23878e-06, 7.23934e-06], 0, 10.3605, 1681114972], "v": "v0.6"}
{"i": [["[\"reduce_mean\", 14, 14, 240]", "cuda -keys=cuda,gpu -arch=sm_80 -max_num_threads=1024 -model=unknown -thread_warp_size=32", [-1, 16, 64, 49152, 2147483647, 1024, 8, 32], "", 0, []], [[], [["FU", 2, [0, 1]], ["SP", 2, 0, 240, [1], 1], ["AN", 2, 0, 5], ["AN", 2, 1, 6], ["FU", 1, [0, 1]], ["SP", 1, 0, 240, [3], 1], ["AN", 1, 0, 5], ["AN", 1, 1, 6], ["PR", 1, 0, "auto_unroll_max_step$512"]]]], "r": [[7.45453e-06, 7.47327e-06, 7.47387e-06], 0, 7.88196, 1681114969], "v": "v0.6"}
{"i": [["[\"reduce_mean\", 14, 14, 240]", "cuda -keys=cuda,gpu -arch=sm_80 -max_num_threads=1024 -model=unknown -thread_warp_size=32", [-1, 16, 64, 49152, 2147483647, 1024, 8, 32], "", 0, []], [[], [["FU", 2, [0, 1]], ["SP", 2, 0, 240, [8], 1], ["AN", 2, 0, 5], ["AN", 2, 1, 6], ["FU", 1, [0, 1]], ["SP", 1, 0, 240, [32], 1], ["AN", 1, 0, 5], ["AN", 1, 1, 6], ["PR", 1, 0, "auto_unroll_max_step$512"]]]], "r": [[8.77829e-06, 8.79703e-06, 8.7977e-06], 0, 8.51976, 1681114970], "v": "v0.6"}
{"i": [["[\"reduce_mean\", 14, 14, 240]", "cuda -keys=cuda,gpu -arch=sm_80 -max_num_threads=1024 -model=unknown -thread_warp_size=32", [-1, 16, 64, 49152, 2147483647, 1024, 8, 32], "", 0, []], [[], [["FU", 2, [0, 1]], ["SP", 2, 0, 240, [60], 1], ["AN", 2, 0, 5], ["AN", 2, 1, 6], ["FU", 1, [0, 1]], ["SP", 1, 0, 240, [3], 1], ["AN", 1, 0, 5], ["AN", 1, 1, 6], ["PR", 1, 0, "auto_unroll_max_step$16"]]]], "r": [[7.54762e-06, 7.56757e-06, 7.56454e-06], 0, 12.5402, 1681114974], "v": "v0.6"}
{"i": [["[\"reduce_mean\", 14, 14, 240]", "cuda -keys=cuda,gpu -arch=sm_80 -max_num_threads=1024 -model=unknown -thread_warp_size=32", [-1, 16, 64, 49152, 2147483647, 1024, 8, 32], "", 0, []], [[], [["FU", 1, [2, 3]], ["SP", 2, 1, 240, [15], 1], ["AN", 2, 2, 6], ["FSP", 1, 2, 1, 1], ["AN", 1, 3, 6], ["CA", 1, 2, 1], ["FU", 2, [0, 1]], ["AN", 2, 0, 5], ["PR", 1, 0, "auto_unroll_max_step$16"]]]], "r": [[7.55207e-06, 7.56664e-06, 7.56548e-06], 0, 9.31086, 1681114971], "v": "v0.6"}
{"i": [["[\"reduce_mean\", 14, 14, 240]", "cuda -keys=cuda,gpu -arch=sm_80 -max_num_threads=1024 -model=unknown -thread_warp_size=32", [-1, 16, 64, 49152, 2147483647, 1024, 8, 32], "", 0, []], [[], [["FU", 2, [0, 1]], ["SP", 2, 0, 240, [4], 1], ["AN", 2, 0, 5], ["AN", 2, 1, 6], ["FU", 1, [0, 1]], ["SP", 1, 0, 240, [32], 1], ["AN", 1, 0, 5], ["AN", 1, 1, 6], ["PR", 1, 0, "auto_unroll_max_step$64"]]]], "r": [[9.16487e-06, 9.16901e-06, 9.15727e-06], 0, 10.0245, 1681114972], "v": "v0.6"}
{"i": [["[\"reduce_mean\", 14, 14, 240]", "cuda -keys=cuda,gpu -arch=sm_80 -max_num_threads=1024 -model=unknown -thread_warp_size=32", [-1, 16, 64, 49152, 2147483647, 1024, 8, 32], "", 0, []], [[], [["FU", 2, [0, 1]], ["SP", 2, 0, 240, [32], 1], ["AN", 2, 0, 5], ["AN", 2, 1, 6], ["FU", 1, [0, 1]], ["SP", 1, 0, 240, [8], 1], ["AN", 1, 0, 5], ["AN", 1, 1, 6], ["PR", 1, 0, "auto_unroll_max_step$512"]]]], "r": [[7.15518e-06, 7.17383e-06, 7.1715e-06], 0, 14.7517, 1681114977], "v": "v0.6"}
{"i": [["[\"reduce_mean\", 14, 14, 240]", "cuda -keys=cuda,gpu -arch=sm_80 -max_num_threads=1024 -model=unknown -thread_warp_size=32", [-1, 16, 64, 49152, 2147483647, 1024, 8, 32], "", 0, []], [[], [["FU", 2, [0, 1]], ["SP", 2, 0, 240, [1], 1], ["AN", 2, 0, 5], ["AN", 2, 1, 6], ["FU", 1, [0, 1]], ["SP", 1, 0, 240, [8], 1], ["AN", 1, 0, 5], ["AN", 1, 1, 6], ["PR", 1, 0, "auto_unroll_max_step$512"]]]], "r": [[7.82991e-06, 7.85228e-06, 7.84926e-06], 0, 15.1186, 1681114977], "v": "v0.6"}
{"i": [["[\"reduce_mean\", 14, 14, 240]", "cuda -keys=cuda,gpu -arch=sm_80 -max_num_threads=1024 -model=unknown -thread_warp_size=32", [-1, 16, 64, 49152, 2147483647, 1024, 8, 32], "", 0, []], [[], [["FU", 2, [0, 1]], ["SP", 2, 0, 240, [60], 1], ["AN", 2, 0, 5], ["AN", 2, 1, 6], ["FU", 1, [0, 1]], ["SP", 1, 0, 240, [15], 1], ["AN", 1, 0, 5], ["AN", 1, 1, 6], ["PR", 1, 0, "auto_unroll_max_step$0"]]]], "r": [[7.55091e-06, 7.57364e-06, 7.57364e-06], 0, 11.4674, 1681114973], "v": "v0.6"}
{"i": [["[\"reduce_mean\", 14, 14, 240]", "cuda -keys=cuda,gpu -arch=sm_80 -max_num_threads=1024 -model=unknown -thread_warp_size=32", [-1, 16, 64, 49152, 2147483647, 1024, 8, 32], "", 0, []], [[], [["FU", 1, [2, 3]], ["SP", 2, 1, 240, [10], 1], ["AN", 2, 2, 6], ["FSP", 1, 2, 1, 1], ["AN", 1, 3, 6], ["CA", 1, 2, 1], ["FU", 2, [0, 1]], ["AN", 2, 0, 5], ["PR", 1, 0, "auto_unroll_max_step$64"]]]], "r": [[5.81423e-06, 5.82421e-06, 5.81946e-06], 0, 14.5155, 1681114976], "v": "v0.6"}
{"i": [["[\"reduce_mean\", 14, 14, 240]", "cuda -keys=cuda,gpu -arch=sm_80 -max_num_threads=1024 -model=unknown -thread_warp_size=32", [-1, 16, 64, 49152, 2147483647, 1024, 8, 32], "", 0, []], [[], [["FU", 1, [2, 3]], ["SP", 2, 1, 240, [60], 1], ["AN", 2, 2, 6], ["FSP", 1, 2, 1, 1], ["AN", 1, 3, 6], ["CA", 1, 2, 1], ["FU", 2, [0, 1]], ["AN", 2, 0, 5], ["PR", 1, 0, "auto_unroll_max_step$16"]]]], "r": [[2.47747e-05, 2.47865e-05, 2.47714e-05], 0, 9.6292, 1681114971], "v": "v0.6"}
{"i": [["[\"reduce_mean\", 14, 14, 240]", "cuda -keys=cuda,gpu -arch=sm_80 -max_num_threads=1024 -model=unknown -thread_warp_size=32", [-1, 16, 64, 49152, 2147483647, 1024, 8, 32], "", 0, []], [[], [["FU", 2, [0, 1]], ["SP", 2, 0, 240, [40], 1], ["AN", 2, 0, 5], ["AN", 2, 1, 6], ["FU", 1, [0, 1]], ["SP", 1, 0, 240, [60], 1], ["AN", 1, 0, 5], ["AN", 1, 1, 6], ["PR", 1, 0, "auto_unroll_max_step$16"]]]], "r": [[8.42208e-06, 8.44994e-06, 8.44735e-06], 0, 8.10342, 1681114970], "v": "v0.6"}
{"i": [["[\"reduce_mean\", 14, 14, 240]", "cuda -keys=cuda,gpu -arch=sm_80 -max_num_threads=1024 -model=unknown -thread_warp_size=32", [-1, 16, 64, 49152, 2147483647, 1024, 8, 32], "", 0, []], [[], [["FU", 2, [0, 1]], ["SP", 2, 0, 240, [40], 1], ["AN", 2, 0, 5], ["AN", 2, 1, 6], ["FU", 1, [0, 1]], ["SP", 1, 0, 240, [3], 1], ["AN", 1, 0, 5], ["AN", 1, 1, 6], ["PR", 1, 0, "auto_unroll_max_step$64"]]]], "r": [[7.5458e-06, 7.56636e-06, 7.56575e-06], 0, 15.5816, 1681114977], "v": "v0.6"}
{"i": [["[\"reduce_mean\", 14, 14, 240]", "cuda -keys=cuda,gpu -arch=sm_80 -max_num_threads=1024 -model=unknown -thread_warp_size=32", [-1, 16, 64, 49152, 2147483647, 1024, 8, 32], "", 0, []], [[], [["FU", 2, [0, 1]], ["SP", 2, 0, 240, [16], 1], ["AN", 2, 0, 5], ["AN", 2, 1, 6], ["FU", 1, [0, 1]], ["SP", 1, 0, 240, [1], 1], ["AN", 1, 0, 5], ["AN", 1, 1, 6], ["PR", 1, 0, "auto_unroll_max_step$16"]]]], "r": [[9.10683e-06, 9.12963e-06, 9.12963e-06], 0, 14.0496, 1681114976], "v": "v0.6"}
{"i": [["[\"reduce_mean\", 14, 14, 240]", "cuda -keys=cuda,gpu -arch=sm_80 -max_num_threads=1024 -model=unknown -thread_warp_size=32", [-1, 16, 64, 49152, 2147483647, 1024, 8, 32], "", 0, []], [[], [["FU", 2, [0, 1]], ["SP", 2, 0, 240, [5], 1], ["AN", 2, 0, 5], ["AN", 2, 1, 6], ["FU", 1, [0, 1]], ["SP", 1, 0, 240, [1], 1], ["AN", 1, 0, 5], ["AN", 1, 1, 6], ["PR", 1, 0, "auto_unroll_max_step$16"]]]], "r": [[8.79149e-06, 8.73641e-06, 8.74742e-06], 0, 8.77014, 1681114970], "v": "v0.6"}
{"i": [["[\"reduce_mean\", 14, 14, 240]", "cuda -keys=cuda,gpu -arch=sm_80 -max_num_threads=1024 -model=unknown -thread_warp_size=32", [-1, 16, 64, 49152, 2147483647, 1024, 8, 32], "", 0, []], [[], [["FU", 2, [0, 1]], ["SP", 2, 0, 240, [60], 1], ["AN", 2, 0, 5], ["AN", 2, 1, 6], ["FU", 1, [0, 1]], ["SP", 1, 0, 240, [2], 1], ["AN", 1, 0, 5], ["AN", 1, 1, 6], ["PR", 1, 0, "auto_unroll_max_step$64"]]]], "r": [[7.48855e-06, 7.54275e-06, 7.54799e-06], 0, 13.3189, 1681114975], "v": "v0.6"}
{"i": [["[\"reduce_mean\", 14, 14, 240]", "cuda -keys=cuda,gpu -arch=sm_80 -max_num_threads=1024 -model=unknown -thread_warp_size=32", [-1, 16, 64, 49152, 2147483647, 1024, 8, 32], "", 0, []], [[], [["FU", 2, [0, 1]], ["SP", 2, 0, 240, [4], 1], ["AN", 2, 0, 5], ["AN", 2, 1, 6], ["FU", 1, [0, 1]], ["SP", 1, 0, 240, [4], 1], ["AN", 1, 0, 5], ["AN", 1, 1, 6], ["PR", 1, 0, "auto_unroll_max_step$512"]]]], "r": [[7.70535e-06, 7.724e-06, 7.72225e-06], 0, 12.8633, 1681114975], "v": "v0.6"}
{"i": [["[\"reduce_mean\", 14, 14, 240]", "cuda -keys=cuda,gpu -arch=sm_80 -max_num_threads=1024 -model=unknown -thread_warp_size=32", [-1, 16, 64, 49152, 2147483647, 1024, 8, 32], "", 0, []], [[], [["FU", 2, [0, 1]], ["SP", 2, 0, 240, [48], 1], ["AN", 2, 0, 5], ["AN", 2, 1, 6], ["FU", 1, [0, 1]], ["SP", 1, 0, 240, [2], 1], ["AN", 1, 0, 5], ["AN", 1, 1, 6], ["PR", 1, 0, "auto_unroll_max_step$1024"]]]], "r": [[7.80331e-06, 7.83052e-06, 7.82568e-06], 0, 13.6622, 1681114975], "v": "v0.6"}
{"i": [["[\"reduce_mean\", 14, 14, 240]", "cuda -keys=cuda,gpu -arch=sm_80 -max_num_threads=1024 -model=unknown -thread_warp_size=32", [-1, 16, 64, 49152, 2147483647, 1024, 8, 32], "", 0, []], [[], [["FU", 2, [0, 1]], ["SP", 2, 0, 240, [1], 1], ["AN", 2, 0, 5], ["AN", 2, 1, 6], ["FU", 1, [0, 1]], ["SP", 1, 0, 240, [48], 1], ["AN", 1, 0, 5], ["AN", 1, 1, 6], ["PR", 1, 0, "auto_unroll_max_step$16"]]]], "r": [[8.11309e-06, 8.1325e-06, 8.13313e-06], 0, 15.9023, 1681114978], "v": "v0.6"}
{"i": [["[\"reduce_mean\", 14, 14, 240]", "cuda -keys=cuda,gpu -arch=sm_80 -max_num_threads=1024 -model=unknown -thread_warp_size=32", [-1, 16, 64, 49152, 2147483647, 1024, 8, 32], "", 0, []], [[], [["FU", 2, [0, 1]], ["SP", 2, 0, 240, [2], 1], ["AN", 2, 0, 5], ["AN", 2, 1, 6], ["FU", 1, [0, 1]], ["SP", 1, 0, 240, [32], 1], ["AN", 1, 0, 5], ["AN", 1, 1, 6], ["PR", 1, 0, "auto_unroll_max_step$16"]]]], "r": [[8.82849e-06, 8.85994e-06, 8.86128e-06], 0, 4.10438, 1681114966], "v": "v0.6"}
{"i": [["[\"reduce_mean\", 14, 14, 240]", "cuda -keys=cuda,gpu -arch=sm_80 -max_num_threads=1024 -model=unknown -thread_warp_size=32", [-1, 16, 64, 49152, 2147483647, 1024, 8, 32], "", 0, []], [[], [["FU", 1, [2, 3]], ["SP", 2, 1, 240, [30], 1], ["AN", 2, 2, 6], ["FSP", 1, 2, 1, 1], ["AN", 1, 3, 6], ["CA", 1, 2, 1], ["FU", 2, [0, 1]], ["AN", 2, 0, 5], ["PR", 1, 0, "auto_unroll_max_step$16"]]]], "r": [[9.75959e-06, 9.77134e-06, 9.76253e-06], 0, 7.18431, 1681114969], "v": "v0.6"}
{"i": [["[\"reduce_mean\", 14, 14, 240]", "cuda -keys=cuda,gpu -arch=sm_80 -max_num_threads=1024 -model=unknown -thread_warp_size=32", [-1, 16, 64, 49152, 2147483647, 1024, 8, 32], "", 0, []], [[], [["FU", 2, [0, 1]], ["SP", 2, 0, 240, [32], 1], ["AN", 2, 0, 5], ["AN", 2, 1, 6], ["FU", 1, [0, 1]], ["SP", 1, 0, 240, [30], 1], ["AN", 1, 0, 5], ["AN", 1, 1, 6], ["PR", 1, 0, "auto_unroll_max_step$0"]]]], "r": [[7.49772e-06, 7.50447e-06, 7.49772e-06], 0, 11.9408, 1681114974], "v": "v0.6"}
{"i": [["[\"reduce_mean\", 14, 14, 240]", "cuda -keys=cuda,gpu -arch=sm_80 -max_num_threads=1024 -model=unknown -thread_warp_size=32", [-1, 16, 64, 49152, 2147483647, 1024, 8, 32], "", 0, []], [[], [["FU", 2, [0, 1]], ["SP", 2, 0, 240, [12], 1], ["AN", 2, 0, 5], ["AN", 2, 1, 6], ["FU", 1, [0, 1]], ["SP", 1, 0, 240, [1], 1], ["AN", 1, 0, 5], ["AN", 1, 1, 6], ["PR", 1, 0, "auto_unroll_max_step$16"]]]], "r": [[8.73546e-06, 8.70065e-06, 8.69865e-06], 0, 15.8284, 1681114978], "v": "v0.6"}
{"i": [["[\"reduce_mean\", 14, 14, 240]", "cuda -keys=cuda,gpu -arch=sm_80 -max_num_threads=1024 -model=unknown -thread_warp_size=32", [-1, 16, 64, 49152, 2147483647, 1024, 8, 32], "", 0, []], [[], [["FU", 2, [0, 1]], ["SP", 2, 0, 240, [6], 1], ["AN", 2, 0, 5], ["AN", 2, 1, 6], ["FU", 1, [0, 1]], ["SP", 1, 0, 240, [2], 1], ["AN", 1, 0, 5], ["AN", 1, 1, 6], ["PR", 1, 0, "auto_unroll_max_step$64"]]]], "r": [[7.63775e-06, 7.65814e-06, 7.65989e-06], 0, 15.8051, 1681114978], "v": "v0.6"}
{"i": [["[\"reduce_mean\", 14, 14, 240]", "cuda -keys=cuda,gpu -arch=sm_80 -max_num_threads=1024 -model=unknown -thread_warp_size=32", [-1, 16, 64, 49152, 2147483647, 1024, 8, 32], "", 0, []], [[], [["FU", 2, [0, 1]], ["SP", 2, 0, 240, [1], 1], ["AN", 2, 0, 5], ["AN", 2, 1, 6], ["FU", 1, [0, 1]], ["SP", 1, 0, 240, [24], 1], ["AN", 1, 0, 5], ["AN", 1, 1, 6], ["PR", 1, 0, "auto_unroll_max_step$512"]]]], "r": [[7.41744e-06, 7.36674e-06, 7.36382e-06], 0, 15.8006, 1681114979], "v": "v0.6"}
{"i": [["[\"reduce_mean\", 14, 14, 240]", "cuda -keys=cuda,gpu -arch=sm_80 -max_num_threads=1024 -model=unknown -thread_warp_size=32", [-1, 16, 64, 49152, 2147483647, 1024, 8, 32], "", 0, []], [[], [["FU", 2, [0, 1]], ["SP", 2, 0, 240, [12], 1], ["AN", 2, 0, 5], ["AN", 2, 1, 6], ["FU", 1, [0, 1]], ["SP", 1, 0, 240, [2], 1], ["AN", 1, 0, 5], ["AN", 1, 1, 6], ["PR", 1, 0, "auto_unroll_max_step$512"]]]], "r": [[7.46582e-06, 7.46523e-06, 7.47048e-06], 0, 15.8639, 1681114979], "v": "v0.6"}
{"i": [["[\"reduce_mean\", 14, 14, 240]", "cuda -keys=cuda,gpu -arch=sm_80 -max_num_threads=1024 -model=unknown -thread_warp_size=32", [-1, 16, 64, 49152, 2147483647, 1024, 8, 32], "", 0, []], [[], [["FU", 2, [0, 1]], ["SP", 2, 0, 240, [2], 1], ["AN", 2, 0, 5], ["AN", 2, 1, 6], ["FU", 1, [0, 1]], ["SP", 1, 0, 240, [15], 1], ["AN", 1, 0, 5], ["AN", 1, 1, 6], ["PR", 1, 0, "auto_unroll_max_step$512"]]]], "r": [[7.29505e-06, 7.33119e-06, 7.32886e-06], 0, 15.7417, 1681114980], "v": "v0.6"}
{"i": [["[\"reduce_mean\", 14, 14, 240]", "cuda -keys=cuda,gpu -arch=sm_80 -max_num_threads=1024 -model=unknown -thread_warp_size=32", [-1, 16, 64, 49152, 2147483647, 1024, 8, 32], "", 0, []], [[], [["FU", 1, [2, 3]], ["SP", 2, 1, 240, [1], 1], ["AN", 2, 2, 6], ["FSP", 1, 2, 1, 1], ["AN", 1, 3, 6], ["CA", 1, 2, 1], ["FU", 2, [0, 1]], ["AN", 2, 0, 5], ["PR", 1, 0, "auto_unroll_max_step$1024"]]]], "r": [[5.19347e-06, 5.20798e-06, 5.20526e-06], 0, 15.9082, 1681114980], "v": "v0.6"}
{"i": [["[\"reduce_mean\", 14, 14, 240]", "cuda -keys=cuda,gpu -arch=sm_80 -max_num_threads=1024 -model=unknown -thread_warp_size=32", [-1, 16, 64, 49152, 2147483647, 1024, 8, 32], "", 0, []], [[], [["FU", 2, [0, 1]], ["SP", 2, 0, 240, [8], 1], ["AN", 2, 0, 5], ["AN", 2, 1, 6], ["FU", 1, [0, 1]], ["SP", 1, 0, 240, [32], 1], ["AN", 1, 0, 5], ["AN", 1, 1, 6], ["PR", 1, 0, "auto_unroll_max_step$64"]]]], "r": [[9.16349e-06, 9.18698e-06, 9.18836e-06], 0, 15.7812, 1681114980], "v": "v0.6"}
{"i": [["[\"reduce_mean\", 14, 14, 240]", "cuda -keys=cuda,gpu -arch=sm_80 -max_num_threads=1024 -model=unknown -thread_warp_size=32", [-1, 16, 64, 49152, 2147483647, 1024, 8, 32], "", 0, []], [[], [["FU", 2, [0, 1]], ["SP", 2, 0, 240, [20], 1], ["AN", 2, 0, 5], ["AN", 2, 1, 6], ["FU", 1, [0, 1]], ["SP", 1, 0, 240, [8], 1], ["AN", 1, 0, 5], ["AN", 1, 1, 6], ["PR", 1, 0, "auto_unroll_max_step$16"]]]], "r": [[7.10797e-06, 7.12429e-06, 7.12545e-06], 0, 15.7588, 1681114981], "v": "v0.6"}
{"i": [["[\"reduce_mean\", 14, 14, 240]", "cuda -keys=cuda,gpu -arch=sm_80 -max_num_threads=1024 -model=unknown -thread_warp_size=32", [-1, 16, 64, 49152, 2147483647, 1024, 8, 32], "", 0, []], [[], [["FU", 2, [0, 1]], ["SP", 2, 0, 240, [4], 1], ["AN", 2, 0, 5], ["AN", 2, 1, 6], ["FU", 1, [0, 1]], ["SP", 1, 0, 240, [32], 1], ["AN", 1, 0, 5], ["AN", 1, 1, 6], ["PR", 1, 0, "auto_unroll_max_step$512"]]]], "r": [[9.1628e-06, 9.17592e-06, 9.17592e-06], 0, 15.739, 1681114981], "v": "v0.6"}
{"i": [["[\"reduce_mean\", 14, 14, 240]", "cuda -keys=cuda,gpu -arch=sm_80 -max_num_threads=1024 -model=unknown -thread_warp_size=32", [-1, 16, 64, 49152, 2147483647, 1024, 8, 32], "", 0, []], [[], [["FU", 2, [0, 1]], ["SP", 2, 0, 240, [3], 1], ["AN", 2, 0, 5], ["AN", 2, 1, 6], ["FU", 1, [0, 1]], ["SP", 1, 0, 240, [10], 1], ["AN", 1, 0, 5], ["AN", 1, 1, 6], ["PR", 1, 0, "auto_unroll_max_step$1024"]]]], "r": [[7.43706e-06, 7.44605e-06, 7.44717e-06], 0, 15.7657, 1681114981], "v": "v0.6"}
{"i": [["[\"reduce_mean\", 14, 14, 240]", "cuda -keys=cuda,gpu -arch=sm_80 -max_num_threads=1024 -model=unknown -thread_warp_size=32", [-1, 16, 64, 49152, 2147483647, 1024, 8, 32], "", 0, []], [[], [["FU", 2, [0, 1]], ["SP", 2, 0, 240, [1], 1], ["AN", 2, 0, 5], ["AN", 2, 1, 6], ["FU", 1, [0, 1]], ["SP", 1, 0, 240, [1], 1], ["AN", 1, 0, 5], ["AN", 1, 1, 6], ["PR", 1, 0, "auto_unroll_max_step$512"]]]], "r": [[9.02253e-06, 9.05362e-06, 9.0557e-06], 0, 15.7058, 1681114982], "v": "v0.6"}
{"i": [["[\"reduce_mean\", 14, 14, 240]", "cuda -keys=cuda,gpu -arch=sm_80 -max_num_threads=1024 -model=unknown -thread_warp_size=32", [-1, 16, 64, 49152, 2147483647, 1024, 8, 32], "", 0, []], [[], [["FU", 2, [0, 1]], ["SP", 2, 0, 240, [1], 1], ["AN", 2, 0, 5], ["AN", 2, 1, 6], ["FU", 1, [0, 1]], ["SP", 1, 0, 240, [6], 1], ["AN", 1, 0, 5], ["AN", 1, 1, 6], ["PR", 1, 0, "auto_unroll_max_step$16"]]]], "r": [[7.33527e-06, 7.34925e-06, 7.35159e-06], 0, 15.7504, 1681114982], "v": "v0.6"}
{"i": [["[\"reduce_mean\", 14, 14, 240]", "cuda -keys=cuda,gpu -arch=sm_80 -max_num_threads=1024 -model=unknown -thread_warp_size=32", [-1, 16, 64, 49152, 2147483647, 1024, 8, 32], "", 0, []], [[], [["FU", 2, [0, 1]], ["SP", 2, 0, 240, [40], 1], ["AN", 2, 0, 5], ["AN", 2, 1, 6], ["FU", 1, [0, 1]], ["SP", 1, 0, 240, [12], 1], ["AN", 1, 0, 5], ["AN", 1, 1, 6], ["PR", 1, 0, "auto_unroll_max_step$512"]]]], "r": [[7.56457e-06, 7.58367e-06, 7.58479e-06], 0, 15.7925, 1681114983], "v": "v0.6"}
{"i": [["[\"reduce_mean\", 14, 14, 240]", "cuda -keys=cuda,gpu -arch=sm_80 -max_num_threads=1024 -model=unknown -thread_warp_size=32", [-1, 16, 64, 49152, 2147483647, 1024, 8, 32], "", 0, []], [[], [["FU", 2, [0, 1]], ["SP", 2, 0, 240, [2], 1], ["AN", 2, 0, 5], ["AN", 2, 1, 6], ["FU", 1, [0, 1]], ["SP", 1, 0, 240, [15], 1], ["AN", 1, 0, 5], ["AN", 1, 1, 6], ["PR", 1, 0, "auto_unroll_max_step$16"]]]], "r": [[7.23878e-06, 7.25675e-06, 7.25731e-06], 0, 15.7181, 1681114983], "v": "v0.6"}
{"i": [["[\"reduce_mean\", 14, 14, 240]", "cuda -keys=cuda,gpu -arch=sm_80 -max_num_threads=1024 -model=unknown -thread_warp_size=32", [-1, 16, 64, 49152, 2147483647, 1024, 8, 32], "", 0, []], [[], [["FU", 1, [2, 3]], ["SP", 2, 1, 240, [32], 1], ["AN", 2, 2, 6], ["FSP", 1, 2, 1, 1], ["AN", 1, 3, 6], ["CA", 1, 2, 1], ["FU", 2, [0, 1]], ["AN", 2, 0, 5], ["PR", 1, 0, "auto_unroll_max_step$16"]]]], "r": [[1.08028e-05, 1.08171e-05, 1.08044e-05], 0, 15.7363, 1681114983], "v": "v0.6"}
{"i": [["[\"reduce_mean\", 14, 14, 240]", "cuda -keys=cuda,gpu -arch=sm_80 -max_num_threads=1024 -model=unknown -thread_warp_size=32", [-1, 16, 64, 49152, 2147483647, 1024, 8, 32], "", 0, []], [[], [["FU", 2, [0, 1]], ["SP", 2, 0, 240, [1], 1], ["AN", 2, 0, 5], ["AN", 2, 1, 6], ["FU", 1, [0, 1]], ["SP", 1, 0, 240, [2], 1], ["AN", 1, 0, 5], ["AN", 1, 1, 6], ["PR", 1, 0, "auto_unroll_max_step$0"]]]], "r": [[7.84127e-06, 7.84127e-06, 7.83689e-06], 0, 15.7708, 1681114984], "v": "v0.6"}
{"i": [["[\"reduce_mean\", 14, 14, 240]", "cuda -keys=cuda,gpu -arch=sm_80 -max_num_threads=1024 -model=unknown -thread_warp_size=32", [-1, 16, 64, 49152, 2147483647, 1024, 8, 32], "", 0, []], [[], [["FU", 2, [0, 1]], ["SP", 2, 0, 240, [8], 1], ["AN", 2, 0, 5], ["AN", 2, 1, 6], ["FU", 1, [0, 1]], ["SP", 1, 0, 240, [48], 1], ["AN", 1, 0, 5], ["AN", 1, 1, 6], ["PR", 1, 0, "auto_unroll_max_step$16"]]]], "r": [[8.27625e-06, 8.29829e-06, 8.30283e-06], 0, 15.7344, 1681114984], "v": "v0.6"}
{"i": [["[\"reduce_mean\", 14, 14, 240]", "cuda -keys=cuda,gpu -arch=sm_80 -max_num_threads=1024 -model=unknown -thread_warp_size=32", [-1, 16, 64, 49152, 2147483647, 1024, 8, 32], "", 0, []], [[], [["FU", 1, [2, 3]], ["SP", 2, 1, 240, [32], 1], ["AN", 2, 2, 6], ["FSP", 1, 2, 1, 1], ["AN", 1, 3, 6], ["CA", 1, 2, 1], ["FU", 2, [0, 1]], ["AN", 2, 0, 5], ["PR", 1, 0, "auto_unroll_max_step$64"]]]], "r": [[1.06171e-05, 1.06303e-05, 1.06179e-05], 0, 15.9071, 1681114985], "v": "v0.6"}
{"i": [["[\"reduce_mean\", 14, 14, 240]", "cuda -keys=cuda,gpu -arch=sm_80 -max_num_threads=1024 -model=unknown -thread_warp_size=32", [-1, 16, 64, 49152, 2147483647, 1024, 8, 32], "", 0, []], [[], [["FU", 2, [0, 1]], ["SP", 2, 0, 240, [2], 1], ["AN", 2, 0, 5], ["AN", 2, 1, 6], ["FU", 1, [0, 1]], ["SP", 1, 0, 240, [60], 1], ["AN", 1, 0, 5], ["AN", 1, 1, 6], ["PR", 1, 0, "auto_unroll_max_step$0"]]]], "r": [[8.42532e-06, 8.42985e-06, 8.43115e-06], 0, 15.9558, 1681114985], "v": "v0.6"}
{"i": [["[\"reduce_mean\", 14, 14, 240]", "cuda -keys=cuda,gpu -arch=sm_80 -max_num_threads=1024 -model=unknown -thread_warp_size=32", [-1, 16, 64, 49152, 2147483647, 1024, 8, 32], "", 0, []], [[], [["FU", 2, [0, 1]], ["SP", 2, 0, 240, [15], 1], ["AN", 2, 0, 5], ["AN", 2, 1, 6], ["FU", 1, [0, 1]], ["SP", 1, 0, 240, [1], 1], ["AN", 1, 0, 5], ["AN", 1, 1, 6], ["PR", 1, 0, "auto_unroll_max_step$0"]]]], "r": [[9.00802e-06, 9.03428e-06, 9.03428e-06], 0, 15.8247, 1681114985], "v": "v0.6"}
{"i": [["[\"reduce_mean\", 14, 14, 240]", "cuda -keys=cuda,gpu -arch=sm_80 -max_num_threads=1024 -model=unknown -thread_warp_size=32", [-1, 16, 64, 49152, 2147483647, 1024, 8, 32], "", 0, []], [[], [["FU", 1, [2, 3]], ["SP", 2, 1, 240, [4], 1], ["AN", 2, 2, 6], ["FSP", 1, 2, 1, 1], ["AN", 1, 3, 6], ["CA", 1, 2, 1], ["FU", 2, [0, 1]], ["AN", 2, 0, 5], ["PR", 1, 0, "auto_unroll_max_step$64"]]]], "r": [[4.16944e-06, 4.18174e-06, 4.17887e-06], 0, 2.04934, 1681115016], "v": "v0.6"}
{"i": [["[\"reduce_mean\", 14, 14, 240]", "cuda -keys=cuda,gpu -arch=sm_80 -max_num_threads=1024 -model=unknown -thread_warp_size=32", [-1, 16, 64, 49152, 2147483647, 1024, 8, 32], "", 0, []], [[], [["FU", 1, [2, 3]], ["SP", 2, 1, 240, [2], 1], ["AN", 2, 2, 6], ["FSP", 1, 2, 1, 1], ["AN", 1, 3, 6], ["CA", 1, 2, 1], ["FU", 2, [0, 1]], ["AN", 2, 0, 5], ["PR", 1, 0, "auto_unroll_max_step$64"]]]], "r": [[4.21146e-06, 4.22274e-06, 4.21963e-06], 0, 3.42485, 1681115018], "v": "v0.6"}
{"i": [["[\"reduce_mean\", 14, 14, 240]", "cuda -keys=cuda,gpu -arch=sm_80 -max_num_threads=1024 -model=unknown -thread_warp_size=32", [-1, 16, 64, 49152, 2147483647, 1024, 8, 32], "", 0, []], [[], [["FU", 1, [2, 3]], ["SP", 2, 1, 240, [3], 1], ["AN", 2, 2, 6], ["FSP", 1, 2, 1, 1], ["AN", 1, 3, 6], ["CA", 1, 2, 1], ["FU", 2, [0, 1]], ["AN", 2, 0, 5], ["PR", 1, 0, "auto_unroll_max_step$64"]]]], "r": [[5.56951e-06, 5.58187e-06, 5.58139e-06], 0, 2.69705, 1681115017], "v": "v0.6"}
{"i": [["[\"reduce_mean\", 14, 14, 240]", "cuda -keys=cuda,gpu -arch=sm_80 -max_num_threads=1024 -model=unknown -thread_warp_size=32", [-1, 16, 64, 49152, 2147483647, 1024, 8, 32], "", 0, []], [[], [["FU", 1, [2, 3]], ["SP", 2, 1, 240, [2], 1], ["AN", 2, 2, 6], ["FSP", 1, 2, 1, 1], ["AN", 1, 3, 6], ["CA", 1, 2, 1], ["FU", 2, [0, 1]], ["AN", 2, 0, 5], ["PR", 1, 0, "auto_unroll_max_step$0"]]]], "r": [[4.18114e-06, 4.19397e-06, 4.19241e-06], 0, 3.80227, 1681115019], "v": "v0.6"}
{"i": [["[\"reduce_mean\", 14, 14, 240]", "cuda -keys=cuda,gpu -arch=sm_80 -max_num_threads=1024 -model=unknown -thread_warp_size=32", [-1, 16, 64, 49152, 2147483647, 1024, 8, 32], "", 0, []], [[], [["FU", 1, [2, 3]], ["SP", 2, 1, 240, [3], 1], ["AN", 2, 2, 6], ["FSP", 1, 2, 1, 1], ["AN", 1, 3, 6], ["CA", 1, 2, 1], ["FU", 2, [0, 1]], ["AN", 2, 0, 5], ["PR", 1, 0, "auto_unroll_max_step$16"]]]], "r": [[5.78857e-06, 5.8014e-06, 5.80045e-06], 0, 5.17449, 1681115020], "v": "v0.6"}
{"i": [["[\"reduce_mean\", 14, 14, 240]", "cuda -keys=cuda,gpu -arch=sm_80 -max_num_threads=1024 -model=unknown -thread_warp_size=32", [-1, 16, 64, 49152, 2147483647, 1024, 8, 32], "", 0, []], [[], [["FU", 1, [2, 3]], ["SP", 2, 1, 240, [3], 1], ["AN", 2, 2, 6], ["FSP", 1, 2, 1, 1], ["AN", 1, 3, 6], ["CA", 1, 2, 1], ["FU", 2, [0, 1]], ["AN", 2, 0, 5], ["PR", 1, 0, "auto_unroll_max_step$0"]]]], "r": [[5.79665e-06, 5.81043e-06, 5.80853e-06], 0, 3.27008, 1681115018], "v": "v0.6"}
{"i": [["[\"reduce_mean\", 14, 14, 240]", "cuda -keys=cuda,gpu -arch=sm_80 -max_num_threads=1024 -model=unknown -thread_warp_size=32", [-1, 16, 64, 49152, 2147483647, 1024, 8, 32], "", 0, []], [[], [["FU", 1, [2, 3]], ["SP", 2, 1, 240, [6], 1], ["AN", 2, 2, 6], ["FSP", 1, 2, 1, 1], ["AN", 1, 3, 6], ["CA", 1, 2, 1], ["FU", 2, [0, 1]], ["AN", 2, 0, 5], ["PR", 1, 0, "auto_unroll_max_step$64"]]]], "r": [[4.848e-06, 4.86195e-06, 4.86113e-06], 0, 4.72607, 1681115019], "v": "v0.6"}
{"i": [["[\"reduce_mean\", 14, 14, 240]", "cuda -keys=cuda,gpu -arch=sm_80 -max_num_threads=1024 -model=unknown -thread_warp_size=32", [-1, 16, 64, 49152, 2147483647, 1024, 8, 32], "", 0, []], [[], [["FU", 1, [2, 3]], ["SP", 2, 1, 240, [5], 1], ["AN", 2, 2, 6], ["FSP", 1, 2, 1, 1], ["AN", 1, 3, 6], ["CA", 1, 2, 1], ["FU", 2, [0, 1]], ["AN", 2, 0, 5], ["PR", 1, 0, "auto_unroll_max_step$64"]]]], "r": [[5.13859e-06, 5.14993e-06, 5.14948e-06], 0, 9.86718, 1681115025], "v": "v0.6"}
{"i": [["[\"reduce_mean\", 14, 14, 240]", "cuda -keys=cuda,gpu -arch=sm_80 -max_num_threads=1024 -model=unknown -thread_warp_size=32", [-1, 16, 64, 49152, 2147483647, 1024, 8, 32], "", 0, []], [[], [["FU", 1, [2, 3]], ["SP", 2, 1, 240, [1], 1], ["AN", 2, 2, 6], ["FSP", 1, 2, 1, 1], ["AN", 1, 3, 6], ["CA", 1, 2, 1], ["FU", 2, [0, 1]], ["AN", 2, 0, 5], ["PR", 1, 0, "auto_unroll_max_step$16"]]]], "r": [[5.97607e-06, 5.98203e-06, 5.98203e-06], 0, 8.47857, 1681115024], "v": "v0.6"}
{"i": [["[\"reduce_mean\", 14, 14, 240]", "cuda -keys=cuda,gpu -arch=sm_80 -max_num_threads=1024 -model=unknown -thread_warp_size=32", [-1, 16, 64, 49152, 2147483647, 1024, 8, 32], "", 0, []], [[], [["FU", 1, [2, 3]], ["SP", 2, 1, 240, [5], 1], ["AN", 2, 2, 6], ["FSP", 1, 2, 1, 1], ["AN", 1, 3, 6], ["CA", 1, 2, 1], ["FU", 2, [0, 1]], ["AN", 2, 0, 5], ["PR", 1, 0, "auto_unroll_max_step$16"]]]], "r": [[8.60354e-06, 8.61651e-06, 8.61586e-06], 0, 5.7005, 1681115020], "v": "v0.6"}
{"i": [["[\"reduce_mean\", 14, 14, 240]", "cuda -keys=cuda,gpu -arch=sm_80 -max_num_threads=1024 -model=unknown -thread_warp_size=32", [-1, 16, 64, 49152, 2147483647, 1024, 8, 32], "", 0, []], [[], [["FU", 1, [2, 3]], ["SP", 2, 1, 240, [8], 1], ["AN", 2, 2, 6], ["FSP", 1, 2, 1, 1], ["AN", 1, 3, 6], ["CA", 1, 2, 1], ["FU", 2, [0, 1]], ["AN", 2, 0, 5], ["PR", 1, 0, "auto_unroll_max_step$64"]]]], "r": [[5.18697e-06, 5.19864e-06, 5.19648e-06], 0, 2.95486, 1681115018], "v": "v0.6"}
{"i": [["[\"reduce_mean\", 14, 14, 240]", "cuda -keys=cuda,gpu -arch=sm_80 -max_num_threads=1024 -model=unknown -thread_warp_size=32", [-1, 16, 64, 49152, 2147483647, 1024, 8, 32], "", 0, []], [[], [["FU", 1, [2, 3]], ["SP", 2, 1, 240, [5], 1], ["AN", 2, 2, 6], ["FSP", 1, 2, 1, 1], ["AN", 1, 3, 6], ["CA", 1, 2, 1], ["FU", 2, [0, 1]], ["AN", 2, 0, 5], ["PR", 1, 0, "auto_unroll_max_step$0"]]]], "r": [[8.61967e-06, 8.63306e-06, 8.62502e-06], 0, 6.98322, 1681115022], "v": "v0.6"}
{"i": [["[\"reduce_mean\", 14, 14, 240]", "cuda -keys=cuda,gpu -arch=sm_80 -max_num_threads=1024 -model=unknown -thread_warp_size=32", [-1, 16, 64, 49152, 2147483647, 1024, 8, 32], "", 0, []], [[], [["FU", 1, [2, 3]], ["SP", 2, 1, 240, [6], 1], ["AN", 2, 2, 6], ["FSP", 1, 2, 1, 1], ["AN", 1, 3, 6], ["CA", 1, 2, 1], ["FU", 2, [0, 1]], ["AN", 2, 0, 5], ["PR", 1, 0, "auto_unroll_max_step$16"]]]], "r": [[8.24336e-06, 8.24461e-06, 8.24523e-06], 0, 4.31519, 1681115019], "v": "v0.6"}
{"i": [["[\"reduce_mean\", 14, 14, 240]", "cuda -keys=cuda,gpu -arch=sm_80 -max_num_threads=1024 -model=unknown -thread_warp_size=32", [-1, 16, 64, 49152, 2147483647, 1024, 8, 32], "", 0, []], [[], [["FU", 1, [2, 3]], ["SP", 2, 1, 240, [6], 1], ["AN", 2, 2, 6], ["FSP", 1, 2, 1, 1], ["AN", 1, 3, 6], ["CA", 1, 2, 1], ["FU", 2, [0, 1]], ["AN", 2, 0, 5], ["PR", 1, 0, "auto_unroll_max_step$0"]]]], "r": [[8.0209e-06, 8.03257e-06, 8.02738e-06], 0, 13.656, 1681115029], "v": "v0.6"}
{"i": [["[\"reduce_mean\", 14, 14, 240]", "cuda -keys=cuda,gpu -arch=sm_80 -max_num_threads=1024 -model=unknown -thread_warp_size=32", [-1, 16, 64, 49152, 2147483647, 1024, 8, 32], "", 0, []], [[], [["FU", 1, [2, 3]], ["SP", 2, 1, 240, [8], 1], ["AN", 2, 2, 6], ["FSP", 1, 2, 1, 1], ["AN", 1, 3, 6], ["CA", 1, 2, 1], ["FU", 2, [0, 1]], ["AN", 2, 0, 5], ["PR", 1, 0, "auto_unroll_max_step$16"]]]], "r": [[6.93657e-06, 6.95062e-06, 6.94949e-06], 0, 13.0196, 1681115028], "v": "v0.6"}
{"i": [["[\"reduce_mean\", 14, 14, 240]", "cuda -keys=cuda,gpu -arch=sm_80 -max_num_threads=1024 -model=unknown -thread_warp_size=32", [-1, 16, 64, 49152, 2147483647, 1024, 8, 32], "", 0, []], [[], [["FU", 1, [2, 3]], ["SP", 2, 1, 240, [15], 1], ["AN", 2, 2, 6], ["FSP", 1, 2, 1, 1], ["AN", 1, 3, 6], ["CA", 1, 2, 1], ["FU", 2, [0, 1]], ["AN", 2, 0, 5], ["PR", 1, 0, "auto_unroll_max_step$64"]]]], "r": [[7.89952e-06, 7.9014e-06, 7.90014e-06], 0, 10.046, 1681115025], "v": "v0.6"}
