python/models/efficientnet/kernel_configs/efficient_reudce_mean_112_112_32.log
{"i": [["[\"reduce_mean\", 112, 112, 32]", "cuda -keys=cuda,gpu -arch=sm_80 -max_num_threads=1024 -model=unknown -thread_warp_size=32", [-1, 16, 64, 49152, 2147483647, 1024, 8, 32], "", 0, []], [[], [["FU", 1, [2, 3]], ["SP", 2, 1, 32, [8], 1], ["AN", 2, 2, 6], ["FSP", 1, 2, 1, 1], ["AN", 1, 3, 6], ["CA", 1, 2, 1], ["FU", 2, [0, 1]], ["AN", 2, 0, 5], ["PR", 1, 0, "auto_unroll_max_step$64"]]]], "r": [[0.000239006, 0.000238982, 0.000239128], 0, 3.8021, 1681111381], "v": "v0.6"}
{"i": [["[\"reduce_mean\", 112, 112, 32]", "cuda -keys=cuda,gpu -arch=sm_80 -max_num_threads=1024 -model=unknown -thread_warp_size=32", [-1, 16, 64, 49152, 2147483647, 1024, 8, 32], "", 0, []], [[], [["FU", 1, [2, 3]], ["SP", 2, 1, 32, [1], 1], ["AN", 2, 2, 6], ["FSP", 1, 2, 1, 1], ["AN", 1, 3, 6], ["CA", 1, 2, 1], ["FU", 2, [0, 1]], ["AN", 2, 0, 5], ["PR", 1, 0, "auto_unroll_max_step$512"]]]], "r": [[0.000208427, 0.000208448, 0.000208363], 0, 7.39333, 1681111385], "v": "v0.6"}
{"i": [["[\"reduce_mean\", 112, 112, 32]", "cuda -keys=cuda,gpu -arch=sm_80 -max_num_threads=1024 -model=unknown -thread_warp_size=32", [-1, 16, 64, 49152, 2147483647, 1024, 8, 32], "", 0, []], [[], [["FU", 1, [2, 3]], ["SP", 2, 1, 32, [2], 1], ["AN", 2, 2, 6], ["FSP", 1, 2, 1, 1], ["AN", 1, 3, 6], ["CA", 1, 2, 1], ["FU", 2, [0, 1]], ["AN", 2, 0, 5], ["PR", 1, 0, "auto_unroll_max_step$16"]]]], "r": [[0.000207952, 0.000208005, 0.000208045], 0, 4.81282, 1681111382], "v": "v0.6"}
{"i": [["[\"reduce_mean\", 112, 112, 32]", "cuda -keys=cuda,gpu -arch=sm_80 -max_num_threads=1024 -model=unknown -thread_warp_size=32", [-1, 16, 64, 49152, 2147483647, 1024, 8, 32], "", 0, []], [[], [["FU", 1, [2, 3]], ["SP", 2, 1, 32, [32], 1], ["AN", 2, 2, 6], ["FSP", 1, 2, 1, 1], ["AN", 1, 3, 6], ["CA", 1, 2, 1], ["FU", 2, [0, 1]], ["AN", 2, 0, 5], ["PR", 1, 0, "auto_unroll_max_step$1024"]]]], "r": [[0.000331392, 0.000331499, 0.000331456], 0, 7.77541, 1681111384], "v": "v0.6"}
{"i": [["[\"reduce_mean\", 112, 112, 32]", "cuda -keys=cuda,gpu -arch=sm_80 -max_num_threads=1024 -model=unknown -thread_warp_size=32", [-1, 16, 64, 49152, 2147483647, 1024, 8, 32], "", 0, []], [[], [["FU", 2, [0, 1]], ["AN", 2, 0, 6], ["FU", 1, [0, 1]], ["AN", 1, 0, 6], ["PR", 1, 0, "auto_unroll_max_step$16"]]]], "r": [[0.000101441, 0.000101447, 0.000101434], 0, 6.32413, 1681111384], "v": "v0.6"}
{"i": [["[\"reduce_mean\", 112, 112, 32]", "cuda -keys=cuda,gpu -arch=sm_80 -max_num_threads=1024 -model=unknown -thread_warp_size=32", [-1, 16, 64, 49152, 2147483647, 1024, 8, 32], "", 0, []], [[], [["FU", 1, [2, 3]], ["SP", 2, 1, 32, [32], 1], ["AN", 2, 2, 6], ["FSP", 1, 2, 1, 1], ["AN", 1, 3, 6], ["CA", 1, 2, 1], ["FU", 2, [0, 1]], ["AN", 2, 0, 5], ["PR", 1, 0, "auto_unroll_max_step$64"]]]], "r": [[0.000349714, 0.00034982, 0.000349855], 0, 5.01099, 1681111383], "v": "v0.6"}
{"i": [["[\"reduce_mean\", 112, 112, 32]", "cuda -keys=cuda,gpu -arch=sm_80 -max_num_threads=1024 -model=unknown -thread_warp_size=32", [-1, 16, 64, 49152, 2147483647, 1024, 8, 32], "", 0, []], [[], [["FU", 1, [2, 3]], ["SP", 2, 1, 32, [32], 1], ["AN", 2, 2, 6], ["FSP", 1, 2, 1, 1], ["AN", 1, 3, 6], ["CA", 1, 2, 1], ["FU", 2, [0, 1]], ["AN", 2, 0, 5], ["PR", 1, 0, "auto_unroll_max_step$16"]]]], "r": [[0.000349784, 0.00034982, 0.000349714], 0, 4.49953, 1681111382], "v": "v0.6"}
{"i": [["[\"reduce_mean\", 112, 112, 32]", "cuda -keys=cuda,gpu -arch=sm_80 -max_num_threads=1024 -model=unknown -thread_warp_size=32", [-1, 16, 64, 49152, 2147483647, 1024, 8, 32], "", 0, []], [[], [["FU", 1, [2, 3]], ["SP", 2, 1, 32, [2], 1], ["AN", 2, 2, 6], ["FSP", 1, 2, 1, 1], ["AN", 1, 3, 6], ["CA", 1, 2, 1], ["FU", 2, [0, 1]], ["AN", 2, 0, 5], ["PR", 1, 0, "auto_unroll_max_step$0"]]]], "r": [[0.000207726, 0.000207766, 0.000207766], 0, 1.31907, 1681111379], "v": "v0.6"}
{"i": [["[\"reduce_mean\", 112, 112, 32]", "cuda -keys=cuda,gpu -arch=sm_80 -max_num_threads=1024 -model=unknown -thread_warp_size=32", [-1, 16, 64, 49152, 2147483647, 1024, 8, 32], "", 0, []], [[], [["FU", 1, [2, 3]], ["SP", 2, 1, 32, [4], 1], ["AN", 2, 2, 6], ["FSP", 1, 2, 1, 1], ["AN", 1, 3, 6], ["CA", 1, 2, 1], ["FU", 2, [0, 1]], ["AN", 2, 0, 5], ["PR", 1, 0, "auto_unroll_max_step$64"]]]], "r": [[0.000222458, 0.000222504, 0.000222663], 0, 3.98744, 1681111382], "v": "v0.6"}
{"i": [["[\"reduce_mean\", 112, 112, 32]", "cuda -keys=cuda,gpu -arch=sm_80 -max_num_threads=1024 -model=unknown -thread_warp_size=32", [-1, 16, 64, 49152, 2147483647, 1024, 8, 32], "", 0, []], [[], [["FU", 1, [2, 3]], ["SP", 2, 1, 32, [1], 1], ["AN", 2, 2, 6], ["FSP", 1, 2, 1, 1], ["AN", 1, 3, 6], ["CA", 1, 2, 1], ["FU", 2, [0, 1]], ["AN", 2, 0, 5], ["PR", 1, 0, "auto_unroll_max_step$64"]]]], "r": [[0.000208045, 0.000208045, 0.000208071], 0, 5.84908, 1681111383], "v": "v0.6"}
{"i": [["[\"reduce_mean\", 112, 112, 32]", "cuda -keys=cuda,gpu -arch=sm_80 -max_num_threads=1024 -model=unknown -thread_warp_size=32", [-1, 16, 64, 49152, 2147483647, 1024, 8, 32], "", 0, []], [[], [["FU", 1, [2, 3]], ["SP", 2, 1, 32, [32], 1], ["AN", 2, 2, 6], ["FSP", 1, 2, 1, 1], ["AN", 1, 3, 6], ["CA", 1, 2, 1], ["FU", 2, [0, 1]], ["AN", 2, 0, 5], ["PR", 1, 0, "auto_unroll_max_step$512"]]]], "r": [[0.000331584, 0.000331584, 0.000331627], 0, 6.57071, 1681111383], "v": "v0.6"}
{"i": [["[\"reduce_mean\", 112, 112, 32]", "cuda -keys=cuda,gpu -arch=sm_80 -max_num_threads=1024 -model=unknown -thread_warp_size=32", [-1, 16, 64, 49152, 2147483647, 1024, 8, 32], "", 0, []], [[], [["FU", 1, [2, 3]], ["SP", 2, 1, 32, [4], 1], ["AN", 2, 2, 6], ["FSP", 1, 2, 1, 1], ["AN", 1, 3, 6], ["CA", 1, 2, 1], ["FU", 2, [0, 1]], ["AN", 2, 0, 5], ["PR", 1, 0, "auto_unroll_max_step$0"]]]], "r": [[0.000222572, 0.000222549, 0.000222595], 0, 8.15167, 1681111386], "v": "v0.6"}
{"i": [["[\"reduce_mean\", 112, 112, 32]", "cuda -keys=cuda,gpu -arch=sm_80 -max_num_threads=1024 -model=unknown -thread_warp_size=32", [-1, 16, 64, 49152, 2147483647, 1024, 8, 32], "", 0, []], [[], [["FU", 1, [2, 3]], ["SP", 2, 1, 32, [8], 1], ["AN", 2, 2, 6], ["FSP", 1, 2, 1, 1], ["AN", 1, 3, 6], ["CA", 1, 2, 1], ["FU", 2, [0, 1]], ["AN", 2, 0, 5], ["PR", 1, 0, "auto_unroll_max_step$1024"]]]], "r": [[0.000238982, 0.000239055, 0.000239153], 0, 1.83204, 1681111379], "v": "v0.6"}
{"i": [["[\"reduce_mean\", 112, 112, 32]", "cuda -keys=cuda,gpu -arch=sm_80 -max_num_threads=1024 -model=unknown -thread_warp_size=32", [-1, 16, 64, 49152, 2147483647, 1024, 8, 32], "", 0, []], [[], [["FU", 1, [2, 3]], ["SP", 2, 1, 32, [8], 1], ["AN", 2, 2, 6], ["FSP", 1, 2, 1, 1], ["AN", 1, 3, 6], ["CA", 1, 2, 1], ["FU", 2, [0, 1]], ["AN", 2, 0, 5], ["PR", 1, 0, "auto_unroll_max_step$512"]]]], "r": [[0.000239348, 0.00023925, 0.000239299], 0, 9.71485, 1681111387], "v": "v0.6"}
{"i": [["[\"reduce_mean\", 112, 112, 32]", "cuda -keys=cuda,gpu -arch=sm_80 -max_num_threads=1024 -model=unknown -thread_warp_size=32", [-1, 16, 64, 49152, 2147483647, 1024, 8, 32], "", 0, []], [[], [["FU", 1, [2, 3]], ["SP", 2, 1, 32, [16], 1], ["AN", 2, 2, 6], ["FSP", 1, 2, 1, 1], ["AN", 1, 3, 6], ["CA", 1, 2, 1], ["FU", 2, [0, 1]], ["AN", 2, 0, 5], ["PR", 1, 0, "auto_unroll_max_step$512"]]]], "r": [[0.000311477, 0.000311497, 0.000311457], 0, 1.5619, 1681111379], "v": "v0.6"}
{"i": [["[\"reduce_mean\", 112, 112, 32]", "cuda -keys=cuda,gpu -arch=sm_80 -max_num_threads=1024 -model=unknown -thread_warp_size=32", [-1, 16, 64, 49152, 2147483647, 1024, 8, 32], "", 0, []], [[], [["FU", 2, [0, 1]], ["AN", 2, 0, 6], ["FU", 1, [0, 1]], ["AN", 1, 0, 6], ["PR", 1, 0, "auto_unroll_max_step$0"]]]], "r": [[0.00010175, 0.00010175, 0.000101776], 0, 8.41119, 1681111386], "v": "v0.6"}
{"i": [["[\"reduce_mean\", 112, 112, 32]", "cuda -keys=cuda,gpu -arch=sm_80 -max_num_threads=1024 -model=unknown -thread_warp_size=32", [-1, 16, 64, 49152, 2147483647, 1024, 8, 32], "", 0, []], [[], [["FU", 1, [2, 3]], ["SP", 2, 1, 32, [1], 1], ["AN", 2, 2, 6], ["FSP", 1, 2, 1, 1], ["AN", 1, 3, 6], ["CA", 1, 2, 1], ["FU", 2, [0, 1]], ["AN", 2, 0, 5], ["PR", 1, 0, "auto_unroll_max_step$16"]]]], "r": [[0.000208258, 0.000208151, 0.000208151], 0, 7.62739, 1681111385], "v": "v0.6"}
{"i": [["[\"reduce_mean\", 112, 112, 32]", "cuda -keys=cuda,gpu -arch=sm_80 -max_num_threads=1024 -model=unknown -thread_warp_size=32", [-1, 16, 64, 49152, 2147483647, 1024, 8, 32], "", 0, []], [[], [["FU", 1, [2, 3]], ["SP", 2, 1, 32, [1], 1], ["AN", 2, 2, 6], ["FSP", 1, 2, 1, 1], ["AN", 1, 3, 6], ["CA", 1, 2, 1], ["FU", 2, [0, 1]], ["AN", 2, 0, 5], ["PR", 1, 0, "auto_unroll_max_step$0"]]]], "r": [[0.000208244, 0.000208218, 0.000208218], 0, 2.55041, 1681111380], "v": "v0.6"}
{"i": [["[\"reduce_mean\", 112, 112, 32]", "cuda -keys=cuda,gpu -arch=sm_80 -max_num_threads=1024 -model=unknown -thread_warp_size=32", [-1, 16, 64, 49152, 2147483647, 1024, 8, 32], "", 0, []], [[], [["FU", 1, [2, 3]], ["SP", 2, 1, 32, [8], 1], ["AN", 2, 2, 6], ["FSP", 1, 2, 1, 1], ["AN", 1, 3, 6], ["CA", 1, 2, 1], ["FU", 2, [0, 1]], ["AN", 2, 0, 5], ["PR", 1, 0, "auto_unroll_max_step$16"]]]], "r": [[0.000238836, 0.00023886, 0.000238787], 0, 3.28378, 1681111381], "v": "v0.6"}
{"i": [["[\"reduce_mean\", 112, 112, 32]", "cuda -keys=cuda,gpu -arch=sm_80 -max_num_threads=1024 -model=unknown -thread_warp_size=32", [-1, 16, 64, 49152, 2147483647, 1024, 8, 32], "", 0, []], [[], [["FU", 1, [2, 3]], ["SP", 2, 1, 32, [16], 1], ["AN", 2, 2, 6], ["FSP", 1, 2, 1, 1], ["AN", 1, 3, 6], ["CA", 1, 2, 1], ["FU", 2, [0, 1]], ["AN", 2, 0, 5], ["PR", 1, 0, "auto_unroll_max_step$1024"]]]], "r": [[0.000191305, 0.000191439, 0.000191427], 0, 12.2932, 1681111385], "v": "v0.6"}
{"i": [["[\"reduce_mean\", 112, 112, 32]", "cuda -keys=cuda,gpu -arch=sm_80 -max_num_threads=1024 -model=unknown -thread_warp_size=32", [-1, 16, 64, 49152, 2147483647, 1024, 8, 32], "", 0, []], [[], [["FU", 2, [0, 1]], ["AN", 2, 0, 6], ["FU", 1, [0, 1]], ["AN", 1, 0, 6], ["PR", 1, 0, "auto_unroll_max_step$512"]]]], "r": [[0.000101553, 0.000101579, 0.000101586], 0, 10.9176, 1681111389], "v": "v0.6"}
{"i": [["[\"reduce_mean\", 112, 112, 32]", "cuda -keys=cuda,gpu -arch=sm_80 -max_num_threads=1024 -model=unknown -thread_warp_size=32", [-1, 16, 64, 49152, 2147483647, 1024, 8, 32], "", 0, []], [[], [["FU", 1, [2, 3]], ["SP", 2, 1, 32, [4], 1], ["AN", 2, 2, 6], ["FSP", 1, 2, 1, 1], ["AN", 1, 3, 6], ["CA", 1, 2, 1], ["FU", 2, [0, 1]], ["AN", 2, 0, 5], ["PR", 1, 0, "auto_unroll_max_step$1024"]]]], "r": [[0.000222572, 0.00022264, 0.000222595], 0, 10.5485, 1681111388], "v": "v0.6"}
{"i": [["[\"reduce_mean\", 112, 112, 32]", "cuda -keys=cuda,gpu -arch=sm_80 -max_num_threads=1024 -model=unknown -thread_warp_size=32", [-1, 16, 64, 49152, 2147483647, 1024, 8, 32], "", 0, []], [[], [["FU", 2, [0, 1]], ["AN", 2, 0, 6], ["FU", 1, [0, 1]], ["AN", 1, 0, 6], ["PR", 1, 0, "auto_unroll_max_step$64"]]]], "r": [[0.000101724, 0.000101796, 0.000101783], 0, 9.17981, 1681111387], "v": "v0.6"}
{"i": [["[\"reduce_mean\", 112, 112, 32]", "cuda -keys=cuda,gpu -arch=sm_80 -max_num_threads=1024 -model=unknown -thread_warp_size=32", [-1, 16, 64, 49152, 2147483647, 1024, 8, 32], "", 0, []], [[], [["FU", 1, [2, 3]], ["SP", 2, 1, 32, [4], 1], ["AN", 2, 2, 6], ["FSP", 1, 2, 1, 1], ["AN", 1, 3, 6], ["CA", 1, 2, 1], ["FU", 2, [0, 1]], ["AN", 2, 0, 5], ["PR", 1, 0, "auto_unroll_max_step$16"]]]], "r": [[0.00022264, 0.000222663, 0.000222777], 0, 8.8764, 1681111387], "v": "v0.6"}
{"i": [["[\"reduce_mean\", 112, 112, 32]", "cuda -keys=cuda,gpu -arch=sm_80 -max_num_threads=1024 -model=unknown -thread_warp_size=32", [-1, 16, 64, 49152, 2147483647, 1024, 8, 32], "", 0, []], [[], [["FU", 1, [2, 3]], ["SP", 2, 1, 32, [16], 1], ["AN", 2, 2, 6], ["FSP", 1, 2, 1, 1], ["AN", 1, 3, 6], ["CA", 1, 2, 1], ["FU", 2, [0, 1]], ["AN", 2, 0, 5], ["PR", 1, 0, "auto_unroll_max_step$0"]]]], "r": [[0.000311356, 0.000311296, 0.000311336], 0, 9.89692, 1681111388], "v": "v0.6"}
{"i": [["[\"reduce_mean\", 112, 112, 32]", "cuda -keys=cuda,gpu -arch=sm_80 -max_num_threads=1024 -model=unknown -thread_warp_size=32", [-1, 16, 64, 49152, 2147483647, 1024, 8, 32], "", 0, []], [[], [["FU", 1, [2, 3]], ["SP", 2, 1, 32, [2], 1], ["AN", 2, 2, 6], ["FSP", 1, 2, 1, 1], ["AN", 1, 3, 6], ["CA", 1, 2, 1], ["FU", 2, [0, 1]], ["AN", 2, 0, 5], ["PR", 1, 0, "auto_unroll_max_step$512"]]]], "r": [[0.000207819, 0.000207872, 0.000207806], 0, 10.3428, 1681111388], "v": "v0.6"}
{"i": [["[\"reduce_mean\", 112, 112, 32]", "cuda -keys=cuda,gpu -arch=sm_80 -max_num_threads=1024 -model=unknown -thread_warp_size=32", [-1, 16, 64, 49152, 2147483647, 1024, 8, 32], "", 0, []], [[], [["FU", 1, [2, 3]], ["SP", 2, 1, 32, [2], 1], ["AN", 2, 2, 6], ["FSP", 1, 2, 1, 1], ["AN", 1, 3, 6], ["CA", 1, 2, 1], ["FU", 2, [0, 1]], ["AN", 2, 0, 5], ["PR", 1, 0, "auto_unroll_max_step$64"]]]], "r": [[0.000207726, 0.000207752, 0.000207726], 0, 13.4517, 1681111391], "v": "v0.6"}
{"i": [["[\"reduce_mean\", 112, 112, 32]", "cuda -keys=cuda,gpu -arch=sm_80 -max_num_threads=1024 -model=unknown -thread_warp_size=32", [-1, 16, 64, 49152, 2147483647, 1024, 8, 32], "", 0, []], [[], [["FU", 1, [2, 3]], ["SP", 2, 1, 32, [1], 1], ["AN", 2, 2, 6], ["FSP", 1, 2, 1, 1], ["AN", 1, 3, 6], ["CA", 1, 2, 1], ["FU", 2, [0, 1]], ["AN", 2, 0, 5], ["PR", 1, 0, "auto_unroll_max_step$1024"]]]], "r": [[0.000207992, 0.000207992, 0.000208005], 0, 2.24984, 1681111380], "v": "v0.6"}
{"i": [["[\"reduce_mean\", 112, 112, 32]", "cuda -keys=cuda,gpu -arch=sm_80 -max_num_threads=1024 -model=unknown -thread_warp_size=32", [-1, 16, 64, 49152, 2147483647, 1024, 8, 32], "", 0, []], [[], [["FU", 1, [2, 3]], ["SP", 2, 1, 32, [2], 1], ["AN", 2, 2, 6], ["FSP", 1, 2, 1, 1], ["AN", 1, 3, 6], ["CA", 1, 2, 1], ["FU", 2, [0, 1]], ["AN", 2, 0, 5], ["PR", 1, 0, "auto_unroll_max_step$1024"]]]], "r": [[0.000207806, 0.000207819, 0.000207819], 0, 2.94858, 1681111381], "v": "v0.6"}
{"i": [["[\"reduce_mean\", 112, 112, 32]", "cuda -keys=cuda,gpu -arch=sm_80 -max_num_threads=1024 -model=unknown -thread_warp_size=32", [-1, 16, 64, 49152, 2147483647, 1024, 8, 32], "", 0, []], [[], [["FU", 1, [2, 3]], ["SP", 2, 1, 32, [8], 1], ["AN", 2, 2, 6], ["FSP", 1, 2, 1, 1], ["AN", 1, 3, 6], ["CA", 1, 2, 1], ["FU", 2, [0, 1]], ["AN", 2, 0, 5], ["PR", 1, 0, "auto_unroll_max_step$0"]]]], "r": [[0.000239104, 0.00023908, 0.000238982], 0, 11.2034, 1681111389], "v": "v0.6"}
{"i": [["[\"reduce_mean\", 112, 112, 32]", "cuda -keys=cuda,gpu -arch=sm_80 -max_num_threads=1024 -model=unknown -thread_warp_size=32", [-1, 16, 64, 49152, 2147483647, 1024, 8, 32], "", 0, []], [[], [["FU", 1, [2, 3]], ["SP", 2, 1, 32, [4], 1], ["AN", 2, 2, 6], ["FSP", 1, 2, 1, 1], ["AN", 1, 3, 6], ["CA", 1, 2, 1], ["FU", 2, [0, 1]], ["AN", 2, 0, 5], ["PR", 1, 0, "auto_unroll_max_step$512"]]]], "r": [[0.000222527, 0.000222504, 0.000222549], 0, 11.5852, 1681111389], "v": "v0.6"}
{"i": [["[\"reduce_mean\", 112, 112, 32]", "cuda -keys=cuda,gpu -arch=sm_80 -max_num_threads=1024 -model=unknown -thread_warp_size=32", [-1, 16, 64, 49152, 2147483647, 1024, 8, 32], "", 0, []], [[], [["FU", 1, [2, 3]], ["SP", 2, 1, 32, [16], 1], ["AN", 2, 2, 6], ["FSP", 1, 2, 1, 1], ["AN", 1, 3, 6], ["CA", 1, 2, 1], ["FU", 2, [0, 1]], ["AN", 2, 0, 5], ["PR", 1, 0, "auto_unroll_max_step$16"]]]], "r": [[0.000311477, 0.000311497, 0.000311376], 0, 12.3749, 1681111390], "v": "v0.6"}
{"i": [["[\"reduce_mean\", 112, 112, 32]", "cuda -keys=cuda,gpu -arch=sm_80 -max_num_threads=1024 -model=unknown -thread_warp_size=32", [-1, 16, 64, 49152, 2147483647, 1024, 8, 32], "", 0, []], [[], [["FU", 2, [0, 1]], ["AN", 2, 0, 6], ["FU", 1, [0, 1]], ["AN", 1, 0, 6], ["PR", 1, 0, "auto_unroll_max_step$1024"]]]], "r": [[0.000101625, 0.000101639, 0.000101606], 0, 11.9788, 1681111390], "v": "v0.6"}
{"i": [["[\"reduce_mean\", 112, 112, 32]", "cuda -keys=cuda,gpu -arch=sm_80 -max_num_threads=1024 -model=unknown -thread_warp_size=32", [-1, 16, 64, 49152, 2147483647, 1024, 8, 32], "", 0, []], [[], [["FU", 1, [2, 3]], ["SP", 2, 1, 32, [32], 1], ["AN", 2, 2, 6], ["FSP", 1, 2, 1, 1], ["AN", 1, 3, 6], ["CA", 1, 2, 1], ["FU", 2, [0, 1]], ["AN", 2, 0, 5], ["PR", 1, 0, "auto_unroll_max_step$0"]]]], "r": [[0.000349784, 0.000349784, 0.000349855], 0, 13.1089, 1681111391], "v": "v0.6"}
{"i": [["[\"reduce_mean\", 112, 112, 32]", "cuda -keys=cuda,gpu -arch=sm_80 -max_num_threads=1024 -model=unknown -thread_warp_size=32", [-1, 16, 64, 49152, 2147483647, 1024, 8, 32], "", 0, []], [[], [["FU", 1, [2, 3]], ["SP", 2, 1, 32, [16], 1], ["AN", 2, 2, 6], ["FSP", 1, 2, 1, 1], ["AN", 1, 3, 6], ["CA", 1, 2, 1], ["FU", 2, [0, 1]], ["AN", 2, 0, 5], ["PR", 1, 0, "auto_unroll_max_step$64"]]]], "r": [[0.000311396, 0.000311416, 0.000311376], 0, 12.6587, 1681111391], "v": "v0.6"}
