python/models/efficientnet/kernel_configs/efficient_fused_depthwise_conv_224_224_3_3_3_s(2, 2).log
{"i": [["[\"fused_depthwise_conv2d\", 224, 224, 3, 3, 3, [2, 2]]", "cuda -keys=cuda,gpu -max_num_threads=1024 -model=unknown -thread_warp_size=32", [-1, 16, 64, 49152, 2147483647, 1024, 8, 32], "", 0, []], [[], [["CI", 8], ["CI", 7], ["CI", 5], ["CHW", 3, "local"], ["SP", 3, 0, 1, [1, 1, 1, 1], 1], ["SP", 3, 5, 112, [1, 56, 2, 1], 1], ["SP", 3, 10, 112, [1, 2, 1, 4], 1], ["SP", 3, 15, 3, [1, 3, 1, 1], 1], ["SP", 3, 20, 3, [1, 1], 1], ["SP", 3, 23, 3, [1, 1], 1], ["RE", 3, [0, 5, 10, 15, 1, 6, 11, 16, 2, 7, 12, 17, 20, 23, 21, 24, 3, 8, 13, 18, 22, 25, 4, 9, 14, 19]], ["FSP", 4, 0, 4, 3], ["FSP", 4, 4, 5, 3], ["FSP", 4, 8, 6, 3], ["FSP", 4, 12, 7, 3], ["RE", 4, [0, 4, 8, 12, 1, 5, 9, 13, 2, 6, 10, 14, 3, 7, 11, 15]], ["CA", 3, 4, 11], ["CHR", 2, "shared", [3]], ["CA", 3, 4, 13], ["CHR", 1, "shared", [4]], ["CA", 2, 5, 13], ["CI", 1], ["FU", 12, [0, 1, 2, 3]], ["SP", 12, 0, 37632, [32], 1], ["AN", 12, 0, 5], ["AN", 12, 1, 6], ["FU", 6, [0, 1, 2, 3]], ["AN", 6, 0, 5], ["FU", 6, [1, 2, 3, 4]], ["AN", 6, 1, 4], ["FU", 6, [2, 3, 4, 5]], ["AN", 6, 2, 6], ["FU", 4, [0, 1, 2, 3]], ["SP", 4, 0, 9, [3], 1], ["AN", 4, 1, 2], ["FFSP", 4, 0, [7, 6, 5, 4], 1, 1], ["AN", 4, 1, 6], ["FU", 2, [0, 1, 2, 3]], ["SP", 2, 0, 105, [1], 1], ["AN", 2, 1, 2], ["FFSP", 2, 0, [7, 6, 5, 4], 1, 1], ["AN", 2, 1, 6], ["PR", 5, 0, "auto_unroll_max_step$512"]]]], "r": [[1.81433e-05, 1.81453e-05, 1.81456e-05, 1.81503e-05, 1.81482e-05, 1.81461e-05, 1.81459e-05, 1.81465e-05, 1.81469e-05, 1.8146e-05], 0, 13.8308, 1649095471], "v": "v0.6"}
{"i": [["[\"fused_depthwise_conv2d\", 224, 224, 3, 3, 3, [2, 2]]", "cuda -keys=cuda,gpu -max_num_threads=1024 -model=unknown -thread_warp_size=32", [-1, 16, 64, 49152, 2147483647, 1024, 8, 32], "", 0, []], [[], [["CI", 8], ["CI", 7], ["CI", 5], ["CHW", 3, "local"], ["SP", 3, 0, 1, [1, 1, 1, 1], 1], ["SP", 3, 5, 112, [2, 28, 1, 1], 1], ["SP", 3, 10, 112, [2, 2, 2, 2], 1], ["SP", 3, 15, 3, [1, 1, 1, 3], 1], ["SP", 3, 20, 3, [1, 1], 1], ["SP", 3, 23, 3, [1, 1], 1], ["RE", 3, [0, 5, 10, 15, 1, 6, 11, 16, 2, 7, 12, 17, 20, 23, 21, 24, 3, 8, 13, 18, 22, 25, 4, 9, 14, 19]], ["FSP", 4, 0, 4, 3], ["FSP", 4, 4, 5, 3], ["FSP", 4, 8, 6, 3], ["FSP", 4, 12, 7, 3], ["RE", 4, [0, 4, 8, 12, 1, 5, 9, 13, 2, 6, 10, 14, 3, 7, 11, 15]], ["CA", 3, 4, 11], ["CHR", 2, "shared", [3]], ["CA", 3, 4, 13], ["CHR", 1, "shared", [4]], ["CA", 2, 5, 13], ["CI", 1], ["FU", 12, [0, 1, 2, 3]], ["SP", 12, 0, 37632, [64], 1], ["AN", 12, 0, 5], ["AN", 12, 1, 6], ["FU", 6, [0, 1, 2, 3]], ["AN", 6, 0, 5], ["FU", 6, [1, 2, 3, 4]], ["AN", 6, 1, 4], ["FU", 6, [2, 3, 4, 5]], ["AN", 6, 2, 6], ["FU", 4, [0, 1, 2, 3]], ["SP", 4, 0, 1, [1], 1], ["AN", 4, 1, 2], ["FFSP", 4, 0, [7, 6, 5, 4], 1, 1], ["AN", 4, 1, 6], ["FU", 2, [0, 1, 2, 3]], ["SP", 2, 0, 7, [1], 1], ["AN", 2, 1, 2], ["FFSP", 2, 0, [7, 6, 5, 4], 1, 1], ["AN", 2, 1, 6], ["PR", 5, 0, "auto_unroll_max_step$0"]]]], "r": [[0.00027275, 0.000272702, 0.000272709, 0.000272659, 0.000272663, 0.000272622, 0.000272627, 0.00027269, 0.000272655, 0.000272727], 0, 6.56749, 1649095466], "v": "v0.6"}
{"i": [["[\"fused_depthwise_conv2d\", 224, 224, 3, 3, 3, [2, 2]]", "cuda -keys=cuda,gpu -max_num_threads=1024 -model=unknown -thread_warp_size=32", [-1, 16, 64, 49152, 2147483647, 1024, 8, 32], "", 0, []], [[], [["CI", 8], ["CI", 7], ["CI", 5], ["CHW", 3, "local"], ["SP", 3, 0, 1, [1, 1, 1, 1], 1], ["SP", 3, 5, 112, [1, 8, 1, 1], 1], ["SP", 3, 10, 112, [1, 16, 1, 7], 1], ["SP", 3, 15, 3, [1, 3, 1, 1], 1], ["SP", 3, 20, 3, [3, 1], 1], ["SP", 3, 23, 3, [1, 1], 1], ["RE", 3, [0, 5, 10, 15, 1, 6, 11, 16, 2, 7, 12, 17, 20, 23, 21, 24, 3, 8, 13, 18, 22, 25, 4, 9, 14, 19]], ["FSP", 4, 0, 4, 3], ["FSP", 4, 4, 5, 3], ["FSP", 4, 8, 6, 3], ["FSP", 4, 12, 7, 3], ["RE", 4, [0, 4, 8, 12, 1, 5, 9, 13, 2, 6, 10, 14, 3, 7, 11, 15]], ["CA", 3, 4, 11], ["CHR", 2, "shared", [3]], ["CA", 3, 4, 13], ["CHR", 1, "shared", [4]], ["CA", 2, 5, 13], ["CI", 1], ["FU", 12, [0, 1, 2, 3]], ["SP", 12, 0, 37632, [32], 1], ["AN", 12, 0, 5], ["AN", 12, 1, 6], ["FU", 6, [0, 1, 2, 3]], ["AN", 6, 0, 5], ["FU", 6, [1, 2, 3, 4]], ["AN", 6, 1, 4], ["FU", 6, [2, 3, 4, 5]], ["AN", 6, 2, 6], ["FU", 4, [0, 1, 2, 3]], ["SP", 4, 0, 3, [1], 1], ["AN", 4, 1, 2], ["FFSP", 4, 0, [7, 6, 5, 4], 1, 1], ["AN", 4, 1, 6], ["FU", 2, [0, 1, 2, 3]], ["SP", 2, 0, 3, [1], 1], ["AN", 2, 1, 2], ["FFSP", 2, 0, [7, 6, 5, 4], 1, 1], ["AN", 2, 1, 6], ["PR", 5, 0, "auto_unroll_max_step$1024"]]]], "r": [[1.17258e-05, 1.17263e-05, 1.17246e-05, 1.17253e-05, 1.17246e-05, 1.17236e-05, 1.17246e-05, 1.17258e-05, 1.17246e-05, 1.1723e-05], 0, 16.6916, 1649095476], "v": "v0.6"}
{"i": [["[\"fused_depthwise_conv2d\", 224, 224, 3, 3, 3, [2, 2]]", "cuda -keys=cuda,gpu -max_num_threads=1024 -model=unknown -thread_warp_size=32", [-1, 16, 64, 49152, 2147483647, 1024, 8, 32], "", 0, []], [[], [["CI", 8], ["CI", 7], ["CI", 5], ["CHW", 3, "local"], ["SP", 3, 0, 1, [1, 1, 1, 1], 1], ["SP", 3, 5, 112, [1, 8, 1, 7], 1], ["SP", 3, 10, 112, [1, 2, 7, 1], 1], ["SP", 3, 15, 3, [1, 1, 3, 1], 1], ["SP", 3, 20, 3, [1, 3], 1], ["SP", 3, 23, 3, [1, 3], 1], ["RE", 3, [0, 5, 10, 15, 1, 6, 11, 16, 2, 7, 12, 17, 20, 23, 21, 24, 3, 8, 13, 18, 22, 25, 4, 9, 14, 19]], ["FSP", 4, 0, 4, 3], ["FSP", 4, 4, 5, 3], ["FSP", 4, 8, 6, 3], ["FSP", 4, 12, 7, 3], ["RE", 4, [0, 4, 8, 12, 1, 5, 9, 13, 2, 6, 10, 14, 3, 7, 11, 15]], ["CA", 3, 4, 11], ["CHR", 2, "shared", [3]], ["CA", 3, 4, 13], ["CHR", 1, "shared", [4]], ["CA", 2, 5, 13], ["CI", 1], ["FU", 12, [0, 1, 2, 3]], ["SP", 12, 0, 37632, [32], 1], ["AN", 12, 0, 5], ["AN", 12, 1, 6], ["FU", 6, [0, 1, 2, 3]], ["AN", 6, 0, 5], ["FU", 6, [1, 2, 3, 4]], ["AN", 6, 1, 4], ["FU", 6, [2, 3, 4, 5]], ["AN", 6, 2, 6], ["FU", 4, [0, 1, 2, 3]], ["SP", 4, 0, 9, [1], 1], ["AN", 4, 1, 2], ["FFSP", 4, 0, [7, 6, 5, 4], 1, 1], ["AN", 4, 1, 6], ["FU", 2, [0, 1, 2, 3]], ["SP", 2, 0, 225, [45], 1], ["AN", 2, 1, 2], ["FFSP", 2, 0, [7, 6, 5, 4], 1, 1], ["AN", 2, 1, 6], ["PR", 5, 0, "auto_unroll_max_step$64"]]]], "r": [[0.000167888, 0.000167858, 0.000167831, 0.00016798, 0.000167968, 0.000167979, 0.00016783, 0.000167869, 0.000167903, 0.000167836], 0, 38.3813, 1649095496], "v": "v0.6"}
{"i": [["[\"fused_depthwise_conv2d\", 224, 224, 3, 3, 3, [2, 2]]", "cuda -keys=cuda,gpu -max_num_threads=1024 -model=unknown -thread_warp_size=32", [-1, 16, 64, 49152, 2147483647, 1024, 8, 32], "", 0, []], [[], [["CI", 8], ["CI", 7], ["CI", 5], ["CHW", 3, "local"], ["SP", 3, 0, 1, [1, 1, 1, 1], 1], ["SP", 3, 5, 112, [8, 1, 1, 2], 1], ["SP", 3, 10, 112, [1, 14, 1, 1], 1], ["SP", 3, 15, 3, [1, 1, 1, 1], 1], ["SP", 3, 20, 3, [3, 1], 1], ["SP", 3, 23, 3, [1, 1], 1], ["RE", 3, [0, 5, 10, 15, 1, 6, 11, 16, 2, 7, 12, 17, 20, 23, 21, 24, 3, 8, 13, 18, 22, 25, 4, 9, 14, 19]], ["FSP", 4, 0, 4, 3], ["FSP", 4, 4, 5, 3], ["FSP", 4, 8, 6, 3], ["FSP", 4, 12, 7, 3], ["RE", 4, [0, 4, 8, 12, 1, 5, 9, 13, 2, 6, 10, 14, 3, 7, 11, 15]], ["CA", 3, 4, 11], ["CHR", 2, "shared", [3]], ["CA", 3, 4, 13], ["CHR", 1, "shared", [4]], ["CA", 2, 5, 13], ["CI", 1], ["FU", 12, [0, 1, 2, 3]], ["SP", 12, 0, 37632, [32], 1], ["AN", 12, 0, 5], ["AN", 12, 1, 6], ["FU", 6, [0, 1, 2, 3]], ["AN", 6, 0, 5], ["FU", 6, [1, 2, 3, 4]], ["AN", 6, 1, 4], ["FU", 6, [2, 3, 4, 5]], ["AN", 6, 2, 6], ["FU", 4, [0, 1, 2, 3]], ["SP", 4, 0, 3, [1], 1], ["AN", 4, 1, 2], ["FFSP", 4, 0, [7, 6, 5, 4], 1, 1], ["AN", 4, 1, 6], ["FU", 2, [0, 1, 2, 3]], ["SP", 2, 0, 33, [1], 1], ["AN", 2, 1, 2], ["FFSP", 2, 0, [7, 6, 5, 4], 1, 1], ["AN", 2, 1, 6], ["PR", 5, 0, "auto_unroll_max_step$16"]]]], "r": [[5.31863e-05, 5.31802e-05, 5.3202e-05, 5.31939e-05, 5.31859e-05, 5.31919e-05, 5.31852e-05, 5.31887e-05, 5.3192e-05, 5.31779e-05], 0, 84.3973, 1649095544], "v": "v0.6"}
{"i": [["[\"fused_depthwise_conv2d\", 224, 224, 3, 3, 3, [2, 2]]", "cuda -keys=cuda,gpu -max_num_threads=1024 -model=unknown -thread_warp_size=32", [-1, 16, 64, 49152, 2147483647, 1024, 8, 32], "", 0, []], [[], [["CI", 8], ["CI", 7], ["CI", 5], ["CHW", 3, "local"], ["SP", 3, 0, 1, [1, 1, 1, 1], 1], ["SP", 3, 5, 112, [1, 1, 1, 1], 1], ["SP", 3, 10, 112, [1, 16, 1, 1], 1], ["SP", 3, 15, 3, [1, 3, 1, 1], 1], ["SP", 3, 20, 3, [3, 1], 1], ["SP", 3, 23, 3, [1, 1], 1], ["RE", 3, [0, 5, 10, 15, 1, 6, 11, 16, 2, 7, 12, 17, 20, 23, 21, 24, 3, 8, 13, 18, 22, 25, 4, 9, 14, 19]], ["FSP", 4, 0, 4, 3], ["FSP", 4, 4, 5, 3], ["FSP", 4, 8, 6, 3], ["FSP", 4, 12, 7, 3], ["RE", 4, [0, 4, 8, 12, 1, 5, 9, 13, 2, 6, 10, 14, 3, 7, 11, 15]], ["CA", 3, 4, 11], ["CHR", 2, "shared", [3]], ["CA", 3, 4, 13], ["CHR", 1, "shared", [4]], ["CA", 2, 5, 13], ["CI", 1], ["FU", 12, [0, 1, 2, 3]], ["SP", 12, 0, 37632, [32], 1], ["AN", 12, 0, 5], ["AN", 12, 1, 6], ["FU", 6, [0, 1, 2, 3]], ["AN", 6, 0, 5], ["FU", 6, [1, 2, 3, 4]], ["AN", 6, 1, 4], ["FU", 6, [2, 3, 4, 5]], ["AN", 6, 2, 6], ["FU", 4, [0, 1, 2, 3]], ["SP", 4, 0, 3, [3], 1], ["AN", 4, 1, 2], ["FFSP", 4, 0, [7, 6, 5, 4], 1, 1], ["AN", 4, 1, 6], ["FU", 2, [0, 1, 2, 3]], ["SP", 2, 0, 3, [1], 1], ["AN", 2, 1, 2], ["FFSP", 2, 0, [7, 6, 5, 4], 1, 1], ["AN", 2, 1, 6], ["PR", 5, 0, "auto_unroll_max_step$1024"]]]], "r": [[8.29748e-06, 8.29798e-06, 8.29359e-06, 8.29633e-06, 8.29392e-06, 8.2912e-06, 8.29307e-06, 8.43739e-06, 8.29174e-06, 8.2932e-06], 0, 30.9945, 1649095490], "v": "v0.6"}
{"i": [["[\"fused_depthwise_conv2d\", 224, 224, 3, 3, 3, [2, 2]]", "cuda -keys=cuda,gpu -max_num_threads=1024 -model=unknown -thread_warp_size=32", [-1, 16, 64, 49152, 2147483647, 1024, 8, 32], "", 0, []], [[], [["CI", 8], ["CI", 7], ["CI", 5], ["CHW", 3, "local"], ["SP", 3, 0, 1, [1, 1, 1, 1], 1], ["SP", 3, 5, 112, [1, 7, 1, 2], 1], ["SP", 3, 10, 112, [1, 16, 1, 1], 1], ["SP", 3, 15, 3, [3, 1, 1, 1], 1], ["SP", 3, 20, 3, [1, 3], 1], ["SP", 3, 23, 3, [1, 3], 1], ["RE", 3, [0, 5, 10, 15, 1, 6, 11, 16, 2, 7, 12, 17, 20, 23, 21, 24, 3, 8, 13, 18, 22, 25, 4, 9, 14, 19]], ["FSP", 4, 0, 4, 3], ["FSP", 4, 4, 5, 3], ["FSP", 4, 8, 6, 3], ["FSP", 4, 12, 7, 3], ["RE", 4, [0, 4, 8, 12, 1, 5, 9, 13, 2, 6, 10, 14, 3, 7, 11, 15]], ["CA", 3, 4, 11], ["CHR", 2, "shared", [3]], ["CA", 3, 4, 13], ["CHR", 1, "shared", [4]], ["CA", 2, 5, 13], ["CI", 1], ["FU", 12, [0, 1, 2, 3]], ["SP", 12, 0, 37632, [32], 1], ["AN", 12, 0, 5], ["AN", 12, 1, 6], ["FU", 6, [0, 1, 2, 3]], ["AN", 6, 0, 5], ["FU", 6, [1, 2, 3, 4]], ["AN", 6, 1, 4], ["FU", 6, [2, 3, 4, 5]], ["AN", 6, 2, 6], ["FU", 4, [0, 1, 2, 3]], ["SP", 4, 0, 9, [1], 1], ["AN", 4, 1, 2], ["FFSP", 4, 0, [7, 6, 5, 4], 1, 1], ["AN", 4, 1, 6], ["FU", 2, [0, 1, 2, 3]], ["SP", 2, 0, 15, [1], 1], ["AN", 2, 1, 2], ["FFSP", 2, 0, [7, 6, 5, 4], 1, 1], ["AN", 2, 1, 6], ["PR", 5, 0, "auto_unroll_max_step$0"]]]], "r": [[1.38967e-05, 1.38973e-05, 1.38983e-05, 1.38979e-05, 1.38974e-05, 1.38978e-05, 1.38975e-05, 1.38981e-05, 1.38983e-05, 1.38978e-05], 0, 40.7599, 1649095501], "v": "v0.6"}
{"i": [["[\"fused_depthwise_conv2d\", 224, 224, 3, 3, 3, [2, 2]]", "cuda -keys=cuda,gpu -max_num_threads=1024 -model=unknown -thread_warp_size=32", [-1, 16, 64, 49152, 2147483647, 1024, 8, 32], "", 0, []], [[], [["CI", 8], ["CI", 7], ["CI", 5], ["CHW", 3, "local"], ["SP", 3, 0, 1, [1, 1, 1, 1], 1], ["SP", 3, 5, 112, [1, 7, 2, 1], 1], ["SP", 3, 10, 112, [2, 7, 4, 1], 1], ["SP", 3, 15, 3, [3, 1, 1, 1], 1], ["SP", 3, 20, 3, [1, 1], 1], ["SP", 3, 23, 3, [3, 1], 1], ["RE", 3, [0, 5, 10, 15, 1, 6, 11, 16, 2, 7, 12, 17, 20, 23, 21, 24, 3, 8, 13, 18, 22, 25, 4, 9, 14, 19]], ["FSP", 4, 0, 4, 3], ["FSP", 4, 4, 5, 3], ["FSP", 4, 8, 6, 3], ["FSP", 4, 12, 7, 3], ["RE", 4, [0, 4, 8, 12, 1, 5, 9, 13, 2, 6, 10, 14, 3, 7, 11, 15]], ["CA", 3, 4, 11], ["CHR", 2, "shared", [3]], ["CA", 3, 4, 13], ["CHR", 1, "shared", [4]], ["CA", 2, 5, 13], ["CI", 1], ["FU", 12, [0, 1, 2, 3]], ["SP", 12, 0, 37632, [32], 1], ["AN", 12, 0, 5], ["AN", 12, 1, 6], ["FU", 6, [0, 1, 2, 3]], ["AN", 6, 0, 5], ["FU", 6, [1, 2, 3, 4]], ["AN", 6, 1, 4], ["FU", 6, [2, 3, 4, 5]], ["AN", 6, 2, 6], ["FU", 4, [0, 1, 2, 3]], ["SP", 4, 0, 3, [1], 1], ["AN", 4, 1, 2], ["FFSP", 4, 0, [7, 6, 5, 4], 1, 1], ["AN", 4, 1, 6], ["FU", 2, [0, 1, 2, 3]], ["SP", 2, 0, 27, [1], 1], ["AN", 2, 1, 2], ["FFSP", 2, 0, [7, 6, 5, 4], 1, 1], ["AN", 2, 1, 6], ["PR", 5, 0, "auto_unroll_max_step$1024"]]]], "r": [[2.71419e-05, 2.7142e-05, 2.71461e-05, 2.7144e-05, 2.71425e-05, 2.71439e-05, 2.71424e-05, 2.71374e-05, 2.71398e-05, 2.71401e-05], 0, 61.5711, 1649095515], "v": "v0.6"}
{"i": [["[\"fused_depthwise_conv2d\", 224, 224, 3, 3, 3, [2, 2]]", "cuda -keys=cuda,gpu -max_num_threads=1024 -model=unknown -thread_warp_size=32", [-1, 16, 64, 49152, 2147483647, 1024, 8, 32], "", 0, []], [[], [["CI", 8], ["CI", 7], ["CI", 5], ["CHW", 3, "local"], ["SP", 3, 0, 1, [1, 1, 1, 1], 1], ["SP", 3, 5, 112, [2, 4, 2, 1], 1], ["SP", 3, 10, 112, [2, 28, 1, 2], 1], ["SP", 3, 15, 3, [1, 1, 1, 1], 1], ["SP", 3, 20, 3, [1, 3], 1], ["SP", 3, 23, 3, [1, 1], 1], ["RE", 3, [0, 5, 10, 15, 1, 6, 11, 16, 2, 7, 12, 17, 20, 23, 21, 24, 3, 8, 13, 18, 22, 25, 4, 9, 14, 19]], ["FSP", 4, 0, 4, 3], ["FSP", 4, 4, 5, 3], ["FSP", 4, 8, 6, 3], ["FSP", 4, 12, 7, 3], ["RE", 4, [0, 4, 8, 12, 1, 5, 9, 13, 2, 6, 10, 14, 3, 7, 11, 15]], ["CA", 3, 4, 11], ["CHR", 2, "shared", [3]], ["CA", 3, 4, 13], ["CHR", 1, "shared", [4]], ["CA", 2, 5, 13], ["CI", 1], ["FU", 12, [0, 1, 2, 3]], ["SP", 12, 0, 37632, [32], 1], ["AN", 12, 0, 5], ["AN", 12, 1, 6], ["FU", 6, [0, 1, 2, 3]], ["AN", 6, 0, 5], ["FU", 6, [1, 2, 3, 4]], ["AN", 6, 1, 4], ["FU", 6, [2, 3, 4, 5]], ["AN", 6, 2, 6], ["FU", 4, [0, 1, 2, 3]], ["SP", 4, 0, 3, [3], 1], ["AN", 4, 1, 2], ["FFSP", 4, 0, [7, 6, 5, 4], 1, 1], ["AN", 4, 1, 6], ["FU", 2, [0, 1, 2, 3]], ["SP", 2, 0, 15, [1], 1], ["AN", 2, 1, 2], ["FFSP", 2, 0, [7, 6, 5, 4], 1, 1], ["AN", 2, 1, 6], ["PR", 5, 0, "auto_unroll_max_step$1024"]]]], "r": [[1.19675e-05, 1.19671e-05, 1.19656e-05, 1.19675e-05, 1.19676e-05, 1.19673e-05, 1.19703e-05, 1.1969e-05, 1.19665e-05, 1.19676e-05], 0, 22.1728, 1649095480], "v": "v0.6"}
{"i": [["[\"fused_depthwise_conv2d\", 224, 224, 3, 3, 3, [2, 2]]", "cuda -keys=cuda,gpu -max_num_threads=1024 -model=unknown -thread_warp_size=32", [-1, 16, 64, 49152, 2147483647, 1024, 8, 32], "", 0, []], [[], [["CI", 8], ["CI", 7], ["CI", 5], ["CHW", 3, "local"], ["SP", 3, 0, 1, [1, 1, 1, 1], 1], ["SP", 3, 5, 112, [2, 8, 1, 1], 1], ["SP", 3, 10, 112, [1, 56, 1, 2], 1], ["SP", 3, 15, 3, [1, 1, 1, 1], 1], ["SP", 3, 20, 3, [3, 1], 1], ["SP", 3, 23, 3, [3, 1], 1], ["RE", 3, [0, 5, 10, 15, 1, 6, 11, 16, 2, 7, 12, 17, 20, 23, 21, 24, 3, 8, 13, 18, 22, 25, 4, 9, 14, 19]], ["FSP", 4, 0, 4, 3], ["FSP", 4, 4, 5, 3], ["FSP", 4, 8, 6, 3], ["FSP", 4, 12, 7, 3], ["RE", 4, [0, 4, 8, 12, 1, 5, 9, 13, 2, 6, 10, 14, 3, 7, 11, 15]], ["CA", 3, 4, 11], ["CHR", 2, "shared", [3]], ["CA", 3, 4, 13], ["CHR", 1, "shared", [4]], ["CA", 2, 5, 13], ["CI", 1], ["FU", 12, [0, 1, 2, 3]], ["SP", 12, 0, 37632, [64], 1], ["AN", 12, 0, 5], ["AN", 12, 1, 6], ["FU", 6, [0, 1, 2, 3]], ["AN", 6, 0, 5], ["FU", 6, [1, 2, 3, 4]], ["AN", 6, 1, 4], ["FU", 6, [2, 3, 4, 5]], ["AN", 6, 2, 6], ["FU", 4, [0, 1, 2, 3]], ["SP", 4, 0, 9, [3], 1], ["AN", 4, 1, 2], ["FFSP", 4, 0, [7, 6, 5, 4], 1, 1], ["AN", 4, 1, 6], ["FU", 2, [0, 1, 2, 3]], ["SP", 2, 0, 45, [1], 1], ["AN", 2, 1, 2], ["FFSP", 2, 0, [7, 6, 5, 4], 1, 1], ["AN", 2, 1, 6], ["PR", 5, 0, "auto_unroll_max_step$1024"]]]], "r": [[9.53072e-06, 9.52705e-06, 9.52529e-06, 9.52709e-06, 9.52725e-06, 9.52696e-06, 9.5265e-06, 9.5272e-06, 9.52607e-06, 9.5257e-06], 0, 45.3325, 1649095505], "v": "v0.6"}
{"i": [["[\"fused_depthwise_conv2d\", 224, 224, 3, 3, 3, [2, 2]]", "cuda -keys=cuda,gpu -max_num_threads=1024 -model=unknown -thread_warp_size=32", [-1, 16, 64, 49152, 2147483647, 1024, 8, 32], "", 0, []], [[], [["CI", 8], ["CI", 7], ["CI", 5], ["CHW", 3, "local"], ["SP", 3, 0, 1, [1, 1, 1, 1], 1], ["SP", 3, 5, 112, [1, 1, 1, 16], 1], ["SP", 3, 10, 112, [2, 14, 1, 1], 1], ["SP", 3, 15, 3, [1, 3, 1, 1], 1], ["SP", 3, 20, 3, [3, 1], 1], ["SP", 3, 23, 3, [1, 1], 1], ["RE", 3, [0, 5, 10, 15, 1, 6, 11, 16, 2, 7, 12, 17, 20, 23, 21, 24, 3, 8, 13, 18, 22, 25, 4, 9, 14, 19]], ["FSP", 4, 0, 4, 3], ["FSP", 4, 4, 5, 3], ["FSP", 4, 8, 6, 3], ["FSP", 4, 12, 7, 3], ["RE", 4, [0, 4, 8, 12, 1, 5, 9, 13, 2, 6, 10, 14, 3, 7, 11, 15]], ["CA", 3, 4, 11], ["CHR", 2, "shared", [3]], ["CA", 3, 4, 13], ["CHR", 1, "shared", [4]], ["CA", 2, 5, 13], ["CI", 1], ["FU", 12, [0, 1, 2, 3]], ["SP", 12, 0, 37632, [32], 1], ["AN", 12, 0, 5], ["AN", 12, 1, 6], ["FU", 6, [0, 1, 2, 3]], ["AN", 6, 0, 5], ["FU", 6, [1, 2, 3, 4]], ["AN", 6, 1, 4], ["FU", 6, [2, 3, 4, 5]], ["AN", 6, 2, 6], ["FU", 4, [0, 1, 2, 3]], ["SP", 4, 0, 3, [1], 1], ["AN", 4, 1, 2], ["FFSP", 4, 0, [7, 6, 5, 4], 1, 1], ["AN", 4, 1, 6], ["FU", 2, [0, 1, 2, 3]], ["SP", 2, 0, 33, [1], 1], ["AN", 2, 1, 2], ["FFSP", 2, 0, [7, 6, 5, 4], 1, 1], ["AN", 2, 1, 6], ["PR", 5, 0, "auto_unroll_max_step$0"]]]], "r": [[9.42945e-05, 9.43002e-05, 9.42994e-05, 9.42923e-05, 9.42845e-05, 9.42762e-05, 9.42928e-05, 9.42891e-05, 9.42807e-05, 9.42974e-05], 0, 26.1363, 1649095486], "v": "v0.6"}
{"i": [["[\"fused_depthwise_conv2d\", 224, 224, 3, 3, 3, [2, 2]]", "cuda -keys=cuda,gpu -max_num_threads=1024 -model=unknown -thread_warp_size=32", [-1, 16, 64, 49152, 2147483647, 1024, 8, 32], "", 0, []], [[], [["CI", 8], ["CI", 7], ["CI", 5], ["CHW", 3, "local"], ["SP", 3, 0, 1, [1, 1, 1, 1], 1], ["SP", 3, 5, 112, [1, 112, 1, 1], 1], ["SP", 3, 10, 112, [1, 4, 1, 2], 1], ["SP", 3, 15, 3, [1, 1, 1, 1], 1], ["SP", 3, 20, 3, [1, 3], 1], ["SP", 3, 23, 3, [1, 1], 1], ["RE", 3, [0, 5, 10, 15, 1, 6, 11, 16, 2, 7, 12, 17, 20, 23, 21, 24, 3, 8, 13, 18, 22, 25, 4, 9, 14, 19]], ["FSP", 4, 0, 4, 3], ["FSP", 4, 4, 5, 3], ["FSP", 4, 8, 6, 3], ["FSP", 4, 12, 7, 3], ["RE", 4, [0, 4, 8, 12, 1, 5, 9, 13, 2, 6, 10, 14, 3, 7, 11, 15]], ["CA", 3, 4, 11], ["CHR", 2, "shared", [3]], ["CA", 3, 4, 13], ["CHR", 1, "shared", [4]], ["CA", 2, 5, 13], ["CI", 1], ["FU", 12, [0, 1, 2, 3]], ["SP", 12, 0, 37632, [32], 1], ["AN", 12, 0, 5], ["AN", 12, 1, 6], ["FU", 6, [0, 1, 2, 3]], ["AN", 6, 0, 5], ["FU", 6, [1, 2, 3, 4]], ["AN", 6, 1, 4], ["FU", 6, [2, 3, 4, 5]], ["AN", 6, 2, 6], ["FU", 4, [0, 1, 2, 3]], ["SP", 4, 0, 3, [1], 1], ["AN", 4, 1, 2], ["FFSP", 4, 0, [7, 6, 5, 4], 1, 1], ["AN", 4, 1, 6], ["FU", 2, [0, 1, 2, 3]], ["SP", 2, 0, 3, [1], 1], ["AN", 2, 1, 2], ["FFSP", 2, 0, [7, 6, 5, 4], 1, 1], ["AN", 2, 1, 6], ["PR", 5, 0, "auto_unroll_max_step$512"]]]], "r": [[1.04744e-05, 1.04763e-05, 1.04753e-05, 1.04749e-05, 1.04739e-05, 1.04737e-05, 1.04745e-05, 1.04757e-05, 1.0474e-05, 1.04757e-05], 0, 49.9735, 1649095510], "v": "v0.6"}
{"i": [["[\"fused_depthwise_conv2d\", 224, 224, 3, 3, 3, [2, 2]]", "cuda -keys=cuda,gpu -max_num_threads=1024 -model=unknown -thread_warp_size=32", [-1, 16, 64, 49152, 2147483647, 1024, 8, 32], "", 0, []], [[], [["CI", 8], ["CI", 7], ["CI", 5], ["CHW", 3, "local"], ["SP", 3, 0, 1, [1, 1, 1, 1], 1], ["SP", 3, 5, 112, [2, 7, 1, 4], 1], ["SP", 3, 10, 112, [1, 2, 1, 2], 1], ["SP", 3, 15, 3, [1, 1, 1, 1], 1], ["SP", 3, 20, 3, [1, 3], 1], ["SP", 3, 23, 3, [3, 1], 1], ["RE", 3, [0, 5, 10, 15, 1, 6, 11, 16, 2, 7, 12, 17, 20, 23, 21, 24, 3, 8, 13, 18, 22, 25, 4, 9, 14, 19]], ["FSP", 4, 0, 4, 3], ["FSP", 4, 4, 5, 3], ["FSP", 4, 8, 6, 3], ["FSP", 4, 12, 7, 3], ["RE", 4, [0, 4, 8, 12, 1, 5, 9, 13, 2, 6, 10, 14, 3, 7, 11, 15]], ["CA", 3, 4, 11], ["CHR", 2, "shared", [3]], ["CA", 3, 4, 13], ["CHR", 1, "shared", [4]], ["CA", 2, 5, 13], ["CI", 1], ["FU", 12, [0, 1, 2, 3]], ["SP", 12, 0, 37632, [4], 1], ["AN", 12, 0, 5], ["AN", 12, 1, 6], ["FU", 6, [0, 1, 2, 3]], ["AN", 6, 0, 5], ["FU", 6, [1, 2, 3, 4]], ["AN", 6, 1, 4], ["FU", 6, [2, 3, 4, 5]], ["AN", 6, 2, 6], ["FU", 4, [0, 1, 2, 3]], ["SP", 4, 0, 9, [1], 1], ["AN", 4, 1, 2], ["FFSP", 4, 0, [7, 6, 5, 4], 1, 1], ["AN", 4, 1, 6], ["FU", 2, [0, 1, 2, 3]], ["SP", 2, 0, 45, [45], 1], ["AN", 2, 1, 2], ["FFSP", 2, 0, [7, 6, 5, 4], 1, 1], ["AN", 2, 1, 6], ["PR", 5, 0, "auto_unroll_max_step$0"]]]], "r": [[3.16278e-05, 3.16237e-05, 3.16215e-05, 3.16252e-05, 3.16202e-05, 3.16228e-05, 3.16171e-05, 3.16246e-05, 3.16219e-05, 3.16203e-05], 0, 65.1498, 1649095525], "v": "v0.6"}
{"i": [["[\"fused_depthwise_conv2d\", 224, 224, 3, 3, 3, [2, 2]]", "cuda -keys=cuda,gpu -max_num_threads=1024 -model=unknown -thread_warp_size=32", [-1, 16, 64, 49152, 2147483647, 1024, 8, 32], "", 0, []], [[], [["CI", 8], ["CI", 7], ["CI", 5], ["CHW", 3, "local"], ["SP", 3, 0, 1, [1, 1, 1, 1], 1], ["SP", 3, 5, 112, [4, 1, 1, 4], 1], ["SP", 3, 10, 112, [2, 14, 1, 1], 1], ["SP", 3, 15, 3, [1, 3, 1, 1], 1], ["SP", 3, 20, 3, [1, 1], 1], ["SP", 3, 23, 3, [3, 1], 1], ["RE", 3, [0, 5, 10, 15, 1, 6, 11, 16, 2, 7, 12, 17, 20, 23, 21, 24, 3, 8, 13, 18, 22, 25, 4, 9, 14, 19]], ["FSP", 4, 0, 4, 3], ["FSP", 4, 4, 5, 3], ["FSP", 4, 8, 6, 3], ["FSP", 4, 12, 7, 3], ["RE", 4, [0, 4, 8, 12, 1, 5, 9, 13, 2, 6, 10, 14, 3, 7, 11, 15]], ["CA", 3, 4, 11], ["CHR", 2, "shared", [3]], ["CA", 3, 4, 13], ["CHR", 1, "shared", [4]], ["CA", 2, 5, 13], ["CI", 1], ["FU", 12, [0, 1, 2, 3]], ["SP", 12, 0, 37632, [64], 1], ["AN", 12, 0, 5], ["AN", 12, 1, 6], ["FU", 6, [0, 1, 2, 3]], ["AN", 6, 0, 5], ["FU", 6, [1, 2, 3, 4]], ["AN", 6, 1, 4], ["FU", 6, [2, 3, 4, 5]], ["AN", 6, 2, 6], ["FU", 4, [0, 1, 2, 3]], ["SP", 4, 0, 3, [3], 1], ["AN", 4, 1, 2], ["FFSP", 4, 0, [7, 6, 5, 4], 1, 1], ["AN", 4, 1, 6], ["FU", 2, [0, 1, 2, 3]], ["SP", 2, 0, 21, [1], 1], ["AN", 2, 1, 2], ["FFSP", 2, 0, [7, 6, 5, 4], 1, 1], ["AN", 2, 1, 6], ["PR", 5, 0, "auto_unroll_max_step$16"]]]], "r": [[9.20187e-05, 9.20419e-05, 9.2014e-05, 9.20198e-05, 9.20378e-05, 9.20252e-05, 9.1984e-05, 9.19967e-05, 9.19827e-05, 9.20075e-05], 0, 135.048, 1649095595], "v": "v0.6"}
{"i": [["[\"fused_depthwise_conv2d\", 224, 224, 3, 3, 3, [2, 2]]", "cuda -keys=cuda,gpu -max_num_threads=1024 -model=unknown -thread_warp_size=32", [-1, 16, 64, 49152, 2147483647, 1024, 8, 32], "", 0, []], [[], [["CI", 8], ["CI", 7], ["CI", 5], ["CHW", 3, "local"], ["SP", 3, 0, 1, [1, 1, 1, 1], 1], ["SP", 3, 5, 112, [2, 7, 1, 4], 1], ["SP", 3, 10, 112, [1, 2, 1, 2], 1], ["SP", 3, 15, 3, [1, 3, 1, 1], 1], ["SP", 3, 20, 3, [1, 3], 1], ["SP", 3, 23, 3, [3, 1], 1], ["RE", 3, [0, 5, 10, 15, 1, 6, 11, 16, 2, 7, 12, 17, 20, 23, 21, 24, 3, 8, 13, 18, 22, 25, 4, 9, 14, 19]], ["FSP", 4, 0, 4, 3], ["FSP", 4, 4, 5, 3], ["FSP", 4, 8, 6, 3], ["FSP", 4, 12, 7, 3], ["RE", 4, [0, 4, 8, 12, 1, 5, 9, 13, 2, 6, 10, 14, 3, 7, 11, 15]], ["CA", 3, 4, 11], ["CHR", 2, "shared", [3]], ["CA", 3, 4, 13], ["CHR", 1, "shared", [4]], ["CA", 2, 5, 13], ["CI", 1], ["FU", 12, [0, 1, 2, 3]], ["SP", 12, 0, 37632, [32], 1], ["AN", 12, 0, 5], ["AN", 12, 1, 6], ["FU", 6, [0, 1, 2, 3]], ["AN", 6, 0, 5], ["FU", 6, [1, 2, 3, 4]], ["AN", 6, 1, 4], ["FU", 6, [2, 3, 4, 5]], ["AN", 6, 2, 6], ["FU", 4, [0, 1, 2, 3]], ["SP", 4, 0, 9, [3], 1], ["AN", 4, 1, 2], ["FFSP", 4, 0, [7, 6, 5, 4], 1, 1], ["AN", 4, 1, 6], ["FU", 2, [0, 1, 2, 3]], ["SP", 2, 0, 45, [1], 1], ["AN", 2, 1, 2], ["FFSP", 2, 0, [7, 6, 5, 4], 1, 1], ["AN", 2, 1, 6], ["PR", 5, 0, "auto_unroll_max_step$0"]]]], "r": [[2.59452e-05, 2.59442e-05, 2.59447e-05, 2.59442e-05, 2.59448e-05, 2.59446e-05, 2.59441e-05, 2.59449e-05, 2.59447e-05, 2.59447e-05], 0, 100.529, 1649095560], "v": "v0.6"}
{"i": [["[\"fused_depthwise_conv2d\", 224, 224, 3, 3, 3, [2, 2]]", "cuda -keys=cuda,gpu -max_num_threads=1024 -model=unknown -thread_warp_size=32", [-1, 16, 64, 49152, 2147483647, 1024, 8, 32], "", 0, []], [[], [["CI", 8], ["CI", 7], ["CI", 5], ["CHW", 3, "local"], ["SP", 3, 0, 1, [1, 1, 1, 1], 1], ["SP", 3, 5, 112, [2, 8, 1, 1], 1], ["SP", 3, 10, 112, [1, 4, 1, 2], 1], ["SP", 3, 15, 3, [1, 1, 1, 3], 1], ["SP", 3, 20, 3, [3, 1], 1], ["SP", 3, 23, 3, [3, 1], 1], ["RE", 3, [0, 5, 10, 15, 1, 6, 11, 16, 2, 7, 12, 17, 20, 23, 21, 24, 3, 8, 13, 18, 22, 25, 4, 9, 14, 19]], ["FSP", 4, 0, 4, 3], ["FSP", 4, 4, 5, 3], ["FSP", 4, 8, 6, 3], ["FSP", 4, 12, 7, 3], ["RE", 4, [0, 4, 8, 12, 1, 5, 9, 13, 2, 6, 10, 14, 3, 7, 11, 15]], ["CA", 3, 4, 11], ["CHR", 2, "shared", [3]], ["CA", 3, 4, 13], ["CHR", 1, "shared", [4]], ["CA", 2, 5, 13], ["CI", 1], ["FU", 12, [0, 1, 2, 3]], ["SP", 12, 0, 37632, [64], 1], ["AN", 12, 0, 5], ["AN", 12, 1, 6], ["FU", 6, [0, 1, 2, 3]], ["AN", 6, 0, 5], ["FU", 6, [1, 2, 3, 4]], ["AN", 6, 1, 4], ["FU", 6, [2, 3, 4, 5]], ["AN", 6, 2, 6], ["FU", 4, [0, 1, 2, 3]], ["SP", 4, 0, 9, [1], 1], ["AN", 4, 1, 2], ["FFSP", 4, 0, [7, 6, 5, 4], 1, 1], ["AN", 4, 1, 6], ["FU", 2, [0, 1, 2, 3]], ["SP", 2, 0, 15, [1], 1], ["AN", 2, 1, 2], ["FFSP", 2, 0, [7, 6, 5, 4], 1, 1], ["AN", 2, 1, 6], ["PR", 5, 0, "auto_unroll_max_step$0"]]]], "r": [[2.13914e-05, 2.13906e-05, 2.13896e-05, 2.13897e-05, 2.13901e-05, 2.13914e-05, 2.13909e-05, 2.13931e-05, 2.13936e-05, 2.13931e-05], 0, 59.9748, 1649095520], "v": "v0.6"}
{"i": [["[\"fused_depthwise_conv2d\", 224, 224, 3, 3, 3, [2, 2]]", "cuda -keys=cuda,gpu -max_num_threads=1024 -model=unknown -thread_warp_size=32", [-1, 16, 64, 49152, 2147483647, 1024, 8, 32], "", 0, []], [[], [["CI", 8], ["CI", 7], ["CI", 5], ["CHW", 3, "local"], ["SP", 3, 0, 1, [1, 1, 1, 1], 1], ["SP", 3, 5, 112, [1, 7, 1, 2], 1], ["SP", 3, 10, 112, [1, 7, 2, 2], 1], ["SP", 3, 15, 3, [1, 1, 3, 1], 1], ["SP", 3, 20, 3, [1, 3], 1], ["SP", 3, 23, 3, [3, 1], 1], ["RE", 3, [0, 5, 10, 15, 1, 6, 11, 16, 2, 7, 12, 17, 20, 23, 21, 24, 3, 8, 13, 18, 22, 25, 4, 9, 14, 19]], ["FSP", 4, 0, 4, 3], ["FSP", 4, 4, 5, 3], ["FSP", 4, 8, 6, 3], ["FSP", 4, 12, 7, 3], ["RE", 4, [0, 4, 8, 12, 1, 5, 9, 13, 2, 6, 10, 14, 3, 7, 11, 15]], ["CA", 3, 4, 11], ["CHR", 2, "shared", [3]], ["CA", 3, 4, 13], ["CHR", 1, "shared", [4]], ["CA", 2, 5, 13], ["CI", 1], ["FU", 12, [0, 1, 2, 3]], ["SP", 12, 0, 37632, [32], 1], ["AN", 12, 0, 5], ["AN", 12, 1, 6], ["FU", 6, [0, 1, 2, 3]], ["AN", 6, 0, 5], ["FU", 6, [1, 2, 3, 4]], ["AN", 6, 1, 4], ["FU", 6, [2, 3, 4, 5]], ["AN", 6, 2, 6], ["FU", 4, [0, 1, 2, 3]], ["SP", 4, 0, 9, [1], 1], ["AN", 4, 1, 2], ["FFSP", 4, 0, [7, 6, 5, 4], 1, 1], ["AN", 4, 1, 6], ["FU", 2, [0, 1, 2, 3]], ["SP", 2, 0, 45, [1], 1], ["AN", 2, 1, 2], ["FFSP", 2, 0, [7, 6, 5, 4], 1, 1], ["AN", 2, 1, 6], ["PR", 5, 0, "auto_unroll_max_step$1024"]]]], "r": [[9.83524e-06, 9.51866e-06, 9.44626e-06, 9.44623e-06, 9.5069e-06, 9.82611e-06, 9.7752e-06, 9.45406e-06, 9.58717e-06, 9.74242e-06], 0, 80.4119, 1649095539], "v": "v0.6"}
{"i": [["[\"fused_depthwise_conv2d\", 224, 224, 3, 3, 3, [2, 2]]", "cuda -keys=cuda,gpu -max_num_threads=1024 -model=unknown -thread_warp_size=32", [-1, 16, 64, 49152, 2147483647, 1024, 8, 32], "", 0, []], [[], [["CI", 8], ["CI", 7], ["CI", 5], ["CHW", 3, "local"], ["SP", 3, 0, 1, [1, 1, 1, 1], 1], ["SP", 3, 5, 112, [4, 4, 7, 1], 1], ["SP", 3, 10, 112, [1, 14, 1, 1], 1], ["SP", 3, 15, 3, [1, 1, 1, 1], 1], ["SP", 3, 20, 3, [1, 3], 1], ["SP", 3, 23, 3, [1, 3], 1], ["RE", 3, [0, 5, 10, 15, 1, 6, 11, 16, 2, 7, 12, 17, 20, 23, 21, 24, 3, 8, 13, 18, 22, 25, 4, 9, 14, 19]], ["FSP", 4, 0, 4, 3], ["FSP", 4, 4, 5, 3], ["FSP", 4, 8, 6, 3], ["FSP", 4, 12, 7, 3], ["RE", 4, [0, 4, 8, 12, 1, 5, 9, 13, 2, 6, 10, 14, 3, 7, 11, 15]], ["CA", 3, 4, 11], ["CHR", 2, "shared", [3]], ["CA", 3, 4, 13], ["CHR", 1, "shared", [4]], ["CA", 2, 5, 13], ["CI", 1], ["FU", 12, [0, 1, 2, 3]], ["SP", 12, 0, 37632, [2], 1], ["AN", 12, 0, 5], ["AN", 12, 1, 6], ["FU", 6, [0, 1, 2, 3]], ["AN", 6, 0, 5], ["FU", 6, [1, 2, 3, 4]], ["AN", 6, 1, 4], ["FU", 6, [2, 3, 4, 5]], ["AN", 6, 2, 6], ["FU", 4, [0, 1, 2, 3]], ["SP", 4, 0, 9, [3], 1], ["AN", 4, 1, 2], ["FFSP", 4, 0, [7, 6, 5, 4], 1, 1], ["AN", 4, 1, 6], ["FU", 2, [0, 1, 2, 3]], ["SP", 2, 0, 45, [1], 1], ["AN", 2, 1, 2], ["FFSP", 2, 0, [7, 6, 5, 4], 1, 1], ["AN", 2, 1, 6], ["PR", 5, 0, "auto_unroll_max_step$0"]]]], "r": [[5.10784e-05, 5.10872e-05, 5.10857e-05, 5.10876e-05, 5.10851e-05, 5.10821e-05, 5.10797e-05, 5.1085e-05, 5.10873e-05, 5.10848e-05], 0, 74.8867, 1649095535], "v": "v0.6"}
{"i": [["[\"fused_depthwise_conv2d\", 224, 224, 3, 3, 3, [2, 2]]", "cuda -keys=cuda,gpu -max_num_threads=1024 -model=unknown -thread_warp_size=32", [-1, 16, 64, 49152, 2147483647, 1024, 8, 32], "", 0, []], [[], [["CI", 8], ["CI", 7], ["CI", 5], ["CHW", 3, "local"], ["SP", 3, 0, 1, [1, 1, 1, 1], 1], ["SP", 3, 5, 112, [7, 16, 1, 1], 1], ["SP", 3, 10, 112, [1, 1, 8, 1], 1], ["SP", 3, 15, 3, [1, 3, 1, 1], 1], ["SP", 3, 20, 3, [3, 1], 1], ["SP", 3, 23, 3, [1, 1], 1], ["RE", 3, [0, 5, 10, 15, 1, 6, 11, 16, 2, 7, 12, 17, 20, 23, 21, 24, 3, 8, 13, 18, 22, 25, 4, 9, 14, 19]], ["FSP", 4, 0, 4, 3], ["FSP", 4, 4, 5, 3], ["FSP", 4, 8, 6, 3], ["FSP", 4, 12, 7, 3], ["RE", 4, [0, 4, 8, 12, 1, 5, 9, 13, 2, 6, 10, 14, 3, 7, 11, 15]], ["CA", 3, 4, 11], ["CHR", 2, "shared", [3]], ["CA", 3, 4, 13], ["CHR", 1, "shared", [4]], ["CA", 2, 5, 13], ["CI", 1], ["FU", 12, [0, 1, 2, 3]], ["SP", 12, 0, 37632, [1], 1], ["AN", 12, 0, 5], ["AN", 12, 1, 6], ["FU", 6, [0, 1, 2, 3]], ["AN", 6, 0, 5], ["FU", 6, [1, 2, 3, 4]], ["AN", 6, 1, 4], ["FU", 6, [2, 3, 4, 5]], ["AN", 6, 2, 6], ["FU", 4, [0, 1, 2, 3]], ["SP", 4, 0, 3, [1], 1], ["AN", 4, 1, 2], ["FFSP", 4, 0, [7, 6, 5, 4], 1, 1], ["AN", 4, 1, 6], ["FU", 2, [0, 1, 2, 3]], ["SP", 2, 0, 45, [1], 1], ["AN", 2, 1, 2], ["FFSP", 2, 0, [7, 6, 5, 4], 1, 1], ["AN", 2, 1, 6], ["PR", 5, 0, "auto_unroll_max_step$16"]]]], "r": [[0.000196419, 0.000196429, 0.000196429, 0.000196424, 0.000196416, 0.000196424, 0.000196423, 0.000196429, 0.000196417, 0.000196425], 0, 114.478, 1649095574], "v": "v0.6"}
{"i": [["[\"fused_depthwise_conv2d\", 224, 224, 3, 3, 3, [2, 2]]", "cuda -keys=cuda,gpu -max_num_threads=1024 -model=unknown -thread_warp_size=32", [-1, 16, 64, 49152, 2147483647, 1024, 8, 32], "", 0, []], [[], [["CI", 8], ["CI", 7], ["CI", 5], ["CHW", 3, "local"], ["SP", 3, 0, 1, [1, 1, 1, 1], 1], ["SP", 3, 5, 112, [2, 7, 1, 4], 1], ["SP", 3, 10, 112, [1, 2, 1, 2], 1], ["SP", 3, 15, 3, [1, 1, 1, 1], 1], ["SP", 3, 20, 3, [1, 3], 1], ["SP", 3, 23, 3, [3, 1], 1], ["RE", 3, [0, 5, 10, 15, 1, 6, 11, 16, 2, 7, 12, 17, 20, 23, 21, 24, 3, 8, 13, 18, 22, 25, 4, 9, 14, 19]], ["FSP", 4, 0, 4, 3], ["FSP", 4, 4, 5, 3], ["FSP", 4, 8, 6, 3], ["FSP", 4, 12, 7, 3], ["RE", 4, [0, 4, 8, 12, 1, 5, 9, 13, 2, 6, 10, 14, 3, 7, 11, 15]], ["CA", 3, 4, 11], ["CHR", 2, "shared", [3]], ["CA", 3, 4, 13], ["CHR", 1, "shared", [4]], ["CA", 2, 5, 13], ["CI", 1], ["FU", 12, [0, 1, 2, 3]], ["SP", 12, 0, 37632, [4], 1], ["AN", 12, 0, 5], ["AN", 12, 1, 6], ["FU", 6, [0, 1, 2, 3]], ["AN", 6, 0, 5], ["FU", 6, [1, 2, 3, 4]], ["AN", 6, 1, 4], ["FU", 6, [2, 3, 4, 5]], ["AN", 6, 2, 6], ["FU", 4, [0, 1, 2, 3]], ["SP", 4, 0, 9, [1], 1], ["AN", 4, 1, 2], ["FFSP", 4, 0, [7, 6, 5, 4], 1, 1], ["AN", 4, 1, 6], ["FU", 2, [0, 1, 2, 3]], ["SP", 2, 0, 45, [1], 1], ["AN", 2, 1, 2], ["FFSP", 2, 0, [7, 6, 5, 4], 1, 1], ["AN", 2, 1, 6], ["PR", 5, 0, "auto_unroll_max_step$0"]]]], "r": [[3.26521e-05, 3.26515e-05, 3.26526e-05, 3.26539e-05, 3.26536e-05, 3.26537e-05, 3.2654e-05, 3.26526e-05, 3.26522e-05, 3.26527e-05], 0, 125.102, 1649095585], "v": "v0.6"}
{"i": [["[\"fused_depthwise_conv2d\", 224, 224, 3, 3, 3, [2, 2]]", "cuda -keys=cuda,gpu -max_num_threads=1024 -model=unknown -thread_warp_size=32", [-1, 16, 64, 49152, 2147483647, 1024, 8, 32], "", 0, []], [[], [["CI", 8], ["CI", 7], ["CI", 5], ["CHW", 3, "local"], ["SP", 3, 0, 1, [1, 1, 1, 1], 1], ["SP", 3, 5, 112, [1, 8, 1, 1], 1], ["SP", 3, 10, 112, [1, 16, 1, 1], 1], ["SP", 3, 15, 3, [1, 3, 1, 1], 1], ["SP", 3, 20, 3, [3, 1], 1], ["SP", 3, 23, 3, [3, 1], 1], ["RE", 3, [0, 5, 10, 15, 1, 6, 11, 16, 2, 7, 12, 17, 20, 23, 21, 24, 3, 8, 13, 18, 22, 25, 4, 9, 14, 19]], ["FSP", 4, 0, 4, 3], ["FSP", 4, 4, 5, 3], ["FSP", 4, 8, 6, 3], ["FSP", 4, 12, 7, 3], ["RE", 4, [0, 4, 8, 12, 1, 5, 9, 13, 2, 6, 10, 14, 3, 7, 11, 15]], ["CA", 3, 4, 11], ["CHR", 2, "shared", [3]], ["CA", 3, 4, 13], ["CHR", 1, "shared", [4]], ["CA", 2, 5, 13], ["CI", 1], ["FU", 12, [0, 1, 2, 3]], ["SP", 12, 0, 37632, [32], 1], ["AN", 12, 0, 5], ["AN", 12, 1, 6], ["FU", 6, [0, 1, 2, 3]], ["AN", 6, 0, 5], ["FU", 6, [1, 2, 3, 4]], ["AN", 6, 1, 4], ["FU", 6, [2, 3, 4, 5]], ["AN", 6, 2, 6], ["FU", 4, [0, 1, 2, 3]], ["SP", 4, 0, 3, [1], 1], ["AN", 4, 1, 2], ["FFSP", 4, 0, [7, 6, 5, 4], 1, 1], ["AN", 4, 1, 6], ["FU", 2, [0, 1, 2, 3]], ["SP", 2, 0, 3, [1], 1], ["AN", 2, 1, 2], ["FFSP", 2, 0, [7, 6, 5, 4], 1, 1], ["AN", 2, 1, 6], ["PR", 5, 0, "auto_unroll_max_step$1024"]]]], "r": [[7.58814e-06, 7.58809e-06, 7.58717e-06, 7.5883e-06, 7.58745e-06, 7.5877e-06, 7.58704e-06, 7.58773e-06, 7.58803e-06, 7.5878e-06], 0, 108.921, 1649095569], "v": "v0.6"}
{"i": [["[\"fused_depthwise_conv2d\", 224, 224, 3, 3, 3, [2, 2]]", "cuda -keys=cuda,gpu -max_num_threads=1024 -model=unknown -thread_warp_size=32", [-1, 16, 64, 49152, 2147483647, 1024, 8, 32], "", 0, []], [[], [["CI", 8], ["CI", 7], ["CI", 5], ["CHW", 3, "local"], ["SP", 3, 0, 1, [1, 1, 1, 1], 1], ["SP", 3, 5, 112, [1, 8, 7, 1], 1], ["SP", 3, 10, 112, [4, 4, 1, 1], 1], ["SP", 3, 15, 3, [1, 1, 1, 3], 1], ["SP", 3, 20, 3, [1, 3], 1], ["SP", 3, 23, 3, [1, 3], 1], ["RE", 3, [0, 5, 10, 15, 1, 6, 11, 16, 2, 7, 12, 17, 20, 23, 21, 24, 3, 8, 13, 18, 22, 25, 4, 9, 14, 19]], ["FSP", 4, 0, 4, 3], ["FSP", 4, 4, 5, 3], ["FSP", 4, 8, 6, 3], ["FSP", 4, 12, 7, 3], ["RE", 4, [0, 4, 8, 12, 1, 5, 9, 13, 2, 6, 10, 14, 3, 7, 11, 15]], ["CA", 3, 4, 11], ["CHR", 2, "shared", [3]], ["CA", 3, 4, 13], ["CHR", 1, "shared", [4]], ["CA", 2, 5, 13], ["CI", 1], ["FU", 12, [0, 1, 2, 3]], ["SP", 12, 0, 37632, [32], 1], ["AN", 12, 0, 5], ["AN", 12, 1, 6], ["FU", 6, [0, 1, 2, 3]], ["AN", 6, 0, 5], ["FU", 6, [1, 2, 3, 4]], ["AN", 6, 1, 4], ["FU", 6, [2, 3, 4, 5]], ["AN", 6, 2, 6], ["FU", 4, [0, 1, 2, 3]], ["SP", 4, 0, 9, [1], 1], ["AN", 4, 1, 2], ["FFSP", 4, 0, [7, 6, 5, 4], 1, 1], ["AN", 4, 1, 6], ["FU", 2, [0, 1, 2, 3]], ["SP", 2, 0, 315, [1], 1], ["AN", 2, 1, 2], ["FFSP", 2, 0, [7, 6, 5, 4], 1, 1], ["AN", 2, 1, 6], ["PR", 5, 0, "auto_unroll_max_step$0"]]]], "r": [[0.000103717, 0.000103746, 0.000103746, 0.000103725, 0.000103695, 0.000103701, 0.000103696, 0.000103724, 0.000103664, 0.000103699], 0, 89.9298, 1649095550], "v": "v0.6"}
{"i": [["[\"fused_depthwise_conv2d\", 224, 224, 3, 3, 3, [2, 2]]", "cuda -keys=cuda,gpu -max_num_threads=1024 -model=unknown -thread_warp_size=32", [-1, 16, 64, 49152, 2147483647, 1024, 8, 32], "", 0, []], [[], [["CI", 8], ["CI", 7], ["CI", 5], ["CHW", 3, "local"], ["SP", 3, 0, 1, [1, 1, 1, 1], 1], ["SP", 3, 5, 112, [1, 7, 4, 1], 1], ["SP", 3, 10, 112, [8, 1, 1, 1], 1], ["SP", 3, 15, 3, [1, 1, 1, 3], 1], ["SP", 3, 20, 3, [1, 1], 1], ["SP", 3, 23, 3, [1, 1], 1], ["RE", 3, [0, 5, 10, 15, 1, 6, 11, 16, 2, 7, 12, 17, 20, 23, 21, 24, 3, 8, 13, 18, 22, 25, 4, 9, 14, 19]], ["FSP", 4, 0, 4, 3], ["FSP", 4, 4, 5, 3], ["FSP", 4, 8, 6, 3], ["FSP", 4, 12, 7, 3], ["RE", 4, [0, 4, 8, 12, 1, 5, 9, 13, 2, 6, 10, 14, 3, 7, 11, 15]], ["CA", 3, 4, 11], ["CHR", 2, "shared", [3]], ["CA", 3, 4, 13], ["CHR", 1, "shared", [4]], ["CA", 2, 5, 13], ["CI", 1], ["FU", 12, [0, 1, 2, 3]], ["SP", 12, 0, 37632, [32], 1], ["AN", 12, 0, 5], ["AN", 12, 1, 6], ["FU", 6, [0, 1, 2, 3]], ["AN", 6, 0, 5], ["FU", 6, [1, 2, 3, 4]], ["AN", 6, 1, 4], ["FU", 6, [2, 3, 4, 5]], ["AN", 6, 2, 6], ["FU", 4, [0, 1, 2, 3]], ["SP", 4, 0, 1, [1], 1], ["AN", 4, 1, 2], ["FFSP", 4, 0, [7, 6, 5, 4], 1, 1], ["AN", 4, 1, 6], ["FU", 2, [0, 1, 2, 3]], ["SP", 2, 0, 7, [1], 1], ["AN", 2, 1, 2], ["FFSP", 2, 0, [7, 6, 5, 4], 1, 1], ["AN", 2, 1, 6], ["PR", 5, 0, "auto_unroll_max_step$64"]]]], "r": [[0.00051369, 0.0005137, 0.00051369, 0.000513667, 0.000513659, 0.000513726, 0.000513773, 0.000513776, 0.00051375, 0.000513855], 0, 95.5136, 1649095555], "v": "v0.6"}
{"i": [["[\"fused_depthwise_conv2d\", 224, 224, 3, 3, 3, [2, 2]]", "cuda -keys=cuda,gpu -max_num_threads=1024 -model=unknown -thread_warp_size=32", [-1, 16, 64, 49152, 2147483647, 1024, 8, 32], "", 0, []], [[], [["CI", 8], ["CI", 7], ["CI", 5], ["CHW", 3, "local"], ["SP", 3, 0, 1, [1, 1, 1, 1], 1], ["SP", 3, 5, 112, [1, 7, 2, 1], 1], ["SP", 3, 10, 112, [2, 7, 4, 1], 1], ["SP", 3, 15, 3, [3, 1, 1, 1], 1], ["SP", 3, 20, 3, [1, 1], 1], ["SP", 3, 23, 3, [1, 1], 1], ["RE", 3, [0, 5, 10, 15, 1, 6, 11, 16, 2, 7, 12, 17, 20, 23, 21, 24, 3, 8, 13, 18, 22, 25, 4, 9, 14, 19]], ["FSP", 4, 0, 4, 3], ["FSP", 4, 4, 5, 3], ["FSP", 4, 8, 6, 3], ["FSP", 4, 12, 7, 3], ["RE", 4, [0, 4, 8, 12, 1, 5, 9, 13, 2, 6, 10, 14, 3, 7, 11, 15]], ["CA", 3, 4, 11], ["CHR", 2, "shared", [3]], ["CA", 3, 4, 13], ["CHR", 1, "shared", [4]], ["CA", 2, 5, 13], ["CI", 1], ["FU", 12, [0, 1, 2, 3]], ["SP", 12, 0, 37632, [32], 1], ["AN", 12, 0, 5], ["AN", 12, 1, 6], ["FU", 6, [0, 1, 2, 3]], ["AN", 6, 0, 5], ["FU", 6, [1, 2, 3, 4]], ["AN", 6, 1, 4], ["FU", 6, [2, 3, 4, 5]], ["AN", 6, 2, 6], ["FU", 4, [0, 1, 2, 3]], ["SP", 4, 0, 3, [3], 1], ["AN", 4, 1, 2], ["FFSP", 4, 0, [7, 6, 5, 4], 1, 1], ["AN", 4, 1, 6], ["FU", 2, [0, 1, 2, 3]], ["SP", 2, 0, 27, [1], 1], ["AN", 2, 1, 2], ["FFSP", 2, 0, [7, 6, 5, 4], 1, 1], ["AN", 2, 1, 6], ["PR", 5, 0, "auto_unroll_max_step$1024"]]]], "r": [[5.23079e-05, 5.23074e-05, 5.23092e-05, 5.23109e-05, 5.23098e-05, 5.23123e-05, 5.2309e-05, 5.23081e-05, 5.2311e-05, 5.23091e-05], 0, 125.022, 1649095580], "v": "v0.6"}
{"i": [["[\"fused_depthwise_conv2d\", 224, 224, 3, 3, 3, [2, 2]]", "cuda -keys=cuda,gpu -max_num_threads=1024 -model=unknown -thread_warp_size=32", [-1, 16, 64, 49152, 2147483647, 1024, 8, 32], "", 0, []], [[], [["CI", 8], ["CI", 7], ["CI", 5], ["CHW", 3, "local"], ["SP", 3, 0, 1, [1, 1, 1, 1], 1], ["SP", 3, 5, 112, [1, 28, 2, 1], 1], ["SP", 3, 10, 112, [1, 1, 8, 2], 1], ["SP", 3, 15, 3, [1, 1, 1, 3], 1], ["SP", 3, 20, 3, [3, 1], 1], ["SP", 3, 23, 3, [3, 1], 1], ["RE", 3, [0, 5, 10, 15, 1, 6, 11, 16, 2, 7, 12, 17, 20, 23, 21, 24, 3, 8, 13, 18, 22, 25, 4, 9, 14, 19]], ["FSP", 4, 0, 4, 3], ["FSP", 4, 4, 5, 3], ["FSP", 4, 8, 6, 3], ["FSP", 4, 12, 7, 3], ["RE", 4, [0, 4, 8, 12, 1, 5, 9, 13, 2, 6, 10, 14, 3, 7, 11, 15]], ["CA", 3, 4, 11], ["CHR", 2, "shared", [3]], ["CA", 3, 4, 13], ["CHR", 1, "shared", [4]], ["CA", 2, 5, 13], ["CI", 1], ["FU", 12, [0, 1, 2, 3]], ["SP", 12, 0, 37632, [32], 1], ["AN", 12, 0, 5], ["AN", 12, 1, 6], ["FU", 6, [0, 1, 2, 3]], ["AN", 6, 0, 5], ["FU", 6, [1, 2, 3, 4]], ["AN", 6, 1, 4], ["FU", 6, [2, 3, 4, 5]], ["AN", 6, 2, 6], ["FU", 4, [0, 1, 2, 3]], ["SP", 4, 0, 3, [1], 1], ["AN", 4, 1, 2], ["FFSP", 4, 0, [7, 6, 5, 4], 1, 1], ["AN", 4, 1, 6], ["FU", 2, [0, 1, 2, 3]], ["SP", 2, 0, 155, [5], 1], ["AN", 2, 1, 2], ["FFSP", 2, 0, [7, 6, 5, 4], 1, 1], ["AN", 2, 1, 6], ["PR", 5, 0, "auto_unroll_max_step$16"]]]], "r": [[8.69164e-05, 8.69166e-05, 8.69156e-05, 8.69195e-05, 8.69155e-05, 8.6912e-05, 8.69115e-05, 8.69216e-05, 8.69162e-05, 8.69168e-05], 0, 156.293, 1649095616], "v": "v0.6"}
{"i": [["[\"fused_depthwise_conv2d\", 224, 224, 3, 3, 3, [2, 2]]", "cuda -keys=cuda,gpu -max_num_threads=1024 -model=unknown -thread_warp_size=32", [-1, 16, 64, 49152, 2147483647, 1024, 8, 32], "", 0, []], [[], [["CI", 8], ["CI", 7], ["CI", 5], ["CHW", 3, "local"], ["SP", 3, 0, 1, [1, 1, 1, 1], 1], ["SP", 3, 5, 112, [1, 28, 1, 1], 1], ["SP", 3, 10, 112, [4, 1, 1, 7], 1], ["SP", 3, 15, 3, [1, 1, 3, 1], 1], ["SP", 3, 20, 3, [3, 1], 1], ["SP", 3, 23, 3, [1, 1], 1], ["RE", 3, [0, 5, 10, 15, 1, 6, 11, 16, 2, 7, 12, 17, 20, 23, 21, 24, 3, 8, 13, 18, 22, 25, 4, 9, 14, 19]], ["FSP", 4, 0, 4, 3], ["FSP", 4, 4, 5, 3], ["FSP", 4, 8, 6, 3], ["FSP", 4, 12, 7, 3], ["RE", 4, [0, 4, 8, 12, 1, 5, 9, 13, 2, 6, 10, 14, 3, 7, 11, 15]], ["CA", 3, 4, 11], ["CHR", 2, "shared", [3]], ["CA", 3, 4, 13], ["CHR", 1, "shared", [4]], ["CA", 2, 5, 13], ["CI", 1], ["FU", 12, [0, 1, 2, 3]], ["SP", 12, 0, 37632, [32], 1], ["AN", 12, 0, 5], ["AN", 12, 1, 6], ["FU", 6, [0, 1, 2, 3]], ["AN", 6, 0, 5], ["FU", 6, [1, 2, 3, 4]], ["AN", 6, 1, 4], ["FU", 6, [2, 3, 4, 5]], ["AN", 6, 2, 6], ["FU", 4, [0, 1, 2, 3]], ["SP", 4, 0, 3, [1], 1], ["AN", 4, 1, 2], ["FFSP", 4, 0, [7, 6, 5, 4], 1, 1], ["AN", 4, 1, 6], ["FU", 2, [0, 1, 2, 3]], ["SP", 2, 0, 39, [1], 1], ["AN", 2, 1, 2], ["FFSP", 2, 0, [7, 6, 5, 4], 1, 1], ["AN", 2, 1, 6], ["PR", 5, 0, "auto_unroll_max_step$0"]]]], "r": [[0.000269255, 0.000269254, 0.000269258, 0.000269267, 0.000269252, 0.000269258, 0.000269256, 0.000269251, 0.000269255, 0.000269257], 0, 180.086, 1649095640], "v": "v0.6"}
{"i": [["[\"fused_depthwise_conv2d\", 224, 224, 3, 3, 3, [2, 2]]", "cuda -keys=cuda,gpu -max_num_threads=1024 -model=unknown -thread_warp_size=32", [-1, 16, 64, 49152, 2147483647, 1024, 8, 32], "", 0, []], [[], [["CI", 8], ["CI", 7], ["CI", 5], ["CHW", 3, "local"], ["SP", 3, 0, 1, [1, 1, 1, 1], 1], ["SP", 3, 5, 112, [2, 7, 1, 2], 1], ["SP", 3, 10, 112, [1, 16, 1, 1], 1], ["SP", 3, 15, 3, [1, 1, 1, 1], 1], ["SP", 3, 20, 3, [1, 1], 1], ["SP", 3, 23, 3, [3, 1], 1], ["RE", 3, [0, 5, 10, 15, 1, 6, 11, 16, 2, 7, 12, 17, 20, 23, 21, 24, 3, 8, 13, 18, 22, 25, 4, 9, 14, 19]], ["FSP", 4, 0, 4, 3], ["FSP", 4, 4, 5, 3], ["FSP", 4, 8, 6, 3], ["FSP", 4, 12, 7, 3], ["RE", 4, [0, 4, 8, 12, 1, 5, 9, 13, 2, 6, 10, 14, 3, 7, 11, 15]], ["CA", 3, 4, 11], ["CHR", 2, "shared", [3]], ["CA", 3, 4, 13], ["CHR", 1, "shared", [4]], ["CA", 2, 5, 13], ["CI", 1], ["FU", 12, [0, 1, 2, 3]], ["SP", 12, 0, 37632, [32], 1], ["AN", 12, 0, 5], ["AN", 12, 1, 6], ["FU", 6, [0, 1, 2, 3]], ["AN", 6, 0, 5], ["FU", 6, [1, 2, 3, 4]], ["AN", 6, 1, 4], ["FU", 6, [2, 3, 4, 5]], ["AN", 6, 2, 6], ["FU", 4, [0, 1, 2, 3]], ["SP", 4, 0, 3, [1], 1], ["AN", 4, 1, 2], ["FFSP", 4, 0, [7, 6, 5, 4], 1, 1], ["AN", 4, 1, 6], ["FU", 2, [0, 1, 2, 3]], ["SP", 2, 0, 9, [1], 1], ["AN", 2, 1, 2], ["FFSP", 2, 0, [7, 6, 5, 4], 1, 1], ["AN", 2, 1, 6], ["PR", 5, 0, "auto_unroll_max_step$64"]]]], "r": [[9.3119e-06, 9.31469e-06, 9.31594e-06, 9.31548e-06, 9.31446e-06, 9.31452e-06, 9.31478e-06, 9.31505e-06, 9.31566e-06, 9.31608e-06], 0, 104.938, 1649095565], "v": "v0.6"}
{"i": [["[\"fused_depthwise_conv2d\", 224, 224, 3, 3, 3, [2, 2]]", "cuda -keys=cuda,gpu -max_num_threads=1024 -model=unknown -thread_warp_size=32", [-1, 16, 64, 49152, 2147483647, 1024, 8, 32], "", 0, []], [[], [["CI", 8], ["CI", 7], ["CI", 5], ["CHW", 3, "local"], ["SP", 3, 0, 1, [1, 1, 1, 1], 1], ["SP", 3, 5, 112, [2, 4, 1, 1], 1], ["SP", 3, 10, 112, [1, 8, 1, 7], 1], ["SP", 3, 15, 3, [1, 1, 1, 1], 1], ["SP", 3, 20, 3, [1, 1], 1], ["SP", 3, 23, 3, [3, 1], 1], ["RE", 3, [0, 5, 10, 15, 1, 6, 11, 16, 2, 7, 12, 17, 20, 23, 21, 24, 3, 8, 13, 18, 22, 25, 4, 9, 14, 19]], ["FSP", 4, 0, 4, 3], ["FSP", 4, 4, 5, 3], ["FSP", 4, 8, 6, 3], ["FSP", 4, 12, 7, 3], ["RE", 4, [0, 4, 8, 12, 1, 5, 9, 13, 2, 6, 10, 14, 3, 7, 11, 15]], ["CA", 3, 4, 11], ["CHR", 2, "shared", [3]], ["CA", 3, 4, 13], ["CHR", 1, "shared", [4]], ["CA", 2, 5, 13], ["CI", 1], ["FU", 12, [0, 1, 2, 3]], ["SP", 12, 0, 37632, [32], 1], ["AN", 12, 0, 5], ["AN", 12, 1, 6], ["FU", 6, [0, 1, 2, 3]], ["AN", 6, 0, 5], ["FU", 6, [1, 2, 3, 4]], ["AN", 6, 1, 4], ["FU", 6, [2, 3, 4, 5]], ["AN", 6, 2, 6], ["FU", 4, [0, 1, 2, 3]], ["SP", 4, 0, 3, [1], 1], ["AN", 4, 1, 2], ["FFSP", 4, 0, [7, 6, 5, 4], 1, 1], ["AN", 4, 1, 6], ["FU", 2, [0, 1, 2, 3]], ["SP", 2, 0, 45, [1], 1], ["AN", 2, 1, 2], ["FFSP", 2, 0, [7, 6, 5, 4], 1, 1], ["AN", 2, 1, 6], ["PR", 5, 0, "auto_unroll_max_step$1024"]]]], "r": [[9.8739e-06, 9.87262e-06, 9.87049e-06, 9.86985e-06, 9.87147e-06, 9.87153e-06, 9.87139e-06, 9.87017e-06, 9.87067e-06, 9.87066e-06], 0, 131.131, 1649095590], "v": "v0.6"}
{"i": [["[\"fused_depthwise_conv2d\", 224, 224, 3, 3, 3, [2, 2]]", "cuda -keys=cuda,gpu -max_num_threads=1024 -model=unknown -thread_warp_size=32", [-1, 16, 64, 49152, 2147483647, 1024, 8, 32], "", 0, []], [[], [["CI", 8], ["CI", 7], ["CI", 5], ["CHW", 3, "local"], ["SP", 3, 0, 1, [1, 1, 1, 1], 1], ["SP", 3, 5, 112, [1, 14, 1, 4], 1], ["SP", 3, 10, 112, [1, 2, 2, 7], 1], ["SP", 3, 15, 3, [1, 1, 1, 1], 1], ["SP", 3, 20, 3, [1, 1], 1], ["SP", 3, 23, 3, [3, 1], 1], ["RE", 3, [0, 5, 10, 15, 1, 6, 11, 16, 2, 7, 12, 17, 20, 23, 21, 24, 3, 8, 13, 18, 22, 25, 4, 9, 14, 19]], ["FSP", 4, 0, 4, 3], ["FSP", 4, 4, 5, 3], ["FSP", 4, 8, 6, 3], ["FSP", 4, 12, 7, 3], ["RE", 4, [0, 4, 8, 12, 1, 5, 9, 13, 2, 6, 10, 14, 3, 7, 11, 15]], ["CA", 3, 4, 11], ["CHR", 2, "shared", [3]], ["CA", 3, 4, 13], ["CHR", 1, "shared", [4]], ["CA", 2, 5, 13], ["CI", 1], ["FU", 12, [0, 1, 2, 3]], ["SP", 12, 0, 37632, [32], 1], ["AN", 12, 0, 5], ["AN", 12, 1, 6], ["FU", 6, [0, 1, 2, 3]], ["AN", 6, 0, 5], ["FU", 6, [1, 2, 3, 4]], ["AN", 6, 1, 4], ["FU", 6, [2, 3, 4, 5]], ["AN", 6, 2, 6], ["FU", 4, [0, 1, 2, 3]], ["SP", 4, 0, 3, [1], 1], ["AN", 4, 1, 2], ["FFSP", 4, 0, [7, 6, 5, 4], 1, 1], ["AN", 4, 1, 6], ["FU", 2, [0, 1, 2, 3]], ["SP", 2, 0, 35, [35], 1], ["AN", 2, 1, 2], ["FFSP", 2, 0, [7, 6, 5, 4], 1, 1], ["AN", 2, 1, 6], ["PR", 5, 0, "auto_unroll_max_step$1024"]]]], "r": [[6.25258e-05, 6.25274e-05, 6.25341e-05, 6.25305e-05, 6.25313e-05, 6.25255e-05, 6.25257e-05, 6.25261e-05, 6.25275e-05, 6.25295e-05], 0, 194.527, 1649095650], "v": "v0.6"}
{"i": [["[\"fused_depthwise_conv2d\", 224, 224, 3, 3, 3, [2, 2]]", "cuda -keys=cuda,gpu -max_num_threads=1024 -model=unknown -thread_warp_size=32", [-1, 16, 64, 49152, 2147483647, 1024, 8, 32], "", 0, []], [[], [["CI", 8], ["CI", 7], ["CI", 5], ["CHW", 3, "local"], ["SP", 3, 0, 1, [1, 1, 1, 1], 1], ["SP", 3, 5, 112, [1, 2, 1, 2], 1], ["SP", 3, 10, 112, [1, 56, 1, 1], 1], ["SP", 3, 15, 3, [1, 1, 1, 3], 1], ["SP", 3, 20, 3, [3, 1], 1], ["SP", 3, 23, 3, [3, 1], 1], ["RE", 3, [0, 5, 10, 15, 1, 6, 11, 16, 2, 7, 12, 17, 20, 23, 21, 24, 3, 8, 13, 18, 22, 25, 4, 9, 14, 19]], ["FSP", 4, 0, 4, 3], ["FSP", 4, 4, 5, 3], ["FSP", 4, 8, 6, 3], ["FSP", 4, 12, 7, 3], ["RE", 4, [0, 4, 8, 12, 1, 5, 9, 13, 2, 6, 10, 14, 3, 7, 11, 15]], ["CA", 3, 4, 11], ["CHR", 2, "shared", [3]], ["CA", 3, 4, 13], ["CHR", 1, "shared", [4]], ["CA", 2, 5, 13], ["CI", 1], ["FU", 12, [0, 1, 2, 3]], ["SP", 12, 0, 37632, [32], 1], ["AN", 12, 0, 5], ["AN", 12, 1, 6], ["FU", 6, [0, 1, 2, 3]], ["AN", 6, 0, 5], ["FU", 6, [1, 2, 3, 4]], ["AN", 6, 1, 4], ["FU", 6, [2, 3, 4, 5]], ["AN", 6, 2, 6], ["FU", 4, [0, 1, 2, 3]], ["SP", 4, 0, 27, [1], 1], ["AN", 4, 1, 2], ["FFSP", 4, 0, [7, 6, 5, 4], 1, 1], ["AN", 4, 1, 6], ["FU", 2, [0, 1, 2, 3]], ["SP", 2, 0, 45, [1], 1], ["AN", 2, 1, 2], ["FFSP", 2, 0, [7, 6, 5, 4], 1, 1], ["AN", 2, 1, 6], ["PR", 5, 0, "auto_unroll_max_step$0"]]]], "r": [[1.43284e-05, 1.43279e-05, 1.43298e-05, 1.4328e-05, 1.43276e-05, 1.43296e-05, 1.43276e-05, 1.43291e-05, 1.4327e-05, 1.43292e-05], 0, 184.735, 1649095645], "v": "v0.6"}
{"i": [["[\"fused_depthwise_conv2d\", 224, 224, 3, 3, 3, [2, 2]]", "cuda -keys=cuda,gpu -max_num_threads=1024 -model=unknown -thread_warp_size=32", [-1, 16, 64, 49152, 2147483647, 1024, 8, 32], "", 0, []], [[], [["CI", 8], ["CI", 7], ["CI", 5], ["CHW", 3, "local"], ["SP", 3, 0, 1, [1, 1, 1, 1], 1], ["SP", 3, 5, 112, [1, 28, 2, 1], 1], ["SP", 3, 10, 112, [1, 1, 16, 1], 1], ["SP", 3, 15, 3, [1, 3, 1, 1], 1], ["SP", 3, 20, 3, [3, 1], 1], ["SP", 3, 23, 3, [1, 1], 1], ["RE", 3, [0, 5, 10, 15, 1, 6, 11, 16, 2, 7, 12, 17, 20, 23, 21, 24, 3, 8, 13, 18, 22, 25, 4, 9, 14, 19]], ["FSP", 4, 0, 4, 3], ["FSP", 4, 4, 5, 3], ["FSP", 4, 8, 6, 3], ["FSP", 4, 12, 7, 3], ["RE", 4, [0, 4, 8, 12, 1, 5, 9, 13, 2, 6, 10, 14, 3, 7, 11, 15]], ["CA", 3, 4, 11], ["CHR", 2, "shared", [3]], ["CA", 3, 4, 13], ["CHR", 1, "shared", [4]], ["CA", 2, 5, 13], ["CI", 1], ["FU", 12, [0, 1, 2, 3]], ["SP", 12, 0, 37632, [32], 1], ["AN", 12, 0, 5], ["AN", 12, 1, 6], ["FU", 6, [0, 1, 2, 3]], ["AN", 6, 0, 5], ["FU", 6, [1, 2, 3, 4]], ["AN", 6, 1, 4], ["FU", 6, [2, 3, 4, 5]], ["AN", 6, 2, 6], ["FU", 4, [0, 1, 2, 3]], ["SP", 4, 0, 3, [3], 1], ["AN", 4, 1, 2], ["FFSP", 4, 0, [7, 6, 5, 4], 1, 1], ["AN", 4, 1, 6], ["FU", 2, [0, 1, 2, 3]], ["SP", 2, 0, 155, [5], 1], ["AN", 2, 1, 2], ["FFSP", 2, 0, [7, 6, 5, 4], 1, 1], ["AN", 2, 1, 6], ["PR", 5, 0, "auto_unroll_max_step$16"]]]], "r": [[5.92915e-05, 5.92855e-05, 5.92925e-05, 5.92903e-05, 5.92877e-05, 5.92935e-05, 5.92899e-05, 5.92875e-05, 5.92892e-05, 5.92889e-05], 0, 195.473, 1649095655], "v": "v0.6"}
{"i": [["[\"fused_depthwise_conv2d\", 224, 224, 3, 3, 3, [2, 2]]", "cuda -keys=cuda,gpu -max_num_threads=1024 -model=unknown -thread_warp_size=32", [-1, 16, 64, 49152, 2147483647, 1024, 8, 32], "", 0, []], [[], [["CI", 8], ["CI", 7], ["CI", 5], ["CHW", 3, "local"], ["SP", 3, 0, 1, [1, 1, 1, 1], 1], ["SP", 3, 5, 112, [1, 28, 2, 1], 1], ["SP", 3, 10, 112, [1, 1, 8, 2], 1], ["SP", 3, 15, 3, [1, 3, 1, 1], 1], ["SP", 3, 20, 3, [3, 1], 1], ["SP", 3, 23, 3, [1, 1], 1], ["RE", 3, [0, 5, 10, 15, 1, 6, 11, 16, 2, 7, 12, 17, 20, 23, 21, 24, 3, 8, 13, 18, 22, 25, 4, 9, 14, 19]], ["FSP", 4, 0, 4, 3], ["FSP", 4, 4, 5, 3], ["FSP", 4, 8, 6, 3], ["FSP", 4, 12, 7, 3], ["RE", 4, [0, 4, 8, 12, 1, 5, 9, 13, 2, 6, 10, 14, 3, 7, 11, 15]], ["CA", 3, 4, 11], ["CHR", 2, "shared", [3]], ["CA", 3, 4, 13], ["CHR", 1, "shared", [4]], ["CA", 2, 5, 13], ["CI", 1], ["FU", 12, [0, 1, 2, 3]], ["SP", 12, 0, 37632, [64], 1], ["AN", 12, 0, 5], ["AN", 12, 1, 6], ["FU", 6, [0, 1, 2, 3]], ["AN", 6, 0, 5], ["FU", 6, [1, 2, 3, 4]], ["AN", 6, 1, 4], ["FU", 6, [2, 3, 4, 5]], ["AN", 6, 2, 6], ["FU", 4, [0, 1, 2, 3]], ["SP", 4, 0, 3, [1], 1], ["AN", 4, 1, 2], ["FFSP", 4, 0, [7, 6, 5, 4], 1, 1], ["AN", 4, 1, 6], ["FU", 2, [0, 1, 2, 3]], ["SP", 2, 0, 155, [5], 1], ["AN", 2, 1, 2], ["FFSP", 2, 0, [7, 6, 5, 4], 1, 1], ["AN", 2, 1, 6], ["PR", 5, 0, "auto_unroll_max_step$16"]]]], "r": [[5.9069e-05, 5.90681e-05, 5.90688e-05, 5.90673e-05, 5.90671e-05, 5.90672e-05, 5.90661e-05, 5.90661e-05, 5.90633e-05, 5.90682e-05], 0, 150.687, 1649095610], "v": "v0.6"}
{"i": [["[\"fused_depthwise_conv2d\", 224, 224, 3, 3, 3, [2, 2]]", "cuda -keys=cuda,gpu -max_num_threads=1024 -model=unknown -thread_warp_size=32", [-1, 16, 64, 49152, 2147483647, 1024, 8, 32], "", 0, []], [[], [["CI", 8], ["CI", 7], ["CI", 5], ["CHW", 3, "local"], ["SP", 3, 0, 1, [1, 1, 1, 1], 1], ["SP", 3, 5, 112, [1, 28, 2, 1], 1], ["SP", 3, 10, 112, [2, 4, 1, 2], 1], ["SP", 3, 15, 3, [1, 1, 1, 3], 1], ["SP", 3, 20, 3, [3, 1], 1], ["SP", 3, 23, 3, [1, 1], 1], ["RE", 3, [0, 5, 10, 15, 1, 6, 11, 16, 2, 7, 12, 17, 20, 23, 21, 24, 3, 8, 13, 18, 22, 25, 4, 9, 14, 19]], ["FSP", 4, 0, 4, 3], ["FSP", 4, 4, 5, 3], ["FSP", 4, 8, 6, 3], ["FSP", 4, 12, 7, 3], ["RE", 4, [0, 4, 8, 12, 1, 5, 9, 13, 2, 6, 10, 14, 3, 7, 11, 15]], ["CA", 3, 4, 11], ["CHR", 2, "shared", [3]], ["CA", 3, 4, 13], ["CHR", 1, "shared", [4]], ["CA", 2, 5, 13], ["CI", 1], ["FU", 12, [0, 1, 2, 3]], ["SP", 12, 0, 37632, [1], 1], ["AN", 12, 0, 5], ["AN", 12, 1, 6], ["FU", 6, [0, 1, 2, 3]], ["AN", 6, 0, 5], ["FU", 6, [1, 2, 3, 4]], ["AN", 6, 1, 4], ["FU", 6, [2, 3, 4, 5]], ["AN", 6, 2, 6], ["FU", 4, [0, 1, 2, 3]], ["SP", 4, 0, 9, [1], 1], ["AN", 4, 1, 2], ["FFSP", 4, 0, [7, 6, 5, 4], 1, 1], ["AN", 4, 1, 6], ["FU", 2, [0, 1, 2, 3]], ["SP", 2, 0, 45, [1], 1], ["AN", 2, 1, 2], ["FFSP", 2, 0, [7, 6, 5, 4], 1, 1], ["AN", 2, 1, 6], ["PR", 5, 0, "auto_unroll_max_step$512"]]]], "r": [[4.28494e-05, 4.28518e-05, 4.28504e-05, 4.28512e-05, 4.28501e-05, 4.28499e-05, 4.2852e-05, 4.28509e-05, 4.28506e-05, 4.28509e-05], 0, 203.17, 1649095661], "v": "v0.6"}
{"i": [["[\"fused_depthwise_conv2d\", 224, 224, 3, 3, 3, [2, 2]]", "cuda -keys=cuda,gpu -max_num_threads=1024 -model=unknown -thread_warp_size=32", [-1, 16, 64, 49152, 2147483647, 1024, 8, 32], "", 0, []], [[], [["CI", 8], ["CI", 7], ["CI", 5], ["CHW", 3, "local"], ["SP", 3, 0, 1, [1, 1, 1, 1], 1], ["SP", 3, 5, 112, [1, 14, 2, 1], 1], ["SP", 3, 10, 112, [7, 1, 4, 1], 1], ["SP", 3, 15, 3, [1, 3, 1, 1], 1], ["SP", 3, 20, 3, [1, 1], 1], ["SP", 3, 23, 3, [1, 1], 1], ["RE", 3, [0, 5, 10, 15, 1, 6, 11, 16, 2, 7, 12, 17, 20, 23, 21, 24, 3, 8, 13, 18, 22, 25, 4, 9, 14, 19]], ["FSP", 4, 0, 4, 3], ["FSP", 4, 4, 5, 3], ["FSP", 4, 8, 6, 3], ["FSP", 4, 12, 7, 3], ["RE", 4, [0, 4, 8, 12, 1, 5, 9, 13, 2, 6, 10, 14, 3, 7, 11, 15]], ["CA", 3, 4, 11], ["CHR", 2, "shared", [3]], ["CA", 3, 4, 13], ["CHR", 1, "shared", [4]], ["CA", 2, 5, 13], ["CI", 1], ["FU", 12, [0, 1, 2, 3]], ["SP", 12, 0, 37632, [64], 1], ["AN", 12, 0, 5], ["AN", 12, 1, 6], ["FU", 6, [0, 1, 2, 3]], ["AN", 6, 0, 5], ["FU", 6, [1, 2, 3, 4]], ["AN", 6, 1, 4], ["FU", 6, [2, 3, 4, 5]], ["AN", 6, 2, 6], ["FU", 4, [0, 1, 2, 3]], ["SP", 4, 0, 1, [1], 1], ["AN", 4, 1, 2], ["FFSP", 4, 0, [7, 6, 5, 4], 1, 1], ["AN", 4, 1, 6], ["FU", 2, [0, 1, 2, 3]], ["SP", 2, 0, 21, [1], 1], ["AN", 2, 1, 2], ["FFSP", 2, 0, [7, 6, 5, 4], 1, 1], ["AN", 2, 1, 6], ["PR", 5, 0, "auto_unroll_max_step$0"]]]], "r": [[0.000504379, 0.000504381, 0.000504392, 0.000504398, 0.000504368, 0.000504356, 0.00050438, 0.000504383, 0.000504356, 0.000504391], 0, 140.627, 1649095601], "v": "v0.6"}
{"i": [["[\"fused_depthwise_conv2d\", 224, 224, 3, 3, 3, [2, 2]]", "cuda -keys=cuda,gpu -max_num_threads=1024 -model=unknown -thread_warp_size=32", [-1, 16, 64, 49152, 2147483647, 1024, 8, 32], "", 0, []], [[], [["CI", 8], ["CI", 7], ["CI", 5], ["CHW", 3, "local"], ["SP", 3, 0, 1, [1, 1, 1, 1], 1], ["SP", 3, 5, 112, [4, 1, 4, 7], 1], ["SP", 3, 10, 112, [1, 2, 1, 4], 1], ["SP", 3, 15, 3, [3, 1, 1, 1], 1], ["SP", 3, 20, 3, [1, 1], 1], ["SP", 3, 23, 3, [1, 3], 1], ["RE", 3, [0, 5, 10, 15, 1, 6, 11, 16, 2, 7, 12, 17, 20, 23, 21, 24, 3, 8, 13, 18, 22, 25, 4, 9, 14, 19]], ["FSP", 4, 0, 4, 3], ["FSP", 4, 4, 5, 3], ["FSP", 4, 8, 6, 3], ["FSP", 4, 12, 7, 3], ["RE", 4, [0, 4, 8, 12, 1, 5, 9, 13, 2, 6, 10, 14, 3, 7, 11, 15]], ["CA", 3, 4, 11], ["CHR", 2, "shared", [3]], ["CA", 3, 4, 13], ["CHR", 1, "shared", [4]], ["CA", 2, 5, 13], ["CI", 1], ["FU", 12, [0, 1, 2, 3]], ["SP", 12, 0, 37632, [32], 1], ["AN", 12, 0, 5], ["AN", 12, 1, 6], ["FU", 6, [0, 1, 2, 3]], ["AN", 6, 0, 5], ["FU", 6, [1, 2, 3, 4]], ["AN", 6, 1, 4], ["FU", 6, [2, 3, 4, 5]], ["AN", 6, 2, 6], ["FU", 4, [0, 1, 2, 3]], ["SP", 4, 0, 1, [1], 1], ["AN", 4, 1, 2], ["FFSP", 4, 0, [7, 6, 5, 4], 1, 1], ["AN", 4, 1, 6], ["FU", 2, [0, 1, 2, 3]], ["SP", 2, 0, 49, [1], 1], ["AN", 2, 1, 2], ["FFSP", 2, 0, [7, 6, 5, 4], 1, 1], ["AN", 2, 1, 6], ["PR", 5, 0, "auto_unroll_max_step$512"]]]], "r": [[0.00286525, 0.00286526, 0.00286523, 0.00286519, 0.00286526, 0.00286551, 0.00286524, 0.00286519, 0.00286519, 0.00286521], 0, 162.155, 1649095620], "v": "v0.6"}
{"i": [["[\"fused_depthwise_conv2d\", 224, 224, 3, 3, 3, [2, 2]]", "cuda -keys=cuda,gpu -max_num_threads=1024 -model=unknown -thread_warp_size=32", [-1, 16, 64, 49152, 2147483647, 1024, 8, 32], "", 0, []], [[], [["CI", 8], ["CI", 7], ["CI", 5], ["CHW", 3, "local"], ["SP", 3, 0, 1, [1, 1, 1, 1], 1], ["SP", 3, 5, 112, [1, 7, 1, 8], 1], ["SP", 3, 10, 112, [1, 14, 1, 1], 1], ["SP", 3, 15, 3, [1, 1, 1, 1], 1], ["SP", 3, 20, 3, [3, 1], 1], ["SP", 3, 23, 3, [1, 1], 1], ["RE", 3, [0, 5, 10, 15, 1, 6, 11, 16, 2, 7, 12, 17, 20, 23, 21, 24, 3, 8, 13, 18, 22, 25, 4, 9, 14, 19]], ["FSP", 4, 0, 4, 3], ["FSP", 4, 4, 5, 3], ["FSP", 4, 8, 6, 3], ["FSP", 4, 12, 7, 3], ["RE", 4, [0, 4, 8, 12, 1, 5, 9, 13, 2, 6, 10, 14, 3, 7, 11, 15]], ["CA", 3, 4, 11], ["CHR", 2, "shared", [3]], ["CA", 3, 4, 13], ["CHR", 1, "shared", [4]], ["CA", 2, 5, 13], ["CI", 1], ["FU", 12, [0, 1, 2, 3]], ["SP", 12, 0, 37632, [32], 1], ["AN", 12, 0, 5], ["AN", 12, 1, 6], ["FU", 6, [0, 1, 2, 3]], ["AN", 6, 0, 5], ["FU", 6, [1, 2, 3, 4]], ["AN", 6, 1, 4], ["FU", 6, [2, 3, 4, 5]], ["AN", 6, 2, 6], ["FU", 4, [0, 1, 2, 3]], ["SP", 4, 0, 1, [1], 1], ["AN", 4, 1, 2], ["FFSP", 4, 0, [7, 6, 5, 4], 1, 1], ["AN", 4, 1, 6], ["FU", 2, [0, 1, 2, 3]], ["SP", 2, 0, 15, [3], 1], ["AN", 2, 1, 2], ["FFSP", 2, 0, [7, 6, 5, 4], 1, 1], ["AN", 2, 1, 6], ["PR", 5, 0, "auto_unroll_max_step$0"]]]], "r": [[3.14394e-05, 3.14379e-05, 3.14421e-05, 3.14442e-05, 3.14384e-05, 3.14406e-05, 3.1439e-05, 3.14465e-05, 3.14439e-05, 3.14427e-05], 0, 169.701, 1649095630], "v": "v0.6"}
{"i": [["[\"fused_depthwise_conv2d\", 224, 224, 3, 3, 3, [2, 2]]", "cuda -keys=cuda,gpu -max_num_threads=1024 -model=unknown -thread_warp_size=32", [-1, 16, 64, 49152, 2147483647, 1024, 8, 32], "", 0, []], [[], [["CI", 8], ["CI", 7], ["CI", 5], ["CHW", 3, "local"], ["SP", 3, 0, 1, [1, 1, 1, 1], 1], ["SP", 3, 5, 112, [1, 28, 2, 2], 1], ["SP", 3, 10, 112, [2, 1, 1, 1], 1], ["SP", 3, 15, 3, [1, 3, 1, 1], 1], ["SP", 3, 20, 3, [1, 3], 1], ["SP", 3, 23, 3, [1, 3], 1], ["RE", 3, [0, 5, 10, 15, 1, 6, 11, 16, 2, 7, 12, 17, 20, 23, 21, 24, 3, 8, 13, 18, 22, 25, 4, 9, 14, 19]], ["FSP", 4, 0, 4, 3], ["FSP", 4, 4, 5, 3], ["FSP", 4, 8, 6, 3], ["FSP", 4, 12, 7, 3], ["RE", 4, [0, 4, 8, 12, 1, 5, 9, 13, 2, 6, 10, 14, 3, 7, 11, 15]], ["CA", 3, 4, 11], ["CHR", 2, "shared", [3]], ["CA", 3, 4, 13], ["CHR", 1, "shared", [4]], ["CA", 2, 5, 13], ["CI", 1], ["FU", 12, [0, 1, 2, 3]], ["SP", 12, 0, 37632, [64], 1], ["AN", 12, 0, 5], ["AN", 12, 1, 6], ["FU", 6, [0, 1, 2, 3]], ["AN", 6, 0, 5], ["FU", 6, [1, 2, 3, 4]], ["AN", 6, 1, 4], ["FU", 6, [2, 3, 4, 5]], ["AN", 6, 2, 6], ["FU", 4, [0, 1, 2, 3]], ["SP", 4, 0, 9, [1], 1], ["AN", 4, 1, 2], ["FFSP", 4, 0, [7, 6, 5, 4], 1, 1], ["AN", 4, 1, 6], ["FU", 2, [0, 1, 2, 3]], ["SP", 2, 0, 27, [1], 1], ["AN", 2, 1, 2], ["FFSP", 2, 0, [7, 6, 5, 4], 1, 1], ["AN", 2, 1, 6], ["PR", 5, 0, "auto_unroll_max_step$16"]]]], "r": [[1.74325e-05, 1.74326e-05, 1.74329e-05, 1.7434e-05, 1.7434e-05, 1.74347e-05, 1.74344e-05, 1.74346e-05, 1.74337e-05, 1.7434e-05], 0, 164.496, 1649095625], "v": "v0.6"}
{"i": [["[\"fused_depthwise_conv2d\", 224, 224, 3, 3, 3, [2, 2]]", "cuda -keys=cuda,gpu -max_num_threads=1024 -model=unknown -thread_warp_size=32", [-1, 16, 64, 49152, 2147483647, 1024, 8, 32], "", 0, []], [[], [["CI", 8], ["CI", 7], ["CI", 5], ["CHW", 3, "local"], ["SP", 3, 0, 1, [1, 1, 1, 1], 1], ["SP", 3, 5, 112, [2, 14, 1, 4], 1], ["SP", 3, 10, 112, [1, 4, 1, 1], 1], ["SP", 3, 15, 3, [1, 1, 1, 3], 1], ["SP", 3, 20, 3, [3, 1], 1], ["SP", 3, 23, 3, [3, 1], 1], ["RE", 3, [0, 5, 10, 15, 1, 6, 11, 16, 2, 7, 12, 17, 20, 23, 21, 24, 3, 8, 13, 18, 22, 25, 4, 9, 14, 19]], ["FSP", 4, 0, 4, 3], ["FSP", 4, 4, 5, 3], ["FSP", 4, 8, 6, 3], ["FSP", 4, 12, 7, 3], ["RE", 4, [0, 4, 8, 12, 1, 5, 9, 13, 2, 6, 10, 14, 3, 7, 11, 15]], ["CA", 3, 4, 11], ["CHR", 2, "shared", [3]], ["CA", 3, 4, 13], ["CHR", 1, "shared", [4]], ["CA", 2, 5, 13], ["CI", 1], ["FU", 12, [0, 1, 2, 3]], ["SP", 12, 0, 37632, [32], 1], ["AN", 12, 0, 5], ["AN", 12, 1, 6], ["FU", 6, [0, 1, 2, 3]], ["AN", 6, 0, 5], ["FU", 6, [1, 2, 3, 4]], ["AN", 6, 1, 4], ["FU", 6, [2, 3, 4, 5]], ["AN", 6, 2, 6], ["FU", 4, [0, 1, 2, 3]], ["SP", 4, 0, 27, [3], 1], ["AN", 4, 1, 2], ["FFSP", 4, 0, [7, 6, 5, 4], 1, 1], ["AN", 4, 1, 6], ["FU", 2, [0, 1, 2, 3]], ["SP", 2, 0, 81, [3], 1], ["AN", 2, 1, 2], ["FFSP", 2, 0, [7, 6, 5, 4], 1, 1], ["AN", 2, 1, 6], ["PR", 5, 0, "auto_unroll_max_step$512"]]]], "r": [[1.00143e-05, 9.9643e-06, 9.97627e-06, 9.96207e-06, 9.99864e-06, 1.00108e-05, 1.00057e-05, 9.97965e-06, 9.98074e-06, 9.95895e-06], 0, 146.381, 1649095605], "v": "v0.6"}
{"i": [["[\"fused_depthwise_conv2d\", 224, 224, 3, 3, 3, [2, 2]]", "cuda -keys=cuda,gpu -max_num_threads=1024 -model=unknown -thread_warp_size=32", [-1, 16, 64, 49152, 2147483647, 1024, 8, 32], "", 0, []], [[], [["CI", 8], ["CI", 7], ["CI", 5], ["CHW", 3, "local"], ["SP", 3, 0, 1, [1, 1, 1, 1], 1], ["SP", 3, 5, 112, [1, 2, 1, 2], 1], ["SP", 3, 10, 112, [1, 56, 1, 1], 1], ["SP", 3, 15, 3, [1, 1, 3, 1], 1], ["SP", 3, 20, 3, [3, 1], 1], ["SP", 3, 23, 3, [1, 3], 1], ["RE", 3, [0, 5, 10, 15, 1, 6, 11, 16, 2, 7, 12, 17, 20, 23, 21, 24, 3, 8, 13, 18, 22, 25, 4, 9, 14, 19]], ["FSP", 4, 0, 4, 3], ["FSP", 4, 4, 5, 3], ["FSP", 4, 8, 6, 3], ["FSP", 4, 12, 7, 3], ["RE", 4, [0, 4, 8, 12, 1, 5, 9, 13, 2, 6, 10, 14, 3, 7, 11, 15]], ["CA", 3, 4, 11], ["CHR", 2, "shared", [3]], ["CA", 3, 4, 13], ["CHR", 1, "shared", [4]], ["CA", 2, 5, 13], ["CI", 1], ["FU", 12, [0, 1, 2, 3]], ["SP", 12, 0, 37632, [32], 1], ["AN", 12, 0, 5], ["AN", 12, 1, 6], ["FU", 6, [0, 1, 2, 3]], ["AN", 6, 0, 5], ["FU", 6, [1, 2, 3, 4]], ["AN", 6, 1, 4], ["FU", 6, [2, 3, 4, 5]], ["AN", 6, 2, 6], ["FU", 4, [0, 1, 2, 3]], ["SP", 4, 0, 27, [1], 1], ["AN", 4, 1, 2], ["FFSP", 4, 0, [7, 6, 5, 4], 1, 1], ["AN", 4, 1, 6], ["FU", 2, [0, 1, 2, 3]], ["SP", 2, 0, 45, [1], 1], ["AN", 2, 1, 2], ["FFSP", 2, 0, [7, 6, 5, 4], 1, 1], ["AN", 2, 1, 6], ["PR", 5, 0, "auto_unroll_max_step$0"]]]], "r": [[1.42164e-05, 1.42158e-05, 1.42159e-05, 1.42165e-05, 1.42164e-05, 1.42166e-05, 1.42165e-05, 1.42165e-05, 1.42164e-05, 1.4216e-05], 0, 174.307, 1649095634], "v": "v0.6"}
{"i": [["[\"fused_depthwise_conv2d\", 224, 224, 3, 3, 3, [2, 2]]", "cuda -keys=cuda,gpu -max_num_threads=1024 -model=unknown -thread_warp_size=32", [-1, 16, 64, 49152, 2147483647, 1024, 8, 32], "", 0, []], [[], [["CI", 8], ["CI", 7], ["CI", 5], ["CHW", 3, "local"], ["SP", 3, 0, 1, [1, 1, 1, 1], 1], ["SP", 3, 5, 112, [1, 28, 2, 1], 1], ["SP", 3, 10, 112, [1, 1, 2, 2], 1], ["SP", 3, 15, 3, [1, 3, 1, 1], 1], ["SP", 3, 20, 3, [3, 1], 1], ["SP", 3, 23, 3, [1, 1], 1], ["RE", 3, [0, 5, 10, 15, 1, 6, 11, 16, 2, 7, 12, 17, 20, 23, 21, 24, 3, 8, 13, 18, 22, 25, 4, 9, 14, 19]], ["FSP", 4, 0, 4, 3], ["FSP", 4, 4, 5, 3], ["FSP", 4, 8, 6, 3], ["FSP", 4, 12, 7, 3], ["RE", 4, [0, 4, 8, 12, 1, 5, 9, 13, 2, 6, 10, 14, 3, 7, 11, 15]], ["CA", 3, 4, 11], ["CHR", 2, "shared", [3]], ["CA", 3, 4, 13], ["CHR", 1, "shared", [4]], ["CA", 2, 5, 13], ["CI", 1], ["FU", 12, [0, 1, 2, 3]], ["SP", 12, 0, 37632, [32], 1], ["AN", 12, 0, 5], ["AN", 12, 1, 6], ["FU", 6, [0, 1, 2, 3]], ["AN", 6, 0, 5], ["FU", 6, [1, 2, 3, 4]], ["AN", 6, 1, 4], ["FU", 6, [2, 3, 4, 5]], ["AN", 6, 2, 6], ["FU", 4, [0, 1, 2, 3]], ["SP", 4, 0, 3, [1], 1], ["AN", 4, 1, 2], ["FFSP", 4, 0, [7, 6, 5, 4], 1, 1], ["AN", 4, 1, 6], ["FU", 2, [0, 1, 2, 3]], ["SP", 2, 0, 155, [1], 1], ["AN", 2, 1, 2], ["FFSP", 2, 0, [7, 6, 5, 4], 1, 1], ["AN", 2, 1, 6], ["PR", 5, 0, "auto_unroll_max_step$1024"]]]], "r": [[1.0464e-05, 1.04639e-05, 1.04623e-05, 1.04622e-05, 1.04617e-05, 1.04617e-05, 1.04626e-05, 1.04634e-05, 1.0463e-05, 1.04635e-05], 0, 69.9853, 1649095529], "v": "v0.6"}
{"i": [["[\"fused_depthwise_conv2d\", 224, 224, 3, 3, 3, [2, 2]]", "cuda -keys=cuda,gpu -max_num_threads=1024 -model=unknown -thread_warp_size=32", [-1, 16, 64, 49152, 2147483647, 1024, 8, 32], "", 0, []], [[], [["CI", 8], ["CI", 7], ["CI", 5], ["CHW", 3, "local"], ["SP", 3, 0, 1, [1, 1, 1, 1], 1], ["SP", 3, 5, 112, [1, 56, 1, 1], 1], ["SP", 3, 10, 112, [1, 1, 14, 1], 1], ["SP", 3, 15, 3, [1, 3, 1, 1], 1], ["SP", 3, 20, 3, [3, 1], 1], ["SP", 3, 23, 3, [1, 3], 1], ["RE", 3, [0, 5, 10, 15, 1, 6, 11, 16, 2, 7, 12, 17, 20, 23, 21, 24, 3, 8, 13, 18, 22, 25, 4, 9, 14, 19]], ["FSP", 4, 0, 4, 3], ["FSP", 4, 4, 5, 3], ["FSP", 4, 8, 6, 3], ["FSP", 4, 12, 7, 3], ["RE", 4, [0, 4, 8, 12, 1, 5, 9, 13, 2, 6, 10, 14, 3, 7, 11, 15]], ["CA", 3, 4, 11], ["CHR", 2, "shared", [3]], ["CA", 3, 4, 13], ["CHR", 1, "shared", [4]], ["CA", 2, 5, 13], ["CI", 1], ["FU", 12, [0, 1, 2, 3]], ["SP", 12, 0, 37632, [2], 1], ["AN", 12, 0, 5], ["AN", 12, 1, 6], ["FU", 6, [0, 1, 2, 3]], ["AN", 6, 0, 5], ["FU", 6, [1, 2, 3, 4]], ["AN", 6, 1, 4], ["FU", 6, [2, 3, 4, 5]], ["AN", 6, 2, 6], ["FU", 4, [0, 1, 2, 3]], ["SP", 4, 0, 9, [1], 1], ["AN", 4, 1, 2], ["FFSP", 4, 0, [7, 6, 5, 4], 1, 1], ["AN", 4, 1, 6], ["FU", 2, [0, 1, 2, 3]], ["SP", 2, 0, 87, [29], 1], ["AN", 2, 1, 2], ["FFSP", 2, 0, [7, 6, 5, 4], 1, 1], ["AN", 2, 1, 6], ["PR", 5, 0, "auto_unroll_max_step$1024"]]]], "r": [[2.91557e-05, 2.9155e-05, 2.91562e-05, 2.91572e-05, 2.9156e-05, 2.91546e-05, 2.91569e-05, 2.91549e-05, 2.91567e-05, 2.91585e-05], 0, 202.147, 1649095666], "v": "v0.6"}
{"i": [["[\"fused_depthwise_conv2d\", 224, 224, 3, 3, 3, [2, 2]]", "cuda -keys=cuda,gpu -max_num_threads=1024 -model=unknown -thread_warp_size=32", [-1, 16, 64, 49152, 2147483647, 1024, 8, 32], "", 0, []], [[], [["CI", 8], ["CI", 7], ["CI", 5], ["CHW", 3, "local"], ["SP", 3, 0, 1, [1, 1, 1, 1], 1], ["SP", 3, 5, 112, [1, 4, 1, 1], 1], ["SP", 3, 10, 112, [1, 4, 2, 14], 1], ["SP", 3, 15, 3, [1, 3, 1, 1], 1], ["SP", 3, 20, 3, [3, 1], 1], ["SP", 3, 23, 3, [1, 3], 1], ["RE", 3, [0, 5, 10, 15, 1, 6, 11, 16, 2, 7, 12, 17, 20, 23, 21, 24, 3, 8, 13, 18, 22, 25, 4, 9, 14, 19]], ["FSP", 4, 0, 4, 3], ["FSP", 4, 4, 5, 3], ["FSP", 4, 8, 6, 3], ["FSP", 4, 12, 7, 3], ["RE", 4, [0, 4, 8, 12, 1, 5, 9, 13, 2, 6, 10, 14, 3, 7, 11, 15]], ["CA", 3, 4, 11], ["CHR", 2, "shared", [3]], ["CA", 3, 4, 13], ["CHR", 1, "shared", [4]], ["CA", 2, 5, 13], ["CI", 1], ["FU", 12, [0, 1, 2, 3]], ["SP", 12, 0, 37632, [1], 1], ["AN", 12, 0, 5], ["AN", 12, 1, 6], ["FU", 6, [0, 1, 2, 3]], ["AN", 6, 0, 5], ["FU", 6, [1, 2, 3, 4]], ["AN", 6, 1, 4], ["FU", 6, [2, 3, 4, 5]], ["AN", 6, 2, 6], ["FU", 4, [0, 1, 2, 3]], ["SP", 4, 0, 9, [1], 1], ["AN", 4, 1, 2], ["FFSP", 4, 0, [7, 6, 5, 4], 1, 1], ["AN", 4, 1, 6], ["FU", 2, [0, 1, 2, 3]], ["SP", 2, 0, 171, [1], 1], ["AN", 2, 1, 2], ["FFSP", 2, 0, [7, 6, 5, 4], 1, 1], ["AN", 2, 1, 6], ["PR", 5, 0, "auto_unroll_max_step$1024"]]]], "r": [[3.63678e-05, 3.63677e-05, 3.63703e-05, 3.63691e-05, 3.63692e-05, 3.63682e-05, 3.637e-05, 3.63708e-05, 3.63686e-05, 3.63703e-05], 0, 202.276, 1649095672], "v": "v0.6"}
