python/models/efficientnet/kernel_configs/efficient_swish_shortcut_add_1_7_7_672.log
{"i": [["[\"shortcut_add\", 1, 7, 7, 672]", "cuda -keys=cuda,gpu -max_num_threads=1024 -model=unknown -thread_warp_size=32", [-1, 16, 64, 49152, 2147483647, 1024, 8, 32], "", 0, []], [[], [["FU", 2, [0, 1, 2, 3]], ["SP", 2, 0, 32928, [8], 1], ["AN", 2, 0, 5], ["AN", 2, 1, 6]]]], "r": [[5.76956e-06, 5.76904e-06, 5.77152e-06], 0, 1.76918, 1681133113], "v": "v0.6"}
{"i": [["[\"shortcut_add\", 1, 7, 7, 672]", "cuda -keys=cuda,gpu -max_num_threads=1024 -model=unknown -thread_warp_size=32", [-1, 16, 64, 49152, 2147483647, 1024, 8, 32], "", 0, []], [[], [["FU", 2, [0, 1, 2, 3]], ["SP", 2, 0, 32928, [2], 1], ["AN", 2, 0, 5], ["AN", 2, 1, 6]]]], "r": [[1.49901e-05, 1.49902e-05, 1.49898e-05], 0, 0.639977, 1681133112], "v": "v0.6"}
{"i": [["[\"shortcut_add\", 1, 7, 7, 672]", "cuda -keys=cuda,gpu -max_num_threads=1024 -model=unknown -thread_warp_size=32", [-1, 16, 64, 49152, 2147483647, 1024, 8, 32], "", 0, []], [[], [["FU", 2, [0, 1, 2, 3]], ["SP", 2, 0, 32928, [7], 1], ["AN", 2, 0, 5], ["AN", 2, 1, 6]]]], "r": [[6.41368e-06, 6.42282e-06, 6.42222e-06], 0, 1.4156, 1681133113], "v": "v0.6"}
{"i": [["[\"shortcut_add\", 1, 7, 7, 672]", "cuda -keys=cuda,gpu -max_num_threads=1024 -model=unknown -thread_warp_size=32", [-1, 16, 64, 49152, 2147483647, 1024, 8, 32], "", 0, []], [[], [["FU", 2, [0, 1, 2, 3]], ["SP", 2, 0, 32928, [16], 1], ["AN", 2, 0, 5], ["AN", 2, 1, 6]]]], "r": [[4.19736e-06, 4.20641e-06, 4.21095e-06], 0, 1.012, 1681133113], "v": "v0.6"}
{"i": [["[\"shortcut_add\", 1, 7, 7, 672]", "cuda -keys=cuda,gpu -max_num_threads=1024 -model=unknown -thread_warp_size=32", [-1, 16, 64, 49152, 2147483647, 1024, 8, 32], "", 0, []], [[], [["FU", 2, [0, 1, 2, 3]], ["SP", 2, 0, 32928, [14], 1], ["AN", 2, 0, 5], ["AN", 2, 1, 6]]]], "r": [[4.59612e-06, 4.60356e-06, 4.61131e-06], 0, 2.06074, 1681133114], "v": "v0.6"}
{"i": [["[\"shortcut_add\", 1, 7, 7, 672]", "cuda -keys=cuda,gpu -max_num_threads=1024 -model=unknown -thread_warp_size=32", [-1, 16, 64, 49152, 2147483647, 1024, 8, 32], "", 0, []], [[], [["FU", 2, [0, 1, 2, 3]], ["SP", 2, 0, 32928, [28], 1], ["AN", 2, 0, 5], ["AN", 2, 1, 6]]]], "r": [[3.44281e-06, 3.44525e-06, 3.44242e-06], 0, 2.82353, 1681133115], "v": "v0.6"}
{"i": [["[\"shortcut_add\", 1, 7, 7, 672]", "cuda -keys=cuda,gpu -max_num_threads=1024 -model=unknown -thread_warp_size=32", [-1, 16, 64, 49152, 2147483647, 1024, 8, 32], "", 0, []], [[], [["FU", 2, [0, 1, 2, 3]], ["SP", 2, 0, 32928, [12], 1], ["AN", 2, 0, 5], ["AN", 2, 1, 6]]]], "r": [[4.71756e-06, 4.7151e-06, 4.71996e-06], 0, 5.0769, 1681133117], "v": "v0.6"}
{"i": [["[\"shortcut_add\", 1, 7, 7, 672]", "cuda -keys=cuda,gpu -max_num_threads=1024 -model=unknown -thread_warp_size=32", [-1, 16, 64, 49152, 2147483647, 1024, 8, 32], "", 0, []], [[], [["FU", 2, [0, 1, 2, 3]], ["SP", 2, 0, 32928, [49], 1], ["AN", 2, 0, 5], ["AN", 2, 1, 6]]]], "r": [[3.49533e-06, 3.50777e-06, 3.50772e-06], 0, 2.43412, 1681133114], "v": "v0.6"}
{"i": [["[\"shortcut_add\", 1, 7, 7, 672]", "cuda -keys=cuda,gpu -max_num_threads=1024 -model=unknown -thread_warp_size=32", [-1, 16, 64, 49152, 2147483647, 1024, 8, 32], "", 0, []], [[], [["FU", 2, [0, 1, 2, 3]], ["SP", 2, 0, 32928, [24], 1], ["AN", 2, 0, 5], ["AN", 2, 1, 6]]]], "r": [[3.69165e-06, 3.70186e-06, 3.70593e-06], 0, 5.43919, 1681133117], "v": "v0.6"}
{"i": [["[\"shortcut_add\", 1, 7, 7, 672]", "cuda -keys=cuda,gpu -max_num_threads=1024 -model=unknown -thread_warp_size=32", [-1, 16, 64, 49152, 2147483647, 1024, 8, 32], "", 0, []], [[], [["FU", 2, [0, 1, 2, 3]], ["SP", 2, 0, 32928, [48], 1], ["AN", 2, 0, 5], ["AN", 2, 1, 6]]]], "r": [[3.36463e-06, 3.37872e-06, 3.37392e-06], 0, 4.7077, 1681133116], "v": "v0.6"}
{"i": [["[\"shortcut_add\", 1, 7, 7, 672]", "cuda -keys=cuda,gpu -max_num_threads=1024 -model=unknown -thread_warp_size=32", [-1, 16, 64, 49152, 2147483647, 1024, 8, 32], "", 0, []], [[], [["FU", 2, [0, 1, 2, 3]], ["SP", 2, 0, 32928, [4], 1], ["AN", 2, 0, 5], ["AN", 2, 1, 6]]]], "r": [[8.92878e-06, 8.92711e-06, 8.9273e-06], 0, 3.16838, 1681133115], "v": "v0.6"}
{"i": [["[\"shortcut_add\", 1, 7, 7, 672]", "cuda -keys=cuda,gpu -max_num_threads=1024 -model=unknown -thread_warp_size=32", [-1, 16, 64, 49152, 2147483647, 1024, 8, 32], "", 0, []], [[], [["FU", 2, [0, 1, 2, 3]], ["SP", 2, 0, 32928, [6], 1], ["AN", 2, 0, 5], ["AN", 2, 1, 6]]]], "r": [[6.87247e-06, 6.86906e-06, 6.87516e-06], 0, 3.97113, 1681133116], "v": "v0.6"}
{"i": [["[\"shortcut_add\", 1, 7, 7, 672]", "cuda -keys=cuda,gpu -max_num_threads=1024 -model=unknown -thread_warp_size=32", [-1, 16, 64, 49152, 2147483647, 1024, 8, 32], "", 0, []], [[], [["FU", 2, [0, 1, 2, 3]], ["SP", 2, 0, 32928, [3], 1], ["AN", 2, 0, 5], ["AN", 2, 1, 6]]]], "r": [[1.08788e-05, 1.08745e-05, 1.08729e-05], 0, 4.31224, 1681133116], "v": "v0.6"}
{"i": [["[\"shortcut_add\", 1, 7, 7, 672]", "cuda -keys=cuda,gpu -max_num_threads=1024 -model=unknown -thread_warp_size=32", [-1, 16, 64, 49152, 2147483647, 1024, 8, 32], "", 0, []], [[], [["FU", 2, [0, 1, 2, 3]], ["SP", 2, 0, 32928, [56], 1], ["AN", 2, 0, 5], ["AN", 2, 1, 6]]]], "r": [[3.1544e-06, 3.1653e-06, 3.15626e-06], 0, 3.60183, 1681133115], "v": "v0.6"}
{"i": [["[\"shortcut_add\", 1, 7, 7, 672]", "cuda -keys=cuda,gpu -max_num_threads=1024 -model=unknown -thread_warp_size=32", [-1, 16, 64, 49152, 2147483647, 1024, 8, 32], "", 0, []], [[], [["FU", 2, [0, 1, 2, 3]], ["SP", 2, 0, 32928, [42], 1], ["AN", 2, 0, 5], ["AN", 2, 1, 6]]]], "r": [[3.3398e-06, 3.33934e-06, 3.34048e-06], 0, 6.16619, 1681133118], "v": "v0.6"}
{"i": [["[\"shortcut_add\", 1, 7, 7, 672]", "cuda -keys=cuda,gpu -max_num_threads=1024 -model=unknown -thread_warp_size=32", [-1, 16, 64, 49152, 2147483647, 1024, 8, 32], "", 0, []], [[], [["FU", 2, [0, 1, 2, 3]], ["SP", 2, 0, 32928, [32], 1], ["AN", 2, 0, 5], ["AN", 2, 1, 6]]]], "r": [[3.37223e-06, 3.36947e-06, 3.37037e-06], 0, 5.80142, 1681133118], "v": "v0.6"}
{"i": [["[\"shortcut_add\", 1, 7, 7, 672]", "cuda -keys=cuda,gpu -max_num_threads=1024 -model=unknown -thread_warp_size=32", [-1, 16, 64, 49152, 2147483647, 1024, 8, 32], "", 0, []], [[], [["FU", 2, [0, 1, 2, 3]], ["SP", 2, 0, 32928, [21], 1], ["AN", 2, 0, 5], ["AN", 2, 1, 6]]]], "r": [[3.93678e-06, 3.94297e-06, 3.94533e-06], 0, 6.52905, 1681133118], "v": "v0.6"}
{"i": [["[\"shortcut_add\", 1, 7, 7, 672]", "cuda -keys=cuda,gpu -max_num_threads=1024 -model=unknown -thread_warp_size=32", [-1, 16, 64, 49152, 2147483647, 1024, 8, 32], "", 0, []], [[], [["FU", 2, [0, 1, 2, 3]], ["SP", 2, 0, 32928, [1], 1], ["AN", 2, 0, 5], ["AN", 2, 1, 6]]]], "r": [[2.72996e-05, 2.73104e-05, 2.731e-05], 0, 6.90692, 1681133119], "v": "v0.6"}
