python/models/efficientnet/kernel_configs/efficient_reudce_mean_28_28_240.log
{"i": [["[\"reduce_mean\", 28, 28, 240]", "cuda -keys=cuda,gpu -arch=sm_80 -max_num_threads=1024 -model=unknown -thread_warp_size=32", [-1, 16, 64, 49152, 2147483647, 1024, 8, 32], "", 0, []], [[], [["FU", 2, [0, 1]], ["SP", 2, 0, 240, [32], 1], ["AN", 2, 0, 5], ["AN", 2, 1, 6], ["FU", 1, [0, 1]], ["SP", 1, 0, 240, [32], 1], ["AN", 1, 0, 5], ["AN", 1, 1, 6], ["PR", 1, 0, "auto_unroll_max_step$64"]]]], "r": [[1.49057e-05, 1.49258e-05, 1.49322e-05], 0, 1.8923, 1681113986], "v": "v0.6"}
{"i": [["[\"reduce_mean\", 28, 28, 240]", "cuda -keys=cuda,gpu -arch=sm_80 -max_num_threads=1024 -model=unknown -thread_warp_size=32", [-1, 16, 64, 49152, 2147483647, 1024, 8, 32], "", 0, []], [[], [["FU", 2, [0, 1]], ["SP", 2, 0, 240, [8], 1], ["AN", 2, 0, 5], ["AN", 2, 1, 6], ["FU", 1, [0, 1]], ["SP", 1, 0, 240, [24], 1], ["AN", 1, 0, 5], ["AN", 1, 1, 6], ["PR", 1, 0, "auto_unroll_max_step$1024"]]]], "r": [[1.41797e-05, 1.42284e-05, 1.42325e-05], 0, 2.89818, 1681113987], "v": "v0.6"}
{"i": [["[\"reduce_mean\", 28, 28, 240]", "cuda -keys=cuda,gpu -arch=sm_80 -max_num_threads=1024 -model=unknown -thread_warp_size=32", [-1, 16, 64, 49152, 2147483647, 1024, 8, 32], "", 0, []], [[], [["FU", 2, [0, 1]], ["SP", 2, 0, 240, [48], 1], ["AN", 2, 0, 5], ["AN", 2, 1, 6], ["FU", 1, [0, 1]], ["SP", 1, 0, 240, [1], 1], ["AN", 1, 0, 5], ["AN", 1, 1, 6], ["PR", 1, 0, "auto_unroll_max_step$1024"]]]], "r": [[1.98803e-05, 1.98422e-05, 1.98286e-05], 0, 4.12013, 1681113989], "v": "v0.6"}
{"i": [["[\"reduce_mean\", 28, 28, 240]", "cuda -keys=cuda,gpu -arch=sm_80 -max_num_threads=1024 -model=unknown -thread_warp_size=32", [-1, 16, 64, 49152, 2147483647, 1024, 8, 32], "", 0, []], [[], [["FU", 2, [0, 1]], ["SP", 2, 0, 240, [1], 1], ["AN", 2, 0, 5], ["AN", 2, 1, 6], ["FU", 1, [0, 1]], ["SP", 1, 0, 240, [2], 1], ["AN", 1, 0, 5], ["AN", 1, 1, 6], ["PR", 1, 0, "auto_unroll_max_step$0"]]]], "r": [[1.46865e-05, 1.47013e-05, 1.47045e-05], 0, 4.27356, 1681113989], "v": "v0.6"}
{"i": [["[\"reduce_mean\", 28, 28, 240]", "cuda -keys=cuda,gpu -arch=sm_80 -max_num_threads=1024 -model=unknown -thread_warp_size=32", [-1, 16, 64, 49152, 2147483647, 1024, 8, 32], "", 0, []], [[], [["FU", 2, [0, 1]], ["SP", 2, 0, 240, [1], 1], ["AN", 2, 0, 5], ["AN", 2, 1, 6], ["FU", 1, [0, 1]], ["SP", 1, 0, 240, [3], 1], ["AN", 1, 0, 5], ["AN", 1, 1, 6], ["PR", 1, 0, "auto_unroll_max_step$512"]]]], "r": [[1.44314e-05, 1.44479e-05, 1.44459e-05], 0, 2.49956, 1681113987], "v": "v0.6"}
{"i": [["[\"reduce_mean\", 28, 28, 240]", "cuda -keys=cuda,gpu -arch=sm_80 -max_num_threads=1024 -model=unknown -thread_warp_size=32", [-1, 16, 64, 49152, 2147483647, 1024, 8, 32], "", 0, []], [[], [["FU", 2, [0, 1]], ["SP", 2, 0, 240, [4], 1], ["AN", 2, 0, 5], ["AN", 2, 1, 6], ["FU", 1, [0, 1]], ["SP", 1, 0, 240, [2], 1], ["AN", 1, 0, 5], ["AN", 1, 1, 6], ["PR", 1, 0, "auto_unroll_max_step$1024"]]]], "r": [[1.45796e-05, 1.46044e-05, 1.45827e-05], 0, 3.22745, 1681113988], "v": "v0.6"}
{"i": [["[\"reduce_mean\", 28, 28, 240]", "cuda -keys=cuda,gpu -arch=sm_80 -max_num_threads=1024 -model=unknown -thread_warp_size=32", [-1, 16, 64, 49152, 2147483647, 1024, 8, 32], "", 0, []], [[], [["FU", 2, [0, 1]], ["SP", 2, 0, 240, [8], 1], ["AN", 2, 0, 5], ["AN", 2, 1, 6], ["FU", 1, [0, 1]], ["SP", 1, 0, 240, [6], 1], ["AN", 1, 0, 5], ["AN", 1, 1, 6], ["PR", 1, 0, "auto_unroll_max_step$0"]]]], "r": [[1.42579e-05, 1.42782e-05, 1.42771e-05], 0, 5.15951, 1681113990], "v": "v0.6"}
{"i": [["[\"reduce_mean\", 28, 28, 240]", "cuda -keys=cuda,gpu -arch=sm_80 -max_num_threads=1024 -model=unknown -thread_warp_size=32", [-1, 16, 64, 49152, 2147483647, 1024, 8, 32], "", 0, []], [[], [["FU", 2, [0, 1]], ["SP", 2, 0, 240, [1], 1], ["AN", 2, 0, 5], ["AN", 2, 1, 6], ["FU", 1, [0, 1]], ["SP", 1, 0, 240, [6], 1], ["AN", 1, 0, 5], ["AN", 1, 1, 6], ["PR", 1, 0, "auto_unroll_max_step$0"]]]], "r": [[1.46977e-05, 1.47195e-05, 1.47257e-05], 0, 5.72208, 1681113990], "v": "v0.6"}
{"i": [["[\"reduce_mean\", 28, 28, 240]", "cuda -keys=cuda,gpu -arch=sm_80 -max_num_threads=1024 -model=unknown -thread_warp_size=32", [-1, 16, 64, 49152, 2147483647, 1024, 8, 32], "", 0, []], [[], [["FU", 2, [0, 1]], ["SP", 2, 0, 240, [2], 1], ["AN", 2, 0, 5], ["AN", 2, 1, 6], ["FU", 1, [0, 1]], ["SP", 1, 0, 240, [32], 1], ["AN", 1, 0, 5], ["AN", 1, 1, 6], ["PR", 1, 0, "auto_unroll_max_step$512"]]]], "r": [[1.50759e-05, 1.51796e-05, 1.51721e-05], 0, 6.91115, 1681113992], "v": "v0.6"}
{"i": [["[\"reduce_mean\", 28, 28, 240]", "cuda -keys=cuda,gpu -arch=sm_80 -max_num_threads=1024 -model=unknown -thread_warp_size=32", [-1, 16, 64, 49152, 2147483647, 1024, 8, 32], "", 0, []], [[], [["FU", 2, [0, 1]], ["SP", 2, 0, 240, [1], 1], ["AN", 2, 0, 5], ["AN", 2, 1, 6], ["FU", 1, [0, 1]], ["SP", 1, 0, 240, [16], 1], ["AN", 1, 0, 5], ["AN", 1, 1, 6], ["PR", 1, 0, "auto_unroll_max_step$0"]]]], "r": [[1.40975e-05, 1.41219e-05, 1.41219e-05], 0, 3.91361, 1681113988], "v": "v0.6"}
{"i": [["[\"reduce_mean\", 28, 28, 240]", "cuda -keys=cuda,gpu -arch=sm_80 -max_num_threads=1024 -model=unknown -thread_warp_size=32", [-1, 16, 64, 49152, 2147483647, 1024, 8, 32], "", 0, []], [[], [["FU", 1, [2, 3]], ["SP", 2, 1, 240, [1], 1], ["AN", 2, 2, 6], ["FSP", 1, 2, 1, 1], ["AN", 1, 3, 6], ["CA", 1, 2, 1], ["FU", 2, [0, 1]], ["AN", 2, 0, 5], ["PR", 1, 0, "auto_unroll_max_step$16"]]]], "r": [[1.61412e-05, 1.61572e-05, 1.61354e-05], 0, 5.50895, 1681113990], "v": "v0.6"}
{"i": [["[\"reduce_mean\", 28, 28, 240]", "cuda -keys=cuda,gpu -arch=sm_80 -max_num_threads=1024 -model=unknown -thread_warp_size=32", [-1, 16, 64, 49152, 2147483647, 1024, 8, 32], "", 0, []], [[], [["FU", 1, [2, 3]], ["SP", 2, 1, 240, [8], 1], ["AN", 2, 2, 6], ["FSP", 1, 2, 1, 1], ["AN", 1, 3, 6], ["CA", 1, 2, 1], ["FU", 2, [0, 1]], ["AN", 2, 0, 5], ["PR", 1, 0, "auto_unroll_max_step$64"]]]], "r": [[8.96033e-06, 8.96368e-06, 8.96837e-06], 0, 7.47482, 1681113992], "v": "v0.6"}
{"i": [["[\"reduce_mean\", 28, 28, 240]", "cuda -keys=cuda,gpu -arch=sm_80 -max_num_threads=1024 -model=unknown -thread_warp_size=32", [-1, 16, 64, 49152, 2147483647, 1024, 8, 32], "", 0, []], [[], [["FU", 1, [2, 3]], ["SP", 2, 1, 240, [8], 1], ["AN", 2, 2, 6], ["FSP", 1, 2, 1, 1], ["AN", 1, 3, 6], ["CA", 1, 2, 1], ["FU", 2, [0, 1]], ["AN", 2, 0, 5], ["PR", 1, 0, "auto_unroll_max_step$16"]]]], "r": [[8.79521e-06, 8.80488e-06, 8.79728e-06], 0, 9.20973, 1681113994], "v": "v0.6"}
{"i": [["[\"reduce_mean\", 28, 28, 240]", "cuda -keys=cuda,gpu -arch=sm_80 -max_num_threads=1024 -model=unknown -thread_warp_size=32", [-1, 16, 64, 49152, 2147483647, 1024, 8, 32], "", 0, []], [[], [["FU", 2, [0, 1]], ["SP", 2, 0, 240, [2], 1], ["AN", 2, 0, 5], ["AN", 2, 1, 6], ["FU", 1, [0, 1]], ["SP", 1, 0, 240, [24], 1], ["AN", 1, 0, 5], ["AN", 1, 1, 6], ["PR", 1, 0, "auto_unroll_max_step$512"]]]], "r": [[1.43173e-05, 1.43433e-05, 1.43443e-05], 0, 8.49678, 1681113993], "v": "v0.6"}
{"i": [["[\"reduce_mean\", 28, 28, 240]", "cuda -keys=cuda,gpu -arch=sm_80 -max_num_threads=1024 -model=unknown -thread_warp_size=32", [-1, 16, 64, 49152, 2147483647, 1024, 8, 32], "", 0, []], [[], [["FU", 2, [0, 1]], ["SP", 2, 0, 240, [16], 1], ["AN", 2, 0, 5], ["AN", 2, 1, 6], ["FU", 1, [0, 1]], ["SP", 1, 0, 240, [1], 1], ["AN", 1, 0, 5], ["AN", 1, 1, 6], ["PR", 1, 0, "auto_unroll_max_step$512"]]]], "r": [[1.99051e-05, 1.99286e-05, 1.99134e-05], 0, 6.38676, 1681113991], "v": "v0.6"}
{"i": [["[\"reduce_mean\", 28, 28, 240]", "cuda -keys=cuda,gpu -arch=sm_80 -max_num_threads=1024 -model=unknown -thread_warp_size=32", [-1, 16, 64, 49152, 2147483647, 1024, 8, 32], "", 0, []], [[], [["FU", 1, [2, 3]], ["SP", 2, 1, 240, [20], 1], ["AN", 2, 2, 6], ["FSP", 1, 2, 1, 1], ["AN", 1, 3, 6], ["CA", 1, 2, 1], ["FU", 2, [0, 1]], ["AN", 2, 0, 5], ["PR", 1, 0, "auto_unroll_max_step$16"]]]], "r": [[5.42935e-05, 5.42971e-05, 5.42827e-05], 0, 6.6356, 1681113991], "v": "v0.6"}
{"i": [["[\"reduce_mean\", 28, 28, 240]", "cuda -keys=cuda,gpu -arch=sm_80 -max_num_threads=1024 -model=unknown -thread_warp_size=32", [-1, 16, 64, 49152, 2147483647, 1024, 8, 32], "", 0, []], [[], [["FU", 2, [0, 1]], ["SP", 2, 0, 240, [4], 1], ["AN", 2, 0, 5], ["AN", 2, 1, 6], ["FU", 1, [0, 1]], ["SP", 1, 0, 240, [16], 1], ["AN", 1, 0, 5], ["AN", 1, 1, 6], ["PR", 1, 0, "auto_unroll_max_step$512"]]]], "r": [[1.39646e-05, 1.3997e-05, 1.40041e-05], 0, 7.86645, 1681113993], "v": "v0.6"}
{"i": [["[\"reduce_mean\", 28, 28, 240]", "cuda -keys=cuda,gpu -arch=sm_80 -max_num_threads=1024 -model=unknown -thread_warp_size=32", [-1, 16, 64, 49152, 2147483647, 1024, 8, 32], "", 0, []], [[], [["FU", 2, [0, 1]], ["SP", 2, 0, 240, [24], 1], ["AN", 2, 0, 5], ["AN", 2, 1, 6], ["FU", 1, [0, 1]], ["SP", 1, 0, 240, [16], 1], ["AN", 1, 0, 5], ["AN", 1, 1, 6], ["PR", 1, 0, "auto_unroll_max_step$512"]]]], "r": [[1.39035e-05, 1.39294e-05, 1.39294e-05], 0, 8.66875, 1681113993], "v": "v0.6"}
{"i": [["[\"reduce_mean\", 28, 28, 240]", "cuda -keys=cuda,gpu -arch=sm_80 -max_num_threads=1024 -model=unknown -thread_warp_size=32", [-1, 16, 64, 49152, 2147483647, 1024, 8, 32], "", 0, []], [[], [["FU", 1, [2, 3]], ["SP", 2, 1, 240, [30], 1], ["AN", 2, 2, 6], ["FSP", 1, 2, 1, 1], ["AN", 1, 3, 6], ["CA", 1, 2, 1], ["FU", 2, [0, 1]], ["AN", 2, 0, 5], ["PR", 1, 0, "auto_unroll_max_step$64"]]]], "r": [[2.92017e-05, 2.92194e-05, 2.92076e-05], 0, 4.86298, 1681113989], "v": "v0.6"}
{"i": [["[\"reduce_mean\", 28, 28, 240]", "cuda -keys=cuda,gpu -arch=sm_80 -max_num_threads=1024 -model=unknown -thread_warp_size=32", [-1, 16, 64, 49152, 2147483647, 1024, 8, 32], "", 0, []], [[], [["FU", 1, [2, 3]], ["SP", 2, 1, 240, [8], 1], ["AN", 2, 2, 6], ["FSP", 1, 2, 1, 1], ["AN", 1, 3, 6], ["CA", 1, 2, 1], ["FU", 2, [0, 1]], ["AN", 2, 0, 5], ["PR", 1, 0, "auto_unroll_max_step$0"]]]], "r": [[8.83317e-06, 8.8499e-06, 8.84254e-06], 0, 3.44482, 1681113988], "v": "v0.6"}
{"i": [["[\"reduce_mean\", 28, 28, 240]", "cuda -keys=cuda,gpu -arch=sm_80 -max_num_threads=1024 -model=unknown -thread_warp_size=32", [-1, 16, 64, 49152, 2147483647, 1024, 8, 32], "", 0, []], [[], [["FU", 1, [2, 3]], ["SP", 2, 1, 240, [6], 1], ["AN", 2, 2, 6], ["FSP", 1, 2, 1, 1], ["AN", 1, 3, 6], ["CA", 1, 2, 1], ["FU", 2, [0, 1]], ["AN", 2, 0, 5], ["PR", 1, 0, "auto_unroll_max_step$512"]]]], "r": [[1.14745e-05, 1.14922e-05, 1.14695e-05], 0, 11.5365, 1681113996], "v": "v0.6"}
{"i": [["[\"reduce_mean\", 28, 28, 240]", "cuda -keys=cuda,gpu -arch=sm_80 -max_num_threads=1024 -model=unknown -thread_warp_size=32", [-1, 16, 64, 49152, 2147483647, 1024, 8, 32], "", 0, []], [[], [["FU", 2, [0, 1]], ["SP", 2, 0, 240, [1], 1], ["AN", 2, 0, 5], ["AN", 2, 1, 6], ["FU", 1, [0, 1]], ["SP", 1, 0, 240, [2], 1], ["AN", 1, 0, 5], ["AN", 1, 1, 6], ["PR", 1, 0, "auto_unroll_max_step$64"]]]], "r": [[1.45993e-05, 1.46231e-05, 1.46303e-05], 0, 9.42477, 1681113994], "v": "v0.6"}
{"i": [["[\"reduce_mean\", 28, 28, 240]", "cuda -keys=cuda,gpu -arch=sm_80 -max_num_threads=1024 -model=unknown -thread_warp_size=32", [-1, 16, 64, 49152, 2147483647, 1024, 8, 32], "", 0, []], [[], [["FU", 1, [2, 3]], ["SP", 2, 1, 240, [4], 1], ["AN", 2, 2, 6], ["FSP", 1, 2, 1, 1], ["AN", 1, 3, 6], ["CA", 1, 2, 1], ["FU", 2, [0, 1]], ["AN", 2, 0, 5], ["PR", 1, 0, "auto_unroll_max_step$512"]]]], "r": [[8.40523e-06, 8.41819e-06, 8.41171e-06], 0, 10.3652, 1681113994], "v": "v0.6"}
{"i": [["[\"reduce_mean\", 28, 28, 240]", "cuda -keys=cuda,gpu -arch=sm_80 -max_num_threads=1024 -model=unknown -thread_warp_size=32", [-1, 16, 64, 49152, 2147483647, 1024, 8, 32], "", 0, []], [[], [["FU", 2, [0, 1]], ["SP", 2, 0, 240, [8], 1], ["AN", 2, 0, 5], ["AN", 2, 1, 6], ["FU", 1, [0, 1]], ["SP", 1, 0, 240, [4], 1], ["AN", 1, 0, 5], ["AN", 1, 1, 6], ["PR", 1, 0, "auto_unroll_max_step$512"]]]], "r": [[1.45765e-05, 1.46055e-05, 1.45972e-05], 0, 10.8787, 1681113996], "v": "v0.6"}
{"i": [["[\"reduce_mean\", 28, 28, 240]", "cuda -keys=cuda,gpu -arch=sm_80 -max_num_threads=1024 -model=unknown -thread_warp_size=32", [-1, 16, 64, 49152, 2147483647, 1024, 8, 32], "", 0, []], [[], [["FU", 1, [2, 3]], ["SP", 2, 1, 240, [40], 1], ["AN", 2, 2, 6], ["FSP", 1, 2, 1, 1], ["AN", 1, 3, 6], ["CA", 1, 2, 1], ["FU", 2, [0, 1]], ["AN", 2, 0, 5], ["PR", 1, 0, "auto_unroll_max_step$512"]]]], "r": [[4.08414e-05, 4.08576e-05, 4.08495e-05], 0, 12.6865, 1681113997], "v": "v0.6"}
{"i": [["[\"reduce_mean\", 28, 28, 240]", "cuda -keys=cuda,gpu -arch=sm_80 -max_num_threads=1024 -model=unknown -thread_warp_size=32", [-1, 16, 64, 49152, 2147483647, 1024, 8, 32], "", 0, []], [[], [["FU", 1, [2, 3]], ["SP", 2, 1, 240, [6], 1], ["AN", 2, 2, 6], ["FSP", 1, 2, 1, 1], ["AN", 1, 3, 6], ["CA", 1, 2, 1], ["FU", 2, [0, 1]], ["AN", 2, 0, 5], ["PR", 1, 0, "auto_unroll_max_step$16"]]]], "r": [[7.42327e-05, 7.42376e-05, 7.42182e-05], 0, 9.75682, 1681113995], "v": "v0.6"}
{"i": [["[\"reduce_mean\", 28, 28, 240]", "cuda -keys=cuda,gpu -arch=sm_80 -max_num_threads=1024 -model=unknown -thread_warp_size=32", [-1, 16, 64, 49152, 2147483647, 1024, 8, 32], "", 0, []], [[], [["FU", 2, [0, 1]], ["SP", 2, 0, 240, [1], 1], ["AN", 2, 0, 5], ["AN", 2, 1, 6], ["FU", 1, [0, 1]], ["SP", 1, 0, 240, [1], 1], ["AN", 1, 0, 5], ["AN", 1, 1, 6], ["PR", 1, 0, "auto_unroll_max_step$0"]]]], "r": [[2.02904e-05, 2.02805e-05, 2.02819e-05], 0, 13.1076, 1681113998], "v": "v0.6"}
{"i": [["[\"reduce_mean\", 28, 28, 240]", "cuda -keys=cuda,gpu -arch=sm_80 -max_num_threads=1024 -model=unknown -thread_warp_size=32", [-1, 16, 64, 49152, 2147483647, 1024, 8, 32], "", 0, []], [[], [["FU", 2, [0, 1]], ["SP", 2, 0, 240, [1], 1], ["AN", 2, 0, 5], ["AN", 2, 1, 6], ["FU", 1, [0, 1]], ["SP", 1, 0, 240, [32], 1], ["AN", 1, 0, 5], ["AN", 1, 1, 6], ["PR", 1, 0, "auto_unroll_max_step$512"]]]], "r": [[1.51494e-05, 1.5212e-05, 1.52174e-05], 0, 12.2408, 1681113997], "v": "v0.6"}
{"i": [["[\"reduce_mean\", 28, 28, 240]", "cuda -keys=cuda,gpu -arch=sm_80 -max_num_threads=1024 -model=unknown -thread_warp_size=32", [-1, 16, 64, 49152, 2147483647, 1024, 8, 32], "", 0, []], [[], [["FU", 1, [2, 3]], ["SP", 2, 1, 240, [4], 1], ["AN", 2, 2, 6], ["FSP", 1, 2, 1, 1], ["AN", 1, 3, 6], ["CA", 1, 2, 1], ["FU", 2, [0, 1]], ["AN", 2, 0, 5], ["PR", 1, 0, "auto_unroll_max_step$16"]]]], "r": [[1.08603e-05, 1.08707e-05, 1.08587e-05], 0, 14.4267, 1681113999], "v": "v0.6"}
{"i": [["[\"reduce_mean\", 28, 28, 240]", "cuda -keys=cuda,gpu -arch=sm_80 -max_num_threads=1024 -model=unknown -thread_warp_size=32", [-1, 16, 64, 49152, 2147483647, 1024, 8, 32], "", 0, []], [[], [["FU", 2, [0, 1]], ["SP", 2, 0, 240, [1], 1], ["AN", 2, 0, 5], ["AN", 2, 1, 6], ["FU", 1, [0, 1]], ["SP", 1, 0, 240, [32], 1], ["AN", 1, 0, 5], ["AN", 1, 1, 6], ["PR", 1, 0, "auto_unroll_max_step$64"]]]], "r": [[1.52725e-05, 1.52909e-05, 1.52941e-05], 0, 14.045, 1681113999], "v": "v0.6"}
{"i": [["[\"reduce_mean\", 28, 28, 240]", "cuda -keys=cuda,gpu -arch=sm_80 -max_num_threads=1024 -model=unknown -thread_warp_size=32", [-1, 16, 64, 49152, 2147483647, 1024, 8, 32], "", 0, []], [[], [["FU", 2, [0, 1]], ["SP", 2, 0, 240, [32], 1], ["AN", 2, 0, 5], ["AN", 2, 1, 6], ["FU", 1, [0, 1]], ["SP", 1, 0, 240, [48], 1], ["AN", 1, 0, 5], ["AN", 1, 1, 6], ["PR", 1, 0, "auto_unroll_max_step$1024"]]]], "r": [[1.86793e-05, 1.86974e-05, 1.86909e-05], 0, 11.6112, 1681113996], "v": "v0.6"}
{"i": [["[\"reduce_mean\", 28, 28, 240]", "cuda -keys=cuda,gpu -arch=sm_80 -max_num_threads=1024 -model=unknown -thread_warp_size=32", [-1, 16, 64, 49152, 2147483647, 1024, 8, 32], "", 0, []], [[], [["FU", 2, [0, 1]], ["SP", 2, 0, 240, [2], 1], ["AN", 2, 0, 5], ["AN", 2, 1, 6], ["FU", 1, [0, 1]], ["SP", 1, 0, 240, [8], 1], ["AN", 1, 0, 5], ["AN", 1, 1, 6], ["PR", 1, 0, "auto_unroll_max_step$64"]]]], "r": [[1.42997e-05, 1.43236e-05, 1.43246e-05], 0, 13.7443, 1681113999], "v": "v0.6"}
{"i": [["[\"reduce_mean\", 28, 28, 240]", "cuda -keys=cuda,gpu -arch=sm_80 -max_num_threads=1024 -model=unknown -thread_warp_size=32", [-1, 16, 64, 49152, 2147483647, 1024, 8, 32], "", 0, []], [[], [["FU", 1, [2, 3]], ["SP", 2, 1, 240, [2], 1], ["AN", 2, 2, 6], ["FSP", 1, 2, 1, 1], ["AN", 1, 3, 6], ["CA", 1, 2, 1], ["FU", 2, [0, 1]], ["AN", 2, 0, 5], ["PR", 1, 0, "auto_unroll_max_step$0"]]]], "r": [[1.00601e-05, 1.00722e-05, 1.00579e-05], 0, 15.5425, 1681114000], "v": "v0.6"}
{"i": [["[\"reduce_mean\", 28, 28, 240]", "cuda -keys=cuda,gpu -arch=sm_80 -max_num_threads=1024 -model=unknown -thread_warp_size=32", [-1, 16, 64, 49152, 2147483647, 1024, 8, 32], "", 0, []], [[], [["FU", 1, [2, 3]], ["SP", 2, 1, 240, [60], 1], ["AN", 2, 2, 6], ["FSP", 1, 2, 1, 1], ["AN", 1, 3, 6], ["CA", 1, 2, 1], ["FU", 2, [0, 1]], ["AN", 2, 0, 5], ["PR", 1, 0, "auto_unroll_max_step$16"]]]], "r": [[5.6681e-05, 5.67325e-05, 5.67141e-05], 0, 15.1866, 1681114000], "v": "v0.6"}
{"i": [["[\"reduce_mean\", 28, 28, 240]", "cuda -keys=cuda,gpu -arch=sm_80 -max_num_threads=1024 -model=unknown -thread_warp_size=32", [-1, 16, 64, 49152, 2147483647, 1024, 8, 32], "", 0, []], [[], [["FU", 2, [0, 1]], ["SP", 2, 0, 240, [4], 1], ["AN", 2, 0, 5], ["AN", 2, 1, 6], ["FU", 1, [0, 1]], ["SP", 1, 0, 240, [32], 1], ["AN", 1, 0, 5], ["AN", 1, 1, 6], ["PR", 1, 0, "auto_unroll_max_step$0"]]]], "r": [[1.50522e-05, 1.50759e-05, 1.50802e-05], 0, 13.3413, 1681113998], "v": "v0.6"}
{"i": [["[\"reduce_mean\", 28, 28, 240]", "cuda -keys=cuda,gpu -arch=sm_80 -max_num_threads=1024 -model=unknown -thread_warp_size=32", [-1, 16, 64, 49152, 2147483647, 1024, 8, 32], "", 0, []], [[], [["FU", 1, [2, 3]], ["SP", 2, 1, 240, [6], 1], ["AN", 2, 2, 6], ["FSP", 1, 2, 1, 1], ["AN", 1, 3, 6], ["CA", 1, 2, 1], ["FU", 2, [0, 1]], ["AN", 2, 0, 5], ["PR", 1, 0, "auto_unroll_max_step$64"]]]], "r": [[7.42424e-05, 7.42182e-05, 7.42036e-05], 0, 14.6015, 1681114000], "v": "v0.6"}
{"i": [["[\"reduce_mean\", 28, 28, 240]", "cuda -keys=cuda,gpu -arch=sm_80 -max_num_threads=1024 -model=unknown -thread_warp_size=32", [-1, 16, 64, 49152, 2147483647, 1024, 8, 32], "", 0, []], [[], [["FU", 2, [0, 1]], ["SP", 2, 0, 240, [1], 1], ["AN", 2, 0, 5], ["AN", 2, 1, 6], ["FU", 1, [0, 1]], ["SP", 1, 0, 240, [10], 1], ["AN", 1, 0, 5], ["AN", 1, 1, 6], ["PR", 1, 0, "auto_unroll_max_step$0"]]]], "r": [[1.44197e-05, 1.44557e-05, 1.44514e-05], 0, 1.51264, 1681113986], "v": "v0.6"}
{"i": [["[\"reduce_mean\", 28, 28, 240]", "cuda -keys=cuda,gpu -arch=sm_80 -max_num_threads=1024 -model=unknown -thread_warp_size=32", [-1, 16, 64, 49152, 2147483647, 1024, 8, 32], "", 0, []], [[], [["FU", 2, [0, 1]], ["SP", 2, 0, 240, [40], 1], ["AN", 2, 0, 5], ["AN", 2, 1, 6], ["FU", 1, [0, 1]], ["SP", 1, 0, 240, [32], 1], ["AN", 1, 0, 5], ["AN", 1, 1, 6], ["PR", 1, 0, "auto_unroll_max_step$512"]]]], "r": [[1.4929e-05, 1.48994e-05, 1.49354e-05], 0, 1.54373, 1681113986], "v": "v0.6"}
{"i": [["[\"reduce_mean\", 28, 28, 240]", "cuda -keys=cuda,gpu -arch=sm_80 -max_num_threads=1024 -model=unknown -thread_warp_size=32", [-1, 16, 64, 49152, 2147483647, 1024, 8, 32], "", 0, []], [[], [["FU", 2, [0, 1]], ["SP", 2, 0, 240, [4], 1], ["AN", 2, 0, 5], ["AN", 2, 1, 6], ["FU", 1, [0, 1]], ["SP", 1, 0, 240, [1], 1], ["AN", 1, 0, 5], ["AN", 1, 1, 6], ["PR", 1, 0, "auto_unroll_max_step$512"]]]], "r": [[1.97835e-05, 1.9807e-05, 1.98042e-05], 0, 7.48794, 1681113992], "v": "v0.6"}
{"i": [["[\"reduce_mean\", 28, 28, 240]", "cuda -keys=cuda,gpu -arch=sm_80 -max_num_threads=1024 -model=unknown -thread_warp_size=32", [-1, 16, 64, 49152, 2147483647, 1024, 8, 32], "", 0, []], [[], [["FU", 2, [0, 1]], ["SP", 2, 0, 240, [40], 1], ["AN", 2, 0, 5], ["AN", 2, 1, 6], ["FU", 1, [0, 1]], ["SP", 1, 0, 240, [20], 1], ["AN", 1, 0, 5], ["AN", 1, 1, 6], ["PR", 1, 0, "auto_unroll_max_step$512"]]]], "r": [[1.41297e-05, 1.41349e-05, 1.4136e-05], 0, 10.3482, 1681113995], "v": "v0.6"}
{"i": [["[\"reduce_mean\", 28, 28, 240]", "cuda -keys=cuda,gpu -arch=sm_80 -max_num_threads=1024 -model=unknown -thread_warp_size=32", [-1, 16, 64, 49152, 2147483647, 1024, 8, 32], "", 0, []], [[], [["FU", 1, [2, 3]], ["SP", 2, 1, 240, [20], 1], ["AN", 2, 2, 6], ["FSP", 1, 2, 1, 1], ["AN", 1, 3, 6], ["CA", 1, 2, 1], ["FU", 2, [0, 1]], ["AN", 2, 0, 5], ["PR", 1, 0, "auto_unroll_max_step$0"]]]], "r": [[5.43818e-05, 5.43889e-05, 5.43783e-05], 0, 11.7808, 1681113997], "v": "v0.6"}
{"i": [["[\"reduce_mean\", 28, 28, 240]", "cuda -keys=cuda,gpu -arch=sm_80 -max_num_threads=1024 -model=unknown -thread_warp_size=32", [-1, 16, 64, 49152, 2147483647, 1024, 8, 32], "", 0, []], [[], [["FU", 1, [2, 3]], ["SP", 2, 1, 240, [16], 1], ["AN", 2, 2, 6], ["FSP", 1, 2, 1, 1], ["AN", 1, 3, 6], ["CA", 1, 2, 1], ["FU", 2, [0, 1]], ["AN", 2, 0, 5], ["PR", 1, 0, "auto_unroll_max_step$64"]]]], "r": [[1.84333e-05, 1.8446e-05, 1.84282e-05], 0, 15.4145, 1681114001], "v": "v0.6"}
{"i": [["[\"reduce_mean\", 28, 28, 240]", "cuda -keys=cuda,gpu -arch=sm_80 -max_num_threads=1024 -model=unknown -thread_warp_size=32", [-1, 16, 64, 49152, 2147483647, 1024, 8, 32], "", 0, []], [[], [["FU", 2, [0, 1]], ["SP", 2, 0, 240, [32], 1], ["AN", 2, 0, 5], ["AN", 2, 1, 6], ["FU", 1, [0, 1]], ["SP", 1, 0, 240, [48], 1], ["AN", 1, 0, 5], ["AN", 1, 1, 6], ["PR", 1, 0, "auto_unroll_max_step$16"]]]], "r": [[1.87848e-05, 1.88039e-05, 1.88026e-05], 0, 15.3599, 1681114001], "v": "v0.6"}
{"i": [["[\"reduce_mean\", 28, 28, 240]", "cuda -keys=cuda,gpu -arch=sm_80 -max_num_threads=1024 -model=unknown -thread_warp_size=32", [-1, 16, 64, 49152, 2147483647, 1024, 8, 32], "", 0, []], [[], [["FU", 2, [0, 1]], ["SP", 2, 0, 240, [8], 1], ["AN", 2, 0, 5], ["AN", 2, 1, 6], ["FU", 1, [0, 1]], ["SP", 1, 0, 240, [32], 1], ["AN", 1, 0, 5], ["AN", 1, 1, 6], ["PR", 1, 0, "auto_unroll_max_step$512"]]]], "r": [[1.50084e-05, 1.50296e-05, 1.50275e-05], 0, 15.4028, 1681114001], "v": "v0.6"}
{"i": [["[\"reduce_mean\", 28, 28, 240]", "cuda -keys=cuda,gpu -arch=sm_80 -max_num_threads=1024 -model=unknown -thread_warp_size=32", [-1, 16, 64, 49152, 2147483647, 1024, 8, 32], "", 0, []], [[], [["FU", 1, [2, 3]], ["SP", 2, 1, 240, [1], 1], ["AN", 2, 2, 6], ["FSP", 1, 2, 1, 1], ["AN", 1, 3, 6], ["CA", 1, 2, 1], ["FU", 2, [0, 1]], ["AN", 2, 0, 5], ["PR", 1, 0, "auto_unroll_max_step$0"]]]], "r": [[1.61415e-05, 1.6146e-05, 1.61258e-05], 0, 15.2061, 1681114002], "v": "v0.6"}
{"i": [["[\"reduce_mean\", 28, 28, 240]", "cuda -keys=cuda,gpu -arch=sm_80 -max_num_threads=1024 -model=unknown -thread_warp_size=32", [-1, 16, 64, 49152, 2147483647, 1024, 8, 32], "", 0, []], [[], [["FU", 1, [2, 3]], ["SP", 2, 1, 240, [32], 1], ["AN", 2, 2, 6], ["FSP", 1, 2, 1, 1], ["AN", 1, 3, 6], ["CA", 1, 2, 1], ["FU", 2, [0, 1]], ["AN", 2, 0, 5], ["PR", 1, 0, "auto_unroll_max_step$64"]]]], "r": [[3.15511e-05, 3.15511e-05, 3.15511e-05], 0, 15.5412, 1681114002], "v": "v0.6"}
{"i": [["[\"reduce_mean\", 28, 28, 240]", "cuda -keys=cuda,gpu -arch=sm_80 -max_num_threads=1024 -model=unknown -thread_warp_size=32", [-1, 16, 64, 49152, 2147483647, 1024, 8, 32], "", 0, []], [[], [["FU", 2, [0, 1]], ["SP", 2, 0, 240, [48], 1], ["AN", 2, 0, 5], ["AN", 2, 1, 6], ["FU", 1, [0, 1]], ["SP", 1, 0, 240, [2], 1], ["AN", 1, 0, 5], ["AN", 1, 1, 6], ["PR", 1, 0, "auto_unroll_max_step$16"]]]], "r": [[1.45547e-05, 1.45143e-05, 1.45277e-05], 0, 15.3835, 1681114003], "v": "v0.6"}
{"i": [["[\"reduce_mean\", 28, 28, 240]", "cuda -keys=cuda,gpu -arch=sm_80 -max_num_threads=1024 -model=unknown -thread_warp_size=32", [-1, 16, 64, 49152, 2147483647, 1024, 8, 32], "", 0, []], [[], [["FU", 1, [2, 3]], ["SP", 2, 1, 240, [2], 1], ["AN", 2, 2, 6], ["FSP", 1, 2, 1, 1], ["AN", 1, 3, 6], ["CA", 1, 2, 1], ["FU", 2, [0, 1]], ["AN", 2, 0, 5], ["PR", 1, 0, "auto_unroll_max_step$512"]]]], "r": [[8.28594e-06, 8.2753e-06, 8.28031e-06], 0, 16.8921, 1681114003], "v": "v0.6"}
{"i": [["[\"reduce_mean\", 28, 28, 240]", "cuda -keys=cuda,gpu -arch=sm_80 -max_num_threads=1024 -model=unknown -thread_warp_size=32", [-1, 16, 64, 49152, 2147483647, 1024, 8, 32], "", 0, []], [[], [["FU", 2, [0, 1]], ["SP", 2, 0, 240, [4], 1], ["AN", 2, 0, 5], ["AN", 2, 1, 6], ["FU", 1, [0, 1]], ["SP", 1, 0, 240, [16], 1], ["AN", 1, 0, 5], ["AN", 1, 1, 6], ["PR", 1, 0, "auto_unroll_max_step$0"]]]], "r": [[1.43066e-05, 1.43228e-05, 1.43157e-05], 0, 15.2803, 1681114003], "v": "v0.6"}
{"i": [["[\"reduce_mean\", 28, 28, 240]", "cuda -keys=cuda,gpu -arch=sm_80 -max_num_threads=1024 -model=unknown -thread_warp_size=32", [-1, 16, 64, 49152, 2147483647, 1024, 8, 32], "", 0, []], [[], [["FU", 2, [0, 1]], ["SP", 2, 0, 240, [2], 1], ["AN", 2, 0, 5], ["AN", 2, 1, 6], ["FU", 1, [0, 1]], ["SP", 1, 0, 240, [4], 1], ["AN", 1, 0, 5], ["AN", 1, 1, 6], ["PR", 1, 0, "auto_unroll_max_step$1024"]]]], "r": [[1.45669e-05, 1.45901e-05, 1.45912e-05], 0, 15.3226, 1681114004], "v": "v0.6"}
{"i": [["[\"reduce_mean\", 28, 28, 240]", "cuda -keys=cuda,gpu -arch=sm_80 -max_num_threads=1024 -model=unknown -thread_warp_size=32", [-1, 16, 64, 49152, 2147483647, 1024, 8, 32], "", 0, []], [[], [["FU", 2, [0, 1]], ["SP", 2, 0, 240, [4], 1], ["AN", 2, 0, 5], ["AN", 2, 1, 6], ["FU", 1, [0, 1]], ["SP", 1, 0, 240, [48], 1], ["AN", 1, 0, 5], ["AN", 1, 1, 6], ["PR", 1, 0, "auto_unroll_max_step$1024"]]]], "r": [[1.86636e-05, 1.869e-05, 1.869e-05], 0, 15.2359, 1681114004], "v": "v0.6"}
{"i": [["[\"reduce_mean\", 28, 28, 240]", "cuda -keys=cuda,gpu -arch=sm_80 -max_num_threads=1024 -model=unknown -thread_warp_size=32", [-1, 16, 64, 49152, 2147483647, 1024, 8, 32], "", 0, []], [[], [["FU", 1, [2, 3]], ["SP", 2, 1, 240, [10], 1], ["AN", 2, 2, 6], ["FSP", 1, 2, 1, 1], ["AN", 1, 3, 6], ["CA", 1, 2, 1], ["FU", 2, [0, 1]], ["AN", 2, 0, 5], ["PR", 1, 0, "auto_unroll_max_step$16"]]]], "r": [[8.04178e-05, 8.03918e-05, 8.03762e-05], 0, 15.2982, 1681114004], "v": "v0.6"}
{"i": [["[\"reduce_mean\", 28, 28, 240]", "cuda -keys=cuda,gpu -arch=sm_80 -max_num_threads=1024 -model=unknown -thread_warp_size=32", [-1, 16, 64, 49152, 2147483647, 1024, 8, 32], "", 0, []], [[], [["FU", 2, [0, 1]], ["SP", 2, 0, 240, [48], 1], ["AN", 2, 0, 5], ["AN", 2, 1, 6], ["FU", 1, [0, 1]], ["SP", 1, 0, 240, [30], 1], ["AN", 1, 0, 5], ["AN", 1, 1, 6], ["PR", 1, 0, "auto_unroll_max_step$0"]]]], "r": [[1.38326e-05, 1.3857e-05, 1.3856e-05], 0, 15.2316, 1681114005], "v": "v0.6"}
{"i": [["[\"reduce_mean\", 28, 28, 240]", "cuda -keys=cuda,gpu -arch=sm_80 -max_num_threads=1024 -model=unknown -thread_warp_size=32", [-1, 16, 64, 49152, 2147483647, 1024, 8, 32], "", 0, []], [[], [["FU", 1, [2, 3]], ["SP", 2, 1, 240, [30], 1], ["AN", 2, 2, 6], ["FSP", 1, 2, 1, 1], ["AN", 1, 3, 6], ["CA", 1, 2, 1], ["FU", 2, [0, 1]], ["AN", 2, 0, 5], ["PR", 1, 0, "auto_unroll_max_step$0"]]]], "r": [[5.88992e-05, 5.893e-05, 5.89262e-05], 0, 15.1723, 1681114005], "v": "v0.6"}
{"i": [["[\"reduce_mean\", 28, 28, 240]", "cuda -keys=cuda,gpu -arch=sm_80 -max_num_threads=1024 -model=unknown -thread_warp_size=32", [-1, 16, 64, 49152, 2147483647, 1024, 8, 32], "", 0, []], [[], [["FU", 2, [0, 1]], ["SP", 2, 0, 240, [15], 1], ["AN", 2, 0, 5], ["AN", 2, 1, 6], ["FU", 1, [0, 1]], ["SP", 1, 0, 240, [4], 1], ["AN", 1, 0, 5], ["AN", 1, 1, 6], ["PR", 1, 0, "auto_unroll_max_step$16"]]]], "r": [[1.43515e-05, 1.43795e-05, 1.43692e-05], 0, 15.241, 1681114005], "v": "v0.6"}
{"i": [["[\"reduce_mean\", 28, 28, 240]", "cuda -keys=cuda,gpu -arch=sm_80 -max_num_threads=1024 -model=unknown -thread_warp_size=32", [-1, 16, 64, 49152, 2147483647, 1024, 8, 32], "", 0, []], [[], [["FU", 2, [0, 1]], ["SP", 2, 0, 240, [16], 1], ["AN", 2, 0, 5], ["AN", 2, 1, 6], ["FU", 1, [0, 1]], ["SP", 1, 0, 240, [32], 1], ["AN", 1, 0, 5], ["AN", 1, 1, 6], ["PR", 1, 0, "auto_unroll_max_step$64"]]]], "r": [[1.49724e-05, 1.50222e-05, 1.50169e-05], 0, 15.2177, 1681114006], "v": "v0.6"}
{"i": [["[\"reduce_mean\", 28, 28, 240]", "cuda -keys=cuda,gpu -arch=sm_80 -max_num_threads=1024 -model=unknown -thread_warp_size=32", [-1, 16, 64, 49152, 2147483647, 1024, 8, 32], "", 0, []], [[], [["FU", 2, [0, 1]], ["SP", 2, 0, 240, [32], 1], ["AN", 2, 0, 5], ["AN", 2, 1, 6], ["FU", 1, [0, 1]], ["SP", 1, 0, 240, [32], 1], ["AN", 1, 0, 5], ["AN", 1, 1, 6], ["PR", 1, 0, "auto_unroll_max_step$0"]]]], "r": [[1.48729e-05, 1.49036e-05, 1.48877e-05], 0, 15.2502, 1681114006], "v": "v0.6"}
{"i": [["[\"reduce_mean\", 28, 28, 240]", "cuda -keys=cuda,gpu -arch=sm_80 -max_num_threads=1024 -model=unknown -thread_warp_size=32", [-1, 16, 64, 49152, 2147483647, 1024, 8, 32], "", 0, []], [[], [["FU", 2, [0, 1]], ["SP", 2, 0, 240, [32], 1], ["AN", 2, 0, 5], ["AN", 2, 1, 6], ["FU", 1, [0, 1]], ["SP", 1, 0, 240, [32], 1], ["AN", 1, 0, 5], ["AN", 1, 1, 6], ["PR", 1, 0, "auto_unroll_max_step$16"]]]], "r": [[1.50403e-05, 1.50716e-05, 1.50792e-05], 0, 15.2213, 1681114007], "v": "v0.6"}
{"i": [["[\"reduce_mean\", 28, 28, 240]", "cuda -keys=cuda,gpu -arch=sm_80 -max_num_threads=1024 -model=unknown -thread_warp_size=32", [-1, 16, 64, 49152, 2147483647, 1024, 8, 32], "", 0, []], [[], [["FU", 2, [0, 1]], ["SP", 2, 0, 240, [32], 1], ["AN", 2, 0, 5], ["AN", 2, 1, 6], ["FU", 1, [0, 1]], ["SP", 1, 0, 240, [32], 1], ["AN", 1, 0, 5], ["AN", 1, 1, 6], ["PR", 1, 0, "auto_unroll_max_step$512"]]]], "r": [[1.49798e-05, 1.49647e-05, 1.49701e-05], 0, 15.2715, 1681114007], "v": "v0.6"}
{"i": [["[\"reduce_mean\", 28, 28, 240]", "cuda -keys=cuda,gpu -arch=sm_80 -max_num_threads=1024 -model=unknown -thread_warp_size=32", [-1, 16, 64, 49152, 2147483647, 1024, 8, 32], "", 0, []], [[], [["FU", 2, [0, 1]], ["SP", 2, 0, 240, [1], 1], ["AN", 2, 0, 5], ["AN", 2, 1, 6], ["FU", 1, [0, 1]], ["SP", 1, 0, 240, [32], 1], ["AN", 1, 0, 5], ["AN", 1, 1, 6], ["PR", 1, 0, "auto_unroll_max_step$16"]]]], "r": [[1.50943e-05, 1.51213e-05, 1.51213e-05], 0, 3.85186, 1681114042], "v": "v0.6"}
{"i": [["[\"reduce_mean\", 28, 28, 240]", "cuda -keys=cuda,gpu -arch=sm_80 -max_num_threads=1024 -model=unknown -thread_warp_size=32", [-1, 16, 64, 49152, 2147483647, 1024, 8, 32], "", 0, []], [[], [["FU", 2, [0, 1]], ["SP", 2, 0, 240, [3], 1], ["AN", 2, 0, 5], ["AN", 2, 1, 6], ["FU", 1, [0, 1]], ["SP", 1, 0, 240, [10], 1], ["AN", 1, 0, 5], ["AN", 1, 1, 6], ["PR", 1, 0, "auto_unroll_max_step$0"]]]], "r": [[1.44697e-05, 1.44832e-05, 1.44801e-05], 0, 2.97237, 1681114041], "v": "v0.6"}
{"i": [["[\"reduce_mean\", 28, 28, 240]", "cuda -keys=cuda,gpu -arch=sm_80 -max_num_threads=1024 -model=unknown -thread_warp_size=32", [-1, 16, 64, 49152, 2147483647, 1024, 8, 32], "", 0, []], [[], [["FU", 1, [2, 3]], ["SP", 2, 1, 240, [15], 1], ["AN", 2, 2, 6], ["FSP", 1, 2, 1, 1], ["AN", 1, 3, 6], ["CA", 1, 2, 1], ["FU", 2, [0, 1]], ["AN", 2, 0, 5], ["PR", 1, 0, "auto_unroll_max_step$16"]]]], "r": [[8.47346e-05, 8.47511e-05, 8.47401e-05], 0, 3.33974, 1681114041], "v": "v0.6"}
{"i": [["[\"reduce_mean\", 28, 28, 240]", "cuda -keys=cuda,gpu -arch=sm_80 -max_num_threads=1024 -model=unknown -thread_warp_size=32", [-1, 16, 64, 49152, 2147483647, 1024, 8, 32], "", 0, []], [[], [["FU", 1, [2, 3]], ["SP", 2, 1, 240, [5], 1], ["AN", 2, 2, 6], ["FSP", 1, 2, 1, 1], ["AN", 1, 3, 6], ["CA", 1, 2, 1], ["FU", 2, [0, 1]], ["AN", 2, 0, 5], ["PR", 1, 0, "auto_unroll_max_step$0"]]]], "r": [[7.89504e-05, 7.89555e-05, 7.89555e-05], 0, 1.93329, 1681114040], "v": "v0.6"}
{"i": [["[\"reduce_mean\", 28, 28, 240]", "cuda -keys=cuda,gpu -arch=sm_80 -max_num_threads=1024 -model=unknown -thread_warp_size=32", [-1, 16, 64, 49152, 2147483647, 1024, 8, 32], "", 0, []], [[], [["FU", 2, [0, 1]], ["SP", 2, 0, 240, [5], 1], ["AN", 2, 0, 5], ["AN", 2, 1, 6], ["FU", 1, [0, 1]], ["SP", 1, 0, 240, [4], 1], ["AN", 1, 0, 5], ["AN", 1, 1, 6], ["PR", 1, 0, "auto_unroll_max_step$16"]]]], "r": [[1.425e-05, 1.42769e-05, 1.4278e-05], 0, 2.68816, 1681114041], "v": "v0.6"}
{"i": [["[\"reduce_mean\", 28, 28, 240]", "cuda -keys=cuda,gpu -arch=sm_80 -max_num_threads=1024 -model=unknown -thread_warp_size=32", [-1, 16, 64, 49152, 2147483647, 1024, 8, 32], "", 0, []], [[], [["FU", 2, [0, 1]], ["SP", 2, 0, 240, [32], 1], ["AN", 2, 0, 5], ["AN", 2, 1, 6], ["FU", 1, [0, 1]], ["SP", 1, 0, 240, [8], 1], ["AN", 1, 0, 5], ["AN", 1, 1, 6], ["PR", 1, 0, "auto_unroll_max_step$512"]]]], "r": [[1.44375e-05, 1.44649e-05, 1.44639e-05], 0, 1.73195, 1681114040], "v": "v0.6"}
{"i": [["[\"reduce_mean\", 28, 28, 240]", "cuda -keys=cuda,gpu -arch=sm_80 -max_num_threads=1024 -model=unknown -thread_warp_size=32", [-1, 16, 64, 49152, 2147483647, 1024, 8, 32], "", 0, []], [[], [["FU", 1, [2, 3]], ["SP", 2, 1, 240, [40], 1], ["AN", 2, 2, 6], ["FSP", 1, 2, 1, 1], ["AN", 1, 3, 6], ["CA", 1, 2, 1], ["FU", 2, [0, 1]], ["AN", 2, 0, 5], ["PR", 1, 0, "auto_unroll_max_step$0"]]]], "r": [[5.01337e-05, 5.01532e-05, 5.01565e-05], 0, 1.4005, 1681114039], "v": "v0.6"}
{"i": [["[\"reduce_mean\", 28, 28, 240]", "cuda -keys=cuda,gpu -arch=sm_80 -max_num_threads=1024 -model=unknown -thread_warp_size=32", [-1, 16, 64, 49152, 2147483647, 1024, 8, 32], "", 0, []], [[], [["FU", 2, [0, 1]], ["SP", 2, 0, 240, [12], 1], ["AN", 2, 0, 5], ["AN", 2, 1, 6], ["FU", 1, [0, 1]], ["SP", 1, 0, 240, [2], 1], ["AN", 1, 0, 5], ["AN", 1, 1, 6], ["PR", 1, 0, "auto_unroll_max_step$16"]]]], "r": [[1.45557e-05, 1.45609e-05, 1.45599e-05], 0, 6.77358, 1681114045], "v": "v0.6"}
{"i": [["[\"reduce_mean\", 28, 28, 240]", "cuda -keys=cuda,gpu -arch=sm_80 -max_num_threads=1024 -model=unknown -thread_warp_size=32", [-1, 16, 64, 49152, 2147483647, 1024, 8, 32], "", 0, []], [[], [["FU", 2, [0, 1]], ["SP", 2, 0, 240, [8], 1], ["AN", 2, 0, 5], ["AN", 2, 1, 6], ["FU", 1, [0, 1]], ["SP", 1, 0, 240, [48], 1], ["AN", 1, 0, 5], ["AN", 1, 1, 6], ["PR", 1, 0, "auto_unroll_max_step$0"]]]], "r": [[1.8461e-05, 1.84741e-05, 1.84794e-05], 0, 2.36442, 1681114040], "v": "v0.6"}
{"i": [["[\"reduce_mean\", 28, 28, 240]", "cuda -keys=cuda,gpu -arch=sm_80 -max_num_threads=1024 -model=unknown -thread_warp_size=32", [-1, 16, 64, 49152, 2147483647, 1024, 8, 32], "", 0, []], [[], [["FU", 2, [0, 1]], ["SP", 2, 0, 240, [2], 1], ["AN", 2, 0, 5], ["AN", 2, 1, 6], ["FU", 1, [0, 1]], ["SP", 1, 0, 240, [1], 1], ["AN", 1, 0, 5], ["AN", 1, 1, 6], ["PR", 1, 0, "auto_unroll_max_step$0"]]]], "r": [[2.00281e-05, 2.00253e-05, 2.00253e-05], 0, 8.67137, 1681114047], "v": "v0.6"}
{"i": [["[\"reduce_mean\", 28, 28, 240]", "cuda -keys=cuda,gpu -arch=sm_80 -max_num_threads=1024 -model=unknown -thread_warp_size=32", [-1, 16, 64, 49152, 2147483647, 1024, 8, 32], "", 0, []], [[], [["FU", 2, [0, 1]], ["SP", 2, 0, 240, [1], 1], ["AN", 2, 0, 5], ["AN", 2, 1, 6], ["FU", 1, [0, 1]], ["SP", 1, 0, 240, [4], 1], ["AN", 1, 0, 5], ["AN", 1, 1, 6], ["PR", 1, 0, "auto_unroll_max_step$512"]]]], "r": [[1.47628e-05, 1.48697e-05, 1.48771e-05], 0, 4.16062, 1681114042], "v": "v0.6"}
{"i": [["[\"reduce_mean\", 28, 28, 240]", "cuda -keys=cuda,gpu -arch=sm_80 -max_num_threads=1024 -model=unknown -thread_warp_size=32", [-1, 16, 64, 49152, 2147483647, 1024, 8, 32], "", 0, []], [[], [["FU", 2, [0, 1]], ["SP", 2, 0, 240, [16], 1], ["AN", 2, 0, 5], ["AN", 2, 1, 6], ["FU", 1, [0, 1]], ["SP", 1, 0, 240, [8], 1], ["AN", 1, 0, 5], ["AN", 1, 1, 6], ["PR", 1, 0, "auto_unroll_max_step$16"]]]], "r": [[1.41574e-05, 1.41807e-05, 1.41817e-05], 0, 5.73273, 1681114044], "v": "v0.6"}
{"i": [["[\"reduce_mean\", 28, 28, 240]", "cuda -keys=cuda,gpu -arch=sm_80 -max_num_threads=1024 -model=unknown -thread_warp_size=32", [-1, 16, 64, 49152, 2147483647, 1024, 8, 32], "", 0, []], [[], [["FU", 2, [0, 1]], ["SP", 2, 0, 240, [1], 1], ["AN", 2, 0, 5], ["AN", 2, 1, 6], ["FU", 1, [0, 1]], ["SP", 1, 0, 240, [8], 1], ["AN", 1, 0, 5], ["AN", 1, 1, 6], ["PR", 1, 0, "auto_unroll_max_step$1024"]]]], "r": [[1.44662e-05, 1.44874e-05, 1.44874e-05], 0, 5.53135, 1681114044], "v": "v0.6"}
{"i": [["[\"reduce_mean\", 28, 28, 240]", "cuda -keys=cuda,gpu -arch=sm_80 -max_num_threads=1024 -model=unknown -thread_warp_size=32", [-1, 16, 64, 49152, 2147483647, 1024, 8, 32], "", 0, []], [[], [["FU", 1, [2, 3]], ["SP", 2, 1, 240, [30], 1], ["AN", 2, 2, 6], ["FSP", 1, 2, 1, 1], ["AN", 1, 3, 6], ["CA", 1, 2, 1], ["FU", 2, [0, 1]], ["AN", 2, 0, 5], ["PR", 1, 0, "auto_unroll_max_step$16"]]]], "r": [[5.87876e-05, 5.87992e-05, 5.8803e-05], 0, 4.87938, 1681114043], "v": "v0.6"}
{"i": [["[\"reduce_mean\", 28, 28, 240]", "cuda -keys=cuda,gpu -arch=sm_80 -max_num_threads=1024 -model=unknown -thread_warp_size=32", [-1, 16, 64, 49152, 2147483647, 1024, 8, 32], "", 0, []], [[], [["FU", 2, [0, 1]], ["SP", 2, 0, 240, [2], 1], ["AN", 2, 0, 5], ["AN", 2, 1, 6], ["FU", 1, [0, 1]], ["SP", 1, 0, 240, [2], 1], ["AN", 1, 0, 5], ["AN", 1, 1, 6], ["PR", 1, 0, "auto_unroll_max_step$0"]]]], "r": [[1.46677e-05, 1.46988e-05, 1.46977e-05], 0, 7.27043, 1681114045], "v": "v0.6"}
{"i": [["[\"reduce_mean\", 28, 28, 240]", "cuda -keys=cuda,gpu -arch=sm_80 -max_num_threads=1024 -model=unknown -thread_warp_size=32", [-1, 16, 64, 49152, 2147483647, 1024, 8, 32], "", 0, []], [[], [["FU", 2, [0, 1]], ["SP", 2, 0, 240, [12], 1], ["AN", 2, 0, 5], ["AN", 2, 1, 6], ["FU", 1, [0, 1]], ["SP", 1, 0, 240, [48], 1], ["AN", 1, 0, 5], ["AN", 1, 1, 6], ["PR", 1, 0, "auto_unroll_max_step$1024"]]]], "r": [[1.87336e-05, 1.87492e-05, 1.87543e-05], 0, 4.4168, 1681114042], "v": "v0.6"}
{"i": [["[\"reduce_mean\", 28, 28, 240]", "cuda -keys=cuda,gpu -arch=sm_80 -max_num_threads=1024 -model=unknown -thread_warp_size=32", [-1, 16, 64, 49152, 2147483647, 1024, 8, 32], "", 0, []], [[], [["FU", 2, [0, 1]], ["SP", 2, 0, 240, [4], 1], ["AN", 2, 0, 5], ["AN", 2, 1, 6], ["FU", 1, [0, 1]], ["SP", 1, 0, 240, [2], 1], ["AN", 1, 0, 5], ["AN", 1, 1, 6], ["PR", 1, 0, "auto_unroll_max_step$16"]]]], "r": [[1.44324e-05, 1.44479e-05, 1.44448e-05], 0, 9.34513, 1681114048], "v": "v0.6"}
{"i": [["[\"reduce_mean\", 28, 28, 240]", "cuda -keys=cuda,gpu -arch=sm_80 -max_num_threads=1024 -model=unknown -thread_warp_size=32", [-1, 16, 64, 49152, 2147483647, 1024, 8, 32], "", 0, []], [[], [["FU", 2, [0, 1]], ["SP", 2, 0, 240, [1], 1], ["AN", 2, 0, 5], ["AN", 2, 1, 6], ["FU", 1, [0, 1]], ["SP", 1, 0, 240, [30], 1], ["AN", 1, 0, 5], ["AN", 1, 1, 6], ["PR", 1, 0, "auto_unroll_max_step$1024"]]]], "r": [[1.42173e-05, 1.42447e-05, 1.42467e-05], 0, 6.34694, 1681114045], "v": "v0.6"}
{"i": [["[\"reduce_mean\", 28, 28, 240]", "cuda -keys=cuda,gpu -arch=sm_80 -max_num_threads=1024 -model=unknown -thread_warp_size=32", [-1, 16, 64, 49152, 2147483647, 1024, 8, 32], "", 0, []], [[], [["FU", 2, [0, 1]], ["SP", 2, 0, 240, [1], 1], ["AN", 2, 0, 5], ["AN", 2, 1, 6], ["FU", 1, [0, 1]], ["SP", 1, 0, 240, [48], 1], ["AN", 1, 0, 5], ["AN", 1, 1, 6], ["PR", 1, 0, "auto_unroll_max_step$0"]]]], "r": [[1.89175e-05, 1.89252e-05, 1.89382e-05], 0, 7.51375, 1681114046], "v": "v0.6"}
{"i": [["[\"reduce_mean\", 28, 28, 240]", "cuda -keys=cuda,gpu -arch=sm_80 -max_num_threads=1024 -model=unknown -thread_warp_size=32", [-1, 16, 64, 49152, 2147483647, 1024, 8, 32], "", 0, []], [[], [["FU", 2, [0, 1]], ["SP", 2, 0, 240, [16], 1], ["AN", 2, 0, 5], ["AN", 2, 1, 6], ["FU", 1, [0, 1]], ["SP", 1, 0, 240, [1], 1], ["AN", 1, 0, 5], ["AN", 1, 1, 6], ["PR", 1, 0, "auto_unroll_max_step$0"]]]], "r": [[2.01166e-05, 2.01373e-05, 2.01373e-05], 0, 8.32438, 1681114047], "v": "v0.6"}
{"i": [["[\"reduce_mean\", 28, 28, 240]", "cuda -keys=cuda,gpu -arch=sm_80 -max_num_threads=1024 -model=unknown -thread_warp_size=32", [-1, 16, 64, 49152, 2147483647, 1024, 8, 32], "", 0, []], [[], [["FU", 2, [0, 1]], ["SP", 2, 0, 240, [32], 1], ["AN", 2, 0, 5], ["AN", 2, 1, 6], ["FU", 1, [0, 1]], ["SP", 1, 0, 240, [1], 1], ["AN", 1, 0, 5], ["AN", 1, 1, 6], ["PR", 1, 0, "auto_unroll_max_step$0"]]]], "r": [[1.99341e-05, 1.99507e-05, 1.9948e-05], 0, 6.06569, 1681114044], "v": "v0.6"}
{"i": [["[\"reduce_mean\", 28, 28, 240]", "cuda -keys=cuda,gpu -arch=sm_80 -max_num_threads=1024 -model=unknown -thread_warp_size=32", [-1, 16, 64, 49152, 2147483647, 1024, 8, 32], "", 0, []], [[], [["FU", 2, [0, 1]], ["SP", 2, 0, 240, [20], 1], ["AN", 2, 0, 5], ["AN", 2, 1, 6], ["FU", 1, [0, 1]], ["SP", 1, 0, 240, [2], 1], ["AN", 1, 0, 5], ["AN", 1, 1, 6], ["PR", 1, 0, "auto_unroll_max_step$1024"]]]], "r": [[1.44666e-05, 1.44801e-05, 1.4478e-05], 0, 5.14547, 1681114043], "v": "v0.6"}
{"i": [["[\"reduce_mean\", 28, 28, 240]", "cuda -keys=cuda,gpu -arch=sm_80 -max_num_threads=1024 -model=unknown -thread_warp_size=32", [-1, 16, 64, 49152, 2147483647, 1024, 8, 32], "", 0, []], [[], [["FU", 2, [0, 1]], ["SP", 2, 0, 240, [1], 1], ["AN", 2, 0, 5], ["AN", 2, 1, 6], ["FU", 1, [0, 1]], ["SP", 1, 0, 240, [32], 1], ["AN", 1, 0, 5], ["AN", 1, 1, 6], ["PR", 1, 0, "auto_unroll_max_step$0"]]]], "r": [[1.54051e-05, 1.54184e-05, 1.54492e-05], 0, 7.8633, 1681114046], "v": "v0.6"}
{"i": [["[\"reduce_mean\", 28, 28, 240]", "cuda -keys=cuda,gpu -arch=sm_80 -max_num_threads=1024 -model=unknown -thread_warp_size=32", [-1, 16, 64, 49152, 2147483647, 1024, 8, 32], "", 0, []], [[], [["FU", 1, [2, 3]], ["SP", 2, 1, 240, [1], 1], ["AN", 2, 2, 6], ["FSP", 1, 2, 1, 1], ["AN", 1, 3, 6], ["CA", 1, 2, 1], ["FU", 2, [0, 1]], ["AN", 2, 0, 5], ["PR", 1, 0, "auto_unroll_max_step$512"]]]], "r": [[1.61437e-05, 1.61516e-05, 1.6137e-05], 0, 10.7826, 1681114049], "v": "v0.6"}
{"i": [["[\"reduce_mean\", 28, 28, 240]", "cuda -keys=cuda,gpu -arch=sm_80 -max_num_threads=1024 -model=unknown -thread_warp_size=32", [-1, 16, 64, 49152, 2147483647, 1024, 8, 32], "", 0, []], [[], [["FU", 2, [0, 1]], ["SP", 2, 0, 240, [4], 1], ["AN", 2, 0, 5], ["AN", 2, 1, 6], ["FU", 1, [0, 1]], ["SP", 1, 0, 240, [3], 1], ["AN", 1, 0, 5], ["AN", 1, 1, 6], ["PR", 1, 0, "auto_unroll_max_step$512"]]]], "r": [[1.41774e-05, 1.41961e-05, 1.42013e-05], 0, 11.486, 1681114050], "v": "v0.6"}
{"i": [["[\"reduce_mean\", 28, 28, 240]", "cuda -keys=cuda,gpu -arch=sm_80 -max_num_threads=1024 -model=unknown -thread_warp_size=32", [-1, 16, 64, 49152, 2147483647, 1024, 8, 32], "", 0, []], [[], [["FU", 2, [0, 1]], ["SP", 2, 0, 240, [60], 1], ["AN", 2, 0, 5], ["AN", 2, 1, 6], ["FU", 1, [0, 1]], ["SP", 1, 0, 240, [32], 1], ["AN", 1, 0, 5], ["AN", 1, 1, 6], ["PR", 1, 0, "auto_unroll_max_step$512"]]]], "r": [[1.52023e-05, 1.52088e-05, 1.52066e-05], 0, 10.0917, 1681114048], "v": "v0.6"}
{"i": [["[\"reduce_mean\", 28, 28, 240]", "cuda -keys=cuda,gpu -arch=sm_80 -max_num_threads=1024 -model=unknown -thread_warp_size=32", [-1, 16, 64, 49152, 2147483647, 1024, 8, 32], "", 0, []], [[], [["FU", 2, [0, 1]], ["SP", 2, 0, 240, [1], 1], ["AN", 2, 0, 5], ["AN", 2, 1, 6], ["FU", 1, [0, 1]], ["SP", 1, 0, 240, [60], 1], ["AN", 1, 0, 5], ["AN", 1, 1, 6], ["PR", 1, 0, "auto_unroll_max_step$0"]]]], "r": [[1.87624e-05, 1.87874e-05, 1.87861e-05], 0, 10.3954, 1681114049], "v": "v0.6"}
{"i": [["[\"reduce_mean\", 28, 28, 240]", "cuda -keys=cuda,gpu -arch=sm_80 -max_num_threads=1024 -model=unknown -thread_warp_size=32", [-1, 16, 64, 49152, 2147483647, 1024, 8, 32], "", 0, []], [[], [["FU", 2, [0, 1]], ["SP", 2, 0, 240, [2], 1], ["AN", 2, 0, 5], ["AN", 2, 1, 6], ["FU", 1, [0, 1]], ["SP", 1, 0, 240, [48], 1], ["AN", 1, 0, 5], ["AN", 1, 1, 6], ["PR", 1, 0, "auto_unroll_max_step$64"]]]], "r": [[1.88492e-05, 1.88782e-05, 1.8915e-05], 0, 9.56253, 1681114048], "v": "v0.6"}
{"i": [["[\"reduce_mean\", 28, 28, 240]", "cuda -keys=cuda,gpu -arch=sm_80 -max_num_threads=1024 -model=unknown -thread_warp_size=32", [-1, 16, 64, 49152, 2147483647, 1024, 8, 32], "", 0, []], [[], [["FU", 1, [2, 3]], ["SP", 2, 1, 240, [16], 1], ["AN", 2, 2, 6], ["FSP", 1, 2, 1, 1], ["AN", 1, 3, 6], ["CA", 1, 2, 1], ["FU", 2, [0, 1]], ["AN", 2, 0, 5], ["PR", 1, 0, "auto_unroll_max_step$16"]]]], "r": [[1.8404e-05, 1.84256e-05, 1.84116e-05], 0, 12.5648, 1681114051], "v": "v0.6"}
{"i": [["[\"reduce_mean\", 28, 28, 240]", "cuda -keys=cuda,gpu -arch=sm_80 -max_num_threads=1024 -model=unknown -thread_warp_size=32", [-1, 16, 64, 49152, 2147483647, 1024, 8, 32], "", 0, []], [[], [["FU", 2, [0, 1]], ["SP", 2, 0, 240, [24], 1], ["AN", 2, 0, 5], ["AN", 2, 1, 6], ["FU", 1, [0, 1]], ["SP", 1, 0, 240, [4], 1], ["AN", 1, 0, 5], ["AN", 1, 1, 6], ["PR", 1, 0, "auto_unroll_max_step$0"]]]], "r": [[1.41474e-05, 1.41629e-05, 1.4165e-05], 0, 11.1372, 1681114049], "v": "v0.6"}
{"i": [["[\"reduce_mean\", 28, 28, 240]", "cuda -keys=cuda,gpu -arch=sm_80 -max_num_threads=1024 -model=unknown -thread_warp_size=32", [-1, 16, 64, 49152, 2147483647, 1024, 8, 32], "", 0, []], [[], [["FU", 1, [2, 3]], ["SP", 2, 1, 240, [3], 1], ["AN", 2, 2, 6], ["FSP", 1, 2, 1, 1], ["AN", 1, 3, 6], ["CA", 1, 2, 1], ["FU", 2, [0, 1]], ["AN", 2, 0, 5], ["PR", 1, 0, "auto_unroll_max_step$64"]]]], "r": [[7.84881e-05, 7.84982e-05, 7.84982e-05], 0, 14.2779, 1681114053], "v": "v0.6"}
{"i": [["[\"reduce_mean\", 28, 28, 240]", "cuda -keys=cuda,gpu -arch=sm_80 -max_num_threads=1024 -model=unknown -thread_warp_size=32", [-1, 16, 64, 49152, 2147483647, 1024, 8, 32], "", 0, []], [[], [["FU", 1, [2, 3]], ["SP", 2, 1, 240, [8], 1], ["AN", 2, 2, 6], ["FSP", 1, 2, 1, 1], ["AN", 1, 3, 6], ["CA", 1, 2, 1], ["FU", 2, [0, 1]], ["AN", 2, 0, 5], ["PR", 1, 0, "auto_unroll_max_step$512"]]]], "r": [[1.14863e-05, 1.14973e-05, 1.14846e-05], 0, 13.7764, 1681114052], "v": "v0.6"}
{"i": [["[\"reduce_mean\", 28, 28, 240]", "cuda -keys=cuda,gpu -arch=sm_80 -max_num_threads=1024 -model=unknown -thread_warp_size=32", [-1, 16, 64, 49152, 2147483647, 1024, 8, 32], "", 0, []], [[], [["FU", 2, [0, 1]], ["SP", 2, 0, 240, [1], 1], ["AN", 2, 0, 5], ["AN", 2, 1, 6], ["FU", 1, [0, 1]], ["SP", 1, 0, 240, [30], 1], ["AN", 1, 0, 5], ["AN", 1, 1, 6], ["PR", 1, 0, "auto_unroll_max_step$0"]]]], "r": [[1.41868e-05, 1.42375e-05, 1.42282e-05], 0, 13.0085, 1681114051], "v": "v0.6"}
{"i": [["[\"reduce_mean\", 28, 28, 240]", "cuda -keys=cuda,gpu -arch=sm_80 -max_num_threads=1024 -model=unknown -thread_warp_size=32", [-1, 16, 64, 49152, 2147483647, 1024, 8, 32], "", 0, []], [[], [["FU", 2, [0, 1]], ["SP", 2, 0, 240, [48], 1], ["AN", 2, 0, 5], ["AN", 2, 1, 6], ["FU", 1, [0, 1]], ["SP", 1, 0, 240, [3], 1], ["AN", 1, 0, 5], ["AN", 1, 1, 6], ["PR", 1, 0, "auto_unroll_max_step$0"]]]], "r": [[1.42345e-05, 1.42568e-05, 1.42508e-05], 0, 13.8367, 1681114052], "v": "v0.6"}
{"i": [["[\"reduce_mean\", 28, 28, 240]", "cuda -keys=cuda,gpu -arch=sm_80 -max_num_threads=1024 -model=unknown -thread_warp_size=32", [-1, 16, 64, 49152, 2147483647, 1024, 8, 32], "", 0, []], [[], [["FU", 2, [0, 1]], ["SP", 2, 0, 240, [15], 1], ["AN", 2, 0, 5], ["AN", 2, 1, 6], ["FU", 1, [0, 1]], ["SP", 1, 0, 240, [3], 1], ["AN", 1, 0, 5], ["AN", 1, 1, 6], ["PR", 1, 0, "auto_unroll_max_step$512"]]]], "r": [[1.46261e-05, 1.46558e-05, 1.46579e-05], 0, 14.8062, 1681114053], "v": "v0.6"}
{"i": [["[\"reduce_mean\", 28, 28, 240]", "cuda -keys=cuda,gpu -arch=sm_80 -max_num_threads=1024 -model=unknown -thread_warp_size=32", [-1, 16, 64, 49152, 2147483647, 1024, 8, 32], "", 0, []], [[], [["FU", 2, [0, 1]], ["SP", 2, 0, 240, [3], 1], ["AN", 2, 0, 5], ["AN", 2, 1, 6], ["FU", 1, [0, 1]], ["SP", 1, 0, 240, [30], 1], ["AN", 1, 0, 5], ["AN", 1, 1, 6], ["PR", 1, 0, "auto_unroll_max_step$512"]]]], "r": [[1.38469e-05, 1.38677e-05, 1.38667e-05], 0, 13.2638, 1681114052], "v": "v0.6"}
{"i": [["[\"reduce_mean\", 28, 28, 240]", "cuda -keys=cuda,gpu -arch=sm_80 -max_num_threads=1024 -model=unknown -thread_warp_size=32", [-1, 16, 64, 49152, 2147483647, 1024, 8, 32], "", 0, []], [[], [["FU", 2, [0, 1]], ["SP", 2, 0, 240, [16], 1], ["AN", 2, 0, 5], ["AN", 2, 1, 6], ["FU", 1, [0, 1]], ["SP", 1, 0, 240, [32], 1], ["AN", 1, 0, 5], ["AN", 1, 1, 6], ["PR", 1, 0, "auto_unroll_max_step$512"]]]], "r": [[1.50307e-05, 1.51524e-05, 1.51482e-05], 0, 8.98529, 1681114047], "v": "v0.6"}
{"i": [["[\"reduce_mean\", 28, 28, 240]", "cuda -keys=cuda,gpu -arch=sm_80 -max_num_threads=1024 -model=unknown -thread_warp_size=32", [-1, 16, 64, 49152, 2147483647, 1024, 8, 32], "", 0, []], [[], [["FU", 2, [0, 1]], ["SP", 2, 0, 240, [32], 1], ["AN", 2, 0, 5], ["AN", 2, 1, 6], ["FU", 1, [0, 1]], ["SP", 1, 0, 240, [12], 1], ["AN", 1, 0, 5], ["AN", 1, 1, 6], ["PR", 1, 0, "auto_unroll_max_step$1024"]]]], "r": [[1.40397e-05, 1.406e-05, 1.4063e-05], 0, 15.3363, 1681114054], "v": "v0.6"}
{"i": [["[\"reduce_mean\", 28, 28, 240]", "cuda -keys=cuda,gpu -arch=sm_80 -max_num_threads=1024 -model=unknown -thread_warp_size=32", [-1, 16, 64, 49152, 2147483647, 1024, 8, 32], "", 0, []], [[], [["FU", 2, [0, 1]], ["SP", 2, 0, 240, [3], 1], ["AN", 2, 0, 5], ["AN", 2, 1, 6], ["FU", 1, [0, 1]], ["SP", 1, 0, 240, [4], 1], ["AN", 1, 0, 5], ["AN", 1, 1, 6], ["PR", 1, 0, "auto_unroll_max_step$512"]]]], "r": [[1.43909e-05, 1.44614e-05, 1.44593e-05], 0, 15.0774, 1681114053], "v": "v0.6"}
{"i": [["[\"reduce_mean\", 28, 28, 240]", "cuda -keys=cuda,gpu -arch=sm_80 -max_num_threads=1024 -model=unknown -thread_warp_size=32", [-1, 16, 64, 49152, 2147483647, 1024, 8, 32], "", 0, []], [[], [["FU", 2, [0, 1]], ["SP", 2, 0, 240, [1], 1], ["AN", 2, 0, 5], ["AN", 2, 1, 6], ["FU", 1, [0, 1]], ["SP", 1, 0, 240, [24], 1], ["AN", 1, 0, 5], ["AN", 1, 1, 6], ["PR", 1, 0, "auto_unroll_max_step$0"]]]], "r": [[1.44894e-05, 1.45029e-05, 1.45029e-05], 0, 12.0761, 1681114051], "v": "v0.6"}
{"i": [["[\"reduce_mean\", 28, 28, 240]", "cuda -keys=cuda,gpu -arch=sm_80 -max_num_threads=1024 -model=unknown -thread_warp_size=32", [-1, 16, 64, 49152, 2147483647, 1024, 8, 32], "", 0, []], [[], [["FU", 1, [2, 3]], ["SP", 2, 1, 240, [10], 1], ["AN", 2, 2, 6], ["FSP", 1, 2, 1, 1], ["AN", 1, 3, 6], ["CA", 1, 2, 1], ["FU", 2, [0, 1]], ["AN", 2, 0, 5], ["PR", 1, 0, "auto_unroll_max_step$512"]]]], "r": [[1.20175e-05, 1.20331e-05, 1.20149e-05], 0, 11.9057, 1681114050], "v": "v0.6"}
{"i": [["[\"reduce_mean\", 28, 28, 240]", "cuda -keys=cuda,gpu -arch=sm_80 -max_num_threads=1024 -model=unknown -thread_warp_size=32", [-1, 16, 64, 49152, 2147483647, 1024, 8, 32], "", 0, []], [[], [["FU", 2, [0, 1]], ["SP", 2, 0, 240, [60], 1], ["AN", 2, 0, 5], ["AN", 2, 1, 6], ["FU", 1, [0, 1]], ["SP", 1, 0, 240, [60], 1], ["AN", 1, 0, 5], ["AN", 1, 1, 6], ["PR", 1, 0, "auto_unroll_max_step$0"]]]], "r": [[1.89598e-05, 1.89848e-05, 1.89861e-05], 0, 15.2212, 1681114054], "v": "v0.6"}
{"i": [["[\"reduce_mean\", 28, 28, 240]", "cuda -keys=cuda,gpu -arch=sm_80 -max_num_threads=1024 -model=unknown -thread_warp_size=32", [-1, 16, 64, 49152, 2147483647, 1024, 8, 32], "", 0, []], [[], [["FU", 2, [0, 1]], ["SP", 2, 0, 240, [40], 1], ["AN", 2, 0, 5], ["AN", 2, 1, 6], ["FU", 1, [0, 1]], ["SP", 1, 0, 240, [5], 1], ["AN", 1, 0, 5], ["AN", 1, 1, 6], ["PR", 1, 0, "auto_unroll_max_step$512"]]]], "r": [[1.41826e-05, 1.42044e-05, 1.42013e-05], 0, 15.2112, 1681114055], "v": "v0.6"}
{"i": [["[\"reduce_mean\", 28, 28, 240]", "cuda -keys=cuda,gpu -arch=sm_80 -max_num_threads=1024 -model=unknown -thread_warp_size=32", [-1, 16, 64, 49152, 2147483647, 1024, 8, 32], "", 0, []], [[], [["FU", 2, [0, 1]], ["SP", 2, 0, 240, [60], 1], ["AN", 2, 0, 5], ["AN", 2, 1, 6], ["FU", 1, [0, 1]], ["SP", 1, 0, 240, [24], 1], ["AN", 1, 0, 5], ["AN", 1, 1, 6], ["PR", 1, 0, "auto_unroll_max_step$512"]]]], "r": [[1.42142e-05, 1.42274e-05, 1.42274e-05], 0, 15.3524, 1681114055], "v": "v0.6"}
{"i": [["[\"reduce_mean\", 28, 28, 240]", "cuda -keys=cuda,gpu -arch=sm_80 -max_num_threads=1024 -model=unknown -thread_warp_size=32", [-1, 16, 64, 49152, 2147483647, 1024, 8, 32], "", 0, []], [[], [["FU", 2, [0, 1]], ["SP", 2, 0, 240, [40], 1], ["AN", 2, 0, 5], ["AN", 2, 1, 6], ["FU", 1, [0, 1]], ["SP", 1, 0, 240, [60], 1], ["AN", 1, 0, 5], ["AN", 1, 1, 6], ["PR", 1, 0, "auto_unroll_max_step$512"]]]], "r": [[1.8876e-05, 1.88734e-05, 1.88618e-05], 0, 15.2354, 1681114055], "v": "v0.6"}
{"i": [["[\"reduce_mean\", 28, 28, 240]", "cuda -keys=cuda,gpu -arch=sm_80 -max_num_threads=1024 -model=unknown -thread_warp_size=32", [-1, 16, 64, 49152, 2147483647, 1024, 8, 32], "", 0, []], [[], [["FU", 1, [2, 3]], ["SP", 2, 1, 240, [1], 1], ["AN", 2, 2, 6], ["FSP", 1, 2, 1, 1], ["AN", 1, 3, 6], ["CA", 1, 2, 1], ["FU", 2, [0, 1]], ["AN", 2, 0, 5], ["PR", 1, 0, "auto_unroll_max_step$1024"]]]], "r": [[1.16657e-05, 1.16682e-05, 1.16598e-05], 0, 16.9633, 1681114056], "v": "v0.6"}
{"i": [["[\"reduce_mean\", 28, 28, 240]", "cuda -keys=cuda,gpu -arch=sm_80 -max_num_threads=1024 -model=unknown -thread_warp_size=32", [-1, 16, 64, 49152, 2147483647, 1024, 8, 32], "", 0, []], [[], [["FU", 2, [0, 1]], ["SP", 2, 0, 240, [1], 1], ["AN", 2, 0, 5], ["AN", 2, 1, 6], ["FU", 1, [0, 1]], ["SP", 1, 0, 240, [20], 1], ["AN", 1, 0, 5], ["AN", 1, 1, 6], ["PR", 1, 0, "auto_unroll_max_step$512"]]]], "r": [[1.43391e-05, 1.44656e-05, 1.44656e-05], 0, 15.2859, 1681114056], "v": "v0.6"}
{"i": [["[\"reduce_mean\", 28, 28, 240]", "cuda -keys=cuda,gpu -arch=sm_80 -max_num_threads=1024 -model=unknown -thread_warp_size=32", [-1, 16, 64, 49152, 2147483647, 1024, 8, 32], "", 0, []], [[], [["FU", 1, [2, 3]], ["SP", 2, 1, 240, [10], 1], ["AN", 2, 2, 6], ["FSP", 1, 2, 1, 1], ["AN", 1, 3, 6], ["CA", 1, 2, 1], ["FU", 2, [0, 1]], ["AN", 2, 0, 5], ["PR", 1, 0, "auto_unroll_max_step$0"]]]], "r": [[8.04854e-05, 8.04542e-05, 8.04854e-05], 0, 15.2676, 1681114056], "v": "v0.6"}
{"i": [["[\"reduce_mean\", 28, 28, 240]", "cuda -keys=cuda,gpu -arch=sm_80 -max_num_threads=1024 -model=unknown -thread_warp_size=32", [-1, 16, 64, 49152, 2147483647, 1024, 8, 32], "", 0, []], [[], [["FU", 2, [0, 1]], ["SP", 2, 0, 240, [15], 1], ["AN", 2, 0, 5], ["AN", 2, 1, 6], ["FU", 1, [0, 1]], ["SP", 1, 0, 240, [1], 1], ["AN", 1, 0, 5], ["AN", 1, 1, 6], ["PR", 1, 0, "auto_unroll_max_step$16"]]]], "r": [[1.98694e-05, 1.9883e-05, 1.98912e-05], 0, 15.1916, 1681114057], "v": "v0.6"}
{"i": [["[\"reduce_mean\", 28, 28, 240]", "cuda -keys=cuda,gpu -arch=sm_80 -max_num_threads=1024 -model=unknown -thread_warp_size=32", [-1, 16, 64, 49152, 2147483647, 1024, 8, 32], "", 0, []], [[], [["FU", 2, [0, 1]], ["SP", 2, 0, 240, [4], 1], ["AN", 2, 0, 5], ["AN", 2, 1, 6], ["FU", 1, [0, 1]], ["SP", 1, 0, 240, [1], 1], ["AN", 1, 0, 5], ["AN", 1, 1, 6], ["PR", 1, 0, "auto_unroll_max_step$0"]]]], "r": [[1.99203e-05, 1.9948e-05, 1.99438e-05], 0, 15.2703, 1681114057], "v": "v0.6"}
{"i": [["[\"reduce_mean\", 28, 28, 240]", "cuda -keys=cuda,gpu -arch=sm_80 -max_num_threads=1024 -model=unknown -thread_warp_size=32", [-1, 16, 64, 49152, 2147483647, 1024, 8, 32], "", 0, []], [[], [["FU", 2, [0, 1]], ["SP", 2, 0, 240, [8], 1], ["AN", 2, 0, 5], ["AN", 2, 1, 6], ["FU", 1, [0, 1]], ["SP", 1, 0, 240, [1], 1], ["AN", 1, 0, 5], ["AN", 1, 1, 6], ["PR", 1, 0, "auto_unroll_max_step$16"]]]], "r": [[1.98609e-05, 1.98775e-05, 1.9872e-05], 0, 15.24, 1681114057], "v": "v0.6"}
{"i": [["[\"reduce_mean\", 28, 28, 240]", "cuda -keys=cuda,gpu -arch=sm_80 -max_num_threads=1024 -model=unknown -thread_warp_size=32", [-1, 16, 64, 49152, 2147483647, 1024, 8, 32], "", 0, []], [[], [["FU", 1, [2, 3]], ["SP", 2, 1, 240, [32], 1], ["AN", 2, 2, 6], ["FSP", 1, 2, 1, 1], ["AN", 1, 3, 6], ["CA", 1, 2, 1], ["FU", 2, [0, 1]], ["AN", 2, 0, 5], ["PR", 1, 0, "auto_unroll_max_step$0"]]]], "r": [[5.87722e-05, 5.88146e-05, 5.87876e-05], 0, 15.2915, 1681114058], "v": "v0.6"}
{"i": [["[\"reduce_mean\", 28, 28, 240]", "cuda -keys=cuda,gpu -arch=sm_80 -max_num_threads=1024 -model=unknown -thread_warp_size=32", [-1, 16, 64, 49152, 2147483647, 1024, 8, 32], "", 0, []], [[], [["FU", 1, [2, 3]], ["SP", 2, 1, 240, [3], 1], ["AN", 2, 2, 6], ["FSP", 1, 2, 1, 1], ["AN", 1, 3, 6], ["CA", 1, 2, 1], ["FU", 2, [0, 1]], ["AN", 2, 0, 5], ["PR", 1, 0, "auto_unroll_max_step$0"]]]], "r": [[7.82549e-05, 7.8265e-05, 7.826e-05], 0, 15.2225, 1681114058], "v": "v0.6"}
{"i": [["[\"reduce_mean\", 28, 28, 240]", "cuda -keys=cuda,gpu -arch=sm_80 -max_num_threads=1024 -model=unknown -thread_warp_size=32", [-1, 16, 64, 49152, 2147483647, 1024, 8, 32], "", 0, []], [[], [["FU", 2, [0, 1]], ["SP", 2, 0, 240, [1], 1], ["AN", 2, 0, 5], ["AN", 2, 1, 6], ["FU", 1, [0, 1]], ["SP", 1, 0, 240, [2], 1], ["AN", 1, 0, 5], ["AN", 1, 1, 6], ["PR", 1, 0, "auto_unroll_max_step$512"]]]], "r": [[1.44759e-05, 1.44935e-05, 1.44977e-05], 0, 15.163, 1681114059], "v": "v0.6"}
{"i": [["[\"reduce_mean\", 28, 28, 240]", "cuda -keys=cuda,gpu -arch=sm_80 -max_num_threads=1024 -model=unknown -thread_warp_size=32", [-1, 16, 64, 49152, 2147483647, 1024, 8, 32], "", 0, []], [[], [["FU", 1, [2, 3]], ["SP", 2, 1, 240, [48], 1], ["AN", 2, 2, 6], ["FSP", 1, 2, 1, 1], ["AN", 1, 3, 6], ["CA", 1, 2, 1], ["FU", 2, [0, 1]], ["AN", 2, 0, 5], ["PR", 1, 0, "auto_unroll_max_step$16"]]]], "r": [[5.22719e-05, 5.22891e-05, 5.22891e-05], 0, 15.199, 1681114059], "v": "v0.6"}
{"i": [["[\"reduce_mean\", 28, 28, 240]", "cuda -keys=cuda,gpu -arch=sm_80 -max_num_threads=1024 -model=unknown -thread_warp_size=32", [-1, 16, 64, 49152, 2147483647, 1024, 8, 32], "", 0, []], [[], [["FU", 1, [2, 3]], ["SP", 2, 1, 240, [15], 1], ["AN", 2, 2, 6], ["FSP", 1, 2, 1, 1], ["AN", 1, 3, 6], ["CA", 1, 2, 1], ["FU", 2, [0, 1]], ["AN", 2, 0, 5], ["PR", 1, 0, "auto_unroll_max_step$0"]]]], "r": [[8.45923e-05, 8.45923e-05, 8.45923e-05], 0, 15.187, 1681114059], "v": "v0.6"}
{"i": [["[\"reduce_mean\", 28, 28, 240]", "cuda -keys=cuda,gpu -arch=sm_80 -max_num_threads=1024 -model=unknown -thread_warp_size=32", [-1, 16, 64, 49152, 2147483647, 1024, 8, 32], "", 0, []], [[], [["FU", 2, [0, 1]], ["SP", 2, 0, 240, [12], 1], ["AN", 2, 0, 5], ["AN", 2, 1, 6], ["FU", 1, [0, 1]], ["SP", 1, 0, 240, [8], 1], ["AN", 1, 0, 5], ["AN", 1, 1, 6], ["PR", 1, 0, "auto_unroll_max_step$0"]]]], "r": [[1.43495e-05, 1.43464e-05, 1.43515e-05], 0, 15.1527, 1681114060], "v": "v0.6"}
{"i": [["[\"reduce_mean\", 28, 28, 240]", "cuda -keys=cuda,gpu -arch=sm_80 -max_num_threads=1024 -model=unknown -thread_warp_size=32", [-1, 16, 64, 49152, 2147483647, 1024, 8, 32], "", 0, []], [[], [["FU", 2, [0, 1]], ["SP", 2, 0, 240, [1], 1], ["AN", 2, 0, 5], ["AN", 2, 1, 6], ["FU", 1, [0, 1]], ["SP", 1, 0, 240, [16], 1], ["AN", 1, 0, 5], ["AN", 1, 1, 6], ["PR", 1, 0, "auto_unroll_max_step$1024"]]]], "r": [[1.41919e-05, 1.42173e-05, 1.42173e-05], 0, 15.1563, 1681114060], "v": "v0.6"}
{"i": [["[\"reduce_mean\", 28, 28, 240]", "cuda -keys=cuda,gpu -arch=sm_80 -max_num_threads=1024 -model=unknown -thread_warp_size=32", [-1, 16, 64, 49152, 2147483647, 1024, 8, 32], "", 0, []], [[], [["FU", 1, [2, 3]], ["SP", 2, 1, 240, [48], 1], ["AN", 2, 2, 6], ["FSP", 1, 2, 1, 1], ["AN", 1, 3, 6], ["CA", 1, 2, 1], ["FU", 2, [0, 1]], ["AN", 2, 0, 5], ["PR", 1, 0, "auto_unroll_max_step$0"]]]], "r": [[5.22822e-05, 5.22891e-05, 5.22925e-05], 0, 15.1094, 1681114060], "v": "v0.6"}
{"i": [["[\"reduce_mean\", 28, 28, 240]", "cuda -keys=cuda,gpu -arch=sm_80 -max_num_threads=1024 -model=unknown -thread_warp_size=32", [-1, 16, 64, 49152, 2147483647, 1024, 8, 32], "", 0, []], [[], [["FU", 2, [0, 1]], ["SP", 2, 0, 240, [48], 1], ["AN", 2, 0, 5], ["AN", 2, 1, 6], ["FU", 1, [0, 1]], ["SP", 1, 0, 240, [2], 1], ["AN", 1, 0, 5], ["AN", 1, 1, 6], ["PR", 1, 0, "auto_unroll_max_step$64"]]]], "r": [[1.44673e-05, 1.44715e-05, 1.44694e-05], 0, 15.1595, 1681114061], "v": "v0.6"}
{"i": [["[\"reduce_mean\", 28, 28, 240]", "cuda -keys=cuda,gpu -arch=sm_80 -max_num_threads=1024 -model=unknown -thread_warp_size=32", [-1, 16, 64, 49152, 2147483647, 1024, 8, 32], "", 0, []], [[], [["FU", 2, [0, 1]], ["SP", 2, 0, 240, [60], 1], ["AN", 2, 0, 5], ["AN", 2, 1, 6], ["FU", 1, [0, 1]], ["SP", 1, 0, 240, [4], 1], ["AN", 1, 0, 5], ["AN", 1, 1, 6], ["PR", 1, 0, "auto_unroll_max_step$512"]]]], "r": [[1.42802e-05, 1.43106e-05, 1.43025e-05], 0, 15.1288, 1681114061], "v": "v0.6"}
{"i": [["[\"reduce_mean\", 28, 28, 240]", "cuda -keys=cuda,gpu -arch=sm_80 -max_num_threads=1024 -model=unknown -thread_warp_size=32", [-1, 16, 64, 49152, 2147483647, 1024, 8, 32], "", 0, []], [[], [["FU", 2, [0, 1]], ["SP", 2, 0, 240, [1], 1], ["AN", 2, 0, 5], ["AN", 2, 1, 6], ["FU", 1, [0, 1]], ["SP", 1, 0, 240, [16], 1], ["AN", 1, 0, 5], ["AN", 1, 1, 6], ["PR", 1, 0, "auto_unroll_max_step$512"]]]], "r": [[1.42147e-05, 1.42365e-05, 1.42344e-05], 0, 15.1616, 1681114062], "v": "v0.6"}
{"i": [["[\"reduce_mean\", 28, 28, 240]", "cuda -keys=cuda,gpu -arch=sm_80 -max_num_threads=1024 -model=unknown -thread_warp_size=32", [-1, 16, 64, 49152, 2147483647, 1024, 8, 32], "", 0, []], [[], [["FU", 1, [2, 3]], ["SP", 2, 1, 240, [2], 1], ["AN", 2, 2, 6], ["FSP", 1, 2, 1, 1], ["AN", 1, 3, 6], ["CA", 1, 2, 1], ["FU", 2, [0, 1]], ["AN", 2, 0, 5], ["PR", 1, 0, "auto_unroll_max_step$64"]]]], "r": [[1.00828e-05, 1.00609e-05, 1.00367e-05], 0, 3.16287, 1681114095], "v": "v0.6"}
{"i": [["[\"reduce_mean\", 28, 28, 240]", "cuda -keys=cuda,gpu -arch=sm_80 -max_num_threads=1024 -model=unknown -thread_warp_size=32", [-1, 16, 64, 49152, 2147483647, 1024, 8, 32], "", 0, []], [[], [["FU", 1, [2, 3]], ["SP", 2, 1, 240, [2], 1], ["AN", 2, 2, 6], ["FSP", 1, 2, 1, 1], ["AN", 1, 3, 6], ["CA", 1, 2, 1], ["FU", 2, [0, 1]], ["AN", 2, 0, 5], ["PR", 1, 0, "auto_unroll_max_step$16"]]]], "r": [[1.01436e-05, 1.01591e-05, 1.01389e-05], 0, 3.84913, 1681114096], "v": "v0.6"}
{"i": [["[\"reduce_mean\", 28, 28, 240]", "cuda -keys=cuda,gpu -arch=sm_80 -max_num_threads=1024 -model=unknown -thread_warp_size=32", [-1, 16, 64, 49152, 2147483647, 1024, 8, 32], "", 0, []], [[], [["FU", 1, [2, 3]], ["SP", 2, 1, 240, [4], 1], ["AN", 2, 2, 6], ["FSP", 1, 2, 1, 1], ["AN", 1, 3, 6], ["CA", 1, 2, 1], ["FU", 2, [0, 1]], ["AN", 2, 0, 5], ["PR", 1, 0, "auto_unroll_max_step$64"]]]], "r": [[1.08755e-05, 1.08907e-05, 1.08739e-05], 0, 2.8706, 1681114095], "v": "v0.6"}
{"i": [["[\"reduce_mean\", 28, 28, 240]", "cuda -keys=cuda,gpu -arch=sm_80 -max_num_threads=1024 -model=unknown -thread_warp_size=32", [-1, 16, 64, 49152, 2147483647, 1024, 8, 32], "", 0, []], [[], [["FU", 1, [2, 3]], ["SP", 2, 1, 240, [4], 1], ["AN", 2, 2, 6], ["FSP", 1, 2, 1, 1], ["AN", 1, 3, 6], ["CA", 1, 2, 1], ["FU", 2, [0, 1]], ["AN", 2, 0, 5], ["PR", 1, 0, "auto_unroll_max_step$0"]]]], "r": [[1.0997e-05, 1.10018e-05, 1.09914e-05], 0, 4.15919, 1681114097], "v": "v0.6"}
{"i": [["[\"reduce_mean\", 28, 28, 240]", "cuda -keys=cuda,gpu -arch=sm_80 -max_num_threads=1024 -model=unknown -thread_warp_size=32", [-1, 16, 64, 49152, 2147483647, 1024, 8, 32], "", 0, []], [[], [["FU", 1, [2, 3]], ["SP", 2, 1, 240, [3], 1], ["AN", 2, 2, 6], ["FSP", 1, 2, 1, 1], ["AN", 1, 3, 6], ["CA", 1, 2, 1], ["FU", 2, [0, 1]], ["AN", 2, 0, 5], ["PR", 1, 0, "auto_unroll_max_step$512"]]]], "r": [[9.45547e-06, 9.46869e-06, 9.53554e-06], 0, 2.81109, 1681114093], "v": "v0.6"}
{"i": [["[\"reduce_mean\", 28, 28, 240]", "cuda -keys=cuda,gpu -arch=sm_80 -max_num_threads=1024 -model=unknown -thread_warp_size=32", [-1, 16, 64, 49152, 2147483647, 1024, 8, 32], "", 0, []], [[], [["FU", 1, [2, 3]], ["SP", 2, 1, 240, [5], 1], ["AN", 2, 2, 6], ["FSP", 1, 2, 1, 1], ["AN", 1, 3, 6], ["CA", 1, 2, 1], ["FU", 2, [0, 1]], ["AN", 2, 0, 5], ["PR", 1, 0, "auto_unroll_max_step$512"]]]], "r": [[1.08243e-05, 1.08379e-05, 1.08235e-05], 0, 6.43388, 1681114098], "v": "v0.6"}
{"i": [["[\"reduce_mean\", 28, 28, 240]", "cuda -keys=cuda,gpu -arch=sm_80 -max_num_threads=1024 -model=unknown -thread_warp_size=32", [-1, 16, 64, 49152, 2147483647, 1024, 8, 32], "", 0, []], [[], [["FU", 1, [2, 3]], ["SP", 2, 1, 240, [12], 1], ["AN", 2, 2, 6], ["FSP", 1, 2, 1, 1], ["AN", 1, 3, 6], ["CA", 1, 2, 1], ["FU", 2, [0, 1]], ["AN", 2, 0, 5], ["PR", 1, 0, "auto_unroll_max_step$512"]]]], "r": [[1.33966e-05, 1.34118e-05, 1.33928e-05], 0, 3.80733, 1681114095], "v": "v0.6"}
{"i": [["[\"reduce_mean\", 28, 28, 240]", "cuda -keys=cuda,gpu -arch=sm_80 -max_num_threads=1024 -model=unknown -thread_warp_size=32", [-1, 16, 64, 49152, 2147483647, 1024, 8, 32], "", 0, []], [[], [["FU", 2, [0, 1]], ["SP", 2, 0, 240, [24], 1], ["AN", 2, 0, 5], ["AN", 2, 1, 6], ["FU", 1, [0, 1]], ["SP", 1, 0, 240, [20], 1], ["AN", 1, 0, 5], ["AN", 1, 1, 6], ["PR", 1, 0, "auto_unroll_max_step$0"]]]], "r": [[1.40904e-05, 1.4128e-05, 1.41188e-05], 0, 4.64943, 1681114097], "v": "v0.6"}
{"i": [["[\"reduce_mean\", 28, 28, 240]", "cuda -keys=cuda,gpu -arch=sm_80 -max_num_threads=1024 -model=unknown -thread_warp_size=32", [-1, 16, 64, 49152, 2147483647, 1024, 8, 32], "", 0, []], [[], [["FU", 2, [0, 1]], ["SP", 2, 0, 240, [24], 1], ["AN", 2, 0, 5], ["AN", 2, 1, 6], ["FU", 1, [0, 1]], ["SP", 1, 0, 240, [20], 1], ["AN", 1, 0, 5], ["AN", 1, 1, 6], ["PR", 1, 0, "auto_unroll_max_step$512"]]]], "r": [[1.42051e-05, 1.42203e-05, 1.42223e-05], 0, 7.24764, 1681114099], "v": "v0.6"}
{"i": [["[\"reduce_mean\", 28, 28, 240]", "cuda -keys=cuda,gpu -arch=sm_80 -max_num_threads=1024 -model=unknown -thread_warp_size=32", [-1, 16, 64, 49152, 2147483647, 1024, 8, 32], "", 0, []], [[], [["FU", 2, [0, 1]], ["SP", 2, 0, 240, [24], 1], ["AN", 2, 0, 5], ["AN", 2, 1, 6], ["FU", 1, [0, 1]], ["SP", 1, 0, 240, [16], 1], ["AN", 1, 0, 5], ["AN", 1, 1, 6], ["PR", 1, 0, "auto_unroll_max_step$1024"]]]], "r": [[1.40945e-05, 1.41259e-05, 1.41371e-05], 0, 7.97954, 1681114100], "v": "v0.6"}
