python/models/efficientnet/kernel_configs/efficient_head_conv1x1_bn_swish_1_14_14_80_480_1_1_1.log
{"i": [["[\"head_conv1x1_bn_swish\", 1, 14, 14, 80, 480, 1, 1, 1]", "cuda -keys=cuda,gpu -max_num_threads=1024 -model=unknown -thread_warp_size=32", [-1, 16, 64, 49152, 2147483647, 1024, 8, 32], "", 0, []], [[], [["CI", 6], ["CI", 4], ["SP", 2, 0, 1, [1, 1, 1, 1], 1], ["SP", 2, 5, 14, [1, 1, 1, 14], 1], ["SP", 2, 10, 14, [1, 7, 1, 1], 1], ["SP", 2, 15, 480, [2, 6, 2, 4], 1], ["SP", 2, 20, 80, [2, 20], 1], ["RE", 2, [0, 5, 10, 15, 1, 6, 11, 16, 2, 7, 12, 17, 20, 21, 3, 8, 13, 18, 22, 4, 9, 14, 19]], ["FSP", 7, 0, 2, 3], ["FSP", 7, 4, 3, 3], ["FSP", 7, 8, 4, 3], ["FSP", 7, 12, 5, 3], ["RE", 7, [0, 4, 8, 12, 1, 5, 9, 13, 2, 6, 10, 14, 3, 7, 11, 15]], ["CA", 2, 7, 11], ["CHR", 1, "shared", [2]], ["CA", 2, 3, 12], ["CHR", 0, "shared", [3]], ["CA", 1, 4, 12], ["FU", 9, [0, 1, 2, 3]], ["AN", 9, 0, 5], ["FU", 9, [1, 2, 3, 4]], ["AN", 9, 1, 4], ["FU", 9, [2, 3, 4, 5]], ["AN", 9, 2, 6], ["FU", 3, [0, 1, 2, 3]], ["SP", 3, 0, 320, [1], 1], ["AN", 3, 1, 2], ["FFSP", 3, 0, [5, 4, 3, 2], 1, 1], ["AN", 3, 1, 6], ["FU", 1, [0, 1, 2, 3]], ["SP", 1, 0, 560, [1], 1], ["AN", 1, 1, 2], ["FFSP", 1, 0, [5, 4, 3, 2], 1, 1], ["AN", 1, 1, 6], ["PR", 4, 0, "auto_unroll_max_step$512"]]]], "r": [[0.000121466, 0.000121394, 0.000120996], 0, 5.88667, 1661934876], "v": "v0.6"}
{"i": [["[\"head_conv1x1_bn_swish\", 1, 14, 14, 80, 480, 1, 1, 1]", "cuda -keys=cuda,gpu -max_num_threads=1024 -model=unknown -thread_warp_size=32", [-1, 16, 64, 49152, 2147483647, 1024, 8, 32], "", 0, []], [[], [["CI", 6], ["CI", 4], ["SP", 2, 0, 1, [1, 1, 1, 1], 1], ["SP", 2, 5, 14, [1, 1, 1, 7], 1], ["SP", 2, 10, 14, [1, 1, 1, 1], 1], ["SP", 2, 15, 480, [1, 15, 1, 32], 1], ["SP", 2, 20, 80, [5, 1], 1], ["RE", 2, [0, 5, 10, 15, 1, 6, 11, 16, 2, 7, 12, 17, 20, 21, 3, 8, 13, 18, 22, 4, 9, 14, 19]], ["FSP", 7, 0, 2, 3], ["FSP", 7, 4, 3, 3], ["FSP", 7, 8, 4, 3], ["FSP", 7, 12, 5, 3], ["RE", 7, [0, 4, 8, 12, 1, 5, 9, 13, 2, 6, 10, 14, 3, 7, 11, 15]], ["CA", 2, 7, 11], ["CHR", 1, "shared", [2]], ["CA", 2, 3, 12], ["CHR", 0, "shared", [3]], ["CA", 1, 4, 12], ["FU", 9, [0, 1, 2, 3]], ["AN", 9, 0, 5], ["FU", 9, [1, 2, 3, 4]], ["AN", 9, 1, 4], ["FU", 9, [2, 3, 4, 5]], ["AN", 9, 2, 6], ["FU", 3, [0, 1, 2, 3]], ["SP", 3, 0, 160, [1], 1], ["AN", 3, 1, 2], ["FFSP", 3, 0, [5, 4, 3, 2], 1, 1], ["AN", 3, 1, 6], ["FU", 1, [0, 1, 2, 3]], ["SP", 1, 0, 70, [10], 1], ["AN", 1, 1, 2], ["FFSP", 1, 0, [5, 4, 3, 2], 1, 1], ["AN", 1, 1, 6], ["PR", 4, 0, "auto_unroll_max_step$0"]]]], "r": [[0.000105057, 0.000105039, 0.000105036], 0, 3.26842, 1661934874], "v": "v0.6"}
{"i": [["[\"head_conv1x1_bn_swish\", 1, 14, 14, 80, 480, 1, 1, 1]", "cuda -keys=cuda,gpu -max_num_threads=1024 -model=unknown -thread_warp_size=32", [-1, 16, 64, 49152, 2147483647, 1024, 8, 32], "", 0, []], [[], [["CI", 6], ["CI", 4], ["SP", 2, 0, 1, [1, 1, 1, 1], 1], ["SP", 2, 5, 14, [1, 2, 1, 1], 1], ["SP", 2, 10, 14, [1, 7, 2, 1], 1], ["SP", 2, 15, 480, [2, 5, 2, 6], 1], ["SP", 2, 20, 80, [2, 5], 1], ["RE", 2, [0, 5, 10, 15, 1, 6, 11, 16, 2, 7, 12, 17, 20, 21, 3, 8, 13, 18, 22, 4, 9, 14, 19]], ["FSP", 7, 0, 2, 3], ["FSP", 7, 4, 3, 3], ["FSP", 7, 8, 4, 3], ["FSP", 7, 12, 5, 3], ["RE", 7, [0, 4, 8, 12, 1, 5, 9, 13, 2, 6, 10, 14, 3, 7, 11, 15]], ["CA", 2, 7, 11], ["CHR", 1, "shared", [2]], ["CA", 2, 3, 12], ["CHR", 0, "shared", [3]], ["CA", 1, 4, 12], ["FU", 9, [0, 1, 2, 3]], ["AN", 9, 0, 5], ["FU", 9, [1, 2, 3, 4]], ["AN", 9, 1, 4], ["FU", 9, [2, 3, 4, 5]], ["AN", 9, 2, 6], ["FU", 3, [0, 1, 2, 3]], ["SP", 3, 0, 120, [5], 1], ["AN", 3, 1, 2], ["FFSP", 3, 0, [5, 4, 3, 2], 1, 1], ["AN", 3, 1, 6], ["FU", 1, [0, 1, 2, 3]], ["SP", 1, 0, 20, [2], 1], ["AN", 1, 1, 2], ["FFSP", 1, 0, [5, 4, 3, 2], 1, 1], ["AN", 1, 1, 6], ["PR", 4, 0, "auto_unroll_max_step$16"]]]], "r": [[2.70883e-05, 2.70399e-05, 2.70339e-05], 0, 5.98927, 1661934877], "v": "v0.6"}
{"i": [["[\"head_conv1x1_bn_swish\", 1, 14, 14, 80, 480, 1, 1, 1]", "cuda -keys=cuda,gpu -max_num_threads=1024 -model=unknown -thread_warp_size=32", [-1, 16, 64, 49152, 2147483647, 1024, 8, 32], "", 0, []], [[], [["CI", 6], ["CI", 4], ["SP", 2, 0, 1, [1, 1, 1, 1], 1], ["SP", 2, 5, 14, [1, 7, 1, 1], 1], ["SP", 2, 10, 14, [1, 7, 1, 1], 1], ["SP", 2, 15, 480, [1, 8, 12, 1], 1], ["SP", 2, 20, 80, [5, 1], 1], ["RE", 2, [0, 5, 10, 15, 1, 6, 11, 16, 2, 7, 12, 17, 20, 21, 3, 8, 13, 18, 22, 4, 9, 14, 19]], ["FSP", 7, 0, 2, 3], ["FSP", 7, 4, 3, 3], ["FSP", 7, 8, 4, 3], ["FSP", 7, 12, 5, 3], ["RE", 7, [0, 4, 8, 12, 1, 5, 9, 13, 2, 6, 10, 14, 3, 7, 11, 15]], ["CA", 2, 7, 11], ["CHR", 1, "shared", [2]], ["CA", 2, 3, 12], ["CHR", 0, "shared", [3]], ["CA", 1, 4, 12], ["FU", 9, [0, 1, 2, 3]], ["AN", 9, 0, 5], ["FU", 9, [1, 2, 3, 4]], ["AN", 9, 1, 4], ["FU", 9, [2, 3, 4, 5]], ["AN", 9, 2, 6], ["FU", 3, [0, 1, 2, 3]], ["SP", 3, 0, 60, [20], 1], ["AN", 3, 1, 2], ["FFSP", 3, 0, [5, 4, 3, 2], 1, 1], ["AN", 3, 1, 6], ["FU", 1, [0, 1, 2, 3]], ["SP", 1, 0, 35, [1], 1], ["AN", 1, 1, 2], ["FFSP", 1, 0, [5, 4, 3, 2], 1, 1], ["AN", 1, 1, 6], ["PR", 4, 0, "auto_unroll_max_step$64"]]]], "r": [[3.09239e-05, 3.09124e-05, 3.09187e-05], 0, 2.19169, 1661934874], "v": "v0.6"}
{"i": [["[\"head_conv1x1_bn_swish\", 1, 14, 14, 80, 480, 1, 1, 1]", "cuda -keys=cuda,gpu -max_num_threads=1024 -model=unknown -thread_warp_size=32", [-1, 16, 64, 49152, 2147483647, 1024, 8, 32], "", 0, []], [[], [["CI", 6], ["CI", 4], ["SP", 2, 0, 1, [1, 1, 1, 1], 1], ["SP", 2, 5, 14, [1, 2, 7, 1], 1], ["SP", 2, 10, 14, [1, 7, 1, 1], 1], ["SP", 2, 15, 480, [1, 24, 5, 1], 1], ["SP", 2, 20, 80, [4, 2], 1], ["RE", 2, [0, 5, 10, 15, 1, 6, 11, 16, 2, 7, 12, 17, 20, 21, 3, 8, 13, 18, 22, 4, 9, 14, 19]], ["FSP", 7, 0, 2, 3], ["FSP", 7, 4, 3, 3], ["FSP", 7, 8, 4, 3], ["FSP", 7, 12, 5, 3], ["RE", 7, [0, 4, 8, 12, 1, 5, 9, 13, 2, 6, 10, 14, 3, 7, 11, 15]], ["CA", 2, 7, 11], ["CHR", 1, "shared", [2]], ["CA", 2, 3, 12], ["CHR", 0, "shared", [3]], ["CA", 1, 4, 12], ["FU", 9, [0, 1, 2, 3]], ["AN", 9, 0, 5], ["FU", 9, [1, 2, 3, 4]], ["AN", 9, 1, 4], ["FU", 9, [2, 3, 4, 5]], ["AN", 9, 2, 6], ["FU", 3, [0, 1, 2, 3]], ["SP", 3, 0, 80, [1], 1], ["AN", 3, 1, 2], ["FFSP", 3, 0, [5, 4, 3, 2], 1, 1], ["AN", 3, 1, 6], ["FU", 1, [0, 1, 2, 3]], ["SP", 1, 0, 56, [1], 1], ["AN", 1, 1, 2], ["FFSP", 1, 0, [5, 4, 3, 2], 1, 1], ["AN", 1, 1, 6], ["PR", 4, 0, "auto_unroll_max_step$0"]]]], "r": [[2.86849e-05, 2.86825e-05, 2.86763e-05], 0, 10.018, 1661934882], "v": "v0.6"}
{"i": [["[\"head_conv1x1_bn_swish\", 1, 14, 14, 80, 480, 1, 1, 1]", "cuda -keys=cuda,gpu -max_num_threads=1024 -model=unknown -thread_warp_size=32", [-1, 16, 64, 49152, 2147483647, 1024, 8, 32], "", 0, []], [[], [["CI", 6], ["CI", 4], ["SP", 2, 0, 1, [1, 1, 1, 1], 1], ["SP", 2, 5, 14, [2, 7, 1, 1], 1], ["SP", 2, 10, 14, [1, 1, 2, 7], 1], ["SP", 2, 15, 480, [1, 96, 1, 5], 1], ["SP", 2, 20, 80, [8, 1], 1], ["RE", 2, [0, 5, 10, 15, 1, 6, 11, 16, 2, 7, 12, 17, 20, 21, 3, 8, 13, 18, 22, 4, 9, 14, 19]], ["FSP", 7, 0, 2, 3], ["FSP", 7, 4, 3, 3], ["FSP", 7, 8, 4, 3], ["FSP", 7, 12, 5, 3], ["RE", 7, [0, 4, 8, 12, 1, 5, 9, 13, 2, 6, 10, 14, 3, 7, 11, 15]], ["CA", 2, 7, 11], ["CHR", 1, "shared", [2]], ["CA", 2, 3, 12], ["CHR", 0, "shared", [3]], ["CA", 1, 4, 12], ["FU", 9, [0, 1, 2, 3]], ["AN", 9, 0, 5], ["FU", 9, [1, 2, 3, 4]], ["AN", 9, 1, 4], ["FU", 9, [2, 3, 4, 5]], ["AN", 9, 2, 6], ["FU", 3, [0, 1, 2, 3]], ["SP", 3, 0, 80, [1], 1], ["AN", 3, 1, 2], ["FFSP", 3, 0, [5, 4, 3, 2], 1, 1], ["AN", 3, 1, 6], ["FU", 1, [0, 1, 2, 3]], ["SP", 1, 0, 224, [1], 1], ["AN", 1, 1, 2], ["FFSP", 1, 0, [5, 4, 3, 2], 1, 1], ["AN", 1, 1, 6], ["PR", 4, 0, "auto_unroll_max_step$512"]]]], "r": [[0.00094311, 0.0009433, 0.000942899], 0, 5.73141, 1661934877], "v": "v0.6"}
{"i": [["[\"head_conv1x1_bn_swish\", 1, 14, 14, 80, 480, 1, 1, 1]", "cuda -keys=cuda,gpu -max_num_threads=1024 -model=unknown -thread_warp_size=32", [-1, 16, 64, 49152, 2147483647, 1024, 8, 32], "", 0, []], [[], [["CI", 6], ["CI", 4], ["SP", 2, 0, 1, [1, 1, 1, 1], 1], ["SP", 2, 5, 14, [1, 7, 1, 2], 1], ["SP", 2, 10, 14, [1, 14, 1, 1], 1], ["SP", 2, 15, 480, [1, 6, 8, 2], 1], ["SP", 2, 20, 80, [1, 1], 1], ["RE", 2, [0, 5, 10, 15, 1, 6, 11, 16, 2, 7, 12, 17, 20, 21, 3, 8, 13, 18, 22, 4, 9, 14, 19]], ["FSP", 7, 0, 2, 3], ["FSP", 7, 4, 3, 3], ["FSP", 7, 8, 4, 3], ["FSP", 7, 12, 5, 3], ["RE", 7, [0, 4, 8, 12, 1, 5, 9, 13, 2, 6, 10, 14, 3, 7, 11, 15]], ["CA", 2, 7, 11], ["CHR", 1, "shared", [2]], ["CA", 2, 3, 12], ["CHR", 0, "shared", [3]], ["CA", 1, 4, 12], ["FU", 9, [0, 1, 2, 3]], ["AN", 9, 0, 5], ["FU", 9, [1, 2, 3, 4]], ["AN", 9, 1, 4], ["FU", 9, [2, 3, 4, 5]], ["AN", 9, 2, 6], ["FU", 3, [0, 1, 2, 3]], ["SP", 3, 0, 80, [1], 1], ["AN", 3, 1, 2], ["FFSP", 3, 0, [5, 4, 3, 2], 1, 1], ["AN", 3, 1, 6], ["FU", 1, [0, 1, 2, 3]], ["SP", 1, 0, 10, [1], 1], ["AN", 1, 1, 2], ["FFSP", 1, 0, [5, 4, 3, 2], 1, 1], ["AN", 1, 1, 6], ["PR", 4, 0, "auto_unroll_max_step$0"]]]], "r": [[0.000104675, 0.000104679, 0.000104682], 0, 4.67705, 1661934876], "v": "v0.6"}
{"i": [["[\"head_conv1x1_bn_swish\", 1, 14, 14, 80, 480, 1, 1, 1]", "cuda -keys=cuda,gpu -max_num_threads=1024 -model=unknown -thread_warp_size=32", [-1, 16, 64, 49152, 2147483647, 1024, 8, 32], "", 0, []], [[], [["CI", 6], ["CI", 4], ["SP", 2, 0, 1, [1, 1, 1, 1], 1], ["SP", 2, 5, 14, [1, 2, 1, 1], 1], ["SP", 2, 10, 14, [1, 14, 1, 1], 1], ["SP", 2, 15, 480, [1, 1, 30, 2], 1], ["SP", 2, 20, 80, [20, 1], 1], ["RE", 2, [0, 5, 10, 15, 1, 6, 11, 16, 2, 7, 12, 17, 20, 21, 3, 8, 13, 18, 22, 4, 9, 14, 19]], ["FSP", 7, 0, 2, 3], ["FSP", 7, 4, 3, 3], ["FSP", 7, 8, 4, 3], ["FSP", 7, 12, 5, 3], ["RE", 7, [0, 4, 8, 12, 1, 5, 9, 13, 2, 6, 10, 14, 3, 7, 11, 15]], ["CA", 2, 7, 11], ["CHR", 1, "shared", [2]], ["CA", 2, 3, 12], ["CHR", 0, "shared", [3]], ["CA", 1, 4, 12], ["FU", 9, [0, 1, 2, 3]], ["AN", 9, 0, 5], ["FU", 9, [1, 2, 3, 4]], ["AN", 9, 1, 4], ["FU", 9, [2, 3, 4, 5]], ["AN", 9, 2, 6], ["FU", 3, [0, 1, 2, 3]], ["SP", 3, 0, 80, [1], 1], ["AN", 3, 1, 2], ["FFSP", 3, 0, [5, 4, 3, 2], 1, 1], ["AN", 3, 1, 6], ["FU", 1, [0, 1, 2, 3]], ["SP", 1, 0, 20, [1], 1], ["AN", 1, 1, 2], ["FFSP", 1, 0, [5, 4, 3, 2], 1, 1], ["AN", 1, 1, 6], ["PR", 4, 0, "auto_unroll_max_step$1024"]]]], "r": [[2.88598e-05, 2.88574e-05, 2.88616e-05], 0, 8.37676, 1661934880], "v": "v0.6"}
{"i": [["[\"head_conv1x1_bn_swish\", 1, 14, 14, 80, 480, 1, 1, 1]", "cuda -keys=cuda,gpu -max_num_threads=1024 -model=unknown -thread_warp_size=32", [-1, 16, 64, 49152, 2147483647, 1024, 8, 32], "", 0, []], [[], [["CI", 6], ["CI", 4], ["SP", 2, 0, 1, [1, 1, 1, 1], 1], ["SP", 2, 5, 14, [1, 7, 1, 2], 1], ["SP", 2, 10, 14, [2, 7, 1, 1], 1], ["SP", 2, 15, 480, [1, 3, 8, 4], 1], ["SP", 2, 20, 80, [1, 16], 1], ["RE", 2, [0, 5, 10, 15, 1, 6, 11, 16, 2, 7, 12, 17, 20, 21, 3, 8, 13, 18, 22, 4, 9, 14, 19]], ["FSP", 7, 0, 2, 3], ["FSP", 7, 4, 3, 3], ["FSP", 7, 8, 4, 3], ["FSP", 7, 12, 5, 3], ["RE", 7, [0, 4, 8, 12, 1, 5, 9, 13, 2, 6, 10, 14, 3, 7, 11, 15]], ["CA", 2, 7, 11], ["CHR", 1, "shared", [2]], ["CA", 2, 3, 12], ["CHR", 0, "shared", [3]], ["CA", 1, 4, 12], ["FU", 9, [0, 1, 2, 3]], ["AN", 9, 0, 5], ["FU", 9, [1, 2, 3, 4]], ["AN", 9, 1, 4], ["FU", 9, [2, 3, 4, 5]], ["AN", 9, 2, 6], ["FU", 3, [0, 1, 2, 3]], ["SP", 3, 0, 512, [1], 1], ["AN", 3, 1, 2], ["FFSP", 3, 0, [5, 4, 3, 2], 1, 1], ["AN", 3, 1, 6], ["FU", 1, [0, 1, 2, 3]], ["SP", 1, 0, 32, [2], 1], ["AN", 1, 1, 2], ["FFSP", 1, 0, [5, 4, 3, 2], 1, 1], ["AN", 1, 1, 6], ["PR", 4, 0, "auto_unroll_max_step$0"]]]], "r": [[7.83473e-05, 7.83285e-05, 7.83077e-05], 0, 3.77673, 1661934875], "v": "v0.6"}
{"i": [["[\"head_conv1x1_bn_swish\", 1, 14, 14, 80, 480, 1, 1, 1]", "cuda -keys=cuda,gpu -max_num_threads=1024 -model=unknown -thread_warp_size=32", [-1, 16, 64, 49152, 2147483647, 1024, 8, 32], "", 0, []], [[], [["CI", 6], ["CI", 4], ["SP", 2, 0, 1, [1, 1, 1, 1], 1], ["SP", 2, 5, 14, [1, 7, 1, 2], 1], ["SP", 2, 10, 14, [2, 1, 1, 7], 1], ["SP", 2, 15, 480, [2, 1, 80, 1], 1], ["SP", 2, 20, 80, [2, 4], 1], ["RE", 2, [0, 5, 10, 15, 1, 6, 11, 16, 2, 7, 12, 17, 20, 21, 3, 8, 13, 18, 22, 4, 9, 14, 19]], ["FSP", 7, 0, 2, 3], ["FSP", 7, 4, 3, 3], ["FSP", 7, 8, 4, 3], ["FSP", 7, 12, 5, 3], ["RE", 7, [0, 4, 8, 12, 1, 5, 9, 13, 2, 6, 10, 14, 3, 7, 11, 15]], ["CA", 2, 7, 11], ["CHR", 1, "shared", [2]], ["CA", 2, 3, 12], ["CHR", 0, "shared", [3]], ["CA", 1, 4, 12], ["FU", 9, [0, 1, 2, 3]], ["AN", 9, 0, 5], ["FU", 9, [1, 2, 3, 4]], ["AN", 9, 1, 4], ["FU", 9, [2, 3, 4, 5]], ["AN", 9, 2, 6], ["FU", 3, [0, 1, 2, 3]], ["SP", 3, 0, 32, [1], 1], ["AN", 3, 1, 2], ["FFSP", 3, 0, [5, 4, 3, 2], 1, 1], ["AN", 3, 1, 6], ["FU", 1, [0, 1, 2, 3]], ["SP", 1, 0, 112, [1], 1], ["AN", 1, 1, 2], ["FFSP", 1, 0, [5, 4, 3, 2], 1, 1], ["AN", 1, 1, 6], ["PR", 4, 0, "auto_unroll_max_step$0"]]]], "r": [[0.00237018, 0.00237102, 0.00237025], 0, 6.63261, 1661934878], "v": "v0.6"}
{"i": [["[\"head_conv1x1_bn_swish\", 1, 14, 14, 80, 480, 1, 1, 1]", "cuda -keys=cuda,gpu -max_num_threads=1024 -model=unknown -thread_warp_size=32", [-1, 16, 64, 49152, 2147483647, 1024, 8, 32], "", 0, []], [[], [["CI", 6], ["CI", 4], ["SP", 2, 0, 1, [1, 1, 1, 1], 1], ["SP", 2, 5, 14, [1, 7, 2, 1], 1], ["SP", 2, 10, 14, [1, 7, 1, 2], 1], ["SP", 2, 15, 480, [4, 5, 1, 8], 1], ["SP", 2, 20, 80, [1, 4], 1], ["RE", 2, [0, 5, 10, 15, 1, 6, 11, 16, 2, 7, 12, 17, 20, 21, 3, 8, 13, 18, 22, 4, 9, 14, 19]], ["FSP", 7, 0, 2, 3], ["FSP", 7, 4, 3, 3], ["FSP", 7, 8, 4, 3], ["FSP", 7, 12, 5, 3], ["RE", 7, [0, 4, 8, 12, 1, 5, 9, 13, 2, 6, 10, 14, 3, 7, 11, 15]], ["CA", 2, 7, 11], ["CHR", 1, "shared", [2]], ["CA", 2, 3, 12], ["CHR", 0, "shared", [3]], ["CA", 1, 4, 12], ["FU", 9, [0, 1, 2, 3]], ["AN", 9, 0, 5], ["FU", 9, [1, 2, 3, 4]], ["AN", 9, 1, 4], ["FU", 9, [2, 3, 4, 5]], ["AN", 9, 2, 6], ["FU", 3, [0, 1, 2, 3]], ["SP", 3, 0, 32, [1], 1], ["AN", 3, 1, 2], ["FFSP", 3, 0, [5, 4, 3, 2], 1, 1], ["AN", 3, 1, 6], ["FU", 1, [0, 1, 2, 3]], ["SP", 1, 0, 16, [4], 1], ["AN", 1, 1, 2], ["FFSP", 1, 0, [5, 4, 3, 2], 1, 1], ["AN", 1, 1, 6], ["PR", 4, 0, "auto_unroll_max_step$512"]]]], "r": [[8.61051e-05, 8.61118e-05, 8.61105e-05], 0, 10.6651, 1661934881], "v": "v0.6"}
{"i": [["[\"head_conv1x1_bn_swish\", 1, 14, 14, 80, 480, 1, 1, 1]", "cuda -keys=cuda,gpu -max_num_threads=1024 -model=unknown -thread_warp_size=32", [-1, 16, 64, 49152, 2147483647, 1024, 8, 32], "", 0, []], [[], [["CI", 6], ["CI", 4], ["SP", 2, 0, 1, [1, 1, 1, 1], 1], ["SP", 2, 5, 14, [1, 14, 1, 1], 1], ["SP", 2, 10, 14, [1, 1, 1, 1], 1], ["SP", 2, 15, 480, [1, 2, 40, 1], 1], ["SP", 2, 20, 80, [4, 20], 1], ["RE", 2, [0, 5, 10, 15, 1, 6, 11, 16, 2, 7, 12, 17, 20, 21, 3, 8, 13, 18, 22, 4, 9, 14, 19]], ["FSP", 7, 0, 2, 3], ["FSP", 7, 4, 3, 3], ["FSP", 7, 8, 4, 3], ["FSP", 7, 12, 5, 3], ["RE", 7, [0, 4, 8, 12, 1, 5, 9, 13, 2, 6, 10, 14, 3, 7, 11, 15]], ["CA", 2, 7, 11], ["CHR", 1, "shared", [2]], ["CA", 2, 3, 12], ["CHR", 0, "shared", [3]], ["CA", 1, 4, 12], ["FU", 9, [0, 1, 2, 3]], ["AN", 9, 0, 5], ["FU", 9, [1, 2, 3, 4]], ["AN", 9, 1, 4], ["FU", 9, [2, 3, 4, 5]], ["AN", 9, 2, 6], ["FU", 3, [0, 1, 2, 3]], ["SP", 3, 0, 160, [1], 1], ["AN", 3, 1, 2], ["FFSP", 3, 0, [5, 4, 3, 2], 1, 1], ["AN", 3, 1, 6], ["FU", 1, [0, 1, 2, 3]], ["SP", 1, 0, 80, [1], 1], ["AN", 1, 1, 2], ["FFSP", 1, 0, [5, 4, 3, 2], 1, 1], ["AN", 1, 1, 6], ["PR", 4, 0, "auto_unroll_max_step$512"]]]], "r": [[2.63743e-05, 2.63302e-05, 2.62524e-05], 0, 10.1066, 1661934880], "v": "v0.6"}
{"i": [["[\"head_conv1x1_bn_swish\", 1, 14, 14, 80, 480, 1, 1, 1]", "cuda -keys=cuda,gpu -max_num_threads=1024 -model=unknown -thread_warp_size=32", [-1, 16, 64, 49152, 2147483647, 1024, 8, 32], "", 0, []], [[], [["CI", 6], ["CI", 4], ["SP", 2, 0, 1, [1, 1, 1, 1], 1], ["SP", 2, 5, 14, [1, 7, 1, 1], 1], ["SP", 2, 10, 14, [1, 1, 1, 1], 1], ["SP", 2, 15, 480, [8, 5, 1, 1], 1], ["SP", 2, 20, 80, [5, 8], 1], ["RE", 2, [0, 5, 10, 15, 1, 6, 11, 16, 2, 7, 12, 17, 20, 21, 3, 8, 13, 18, 22, 4, 9, 14, 19]], ["FSP", 7, 0, 2, 3], ["FSP", 7, 4, 3, 3], ["FSP", 7, 8, 4, 3], ["FSP", 7, 12, 5, 3], ["RE", 7, [0, 4, 8, 12, 1, 5, 9, 13, 2, 6, 10, 14, 3, 7, 11, 15]], ["CA", 2, 7, 11], ["CHR", 1, "shared", [2]], ["CA", 2, 3, 12], ["CHR", 0, "shared", [3]], ["CA", 1, 4, 12], ["FU", 9, [0, 1, 2, 3]], ["AN", 9, 0, 5], ["FU", 9, [1, 2, 3, 4]], ["AN", 9, 1, 4], ["FU", 9, [2, 3, 4, 5]], ["AN", 9, 2, 6], ["FU", 3, [0, 1, 2, 3]], ["SP", 3, 0, 40, [1], 1], ["AN", 3, 1, 2], ["FFSP", 3, 0, [5, 4, 3, 2], 1, 1], ["AN", 3, 1, 6], ["FU", 1, [0, 1, 2, 3]], ["SP", 1, 0, 80, [5], 1], ["AN", 1, 1, 2], ["FFSP", 1, 0, [5, 4, 3, 2], 1, 1], ["AN", 1, 1, 6], ["PR", 4, 0, "auto_unroll_max_step$16"]]]], "r": [[1.97668e-05, 1.97123e-05, 1.97133e-05], 0, 1.6179, 1661934873], "v": "v0.6"}
{"i": [["[\"head_conv1x1_bn_swish\", 1, 14, 14, 80, 480, 1, 1, 1]", "cuda -keys=cuda,gpu -max_num_threads=1024 -model=unknown -thread_warp_size=32", [-1, 16, 64, 49152, 2147483647, 1024, 8, 32], "", 0, []], [[], [["CI", 6], ["CI", 4], ["SP", 2, 0, 1, [1, 1, 1, 1], 1], ["SP", 2, 5, 14, [1, 1, 1, 1], 1], ["SP", 2, 10, 14, [1, 14, 1, 1], 1], ["SP", 2, 15, 480, [8, 5, 2, 3], 1], ["SP", 2, 20, 80, [2, 1], 1], ["RE", 2, [0, 5, 10, 15, 1, 6, 11, 16, 2, 7, 12, 17, 20, 21, 3, 8, 13, 18, 22, 4, 9, 14, 19]], ["FSP", 7, 0, 2, 3], ["FSP", 7, 4, 3, 3], ["FSP", 7, 8, 4, 3], ["FSP", 7, 12, 5, 3], ["RE", 7, [0, 4, 8, 12, 1, 5, 9, 13, 2, 6, 10, 14, 3, 7, 11, 15]], ["CA", 2, 7, 11], ["CHR", 1, "shared", [2]], ["CA", 2, 3, 12], ["CHR", 0, "shared", [3]], ["CA", 1, 4, 12], ["FU", 9, [0, 1, 2, 3]], ["AN", 9, 0, 5], ["FU", 9, [1, 2, 3, 4]], ["AN", 9, 1, 4], ["FU", 9, [2, 3, 4, 5]], ["AN", 9, 2, 6], ["FU", 3, [0, 1, 2, 3]], ["SP", 3, 0, 12, [1], 1], ["AN", 3, 1, 2], ["FFSP", 3, 0, [5, 4, 3, 2], 1, 1], ["AN", 3, 1, 6], ["FU", 1, [0, 1, 2, 3]], ["SP", 1, 0, 28, [1], 1], ["AN", 1, 1, 2], ["FFSP", 1, 0, [5, 4, 3, 2], 1, 1], ["AN", 1, 1, 6], ["PR", 4, 0, "auto_unroll_max_step$16"]]]], "r": [[4.49963e-05, 4.49227e-05, 4.49119e-05], 0, 11.3313, 1661934883], "v": "v0.6"}
{"i": [["[\"head_conv1x1_bn_swish\", 1, 14, 14, 80, 480, 1, 1, 1]", "cuda -keys=cuda,gpu -max_num_threads=1024 -model=unknown -thread_warp_size=32", [-1, 16, 64, 49152, 2147483647, 1024, 8, 32], "", 0, []], [[], [["CI", 6], ["CI", 4], ["SP", 2, 0, 1, [1, 1, 1, 1], 1], ["SP", 2, 5, 14, [1, 2, 1, 7], 1], ["SP", 2, 10, 14, [1, 2, 1, 1], 1], ["SP", 2, 15, 480, [1, 24, 2, 1], 1], ["SP", 2, 20, 80, [16, 1], 1], ["RE", 2, [0, 5, 10, 15, 1, 6, 11, 16, 2, 7, 12, 17, 20, 21, 3, 8, 13, 18, 22, 4, 9, 14, 19]], ["FSP", 7, 0, 2, 3], ["FSP", 7, 4, 3, 3], ["FSP", 7, 8, 4, 3], ["FSP", 7, 12, 5, 3], ["RE", 7, [0, 4, 8, 12, 1, 5, 9, 13, 2, 6, 10, 14, 3, 7, 11, 15]], ["CA", 2, 7, 11], ["CHR", 1, "shared", [2]], ["CA", 2, 3, 12], ["CHR", 0, "shared", [3]], ["CA", 1, 4, 12], ["FU", 9, [0, 1, 2, 3]], ["AN", 9, 0, 5], ["FU", 9, [1, 2, 3, 4]], ["AN", 9, 1, 4], ["FU", 9, [2, 3, 4, 5]], ["AN", 9, 2, 6], ["FU", 3, [0, 1, 2, 3]], ["SP", 3, 0, 32, [1], 1], ["AN", 3, 1, 2], ["FFSP", 3, 0, [5, 4, 3, 2], 1, 1], ["AN", 3, 1, 6], ["FU", 1, [0, 1, 2, 3]], ["SP", 1, 0, 112, [1], 1], ["AN", 1, 1, 2], ["FFSP", 1, 0, [5, 4, 3, 2], 1, 1], ["AN", 1, 1, 6], ["PR", 4, 0, "auto_unroll_max_step$64"]]]], "r": [[1.30112e-05, 1.30155e-05, 1.30287e-05], 0, 9.6557, 1661934882], "v": "v0.6"}
{"i": [["[\"head_conv1x1_bn_swish\", 1, 14, 14, 80, 480, 1, 1, 1]", "cuda -keys=cuda,gpu -max_num_threads=1024 -model=unknown -thread_warp_size=32", [-1, 16, 64, 49152, 2147483647, 1024, 8, 32], "", 0, []], [[], [["CI", 6], ["CI", 4], ["SP", 2, 0, 1, [1, 1, 1, 1], 1], ["SP", 2, 5, 14, [1, 7, 1, 1], 1], ["SP", 2, 10, 14, [1, 7, 1, 2], 1], ["SP", 2, 15, 480, [8, 5, 12, 1], 1], ["SP", 2, 20, 80, [1, 10], 1], ["RE", 2, [0, 5, 10, 15, 1, 6, 11, 16, 2, 7, 12, 17, 20, 21, 3, 8, 13, 18, 22, 4, 9, 14, 19]], ["FSP", 7, 0, 2, 3], ["FSP", 7, 4, 3, 3], ["FSP", 7, 8, 4, 3], ["FSP", 7, 12, 5, 3], ["RE", 7, [0, 4, 8, 12, 1, 5, 9, 13, 2, 6, 10, 14, 3, 7, 11, 15]], ["CA", 2, 7, 11], ["CHR", 1, "shared", [2]], ["CA", 2, 3, 12], ["CHR", 0, "shared", [3]], ["CA", 1, 4, 12], ["FU", 9, [0, 1, 2, 3]], ["AN", 9, 0, 5], ["FU", 9, [1, 2, 3, 4]], ["AN", 9, 1, 4], ["FU", 9, [2, 3, 4, 5]], ["AN", 9, 2, 6], ["FU", 3, [0, 1, 2, 3]], ["SP", 3, 0, 120, [40], 1], ["AN", 3, 1, 2], ["FFSP", 3, 0, [5, 4, 3, 2], 1, 1], ["AN", 3, 1, 6], ["FU", 1, [0, 1, 2, 3]], ["SP", 1, 0, 20, [1], 1], ["AN", 1, 1, 2], ["FFSP", 1, 0, [5, 4, 3, 2], 1, 1], ["AN", 1, 1, 6], ["PR", 4, 0, "auto_unroll_max_step$64"]]]], "r": [[0.000196107, 0.00019629, 0.000196175], 0, 10.7487, 1661934883], "v": "v0.6"}
{"i": [["[\"head_conv1x1_bn_swish\", 1, 14, 14, 80, 480, 1, 1, 1]", "cuda -keys=cuda,gpu -max_num_threads=1024 -model=unknown -thread_warp_size=32", [-1, 16, 64, 49152, 2147483647, 1024, 8, 32], "", 0, []], [[], [["CI", 6], ["CI", 4], ["SP", 2, 0, 1, [1, 1, 1, 1], 1], ["SP", 2, 5, 14, [1, 1, 7, 1], 1], ["SP", 2, 10, 14, [1, 1, 14, 1], 1], ["SP", 2, 15, 480, [1, 48, 1, 2], 1], ["SP", 2, 20, 80, [5, 2], 1], ["RE", 2, [0, 5, 10, 15, 1, 6, 11, 16, 2, 7, 12, 17, 20, 21, 3, 8, 13, 18, 22, 4, 9, 14, 19]], ["FSP", 7, 0, 2, 3], ["FSP", 7, 4, 3, 3], ["FSP", 7, 8, 4, 3], ["FSP", 7, 12, 5, 3], ["RE", 7, [0, 4, 8, 12, 1, 5, 9, 13, 2, 6, 10, 14, 3, 7, 11, 15]], ["CA", 2, 7, 11], ["CHR", 1, "shared", [2]], ["CA", 2, 3, 12], ["CHR", 0, "shared", [3]], ["CA", 1, 4, 12], ["FU", 9, [0, 1, 2, 3]], ["AN", 9, 0, 5], ["FU", 9, [1, 2, 3, 4]], ["AN", 9, 1, 4], ["FU", 9, [2, 3, 4, 5]], ["AN", 9, 2, 6], ["FU", 3, [0, 1, 2, 3]], ["SP", 3, 0, 80, [1], 1], ["AN", 3, 1, 2], ["FFSP", 3, 0, [5, 4, 3, 2], 1, 1], ["AN", 3, 1, 6], ["FU", 1, [0, 1, 2, 3]], ["SP", 1, 0, 140, [1], 1], ["AN", 1, 1, 2], ["FFSP", 1, 0, [5, 4, 3, 2], 1, 1], ["AN", 1, 1, 6], ["PR", 4, 0, "auto_unroll_max_step$1024"]]]], "r": [[0.000439606, 0.000439504, 0.000439755], 0, 13.3287, 1661934884], "v": "v0.6"}
{"i": [["[\"head_conv1x1_bn_swish\", 1, 14, 14, 80, 480, 1, 1, 1]", "cuda -keys=cuda,gpu -max_num_threads=1024 -model=unknown -thread_warp_size=32", [-1, 16, 64, 49152, 2147483647, 1024, 8, 32], "", 0, []], [[], [["CI", 6], ["CI", 4], ["SP", 2, 0, 1, [1, 1, 1, 1], 1], ["SP", 2, 5, 14, [1, 7, 1, 2], 1], ["SP", 2, 10, 14, [2, 7, 1, 1], 1], ["SP", 2, 15, 480, [1, 2, 4, 10], 1], ["SP", 2, 20, 80, [8, 2], 1], ["RE", 2, [0, 5, 10, 15, 1, 6, 11, 16, 2, 7, 12, 17, 20, 21, 3, 8, 13, 18, 22, 4, 9, 14, 19]], ["FSP", 7, 0, 2, 3], ["FSP", 7, 4, 3, 3], ["FSP", 7, 8, 4, 3], ["FSP", 7, 12, 5, 3], ["RE", 7, [0, 4, 8, 12, 1, 5, 9, 13, 2, 6, 10, 14, 3, 7, 11, 15]], ["CA", 2, 7, 11], ["CHR", 1, "shared", [2]], ["CA", 2, 3, 12], ["CHR", 0, "shared", [3]], ["CA", 1, 4, 12], ["FU", 9, [0, 1, 2, 3]], ["AN", 9, 0, 5], ["FU", 9, [1, 2, 3, 4]], ["AN", 9, 1, 4], ["FU", 9, [2, 3, 4, 5]], ["AN", 9, 2, 6], ["FU", 3, [0, 1, 2, 3]], ["SP", 3, 0, 640, [1], 1], ["AN", 3, 1, 2], ["FFSP", 3, 0, [5, 4, 3, 2], 1, 1], ["AN", 3, 1, 6], ["FU", 1, [0, 1, 2, 3]], ["SP", 1, 0, 64, [1], 1], ["AN", 1, 1, 2], ["FFSP", 1, 0, [5, 4, 3, 2], 1, 1], ["AN", 1, 1, 6], ["PR", 4, 0, "auto_unroll_max_step$1024"]]]], "r": [[5.86545e-05, 5.86556e-05, 5.8624e-05], 0, 14.2314, 1661934885], "v": "v0.6"}
{"i": [["[\"head_conv1x1_bn_swish\", 1, 14, 14, 80, 480, 1, 1, 1]", "cuda -keys=cuda,gpu -max_num_threads=1024 -model=unknown -thread_warp_size=32", [-1, 16, 64, 49152, 2147483647, 1024, 8, 32], "", 0, []], [[], [["CI", 6], ["CI", 4], ["SP", 2, 0, 1, [1, 1, 1, 1], 1], ["SP", 2, 5, 14, [7, 1, 1, 2], 1], ["SP", 2, 10, 14, [1, 7, 2, 1], 1], ["SP", 2, 15, 480, [1, 1, 12, 2], 1], ["SP", 2, 20, 80, [8, 5], 1], ["RE", 2, [0, 5, 10, 15, 1, 6, 11, 16, 2, 7, 12, 17, 20, 21, 3, 8, 13, 18, 22, 4, 9, 14, 19]], ["FSP", 7, 0, 2, 3], ["FSP", 7, 4, 3, 3], ["FSP", 7, 8, 4, 3], ["FSP", 7, 12, 5, 3], ["RE", 7, [0, 4, 8, 12, 1, 5, 9, 13, 2, 6, 10, 14, 3, 7, 11, 15]], ["CA", 2, 7, 11], ["CHR", 1, "shared", [2]], ["CA", 2, 3, 12], ["CHR", 0, "shared", [3]], ["CA", 1, 4, 12], ["FU", 9, [0, 1, 2, 3]], ["AN", 9, 0, 5], ["FU", 9, [1, 2, 3, 4]], ["AN", 9, 1, 4], ["FU", 9, [2, 3, 4, 5]], ["AN", 9, 2, 6], ["FU", 3, [0, 1, 2, 3]], ["SP", 3, 0, 320, [1], 1], ["AN", 3, 1, 2], ["FFSP", 3, 0, [5, 4, 3, 2], 1, 1], ["AN", 3, 1, 6], ["FU", 1, [0, 1, 2, 3]], ["SP", 1, 0, 160, [1], 1], ["AN", 1, 1, 2], ["FFSP", 1, 0, [5, 4, 3, 2], 1, 1], ["AN", 1, 1, 6], ["PR", 4, 0, "auto_unroll_max_step$64"]]]], "r": [[0.000504762, 0.000504717, 0.000504767], 0, 14.6356, 1661934886], "v": "v0.6"}
{"i": [["[\"head_conv1x1_bn_swish\", 1, 14, 14, 80, 480, 1, 1, 1]", "cuda -keys=cuda,gpu -max_num_threads=1024 -model=unknown -thread_warp_size=32", [-1, 16, 64, 49152, 2147483647, 1024, 8, 32], "", 0, []], [[], [["CI", 6], ["CI", 4], ["SP", 2, 0, 1, [1, 1, 1, 1], 1], ["SP", 2, 5, 14, [1, 7, 1, 2], 1], ["SP", 2, 10, 14, [1, 7, 2, 1], 1], ["SP", 2, 15, 480, [1, 2, 4, 10], 1], ["SP", 2, 20, 80, [8, 2], 1], ["RE", 2, [0, 5, 10, 15, 1, 6, 11, 16, 2, 7, 12, 17, 20, 21, 3, 8, 13, 18, 22, 4, 9, 14, 19]], ["FSP", 7, 0, 2, 3], ["FSP", 7, 4, 3, 3], ["FSP", 7, 8, 4, 3], ["FSP", 7, 12, 5, 3], ["RE", 7, [0, 4, 8, 12, 1, 5, 9, 13, 2, 6, 10, 14, 3, 7, 11, 15]], ["CA", 2, 7, 11], ["CHR", 1, "shared", [2]], ["CA", 2, 3, 12], ["CHR", 0, "shared", [3]], ["CA", 1, 4, 12], ["FU", 9, [0, 1, 2, 3]], ["AN", 9, 0, 5], ["FU", 9, [1, 2, 3, 4]], ["AN", 9, 1, 4], ["FU", 9, [2, 3, 4, 5]], ["AN", 9, 2, 6], ["FU", 3, [0, 1, 2, 3]], ["SP", 3, 0, 640, [2], 1], ["AN", 3, 1, 2], ["FFSP", 3, 0, [5, 4, 3, 2], 1, 1], ["AN", 3, 1, 6], ["FU", 1, [0, 1, 2, 3]], ["SP", 1, 0, 64, [1], 1], ["AN", 1, 1, 2], ["FFSP", 1, 0, [5, 4, 3, 2], 1, 1], ["AN", 1, 1, 6], ["PR", 4, 0, "auto_unroll_max_step$1024"]]]], "r": [[6.21378e-05, 6.21348e-05, 6.21622e-05], 0, 15.8755, 1661934887], "v": "v0.6"}
{"i": [["[\"head_conv1x1_bn_swish\", 1, 14, 14, 80, 480, 1, 1, 1]", "cuda -keys=cuda,gpu -max_num_threads=1024 -model=unknown -thread_warp_size=32", [-1, 16, 64, 49152, 2147483647, 1024, 8, 32], "", 0, []], [[], [["CI", 6], ["CI", 4], ["SP", 2, 0, 1, [1, 1, 1, 1], 1], ["SP", 2, 5, 14, [1, 7, 2, 1], 1], ["SP", 2, 10, 14, [1, 1, 7, 1], 1], ["SP", 2, 15, 480, [1, 24, 20, 1], 1], ["SP", 2, 20, 80, [5, 2], 1], ["RE", 2, [0, 5, 10, 15, 1, 6, 11, 16, 2, 7, 12, 17, 20, 21, 3, 8, 13, 18, 22, 4, 9, 14, 19]], ["FSP", 7, 0, 2, 3], ["FSP", 7, 4, 3, 3], ["FSP", 7, 8, 4, 3], ["FSP", 7, 12, 5, 3], ["RE", 7, [0, 4, 8, 12, 1, 5, 9, 13, 2, 6, 10, 14, 3, 7, 11, 15]], ["CA", 2, 7, 11], ["CHR", 1, "shared", [2]], ["CA", 2, 3, 12], ["CHR", 0, "shared", [3]], ["CA", 1, 4, 12], ["FU", 9, [0, 1, 2, 3]], ["AN", 9, 0, 5], ["FU", 9, [1, 2, 3, 4]], ["AN", 9, 1, 4], ["FU", 9, [2, 3, 4, 5]], ["AN", 9, 2, 6], ["FU", 3, [0, 1, 2, 3]], ["SP", 3, 0, 200, [2], 1], ["AN", 3, 1, 2], ["FFSP", 3, 0, [5, 4, 3, 2], 1, 1], ["AN", 3, 1, 6], ["FU", 1, [0, 1, 2, 3]], ["SP", 1, 0, 140, [7], 1], ["AN", 1, 1, 2], ["FFSP", 1, 0, [5, 4, 3, 2], 1, 1], ["AN", 1, 1, 6], ["PR", 4, 0, "auto_unroll_max_step$64"]]]], "r": [[0.00030582, 0.000305895, 0.00030594], 0, 14.1455, 1661934886], "v": "v0.6"}
{"i": [["[\"head_conv1x1_bn_swish\", 1, 14, 14, 80, 480, 1, 1, 1]", "cuda -keys=cuda,gpu -max_num_threads=1024 -model=unknown -thread_warp_size=32", [-1, 16, 64, 49152, 2147483647, 1024, 8, 32], "", 0, []], [[], [["CI", 6], ["CI", 4], ["SP", 2, 0, 1, [1, 1, 1, 1], 1], ["SP", 2, 5, 14, [1, 2, 1, 1], 1], ["SP", 2, 10, 14, [1, 1, 1, 2], 1], ["SP", 2, 15, 480, [1, 4, 20, 1], 1], ["SP", 2, 20, 80, [2, 20], 1], ["RE", 2, [0, 5, 10, 15, 1, 6, 11, 16, 2, 7, 12, 17, 20, 21, 3, 8, 13, 18, 22, 4, 9, 14, 19]], ["FSP", 7, 0, 2, 3], ["FSP", 7, 4, 3, 3], ["FSP", 7, 8, 4, 3], ["FSP", 7, 12, 5, 3], ["RE", 7, [0, 4, 8, 12, 1, 5, 9, 13, 2, 6, 10, 14, 3, 7, 11, 15]], ["CA", 2, 7, 11], ["CHR", 1, "shared", [2]], ["CA", 2, 3, 12], ["CHR", 0, "shared", [3]], ["CA", 1, 4, 12], ["FU", 9, [0, 1, 2, 3]], ["AN", 9, 0, 5], ["FU", 9, [1, 2, 3, 4]], ["AN", 9, 1, 4], ["FU", 9, [2, 3, 4, 5]], ["AN", 9, 2, 6], ["FU", 3, [0, 1, 2, 3]], ["SP", 3, 0, 40, [1], 1], ["AN", 3, 1, 2], ["FFSP", 3, 0, [5, 4, 3, 2], 1, 1], ["AN", 3, 1, 6], ["FU", 1, [0, 1, 2, 3]], ["SP", 1, 0, 80, [16], 1], ["AN", 1, 1, 2], ["FFSP", 1, 0, [5, 4, 3, 2], 1, 1], ["AN", 1, 1, 6], ["PR", 4, 0, "auto_unroll_max_step$1024"]]]], "r": [[5.13465e-05, 5.13389e-05, 5.13104e-05], 0, 20.3623, 1661934888], "v": "v0.6"}
{"i": [["[\"head_conv1x1_bn_swish\", 1, 14, 14, 80, 480, 1, 1, 1]", "cuda -keys=cuda,gpu -max_num_threads=1024 -model=unknown -thread_warp_size=32", [-1, 16, 64, 49152, 2147483647, 1024, 8, 32], "", 0, []], [[], [["CI", 6], ["CI", 4], ["SP", 2, 0, 1, [1, 1, 1, 1], 1], ["SP", 2, 5, 14, [1, 7, 1, 1], 1], ["SP", 2, 10, 14, [1, 7, 2, 1], 1], ["SP", 2, 15, 480, [8, 5, 12, 1], 1], ["SP", 2, 20, 80, [1, 2], 1], ["RE", 2, [0, 5, 10, 15, 1, 6, 11, 16, 2, 7, 12, 17, 20, 21, 3, 8, 13, 18, 22, 4, 9, 14, 19]], ["FSP", 7, 0, 2, 3], ["FSP", 7, 4, 3, 3], ["FSP", 7, 8, 4, 3], ["FSP", 7, 12, 5, 3], ["RE", 7, [0, 4, 8, 12, 1, 5, 9, 13, 2, 6, 10, 14, 3, 7, 11, 15]], ["CA", 2, 7, 11], ["CHR", 1, "shared", [2]], ["CA", 2, 3, 12], ["CHR", 0, "shared", [3]], ["CA", 1, 4, 12], ["FU", 9, [0, 1, 2, 3]], ["AN", 9, 0, 5], ["FU", 9, [1, 2, 3, 4]], ["AN", 9, 1, 4], ["FU", 9, [2, 3, 4, 5]], ["AN", 9, 2, 6], ["FU", 3, [0, 1, 2, 3]], ["SP", 3, 0, 120, [1], 1], ["AN", 3, 1, 2], ["FFSP", 3, 0, [5, 4, 3, 2], 1, 1], ["AN", 3, 1, 6], ["FU", 1, [0, 1, 2, 3]], ["SP", 1, 0, 20, [1], 1], ["AN", 1, 1, 2], ["FFSP", 1, 0, [5, 4, 3, 2], 1, 1], ["AN", 1, 1, 6], ["PR", 4, 0, "auto_unroll_max_step$64"]]]], "r": [[0.000353295, 0.000353079, 0.00035306], 0, 17.1866, 1661934889], "v": "v0.6"}
{"i": [["[\"head_conv1x1_bn_swish\", 1, 14, 14, 80, 480, 1, 1, 1]", "cuda -keys=cuda,gpu -max_num_threads=1024 -model=unknown -thread_warp_size=32", [-1, 16, 64, 49152, 2147483647, 1024, 8, 32], "", 0, []], [[], [["CI", 6], ["CI", 4], ["SP", 2, 0, 1, [1, 1, 1, 1], 1], ["SP", 2, 5, 14, [1, 1, 14, 1], 1], ["SP", 2, 10, 14, [1, 14, 1, 1], 1], ["SP", 2, 15, 480, [6, 5, 1, 2], 1], ["SP", 2, 20, 80, [10, 2], 1], ["RE", 2, [0, 5, 10, 15, 1, 6, 11, 16, 2, 7, 12, 17, 20, 21, 3, 8, 13, 18, 22, 4, 9, 14, 19]], ["FSP", 7, 0, 2, 3], ["FSP", 7, 4, 3, 3], ["FSP", 7, 8, 4, 3], ["FSP", 7, 12, 5, 3], ["RE", 7, [0, 4, 8, 12, 1, 5, 9, 13, 2, 6, 10, 14, 3, 7, 11, 15]], ["CA", 2, 7, 11], ["CHR", 1, "shared", [2]], ["CA", 2, 3, 12], ["CHR", 0, "shared", [3]], ["CA", 1, 4, 12], ["FU", 9, [0, 1, 2, 3]], ["AN", 9, 0, 5], ["FU", 9, [1, 2, 3, 4]], ["AN", 9, 1, 4], ["FU", 9, [2, 3, 4, 5]], ["AN", 9, 2, 6], ["FU", 3, [0, 1, 2, 3]], ["SP", 3, 0, 40, [1], 1], ["AN", 3, 1, 2], ["FFSP", 3, 0, [5, 4, 3, 2], 1, 1], ["AN", 3, 1, 6], ["FU", 1, [0, 1, 2, 3]], ["SP", 1, 0, 280, [1], 1], ["AN", 1, 1, 2], ["FFSP", 1, 0, [5, 4, 3, 2], 1, 1], ["AN", 1, 1, 6], ["PR", 4, 0, "auto_unroll_max_step$1024"]]]], "r": [[5.94922e-05, 5.94899e-05, 5.948e-05], 0, 17.4451, 1661934889], "v": "v0.6"}
{"i": [["[\"head_conv1x1_bn_swish\", 1, 14, 14, 80, 480, 1, 1, 1]", "cuda -keys=cuda,gpu -max_num_threads=1024 -model=unknown -thread_warp_size=32", [-1, 16, 64, 49152, 2147483647, 1024, 8, 32], "", 0, []], [[], [["CI", 6], ["CI", 4], ["SP", 2, 0, 1, [1, 1, 1, 1], 1], ["SP", 2, 5, 14, [1, 1, 1, 14], 1], ["SP", 2, 10, 14, [1, 14, 1, 1], 1], ["SP", 2, 15, 480, [2, 12, 10, 2], 1], ["SP", 2, 20, 80, [4, 1], 1], ["RE", 2, [0, 5, 10, 15, 1, 6, 11, 16, 2, 7, 12, 17, 20, 21, 3, 8, 13, 18, 22, 4, 9, 14, 19]], ["FSP", 7, 0, 2, 3], ["FSP", 7, 4, 3, 3], ["FSP", 7, 8, 4, 3], ["FSP", 7, 12, 5, 3], ["RE", 7, [0, 4, 8, 12, 1, 5, 9, 13, 2, 6, 10, 14, 3, 7, 11, 15]], ["CA", 2, 7, 11], ["CHR", 1, "shared", [2]], ["CA", 2, 3, 12], ["CHR", 0, "shared", [3]], ["CA", 1, 4, 12], ["FU", 9, [0, 1, 2, 3]], ["AN", 9, 0, 5], ["FU", 9, [1, 2, 3, 4]], ["AN", 9, 1, 4], ["FU", 9, [2, 3, 4, 5]], ["AN", 9, 2, 6], ["FU", 3, [0, 1, 2, 3]], ["SP", 3, 0, 16, [1], 1], ["AN", 3, 1, 2], ["FFSP", 3, 0, [5, 4, 3, 2], 1, 1], ["AN", 3, 1, 6], ["FU", 1, [0, 1, 2, 3]], ["SP", 1, 0, 56, [1], 1], ["AN", 1, 1, 2], ["FFSP", 1, 0, [5, 4, 3, 2], 1, 1], ["AN", 1, 1, 6], ["PR", 4, 0, "auto_unroll_max_step$64"]]]], "r": [[0.00106099, 0.00106034, 0.00106103], 0, 18.9604, 1661934890], "v": "v0.6"}
{"i": [["[\"head_conv1x1_bn_swish\", 1, 14, 14, 80, 480, 1, 1, 1]", "cuda -keys=cuda,gpu -max_num_threads=1024 -model=unknown -thread_warp_size=32", [-1, 16, 64, 49152, 2147483647, 1024, 8, 32], "", 0, []], [[], [["CI", 6], ["CI", 4], ["SP", 2, 0, 1, [1, 1, 1, 1], 1], ["SP", 2, 5, 14, [1, 2, 7, 1], 1], ["SP", 2, 10, 14, [1, 1, 1, 1], 1], ["SP", 2, 15, 480, [3, 20, 4, 1], 1], ["SP", 2, 20, 80, [4, 2], 1], ["RE", 2, [0, 5, 10, 15, 1, 6, 11, 16, 2, 7, 12, 17, 20, 21, 3, 8, 13, 18, 22, 4, 9, 14, 19]], ["FSP", 7, 0, 2, 3], ["FSP", 7, 4, 3, 3], ["FSP", 7, 8, 4, 3], ["FSP", 7, 12, 5, 3], ["RE", 7, [0, 4, 8, 12, 1, 5, 9, 13, 2, 6, 10, 14, 3, 7, 11, 15]], ["CA", 2, 7, 11], ["CHR", 1, "shared", [2]], ["CA", 2, 3, 12], ["CHR", 0, "shared", [3]], ["CA", 1, 4, 12], ["FU", 9, [0, 1, 2, 3]], ["AN", 9, 0, 5], ["FU", 9, [1, 2, 3, 4]], ["AN", 9, 1, 4], ["FU", 9, [2, 3, 4, 5]], ["AN", 9, 2, 6], ["FU", 3, [0, 1, 2, 3]], ["SP", 3, 0, 32, [1], 1], ["AN", 3, 1, 2], ["FFSP", 3, 0, [5, 4, 3, 2], 1, 1], ["AN", 3, 1, 6], ["FU", 1, [0, 1, 2, 3]], ["SP", 1, 0, 56, [4], 1], ["AN", 1, 1, 2], ["FFSP", 1, 0, [5, 4, 3, 2], 1, 1], ["AN", 1, 1, 6], ["PR", 4, 0, "auto_unroll_max_step$512"]]]], "r": [[3.37013e-05, 3.37022e-05, 3.36888e-05], 0, 19.6291, 1661934892], "v": "v0.6"}
{"i": [["[\"head_conv1x1_bn_swish\", 1, 14, 14, 80, 480, 1, 1, 1]", "cuda -keys=cuda,gpu -max_num_threads=1024 -model=unknown -thread_warp_size=32", [-1, 16, 64, 49152, 2147483647, 1024, 8, 32], "", 0, []], [[], [["CI", 6], ["CI", 4], ["SP", 2, 0, 1, [1, 1, 1, 1], 1], ["SP", 2, 5, 14, [1, 2, 1, 1], 1], ["SP", 2, 10, 14, [1, 7, 2, 1], 1], ["SP", 2, 15, 480, [2, 1, 2, 6], 1], ["SP", 2, 20, 80, [1, 10], 1], ["RE", 2, [0, 5, 10, 15, 1, 6, 11, 16, 2, 7, 12, 17, 20, 21, 3, 8, 13, 18, 22, 4, 9, 14, 19]], ["FSP", 7, 0, 2, 3], ["FSP", 7, 4, 3, 3], ["FSP", 7, 8, 4, 3], ["FSP", 7, 12, 5, 3], ["RE", 7, [0, 4, 8, 12, 1, 5, 9, 13, 2, 6, 10, 14, 3, 7, 11, 15]], ["CA", 2, 7, 11], ["CHR", 1, "shared", [2]], ["CA", 2, 3, 12], ["CHR", 0, "shared", [3]], ["CA", 1, 4, 12], ["FU", 9, [0, 1, 2, 3]], ["AN", 9, 0, 5], ["FU", 9, [1, 2, 3, 4]], ["AN", 9, 1, 4], ["FU", 9, [2, 3, 4, 5]], ["AN", 9, 2, 6], ["FU", 3, [0, 1, 2, 3]], ["SP", 3, 0, 120, [15], 1], ["AN", 3, 1, 2], ["FFSP", 3, 0, [5, 4, 3, 2], 1, 1], ["AN", 3, 1, 6], ["FU", 1, [0, 1, 2, 3]], ["SP", 1, 0, 20, [1], 1], ["AN", 1, 1, 2], ["FFSP", 1, 0, [5, 4, 3, 2], 1, 1], ["AN", 1, 1, 6], ["PR", 4, 0, "auto_unroll_max_step$1024"]]]], "r": [[2.10082e-05, 2.10169e-05, 2.10101e-05], 0, 19.5599, 1661934891], "v": "v0.6"}
{"i": [["[\"head_conv1x1_bn_swish\", 1, 14, 14, 80, 480, 1, 1, 1]", "cuda -keys=cuda,gpu -max_num_threads=1024 -model=unknown -thread_warp_size=32", [-1, 16, 64, 49152, 2147483647, 1024, 8, 32], "", 0, []], [[], [["CI", 6], ["CI", 4], ["SP", 2, 0, 1, [1, 1, 1, 1], 1], ["SP", 2, 5, 14, [1, 7, 1, 2], 1], ["SP", 2, 10, 14, [1, 2, 7, 1], 1], ["SP", 2, 15, 480, [1, 4, 24, 5], 1], ["SP", 2, 20, 80, [2, 1], 1], ["RE", 2, [0, 5, 10, 15, 1, 6, 11, 16, 2, 7, 12, 17, 20, 21, 3, 8, 13, 18, 22, 4, 9, 14, 19]], ["FSP", 7, 0, 2, 3], ["FSP", 7, 4, 3, 3], ["FSP", 7, 8, 4, 3], ["FSP", 7, 12, 5, 3], ["RE", 7, [0, 4, 8, 12, 1, 5, 9, 13, 2, 6, 10, 14, 3, 7, 11, 15]], ["CA", 2, 7, 11], ["CHR", 1, "shared", [2]], ["CA", 2, 3, 12], ["CHR", 0, "shared", [3]], ["CA", 1, 4, 12], ["FU", 9, [0, 1, 2, 3]], ["AN", 9, 0, 5], ["FU", 9, [1, 2, 3, 4]], ["AN", 9, 1, 4], ["FU", 9, [2, 3, 4, 5]], ["AN", 9, 2, 6], ["FU", 3, [0, 1, 2, 3]], ["SP", 3, 0, 240, [1], 1], ["AN", 3, 1, 2], ["FFSP", 3, 0, [5, 4, 3, 2], 1, 1], ["AN", 3, 1, 6], ["FU", 1, [0, 1, 2, 3]], ["SP", 1, 0, 4, [1], 1], ["AN", 1, 1, 2], ["FFSP", 1, 0, [5, 4, 3, 2], 1, 1], ["AN", 1, 1, 6], ["PR", 4, 0, "auto_unroll_max_step$0"]]]], "r": [[0.00159993, 0.00160053, 0.00159999], 0, 20.6309, 1661934892], "v": "v0.6"}
{"i": [["[\"head_conv1x1_bn_swish\", 1, 14, 14, 80, 480, 1, 1, 1]", "cuda -keys=cuda,gpu -max_num_threads=1024 -model=unknown -thread_warp_size=32", [-1, 16, 64, 49152, 2147483647, 1024, 8, 32], "", 0, []], [[], [["CI", 6], ["CI", 4], ["SP", 2, 0, 1, [1, 1, 1, 1], 1], ["SP", 2, 5, 14, [1, 7, 1, 1], 1], ["SP", 2, 10, 14, [1, 1, 14, 1], 1], ["SP", 2, 15, 480, [1, 48, 1, 10], 1], ["SP", 2, 20, 80, [2, 4], 1], ["RE", 2, [0, 5, 10, 15, 1, 6, 11, 16, 2, 7, 12, 17, 20, 21, 3, 8, 13, 18, 22, 4, 9, 14, 19]], ["FSP", 7, 0, 2, 3], ["FSP", 7, 4, 3, 3], ["FSP", 7, 8, 4, 3], ["FSP", 7, 12, 5, 3], ["RE", 7, [0, 4, 8, 12, 1, 5, 9, 13, 2, 6, 10, 14, 3, 7, 11, 15]], ["CA", 2, 7, 11], ["CHR", 1, "shared", [2]], ["CA", 2, 3, 12], ["CHR", 0, "shared", [3]], ["CA", 1, 4, 12], ["FU", 9, [0, 1, 2, 3]], ["AN", 9, 0, 5], ["FU", 9, [1, 2, 3, 4]], ["AN", 9, 1, 4], ["FU", 9, [2, 3, 4, 5]], ["AN", 9, 2, 6], ["FU", 3, [0, 1, 2, 3]], ["SP", 3, 0, 80, [1], 1], ["AN", 3, 1, 2], ["FFSP", 3, 0, [5, 4, 3, 2], 1, 1], ["AN", 3, 1, 6], ["FU", 1, [0, 1, 2, 3]], ["SP", 1, 0, 112, [4], 1], ["AN", 1, 1, 2], ["FFSP", 1, 0, [5, 4, 3, 2], 1, 1], ["AN", 1, 1, 6], ["PR", 4, 0, "auto_unroll_max_step$64"]]]], "r": [[0.000120224, 0.000120255, 0.0001202], 0, 21.6619, 1661934894], "v": "v0.6"}
{"i": [["[\"head_conv1x1_bn_swish\", 1, 14, 14, 80, 480, 1, 1, 1]", "cuda -keys=cuda,gpu -max_num_threads=1024 -model=unknown -thread_warp_size=32", [-1, 16, 64, 49152, 2147483647, 1024, 8, 32], "", 0, []], [[], [["CI", 6], ["CI", 4], ["SP", 2, 0, 1, [1, 1, 1, 1], 1], ["SP", 2, 5, 14, [2, 7, 1, 1], 1], ["SP", 2, 10, 14, [1, 7, 1, 1], 1], ["SP", 2, 15, 480, [2, 1, 2, 20], 1], ["SP", 2, 20, 80, [1, 40], 1], ["RE", 2, [0, 5, 10, 15, 1, 6, 11, 16, 2, 7, 12, 17, 20, 21, 3, 8, 13, 18, 22, 4, 9, 14, 19]], ["FSP", 7, 0, 2, 3], ["FSP", 7, 4, 3, 3], ["FSP", 7, 8, 4, 3], ["FSP", 7, 12, 5, 3], ["RE", 7, [0, 4, 8, 12, 1, 5, 9, 13, 2, 6, 10, 14, 3, 7, 11, 15]], ["CA", 2, 7, 11], ["CHR", 1, "shared", [2]], ["CA", 2, 3, 12], ["CHR", 0, "shared", [3]], ["CA", 1, 4, 12], ["FU", 9, [0, 1, 2, 3]], ["AN", 9, 0, 5], ["FU", 9, [1, 2, 3, 4]], ["AN", 9, 1, 4], ["FU", 9, [2, 3, 4, 5]], ["AN", 9, 2, 6], ["FU", 3, [0, 1, 2, 3]], ["SP", 3, 0, 1600, [1], 1], ["AN", 3, 1, 2], ["FFSP", 3, 0, [5, 4, 3, 2], 1, 1], ["AN", 3, 1, 6], ["FU", 1, [0, 1, 2, 3]], ["SP", 1, 0, 80, [1], 1], ["AN", 1, 1, 2], ["FFSP", 1, 0, [5, 4, 3, 2], 1, 1], ["AN", 1, 1, 6], ["PR", 4, 0, "auto_unroll_max_step$0"]]]], "r": [[8.85153e-05, 8.84674e-05, 8.85261e-05], 0, 23.4244, 1661934896], "v": "v0.6"}
{"i": [["[\"head_conv1x1_bn_swish\", 1, 14, 14, 80, 480, 1, 1, 1]", "cuda -keys=cuda,gpu -max_num_threads=1024 -model=unknown -thread_warp_size=32", [-1, 16, 64, 49152, 2147483647, 1024, 8, 32], "", 0, []], [[], [["CI", 6], ["CI", 4], ["SP", 2, 0, 1, [1, 1, 1, 1], 1], ["SP", 2, 5, 14, [1, 1, 1, 2], 1], ["SP", 2, 10, 14, [14, 1, 1, 1], 1], ["SP", 2, 15, 480, [1, 120, 1, 4], 1], ["SP", 2, 20, 80, [2, 8], 1], ["RE", 2, [0, 5, 10, 15, 1, 6, 11, 16, 2, 7, 12, 17, 20, 21, 3, 8, 13, 18, 22, 4, 9, 14, 19]], ["FSP", 7, 0, 2, 3], ["FSP", 7, 4, 3, 3], ["FSP", 7, 8, 4, 3], ["FSP", 7, 12, 5, 3], ["RE", 7, [0, 4, 8, 12, 1, 5, 9, 13, 2, 6, 10, 14, 3, 7, 11, 15]], ["CA", 2, 7, 11], ["CHR", 1, "shared", [2]], ["CA", 2, 3, 12], ["CHR", 0, "shared", [3]], ["CA", 1, 4, 12], ["FU", 9, [0, 1, 2, 3]], ["AN", 9, 0, 5], ["FU", 9, [1, 2, 3, 4]], ["AN", 9, 1, 4], ["FU", 9, [2, 3, 4, 5]], ["AN", 9, 2, 6], ["FU", 3, [0, 1, 2, 3]], ["SP", 3, 0, 64, [1], 1], ["AN", 3, 1, 2], ["FFSP", 3, 0, [5, 4, 3, 2], 1, 1], ["AN", 3, 1, 6], ["FU", 1, [0, 1, 2, 3]], ["SP", 1, 0, 224, [1], 1], ["AN", 1, 1, 2], ["FFSP", 1, 0, [5, 4, 3, 2], 1, 1], ["AN", 1, 1, 6], ["PR", 4, 0, "auto_unroll_max_step$1024"]]]], "r": [[4.16797e-05, 4.16843e-05, 4.16745e-05], 0, 22.2094, 1661934893], "v": "v0.6"}
{"i": [["[\"head_conv1x1_bn_swish\", 1, 14, 14, 80, 480, 1, 1, 1]", "cuda -keys=cuda,gpu -max_num_threads=1024 -model=unknown -thread_warp_size=32", [-1, 16, 64, 49152, 2147483647, 1024, 8, 32], "", 0, []], [[], [["CI", 6], ["CI", 4], ["SP", 2, 0, 1, [1, 1, 1, 1], 1], ["SP", 2, 5, 14, [1, 2, 7, 1], 1], ["SP", 2, 10, 14, [1, 1, 1, 1], 1], ["SP", 2, 15, 480, [1, 16, 1, 3], 1], ["SP", 2, 20, 80, [8, 2], 1], ["RE", 2, [0, 5, 10, 15, 1, 6, 11, 16, 2, 7, 12, 17, 20, 21, 3, 8, 13, 18, 22, 4, 9, 14, 19]], ["FSP", 7, 0, 2, 3], ["FSP", 7, 4, 3, 3], ["FSP", 7, 8, 4, 3], ["FSP", 7, 12, 5, 3], ["RE", 7, [0, 4, 8, 12, 1, 5, 9, 13, 2, 6, 10, 14, 3, 7, 11, 15]], ["CA", 2, 7, 11], ["CHR", 1, "shared", [2]], ["CA", 2, 3, 12], ["CHR", 0, "shared", [3]], ["CA", 1, 4, 12], ["FU", 9, [0, 1, 2, 3]], ["AN", 9, 0, 5], ["FU", 9, [1, 2, 3, 4]], ["AN", 9, 1, 4], ["FU", 9, [2, 3, 4, 5]], ["AN", 9, 2, 6], ["FU", 3, [0, 1, 2, 3]], ["SP", 3, 0, 24, [4], 1], ["AN", 3, 1, 2], ["FFSP", 3, 0, [5, 4, 3, 2], 1, 1], ["AN", 3, 1, 6], ["FU", 1, [0, 1, 2, 3]], ["SP", 1, 0, 56, [1], 1], ["AN", 1, 1, 2], ["FFSP", 1, 0, [5, 4, 3, 2], 1, 1], ["AN", 1, 1, 6], ["PR", 4, 0, "auto_unroll_max_step$512"]]]], "r": [[1.03499e-05, 1.03069e-05, 1.02937e-05], 0, 21.9531, 1661934894], "v": "v0.6"}
{"i": [["[\"head_conv1x1_bn_swish\", 1, 14, 14, 80, 480, 1, 1, 1]", "cuda -keys=cuda,gpu -max_num_threads=1024 -model=unknown -thread_warp_size=32", [-1, 16, 64, 49152, 2147483647, 1024, 8, 32], "", 0, []], [[], [["CI", 6], ["CI", 4], ["SP", 2, 0, 1, [1, 1, 1, 1], 1], ["SP", 2, 5, 14, [1, 7, 2, 1], 1], ["SP", 2, 10, 14, [1, 1, 1, 1], 1], ["SP", 2, 15, 480, [8, 5, 1, 1], 1], ["SP", 2, 20, 80, [10, 8], 1], ["RE", 2, [0, 5, 10, 15, 1, 6, 11, 16, 2, 7, 12, 17, 20, 21, 3, 8, 13, 18, 22, 4, 9, 14, 19]], ["FSP", 7, 0, 2, 3], ["FSP", 7, 4, 3, 3], ["FSP", 7, 8, 4, 3], ["FSP", 7, 12, 5, 3], ["RE", 7, [0, 4, 8, 12, 1, 5, 9, 13, 2, 6, 10, 14, 3, 7, 11, 15]], ["CA", 2, 7, 11], ["CHR", 1, "shared", [2]], ["CA", 2, 3, 12], ["CHR", 0, "shared", [3]], ["CA", 1, 4, 12], ["FU", 9, [0, 1, 2, 3]], ["AN", 9, 0, 5], ["FU", 9, [1, 2, 3, 4]], ["AN", 9, 1, 4], ["FU", 9, [2, 3, 4, 5]], ["AN", 9, 2, 6], ["FU", 3, [0, 1, 2, 3]], ["SP", 3, 0, 40, [1], 1], ["AN", 3, 1, 2], ["FFSP", 3, 0, [5, 4, 3, 2], 1, 1], ["AN", 3, 1, 6], ["FU", 1, [0, 1, 2, 3]], ["SP", 1, 0, 80, [5], 1], ["AN", 1, 1, 2], ["FFSP", 1, 0, [5, 4, 3, 2], 1, 1], ["AN", 1, 1, 6], ["PR", 4, 0, "auto_unroll_max_step$16"]]]], "r": [[1.57825e-05, 1.57899e-05, 1.57722e-05], 0, 23.9033, 1661934896], "v": "v0.6"}
{"i": [["[\"head_conv1x1_bn_swish\", 1, 14, 14, 80, 480, 1, 1, 1]", "cuda -keys=cuda,gpu -max_num_threads=1024 -model=unknown -thread_warp_size=32", [-1, 16, 64, 49152, 2147483647, 1024, 8, 32], "", 0, []], [[], [["CI", 6], ["CI", 4], ["SP", 2, 0, 1, [1, 1, 1, 1], 1], ["SP", 2, 5, 14, [1, 7, 1, 2], 1], ["SP", 2, 10, 14, [1, 1, 1, 7], 1], ["SP", 2, 15, 480, [2, 16, 5, 3], 1], ["SP", 2, 20, 80, [2, 8], 1], ["RE", 2, [0, 5, 10, 15, 1, 6, 11, 16, 2, 7, 12, 17, 20, 21, 3, 8, 13, 18, 22, 4, 9, 14, 19]], ["FSP", 7, 0, 2, 3], ["FSP", 7, 4, 3, 3], ["FSP", 7, 8, 4, 3], ["FSP", 7, 12, 5, 3], ["RE", 7, [0, 4, 8, 12, 1, 5, 9, 13, 2, 6, 10, 14, 3, 7, 11, 15]], ["CA", 2, 7, 11], ["CHR", 1, "shared", [2]], ["CA", 2, 3, 12], ["CHR", 0, "shared", [3]], ["CA", 1, 4, 12], ["FU", 9, [0, 1, 2, 3]], ["AN", 9, 0, 5], ["FU", 9, [1, 2, 3, 4]], ["AN", 9, 1, 4], ["FU", 9, [2, 3, 4, 5]], ["AN", 9, 2, 6], ["FU", 3, [0, 1, 2, 3]], ["SP", 3, 0, 240, [1], 1], ["AN", 3, 1, 2], ["FFSP", 3, 0, [5, 4, 3, 2], 1, 1], ["AN", 3, 1, 6], ["FU", 1, [0, 1, 2, 3]], ["SP", 1, 0, 224, [1], 1], ["AN", 1, 1, 2], ["FFSP", 1, 0, [5, 4, 3, 2], 1, 1], ["AN", 1, 1, 6], ["PR", 4, 0, "auto_unroll_max_step$64"]]]], "r": [[0.000264966, 0.000264896, 0.000264907], 0, 25.021, 1661934897], "v": "v0.6"}
{"i": [["[\"head_conv1x1_bn_swish\", 1, 14, 14, 80, 480, 1, 1, 1]", "cuda -keys=cuda,gpu -max_num_threads=1024 -model=unknown -thread_warp_size=32", [-1, 16, 64, 49152, 2147483647, 1024, 8, 32], "", 0, []], [[], [["CI", 6], ["CI", 4], ["SP", 2, 0, 1, [1, 1, 1, 1], 1], ["SP", 2, 5, 14, [1, 2, 1, 7], 1], ["SP", 2, 10, 14, [1, 1, 2, 1], 1], ["SP", 2, 15, 480, [1, 16, 1, 3], 1], ["SP", 2, 20, 80, [8, 2], 1], ["RE", 2, [0, 5, 10, 15, 1, 6, 11, 16, 2, 7, 12, 17, 20, 21, 3, 8, 13, 18, 22, 4, 9, 14, 19]], ["FSP", 7, 0, 2, 3], ["FSP", 7, 4, 3, 3], ["FSP", 7, 8, 4, 3], ["FSP", 7, 12, 5, 3], ["RE", 7, [0, 4, 8, 12, 1, 5, 9, 13, 2, 6, 10, 14, 3, 7, 11, 15]], ["CA", 2, 7, 11], ["CHR", 1, "shared", [2]], ["CA", 2, 3, 12], ["CHR", 0, "shared", [3]], ["CA", 1, 4, 12], ["FU", 9, [0, 1, 2, 3]], ["AN", 9, 0, 5], ["FU", 9, [1, 2, 3, 4]], ["AN", 9, 1, 4], ["FU", 9, [2, 3, 4, 5]], ["AN", 9, 2, 6], ["FU", 3, [0, 1, 2, 3]], ["SP", 3, 0, 24, [1], 1], ["AN", 3, 1, 2], ["FFSP", 3, 0, [5, 4, 3, 2], 1, 1], ["AN", 3, 1, 6], ["FU", 1, [0, 1, 2, 3]], ["SP", 1, 0, 56, [2], 1], ["AN", 1, 1, 2], ["FFSP", 1, 0, [5, 4, 3, 2], 1, 1], ["AN", 1, 1, 6], ["PR", 4, 0, "auto_unroll_max_step$512"]]]], "r": [[1.51852e-05, 1.51944e-05, 1.5187e-05], 0, 25.2764, 1661934898], "v": "v0.6"}
{"i": [["[\"head_conv1x1_bn_swish\", 1, 14, 14, 80, 480, 1, 1, 1]", "cuda -keys=cuda,gpu -max_num_threads=1024 -model=unknown -thread_warp_size=32", [-1, 16, 64, 49152, 2147483647, 1024, 8, 32], "", 0, []], [[], [["CI", 6], ["CI", 4], ["SP", 2, 0, 1, [1, 1, 1, 1], 1], ["SP", 2, 5, 14, [1, 1, 1, 7], 1], ["SP", 2, 10, 14, [1, 7, 1, 2], 1], ["SP", 2, 15, 480, [1, 15, 1, 4], 1], ["SP", 2, 20, 80, [5, 1], 1], ["RE", 2, [0, 5, 10, 15, 1, 6, 11, 16, 2, 7, 12, 17, 20, 21, 3, 8, 13, 18, 22, 4, 9, 14, 19]], ["FSP", 7, 0, 2, 3], ["FSP", 7, 4, 3, 3], ["FSP", 7, 8, 4, 3], ["FSP", 7, 12, 5, 3], ["RE", 7, [0, 4, 8, 12, 1, 5, 9, 13, 2, 6, 10, 14, 3, 7, 11, 15]], ["CA", 2, 7, 11], ["CHR", 1, "shared", [2]], ["CA", 2, 3, 12], ["CHR", 0, "shared", [3]], ["CA", 1, 4, 12], ["FU", 9, [0, 1, 2, 3]], ["AN", 9, 0, 5], ["FU", 9, [1, 2, 3, 4]], ["AN", 9, 1, 4], ["FU", 9, [2, 3, 4, 5]], ["AN", 9, 2, 6], ["FU", 3, [0, 1, 2, 3]], ["SP", 3, 0, 160, [1], 1], ["AN", 3, 1, 2], ["FFSP", 3, 0, [5, 4, 3, 2], 1, 1], ["AN", 3, 1, 6], ["FU", 1, [0, 1, 2, 3]], ["SP", 1, 0, 70, [1], 1], ["AN", 1, 1, 2], ["FFSP", 1, 0, [5, 4, 3, 2], 1, 1], ["AN", 1, 1, 6], ["PR", 4, 0, "auto_unroll_max_step$0"]]]], "r": [[2.46537e-05, 2.46571e-05, 2.46723e-05], 0, 25.4479, 1661934898], "v": "v0.6"}
{"i": [["[\"head_conv1x1_bn_swish\", 1, 14, 14, 80, 480, 1, 1, 1]", "cuda -keys=cuda,gpu -max_num_threads=1024 -model=unknown -thread_warp_size=32", [-1, 16, 64, 49152, 2147483647, 1024, 8, 32], "", 0, []], [[], [["CI", 6], ["CI", 4], ["SP", 2, 0, 1, [1, 1, 1, 1], 1], ["SP", 2, 5, 14, [1, 7, 1, 1], 1], ["SP", 2, 10, 14, [1, 1, 1, 14], 1], ["SP", 2, 15, 480, [2, 10, 2, 2], 1], ["SP", 2, 20, 80, [5, 1], 1], ["RE", 2, [0, 5, 10, 15, 1, 6, 11, 16, 2, 7, 12, 17, 20, 21, 3, 8, 13, 18, 22, 4, 9, 14, 19]], ["FSP", 7, 0, 2, 3], ["FSP", 7, 4, 3, 3], ["FSP", 7, 8, 4, 3], ["FSP", 7, 12, 5, 3], ["RE", 7, [0, 4, 8, 12, 1, 5, 9, 13, 2, 6, 10, 14, 3, 7, 11, 15]], ["CA", 2, 7, 11], ["CHR", 1, "shared", [2]], ["CA", 2, 3, 12], ["CHR", 0, "shared", [3]], ["CA", 1, 4, 12], ["FU", 9, [0, 1, 2, 3]], ["AN", 9, 0, 5], ["FU", 9, [1, 2, 3, 4]], ["AN", 9, 1, 4], ["FU", 9, [2, 3, 4, 5]], ["AN", 9, 2, 6], ["FU", 3, [0, 1, 2, 3]], ["SP", 3, 0, 160, [1], 1], ["AN", 3, 1, 2], ["FFSP", 3, 0, [5, 4, 3, 2], 1, 1], ["AN", 3, 1, 6], ["FU", 1, [0, 1, 2, 3]], ["SP", 1, 0, 560, [10], 1], ["AN", 1, 1, 2], ["FFSP", 1, 0, [5, 4, 3, 2], 1, 1], ["AN", 1, 1, 6], ["PR", 4, 0, "auto_unroll_max_step$16"]]]], "r": [[4.25845e-05, 4.25812e-05, 4.25742e-05], 0, 25.9779, 1661934899], "v": "v0.6"}
{"i": [["[\"head_conv1x1_bn_swish\", 1, 14, 14, 80, 480, 1, 1, 1]", "cuda -keys=cuda,gpu -max_num_threads=1024 -model=unknown -thread_warp_size=32", [-1, 16, 64, 49152, 2147483647, 1024, 8, 32], "", 0, []], [[], [["CI", 6], ["CI", 4], ["SP", 2, 0, 1, [1, 1, 1, 1], 1], ["SP", 2, 5, 14, [1, 1, 1, 7], 1], ["SP", 2, 10, 14, [1, 7, 1, 1], 1], ["SP", 2, 15, 480, [4, 6, 1, 2], 1], ["SP", 2, 20, 80, [1, 4], 1], ["RE", 2, [0, 5, 10, 15, 1, 6, 11, 16, 2, 7, 12, 17, 20, 21, 3, 8, 13, 18, 22, 4, 9, 14, 19]], ["FSP", 7, 0, 2, 3], ["FSP", 7, 4, 3, 3], ["FSP", 7, 8, 4, 3], ["FSP", 7, 12, 5, 3], ["RE", 7, [0, 4, 8, 12, 1, 5, 9, 13, 2, 6, 10, 14, 3, 7, 11, 15]], ["CA", 2, 7, 11], ["CHR", 1, "shared", [2]], ["CA", 2, 3, 12], ["CHR", 0, "shared", [3]], ["CA", 1, 4, 12], ["FU", 9, [0, 1, 2, 3]], ["AN", 9, 0, 5], ["FU", 9, [1, 2, 3, 4]], ["AN", 9, 1, 4], ["FU", 9, [2, 3, 4, 5]], ["AN", 9, 2, 6], ["FU", 3, [0, 1, 2, 3]], ["SP", 3, 0, 16, [2], 1], ["AN", 3, 1, 2], ["FFSP", 3, 0, [5, 4, 3, 2], 1, 1], ["AN", 3, 1, 6], ["FU", 1, [0, 1, 2, 3]], ["SP", 1, 0, 56, [1], 1], ["AN", 1, 1, 2], ["FFSP", 1, 0, [5, 4, 3, 2], 1, 1], ["AN", 1, 1, 6], ["PR", 4, 0, "auto_unroll_max_step$64"]]]], "r": [[2.15835e-05, 2.15876e-05, 2.15881e-05], 0, 26.5836, 1661934899], "v": "v0.6"}
{"i": [["[\"head_conv1x1_bn_swish\", 1, 14, 14, 80, 480, 1, 1, 1]", "cuda -keys=cuda,gpu -max_num_threads=1024 -model=unknown -thread_warp_size=32", [-1, 16, 64, 49152, 2147483647, 1024, 8, 32], "", 0, []], [[], [["CI", 6], ["CI", 4], ["SP", 2, 0, 1, [1, 1, 1, 1], 1], ["SP", 2, 5, 14, [1, 7, 1, 2], 1], ["SP", 2, 10, 14, [1, 7, 2, 1], 1], ["SP", 2, 15, 480, [1, 2, 4, 10], 1], ["SP", 2, 20, 80, [8, 2], 1], ["RE", 2, [0, 5, 10, 15, 1, 6, 11, 16, 2, 7, 12, 17, 20, 21, 3, 8, 13, 18, 22, 4, 9, 14, 19]], ["FSP", 7, 0, 2, 3], ["FSP", 7, 4, 3, 3], ["FSP", 7, 8, 4, 3], ["FSP", 7, 12, 5, 3], ["RE", 7, [0, 4, 8, 12, 1, 5, 9, 13, 2, 6, 10, 14, 3, 7, 11, 15]], ["CA", 2, 7, 11], ["CHR", 1, "shared", [2]], ["CA", 2, 3, 12], ["CHR", 0, "shared", [3]], ["CA", 1, 4, 12], ["FU", 9, [0, 1, 2, 3]], ["AN", 9, 0, 5], ["FU", 9, [1, 2, 3, 4]], ["AN", 9, 1, 4], ["FU", 9, [2, 3, 4, 5]], ["AN", 9, 2, 6], ["FU", 3, [0, 1, 2, 3]], ["SP", 3, 0, 640, [1], 1], ["AN", 3, 1, 2], ["FFSP", 3, 0, [5, 4, 3, 2], 1, 1], ["AN", 3, 1, 6], ["FU", 1, [0, 1, 2, 3]], ["SP", 1, 0, 64, [1], 1], ["AN", 1, 1, 2], ["FFSP", 1, 0, [5, 4, 3, 2], 1, 1], ["AN", 1, 1, 6], ["PR", 4, 0, "auto_unroll_max_step$1024"]]]], "r": [[6.2136e-05, 6.21312e-05, 6.21243e-05], 0, 28.3496, 1661934900], "v": "v0.6"}
{"i": [["[\"head_conv1x1_bn_swish\", 1, 14, 14, 80, 480, 1, 1, 1]", "cuda -keys=cuda,gpu -max_num_threads=1024 -model=unknown -thread_warp_size=32", [-1, 16, 64, 49152, 2147483647, 1024, 8, 32], "", 0, []], [[], [["CI", 6], ["CI", 4], ["SP", 2, 0, 1, [1, 1, 1, 1], 1], ["SP", 2, 5, 14, [2, 7, 1, 1], 1], ["SP", 2, 10, 14, [1, 1, 1, 14], 1], ["SP", 2, 15, 480, [2, 6, 1, 20], 1], ["SP", 2, 20, 80, [2, 1], 1], ["RE", 2, [0, 5, 10, 15, 1, 6, 11, 16, 2, 7, 12, 17, 20, 21, 3, 8, 13, 18, 22, 4, 9, 14, 19]], ["FSP", 7, 0, 2, 3], ["FSP", 7, 4, 3, 3], ["FSP", 7, 8, 4, 3], ["FSP", 7, 12, 5, 3], ["RE", 7, [0, 4, 8, 12, 1, 5, 9, 13, 2, 6, 10, 14, 3, 7, 11, 15]], ["CA", 2, 7, 11], ["CHR", 1, "shared", [2]], ["CA", 2, 3, 12], ["CHR", 0, "shared", [3]], ["CA", 1, 4, 12], ["FU", 9, [0, 1, 2, 3]], ["AN", 9, 0, 5], ["FU", 9, [1, 2, 3, 4]], ["AN", 9, 1, 4], ["FU", 9, [2, 3, 4, 5]], ["AN", 9, 2, 6], ["FU", 3, [0, 1, 2, 3]], ["SP", 3, 0, 40, [20], 1], ["AN", 3, 1, 2], ["FFSP", 3, 0, [5, 4, 3, 2], 1, 1], ["AN", 3, 1, 6], ["FU", 1, [0, 1, 2, 3]], ["SP", 1, 0, 28, [1], 1], ["AN", 1, 1, 2], ["FFSP", 1, 0, [5, 4, 3, 2], 1, 1], ["AN", 1, 1, 6], ["PR", 4, 0, "auto_unroll_max_step$16"]]]], "r": [[0.00112861, 0.00112832, 0.00112838], 0, 17.8866, 1661934890], "v": "v0.6"}
{"i": [["[\"head_conv1x1_bn_swish\", 1, 14, 14, 80, 480, 1, 1, 1]", "cuda -keys=cuda,gpu -max_num_threads=1024 -model=unknown -thread_warp_size=32", [-1, 16, 64, 49152, 2147483647, 1024, 8, 32], "", 0, []], [[], [["CI", 6], ["CI", 4], ["SP", 2, 0, 1, [1, 1, 1, 1], 1], ["SP", 2, 5, 14, [1, 1, 2, 7], 1], ["SP", 2, 10, 14, [2, 7, 1, 1], 1], ["SP", 2, 15, 480, [1, 5, 48, 1], 1], ["SP", 2, 20, 80, [5, 1], 1], ["RE", 2, [0, 5, 10, 15, 1, 6, 11, 16, 2, 7, 12, 17, 20, 21, 3, 8, 13, 18, 22, 4, 9, 14, 19]], ["FSP", 7, 0, 2, 3], ["FSP", 7, 4, 3, 3], ["FSP", 7, 8, 4, 3], ["FSP", 7, 12, 5, 3], ["RE", 7, [0, 4, 8, 12, 1, 5, 9, 13, 2, 6, 10, 14, 3, 7, 11, 15]], ["CA", 2, 7, 11], ["CHR", 1, "shared", [2]], ["CA", 2, 3, 12], ["CHR", 0, "shared", [3]], ["CA", 1, 4, 12], ["FU", 9, [0, 1, 2, 3]], ["AN", 9, 0, 5], ["FU", 9, [1, 2, 3, 4]], ["AN", 9, 1, 4], ["FU", 9, [2, 3, 4, 5]], ["AN", 9, 2, 6], ["FU", 3, [0, 1, 2, 3]], ["SP", 3, 0, 15, [1], 1], ["AN", 3, 1, 2], ["FFSP", 3, 0, [5, 4, 3, 2], 1, 1], ["AN", 3, 1, 6], ["FU", 1, [0, 1, 2, 3]], ["SP", 1, 0, 70, [1], 1], ["AN", 1, 1, 2], ["FFSP", 1, 0, [5, 4, 3, 2], 1, 1], ["AN", 1, 1, 6], ["PR", 4, 0, "auto_unroll_max_step$16"]]]], "r": [[0.00158354, 0.00158515, 0.00158536], 0, 29.09, 1661934901], "v": "v0.6"}
{"i": [["[\"head_conv1x1_bn_swish\", 1, 14, 14, 80, 480, 1, 1, 1]", "cuda -keys=cuda,gpu -max_num_threads=1024 -model=unknown -thread_warp_size=32", [-1, 16, 64, 49152, 2147483647, 1024, 8, 32], "", 0, []], [[], [["CI", 6], ["CI", 4], ["SP", 2, 0, 1, [1, 1, 1, 1], 1], ["SP", 2, 5, 14, [1, 7, 1, 1], 1], ["SP", 2, 10, 14, [1, 1, 1, 2], 1], ["SP", 2, 15, 480, [2, 48, 1, 5], 1], ["SP", 2, 20, 80, [8, 1], 1], ["RE", 2, [0, 5, 10, 15, 1, 6, 11, 16, 2, 7, 12, 17, 20, 21, 3, 8, 13, 18, 22, 4, 9, 14, 19]], ["FSP", 7, 0, 2, 3], ["FSP", 7, 4, 3, 3], ["FSP", 7, 8, 4, 3], ["FSP", 7, 12, 5, 3], ["RE", 7, [0, 4, 8, 12, 1, 5, 9, 13, 2, 6, 10, 14, 3, 7, 11, 15]], ["CA", 2, 7, 11], ["CHR", 1, "shared", [2]], ["CA", 2, 3, 12], ["CHR", 0, "shared", [3]], ["CA", 1, 4, 12], ["FU", 9, [0, 1, 2, 3]], ["AN", 9, 0, 5], ["FU", 9, [1, 2, 3, 4]], ["AN", 9, 1, 4], ["FU", 9, [2, 3, 4, 5]], ["AN", 9, 2, 6], ["FU", 3, [0, 1, 2, 3]], ["SP", 3, 0, 40, [1], 1], ["AN", 3, 1, 2], ["FFSP", 3, 0, [5, 4, 3, 2], 1, 1], ["AN", 3, 1, 6], ["FU", 1, [0, 1, 2, 3]], ["SP", 1, 0, 32, [1], 1], ["AN", 1, 1, 2], ["FFSP", 1, 0, [5, 4, 3, 2], 1, 1], ["AN", 1, 1, 6], ["PR", 4, 0, "auto_unroll_max_step$16"]]]], "r": [[2.11089e-05, 2.11023e-05, 2.10956e-05], 0, 28.0742, 1661934901], "v": "v0.6"}
{"i": [["[\"head_conv1x1_bn_swish\", 1, 14, 14, 80, 480, 1, 1, 1]", "cuda -keys=cuda,gpu -max_num_threads=1024 -model=unknown -thread_warp_size=32", [-1, 16, 64, 49152, 2147483647, 1024, 8, 32], "", 0, []], [[], [["CI", 6], ["CI", 4], ["SP", 2, 0, 1, [1, 1, 1, 1], 1], ["SP", 2, 5, 14, [7, 1, 2, 1], 1], ["SP", 2, 10, 14, [1, 2, 1, 7], 1], ["SP", 2, 15, 480, [1, 96, 1, 1], 1], ["SP", 2, 20, 80, [2, 1], 1], ["RE", 2, [0, 5, 10, 15, 1, 6, 11, 16, 2, 7, 12, 17, 20, 21, 3, 8, 13, 18, 22, 4, 9, 14, 19]], ["FSP", 7, 0, 2, 3], ["FSP", 7, 4, 3, 3], ["FSP", 7, 8, 4, 3], ["FSP", 7, 12, 5, 3], ["RE", 7, [0, 4, 8, 12, 1, 5, 9, 13, 2, 6, 10, 14, 3, 7, 11, 15]], ["CA", 2, 7, 11], ["CHR", 1, "shared", [2]], ["CA", 2, 3, 12], ["CHR", 0, "shared", [3]], ["CA", 1, 4, 12], ["FU", 9, [0, 1, 2, 3]], ["AN", 9, 0, 5], ["FU", 9, [1, 2, 3, 4]], ["AN", 9, 1, 4], ["FU", 9, [2, 3, 4, 5]], ["AN", 9, 2, 6], ["FU", 3, [0, 1, 2, 3]], ["SP", 3, 0, 2, [1], 1], ["AN", 3, 1, 2], ["FFSP", 3, 0, [5, 4, 3, 2], 1, 1], ["AN", 3, 1, 6], ["FU", 1, [0, 1, 2, 3]], ["SP", 1, 0, 28, [1], 1], ["AN", 1, 1, 2], ["FFSP", 1, 0, [5, 4, 3, 2], 1, 1], ["AN", 1, 1, 6], ["PR", 4, 0, "auto_unroll_max_step$512"]]]], "r": [[5.09537e-05, 5.09595e-05, 5.09593e-05], 0, 28.6241, 1661934902], "v": "v0.6"}
{"i": [["[\"head_conv1x1_bn_swish\", 1, 14, 14, 80, 480, 1, 1, 1]", "cuda -keys=cuda,gpu -max_num_threads=1024 -model=unknown -thread_warp_size=32", [-1, 16, 64, 49152, 2147483647, 1024, 8, 32], "", 0, []], [[], [["CI", 6], ["CI", 4], ["SP", 2, 0, 1, [1, 1, 1, 1], 1], ["SP", 2, 5, 14, [1, 2, 1, 1], 1], ["SP", 2, 10, 14, [1, 1, 1, 1], 1], ["SP", 2, 15, 480, [1, 30, 1, 16], 1], ["SP", 2, 20, 80, [4, 1], 1], ["RE", 2, [0, 5, 10, 15, 1, 6, 11, 16, 2, 7, 12, 17, 20, 21, 3, 8, 13, 18, 22, 4, 9, 14, 19]], ["FSP", 7, 0, 2, 3], ["FSP", 7, 4, 3, 3], ["FSP", 7, 8, 4, 3], ["FSP", 7, 12, 5, 3], ["RE", 7, [0, 4, 8, 12, 1, 5, 9, 13, 2, 6, 10, 14, 3, 7, 11, 15]], ["CA", 2, 7, 11], ["CHR", 1, "shared", [2]], ["CA", 2, 3, 12], ["CHR", 0, "shared", [3]], ["CA", 1, 4, 12], ["FU", 9, [0, 1, 2, 3]], ["AN", 9, 0, 5], ["FU", 9, [1, 2, 3, 4]], ["AN", 9, 1, 4], ["FU", 9, [2, 3, 4, 5]], ["AN", 9, 2, 6], ["FU", 3, [0, 1, 2, 3]], ["SP", 3, 0, 16, [2], 1], ["AN", 3, 1, 2], ["FFSP", 3, 0, [5, 4, 3, 2], 1, 1], ["AN", 3, 1, 6], ["FU", 1, [0, 1, 2, 3]], ["SP", 1, 0, 1, [1], 1], ["AN", 1, 1, 2], ["FFSP", 1, 0, [5, 4, 3, 2], 1, 1], ["AN", 1, 1, 6], ["PR", 4, 0, "auto_unroll_max_step$512"]]]], "r": [[2.68869e-05, 2.68742e-05, 2.68681e-05], 0, 28.1313, 1661934903], "v": "v0.6"}
{"i": [["[\"head_conv1x1_bn_swish\", 1, 14, 14, 80, 480, 1, 1, 1]", "cuda -keys=cuda,gpu -max_num_threads=1024 -model=unknown -thread_warp_size=32", [-1, 16, 64, 49152, 2147483647, 1024, 8, 32], "", 0, []], [[], [["CI", 6], ["CI", 4], ["SP", 2, 0, 1, [1, 1, 1, 1], 1], ["SP", 2, 5, 14, [1, 1, 7, 1], 1], ["SP", 2, 10, 14, [1, 2, 1, 7], 1], ["SP", 2, 15, 480, [2, 30, 1, 2], 1], ["SP", 2, 20, 80, [2, 1], 1], ["RE", 2, [0, 5, 10, 15, 1, 6, 11, 16, 2, 7, 12, 17, 20, 21, 3, 8, 13, 18, 22, 4, 9, 14, 19]], ["FSP", 7, 0, 2, 3], ["FSP", 7, 4, 3, 3], ["FSP", 7, 8, 4, 3], ["FSP", 7, 12, 5, 3], ["RE", 7, [0, 4, 8, 12, 1, 5, 9, 13, 2, 6, 10, 14, 3, 7, 11, 15]], ["CA", 2, 7, 11], ["CHR", 1, "shared", [2]], ["CA", 2, 3, 12], ["CHR", 0, "shared", [3]], ["CA", 1, 4, 12], ["FU", 9, [0, 1, 2, 3]], ["AN", 9, 0, 5], ["FU", 9, [1, 2, 3, 4]], ["AN", 9, 1, 4], ["FU", 9, [2, 3, 4, 5]], ["AN", 9, 2, 6], ["FU", 3, [0, 1, 2, 3]], ["SP", 3, 0, 4, [1], 1], ["AN", 3, 1, 2], ["FFSP", 3, 0, [5, 4, 3, 2], 1, 1], ["AN", 3, 1, 6], ["FU", 1, [0, 1, 2, 3]], ["SP", 1, 0, 98, [1], 1], ["AN", 1, 1, 2], ["FFSP", 1, 0, [5, 4, 3, 2], 1, 1], ["AN", 1, 1, 6], ["PR", 4, 0, "auto_unroll_max_step$16"]]]], "r": [[6.33316e-05, 6.33377e-05, 6.33673e-05], 0, 28.1522, 1661934903], "v": "v0.6"}
{"i": [["[\"head_conv1x1_bn_swish\", 1, 14, 14, 80, 480, 1, 1, 1]", "cuda -keys=cuda,gpu -max_num_threads=1024 -model=unknown -thread_warp_size=32", [-1, 16, 64, 49152, 2147483647, 1024, 8, 32], "", 0, []], [[], [["CI", 6], ["CI", 4], ["SP", 2, 0, 1, [1, 1, 1, 1], 1], ["SP", 2, 5, 14, [1, 2, 1, 1], 1], ["SP", 2, 10, 14, [2, 7, 1, 1], 1], ["SP", 2, 15, 480, [1, 16, 3, 1], 1], ["SP", 2, 20, 80, [8, 1], 1], ["RE", 2, [0, 5, 10, 15, 1, 6, 11, 16, 2, 7, 12, 17, 20, 21, 3, 8, 13, 18, 22, 4, 9, 14, 19]], ["FSP", 7, 0, 2, 3], ["FSP", 7, 4, 3, 3], ["FSP", 7, 8, 4, 3], ["FSP", 7, 12, 5, 3], ["RE", 7, [0, 4, 8, 12, 1, 5, 9, 13, 2, 6, 10, 14, 3, 7, 11, 15]], ["CA", 2, 7, 11], ["CHR", 1, "shared", [2]], ["CA", 2, 3, 12], ["CHR", 0, "shared", [3]], ["CA", 1, 4, 12], ["FU", 9, [0, 1, 2, 3]], ["AN", 9, 0, 5], ["FU", 9, [1, 2, 3, 4]], ["AN", 9, 1, 4], ["FU", 9, [2, 3, 4, 5]], ["AN", 9, 2, 6], ["FU", 3, [0, 1, 2, 3]], ["SP", 3, 0, 24, [1], 1], ["AN", 3, 1, 2], ["FFSP", 3, 0, [5, 4, 3, 2], 1, 1], ["AN", 3, 1, 6], ["FU", 1, [0, 1, 2, 3]], ["SP", 1, 0, 16, [16], 1], ["AN", 1, 1, 2], ["FFSP", 1, 0, [5, 4, 3, 2], 1, 1], ["AN", 1, 1, 6], ["PR", 4, 0, "auto_unroll_max_step$512"]]]], "r": [[1.19591e-05, 1.19675e-05, 1.19663e-05], 0, 28.0092, 1661934904], "v": "v0.6"}
{"i": [["[\"head_conv1x1_bn_swish\", 1, 14, 14, 80, 480, 1, 1, 1]", "cuda -keys=cuda,gpu -max_num_threads=1024 -model=unknown -thread_warp_size=32", [-1, 16, 64, 49152, 2147483647, 1024, 8, 32], "", 0, []], [[], [["CI", 6], ["CI", 4], ["SP", 2, 0, 1, [1, 1, 1, 1], 1], ["SP", 2, 5, 14, [2, 1, 1, 1], 1], ["SP", 2, 10, 14, [2, 1, 1, 1], 1], ["SP", 2, 15, 480, [1, 32, 3, 5], 1], ["SP", 2, 20, 80, [2, 1], 1], ["RE", 2, [0, 5, 10, 15, 1, 6, 11, 16, 2, 7, 12, 17, 20, 21, 3, 8, 13, 18, 22, 4, 9, 14, 19]], ["FSP", 7, 0, 2, 3], ["FSP", 7, 4, 3, 3], ["FSP", 7, 8, 4, 3], ["FSP", 7, 12, 5, 3], ["RE", 7, [0, 4, 8, 12, 1, 5, 9, 13, 2, 6, 10, 14, 3, 7, 11, 15]], ["CA", 2, 7, 11], ["CHR", 1, "shared", [2]], ["CA", 2, 3, 12], ["CHR", 0, "shared", [3]], ["CA", 1, 4, 12], ["FU", 9, [0, 1, 2, 3]], ["AN", 9, 0, 5], ["FU", 9, [1, 2, 3, 4]], ["AN", 9, 1, 4], ["FU", 9, [2, 3, 4, 5]], ["AN", 9, 2, 6], ["FU", 3, [0, 1, 2, 3]], ["SP", 3, 0, 150, [1], 1], ["AN", 3, 1, 2], ["FFSP", 3, 0, [5, 4, 3, 2], 1, 1], ["AN", 3, 1, 6], ["FU", 1, [0, 1, 2, 3]], ["SP", 1, 0, 10, [5], 1], ["AN", 1, 1, 2], ["FFSP", 1, 0, [5, 4, 3, 2], 1, 1], ["AN", 1, 1, 6], ["PR", 4, 0, "auto_unroll_max_step$0"]]]], "r": [[4.5105e-05, 4.51138e-05, 4.50596e-05], 0, 27.9583, 1661934904], "v": "v0.6"}
{"i": [["[\"head_conv1x1_bn_swish\", 1, 14, 14, 80, 480, 1, 1, 1]", "cuda -keys=cuda,gpu -max_num_threads=1024 -model=unknown -thread_warp_size=32", [-1, 16, 64, 49152, 2147483647, 1024, 8, 32], "", 0, []], [[], [["CI", 6], ["CI", 4], ["SP", 2, 0, 1, [1, 1, 1, 1], 1], ["SP", 2, 5, 14, [1, 2, 1, 1], 1], ["SP", 2, 10, 14, [1, 7, 1, 2], 1], ["SP", 2, 15, 480, [3, 5, 4, 8], 1], ["SP", 2, 20, 80, [4, 1], 1], ["RE", 2, [0, 5, 10, 15, 1, 6, 11, 16, 2, 7, 12, 17, 20, 21, 3, 8, 13, 18, 22, 4, 9, 14, 19]], ["FSP", 7, 0, 2, 3], ["FSP", 7, 4, 3, 3], ["FSP", 7, 8, 4, 3], ["FSP", 7, 12, 5, 3], ["RE", 7, [0, 4, 8, 12, 1, 5, 9, 13, 2, 6, 10, 14, 3, 7, 11, 15]], ["CA", 2, 7, 11], ["CHR", 1, "shared", [2]], ["CA", 2, 3, 12], ["CHR", 0, "shared", [3]], ["CA", 1, 4, 12], ["FU", 9, [0, 1, 2, 3]], ["AN", 9, 0, 5], ["FU", 9, [1, 2, 3, 4]], ["AN", 9, 1, 4], ["FU", 9, [2, 3, 4, 5]], ["AN", 9, 2, 6], ["FU", 3, [0, 1, 2, 3]], ["SP", 3, 0, 128, [32], 1], ["AN", 3, 1, 2], ["FFSP", 3, 0, [5, 4, 3, 2], 1, 1], ["AN", 3, 1, 6], ["FU", 1, [0, 1, 2, 3]], ["SP", 1, 0, 8, [1], 1], ["AN", 1, 1, 2], ["FFSP", 1, 0, [5, 4, 3, 2], 1, 1], ["AN", 1, 1, 6], ["PR", 4, 0, "auto_unroll_max_step$64"]]]], "r": [[0.000154692, 0.000154737, 0.000154718], 0, 28.1335, 1661934905], "v": "v0.6"}
{"i": [["[\"head_conv1x1_bn_swish\", 1, 14, 14, 80, 480, 1, 1, 1]", "cuda -keys=cuda,gpu -max_num_threads=1024 -model=unknown -thread_warp_size=32", [-1, 16, 64, 49152, 2147483647, 1024, 8, 32], "", 0, []], [[], [["CI", 6], ["CI", 4], ["SP", 2, 0, 1, [1, 1, 1, 1], 1], ["SP", 2, 5, 14, [1, 1, 14, 1], 1], ["SP", 2, 10, 14, [1, 1, 1, 2], 1], ["SP", 2, 15, 480, [1, 40, 1, 6], 1], ["SP", 2, 20, 80, [4, 5], 1], ["RE", 2, [0, 5, 10, 15, 1, 6, 11, 16, 2, 7, 12, 17, 20, 21, 3, 8, 13, 18, 22, 4, 9, 14, 19]], ["FSP", 7, 0, 2, 3], ["FSP", 7, 4, 3, 3], ["FSP", 7, 8, 4, 3], ["FSP", 7, 12, 5, 3], ["RE", 7, [0, 4, 8, 12, 1, 5, 9, 13, 2, 6, 10, 14, 3, 7, 11, 15]], ["CA", 2, 7, 11], ["CHR", 1, "shared", [2]], ["CA", 2, 3, 12], ["CHR", 0, "shared", [3]], ["CA", 1, 4, 12], ["FU", 9, [0, 1, 2, 3]], ["AN", 9, 0, 5], ["FU", 9, [1, 2, 3, 4]], ["AN", 9, 1, 4], ["FU", 9, [2, 3, 4, 5]], ["AN", 9, 2, 6], ["FU", 3, [0, 1, 2, 3]], ["SP", 3, 0, 120, [1], 1], ["AN", 3, 1, 2], ["FFSP", 3, 0, [5, 4, 3, 2], 1, 1], ["AN", 3, 1, 6], ["FU", 1, [0, 1, 2, 3]], ["SP", 1, 0, 560, [1], 1], ["AN", 1, 1, 2], ["FFSP", 1, 0, [5, 4, 3, 2], 1, 1], ["AN", 1, 1, 6], ["PR", 4, 0, "auto_unroll_max_step$1024"]]]], "r": [[6.40996e-05, 6.41222e-05, 6.41342e-05], 0, 30.1316, 1661934906], "v": "v0.6"}
{"i": [["[\"head_conv1x1_bn_swish\", 1, 14, 14, 80, 480, 1, 1, 1]", "cuda -keys=cuda,gpu -max_num_threads=1024 -model=unknown -thread_warp_size=32", [-1, 16, 64, 49152, 2147483647, 1024, 8, 32], "", 0, []], [[], [["CI", 6], ["CI", 4], ["SP", 2, 0, 1, [1, 1, 1, 1], 1], ["SP", 2, 5, 14, [1, 14, 1, 1], 1], ["SP", 2, 10, 14, [7, 2, 1, 1], 1], ["SP", 2, 15, 480, [1, 2, 1, 40], 1], ["SP", 2, 20, 80, [2, 1], 1], ["RE", 2, [0, 5, 10, 15, 1, 6, 11, 16, 2, 7, 12, 17, 20, 21, 3, 8, 13, 18, 22, 4, 9, 14, 19]], ["FSP", 7, 0, 2, 3], ["FSP", 7, 4, 3, 3], ["FSP", 7, 8, 4, 3], ["FSP", 7, 12, 5, 3], ["RE", 7, [0, 4, 8, 12, 1, 5, 9, 13, 2, 6, 10, 14, 3, 7, 11, 15]], ["CA", 2, 7, 11], ["CHR", 1, "shared", [2]], ["CA", 2, 3, 12], ["CHR", 0, "shared", [3]], ["CA", 1, 4, 12], ["FU", 9, [0, 1, 2, 3]], ["AN", 9, 0, 5], ["FU", 9, [1, 2, 3, 4]], ["AN", 9, 1, 4], ["FU", 9, [2, 3, 4, 5]], ["AN", 9, 2, 6], ["FU", 3, [0, 1, 2, 3]], ["SP", 3, 0, 80, [1], 1], ["AN", 3, 1, 2], ["FFSP", 3, 0, [5, 4, 3, 2], 1, 1], ["AN", 3, 1, 6], ["FU", 1, [0, 1, 2, 3]], ["SP", 1, 0, 4, [1], 1], ["AN", 1, 1, 2], ["FFSP", 1, 0, [5, 4, 3, 2], 1, 1], ["AN", 1, 1, 6], ["PR", 4, 0, "auto_unroll_max_step$1024"]]]], "r": [[0.000650972, 0.00065191, 0.000651237], 0, 28.6468, 1661934906], "v": "v0.6"}
