python/models/efficientnet/kernel_configs/efficient_swish_shortcut_add_1_14_14_480.log
{"i": [["[\"shortcut_add\", 1, 14, 14, 480]", "cuda -keys=cuda,gpu -max_num_threads=1024 -model=unknown -thread_warp_size=32", [-1, 16, 64, 49152, 2147483647, 1024, 8, 32], "", 0, []], [[], [["FU", 2, [0, 1, 2, 3]], ["SP", 2, 0, 94080, [16], 1], ["AN", 2, 0, 5], ["AN", 2, 1, 6]]]], "r": [[7.03105e-06, 7.03217e-06, 7.03534e-06], 0, 0.666722, 1681133013], "v": "v0.6"}
{"i": [["[\"shortcut_add\", 1, 14, 14, 480]", "cuda -keys=cuda,gpu -max_num_threads=1024 -model=unknown -thread_warp_size=32", [-1, 16, 64, 49152, 2147483647, 1024, 8, 32], "", 0, []], [[], [["FU", 2, [0, 1, 2, 3]], ["SP", 2, 0, 94080, [56], 1], ["AN", 2, 0, 5], ["AN", 2, 1, 6]]]], "r": [[4.35678e-06, 4.33775e-06, 4.43474e-06], 0, 2.27063, 1681133014], "v": "v0.6"}
{"i": [["[\"shortcut_add\", 1, 14, 14, 480]", "cuda -keys=cuda,gpu -max_num_threads=1024 -model=unknown -thread_warp_size=32", [-1, 16, 64, 49152, 2147483647, 1024, 8, 32], "", 0, []], [[], [["FU", 2, [0, 1, 2, 3]], ["SP", 2, 0, 94080, [20], 1], ["AN", 2, 0, 5], ["AN", 2, 1, 6]]]], "r": [[6.2118e-06, 6.21307e-06, 6.2173e-06], 0, 1.12523, 1681133013], "v": "v0.6"}
{"i": [["[\"shortcut_add\", 1, 14, 14, 480]", "cuda -keys=cuda,gpu -max_num_threads=1024 -model=unknown -thread_warp_size=32", [-1, 16, 64, 49152, 2147483647, 1024, 8, 32], "", 0, []], [[], [["FU", 2, [0, 1, 2, 3]], ["SP", 2, 0, 94080, [24], 1], ["AN", 2, 0, 5], ["AN", 2, 1, 6]]]], "r": [[5.60261e-06, 5.59988e-06, 5.60754e-06], 0, 1.48124, 1681133014], "v": "v0.6"}
{"i": [["[\"shortcut_add\", 1, 14, 14, 480]", "cuda -keys=cuda,gpu -max_num_threads=1024 -model=unknown -thread_warp_size=32", [-1, 16, 64, 49152, 2147483647, 1024, 8, 32], "", 0, []], [[], [["FU", 2, [0, 1, 2, 3]], ["SP", 2, 0, 94080, [28], 1], ["AN", 2, 0, 5], ["AN", 2, 1, 6]]]], "r": [[5.20486e-06, 5.21932e-06, 5.27888e-06], 0, 6.08077, 1681133018], "v": "v0.6"}
{"i": [["[\"shortcut_add\", 1, 14, 14, 480]", "cuda -keys=cuda,gpu -max_num_threads=1024 -model=unknown -thread_warp_size=32", [-1, 16, 64, 49152, 2147483647, 1024, 8, 32], "", 0, []], [[], [["FU", 2, [0, 1, 2, 3]], ["SP", 2, 0, 94080, [12], 1], ["AN", 2, 0, 5], ["AN", 2, 1, 6]]]], "r": [[8.4479e-06, 8.45307e-06, 8.44616e-06], 0, 7.35533, 1681133020], "v": "v0.6"}
{"i": [["[\"shortcut_add\", 1, 14, 14, 480]", "cuda -keys=cuda,gpu -max_num_threads=1024 -model=unknown -thread_warp_size=32", [-1, 16, 64, 49152, 2147483647, 1024, 8, 32], "", 0, []], [[], [["FU", 2, [0, 1, 2, 3]], ["SP", 2, 0, 94080, [42], 1], ["AN", 2, 0, 5], ["AN", 2, 1, 6]]]], "r": [[4.66995e-06, 4.49615e-06, 4.93571e-06], 0, 4.09464, 1681133016], "v": "v0.6"}
{"i": [["[\"shortcut_add\", 1, 14, 14, 480]", "cuda -keys=cuda,gpu -max_num_threads=1024 -model=unknown -thread_warp_size=32", [-1, 16, 64, 49152, 2147483647, 1024, 8, 32], "", 0, []], [[], [["FU", 2, [0, 1, 2, 3]], ["SP", 2, 0, 94080, [15], 1], ["AN", 2, 0, 5], ["AN", 2, 1, 6]]]], "r": [[1.6233e-05, 1.59219e-05, 7.26121e-06], 0, 4.92661, 1681133017], "v": "v0.6"}
{"i": [["[\"shortcut_add\", 1, 14, 14, 480]", "cuda -keys=cuda,gpu -max_num_threads=1024 -model=unknown -thread_warp_size=32", [-1, 16, 64, 49152, 2147483647, 1024, 8, 32], "", 0, []], [[], [["FU", 2, [0, 1, 2, 3]], ["SP", 2, 0, 94080, [32], 1], ["AN", 2, 0, 5], ["AN", 2, 1, 6]]]], "r": [[5.43851e-06, 5.48357e-06, 5.61127e-06], 0, 4.46464, 1681133017], "v": "v0.6"}
{"i": [["[\"shortcut_add\", 1, 14, 14, 480]", "cuda -keys=cuda,gpu -max_num_threads=1024 -model=unknown -thread_warp_size=32", [-1, 16, 64, 49152, 2147483647, 1024, 8, 32], "", 0, []], [[], [["FU", 2, [0, 1, 2, 3]], ["SP", 2, 0, 94080, [1], 1], ["AN", 2, 0, 5], ["AN", 2, 1, 6]]]], "r": [[7.25024e-05, 7.25011e-05, 7.24955e-05], 0, 1.82221, 1681133014], "v": "v0.6"}
{"i": [["[\"shortcut_add\", 1, 14, 14, 480]", "cuda -keys=cuda,gpu -max_num_threads=1024 -model=unknown -thread_warp_size=32", [-1, 16, 64, 49152, 2147483647, 1024, 8, 32], "", 0, []], [[], [["FU", 2, [0, 1, 2, 3]], ["SP", 2, 0, 94080, [10], 1], ["AN", 2, 0, 5], ["AN", 2, 1, 6]]]], "r": [[1.15202e-05, 1.15335e-05, 1.13052e-05], 0, 3.60324, 1681133016], "v": "v0.6"}
{"i": [["[\"shortcut_add\", 1, 14, 14, 480]", "cuda -keys=cuda,gpu -max_num_threads=1024 -model=unknown -thread_warp_size=32", [-1, 16, 64, 49152, 2147483647, 1024, 8, 32], "", 0, []], [[], [["FU", 2, [0, 1, 2, 3]], ["SP", 2, 0, 94080, [60], 1], ["AN", 2, 0, 5], ["AN", 2, 1, 6]]]], "r": [[3.8351e-06, 3.83495e-06, 3.83641e-06], 0, 2.70232, 1681133015], "v": "v0.6"}
{"i": [["[\"shortcut_add\", 1, 14, 14, 480]", "cuda -keys=cuda,gpu -max_num_threads=1024 -model=unknown -thread_warp_size=32", [-1, 16, 64, 49152, 2147483647, 1024, 8, 32], "", 0, []], [[], [["FU", 2, [0, 1, 2, 3]], ["SP", 2, 0, 94080, [4], 1], ["AN", 2, 0, 5], ["AN", 2, 1, 6]]]], "r": [[2.02089e-05, 2.36091e-05, 2.31256e-05], 0, 3.2002, 1681133015], "v": "v0.6"}
{"i": [["[\"shortcut_add\", 1, 14, 14, 480]", "cuda -keys=cuda,gpu -max_num_threads=1024 -model=unknown -thread_warp_size=32", [-1, 16, 64, 49152, 2147483647, 1024, 8, 32], "", 0, []], [[], [["FU", 2, [0, 1, 2, 3]], ["SP", 2, 0, 94080, [2], 1], ["AN", 2, 0, 5], ["AN", 2, 1, 6]]]], "r": [[3.75523e-05, 3.75545e-05, 3.75469e-05], 0, 7.73269, 1681133020], "v": "v0.6"}
{"i": [["[\"shortcut_add\", 1, 14, 14, 480]", "cuda -keys=cuda,gpu -max_num_threads=1024 -model=unknown -thread_warp_size=32", [-1, 16, 64, 49152, 2147483647, 1024, 8, 32], "", 0, []], [[], [["FU", 2, [0, 1, 2, 3]], ["SP", 2, 0, 94080, [30], 1], ["AN", 2, 0, 5], ["AN", 2, 1, 6]]]], "r": [[5.12387e-06, 5.13041e-06, 5.13013e-06], 0, 6.93052, 1681133019], "v": "v0.6"}
{"i": [["[\"shortcut_add\", 1, 14, 14, 480]", "cuda -keys=cuda,gpu -max_num_threads=1024 -model=unknown -thread_warp_size=32", [-1, 16, 64, 49152, 2147483647, 1024, 8, 32], "", 0, []], [[], [["FU", 2, [0, 1, 2, 3]], ["SP", 2, 0, 94080, [21], 1], ["AN", 2, 0, 5], ["AN", 2, 1, 6]]]], "r": [[5.97016e-06, 5.97054e-06, 5.97499e-06], 0, 6.4968, 1681133019], "v": "v0.6"}
{"i": [["[\"shortcut_add\", 1, 14, 14, 480]", "cuda -keys=cuda,gpu -max_num_threads=1024 -model=unknown -thread_warp_size=32", [-1, 16, 64, 49152, 2147483647, 1024, 8, 32], "", 0, []], [[], [["FU", 2, [0, 1, 2, 3]], ["SP", 2, 0, 94080, [8], 1], ["AN", 2, 0, 5], ["AN", 2, 1, 6]]]], "r": [[1.14286e-05, 1.14243e-05, 1.14365e-05], 0, 9.81263, 1681133022], "v": "v0.6"}
{"i": [["[\"shortcut_add\", 1, 14, 14, 480]", "cuda -keys=cuda,gpu -max_num_threads=1024 -model=unknown -thread_warp_size=32", [-1, 16, 64, 49152, 2147483647, 1024, 8, 32], "", 0, []], [[], [["FU", 2, [0, 1, 2, 3]], ["SP", 2, 0, 94080, [3], 1], ["AN", 2, 0, 5], ["AN", 2, 1, 6]]]], "r": [[5.71613e-05, 5.56104e-05, 5.55421e-05], 0, 5.53358, 1681133018], "v": "v0.6"}
{"i": [["[\"shortcut_add\", 1, 14, 14, 480]", "cuda -keys=cuda,gpu -max_num_threads=1024 -model=unknown -thread_warp_size=32", [-1, 16, 64, 49152, 2147483647, 1024, 8, 32], "", 0, []], [[], [["FU", 2, [0, 1, 2, 3]], ["SP", 2, 0, 94080, [40], 1], ["AN", 2, 0, 5], ["AN", 2, 1, 6]]]], "r": [[4.54666e-06, 4.55021e-06, 4.55472e-06], 0, 10.2069, 1681133022], "v": "v0.6"}
{"i": [["[\"shortcut_add\", 1, 14, 14, 480]", "cuda -keys=cuda,gpu -max_num_threads=1024 -model=unknown -thread_warp_size=32", [-1, 16, 64, 49152, 2147483647, 1024, 8, 32], "", 0, []], [[], [["FU", 2, [0, 1, 2, 3]], ["SP", 2, 0, 94080, [14], 1], ["AN", 2, 0, 5], ["AN", 2, 1, 6]]]], "r": [[7.68672e-06, 7.6844e-06, 7.68925e-06], 0, 8.98878, 1681133021], "v": "v0.6"}
{"i": [["[\"shortcut_add\", 1, 14, 14, 480]", "cuda -keys=cuda,gpu -max_num_threads=1024 -model=unknown -thread_warp_size=32", [-1, 16, 64, 49152, 2147483647, 1024, 8, 32], "", 0, []], [[], [["FU", 2, [0, 1, 2, 3]], ["SP", 2, 0, 94080, [64], 1], ["AN", 2, 0, 5], ["AN", 2, 1, 6]]]], "r": [[3.91715e-06, 3.92253e-06, 3.9298e-06], 0, 8.13582, 1681133020], "v": "v0.6"}
{"i": [["[\"shortcut_add\", 1, 14, 14, 480]", "cuda -keys=cuda,gpu -max_num_threads=1024 -model=unknown -thread_warp_size=32", [-1, 16, 64, 49152, 2147483647, 1024, 8, 32], "", 0, []], [[], [["FU", 2, [0, 1, 2, 3]], ["SP", 2, 0, 94080, [35], 1], ["AN", 2, 0, 5], ["AN", 2, 1, 6]]]], "r": [[4.63427e-06, 4.64131e-06, 4.63936e-06], 0, 9.39477, 1681133022], "v": "v0.6"}
{"i": [["[\"shortcut_add\", 1, 14, 14, 480]", "cuda -keys=cuda,gpu -max_num_threads=1024 -model=unknown -thread_warp_size=32", [-1, 16, 64, 49152, 2147483647, 1024, 8, 32], "", 0, []], [[], [["FU", 2, [0, 1, 2, 3]], ["SP", 2, 0, 94080, [6], 1], ["AN", 2, 0, 5], ["AN", 2, 1, 6]]]], "r": [[1.45079e-05, 1.45073e-05, 1.45021e-05], 0, 8.58768, 1681133021], "v": "v0.6"}
{"i": [["[\"shortcut_add\", 1, 14, 14, 480]", "cuda -keys=cuda,gpu -max_num_threads=1024 -model=unknown -thread_warp_size=32", [-1, 16, 64, 49152, 2147483647, 1024, 8, 32], "", 0, []], [[], [["FU", 2, [0, 1, 2, 3]], ["SP", 2, 0, 94080, [49], 1], ["AN", 2, 0, 5], ["AN", 2, 1, 6]]]], "r": [[4.09111e-06, 4.09226e-06, 4.0925e-06], 0, 10.6642, 1681133023], "v": "v0.6"}
{"i": [["[\"shortcut_add\", 1, 14, 14, 480]", "cuda -keys=cuda,gpu -max_num_threads=1024 -model=unknown -thread_warp_size=32", [-1, 16, 64, 49152, 2147483647, 1024, 8, 32], "", 0, []], [[], [["FU", 2, [0, 1, 2, 3]], ["SP", 2, 0, 94080, [5], 1], ["AN", 2, 0, 5], ["AN", 2, 1, 6]]]], "r": [[1.68733e-05, 1.68807e-05, 1.68776e-05], 0, 11.4307, 1681133024], "v": "v0.6"}
{"i": [["[\"shortcut_add\", 1, 14, 14, 480]", "cuda -keys=cuda,gpu -max_num_threads=1024 -model=unknown -thread_warp_size=32", [-1, 16, 64, 49152, 2147483647, 1024, 8, 32], "", 0, []], [[], [["FU", 2, [0, 1, 2, 3]], ["SP", 2, 0, 94080, [48], 1], ["AN", 2, 0, 5], ["AN", 2, 1, 6]]]], "r": [[4.21411e-06, 4.21928e-06, 4.21928e-06], 0, 11.8765, 1681133024], "v": "v0.6"}
{"i": [["[\"shortcut_add\", 1, 14, 14, 480]", "cuda -keys=cuda,gpu -max_num_threads=1024 -model=unknown -thread_warp_size=32", [-1, 16, 64, 49152, 2147483647, 1024, 8, 32], "", 0, []], [[], [["FU", 2, [0, 1, 2, 3]], ["SP", 2, 0, 94080, [7], 1], ["AN", 2, 0, 5], ["AN", 2, 1, 6]]]], "r": [[1.27144e-05, 1.27184e-05, 1.27106e-05], 0, 11.0378, 1681133023], "v": "v0.6"}
