python/models/swin_transformer/kernel_configs/swin_transform_auto_tvm_tune_fused_reshape_permute_matmul_tensorcore_1_64_64_4_128.log
{"input": ["cuda -keys=cuda,gpu -max_num_threads=1024 -thread_warp_size=32", "fused_reshape_permute_matmul_tensorcore.cuda", [["TENSOR", [4096, 32, 4], "float16"], ["TENSOR", [128, 128], "float16"]], {}], "config": {"index": 755, "code_hash": null, "entity": [["block_row_warps", "ot", 4], ["block_col_warps", "ot", 4], ["warp_row_tiles", "ot", 4], ["warp_col_tiles", "ot", 1], ["chunk", "ot", 2], ["offset", "ot", 0], ["offsetCS", "ot", 8], ["vec", "ot", 1], ["wmma_m", "ot", 32]]}, "result": [[5.7276415e-05], 0, 1.1138715744018555, 1651824674.503919], "version": 0.2, "tvm_version": "0.8.0"}
{"input": ["cuda -keys=cuda,gpu -max_num_threads=1024 -thread_warp_size=32", "fused_reshape_permute_matmul_tensorcore.cuda", [["TENSOR", [4096, 32, 4], "float16"], ["TENSOR", [128, 128], "float16"]], {}], "config": {"index": 7233, "code_hash": null, "entity": [["block_row_warps", "ot", 1], ["block_col_warps", "ot", 4], ["warp_row_tiles", "ot", 4], ["warp_col_tiles", "ot", 1], ["chunk", "ot", 2], ["offset", "ot", 0], ["offsetCS", "ot", 8], ["vec", "ot", 2], ["wmma_m", "ot", 16]]}, "result": [[1.5771775999999998e-05], 0, 0.9280128479003906, 1651824674.9965045], "version": 0.2, "tvm_version": "0.8.0"}
{"input": ["cuda -keys=cuda,gpu -max_num_threads=1024 -thread_warp_size=32", "fused_reshape_permute_matmul_tensorcore.cuda", [["TENSOR", [4096, 32, 4], "float16"], ["TENSOR", [128, 128], "float16"]], {}], "config": {"index": 8082, "code_hash": null, "entity": [["block_row_warps", "ot", 1], ["block_col_warps", "ot", 1], ["warp_row_tiles", "ot", 2], ["warp_col_tiles", "ot", 4], ["chunk", "ot", 8], ["offset", "ot", 0], ["offsetCS", "ot", 0], ["vec", "ot", 4], ["wmma_m", "ot", 16]]}, "result": [[1.4730895000000001e-05], 0, 1.135927677154541, 1651824676.0706964], "version": 0.2, "tvm_version": "0.8.0"}
{"input": ["cuda -keys=cuda,gpu -max_num_threads=1024 -thread_warp_size=32", "fused_reshape_permute_matmul_tensorcore.cuda", [["TENSOR", [4096, 32, 4], "float16"], ["TENSOR", [128, 128], "float16"]], {}], "config": {"index": 1872, "code_hash": null, "entity": [["block_row_warps", "ot", 1], ["block_col_warps", "ot", 1], ["warp_row_tiles", "ot", 2], ["warp_col_tiles", "ot", 1], ["chunk", "ot", 8], ["offset", "ot", 8], ["offsetCS", "ot", 0], ["vec", "ot", 2], ["wmma_m", "ot", 32]]}, "result": [[5.0664089e-05], 0, 1.0640103816986084, 1651824677.2460742], "version": 0.2, "tvm_version": "0.8.0"}
{"input": ["cuda -keys=cuda,gpu -max_num_threads=1024 -thread_warp_size=32", "fused_reshape_permute_matmul_tensorcore.cuda", [["TENSOR", [4096, 32, 4], "float16"], ["TENSOR", [128, 128], "float16"]], {}], "config": {"index": 6730, "code_hash": null, "entity": [["block_row_warps", "ot", 2], ["block_col_warps", "ot", 4], ["warp_row_tiles", "ot", 1], ["warp_col_tiles", "ot", 1], ["chunk", "ot", 8], ["offset", "ot", 0], ["offsetCS", "ot", 0], ["vec", "ot", 2], ["wmma_m", "ot", 16]]}, "result": [[1.5482368e-05], 0, 0.8394713401794434, 1651824678.2661083], "version": 0.2, "tvm_version": "0.8.0"}
{"input": ["cuda -keys=cuda,gpu -max_num_threads=1024 -thread_warp_size=32", "fused_reshape_permute_matmul_tensorcore.cuda", [["TENSOR", [4096, 32, 4], "float16"], ["TENSOR", [128, 128], "float16"]], {}], "config": {"index": 2799, "code_hash": null, "entity": [["block_row_warps", "ot", 1], ["block_col_warps", "ot", 1], ["warp_row_tiles", "ot", 4], ["warp_col_tiles", "ot", 2], ["chunk", "ot", 4], ["offset", "ot", 0], ["offsetCS", "ot", 0], ["vec", "ot", 4], ["wmma_m", "ot", 32]]}, "result": [[2.255363e-05], 0, 0.9408376216888428, 1651824678.8036797], "version": 0.2, "tvm_version": "0.8.0"}
{"input": ["cuda -keys=cuda,gpu -max_num_threads=1024 -thread_warp_size=32", "fused_reshape_permute_matmul_tensorcore.cuda", [["TENSOR", [4096, 32, 4], "float16"], ["TENSOR", [128, 128], "float16"]], {}], "config": {"index": 3510, "code_hash": null, "entity": [["block_row_warps", "ot", 1], ["block_col_warps", "ot", 1], ["warp_row_tiles", "ot", 1], ["warp_col_tiles", "ot", 2], ["chunk", "ot", 8], ["offset", "ot", 0], ["offsetCS", "ot", 8], ["vec", "ot", 4], ["wmma_m", "ot", 32]]}, "result": [[3.4110926e-05], 0, 0.9076197147369385, 1651824680.508064], "version": 0.2, "tvm_version": "0.8.0"}
{"input": ["cuda -keys=cuda,gpu -max_num_threads=1024 -thread_warp_size=32", "fused_reshape_permute_matmul_tensorcore.cuda", [["TENSOR", [4096, 32, 4], "float16"], ["TENSOR", [128, 128], "float16"]], {}], "config": {"index": 13856, "code_hash": null, "entity": [["block_row_warps", "ot", 4], ["block_col_warps", "ot", 2], ["warp_row_tiles", "ot", 1], ["warp_col_tiles", "ot", 1], ["chunk", "ot", 8], ["offset", "ot", 0], ["offsetCS", "ot", 8], ["vec", "ot", 4], ["wmma_m", "ot", 8]]}, "result": [[2.6428185e-05], 0, 0.9585955142974854, 1651824681.110991], "version": 0.2, "tvm_version": "0.8.0"}
{"input": ["cuda -keys=cuda,gpu -max_num_threads=1024 -thread_warp_size=32", "fused_reshape_permute_matmul_tensorcore.cuda", [["TENSOR", [4096, 32, 4], "float16"], ["TENSOR", [128, 128], "float16"]], {}], "config": {"index": 12279, "code_hash": null, "entity": [["block_row_warps", "ot", 1], ["block_col_warps", "ot", 2], ["warp_row_tiles", "ot", 4], ["warp_col_tiles", "ot", 2], ["chunk", "ot", 8], ["offset", "ot", 8], ["offsetCS", "ot", 0], ["vec", "ot", 2], ["wmma_m", "ot", 8]]}, "result": [[1.148468e-05], 0, 1.0065715312957764, 1651824682.2411742], "version": 0.2, "tvm_version": "0.8.0"}
{"input": ["cuda -keys=cuda,gpu -max_num_threads=1024 -thread_warp_size=32", "fused_reshape_permute_matmul_tensorcore.cuda", [["TENSOR", [4096, 32, 4], "float16"], ["TENSOR", [128, 128], "float16"]], {}], "config": {"index": 2684, "code_hash": null, "entity": [["block_row_warps", "ot", 4], ["block_col_warps", "ot", 1], ["warp_row_tiles", "ot", 2], ["warp_col_tiles", "ot", 1], ["chunk", "ot", 2], ["offset", "ot", 0], ["offsetCS", "ot", 0], ["vec", "ot", 4], ["wmma_m", "ot", 32]]}, "result": [[8.0071505e-05], 0, 1.1499507427215576, 1651824683.507645], "version": 0.2, "tvm_version": "0.8.0"}
{"input": ["cuda -keys=cuda,gpu -max_num_threads=1024 -thread_warp_size=32", "fused_reshape_permute_matmul_tensorcore.cuda", [["TENSOR", [4096, 32, 4], "float16"], ["TENSOR", [128, 128], "float16"]], {}], "config": {"index": 15255, "code_hash": null, "entity": [["block_row_warps", "ot", 1], ["block_col_warps", "ot", 1], ["warp_row_tiles", "ot", 1], ["warp_col_tiles", "ot", 2], ["chunk", "ot", 1], ["offset", "ot", 8], ["offsetCS", "ot", 8], ["vec", "ot", 8], ["wmma_m", "ot", 8]]}, "result": [[1.7296525e-05], 0, 0.9584872722625732, 1651824684.951513], "version": 0.2, "tvm_version": "0.8.0"}
