python/models/swin_transformer/kernel_configs/swin_transform_auto_tvm_tune_attn_v_pad_matmul_tensorcore_1_28_28_8_7.log
{"input": ["cuda -keys=cuda,gpu -max_num_threads=1024 -thread_warp_size=32", "attn_v_pad_matmul.cuda", [["TENSOR", [128, 49, 49], "float16"], ["TENSOR", [128, 32, 49], "float16"]], {}], "config": {"index": 2837, "code_hash": null, "entity": [["block_row_warps", "ot", 4], ["block_col_warps", "ot", 1], ["warp_row_tiles", "ot", 1], ["warp_col_tiles", "ot", 1], ["chunk", "ot", 8], ["offset", "ot", 0], ["offsetCS", "ot", 0], ["vec", "ot", 4], ["wmma_m", "ot", 32]]}, "result": [[2.8665823e-05], 0, 1.4275164604187012, 1651926687.974259], "version": 0.2, "tvm_version": "0.8.0"}
{"input": ["cuda -keys=cuda,gpu -max_num_threads=1024 -thread_warp_size=32", "attn_v_pad_matmul.cuda", [["TENSOR", [128, 49, 49], "float16"], ["TENSOR", [128, 32, 49], "float16"]], {}], "config": {"index": 12248, "code_hash": null, "entity": [["block_row_warps", "ot", 4], ["block_col_warps", "ot", 4], ["warp_row_tiles", "ot", 2], ["warp_col_tiles", "ot", 1], ["chunk", "ot", 8], ["offset", "ot", 8], ["offsetCS", "ot", 0], ["vec", "ot", 2], ["wmma_m", "ot", 8]]}, "result": [[2.7690554e-05], 0, 1.3245203495025635, 1651926688.5756633], "version": 0.2, "tvm_version": "0.8.0"}
{"input": ["cuda -keys=cuda,gpu -max_num_threads=1024 -thread_warp_size=32", "attn_v_pad_matmul.cuda", [["TENSOR", [128, 49, 49], "float16"], ["TENSOR", [128, 32, 49], "float16"]], {}], "config": {"index": 5465, "code_hash": null, "entity": [["block_row_warps", "ot", 4], ["block_col_warps", "ot", 1], ["warp_row_tiles", "ot", 2], ["warp_col_tiles", "ot", 2], ["chunk", "ot", 8], ["offset", "ot", 0], ["offsetCS", "ot", 0], ["vec", "ot", 1], ["wmma_m", "ot", 16]]}, "result": [[1.9257521e-05], 0, 1.4115502834320068, 1651926690.4439118], "version": 0.2, "tvm_version": "0.8.0"}
{"input": ["cuda -keys=cuda,gpu -max_num_threads=1024 -thread_warp_size=32", "attn_v_pad_matmul.cuda", [["TENSOR", [128, 49, 49], "float16"], ["TENSOR", [128, 32, 49], "float16"]], {}], "config": {"index": 5692, "code_hash": null, "entity": [["block_row_warps", "ot", 2], ["block_col_warps", "ot", 2], ["warp_row_tiles", "ot", 4], ["warp_col_tiles", "ot", 1], ["chunk", "ot", 4], ["offset", "ot", 8], ["offsetCS", "ot", 0], ["vec", "ot", 1], ["wmma_m", "ot", 16]]}, "result": [[1.0951202e-05], 0, 1.4996023178100586, 1651926691.890421], "version": 0.2, "tvm_version": "0.8.0"}
{"input": ["cuda -keys=cuda,gpu -max_num_threads=1024 -thread_warp_size=32", "attn_v_pad_matmul.cuda", [["TENSOR", [128, 49, 49], "float16"], ["TENSOR", [128, 32, 49], "float16"]], {}], "config": {"index": 2989, "code_hash": null, "entity": [["block_row_warps", "ot", 2], ["block_col_warps", "ot", 1], ["warp_row_tiles", "ot", 4], ["warp_col_tiles", "ot", 4], ["chunk", "ot", 1], ["offset", "ot", 8], ["offsetCS", "ot", 0], ["vec", "ot", 4], ["wmma_m", "ot", 32]]}, "result": [[1.2645108e-05], 0, 1.5258610248565674, 1651926692.583761], "version": 0.2, "tvm_version": "0.8.0"}
{"input": ["cuda -keys=cuda,gpu -max_num_threads=1024 -thread_warp_size=32", "attn_v_pad_matmul.cuda", [["TENSOR", [128, 49, 49], "float16"], ["TENSOR", [128, 32, 49], "float16"]], {}], "config": {"index": 13532, "code_hash": null, "entity": [["block_row_warps", "ot", 4], ["block_col_warps", "ot", 2], ["warp_row_tiles", "ot", 1], ["warp_col_tiles", "ot", 1], ["chunk", "ot", 8], ["offset", "ot", 8], ["offsetCS", "ot", 0], ["vec", "ot", 4], ["wmma_m", "ot", 8]]}, "result": [[2.1939779000000002e-05], 0, 1.3349218368530273, 1651926696.3473868], "version": 0.2, "tvm_version": "0.8.0"}
{"input": ["cuda -keys=cuda,gpu -max_num_threads=1024 -thread_warp_size=32", "attn_v_pad_matmul.cuda", [["TENSOR", [128, 49, 49], "float16"], ["TENSOR", [128, 32, 49], "float16"]], {}], "config": {"index": 1699, "code_hash": null, "entity": [["block_row_warps", "ot", 2], ["block_col_warps", "ot", 4], ["warp_row_tiles", "ot", 4], ["warp_col_tiles", "ot", 4], ["chunk", "ot", 1], ["offset", "ot", 8], ["offsetCS", "ot", 0], ["vec", "ot", 2], ["wmma_m", "ot", 32]]}, "result": [[2.0582063e-05], 0, 1.3332924842834473, 1651926696.9128494], "version": 0.2, "tvm_version": "0.8.0"}
{"input": ["cuda -keys=cuda,gpu -max_num_threads=1024 -thread_warp_size=32", "attn_v_pad_matmul.cuda", [["TENSOR", [128, 49, 49], "float16"], ["TENSOR", [128, 32, 49], "float16"]], {}], "config": {"index": 4340, "code_hash": null, "entity": [["block_row_warps", "ot", 4], ["block_col_warps", "ot", 1], ["warp_row_tiles", "ot", 4], ["warp_col_tiles", "ot", 2], ["chunk", "ot", 2], ["offset", "ot", 8], ["offsetCS", "ot", 0], ["vec", "ot", 8], ["wmma_m", "ot", 32]]}, "result": [[1.9408897e-05], 0, 1.6529426574707031, 1651926698.6136835], "version": 0.2, "tvm_version": "0.8.0"}
{"input": ["cuda -keys=cuda,gpu -max_num_threads=1024 -thread_warp_size=32", "attn_v_pad_matmul.cuda", [["TENSOR", [128, 49, 49], "float16"], ["TENSOR", [128, 32, 49], "float16"]], {}], "config": {"index": 3628, "code_hash": null, "entity": [["block_row_warps", "ot", 2], ["block_col_warps", "ot", 1], ["warp_row_tiles", "ot", 2], ["warp_col_tiles", "ot", 4], ["chunk", "ot", 1], ["offset", "ot", 8], ["offsetCS", "ot", 8], ["vec", "ot", 4], ["wmma_m", "ot", 32]]}, "result": [[1.1620251e-05], 0, 1.3062760829925537, 1651926699.9461982], "version": 0.2, "tvm_version": "0.8.0"}
{"input": ["cuda -keys=cuda,gpu -max_num_threads=1024 -thread_warp_size=32", "attn_v_pad_matmul.cuda", [["TENSOR", [128, 49, 49], "float16"], ["TENSOR", [128, 32, 49], "float16"]], {}], "config": {"index": 3125, "code_hash": null, "entity": [["block_row_warps", "ot", 4], ["block_col_warps", "ot", 1], ["warp_row_tiles", "ot", 4], ["warp_col_tiles", "ot", 2], ["chunk", "ot", 4], ["offset", "ot", 8], ["offsetCS", "ot", 0], ["vec", "ot", 4], ["wmma_m", "ot", 32]]}, "result": [[1.255547e-05], 0, 1.7586369514465332, 1651926700.8526485], "version": 0.2, "tvm_version": "0.8.0"}
{"input": ["cuda -keys=cuda,gpu -max_num_threads=1024 -thread_warp_size=32", "attn_v_pad_matmul.cuda", [["TENSOR", [128, 49, 49], "float16"], ["TENSOR", [128, 32, 49], "float16"]], {}], "config": {"index": 7900, "code_hash": null, "entity": [["block_row_warps", "ot", 2], ["block_col_warps", "ot", 4], ["warp_row_tiles", "ot", 2], ["warp_col_tiles", "ot", 2], ["chunk", "ot", 2], ["offset", "ot", 0], ["offsetCS", "ot", 0], ["vec", "ot", 4], ["wmma_m", "ot", 16]]}, "result": [[2.5480042e-05], 0, 1.4625649452209473, 1651926702.6323652], "version": 0.2, "tvm_version": "0.8.0"}
{"input": ["cuda -keys=cuda,gpu -max_num_threads=1024 -thread_warp_size=32", "attn_v_pad_matmul.cuda", [["TENSOR", [128, 49, 49], "float16"], ["TENSOR", [128, 32, 49], "float16"]], {}], "config": {"index": 132, "code_hash": null, "entity": [["block_row_warps", "ot", 1], ["block_col_warps", "ot", 4], ["warp_row_tiles", "ot", 4], ["warp_col_tiles", "ot", 2], ["chunk", "ot", 2], ["offset", "ot", 0], ["offsetCS", "ot", 0], ["vec", "ot", 1], ["wmma_m", "ot", 32]]}, "result": [[1.8197867e-05], 0, 1.541231632232666, 1651926704.377014], "version": 0.2, "tvm_version": "0.8.0"}
{"input": ["cuda -keys=cuda,gpu -max_num_threads=1024 -thread_warp_size=32", "attn_v_pad_matmul.cuda", [["TENSOR", [128, 49, 49], "float16"], ["TENSOR", [128, 32, 49], "float16"]], {}], "config": {"index": 13300, "code_hash": null, "entity": [["block_row_warps", "ot", 2], ["block_col_warps", "ot", 4], ["warp_row_tiles", "ot", 2], ["warp_col_tiles", "ot", 1], ["chunk", "ot", 1], ["offset", "ot", 8], ["offsetCS", "ot", 0], ["vec", "ot", 4], ["wmma_m", "ot", 8]]}, "result": [[2.6985941e-05], 0, 1.5138003826141357, 1651926705.15411], "version": 0.2, "tvm_version": "0.8.0"}
{"input": ["cuda -keys=cuda,gpu -max_num_threads=1024 -thread_warp_size=32", "attn_v_pad_matmul.cuda", [["TENSOR", [128, 49, 49], "float16"], ["TENSOR", [128, 32, 49], "float16"]], {}], "config": {"index": 10168, "code_hash": null, "entity": [["block_row_warps", "ot", 2], ["block_col_warps", "ot", 4], ["warp_row_tiles", "ot", 2], ["warp_col_tiles", "ot", 2], ["chunk", "ot", 2], ["offset", "ot", 8], ["offsetCS", "ot", 8], ["vec", "ot", 8], ["wmma_m", "ot", 16]]}, "result": [[2.4322068e-05], 0, 1.5860154628753662, 1651926706.6013808], "version": 0.2, "tvm_version": "0.8.0"}
{"input": ["cuda -keys=cuda,gpu -max_num_threads=1024 -thread_warp_size=32", "attn_v_pad_matmul.cuda", [["TENSOR", [128, 49, 49], "float16"], ["TENSOR", [128, 32, 49], "float16"]], {}], "config": {"index": 14349, "code_hash": null, "entity": [["block_row_warps", "ot", 1], ["block_col_warps", "ot", 2], ["warp_row_tiles", "ot", 2], ["warp_col_tiles", "ot", 1], ["chunk", "ot", 2], ["offset", "ot", 0], ["offsetCS", "ot", 0], ["vec", "ot", 8], ["wmma_m", "ot", 8]]}, "result": [[1.6059698e-05], 0, 1.435509443283081, 1651926708.3439846], "version": 0.2, "tvm_version": "0.8.0"}
{"input": ["cuda -keys=cuda,gpu -max_num_threads=1024 -thread_warp_size=32", "attn_v_pad_matmul.cuda", [["TENSOR", [128, 49, 49], "float16"], ["TENSOR", [128, 32, 49], "float16"]], {}], "config": {"index": 7630, "code_hash": null, "entity": [["block_row_warps", "ot", 2], ["block_col_warps", "ot", 4], ["warp_row_tiles", "ot", 2], ["warp_col_tiles", "ot", 1], ["chunk", "ot", 4], ["offset", "ot", 8], ["offsetCS", "ot", 8], ["vec", "ot", 2], ["wmma_m", "ot", 16]]}, "result": [[1.3792573e-05], 0, 1.478675365447998, 1651926710.1295166], "version": 0.2, "tvm_version": "0.8.0"}
{"input": ["cuda -keys=cuda,gpu -max_num_threads=1024 -thread_warp_size=32", "attn_v_pad_matmul.cuda", [["TENSOR", [128, 49, 49], "float16"], ["TENSOR", [128, 32, 49], "float16"]], {}], "config": {"index": 5950, "code_hash": null, "entity": [["block_row_warps", "ot", 2], ["block_col_warps", "ot", 1], ["warp_row_tiles", "ot", 2], ["warp_col_tiles", "ot", 2], ["chunk", "ot", 2], ["offset", "ot", 0], ["offsetCS", "ot", 8], ["vec", "ot", 1], ["wmma_m", "ot", 16]]}, "result": [[1.0657893e-05], 0, 1.3904330730438232, 1651926713.0050402], "version": 0.2, "tvm_version": "0.8.0"}
{"input": ["cuda -keys=cuda,gpu -max_num_threads=1024 -thread_warp_size=32", "attn_v_pad_matmul.cuda", [["TENSOR", [128, 49, 49], "float16"], ["TENSOR", [128, 32, 49], "float16"]], {}], "config": {"index": 4533, "code_hash": null, "entity": [["block_row_warps", "ot", 1], ["block_col_warps", "ot", 4], ["warp_row_tiles", "ot", 4], ["warp_col_tiles", "ot", 4], ["chunk", "ot", 8], ["offset", "ot", 8], ["offsetCS", "ot", 0], ["vec", "ot", 8], ["wmma_m", "ot", 32]]}, "result": [[1.6624123000000002e-05], 0, 1.4748408794403076, 1651926714.6956367], "version": 0.2, "tvm_version": "0.8.0"}
{"input": ["cuda -keys=cuda,gpu -max_num_threads=1024 -thread_warp_size=32", "attn_v_pad_matmul.cuda", [["TENSOR", [128, 49, 49], "float16"], ["TENSOR", [128, 32, 49], "float16"]], {}], "config": {"index": 3972, "code_hash": null, "entity": [["block_row_warps", "ot", 1], ["block_col_warps", "ot", 2], ["warp_row_tiles", "ot", 1], ["warp_col_tiles", "ot", 1], ["chunk", "ot", 2], ["offset", "ot", 0], ["offsetCS", "ot", 0], ["vec", "ot", 8], ["wmma_m", "ot", 32]]}, "result": [[1.9162717e-05], 0, 1.2350938320159912, 1651926715.2558606], "version": 0.2, "tvm_version": "0.8.0"}
{"input": ["cuda -keys=cuda,gpu -max_num_threads=1024 -thread_warp_size=32", "attn_v_pad_matmul.cuda", [["TENSOR", [128, 49, 49], "float16"], ["TENSOR", [128, 32, 49], "float16"]], {}], "config": {"index": 5094, "code_hash": null, "entity": [["block_row_warps", "ot", 1], ["block_col_warps", "ot", 1], ["warp_row_tiles", "ot", 4], ["warp_col_tiles", "ot", 4], ["chunk", "ot", 4], ["offset", "ot", 8], ["offsetCS", "ot", 8], ["vec", "ot", 8], ["wmma_m", "ot", 32]]}, "result": [[2.0298307999999997e-05], 0, 1.3957233428955078, 1651926717.0218565], "version": 0.2, "tvm_version": "0.8.0"}
{"input": ["cuda -keys=cuda,gpu -max_num_threads=1024 -thread_warp_size=32", "attn_v_pad_matmul.cuda", [["TENSOR", [128, 49, 49], "float16"], ["TENSOR", [128, 32, 49], "float16"]], {}], "config": {"index": 2014, "code_hash": null, "entity": [["block_row_warps", "ot", 2], ["block_col_warps", "ot", 4], ["warp_row_tiles", "ot", 2], ["warp_col_tiles", "ot", 4], ["chunk", "ot", 1], ["offset", "ot", 0], ["offsetCS", "ot", 8], ["vec", "ot", 2], ["wmma_m", "ot", 32]]}, "result": [[1.4486530999999999e-05], 0, 1.3382327556610107, 1651926718.4317846], "version": 0.2, "tvm_version": "0.8.0"}
{"input": ["cuda -keys=cuda,gpu -max_num_threads=1024 -thread_warp_size=32", "attn_v_pad_matmul.cuda", [["TENSOR", [128, 49, 49], "float16"], ["TENSOR", [128, 32, 49], "float16"]], {}], "config": {"index": 7901, "code_hash": null, "entity": [["block_row_warps", "ot", 4], ["block_col_warps", "ot", 4], ["warp_row_tiles", "ot", 2], ["warp_col_tiles", "ot", 2], ["chunk", "ot", 2], ["offset", "ot", 0], ["offsetCS", "ot", 0], ["vec", "ot", 4], ["wmma_m", "ot", 16]]}, "result": [[4.7582682e-05], 0, 1.8044955730438232, 1651926719.4912362], "version": 0.2, "tvm_version": "0.8.0"}
{"input": ["cuda -keys=cuda,gpu -max_num_threads=1024 -thread_warp_size=32", "attn_v_pad_matmul.cuda", [["TENSOR", [128, 49, 49], "float16"], ["TENSOR", [128, 32, 49], "float16"]], {}], "config": {"index": 8221, "code_hash": null, "entity": [["block_row_warps", "ot", 2], ["block_col_warps", "ot", 2], ["warp_row_tiles", "ot", 2], ["warp_col_tiles", "ot", 2], ["chunk", "ot", 2], ["offset", "ot", 8], ["offsetCS", "ot", 0], ["vec", "ot", 4], ["wmma_m", "ot", 16]]}, "result": [[1.4499069e-05], 0, 1.6036138534545898, 1651926721.3261907], "version": 0.2, "tvm_version": "0.8.0"}
{"input": ["cuda -keys=cuda,gpu -max_num_threads=1024 -thread_warp_size=32", "attn_v_pad_matmul.cuda", [["TENSOR", [128, 49, 49], "float16"], ["TENSOR", [128, 32, 49], "float16"]], {}], "config": {"index": 4445, "code_hash": null, "entity": [["block_row_warps", "ot", 4], ["block_col_warps", "ot", 4], ["warp_row_tiles", "ot", 2], ["warp_col_tiles", "ot", 4], ["chunk", "ot", 4], ["offset", "ot", 8], ["offsetCS", "ot", 0], ["vec", "ot", 8], ["wmma_m", "ot", 32]]}, "result": [[3.423910899999999e-05], 0, 1.5612831115722656, 1651926723.2264879], "version": 0.2, "tvm_version": "0.8.0"}
{"input": ["cuda -keys=cuda,gpu -max_num_threads=1024 -thread_warp_size=32", "attn_v_pad_matmul.cuda", [["TENSOR", [128, 49, 49], "float16"], ["TENSOR", [128, 32, 49], "float16"]], {}], "config": {"index": 1369, "code_hash": null, "entity": [["block_row_warps", "ot", 2], ["block_col_warps", "ot", 1], ["warp_row_tiles", "ot", 4], ["warp_col_tiles", "ot", 4], ["chunk", "ot", 1], ["offset", "ot", 0], ["offsetCS", "ot", 0], ["vec", "ot", 2], ["wmma_m", "ot", 32]]}, "result": [[9.74052039555006e-06], 0, 1.5168652534484863, 1651926723.990686], "version": 0.2, "tvm_version": "0.8.0"}
{"input": ["cuda -keys=cuda,gpu -max_num_threads=1024 -thread_warp_size=32", "attn_v_pad_matmul.cuda", [["TENSOR", [128, 49, 49], "float16"], ["TENSOR", [128, 32, 49], "float16"]], {}], "config": {"index": 4943, "code_hash": null, "entity": [["block_row_warps", "ot", 4], ["block_col_warps", "ot", 1], ["warp_row_tiles", "ot", 1], ["warp_col_tiles", "ot", 1], ["chunk", "ot", 2], ["offset", "ot", 8], ["offsetCS", "ot", 8], ["vec", "ot", 8], ["wmma_m", "ot", 32]]}, "result": [[1.7783364999999997e-05], 0, 1.442622423171997, 1651926725.825828], "version": 0.2, "tvm_version": "0.8.0"}
{"input": ["cuda -keys=cuda,gpu -max_num_threads=1024 -thread_warp_size=32", "attn_v_pad_matmul.cuda", [["TENSOR", [128, 49, 49], "float16"], ["TENSOR", [128, 32, 49], "float16"]], {}], "config": {"index": 3736, "code_hash": null, "entity": [["block_row_warps", "ot", 2], ["block_col_warps", "ot", 1], ["warp_row_tiles", "ot", 2], ["warp_col_tiles", "ot", 1], ["chunk", "ot", 4], ["offset", "ot", 8], ["offsetCS", "ot", 8], ["vec", "ot", 4], ["wmma_m", "ot", 32]]}, "result": [[1.5318791999999998e-05], 0, 1.4832441806793213, 1651926726.4699228], "version": 0.2, "tvm_version": "0.8.0"}
{"input": ["cuda -keys=cuda,gpu -max_num_threads=1024 -thread_warp_size=32", "attn_v_pad_matmul.cuda", [["TENSOR", [128, 49, 49], "float16"], ["TENSOR", [128, 32, 49], "float16"]], {}], "config": {"index": 14601, "code_hash": null, "entity": [["block_row_warps", "ot", 1], ["block_col_warps", "ot", 2], ["warp_row_tiles", "ot", 4], ["warp_col_tiles", "ot", 1], ["chunk", "ot", 1], ["offset", "ot", 8], ["offsetCS", "ot", 0], ["vec", "ot", 8], ["wmma_m", "ot", 8]]}, "result": [[1.3413263e-05], 0, 1.080122947692871, 1651926729.9507182], "version": 0.2, "tvm_version": "0.8.0"}
{"input": ["cuda -keys=cuda,gpu -max_num_threads=1024 -thread_warp_size=32", "attn_v_pad_matmul.cuda", [["TENSOR", [128, 49, 49], "float16"], ["TENSOR", [128, 32, 49], "float16"]], {}], "config": {"index": 9407, "code_hash": null, "entity": [["block_row_warps", "ot", 4], ["block_col_warps", "ot", 1], ["warp_row_tiles", "ot", 2], ["warp_col_tiles", "ot", 1], ["chunk", "ot", 1], ["offset", "ot", 8], ["offsetCS", "ot", 0], ["vec", "ot", 8], ["wmma_m", "ot", 16]]}, "result": [[3.6431958e-05], 0, 1.6981847286224365, 1651926732.9197156], "version": 0.2, "tvm_version": "0.8.0"}
{"input": ["cuda -keys=cuda,gpu -max_num_threads=1024 -thread_warp_size=32", "attn_v_pad_matmul.cuda", [["TENSOR", [128, 49, 49], "float16"], ["TENSOR", [128, 32, 49], "float16"]], {}], "config": {"index": 10047, "code_hash": null, "entity": [["block_row_warps", "ot", 1], ["block_col_warps", "ot", 2], ["warp_row_tiles", "ot", 1], ["warp_col_tiles", "ot", 1], ["chunk", "ot", 1], ["offset", "ot", 8], ["offsetCS", "ot", 8], ["vec", "ot", 8], ["wmma_m", "ot", 16]]}, "result": [[1.8236619000000003e-05], 0, 1.5653598308563232, 1651926733.5062673], "version": 0.2, "tvm_version": "0.8.0"}
{"input": ["cuda -keys=cuda,gpu -max_num_threads=1024 -thread_warp_size=32", "attn_v_pad_matmul.cuda", [["TENSOR", [128, 49, 49], "float16"], ["TENSOR", [128, 32, 49], "float16"]], {}], "config": {"index": 5779, "code_hash": null, "entity": [["block_row_warps", "ot", 2], ["block_col_warps", "ot", 1], ["warp_row_tiles", "ot", 1], ["warp_col_tiles", "ot", 2], ["chunk", "ot", 8], ["offset", "ot", 8], ["offsetCS", "ot", 0], ["vec", "ot", 1], ["wmma_m", "ot", 16]]}, "result": [[8.651501236093943e-06], 0, 1.713801383972168, 1651926735.5794353], "version": 0.2, "tvm_version": "0.8.0"}
{"input": ["cuda -keys=cuda,gpu -max_num_threads=1024 -thread_warp_size=32", "attn_v_pad_matmul.cuda", [["TENSOR", [128, 49, 49], "float16"], ["TENSOR", [128, 32, 49], "float16"]], {}], "config": {"index": 3601, "code_hash": null, "entity": [["block_row_warps", "ot", 2], ["block_col_warps", "ot", 1], ["warp_row_tiles", "ot", 2], ["warp_col_tiles", "ot", 2], ["chunk", "ot", 1], ["offset", "ot", 8], ["offsetCS", "ot", 8], ["vec", "ot", 4], ["wmma_m", "ot", 32]]}, "result": [[1.0994332e-05], 0, 1.3915624618530273, 1651926736.0161662], "version": 0.2, "tvm_version": "0.8.0"}
{"input": ["cuda -keys=cuda,gpu -max_num_threads=1024 -thread_warp_size=32", "attn_v_pad_matmul.cuda", [["TENSOR", [128, 49, 49], "float16"], ["TENSOR", [128, 32, 49], "float16"]], {}], "config": {"index": 653, "code_hash": null, "entity": [["block_row_warps", "ot", 4], ["block_col_warps", "ot", 2], ["warp_row_tiles", "ot", 1], ["warp_col_tiles", "ot", 1], ["chunk", "ot", 1], ["offset", "ot", 0], ["offsetCS", "ot", 8], ["vec", "ot", 1], ["wmma_m", "ot", 32]]}, "result": [[2.1492627999999998e-05], 0, 1.8216941356658936, 1651926738.068814], "version": 0.2, "tvm_version": "0.8.0"}
{"input": ["cuda -keys=cuda,gpu -max_num_threads=1024 -thread_warp_size=32", "attn_v_pad_matmul.cuda", [["TENSOR", [128, 49, 49], "float16"], ["TENSOR", [128, 32, 49], "float16"]], {}], "config": {"index": 13791, "code_hash": null, "entity": [["block_row_warps", "ot", 1], ["block_col_warps", "ot", 2], ["warp_row_tiles", "ot", 4], ["warp_col_tiles", "ot", 1], ["chunk", "ot", 4], ["offset", "ot", 0], ["offsetCS", "ot", 8], ["vec", "ot", 4], ["wmma_m", "ot", 8]]}, "result": [[1.2877789e-05], 0, 1.5081562995910645, 1651926739.4735725], "version": 0.2, "tvm_version": "0.8.0"}
{"input": ["cuda -keys=cuda,gpu -max_num_threads=1024 -thread_warp_size=32", "attn_v_pad_matmul.cuda", [["TENSOR", [128, 49, 49], "float16"], ["TENSOR", [128, 32, 49], "float16"]], {}], "config": {"index": 4143, "code_hash": null, "entity": [["block_row_warps", "ot", 1], ["block_col_warps", "ot", 2], ["warp_row_tiles", "ot", 2], ["warp_col_tiles", "ot", 1], ["chunk", "ot", 8], ["offset", "ot", 0], ["offsetCS", "ot", 0], ["vec", "ot", 8], ["wmma_m", "ot", 32]]}, "result": [[2.3869473e-05], 0, 1.40437650680542, 1651926741.3240793], "version": 0.2, "tvm_version": "0.8.0"}
{"input": ["cuda -keys=cuda,gpu -max_num_threads=1024 -thread_warp_size=32", "attn_v_pad_matmul.cuda", [["TENSOR", [128, 49, 49], "float16"], ["TENSOR", [128, 32, 49], "float16"]], {}], "config": {"index": 6730, "code_hash": null, "entity": [["block_row_warps", "ot", 2], ["block_col_warps", "ot", 4], ["warp_row_tiles", "ot", 1], ["warp_col_tiles", "ot", 1], ["chunk", "ot", 8], ["offset", "ot", 0], ["offsetCS", "ot", 0], ["vec", "ot", 2], ["wmma_m", "ot", 16]]}, "result": [[4.4566855e-05], 0, 1.282686710357666, 1651926741.8768823], "version": 0.2, "tvm_version": "0.8.0"}
{"input": ["cuda -keys=cuda,gpu -max_num_threads=1024 -thread_warp_size=32", "attn_v_pad_matmul.cuda", [["TENSOR", [128, 49, 49], "float16"], ["TENSOR", [128, 32, 49], "float16"]], {}], "config": {"index": 925, "code_hash": null, "entity": [["block_row_warps", "ot", 2], ["block_col_warps", "ot", 4], ["warp_row_tiles", "ot", 1], ["warp_col_tiles", "ot", 2], ["chunk", "ot", 8], ["offset", "ot", 0], ["offsetCS", "ot", 8], ["vec", "ot", 1], ["wmma_m", "ot", 32]]}, "result": [[4.1223371e-05], 0, 1.804976463317871, 1651926743.008208], "version": 0.2, "tvm_version": "0.8.0"}
{"input": ["cuda -keys=cuda,gpu -max_num_threads=1024 -thread_warp_size=32", "attn_v_pad_matmul.cuda", [["TENSOR", [128, 49, 49], "float16"], ["TENSOR", [128, 32, 49], "float16"]], {}], "config": {"index": 2276, "code_hash": null, "entity": [["block_row_warps", "ot", 4], ["block_col_warps", "ot", 4], ["warp_row_tiles", "ot", 1], ["warp_col_tiles", "ot", 1], ["chunk", "ot", 1], ["offset", "ot", 8], ["offsetCS", "ot", 8], ["vec", "ot", 2], ["wmma_m", "ot", 32]]}, "result": [[4.2669843e-05], 0, 1.6871774196624756, 1651926745.6497643], "version": 0.2, "tvm_version": "0.8.0"}
{"input": ["cuda -keys=cuda,gpu -max_num_threads=1024 -thread_warp_size=32", "attn_v_pad_matmul.cuda", [["TENSOR", [128, 49, 49], "float16"], ["TENSOR", [128, 32, 49], "float16"]], {}], "config": {"index": 7484, "code_hash": null, "entity": [["block_row_warps", "ot", 4], ["block_col_warps", "ot", 2], ["warp_row_tiles", "ot", 1], ["warp_col_tiles", "ot", 2], ["chunk", "ot", 1], ["offset", "ot", 8], ["offsetCS", "ot", 8], ["vec", "ot", 2], ["wmma_m", "ot", 16]]}, "result": [[1.5777118e-05], 0, 1.6801865100860596, 1651926746.3279967], "version": 0.2, "tvm_version": "0.8.0"}
{"input": ["cuda -keys=cuda,gpu -max_num_threads=1024 -thread_warp_size=32", "attn_v_pad_matmul.cuda", [["TENSOR", [128, 49, 49], "float16"], ["TENSOR", [128, 32, 49], "float16"]], {}], "config": {"index": 3834, "code_hash": null, "entity": [["block_row_warps", "ot", 1], ["block_col_warps", "ot", 1], ["warp_row_tiles", "ot", 1], ["warp_col_tiles", "ot", 2], ["chunk", "ot", 8], ["offset", "ot", 8], ["offsetCS", "ot", 8], ["vec", "ot", 4], ["wmma_m", "ot", 32]]}, "result": [[1.0260844e-05], 0, 1.315577745437622, 1651926747.9301782], "version": 0.2, "tvm_version": "0.8.0"}
{"input": ["cuda -keys=cuda,gpu -max_num_threads=1024 -thread_warp_size=32", "attn_v_pad_matmul.cuda", [["TENSOR", [128, 49, 49], "float16"], ["TENSOR", [128, 32, 49], "float16"]], {}], "config": {"index": 1649, "code_hash": null, "entity": [["block_row_warps", "ot", 4], ["block_col_warps", "ot", 1], ["warp_row_tiles", "ot", 1], ["warp_col_tiles", "ot", 2], ["chunk", "ot", 1], ["offset", "ot", 8], ["offsetCS", "ot", 0], ["vec", "ot", 2], ["wmma_m", "ot", 32]]}, "result": [[1.1506740000000002e-05], 0, 1.5244050025939941, 1651926748.6321042], "version": 0.2, "tvm_version": "0.8.0"}
{"input": ["cuda -keys=cuda,gpu -max_num_threads=1024 -thread_warp_size=32", "attn_v_pad_matmul.cuda", [["TENSOR", [128, 49, 49], "float16"], ["TENSOR", [128, 32, 49], "float16"]], {}], "config": {"index": 10626, "code_hash": null, "entity": [["block_row_warps", "ot", 1], ["block_col_warps", "ot", 4], ["warp_row_tiles", "ot", 2], ["warp_col_tiles", "ot", 1], ["chunk", "ot", 8], ["offset", "ot", 0], ["offsetCS", "ot", 0], ["vec", "ot", 1], ["wmma_m", "ot", 8]]}, "result": [[1.9660765e-05], 0, 1.438645362854004, 1651926750.314194], "version": 0.2, "tvm_version": "0.8.0"}
{"input": ["cuda -keys=cuda,gpu -max_num_threads=1024 -thread_warp_size=32", "attn_v_pad_matmul.cuda", [["TENSOR", [128, 49, 49], "float16"], ["TENSOR", [128, 32, 49], "float16"]], {}], "config": {"index": 1781, "code_hash": null, "entity": [["block_row_warps", "ot", 4], ["block_col_warps", "ot", 4], ["warp_row_tiles", "ot", 4], ["warp_col_tiles", "ot", 4], ["chunk", "ot", 2], ["offset", "ot", 8], ["offsetCS", "ot", 0], ["vec", "ot", 2], ["wmma_m", "ot", 32]]}, "result": [[3.5632364e-05], 0, 1.452836036682129, 1651926750.9521098], "version": 0.2, "tvm_version": "0.8.0"}
{"input": ["cuda -keys=cuda,gpu -max_num_threads=1024 -thread_warp_size=32", "attn_v_pad_matmul.cuda", [["TENSOR", [128, 49, 49], "float16"], ["TENSOR", [128, 32, 49], "float16"]], {}], "config": {"index": 7731, "code_hash": null, "entity": [["block_row_warps", "ot", 1], ["block_col_warps", "ot", 1], ["warp_row_tiles", "ot", 2], ["warp_col_tiles", "ot", 2], ["chunk", "ot", 8], ["offset", "ot", 8], ["offsetCS", "ot", 8], ["vec", "ot", 2], ["wmma_m", "ot", 16]]}, "result": [[2.0778833e-05], 0, 1.4215118885040283, 1651926752.7164395], "version": 0.2, "tvm_version": "0.8.0"}
{"input": ["cuda -keys=cuda,gpu -max_num_threads=1024 -thread_warp_size=32", "attn_v_pad_matmul.cuda", [["TENSOR", [128, 49, 49], "float16"], ["TENSOR", [128, 32, 49], "float16"]], {}], "config": {"index": 6022, "code_hash": null, "entity": [["block_row_warps", "ot", 2], ["block_col_warps", "ot", 1], ["warp_row_tiles", "ot", 1], ["warp_col_tiles", "ot", 2], ["chunk", "ot", 4], ["offset", "ot", 0], ["offsetCS", "ot", 8], ["vec", "ot", 1], ["wmma_m", "ot", 16]]}, "result": [[1.3666240999999999e-05], 0, 1.3979923725128174, 1651926753.406411], "version": 0.2, "tvm_version": "0.8.0"}
{"input": ["cuda -keys=cuda,gpu -max_num_threads=1024 -thread_warp_size=32", "attn_v_pad_matmul.cuda", [["TENSOR", [128, 49, 49], "float16"], ["TENSOR", [128, 32, 49], "float16"]], {}], "config": {"index": 9286, "code_hash": null, "entity": [["block_row_warps", "ot", 2], ["block_col_warps", "ot", 4], ["warp_row_tiles", "ot", 4], ["warp_col_tiles", "ot", 2], ["chunk", "ot", 4], ["offset", "ot", 0], ["offsetCS", "ot", 0], ["vec", "ot", 8], ["wmma_m", "ot", 16]]}, "result": [[3.3497467000000006e-05], 0, 1.6911609172821045, 1651926754.979761], "version": 0.2, "tvm_version": "0.8.0"}
{"input": ["cuda -keys=cuda,gpu -max_num_threads=1024 -thread_warp_size=32", "attn_v_pad_matmul.cuda", [["TENSOR", [128, 49, 49], "float16"], ["TENSOR", [128, 32, 49], "float16"]], {}], "config": {"index": 10942, "code_hash": null, "entity": [["block_row_warps", "ot", 2], ["block_col_warps", "ot", 4], ["warp_row_tiles", "ot", 1], ["warp_col_tiles", "ot", 1], ["chunk", "ot", 8], ["offset", "ot", 8], ["offsetCS", "ot", 0], ["vec", "ot", 1], ["wmma_m", "ot", 8]]}, "result": [[1.6211264e-05], 0, 1.595916509628296, 1651926757.4111514], "version": 0.2, "tvm_version": "0.8.0"}
{"input": ["cuda -keys=cuda,gpu -max_num_threads=1024 -thread_warp_size=32", "attn_v_pad_matmul.cuda", [["TENSOR", [128, 49, 49], "float16"], ["TENSOR", [128, 32, 49], "float16"]], {}], "config": {"index": 13852, "code_hash": null, "entity": [["block_row_warps", "ot", 2], ["block_col_warps", "ot", 1], ["warp_row_tiles", "ot", 1], ["warp_col_tiles", "ot", 1], ["chunk", "ot", 8], ["offset", "ot", 0], ["offsetCS", "ot", 8], ["vec", "ot", 4], ["wmma_m", "ot", 8]]}, "result": [[1.7832535e-05], 0, 1.6858820915222168, 1651926758.0822353], "version": 0.2, "tvm_version": "0.8.0"}
{"input": ["cuda -keys=cuda,gpu -max_num_threads=1024 -thread_warp_size=32", "attn_v_pad_matmul.cuda", [["TENSOR", [128, 49, 49], "float16"], ["TENSOR", [128, 32, 49], "float16"]], {}], "config": {"index": 2510, "code_hash": null, "entity": [["block_row_warps", "ot", 4], ["block_col_warps", "ot", 4], ["warp_row_tiles", "ot", 4], ["warp_col_tiles", "ot", 4], ["chunk", "ot", 4], ["offset", "ot", 8], ["offsetCS", "ot", 8], ["vec", "ot", 2], ["wmma_m", "ot", 32]]}, "result": [[2.3971917000000003e-05], 0, 1.6069374084472656, 1651926759.6179953], "version": 0.2, "tvm_version": "0.8.0"}
{"input": ["cuda -keys=cuda,gpu -max_num_threads=1024 -thread_warp_size=32", "attn_v_pad_matmul.cuda", [["TENSOR", [128, 49, 49], "float16"], ["TENSOR", [128, 32, 49], "float16"]], {}], "config": {"index": 6830, "code_hash": null, "entity": [["block_row_warps", "ot", 4], ["block_col_warps", "ot", 4], ["warp_row_tiles", "ot", 4], ["warp_col_tiles", "ot", 1], ["chunk", "ot", 1], ["offset", "ot", 8], ["offsetCS", "ot", 0], ["vec", "ot", 2], ["wmma_m", "ot", 16]]}, "result": [[3.3023441e-05], 0, 1.5093448162078857, 1651926760.3134594], "version": 0.2, "tvm_version": "0.8.0"}
{"input": ["cuda -keys=cuda,gpu -max_num_threads=1024 -thread_warp_size=32", "attn_v_pad_matmul.cuda", [["TENSOR", [128, 49, 49], "float16"], ["TENSOR", [128, 32, 49], "float16"]], {}], "config": {"index": 8129, "code_hash": null, "entity": [["block_row_warps", "ot", 4], ["block_col_warps", "ot", 1], ["warp_row_tiles", "ot", 1], ["warp_col_tiles", "ot", 2], ["chunk", "ot", 1], ["offset", "ot", 8], ["offsetCS", "ot", 0], ["vec", "ot", 4], ["wmma_m", "ot", 16]]}, "result": [[2.1555789999999997e-05], 0, 1.4572312831878662, 1651926762.063004], "version": 0.2, "tvm_version": "0.8.0"}
{"input": ["cuda -keys=cuda,gpu -max_num_threads=1024 -thread_warp_size=32", "attn_v_pad_matmul.cuda", [["TENSOR", [128, 49, 49], "float16"], ["TENSOR", [128, 32, 49], "float16"]], {}], "config": {"index": 5214, "code_hash": null, "entity": [["block_row_warps", "ot", 1], ["block_col_warps", "ot", 2], ["warp_row_tiles", "ot", 1], ["warp_col_tiles", "ot", 2], ["chunk", "ot", 1], ["offset", "ot", 0], ["offsetCS", "ot", 0], ["vec", "ot", 1], ["wmma_m", "ot", 16]]}, "result": [[9.823616192830654e-06], 0, 1.343991756439209, 1651926762.5624044], "version": 0.2, "tvm_version": "0.8.0"}
{"input": ["cuda -keys=cuda,gpu -max_num_threads=1024 -thread_warp_size=32", "attn_v_pad_matmul.cuda", [["TENSOR", [128, 49, 49], "float16"], ["TENSOR", [128, 32, 49], "float16"]], {}], "config": {"index": 12718, "code_hash": null, "entity": [["block_row_warps", "ot", 2], ["block_col_warps", "ot", 1], ["warp_row_tiles", "ot", 1], ["warp_col_tiles", "ot", 1], ["chunk", "ot", 2], ["offset", "ot", 8], ["offsetCS", "ot", 8], ["vec", "ot", 2], ["wmma_m", "ot", 8]]}, "result": [[1.0983992000000002e-05], 0, 3.1862316131591797, 1651926765.9755435], "version": 0.2, "tvm_version": "0.8.0"}
{"input": ["cuda -keys=cuda,gpu -max_num_threads=1024 -thread_warp_size=32", "attn_v_pad_matmul.cuda", [["TENSOR", [128, 49, 49], "float16"], ["TENSOR", [128, 32, 49], "float16"]], {}], "config": {"index": 5082, "code_hash": null, "entity": [["block_row_warps", "ot", 1], ["block_col_warps", "ot", 4], ["warp_row_tiles", "ot", 1], ["warp_col_tiles", "ot", 4], ["chunk", "ot", 4], ["offset", "ot", 8], ["offsetCS", "ot", 8], ["vec", "ot", 8], ["wmma_m", "ot", 32]]}, "result": [[1.1701814000000002e-05], 0, 1.68021559715271, 1651926767.894274], "version": 0.2, "tvm_version": "0.8.0"}
{"input": ["cuda -keys=cuda,gpu -max_num_threads=1024 -thread_warp_size=32", "attn_v_pad_matmul.cuda", [["TENSOR", [128, 49, 49], "float16"], ["TENSOR", [128, 32, 49], "float16"]], {}], "config": {"index": 552, "code_hash": null, "entity": [["block_row_warps", "ot", 1], ["block_col_warps", "ot", 2], ["warp_row_tiles", "ot", 2], ["warp_col_tiles", "ot", 4], ["chunk", "ot", 4], ["offset", "ot", 8], ["offsetCS", "ot", 0], ["vec", "ot", 1], ["wmma_m", "ot", 32]]}, "result": [[1.2180811e-05], 0, 1.46195387840271, 1651926814.1785715], "version": 0.2, "tvm_version": "0.8.0"}
{"input": ["cuda -keys=cuda,gpu -max_num_threads=1024 -thread_warp_size=32", "attn_v_pad_matmul.cuda", [["TENSOR", [128, 49, 49], "float16"], ["TENSOR", [128, 32, 49], "float16"]], {}], "config": {"index": 633, "code_hash": null, "entity": [["block_row_warps", "ot", 1], ["block_col_warps", "ot", 2], ["warp_row_tiles", "ot", 2], ["warp_col_tiles", "ot", 4], ["chunk", "ot", 8], ["offset", "ot", 8], ["offsetCS", "ot", 0], ["vec", "ot", 1], ["wmma_m", "ot", 32]]}, "result": [[1.2078874000000001e-05], 0, 1.9018266201019287, 1651926814.9917674], "version": 0.2, "tvm_version": "0.8.0"}
{"input": ["cuda -keys=cuda,gpu -max_num_threads=1024 -thread_warp_size=32", "attn_v_pad_matmul.cuda", [["TENSOR", [128, 49, 49], "float16"], ["TENSOR", [128, 32, 49], "float16"]], {}], "config": {"index": 3468, "code_hash": null, "entity": [["block_row_warps", "ot", 1], ["block_col_warps", "ot", 2], ["warp_row_tiles", "ot", 2], ["warp_col_tiles", "ot", 4], ["chunk", "ot", 4], ["offset", "ot", 0], ["offsetCS", "ot", 8], ["vec", "ot", 4], ["wmma_m", "ot", 32]]}, "result": [[1.5391158e-05], 0, 1.563424825668335, 1651926815.5086613], "version": 0.2, "tvm_version": "0.8.0"}
{"input": ["cuda -keys=cuda,gpu -max_num_threads=1024 -thread_warp_size=32", "attn_v_pad_matmul.cuda", [["TENSOR", [128, 49, 49], "float16"], ["TENSOR", [128, 32, 49], "float16"]], {}], "config": {"index": 1524, "code_hash": null, "entity": [["block_row_warps", "ot", 1], ["block_col_warps", "ot", 2], ["warp_row_tiles", "ot", 2], ["warp_col_tiles", "ot", 4], ["chunk", "ot", 4], ["offset", "ot", 0], ["offsetCS", "ot", 0], ["vec", "ot", 2], ["wmma_m", "ot", 32]]}, "result": [[1.5265528e-05], 0, 1.974557876586914, 1651926816.4583952], "version": 0.2, "tvm_version": "0.8.0"}
{"input": ["cuda -keys=cuda,gpu -max_num_threads=1024 -thread_warp_size=32", "attn_v_pad_matmul.cuda", [["TENSOR", [128, 49, 49], "float16"], ["TENSOR", [128, 32, 49], "float16"]], {}], "config": {"index": 3225, "code_hash": null, "entity": [["block_row_warps", "ot", 1], ["block_col_warps", "ot", 2], ["warp_row_tiles", "ot", 2], ["warp_col_tiles", "ot", 4], ["chunk", "ot", 8], ["offset", "ot", 8], ["offsetCS", "ot", 0], ["vec", "ot", 4], ["wmma_m", "ot", 32]]}, "result": [[1.2658533999999999e-05], 0, 1.6933989524841309, 1651926817.171683], "version": 0.2, "tvm_version": "0.8.0"}
{"input": ["cuda -keys=cuda,gpu -max_num_threads=1024 -thread_warp_size=32", "attn_v_pad_matmul.cuda", [["TENSOR", [128, 49, 49], "float16"], ["TENSOR", [128, 32, 49], "float16"]], {}], "config": {"index": 1281, "code_hash": null, "entity": [["block_row_warps", "ot", 1], ["block_col_warps", "ot", 2], ["warp_row_tiles", "ot", 2], ["warp_col_tiles", "ot", 4], ["chunk", "ot", 8], ["offset", "ot", 8], ["offsetCS", "ot", 8], ["vec", "ot", 1], ["wmma_m", "ot", 32]]}, "result": [[1.0815462999999999e-05], 0, 1.560462474822998, 1651926817.6647134], "version": 0.2, "tvm_version": "0.8.0"}
{"input": ["cuda -keys=cuda,gpu -max_num_threads=1024 -thread_warp_size=32", "attn_v_pad_matmul.cuda", [["TENSOR", [128, 49, 49], "float16"], ["TENSOR", [128, 32, 49], "float16"]], {}], "config": {"index": 876, "code_hash": null, "entity": [["block_row_warps", "ot", 1], ["block_col_warps", "ot", 2], ["warp_row_tiles", "ot", 2], ["warp_col_tiles", "ot", 4], ["chunk", "ot", 4], ["offset", "ot", 0], ["offsetCS", "ot", 8], ["vec", "ot", 1], ["wmma_m", "ot", 32]]}, "result": [[1.4316468e-05], 0, 1.3448126316070557, 1651926818.110393], "version": 0.2, "tvm_version": "0.8.0"}
{"input": ["cuda -keys=cuda,gpu -max_num_threads=1024 -thread_warp_size=32", "attn_v_pad_matmul.cuda", [["TENSOR", [128, 49, 49], "float16"], ["TENSOR", [128, 32, 49], "float16"]], {}], "config": {"index": 957, "code_hash": null, "entity": [["block_row_warps", "ot", 1], ["block_col_warps", "ot", 2], ["warp_row_tiles", "ot", 2], ["warp_col_tiles", "ot", 4], ["chunk", "ot", 8], ["offset", "ot", 0], ["offsetCS", "ot", 8], ["vec", "ot", 1], ["wmma_m", "ot", 32]]}, "result": [[1.4555424e-05], 0, 2.099411964416504, 1651926819.0798469], "version": 0.2, "tvm_version": "0.8.0"}
{"input": ["cuda -keys=cuda,gpu -max_num_threads=1024 -thread_warp_size=32", "attn_v_pad_matmul.cuda", [["TENSOR", [128, 49, 49], "float16"], ["TENSOR", [128, 32, 49], "float16"]], {}], "config": {"index": 228, "code_hash": null, "entity": [["block_row_warps", "ot", 1], ["block_col_warps", "ot", 2], ["warp_row_tiles", "ot", 2], ["warp_col_tiles", "ot", 4], ["chunk", "ot", 4], ["offset", "ot", 0], ["offsetCS", "ot", 0], ["vec", "ot", 1], ["wmma_m", "ot", 32]]}, "result": [[1.5478906e-05], 0, 1.6083917617797852, 1651926819.799391], "version": 0.2, "tvm_version": "0.8.0"}
{"input": ["cuda -keys=cuda,gpu -max_num_threads=1024 -thread_warp_size=32", "attn_v_pad_matmul.cuda", [["TENSOR", [128, 49, 49], "float16"], ["TENSOR", [128, 32, 49], "float16"]], {}], "config": {"index": 2901, "code_hash": null, "entity": [["block_row_warps", "ot", 1], ["block_col_warps", "ot", 2], ["warp_row_tiles", "ot", 2], ["warp_col_tiles", "ot", 4], ["chunk", "ot", 8], ["offset", "ot", 0], ["offsetCS", "ot", 0], ["vec", "ot", 4], ["wmma_m", "ot", 32]]}, "result": [[1.5770331000000002e-05], 0, 1.7615993022918701, 1651926820.4357772], "version": 0.2, "tvm_version": "0.8.0"}
{"input": ["cuda -keys=cuda,gpu -max_num_threads=1024 -thread_warp_size=32", "attn_v_pad_matmul.cuda", [["TENSOR", [128, 49, 49], "float16"], ["TENSOR", [128, 32, 49], "float16"]], {}], "config": {"index": 2577, "code_hash": null, "entity": [["block_row_warps", "ot", 1], ["block_col_warps", "ot", 2], ["warp_row_tiles", "ot", 2], ["warp_col_tiles", "ot", 4], ["chunk", "ot", 8], ["offset", "ot", 8], ["offsetCS", "ot", 8], ["vec", "ot", 2], ["wmma_m", "ot", 32]]}, "result": [[1.0874794e-05], 0, 1.4621601104736328, 1651926821.0028567], "version": 0.2, "tvm_version": "0.8.0"}
{"input": ["cuda -keys=cuda,gpu -max_num_threads=1024 -thread_warp_size=32", "attn_v_pad_matmul.cuda", [["TENSOR", [128, 49, 49], "float16"], ["TENSOR", [128, 32, 49], "float16"]], {}], "config": {"index": 5394, "code_hash": null, "entity": [["block_row_warps", "ot", 1], ["block_col_warps", "ot", 2], ["warp_row_tiles", "ot", 4], ["warp_col_tiles", "ot", 2], ["chunk", "ot", 4], ["offset", "ot", 0], ["offsetCS", "ot", 0], ["vec", "ot", 1], ["wmma_m", "ot", 16]]}, "result": [[1.5452121999999997e-05], 0, 1.9854755401611328, 1651926821.8171198], "version": 0.2, "tvm_version": "0.8.0"}
{"input": ["cuda -keys=cuda,gpu -max_num_threads=1024 -thread_warp_size=32", "attn_v_pad_matmul.cuda", [["TENSOR", [128, 49, 49], "float16"], ["TENSOR", [128, 32, 49], "float16"]], {}], "config": {"index": 309, "code_hash": null, "entity": [["block_row_warps", "ot", 1], ["block_col_warps", "ot", 2], ["warp_row_tiles", "ot", 2], ["warp_col_tiles", "ot", 4], ["chunk", "ot", 8], ["offset", "ot", 0], ["offsetCS", "ot", 0], ["vec", "ot", 1], ["wmma_m", "ot", 32]]}, "result": [[1.5070393e-05], 0, 1.7141125202178955, 1651926822.5969982], "version": 0.2, "tvm_version": "0.8.0"}
{"input": ["cuda -keys=cuda,gpu -max_num_threads=1024 -thread_warp_size=32", "attn_v_pad_matmul.cuda", [["TENSOR", [128, 49, 49], "float16"], ["TENSOR", [128, 32, 49], "float16"]], {}], "config": {"index": 1200, "code_hash": null, "entity": [["block_row_warps", "ot", 1], ["block_col_warps", "ot", 2], ["warp_row_tiles", "ot", 2], ["warp_col_tiles", "ot", 4], ["chunk", "ot", 4], ["offset", "ot", 8], ["offsetCS", "ot", 8], ["vec", "ot", 1], ["wmma_m", "ot", 32]]}, "result": [[1.0830453e-05], 0, 1.535400629043579, 1651926823.4903817], "version": 0.2, "tvm_version": "0.8.0"}
{"input": ["cuda -keys=cuda,gpu -max_num_threads=1024 -thread_warp_size=32", "attn_v_pad_matmul.cuda", [["TENSOR", [128, 49, 49], "float16"], ["TENSOR", [128, 32, 49], "float16"]], {}], "config": {"index": 5718, "code_hash": null, "entity": [["block_row_warps", "ot", 1], ["block_col_warps", "ot", 2], ["warp_row_tiles", "ot", 4], ["warp_col_tiles", "ot", 2], ["chunk", "ot", 4], ["offset", "ot", 8], ["offsetCS", "ot", 0], ["vec", "ot", 1], ["wmma_m", "ot", 16]]}, "result": [[1.2095049e-05], 0, 1.398123025894165, 1651926824.0509868], "version": 0.2, "tvm_version": "0.8.0"}
{"input": ["cuda -keys=cuda,gpu -max_num_threads=1024 -thread_warp_size=32", "attn_v_pad_matmul.cuda", [["TENSOR", [128, 49, 49], "float16"], ["TENSOR", [128, 32, 49], "float16"]], {}], "config": {"index": 3792, "code_hash": null, "entity": [["block_row_warps", "ot", 1], ["block_col_warps", "ot", 2], ["warp_row_tiles", "ot", 2], ["warp_col_tiles", "ot", 4], ["chunk", "ot", 4], ["offset", "ot", 8], ["offsetCS", "ot", 8], ["vec", "ot", 4], ["wmma_m", "ot", 32]]}, "result": [[1.1264238e-05], 0, 1.6321802139282227, 1651926824.674906], "version": 0.2, "tvm_version": "0.8.0"}
{"input": ["cuda -keys=cuda,gpu -max_num_threads=1024 -thread_warp_size=32", "attn_v_pad_matmul.cuda", [["TENSOR", [128, 49, 49], "float16"], ["TENSOR", [128, 32, 49], "float16"]], {}], "config": {"index": 8310, "code_hash": null, "entity": [["block_row_warps", "ot", 1], ["block_col_warps", "ot", 2], ["warp_row_tiles", "ot", 4], ["warp_col_tiles", "ot", 2], ["chunk", "ot", 4], ["offset", "ot", 8], ["offsetCS", "ot", 0], ["vec", "ot", 4], ["wmma_m", "ot", 16]]}, "result": [[1.252124e-05], 0, 2.273040294647217, 1651926825.7000384], "version": 0.2, "tvm_version": "0.8.0"}
{"input": ["cuda -keys=cuda,gpu -max_num_threads=1024 -thread_warp_size=32", "attn_v_pad_matmul.cuda", [["TENSOR", [128, 49, 49], "float16"], ["TENSOR", [128, 32, 49], "float16"]], {}], "config": {"index": 3549, "code_hash": null, "entity": [["block_row_warps", "ot", 1], ["block_col_warps", "ot", 2], ["warp_row_tiles", "ot", 2], ["warp_col_tiles", "ot", 4], ["chunk", "ot", 8], ["offset", "ot", 0], ["offsetCS", "ot", 8], ["vec", "ot", 4], ["wmma_m", "ot", 32]]}, "result": [[1.5163251e-05], 0, 1.7015433311462402, 1651926826.3399708], "version": 0.2, "tvm_version": "0.8.0"}
{"input": ["cuda -keys=cuda,gpu -max_num_threads=1024 -thread_warp_size=32", "attn_v_pad_matmul.cuda", [["TENSOR", [128, 49, 49], "float16"], ["TENSOR", [128, 32, 49], "float16"]], {}], "config": {"index": 6366, "code_hash": null, "entity": [["block_row_warps", "ot", 1], ["block_col_warps", "ot", 2], ["warp_row_tiles", "ot", 4], ["warp_col_tiles", "ot", 2], ["chunk", "ot", 4], ["offset", "ot", 8], ["offsetCS", "ot", 8], ["vec", "ot", 1], ["wmma_m", "ot", 16]]}, "result": [[1.0982352e-05], 0, 1.905412197113037, 1651926826.9092846], "version": 0.2, "tvm_version": "0.8.0"}
{"input": ["cuda -keys=cuda,gpu -max_num_threads=1024 -thread_warp_size=32", "attn_v_pad_matmul.cuda", [["TENSOR", [128, 49, 49], "float16"], ["TENSOR", [128, 32, 49], "float16"]], {}], "config": {"index": 6042, "code_hash": null, "entity": [["block_row_warps", "ot", 1], ["block_col_warps", "ot", 2], ["warp_row_tiles", "ot", 4], ["warp_col_tiles", "ot", 2], ["chunk", "ot", 4], ["offset", "ot", 0], ["offsetCS", "ot", 8], ["vec", "ot", 1], ["wmma_m", "ot", 16]]}, "result": [[1.4193687e-05], 0, 1.791518211364746, 1651926827.765301], "version": 0.2, "tvm_version": "0.8.0"}
{"input": ["cuda -keys=cuda,gpu -max_num_threads=1024 -thread_warp_size=32", "attn_v_pad_matmul.cuda", [["TENSOR", [128, 49, 49], "float16"], ["TENSOR", [128, 32, 49], "float16"]], {}], "config": {"index": 6447, "code_hash": null, "entity": [["block_row_warps", "ot", 1], ["block_col_warps", "ot", 2], ["warp_row_tiles", "ot", 4], ["warp_col_tiles", "ot", 2], ["chunk", "ot", 8], ["offset", "ot", 8], ["offsetCS", "ot", 8], ["vec", "ot", 1], ["wmma_m", "ot", 16]]}, "result": [[1.0881574e-05], 0, 1.5097155570983887, 1651926828.4920404], "version": 0.2, "tvm_version": "0.8.0"}
{"input": ["cuda -keys=cuda,gpu -max_num_threads=1024 -thread_warp_size=32", "attn_v_pad_matmul.cuda", [["TENSOR", [128, 49, 49], "float16"], ["TENSOR", [128, 32, 49], "float16"]], {}], "config": {"index": 7419, "code_hash": null, "entity": [["block_row_warps", "ot", 1], ["block_col_warps", "ot", 2], ["warp_row_tiles", "ot", 4], ["warp_col_tiles", "ot", 2], ["chunk", "ot", 8], ["offset", "ot", 0], ["offsetCS", "ot", 8], ["vec", "ot", 2], ["wmma_m", "ot", 16]]}, "result": [[1.3704276999999999e-05], 0, 1.817479133605957, 1651926829.221727], "version": 0.2, "tvm_version": "0.8.0"}
{"input": ["cuda -keys=cuda,gpu -max_num_threads=1024 -thread_warp_size=32", "attn_v_pad_matmul.cuda", [["TENSOR", [128, 49, 49], "float16"], ["TENSOR", [128, 32, 49], "float16"]], {}], "config": {"index": 1929, "code_hash": null, "entity": [["block_row_warps", "ot", 1], ["block_col_warps", "ot", 2], ["warp_row_tiles", "ot", 2], ["warp_col_tiles", "ot", 4], ["chunk", "ot", 8], ["offset", "ot", 8], ["offsetCS", "ot", 0], ["vec", "ot", 2], ["wmma_m", "ot", 32]]}, "result": [[1.1614266e-05], 0, 2.091891050338745, 1651926830.1119685], "version": 0.2, "tvm_version": "0.8.0"}
{"input": ["cuda -keys=cuda,gpu -max_num_threads=1024 -thread_warp_size=32", "attn_v_pad_matmul.cuda", [["TENSOR", [128, 49, 49], "float16"], ["TENSOR", [128, 32, 49], "float16"]], {}], "config": {"index": 8634, "code_hash": null, "entity": [["block_row_warps", "ot", 1], ["block_col_warps", "ot", 2], ["warp_row_tiles", "ot", 4], ["warp_col_tiles", "ot", 2], ["chunk", "ot", 4], ["offset", "ot", 0], ["offsetCS", "ot", 8], ["vec", "ot", 4], ["wmma_m", "ot", 16]]}, "result": [[1.5906885000000004e-05], 0, 1.808645486831665, 1651926830.7996352], "version": 0.2, "tvm_version": "0.8.0"}
{"input": ["cuda -keys=cuda,gpu -max_num_threads=1024 -thread_warp_size=32", "attn_v_pad_matmul.cuda", [["TENSOR", [128, 49, 49], "float16"], ["TENSOR", [128, 32, 49], "float16"]], {}], "config": {"index": 7743, "code_hash": null, "entity": [["block_row_warps", "ot", 1], ["block_col_warps", "ot", 2], ["warp_row_tiles", "ot", 4], ["warp_col_tiles", "ot", 2], ["chunk", "ot", 8], ["offset", "ot", 8], ["offsetCS", "ot", 8], ["vec", "ot", 2], ["wmma_m", "ot", 16]]}, "result": [[1.0786626e-05], 0, 1.8691399097442627, 1651926831.5485451], "version": 0.2, "tvm_version": "0.8.0"}
{"input": ["cuda -keys=cuda,gpu -max_num_threads=1024 -thread_warp_size=32", "attn_v_pad_matmul.cuda", [["TENSOR", [128, 49, 49], "float16"], ["TENSOR", [128, 32, 49], "float16"]], {}], "config": {"index": 7095, "code_hash": null, "entity": [["block_row_warps", "ot", 1], ["block_col_warps", "ot", 2], ["warp_row_tiles", "ot", 4], ["warp_col_tiles", "ot", 2], ["chunk", "ot", 8], ["offset", "ot", 8], ["offsetCS", "ot", 0], ["vec", "ot", 2], ["wmma_m", "ot", 16]]}, "result": [[1.1724497e-05], 0, 2.1307923793792725, 1651926832.449094], "version": 0.2, "tvm_version": "0.8.0"}
{"input": ["cuda -keys=cuda,gpu -max_num_threads=1024 -thread_warp_size=32", "attn_v_pad_matmul.cuda", [["TENSOR", [128, 49, 49], "float16"], ["TENSOR", [128, 32, 49], "float16"]], {}], "config": {"index": 9039, "code_hash": null, "entity": [["block_row_warps", "ot", 1], ["block_col_warps", "ot", 2], ["warp_row_tiles", "ot", 4], ["warp_col_tiles", "ot", 2], ["chunk", "ot", 8], ["offset", "ot", 8], ["offsetCS", "ot", 8], ["vec", "ot", 4], ["wmma_m", "ot", 16]]}, "result": [[1.1421238e-05], 0, 1.6423404216766357, 1651926832.9811888], "version": 0.2, "tvm_version": "0.8.0"}
{"input": ["cuda -keys=cuda,gpu -max_num_threads=1024 -thread_warp_size=32", "attn_v_pad_matmul.cuda", [["TENSOR", [128, 49, 49], "float16"], ["TENSOR", [128, 32, 49], "float16"]], {}], "config": {"index": 8715, "code_hash": null, "entity": [["block_row_warps", "ot", 1], ["block_col_warps", "ot", 2], ["warp_row_tiles", "ot", 4], ["warp_col_tiles", "ot", 2], ["chunk", "ot", 8], ["offset", "ot", 0], ["offsetCS", "ot", 8], ["vec", "ot", 4], ["wmma_m", "ot", 16]]}, "result": [[1.4838710000000001e-05], 0, 1.6529195308685303, 1651926833.6319916], "version": 0.2, "tvm_version": "0.8.0"}
{"input": ["cuda -keys=cuda,gpu -max_num_threads=1024 -thread_warp_size=32", "attn_v_pad_matmul.cuda", [["TENSOR", [128, 49, 49], "float16"], ["TENSOR", [128, 32, 49], "float16"]], {}], "config": {"index": 1605, "code_hash": null, "entity": [["block_row_warps", "ot", 1], ["block_col_warps", "ot", 2], ["warp_row_tiles", "ot", 2], ["warp_col_tiles", "ot", 4], ["chunk", "ot", 8], ["offset", "ot", 0], ["offsetCS", "ot", 0], ["vec", "ot", 2], ["wmma_m", "ot", 32]]}, "result": [[1.4986201e-05], 0, 1.9792449474334717, 1651926834.4484553], "version": 0.2, "tvm_version": "0.8.0"}
{"input": ["cuda -keys=cuda,gpu -max_num_threads=1024 -thread_warp_size=32", "attn_v_pad_matmul.cuda", [["TENSOR", [128, 49, 49], "float16"], ["TENSOR", [128, 32, 49], "float16"]], {}], "config": {"index": 6771, "code_hash": null, "entity": [["block_row_warps", "ot", 1], ["block_col_warps", "ot", 2], ["warp_row_tiles", "ot", 4], ["warp_col_tiles", "ot", 2], ["chunk", "ot", 8], ["offset", "ot", 0], ["offsetCS", "ot", 0], ["vec", "ot", 2], ["wmma_m", "ot", 16]]}, "result": [[1.4745726e-05], 0, 2.059852361679077, 1651926835.29982], "version": 0.2, "tvm_version": "0.8.0"}
{"input": ["cuda -keys=cuda,gpu -max_num_threads=1024 -thread_warp_size=32", "attn_v_pad_matmul.cuda", [["TENSOR", [128, 49, 49], "float16"], ["TENSOR", [128, 32, 49], "float16"]], {}], "config": {"index": 6690, "code_hash": null, "entity": [["block_row_warps", "ot", 1], ["block_col_warps", "ot", 2], ["warp_row_tiles", "ot", 4], ["warp_col_tiles", "ot", 2], ["chunk", "ot", 4], ["offset", "ot", 0], ["offsetCS", "ot", 0], ["vec", "ot", 2], ["wmma_m", "ot", 16]]}, "result": [[1.5072409e-05], 0, 1.5069074630737305, 1651926835.892177], "version": 0.2, "tvm_version": "0.8.0"}
{"input": ["cuda -keys=cuda,gpu -max_num_threads=1024 -thread_warp_size=32", "attn_v_pad_matmul.cuda", [["TENSOR", [128, 49, 49], "float16"], ["TENSOR", [128, 32, 49], "float16"]], {}], "config": {"index": 3873, "code_hash": null, "entity": [["block_row_warps", "ot", 1], ["block_col_warps", "ot", 2], ["warp_row_tiles", "ot", 2], ["warp_col_tiles", "ot", 4], ["chunk", "ot", 8], ["offset", "ot", 8], ["offsetCS", "ot", 8], ["vec", "ot", 4], ["wmma_m", "ot", 32]]}, "result": [[1.1473233e-05], 0, 2.032865047454834, 1651926836.5752575], "version": 0.2, "tvm_version": "0.8.0"}
{"input": ["cuda -keys=cuda,gpu -max_num_threads=1024 -thread_warp_size=32", "attn_v_pad_matmul.cuda", [["TENSOR", [128, 49, 49], "float16"], ["TENSOR", [128, 32, 49], "float16"]], {}], "config": {"index": 2820, "code_hash": null, "entity": [["block_row_warps", "ot", 1], ["block_col_warps", "ot", 2], ["warp_row_tiles", "ot", 2], ["warp_col_tiles", "ot", 4], ["chunk", "ot", 4], ["offset", "ot", 0], ["offsetCS", "ot", 0], ["vec", "ot", 4], ["wmma_m", "ot", 32]]}, "result": [[1.5681113e-05], 0, 2.1521108150482178, 1651926837.500396], "version": 0.2, "tvm_version": "0.8.0"}
{"input": ["cuda -keys=cuda,gpu -max_num_threads=1024 -thread_warp_size=32", "attn_v_pad_matmul.cuda", [["TENSOR", [128, 49, 49], "float16"], ["TENSOR", [128, 32, 49], "float16"]], {}], "config": {"index": 7662, "code_hash": null, "entity": [["block_row_warps", "ot", 1], ["block_col_warps", "ot", 2], ["warp_row_tiles", "ot", 4], ["warp_col_tiles", "ot", 2], ["chunk", "ot", 4], ["offset", "ot", 8], ["offsetCS", "ot", 8], ["vec", "ot", 2], ["wmma_m", "ot", 16]]}, "result": [[1.0710972999999999e-05], 0, 1.4721298217773438, 1651926838.1331768], "version": 0.2, "tvm_version": "0.8.0"}
{"input": ["cuda -keys=cuda,gpu -max_num_threads=1024 -thread_warp_size=32", "attn_v_pad_matmul.cuda", [["TENSOR", [128, 49, 49], "float16"], ["TENSOR", [128, 32, 49], "float16"]], {}], "config": {"index": 8391, "code_hash": null, "entity": [["block_row_warps", "ot", 1], ["block_col_warps", "ot", 2], ["warp_row_tiles", "ot", 4], ["warp_col_tiles", "ot", 2], ["chunk", "ot", 8], ["offset", "ot", 8], ["offsetCS", "ot", 0], ["vec", "ot", 4], ["wmma_m", "ot", 16]]}, "result": [[1.2596253e-05], 0, 1.8144986629486084, 1651926838.7647247], "version": 0.2, "tvm_version": "0.8.0"}
{"input": ["cuda -keys=cuda,gpu -max_num_threads=1024 -thread_warp_size=32", "attn_v_pad_matmul.cuda", [["TENSOR", [128, 49, 49], "float16"], ["TENSOR", [128, 32, 49], "float16"]], {}], "config": {"index": 7338, "code_hash": null, "entity": [["block_row_warps", "ot", 1], ["block_col_warps", "ot", 2], ["warp_row_tiles", "ot", 4], ["warp_col_tiles", "ot", 2], ["chunk", "ot", 4], ["offset", "ot", 0], ["offsetCS", "ot", 8], ["vec", "ot", 2], ["wmma_m", "ot", 16]]}, "result": [[1.3887639e-05], 0, 1.6474826335906982, 1651926839.6613517], "version": 0.2, "tvm_version": "0.8.0"}
{"input": ["cuda -keys=cuda,gpu -max_num_threads=1024 -thread_warp_size=32", "attn_v_pad_matmul.cuda", [["TENSOR", [128, 49, 49], "float16"], ["TENSOR", [128, 32, 49], "float16"]], {}], "config": {"index": 7014, "code_hash": null, "entity": [["block_row_warps", "ot", 1], ["block_col_warps", "ot", 2], ["warp_row_tiles", "ot", 4], ["warp_col_tiles", "ot", 2], ["chunk", "ot", 4], ["offset", "ot", 8], ["offsetCS", "ot", 0], ["vec", "ot", 2], ["wmma_m", "ot", 16]]}, "result": [[1.1872362000000001e-05], 0, 1.5474011898040771, 1651926840.3770704], "version": 0.2, "tvm_version": "0.8.0"}
{"input": ["cuda -keys=cuda,gpu -max_num_threads=1024 -thread_warp_size=32", "attn_v_pad_matmul.cuda", [["TENSOR", [128, 49, 49], "float16"], ["TENSOR", [128, 32, 49], "float16"]], {}], "config": {"index": 3144, "code_hash": null, "entity": [["block_row_warps", "ot", 1], ["block_col_warps", "ot", 2], ["warp_row_tiles", "ot", 2], ["warp_col_tiles", "ot", 4], ["chunk", "ot", 4], ["offset", "ot", 8], ["offsetCS", "ot", 0], ["vec", "ot", 4], ["wmma_m", "ot", 32]]}, "result": [[1.2286997e-05], 0, 1.8027698993682861, 1651926841.2763336], "version": 0.2, "tvm_version": "0.8.0"}
{"input": ["cuda -keys=cuda,gpu -max_num_threads=1024 -thread_warp_size=32", "attn_v_pad_matmul.cuda", [["TENSOR", [128, 49, 49], "float16"], ["TENSOR", [128, 32, 49], "float16"]], {}], "config": {"index": 7986, "code_hash": null, "entity": [["block_row_warps", "ot", 1], ["block_col_warps", "ot", 2], ["warp_row_tiles", "ot", 4], ["warp_col_tiles", "ot", 2], ["chunk", "ot", 4], ["offset", "ot", 0], ["offsetCS", "ot", 0], ["vec", "ot", 4], ["wmma_m", "ot", 16]]}, "result": [[1.5700887000000002e-05], 0, 1.9065735340118408, 1651926841.948075], "version": 0.2, "tvm_version": "0.8.0"}
{"input": ["cuda -keys=cuda,gpu -max_num_threads=1024 -thread_warp_size=32", "attn_v_pad_matmul.cuda", [["TENSOR", [128, 49, 49], "float16"], ["TENSOR", [128, 32, 49], "float16"]], {}], "config": {"index": 1848, "code_hash": null, "entity": [["block_row_warps", "ot", 1], ["block_col_warps", "ot", 2], ["warp_row_tiles", "ot", 2], ["warp_col_tiles", "ot", 4], ["chunk", "ot", 4], ["offset", "ot", 8], ["offsetCS", "ot", 0], ["vec", "ot", 2], ["wmma_m", "ot", 32]]}, "result": [[1.1673532e-05], 0, 1.921936273574829, 1651926842.6972766], "version": 0.2, "tvm_version": "0.8.0"}
{"input": ["cuda -keys=cuda,gpu -max_num_threads=1024 -thread_warp_size=32", "attn_v_pad_matmul.cuda", [["TENSOR", [128, 49, 49], "float16"], ["TENSOR", [128, 32, 49], "float16"]], {}], "config": {"index": 8958, "code_hash": null, "entity": [["block_row_warps", "ot", 1], ["block_col_warps", "ot", 2], ["warp_row_tiles", "ot", 4], ["warp_col_tiles", "ot", 2], ["chunk", "ot", 4], ["offset", "ot", 8], ["offsetCS", "ot", 8], ["vec", "ot", 4], ["wmma_m", "ot", 16]]}, "result": [[1.1201466999999999e-05], 0, 1.4699041843414307, 1651926845.0249689], "version": 0.2, "tvm_version": "0.8.0"}
{"input": ["cuda -keys=cuda,gpu -max_num_threads=1024 -thread_warp_size=32", "attn_v_pad_matmul.cuda", [["TENSOR", [128, 49, 49], "float16"], ["TENSOR", [128, 32, 49], "float16"]], {}], "config": {"index": 2172, "code_hash": null, "entity": [["block_row_warps", "ot", 1], ["block_col_warps", "ot", 2], ["warp_row_tiles", "ot", 2], ["warp_col_tiles", "ot", 4], ["chunk", "ot", 4], ["offset", "ot", 0], ["offsetCS", "ot", 8], ["vec", "ot", 2], ["wmma_m", "ot", 32]]}, "result": [[1.4076821000000001e-05], 0, 1.5169970989227295, 1651926845.6454291], "version": 0.2, "tvm_version": "0.8.0"}
{"input": ["cuda -keys=cuda,gpu -max_num_threads=1024 -thread_warp_size=32", "attn_v_pad_matmul.cuda", [["TENSOR", [128, 49, 49], "float16"], ["TENSOR", [128, 32, 49], "float16"]], {}], "config": {"index": 2496, "code_hash": null, "entity": [["block_row_warps", "ot", 1], ["block_col_warps", "ot", 2], ["warp_row_tiles", "ot", 2], ["warp_col_tiles", "ot", 4], ["chunk", "ot", 4], ["offset", "ot", 8], ["offsetCS", "ot", 8], ["vec", "ot", 2], ["wmma_m", "ot", 32]]}, "result": [[1.0984556e-05], 0, 2.1230201721191406, 1651926846.6419723], "version": 0.2, "tvm_version": "0.8.0"}
{"input": ["cuda -keys=cuda,gpu -max_num_threads=1024 -thread_warp_size=32", "attn_v_pad_matmul.cuda", [["TENSOR", [128, 49, 49], "float16"], ["TENSOR", [128, 32, 49], "float16"]], {}], "config": {"index": 5475, "code_hash": null, "entity": [["block_row_warps", "ot", 1], ["block_col_warps", "ot", 2], ["warp_row_tiles", "ot", 4], ["warp_col_tiles", "ot", 2], ["chunk", "ot", 8], ["offset", "ot", 0], ["offsetCS", "ot", 0], ["vec", "ot", 1], ["wmma_m", "ot", 16]]}, "result": [[1.5290976e-05], 0, 1.572584629058838, 1651926847.3068779], "version": 0.2, "tvm_version": "0.8.0"}
{"input": ["cuda -keys=cuda,gpu -max_num_threads=1024 -thread_warp_size=32", "attn_v_pad_matmul.cuda", [["TENSOR", [128, 49, 49], "float16"], ["TENSOR", [128, 32, 49], "float16"]], {}], "config": {"index": 2253, "code_hash": null, "entity": [["block_row_warps", "ot", 1], ["block_col_warps", "ot", 2], ["warp_row_tiles", "ot", 2], ["warp_col_tiles", "ot", 4], ["chunk", "ot", 8], ["offset", "ot", 0], ["offsetCS", "ot", 8], ["vec", "ot", 2], ["wmma_m", "ot", 32]]}, "result": [[1.4292076e-05], 0, 1.5536651611328125, 1651926847.9551296], "version": 0.2, "tvm_version": "0.8.0"}
{"input": ["cuda -keys=cuda,gpu -max_num_threads=1024 -thread_warp_size=32", "attn_v_pad_matmul.cuda", [["TENSOR", [128, 49, 49], "float16"], ["TENSOR", [128, 32, 49], "float16"]], {}], "config": {"index": 5799, "code_hash": null, "entity": [["block_row_warps", "ot", 1], ["block_col_warps", "ot", 2], ["warp_row_tiles", "ot", 4], ["warp_col_tiles", "ot", 2], ["chunk", "ot", 8], ["offset", "ot", 8], ["offsetCS", "ot", 0], ["vec", "ot", 1], ["wmma_m", "ot", 16]]}, "result": [[1.2308048000000001e-05], 0, 1.7779974937438965, 1651926848.7691336], "version": 0.2, "tvm_version": "0.8.0"}
{"input": ["cuda -keys=cuda,gpu -max_num_threads=1024 -thread_warp_size=32", "attn_v_pad_matmul.cuda", [["TENSOR", [128, 49, 49], "float16"], ["TENSOR", [128, 32, 49], "float16"]], {}], "config": {"index": 6123, "code_hash": null, "entity": [["block_row_warps", "ot", 1], ["block_col_warps", "ot", 2], ["warp_row_tiles", "ot", 4], ["warp_col_tiles", "ot", 2], ["chunk", "ot", 8], ["offset", "ot", 0], ["offsetCS", "ot", 8], ["vec", "ot", 1], ["wmma_m", "ot", 16]]}, "result": [[1.4365466e-05], 0, 1.6877992153167725, 1651926849.63661], "version": 0.2, "tvm_version": "0.8.0"}
{"input": ["cuda -keys=cuda,gpu -max_num_threads=1024 -thread_warp_size=32", "attn_v_pad_matmul.cuda", [["TENSOR", [128, 49, 49], "float16"], ["TENSOR", [128, 32, 49], "float16"]], {}], "config": {"index": 8067, "code_hash": null, "entity": [["block_row_warps", "ot", 1], ["block_col_warps", "ot", 2], ["warp_row_tiles", "ot", 4], ["warp_col_tiles", "ot", 2], ["chunk", "ot", 8], ["offset", "ot", 0], ["offsetCS", "ot", 0], ["vec", "ot", 4], ["wmma_m", "ot", 16]]}, "result": [[1.5396529e-05], 0, 1.709193468093872, 1651926850.2976797], "version": 0.2, "tvm_version": "0.8.0"}
{"input": ["cuda -keys=cuda,gpu -max_num_threads=1024 -thread_warp_size=32", "attn_v_pad_matmul.cuda", [["TENSOR", [128, 49, 49], "float16"], ["TENSOR", [128, 32, 49], "float16"]], {}], "config": {"index": 4116, "code_hash": null, "entity": [["block_row_warps", "ot", 1], ["block_col_warps", "ot", 2], ["warp_row_tiles", "ot", 2], ["warp_col_tiles", "ot", 4], ["chunk", "ot", 4], ["offset", "ot", 0], ["offsetCS", "ot", 0], ["vec", "ot", 8], ["wmma_m", "ot", 32]]}, "result": [[1.9658124000000003e-05], 0, 1.7090809345245361, 1651926851.1461468], "version": 0.2, "tvm_version": "0.8.0"}
{"input": ["cuda -keys=cuda,gpu -max_num_threads=1024 -thread_warp_size=32", "attn_v_pad_matmul.cuda", [["TENSOR", [128, 49, 49], "float16"], ["TENSOR", [128, 32, 49], "float16"]], {}], "config": {"index": 4440, "code_hash": null, "entity": [["block_row_warps", "ot", 1], ["block_col_warps", "ot", 2], ["warp_row_tiles", "ot", 2], ["warp_col_tiles", "ot", 4], ["chunk", "ot", 4], ["offset", "ot", 8], ["offsetCS", "ot", 0], ["vec", "ot", 8], ["wmma_m", "ot", 32]]}, "result": [[1.5682265e-05], 0, 1.6784634590148926, 1651926851.8689046], "version": 0.2, "tvm_version": "0.8.0"}
{"input": ["cuda -keys=cuda,gpu -max_num_threads=1024 -thread_warp_size=32", "attn_v_pad_matmul.cuda", [["TENSOR", [128, 49, 49], "float16"], ["TENSOR", [128, 32, 49], "float16"]], {}], "config": {"index": 4197, "code_hash": null, "entity": [["block_row_warps", "ot", 1], ["block_col_warps", "ot", 2], ["warp_row_tiles", "ot", 2], ["warp_col_tiles", "ot", 4], ["chunk", "ot", 8], ["offset", "ot", 0], ["offsetCS", "ot", 0], ["vec", "ot", 8], ["wmma_m", "ot", 32]]}, "result": [[1.9397840999999998e-05], 0, 1.7260448932647705, 1651926852.6260211], "version": 0.2, "tvm_version": "0.8.0"}
{"input": ["cuda -keys=cuda,gpu -max_num_threads=1024 -thread_warp_size=32", "attn_v_pad_matmul.cuda", [["TENSOR", [128, 49, 49], "float16"], ["TENSOR", [128, 32, 49], "float16"]], {}], "config": {"index": 9363, "code_hash": null, "entity": [["block_row_warps", "ot", 1], ["block_col_warps", "ot", 2], ["warp_row_tiles", "ot", 4], ["warp_col_tiles", "ot", 2], ["chunk", "ot", 8], ["offset", "ot", 0], ["offsetCS", "ot", 0], ["vec", "ot", 8], ["wmma_m", "ot", 16]]}, "result": [[1.9052455999999997e-05], 0, 1.9586186408996582, 1651926853.3715734], "version": 0.2, "tvm_version": "0.8.0"}
{"input": ["cuda -keys=cuda,gpu -max_num_threads=1024 -thread_warp_size=32", "attn_v_pad_matmul.cuda", [["TENSOR", [128, 49, 49], "float16"], ["TENSOR", [128, 32, 49], "float16"]], {}], "config": {"index": 5088, "code_hash": null, "entity": [["block_row_warps", "ot", 1], ["block_col_warps", "ot", 2], ["warp_row_tiles", "ot", 2], ["warp_col_tiles", "ot", 4], ["chunk", "ot", 4], ["offset", "ot", 8], ["offsetCS", "ot", 8], ["vec", "ot", 8], ["wmma_m", "ot", 32]]}, "result": [[1.4430005e-05], 0, 1.5832595825195312, 1651926853.9489892], "version": 0.2, "tvm_version": "0.8.0"}
{"input": ["cuda -keys=cuda,gpu -max_num_threads=1024 -thread_warp_size=32", "attn_v_pad_matmul.cuda", [["TENSOR", [128, 49, 49], "float16"], ["TENSOR", [128, 32, 49], "float16"]], {}], "config": {"index": 4845, "code_hash": null, "entity": [["block_row_warps", "ot", 1], ["block_col_warps", "ot", 2], ["warp_row_tiles", "ot", 2], ["warp_col_tiles", "ot", 4], ["chunk", "ot", 8], ["offset", "ot", 0], ["offsetCS", "ot", 8], ["vec", "ot", 8], ["wmma_m", "ot", 32]]}, "result": [[1.7726417e-05], 0, 1.527829647064209, 1651926854.5848567], "version": 0.2, "tvm_version": "0.8.0"}
{"input": ["cuda -keys=cuda,gpu -max_num_threads=1024 -thread_warp_size=32", "attn_v_pad_matmul.cuda", [["TENSOR", [128, 49, 49], "float16"], ["TENSOR", [128, 32, 49], "float16"]], {}], "config": {"index": 4521, "code_hash": null, "entity": [["block_row_warps", "ot", 1], ["block_col_warps", "ot", 2], ["warp_row_tiles", "ot", 2], ["warp_col_tiles", "ot", 4], ["chunk", "ot", 8], ["offset", "ot", 8], ["offsetCS", "ot", 0], ["vec", "ot", 8], ["wmma_m", "ot", 32]]}, "result": [[1.5679313e-05], 0, 1.7250261306762695, 1651926855.2854538], "version": 0.2, "tvm_version": "0.8.0"}
{"input": ["cuda -keys=cuda,gpu -max_num_threads=1024 -thread_warp_size=32", "attn_v_pad_matmul.cuda", [["TENSOR", [128, 49, 49], "float16"], ["TENSOR", [128, 32, 49], "float16"]], {}], "config": {"index": 10335, "code_hash": null, "entity": [["block_row_warps", "ot", 1], ["block_col_warps", "ot", 2], ["warp_row_tiles", "ot", 4], ["warp_col_tiles", "ot", 2], ["chunk", "ot", 8], ["offset", "ot", 8], ["offsetCS", "ot", 8], ["vec", "ot", 8], ["wmma_m", "ot", 16]]}, "result": [[1.3704181999999999e-05], 0, 1.647301435470581, 1651926856.1706665], "version": 0.2, "tvm_version": "0.8.0"}
