python/models/swin_transformer/kernel_configs/swin_transformer_fused_reshape_permute_1_64_64_128_8_4
{"i": [["[\"fused_reshape_permute\", 1, 64, 64, 128, 8, 4]", "cuda -keys=cuda,gpu -max_num_threads=1024 -model=unknown -thread_warp_size=32", [-1, 16, 64, 49152, 2147483647, 1024, 8, 32], "", 0, []], [[], [["FU", 1, [0, 1, 2, 3, 4]], ["SP", 1, 0, 1572864, [48], 1], ["AN", 1, 0, 5], ["AN", 1, 1, 6]]]], "r": [[2.66746e-05, 2.76769e-05, 2.66605e-05, 2.71367e-05, 2.66833e-05, 2.66846e-05, 2.66916e-05, 2.66968e-05, 2.66817e-05, 2.66832e-05], 0, 39.0667, 1651933528], "v": "v0.6"}
{"i": [["[\"fused_reshape_permute\", 1, 64, 64, 128, 8, 4]", "cuda -keys=cuda,gpu -max_num_threads=1024 -model=unknown -thread_warp_size=32", [-1, 16, 64, 49152, 2147483647, 1024, 8, 32], "", 0, []], [[], [["FU", 1, [0, 1, 2, 3, 4]], ["SP", 1, 0, 1572864, [64], 1], ["AN", 1, 0, 5], ["AN", 1, 1, 6]]]], "r": [[2.08163e-05, 2.08088e-05, 2.08128e-05, 2.08075e-05, 2.08102e-05, 2.08078e-05, 2.08058e-05, 2.08095e-05, 2.08068e-05, 2.08087e-05], 0, 5.38175, 1651933495], "v": "v0.6"}
{"i": [["[\"fused_reshape_permute\", 1, 64, 64, 128, 8, 4]", "cuda -keys=cuda,gpu -max_num_threads=1024 -model=unknown -thread_warp_size=32", [-1, 16, 64, 49152, 2147483647, 1024, 8, 32], "", 0, []], [[], [["FU", 1, [0, 1, 2, 3, 4]], ["SP", 1, 0, 1572864, [3], 1], ["AN", 1, 0, 5], ["AN", 1, 1, 6]]]], "r": [[0.000401103, 0.000391218, 0.00039109, 0.000391102, 0.00039108, 0.000391092, 0.000391173, 0.000391292, 0.000391094, 0.000391085], 0, 28.4898, 1651933518], "v": "v0.6"}
{"i": [["[\"fused_reshape_permute\", 1, 64, 64, 128, 8, 4]", "cuda -keys=cuda,gpu -max_num_threads=1024 -model=unknown -thread_warp_size=32", [-1, 16, 64, 49152, 2147483647, 1024, 8, 32], "", 0, []], [[], [["FU", 1, [0, 1, 2, 3, 4]], ["SP", 1, 0, 1572864, [2], 1], ["AN", 1, 0, 5], ["AN", 1, 1, 6]]]], "r": [[0.000585461, 0.000585601, 0.000585465, 0.000585577, 0.000585424, 0.000585429, 0.000585438, 0.000585432, 0.000585494, 0.000585544], 0, 10.9693, 1651933500], "v": "v0.6"}
{"i": [["[\"fused_reshape_permute\", 1, 64, 64, 128, 8, 4]", "cuda -keys=cuda,gpu -max_num_threads=1024 -model=unknown -thread_warp_size=32", [-1, 16, 64, 49152, 2147483647, 1024, 8, 32], "", 0, []], [[], [["FU", 1, [0, 1, 2, 3, 4]], ["SP", 1, 0, 1572864, [32], 1], ["AN", 1, 0, 5], ["AN", 1, 1, 6]]]], "r": [[3.90934e-05, 3.90942e-05, 3.90939e-05, 3.90934e-05, 3.90912e-05, 3.90957e-05, 3.90929e-05, 3.90932e-05, 3.90923e-05, 3.9089e-05], 0, 44.4767, 1651933534], "v": "v0.6"}
{"i": [["[\"fused_reshape_permute\", 1, 64, 64, 128, 8, 4]", "cuda -keys=cuda,gpu -max_num_threads=1024 -model=unknown -thread_warp_size=32", [-1, 16, 64, 49152, 2147483647, 1024, 8, 32], "", 0, []], [[], [["FU", 1, [0, 1, 2, 3, 4]], ["SP", 1, 0, 1572864, [1], 1], ["AN", 1, 0, 5], ["AN", 1, 1, 6]]]], "r": [[0.0011689, 0.00116853, 0.00116804, 0.00116809, 0.00116809, 0.00116804, 0.00116811, 0.00116811, 0.00116803, 0.00116809], 0, 22.6254, 1651933512], "v": "v0.6"}
{"i": [["[\"fused_reshape_permute\", 1, 64, 64, 128, 8, 4]", "cuda -keys=cuda,gpu -max_num_threads=1024 -model=unknown -thread_warp_size=32", [-1, 16, 64, 49152, 2147483647, 1024, 8, 32], "", 0, []], [[], [["FU", 1, [0, 1, 2, 3, 4]], ["SP", 1, 0, 1572864, [24], 1], ["AN", 1, 0, 5], ["AN", 1, 1, 6]]]], "r": [[5.14129e-05, 5.14178e-05, 5.14159e-05, 5.14198e-05, 5.14119e-05, 5.14007e-05, 5.14067e-05, 5.14186e-05, 5.14248e-05, 5.14156e-05], 0, 66.8578, 1651933556], "v": "v0.6"}
{"i": [["[\"fused_reshape_permute\", 1, 64, 64, 128, 8, 4]", "cuda -keys=cuda,gpu -max_num_threads=1024 -model=unknown -thread_warp_size=32", [-1, 16, 64, 49152, 2147483647, 1024, 8, 32], "", 0, []], [[], [["FU", 1, [0, 1, 2, 3, 4]], ["SP", 1, 0, 1572864, [16], 1], ["AN", 1, 0, 5], ["AN", 1, 1, 6]]]], "r": [[7.56237e-05, 7.56143e-05, 7.56126e-05, 7.56156e-05, 7.56173e-05, 7.56265e-05, 7.56135e-05, 7.56138e-05, 7.5616e-05, 7.56184e-05], 0, 33.9947, 1651933523], "v": "v0.6"}
{"i": [["[\"fused_reshape_permute\", 1, 64, 64, 128, 8, 4]", "cuda -keys=cuda,gpu -max_num_threads=1024 -model=unknown -thread_warp_size=32", [-1, 16, 64, 49152, 2147483647, 1024, 8, 32], "", 0, []], [[], [["FU", 1, [0, 1, 2, 3, 4]], ["SP", 1, 0, 1572864, [12], 1], ["AN", 1, 0, 5], ["AN", 1, 1, 6]]]], "r": [[9.98219e-05, 9.98052e-05, 9.98092e-05, 9.98074e-05, 9.98212e-05, 9.98163e-05, 9.98791e-05, 9.98601e-05, 9.98066e-05, 9.98235e-05], 0, 16.7938, 1651933506], "v": "v0.6"}
{"i": [["[\"fused_reshape_permute\", 1, 64, 64, 128, 8, 4]", "cuda -keys=cuda,gpu -max_num_threads=1024 -model=unknown -thread_warp_size=32", [-1, 16, 64, 49152, 2147483647, 1024, 8, 32], "", 0, []], [[], [["FU", 1, [0, 1, 2, 3, 4]], ["SP", 1, 0, 1572864, [8], 1], ["AN", 1, 0, 5], ["AN", 1, 1, 6]]]], "r": [[0.000148519, 0.000148506, 0.000148495, 0.000148503, 0.000148484, 0.000148493, 0.000148487, 0.000148487, 0.000148493, 0.000148492], 0, 55.7212, 1651933545], "v": "v0.6"}
{"i": [["[\"fused_reshape_permute\", 1, 64, 64, 128, 8, 4]", "cuda -keys=cuda,gpu -max_num_threads=1024 -model=unknown -thread_warp_size=32", [-1, 16, 64, 49152, 2147483647, 1024, 8, 32], "", 0, []], [[], [["FU", 1, [0, 1, 2, 3, 4]], ["SP", 1, 0, 1572864, [4], 1], ["AN", 1, 0, 5], ["AN", 1, 1, 6]]]], "r": [[0.000294063, 0.000294117, 0.00029399, 0.000294027, 0.000293971, 0.000293977, 0.000293978, 0.000294021, 0.000294038, 0.000294035], 0, 61.4873, 1651933551], "v": "v0.6"}
{"i": [["[\"fused_reshape_permute\", 1, 64, 64, 128, 8, 4]", "cuda -keys=cuda,gpu -max_num_threads=1024 -model=unknown -thread_warp_size=32", [-1, 16, 64, 49152, 2147483647, 1024, 8, 32], "", 0, []], [[], [["FU", 1, [0, 1, 2, 3, 4]], ["SP", 1, 0, 1572864, [6], 1], ["AN", 1, 0, 5], ["AN", 1, 1, 6]]]], "r": [[0.000196895, 0.000196879, 0.000196854, 0.000196841, 0.00019685, 0.000196883, 0.000196865, 0.000196884, 0.000196856, 0.000196858], 0, 50.1715, 1651933540], "v": "v0.6"}
{"i": [["[\"fused_reshape_permute\", 1, 64, 64, 128, 8, 4]", "cuda -keys=cuda,gpu -max_num_threads=1024 -model=unknown -thread_warp_size=32", [-1, 16, 64, 49152, 2147483647, 1024, 8, 32], "", 0, []], [[], [["FU", 1, [0, 1, 2, 3, 4]], ["SP", 1, 0, 1572864, [4], 1], ["AN", 1, 0, 5], ["AN", 1, 1, 6]]]], "r": [[0.000294107, 0.000294132, 0.000294468, 0.000294598, 0.000294143, 0.000294166, 0.000294104, 0.000294105, 0.000294141, 0.00029425], 0, 33.1559, 1651933986], "v": "v0.6"}
{"i": [["[\"fused_reshape_permute\", 1, 64, 64, 128, 8, 4]", "cuda -keys=cuda,gpu -max_num_threads=1024 -model=unknown -thread_warp_size=32", [-1, 16, 64, 49152, 2147483647, 1024, 8, 32], "", 0, []], [[], [["FU", 1, [0, 1, 2, 3, 4]], ["SP", 1, 0, 1572864, [64], 1], ["AN", 1, 0, 5], ["AN", 1, 1, 6]]]], "r": [[2.07081e-05, 2.07062e-05, 2.07037e-05, 2.07068e-05, 2.07065e-05, 2.07085e-05, 2.0706e-05, 2.07057e-05, 2.0709e-05, 2.07016e-05], 0, 22.0106, 1651933975], "v": "v0.6"}
{"i": [["[\"fused_reshape_permute\", 1, 64, 64, 128, 8, 4]", "cuda -keys=cuda,gpu -max_num_threads=1024 -model=unknown -thread_warp_size=32", [-1, 16, 64, 49152, 2147483647, 1024, 8, 32], "", 0, []], [[], [["FU", 1, [0, 1, 2, 3, 4]], ["SP", 1, 0, 1572864, [1], 1], ["AN", 1, 0, 5], ["AN", 1, 1, 6]]]], "r": [[0.00116812, 0.0011682, 0.00116812, 0.00116828, 0.00116812, 0.00116803, 0.00116801, 0.00116809, 0.00116804, 0.00116809], 0, 12.0576, 1651933965], "v": "v0.6"}
{"i": [["[\"fused_reshape_permute\", 1, 64, 64, 128, 8, 4]", "cuda -keys=cuda,gpu -max_num_threads=1024 -model=unknown -thread_warp_size=32", [-1, 16, 64, 49152, 2147483647, 1024, 8, 32], "", 0, []], [[], [["FU", 1, [0, 1, 2, 3, 4]], ["SP", 1, 0, 1572864, [3], 1], ["AN", 1, 0, 5], ["AN", 1, 1, 6]]]], "r": [[0.000391259, 0.000391297, 0.000391257, 0.000391347, 0.000391386, 0.000391312, 0.000391399, 0.000391401, 0.000391252, 0.000391215], 0, 6.61421, 1651933959], "v": "v0.6"}
{"i": [["[\"fused_reshape_permute\", 1, 64, 64, 128, 8, 4]", "cuda -keys=cuda,gpu -max_num_threads=1024 -model=unknown -thread_warp_size=32", [-1, 16, 64, 49152, 2147483647, 1024, 8, 32], "", 0, []], [[], [["FU", 1, [0, 1, 2, 3, 4]], ["SP", 1, 0, 1572864, [8], 1], ["AN", 1, 0, 5], ["AN", 1, 1, 6]]]], "r": [[0.000148378, 0.000148423, 0.000148363, 0.000153286, 0.000148368, 0.000148372, 0.000148361, 0.000149976, 0.000148389, 0.000148369], 0, 38.5295, 1651933992], "v": "v0.6"}
{"i": [["[\"fused_reshape_permute\", 1, 64, 64, 128, 8, 4]", "cuda -keys=cuda,gpu -max_num_threads=1024 -model=unknown -thread_warp_size=32", [-1, 16, 64, 49152, 2147483647, 1024, 8, 32], "", 0, []], [[], [["FU", 1, [0, 1, 2, 3, 4]], ["SP", 1, 0, 1572864, [32], 1], ["AN", 1, 0, 5], ["AN", 1, 1, 6]]]], "r": [[3.92297e-05, 3.92323e-05, 3.92294e-05, 3.92365e-05, 3.92319e-05, 3.92283e-05, 3.92309e-05, 3.92364e-05, 3.92418e-05, 3.92333e-05], 0, 17.1453, 1651933970], "v": "v0.6"}
{"i": [["[\"fused_reshape_permute\", 1, 64, 64, 128, 8, 4]", "cuda -keys=cuda,gpu -max_num_threads=1024 -model=unknown -thread_warp_size=32", [-1, 16, 64, 49152, 2147483647, 1024, 8, 32], "", 0, []], [[], [["FU", 1, [0, 1, 2, 3, 4]], ["SP", 1, 0, 1572864, [2], 1], ["AN", 1, 0, 5], ["AN", 1, 1, 6]]]], "r": [[0.000585587, 0.000585543, 0.000585639, 0.000585676, 0.000585464, 0.000585634, 0.000585624, 0.000585459, 0.000585451, 0.000585449], 0, 60.7778, 1651934014], "v": "v0.6"}
{"i": [["[\"fused_reshape_permute\", 1, 64, 64, 128, 8, 4]", "cuda -keys=cuda,gpu -max_num_threads=1024 -model=unknown -thread_warp_size=32", [-1, 16, 64, 49152, 2147483647, 1024, 8, 32], "", 0, []], [[], [["FU", 1, [0, 1, 2, 3, 4]], ["SP", 1, 0, 1572864, [6], 1], ["AN", 1, 0, 5], ["AN", 1, 1, 6]]]], "r": [[0.000197038, 0.000197062, 0.000197017, 0.000196996, 0.000197027, 0.000197035, 0.000196987, 0.000196991, 0.000197019, 0.000197074], 0, 27.7908, 1651933981], "v": "v0.6"}
{"i": [["[\"fused_reshape_permute\", 1, 64, 64, 128, 8, 4]", "cuda -keys=cuda,gpu -max_num_threads=1024 -model=unknown -thread_warp_size=32", [-1, 16, 64, 49152, 2147483647, 1024, 8, 32], "", 0, []], [[], [["FU", 1, [0, 1, 2, 3, 4]], ["SP", 1, 0, 1572864, [12], 1], ["AN", 1, 0, 5], ["AN", 1, 1, 6]]]], "r": [[9.99425e-05, 9.99202e-05, 9.99191e-05, 9.99146e-05, 9.99201e-05, 9.99158e-05, 9.99198e-05, 9.99304e-05, 9.99298e-05, 9.99213e-05], 0, 65.9646, 1651934019], "v": "v0.6"}
{"i": [["[\"fused_reshape_permute\", 1, 64, 64, 128, 8, 4]", "cuda -keys=cuda,gpu -max_num_threads=1024 -model=unknown -thread_warp_size=32", [-1, 16, 64, 49152, 2147483647, 1024, 8, 32], "", 0, []], [[], [["FU", 1, [0, 1, 2, 3, 4]], ["SP", 1, 0, 1572864, [24], 1], ["AN", 1, 0, 5], ["AN", 1, 1, 6]]]], "r": [[5.15053e-05, 5.15057e-05, 5.15071e-05, 5.15025e-05, 5.15019e-05, 5.15057e-05, 5.151e-05, 5.1504e-05, 5.21552e-05, 5.15508e-05], 0, 44.7244, 1651933997], "v": "v0.6"}
{"i": [["[\"fused_reshape_permute\", 1, 64, 64, 128, 8, 4]", "cuda -keys=cuda,gpu -max_num_threads=1024 -model=unknown -thread_warp_size=32", [-1, 16, 64, 49152, 2147483647, 1024, 8, 32], "", 0, []], [[], [["FU", 1, [0, 1, 2, 3, 4]], ["SP", 1, 0, 1572864, [16], 1], ["AN", 1, 0, 5], ["AN", 1, 1, 6]]]], "r": [[7.54926e-05, 7.54911e-05, 7.54894e-05, 7.54953e-05, 7.55114e-05, 7.5505e-05, 7.54892e-05, 7.54936e-05, 7.54917e-05, 7.549e-05], 0, 54.8754, 1651934008], "v": "v0.6"}
{"i": [["[\"fused_reshape_permute\", 1, 64, 64, 128, 8, 4]", "cuda -keys=cuda,gpu -max_num_threads=1024 -model=unknown -thread_warp_size=32", [-1, 16, 64, 49152, 2147483647, 1024, 8, 32], "", 0, []], [[], [["FU", 1, [0, 1, 2, 3, 4]], ["SP", 1, 0, 1572864, [48], 1], ["AN", 1, 0, 5], ["AN", 1, 1, 6]]]], "r": [[2.68338e-05, 2.68383e-05, 2.82705e-05, 2.75721e-05, 2.68379e-05, 2.68364e-05, 2.684e-05, 2.68459e-05, 2.68391e-05, 2.68332e-05], 0, 49.3639, 1651934003], "v": "v0.6"}
