python/models/swin_transformer/kernel_configs/swin_transformer_fused_roll_window_partition_1_28_28_256_3_7_float16.log
{"i": [["[\"fused_roll_window_partition\", 1, 28, 28, 256, 3, 7, \"float16\"]", "cuda -keys=cuda,gpu -max_num_threads=1024 -model=unknown -thread_warp_size=32", [-1, 16, 64, 49152, 2147483647, 1024, 8, 32], "", 0, []], [[], [["FU", 1, [0, 1, 2, 3]], ["SP", 1, 0, 200704, [1], 1], ["AN", 1, 0, 5], ["AN", 1, 1, 6]]]], "r": [[0.000151748, 0.000162499, 0.000153196, 0.000156615, 0.000157635, 0.000160415, 0.000155648, 0.000151753, 0.000157281, 0.00017458], 0, 8.71697, 1651678723], "v": "v0.6"}
{"i": [["[\"fused_roll_window_partition\", 1, 28, 28, 256, 3, 7, \"float16\"]", "cuda -keys=cuda,gpu -max_num_threads=1024 -model=unknown -thread_warp_size=32", [-1, 16, 64, 49152, 2147483647, 1024, 8, 32], "", 0, []], [[], [["FU", 1, [0, 1, 2, 3]], ["SP", 1, 0, 200704, [56], 1], ["AN", 1, 0, 5], ["AN", 1, 1, 6]]]], "r": [[1.35706e-05, 5.22023e-06, 5.22124e-06, 5.21979e-06, 5.22285e-06, 5.26163e-06, 5.23976e-06, 5.83306e-06, 6.33628e-06, 5.26956e-06], 0, 3.58212, 1651678717], "v": "v0.6"}
{"i": [["[\"fused_roll_window_partition\", 1, 28, 28, 256, 3, 7, \"float16\"]", "cuda -keys=cuda,gpu -max_num_threads=1024 -model=unknown -thread_warp_size=32", [-1, 16, 64, 49152, 2147483647, 1024, 8, 32], "", 0, []], [[], [["FU", 1, [0, 1, 2, 3]], ["SP", 1, 0, 200704, [16], 1], ["AN", 1, 0, 5], ["AN", 1, 1, 6]]]], "r": [[1.21187e-05, 1.21096e-05, 1.22256e-05, 1.21796e-05, 1.36849e-05, 1.39788e-05, 1.26465e-05, 1.2106e-05, 1.22054e-05, 1.21063e-05], 0, 26.146, 1651678740], "v": "v0.6"}
{"i": [["[\"fused_roll_window_partition\", 1, 28, 28, 256, 3, 7, \"float16\"]", "cuda -keys=cuda,gpu -max_num_threads=1024 -model=unknown -thread_warp_size=32", [-1, 16, 64, 49152, 2147483647, 1024, 8, 32], "", 0, []], [[], [["FU", 1, [0, 1, 2, 3]], ["SP", 1, 0, 200704, [28], 1], ["AN", 1, 0, 5], ["AN", 1, 1, 6]]]], "r": [[8.34003e-06, 8.85257e-06, 8.65894e-06, 8.25496e-06, 8.49859e-06, 8.23795e-06, 8.68073e-06, 8.59066e-06, 1.05232e-05, 1.91644e-05], 0, 12.126, 1651678726], "v": "v0.6"}
{"i": [["[\"fused_roll_window_partition\", 1, 28, 28, 256, 3, 7, \"float16\"]", "cuda -keys=cuda,gpu -max_num_threads=1024 -model=unknown -thread_warp_size=32", [-1, 16, 64, 49152, 2147483647, 1024, 8, 32], "", 0, []], [[], [["FU", 1, [0, 1, 2, 3]], ["SP", 1, 0, 200704, [7], 1], ["AN", 1, 0, 5], ["AN", 1, 1, 6]]]], "r": [[2.41962e-05, 2.55682e-05, 2.54201e-05, 2.81677e-05, 4.26905e-05, 2.41647e-05, 2.41632e-05, 2.42867e-05, 2.42357e-05, 2.67288e-05], 0, 6.18236, 1651678720], "v": "v0.6"}
{"i": [["[\"fused_roll_window_partition\", 1, 28, 28, 256, 3, 7, \"float16\"]", "cuda -keys=cuda,gpu -max_num_threads=1024 -model=unknown -thread_warp_size=32", [-1, 16, 64, 49152, 2147483647, 1024, 8, 32], "", 0, []], [[], [["FU", 1, [0, 1, 2, 3]], ["SP", 1, 0, 200704, [4], 1], ["AN", 1, 0, 5], ["AN", 1, 1, 6]]]], "r": [[4.02941e-05, 4.01372e-05, 4.00718e-05, 4.49551e-05, 4.05787e-05, 4.0048e-05, 4.06925e-05, 4.02978e-05, 4.72386e-05, 4.16122e-05], 0, 29.6792, 1651678744], "v": "v0.6"}
{"i": [["[\"fused_roll_window_partition\", 1, 28, 28, 256, 3, 7, \"float16\"]", "cuda -keys=cuda,gpu -max_num_threads=1024 -model=unknown -thread_warp_size=32", [-1, 16, 64, 49152, 2147483647, 1024, 8, 32], "", 0, []], [[], [["FU", 1, [0, 1, 2, 3]], ["SP", 1, 0, 200704, [64], 1], ["AN", 1, 0, 5], ["AN", 1, 1, 6]]]], "r": [[5.70342e-06, 5.47014e-06, 5.20148e-06, 5.13687e-06, 5.18354e-06, 5.19323e-06, 5.14708e-06, 6.00895e-06, 5.50222e-06, 5.13321e-06], 0, 23.5097, 1651678738], "v": "v0.6"}
{"i": [["[\"fused_roll_window_partition\", 1, 28, 28, 256, 3, 7, \"float16\"]", "cuda -keys=cuda,gpu -max_num_threads=1024 -model=unknown -thread_warp_size=32", [-1, 16, 64, 49152, 2147483647, 1024, 8, 32], "", 0, []], [[], [["FU", 1, [0, 1, 2, 3]], ["SP", 1, 0, 200704, [49], 1], ["AN", 1, 0, 5], ["AN", 1, 1, 6]]]], "r": [[6.2173e-06, 5.94521e-06, 5.67923e-06, 5.66895e-06, 5.72948e-06, 5.66657e-06, 6.29879e-06, 5.8799e-06, 5.70061e-06, 5.70353e-06], 0, 20.9201, 1651678735], "v": "v0.6"}
{"i": [["[\"fused_roll_window_partition\", 1, 28, 28, 256, 3, 7, \"float16\"]", "cuda -keys=cuda,gpu -max_num_threads=1024 -model=unknown -thread_warp_size=32", [-1, 16, 64, 49152, 2147483647, 1024, 8, 32], "", 0, []], [[], [["FU", 1, [0, 1, 2, 3]], ["SP", 1, 0, 200704, [14], 1], ["AN", 1, 0, 5], ["AN", 1, 1, 6]]]], "r": [[1.41546e-05, 1.36634e-05, 1.36144e-05, 1.5127e-05, 1.57168e-05, 1.44947e-05, 1.41388e-05, 1.65199e-05, 1.59325e-05, 1.44963e-05], 0, 15.5007, 1651678730], "v": "v0.6"}
{"i": [["[\"fused_roll_window_partition\", 1, 28, 28, 256, 3, 7, \"float16\"]", "cuda -keys=cuda,gpu -max_num_threads=1024 -model=unknown -thread_warp_size=32", [-1, 16, 64, 49152, 2147483647, 1024, 8, 32], "", 0, []], [[], [["FU", 1, [0, 1, 2, 3]], ["SP", 1, 0, 200704, [8], 1], ["AN", 1, 0, 5], ["AN", 1, 1, 6]]]], "r": [[2.32764e-05, 2.22309e-05, 2.16e-05, 2.16173e-05, 2.16136e-05, 2.42816e-05, 5.14171e-05, 2.15166e-05, 2.2059e-05, 2.20624e-05], 0, 18.2861, 1651678732], "v": "v0.6"}
{"i": [["[\"fused_roll_window_partition\", 1, 28, 28, 256, 3, 7, \"float16\"]", "cuda -keys=cuda,gpu -max_num_threads=1024 -model=unknown -thread_warp_size=32", [-1, 16, 64, 49152, 2147483647, 1024, 8, 32], "", 0, []], [[], [["FU", 1, [0, 1, 2, 3]], ["SP", 1, 0, 200704, [28], 1], ["AN", 1, 0, 5], ["AN", 1, 1, 6]]]], "r": [[8.02159e-06, 8.02131e-06, 8.0219e-06, 8.02016e-06, 8.02145e-06, 8.02202e-06, 8.01986e-06, 8.02181e-06, 8.02033e-06, 8.01983e-06], 0, 9.78943, 1651682050], "v": "v0.6"}
{"i": [["[\"fused_roll_window_partition\", 1, 28, 28, 256, 3, 7, \"float16\"]", "cuda -keys=cuda,gpu -max_num_threads=1024 -model=unknown -thread_warp_size=32", [-1, 16, 64, 49152, 2147483647, 1024, 8, 32], "", 0, []], [[], [["FU", 1, [0, 1, 2, 3]], ["SP", 1, 0, 200704, [14], 1], ["AN", 1, 0, 5], ["AN", 1, 1, 6]]]], "r": [[4.37442e-05, 1.34018e-05, 1.34042e-05, 1.33933e-05, 1.33797e-05, 1.33796e-05, 1.33789e-05, 1.34223e-05, 1.33981e-05, 1.3515e-05], 0, 3.40535, 1651682043], "v": "v0.6"}
{"i": [["[\"fused_roll_window_partition\", 1, 28, 28, 256, 3, 7, \"float16\"]", "cuda -keys=cuda,gpu -max_num_threads=1024 -model=unknown -thread_warp_size=32", [-1, 16, 64, 49152, 2147483647, 1024, 8, 32], "", 0, []], [[], [["FU", 1, [0, 1, 2, 3]], ["SP", 1, 0, 200704, [7], 1], ["AN", 1, 0, 5], ["AN", 1, 1, 6]]]], "r": [[2.41408e-05, 2.41411e-05, 2.4142e-05, 2.41409e-05, 2.41415e-05, 2.41429e-05, 2.41393e-05, 2.64998e-05, 2.4141e-05, 2.43031e-05], 0, 11.9419, 1651682052], "v": "v0.6"}
{"i": [["[\"fused_roll_window_partition\", 1, 28, 28, 256, 3, 7, \"float16\"]", "cuda -keys=cuda,gpu -max_num_threads=1024 -model=unknown -thread_warp_size=32", [-1, 16, 64, 49152, 2147483647, 1024, 8, 32], "", 0, []], [[], [["FU", 1, [0, 1, 2, 3]], ["SP", 1, 0, 200704, [4], 1], ["AN", 1, 0, 5], ["AN", 1, 1, 6]]]], "r": [[4.5783e-05, 4.27069e-05, 5.00547e-05, 0.000116863, 4.02886e-05, 4.00814e-05, 4.041e-05, 4.01444e-05, 4.03511e-05, 4.57973e-05], 0, 15.2491, 1651682055], "v": "v0.6"}
{"i": [["[\"fused_roll_window_partition\", 1, 28, 28, 256, 3, 7, \"float16\"]", "cuda -keys=cuda,gpu -max_num_threads=1024 -model=unknown -thread_warp_size=32", [-1, 16, 64, 49152, 2147483647, 1024, 8, 32], "", 0, []], [[], [["FU", 1, [0, 1, 2, 3]], ["SP", 1, 0, 200704, [64], 1], ["AN", 1, 0, 5], ["AN", 1, 1, 6]]]], "r": [[4.96951e-06, 4.94955e-06, 4.95059e-06, 4.9497e-06, 4.94951e-06, 4.9517e-06, 4.95055e-06, 4.95011e-06, 4.94968e-06, 4.95014e-06], 0, 25.1741, 1651682065], "v": "v0.6"}
{"i": [["[\"fused_roll_window_partition\", 1, 28, 28, 256, 3, 7, \"float16\"]", "cuda -keys=cuda,gpu -max_num_threads=1024 -model=unknown -thread_warp_size=32", [-1, 16, 64, 49152, 2147483647, 1024, 8, 32], "", 0, []], [[], [["FU", 1, [0, 1, 2, 3]], ["SP", 1, 0, 200704, [2], 1], ["AN", 1, 0, 5], ["AN", 1, 1, 6]]]], "r": [[7.72555e-05, 7.94914e-05, 7.73608e-05, 7.75349e-05, 8.28467e-05, 8.06814e-05, 7.72564e-05, 7.72572e-05, 7.72564e-05, 7.72503e-05], 0, 20.9393, 1651682061], "v": "v0.6"}
{"i": [["[\"fused_roll_window_partition\", 1, 28, 28, 256, 3, 7, \"float16\"]", "cuda -keys=cuda,gpu -max_num_threads=1024 -model=unknown -thread_warp_size=32", [-1, 16, 64, 49152, 2147483647, 1024, 8, 32], "", 0, []], [[], [["FU", 1, [0, 1, 2, 3]], ["SP", 1, 0, 200704, [8], 1], ["AN", 1, 0, 5], ["AN", 1, 1, 6]]]], "r": [[2.20955e-05, 2.18416e-05, 2.14908e-05, 2.15525e-05, 2.33202e-05, 2.21782e-05, 2.14217e-05, 2.14221e-05, 2.14224e-05, 2.1476e-05], 0, 5.77851, 1651682045], "v": "v0.6"}
{"i": [["[\"fused_roll_window_partition\", 1, 28, 28, 256, 3, 7, \"float16\"]", "cuda -keys=cuda,gpu -max_num_threads=1024 -model=unknown -thread_warp_size=32", [-1, 16, 64, 49152, 2147483647, 1024, 8, 32], "", 0, []], [[], [["FU", 1, [0, 1, 2, 3]], ["SP", 1, 0, 200704, [32], 1], ["AN", 1, 0, 5], ["AN", 1, 1, 6]]]], "r": [[7.43129e-06, 7.40701e-06, 7.39919e-06, 9.67515e-06, 7.98695e-06, 7.95305e-06, 9.2612e-06, 7.38422e-06, 7.42164e-06, 7.41651e-06], 0, 18.1965, 1651682058], "v": "v0.6"}
{"i": [["[\"fused_roll_window_partition\", 1, 28, 28, 256, 3, 7, \"float16\"]", "cuda -keys=cuda,gpu -max_num_threads=1024 -model=unknown -thread_warp_size=32", [-1, 16, 64, 49152, 2147483647, 1024, 8, 32], "", 0, []], [[], [["FU", 1, [0, 1, 2, 3]], ["SP", 1, 0, 200704, [49], 1], ["AN", 1, 0, 5], ["AN", 1, 1, 6]]]], "r": [[6.01149e-06, 7.38791e-06, 5.64597e-06, 5.63669e-06, 5.62631e-06, 5.62596e-06, 5.62549e-06, 5.62693e-06, 5.62599e-06, 5.62672e-06], 0, 7.94181, 1651682048], "v": "v0.6"}
{"i": [["[\"fused_roll_window_partition\", 1, 28, 28, 256, 3, 7, \"float16\"]", "cuda -keys=cuda,gpu -max_num_threads=1024 -model=unknown -thread_warp_size=32", [-1, 16, 64, 49152, 2147483647, 1024, 8, 32], "", 0, []], [[], [["FU", 1, [0, 1, 2, 3]], ["SP", 1, 0, 200704, [1], 1], ["AN", 1, 0, 5], ["AN", 1, 1, 6]]]], "r": [[0.000151638, 0.000156283, 0.000164909, 0.000151855, 0.00015171, 0.000159205, 0.000162537, 0.000170459, 0.000155772, 0.000153638], 0, 29.1893, 1651682069], "v": "v0.6"}
{"i": [["[\"fused_roll_window_partition\", 1, 28, 28, 256, 3, 7, \"float16\"]", "cuda -keys=cuda,gpu -max_num_threads=1024 -model=unknown -thread_warp_size=32", [-1, 16, 64, 49152, 2147483647, 1024, 8, 32], "", 0, []], [[], [["FU", 1, [0, 1, 2, 3]], ["SP", 1, 0, 200704, [16], 1], ["AN", 1, 0, 5], ["AN", 1, 1, 6]]]], "r": [[1.33506e-05, 1.29174e-05, 1.78047e-05, 1.22329e-05, 1.22425e-05, 1.33428e-05, 1.55978e-05, 1.22328e-05, 1.2239e-05, 1.22373e-05], 0, 23.6336, 1651682064], "v": "v0.6"}
{"i": [["[\"fused_roll_window_partition\", 1, 28, 28, 256, 3, 7, \"float16\"]", "cuda -keys=cuda,gpu -max_num_threads=1024 -model=unknown -thread_warp_size=32", [-1, 16, 64, 49152, 2147483647, 1024, 8, 32], "", 0, []], [[], [["FU", 1, [0, 1, 2, 3]], ["SP", 1, 0, 200704, [56], 1], ["AN", 1, 0, 5], ["AN", 1, 1, 6]]]], "r": [[5.27595e-06, 5.27738e-06, 5.27671e-06, 5.27692e-06, 5.27657e-06, 5.27772e-06, 5.27706e-06, 5.27686e-06, 5.27769e-06, 5.276e-06], 0, 27.1682, 1651682067], "v": "v0.6"}
