python/models/swin_transformer/kernel_configs/swin_transformer_auto_tvm_qeury_key_matmul_q_k_64_4_64_32.log
{"input": ["cuda -keys=cuda,gpu -max_num_threads=1024 -thread_warp_size=32", "batch_matmul_tensorcore_q_k.cuda", [["TENSOR", [256, 64, 32], "float16"], ["TENSOR", [256, 64, 32], "float16"]], {}], "config": {"index": 59219, "code_hash": null, "entity": [["block_row_warps", "ot", 4], ["warp_row_tiles", "ot", 4], ["warp_col_tiles", "ot", 1], ["chunk", "ot", 1], ["offset", "ot", 8], ["offsetCS", "ot", 0], ["vec", "ot", 2], ["wmma_m", "ot", 8]]}, "result": [[3.2674256e-05], 0, 1.3466777801513672, 1650980904.7357955], "version": 0.2, "tvm_version": "0.8.0"}
{"input": ["cuda -keys=cuda,gpu -max_num_threads=1024 -thread_warp_size=32", "batch_matmul_tensorcore_q_k.cuda", [["TENSOR", [256, 64, 32], "float16"], ["TENSOR", [256, 64, 32], "float16"]], {}], "config": {"index": 9958, "code_hash": null, "entity": [["block_row_warps", "ot", 12], ["warp_row_tiles", "ot", 8], ["warp_col_tiles", "ot", 8], ["chunk", "ot", 2], ["offset", "ot", 0], ["offsetCS", "ot", 8], ["vec", "ot", 2], ["wmma_m", "ot", 32]]}, "result": [[5.9711581e-05], 0, 1.5263187885284424, 1650980905.5671268], "version": 0.2, "tvm_version": "0.8.0"}
{"input": ["cuda -keys=cuda,gpu -max_num_threads=1024 -thread_warp_size=32", "batch_matmul_tensorcore_q_k.cuda", [["TENSOR", [256, 64, 32], "float16"], ["TENSOR", [256, 64, 32], "float16"]], {}], "config": {"index": 21100, "code_hash": null, "entity": [["block_row_warps", "ot", 6], ["warp_row_tiles", "ot", 4], ["warp_col_tiles", "ot", 4], ["chunk", "ot", 2], ["offset", "ot", 8], ["offsetCS", "ot", 0], ["vec", "ot", 8], ["wmma_m", "ot", 32]]}, "result": [[3.4675511999999996e-05], 0, 1.2893009185791016, 1650980906.6797125], "version": 0.2, "tvm_version": "0.8.0"}
{"input": ["cuda -keys=cuda,gpu -max_num_threads=1024 -thread_warp_size=32", "batch_matmul_tensorcore_q_k.cuda", [["TENSOR", [256, 64, 32], "float16"], ["TENSOR", [256, 64, 32], "float16"]], {}], "config": {"index": 62209, "code_hash": null, "entity": [["block_row_warps", "ot", 2], ["warp_row_tiles", "ot", 2], ["warp_col_tiles", "ot", 1], ["chunk", "ot", 16], ["offset", "ot", 0], ["offsetCS", "ot", 8], ["vec", "ot", 2], ["wmma_m", "ot", 8]]}, "result": [[1.7476609e-05], 0, 1.075049877166748, 1650980907.7291088], "version": 0.2, "tvm_version": "0.8.0"}
{"input": ["cuda -keys=cuda,gpu -max_num_threads=1024 -thread_warp_size=32", "batch_matmul_tensorcore_q_k.cuda", [["TENSOR", [256, 64, 32], "float16"], ["TENSOR", [256, 64, 32], "float16"]], {}], "config": {"index": 66605, "code_hash": null, "entity": [["block_row_warps", "ot", 8], ["warp_row_tiles", "ot", 1], ["warp_col_tiles", "ot", 1], ["chunk", "ot", 8], ["offset", "ot", 8], ["offsetCS", "ot", 0], ["vec", "ot", 4], ["wmma_m", "ot", 8]]}, "result": [[4.9352206e-05], 0, 1.198850154876709, 1650980908.4361231], "version": 0.2, "tvm_version": "0.8.0"}
{"input": ["cuda -keys=cuda,gpu -max_num_threads=1024 -thread_warp_size=32", "batch_matmul_tensorcore_q_k.cuda", [["TENSOR", [256, 64, 32], "float16"], ["TENSOR", [256, 64, 32], "float16"]], {}], "config": {"index": 29234, "code_hash": null, "entity": [["block_row_warps", "ot", 3], ["warp_row_tiles", "ot", 8], ["warp_col_tiles", "ot", 1], ["chunk", "ot", 3], ["offset", "ot", 0], ["offsetCS", "ot", 8], ["vec", "ot", 1], ["wmma_m", "ot", 16]]}, "result": [[1.9197495e-05], 0, 1.1648313999176025, 1650980909.055928], "version": 0.2, "tvm_version": "0.8.0"}
{"input": ["cuda -keys=cuda,gpu -max_num_threads=1024 -thread_warp_size=32", "batch_matmul_tensorcore_q_k.cuda", [["TENSOR", [256, 64, 32], "float16"], ["TENSOR", [256, 64, 32], "float16"]], {}], "config": {"index": 47613, "code_hash": null, "entity": [["block_row_warps", "ot", 8], ["warp_row_tiles", "ot", 2], ["warp_col_tiles", "ot", 1], ["chunk", "ot", 12], ["offset", "ot", 8], ["offsetCS", "ot", 0], ["vec", "ot", 8], ["wmma_m", "ot", 16]]}, "result": [[8.891292e-05], 0, 1.4310860633850098, 1650980910.320663], "version": 0.2, "tvm_version": "0.8.0"}
{"input": ["cuda -keys=cuda,gpu -max_num_threads=1024 -thread_warp_size=32", "batch_matmul_tensorcore_q_k.cuda", [["TENSOR", [256, 64, 32], "float16"], ["TENSOR", [256, 64, 32], "float16"]], {}], "config": {"index": 13816, "code_hash": null, "entity": [["block_row_warps", "ot", 1], ["warp_row_tiles", "ot", 4], ["warp_col_tiles", "ot", 1], ["chunk", "ot", 8], ["offset", "ot", 0], ["offsetCS", "ot", 0], ["vec", "ot", 4], ["wmma_m", "ot", 32]]}, "result": [[5.7440662e-05], 0, 1.228050947189331, 1650980911.4598932], "version": 0.2, "tvm_version": "0.8.0"}
{"input": ["cuda -keys=cuda,gpu -max_num_threads=1024 -thread_warp_size=32", "batch_matmul_tensorcore_q_k.cuda", [["TENSOR", [256, 64, 32], "float16"], ["TENSOR", [256, 64, 32], "float16"]], {}], "config": {"index": 17045, "code_hash": null, "entity": [["block_row_warps", "ot", 8], ["warp_row_tiles", "ot", 1], ["warp_col_tiles", "ot", 2], ["chunk", "ot", 8], ["offset", "ot", 0], ["offsetCS", "ot", 8], ["vec", "ot", 4], ["wmma_m", "ot", 32]]}, "result": [[0.00013451285200000003], 0, 1.5825533866882324, 1650980912.869328], "version": 0.2, "tvm_version": "0.8.0"}
{"input": ["cuda -keys=cuda,gpu -max_num_threads=1024 -thread_warp_size=32", "batch_matmul_tensorcore_q_k.cuda", [["TENSOR", [256, 64, 32], "float16"], ["TENSOR", [256, 64, 32], "float16"]], {}], "config": {"index": 887, "code_hash": null, "entity": [["block_row_warps", "ot", 16], ["warp_row_tiles", "ot", 1], ["warp_col_tiles", "ot", 4], ["chunk", "ot", 6], ["offset", "ot", 0], ["offsetCS", "ot", 0], ["vec", "ot", 1], ["wmma_m", "ot", 32]]}, "result": [[7.9716094e-05], 0, 1.310150384902954, 1650980914.1362147], "version": 0.2, "tvm_version": "0.8.0"}
{"input": ["cuda -keys=cuda,gpu -max_num_threads=1024 -thread_warp_size=32", "batch_matmul_tensorcore_q_k.cuda", [["TENSOR", [256, 64, 32], "float16"], ["TENSOR", [256, 64, 32], "float16"]], {}], "config": {"index": 11872, "code_hash": null, "entity": [["block_row_warps", "ot", 1], ["warp_row_tiles", "ot", 8], ["warp_col_tiles", "ot", 2], ["chunk", "ot", 4], ["offset", "ot", 8], ["offsetCS", "ot", 8], ["vec", "ot", 2], ["wmma_m", "ot", 32]]}, "result": [[8.666500618046972e-06], 0, 1.1710236072540283, 1650980914.7354548], "version": 0.2, "tvm_version": "0.8.0"}
{"input": ["cuda -keys=cuda,gpu -max_num_threads=1024 -thread_warp_size=32", "batch_matmul_tensorcore_q_k.cuda", [["TENSOR", [256, 64, 32], "float16"], ["TENSOR", [256, 64, 32], "float16"]], {}], "config": {"index": 40820, "code_hash": null, "entity": [["block_row_warps", "ot", 6], ["warp_row_tiles", "ot", 4], ["warp_col_tiles", "ot", 1], ["chunk", "ot", 6], ["offset", "ot", 8], ["offsetCS", "ot", 0], ["vec", "ot", 4], ["wmma_m", "ot", 16]]}, "result": [[4.8471533e-05], 0, 1.1913201808929443, 1650980915.82183], "version": 0.2, "tvm_version": "0.8.0"}
{"input": ["cuda -keys=cuda,gpu -max_num_threads=1024 -thread_warp_size=32", "batch_matmul_tensorcore_q_k.cuda", [["TENSOR", [256, 64, 32], "float16"], ["TENSOR", [256, 64, 32], "float16"]], {}], "config": {"index": 26085, "code_hash": null, "entity": [["block_row_warps", "ot", 8], ["warp_row_tiles", "ot", 1], ["warp_col_tiles", "ot", 4], ["chunk", "ot", 3], ["offset", "ot", 0], ["offsetCS", "ot", 0], ["vec", "ot", 1], ["wmma_m", "ot", 16]]}, "result": [[1.9598037000000002e-05], 0, 1.235929250717163, 1650980916.929257], "version": 0.2, "tvm_version": "0.8.0"}
{"input": ["cuda -keys=cuda,gpu -max_num_threads=1024 -thread_warp_size=32", "batch_matmul_tensorcore_q_k.cuda", [["TENSOR", [256, 64, 32], "float16"], ["TENSOR", [256, 64, 32], "float16"]], {}], "config": {"index": 63054, "code_hash": null, "entity": [["block_row_warps", "ot", 12], ["warp_row_tiles", "ot", 2], ["warp_col_tiles", "ot", 2], ["chunk", "ot", 4], ["offset", "ot", 8], ["offsetCS", "ot", 8], ["vec", "ot", 2], ["wmma_m", "ot", 8]]}, "result": [[2.3180954e-05], 0, 1.2404921054840088, 1650980918.0937972], "version": 0.2, "tvm_version": "0.8.0"}
{"input": ["cuda -keys=cuda,gpu -max_num_threads=1024 -thread_warp_size=32", "batch_matmul_tensorcore_q_k.cuda", [["TENSOR", [256, 64, 32], "float16"], ["TENSOR", [256, 64, 32], "float16"]], {}], "config": {"index": 66611, "code_hash": null, "entity": [["block_row_warps", "ot", 4], ["warp_row_tiles", "ot", 2], ["warp_col_tiles", "ot", 1], ["chunk", "ot", 8], ["offset", "ot", 8], ["offsetCS", "ot", 0], ["vec", "ot", 4], ["wmma_m", "ot", 8]]}, "result": [[2.9101300999999998e-05], 0, 1.2269415855407715, 1650980918.8106532], "version": 0.2, "tvm_version": "0.8.0"}
{"input": ["cuda -keys=cuda,gpu -max_num_threads=1024 -thread_warp_size=32", "batch_matmul_tensorcore_q_k.cuda", [["TENSOR", [256, 64, 32], "float16"], ["TENSOR", [256, 64, 32], "float16"]], {}], "config": {"index": 44418, "code_hash": null, "entity": [["block_row_warps", "ot", 3], ["warp_row_tiles", "ot", 4], ["warp_col_tiles", "ot", 1], ["chunk", "ot", 12], ["offset", "ot", 8], ["offsetCS", "ot", 8], ["vec", "ot", 4], ["wmma_m", "ot", 16]]}, "result": [[2.1648726e-05], 0, 1.2721624374389648, 1650980919.8822782], "version": 0.2, "tvm_version": "0.8.0"}
{"input": ["cuda -keys=cuda,gpu -max_num_threads=1024 -thread_warp_size=32", "batch_matmul_tensorcore_q_k.cuda", [["TENSOR", [256, 64, 32], "float16"], ["TENSOR", [256, 64, 32], "float16"]], {}], "config": {"index": 48680, "code_hash": null, "entity": [["block_row_warps", "ot", 1], ["warp_row_tiles", "ot", 1], ["warp_col_tiles", "ot", 4], ["chunk", "ot", 4], ["offset", "ot", 0], ["offsetCS", "ot", 8], ["vec", "ot", 8], ["wmma_m", "ot", 16]]}, "result": [[1.5041543000000001e-05], 0, 1.138108253479004, 1650980921.9788136], "version": 0.2, "tvm_version": "0.8.0"}
{"input": ["cuda -keys=cuda,gpu -max_num_threads=1024 -thread_warp_size=32", "batch_matmul_tensorcore_q_k.cuda", [["TENSOR", [256, 64, 32], "float16"], ["TENSOR", [256, 64, 32], "float16"]], {}], "config": {"index": 15691, "code_hash": null, "entity": [["block_row_warps", "ot", 4], ["warp_row_tiles", "ot", 2], ["warp_col_tiles", "ot", 4], ["chunk", "ot", 12], ["offset", "ot", 8], ["offsetCS", "ot", 0], ["vec", "ot", 4], ["wmma_m", "ot", 32]]}, "result": [[2.5072525e-05], 0, 1.2090156078338623, 1650980923.1386058], "version": 0.2, "tvm_version": "0.8.0"}
{"input": ["cuda -keys=cuda,gpu -max_num_threads=1024 -thread_warp_size=32", "batch_matmul_tensorcore_q_k.cuda", [["TENSOR", [256, 64, 32], "float16"], ["TENSOR", [256, 64, 32], "float16"]], {}], "config": {"index": 7464, "code_hash": null, "entity": [["block_row_warps", "ot", 1], ["warp_row_tiles", "ot", 6], ["warp_col_tiles", "ot", 2], ["chunk", "ot", 8], ["offset", "ot", 0], ["offsetCS", "ot", 0], ["vec", "ot", 2], ["wmma_m", "ot", 32]]}, "result": [[2.9674673e-05], 0, 1.32289719581604, 1650980924.249488], "version": 0.2, "tvm_version": "0.8.0"}
{"input": ["cuda -keys=cuda,gpu -max_num_threads=1024 -thread_warp_size=32", "batch_matmul_tensorcore_q_k.cuda", [["TENSOR", [256, 64, 32], "float16"], ["TENSOR", [256, 64, 32], "float16"]], {}], "config": {"index": 14501, "code_hash": null, "entity": [["block_row_warps", "ot", 8], ["warp_row_tiles", "ot", 4], ["warp_col_tiles", "ot", 4], ["chunk", "ot", 1], ["offset", "ot", 8], ["offsetCS", "ot", 0], ["vec", "ot", 4], ["wmma_m", "ot", 32]]}, "result": [[5.0842633e-05], 0, 1.1310703754425049, 1650980925.4453404], "version": 0.2, "tvm_version": "0.8.0"}
{"input": ["cuda -keys=cuda,gpu -max_num_threads=1024 -thread_warp_size=32", "batch_matmul_tensorcore_q_k.cuda", [["TENSOR", [256, 64, 32], "float16"], ["TENSOR", [256, 64, 32], "float16"]], {}], "config": {"index": 44478, "code_hash": null, "entity": [["block_row_warps", "ot", 12], ["warp_row_tiles", "ot", 8], ["warp_col_tiles", "ot", 2], ["chunk", "ot", 12], ["offset", "ot", 8], ["offsetCS", "ot", 8], ["vec", "ot", 4], ["wmma_m", "ot", 16]]}, "result": [[3.425937e-05], 0, 1.287257432937622, 1650980926.1168916], "version": 0.2, "tvm_version": "0.8.0"}
{"input": ["cuda -keys=cuda,gpu -max_num_threads=1024 -thread_warp_size=32", "batch_matmul_tensorcore_q_k.cuda", [["TENSOR", [256, 64, 32], "float16"], ["TENSOR", [256, 64, 32], "float16"]], {}], "config": {"index": 68641, "code_hash": null, "entity": [["block_row_warps", "ot", 2], ["warp_row_tiles", "ot", 1], ["warp_col_tiles", "ot", 2], ["chunk", "ot", 16], ["offset", "ot", 0], ["offsetCS", "ot", 8], ["vec", "ot", 4], ["wmma_m", "ot", 8]]}, "result": [[1.6596455e-05], 0, 1.1010615825653076, 1650980927.153891], "version": 0.2, "tvm_version": "0.8.0"}
{"input": ["cuda -keys=cuda,gpu -max_num_threads=1024 -thread_warp_size=32", "batch_matmul_tensorcore_q_k.cuda", [["TENSOR", [256, 64, 32], "float16"], ["TENSOR", [256, 64, 32], "float16"]], {}], "config": {"index": 68237, "code_hash": null, "entity": [["block_row_warps", "ot", 8], ["warp_row_tiles", "ot", 8], ["warp_col_tiles", "ot", 1], ["chunk", "ot", 8], ["offset", "ot", 0], ["offsetCS", "ot", 8], ["vec", "ot", 4], ["wmma_m", "ot", 8]]}, "result": [[6.2450706e-05], 0, 1.3800089359283447, 1650980928.0011778], "version": 0.2, "tvm_version": "0.8.0"}
{"input": ["cuda -keys=cuda,gpu -max_num_threads=1024 -thread_warp_size=32", "batch_matmul_tensorcore_q_k.cuda", [["TENSOR", [256, 64, 32], "float16"], ["TENSOR", [256, 64, 32], "float16"]], {}], "config": {"index": 13346, "code_hash": null, "entity": [["block_row_warps", "ot", 3], ["warp_row_tiles", "ot", 6], ["warp_col_tiles", "ot", 8], ["chunk", "ot", 3], ["offset", "ot", 0], ["offsetCS", "ot", 0], ["vec", "ot", 4], ["wmma_m", "ot", 32]]}, "result": [[1.7756662999999998e-05], 0, 1.160963535308838, 1650980929.067171], "version": 0.2, "tvm_version": "0.8.0"}
{"input": ["cuda -keys=cuda,gpu -max_num_threads=1024 -thread_warp_size=32", "batch_matmul_tensorcore_q_k.cuda", [["TENSOR", [256, 64, 32], "float16"], ["TENSOR", [256, 64, 32], "float16"]], {}], "config": {"index": 13335, "code_hash": null, "entity": [["block_row_warps", "ot", 16], ["warp_row_tiles", "ot", 2], ["warp_col_tiles", "ot", 8], ["chunk", "ot", 3], ["offset", "ot", 0], ["offsetCS", "ot", 0], ["vec", "ot", 4], ["wmma_m", "ot", 32]]}, "result": [[5.212727e-05], 0, 1.0687096118927002, 1650980930.246913], "version": 0.2, "tvm_version": "0.8.0"}
{"input": ["cuda -keys=cuda,gpu -max_num_threads=1024 -thread_warp_size=32", "batch_matmul_tensorcore_q_k.cuda", [["TENSOR", [256, 64, 32], "float16"], ["TENSOR", [256, 64, 32], "float16"]], {}], "config": {"index": 22245, "code_hash": null, "entity": [["block_row_warps", "ot", 8], ["warp_row_tiles", "ot", 1], ["warp_col_tiles", "ot", 2], ["chunk", "ot", 16], ["offset", "ot", 8], ["offsetCS", "ot", 0], ["vec", "ot", 8], ["wmma_m", "ot", 32]]}, "result": [[8.9096355e-05], 0, 1.1586551666259766, 1650980931.5023663], "version": 0.2, "tvm_version": "0.8.0"}
{"input": ["cuda -keys=cuda,gpu -max_num_threads=1024 -thread_warp_size=32", "batch_matmul_tensorcore_q_k.cuda", [["TENSOR", [256, 64, 32], "float16"], ["TENSOR", [256, 64, 32], "float16"]], {}], "config": {"index": 8876, "code_hash": null, "entity": [["block_row_warps", "ot", 6], ["warp_row_tiles", "ot", 8], ["warp_col_tiles", "ot", 2], ["chunk", "ot", 6], ["offset", "ot", 8], ["offsetCS", "ot", 0], ["vec", "ot", 2], ["wmma_m", "ot", 32]]}, "result": [[5.6445524e-05], 0, 1.0894250869750977, 1650980932.229462], "version": 0.2, "tvm_version": "0.8.0"}
{"input": ["cuda -keys=cuda,gpu -max_num_threads=1024 -thread_warp_size=32", "batch_matmul_tensorcore_q_k.cuda", [["TENSOR", [256, 64, 32], "float16"], ["TENSOR", [256, 64, 32], "float16"]], {}], "config": {"index": 42835, "code_hash": null, "entity": [["block_row_warps", "ot", 4], ["warp_row_tiles", "ot", 8], ["warp_col_tiles", "ot", 1], ["chunk", "ot", 12], ["offset", "ot", 0], ["offsetCS", "ot", 8], ["vec", "ot", 4], ["wmma_m", "ot", 16]]}, "result": [[5.886011400000001e-05], 0, 1.0967154502868652, 1650980933.015599], "version": 0.2, "tvm_version": "0.8.0"}
{"input": ["cuda -keys=cuda,gpu -max_num_threads=1024 -thread_warp_size=32", "batch_matmul_tensorcore_q_k.cuda", [["TENSOR", [256, 64, 32], "float16"], ["TENSOR", [256, 64, 32], "float16"]], {}], "config": {"index": 21694, "code_hash": null, "entity": [["block_row_warps", "ot", 12], ["warp_row_tiles", "ot", 2], ["warp_col_tiles", "ot", 4], ["chunk", "ot", 6], ["offset", "ot", 8], ["offsetCS", "ot", 0], ["vec", "ot", 8], ["wmma_m", "ot", 32]]}, "result": [[5.5334803e-05], 0, 1.2481014728546143, 1650980934.1995206], "version": 0.2, "tvm_version": "0.8.0"}
{"input": ["cuda -keys=cuda,gpu -max_num_threads=1024 -thread_warp_size=32", "batch_matmul_tensorcore_q_k.cuda", [["TENSOR", [256, 64, 32], "float16"], ["TENSOR", [256, 64, 32], "float16"]], {}], "config": {"index": 59603, "code_hash": null, "entity": [["block_row_warps", "ot", 4], ["warp_row_tiles", "ot", 1], ["warp_col_tiles", "ot", 1], ["chunk", "ot", 3], ["offset", "ot", 8], ["offsetCS", "ot", 0], ["vec", "ot", 2], ["wmma_m", "ot", 8]]}, "result": [[2.5200943999999998e-05], 0, 0.9710292816162109, 1650980936.7863834], "version": 0.2, "tvm_version": "0.8.0"}
{"input": ["cuda -keys=cuda,gpu -max_num_threads=1024 -thread_warp_size=32", "batch_matmul_tensorcore_q_k.cuda", [["TENSOR", [256, 64, 32], "float16"], ["TENSOR", [256, 64, 32], "float16"]], {}], "config": {"index": 36271, "code_hash": null, "entity": [["block_row_warps", "ot", 16], ["warp_row_tiles", "ot", 6], ["warp_col_tiles", "ot", 2], ["chunk", "ot", 8], ["offset", "ot", 0], ["offsetCS", "ot", 8], ["vec", "ot", 2], ["wmma_m", "ot", 16]]}, "result": [[0.00010106108799999999], 0, 1.2407433986663818, 1650980938.5827746], "version": 0.2, "tvm_version": "0.8.0"}
{"input": ["cuda -keys=cuda,gpu -max_num_threads=1024 -thread_warp_size=32", "batch_matmul_tensorcore_q_k.cuda", [["TENSOR", [256, 64, 32], "float16"], ["TENSOR", [256, 64, 32], "float16"]], {}], "config": {"index": 1716, "code_hash": null, "entity": [["block_row_warps", "ot", 6], ["warp_row_tiles", "ot", 8], ["warp_col_tiles", "ot", 4], ["chunk", "ot", 1], ["offset", "ot", 8], ["offsetCS", "ot", 0], ["vec", "ot", 1], ["wmma_m", "ot", 32]]}, "result": [[3.4038757e-05], 0, 0.9792778491973877, 1650980940.1474988], "version": 0.2, "tvm_version": "0.8.0"}
{"input": ["cuda -keys=cuda,gpu -max_num_threads=1024 -thread_warp_size=32", "batch_matmul_tensorcore_q_k.cuda", [["TENSOR", [256, 64, 32], "float16"], ["TENSOR", [256, 64, 32], "float16"]], {}], "config": {"index": 61436, "code_hash": null, "entity": [["block_row_warps", "ot", 6], ["warp_row_tiles", "ot", 8], ["warp_col_tiles", "ot", 1], ["chunk", "ot", 4], ["offset", "ot", 0], ["offsetCS", "ot", 8], ["vec", "ot", 2], ["wmma_m", "ot", 8]]}, "result": [[3.1645271e-05], 0, 0.9909787178039551, 1650980941.7442105], "version": 0.2, "tvm_version": "0.8.0"}
{"input": ["cuda -keys=cuda,gpu -max_num_threads=1024 -thread_warp_size=32", "batch_matmul_tensorcore_q_k.cuda", [["TENSOR", [256, 64, 32], "float16"], ["TENSOR", [256, 64, 32], "float16"]], {}], "config": {"index": 60048, "code_hash": null, "entity": [["block_row_warps", "ot", 1], ["warp_row_tiles", "ot", 2], ["warp_col_tiles", "ot", 2], ["chunk", "ot", 6], ["offset", "ot", 8], ["offsetCS", "ot", 0], ["vec", "ot", 2], ["wmma_m", "ot", 8]]}, "result": [[6.406786773794808e-06], 0, 0.882265567779541, 1650980942.7750912], "version": 0.2, "tvm_version": "0.8.0"}
{"input": ["cuda -keys=cuda,gpu -max_num_threads=1024 -thread_warp_size=32", "batch_matmul_tensorcore_q_k.cuda", [["TENSOR", [256, 64, 32], "float16"], ["TENSOR", [256, 64, 32], "float16"]], {}], "config": {"index": 41112, "code_hash": null, "entity": [["block_row_warps", "ot", 1], ["warp_row_tiles", "ot", 8], ["warp_col_tiles", "ot", 4], ["chunk", "ot", 8], ["offset", "ot", 8], ["offsetCS", "ot", 0], ["vec", "ot", 4], ["wmma_m", "ot", 16]]}, "result": [[1.1260229e-05], 0, 0.9921481609344482, 1650980944.4098904], "version": 0.2, "tvm_version": "0.8.0"}
{"input": ["cuda -keys=cuda,gpu -max_num_threads=1024 -thread_warp_size=32", "batch_matmul_tensorcore_q_k.cuda", [["TENSOR", [256, 64, 32], "float16"], ["TENSOR", [256, 64, 32], "float16"]], {}], "config": {"index": 36457, "code_hash": null, "entity": [["block_row_warps", "ot", 2], ["warp_row_tiles", "ot", 4], ["warp_col_tiles", "ot", 2], ["chunk", "ot", 12], ["offset", "ot", 0], ["offsetCS", "ot", 8], ["vec", "ot", 2], ["wmma_m", "ot", 16]]}, "result": [[1.8932845e-05], 0, 1.0443053245544434, 1650980946.9763796], "version": 0.2, "tvm_version": "0.8.0"}
{"input": ["cuda -keys=cuda,gpu -max_num_threads=1024 -thread_warp_size=32", "batch_matmul_tensorcore_q_k.cuda", [["TENSOR", [256, 64, 32], "float16"], ["TENSOR", [256, 64, 32], "float16"]], {}], "config": {"index": 23491, "code_hash": null, "entity": [["block_row_warps", "ot", 4], ["warp_row_tiles", "ot", 2], ["warp_col_tiles", "ot", 4], ["chunk", "ot", 8], ["offset", "ot", 0], ["offsetCS", "ot", 8], ["vec", "ot", 8], ["wmma_m", "ot", 32]]}, "result": [[4.0296199000000006e-05], 0, 1.0410223007202148, 1650980948.1693246], "version": 0.2, "tvm_version": "0.8.0"}
{"input": ["cuda -keys=cuda,gpu -max_num_threads=1024 -thread_warp_size=32", "batch_matmul_tensorcore_q_k.cuda", [["TENSOR", [256, 64, 32], "float16"], ["TENSOR", [256, 64, 32], "float16"]], {}], "config": {"index": 26617, "code_hash": null, "entity": [["block_row_warps", "ot", 2], ["warp_row_tiles", "ot", 4], ["warp_col_tiles", "ot", 1], ["chunk", "ot", 8], ["offset", "ot", 0], ["offsetCS", "ot", 0], ["vec", "ot", 1], ["wmma_m", "ot", 16]]}, "result": [[3.6271768e-05], 0, 1.2309927940368652, 1650980948.8382747], "version": 0.2, "tvm_version": "0.8.0"}
{"input": ["cuda -keys=cuda,gpu -max_num_threads=1024 -thread_warp_size=32", "batch_matmul_tensorcore_q_k.cuda", [["TENSOR", [256, 64, 32], "float16"], ["TENSOR", [256, 64, 32], "float16"]], {}], "config": {"index": 11529, "code_hash": null, "entity": [["block_row_warps", "ot", 2], ["warp_row_tiles", "ot", 2], ["warp_col_tiles", "ot", 8], ["chunk", "ot", 2], ["offset", "ot", 8], ["offsetCS", "ot", 8], ["vec", "ot", 2], ["wmma_m", "ot", 32]]}, "result": [[6.327271940667491e-06], 0, 1.06461763381958, 1650980949.8705852], "version": 0.2, "tvm_version": "0.8.0"}
{"input": ["cuda -keys=cuda,gpu -max_num_threads=1024 -thread_warp_size=32", "batch_matmul_tensorcore_q_k.cuda", [["TENSOR", [256, 64, 32], "float16"], ["TENSOR", [256, 64, 32], "float16"]], {}], "config": {"index": 26426, "code_hash": null, "entity": [["block_row_warps", "ot", 3], ["warp_row_tiles", "ot", 6], ["warp_col_tiles", "ot", 1], ["chunk", "ot", 6], ["offset", "ot", 0], ["offsetCS", "ot", 0], ["vec", "ot", 1], ["wmma_m", "ot", 16]]}, "result": [[6.0720852e-05], 0, 1.101149082183838, 1650980951.1355038], "version": 0.2, "tvm_version": "0.8.0"}
{"input": ["cuda -keys=cuda,gpu -max_num_threads=1024 -thread_warp_size=32", "batch_matmul_tensorcore_q_k.cuda", [["TENSOR", [256, 64, 32], "float16"], ["TENSOR", [256, 64, 32], "float16"]], {}], "config": {"index": 20619, "code_hash": null, "entity": [["block_row_warps", "ot", 4], ["warp_row_tiles", "ot", 4], ["warp_col_tiles", "ot", 1], ["chunk", "ot", 16], ["offset", "ot", 0], ["offsetCS", "ot", 0], ["vec", "ot", 8], ["wmma_m", "ot", 32]]}, "result": [[0.00024201771599999998], 0, 1.7770085334777832, 1650980952.8865988], "version": 0.2, "tvm_version": "0.8.0"}
{"input": ["cuda -keys=cuda,gpu -max_num_threads=1024 -thread_warp_size=32", "batch_matmul_tensorcore_q_k.cuda", [["TENSOR", [256, 64, 32], "float16"], ["TENSOR", [256, 64, 32], "float16"]], {}], "config": {"index": 50280, "code_hash": null, "entity": [["block_row_warps", "ot", 1], ["warp_row_tiles", "ot", 1], ["warp_col_tiles", "ot", 4], ["chunk", "ot", 4], ["offset", "ot", 8], ["offsetCS", "ot", 8], ["vec", "ot", 8], ["wmma_m", "ot", 16]]}, "result": [[8.62023176761434e-06], 0, 1.056422233581543, 1650980991.4870934], "version": 0.2, "tvm_version": "0.8.0"}
{"input": ["cuda -keys=cuda,gpu -max_num_threads=1024 -thread_warp_size=32", "batch_matmul_tensorcore_q_k.cuda", [["TENSOR", [256, 64, 32], "float16"], ["TENSOR", [256, 64, 32], "float16"]], {}], "config": {"index": 75848, "code_hash": null, "entity": [["block_row_warps", "ot", 1], ["warp_row_tiles", "ot", 2], ["warp_col_tiles", "ot", 2], ["chunk", "ot", 4], ["offset", "ot", 8], ["offsetCS", "ot", 8], ["vec", "ot", 8], ["wmma_m", "ot", 8]]}, "result": [[8.607132262051916e-06], 0, 1.0301964282989502, 1650980992.214034], "version": 0.2, "tvm_version": "0.8.0"}
{"input": ["cuda -keys=cuda,gpu -max_num_threads=1024 -thread_warp_size=32", "batch_matmul_tensorcore_q_k.cuda", [["TENSOR", [256, 64, 32], "float16"], ["TENSOR", [256, 64, 32], "float16"]], {}], "config": {"index": 50080, "code_hash": null, "entity": [["block_row_warps", "ot", 1], ["warp_row_tiles", "ot", 1], ["warp_col_tiles", "ot", 4], ["chunk", "ot", 3], ["offset", "ot", 8], ["offsetCS", "ot", 8], ["vec", "ot", 8], ["wmma_m", "ot", 16]]}, "result": [[8.389914091470951e-06], 0, 0.9653236865997314, 1650980993.329365], "version": 0.2, "tvm_version": "0.8.0"}
{"input": ["cuda -keys=cuda,gpu -max_num_threads=1024 -thread_warp_size=32", "batch_matmul_tensorcore_q_k.cuda", [["TENSOR", [256, 64, 32], "float16"], ["TENSOR", [256, 64, 32], "float16"]], {}], "config": {"index": 49880, "code_hash": null, "entity": [["block_row_warps", "ot", 1], ["warp_row_tiles", "ot", 1], ["warp_col_tiles", "ot", 4], ["chunk", "ot", 2], ["offset", "ot", 8], ["offsetCS", "ot", 8], ["vec", "ot", 8], ["wmma_m", "ot", 16]]}, "result": [[7.6274765142150815e-06], 0, 1.035794734954834, 1650980994.4099605], "version": 0.2, "tvm_version": "0.8.0"}
{"input": ["cuda -keys=cuda,gpu -max_num_threads=1024 -thread_warp_size=32", "batch_matmul_tensorcore_q_k.cuda", [["TENSOR", [256, 64, 32], "float16"], ["TENSOR", [256, 64, 32], "float16"]], {}], "config": {"index": 76048, "code_hash": null, "entity": [["block_row_warps", "ot", 1], ["warp_row_tiles", "ot", 2], ["warp_col_tiles", "ot", 2], ["chunk", "ot", 6], ["offset", "ot", 8], ["offsetCS", "ot", 8], ["vec", "ot", 8], ["wmma_m", "ot", 8]]}, "result": [[8.121448084054389e-06], 0, 1.1884841918945312, 1650980995.1581962], "version": 0.2, "tvm_version": "0.8.0"}
{"input": ["cuda -keys=cuda,gpu -max_num_threads=1024 -thread_warp_size=32", "batch_matmul_tensorcore_q_k.cuda", [["TENSOR", [256, 64, 32], "float16"], ["TENSOR", [256, 64, 32], "float16"]], {}], "config": {"index": 47080, "code_hash": null, "entity": [["block_row_warps", "ot", 1], ["warp_row_tiles", "ot", 1], ["warp_col_tiles", "ot", 4], ["chunk", "ot", 4], ["offset", "ot", 8], ["offsetCS", "ot", 0], ["vec", "ot", 8], ["wmma_m", "ot", 16]]}, "result": [[9.074839925834362e-06], 0, 0.9749469757080078, 1650980995.8097792], "version": 0.2, "tvm_version": "0.8.0"}
{"input": ["cuda -keys=cuda,gpu -max_num_threads=1024 -thread_warp_size=32", "batch_matmul_tensorcore_q_k.cuda", [["TENSOR", [256, 64, 32], "float16"], ["TENSOR", [256, 64, 32], "float16"]], {}], "config": {"index": 48480, "code_hash": null, "entity": [["block_row_warps", "ot", 1], ["warp_row_tiles", "ot", 1], ["warp_col_tiles", "ot", 4], ["chunk", "ot", 3], ["offset", "ot", 0], ["offsetCS", "ot", 8], ["vec", "ot", 8], ["wmma_m", "ot", 16]]}, "result": [[7.32266563658838e-06], 0, 1.002537727355957, 1650980996.4951372], "version": 0.2, "tvm_version": "0.8.0"}
{"input": ["cuda -keys=cuda,gpu -max_num_threads=1024 -thread_warp_size=32", "batch_matmul_tensorcore_q_k.cuda", [["TENSOR", [256, 64, 32], "float16"], ["TENSOR", [256, 64, 32], "float16"]], {}], "config": {"index": 44280, "code_hash": null, "entity": [["block_row_warps", "ot", 1], ["warp_row_tiles", "ot", 1], ["warp_col_tiles", "ot", 4], ["chunk", "ot", 8], ["offset", "ot", 8], ["offsetCS", "ot", 8], ["vec", "ot", 4], ["wmma_m", "ot", 16]]}, "result": [[7.958285537700866e-06], 0, 1.0322132110595703, 1650980997.1753104], "version": 0.2, "tvm_version": "0.8.0"}
{"input": ["cuda -keys=cuda,gpu -max_num_threads=1024 -thread_warp_size=32", "batch_matmul_tensorcore_q_k.cuda", [["TENSOR", [256, 64, 32], "float16"], ["TENSOR", [256, 64, 32], "float16"]], {}], "config": {"index": 75648, "code_hash": null, "entity": [["block_row_warps", "ot", 1], ["warp_row_tiles", "ot", 2], ["warp_col_tiles", "ot", 2], ["chunk", "ot", 3], ["offset", "ot", 8], ["offsetCS", "ot", 8], ["vec", "ot", 8], ["wmma_m", "ot", 8]]}, "result": [[7.280367119901111e-06], 0, 1.1567280292510986, 1650980997.8192582], "version": 0.2, "tvm_version": "0.8.0"}
{"input": ["cuda -keys=cuda,gpu -max_num_threads=1024 -thread_warp_size=32", "batch_matmul_tensorcore_q_k.cuda", [["TENSOR", [256, 64, 32], "float16"], ["TENSOR", [256, 64, 32], "float16"]], {}], "config": {"index": 50480, "code_hash": null, "entity": [["block_row_warps", "ot", 1], ["warp_row_tiles", "ot", 1], ["warp_col_tiles", "ot", 4], ["chunk", "ot", 6], ["offset", "ot", 8], ["offsetCS", "ot", 8], ["vec", "ot", 8], ["wmma_m", "ot", 16]]}, "result": [[8.249328182941902e-06], 0, 1.0082554817199707, 1650980998.9610066], "version": 0.2, "tvm_version": "0.8.0"}
{"input": ["cuda -keys=cuda,gpu -max_num_threads=1024 -thread_warp_size=32", "batch_matmul_tensorcore_q_k.cuda", [["TENSOR", [256, 64, 32], "float16"], ["TENSOR", [256, 64, 32], "float16"]], {}], "config": {"index": 43680, "code_hash": null, "entity": [["block_row_warps", "ot", 1], ["warp_row_tiles", "ot", 1], ["warp_col_tiles", "ot", 4], ["chunk", "ot", 3], ["offset", "ot", 8], ["offsetCS", "ot", 8], ["vec", "ot", 4], ["wmma_m", "ot", 16]]}, "result": [[7.3319999999999994e-06], 0, 1.043910264968872, 1650980999.6941638], "version": 0.2, "tvm_version": "0.8.0"}
{"input": ["cuda -keys=cuda,gpu -max_num_threads=1024 -thread_warp_size=32", "batch_matmul_tensorcore_q_k.cuda", [["TENSOR", [256, 64, 32], "float16"], ["TENSOR", [256, 64, 32], "float16"]], {}], "config": {"index": 43880, "code_hash": null, "entity": [["block_row_warps", "ot", 1], ["warp_row_tiles", "ot", 1], ["warp_col_tiles", "ot", 4], ["chunk", "ot", 4], ["offset", "ot", 8], ["offsetCS", "ot", 8], ["vec", "ot", 4], ["wmma_m", "ot", 16]]}, "result": [[7.4141260815822e-06], 0, 0.9754509925842285, 1650981000.3390532], "version": 0.2, "tvm_version": "0.8.0"}
{"input": ["cuda -keys=cuda,gpu -max_num_threads=1024 -thread_warp_size=32", "batch_matmul_tensorcore_q_k.cuda", [["TENSOR", [256, 64, 32], "float16"], ["TENSOR", [256, 64, 32], "float16"]], {}], "config": {"index": 48280, "code_hash": null, "entity": [["block_row_warps", "ot", 1], ["warp_row_tiles", "ot", 1], ["warp_col_tiles", "ot", 4], ["chunk", "ot", 2], ["offset", "ot", 0], ["offsetCS", "ot", 8], ["vec", "ot", 8], ["wmma_m", "ot", 16]]}, "result": [[1.1244788009888752e-05], 0, 0.9864592552185059, 1650981001.390344], "version": 0.2, "tvm_version": "0.8.0"}
{"input": ["cuda -keys=cuda,gpu -max_num_threads=1024 -thread_warp_size=32", "batch_matmul_tensorcore_q_k.cuda", [["TENSOR", [256, 64, 32], "float16"], ["TENSOR", [256, 64, 32], "float16"]], {}], "config": {"index": 37280, "code_hash": null, "entity": [["block_row_warps", "ot", 1], ["warp_row_tiles", "ot", 1], ["warp_col_tiles", "ot", 4], ["chunk", "ot", 3], ["offset", "ot", 8], ["offsetCS", "ot", 8], ["vec", "ot", 2], ["wmma_m", "ot", 16]]}, "result": [[9.08370086526576e-06], 0, 1.0557115077972412, 1650981002.4838886], "version": 0.2, "tvm_version": "0.8.0"}
{"input": ["cuda -keys=cuda,gpu -max_num_threads=1024 -thread_warp_size=32", "batch_matmul_tensorcore_q_k.cuda", [["TENSOR", [256, 64, 32], "float16"], ["TENSOR", [256, 64, 32], "float16"]], {}], "config": {"index": 37480, "code_hash": null, "entity": [["block_row_warps", "ot", 1], ["warp_row_tiles", "ot", 1], ["warp_col_tiles", "ot", 4], ["chunk", "ot", 4], ["offset", "ot", 8], ["offsetCS", "ot", 8], ["vec", "ot", 2], ["wmma_m", "ot", 16]]}, "result": [[8.818008034610631e-06], 0, 1.0626161098480225, 1650981003.1746264], "version": 0.2, "tvm_version": "0.8.0"}
{"input": ["cuda -keys=cuda,gpu -max_num_threads=1024 -thread_warp_size=32", "batch_matmul_tensorcore_q_k.cuda", [["TENSOR", [256, 64, 32], "float16"], ["TENSOR", [256, 64, 32], "float16"]], {}], "config": {"index": 74448, "code_hash": null, "entity": [["block_row_warps", "ot", 1], ["warp_row_tiles", "ot", 2], ["warp_col_tiles", "ot", 2], ["chunk", "ot", 6], ["offset", "ot", 0], ["offsetCS", "ot", 8], ["vec", "ot", 8], ["wmma_m", "ot", 8]]}, "result": [[1.0349553000000001e-05], 0, 0.986626148223877, 1650981004.2605178], "version": 0.2, "tvm_version": "0.8.0"}
{"input": ["cuda -keys=cuda,gpu -max_num_threads=1024 -thread_warp_size=32", "batch_matmul_tensorcore_q_k.cuda", [["TENSOR", [256, 64, 32], "float16"], ["TENSOR", [256, 64, 32], "float16"]], {}], "config": {"index": 44080, "code_hash": null, "entity": [["block_row_warps", "ot", 1], ["warp_row_tiles", "ot", 1], ["warp_col_tiles", "ot", 4], ["chunk", "ot", 6], ["offset", "ot", 8], ["offsetCS", "ot", 8], ["vec", "ot", 4], ["wmma_m", "ot", 16]]}, "result": [[7.027983312731767e-06], 0, 1.0067315101623535, 1650981005.3680358], "version": 0.2, "tvm_version": "0.8.0"}
{"input": ["cuda -keys=cuda,gpu -max_num_threads=1024 -thread_warp_size=32", "batch_matmul_tensorcore_q_k.cuda", [["TENSOR", [256, 64, 32], "float16"], ["TENSOR", [256, 64, 32], "float16"]], {}], "config": {"index": 75448, "code_hash": null, "entity": [["block_row_warps", "ot", 1], ["warp_row_tiles", "ot", 2], ["warp_col_tiles", "ot", 2], ["chunk", "ot", 2], ["offset", "ot", 8], ["offsetCS", "ot", 8], ["vec", "ot", 8], ["wmma_m", "ot", 8]]}, "result": [[7.146438813349814e-06], 0, 0.9402890205383301, 1650981005.9746532], "version": 0.2, "tvm_version": "0.8.0"}
{"input": ["cuda -keys=cuda,gpu -max_num_threads=1024 -thread_warp_size=32", "batch_matmul_tensorcore_q_k.cuda", [["TENSOR", [256, 64, 32], "float16"], ["TENSOR", [256, 64, 32], "float16"]], {}], "config": {"index": 74248, "code_hash": null, "entity": [["block_row_warps", "ot", 1], ["warp_row_tiles", "ot", 2], ["warp_col_tiles", "ot", 2], ["chunk", "ot", 4], ["offset", "ot", 0], ["offsetCS", "ot", 8], ["vec", "ot", 8], ["wmma_m", "ot", 8]]}, "result": [[1.3444623999999999e-05], 0, 0.8936066627502441, 1650981006.9951987], "version": 0.2, "tvm_version": "0.8.0"}
{"input": ["cuda -keys=cuda,gpu -max_num_threads=1024 -thread_warp_size=32", "batch_matmul_tensorcore_q_k.cuda", [["TENSOR", [256, 64, 32], "float16"], ["TENSOR", [256, 64, 32], "float16"]], {}], "config": {"index": 74048, "code_hash": null, "entity": [["block_row_warps", "ot", 1], ["warp_row_tiles", "ot", 2], ["warp_col_tiles", "ot", 2], ["chunk", "ot", 3], ["offset", "ot", 0], ["offsetCS", "ot", 8], ["vec", "ot", 8], ["wmma_m", "ot", 8]]}, "result": [[9.63765327564895e-06], 0, 0.9586682319641113, 1650981008.1210027], "version": 0.2, "tvm_version": "0.8.0"}
{"input": ["cuda -keys=cuda,gpu -max_num_threads=1024 -thread_warp_size=32", "batch_matmul_tensorcore_q_k.cuda", [["TENSOR", [256, 64, 32], "float16"], ["TENSOR", [256, 64, 32], "float16"]], {}], "config": {"index": 69848, "code_hash": null, "entity": [["block_row_warps", "ot", 1], ["warp_row_tiles", "ot", 2], ["warp_col_tiles", "ot", 2], ["chunk", "ot", 8], ["offset", "ot", 8], ["offsetCS", "ot", 8], ["vec", "ot", 4], ["wmma_m", "ot", 8]]}, "result": [[9.506927070457355e-06], 0, 1.0820038318634033, 1650981008.8006134], "version": 0.2, "tvm_version": "0.8.0"}
{"input": ["cuda -keys=cuda,gpu -max_num_threads=1024 -thread_warp_size=32", "batch_matmul_tensorcore_q_k.cuda", [["TENSOR", [256, 64, 32], "float16"], ["TENSOR", [256, 64, 32], "float16"]], {}], "config": {"index": 74648, "code_hash": null, "entity": [["block_row_warps", "ot", 1], ["warp_row_tiles", "ot", 2], ["warp_col_tiles", "ot", 2], ["chunk", "ot", 8], ["offset", "ot", 0], ["offsetCS", "ot", 8], ["vec", "ot", 8], ["wmma_m", "ot", 8]]}, "result": [[1.6009284999999998e-05], 0, 1.1220576763153076, 1650981009.5026526], "version": 0.2, "tvm_version": "0.8.0"}
{"input": ["cuda -keys=cuda,gpu -max_num_threads=1024 -thread_warp_size=32", "batch_matmul_tensorcore_q_k.cuda", [["TENSOR", [256, 64, 32], "float16"], ["TENSOR", [256, 64, 32], "float16"]], {}], "config": {"index": 43480, "code_hash": null, "entity": [["block_row_warps", "ot", 1], ["warp_row_tiles", "ot", 1], ["warp_col_tiles", "ot", 4], ["chunk", "ot", 2], ["offset", "ot", 8], ["offsetCS", "ot", 8], ["vec", "ot", 4], ["wmma_m", "ot", 16]]}, "result": [[6.807255871446229e-06], 0, 0.962604284286499, 1650981010.5475383], "version": 0.2, "tvm_version": "0.8.0"}
{"input": ["cuda -keys=cuda,gpu -max_num_threads=1024 -thread_warp_size=32", "batch_matmul_tensorcore_q_k.cuda", [["TENSOR", [256, 64, 32], "float16"], ["TENSOR", [256, 64, 32], "float16"]], {}], "config": {"index": 76248, "code_hash": null, "entity": [["block_row_warps", "ot", 1], ["warp_row_tiles", "ot", 2], ["warp_col_tiles", "ot", 2], ["chunk", "ot", 8], ["offset", "ot", 8], ["offsetCS", "ot", 8], ["vec", "ot", 8], ["wmma_m", "ot", 8]]}, "result": [[7.851400494437577e-06], 0, 1.0028841495513916, 1650981011.1565967], "version": 0.2, "tvm_version": "0.8.0"}
{"input": ["cuda -keys=cuda,gpu -max_num_threads=1024 -thread_warp_size=32", "batch_matmul_tensorcore_q_k.cuda", [["TENSOR", [256, 64, 32], "float16"], ["TENSOR", [256, 64, 32], "float16"]], {}], "config": {"index": 48880, "code_hash": null, "entity": [["block_row_warps", "ot", 1], ["warp_row_tiles", "ot", 1], ["warp_col_tiles", "ot", 4], ["chunk", "ot", 6], ["offset", "ot", 0], ["offsetCS", "ot", 8], ["vec", "ot", 8], ["wmma_m", "ot", 16]]}, "result": [[7.848847342398021e-06], 0, 1.0563042163848877, 1650981011.7951083], "version": 0.2, "tvm_version": "0.8.0"}
{"input": ["cuda -keys=cuda,gpu -max_num_threads=1024 -thread_warp_size=32", "batch_matmul_tensorcore_q_k.cuda", [["TENSOR", [256, 64, 32], "float16"], ["TENSOR", [256, 64, 32], "float16"]], {}], "config": {"index": 37680, "code_hash": null, "entity": [["block_row_warps", "ot", 1], ["warp_row_tiles", "ot", 1], ["warp_col_tiles", "ot", 4], ["chunk", "ot", 6], ["offset", "ot", 8], ["offsetCS", "ot", 8], ["vec", "ot", 2], ["wmma_m", "ot", 16]]}, "result": [[8.347810877626699e-06], 0, 1.0661568641662598, 1650981012.8411534], "version": 0.2, "tvm_version": "0.8.0"}
{"input": ["cuda -keys=cuda,gpu -max_num_threads=1024 -thread_warp_size=32", "batch_matmul_tensorcore_q_k.cuda", [["TENSOR", [256, 64, 32], "float16"], ["TENSOR", [256, 64, 32], "float16"]], {}], "config": {"index": 42280, "code_hash": null, "entity": [["block_row_warps", "ot", 1], ["warp_row_tiles", "ot", 1], ["warp_col_tiles", "ot", 4], ["chunk", "ot", 4], ["offset", "ot", 0], ["offsetCS", "ot", 8], ["vec", "ot", 4], ["wmma_m", "ot", 16]]}, "result": [[1.2025537e-05], 0, 1.0115618705749512, 1650981013.4998367], "version": 0.2, "tvm_version": "0.8.0"}
{"input": ["cuda -keys=cuda,gpu -max_num_threads=1024 -thread_warp_size=32", "batch_matmul_tensorcore_q_k.cuda", [["TENSOR", [256, 64, 32], "float16"], ["TENSOR", [256, 64, 32], "float16"]], {}], "config": {"index": 42080, "code_hash": null, "entity": [["block_row_warps", "ot", 1], ["warp_row_tiles", "ot", 1], ["warp_col_tiles", "ot", 4], ["chunk", "ot", 3], ["offset", "ot", 0], ["offsetCS", "ot", 8], ["vec", "ot", 4], ["wmma_m", "ot", 16]]}, "result": [[7.750490111248456e-06], 0, 1.004871129989624, 1650981014.1855032], "version": 0.2, "tvm_version": "0.8.0"}
{"input": ["cuda -keys=cuda,gpu -max_num_threads=1024 -thread_warp_size=32", "batch_matmul_tensorcore_q_k.cuda", [["TENSOR", [256, 64, 32], "float16"], ["TENSOR", [256, 64, 32], "float16"]], {}], "config": {"index": 37080, "code_hash": null, "entity": [["block_row_warps", "ot", 1], ["warp_row_tiles", "ot", 1], ["warp_col_tiles", "ot", 4], ["chunk", "ot", 2], ["offset", "ot", 8], ["offsetCS", "ot", 8], ["vec", "ot", 2], ["wmma_m", "ot", 16]]}, "result": [[7.373375154511743e-06], 0, 0.9095802307128906, 1650981015.2090707], "version": 0.2, "tvm_version": "0.8.0"}
{"input": ["cuda -keys=cuda,gpu -max_num_threads=1024 -thread_warp_size=32", "batch_matmul_tensorcore_q_k.cuda", [["TENSOR", [256, 64, 32], "float16"], ["TENSOR", [256, 64, 32], "float16"]], {}], "config": {"index": 49080, "code_hash": null, "entity": [["block_row_warps", "ot", 1], ["warp_row_tiles", "ot", 1], ["warp_col_tiles", "ot", 4], ["chunk", "ot", 8], ["offset", "ot", 0], ["offsetCS", "ot", 8], ["vec", "ot", 8], ["wmma_m", "ot", 16]]}, "result": [[1.6568924e-05], 0, 0.9997990131378174, 1650981015.8708556], "version": 0.2, "tvm_version": "0.8.0"}
{"input": ["cuda -keys=cuda,gpu -max_num_threads=1024 -thread_warp_size=32", "batch_matmul_tensorcore_q_k.cuda", [["TENSOR", [256, 64, 32], "float16"], ["TENSOR", [256, 64, 32], "float16"]], {}], "config": {"index": 50680, "code_hash": null, "entity": [["block_row_warps", "ot", 1], ["warp_row_tiles", "ot", 1], ["warp_col_tiles", "ot", 4], ["chunk", "ot", 8], ["offset", "ot", 8], ["offsetCS", "ot", 8], ["vec", "ot", 8], ["wmma_m", "ot", 16]]}, "result": [[9.341325710754018e-06], 0, 1.0396983623504639, 1650981016.9402835], "version": 0.2, "tvm_version": "0.8.0"}
{"input": ["cuda -keys=cuda,gpu -max_num_threads=1024 -thread_warp_size=32", "batch_matmul_tensorcore_q_k.cuda", [["TENSOR", [256, 64, 32], "float16"], ["TENSOR", [256, 64, 32], "float16"]], {}], "config": {"index": 69448, "code_hash": null, "entity": [["block_row_warps", "ot", 1], ["warp_row_tiles", "ot", 2], ["warp_col_tiles", "ot", 2], ["chunk", "ot", 4], ["offset", "ot", 8], ["offsetCS", "ot", 8], ["vec", "ot", 4], ["wmma_m", "ot", 8]]}, "result": [[7.508100741656366e-06], 0, 0.934906005859375, 1650981017.9912977], "version": 0.2, "tvm_version": "0.8.0"}
{"input": ["cuda -keys=cuda,gpu -max_num_threads=1024 -thread_warp_size=32", "batch_matmul_tensorcore_q_k.cuda", [["TENSOR", [256, 64, 32], "float16"], ["TENSOR", [256, 64, 32], "float16"]], {}], "config": {"index": 69248, "code_hash": null, "entity": [["block_row_warps", "ot", 1], ["warp_row_tiles", "ot", 2], ["warp_col_tiles", "ot", 2], ["chunk", "ot", 3], ["offset", "ot", 8], ["offsetCS", "ot", 8], ["vec", "ot", 4], ["wmma_m", "ot", 8]]}, "result": [[6.99733065512979e-06], 0, 1.0720250606536865, 1650981018.6416757], "version": 0.2, "tvm_version": "0.8.0"}
{"input": ["cuda -keys=cuda,gpu -max_num_threads=1024 -thread_warp_size=32", "batch_matmul_tensorcore_q_k.cuda", [["TENSOR", [256, 64, 32], "float16"], ["TENSOR", [256, 64, 32], "float16"]], {}], "config": {"index": 36880, "code_hash": null, "entity": [["block_row_warps", "ot", 1], ["warp_row_tiles", "ot", 1], ["warp_col_tiles", "ot", 4], ["chunk", "ot", 1], ["offset", "ot", 8], ["offsetCS", "ot", 8], ["vec", "ot", 2], ["wmma_m", "ot", 16]]}, "result": [[6.924526576019778e-06], 0, 0.9379172325134277, 1650981019.6489348], "version": 0.2, "tvm_version": "0.8.0"}
{"input": ["cuda -keys=cuda,gpu -max_num_threads=1024 -thread_warp_size=32", "batch_matmul_tensorcore_q_k.cuda", [["TENSOR", [256, 64, 32], "float16"], ["TENSOR", [256, 64, 32], "float16"]], {}], "config": {"index": 35680, "code_hash": null, "entity": [["block_row_warps", "ot", 1], ["warp_row_tiles", "ot", 1], ["warp_col_tiles", "ot", 4], ["chunk", "ot", 3], ["offset", "ot", 0], ["offsetCS", "ot", 8], ["vec", "ot", 2], ["wmma_m", "ot", 16]]}, "result": [[9.57298454882571e-06], 0, 1.0511784553527832, 1650981020.3517022], "version": 0.2, "tvm_version": "0.8.0"}
{"input": ["cuda -keys=cuda,gpu -max_num_threads=1024 -thread_warp_size=32", "batch_matmul_tensorcore_q_k.cuda", [["TENSOR", [256, 64, 32], "float16"], ["TENSOR", [256, 64, 32], "float16"]], {}], "config": {"index": 35880, "code_hash": null, "entity": [["block_row_warps", "ot", 1], ["warp_row_tiles", "ot", 1], ["warp_col_tiles", "ot", 4], ["chunk", "ot", 4], ["offset", "ot", 0], ["offsetCS", "ot", 8], ["vec", "ot", 2], ["wmma_m", "ot", 16]]}, "result": [[1.1439797e-05], 0, 1.0423426628112793, 1650981021.068719], "version": 0.2, "tvm_version": "0.8.0"}
{"input": ["cuda -keys=cuda,gpu -max_num_threads=1024 -thread_warp_size=32", "batch_matmul_tensorcore_q_k.cuda", [["TENSOR", [256, 64, 32], "float16"], ["TENSOR", [256, 64, 32], "float16"]], {}], "config": {"index": 72648, "code_hash": null, "entity": [["block_row_warps", "ot", 1], ["warp_row_tiles", "ot", 2], ["warp_col_tiles", "ot", 2], ["chunk", "ot", 4], ["offset", "ot", 8], ["offsetCS", "ot", 0], ["vec", "ot", 8], ["wmma_m", "ot", 8]]}, "result": [[8.983300370828183e-06], 0, 0.9060771465301514, 1650981022.1288416], "version": 0.2, "tvm_version": "0.8.0"}
{"input": ["cuda -keys=cuda,gpu -max_num_threads=1024 -thread_warp_size=32", "batch_matmul_tensorcore_q_k.cuda", [["TENSOR", [256, 64, 32], "float16"], ["TENSOR", [256, 64, 32], "float16"]], {}], "config": {"index": 42480, "code_hash": null, "entity": [["block_row_warps", "ot", 1], ["warp_row_tiles", "ot", 1], ["warp_col_tiles", "ot", 4], ["chunk", "ot", 6], ["offset", "ot", 0], ["offsetCS", "ot", 8], ["vec", "ot", 4], ["wmma_m", "ot", 16]]}, "result": [[9.470719406674908e-06], 0, 0.9932773113250732, 1650981023.231076], "version": 0.2, "tvm_version": "0.8.0"}
{"input": ["cuda -keys=cuda,gpu -max_num_threads=1024 -thread_warp_size=32", "batch_matmul_tensorcore_q_k.cuda", [["TENSOR", [256, 64, 32], "float16"], ["TENSOR", [256, 64, 32], "float16"]], {}], "config": {"index": 37881, "code_hash": null, "entity": [["block_row_warps", "ot", 2], ["warp_row_tiles", "ot", 1], ["warp_col_tiles", "ot", 4], ["chunk", "ot", 8], ["offset", "ot", 8], ["offsetCS", "ot", 8], ["vec", "ot", 2], ["wmma_m", "ot", 16]]}, "result": [[8.656100741656365e-06], 0, 1.0425350666046143, 1650981023.8986402], "version": 0.2, "tvm_version": "0.8.0"}
{"input": ["cuda -keys=cuda,gpu -max_num_threads=1024 -thread_warp_size=32", "batch_matmul_tensorcore_q_k.cuda", [["TENSOR", [256, 64, 32], "float16"], ["TENSOR", [256, 64, 32], "float16"]], {}], "config": {"index": 63048, "code_hash": null, "entity": [["block_row_warps", "ot", 1], ["warp_row_tiles", "ot", 2], ["warp_col_tiles", "ot", 2], ["chunk", "ot", 4], ["offset", "ot", 8], ["offsetCS", "ot", 8], ["vec", "ot", 2], ["wmma_m", "ot", 8]]}, "result": [[8.356771940667491e-06], 0, 1.0108232498168945, 1650981024.5632856], "version": 0.2, "tvm_version": "0.8.0"}
{"input": ["cuda -keys=cuda,gpu -max_num_threads=1024 -thread_warp_size=32", "batch_matmul_tensorcore_q_k.cuda", [["TENSOR", [256, 64, 32], "float16"], ["TENSOR", [256, 64, 32], "float16"]], {}], "config": {"index": 62848, "code_hash": null, "entity": [["block_row_warps", "ot", 1], ["warp_row_tiles", "ot", 2], ["warp_col_tiles", "ot", 2], ["chunk", "ot", 3], ["offset", "ot", 8], ["offsetCS", "ot", 8], ["vec", "ot", 2], ["wmma_m", "ot", 8]]}, "result": [[7.409181705809642e-06], 0, 0.9465551376342773, 1650981025.6786222], "version": 0.2, "tvm_version": "0.8.0"}
{"input": ["cuda -keys=cuda,gpu -max_num_threads=1024 -thread_warp_size=32", "batch_matmul_tensorcore_q_k.cuda", [["TENSOR", [256, 64, 32], "float16"], ["TENSOR", [256, 64, 32], "float16"]], {}], "config": {"index": 75048, "code_hash": null, "entity": [["block_row_warps", "ot", 1], ["warp_row_tiles", "ot", 2], ["warp_col_tiles", "ot", 2], ["chunk", "ot", 16], ["offset", "ot", 0], ["offsetCS", "ot", 8], ["vec", "ot", 8], ["wmma_m", "ot", 8]]}, "result": [[1.3479862e-05], 0, 0.9645166397094727, 1650981026.7269022], "version": 0.2, "tvm_version": "0.8.0"}
{"input": ["cuda -keys=cuda,gpu -max_num_threads=1024 -thread_warp_size=32", "batch_matmul_tensorcore_q_k.cuda", [["TENSOR", [256, 64, 32], "float16"], ["TENSOR", [256, 64, 32], "float16"]], {}], "config": {"index": 76648, "code_hash": null, "entity": [["block_row_warps", "ot", 1], ["warp_row_tiles", "ot", 2], ["warp_col_tiles", "ot", 2], ["chunk", "ot", 16], ["offset", "ot", 8], ["offsetCS", "ot", 8], ["vec", "ot", 8], ["wmma_m", "ot", 8]]}, "result": [[1.099109e-05], 0, 0.9533350467681885, 1650981027.3642006], "version": 0.2, "tvm_version": "0.8.0"}
{"input": ["cuda -keys=cuda,gpu -max_num_threads=1024 -thread_warp_size=32", "batch_matmul_tensorcore_q_k.cuda", [["TENSOR", [256, 64, 32], "float16"], ["TENSOR", [256, 64, 32], "float16"]], {}], "config": {"index": 76448, "code_hash": null, "entity": [["block_row_warps", "ot", 1], ["warp_row_tiles", "ot", 2], ["warp_col_tiles", "ot", 2], ["chunk", "ot", 12], ["offset", "ot", 8], ["offsetCS", "ot", 8], ["vec", "ot", 8], ["wmma_m", "ot", 8]]}, "result": [[9.35959826946848e-06], 0, 1.12785005569458, 1650981028.1418216], "version": 0.2, "tvm_version": "0.8.0"}
{"input": ["cuda -keys=cuda,gpu -max_num_threads=1024 -thread_warp_size=32", "batch_matmul_tensorcore_q_k.cuda", [["TENSOR", [256, 64, 32], "float16"], ["TENSOR", [256, 64, 32], "float16"]], {}], "config": {"index": 74848, "code_hash": null, "entity": [["block_row_warps", "ot", 1], ["warp_row_tiles", "ot", 2], ["warp_col_tiles", "ot", 2], ["chunk", "ot", 12], ["offset", "ot", 0], ["offsetCS", "ot", 8], ["vec", "ot", 8], ["wmma_m", "ot", 8]]}, "result": [[1.4700663e-05], 0, 0.9346389770507812, 1650981029.24649], "version": 0.2, "tvm_version": "0.8.0"}
{"input": ["cuda -keys=cuda,gpu -max_num_threads=1024 -thread_warp_size=32", "batch_matmul_tensorcore_q_k.cuda", [["TENSOR", [256, 64, 32], "float16"], ["TENSOR", [256, 64, 32], "float16"]], {}], "config": {"index": 69648, "code_hash": null, "entity": [["block_row_warps", "ot", 1], ["warp_row_tiles", "ot", 2], ["warp_col_tiles", "ot", 2], ["chunk", "ot", 6], ["offset", "ot", 8], ["offsetCS", "ot", 8], ["vec", "ot", 4], ["wmma_m", "ot", 8]]}, "result": [[7.850791100123609e-06], 0, 0.982933521270752, 1650981030.3295321], "version": 0.2, "tvm_version": "0.8.0"}
{"input": ["cuda -keys=cuda,gpu -max_num_threads=1024 -thread_warp_size=32", "batch_matmul_tensorcore_q_k.cuda", [["TENSOR", [256, 64, 32], "float16"], ["TENSOR", [256, 64, 32], "float16"]], {}], "config": {"index": 46880, "code_hash": null, "entity": [["block_row_warps", "ot", 1], ["warp_row_tiles", "ot", 1], ["warp_col_tiles", "ot", 4], ["chunk", "ot", 3], ["offset", "ot", 8], ["offsetCS", "ot", 0], ["vec", "ot", 8], ["wmma_m", "ot", 16]]}, "result": [[8.894127935723115e-06], 0, 1.0624501705169678, 1650981031.0527005], "version": 0.2, "tvm_version": "0.8.0"}
{"input": ["cuda -keys=cuda,gpu -max_num_threads=1024 -thread_warp_size=32", "batch_matmul_tensorcore_q_k.cuda", [["TENSOR", [256, 64, 32], "float16"], ["TENSOR", [256, 64, 32], "float16"]], {}], "config": {"index": 41880, "code_hash": null, "entity": [["block_row_warps", "ot", 1], ["warp_row_tiles", "ot", 1], ["warp_col_tiles", "ot", 4], ["chunk", "ot", 2], ["offset", "ot", 0], ["offsetCS", "ot", 8], ["vec", "ot", 4], ["wmma_m", "ot", 16]]}, "result": [[7.81598454882571e-06], 0, 0.8684475421905518, 1650981032.064345], "version": 0.2, "tvm_version": "0.8.0"}
{"input": ["cuda -keys=cuda,gpu -max_num_threads=1024 -thread_warp_size=32", "batch_matmul_tensorcore_q_k.cuda", [["TENSOR", [256, 64, 32], "float16"], ["TENSOR", [256, 64, 32], "float16"]], {}], "config": {"index": 17889, "code_hash": null, "entity": [["block_row_warps", "ot", 2], ["warp_row_tiles", "ot", 2], ["warp_col_tiles", "ot", 4], ["chunk", "ot", 2], ["offset", "ot", 8], ["offsetCS", "ot", 8], ["vec", "ot", 4], ["wmma_m", "ot", 32]]}, "result": [[1.0560929e-05], 0, 1.0022149085998535, 1650981032.715934], "version": 0.2, "tvm_version": "0.8.0"}
{"input": ["cuda -keys=cuda,gpu -max_num_threads=1024 -thread_warp_size=32", "batch_matmul_tensorcore_q_k.cuda", [["TENSOR", [256, 64, 32], "float16"], ["TENSOR", [256, 64, 32], "float16"]], {}], "config": {"index": 41080, "code_hash": null, "entity": [["block_row_warps", "ot", 1], ["warp_row_tiles", "ot", 1], ["warp_col_tiles", "ot", 4], ["chunk", "ot", 8], ["offset", "ot", 8], ["offsetCS", "ot", 0], ["vec", "ot", 4], ["wmma_m", "ot", 16]]}, "result": [[8.223187268232385e-06], 0, 0.9879686832427979, 1650981033.3681505], "version": 0.2, "tvm_version": "0.8.0"}
{"input": ["cuda -keys=cuda,gpu -max_num_threads=1024 -thread_warp_size=32", "batch_matmul_tensorcore_q_k.cuda", [["TENSOR", [256, 64, 32], "float16"], ["TENSOR", [256, 64, 32], "float16"]], {}], "config": {"index": 12130, "code_hash": null, "entity": [["block_row_warps", "ot", 3], ["warp_row_tiles", "ot", 2], ["warp_col_tiles", "ot", 8], ["chunk", "ot", 6], ["offset", "ot", 8], ["offsetCS", "ot", 8], ["vec", "ot", 2], ["wmma_m", "ot", 32]]}, "result": [[1.5586477e-05], 0, 1.1033332347869873, 1650981034.4770267], "version": 0.2, "tvm_version": "0.8.0"}
{"input": ["cuda -keys=cuda,gpu -max_num_threads=1024 -thread_warp_size=32", "batch_matmul_tensorcore_q_k.cuda", [["TENSOR", [256, 64, 32], "float16"], ["TENSOR", [256, 64, 32], "float16"]], {}], "config": {"index": 43289, "code_hash": null, "entity": [["block_row_warps", "ot", 2], ["warp_row_tiles", "ot", 2], ["warp_col_tiles", "ot", 4], ["chunk", "ot", 1], ["offset", "ot", 8], ["offsetCS", "ot", 8], ["vec", "ot", 4], ["wmma_m", "ot", 16]]}, "result": [[7.949963535228678e-06], 0, 0.9691779613494873, 1650981035.5504127], "version": 0.2, "tvm_version": "0.8.0"}
{"input": ["cuda -keys=cuda,gpu -max_num_threads=1024 -thread_warp_size=32", "batch_matmul_tensorcore_q_k.cuda", [["TENSOR", [256, 64, 32], "float16"], ["TENSOR", [256, 64, 32], "float16"]], {}], "config": {"index": 41689, "code_hash": null, "entity": [["block_row_warps", "ot", 2], ["warp_row_tiles", "ot", 2], ["warp_col_tiles", "ot", 4], ["chunk", "ot", 1], ["offset", "ot", 0], ["offsetCS", "ot", 8], ["vec", "ot", 4], ["wmma_m", "ot", 16]]}, "result": [[8.105026576019778e-06], 0, 1.0245013236999512, 1650981036.2493742], "version": 0.2, "tvm_version": "0.8.0"}
{"input": ["cuda -keys=cuda,gpu -max_num_threads=1024 -thread_warp_size=32", "batch_matmul_tensorcore_q_k.cuda", [["TENSOR", [256, 64, 32], "float16"], ["TENSOR", [256, 64, 32], "float16"]], {}], "config": {"index": 36080, "code_hash": null, "entity": [["block_row_warps", "ot", 1], ["warp_row_tiles", "ot", 1], ["warp_col_tiles", "ot", 4], ["chunk", "ot", 6], ["offset", "ot", 0], ["offsetCS", "ot", 8], ["vec", "ot", 2], ["wmma_m", "ot", 16]]}, "result": [[8.750411001236094e-06], 0, 0.9955799579620361, 1650981036.9258795], "version": 0.2, "tvm_version": "0.8.0"}
{"input": ["cuda -keys=cuda,gpu -max_num_threads=1024 -thread_warp_size=32", "batch_matmul_tensorcore_q_k.cuda", [["TENSOR", [256, 64, 32], "float16"], ["TENSOR", [256, 64, 32], "float16"]], {}], "config": {"index": 69240, "code_hash": null, "entity": [["block_row_warps", "ot", 1], ["warp_row_tiles", "ot", 1], ["warp_col_tiles", "ot", 2], ["chunk", "ot", 3], ["offset", "ot", 8], ["offsetCS", "ot", 8], ["vec", "ot", 4], ["wmma_m", "ot", 8]]}, "result": [[9.073656365883807e-06], 0, 1.0929088592529297, 1650981037.5953608], "version": 0.2, "tvm_version": "0.8.0"}
{"input": ["cuda -keys=cuda,gpu -max_num_threads=1024 -thread_warp_size=32", "batch_matmul_tensorcore_q_k.cuda", [["TENSOR", [256, 64, 32], "float16"], ["TENSOR", [256, 64, 32], "float16"]], {}], "config": {"index": 69440, "code_hash": null, "entity": [["block_row_warps", "ot", 1], ["warp_row_tiles", "ot", 1], ["warp_col_tiles", "ot", 2], ["chunk", "ot", 4], ["offset", "ot", 8], ["offsetCS", "ot", 8], ["vec", "ot", 4], ["wmma_m", "ot", 8]]}, "result": [[9.653018541409147e-06], 0, 1.035163402557373, 1650981038.315003], "version": 0.2, "tvm_version": "0.8.0"}
{"input": ["cuda -keys=cuda,gpu -max_num_threads=1024 -thread_warp_size=32", "batch_matmul_tensorcore_q_k.cuda", [["TENSOR", [256, 64, 32], "float16"], ["TENSOR", [256, 64, 32], "float16"]], {}], "config": {"index": 38280, "code_hash": null, "entity": [["block_row_warps", "ot", 1], ["warp_row_tiles", "ot", 1], ["warp_col_tiles", "ot", 4], ["chunk", "ot", 16], ["offset", "ot", 8], ["offsetCS", "ot", 8], ["vec", "ot", 2], ["wmma_m", "ot", 16]]}, "result": [[1.2295103e-05], 0, 0.9389712810516357, 1650981039.452532], "version": 0.2, "tvm_version": "0.8.0"}
{"input": ["cuda -keys=cuda,gpu -max_num_threads=1024 -thread_warp_size=32", "batch_matmul_tensorcore_q_k.cuda", [["TENSOR", [256, 64, 32], "float16"], ["TENSOR", [256, 64, 32], "float16"]], {}], "config": {"index": 18329, "code_hash": null, "entity": [["block_row_warps", "ot", 2], ["warp_row_tiles", "ot", 2], ["warp_col_tiles", "ot", 8], ["chunk", "ot", 4], ["offset", "ot", 8], ["offsetCS", "ot", 8], ["vec", "ot", 4], ["wmma_m", "ot", 32]]}, "result": [[1.2027027e-05], 0, 0.9685811996459961, 1650981040.5512962], "version": 0.2, "tvm_version": "0.8.0"}
{"input": ["cuda -keys=cuda,gpu -max_num_threads=1024 -thread_warp_size=32", "batch_matmul_tensorcore_q_k.cuda", [["TENSOR", [256, 64, 32], "float16"], ["TENSOR", [256, 64, 32], "float16"]], {}], "config": {"index": 16129, "code_hash": null, "entity": [["block_row_warps", "ot", 2], ["warp_row_tiles", "ot", 2], ["warp_col_tiles", "ot", 8], ["chunk", "ot", 1], ["offset", "ot", 0], ["offsetCS", "ot", 8], ["vec", "ot", 4], ["wmma_m", "ot", 32]]}, "result": [[1.2139477e-05], 0, 1.1126384735107422, 1650981041.3033018], "version": 0.2, "tvm_version": "0.8.0"}
{"input": ["cuda -keys=cuda,gpu -max_num_threads=1024 -thread_warp_size=32", "batch_matmul_tensorcore_q_k.cuda", [["TENSOR", [256, 64, 32], "float16"], ["TENSOR", [256, 64, 32], "float16"]], {}], "config": {"index": 17729, "code_hash": null, "entity": [["block_row_warps", "ot", 2], ["warp_row_tiles", "ot", 2], ["warp_col_tiles", "ot", 8], ["chunk", "ot", 1], ["offset", "ot", 8], ["offsetCS", "ot", 8], ["vec", "ot", 4], ["wmma_m", "ot", 32]]}, "result": [[9.839557478368356e-06], 0, 1.1887593269348145, 1650981042.025393], "version": 0.2, "tvm_version": "0.8.0"}
{"input": ["cuda -keys=cuda,gpu -max_num_threads=1024 -thread_warp_size=32", "batch_matmul_tensorcore_q_k.cuda", [["TENSOR", [256, 64, 32], "float16"], ["TENSOR", [256, 64, 32], "float16"]], {}], "config": {"index": 37481, "code_hash": null, "entity": [["block_row_warps", "ot", 2], ["warp_row_tiles", "ot", 1], ["warp_col_tiles", "ot", 4], ["chunk", "ot", 4], ["offset", "ot", 8], ["offsetCS", "ot", 8], ["vec", "ot", 2], ["wmma_m", "ot", 16]]}, "result": [[7.078262051915946e-06], 0, 0.8769762516021729, 1650981043.022298], "version": 0.2, "tvm_version": "0.8.0"}
{"input": ["cuda -keys=cuda,gpu -max_num_threads=1024 -thread_warp_size=32", "batch_matmul_tensorcore_q_k.cuda", [["TENSOR", [256, 64, 32], "float16"], ["TENSOR", [256, 64, 32], "float16"]], {}], "config": {"index": 5341, "code_hash": null, "entity": [["block_row_warps", "ot", 8], ["warp_row_tiles", "ot", 4], ["warp_col_tiles", "ot", 8], ["chunk", "ot", 3], ["offset", "ot", 8], ["offsetCS", "ot", 8], ["vec", "ot", 1], ["wmma_m", "ot", 32]]}, "result": [[2.2805646e-05], 0, 1.0326824188232422, 1650981044.1913214], "version": 0.2, "tvm_version": "0.8.0"}
{"input": ["cuda -keys=cuda,gpu -max_num_threads=1024 -thread_warp_size=32", "batch_matmul_tensorcore_q_k.cuda", [["TENSOR", [256, 64, 32], "float16"], ["TENSOR", [256, 64, 32], "float16"]], {}], "config": {"index": 23283, "code_hash": null, "entity": [["block_row_warps", "ot", 4], ["warp_row_tiles", "ot", 1], ["warp_col_tiles", "ot", 4], ["chunk", "ot", 6], ["offset", "ot", 0], ["offsetCS", "ot", 8], ["vec", "ot", 8], ["wmma_m", "ot", 32]]}, "result": [[3.6529281e-05], 0, 1.0263702869415283, 1650981045.3523781], "version": 0.2, "tvm_version": "0.8.0"}
{"input": ["cuda -keys=cuda,gpu -max_num_threads=1024 -thread_warp_size=32", "batch_matmul_tensorcore_q_k.cuda", [["TENSOR", [256, 64, 32], "float16"], ["TENSOR", [256, 64, 32], "float16"]], {}], "config": {"index": 741, "code_hash": null, "entity": [["block_row_warps", "ot", 8], ["warp_row_tiles", "ot", 4], ["warp_col_tiles", "ot", 8], ["chunk", "ot", 4], ["offset", "ot", 0], ["offsetCS", "ot", 0], ["vec", "ot", 1], ["wmma_m", "ot", 32]]}, "result": [[3.3431913e-05], 0, 1.0491085052490234, 1650981046.0424125], "version": 0.2, "tvm_version": "0.8.0"}
{"input": ["cuda -keys=cuda,gpu -max_num_threads=1024 -thread_warp_size=32", "batch_matmul_tensorcore_q_k.cuda", [["TENSOR", [256, 64, 32], "float16"], ["TENSOR", [256, 64, 32], "float16"]], {}], "config": {"index": 11302, "code_hash": null, "entity": [["block_row_warps", "ot", 12], ["warp_row_tiles", "ot", 4], ["warp_col_tiles", "ot", 4], ["chunk", "ot", 1], ["offset", "ot", 8], ["offsetCS", "ot", 8], ["vec", "ot", 2], ["wmma_m", "ot", 32]]}, "result": [[6.3334167e-05], 0, 1.1518216133117676, 1650981047.8374305], "version": 0.2, "tvm_version": "0.8.0"}
{"input": ["cuda -keys=cuda,gpu -max_num_threads=1024 -thread_warp_size=32", "batch_matmul_tensorcore_q_k.cuda", [["TENSOR", [256, 64, 32], "float16"], ["TENSOR", [256, 64, 32], "float16"]], {}], "config": {"index": 46018, "code_hash": null, "entity": [["block_row_warps", "ot", 3], ["warp_row_tiles", "ot", 4], ["warp_col_tiles", "ot", 1], ["chunk", "ot", 12], ["offset", "ot", 0], ["offsetCS", "ot", 0], ["vec", "ot", 8], ["wmma_m", "ot", 16]]}, "result": [[6.3406762e-05], 0, 1.0749247074127197, 1650981048.5926032], "version": 0.2, "tvm_version": "0.8.0"}
{"input": ["cuda -keys=cuda,gpu -max_num_threads=1024 -thread_warp_size=32", "batch_matmul_tensorcore_q_k.cuda", [["TENSOR", [256, 64, 32], "float16"], ["TENSOR", [256, 64, 32], "float16"]], {}], "config": {"index": 62820, "code_hash": null, "entity": [["block_row_warps", "ot", 6], ["warp_row_tiles", "ot", 4], ["warp_col_tiles", "ot", 1], ["chunk", "ot", 3], ["offset", "ot", 8], ["offsetCS", "ot", 8], ["vec", "ot", 2], ["wmma_m", "ot", 8]]}, "result": [[1.5037328e-05], 0, 0.9003109931945801, 1650981049.636172], "version": 0.2, "tvm_version": "0.8.0"}
{"input": ["cuda -keys=cuda,gpu -max_num_threads=1024 -thread_warp_size=32", "batch_matmul_tensorcore_q_k.cuda", [["TENSOR", [256, 64, 32], "float16"], ["TENSOR", [256, 64, 32], "float16"]], {}], "config": {"index": 31097, "code_hash": null, "entity": [["block_row_warps", "ot", 2], ["warp_row_tiles", "ot", 4], ["warp_col_tiles", "ot", 4], ["chunk", "ot", 4], ["offset", "ot", 8], ["offsetCS", "ot", 8], ["vec", "ot", 1], ["wmma_m", "ot", 16]]}, "result": [[6.429213844252164e-06], 0, 0.946530818939209, 1650981050.2396345], "version": 0.2, "tvm_version": "0.8.0"}
{"input": ["cuda -keys=cuda,gpu -max_num_threads=1024 -thread_warp_size=32", "batch_matmul_tensorcore_q_k.cuda", [["TENSOR", [256, 64, 32], "float16"], ["TENSOR", [256, 64, 32], "float16"]], {}], "config": {"index": 3750, "code_hash": null, "entity": [["block_row_warps", "ot", 12], ["warp_row_tiles", "ot", 6], ["warp_col_tiles", "ot", 8], ["chunk", "ot", 3], ["offset", "ot", 0], ["offsetCS", "ot", 8], ["vec", "ot", 1], ["wmma_m", "ot", 32]]}, "result": [[5.0907582e-05], 0, 1.041703462600708, 1650981051.4308746], "version": 0.2, "tvm_version": "0.8.0"}
{"input": ["cuda -keys=cuda,gpu -max_num_threads=1024 -thread_warp_size=32", "batch_matmul_tensorcore_q_k.cuda", [["TENSOR", [256, 64, 32], "float16"], ["TENSOR", [256, 64, 32], "float16"]], {}], "config": {"index": 11496, "code_hash": null, "entity": [["block_row_warps", "ot", 1], ["warp_row_tiles", "ot", 4], ["warp_col_tiles", "ot", 4], ["chunk", "ot", 2], ["offset", "ot", 8], ["offsetCS", "ot", 8], ["vec", "ot", 2], ["wmma_m", "ot", 32]]}, "result": [[6.517075401730531e-06], 0, 0.9845051765441895, 1650981052.0417423], "version": 0.2, "tvm_version": "0.8.0"}
{"input": ["cuda -keys=cuda,gpu -max_num_threads=1024 -thread_warp_size=32", "batch_matmul_tensorcore_q_k.cuda", [["TENSOR", [256, 64, 32], "float16"], ["TENSOR", [256, 64, 32], "float16"]], {}], "config": {"index": 11488, "code_hash": null, "entity": [["block_row_warps", "ot", 1], ["warp_row_tiles", "ot", 2], ["warp_col_tiles", "ot", 4], ["chunk", "ot", 2], ["offset", "ot", 8], ["offsetCS", "ot", 8], ["vec", "ot", 2], ["wmma_m", "ot", 32]]}, "result": [[9.682795426452411e-06], 0, 0.9872560501098633, 1650981078.677064], "version": 0.2, "tvm_version": "0.8.0"}
{"input": ["cuda -keys=cuda,gpu -max_num_threads=1024 -thread_warp_size=32", "batch_matmul_tensorcore_q_k.cuda", [["TENSOR", [256, 64, 32], "float16"], ["TENSOR", [256, 64, 32], "float16"]], {}], "config": {"index": 36912, "code_hash": null, "entity": [["block_row_warps", "ot", 1], ["warp_row_tiles", "ot", 8], ["warp_col_tiles", "ot", 4], ["chunk", "ot", 1], ["offset", "ot", 8], ["offsetCS", "ot", 8], ["vec", "ot", 2], ["wmma_m", "ot", 16]]}, "result": [[9.393512360939431e-06], 0, 1.136159896850586, 1650981079.418416], "version": 0.2, "tvm_version": "0.8.0"}
