python/models/swin_transformer/kernel_configs/swin_transformer_attn_v_permute_1_56_56_512_7_16.log
{"i": [["[\"attn_v_permute\", 1, 56, 56, 512, 7, 16]", "cuda -keys=cuda,gpu -max_num_threads=1024 -model=unknown -thread_warp_size=32", [-1, 16, 64, 49152, 2147483647, 1024, 8, 32], "", 0, []], [[], [["FU", 1, [0, 1, 2, 3]], ["SP", 1, 0, 1605632, [16], 1], ["AN", 1, 0, 5], ["AN", 1, 1, 6]]]], "r": [[7.7048e-05, 7.70595e-05, 7.70688e-05], 0, 2.45665, 1668019415], "v": "v0.6"}
{"i": [["[\"attn_v_permute\", 1, 56, 56, 512, 7, 16]", "cuda -keys=cuda,gpu -max_num_threads=1024 -model=unknown -thread_warp_size=32", [-1, 16, 64, 49152, 2147483647, 1024, 8, 32], "", 0, []], [[], [["FU", 1, [0, 1, 2, 3]], ["SP", 1, 0, 1605632, [1], 1], ["AN", 1, 0, 5], ["AN", 1, 1, 6]]]], "r": [[0.0011931, 0.00119323, 0.00119324], 0, 2.92714, 1668019416], "v": "v0.6"}
{"i": [["[\"attn_v_permute\", 1, 56, 56, 512, 7, 16]", "cuda -keys=cuda,gpu -max_num_threads=1024 -model=unknown -thread_warp_size=32", [-1, 16, 64, 49152, 2147483647, 1024, 8, 32], "", 0, []], [[], [["FU", 1, [0, 1, 2, 3]], ["SP", 1, 0, 1605632, [4], 1], ["AN", 1, 0, 5], ["AN", 1, 1, 6]]]], "r": [[0.000300394, 0.000300388, 0.00030035], 0, 2.01912, 1668019415], "v": "v0.6"}
{"i": [["[\"attn_v_permute\", 1, 56, 56, 512, 7, 16]", "cuda -keys=cuda,gpu -max_num_threads=1024 -model=unknown -thread_warp_size=32", [-1, 16, 64, 49152, 2147483647, 1024, 8, 32], "", 0, []], [[], [["FU", 1, [0, 1, 2, 3]], ["SP", 1, 0, 1605632, [56], 1], ["AN", 1, 0, 5], ["AN", 1, 1, 6]]]], "r": [[2.38067e-05, 2.3807e-05, 2.3811e-05], 0, 0.675614, 1668019414], "v": "v0.6"}
{"i": [["[\"attn_v_permute\", 1, 56, 56, 512, 7, 16]", "cuda -keys=cuda,gpu -max_num_threads=1024 -model=unknown -thread_warp_size=32", [-1, 16, 64, 49152, 2147483647, 1024, 8, 32], "", 0, []], [[], [["FU", 1, [0, 1, 2, 3]], ["SP", 1, 0, 1605632, [49], 1], ["AN", 1, 0, 5], ["AN", 1, 1, 6]]]], "r": [[2.68039e-05, 2.68006e-05, 2.68048e-05], 0, 1.1103, 1668019414], "v": "v0.6"}
{"i": [["[\"attn_v_permute\", 1, 56, 56, 512, 7, 16]", "cuda -keys=cuda,gpu -max_num_threads=1024 -model=unknown -thread_warp_size=32", [-1, 16, 64, 49152, 2147483647, 1024, 8, 32], "", 0, []], [[], [["FU", 1, [0, 1, 2, 3]], ["SP", 1, 0, 1605632, [2], 1], ["AN", 1, 0, 5], ["AN", 1, 1, 6]]]], "r": [[0.000598109, 0.000598137, 0.000598138], 0, 1.59176, 1668019415], "v": "v0.6"}
{"i": [["[\"attn_v_permute\", 1, 56, 56, 512, 7, 16]", "cuda -keys=cuda,gpu -max_num_threads=1024 -model=unknown -thread_warp_size=32", [-1, 16, 64, 49152, 2147483647, 1024, 8, 32], "", 0, []], [[], [["FU", 1, [0, 1, 2, 3]], ["SP", 1, 0, 1605632, [32], 1], ["AN", 1, 0, 5], ["AN", 1, 1, 6]]]], "r": [[3.99157e-05, 3.99229e-05, 3.99113e-05], 0, 3.76884, 1668019417], "v": "v0.6"}
{"i": [["[\"attn_v_permute\", 1, 56, 56, 512, 7, 16]", "cuda -keys=cuda,gpu -max_num_threads=1024 -model=unknown -thread_warp_size=32", [-1, 16, 64, 49152, 2147483647, 1024, 8, 32], "", 0, []], [[], [["FU", 1, [0, 1, 2, 3]], ["SP", 1, 0, 1605632, [7], 1], ["AN", 1, 0, 5], ["AN", 1, 1, 6]]]], "r": [[0.000172837, 0.000172834, 0.000172829], 0, 3.32971, 1668019416], "v": "v0.6"}
{"i": [["[\"attn_v_permute\", 1, 56, 56, 512, 7, 16]", "cuda -keys=cuda,gpu -max_num_threads=1024 -model=unknown -thread_warp_size=32", [-1, 16, 64, 49152, 2147483647, 1024, 8, 32], "", 0, []], [[], [["FU", 1, [0, 1, 2, 3]], ["SP", 1, 0, 1605632, [64], 1], ["AN", 1, 0, 5], ["AN", 1, 1, 6]]]], "r": [[2.13121e-05, 2.13229e-05, 2.13174e-05], 0, 4.23555, 1668019417], "v": "v0.6"}
{"i": [["[\"attn_v_permute\", 1, 56, 56, 512, 7, 16]", "cuda -keys=cuda,gpu -max_num_threads=1024 -model=unknown -thread_warp_size=32", [-1, 16, 64, 49152, 2147483647, 1024, 8, 32], "", 0, []], [[], [["FU", 1, [0, 1, 2, 3]], ["SP", 1, 0, 1605632, [28], 1], ["AN", 1, 0, 5], ["AN", 1, 1, 6]]]], "r": [[4.53006e-05, 4.533e-05, 4.53332e-05], 0, 4.67256, 1668019418], "v": "v0.6"}
{"i": [["[\"attn_v_permute\", 1, 56, 56, 512, 7, 16]", "cuda -keys=cuda,gpu -max_num_threads=1024 -model=unknown -thread_warp_size=32", [-1, 16, 64, 49152, 2147483647, 1024, 8, 32], "", 0, []], [[], [["FU", 1, [0, 1, 2, 3]], ["SP", 1, 0, 1605632, [8], 1], ["AN", 1, 0, 5], ["AN", 1, 1, 6]]]], "r": [[0.000151573, 0.000151578, 0.000151595], 0, 5.5633, 1668019419], "v": "v0.6"}
{"i": [["[\"attn_v_permute\", 1, 56, 56, 512, 7, 16]", "cuda -keys=cuda,gpu -max_num_threads=1024 -model=unknown -thread_warp_size=32", [-1, 16, 64, 49152, 2147483647, 1024, 8, 32], "", 0, []], [[], [["FU", 1, [0, 1, 2, 3]], ["SP", 1, 0, 1605632, [14], 1], ["AN", 1, 0, 5], ["AN", 1, 1, 6]]]], "r": [[8.78426e-05, 8.78627e-05, 8.78656e-05], 0, 5.09305, 1668019418], "v": "v0.6"}
{"i": [["[\"attn_v_permute\", 1, 56, 56, 512, 7, 16]", "cuda -keys=cuda,gpu -max_num_threads=1024 -model=unknown -thread_warp_size=32", [-1, 16, 64, 49152, 2147483647, 1024, 8, 32], "", 0, []], [[], [["FU", 1, [0, 1, 2, 3]], ["SP", 1, 0, 1605632, [8], 1], ["AN", 1, 0, 5], ["AN", 1, 1, 6]]]], "r": [[0.000151672, 0.000151668, 0.000151681], 0, 2.73899, 1668019790], "v": "v0.6"}
{"i": [["[\"attn_v_permute\", 1, 56, 56, 512, 7, 16]", "cuda -keys=cuda,gpu -max_num_threads=1024 -model=unknown -thread_warp_size=32", [-1, 16, 64, 49152, 2147483647, 1024, 8, 32], "", 0, []], [[], [["FU", 1, [0, 1, 2, 3]], ["SP", 1, 0, 1605632, [1], 1], ["AN", 1, 0, 5], ["AN", 1, 1, 6]]]], "r": [[0.00119325, 0.00119325, 0.00119338], 0, 1.06948, 1668019788], "v": "v0.6"}
{"i": [["[\"attn_v_permute\", 1, 56, 56, 512, 7, 16]", "cuda -keys=cuda,gpu -max_num_threads=1024 -model=unknown -thread_warp_size=32", [-1, 16, 64, 49152, 2147483647, 1024, 8, 32], "", 0, []], [[], [["FU", 1, [0, 1, 2, 3]], ["SP", 1, 0, 1605632, [16], 1], ["AN", 1, 0, 5], ["AN", 1, 1, 6]]]], "r": [[7.71062e-05, 7.71367e-05, 7.71126e-05], 0, 0.660943, 1668019788], "v": "v0.6"}
{"i": [["[\"attn_v_permute\", 1, 56, 56, 512, 7, 16]", "cuda -keys=cuda,gpu -max_num_threads=1024 -model=unknown -thread_warp_size=32", [-1, 16, 64, 49152, 2147483647, 1024, 8, 32], "", 0, []], [[], [["FU", 1, [0, 1, 2, 3]], ["SP", 1, 0, 1605632, [4], 1], ["AN", 1, 0, 5], ["AN", 1, 1, 6]]]], "r": [[0.000300447, 0.000300437, 0.000300427], 0, 1.49864, 1668019788], "v": "v0.6"}
{"i": [["[\"attn_v_permute\", 1, 56, 56, 512, 7, 16]", "cuda -keys=cuda,gpu -max_num_threads=1024 -model=unknown -thread_warp_size=32", [-1, 16, 64, 49152, 2147483647, 1024, 8, 32], "", 0, []], [[], [["FU", 1, [0, 1, 2, 3]], ["SP", 1, 0, 1605632, [64], 1], ["AN", 1, 0, 5], ["AN", 1, 1, 6]]]], "r": [[2.12824e-05, 2.12844e-05, 2.12878e-05], 0, 2.2995, 1668019789], "v": "v0.6"}
{"i": [["[\"attn_v_permute\", 1, 56, 56, 512, 7, 16]", "cuda -keys=cuda,gpu -max_num_threads=1024 -model=unknown -thread_warp_size=32", [-1, 16, 64, 49152, 2147483647, 1024, 8, 32], "", 0, []], [[], [["FU", 1, [0, 1, 2, 3]], ["SP", 1, 0, 1605632, [2], 1], ["AN", 1, 0, 5], ["AN", 1, 1, 6]]]], "r": [[0.000598179, 0.000598112, 0.000598201], 0, 1.88854, 1668019789], "v": "v0.6"}
{"i": [["[\"attn_v_permute\", 1, 56, 56, 512, 7, 16]", "cuda -keys=cuda,gpu -max_num_threads=1024 -model=unknown -thread_warp_size=32", [-1, 16, 64, 49152, 2147483647, 1024, 8, 32], "", 0, []], [[], [["FU", 1, [0, 1, 2, 3]], ["SP", 1, 0, 1605632, [7], 1], ["AN", 1, 0, 5], ["AN", 1, 1, 6]]]], "r": [[0.00017291, 0.000172925, 0.000172939], 0, 3.52881, 1668019791], "v": "v0.6"}
{"i": [["[\"attn_v_permute\", 1, 56, 56, 512, 7, 16]", "cuda -keys=cuda,gpu -max_num_threads=1024 -model=unknown -thread_warp_size=32", [-1, 16, 64, 49152, 2147483647, 1024, 8, 32], "", 0, []], [[], [["FU", 1, [0, 1, 2, 3]], ["SP", 1, 0, 1605632, [32], 1], ["AN", 1, 0, 5], ["AN", 1, 1, 6]]]], "r": [[3.99193e-05, 3.99274e-05, 3.99339e-05], 0, 4.39311, 1668019791], "v": "v0.6"}
{"i": [["[\"attn_v_permute\", 1, 56, 56, 512, 7, 16]", "cuda -keys=cuda,gpu -max_num_threads=1024 -model=unknown -thread_warp_size=32", [-1, 16, 64, 49152, 2147483647, 1024, 8, 32], "", 0, []], [[], [["FU", 1, [0, 1, 2, 3]], ["SP", 1, 0, 1605632, [14], 1], ["AN", 1, 0, 5], ["AN", 1, 1, 6]]]], "r": [[8.78629e-05, 8.7883e-05, 8.78726e-05], 0, 3.1395, 1668019790], "v": "v0.6"}
{"i": [["[\"attn_v_permute\", 1, 56, 56, 512, 7, 16]", "cuda -keys=cuda,gpu -max_num_threads=1024 -model=unknown -thread_warp_size=32", [-1, 16, 64, 49152, 2147483647, 1024, 8, 32], "", 0, []], [[], [["FU", 1, [0, 1, 2, 3]], ["SP", 1, 0, 1605632, [49], 1], ["AN", 1, 0, 5], ["AN", 1, 1, 6]]]], "r": [[2.68022e-05, 2.68189e-05, 2.68207e-05], 0, 3.97604, 1668019791], "v": "v0.6"}
{"i": [["[\"attn_v_permute\", 1, 56, 56, 512, 7, 16]", "cuda -keys=cuda,gpu -max_num_threads=1024 -model=unknown -thread_warp_size=32", [-1, 16, 64, 49152, 2147483647, 1024, 8, 32], "", 0, []], [[], [["FU", 1, [0, 1, 2, 3]], ["SP", 1, 0, 1605632, [56], 1], ["AN", 1, 0, 5], ["AN", 1, 1, 6]]]], "r": [[2.381e-05, 2.38321e-05, 2.38253e-05], 0, 5.23103, 1668019792], "v": "v0.6"}
{"i": [["[\"attn_v_permute\", 1, 56, 56, 512, 7, 16]", "cuda -keys=cuda,gpu -max_num_threads=1024 -model=unknown -thread_warp_size=32", [-1, 16, 64, 49152, 2147483647, 1024, 8, 32], "", 0, []], [[], [["FU", 1, [0, 1, 2, 3]], ["SP", 1, 0, 1605632, [28], 1], ["AN", 1, 0, 5], ["AN", 1, 1, 6]]]], "r": [[4.52114e-05, 4.52184e-05, 4.52256e-05], 0, 4.77736, 1668019792], "v": "v0.6"}
