python/models/swin_transformer/kernel_configs/swin_transformer_window_partition_1_7_7_1024_7_float16.log
{"i": [["[\"window_partition\", 1, 7, 7, 1024, 7, \"float16\"]", "cuda -keys=cuda,gpu -max_num_threads=1024 -model=unknown -thread_warp_size=32", [-1, 16, 64, 49152, 2147483647, 1024, 8, 32], "", 0, []], [[], [["FU", 1, [0, 1, 2, 3]], ["SP", 1, 0, 50176, [2], 1], ["AN", 1, 0, 5], ["AN", 1, 1, 6]]]], "r": [[2.12139e-05, 2.12277e-05, 2.12232e-05], 0, 2.91999, 1668058995], "v": "v0.6"}
{"i": [["[\"window_partition\", 1, 7, 7, 1024, 7, \"float16\"]", "cuda -keys=cuda,gpu -max_num_threads=1024 -model=unknown -thread_warp_size=32", [-1, 16, 64, 49152, 2147483647, 1024, 8, 32], "", 0, []], [[], [["FU", 1, [0, 1, 2, 3]], ["SP", 1, 0, 50176, [64], 1], ["AN", 1, 0, 5], ["AN", 1, 1, 6]]]], "r": [[3.06632e-06, 3.06225e-06, 3.06233e-06], 0, 1.75158, 1668058994], "v": "v0.6"}
{"i": [["[\"window_partition\", 1, 7, 7, 1024, 7, \"float16\"]", "cuda -keys=cuda,gpu -max_num_threads=1024 -model=unknown -thread_warp_size=32", [-1, 16, 64, 49152, 2147483647, 1024, 8, 32], "", 0, []], [[], [["FU", 1, [0, 1, 2, 3]], ["SP", 1, 0, 50176, [16], 1], ["AN", 1, 0, 5], ["AN", 1, 1, 6]]]], "r": [[5.03396e-06, 5.05146e-06, 5.05351e-06], 0, 0.59071, 1668058993], "v": "v0.6"}
{"i": [["[\"window_partition\", 1, 7, 7, 1024, 7, \"float16\"]", "cuda -keys=cuda,gpu -max_num_threads=1024 -model=unknown -thread_warp_size=32", [-1, 16, 64, 49152, 2147483647, 1024, 8, 32], "", 0, []], [[], [["FU", 1, [0, 1, 2, 3]], ["SP", 1, 0, 50176, [14], 1], ["AN", 1, 0, 5], ["AN", 1, 1, 6]]]], "r": [[5.14646e-06, 5.15643e-06, 5.15483e-06], 0, 1.36897, 1668058994], "v": "v0.6"}
{"i": [["[\"window_partition\", 1, 7, 7, 1024, 7, \"float16\"]", "cuda -keys=cuda,gpu -max_num_threads=1024 -model=unknown -thread_warp_size=32", [-1, 16, 64, 49152, 2147483647, 1024, 8, 32], "", 0, []], [[], [["FU", 1, [0, 1, 2, 3]], ["SP", 1, 0, 50176, [32], 1], ["AN", 1, 0, 5], ["AN", 1, 1, 6]]]], "r": [[3.60111e-06, 3.61313e-06, 3.61509e-06], 0, 0.990289, 1668058993], "v": "v0.6"}
{"i": [["[\"window_partition\", 1, 7, 7, 1024, 7, \"float16\"]", "cuda -keys=cuda,gpu -max_num_threads=1024 -model=unknown -thread_warp_size=32", [-1, 16, 64, 49152, 2147483647, 1024, 8, 32], "", 0, []], [[], [["FU", 1, [0, 1, 2, 3]], ["SP", 1, 0, 50176, [4], 1], ["AN", 1, 0, 5], ["AN", 1, 1, 6]]]], "r": [[1.19841e-05, 1.19946e-05, 1.19996e-05], 0, 2.17485, 1668058995], "v": "v0.6"}
{"i": [["[\"window_partition\", 1, 7, 7, 1024, 7, \"float16\"]", "cuda -keys=cuda,gpu -max_num_threads=1024 -model=unknown -thread_warp_size=32", [-1, 16, 64, 49152, 2147483647, 1024, 8, 32], "", 0, []], [[], [["FU", 1, [0, 1, 2, 3]], ["SP", 1, 0, 50176, [1], 1], ["AN", 1, 0, 5], ["AN", 1, 1, 6]]]], "r": [[3.97931e-05, 3.98107e-05, 3.98102e-05], 0, 2.54666, 1668058995], "v": "v0.6"}
{"i": [["[\"window_partition\", 1, 7, 7, 1024, 7, \"float16\"]", "cuda -keys=cuda,gpu -max_num_threads=1024 -model=unknown -thread_warp_size=32", [-1, 16, 64, 49152, 2147483647, 1024, 8, 32], "", 0, []], [[], [["FU", 1, [0, 1, 2, 3]], ["SP", 1, 0, 50176, [8], 1], ["AN", 1, 0, 5], ["AN", 1, 1, 6]]]], "r": [[7.21524e-06, 7.22964e-06, 7.22898e-06], 0, 4.43734, 1668058997], "v": "v0.6"}
{"i": [["[\"window_partition\", 1, 7, 7, 1024, 7, \"float16\"]", "cuda -keys=cuda,gpu -max_num_threads=1024 -model=unknown -thread_warp_size=32", [-1, 16, 64, 49152, 2147483647, 1024, 8, 32], "", 0, []], [[], [["FU", 1, [0, 1, 2, 3]], ["SP", 1, 0, 50176, [49], 1], ["AN", 1, 0, 5], ["AN", 1, 1, 6]]]], "r": [[3.48524e-06, 3.49861e-06, 3.49813e-06], 0, 4.02782, 1668058996], "v": "v0.6"}
{"i": [["[\"window_partition\", 1, 7, 7, 1024, 7, \"float16\"]", "cuda -keys=cuda,gpu -max_num_threads=1024 -model=unknown -thread_warp_size=32", [-1, 16, 64, 49152, 2147483647, 1024, 8, 32], "", 0, []], [[], [["FU", 1, [0, 1, 2, 3]], ["SP", 1, 0, 50176, [56], 1], ["AN", 1, 0, 5], ["AN", 1, 1, 6]]]], "r": [[3.1318e-06, 3.14238e-06, 3.14265e-06], 0, 3.29917, 1668058996], "v": "v0.6"}
{"i": [["[\"window_partition\", 1, 7, 7, 1024, 7, \"float16\"]", "cuda -keys=cuda,gpu -max_num_threads=1024 -model=unknown -thread_warp_size=32", [-1, 16, 64, 49152, 2147483647, 1024, 8, 32], "", 0, []], [[], [["FU", 1, [0, 1, 2, 3]], ["SP", 1, 0, 50176, [28], 1], ["AN", 1, 0, 5], ["AN", 1, 1, 6]]]], "r": [[3.9284e-06, 3.94751e-06, 3.94517e-06], 0, 4.82233, 1668058997], "v": "v0.6"}
{"i": [["[\"window_partition\", 1, 7, 7, 1024, 7, \"float16\"]", "cuda -keys=cuda,gpu -max_num_threads=1024 -model=unknown -thread_warp_size=32", [-1, 16, 64, 49152, 2147483647, 1024, 8, 32], "", 0, []], [[], [["FU", 1, [0, 1, 2, 3]], ["SP", 1, 0, 50176, [7], 1], ["AN", 1, 0, 5], ["AN", 1, 1, 6]]]], "r": [[7.89282e-06, 7.89796e-06, 7.89857e-06], 0, 3.65184, 1668058996], "v": "v0.6"}
{"i": [["[\"window_partition\", 1, 7, 7, 1024, 7, \"float16\"]", "cuda -keys=cuda,gpu -max_num_threads=1024 -model=unknown -thread_warp_size=32", [-1, 16, 64, 49152, 2147483647, 1024, 8, 32], "", 0, []], [[], [["FU", 1, [0, 1, 2, 3]], ["SP", 1, 0, 50176, [56], 1], ["AN", 1, 0, 5], ["AN", 1, 1, 6]]]], "r": [[3.36409e-06, 3.38189e-06, 3.37824e-06], 0, 0.577895, 1668061539], "v": "v0.6"}
{"i": [["[\"window_partition\", 1, 7, 7, 1024, 7, \"float16\"]", "cuda -keys=cuda,gpu -max_num_threads=1024 -model=unknown -thread_warp_size=32", [-1, 16, 64, 49152, 2147483647, 1024, 8, 32], "", 0, []], [[], [["FU", 1, [0, 1, 2, 3]], ["SP", 1, 0, 50176, [14], 1], ["AN", 1, 0, 5], ["AN", 1, 1, 6]]]], "r": [[5.39631e-06, 5.41284e-06, 5.4133e-06], 0, 1.26524, 1668061540], "v": "v0.6"}
{"i": [["[\"window_partition\", 1, 7, 7, 1024, 7, \"float16\"]", "cuda -keys=cuda,gpu -max_num_threads=1024 -model=unknown -thread_warp_size=32", [-1, 16, 64, 49152, 2147483647, 1024, 8, 32], "", 0, []], [[], [["FU", 1, [0, 1, 2, 3]], ["SP", 1, 0, 50176, [64], 1], ["AN", 1, 0, 5], ["AN", 1, 1, 6]]]], "r": [[3.13947e-06, 3.15479e-06, 3.14791e-06], 0, 0.895616, 1668061539], "v": "v0.6"}
{"i": [["[\"window_partition\", 1, 7, 7, 1024, 7, \"float16\"]", "cuda -keys=cuda,gpu -max_num_threads=1024 -model=unknown -thread_warp_size=32", [-1, 16, 64, 49152, 2147483647, 1024, 8, 32], "", 0, []], [[], [["FU", 1, [0, 1, 2, 3]], ["SP", 1, 0, 50176, [4], 1], ["AN", 1, 0, 5], ["AN", 1, 1, 6]]]], "r": [[1.21139e-05, 1.21242e-05, 1.21253e-05], 0, 1.60704, 1668061540], "v": "v0.6"}
{"i": [["[\"window_partition\", 1, 7, 7, 1024, 7, \"float16\"]", "cuda -keys=cuda,gpu -max_num_threads=1024 -model=unknown -thread_warp_size=32", [-1, 16, 64, 49152, 2147483647, 1024, 8, 32], "", 0, []], [[], [["FU", 1, [0, 1, 2, 3]], ["SP", 1, 0, 50176, [8], 1], ["AN", 1, 0, 5], ["AN", 1, 1, 6]]]], "r": [[7.26242e-06, 7.2778e-06, 7.27694e-06], 0, 2.63825, 1668061541], "v": "v0.6"}
{"i": [["[\"window_partition\", 1, 7, 7, 1024, 7, \"float16\"]", "cuda -keys=cuda,gpu -max_num_threads=1024 -model=unknown -thread_warp_size=32", [-1, 16, 64, 49152, 2147483647, 1024, 8, 32], "", 0, []], [[], [["FU", 1, [0, 1, 2, 3]], ["SP", 1, 0, 50176, [16], 1], ["AN", 1, 0, 5], ["AN", 1, 1, 6]]]], "r": [[5.06179e-06, 5.07469e-06, 5.07308e-06], 0, 2.29554, 1668061541], "v": "v0.6"}
{"i": [["[\"window_partition\", 1, 7, 7, 1024, 7, \"float16\"]", "cuda -keys=cuda,gpu -max_num_threads=1024 -model=unknown -thread_warp_size=32", [-1, 16, 64, 49152, 2147483647, 1024, 8, 32], "", 0, []], [[], [["FU", 1, [0, 1, 2, 3]], ["SP", 1, 0, 50176, [49], 1], ["AN", 1, 0, 5], ["AN", 1, 1, 6]]]], "r": [[3.48327e-06, 3.49648e-06, 3.49875e-06], 0, 1.92229, 1668061540], "v": "v0.6"}
{"i": [["[\"window_partition\", 1, 7, 7, 1024, 7, \"float16\"]", "cuda -keys=cuda,gpu -max_num_threads=1024 -model=unknown -thread_warp_size=32", [-1, 16, 64, 49152, 2147483647, 1024, 8, 32], "", 0, []], [[], [["FU", 1, [0, 1, 2, 3]], ["SP", 1, 0, 50176, [2], 1], ["AN", 1, 0, 5], ["AN", 1, 1, 6]]]], "r": [[2.1484e-05, 2.1496e-05, 2.14959e-05], 0, 2.95844, 1668061542], "v": "v0.6"}
{"i": [["[\"window_partition\", 1, 7, 7, 1024, 7, \"float16\"]", "cuda -keys=cuda,gpu -max_num_threads=1024 -model=unknown -thread_warp_size=32", [-1, 16, 64, 49152, 2147483647, 1024, 8, 32], "", 0, []], [[], [["FU", 1, [0, 1, 2, 3]], ["SP", 1, 0, 50176, [28], 1], ["AN", 1, 0, 5], ["AN", 1, 1, 6]]]], "r": [[3.95635e-06, 3.97442e-06, 3.97122e-06], 0, 3.34077, 1668061542], "v": "v0.6"}
{"i": [["[\"window_partition\", 1, 7, 7, 1024, 7, \"float16\"]", "cuda -keys=cuda,gpu -max_num_threads=1024 -model=unknown -thread_warp_size=32", [-1, 16, 64, 49152, 2147483647, 1024, 8, 32], "", 0, []], [[], [["FU", 1, [0, 1, 2, 3]], ["SP", 1, 0, 50176, [7], 1], ["AN", 1, 0, 5], ["AN", 1, 1, 6]]]], "r": [[8.00275e-06, 8.01934e-06, 8.0239e-06], 0, 4.01899, 1668061543], "v": "v0.6"}
{"i": [["[\"window_partition\", 1, 7, 7, 1024, 7, \"float16\"]", "cuda -keys=cuda,gpu -max_num_threads=1024 -model=unknown -thread_warp_size=32", [-1, 16, 64, 49152, 2147483647, 1024, 8, 32], "", 0, []], [[], [["FU", 1, [0, 1, 2, 3]], ["SP", 1, 0, 50176, [1], 1], ["AN", 1, 0, 5], ["AN", 1, 1, 6]]]], "r": [[3.98501e-05, 3.9869e-05, 3.98685e-05], 0, 3.68593, 1668061542], "v": "v0.6"}
{"i": [["[\"window_partition\", 1, 7, 7, 1024, 7, \"float16\"]", "cuda -keys=cuda,gpu -max_num_threads=1024 -model=unknown -thread_warp_size=32", [-1, 16, 64, 49152, 2147483647, 1024, 8, 32], "", 0, []], [[], [["FU", 1, [0, 1, 2, 3]], ["SP", 1, 0, 50176, [32], 1], ["AN", 1, 0, 5], ["AN", 1, 1, 6]]]], "r": [[3.65512e-06, 3.66635e-06, 3.66543e-06], 0, 4.39326, 1668061543], "v": "v0.6"}
