python/models/swin_transformer/kernel_configs/swin_transformer_roll_1_56_56_512_-3_float16.log
{"i": [["[\"roll\", 1, 56, 56, 512, -3, \"float16\"]", "cuda -keys=cuda,gpu -max_num_threads=1024 -model=unknown -thread_warp_size=32", [-1, 16, 64, 49152, 2147483647, 1024, 8, 32], "", 0, []], [[], [["FU", 1, [0, 1, 2, 3]], ["SP", 1, 0, 1605632, [1], 1], ["AN", 1, 0, 5], ["AN", 1, 1, 6]]]], "r": [[0.00119355, 0.00119359, 0.00119366], 0, 3.37029, 1668019458], "v": "v0.6"}
{"i": [["[\"roll\", 1, 56, 56, 512, -3, \"float16\"]", "cuda -keys=cuda,gpu -max_num_threads=1024 -model=unknown -thread_warp_size=32", [-1, 16, 64, 49152, 2147483647, 1024, 8, 32], "", 0, []], [[], [["FU", 1, [0, 1, 2, 3]], ["SP", 1, 0, 1605632, [16], 1], ["AN", 1, 0, 5], ["AN", 1, 1, 6]]]], "r": [[7.71744e-05, 7.71768e-05, 7.71713e-05], 0, 1.10579, 1668019456], "v": "v0.6"}
{"i": [["[\"roll\", 1, 56, 56, 512, -3, \"float16\"]", "cuda -keys=cuda,gpu -max_num_threads=1024 -model=unknown -thread_warp_size=32", [-1, 16, 64, 49152, 2147483647, 1024, 8, 32], "", 0, []], [[], [["FU", 1, [0, 1, 2, 3]], ["SP", 1, 0, 1605632, [32], 1], ["AN", 1, 0, 5], ["AN", 1, 1, 6]]]], "r": [[3.99714e-05, 3.9983e-05, 3.99787e-05], 0, 1.54615, 1668019456], "v": "v0.6"}
{"i": [["[\"roll\", 1, 56, 56, 512, -3, \"float16\"]", "cuda -keys=cuda,gpu -max_num_threads=1024 -model=unknown -thread_warp_size=32", [-1, 16, 64, 49152, 2147483647, 1024, 8, 32], "", 0, []], [[], [["FU", 1, [0, 1, 2, 3]], ["SP", 1, 0, 1605632, [56], 1], ["AN", 1, 0, 5], ["AN", 1, 1, 6]]]], "r": [[2.36274e-05, 2.36363e-05, 2.36347e-05], 0, 2.03685, 1668019457], "v": "v0.6"}
{"i": [["[\"roll\", 1, 56, 56, 512, -3, \"float16\"]", "cuda -keys=cuda,gpu -max_num_threads=1024 -model=unknown -thread_warp_size=32", [-1, 16, 64, 49152, 2147483647, 1024, 8, 32], "", 0, []], [[], [["FU", 1, [0, 1, 2, 3]], ["SP", 1, 0, 1605632, [49], 1], ["AN", 1, 0, 5], ["AN", 1, 1, 6]]]], "r": [[2.67216e-05, 2.674e-05, 2.67452e-05], 0, 0.682317, 1668019455], "v": "v0.6"}
{"i": [["[\"roll\", 1, 56, 56, 512, -3, \"float16\"]", "cuda -keys=cuda,gpu -max_num_threads=1024 -model=unknown -thread_warp_size=32", [-1, 16, 64, 49152, 2147483647, 1024, 8, 32], "", 0, []], [[], [["FU", 1, [0, 1, 2, 3]], ["SP", 1, 0, 1605632, [14], 1], ["AN", 1, 0, 5], ["AN", 1, 1, 6]]]], "r": [[8.77694e-05, 8.77718e-05, 8.77553e-05], 0, 2.46201, 1668019457], "v": "v0.6"}
{"i": [["[\"roll\", 1, 56, 56, 512, -3, \"float16\"]", "cuda -keys=cuda,gpu -max_num_threads=1024 -model=unknown -thread_warp_size=32", [-1, 16, 64, 49152, 2147483647, 1024, 8, 32], "", 0, []], [[], [["FU", 1, [0, 1, 2, 3]], ["SP", 1, 0, 1605632, [2], 1], ["AN", 1, 0, 5], ["AN", 1, 1, 6]]]], "r": [[0.000598299, 0.000598293, 0.000598357], 0, 3.81006, 1668019459], "v": "v0.6"}
{"i": [["[\"roll\", 1, 56, 56, 512, -3, \"float16\"]", "cuda -keys=cuda,gpu -max_num_threads=1024 -model=unknown -thread_warp_size=32", [-1, 16, 64, 49152, 2147483647, 1024, 8, 32], "", 0, []], [[], [["FU", 1, [0, 1, 2, 3]], ["SP", 1, 0, 1605632, [64], 1], ["AN", 1, 0, 5], ["AN", 1, 1, 6]]]], "r": [[2.09423e-05, 2.09621e-05, 2.09535e-05], 0, 4.24529, 1668019459], "v": "v0.6"}
{"i": [["[\"roll\", 1, 56, 56, 512, -3, \"float16\"]", "cuda -keys=cuda,gpu -max_num_threads=1024 -model=unknown -thread_warp_size=32", [-1, 16, 64, 49152, 2147483647, 1024, 8, 32], "", 0, []], [[], [["FU", 1, [0, 1, 2, 3]], ["SP", 1, 0, 1605632, [7], 1], ["AN", 1, 0, 5], ["AN", 1, 1, 6]]]], "r": [[0.000173043, 0.000173067, 0.000173062], 0, 2.88431, 1668019458], "v": "v0.6"}
{"i": [["[\"roll\", 1, 56, 56, 512, -3, \"float16\"]", "cuda -keys=cuda,gpu -max_num_threads=1024 -model=unknown -thread_warp_size=32", [-1, 16, 64, 49152, 2147483647, 1024, 8, 32], "", 0, []], [[], [["FU", 1, [0, 1, 2, 3]], ["SP", 1, 0, 1605632, [28], 1], ["AN", 1, 0, 5], ["AN", 1, 1, 6]]]], "r": [[4.52539e-05, 4.52467e-05, 4.52521e-05], 0, 5.13175, 1668019460], "v": "v0.6"}
{"i": [["[\"roll\", 1, 56, 56, 512, -3, \"float16\"]", "cuda -keys=cuda,gpu -max_num_threads=1024 -model=unknown -thread_warp_size=32", [-1, 16, 64, 49152, 2147483647, 1024, 8, 32], "", 0, []], [[], [["FU", 1, [0, 1, 2, 3]], ["SP", 1, 0, 1605632, [8], 1], ["AN", 1, 0, 5], ["AN", 1, 1, 6]]]], "r": [[0.000151614, 0.000151631, 0.000151655], 0, 5.55791, 1668019460], "v": "v0.6"}
{"i": [["[\"roll\", 1, 56, 56, 512, -3, \"float16\"]", "cuda -keys=cuda,gpu -max_num_threads=1024 -model=unknown -thread_warp_size=32", [-1, 16, 64, 49152, 2147483647, 1024, 8, 32], "", 0, []], [[], [["FU", 1, [0, 1, 2, 3]], ["SP", 1, 0, 1605632, [4], 1], ["AN", 1, 0, 5], ["AN", 1, 1, 6]]]], "r": [[0.000300588, 0.000300605, 0.000300627], 0, 4.71647, 1668019460], "v": "v0.6"}
{"i": [["[\"roll\", 1, 56, 56, 512, -3, \"float16\"]", "cuda -keys=cuda,gpu -max_num_threads=1024 -model=unknown -thread_warp_size=32", [-1, 16, 64, 49152, 2147483647, 1024, 8, 32], "", 0, []], [[], [["FU", 1, [0, 1, 2, 3]], ["SP", 1, 0, 1605632, [49], 1], ["AN", 1, 0, 5], ["AN", 1, 1, 6]]]], "r": [[2.66931e-05, 2.6678e-05, 2.66875e-05], 0, 2.74336, 1668019831], "v": "v0.6"}
{"i": [["[\"roll\", 1, 56, 56, 512, -3, \"float16\"]", "cuda -keys=cuda,gpu -max_num_threads=1024 -model=unknown -thread_warp_size=32", [-1, 16, 64, 49152, 2147483647, 1024, 8, 32], "", 0, []], [[], [["FU", 1, [0, 1, 2, 3]], ["SP", 1, 0, 1605632, [2], 1], ["AN", 1, 0, 5], ["AN", 1, 1, 6]]]], "r": [[0.000598222, 0.000598123, 0.000598183], 0, 1.91435, 1668019830], "v": "v0.6"}
{"i": [["[\"roll\", 1, 56, 56, 512, -3, \"float16\"]", "cuda -keys=cuda,gpu -max_num_threads=1024 -model=unknown -thread_warp_size=32", [-1, 16, 64, 49152, 2147483647, 1024, 8, 32], "", 0, []], [[], [["FU", 1, [0, 1, 2, 3]], ["SP", 1, 0, 1605632, [14], 1], ["AN", 1, 0, 5], ["AN", 1, 1, 6]]]], "r": [[8.77524e-05, 8.77562e-05, 8.77765e-05], 0, 0.689486, 1668019829], "v": "v0.6"}
{"i": [["[\"roll\", 1, 56, 56, 512, -3, \"float16\"]", "cuda -keys=cuda,gpu -max_num_threads=1024 -model=unknown -thread_warp_size=32", [-1, 16, 64, 49152, 2147483647, 1024, 8, 32], "", 0, []], [[], [["FU", 1, [0, 1, 2, 3]], ["SP", 1, 0, 1605632, [56], 1], ["AN", 1, 0, 5], ["AN", 1, 1, 6]]]], "r": [[2.36581e-05, 2.36759e-05, 2.36664e-05], 0, 1.08883, 1668019829], "v": "v0.6"}
{"i": [["[\"roll\", 1, 56, 56, 512, -3, \"float16\"]", "cuda -keys=cuda,gpu -max_num_threads=1024 -model=unknown -thread_warp_size=32", [-1, 16, 64, 49152, 2147483647, 1024, 8, 32], "", 0, []], [[], [["FU", 1, [0, 1, 2, 3]], ["SP", 1, 0, 1605632, [4], 1], ["AN", 1, 0, 5], ["AN", 1, 1, 6]]]], "r": [[0.000300558, 0.000300533, 0.0003005], 0, 3.18135, 1668019831], "v": "v0.6"}
{"i": [["[\"roll\", 1, 56, 56, 512, -3, \"float16\"]", "cuda -keys=cuda,gpu -max_num_threads=1024 -model=unknown -thread_warp_size=32", [-1, 16, 64, 49152, 2147483647, 1024, 8, 32], "", 0, []], [[], [["FU", 1, [0, 1, 2, 3]], ["SP", 1, 0, 1605632, [28], 1], ["AN", 1, 0, 5], ["AN", 1, 1, 6]]]], "r": [[4.52541e-05, 4.52786e-05, 4.52604e-05], 0, 2.3233, 1668019830], "v": "v0.6"}
{"i": [["[\"roll\", 1, 56, 56, 512, -3, \"float16\"]", "cuda -keys=cuda,gpu -max_num_threads=1024 -model=unknown -thread_warp_size=32", [-1, 16, 64, 49152, 2147483647, 1024, 8, 32], "", 0, []], [[], [["FU", 1, [0, 1, 2, 3]], ["SP", 1, 0, 1605632, [1], 1], ["AN", 1, 0, 5], ["AN", 1, 1, 6]]]], "r": [[0.00119359, 0.00119351, 0.00119356], 0, 1.47661, 1668019830], "v": "v0.6"}
{"i": [["[\"roll\", 1, 56, 56, 512, -3, \"float16\"]", "cuda -keys=cuda,gpu -max_num_threads=1024 -model=unknown -thread_warp_size=32", [-1, 16, 64, 49152, 2147483647, 1024, 8, 32], "", 0, []], [[], [["FU", 1, [0, 1, 2, 3]], ["SP", 1, 0, 1605632, [64], 1], ["AN", 1, 0, 5], ["AN", 1, 1, 6]]]], "r": [[2.1003e-05, 2.1004e-05, 2.10013e-05], 0, 4.00161, 1668019832], "v": "v0.6"}
{"i": [["[\"roll\", 1, 56, 56, 512, -3, \"float16\"]", "cuda -keys=cuda,gpu -max_num_threads=1024 -model=unknown -thread_warp_size=32", [-1, 16, 64, 49152, 2147483647, 1024, 8, 32], "", 0, []], [[], [["FU", 1, [0, 1, 2, 3]], ["SP", 1, 0, 1605632, [32], 1], ["AN", 1, 0, 5], ["AN", 1, 1, 6]]]], "r": [[3.98923e-05, 3.98986e-05, 3.9896e-05], 0, 4.84703, 1668019833], "v": "v0.6"}
{"i": [["[\"roll\", 1, 56, 56, 512, -3, \"float16\"]", "cuda -keys=cuda,gpu -max_num_threads=1024 -model=unknown -thread_warp_size=32", [-1, 16, 64, 49152, 2147483647, 1024, 8, 32], "", 0, []], [[], [["FU", 1, [0, 1, 2, 3]], ["SP", 1, 0, 1605632, [8], 1], ["AN", 1, 0, 5], ["AN", 1, 1, 6]]]], "r": [[0.00015165, 0.000151649, 0.000151649], 0, 4.43758, 1668019833], "v": "v0.6"}
{"i": [["[\"roll\", 1, 56, 56, 512, -3, \"float16\"]", "cuda -keys=cuda,gpu -max_num_threads=1024 -model=unknown -thread_warp_size=32", [-1, 16, 64, 49152, 2147483647, 1024, 8, 32], "", 0, []], [[], [["FU", 1, [0, 1, 2, 3]], ["SP", 1, 0, 1605632, [16], 1], ["AN", 1, 0, 5], ["AN", 1, 1, 6]]]], "r": [[7.72708e-05, 7.72924e-05, 7.73107e-05], 0, 3.58887, 1668019832], "v": "v0.6"}
{"i": [["[\"roll\", 1, 56, 56, 512, -3, \"float16\"]", "cuda -keys=cuda,gpu -max_num_threads=1024 -model=unknown -thread_warp_size=32", [-1, 16, 64, 49152, 2147483647, 1024, 8, 32], "", 0, []], [[], [["FU", 1, [0, 1, 2, 3]], ["SP", 1, 0, 1605632, [7], 1], ["AN", 1, 0, 5], ["AN", 1, 1, 6]]]], "r": [[0.000172896, 0.000172896, 0.000172931], 0, 5.25246, 1668019833], "v": "v0.6"}
