python/models/swin_transformer/kernel_configs/swin_transformer_roll_1_56_56_256_-3_float16.log
{"i": [["[\"roll\", 1, 56, 56, 256, -3, \"float16\"]", "cuda -keys=cuda,gpu -max_num_threads=1024 -model=unknown -thread_warp_size=32", [-1, 16, 64, 49152, 2147483647, 1024, 8, 32], "", 0, []], [[], [["FU", 1, [0, 1, 2, 3]], ["SP", 1, 0, 802816, [1], 1], ["AN", 1, 0, 5], ["AN", 1, 1, 6]]]], "r": [[0.000598147, 0.00059809, 0.000598247], 0, 3.41301, 1668018684], "v": "v0.6"}
{"i": [["[\"roll\", 1, 56, 56, 256, -3, \"float16\"]", "cuda -keys=cuda,gpu -max_num_threads=1024 -model=unknown -thread_warp_size=32", [-1, 16, 64, 49152, 2147483647, 1024, 8, 32], "", 0, []], [[], [["FU", 1, [0, 1, 2, 3]], ["SP", 1, 0, 802816, [2], 1], ["AN", 1, 0, 5], ["AN", 1, 1, 6]]]], "r": [[0.000300496, 0.000300497, 0.000300539], 0, 2.59545, 1668018683], "v": "v0.6"}
{"i": [["[\"roll\", 1, 56, 56, 256, -3, \"float16\"]", "cuda -keys=cuda,gpu -max_num_threads=1024 -model=unknown -thread_warp_size=32", [-1, 16, 64, 49152, 2147483647, 1024, 8, 32], "", 0, []], [[], [["FU", 1, [0, 1, 2, 3]], ["SP", 1, 0, 802816, [28], 1], ["AN", 1, 0, 5], ["AN", 1, 1, 6]]]], "r": [[2.41687e-05, 2.4171e-05, 2.41806e-05], 0, 1.40171, 1668018682], "v": "v0.6"}
{"i": [["[\"roll\", 1, 56, 56, 256, -3, \"float16\"]", "cuda -keys=cuda,gpu -max_num_threads=1024 -model=unknown -thread_warp_size=32", [-1, 16, 64, 49152, 2147483647, 1024, 8, 32], "", 0, []], [[], [["FU", 1, [0, 1, 2, 3]], ["SP", 1, 0, 802816, [4], 1], ["AN", 1, 0, 5], ["AN", 1, 1, 6]]]], "r": [[0.000151796, 0.000151787, 0.00015177], 0, 1.00796, 1668018682], "v": "v0.6"}
{"i": [["[\"roll\", 1, 56, 56, 256, -3, \"float16\"]", "cuda -keys=cuda,gpu -max_num_threads=1024 -model=unknown -thread_warp_size=32", [-1, 16, 64, 49152, 2147483647, 1024, 8, 32], "", 0, []], [[], [["FU", 1, [0, 1, 2, 3]], ["SP", 1, 0, 802816, [56], 1], ["AN", 1, 0, 5], ["AN", 1, 1, 6]]]], "r": [[1.32197e-05, 1.32393e-05, 1.32469e-05], 0, 0.630141, 1668018681], "v": "v0.6"}
{"i": [["[\"roll\", 1, 56, 56, 256, -3, \"float16\"]", "cuda -keys=cuda,gpu -max_num_threads=1024 -model=unknown -thread_warp_size=32", [-1, 16, 64, 49152, 2147483647, 1024, 8, 32], "", 0, []], [[], [["FU", 1, [0, 1, 2, 3]], ["SP", 1, 0, 802816, [64], 1], ["AN", 1, 0, 5], ["AN", 1, 1, 6]]]], "r": [[1.18809e-05, 1.18946e-05, 1.18899e-05], 0, 2.21425, 1668018683], "v": "v0.6"}
{"i": [["[\"roll\", 1, 56, 56, 256, -3, \"float16\"]", "cuda -keys=cuda,gpu -max_num_threads=1024 -model=unknown -thread_warp_size=32", [-1, 16, 64, 49152, 2147483647, 1024, 8, 32], "", 0, []], [[], [["FU", 1, [0, 1, 2, 3]], ["SP", 1, 0, 802816, [16], 1], ["AN", 1, 0, 5], ["AN", 1, 1, 6]]]], "r": [[3.99569e-05, 3.99662e-05, 3.99702e-05], 0, 1.82794, 1668018683], "v": "v0.6"}
{"i": [["[\"roll\", 1, 56, 56, 256, -3, \"float16\"]", "cuda -keys=cuda,gpu -max_num_threads=1024 -model=unknown -thread_warp_size=32", [-1, 16, 64, 49152, 2147483647, 1024, 8, 32], "", 0, []], [[], [["FU", 1, [0, 1, 2, 3]], ["SP", 1, 0, 802816, [7], 1], ["AN", 1, 0, 5], ["AN", 1, 1, 6]]]], "r": [[8.78452e-05, 8.78804e-05, 8.78514e-05], 0, 3.03194, 1668018684], "v": "v0.6"}
{"i": [["[\"roll\", 1, 56, 56, 256, -3, \"float16\"]", "cuda -keys=cuda,gpu -max_num_threads=1024 -model=unknown -thread_warp_size=32", [-1, 16, 64, 49152, 2147483647, 1024, 8, 32], "", 0, []], [[], [["FU", 1, [0, 1, 2, 3]], ["SP", 1, 0, 802816, [8], 1], ["AN", 1, 0, 5], ["AN", 1, 1, 6]]]], "r": [[7.7208e-05, 7.72448e-05, 7.72397e-05], 0, 3.78881, 1668018685], "v": "v0.6"}
{"i": [["[\"roll\", 1, 56, 56, 256, -3, \"float16\"]", "cuda -keys=cuda,gpu -max_num_threads=1024 -model=unknown -thread_warp_size=32", [-1, 16, 64, 49152, 2147483647, 1024, 8, 32], "", 0, []], [[], [["FU", 1, [0, 1, 2, 3]], ["SP", 1, 0, 802816, [49], 1], ["AN", 1, 0, 5], ["AN", 1, 1, 6]]]], "r": [[1.4679e-05, 1.4687e-05, 1.4673e-05], 0, 4.22058, 1668018685], "v": "v0.6"}
{"i": [["[\"roll\", 1, 56, 56, 256, -3, \"float16\"]", "cuda -keys=cuda,gpu -max_num_threads=1024 -model=unknown -thread_warp_size=32", [-1, 16, 64, 49152, 2147483647, 1024, 8, 32], "", 0, []], [[], [["FU", 1, [0, 1, 2, 3]], ["SP", 1, 0, 802816, [14], 1], ["AN", 1, 0, 5], ["AN", 1, 1, 6]]]], "r": [[4.5279e-05, 4.52806e-05, 4.52791e-05], 0, 4.60996, 1668018686], "v": "v0.6"}
{"i": [["[\"roll\", 1, 56, 56, 256, -3, \"float16\"]", "cuda -keys=cuda,gpu -max_num_threads=1024 -model=unknown -thread_warp_size=32", [-1, 16, 64, 49152, 2147483647, 1024, 8, 32], "", 0, []], [[], [["FU", 1, [0, 1, 2, 3]], ["SP", 1, 0, 802816, [32], 1], ["AN", 1, 0, 5], ["AN", 1, 1, 6]]]], "r": [[2.15511e-05, 2.15628e-05, 2.15607e-05], 0, 4.98486, 1668018686], "v": "v0.6"}
{"i": [["[\"roll\", 1, 56, 56, 256, -3, \"float16\"]", "cuda -keys=cuda,gpu -max_num_threads=1024 -model=unknown -thread_warp_size=32", [-1, 16, 64, 49152, 2147483647, 1024, 8, 32], "", 0, []], [[], [["FU", 1, [0, 1, 2, 3]], ["SP", 1, 0, 802816, [2], 1], ["AN", 1, 0, 5], ["AN", 1, 1, 6]]]], "r": [[0.000300629, 0.000300614, 0.000300581], 0, 2.83714, 1668018980], "v": "v0.6"}
{"i": [["[\"roll\", 1, 56, 56, 256, -3, \"float16\"]", "cuda -keys=cuda,gpu -max_num_threads=1024 -model=unknown -thread_warp_size=32", [-1, 16, 64, 49152, 2147483647, 1024, 8, 32], "", 0, []], [[], [["FU", 1, [0, 1, 2, 3]], ["SP", 1, 0, 802816, [1], 1], ["AN", 1, 0, 5], ["AN", 1, 1, 6]]]], "r": [[0.000598395, 0.000598378, 0.000598422], 0, 1.33218, 1668018978], "v": "v0.6"}
{"i": [["[\"roll\", 1, 56, 56, 256, -3, \"float16\"]", "cuda -keys=cuda,gpu -max_num_threads=1024 -model=unknown -thread_warp_size=32", [-1, 16, 64, 49152, 2147483647, 1024, 8, 32], "", 0, []], [[], [["FU", 1, [0, 1, 2, 3]], ["SP", 1, 0, 802816, [28], 1], ["AN", 1, 0, 5], ["AN", 1, 1, 6]]]], "r": [[2.42477e-05, 2.42636e-05, 2.42717e-05], 0, 1.72957, 1668018979], "v": "v0.6"}
{"i": [["[\"roll\", 1, 56, 56, 256, -3, \"float16\"]", "cuda -keys=cuda,gpu -max_num_threads=1024 -model=unknown -thread_warp_size=32", [-1, 16, 64, 49152, 2147483647, 1024, 8, 32], "", 0, []], [[], [["FU", 1, [0, 1, 2, 3]], ["SP", 1, 0, 802816, [7], 1], ["AN", 1, 0, 5], ["AN", 1, 1, 6]]]], "r": [[8.78258e-05, 8.78632e-05, 8.78705e-05], 0, 0.606176, 1668018977], "v": "v0.6"}
{"i": [["[\"roll\", 1, 56, 56, 256, -3, \"float16\"]", "cuda -keys=cuda,gpu -max_num_threads=1024 -model=unknown -thread_warp_size=32", [-1, 16, 64, 49152, 2147483647, 1024, 8, 32], "", 0, []], [[], [["FU", 1, [0, 1, 2, 3]], ["SP", 1, 0, 802816, [32], 1], ["AN", 1, 0, 5], ["AN", 1, 1, 6]]]], "r": [[2.14625e-05, 2.14761e-05, 2.14739e-05], 0, 0.975759, 1668018978], "v": "v0.6"}
{"i": [["[\"roll\", 1, 56, 56, 256, -3, \"float16\"]", "cuda -keys=cuda,gpu -max_num_threads=1024 -model=unknown -thread_warp_size=32", [-1, 16, 64, 49152, 2147483647, 1024, 8, 32], "", 0, []], [[], [["FU", 1, [0, 1, 2, 3]], ["SP", 1, 0, 802816, [56], 1], ["AN", 1, 0, 5], ["AN", 1, 1, 6]]]], "r": [[1.32733e-05, 1.32717e-05, 1.32723e-05], 0, 2.44044, 1668018979], "v": "v0.6"}
{"i": [["[\"roll\", 1, 56, 56, 256, -3, \"float16\"]", "cuda -keys=cuda,gpu -max_num_threads=1024 -model=unknown -thread_warp_size=32", [-1, 16, 64, 49152, 2147483647, 1024, 8, 32], "", 0, []], [[], [["FU", 1, [0, 1, 2, 3]], ["SP", 1, 0, 802816, [14], 1], ["AN", 1, 0, 5], ["AN", 1, 1, 6]]]], "r": [[4.53886e-05, 4.54062e-05, 4.54154e-05], 0, 3.20215, 1668018980], "v": "v0.6"}
{"i": [["[\"roll\", 1, 56, 56, 256, -3, \"float16\"]", "cuda -keys=cuda,gpu -max_num_threads=1024 -model=unknown -thread_warp_size=32", [-1, 16, 64, 49152, 2147483647, 1024, 8, 32], "", 0, []], [[], [["FU", 1, [0, 1, 2, 3]], ["SP", 1, 0, 802816, [49], 1], ["AN", 1, 0, 5], ["AN", 1, 1, 6]]]], "r": [[1.46871e-05, 1.46982e-05, 1.47063e-05], 0, 2.09096, 1668018979], "v": "v0.6"}
{"i": [["[\"roll\", 1, 56, 56, 256, -3, \"float16\"]", "cuda -keys=cuda,gpu -max_num_threads=1024 -model=unknown -thread_warp_size=32", [-1, 16, 64, 49152, 2147483647, 1024, 8, 32], "", 0, []], [[], [["FU", 1, [0, 1, 2, 3]], ["SP", 1, 0, 802816, [16], 1], ["AN", 1, 0, 5], ["AN", 1, 1, 6]]]], "r": [[3.99871e-05, 4.00133e-05, 4.0008e-05], 0, 3.54685, 1668018980], "v": "v0.6"}
{"i": [["[\"roll\", 1, 56, 56, 256, -3, \"float16\"]", "cuda -keys=cuda,gpu -max_num_threads=1024 -model=unknown -thread_warp_size=32", [-1, 16, 64, 49152, 2147483647, 1024, 8, 32], "", 0, []], [[], [["FU", 1, [0, 1, 2, 3]], ["SP", 1, 0, 802816, [64], 1], ["AN", 1, 0, 5], ["AN", 1, 1, 6]]]], "r": [[1.18942e-05, 1.19062e-05, 1.19005e-05], 0, 4.6305, 1668018982], "v": "v0.6"}
{"i": [["[\"roll\", 1, 56, 56, 256, -3, \"float16\"]", "cuda -keys=cuda,gpu -max_num_threads=1024 -model=unknown -thread_warp_size=32", [-1, 16, 64, 49152, 2147483647, 1024, 8, 32], "", 0, []], [[], [["FU", 1, [0, 1, 2, 3]], ["SP", 1, 0, 802816, [8], 1], ["AN", 1, 0, 5], ["AN", 1, 1, 6]]]], "r": [[7.72229e-05, 7.72634e-05, 7.72513e-05], 0, 4.26731, 1668018981], "v": "v0.6"}
{"i": [["[\"roll\", 1, 56, 56, 256, -3, \"float16\"]", "cuda -keys=cuda,gpu -max_num_threads=1024 -model=unknown -thread_warp_size=32", [-1, 16, 64, 49152, 2147483647, 1024, 8, 32], "", 0, []], [[], [["FU", 1, [0, 1, 2, 3]], ["SP", 1, 0, 802816, [4], 1], ["AN", 1, 0, 5], ["AN", 1, 1, 6]]]], "r": [[0.00015181, 0.000151816, 0.000151843], 0, 3.91702, 1668018981], "v": "v0.6"}
