python/models/swin_transformer/kernel_configs/swin_transform_auto_tvm_tune_fused_layer_normalization_matmul_1_8_8_1024.log
{"input": ["cuda -keys=cuda,gpu -max_num_threads=1024 -thread_warp_size=32", "fused_layer_norm_matmul_tensorcore.cuda", [["TENSOR", [16, 4096], "float16"], ["TENSOR", [16], "float16"], ["TENSOR", [16], "float16"], ["TENSOR", [2048, 4096], "float16"], 0.000244140625], {}], "config": {"index": 5779, "code_hash": null, "entity": [["block_row_warps", "ot", 2], ["block_col_warps", "ot", 1], ["warp_row_tiles", "ot", 1], ["warp_col_tiles", "ot", 2], ["chunk", "ot", 8], ["offset", "ot", 8], ["offsetCS", "ot", 0], ["vec", "ot", 1], ["wmma_m", "ot", 8]]}, "result": [[0.000384579756], 0, 3.2627038955688477, 1652007183.3169577], "version": 0.2, "tvm_version": "0.8.0"}
{"input": ["cuda -keys=cuda,gpu -max_num_threads=1024 -thread_warp_size=32", "fused_layer_norm_matmul_tensorcore.cuda", [["TENSOR", [16, 4096], "float16"], ["TENSOR", [16], "float16"], ["TENSOR", [16], "float16"], ["TENSOR", [2048, 4096], "float16"], 0.000244140625], {}], "config": {"index": 8661, "code_hash": null, "entity": [["block_row_warps", "ot", 1], ["block_col_warps", "ot", 2], ["warp_row_tiles", "ot", 4], ["warp_col_tiles", "ot", 4], ["chunk", "ot", 4], ["offset", "ot", 0], ["offsetCS", "ot", 8], ["vec", "ot", 4], ["wmma_m", "ot", 8]]}, "result": [[0.000259727342], 0, 2.766658306121826, 1652007186.4483173], "version": 0.2, "tvm_version": "0.8.0"}
{"input": ["cuda -keys=cuda,gpu -max_num_threads=1024 -thread_warp_size=32", "fused_layer_norm_matmul_tensorcore.cuda", [["TENSOR", [16, 4096], "float16"], ["TENSOR", [16], "float16"], ["TENSOR", [16], "float16"], ["TENSOR", [2048, 4096], "float16"], 0.000244140625], {}], "config": {"index": 3657, "code_hash": null, "entity": [["block_row_warps", "ot", 1], ["block_col_warps", "ot", 2], ["warp_row_tiles", "ot", 2], ["warp_col_tiles", "ot", 1], ["chunk", "ot", 2], ["offset", "ot", 8], ["offsetCS", "ot", 8], ["vec", "ot", 4], ["wmma_m", "ot", 16]]}, "result": [[0.000162049646], 0, 2.2520902156829834, 1652007189.007893], "version": 0.2, "tvm_version": "0.8.0"}
{"input": ["cuda -keys=cuda,gpu -max_num_threads=1024 -thread_warp_size=32", "fused_layer_norm_matmul_tensorcore.cuda", [["TENSOR", [16, 4096], "float16"], ["TENSOR", [16], "float16"], ["TENSOR", [16], "float16"], ["TENSOR", [2048, 4096], "float16"], 0.000244140625], {}], "config": {"index": 1959, "code_hash": null, "entity": [["block_row_warps", "ot", 1], ["block_col_warps", "ot", 4], ["warp_row_tiles", "ot", 2], ["warp_col_tiles", "ot", 1], ["chunk", "ot", 1], ["offset", "ot", 0], ["offsetCS", "ot", 8], ["vec", "ot", 2], ["wmma_m", "ot", 16]]}, "result": [[0.00013987675999999999], 0, 2.189642906188965, 1652007191.6519475], "version": 0.2, "tvm_version": "0.8.0"}
{"input": ["cuda -keys=cuda,gpu -max_num_threads=1024 -thread_warp_size=32", "fused_layer_norm_matmul_tensorcore.cuda", [["TENSOR", [16, 4096], "float16"], ["TENSOR", [16], "float16"], ["TENSOR", [16], "float16"], ["TENSOR", [2048, 4096], "float16"], 0.000244140625], {}], "config": {"index": 783, "code_hash": null, "entity": [["block_row_warps", "ot", 1], ["block_col_warps", "ot", 1], ["warp_row_tiles", "ot", 1], ["warp_col_tiles", "ot", 4], ["chunk", "ot", 2], ["offset", "ot", 0], ["offsetCS", "ot", 8], ["vec", "ot", 1], ["wmma_m", "ot", 16]]}, "result": [[0.000569732962], 0, 3.7742676734924316, 1652007197.8101373], "version": 0.2, "tvm_version": "0.8.0"}
{"input": ["cuda -keys=cuda,gpu -max_num_threads=1024 -thread_warp_size=32", "fused_layer_norm_matmul_tensorcore.cuda", [["TENSOR", [16, 4096], "float16"], ["TENSOR", [16], "float16"], ["TENSOR", [16], "float16"], ["TENSOR", [2048, 4096], "float16"], 0.000244140625], {}], "config": {"index": 7378, "code_hash": null, "entity": [["block_row_warps", "ot", 2], ["block_col_warps", "ot", 4], ["warp_row_tiles", "ot", 1], ["warp_col_tiles", "ot", 1], ["chunk", "ot", 8], ["offset", "ot", 0], ["offsetCS", "ot", 8], ["vec", "ot", 2], ["wmma_m", "ot", 8]]}, "result": [[0.00017619890699999998], 0, 2.3520760536193848, 1652007200.606347], "version": 0.2, "tvm_version": "0.8.0"}
{"input": ["cuda -keys=cuda,gpu -max_num_threads=1024 -thread_warp_size=32", "fused_layer_norm_matmul_tensorcore.cuda", [["TENSOR", [16, 4096], "float16"], ["TENSOR", [16], "float16"], ["TENSOR", [16], "float16"], ["TENSOR", [2048, 4096], "float16"], 0.000244140625], {}], "config": {"index": 9160, "code_hash": null, "entity": [["block_row_warps", "ot", 2], ["block_col_warps", "ot", 4], ["warp_row_tiles", "ot", 1], ["warp_col_tiles", "ot", 1], ["chunk", "ot", 2], ["offset", "ot", 0], ["offsetCS", "ot", 0], ["vec", "ot", 8], ["wmma_m", "ot", 8]]}, "result": [[0.000249906133], 0, 2.4639365673065186, 1652007206.6952674], "version": 0.2, "tvm_version": "0.8.0"}
{"input": ["cuda -keys=cuda,gpu -max_num_threads=1024 -thread_warp_size=32", "fused_layer_norm_matmul_tensorcore.cuda", [["TENSOR", [16, 4096], "float16"], ["TENSOR", [16], "float16"], ["TENSOR", [16], "float16"], ["TENSOR", [2048, 4096], "float16"], 0.000244140625], {}], "config": {"index": 1095, "code_hash": null, "entity": [["block_row_warps", "ot", 1], ["block_col_warps", "ot", 4], ["warp_row_tiles", "ot", 2], ["warp_col_tiles", "ot", 2], ["chunk", "ot", 2], ["offset", "ot", 8], ["offsetCS", "ot", 8], ["vec", "ot", 1], ["wmma_m", "ot", 16]]}, "result": [[0.000228489833], 0, 2.204702854156494, 1652007209.5004425], "version": 0.2, "tvm_version": "0.8.0"}
{"input": ["cuda -keys=cuda,gpu -max_num_threads=1024 -thread_warp_size=32", "fused_layer_norm_matmul_tensorcore.cuda", [["TENSOR", [16, 4096], "float16"], ["TENSOR", [16], "float16"], ["TENSOR", [16], "float16"], ["TENSOR", [2048, 4096], "float16"], 0.000244140625], {}], "config": {"index": 3669, "code_hash": null, "entity": [["block_row_warps", "ot", 1], ["block_col_warps", "ot", 4], ["warp_row_tiles", "ot", 4], ["warp_col_tiles", "ot", 1], ["chunk", "ot", 2], ["offset", "ot", 8], ["offsetCS", "ot", 8], ["vec", "ot", 4], ["wmma_m", "ot", 16]]}, "result": [[0.00010294346499999999], 0, 2.0715227127075195, 1652007211.9352686], "version": 0.2, "tvm_version": "0.8.0"}
{"input": ["cuda -keys=cuda,gpu -max_num_threads=1024 -thread_warp_size=32", "fused_layer_norm_matmul_tensorcore.cuda", [["TENSOR", [16, 4096], "float16"], ["TENSOR", [16], "float16"], ["TENSOR", [16], "float16"], ["TENSOR", [2048, 4096], "float16"], 0.000244140625], {}], "config": {"index": 1083, "code_hash": null, "entity": [["block_row_warps", "ot", 1], ["block_col_warps", "ot", 2], ["warp_row_tiles", "ot", 1], ["warp_col_tiles", "ot", 2], ["chunk", "ot", 2], ["offset", "ot", 8], ["offsetCS", "ot", 8], ["vec", "ot", 1], ["wmma_m", "ot", 16]]}, "result": [[0.000335095203], 0, 2.6700243949890137, 1652007213.9462812], "version": 0.2, "tvm_version": "0.8.0"}
{"input": ["cuda -keys=cuda,gpu -max_num_threads=1024 -thread_warp_size=32", "fused_layer_norm_matmul_tensorcore.cuda", [["TENSOR", [16, 4096], "float16"], ["TENSOR", [16], "float16"], ["TENSOR", [16], "float16"], ["TENSOR", [2048, 4096], "float16"], 0.000244140625], {}], "config": {"index": 837, "code_hash": null, "entity": [["block_row_warps", "ot", 1], ["block_col_warps", "ot", 1], ["warp_row_tiles", "ot", 1], ["warp_col_tiles", "ot", 2], ["chunk", "ot", 4], ["offset", "ot", 0], ["offsetCS", "ot", 8], ["vec", "ot", 1], ["wmma_m", "ot", 16]]}, "result": [[0.000587108925], 0, 3.3558011054992676, 1652007229.9202693], "version": 0.2, "tvm_version": "0.8.0"}
{"input": ["cuda -keys=cuda,gpu -max_num_threads=1024 -thread_warp_size=32", "fused_layer_norm_matmul_tensorcore.cuda", [["TENSOR", [16, 4096], "float16"], ["TENSOR", [16], "float16"], ["TENSOR", [16], "float16"], ["TENSOR", [2048, 4096], "float16"], 0.000244140625], {}], "config": {"index": 9130, "code_hash": null, "entity": [["block_row_warps", "ot", 2], ["block_col_warps", "ot", 2], ["warp_row_tiles", "ot", 1], ["warp_col_tiles", "ot", 4], ["chunk", "ot", 1], ["offset", "ot", 0], ["offsetCS", "ot", 0], ["vec", "ot", 8], ["wmma_m", "ot", 8]]}, "result": [[0.000469359371], 0, 2.936020851135254, 1652007233.321009], "version": 0.2, "tvm_version": "0.8.0"}
{"input": ["cuda -keys=cuda,gpu -max_num_threads=1024 -thread_warp_size=32", "fused_layer_norm_matmul_tensorcore.cuda", [["TENSOR", [16, 4096], "float16"], ["TENSOR", [16], "float16"], ["TENSOR", [16], "float16"], ["TENSOR", [2048, 4096], "float16"], 0.000244140625], {}], "config": {"index": 5550, "code_hash": null, "entity": [["block_row_warps", "ot", 1], ["block_col_warps", "ot", 4], ["warp_row_tiles", "ot", 2], ["warp_col_tiles", "ot", 2], ["chunk", "ot", 1], ["offset", "ot", 8], ["offsetCS", "ot", 0], ["vec", "ot", 1], ["wmma_m", "ot", 8]]}, "result": [[0.000329797885], 0, 2.4246044158935547, 1652007235.2192533], "version": 0.2, "tvm_version": "0.8.0"}
{"input": ["cuda -keys=cuda,gpu -max_num_threads=1024 -thread_warp_size=32", "fused_layer_norm_matmul_tensorcore.cuda", [["TENSOR", [16, 4096], "float16"], ["TENSOR", [16], "float16"], ["TENSOR", [16], "float16"], ["TENSOR", [2048, 4096], "float16"], 0.000244140625], {}], "config": {"index": 9187, "code_hash": null, "entity": [["block_row_warps", "ot", 2], ["block_col_warps", "ot", 4], ["warp_row_tiles", "ot", 1], ["warp_col_tiles", "ot", 2], ["chunk", "ot", 2], ["offset", "ot", 0], ["offsetCS", "ot", 0], ["vec", "ot", 8], ["wmma_m", "ot", 8]]}, "result": [[0.000314009516], 0, 2.377202272415161, 1652007238.2808511], "version": 0.2, "tvm_version": "0.8.0"}
{"input": ["cuda -keys=cuda,gpu -max_num_threads=1024 -thread_warp_size=32", "fused_layer_norm_matmul_tensorcore.cuda", [["TENSOR", [16, 4096], "float16"], ["TENSOR", [16], "float16"], ["TENSOR", [16], "float16"], ["TENSOR", [2048, 4096], "float16"], 0.000244140625], {}], "config": {"index": 3759, "code_hash": null, "entity": [["block_row_warps", "ot", 1], ["block_col_warps", "ot", 4], ["warp_row_tiles", "ot", 1], ["warp_col_tiles", "ot", 2], ["chunk", "ot", 4], ["offset", "ot", 8], ["offsetCS", "ot", 8], ["vec", "ot", 4], ["wmma_m", "ot", 16]]}, "result": [[0.00013986865499999998], 0, 1.8232612609863281, 1652007240.6089156], "version": 0.2, "tvm_version": "0.8.0"}
{"input": ["cuda -keys=cuda,gpu -max_num_threads=1024 -thread_warp_size=32", "fused_layer_norm_matmul_tensorcore.cuda", [["TENSOR", [16, 4096], "float16"], ["TENSOR", [16], "float16"], ["TENSOR", [16], "float16"], ["TENSOR", [2048, 4096], "float16"], 0.000244140625], {}], "config": {"index": 5658, "code_hash": null, "entity": [["block_row_warps", "ot", 1], ["block_col_warps", "ot", 4], ["warp_row_tiles", "ot", 2], ["warp_col_tiles", "ot", 4], ["chunk", "ot", 2], ["offset", "ot", 8], ["offsetCS", "ot", 0], ["vec", "ot", 1], ["wmma_m", "ot", 8]]}, "result": [[0.00044272557699999996], 0, 3.139237403869629, 1652007248.5619626], "version": 0.2, "tvm_version": "0.8.0"}
{"input": ["cuda -keys=cuda,gpu -max_num_threads=1024 -thread_warp_size=32", "fused_layer_norm_matmul_tensorcore.cuda", [["TENSOR", [16, 4096], "float16"], ["TENSOR", [16], "float16"], ["TENSOR", [16], "float16"], ["TENSOR", [2048, 4096], "float16"], 0.000244140625], {}], "config": {"index": 5752, "code_hash": null, "entity": [["block_row_warps", "ot", 2], ["block_col_warps", "ot", 1], ["warp_row_tiles", "ot", 1], ["warp_col_tiles", "ot", 1], ["chunk", "ot", 8], ["offset", "ot", 8], ["offsetCS", "ot", 0], ["vec", "ot", 1], ["wmma_m", "ot", 8]]}, "result": [[0.000321182007], 0, 2.5050296783447266, 1652007252.7918303], "version": 0.2, "tvm_version": "0.8.0"}
{"input": ["cuda -keys=cuda,gpu -max_num_threads=1024 -thread_warp_size=32", "fused_layer_norm_matmul_tensorcore.cuda", [["TENSOR", [16, 4096], "float16"], ["TENSOR", [16], "float16"], ["TENSOR", [16], "float16"], ["TENSOR", [2048, 4096], "float16"], 0.000244140625], {}], "config": {"index": 5946, "code_hash": null, "entity": [["block_row_warps", "ot", 1], ["block_col_warps", "ot", 4], ["warp_row_tiles", "ot", 1], ["warp_col_tiles", "ot", 2], ["chunk", "ot", 2], ["offset", "ot", 0], ["offsetCS", "ot", 8], ["vec", "ot", 1], ["wmma_m", "ot", 8]]}, "result": [[0.000232260598], 0, 2.1221985816955566, 1652007255.3997571], "version": 0.2, "tvm_version": "0.8.0"}
{"input": ["cuda -keys=cuda,gpu -max_num_threads=1024 -thread_warp_size=32", "fused_layer_norm_matmul_tensorcore.cuda", [["TENSOR", [16, 4096], "float16"], ["TENSOR", [16], "float16"], ["TENSOR", [16], "float16"], ["TENSOR", [2048, 4096], "float16"], 0.000244140625], {}], "config": {"index": 5947, "code_hash": null, "entity": [["block_row_warps", "ot", 2], ["block_col_warps", "ot", 4], ["warp_row_tiles", "ot", 1], ["warp_col_tiles", "ot", 2], ["chunk", "ot", 2], ["offset", "ot", 0], ["offsetCS", "ot", 8], ["vec", "ot", 1], ["wmma_m", "ot", 8]]}, "result": [[0.00025755426799999997], 0, 2.4663054943084717, 1652007287.6601055], "version": 0.2, "tvm_version": "0.8.0"}
{"input": ["cuda -keys=cuda,gpu -max_num_threads=1024 -thread_warp_size=32", "fused_layer_norm_matmul_tensorcore.cuda", [["TENSOR", [16, 4096], "float16"], ["TENSOR", [16], "float16"], ["TENSOR", [16], "float16"], ["TENSOR", [2048, 4096], "float16"], 0.000244140625], {}], "config": {"index": 6271, "code_hash": null, "entity": [["block_row_warps", "ot", 2], ["block_col_warps", "ot", 4], ["warp_row_tiles", "ot", 1], ["warp_col_tiles", "ot", 2], ["chunk", "ot", 2], ["offset", "ot", 8], ["offsetCS", "ot", 8], ["vec", "ot", 1], ["wmma_m", "ot", 8]]}, "result": [[0.00017689424800000002], 0, 2.3923585414886475, 1652007289.1652472], "version": 0.2, "tvm_version": "0.8.0"}
{"input": ["cuda -keys=cuda,gpu -max_num_threads=1024 -thread_warp_size=32", "fused_layer_norm_matmul_tensorcore.cuda", [["TENSOR", [16, 4096], "float16"], ["TENSOR", [16], "float16"], ["TENSOR", [16], "float16"], ["TENSOR", [2048, 4096], "float16"], 0.000244140625], {}], "config": {"index": 5623, "code_hash": null, "entity": [["block_row_warps", "ot", 2], ["block_col_warps", "ot", 4], ["warp_row_tiles", "ot", 1], ["warp_col_tiles", "ot", 2], ["chunk", "ot", 2], ["offset", "ot", 8], ["offsetCS", "ot", 0], ["vec", "ot", 1], ["wmma_m", "ot", 8]]}, "result": [[0.000176837739], 0, 2.3895504474639893, 1652007290.8028865], "version": 0.2, "tvm_version": "0.8.0"}
{"input": ["cuda -keys=cuda,gpu -max_num_threads=1024 -thread_warp_size=32", "fused_layer_norm_matmul_tensorcore.cuda", [["TENSOR", [16, 4096], "float16"], ["TENSOR", [16], "float16"], ["TENSOR", [16], "float16"], ["TENSOR", [2048, 4096], "float16"], 0.000244140625], {}], "config": {"index": 5299, "code_hash": null, "entity": [["block_row_warps", "ot", 2], ["block_col_warps", "ot", 4], ["warp_row_tiles", "ot", 1], ["warp_col_tiles", "ot", 2], ["chunk", "ot", 2], ["offset", "ot", 0], ["offsetCS", "ot", 0], ["vec", "ot", 1], ["wmma_m", "ot", 8]]}, "result": [[0.000257994565], 0, 2.418820858001709, 1652007292.4488714], "version": 0.2, "tvm_version": "0.8.0"}
{"input": ["cuda -keys=cuda,gpu -max_num_threads=1024 -thread_warp_size=32", "fused_layer_norm_matmul_tensorcore.cuda", [["TENSOR", [16, 4096], "float16"], ["TENSOR", [16], "float16"], ["TENSOR", [16], "float16"], ["TENSOR", [2048, 4096], "float16"], 0.000244140625], {}], "config": {"index": 5307, "code_hash": null, "entity": [["block_row_warps", "ot", 1], ["block_col_warps", "ot", 4], ["warp_row_tiles", "ot", 2], ["warp_col_tiles", "ot", 2], ["chunk", "ot", 2], ["offset", "ot", 0], ["offsetCS", "ot", 0], ["vec", "ot", 1], ["wmma_m", "ot", 8]]}, "result": [[0.000304313828], 0, 3.213852882385254, 1652007294.5784822], "version": 0.2, "tvm_version": "0.8.0"}
{"input": ["cuda -keys=cuda,gpu -max_num_threads=1024 -thread_warp_size=32", "fused_layer_norm_matmul_tensorcore.cuda", [["TENSOR", [16, 4096], "float16"], ["TENSOR", [16], "float16"], ["TENSOR", [16], "float16"], ["TENSOR", [2048, 4096], "float16"], 0.000244140625], {}], "config": {"index": 5964, "code_hash": null, "entity": [["block_row_warps", "ot", 1], ["block_col_warps", "ot", 4], ["warp_row_tiles", "ot", 4], ["warp_col_tiles", "ot", 2], ["chunk", "ot", 2], ["offset", "ot", 0], ["offsetCS", "ot", 8], ["vec", "ot", 1], ["wmma_m", "ot", 8]]}, "result": [[0.00030572889100000003], 0, 2.97586727142334, 1652007296.4259734], "version": 0.2, "tvm_version": "0.8.0"}
{"input": ["cuda -keys=cuda,gpu -max_num_threads=1024 -thread_warp_size=32", "fused_layer_norm_matmul_tensorcore.cuda", [["TENSOR", [16, 4096], "float16"], ["TENSOR", [16], "float16"], ["TENSOR", [16], "float16"], ["TENSOR", [2048, 4096], "float16"], 0.000244140625], {}], "config": {"index": 5955, "code_hash": null, "entity": [["block_row_warps", "ot", 1], ["block_col_warps", "ot", 4], ["warp_row_tiles", "ot", 2], ["warp_col_tiles", "ot", 2], ["chunk", "ot", 2], ["offset", "ot", 0], ["offsetCS", "ot", 8], ["vec", "ot", 1], ["wmma_m", "ot", 8]]}, "result": [[0.000304978462], 0, 2.8915889263153076, 1652007298.2290754], "version": 0.2, "tvm_version": "0.8.0"}
{"input": ["cuda -keys=cuda,gpu -max_num_threads=1024 -thread_warp_size=32", "fused_layer_norm_matmul_tensorcore.cuda", [["TENSOR", [16, 4096], "float16"], ["TENSOR", [16], "float16"], ["TENSOR", [16], "float16"], ["TENSOR", [2048, 4096], "float16"], 0.000244140625], {}], "config": {"index": 5316, "code_hash": null, "entity": [["block_row_warps", "ot", 1], ["block_col_warps", "ot", 4], ["warp_row_tiles", "ot", 4], ["warp_col_tiles", "ot", 2], ["chunk", "ot", 2], ["offset", "ot", 0], ["offsetCS", "ot", 0], ["vec", "ot", 1], ["wmma_m", "ot", 8]]}, "result": [[0.000305662245], 0, 2.995702028274536, 1652007300.2681205], "version": 0.2, "tvm_version": "0.8.0"}
{"input": ["cuda -keys=cuda,gpu -max_num_threads=1024 -thread_warp_size=32", "fused_layer_norm_matmul_tensorcore.cuda", [["TENSOR", [16, 4096], "float16"], ["TENSOR", [16], "float16"], ["TENSOR", [16], "float16"], ["TENSOR", [2048, 4096], "float16"], 0.000244140625], {}], "config": {"index": 5640, "code_hash": null, "entity": [["block_row_warps", "ot", 1], ["block_col_warps", "ot", 4], ["warp_row_tiles", "ot", 4], ["warp_col_tiles", "ot", 2], ["chunk", "ot", 2], ["offset", "ot", 8], ["offsetCS", "ot", 0], ["vec", "ot", 1], ["wmma_m", "ot", 8]]}, "result": [[0.000235305084], 0, 2.811976671218872, 1652007302.0523632], "version": 0.2, "tvm_version": "0.8.0"}
{"input": ["cuda -keys=cuda,gpu -max_num_threads=1024 -thread_warp_size=32", "fused_layer_norm_matmul_tensorcore.cuda", [["TENSOR", [16, 4096], "float16"], ["TENSOR", [16], "float16"], ["TENSOR", [16], "float16"], ["TENSOR", [2048, 4096], "float16"], 0.000244140625], {}], "config": {"index": 6288, "code_hash": null, "entity": [["block_row_warps", "ot", 1], ["block_col_warps", "ot", 4], ["warp_row_tiles", "ot", 4], ["warp_col_tiles", "ot", 2], ["chunk", "ot", 2], ["offset", "ot", 8], ["offsetCS", "ot", 8], ["vec", "ot", 1], ["wmma_m", "ot", 8]]}, "result": [[0.000235852296], 0, 2.6260945796966553, 1652007303.6295125], "version": 0.2, "tvm_version": "0.8.0"}
{"input": ["cuda -keys=cuda,gpu -max_num_threads=1024 -thread_warp_size=32", "fused_layer_norm_matmul_tensorcore.cuda", [["TENSOR", [16, 4096], "float16"], ["TENSOR", [16], "float16"], ["TENSOR", [16], "float16"], ["TENSOR", [2048, 4096], "float16"], 0.000244140625], {}], "config": {"index": 5631, "code_hash": null, "entity": [["block_row_warps", "ot", 1], ["block_col_warps", "ot", 4], ["warp_row_tiles", "ot", 2], ["warp_col_tiles", "ot", 2], ["chunk", "ot", 2], ["offset", "ot", 8], ["offsetCS", "ot", 0], ["vec", "ot", 1], ["wmma_m", "ot", 8]]}, "result": [[0.000235337237], 0, 2.8846113681793213, 1652007305.4254963], "version": 0.2, "tvm_version": "0.8.0"}
{"input": ["cuda -keys=cuda,gpu -max_num_threads=1024 -thread_warp_size=32", "fused_layer_norm_matmul_tensorcore.cuda", [["TENSOR", [16, 4096], "float16"], ["TENSOR", [16], "float16"], ["TENSOR", [16], "float16"], ["TENSOR", [2048, 4096], "float16"], 0.000244140625], {}], "config": {"index": 6279, "code_hash": null, "entity": [["block_row_warps", "ot", 1], ["block_col_warps", "ot", 4], ["warp_row_tiles", "ot", 2], ["warp_col_tiles", "ot", 2], ["chunk", "ot", 2], ["offset", "ot", 8], ["offsetCS", "ot", 8], ["vec", "ot", 1], ["wmma_m", "ot", 8]]}, "result": [[0.000235242009], 0, 2.69063401222229, 1652007307.05031], "version": 0.2, "tvm_version": "0.8.0"}
{"input": ["cuda -keys=cuda,gpu -max_num_threads=1024 -thread_warp_size=32", "fused_layer_norm_matmul_tensorcore.cuda", [["TENSOR", [16, 4096], "float16"], ["TENSOR", [16], "float16"], ["TENSOR", [16], "float16"], ["TENSOR", [2048, 4096], "float16"], 0.000244140625], {}], "config": {"index": 5622, "code_hash": null, "entity": [["block_row_warps", "ot", 1], ["block_col_warps", "ot", 4], ["warp_row_tiles", "ot", 1], ["warp_col_tiles", "ot", 2], ["chunk", "ot", 2], ["offset", "ot", 8], ["offsetCS", "ot", 0], ["vec", "ot", 1], ["wmma_m", "ot", 8]]}, "result": [[0.000180159656], 0, 2.479198455810547, 1652007308.6301355], "version": 0.2, "tvm_version": "0.8.0"}
{"input": ["cuda -keys=cuda,gpu -max_num_threads=1024 -thread_warp_size=32", "fused_layer_norm_matmul_tensorcore.cuda", [["TENSOR", [16, 4096], "float16"], ["TENSOR", [16], "float16"], ["TENSOR", [16], "float16"], ["TENSOR", [2048, 4096], "float16"], 0.000244140625], {}], "config": {"index": 6270, "code_hash": null, "entity": [["block_row_warps", "ot", 1], ["block_col_warps", "ot", 4], ["warp_row_tiles", "ot", 1], ["warp_col_tiles", "ot", 2], ["chunk", "ot", 2], ["offset", "ot", 8], ["offsetCS", "ot", 8], ["vec", "ot", 1], ["wmma_m", "ot", 8]]}, "result": [[0.000180627387], 0, 2.56032395362854, 1652007310.2695851], "version": 0.2, "tvm_version": "0.8.0"}
{"input": ["cuda -keys=cuda,gpu -max_num_threads=1024 -thread_warp_size=32", "fused_layer_norm_matmul_tensorcore.cuda", [["TENSOR", [16, 4096], "float16"], ["TENSOR", [16], "float16"], ["TENSOR", [16], "float16"], ["TENSOR", [2048, 4096], "float16"], 0.000244140625], {}], "config": {"index": 5298, "code_hash": null, "entity": [["block_row_warps", "ot", 1], ["block_col_warps", "ot", 4], ["warp_row_tiles", "ot", 1], ["warp_col_tiles", "ot", 2], ["chunk", "ot", 2], ["offset", "ot", 0], ["offsetCS", "ot", 0], ["vec", "ot", 1], ["wmma_m", "ot", 8]]}, "result": [[0.000230336051], 0, 2.6352431774139404, 1652007311.877708], "version": 0.2, "tvm_version": "0.8.0"}
{"input": ["cuda -keys=cuda,gpu -max_num_threads=1024 -thread_warp_size=32", "fused_layer_norm_matmul_tensorcore.cuda", [["TENSOR", [16, 4096], "float16"], ["TENSOR", [16], "float16"], ["TENSOR", [16], "float16"], ["TENSOR", [2048, 4096], "float16"], 0.000244140625], {}], "config": {"index": 87, "code_hash": null, "entity": [["block_row_warps", "ot", 1], ["block_col_warps", "ot", 4], ["warp_row_tiles", "ot", 1], ["warp_col_tiles", "ot", 1], ["chunk", "ot", 2], ["offset", "ot", 0], ["offsetCS", "ot", 0], ["vec", "ot", 1], ["wmma_m", "ot", 16]]}, "result": [[0.000216740987], 0, 2.6266114711761475, 1652007313.7295034], "version": 0.2, "tvm_version": "0.8.0"}
{"input": ["cuda -keys=cuda,gpu -max_num_threads=1024 -thread_warp_size=32", "fused_layer_norm_matmul_tensorcore.cuda", [["TENSOR", [16, 4096], "float16"], ["TENSOR", [16], "float16"], ["TENSOR", [16], "float16"], ["TENSOR", [2048, 4096], "float16"], 0.000244140625], {}], "config": {"index": 96, "code_hash": null, "entity": [["block_row_warps", "ot", 1], ["block_col_warps", "ot", 4], ["warp_row_tiles", "ot", 2], ["warp_col_tiles", "ot", 1], ["chunk", "ot", 2], ["offset", "ot", 0], ["offsetCS", "ot", 0], ["vec", "ot", 1], ["wmma_m", "ot", 16]]}, "result": [[0.00021611976999999998], 0, 2.2339134216308594, 1652007315.2802875], "version": 0.2, "tvm_version": "0.8.0"}
{"input": ["cuda -keys=cuda,gpu -max_num_threads=1024 -thread_warp_size=32", "fused_layer_norm_matmul_tensorcore.cuda", [["TENSOR", [16, 4096], "float16"], ["TENSOR", [16], "float16"], ["TENSOR", [16], "float16"], ["TENSOR", [2048, 4096], "float16"], 0.000244140625], {}], "config": {"index": 771, "code_hash": null, "entity": [["block_row_warps", "ot", 1], ["block_col_warps", "ot", 4], ["warp_row_tiles", "ot", 2], ["warp_col_tiles", "ot", 2], ["chunk", "ot", 2], ["offset", "ot", 0], ["offsetCS", "ot", 8], ["vec", "ot", 1], ["wmma_m", "ot", 16]]}, "result": [[0.000290131157], 0, 2.867805242538452, 1652007317.1410077], "version": 0.2, "tvm_version": "0.8.0"}
{"input": ["cuda -keys=cuda,gpu -max_num_threads=1024 -thread_warp_size=32", "fused_layer_norm_matmul_tensorcore.cuda", [["TENSOR", [16, 4096], "float16"], ["TENSOR", [16], "float16"], ["TENSOR", [16], "float16"], ["TENSOR", [2048, 4096], "float16"], 0.000244140625], {}], "config": {"index": 456, "code_hash": null, "entity": [["block_row_warps", "ot", 1], ["block_col_warps", "ot", 4], ["warp_row_tiles", "ot", 4], ["warp_col_tiles", "ot", 2], ["chunk", "ot", 2], ["offset", "ot", 8], ["offsetCS", "ot", 0], ["vec", "ot", 1], ["wmma_m", "ot", 16]]}, "result": [[0.00022813391799999998], 0, 2.686943531036377, 1652007318.853325], "version": 0.2, "tvm_version": "0.8.0"}
{"input": ["cuda -keys=cuda,gpu -max_num_threads=1024 -thread_warp_size=32", "fused_layer_norm_matmul_tensorcore.cuda", [["TENSOR", [16, 4096], "float16"], ["TENSOR", [16], "float16"], ["TENSOR", [16], "float16"], ["TENSOR", [2048, 4096], "float16"], 0.000244140625], {}], "config": {"index": 5280, "code_hash": null, "entity": [["block_row_warps", "ot", 1], ["block_col_warps", "ot", 4], ["warp_row_tiles", "ot", 2], ["warp_col_tiles", "ot", 1], ["chunk", "ot", 2], ["offset", "ot", 0], ["offsetCS", "ot", 0], ["vec", "ot", 1], ["wmma_m", "ot", 8]]}, "result": [[0.00024338420799999998], 0, 2.4706857204437256, 1652007320.507293], "version": 0.2, "tvm_version": "0.8.0"}
{"input": ["cuda -keys=cuda,gpu -max_num_threads=1024 -thread_warp_size=32", "fused_layer_norm_matmul_tensorcore.cuda", [["TENSOR", [16, 4096], "float16"], ["TENSOR", [16], "float16"], ["TENSOR", [16], "float16"], ["TENSOR", [2048, 4096], "float16"], 0.000244140625], {}], "config": {"index": 744, "code_hash": null, "entity": [["block_row_warps", "ot", 1], ["block_col_warps", "ot", 4], ["warp_row_tiles", "ot", 2], ["warp_col_tiles", "ot", 1], ["chunk", "ot", 2], ["offset", "ot", 0], ["offsetCS", "ot", 8], ["vec", "ot", 1], ["wmma_m", "ot", 16]]}, "result": [[0.00021798569200000002], 0, 2.428804397583008, 1652007322.179532], "version": 0.2, "tvm_version": "0.8.0"}
{"input": ["cuda -keys=cuda,gpu -max_num_threads=1024 -thread_warp_size=32", "fused_layer_norm_matmul_tensorcore.cuda", [["TENSOR", [16, 4096], "float16"], ["TENSOR", [16], "float16"], ["TENSOR", [16], "float16"], ["TENSOR", [2048, 4096], "float16"], 0.000244140625], {}], "config": {"index": 411, "code_hash": null, "entity": [["block_row_warps", "ot", 1], ["block_col_warps", "ot", 4], ["warp_row_tiles", "ot", 1], ["warp_col_tiles", "ot", 1], ["chunk", "ot", 2], ["offset", "ot", 8], ["offsetCS", "ot", 0], ["vec", "ot", 1], ["wmma_m", "ot", 16]]}, "result": [[0.00020410855799999998], 0, 2.186777353286743, 1652007323.6333861], "version": 0.2, "tvm_version": "0.8.0"}
{"input": ["cuda -keys=cuda,gpu -max_num_threads=1024 -thread_warp_size=32", "fused_layer_norm_matmul_tensorcore.cuda", [["TENSOR", [16, 4096], "float16"], ["TENSOR", [16], "float16"], ["TENSOR", [16], "float16"], ["TENSOR", [2048, 4096], "float16"], 0.000244140625], {}], "config": {"index": 114, "code_hash": null, "entity": [["block_row_warps", "ot", 1], ["block_col_warps", "ot", 4], ["warp_row_tiles", "ot", 1], ["warp_col_tiles", "ot", 2], ["chunk", "ot", 2], ["offset", "ot", 0], ["offsetCS", "ot", 0], ["vec", "ot", 1], ["wmma_m", "ot", 16]]}, "result": [[0.000257823808], 0, 2.667311906814575, 1652007325.4464414], "version": 0.2, "tvm_version": "0.8.0"}
{"input": ["cuda -keys=cuda,gpu -max_num_threads=1024 -thread_warp_size=32", "fused_layer_norm_matmul_tensorcore.cuda", [["TENSOR", [16, 4096], "float16"], ["TENSOR", [16], "float16"], ["TENSOR", [16], "float16"], ["TENSOR", [2048, 4096], "float16"], 0.000244140625], {}], "config": {"index": 438, "code_hash": null, "entity": [["block_row_warps", "ot", 1], ["block_col_warps", "ot", 4], ["warp_row_tiles", "ot", 1], ["warp_col_tiles", "ot", 2], ["chunk", "ot", 2], ["offset", "ot", 8], ["offsetCS", "ot", 0], ["vec", "ot", 1], ["wmma_m", "ot", 16]]}, "result": [[0.000227037648], 0, 2.4634621143341064, 1652007327.1864743], "version": 0.2, "tvm_version": "0.8.0"}
{"input": ["cuda -keys=cuda,gpu -max_num_threads=1024 -thread_warp_size=32", "fused_layer_norm_matmul_tensorcore.cuda", [["TENSOR", [16, 4096], "float16"], ["TENSOR", [16], "float16"], ["TENSOR", [16], "float16"], ["TENSOR", [2048, 4096], "float16"], 0.000244140625], {}], "config": {"index": 123, "code_hash": null, "entity": [["block_row_warps", "ot", 1], ["block_col_warps", "ot", 4], ["warp_row_tiles", "ot", 2], ["warp_col_tiles", "ot", 2], ["chunk", "ot", 2], ["offset", "ot", 0], ["offsetCS", "ot", 0], ["vec", "ot", 1], ["wmma_m", "ot", 16]]}, "result": [[0.000290036848], 0, 2.5755114555358887, 1652007328.9114811], "version": 0.2, "tvm_version": "0.8.0"}
{"input": ["cuda -keys=cuda,gpu -max_num_threads=1024 -thread_warp_size=32", "fused_layer_norm_matmul_tensorcore.cuda", [["TENSOR", [16, 4096], "float16"], ["TENSOR", [16], "float16"], ["TENSOR", [16], "float16"], ["TENSOR", [2048, 4096], "float16"], 0.000244140625], {}], "config": {"index": 6261, "code_hash": null, "entity": [["block_row_warps", "ot", 1], ["block_col_warps", "ot", 4], ["warp_row_tiles", "ot", 4], ["warp_col_tiles", "ot", 1], ["chunk", "ot", 2], ["offset", "ot", 8], ["offsetCS", "ot", 8], ["vec", "ot", 1], ["wmma_m", "ot", 8]]}, "result": [[0.000223820205], 0, 2.734036684036255, 1652007330.664111], "version": 0.2, "tvm_version": "0.8.0"}
{"input": ["cuda -keys=cuda,gpu -max_num_threads=1024 -thread_warp_size=32", "fused_layer_norm_matmul_tensorcore.cuda", [["TENSOR", [16, 4096], "float16"], ["TENSOR", [16], "float16"], ["TENSOR", [16], "float16"], ["TENSOR", [2048, 4096], "float16"], 0.000244140625], {}], "config": {"index": 105, "code_hash": null, "entity": [["block_row_warps", "ot", 1], ["block_col_warps", "ot", 4], ["warp_row_tiles", "ot", 4], ["warp_col_tiles", "ot", 1], ["chunk", "ot", 2], ["offset", "ot", 0], ["offsetCS", "ot", 0], ["vec", "ot", 1], ["wmma_m", "ot", 16]]}, "result": [[0.000217099006], 0, 2.420261859893799, 1652007332.2051148], "version": 0.2, "tvm_version": "0.8.0"}
{"input": ["cuda -keys=cuda,gpu -max_num_threads=1024 -thread_warp_size=32", "fused_layer_norm_matmul_tensorcore.cuda", [["TENSOR", [16, 4096], "float16"], ["TENSOR", [16], "float16"], ["TENSOR", [16], "float16"], ["TENSOR", [2048, 4096], "float16"], 0.000244140625], {}], "config": {"index": 429, "code_hash": null, "entity": [["block_row_warps", "ot", 1], ["block_col_warps", "ot", 4], ["warp_row_tiles", "ot", 4], ["warp_col_tiles", "ot", 1], ["chunk", "ot", 2], ["offset", "ot", 8], ["offsetCS", "ot", 0], ["vec", "ot", 1], ["wmma_m", "ot", 16]]}, "result": [[0.000205129591], 0, 2.5446298122406006, 1652007333.8116791], "version": 0.2, "tvm_version": "0.8.0"}
{"input": ["cuda -keys=cuda,gpu -max_num_threads=1024 -thread_warp_size=32", "fused_layer_norm_matmul_tensorcore.cuda", [["TENSOR", [16, 4096], "float16"], ["TENSOR", [16], "float16"], ["TENSOR", [16], "float16"], ["TENSOR", [2048, 4096], "float16"], 0.000244140625], {}], "config": {"index": 753, "code_hash": null, "entity": [["block_row_warps", "ot", 1], ["block_col_warps", "ot", 4], ["warp_row_tiles", "ot", 4], ["warp_col_tiles", "ot", 1], ["chunk", "ot", 2], ["offset", "ot", 0], ["offsetCS", "ot", 8], ["vec", "ot", 1], ["wmma_m", "ot", 16]]}, "result": [[0.00021768433500000001], 0, 2.8645317554473877, 1652007335.6358807], "version": 0.2, "tvm_version": "0.8.0"}
{"input": ["cuda -keys=cuda,gpu -max_num_threads=1024 -thread_warp_size=32", "fused_layer_norm_matmul_tensorcore.cuda", [["TENSOR", [16, 4096], "float16"], ["TENSOR", [16], "float16"], ["TENSOR", [16], "float16"], ["TENSOR", [2048, 4096], "float16"], 0.000244140625], {}], "config": {"index": 5937, "code_hash": null, "entity": [["block_row_warps", "ot", 1], ["block_col_warps", "ot", 4], ["warp_row_tiles", "ot", 4], ["warp_col_tiles", "ot", 1], ["chunk", "ot", 2], ["offset", "ot", 0], ["offsetCS", "ot", 8], ["vec", "ot", 1], ["wmma_m", "ot", 8]]}, "result": [[0.00024255112399999997], 0, 2.6783692836761475, 1652007337.2119162], "version": 0.2, "tvm_version": "0.8.0"}
{"input": ["cuda -keys=cuda,gpu -max_num_threads=1024 -thread_warp_size=32", "fused_layer_norm_matmul_tensorcore.cuda", [["TENSOR", [16, 4096], "float16"], ["TENSOR", [16], "float16"], ["TENSOR", [16], "float16"], ["TENSOR", [2048, 4096], "float16"], 0.000244140625], {}], "config": {"index": 5928, "code_hash": null, "entity": [["block_row_warps", "ot", 1], ["block_col_warps", "ot", 4], ["warp_row_tiles", "ot", 2], ["warp_col_tiles", "ot", 1], ["chunk", "ot", 2], ["offset", "ot", 0], ["offsetCS", "ot", 8], ["vec", "ot", 1], ["wmma_m", "ot", 8]]}, "result": [[0.00024212672699999997], 0, 2.607321262359619, 1652007338.9949443], "version": 0.2, "tvm_version": "0.8.0"}
{"input": ["cuda -keys=cuda,gpu -max_num_threads=1024 -thread_warp_size=32", "fused_layer_norm_matmul_tensorcore.cuda", [["TENSOR", [16, 4096], "float16"], ["TENSOR", [16], "float16"], ["TENSOR", [16], "float16"], ["TENSOR", [2048, 4096], "float16"], 0.000244140625], {}], "config": {"index": 5613, "code_hash": null, "entity": [["block_row_warps", "ot", 1], ["block_col_warps", "ot", 4], ["warp_row_tiles", "ot", 4], ["warp_col_tiles", "ot", 1], ["chunk", "ot", 2], ["offset", "ot", 8], ["offsetCS", "ot", 0], ["vec", "ot", 1], ["wmma_m", "ot", 8]]}, "result": [[0.000224943442], 0, 2.5264296531677246, 1652007340.6431315], "version": 0.2, "tvm_version": "0.8.0"}
{"input": ["cuda -keys=cuda,gpu -max_num_threads=1024 -thread_warp_size=32", "fused_layer_norm_matmul_tensorcore.cuda", [["TENSOR", [16, 4096], "float16"], ["TENSOR", [16], "float16"], ["TENSOR", [16], "float16"], ["TENSOR", [2048, 4096], "float16"], 0.000244140625], {}], "config": {"index": 132, "code_hash": null, "entity": [["block_row_warps", "ot", 1], ["block_col_warps", "ot", 4], ["warp_row_tiles", "ot", 4], ["warp_col_tiles", "ot", 2], ["chunk", "ot", 2], ["offset", "ot", 0], ["offsetCS", "ot", 0], ["vec", "ot", 1], ["wmma_m", "ot", 16]]}, "result": [[0.000292220918], 0, 2.816035509109497, 1652007342.5332391], "version": 0.2, "tvm_version": "0.8.0"}
{"input": ["cuda -keys=cuda,gpu -max_num_threads=1024 -thread_warp_size=32", "fused_layer_norm_matmul_tensorcore.cuda", [["TENSOR", [16, 4096], "float16"], ["TENSOR", [16], "float16"], ["TENSOR", [16], "float16"], ["TENSOR", [2048, 4096], "float16"], 0.000244140625], {}], "config": {"index": 1068, "code_hash": null, "entity": [["block_row_warps", "ot", 1], ["block_col_warps", "ot", 4], ["warp_row_tiles", "ot", 2], ["warp_col_tiles", "ot", 1], ["chunk", "ot", 2], ["offset", "ot", 8], ["offsetCS", "ot", 8], ["vec", "ot", 1], ["wmma_m", "ot", 16]]}, "result": [[0.000204317894], 0, 2.501209020614624, 1652007344.2470236], "version": 0.2, "tvm_version": "0.8.0"}
{"input": ["cuda -keys=cuda,gpu -max_num_threads=1024 -thread_warp_size=32", "fused_layer_norm_matmul_tensorcore.cuda", [["TENSOR", [16, 4096], "float16"], ["TENSOR", [16], "float16"], ["TENSOR", [16], "float16"], ["TENSOR", [2048, 4096], "float16"], 0.000244140625], {}], "config": {"index": 1077, "code_hash": null, "entity": [["block_row_warps", "ot", 1], ["block_col_warps", "ot", 4], ["warp_row_tiles", "ot", 4], ["warp_col_tiles", "ot", 1], ["chunk", "ot", 2], ["offset", "ot", 8], ["offsetCS", "ot", 8], ["vec", "ot", 1], ["wmma_m", "ot", 16]]}, "result": [[0.000204273551], 0, 2.355212926864624, 1652007345.6816616], "version": 0.2, "tvm_version": "0.8.0"}
{"input": ["cuda -keys=cuda,gpu -max_num_threads=1024 -thread_warp_size=32", "fused_layer_norm_matmul_tensorcore.cuda", [["TENSOR", [16, 4096], "float16"], ["TENSOR", [16], "float16"], ["TENSOR", [16], "float16"], ["TENSOR", [2048, 4096], "float16"], 0.000244140625], {}], "config": {"index": 5604, "code_hash": null, "entity": [["block_row_warps", "ot", 1], ["block_col_warps", "ot", 4], ["warp_row_tiles", "ot", 2], ["warp_col_tiles", "ot", 1], ["chunk", "ot", 2], ["offset", "ot", 8], ["offsetCS", "ot", 0], ["vec", "ot", 1], ["wmma_m", "ot", 8]]}, "result": [[0.000225007321], 0, 2.568027973175049, 1652007347.4009378], "version": 0.2, "tvm_version": "0.8.0"}
{"input": ["cuda -keys=cuda,gpu -max_num_threads=1024 -thread_warp_size=32", "fused_layer_norm_matmul_tensorcore.cuda", [["TENSOR", [16, 4096], "float16"], ["TENSOR", [16], "float16"], ["TENSOR", [16], "float16"], ["TENSOR", [2048, 4096], "float16"], 0.000244140625], {}], "config": {"index": 780, "code_hash": null, "entity": [["block_row_warps", "ot", 1], ["block_col_warps", "ot", 4], ["warp_row_tiles", "ot", 4], ["warp_col_tiles", "ot", 2], ["chunk", "ot", 2], ["offset", "ot", 0], ["offsetCS", "ot", 8], ["vec", "ot", 1], ["wmma_m", "ot", 16]]}, "result": [[0.00029409217799999997], 0, 2.720458984375, 1652007349.132128], "version": 0.2, "tvm_version": "0.8.0"}
{"input": ["cuda -keys=cuda,gpu -max_num_threads=1024 -thread_warp_size=32", "fused_layer_norm_matmul_tensorcore.cuda", [["TENSOR", [16, 4096], "float16"], ["TENSOR", [16], "float16"], ["TENSOR", [16], "float16"], ["TENSOR", [2048, 4096], "float16"], 0.000244140625], {}], "config": {"index": 420, "code_hash": null, "entity": [["block_row_warps", "ot", 1], ["block_col_warps", "ot", 4], ["warp_row_tiles", "ot", 2], ["warp_col_tiles", "ot", 1], ["chunk", "ot", 2], ["offset", "ot", 8], ["offsetCS", "ot", 0], ["vec", "ot", 1], ["wmma_m", "ot", 16]]}, "result": [[0.000204072742], 0, 2.4614553451538086, 1652007350.726847], "version": 0.2, "tvm_version": "0.8.0"}
{"input": ["cuda -keys=cuda,gpu -max_num_threads=1024 -thread_warp_size=32", "fused_layer_norm_matmul_tensorcore.cuda", [["TENSOR", [16, 4096], "float16"], ["TENSOR", [16], "float16"], ["TENSOR", [16], "float16"], ["TENSOR", [2048, 4096], "float16"], 0.000244140625], {}], "config": {"index": 6252, "code_hash": null, "entity": [["block_row_warps", "ot", 1], ["block_col_warps", "ot", 4], ["warp_row_tiles", "ot", 2], ["warp_col_tiles", "ot", 1], ["chunk", "ot", 2], ["offset", "ot", 8], ["offsetCS", "ot", 8], ["vec", "ot", 1], ["wmma_m", "ot", 8]]}, "result": [[0.00022422616], 0, 2.633760690689087, 1652007352.4488432], "version": 0.2, "tvm_version": "0.8.0"}
{"input": ["cuda -keys=cuda,gpu -max_num_threads=1024 -thread_warp_size=32", "fused_layer_norm_matmul_tensorcore.cuda", [["TENSOR", [16, 4096], "float16"], ["TENSOR", [16], "float16"], ["TENSOR", [16], "float16"], ["TENSOR", [2048, 4096], "float16"], 0.000244140625], {}], "config": {"index": 735, "code_hash": null, "entity": [["block_row_warps", "ot", 1], ["block_col_warps", "ot", 4], ["warp_row_tiles", "ot", 1], ["warp_col_tiles", "ot", 1], ["chunk", "ot", 2], ["offset", "ot", 0], ["offsetCS", "ot", 8], ["vec", "ot", 1], ["wmma_m", "ot", 16]]}, "result": [[0.000217057751], 0, 2.358898401260376, 1652007353.95602], "version": 0.2, "tvm_version": "0.8.0"}
{"input": ["cuda -keys=cuda,gpu -max_num_threads=1024 -thread_warp_size=32", "fused_layer_norm_matmul_tensorcore.cuda", [["TENSOR", [16, 4096], "float16"], ["TENSOR", [16], "float16"], ["TENSOR", [16], "float16"], ["TENSOR", [2048, 4096], "float16"], 0.000244140625], {}], "config": {"index": 447, "code_hash": null, "entity": [["block_row_warps", "ot", 1], ["block_col_warps", "ot", 4], ["warp_row_tiles", "ot", 2], ["warp_col_tiles", "ot", 2], ["chunk", "ot", 2], ["offset", "ot", 8], ["offsetCS", "ot", 0], ["vec", "ot", 1], ["wmma_m", "ot", 16]]}, "result": [[0.000227308267], 0, 2.420431137084961, 1652007357.114002], "version": 0.2, "tvm_version": "0.8.0"}
{"input": ["cuda -keys=cuda,gpu -max_num_threads=1024 -thread_warp_size=32", "fused_layer_norm_matmul_tensorcore.cuda", [["TENSOR", [16, 4096], "float16"], ["TENSOR", [16], "float16"], ["TENSOR", [16], "float16"], ["TENSOR", [2048, 4096], "float16"], 0.000244140625], {}], "config": {"index": 5289, "code_hash": null, "entity": [["block_row_warps", "ot", 1], ["block_col_warps", "ot", 4], ["warp_row_tiles", "ot", 4], ["warp_col_tiles", "ot", 1], ["chunk", "ot", 2], ["offset", "ot", 0], ["offsetCS", "ot", 0], ["vec", "ot", 1], ["wmma_m", "ot", 8]]}, "result": [[0.00024297367], 0, 2.6745402812957764, 1652007358.953347], "version": 0.2, "tvm_version": "0.8.0"}
{"input": ["cuda -keys=cuda,gpu -max_num_threads=1024 -thread_warp_size=32", "fused_layer_norm_matmul_tensorcore.cuda", [["TENSOR", [16, 4096], "float16"], ["TENSOR", [16], "float16"], ["TENSOR", [16], "float16"], ["TENSOR", [2048, 4096], "float16"], 0.000244140625], {}], "config": {"index": 1086, "code_hash": null, "entity": [["block_row_warps", "ot", 1], ["block_col_warps", "ot", 4], ["warp_row_tiles", "ot", 1], ["warp_col_tiles", "ot", 2], ["chunk", "ot", 2], ["offset", "ot", 8], ["offsetCS", "ot", 8], ["vec", "ot", 1], ["wmma_m", "ot", 16]]}, "result": [[0.00022963146], 0, 2.3564045429229736, 1652007360.496381], "version": 0.2, "tvm_version": "0.8.0"}
{"input": ["cuda -keys=cuda,gpu -max_num_threads=1024 -thread_warp_size=32", "fused_layer_norm_matmul_tensorcore.cuda", [["TENSOR", [16, 4096], "float16"], ["TENSOR", [16], "float16"], ["TENSOR", [16], "float16"], ["TENSOR", [2048, 4096], "float16"], 0.000244140625], {}], "config": {"index": 762, "code_hash": null, "entity": [["block_row_warps", "ot", 1], ["block_col_warps", "ot", 4], ["warp_row_tiles", "ot", 1], ["warp_col_tiles", "ot", 2], ["chunk", "ot", 2], ["offset", "ot", 0], ["offsetCS", "ot", 8], ["vec", "ot", 1], ["wmma_m", "ot", 16]]}, "result": [[0.000257420588], 0, 2.6007471084594727, 1652007362.305852], "version": 0.2, "tvm_version": "0.8.0"}
{"input": ["cuda -keys=cuda,gpu -max_num_threads=1024 -thread_warp_size=32", "fused_layer_norm_matmul_tensorcore.cuda", [["TENSOR", [16, 4096], "float16"], ["TENSOR", [16], "float16"], ["TENSOR", [16], "float16"], ["TENSOR", [2048, 4096], "float16"], 0.000244140625], {}], "config": {"index": 1059, "code_hash": null, "entity": [["block_row_warps", "ot", 1], ["block_col_warps", "ot", 4], ["warp_row_tiles", "ot", 1], ["warp_col_tiles", "ot", 1], ["chunk", "ot", 2], ["offset", "ot", 8], ["offsetCS", "ot", 8], ["vec", "ot", 1], ["wmma_m", "ot", 16]]}, "result": [[0.000204819514], 0, 2.4345099925994873, 1652007364.0318768], "version": 0.2, "tvm_version": "0.8.0"}
{"input": ["cuda -keys=cuda,gpu -max_num_threads=1024 -thread_warp_size=32", "fused_layer_norm_matmul_tensorcore.cuda", [["TENSOR", [16, 4096], "float16"], ["TENSOR", [16], "float16"], ["TENSOR", [16], "float16"], ["TENSOR", [2048, 4096], "float16"], 0.000244140625], {}], "config": {"index": 1104, "code_hash": null, "entity": [["block_row_warps", "ot", 1], ["block_col_warps", "ot", 4], ["warp_row_tiles", "ot", 4], ["warp_col_tiles", "ot", 2], ["chunk", "ot", 2], ["offset", "ot", 8], ["offsetCS", "ot", 8], ["vec", "ot", 1], ["wmma_m", "ot", 16]]}, "result": [[0.00022800403], 0, 2.346224069595337, 1652007365.5405228], "version": 0.2, "tvm_version": "0.8.0"}
{"input": ["cuda -keys=cuda,gpu -max_num_threads=1024 -thread_warp_size=32", "fused_layer_norm_matmul_tensorcore.cuda", [["TENSOR", [16, 4096], "float16"], ["TENSOR", [16], "float16"], ["TENSOR", [16], "float16"], ["TENSOR", [2048, 4096], "float16"], 0.000244140625], {}], "config": {"index": 759, "code_hash": null, "entity": [["block_row_warps", "ot", 1], ["block_col_warps", "ot", 2], ["warp_row_tiles", "ot", 1], ["warp_col_tiles", "ot", 2], ["chunk", "ot", 2], ["offset", "ot", 0], ["offsetCS", "ot", 8], ["vec", "ot", 1], ["wmma_m", "ot", 16]]}, "result": [[0.000349103911], 0, 2.9836912155151367, 1652007367.71231], "version": 0.2, "tvm_version": "0.8.0"}
{"input": ["cuda -keys=cuda,gpu -max_num_threads=1024 -thread_warp_size=32", "fused_layer_norm_matmul_tensorcore.cuda", [["TENSOR", [16, 4096], "float16"], ["TENSOR", [16], "float16"], ["TENSOR", [16], "float16"], ["TENSOR", [2048, 4096], "float16"], 0.000244140625], {}], "config": {"index": 1065, "code_hash": null, "entity": [["block_row_warps", "ot", 1], ["block_col_warps", "ot", 2], ["warp_row_tiles", "ot", 2], ["warp_col_tiles", "ot", 1], ["chunk", "ot", 2], ["offset", "ot", 8], ["offsetCS", "ot", 8], ["vec", "ot", 1], ["wmma_m", "ot", 16]]}, "result": [[0.00031260102899999996], 0, 2.572894811630249, 1652007369.5677085], "version": 0.2, "tvm_version": "0.8.0"}
{"input": ["cuda -keys=cuda,gpu -max_num_threads=1024 -thread_warp_size=32", "fused_layer_norm_matmul_tensorcore.cuda", [["TENSOR", [16, 4096], "float16"], ["TENSOR", [16], "float16"], ["TENSOR", [16], "float16"], ["TENSOR", [2048, 4096], "float16"], 0.000244140625], {}], "config": {"index": 1056, "code_hash": null, "entity": [["block_row_warps", "ot", 1], ["block_col_warps", "ot", 2], ["warp_row_tiles", "ot", 1], ["warp_col_tiles", "ot", 1], ["chunk", "ot", 2], ["offset", "ot", 8], ["offsetCS", "ot", 8], ["vec", "ot", 1], ["wmma_m", "ot", 16]]}, "result": [[0.000311837219], 0, 2.604766607284546, 1652007371.3875444], "version": 0.2, "tvm_version": "0.8.0"}
{"input": ["cuda -keys=cuda,gpu -max_num_threads=1024 -thread_warp_size=32", "fused_layer_norm_matmul_tensorcore.cuda", [["TENSOR", [16, 4096], "float16"], ["TENSOR", [16], "float16"], ["TENSOR", [16], "float16"], ["TENSOR", [2048, 4096], "float16"], 0.000244140625], {}], "config": {"index": 5593, "code_hash": null, "entity": [["block_row_warps", "ot", 2], ["block_col_warps", "ot", 2], ["warp_row_tiles", "ot", 1], ["warp_col_tiles", "ot", 1], ["chunk", "ot", 2], ["offset", "ot", 8], ["offsetCS", "ot", 0], ["vec", "ot", 1], ["wmma_m", "ot", 8]]}, "result": [[0.000173381153], 0, 2.4100587368011475, 1652007373.0286782], "version": 0.2, "tvm_version": "0.8.0"}
{"input": ["cuda -keys=cuda,gpu -max_num_threads=1024 -thread_warp_size=32", "fused_layer_norm_matmul_tensorcore.cuda", [["TENSOR", [16, 4096], "float16"], ["TENSOR", [16], "float16"], ["TENSOR", [16], "float16"], ["TENSOR", [2048, 4096], "float16"], 0.000244140625], {}], "config": {"index": 1074, "code_hash": null, "entity": [["block_row_warps", "ot", 1], ["block_col_warps", "ot", 2], ["warp_row_tiles", "ot", 4], ["warp_col_tiles", "ot", 1], ["chunk", "ot", 2], ["offset", "ot", 8], ["offsetCS", "ot", 8], ["vec", "ot", 1], ["wmma_m", "ot", 16]]}, "result": [[0.00031131825199999996], 0, 2.5704872608184814, 1652007374.803701], "version": 0.2, "tvm_version": "0.8.0"}
{"input": ["cuda -keys=cuda,gpu -max_num_threads=1024 -thread_warp_size=32", "fused_layer_norm_matmul_tensorcore.cuda", [["TENSOR", [16, 4096], "float16"], ["TENSOR", [16], "float16"], ["TENSOR", [16], "float16"], ["TENSOR", [2048, 4096], "float16"], 0.000244140625], {}], "config": {"index": 1092, "code_hash": null, "entity": [["block_row_warps", "ot", 1], ["block_col_warps", "ot", 2], ["warp_row_tiles", "ot", 2], ["warp_col_tiles", "ot", 2], ["chunk", "ot", 2], ["offset", "ot", 8], ["offsetCS", "ot", 8], ["vec", "ot", 1], ["wmma_m", "ot", 16]]}, "result": [[0.000337159891], 0, 2.8374576568603516, 1652007376.8457532], "version": 0.2, "tvm_version": "0.8.0"}
{"input": ["cuda -keys=cuda,gpu -max_num_threads=1024 -thread_warp_size=32", "fused_layer_norm_matmul_tensorcore.cuda", [["TENSOR", [16, 4096], "float16"], ["TENSOR", [16], "float16"], ["TENSOR", [16], "float16"], ["TENSOR", [2048, 4096], "float16"], 0.000244140625], {}], "config": {"index": 5610, "code_hash": null, "entity": [["block_row_warps", "ot", 1], ["block_col_warps", "ot", 2], ["warp_row_tiles", "ot", 4], ["warp_col_tiles", "ot", 1], ["chunk", "ot", 2], ["offset", "ot", 8], ["offsetCS", "ot", 0], ["vec", "ot", 1], ["wmma_m", "ot", 8]]}, "result": [[0.00032997189300000004], 0, 2.862668037414551, 1652007378.9964807], "version": 0.2, "tvm_version": "0.8.0"}
{"input": ["cuda -keys=cuda,gpu -max_num_threads=1024 -thread_warp_size=32", "fused_layer_norm_matmul_tensorcore.cuda", [["TENSOR", [16, 4096], "float16"], ["TENSOR", [16], "float16"], ["TENSOR", [16], "float16"], ["TENSOR", [2048, 4096], "float16"], 0.000244140625], {}], "config": {"index": 5601, "code_hash": null, "entity": [["block_row_warps", "ot", 1], ["block_col_warps", "ot", 2], ["warp_row_tiles", "ot", 2], ["warp_col_tiles", "ot", 1], ["chunk", "ot", 2], ["offset", "ot", 8], ["offsetCS", "ot", 0], ["vec", "ot", 1], ["wmma_m", "ot", 8]]}, "result": [[0.00033123415099999996], 0, 2.6141624450683594, 1652007380.8508034], "version": 0.2, "tvm_version": "0.8.0"}
{"input": ["cuda -keys=cuda,gpu -max_num_threads=1024 -thread_warp_size=32", "fused_layer_norm_matmul_tensorcore.cuda", [["TENSOR", [16, 4096], "float16"], ["TENSOR", [16], "float16"], ["TENSOR", [16], "float16"], ["TENSOR", [2048, 4096], "float16"], 0.000244140625], {}], "config": {"index": 6249, "code_hash": null, "entity": [["block_row_warps", "ot", 1], ["block_col_warps", "ot", 2], ["warp_row_tiles", "ot", 2], ["warp_col_tiles", "ot", 1], ["chunk", "ot", 2], ["offset", "ot", 8], ["offsetCS", "ot", 8], ["vec", "ot", 1], ["wmma_m", "ot", 8]]}, "result": [[0.00032981974200000004], 0, 2.6502206325531006, 1652007382.7208583], "version": 0.2, "tvm_version": "0.8.0"}
{"input": ["cuda -keys=cuda,gpu -max_num_threads=1024 -thread_warp_size=32", "fused_layer_norm_matmul_tensorcore.cuda", [["TENSOR", [16, 4096], "float16"], ["TENSOR", [16], "float16"], ["TENSOR", [16], "float16"], ["TENSOR", [2048, 4096], "float16"], 0.000244140625], {}], "config": {"index": 5916, "code_hash": null, "entity": [["block_row_warps", "ot", 1], ["block_col_warps", "ot", 2], ["warp_row_tiles", "ot", 1], ["warp_col_tiles", "ot", 1], ["chunk", "ot", 2], ["offset", "ot", 0], ["offsetCS", "ot", 8], ["vec", "ot", 1], ["wmma_m", "ot", 8]]}, "result": [[0.000220709647], 0, 2.519198417663574, 1652007384.491769], "version": 0.2, "tvm_version": "0.8.0"}
{"input": ["cuda -keys=cuda,gpu -max_num_threads=1024 -thread_warp_size=32", "fused_layer_norm_matmul_tensorcore.cuda", [["TENSOR", [16, 4096], "float16"], ["TENSOR", [16], "float16"], ["TENSOR", [16], "float16"], ["TENSOR", [2048, 4096], "float16"], 0.000244140625], {}], "config": {"index": 5296, "code_hash": null, "entity": [["block_row_warps", "ot", 2], ["block_col_warps", "ot", 2], ["warp_row_tiles", "ot", 1], ["warp_col_tiles", "ot", 2], ["chunk", "ot", 2], ["offset", "ot", 0], ["offsetCS", "ot", 0], ["vec", "ot", 1], ["wmma_m", "ot", 8]]}, "result": [[0.00025705246899999993], 0, 2.360593795776367, 1652007386.131702], "version": 0.2, "tvm_version": "0.8.0"}
{"input": ["cuda -keys=cuda,gpu -max_num_threads=1024 -thread_warp_size=32", "fused_layer_norm_matmul_tensorcore.cuda", [["TENSOR", [16, 4096], "float16"], ["TENSOR", [16], "float16"], ["TENSOR", [16], "float16"], ["TENSOR", [2048, 4096], "float16"], 0.000244140625], {}], "config": {"index": 5277, "code_hash": null, "entity": [["block_row_warps", "ot", 1], ["block_col_warps", "ot", 2], ["warp_row_tiles", "ot", 2], ["warp_col_tiles", "ot", 1], ["chunk", "ot", 2], ["offset", "ot", 0], ["offsetCS", "ot", 0], ["vec", "ot", 1], ["wmma_m", "ot", 8]]}, "result": [[0.000340559887], 0, 2.762061595916748, 1652007388.143943], "version": 0.2, "tvm_version": "0.8.0"}
{"input": ["cuda -keys=cuda,gpu -max_num_threads=1024 -thread_warp_size=32", "fused_layer_norm_matmul_tensorcore.cuda", [["TENSOR", [16, 4096], "float16"], ["TENSOR", [16], "float16"], ["TENSOR", [16], "float16"], ["TENSOR", [2048, 4096], "float16"], 0.000244140625], {}], "config": {"index": 1101, "code_hash": null, "entity": [["block_row_warps", "ot", 1], ["block_col_warps", "ot", 2], ["warp_row_tiles", "ot", 4], ["warp_col_tiles", "ot", 2], ["chunk", "ot", 2], ["offset", "ot", 8], ["offsetCS", "ot", 8], ["vec", "ot", 1], ["wmma_m", "ot", 16]]}, "result": [[0.000339062371], 0, 2.842580556869507, 1652007390.24461], "version": 0.2, "tvm_version": "0.8.0"}
{"input": ["cuda -keys=cuda,gpu -max_num_threads=1024 -thread_warp_size=32", "fused_layer_norm_matmul_tensorcore.cuda", [["TENSOR", [16, 4096], "float16"], ["TENSOR", [16], "float16"], ["TENSOR", [16], "float16"], ["TENSOR", [2048, 4096], "float16"], 0.000244140625], {}], "config": {"index": 5925, "code_hash": null, "entity": [["block_row_warps", "ot", 1], ["block_col_warps", "ot", 2], ["warp_row_tiles", "ot", 2], ["warp_col_tiles", "ot", 1], ["chunk", "ot", 2], ["offset", "ot", 0], ["offsetCS", "ot", 8], ["vec", "ot", 1], ["wmma_m", "ot", 8]]}, "result": [[0.00034226814100000004], 0, 2.7698018550872803, 1652007392.2093809], "version": 0.2, "tvm_version": "0.8.0"}
{"input": ["cuda -keys=cuda,gpu -max_num_threads=1024 -thread_warp_size=32", "fused_layer_norm_matmul_tensorcore.cuda", [["TENSOR", [16, 4096], "float16"], ["TENSOR", [16], "float16"], ["TENSOR", [16], "float16"], ["TENSOR", [2048, 4096], "float16"], 0.000244140625], {}], "config": {"index": 6240, "code_hash": null, "entity": [["block_row_warps", "ot", 1], ["block_col_warps", "ot", 2], ["warp_row_tiles", "ot", 1], ["warp_col_tiles", "ot", 1], ["chunk", "ot", 2], ["offset", "ot", 8], ["offsetCS", "ot", 8], ["vec", "ot", 1], ["wmma_m", "ot", 8]]}, "result": [[0.000198839232], 0, 2.3562428951263428, 1652007393.746191], "version": 0.2, "tvm_version": "0.8.0"}
{"input": ["cuda -keys=cuda,gpu -max_num_threads=1024 -thread_warp_size=32", "fused_layer_norm_matmul_tensorcore.cuda", [["TENSOR", [16, 4096], "float16"], ["TENSOR", [16], "float16"], ["TENSOR", [16], "float16"], ["TENSOR", [2048, 4096], "float16"], 0.000244140625], {}], "config": {"index": 8121, "code_hash": null, "entity": [["block_row_warps", "ot", 1], ["block_col_warps", "ot", 2], ["warp_row_tiles", "ot", 4], ["warp_col_tiles", "ot", 1], ["chunk", "ot", 1], ["offset", "ot", 8], ["offsetCS", "ot", 0], ["vec", "ot", 4], ["wmma_m", "ot", 8]]}, "result": [[0.00016195160599999999], 0, 2.3966846466064453, 1652007395.3673885], "version": 0.2, "tvm_version": "0.8.0"}
{"input": ["cuda -keys=cuda,gpu -max_num_threads=1024 -thread_warp_size=32", "fused_layer_norm_matmul_tensorcore.cuda", [["TENSOR", [16, 4096], "float16"], ["TENSOR", [16], "float16"], ["TENSOR", [16], "float16"], ["TENSOR", [2048, 4096], "float16"], 0.000244140625], {}], "config": {"index": 3663, "code_hash": null, "entity": [["block_row_warps", "ot", 1], ["block_col_warps", "ot", 1], ["warp_row_tiles", "ot", 4], ["warp_col_tiles", "ot", 1], ["chunk", "ot", 2], ["offset", "ot", 8], ["offsetCS", "ot", 8], ["vec", "ot", 4], ["wmma_m", "ot", 16]]}, "result": [[0.00023392878099999997], 0, 2.292555332183838, 1652007397.002788], "version": 0.2, "tvm_version": "0.8.0"}
{"input": ["cuda -keys=cuda,gpu -max_num_threads=1024 -thread_warp_size=32", "fused_layer_norm_matmul_tensorcore.cuda", [["TENSOR", [16, 4096], "float16"], ["TENSOR", [16], "float16"], ["TENSOR", [16], "float16"], ["TENSOR", [2048, 4096], "float16"], 0.000244140625], {}], "config": {"index": 150, "code_hash": null, "entity": [["block_row_warps", "ot", 1], ["block_col_warps", "ot", 4], ["warp_row_tiles", "ot", 2], ["warp_col_tiles", "ot", 4], ["chunk", "ot", 2], ["offset", "ot", 0], ["offsetCS", "ot", 0], ["vec", "ot", 1], ["wmma_m", "ot", 16]]}, "result": [[0.000343842299], 0, 3.1383917331695557, 1652007417.8165894], "version": 0.2, "tvm_version": "0.8.0"}
{"input": ["cuda -keys=cuda,gpu -max_num_threads=1024 -thread_warp_size=32", "fused_layer_norm_matmul_tensorcore.cuda", [["TENSOR", [16, 4096], "float16"], ["TENSOR", [16], "float16"], ["TENSOR", [16], "float16"], ["TENSOR", [2048, 4096], "float16"], 0.000244140625], {}], "config": {"index": 483, "code_hash": null, "entity": [["block_row_warps", "ot", 1], ["block_col_warps", "ot", 4], ["warp_row_tiles", "ot", 4], ["warp_col_tiles", "ot", 4], ["chunk", "ot", 2], ["offset", "ot", 8], ["offsetCS", "ot", 0], ["vec", "ot", 1], ["wmma_m", "ot", 16]]}, "result": [[0.000248023126], 0, 2.7762110233306885, 1652007419.7247133], "version": 0.2, "tvm_version": "0.8.0"}
{"input": ["cuda -keys=cuda,gpu -max_num_threads=1024 -thread_warp_size=32", "fused_layer_norm_matmul_tensorcore.cuda", [["TENSOR", [16, 4096], "float16"], ["TENSOR", [16], "float16"], ["TENSOR", [16], "float16"], ["TENSOR", [2048, 4096], "float16"], 0.000244140625], {}], "config": {"index": 294, "code_hash": null, "entity": [["block_row_warps", "ot", 1], ["block_col_warps", "ot", 4], ["warp_row_tiles", "ot", 4], ["warp_col_tiles", "ot", 2], ["chunk", "ot", 8], ["offset", "ot", 0], ["offsetCS", "ot", 0], ["vec", "ot", 1], ["wmma_m", "ot", 16]]}, "result": [[0.00025999779], 0, 2.4855477809906006, 1652007421.3357656], "version": 0.2, "tvm_version": "0.8.0"}
{"input": ["cuda -keys=cuda,gpu -max_num_threads=1024 -thread_warp_size=32", "fused_layer_norm_matmul_tensorcore.cuda", [["TENSOR", [16, 4096], "float16"], ["TENSOR", [16], "float16"], ["TENSOR", [16], "float16"], ["TENSOR", [2048, 4096], "float16"], 0.000244140625], {}], "config": {"index": 5451, "code_hash": null, "entity": [["block_row_warps", "ot", 1], ["block_col_warps", "ot", 4], ["warp_row_tiles", "ot", 4], ["warp_col_tiles", "ot", 1], ["chunk", "ot", 8], ["offset", "ot", 0], ["offsetCS", "ot", 0], ["vec", "ot", 1], ["wmma_m", "ot", 8]]}, "result": [[0.00026082286699999997], 0, 2.650437116622925, 1652007423.186608], "version": 0.2, "tvm_version": "0.8.0"}
{"input": ["cuda -keys=cuda,gpu -max_num_threads=1024 -thread_warp_size=32", "fused_layer_norm_matmul_tensorcore.cuda", [["TENSOR", [16, 4096], "float16"], ["TENSOR", [16], "float16"], ["TENSOR", [16], "float16"], ["TENSOR", [2048, 4096], "float16"], 0.000244140625], {}], "config": {"index": 1509, "code_hash": null, "entity": [["block_row_warps", "ot", 1], ["block_col_warps", "ot", 4], ["warp_row_tiles", "ot", 4], ["warp_col_tiles", "ot", 2], ["chunk", "ot", 4], ["offset", "ot", 0], ["offsetCS", "ot", 0], ["vec", "ot", 2], ["wmma_m", "ot", 16]]}, "result": [[0.00017720625899999998], 0, 2.414069890975952, 1652007424.8343182], "version": 0.2, "tvm_version": "0.8.0"}
{"input": ["cuda -keys=cuda,gpu -max_num_threads=1024 -thread_warp_size=32", "fused_layer_norm_matmul_tensorcore.cuda", [["TENSOR", [16, 4096], "float16"], ["TENSOR", [16], "float16"], ["TENSOR", [16], "float16"], ["TENSOR", [2048, 4096], "float16"], 0.000244140625], {}], "config": {"index": 480, "code_hash": null, "entity": [["block_row_warps", "ot", 1], ["block_col_warps", "ot", 2], ["warp_row_tiles", "ot", 4], ["warp_col_tiles", "ot", 4], ["chunk", "ot", 2], ["offset", "ot", 8], ["offsetCS", "ot", 0], ["vec", "ot", 1], ["wmma_m", "ot", 16]]}, "result": [[0.000350904653], 0, 2.9400482177734375, 1652007426.7806566], "version": 0.2, "tvm_version": "0.8.0"}
{"input": ["cuda -keys=cuda,gpu -max_num_threads=1024 -thread_warp_size=32", "fused_layer_norm_matmul_tensorcore.cuda", [["TENSOR", [16, 4096], "float16"], ["TENSOR", [16], "float16"], ["TENSOR", [16], "float16"], ["TENSOR", [2048, 4096], "float16"], 0.000244140625], {}], "config": {"index": 465, "code_hash": null, "entity": [["block_row_warps", "ot", 1], ["block_col_warps", "ot", 4], ["warp_row_tiles", "ot", 1], ["warp_col_tiles", "ot", 4], ["chunk", "ot", 2], ["offset", "ot", 8], ["offsetCS", "ot", 0], ["vec", "ot", 1], ["wmma_m", "ot", 16]]}, "result": [[0.000247081033], 0, 2.795396089553833, 1652007428.5795414], "version": 0.2, "tvm_version": "0.8.0"}
{"input": ["cuda -keys=cuda,gpu -max_num_threads=1024 -thread_warp_size=32", "fused_layer_norm_matmul_tensorcore.cuda", [["TENSOR", [16, 4096], "float16"], ["TENSOR", [16], "float16"], ["TENSOR", [16], "float16"], ["TENSOR", [2048, 4096], "float16"], 0.000244140625], {}], "config": {"index": 5595, "code_hash": null, "entity": [["block_row_warps", "ot", 1], ["block_col_warps", "ot", 4], ["warp_row_tiles", "ot", 1], ["warp_col_tiles", "ot", 1], ["chunk", "ot", 2], ["offset", "ot", 8], ["offsetCS", "ot", 0], ["vec", "ot", 1], ["wmma_m", "ot", 8]]}, "result": [[0.000147643758], 0, 1.9502203464508057, 1652007429.897232], "version": 0.2, "tvm_version": "0.8.0"}
{"input": ["cuda -keys=cuda,gpu -max_num_threads=1024 -thread_warp_size=32", "fused_layer_norm_matmul_tensorcore.cuda", [["TENSOR", [16, 4096], "float16"], ["TENSOR", [16], "float16"], ["TENSOR", [16], "float16"], ["TENSOR", [2048, 4096], "float16"], 0.000244140625], {}], "config": {"index": 5745, "code_hash": null, "entity": [["block_row_warps", "ot", 1], ["block_col_warps", "ot", 2], ["warp_row_tiles", "ot", 4], ["warp_col_tiles", "ot", 4], ["chunk", "ot", 4], ["offset", "ot", 8], ["offsetCS", "ot", 0], ["vec", "ot", 1], ["wmma_m", "ot", 8]]}, "result": [[0.000507503708], 0, 3.5337395668029785, 1652007432.5155993], "version": 0.2, "tvm_version": "0.8.0"}
{"input": ["cuda -keys=cuda,gpu -max_num_threads=1024 -thread_warp_size=32", "fused_layer_norm_matmul_tensorcore.cuda", [["TENSOR", [16, 4096], "float16"], ["TENSOR", [16], "float16"], ["TENSOR", [16], "float16"], ["TENSOR", [2048, 4096], "float16"], 0.000244140625], {}], "config": {"index": 2499, "code_hash": null, "entity": [["block_row_warps", "ot", 1], ["block_col_warps", "ot", 4], ["warp_row_tiles", "ot", 2], ["warp_col_tiles", "ot", 4], ["chunk", "ot", 4], ["offset", "ot", 8], ["offsetCS", "ot", 8], ["vec", "ot", 2], ["wmma_m", "ot", 16]]}, "result": [[0.00013633697], 0, 2.4039559364318848, 1652007434.1085615], "version": 0.2, "tvm_version": "0.8.0"}
{"input": ["cuda -keys=cuda,gpu -max_num_threads=1024 -thread_warp_size=32", "fused_layer_norm_matmul_tensorcore.cuda", [["TENSOR", [16, 4096], "float16"], ["TENSOR", [16], "float16"], ["TENSOR", [16], "float16"], ["TENSOR", [2048, 4096], "float16"], 0.000244140625], {}], "config": {"index": 5704, "code_hash": null, "entity": [["block_row_warps", "ot", 2], ["block_col_warps", "ot", 4], ["warp_row_tiles", "ot", 1], ["warp_col_tiles", "ot", 2], ["chunk", "ot", 4], ["offset", "ot", 8], ["offsetCS", "ot", 0], ["vec", "ot", 1], ["wmma_m", "ot", 8]]}, "result": [[0.000170228463], 0, 2.2669761180877686, 1652007435.592368], "version": 0.2, "tvm_version": "0.8.0"}
{"input": ["cuda -keys=cuda,gpu -max_num_threads=1024 -thread_warp_size=32", "fused_layer_norm_matmul_tensorcore.cuda", [["TENSOR", [16, 4096], "float16"], ["TENSOR", [16], "float16"], ["TENSOR", [16], "float16"], ["TENSOR", [2048, 4096], "float16"], 0.000244140625], {}], "config": {"index": 1500, "code_hash": null, "entity": [["block_row_warps", "ot", 1], ["block_col_warps", "ot", 4], ["warp_row_tiles", "ot", 2], ["warp_col_tiles", "ot", 2], ["chunk", "ot", 4], ["offset", "ot", 0], ["offsetCS", "ot", 0], ["vec", "ot", 2], ["wmma_m", "ot", 16]]}, "result": [[0.000178990026], 0, 2.469575881958008, 1652007437.1769495], "version": 0.2, "tvm_version": "0.8.0"}
{"input": ["cuda -keys=cuda,gpu -max_num_threads=1024 -thread_warp_size=32", "fused_layer_norm_matmul_tensorcore.cuda", [["TENSOR", [16, 4096], "float16"], ["TENSOR", [16], "float16"], ["TENSOR", [16], "float16"], ["TENSOR", [2048, 4096], "float16"], 0.000244140625], {}], "config": {"index": 867, "code_hash": null, "entity": [["block_row_warps", "ot", 1], ["block_col_warps", "ot", 2], ["warp_row_tiles", "ot", 1], ["warp_col_tiles", "ot", 4], ["chunk", "ot", 4], ["offset", "ot", 0], ["offsetCS", "ot", 8], ["vec", "ot", 1], ["wmma_m", "ot", 16]]}, "result": [[0.000427147553], 0, 3.204521656036377, 1652007439.375324], "version": 0.2, "tvm_version": "0.8.0"}
{"input": ["cuda -keys=cuda,gpu -max_num_threads=1024 -thread_warp_size=32", "fused_layer_norm_matmul_tensorcore.cuda", [["TENSOR", [16, 4096], "float16"], ["TENSOR", [16], "float16"], ["TENSOR", [16], "float16"], ["TENSOR", [2048, 4096], "float16"], 0.000244140625], {}], "config": {"index": 561, "code_hash": null, "entity": [["block_row_warps", "ot", 1], ["block_col_warps", "ot", 2], ["warp_row_tiles", "ot", 4], ["warp_col_tiles", "ot", 4], ["chunk", "ot", 4], ["offset", "ot", 8], ["offsetCS", "ot", 0], ["vec", "ot", 1], ["wmma_m", "ot", 16]]}, "result": [[0.000378289374], 0, 2.9472336769104004, 1652007441.4815803], "version": 0.2, "tvm_version": "0.8.0"}
{"input": ["cuda -keys=cuda,gpu -max_num_threads=1024 -thread_warp_size=32", "fused_layer_norm_matmul_tensorcore.cuda", [["TENSOR", [16, 4096], "float16"], ["TENSOR", [16], "float16"], ["TENSOR", [16], "float16"], ["TENSOR", [2048, 4096], "float16"], 0.000244140625], {}], "config": {"index": 474, "code_hash": null, "entity": [["block_row_warps", "ot", 1], ["block_col_warps", "ot", 4], ["warp_row_tiles", "ot", 2], ["warp_col_tiles", "ot", 4], ["chunk", "ot", 2], ["offset", "ot", 8], ["offsetCS", "ot", 0], ["vec", "ot", 1], ["wmma_m", "ot", 16]]}, "result": [[0.000247243564], 0, 2.6890976428985596, 1652007443.2493103], "version": 0.2, "tvm_version": "0.8.0"}
