python/models/swin_transformer/kernel_configs/swin_transform_auto_tvm_tune_attn_v_pad_matmul_tensorcore_1_56_56_4_7.log
{"input": ["cuda -keys=cuda,gpu -max_num_threads=1024 -thread_warp_size=32", "attn_v_pad_matmul.cuda", [["TENSOR", [256, 49, 49], "float16"], ["TENSOR", [256, 32, 49], "float16"]], {}], "config": {"index": 2819, "code_hash": null, "entity": [["block_row_warps", "ot", 4], ["block_col_warps", "ot", 1], ["warp_row_tiles", "ot", 2], ["warp_col_tiles", "ot", 4], ["chunk", "ot", 4], ["offset", "ot", 0], ["offsetCS", "ot", 0], ["vec", "ot", 4], ["wmma_m", "ot", 32]]}, "result": [[2.499991e-05], 0, 1.7414774894714355, 1651924467.390127], "version": 0.2, "tvm_version": "0.8.0"}
{"input": ["cuda -keys=cuda,gpu -max_num_threads=1024 -thread_warp_size=32", "attn_v_pad_matmul.cuda", [["TENSOR", [256, 49, 49], "float16"], ["TENSOR", [256, 32, 49], "float16"]], {}], "config": {"index": 1626, "code_hash": null, "entity": [["block_row_warps", "ot", 1], ["block_col_warps", "ot", 4], ["warp_row_tiles", "ot", 1], ["warp_col_tiles", "ot", 1], ["chunk", "ot", 1], ["offset", "ot", 8], ["offsetCS", "ot", 0], ["vec", "ot", 2], ["wmma_m", "ot", 32]]}, "result": [[1.9423733e-05], 0, 1.6194665431976318, 1651924468.009747], "version": 0.2, "tvm_version": "0.8.0"}
{"input": ["cuda -keys=cuda,gpu -max_num_threads=1024 -thread_warp_size=32", "attn_v_pad_matmul.cuda", [["TENSOR", [256, 49, 49], "float16"], ["TENSOR", [256, 32, 49], "float16"]], {}], "config": {"index": 276, "code_hash": null, "entity": [["block_row_warps", "ot", 1], ["block_col_warps", "ot", 4], ["warp_row_tiles", "ot", 1], ["warp_col_tiles", "ot", 2], ["chunk", "ot", 8], ["offset", "ot", 0], ["offsetCS", "ot", 0], ["vec", "ot", 1], ["wmma_m", "ot", 32]]}, "result": [[3.2392874e-05], 0, 1.5728983879089355, 1651924469.730101], "version": 0.2, "tvm_version": "0.8.0"}
{"input": ["cuda -keys=cuda,gpu -max_num_threads=1024 -thread_warp_size=32", "attn_v_pad_matmul.cuda", [["TENSOR", [256, 49, 49], "float16"], ["TENSOR", [256, 32, 49], "float16"]], {}], "config": {"index": 7294, "code_hash": null, "entity": [["block_row_warps", "ot", 2], ["block_col_warps", "ot", 2], ["warp_row_tiles", "ot", 1], ["warp_col_tiles", "ot", 1], ["chunk", "ot", 4], ["offset", "ot", 0], ["offsetCS", "ot", 8], ["vec", "ot", 2], ["wmma_m", "ot", 16]]}, "result": [[3.1612449e-05], 0, 1.7284131050109863, 1651924471.4754395], "version": 0.2, "tvm_version": "0.8.0"}
{"input": ["cuda -keys=cuda,gpu -max_num_threads=1024 -thread_warp_size=32", "attn_v_pad_matmul.cuda", [["TENSOR", [256, 49, 49], "float16"], ["TENSOR", [256, 32, 49], "float16"]], {}], "config": {"index": 1672, "code_hash": null, "entity": [["block_row_warps", "ot", 2], ["block_col_warps", "ot", 4], ["warp_row_tiles", "ot", 4], ["warp_col_tiles", "ot", 2], ["chunk", "ot", 1], ["offset", "ot", 8], ["offsetCS", "ot", 0], ["vec", "ot", 2], ["wmma_m", "ot", 32]]}, "result": [[2.8673891e-05], 0, 1.7337663173675537, 1651924473.1042523], "version": 0.2, "tvm_version": "0.8.0"}
{"input": ["cuda -keys=cuda,gpu -max_num_threads=1024 -thread_warp_size=32", "attn_v_pad_matmul.cuda", [["TENSOR", [256, 49, 49], "float16"], ["TENSOR", [256, 32, 49], "float16"]], {}], "config": {"index": 3637, "code_hash": null, "entity": [["block_row_warps", "ot", 2], ["block_col_warps", "ot", 1], ["warp_row_tiles", "ot", 4], ["warp_col_tiles", "ot", 4], ["chunk", "ot", 1], ["offset", "ot", 8], ["offsetCS", "ot", 8], ["vec", "ot", 4], ["wmma_m", "ot", 32]]}, "result": [[1.5033618e-05], 0, 1.913416862487793, 1651924473.7597072], "version": 0.2, "tvm_version": "0.8.0"}
{"input": ["cuda -keys=cuda,gpu -max_num_threads=1024 -thread_warp_size=32", "attn_v_pad_matmul.cuda", [["TENSOR", [256, 49, 49], "float16"], ["TENSOR", [256, 32, 49], "float16"]], {}], "config": {"index": 6763, "code_hash": null, "entity": [["block_row_warps", "ot", 2], ["block_col_warps", "ot", 2], ["warp_row_tiles", "ot", 2], ["warp_col_tiles", "ot", 2], ["chunk", "ot", 8], ["offset", "ot", 0], ["offsetCS", "ot", 0], ["vec", "ot", 2], ["wmma_m", "ot", 16]]}, "result": [[2.9174059e-05], 0, 1.800184726715088, 1651924475.4820457], "version": 0.2, "tvm_version": "0.8.0"}
{"input": ["cuda -keys=cuda,gpu -max_num_threads=1024 -thread_warp_size=32", "attn_v_pad_matmul.cuda", [["TENSOR", [256, 49, 49], "float16"], ["TENSOR", [256, 32, 49], "float16"]], {}], "config": {"index": 9363, "code_hash": null, "entity": [["block_row_warps", "ot", 1], ["block_col_warps", "ot", 2], ["warp_row_tiles", "ot", 4], ["warp_col_tiles", "ot", 2], ["chunk", "ot", 8], ["offset", "ot", 0], ["offsetCS", "ot", 0], ["vec", "ot", 8], ["wmma_m", "ot", 16]]}, "result": [[2.4044015000000003e-05], 0, 1.7276959419250488, 1651924477.2437043], "version": 0.2, "tvm_version": "0.8.0"}
{"input": ["cuda -keys=cuda,gpu -max_num_threads=1024 -thread_warp_size=32", "attn_v_pad_matmul.cuda", [["TENSOR", [256, 49, 49], "float16"], ["TENSOR", [256, 32, 49], "float16"]], {}], "config": {"index": 1421, "code_hash": null, "entity": [["block_row_warps", "ot", 4], ["block_col_warps", "ot", 4], ["warp_row_tiles", "ot", 2], ["warp_col_tiles", "ot", 2], ["chunk", "ot", 2], ["offset", "ot", 0], ["offsetCS", "ot", 0], ["vec", "ot", 2], ["wmma_m", "ot", 32]]}, "result": [[7.1643475e-05], 0, 1.8465356826782227, 1651924479.1047103], "version": 0.2, "tvm_version": "0.8.0"}
{"input": ["cuda -keys=cuda,gpu -max_num_threads=1024 -thread_warp_size=32", "attn_v_pad_matmul.cuda", [["TENSOR", [256, 49, 49], "float16"], ["TENSOR", [256, 32, 49], "float16"]], {}], "config": {"index": 12968, "code_hash": null, "entity": [["block_row_warps", "ot", 4], ["block_col_warps", "ot", 4], ["warp_row_tiles", "ot", 1], ["warp_col_tiles", "ot", 1], ["chunk", "ot", 1], ["offset", "ot", 0], ["offsetCS", "ot", 0], ["vec", "ot", 4], ["wmma_m", "ot", 8]]}, "result": [[5.1733146e-05], 0, 1.8759539127349854, 1651924479.8529682], "version": 0.2, "tvm_version": "0.8.0"}
{"input": ["cuda -keys=cuda,gpu -max_num_threads=1024 -thread_warp_size=32", "attn_v_pad_matmul.cuda", [["TENSOR", [256, 49, 49], "float16"], ["TENSOR", [256, 32, 49], "float16"]], {}], "config": {"index": 2415, "code_hash": null, "entity": [["block_row_warps", "ot", 1], ["block_col_warps", "ot", 2], ["warp_row_tiles", "ot", 2], ["warp_col_tiles", "ot", 4], ["chunk", "ot", 2], ["offset", "ot", 8], ["offsetCS", "ot", 8], ["vec", "ot", 2], ["wmma_m", "ot", 32]]}, "result": [[1.1318967000000001e-05], 0, 1.5164079666137695, 1651924484.6589673], "version": 0.2, "tvm_version": "0.8.0"}
{"input": ["cuda -keys=cuda,gpu -max_num_threads=1024 -thread_warp_size=32", "attn_v_pad_matmul.cuda", [["TENSOR", [256, 49, 49], "float16"], ["TENSOR", [256, 32, 49], "float16"]], {}], "config": {"index": 8360, "code_hash": null, "entity": [["block_row_warps", "ot", 4], ["block_col_warps", "ot", 4], ["warp_row_tiles", "ot", 2], ["warp_col_tiles", "ot", 1], ["chunk", "ot", 8], ["offset", "ot", 8], ["offsetCS", "ot", 0], ["vec", "ot", 4], ["wmma_m", "ot", 16]]}, "result": [[4.5479383e-05], 0, 1.5364677906036377, 1651924485.3956242], "version": 0.2, "tvm_version": "0.8.0"}
{"input": ["cuda -keys=cuda,gpu -max_num_threads=1024 -thread_warp_size=32", "attn_v_pad_matmul.cuda", [["TENSOR", [256, 49, 49], "float16"], ["TENSOR", [256, 32, 49], "float16"]], {}], "config": {"index": 7314, "code_hash": null, "entity": [["block_row_warps", "ot", 1], ["block_col_warps", "ot", 4], ["warp_row_tiles", "ot", 4], ["warp_col_tiles", "ot", 1], ["chunk", "ot", 4], ["offset", "ot", 0], ["offsetCS", "ot", 8], ["vec", "ot", 2], ["wmma_m", "ot", 16]]}, "result": [[3.0068826e-05], 0, 1.639716386795044, 1651924487.2593637], "version": 0.2, "tvm_version": "0.8.0"}
{"input": ["cuda -keys=cuda,gpu -max_num_threads=1024 -thread_warp_size=32", "attn_v_pad_matmul.cuda", [["TENSOR", [256, 49, 49], "float16"], ["TENSOR", [256, 32, 49], "float16"]], {}], "config": {"index": 4839, "code_hash": null, "entity": [["block_row_warps", "ot", 1], ["block_col_warps", "ot", 4], ["warp_row_tiles", "ot", 1], ["warp_col_tiles", "ot", 4], ["chunk", "ot", 8], ["offset", "ot", 0], ["offsetCS", "ot", 8], ["vec", "ot", 8], ["wmma_m", "ot", 32]]}, "result": [[2.4829653e-05], 0, 1.723386526107788, 1651924489.116405], "version": 0.2, "tvm_version": "0.8.0"}
{"input": ["cuda -keys=cuda,gpu -max_num_threads=1024 -thread_warp_size=32", "attn_v_pad_matmul.cuda", [["TENSOR", [256, 49, 49], "float16"], ["TENSOR", [256, 32, 49], "float16"]], {}], "config": {"index": 8716, "code_hash": null, "entity": [["block_row_warps", "ot", 2], ["block_col_warps", "ot", 2], ["warp_row_tiles", "ot", 4], ["warp_col_tiles", "ot", 2], ["chunk", "ot", 8], ["offset", "ot", 0], ["offsetCS", "ot", 8], ["vec", "ot", 4], ["wmma_m", "ot", 16]]}, "result": [[2.4077788000000002e-05], 0, 1.7946677207946777, 1651924490.8201816], "version": 0.2, "tvm_version": "0.8.0"}
{"input": ["cuda -keys=cuda,gpu -max_num_threads=1024 -thread_warp_size=32", "attn_v_pad_matmul.cuda", [["TENSOR", [256, 49, 49], "float16"], ["TENSOR", [256, 32, 49], "float16"]], {}], "config": {"index": 627, "code_hash": null, "entity": [["block_row_warps", "ot", 1], ["block_col_warps", "ot", 4], ["warp_row_tiles", "ot", 1], ["warp_col_tiles", "ot", 4], ["chunk", "ot", 8], ["offset", "ot", 8], ["offsetCS", "ot", 0], ["vec", "ot", 1], ["wmma_m", "ot", 32]]}, "result": [[1.3587699999999999e-05], 0, 1.5030457973480225, 1651924491.5054305], "version": 0.2, "tvm_version": "0.8.0"}
{"input": ["cuda -keys=cuda,gpu -max_num_threads=1024 -thread_warp_size=32", "attn_v_pad_matmul.cuda", [["TENSOR", [256, 49, 49], "float16"], ["TENSOR", [256, 32, 49], "float16"]], {}], "config": {"index": 4720, "code_hash": null, "entity": [["block_row_warps", "ot", 2], ["block_col_warps", "ot", 2], ["warp_row_tiles", "ot", 4], ["warp_col_tiles", "ot", 1], ["chunk", "ot", 4], ["offset", "ot", 0], ["offsetCS", "ot", 8], ["vec", "ot", 8], ["wmma_m", "ot", 32]]}, "result": [[5.4048152000000004e-05], 0, 1.8118915557861328, 1651924493.3209448], "version": 0.2, "tvm_version": "0.8.0"}
{"input": ["cuda -keys=cuda,gpu -max_num_threads=1024 -thread_warp_size=32", "attn_v_pad_matmul.cuda", [["TENSOR", [256, 49, 49], "float16"], ["TENSOR", [256, 32, 49], "float16"]], {}], "config": {"index": 1366, "code_hash": null, "entity": [["block_row_warps", "ot", 2], ["block_col_warps", "ot", 4], ["warp_row_tiles", "ot", 2], ["warp_col_tiles", "ot", 4], ["chunk", "ot", 1], ["offset", "ot", 0], ["offsetCS", "ot", 0], ["vec", "ot", 2], ["wmma_m", "ot", 32]]}, "result": [[2.6291675e-05], 0, 1.5189340114593506, 1651924496.045142], "version": 0.2, "tvm_version": "0.8.0"}
{"input": ["cuda -keys=cuda,gpu -max_num_threads=1024 -thread_warp_size=32", "attn_v_pad_matmul.cuda", [["TENSOR", [256, 49, 49], "float16"], ["TENSOR", [256, 32, 49], "float16"]], {}], "config": {"index": 655, "code_hash": null, "entity": [["block_row_warps", "ot", 2], ["block_col_warps", "ot", 4], ["warp_row_tiles", "ot", 1], ["warp_col_tiles", "ot", 1], ["chunk", "ot", 1], ["offset", "ot", 0], ["offsetCS", "ot", 8], ["vec", "ot", 1], ["wmma_m", "ot", 32]]}, "result": [[3.4556691e-05], 0, 1.577608585357666, 1651924496.78749], "version": 0.2, "tvm_version": "0.8.0"}
{"input": ["cuda -keys=cuda,gpu -max_num_threads=1024 -thread_warp_size=32", "attn_v_pad_matmul.cuda", [["TENSOR", [256, 49, 49], "float16"], ["TENSOR", [256, 32, 49], "float16"]], {}], "config": {"index": 8717, "code_hash": null, "entity": [["block_row_warps", "ot", 4], ["block_col_warps", "ot", 2], ["warp_row_tiles", "ot", 4], ["warp_col_tiles", "ot", 2], ["chunk", "ot", 8], ["offset", "ot", 0], ["offsetCS", "ot", 8], ["vec", "ot", 4], ["wmma_m", "ot", 16]]}, "result": [[2.9836621e-05], 0, 1.7056119441986084, 1651924497.5355568], "version": 0.2, "tvm_version": "0.8.0"}
{"input": ["cuda -keys=cuda,gpu -max_num_threads=1024 -thread_warp_size=32", "attn_v_pad_matmul.cuda", [["TENSOR", [256, 49, 49], "float16"], ["TENSOR", [256, 32, 49], "float16"]], {}], "config": {"index": 8799, "code_hash": null, "entity": [["block_row_warps", "ot", 1], ["block_col_warps", "ot", 4], ["warp_row_tiles", "ot", 4], ["warp_col_tiles", "ot", 2], ["chunk", "ot", 1], ["offset", "ot", 8], ["offsetCS", "ot", 8], ["vec", "ot", 4], ["wmma_m", "ot", 16]]}, "result": [[9.702538936959208e-06], 0, 1.6260969638824463, 1651924499.2439623], "version": 0.2, "tvm_version": "0.8.0"}
{"input": ["cuda -keys=cuda,gpu -max_num_threads=1024 -thread_warp_size=32", "attn_v_pad_matmul.cuda", [["TENSOR", [256, 49, 49], "float16"], ["TENSOR", [256, 32, 49], "float16"]], {}], "config": {"index": 645, "code_hash": null, "entity": [["block_row_warps", "ot", 1], ["block_col_warps", "ot", 4], ["warp_row_tiles", "ot", 4], ["warp_col_tiles", "ot", 4], ["chunk", "ot", 8], ["offset", "ot", 8], ["offsetCS", "ot", 0], ["vec", "ot", 1], ["wmma_m", "ot", 32]]}, "result": [[1.7618097e-05], 0, 1.8042469024658203, 1651924501.0219402], "version": 0.2, "tvm_version": "0.8.0"}
{"input": ["cuda -keys=cuda,gpu -max_num_threads=1024 -thread_warp_size=32", "attn_v_pad_matmul.cuda", [["TENSOR", [256, 49, 49], "float16"], ["TENSOR", [256, 32, 49], "float16"]], {}], "config": {"index": 7952, "code_hash": null, "entity": [["block_row_warps", "ot", 4], ["block_col_warps", "ot", 2], ["warp_row_tiles", "ot", 2], ["warp_col_tiles", "ot", 1], ["chunk", "ot", 4], ["offset", "ot", 0], ["offsetCS", "ot", 0], ["vec", "ot", 4], ["wmma_m", "ot", 16]]}, "result": [[6.5687673e-05], 0, 1.6681900024414062, 1651924501.8373137], "version": 0.2, "tvm_version": "0.8.0"}
{"input": ["cuda -keys=cuda,gpu -max_num_threads=1024 -thread_warp_size=32", "attn_v_pad_matmul.cuda", [["TENSOR", [256, 49, 49], "float16"], ["TENSOR", [256, 32, 49], "float16"]], {}], "config": {"index": 6895, "code_hash": null, "entity": [["block_row_warps", "ot", 2], ["block_col_warps", "ot", 1], ["warp_row_tiles", "ot", 2], ["warp_col_tiles", "ot", 1], ["chunk", "ot", 2], ["offset", "ot", 8], ["offsetCS", "ot", 0], ["vec", "ot", 2], ["wmma_m", "ot", 16]]}, "result": [[1.3288567000000002e-05], 0, 1.5153985023498535, 1651924506.5012207], "version": 0.2, "tvm_version": "0.8.0"}
{"input": ["cuda -keys=cuda,gpu -max_num_threads=1024 -thread_warp_size=32", "attn_v_pad_matmul.cuda", [["TENSOR", [256, 49, 49], "float16"], ["TENSOR", [256, 32, 49], "float16"]], {}], "config": {"index": 1473, "code_hash": null, "entity": [["block_row_warps", "ot", 1], ["block_col_warps", "ot", 4], ["warp_row_tiles", "ot", 2], ["warp_col_tiles", "ot", 1], ["chunk", "ot", 4], ["offset", "ot", 0], ["offsetCS", "ot", 0], ["vec", "ot", 2], ["wmma_m", "ot", 32]]}, "result": [[4.7723597e-05], 0, 1.6246092319488525, 1651924508.2933185], "version": 0.2, "tvm_version": "0.8.0"}
{"input": ["cuda -keys=cuda,gpu -max_num_threads=1024 -thread_warp_size=32", "attn_v_pad_matmul.cuda", [["TENSOR", [256, 49, 49], "float16"], ["TENSOR", [256, 32, 49], "float16"]], {}], "config": {"index": 6424, "code_hash": null, "entity": [["block_row_warps", "ot", 2], ["block_col_warps", "ot", 4], ["warp_row_tiles", "ot", 4], ["warp_col_tiles", "ot", 1], ["chunk", "ot", 8], ["offset", "ot", 8], ["offsetCS", "ot", 8], ["vec", "ot", 1], ["wmma_m", "ot", 16]]}, "result": [[9.352575401730531e-06], 0, 1.5400824546813965, 1651924510.0416305], "version": 0.2, "tvm_version": "0.8.0"}
{"input": ["cuda -keys=cuda,gpu -max_num_threads=1024 -thread_warp_size=32", "attn_v_pad_matmul.cuda", [["TENSOR", [256, 49, 49], "float16"], ["TENSOR", [256, 32, 49], "float16"]], {}], "config": {"index": 7384, "code_hash": null, "entity": [["block_row_warps", "ot", 2], ["block_col_warps", "ot", 2], ["warp_row_tiles", "ot", 2], ["warp_col_tiles", "ot", 1], ["chunk", "ot", 8], ["offset", "ot", 0], ["offsetCS", "ot", 8], ["vec", "ot", 2], ["wmma_m", "ot", 16]]}, "result": [[3.0753828e-05], 0, 1.5958647727966309, 1651924510.74324], "version": 0.2, "tvm_version": "0.8.0"}
{"input": ["cuda -keys=cuda,gpu -max_num_threads=1024 -thread_warp_size=32", "attn_v_pad_matmul.cuda", [["TENSOR", [256, 49, 49], "float16"], ["TENSOR", [256, 32, 49], "float16"]], {}], "config": {"index": 10695, "code_hash": null, "entity": [["block_row_warps", "ot", 1], ["block_col_warps", "ot", 2], ["warp_row_tiles", "ot", 1], ["warp_col_tiles", "ot", 1], ["chunk", "ot", 1], ["offset", "ot", 8], ["offsetCS", "ot", 0], ["vec", "ot", 1], ["wmma_m", "ot", 8]]}, "result": [[1.6854032000000002e-05], 0, 1.4562742710113525, 1651924512.3783126], "version": 0.2, "tvm_version": "0.8.0"}
{"input": ["cuda -keys=cuda,gpu -max_num_threads=1024 -thread_warp_size=32", "attn_v_pad_matmul.cuda", [["TENSOR", [256, 49, 49], "float16"], ["TENSOR", [256, 32, 49], "float16"]], {}], "config": {"index": 8192, "code_hash": null, "entity": [["block_row_warps", "ot", 4], ["block_col_warps", "ot", 1], ["warp_row_tiles", "ot", 2], ["warp_col_tiles", "ot", 1], ["chunk", "ot", 2], ["offset", "ot", 8], ["offsetCS", "ot", 0], ["vec", "ot", 4], ["wmma_m", "ot", 16]]}, "result": [[1.7361918e-05], 0, 1.6320197582244873, 1651924513.0526075], "version": 0.2, "tvm_version": "0.8.0"}
{"input": ["cuda -keys=cuda,gpu -max_num_threads=1024 -thread_warp_size=32", "attn_v_pad_matmul.cuda", [["TENSOR", [256, 49, 49], "float16"], ["TENSOR", [256, 32, 49], "float16"]], {}], "config": {"index": 12163, "code_hash": null, "entity": [["block_row_warps", "ot", 2], ["block_col_warps", "ot", 2], ["warp_row_tiles", "ot", 2], ["warp_col_tiles", "ot", 1], ["chunk", "ot", 4], ["offset", "ot", 8], ["offsetCS", "ot", 0], ["vec", "ot", 2], ["wmma_m", "ot", 8]]}, "result": [[1.6058709e-05], 0, 1.6395118236541748, 1651924514.7190945], "version": 0.2, "tvm_version": "0.8.0"}
{"input": ["cuda -keys=cuda,gpu -max_num_threads=1024 -thread_warp_size=32", "attn_v_pad_matmul.cuda", [["TENSOR", [256, 49, 49], "float16"], ["TENSOR", [256, 32, 49], "float16"]], {}], "config": {"index": 7813, "code_hash": null, "entity": [["block_row_warps", "ot", 2], ["block_col_warps", "ot", 1], ["warp_row_tiles", "ot", 2], ["warp_col_tiles", "ot", 2], ["chunk", "ot", 1], ["offset", "ot", 0], ["offsetCS", "ot", 0], ["vec", "ot", 4], ["wmma_m", "ot", 16]]}, "result": [[1.2977734999999998e-05], 0, 1.5069379806518555, 1651924515.3915405], "version": 0.2, "tvm_version": "0.8.0"}
{"input": ["cuda -keys=cuda,gpu -max_num_threads=1024 -thread_warp_size=32", "attn_v_pad_matmul.cuda", [["TENSOR", [256, 49, 49], "float16"], ["TENSOR", [256, 32, 49], "float16"]], {}], "config": {"index": 8350, "code_hash": null, "entity": [["block_row_warps", "ot", 2], ["block_col_warps", "ot", 4], ["warp_row_tiles", "ot", 1], ["warp_col_tiles", "ot", 1], ["chunk", "ot", 8], ["offset", "ot", 8], ["offsetCS", "ot", 0], ["vec", "ot", 4], ["wmma_m", "ot", 16]]}, "result": [[2.6779174e-05], 0, 1.5955371856689453, 1651924517.036057], "version": 0.2, "tvm_version": "0.8.0"}
{"input": ["cuda -keys=cuda,gpu -max_num_threads=1024 -thread_warp_size=32", "attn_v_pad_matmul.cuda", [["TENSOR", [256, 49, 49], "float16"], ["TENSOR", [256, 32, 49], "float16"]], {}], "config": {"index": 2498, "code_hash": null, "entity": [["block_row_warps", "ot", 4], ["block_col_warps", "ot", 2], ["warp_row_tiles", "ot", 2], ["warp_col_tiles", "ot", 4], ["chunk", "ot", 4], ["offset", "ot", 8], ["offsetCS", "ot", 8], ["vec", "ot", 2], ["wmma_m", "ot", 32]]}, "result": [[1.6078149e-05], 0, 1.44282865524292, 1651924517.7420254], "version": 0.2, "tvm_version": "0.8.0"}
{"input": ["cuda -keys=cuda,gpu -max_num_threads=1024 -thread_warp_size=32", "attn_v_pad_matmul.cuda", [["TENSOR", [256, 49, 49], "float16"], ["TENSOR", [256, 32, 49], "float16"]], {}], "config": {"index": 9354, "code_hash": null, "entity": [["block_row_warps", "ot", 1], ["block_col_warps", "ot", 2], ["warp_row_tiles", "ot", 2], ["warp_col_tiles", "ot", 2], ["chunk", "ot", 8], ["offset", "ot", 0], ["offsetCS", "ot", 0], ["vec", "ot", 8], ["wmma_m", "ot", 16]]}, "result": [[2.3810507e-05], 0, 1.6579620838165283, 1651924519.5347576], "version": 0.2, "tvm_version": "0.8.0"}
{"input": ["cuda -keys=cuda,gpu -max_num_threads=1024 -thread_warp_size=32", "attn_v_pad_matmul.cuda", [["TENSOR", [256, 49, 49], "float16"], ["TENSOR", [256, 32, 49], "float16"]], {}], "config": {"index": 1706, "code_hash": null, "entity": [["block_row_warps", "ot", 4], ["block_col_warps", "ot", 2], ["warp_row_tiles", "ot", 1], ["warp_col_tiles", "ot", 1], ["chunk", "ot", 2], ["offset", "ot", 8], ["offsetCS", "ot", 0], ["vec", "ot", 2], ["wmma_m", "ot", 32]]}, "result": [[2.7435672000000002e-05], 0, 1.623304843902588, 1651924521.2171185], "version": 0.2, "tvm_version": "0.8.0"}
{"input": ["cuda -keys=cuda,gpu -max_num_threads=1024 -thread_warp_size=32", "attn_v_pad_matmul.cuda", [["TENSOR", [256, 49, 49], "float16"], ["TENSOR", [256, 32, 49], "float16"]], {}], "config": {"index": 922, "code_hash": null, "entity": [["block_row_warps", "ot", 2], ["block_col_warps", "ot", 2], ["warp_row_tiles", "ot", 1], ["warp_col_tiles", "ot", 2], ["chunk", "ot", 8], ["offset", "ot", 0], ["offsetCS", "ot", 8], ["vec", "ot", 1], ["wmma_m", "ot", 32]]}, "result": [[3.4587171e-05], 0, 1.7184443473815918, 1651924521.9796958], "version": 0.2, "tvm_version": "0.8.0"}
{"input": ["cuda -keys=cuda,gpu -max_num_threads=1024 -thread_warp_size=32", "attn_v_pad_matmul.cuda", [["TENSOR", [256, 49, 49], "float16"], ["TENSOR", [256, 32, 49], "float16"]], {}], "config": {"index": 9084, "code_hash": null, "entity": [["block_row_warps", "ot", 1], ["block_col_warps", "ot", 2], ["warp_row_tiles", "ot", 2], ["warp_col_tiles", "ot", 1], ["chunk", "ot", 1], ["offset", "ot", 0], ["offsetCS", "ot", 0], ["vec", "ot", 8], ["wmma_m", "ot", 16]]}, "result": [[1.6443423e-05], 0, 1.526085376739502, 1651924523.665139], "version": 0.2, "tvm_version": "0.8.0"}
{"input": ["cuda -keys=cuda,gpu -max_num_threads=1024 -thread_warp_size=32", "attn_v_pad_matmul.cuda", [["TENSOR", [256, 49, 49], "float16"], ["TENSOR", [256, 32, 49], "float16"]], {}], "config": {"index": 592, "code_hash": null, "entity": [["block_row_warps", "ot", 2], ["block_col_warps", "ot", 4], ["warp_row_tiles", "ot", 4], ["warp_col_tiles", "ot", 1], ["chunk", "ot", 8], ["offset", "ot", 8], ["offsetCS", "ot", 0], ["vec", "ot", 1], ["wmma_m", "ot", 32]]}, "result": [[2.4370861e-05], 0, 1.5152151584625244, 1651924525.3713045], "version": 0.2, "tvm_version": "0.8.0"}
{"input": ["cuda -keys=cuda,gpu -max_num_threads=1024 -thread_warp_size=32", "attn_v_pad_matmul.cuda", [["TENSOR", [256, 49, 49], "float16"], ["TENSOR", [256, 32, 49], "float16"]], {}], "config": {"index": 12255, "code_hash": null, "entity": [["block_row_warps", "ot", 1], ["block_col_warps", "ot", 4], ["warp_row_tiles", "ot", 4], ["warp_col_tiles", "ot", 1], ["chunk", "ot", 8], ["offset", "ot", 8], ["offsetCS", "ot", 0], ["vec", "ot", 2], ["wmma_m", "ot", 8]]}, "result": [[1.5075375999999999e-05], 0, 1.621600866317749, 1651924526.0745952], "version": 0.2, "tvm_version": "0.8.0"}
{"input": ["cuda -keys=cuda,gpu -max_num_threads=1024 -thread_warp_size=32", "attn_v_pad_matmul.cuda", [["TENSOR", [256, 49, 49], "float16"], ["TENSOR", [256, 32, 49], "float16"]], {}], "config": {"index": 6125, "code_hash": null, "entity": [["block_row_warps", "ot", 4], ["block_col_warps", "ot", 2], ["warp_row_tiles", "ot", 4], ["warp_col_tiles", "ot", 2], ["chunk", "ot", 8], ["offset", "ot", 0], ["offsetCS", "ot", 8], ["vec", "ot", 1], ["wmma_m", "ot", 16]]}, "result": [[3.7053252e-05], 0, 1.831460952758789, 1651924527.9065], "version": 0.2, "tvm_version": "0.8.0"}
{"input": ["cuda -keys=cuda,gpu -max_num_threads=1024 -thread_warp_size=32", "attn_v_pad_matmul.cuda", [["TENSOR", [256, 49, 49], "float16"], ["TENSOR", [256, 32, 49], "float16"]], {}], "config": {"index": 10869, "code_hash": null, "entity": [["block_row_warps", "ot", 1], ["block_col_warps", "ot", 4], ["warp_row_tiles", "ot", 2], ["warp_col_tiles", "ot", 1], ["chunk", "ot", 4], ["offset", "ot", 8], ["offsetCS", "ot", 0], ["vec", "ot", 1], ["wmma_m", "ot", 8]]}, "result": [[1.5647850000000003e-05], 0, 1.5278804302215576, 1651924530.6752315], "version": 0.2, "tvm_version": "0.8.0"}
{"input": ["cuda -keys=cuda,gpu -max_num_threads=1024 -thread_warp_size=32", "attn_v_pad_matmul.cuda", [["TENSOR", [256, 49, 49], "float16"], ["TENSOR", [256, 32, 49], "float16"]], {}], "config": {"index": 1961, "code_hash": null, "entity": [["block_row_warps", "ot", 4], ["block_col_warps", "ot", 4], ["warp_row_tiles", "ot", 2], ["warp_col_tiles", "ot", 1], ["chunk", "ot", 1], ["offset", "ot", 0], ["offsetCS", "ot", 8], ["vec", "ot", 2], ["wmma_m", "ot", 32]]}, "result": [[6.1472369e-05], 0, 1.6157574653625488, 1651924531.445593], "version": 0.2, "tvm_version": "0.8.0"}
{"input": ["cuda -keys=cuda,gpu -max_num_threads=1024 -thread_warp_size=32", "attn_v_pad_matmul.cuda", [["TENSOR", [256, 49, 49], "float16"], ["TENSOR", [256, 32, 49], "float16"]], {}], "config": {"index": 12075, "code_hash": null, "entity": [["block_row_warps", "ot", 1], ["block_col_warps", "ot", 4], ["warp_row_tiles", "ot", 1], ["warp_col_tiles", "ot", 1], ["chunk", "ot", 2], ["offset", "ot", 8], ["offsetCS", "ot", 0], ["vec", "ot", 2], ["wmma_m", "ot", 8]]}, "result": [[1.3025777e-05], 0, 1.300898551940918, 1651924533.0658364], "version": 0.2, "tvm_version": "0.8.0"}
{"input": ["cuda -keys=cuda,gpu -max_num_threads=1024 -thread_warp_size=32", "attn_v_pad_matmul.cuda", [["TENSOR", [256, 49, 49], "float16"], ["TENSOR", [256, 32, 49], "float16"]], {}], "config": {"index": 1254, "code_hash": null, "entity": [["block_row_warps", "ot", 1], ["block_col_warps", "ot", 2], ["warp_row_tiles", "ot", 2], ["warp_col_tiles", "ot", 2], ["chunk", "ot", 8], ["offset", "ot", 8], ["offsetCS", "ot", 8], ["vec", "ot", 1], ["wmma_m", "ot", 32]]}, "result": [[1.5132063999999999e-05], 0, 1.4565706253051758, 1651924535.8945653], "version": 0.2, "tvm_version": "0.8.0"}
{"input": ["cuda -keys=cuda,gpu -max_num_threads=1024 -thread_warp_size=32", "attn_v_pad_matmul.cuda", [["TENSOR", [256, 49, 49], "float16"], ["TENSOR", [256, 32, 49], "float16"]], {}], "config": {"index": 12656, "code_hash": null, "entity": [["block_row_warps", "ot", 4], ["block_col_warps", "ot", 1], ["warp_row_tiles", "ot", 4], ["warp_col_tiles", "ot", 1], ["chunk", "ot", 1], ["offset", "ot", 8], ["offsetCS", "ot", 8], ["vec", "ot", 2], ["wmma_m", "ot", 8]]}, "result": [[1.4165917000000001e-05], 0, 1.3880033493041992, 1651924536.5814548], "version": 0.2, "tvm_version": "0.8.0"}
{"input": ["cuda -keys=cuda,gpu -max_num_threads=1024 -thread_warp_size=32", "attn_v_pad_matmul.cuda", [["TENSOR", [256, 49, 49], "float16"], ["TENSOR", [256, 32, 49], "float16"]], {}], "config": {"index": 11421, "code_hash": null, "entity": [["block_row_warps", "ot", 1], ["block_col_warps", "ot", 1], ["warp_row_tiles", "ot", 1], ["warp_col_tiles", "ot", 1], ["chunk", "ot", 2], ["offset", "ot", 8], ["offsetCS", "ot", 8], ["vec", "ot", 1], ["wmma_m", "ot", 8]]}, "result": [[1.3515183e-05], 0, 1.5167267322540283, 1651924538.3328042], "version": 0.2, "tvm_version": "0.8.0"}
{"input": ["cuda -keys=cuda,gpu -max_num_threads=1024 -thread_warp_size=32", "attn_v_pad_matmul.cuda", [["TENSOR", [256, 49, 49], "float16"], ["TENSOR", [256, 32, 49], "float16"]], {}], "config": {"index": 897, "code_hash": null, "entity": [["block_row_warps", "ot", 1], ["block_col_warps", "ot", 4], ["warp_row_tiles", "ot", 1], ["warp_col_tiles", "ot", 1], ["chunk", "ot", 8], ["offset", "ot", 0], ["offsetCS", "ot", 8], ["vec", "ot", 1], ["wmma_m", "ot", 32]]}, "result": [[4.4150562999999996e-05], 0, 1.523752212524414, 1651924539.0768428], "version": 0.2, "tvm_version": "0.8.0"}
{"input": ["cuda -keys=cuda,gpu -max_num_threads=1024 -thread_warp_size=32", "attn_v_pad_matmul.cuda", [["TENSOR", [256, 49, 49], "float16"], ["TENSOR", [256, 32, 49], "float16"]], {}], "config": {"index": 2666, "code_hash": null, "entity": [["block_row_warps", "ot", 4], ["block_col_warps", "ot", 1], ["warp_row_tiles", "ot", 4], ["warp_col_tiles", "ot", 4], ["chunk", "ot", 1], ["offset", "ot", 0], ["offsetCS", "ot", 0], ["vec", "ot", 4], ["wmma_m", "ot", 32]]}, "result": [[1.2068023e-05], 0, 1.574157476425171, 1651924540.731123], "version": 0.2, "tvm_version": "0.8.0"}
{"input": ["cuda -keys=cuda,gpu -max_num_threads=1024 -thread_warp_size=32", "attn_v_pad_matmul.cuda", [["TENSOR", [256, 49, 49], "float16"], ["TENSOR", [256, 32, 49], "float16"]], {}], "config": {"index": 11041, "code_hash": null, "entity": [["block_row_warps", "ot", 2], ["block_col_warps", "ot", 4], ["warp_row_tiles", "ot", 4], ["warp_col_tiles", "ot", 1], ["chunk", "ot", 1], ["offset", "ot", 0], ["offsetCS", "ot", 8], ["vec", "ot", 1], ["wmma_m", "ot", 8]]}, "result": [[2.0706745000000003e-05], 0, 1.6813831329345703, 1651924541.4849112], "version": 0.2, "tvm_version": "0.8.0"}
{"input": ["cuda -keys=cuda,gpu -max_num_threads=1024 -thread_warp_size=32", "attn_v_pad_matmul.cuda", [["TENSOR", [256, 49, 49], "float16"], ["TENSOR", [256, 32, 49], "float16"]], {}], "config": {"index": 5793, "code_hash": null, "entity": [["block_row_warps", "ot", 1], ["block_col_warps", "ot", 4], ["warp_row_tiles", "ot", 2], ["warp_col_tiles", "ot", 2], ["chunk", "ot", 8], ["offset", "ot", 8], ["offsetCS", "ot", 0], ["vec", "ot", 1], ["wmma_m", "ot", 16]]}, "result": [[1.3658907e-05], 0, 1.5413789749145508, 1651924543.1365957], "version": 0.2, "tvm_version": "0.8.0"}
{"input": ["cuda -keys=cuda,gpu -max_num_threads=1024 -thread_warp_size=32", "attn_v_pad_matmul.cuda", [["TENSOR", [256, 49, 49], "float16"], ["TENSOR", [256, 32, 49], "float16"]], {}], "config": {"index": 2324, "code_hash": null, "entity": [["block_row_warps", "ot", 4], ["block_col_warps", "ot", 1], ["warp_row_tiles", "ot", 1], ["warp_col_tiles", "ot", 4], ["chunk", "ot", 1], ["offset", "ot", 8], ["offsetCS", "ot", 8], ["vec", "ot", 2], ["wmma_m", "ot", 32]]}, "result": [[1.367665e-05], 0, 1.7933533191680908, 1651924577.2894986], "version": 0.2, "tvm_version": "0.8.0"}
{"input": ["cuda -keys=cuda,gpu -max_num_threads=1024 -thread_warp_size=32", "attn_v_pad_matmul.cuda", [["TENSOR", [256, 49, 49], "float16"], ["TENSOR", [256, 32, 49], "float16"]], {}], "config": {"index": 2971, "code_hash": null, "entity": [["block_row_warps", "ot", 2], ["block_col_warps", "ot", 1], ["warp_row_tiles", "ot", 1], ["warp_col_tiles", "ot", 4], ["chunk", "ot", 1], ["offset", "ot", 8], ["offsetCS", "ot", 0], ["vec", "ot", 4], ["wmma_m", "ot", 32]]}, "result": [[1.3193602e-05], 0, 1.4217240810394287, 1651924577.953992], "version": 0.2, "tvm_version": "0.8.0"}
{"input": ["cuda -keys=cuda,gpu -max_num_threads=1024 -thread_warp_size=32", "attn_v_pad_matmul.cuda", [["TENSOR", [256, 49, 49], "float16"], ["TENSOR", [256, 32, 49], "float16"]], {}], "config": {"index": 2731, "code_hash": null, "entity": [["block_row_warps", "ot", 2], ["block_col_warps", "ot", 2], ["warp_row_tiles", "ot", 1], ["warp_col_tiles", "ot", 4], ["chunk", "ot", 2], ["offset", "ot", 0], ["offsetCS", "ot", 0], ["vec", "ot", 4], ["wmma_m", "ot", 32]]}, "result": [[2.3478282e-05], 0, 1.9300146102905273, 1651924578.617604], "version": 0.2, "tvm_version": "0.8.0"}
{"input": ["cuda -keys=cuda,gpu -max_num_threads=1024 -thread_warp_size=32", "attn_v_pad_matmul.cuda", [["TENSOR", [256, 49, 49], "float16"], ["TENSOR", [256, 32, 49], "float16"]], {}], "config": {"index": 3055, "code_hash": null, "entity": [["block_row_warps", "ot", 2], ["block_col_warps", "ot", 2], ["warp_row_tiles", "ot", 1], ["warp_col_tiles", "ot", 4], ["chunk", "ot", 2], ["offset", "ot", 8], ["offsetCS", "ot", 0], ["vec", "ot", 4], ["wmma_m", "ot", 32]]}, "result": [[1.8602918e-05], 0, 1.5850646495819092, 1651924579.327032], "version": 0.2, "tvm_version": "0.8.0"}
{"input": ["cuda -keys=cuda,gpu -max_num_threads=1024 -thread_warp_size=32", "attn_v_pad_matmul.cuda", [["TENSOR", [256, 49, 49], "float16"], ["TENSOR", [256, 32, 49], "float16"]], {}], "config": {"index": 3379, "code_hash": null, "entity": [["block_row_warps", "ot", 2], ["block_col_warps", "ot", 2], ["warp_row_tiles", "ot", 1], ["warp_col_tiles", "ot", 4], ["chunk", "ot", 2], ["offset", "ot", 0], ["offsetCS", "ot", 8], ["vec", "ot", 4], ["wmma_m", "ot", 32]]}, "result": [[2.0186637e-05], 0, 1.7845306396484375, 1651924580.035163], "version": 0.2, "tvm_version": "0.8.0"}
{"input": ["cuda -keys=cuda,gpu -max_num_threads=1024 -thread_warp_size=32", "attn_v_pad_matmul.cuda", [["TENSOR", [256, 49, 49], "float16"], ["TENSOR", [256, 32, 49], "float16"]], {}], "config": {"index": 2973, "code_hash": null, "entity": [["block_row_warps", "ot", 1], ["block_col_warps", "ot", 2], ["warp_row_tiles", "ot", 1], ["warp_col_tiles", "ot", 4], ["chunk", "ot", 1], ["offset", "ot", 8], ["offsetCS", "ot", 0], ["vec", "ot", 4], ["wmma_m", "ot", 32]]}, "result": [[1.4361840000000001e-05], 0, 1.5551838874816895, 1651924580.6964736], "version": 0.2, "tvm_version": "0.8.0"}
{"input": ["cuda -keys=cuda,gpu -max_num_threads=1024 -thread_warp_size=32", "attn_v_pad_matmul.cuda", [["TENSOR", [256, 49, 49], "float16"], ["TENSOR", [256, 32, 49], "float16"]], {}], "config": {"index": 3630, "code_hash": null, "entity": [["block_row_warps", "ot", 1], ["block_col_warps", "ot", 2], ["warp_row_tiles", "ot", 2], ["warp_col_tiles", "ot", 4], ["chunk", "ot", 1], ["offset", "ot", 8], ["offsetCS", "ot", 8], ["vec", "ot", 4], ["wmma_m", "ot", 32]]}, "result": [[1.2613041e-05], 0, 1.7852153778076172, 1651924581.4086933], "version": 0.2, "tvm_version": "0.8.0"}
{"input": ["cuda -keys=cuda,gpu -max_num_threads=1024 -thread_warp_size=32", "attn_v_pad_matmul.cuda", [["TENSOR", [256, 49, 49], "float16"], ["TENSOR", [256, 32, 49], "float16"]], {}], "config": {"index": 3619, "code_hash": null, "entity": [["block_row_warps", "ot", 2], ["block_col_warps", "ot", 1], ["warp_row_tiles", "ot", 1], ["warp_col_tiles", "ot", 4], ["chunk", "ot", 1], ["offset", "ot", 8], ["offsetCS", "ot", 8], ["vec", "ot", 4], ["wmma_m", "ot", 32]]}, "result": [[1.2544025e-05], 0, 1.7294361591339111, 1651924582.07115], "version": 0.2, "tvm_version": "0.8.0"}
{"input": ["cuda -keys=cuda,gpu -max_num_threads=1024 -thread_warp_size=32", "attn_v_pad_matmul.cuda", [["TENSOR", [256, 49, 49], "float16"], ["TENSOR", [256, 32, 49], "float16"]], {}], "config": {"index": 3628, "code_hash": null, "entity": [["block_row_warps", "ot", 2], ["block_col_warps", "ot", 1], ["warp_row_tiles", "ot", 2], ["warp_col_tiles", "ot", 4], ["chunk", "ot", 1], ["offset", "ot", 8], ["offsetCS", "ot", 8], ["vec", "ot", 4], ["wmma_m", "ot", 32]]}, "result": [[1.3591459999999999e-05], 0, 1.617389440536499, 1651924582.6888459], "version": 0.2, "tvm_version": "0.8.0"}
{"input": ["cuda -keys=cuda,gpu -max_num_threads=1024 -thread_warp_size=32", "attn_v_pad_matmul.cuda", [["TENSOR", [256, 49, 49], "float16"], ["TENSOR", [256, 32, 49], "float16"]], {}], "config": {"index": 4359, "code_hash": null, "entity": [["block_row_warps", "ot", 1], ["block_col_warps", "ot", 2], ["warp_row_tiles", "ot", 2], ["warp_col_tiles", "ot", 4], ["chunk", "ot", 2], ["offset", "ot", 8], ["offsetCS", "ot", 0], ["vec", "ot", 8], ["wmma_m", "ot", 32]]}, "result": [[1.7959493e-05], 0, 1.840536117553711, 1651924583.36823], "version": 0.2, "tvm_version": "0.8.0"}
{"input": ["cuda -keys=cuda,gpu -max_num_threads=1024 -thread_warp_size=32", "attn_v_pad_matmul.cuda", [["TENSOR", [256, 49, 49], "float16"], ["TENSOR", [256, 32, 49], "float16"]], {}], "config": {"index": 4357, "code_hash": null, "entity": [["block_row_warps", "ot", 2], ["block_col_warps", "ot", 1], ["warp_row_tiles", "ot", 2], ["warp_col_tiles", "ot", 4], ["chunk", "ot", 2], ["offset", "ot", 8], ["offsetCS", "ot", 0], ["vec", "ot", 8], ["wmma_m", "ot", 32]]}, "result": [[1.8713952e-05], 0, 1.9507226943969727, 1651924584.0372317], "version": 0.2, "tvm_version": "0.8.0"}
{"input": ["cuda -keys=cuda,gpu -max_num_threads=1024 -thread_warp_size=32", "attn_v_pad_matmul.cuda", [["TENSOR", [256, 49, 49], "float16"], ["TENSOR", [256, 32, 49], "float16"]], {}], "config": {"index": 3377, "code_hash": null, "entity": [["block_row_warps", "ot", 4], ["block_col_warps", "ot", 1], ["warp_row_tiles", "ot", 1], ["warp_col_tiles", "ot", 4], ["chunk", "ot", 2], ["offset", "ot", 0], ["offsetCS", "ot", 8], ["vec", "ot", 4], ["wmma_m", "ot", 32]]}, "result": [[2.0162925999999997e-05], 0, 1.5516085624694824, 1651924584.6687806], "version": 0.2, "tvm_version": "0.8.0"}
{"input": ["cuda -keys=cuda,gpu -max_num_threads=1024 -thread_warp_size=32", "attn_v_pad_matmul.cuda", [["TENSOR", [256, 49, 49], "float16"], ["TENSOR", [256, 32, 49], "float16"]], {}], "config": {"index": 2980, "code_hash": null, "entity": [["block_row_warps", "ot", 2], ["block_col_warps", "ot", 1], ["warp_row_tiles", "ot", 2], ["warp_col_tiles", "ot", 4], ["chunk", "ot", 1], ["offset", "ot", 8], ["offsetCS", "ot", 0], ["vec", "ot", 4], ["wmma_m", "ot", 32]]}, "result": [[1.3754508e-05], 0, 1.8731989860534668, 1651924585.3504527], "version": 0.2, "tvm_version": "0.8.0"}
{"input": ["cuda -keys=cuda,gpu -max_num_threads=1024 -thread_warp_size=32", "attn_v_pad_matmul.cuda", [["TENSOR", [256, 49, 49], "float16"], ["TENSOR", [256, 32, 49], "float16"]], {}], "config": {"index": 4024, "code_hash": null, "entity": [["block_row_warps", "ot", 2], ["block_col_warps", "ot", 1], ["warp_row_tiles", "ot", 1], ["warp_col_tiles", "ot", 4], ["chunk", "ot", 2], ["offset", "ot", 0], ["offsetCS", "ot", 0], ["vec", "ot", 8], ["wmma_m", "ot", 32]]}, "result": [[1.7295884999999997e-05], 0, 1.6552186012268066, 1651924586.041415], "version": 0.2, "tvm_version": "0.8.0"}
{"input": ["cuda -keys=cuda,gpu -max_num_threads=1024 -thread_warp_size=32", "attn_v_pad_matmul.cuda", [["TENSOR", [256, 49, 49], "float16"], ["TENSOR", [256, 32, 49], "float16"]], {}], "config": {"index": 4350, "code_hash": null, "entity": [["block_row_warps", "ot", 1], ["block_col_warps", "ot", 2], ["warp_row_tiles", "ot", 1], ["warp_col_tiles", "ot", 4], ["chunk", "ot", 2], ["offset", "ot", 8], ["offsetCS", "ot", 0], ["vec", "ot", 8], ["wmma_m", "ot", 32]]}, "result": [[1.6838053e-05], 0, 1.7479615211486816, 1651924586.748777], "version": 0.2, "tvm_version": "0.8.0"}
{"input": ["cuda -keys=cuda,gpu -max_num_threads=1024 -thread_warp_size=32", "attn_v_pad_matmul.cuda", [["TENSOR", [256, 49, 49], "float16"], ["TENSOR", [256, 32, 49], "float16"]], {}], "config": {"index": 8137, "code_hash": null, "entity": [["block_row_warps", "ot", 2], ["block_col_warps", "ot", 1], ["warp_row_tiles", "ot", 2], ["warp_col_tiles", "ot", 2], ["chunk", "ot", 1], ["offset", "ot", 8], ["offsetCS", "ot", 0], ["vec", "ot", 4], ["wmma_m", "ot", 16]]}, "result": [[1.2460414e-05], 0, 1.7168140411376953, 1651924587.4239726], "version": 0.2, "tvm_version": "0.8.0"}
{"input": ["cuda -keys=cuda,gpu -max_num_threads=1024 -thread_warp_size=32", "attn_v_pad_matmul.cuda", [["TENSOR", [256, 49, 49], "float16"], ["TENSOR", [256, 32, 49], "float16"]], {}], "config": {"index": 4033, "code_hash": null, "entity": [["block_row_warps", "ot", 2], ["block_col_warps", "ot", 1], ["warp_row_tiles", "ot", 2], ["warp_col_tiles", "ot", 4], ["chunk", "ot", 2], ["offset", "ot", 0], ["offsetCS", "ot", 0], ["vec", "ot", 8], ["wmma_m", "ot", 32]]}, "result": [[1.9916637e-05], 0, 1.831908941268921, 1651924588.0633593], "version": 0.2, "tvm_version": "0.8.0"}
{"input": ["cuda -keys=cuda,gpu -max_num_threads=1024 -thread_warp_size=32", "attn_v_pad_matmul.cuda", [["TENSOR", [256, 49, 49], "float16"], ["TENSOR", [256, 32, 49], "float16"]], {}], "config": {"index": 5005, "code_hash": null, "entity": [["block_row_warps", "ot", 2], ["block_col_warps", "ot", 1], ["warp_row_tiles", "ot", 2], ["warp_col_tiles", "ot", 4], ["chunk", "ot", 2], ["offset", "ot", 8], ["offsetCS", "ot", 8], ["vec", "ot", 8], ["wmma_m", "ot", 32]]}, "result": [[1.5740899999999997e-05], 0, 1.7631471157073975, 1651924588.6992142], "version": 0.2, "tvm_version": "0.8.0"}
{"input": ["cuda -keys=cuda,gpu -max_num_threads=1024 -thread_warp_size=32", "attn_v_pad_matmul.cuda", [["TENSOR", [256, 49, 49], "float16"], ["TENSOR", [256, 32, 49], "float16"]], {}], "config": {"index": 3703, "code_hash": null, "entity": [["block_row_warps", "ot", 2], ["block_col_warps", "ot", 2], ["warp_row_tiles", "ot", 1], ["warp_col_tiles", "ot", 4], ["chunk", "ot", 2], ["offset", "ot", 8], ["offsetCS", "ot", 8], ["vec", "ot", 4], ["wmma_m", "ot", 32]]}, "result": [[1.5543007e-05], 0, 1.834613561630249, 1651924589.388811], "version": 0.2, "tvm_version": "0.8.0"}
{"input": ["cuda -keys=cuda,gpu -max_num_threads=1024 -thread_warp_size=32", "attn_v_pad_matmul.cuda", [["TENSOR", [256, 49, 49], "float16"], ["TENSOR", [256, 32, 49], "float16"]], {}], "config": {"index": 4681, "code_hash": null, "entity": [["block_row_warps", "ot", 2], ["block_col_warps", "ot", 1], ["warp_row_tiles", "ot", 2], ["warp_col_tiles", "ot", 4], ["chunk", "ot", 2], ["offset", "ot", 0], ["offsetCS", "ot", 8], ["vec", "ot", 8], ["wmma_m", "ot", 32]]}, "result": [[1.8920275e-05], 0, 1.5672376155853271, 1651924590.0312507], "version": 0.2, "tvm_version": "0.8.0"}
{"input": ["cuda -keys=cuda,gpu -max_num_threads=1024 -thread_warp_size=32", "attn_v_pad_matmul.cuda", [["TENSOR", [256, 49, 49], "float16"], ["TENSOR", [256, 32, 49], "float16"]], {}], "config": {"index": 5007, "code_hash": null, "entity": [["block_row_warps", "ot", 1], ["block_col_warps", "ot", 2], ["warp_row_tiles", "ot", 2], ["warp_col_tiles", "ot", 4], ["chunk", "ot", 2], ["offset", "ot", 8], ["offsetCS", "ot", 8], ["vec", "ot", 8], ["wmma_m", "ot", 32]]}, "result": [[1.8951405e-05], 0, 1.61083984375, 1651924590.7268648], "version": 0.2, "tvm_version": "0.8.0"}
{"input": ["cuda -keys=cuda,gpu -max_num_threads=1024 -thread_warp_size=32", "attn_v_pad_matmul.cuda", [["TENSOR", [256, 49, 49], "float16"], ["TENSOR", [256, 32, 49], "float16"]], {}], "config": {"index": 4672, "code_hash": null, "entity": [["block_row_warps", "ot", 2], ["block_col_warps", "ot", 1], ["warp_row_tiles", "ot", 1], ["warp_col_tiles", "ot", 4], ["chunk", "ot", 2], ["offset", "ot", 0], ["offsetCS", "ot", 8], ["vec", "ot", 8], ["wmma_m", "ot", 32]]}, "result": [[1.6500214e-05], 0, 1.9067599773406982, 1651924591.468715], "version": 0.2, "tvm_version": "0.8.0"}
{"input": ["cuda -keys=cuda,gpu -max_num_threads=1024 -thread_warp_size=32", "attn_v_pad_matmul.cuda", [["TENSOR", [256, 49, 49], "float16"], ["TENSOR", [256, 32, 49], "float16"]], {}], "config": {"index": 9199, "code_hash": null, "entity": [["block_row_warps", "ot", 2], ["block_col_warps", "ot", 1], ["warp_row_tiles", "ot", 4], ["warp_col_tiles", "ot", 2], ["chunk", "ot", 2], ["offset", "ot", 0], ["offsetCS", "ot", 0], ["vec", "ot", 8], ["wmma_m", "ot", 16]]}, "result": [[1.9750046e-05], 0, 1.8587391376495361, 1651924592.1643329], "version": 0.2, "tvm_version": "0.8.0"}
{"input": ["cuda -keys=cuda,gpu -max_num_threads=1024 -thread_warp_size=32", "attn_v_pad_matmul.cuda", [["TENSOR", [256, 49, 49], "float16"], ["TENSOR", [256, 32, 49], "float16"]], {}], "config": {"index": 4266, "code_hash": null, "entity": [["block_row_warps", "ot", 1], ["block_col_warps", "ot", 1], ["warp_row_tiles", "ot", 1], ["warp_col_tiles", "ot", 4], ["chunk", "ot", 1], ["offset", "ot", 8], ["offsetCS", "ot", 0], ["vec", "ot", 8], ["wmma_m", "ot", 32]]}, "result": [[1.5171273e-05], 0, 1.4884049892425537, 1651924592.8094072], "version": 0.2, "tvm_version": "0.8.0"}
{"input": ["cuda -keys=cuda,gpu -max_num_threads=1024 -thread_warp_size=32", "attn_v_pad_matmul.cuda", [["TENSOR", [256, 49, 49], "float16"], ["TENSOR", [256, 32, 49], "float16"]], {}], "config": {"index": 4275, "code_hash": null, "entity": [["block_row_warps", "ot", 1], ["block_col_warps", "ot", 1], ["warp_row_tiles", "ot", 2], ["warp_col_tiles", "ot", 4], ["chunk", "ot", 1], ["offset", "ot", 8], ["offsetCS", "ot", 0], ["vec", "ot", 8], ["wmma_m", "ot", 32]]}, "result": [[2.3898929e-05], 0, 1.9049346446990967, 1651924593.6016617], "version": 0.2, "tvm_version": "0.8.0"}
{"input": ["cuda -keys=cuda,gpu -max_num_threads=1024 -thread_warp_size=32", "attn_v_pad_matmul.cuda", [["TENSOR", [256, 49, 49], "float16"], ["TENSOR", [256, 32, 49], "float16"]], {}], "config": {"index": 4284, "code_hash": null, "entity": [["block_row_warps", "ot", 1], ["block_col_warps", "ot", 1], ["warp_row_tiles", "ot", 4], ["warp_col_tiles", "ot", 4], ["chunk", "ot", 1], ["offset", "ot", 8], ["offsetCS", "ot", 0], ["vec", "ot", 8], ["wmma_m", "ot", 32]]}, "result": [[2.6051165999999996e-05], 0, 1.781334400177002, 1651924594.281841], "version": 0.2, "tvm_version": "0.8.0"}
{"input": ["cuda -keys=cuda,gpu -max_num_threads=1024 -thread_warp_size=32", "attn_v_pad_matmul.cuda", [["TENSOR", [256, 49, 49], "float16"], ["TENSOR", [256, 32, 49], "float16"]], {}], "config": {"index": 4035, "code_hash": null, "entity": [["block_row_warps", "ot", 1], ["block_col_warps", "ot", 2], ["warp_row_tiles", "ot", 2], ["warp_col_tiles", "ot", 4], ["chunk", "ot", 2], ["offset", "ot", 0], ["offsetCS", "ot", 0], ["vec", "ot", 8], ["wmma_m", "ot", 32]]}, "result": [[2.082725e-05], 0, 1.7610538005828857, 1651924594.9668853], "version": 0.2, "tvm_version": "0.8.0"}
{"input": ["cuda -keys=cuda,gpu -max_num_threads=1024 -thread_warp_size=32", "attn_v_pad_matmul.cuda", [["TENSOR", [256, 49, 49], "float16"], ["TENSOR", [256, 32, 49], "float16"]], {}], "config": {"index": 4026, "code_hash": null, "entity": [["block_row_warps", "ot", 1], ["block_col_warps", "ot", 2], ["warp_row_tiles", "ot", 1], ["warp_col_tiles", "ot", 4], ["chunk", "ot", 2], ["offset", "ot", 0], ["offsetCS", "ot", 0], ["vec", "ot", 8], ["wmma_m", "ot", 32]]}, "result": [[1.9460320999999998e-05], 0, 1.8230862617492676, 1651924595.6935909], "version": 0.2, "tvm_version": "0.8.0"}
{"input": ["cuda -keys=cuda,gpu -max_num_threads=1024 -thread_warp_size=32", "attn_v_pad_matmul.cuda", [["TENSOR", [256, 49, 49], "float16"], ["TENSOR", [256, 32, 49], "float16"]], {}], "config": {"index": 8867, "code_hash": null, "entity": [["block_row_warps", "ot", 4], ["block_col_warps", "ot", 1], ["warp_row_tiles", "ot", 2], ["warp_col_tiles", "ot", 2], ["chunk", "ot", 2], ["offset", "ot", 8], ["offsetCS", "ot", 8], ["vec", "ot", 4], ["wmma_m", "ot", 16]]}, "result": [[1.4895389e-05], 0, 1.856184959411621, 1651924596.3996027], "version": 0.2, "tvm_version": "0.8.0"}
{"input": ["cuda -keys=cuda,gpu -max_num_threads=1024 -thread_warp_size=32", "attn_v_pad_matmul.cuda", [["TENSOR", [256, 49, 49], "float16"], ["TENSOR", [256, 32, 49], "float16"]], {}], "config": {"index": 4996, "code_hash": null, "entity": [["block_row_warps", "ot", 2], ["block_col_warps", "ot", 1], ["warp_row_tiles", "ot", 1], ["warp_col_tiles", "ot", 4], ["chunk", "ot", 2], ["offset", "ot", 8], ["offsetCS", "ot", 8], ["vec", "ot", 8], ["wmma_m", "ot", 32]]}, "result": [[1.4242104e-05], 0, 1.672165870666504, 1651924597.0926657], "version": 0.2, "tvm_version": "0.8.0"}
{"input": ["cuda -keys=cuda,gpu -max_num_threads=1024 -thread_warp_size=32", "attn_v_pad_matmul.cuda", [["TENSOR", [256, 49, 49], "float16"], ["TENSOR", [256, 32, 49], "float16"]], {}], "config": {"index": 8543, "code_hash": null, "entity": [["block_row_warps", "ot", 4], ["block_col_warps", "ot", 1], ["warp_row_tiles", "ot", 2], ["warp_col_tiles", "ot", 2], ["chunk", "ot", 2], ["offset", "ot", 0], ["offsetCS", "ot", 8], ["vec", "ot", 4], ["wmma_m", "ot", 16]]}, "result": [[2.0041367e-05], 0, 1.7921361923217773, 1651924597.8523395], "version": 0.2, "tvm_version": "0.8.0"}
{"input": ["cuda -keys=cuda,gpu -max_num_threads=1024 -thread_warp_size=32", "attn_v_pad_matmul.cuda", [["TENSOR", [256, 49, 49], "float16"], ["TENSOR", [256, 32, 49], "float16"]], {}], "config": {"index": 8219, "code_hash": null, "entity": [["block_row_warps", "ot", 4], ["block_col_warps", "ot", 1], ["warp_row_tiles", "ot", 2], ["warp_col_tiles", "ot", 2], ["chunk", "ot", 2], ["offset", "ot", 8], ["offsetCS", "ot", 0], ["vec", "ot", 4], ["wmma_m", "ot", 16]]}, "result": [[1.6618137999999997e-05], 0, 1.7847399711608887, 1651924598.5336866], "version": 0.2, "tvm_version": "0.8.0"}
{"input": ["cuda -keys=cuda,gpu -max_num_threads=1024 -thread_warp_size=32", "attn_v_pad_matmul.cuda", [["TENSOR", [256, 49, 49], "float16"], ["TENSOR", [256, 32, 49], "float16"]], {}], "config": {"index": 13951, "code_hash": null, "entity": [["block_row_warps", "ot", 2], ["block_col_warps", "ot", 1], ["warp_row_tiles", "ot", 4], ["warp_col_tiles", "ot", 1], ["chunk", "ot", 1], ["offset", "ot", 8], ["offsetCS", "ot", 8], ["vec", "ot", 4], ["wmma_m", "ot", 8]]}, "result": [[1.2786462e-05], 0, 1.8556926250457764, 1651924599.1985598], "version": 0.2, "tvm_version": "0.8.0"}
{"input": ["cuda -keys=cuda,gpu -max_num_threads=1024 -thread_warp_size=32", "attn_v_pad_matmul.cuda", [["TENSOR", [256, 49, 49], "float16"], ["TENSOR", [256, 32, 49], "float16"]], {}], "config": {"index": 13387, "code_hash": null, "entity": [["block_row_warps", "ot", 2], ["block_col_warps", "ot", 2], ["warp_row_tiles", "ot", 4], ["warp_col_tiles", "ot", 1], ["chunk", "ot", 2], ["offset", "ot", 8], ["offsetCS", "ot", 0], ["vec", "ot", 4], ["wmma_m", "ot", 8]]}, "result": [[1.9465119000000003e-05], 0, 1.8723876476287842, 1651924599.9207404], "version": 0.2, "tvm_version": "0.8.0"}
{"input": ["cuda -keys=cuda,gpu -max_num_threads=1024 -thread_warp_size=32", "attn_v_pad_matmul.cuda", [["TENSOR", [256, 49, 49], "float16"], ["TENSOR", [256, 32, 49], "float16"]], {}], "config": {"index": 14033, "code_hash": null, "entity": [["block_row_warps", "ot", 4], ["block_col_warps", "ot", 1], ["warp_row_tiles", "ot", 4], ["warp_col_tiles", "ot", 1], ["chunk", "ot", 2], ["offset", "ot", 8], ["offsetCS", "ot", 8], ["vec", "ot", 4], ["wmma_m", "ot", 8]]}, "result": [[1.6017515999999997e-05], 0, 1.8183364868164062, 1651924600.5818012], "version": 0.2, "tvm_version": "0.8.0"}
{"input": ["cuda -keys=cuda,gpu -max_num_threads=1024 -thread_warp_size=32", "attn_v_pad_matmul.cuda", [["TENSOR", [256, 49, 49], "float16"], ["TENSOR", [256, 32, 49], "float16"]], {}], "config": {"index": 8221, "code_hash": null, "entity": [["block_row_warps", "ot", 2], ["block_col_warps", "ot", 2], ["warp_row_tiles", "ot", 2], ["warp_col_tiles", "ot", 2], ["chunk", "ot", 2], ["offset", "ot", 8], ["offsetCS", "ot", 0], ["vec", "ot", 4], ["wmma_m", "ot", 16]]}, "result": [[1.9030259e-05], 0, 1.5877618789672852, 1651924601.204978], "version": 0.2, "tvm_version": "0.8.0"}
{"input": ["cuda -keys=cuda,gpu -max_num_threads=1024 -thread_warp_size=32", "attn_v_pad_matmul.cuda", [["TENSOR", [256, 49, 49], "float16"], ["TENSOR", [256, 32, 49], "float16"]], {}], "config": {"index": 15006, "code_hash": null, "entity": [["block_row_warps", "ot", 1], ["block_col_warps", "ot", 2], ["warp_row_tiles", "ot", 4], ["warp_col_tiles", "ot", 1], ["chunk", "ot", 2], ["offset", "ot", 0], ["offsetCS", "ot", 8], ["vec", "ot", 8], ["wmma_m", "ot", 8]]}, "result": [[1.8369560000000002e-05], 0, 1.8827040195465088, 1651924601.8838987], "version": 0.2, "tvm_version": "0.8.0"}
{"input": ["cuda -keys=cuda,gpu -max_num_threads=1024 -thread_warp_size=32", "attn_v_pad_matmul.cuda", [["TENSOR", [256, 49, 49], "float16"], ["TENSOR", [256, 32, 49], "float16"]], {}], "config": {"index": 4348, "code_hash": null, "entity": [["block_row_warps", "ot", 2], ["block_col_warps", "ot", 1], ["warp_row_tiles", "ot", 1], ["warp_col_tiles", "ot", 4], ["chunk", "ot", 2], ["offset", "ot", 8], ["offsetCS", "ot", 0], ["vec", "ot", 8], ["wmma_m", "ot", 32]]}, "result": [[1.4731857e-05], 0, 1.8364856243133545, 1651924602.583664], "version": 0.2, "tvm_version": "0.8.0"}
{"input": ["cuda -keys=cuda,gpu -max_num_threads=1024 -thread_warp_size=32", "attn_v_pad_matmul.cuda", [["TENSOR", [256, 49, 49], "float16"], ["TENSOR", [256, 32, 49], "float16"]], {}], "config": {"index": 14598, "code_hash": null, "entity": [["block_row_warps", "ot", 1], ["block_col_warps", "ot", 1], ["warp_row_tiles", "ot", 4], ["warp_col_tiles", "ot", 1], ["chunk", "ot", 1], ["offset", "ot", 8], ["offsetCS", "ot", 0], ["vec", "ot", 8], ["wmma_m", "ot", 8]]}, "result": [[1.5227057000000001e-05], 0, 1.6623036861419678, 1651924603.2035728], "version": 0.2, "tvm_version": "0.8.0"}
{"input": ["cuda -keys=cuda,gpu -max_num_threads=1024 -thread_warp_size=32", "attn_v_pad_matmul.cuda", [["TENSOR", [256, 49, 49], "float16"], ["TENSOR", [256, 32, 49], "float16"]], {}], "config": {"index": 12010, "code_hash": null, "entity": [["block_row_warps", "ot", 2], ["block_col_warps", "ot", 2], ["warp_row_tiles", "ot", 4], ["warp_col_tiles", "ot", 1], ["chunk", "ot", 1], ["offset", "ot", 8], ["offsetCS", "ot", 0], ["vec", "ot", 2], ["wmma_m", "ot", 8]]}, "result": [[1.7739277000000002e-05], 0, 1.8692398071289062, 1651924603.938672], "version": 0.2, "tvm_version": "0.8.0"}
{"input": ["cuda -keys=cuda,gpu -max_num_threads=1024 -thread_warp_size=32", "attn_v_pad_matmul.cuda", [["TENSOR", [256, 49, 49], "float16"], ["TENSOR", [256, 32, 49], "float16"]], {}], "config": {"index": 4683, "code_hash": null, "entity": [["block_row_warps", "ot", 1], ["block_col_warps", "ot", 2], ["warp_row_tiles", "ot", 2], ["warp_col_tiles", "ot", 4], ["chunk", "ot", 2], ["offset", "ot", 0], ["offsetCS", "ot", 8], ["vec", "ot", 8], ["wmma_m", "ot", 32]]}, "result": [[2.0662320999999998e-05], 0, 1.7431423664093018, 1651924606.5390096], "version": 0.2, "tvm_version": "0.8.0"}
{"input": ["cuda -keys=cuda,gpu -max_num_threads=1024 -thread_warp_size=32", "attn_v_pad_matmul.cuda", [["TENSOR", [256, 49, 49], "float16"], ["TENSOR", [256, 32, 49], "float16"]], {}], "config": {"index": 9514, "code_hash": null, "entity": [["block_row_warps", "ot", 2], ["block_col_warps", "ot", 1], ["warp_row_tiles", "ot", 2], ["warp_col_tiles", "ot", 2], ["chunk", "ot", 2], ["offset", "ot", 8], ["offsetCS", "ot", 0], ["vec", "ot", 8], ["wmma_m", "ot", 16]]}, "result": [[1.4614629e-05], 0, 1.6155359745025635, 1651924607.2212896], "version": 0.2, "tvm_version": "0.8.0"}
{"input": ["cuda -keys=cuda,gpu -max_num_threads=1024 -thread_warp_size=32", "attn_v_pad_matmul.cuda", [["TENSOR", [256, 49, 49], "float16"], ["TENSOR", [256, 32, 49], "float16"]], {}], "config": {"index": 7897, "code_hash": null, "entity": [["block_row_warps", "ot", 2], ["block_col_warps", "ot", 2], ["warp_row_tiles", "ot", 2], ["warp_col_tiles", "ot", 2], ["chunk", "ot", 2], ["offset", "ot", 0], ["offsetCS", "ot", 0], ["vec", "ot", 4], ["wmma_m", "ot", 16]]}, "result": [[2.3545169999999997e-05], 0, 1.4998879432678223, 1651924607.9238098], "version": 0.2, "tvm_version": "0.8.0"}
{"input": ["cuda -keys=cuda,gpu -max_num_threads=1024 -thread_warp_size=32", "attn_v_pad_matmul.cuda", [["TENSOR", [256, 49, 49], "float16"], ["TENSOR", [256, 32, 49], "float16"]], {}], "config": {"index": 12658, "code_hash": null, "entity": [["block_row_warps", "ot", 2], ["block_col_warps", "ot", 2], ["warp_row_tiles", "ot", 4], ["warp_col_tiles", "ot", 1], ["chunk", "ot", 1], ["offset", "ot", 8], ["offsetCS", "ot", 8], ["vec", "ot", 2], ["wmma_m", "ot", 8]]}, "result": [[1.4155490999999999e-05], 0, 1.6839351654052734, 1651924608.6130996], "version": 0.2, "tvm_version": "0.8.0"}
{"input": ["cuda -keys=cuda,gpu -max_num_threads=1024 -thread_warp_size=32", "attn_v_pad_matmul.cuda", [["TENSOR", [256, 49, 49], "float16"], ["TENSOR", [256, 32, 49], "float16"]], {}], "config": {"index": 10164, "code_hash": null, "entity": [["block_row_warps", "ot", 1], ["block_col_warps", "ot", 2], ["warp_row_tiles", "ot", 2], ["warp_col_tiles", "ot", 2], ["chunk", "ot", 2], ["offset", "ot", 8], ["offsetCS", "ot", 8], ["vec", "ot", 8], ["wmma_m", "ot", 16]]}, "result": [[1.566453e-05], 0, 1.6287834644317627, 1651924609.2792296], "version": 0.2, "tvm_version": "0.8.0"}
{"input": ["cuda -keys=cuda,gpu -max_num_threads=1024 -thread_warp_size=32", "attn_v_pad_matmul.cuda", [["TENSOR", [256, 49, 49], "float16"], ["TENSOR", [256, 32, 49], "float16"]], {}], "config": {"index": 9849, "code_hash": null, "entity": [["block_row_warps", "ot", 1], ["block_col_warps", "ot", 2], ["warp_row_tiles", "ot", 4], ["warp_col_tiles", "ot", 2], ["chunk", "ot", 2], ["offset", "ot", 0], ["offsetCS", "ot", 8], ["vec", "ot", 8], ["wmma_m", "ot", 16]]}, "result": [[2.0642359e-05], 0, 1.808532476425171, 1651924610.0359623], "version": 0.2, "tvm_version": "0.8.0"}
{"input": ["cuda -keys=cuda,gpu -max_num_threads=1024 -thread_warp_size=32", "attn_v_pad_matmul.cuda", [["TENSOR", [256, 49, 49], "float16"], ["TENSOR", [256, 32, 49], "float16"]], {}], "config": {"index": 9523, "code_hash": null, "entity": [["block_row_warps", "ot", 2], ["block_col_warps", "ot", 1], ["warp_row_tiles", "ot", 4], ["warp_col_tiles", "ot", 2], ["chunk", "ot", 2], ["offset", "ot", 8], ["offsetCS", "ot", 0], ["vec", "ot", 8], ["wmma_m", "ot", 16]]}, "result": [[1.8701702e-05], 0, 1.7136883735656738, 1651924610.706561], "version": 0.2, "tvm_version": "0.8.0"}
{"input": ["cuda -keys=cuda,gpu -max_num_threads=1024 -thread_warp_size=32", "attn_v_pad_matmul.cuda", [["TENSOR", [256, 49, 49], "float16"], ["TENSOR", [256, 32, 49], "float16"]], {}], "config": {"index": 6844, "code_hash": null, "entity": [["block_row_warps", "ot", 2], ["block_col_warps", "ot", 2], ["warp_row_tiles", "ot", 2], ["warp_col_tiles", "ot", 2], ["chunk", "ot", 1], ["offset", "ot", 8], ["offsetCS", "ot", 0], ["vec", "ot", 2], ["wmma_m", "ot", 16]]}, "result": [[1.7050301e-05], 0, 1.4520795345306396, 1651924611.3855531], "version": 0.2, "tvm_version": "0.8.0"}
{"input": ["cuda -keys=cuda,gpu -max_num_threads=1024 -thread_warp_size=32", "attn_v_pad_matmul.cuda", [["TENSOR", [256, 49, 49], "float16"], ["TENSOR", [256, 32, 49], "float16"]], {}], "config": {"index": 6842, "code_hash": null, "entity": [["block_row_warps", "ot", 4], ["block_col_warps", "ot", 1], ["warp_row_tiles", "ot", 2], ["warp_col_tiles", "ot", 2], ["chunk", "ot", 1], ["offset", "ot", 8], ["offsetCS", "ot", 0], ["vec", "ot", 2], ["wmma_m", "ot", 16]]}, "result": [[1.4544991000000001e-05], 0, 1.5656957626342773, 1651924612.1437216], "version": 0.2, "tvm_version": "0.8.0"}
{"input": ["cuda -keys=cuda,gpu -max_num_threads=1024 -thread_warp_size=32", "attn_v_pad_matmul.cuda", [["TENSOR", [256, 49, 49], "float16"], ["TENSOR", [256, 32, 49], "float16"]], {}], "config": {"index": 10173, "code_hash": null, "entity": [["block_row_warps", "ot", 1], ["block_col_warps", "ot", 2], ["warp_row_tiles", "ot", 4], ["warp_col_tiles", "ot", 2], ["chunk", "ot", 2], ["offset", "ot", 8], ["offsetCS", "ot", 8], ["vec", "ot", 8], ["wmma_m", "ot", 16]]}, "result": [[1.8952672e-05], 0, 1.5186443328857422, 1651924612.7944226], "version": 0.2, "tvm_version": "0.8.0"}
{"input": ["cuda -keys=cuda,gpu -max_num_threads=1024 -thread_warp_size=32", "attn_v_pad_matmul.cuda", [["TENSOR", [256, 49, 49], "float16"], ["TENSOR", [256, 32, 49], "float16"]], {}], "config": {"index": 9190, "code_hash": null, "entity": [["block_row_warps", "ot", 2], ["block_col_warps", "ot", 1], ["warp_row_tiles", "ot", 2], ["warp_col_tiles", "ot", 2], ["chunk", "ot", 2], ["offset", "ot", 0], ["offsetCS", "ot", 0], ["vec", "ot", 8], ["wmma_m", "ot", 16]]}, "result": [[1.7116753e-05], 0, 1.5378026962280273, 1651924613.5005567], "version": 0.2, "tvm_version": "0.8.0"}
{"input": ["cuda -keys=cuda,gpu -max_num_threads=1024 -thread_warp_size=32", "attn_v_pad_matmul.cuda", [["TENSOR", [256, 49, 49], "float16"], ["TENSOR", [256, 32, 49], "float16"]], {}], "config": {"index": 9432, "code_hash": null, "entity": [["block_row_warps", "ot", 1], ["block_col_warps", "ot", 1], ["warp_row_tiles", "ot", 2], ["warp_col_tiles", "ot", 2], ["chunk", "ot", 1], ["offset", "ot", 8], ["offsetCS", "ot", 0], ["vec", "ot", 8], ["wmma_m", "ot", 16]]}, "result": [[1.488541e-05], 0, 1.757002353668213, 1651924614.179202], "version": 0.2, "tvm_version": "0.8.0"}
{"input": ["cuda -keys=cuda,gpu -max_num_threads=1024 -thread_warp_size=32", "attn_v_pad_matmul.cuda", [["TENSOR", [256, 49, 49], "float16"], ["TENSOR", [256, 32, 49], "float16"]], {}], "config": {"index": 13711, "code_hash": null, "entity": [["block_row_warps", "ot", 2], ["block_col_warps", "ot", 2], ["warp_row_tiles", "ot", 4], ["warp_col_tiles", "ot", 1], ["chunk", "ot", 2], ["offset", "ot", 0], ["offsetCS", "ot", 8], ["vec", "ot", 4], ["wmma_m", "ot", 8]]}, "result": [[2.0593591e-05], 0, 1.6530072689056396, 1651924614.8001502], "version": 0.2, "tvm_version": "0.8.0"}
{"input": ["cuda -keys=cuda,gpu -max_num_threads=1024 -thread_warp_size=32", "attn_v_pad_matmul.cuda", [["TENSOR", [256, 49, 49], "float16"], ["TENSOR", [256, 32, 49], "float16"]], {}], "config": {"index": 9525, "code_hash": null, "entity": [["block_row_warps", "ot", 1], ["block_col_warps", "ot", 2], ["warp_row_tiles", "ot", 4], ["warp_col_tiles", "ot", 2], ["chunk", "ot", 2], ["offset", "ot", 8], ["offsetCS", "ot", 0], ["vec", "ot", 8], ["wmma_m", "ot", 16]]}, "result": [[1.7933826999999998e-05], 0, 1.8038444519042969, 1651924615.490515], "version": 0.2, "tvm_version": "0.8.0"}
{"input": ["cuda -keys=cuda,gpu -max_num_threads=1024 -thread_warp_size=32", "attn_v_pad_matmul.cuda", [["TENSOR", [256, 49, 49], "float16"], ["TENSOR", [256, 32, 49], "float16"]], {}], "config": {"index": 8148, "code_hash": null, "entity": [["block_row_warps", "ot", 1], ["block_col_warps", "ot", 2], ["warp_row_tiles", "ot", 4], ["warp_col_tiles", "ot", 2], ["chunk", "ot", 1], ["offset", "ot", 8], ["offsetCS", "ot", 0], ["vec", "ot", 4], ["wmma_m", "ot", 16]]}, "result": [[1.4269097e-05], 0, 1.6488142013549805, 1651924616.1634948], "version": 0.2, "tvm_version": "0.8.0"}
{"input": ["cuda -keys=cuda,gpu -max_num_threads=1024 -thread_warp_size=32", "attn_v_pad_matmul.cuda", [["TENSOR", [256, 49, 49], "float16"], ["TENSOR", [256, 32, 49], "float16"]], {}], "config": {"index": 10171, "code_hash": null, "entity": [["block_row_warps", "ot", 2], ["block_col_warps", "ot", 1], ["warp_row_tiles", "ot", 4], ["warp_col_tiles", "ot", 2], ["chunk", "ot", 2], ["offset", "ot", 8], ["offsetCS", "ot", 8], ["vec", "ot", 8], ["wmma_m", "ot", 16]]}, "result": [[1.5896634e-05], 0, 1.60207200050354, 1651924616.888918], "version": 0.2, "tvm_version": "0.8.0"}
{"input": ["cuda -keys=cuda,gpu -max_num_threads=1024 -thread_warp_size=32", "attn_v_pad_matmul.cuda", [["TENSOR", [256, 49, 49], "float16"], ["TENSOR", [256, 32, 49], "float16"]], {}], "config": {"index": 13953, "code_hash": null, "entity": [["block_row_warps", "ot", 1], ["block_col_warps", "ot", 2], ["warp_row_tiles", "ot", 4], ["warp_col_tiles", "ot", 1], ["chunk", "ot", 1], ["offset", "ot", 8], ["offsetCS", "ot", 8], ["vec", "ot", 4], ["wmma_m", "ot", 8]]}, "result": [[1.325913e-05], 0, 1.5413284301757812, 1651924617.4938648], "version": 0.2, "tvm_version": "0.8.0"}
{"input": ["cuda -keys=cuda,gpu -max_num_threads=1024 -thread_warp_size=32", "attn_v_pad_matmul.cuda", [["TENSOR", [256, 49, 49], "float16"], ["TENSOR", [256, 32, 49], "float16"]], {}], "config": {"index": 14035, "code_hash": null, "entity": [["block_row_warps", "ot", 2], ["block_col_warps", "ot", 2], ["warp_row_tiles", "ot", 4], ["warp_col_tiles", "ot", 1], ["chunk", "ot", 2], ["offset", "ot", 8], ["offsetCS", "ot", 8], ["vec", "ot", 4], ["wmma_m", "ot", 8]]}, "result": [[1.5708299e-05], 0, 1.7972497940063477, 1651924618.2423959], "version": 0.2, "tvm_version": "0.8.0"}
{"input": ["cuda -keys=cuda,gpu -max_num_threads=1024 -thread_warp_size=32", "attn_v_pad_matmul.cuda", [["TENSOR", [256, 49, 49], "float16"], ["TENSOR", [256, 32, 49], "float16"]], {}], "config": {"index": 15246, "code_hash": null, "entity": [["block_row_warps", "ot", 1], ["block_col_warps", "ot", 1], ["warp_row_tiles", "ot", 4], ["warp_col_tiles", "ot", 1], ["chunk", "ot", 1], ["offset", "ot", 8], ["offsetCS", "ot", 8], ["vec", "ot", 8], ["wmma_m", "ot", 8]]}, "result": [[1.3979517e-05], 0, 1.6643595695495605, 1651924618.9015875], "version": 0.2, "tvm_version": "0.8.0"}
{"input": ["cuda -keys=cuda,gpu -max_num_threads=1024 -thread_warp_size=32", "attn_v_pad_matmul.cuda", [["TENSOR", [256, 49, 49], "float16"], ["TENSOR", [256, 32, 49], "float16"]], {}], "config": {"index": 7492, "code_hash": null, "entity": [["block_row_warps", "ot", 2], ["block_col_warps", "ot", 2], ["warp_row_tiles", "ot", 2], ["warp_col_tiles", "ot", 2], ["chunk", "ot", 1], ["offset", "ot", 8], ["offsetCS", "ot", 8], ["vec", "ot", 2], ["wmma_m", "ot", 16]]}, "result": [[1.388658e-05], 0, 1.6453287601470947, 1651924619.5527642], "version": 0.2, "tvm_version": "0.8.0"}
