python/models/swin_transformer/kernel_configs/swin_transformer_permute_attn_q_k_v_1_7_7_1024_7_32_float16.log
{"i": [["[\"permute_attn_q_k_v\", 1, 7, 7, 1024, 7, 32, \"float16\"]", "cuda -keys=cuda,gpu -max_num_threads=1024 -model=unknown -thread_warp_size=32", [-1, 16, 64, 49152, 2147483647, 1024, 8, 32], "", 0, []], [[], [["FU", 1, [0, 1, 2, 3]], ["SP", 1, 0, 50176, [1], 1], ["AN", 1, 0, 5], ["AN", 1, 1, 6]]]], "r": [[4.00137e-05, 4.00548e-05, 4.00662e-05], 0, 1.70051, 1668059417], "v": "v0.6"}
{"i": [["[\"permute_attn_q_k_v\", 1, 7, 7, 1024, 7, 32, \"float16\"]", "cuda -keys=cuda,gpu -max_num_threads=1024 -model=unknown -thread_warp_size=32", [-1, 16, 64, 49152, 2147483647, 1024, 8, 32], "", 0, []], [[], [["FU", 1, [0, 1, 2, 3]], ["SP", 1, 0, 50176, [28], 1], ["AN", 1, 0, 5], ["AN", 1, 1, 6]]]], "r": [[3.90799e-06, 3.92449e-06, 3.92661e-06], 0, 2.06204, 1668059417], "v": "v0.6"}
{"i": [["[\"permute_attn_q_k_v\", 1, 7, 7, 1024, 7, 32, \"float16\"]", "cuda -keys=cuda,gpu -max_num_threads=1024 -model=unknown -thread_warp_size=32", [-1, 16, 64, 49152, 2147483647, 1024, 8, 32], "", 0, []], [[], [["FU", 1, [0, 1, 2, 3]], ["SP", 1, 0, 50176, [56], 1], ["AN", 1, 0, 5], ["AN", 1, 1, 6]]]], "r": [[3.17794e-06, 3.17824e-06, 3.17859e-06], 0, 0.593901, 1668059416], "v": "v0.6"}
{"i": [["[\"permute_attn_q_k_v\", 1, 7, 7, 1024, 7, 32, \"float16\"]", "cuda -keys=cuda,gpu -max_num_threads=1024 -model=unknown -thread_warp_size=32", [-1, 16, 64, 49152, 2147483647, 1024, 8, 32], "", 0, []], [[], [["FU", 1, [0, 1, 2, 3]], ["SP", 1, 0, 50176, [49], 1], ["AN", 1, 0, 5], ["AN", 1, 1, 6]]]], "r": [[3.34285e-06, 3.34068e-06, 3.33726e-06], 0, 1.32901, 1668059416], "v": "v0.6"}
{"i": [["[\"permute_attn_q_k_v\", 1, 7, 7, 1024, 7, 32, \"float16\"]", "cuda -keys=cuda,gpu -max_num_threads=1024 -model=unknown -thread_warp_size=32", [-1, 16, 64, 49152, 2147483647, 1024, 8, 32], "", 0, []], [[], [["FU", 1, [0, 1, 2, 3]], ["SP", 1, 0, 50176, [14], 1], ["AN", 1, 0, 5], ["AN", 1, 1, 6]]]], "r": [[5.26899e-06, 5.28393e-06, 5.2855e-06], 0, 0.912676, 1668059416], "v": "v0.6"}
{"i": [["[\"permute_attn_q_k_v\", 1, 7, 7, 1024, 7, 32, \"float16\"]", "cuda -keys=cuda,gpu -max_num_threads=1024 -model=unknown -thread_warp_size=32", [-1, 16, 64, 49152, 2147483647, 1024, 8, 32], "", 0, []], [[], [["FU", 1, [0, 1, 2, 3]], ["SP", 1, 0, 50176, [7], 1], ["AN", 1, 0, 5], ["AN", 1, 1, 6]]]], "r": [[8.11081e-06, 8.11686e-06, 8.10922e-06], 0, 2.81999, 1668059418], "v": "v0.6"}
{"i": [["[\"permute_attn_q_k_v\", 1, 7, 7, 1024, 7, 32, \"float16\"]", "cuda -keys=cuda,gpu -max_num_threads=1024 -model=unknown -thread_warp_size=32", [-1, 16, 64, 49152, 2147483647, 1024, 8, 32], "", 0, []], [[], [["FU", 1, [0, 1, 2, 3]], ["SP", 1, 0, 50176, [4], 1], ["AN", 1, 0, 5], ["AN", 1, 1, 6]]]], "r": [[1.21878e-05, 1.22006e-05, 1.22064e-05], 0, 2.47103, 1668059418], "v": "v0.6"}
{"i": [["[\"permute_attn_q_k_v\", 1, 7, 7, 1024, 7, 32, \"float16\"]", "cuda -keys=cuda,gpu -max_num_threads=1024 -model=unknown -thread_warp_size=32", [-1, 16, 64, 49152, 2147483647, 1024, 8, 32], "", 0, []], [[], [["FU", 1, [0, 1, 2, 3]], ["SP", 1, 0, 50176, [16], 1], ["AN", 1, 0, 5], ["AN", 1, 1, 6]]]], "r": [[4.95396e-06, 4.96714e-06, 4.96855e-06], 0, 3.56415, 1668059419], "v": "v0.6"}
{"i": [["[\"permute_attn_q_k_v\", 1, 7, 7, 1024, 7, 32, \"float16\"]", "cuda -keys=cuda,gpu -max_num_threads=1024 -model=unknown -thread_warp_size=32", [-1, 16, 64, 49152, 2147483647, 1024, 8, 32], "", 0, []], [[], [["FU", 1, [0, 1, 2, 3]], ["SP", 1, 0, 50176, [32], 1], ["AN", 1, 0, 5], ["AN", 1, 1, 6]]]], "r": [[3.78212e-06, 3.78821e-06, 3.78754e-06], 0, 4.7028, 1668059420], "v": "v0.6"}
{"i": [["[\"permute_attn_q_k_v\", 1, 7, 7, 1024, 7, 32, \"float16\"]", "cuda -keys=cuda,gpu -max_num_threads=1024 -model=unknown -thread_warp_size=32", [-1, 16, 64, 49152, 2147483647, 1024, 8, 32], "", 0, []], [[], [["FU", 1, [0, 1, 2, 3]], ["SP", 1, 0, 50176, [8], 1], ["AN", 1, 0, 5], ["AN", 1, 1, 6]]]], "r": [[7.23048e-06, 7.25029e-06, 7.24748e-06], 0, 3.92475, 1668059419], "v": "v0.6"}
{"i": [["[\"permute_attn_q_k_v\", 1, 7, 7, 1024, 7, 32, \"float16\"]", "cuda -keys=cuda,gpu -max_num_threads=1024 -model=unknown -thread_warp_size=32", [-1, 16, 64, 49152, 2147483647, 1024, 8, 32], "", 0, []], [[], [["FU", 1, [0, 1, 2, 3]], ["SP", 1, 0, 50176, [2], 1], ["AN", 1, 0, 5], ["AN", 1, 1, 6]]]], "r": [[2.13166e-05, 2.13271e-05, 2.13199e-05], 0, 3.18053, 1668059418], "v": "v0.6"}
{"i": [["[\"permute_attn_q_k_v\", 1, 7, 7, 1024, 7, 32, \"float16\"]", "cuda -keys=cuda,gpu -max_num_threads=1024 -model=unknown -thread_warp_size=32", [-1, 16, 64, 49152, 2147483647, 1024, 8, 32], "", 0, []], [[], [["FU", 1, [0, 1, 2, 3]], ["SP", 1, 0, 50176, [64], 1], ["AN", 1, 0, 5], ["AN", 1, 1, 6]]]], "r": [[3.0743e-06, 3.07109e-06, 3.07093e-06], 0, 4.30499, 1668059420], "v": "v0.6"}
{"i": [["[\"permute_attn_q_k_v\", 1, 7, 7, 1024, 7, 32, \"float16\"]", "cuda -keys=cuda,gpu -max_num_threads=1024 -model=unknown -thread_warp_size=32", [-1, 16, 64, 49152, 2147483647, 1024, 8, 32], "", 0, []], [[], [["FU", 1, [0, 1, 2, 3]], ["SP", 1, 0, 50176, [8], 1], ["AN", 1, 0, 5], ["AN", 1, 1, 6]]]], "r": [[7.20895e-06, 7.22179e-06, 7.22151e-06], 0, 0.86798, 1668059433], "v": "v0.6"}
{"i": [["[\"permute_attn_q_k_v\", 1, 7, 7, 1024, 7, 32, \"float16\"]", "cuda -keys=cuda,gpu -max_num_threads=1024 -model=unknown -thread_warp_size=32", [-1, 16, 64, 49152, 2147483647, 1024, 8, 32], "", 0, []], [[], [["FU", 1, [0, 1, 2, 3]], ["SP", 1, 0, 50176, [4], 1], ["AN", 1, 0, 5], ["AN", 1, 1, 6]]]], "r": [[1.20691e-05, 1.20857e-05, 1.20865e-05], 0, 0.583135, 1668059432], "v": "v0.6"}
{"i": [["[\"permute_attn_q_k_v\", 1, 7, 7, 1024, 7, 32, \"float16\"]", "cuda -keys=cuda,gpu -max_num_threads=1024 -model=unknown -thread_warp_size=32", [-1, 16, 64, 49152, 2147483647, 1024, 8, 32], "", 0, []], [[], [["FU", 1, [0, 1, 2, 3]], ["SP", 1, 0, 50176, [32], 1], ["AN", 1, 0, 5], ["AN", 1, 1, 6]]]], "r": [[3.62612e-06, 3.63883e-06, 3.63819e-06], 0, 2.61293, 1668059434], "v": "v0.6"}
{"i": [["[\"permute_attn_q_k_v\", 1, 7, 7, 1024, 7, 32, \"float16\"]", "cuda -keys=cuda,gpu -max_num_threads=1024 -model=unknown -thread_warp_size=32", [-1, 16, 64, 49152, 2147483647, 1024, 8, 32], "", 0, []], [[], [["FU", 1, [0, 1, 2, 3]], ["SP", 1, 0, 50176, [14], 1], ["AN", 1, 0, 5], ["AN", 1, 1, 6]]]], "r": [[5.20359e-06, 5.21204e-06, 5.21197e-06], 0, 1.23574, 1668059433], "v": "v0.6"}
{"i": [["[\"permute_attn_q_k_v\", 1, 7, 7, 1024, 7, 32, \"float16\"]", "cuda -keys=cuda,gpu -max_num_threads=1024 -model=unknown -thread_warp_size=32", [-1, 16, 64, 49152, 2147483647, 1024, 8, 32], "", 0, []], [[], [["FU", 1, [0, 1, 2, 3]], ["SP", 1, 0, 50176, [56], 1], ["AN", 1, 0, 5], ["AN", 1, 1, 6]]]], "r": [[3.2192e-06, 3.21511e-06, 3.21566e-06], 0, 2.27849, 1668059434], "v": "v0.6"}
{"i": [["[\"permute_attn_q_k_v\", 1, 7, 7, 1024, 7, 32, \"float16\"]", "cuda -keys=cuda,gpu -max_num_threads=1024 -model=unknown -thread_warp_size=32", [-1, 16, 64, 49152, 2147483647, 1024, 8, 32], "", 0, []], [[], [["FU", 1, [0, 1, 2, 3]], ["SP", 1, 0, 50176, [64], 1], ["AN", 1, 0, 5], ["AN", 1, 1, 6]]]], "r": [[3.2698e-06, 3.28329e-06, 3.28524e-06], 0, 1.56956, 1668059433], "v": "v0.6"}
{"i": [["[\"permute_attn_q_k_v\", 1, 7, 7, 1024, 7, 32, \"float16\"]", "cuda -keys=cuda,gpu -max_num_threads=1024 -model=unknown -thread_warp_size=32", [-1, 16, 64, 49152, 2147483647, 1024, 8, 32], "", 0, []], [[], [["FU", 1, [0, 1, 2, 3]], ["SP", 1, 0, 50176, [7], 1], ["AN", 1, 0, 5], ["AN", 1, 1, 6]]]], "r": [[8.12871e-06, 8.14139e-06, 8.1432e-06], 0, 3.60635, 1668059435], "v": "v0.6"}
{"i": [["[\"permute_attn_q_k_v\", 1, 7, 7, 1024, 7, 32, \"float16\"]", "cuda -keys=cuda,gpu -max_num_threads=1024 -model=unknown -thread_warp_size=32", [-1, 16, 64, 49152, 2147483647, 1024, 8, 32], "", 0, []], [[], [["FU", 1, [0, 1, 2, 3]], ["SP", 1, 0, 50176, [1], 1], ["AN", 1, 0, 5], ["AN", 1, 1, 6]]]], "r": [[3.99896e-05, 4.00049e-05, 3.99985e-05], 0, 1.89809, 1668059434], "v": "v0.6"}
{"i": [["[\"permute_attn_q_k_v\", 1, 7, 7, 1024, 7, 32, \"float16\"]", "cuda -keys=cuda,gpu -max_num_threads=1024 -model=unknown -thread_warp_size=32", [-1, 16, 64, 49152, 2147483647, 1024, 8, 32], "", 0, []], [[], [["FU", 1, [0, 1, 2, 3]], ["SP", 1, 0, 50176, [49], 1], ["AN", 1, 0, 5], ["AN", 1, 1, 6]]]], "r": [[3.48926e-06, 3.50034e-06, 3.50218e-06], 0, 3.27779, 1668059435], "v": "v0.6"}
{"i": [["[\"permute_attn_q_k_v\", 1, 7, 7, 1024, 7, 32, \"float16\"]", "cuda -keys=cuda,gpu -max_num_threads=1024 -model=unknown -thread_warp_size=32", [-1, 16, 64, 49152, 2147483647, 1024, 8, 32], "", 0, []], [[], [["FU", 1, [0, 1, 2, 3]], ["SP", 1, 0, 50176, [2], 1], ["AN", 1, 0, 5], ["AN", 1, 1, 6]]]], "r": [[2.14026e-05, 2.14123e-05, 2.13963e-05], 0, 4.32555, 1668059436], "v": "v0.6"}
{"i": [["[\"permute_attn_q_k_v\", 1, 7, 7, 1024, 7, 32, \"float16\"]", "cuda -keys=cuda,gpu -max_num_threads=1024 -model=unknown -thread_warp_size=32", [-1, 16, 64, 49152, 2147483647, 1024, 8, 32], "", 0, []], [[], [["FU", 1, [0, 1, 2, 3]], ["SP", 1, 0, 50176, [28], 1], ["AN", 1, 0, 5], ["AN", 1, 1, 6]]]], "r": [[3.89988e-06, 3.91279e-06, 3.91511e-06], 0, 2.93086, 1668059435], "v": "v0.6"}
{"i": [["[\"permute_attn_q_k_v\", 1, 7, 7, 1024, 7, 32, \"float16\"]", "cuda -keys=cuda,gpu -max_num_threads=1024 -model=unknown -thread_warp_size=32", [-1, 16, 64, 49152, 2147483647, 1024, 8, 32], "", 0, []], [[], [["FU", 1, [0, 1, 2, 3]], ["SP", 1, 0, 50176, [16], 1], ["AN", 1, 0, 5], ["AN", 1, 1, 6]]]], "r": [[5.02196e-06, 5.03528e-06, 5.03519e-06], 0, 3.94369, 1668059436], "v": "v0.6"}
{"i": [["[\"permute_attn_q_k_v\", 1, 7, 7, 1024, 7, 32, \"float16\"]", "cuda -keys=cuda,gpu -max_num_threads=1024 -model=unknown -thread_warp_size=32", [-1, 16, 64, 49152, 2147483647, 1024, 8, 32], "", 0, []], [[], [["FU", 1, [0, 1, 2, 3]], ["SP", 1, 0, 50176, [7], 1], ["AN", 1, 0, 5], ["AN", 1, 1, 6]]]], "r": [[7.94851e-06, 7.96215e-06, 7.9599e-06], 0, 0.87736, 1668059449], "v": "v0.6"}
{"i": [["[\"permute_attn_q_k_v\", 1, 7, 7, 1024, 7, 32, \"float16\"]", "cuda -keys=cuda,gpu -max_num_threads=1024 -model=unknown -thread_warp_size=32", [-1, 16, 64, 49152, 2147483647, 1024, 8, 32], "", 0, []], [[], [["FU", 1, [0, 1, 2, 3]], ["SP", 1, 0, 50176, [14], 1], ["AN", 1, 0, 5], ["AN", 1, 1, 6]]]], "r": [[5.25465e-06, 5.26431e-06, 5.26361e-06], 0, 1.57172, 1668059450], "v": "v0.6"}
{"i": [["[\"permute_attn_q_k_v\", 1, 7, 7, 1024, 7, 32, \"float16\"]", "cuda -keys=cuda,gpu -max_num_threads=1024 -model=unknown -thread_warp_size=32", [-1, 16, 64, 49152, 2147483647, 1024, 8, 32], "", 0, []], [[], [["FU", 1, [0, 1, 2, 3]], ["SP", 1, 0, 50176, [1], 1], ["AN", 1, 0, 5], ["AN", 1, 1, 6]]]], "r": [[3.99435e-05, 3.996e-05, 3.99601e-05], 0, 0.57496, 1668059449], "v": "v0.6"}
{"i": [["[\"permute_attn_q_k_v\", 1, 7, 7, 1024, 7, 32, \"float16\"]", "cuda -keys=cuda,gpu -max_num_threads=1024 -model=unknown -thread_warp_size=32", [-1, 16, 64, 49152, 2147483647, 1024, 8, 32], "", 0, []], [[], [["FU", 1, [0, 1, 2, 3]], ["SP", 1, 0, 50176, [56], 1], ["AN", 1, 0, 5], ["AN", 1, 1, 6]]]], "r": [[3.14323e-06, 3.14081e-06, 3.13862e-06], 0, 1.90623, 1668059451], "v": "v0.6"}
{"i": [["[\"permute_attn_q_k_v\", 1, 7, 7, 1024, 7, 32, \"float16\"]", "cuda -keys=cuda,gpu -max_num_threads=1024 -model=unknown -thread_warp_size=32", [-1, 16, 64, 49152, 2147483647, 1024, 8, 32], "", 0, []], [[], [["FU", 1, [0, 1, 2, 3]], ["SP", 1, 0, 50176, [16], 1], ["AN", 1, 0, 5], ["AN", 1, 1, 6]]]], "r": [[4.98315e-06, 4.99876e-06, 4.99293e-06], 0, 1.24347, 1668059450], "v": "v0.6"}
{"i": [["[\"permute_attn_q_k_v\", 1, 7, 7, 1024, 7, 32, \"float16\"]", "cuda -keys=cuda,gpu -max_num_threads=1024 -model=unknown -thread_warp_size=32", [-1, 16, 64, 49152, 2147483647, 1024, 8, 32], "", 0, []], [[], [["FU", 1, [0, 1, 2, 3]], ["SP", 1, 0, 50176, [64], 1], ["AN", 1, 0, 5], ["AN", 1, 1, 6]]]], "r": [[3.09027e-06, 3.09026e-06, 3.08954e-06], 0, 2.29219, 1668059451], "v": "v0.6"}
{"i": [["[\"permute_attn_q_k_v\", 1, 7, 7, 1024, 7, 32, \"float16\"]", "cuda -keys=cuda,gpu -max_num_threads=1024 -model=unknown -thread_warp_size=32", [-1, 16, 64, 49152, 2147483647, 1024, 8, 32], "", 0, []], [[], [["FU", 1, [0, 1, 2, 3]], ["SP", 1, 0, 50176, [32], 1], ["AN", 1, 0, 5], ["AN", 1, 1, 6]]]], "r": [[3.63604e-06, 3.64915e-06, 3.64735e-06], 0, 2.94124, 1668059452], "v": "v0.6"}
{"i": [["[\"permute_attn_q_k_v\", 1, 7, 7, 1024, 7, 32, \"float16\"]", "cuda -keys=cuda,gpu -max_num_threads=1024 -model=unknown -thread_warp_size=32", [-1, 16, 64, 49152, 2147483647, 1024, 8, 32], "", 0, []], [[], [["FU", 1, [0, 1, 2, 3]], ["SP", 1, 0, 50176, [8], 1], ["AN", 1, 0, 5], ["AN", 1, 1, 6]]]], "r": [[7.23776e-06, 7.254e-06, 7.24855e-06], 0, 2.62135, 1668059451], "v": "v0.6"}
{"i": [["[\"permute_attn_q_k_v\", 1, 7, 7, 1024, 7, 32, \"float16\"]", "cuda -keys=cuda,gpu -max_num_threads=1024 -model=unknown -thread_warp_size=32", [-1, 16, 64, 49152, 2147483647, 1024, 8, 32], "", 0, []], [[], [["FU", 1, [0, 1, 2, 3]], ["SP", 1, 0, 50176, [49], 1], ["AN", 1, 0, 5], ["AN", 1, 1, 6]]]], "r": [[3.3078e-06, 3.32178e-06, 3.31681e-06], 0, 3.97139, 1668059453], "v": "v0.6"}
{"i": [["[\"permute_attn_q_k_v\", 1, 7, 7, 1024, 7, 32, \"float16\"]", "cuda -keys=cuda,gpu -max_num_threads=1024 -model=unknown -thread_warp_size=32", [-1, 16, 64, 49152, 2147483647, 1024, 8, 32], "", 0, []], [[], [["FU", 1, [0, 1, 2, 3]], ["SP", 1, 0, 50176, [2], 1], ["AN", 1, 0, 5], ["AN", 1, 1, 6]]]], "r": [[2.15488e-05, 2.15369e-05, 2.15481e-05], 0, 3.31661, 1668059452], "v": "v0.6"}
{"i": [["[\"permute_attn_q_k_v\", 1, 7, 7, 1024, 7, 32, \"float16\"]", "cuda -keys=cuda,gpu -max_num_threads=1024 -model=unknown -thread_warp_size=32", [-1, 16, 64, 49152, 2147483647, 1024, 8, 32], "", 0, []], [[], [["FU", 1, [0, 1, 2, 3]], ["SP", 1, 0, 50176, [28], 1], ["AN", 1, 0, 5], ["AN", 1, 1, 6]]]], "r": [[3.86335e-06, 3.88707e-06, 3.88866e-06], 0, 4.35237, 1668059453], "v": "v0.6"}
{"i": [["[\"permute_attn_q_k_v\", 1, 7, 7, 1024, 7, 32, \"float16\"]", "cuda -keys=cuda,gpu -max_num_threads=1024 -model=unknown -thread_warp_size=32", [-1, 16, 64, 49152, 2147483647, 1024, 8, 32], "", 0, []], [[], [["FU", 1, [0, 1, 2, 3]], ["SP", 1, 0, 50176, [4], 1], ["AN", 1, 0, 5], ["AN", 1, 1, 6]]]], "r": [[1.20733e-05, 1.20807e-05, 1.20757e-05], 0, 3.6408, 1668059452], "v": "v0.6"}
{"i": [["[\"permute_attn_q_k_v\", 1, 7, 7, 1024, 7, 32, \"float16\"]", "cuda -keys=cuda,gpu -max_num_threads=1024 -model=unknown -thread_warp_size=32", [-1, 16, 64, 49152, 2147483647, 1024, 8, 32], "", 0, []], [[], [["FU", 1, [0, 1, 2, 3]], ["SP", 1, 0, 50176, [4], 1], ["AN", 1, 0, 5], ["AN", 1, 1, 6]]]], "r": [[1.20671e-05, 1.20736e-05, 1.20793e-05], 0, 1.95906, 1668061559], "v": "v0.6"}
{"i": [["[\"permute_attn_q_k_v\", 1, 7, 7, 1024, 7, 32, \"float16\"]", "cuda -keys=cuda,gpu -max_num_threads=1024 -model=unknown -thread_warp_size=32", [-1, 16, 64, 49152, 2147483647, 1024, 8, 32], "", 0, []], [[], [["FU", 1, [0, 1, 2, 3]], ["SP", 1, 0, 50176, [1], 1], ["AN", 1, 0, 5], ["AN", 1, 1, 6]]]], "r": [[4.00503e-05, 4.00602e-05, 4.00445e-05], 0, 1.62772, 1668061559], "v": "v0.6"}
{"i": [["[\"permute_attn_q_k_v\", 1, 7, 7, 1024, 7, 32, \"float16\"]", "cuda -keys=cuda,gpu -max_num_threads=1024 -model=unknown -thread_warp_size=32", [-1, 16, 64, 49152, 2147483647, 1024, 8, 32], "", 0, []], [[], [["FU", 1, [0, 1, 2, 3]], ["SP", 1, 0, 50176, [49], 1], ["AN", 1, 0, 5], ["AN", 1, 1, 6]]]], "r": [[3.42938e-06, 3.43601e-06, 3.43666e-06], 0, 0.570714, 1668061557], "v": "v0.6"}
{"i": [["[\"permute_attn_q_k_v\", 1, 7, 7, 1024, 7, 32, \"float16\"]", "cuda -keys=cuda,gpu -max_num_threads=1024 -model=unknown -thread_warp_size=32", [-1, 16, 64, 49152, 2147483647, 1024, 8, 32], "", 0, []], [[], [["FU", 1, [0, 1, 2, 3]], ["SP", 1, 0, 50176, [8], 1], ["AN", 1, 0, 5], ["AN", 1, 1, 6]]]], "r": [[7.16741e-06, 7.17963e-06, 7.17683e-06], 0, 1.28214, 1668061558], "v": "v0.6"}
{"i": [["[\"permute_attn_q_k_v\", 1, 7, 7, 1024, 7, 32, \"float16\"]", "cuda -keys=cuda,gpu -max_num_threads=1024 -model=unknown -thread_warp_size=32", [-1, 16, 64, 49152, 2147483647, 1024, 8, 32], "", 0, []], [[], [["FU", 1, [0, 1, 2, 3]], ["SP", 1, 0, 50176, [56], 1], ["AN", 1, 0, 5], ["AN", 1, 1, 6]]]], "r": [[3.18892e-06, 3.19101e-06, 3.19025e-06], 0, 0.910406, 1668061558], "v": "v0.6"}
{"i": [["[\"permute_attn_q_k_v\", 1, 7, 7, 1024, 7, 32, \"float16\"]", "cuda -keys=cuda,gpu -max_num_threads=1024 -model=unknown -thread_warp_size=32", [-1, 16, 64, 49152, 2147483647, 1024, 8, 32], "", 0, []], [[], [["FU", 1, [0, 1, 2, 3]], ["SP", 1, 0, 50176, [32], 1], ["AN", 1, 0, 5], ["AN", 1, 1, 6]]]], "r": [[3.70083e-06, 3.71347e-06, 3.71189e-06], 0, 2.63921, 1668061560], "v": "v0.6"}
{"i": [["[\"permute_attn_q_k_v\", 1, 7, 7, 1024, 7, 32, \"float16\"]", "cuda -keys=cuda,gpu -max_num_threads=1024 -model=unknown -thread_warp_size=32", [-1, 16, 64, 49152, 2147483647, 1024, 8, 32], "", 0, []], [[], [["FU", 1, [0, 1, 2, 3]], ["SP", 1, 0, 50176, [7], 1], ["AN", 1, 0, 5], ["AN", 1, 1, 6]]]], "r": [[7.97036e-06, 7.96713e-06, 7.97503e-06], 0, 2.33337, 1668061559], "v": "v0.6"}
{"i": [["[\"permute_attn_q_k_v\", 1, 7, 7, 1024, 7, 32, \"float16\"]", "cuda -keys=cuda,gpu -max_num_threads=1024 -model=unknown -thread_warp_size=32", [-1, 16, 64, 49152, 2147483647, 1024, 8, 32], "", 0, []], [[], [["FU", 1, [0, 1, 2, 3]], ["SP", 1, 0, 50176, [64], 1], ["AN", 1, 0, 5], ["AN", 1, 1, 6]]]], "r": [[3.21587e-06, 3.22886e-06, 3.22437e-06], 0, 2.97138, 1668061560], "v": "v0.6"}
{"i": [["[\"permute_attn_q_k_v\", 1, 7, 7, 1024, 7, 32, \"float16\"]", "cuda -keys=cuda,gpu -max_num_threads=1024 -model=unknown -thread_warp_size=32", [-1, 16, 64, 49152, 2147483647, 1024, 8, 32], "", 0, []], [[], [["FU", 1, [0, 1, 2, 3]], ["SP", 1, 0, 50176, [14], 1], ["AN", 1, 0, 5], ["AN", 1, 1, 6]]]], "r": [[5.41069e-06, 5.44034e-06, 5.44081e-06], 0, 4.01565, 1668061561], "v": "v0.6"}
{"i": [["[\"permute_attn_q_k_v\", 1, 7, 7, 1024, 7, 32, \"float16\"]", "cuda -keys=cuda,gpu -max_num_threads=1024 -model=unknown -thread_warp_size=32", [-1, 16, 64, 49152, 2147483647, 1024, 8, 32], "", 0, []], [[], [["FU", 1, [0, 1, 2, 3]], ["SP", 1, 0, 50176, [16], 1], ["AN", 1, 0, 5], ["AN", 1, 1, 6]]]], "r": [[4.9904e-06, 5.00608e-06, 5.00713e-06], 0, 4.40161, 1668061561], "v": "v0.6"}
{"i": [["[\"permute_attn_q_k_v\", 1, 7, 7, 1024, 7, 32, \"float16\"]", "cuda -keys=cuda,gpu -max_num_threads=1024 -model=unknown -thread_warp_size=32", [-1, 16, 64, 49152, 2147483647, 1024, 8, 32], "", 0, []], [[], [["FU", 1, [0, 1, 2, 3]], ["SP", 1, 0, 50176, [2], 1], ["AN", 1, 0, 5], ["AN", 1, 1, 6]]]], "r": [[2.13991e-05, 2.14145e-05, 2.14127e-05], 0, 3.68679, 1668061561], "v": "v0.6"}
{"i": [["[\"permute_attn_q_k_v\", 1, 7, 7, 1024, 7, 32, \"float16\"]", "cuda -keys=cuda,gpu -max_num_threads=1024 -model=unknown -thread_warp_size=32", [-1, 16, 64, 49152, 2147483647, 1024, 8, 32], "", 0, []], [[], [["FU", 1, [0, 1, 2, 3]], ["SP", 1, 0, 50176, [28], 1], ["AN", 1, 0, 5], ["AN", 1, 1, 6]]]], "r": [[3.81677e-06, 3.82414e-06, 3.82763e-06], 0, 3.34211, 1668061560], "v": "v0.6"}
{"i": [["[\"permute_attn_q_k_v\", 1, 7, 7, 1024, 7, 32, \"float16\"]", "cuda -keys=cuda,gpu -max_num_threads=1024 -model=unknown -thread_warp_size=32", [-1, 16, 64, 49152, 2147483647, 1024, 8, 32], "", 0, []], [[], [["FU", 1, [0, 1, 2, 3]], ["SP", 1, 0, 50176, [64], 1], ["AN", 1, 0, 5], ["AN", 1, 1, 6]]]], "r": [[3.07992e-06, 3.07744e-06, 3.07786e-06], 0, 1.52421, 1668061575], "v": "v0.6"}
{"i": [["[\"permute_attn_q_k_v\", 1, 7, 7, 1024, 7, 32, \"float16\"]", "cuda -keys=cuda,gpu -max_num_threads=1024 -model=unknown -thread_warp_size=32", [-1, 16, 64, 49152, 2147483647, 1024, 8, 32], "", 0, []], [[], [["FU", 1, [0, 1, 2, 3]], ["SP", 1, 0, 50176, [7], 1], ["AN", 1, 0, 5], ["AN", 1, 1, 6]]]], "r": [[7.9846e-06, 7.9954e-06, 7.9982e-06], 0, 0.834411, 1668061575], "v": "v0.6"}
{"i": [["[\"permute_attn_q_k_v\", 1, 7, 7, 1024, 7, 32, \"float16\"]", "cuda -keys=cuda,gpu -max_num_threads=1024 -model=unknown -thread_warp_size=32", [-1, 16, 64, 49152, 2147483647, 1024, 8, 32], "", 0, []], [[], [["FU", 1, [0, 1, 2, 3]], ["SP", 1, 0, 50176, [56], 1], ["AN", 1, 0, 5], ["AN", 1, 1, 6]]]], "r": [[3.09642e-06, 3.09348e-06, 3.0945e-06], 0, 1.21372, 1668061575], "v": "v0.6"}
{"i": [["[\"permute_attn_q_k_v\", 1, 7, 7, 1024, 7, 32, \"float16\"]", "cuda -keys=cuda,gpu -max_num_threads=1024 -model=unknown -thread_warp_size=32", [-1, 16, 64, 49152, 2147483647, 1024, 8, 32], "", 0, []], [[], [["FU", 1, [0, 1, 2, 3]], ["SP", 1, 0, 50176, [2], 1], ["AN", 1, 0, 5], ["AN", 1, 1, 6]]]], "r": [[2.12981e-05, 2.13047e-05, 2.13071e-05], 0, 1.87292, 1668061576], "v": "v0.6"}
{"i": [["[\"permute_attn_q_k_v\", 1, 7, 7, 1024, 7, 32, \"float16\"]", "cuda -keys=cuda,gpu -max_num_threads=1024 -model=unknown -thread_warp_size=32", [-1, 16, 64, 49152, 2147483647, 1024, 8, 32], "", 0, []], [[], [["FU", 1, [0, 1, 2, 3]], ["SP", 1, 0, 50176, [1], 1], ["AN", 1, 0, 5], ["AN", 1, 1, 6]]]], "r": [[3.99609e-05, 3.99771e-05, 3.99618e-05], 0, 0.589641, 1668061574], "v": "v0.6"}
{"i": [["[\"permute_attn_q_k_v\", 1, 7, 7, 1024, 7, 32, \"float16\"]", "cuda -keys=cuda,gpu -max_num_threads=1024 -model=unknown -thread_warp_size=32", [-1, 16, 64, 49152, 2147483647, 1024, 8, 32], "", 0, []], [[], [["FU", 1, [0, 1, 2, 3]], ["SP", 1, 0, 50176, [14], 1], ["AN", 1, 0, 5], ["AN", 1, 1, 6]]]], "r": [[5.44684e-06, 5.45379e-06, 5.45426e-06], 0, 2.23444, 1668061576], "v": "v0.6"}
{"i": [["[\"permute_attn_q_k_v\", 1, 7, 7, 1024, 7, 32, \"float16\"]", "cuda -keys=cuda,gpu -max_num_threads=1024 -model=unknown -thread_warp_size=32", [-1, 16, 64, 49152, 2147483647, 1024, 8, 32], "", 0, []], [[], [["FU", 1, [0, 1, 2, 3]], ["SP", 1, 0, 50176, [49], 1], ["AN", 1, 0, 5], ["AN", 1, 1, 6]]]], "r": [[3.49063e-06, 3.50594e-06, 3.50489e-06], 0, 2.57445, 1668061576], "v": "v0.6"}
{"i": [["[\"permute_attn_q_k_v\", 1, 7, 7, 1024, 7, 32, \"float16\"]", "cuda -keys=cuda,gpu -max_num_threads=1024 -model=unknown -thread_warp_size=32", [-1, 16, 64, 49152, 2147483647, 1024, 8, 32], "", 0, []], [[], [["FU", 1, [0, 1, 2, 3]], ["SP", 1, 0, 50176, [32], 1], ["AN", 1, 0, 5], ["AN", 1, 1, 6]]]], "r": [[3.65286e-06, 3.65738e-06, 3.65843e-06], 0, 4.3114, 1668061578], "v": "v0.6"}
{"i": [["[\"permute_attn_q_k_v\", 1, 7, 7, 1024, 7, 32, \"float16\"]", "cuda -keys=cuda,gpu -max_num_threads=1024 -model=unknown -thread_warp_size=32", [-1, 16, 64, 49152, 2147483647, 1024, 8, 32], "", 0, []], [[], [["FU", 1, [0, 1, 2, 3]], ["SP", 1, 0, 50176, [28], 1], ["AN", 1, 0, 5], ["AN", 1, 1, 6]]]], "r": [[3.92396e-06, 3.93048e-06, 3.93559e-06], 0, 2.89406, 1668061577], "v": "v0.6"}
{"i": [["[\"permute_attn_q_k_v\", 1, 7, 7, 1024, 7, 32, \"float16\"]", "cuda -keys=cuda,gpu -max_num_threads=1024 -model=unknown -thread_warp_size=32", [-1, 16, 64, 49152, 2147483647, 1024, 8, 32], "", 0, []], [[], [["FU", 1, [0, 1, 2, 3]], ["SP", 1, 0, 50176, [4], 1], ["AN", 1, 0, 5], ["AN", 1, 1, 6]]]], "r": [[1.20254e-05, 1.20345e-05, 1.20339e-05], 0, 3.24766, 1668061577], "v": "v0.6"}
{"i": [["[\"permute_attn_q_k_v\", 1, 7, 7, 1024, 7, 32, \"float16\"]", "cuda -keys=cuda,gpu -max_num_threads=1024 -model=unknown -thread_warp_size=32", [-1, 16, 64, 49152, 2147483647, 1024, 8, 32], "", 0, []], [[], [["FU", 1, [0, 1, 2, 3]], ["SP", 1, 0, 50176, [8], 1], ["AN", 1, 0, 5], ["AN", 1, 1, 6]]]], "r": [[7.2411e-06, 7.25153e-06, 7.25451e-06], 0, 3.93667, 1668061578], "v": "v0.6"}
{"i": [["[\"permute_attn_q_k_v\", 1, 7, 7, 1024, 7, 32, \"float16\"]", "cuda -keys=cuda,gpu -max_num_threads=1024 -model=unknown -thread_warp_size=32", [-1, 16, 64, 49152, 2147483647, 1024, 8, 32], "", 0, []], [[], [["FU", 1, [0, 1, 2, 3]], ["SP", 1, 0, 50176, [16], 1], ["AN", 1, 0, 5], ["AN", 1, 1, 6]]]], "r": [[5.02407e-06, 5.02552e-06, 5.03037e-06], 0, 3.5927, 1668061578], "v": "v0.6"}
{"i": [["[\"permute_attn_q_k_v\", 1, 7, 7, 1024, 7, 32, \"float16\"]", "cuda -keys=cuda,gpu -max_num_threads=1024 -model=unknown -thread_warp_size=32", [-1, 16, 64, 49152, 2147483647, 1024, 8, 32], "", 0, []], [[], [["FU", 1, [0, 1, 2, 3]], ["SP", 1, 0, 50176, [2], 1], ["AN", 1, 0, 5], ["AN", 1, 1, 6]]]], "r": [[2.13548e-05, 2.13662e-05, 2.13691e-05], 0, 0.587631, 1668061591], "v": "v0.6"}
{"i": [["[\"permute_attn_q_k_v\", 1, 7, 7, 1024, 7, 32, \"float16\"]", "cuda -keys=cuda,gpu -max_num_threads=1024 -model=unknown -thread_warp_size=32", [-1, 16, 64, 49152, 2147483647, 1024, 8, 32], "", 0, []], [[], [["FU", 1, [0, 1, 2, 3]], ["SP", 1, 0, 50176, [28], 1], ["AN", 1, 0, 5], ["AN", 1, 1, 6]]]], "r": [[3.89037e-06, 3.90161e-06, 3.90208e-06], 0, 1.99236, 1668061593], "v": "v0.6"}
{"i": [["[\"permute_attn_q_k_v\", 1, 7, 7, 1024, 7, 32, \"float16\"]", "cuda -keys=cuda,gpu -max_num_threads=1024 -model=unknown -thread_warp_size=32", [-1, 16, 64, 49152, 2147483647, 1024, 8, 32], "", 0, []], [[], [["FU", 1, [0, 1, 2, 3]], ["SP", 1, 0, 50176, [7], 1], ["AN", 1, 0, 5], ["AN", 1, 1, 6]]]], "r": [[7.94731e-06, 7.95656e-06, 7.9574e-06], 0, 1.65185, 1668061593], "v": "v0.6"}
{"i": [["[\"permute_attn_q_k_v\", 1, 7, 7, 1024, 7, 32, \"float16\"]", "cuda -keys=cuda,gpu -max_num_threads=1024 -model=unknown -thread_warp_size=32", [-1, 16, 64, 49152, 2147483647, 1024, 8, 32], "", 0, []], [[], [["FU", 1, [0, 1, 2, 3]], ["SP", 1, 0, 50176, [8], 1], ["AN", 1, 0, 5], ["AN", 1, 1, 6]]]], "r": [[7.28262e-06, 7.29742e-06, 7.29162e-06], 0, 3.01937, 1668061594], "v": "v0.6"}
{"i": [["[\"permute_attn_q_k_v\", 1, 7, 7, 1024, 7, 32, \"float16\"]", "cuda -keys=cuda,gpu -max_num_threads=1024 -model=unknown -thread_warp_size=32", [-1, 16, 64, 49152, 2147483647, 1024, 8, 32], "", 0, []], [[], [["FU", 1, [0, 1, 2, 3]], ["SP", 1, 0, 50176, [64], 1], ["AN", 1, 0, 5], ["AN", 1, 1, 6]]]], "r": [[3.02839e-06, 3.02301e-06, 3.02421e-06], 0, 0.925211, 1668061592], "v": "v0.6"}
{"i": [["[\"permute_attn_q_k_v\", 1, 7, 7, 1024, 7, 32, \"float16\"]", "cuda -keys=cuda,gpu -max_num_threads=1024 -model=unknown -thread_warp_size=32", [-1, 16, 64, 49152, 2147483647, 1024, 8, 32], "", 0, []], [[], [["FU", 1, [0, 1, 2, 3]], ["SP", 1, 0, 50176, [14], 1], ["AN", 1, 0, 5], ["AN", 1, 1, 6]]]], "r": [[5.39902e-06, 5.41542e-06, 5.41426e-06], 0, 2.34449, 1668061593], "v": "v0.6"}
{"i": [["[\"permute_attn_q_k_v\", 1, 7, 7, 1024, 7, 32, \"float16\"]", "cuda -keys=cuda,gpu -max_num_threads=1024 -model=unknown -thread_warp_size=32", [-1, 16, 64, 49152, 2147483647, 1024, 8, 32], "", 0, []], [[], [["FU", 1, [0, 1, 2, 3]], ["SP", 1, 0, 50176, [16], 1], ["AN", 1, 0, 5], ["AN", 1, 1, 6]]]], "r": [[5.10878e-06, 5.12966e-06, 5.12279e-06], 0, 1.30812, 1668061592], "v": "v0.6"}
{"i": [["[\"permute_attn_q_k_v\", 1, 7, 7, 1024, 7, 32, \"float16\"]", "cuda -keys=cuda,gpu -max_num_threads=1024 -model=unknown -thread_warp_size=32", [-1, 16, 64, 49152, 2147483647, 1024, 8, 32], "", 0, []], [[], [["FU", 1, [0, 1, 2, 3]], ["SP", 1, 0, 50176, [4], 1], ["AN", 1, 0, 5], ["AN", 1, 1, 6]]]], "r": [[1.21466e-05, 1.21607e-05, 1.21595e-05], 0, 2.68945, 1668061594], "v": "v0.6"}
{"i": [["[\"permute_attn_q_k_v\", 1, 7, 7, 1024, 7, 32, \"float16\"]", "cuda -keys=cuda,gpu -max_num_threads=1024 -model=unknown -thread_warp_size=32", [-1, 16, 64, 49152, 2147483647, 1024, 8, 32], "", 0, []], [[], [["FU", 1, [0, 1, 2, 3]], ["SP", 1, 0, 50176, [32], 1], ["AN", 1, 0, 5], ["AN", 1, 1, 6]]]], "r": [[3.63442e-06, 3.64637e-06, 3.64516e-06], 0, 3.38817, 1668061594], "v": "v0.6"}
{"i": [["[\"permute_attn_q_k_v\", 1, 7, 7, 1024, 7, 32, \"float16\"]", "cuda -keys=cuda,gpu -max_num_threads=1024 -model=unknown -thread_warp_size=32", [-1, 16, 64, 49152, 2147483647, 1024, 8, 32], "", 0, []], [[], [["FU", 1, [0, 1, 2, 3]], ["SP", 1, 0, 50176, [49], 1], ["AN", 1, 0, 5], ["AN", 1, 1, 6]]]], "r": [[3.46763e-06, 3.48786e-06, 3.48713e-06], 0, 3.7154, 1668061595], "v": "v0.6"}
{"i": [["[\"permute_attn_q_k_v\", 1, 7, 7, 1024, 7, 32, \"float16\"]", "cuda -keys=cuda,gpu -max_num_threads=1024 -model=unknown -thread_warp_size=32", [-1, 16, 64, 49152, 2147483647, 1024, 8, 32], "", 0, []], [[], [["FU", 1, [0, 1, 2, 3]], ["SP", 1, 0, 50176, [1], 1], ["AN", 1, 0, 5], ["AN", 1, 1, 6]]]], "r": [[4.00467e-05, 4.00672e-05, 4.00673e-05], 0, 4.4215, 1668061595], "v": "v0.6"}
{"i": [["[\"permute_attn_q_k_v\", 1, 7, 7, 1024, 7, 32, \"float16\"]", "cuda -keys=cuda,gpu -max_num_threads=1024 -model=unknown -thread_warp_size=32", [-1, 16, 64, 49152, 2147483647, 1024, 8, 32], "", 0, []], [[], [["FU", 1, [0, 1, 2, 3]], ["SP", 1, 0, 50176, [56], 1], ["AN", 1, 0, 5], ["AN", 1, 1, 6]]]], "r": [[3.11467e-06, 3.11178e-06, 3.1119e-06], 0, 4.03414, 1668061595], "v": "v0.6"}
