python/models/swin_transformer/kernel_configs/swin_transformer_fused_window_reverse_roll_add_1_7_7_1024_0_7_float16.log
{"i": [["[\"fused_window_reverse_roll_add\", 1, 7, 7, 1024, 0, 7, \"float16\"]", "cuda -keys=cuda,gpu -max_num_threads=1024 -model=unknown -thread_warp_size=32", [-1, 16, 64, 49152, 2147483647, 1024, 8, 32], "", 0, []], [[], [["FU", 2, [0, 1, 2, 3]], ["SP", 2, 0, 50176, [64], 1], ["AN", 2, 0, 5], ["AN", 2, 1, 6]]]], "r": [[3.14961e-06, 4.43077e-06, 4.65202e-06, 3.58509e-06, 3.70436e-06, 3.9642e-06, 3.23264e-06, 4.30468e-06, 4.46529e-06, 3.66222e-06], 0, 6.17768, 1652003382], "v": "v0.6"}
{"i": [["[\"fused_window_reverse_roll_add\", 1, 7, 7, 1024, 0, 7, \"float16\"]", "cuda -keys=cuda,gpu -max_num_threads=1024 -model=unknown -thread_warp_size=32", [-1, 16, 64, 49152, 2147483647, 1024, 8, 32], "", 0, []], [[], [["FU", 2, [0, 1, 2, 3]], ["SP", 2, 0, 50176, [14], 1], ["AN", 2, 0, 5], ["AN", 2, 1, 6]]]], "r": [[5.39408e-06, 5.30754e-06, 5.33645e-06, 8.85988e-06, 5.28999e-06, 5.29113e-06, 5.32905e-06, 5.54661e-06, 9.63722e-06, 5.29702e-06], 0, 32.602, 1652003409], "v": "v0.6"}
{"i": [["[\"fused_window_reverse_roll_add\", 1, 7, 7, 1024, 0, 7, \"float16\"]", "cuda -keys=cuda,gpu -max_num_threads=1024 -model=unknown -thread_warp_size=32", [-1, 16, 64, 49152, 2147483647, 1024, 8, 32], "", 0, []], [[], [["FU", 2, [0, 1, 2, 3]], ["SP", 2, 0, 50176, [49], 1], ["AN", 2, 0, 5], ["AN", 2, 1, 6]]]], "r": [[3.50113e-06, 4.45096e-06, 4.61436e-06, 3.84087e-06, 4.0255e-06, 3.27619e-06, 3.77814e-06, 4.47441e-06, 4.65087e-06, 3.53531e-06], 0, 12.4624, 1652003389], "v": "v0.6"}
{"i": [["[\"fused_window_reverse_roll_add\", 1, 7, 7, 1024, 0, 7, \"float16\"]", "cuda -keys=cuda,gpu -max_num_threads=1024 -model=unknown -thread_warp_size=32", [-1, 16, 64, 49152, 2147483647, 1024, 8, 32], "", 0, []], [[], [["FU", 2, [0, 1, 2, 3]], ["SP", 2, 0, 50176, [8], 1], ["AN", 2, 0, 5], ["AN", 2, 1, 6]]]], "r": [[7.35667e-06, 7.35417e-06, 7.40851e-06, 7.35511e-06, 7.48151e-06, 1.0391e-05, 7.35518e-06, 7.36719e-06, 7.36869e-06, 9.97564e-06], 0, 28.0527, 1652003404], "v": "v0.6"}
{"i": [["[\"fused_window_reverse_roll_add\", 1, 7, 7, 1024, 0, 7, \"float16\"]", "cuda -keys=cuda,gpu -max_num_threads=1024 -model=unknown -thread_warp_size=32", [-1, 16, 64, 49152, 2147483647, 1024, 8, 32], "", 0, []], [[], [["FU", 2, [0, 1, 2, 3]], ["SP", 2, 0, 50176, [56], 1], ["AN", 2, 0, 5], ["AN", 2, 1, 6]]]], "r": [[5.96331e-06, 5.00662e-06, 3.67419e-06, 3.52105e-06, 5.79513e-06, 5.3864e-06, 4.48934e-06, 4.5377e-06, 3.57695e-06, 3.20834e-06], 0, 22.105, 1652003398], "v": "v0.6"}
{"i": [["[\"fused_window_reverse_roll_add\", 1, 7, 7, 1024, 0, 7, \"float16\"]", "cuda -keys=cuda,gpu -max_num_threads=1024 -model=unknown -thread_warp_size=32", [-1, 16, 64, 49152, 2147483647, 1024, 8, 32], "", 0, []], [[], [["FU", 2, [0, 1, 2, 3]], ["SP", 2, 0, 50176, [4], 1], ["AN", 2, 0, 5], ["AN", 2, 1, 6]]]], "r": [[1.19911e-05, 1.19876e-05, 1.19997e-05, 1.19838e-05, 1.19817e-05, 1.19979e-05, 1.19802e-05, 1.19791e-05, 1.19822e-05, 1.20122e-05], 0, 37.3894, 1652003414], "v": "v0.6"}
{"i": [["[\"fused_window_reverse_roll_add\", 1, 7, 7, 1024, 0, 7, \"float16\"]", "cuda -keys=cuda,gpu -max_num_threads=1024 -model=unknown -thread_warp_size=32", [-1, 16, 64, 49152, 2147483647, 1024, 8, 32], "", 0, []], [[], [["FU", 2, [0, 1, 2, 3]], ["SP", 2, 0, 50176, [16], 1], ["AN", 2, 0, 5], ["AN", 2, 1, 6]]]], "r": [[6.624e-06, 6.51554e-06, 5.14208e-06, 5.14471e-06, 4.97641e-06, 4.88671e-06, 7.54248e-06, 5.6197e-06, 5.29868e-06, 5.20419e-06], 0, 16.9003, 1652003393], "v": "v0.6"}
{"i": [["[\"fused_window_reverse_roll_add\", 1, 7, 7, 1024, 0, 7, \"float16\"]", "cuda -keys=cuda,gpu -max_num_threads=1024 -model=unknown -thread_warp_size=32", [-1, 16, 64, 49152, 2147483647, 1024, 8, 32], "", 0, []], [[], [["FU", 2, [0, 1, 2, 3]], ["SP", 2, 0, 50176, [32], 1], ["AN", 2, 0, 5], ["AN", 2, 1, 6]]]], "r": [[5.28468e-06, 4.12972e-06, 3.85672e-06, 4.50186e-06, 3.81651e-06, 3.82335e-06, 4.32448e-06, 5.05797e-06, 4.63702e-06, 4.04376e-06], 0, 46.844, 1652003423], "v": "v0.6"}
{"i": [["[\"fused_window_reverse_roll_add\", 1, 7, 7, 1024, 0, 7, \"float16\"]", "cuda -keys=cuda,gpu -max_num_threads=1024 -model=unknown -thread_warp_size=32", [-1, 16, 64, 49152, 2147483647, 1024, 8, 32], "", 0, []], [[], [["FU", 2, [0, 1, 2, 3]], ["SP", 2, 0, 50176, [2], 1], ["AN", 2, 0, 5], ["AN", 2, 1, 6]]]], "r": [[2.1334e-05, 2.13393e-05, 2.13393e-05, 2.13402e-05, 2.13381e-05, 2.13397e-05, 2.13386e-05, 2.13414e-05, 2.13356e-05, 2.13366e-05], 0, 51.0763, 1652003427], "v": "v0.6"}
{"i": [["[\"fused_window_reverse_roll_add\", 1, 7, 7, 1024, 0, 7, \"float16\"]", "cuda -keys=cuda,gpu -max_num_threads=1024 -model=unknown -thread_warp_size=32", [-1, 16, 64, 49152, 2147483647, 1024, 8, 32], "", 0, []], [[], [["FU", 2, [0, 1, 2, 3]], ["SP", 2, 0, 50176, [7], 1], ["AN", 2, 0, 5], ["AN", 2, 1, 6]]]], "r": [[8.09006e-06, 8.0908e-06, 8.08958e-06, 8.09051e-06, 8.09047e-06, 8.08991e-06, 8.09016e-06, 8.0907e-06, 8.09077e-06, 8.09102e-06], 0, 41.9247, 1652003418], "v": "v0.6"}
{"i": [["[\"fused_window_reverse_roll_add\", 1, 7, 7, 1024, 0, 7, \"float16\"]", "cuda -keys=cuda,gpu -max_num_threads=1024 -model=unknown -thread_warp_size=32", [-1, 16, 64, 49152, 2147483647, 1024, 8, 32], "", 0, []], [[], [["FU", 2, [0, 1, 2, 3]], ["SP", 2, 0, 50176, [1], 1], ["AN", 2, 0, 5], ["AN", 2, 1, 6]]]], "r": [[4.00512e-05, 4.00581e-05, 4.00524e-05, 4.00754e-05, 4.00506e-05, 4.00564e-05, 4.00571e-05, 4.00324e-05, 4.06896e-05, 4.00448e-05], 0, 61.5151, 1652003438], "v": "v0.6"}
{"i": [["[\"fused_window_reverse_roll_add\", 1, 7, 7, 1024, 0, 7, \"float16\"]", "cuda -keys=cuda,gpu -max_num_threads=1024 -model=unknown -thread_warp_size=32", [-1, 16, 64, 49152, 2147483647, 1024, 8, 32], "", 0, []], [[], [["FU", 2, [0, 1, 2, 3]], ["SP", 2, 0, 50176, [28], 1], ["AN", 2, 0, 5], ["AN", 2, 1, 6]]]], "r": [[5.06012e-06, 4.24214e-06, 4.29938e-06, 4.18656e-06, 3.85042e-06, 4.72216e-06, 5.0888e-06, 4.59046e-06, 3.94076e-06, 4.2392e-06], 0, 56.0601, 1652003432], "v": "v0.6"}
