python/models/swin_transformer/kernel_configs/swin_transformer_window_reverse_1_28_28_256_7_float16.log
{"i": [["[\"window_reverse\", 1, 28, 28, 256, 7, \"float16\"]", "cuda -keys=cuda,gpu -max_num_threads=1024 -model=unknown -thread_warp_size=32", [-1, 16, 64, 49152, 2147483647, 1024, 8, 32], "", 0, []], [[], [["FU", 1, [0, 1, 2, 3]], ["SP", 1, 0, 200704, [7], 1], ["AN", 1, 0, 5], ["AN", 1, 1, 6]]]], "r": [[2.38483e-05, 2.38688e-05, 2.38732e-05], 0, 4.26635, 1668050151], "v": "v0.6"}
{"i": [["[\"window_reverse\", 1, 28, 28, 256, 7, \"float16\"]", "cuda -keys=cuda,gpu -max_num_threads=1024 -model=unknown -thread_warp_size=32", [-1, 16, 64, 49152, 2147483647, 1024, 8, 32], "", 0, []], [[], [["FU", 1, [0, 1, 2, 3]], ["SP", 1, 0, 200704, [64], 1], ["AN", 1, 0, 5], ["AN", 1, 1, 6]]]], "r": [[4.96368e-06, 4.97284e-06, 4.97354e-06], 0, 1.34964, 1668050148], "v": "v0.6"}
{"i": [["[\"window_reverse\", 1, 28, 28, 256, 7, \"float16\"]", "cuda -keys=cuda,gpu -max_num_threads=1024 -model=unknown -thread_warp_size=32", [-1, 16, 64, 49152, 2147483647, 1024, 8, 32], "", 0, []], [[], [["FU", 1, [0, 1, 2, 3]], ["SP", 1, 0, 200704, [56], 1], ["AN", 1, 0, 5], ["AN", 1, 1, 6]]]], "r": [[5.12124e-06, 5.13585e-06, 5.1386e-06], 0, 0.988669, 1668050148], "v": "v0.6"}
{"i": [["[\"window_reverse\", 1, 28, 28, 256, 7, \"float16\"]", "cuda -keys=cuda,gpu -max_num_threads=1024 -model=unknown -thread_warp_size=32", [-1, 16, 64, 49152, 2147483647, 1024, 8, 32], "", 0, []], [[], [["FU", 1, [0, 1, 2, 3]], ["SP", 1, 0, 200704, [8], 1], ["AN", 1, 0, 5], ["AN", 1, 1, 6]]]], "r": [[2.13497e-05, 2.13628e-05, 2.13457e-05], 0, 2.93996, 1668050150], "v": "v0.6"}
{"i": [["[\"window_reverse\", 1, 28, 28, 256, 7, \"float16\"]", "cuda -keys=cuda,gpu -max_num_threads=1024 -model=unknown -thread_warp_size=32", [-1, 16, 64, 49152, 2147483647, 1024, 8, 32], "", 0, []], [[], [["FU", 1, [0, 1, 2, 3]], ["SP", 1, 0, 200704, [16], 1], ["AN", 1, 0, 5], ["AN", 1, 1, 6]]]], "r": [[1.1905e-05, 1.19137e-05, 1.19091e-05], 0, 2.23677, 1668050149], "v": "v0.6"}
{"i": [["[\"window_reverse\", 1, 28, 28, 256, 7, \"float16\"]", "cuda -keys=cuda,gpu -max_num_threads=1024 -model=unknown -thread_warp_size=32", [-1, 16, 64, 49152, 2147483647, 1024, 8, 32], "", 0, []], [[], [["FU", 1, [0, 1, 2, 3]], ["SP", 1, 0, 200704, [1], 1], ["AN", 1, 0, 5], ["AN", 1, 1, 6]]]], "r": [[0.000151552, 0.000151588, 0.000151578], 0, 1.948, 1668050149], "v": "v0.6"}
{"i": [["[\"window_reverse\", 1, 28, 28, 256, 7, \"float16\"]", "cuda -keys=cuda,gpu -max_num_threads=1024 -model=unknown -thread_warp_size=32", [-1, 16, 64, 49152, 2147483647, 1024, 8, 32], "", 0, []], [[], [["FU", 1, [0, 1, 2, 3]], ["SP", 1, 0, 200704, [49], 1], ["AN", 1, 0, 5], ["AN", 1, 1, 6]]]], "r": [[5.69883e-06, 5.7301e-06, 5.72801e-06], 0, 2.76252, 1668050150], "v": "v0.6"}
{"i": [["[\"window_reverse\", 1, 28, 28, 256, 7, \"float16\"]", "cuda -keys=cuda,gpu -max_num_threads=1024 -model=unknown -thread_warp_size=32", [-1, 16, 64, 49152, 2147483647, 1024, 8, 32], "", 0, []], [[], [["FU", 1, [0, 1, 2, 3]], ["SP", 1, 0, 200704, [32], 1], ["AN", 1, 0, 5], ["AN", 1, 1, 6]]]], "r": [[7.22881e-06, 7.24316e-06, 7.24039e-06], 0, 3.88163, 1668050151], "v": "v0.6"}
{"i": [["[\"window_reverse\", 1, 28, 28, 256, 7, \"float16\"]", "cuda -keys=cuda,gpu -max_num_threads=1024 -model=unknown -thread_warp_size=32", [-1, 16, 64, 49152, 2147483647, 1024, 8, 32], "", 0, []], [[], [["FU", 1, [0, 1, 2, 3]], ["SP", 1, 0, 200704, [4], 1], ["AN", 1, 0, 5], ["AN", 1, 1, 6]]]], "r": [[3.98391e-05, 3.98581e-05, 3.98735e-05], 0, 1.58774, 1668050149], "v": "v0.6"}
{"i": [["[\"window_reverse\", 1, 28, 28, 256, 7, \"float16\"]", "cuda -keys=cuda,gpu -max_num_threads=1024 -model=unknown -thread_warp_size=32", [-1, 16, 64, 49152, 2147483647, 1024, 8, 32], "", 0, []], [[], [["FU", 1, [0, 1, 2, 3]], ["SP", 1, 0, 200704, [28], 1], ["AN", 1, 0, 5], ["AN", 1, 1, 6]]]], "r": [[7.93308e-06, 7.95189e-06, 7.95075e-06], 0, 4.92073, 1668050152], "v": "v0.6"}
{"i": [["[\"window_reverse\", 1, 28, 28, 256, 7, \"float16\"]", "cuda -keys=cuda,gpu -max_num_threads=1024 -model=unknown -thread_warp_size=32", [-1, 16, 64, 49152, 2147483647, 1024, 8, 32], "", 0, []], [[], [["FU", 1, [0, 1, 2, 3]], ["SP", 1, 0, 200704, [14], 1], ["AN", 1, 0, 5], ["AN", 1, 1, 6]]]], "r": [[1.33207e-05, 1.3332e-05, 1.33283e-05], 0, 3.46106, 1668050151], "v": "v0.6"}
{"i": [["[\"window_reverse\", 1, 28, 28, 256, 7, \"float16\"]", "cuda -keys=cuda,gpu -max_num_threads=1024 -model=unknown -thread_warp_size=32", [-1, 16, 64, 49152, 2147483647, 1024, 8, 32], "", 0, []], [[], [["FU", 1, [0, 1, 2, 3]], ["SP", 1, 0, 200704, [2], 1], ["AN", 1, 0, 5], ["AN", 1, 1, 6]]]], "r": [[7.7133e-05, 7.71922e-05, 7.71619e-05], 0, 4.57087, 1668050152], "v": "v0.6"}
{"i": [["[\"window_reverse\", 1, 28, 28, 256, 7, \"float16\"]", "cuda -keys=cuda,gpu -max_num_threads=1024 -model=unknown -thread_warp_size=32", [-1, 16, 64, 49152, 2147483647, 1024, 8, 32], "", 0, []], [[], [["FU", 1, [0, 1, 2, 3]], ["SP", 1, 0, 200704, [8], 1], ["AN", 1, 0, 5], ["AN", 1, 1, 6]]]], "r": [[2.12577e-05, 2.12687e-05, 2.12572e-05], 0, 2.68221, 1668051406], "v": "v0.6"}
{"i": [["[\"window_reverse\", 1, 28, 28, 256, 7, \"float16\"]", "cuda -keys=cuda,gpu -max_num_threads=1024 -model=unknown -thread_warp_size=32", [-1, 16, 64, 49152, 2147483647, 1024, 8, 32], "", 0, []], [[], [["FU", 1, [0, 1, 2, 3]], ["SP", 1, 0, 200704, [28], 1], ["AN", 1, 0, 5], ["AN", 1, 1, 6]]]], "r": [[7.90848e-06, 7.92535e-06, 7.92349e-06], 0, 0.579684, 1668051404], "v": "v0.6"}
{"i": [["[\"window_reverse\", 1, 28, 28, 256, 7, \"float16\"]", "cuda -keys=cuda,gpu -max_num_threads=1024 -model=unknown -thread_warp_size=32", [-1, 16, 64, 49152, 2147483647, 1024, 8, 32], "", 0, []], [[], [["FU", 1, [0, 1, 2, 3]], ["SP", 1, 0, 200704, [49], 1], ["AN", 1, 0, 5], ["AN", 1, 1, 6]]]], "r": [[5.73031e-06, 5.7384e-06, 5.74267e-06], 0, 1.62916, 1668051405], "v": "v0.6"}
{"i": [["[\"window_reverse\", 1, 28, 28, 256, 7, \"float16\"]", "cuda -keys=cuda,gpu -max_num_threads=1024 -model=unknown -thread_warp_size=32", [-1, 16, 64, 49152, 2147483647, 1024, 8, 32], "", 0, []], [[], [["FU", 1, [0, 1, 2, 3]], ["SP", 1, 0, 200704, [16], 1], ["AN", 1, 0, 5], ["AN", 1, 1, 6]]]], "r": [[1.19539e-05, 1.19677e-05, 1.19529e-05], 0, 1.2425, 1668051404], "v": "v0.6"}
{"i": [["[\"window_reverse\", 1, 28, 28, 256, 7, \"float16\"]", "cuda -keys=cuda,gpu -max_num_threads=1024 -model=unknown -thread_warp_size=32", [-1, 16, 64, 49152, 2147483647, 1024, 8, 32], "", 0, []], [[], [["FU", 1, [0, 1, 2, 3]], ["SP", 1, 0, 200704, [56], 1], ["AN", 1, 0, 5], ["AN", 1, 1, 6]]]], "r": [[5.37924e-06, 5.39427e-06, 5.3885e-06], 0, 1.95931, 1668051405], "v": "v0.6"}
{"i": [["[\"window_reverse\", 1, 28, 28, 256, 7, \"float16\"]", "cuda -keys=cuda,gpu -max_num_threads=1024 -model=unknown -thread_warp_size=32", [-1, 16, 64, 49152, 2147483647, 1024, 8, 32], "", 0, []], [[], [["FU", 1, [0, 1, 2, 3]], ["SP", 1, 0, 200704, [32], 1], ["AN", 1, 0, 5], ["AN", 1, 1, 6]]]], "r": [[7.25001e-06, 7.27177e-06, 7.26735e-06], 0, 0.93198, 1668051404], "v": "v0.6"}
{"i": [["[\"window_reverse\", 1, 28, 28, 256, 7, \"float16\"]", "cuda -keys=cuda,gpu -max_num_threads=1024 -model=unknown -thread_warp_size=32", [-1, 16, 64, 49152, 2147483647, 1024, 8, 32], "", 0, []], [[], [["FU", 1, [0, 1, 2, 3]], ["SP", 1, 0, 200704, [7], 1], ["AN", 1, 0, 5], ["AN", 1, 1, 6]]]], "r": [[2.39147e-05, 2.39391e-05, 2.39437e-05], 0, 2.31376, 1668051405], "v": "v0.6"}
{"i": [["[\"window_reverse\", 1, 28, 28, 256, 7, \"float16\"]", "cuda -keys=cuda,gpu -max_num_threads=1024 -model=unknown -thread_warp_size=32", [-1, 16, 64, 49152, 2147483647, 1024, 8, 32], "", 0, []], [[], [["FU", 1, [0, 1, 2, 3]], ["SP", 1, 0, 200704, [64], 1], ["AN", 1, 0, 5], ["AN", 1, 1, 6]]]], "r": [[4.87037e-06, 4.87429e-06, 4.87604e-06], 0, 3.33451, 1668051406], "v": "v0.6"}
{"i": [["[\"window_reverse\", 1, 28, 28, 256, 7, \"float16\"]", "cuda -keys=cuda,gpu -max_num_threads=1024 -model=unknown -thread_warp_size=32", [-1, 16, 64, 49152, 2147483647, 1024, 8, 32], "", 0, []], [[], [["FU", 1, [0, 1, 2, 3]], ["SP", 1, 0, 200704, [14], 1], ["AN", 1, 0, 5], ["AN", 1, 1, 6]]]], "r": [[1.33299e-05, 1.33447e-05, 1.33473e-05], 0, 3.71959, 1668051407], "v": "v0.6"}
{"i": [["[\"window_reverse\", 1, 28, 28, 256, 7, \"float16\"]", "cuda -keys=cuda,gpu -max_num_threads=1024 -model=unknown -thread_warp_size=32", [-1, 16, 64, 49152, 2147483647, 1024, 8, 32], "", 0, []], [[], [["FU", 1, [0, 1, 2, 3]], ["SP", 1, 0, 200704, [4], 1], ["AN", 1, 0, 5], ["AN", 1, 1, 6]]]], "r": [[3.9806e-05, 3.98228e-05, 3.98213e-05], 0, 3.0108, 1668051406], "v": "v0.6"}
{"i": [["[\"window_reverse\", 1, 28, 28, 256, 7, \"float16\"]", "cuda -keys=cuda,gpu -max_num_threads=1024 -model=unknown -thread_warp_size=32", [-1, 16, 64, 49152, 2147483647, 1024, 8, 32], "", 0, []], [[], [["FU", 1, [0, 1, 2, 3]], ["SP", 1, 0, 200704, [1], 1], ["AN", 1, 0, 5], ["AN", 1, 1, 6]]]], "r": [[0.000151664, 0.000151658, 0.000151683], 0, 4.02795, 1668051407], "v": "v0.6"}
{"i": [["[\"window_reverse\", 1, 28, 28, 256, 7, \"float16\"]", "cuda -keys=cuda,gpu -max_num_threads=1024 -model=unknown -thread_warp_size=32", [-1, 16, 64, 49152, 2147483647, 1024, 8, 32], "", 0, []], [[], [["FU", 1, [0, 1, 2, 3]], ["SP", 1, 0, 200704, [2], 1], ["AN", 1, 0, 5], ["AN", 1, 1, 6]]]], "r": [[7.70202e-05, 7.70268e-05, 7.70542e-05], 0, 4.34891, 1668051408], "v": "v0.6"}
