python/models/swin_transformer/kernel_configs/swin_transformer_layer_normalization_variance_1_224_224_128_float16.log
{"i": [["[\"layer_normalization_variance\", 1, 224, 224, 128, \"float16\"]", "cuda -keys=cuda,gpu -max_num_threads=1024 -model=unknown -thread_warp_size=32", [-1, 16, 64, 49152, 2147483647, 1024, 8, 32], "", 0, []], [[], [["SP", 3, 1, 512, [32], 1], ["AN", 3, 2, 6], ["CI", 2], ["AN", 3, 0, 5], ["PR", 3, 0, "auto_unroll_max_step$64"]]]], "r": [[1.26075e-05, 1.26033e-05, 1.2607e-05], 0, 1.92742, 1668020685], "v": "v0.6"}
{"i": [["[\"layer_normalization_variance\", 1, 224, 224, 128, \"float16\"]", "cuda -keys=cuda,gpu -max_num_threads=1024 -model=unknown -thread_warp_size=32", [-1, 16, 64, 49152, 2147483647, 1024, 8, 32], "", 0, []], [[], [["CI", 2], ["SP", 3, 0, 12544, [56], 1], ["AN", 3, 0, 5], ["AN", 3, 1, 6], ["PR", 3, 0, "auto_unroll_max_step$1024"]]]], "r": [[6.90575e-05, 6.90112e-05, 6.90319e-05], 0, 1.39691, 1668020684], "v": "v0.6"}
{"i": [["[\"layer_normalization_variance\", 1, 224, 224, 128, \"float16\"]", "cuda -keys=cuda,gpu -max_num_threads=1024 -model=unknown -thread_warp_size=32", [-1, 16, 64, 49152, 2147483647, 1024, 8, 32], "", 0, []], [[], [["CI", 2], ["SP", 3, 0, 12544, [8], 1], ["AN", 3, 0, 5], ["AN", 3, 1, 6], ["PR", 3, 0, "auto_unroll_max_step$64"]]]], "r": [[4.81488e-05, 4.8137e-05, 4.81536e-05], 0, 2.54536, 1668020685], "v": "v0.6"}
{"i": [["[\"layer_normalization_variance\", 1, 224, 224, 128, \"float16\"]", "cuda -keys=cuda,gpu -max_num_threads=1024 -model=unknown -thread_warp_size=32", [-1, 16, 64, 49152, 2147483647, 1024, 8, 32], "", 0, []], [[], [["SP", 3, 1, 512, [16], 1], ["AN", 3, 2, 6], ["CI", 2], ["AN", 3, 0, 5], ["PR", 3, 0, "auto_unroll_max_step$1024"]]]], "r": [[1.32492e-05, 1.32487e-05, 1.32572e-05], 0, 0.852016, 1668020683], "v": "v0.6"}
{"i": [["[\"layer_normalization_variance\", 1, 224, 224, 128, \"float16\"]", "cuda -keys=cuda,gpu -max_num_threads=1024 -model=unknown -thread_warp_size=32", [-1, 16, 64, 49152, 2147483647, 1024, 8, 32], "", 0, []], [[], [["CI", 2], ["SP", 3, 0, 12544, [56], 1], ["AN", 3, 0, 5], ["AN", 3, 1, 6], ["PR", 3, 0, "auto_unroll_max_step$512"]]]], "r": [[6.89848e-05, 6.90105e-05, 6.90231e-05], 0, 11.2797, 1668020694], "v": "v0.6"}
{"i": [["[\"layer_normalization_variance\", 1, 224, 224, 128, \"float16\"]", "cuda -keys=cuda,gpu -max_num_threads=1024 -model=unknown -thread_warp_size=32", [-1, 16, 64, 49152, 2147483647, 1024, 8, 32], "", 0, []], [[], [["CI", 2], ["SP", 3, 0, 12544, [32], 1], ["AN", 3, 0, 5], ["AN", 3, 1, 6], ["PR", 3, 0, "auto_unroll_max_step$0"]]]], "r": [[6.19044e-05, 6.18885e-05, 6.18984e-05], 0, 3.084, 1668020686], "v": "v0.6"}
{"i": [["[\"layer_normalization_variance\", 1, 224, 224, 128, \"float16\"]", "cuda -keys=cuda,gpu -max_num_threads=1024 -model=unknown -thread_warp_size=32", [-1, 16, 64, 49152, 2147483647, 1024, 8, 32], "", 0, []], [[], [["CI", 2], ["SP", 3, 0, 12544, [2], 1], ["AN", 3, 0, 5], ["AN", 3, 1, 6], ["PR", 3, 0, "auto_unroll_max_step$512"]]]], "r": [[6.68483e-05, 6.66715e-05, 6.67118e-05], 0, 5.31822, 1668020688], "v": "v0.6"}
{"i": [["[\"layer_normalization_variance\", 1, 224, 224, 128, \"float16\"]", "cuda -keys=cuda,gpu -max_num_threads=1024 -model=unknown -thread_warp_size=32", [-1, 16, 64, 49152, 2147483647, 1024, 8, 32], "", 0, []], [[], [["CI", 2], ["SP", 3, 0, 12544, [32], 1], ["AN", 3, 0, 5], ["AN", 3, 1, 6], ["PR", 3, 0, "auto_unroll_max_step$1024"]]]], "r": [[6.1774e-05, 6.17684e-05, 6.17833e-05], 0, 3.62873, 1668020686], "v": "v0.6"}
{"i": [["[\"layer_normalization_variance\", 1, 224, 224, 128, \"float16\"]", "cuda -keys=cuda,gpu -max_num_threads=1024 -model=unknown -thread_warp_size=32", [-1, 16, 64, 49152, 2147483647, 1024, 8, 32], "", 0, []], [[], [["SP", 3, 1, 512, [16], 1], ["AN", 3, 2, 6], ["CI", 2], ["AN", 3, 0, 5], ["PR", 3, 0, "auto_unroll_max_step$0"]]]], "r": [[1.31818e-05, 1.3186e-05, 1.31756e-05], 0, 4.19446, 1668020687], "v": "v0.6"}
{"i": [["[\"layer_normalization_variance\", 1, 224, 224, 128, \"float16\"]", "cuda -keys=cuda,gpu -max_num_threads=1024 -model=unknown -thread_warp_size=32", [-1, 16, 64, 49152, 2147483647, 1024, 8, 32], "", 0, []], [[], [["SP", 3, 1, 512, [4], 1], ["AN", 3, 2, 6], ["CI", 2], ["AN", 3, 0, 5], ["PR", 3, 0, "auto_unroll_max_step$64"]]]], "r": [[2.73598e-05, 2.7364e-05, 2.73785e-05], 0, 4.72079, 1668020687], "v": "v0.6"}
{"i": [["[\"layer_normalization_variance\", 1, 224, 224, 128, \"float16\"]", "cuda -keys=cuda,gpu -max_num_threads=1024 -model=unknown -thread_warp_size=32", [-1, 16, 64, 49152, 2147483647, 1024, 8, 32], "", 0, []], [[], [["CI", 2], ["SP", 3, 0, 12544, [28], 1], ["AN", 3, 0, 5], ["AN", 3, 1, 6], ["PR", 3, 0, "auto_unroll_max_step$16"]]]], "r": [[5.9183e-05, 5.92545e-05, 5.92712e-05], 0, 5.94912, 1668020689], "v": "v0.6"}
{"i": [["[\"layer_normalization_variance\", 1, 224, 224, 128, \"float16\"]", "cuda -keys=cuda,gpu -max_num_threads=1024 -model=unknown -thread_warp_size=32", [-1, 16, 64, 49152, 2147483647, 1024, 8, 32], "", 0, []], [[], [["SP", 3, 1, 512, [1], 1], ["AN", 3, 2, 6], ["CI", 2], ["AN", 3, 0, 5], ["PR", 3, 0, "auto_unroll_max_step$512"]]]], "r": [[8.15357e-05, 8.15256e-05, 8.14855e-05], 0, 6.45239, 1668020689], "v": "v0.6"}
{"i": [["[\"layer_normalization_variance\", 1, 224, 224, 128, \"float16\"]", "cuda -keys=cuda,gpu -max_num_threads=1024 -model=unknown -thread_warp_size=32", [-1, 16, 64, 49152, 2147483647, 1024, 8, 32], "", 0, []], [[], [["SP", 3, 1, 512, [4], 1], ["AN", 3, 2, 6], ["CI", 2], ["AN", 3, 0, 5], ["PR", 3, 0, "auto_unroll_max_step$16"]]]], "r": [[2.73169e-05, 2.73098e-05, 2.73231e-05], 0, 8.09426, 1668020691], "v": "v0.6"}
{"i": [["[\"layer_normalization_variance\", 1, 224, 224, 128, \"float16\"]", "cuda -keys=cuda,gpu -max_num_threads=1024 -model=unknown -thread_warp_size=32", [-1, 16, 64, 49152, 2147483647, 1024, 8, 32], "", 0, []], [[], [["SP", 3, 1, 512, [1], 1], ["AN", 3, 2, 6], ["CI", 2], ["AN", 3, 0, 5], ["PR", 3, 0, "auto_unroll_max_step$64"]]]], "r": [[8.1446e-05, 8.14506e-05, 8.13884e-05], 0, 9.18754, 1668020692], "v": "v0.6"}
{"i": [["[\"layer_normalization_variance\", 1, 224, 224, 128, \"float16\"]", "cuda -keys=cuda,gpu -max_num_threads=1024 -model=unknown -thread_warp_size=32", [-1, 16, 64, 49152, 2147483647, 1024, 8, 32], "", 0, []], [[], [["SP", 3, 1, 512, [32], 1], ["AN", 3, 2, 6], ["CI", 2], ["AN", 3, 0, 5], ["PR", 3, 0, "auto_unroll_max_step$512"]]]], "r": [[1.26889e-05, 1.26797e-05, 1.26876e-05], 0, 6.96472, 1668020690], "v": "v0.6"}
{"i": [["[\"layer_normalization_variance\", 1, 224, 224, 128, \"float16\"]", "cuda -keys=cuda,gpu -max_num_threads=1024 -model=unknown -thread_warp_size=32", [-1, 16, 64, 49152, 2147483647, 1024, 8, 32], "", 0, []], [[], [["SP", 3, 1, 512, [2], 1], ["AN", 3, 2, 6], ["CI", 2], ["AN", 3, 0, 5], ["PR", 3, 0, "auto_unroll_max_step$512"]]]], "r": [[4.84887e-05, 4.8527e-05, 4.84978e-05], 0, 10.2932, 1668020693], "v": "v0.6"}
{"i": [["[\"layer_normalization_variance\", 1, 224, 224, 128, \"float16\"]", "cuda -keys=cuda,gpu -max_num_threads=1024 -model=unknown -thread_warp_size=32", [-1, 16, 64, 49152, 2147483647, 1024, 8, 32], "", 0, []], [[], [["CI", 2], ["SP", 3, 0, 12544, [64], 1], ["AN", 3, 0, 5], ["AN", 3, 1, 6], ["PR", 3, 0, "auto_unroll_max_step$64"]]]], "r": [[6.19261e-05, 6.19164e-05, 6.18993e-05], 0, 8.63876, 1668020691], "v": "v0.6"}
{"i": [["[\"layer_normalization_variance\", 1, 224, 224, 128, \"float16\"]", "cuda -keys=cuda,gpu -max_num_threads=1024 -model=unknown -thread_warp_size=32", [-1, 16, 64, 49152, 2147483647, 1024, 8, 32], "", 0, []], [[], [["SP", 3, 1, 512, [64], 1], ["AN", 3, 2, 6], ["CI", 2], ["AN", 3, 0, 5], ["PR", 3, 0, "auto_unroll_max_step$16"]]]], "r": [[1.26908e-05, 1.26981e-05, 1.26936e-05], 0, 9.73275, 1668020692], "v": "v0.6"}
{"i": [["[\"layer_normalization_variance\", 1, 224, 224, 128, \"float16\"]", "cuda -keys=cuda,gpu -max_num_threads=1024 -model=unknown -thread_warp_size=32", [-1, 16, 64, 49152, 2147483647, 1024, 8, 32], "", 0, []], [[], [["CI", 2], ["SP", 3, 0, 12544, [64], 1], ["AN", 3, 0, 5], ["AN", 3, 1, 6], ["PR", 3, 0, "auto_unroll_max_step$0"]]]], "r": [[6.19076e-05, 6.1911e-05, 6.18999e-05], 0, 7.60013, 1668020690], "v": "v0.6"}
{"i": [["[\"layer_normalization_variance\", 1, 224, 224, 128, \"float16\"]", "cuda -keys=cuda,gpu -max_num_threads=1024 -model=unknown -thread_warp_size=32", [-1, 16, 64, 49152, 2147483647, 1024, 8, 32], "", 0, []], [[], [["SP", 3, 1, 512, [32], 1], ["AN", 3, 2, 6], ["CI", 2], ["AN", 3, 0, 5], ["PR", 3, 0, "auto_unroll_max_step$16"]]]], "r": [[1.26297e-05, 1.26381e-05, 1.26407e-05], 0, 10.8303, 1668020694], "v": "v0.6"}
