python/models/swin_transformer/kernel_configs/swin_transformer_window_reverse_1_56_56_512_7_float16.log
{"i": [["[\"window_reverse\", 1, 56, 56, 512, 7, \"float16\"]", "cuda -keys=cuda,gpu -max_num_threads=1024 -model=unknown -thread_warp_size=32", [-1, 16, 64, 49152, 2147483647, 1024, 8, 32], "", 0, []], [[], [["FU", 1, [0, 1, 2, 3]], ["SP", 1, 0, 1605632, [32], 1], ["AN", 1, 0, 5], ["AN", 1, 1, 6]]]], "r": [[3.97862e-05, 3.97954e-05, 3.97657e-05], 0, 0.690127, 1668019435], "v": "v0.6"}
{"i": [["[\"window_reverse\", 1, 56, 56, 512, 7, \"float16\"]", "cuda -keys=cuda,gpu -max_num_threads=1024 -model=unknown -thread_warp_size=32", [-1, 16, 64, 49152, 2147483647, 1024, 8, 32], "", 0, []], [[], [["FU", 1, [0, 1, 2, 3]], ["SP", 1, 0, 1605632, [56], 1], ["AN", 1, 0, 5], ["AN", 1, 1, 6]]]], "r": [[2.37631e-05, 2.3765e-05, 2.37662e-05], 0, 1.52901, 1668019436], "v": "v0.6"}
{"i": [["[\"window_reverse\", 1, 56, 56, 512, 7, \"float16\"]", "cuda -keys=cuda,gpu -max_num_threads=1024 -model=unknown -thread_warp_size=32", [-1, 16, 64, 49152, 2147483647, 1024, 8, 32], "", 0, []], [[], [["FU", 1, [0, 1, 2, 3]], ["SP", 1, 0, 1605632, [2], 1], ["AN", 1, 0, 5], ["AN", 1, 1, 6]]]], "r": [[0.000598099, 0.000597978, 0.00059799], 0, 1.125, 1668019435], "v": "v0.6"}
{"i": [["[\"window_reverse\", 1, 56, 56, 512, 7, \"float16\"]", "cuda -keys=cuda,gpu -max_num_threads=1024 -model=unknown -thread_warp_size=32", [-1, 16, 64, 49152, 2147483647, 1024, 8, 32], "", 0, []], [[], [["FU", 1, [0, 1, 2, 3]], ["SP", 1, 0, 1605632, [49], 1], ["AN", 1, 0, 5], ["AN", 1, 1, 6]]]], "r": [[2.68709e-05, 2.68783e-05, 2.68825e-05], 0, 2.45009, 1668019437], "v": "v0.6"}
{"i": [["[\"window_reverse\", 1, 56, 56, 512, 7, \"float16\"]", "cuda -keys=cuda,gpu -max_num_threads=1024 -model=unknown -thread_warp_size=32", [-1, 16, 64, 49152, 2147483647, 1024, 8, 32], "", 0, []], [[], [["FU", 1, [0, 1, 2, 3]], ["SP", 1, 0, 1605632, [28], 1], ["AN", 1, 0, 5], ["AN", 1, 1, 6]]]], "r": [[4.51484e-05, 4.51699e-05, 4.51581e-05], 0, 2.87298, 1668019437], "v": "v0.6"}
{"i": [["[\"window_reverse\", 1, 56, 56, 512, 7, \"float16\"]", "cuda -keys=cuda,gpu -max_num_threads=1024 -model=unknown -thread_warp_size=32", [-1, 16, 64, 49152, 2147483647, 1024, 8, 32], "", 0, []], [[], [["FU", 1, [0, 1, 2, 3]], ["SP", 1, 0, 1605632, [64], 1], ["AN", 1, 0, 5], ["AN", 1, 1, 6]]]], "r": [[2.11011e-05, 2.10954e-05, 2.1094e-05], 0, 2.00911, 1668019436], "v": "v0.6"}
{"i": [["[\"window_reverse\", 1, 56, 56, 512, 7, \"float16\"]", "cuda -keys=cuda,gpu -max_num_threads=1024 -model=unknown -thread_warp_size=32", [-1, 16, 64, 49152, 2147483647, 1024, 8, 32], "", 0, []], [[], [["FU", 1, [0, 1, 2, 3]], ["SP", 1, 0, 1605632, [16], 1], ["AN", 1, 0, 5], ["AN", 1, 1, 6]]]], "r": [[7.71356e-05, 7.71071e-05, 7.71255e-05], 0, 3.35247, 1668019438], "v": "v0.6"}
{"i": [["[\"window_reverse\", 1, 56, 56, 512, 7, \"float16\"]", "cuda -keys=cuda,gpu -max_num_threads=1024 -model=unknown -thread_warp_size=32", [-1, 16, 64, 49152, 2147483647, 1024, 8, 32], "", 0, []], [[], [["FU", 1, [0, 1, 2, 3]], ["SP", 1, 0, 1605632, [4], 1], ["AN", 1, 0, 5], ["AN", 1, 1, 6]]]], "r": [[0.000300484, 0.000300435, 0.000300484], 0, 3.76757, 1668019438], "v": "v0.6"}
{"i": [["[\"window_reverse\", 1, 56, 56, 512, 7, \"float16\"]", "cuda -keys=cuda,gpu -max_num_threads=1024 -model=unknown -thread_warp_size=32", [-1, 16, 64, 49152, 2147483647, 1024, 8, 32], "", 0, []], [[], [["FU", 1, [0, 1, 2, 3]], ["SP", 1, 0, 1605632, [7], 1], ["AN", 1, 0, 5], ["AN", 1, 1, 6]]]], "r": [[0.000172864, 0.000172826, 0.000172847], 0, 4.19756, 1668019438], "v": "v0.6"}
{"i": [["[\"window_reverse\", 1, 56, 56, 512, 7, \"float16\"]", "cuda -keys=cuda,gpu -max_num_threads=1024 -model=unknown -thread_warp_size=32", [-1, 16, 64, 49152, 2147483647, 1024, 8, 32], "", 0, []], [[], [["FU", 1, [0, 1, 2, 3]], ["SP", 1, 0, 1605632, [14], 1], ["AN", 1, 0, 5], ["AN", 1, 1, 6]]]], "r": [[8.76911e-05, 8.76857e-05, 8.7692e-05], 0, 4.66855, 1668019439], "v": "v0.6"}
{"i": [["[\"window_reverse\", 1, 56, 56, 512, 7, \"float16\"]", "cuda -keys=cuda,gpu -max_num_threads=1024 -model=unknown -thread_warp_size=32", [-1, 16, 64, 49152, 2147483647, 1024, 8, 32], "", 0, []], [[], [["FU", 1, [0, 1, 2, 3]], ["SP", 1, 0, 1605632, [8], 1], ["AN", 1, 0, 5], ["AN", 1, 1, 6]]]], "r": [[0.0001516, 0.000151583, 0.00015164], 0, 5.51978, 1668019440], "v": "v0.6"}
{"i": [["[\"window_reverse\", 1, 56, 56, 512, 7, \"float16\"]", "cuda -keys=cuda,gpu -max_num_threads=1024 -model=unknown -thread_warp_size=32", [-1, 16, 64, 49152, 2147483647, 1024, 8, 32], "", 0, []], [[], [["FU", 1, [0, 1, 2, 3]], ["SP", 1, 0, 1605632, [1], 1], ["AN", 1, 0, 5], ["AN", 1, 1, 6]]]], "r": [[0.00119312, 0.00119317, 0.00119319], 0, 5.08337, 1668019439], "v": "v0.6"}
{"i": [["[\"window_reverse\", 1, 56, 56, 512, 7, \"float16\"]", "cuda -keys=cuda,gpu -max_num_threads=1024 -model=unknown -thread_warp_size=32", [-1, 16, 64, 49152, 2147483647, 1024, 8, 32], "", 0, []], [[], [["FU", 1, [0, 1, 2, 3]], ["SP", 1, 0, 1605632, [56], 1], ["AN", 1, 0, 5], ["AN", 1, 1, 6]]]], "r": [[2.37245e-05, 2.37368e-05, 2.37301e-05], 0, 1.05696, 1668019809], "v": "v0.6"}
{"i": [["[\"window_reverse\", 1, 56, 56, 512, 7, \"float16\"]", "cuda -keys=cuda,gpu -max_num_threads=1024 -model=unknown -thread_warp_size=32", [-1, 16, 64, 49152, 2147483647, 1024, 8, 32], "", 0, []], [[], [["FU", 1, [0, 1, 2, 3]], ["SP", 1, 0, 1605632, [8], 1], ["AN", 1, 0, 5], ["AN", 1, 1, 6]]]], "r": [[0.000151462, 0.000151451, 0.00015143], 0, 1.89421, 1668019810], "v": "v0.6"}
{"i": [["[\"window_reverse\", 1, 56, 56, 512, 7, \"float16\"]", "cuda -keys=cuda,gpu -max_num_threads=1024 -model=unknown -thread_warp_size=32", [-1, 16, 64, 49152, 2147483647, 1024, 8, 32], "", 0, []], [[], [["FU", 1, [0, 1, 2, 3]], ["SP", 1, 0, 1605632, [7], 1], ["AN", 1, 0, 5], ["AN", 1, 1, 6]]]], "r": [[0.000172705, 0.000172746, 0.000172696], 0, 1.44332, 1668019809], "v": "v0.6"}
{"i": [["[\"window_reverse\", 1, 56, 56, 512, 7, \"float16\"]", "cuda -keys=cuda,gpu -max_num_threads=1024 -model=unknown -thread_warp_size=32", [-1, 16, 64, 49152, 2147483647, 1024, 8, 32], "", 0, []], [[], [["FU", 1, [0, 1, 2, 3]], ["SP", 1, 0, 1605632, [14], 1], ["AN", 1, 0, 5], ["AN", 1, 1, 6]]]], "r": [[8.76348e-05, 8.76477e-05, 8.76555e-05], 0, 2.71581, 1668019810], "v": "v0.6"}
{"i": [["[\"window_reverse\", 1, 56, 56, 512, 7, \"float16\"]", "cuda -keys=cuda,gpu -max_num_threads=1024 -model=unknown -thread_warp_size=32", [-1, 16, 64, 49152, 2147483647, 1024, 8, 32], "", 0, []], [[], [["FU", 1, [0, 1, 2, 3]], ["SP", 1, 0, 1605632, [2], 1], ["AN", 1, 0, 5], ["AN", 1, 1, 6]]]], "r": [[0.00059799, 0.000597923, 0.000597995], 0, 0.645658, 1668019808], "v": "v0.6"}
{"i": [["[\"window_reverse\", 1, 56, 56, 512, 7, \"float16\"]", "cuda -keys=cuda,gpu -max_num_threads=1024 -model=unknown -thread_warp_size=32", [-1, 16, 64, 49152, 2147483647, 1024, 8, 32], "", 0, []], [[], [["FU", 1, [0, 1, 2, 3]], ["SP", 1, 0, 1605632, [49], 1], ["AN", 1, 0, 5], ["AN", 1, 1, 6]]]], "r": [[2.67789e-05, 2.67849e-05, 2.67701e-05], 0, 2.31033, 1668019810], "v": "v0.6"}
{"i": [["[\"window_reverse\", 1, 56, 56, 512, 7, \"float16\"]", "cuda -keys=cuda,gpu -max_num_threads=1024 -model=unknown -thread_warp_size=32", [-1, 16, 64, 49152, 2147483647, 1024, 8, 32], "", 0, []], [[], [["FU", 1, [0, 1, 2, 3]], ["SP", 1, 0, 1605632, [28], 1], ["AN", 1, 0, 5], ["AN", 1, 1, 6]]]], "r": [[4.5029e-05, 4.50541e-05, 4.50418e-05], 0, 3.14168, 1668019811], "v": "v0.6"}
{"i": [["[\"window_reverse\", 1, 56, 56, 512, 7, \"float16\"]", "cuda -keys=cuda,gpu -max_num_threads=1024 -model=unknown -thread_warp_size=32", [-1, 16, 64, 49152, 2147483647, 1024, 8, 32], "", 0, []], [[], [["FU", 1, [0, 1, 2, 3]], ["SP", 1, 0, 1605632, [16], 1], ["AN", 1, 0, 5], ["AN", 1, 1, 6]]]], "r": [[7.71198e-05, 7.71167e-05, 7.71151e-05], 0, 3.9537, 1668019812], "v": "v0.6"}
{"i": [["[\"window_reverse\", 1, 56, 56, 512, 7, \"float16\"]", "cuda -keys=cuda,gpu -max_num_threads=1024 -model=unknown -thread_warp_size=32", [-1, 16, 64, 49152, 2147483647, 1024, 8, 32], "", 0, []], [[], [["FU", 1, [0, 1, 2, 3]], ["SP", 1, 0, 1605632, [32], 1], ["AN", 1, 0, 5], ["AN", 1, 1, 6]]]], "r": [[3.98022e-05, 3.98103e-05, 3.98194e-05], 0, 4.40928, 1668019812], "v": "v0.6"}
{"i": [["[\"window_reverse\", 1, 56, 56, 512, 7, \"float16\"]", "cuda -keys=cuda,gpu -max_num_threads=1024 -model=unknown -thread_warp_size=32", [-1, 16, 64, 49152, 2147483647, 1024, 8, 32], "", 0, []], [[], [["FU", 1, [0, 1, 2, 3]], ["SP", 1, 0, 1605632, [4], 1], ["AN", 1, 0, 5], ["AN", 1, 1, 6]]]], "r": [[0.000300331, 0.000300317, 0.000300346], 0, 3.54026, 1668019811], "v": "v0.6"}
{"i": [["[\"window_reverse\", 1, 56, 56, 512, 7, \"float16\"]", "cuda -keys=cuda,gpu -max_num_threads=1024 -model=unknown -thread_warp_size=32", [-1, 16, 64, 49152, 2147483647, 1024, 8, 32], "", 0, []], [[], [["FU", 1, [0, 1, 2, 3]], ["SP", 1, 0, 1605632, [64], 1], ["AN", 1, 0, 5], ["AN", 1, 1, 6]]]], "r": [[2.11261e-05, 2.11244e-05, 2.11232e-05], 0, 4.79359, 1668019813], "v": "v0.6"}
{"i": [["[\"window_reverse\", 1, 56, 56, 512, 7, \"float16\"]", "cuda -keys=cuda,gpu -max_num_threads=1024 -model=unknown -thread_warp_size=32", [-1, 16, 64, 49152, 2147483647, 1024, 8, 32], "", 0, []], [[], [["FU", 1, [0, 1, 2, 3]], ["SP", 1, 0, 1605632, [1], 1], ["AN", 1, 0, 5], ["AN", 1, 1, 6]]]], "r": [[0.00119312, 0.00119316, 0.00119313], 0, 5.20094, 1668019813], "v": "v0.6"}
