python/models/swin_transformer/kernel_configs/swin_transformer_layer_normalization_normal_1_56_56_256_1_0_float16.log
{"i": [["[\"layer_normalization_normal\", 1, 56, 56, 256, 1, 0, \"float16\"]", "cuda -keys=cuda,gpu -max_num_threads=1024 -model=unknown -thread_warp_size=32", [-1, 16, 64, 49152, 2147483647, 1024, 8, 32], "", 0, []], [[], [["CHW", 4, "local"], ["CI", 4], ["CI", 3], ["FU", 5, [0, 1]], ["SP", 5, 0, 802816, [16], 1], ["AN", 5, 0, 5], ["AN", 5, 1, 6]]]], "r": [[4.01739e-05, 4.01743e-05, 4.01563e-05], 0, 1.80781, 1668018363], "v": "v0.6"}
{"i": [["[\"layer_normalization_normal\", 1, 56, 56, 256, 1, 0, \"float16\"]", "cuda -keys=cuda,gpu -max_num_threads=1024 -model=unknown -thread_warp_size=32", [-1, 16, 64, 49152, 2147483647, 1024, 8, 32], "", 0, []], [[], [["CHW", 4, "local"], ["CI", 4], ["CI", 3], ["FU", 5, [0, 1]], ["SP", 5, 0, 802816, [8], 1], ["AN", 5, 0, 5], ["AN", 5, 1, 6]]]], "r": [[7.73998e-05, 7.74231e-05, 7.74146e-05], 0, 0.981083, 1668018362], "v": "v0.6"}
{"i": [["[\"layer_normalization_normal\", 1, 56, 56, 256, 1, 0, \"float16\"]", "cuda -keys=cuda,gpu -max_num_threads=1024 -model=unknown -thread_warp_size=32", [-1, 16, 64, 49152, 2147483647, 1024, 8, 32], "", 0, []], [[], [["CHW", 4, "local"], ["CI", 4], ["CI", 3], ["FU", 5, [0, 1]], ["SP", 5, 0, 802816, [32], 1], ["AN", 5, 0, 5], ["AN", 5, 1, 6]]]], "r": [[2.16737e-05, 2.16624e-05, 2.16651e-05], 0, 1.41404, 1668018363], "v": "v0.6"}
{"i": [["[\"layer_normalization_normal\", 1, 56, 56, 256, 1, 0, \"float16\"]", "cuda -keys=cuda,gpu -max_num_threads=1024 -model=unknown -thread_warp_size=32", [-1, 16, 64, 49152, 2147483647, 1024, 8, 32], "", 0, []], [[], [["CHW", 4, "local"], ["CI", 4], ["CI", 3], ["FU", 5, [0, 1]], ["SP", 5, 0, 802816, [4], 1], ["AN", 5, 0, 5], ["AN", 5, 1, 6]]]], "r": [[0.00015188, 0.000151853, 0.00015184], 0, 0.628194, 1668018362], "v": "v0.6"}
{"i": [["[\"layer_normalization_normal\", 1, 56, 56, 256, 1, 0, \"float16\"]", "cuda -keys=cuda,gpu -max_num_threads=1024 -model=unknown -thread_warp_size=32", [-1, 16, 64, 49152, 2147483647, 1024, 8, 32], "", 0, []], [[], [["CHW", 4, "local"], ["CI", 4], ["CI", 3], ["FU", 5, [0, 1]], ["SP", 5, 0, 802816, [56], 1], ["AN", 5, 0, 5], ["AN", 5, 1, 6]]]], "r": [[1.35112e-05, 1.34995e-05, 1.34978e-05], 0, 2.18682, 1668018363], "v": "v0.6"}
{"i": [["[\"layer_normalization_normal\", 1, 56, 56, 256, 1, 0, \"float16\"]", "cuda -keys=cuda,gpu -max_num_threads=1024 -model=unknown -thread_warp_size=32", [-1, 16, 64, 49152, 2147483647, 1024, 8, 32], "", 0, []], [[], [["CHW", 4, "local"], ["CI", 4], ["CI", 3], ["FU", 5, [0, 1]], ["SP", 5, 0, 802816, [14], 1], ["AN", 5, 0, 5], ["AN", 5, 1, 6]]]], "r": [[4.55602e-05, 4.55642e-05, 4.55437e-05], 0, 2.62318, 1668018364], "v": "v0.6"}
{"i": [["[\"layer_normalization_normal\", 1, 56, 56, 256, 1, 0, \"float16\"]", "cuda -keys=cuda,gpu -max_num_threads=1024 -model=unknown -thread_warp_size=32", [-1, 16, 64, 49152, 2147483647, 1024, 8, 32], "", 0, []], [[], [["CHW", 4, "local"], ["CI", 4], ["CI", 3], ["FU", 5, [0, 1]], ["SP", 5, 0, 802816, [28], 1], ["AN", 5, 0, 5], ["AN", 5, 1, 6]]]], "r": [[2.45227e-05, 2.45152e-05, 2.45216e-05], 0, 3.36044, 1668018365], "v": "v0.6"}
{"i": [["[\"layer_normalization_normal\", 1, 56, 56, 256, 1, 0, \"float16\"]", "cuda -keys=cuda,gpu -max_num_threads=1024 -model=unknown -thread_warp_size=32", [-1, 16, 64, 49152, 2147483647, 1024, 8, 32], "", 0, []], [[], [["CHW", 4, "local"], ["CI", 4], ["CI", 3], ["FU", 5, [0, 1]], ["SP", 5, 0, 802816, [49], 1], ["AN", 5, 0, 5], ["AN", 5, 1, 6]]]], "r": [[1.49796e-05, 1.49683e-05, 1.49743e-05], 0, 4.54882, 1668018366], "v": "v0.6"}
{"i": [["[\"layer_normalization_normal\", 1, 56, 56, 256, 1, 0, \"float16\"]", "cuda -keys=cuda,gpu -max_num_threads=1024 -model=unknown -thread_warp_size=32", [-1, 16, 64, 49152, 2147483647, 1024, 8, 32], "", 0, []], [[], [["CHW", 4, "local"], ["CI", 4], ["CI", 3], ["FU", 5, [0, 1]], ["SP", 5, 0, 802816, [2], 1], ["AN", 5, 0, 5], ["AN", 5, 1, 6]]]], "r": [[0.000300684, 0.000300705, 0.000300679], 0, 2.99625, 1668018364], "v": "v0.6"}
{"i": [["[\"layer_normalization_normal\", 1, 56, 56, 256, 1, 0, \"float16\"]", "cuda -keys=cuda,gpu -max_num_threads=1024 -model=unknown -thread_warp_size=32", [-1, 16, 64, 49152, 2147483647, 1024, 8, 32], "", 0, []], [[], [["CHW", 4, "local"], ["CI", 4], ["CI", 3], ["FU", 5, [0, 1]], ["SP", 5, 0, 802816, [1], 1], ["AN", 5, 0, 5], ["AN", 5, 1, 6]]]], "r": [[0.000598378, 0.000598314, 0.000598327], 0, 4.1696, 1668018365], "v": "v0.6"}
{"i": [["[\"layer_normalization_normal\", 1, 56, 56, 256, 1, 0, \"float16\"]", "cuda -keys=cuda,gpu -max_num_threads=1024 -model=unknown -thread_warp_size=32", [-1, 16, 64, 49152, 2147483647, 1024, 8, 32], "", 0, []], [[], [["CHW", 4, "local"], ["CI", 4], ["CI", 3], ["FU", 5, [0, 1]], ["SP", 5, 0, 802816, [64], 1], ["AN", 5, 0, 5], ["AN", 5, 1, 6]]]], "r": [[1.21428e-05, 1.21302e-05, 1.21455e-05], 0, 3.78742, 1668018365], "v": "v0.6"}
{"i": [["[\"layer_normalization_normal\", 1, 56, 56, 256, 1, 0, \"float16\"]", "cuda -keys=cuda,gpu -max_num_threads=1024 -model=unknown -thread_warp_size=32", [-1, 16, 64, 49152, 2147483647, 1024, 8, 32], "", 0, []], [[], [["CHW", 4, "local"], ["CI", 4], ["CI", 3], ["FU", 5, [0, 1]], ["SP", 5, 0, 802816, [7], 1], ["AN", 5, 0, 5], ["AN", 5, 1, 6]]]], "r": [[8.79606e-05, 8.79628e-05, 8.79736e-05], 0, 4.94996, 1668018366], "v": "v0.6"}
{"i": [["[\"layer_normalization_normal\", 1, 56, 56, 256, 1, 0, \"float16\"]", "cuda -keys=cuda,gpu -max_num_threads=1024 -model=unknown -thread_warp_size=32", [-1, 16, 64, 49152, 2147483647, 1024, 8, 32], "", 0, []], [[], [["CHW", 4, "local"], ["CI", 4], ["CI", 3], ["FU", 5, [0, 1]], ["SP", 5, 0, 802816, [8], 1], ["AN", 5, 0, 5], ["AN", 5, 1, 6]]]], "r": [[7.73151e-05, 7.73035e-05, 7.73223e-05], 0, 0.598533, 1668018718], "v": "v0.6"}
{"i": [["[\"layer_normalization_normal\", 1, 56, 56, 256, 1, 0, \"float16\"]", "cuda -keys=cuda,gpu -max_num_threads=1024 -model=unknown -thread_warp_size=32", [-1, 16, 64, 49152, 2147483647, 1024, 8, 32], "", 0, []], [[], [["CHW", 4, "local"], ["CI", 4], ["CI", 3], ["FU", 5, [0, 1]], ["SP", 5, 0, 802816, [14], 1], ["AN", 5, 0, 5], ["AN", 5, 1, 6]]]], "r": [[4.5584e-05, 4.55802e-05, 4.55811e-05], 0, 1.68394, 1668018719], "v": "v0.6"}
{"i": [["[\"layer_normalization_normal\", 1, 56, 56, 256, 1, 0, \"float16\"]", "cuda -keys=cuda,gpu -max_num_threads=1024 -model=unknown -thread_warp_size=32", [-1, 16, 64, 49152, 2147483647, 1024, 8, 32], "", 0, []], [[], [["CHW", 4, "local"], ["CI", 4], ["CI", 3], ["FU", 5, [0, 1]], ["SP", 5, 0, 802816, [7], 1], ["AN", 5, 0, 5], ["AN", 5, 1, 6]]]], "r": [[8.79996e-05, 8.80347e-05, 8.80129e-05], 0, 0.952718, 1668018719], "v": "v0.6"}
{"i": [["[\"layer_normalization_normal\", 1, 56, 56, 256, 1, 0, \"float16\"]", "cuda -keys=cuda,gpu -max_num_threads=1024 -model=unknown -thread_warp_size=32", [-1, 16, 64, 49152, 2147483647, 1024, 8, 32], "", 0, []], [[], [["CHW", 4, "local"], ["CI", 4], ["CI", 3], ["FU", 5, [0, 1]], ["SP", 5, 0, 802816, [2], 1], ["AN", 5, 0, 5], ["AN", 5, 1, 6]]]], "r": [[0.000300796, 0.000300824, 0.000300838], 0, 1.3318, 1668018719], "v": "v0.6"}
{"i": [["[\"layer_normalization_normal\", 1, 56, 56, 256, 1, 0, \"float16\"]", "cuda -keys=cuda,gpu -max_num_threads=1024 -model=unknown -thread_warp_size=32", [-1, 16, 64, 49152, 2147483647, 1024, 8, 32], "", 0, []], [[], [["CHW", 4, "local"], ["CI", 4], ["CI", 3], ["FU", 5, [0, 1]], ["SP", 5, 0, 802816, [1], 1], ["AN", 5, 0, 5], ["AN", 5, 1, 6]]]], "r": [[0.00059834, 0.000598423, 0.000598366], 0, 2.02479, 1668018720], "v": "v0.6"}
{"i": [["[\"layer_normalization_normal\", 1, 56, 56, 256, 1, 0, \"float16\"]", "cuda -keys=cuda,gpu -max_num_threads=1024 -model=unknown -thread_warp_size=32", [-1, 16, 64, 49152, 2147483647, 1024, 8, 32], "", 0, []], [[], [["CHW", 4, "local"], ["CI", 4], ["CI", 3], ["FU", 5, [0, 1]], ["SP", 5, 0, 802816, [28], 1], ["AN", 5, 0, 5], ["AN", 5, 1, 6]]]], "r": [[2.44412e-05, 2.44556e-05, 2.44327e-05], 0, 2.42552, 1668018720], "v": "v0.6"}
{"i": [["[\"layer_normalization_normal\", 1, 56, 56, 256, 1, 0, \"float16\"]", "cuda -keys=cuda,gpu -max_num_threads=1024 -model=unknown -thread_warp_size=32", [-1, 16, 64, 49152, 2147483647, 1024, 8, 32], "", 0, []], [[], [["CHW", 4, "local"], ["CI", 4], ["CI", 3], ["FU", 5, [0, 1]], ["SP", 5, 0, 802816, [16], 1], ["AN", 5, 0, 5], ["AN", 5, 1, 6]]]], "r": [[4.01727e-05, 4.01568e-05, 4.01811e-05], 0, 2.76352, 1668018721], "v": "v0.6"}
{"i": [["[\"layer_normalization_normal\", 1, 56, 56, 256, 1, 0, \"float16\"]", "cuda -keys=cuda,gpu -max_num_threads=1024 -model=unknown -thread_warp_size=32", [-1, 16, 64, 49152, 2147483647, 1024, 8, 32], "", 0, []], [[], [["CHW", 4, "local"], ["CI", 4], ["CI", 3], ["FU", 5, [0, 1]], ["SP", 5, 0, 802816, [64], 1], ["AN", 5, 0, 5], ["AN", 5, 1, 6]]]], "r": [[1.21508e-05, 1.21542e-05, 1.21475e-05], 0, 3.49292, 1668018721], "v": "v0.6"}
{"i": [["[\"layer_normalization_normal\", 1, 56, 56, 256, 1, 0, \"float16\"]", "cuda -keys=cuda,gpu -max_num_threads=1024 -model=unknown -thread_warp_size=32", [-1, 16, 64, 49152, 2147483647, 1024, 8, 32], "", 0, []], [[], [["CHW", 4, "local"], ["CI", 4], ["CI", 3], ["FU", 5, [0, 1]], ["SP", 5, 0, 802816, [56], 1], ["AN", 5, 0, 5], ["AN", 5, 1, 6]]]], "r": [[1.3373e-05, 1.33603e-05, 1.33644e-05], 0, 3.83103, 1668018722], "v": "v0.6"}
{"i": [["[\"layer_normalization_normal\", 1, 56, 56, 256, 1, 0, \"float16\"]", "cuda -keys=cuda,gpu -max_num_threads=1024 -model=unknown -thread_warp_size=32", [-1, 16, 64, 49152, 2147483647, 1024, 8, 32], "", 0, []], [[], [["CHW", 4, "local"], ["CI", 4], ["CI", 3], ["FU", 5, [0, 1]], ["SP", 5, 0, 802816, [32], 1], ["AN", 5, 0, 5], ["AN", 5, 1, 6]]]], "r": [[2.17197e-05, 2.17056e-05, 2.16873e-05], 0, 3.10334, 1668018721], "v": "v0.6"}
{"i": [["[\"layer_normalization_normal\", 1, 56, 56, 256, 1, 0, \"float16\"]", "cuda -keys=cuda,gpu -max_num_threads=1024 -model=unknown -thread_warp_size=32", [-1, 16, 64, 49152, 2147483647, 1024, 8, 32], "", 0, []], [[], [["CHW", 4, "local"], ["CI", 4], ["CI", 3], ["FU", 5, [0, 1]], ["SP", 5, 0, 802816, [4], 1], ["AN", 5, 0, 5], ["AN", 5, 1, 6]]]], "r": [[0.000151901, 0.000151881, 0.000151922], 0, 4.15155, 1668018722], "v": "v0.6"}
{"i": [["[\"layer_normalization_normal\", 1, 56, 56, 256, 1, 0, \"float16\"]", "cuda -keys=cuda,gpu -max_num_threads=1024 -model=unknown -thread_warp_size=32", [-1, 16, 64, 49152, 2147483647, 1024, 8, 32], "", 0, []], [[], [["CHW", 4, "local"], ["CI", 4], ["CI", 3], ["FU", 5, [0, 1]], ["SP", 5, 0, 802816, [49], 1], ["AN", 5, 0, 5], ["AN", 5, 1, 6]]]], "r": [[1.4954e-05, 1.49616e-05, 1.49674e-05], 0, 4.55123, 1668018722], "v": "v0.6"}
