python/models/swin_transformer/kernel_configs/swin_transformer_roll_tune_1_28_28_256_3_float16.log
{"i": [["[\"roll\", 1, 28, 28, 256, 3, \"float16\"]", "cuda -keys=cuda,gpu -max_num_threads=1024 -model=unknown -thread_warp_size=32", [-1, 16, 64, 49152, 2147483647, 1024, 8, 32], "", 0, []], [[], [["FU", 1, [0, 1, 2, 3]], ["SP", 1, 0, 200704, [49], 1], ["AN", 1, 0, 5], ["AN", 1, 1, 6]]]], "r": [[5.6931e-06, 5.69318e-06, 5.69104e-06, 5.99189e-06, 5.9954e-06, 5.70325e-06, 5.69282e-06, 5.76959e-06, 5.76282e-06, 5.69218e-06], 0, 22.1357, 1652026430], "v": "v0.6"}
{"i": [["[\"roll\", 1, 28, 28, 256, 3, \"float16\"]", "cuda -keys=cuda,gpu -max_num_threads=1024 -model=unknown -thread_warp_size=32", [-1, 16, 64, 49152, 2147483647, 1024, 8, 32], "", 0, []], [[], [["FU", 1, [0, 1, 2, 3]], ["SP", 1, 0, 200704, [56], 1], ["AN", 1, 0, 5], ["AN", 1, 1, 6]]]], "r": [[5.80355e-06, 5.65824e-06, 5.23417e-06, 5.19888e-06, 5.35344e-06, 5.54199e-06, 5.15294e-06, 5.19889e-06, 5.39102e-06, 5.80911e-06], 0, 8.38874, 1652026416], "v": "v0.6"}
{"i": [["[\"roll\", 1, 28, 28, 256, 3, \"float16\"]", "cuda -keys=cuda,gpu -max_num_threads=1024 -model=unknown -thread_warp_size=32", [-1, 16, 64, 49152, 2147483647, 1024, 8, 32], "", 0, []], [[], [["FU", 1, [0, 1, 2, 3]], ["SP", 1, 0, 200704, [28], 1], ["AN", 1, 0, 5], ["AN", 1, 1, 6]]]], "r": [[7.98792e-06, 7.98846e-06, 7.98939e-06, 8.06466e-06, 7.98744e-06, 7.98708e-06, 8.11897e-06, 7.98922e-06, 8.05215e-06, 8.04653e-06], 0, 18.0248, 1652026426], "v": "v0.6"}
{"i": [["[\"roll\", 1, 28, 28, 256, 3, \"float16\"]", "cuda -keys=cuda,gpu -max_num_threads=1024 -model=unknown -thread_warp_size=32", [-1, 16, 64, 49152, 2147483647, 1024, 8, 32], "", 0, []], [[], [["FU", 1, [0, 1, 2, 3]], ["SP", 1, 0, 200704, [64], 1], ["AN", 1, 0, 5], ["AN", 1, 1, 6]]]], "r": [[4.99996e-06, 5.5108e-06, 5.31329e-06, 4.98278e-06, 4.91671e-06, 5.02713e-06, 5.14959e-06, 4.91687e-06, 5.02562e-06, 5.51565e-06], 0, 31.311, 1652026439], "v": "v0.6"}
{"i": [["[\"roll\", 1, 28, 28, 256, 3, \"float16\"]", "cuda -keys=cuda,gpu -max_num_threads=1024 -model=unknown -thread_warp_size=32", [-1, 16, 64, 49152, 2147483647, 1024, 8, 32], "", 0, []], [[], [["FU", 1, [0, 1, 2, 3]], ["SP", 1, 0, 200704, [32], 1], ["AN", 1, 0, 5], ["AN", 1, 1, 6]]]], "r": [[7.36388e-06, 7.36513e-06, 7.52764e-06, 7.39763e-06, 7.36877e-06, 7.43162e-06, 7.36545e-06, 7.44656e-06, 7.36427e-06, 7.36472e-06], 0, 4.62043, 1652026412], "v": "v0.6"}
{"i": [["[\"roll\", 1, 28, 28, 256, 3, \"float16\"]", "cuda -keys=cuda,gpu -max_num_threads=1024 -model=unknown -thread_warp_size=32", [-1, 16, 64, 49152, 2147483647, 1024, 8, 32], "", 0, []], [[], [["FU", 1, [0, 1, 2, 3]], ["SP", 1, 0, 200704, [2], 1], ["AN", 1, 0, 5], ["AN", 1, 1, 6]]]], "r": [[7.70828e-05, 7.70965e-05, 7.70749e-05, 7.70864e-05, 7.70967e-05, 7.71246e-05, 7.71047e-05, 7.70779e-05, 7.70756e-05, 7.70803e-05], 0, 13.8848, 1652026422], "v": "v0.6"}
{"i": [["[\"roll\", 1, 28, 28, 256, 3, \"float16\"]", "cuda -keys=cuda,gpu -max_num_threads=1024 -model=unknown -thread_warp_size=32", [-1, 16, 64, 49152, 2147483647, 1024, 8, 32], "", 0, []], [[], [["FU", 1, [0, 1, 2, 3]], ["SP", 1, 0, 200704, [16], 1], ["AN", 1, 0, 5], ["AN", 1, 1, 6]]]], "r": [[1.20766e-05, 1.20783e-05, 1.20758e-05, 1.20759e-05, 1.20752e-05, 1.20777e-05, 1.2074e-05, 1.20745e-05, 1.20767e-05, 1.20761e-05], 0, 46.4687, 1652026454], "v": "v0.6"}
{"i": [["[\"roll\", 1, 28, 28, 256, 3, \"float16\"]", "cuda -keys=cuda,gpu -max_num_threads=1024 -model=unknown -thread_warp_size=32", [-1, 16, 64, 49152, 2147483647, 1024, 8, 32], "", 0, []], [[], [["FU", 1, [0, 1, 2, 3]], ["SP", 1, 0, 200704, [1], 1], ["AN", 1, 0, 5], ["AN", 1, 1, 6]]]], "r": [[0.000151423, 0.000151414, 0.000151415, 0.000151418, 0.00015142, 0.000151444, 0.000151422, 0.000151443, 0.000151479, 0.00015149], 0, 27.4998, 1652026435], "v": "v0.6"}
{"i": [["[\"roll\", 1, 28, 28, 256, 3, \"float16\"]", "cuda -keys=cuda,gpu -max_num_threads=1024 -model=unknown -thread_warp_size=32", [-1, 16, 64, 49152, 2147483647, 1024, 8, 32], "", 0, []], [[], [["FU", 1, [0, 1, 2, 3]], ["SP", 1, 0, 200704, [4], 1], ["AN", 1, 0, 5], ["AN", 1, 1, 6]]]], "r": [[4.01104e-05, 4.01229e-05, 4.0106e-05, 4.0111e-05, 4.0111e-05, 4.01132e-05, 4.01107e-05, 4.01099e-05, 4.01117e-05, 4.01097e-05], 0, 36.6602, 1652026445], "v": "v0.6"}
{"i": [["[\"roll\", 1, 28, 28, 256, 3, \"float16\"]", "cuda -keys=cuda,gpu -max_num_threads=1024 -model=unknown -thread_warp_size=32", [-1, 16, 64, 49152, 2147483647, 1024, 8, 32], "", 0, []], [[], [["FU", 1, [0, 1, 2, 3]], ["SP", 1, 0, 200704, [7], 1], ["AN", 1, 0, 5], ["AN", 1, 1, 6]]]], "r": [[2.4293e-05, 2.4294e-05, 2.42949e-05, 2.42955e-05, 2.42935e-05, 2.42949e-05, 2.42941e-05, 2.42948e-05, 2.42948e-05, 2.42948e-05], 0, 41.8962, 1652026450], "v": "v0.6"}
{"i": [["[\"roll\", 1, 28, 28, 256, 3, \"float16\"]", "cuda -keys=cuda,gpu -max_num_threads=1024 -model=unknown -thread_warp_size=32", [-1, 16, 64, 49152, 2147483647, 1024, 8, 32], "", 0, []], [[], [["FU", 1, [0, 1, 2, 3]], ["SP", 1, 0, 200704, [14], 1], ["AN", 1, 0, 5], ["AN", 1, 1, 6]]]], "r": [[1.34967e-05, 1.34967e-05, 1.34964e-05, 1.34974e-05, 1.34977e-05, 1.34977e-05, 1.34966e-05, 1.34971e-05, 1.34975e-05, 1.3497e-05], 0, 51.2442, 1652026459], "v": "v0.6"}
{"i": [["[\"roll\", 1, 28, 28, 256, 3, \"float16\"]", "cuda -keys=cuda,gpu -max_num_threads=1024 -model=unknown -thread_warp_size=32", [-1, 16, 64, 49152, 2147483647, 1024, 8, 32], "", 0, []], [[], [["FU", 1, [0, 1, 2, 3]], ["SP", 1, 0, 200704, [8], 1], ["AN", 1, 0, 5], ["AN", 1, 1, 6]]]], "r": [[2.13819e-05, 2.13841e-05, 2.13814e-05, 2.20223e-05, 2.14017e-05, 2.13819e-05, 2.1385e-05, 2.13933e-05, 2.13818e-05, 2.13801e-05], 0, 55.739, 1652026464], "v": "v0.6"}
{"i": [["[\"roll\", 1, 28, 28, 256, 3, \"float16\"]", "cuda -keys=cuda,gpu -max_num_threads=1024 -model=unknown -thread_warp_size=32", [-1, 16, 64, 49152, 2147483647, 1024, 8, 32], "", 0, []], [[], [["FU", 1, [0, 1, 2, 3]], ["SP", 1, 0, 200704, [7], 1], ["AN", 1, 0, 5], ["AN", 1, 1, 6]]]], "r": [[2.39963e-05, 2.40136e-05, 2.40137e-05], 0, 2.36655, 1668020772], "v": "v0.6"}
{"i": [["[\"roll\", 1, 28, 28, 256, 3, \"float16\"]", "cuda -keys=cuda,gpu -max_num_threads=1024 -model=unknown -thread_warp_size=32", [-1, 16, 64, 49152, 2147483647, 1024, 8, 32], "", 0, []], [[], [["FU", 1, [0, 1, 2, 3]], ["SP", 1, 0, 200704, [1], 1], ["AN", 1, 0, 5], ["AN", 1, 1, 6]]]], "r": [[0.00015165, 0.000151613, 0.00015168], 0, 0.924129, 1668020771], "v": "v0.6"}
{"i": [["[\"roll\", 1, 28, 28, 256, 3, \"float16\"]", "cuda -keys=cuda,gpu -max_num_threads=1024 -model=unknown -thread_warp_size=32", [-1, 16, 64, 49152, 2147483647, 1024, 8, 32], "", 0, []], [[], [["FU", 1, [0, 1, 2, 3]], ["SP", 1, 0, 200704, [28], 1], ["AN", 1, 0, 5], ["AN", 1, 1, 6]]]], "r": [[8.15514e-06, 8.16158e-06, 8.16085e-06], 0, 0.591207, 1668020770], "v": "v0.6"}
{"i": [["[\"roll\", 1, 28, 28, 256, 3, \"float16\"]", "cuda -keys=cuda,gpu -max_num_threads=1024 -model=unknown -thread_warp_size=32", [-1, 16, 64, 49152, 2147483647, 1024, 8, 32], "", 0, []], [[], [["FU", 1, [0, 1, 2, 3]], ["SP", 1, 0, 200704, [14], 1], ["AN", 1, 0, 5], ["AN", 1, 1, 6]]]], "r": [[1.34443e-05, 1.34622e-05, 1.34555e-05], 0, 1.672, 1668020772], "v": "v0.6"}
{"i": [["[\"roll\", 1, 28, 28, 256, 3, \"float16\"]", "cuda -keys=cuda,gpu -max_num_threads=1024 -model=unknown -thread_warp_size=32", [-1, 16, 64, 49152, 2147483647, 1024, 8, 32], "", 0, []], [[], [["FU", 1, [0, 1, 2, 3]], ["SP", 1, 0, 200704, [64], 1], ["AN", 1, 0, 5], ["AN", 1, 1, 6]]]], "r": [[4.8285e-06, 4.83821e-06, 4.83842e-06], 0, 2.01036, 1668020772], "v": "v0.6"}
{"i": [["[\"roll\", 1, 28, 28, 256, 3, \"float16\"]", "cuda -keys=cuda,gpu -max_num_threads=1024 -model=unknown -thread_warp_size=32", [-1, 16, 64, 49152, 2147483647, 1024, 8, 32], "", 0, []], [[], [["FU", 1, [0, 1, 2, 3]], ["SP", 1, 0, 200704, [56], 1], ["AN", 1, 0, 5], ["AN", 1, 1, 6]]]], "r": [[5.28095e-06, 5.28982e-06, 5.2857e-06], 0, 1.27861, 1668020771], "v": "v0.6"}
{"i": [["[\"roll\", 1, 28, 28, 256, 3, \"float16\"]", "cuda -keys=cuda,gpu -max_num_threads=1024 -model=unknown -thread_warp_size=32", [-1, 16, 64, 49152, 2147483647, 1024, 8, 32], "", 0, []], [[], [["FU", 1, [0, 1, 2, 3]], ["SP", 1, 0, 200704, [2], 1], ["AN", 1, 0, 5], ["AN", 1, 1, 6]]]], "r": [[7.71707e-05, 7.71762e-05, 7.71581e-05], 0, 3.11357, 1668020773], "v": "v0.6"}
{"i": [["[\"roll\", 1, 28, 28, 256, 3, \"float16\"]", "cuda -keys=cuda,gpu -max_num_threads=1024 -model=unknown -thread_warp_size=32", [-1, 16, 64, 49152, 2147483647, 1024, 8, 32], "", 0, []], [[], [["FU", 1, [0, 1, 2, 3]], ["SP", 1, 0, 200704, [8], 1], ["AN", 1, 0, 5], ["AN", 1, 1, 6]]]], "r": [[2.15916e-05, 2.16092e-05, 2.16138e-05], 0, 3.85725, 1668020774], "v": "v0.6"}
{"i": [["[\"roll\", 1, 28, 28, 256, 3, \"float16\"]", "cuda -keys=cuda,gpu -max_num_threads=1024 -model=unknown -thread_warp_size=32", [-1, 16, 64, 49152, 2147483647, 1024, 8, 32], "", 0, []], [[], [["FU", 1, [0, 1, 2, 3]], ["SP", 1, 0, 200704, [49], 1], ["AN", 1, 0, 5], ["AN", 1, 1, 6]]]], "r": [[5.63826e-06, 5.64654e-06, 5.65016e-06], 0, 2.75891, 1668020773], "v": "v0.6"}
{"i": [["[\"roll\", 1, 28, 28, 256, 3, \"float16\"]", "cuda -keys=cuda,gpu -max_num_threads=1024 -model=unknown -thread_warp_size=32", [-1, 16, 64, 49152, 2147483647, 1024, 8, 32], "", 0, []], [[], [["FU", 1, [0, 1, 2, 3]], ["SP", 1, 0, 200704, [4], 1], ["AN", 1, 0, 5], ["AN", 1, 1, 6]]]], "r": [[3.99018e-05, 3.99295e-05, 3.99218e-05], 0, 3.46944, 1668020773], "v": "v0.6"}
{"i": [["[\"roll\", 1, 28, 28, 256, 3, \"float16\"]", "cuda -keys=cuda,gpu -max_num_threads=1024 -model=unknown -thread_warp_size=32", [-1, 16, 64, 49152, 2147483647, 1024, 8, 32], "", 0, []], [[], [["FU", 1, [0, 1, 2, 3]], ["SP", 1, 0, 200704, [32], 1], ["AN", 1, 0, 5], ["AN", 1, 1, 6]]]], "r": [[7.38825e-06, 7.38818e-06, 7.38487e-06], 0, 4.56222, 1668020775], "v": "v0.6"}
{"i": [["[\"roll\", 1, 28, 28, 256, 3, \"float16\"]", "cuda -keys=cuda,gpu -max_num_threads=1024 -model=unknown -thread_warp_size=32", [-1, 16, 64, 49152, 2147483647, 1024, 8, 32], "", 0, []], [[], [["FU", 1, [0, 1, 2, 3]], ["SP", 1, 0, 200704, [16], 1], ["AN", 1, 0, 5], ["AN", 1, 1, 6]]]], "r": [[1.20229e-05, 1.20233e-05, 1.20318e-05], 0, 4.21497, 1668020774], "v": "v0.6"}
{"i": [["[\"roll\", 1, 28, 28, 256, 3, \"float16\"]", "cuda -keys=cuda,gpu -max_num_threads=1024 -model=unknown -thread_warp_size=32", [-1, 16, 64, 49152, 2147483647, 1024, 8, 32], "", 0, []], [[], [["FU", 1, [0, 1, 2, 3]], ["SP", 1, 0, 200704, [56], 1], ["AN", 1, 0, 5], ["AN", 1, 1, 6]]]], "r": [[5.15551e-06, 5.16903e-06, 5.16785e-06], 0, 1.65798, 1668048717], "v": "v0.6"}
{"i": [["[\"roll\", 1, 28, 28, 256, 3, \"float16\"]", "cuda -keys=cuda,gpu -max_num_threads=1024 -model=unknown -thread_warp_size=32", [-1, 16, 64, 49152, 2147483647, 1024, 8, 32], "", 0, []], [[], [["FU", 1, [0, 1, 2, 3]], ["SP", 1, 0, 200704, [8], 1], ["AN", 1, 0, 5], ["AN", 1, 1, 6]]]], "r": [[2.14654e-05, 2.1481e-05, 2.14928e-05], 0, 1.2776, 1668048717], "v": "v0.6"}
{"i": [["[\"roll\", 1, 28, 28, 256, 3, \"float16\"]", "cuda -keys=cuda,gpu -max_num_threads=1024 -model=unknown -thread_warp_size=32", [-1, 16, 64, 49152, 2147483647, 1024, 8, 32], "", 0, []], [[], [["FU", 1, [0, 1, 2, 3]], ["SP", 1, 0, 200704, [4], 1], ["AN", 1, 0, 5], ["AN", 1, 1, 6]]]], "r": [[3.99961e-05, 4.00158e-05, 4.00173e-05], 0, 0.936172, 1668048717], "v": "v0.6"}
{"i": [["[\"roll\", 1, 28, 28, 256, 3, \"float16\"]", "cuda -keys=cuda,gpu -max_num_threads=1024 -model=unknown -thread_warp_size=32", [-1, 16, 64, 49152, 2147483647, 1024, 8, 32], "", 0, []], [[], [["FU", 1, [0, 1, 2, 3]], ["SP", 1, 0, 200704, [64], 1], ["AN", 1, 0, 5], ["AN", 1, 1, 6]]]], "r": [[4.96737e-06, 4.98088e-06, 4.98219e-06], 0, 0.583564, 1668048716], "v": "v0.6"}
{"i": [["[\"roll\", 1, 28, 28, 256, 3, \"float16\"]", "cuda -keys=cuda,gpu -max_num_threads=1024 -model=unknown -thread_warp_size=32", [-1, 16, 64, 49152, 2147483647, 1024, 8, 32], "", 0, []], [[], [["FU", 1, [0, 1, 2, 3]], ["SP", 1, 0, 200704, [32], 1], ["AN", 1, 0, 5], ["AN", 1, 1, 6]]]], "r": [[7.37197e-06, 7.3823e-06, 7.37205e-06], 0, 2.32157, 1668048718], "v": "v0.6"}
{"i": [["[\"roll\", 1, 28, 28, 256, 3, \"float16\"]", "cuda -keys=cuda,gpu -max_num_threads=1024 -model=unknown -thread_warp_size=32", [-1, 16, 64, 49152, 2147483647, 1024, 8, 32], "", 0, []], [[], [["FU", 1, [0, 1, 2, 3]], ["SP", 1, 0, 200704, [16], 1], ["AN", 1, 0, 5], ["AN", 1, 1, 6]]]], "r": [[1.20297e-05, 1.2044e-05, 1.20403e-05], 0, 1.98744, 1668048718], "v": "v0.6"}
{"i": [["[\"roll\", 1, 28, 28, 256, 3, \"float16\"]", "cuda -keys=cuda,gpu -max_num_threads=1024 -model=unknown -thread_warp_size=32", [-1, 16, 64, 49152, 2147483647, 1024, 8, 32], "", 0, []], [[], [["FU", 1, [0, 1, 2, 3]], ["SP", 1, 0, 200704, [49], 1], ["AN", 1, 0, 5], ["AN", 1, 1, 6]]]], "r": [[5.56509e-06, 5.57679e-06, 5.57478e-06], 0, 2.68097, 1668048718], "v": "v0.6"}
{"i": [["[\"roll\", 1, 28, 28, 256, 3, \"float16\"]", "cuda -keys=cuda,gpu -max_num_threads=1024 -model=unknown -thread_warp_size=32", [-1, 16, 64, 49152, 2147483647, 1024, 8, 32], "", 0, []], [[], [["FU", 1, [0, 1, 2, 3]], ["SP", 1, 0, 200704, [2], 1], ["AN", 1, 0, 5], ["AN", 1, 1, 6]]]], "r": [[7.717e-05, 7.71821e-05, 7.719e-05], 0, 3.038, 1668048719], "v": "v0.6"}
{"i": [["[\"roll\", 1, 28, 28, 256, 3, \"float16\"]", "cuda -keys=cuda,gpu -max_num_threads=1024 -model=unknown -thread_warp_size=32", [-1, 16, 64, 49152, 2147483647, 1024, 8, 32], "", 0, []], [[], [["FU", 1, [0, 1, 2, 3]], ["SP", 1, 0, 200704, [1], 1], ["AN", 1, 0, 5], ["AN", 1, 1, 6]]]], "r": [[0.000151693, 0.000151688, 0.000151716], 0, 3.3677, 1668048719], "v": "v0.6"}
{"i": [["[\"roll\", 1, 28, 28, 256, 3, \"float16\"]", "cuda -keys=cuda,gpu -max_num_threads=1024 -model=unknown -thread_warp_size=32", [-1, 16, 64, 49152, 2147483647, 1024, 8, 32], "", 0, []], [[], [["FU", 1, [0, 1, 2, 3]], ["SP", 1, 0, 200704, [7], 1], ["AN", 1, 0, 5], ["AN", 1, 1, 6]]]], "r": [[2.40517e-05, 2.40663e-05, 2.4065e-05], 0, 3.72363, 1668048719], "v": "v0.6"}
{"i": [["[\"roll\", 1, 28, 28, 256, 3, \"float16\"]", "cuda -keys=cuda,gpu -max_num_threads=1024 -model=unknown -thread_warp_size=32", [-1, 16, 64, 49152, 2147483647, 1024, 8, 32], "", 0, []], [[], [["FU", 1, [0, 1, 2, 3]], ["SP", 1, 0, 200704, [28], 1], ["AN", 1, 0, 5], ["AN", 1, 1, 6]]]], "r": [[8.01919e-06, 8.02989e-06, 8.02431e-06], 0, 4.07272, 1668048720], "v": "v0.6"}
{"i": [["[\"roll\", 1, 28, 28, 256, 3, \"float16\"]", "cuda -keys=cuda,gpu -max_num_threads=1024 -model=unknown -thread_warp_size=32", [-1, 16, 64, 49152, 2147483647, 1024, 8, 32], "", 0, []], [[], [["FU", 1, [0, 1, 2, 3]], ["SP", 1, 0, 200704, [14], 1], ["AN", 1, 0, 5], ["AN", 1, 1, 6]]]], "r": [[1.34191e-05, 1.34363e-05, 1.34301e-05], 0, 4.42518, 1668048720], "v": "v0.6"}
{"i": [["[\"roll\", 1, 28, 28, 256, 3, \"float16\"]", "cuda -keys=cuda,gpu -max_num_threads=1024 -model=unknown -thread_warp_size=32", [-1, 16, 64, 49152, 2147483647, 1024, 8, 32], "", 0, []], [[], [["FU", 1, [0, 1, 2, 3]], ["SP", 1, 0, 200704, [4], 1], ["AN", 1, 0, 5], ["AN", 1, 1, 6]]]], "r": [[4.00674e-05, 4.00886e-05, 4.00833e-05], 0, 3.04957, 1668051123], "v": "v0.6"}
{"i": [["[\"roll\", 1, 28, 28, 256, 3, \"float16\"]", "cuda -keys=cuda,gpu -max_num_threads=1024 -model=unknown -thread_warp_size=32", [-1, 16, 64, 49152, 2147483647, 1024, 8, 32], "", 0, []], [[], [["FU", 1, [0, 1, 2, 3]], ["SP", 1, 0, 200704, [28], 1], ["AN", 1, 0, 5], ["AN", 1, 1, 6]]]], "r": [[8.06648e-06, 8.07405e-06, 8.07576e-06], 0, 0.926883, 1668051120], "v": "v0.6"}
{"i": [["[\"roll\", 1, 28, 28, 256, 3, \"float16\"]", "cuda -keys=cuda,gpu -max_num_threads=1024 -model=unknown -thread_warp_size=32", [-1, 16, 64, 49152, 2147483647, 1024, 8, 32], "", 0, []], [[], [["FU", 1, [0, 1, 2, 3]], ["SP", 1, 0, 200704, [64], 1], ["AN", 1, 0, 5], ["AN", 1, 1, 6]]]], "r": [[5.03293e-06, 5.04624e-06, 5.04253e-06], 0, 1.98555, 1668051121], "v": "v0.6"}
{"i": [["[\"roll\", 1, 28, 28, 256, 3, \"float16\"]", "cuda -keys=cuda,gpu -max_num_threads=1024 -model=unknown -thread_warp_size=32", [-1, 16, 64, 49152, 2147483647, 1024, 8, 32], "", 0, []], [[], [["FU", 1, [0, 1, 2, 3]], ["SP", 1, 0, 200704, [1], 1], ["AN", 1, 0, 5], ["AN", 1, 1, 6]]]], "r": [[0.000151768, 0.000151696, 0.000151773], 0, 1.26558, 1668051121], "v": "v0.6"}
{"i": [["[\"roll\", 1, 28, 28, 256, 3, \"float16\"]", "cuda -keys=cuda,gpu -max_num_threads=1024 -model=unknown -thread_warp_size=32", [-1, 16, 64, 49152, 2147483647, 1024, 8, 32], "", 0, []], [[], [["FU", 1, [0, 1, 2, 3]], ["SP", 1, 0, 200704, [49], 1], ["AN", 1, 0, 5], ["AN", 1, 1, 6]]]], "r": [[5.6263e-06, 5.64221e-06, 5.63937e-06], 0, 0.584181, 1668051120], "v": "v0.6"}
{"i": [["[\"roll\", 1, 28, 28, 256, 3, \"float16\"]", "cuda -keys=cuda,gpu -max_num_threads=1024 -model=unknown -thread_warp_size=32", [-1, 16, 64, 49152, 2147483647, 1024, 8, 32], "", 0, []], [[], [["FU", 1, [0, 1, 2, 3]], ["SP", 1, 0, 200704, [16], 1], ["AN", 1, 0, 5], ["AN", 1, 1, 6]]]], "r": [[1.21411e-05, 1.21559e-05, 1.21439e-05], 0, 1.64971, 1668051121], "v": "v0.6"}
{"i": [["[\"roll\", 1, 28, 28, 256, 3, \"float16\"]", "cuda -keys=cuda,gpu -max_num_threads=1024 -model=unknown -thread_warp_size=32", [-1, 16, 64, 49152, 2147483647, 1024, 8, 32], "", 0, []], [[], [["FU", 1, [0, 1, 2, 3]], ["SP", 1, 0, 200704, [56], 1], ["AN", 1, 0, 5], ["AN", 1, 1, 6]]]], "r": [[5.12897e-06, 5.1422e-06, 5.1386e-06], 0, 2.70463, 1668051122], "v": "v0.6"}
{"i": [["[\"roll\", 1, 28, 28, 256, 3, \"float16\"]", "cuda -keys=cuda,gpu -max_num_threads=1024 -model=unknown -thread_warp_size=32", [-1, 16, 64, 49152, 2147483647, 1024, 8, 32], "", 0, []], [[], [["FU", 1, [0, 1, 2, 3]], ["SP", 1, 0, 200704, [14], 1], ["AN", 1, 0, 5], ["AN", 1, 1, 6]]]], "r": [[1.34303e-05, 1.34578e-05, 1.34524e-05], 0, 2.31577, 1668051122], "v": "v0.6"}
{"i": [["[\"roll\", 1, 28, 28, 256, 3, \"float16\"]", "cuda -keys=cuda,gpu -max_num_threads=1024 -model=unknown -thread_warp_size=32", [-1, 16, 64, 49152, 2147483647, 1024, 8, 32], "", 0, []], [[], [["FU", 1, [0, 1, 2, 3]], ["SP", 1, 0, 200704, [32], 1], ["AN", 1, 0, 5], ["AN", 1, 1, 6]]]], "r": [[7.42283e-06, 7.44254e-06, 7.43891e-06], 0, 3.39082, 1668051123], "v": "v0.6"}
{"i": [["[\"roll\", 1, 28, 28, 256, 3, \"float16\"]", "cuda -keys=cuda,gpu -max_num_threads=1024 -model=unknown -thread_warp_size=32", [-1, 16, 64, 49152, 2147483647, 1024, 8, 32], "", 0, []], [[], [["FU", 1, [0, 1, 2, 3]], ["SP", 1, 0, 200704, [2], 1], ["AN", 1, 0, 5], ["AN", 1, 1, 6]]]], "r": [[7.72339e-05, 7.72537e-05, 7.72412e-05], 0, 3.76303, 1668051123], "v": "v0.6"}
{"i": [["[\"roll\", 1, 28, 28, 256, 3, \"float16\"]", "cuda -keys=cuda,gpu -max_num_threads=1024 -model=unknown -thread_warp_size=32", [-1, 16, 64, 49152, 2147483647, 1024, 8, 32], "", 0, []], [[], [["FU", 1, [0, 1, 2, 3]], ["SP", 1, 0, 200704, [8], 1], ["AN", 1, 0, 5], ["AN", 1, 1, 6]]]], "r": [[2.14957e-05, 2.15077e-05, 2.15041e-05], 0, 4.46631, 1668051124], "v": "v0.6"}
{"i": [["[\"roll\", 1, 28, 28, 256, 3, \"float16\"]", "cuda -keys=cuda,gpu -max_num_threads=1024 -model=unknown -thread_warp_size=32", [-1, 16, 64, 49152, 2147483647, 1024, 8, 32], "", 0, []], [[], [["FU", 1, [0, 1, 2, 3]], ["SP", 1, 0, 200704, [7], 1], ["AN", 1, 0, 5], ["AN", 1, 1, 6]]]], "r": [[2.40596e-05, 2.40671e-05, 2.40692e-05], 0, 4.11236, 1668051124], "v": "v0.6"}
