python/models/swin_transformer/kernel_configs/swin_transformer_batch_matmul_32_49_32_49.log
{"input": ["cuda -keys=cuda,gpu -max_num_threads=1024 -thread_warp_size=32", "batch_matmul_tensorcore.cuda", [["TENSOR", [32, 64, 64], "float16"], ["TENSOR", [32, 32, 64], "float16"]], {}], "config": {"index": 2124, "code_hash": null, "entity": [["block_row_warps", "ot", 1], ["block_col_warps", "ot", 1], ["warp_row_tiles", "ot", 4], ["warp_col_tiles", "ot", 1], ["chunk", "ot", 4], ["offset", "ot", 0], ["offsetCS", "ot", 8], ["vec", "ot", 2], ["wmma_m", "ot", 32]]}, "result": [[4.4862521631644006e-06], 0, 1.2515308856964111, 1668059963.8658092], "version": 0.2, "tvm_version": "0.8.0"}
{"input": ["cuda -keys=cuda,gpu -max_num_threads=1024 -thread_warp_size=32", "batch_matmul_tensorcore.cuda", [["TENSOR", [32, 64, 64], "float16"], ["TENSOR", [32, 32, 64], "float16"]], {}], "config": {"index": 6828, "code_hash": null, "entity": [["block_row_warps", "ot", 1], ["block_col_warps", "ot", 4], ["warp_row_tiles", "ot", 4], ["warp_col_tiles", "ot", 1], ["chunk", "ot", 1], ["offset", "ot", 8], ["offsetCS", "ot", 0], ["vec", "ot", 2], ["wmma_m", "ot", 16]]}, "result": [[4.70303522867738e-06], 0, 1.1210217475891113, 1668059964.8048415], "version": 0.2, "tvm_version": "0.8.0"}
{"input": ["cuda -keys=cuda,gpu -max_num_threads=1024 -thread_warp_size=32", "batch_matmul_tensorcore.cuda", [["TENSOR", [32, 64, 64], "float16"], ["TENSOR", [32, 32, 64], "float16"]], {}], "config": {"index": 1655, "code_hash": null, "entity": [["block_row_warps", "ot", 4], ["block_col_warps", "ot", 4], ["warp_row_tiles", "ot", 1], ["warp_col_tiles", "ot", 2], ["chunk", "ot", 1], ["offset", "ot", 8], ["offsetCS", "ot", 0], ["vec", "ot", 2], ["wmma_m", "ot", 32]]}, "result": [[1.2170180999999999e-05], 0, 1.1621167659759521, 1668059965.3242567], "version": 0.2, "tvm_version": "0.8.0"}
{"input": ["cuda -keys=cuda,gpu -max_num_threads=1024 -thread_warp_size=32", "batch_matmul_tensorcore.cuda", [["TENSOR", [32, 64, 64], "float16"], ["TENSOR", [32, 32, 64], "float16"]], {}], "config": {"index": 2897, "code_hash": null, "entity": [["block_row_warps", "ot", 4], ["block_col_warps", "ot", 4], ["warp_row_tiles", "ot", 1], ["warp_col_tiles", "ot", 4], ["chunk", "ot", 8], ["offset", "ot", 0], ["offsetCS", "ot", 0], ["vec", "ot", 4], ["wmma_m", "ot", 32]]}, "result": [[1.8436692e-05], 0, 1.1183099746704102, 1668059966.8010342], "version": 0.2, "tvm_version": "0.8.0"}
{"input": ["cuda -keys=cuda,gpu -max_num_threads=1024 -thread_warp_size=32", "batch_matmul_tensorcore.cuda", [["TENSOR", [32, 64, 64], "float16"], ["TENSOR", [32, 32, 64], "float16"]], {}], "config": {"index": 7724, "code_hash": null, "entity": [["block_row_warps", "ot", 4], ["block_col_warps", "ot", 1], ["warp_row_tiles", "ot", 1], ["warp_col_tiles", "ot", 2], ["chunk", "ot", 8], ["offset", "ot", 8], ["offsetCS", "ot", 8], ["vec", "ot", 2], ["wmma_m", "ot", 16]]}, "result": [[3.7868733003708283e-06], 0, 1.200706958770752, 1668059967.3353245], "version": 0.2, "tvm_version": "0.8.0"}
{"input": ["cuda -keys=cuda,gpu -max_num_threads=1024 -thread_warp_size=32", "batch_matmul_tensorcore.cuda", [["TENSOR", [32, 64, 64], "float16"], ["TENSOR", [32, 32, 64], "float16"]], {}], "config": {"index": 8190, "code_hash": null, "entity": [["block_row_warps", "ot", 1], ["block_col_warps", "ot", 1], ["warp_row_tiles", "ot", 2], ["warp_col_tiles", "ot", 1], ["chunk", "ot", 2], ["offset", "ot", 8], ["offsetCS", "ot", 0], ["vec", "ot", 4], ["wmma_m", "ot", 16]]}, "result": [[3.198616810877627e-06], 0, 1.0586256980895996, 1668059968.1963117], "version": 0.2, "tvm_version": "0.8.0"}
{"input": ["cuda -keys=cuda,gpu -max_num_threads=1024 -thread_warp_size=32", "batch_matmul_tensorcore.cuda", [["TENSOR", [32, 64, 64], "float16"], ["TENSOR", [32, 32, 64], "float16"]], {}], "config": {"index": 7005, "code_hash": null, "entity": [["block_row_warps", "ot", 1], ["block_col_warps", "ot", 2], ["warp_row_tiles", "ot", 2], ["warp_col_tiles", "ot", 2], ["chunk", "ot", 4], ["offset", "ot", 8], ["offsetCS", "ot", 0], ["vec", "ot", 2], ["wmma_m", "ot", 16]]}, "result": [[3.3792540173053155e-06], 0, 1.0578560829162598, 1668059968.640178], "version": 0.2, "tvm_version": "0.8.0"}
{"input": ["cuda -keys=cuda,gpu -max_num_threads=1024 -thread_warp_size=32", "batch_matmul_tensorcore.cuda", [["TENSOR", [32, 64, 64], "float16"], ["TENSOR", [32, 32, 64], "float16"]], {}], "config": {"index": 3833, "code_hash": null, "entity": [["block_row_warps", "ot", 4], ["block_col_warps", "ot", 4], ["warp_row_tiles", "ot", 4], ["warp_col_tiles", "ot", 1], ["chunk", "ot", 8], ["offset", "ot", 8], ["offsetCS", "ot", 8], ["vec", "ot", 4], ["wmma_m", "ot", 32]]}, "result": [[8.727337e-06], 0, 1.2232375144958496, 1668059969.5660985], "version": 0.2, "tvm_version": "0.8.0"}
{"input": ["cuda -keys=cuda,gpu -max_num_threads=1024 -thread_warp_size=32", "batch_matmul_tensorcore.cuda", [["TENSOR", [32, 64, 64], "float16"], ["TENSOR", [32, 32, 64], "float16"]], {}], "config": {"index": 964, "code_hash": null, "entity": [["block_row_warps", "ot", 2], ["block_col_warps", "ot", 1], ["warp_row_tiles", "ot", 4], ["warp_col_tiles", "ot", 4], ["chunk", "ot", 8], ["offset", "ot", 0], ["offsetCS", "ot", 8], ["vec", "ot", 1], ["wmma_m", "ot", 32]]}, "result": [[5.3999449999999995e-06], 0, 1.2235932350158691, 1668059970.0776255], "version": 0.2, "tvm_version": "0.8.0"}
{"input": ["cuda -keys=cuda,gpu -max_num_threads=1024 -thread_warp_size=32", "batch_matmul_tensorcore.cuda", [["TENSOR", [32, 64, 64], "float16"], ["TENSOR", [32, 32, 64], "float16"]], {}], "config": {"index": 6898, "code_hash": null, "entity": [["block_row_warps", "ot", 2], ["block_col_warps", "ot", 2], ["warp_row_tiles", "ot", 2], ["warp_col_tiles", "ot", 1], ["chunk", "ot", 2], ["offset", "ot", 8], ["offsetCS", "ot", 0], ["vec", "ot", 2], ["wmma_m", "ot", 16]]}, "result": [[4.513009888751545e-06], 0, 0.9866745471954346, 1668059971.009827], "version": 0.2, "tvm_version": "0.8.0"}
{"input": ["cuda -keys=cuda,gpu -max_num_threads=1024 -thread_warp_size=32", "batch_matmul_tensorcore.cuda", [["TENSOR", [32, 64, 64], "float16"], ["TENSOR", [32, 32, 64], "float16"]], {}], "config": {"index": 10157, "code_hash": null, "entity": [["block_row_warps", "ot", 4], ["block_col_warps", "ot", 2], ["warp_row_tiles", "ot", 1], ["warp_col_tiles", "ot", 2], ["chunk", "ot", 2], ["offset", "ot", 8], ["offsetCS", "ot", 8], ["vec", "ot", 8], ["wmma_m", "ot", 16]]}, "result": [[1.1698486000000002e-05], 0, 1.0971903800964355, 1668059972.4685812], "version": 0.2, "tvm_version": "0.8.0"}
{"input": ["cuda -keys=cuda,gpu -max_num_threads=1024 -thread_warp_size=32", "batch_matmul_tensorcore.cuda", [["TENSOR", [32, 64, 64], "float16"], ["TENSOR", [32, 32, 64], "float16"]], {}], "config": {"index": 11846, "code_hash": null, "entity": [["block_row_warps", "ot", 4], ["block_col_warps", "ot", 1], ["warp_row_tiles", "ot", 4], ["warp_col_tiles", "ot", 1], ["chunk", "ot", 4], ["offset", "ot", 0], ["offsetCS", "ot", 0], ["vec", "ot", 2], ["wmma_m", "ot", 8]]}, "result": [[6.663978e-06], 0, 0.9884870052337646, 1668059973.4158425], "version": 0.2, "tvm_version": "0.8.0"}
{"input": ["cuda -keys=cuda,gpu -max_num_threads=1024 -thread_warp_size=32", "batch_matmul_tensorcore.cuda", [["TENSOR", [32, 64, 64], "float16"], ["TENSOR", [32, 32, 64], "float16"]], {}], "config": {"index": 7635, "code_hash": null, "entity": [["block_row_warps", "ot", 1], ["block_col_warps", "ot", 2], ["warp_row_tiles", "ot", 4], ["warp_col_tiles", "ot", 1], ["chunk", "ot", 4], ["offset", "ot", 8], ["offsetCS", "ot", 8], ["vec", "ot", 2], ["wmma_m", "ot", 16]]}, "result": [[3.669870828182942e-06], 0, 0.8785288333892822, 1668059974.8084936], "version": 0.2, "tvm_version": "0.8.0"}
{"input": ["cuda -keys=cuda,gpu -max_num_threads=1024 -thread_warp_size=32", "batch_matmul_tensorcore.cuda", [["TENSOR", [32, 64, 64], "float16"], ["TENSOR", [32, 32, 64], "float16"]], {}], "config": {"index": 2353, "code_hash": null, "entity": [["block_row_warps", "ot", 2], ["block_col_warps", "ot", 2], ["warp_row_tiles", "ot", 1], ["warp_col_tiles", "ot", 1], ["chunk", "ot", 2], ["offset", "ot", 8], ["offsetCS", "ot", 8], ["vec", "ot", 2], ["wmma_m", "ot", 32]]}, "result": [[4.2625624227441285e-06], 0, 0.9203851222991943, 1668059975.7342], "version": 0.2, "tvm_version": "0.8.0"}
{"input": ["cuda -keys=cuda,gpu -max_num_threads=1024 -thread_warp_size=32", "batch_matmul_tensorcore.cuda", [["TENSOR", [32, 64, 64], "float16"], ["TENSOR", [32, 32, 64], "float16"]], {}], "config": {"index": 10219, "code_hash": null, "entity": [["block_row_warps", "ot", 2], ["block_col_warps", "ot", 2], ["warp_row_tiles", "ot", 2], ["warp_col_tiles", "ot", 1], ["chunk", "ot", 4], ["offset", "ot", 8], ["offsetCS", "ot", 8], ["vec", "ot", 8], ["wmma_m", "ot", 16]]}, "result": [[4.2560828182941906e-06], 0, 1.1204180717468262, 1668059976.2541578], "version": 0.2, "tvm_version": "0.8.0"}
{"input": ["cuda -keys=cuda,gpu -max_num_threads=1024 -thread_warp_size=32", "batch_matmul_tensorcore.cuda", [["TENSOR", [32, 64, 64], "float16"], ["TENSOR", [32, 32, 64], "float16"]], {}], "config": {"index": 13457, "code_hash": null, "entity": [["block_row_warps", "ot", 4], ["block_col_warps", "ot", 1], ["warp_row_tiles", "ot", 2], ["warp_col_tiles", "ot", 1], ["chunk", "ot", 4], ["offset", "ot", 8], ["offsetCS", "ot", 0], ["vec", "ot", 4], ["wmma_m", "ot", 8]]}, "result": [[4.225674289245983e-06], 0, 1.0682649612426758, 1668059976.7815006], "version": 0.2, "tvm_version": "0.8.0"}
{"input": ["cuda -keys=cuda,gpu -max_num_threads=1024 -thread_warp_size=32", "batch_matmul_tensorcore.cuda", [["TENSOR", [32, 64, 64], "float16"], ["TENSOR", [32, 32, 64], "float16"]], {}], "config": {"index": 9669, "code_hash": null, "entity": [["block_row_warps", "ot", 1], ["block_col_warps", "ot", 2], ["warp_row_tiles", "ot", 1], ["warp_col_tiles", "ot", 2], ["chunk", "ot", 8], ["offset", "ot", 8], ["offsetCS", "ot", 0], ["vec", "ot", 8], ["wmma_m", "ot", 16]]}, "result": [[3.6395506798516685e-06], 0, 1.0300700664520264, 1668059977.3131123], "version": 0.2, "tvm_version": "0.8.0"}
{"input": ["cuda -keys=cuda,gpu -max_num_threads=1024 -thread_warp_size=32", "batch_matmul_tensorcore.cuda", [["TENSOR", [32, 64, 64], "float16"], ["TENSOR", [32, 32, 64], "float16"]], {}], "config": {"index": 12816, "code_hash": null, "entity": [["block_row_warps", "ot", 1], ["block_col_warps", "ot", 1], ["warp_row_tiles", "ot", 4], ["warp_col_tiles", "ot", 1], ["chunk", "ot", 4], ["offset", "ot", 8], ["offsetCS", "ot", 8], ["vec", "ot", 2], ["wmma_m", "ot", 8]]}, "result": [[3.369005562422744e-06], 0, 0.9960691928863525, 1668059978.1824064], "version": 0.2, "tvm_version": "0.8.0"}
{"input": ["cuda -keys=cuda,gpu -max_num_threads=1024 -thread_warp_size=32", "batch_matmul_tensorcore.cuda", [["TENSOR", [32, 64, 64], "float16"], ["TENSOR", [32, 32, 64], "float16"]], {}], "config": {"index": 7157, "code_hash": null, "entity": [["block_row_warps", "ot", 4], ["block_col_warps", "ot", 1], ["warp_row_tiles", "ot", 1], ["warp_col_tiles", "ot", 2], ["chunk", "ot", 1], ["offset", "ot", 0], ["offsetCS", "ot", 8], ["vec", "ot", 2], ["wmma_m", "ot", 16]]}, "result": [[4.65744870210136e-06], 0, 0.9652831554412842, 1668059978.6860986], "version": 0.2, "tvm_version": "0.8.0"}
{"input": ["cuda -keys=cuda,gpu -max_num_threads=1024 -thread_warp_size=32", "batch_matmul_tensorcore.cuda", [["TENSOR", [32, 64, 64], "float16"], ["TENSOR", [32, 32, 64], "float16"]], {}], "config": {"index": 2537, "code_hash": null, "entity": [["block_row_warps", "ot", 4], ["block_col_warps", "ot", 4], ["warp_row_tiles", "ot", 4], ["warp_col_tiles", "ot", 1], ["chunk", "ot", 8], ["offset", "ot", 8], ["offsetCS", "ot", 8], ["vec", "ot", 2], ["wmma_m", "ot", 32]]}, "result": [[7.889436e-06], 0, 1.120276689529419, 1668059979.2609882], "version": 0.2, "tvm_version": "0.8.0"}
{"input": ["cuda -keys=cuda,gpu -max_num_threads=1024 -thread_warp_size=32", "batch_matmul_tensorcore.cuda", [["TENSOR", [32, 64, 64], "float16"], ["TENSOR", [32, 32, 64], "float16"]], {}], "config": {"index": 10162, "code_hash": null, "entity": [["block_row_warps", "ot", 2], ["block_col_warps", "ot", 1], ["warp_row_tiles", "ot", 2], ["warp_col_tiles", "ot", 2], ["chunk", "ot", 2], ["offset", "ot", 8], ["offsetCS", "ot", 8], ["vec", "ot", 8], ["wmma_m", "ot", 16]]}, "result": [[3.789428306551298e-06], 0, 1.0715363025665283, 1668059979.7712677], "version": 0.2, "tvm_version": "0.8.0"}
{"input": ["cuda -keys=cuda,gpu -max_num_threads=1024 -thread_warp_size=32", "batch_matmul_tensorcore.cuda", [["TENSOR", [32, 64, 64], "float16"], ["TENSOR", [32, 32, 64], "float16"]], {}], "config": {"index": 12558, "code_hash": null, "entity": [["block_row_warps", "ot", 1], ["block_col_warps", "ot", 2], ["warp_row_tiles", "ot", 1], ["warp_col_tiles", "ot", 1], ["chunk", "ot", 8], ["offset", "ot", 0], ["offsetCS", "ot", 8], ["vec", "ot", 2], ["wmma_m", "ot", 8]]}, "result": [[4.77107107540173e-06], 0, 0.950089693069458, 1668059981.1955264], "version": 0.2, "tvm_version": "0.8.0"}
{"input": ["cuda -keys=cuda,gpu -max_num_threads=1024 -thread_warp_size=32", "batch_matmul_tensorcore.cuda", [["TENSOR", [32, 64, 64], "float16"], ["TENSOR", [32, 32, 64], "float16"]], {}], "config": {"index": 5289, "code_hash": null, "entity": [["block_row_warps", "ot", 1], ["block_col_warps", "ot", 4], ["warp_row_tiles", "ot", 4], ["warp_col_tiles", "ot", 1], ["chunk", "ot", 2], ["offset", "ot", 0], ["offsetCS", "ot", 0], ["vec", "ot", 1], ["wmma_m", "ot", 16]]}, "result": [[6.179589e-06], 0, 1.0911037921905518, 1668059981.746728], "version": 0.2, "tvm_version": "0.8.0"}
{"input": ["cuda -keys=cuda,gpu -max_num_threads=1024 -thread_warp_size=32", "batch_matmul_tensorcore.cuda", [["TENSOR", [32, 64, 64], "float16"], ["TENSOR", [32, 32, 64], "float16"]], {}], "config": {"index": 8941, "code_hash": null, "entity": [["block_row_warps", "ot", 2], ["block_col_warps", "ot", 2], ["warp_row_tiles", "ot", 1], ["warp_col_tiles", "ot", 2], ["chunk", "ot", 4], ["offset", "ot", 8], ["offsetCS", "ot", 8], ["vec", "ot", 4], ["wmma_m", "ot", 16]]}, "result": [[4.18402348578492e-06], 0, 1.0376768112182617, 1668059982.2506773], "version": 0.2, "tvm_version": "0.8.0"}
{"input": ["cuda -keys=cuda,gpu -max_num_threads=1024 -thread_warp_size=32", "batch_matmul_tensorcore.cuda", [["TENSOR", [32, 64, 64], "float16"], ["TENSOR", [32, 32, 64], "float16"]], {}], "config": {"index": 2439, "code_hash": null, "entity": [["block_row_warps", "ot", 1], ["block_col_warps", "ot", 1], ["warp_row_tiles", "ot", 2], ["warp_col_tiles", "ot", 1], ["chunk", "ot", 4], ["offset", "ot", 8], ["offsetCS", "ot", 8], ["vec", "ot", 2], ["wmma_m", "ot", 32]]}, "result": [[3.4210364647713227e-06], 0, 1.009119987487793, 1668059983.1591415], "version": 0.2, "tvm_version": "0.8.0"}
{"input": ["cuda -keys=cuda,gpu -max_num_threads=1024 -thread_warp_size=32", "batch_matmul_tensorcore.cuda", [["TENSOR", [32, 64, 64], "float16"], ["TENSOR", [32, 32, 64], "float16"]], {}], "config": {"index": 1835, "code_hash": null, "entity": [["block_row_warps", "ot", 4], ["block_col_warps", "ot", 4], ["warp_row_tiles", "ot", 4], ["warp_col_tiles", "ot", 2], ["chunk", "ot", 4], ["offset", "ot", 8], ["offsetCS", "ot", 0], ["vec", "ot", 2], ["wmma_m", "ot", 32]]}, "result": [[9.285693999999998e-06], 0, 1.1679470539093018, 1668059983.723815], "version": 0.2, "tvm_version": "0.8.0"}
{"input": ["cuda -keys=cuda,gpu -max_num_threads=1024 -thread_warp_size=32", "batch_matmul_tensorcore.cuda", [["TENSOR", [32, 64, 64], "float16"], ["TENSOR", [32, 32, 64], "float16"]], {}], "config": {"index": 11920, "code_hash": null, "entity": [["block_row_warps", "ot", 2], ["block_col_warps", "ot", 2], ["warp_row_tiles", "ot", 2], ["warp_col_tiles", "ot", 1], ["chunk", "ot", 8], ["offset", "ot", 0], ["offsetCS", "ot", 0], ["vec", "ot", 2], ["wmma_m", "ot", 8]]}, "result": [[5.555356999999999e-06], 0, 0.9795141220092773, 1668059984.227613], "version": 0.2, "tvm_version": "0.8.0"}
{"input": ["cuda -keys=cuda,gpu -max_num_threads=1024 -thread_warp_size=32", "batch_matmul_tensorcore.cuda", [["TENSOR", [32, 64, 64], "float16"], ["TENSOR", [32, 32, 64], "float16"]], {}], "config": {"index": 1007, "code_hash": null, "entity": [["block_row_warps", "ot", 4], ["block_col_warps", "ot", 4], ["warp_row_tiles", "ot", 1], ["warp_col_tiles", "ot", 2], ["chunk", "ot", 1], ["offset", "ot", 8], ["offsetCS", "ot", 8], ["vec", "ot", 1], ["wmma_m", "ot", 32]]}, "result": [[7.398571e-06], 0, 0.9091980457305908, 1668059985.1691403], "version": 0.2, "tvm_version": "0.8.0"}
{"input": ["cuda -keys=cuda,gpu -max_num_threads=1024 -thread_warp_size=32", "batch_matmul_tensorcore.cuda", [["TENSOR", [32, 64, 64], "float16"], ["TENSOR", [32, 32, 64], "float16"]], {}], "config": {"index": 13205, "code_hash": null, "entity": [["block_row_warps", "ot", 4], ["block_col_warps", "ot", 1], ["warp_row_tiles", "ot", 1], ["warp_col_tiles", "ot", 1], ["chunk", "ot", 8], ["offset", "ot", 0], ["offsetCS", "ot", 0], ["vec", "ot", 4], ["wmma_m", "ot", 8]]}, "result": [[6.791961e-06], 0, 1.013612985610962, 1668059985.7123563], "version": 0.2, "tvm_version": "0.8.0"}
{"input": ["cuda -keys=cuda,gpu -max_num_threads=1024 -thread_warp_size=32", "batch_matmul_tensorcore.cuda", [["TENSOR", [32, 64, 64], "float16"], ["TENSOR", [32, 32, 64], "float16"]], {}], "config": {"index": 2930, "code_hash": null, "entity": [["block_row_warps", "ot", 4], ["block_col_warps", "ot", 2], ["warp_row_tiles", "ot", 2], ["warp_col_tiles", "ot", 1], ["chunk", "ot", 1], ["offset", "ot", 8], ["offsetCS", "ot", 0], ["vec", "ot", 4], ["wmma_m", "ot", 32]]}, "result": [[5.710071e-06], 0, 0.9491226673126221, 1668059987.5242896], "version": 0.2, "tvm_version": "0.8.0"}
{"input": ["cuda -keys=cuda,gpu -max_num_threads=1024 -thread_warp_size=32", "batch_matmul_tensorcore.cuda", [["TENSOR", [32, 64, 64], "float16"], ["TENSOR", [32, 32, 64], "float16"]], {}], "config": {"index": 3866, "code_hash": null, "entity": [["block_row_warps", "ot", 4], ["block_col_warps", "ot", 2], ["warp_row_tiles", "ot", 1], ["warp_col_tiles", "ot", 4], ["chunk", "ot", 8], ["offset", "ot", 8], ["offsetCS", "ot", 8], ["vec", "ot", 4], ["wmma_m", "ot", 32]]}, "result": [[4.496221878862794e-06], 0, 1.00738525390625, 1668059988.0484948], "version": 0.2, "tvm_version": "0.8.0"}
{"input": ["cuda -keys=cuda,gpu -max_num_threads=1024 -thread_warp_size=32", "batch_matmul_tensorcore.cuda", [["TENSOR", [32, 64, 64], "float16"], ["TENSOR", [32, 32, 64], "float16"]], {}], "config": {"index": 12157, "code_hash": null, "entity": [["block_row_warps", "ot", 2], ["block_col_warps", "ot", 4], ["warp_row_tiles", "ot", 1], ["warp_col_tiles", "ot", 1], ["chunk", "ot", 4], ["offset", "ot", 8], ["offsetCS", "ot", 0], ["vec", "ot", 2], ["wmma_m", "ot", 8]]}, "result": [[5.22015e-06], 0, 0.8433363437652588, 1668059988.9553406], "version": 0.2, "tvm_version": "0.8.0"}
{"input": ["cuda -keys=cuda,gpu -max_num_threads=1024 -thread_warp_size=32", "batch_matmul_tensorcore.cuda", [["TENSOR", [32, 64, 64], "float16"], ["TENSOR", [32, 32, 64], "float16"]], {}], "config": {"index": 3875, "code_hash": null, "entity": [["block_row_warps", "ot", 4], ["block_col_warps", "ot", 2], ["warp_row_tiles", "ot", 2], ["warp_col_tiles", "ot", 4], ["chunk", "ot", 8], ["offset", "ot", 8], ["offsetCS", "ot", 8], ["vec", "ot", 4], ["wmma_m", "ot", 32]]}, "result": [[5.089385e-06], 0, 0.9414172172546387, 1668059989.8823135], "version": 0.2, "tvm_version": "0.8.0"}
{"input": ["cuda -keys=cuda,gpu -max_num_threads=1024 -thread_warp_size=32", "batch_matmul_tensorcore.cuda", [["TENSOR", [32, 64, 64], "float16"], ["TENSOR", [32, 32, 64], "float16"]], {}], "config": {"index": 3382, "code_hash": null, "entity": [["block_row_warps", "ot", 2], ["block_col_warps", "ot", 4], ["warp_row_tiles", "ot", 1], ["warp_col_tiles", "ot", 4], ["chunk", "ot", 2], ["offset", "ot", 0], ["offsetCS", "ot", 8], ["vec", "ot", 4], ["wmma_m", "ot", 32]]}, "result": [[6.500948e-06], 0, 0.99556565284729, 1668059990.3948128], "version": 0.2, "tvm_version": "0.8.0"}
{"input": ["cuda -keys=cuda,gpu -max_num_threads=1024 -thread_warp_size=32", "batch_matmul_tensorcore.cuda", [["TENSOR", [32, 64, 64], "float16"], ["TENSOR", [32, 32, 64], "float16"]], {}], "config": {"index": 11684, "code_hash": null, "entity": [["block_row_warps", "ot", 4], ["block_col_warps", "ot", 1], ["warp_row_tiles", "ot", 4], ["warp_col_tiles", "ot", 1], ["chunk", "ot", 1], ["offset", "ot", 0], ["offsetCS", "ot", 0], ["vec", "ot", 2], ["wmma_m", "ot", 8]]}, "result": [[5.04881e-06], 0, 1.1715729236602783, 1668059991.3401842], "version": 0.2, "tvm_version": "0.8.0"}
{"input": ["cuda -keys=cuda,gpu -max_num_threads=1024 -thread_warp_size=32", "batch_matmul_tensorcore.cuda", [["TENSOR", [32, 64, 64], "float16"], ["TENSOR", [32, 32, 64], "float16"]], {}], "config": {"index": 2236, "code_hash": null, "entity": [["block_row_warps", "ot", 2], ["block_col_warps", "ot", 2], ["warp_row_tiles", "ot", 4], ["warp_col_tiles", "ot", 2], ["chunk", "ot", 8], ["offset", "ot", 0], ["offsetCS", "ot", 8], ["vec", "ot", 2], ["wmma_m", "ot", 32]]}, "result": [[7.435037e-06], 0, 0.8774993419647217, 1668059992.2644277], "version": 0.2, "tvm_version": "0.8.0"}
{"input": ["cuda -keys=cuda,gpu -max_num_threads=1024 -thread_warp_size=32", "batch_matmul_tensorcore.cuda", [["TENSOR", [32, 64, 64], "float16"], ["TENSOR", [32, 32, 64], "float16"]], {}], "config": {"index": 8782, "code_hash": null, "entity": [["block_row_warps", "ot", 2], ["block_col_warps", "ot", 4], ["warp_row_tiles", "ot", 1], ["warp_col_tiles", "ot", 2], ["chunk", "ot", 1], ["offset", "ot", 8], ["offsetCS", "ot", 8], ["vec", "ot", 4], ["wmma_m", "ot", 16]]}, "result": [[5.9238060000000005e-06], 0, 0.9667346477508545, 1668059992.762958], "version": 0.2, "tvm_version": "0.8.0"}
{"input": ["cuda -keys=cuda,gpu -max_num_threads=1024 -thread_warp_size=32", "batch_matmul_tensorcore.cuda", [["TENSOR", [32, 64, 64], "float16"], ["TENSOR", [32, 32, 64], "float16"]], {}], "config": {"index": 10255, "code_hash": null, "entity": [["block_row_warps", "ot", 2], ["block_col_warps", "ot", 2], ["warp_row_tiles", "ot", 4], ["warp_col_tiles", "ot", 2], ["chunk", "ot", 4], ["offset", "ot", 8], ["offsetCS", "ot", 8], ["vec", "ot", 8], ["wmma_m", "ot", 16]]}, "result": [[4.709966007416564e-06], 0, 1.1814038753509521, 1668059993.695485], "version": 0.2, "tvm_version": "0.8.0"}
{"input": ["cuda -keys=cuda,gpu -max_num_threads=1024 -thread_warp_size=32", "batch_matmul_tensorcore.cuda", [["TENSOR", [32, 64, 64], "float16"], ["TENSOR", [32, 32, 64], "float16"]], {}], "config": {"index": 5020, "code_hash": null, "entity": [["block_row_warps", "ot", 2], ["block_col_warps", "ot", 4], ["warp_row_tiles", "ot", 4], ["warp_col_tiles", "ot", 4], ["chunk", "ot", 2], ["offset", "ot", 8], ["offsetCS", "ot", 8], ["vec", "ot", 8], ["wmma_m", "ot", 32]]}, "result": [[6.969979e-06], 0, 1.1984586715698242, 1668059994.6386504], "version": 0.2, "tvm_version": "0.8.0"}
{"input": ["cuda -keys=cuda,gpu -max_num_threads=1024 -thread_warp_size=32", "batch_matmul_tensorcore.cuda", [["TENSOR", [32, 64, 64], "float16"], ["TENSOR", [32, 32, 64], "float16"]], {}], "config": {"index": 3548, "code_hash": null, "entity": [["block_row_warps", "ot", 4], ["block_col_warps", "ot", 1], ["warp_row_tiles", "ot", 2], ["warp_col_tiles", "ot", 4], ["chunk", "ot", 8], ["offset", "ot", 0], ["offsetCS", "ot", 8], ["vec", "ot", 4], ["wmma_m", "ot", 32]]}, "result": [[6.0806339999999995e-06], 0, 1.1112308502197266, 1668059995.0810242], "version": 0.2, "tvm_version": "0.8.0"}
{"input": ["cuda -keys=cuda,gpu -max_num_threads=1024 -thread_warp_size=32", "batch_matmul_tensorcore.cuda", [["TENSOR", [32, 64, 64], "float16"], ["TENSOR", [32, 32, 64], "float16"]], {}], "config": {"index": 5112, "code_hash": null, "entity": [["block_row_warps", "ot", 1], ["block_col_warps", "ot", 1], ["warp_row_tiles", "ot", 2], ["warp_col_tiles", "ot", 1], ["chunk", "ot", 8], ["offset", "ot", 8], ["offsetCS", "ot", 8], ["vec", "ot", 8], ["wmma_m", "ot", 32]]}, "result": [[3.3999301606922127e-06], 0, 0.8417007923126221, 1668059995.9456327], "version": 0.2, "tvm_version": "0.8.0"}
{"input": ["cuda -keys=cuda,gpu -max_num_threads=1024 -thread_warp_size=32", "batch_matmul_tensorcore.cuda", [["TENSOR", [32, 64, 64], "float16"], ["TENSOR", [32, 32, 64], "float16"]], {}], "config": {"index": 6804, "code_hash": null, "entity": [["block_row_warps", "ot", 1], ["block_col_warps", "ot", 1], ["warp_row_tiles", "ot", 1], ["warp_col_tiles", "ot", 1], ["chunk", "ot", 1], ["offset", "ot", 8], ["offsetCS", "ot", 0], ["vec", "ot", 2], ["wmma_m", "ot", 16]]}, "result": [[3.5916538936959208e-06], 0, 1.0391066074371338, 1668059996.8454597], "version": 0.2, "tvm_version": "0.8.0"}
{"input": ["cuda -keys=cuda,gpu -max_num_threads=1024 -thread_warp_size=32", "batch_matmul_tensorcore.cuda", [["TENSOR", [32, 64, 64], "float16"], ["TENSOR", [32, 32, 64], "float16"]], {}], "config": {"index": 9103, "code_hash": null, "entity": [["block_row_warps", "ot", 2], ["block_col_warps", "ot", 2], ["warp_row_tiles", "ot", 1], ["warp_col_tiles", "ot", 2], ["chunk", "ot", 1], ["offset", "ot", 0], ["offsetCS", "ot", 0], ["vec", "ot", 8], ["wmma_m", "ot", 16]]}, "result": [[9.054192e-06], 0, 1.1183960437774658, 1668059998.3060992], "version": 0.2, "tvm_version": "0.8.0"}
{"input": ["cuda -keys=cuda,gpu -max_num_threads=1024 -thread_warp_size=32", "batch_matmul_tensorcore.cuda", [["TENSOR", [32, 64, 64], "float16"], ["TENSOR", [32, 32, 64], "float16"]], {}], "config": {"index": 4247, "code_hash": null, "entity": [["block_row_warps", "ot", 4], ["block_col_warps", "ot", 4], ["warp_row_tiles", "ot", 1], ["warp_col_tiles", "ot", 2], ["chunk", "ot", 1], ["offset", "ot", 8], ["offsetCS", "ot", 0], ["vec", "ot", 8], ["wmma_m", "ot", 32]]}, "result": [[2.4202570000000002e-05], 0, 1.018225908279419, 1668059999.3098905], "version": 0.2, "tvm_version": "0.8.0"}
{"input": ["cuda -keys=cuda,gpu -max_num_threads=1024 -thread_warp_size=32", "batch_matmul_tensorcore.cuda", [["TENSOR", [32, 64, 64], "float16"], ["TENSOR", [32, 32, 64], "float16"]], {}], "config": {"index": 11766, "code_hash": null, "entity": [["block_row_warps", "ot", 1], ["block_col_warps", "ot", 2], ["warp_row_tiles", "ot", 4], ["warp_col_tiles", "ot", 1], ["chunk", "ot", 2], ["offset", "ot", 0], ["offsetCS", "ot", 0], ["vec", "ot", 2], ["wmma_m", "ot", 8]]}, "result": [[3.845449938195303e-06], 0, 1.1486830711364746, 1668059999.8136144], "version": 0.2, "tvm_version": "0.8.0"}
{"input": ["cuda -keys=cuda,gpu -max_num_threads=1024 -thread_warp_size=32", "batch_matmul_tensorcore.cuda", [["TENSOR", [32, 64, 64], "float16"], ["TENSOR", [32, 32, 64], "float16"]], {}], "config": {"index": 5951, "code_hash": null, "entity": [["block_row_warps", "ot", 4], ["block_col_warps", "ot", 1], ["warp_row_tiles", "ot", 2], ["warp_col_tiles", "ot", 2], ["chunk", "ot", 2], ["offset", "ot", 0], ["offsetCS", "ot", 8], ["vec", "ot", 1], ["wmma_m", "ot", 16]]}, "result": [[5.121879e-06], 0, 1.0666859149932861, 1668060001.2437487], "version": 0.2, "tvm_version": "0.8.0"}
{"input": ["cuda -keys=cuda,gpu -max_num_threads=1024 -thread_warp_size=32", "batch_matmul_tensorcore.cuda", [["TENSOR", [32, 64, 64], "float16"], ["TENSOR", [32, 32, 64], "float16"]], {}], "config": {"index": 7492, "code_hash": null, "entity": [["block_row_warps", "ot", 2], ["block_col_warps", "ot", 2], ["warp_row_tiles", "ot", 2], ["warp_col_tiles", "ot", 2], ["chunk", "ot", 1], ["offset", "ot", 8], ["offsetCS", "ot", 8], ["vec", "ot", 2], ["wmma_m", "ot", 16]]}, "result": [[4.344351668726824e-06], 0, 1.156656265258789, 1668060002.1848218], "version": 0.2, "tvm_version": "0.8.0"}
{"input": ["cuda -keys=cuda,gpu -max_num_threads=1024 -thread_warp_size=32", "batch_matmul_tensorcore.cuda", [["TENSOR", [32, 64, 64], "float16"], ["TENSOR", [32, 32, 64], "float16"]], {}], "config": {"index": 722, "code_hash": null, "entity": [["block_row_warps", "ot", 4], ["block_col_warps", "ot", 1], ["warp_row_tiles", "ot", 4], ["warp_col_tiles", "ot", 4], ["chunk", "ot", 1], ["offset", "ot", 0], ["offsetCS", "ot", 8], ["vec", "ot", 1], ["wmma_m", "ot", 32]]}, "result": [[5.557167e-06], 0, 1.1111667156219482, 1668060002.6783493], "version": 0.2, "tvm_version": "0.8.0"}
{"input": ["cuda -keys=cuda,gpu -max_num_threads=1024 -thread_warp_size=32", "batch_matmul_tensorcore.cuda", [["TENSOR", [32, 64, 64], "float16"], ["TENSOR", [32, 32, 64], "float16"]], {}], "config": {"index": 4499, "code_hash": null, "entity": [["block_row_warps", "ot", 4], ["block_col_warps", "ot", 4], ["warp_row_tiles", "ot", 2], ["warp_col_tiles", "ot", 2], ["chunk", "ot", 8], ["offset", "ot", 8], ["offsetCS", "ot", 0], ["vec", "ot", 8], ["wmma_m", "ot", 32]]}, "result": [[9.649174e-06], 0, 1.1451044082641602, 1668060003.1262019], "version": 0.2, "tvm_version": "0.8.0"}
{"input": ["cuda -keys=cuda,gpu -max_num_threads=1024 -thread_warp_size=32", "batch_matmul_tensorcore.cuda", [["TENSOR", [32, 64, 64], "float16"], ["TENSOR", [32, 32, 64], "float16"]], {}], "config": {"index": 4367, "code_hash": null, "entity": [["block_row_warps", "ot", 4], ["block_col_warps", "ot", 1], ["warp_row_tiles", "ot", 4], ["warp_col_tiles", "ot", 4], ["chunk", "ot", 2], ["offset", "ot", 8], ["offsetCS", "ot", 0], ["vec", "ot", 8], ["wmma_m", "ot", 32]]}, "result": [[5.368234e-06], 0, 0.9125447273254395, 1668060004.0481305], "version": 0.2, "tvm_version": "0.8.0"}
{"input": ["cuda -keys=cuda,gpu -max_num_threads=1024 -thread_warp_size=32", "batch_matmul_tensorcore.cuda", [["TENSOR", [32, 64, 64], "float16"], ["TENSOR", [32, 32, 64], "float16"]], {}], "config": {"index": 7893, "code_hash": null, "entity": [["block_row_warps", "ot", 1], ["block_col_warps", "ot", 1], ["warp_row_tiles", "ot", 2], ["warp_col_tiles", "ot", 2], ["chunk", "ot", 2], ["offset", "ot", 0], ["offsetCS", "ot", 0], ["vec", "ot", 4], ["wmma_m", "ot", 16]]}, "result": [[3.7253590852904824e-06], 0, 0.9682033061981201, 1668060004.5423496], "version": 0.2, "tvm_version": "0.8.0"}
{"input": ["cuda -keys=cuda,gpu -max_num_threads=1024 -thread_warp_size=32", "batch_matmul_tensorcore.cuda", [["TENSOR", [32, 64, 64], "float16"], ["TENSOR", [32, 32, 64], "float16"]], {}], "config": {"index": 600, "code_hash": null, "entity": [["block_row_warps", "ot", 1], ["block_col_warps", "ot", 4], ["warp_row_tiles", "ot", 1], ["warp_col_tiles", "ot", 2], ["chunk", "ot", 8], ["offset", "ot", 8], ["offsetCS", "ot", 0], ["vec", "ot", 1], ["wmma_m", "ot", 32]]}, "result": [[3.9288572311495675e-06], 0, 0.9137270450592041, 1668060005.9619434], "version": 0.2, "tvm_version": "0.8.0"}
{"input": ["cuda -keys=cuda,gpu -max_num_threads=1024 -thread_warp_size=32", "batch_matmul_tensorcore.cuda", [["TENSOR", [32, 64, 64], "float16"], ["TENSOR", [32, 32, 64], "float16"]], {}], "config": {"index": 7238, "code_hash": null, "entity": [["block_row_warps", "ot", 4], ["block_col_warps", "ot", 1], ["warp_row_tiles", "ot", 1], ["warp_col_tiles", "ot", 2], ["chunk", "ot", 2], ["offset", "ot", 0], ["offsetCS", "ot", 8], ["vec", "ot", 2], ["wmma_m", "ot", 16]]}, "result": [[5.844722e-06], 0, 1.040790319442749, 1668060006.9078403], "version": 0.2, "tvm_version": "0.8.0"}
{"input": ["cuda -keys=cuda,gpu -max_num_threads=1024 -thread_warp_size=32", "batch_matmul_tensorcore.cuda", [["TENSOR", [32, 64, 64], "float16"], ["TENSOR", [32, 32, 64], "float16"]], {}], "config": {"index": 3446, "code_hash": null, "entity": [["block_row_warps", "ot", 4], ["block_col_warps", "ot", 4], ["warp_row_tiles", "ot", 2], ["warp_col_tiles", "ot", 2], ["chunk", "ot", 4], ["offset", "ot", 0], ["offsetCS", "ot", 8], ["vec", "ot", 4], ["wmma_m", "ot", 32]]}, "result": [[1.8954754e-05], 0, 1.0470941066741943, 1668060007.460423], "version": 0.2, "tvm_version": "0.8.0"}
{"input": ["cuda -keys=cuda,gpu -max_num_threads=1024 -thread_warp_size=32", "batch_matmul_tensorcore.cuda", [["TENSOR", [32, 64, 64], "float16"], ["TENSOR", [32, 32, 64], "float16"]], {}], "config": {"index": 1446, "code_hash": null, "entity": [["block_row_warps", "ot", 1], ["block_col_warps", "ot", 4], ["warp_row_tiles", "ot", 2], ["warp_col_tiles", "ot", 4], ["chunk", "ot", 2], ["offset", "ot", 0], ["offsetCS", "ot", 0], ["vec", "ot", 2], ["wmma_m", "ot", 32]]}, "result": [[5.236841e-06], 0, 0.9331600666046143, 1668060008.3983254], "version": 0.2, "tvm_version": "0.8.0"}
{"input": ["cuda -keys=cuda,gpu -max_num_threads=1024 -thread_warp_size=32", "batch_matmul_tensorcore.cuda", [["TENSOR", [32, 64, 64], "float16"], ["TENSOR", [32, 32, 64], "float16"]], {}], "config": {"index": 4103, "code_hash": null, "entity": [["block_row_warps", "ot", 4], ["block_col_warps", "ot", 4], ["warp_row_tiles", "ot", 4], ["warp_col_tiles", "ot", 2], ["chunk", "ot", 4], ["offset", "ot", 0], ["offsetCS", "ot", 0], ["vec", "ot", 8], ["wmma_m", "ot", 32]]}, "result": [[2.2880350000000002e-05], 0, 1.1725232601165771, 1668060009.386366], "version": 0.2, "tvm_version": "0.8.0"}
{"input": ["cuda -keys=cuda,gpu -max_num_threads=1024 -thread_warp_size=32", "batch_matmul_tensorcore.cuda", [["TENSOR", [32, 64, 64], "float16"], ["TENSOR", [32, 32, 64], "float16"]], {}], "config": {"index": 1232, "code_hash": null, "entity": [["block_row_warps", "ot", 4], ["block_col_warps", "ot", 4], ["warp_row_tiles", "ot", 2], ["warp_col_tiles", "ot", 1], ["chunk", "ot", 8], ["offset", "ot", 8], ["offsetCS", "ot", 8], ["vec", "ot", 1], ["wmma_m", "ot", 32]]}, "result": [[7.829638e-06], 0, 1.0691583156585693, 1668060009.875803], "version": 0.2, "tvm_version": "0.8.0"}
{"input": ["cuda -keys=cuda,gpu -max_num_threads=1024 -thread_warp_size=32", "batch_matmul_tensorcore.cuda", [["TENSOR", [32, 64, 64], "float16"], ["TENSOR", [32, 32, 64], "float16"]], {}], "config": {"index": 6030, "code_hash": null, "entity": [["block_row_warps", "ot", 1], ["block_col_warps", "ot", 1], ["warp_row_tiles", "ot", 2], ["warp_col_tiles", "ot", 2], ["chunk", "ot", 4], ["offset", "ot", 0], ["offsetCS", "ot", 8], ["vec", "ot", 1], ["wmma_m", "ot", 16]]}, "result": [[4.445437577255871e-06], 0, 1.1827738285064697, 1668060010.3937597], "version": 0.2, "tvm_version": "0.8.0"}
{"input": ["cuda -keys=cuda,gpu -max_num_threads=1024 -thread_warp_size=32", "batch_matmul_tensorcore.cuda", [["TENSOR", [32, 64, 64], "float16"], ["TENSOR", [32, 32, 64], "float16"]], {}], "config": {"index": 4318, "code_hash": null, "entity": [["block_row_warps", "ot", 2], ["block_col_warps", "ot", 4], ["warp_row_tiles", "ot", 4], ["warp_col_tiles", "ot", 1], ["chunk", "ot", 2], ["offset", "ot", 8], ["offsetCS", "ot", 0], ["vec", "ot", 8], ["wmma_m", "ot", 32]]}, "result": [[8.882055e-06], 0, 1.0258305072784424, 1668060010.9548051], "version": 0.2, "tvm_version": "0.8.0"}
{"input": ["cuda -keys=cuda,gpu -max_num_threads=1024 -thread_warp_size=32", "batch_matmul_tensorcore.cuda", [["TENSOR", [32, 64, 64], "float16"], ["TENSOR", [32, 32, 64], "float16"]], {}], "config": {"index": 5231, "code_hash": null, "entity": [["block_row_warps", "ot", 4], ["block_col_warps", "ot", 1], ["warp_row_tiles", "ot", 4], ["warp_col_tiles", "ot", 2], ["chunk", "ot", 1], ["offset", "ot", 0], ["offsetCS", "ot", 0], ["vec", "ot", 1], ["wmma_m", "ot", 16]]}, "result": [[5.28333e-06], 0, 0.9851384162902832, 1668060011.8688023], "version": 0.2, "tvm_version": "0.8.0"}
{"input": ["cuda -keys=cuda,gpu -max_num_threads=1024 -thread_warp_size=32", "batch_matmul_tensorcore.cuda", [["TENSOR", [32, 64, 64], "float16"], ["TENSOR", [32, 32, 64], "float16"]], {}], "config": {"index": 3964, "code_hash": null, "entity": [["block_row_warps", "ot", 2], ["block_col_warps", "ot", 2], ["warp_row_tiles", "ot", 4], ["warp_col_tiles", "ot", 4], ["chunk", "ot", 1], ["offset", "ot", 0], ["offsetCS", "ot", 0], ["vec", "ot", 8], ["wmma_m", "ot", 32]]}, "result": [[7.179997000000001e-06], 0, 1.1245348453521729, 1668060012.385698], "version": 0.2, "tvm_version": "0.8.0"}
{"input": ["cuda -keys=cuda,gpu -max_num_threads=1024 -thread_warp_size=32", "batch_matmul_tensorcore.cuda", [["TENSOR", [32, 64, 64], "float16"], ["TENSOR", [32, 32, 64], "float16"]], {}], "config": {"index": 2376, "code_hash": null, "entity": [["block_row_warps", "ot", 1], ["block_col_warps", "ot", 1], ["warp_row_tiles", "ot", 1], ["warp_col_tiles", "ot", 2], ["chunk", "ot", 2], ["offset", "ot", 8], ["offsetCS", "ot", 8], ["vec", "ot", 2], ["wmma_m", "ot", 32]]}, "result": [[3.4820550061804694e-06], 0, 1.1523020267486572, 1668060036.95972], "version": 0.2, "tvm_version": "0.8.0"}
{"input": ["cuda -keys=cuda,gpu -max_num_threads=1024 -thread_warp_size=32", "batch_matmul_tensorcore.cuda", [["TENSOR", [32, 64, 64], "float16"], ["TENSOR", [32, 32, 64], "float16"]], {}], "config": {"index": 2457, "code_hash": null, "entity": [["block_row_warps", "ot", 1], ["block_col_warps", "ot", 1], ["warp_row_tiles", "ot", 1], ["warp_col_tiles", "ot", 2], ["chunk", "ot", 4], ["offset", "ot", 8], ["offsetCS", "ot", 8], ["vec", "ot", 2], ["wmma_m", "ot", 32]]}, "result": [[3.136588380716935e-06], 0, 1.426546573638916, 1668060037.4476564], "version": 0.2, "tvm_version": "0.8.0"}
{"input": ["cuda -keys=cuda,gpu -max_num_threads=1024 -thread_warp_size=32", "batch_matmul_tensorcore.cuda", [["TENSOR", [32, 64, 64], "float16"], ["TENSOR", [32, 32, 64], "float16"]], {}], "config": {"index": 2430, "code_hash": null, "entity": [["block_row_warps", "ot", 1], ["block_col_warps", "ot", 1], ["warp_row_tiles", "ot", 1], ["warp_col_tiles", "ot", 1], ["chunk", "ot", 4], ["offset", "ot", 8], ["offsetCS", "ot", 8], ["vec", "ot", 2], ["wmma_m", "ot", 32]]}, "result": [[3.3616656365883802e-06], 0, 1.2768950462341309, 1668060037.9297764], "version": 0.2, "tvm_version": "0.8.0"}
{"input": ["cuda -keys=cuda,gpu -max_num_threads=1024 -thread_warp_size=32", "batch_matmul_tensorcore.cuda", [["TENSOR", [32, 64, 64], "float16"], ["TENSOR", [32, 32, 64], "float16"]], {}], "config": {"index": 7542, "code_hash": null, "entity": [["block_row_warps", "ot", 1], ["block_col_warps", "ot", 1], ["warp_row_tiles", "ot", 2], ["warp_col_tiles", "ot", 1], ["chunk", "ot", 2], ["offset", "ot", 8], ["offsetCS", "ot", 8], ["vec", "ot", 2], ["wmma_m", "ot", 16]]}, "result": [[3.520901112484549e-06], 0, 1.1710872650146484, 1668060038.3714654], "version": 0.2, "tvm_version": "0.8.0"}
{"input": ["cuda -keys=cuda,gpu -max_num_threads=1024 -thread_warp_size=32", "batch_matmul_tensorcore.cuda", [["TENSOR", [32, 64, 64], "float16"], ["TENSOR", [32, 32, 64], "float16"]], {}], "config": {"index": 7623, "code_hash": null, "entity": [["block_row_warps", "ot", 1], ["block_col_warps", "ot", 1], ["warp_row_tiles", "ot", 2], ["warp_col_tiles", "ot", 1], ["chunk", "ot", 4], ["offset", "ot", 8], ["offsetCS", "ot", 8], ["vec", "ot", 2], ["wmma_m", "ot", 16]]}, "result": [[3.424449938195303e-06], 0, 1.2651727199554443, 1668060038.8552759], "version": 0.2, "tvm_version": "0.8.0"}
{"input": ["cuda -keys=cuda,gpu -max_num_threads=1024 -thread_warp_size=32", "batch_matmul_tensorcore.cuda", [["TENSOR", [32, 64, 64], "float16"], ["TENSOR", [32, 32, 64], "float16"]], {}], "config": {"index": 3753, "code_hash": null, "entity": [["block_row_warps", "ot", 1], ["block_col_warps", "ot", 1], ["warp_row_tiles", "ot", 1], ["warp_col_tiles", "ot", 2], ["chunk", "ot", 4], ["offset", "ot", 8], ["offsetCS", "ot", 8], ["vec", "ot", 4], ["wmma_m", "ot", 32]]}, "result": [[3.1632948084054383e-06], 0, 1.1548371315002441, 1668060039.2929075], "version": 0.2, "tvm_version": "0.8.0"}
{"input": ["cuda -keys=cuda,gpu -max_num_threads=1024 -thread_warp_size=32", "batch_matmul_tensorcore.cuda", [["TENSOR", [32, 64, 64], "float16"], ["TENSOR", [32, 32, 64], "float16"]], {}], "config": {"index": 1728, "code_hash": null, "entity": [["block_row_warps", "ot", 1], ["block_col_warps", "ot", 1], ["warp_row_tiles", "ot", 1], ["warp_col_tiles", "ot", 2], ["chunk", "ot", 2], ["offset", "ot", 8], ["offsetCS", "ot", 0], ["vec", "ot", 2], ["wmma_m", "ot", 32]]}, "result": [[3.2557039555006186e-06], 0, 1.14096999168396, 1668060039.7305455], "version": 0.2, "tvm_version": "0.8.0"}
{"input": ["cuda -keys=cuda,gpu -max_num_threads=1024 -thread_warp_size=32", "batch_matmul_tensorcore.cuda", [["TENSOR", [32, 64, 64], "float16"], ["TENSOR", [32, 32, 64], "float16"]], {}], "config": {"index": 1809, "code_hash": null, "entity": [["block_row_warps", "ot", 1], ["block_col_warps", "ot", 1], ["warp_row_tiles", "ot", 1], ["warp_col_tiles", "ot", 2], ["chunk", "ot", 4], ["offset", "ot", 8], ["offsetCS", "ot", 0], ["vec", "ot", 2], ["wmma_m", "ot", 32]]}, "result": [[3.3481242274412856e-06], 0, 1.2928314208984375, 1668060040.2184024], "version": 0.2, "tvm_version": "0.8.0"}
{"input": ["cuda -keys=cuda,gpu -max_num_threads=1024 -thread_warp_size=32", "batch_matmul_tensorcore.cuda", [["TENSOR", [32, 64, 64], "float16"], ["TENSOR", [32, 32, 64], "float16"]], {}], "config": {"index": 8919, "code_hash": null, "entity": [["block_row_warps", "ot", 1], ["block_col_warps", "ot", 1], ["warp_row_tiles", "ot", 2], ["warp_col_tiles", "ot", 1], ["chunk", "ot", 4], ["offset", "ot", 8], ["offsetCS", "ot", 8], ["vec", "ot", 4], ["wmma_m", "ot", 16]]}, "result": [[3.183470333745365e-06], 0, 1.356743335723877, 1668060040.654829], "version": 0.2, "tvm_version": "0.8.0"}
{"input": ["cuda -keys=cuda,gpu -max_num_threads=1024 -thread_warp_size=32", "batch_matmul_tensorcore.cuda", [["TENSOR", [32, 64, 64], "float16"], ["TENSOR", [32, 32, 64], "float16"]], {}], "config": {"index": 1782, "code_hash": null, "entity": [["block_row_warps", "ot", 1], ["block_col_warps", "ot", 1], ["warp_row_tiles", "ot", 1], ["warp_col_tiles", "ot", 1], ["chunk", "ot", 4], ["offset", "ot", 8], ["offsetCS", "ot", 0], ["vec", "ot", 2], ["wmma_m", "ot", 32]]}, "result": [[3.44373238566131e-06], 0, 1.240105152130127, 1668060041.1360927], "version": 0.2, "tvm_version": "0.8.0"}
{"input": ["cuda -keys=cuda,gpu -max_num_threads=1024 -thread_warp_size=32", "batch_matmul_tensorcore.cuda", [["TENSOR", [32, 64, 64], "float16"], ["TENSOR", [32, 32, 64], "float16"]], {}], "config": {"index": 2349, "code_hash": null, "entity": [["block_row_warps", "ot", 1], ["block_col_warps", "ot", 1], ["warp_row_tiles", "ot", 1], ["warp_col_tiles", "ot", 1], ["chunk", "ot", 2], ["offset", "ot", 8], ["offsetCS", "ot", 8], ["vec", "ot", 2], ["wmma_m", "ot", 32]]}, "result": [[3.4859950556242274e-06], 0, 1.458087682723999, 1668060041.6698234], "version": 0.2, "tvm_version": "0.8.0"}
{"input": ["cuda -keys=cuda,gpu -max_num_threads=1024 -thread_warp_size=32", "batch_matmul_tensorcore.cuda", [["TENSOR", [32, 64, 64], "float16"], ["TENSOR", [32, 32, 64], "float16"]], {}], "config": {"index": 6894, "code_hash": null, "entity": [["block_row_warps", "ot", 1], ["block_col_warps", "ot", 1], ["warp_row_tiles", "ot", 2], ["warp_col_tiles", "ot", 1], ["chunk", "ot", 2], ["offset", "ot", 8], ["offsetCS", "ot", 0], ["vec", "ot", 2], ["wmma_m", "ot", 16]]}, "result": [[3.290428306551298e-06], 0, 1.3194811344146729, 1668060042.1088574], "version": 0.2, "tvm_version": "0.8.0"}
{"input": ["cuda -keys=cuda,gpu -max_num_threads=1024 -thread_warp_size=32", "batch_matmul_tensorcore.cuda", [["TENSOR", [32, 64, 64], "float16"], ["TENSOR", [32, 32, 64], "float16"]], {}], "config": {"index": 3672, "code_hash": null, "entity": [["block_row_warps", "ot", 1], ["block_col_warps", "ot", 1], ["warp_row_tiles", "ot", 1], ["warp_col_tiles", "ot", 2], ["chunk", "ot", 2], ["offset", "ot", 8], ["offsetCS", "ot", 8], ["vec", "ot", 4], ["wmma_m", "ot", 32]]}, "result": [[3.1956446229913473e-06], 0, 1.3274500370025635, 1668060042.552097], "version": 0.2, "tvm_version": "0.8.0"}
{"input": ["cuda -keys=cuda,gpu -max_num_threads=1024 -thread_warp_size=32", "batch_matmul_tensorcore.cuda", [["TENSOR", [32, 64, 64], "float16"], ["TENSOR", [32, 32, 64], "float16"]], {}], "config": {"index": 6975, "code_hash": null, "entity": [["block_row_warps", "ot", 1], ["block_col_warps", "ot", 1], ["warp_row_tiles", "ot", 2], ["warp_col_tiles", "ot", 1], ["chunk", "ot", 4], ["offset", "ot", 8], ["offsetCS", "ot", 0], ["vec", "ot", 2], ["wmma_m", "ot", 16]]}, "result": [[3.373561186650185e-06], 0, 1.0478291511535645, 1668060043.0356784], "version": 0.2, "tvm_version": "0.8.0"}
{"input": ["cuda -keys=cuda,gpu -max_num_threads=1024 -thread_warp_size=32", "batch_matmul_tensorcore.cuda", [["TENSOR", [32, 64, 64], "float16"], ["TENSOR", [32, 32, 64], "float16"]], {}], "config": {"index": 7569, "code_hash": null, "entity": [["block_row_warps", "ot", 1], ["block_col_warps", "ot", 1], ["warp_row_tiles", "ot", 2], ["warp_col_tiles", "ot", 2], ["chunk", "ot", 2], ["offset", "ot", 8], ["offsetCS", "ot", 8], ["vec", "ot", 2], ["wmma_m", "ot", 16]]}, "result": [[3.587553152039555e-06], 0, 1.2724273204803467, 1668060043.4772215], "version": 0.2, "tvm_version": "0.8.0"}
{"input": ["cuda -keys=cuda,gpu -max_num_threads=1024 -thread_warp_size=32", "batch_matmul_tensorcore.cuda", [["TENSOR", [32, 64, 64], "float16"], ["TENSOR", [32, 32, 64], "float16"]], {}], "config": {"index": 3726, "code_hash": null, "entity": [["block_row_warps", "ot", 1], ["block_col_warps", "ot", 1], ["warp_row_tiles", "ot", 1], ["warp_col_tiles", "ot", 1], ["chunk", "ot", 4], ["offset", "ot", 8], ["offsetCS", "ot", 8], ["vec", "ot", 4], ["wmma_m", "ot", 32]]}, "result": [[3.3935352286773795e-06], 0, 1.1260201930999756, 1668060043.9215515], "version": 0.2, "tvm_version": "0.8.0"}
{"input": ["cuda -keys=cuda,gpu -max_num_threads=1024 -thread_warp_size=32", "batch_matmul_tensorcore.cuda", [["TENSOR", [32, 64, 64], "float16"], ["TENSOR", [32, 32, 64], "float16"]], {}], "config": {"index": 2538, "code_hash": null, "entity": [["block_row_warps", "ot", 1], ["block_col_warps", "ot", 1], ["warp_row_tiles", "ot", 1], ["warp_col_tiles", "ot", 2], ["chunk", "ot", 8], ["offset", "ot", 8], ["offsetCS", "ot", 8], ["vec", "ot", 2], ["wmma_m", "ot", 32]]}, "result": [[3.1847367119901117e-06], 0, 1.0201339721679688, 1668060044.4052546], "version": 0.2, "tvm_version": "0.8.0"}
{"input": ["cuda -keys=cuda,gpu -max_num_threads=1024 -thread_warp_size=32", "batch_matmul_tensorcore.cuda", [["TENSOR", [32, 64, 64], "float16"], ["TENSOR", [32, 32, 64], "float16"]], {}], "config": {"index": 8838, "code_hash": null, "entity": [["block_row_warps", "ot", 1], ["block_col_warps", "ot", 1], ["warp_row_tiles", "ot", 2], ["warp_col_tiles", "ot", 1], ["chunk", "ot", 2], ["offset", "ot", 8], ["offsetCS", "ot", 8], ["vec", "ot", 4], ["wmma_m", "ot", 16]]}, "result": [[3.2623757725587145e-06], 0, 1.1940252780914307, 1668060044.848098], "version": 0.2, "tvm_version": "0.8.0"}
{"input": ["cuda -keys=cuda,gpu -max_num_threads=1024 -thread_warp_size=32", "batch_matmul_tensorcore.cuda", [["TENSOR", [32, 64, 64], "float16"], ["TENSOR", [32, 32, 64], "float16"]], {}], "config": {"index": 2511, "code_hash": null, "entity": [["block_row_warps", "ot", 1], ["block_col_warps", "ot", 1], ["warp_row_tiles", "ot", 1], ["warp_col_tiles", "ot", 1], ["chunk", "ot", 8], ["offset", "ot", 8], ["offsetCS", "ot", 8], ["vec", "ot", 2], ["wmma_m", "ot", 32]]}, "result": [[3.4703553770086525e-06], 0, 1.1974027156829834, 1668060045.2939413], "version": 0.2, "tvm_version": "0.8.0"}
{"input": ["cuda -keys=cuda,gpu -max_num_threads=1024 -thread_warp_size=32", "batch_matmul_tensorcore.cuda", [["TENSOR", [32, 64, 64], "float16"], ["TENSOR", [32, 32, 64], "float16"]], {}], "config": {"index": 3105, "code_hash": null, "entity": [["block_row_warps", "ot", 1], ["block_col_warps", "ot", 1], ["warp_row_tiles", "ot", 1], ["warp_col_tiles", "ot", 2], ["chunk", "ot", 4], ["offset", "ot", 8], ["offsetCS", "ot", 0], ["vec", "ot", 4], ["wmma_m", "ot", 32]]}, "result": [[3.1813498145859088e-06], 0, 1.0462818145751953, 1668060045.7770813], "version": 0.2, "tvm_version": "0.8.0"}
{"input": ["cuda -keys=cuda,gpu -max_num_threads=1024 -thread_warp_size=32", "batch_matmul_tensorcore.cuda", [["TENSOR", [32, 64, 64], "float16"], ["TENSOR", [32, 32, 64], "float16"]], {}], "config": {"index": 3834, "code_hash": null, "entity": [["block_row_warps", "ot", 1], ["block_col_warps", "ot", 1], ["warp_row_tiles", "ot", 1], ["warp_col_tiles", "ot", 2], ["chunk", "ot", 8], ["offset", "ot", 8], ["offsetCS", "ot", 8], ["vec", "ot", 4], ["wmma_m", "ot", 32]]}, "result": [[3.1401569839307786e-06], 0, 1.2225911617279053, 1668060046.2210448], "version": 0.2, "tvm_version": "0.8.0"}
{"input": ["cuda -keys=cuda,gpu -max_num_threads=1024 -thread_warp_size=32", "batch_matmul_tensorcore.cuda", [["TENSOR", [32, 64, 64], "float16"], ["TENSOR", [32, 32, 64], "float16"]], {}], "config": {"index": 3645, "code_hash": null, "entity": [["block_row_warps", "ot", 1], ["block_col_warps", "ot", 1], ["warp_row_tiles", "ot", 1], ["warp_col_tiles", "ot", 1], ["chunk", "ot", 2], ["offset", "ot", 8], ["offsetCS", "ot", 8], ["vec", "ot", 4], ["wmma_m", "ot", 32]]}, "result": [[3.616935105067985e-06], 0, 1.1962003707885742, 1668060046.7008543], "version": 0.2, "tvm_version": "0.8.0"}
{"input": ["cuda -keys=cuda,gpu -max_num_threads=1024 -thread_warp_size=32", "batch_matmul_tensorcore.cuda", [["TENSOR", [32, 64, 64], "float16"], ["TENSOR", [32, 32, 64], "float16"]], {}], "config": {"index": 2295, "code_hash": null, "entity": [["block_row_warps", "ot", 1], ["block_col_warps", "ot", 1], ["warp_row_tiles", "ot", 1], ["warp_col_tiles", "ot", 2], ["chunk", "ot", 1], ["offset", "ot", 8], ["offsetCS", "ot", 8], ["vec", "ot", 2], ["wmma_m", "ot", 32]]}, "result": [[3.441710754017305e-06], 0, 1.20133638381958, 1668060047.1832554], "version": 0.2, "tvm_version": "0.8.0"}
{"input": ["cuda -keys=cuda,gpu -max_num_threads=1024 -thread_warp_size=32", "batch_matmul_tensorcore.cuda", [["TENSOR", [32, 64, 64], "float16"], ["TENSOR", [32, 32, 64], "float16"]], {}], "config": {"index": 7704, "code_hash": null, "entity": [["block_row_warps", "ot", 1], ["block_col_warps", "ot", 1], ["warp_row_tiles", "ot", 2], ["warp_col_tiles", "ot", 1], ["chunk", "ot", 8], ["offset", "ot", 8], ["offsetCS", "ot", 8], ["vec", "ot", 2], ["wmma_m", "ot", 16]]}, "result": [[3.1808603213844253e-06], 0, 1.0116355419158936, 1668060047.625557], "version": 0.2, "tvm_version": "0.8.0"}
{"input": ["cuda -keys=cuda,gpu -max_num_threads=1024 -thread_warp_size=32", "batch_matmul_tensorcore.cuda", [["TENSOR", [32, 64, 64], "float16"], ["TENSOR", [32, 32, 64], "float16"]], {}], "config": {"index": 2352, "code_hash": null, "entity": [["block_row_warps", "ot", 1], ["block_col_warps", "ot", 2], ["warp_row_tiles", "ot", 1], ["warp_col_tiles", "ot", 1], ["chunk", "ot", 2], ["offset", "ot", 8], ["offsetCS", "ot", 8], ["vec", "ot", 2], ["wmma_m", "ot", 32]]}, "result": [[3.6566971569839308e-06], 0, 1.360001802444458, 1668060048.118314], "version": 0.2, "tvm_version": "0.8.0"}
{"input": ["cuda -keys=cuda,gpu -max_num_threads=1024 -thread_warp_size=32", "batch_matmul_tensorcore.cuda", [["TENSOR", [32, 64, 64], "float16"], ["TENSOR", [32, 32, 64], "float16"]], {}], "config": {"index": 2268, "code_hash": null, "entity": [["block_row_warps", "ot", 1], ["block_col_warps", "ot", 1], ["warp_row_tiles", "ot", 1], ["warp_col_tiles", "ot", 1], ["chunk", "ot", 1], ["offset", "ot", 8], ["offsetCS", "ot", 8], ["vec", "ot", 2], ["wmma_m", "ot", 32]]}, "result": [[3.6639647713226207e-06], 0, 1.035308599472046, 1668060048.6418338], "version": 0.2, "tvm_version": "0.8.0"}
{"input": ["cuda -keys=cuda,gpu -max_num_threads=1024 -thread_warp_size=32", "batch_matmul_tensorcore.cuda", [["TENSOR", [32, 64, 64], "float16"], ["TENSOR", [32, 32, 64], "float16"]], {}], "config": {"index": 8271, "code_hash": null, "entity": [["block_row_warps", "ot", 1], ["block_col_warps", "ot", 1], ["warp_row_tiles", "ot", 2], ["warp_col_tiles", "ot", 1], ["chunk", "ot", 4], ["offset", "ot", 8], ["offsetCS", "ot", 0], ["vec", "ot", 4], ["wmma_m", "ot", 16]]}, "result": [[3.331504944375772e-06], 0, 1.14268159866333, 1668060049.0820415], "version": 0.2, "tvm_version": "0.8.0"}
{"input": ["cuda -keys=cuda,gpu -max_num_threads=1024 -thread_warp_size=32", "batch_matmul_tensorcore.cuda", [["TENSOR", [32, 64, 64], "float16"], ["TENSOR", [32, 32, 64], "float16"]], {}], "config": {"index": 5103, "code_hash": null, "entity": [["block_row_warps", "ot", 1], ["block_col_warps", "ot", 1], ["warp_row_tiles", "ot", 1], ["warp_col_tiles", "ot", 1], ["chunk", "ot", 8], ["offset", "ot", 8], ["offsetCS", "ot", 8], ["vec", "ot", 8], ["wmma_m", "ot", 32]]}, "result": [[3.373690976514215e-06], 0, 1.3375842571258545, 1668060049.519295], "version": 0.2, "tvm_version": "0.8.0"}
{"input": ["cuda -keys=cuda,gpu -max_num_threads=1024 -thread_warp_size=32", "batch_matmul_tensorcore.cuda", [["TENSOR", [32, 64, 64], "float16"], ["TENSOR", [32, 32, 64], "float16"]], {}], "config": {"index": 1701, "code_hash": null, "entity": [["block_row_warps", "ot", 1], ["block_col_warps", "ot", 1], ["warp_row_tiles", "ot", 1], ["warp_col_tiles", "ot", 1], ["chunk", "ot", 2], ["offset", "ot", 8], ["offsetCS", "ot", 0], ["vec", "ot", 2], ["wmma_m", "ot", 32]]}, "result": [[3.5847793572311493e-06], 0, 1.310969352722168, 1668060050.045959], "version": 0.2, "tvm_version": "0.8.0"}
{"input": ["cuda -keys=cuda,gpu -max_num_threads=1024 -thread_warp_size=32", "batch_matmul_tensorcore.cuda", [["TENSOR", [32, 64, 64], "float16"], ["TENSOR", [32, 32, 64], "float16"]], {}], "config": {"index": 9000, "code_hash": null, "entity": [["block_row_warps", "ot", 1], ["block_col_warps", "ot", 1], ["warp_row_tiles", "ot", 2], ["warp_col_tiles", "ot", 1], ["chunk", "ot", 8], ["offset", "ot", 8], ["offsetCS", "ot", 8], ["vec", "ot", 4], ["wmma_m", "ot", 16]]}, "result": [[3.142598887515451e-06], 0, 1.1691339015960693, 1668060050.4839306], "version": 0.2, "tvm_version": "0.8.0"}
{"input": ["cuda -keys=cuda,gpu -max_num_threads=1024 -thread_warp_size=32", "batch_matmul_tensorcore.cuda", [["TENSOR", [32, 64, 64], "float16"], ["TENSOR", [32, 32, 64], "float16"]], {}], "config": {"index": 3024, "code_hash": null, "entity": [["block_row_warps", "ot", 1], ["block_col_warps", "ot", 1], ["warp_row_tiles", "ot", 1], ["warp_col_tiles", "ot", 2], ["chunk", "ot", 2], ["offset", "ot", 8], ["offsetCS", "ot", 0], ["vec", "ot", 4], ["wmma_m", "ot", 32]]}, "result": [[3.428e-06], 0, 1.2305009365081787, 1668060050.9232821], "version": 0.2, "tvm_version": "0.8.0"}
{"input": ["cuda -keys=cuda,gpu -max_num_threads=1024 -thread_warp_size=32", "batch_matmul_tensorcore.cuda", [["TENSOR", [32, 64, 64], "float16"], ["TENSOR", [32, 32, 64], "float16"]], {}], "config": {"index": 7461, "code_hash": null, "entity": [["block_row_warps", "ot", 1], ["block_col_warps", "ot", 1], ["warp_row_tiles", "ot", 2], ["warp_col_tiles", "ot", 1], ["chunk", "ot", 1], ["offset", "ot", 8], ["offsetCS", "ot", 8], ["vec", "ot", 2], ["wmma_m", "ot", 16]]}, "result": [[3.5422224969097646e-06], 0, 0.9696204662322998, 1668060051.4026995], "version": 0.2, "tvm_version": "0.8.0"}
{"input": ["cuda -keys=cuda,gpu -max_num_threads=1024 -thread_warp_size=32", "batch_matmul_tensorcore.cuda", [["TENSOR", [32, 64, 64], "float16"], ["TENSOR", [32, 32, 64], "float16"]], {}], "config": {"index": 6328, "code_hash": null, "entity": [["block_row_warps", "ot", 2], ["block_col_warps", "ot", 1], ["warp_row_tiles", "ot", 2], ["warp_col_tiles", "ot", 1], ["chunk", "ot", 4], ["offset", "ot", 8], ["offsetCS", "ot", 8], ["vec", "ot", 1], ["wmma_m", "ot", 16]]}, "result": [[3.80482694684796e-06], 0, 1.4026808738708496, 1668060051.8970768], "version": 0.2, "tvm_version": "0.8.0"}
{"input": ["cuda -keys=cuda,gpu -max_num_threads=1024 -thread_warp_size=32", "batch_matmul_tensorcore.cuda", [["TENSOR", [32, 64, 64], "float16"], ["TENSOR", [32, 32, 64], "float16"]], {}], "config": {"index": 5022, "code_hash": null, "entity": [["block_row_warps", "ot", 1], ["block_col_warps", "ot", 1], ["warp_row_tiles", "ot", 1], ["warp_col_tiles", "ot", 1], ["chunk", "ot", 4], ["offset", "ot", 8], ["offsetCS", "ot", 8], ["vec", "ot", 8], ["wmma_m", "ot", 32]]}, "result": [[3.520415327564895e-06], 0, 1.2172436714172363, 1668060052.3801053], "version": 0.2, "tvm_version": "0.8.0"}
{"input": ["cuda -keys=cuda,gpu -max_num_threads=1024 -thread_warp_size=32", "batch_matmul_tensorcore.cuda", [["TENSOR", [32, 64, 64], "float16"], ["TENSOR", [32, 32, 64], "float16"]], {}], "config": {"index": 8865, "code_hash": null, "entity": [["block_row_warps", "ot", 1], ["block_col_warps", "ot", 1], ["warp_row_tiles", "ot", 2], ["warp_col_tiles", "ot", 2], ["chunk", "ot", 2], ["offset", "ot", 8], ["offsetCS", "ot", 8], ["vec", "ot", 4], ["wmma_m", "ot", 16]]}, "result": [[3.7203454882571076e-06], 0, 1.0003347396850586, 1668060052.8638074], "version": 0.2, "tvm_version": "0.8.0"}
{"input": ["cuda -keys=cuda,gpu -max_num_threads=1024 -thread_warp_size=32", "batch_matmul_tensorcore.cuda", [["TENSOR", [32, 64, 64], "float16"], ["TENSOR", [32, 32, 64], "float16"]], {}], "config": {"index": 6921, "code_hash": null, "entity": [["block_row_warps", "ot", 1], ["block_col_warps", "ot", 1], ["warp_row_tiles", "ot", 2], ["warp_col_tiles", "ot", 2], ["chunk", "ot", 2], ["offset", "ot", 8], ["offsetCS", "ot", 0], ["vec", "ot", 2], ["wmma_m", "ot", 16]]}, "result": [[3.6780927070457354e-06], 0, 0.9811403751373291, 1668060053.3107963], "version": 0.2, "tvm_version": "0.8.0"}
{"input": ["cuda -keys=cuda,gpu -max_num_threads=1024 -thread_warp_size=32", "batch_matmul_tensorcore.cuda", [["TENSOR", [32, 64, 64], "float16"], ["TENSOR", [32, 32, 64], "float16"]], {}], "config": {"index": 7533, "code_hash": null, "entity": [["block_row_warps", "ot", 1], ["block_col_warps", "ot", 1], ["warp_row_tiles", "ot", 1], ["warp_col_tiles", "ot", 1], ["chunk", "ot", 2], ["offset", "ot", 8], ["offsetCS", "ot", 8], ["vec", "ot", 2], ["wmma_m", "ot", 16]]}, "result": [[3.2612725587144623e-06], 0, 1.2525639533996582, 1668060053.7917047], "version": 0.2, "tvm_version": "0.8.0"}
{"input": ["cuda -keys=cuda,gpu -max_num_threads=1024 -thread_warp_size=32", "batch_matmul_tensorcore.cuda", [["TENSOR", [32, 64, 64], "float16"], ["TENSOR", [32, 32, 64], "float16"]], {}], "config": {"index": 3078, "code_hash": null, "entity": [["block_row_warps", "ot", 1], ["block_col_warps", "ot", 1], ["warp_row_tiles", "ot", 1], ["warp_col_tiles", "ot", 1], ["chunk", "ot", 4], ["offset", "ot", 8], ["offsetCS", "ot", 0], ["vec", "ot", 4], ["wmma_m", "ot", 32]]}, "result": [[3.335242892459827e-06], 0, 1.2345280647277832, 1668060054.2718124], "version": 0.2, "tvm_version": "0.8.0"}
{"input": ["cuda -keys=cuda,gpu -max_num_threads=1024 -thread_warp_size=32", "batch_matmul_tensorcore.cuda", [["TENSOR", [32, 64, 64], "float16"], ["TENSOR", [32, 32, 64], "float16"]], {}], "config": {"index": 7650, "code_hash": null, "entity": [["block_row_warps", "ot", 1], ["block_col_warps", "ot", 1], ["warp_row_tiles", "ot", 2], ["warp_col_tiles", "ot", 2], ["chunk", "ot", 4], ["offset", "ot", 8], ["offsetCS", "ot", 8], ["vec", "ot", 2], ["wmma_m", "ot", 16]]}, "result": [[3.3519184177997527e-06], 0, 1.27738356590271, 1668060054.7145276], "version": 0.2, "tvm_version": "0.8.0"}
{"input": ["cuda -keys=cuda,gpu -max_num_threads=1024 -thread_warp_size=32", "batch_matmul_tensorcore.cuda", [["TENSOR", [32, 64, 64], "float16"], ["TENSOR", [32, 32, 64], "float16"]], {}], "config": {"index": 1890, "code_hash": null, "entity": [["block_row_warps", "ot", 1], ["block_col_warps", "ot", 1], ["warp_row_tiles", "ot", 1], ["warp_col_tiles", "ot", 2], ["chunk", "ot", 8], ["offset", "ot", 8], ["offsetCS", "ot", 0], ["vec", "ot", 2], ["wmma_m", "ot", 32]]}, "result": [[3.107775030902349e-06], 0, 1.178074836730957, 1668060055.1555967], "version": 0.2, "tvm_version": "0.8.0"}
{"input": ["cuda -keys=cuda,gpu -max_num_threads=1024 -thread_warp_size=32", "batch_matmul_tensorcore.cuda", [["TENSOR", [32, 64, 64], "float16"], ["TENSOR", [32, 32, 64], "float16"]], {}], "config": {"index": 3807, "code_hash": null, "entity": [["block_row_warps", "ot", 1], ["block_col_warps", "ot", 1], ["warp_row_tiles", "ot", 1], ["warp_col_tiles", "ot", 1], ["chunk", "ot", 8], ["offset", "ot", 8], ["offsetCS", "ot", 8], ["vec", "ot", 4], ["wmma_m", "ot", 32]]}, "result": [[3.3317466007416564e-06], 0, 0.9097204208374023, 1668060056.4111218], "version": 0.2, "tvm_version": "0.8.0"}
{"input": ["cuda -keys=cuda,gpu -max_num_threads=1024 -thread_warp_size=32", "batch_matmul_tensorcore.cuda", [["TENSOR", [32, 64, 64], "float16"], ["TENSOR", [32, 32, 64], "float16"]], {}], "config": {"index": 7614, "code_hash": null, "entity": [["block_row_warps", "ot", 1], ["block_col_warps", "ot", 1], ["warp_row_tiles", "ot", 1], ["warp_col_tiles", "ot", 1], ["chunk", "ot", 4], ["offset", "ot", 8], ["offsetCS", "ot", 8], ["vec", "ot", 2], ["wmma_m", "ot", 16]]}, "result": [[3.442463535228677e-06], 0, 0.9146010875701904, 1668060056.8507388], "version": 0.2, "tvm_version": "0.8.0"}
{"input": ["cuda -keys=cuda,gpu -max_num_threads=1024 -thread_warp_size=32", "batch_matmul_tensorcore.cuda", [["TENSOR", [32, 64, 64], "float16"], ["TENSOR", [32, 32, 64], "float16"]], {}], "config": {"index": 1863, "code_hash": null, "entity": [["block_row_warps", "ot", 1], ["block_col_warps", "ot", 1], ["warp_row_tiles", "ot", 1], ["warp_col_tiles", "ot", 1], ["chunk", "ot", 8], ["offset", "ot", 8], ["offsetCS", "ot", 0], ["vec", "ot", 2], ["wmma_m", "ot", 32]]}, "result": [[3.3939147095179235e-06], 0, 1.0888855457305908, 1668060057.289696], "version": 0.2, "tvm_version": "0.8.0"}
{"input": ["cuda -keys=cuda,gpu -max_num_threads=1024 -thread_warp_size=32", "batch_matmul_tensorcore.cuda", [["TENSOR", [32, 64, 64], "float16"], ["TENSOR", [32, 32, 64], "float16"]], {}], "config": {"index": 3591, "code_hash": null, "entity": [["block_row_warps", "ot", 1], ["block_col_warps", "ot", 1], ["warp_row_tiles", "ot", 1], ["warp_col_tiles", "ot", 2], ["chunk", "ot", 1], ["offset", "ot", 8], ["offsetCS", "ot", 8], ["vec", "ot", 4], ["wmma_m", "ot", 32]]}, "result": [[3.38966934487021e-06], 0, 1.1705925464630127, 1668060057.8202648], "version": 0.2, "tvm_version": "0.8.0"}
{"input": ["cuda -keys=cuda,gpu -max_num_threads=1024 -thread_warp_size=32", "batch_matmul_tensorcore.cuda", [["TENSOR", [32, 64, 64], "float16"], ["TENSOR", [32, 32, 64], "float16"]], {}], "config": {"index": 3186, "code_hash": null, "entity": [["block_row_warps", "ot", 1], ["block_col_warps", "ot", 1], ["warp_row_tiles", "ot", 1], ["warp_col_tiles", "ot", 2], ["chunk", "ot", 8], ["offset", "ot", 8], ["offsetCS", "ot", 0], ["vec", "ot", 4], ["wmma_m", "ot", 32]]}, "result": [[3.1364857849196542e-06], 0, 0.8839905261993408, 1668060058.2602563], "version": 0.2, "tvm_version": "0.8.0"}
{"input": ["cuda -keys=cuda,gpu -max_num_threads=1024 -thread_warp_size=32", "batch_matmul_tensorcore.cuda", [["TENSOR", [32, 64, 64], "float16"], ["TENSOR", [32, 32, 64], "float16"]], {}], "config": {"index": 12735, "code_hash": null, "entity": [["block_row_warps", "ot", 1], ["block_col_warps", "ot", 1], ["warp_row_tiles", "ot", 4], ["warp_col_tiles", "ot", 1], ["chunk", "ot", 2], ["offset", "ot", 8], ["offsetCS", "ot", 8], ["vec", "ot", 2], ["wmma_m", "ot", 8]]}, "result": [[3.668915327564895e-06], 0, 1.0814476013183594, 1668060058.7009206], "version": 0.2, "tvm_version": "0.8.0"}
{"input": ["cuda -keys=cuda,gpu -max_num_threads=1024 -thread_warp_size=32", "batch_matmul_tensorcore.cuda", [["TENSOR", [32, 64, 64], "float16"], ["TENSOR", [32, 32, 64], "float16"]], {}], "config": {"index": 2997, "code_hash": null, "entity": [["block_row_warps", "ot", 1], ["block_col_warps", "ot", 1], ["warp_row_tiles", "ot", 1], ["warp_col_tiles", "ot", 1], ["chunk", "ot", 2], ["offset", "ot", 8], ["offsetCS", "ot", 0], ["vec", "ot", 4], ["wmma_m", "ot", 32]]}, "result": [[3.4333967861557478e-06], 0, 1.1433885097503662, 1668060059.2256312], "version": 0.2, "tvm_version": "0.8.0"}
