python/models/swin_transformer/kernel_configs/swin_transformer_relu_1_56_56_256.log
{"i": [["[\"relu\", 1, 56, 56, 256]", "cuda -keys=cuda,gpu -max_num_threads=1024 -model=unknown -thread_warp_size=32", [-1, 16, 64, 49152, 2147483647, 1024, 8, 32], "", 0, []], [[], [["FU", 1, [0, 1, 2, 3]], ["SP", 1, 0, 802816, [1], 1], ["AN", 1, 0, 5], ["AN", 1, 1, 6]]]], "r": [[0.000598106, 0.000598035, 0.000598157], 0, 0.533112, 1668018751], "v": "v0.6"}
{"i": [["[\"relu\", 1, 56, 56, 256]", "cuda -keys=cuda,gpu -max_num_threads=1024 -model=unknown -thread_warp_size=32", [-1, 16, 64, 49152, 2147483647, 1024, 8, 32], "", 0, []], [[], [["FU", 1, [0, 1, 2, 3]], ["SP", 1, 0, 802816, [2], 1], ["AN", 1, 0, 5], ["AN", 1, 1, 6]]]], "r": [[0.000300404, 0.000300502, 0.000300437], 0, 2.28775, 1668018753], "v": "v0.6"}
{"i": [["[\"relu\", 1, 56, 56, 256]", "cuda -keys=cuda,gpu -max_num_threads=1024 -model=unknown -thread_warp_size=32", [-1, 16, 64, 49152, 2147483647, 1024, 8, 32], "", 0, []], [[], [["FU", 1, [0, 1, 2, 3]], ["SP", 1, 0, 802816, [16], 1], ["AN", 1, 0, 5], ["AN", 1, 1, 6]]]], "r": [[3.99103e-05, 3.99226e-05, 3.99289e-05], 0, 1.581, 1668018752], "v": "v0.6"}
{"i": [["[\"relu\", 1, 56, 56, 256]", "cuda -keys=cuda,gpu -max_num_threads=1024 -model=unknown -thread_warp_size=32", [-1, 16, 64, 49152, 2147483647, 1024, 8, 32], "", 0, []], [[], [["FU", 1, [0, 1, 2, 3]], ["SP", 1, 0, 802816, [28], 1], ["AN", 1, 0, 5], ["AN", 1, 1, 6]]]], "r": [[2.39795e-05, 2.39835e-05, 2.39837e-05], 0, 1.24028, 1668018752], "v": "v0.6"}
{"i": [["[\"relu\", 1, 56, 56, 256]", "cuda -keys=cuda,gpu -max_num_threads=1024 -model=unknown -thread_warp_size=32", [-1, 16, 64, 49152, 2147483647, 1024, 8, 32], "", 0, []], [[], [["FU", 1, [0, 1, 2, 3]], ["SP", 1, 0, 802816, [4], 1], ["AN", 1, 0, 5], ["AN", 1, 1, 6]]]], "r": [[0.000151568, 0.000151604, 0.0001516], 0, 0.855695, 1668018752], "v": "v0.6"}
{"i": [["[\"relu\", 1, 56, 56, 256]", "cuda -keys=cuda,gpu -max_num_threads=1024 -model=unknown -thread_warp_size=32", [-1, 16, 64, 49152, 2147483647, 1024, 8, 32], "", 0, []], [[], [["FU", 1, [0, 1, 2, 3]], ["SP", 1, 0, 802816, [56], 1], ["AN", 1, 0, 5], ["AN", 1, 1, 6]]]], "r": [[1.31334e-05, 1.31457e-05, 1.3132e-05], 0, 1.92327, 1668018753], "v": "v0.6"}
{"i": [["[\"relu\", 1, 56, 56, 256]", "cuda -keys=cuda,gpu -max_num_threads=1024 -model=unknown -thread_warp_size=32", [-1, 16, 64, 49152, 2147483647, 1024, 8, 32], "", 0, []], [[], [["FU", 1, [0, 1, 2, 3]], ["SP", 1, 0, 802816, [14], 1], ["AN", 1, 0, 5], ["AN", 1, 1, 6]]]], "r": [[4.51632e-05, 4.5169e-05, 4.51667e-05], 0, 2.6179, 1668018753], "v": "v0.6"}
{"i": [["[\"relu\", 1, 56, 56, 256]", "cuda -keys=cuda,gpu -max_num_threads=1024 -model=unknown -thread_warp_size=32", [-1, 16, 64, 49152, 2147483647, 1024, 8, 32], "", 0, []], [[], [["FU", 1, [0, 1, 2, 3]], ["SP", 1, 0, 802816, [7], 1], ["AN", 1, 0, 5], ["AN", 1, 1, 6]]]], "r": [[8.76685e-05, 8.76502e-05, 8.76412e-05], 0, 2.96436, 1668018754], "v": "v0.6"}
{"i": [["[\"relu\", 1, 56, 56, 256]", "cuda -keys=cuda,gpu -max_num_threads=1024 -model=unknown -thread_warp_size=32", [-1, 16, 64, 49152, 2147483647, 1024, 8, 32], "", 0, []], [[], [["FU", 1, [0, 1, 2, 3]], ["SP", 1, 0, 802816, [64], 1], ["AN", 1, 0, 5], ["AN", 1, 1, 6]]]], "r": [[1.18067e-05, 1.18256e-05, 1.18211e-05], 0, 3.65934, 1668018755], "v": "v0.6"}
{"i": [["[\"relu\", 1, 56, 56, 256]", "cuda -keys=cuda,gpu -max_num_threads=1024 -model=unknown -thread_warp_size=32", [-1, 16, 64, 49152, 2147483647, 1024, 8, 32], "", 0, []], [[], [["FU", 1, [0, 1, 2, 3]], ["SP", 1, 0, 802816, [32], 1], ["AN", 1, 0, 5], ["AN", 1, 1, 6]]]], "r": [[2.14987e-05, 2.15033e-05, 2.14995e-05], 0, 3.324, 1668018754], "v": "v0.6"}
{"i": [["[\"relu\", 1, 56, 56, 256]", "cuda -keys=cuda,gpu -max_num_threads=1024 -model=unknown -thread_warp_size=32", [-1, 16, 64, 49152, 2147483647, 1024, 8, 32], "", 0, []], [[], [["FU", 1, [0, 1, 2, 3]], ["SP", 1, 0, 802816, [49], 1], ["AN", 1, 0, 5], ["AN", 1, 1, 6]]]], "r": [[1.46748e-05, 1.46892e-05, 1.46837e-05], 0, 4.00274, 1668018755], "v": "v0.6"}
{"i": [["[\"relu\", 1, 56, 56, 256]", "cuda -keys=cuda,gpu -max_num_threads=1024 -model=unknown -thread_warp_size=32", [-1, 16, 64, 49152, 2147483647, 1024, 8, 32], "", 0, []], [[], [["FU", 1, [0, 1, 2, 3]], ["SP", 1, 0, 802816, [8], 1], ["AN", 1, 0, 5], ["AN", 1, 1, 6]]]], "r": [[7.70368e-05, 7.70772e-05, 7.70499e-05], 0, 4.39091, 1668018755], "v": "v0.6"}
{"i": [["[\"relu\", 1, 56, 56, 256]", "cuda -keys=cuda,gpu -max_num_threads=1024 -model=unknown -thread_warp_size=32", [-1, 16, 64, 49152, 2147483647, 1024, 8, 32], "", 0, []], [[], [["FU", 1, [0, 1, 2, 3]], ["SP", 1, 0, 802816, [49], 1], ["AN", 1, 0, 5], ["AN", 1, 1, 6]]]], "r": [[1.46498e-05, 1.46579e-05, 1.46518e-05], 0, 1.92404, 1668018997], "v": "v0.6"}
{"i": [["[\"relu\", 1, 56, 56, 256]", "cuda -keys=cuda,gpu -max_num_threads=1024 -model=unknown -thread_warp_size=32", [-1, 16, 64, 49152, 2147483647, 1024, 8, 32], "", 0, []], [[], [["FU", 1, [0, 1, 2, 3]], ["SP", 1, 0, 802816, [4], 1], ["AN", 1, 0, 5], ["AN", 1, 1, 6]]]], "r": [[0.000151665, 0.000151646, 0.000151699], 0, 0.857929, 1668018996], "v": "v0.6"}
{"i": [["[\"relu\", 1, 56, 56, 256]", "cuda -keys=cuda,gpu -max_num_threads=1024 -model=unknown -thread_warp_size=32", [-1, 16, 64, 49152, 2147483647, 1024, 8, 32], "", 0, []], [[], [["FU", 1, [0, 1, 2, 3]], ["SP", 1, 0, 802816, [8], 1], ["AN", 1, 0, 5], ["AN", 1, 1, 6]]]], "r": [[7.70681e-05, 7.70958e-05, 7.70897e-05], 0, 1.58294, 1668018997], "v": "v0.6"}
{"i": [["[\"relu\", 1, 56, 56, 256]", "cuda -keys=cuda,gpu -max_num_threads=1024 -model=unknown -thread_warp_size=32", [-1, 16, 64, 49152, 2147483647, 1024, 8, 32], "", 0, []], [[], [["FU", 1, [0, 1, 2, 3]], ["SP", 1, 0, 802816, [16], 1], ["AN", 1, 0, 5], ["AN", 1, 1, 6]]]], "r": [[3.98765e-05, 3.98793e-05, 3.98757e-05], 0, 0.550807, 1668018996], "v": "v0.6"}
{"i": [["[\"relu\", 1, 56, 56, 256]", "cuda -keys=cuda,gpu -max_num_threads=1024 -model=unknown -thread_warp_size=32", [-1, 16, 64, 49152, 2147483647, 1024, 8, 32], "", 0, []], [[], [["FU", 1, [0, 1, 2, 3]], ["SP", 1, 0, 802816, [14], 1], ["AN", 1, 0, 5], ["AN", 1, 1, 6]]]], "r": [[4.51623e-05, 4.51682e-05, 4.5179e-05], 0, 1.23951, 1668018997], "v": "v0.6"}
{"i": [["[\"relu\", 1, 56, 56, 256]", "cuda -keys=cuda,gpu -max_num_threads=1024 -model=unknown -thread_warp_size=32", [-1, 16, 64, 49152, 2147483647, 1024, 8, 32], "", 0, []], [[], [["FU", 1, [0, 1, 2, 3]], ["SP", 1, 0, 802816, [7], 1], ["AN", 1, 0, 5], ["AN", 1, 1, 6]]]], "r": [[8.76887e-05, 8.77071e-05, 8.77005e-05], 0, 2.30141, 1668018998], "v": "v0.6"}
{"i": [["[\"relu\", 1, 56, 56, 256]", "cuda -keys=cuda,gpu -max_num_threads=1024 -model=unknown -thread_warp_size=32", [-1, 16, 64, 49152, 2147483647, 1024, 8, 32], "", 0, []], [[], [["FU", 1, [0, 1, 2, 3]], ["SP", 1, 0, 802816, [28], 1], ["AN", 1, 0, 5], ["AN", 1, 1, 6]]]], "r": [[2.39432e-05, 2.39524e-05, 2.39517e-05], 0, 2.64159, 1668018998], "v": "v0.6"}
{"i": [["[\"relu\", 1, 56, 56, 256]", "cuda -keys=cuda,gpu -max_num_threads=1024 -model=unknown -thread_warp_size=32", [-1, 16, 64, 49152, 2147483647, 1024, 8, 32], "", 0, []], [[], [["FU", 1, [0, 1, 2, 3]], ["SP", 1, 0, 802816, [56], 1], ["AN", 1, 0, 5], ["AN", 1, 1, 6]]]], "r": [[1.32274e-05, 1.32455e-05, 1.32353e-05], 0, 3.70493, 1668018999], "v": "v0.6"}
{"i": [["[\"relu\", 1, 56, 56, 256]", "cuda -keys=cuda,gpu -max_num_threads=1024 -model=unknown -thread_warp_size=32", [-1, 16, 64, 49152, 2147483647, 1024, 8, 32], "", 0, []], [[], [["FU", 1, [0, 1, 2, 3]], ["SP", 1, 0, 802816, [2], 1], ["AN", 1, 0, 5], ["AN", 1, 1, 6]]]], "r": [[0.000300445, 0.000300419, 0.00030045], 0, 3.36681, 1668018999], "v": "v0.6"}
{"i": [["[\"relu\", 1, 56, 56, 256]", "cuda -keys=cuda,gpu -max_num_threads=1024 -model=unknown -thread_warp_size=32", [-1, 16, 64, 49152, 2147483647, 1024, 8, 32], "", 0, []], [[], [["FU", 1, [0, 1, 2, 3]], ["SP", 1, 0, 802816, [64], 1], ["AN", 1, 0, 5], ["AN", 1, 1, 6]]]], "r": [[1.1881e-05, 1.1884e-05, 1.18839e-05], 0, 4.38697, 1668019000], "v": "v0.6"}
{"i": [["[\"relu\", 1, 56, 56, 256]", "cuda -keys=cuda,gpu -max_num_threads=1024 -model=unknown -thread_warp_size=32", [-1, 16, 64, 49152, 2147483647, 1024, 8, 32], "", 0, []], [[], [["FU", 1, [0, 1, 2, 3]], ["SP", 1, 0, 802816, [32], 1], ["AN", 1, 0, 5], ["AN", 1, 1, 6]]]], "r": [[2.13399e-05, 2.13406e-05, 2.13522e-05], 0, 2.98575, 1668018998], "v": "v0.6"}
{"i": [["[\"relu\", 1, 56, 56, 256]", "cuda -keys=cuda,gpu -max_num_threads=1024 -model=unknown -thread_warp_size=32", [-1, 16, 64, 49152, 2147483647, 1024, 8, 32], "", 0, []], [[], [["FU", 1, [0, 1, 2, 3]], ["SP", 1, 0, 802816, [1], 1], ["AN", 1, 0, 5], ["AN", 1, 1, 6]]]], "r": [[0.000598223, 0.000598239, 0.000598314], 0, 4.00669, 1668018999], "v": "v0.6"}
