python/models/swin_transformer/kernel_configs/swin_transformer_window_partition_1_56_56_512_7_float16.log
{"i": [["[\"window_partition\", 1, 56, 56, 512, 7, \"float16\"]", "cuda -keys=cuda,gpu -max_num_threads=1024 -model=unknown -thread_warp_size=32", [-1, 16, 64, 49152, 2147483647, 1024, 8, 32], "", 0, []], [[], [["FU", 1, [0, 1, 2, 3]], ["SP", 1, 0, 1605632, [32], 1], ["AN", 1, 0, 5], ["AN", 1, 1, 6]]]], "r": [[4.0022e-05, 4.00208e-05, 4.00367e-05], 0, 2.0256, 1668019073], "v": "v0.6"}
{"i": [["[\"window_partition\", 1, 56, 56, 512, 7, \"float16\"]", "cuda -keys=cuda,gpu -max_num_threads=1024 -model=unknown -thread_warp_size=32", [-1, 16, 64, 49152, 2147483647, 1024, 8, 32], "", 0, []], [[], [["FU", 1, [0, 1, 2, 3]], ["SP", 1, 0, 1605632, [28], 1], ["AN", 1, 0, 5], ["AN", 1, 1, 6]]]], "r": [[4.5279e-05, 4.52818e-05, 4.52825e-05], 0, 1.17219, 1668019072], "v": "v0.6"}
{"i": [["[\"window_partition\", 1, 56, 56, 512, 7, \"float16\"]", "cuda -keys=cuda,gpu -max_num_threads=1024 -model=unknown -thread_warp_size=32", [-1, 16, 64, 49152, 2147483647, 1024, 8, 32], "", 0, []], [[], [["FU", 1, [0, 1, 2, 3]], ["SP", 1, 0, 1605632, [8], 1], ["AN", 1, 0, 5], ["AN", 1, 1, 6]]]], "r": [[0.000151701, 0.000151677, 0.000151689], 0, 2.49607, 1668019073], "v": "v0.6"}
{"i": [["[\"window_partition\", 1, 56, 56, 512, 7, \"float16\"]", "cuda -keys=cuda,gpu -max_num_threads=1024 -model=unknown -thread_warp_size=32", [-1, 16, 64, 49152, 2147483647, 1024, 8, 32], "", 0, []], [[], [["FU", 1, [0, 1, 2, 3]], ["SP", 1, 0, 1605632, [56], 1], ["AN", 1, 0, 5], ["AN", 1, 1, 6]]]], "r": [[2.37634e-05, 2.37865e-05, 2.37681e-05], 0, 0.683118, 1668019071], "v": "v0.6"}
{"i": [["[\"window_partition\", 1, 56, 56, 512, 7, \"float16\"]", "cuda -keys=cuda,gpu -max_num_threads=1024 -model=unknown -thread_warp_size=32", [-1, 16, 64, 49152, 2147483647, 1024, 8, 32], "", 0, []], [[], [["FU", 1, [0, 1, 2, 3]], ["SP", 1, 0, 1605632, [64], 1], ["AN", 1, 0, 5], ["AN", 1, 1, 6]]]], "r": [[2.11409e-05, 2.11462e-05, 2.11562e-05], 0, 1.58523, 1668019072], "v": "v0.6"}
{"i": [["[\"window_partition\", 1, 56, 56, 512, 7, \"float16\"]", "cuda -keys=cuda,gpu -max_num_threads=1024 -model=unknown -thread_warp_size=32", [-1, 16, 64, 49152, 2147483647, 1024, 8, 32], "", 0, []], [[], [["FU", 1, [0, 1, 2, 3]], ["SP", 1, 0, 1605632, [16], 1], ["AN", 1, 0, 5], ["AN", 1, 1, 6]]]], "r": [[7.72702e-05, 7.72862e-05, 7.72977e-05], 0, 2.91101, 1668019074], "v": "v0.6"}
{"i": [["[\"window_partition\", 1, 56, 56, 512, 7, \"float16\"]", "cuda -keys=cuda,gpu -max_num_threads=1024 -model=unknown -thread_warp_size=32", [-1, 16, 64, 49152, 2147483647, 1024, 8, 32], "", 0, []], [[], [["FU", 1, [0, 1, 2, 3]], ["SP", 1, 0, 1605632, [4], 1], ["AN", 1, 0, 5], ["AN", 1, 1, 6]]]], "r": [[0.000300486, 0.000300491, 0.000300497], 0, 4.24889, 1668019075], "v": "v0.6"}
{"i": [["[\"window_partition\", 1, 56, 56, 512, 7, \"float16\"]", "cuda -keys=cuda,gpu -max_num_threads=1024 -model=unknown -thread_warp_size=32", [-1, 16, 64, 49152, 2147483647, 1024, 8, 32], "", 0, []], [[], [["FU", 1, [0, 1, 2, 3]], ["SP", 1, 0, 1605632, [2], 1], ["AN", 1, 0, 5], ["AN", 1, 1, 6]]]], "r": [[0.000598234, 0.000598232, 0.000598351], 0, 4.67573, 1668019076], "v": "v0.6"}
{"i": [["[\"window_partition\", 1, 56, 56, 512, 7, \"float16\"]", "cuda -keys=cuda,gpu -max_num_threads=1024 -model=unknown -thread_warp_size=32", [-1, 16, 64, 49152, 2147483647, 1024, 8, 32], "", 0, []], [[], [["FU", 1, [0, 1, 2, 3]], ["SP", 1, 0, 1605632, [14], 1], ["AN", 1, 0, 5], ["AN", 1, 1, 6]]]], "r": [[8.78373e-05, 8.78502e-05, 8.78314e-05], 0, 3.35131, 1668019074], "v": "v0.6"}
{"i": [["[\"window_partition\", 1, 56, 56, 512, 7, \"float16\"]", "cuda -keys=cuda,gpu -max_num_threads=1024 -model=unknown -thread_warp_size=32", [-1, 16, 64, 49152, 2147483647, 1024, 8, 32], "", 0, []], [[], [["FU", 1, [0, 1, 2, 3]], ["SP", 1, 0, 1605632, [7], 1], ["AN", 1, 0, 5], ["AN", 1, 1, 6]]]], "r": [[0.000172954, 0.000172976, 0.000172997], 0, 5.13231, 1668019076], "v": "v0.6"}
{"i": [["[\"window_partition\", 1, 56, 56, 512, 7, \"float16\"]", "cuda -keys=cuda,gpu -max_num_threads=1024 -model=unknown -thread_warp_size=32", [-1, 16, 64, 49152, 2147483647, 1024, 8, 32], "", 0, []], [[], [["FU", 1, [0, 1, 2, 3]], ["SP", 1, 0, 1605632, [1], 1], ["AN", 1, 0, 5], ["AN", 1, 1, 6]]]], "r": [[0.00119326, 0.00119331, 0.00119347], 0, 5.55347, 1668019076], "v": "v0.6"}
{"i": [["[\"window_partition\", 1, 56, 56, 512, 7, \"float16\"]", "cuda -keys=cuda,gpu -max_num_threads=1024 -model=unknown -thread_warp_size=32", [-1, 16, 64, 49152, 2147483647, 1024, 8, 32], "", 0, []], [[], [["FU", 1, [0, 1, 2, 3]], ["SP", 1, 0, 1605632, [49], 1], ["AN", 1, 0, 5], ["AN", 1, 1, 6]]]], "r": [[2.67824e-05, 2.67789e-05, 2.67957e-05], 0, 3.83159, 1668019075], "v": "v0.6"}
{"i": [["[\"window_partition\", 1, 56, 56, 512, 7, \"float16\"]", "cuda -keys=cuda,gpu -max_num_threads=1024 -model=unknown -thread_warp_size=32", [-1, 16, 64, 49152, 2147483647, 1024, 8, 32], "", 0, []], [[], [["FU", 1, [0, 1, 2, 3]], ["SP", 1, 0, 1605632, [32], 1], ["AN", 1, 0, 5], ["AN", 1, 1, 6]]]], "r": [[3.99598e-05, 3.99712e-05, 3.99703e-05], 0, 1.11363, 1668019622], "v": "v0.6"}
{"i": [["[\"window_partition\", 1, 56, 56, 512, 7, \"float16\"]", "cuda -keys=cuda,gpu -max_num_threads=1024 -model=unknown -thread_warp_size=32", [-1, 16, 64, 49152, 2147483647, 1024, 8, 32], "", 0, []], [[], [["FU", 1, [0, 1, 2, 3]], ["SP", 1, 0, 1605632, [16], 1], ["AN", 1, 0, 5], ["AN", 1, 1, 6]]]], "r": [[7.73543e-05, 7.73563e-05, 7.73527e-05], 0, 1.50498, 1668019622], "v": "v0.6"}
{"i": [["[\"window_partition\", 1, 56, 56, 512, 7, \"float16\"]", "cuda -keys=cuda,gpu -max_num_threads=1024 -model=unknown -thread_warp_size=32", [-1, 16, 64, 49152, 2147483647, 1024, 8, 32], "", 0, []], [[], [["FU", 1, [0, 1, 2, 3]], ["SP", 1, 0, 1605632, [1], 1], ["AN", 1, 0, 5], ["AN", 1, 1, 6]]]], "r": [[0.00119345, 0.00119341, 0.0011933], 0, 2.75179, 1668019623], "v": "v0.6"}
{"i": [["[\"window_partition\", 1, 56, 56, 512, 7, \"float16\"]", "cuda -keys=cuda,gpu -max_num_threads=1024 -model=unknown -thread_warp_size=32", [-1, 16, 64, 49152, 2147483647, 1024, 8, 32], "", 0, []], [[], [["FU", 1, [0, 1, 2, 3]], ["SP", 1, 0, 1605632, [28], 1], ["AN", 1, 0, 5], ["AN", 1, 1, 6]]]], "r": [[4.52543e-05, 4.52164e-05, 4.52122e-05], 0, 0.654243, 1668019621], "v": "v0.6"}
{"i": [["[\"window_partition\", 1, 56, 56, 512, 7, \"float16\"]", "cuda -keys=cuda,gpu -max_num_threads=1024 -model=unknown -thread_warp_size=32", [-1, 16, 64, 49152, 2147483647, 1024, 8, 32], "", 0, []], [[], [["FU", 1, [0, 1, 2, 3]], ["SP", 1, 0, 1605632, [7], 1], ["AN", 1, 0, 5], ["AN", 1, 1, 6]]]], "r": [[0.000172885, 0.000172874, 0.000172894], 0, 1.91168, 1668019622], "v": "v0.6"}
{"i": [["[\"window_partition\", 1, 56, 56, 512, 7, \"float16\"]", "cuda -keys=cuda,gpu -max_num_threads=1024 -model=unknown -thread_warp_size=32", [-1, 16, 64, 49152, 2147483647, 1024, 8, 32], "", 0, []], [[], [["FU", 1, [0, 1, 2, 3]], ["SP", 1, 0, 1605632, [4], 1], ["AN", 1, 0, 5], ["AN", 1, 1, 6]]]], "r": [[0.000300474, 0.000300487, 0.0003005], 0, 2.3503, 1668019623], "v": "v0.6"}
{"i": [["[\"window_partition\", 1, 56, 56, 512, 7, \"float16\"]", "cuda -keys=cuda,gpu -max_num_threads=1024 -model=unknown -thread_warp_size=32", [-1, 16, 64, 49152, 2147483647, 1024, 8, 32], "", 0, []], [[], [["FU", 1, [0, 1, 2, 3]], ["SP", 1, 0, 1605632, [56], 1], ["AN", 1, 0, 5], ["AN", 1, 1, 6]]]], "r": [[2.36399e-05, 2.36286e-05, 2.36212e-05], 0, 3.59417, 1668019624], "v": "v0.6"}
{"i": [["[\"window_partition\", 1, 56, 56, 512, 7, \"float16\"]", "cuda -keys=cuda,gpu -max_num_threads=1024 -model=unknown -thread_warp_size=32", [-1, 16, 64, 49152, 2147483647, 1024, 8, 32], "", 0, []], [[], [["FU", 1, [0, 1, 2, 3]], ["SP", 1, 0, 1605632, [49], 1], ["AN", 1, 0, 5], ["AN", 1, 1, 6]]]], "r": [[2.67219e-05, 2.67199e-05, 2.67496e-05], 0, 3.16292, 1668019624], "v": "v0.6"}
{"i": [["[\"window_partition\", 1, 56, 56, 512, 7, \"float16\"]", "cuda -keys=cuda,gpu -max_num_threads=1024 -model=unknown -thread_warp_size=32", [-1, 16, 64, 49152, 2147483647, 1024, 8, 32], "", 0, []], [[], [["FU", 1, [0, 1, 2, 3]], ["SP", 1, 0, 1605632, [8], 1], ["AN", 1, 0, 5], ["AN", 1, 1, 6]]]], "r": [[0.000151633, 0.00015162, 0.000151632], 0, 3.99448, 1668019625], "v": "v0.6"}
{"i": [["[\"window_partition\", 1, 56, 56, 512, 7, \"float16\"]", "cuda -keys=cuda,gpu -max_num_threads=1024 -model=unknown -thread_warp_size=32", [-1, 16, 64, 49152, 2147483647, 1024, 8, 32], "", 0, []], [[], [["FU", 1, [0, 1, 2, 3]], ["SP", 1, 0, 1605632, [2], 1], ["AN", 1, 0, 5], ["AN", 1, 1, 6]]]], "r": [[0.000598133, 0.000598119, 0.000598185], 0, 4.38801, 1668019625], "v": "v0.6"}
{"i": [["[\"window_partition\", 1, 56, 56, 512, 7, \"float16\"]", "cuda -keys=cuda,gpu -max_num_threads=1024 -model=unknown -thread_warp_size=32", [-1, 16, 64, 49152, 2147483647, 1024, 8, 32], "", 0, []], [[], [["FU", 1, [0, 1, 2, 3]], ["SP", 1, 0, 1605632, [64], 1], ["AN", 1, 0, 5], ["AN", 1, 1, 6]]]], "r": [[2.11238e-05, 2.11472e-05, 2.11471e-05], 0, 5.21739, 1668019626], "v": "v0.6"}
{"i": [["[\"window_partition\", 1, 56, 56, 512, 7, \"float16\"]", "cuda -keys=cuda,gpu -max_num_threads=1024 -model=unknown -thread_warp_size=32", [-1, 16, 64, 49152, 2147483647, 1024, 8, 32], "", 0, []], [[], [["FU", 1, [0, 1, 2, 3]], ["SP", 1, 0, 1605632, [14], 1], ["AN", 1, 0, 5], ["AN", 1, 1, 6]]]], "r": [[8.77463e-05, 8.77697e-05, 8.77751e-05], 0, 4.80993, 1668019625], "v": "v0.6"}
