python/models/swin_transformer/kernel_configs/swin_transformer_fused_window_reverse_roll_add_1_56_56_128_3_7_float16.log
{"i": [["[\"fused_window_reverse_roll_add\", 1, 56, 56, 128, 3, 7, \"float16\"]", "cuda -keys=cuda,gpu -max_num_threads=1024 -model=unknown -thread_warp_size=32", [-1, 16, 64, 49152, 2147483647, 1024, 8, 32], "", 0, []], [[], [["FU", 2, [0, 1, 2, 3]], ["SP", 2, 0, 401408, [28], 1], ["AN", 2, 0, 5], ["AN", 2, 1, 6]]]], "r": [[3.27533e-05, 1.35152e-05, 1.35131e-05, 1.35155e-05, 1.46881e-05, 1.36535e-05, 1.34779e-05, 1.3479e-05, 1.34725e-05, 1.34778e-05], 0, 6.95602, 1651678960], "v": "v0.6"}
{"i": [["[\"fused_window_reverse_roll_add\", 1, 56, 56, 128, 3, 7, \"float16\"]", "cuda -keys=cuda,gpu -max_num_threads=1024 -model=unknown -thread_warp_size=32", [-1, 16, 64, 49152, 2147483647, 1024, 8, 32], "", 0, []], [[], [["FU", 2, [0, 1, 2, 3]], ["SP", 2, 0, 401408, [8], 1], ["AN", 2, 0, 5], ["AN", 2, 1, 6]]]], "r": [[4.56443e-05, 4.32685e-05, 4.23114e-05, 4.03991e-05, 4.02477e-05, 4.54879e-05, 4.25538e-05, 4.27745e-05, 4.58371e-05, 4.12979e-05], 0, 3.81959, 1651678957], "v": "v0.6"}
{"i": [["[\"fused_window_reverse_roll_add\", 1, 56, 56, 128, 3, 7, \"float16\"]", "cuda -keys=cuda,gpu -max_num_threads=1024 -model=unknown -thread_warp_size=32", [-1, 16, 64, 49152, 2147483647, 1024, 8, 32], "", 0, []], [[], [["FU", 2, [0, 1, 2, 3]], ["SP", 2, 0, 401408, [2], 1], ["AN", 2, 0, 5], ["AN", 2, 1, 6]]]], "r": [[0.000155716, 0.000152353, 0.000152147, 0.000160881, 0.000160551, 0.000173486, 0.000185698, 0.000155262, 0.000151968, 0.000151915], 0, 9.62379, 1651678963], "v": "v0.6"}
{"i": [["[\"fused_window_reverse_roll_add\", 1, 56, 56, 128, 3, 7, \"float16\"]", "cuda -keys=cuda,gpu -max_num_threads=1024 -model=unknown -thread_warp_size=32", [-1, 16, 64, 49152, 2147483647, 1024, 8, 32], "", 0, []], [[], [["FU", 2, [0, 1, 2, 3]], ["SP", 2, 0, 401408, [1], 1], ["AN", 2, 0, 5], ["AN", 2, 1, 6]]]], "r": [[0.000311232, 0.000320935, 0.000302255, 0.000302618, 0.000300703, 0.000300553, 0.000324932, 0.000317439, 0.000300332, 0.000300352], 0, 12.7509, 1651678966], "v": "v0.6"}
{"i": [["[\"fused_window_reverse_roll_add\", 1, 56, 56, 128, 3, 7, \"float16\"]", "cuda -keys=cuda,gpu -max_num_threads=1024 -model=unknown -thread_warp_size=32", [-1, 16, 64, 49152, 2147483647, 1024, 8, 32], "", 0, []], [[], [["FU", 2, [0, 1, 2, 3]], ["SP", 2, 0, 401408, [64], 1], ["AN", 2, 0, 5], ["AN", 2, 1, 6]]]], "r": [[7.40325e-06, 7.40305e-06, 7.40211e-06, 7.40045e-06, 7.40114e-06, 7.40092e-06, 7.40041e-06, 7.40093e-06, 7.39865e-06, 7.39981e-06], 0, 21.4783, 1651678975], "v": "v0.6"}
{"i": [["[\"fused_window_reverse_roll_add\", 1, 56, 56, 128, 3, 7, \"float16\"]", "cuda -keys=cuda,gpu -max_num_threads=1024 -model=unknown -thread_warp_size=32", [-1, 16, 64, 49152, 2147483647, 1024, 8, 32], "", 0, []], [[], [["FU", 2, [0, 1, 2, 3]], ["SP", 2, 0, 401408, [14], 1], ["AN", 2, 0, 5], ["AN", 2, 1, 6]]]], "r": [[2.42528e-05, 2.43784e-05, 2.43599e-05, 2.56531e-05, 2.74329e-05, 3.31638e-05, 2.4374e-05, 2.42369e-05, 2.73152e-05, 2.4981e-05], 0, 23.8929, 1651678978], "v": "v0.6"}
{"i": [["[\"fused_window_reverse_roll_add\", 1, 56, 56, 128, 3, 7, \"float16\"]", "cuda -keys=cuda,gpu -max_num_threads=1024 -model=unknown -thread_warp_size=32", [-1, 16, 64, 49152, 2147483647, 1024, 8, 32], "", 0, []], [[], [["FU", 2, [0, 1, 2, 3]], ["SP", 2, 0, 401408, [7], 1], ["AN", 2, 0, 5], ["AN", 2, 1, 6]]]], "r": [[4.53379e-05, 4.53415e-05, 4.53423e-05, 4.53413e-05, 4.534e-05, 4.67783e-05, 4.53645e-05, 4.55067e-05, 4.55993e-05, 4.87971e-05], 0, 16.9686, 1651678970], "v": "v0.6"}
{"i": [["[\"fused_window_reverse_roll_add\", 1, 56, 56, 128, 3, 7, \"float16\"]", "cuda -keys=cuda,gpu -max_num_threads=1024 -model=unknown -thread_warp_size=32", [-1, 16, 64, 49152, 2147483647, 1024, 8, 32], "", 0, []], [[], [["FU", 2, [0, 1, 2, 3]], ["SP", 2, 0, 401408, [16], 1], ["AN", 2, 0, 5], ["AN", 2, 1, 6]]]], "r": [[2.15193e-05, 2.44231e-05, 2.23291e-05, 2.42719e-05, 2.22674e-05, 2.15801e-05, 2.15808e-05, 2.15795e-05, 2.1583e-05, 2.15777e-05], 0, 19.5944, 1651678973], "v": "v0.6"}
{"i": [["[\"fused_window_reverse_roll_add\", 1, 56, 56, 128, 3, 7, \"float16\"]", "cuda -keys=cuda,gpu -max_num_threads=1024 -model=unknown -thread_warp_size=32", [-1, 16, 64, 49152, 2147483647, 1024, 8, 32], "", 0, []], [[], [["FU", 2, [0, 1, 2, 3]], ["SP", 2, 0, 401408, [49], 1], ["AN", 2, 0, 5], ["AN", 2, 1, 6]]]], "r": [[8.92602e-06, 8.92509e-06, 8.92482e-06, 8.92458e-06, 8.9256e-06, 8.92707e-06, 8.92599e-06, 8.92452e-06, 8.92577e-06, 8.92555e-06], 0, 14.5334, 1651678968], "v": "v0.6"}
{"i": [["[\"fused_window_reverse_roll_add\", 1, 56, 56, 128, 3, 7, \"float16\"]", "cuda -keys=cuda,gpu -max_num_threads=1024 -model=unknown -thread_warp_size=32", [-1, 16, 64, 49152, 2147483647, 1024, 8, 32], "", 0, []], [[], [["FU", 2, [0, 1, 2, 3]], ["SP", 2, 0, 401408, [4], 1], ["AN", 2, 0, 5], ["AN", 2, 1, 6]]]], "r": [[8.11491e-05, 8.33176e-05, 8.01755e-05, 8.04436e-05, 8.16231e-05, 7.74089e-05, 8.26678e-05, 8.02371e-05, 7.71962e-05, 7.79029e-05], 0, 27.6584, 1651678981], "v": "v0.6"}
{"i": [["[\"fused_window_reverse_roll_add\", 1, 56, 56, 128, 3, 7, \"float16\"]", "cuda -keys=cuda,gpu -max_num_threads=1024 -model=unknown -thread_warp_size=32", [-1, 16, 64, 49152, 2147483647, 1024, 8, 32], "", 0, []], [[], [["FU", 2, [0, 1, 2, 3]], ["SP", 2, 0, 401408, [28], 1], ["AN", 2, 0, 5], ["AN", 2, 1, 6]]]], "r": [[4.60548e-05, 1.35452e-05, 1.34456e-05, 1.34449e-05, 1.34431e-05, 1.34438e-05, 1.34428e-05, 1.34432e-05, 1.34432e-05, 1.34429e-05], 0, 4.29351, 1651682291], "v": "v0.6"}
{"i": [["[\"fused_window_reverse_roll_add\", 1, 56, 56, 128, 3, 7, \"float16\"]", "cuda -keys=cuda,gpu -max_num_threads=1024 -model=unknown -thread_warp_size=32", [-1, 16, 64, 49152, 2147483647, 1024, 8, 32], "", 0, []], [[], [["FU", 2, [0, 1, 2, 3]], ["SP", 2, 0, 401408, [16], 1], ["AN", 2, 0, 5], ["AN", 2, 1, 6]]]], "r": [[2.15513e-05, 2.79161e-05, 2.33251e-05, 2.33686e-05, 2.2567e-05, 2.15232e-05, 2.75377e-05, 2.63526e-05, 2.15252e-05, 2.15305e-05], 0, 14.676, 1651682301], "v": "v0.6"}
{"i": [["[\"fused_window_reverse_roll_add\", 1, 56, 56, 128, 3, 7, \"float16\"]", "cuda -keys=cuda,gpu -max_num_threads=1024 -model=unknown -thread_warp_size=32", [-1, 16, 64, 49152, 2147483647, 1024, 8, 32], "", 0, []], [[], [["FU", 2, [0, 1, 2, 3]], ["SP", 2, 0, 401408, [8], 1], ["AN", 2, 0, 5], ["AN", 2, 1, 6]]]], "r": [[4.00111e-05, 4.00136e-05, 4.0246e-05, 3.99986e-05, 4.0168e-05, 4.35417e-05, 4.13275e-05, 4.00108e-05, 4.00141e-05, 4.19641e-05], 0, 6.62051, 1651682293], "v": "v0.6"}
{"i": [["[\"fused_window_reverse_roll_add\", 1, 56, 56, 128, 3, 7, \"float16\"]", "cuda -keys=cuda,gpu -max_num_threads=1024 -model=unknown -thread_warp_size=32", [-1, 16, 64, 49152, 2147483647, 1024, 8, 32], "", 0, []], [[], [["FU", 2, [0, 1, 2, 3]], ["SP", 2, 0, 401408, [2], 1], ["AN", 2, 0, 5], ["AN", 2, 1, 6]]]], "r": [[0.000154723, 0.000194352, 0.000324342, 0.000151914, 0.00016245, 0.00016121, 0.000239133, 0.000152623, 0.000151817, 0.000157722], 0, 21.3467, 1651682308], "v": "v0.6"}
{"i": [["[\"fused_window_reverse_roll_add\", 1, 56, 56, 128, 3, 7, \"float16\"]", "cuda -keys=cuda,gpu -max_num_threads=1024 -model=unknown -thread_warp_size=32", [-1, 16, 64, 49152, 2147483647, 1024, 8, 32], "", 0, []], [[], [["FU", 2, [0, 1, 2, 3]], ["SP", 2, 0, 401408, [64], 1], ["AN", 2, 0, 5], ["AN", 2, 1, 6]]]], "r": [[7.50158e-06, 7.46448e-06, 8.83528e-06, 7.99446e-06, 7.65942e-06, 1.71273e-05, 7.45577e-06, 7.62676e-06, 9.95337e-06, 7.455e-06], 0, 9.24596, 1651682296], "v": "v0.6"}
{"i": [["[\"fused_window_reverse_roll_add\", 1, 56, 56, 128, 3, 7, \"float16\"]", "cuda -keys=cuda,gpu -max_num_threads=1024 -model=unknown -thread_warp_size=32", [-1, 16, 64, 49152, 2147483647, 1024, 8, 32], "", 0, []], [[], [["FU", 2, [0, 1, 2, 3]], ["SP", 2, 0, 401408, [49], 1], ["AN", 2, 0, 5], ["AN", 2, 1, 6]]]], "r": [[9.49555e-06, 1.15813e-05, 8.88252e-06, 8.76881e-06, 8.77285e-06, 8.77076e-06, 8.77032e-06, 8.76969e-06, 8.76938e-06, 8.76812e-06], 0, 25.8967, 1651682313], "v": "v0.6"}
{"i": [["[\"fused_window_reverse_roll_add\", 1, 56, 56, 128, 3, 7, \"float16\"]", "cuda -keys=cuda,gpu -max_num_threads=1024 -model=unknown -thread_warp_size=32", [-1, 16, 64, 49152, 2147483647, 1024, 8, 32], "", 0, []], [[], [["FU", 2, [0, 1, 2, 3]], ["SP", 2, 0, 401408, [56], 1], ["AN", 2, 0, 5], ["AN", 2, 1, 6]]]], "r": [[8.10794e-06, 8.01313e-06, 8.06185e-06, 1.02053e-05, 9.31265e-06, 8.39581e-06, 8.31439e-06, 8.00949e-06, 8.05396e-06, 8.01593e-06], 0, 30.9482, 1651682318], "v": "v0.6"}
{"i": [["[\"fused_window_reverse_roll_add\", 1, 56, 56, 128, 3, 7, \"float16\"]", "cuda -keys=cuda,gpu -max_num_threads=1024 -model=unknown -thread_warp_size=32", [-1, 16, 64, 49152, 2147483647, 1024, 8, 32], "", 0, []], [[], [["FU", 2, [0, 1, 2, 3]], ["SP", 2, 0, 401408, [4], 1], ["AN", 2, 0, 5], ["AN", 2, 1, 6]]]], "r": [[7.72491e-05, 7.72483e-05, 7.72511e-05, 7.72557e-05, 7.72494e-05, 7.72454e-05, 7.72484e-05, 7.72545e-05, 7.72574e-05, 7.72491e-05], 0, 11.7169, 1651682298], "v": "v0.6"}
{"i": [["[\"fused_window_reverse_roll_add\", 1, 56, 56, 128, 3, 7, \"float16\"]", "cuda -keys=cuda,gpu -max_num_threads=1024 -model=unknown -thread_warp_size=32", [-1, 16, 64, 49152, 2147483647, 1024, 8, 32], "", 0, []], [[], [["FU", 2, [0, 1, 2, 3]], ["SP", 2, 0, 401408, [7], 1], ["AN", 2, 0, 5], ["AN", 2, 1, 6]]]], "r": [[4.52843e-05, 4.52902e-05, 4.52845e-05, 4.52859e-05, 4.52887e-05, 4.52831e-05, 4.52854e-05, 4.52823e-05, 4.52843e-05, 4.52814e-05], 0, 28.1921, 1651682315], "v": "v0.6"}
{"i": [["[\"fused_window_reverse_roll_add\", 1, 56, 56, 128, 3, 7, \"float16\"]", "cuda -keys=cuda,gpu -max_num_threads=1024 -model=unknown -thread_warp_size=32", [-1, 16, 64, 49152, 2147483647, 1024, 8, 32], "", 0, []], [[], [["FU", 2, [0, 1, 2, 3]], ["SP", 2, 0, 401408, [14], 1], ["AN", 2, 0, 5], ["AN", 2, 1, 6]]]], "r": [[2.42695e-05, 2.42791e-05, 2.42698e-05, 2.42744e-05, 2.42744e-05, 2.42766e-05, 2.43679e-05, 2.42394e-05, 2.68631e-05, 5.03303e-05], 0, 17.2717, 1651682304], "v": "v0.6"}
{"i": [["[\"fused_window_reverse_roll_add\", 1, 56, 56, 128, 3, 7, \"float16\"]", "cuda -keys=cuda,gpu -max_num_threads=1024 -model=unknown -thread_warp_size=32", [-1, 16, 64, 49152, 2147483647, 1024, 8, 32], "", 0, []], [[], [["FU", 2, [0, 1, 2, 3]], ["SP", 2, 0, 401408, [32], 1], ["AN", 2, 0, 5], ["AN", 2, 1, 6]]]], "r": [[1.22502e-05, 1.22304e-05, 1.23457e-05, 1.22285e-05, 1.58457e-05, 1.27133e-05, 1.40418e-05, 1.23109e-05, 1.22619e-05, 1.41932e-05], 0, 23.7238, 1651682311], "v": "v0.6"}
{"i": [["[\"fused_window_reverse_roll_add\", 1, 56, 56, 128, 3, 7, \"float16\"]", "cuda -keys=cuda,gpu -max_num_threads=1024 -model=unknown -thread_warp_size=32", [-1, 16, 64, 49152, 2147483647, 1024, 8, 32], "", 0, []], [[], [["FU", 2, [0, 1, 2, 3]], ["SP", 2, 0, 401408, [1], 1], ["AN", 2, 0, 5], ["AN", 2, 1, 6]]]], "r": [[0.000321707, 0.000309417, 0.000300697, 0.000300707, 0.000310179, 0.000318085, 0.000322912, 0.000313118, 0.000309848, 0.000565819], 0, 34.0584, 1651682321], "v": "v0.6"}
{"i": [["[\"fused_window_reverse_roll_add\", 1, 56, 56, 128, 3, 7, \"float16\"]", "cuda -keys=cuda,gpu -max_num_threads=1024 -model=unknown -thread_warp_size=32", [-1, 16, 64, 49152, 2147483647, 1024, 8, 32], "", 0, []], [[], [["FU", 2, [0, 1, 2, 3]], ["SP", 2, 0, 401408, [32], 1], ["AN", 2, 0, 5], ["AN", 2, 1, 6]]]], "r": [[1.24472e-05, 1.24461e-05, 1.24476e-05, 1.24471e-05, 1.24454e-05, 1.24455e-05, 1.24446e-05, 1.24463e-05, 1.24455e-05, 1.24457e-05], 0, 11.2103, 1652002951], "v": "v0.6"}
{"i": [["[\"fused_window_reverse_roll_add\", 1, 56, 56, 128, 3, 7, \"float16\"]", "cuda -keys=cuda,gpu -max_num_threads=1024 -model=unknown -thread_warp_size=32", [-1, 16, 64, 49152, 2147483647, 1024, 8, 32], "", 0, []], [[], [["FU", 2, [0, 1, 2, 3]], ["SP", 2, 0, 401408, [64], 1], ["AN", 2, 0, 5], ["AN", 2, 1, 6]]]], "r": [[7.52746e-06, 7.52658e-06, 7.52671e-06, 7.52681e-06, 7.52447e-06, 7.52466e-06, 7.52659e-06, 7.52414e-06, 7.52658e-06, 7.52753e-06], 0, 21.0253, 1652002961], "v": "v0.6"}
{"i": [["[\"fused_window_reverse_roll_add\", 1, 56, 56, 128, 3, 7, \"float16\"]", "cuda -keys=cuda,gpu -max_num_threads=1024 -model=unknown -thread_warp_size=32", [-1, 16, 64, 49152, 2147483647, 1024, 8, 32], "", 0, []], [[], [["FU", 2, [0, 1, 2, 3]], ["SP", 2, 0, 401408, [49], 1], ["AN", 2, 0, 5], ["AN", 2, 1, 6]]]], "r": [[8.79074e-06, 8.79177e-06, 8.7923e-06, 8.79212e-06, 8.79114e-06, 8.79146e-06, 8.79147e-06, 8.79154e-06, 8.79114e-06, 8.79078e-06], 0, 30.6753, 1652002970], "v": "v0.6"}
{"i": [["[\"fused_window_reverse_roll_add\", 1, 56, 56, 128, 3, 7, \"float16\"]", "cuda -keys=cuda,gpu -max_num_threads=1024 -model=unknown -thread_warp_size=32", [-1, 16, 64, 49152, 2147483647, 1024, 8, 32], "", 0, []], [[], [["FU", 2, [0, 1, 2, 3]], ["SP", 2, 0, 401408, [4], 1], ["AN", 2, 0, 5], ["AN", 2, 1, 6]]]], "r": [[7.72973e-05, 7.73018e-05, 7.73044e-05, 7.73061e-05, 7.7299e-05, 7.72983e-05, 7.72963e-05, 7.73007e-05, 7.72979e-05, 7.72982e-05], 0, 36.1508, 1652002976], "v": "v0.6"}
{"i": [["[\"fused_window_reverse_roll_add\", 1, 56, 56, 128, 3, 7, \"float16\"]", "cuda -keys=cuda,gpu -max_num_threads=1024 -model=unknown -thread_warp_size=32", [-1, 16, 64, 49152, 2147483647, 1024, 8, 32], "", 0, []], [[], [["FU", 2, [0, 1, 2, 3]], ["SP", 2, 0, 401408, [56], 1], ["AN", 2, 0, 5], ["AN", 2, 1, 6]]]], "r": [[8.12853e-06, 8.12844e-06, 8.1294e-06, 8.11962e-06, 8.11877e-06, 8.11914e-06, 8.11979e-06, 8.1198e-06, 8.12076e-06, 8.12042e-06], 0, 39.9153, 1652002980], "v": "v0.6"}
{"i": [["[\"fused_window_reverse_roll_add\", 1, 56, 56, 128, 3, 7, \"float16\"]", "cuda -keys=cuda,gpu -max_num_threads=1024 -model=unknown -thread_warp_size=32", [-1, 16, 64, 49152, 2147483647, 1024, 8, 32], "", 0, []], [[], [["FU", 2, [0, 1, 2, 3]], ["SP", 2, 0, 401408, [8], 1], ["AN", 2, 0, 5], ["AN", 2, 1, 6]]]], "r": [[4.00473e-05, 4.00487e-05, 4.00499e-05, 4.00535e-05, 4.00488e-05, 4.00443e-05, 4.00486e-05, 4.00507e-05, 4.00506e-05, 4.00504e-05], 0, 45.2297, 1652002985], "v": "v0.6"}
{"i": [["[\"fused_window_reverse_roll_add\", 1, 56, 56, 128, 3, 7, \"float16\"]", "cuda -keys=cuda,gpu -max_num_threads=1024 -model=unknown -thread_warp_size=32", [-1, 16, 64, 49152, 2147483647, 1024, 8, 32], "", 0, []], [[], [["FU", 2, [0, 1, 2, 3]], ["SP", 2, 0, 401408, [7], 1], ["AN", 2, 0, 5], ["AN", 2, 1, 6]]]], "r": [[4.52365e-05, 4.52367e-05, 4.52394e-05, 4.52423e-05, 4.52399e-05, 4.52396e-05, 4.52401e-05, 4.52398e-05, 4.52407e-05, 4.52426e-05], 0, 16.6258, 1652002956], "v": "v0.6"}
{"i": [["[\"fused_window_reverse_roll_add\", 1, 56, 56, 128, 3, 7, \"float16\"]", "cuda -keys=cuda,gpu -max_num_threads=1024 -model=unknown -thread_warp_size=32", [-1, 16, 64, 49152, 2147483647, 1024, 8, 32], "", 0, []], [[], [["FU", 2, [0, 1, 2, 3]], ["SP", 2, 0, 401408, [28], 1], ["AN", 2, 0, 5], ["AN", 2, 1, 6]]]], "r": [[1.35061e-05, 1.3509e-05, 1.35099e-05, 1.35112e-05, 1.35099e-05, 1.35099e-05, 1.35096e-05, 1.35074e-05, 1.35086e-05, 1.35086e-05], 0, 7.18161, 1652002947], "v": "v0.6"}
{"i": [["[\"fused_window_reverse_roll_add\", 1, 56, 56, 128, 3, 7, \"float16\"]", "cuda -keys=cuda,gpu -max_num_threads=1024 -model=unknown -thread_warp_size=32", [-1, 16, 64, 49152, 2147483647, 1024, 8, 32], "", 0, []], [[], [["FU", 2, [0, 1, 2, 3]], ["SP", 2, 0, 401408, [14], 1], ["AN", 2, 0, 5], ["AN", 2, 1, 6]]]], "r": [[2.42931e-05, 2.42912e-05, 2.42906e-05, 2.42911e-05, 2.42909e-05, 2.42948e-05, 2.42932e-05, 2.42913e-05, 2.42914e-05, 2.4294e-05], 0, 26.1679, 1652002966], "v": "v0.6"}
{"i": [["[\"fused_window_reverse_roll_add\", 1, 56, 56, 128, 3, 7, \"float16\"]", "cuda -keys=cuda,gpu -max_num_threads=1024 -model=unknown -thread_warp_size=32", [-1, 16, 64, 49152, 2147483647, 1024, 8, 32], "", 0, []], [[], [["FU", 2, [0, 1, 2, 3]], ["SP", 2, 0, 401408, [16], 1], ["AN", 2, 0, 5], ["AN", 2, 1, 6]]]], "r": [[2.16026e-05, 2.15998e-05, 2.16015e-05, 2.1604e-05, 2.16025e-05, 2.16016e-05, 2.16012e-05, 2.15999e-05, 2.16024e-05, 2.16018e-05], 0, 50.2395, 1652002990], "v": "v0.6"}
{"i": [["[\"fused_window_reverse_roll_add\", 1, 56, 56, 128, 3, 7, \"float16\"]", "cuda -keys=cuda,gpu -max_num_threads=1024 -model=unknown -thread_warp_size=32", [-1, 16, 64, 49152, 2147483647, 1024, 8, 32], "", 0, []], [[], [["FU", 2, [0, 1, 2, 3]], ["SP", 2, 0, 401408, [2], 1], ["AN", 2, 0, 5], ["AN", 2, 1, 6]]]], "r": [[0.000151601, 0.000151598, 0.000151602, 0.000151614, 0.000151604, 0.000151601, 0.000151603, 0.000151602, 0.000151601, 0.000151605], 0, 61.4361, 1652003001], "v": "v0.6"}
{"i": [["[\"fused_window_reverse_roll_add\", 1, 56, 56, 128, 3, 7, \"float16\"]", "cuda -keys=cuda,gpu -max_num_threads=1024 -model=unknown -thread_warp_size=32", [-1, 16, 64, 49152, 2147483647, 1024, 8, 32], "", 0, []], [[], [["FU", 2, [0, 1, 2, 3]], ["SP", 2, 0, 401408, [1], 1], ["AN", 2, 0, 5], ["AN", 2, 1, 6]]]], "r": [[0.000300264, 0.000300258, 0.000300264, 0.00030028, 0.000300268, 0.000300257, 0.000300258, 0.000300254, 0.000300254, 0.00030026], 0, 55.7724, 1652002996], "v": "v0.6"}
