python/models/swin_transformer/kernel_configs/swin_transformer_roll_tune_1_7_7_1024_3_float16.log
{"i": [["[\"roll\", 1, 7, 7, 1024, 3, \"float16\"]", "cuda -keys=cuda,gpu -max_num_threads=1024 -model=unknown -thread_warp_size=32", [-1, 16, 64, 49152, 2147483647, 1024, 8, 32], "", 0, []], [[], [["FU", 1, [0, 1, 2, 3]], ["SP", 1, 0, 50176, [2], 1], ["AN", 1, 0, 5], ["AN", 1, 1, 6]]]], "r": [[2.15697e-05, 2.15684e-05, 2.15689e-05, 2.15801e-05, 2.15766e-05, 2.15812e-05, 2.15694e-05, 2.15688e-05, 2.15671e-05, 2.15712e-05], 0, 24.4036, 1652026601], "v": "v0.6"}
{"i": [["[\"roll\", 1, 7, 7, 1024, 3, \"float16\"]", "cuda -keys=cuda,gpu -max_num_threads=1024 -model=unknown -thread_warp_size=32", [-1, 16, 64, 49152, 2147483647, 1024, 8, 32], "", 0, []], [[], [["FU", 1, [0, 1, 2, 3]], ["SP", 1, 0, 50176, [28], 1], ["AN", 1, 0, 5], ["AN", 1, 1, 6]]]], "r": [[5.58831e-06, 5.72438e-06, 4.87761e-06, 4.36291e-06, 5.3591e-06, 4.12887e-06, 5.23017e-06, 5.22285e-06, 4.40359e-06, 4.85934e-06], 0, 6.17787, 1652026583], "v": "v0.6"}
{"i": [["[\"roll\", 1, 7, 7, 1024, 3, \"float16\"]", "cuda -keys=cuda,gpu -max_num_threads=1024 -model=unknown -thread_warp_size=32", [-1, 16, 64, 49152, 2147483647, 1024, 8, 32], "", 0, []], [[], [["FU", 1, [0, 1, 2, 3]], ["SP", 1, 0, 50176, [14], 1], ["AN", 1, 0, 5], ["AN", 1, 1, 6]]]], "r": [[5.73519e-06, 5.5354e-06, 5.58404e-06, 5.48854e-06, 5.44314e-06, 5.61372e-06, 5.44275e-06, 5.44161e-06, 5.52188e-06, 5.8083e-06], 0, 10.3081, 1652026587], "v": "v0.6"}
{"i": [["[\"roll\", 1, 7, 7, 1024, 3, \"float16\"]", "cuda -keys=cuda,gpu -max_num_threads=1024 -model=unknown -thread_warp_size=32", [-1, 16, 64, 49152, 2147483647, 1024, 8, 32], "", 0, []], [[], [["FU", 1, [0, 1, 2, 3]], ["SP", 1, 0, 50176, [4], 1], ["AN", 1, 0, 5], ["AN", 1, 1, 6]]]], "r": [[1.21111e-05, 1.2114e-05, 1.2108e-05, 1.21097e-05, 1.21124e-05, 1.21123e-05, 1.21105e-05, 1.21107e-05, 1.21097e-05, 1.21081e-05], 0, 15.0661, 1652026592], "v": "v0.6"}
{"i": [["[\"roll\", 1, 7, 7, 1024, 3, \"float16\"]", "cuda -keys=cuda,gpu -max_num_threads=1024 -model=unknown -thread_warp_size=32", [-1, 16, 64, 49152, 2147483647, 1024, 8, 32], "", 0, []], [[], [["FU", 1, [0, 1, 2, 3]], ["SP", 1, 0, 50176, [64], 1], ["AN", 1, 0, 5], ["AN", 1, 1, 6]]]], "r": [[4.53453e-06, 3.96018e-06, 4.35847e-06, 4.19587e-06, 3.63368e-06, 3.98784e-06, 3.26321e-06, 4.29231e-06, 4.64181e-06, 3.98217e-06], 0, 34.1106, 1652026611], "v": "v0.6"}
{"i": [["[\"roll\", 1, 7, 7, 1024, 3, \"float16\"]", "cuda -keys=cuda,gpu -max_num_threads=1024 -model=unknown -thread_warp_size=32", [-1, 16, 64, 49152, 2147483647, 1024, 8, 32], "", 0, []], [[], [["FU", 1, [0, 1, 2, 3]], ["SP", 1, 0, 50176, [8], 1], ["AN", 1, 0, 5], ["AN", 1, 1, 6]]]], "r": [[7.29074e-06, 7.28496e-06, 7.44094e-06, 7.28446e-06, 7.28489e-06, 7.28489e-06, 7.39173e-06, 7.28483e-06, 7.28535e-06, 7.28838e-06], 0, 28.1771, 1652026605], "v": "v0.6"}
{"i": [["[\"roll\", 1, 7, 7, 1024, 3, \"float16\"]", "cuda -keys=cuda,gpu -max_num_threads=1024 -model=unknown -thread_warp_size=32", [-1, 16, 64, 49152, 2147483647, 1024, 8, 32], "", 0, []], [[], [["FU", 1, [0, 1, 2, 3]], ["SP", 1, 0, 50176, [32], 1], ["AN", 1, 0, 5], ["AN", 1, 1, 6]]]], "r": [[5.9225e-06, 4.09476e-06, 3.79103e-06, 3.96871e-06, 4.28443e-06, 3.734e-06, 4.24486e-06, 3.85043e-06, 5.04346e-06, 4.76427e-06], 0, 19.5208, 1652026596], "v": "v0.6"}
{"i": [["[\"roll\", 1, 7, 7, 1024, 3, \"float16\"]", "cuda -keys=cuda,gpu -max_num_threads=1024 -model=unknown -thread_warp_size=32", [-1, 16, 64, 49152, 2147483647, 1024, 8, 32], "", 0, []], [[], [["FU", 1, [0, 1, 2, 3]], ["SP", 1, 0, 50176, [7], 1], ["AN", 1, 0, 5], ["AN", 1, 1, 6]]]], "r": [[8.251e-06, 8.25157e-06, 8.32868e-06, 8.25e-06, 8.25128e-06, 8.39497e-06, 8.25708e-06, 8.25627e-06, 8.2509e-06, 8.25058e-06], 0, 49.2452, 1652026626], "v": "v0.6"}
{"i": [["[\"roll\", 1, 7, 7, 1024, 3, \"float16\"]", "cuda -keys=cuda,gpu -max_num_threads=1024 -model=unknown -thread_warp_size=32", [-1, 16, 64, 49152, 2147483647, 1024, 8, 32], "", 0, []], [[], [["FU", 1, [0, 1, 2, 3]], ["SP", 1, 0, 50176, [1], 1], ["AN", 1, 0, 5], ["AN", 1, 1, 6]]]], "r": [[4.01481e-05, 4.01263e-05, 4.01271e-05, 4.01306e-05, 4.01323e-05, 4.01231e-05, 4.01303e-05, 4.01419e-05, 4.01299e-05, 4.0145e-05], 0, 44.8026, 1652026621], "v": "v0.6"}
{"i": [["[\"roll\", 1, 7, 7, 1024, 3, \"float16\"]", "cuda -keys=cuda,gpu -max_num_threads=1024 -model=unknown -thread_warp_size=32", [-1, 16, 64, 49152, 2147483647, 1024, 8, 32], "", 0, []], [[], [["FU", 1, [0, 1, 2, 3]], ["SP", 1, 0, 50176, [56], 1], ["AN", 1, 0, 5], ["AN", 1, 1, 6]]]], "r": [[3.39336e-06, 3.96922e-06, 4.71588e-06, 4.06657e-06, 3.67265e-06, 4.03236e-06, 3.39328e-06, 3.86237e-06, 4.19361e-06, 4.36969e-06], 0, 39.5333, 1652026616], "v": "v0.6"}
{"i": [["[\"roll\", 1, 7, 7, 1024, 3, \"float16\"]", "cuda -keys=cuda,gpu -max_num_threads=1024 -model=unknown -thread_warp_size=32", [-1, 16, 64, 49152, 2147483647, 1024, 8, 32], "", 0, []], [[], [["FU", 1, [0, 1, 2, 3]], ["SP", 1, 0, 50176, [16], 1], ["AN", 1, 0, 5], ["AN", 1, 1, 6]]]], "r": [[5.20788e-06, 5.24316e-06, 5.32204e-06, 5.44226e-06, 5.21487e-06, 5.2095e-06, 5.26784e-06, 5.49709e-06, 5.21021e-06, 5.79854e-06], 0, 53.1635, 1652026630], "v": "v0.6"}
{"i": [["[\"roll\", 1, 7, 7, 1024, 3, \"float16\"]", "cuda -keys=cuda,gpu -max_num_threads=1024 -model=unknown -thread_warp_size=32", [-1, 16, 64, 49152, 2147483647, 1024, 8, 32], "", 0, []], [[], [["FU", 1, [0, 1, 2, 3]], ["SP", 1, 0, 50176, [49], 1], ["AN", 1, 0, 5], ["AN", 1, 1, 6]]]], "r": [[4.34277e-06, 3.79603e-06, 3.67721e-06, 4.34016e-06, 3.63979e-06, 4.35033e-06, 4.62991e-06, 3.71774e-06, 4.06257e-06, 3.45079e-06], 0, 58.6781, 1652026635], "v": "v0.6"}
{"i": [["[\"roll\", 1, 7, 7, 1024, 3, \"float16\"]", "cuda -keys=cuda,gpu -max_num_threads=1024 -model=unknown -thread_warp_size=32", [-1, 16, 64, 49152, 2147483647, 1024, 8, 32], "", 0, []], [[], [["FU", 1, [0, 1, 2, 3]], ["SP", 1, 0, 50176, [4], 1], ["AN", 1, 0, 5], ["AN", 1, 1, 6]]]], "r": [[1.20359e-05, 1.20476e-05, 1.20378e-05], 0, 1.4174, 1668058977], "v": "v0.6"}
{"i": [["[\"roll\", 1, 7, 7, 1024, 3, \"float16\"]", "cuda -keys=cuda,gpu -max_num_threads=1024 -model=unknown -thread_warp_size=32", [-1, 16, 64, 49152, 2147483647, 1024, 8, 32], "", 0, []], [[], [["FU", 1, [0, 1, 2, 3]], ["SP", 1, 0, 50176, [16], 1], ["AN", 1, 0, 5], ["AN", 1, 1, 6]]]], "r": [[4.97287e-06, 4.99262e-06, 4.98951e-06], 0, 2.20149, 1668058977], "v": "v0.6"}
{"i": [["[\"roll\", 1, 7, 7, 1024, 3, \"float16\"]", "cuda -keys=cuda,gpu -max_num_threads=1024 -model=unknown -thread_warp_size=32", [-1, 16, 64, 49152, 2147483647, 1024, 8, 32], "", 0, []], [[], [["FU", 1, [0, 1, 2, 3]], ["SP", 1, 0, 50176, [14], 1], ["AN", 1, 0, 5], ["AN", 1, 1, 6]]]], "r": [[5.2471e-06, 5.26458e-06, 5.2598e-06], 0, 1.79459, 1668058977], "v": "v0.6"}
{"i": [["[\"roll\", 1, 7, 7, 1024, 3, \"float16\"]", "cuda -keys=cuda,gpu -max_num_threads=1024 -model=unknown -thread_warp_size=32", [-1, 16, 64, 49152, 2147483647, 1024, 8, 32], "", 0, []], [[], [["FU", 1, [0, 1, 2, 3]], ["SP", 1, 0, 50176, [2], 1], ["AN", 1, 0, 5], ["AN", 1, 1, 6]]]], "r": [[2.14413e-05, 2.1455e-05, 2.1451e-05], 0, 1.03979, 1668058976], "v": "v0.6"}
{"i": [["[\"roll\", 1, 7, 7, 1024, 3, \"float16\"]", "cuda -keys=cuda,gpu -max_num_threads=1024 -model=unknown -thread_warp_size=32", [-1, 16, 64, 49152, 2147483647, 1024, 8, 32], "", 0, []], [[], [["FU", 1, [0, 1, 2, 3]], ["SP", 1, 0, 50176, [64], 1], ["AN", 1, 0, 5], ["AN", 1, 1, 6]]]], "r": [[3.18713e-06, 3.18761e-06, 3.18463e-06], 0, 0.625024, 1668058976], "v": "v0.6"}
{"i": [["[\"roll\", 1, 7, 7, 1024, 3, \"float16\"]", "cuda -keys=cuda,gpu -max_num_threads=1024 -model=unknown -thread_warp_size=32", [-1, 16, 64, 49152, 2147483647, 1024, 8, 32], "", 0, []], [[], [["FU", 1, [0, 1, 2, 3]], ["SP", 1, 0, 50176, [7], 1], ["AN", 1, 0, 5], ["AN", 1, 1, 6]]]], "r": [[7.94932e-06, 7.96262e-06, 7.96344e-06], 0, 3.34801, 1668058979], "v": "v0.6"}
{"i": [["[\"roll\", 1, 7, 7, 1024, 3, \"float16\"]", "cuda -keys=cuda,gpu -max_num_threads=1024 -model=unknown -thread_warp_size=32", [-1, 16, 64, 49152, 2147483647, 1024, 8, 32], "", 0, []], [[], [["FU", 1, [0, 1, 2, 3]], ["SP", 1, 0, 50176, [49], 1], ["AN", 1, 0, 5], ["AN", 1, 1, 6]]]], "r": [[3.47032e-06, 3.48865e-06, 3.48879e-06], 0, 2.93321, 1668058978], "v": "v0.6"}
{"i": [["[\"roll\", 1, 7, 7, 1024, 3, \"float16\"]", "cuda -keys=cuda,gpu -max_num_threads=1024 -model=unknown -thread_warp_size=32", [-1, 16, 64, 49152, 2147483647, 1024, 8, 32], "", 0, []], [[], [["FU", 1, [0, 1, 2, 3]], ["SP", 1, 0, 50176, [56], 1], ["AN", 1, 0, 5], ["AN", 1, 1, 6]]]], "r": [[3.2939e-06, 3.30166e-06, 3.29609e-06], 0, 4.11469, 1668058979], "v": "v0.6"}
{"i": [["[\"roll\", 1, 7, 7, 1024, 3, \"float16\"]", "cuda -keys=cuda,gpu -max_num_threads=1024 -model=unknown -thread_warp_size=32", [-1, 16, 64, 49152, 2147483647, 1024, 8, 32], "", 0, []], [[], [["FU", 1, [0, 1, 2, 3]], ["SP", 1, 0, 50176, [1], 1], ["AN", 1, 0, 5], ["AN", 1, 1, 6]]]], "r": [[3.99798e-05, 4.00027e-05, 3.99963e-05], 0, 3.7363, 1668058979], "v": "v0.6"}
{"i": [["[\"roll\", 1, 7, 7, 1024, 3, \"float16\"]", "cuda -keys=cuda,gpu -max_num_threads=1024 -model=unknown -thread_warp_size=32", [-1, 16, 64, 49152, 2147483647, 1024, 8, 32], "", 0, []], [[], [["FU", 1, [0, 1, 2, 3]], ["SP", 1, 0, 50176, [32], 1], ["AN", 1, 0, 5], ["AN", 1, 1, 6]]]], "r": [[3.82282e-06, 3.82192e-06, 3.82255e-06], 0, 2.57211, 1668058978], "v": "v0.6"}
{"i": [["[\"roll\", 1, 7, 7, 1024, 3, \"float16\"]", "cuda -keys=cuda,gpu -max_num_threads=1024 -model=unknown -thread_warp_size=32", [-1, 16, 64, 49152, 2147483647, 1024, 8, 32], "", 0, []], [[], [["FU", 1, [0, 1, 2, 3]], ["SP", 1, 0, 50176, [8], 1], ["AN", 1, 0, 5], ["AN", 1, 1, 6]]]], "r": [[7.29334e-06, 7.30625e-06, 7.30891e-06], 0, 4.51138, 1668058980], "v": "v0.6"}
{"i": [["[\"roll\", 1, 7, 7, 1024, 3, \"float16\"]", "cuda -keys=cuda,gpu -max_num_threads=1024 -model=unknown -thread_warp_size=32", [-1, 16, 64, 49152, 2147483647, 1024, 8, 32], "", 0, []], [[], [["FU", 1, [0, 1, 2, 3]], ["SP", 1, 0, 50176, [28], 1], ["AN", 1, 0, 5], ["AN", 1, 1, 6]]]], "r": [[3.95988e-06, 3.9729e-06, 3.96894e-06], 0, 4.87047, 1668058980], "v": "v0.6"}
{"i": [["[\"roll\", 1, 7, 7, 1024, 3, \"float16\"]", "cuda -keys=cuda,gpu -max_num_threads=1024 -model=unknown -thread_warp_size=32", [-1, 16, 64, 49152, 2147483647, 1024, 8, 32], "", 0, []], [[], [["FU", 1, [0, 1, 2, 3]], ["SP", 1, 0, 50176, [8], 1], ["AN", 1, 0, 5], ["AN", 1, 1, 6]]]], "r": [[7.2499e-06, 7.25526e-06, 7.26135e-06], 0, 2.64246, 1668061524], "v": "v0.6"}
{"i": [["[\"roll\", 1, 7, 7, 1024, 3, \"float16\"]", "cuda -keys=cuda,gpu -max_num_threads=1024 -model=unknown -thread_warp_size=32", [-1, 16, 64, 49152, 2147483647, 1024, 8, 32], "", 0, []], [[], [["FU", 1, [0, 1, 2, 3]], ["SP", 1, 0, 50176, [7], 1], ["AN", 1, 0, 5], ["AN", 1, 1, 6]]]], "r": [[8.20283e-06, 8.21683e-06, 8.21068e-06], 0, 1.60677, 1668061523], "v": "v0.6"}
{"i": [["[\"roll\", 1, 7, 7, 1024, 3, \"float16\"]", "cuda -keys=cuda,gpu -max_num_threads=1024 -model=unknown -thread_warp_size=32", [-1, 16, 64, 49152, 2147483647, 1024, 8, 32], "", 0, []], [[], [["FU", 1, [0, 1, 2, 3]], ["SP", 1, 0, 50176, [28], 1], ["AN", 1, 0, 5], ["AN", 1, 1, 6]]]], "r": [[3.76727e-06, 3.77726e-06, 3.77969e-06], 0, 1.22108, 1668061523], "v": "v0.6"}
{"i": [["[\"roll\", 1, 7, 7, 1024, 3, \"float16\"]", "cuda -keys=cuda,gpu -max_num_threads=1024 -model=unknown -thread_warp_size=32", [-1, 16, 64, 49152, 2147483647, 1024, 8, 32], "", 0, []], [[], [["FU", 1, [0, 1, 2, 3]], ["SP", 1, 0, 50176, [16], 1], ["AN", 1, 0, 5], ["AN", 1, 1, 6]]]], "r": [[4.9149e-06, 4.92813e-06, 4.92866e-06], 0, 0.58046, 1668061522], "v": "v0.6"}
{"i": [["[\"roll\", 1, 7, 7, 1024, 3, \"float16\"]", "cuda -keys=cuda,gpu -max_num_threads=1024 -model=unknown -thread_warp_size=32", [-1, 16, 64, 49152, 2147483647, 1024, 8, 32], "", 0, []], [[], [["FU", 1, [0, 1, 2, 3]], ["SP", 1, 0, 50176, [14], 1], ["AN", 1, 0, 5], ["AN", 1, 1, 6]]]], "r": [[5.29123e-06, 5.31177e-06, 5.31057e-06], 0, 1.93998, 1668061524], "v": "v0.6"}
{"i": [["[\"roll\", 1, 7, 7, 1024, 3, \"float16\"]", "cuda -keys=cuda,gpu -max_num_threads=1024 -model=unknown -thread_warp_size=32", [-1, 16, 64, 49152, 2147483647, 1024, 8, 32], "", 0, []], [[], [["FU", 1, [0, 1, 2, 3]], ["SP", 1, 0, 50176, [2], 1], ["AN", 1, 0, 5], ["AN", 1, 1, 6]]]], "r": [[2.14295e-05, 2.14549e-05, 2.14535e-05], 0, 0.887576, 1668061523], "v": "v0.6"}
{"i": [["[\"roll\", 1, 7, 7, 1024, 3, \"float16\"]", "cuda -keys=cuda,gpu -max_num_threads=1024 -model=unknown -thread_warp_size=32", [-1, 16, 64, 49152, 2147483647, 1024, 8, 32], "", 0, []], [[], [["FU", 1, [0, 1, 2, 3]], ["SP", 1, 0, 50176, [56], 1], ["AN", 1, 0, 5], ["AN", 1, 1, 6]]]], "r": [[3.14556e-06, 3.14367e-06, 3.14318e-06], 0, 2.26354, 1668061524], "v": "v0.6"}
{"i": [["[\"roll\", 1, 7, 7, 1024, 3, \"float16\"]", "cuda -keys=cuda,gpu -max_num_threads=1024 -model=unknown -thread_warp_size=32", [-1, 16, 64, 49152, 2147483647, 1024, 8, 32], "", 0, []], [[], [["FU", 1, [0, 1, 2, 3]], ["SP", 1, 0, 50176, [64], 1], ["AN", 1, 0, 5], ["AN", 1, 1, 6]]]], "r": [[3.11482e-06, 3.11611e-06, 3.11559e-06], 0, 3.31451, 1668061525], "v": "v0.6"}
{"i": [["[\"roll\", 1, 7, 7, 1024, 3, \"float16\"]", "cuda -keys=cuda,gpu -max_num_threads=1024 -model=unknown -thread_warp_size=32", [-1, 16, 64, 49152, 2147483647, 1024, 8, 32], "", 0, []], [[], [["FU", 1, [0, 1, 2, 3]], ["SP", 1, 0, 50176, [4], 1], ["AN", 1, 0, 5], ["AN", 1, 1, 6]]]], "r": [[1.20548e-05, 1.20649e-05, 1.2062e-05], 0, 3.70788, 1668061526], "v": "v0.6"}
{"i": [["[\"roll\", 1, 7, 7, 1024, 3, \"float16\"]", "cuda -keys=cuda,gpu -max_num_threads=1024 -model=unknown -thread_warp_size=32", [-1, 16, 64, 49152, 2147483647, 1024, 8, 32], "", 0, []], [[], [["FU", 1, [0, 1, 2, 3]], ["SP", 1, 0, 50176, [32], 1], ["AN", 1, 0, 5], ["AN", 1, 1, 6]]]], "r": [[3.69939e-06, 3.71518e-06, 3.71234e-06], 0, 2.96946, 1668061525], "v": "v0.6"}
{"i": [["[\"roll\", 1, 7, 7, 1024, 3, \"float16\"]", "cuda -keys=cuda,gpu -max_num_threads=1024 -model=unknown -thread_warp_size=32", [-1, 16, 64, 49152, 2147483647, 1024, 8, 32], "", 0, []], [[], [["FU", 1, [0, 1, 2, 3]], ["SP", 1, 0, 50176, [1], 1], ["AN", 1, 0, 5], ["AN", 1, 1, 6]]]], "r": [[4.00558e-05, 4.00654e-05, 4.00583e-05], 0, 4.3478, 1668061526], "v": "v0.6"}
{"i": [["[\"roll\", 1, 7, 7, 1024, 3, \"float16\"]", "cuda -keys=cuda,gpu -max_num_threads=1024 -model=unknown -thread_warp_size=32", [-1, 16, 64, 49152, 2147483647, 1024, 8, 32], "", 0, []], [[], [["FU", 1, [0, 1, 2, 3]], ["SP", 1, 0, 50176, [49], 1], ["AN", 1, 0, 5], ["AN", 1, 1, 6]]]], "r": [[3.27537e-06, 3.28569e-06, 3.28185e-06], 0, 4.00347, 1668061526], "v": "v0.6"}
