python/models/swin_transformer/kernel_configs/swin_transformer_patch_embed_transpose_1_224_224_128_float16.log
{"i": [["[\"patch_embed_transpose\", 1, 224, 224, 128, \"float16\"]", "cuda -keys=cuda,gpu -max_num_threads=1024 -model=unknown -thread_warp_size=32", [-1, 16, 64, 49152, 2147483647, 1024, 8, 32], "", 0, []], [[], [["FU", 1, [0, 1, 2, 3]], ["SP", 1, 0, 6422528, [2], 1], ["AN", 1, 0, 5], ["AN", 1, 1, 6]]]], "r": [[0.00238369, 0.00238372, 0.00238372], 0, 4.02642, 1668020668], "v": "v0.6"}
{"i": [["[\"patch_embed_transpose\", 1, 224, 224, 128, \"float16\"]", "cuda -keys=cuda,gpu -max_num_threads=1024 -model=unknown -thread_warp_size=32", [-1, 16, 64, 49152, 2147483647, 1024, 8, 32], "", 0, []], [[], [["FU", 1, [0, 1, 2, 3]], ["SP", 1, 0, 6422528, [16], 1], ["AN", 1, 0, 5], ["AN", 1, 1, 6]]]], "r": [[0.000301759, 0.000301809, 0.000301603], 0, 4.77513, 1668020669], "v": "v0.6"}
{"i": [["[\"patch_embed_transpose\", 1, 224, 224, 128, \"float16\"]", "cuda -keys=cuda,gpu -max_num_threads=1024 -model=unknown -thread_warp_size=32", [-1, 16, 64, 49152, 2147483647, 1024, 8, 32], "", 0, []], [[], [["FU", 1, [0, 1, 2, 3]], ["SP", 1, 0, 6422528, [1], 1], ["AN", 1, 0, 5], ["AN", 1, 1, 6]]]], "r": [[0.00476212, 0.00476225, 0.00476228], 0, 3.27119, 1668020668], "v": "v0.6"}
{"i": [["[\"patch_embed_transpose\", 1, 224, 224, 128, \"float16\"]", "cuda -keys=cuda,gpu -max_num_threads=1024 -model=unknown -thread_warp_size=32", [-1, 16, 64, 49152, 2147483647, 1024, 8, 32], "", 0, []], [[], [["FU", 1, [0, 1, 2, 3]], ["SP", 1, 0, 6422528, [8], 1], ["AN", 1, 0, 5], ["AN", 1, 1, 6]]]], "r": [[0.000598388, 0.000598339, 0.000598265], 0, 1.69386, 1668020666], "v": "v0.6"}
{"i": [["[\"patch_embed_transpose\", 1, 224, 224, 128, \"float16\"]", "cuda -keys=cuda,gpu -max_num_threads=1024 -model=unknown -thread_warp_size=32", [-1, 16, 64, 49152, 2147483647, 1024, 8, 32], "", 0, []], [[], [["FU", 1, [0, 1, 2, 3]], ["SP", 1, 0, 6422528, [64], 1], ["AN", 1, 0, 5], ["AN", 1, 1, 6]]]], "r": [[8.02173e-05, 8.02063e-05, 8.0127e-05], 0, 1.00451, 1668020665], "v": "v0.6"}
{"i": [["[\"patch_embed_transpose\", 1, 224, 224, 128, \"float16\"]", "cuda -keys=cuda,gpu -max_num_threads=1024 -model=unknown -thread_warp_size=32", [-1, 16, 64, 49152, 2147483647, 1024, 8, 32], "", 0, []], [[], [["FU", 1, [0, 1, 2, 3]], ["SP", 1, 0, 6422528, [7], 1], ["AN", 1, 0, 5], ["AN", 1, 1, 6]]]], "r": [[0.000683295, 0.00068336, 0.000683179], 0, 2.44465, 1668020667], "v": "v0.6"}
{"i": [["[\"patch_embed_transpose\", 1, 224, 224, 128, \"float16\"]", "cuda -keys=cuda,gpu -max_num_threads=1024 -model=unknown -thread_warp_size=32", [-1, 16, 64, 49152, 2147483647, 1024, 8, 32], "", 0, []], [[], [["FU", 1, [0, 1, 2, 3]], ["SP", 1, 0, 6422528, [56], 1], ["AN", 1, 0, 5], ["AN", 1, 1, 6]]]], "r": [[8.89446e-05, 8.88905e-05, 8.88664e-05], 0, 6.31987, 1668020671], "v": "v0.6"}
{"i": [["[\"patch_embed_transpose\", 1, 224, 224, 128, \"float16\"]", "cuda -keys=cuda,gpu -max_num_threads=1024 -model=unknown -thread_warp_size=32", [-1, 16, 64, 49152, 2147483647, 1024, 8, 32], "", 0, []], [[], [["FU", 1, [0, 1, 2, 3]], ["SP", 1, 0, 6422528, [28], 1], ["AN", 1, 0, 5], ["AN", 1, 1, 6]]]], "r": [[0.000173241, 0.000173187, 0.000173153], 0, 5.55788, 1668020670], "v": "v0.6"}
{"i": [["[\"patch_embed_transpose\", 1, 224, 224, 128, \"float16\"]", "cuda -keys=cuda,gpu -max_num_threads=1024 -model=unknown -thread_warp_size=32", [-1, 16, 64, 49152, 2147483647, 1024, 8, 32], "", 0, []], [[], [["FU", 1, [0, 1, 2, 3]], ["SP", 1, 0, 6422528, [32], 1], ["AN", 1, 0, 5], ["AN", 1, 1, 6]]]], "r": [[0.000151965, 0.000151933, 0.000151906], 0, 7.04896, 1668020671], "v": "v0.6"}
{"i": [["[\"patch_embed_transpose\", 1, 224, 224, 128, \"float16\"]", "cuda -keys=cuda,gpu -max_num_threads=1024 -model=unknown -thread_warp_size=32", [-1, 16, 64, 49152, 2147483647, 1024, 8, 32], "", 0, []], [[], [["FU", 1, [0, 1, 2, 3]], ["SP", 1, 0, 6422528, [14], 1], ["AN", 1, 0, 5], ["AN", 1, 1, 6]]]], "r": [[0.000343411, 0.000343347, 0.000343291], 0, 7.8367, 1668020672], "v": "v0.6"}
{"i": [["[\"patch_embed_transpose\", 1, 224, 224, 128, \"float16\"]", "cuda -keys=cuda,gpu -max_num_threads=1024 -model=unknown -thread_warp_size=32", [-1, 16, 64, 49152, 2147483647, 1024, 8, 32], "", 0, []], [[], [["FU", 1, [0, 1, 2, 3]], ["SP", 1, 0, 6422528, [4], 1], ["AN", 1, 0, 5], ["AN", 1, 1, 6]]]], "r": [[0.00119343, 0.00119329, 0.00119327], 0, 9.34058, 1668020674], "v": "v0.6"}
{"i": [["[\"patch_embed_transpose\", 1, 224, 224, 128, \"float16\"]", "cuda -keys=cuda,gpu -max_num_threads=1024 -model=unknown -thread_warp_size=32", [-1, 16, 64, 49152, 2147483647, 1024, 8, 32], "", 0, []], [[], [["FU", 1, [0, 1, 2, 3]], ["SP", 1, 0, 6422528, [49], 1], ["AN", 1, 0, 5], ["AN", 1, 1, 6]]]], "r": [[0.000100438, 0.000100413, 0.000100374], 0, 8.59021, 1668020673], "v": "v0.6"}
