python/models/swin_transformer/kernel_configs/swin_transformer_fused_window_reverse_roll_add_1_28_28_256_0_7_float16.log
{"i": [["[\"fused_window_reverse_roll_add\", 1, 28, 28, 256, 0, 7, \"float16\"]", "cuda -keys=cuda,gpu -max_num_threads=1024 -model=unknown -thread_warp_size=32", [-1, 16, 64, 49152, 2147483647, 1024, 8, 32], "", 0, []], [[], [["FU", 2, [0, 1, 2, 3]], ["SP", 2, 0, 200704, [32], 1], ["AN", 2, 0, 5], ["AN", 2, 1, 6]]]], "r": [[7.44501e-06, 7.50706e-06, 7.44404e-06, 7.44163e-06, 7.46934e-06, 7.43893e-06, 7.45596e-06, 7.57506e-06, 7.46953e-06, 7.43613e-06], 0, 11.0783, 1652003208], "v": "v0.6"}
{"i": [["[\"fused_window_reverse_roll_add\", 1, 28, 28, 256, 0, 7, \"float16\"]", "cuda -keys=cuda,gpu -max_num_threads=1024 -model=unknown -thread_warp_size=32", [-1, 16, 64, 49152, 2147483647, 1024, 8, 32], "", 0, []], [[], [["FU", 2, [0, 1, 2, 3]], ["SP", 2, 0, 200704, [2], 1], ["AN", 2, 0, 5], ["AN", 2, 1, 6]]]], "r": [[7.71601e-05, 7.71661e-05, 7.71703e-05, 7.71632e-05, 7.71586e-05, 7.71597e-05, 7.71648e-05, 7.72012e-05, 7.71973e-05, 7.71804e-05], 0, 16.5965, 1652003213], "v": "v0.6"}
{"i": [["[\"fused_window_reverse_roll_add\", 1, 28, 28, 256, 0, 7, \"float16\"]", "cuda -keys=cuda,gpu -max_num_threads=1024 -model=unknown -thread_warp_size=32", [-1, 16, 64, 49152, 2147483647, 1024, 8, 32], "", 0, []], [[], [["FU", 2, [0, 1, 2, 3]], ["SP", 2, 0, 200704, [16], 1], ["AN", 2, 0, 5], ["AN", 2, 1, 6]]]], "r": [[1.20676e-05, 1.20665e-05, 1.20671e-05, 1.20653e-05, 1.20712e-05, 1.2065e-05, 1.20647e-05, 1.20653e-05, 1.20644e-05, 1.2066e-05], 0, 24.4216, 1652003221], "v": "v0.6"}
{"i": [["[\"fused_window_reverse_roll_add\", 1, 28, 28, 256, 0, 7, \"float16\"]", "cuda -keys=cuda,gpu -max_num_threads=1024 -model=unknown -thread_warp_size=32", [-1, 16, 64, 49152, 2147483647, 1024, 8, 32], "", 0, []], [[], [["FU", 2, [0, 1, 2, 3]], ["SP", 2, 0, 200704, [8], 1], ["AN", 2, 0, 5], ["AN", 2, 1, 6]]]], "r": [[2.15688e-05, 2.15785e-05, 2.15689e-05, 2.15715e-05, 2.15672e-05, 2.15658e-05, 2.15683e-05, 2.15685e-05, 2.15692e-05, 2.15701e-05], 0, 37.8782, 1652003235], "v": "v0.6"}
{"i": [["[\"fused_window_reverse_roll_add\", 1, 28, 28, 256, 0, 7, \"float16\"]", "cuda -keys=cuda,gpu -max_num_threads=1024 -model=unknown -thread_warp_size=32", [-1, 16, 64, 49152, 2147483647, 1024, 8, 32], "", 0, []], [[], [["FU", 2, [0, 1, 2, 3]], ["SP", 2, 0, 200704, [14], 1], ["AN", 2, 0, 5], ["AN", 2, 1, 6]]]], "r": [[1.34749e-05, 1.34734e-05, 1.34732e-05, 1.34852e-05, 1.34816e-05, 1.34743e-05, 1.34744e-05, 1.34763e-05, 1.34763e-05, 1.3474e-05], 0, 29.2201, 1652003226], "v": "v0.6"}
{"i": [["[\"fused_window_reverse_roll_add\", 1, 28, 28, 256, 0, 7, \"float16\"]", "cuda -keys=cuda,gpu -max_num_threads=1024 -model=unknown -thread_warp_size=32", [-1, 16, 64, 49152, 2147483647, 1024, 8, 32], "", 0, []], [[], [["FU", 2, [0, 1, 2, 3]], ["SP", 2, 0, 200704, [56], 1], ["AN", 2, 0, 5], ["AN", 2, 1, 6]]]], "r": [[5.26033e-06, 5.2622e-06, 5.61172e-06, 5.47615e-06, 5.41798e-06, 5.32647e-06, 5.26747e-06, 5.43529e-06, 5.77835e-06, 5.26005e-06], 0, 20.2567, 1652003217], "v": "v0.6"}
{"i": [["[\"fused_window_reverse_roll_add\", 1, 28, 28, 256, 0, 7, \"float16\"]", "cuda -keys=cuda,gpu -max_num_threads=1024 -model=unknown -thread_warp_size=32", [-1, 16, 64, 49152, 2147483647, 1024, 8, 32], "", 0, []], [[], [["FU", 2, [0, 1, 2, 3]], ["SP", 2, 0, 200704, [1], 1], ["AN", 2, 0, 5], ["AN", 2, 1, 6]]]], "r": [[0.000151652, 0.000151584, 0.000151606, 0.000151586, 0.000151575, 0.000151586, 0.000151586, 0.000151591, 0.000151598, 0.000151615], 0, 5.37666, 1652003202], "v": "v0.6"}
{"i": [["[\"fused_window_reverse_roll_add\", 1, 28, 28, 256, 0, 7, \"float16\"]", "cuda -keys=cuda,gpu -max_num_threads=1024 -model=unknown -thread_warp_size=32", [-1, 16, 64, 49152, 2147483647, 1024, 8, 32], "", 0, []], [[], [["FU", 2, [0, 1, 2, 3]], ["SP", 2, 0, 200704, [7], 1], ["AN", 2, 0, 5], ["AN", 2, 1, 6]]]], "r": [[2.42815e-05, 2.42817e-05, 2.42806e-05, 2.42712e-05, 2.4273e-05, 2.4276e-05, 2.42725e-05, 2.42759e-05, 2.42844e-05, 2.42829e-05], 0, 47.0298, 1652003244], "v": "v0.6"}
{"i": [["[\"fused_window_reverse_roll_add\", 1, 28, 28, 256, 0, 7, \"float16\"]", "cuda -keys=cuda,gpu -max_num_threads=1024 -model=unknown -thread_warp_size=32", [-1, 16, 64, 49152, 2147483647, 1024, 8, 32], "", 0, []], [[], [["FU", 2, [0, 1, 2, 3]], ["SP", 2, 0, 200704, [28], 1], ["AN", 2, 0, 5], ["AN", 2, 1, 6]]]], "r": [[8.13909e-06, 8.13791e-06, 8.13845e-06, 8.1387e-06, 8.14082e-06, 8.33471e-06, 8.1399e-06, 8.14002e-06, 8.14145e-06, 8.16565e-06], 0, 32.9272, 1652003230], "v": "v0.6"}
{"i": [["[\"fused_window_reverse_roll_add\", 1, 28, 28, 256, 0, 7, \"float16\"]", "cuda -keys=cuda,gpu -max_num_threads=1024 -model=unknown -thread_warp_size=32", [-1, 16, 64, 49152, 2147483647, 1024, 8, 32], "", 0, []], [[], [["FU", 2, [0, 1, 2, 3]], ["SP", 2, 0, 200704, [64], 1], ["AN", 2, 0, 5], ["AN", 2, 1, 6]]]], "r": [[5.36891e-06, 4.83136e-06, 5.22268e-06, 4.82844e-06, 5.05976e-06, 5.39338e-06, 5.07707e-06, 4.85899e-06, 5.25583e-06, 4.82745e-06], 0, 43.4597, 1652003240], "v": "v0.6"}
{"i": [["[\"fused_window_reverse_roll_add\", 1, 28, 28, 256, 0, 7, \"float16\"]", "cuda -keys=cuda,gpu -max_num_threads=1024 -model=unknown -thread_warp_size=32", [-1, 16, 64, 49152, 2147483647, 1024, 8, 32], "", 0, []], [[], [["FU", 2, [0, 1, 2, 3]], ["SP", 2, 0, 200704, [4], 1], ["AN", 2, 0, 5], ["AN", 2, 1, 6]]]], "r": [[4.00432e-05, 4.00457e-05, 4.00427e-05, 4.00425e-05, 4.00357e-05, 4.00444e-05, 4.00433e-05, 4.00405e-05, 4.00387e-05, 4.00388e-05], 0, 52.4088, 1652003250], "v": "v0.6"}
{"i": [["[\"fused_window_reverse_roll_add\", 1, 28, 28, 256, 0, 7, \"float16\"]", "cuda -keys=cuda,gpu -max_num_threads=1024 -model=unknown -thread_warp_size=32", [-1, 16, 64, 49152, 2147483647, 1024, 8, 32], "", 0, []], [[], [["FU", 2, [0, 1, 2, 3]], ["SP", 2, 0, 200704, [49], 1], ["AN", 2, 0, 5], ["AN", 2, 1, 6]]]], "r": [[5.73703e-06, 5.7292e-06, 5.80873e-06, 5.72016e-06, 5.8723e-06, 5.77526e-06, 5.72056e-06, 5.77859e-06, 5.80679e-06, 5.72127e-06], 0, 57.9413, 1652003255], "v": "v0.6"}
