python/models/swin_transformer/kernel_configs/swin_transform_auto_tvm_tune_fused_matmul_tensorcore_add_1_16_16_2048_512.log
{"input": ["cuda -keys=cuda,gpu -max_num_threads=1024 -thread_warp_size=32", "fused_matmul_tensorcore_add.cuda", [["TENSOR", [256, 2048], "float16"], ["TENSOR", [256, 2048], "float16"], ["TENSOR", [512, 2048], "float16"]], {}], "config": {"index": 6349, "code_hash": null, "entity": [["block_row_warps", "ot", 2], ["block_col_warps", "ot", 2], ["warp_row_tiles", "ot", 1], ["warp_col_tiles", "ot", 2], ["chunk", "ot", 4], ["offset", "ot", 8], ["offsetCS", "ot", 8], ["vec", "ot", 1], ["wmma_m", "ot", 16]]}, "result": [[9.4744519e-05], 0, 1.2455263137817383, 1651810901.357934], "version": 0.2, "tvm_version": "0.8.0"}
{"input": ["cuda -keys=cuda,gpu -max_num_threads=1024 -thread_warp_size=32", "fused_matmul_tensorcore_add.cuda", [["TENSOR", [256, 2048], "float16"], ["TENSOR", [256, 2048], "float16"], ["TENSOR", [512, 2048], "float16"]], {}], "config": {"index": 13420, "code_hash": null, "entity": [["block_row_warps", "ot", 2], ["block_col_warps", "ot", 1], ["warp_row_tiles", "ot", 1], ["warp_col_tiles", "ot", 4], ["chunk", "ot", 2], ["offset", "ot", 8], ["offsetCS", "ot", 0], ["vec", "ot", 4], ["wmma_m", "ot", 8]]}, "result": [[3.9189804e-05], 0, 1.0174109935760498, 1651810901.979323], "version": 0.2, "tvm_version": "0.8.0"}
{"input": ["cuda -keys=cuda,gpu -max_num_threads=1024 -thread_warp_size=32", "fused_matmul_tensorcore_add.cuda", [["TENSOR", [256, 2048], "float16"], ["TENSOR", [256, 2048], "float16"], ["TENSOR", [512, 2048], "float16"]], {}], "config": {"index": 7119, "code_hash": null, "entity": [["block_row_warps", "ot", 1], ["block_col_warps", "ot", 1], ["warp_row_tiles", "ot", 4], ["warp_col_tiles", "ot", 4], ["chunk", "ot", 8], ["offset", "ot", 8], ["offsetCS", "ot", 0], ["vec", "ot", 2], ["wmma_m", "ot", 16]]}, "result": [[0.000159784296], 0, 1.5782065391540527, 1651810903.6055136], "version": 0.2, "tvm_version": "0.8.0"}
{"input": ["cuda -keys=cuda,gpu -max_num_threads=1024 -thread_warp_size=32", "fused_matmul_tensorcore_add.cuda", [["TENSOR", [256, 2048], "float16"], ["TENSOR", [256, 2048], "float16"], ["TENSOR", [512, 2048], "float16"]], {}], "config": {"index": 4063, "code_hash": null, "entity": [["block_row_warps", "ot", 2], ["block_col_warps", "ot", 2], ["warp_row_tiles", "ot", 2], ["warp_col_tiles", "ot", 1], ["chunk", "ot", 4], ["offset", "ot", 0], ["offsetCS", "ot", 0], ["vec", "ot", 8], ["wmma_m", "ot", 32]]}, "result": [[7.254811100000001e-05], 0, 1.077394723892212, 1651810904.8608954], "version": 0.2, "tvm_version": "0.8.0"}
{"input": ["cuda -keys=cuda,gpu -max_num_threads=1024 -thread_warp_size=32", "fused_matmul_tensorcore_add.cuda", [["TENSOR", [256, 2048], "float16"], ["TENSOR", [256, 2048], "float16"], ["TENSOR", [512, 2048], "float16"]], {}], "config": {"index": 7176, "code_hash": null, "entity": [["block_row_warps", "ot", 1], ["block_col_warps", "ot", 2], ["warp_row_tiles", "ot", 4], ["warp_col_tiles", "ot", 2], ["chunk", "ot", 1], ["offset", "ot", 0], ["offsetCS", "ot", 8], ["vec", "ot", 2], ["wmma_m", "ot", 16]]}, "result": [[6.759455899999999e-05], 0, 1.0946121215820312, 1651810906.114139], "version": 0.2, "tvm_version": "0.8.0"}
{"input": ["cuda -keys=cuda,gpu -max_num_threads=1024 -thread_warp_size=32", "fused_matmul_tensorcore_add.cuda", [["TENSOR", [256, 2048], "float16"], ["TENSOR", [256, 2048], "float16"], ["TENSOR", [512, 2048], "float16"]], {}], "config": {"index": 5068, "code_hash": null, "entity": [["block_row_warps", "ot", 2], ["block_col_warps", "ot", 1], ["warp_row_tiles", "ot", 4], ["warp_col_tiles", "ot", 2], ["chunk", "ot", 4], ["offset", "ot", 8], ["offsetCS", "ot", 8], ["vec", "ot", 8], ["wmma_m", "ot", 32]]}, "result": [[4.4032271e-05], 0, 1.1013462543487549, 1651810906.747532], "version": 0.2, "tvm_version": "0.8.0"}
{"input": ["cuda -keys=cuda,gpu -max_num_threads=1024 -thread_warp_size=32", "fused_matmul_tensorcore_add.cuda", [["TENSOR", [256, 2048], "float16"], ["TENSOR", [256, 2048], "float16"], ["TENSOR", [512, 2048], "float16"]], {}], "config": {"index": 11561, "code_hash": null, "entity": [["block_row_warps", "ot", 4], ["block_col_warps", "ot", 2], ["warp_row_tiles", "ot", 1], ["warp_col_tiles", "ot", 4], ["chunk", "ot", 4], ["offset", "ot", 8], ["offsetCS", "ot", 8], ["vec", "ot", 1], ["wmma_m", "ot", 8]]}, "result": [[7.8207761e-05], 0, 1.263875961303711, 1651810907.4721558], "version": 0.2, "tvm_version": "0.8.0"}
{"input": ["cuda -keys=cuda,gpu -max_num_threads=1024 -thread_warp_size=32", "fused_matmul_tensorcore_add.cuda", [["TENSOR", [256, 2048], "float16"], ["TENSOR", [256, 2048], "float16"], ["TENSOR", [512, 2048], "float16"]], {}], "config": {"index": 1714, "code_hash": null, "entity": [["block_row_warps", "ot", 2], ["block_col_warps", "ot", 2], ["warp_row_tiles", "ot", 2], ["warp_col_tiles", "ot", 1], ["chunk", "ot", 2], ["offset", "ot", 8], ["offsetCS", "ot", 0], ["vec", "ot", 2], ["wmma_m", "ot", 32]]}, "result": [[4.2235075e-05], 0, 1.1434547901153564, 1651810908.1087077], "version": 0.2, "tvm_version": "0.8.0"}
{"input": ["cuda -keys=cuda,gpu -max_num_threads=1024 -thread_warp_size=32", "fused_matmul_tensorcore_add.cuda", [["TENSOR", [256, 2048], "float16"], ["TENSOR", [256, 2048], "float16"], ["TENSOR", [512, 2048], "float16"]], {}], "config": {"index": 2403, "code_hash": null, "entity": [["block_row_warps", "ot", 1], ["block_col_warps", "ot", 1], ["warp_row_tiles", "ot", 1], ["warp_col_tiles", "ot", 4], ["chunk", "ot", 2], ["offset", "ot", 8], ["offsetCS", "ot", 8], ["vec", "ot", 2], ["wmma_m", "ot", 32]]}, "result": [[3.888684e-05], 0, 1.101156234741211, 1651810909.2832925], "version": 0.2, "tvm_version": "0.8.0"}
{"input": ["cuda -keys=cuda,gpu -max_num_threads=1024 -thread_warp_size=32", "fused_matmul_tensorcore_add.cuda", [["TENSOR", [256, 2048], "float16"], ["TENSOR", [256, 2048], "float16"], ["TENSOR", [512, 2048], "float16"]], {}], "config": {"index": 9100, "code_hash": null, "entity": [["block_row_warps", "ot", 2], ["block_col_warps", "ot", 1], ["warp_row_tiles", "ot", 1], ["warp_col_tiles", "ot", 2], ["chunk", "ot", 1], ["offset", "ot", 0], ["offsetCS", "ot", 0], ["vec", "ot", 8], ["wmma_m", "ot", 16]]}, "result": [[3.0809764e-05], 0, 0.9455170631408691, 1651810910.4274502], "version": 0.2, "tvm_version": "0.8.0"}
{"input": ["cuda -keys=cuda,gpu -max_num_threads=1024 -thread_warp_size=32", "fused_matmul_tensorcore_add.cuda", [["TENSOR", [256, 2048], "float16"], ["TENSOR", [256, 2048], "float16"], ["TENSOR", [512, 2048], "float16"]], {}], "config": {"index": 12244, "code_hash": null, "entity": [["block_row_warps", "ot", 2], ["block_col_warps", "ot", 2], ["warp_row_tiles", "ot", 2], ["warp_col_tiles", "ot", 1], ["chunk", "ot", 8], ["offset", "ot", 8], ["offsetCS", "ot", 0], ["vec", "ot", 2], ["wmma_m", "ot", 8]]}, "result": [[2.0462388000000003e-05], 0, 1.0969927310943604, 1651810911.01884], "version": 0.2, "tvm_version": "0.8.0"}
{"input": ["cuda -keys=cuda,gpu -max_num_threads=1024 -thread_warp_size=32", "fused_matmul_tensorcore_add.cuda", [["TENSOR", [256, 2048], "float16"], ["TENSOR", [256, 2048], "float16"], ["TENSOR", [512, 2048], "float16"]], {}], "config": {"index": 11927, "code_hash": null, "entity": [["block_row_warps", "ot", 4], ["block_col_warps", "ot", 1], ["warp_row_tiles", "ot", 4], ["warp_col_tiles", "ot", 1], ["chunk", "ot", 8], ["offset", "ot", 0], ["offsetCS", "ot", 0], ["vec", "ot", 2], ["wmma_m", "ot", 8]]}, "result": [[8.8938142e-05], 0, 1.3032193183898926, 1651810912.408587], "version": 0.2, "tvm_version": "0.8.0"}
{"input": ["cuda -keys=cuda,gpu -max_num_threads=1024 -thread_warp_size=32", "fused_matmul_tensorcore_add.cuda", [["TENSOR", [256, 2048], "float16"], ["TENSOR", [256, 2048], "float16"], ["TENSOR", [512, 2048], "float16"]], {}], "config": {"index": 9968, "code_hash": null, "entity": [["block_row_warps", "ot", 4], ["block_col_warps", "ot", 2], ["warp_row_tiles", "ot", 1], ["warp_col_tiles", "ot", 1], ["chunk", "ot", 8], ["offset", "ot", 0], ["offsetCS", "ot", 8], ["vec", "ot", 8], ["wmma_m", "ot", 16]]}, "result": [[5.8249274999999996e-05], 0, 1.007558822631836, 1651810913.0494952], "version": 0.2, "tvm_version": "0.8.0"}
{"input": ["cuda -keys=cuda,gpu -max_num_threads=1024 -thread_warp_size=32", "fused_matmul_tensorcore_add.cuda", [["TENSOR", [256, 2048], "float16"], ["TENSOR", [256, 2048], "float16"], ["TENSOR", [512, 2048], "float16"]], {}], "config": {"index": 14755, "code_hash": null, "entity": [["block_row_warps", "ot", 2], ["block_col_warps", "ot", 2], ["warp_row_tiles", "ot", 2], ["warp_col_tiles", "ot", 1], ["chunk", "ot", 4], ["offset", "ot", 8], ["offsetCS", "ot", 0], ["vec", "ot", 8], ["wmma_m", "ot", 8]]}, "result": [[2.3408494e-05], 0, 0.9809727668762207, 1651810914.1782665], "version": 0.2, "tvm_version": "0.8.0"}
{"input": ["cuda -keys=cuda,gpu -max_num_threads=1024 -thread_warp_size=32", "fused_matmul_tensorcore_add.cuda", [["TENSOR", [256, 2048], "float16"], ["TENSOR", [256, 2048], "float16"], ["TENSOR", [512, 2048], "float16"]], {}], "config": {"index": 5913, "code_hash": null, "entity": [["block_row_warps", "ot", 1], ["block_col_warps", "ot", 1], ["warp_row_tiles", "ot", 1], ["warp_col_tiles", "ot", 1], ["chunk", "ot", 2], ["offset", "ot", 0], ["offsetCS", "ot", 8], ["vec", "ot", 1], ["wmma_m", "ot", 16]]}, "result": [[5.2801057e-05], 0, 1.0231776237487793, 1651810914.7698908], "version": 0.2, "tvm_version": "0.8.0"}
{"input": ["cuda -keys=cuda,gpu -max_num_threads=1024 -thread_warp_size=32", "fused_matmul_tensorcore_add.cuda", [["TENSOR", [256, 2048], "float16"], ["TENSOR", [256, 2048], "float16"], ["TENSOR", [512, 2048], "float16"]], {}], "config": {"index": 13500, "code_hash": null, "entity": [["block_row_warps", "ot", 1], ["block_col_warps", "ot", 1], ["warp_row_tiles", "ot", 1], ["warp_col_tiles", "ot", 4], ["chunk", "ot", 4], ["offset", "ot", 8], ["offsetCS", "ot", 0], ["vec", "ot", 4], ["wmma_m", "ot", 8]]}, "result": [[4.1011007000000003e-05], 0, 1.1528141498565674, 1651810915.9309669], "version": 0.2, "tvm_version": "0.8.0"}
{"input": ["cuda -keys=cuda,gpu -max_num_threads=1024 -thread_warp_size=32", "fused_matmul_tensorcore_add.cuda", [["TENSOR", [256, 2048], "float16"], ["TENSOR", [256, 2048], "float16"], ["TENSOR", [512, 2048], "float16"]], {}], "config": {"index": 10651, "code_hash": null, "entity": [["block_row_warps", "ot", 2], ["block_col_warps", "ot", 2], ["warp_row_tiles", "ot", 2], ["warp_col_tiles", "ot", 2], ["chunk", "ot", 8], ["offset", "ot", 0], ["offsetCS", "ot", 0], ["vec", "ot", 1], ["wmma_m", "ot", 8]]}, "result": [[9.295103299999999e-05], 0, 1.4437298774719238, 1651810916.792839], "version": 0.2, "tvm_version": "0.8.0"}
{"input": ["cuda -keys=cuda,gpu -max_num_threads=1024 -thread_warp_size=32", "fused_matmul_tensorcore_add.cuda", [["TENSOR", [256, 2048], "float16"], ["TENSOR", [256, 2048], "float16"], ["TENSOR", [512, 2048], "float16"]], {}], "config": {"index": 11855, "code_hash": null, "entity": [["block_row_warps", "ot", 4], ["block_col_warps", "ot", 1], ["warp_row_tiles", "ot", 1], ["warp_col_tiles", "ot", 2], ["chunk", "ot", 4], ["offset", "ot", 0], ["offsetCS", "ot", 0], ["vec", "ot", 2], ["wmma_m", "ot", 8]]}, "result": [[7.333328e-05], 0, 1.0830357074737549, 1651810918.0680363], "version": 0.2, "tvm_version": "0.8.0"}
{"input": ["cuda -keys=cuda,gpu -max_num_threads=1024 -thread_warp_size=32", "fused_matmul_tensorcore_add.cuda", [["TENSOR", [256, 2048], "float16"], ["TENSOR", [256, 2048], "float16"], ["TENSOR", [512, 2048], "float16"]], {}], "config": {"index": 7277, "code_hash": null, "entity": [["block_row_warps", "ot", 4], ["block_col_warps", "ot", 2], ["warp_row_tiles", "ot", 2], ["warp_col_tiles", "ot", 4], ["chunk", "ot", 2], ["offset", "ot", 0], ["offsetCS", "ot", 8], ["vec", "ot", 2], ["wmma_m", "ot", 16]]}, "result": [[0.000149018991], 0, 1.5440170764923096, 1651814398.56175], "version": 0.2, "tvm_version": "0.8.0"}
{"input": ["cuda -keys=cuda,gpu -max_num_threads=1024 -thread_warp_size=32", "fused_matmul_tensorcore_add.cuda", [["TENSOR", [256, 2048], "float16"], ["TENSOR", [256, 2048], "float16"], ["TENSOR", [512, 2048], "float16"]], {}], "config": {"index": 10428, "code_hash": null, "entity": [["block_row_warps", "ot", 1], ["block_col_warps", "ot", 4], ["warp_row_tiles", "ot", 1], ["warp_col_tiles", "ot", 4], ["chunk", "ot", 1], ["offset", "ot", 0], ["offsetCS", "ot", 0], ["vec", "ot", 1], ["wmma_m", "ot", 8]]}, "result": [[0.00021434191999999998], 0, 1.959364891052246, 1651814399.7486398], "version": 0.2, "tvm_version": "0.8.0"}
{"input": ["cuda -keys=cuda,gpu -max_num_threads=1024 -thread_warp_size=32", "fused_matmul_tensorcore_add.cuda", [["TENSOR", [256, 2048], "float16"], ["TENSOR", [256, 2048], "float16"], ["TENSOR", [512, 2048], "float16"]], {}], "config": {"index": 8431, "code_hash": null, "entity": [["block_row_warps", "ot", 2], ["block_col_warps", "ot", 4], ["warp_row_tiles", "ot", 1], ["warp_col_tiles", "ot", 1], ["chunk", "ot", 1], ["offset", "ot", 0], ["offsetCS", "ot", 8], ["vec", "ot", 4], ["wmma_m", "ot", 16]]}, "result": [[6.1918258e-05], 0, 1.260984182357788, 1651814401.6047063], "version": 0.2, "tvm_version": "0.8.0"}
{"input": ["cuda -keys=cuda,gpu -max_num_threads=1024 -thread_warp_size=32", "fused_matmul_tensorcore_add.cuda", [["TENSOR", [256, 2048], "float16"], ["TENSOR", [256, 2048], "float16"], ["TENSOR", [512, 2048], "float16"]], {}], "config": {"index": 1981, "code_hash": null, "entity": [["block_row_warps", "ot", 2], ["block_col_warps", "ot", 1], ["warp_row_tiles", "ot", 2], ["warp_col_tiles", "ot", 2], ["chunk", "ot", 1], ["offset", "ot", 0], ["offsetCS", "ot", 8], ["vec", "ot", 2], ["wmma_m", "ot", 32]]}, "result": [[0.000102905886], 0, 1.3736183643341064, 1651814402.962691], "version": 0.2, "tvm_version": "0.8.0"}
{"input": ["cuda -keys=cuda,gpu -max_num_threads=1024 -thread_warp_size=32", "fused_matmul_tensorcore_add.cuda", [["TENSOR", [256, 2048], "float16"], ["TENSOR", [256, 2048], "float16"], ["TENSOR", [512, 2048], "float16"]], {}], "config": {"index": 6266, "code_hash": null, "entity": [["block_row_warps", "ot", 4], ["block_col_warps", "ot", 1], ["warp_row_tiles", "ot", 1], ["warp_col_tiles", "ot", 2], ["chunk", "ot", 2], ["offset", "ot", 8], ["offsetCS", "ot", 8], ["vec", "ot", 1], ["wmma_m", "ot", 16]]}, "result": [[4.3785934e-05], 0, 1.1941993236541748, 1651814404.1259394], "version": 0.2, "tvm_version": "0.8.0"}
{"input": ["cuda -keys=cuda,gpu -max_num_threads=1024 -thread_warp_size=32", "fused_matmul_tensorcore_add.cuda", [["TENSOR", [256, 2048], "float16"], ["TENSOR", [256, 2048], "float16"], ["TENSOR", [512, 2048], "float16"]], {}], "config": {"index": 14238, "code_hash": null, "entity": [["block_row_warps", "ot", 1], ["block_col_warps", "ot", 1], ["warp_row_tiles", "ot", 2], ["warp_col_tiles", "ot", 4], ["chunk", "ot", 8], ["offset", "ot", 8], ["offsetCS", "ot", 8], ["vec", "ot", 4], ["wmma_m", "ot", 8]]}, "result": [[3.9793532e-05], 0, 1.501918077468872, 1651814404.8071601], "version": 0.2, "tvm_version": "0.8.0"}
{"input": ["cuda -keys=cuda,gpu -max_num_threads=1024 -thread_warp_size=32", "fused_matmul_tensorcore_add.cuda", [["TENSOR", [256, 2048], "float16"], ["TENSOR", [256, 2048], "float16"], ["TENSOR", [512, 2048], "float16"]], {}], "config": {"index": 14204, "code_hash": null, "entity": [["block_row_warps", "ot", 4], ["block_col_warps", "ot", 1], ["warp_row_tiles", "ot", 1], ["warp_col_tiles", "ot", 2], ["chunk", "ot", 8], ["offset", "ot", 8], ["offsetCS", "ot", 8], ["vec", "ot", 4], ["wmma_m", "ot", 8]]}, "result": [[2.0737031000000003e-05], 0, 1.1657311916351318, 1651814405.927127], "version": 0.2, "tvm_version": "0.8.0"}
{"input": ["cuda -keys=cuda,gpu -max_num_threads=1024 -thread_warp_size=32", "fused_matmul_tensorcore_add.cuda", [["TENSOR", [256, 2048], "float16"], ["TENSOR", [256, 2048], "float16"], ["TENSOR", [512, 2048], "float16"]], {}], "config": {"index": 12778, "code_hash": null, "entity": [["block_row_warps", "ot", 2], ["block_col_warps", "ot", 4], ["warp_row_tiles", "ot", 1], ["warp_col_tiles", "ot", 4], ["chunk", "ot", 2], ["offset", "ot", 8], ["offsetCS", "ot", 8], ["vec", "ot", 2], ["wmma_m", "ot", 8]]}, "result": [[0.000137590042], 0, 1.5254511833190918, 1651814407.373562], "version": 0.2, "tvm_version": "0.8.0"}
{"input": ["cuda -keys=cuda,gpu -max_num_threads=1024 -thread_warp_size=32", "fused_matmul_tensorcore_add.cuda", [["TENSOR", [256, 2048], "float16"], ["TENSOR", [256, 2048], "float16"], ["TENSOR", [512, 2048], "float16"]], {}], "config": {"index": 1900, "code_hash": null, "entity": [["block_row_warps", "ot", 2], ["block_col_warps", "ot", 1], ["warp_row_tiles", "ot", 2], ["warp_col_tiles", "ot", 2], ["chunk", "ot", 8], ["offset", "ot", 8], ["offsetCS", "ot", 0], ["vec", "ot", 2], ["wmma_m", "ot", 32]]}, "result": [[2.8449532000000004e-05], 0, 1.3349287509918213, 1651814407.9718292], "version": 0.2, "tvm_version": "0.8.0"}
{"input": ["cuda -keys=cuda,gpu -max_num_threads=1024 -thread_warp_size=32", "fused_matmul_tensorcore_add.cuda", [["TENSOR", [256, 2048], "float16"], ["TENSOR", [256, 2048], "float16"], ["TENSOR", [512, 2048], "float16"]], {}], "config": {"index": 12831, "code_hash": null, "entity": [["block_row_warps", "ot", 1], ["block_col_warps", "ot", 4], ["warp_row_tiles", "ot", 1], ["warp_col_tiles", "ot", 2], ["chunk", "ot", 4], ["offset", "ot", 8], ["offsetCS", "ot", 8], ["vec", "ot", 2], ["wmma_m", "ot", 8]]}, "result": [[3.782936999999999e-05], 0, 1.2200052738189697, 1651814408.5548587], "version": 0.2, "tvm_version": "0.8.0"}
{"input": ["cuda -keys=cuda,gpu -max_num_threads=1024 -thread_warp_size=32", "fused_matmul_tensorcore_add.cuda", [["TENSOR", [256, 2048], "float16"], ["TENSOR", [256, 2048], "float16"], ["TENSOR", [512, 2048], "float16"]], {}], "config": {"index": 15415, "code_hash": null, "entity": [["block_row_warps", "ot", 2], ["block_col_warps", "ot", 4], ["warp_row_tiles", "ot", 4], ["warp_col_tiles", "ot", 1], ["chunk", "ot", 4], ["offset", "ot", 8], ["offsetCS", "ot", 8], ["vec", "ot", 8], ["wmma_m", "ot", 8]]}, "result": [[6.421648999999999e-05], 0, 1.3095755577087402, 1651814410.4110093], "version": 0.2, "tvm_version": "0.8.0"}
{"input": ["cuda -keys=cuda,gpu -max_num_threads=1024 -thread_warp_size=32", "fused_matmul_tensorcore_add.cuda", [["TENSOR", [256, 2048], "float16"], ["TENSOR", [256, 2048], "float16"], ["TENSOR", [512, 2048], "float16"]], {}], "config": {"index": 11519, "code_hash": null, "entity": [["block_row_warps", "ot", 4], ["block_col_warps", "ot", 4], ["warp_row_tiles", "ot", 2], ["warp_col_tiles", "ot", 1], ["chunk", "ot", 4], ["offset", "ot", 8], ["offsetCS", "ot", 8], ["vec", "ot", 1], ["wmma_m", "ot", 8]]}, "result": [[6.9343503e-05], 0, 1.2054932117462158, 1651814411.0912426], "version": 0.2, "tvm_version": "0.8.0"}
{"input": ["cuda -keys=cuda,gpu -max_num_threads=1024 -thread_warp_size=32", "fused_matmul_tensorcore_add.cuda", [["TENSOR", [256, 2048], "float16"], ["TENSOR", [256, 2048], "float16"], ["TENSOR", [512, 2048], "float16"]], {}], "config": {"index": 15272, "code_hash": null, "entity": [["block_row_warps", "ot", 4], ["block_col_warps", "ot", 4], ["warp_row_tiles", "ot", 2], ["warp_col_tiles", "ot", 2], ["chunk", "ot", 1], ["offset", "ot", 8], ["offsetCS", "ot", 8], ["vec", "ot", 8], ["wmma_m", "ot", 8]]}, "result": [[0.000174786211], 0, 1.7130885124206543, 1651814412.0791671], "version": 0.2, "tvm_version": "0.8.0"}
{"input": ["cuda -keys=cuda,gpu -max_num_threads=1024 -thread_warp_size=32", "fused_matmul_tensorcore_add.cuda", [["TENSOR", [256, 2048], "float16"], ["TENSOR", [256, 2048], "float16"], ["TENSOR", [512, 2048], "float16"]], {}], "config": {"index": 3045, "code_hash": null, "entity": [["block_row_warps", "ot", 1], ["block_col_warps", "ot", 2], ["warp_row_tiles", "ot", 4], ["warp_col_tiles", "ot", 2], ["chunk", "ot", 2], ["offset", "ot", 8], ["offsetCS", "ot", 0], ["vec", "ot", 4], ["wmma_m", "ot", 32]]}, "result": [[6.3366089e-05], 0, 1.2996625900268555, 1651814413.352795], "version": 0.2, "tvm_version": "0.8.0"}
{"input": ["cuda -keys=cuda,gpu -max_num_threads=1024 -thread_warp_size=32", "fused_matmul_tensorcore_add.cuda", [["TENSOR", [256, 2048], "float16"], ["TENSOR", [256, 2048], "float16"], ["TENSOR", [512, 2048], "float16"]], {}], "config": {"index": 5386, "code_hash": null, "entity": [["block_row_warps", "ot", 2], ["block_col_warps", "ot", 2], ["warp_row_tiles", "ot", 2], ["warp_col_tiles", "ot", 2], ["chunk", "ot", 4], ["offset", "ot", 0], ["offsetCS", "ot", 0], ["vec", "ot", 1], ["wmma_m", "ot", 16]]}, "result": [[9.598302099999999e-05], 0, 1.3472249507904053, 1651814414.7156053], "version": 0.2, "tvm_version": "0.8.0"}
{"input": ["cuda -keys=cuda,gpu -max_num_threads=1024 -thread_warp_size=32", "fused_matmul_tensorcore_add.cuda", [["TENSOR", [256, 2048], "float16"], ["TENSOR", [256, 2048], "float16"], ["TENSOR", [512, 2048], "float16"]], {}], "config": {"index": 6199, "code_hash": null, "entity": [["block_row_warps", "ot", 2], ["block_col_warps", "ot", 4], ["warp_row_tiles", "ot", 2], ["warp_col_tiles", "ot", 2], ["chunk", "ot", 1], ["offset", "ot", 8], ["offsetCS", "ot", 8], ["vec", "ot", 1], ["wmma_m", "ot", 16]]}, "result": [[7.1784758e-05], 0, 1.189765453338623, 1651814415.3953047], "version": 0.2, "tvm_version": "0.8.0"}
{"input": ["cuda -keys=cuda,gpu -max_num_threads=1024 -thread_warp_size=32", "fused_matmul_tensorcore_add.cuda", [["TENSOR", [256, 2048], "float16"], ["TENSOR", [256, 2048], "float16"], ["TENSOR", [512, 2048], "float16"]], {}], "config": {"index": 14723, "code_hash": null, "entity": [["block_row_warps", "ot", 4], ["block_col_warps", "ot", 4], ["warp_row_tiles", "ot", 1], ["warp_col_tiles", "ot", 4], ["chunk", "ot", 2], ["offset", "ot", 8], ["offsetCS", "ot", 0], ["vec", "ot", 8], ["wmma_m", "ot", 8]]}, "result": [[0.00014435568100000003], 0, 1.480144739151001, 1651814416.9001167], "version": 0.2, "tvm_version": "0.8.0"}
{"input": ["cuda -keys=cuda,gpu -max_num_threads=1024 -thread_warp_size=32", "fused_matmul_tensorcore_add.cuda", [["TENSOR", [256, 2048], "float16"], ["TENSOR", [256, 2048], "float16"], ["TENSOR", [512, 2048], "float16"]], {}], "config": {"index": 13817, "code_hash": null, "entity": [["block_row_warps", "ot", 4], ["block_col_warps", "ot", 1], ["warp_row_tiles", "ot", 4], ["warp_col_tiles", "ot", 2], ["chunk", "ot", 4], ["offset", "ot", 0], ["offsetCS", "ot", 8], ["vec", "ot", 4], ["wmma_m", "ot", 8]]}, "result": [[0.0001058831], 0, 1.4708387851715088, 1651814417.7277017], "version": 0.2, "tvm_version": "0.8.0"}
{"input": ["cuda -keys=cuda,gpu -max_num_threads=1024 -thread_warp_size=32", "fused_matmul_tensorcore_add.cuda", [["TENSOR", [256, 2048], "float16"], ["TENSOR", [256, 2048], "float16"], ["TENSOR", [512, 2048], "float16"]], {}], "config": {"index": 10095, "code_hash": null, "entity": [["block_row_warps", "ot", 1], ["block_col_warps", "ot", 4], ["warp_row_tiles", "ot", 4], ["warp_col_tiles", "ot", 2], ["chunk", "ot", 1], ["offset", "ot", 8], ["offsetCS", "ot", 8], ["vec", "ot", 8], ["wmma_m", "ot", 16]]}, "result": [[7.076434000000001e-05], 0, 1.2575292587280273, 1651814418.4294631], "version": 0.2, "tvm_version": "0.8.0"}
{"input": ["cuda -keys=cuda,gpu -max_num_threads=1024 -thread_warp_size=32", "fused_matmul_tensorcore_add.cuda", [["TENSOR", [256, 2048], "float16"], ["TENSOR", [256, 2048], "float16"], ["TENSOR", [512, 2048], "float16"]], {}], "config": {"index": 2771, "code_hash": null, "entity": [["block_row_warps", "ot", 4], ["block_col_warps", "ot", 4], ["warp_row_tiles", "ot", 2], ["warp_col_tiles", "ot", 1], ["chunk", "ot", 4], ["offset", "ot", 0], ["offsetCS", "ot", 0], ["vec", "ot", 4], ["wmma_m", "ot", 32]]}, "result": [[0.000238096957], 0, 1.8344779014587402, 1651814419.6595256], "version": 0.2, "tvm_version": "0.8.0"}
{"input": ["cuda -keys=cuda,gpu -max_num_threads=1024 -thread_warp_size=32", "fused_matmul_tensorcore_add.cuda", [["TENSOR", [256, 2048], "float16"], ["TENSOR", [256, 2048], "float16"], ["TENSOR", [512, 2048], "float16"]], {}], "config": {"index": 7796, "code_hash": null, "entity": [["block_row_warps", "ot", 4], ["block_col_warps", "ot", 1], ["warp_row_tiles", "ot", 4], ["warp_col_tiles", "ot", 1], ["chunk", "ot", 1], ["offset", "ot", 0], ["offsetCS", "ot", 0], ["vec", "ot", 4], ["wmma_m", "ot", 16]]}, "result": [[0.000124174437], 0, 1.3440401554107666, 1651814421.0699043], "version": 0.2, "tvm_version": "0.8.0"}
{"input": ["cuda -keys=cuda,gpu -max_num_threads=1024 -thread_warp_size=32", "fused_matmul_tensorcore_add.cuda", [["TENSOR", [256, 2048], "float16"], ["TENSOR", [256, 2048], "float16"], ["TENSOR", [512, 2048], "float16"]], {}], "config": {"index": 7869, "code_hash": null, "entity": [["block_row_warps", "ot", 1], ["block_col_warps", "ot", 2], ["warp_row_tiles", "ot", 2], ["warp_col_tiles", "ot", 1], ["chunk", "ot", 2], ["offset", "ot", 0], ["offsetCS", "ot", 0], ["vec", "ot", 4], ["wmma_m", "ot", 16]]}, "result": [[4.9302092e-05], 0, 1.3095321655273438, 1651814421.6833246], "version": 0.2, "tvm_version": "0.8.0"}
{"input": ["cuda -keys=cuda,gpu -max_num_threads=1024 -thread_warp_size=32", "fused_matmul_tensorcore_add.cuda", [["TENSOR", [256, 2048], "float16"], ["TENSOR", [256, 2048], "float16"], ["TENSOR", [512, 2048], "float16"]], {}], "config": {"index": 11859, "code_hash": null, "entity": [["block_row_warps", "ot", 1], ["block_col_warps", "ot", 4], ["warp_row_tiles", "ot", 1], ["warp_col_tiles", "ot", 2], ["chunk", "ot", 4], ["offset", "ot", 0], ["offsetCS", "ot", 0], ["vec", "ot", 2], ["wmma_m", "ot", 8]]}, "result": [[8.1582846e-05], 0, 1.3741590976715088, 1651814422.990126], "version": 0.2, "tvm_version": "0.8.0"}
{"input": ["cuda -keys=cuda,gpu -max_num_threads=1024 -thread_warp_size=32", "fused_matmul_tensorcore_add.cuda", [["TENSOR", [256, 2048], "float16"], ["TENSOR", [256, 2048], "float16"], ["TENSOR", [512, 2048], "float16"]], {}], "config": {"index": 10562, "code_hash": null, "entity": [["block_row_warps", "ot", 4], ["block_col_warps", "ot", 2], ["warp_row_tiles", "ot", 1], ["warp_col_tiles", "ot", 2], ["chunk", "ot", 4], ["offset", "ot", 0], ["offsetCS", "ot", 0], ["vec", "ot", 1], ["wmma_m", "ot", 8]]}, "result": [[0.000150151623], 0, 1.5792136192321777, 1651814423.9068732], "version": 0.2, "tvm_version": "0.8.0"}
{"input": ["cuda -keys=cuda,gpu -max_num_threads=1024 -thread_warp_size=32", "fused_matmul_tensorcore_add.cuda", [["TENSOR", [256, 2048], "float16"], ["TENSOR", [256, 2048], "float16"], ["TENSOR", [512, 2048], "float16"]], {}], "config": {"index": 3918, "code_hash": null, "entity": [["block_row_warps", "ot", 1], ["block_col_warps", "ot", 2], ["warp_row_tiles", "ot", 1], ["warp_col_tiles", "ot", 2], ["chunk", "ot", 1], ["offset", "ot", 0], ["offsetCS", "ot", 0], ["vec", "ot", 8], ["wmma_m", "ot", 32]]}, "result": [[3.208897e-05], 0, 0.9781980514526367, 1651814425.089449], "version": 0.2, "tvm_version": "0.8.0"}
{"input": ["cuda -keys=cuda,gpu -max_num_threads=1024 -thread_warp_size=32", "fused_matmul_tensorcore_add.cuda", [["TENSOR", [256, 2048], "float16"], ["TENSOR", [256, 2048], "float16"], ["TENSOR", [512, 2048], "float16"]], {}], "config": {"index": 7190, "code_hash": null, "entity": [["block_row_warps", "ot", 4], ["block_col_warps", "ot", 4], ["warp_row_tiles", "ot", 1], ["warp_col_tiles", "ot", 4], ["chunk", "ot", 1], ["offset", "ot", 0], ["offsetCS", "ot", 8], ["vec", "ot", 2], ["wmma_m", "ot", 16]]}, "result": [[0.000116335194], 0, 1.37660813331604, 1651814426.4832764], "version": 0.2, "tvm_version": "0.8.0"}
{"input": ["cuda -keys=cuda,gpu -max_num_threads=1024 -thread_warp_size=32", "fused_matmul_tensorcore_add.cuda", [["TENSOR", [256, 2048], "float16"], ["TENSOR", [256, 2048], "float16"], ["TENSOR", [512, 2048], "float16"]], {}], "config": {"index": 7563, "code_hash": null, "entity": [["block_row_warps", "ot", 1], ["block_col_warps", "ot", 2], ["warp_row_tiles", "ot", 1], ["warp_col_tiles", "ot", 2], ["chunk", "ot", 2], ["offset", "ot", 8], ["offsetCS", "ot", 8], ["vec", "ot", 2], ["wmma_m", "ot", 16]]}, "result": [[4.371606400000001e-05], 0, 0.9934747219085693, 1651814427.657322], "version": 0.2, "tvm_version": "0.8.0"}
{"input": ["cuda -keys=cuda,gpu -max_num_threads=1024 -thread_warp_size=32", "fused_matmul_tensorcore_add.cuda", [["TENSOR", [256, 2048], "float16"], ["TENSOR", [256, 2048], "float16"], ["TENSOR", [512, 2048], "float16"]], {}], "config": {"index": 8564, "code_hash": null, "entity": [["block_row_warps", "ot", 4], ["block_col_warps", "ot", 2], ["warp_row_tiles", "ot", 1], ["warp_col_tiles", "ot", 4], ["chunk", "ot", 2], ["offset", "ot", 0], ["offsetCS", "ot", 8], ["vec", "ot", 4], ["wmma_m", "ot", 16]]}, "result": [[8.5208863e-05], 0, 1.2952582836151123, 1651814428.3902042], "version": 0.2, "tvm_version": "0.8.0"}
{"input": ["cuda -keys=cuda,gpu -max_num_threads=1024 -thread_warp_size=32", "fused_matmul_tensorcore_add.cuda", [["TENSOR", [256, 2048], "float16"], ["TENSOR", [256, 2048], "float16"], ["TENSOR", [512, 2048], "float16"]], {}], "config": {"index": 11392, "code_hash": null, "entity": [["block_row_warps", "ot", 2], ["block_col_warps", "ot", 4], ["warp_row_tiles", "ot", 4], ["warp_col_tiles", "ot", 2], ["chunk", "ot", 1], ["offset", "ot", 8], ["offsetCS", "ot", 8], ["vec", "ot", 1], ["wmma_m", "ot", 8]]}, "result": [[0.000117292537], 0, 1.2683088779449463, 1651814429.829443], "version": 0.2, "tvm_version": "0.8.0"}
{"input": ["cuda -keys=cuda,gpu -max_num_threads=1024 -thread_warp_size=32", "fused_matmul_tensorcore_add.cuda", [["TENSOR", [256, 2048], "float16"], ["TENSOR", [256, 2048], "float16"], ["TENSOR", [512, 2048], "float16"]], {}], "config": {"index": 14345, "code_hash": null, "entity": [["block_row_warps", "ot", 4], ["block_col_warps", "ot", 4], ["warp_row_tiles", "ot", 1], ["warp_col_tiles", "ot", 1], ["chunk", "ot", 2], ["offset", "ot", 0], ["offsetCS", "ot", 0], ["vec", "ot", 8], ["wmma_m", "ot", 8]]}, "result": [[0.00010983334600000002], 0, 1.1732404232025146, 1651814431.202689], "version": 0.2, "tvm_version": "0.8.0"}
{"input": ["cuda -keys=cuda,gpu -max_num_threads=1024 -thread_warp_size=32", "fused_matmul_tensorcore_add.cuda", [["TENSOR", [256, 2048], "float16"], ["TENSOR", [256, 2048], "float16"], ["TENSOR", [512, 2048], "float16"]], {}], "config": {"index": 10893, "code_hash": null, "entity": [["block_row_warps", "ot", 1], ["block_col_warps", "ot", 2], ["warp_row_tiles", "ot", 2], ["warp_col_tiles", "ot", 2], ["chunk", "ot", 4], ["offset", "ot", 8], ["offsetCS", "ot", 0], ["vec", "ot", 1], ["wmma_m", "ot", 8]]}, "result": [[5.142412e-05], 0, 1.1866371631622314, 1651814431.8664806], "version": 0.2, "tvm_version": "0.8.0"}
{"input": ["cuda -keys=cuda,gpu -max_num_threads=1024 -thread_warp_size=32", "fused_matmul_tensorcore_add.cuda", [["TENSOR", [256, 2048], "float16"], ["TENSOR", [256, 2048], "float16"], ["TENSOR", [512, 2048], "float16"]], {}], "config": {"index": 4176, "code_hash": null, "entity": [["block_row_warps", "ot", 1], ["block_col_warps", "ot", 1], ["warp_row_tiles", "ot", 4], ["warp_col_tiles", "ot", 2], ["chunk", "ot", 8], ["offset", "ot", 0], ["offsetCS", "ot", 0], ["vec", "ot", 8], ["wmma_m", "ot", 32]]}, "result": [[7.6701046e-05], 0, 1.264317512512207, 1651814433.219064], "version": 0.2, "tvm_version": "0.8.0"}
{"input": ["cuda -keys=cuda,gpu -max_num_threads=1024 -thread_warp_size=32", "fused_matmul_tensorcore_add.cuda", [["TENSOR", [256, 2048], "float16"], ["TENSOR", [256, 2048], "float16"], ["TENSOR", [512, 2048], "float16"]], {}], "config": {"index": 5039, "code_hash": null, "entity": [["block_row_warps", "ot", 4], ["block_col_warps", "ot", 4], ["warp_row_tiles", "ot", 2], ["warp_col_tiles", "ot", 1], ["chunk", "ot", 4], ["offset", "ot", 8], ["offsetCS", "ot", 8], ["vec", "ot", 8], ["wmma_m", "ot", 32]]}, "result": [[6.6929972e-05], 0, 1.0536842346191406, 1651814433.8800466], "version": 0.2, "tvm_version": "0.8.0"}
{"input": ["cuda -keys=cuda,gpu -max_num_threads=1024 -thread_warp_size=32", "fused_matmul_tensorcore_add.cuda", [["TENSOR", [256, 2048], "float16"], ["TENSOR", [256, 2048], "float16"], ["TENSOR", [512, 2048], "float16"]], {}], "config": {"index": 12814, "code_hash": null, "entity": [["block_row_warps", "ot", 2], ["block_col_warps", "ot", 4], ["warp_row_tiles", "ot", 2], ["warp_col_tiles", "ot", 1], ["chunk", "ot", 4], ["offset", "ot", 8], ["offsetCS", "ot", 8], ["vec", "ot", 2], ["wmma_m", "ot", 8]]}, "result": [[3.2850508e-05], 0, 0.9568266868591309, 1651814435.03624], "version": 0.2, "tvm_version": "0.8.0"}
{"input": ["cuda -keys=cuda,gpu -max_num_threads=1024 -thread_warp_size=32", "fused_matmul_tensorcore_add.cuda", [["TENSOR", [256, 2048], "float16"], ["TENSOR", [256, 2048], "float16"], ["TENSOR", [512, 2048], "float16"]], {}], "config": {"index": 4415, "code_hash": null, "entity": [["block_row_warps", "ot", 4], ["block_col_warps", "ot", 2], ["warp_row_tiles", "ot", 2], ["warp_col_tiles", "ot", 2], ["chunk", "ot", 4], ["offset", "ot", 8], ["offsetCS", "ot", 0], ["vec", "ot", 8], ["wmma_m", "ot", 32]]}, "result": [[4.6860954e-05], 0, 1.086728811264038, 1651814435.711261], "version": 0.2, "tvm_version": "0.8.0"}
{"input": ["cuda -keys=cuda,gpu -max_num_threads=1024 -thread_warp_size=32", "fused_matmul_tensorcore_add.cuda", [["TENSOR", [256, 2048], "float16"], ["TENSOR", [256, 2048], "float16"], ["TENSOR", [512, 2048], "float16"]], {}], "config": {"index": 6958, "code_hash": null, "entity": [["block_row_warps", "ot", 2], ["block_col_warps", "ot", 1], ["warp_row_tiles", "ot", 4], ["warp_col_tiles", "ot", 4], ["chunk", "ot", 2], ["offset", "ot", 8], ["offsetCS", "ot", 0], ["vec", "ot", 2], ["wmma_m", "ot", 16]]}, "result": [[0.000100071144], 0, 1.3637237548828125, 1651814438.6897707], "version": 0.2, "tvm_version": "0.8.0"}
{"input": ["cuda -keys=cuda,gpu -max_num_threads=1024 -thread_warp_size=32", "fused_matmul_tensorcore_add.cuda", [["TENSOR", [256, 2048], "float16"], ["TENSOR", [256, 2048], "float16"], ["TENSOR", [512, 2048], "float16"]], {}], "config": {"index": 7651, "code_hash": null, "entity": [["block_row_warps", "ot", 2], ["block_col_warps", "ot", 1], ["warp_row_tiles", "ot", 2], ["warp_col_tiles", "ot", 2], ["chunk", "ot", 4], ["offset", "ot", 8], ["offsetCS", "ot", 8], ["vec", "ot", 2], ["wmma_m", "ot", 16]]}, "result": [[2.9411532000000002e-05], 0, 1.2162103652954102, 1651814439.8431888], "version": 0.2, "tvm_version": "0.8.0"}
{"input": ["cuda -keys=cuda,gpu -max_num_threads=1024 -thread_warp_size=32", "fused_matmul_tensorcore_add.cuda", [["TENSOR", [256, 2048], "float16"], ["TENSOR", [256, 2048], "float16"], ["TENSOR", [512, 2048], "float16"]], {}], "config": {"index": 859, "code_hash": null, "entity": [["block_row_warps", "ot", 2], ["block_col_warps", "ot", 2], ["warp_row_tiles", "ot", 4], ["warp_col_tiles", "ot", 2], ["chunk", "ot", 4], ["offset", "ot", 0], ["offsetCS", "ot", 8], ["vec", "ot", 1], ["wmma_m", "ot", 32]]}, "result": [[0.000165355882], 0, 1.7357161045074463, 1651814440.8766015], "version": 0.2, "tvm_version": "0.8.0"}
{"input": ["cuda -keys=cuda,gpu -max_num_threads=1024 -thread_warp_size=32", "fused_matmul_tensorcore_add.cuda", [["TENSOR", [256, 2048], "float16"], ["TENSOR", [256, 2048], "float16"], ["TENSOR", [512, 2048], "float16"]], {}], "config": {"index": 4459, "code_hash": null, "entity": [["block_row_warps", "ot", 2], ["block_col_warps", "ot", 2], ["warp_row_tiles", "ot", 1], ["warp_col_tiles", "ot", 1], ["chunk", "ot", 8], ["offset", "ot", 8], ["offsetCS", "ot", 0], ["vec", "ot", 8], ["wmma_m", "ot", 32]]}, "result": [[2.3074421999999997e-05], 0, 1.1960408687591553, 1651814442.5987508], "version": 0.2, "tvm_version": "0.8.0"}
{"input": ["cuda -keys=cuda,gpu -max_num_threads=1024 -thread_warp_size=32", "fused_matmul_tensorcore_add.cuda", [["TENSOR", [256, 2048], "float16"], ["TENSOR", [256, 2048], "float16"], ["TENSOR", [512, 2048], "float16"]], {}], "config": {"index": 378, "code_hash": null, "entity": [["block_row_warps", "ot", 1], ["block_col_warps", "ot", 1], ["warp_row_tiles", "ot", 1], ["warp_col_tiles", "ot", 4], ["chunk", "ot", 1], ["offset", "ot", 8], ["offsetCS", "ot", 0], ["vec", "ot", 1], ["wmma_m", "ot", 32]]}, "result": [[8.5439545e-05], 0, 1.3927290439605713, 1651814443.359572], "version": 0.2, "tvm_version": "0.8.0"}
{"input": ["cuda -keys=cuda,gpu -max_num_threads=1024 -thread_warp_size=32", "fused_matmul_tensorcore_add.cuda", [["TENSOR", [256, 2048], "float16"], ["TENSOR", [256, 2048], "float16"], ["TENSOR", [512, 2048], "float16"]], {}], "config": {"index": 9984, "code_hash": null, "entity": [["block_row_warps", "ot", 1], ["block_col_warps", "ot", 2], ["warp_row_tiles", "ot", 4], ["warp_col_tiles", "ot", 1], ["chunk", "ot", 8], ["offset", "ot", 0], ["offsetCS", "ot", 8], ["vec", "ot", 8], ["wmma_m", "ot", 16]]}, "result": [[4.3969383e-05], 0, 1.2329893112182617, 1651814444.5891004], "version": 0.2, "tvm_version": "0.8.0"}
{"input": ["cuda -keys=cuda,gpu -max_num_threads=1024 -thread_warp_size=32", "fused_matmul_tensorcore_add.cuda", [["TENSOR", [256, 2048], "float16"], ["TENSOR", [256, 2048], "float16"], ["TENSOR", [512, 2048], "float16"]], {}], "config": {"index": 6669, "code_hash": null, "entity": [["block_row_warps", "ot", 1], ["block_col_warps", "ot", 1], ["warp_row_tiles", "ot", 1], ["warp_col_tiles", "ot", 2], ["chunk", "ot", 4], ["offset", "ot", 0], ["offsetCS", "ot", 0], ["vec", "ot", 2], ["wmma_m", "ot", 16]]}, "result": [[5.9945912e-05], 0, 1.309222936630249, 1651814445.2269168], "version": 0.2, "tvm_version": "0.8.0"}
{"input": ["cuda -keys=cuda,gpu -max_num_threads=1024 -thread_warp_size=32", "fused_matmul_tensorcore_add.cuda", [["TENSOR", [256, 2048], "float16"], ["TENSOR", [256, 2048], "float16"], ["TENSOR", [512, 2048], "float16"]], {}], "config": {"index": 11250, "code_hash": null, "entity": [["block_row_warps", "ot", 1], ["block_col_warps", "ot", 1], ["warp_row_tiles", "ot", 4], ["warp_col_tiles", "ot", 4], ["chunk", "ot", 4], ["offset", "ot", 0], ["offsetCS", "ot", 8], ["vec", "ot", 1], ["wmma_m", "ot", 8]]}, "result": [[0.000227787746], 0, 1.8427422046661377, 1651814447.0319285], "version": 0.2, "tvm_version": "0.8.0"}
{"input": ["cuda -keys=cuda,gpu -max_num_threads=1024 -thread_warp_size=32", "fused_matmul_tensorcore_add.cuda", [["TENSOR", [256, 2048], "float16"], ["TENSOR", [256, 2048], "float16"], ["TENSOR", [512, 2048], "float16"]], {}], "config": {"index": 5107, "code_hash": null, "entity": [["block_row_warps", "ot", 2], ["block_col_warps", "ot", 2], ["warp_row_tiles", "ot", 1], ["warp_col_tiles", "ot", 1], ["chunk", "ot", 8], ["offset", "ot", 8], ["offsetCS", "ot", 8], ["vec", "ot", 8], ["wmma_m", "ot", 32]]}, "result": [[2.3165151000000002e-05], 0, 1.125366449356079, 1651814447.6026027], "version": 0.2, "tvm_version": "0.8.0"}
{"input": ["cuda -keys=cuda,gpu -max_num_threads=1024 -thread_warp_size=32", "fused_matmul_tensorcore_add.cuda", [["TENSOR", [256, 2048], "float16"], ["TENSOR", [256, 2048], "float16"], ["TENSOR", [512, 2048], "float16"]], {}], "config": {"index": 10891, "code_hash": null, "entity": [["block_row_warps", "ot", 2], ["block_col_warps", "ot", 1], ["warp_row_tiles", "ot", 2], ["warp_col_tiles", "ot", 2], ["chunk", "ot", 4], ["offset", "ot", 8], ["offsetCS", "ot", 0], ["vec", "ot", 1], ["wmma_m", "ot", 8]]}, "result": [[4.2623348e-05], 0, 1.4269349575042725, 1651814448.8075104], "version": 0.2, "tvm_version": "0.8.0"}
{"input": ["cuda -keys=cuda,gpu -max_num_threads=1024 -thread_warp_size=32", "fused_matmul_tensorcore_add.cuda", [["TENSOR", [256, 2048], "float16"], ["TENSOR", [256, 2048], "float16"], ["TENSOR", [512, 2048], "float16"]], {}], "config": {"index": 6876, "code_hash": null, "entity": [["block_row_warps", "ot", 1], ["block_col_warps", "ot", 1], ["warp_row_tiles", "ot", 4], ["warp_col_tiles", "ot", 4], ["chunk", "ot", 1], ["offset", "ot", 8], ["offsetCS", "ot", 0], ["vec", "ot", 2], ["wmma_m", "ot", 16]]}, "result": [[0.000113995069], 0, 1.3429725170135498, 1651814449.6639524], "version": 0.2, "tvm_version": "0.8.0"}
{"input": ["cuda -keys=cuda,gpu -max_num_threads=1024 -thread_warp_size=32", "fused_matmul_tensorcore_add.cuda", [["TENSOR", [256, 2048], "float16"], ["TENSOR", [256, 2048], "float16"], ["TENSOR", [512, 2048], "float16"]], {}], "config": {"index": 1849, "code_hash": null, "entity": [["block_row_warps", "ot", 2], ["block_col_warps", "ot", 2], ["warp_row_tiles", "ot", 2], ["warp_col_tiles", "ot", 4], ["chunk", "ot", 4], ["offset", "ot", 8], ["offsetCS", "ot", 0], ["vec", "ot", 2], ["wmma_m", "ot", 32]]}, "result": [[4.4030399e-05], 0, 1.3312859535217285, 1651814450.8825502], "version": 0.2, "tvm_version": "0.8.0"}
{"input": ["cuda -keys=cuda,gpu -max_num_threads=1024 -thread_warp_size=32", "fused_matmul_tensorcore_add.cuda", [["TENSOR", [256, 2048], "float16"], ["TENSOR", [256, 2048], "float16"], ["TENSOR", [512, 2048], "float16"]], {}], "config": {"index": 4074, "code_hash": null, "entity": [["block_row_warps", "ot", 1], ["block_col_warps", "ot", 4], ["warp_row_tiles", "ot", 4], ["warp_col_tiles", "ot", 1], ["chunk", "ot", 4], ["offset", "ot", 0], ["offsetCS", "ot", 0], ["vec", "ot", 8], ["wmma_m", "ot", 32]]}, "result": [[0.000121571921], 0, 1.4740915298461914, 1651814452.329354], "version": 0.2, "tvm_version": "0.8.0"}
{"input": ["cuda -keys=cuda,gpu -max_num_threads=1024 -thread_warp_size=32", "fused_matmul_tensorcore_add.cuda", [["TENSOR", [256, 2048], "float16"], ["TENSOR", [256, 2048], "float16"], ["TENSOR", [512, 2048], "float16"]], {}], "config": {"index": 6029, "code_hash": null, "entity": [["block_row_warps", "ot", 4], ["block_col_warps", "ot", 4], ["warp_row_tiles", "ot", 1], ["warp_col_tiles", "ot", 2], ["chunk", "ot", 4], ["offset", "ot", 0], ["offsetCS", "ot", 8], ["vec", "ot", 1], ["wmma_m", "ot", 16]]}, "result": [[0.00017843802400000001], 0, 1.6391165256500244, 1651814453.3937721], "version": 0.2, "tvm_version": "0.8.0"}
{"input": ["cuda -keys=cuda,gpu -max_num_threads=1024 -thread_warp_size=32", "fused_matmul_tensorcore_add.cuda", [["TENSOR", [256, 2048], "float16"], ["TENSOR", [256, 2048], "float16"], ["TENSOR", [512, 2048], "float16"]], {}], "config": {"index": 9346, "code_hash": null, "entity": [["block_row_warps", "ot", 2], ["block_col_warps", "ot", 2], ["warp_row_tiles", "ot", 1], ["warp_col_tiles", "ot", 2], ["chunk", "ot", 8], ["offset", "ot", 0], ["offsetCS", "ot", 0], ["vec", "ot", 8], ["wmma_m", "ot", 16]]}, "result": [[4.7619539e-05], 0, 1.2409262657165527, 1651814454.0396955], "version": 0.2, "tvm_version": "0.8.0"}
{"input": ["cuda -keys=cuda,gpu -max_num_threads=1024 -thread_warp_size=32", "fused_matmul_tensorcore_add.cuda", [["TENSOR", [256, 2048], "float16"], ["TENSOR", [256, 2048], "float16"], ["TENSOR", [512, 2048], "float16"]], {}], "config": {"index": 12587, "code_hash": null, "entity": [["block_row_warps", "ot", 4], ["block_col_warps", "ot", 2], ["warp_row_tiles", "ot", 1], ["warp_col_tiles", "ot", 2], ["chunk", "ot", 8], ["offset", "ot", 0], ["offsetCS", "ot", 8], ["vec", "ot", 2], ["wmma_m", "ot", 8]]}, "result": [[0.000124305208], 0, 1.554401159286499, 1651814454.8892071], "version": 0.2, "tvm_version": "0.8.0"}
{"input": ["cuda -keys=cuda,gpu -max_num_threads=1024 -thread_warp_size=32", "fused_matmul_tensorcore_add.cuda", [["TENSOR", [256, 2048], "float16"], ["TENSOR", [256, 2048], "float16"], ["TENSOR", [512, 2048], "float16"]], {}], "config": {"index": 8965, "code_hash": null, "entity": [["block_row_warps", "ot", 2], ["block_col_warps", "ot", 1], ["warp_row_tiles", "ot", 1], ["warp_col_tiles", "ot", 4], ["chunk", "ot", 4], ["offset", "ot", 8], ["offsetCS", "ot", 8], ["vec", "ot", 4], ["wmma_m", "ot", 16]]}, "result": [[2.6871143999999998e-05], 0, 1.2527110576629639, 1651814456.0504014], "version": 0.2, "tvm_version": "0.8.0"}
{"input": ["cuda -keys=cuda,gpu -max_num_threads=1024 -thread_warp_size=32", "fused_matmul_tensorcore_add.cuda", [["TENSOR", [256, 2048], "float16"], ["TENSOR", [256, 2048], "float16"], ["TENSOR", [512, 2048], "float16"]], {}], "config": {"index": 7575, "code_hash": null, "entity": [["block_row_warps", "ot", 1], ["block_col_warps", "ot", 4], ["warp_row_tiles", "ot", 2], ["warp_col_tiles", "ot", 2], ["chunk", "ot", 2], ["offset", "ot", 8], ["offsetCS", "ot", 8], ["vec", "ot", 2], ["wmma_m", "ot", 16]]}, "result": [[4.6237489e-05], 0, 1.208847999572754, 1651814456.652396], "version": 0.2, "tvm_version": "0.8.0"}
{"input": ["cuda -keys=cuda,gpu -max_num_threads=1024 -thread_warp_size=32", "fused_matmul_tensorcore_add.cuda", [["TENSOR", [256, 2048], "float16"], ["TENSOR", [256, 2048], "float16"], ["TENSOR", [512, 2048], "float16"]], {}], "config": {"index": 9870, "code_hash": null, "entity": [["block_row_warps", "ot", 1], ["block_col_warps", "ot", 4], ["warp_row_tiles", "ot", 2], ["warp_col_tiles", "ot", 4], ["chunk", "ot", 2], ["offset", "ot", 0], ["offsetCS", "ot", 8], ["vec", "ot", 8], ["wmma_m", "ot", 16]]}, "result": [[8.0024574e-05], 0, 1.3106212615966797, 1651814457.9419923], "version": 0.2, "tvm_version": "0.8.0"}
{"input": ["cuda -keys=cuda,gpu -max_num_threads=1024 -thread_warp_size=32", "fused_matmul_tensorcore_add.cuda", [["TENSOR", [256, 2048], "float16"], ["TENSOR", [256, 2048], "float16"], ["TENSOR", [512, 2048], "float16"]], {}], "config": {"index": 6927, "code_hash": null, "entity": [["block_row_warps", "ot", 1], ["block_col_warps", "ot", 4], ["warp_row_tiles", "ot", 2], ["warp_col_tiles", "ot", 2], ["chunk", "ot", 2], ["offset", "ot", 8], ["offsetCS", "ot", 0], ["vec", "ot", 2], ["wmma_m", "ot", 16]]}, "result": [[4.6331904e-05], 0, 1.13954496383667, 1651814458.6006684], "version": 0.2, "tvm_version": "0.8.0"}
{"input": ["cuda -keys=cuda,gpu -max_num_threads=1024 -thread_warp_size=32", "fused_matmul_tensorcore_add.cuda", [["TENSOR", [256, 2048], "float16"], ["TENSOR", [256, 2048], "float16"], ["TENSOR", [512, 2048], "float16"]], {}], "config": {"index": 7435, "code_hash": null, "entity": [["block_row_warps", "ot", 2], ["block_col_warps", "ot", 1], ["warp_row_tiles", "ot", 2], ["warp_col_tiles", "ot", 4], ["chunk", "ot", 8], ["offset", "ot", 0], ["offsetCS", "ot", 8], ["vec", "ot", 2], ["wmma_m", "ot", 16]]}, "result": [[5.9088653e-05], 0, 1.5011086463928223, 1651814459.9296286], "version": 0.2, "tvm_version": "0.8.0"}
{"input": ["cuda -keys=cuda,gpu -max_num_threads=1024 -thread_warp_size=32", "fused_matmul_tensorcore_add.cuda", [["TENSOR", [256, 2048], "float16"], ["TENSOR", [256, 2048], "float16"], ["TENSOR", [512, 2048], "float16"]], {}], "config": {"index": 2991, "code_hash": null, "entity": [["block_row_warps", "ot", 1], ["block_col_warps", "ot", 2], ["warp_row_tiles", "ot", 4], ["warp_col_tiles", "ot", 4], ["chunk", "ot", 1], ["offset", "ot", 8], ["offsetCS", "ot", 0], ["vec", "ot", 4], ["wmma_m", "ot", 32]]}, "result": [[8.718877999999999e-05], 0, 1.3442442417144775, 1651814460.681752], "version": 0.2, "tvm_version": "0.8.0"}
{"input": ["cuda -keys=cuda,gpu -max_num_threads=1024 -thread_warp_size=32", "fused_matmul_tensorcore_add.cuda", [["TENSOR", [256, 2048], "float16"], ["TENSOR", [256, 2048], "float16"], ["TENSOR", [512, 2048], "float16"]], {}], "config": {"index": 6002, "code_hash": null, "entity": [["block_row_warps", "ot", 4], ["block_col_warps", "ot", 4], ["warp_row_tiles", "ot", 1], ["warp_col_tiles", "ot", 1], ["chunk", "ot", 4], ["offset", "ot", 0], ["offsetCS", "ot", 8], ["vec", "ot", 1], ["wmma_m", "ot", 16]]}, "result": [[0.00012158573800000001], 0, 1.4085338115692139, 1651814462.0750608], "version": 0.2, "tvm_version": "0.8.0"}
{"input": ["cuda -keys=cuda,gpu -max_num_threads=1024 -thread_warp_size=32", "fused_matmul_tensorcore_add.cuda", [["TENSOR", [256, 2048], "float16"], ["TENSOR", [256, 2048], "float16"], ["TENSOR", [512, 2048], "float16"]], {}], "config": {"index": 14702, "code_hash": null, "entity": [["block_row_warps", "ot", 4], ["block_col_warps", "ot", 2], ["warp_row_tiles", "ot", 2], ["warp_col_tiles", "ot", 2], ["chunk", "ot", 2], ["offset", "ot", 8], ["offsetCS", "ot", 0], ["vec", "ot", 8], ["wmma_m", "ot", 8]]}, "result": [[5.1366678e-05], 0, 1.1835846900939941, 1651814462.7110884], "version": 0.2, "tvm_version": "0.8.0"}
{"input": ["cuda -keys=cuda,gpu -max_num_threads=1024 -thread_warp_size=32", "fused_matmul_tensorcore_add.cuda", [["TENSOR", [256, 2048], "float16"], ["TENSOR", [256, 2048], "float16"], ["TENSOR", [512, 2048], "float16"]], {}], "config": {"index": 5935, "code_hash": null, "entity": [["block_row_warps", "ot", 2], ["block_col_warps", "ot", 2], ["warp_row_tiles", "ot", 4], ["warp_col_tiles", "ot", 1], ["chunk", "ot", 2], ["offset", "ot", 0], ["offsetCS", "ot", 8], ["vec", "ot", 1], ["wmma_m", "ot", 16]]}, "result": [[8.697091899999999e-05], 0, 1.4101202487945557, 1651814464.031549], "version": 0.2, "tvm_version": "0.8.0"}
{"input": ["cuda -keys=cuda,gpu -max_num_threads=1024 -thread_warp_size=32", "fused_matmul_tensorcore_add.cuda", [["TENSOR", [256, 2048], "float16"], ["TENSOR", [256, 2048], "float16"], ["TENSOR", [512, 2048], "float16"]], {}], "config": {"index": 32, "code_hash": null, "entity": [["block_row_warps", "ot", 4], ["block_col_warps", "ot", 2], ["warp_row_tiles", "ot", 1], ["warp_col_tiles", "ot", 2], ["chunk", "ot", 1], ["offset", "ot", 0], ["offsetCS", "ot", 0], ["vec", "ot", 1], ["wmma_m", "ot", 32]]}, "result": [[6.894677e-05], 0, 1.3946430683135986, 1651814464.7633073], "version": 0.2, "tvm_version": "0.8.0"}
{"input": ["cuda -keys=cuda,gpu -max_num_threads=1024 -thread_warp_size=32", "fused_matmul_tensorcore_add.cuda", [["TENSOR", [256, 2048], "float16"], ["TENSOR", [256, 2048], "float16"], ["TENSOR", [512, 2048], "float16"]], {}], "config": {"index": 7564, "code_hash": null, "entity": [["block_row_warps", "ot", 2], ["block_col_warps", "ot", 2], ["warp_row_tiles", "ot", 1], ["warp_col_tiles", "ot", 2], ["chunk", "ot", 2], ["offset", "ot", 8], ["offsetCS", "ot", 8], ["vec", "ot", 2], ["wmma_m", "ot", 16]]}, "result": [[4.047218e-05], 0, 1.0704011917114258, 1651814465.9429946], "version": 0.2, "tvm_version": "0.8.0"}
{"input": ["cuda -keys=cuda,gpu -max_num_threads=1024 -thread_warp_size=32", "fused_matmul_tensorcore_add.cuda", [["TENSOR", [256, 2048], "float16"], ["TENSOR", [256, 2048], "float16"], ["TENSOR", [512, 2048], "float16"]], {}], "config": {"index": 294, "code_hash": null, "entity": [["block_row_warps", "ot", 1], ["block_col_warps", "ot", 4], ["warp_row_tiles", "ot", 4], ["warp_col_tiles", "ot", 2], ["chunk", "ot", 8], ["offset", "ot", 0], ["offsetCS", "ot", 0], ["vec", "ot", 1], ["wmma_m", "ot", 32]]}, "result": [[0.000143289163], 0, 1.8172428607940674, 1651814467.5491033], "version": 0.2, "tvm_version": "0.8.0"}
{"input": ["cuda -keys=cuda,gpu -max_num_threads=1024 -thread_warp_size=32", "fused_matmul_tensorcore_add.cuda", [["TENSOR", [256, 2048], "float16"], ["TENSOR", [256, 2048], "float16"], ["TENSOR", [512, 2048], "float16"]], {}], "config": {"index": 11139, "code_hash": null, "entity": [["block_row_warps", "ot", 1], ["block_col_warps", "ot", 4], ["warp_row_tiles", "ot", 2], ["warp_col_tiles", "ot", 2], ["chunk", "ot", 2], ["offset", "ot", 0], ["offsetCS", "ot", 8], ["vec", "ot", 1], ["wmma_m", "ot", 8]]}, "result": [[0.000108206939], 0, 1.3851501941680908, 1651814468.9427438], "version": 0.2, "tvm_version": "0.8.0"}
{"input": ["cuda -keys=cuda,gpu -max_num_threads=1024 -thread_warp_size=32", "fused_matmul_tensorcore_add.cuda", [["TENSOR", [256, 2048], "float16"], ["TENSOR", [256, 2048], "float16"], ["TENSOR", [512, 2048], "float16"]], {}], "config": {"index": 10897, "code_hash": null, "entity": [["block_row_warps", "ot", 2], ["block_col_warps", "ot", 4], ["warp_row_tiles", "ot", 2], ["warp_col_tiles", "ot", 2], ["chunk", "ot", 4], ["offset", "ot", 8], ["offsetCS", "ot", 0], ["vec", "ot", 1], ["wmma_m", "ot", 8]]}, "result": [[7.0326419e-05], 0, 1.3588995933532715, 1651814469.6425989], "version": 0.2, "tvm_version": "0.8.0"}
{"input": ["cuda -keys=cuda,gpu -max_num_threads=1024 -thread_warp_size=32", "fused_matmul_tensorcore_add.cuda", [["TENSOR", [256, 2048], "float16"], ["TENSOR", [256, 2048], "float16"], ["TENSOR", [512, 2048], "float16"]], {}], "config": {"index": 1037, "code_hash": null, "entity": [["block_row_warps", "ot", 4], ["block_col_warps", "ot", 1], ["warp_row_tiles", "ot", 2], ["warp_col_tiles", "ot", 4], ["chunk", "ot", 1], ["offset", "ot", 8], ["offsetCS", "ot", 8], ["vec", "ot", 1], ["wmma_m", "ot", 32]]}, "result": [[0.000106075192], 0, 1.2787461280822754, 1651814471.0258422], "version": 0.2, "tvm_version": "0.8.0"}
{"input": ["cuda -keys=cuda,gpu -max_num_threads=1024 -thread_warp_size=32", "fused_matmul_tensorcore_add.cuda", [["TENSOR", [256, 2048], "float16"], ["TENSOR", [256, 2048], "float16"], ["TENSOR", [512, 2048], "float16"]], {}], "config": {"index": 6092, "code_hash": null, "entity": [["block_row_warps", "ot", 4], ["block_col_warps", "ot", 4], ["warp_row_tiles", "ot", 2], ["warp_col_tiles", "ot", 1], ["chunk", "ot", 8], ["offset", "ot", 0], ["offsetCS", "ot", 8], ["vec", "ot", 1], ["wmma_m", "ot", 16]]}, "result": [[0.000177864472], 0, 1.755746841430664, 1651814472.098837], "version": 0.2, "tvm_version": "0.8.0"}
{"input": ["cuda -keys=cuda,gpu -max_num_threads=1024 -thread_warp_size=32", "fused_matmul_tensorcore_add.cuda", [["TENSOR", [256, 2048], "float16"], ["TENSOR", [256, 2048], "float16"], ["TENSOR", [512, 2048], "float16"]], {}], "config": {"index": 3683, "code_hash": null, "entity": [["block_row_warps", "ot", 4], ["block_col_warps", "ot", 1], ["warp_row_tiles", "ot", 2], ["warp_col_tiles", "ot", 2], ["chunk", "ot", 2], ["offset", "ot", 8], ["offsetCS", "ot", 8], ["vec", "ot", 4], ["wmma_m", "ot", 32]]}, "result": [[5.0597445e-05], 0, 1.211167812347412, 1651814473.3174229], "version": 0.2, "tvm_version": "0.8.0"}
{"input": ["cuda -keys=cuda,gpu -max_num_threads=1024 -thread_warp_size=32", "fused_matmul_tensorcore_add.cuda", [["TENSOR", [256, 2048], "float16"], ["TENSOR", [256, 2048], "float16"], ["TENSOR", [512, 2048], "float16"]], {}], "config": {"index": 9538, "code_hash": null, "entity": [["block_row_warps", "ot", 2], ["block_col_warps", "ot", 4], ["warp_row_tiles", "ot", 1], ["warp_col_tiles", "ot", 4], ["chunk", "ot", 2], ["offset", "ot", 8], ["offsetCS", "ot", 0], ["vec", "ot", 8], ["wmma_m", "ot", 16]]}, "result": [[8.0657433e-05], 0, 1.3226549625396729, 1651814474.0364685], "version": 0.2, "tvm_version": "0.8.0"}
{"input": ["cuda -keys=cuda,gpu -max_num_threads=1024 -thread_warp_size=32", "fused_matmul_tensorcore_add.cuda", [["TENSOR", [256, 2048], "float16"], ["TENSOR", [256, 2048], "float16"], ["TENSOR", [512, 2048], "float16"]], {}], "config": {"index": 4783, "code_hash": null, "entity": [["block_row_warps", "ot", 2], ["block_col_warps", "ot", 2], ["warp_row_tiles", "ot", 1], ["warp_col_tiles", "ot", 1], ["chunk", "ot", 8], ["offset", "ot", 0], ["offsetCS", "ot", 8], ["vec", "ot", 8], ["wmma_m", "ot", 32]]}, "result": [[8.4259081e-05], 0, 1.2898070812225342, 1651814508.9216406], "version": 0.2, "tvm_version": "0.8.0"}
{"input": ["cuda -keys=cuda,gpu -max_num_threads=1024 -thread_warp_size=32", "fused_matmul_tensorcore_add.cuda", [["TENSOR", [256, 2048], "float16"], ["TENSOR", [256, 2048], "float16"], ["TENSOR", [512, 2048], "float16"]], {}], "config": {"index": 4135, "code_hash": null, "entity": [["block_row_warps", "ot", 2], ["block_col_warps", "ot", 2], ["warp_row_tiles", "ot", 1], ["warp_col_tiles", "ot", 1], ["chunk", "ot", 8], ["offset", "ot", 0], ["offsetCS", "ot", 0], ["vec", "ot", 8], ["wmma_m", "ot", 32]]}, "result": [[7.2267714e-05], 0, 1.2758698463439941, 1651814509.6072292], "version": 0.2, "tvm_version": "0.8.0"}
{"input": ["cuda -keys=cuda,gpu -max_num_threads=1024 -thread_warp_size=32", "fused_matmul_tensorcore_add.cuda", [["TENSOR", [256, 2048], "float16"], ["TENSOR", [256, 2048], "float16"], ["TENSOR", [512, 2048], "float16"]], {}], "config": {"index": 3811, "code_hash": null, "entity": [["block_row_warps", "ot", 2], ["block_col_warps", "ot", 2], ["warp_row_tiles", "ot", 1], ["warp_col_tiles", "ot", 1], ["chunk", "ot", 8], ["offset", "ot", 8], ["offsetCS", "ot", 8], ["vec", "ot", 4], ["wmma_m", "ot", 32]]}, "result": [[2.219063e-05], 0, 1.2502260208129883, 1651814510.1976588], "version": 0.2, "tvm_version": "0.8.0"}
{"input": ["cuda -keys=cuda,gpu -max_num_threads=1024 -thread_warp_size=32", "fused_matmul_tensorcore_add.cuda", [["TENSOR", [256, 2048], "float16"], ["TENSOR", [256, 2048], "float16"], ["TENSOR", [512, 2048], "float16"]], {}], "config": {"index": 3163, "code_hash": null, "entity": [["block_row_warps", "ot", 2], ["block_col_warps", "ot", 2], ["warp_row_tiles", "ot", 1], ["warp_col_tiles", "ot", 1], ["chunk", "ot", 8], ["offset", "ot", 8], ["offsetCS", "ot", 0], ["vec", "ot", 4], ["wmma_m", "ot", 32]]}, "result": [[2.2218232e-05], 0, 1.1652123928070068, 1651814510.7282355], "version": 0.2, "tvm_version": "0.8.0"}
{"input": ["cuda -keys=cuda,gpu -max_num_threads=1024 -thread_warp_size=32", "fused_matmul_tensorcore_add.cuda", [["TENSOR", [256, 2048], "float16"], ["TENSOR", [256, 2048], "float16"], ["TENSOR", [512, 2048], "float16"]], {}], "config": {"index": 3487, "code_hash": null, "entity": [["block_row_warps", "ot", 2], ["block_col_warps", "ot", 2], ["warp_row_tiles", "ot", 1], ["warp_col_tiles", "ot", 1], ["chunk", "ot", 8], ["offset", "ot", 0], ["offsetCS", "ot", 8], ["vec", "ot", 4], ["wmma_m", "ot", 32]]}, "result": [[7.1600553e-05], 0, 1.3054053783416748, 1651814511.422146], "version": 0.2, "tvm_version": "0.8.0"}
{"input": ["cuda -keys=cuda,gpu -max_num_threads=1024 -thread_warp_size=32", "fused_matmul_tensorcore_add.cuda", [["TENSOR", [256, 2048], "float16"], ["TENSOR", [256, 2048], "float16"], ["TENSOR", [512, 2048], "float16"]], {}], "config": {"index": 2839, "code_hash": null, "entity": [["block_row_warps", "ot", 2], ["block_col_warps", "ot", 2], ["warp_row_tiles", "ot", 1], ["warp_col_tiles", "ot", 1], ["chunk", "ot", 8], ["offset", "ot", 0], ["offsetCS", "ot", 0], ["vec", "ot", 4], ["wmma_m", "ot", 32]]}, "result": [[7.1261812e-05], 0, 1.3906071186065674, 1651814512.153065], "version": 0.2, "tvm_version": "0.8.0"}
{"input": ["cuda -keys=cuda,gpu -max_num_threads=1024 -thread_warp_size=32", "fused_matmul_tensorcore_add.cuda", [["TENSOR", [256, 2048], "float16"], ["TENSOR", [256, 2048], "float16"], ["TENSOR", [512, 2048], "float16"]], {}], "config": {"index": 3406, "code_hash": null, "entity": [["block_row_warps", "ot", 2], ["block_col_warps", "ot", 2], ["warp_row_tiles", "ot", 1], ["warp_col_tiles", "ot", 1], ["chunk", "ot", 4], ["offset", "ot", 0], ["offsetCS", "ot", 8], ["vec", "ot", 4], ["wmma_m", "ot", 32]]}, "result": [[7.6422737e-05], 0, 1.2413363456726074, 1651814512.8256137], "version": 0.2, "tvm_version": "0.8.0"}
{"input": ["cuda -keys=cuda,gpu -max_num_threads=1024 -thread_warp_size=32", "fused_matmul_tensorcore_add.cuda", [["TENSOR", [256, 2048], "float16"], ["TENSOR", [256, 2048], "float16"], ["TENSOR", [512, 2048], "float16"]], {}], "config": {"index": 4297, "code_hash": null, "entity": [["block_row_warps", "ot", 2], ["block_col_warps", "ot", 2], ["warp_row_tiles", "ot", 1], ["warp_col_tiles", "ot", 1], ["chunk", "ot", 2], ["offset", "ot", 8], ["offsetCS", "ot", 0], ["vec", "ot", 8], ["wmma_m", "ot", 32]]}, "result": [[5.2426356e-05], 0, 1.1747419834136963, 1651814513.4393098], "version": 0.2, "tvm_version": "0.8.0"}
{"input": ["cuda -keys=cuda,gpu -max_num_threads=1024 -thread_warp_size=32", "fused_matmul_tensorcore_add.cuda", [["TENSOR", [256, 2048], "float16"], ["TENSOR", [256, 2048], "float16"], ["TENSOR", [512, 2048], "float16"]], {}], "config": {"index": 3973, "code_hash": null, "entity": [["block_row_warps", "ot", 2], ["block_col_warps", "ot", 2], ["warp_row_tiles", "ot", 1], ["warp_col_tiles", "ot", 1], ["chunk", "ot", 2], ["offset", "ot", 0], ["offsetCS", "ot", 0], ["vec", "ot", 8], ["wmma_m", "ot", 32]]}, "result": [[7.9615856e-05], 0, 1.2909269332885742, 1651814514.1984622], "version": 0.2, "tvm_version": "0.8.0"}
{"input": ["cuda -keys=cuda,gpu -max_num_threads=1024 -thread_warp_size=32", "fused_matmul_tensorcore_add.cuda", [["TENSOR", [256, 2048], "float16"], ["TENSOR", [256, 2048], "float16"], ["TENSOR", [512, 2048], "float16"]], {}], "config": {"index": 4945, "code_hash": null, "entity": [["block_row_warps", "ot", 2], ["block_col_warps", "ot", 2], ["warp_row_tiles", "ot", 1], ["warp_col_tiles", "ot", 1], ["chunk", "ot", 2], ["offset", "ot", 8], ["offsetCS", "ot", 8], ["vec", "ot", 8], ["wmma_m", "ot", 32]]}, "result": [[5.2099344e-05], 0, 1.1990437507629395, 1651814514.8169062], "version": 0.2, "tvm_version": "0.8.0"}
{"input": ["cuda -keys=cuda,gpu -max_num_threads=1024 -thread_warp_size=32", "fused_matmul_tensorcore_add.cuda", [["TENSOR", [256, 2048], "float16"], ["TENSOR", [256, 2048], "float16"], ["TENSOR", [512, 2048], "float16"]], {}], "config": {"index": 3730, "code_hash": null, "entity": [["block_row_warps", "ot", 2], ["block_col_warps", "ot", 2], ["warp_row_tiles", "ot", 1], ["warp_col_tiles", "ot", 1], ["chunk", "ot", 4], ["offset", "ot", 8], ["offsetCS", "ot", 8], ["vec", "ot", 4], ["wmma_m", "ot", 32]]}, "result": [[2.8214041000000003e-05], 0, 1.110111951828003, 1651814515.3643515], "version": 0.2, "tvm_version": "0.8.0"}
{"input": ["cuda -keys=cuda,gpu -max_num_threads=1024 -thread_warp_size=32", "fused_matmul_tensorcore_add.cuda", [["TENSOR", [256, 2048], "float16"], ["TENSOR", [256, 2048], "float16"], ["TENSOR", [512, 2048], "float16"]], {}], "config": {"index": 4702, "code_hash": null, "entity": [["block_row_warps", "ot", 2], ["block_col_warps", "ot", 2], ["warp_row_tiles", "ot", 1], ["warp_col_tiles", "ot", 1], ["chunk", "ot", 4], ["offset", "ot", 0], ["offsetCS", "ot", 8], ["vec", "ot", 8], ["wmma_m", "ot", 32]]}, "result": [[7.2256958e-05], 0, 1.2127647399902344, 1651814516.0985234], "version": 0.2, "tvm_version": "0.8.0"}
{"input": ["cuda -keys=cuda,gpu -max_num_threads=1024 -thread_warp_size=32", "fused_matmul_tensorcore_add.cuda", [["TENSOR", [256, 2048], "float16"], ["TENSOR", [256, 2048], "float16"], ["TENSOR", [512, 2048], "float16"]], {}], "config": {"index": 3325, "code_hash": null, "entity": [["block_row_warps", "ot", 2], ["block_col_warps", "ot", 2], ["warp_row_tiles", "ot", 1], ["warp_col_tiles", "ot", 1], ["chunk", "ot", 2], ["offset", "ot", 0], ["offsetCS", "ot", 8], ["vec", "ot", 4], ["wmma_m", "ot", 32]]}, "result": [[4.8491292e-05], 0, 1.201906681060791, 1651814516.7125087], "version": 0.2, "tvm_version": "0.8.0"}
{"input": ["cuda -keys=cuda,gpu -max_num_threads=1024 -thread_warp_size=32", "fused_matmul_tensorcore_add.cuda", [["TENSOR", [256, 2048], "float16"], ["TENSOR", [256, 2048], "float16"], ["TENSOR", [512, 2048], "float16"]], {}], "config": {"index": 4054, "code_hash": null, "entity": [["block_row_warps", "ot", 2], ["block_col_warps", "ot", 2], ["warp_row_tiles", "ot", 1], ["warp_col_tiles", "ot", 1], ["chunk", "ot", 4], ["offset", "ot", 0], ["offsetCS", "ot", 0], ["vec", "ot", 8], ["wmma_m", "ot", 32]]}, "result": [[7.2499237e-05], 0, 1.232069730758667, 1651814517.3932257], "version": 0.2, "tvm_version": "0.8.0"}
{"input": ["cuda -keys=cuda,gpu -max_num_threads=1024 -thread_warp_size=32", "fused_matmul_tensorcore_add.cuda", [["TENSOR", [256, 2048], "float16"], ["TENSOR", [256, 2048], "float16"], ["TENSOR", [512, 2048], "float16"]], {}], "config": {"index": 4621, "code_hash": null, "entity": [["block_row_warps", "ot", 2], ["block_col_warps", "ot", 2], ["warp_row_tiles", "ot", 1], ["warp_col_tiles", "ot", 1], ["chunk", "ot", 2], ["offset", "ot", 0], ["offsetCS", "ot", 8], ["vec", "ot", 8], ["wmma_m", "ot", 32]]}, "result": [[7.9613906e-05], 0, 1.3568613529205322, 1651814518.1447856], "version": 0.2, "tvm_version": "0.8.0"}
