python/models/swin_transformer/kernel_configs/swin_transformer_auto_tvm_qeury_key_matmul_q_k_4_16_64_32.log
{"input": ["cuda -keys=cuda,gpu -max_num_threads=1024 -thread_warp_size=32", "batch_matmul_tensorcore_q_k.cuda", [["TENSOR", [64, 64, 32], "float16"], ["TENSOR", [64, 64, 32], "float16"]], {}], "config": {"index": 72605, "code_hash": null, "entity": [["block_row_warps", "ot", 8], ["warp_row_tiles", "ot", 1], ["warp_col_tiles", "ot", 1], ["chunk", "ot", 4], ["offset", "ot", 8], ["offsetCS", "ot", 0], ["vec", "ot", 8], ["wmma_m", "ot", 8]]}, "result": [[4.271749e-05], 0, 1.2708137035369873, 1651068017.3992028], "version": 0.2, "tvm_version": "0.8.0"}
{"input": ["cuda -keys=cuda,gpu -max_num_threads=1024 -thread_warp_size=32", "batch_matmul_tensorcore_q_k.cuda", [["TENSOR", [64, 64, 32], "float16"], ["TENSOR", [64, 64, 32], "float16"]], {}], "config": {"index": 24487, "code_hash": null, "entity": [["block_row_warps", "ot", 16], ["warp_row_tiles", "ot", 1], ["warp_col_tiles", "ot", 4], ["chunk", "ot", 3], ["offset", "ot", 8], ["offsetCS", "ot", 8], ["vec", "ot", 8], ["wmma_m", "ot", 32]]}, "result": [[1.8598783e-05], 0, 1.26287841796875, 1651068018.4512334], "version": 0.2, "tvm_version": "0.8.0"}
{"input": ["cuda -keys=cuda,gpu -max_num_threads=1024 -thread_warp_size=32", "batch_matmul_tensorcore_q_k.cuda", [["TENSOR", [64, 64, 32], "float16"], ["TENSOR", [64, 64, 32], "float16"]], {}], "config": {"index": 14244, "code_hash": null, "entity": [["block_row_warps", "ot", 6], ["warp_row_tiles", "ot", 1], ["warp_col_tiles", "ot", 2], ["chunk", "ot", 16], ["offset", "ot", 0], ["offsetCS", "ot", 0], ["vec", "ot", 4], ["wmma_m", "ot", 32]]}, "result": [[4.988932e-05], 0, 1.353562831878662, 1651068019.1409342], "version": 0.2, "tvm_version": "0.8.0"}
{"input": ["cuda -keys=cuda,gpu -max_num_threads=1024 -thread_warp_size=32", "batch_matmul_tensorcore_q_k.cuda", [["TENSOR", [64, 64, 32], "float16"], ["TENSOR", [64, 64, 32], "float16"]], {}], "config": {"index": 12297, "code_hash": null, "entity": [["block_row_warps", "ot", 2], ["warp_row_tiles", "ot", 4], ["warp_col_tiles", "ot", 4], ["chunk", "ot", 8], ["offset", "ot", 8], ["offsetCS", "ot", 8], ["vec", "ot", 2], ["wmma_m", "ot", 32]]}, "result": [[4.629743692660551e-06], 0, 1.2029681205749512, 1651068019.7773938], "version": 0.2, "tvm_version": "0.8.0"}
{"input": ["cuda -keys=cuda,gpu -max_num_threads=1024 -thread_warp_size=32", "batch_matmul_tensorcore_q_k.cuda", [["TENSOR", [64, 64, 32], "float16"], ["TENSOR", [64, 64, 32], "float16"]], {}], "config": {"index": 12409, "code_hash": null, "entity": [["block_row_warps", "ot", 2], ["warp_row_tiles", "ot", 2], ["warp_col_tiles", "ot", 1], ["chunk", "ot", 12], ["offset", "ot", 8], ["offsetCS", "ot", 8], ["vec", "ot", 2], ["wmma_m", "ot", 32]]}, "result": [[8.685187886279357e-06], 0, 1.1606972217559814, 1651068020.7754993], "version": 0.2, "tvm_version": "0.8.0"}
{"input": ["cuda -keys=cuda,gpu -max_num_threads=1024 -thread_warp_size=32", "batch_matmul_tensorcore_q_k.cuda", [["TENSOR", [64, 64, 32], "float16"], ["TENSOR", [64, 64, 32], "float16"]], {}], "config": {"index": 17077, "code_hash": null, "entity": [["block_row_warps", "ot", 8], ["warp_row_tiles", "ot", 8], ["warp_col_tiles", "ot", 2], ["chunk", "ot", 8], ["offset", "ot", 0], ["offsetCS", "ot", 8], ["vec", "ot", 4], ["wmma_m", "ot", 32]]}, "result": [[5.797829500000001e-05], 0, 1.3256642818450928, 1651068021.4776182], "version": 0.2, "tvm_version": "0.8.0"}
{"input": ["cuda -keys=cuda,gpu -max_num_threads=1024 -thread_warp_size=32", "batch_matmul_tensorcore_q_k.cuda", [["TENSOR", [64, 64, 32], "float16"], ["TENSOR", [64, 64, 32], "float16"]], {}], "config": {"index": 48417, "code_hash": null, "entity": [["block_row_warps", "ot", 2], ["warp_row_tiles", "ot", 4], ["warp_col_tiles", "ot", 1], ["chunk", "ot", 3], ["offset", "ot", 0], ["offsetCS", "ot", 8], ["vec", "ot", 8], ["wmma_m", "ot", 16]]}, "result": [[7.5255735475896165e-06], 0, 1.0578160285949707, 1651068022.5154476], "version": 0.2, "tvm_version": "0.8.0"}
{"input": ["cuda -keys=cuda,gpu -max_num_threads=1024 -thread_warp_size=32", "batch_matmul_tensorcore_q_k.cuda", [["TENSOR", [64, 64, 32], "float16"], ["TENSOR", [64, 64, 32], "float16"]], {}], "config": {"index": 10139, "code_hash": null, "entity": [["block_row_warps", "ot", 4], ["warp_row_tiles", "ot", 4], ["warp_col_tiles", "ot", 8], ["chunk", "ot", 3], ["offset", "ot", 0], ["offsetCS", "ot", 8], ["vec", "ot", 2], ["wmma_m", "ot", 32]]}, "result": [[5.682492610837437e-06], 0, 1.2477283477783203, 1651068023.0940897], "version": 0.2, "tvm_version": "0.8.0"}
{"input": ["cuda -keys=cuda,gpu -max_num_threads=1024 -thread_warp_size=32", "batch_matmul_tensorcore_q_k.cuda", [["TENSOR", [64, 64, 32], "float16"], ["TENSOR", [64, 64, 32], "float16"]], {}], "config": {"index": 39696, "code_hash": null, "entity": [["block_row_warps", "ot", 1], ["warp_row_tiles", "ot", 4], ["warp_col_tiles", "ot", 4], ["chunk", "ot", 12], ["offset", "ot", 0], ["offsetCS", "ot", 0], ["vec", "ot", 4], ["wmma_m", "ot", 16]]}, "result": [[7.75140173053152e-06], 0, 1.1083636283874512, 1651068024.6237967], "version": 0.2, "tvm_version": "0.8.0"}
{"input": ["cuda -keys=cuda,gpu -max_num_threads=1024 -thread_warp_size=32", "batch_matmul_tensorcore_q_k.cuda", [["TENSOR", [64, 64, 32], "float16"], ["TENSOR", [64, 64, 32], "float16"]], {}], "config": {"index": 11736, "code_hash": null, "entity": [["block_row_warps", "ot", 1], ["warp_row_tiles", "ot", 4], ["warp_col_tiles", "ot", 8], ["chunk", "ot", 3], ["offset", "ot", 8], ["offsetCS", "ot", 8], ["vec", "ot", 2], ["wmma_m", "ot", 32]]}, "result": [[1.0839155e-05], 0, 1.184704303741455, 1651068026.7077417], "version": 0.2, "tvm_version": "0.8.0"}
{"input": ["cuda -keys=cuda,gpu -max_num_threads=1024 -thread_warp_size=32", "batch_matmul_tensorcore_q_k.cuda", [["TENSOR", [64, 64, 32], "float16"], ["TENSOR", [64, 64, 32], "float16"]], {}], "config": {"index": 24869, "code_hash": null, "entity": [["block_row_warps", "ot", 8], ["warp_row_tiles", "ot", 6], ["warp_col_tiles", "ot", 2], ["chunk", "ot", 6], ["offset", "ot", 8], ["offsetCS", "ot", 8], ["vec", "ot", 8], ["wmma_m", "ot", 32]]}, "result": [[3.3839699e-05], 0, 1.3638436794281006, 1651068027.4414365], "version": 0.2, "tvm_version": "0.8.0"}
{"input": ["cuda -keys=cuda,gpu -max_num_threads=1024 -thread_warp_size=32", "batch_matmul_tensorcore_q_k.cuda", [["TENSOR", [64, 64, 32], "float16"], ["TENSOR", [64, 64, 32], "float16"]], {}], "config": {"index": 75261, "code_hash": null, "entity": [["block_row_warps", "ot", 8], ["warp_row_tiles", "ot", 4], ["warp_col_tiles", "ot", 2], ["chunk", "ot", 1], ["offset", "ot", 8], ["offsetCS", "ot", 8], ["vec", "ot", 8], ["wmma_m", "ot", 8]]}, "result": [[1.2085561e-05], 0, 1.1335303783416748, 1651068029.0218227], "version": 0.2, "tvm_version": "0.8.0"}
{"input": ["cuda -keys=cuda,gpu -max_num_threads=1024 -thread_warp_size=32", "batch_matmul_tensorcore_q_k.cuda", [["TENSOR", [64, 64, 32], "float16"], ["TENSOR", [64, 64, 32], "float16"]], {}], "config": {"index": 46434, "code_hash": null, "entity": [["block_row_warps", "ot", 3], ["warp_row_tiles", "ot", 8], ["warp_col_tiles", "ot", 1], ["chunk", "ot", 1], ["offset", "ot", 8], ["offsetCS", "ot", 0], ["vec", "ot", 8], ["wmma_m", "ot", 16]]}, "result": [[3.1331215000000004e-05], 0, 1.378007173538208, 1651068029.7560322], "version": 0.2, "tvm_version": "0.8.0"}
{"input": ["cuda -keys=cuda,gpu -max_num_threads=1024 -thread_warp_size=32", "batch_matmul_tensorcore_q_k.cuda", [["TENSOR", [64, 64, 32], "float16"], ["TENSOR", [64, 64, 32], "float16"]], {}], "config": {"index": 72877, "code_hash": null, "entity": [["block_row_warps", "ot", 8], ["warp_row_tiles", "ot", 8], ["warp_col_tiles", "ot", 2], ["chunk", "ot", 6], ["offset", "ot", 8], ["offsetCS", "ot", 0], ["vec", "ot", 8], ["wmma_m", "ot", 8]]}, "result": [[1.4287668999999999e-05], 0, 1.16890549659729, 1651068030.8703752], "version": 0.2, "tvm_version": "0.8.0"}
{"input": ["cuda -keys=cuda,gpu -max_num_threads=1024 -thread_warp_size=32", "batch_matmul_tensorcore_q_k.cuda", [["TENSOR", [64, 64, 32], "float16"], ["TENSOR", [64, 64, 32], "float16"]], {}], "config": {"index": 38624, "code_hash": null, "entity": [["block_row_warps", "ot", 1], ["warp_row_tiles", "ot", 6], ["warp_col_tiles", "ot", 1], ["chunk", "ot", 2], ["offset", "ot", 0], ["offsetCS", "ot", 0], ["vec", "ot", 4], ["wmma_m", "ot", 16]]}, "result": [[1.0129791000000001e-05], 0, 1.0892767906188965, 1651068031.9542277], "version": 0.2, "tvm_version": "0.8.0"}
{"input": ["cuda -keys=cuda,gpu -max_num_threads=1024 -thread_warp_size=32", "batch_matmul_tensorcore_q_k.cuda", [["TENSOR", [64, 64, 32], "float16"], ["TENSOR", [64, 64, 32], "float16"]], {}], "config": {"index": 893, "code_hash": null, "entity": [["block_row_warps", "ot", 8], ["warp_row_tiles", "ot", 2], ["warp_col_tiles", "ot", 4], ["chunk", "ot", 6], ["offset", "ot", 0], ["offsetCS", "ot", 0], ["vec", "ot", 1], ["wmma_m", "ot", 32]]}, "result": [[2.2234559999999996e-05], 0, 1.139514684677124, 1651068036.7704194], "version": 0.2, "tvm_version": "0.8.0"}
{"input": ["cuda -keys=cuda,gpu -max_num_threads=1024 -thread_warp_size=32", "batch_matmul_tensorcore_q_k.cuda", [["TENSOR", [64, 64, 32], "float16"], ["TENSOR", [64, 64, 32], "float16"]], {}], "config": {"index": 2218, "code_hash": null, "entity": [["block_row_warps", "ot", 3], ["warp_row_tiles", "ot", 4], ["warp_col_tiles", "ot", 1], ["chunk", "ot", 4], ["offset", "ot", 8], ["offsetCS", "ot", 0], ["vec", "ot", 1], ["wmma_m", "ot", 32]]}, "result": [[2.9208702e-05], 0, 1.3734657764434814, 1651068037.5030923], "version": 0.2, "tvm_version": "0.8.0"}
{"input": ["cuda -keys=cuda,gpu -max_num_threads=1024 -thread_warp_size=32", "batch_matmul_tensorcore_q_k.cuda", [["TENSOR", [64, 64, 32], "float16"], ["TENSOR", [64, 64, 32], "float16"]], {}], "config": {"index": 15519, "code_hash": null, "entity": [["block_row_warps", "ot", 16], ["warp_row_tiles", "ot", 8], ["warp_col_tiles", "ot", 4], ["chunk", "ot", 8], ["offset", "ot", 8], ["offsetCS", "ot", 0], ["vec", "ot", 4], ["wmma_m", "ot", 32]]}, "result": [[4.2507868999999995e-05], 0, 1.2166414260864258, 1651068038.6543708], "version": 0.2, "tvm_version": "0.8.0"}
{"input": ["cuda -keys=cuda,gpu -max_num_threads=1024 -thread_warp_size=32", "batch_matmul_tensorcore_q_k.cuda", [["TENSOR", [64, 64, 32], "float16"], ["TENSOR", [64, 64, 32], "float16"]], {}], "config": {"index": 45068, "code_hash": null, "entity": [["block_row_warps", "ot", 6], ["warp_row_tiles", "ot", 6], ["warp_col_tiles", "ot", 2], ["chunk", "ot", 2], ["offset", "ot", 0], ["offsetCS", "ot", 0], ["vec", "ot", 8], ["wmma_m", "ot", 16]]}, "result": [[1.6821793e-05], 0, 1.043975591659546, 1651068039.7672238], "version": 0.2, "tvm_version": "0.8.0"}
{"input": ["cuda -keys=cuda,gpu -max_num_threads=1024 -thread_warp_size=32", "batch_matmul_tensorcore_q_k.cuda", [["TENSOR", [64, 64, 32], "float16"], ["TENSOR", [64, 64, 32], "float16"]], {}], "config": {"index": 22074, "code_hash": null, "entity": [["block_row_warps", "ot", 3], ["warp_row_tiles", "ot", 8], ["warp_col_tiles", "ot", 2], ["chunk", "ot", 12], ["offset", "ot", 8], ["offsetCS", "ot", 0], ["vec", "ot", 8], ["wmma_m", "ot", 32]]}, "result": [[1.7387019e-05], 0, 1.315857172012329, 1651068040.3977919], "version": 0.2, "tvm_version": "0.8.0"}
{"input": ["cuda -keys=cuda,gpu -max_num_threads=1024 -thread_warp_size=32", "batch_matmul_tensorcore_q_k.cuda", [["TENSOR", [64, 64, 32], "float16"], ["TENSOR", [64, 64, 32], "float16"]], {}], "config": {"index": 41669, "code_hash": null, "entity": [["block_row_warps", "ot", 8], ["warp_row_tiles", "ot", 6], ["warp_col_tiles", "ot", 2], ["chunk", "ot", 1], ["offset", "ot", 0], ["offsetCS", "ot", 8], ["vec", "ot", 4], ["wmma_m", "ot", 16]]}, "result": [[1.8217134000000002e-05], 0, 1.0116169452667236, 1651068041.5289915], "version": 0.2, "tvm_version": "0.8.0"}
{"input": ["cuda -keys=cuda,gpu -max_num_threads=1024 -thread_warp_size=32", "batch_matmul_tensorcore_q_k.cuda", [["TENSOR", [64, 64, 32], "float16"], ["TENSOR", [64, 64, 32], "float16"]], {}], "config": {"index": 61662, "code_hash": null, "entity": [["block_row_warps", "ot", 12], ["warp_row_tiles", "ot", 4], ["warp_col_tiles", "ot", 2], ["chunk", "ot", 6], ["offset", "ot", 0], ["offsetCS", "ot", 8], ["vec", "ot", 2], ["wmma_m", "ot", 8]]}, "result": [[1.6111034e-05], 0, 1.071537971496582, 1651068042.1884155], "version": 0.2, "tvm_version": "0.8.0"}
{"input": ["cuda -keys=cuda,gpu -max_num_threads=1024 -thread_warp_size=32", "batch_matmul_tensorcore_q_k.cuda", [["TENSOR", [64, 64, 32], "float16"], ["TENSOR", [64, 64, 32], "float16"]], {}], "config": {"index": 10299, "code_hash": null, "entity": [["block_row_warps", "ot", 4], ["warp_row_tiles", "ot", 4], ["warp_col_tiles", "ot", 4], ["chunk", "ot", 4], ["offset", "ot", 0], ["offsetCS", "ot", 8], ["vec", "ot", 2], ["wmma_m", "ot", 32]]}, "result": [[1.6412861e-05], 0, 1.1651828289031982, 1651068043.2829368], "version": 0.2, "tvm_version": "0.8.0"}
{"input": ["cuda -keys=cuda,gpu -max_num_threads=1024 -thread_warp_size=32", "batch_matmul_tensorcore_q_k.cuda", [["TENSOR", [64, 64, 32], "float16"], ["TENSOR", [64, 64, 32], "float16"]], {}], "config": {"index": 51255, "code_hash": null, "entity": [["block_row_warps", "ot", 16], ["warp_row_tiles", "ot", 2], ["warp_col_tiles", "ot", 2], ["chunk", "ot", 1], ["offset", "ot", 0], ["offsetCS", "ot", 0], ["vec", "ot", 1], ["wmma_m", "ot", 8]]}, "result": [[2.6667928e-05], 0, 1.1686375141143799, 1651068044.4768033], "version": 0.2, "tvm_version": "0.8.0"}
{"input": ["cuda -keys=cuda,gpu -max_num_threads=1024 -thread_warp_size=32", "batch_matmul_tensorcore_q_k.cuda", [["TENSOR", [64, 64, 32], "float16"], ["TENSOR", [64, 64, 32], "float16"]], {}], "config": {"index": 48801, "code_hash": null, "entity": [["block_row_warps", "ot", 2], ["warp_row_tiles", "ot", 1], ["warp_col_tiles", "ot", 1], ["chunk", "ot", 6], ["offset", "ot", 0], ["offsetCS", "ot", 8], ["vec", "ot", 8], ["wmma_m", "ot", 16]]}, "result": [[2.710379e-05], 0, 0.9226679801940918, 1651068047.109571], "version": 0.2, "tvm_version": "0.8.0"}
{"input": ["cuda -keys=cuda,gpu -max_num_threads=1024 -thread_warp_size=32", "batch_matmul_tensorcore_q_k.cuda", [["TENSOR", [64, 64, 32], "float16"], ["TENSOR", [64, 64, 32], "float16"]], {}], "config": {"index": 21357, "code_hash": null, "entity": [["block_row_warps", "ot", 8], ["warp_row_tiles", "ot", 8], ["warp_col_tiles", "ot", 8], ["chunk", "ot", 3], ["offset", "ot", 8], ["offsetCS", "ot", 0], ["vec", "ot", 8], ["wmma_m", "ot", 32]]}, "result": [[2.4505455e-05], 0, 0.9544639587402344, 1651068048.280558], "version": 0.2, "tvm_version": "0.8.0"}
{"input": ["cuda -keys=cuda,gpu -max_num_threads=1024 -thread_warp_size=32", "batch_matmul_tensorcore_q_k.cuda", [["TENSOR", [64, 64, 32], "float16"], ["TENSOR", [64, 64, 32], "float16"]], {}], "config": {"index": 5032, "code_hash": null, "entity": [["block_row_warps", "ot", 1], ["warp_row_tiles", "ot", 8], ["warp_col_tiles", "ot", 1], ["chunk", "ot", 2], ["offset", "ot", 8], ["offsetCS", "ot", 8], ["vec", "ot", 1], ["wmma_m", "ot", 32]]}, "result": [[1.1677004e-05], 0, 0.89316725730896, 1651068049.327007], "version": 0.2, "tvm_version": "0.8.0"}
{"input": ["cuda -keys=cuda,gpu -max_num_threads=1024 -thread_warp_size=32", "batch_matmul_tensorcore_q_k.cuda", [["TENSOR", [64, 64, 32], "float16"], ["TENSOR", [64, 64, 32], "float16"]], {}], "config": {"index": 73422, "code_hash": null, "entity": [["block_row_warps", "ot", 12], ["warp_row_tiles", "ot", 4], ["warp_col_tiles", "ot", 1], ["chunk", "ot", 16], ["offset", "ot", 8], ["offsetCS", "ot", 0], ["vec", "ot", 8], ["wmma_m", "ot", 8]]}, "result": [[3.0665107e-05], 0, 1.0518865585327148, 1651068050.033885], "version": 0.2, "tvm_version": "0.8.0"}
{"input": ["cuda -keys=cuda,gpu -max_num_threads=1024 -thread_warp_size=32", "batch_matmul_tensorcore_q_k.cuda", [["TENSOR", [64, 64, 32], "float16"], ["TENSOR", [64, 64, 32], "float16"]], {}], "config": {"index": 75463, "code_hash": null, "entity": [["block_row_warps", "ot", 16], ["warp_row_tiles", "ot", 4], ["warp_col_tiles", "ot", 2], ["chunk", "ot", 2], ["offset", "ot", 8], ["offsetCS", "ot", 8], ["vec", "ot", 8], ["wmma_m", "ot", 8]]}, "result": [[1.4389874e-05], 0, 0.9221959114074707, 1651068051.0819218], "version": 0.2, "tvm_version": "0.8.0"}
{"input": ["cuda -keys=cuda,gpu -max_num_threads=1024 -thread_warp_size=32", "batch_matmul_tensorcore_q_k.cuda", [["TENSOR", [64, 64, 32], "float16"], ["TENSOR", [64, 64, 32], "float16"]], {}], "config": {"index": 76414, "code_hash": null, "entity": [["block_row_warps", "ot", 12], ["warp_row_tiles", "ot", 2], ["warp_col_tiles", "ot", 1], ["chunk", "ot", 12], ["offset", "ot", 8], ["offsetCS", "ot", 8], ["vec", "ot", 8], ["wmma_m", "ot", 8]]}, "result": [[2.4276107e-05], 0, 1.1546881198883057, 1651068051.7167728], "version": 0.2, "tvm_version": "0.8.0"}
{"input": ["cuda -keys=cuda,gpu -max_num_threads=1024 -thread_warp_size=32", "batch_matmul_tensorcore_q_k.cuda", [["TENSOR", [64, 64, 32], "float16"], ["TENSOR", [64, 64, 32], "float16"]], {}], "config": {"index": 47277, "code_hash": null, "entity": [["block_row_warps", "ot", 8], ["warp_row_tiles", "ot", 8], ["warp_col_tiles", "ot", 2], ["chunk", "ot", 6], ["offset", "ot", 8], ["offsetCS", "ot", 0], ["vec", "ot", 8], ["wmma_m", "ot", 16]]}, "result": [[2.2395702999999998e-05], 0, 1.1692259311676025, 1651068052.8444483], "version": 0.2, "tvm_version": "0.8.0"}
{"input": ["cuda -keys=cuda,gpu -max_num_threads=1024 -thread_warp_size=32", "batch_matmul_tensorcore_q_k.cuda", [["TENSOR", [64, 64, 32], "float16"], ["TENSOR", [64, 64, 32], "float16"]], {}], "config": {"index": 13652, "code_hash": null, "entity": [["block_row_warps", "ot", 6], ["warp_row_tiles", "ot", 2], ["warp_col_tiles", "ot", 2], ["chunk", "ot", 6], ["offset", "ot", 0], ["offsetCS", "ot", 0], ["vec", "ot", 4], ["wmma_m", "ot", 32]]}, "result": [[3.5467765e-05], 0, 1.255969762802124, 1651068053.555089], "version": 0.2, "tvm_version": "0.8.0"}
{"input": ["cuda -keys=cuda,gpu -max_num_threads=1024 -thread_warp_size=32", "batch_matmul_tensorcore_q_k.cuda", [["TENSOR", [64, 64, 32], "float16"], ["TENSOR", [64, 64, 32], "float16"]], {}], "config": {"index": 21866, "code_hash": null, "entity": [["block_row_warps", "ot", 3], ["warp_row_tiles", "ot", 6], ["warp_col_tiles", "ot", 2], ["chunk", "ot", 8], ["offset", "ot", 8], ["offsetCS", "ot", 0], ["vec", "ot", 8], ["wmma_m", "ot", 32]]}, "result": [[1.5360635000000002e-05], 0, 1.0467894077301025, 1651068054.6768537], "version": 0.2, "tvm_version": "0.8.0"}
{"input": ["cuda -keys=cuda,gpu -max_num_threads=1024 -thread_warp_size=32", "batch_matmul_tensorcore_q_k.cuda", [["TENSOR", [64, 64, 32], "float16"], ["TENSOR", [64, 64, 32], "float16"]], {}], "config": {"index": 47511, "code_hash": null, "entity": [["block_row_warps", "ot", 16], ["warp_row_tiles", "ot", 6], ["warp_col_tiles", "ot", 4], ["chunk", "ot", 8], ["offset", "ot", 8], ["offsetCS", "ot", 0], ["vec", "ot", 8], ["wmma_m", "ot", 16]]}, "result": [[2.6313806e-05], 0, 1.0736563205718994, 1651068055.8053565], "version": 0.2, "tvm_version": "0.8.0"}
{"input": ["cuda -keys=cuda,gpu -max_num_threads=1024 -thread_warp_size=32", "batch_matmul_tensorcore_q_k.cuda", [["TENSOR", [64, 64, 32], "float16"], ["TENSOR", [64, 64, 32], "float16"]], {}], "config": {"index": 54836, "code_hash": null, "entity": [["block_row_warps", "ot", 6], ["warp_row_tiles", "ot", 8], ["warp_col_tiles", "ot", 1], ["chunk", "ot", 3], ["offset", "ot", 0], ["offsetCS", "ot", 8], ["vec", "ot", 1], ["wmma_m", "ot", 8]]}, "result": [[1.2614354000000002e-05], 0, 1.050567388534546, 1651068056.5305996], "version": 0.2, "tvm_version": "0.8.0"}
{"input": ["cuda -keys=cuda,gpu -max_num_threads=1024 -thread_warp_size=32", "batch_matmul_tensorcore_q_k.cuda", [["TENSOR", [64, 64, 32], "float16"], ["TENSOR", [64, 64, 32], "float16"]], {}], "config": {"index": 51236, "code_hash": null, "entity": [["block_row_warps", "ot", 6], ["warp_row_tiles", "ot", 8], ["warp_col_tiles", "ot", 1], ["chunk", "ot", 1], ["offset", "ot", 0], ["offsetCS", "ot", 0], ["vec", "ot", 1], ["wmma_m", "ot", 8]]}, "result": [[2.2048791e-05], 0, 1.1040661334991455, 1651068059.1796188], "version": 0.2, "tvm_version": "0.8.0"}
{"input": ["cuda -keys=cuda,gpu -max_num_threads=1024 -thread_warp_size=32", "batch_matmul_tensorcore_q_k.cuda", [["TENSOR", [64, 64, 32], "float16"], ["TENSOR", [64, 64, 32], "float16"]], {}], "config": {"index": 18541, "code_hash": null, "entity": [["block_row_warps", "ot", 8], ["warp_row_tiles", "ot", 4], ["warp_col_tiles", "ot", 8], ["chunk", "ot", 6], ["offset", "ot", 8], ["offsetCS", "ot", 8], ["vec", "ot", 4], ["wmma_m", "ot", 32]]}, "result": [[1.0251874000000001e-05], 0, 1.0297510623931885, 1651068059.8547206], "version": 0.2, "tvm_version": "0.8.0"}
{"input": ["cuda -keys=cuda,gpu -max_num_threads=1024 -thread_warp_size=32", "batch_matmul_tensorcore_q_k.cuda", [["TENSOR", [64, 64, 32], "float16"], ["TENSOR", [64, 64, 32], "float16"]], {}], "config": {"index": 49683, "code_hash": null, "entity": [["block_row_warps", "ot", 4], ["warp_row_tiles", "ot", 1], ["warp_col_tiles", "ot", 4], ["chunk", "ot", 1], ["offset", "ot", 8], ["offsetCS", "ot", 8], ["vec", "ot", 8], ["wmma_m", "ot", 16]]}, "result": [[8.009784919653895e-06], 0, 0.9206616878509521, 1651068060.8743212], "version": 0.2, "tvm_version": "0.8.0"}
{"input": ["cuda -keys=cuda,gpu -max_num_threads=1024 -thread_warp_size=32", "batch_matmul_tensorcore_q_k.cuda", [["TENSOR", [64, 64, 32], "float16"], ["TENSOR", [64, 64, 32], "float16"]], {}], "config": {"index": 16896, "code_hash": null, "entity": [["block_row_warps", "ot", 1], ["warp_row_tiles", "ot", 4], ["warp_col_tiles", "ot", 4], ["chunk", "ot", 6], ["offset", "ot", 0], ["offsetCS", "ot", 8], ["vec", "ot", 4], ["wmma_m", "ot", 32]]}, "result": [[9.241404202719406e-06], 0, 1.1059925556182861, 1651068104.4383318], "version": 0.2, "tvm_version": "0.8.0"}
{"input": ["cuda -keys=cuda,gpu -max_num_threads=1024 -thread_warp_size=32", "batch_matmul_tensorcore_q_k.cuda", [["TENSOR", [64, 64, 32], "float16"], ["TENSOR", [64, 64, 32], "float16"]], {}], "config": {"index": 16496, "code_hash": null, "entity": [["block_row_warps", "ot", 1], ["warp_row_tiles", "ot", 4], ["warp_col_tiles", "ot", 4], ["chunk", "ot", 3], ["offset", "ot", 0], ["offsetCS", "ot", 8], ["vec", "ot", 4], ["wmma_m", "ot", 32]]}, "result": [[6.5723084054388135e-06], 0, 1.2134370803833008, 1651068105.0656226], "version": 0.2, "tvm_version": "0.8.0"}
{"input": ["cuda -keys=cuda,gpu -max_num_threads=1024 -thread_warp_size=32", "batch_matmul_tensorcore_q_k.cuda", [["TENSOR", [64, 64, 32], "float16"], ["TENSOR", [64, 64, 32], "float16"]], {}], "config": {"index": 17896, "code_hash": null, "entity": [["block_row_warps", "ot", 1], ["warp_row_tiles", "ot", 4], ["warp_col_tiles", "ot", 4], ["chunk", "ot", 2], ["offset", "ot", 8], ["offsetCS", "ot", 8], ["vec", "ot", 4], ["wmma_m", "ot", 32]]}, "result": [[6.366474660074165e-06], 0, 1.0471093654632568, 1651068106.060233], "version": 0.2, "tvm_version": "0.8.0"}
{"input": ["cuda -keys=cuda,gpu -max_num_threads=1024 -thread_warp_size=32", "batch_matmul_tensorcore_q_k.cuda", [["TENSOR", [64, 64, 32], "float16"], ["TENSOR", [64, 64, 32], "float16"]], {}], "config": {"index": 16296, "code_hash": null, "entity": [["block_row_warps", "ot", 1], ["warp_row_tiles", "ot", 4], ["warp_col_tiles", "ot", 4], ["chunk", "ot", 2], ["offset", "ot", 0], ["offsetCS", "ot", 8], ["vec", "ot", 4], ["wmma_m", "ot", 32]]}, "result": [[6.834388751545117e-06], 0, 1.2056825160980225, 1651068106.6833615], "version": 0.2, "tvm_version": "0.8.0"}
{"input": ["cuda -keys=cuda,gpu -max_num_threads=1024 -thread_warp_size=32", "batch_matmul_tensorcore_q_k.cuda", [["TENSOR", [64, 64, 32], "float16"], ["TENSOR", [64, 64, 32], "float16"]], {}], "config": {"index": 36098, "code_hash": null, "entity": [["block_row_warps", "ot", 3], ["warp_row_tiles", "ot", 4], ["warp_col_tiles", "ot", 4], ["chunk", "ot", 6], ["offset", "ot", 0], ["offsetCS", "ot", 8], ["vec", "ot", 2], ["wmma_m", "ot", 16]]}, "result": [[8.967291718170581e-06], 0, 1.2442398071289062, 1651068107.3564482], "version": 0.2, "tvm_version": "0.8.0"}
{"input": ["cuda -keys=cuda,gpu -max_num_threads=1024 -thread_warp_size=32", "batch_matmul_tensorcore_q_k.cuda", [["TENSOR", [64, 64, 32], "float16"], ["TENSOR", [64, 64, 32], "float16"]], {}], "config": {"index": 12130, "code_hash": null, "entity": [["block_row_warps", "ot", 3], ["warp_row_tiles", "ot", 2], ["warp_col_tiles", "ot", 8], ["chunk", "ot", 6], ["offset", "ot", 8], ["offsetCS", "ot", 8], ["vec", "ot", 2], ["wmma_m", "ot", 32]]}, "result": [[8.857305933250926e-06], 0, 1.095472812652588, 1651068108.3852522], "version": 0.2, "tvm_version": "0.8.0"}
{"input": ["cuda -keys=cuda,gpu -max_num_threads=1024 -thread_warp_size=32", "batch_matmul_tensorcore_q_k.cuda", [["TENSOR", [64, 64, 32], "float16"], ["TENSOR", [64, 64, 32], "float16"]], {}], "config": {"index": 37698, "code_hash": null, "entity": [["block_row_warps", "ot", 3], ["warp_row_tiles", "ot", 4], ["warp_col_tiles", "ot", 4], ["chunk", "ot", 6], ["offset", "ot", 8], ["offsetCS", "ot", 8], ["vec", "ot", 2], ["wmma_m", "ot", 16]]}, "result": [[1.0036886897404201e-05], 0, 1.1510813236236572, 1651068109.01328], "version": 0.2, "tvm_version": "0.8.0"}
{"input": ["cuda -keys=cuda,gpu -max_num_threads=1024 -thread_warp_size=32", "batch_matmul_tensorcore_q_k.cuda", [["TENSOR", [64, 64, 32], "float16"], ["TENSOR", [64, 64, 32], "float16"]], {}], "config": {"index": 10530, "code_hash": null, "entity": [["block_row_warps", "ot", 3], ["warp_row_tiles", "ot", 2], ["warp_col_tiles", "ot", 8], ["chunk", "ot", 6], ["offset", "ot", 0], ["offsetCS", "ot", 8], ["vec", "ot", 2], ["wmma_m", "ot", 32]]}, "result": [[1.2355894e-05], 0, 1.2122623920440674, 1651068110.0840187], "version": 0.2, "tvm_version": "0.8.0"}
{"input": ["cuda -keys=cuda,gpu -max_num_threads=1024 -thread_warp_size=32", "batch_matmul_tensorcore_q_k.cuda", [["TENSOR", [64, 64, 32], "float16"], ["TENSOR", [64, 64, 32], "float16"]], {}], "config": {"index": 35457, "code_hash": null, "entity": [["block_row_warps", "ot", 2], ["warp_row_tiles", "ot", 4], ["warp_col_tiles", "ot", 2], ["chunk", "ot", 2], ["offset", "ot", 0], ["offsetCS", "ot", 8], ["vec", "ot", 2], ["wmma_m", "ot", 16]]}, "result": [[8.795143386897404e-06], 0, 1.2370648384094238, 1651068110.8393312], "version": 0.2, "tvm_version": "0.8.0"}
{"input": ["cuda -keys=cuda,gpu -max_num_threads=1024 -thread_warp_size=32", "batch_matmul_tensorcore_q_k.cuda", [["TENSOR", [64, 64, 32], "float16"], ["TENSOR", [64, 64, 32], "float16"]], {}], "config": {"index": 35657, "code_hash": null, "entity": [["block_row_warps", "ot", 2], ["warp_row_tiles", "ot", 4], ["warp_col_tiles", "ot", 2], ["chunk", "ot", 3], ["offset", "ot", 0], ["offsetCS", "ot", 8], ["vec", "ot", 2], ["wmma_m", "ot", 16]]}, "result": [[7.360147095179234e-06], 0, 1.2024815082550049, 1651068111.5262332], "version": 0.2, "tvm_version": "0.8.0"}
{"input": ["cuda -keys=cuda,gpu -max_num_threads=1024 -thread_warp_size=32", "batch_matmul_tensorcore_q_k.cuda", [["TENSOR", [64, 64, 32], "float16"], ["TENSOR", [64, 64, 32], "float16"]], {}], "config": {"index": 37057, "code_hash": null, "entity": [["block_row_warps", "ot", 2], ["warp_row_tiles", "ot", 4], ["warp_col_tiles", "ot", 2], ["chunk", "ot", 2], ["offset", "ot", 8], ["offsetCS", "ot", 8], ["vec", "ot", 2], ["wmma_m", "ot", 16]]}, "result": [[6.7406718170580966e-06], 0, 1.0792605876922607, 1651068112.5560684], "version": 0.2, "tvm_version": "0.8.0"}
{"input": ["cuda -keys=cuda,gpu -max_num_threads=1024 -thread_warp_size=32", "batch_matmul_tensorcore_q_k.cuda", [["TENSOR", [64, 64, 32], "float16"], ["TENSOR", [64, 64, 32], "float16"]], {}], "config": {"index": 42472, "code_hash": null, "entity": [["block_row_warps", "ot", 1], ["warp_row_tiles", "ot", 8], ["warp_col_tiles", "ot", 2], ["chunk", "ot", 6], ["offset", "ot", 0], ["offsetCS", "ot", 8], ["vec", "ot", 4], ["wmma_m", "ot", 16]]}, "result": [[9.396575401730531e-06], 0, 1.2127697467803955, 1651068113.2722578], "version": 0.2, "tvm_version": "0.8.0"}
{"input": ["cuda -keys=cuda,gpu -max_num_threads=1024 -thread_warp_size=32", "batch_matmul_tensorcore_q_k.cuda", [["TENSOR", [64, 64, 32], "float16"], ["TENSOR", [64, 64, 32], "float16"]], {}], "config": {"index": 10538, "code_hash": null, "entity": [["block_row_warps", "ot", 3], ["warp_row_tiles", "ot", 4], ["warp_col_tiles", "ot", 8], ["chunk", "ot", 6], ["offset", "ot", 0], ["offsetCS", "ot", 8], ["vec", "ot", 2], ["wmma_m", "ot", 32]]}, "result": [[1.1720834e-05], 0, 1.2160866260528564, 1651068113.9446511], "version": 0.2, "tvm_version": "0.8.0"}
{"input": ["cuda -keys=cuda,gpu -max_num_threads=1024 -thread_warp_size=32", "batch_matmul_tensorcore_q_k.cuda", [["TENSOR", [64, 64, 32], "float16"], ["TENSOR", [64, 64, 32], "float16"]], {}], "config": {"index": 12138, "code_hash": null, "entity": [["block_row_warps", "ot", 3], ["warp_row_tiles", "ot", 4], ["warp_col_tiles", "ot", 8], ["chunk", "ot", 6], ["offset", "ot", 8], ["offsetCS", "ot", 8], ["vec", "ot", 2], ["wmma_m", "ot", 32]]}, "result": [[1.1245359e-05], 0, 1.106564998626709, 1651068115.0016394], "version": 0.2, "tvm_version": "0.8.0"}
{"input": ["cuda -keys=cuda,gpu -max_num_threads=1024 -thread_warp_size=32", "batch_matmul_tensorcore_q_k.cuda", [["TENSOR", [64, 64, 32], "float16"], ["TENSOR", [64, 64, 32], "float16"]], {}], "config": {"index": 41872, "code_hash": null, "entity": [["block_row_warps", "ot", 1], ["warp_row_tiles", "ot", 8], ["warp_col_tiles", "ot", 2], ["chunk", "ot", 2], ["offset", "ot", 0], ["offsetCS", "ot", 8], ["vec", "ot", 4], ["wmma_m", "ot", 16]]}, "result": [[7.484217552533992e-06], 0, 1.208390474319458, 1651068115.6986544], "version": 0.2, "tvm_version": "0.8.0"}
{"input": ["cuda -keys=cuda,gpu -max_num_threads=1024 -thread_warp_size=32", "batch_matmul_tensorcore_q_k.cuda", [["TENSOR", [64, 64, 32], "float16"], ["TENSOR", [64, 64, 32], "float16"]], {}], "config": {"index": 42072, "code_hash": null, "entity": [["block_row_warps", "ot", 1], ["warp_row_tiles", "ot", 8], ["warp_col_tiles", "ot", 2], ["chunk", "ot", 3], ["offset", "ot", 0], ["offsetCS", "ot", 8], ["vec", "ot", 4], ["wmma_m", "ot", 16]]}, "result": [[6.5258881334981465e-06], 0, 1.1973154544830322, 1651068116.8016226], "version": 0.2, "tvm_version": "0.8.0"}
{"input": ["cuda -keys=cuda,gpu -max_num_threads=1024 -thread_warp_size=32", "batch_matmul_tensorcore_q_k.cuda", [["TENSOR", [64, 64, 32], "float16"], ["TENSOR", [64, 64, 32], "float16"]], {}], "config": {"index": 43472, "code_hash": null, "entity": [["block_row_warps", "ot", 1], ["warp_row_tiles", "ot", 8], ["warp_col_tiles", "ot", 2], ["chunk", "ot", 2], ["offset", "ot", 8], ["offsetCS", "ot", 8], ["vec", "ot", 4], ["wmma_m", "ot", 16]]}, "result": [[6.3821563658838065e-06], 0, 0.9842228889465332, 1651068117.778297], "version": 0.2, "tvm_version": "0.8.0"}
{"input": ["cuda -keys=cuda,gpu -max_num_threads=1024 -thread_warp_size=32", "batch_matmul_tensorcore_q_k.cuda", [["TENSOR", [64, 64, 32], "float16"], ["TENSOR", [64, 64, 32], "float16"]], {}], "config": {"index": 9889, "code_hash": null, "entity": [["block_row_warps", "ot", 2], ["warp_row_tiles", "ot", 2], ["warp_col_tiles", "ot", 4], ["chunk", "ot", 2], ["offset", "ot", 0], ["offsetCS", "ot", 8], ["vec", "ot", 2], ["wmma_m", "ot", 32]]}, "result": [[6.776652039555006e-06], 0, 1.2474756240844727, 1651068118.4369144], "version": 0.2, "tvm_version": "0.8.0"}
{"input": ["cuda -keys=cuda,gpu -max_num_threads=1024 -thread_warp_size=32", "batch_matmul_tensorcore_q_k.cuda", [["TENSOR", [64, 64, 32], "float16"], ["TENSOR", [64, 64, 32], "float16"]], {}], "config": {"index": 10089, "code_hash": null, "entity": [["block_row_warps", "ot", 2], ["warp_row_tiles", "ot", 2], ["warp_col_tiles", "ot", 4], ["chunk", "ot", 3], ["offset", "ot", 0], ["offsetCS", "ot", 8], ["vec", "ot", 2], ["wmma_m", "ot", 32]]}, "result": [[6.817863411619283e-06], 0, 1.1091763973236084, 1651068119.5954227], "version": 0.2, "tvm_version": "0.8.0"}
{"input": ["cuda -keys=cuda,gpu -max_num_threads=1024 -thread_warp_size=32", "batch_matmul_tensorcore_q_k.cuda", [["TENSOR", [64, 64, 32], "float16"], ["TENSOR", [64, 64, 32], "float16"]], {}], "config": {"index": 11489, "code_hash": null, "entity": [["block_row_warps", "ot", 2], ["warp_row_tiles", "ot", 2], ["warp_col_tiles", "ot", 4], ["chunk", "ot", 2], ["offset", "ot", 8], ["offsetCS", "ot", 8], ["vec", "ot", 2], ["wmma_m", "ot", 32]]}, "result": [[6.567497527812113e-06], 0, 0.9543700218200684, 1651068120.621037], "version": 0.2, "tvm_version": "0.8.0"}
{"input": ["cuda -keys=cuda,gpu -max_num_threads=1024 -thread_warp_size=32", "batch_matmul_tensorcore_q_k.cuda", [["TENSOR", [64, 64, 32], "float16"], ["TENSOR", [64, 64, 32], "float16"]], {}], "config": {"index": 37898, "code_hash": null, "entity": [["block_row_warps", "ot", 3], ["warp_row_tiles", "ot", 4], ["warp_col_tiles", "ot", 4], ["chunk", "ot", 8], ["offset", "ot", 8], ["offsetCS", "ot", 8], ["vec", "ot", 2], ["wmma_m", "ot", 16]]}, "result": [[1.2109971e-05], 0, 1.1139302253723145, 1651068121.2869608], "version": 0.2, "tvm_version": "0.8.0"}
{"input": ["cuda -keys=cuda,gpu -max_num_threads=1024 -thread_warp_size=32", "batch_matmul_tensorcore_q_k.cuda", [["TENSOR", [64, 64, 32], "float16"], ["TENSOR", [64, 64, 32], "float16"]], {}], "config": {"index": 12330, "code_hash": null, "entity": [["block_row_warps", "ot", 3], ["warp_row_tiles", "ot", 2], ["warp_col_tiles", "ot", 8], ["chunk", "ot", 8], ["offset", "ot", 8], ["offsetCS", "ot", 8], ["vec", "ot", 2], ["wmma_m", "ot", 32]]}, "result": [[1.036807e-05], 0, 1.2388768196105957, 1651068121.9609516], "version": 0.2, "tvm_version": "0.8.0"}
{"input": ["cuda -keys=cuda,gpu -max_num_threads=1024 -thread_warp_size=32", "batch_matmul_tensorcore_q_k.cuda", [["TENSOR", [64, 64, 32], "float16"], ["TENSOR", [64, 64, 32], "float16"]], {}], "config": {"index": 16696, "code_hash": null, "entity": [["block_row_warps", "ot", 1], ["warp_row_tiles", "ot", 4], ["warp_col_tiles", "ot", 4], ["chunk", "ot", 4], ["offset", "ot", 0], ["offsetCS", "ot", 8], ["vec", "ot", 4], ["wmma_m", "ot", 32]]}, "result": [[8.856622991347344e-06], 0, 1.0213229656219482, 1651068123.0772085], "version": 0.2, "tvm_version": "0.8.0"}
{"input": ["cuda -keys=cuda,gpu -max_num_threads=1024 -thread_warp_size=32", "batch_matmul_tensorcore_q_k.cuda", [["TENSOR", [64, 64, 32], "float16"], ["TENSOR", [64, 64, 32], "float16"]], {}], "config": {"index": 18296, "code_hash": null, "entity": [["block_row_warps", "ot", 1], ["warp_row_tiles", "ot", 4], ["warp_col_tiles", "ot", 4], ["chunk", "ot", 4], ["offset", "ot", 8], ["offsetCS", "ot", 8], ["vec", "ot", 4], ["wmma_m", "ot", 32]]}, "result": [[7.834501854140914e-06], 0, 0.8931500911712646, 1651068124.078429], "version": 0.2, "tvm_version": "0.8.0"}
{"input": ["cuda -keys=cuda,gpu -max_num_threads=1024 -thread_warp_size=32", "batch_matmul_tensorcore_q_k.cuda", [["TENSOR", [64, 64, 32], "float16"], ["TENSOR", [64, 64, 32], "float16"]], {}], "config": {"index": 18096, "code_hash": null, "entity": [["block_row_warps", "ot", 1], ["warp_row_tiles", "ot", 4], ["warp_col_tiles", "ot", 4], ["chunk", "ot", 3], ["offset", "ot", 8], ["offsetCS", "ot", 8], ["vec", "ot", 4], ["wmma_m", "ot", 32]]}, "result": [[7.301912237330037e-06], 0, 1.082793951034546, 1651068124.6637692], "version": 0.2, "tvm_version": "0.8.0"}
{"input": ["cuda -keys=cuda,gpu -max_num_threads=1024 -thread_warp_size=32", "batch_matmul_tensorcore_q_k.cuda", [["TENSOR", [64, 64, 32], "float16"], ["TENSOR", [64, 64, 32], "float16"]], {}], "config": {"index": 36057, "code_hash": null, "entity": [["block_row_warps", "ot", 2], ["warp_row_tiles", "ot", 4], ["warp_col_tiles", "ot", 2], ["chunk", "ot", 6], ["offset", "ot", 0], ["offsetCS", "ot", 8], ["vec", "ot", 2], ["wmma_m", "ot", 16]]}, "result": [[9.023520395550062e-06], 0, 1.1188576221466064, 1651068125.7924876], "version": 0.2, "tvm_version": "0.8.0"}
{"input": ["cuda -keys=cuda,gpu -max_num_threads=1024 -thread_warp_size=32", "batch_matmul_tensorcore_q_k.cuda", [["TENSOR", [64, 64, 32], "float16"], ["TENSOR", [64, 64, 32], "float16"]], {}], "config": {"index": 61674, "code_hash": null, "entity": [["block_row_warps", "ot", 3], ["warp_row_tiles", "ot", 8], ["warp_col_tiles", "ot", 2], ["chunk", "ot", 6], ["offset", "ot", 0], ["offsetCS", "ot", 8], ["vec", "ot", 2], ["wmma_m", "ot", 8]]}, "result": [[1.230359e-05], 0, 1.0098700523376465, 1651068126.9137626], "version": 0.2, "tvm_version": "0.8.0"}
{"input": ["cuda -keys=cuda,gpu -max_num_threads=1024 -thread_warp_size=32", "batch_matmul_tensorcore_q_k.cuda", [["TENSOR", [64, 64, 32], "float16"], ["TENSOR", [64, 64, 32], "float16"]], {}], "config": {"index": 63274, "code_hash": null, "entity": [["block_row_warps", "ot", 3], ["warp_row_tiles", "ot", 8], ["warp_col_tiles", "ot", 2], ["chunk", "ot", 6], ["offset", "ot", 8], ["offsetCS", "ot", 8], ["vec", "ot", 2], ["wmma_m", "ot", 8]]}, "result": [[1.1351149e-05], 0, 1.0883259773254395, 1651068127.5732777], "version": 0.2, "tvm_version": "0.8.0"}
{"input": ["cuda -keys=cuda,gpu -max_num_threads=1024 -thread_warp_size=32", "batch_matmul_tensorcore_q_k.cuda", [["TENSOR", [64, 64, 32], "float16"], ["TENSOR", [64, 64, 32], "float16"]], {}], "config": {"index": 61233, "code_hash": null, "entity": [["block_row_warps", "ot", 2], ["warp_row_tiles", "ot", 8], ["warp_col_tiles", "ot", 1], ["chunk", "ot", 3], ["offset", "ot", 0], ["offsetCS", "ot", 8], ["vec", "ot", 2], ["wmma_m", "ot", 8]]}, "result": [[7.5224369592089e-06], 0, 1.085470199584961, 1651068128.256173], "version": 0.2, "tvm_version": "0.8.0"}
{"input": ["cuda -keys=cuda,gpu -max_num_threads=1024 -thread_warp_size=32", "batch_matmul_tensorcore_q_k.cuda", [["TENSOR", [64, 64, 32], "float16"], ["TENSOR", [64, 64, 32], "float16"]], {}], "config": {"index": 62633, "code_hash": null, "entity": [["block_row_warps", "ot", 2], ["warp_row_tiles", "ot", 8], ["warp_col_tiles", "ot", 1], ["chunk", "ot", 2], ["offset", "ot", 8], ["offsetCS", "ot", 8], ["vec", "ot", 2], ["wmma_m", "ot", 8]]}, "result": [[7.274898640296663e-06], 0, 0.8574345111846924, 1651068129.2533329], "version": 0.2, "tvm_version": "0.8.0"}
{"input": ["cuda -keys=cuda,gpu -max_num_threads=1024 -thread_warp_size=32", "batch_matmul_tensorcore_q_k.cuda", [["TENSOR", [64, 64, 32], "float16"], ["TENSOR", [64, 64, 32], "float16"]], {}], "config": {"index": 61033, "code_hash": null, "entity": [["block_row_warps", "ot", 2], ["warp_row_tiles", "ot", 8], ["warp_col_tiles", "ot", 1], ["chunk", "ot", 2], ["offset", "ot", 0], ["offsetCS", "ot", 8], ["vec", "ot", 2], ["wmma_m", "ot", 8]]}, "result": [[7.106609394313969e-06], 0, 1.246081829071045, 1651068129.9145925], "version": 0.2, "tvm_version": "0.8.0"}
{"input": ["cuda -keys=cuda,gpu -max_num_threads=1024 -thread_warp_size=32", "batch_matmul_tensorcore_q_k.cuda", [["TENSOR", [64, 64, 32], "float16"], ["TENSOR", [64, 64, 32], "float16"]], {}], "config": {"index": 16912, "code_hash": null, "entity": [["block_row_warps", "ot", 1], ["warp_row_tiles", "ot", 8], ["warp_col_tiles", "ot", 4], ["chunk", "ot", 6], ["offset", "ot", 0], ["offsetCS", "ot", 8], ["vec", "ot", 4], ["wmma_m", "ot", 32]]}, "result": [[8.577172435105068e-06], 0, 1.0722675323486328, 1651068130.971642], "version": 0.2, "tvm_version": "0.8.0"}
{"input": ["cuda -keys=cuda,gpu -max_num_threads=1024 -thread_warp_size=32", "batch_matmul_tensorcore_q_k.cuda", [["TENSOR", [64, 64, 32], "float16"], ["TENSOR", [64, 64, 32], "float16"]], {}], "config": {"index": 16904, "code_hash": null, "entity": [["block_row_warps", "ot", 1], ["warp_row_tiles", "ot", 6], ["warp_col_tiles", "ot", 4], ["chunk", "ot", 6], ["offset", "ot", 0], ["offsetCS", "ot", 8], ["vec", "ot", 4], ["wmma_m", "ot", 32]]}, "result": [[8.949582200247217e-06], 0, 1.1400692462921143, 1651068132.0610495], "version": 0.2, "tvm_version": "0.8.0"}
{"input": ["cuda -keys=cuda,gpu -max_num_threads=1024 -thread_warp_size=32", "batch_matmul_tensorcore_q_k.cuda", [["TENSOR", [64, 64, 32], "float16"], ["TENSOR", [64, 64, 32], "float16"]], {}], "config": {"index": 37257, "code_hash": null, "entity": [["block_row_warps", "ot", 2], ["warp_row_tiles", "ot", 4], ["warp_col_tiles", "ot", 2], ["chunk", "ot", 3], ["offset", "ot", 8], ["offsetCS", "ot", 8], ["vec", "ot", 2], ["wmma_m", "ot", 16]]}, "result": [[6.1815997552019575e-06], 0, 1.1146278381347656, 1651068132.6559622], "version": 0.2, "tvm_version": "0.8.0"}
{"input": ["cuda -keys=cuda,gpu -max_num_threads=1024 -thread_warp_size=32", "batch_matmul_tensorcore_q_k.cuda", [["TENSOR", [64, 64, 32], "float16"], ["TENSOR", [64, 64, 32], "float16"]], {}], "config": {"index": 36114, "code_hash": null, "entity": [["block_row_warps", "ot", 3], ["warp_row_tiles", "ot", 8], ["warp_col_tiles", "ot", 4], ["chunk", "ot", 6], ["offset", "ot", 0], ["offsetCS", "ot", 8], ["vec", "ot", 2], ["wmma_m", "ot", 16]]}, "result": [[1.0572568e-05], 0, 1.1881728172302246, 1651068133.2593572], "version": 0.2, "tvm_version": "0.8.0"}
{"input": ["cuda -keys=cuda,gpu -max_num_threads=1024 -thread_warp_size=32", "batch_matmul_tensorcore_q_k.cuda", [["TENSOR", [64, 64, 32], "float16"], ["TENSOR", [64, 64, 32], "float16"]], {}], "config": {"index": 37714, "code_hash": null, "entity": [["block_row_warps", "ot", 3], ["warp_row_tiles", "ot", 8], ["warp_col_tiles", "ot", 4], ["chunk", "ot", 6], ["offset", "ot", 8], ["offsetCS", "ot", 8], ["vec", "ot", 2], ["wmma_m", "ot", 16]]}, "result": [[1.0407425e-05], 0, 1.0497322082519531, 1651068133.9174228], "version": 0.2, "tvm_version": "0.8.0"}
{"input": ["cuda -keys=cuda,gpu -max_num_threads=1024 -thread_warp_size=32", "batch_matmul_tensorcore_q_k.cuda", [["TENSOR", [64, 64, 32], "float16"], ["TENSOR", [64, 64, 32], "float16"]], {}], "config": {"index": 17904, "code_hash": null, "entity": [["block_row_warps", "ot", 1], ["warp_row_tiles", "ot", 6], ["warp_col_tiles", "ot", 4], ["chunk", "ot", 2], ["offset", "ot", 8], ["offsetCS", "ot", 8], ["vec", "ot", 4], ["wmma_m", "ot", 32]]}, "result": [[7.042632262051916e-06], 0, 1.071345329284668, 1651068134.9319777], "version": 0.2, "tvm_version": "0.8.0"}
{"input": ["cuda -keys=cuda,gpu -max_num_threads=1024 -thread_warp_size=32", "batch_matmul_tensorcore_q_k.cuda", [["TENSOR", [64, 64, 32], "float16"], ["TENSOR", [64, 64, 32], "float16"]], {}], "config": {"index": 16512, "code_hash": null, "entity": [["block_row_warps", "ot", 1], ["warp_row_tiles", "ot", 8], ["warp_col_tiles", "ot", 4], ["chunk", "ot", 3], ["offset", "ot", 0], ["offsetCS", "ot", 8], ["vec", "ot", 4], ["wmma_m", "ot", 32]]}, "result": [[1.0632552e-05], 0, 1.0418057441711426, 1651068136.002769], "version": 0.2, "tvm_version": "0.8.0"}
{"input": ["cuda -keys=cuda,gpu -max_num_threads=1024 -thread_warp_size=32", "batch_matmul_tensorcore_q_k.cuda", [["TENSOR", [64, 64, 32], "float16"], ["TENSOR", [64, 64, 32], "float16"]], {}], "config": {"index": 17912, "code_hash": null, "entity": [["block_row_warps", "ot", 1], ["warp_row_tiles", "ot", 8], ["warp_col_tiles", "ot", 4], ["chunk", "ot", 2], ["offset", "ot", 8], ["offsetCS", "ot", 8], ["vec", "ot", 4], ["wmma_m", "ot", 32]]}, "result": [[8.294477750309024e-06], 0, 1.2779409885406494, 1651068136.7390783], "version": 0.2, "tvm_version": "0.8.0"}
{"input": ["cuda -keys=cuda,gpu -max_num_threads=1024 -thread_warp_size=32", "batch_matmul_tensorcore_q_k.cuda", [["TENSOR", [64, 64, 32], "float16"], ["TENSOR", [64, 64, 32], "float16"]], {}], "config": {"index": 16504, "code_hash": null, "entity": [["block_row_warps", "ot", 1], ["warp_row_tiles", "ot", 6], ["warp_col_tiles", "ot", 4], ["chunk", "ot", 3], ["offset", "ot", 0], ["offsetCS", "ot", 8], ["vec", "ot", 4], ["wmma_m", "ot", 32]]}, "result": [[7.4311236093943145e-06], 0, 1.0797004699707031, 1651068137.8232234], "version": 0.2, "tvm_version": "0.8.0"}
{"input": ["cuda -keys=cuda,gpu -max_num_threads=1024 -thread_warp_size=32", "batch_matmul_tensorcore_q_k.cuda", [["TENSOR", [64, 64, 32], "float16"], ["TENSOR", [64, 64, 32], "float16"]], {}], "config": {"index": 16312, "code_hash": null, "entity": [["block_row_warps", "ot", 1], ["warp_row_tiles", "ot", 8], ["warp_col_tiles", "ot", 4], ["chunk", "ot", 2], ["offset", "ot", 0], ["offsetCS", "ot", 8], ["vec", "ot", 4], ["wmma_m", "ot", 32]]}, "result": [[9.891386897404203e-06], 0, 1.2289910316467285, 1651068138.9330077], "version": 0.2, "tvm_version": "0.8.0"}
{"input": ["cuda -keys=cuda,gpu -max_num_threads=1024 -thread_warp_size=32", "batch_matmul_tensorcore_q_k.cuda", [["TENSOR", [64, 64, 32], "float16"], ["TENSOR", [64, 64, 32], "float16"]], {}], "config": {"index": 16304, "code_hash": null, "entity": [["block_row_warps", "ot", 1], ["warp_row_tiles", "ot", 6], ["warp_col_tiles", "ot", 4], ["chunk", "ot", 2], ["offset", "ot", 0], ["offsetCS", "ot", 8], ["vec", "ot", 4], ["wmma_m", "ot", 32]]}, "result": [[8.65108714462299e-06], 0, 1.2390196323394775, 1651068139.648148], "version": 0.2, "tvm_version": "0.8.0"}
{"input": ["cuda -keys=cuda,gpu -max_num_threads=1024 -thread_warp_size=32", "batch_matmul_tensorcore_q_k.cuda", [["TENSOR", [64, 64, 32], "float16"], ["TENSOR", [64, 64, 32], "float16"]], {}], "config": {"index": 10330, "code_hash": null, "entity": [["block_row_warps", "ot", 3], ["warp_row_tiles", "ot", 2], ["warp_col_tiles", "ot", 8], ["chunk", "ot", 4], ["offset", "ot", 0], ["offsetCS", "ot", 8], ["vec", "ot", 2], ["wmma_m", "ot", 32]]}, "result": [[1.1921568e-05], 0, 1.198918342590332, 1651068140.2936702], "version": 0.2, "tvm_version": "0.8.0"}
{"input": ["cuda -keys=cuda,gpu -max_num_threads=1024 -thread_warp_size=32", "batch_matmul_tensorcore_q_k.cuda", [["TENSOR", [64, 64, 32], "float16"], ["TENSOR", [64, 64, 32], "float16"]], {}], "config": {"index": 37098, "code_hash": null, "entity": [["block_row_warps", "ot", 3], ["warp_row_tiles", "ot", 4], ["warp_col_tiles", "ot", 4], ["chunk", "ot", 2], ["offset", "ot", 8], ["offsetCS", "ot", 8], ["vec", "ot", 2], ["wmma_m", "ot", 16]]}, "result": [[8.631843016069222e-06], 0, 1.1351385116577148, 1651068141.3772616], "version": 0.2, "tvm_version": "0.8.0"}
{"input": ["cuda -keys=cuda,gpu -max_num_threads=1024 -thread_warp_size=32", "batch_matmul_tensorcore_q_k.cuda", [["TENSOR", [64, 64, 32], "float16"], ["TENSOR", [64, 64, 32], "float16"]], {}], "config": {"index": 10130, "code_hash": null, "entity": [["block_row_warps", "ot", 3], ["warp_row_tiles", "ot", 2], ["warp_col_tiles", "ot", 8], ["chunk", "ot", 3], ["offset", "ot", 0], ["offsetCS", "ot", 8], ["vec", "ot", 2], ["wmma_m", "ot", 32]]}, "result": [[8.928076637824474e-06], 0, 1.072005271911621, 1651068142.0526245], "version": 0.2, "tvm_version": "0.8.0"}
{"input": ["cuda -keys=cuda,gpu -max_num_threads=1024 -thread_warp_size=32", "batch_matmul_tensorcore_q_k.cuda", [["TENSOR", [64, 64, 32], "float16"], ["TENSOR", [64, 64, 32], "float16"]], {}], "config": {"index": 11530, "code_hash": null, "entity": [["block_row_warps", "ot", 3], ["warp_row_tiles", "ot", 2], ["warp_col_tiles", "ot", 8], ["chunk", "ot", 2], ["offset", "ot", 8], ["offsetCS", "ot", 8], ["vec", "ot", 2], ["wmma_m", "ot", 32]]}, "result": [[8.917814585908529e-06], 0, 1.2449653148651123, 1651068142.6797574], "version": 0.2, "tvm_version": "0.8.0"}
{"input": ["cuda -keys=cuda,gpu -max_num_threads=1024 -thread_warp_size=32", "batch_matmul_tensorcore_q_k.cuda", [["TENSOR", [64, 64, 32], "float16"], ["TENSOR", [64, 64, 32], "float16"]], {}], "config": {"index": 35898, "code_hash": null, "entity": [["block_row_warps", "ot", 3], ["warp_row_tiles", "ot", 4], ["warp_col_tiles", "ot", 4], ["chunk", "ot", 4], ["offset", "ot", 0], ["offsetCS", "ot", 8], ["vec", "ot", 2], ["wmma_m", "ot", 16]]}, "result": [[1.1078184e-05], 0, 1.1011457443237305, 1651068143.2855012], "version": 0.2, "tvm_version": "0.8.0"}
{"input": ["cuda -keys=cuda,gpu -max_num_threads=1024 -thread_warp_size=32", "batch_matmul_tensorcore_q_k.cuda", [["TENSOR", [64, 64, 32], "float16"], ["TENSOR", [64, 64, 32], "float16"]], {}], "config": {"index": 37498, "code_hash": null, "entity": [["block_row_warps", "ot", 3], ["warp_row_tiles", "ot", 4], ["warp_col_tiles", "ot", 4], ["chunk", "ot", 4], ["offset", "ot", 8], ["offsetCS", "ot", 8], ["vec", "ot", 2], ["wmma_m", "ot", 16]]}, "result": [[8.875144622991348e-06], 0, 1.3805060386657715, 1651068143.9963853], "version": 0.2, "tvm_version": "0.8.0"}
{"input": ["cuda -keys=cuda,gpu -max_num_threads=1024 -thread_warp_size=32", "batch_matmul_tensorcore_q_k.cuda", [["TENSOR", [64, 64, 32], "float16"], ["TENSOR", [64, 64, 32], "float16"]], {}], "config": {"index": 11930, "code_hash": null, "entity": [["block_row_warps", "ot", 3], ["warp_row_tiles", "ot", 2], ["warp_col_tiles", "ot", 8], ["chunk", "ot", 4], ["offset", "ot", 8], ["offsetCS", "ot", 8], ["vec", "ot", 2], ["wmma_m", "ot", 32]]}, "result": [[9.062572929542646e-06], 0, 1.086228370666504, 1651068145.0473719], "version": 0.2, "tvm_version": "0.8.0"}
{"input": ["cuda -keys=cuda,gpu -max_num_threads=1024 -thread_warp_size=32", "batch_matmul_tensorcore_q_k.cuda", [["TENSOR", [64, 64, 32], "float16"], ["TENSOR", [64, 64, 32], "float16"]], {}], "config": {"index": 11730, "code_hash": null, "entity": [["block_row_warps", "ot", 3], ["warp_row_tiles", "ot", 2], ["warp_col_tiles", "ot", 8], ["chunk", "ot", 3], ["offset", "ot", 8], ["offsetCS", "ot", 8], ["vec", "ot", 2], ["wmma_m", "ot", 32]]}, "result": [[1.1199241e-05], 0, 1.1305007934570312, 1651068145.6653273], "version": 0.2, "tvm_version": "0.8.0"}
{"input": ["cuda -keys=cuda,gpu -max_num_threads=1024 -thread_warp_size=32", "batch_matmul_tensorcore_q_k.cuda", [["TENSOR", [64, 64, 32], "float16"], ["TENSOR", [64, 64, 32], "float16"]], {}], "config": {"index": 35698, "code_hash": null, "entity": [["block_row_warps", "ot", 3], ["warp_row_tiles", "ot", 4], ["warp_col_tiles", "ot", 4], ["chunk", "ot", 3], ["offset", "ot", 0], ["offsetCS", "ot", 8], ["vec", "ot", 2], ["wmma_m", "ot", 16]]}, "result": [[9.658758343634118e-06], 0, 0.9747121334075928, 1651068146.7860477], "version": 0.2, "tvm_version": "0.8.0"}
{"input": ["cuda -keys=cuda,gpu -max_num_threads=1024 -thread_warp_size=32", "batch_matmul_tensorcore_q_k.cuda", [["TENSOR", [64, 64, 32], "float16"], ["TENSOR", [64, 64, 32], "float16"]], {}], "config": {"index": 9930, "code_hash": null, "entity": [["block_row_warps", "ot", 3], ["warp_row_tiles", "ot", 2], ["warp_col_tiles", "ot", 8], ["chunk", "ot", 2], ["offset", "ot", 0], ["offsetCS", "ot", 8], ["vec", "ot", 2], ["wmma_m", "ot", 32]]}, "result": [[9.349161928306552e-06], 0, 1.076608657836914, 1651068147.8830755], "version": 0.2, "tvm_version": "0.8.0"}
{"input": ["cuda -keys=cuda,gpu -max_num_threads=1024 -thread_warp_size=32", "batch_matmul_tensorcore_q_k.cuda", [["TENSOR", [64, 64, 32], "float16"], ["TENSOR", [64, 64, 32], "float16"]], {}], "config": {"index": 35498, "code_hash": null, "entity": [["block_row_warps", "ot", 3], ["warp_row_tiles", "ot", 4], ["warp_col_tiles", "ot", 4], ["chunk", "ot", 2], ["offset", "ot", 0], ["offsetCS", "ot", 8], ["vec", "ot", 2], ["wmma_m", "ot", 16]]}, "result": [[1.0233829e-05], 0, 1.1345815658569336, 1651068148.5320077], "version": 0.2, "tvm_version": "0.8.0"}
{"input": ["cuda -keys=cuda,gpu -max_num_threads=1024 -thread_warp_size=32", "batch_matmul_tensorcore_q_k.cuda", [["TENSOR", [64, 64, 32], "float16"], ["TENSOR", [64, 64, 32], "float16"]], {}], "config": {"index": 37298, "code_hash": null, "entity": [["block_row_warps", "ot", 3], ["warp_row_tiles", "ot", 4], ["warp_col_tiles", "ot", 4], ["chunk", "ot", 3], ["offset", "ot", 8], ["offsetCS", "ot", 8], ["vec", "ot", 2], ["wmma_m", "ot", 16]]}, "result": [[9.557114338689741e-06], 0, 0.9619579315185547, 1651068149.6465168], "version": 0.2, "tvm_version": "0.8.0"}
{"input": ["cuda -keys=cuda,gpu -max_num_threads=1024 -thread_warp_size=32", "batch_matmul_tensorcore_q_k.cuda", [["TENSOR", [64, 64, 32], "float16"], ["TENSOR", [64, 64, 32], "float16"]], {}], "config": {"index": 10489, "code_hash": null, "entity": [["block_row_warps", "ot", 2], ["warp_row_tiles", "ot", 2], ["warp_col_tiles", "ot", 4], ["chunk", "ot", 6], ["offset", "ot", 0], ["offsetCS", "ot", 8], ["vec", "ot", 2], ["wmma_m", "ot", 32]]}, "result": [[7.367035846724351e-06], 0, 0.9023747444152832, 1651068150.7177162], "version": 0.2, "tvm_version": "0.8.0"}
{"input": ["cuda -keys=cuda,gpu -max_num_threads=1024 -thread_warp_size=32", "batch_matmul_tensorcore_q_k.cuda", [["TENSOR", [64, 64, 32], "float16"], ["TENSOR", [64, 64, 32], "float16"]], {}], "config": {"index": 12129, "code_hash": null, "entity": [["block_row_warps", "ot", 2], ["warp_row_tiles", "ot", 2], ["warp_col_tiles", "ot", 8], ["chunk", "ot", 6], ["offset", "ot", 8], ["offsetCS", "ot", 8], ["vec", "ot", 2], ["wmma_m", "ot", 32]]}, "result": [[7.4521495673671194e-06], 0, 1.0174851417541504, 1651068151.2950792], "version": 0.2, "tvm_version": "0.8.0"}
{"input": ["cuda -keys=cuda,gpu -max_num_threads=1024 -thread_warp_size=32", "batch_matmul_tensorcore_q_k.cuda", [["TENSOR", [64, 64, 32], "float16"], ["TENSOR", [64, 64, 32], "float16"]], {}], "config": {"index": 36097, "code_hash": null, "entity": [["block_row_warps", "ot", 2], ["warp_row_tiles", "ot", 4], ["warp_col_tiles", "ot", 4], ["chunk", "ot", 6], ["offset", "ot", 0], ["offsetCS", "ot", 8], ["vec", "ot", 2], ["wmma_m", "ot", 16]]}, "result": [[7.275942521631644e-06], 0, 1.2082371711730957, 1651068151.9481452], "version": 0.2, "tvm_version": "0.8.0"}
{"input": ["cuda -keys=cuda,gpu -max_num_threads=1024 -thread_warp_size=32", "batch_matmul_tensorcore_q_k.cuda", [["TENSOR", [64, 64, 32], "float16"], ["TENSOR", [64, 64, 32], "float16"]], {}], "config": {"index": 37697, "code_hash": null, "entity": [["block_row_warps", "ot", 2], ["warp_row_tiles", "ot", 4], ["warp_col_tiles", "ot", 4], ["chunk", "ot", 6], ["offset", "ot", 8], ["offsetCS", "ot", 8], ["vec", "ot", 2], ["wmma_m", "ot", 16]]}, "result": [[6.798501236093942e-06], 0, 0.9370360374450684, 1651068152.9242468], "version": 0.2, "tvm_version": "0.8.0"}
{"input": ["cuda -keys=cuda,gpu -max_num_threads=1024 -thread_warp_size=32", "batch_matmul_tensorcore_q_k.cuda", [["TENSOR", [64, 64, 32], "float16"], ["TENSOR", [64, 64, 32], "float16"]], {}], "config": {"index": 10529, "code_hash": null, "entity": [["block_row_warps", "ot", 2], ["warp_row_tiles", "ot", 2], ["warp_col_tiles", "ot", 8], ["chunk", "ot", 6], ["offset", "ot", 0], ["offsetCS", "ot", 8], ["vec", "ot", 2], ["wmma_m", "ot", 32]]}, "result": [[7.261715698393078e-06], 0, 0.880394697189331, 1651068153.4986467], "version": 0.2, "tvm_version": "0.8.0"}
{"input": ["cuda -keys=cuda,gpu -max_num_threads=1024 -thread_warp_size=32", "batch_matmul_tensorcore_q_k.cuda", [["TENSOR", [64, 64, 32], "float16"], ["TENSOR", [64, 64, 32], "float16"]], {}], "config": {"index": 42272, "code_hash": null, "entity": [["block_row_warps", "ot", 1], ["warp_row_tiles", "ot", 8], ["warp_col_tiles", "ot", 2], ["chunk", "ot", 4], ["offset", "ot", 0], ["offsetCS", "ot", 8], ["vec", "ot", 4], ["wmma_m", "ot", 16]]}, "result": [[1.0062735e-05], 0, 1.015516996383667, 1651068154.5428102], "version": 0.2, "tvm_version": "0.8.0"}
{"input": ["cuda -keys=cuda,gpu -max_num_threads=1024 -thread_warp_size=32", "batch_matmul_tensorcore_q_k.cuda", [["TENSOR", [64, 64, 32], "float16"], ["TENSOR", [64, 64, 32], "float16"]], {}], "config": {"index": 43672, "code_hash": null, "entity": [["block_row_warps", "ot", 1], ["warp_row_tiles", "ot", 8], ["warp_col_tiles", "ot", 2], ["chunk", "ot", 3], ["offset", "ot", 8], ["offsetCS", "ot", 8], ["vec", "ot", 4], ["wmma_m", "ot", 16]]}, "result": [[7.1243312731767605e-06], 0, 1.1774225234985352, 1651068155.174131], "version": 0.2, "tvm_version": "0.8.0"}
{"input": ["cuda -keys=cuda,gpu -max_num_threads=1024 -thread_warp_size=32", "batch_matmul_tensorcore_q_k.cuda", [["TENSOR", [64, 64, 32], "float16"], ["TENSOR", [64, 64, 32], "float16"]], {}], "config": {"index": 35476, "code_hash": null, "entity": [["block_row_warps", "ot", 6], ["warp_row_tiles", "ot", 8], ["warp_col_tiles", "ot", 2], ["chunk", "ot", 2], ["offset", "ot", 0], ["offsetCS", "ot", 8], ["vec", "ot", 2], ["wmma_m", "ot", 16]]}, "result": [[1.400754e-05], 0, 0.9765336513519287, 1651068156.2582521], "version": 0.2, "tvm_version": "0.8.0"}
{"input": ["cuda -keys=cuda,gpu -max_num_threads=1024 -thread_warp_size=32", "batch_matmul_tensorcore_q_k.cuda", [["TENSOR", [64, 64, 32], "float16"], ["TENSOR", [64, 64, 32], "float16"]], {}], "config": {"index": 2322, "code_hash": null, "entity": [["block_row_warps", "ot", 3], ["warp_row_tiles", "ot", 1], ["warp_col_tiles", "ot", 8], ["chunk", "ot", 4], ["offset", "ot", 8], ["offsetCS", "ot", 0], ["vec", "ot", 1], ["wmma_m", "ot", 32]]}, "result": [[1.2982861e-05], 0, 1.0409481525421143, 1651068157.3559704], "version": 0.2, "tvm_version": "0.8.0"}
{"input": ["cuda -keys=cuda,gpu -max_num_threads=1024 -thread_warp_size=32", "batch_matmul_tensorcore_q_k.cuda", [["TENSOR", [64, 64, 32], "float16"], ["TENSOR", [64, 64, 32], "float16"]], {}], "config": {"index": 34283, "code_hash": null, "entity": [["block_row_warps", "ot", 4], ["warp_row_tiles", "ot", 1], ["warp_col_tiles", "ot", 4], ["chunk", "ot", 4], ["offset", "ot", 8], ["offsetCS", "ot", 0], ["vec", "ot", 2], ["wmma_m", "ot", 16]]}, "result": [[7.254437577255871e-06], 0, 0.9656620025634766, 1651068158.46885], "version": 0.2, "tvm_version": "0.8.0"}
{"input": ["cuda -keys=cuda,gpu -max_num_threads=1024 -thread_warp_size=32", "batch_matmul_tensorcore_q_k.cuda", [["TENSOR", [64, 64, 32], "float16"], ["TENSOR", [64, 64, 32], "float16"]], {}], "config": {"index": 19745, "code_hash": null, "entity": [["block_row_warps", "ot", 2], ["warp_row_tiles", "ot", 6], ["warp_col_tiles", "ot", 8], ["chunk", "ot", 3], ["offset", "ot", 0], ["offsetCS", "ot", 0], ["vec", "ot", 8], ["wmma_m", "ot", 32]]}, "result": [[9.546220642768851e-06], 0, 1.0249261856079102, 1651068159.5834646], "version": 0.2, "tvm_version": "0.8.0"}
{"input": ["cuda -keys=cuda,gpu -max_num_threads=1024 -thread_warp_size=32", "batch_matmul_tensorcore_q_k.cuda", [["TENSOR", [64, 64, 32], "float16"], ["TENSOR", [64, 64, 32], "float16"]], {}], "config": {"index": 30884, "code_hash": null, "entity": [["block_row_warps", "ot", 6], ["warp_row_tiles", "ot", 1], ["warp_col_tiles", "ot", 4], ["chunk", "ot", 3], ["offset", "ot", 8], ["offsetCS", "ot", 8], ["vec", "ot", 1], ["wmma_m", "ot", 16]]}, "result": [[1.0024939e-05], 0, 0.9323484897613525, 1651068161.21657], "version": 0.2, "tvm_version": "0.8.0"}
{"input": ["cuda -keys=cuda,gpu -max_num_threads=1024 -thread_warp_size=32", "batch_matmul_tensorcore_q_k.cuda", [["TENSOR", [64, 64, 32], "float16"], ["TENSOR", [64, 64, 32], "float16"]], {}], "config": {"index": 33645, "code_hash": null, "entity": [["block_row_warps", "ot", 8], ["warp_row_tiles", "ot", 1], ["warp_col_tiles", "ot", 2], ["chunk", "ot", 1], ["offset", "ot", 8], ["offsetCS", "ot", 0], ["vec", "ot", 2], ["wmma_m", "ot", 16]]}, "result": [[2.253833e-05], 0, 1.0555732250213623, 1651068162.3210382], "version": 0.2, "tvm_version": "0.8.0"}
{"input": ["cuda -keys=cuda,gpu -max_num_threads=1024 -thread_warp_size=32", "batch_matmul_tensorcore_q_k.cuda", [["TENSOR", [64, 64, 32], "float16"], ["TENSOR", [64, 64, 32], "float16"]], {}], "config": {"index": 31812, "code_hash": null, "entity": [["block_row_warps", "ot", 6], ["warp_row_tiles", "ot", 2], ["warp_col_tiles", "ot", 1], ["chunk", "ot", 16], ["offset", "ot", 8], ["offsetCS", "ot", 8], ["vec", "ot", 1], ["wmma_m", "ot", 16]]}, "result": [[1.3005312e-05], 0, 1.0021030902862549, 1651068162.951958], "version": 0.2, "tvm_version": "0.8.0"}
{"input": ["cuda -keys=cuda,gpu -max_num_threads=1024 -thread_warp_size=32", "batch_matmul_tensorcore_q_k.cuda", [["TENSOR", [64, 64, 32], "float16"], ["TENSOR", [64, 64, 32], "float16"]], {}], "config": {"index": 37892, "code_hash": null, "entity": [["block_row_warps", "ot", 6], ["warp_row_tiles", "ot", 2], ["warp_col_tiles", "ot", 4], ["chunk", "ot", 8], ["offset", "ot", 8], ["offsetCS", "ot", 8], ["vec", "ot", 2], ["wmma_m", "ot", 16]]}, "result": [[9.603944375772559e-06], 0, 0.9867658615112305, 1651068164.0278747], "version": 0.2, "tvm_version": "0.8.0"}
{"input": ["cuda -keys=cuda,gpu -max_num_threads=1024 -thread_warp_size=32", "batch_matmul_tensorcore_q_k.cuda", [["TENSOR", [64, 64, 32], "float16"], ["TENSOR", [64, 64, 32], "float16"]], {}], "config": {"index": 37107, "code_hash": null, "entity": [["block_row_warps", "ot", 4], ["warp_row_tiles", "ot", 6], ["warp_col_tiles", "ot", 4], ["chunk", "ot", 2], ["offset", "ot", 8], ["offsetCS", "ot", 8], ["vec", "ot", 2], ["wmma_m", "ot", 16]]}, "result": [[7.2727194066749075e-06], 0, 0.9661226272583008, 1651068193.6886506], "version": 0.2, "tvm_version": "0.8.0"}
{"input": ["cuda -keys=cuda,gpu -max_num_threads=1024 -thread_warp_size=32", "batch_matmul_tensorcore_q_k.cuda", [["TENSOR", [64, 64, 32], "float16"], ["TENSOR", [64, 64, 32], "float16"]], {}], "config": {"index": 49912, "code_hash": null, "entity": [["block_row_warps", "ot", 1], ["warp_row_tiles", "ot", 8], ["warp_col_tiles", "ot", 4], ["chunk", "ot", 2], ["offset", "ot", 8], ["offsetCS", "ot", 8], ["vec", "ot", 8], ["wmma_m", "ot", 16]]}, "result": [[8.247024721878864e-06], 0, 1.0493988990783691, 1651068194.2594314], "version": 0.2, "tvm_version": "0.8.0"}
{"input": ["cuda -keys=cuda,gpu -max_num_threads=1024 -thread_warp_size=32", "batch_matmul_tensorcore_q_k.cuda", [["TENSOR", [64, 64, 32], "float16"], ["TENSOR", [64, 64, 32], "float16"]], {}], "config": {"index": 37099, "code_hash": null, "entity": [["block_row_warps", "ot", 4], ["warp_row_tiles", "ot", 4], ["warp_col_tiles", "ot", 4], ["chunk", "ot", 2], ["offset", "ot", 8], ["offsetCS", "ot", 8], ["vec", "ot", 2], ["wmma_m", "ot", 16]]}, "result": [[6.135541385652974e-06], 0, 0.9849190711975098, 1651068194.8175972], "version": 0.2, "tvm_version": "0.8.0"}
{"input": ["cuda -keys=cuda,gpu -max_num_threads=1024 -thread_warp_size=32", "batch_matmul_tensorcore_q_k.cuda", [["TENSOR", [64, 64, 32], "float16"], ["TENSOR", [64, 64, 32], "float16"]], {}], "config": {"index": 37083, "code_hash": null, "entity": [["block_row_warps", "ot", 4], ["warp_row_tiles", "ot", 1], ["warp_col_tiles", "ot", 4], ["chunk", "ot", 2], ["offset", "ot", 8], ["offsetCS", "ot", 8], ["vec", "ot", 2], ["wmma_m", "ot", 16]]}, "result": [[5.6671383164512754e-06], 0, 0.9955563545227051, 1651068195.4412854], "version": 0.2, "tvm_version": "0.8.0"}
{"input": ["cuda -keys=cuda,gpu -max_num_threads=1024 -thread_warp_size=32", "batch_matmul_tensorcore_q_k.cuda", [["TENSOR", [64, 64, 32], "float16"], ["TENSOR", [64, 64, 32], "float16"]], {}], "config": {"index": 46712, "code_hash": null, "entity": [["block_row_warps", "ot", 1], ["warp_row_tiles", "ot", 8], ["warp_col_tiles", "ot", 4], ["chunk", "ot", 2], ["offset", "ot", 8], ["offsetCS", "ot", 0], ["vec", "ot", 8], ["wmma_m", "ot", 16]]}, "result": [[8.170292336217553e-06], 0, 0.9924468994140625, 1651068195.9957817], "version": 0.2, "tvm_version": "0.8.0"}
{"input": ["cuda -keys=cuda,gpu -max_num_threads=1024 -thread_warp_size=32", "batch_matmul_tensorcore_q_k.cuda", [["TENSOR", [64, 64, 32], "float16"], ["TENSOR", [64, 64, 32], "float16"]], {}], "config": {"index": 33907, "code_hash": null, "entity": [["block_row_warps", "ot", 4], ["warp_row_tiles", "ot", 6], ["warp_col_tiles", "ot", 4], ["chunk", "ot", 2], ["offset", "ot", 8], ["offsetCS", "ot", 0], ["vec", "ot", 2], ["wmma_m", "ot", 16]]}, "result": [[8.947232385661311e-06], 0, 1.117659330368042, 1651068196.6133168], "version": 0.2, "tvm_version": "0.8.0"}
