python/models/swin_transformer/kernel_configs/swin_transformer_relu_1_7_7_1024.log
{"i": [["[\"relu\", 1, 7, 7, 1024]", "cuda -keys=cuda,gpu -max_num_threads=1024 -model=unknown -thread_warp_size=32", [-1, 16, 64, 49152, 2147483647, 1024, 8, 32], "", 0, []], [[], [["FU", 1, [0, 1, 2, 3]], ["SP", 1, 0, 50176, [8], 1], ["AN", 1, 0, 5], ["AN", 1, 1, 6]]]], "r": [[7.29499e-06, 7.30369e-06, 7.30285e-06], 0, 1.22168, 1668060926], "v": "v0.6"}
{"i": [["[\"relu\", 1, 7, 7, 1024]", "cuda -keys=cuda,gpu -max_num_threads=1024 -model=unknown -thread_warp_size=32", [-1, 16, 64, 49152, 2147483647, 1024, 8, 32], "", 0, []], [[], [["FU", 1, [0, 1, 2, 3]], ["SP", 1, 0, 50176, [16], 1], ["AN", 1, 0, 5], ["AN", 1, 1, 6]]]], "r": [[4.94011e-06, 4.95828e-06, 4.95566e-06], 0, 2.57, 1668060927], "v": "v0.6"}
{"i": [["[\"relu\", 1, 7, 7, 1024]", "cuda -keys=cuda,gpu -max_num_threads=1024 -model=unknown -thread_warp_size=32", [-1, 16, 64, 49152, 2147483647, 1024, 8, 32], "", 0, []], [[], [["FU", 1, [0, 1, 2, 3]], ["SP", 1, 0, 50176, [1], 1], ["AN", 1, 0, 5], ["AN", 1, 1, 6]]]], "r": [[3.98225e-05, 3.98285e-05, 3.98205e-05], 0, 0.837159, 1668060925], "v": "v0.6"}
{"i": [["[\"relu\", 1, 7, 7, 1024]", "cuda -keys=cuda,gpu -max_num_threads=1024 -model=unknown -thread_warp_size=32", [-1, 16, 64, 49152, 2147483647, 1024, 8, 32], "", 0, []], [[], [["FU", 1, [0, 1, 2, 3]], ["SP", 1, 0, 50176, [64], 1], ["AN", 1, 0, 5], ["AN", 1, 1, 6]]]], "r": [[3.21641e-06, 3.22715e-06, 3.22502e-06], 0, 1.55151, 1668060926], "v": "v0.6"}
{"i": [["[\"relu\", 1, 7, 7, 1024]", "cuda -keys=cuda,gpu -max_num_threads=1024 -model=unknown -thread_warp_size=32", [-1, 16, 64, 49152, 2147483647, 1024, 8, 32], "", 0, []], [[], [["FU", 1, [0, 1, 2, 3]], ["SP", 1, 0, 50176, [49], 1], ["AN", 1, 0, 5], ["AN", 1, 1, 6]]]], "r": [[3.4818e-06, 3.49107e-06, 3.49672e-06], 0, 0.514991, 1668060925], "v": "v0.6"}
{"i": [["[\"relu\", 1, 7, 7, 1024]", "cuda -keys=cuda,gpu -max_num_threads=1024 -model=unknown -thread_warp_size=32", [-1, 16, 64, 49152, 2147483647, 1024, 8, 32], "", 0, []], [[], [["FU", 1, [0, 1, 2, 3]], ["SP", 1, 0, 50176, [2], 1], ["AN", 1, 0, 5], ["AN", 1, 1, 6]]]], "r": [[2.13178e-05, 2.13519e-05, 2.13611e-05], 0, 1.8842, 1668060926], "v": "v0.6"}
{"i": [["[\"relu\", 1, 7, 7, 1024]", "cuda -keys=cuda,gpu -max_num_threads=1024 -model=unknown -thread_warp_size=32", [-1, 16, 64, 49152, 2147483647, 1024, 8, 32], "", 0, []], [[], [["FU", 1, [0, 1, 2, 3]], ["SP", 1, 0, 50176, [7], 1], ["AN", 1, 0, 5], ["AN", 1, 1, 6]]]], "r": [[7.897e-06, 7.90442e-06, 7.9037e-06], 0, 2.23443, 1668060927], "v": "v0.6"}
{"i": [["[\"relu\", 1, 7, 7, 1024]", "cuda -keys=cuda,gpu -max_num_threads=1024 -model=unknown -thread_warp_size=32", [-1, 16, 64, 49152, 2147483647, 1024, 8, 32], "", 0, []], [[], [["FU", 1, [0, 1, 2, 3]], ["SP", 1, 0, 50176, [28], 1], ["AN", 1, 0, 5], ["AN", 1, 1, 6]]]], "r": [[3.89059e-06, 3.90835e-06, 3.90193e-06], 0, 3.6337, 1668060928], "v": "v0.6"}
{"i": [["[\"relu\", 1, 7, 7, 1024]", "cuda -keys=cuda,gpu -max_num_threads=1024 -model=unknown -thread_warp_size=32", [-1, 16, 64, 49152, 2147483647, 1024, 8, 32], "", 0, []], [[], [["FU", 1, [0, 1, 2, 3]], ["SP", 1, 0, 50176, [56], 1], ["AN", 1, 0, 5], ["AN", 1, 1, 6]]]], "r": [[3.1989e-06, 3.19126e-06, 3.19285e-06], 0, 2.91421, 1668060927], "v": "v0.6"}
{"i": [["[\"relu\", 1, 7, 7, 1024]", "cuda -keys=cuda,gpu -max_num_threads=1024 -model=unknown -thread_warp_size=32", [-1, 16, 64, 49152, 2147483647, 1024, 8, 32], "", 0, []], [[], [["FU", 1, [0, 1, 2, 3]], ["SP", 1, 0, 50176, [32], 1], ["AN", 1, 0, 5], ["AN", 1, 1, 6]]]], "r": [[3.83065e-06, 3.84596e-06, 3.84793e-06], 0, 3.2932, 1668060928], "v": "v0.6"}
{"i": [["[\"relu\", 1, 7, 7, 1024]", "cuda -keys=cuda,gpu -max_num_threads=1024 -model=unknown -thread_warp_size=32", [-1, 16, 64, 49152, 2147483647, 1024, 8, 32], "", 0, []], [[], [["FU", 1, [0, 1, 2, 3]], ["SP", 1, 0, 50176, [4], 1], ["AN", 1, 0, 5], ["AN", 1, 1, 6]]]], "r": [[1.20623e-05, 1.20801e-05, 1.20778e-05], 0, 3.97399, 1668060928], "v": "v0.6"}
{"i": [["[\"relu\", 1, 7, 7, 1024]", "cuda -keys=cuda,gpu -max_num_threads=1024 -model=unknown -thread_warp_size=32", [-1, 16, 64, 49152, 2147483647, 1024, 8, 32], "", 0, []], [[], [["FU", 1, [0, 1, 2, 3]], ["SP", 1, 0, 50176, [14], 1], ["AN", 1, 0, 5], ["AN", 1, 1, 6]]]], "r": [[5.23954e-06, 5.25005e-06, 5.24653e-06], 0, 4.33695, 1668060929], "v": "v0.6"}
{"i": [["[\"relu\", 1, 7, 7, 1024]", "cuda -keys=cuda,gpu -max_num_threads=1024 -model=unknown -thread_warp_size=32", [-1, 16, 64, 49152, 2147483647, 1024, 8, 32], "", 0, []], [[], [["FU", 1, [0, 1, 2, 3]], ["SP", 1, 0, 50176, [64], 1], ["AN", 1, 0, 5], ["AN", 1, 1, 6]]]], "r": [[3.07928e-06, 3.09643e-06, 3.09335e-06], 0, 1.27068, 1668061845], "v": "v0.6"}
{"i": [["[\"relu\", 1, 7, 7, 1024]", "cuda -keys=cuda,gpu -max_num_threads=1024 -model=unknown -thread_warp_size=32", [-1, 16, 64, 49152, 2147483647, 1024, 8, 32], "", 0, []], [[], [["FU", 1, [0, 1, 2, 3]], ["SP", 1, 0, 50176, [28], 1], ["AN", 1, 0, 5], ["AN", 1, 1, 6]]]], "r": [[3.91416e-06, 3.92927e-06, 3.925e-06], 0, 2.31649, 1668061846], "v": "v0.6"}
{"i": [["[\"relu\", 1, 7, 7, 1024]", "cuda -keys=cuda,gpu -max_num_threads=1024 -model=unknown -thread_warp_size=32", [-1, 16, 64, 49152, 2147483647, 1024, 8, 32], "", 0, []], [[], [["FU", 1, [0, 1, 2, 3]], ["SP", 1, 0, 50176, [4], 1], ["AN", 1, 0, 5], ["AN", 1, 1, 6]]]], "r": [[1.19988e-05, 1.2016e-05, 1.20142e-05], 0, 3.70349, 1668061848], "v": "v0.6"}
{"i": [["[\"relu\", 1, 7, 7, 1024]", "cuda -keys=cuda,gpu -max_num_threads=1024 -model=unknown -thread_warp_size=32", [-1, 16, 64, 49152, 2147483647, 1024, 8, 32], "", 0, []], [[], [["FU", 1, [0, 1, 2, 3]], ["SP", 1, 0, 50176, [1], 1], ["AN", 1, 0, 5], ["AN", 1, 1, 6]]]], "r": [[3.98116e-05, 3.982e-05, 3.98329e-05], 0, 1.60154, 1668061846], "v": "v0.6"}
{"i": [["[\"relu\", 1, 7, 7, 1024]", "cuda -keys=cuda,gpu -max_num_threads=1024 -model=unknown -thread_warp_size=32", [-1, 16, 64, 49152, 2147483647, 1024, 8, 32], "", 0, []], [[], [["FU", 1, [0, 1, 2, 3]], ["SP", 1, 0, 50176, [8], 1], ["AN", 1, 0, 5], ["AN", 1, 1, 6]]]], "r": [[7.21977e-06, 7.24275e-06, 7.24347e-06], 0, 0.897063, 1668061845], "v": "v0.6"}
{"i": [["[\"relu\", 1, 7, 7, 1024]", "cuda -keys=cuda,gpu -max_num_threads=1024 -model=unknown -thread_warp_size=32", [-1, 16, 64, 49152, 2147483647, 1024, 8, 32], "", 0, []], [[], [["FU", 1, [0, 1, 2, 3]], ["SP", 1, 0, 50176, [56], 1], ["AN", 1, 0, 5], ["AN", 1, 1, 6]]]], "r": [[3.14169e-06, 3.13973e-06, 3.14123e-06], 0, 0.556531, 1668061845], "v": "v0.6"}
{"i": [["[\"relu\", 1, 7, 7, 1024]", "cuda -keys=cuda,gpu -max_num_threads=1024 -model=unknown -thread_warp_size=32", [-1, 16, 64, 49152, 2147483647, 1024, 8, 32], "", 0, []], [[], [["FU", 1, [0, 1, 2, 3]], ["SP", 1, 0, 50176, [49], 1], ["AN", 1, 0, 5], ["AN", 1, 1, 6]]]], "r": [[3.28689e-06, 3.28785e-06, 3.2866e-06], 0, 3.36316, 1668061848], "v": "v0.6"}
{"i": [["[\"relu\", 1, 7, 7, 1024]", "cuda -keys=cuda,gpu -max_num_threads=1024 -model=unknown -thread_warp_size=32", [-1, 16, 64, 49152, 2147483647, 1024, 8, 32], "", 0, []], [[], [["FU", 1, [0, 1, 2, 3]], ["SP", 1, 0, 50176, [14], 1], ["AN", 1, 0, 5], ["AN", 1, 1, 6]]]], "r": [[5.40854e-06, 5.42589e-06, 5.42752e-06], 0, 1.93817, 1668061846], "v": "v0.6"}
{"i": [["[\"relu\", 1, 7, 7, 1024]", "cuda -keys=cuda,gpu -max_num_threads=1024 -model=unknown -thread_warp_size=32", [-1, 16, 64, 49152, 2147483647, 1024, 8, 32], "", 0, []], [[], [["FU", 1, [0, 1, 2, 3]], ["SP", 1, 0, 50176, [7], 1], ["AN", 1, 0, 5], ["AN", 1, 1, 6]]]], "r": [[7.88499e-06, 7.90323e-06, 7.90381e-06], 0, 2.96346, 1668061847], "v": "v0.6"}
{"i": [["[\"relu\", 1, 7, 7, 1024]", "cuda -keys=cuda,gpu -max_num_threads=1024 -model=unknown -thread_warp_size=32", [-1, 16, 64, 49152, 2147483647, 1024, 8, 32], "", 0, []], [[], [["FU", 1, [0, 1, 2, 3]], ["SP", 1, 0, 50176, [2], 1], ["AN", 1, 0, 5], ["AN", 1, 1, 6]]]], "r": [[2.12686e-05, 2.12827e-05, 2.12831e-05], 0, 4.0401, 1668061848], "v": "v0.6"}
{"i": [["[\"relu\", 1, 7, 7, 1024]", "cuda -keys=cuda,gpu -max_num_threads=1024 -model=unknown -thread_warp_size=32", [-1, 16, 64, 49152, 2147483647, 1024, 8, 32], "", 0, []], [[], [["FU", 1, [0, 1, 2, 3]], ["SP", 1, 0, 50176, [16], 1], ["AN", 1, 0, 5], ["AN", 1, 1, 6]]]], "r": [[5.0439e-06, 5.0599e-06, 5.05074e-06], 0, 2.61988, 1668061847], "v": "v0.6"}
{"i": [["[\"relu\", 1, 7, 7, 1024]", "cuda -keys=cuda,gpu -max_num_threads=1024 -model=unknown -thread_warp_size=32", [-1, 16, 64, 49152, 2147483647, 1024, 8, 32], "", 0, []], [[], [["FU", 1, [0, 1, 2, 3]], ["SP", 1, 0, 50176, [32], 1], ["AN", 1, 0, 5], ["AN", 1, 1, 6]]]], "r": [[3.66163e-06, 3.67492e-06, 3.67204e-06], 0, 4.40801, 1668061849], "v": "v0.6"}
