python/models/swin_transformer/kernel_configs/swin_transformer_fused_roll_window_partition_1_7_7_1024_3_7_float16.log
{"i": [["[\"fused_roll_window_partition\", 1, 7, 7, 1024, 3, 7, \"float16\"]", "cuda -keys=cuda,gpu -max_num_threads=1024 -model=unknown -thread_warp_size=32", [-1, 16, 64, 49152, 2147483647, 1024, 8, 32], "", 0, []], [[], [["FU", 1, [0, 1, 2, 3]], ["SP", 1, 0, 50176, [14], 1], ["AN", 1, 0, 5], ["AN", 1, 1, 6]]]], "r": [[5.72859e-06, 5.57494e-06, 5.39614e-06, 5.39577e-06, 5.39661e-06, 5.39848e-06, 5.39575e-06, 5.39584e-06, 5.39635e-06, 5.39531e-06], 0, 5.27862, 1651678875], "v": "v0.6"}
{"i": [["[\"fused_roll_window_partition\", 1, 7, 7, 1024, 3, 7, \"float16\"]", "cuda -keys=cuda,gpu -max_num_threads=1024 -model=unknown -thread_warp_size=32", [-1, 16, 64, 49152, 2147483647, 1024, 8, 32], "", 0, []], [[], [["FU", 1, [0, 1, 2, 3]], ["SP", 1, 0, 50176, [8], 1], ["AN", 1, 0, 5], ["AN", 1, 1, 6]]]], "r": [[7.36178e-06, 7.35918e-06, 7.35911e-06, 7.36016e-06, 7.42019e-06, 7.38729e-06, 7.39582e-06, 7.41924e-06, 8.127e-06, 7.64138e-06], 0, 20.3999, 1651678890], "v": "v0.6"}
{"i": [["[\"fused_roll_window_partition\", 1, 7, 7, 1024, 3, 7, \"float16\"]", "cuda -keys=cuda,gpu -max_num_threads=1024 -model=unknown -thread_warp_size=32", [-1, 16, 64, 49152, 2147483647, 1024, 8, 32], "", 0, []], [[], [["FU", 1, [0, 1, 2, 3]], ["SP", 1, 0, 50176, [16], 1], ["AN", 1, 0, 5], ["AN", 1, 1, 6]]]], "r": [[5.19682e-06, 5.12789e-06, 7.07382e-06, 4.92078e-06, 4.9196e-06, 4.90894e-06, 4.90761e-06, 4.90825e-06, 4.90925e-06, 4.90952e-06], 0, 9.99783, 1651678879], "v": "v0.6"}
{"i": [["[\"fused_roll_window_partition\", 1, 7, 7, 1024, 3, 7, \"float16\"]", "cuda -keys=cuda,gpu -max_num_threads=1024 -model=unknown -thread_warp_size=32", [-1, 16, 64, 49152, 2147483647, 1024, 8, 32], "", 0, []], [[], [["FU", 1, [0, 1, 2, 3]], ["SP", 1, 0, 50176, [49], 1], ["AN", 1, 0, 5], ["AN", 1, 1, 6]]]], "r": [[3.69769e-06, 3.97308e-06, 3.86431e-06, 3.75304e-06, 3.74153e-06, 4.07682e-06, 3.76564e-06, 3.88251e-06, 3.76374e-06, 3.96082e-06], 0, 12.7933, 1651678882], "v": "v0.6"}
{"i": [["[\"fused_roll_window_partition\", 1, 7, 7, 1024, 3, 7, \"float16\"]", "cuda -keys=cuda,gpu -max_num_threads=1024 -model=unknown -thread_warp_size=32", [-1, 16, 64, 49152, 2147483647, 1024, 8, 32], "", 0, []], [[], [["FU", 1, [0, 1, 2, 3]], ["SP", 1, 0, 50176, [1], 1], ["AN", 1, 0, 5], ["AN", 1, 1, 6]]]], "r": [[4.5896e-05, 4.28917e-05, 4.32316e-05, 4.14449e-05, 3.99956e-05, 3.99946e-05, 3.99934e-05, 3.99939e-05, 3.99947e-05, 4.12155e-05], 0, 7.91473, 1651678877], "v": "v0.6"}
{"i": [["[\"fused_roll_window_partition\", 1, 7, 7, 1024, 3, 7, \"float16\"]", "cuda -keys=cuda,gpu -max_num_threads=1024 -model=unknown -thread_warp_size=32", [-1, 16, 64, 49152, 2147483647, 1024, 8, 32], "", 0, []], [[], [["FU", 1, [0, 1, 2, 3]], ["SP", 1, 0, 50176, [56], 1], ["AN", 1, 0, 5], ["AN", 1, 1, 6]]]], "r": [[3.73561e-06, 3.66005e-06, 3.78819e-06, 3.77517e-06, 3.73497e-06, 3.74099e-06, 3.66055e-06, 3.72418e-06, 3.76376e-06, 3.77951e-06], 0, 3.23066, 1651678873], "v": "v0.6"}
{"i": [["[\"fused_roll_window_partition\", 1, 7, 7, 1024, 3, 7, \"float16\"]", "cuda -keys=cuda,gpu -max_num_threads=1024 -model=unknown -thread_warp_size=32", [-1, 16, 64, 49152, 2147483647, 1024, 8, 32], "", 0, []], [[], [["FU", 1, [0, 1, 2, 3]], ["SP", 1, 0, 50176, [28], 1], ["AN", 1, 0, 5], ["AN", 1, 1, 6]]]], "r": [[3.83752e-06, 3.83629e-06, 3.83528e-06, 4.22381e-06, 3.83602e-06, 3.86386e-06, 4.08251e-06, 3.96512e-06, 3.83778e-06, 3.8373e-06], 0, 17.8411, 1651678887], "v": "v0.6"}
{"i": [["[\"fused_roll_window_partition\", 1, 7, 7, 1024, 3, 7, \"float16\"]", "cuda -keys=cuda,gpu -max_num_threads=1024 -model=unknown -thread_warp_size=32", [-1, 16, 64, 49152, 2147483647, 1024, 8, 32], "", 0, []], [[], [["FU", 1, [0, 1, 2, 3]], ["SP", 1, 0, 50176, [64], 1], ["AN", 1, 0, 5], ["AN", 1, 1, 6]]]], "r": [[3.89414e-06, 3.77279e-06, 3.90584e-06, 3.79598e-06, 3.75805e-06, 3.71134e-06, 3.83438e-06, 3.70264e-06, 3.77132e-06, 3.79812e-06], 0, 22.7219, 1651678892], "v": "v0.6"}
{"i": [["[\"fused_roll_window_partition\", 1, 7, 7, 1024, 3, 7, \"float16\"]", "cuda -keys=cuda,gpu -max_num_threads=1024 -model=unknown -thread_warp_size=32", [-1, 16, 64, 49152, 2147483647, 1024, 8, 32], "", 0, []], [[], [["FU", 1, [0, 1, 2, 3]], ["SP", 1, 0, 50176, [32], 1], ["AN", 1, 0, 5], ["AN", 1, 1, 6]]]], "r": [[4.08489e-06, 4.16814e-06, 4.08858e-06, 3.89573e-06, 3.68309e-06, 4.19208e-06, 3.79086e-06, 3.86826e-06, 3.6914e-06, 3.72205e-06], 0, 15.2991, 1651678885], "v": "v0.6"}
{"i": [["[\"fused_roll_window_partition\", 1, 7, 7, 1024, 3, 7, \"float16\"]", "cuda -keys=cuda,gpu -max_num_threads=1024 -model=unknown -thread_warp_size=32", [-1, 16, 64, 49152, 2147483647, 1024, 8, 32], "", 0, []], [[], [["FU", 1, [0, 1, 2, 3]], ["SP", 1, 0, 50176, [2], 1], ["AN", 1, 0, 5], ["AN", 1, 1, 6]]]], "r": [[2.13946e-05, 2.21178e-05, 2.1403e-05, 2.1552e-05, 2.28023e-05, 2.2231e-05, 2.13955e-05, 2.13952e-05, 2.13955e-05, 2.13936e-05], 0, 25.0537, 1651678895], "v": "v0.6"}
{"i": [["[\"fused_roll_window_partition\", 1, 7, 7, 1024, 3, 7, \"float16\"]", "cuda -keys=cuda,gpu -max_num_threads=1024 -model=unknown -thread_warp_size=32", [-1, 16, 64, 49152, 2147483647, 1024, 8, 32], "", 0, []], [[], [["FU", 1, [0, 1, 2, 3]], ["SP", 1, 0, 50176, [8], 1], ["AN", 1, 0, 5], ["AN", 1, 1, 6]]]], "r": [[7.29589e-06, 7.29652e-06, 7.29616e-06, 7.29569e-06, 7.29576e-06, 7.29556e-06, 7.29624e-06, 7.29599e-06, 7.2957e-06, 7.29565e-06], 0, 6.89804, 1651682206], "v": "v0.6"}
{"i": [["[\"fused_roll_window_partition\", 1, 7, 7, 1024, 3, 7, \"float16\"]", "cuda -keys=cuda,gpu -max_num_threads=1024 -model=unknown -thread_warp_size=32", [-1, 16, 64, 49152, 2147483647, 1024, 8, 32], "", 0, []], [[], [["FU", 1, [0, 1, 2, 3]], ["SP", 1, 0, 50176, [32], 1], ["AN", 1, 0, 5], ["AN", 1, 1, 6]]]], "r": [[4.37423e-06, 4.81845e-06, 1.27601e-05, 4.01705e-06, 3.78292e-06, 3.77512e-06, 3.77486e-06, 3.77451e-06, 3.7746e-06, 3.77409e-06], 0, 5.30763, 1651682204], "v": "v0.6"}
{"i": [["[\"fused_roll_window_partition\", 1, 7, 7, 1024, 3, 7, \"float16\"]", "cuda -keys=cuda,gpu -max_num_threads=1024 -model=unknown -thread_warp_size=32", [-1, 16, 64, 49152, 2147483647, 1024, 8, 32], "", 0, []], [[], [["FU", 1, [0, 1, 2, 3]], ["SP", 1, 0, 50176, [2], 1], ["AN", 1, 0, 5], ["AN", 1, 1, 6]]]], "r": [[2.15536e-05, 2.1554e-05, 2.1555e-05, 2.15549e-05, 2.15542e-05, 2.15551e-05, 2.15332e-05, 2.16049e-05, 2.15791e-05, 2.22027e-05], 0, 10.9313, 1651682210], "v": "v0.6"}
{"i": [["[\"fused_roll_window_partition\", 1, 7, 7, 1024, 3, 7, \"float16\"]", "cuda -keys=cuda,gpu -max_num_threads=1024 -model=unknown -thread_warp_size=32", [-1, 16, 64, 49152, 2147483647, 1024, 8, 32], "", 0, []], [[], [["FU", 1, [0, 1, 2, 3]], ["SP", 1, 0, 50176, [49], 1], ["AN", 1, 0, 5], ["AN", 1, 1, 6]]]], "r": [[3.32874e-06, 3.34549e-06, 3.34826e-06, 3.98218e-06, 4.17822e-06, 4.85325e-06, 4.12465e-06, 4.49154e-06, 4.15428e-06, 4.10912e-06], 0, 17.3557, 1651682216], "v": "v0.6"}
{"i": [["[\"fused_roll_window_partition\", 1, 7, 7, 1024, 3, 7, \"float16\"]", "cuda -keys=cuda,gpu -max_num_threads=1024 -model=unknown -thread_warp_size=32", [-1, 16, 64, 49152, 2147483647, 1024, 8, 32], "", 0, []], [[], [["FU", 1, [0, 1, 2, 3]], ["SP", 1, 0, 50176, [56], 1], ["AN", 1, 0, 5], ["AN", 1, 1, 6]]]], "r": [[3.87753e-06, 3.77812e-06, 5.78471e-06, 3.33664e-06, 7.10982e-06, 3.33294e-06, 3.31295e-06, 3.2859e-06, 3.25527e-06, 3.29894e-06], 0, 14.5849, 1651682214], "v": "v0.6"}
{"i": [["[\"fused_roll_window_partition\", 1, 7, 7, 1024, 3, 7, \"float16\"]", "cuda -keys=cuda,gpu -max_num_threads=1024 -model=unknown -thread_warp_size=32", [-1, 16, 64, 49152, 2147483647, 1024, 8, 32], "", 0, []], [[], [["FU", 1, [0, 1, 2, 3]], ["SP", 1, 0, 50176, [14], 1], ["AN", 1, 0, 5], ["AN", 1, 1, 6]]]], "r": [[5.38044e-06, 5.37988e-06, 5.37935e-06, 5.38042e-06, 5.37994e-06, 5.3809e-06, 5.38074e-06, 5.38106e-06, 5.3802e-06, 5.38032e-06], 0, 26.7802, 1651682226], "v": "v0.6"}
{"i": [["[\"fused_roll_window_partition\", 1, 7, 7, 1024, 3, 7, \"float16\"]", "cuda -keys=cuda,gpu -max_num_threads=1024 -model=unknown -thread_warp_size=32", [-1, 16, 64, 49152, 2147483647, 1024, 8, 32], "", 0, []], [[], [["FU", 1, [0, 1, 2, 3]], ["SP", 1, 0, 50176, [28], 1], ["AN", 1, 0, 5], ["AN", 1, 1, 6]]]], "r": [[4.35056e-06, 4.37012e-06, 4.39197e-06, 5.52629e-06, 4.94822e-06, 4.28297e-06, 4.71324e-06, 7.86739e-06, 4.49041e-06, 4.62874e-06], 0, 21.3126, 1651682220], "v": "v0.6"}
{"i": [["[\"fused_roll_window_partition\", 1, 7, 7, 1024, 3, 7, \"float16\"]", "cuda -keys=cuda,gpu -max_num_threads=1024 -model=unknown -thread_warp_size=32", [-1, 16, 64, 49152, 2147483647, 1024, 8, 32], "", 0, []], [[], [["FU", 1, [0, 1, 2, 3]], ["SP", 1, 0, 50176, [16], 1], ["AN", 1, 0, 5], ["AN", 1, 1, 6]]]], "r": [[5.1842e-06, 5.18335e-06, 5.18484e-06, 5.18398e-06, 5.18343e-06, 5.18439e-06, 5.185e-06, 5.18429e-06, 5.18482e-06, 5.18419e-06], 0, 25.0517, 1651682224], "v": "v0.6"}
{"i": [["[\"fused_roll_window_partition\", 1, 7, 7, 1024, 3, 7, \"float16\"]", "cuda -keys=cuda,gpu -max_num_threads=1024 -model=unknown -thread_warp_size=32", [-1, 16, 64, 49152, 2147483647, 1024, 8, 32], "", 0, []], [[], [["FU", 1, [0, 1, 2, 3]], ["SP", 1, 0, 50176, [4], 1], ["AN", 1, 0, 5], ["AN", 1, 1, 6]]]], "r": [[1.2149e-05, 1.2147e-05, 1.21497e-05, 1.21495e-05, 1.21466e-05, 1.21486e-05, 1.21467e-05, 1.21477e-05, 1.21469e-05, 1.21499e-05], 0, 8.92537, 1651682208], "v": "v0.6"}
{"i": [["[\"fused_roll_window_partition\", 1, 7, 7, 1024, 3, 7, \"float16\"]", "cuda -keys=cuda,gpu -max_num_threads=1024 -model=unknown -thread_warp_size=32", [-1, 16, 64, 49152, 2147483647, 1024, 8, 32], "", 0, []], [[], [["FU", 1, [0, 1, 2, 3]], ["SP", 1, 0, 50176, [7], 1], ["AN", 1, 0, 5], ["AN", 1, 1, 6]]]], "r": [[7.95691e-06, 7.95682e-06, 7.95707e-06, 7.95697e-06, 7.95741e-06, 7.95726e-06, 7.95709e-06, 7.95704e-06, 7.95708e-06, 7.95671e-06], 0, 23.3375, 1651682222], "v": "v0.6"}
{"i": [["[\"fused_roll_window_partition\", 1, 7, 7, 1024, 3, 7, \"float16\"]", "cuda -keys=cuda,gpu -max_num_threads=1024 -model=unknown -thread_warp_size=32", [-1, 16, 64, 49152, 2147483647, 1024, 8, 32], "", 0, []], [[], [["FU", 1, [0, 1, 2, 3]], ["SP", 1, 0, 50176, [64], 1], ["AN", 1, 0, 5], ["AN", 1, 1, 6]]]], "r": [[9.38043e-06, 3.3285e-06, 3.23333e-06, 3.2873e-06, 3.36634e-06, 5.29955e-06, 4.20448e-06, 4.22185e-06, 6.20421e-06, 4.69027e-06], 0, 33.6566, 1651682233], "v": "v0.6"}
{"i": [["[\"fused_roll_window_partition\", 1, 7, 7, 1024, 3, 7, \"float16\"]", "cuda -keys=cuda,gpu -max_num_threads=1024 -model=unknown -thread_warp_size=32", [-1, 16, 64, 49152, 2147483647, 1024, 8, 32], "", 0, []], [[], [["FU", 1, [0, 1, 2, 3]], ["SP", 1, 0, 50176, [1], 1], ["AN", 1, 0, 5], ["AN", 1, 1, 6]]]], "r": [[4.00206e-05, 4.00605e-05, 4.00795e-05, 4.34699e-05, 4.75201e-05, 4.5803e-05, 5.76044e-05, 4.00775e-05, 3.99767e-05, 4.00822e-05], 0, 29.7784, 1651682229], "v": "v0.6"}
