python/models/swin_transformer/kernel_configs/swin_transformer_layer_normalization_normal_1_56_56_512_1_0_float16.log
{"i": [["[\"layer_normalization_normal\", 1, 56, 56, 512, 1, 0, \"float16\"]", "cuda -keys=cuda,gpu -max_num_threads=1024 -model=unknown -thread_warp_size=32", [-1, 16, 64, 49152, 2147483647, 1024, 8, 32], "", 0, []], [[], [["CHW", 4, "local"], ["CI", 4], ["CI", 3], ["FU", 5, [0, 1]], ["SP", 5, 0, 1605632, [32], 1], ["AN", 5, 0, 5], ["AN", 5, 1, 6]]]], "r": [[4.01886e-05, 4.01754e-05, 4.01776e-05], 0, 1.15373, 1668019032], "v": "v0.6"}
{"i": [["[\"layer_normalization_normal\", 1, 56, 56, 512, 1, 0, \"float16\"]", "cuda -keys=cuda,gpu -max_num_threads=1024 -model=unknown -thread_warp_size=32", [-1, 16, 64, 49152, 2147483647, 1024, 8, 32], "", 0, []], [[], [["CHW", 4, "local"], ["CI", 4], ["CI", 3], ["FU", 5, [0, 1]], ["SP", 5, 0, 1605632, [7], 1], ["AN", 5, 0, 5], ["AN", 5, 1, 6]]]], "r": [[0.000173239, 0.000173228, 0.000173258], 0, 2.893, 1668019034], "v": "v0.6"}
{"i": [["[\"layer_normalization_normal\", 1, 56, 56, 512, 1, 0, \"float16\"]", "cuda -keys=cuda,gpu -max_num_threads=1024 -model=unknown -thread_warp_size=32", [-1, 16, 64, 49152, 2147483647, 1024, 8, 32], "", 0, []], [[], [["CHW", 4, "local"], ["CI", 4], ["CI", 3], ["FU", 5, [0, 1]], ["SP", 5, 0, 1605632, [64], 1], ["AN", 5, 0, 5], ["AN", 5, 1, 6]]]], "r": [[2.13493e-05, 2.13259e-05, 2.13194e-05], 0, 2.47609, 1668019033], "v": "v0.6"}
{"i": [["[\"layer_normalization_normal\", 1, 56, 56, 512, 1, 0, \"float16\"]", "cuda -keys=cuda,gpu -max_num_threads=1024 -model=unknown -thread_warp_size=32", [-1, 16, 64, 49152, 2147483647, 1024, 8, 32], "", 0, []], [[], [["CHW", 4, "local"], ["CI", 4], ["CI", 3], ["FU", 5, [0, 1]], ["SP", 5, 0, 1605632, [56], 1], ["AN", 5, 0, 5], ["AN", 5, 1, 6]]]], "r": [[2.3969e-05, 2.39617e-05, 2.39541e-05], 0, 1.5835, 1668019032], "v": "v0.6"}
{"i": [["[\"layer_normalization_normal\", 1, 56, 56, 512, 1, 0, \"float16\"]", "cuda -keys=cuda,gpu -max_num_threads=1024 -model=unknown -thread_warp_size=32", [-1, 16, 64, 49152, 2147483647, 1024, 8, 32], "", 0, []], [[], [["CHW", 4, "local"], ["CI", 4], ["CI", 3], ["FU", 5, [0, 1]], ["SP", 5, 0, 1605632, [49], 1], ["AN", 5, 0, 5], ["AN", 5, 1, 6]]]], "r": [[2.70103e-05, 2.70245e-05, 2.69996e-05], 0, 2.00557, 1668019033], "v": "v0.6"}
{"i": [["[\"layer_normalization_normal\", 1, 56, 56, 512, 1, 0, \"float16\"]", "cuda -keys=cuda,gpu -max_num_threads=1024 -model=unknown -thread_warp_size=32", [-1, 16, 64, 49152, 2147483647, 1024, 8, 32], "", 0, []], [[], [["CHW", 4, "local"], ["CI", 4], ["CI", 3], ["FU", 5, [0, 1]], ["SP", 5, 0, 1605632, [4], 1], ["AN", 5, 0, 5], ["AN", 5, 1, 6]]]], "r": [[0.000300745, 0.000300801, 0.000300813], 0, 0.673909, 1668019031], "v": "v0.6"}
{"i": [["[\"layer_normalization_normal\", 1, 56, 56, 512, 1, 0, \"float16\"]", "cuda -keys=cuda,gpu -max_num_threads=1024 -model=unknown -thread_warp_size=32", [-1, 16, 64, 49152, 2147483647, 1024, 8, 32], "", 0, []], [[], [["CHW", 4, "local"], ["CI", 4], ["CI", 3], ["FU", 5, [0, 1]], ["SP", 5, 0, 1605632, [2], 1], ["AN", 5, 0, 5], ["AN", 5, 1, 6]]]], "r": [[0.000598625, 0.000598524, 0.000598608], 0, 3.30996, 1668019034], "v": "v0.6"}
{"i": [["[\"layer_normalization_normal\", 1, 56, 56, 512, 1, 0, \"float16\"]", "cuda -keys=cuda,gpu -max_num_threads=1024 -model=unknown -thread_warp_size=32", [-1, 16, 64, 49152, 2147483647, 1024, 8, 32], "", 0, []], [[], [["CHW", 4, "local"], ["CI", 4], ["CI", 3], ["FU", 5, [0, 1]], ["SP", 5, 0, 1605632, [8], 1], ["AN", 5, 0, 5], ["AN", 5, 1, 6]]]], "r": [[0.000151965, 0.000151903, 0.000151899], 0, 4.18751, 1668019035], "v": "v0.6"}
{"i": [["[\"layer_normalization_normal\", 1, 56, 56, 512, 1, 0, \"float16\"]", "cuda -keys=cuda,gpu -max_num_threads=1024 -model=unknown -thread_warp_size=32", [-1, 16, 64, 49152, 2147483647, 1024, 8, 32], "", 0, []], [[], [["CHW", 4, "local"], ["CI", 4], ["CI", 3], ["FU", 5, [0, 1]], ["SP", 5, 0, 1605632, [14], 1], ["AN", 5, 0, 5], ["AN", 5, 1, 6]]]], "r": [[8.80505e-05, 8.80445e-05, 8.80541e-05], 0, 4.6141, 1668019035], "v": "v0.6"}
{"i": [["[\"layer_normalization_normal\", 1, 56, 56, 512, 1, 0, \"float16\"]", "cuda -keys=cuda,gpu -max_num_threads=1024 -model=unknown -thread_warp_size=32", [-1, 16, 64, 49152, 2147483647, 1024, 8, 32], "", 0, []], [[], [["CHW", 4, "local"], ["CI", 4], ["CI", 3], ["FU", 5, [0, 1]], ["SP", 5, 0, 1605632, [1], 1], ["AN", 5, 0, 5], ["AN", 5, 1, 6]]]], "r": [[0.00119386, 0.00119379, 0.00119385], 0, 3.77551, 1668019034], "v": "v0.6"}
{"i": [["[\"layer_normalization_normal\", 1, 56, 56, 512, 1, 0, \"float16\"]", "cuda -keys=cuda,gpu -max_num_threads=1024 -model=unknown -thread_warp_size=32", [-1, 16, 64, 49152, 2147483647, 1024, 8, 32], "", 0, []], [[], [["CHW", 4, "local"], ["CI", 4], ["CI", 3], ["FU", 5, [0, 1]], ["SP", 5, 0, 1605632, [28], 1], ["AN", 5, 0, 5], ["AN", 5, 1, 6]]]], "r": [[4.54801e-05, 4.54802e-05, 4.5473e-05], 0, 5.0835, 1668019036], "v": "v0.6"}
{"i": [["[\"layer_normalization_normal\", 1, 56, 56, 512, 1, 0, \"float16\"]", "cuda -keys=cuda,gpu -max_num_threads=1024 -model=unknown -thread_warp_size=32", [-1, 16, 64, 49152, 2147483647, 1024, 8, 32], "", 0, []], [[], [["CHW", 4, "local"], ["CI", 4], ["CI", 3], ["FU", 5, [0, 1]], ["SP", 5, 0, 1605632, [16], 1], ["AN", 5, 0, 5], ["AN", 5, 1, 6]]]], "r": [[7.74283e-05, 7.7435e-05, 7.7426e-05], 0, 5.52804, 1668019036], "v": "v0.6"}
{"i": [["[\"layer_normalization_normal\", 1, 56, 56, 512, 1, 0, \"float16\"]", "cuda -keys=cuda,gpu -max_num_threads=1024 -model=unknown -thread_warp_size=32", [-1, 16, 64, 49152, 2147483647, 1024, 8, 32], "", 0, []], [[], [["CHW", 4, "local"], ["CI", 4], ["CI", 3], ["FU", 5, [0, 1]], ["SP", 5, 0, 1605632, [1], 1], ["AN", 5, 0, 5], ["AN", 5, 1, 6]]]], "r": [[0.00119356, 0.00119351, 0.00119369], 0, 2.2702, 1668019496], "v": "v0.6"}
{"i": [["[\"layer_normalization_normal\", 1, 56, 56, 512, 1, 0, \"float16\"]", "cuda -keys=cuda,gpu -max_num_threads=1024 -model=unknown -thread_warp_size=32", [-1, 16, 64, 49152, 2147483647, 1024, 8, 32], "", 0, []], [[], [["CHW", 4, "local"], ["CI", 4], ["CI", 3], ["FU", 5, [0, 1]], ["SP", 5, 0, 1605632, [8], 1], ["AN", 5, 0, 5], ["AN", 5, 1, 6]]]], "r": [[0.000151827, 0.000151821, 0.000151798], 0, 0.62766, 1668019494], "v": "v0.6"}
{"i": [["[\"layer_normalization_normal\", 1, 56, 56, 512, 1, 0, \"float16\"]", "cuda -keys=cuda,gpu -max_num_threads=1024 -model=unknown -thread_warp_size=32", [-1, 16, 64, 49152, 2147483647, 1024, 8, 32], "", 0, []], [[], [["CHW", 4, "local"], ["CI", 4], ["CI", 3], ["FU", 5, [0, 1]], ["SP", 5, 0, 1605632, [7], 1], ["AN", 5, 0, 5], ["AN", 5, 1, 6]]]], "r": [[0.000173119, 0.000173091, 0.000173135], 0, 2.65377, 1668019496], "v": "v0.6"}
{"i": [["[\"layer_normalization_normal\", 1, 56, 56, 512, 1, 0, \"float16\"]", "cuda -keys=cuda,gpu -max_num_threads=1024 -model=unknown -thread_warp_size=32", [-1, 16, 64, 49152, 2147483647, 1024, 8, 32], "", 0, []], [[], [["CHW", 4, "local"], ["CI", 4], ["CI", 3], ["FU", 5, [0, 1]], ["SP", 5, 0, 1605632, [56], 1], ["AN", 5, 0, 5], ["AN", 5, 1, 6]]]], "r": [[2.39551e-05, 2.39504e-05, 2.39336e-05], 0, 1.06301, 1668019494], "v": "v0.6"}
{"i": [["[\"layer_normalization_normal\", 1, 56, 56, 512, 1, 0, \"float16\"]", "cuda -keys=cuda,gpu -max_num_threads=1024 -model=unknown -thread_warp_size=32", [-1, 16, 64, 49152, 2147483647, 1024, 8, 32], "", 0, []], [[], [["CHW", 4, "local"], ["CI", 4], ["CI", 3], ["FU", 5, [0, 1]], ["SP", 5, 0, 1605632, [4], 1], ["AN", 5, 0, 5], ["AN", 5, 1, 6]]]], "r": [[0.000300643, 0.000300666, 0.000300682], 0, 1.45427, 1668019495], "v": "v0.6"}
{"i": [["[\"layer_normalization_normal\", 1, 56, 56, 512, 1, 0, \"float16\"]", "cuda -keys=cuda,gpu -max_num_threads=1024 -model=unknown -thread_warp_size=32", [-1, 16, 64, 49152, 2147483647, 1024, 8, 32], "", 0, []], [[], [["CHW", 4, "local"], ["CI", 4], ["CI", 3], ["FU", 5, [0, 1]], ["SP", 5, 0, 1605632, [2], 1], ["AN", 5, 0, 5], ["AN", 5, 1, 6]]]], "r": [[0.000598363, 0.000598332, 0.000598366], 0, 1.83636, 1668019495], "v": "v0.6"}
{"i": [["[\"layer_normalization_normal\", 1, 56, 56, 512, 1, 0, \"float16\"]", "cuda -keys=cuda,gpu -max_num_threads=1024 -model=unknown -thread_warp_size=32", [-1, 16, 64, 49152, 2147483647, 1024, 8, 32], "", 0, []], [[], [["CHW", 4, "local"], ["CI", 4], ["CI", 3], ["FU", 5, [0, 1]], ["SP", 5, 0, 1605632, [32], 1], ["AN", 5, 0, 5], ["AN", 5, 1, 6]]]], "r": [[4.01733e-05, 4.01724e-05, 4.01635e-05], 0, 3.02603, 1668019496], "v": "v0.6"}
{"i": [["[\"layer_normalization_normal\", 1, 56, 56, 512, 1, 0, \"float16\"]", "cuda -keys=cuda,gpu -max_num_threads=1024 -model=unknown -thread_warp_size=32", [-1, 16, 64, 49152, 2147483647, 1024, 8, 32], "", 0, []], [[], [["CHW", 4, "local"], ["CI", 4], ["CI", 3], ["FU", 5, [0, 1]], ["SP", 5, 0, 1605632, [28], 1], ["AN", 5, 0, 5], ["AN", 5, 1, 6]]]], "r": [[4.54922e-05, 4.54776e-05, 4.54758e-05], 0, 3.83276, 1668019497], "v": "v0.6"}
{"i": [["[\"layer_normalization_normal\", 1, 56, 56, 512, 1, 0, \"float16\"]", "cuda -keys=cuda,gpu -max_num_threads=1024 -model=unknown -thread_warp_size=32", [-1, 16, 64, 49152, 2147483647, 1024, 8, 32], "", 0, []], [[], [["CHW", 4, "local"], ["CI", 4], ["CI", 3], ["FU", 5, [0, 1]], ["SP", 5, 0, 1605632, [49], 1], ["AN", 5, 0, 5], ["AN", 5, 1, 6]]]], "r": [[2.69453e-05, 2.69639e-05, 2.69402e-05], 0, 4.6444, 1668019498], "v": "v0.6"}
{"i": [["[\"layer_normalization_normal\", 1, 56, 56, 512, 1, 0, \"float16\"]", "cuda -keys=cuda,gpu -max_num_threads=1024 -model=unknown -thread_warp_size=32", [-1, 16, 64, 49152, 2147483647, 1024, 8, 32], "", 0, []], [[], [["CHW", 4, "local"], ["CI", 4], ["CI", 3], ["FU", 5, [0, 1]], ["SP", 5, 0, 1605632, [64], 1], ["AN", 5, 0, 5], ["AN", 5, 1, 6]]]], "r": [[2.12845e-05, 2.12754e-05, 2.12797e-05], 0, 3.45619, 1668019497], "v": "v0.6"}
{"i": [["[\"layer_normalization_normal\", 1, 56, 56, 512, 1, 0, \"float16\"]", "cuda -keys=cuda,gpu -max_num_threads=1024 -model=unknown -thread_warp_size=32", [-1, 16, 64, 49152, 2147483647, 1024, 8, 32], "", 0, []], [[], [["CHW", 4, "local"], ["CI", 4], ["CI", 3], ["FU", 5, [0, 1]], ["SP", 5, 0, 1605632, [16], 1], ["AN", 5, 0, 5], ["AN", 5, 1, 6]]]], "r": [[7.73986e-05, 7.73873e-05, 7.73871e-05], 0, 4.22128, 1668019498], "v": "v0.6"}
{"i": [["[\"layer_normalization_normal\", 1, 56, 56, 512, 1, 0, \"float16\"]", "cuda -keys=cuda,gpu -max_num_threads=1024 -model=unknown -thread_warp_size=32", [-1, 16, 64, 49152, 2147483647, 1024, 8, 32], "", 0, []], [[], [["CHW", 4, "local"], ["CI", 4], ["CI", 3], ["FU", 5, [0, 1]], ["SP", 5, 0, 1605632, [14], 1], ["AN", 5, 0, 5], ["AN", 5, 1, 6]]]], "r": [[8.81162e-05, 8.81531e-05, 8.81608e-05], 0, 5.03819, 1668019498], "v": "v0.6"}
