python/models/swin_transformer/kernel_configs/swin_transformer_window_reverse_1_56_56_128_7_float16.log
{"i": [["[\"window_reverse\", 1, 56, 56, 128, 7, \"float16\"]", "cuda -keys=cuda,gpu -max_num_threads=1024 -model=unknown -thread_warp_size=32", [-1, 16, 64, 49152, 2147483647, 1024, 8, 32], "", 0, []], [[], [["FU", 1, [0, 1, 2, 3]], ["SP", 1, 0, 401408, [14], 1], ["AN", 1, 0, 5], ["AN", 1, 1, 6]]]], "r": [[2.38102e-05, 2.38188e-05, 2.38195e-05], 0, 1.67014, 1668018160], "v": "v0.6"}
{"i": [["[\"window_reverse\", 1, 56, 56, 128, 7, \"float16\"]", "cuda -keys=cuda,gpu -max_num_threads=1024 -model=unknown -thread_warp_size=32", [-1, 16, 64, 49152, 2147483647, 1024, 8, 32], "", 0, []], [[], [["FU", 1, [0, 1, 2, 3]], ["SP", 1, 0, 401408, [56], 1], ["AN", 1, 0, 5], ["AN", 1, 1, 6]]]], "r": [[7.83791e-06, 7.85983e-06, 7.861e-06], 0, 0.603736, 1668018159], "v": "v0.6"}
{"i": [["[\"window_reverse\", 1, 56, 56, 128, 7, \"float16\"]", "cuda -keys=cuda,gpu -max_num_threads=1024 -model=unknown -thread_warp_size=32", [-1, 16, 64, 49152, 2147483647, 1024, 8, 32], "", 0, []], [[], [["FU", 1, [0, 1, 2, 3]], ["SP", 1, 0, 401408, [2], 1], ["AN", 1, 0, 5], ["AN", 1, 1, 6]]]], "r": [[0.000151264, 0.000151308, 0.000151294], 0, 1.27032, 1668018160], "v": "v0.6"}
{"i": [["[\"window_reverse\", 1, 56, 56, 128, 7, \"float16\"]", "cuda -keys=cuda,gpu -max_num_threads=1024 -model=unknown -thread_warp_size=32", [-1, 16, 64, 49152, 2147483647, 1024, 8, 32], "", 0, []], [[], [["FU", 1, [0, 1, 2, 3]], ["SP", 1, 0, 401408, [4], 1], ["AN", 1, 0, 5], ["AN", 1, 1, 6]]]], "r": [[7.69282e-05, 7.69158e-05, 7.69083e-05], 0, 2.40163, 1668018161], "v": "v0.6"}
{"i": [["[\"window_reverse\", 1, 56, 56, 128, 7, \"float16\"]", "cuda -keys=cuda,gpu -max_num_threads=1024 -model=unknown -thread_warp_size=32", [-1, 16, 64, 49152, 2147483647, 1024, 8, 32], "", 0, []], [[], [["FU", 1, [0, 1, 2, 3]], ["SP", 1, 0, 401408, [8], 1], ["AN", 1, 0, 5], ["AN", 1, 1, 6]]]], "r": [[3.97899e-05, 3.98077e-05, 3.9819e-05], 0, 0.932692, 1668018159], "v": "v0.6"}
{"i": [["[\"window_reverse\", 1, 56, 56, 128, 7, \"float16\"]", "cuda -keys=cuda,gpu -max_num_threads=1024 -model=unknown -thread_warp_size=32", [-1, 16, 64, 49152, 2147483647, 1024, 8, 32], "", 0, []], [[], [["FU", 1, [0, 1, 2, 3]], ["SP", 1, 0, 401408, [64], 1], ["AN", 1, 0, 5], ["AN", 1, 1, 6]]]], "r": [[7.21837e-06, 7.22904e-06, 7.23531e-06], 0, 2.03061, 1668018160], "v": "v0.6"}
{"i": [["[\"window_reverse\", 1, 56, 56, 128, 7, \"float16\"]", "cuda -keys=cuda,gpu -max_num_threads=1024 -model=unknown -thread_warp_size=32", [-1, 16, 64, 49152, 2147483647, 1024, 8, 32], "", 0, []], [[], [["FU", 1, [0, 1, 2, 3]], ["SP", 1, 0, 401408, [7], 1], ["AN", 1, 0, 5], ["AN", 1, 1, 6]]]], "r": [[4.50456e-05, 4.50435e-05, 4.50371e-05], 0, 3.50761, 1668018162], "v": "v0.6"}
{"i": [["[\"window_reverse\", 1, 56, 56, 128, 7, \"float16\"]", "cuda -keys=cuda,gpu -max_num_threads=1024 -model=unknown -thread_warp_size=32", [-1, 16, 64, 49152, 2147483647, 1024, 8, 32], "", 0, []], [[], [["FU", 1, [0, 1, 2, 3]], ["SP", 1, 0, 401408, [49], 1], ["AN", 1, 0, 5], ["AN", 1, 1, 6]]]], "r": [[8.59824e-06, 8.60808e-06, 8.60427e-06], 0, 2.81758, 1668018161], "v": "v0.6"}
{"i": [["[\"window_reverse\", 1, 56, 56, 128, 7, \"float16\"]", "cuda -keys=cuda,gpu -max_num_threads=1024 -model=unknown -thread_warp_size=32", [-1, 16, 64, 49152, 2147483647, 1024, 8, 32], "", 0, []], [[], [["FU", 1, [0, 1, 2, 3]], ["SP", 1, 0, 401408, [1], 1], ["AN", 1, 0, 5], ["AN", 1, 1, 6]]]], "r": [[0.000300276, 0.000300255, 0.000300301], 0, 3.14072, 1668018161], "v": "v0.6"}
{"i": [["[\"window_reverse\", 1, 56, 56, 128, 7, \"float16\"]", "cuda -keys=cuda,gpu -max_num_threads=1024 -model=unknown -thread_warp_size=32", [-1, 16, 64, 49152, 2147483647, 1024, 8, 32], "", 0, []], [[], [["FU", 1, [0, 1, 2, 3]], ["SP", 1, 0, 401408, [32], 1], ["AN", 1, 0, 5], ["AN", 1, 1, 6]]]], "r": [[1.18589e-05, 1.18685e-05, 1.18669e-05], 0, 4.61922, 1668018163], "v": "v0.6"}
{"i": [["[\"window_reverse\", 1, 56, 56, 128, 7, \"float16\"]", "cuda -keys=cuda,gpu -max_num_threads=1024 -model=unknown -thread_warp_size=32", [-1, 16, 64, 49152, 2147483647, 1024, 8, 32], "", 0, []], [[], [["FU", 1, [0, 1, 2, 3]], ["SP", 1, 0, 401408, [28], 1], ["AN", 1, 0, 5], ["AN", 1, 1, 6]]]], "r": [[1.33045e-05, 1.33152e-05, 1.3313e-05], 0, 4.25792, 1668018163], "v": "v0.6"}
{"i": [["[\"window_reverse\", 1, 56, 56, 128, 7, \"float16\"]", "cuda -keys=cuda,gpu -max_num_threads=1024 -model=unknown -thread_warp_size=32", [-1, 16, 64, 49152, 2147483647, 1024, 8, 32], "", 0, []], [[], [["FU", 1, [0, 1, 2, 3]], ["SP", 1, 0, 401408, [16], 1], ["AN", 1, 0, 5], ["AN", 1, 1, 6]]]], "r": [[2.13142e-05, 2.13184e-05, 2.13174e-05], 0, 3.89062, 1668018162], "v": "v0.6"}
{"i": [["[\"window_reverse\", 1, 56, 56, 128, 7, \"float16\"]", "cuda -keys=cuda,gpu -max_num_threads=1024 -model=unknown -thread_warp_size=32", [-1, 16, 64, 49152, 2147483647, 1024, 8, 32], "", 0, []], [[], [["FU", 1, [0, 1, 2, 3]], ["SP", 1, 0, 401408, [64], 1], ["AN", 1, 0, 5], ["AN", 1, 1, 6]]]], "r": [[7.10767e-06, 7.12334e-06, 7.11889e-06], 0, 0.573978, 1668018290], "v": "v0.6"}
{"i": [["[\"window_reverse\", 1, 56, 56, 128, 7, \"float16\"]", "cuda -keys=cuda,gpu -max_num_threads=1024 -model=unknown -thread_warp_size=32", [-1, 16, 64, 49152, 2147483647, 1024, 8, 32], "", 0, []], [[], [["FU", 1, [0, 1, 2, 3]], ["SP", 1, 0, 401408, [8], 1], ["AN", 1, 0, 5], ["AN", 1, 1, 6]]]], "r": [[3.98928e-05, 3.98988e-05, 3.98952e-05], 0, 0.879096, 1668018290], "v": "v0.6"}
{"i": [["[\"window_reverse\", 1, 56, 56, 128, 7, \"float16\"]", "cuda -keys=cuda,gpu -max_num_threads=1024 -model=unknown -thread_warp_size=32", [-1, 16, 64, 49152, 2147483647, 1024, 8, 32], "", 0, []], [[], [["FU", 1, [0, 1, 2, 3]], ["SP", 1, 0, 401408, [7], 1], ["AN", 1, 0, 5], ["AN", 1, 1, 6]]]], "r": [[4.51506e-05, 4.51651e-05, 4.51614e-05], 0, 1.58113, 1668018291], "v": "v0.6"}
{"i": [["[\"window_reverse\", 1, 56, 56, 128, 7, \"float16\"]", "cuda -keys=cuda,gpu -max_num_threads=1024 -model=unknown -thread_warp_size=32", [-1, 16, 64, 49152, 2147483647, 1024, 8, 32], "", 0, []], [[], [["FU", 1, [0, 1, 2, 3]], ["SP", 1, 0, 401408, [1], 1], ["AN", 1, 0, 5], ["AN", 1, 1, 6]]]], "r": [[0.000300283, 0.000300185, 0.000300232], 0, 1.24394, 1668018290], "v": "v0.6"}
{"i": [["[\"window_reverse\", 1, 56, 56, 128, 7, \"float16\"]", "cuda -keys=cuda,gpu -max_num_threads=1024 -model=unknown -thread_warp_size=32", [-1, 16, 64, 49152, 2147483647, 1024, 8, 32], "", 0, []], [[], [["FU", 1, [0, 1, 2, 3]], ["SP", 1, 0, 401408, [16], 1], ["AN", 1, 0, 5], ["AN", 1, 1, 6]]]], "r": [[2.12887e-05, 2.12946e-05, 2.13053e-05], 0, 2.29382, 1668018292], "v": "v0.6"}
{"i": [["[\"window_reverse\", 1, 56, 56, 128, 7, \"float16\"]", "cuda -keys=cuda,gpu -max_num_threads=1024 -model=unknown -thread_warp_size=32", [-1, 16, 64, 49152, 2147483647, 1024, 8, 32], "", 0, []], [[], [["FU", 1, [0, 1, 2, 3]], ["SP", 1, 0, 401408, [2], 1], ["AN", 1, 0, 5], ["AN", 1, 1, 6]]]], "r": [[0.000151282, 0.000151298, 0.000151284], 0, 1.91663, 1668018291], "v": "v0.6"}
{"i": [["[\"window_reverse\", 1, 56, 56, 128, 7, \"float16\"]", "cuda -keys=cuda,gpu -max_num_threads=1024 -model=unknown -thread_warp_size=32", [-1, 16, 64, 49152, 2147483647, 1024, 8, 32], "", 0, []], [[], [["FU", 1, [0, 1, 2, 3]], ["SP", 1, 0, 401408, [28], 1], ["AN", 1, 0, 5], ["AN", 1, 1, 6]]]], "r": [[1.34169e-05, 1.34167e-05, 1.34267e-05], 0, 2.95735, 1668018292], "v": "v0.6"}
{"i": [["[\"window_reverse\", 1, 56, 56, 128, 7, \"float16\"]", "cuda -keys=cuda,gpu -max_num_threads=1024 -model=unknown -thread_warp_size=32", [-1, 16, 64, 49152, 2147483647, 1024, 8, 32], "", 0, []], [[], [["FU", 1, [0, 1, 2, 3]], ["SP", 1, 0, 401408, [49], 1], ["AN", 1, 0, 5], ["AN", 1, 1, 6]]]], "r": [[8.80033e-06, 8.80781e-06, 8.80309e-06], 0, 2.62087, 1668018292], "v": "v0.6"}
{"i": [["[\"window_reverse\", 1, 56, 56, 128, 7, \"float16\"]", "cuda -keys=cuda,gpu -max_num_threads=1024 -model=unknown -thread_warp_size=32", [-1, 16, 64, 49152, 2147483647, 1024, 8, 32], "", 0, []], [[], [["FU", 1, [0, 1, 2, 3]], ["SP", 1, 0, 401408, [14], 1], ["AN", 1, 0, 5], ["AN", 1, 1, 6]]]], "r": [[2.37447e-05, 2.37428e-05, 2.37428e-05], 0, 3.31745, 1668018293], "v": "v0.6"}
{"i": [["[\"window_reverse\", 1, 56, 56, 128, 7, \"float16\"]", "cuda -keys=cuda,gpu -max_num_threads=1024 -model=unknown -thread_warp_size=32", [-1, 16, 64, 49152, 2147483647, 1024, 8, 32], "", 0, []], [[], [["FU", 1, [0, 1, 2, 3]], ["SP", 1, 0, 401408, [4], 1], ["AN", 1, 0, 5], ["AN", 1, 1, 6]]]], "r": [[7.69218e-05, 7.695e-05, 7.69558e-05], 0, 3.64327, 1668018293], "v": "v0.6"}
{"i": [["[\"window_reverse\", 1, 56, 56, 128, 7, \"float16\"]", "cuda -keys=cuda,gpu -max_num_threads=1024 -model=unknown -thread_warp_size=32", [-1, 16, 64, 49152, 2147483647, 1024, 8, 32], "", 0, []], [[], [["FU", 1, [0, 1, 2, 3]], ["SP", 1, 0, 401408, [32], 1], ["AN", 1, 0, 5], ["AN", 1, 1, 6]]]], "r": [[1.19235e-05, 1.19203e-05, 1.19274e-05], 0, 3.97756, 1668018293], "v": "v0.6"}
{"i": [["[\"window_reverse\", 1, 56, 56, 128, 7, \"float16\"]", "cuda -keys=cuda,gpu -max_num_threads=1024 -model=unknown -thread_warp_size=32", [-1, 16, 64, 49152, 2147483647, 1024, 8, 32], "", 0, []], [[], [["FU", 1, [0, 1, 2, 3]], ["SP", 1, 0, 401408, [56], 1], ["AN", 1, 0, 5], ["AN", 1, 1, 6]]]], "r": [[7.91226e-06, 7.92511e-06, 7.923e-06], 0, 4.35882, 1668018294], "v": "v0.6"}
{"i": [["[\"window_reverse\", 1, 56, 56, 128, 7, \"float16\"]", "cuda -keys=cuda,gpu -max_num_threads=1024 -model=unknown -thread_warp_size=32", [-1, 16, 64, 49152, 2147483647, 1024, 8, 32], "", 0, []], [[], [["FU", 1, [0, 1, 2, 3]], ["SP", 1, 0, 401408, [28], 1], ["AN", 1, 0, 5], ["AN", 1, 1, 6]]]], "r": [[1.31862e-05, 1.31913e-05, 1.31955e-05], 0, 1.27936, 1668046989], "v": "v0.6"}
{"i": [["[\"window_reverse\", 1, 56, 56, 128, 7, \"float16\"]", "cuda -keys=cuda,gpu -max_num_threads=1024 -model=unknown -thread_warp_size=32", [-1, 16, 64, 49152, 2147483647, 1024, 8, 32], "", 0, []], [[], [["FU", 1, [0, 1, 2, 3]], ["SP", 1, 0, 401408, [49], 1], ["AN", 1, 0, 5], ["AN", 1, 1, 6]]]], "r": [[8.59874e-06, 8.61278e-06, 8.6101e-06], 0, 2.00569, 1668046990], "v": "v0.6"}
{"i": [["[\"window_reverse\", 1, 56, 56, 128, 7, \"float16\"]", "cuda -keys=cuda,gpu -max_num_threads=1024 -model=unknown -thread_warp_size=32", [-1, 16, 64, 49152, 2147483647, 1024, 8, 32], "", 0, []], [[], [["FU", 1, [0, 1, 2, 3]], ["SP", 1, 0, 401408, [2], 1], ["AN", 1, 0, 5], ["AN", 1, 1, 6]]]], "r": [[0.000151317, 0.000151335, 0.000151353], 0, 1.65702, 1668046989], "v": "v0.6"}
{"i": [["[\"window_reverse\", 1, 56, 56, 128, 7, \"float16\"]", "cuda -keys=cuda,gpu -max_num_threads=1024 -model=unknown -thread_warp_size=32", [-1, 16, 64, 49152, 2147483647, 1024, 8, 32], "", 0, []], [[], [["FU", 1, [0, 1, 2, 3]], ["SP", 1, 0, 401408, [14], 1], ["AN", 1, 0, 5], ["AN", 1, 1, 6]]]], "r": [[2.38428e-05, 2.38599e-05, 2.38555e-05], 0, 0.59575, 1668046988], "v": "v0.6"}
{"i": [["[\"window_reverse\", 1, 56, 56, 128, 7, \"float16\"]", "cuda -keys=cuda,gpu -max_num_threads=1024 -model=unknown -thread_warp_size=32", [-1, 16, 64, 49152, 2147483647, 1024, 8, 32], "", 0, []], [[], [["FU", 1, [0, 1, 2, 3]], ["SP", 1, 0, 401408, [64], 1], ["AN", 1, 0, 5], ["AN", 1, 1, 6]]]], "r": [[7.11002e-06, 7.11858e-06, 7.12235e-06], 0, 0.934201, 1668046989], "v": "v0.6"}
{"i": [["[\"window_reverse\", 1, 56, 56, 128, 7, \"float16\"]", "cuda -keys=cuda,gpu -max_num_threads=1024 -model=unknown -thread_warp_size=32", [-1, 16, 64, 49152, 2147483647, 1024, 8, 32], "", 0, []], [[], [["FU", 1, [0, 1, 2, 3]], ["SP", 1, 0, 401408, [8], 1], ["AN", 1, 0, 5], ["AN", 1, 1, 6]]]], "r": [[3.97055e-05, 3.97173e-05, 3.97231e-05], 0, 2.74375, 1668046991], "v": "v0.6"}
{"i": [["[\"window_reverse\", 1, 56, 56, 128, 7, \"float16\"]", "cuda -keys=cuda,gpu -max_num_threads=1024 -model=unknown -thread_warp_size=32", [-1, 16, 64, 49152, 2147483647, 1024, 8, 32], "", 0, []], [[], [["FU", 1, [0, 1, 2, 3]], ["SP", 1, 0, 401408, [1], 1], ["AN", 1, 0, 5], ["AN", 1, 1, 6]]]], "r": [[0.000300181, 0.00030018, 0.000300204], 0, 2.34237, 1668046990], "v": "v0.6"}
{"i": [["[\"window_reverse\", 1, 56, 56, 128, 7, \"float16\"]", "cuda -keys=cuda,gpu -max_num_threads=1024 -model=unknown -thread_warp_size=32", [-1, 16, 64, 49152, 2147483647, 1024, 8, 32], "", 0, []], [[], [["FU", 1, [0, 1, 2, 3]], ["SP", 1, 0, 401408, [32], 1], ["AN", 1, 0, 5], ["AN", 1, 1, 6]]]], "r": [[1.18474e-05, 1.18576e-05, 1.18533e-05], 0, 3.07935, 1668046991], "v": "v0.6"}
{"i": [["[\"window_reverse\", 1, 56, 56, 128, 7, \"float16\"]", "cuda -keys=cuda,gpu -max_num_threads=1024 -model=unknown -thread_warp_size=32", [-1, 16, 64, 49152, 2147483647, 1024, 8, 32], "", 0, []], [[], [["FU", 1, [0, 1, 2, 3]], ["SP", 1, 0, 401408, [4], 1], ["AN", 1, 0, 5], ["AN", 1, 1, 6]]]], "r": [[7.70213e-05, 7.70461e-05, 7.7036e-05], 0, 3.41824, 1668046991], "v": "v0.6"}
{"i": [["[\"window_reverse\", 1, 56, 56, 128, 7, \"float16\"]", "cuda -keys=cuda,gpu -max_num_threads=1024 -model=unknown -thread_warp_size=32", [-1, 16, 64, 49152, 2147483647, 1024, 8, 32], "", 0, []], [[], [["FU", 1, [0, 1, 2, 3]], ["SP", 1, 0, 401408, [7], 1], ["AN", 1, 0, 5], ["AN", 1, 1, 6]]]], "r": [[4.50545e-05, 4.5066e-05, 4.507e-05], 0, 3.79115, 1668046992], "v": "v0.6"}
{"i": [["[\"window_reverse\", 1, 56, 56, 128, 7, \"float16\"]", "cuda -keys=cuda,gpu -max_num_threads=1024 -model=unknown -thread_warp_size=32", [-1, 16, 64, 49152, 2147483647, 1024, 8, 32], "", 0, []], [[], [["FU", 1, [0, 1, 2, 3]], ["SP", 1, 0, 401408, [16], 1], ["AN", 1, 0, 5], ["AN", 1, 1, 6]]]], "r": [[2.12147e-05, 2.12287e-05, 2.12306e-05], 0, 4.13674, 1668046992], "v": "v0.6"}
{"i": [["[\"window_reverse\", 1, 56, 56, 128, 7, \"float16\"]", "cuda -keys=cuda,gpu -max_num_threads=1024 -model=unknown -thread_warp_size=32", [-1, 16, 64, 49152, 2147483647, 1024, 8, 32], "", 0, []], [[], [["FU", 1, [0, 1, 2, 3]], ["SP", 1, 0, 401408, [56], 1], ["AN", 1, 0, 5], ["AN", 1, 1, 6]]]], "r": [[7.82813e-06, 7.84694e-06, 7.84096e-06], 0, 4.47914, 1668046992], "v": "v0.6"}
{"i": [["[\"window_reverse\", 1, 56, 56, 128, 7, \"float16\"]", "cuda -keys=cuda,gpu -max_num_threads=1024 -model=unknown -thread_warp_size=32", [-1, 16, 64, 49152, 2147483647, 1024, 8, 32], "", 0, []], [[], [["FU", 1, [0, 1, 2, 3]], ["SP", 1, 0, 401408, [8], 1], ["AN", 1, 0, 5], ["AN", 1, 1, 6]]]], "r": [[3.98285e-05, 3.98498e-05, 3.98361e-05], 0, 2.39034, 1668048458], "v": "v0.6"}
{"i": [["[\"window_reverse\", 1, 56, 56, 128, 7, \"float16\"]", "cuda -keys=cuda,gpu -max_num_threads=1024 -model=unknown -thread_warp_size=32", [-1, 16, 64, 49152, 2147483647, 1024, 8, 32], "", 0, []], [[], [["FU", 1, [0, 1, 2, 3]], ["SP", 1, 0, 401408, [1], 1], ["AN", 1, 0, 5], ["AN", 1, 1, 6]]]], "r": [[0.000300076, 0.000300076, 0.000300075], 0, 0.948882, 1668048457], "v": "v0.6"}
{"i": [["[\"window_reverse\", 1, 56, 56, 128, 7, \"float16\"]", "cuda -keys=cuda,gpu -max_num_threads=1024 -model=unknown -thread_warp_size=32", [-1, 16, 64, 49152, 2147483647, 1024, 8, 32], "", 0, []], [[], [["FU", 1, [0, 1, 2, 3]], ["SP", 1, 0, 401408, [4], 1], ["AN", 1, 0, 5], ["AN", 1, 1, 6]]]], "r": [[7.6977e-05, 7.69912e-05, 7.70162e-05], 0, 1.28285, 1668048457], "v": "v0.6"}
{"i": [["[\"window_reverse\", 1, 56, 56, 128, 7, \"float16\"]", "cuda -keys=cuda,gpu -max_num_threads=1024 -model=unknown -thread_warp_size=32", [-1, 16, 64, 49152, 2147483647, 1024, 8, 32], "", 0, []], [[], [["FU", 1, [0, 1, 2, 3]], ["SP", 1, 0, 401408, [16], 1], ["AN", 1, 0, 5], ["AN", 1, 1, 6]]]], "r": [[2.11875e-05, 2.12149e-05, 2.12099e-05], 0, 1.67763, 1668048458], "v": "v0.6"}
{"i": [["[\"window_reverse\", 1, 56, 56, 128, 7, \"float16\"]", "cuda -keys=cuda,gpu -max_num_threads=1024 -model=unknown -thread_warp_size=32", [-1, 16, 64, 49152, 2147483647, 1024, 8, 32], "", 0, []], [[], [["FU", 1, [0, 1, 2, 3]], ["SP", 1, 0, 401408, [49], 1], ["AN", 1, 0, 5], ["AN", 1, 1, 6]]]], "r": [[8.5336e-06, 8.5471e-06, 8.54201e-06], 0, 0.600259, 1668048457], "v": "v0.6"}
{"i": [["[\"window_reverse\", 1, 56, 56, 128, 7, \"float16\"]", "cuda -keys=cuda,gpu -max_num_threads=1024 -model=unknown -thread_warp_size=32", [-1, 16, 64, 49152, 2147483647, 1024, 8, 32], "", 0, []], [[], [["FU", 1, [0, 1, 2, 3]], ["SP", 1, 0, 401408, [32], 1], ["AN", 1, 0, 5], ["AN", 1, 1, 6]]]], "r": [[1.20711e-05, 1.20725e-05, 1.20719e-05], 0, 3.12332, 1668048459], "v": "v0.6"}
{"i": [["[\"window_reverse\", 1, 56, 56, 128, 7, \"float16\"]", "cuda -keys=cuda,gpu -max_num_threads=1024 -model=unknown -thread_warp_size=32", [-1, 16, 64, 49152, 2147483647, 1024, 8, 32], "", 0, []], [[], [["FU", 1, [0, 1, 2, 3]], ["SP", 1, 0, 401408, [56], 1], ["AN", 1, 0, 5], ["AN", 1, 1, 6]]]], "r": [[7.88188e-06, 7.89489e-06, 7.86715e-06], 0, 2.78243, 1668048459], "v": "v0.6"}
{"i": [["[\"window_reverse\", 1, 56, 56, 128, 7, \"float16\"]", "cuda -keys=cuda,gpu -max_num_threads=1024 -model=unknown -thread_warp_size=32", [-1, 16, 64, 49152, 2147483647, 1024, 8, 32], "", 0, []], [[], [["FU", 1, [0, 1, 2, 3]], ["SP", 1, 0, 401408, [7], 1], ["AN", 1, 0, 5], ["AN", 1, 1, 6]]]], "r": [[4.5045e-05, 4.50585e-05, 4.50427e-05], 0, 2.03411, 1668048458], "v": "v0.6"}
{"i": [["[\"window_reverse\", 1, 56, 56, 128, 7, \"float16\"]", "cuda -keys=cuda,gpu -max_num_threads=1024 -model=unknown -thread_warp_size=32", [-1, 16, 64, 49152, 2147483647, 1024, 8, 32], "", 0, []], [[], [["FU", 1, [0, 1, 2, 3]], ["SP", 1, 0, 401408, [14], 1], ["AN", 1, 0, 5], ["AN", 1, 1, 6]]]], "r": [[2.37985e-05, 2.3837e-05, 2.38333e-05], 0, 4.5578, 1668048461], "v": "v0.6"}
{"i": [["[\"window_reverse\", 1, 56, 56, 128, 7, \"float16\"]", "cuda -keys=cuda,gpu -max_num_threads=1024 -model=unknown -thread_warp_size=32", [-1, 16, 64, 49152, 2147483647, 1024, 8, 32], "", 0, []], [[], [["FU", 1, [0, 1, 2, 3]], ["SP", 1, 0, 401408, [28], 1], ["AN", 1, 0, 5], ["AN", 1, 1, 6]]]], "r": [[1.32651e-05, 1.32769e-05, 1.3268e-05], 0, 3.45104, 1668048460], "v": "v0.6"}
{"i": [["[\"window_reverse\", 1, 56, 56, 128, 7, \"float16\"]", "cuda -keys=cuda,gpu -max_num_threads=1024 -model=unknown -thread_warp_size=32", [-1, 16, 64, 49152, 2147483647, 1024, 8, 32], "", 0, []], [[], [["FU", 1, [0, 1, 2, 3]], ["SP", 1, 0, 401408, [2], 1], ["AN", 1, 0, 5], ["AN", 1, 1, 6]]]], "r": [[0.000151205, 0.000151222, 0.000151239], 0, 4.21314, 1668048460], "v": "v0.6"}
{"i": [["[\"window_reverse\", 1, 56, 56, 128, 7, \"float16\"]", "cuda -keys=cuda,gpu -max_num_threads=1024 -model=unknown -thread_warp_size=32", [-1, 16, 64, 49152, 2147483647, 1024, 8, 32], "", 0, []], [[], [["FU", 1, [0, 1, 2, 3]], ["SP", 1, 0, 401408, [64], 1], ["AN", 1, 0, 5], ["AN", 1, 1, 6]]]], "r": [[7.17464e-06, 7.19426e-06, 7.15064e-06], 0, 3.85348, 1668048460], "v": "v0.6"}
