python/models/swin_transformer/kernel_configs/swin_transform_auto_tvm_tune_fused_reshape_permute_matmul_tensorcore_1_8_8_32_1024.log
{"input": ["cuda -keys=cuda,gpu -max_num_threads=1024 -thread_warp_size=32", "fused_reshape_permute_matmul_tensorcore.cuda", [["TENSOR", [64, 32, 32], "float16"], ["TENSOR", [1024, 1024], "float16"]], {}], "config": {"index": 11203, "code_hash": null, "entity": [["block_row_warps", "ot", 2], ["block_col_warps", "ot", 4], ["warp_row_tiles", "ot", 4], ["warp_col_tiles", "ot", 1], ["chunk", "ot", 4], ["offset", "ot", 0], ["offsetCS", "ot", 8], ["vec", "ot", 1], ["wmma_m", "ot", 8]]}, "result": [[0.000390180795, 4.401035913312694e-05], 0, 1.2118234634399414, 1697195315.47901], "version": 0.2, "tvm_version": "0.8.0"}
{"input": ["cuda -keys=cuda,gpu -max_num_threads=1024 -thread_warp_size=32", "fused_reshape_permute_matmul_tensorcore.cuda", [["TENSOR", [64, 32, 32], "float16"], ["TENSOR", [1024, 1024], "float16"]], {}], "config": {"index": 11855, "code_hash": null, "entity": [["block_row_warps", "ot", 4], ["block_col_warps", "ot", 1], ["warp_row_tiles", "ot", 1], ["warp_col_tiles", "ot", 2], ["chunk", "ot", 4], ["offset", "ot", 0], ["offsetCS", "ot", 0], ["vec", "ot", 2], ["wmma_m", "ot", 8]]}, "result": [[0.00028034776, 3.733843034055728e-05], 0, 1.1506156921386719, 1697195316.0067353], "version": 0.2, "tvm_version": "0.8.0"}
{"input": ["cuda -keys=cuda,gpu -max_num_threads=1024 -thread_warp_size=32", "fused_reshape_permute_matmul_tensorcore.cuda", [["TENSOR", [64, 32, 32], "float16"], ["TENSOR", [1024, 1024], "float16"]], {}], "config": {"index": 14373, "code_hash": null, "entity": [["block_row_warps", "ot", 1], ["block_col_warps", "ot", 1], ["warp_row_tiles", "ot", 2], ["warp_col_tiles", "ot", 2], ["chunk", "ot", 2], ["offset", "ot", 0], ["offsetCS", "ot", 0], ["vec", "ot", 8], ["wmma_m", "ot", 8]]}, "result": [[0.00030497153, 4.2704699690402476e-05], 0, 1.239783763885498, 1697195316.4975502], "version": 0.2, "tvm_version": "0.8.0"}
{"input": ["cuda -keys=cuda,gpu -max_num_threads=1024 -thread_warp_size=32", "fused_reshape_permute_matmul_tensorcore.cuda", [["TENSOR", [64, 32, 32], "float16"], ["TENSOR", [1024, 1024], "float16"]], {}], "config": {"index": 7677, "code_hash": null, "entity": [["block_row_warps", "ot", 1], ["block_col_warps", "ot", 1], ["warp_row_tiles", "ot", 2], ["warp_col_tiles", "ot", 4], ["chunk", "ot", 4], ["offset", "ot", 8], ["offsetCS", "ot", 8], ["vec", "ot", 2], ["wmma_m", "ot", 16]]}, "result": [[0.000416153055, 2.3782726840855105e-05], 0, 1.2726261615753174, 1697195317.0008733], "version": 0.2, "tvm_version": "0.8.0"}
{"input": ["cuda -keys=cuda,gpu -max_num_threads=1024 -thread_warp_size=32", "fused_reshape_permute_matmul_tensorcore.cuda", [["TENSOR", [64, 32, 32], "float16"], ["TENSOR", [1024, 1024], "float16"]], {}], "config": {"index": 2817, "code_hash": null, "entity": [["block_row_warps", "ot", 1], ["block_col_warps", "ot", 1], ["warp_row_tiles", "ot", 2], ["warp_col_tiles", "ot", 4], ["chunk", "ot", 4], ["offset", "ot", 0], ["offsetCS", "ot", 0], ["vec", "ot", 4], ["wmma_m", "ot", 32]]}, "result": [[0.00042406084999999994, 5.444128e-05], 0, 1.2814011573791504, 1697195317.5438726], "version": 0.2, "tvm_version": "0.8.0"}
{"input": ["cuda -keys=cuda,gpu -max_num_threads=1024 -thread_warp_size=32", "fused_reshape_permute_matmul_tensorcore.cuda", [["TENSOR", [64, 32, 32], "float16"], ["TENSOR", [1024, 1024], "float16"]], {}], "config": {"index": 9127, "code_hash": null, "entity": [["block_row_warps", "ot", 2], ["block_col_warps", "ot", 1], ["warp_row_tiles", "ot", 1], ["warp_col_tiles", "ot", 4], ["chunk", "ot", 1], ["offset", "ot", 0], ["offsetCS", "ot", 0], ["vec", "ot", 8], ["wmma_m", "ot", 16]]}, "result": [[0.00028540996499999997, 5.9533189999999994e-05], 0, 1.047651767730713, 1697195318.018258], "version": 0.2, "tvm_version": "0.8.0"}
{"input": ["cuda -keys=cuda,gpu -max_num_threads=1024 -thread_warp_size=32", "fused_reshape_permute_matmul_tensorcore.cuda", [["TENSOR", [64, 32, 32], "float16"], ["TENSOR", [1024, 1024], "float16"]], {}], "config": {"index": 14912, "code_hash": null, "entity": [["block_row_warps", "ot", 4], ["block_col_warps", "ot", 4], ["warp_row_tiles", "ot", 1], ["warp_col_tiles", "ot", 1], ["chunk", "ot", 1], ["offset", "ot", 0], ["offsetCS", "ot", 8], ["vec", "ot", 8], ["wmma_m", "ot", 8]]}, "result": [[0.000267209905, 6.126447000000001e-05], 0, 1.191765308380127, 1697195318.4888043], "version": 0.2, "tvm_version": "0.8.0"}
{"input": ["cuda -keys=cuda,gpu -max_num_threads=1024 -thread_warp_size=32", "fused_reshape_permute_matmul_tensorcore.cuda", [["TENSOR", [64, 32, 32], "float16"], ["TENSOR", [1024, 1024], "float16"]], {}], "config": {"index": 9682, "code_hash": null, "entity": [["block_row_warps", "ot", 2], ["block_col_warps", "ot", 4], ["warp_row_tiles", "ot", 2], ["warp_col_tiles", "ot", 2], ["chunk", "ot", 8], ["offset", "ot", 8], ["offsetCS", "ot", 0], ["vec", "ot", 8], ["wmma_m", "ot", 16]]}, "result": [[0.00037408938499999995, 1.2820047619047619e-05], 0, 1.1338317394256592, 1697195319.038337], "version": 0.2, "tvm_version": "0.8.0"}
{"input": ["cuda -keys=cuda,gpu -max_num_threads=1024 -thread_warp_size=32", "fused_reshape_permute_matmul_tensorcore.cuda", [["TENSOR", [64, 32, 32], "float16"], ["TENSOR", [1024, 1024], "float16"]], {}], "config": {"index": 9976, "code_hash": null, "entity": [["block_row_warps", "ot", 2], ["block_col_warps", "ot", 2], ["warp_row_tiles", "ot", 2], ["warp_col_tiles", "ot", 1], ["chunk", "ot", 8], ["offset", "ot", 0], ["offsetCS", "ot", 8], ["vec", "ot", 8], ["wmma_m", "ot", 16]]}, "result": [[0.000319881525, 2.4959052369077305e-05], 0, 1.1726555824279785, 1697195319.5323794], "version": 0.2, "tvm_version": "0.8.0"}
{"input": ["cuda -keys=cuda,gpu -max_num_threads=1024 -thread_warp_size=32", "fused_reshape_permute_matmul_tensorcore.cuda", [["TENSOR", [64, 32, 32], "float16"], ["TENSOR", [1024, 1024], "float16"]], {}], "config": {"index": 14680, "code_hash": null, "entity": [["block_row_warps", "ot", 2], ["block_col_warps", "ot", 1], ["warp_row_tiles", "ot", 4], ["warp_col_tiles", "ot", 1], ["chunk", "ot", 2], ["offset", "ot", 8], ["offsetCS", "ot", 0], ["vec", "ot", 8], ["wmma_m", "ot", 8]]}, "result": [[0.00032518210000000007, 1.9763723320158103e-05], 0, 1.0200257301330566, 1697195320.016167], "version": 0.2, "tvm_version": "0.8.0"}
{"input": ["cuda -keys=cuda,gpu -max_num_threads=1024 -thread_warp_size=32", "fused_reshape_permute_matmul_tensorcore.cuda", [["TENSOR", [64, 32, 32], "float16"], ["TENSOR", [1024, 1024], "float16"]], {}], "config": {"index": 4590, "code_hash": null, "entity": [["block_row_warps", "ot", 1], ["block_col_warps", "ot", 1], ["warp_row_tiles", "ot", 1], ["warp_col_tiles", "ot", 4], ["chunk", "ot", 1], ["offset", "ot", 0], ["offsetCS", "ot", 8], ["vec", "ot", 8], ["wmma_m", "ot", 32]]}, "result": [[0.00027993163500000004, 5.5855804999999995e-05], 0, 0.9821248054504395, 1697195320.5349965], "version": 0.2, "tvm_version": "0.8.0"}
{"input": ["cuda -keys=cuda,gpu -max_num_threads=1024 -thread_warp_size=32", "fused_reshape_permute_matmul_tensorcore.cuda", [["TENSOR", [64, 32, 32], "float16"], ["TENSOR", [1024, 1024], "float16"]], {}], "config": {"index": 11777, "code_hash": null, "entity": [["block_row_warps", "ot", 4], ["block_col_warps", "ot", 2], ["warp_row_tiles", "ot", 1], ["warp_col_tiles", "ot", 2], ["chunk", "ot", 2], ["offset", "ot", 0], ["offsetCS", "ot", 0], ["vec", "ot", 2], ["wmma_m", "ot", 8]]}, "result": [[0.00024491700000000004, 3.4202625386996904e-05], 0, 1.0302870273590088, 1697195321.0085137], "version": 0.2, "tvm_version": "0.8.0"}
{"input": ["cuda -keys=cuda,gpu -max_num_threads=1024 -thread_warp_size=32", "fused_reshape_permute_matmul_tensorcore.cuda", [["TENSOR", [64, 32, 32], "float16"], ["TENSOR", [1024, 1024], "float16"]], {}], "config": {"index": 14824, "code_hash": null, "entity": [["block_row_warps", "ot", 2], ["block_col_warps", "ot", 1], ["warp_row_tiles", "ot", 1], ["warp_col_tiles", "ot", 1], ["chunk", "ot", 8], ["offset", "ot", 8], ["offsetCS", "ot", 0], ["vec", "ot", 8], ["wmma_m", "ot", 8]]}, "result": [[0.00026763594, 9.504783480825958e-06], 0, 1.031123161315918, 1697195321.4950151], "version": 0.2, "tvm_version": "0.8.0"}
{"input": ["cuda -keys=cuda,gpu -max_num_threads=1024 -thread_warp_size=32", "fused_reshape_permute_matmul_tensorcore.cuda", [["TENSOR", [64, 32, 32], "float16"], ["TENSOR", [1024, 1024], "float16"]], {}], "config": {"index": 1749, "code_hash": null, "entity": [["block_row_warps", "ot", 1], ["block_col_warps", "ot", 2], ["warp_row_tiles", "ot", 4], ["warp_col_tiles", "ot", 2], ["chunk", "ot", 2], ["offset", "ot", 8], ["offsetCS", "ot", 0], ["vec", "ot", 2], ["wmma_m", "ot", 32]]}, "result": [[0.000269598815, 2.56741641025641e-05], 0, 1.1934082508087158, 1697195322.0166922], "version": 0.2, "tvm_version": "0.8.0"}
{"input": ["cuda -keys=cuda,gpu -max_num_threads=1024 -thread_warp_size=32", "fused_reshape_permute_matmul_tensorcore.cuda", [["TENSOR", [64, 32, 32], "float16"], ["TENSOR", [1024, 1024], "float16"]], {}], "config": {"index": 10479, "code_hash": null, "entity": [["block_row_warps", "ot", 1], ["block_col_warps", "ot", 2], ["warp_row_tiles", "ot", 1], ["warp_col_tiles", "ot", 2], ["chunk", "ot", 2], ["offset", "ot", 0], ["offsetCS", "ot", 0], ["vec", "ot", 1], ["wmma_m", "ot", 8]]}, "result": [[0.00031467475, 4.820217956656347e-05], 0, 1.0357625484466553, 1697195322.5126686], "version": 0.2, "tvm_version": "0.8.0"}
{"input": ["cuda -keys=cuda,gpu -max_num_threads=1024 -thread_warp_size=32", "fused_reshape_permute_matmul_tensorcore.cuda", [["TENSOR", [64, 32, 32], "float16"], ["TENSOR", [1024, 1024], "float16"]], {}], "config": {"index": 8439, "code_hash": null, "entity": [["block_row_warps", "ot", 1], ["block_col_warps", "ot", 4], ["warp_row_tiles", "ot", 2], ["warp_col_tiles", "ot", 1], ["chunk", "ot", 1], ["offset", "ot", 0], ["offsetCS", "ot", 8], ["vec", "ot", 4], ["wmma_m", "ot", 16]]}, "result": [[0.00025743422500000004, 2.4483552567237164e-05], 0, 0.969841480255127, 1697195322.9828024], "version": 0.2, "tvm_version": "0.8.0"}
{"input": ["cuda -keys=cuda,gpu -max_num_threads=1024 -thread_warp_size=32", "fused_reshape_permute_matmul_tensorcore.cuda", [["TENSOR", [64, 32, 32], "float16"], ["TENSOR", [1024, 1024], "float16"]], {}], "config": {"index": 2218, "code_hash": null, "entity": [["block_row_warps", "ot", 2], ["block_col_warps", "ot", 2], ["warp_row_tiles", "ot", 1], ["warp_col_tiles", "ot", 2], ["chunk", "ot", 8], ["offset", "ot", 0], ["offsetCS", "ot", 8], ["vec", "ot", 2], ["wmma_m", "ot", 32]]}, "result": [[0.000337104825, 2.614304438642298e-05], 0, 1.0420827865600586, 1697195323.5131102], "version": 0.2, "tvm_version": "0.8.0"}
{"input": ["cuda -keys=cuda,gpu -max_num_threads=1024 -thread_warp_size=32", "fused_reshape_permute_matmul_tensorcore.cuda", [["TENSOR", [64, 32, 32], "float16"], ["TENSOR", [1024, 1024], "float16"]], {}], "config": {"index": 7332, "code_hash": null, "entity": [["block_row_warps", "ot", 1], ["block_col_warps", "ot", 4], ["warp_row_tiles", "ot", 2], ["warp_col_tiles", "ot", 2], ["chunk", "ot", 4], ["offset", "ot", 0], ["offsetCS", "ot", 8], ["vec", "ot", 2], ["wmma_m", "ot", 16]]}, "result": [[0.000326133905, 3.813126315789473e-05], 0, 1.0180232524871826, 1697195324.0030792], "version": 0.2, "tvm_version": "0.8.0"}
{"input": ["cuda -keys=cuda,gpu -max_num_threads=1024 -thread_warp_size=32", "fused_reshape_permute_matmul_tensorcore.cuda", [["TENSOR", [64, 32, 32], "float16"], ["TENSOR", [1024, 1024], "float16"]], {}], "config": {"index": 13565, "code_hash": null, "entity": [["block_row_warps", "ot", 4], ["block_col_warps", "ot", 1], ["warp_row_tiles", "ot", 2], ["warp_col_tiles", "ot", 2], ["chunk", "ot", 8], ["offset", "ot", 8], ["offsetCS", "ot", 0], ["vec", "ot", 4], ["wmma_m", "ot", 8]]}, "result": [[0.00041075232000000004, 1.3120485760781124e-05], 0, 1.0074687004089355, 1697195324.5191908], "version": 0.2, "tvm_version": "0.8.0"}
{"input": ["cuda -keys=cuda,gpu -max_num_threads=1024 -thread_warp_size=32", "fused_reshape_permute_matmul_tensorcore.cuda", [["TENSOR", [64, 32, 32], "float16"], ["TENSOR", [1024, 1024], "float16"]], {}], "config": {"index": 7083, "code_hash": null, "entity": [["block_row_warps", "ot", 1], ["block_col_warps", "ot", 1], ["warp_row_tiles", "ot", 2], ["warp_col_tiles", "ot", 2], ["chunk", "ot", 8], ["offset", "ot", 8], ["offsetCS", "ot", 0], ["vec", "ot", 2], ["wmma_m", "ot", 16]]}, "result": [[0.000435092155, 1.5030151769087523e-05], 0, 1.216280460357666, 1697195325.0833232], "version": 0.2, "tvm_version": "0.8.0"}
{"input": ["cuda -keys=cuda,gpu -max_num_threads=1024 -thread_warp_size=32", "fused_reshape_permute_matmul_tensorcore.cuda", [["TENSOR", [64, 32, 32], "float16"], ["TENSOR", [1024, 1024], "float16"]], {}], "config": {"index": 8532, "code_hash": null, "entity": [["block_row_warps", "ot", 1], ["block_col_warps", "ot", 1], ["warp_row_tiles", "ot", 1], ["warp_col_tiles", "ot", 2], ["chunk", "ot", 2], ["offset", "ot", 0], ["offsetCS", "ot", 8], ["vec", "ot", 4], ["wmma_m", "ot", 16]]}, "result": [[0.000268905885, 2.9386310850439884e-05], 0, 1.0192677974700928, 1697195325.5584238], "version": 0.2, "tvm_version": "0.8.0"}
{"input": ["cuda -keys=cuda,gpu -max_num_threads=1024 -thread_warp_size=32", "fused_reshape_permute_matmul_tensorcore.cuda", [["TENSOR", [64, 32, 32], "float16"], ["TENSOR", [1024, 1024], "float16"]], {}], "config": {"index": 6893, "code_hash": null, "entity": [["block_row_warps", "ot", 4], ["block_col_warps", "ot", 4], ["warp_row_tiles", "ot", 1], ["warp_col_tiles", "ot", 1], ["chunk", "ot", 2], ["offset", "ot", 8], ["offsetCS", "ot", 0], ["vec", "ot", 2], ["wmma_m", "ot", 16]]}, "result": [[0.00022558609, 1.7946195338512768e-05], 0, 1.1561942100524902, 1697195326.044202], "version": 0.2, "tvm_version": "0.8.0"}
{"input": ["cuda -keys=cuda,gpu -max_num_threads=1024 -thread_warp_size=32", "fused_reshape_permute_matmul_tensorcore.cuda", [["TENSOR", [64, 32, 32], "float16"], ["TENSOR", [1024, 1024], "float16"]], {}], "config": {"index": 3780, "code_hash": null, "entity": [["block_row_warps", "ot", 1], ["block_col_warps", "ot", 1], ["warp_row_tiles", "ot", 1], ["warp_col_tiles", "ot", 4], ["chunk", "ot", 4], ["offset", "ot", 8], ["offsetCS", "ot", 8], ["vec", "ot", 4], ["wmma_m", "ot", 32]]}, "result": [[0.000305546725, 1.6421936927772126e-05], 0, 1.1837661266326904, 1697195326.5859811], "version": 0.2, "tvm_version": "0.8.0"}
{"input": ["cuda -keys=cuda,gpu -max_num_threads=1024 -thread_warp_size=32", "fused_reshape_permute_matmul_tensorcore.cuda", [["TENSOR", [64, 32, 32], "float16"], ["TENSOR", [1024, 1024], "float16"]], {}], "config": {"index": 7294, "code_hash": null, "entity": [["block_row_warps", "ot", 2], ["block_col_warps", "ot", 2], ["warp_row_tiles", "ot", 1], ["warp_col_tiles", "ot", 1], ["chunk", "ot", 4], ["offset", "ot", 0], ["offsetCS", "ot", 8], ["vec", "ot", 2], ["wmma_m", "ot", 16]]}, "result": [[0.00023286004999999998, 2.338635747663551e-05], 0, 1.0384409427642822, 1697195327.0606303], "version": 0.2, "tvm_version": "0.8.0"}
{"input": ["cuda -keys=cuda,gpu -max_num_threads=1024 -thread_warp_size=32", "fused_reshape_permute_matmul_tensorcore.cuda", [["TENSOR", [64, 32, 32], "float16"], ["TENSOR", [1024, 1024], "float16"]], {}], "config": {"index": 6304, "code_hash": null, "entity": [["block_row_warps", "ot", 2], ["block_col_warps", "ot", 2], ["warp_row_tiles", "ot", 2], ["warp_col_tiles", "ot", 4], ["chunk", "ot", 2], ["offset", "ot", 8], ["offsetCS", "ot", 8], ["vec", "ot", 1], ["wmma_m", "ot", 16]]}, "result": [[0.0003702523999999999, 4.323911764705882e-05], 0, 1.038193702697754, 1697195327.5636601], "version": 0.2, "tvm_version": "0.8.0"}
{"input": ["cuda -keys=cuda,gpu -max_num_threads=1024 -thread_warp_size=32", "fused_reshape_permute_matmul_tensorcore.cuda", [["TENSOR", [64, 32, 32], "float16"], ["TENSOR", [1024, 1024], "float16"]], {}], "config": {"index": 6198, "code_hash": null, "entity": [["block_row_warps", "ot", 1], ["block_col_warps", "ot", 4], ["warp_row_tiles", "ot", 2], ["warp_col_tiles", "ot", 2], ["chunk", "ot", 1], ["offset", "ot", 8], ["offsetCS", "ot", 8], ["vec", "ot", 1], ["wmma_m", "ot", 16]]}, "result": [[0.00026053362, 4.244837770897833e-05], 0, 0.9980611801147461, 1697195328.087502], "version": 0.2, "tvm_version": "0.8.0"}
{"input": ["cuda -keys=cuda,gpu -max_num_threads=1024 -thread_warp_size=32", "fused_reshape_permute_matmul_tensorcore.cuda", [["TENSOR", [64, 32, 32], "float16"], ["TENSOR", [1024, 1024], "float16"]], {}], "config": {"index": 15411, "code_hash": null, "entity": [["block_row_warps", "ot", 1], ["block_col_warps", "ot", 2], ["warp_row_tiles", "ot", 4], ["warp_col_tiles", "ot", 1], ["chunk", "ot", 4], ["offset", "ot", 8], ["offsetCS", "ot", 8], ["vec", "ot", 8], ["wmma_m", "ot", 8]]}, "result": [[0.00031003158, 1.4720835004557885e-05], 0, 1.0611903667449951, 1697195328.585107], "version": 0.2, "tvm_version": "0.8.0"}
{"input": ["cuda -keys=cuda,gpu -max_num_threads=1024 -thread_warp_size=32", "fused_reshape_permute_matmul_tensorcore.cuda", [["TENSOR", [64, 32, 32], "float16"], ["TENSOR", [1024, 1024], "float16"]], {}], "config": {"index": 7785, "code_hash": null, "entity": [["block_row_warps", "ot", 1], ["block_col_warps", "ot", 1], ["warp_row_tiles", "ot", 2], ["warp_col_tiles", "ot", 1], ["chunk", "ot", 1], ["offset", "ot", 0], ["offsetCS", "ot", 0], ["vec", "ot", 4], ["wmma_m", "ot", 16]]}, "result": [[0.000256277845, 2.4557808510638297e-05], 0, 0.9600892066955566, 1697195329.07509], "version": 0.2, "tvm_version": "0.8.0"}
{"input": ["cuda -keys=cuda,gpu -max_num_threads=1024 -thread_warp_size=32", "fused_reshape_permute_matmul_tensorcore.cuda", [["TENSOR", [64, 32, 32], "float16"], ["TENSOR", [1024, 1024], "float16"]], {}], "config": {"index": 8590, "code_hash": null, "entity": [["block_row_warps", "ot", 2], ["block_col_warps", "ot", 2], ["warp_row_tiles", "ot", 1], ["warp_col_tiles", "ot", 1], ["chunk", "ot", 4], ["offset", "ot", 0], ["offsetCS", "ot", 8], ["vec", "ot", 4], ["wmma_m", "ot", 16]]}, "result": [[0.00026326269, 2.114363424947146e-05], 0, 1.051189661026001, 1697195329.592377], "version": 0.2, "tvm_version": "0.8.0"}
{"input": ["cuda -keys=cuda,gpu -max_num_threads=1024 -thread_warp_size=32", "fused_reshape_permute_matmul_tensorcore.cuda", [["TENSOR", [64, 32, 32], "float16"], ["TENSOR", [1024, 1024], "float16"]], {}], "config": {"index": 14014, "code_hash": null, "entity": [["block_row_warps", "ot", 2], ["block_col_warps", "ot", 1], ["warp_row_tiles", "ot", 1], ["warp_col_tiles", "ot", 1], ["chunk", "ot", 2], ["offset", "ot", 8], ["offsetCS", "ot", 8], ["vec", "ot", 4], ["wmma_m", "ot", 8]]}, "result": [[0.000277337145, 1.4718918721461187e-05], 0, 0.8287186622619629, 1697195330.8715003], "version": 0.2, "tvm_version": "0.8.0"}
{"input": ["cuda -keys=cuda,gpu -max_num_threads=1024 -thread_warp_size=32", "fused_reshape_permute_matmul_tensorcore.cuda", [["TENSOR", [64, 32, 32], "float16"], ["TENSOR", [1024, 1024], "float16"]], {}], "config": {"index": 14059, "code_hash": null, "entity": [["block_row_warps", "ot", 2], ["block_col_warps", "ot", 1], ["warp_row_tiles", "ot", 4], ["warp_col_tiles", "ot", 2], ["chunk", "ot", 2], ["offset", "ot", 8], ["offsetCS", "ot", 8], ["vec", "ot", 4], ["wmma_m", "ot", 8]]}, "result": [[0.00032804007499999995, 2.975439779005525e-05], 0, 0.8578128814697266, 1697195331.378677], "version": 0.2, "tvm_version": "0.8.0"}
{"input": ["cuda -keys=cuda,gpu -max_num_threads=1024 -thread_warp_size=32", "fused_reshape_permute_matmul_tensorcore.cuda", [["TENSOR", [64, 32, 32], "float16"], ["TENSOR", [1024, 1024], "float16"]], {}], "config": {"index": 14323, "code_hash": null, "entity": [["block_row_warps", "ot", 2], ["block_col_warps", "ot", 2], ["warp_row_tiles", "ot", 2], ["warp_col_tiles", "ot", 4], ["chunk", "ot", 1], ["offset", "ot", 0], ["offsetCS", "ot", 0], ["vec", "ot", 8], ["wmma_m", "ot", 8]]}, "result": [[0.000345089305, 6.7508555e-05], 0, 0.9542455673217773, 1697195331.9124422], "version": 0.2, "tvm_version": "0.8.0"}
{"input": ["cuda -keys=cuda,gpu -max_num_threads=1024 -thread_warp_size=32", "fused_reshape_permute_matmul_tensorcore.cuda", [["TENSOR", [64, 32, 32], "float16"], ["TENSOR", [1024, 1024], "float16"]], {}], "config": {"index": 4644, "code_hash": null, "entity": [["block_row_warps", "ot", 1], ["block_col_warps", "ot", 1], ["warp_row_tiles", "ot", 1], ["warp_col_tiles", "ot", 2], ["chunk", "ot", 2], ["offset", "ot", 0], ["offsetCS", "ot", 8], ["vec", "ot", 8], ["wmma_m", "ot", 32]]}, "result": [[0.000308079535, 2.0880189979123175e-05], 0, 0.9034252166748047, 1697195332.395773], "version": 0.2, "tvm_version": "0.8.0"}
{"input": ["cuda -keys=cuda,gpu -max_num_threads=1024 -thread_warp_size=32", "fused_reshape_permute_matmul_tensorcore.cuda", [["TENSOR", [64, 32, 32], "float16"], ["TENSOR", [1024, 1024], "float16"]], {}], "config": {"index": 6720, "code_hash": null, "entity": [["block_row_warps", "ot", 1], ["block_col_warps", "ot", 4], ["warp_row_tiles", "ot", 4], ["warp_col_tiles", "ot", 4], ["chunk", "ot", 4], ["offset", "ot", 0], ["offsetCS", "ot", 0], ["vec", "ot", 2], ["wmma_m", "ot", 16]]}, "result": [[0.0006360959249999999, 7.072113e-05], 0, 1.0376694202423096, 1697195332.9443338], "version": 0.2, "tvm_version": "0.8.0"}
{"input": ["cuda -keys=cuda,gpu -max_num_threads=1024 -thread_warp_size=32", "fused_reshape_permute_matmul_tensorcore.cuda", [["TENSOR", [64, 32, 32], "float16"], ["TENSOR", [1024, 1024], "float16"]], {}], "config": {"index": 12555, "code_hash": null, "entity": [["block_row_warps", "ot", 1], ["block_col_warps", "ot", 1], ["warp_row_tiles", "ot", 1], ["warp_col_tiles", "ot", 1], ["chunk", "ot", 8], ["offset", "ot", 0], ["offsetCS", "ot", 8], ["vec", "ot", 2], ["wmma_m", "ot", 8]]}, "result": [[0.00031736717500000005, 2.4395319512195126e-05], 0, 0.9863615036010742, 1697195333.4766529], "version": 0.2, "tvm_version": "0.8.0"}
{"input": ["cuda -keys=cuda,gpu -max_num_threads=1024 -thread_warp_size=32", "fused_reshape_permute_matmul_tensorcore.cuda", [["TENSOR", [64, 32, 32], "float16"], ["TENSOR", [1024, 1024], "float16"]], {}], "config": {"index": 7311, "code_hash": null, "entity": [["block_row_warps", "ot", 1], ["block_col_warps", "ot", 2], ["warp_row_tiles", "ot", 4], ["warp_col_tiles", "ot", 1], ["chunk", "ot", 4], ["offset", "ot", 0], ["offsetCS", "ot", 8], ["vec", "ot", 2], ["wmma_m", "ot", 16]]}, "result": [[0.00032745923500000003, 4.172910835913313e-05], 0, 0.9311103820800781, 1697195333.971923], "version": 0.2, "tvm_version": "0.8.0"}
{"input": ["cuda -keys=cuda,gpu -max_num_threads=1024 -thread_warp_size=32", "fused_reshape_permute_matmul_tensorcore.cuda", [["TENSOR", [64, 32, 32], "float16"], ["TENSOR", [1024, 1024], "float16"]], {}], "config": {"index": 1299, "code_hash": null, "entity": [["block_row_warps", "ot", 1], ["block_col_warps", "ot", 2], ["warp_row_tiles", "ot", 1], ["warp_col_tiles", "ot", 1], ["chunk", "ot", 1], ["offset", "ot", 0], ["offsetCS", "ot", 0], ["vec", "ot", 2], ["wmma_m", "ot", 32]]}, "result": [[0.00023110589, 2.1471751072961374e-05], 0, 0.887169599533081, 1697195334.4486578], "version": 0.2, "tvm_version": "0.8.0"}
{"input": ["cuda -keys=cuda,gpu -max_num_threads=1024 -thread_warp_size=32", "fused_reshape_permute_matmul_tensorcore.cuda", [["TENSOR", [64, 32, 32], "float16"], ["TENSOR", [1024, 1024], "float16"]], {}], "config": {"index": 9641, "code_hash": null, "entity": [["block_row_warps", "ot", 4], ["block_col_warps", "ot", 1], ["warp_row_tiles", "ot", 1], ["warp_col_tiles", "ot", 1], ["chunk", "ot", 8], ["offset", "ot", 8], ["offsetCS", "ot", 0], ["vec", "ot", 8], ["wmma_m", "ot", 16]]}, "result": [[0.000246312675, 9.685025210084035e-06], 0, 1.071713924407959, 1697195334.9750147], "version": 0.2, "tvm_version": "0.8.0"}
{"input": ["cuda -keys=cuda,gpu -max_num_threads=1024 -thread_warp_size=32", "fused_reshape_permute_matmul_tensorcore.cuda", [["TENSOR", [64, 32, 32], "float16"], ["TENSOR", [1024, 1024], "float16"]], {}], "config": {"index": 6322, "code_hash": null, "entity": [["block_row_warps", "ot", 2], ["block_col_warps", "ot", 2], ["warp_row_tiles", "ot", 1], ["warp_col_tiles", "ot", 1], ["chunk", "ot", 4], ["offset", "ot", 8], ["offsetCS", "ot", 8], ["vec", "ot", 1], ["wmma_m", "ot", 16]]}, "result": [[0.00023621656500000002, 1.7119434782608692e-05], 0, 0.9155702590942383, 1697195335.4579988], "version": 0.2, "tvm_version": "0.8.0"}
{"input": ["cuda -keys=cuda,gpu -max_num_threads=1024 -thread_warp_size=32", "fused_reshape_permute_matmul_tensorcore.cuda", [["TENSOR", [64, 32, 32], "float16"], ["TENSOR", [1024, 1024], "float16"]], {}], "config": {"index": 11277, "code_hash": null, "entity": [["block_row_warps", "ot", 1], ["block_col_warps", "ot", 1], ["warp_row_tiles", "ot", 4], ["warp_col_tiles", "ot", 1], ["chunk", "ot", 8], ["offset", "ot", 0], ["offsetCS", "ot", 8], ["vec", "ot", 1], ["wmma_m", "ot", 8]]}, "result": [[0.000569407585, 4.083278328173374e-05], 0, 1.1112799644470215, 1697195335.999742], "version": 0.2, "tvm_version": "0.8.0"}
{"input": ["cuda -keys=cuda,gpu -max_num_threads=1024 -thread_warp_size=32", "fused_reshape_permute_matmul_tensorcore.cuda", [["TENSOR", [64, 32, 32], "float16"], ["TENSOR", [1024, 1024], "float16"]], {}], "config": {"index": 6758, "code_hash": null, "entity": [["block_row_warps", "ot", 4], ["block_col_warps", "ot", 4], ["warp_row_tiles", "ot", 1], ["warp_col_tiles", "ot", 2], ["chunk", "ot", 8], ["offset", "ot", 0], ["offsetCS", "ot", 0], ["vec", "ot", 2], ["wmma_m", "ot", 16]]}, "result": [[0.000350310025, 2.657071217105263e-05], 0, 1.0691254138946533, 1697195336.5592587], "version": 0.2, "tvm_version": "0.8.0"}
{"input": ["cuda -keys=cuda,gpu -max_num_threads=1024 -thread_warp_size=32", "fused_reshape_permute_matmul_tensorcore.cuda", [["TENSOR", [64, 32, 32], "float16"], ["TENSOR", [1024, 1024], "float16"]], {}], "config": {"index": 10642, "code_hash": null, "entity": [["block_row_warps", "ot", 2], ["block_col_warps", "ot", 2], ["warp_row_tiles", "ot", 1], ["warp_col_tiles", "ot", 2], ["chunk", "ot", 8], ["offset", "ot", 0], ["offsetCS", "ot", 0], ["vec", "ot", 1], ["wmma_m", "ot", 8]]}, "result": [[0.00046697038, 4.196985758513932e-05], 0, 0.9853291511535645, 1697195337.0808952], "version": 0.2, "tvm_version": "0.8.0"}
{"input": ["cuda -keys=cuda,gpu -max_num_threads=1024 -thread_warp_size=32", "fused_reshape_permute_matmul_tensorcore.cuda", [["TENSOR", [64, 32, 32], "float16"], ["TENSOR", [1024, 1024], "float16"]], {}], "config": {"index": 2145, "code_hash": null, "entity": [["block_row_warps", "ot", 1], ["block_col_warps", "ot", 2], ["warp_row_tiles", "ot", 2], ["warp_col_tiles", "ot", 2], ["chunk", "ot", 4], ["offset", "ot", 0], ["offsetCS", "ot", 8], ["vec", "ot", 2], ["wmma_m", "ot", 32]]}, "result": [[0.00033020228999999996, 4.129834365325078e-05], 0, 0.897470235824585, 1697195337.5761702], "version": 0.2, "tvm_version": "0.8.0"}
{"input": ["cuda -keys=cuda,gpu -max_num_threads=1024 -thread_warp_size=32", "fused_reshape_permute_matmul_tensorcore.cuda", [["TENSOR", [64, 32, 32], "float16"], ["TENSOR", [1024, 1024], "float16"]], {}], "config": {"index": 3255, "code_hash": null, "entity": [["block_row_warps", "ot", 1], ["block_col_warps", "ot", 4], ["warp_row_tiles", "ot", 2], ["warp_col_tiles", "ot", 1], ["chunk", "ot", 1], ["offset", "ot", 0], ["offsetCS", "ot", 8], ["vec", "ot", 4], ["wmma_m", "ot", 32]]}, "result": [[0.00026042102, 2.1190008474576267e-05], 0, 0.9846770763397217, 1697195338.0954866], "version": 0.2, "tvm_version": "0.8.0"}
{"input": ["cuda -keys=cuda,gpu -max_num_threads=1024 -thread_warp_size=32", "fused_reshape_permute_matmul_tensorcore.cuda", [["TENSOR", [64, 32, 32], "float16"], ["TENSOR", [1024, 1024], "float16"]], {}], "config": {"index": 13527, "code_hash": null, "entity": [["block_row_warps", "ot", 1], ["block_col_warps", "ot", 1], ["warp_row_tiles", "ot", 1], ["warp_col_tiles", "ot", 1], ["chunk", "ot", 8], ["offset", "ot", 8], ["offsetCS", "ot", 0], ["vec", "ot", 4], ["wmma_m", "ot", 8]]}, "result": [[0.000278981255, 1.2062758982035927e-05], 0, 0.9716825485229492, 1697195338.5861635], "version": 0.2, "tvm_version": "0.8.0"}
{"input": ["cuda -keys=cuda,gpu -max_num_threads=1024 -thread_warp_size=32", "fused_reshape_permute_matmul_tensorcore.cuda", [["TENSOR", [64, 32, 32], "float16"], ["TENSOR", [1024, 1024], "float16"]], {}], "config": {"index": 1017, "code_hash": null, "entity": [["block_row_warps", "ot", 1], ["block_col_warps", "ot", 1], ["warp_row_tiles", "ot", 4], ["warp_col_tiles", "ot", 2], ["chunk", "ot", 1], ["offset", "ot", 8], ["offsetCS", "ot", 8], ["vec", "ot", 1], ["wmma_m", "ot", 32]]}, "result": [[0.00025824231999999997, 3.903507120743034e-05], 0, 0.8867833614349365, 1697195339.0720894], "version": 0.2, "tvm_version": "0.8.0"}
{"input": ["cuda -keys=cuda,gpu -max_num_threads=1024 -thread_warp_size=32", "fused_reshape_permute_matmul_tensorcore.cuda", [["TENSOR", [64, 32, 32], "float16"], ["TENSOR", [1024, 1024], "float16"]], {}], "config": {"index": 10389, "code_hash": null, "entity": [["block_row_warps", "ot", 1], ["block_col_warps", "ot", 2], ["warp_row_tiles", "ot", 4], ["warp_col_tiles", "ot", 1], ["chunk", "ot", 1], ["offset", "ot", 0], ["offsetCS", "ot", 0], ["vec", "ot", 1], ["wmma_m", "ot", 8]]}, "result": [[0.000275713245, 4.3909699690402476e-05], 0, 0.9129962921142578, 1697195339.6024718], "version": 0.2, "tvm_version": "0.8.0"}
{"input": ["cuda -keys=cuda,gpu -max_num_threads=1024 -thread_warp_size=32", "fused_reshape_permute_matmul_tensorcore.cuda", [["TENSOR", [64, 32, 32], "float16"], ["TENSOR", [1024, 1024], "float16"]], {}], "config": {"index": 5856, "code_hash": null, "entity": [["block_row_warps", "ot", 1], ["block_col_warps", "ot", 4], ["warp_row_tiles", "ot", 4], ["warp_col_tiles", "ot", 1], ["chunk", "ot", 1], ["offset", "ot", 0], ["offsetCS", "ot", 8], ["vec", "ot", 1], ["wmma_m", "ot", 16]]}, "result": [[0.000284824425, 6.281775e-05], 0, 0.871143102645874, 1697195340.0779529], "version": 0.2, "tvm_version": "0.8.0"}
{"input": ["cuda -keys=cuda,gpu -max_num_threads=1024 -thread_warp_size=32", "fused_reshape_permute_matmul_tensorcore.cuda", [["TENSOR", [64, 32, 32], "float16"], ["TENSOR", [1024, 1024], "float16"]], {}], "config": {"index": 3480, "code_hash": null, "entity": [["block_row_warps", "ot", 1], ["block_col_warps", "ot", 4], ["warp_row_tiles", "ot", 4], ["warp_col_tiles", "ot", 4], ["chunk", "ot", 4], ["offset", "ot", 0], ["offsetCS", "ot", 8], ["vec", "ot", 4], ["wmma_m", "ot", 32]]}, "result": [[0.00043734828499999995, 5.2823039999999995e-05], 0, 1.0167791843414307, 1697195340.5880516], "version": 0.2, "tvm_version": "0.8.0"}
{"input": ["cuda -keys=cuda,gpu -max_num_threads=1024 -thread_warp_size=32", "fused_reshape_permute_matmul_tensorcore.cuda", [["TENSOR", [64, 32, 32], "float16"], ["TENSOR", [1024, 1024], "float16"]], {}], "config": {"index": 3814, "code_hash": null, "entity": [["block_row_warps", "ot", 2], ["block_col_warps", "ot", 4], ["warp_row_tiles", "ot", 1], ["warp_col_tiles", "ot", 1], ["chunk", "ot", 8], ["offset", "ot", 8], ["offsetCS", "ot", 8], ["vec", "ot", 4], ["wmma_m", "ot", 32]]}, "result": [[0.000262300625, 1.033774406670943e-05], 0, 0.9570341110229492, 1697195341.116589], "version": 0.2, "tvm_version": "0.8.0"}
{"input": ["cuda -keys=cuda,gpu -max_num_threads=1024 -thread_warp_size=32", "fused_reshape_permute_matmul_tensorcore.cuda", [["TENSOR", [64, 32, 32], "float16"], ["TENSOR", [1024, 1024], "float16"]], {}], "config": {"index": 12115, "code_hash": null, "entity": [["block_row_warps", "ot", 2], ["block_col_warps", "ot", 1], ["warp_row_tiles", "ot", 4], ["warp_col_tiles", "ot", 2], ["chunk", "ot", 2], ["offset", "ot", 8], ["offsetCS", "ot", 0], ["vec", "ot", 2], ["wmma_m", "ot", 8]]}, "result": [[0.00034022275, 2.942908823529412e-05], 0, 0.9687936305999756, 1697195341.6066198], "version": 0.2, "tvm_version": "0.8.0"}
{"input": ["cuda -keys=cuda,gpu -max_num_threads=1024 -thread_warp_size=32", "fused_reshape_permute_matmul_tensorcore.cuda", [["TENSOR", [64, 32, 32], "float16"], ["TENSOR", [1024, 1024], "float16"]], {}], "config": {"index": 7155, "code_hash": null, "entity": [["block_row_warps", "ot", 1], ["block_col_warps", "ot", 1], ["warp_row_tiles", "ot", 1], ["warp_col_tiles", "ot", 2], ["chunk", "ot", 1], ["offset", "ot", 0], ["offsetCS", "ot", 8], ["vec", "ot", 2], ["wmma_m", "ot", 16]]}, "result": [[0.00023831156, 2.859435142857143e-05], 0, 0.914121150970459, 1697195342.0754066], "version": 0.2, "tvm_version": "0.8.0"}
{"input": ["cuda -keys=cuda,gpu -max_num_threads=1024 -thread_warp_size=32", "fused_reshape_permute_matmul_tensorcore.cuda", [["TENSOR", [64, 32, 32], "float16"], ["TENSOR", [1024, 1024], "float16"]], {}], "config": {"index": 7084, "code_hash": null, "entity": [["block_row_warps", "ot", 2], ["block_col_warps", "ot", 1], ["warp_row_tiles", "ot", 2], ["warp_col_tiles", "ot", 2], ["chunk", "ot", 8], ["offset", "ot", 8], ["offsetCS", "ot", 0], ["vec", "ot", 2], ["wmma_m", "ot", 16]]}, "result": [[0.00040467723499999997, 1.3151947882736156e-05], 0, 1.1327722072601318, 1697195342.6334956], "version": 0.2, "tvm_version": "0.8.0"}
{"input": ["cuda -keys=cuda,gpu -max_num_threads=1024 -thread_warp_size=32", "fused_reshape_permute_matmul_tensorcore.cuda", [["TENSOR", [64, 32, 32], "float16"], ["TENSOR", [1024, 1024], "float16"]], {}], "config": {"index": 3924, "code_hash": null, "entity": [["block_row_warps", "ot", 1], ["block_col_warps", "ot", 1], ["warp_row_tiles", "ot", 2], ["warp_col_tiles", "ot", 2], ["chunk", "ot", 1], ["offset", "ot", 0], ["offsetCS", "ot", 0], ["vec", "ot", 8], ["wmma_m", "ot", 32]]}, "result": [[0.00029745815, 2.369656598240469e-05], 0, 0.959801197052002, 1697195343.1309206], "version": 0.2, "tvm_version": "0.8.0"}
{"input": ["cuda -keys=cuda,gpu -max_num_threads=1024 -thread_warp_size=32", "fused_reshape_permute_matmul_tensorcore.cuda", [["TENSOR", [64, 32, 32], "float16"], ["TENSOR", [1024, 1024], "float16"]], {}], "config": {"index": 9336, "code_hash": null, "entity": [["block_row_warps", "ot", 1], ["block_col_warps", "ot", 2], ["warp_row_tiles", "ot", 4], ["warp_col_tiles", "ot", 1], ["chunk", "ot", 8], ["offset", "ot", 0], ["offsetCS", "ot", 0], ["vec", "ot", 8], ["wmma_m", "ot", 16]]}, "result": [[0.00041217188000000003, 3.8446869969040245e-05], 0, 1.0546751022338867, 1697195343.638946], "version": 0.2, "tvm_version": "0.8.0"}
{"input": ["cuda -keys=cuda,gpu -max_num_threads=1024 -thread_warp_size=32", "fused_reshape_permute_matmul_tensorcore.cuda", [["TENSOR", [64, 32, 32], "float16"], ["TENSOR", [1024, 1024], "float16"]], {}], "config": {"index": 6157, "code_hash": null, "entity": [["block_row_warps", "ot", 2], ["block_col_warps", "ot", 1], ["warp_row_tiles", "ot", 1], ["warp_col_tiles", "ot", 1], ["chunk", "ot", 1], ["offset", "ot", 8], ["offsetCS", "ot", 8], ["vec", "ot", 1], ["wmma_m", "ot", 16]]}, "result": [[0.00021690076999999997, 2.187805240174673e-05], 0, 0.7526271343231201, 1697195369.0528998], "version": 0.2, "tvm_version": "0.8.0"}
{"input": ["cuda -keys=cuda,gpu -max_num_threads=1024 -thread_warp_size=32", "fused_reshape_permute_matmul_tensorcore.cuda", [["TENSOR", [64, 32, 32], "float16"], ["TENSOR", [1024, 1024], "float16"]], {}], "config": {"index": 2268, "code_hash": null, "entity": [["block_row_warps", "ot", 1], ["block_col_warps", "ot", 1], ["warp_row_tiles", "ot", 1], ["warp_col_tiles", "ot", 1], ["chunk", "ot", 1], ["offset", "ot", 8], ["offsetCS", "ot", 8], ["vec", "ot", 2], ["wmma_m", "ot", 32]]}, "result": [[0.00023116477, 1.9771644268774704e-05], 0, 0.7797768115997314, 1697195369.5157292], "version": 0.2, "tvm_version": "0.8.0"}
{"input": ["cuda -keys=cuda,gpu -max_num_threads=1024 -thread_warp_size=32", "fused_reshape_permute_matmul_tensorcore.cuda", [["TENSOR", [64, 32, 32], "float16"], ["TENSOR", [1024, 1024], "float16"]], {}], "config": {"index": 6160, "code_hash": null, "entity": [["block_row_warps", "ot", 2], ["block_col_warps", "ot", 2], ["warp_row_tiles", "ot", 1], ["warp_col_tiles", "ot", 1], ["chunk", "ot", 1], ["offset", "ot", 8], ["offsetCS", "ot", 8], ["vec", "ot", 1], ["wmma_m", "ot", 16]]}, "result": [[2.171531843575419e-05, 2.170962849162011e-05], 0, 0.7648570537567139, 1697195369.9638202], "version": 0.2, "tvm_version": "0.8.0"}
{"input": ["cuda -keys=cuda,gpu -max_num_threads=1024 -thread_warp_size=32", "fused_reshape_permute_matmul_tensorcore.cuda", [["TENSOR", [64, 32, 32], "float16"], ["TENSOR", [1024, 1024], "float16"]], {}], "config": {"index": 6562, "code_hash": null, "entity": [["block_row_warps", "ot", 2], ["block_col_warps", "ot", 1], ["warp_row_tiles", "ot", 1], ["warp_col_tiles", "ot", 1], ["chunk", "ot", 2], ["offset", "ot", 0], ["offsetCS", "ot", 0], ["vec", "ot", 2], ["wmma_m", "ot", 16]]}, "result": [[0.00022431089499999997, 1.6596364948453607e-05], 0, 0.849604606628418, 1697195370.4875276], "version": 0.2, "tvm_version": "0.8.0"}
{"input": ["cuda -keys=cuda,gpu -max_num_threads=1024 -thread_warp_size=32", "fused_reshape_permute_matmul_tensorcore.cuda", [["TENSOR", [64, 32, 32], "float16"], ["TENSOR", [1024, 1024], "float16"]], {}], "config": {"index": 2349, "code_hash": null, "entity": [["block_row_warps", "ot", 1], ["block_col_warps", "ot", 1], ["warp_row_tiles", "ot", 1], ["warp_col_tiles", "ot", 1], ["chunk", "ot", 2], ["offset", "ot", 8], ["offsetCS", "ot", 8], ["vec", "ot", 2], ["wmma_m", "ot", 32]]}, "result": [[0.00022235142499999998, 1.4145710526315788e-05], 0, 0.7968437671661377, 1697195370.9641953], "version": 0.2, "tvm_version": "0.8.0"}
{"input": ["cuda -keys=cuda,gpu -max_num_threads=1024 -thread_warp_size=32", "fused_reshape_permute_matmul_tensorcore.cuda", [["TENSOR", [64, 32, 32], "float16"], ["TENSOR", [1024, 1024], "float16"]], {}], "config": {"index": 7534, "code_hash": null, "entity": [["block_row_warps", "ot", 2], ["block_col_warps", "ot", 1], ["warp_row_tiles", "ot", 1], ["warp_col_tiles", "ot", 1], ["chunk", "ot", 2], ["offset", "ot", 8], ["offsetCS", "ot", 8], ["vec", "ot", 2], ["wmma_m", "ot", 16]]}, "result": [[0.000222923615, 1.3628836993243244e-05], 0, 0.7995293140411377, 1697195371.4414184], "version": 0.2, "tvm_version": "0.8.0"}
{"input": ["cuda -keys=cuda,gpu -max_num_threads=1024 -thread_warp_size=32", "fused_reshape_permute_matmul_tensorcore.cuda", [["TENSOR", [64, 32, 32], "float16"], ["TENSOR", [1024, 1024], "float16"]], {}], "config": {"index": 6886, "code_hash": null, "entity": [["block_row_warps", "ot", 2], ["block_col_warps", "ot", 1], ["warp_row_tiles", "ot", 1], ["warp_col_tiles", "ot", 1], ["chunk", "ot", 2], ["offset", "ot", 8], ["offsetCS", "ot", 0], ["vec", "ot", 2], ["wmma_m", "ot", 16]]}, "result": [[0.000221505985, 1.3723079216354344e-05], 0, 0.85725998878479, 1697195371.9607143], "version": 0.2, "tvm_version": "0.8.0"}
{"input": ["cuda -keys=cuda,gpu -max_num_threads=1024 -thread_warp_size=32", "fused_reshape_permute_matmul_tensorcore.cuda", [["TENSOR", [64, 32, 32], "float16"], ["TENSOR", [1024, 1024], "float16"]], {}], "config": {"index": 7210, "code_hash": null, "entity": [["block_row_warps", "ot", 2], ["block_col_warps", "ot", 1], ["warp_row_tiles", "ot", 1], ["warp_col_tiles", "ot", 1], ["chunk", "ot", 2], ["offset", "ot", 0], ["offsetCS", "ot", 8], ["vec", "ot", 2], ["wmma_m", "ot", 16]]}, "result": [[0.000225952475, 1.7071564482029597e-05], 0, 0.8083682060241699, 1697195372.4408395], "version": 0.2, "tvm_version": "0.8.0"}
{"input": ["cuda -keys=cuda,gpu -max_num_threads=1024 -thread_warp_size=32", "fused_reshape_permute_matmul_tensorcore.cuda", [["TENSOR", [64, 32, 32], "float16"], ["TENSOR", [1024, 1024], "float16"]], {}], "config": {"index": 2271, "code_hash": null, "entity": [["block_row_warps", "ot", 1], ["block_col_warps", "ot", 2], ["warp_row_tiles", "ot", 1], ["warp_col_tiles", "ot", 1], ["chunk", "ot", 1], ["offset", "ot", 8], ["offsetCS", "ot", 8], ["vec", "ot", 2], ["wmma_m", "ot", 32]]}, "result": [[1.9496117572692794e-05, 1.9495945638432365e-05], 0, 0.7616729736328125, 1697195372.890098], "version": 0.2, "tvm_version": "0.8.0"}
{"input": ["cuda -keys=cuda,gpu -max_num_threads=1024 -thread_warp_size=32", "fused_reshape_permute_matmul_tensorcore.cuda", [["TENSOR", [64, 32, 32], "float16"], ["TENSOR", [1024, 1024], "float16"]], {}], "config": {"index": 5509, "code_hash": null, "entity": [["block_row_warps", "ot", 2], ["block_col_warps", "ot", 1], ["warp_row_tiles", "ot", 1], ["warp_col_tiles", "ot", 1], ["chunk", "ot", 1], ["offset", "ot", 8], ["offsetCS", "ot", 0], ["vec", "ot", 1], ["wmma_m", "ot", 16]]}, "result": [[0.00021613627, 2.170781048387097e-05], 0, 0.8311700820922852, 1697195373.409463], "version": 0.2, "tvm_version": "0.8.0"}
{"input": ["cuda -keys=cuda,gpu -max_num_threads=1024 -thread_warp_size=32", "fused_reshape_permute_matmul_tensorcore.cuda", [["TENSOR", [64, 32, 32], "float16"], ["TENSOR", [1024, 1024], "float16"]], {}], "config": {"index": 1702, "code_hash": null, "entity": [["block_row_warps", "ot", 2], ["block_col_warps", "ot", 1], ["warp_row_tiles", "ot", 1], ["warp_col_tiles", "ot", 1], ["chunk", "ot", 2], ["offset", "ot", 8], ["offsetCS", "ot", 0], ["vec", "ot", 2], ["wmma_m", "ot", 32]]}, "result": [[0.000229399065, 1.479393394495413e-05], 0, 0.8080432415008545, 1697195373.8944175], "version": 0.2, "tvm_version": "0.8.0"}
{"input": ["cuda -keys=cuda,gpu -max_num_threads=1024 -thread_warp_size=32", "fused_reshape_permute_matmul_tensorcore.cuda", [["TENSOR", [64, 32, 32], "float16"], ["TENSOR", [1024, 1024], "float16"]], {}], "config": {"index": 6565, "code_hash": null, "entity": [["block_row_warps", "ot", 2], ["block_col_warps", "ot", 2], ["warp_row_tiles", "ot", 1], ["warp_col_tiles", "ot", 1], ["chunk", "ot", 2], ["offset", "ot", 0], ["offsetCS", "ot", 0], ["vec", "ot", 2], ["wmma_m", "ot", 16]]}, "result": [[1.6448939784946236e-05, 1.644591182795699e-05], 0, 0.7624568939208984, 1697195374.348282], "version": 0.2, "tvm_version": "0.8.0"}
{"input": ["cuda -keys=cuda,gpu -max_num_threads=1024 -thread_warp_size=32", "fused_reshape_permute_matmul_tensorcore.cuda", [["TENSOR", [64, 32, 32], "float16"], ["TENSOR", [1024, 1024], "float16"]], {}], "config": {"index": 6238, "code_hash": null, "entity": [["block_row_warps", "ot", 2], ["block_col_warps", "ot", 1], ["warp_row_tiles", "ot", 1], ["warp_col_tiles", "ot", 1], ["chunk", "ot", 2], ["offset", "ot", 8], ["offsetCS", "ot", 8], ["vec", "ot", 1], ["wmma_m", "ot", 16]]}, "result": [[0.00021667435999999998, 2.564720512820513e-05], 0, 0.8435239791870117, 1697195374.8647108], "version": 0.2, "tvm_version": "0.8.0"}
{"input": ["cuda -keys=cuda,gpu -max_num_threads=1024 -thread_warp_size=32", "fused_reshape_permute_matmul_tensorcore.cuda", [["TENSOR", [64, 32, 32], "float16"], ["TENSOR", [1024, 1024], "float16"]], {}], "config": {"index": 6481, "code_hash": null, "entity": [["block_row_warps", "ot", 2], ["block_col_warps", "ot", 1], ["warp_row_tiles", "ot", 1], ["warp_col_tiles", "ot", 1], ["chunk", "ot", 1], ["offset", "ot", 0], ["offsetCS", "ot", 0], ["vec", "ot", 2], ["wmma_m", "ot", 16]]}, "result": [[0.000236581325, 1.5144261724659609e-05], 0, 0.8357152938842773, 1697195375.3294878], "version": 0.2, "tvm_version": "0.8.0"}
{"input": ["cuda -keys=cuda,gpu -max_num_threads=1024 -thread_warp_size=32", "fused_reshape_permute_matmul_tensorcore.cuda", [["TENSOR", [64, 32, 32], "float16"], ["TENSOR", [1024, 1024], "float16"]], {}], "config": {"index": 2352, "code_hash": null, "entity": [["block_row_warps", "ot", 1], ["block_col_warps", "ot", 2], ["warp_row_tiles", "ot", 1], ["warp_col_tiles", "ot", 1], ["chunk", "ot", 2], ["offset", "ot", 8], ["offsetCS", "ot", 8], ["vec", "ot", 2], ["wmma_m", "ot", 32]]}, "result": [[1.4188475256769374e-05, 1.4175529411764706e-05], 0, 0.7718033790588379, 1697195375.7769008], "version": 0.2, "tvm_version": "0.8.0"}
{"input": ["cuda -keys=cuda,gpu -max_num_threads=1024 -thread_warp_size=32", "fused_reshape_permute_matmul_tensorcore.cuda", [["TENSOR", [64, 32, 32], "float16"], ["TENSOR", [1024, 1024], "float16"]], {}], "config": {"index": 972, "code_hash": null, "entity": [["block_row_warps", "ot", 1], ["block_col_warps", "ot", 1], ["warp_row_tiles", "ot", 1], ["warp_col_tiles", "ot", 1], ["chunk", "ot", 1], ["offset", "ot", 8], ["offsetCS", "ot", 8], ["vec", "ot", 1], ["wmma_m", "ot", 32]]}, "result": [[0.00021417700499999997, 2.2020265667574934e-05], 0, 0.835299015045166, 1697195376.2957883], "version": 0.2, "tvm_version": "0.8.0"}
{"input": ["cuda -keys=cuda,gpu -max_num_threads=1024 -thread_warp_size=32", "fused_reshape_permute_matmul_tensorcore.cuda", [["TENSOR", [64, 32, 32], "float16"], ["TENSOR", [1024, 1024], "float16"]], {}], "config": {"index": 7537, "code_hash": null, "entity": [["block_row_warps", "ot", 2], ["block_col_warps", "ot", 2], ["warp_row_tiles", "ot", 1], ["warp_col_tiles", "ot", 1], ["chunk", "ot", 2], ["offset", "ot", 8], ["offsetCS", "ot", 8], ["vec", "ot", 2], ["wmma_m", "ot", 16]]}, "result": [[1.3613588499550762e-05, 1.3610383647798743e-05], 0, 0.7644760608673096, 1697195376.7424052], "version": 0.2, "tvm_version": "0.8.0"}
{"input": ["cuda -keys=cuda,gpu -max_num_threads=1024 -thread_warp_size=32", "fused_reshape_permute_matmul_tensorcore.cuda", [["TENSOR", [64, 32, 32], "float16"], ["TENSOR", [1024, 1024], "float16"]], {}], "config": {"index": 1944, "code_hash": null, "entity": [["block_row_warps", "ot", 1], ["block_col_warps", "ot", 1], ["warp_row_tiles", "ot", 1], ["warp_col_tiles", "ot", 1], ["chunk", "ot", 1], ["offset", "ot", 0], ["offsetCS", "ot", 8], ["vec", "ot", 2], ["wmma_m", "ot", 32]]}, "result": [[0.00023466982000000002, 2.1426629482071714e-05], 0, 0.8123137950897217, 1697195377.2270603], "version": 0.2, "tvm_version": "0.8.0"}
{"input": ["cuda -keys=cuda,gpu -max_num_threads=1024 -thread_warp_size=32", "fused_reshape_permute_matmul_tensorcore.cuda", [["TENSOR", [64, 32, 32], "float16"], ["TENSOR", [1024, 1024], "float16"]], {}], "config": {"index": 6889, "code_hash": null, "entity": [["block_row_warps", "ot", 2], ["block_col_warps", "ot", 2], ["warp_row_tiles", "ot", 1], ["warp_col_tiles", "ot", 1], ["chunk", "ot", 2], ["offset", "ot", 8], ["offsetCS", "ot", 0], ["vec", "ot", 2], ["wmma_m", "ot", 16]]}, "result": [[1.3773370673952641e-05, 1.376947358834244e-05], 0, 0.8134670257568359, 1697195377.7137856], "version": 0.2, "tvm_version": "0.8.0"}
{"input": ["cuda -keys=cuda,gpu -max_num_threads=1024 -thread_warp_size=32", "fused_reshape_permute_matmul_tensorcore.cuda", [["TENSOR", [64, 32, 32], "float16"], ["TENSOR", [1024, 1024], "float16"]], {}], "config": {"index": 1620, "code_hash": null, "entity": [["block_row_warps", "ot", 1], ["block_col_warps", "ot", 1], ["warp_row_tiles", "ot", 1], ["warp_col_tiles", "ot", 1], ["chunk", "ot", 1], ["offset", "ot", 8], ["offsetCS", "ot", 0], ["vec", "ot", 2], ["wmma_m", "ot", 32]]}, "result": [[0.000230971625, 1.957501212121212e-05], 0, 0.8408777713775635, 1697195378.1941142], "version": 0.2, "tvm_version": "0.8.0"}
{"input": ["cuda -keys=cuda,gpu -max_num_threads=1024 -thread_warp_size=32", "fused_reshape_permute_matmul_tensorcore.cuda", [["TENSOR", [64, 32, 32], "float16"], ["TENSOR", [1024, 1024], "float16"]], {}], "config": {"index": 42, "code_hash": null, "entity": [["block_row_warps", "ot", 1], ["block_col_warps", "ot", 4], ["warp_row_tiles", "ot", 2], ["warp_col_tiles", "ot", 2], ["chunk", "ot", 1], ["offset", "ot", 0], ["offsetCS", "ot", 0], ["vec", "ot", 1], ["wmma_m", "ot", 32]]}, "result": [[0.000253919625, 4.172033436532508e-05], 0, 1.982600450515747, 1697201371.259698], "version": 0.2, "tvm_version": "0.8.0"}
{"input": ["cuda -keys=cuda,gpu -max_num_threads=1024 -thread_warp_size=32", "fused_reshape_permute_matmul_tensorcore.cuda", [["TENSOR", [64, 32, 32], "float16"], ["TENSOR", [1024, 1024], "float16"]], {}], "config": {"index": 13295, "code_hash": null, "entity": [["block_row_warps", "ot", 4], ["block_col_warps", "ot", 1], ["warp_row_tiles", "ot", 2], ["warp_col_tiles", "ot", 1], ["chunk", "ot", 1], ["offset", "ot", 8], ["offsetCS", "ot", 0], ["vec", "ot", 4], ["wmma_m", "ot", 8]]}, "result": [[0.000263916005, 2.3449639344262294e-05], 0, 1.0637874603271484, 1697201371.778344], "version": 0.2, "tvm_version": "0.8.0"}
{"input": ["cuda -keys=cuda,gpu -max_num_threads=1024 -thread_warp_size=32", "fused_reshape_permute_matmul_tensorcore.cuda", [["TENSOR", [64, 32, 32], "float16"], ["TENSOR", [1024, 1024], "float16"]], {}], "config": {"index": 13738, "code_hash": null, "entity": [["block_row_warps", "ot", 2], ["block_col_warps", "ot", 2], ["warp_row_tiles", "ot", 4], ["warp_col_tiles", "ot", 2], ["chunk", "ot", 2], ["offset", "ot", 0], ["offsetCS", "ot", 8], ["vec", "ot", 4], ["wmma_m", "ot", 8]]}, "result": [[0.00032965455, 3.787732507739938e-05], 0, 1.2902297973632812, 1697201372.266264], "version": 0.2, "tvm_version": "0.8.0"}
{"input": ["cuda -keys=cuda,gpu -max_num_threads=1024 -thread_warp_size=32", "fused_reshape_permute_matmul_tensorcore.cuda", [["TENSOR", [64, 32, 32], "float16"], ["TENSOR", [1024, 1024], "float16"]], {}], "config": {"index": 13586, "code_hash": null, "entity": [["block_row_warps", "ot", 4], ["block_col_warps", "ot", 2], ["warp_row_tiles", "ot", 1], ["warp_col_tiles", "ot", 4], ["chunk", "ot", 8], ["offset", "ot", 8], ["offsetCS", "ot", 0], ["vec", "ot", 4], ["wmma_m", "ot", 8]]}, "result": [[0.000451415145, 1.6835646464646467e-05], 0, 1.382014274597168, 1697201372.7755592], "version": 0.2, "tvm_version": "0.8.0"}
{"input": ["cuda -keys=cuda,gpu -max_num_threads=1024 -thread_warp_size=32", "fused_reshape_permute_matmul_tensorcore.cuda", [["TENSOR", [64, 32, 32], "float16"], ["TENSOR", [1024, 1024], "float16"]], {}], "config": {"index": 4389, "code_hash": null, "entity": [["block_row_warps", "ot", 1], ["block_col_warps", "ot", 4], ["warp_row_tiles", "ot", 2], ["warp_col_tiles", "ot", 1], ["chunk", "ot", 4], ["offset", "ot", 8], ["offsetCS", "ot", 0], ["vec", "ot", 8], ["wmma_m", "ot", 32]]}, "result": [[0.00029625294, 1.2979937349397593e-05], 0, 1.2710189819335938, 1697201373.3091702], "version": 0.2, "tvm_version": "0.8.0"}
{"input": ["cuda -keys=cuda,gpu -max_num_threads=1024 -thread_warp_size=32", "fused_reshape_permute_matmul_tensorcore.cuda", [["TENSOR", [64, 32, 32], "float16"], ["TENSOR", [1024, 1024], "float16"]], {}], "config": {"index": 10839, "code_hash": null, "entity": [["block_row_warps", "ot", 1], ["block_col_warps", "ot", 2], ["warp_row_tiles", "ot", 2], ["warp_col_tiles", "ot", 4], ["chunk", "ot", 2], ["offset", "ot", 8], ["offsetCS", "ot", 0], ["vec", "ot", 1], ["wmma_m", "ot", 8]]}, "result": [[0.00047388993999999995, 6.0436645000000007e-05], 0, 1.3329832553863525, 1697201373.8183277], "version": 0.2, "tvm_version": "0.8.0"}
{"input": ["cuda -keys=cuda,gpu -max_num_threads=1024 -thread_warp_size=32", "fused_reshape_permute_matmul_tensorcore.cuda", [["TENSOR", [64, 32, 32], "float16"], ["TENSOR", [1024, 1024], "float16"]], {}], "config": {"index": 15097, "code_hash": null, "entity": [["block_row_warps", "ot", 2], ["block_col_warps", "ot", 2], ["warp_row_tiles", "ot", 1], ["warp_col_tiles", "ot", 2], ["chunk", "ot", 4], ["offset", "ot", 0], ["offsetCS", "ot", 8], ["vec", "ot", 8], ["wmma_m", "ot", 8]]}, "result": [[0.000287950795, 3.9519857585139315e-05], 0, 1.1503255367279053, 1697201374.3035402], "version": 0.2, "tvm_version": "0.8.0"}
{"input": ["cuda -keys=cuda,gpu -max_num_threads=1024 -thread_warp_size=32", "fused_reshape_permute_matmul_tensorcore.cuda", [["TENSOR", [64, 32, 32], "float16"], ["TENSOR", [1024, 1024], "float16"]], {}], "config": {"index": 5435, "code_hash": null, "entity": [["block_row_warps", "ot", 4], ["block_col_warps", "ot", 4], ["warp_row_tiles", "ot", 1], ["warp_col_tiles", "ot", 1], ["chunk", "ot", 8], ["offset", "ot", 0], ["offsetCS", "ot", 0], ["vec", "ot", 1], ["wmma_m", "ot", 16]]}, "result": [[0.00029804113, 2.3053297235023044e-05], 0, 1.3724555969238281, 1697201374.8269749], "version": 0.2, "tvm_version": "0.8.0"}
{"input": ["cuda -keys=cuda,gpu -max_num_threads=1024 -thread_warp_size=32", "fused_reshape_permute_matmul_tensorcore.cuda", [["TENSOR", [64, 32, 32], "float16"], ["TENSOR", [1024, 1024], "float16"]], {}], "config": {"index": 9024, "code_hash": null, "entity": [["block_row_warps", "ot", 1], ["block_col_warps", "ot", 4], ["warp_row_tiles", "ot", 1], ["warp_col_tiles", "ot", 2], ["chunk", "ot", 8], ["offset", "ot", 8], ["offsetCS", "ot", 8], ["vec", "ot", 4], ["wmma_m", "ot", 16]]}, "result": [[0.00030630524, 1.1829870139398387e-05], 0, 1.1914925575256348, 1697201375.3262231], "version": 0.2, "tvm_version": "0.8.0"}
{"input": ["cuda -keys=cuda,gpu -max_num_threads=1024 -thread_warp_size=32", "fused_reshape_permute_matmul_tensorcore.cuda", [["TENSOR", [64, 32, 32], "float16"], ["TENSOR", [1024, 1024], "float16"]], {}], "config": {"index": 8324, "code_hash": null, "entity": [["block_row_warps", "ot", 4], ["block_col_warps", "ot", 4], ["warp_row_tiles", "ot", 1], ["warp_col_tiles", "ot", 4], ["chunk", "ot", 4], ["offset", "ot", 8], ["offsetCS", "ot", 0], ["vec", "ot", 4], ["wmma_m", "ot", 16]]}, "result": [[0.000292623255, 1.6423547304170905e-05], 0, 1.1220548152923584, 1697201375.8165026], "version": 0.2, "tvm_version": "0.8.0"}
{"input": ["cuda -keys=cuda,gpu -max_num_threads=1024 -thread_warp_size=32", "fused_reshape_permute_matmul_tensorcore.cuda", [["TENSOR", [64, 32, 32], "float16"], ["TENSOR", [1024, 1024], "float16"]], {}], "config": {"index": 8515, "code_hash": null, "entity": [["block_row_warps", "ot", 2], ["block_col_warps", "ot", 1], ["warp_row_tiles", "ot", 2], ["warp_col_tiles", "ot", 1], ["chunk", "ot", 2], ["offset", "ot", 0], ["offsetCS", "ot", 8], ["vec", "ot", 4], ["wmma_m", "ot", 16]]}, "result": [[0.00025219638, 2.307428142857143e-05], 0, 1.0094966888427734, 1697201376.3417249], "version": 0.2, "tvm_version": "0.8.0"}
{"input": ["cuda -keys=cuda,gpu -max_num_threads=1024 -thread_warp_size=32", "fused_reshape_permute_matmul_tensorcore.cuda", [["TENSOR", [64, 32, 32], "float16"], ["TENSOR", [1024, 1024], "float16"]], {}], "config": {"index": 11049, "code_hash": null, "entity": [["block_row_warps", "ot", 1], ["block_col_warps", "ot", 4], ["warp_row_tiles", "ot", 1], ["warp_col_tiles", "ot", 2], ["chunk", "ot", 1], ["offset", "ot", 0], ["offsetCS", "ot", 8], ["vec", "ot", 1], ["wmma_m", "ot", 8]]}, "result": [[0.00032527974, 9.856909e-05], 0, 1.0398659706115723, 1697201376.8292506], "version": 0.2, "tvm_version": "0.8.0"}
{"input": ["cuda -keys=cuda,gpu -max_num_threads=1024 -thread_warp_size=32", "fused_reshape_permute_matmul_tensorcore.cuda", [["TENSOR", [64, 32, 32], "float16"], ["TENSOR", [1024, 1024], "float16"]], {}], "config": {"index": 5434, "code_hash": null, "entity": [["block_row_warps", "ot", 2], ["block_col_warps", "ot", 4], ["warp_row_tiles", "ot", 1], ["warp_col_tiles", "ot", 1], ["chunk", "ot", 8], ["offset", "ot", 0], ["offsetCS", "ot", 0], ["vec", "ot", 1], ["wmma_m", "ot", 16]]}, "result": [[0.000292929435, 2.6318590460526313e-05], 0, 1.1235389709472656, 1697201377.3213649], "version": 0.2, "tvm_version": "0.8.0"}
{"input": ["cuda -keys=cuda,gpu -max_num_threads=1024 -thread_warp_size=32", "fused_reshape_permute_matmul_tensorcore.cuda", [["TENSOR", [64, 32, 32], "float16"], ["TENSOR", [1024, 1024], "float16"]], {}], "config": {"index": 9228, "code_hash": null, "entity": [["block_row_warps", "ot", 1], ["block_col_warps", "ot", 2], ["warp_row_tiles", "ot", 4], ["warp_col_tiles", "ot", 4], ["chunk", "ot", 2], ["offset", "ot", 0], ["offsetCS", "ot", 0], ["vec", "ot", 8], ["wmma_m", "ot", 16]]}, "result": [[0.00040740845499999997, 4.937089473684211e-05], 0, 1.2481226921081543, 1697201377.8716693], "version": 0.2, "tvm_version": "0.8.0"}
{"input": ["cuda -keys=cuda,gpu -max_num_threads=1024 -thread_warp_size=32", "fused_reshape_permute_matmul_tensorcore.cuda", [["TENSOR", [64, 32, 32], "float16"], ["TENSOR", [1024, 1024], "float16"]], {}], "config": {"index": 14990, "code_hash": null, "entity": [["block_row_warps", "ot", 4], ["block_col_warps", "ot", 2], ["warp_row_tiles", "ot", 1], ["warp_col_tiles", "ot", 1], ["chunk", "ot", 2], ["offset", "ot", 0], ["offsetCS", "ot", 8], ["vec", "ot", 8], ["wmma_m", "ot", 8]]}, "result": [[0.00033784004000000006, 1.3834057560137456e-05], 0, 1.274590253829956, 1697201378.376949], "version": 0.2, "tvm_version": "0.8.0"}
{"input": ["cuda -keys=cuda,gpu -max_num_threads=1024 -thread_warp_size=32", "fused_reshape_permute_matmul_tensorcore.cuda", [["TENSOR", [64, 32, 32], "float16"], ["TENSOR", [1024, 1024], "float16"]], {}], "config": {"index": 13532, "code_hash": null, "entity": [["block_row_warps", "ot", 4], ["block_col_warps", "ot", 2], ["warp_row_tiles", "ot", 1], ["warp_col_tiles", "ot", 1], ["chunk", "ot", 8], ["offset", "ot", 8], ["offsetCS", "ot", 0], ["vec", "ot", 4], ["wmma_m", "ot", 8]]}, "result": [[0.00025838933, 9.598869125520524e-06], 0, 0.9588632583618164, 1697201378.8647268], "version": 0.2, "tvm_version": "0.8.0"}
{"input": ["cuda -keys=cuda,gpu -max_num_threads=1024 -thread_warp_size=32", "fused_reshape_permute_matmul_tensorcore.cuda", [["TENSOR", [64, 32, 32], "float16"], ["TENSOR", [1024, 1024], "float16"]], {}], "config": {"index": 6055, "code_hash": null, "entity": [["block_row_warps", "ot", 2], ["block_col_warps", "ot", 4], ["warp_row_tiles", "ot", 1], ["warp_col_tiles", "ot", 4], ["chunk", "ot", 4], ["offset", "ot", 0], ["offsetCS", "ot", 8], ["vec", "ot", 1], ["wmma_m", "ot", 16]]}, "result": [[0.000394197055, 5.378043500000001e-05], 0, 1.2651481628417969, 1697201379.4038668], "version": 0.2, "tvm_version": "0.8.0"}
{"input": ["cuda -keys=cuda,gpu -max_num_threads=1024 -thread_warp_size=32", "fused_reshape_permute_matmul_tensorcore.cuda", [["TENSOR", [64, 32, 32], "float16"], ["TENSOR", [1024, 1024], "float16"]], {}], "config": {"index": 11053, "code_hash": null, "entity": [["block_row_warps", "ot", 2], ["block_col_warps", "ot", 1], ["warp_row_tiles", "ot", 2], ["warp_col_tiles", "ot", 2], ["chunk", "ot", 1], ["offset", "ot", 0], ["offsetCS", "ot", 8], ["vec", "ot", 1], ["wmma_m", "ot", 8]]}, "result": [[0.00028485382, 5.412108e-05], 0, 0.9730072021484375, 1697201379.8815906], "version": 0.2, "tvm_version": "0.8.0"}
{"input": ["cuda -keys=cuda,gpu -max_num_threads=1024 -thread_warp_size=32", "fused_reshape_permute_matmul_tensorcore.cuda", [["TENSOR", [64, 32, 32], "float16"], ["TENSOR", [1024, 1024], "float16"]], {}], "config": {"index": 13804, "code_hash": null, "entity": [["block_row_warps", "ot", 2], ["block_col_warps", "ot", 4], ["warp_row_tiles", "ot", 1], ["warp_col_tiles", "ot", 2], ["chunk", "ot", 4], ["offset", "ot", 0], ["offsetCS", "ot", 8], ["vec", "ot", 4], ["wmma_m", "ot", 8]]}, "result": [[0.00029132294000000004, 3.8807250773993805e-05], 0, 1.1106081008911133, 1697201380.364067], "version": 0.2, "tvm_version": "0.8.0"}
{"input": ["cuda -keys=cuda,gpu -max_num_threads=1024 -thread_warp_size=32", "fused_reshape_permute_matmul_tensorcore.cuda", [["TENSOR", [64, 32, 32], "float16"], ["TENSOR", [1024, 1024], "float16"]], {}], "config": {"index": 99, "code_hash": null, "entity": [["block_row_warps", "ot", 1], ["block_col_warps", "ot", 1], ["warp_row_tiles", "ot", 4], ["warp_col_tiles", "ot", 1], ["chunk", "ot", 2], ["offset", "ot", 0], ["offsetCS", "ot", 0], ["vec", "ot", 1], ["wmma_m", "ot", 32]]}, "result": [[0.000264960445, 3.961164086687306e-05], 0, 1.0961556434631348, 1697201380.8904302], "version": 0.2, "tvm_version": "0.8.0"}
{"input": ["cuda -keys=cuda,gpu -max_num_threads=1024 -thread_warp_size=32", "fused_reshape_permute_matmul_tensorcore.cuda", [["TENSOR", [64, 32, 32], "float16"], ["TENSOR", [1024, 1024], "float16"]], {}], "config": {"index": 2919, "code_hash": null, "entity": [["block_row_warps", "ot", 1], ["block_col_warps", "ot", 2], ["warp_row_tiles", "ot", 1], ["warp_col_tiles", "ot", 1], ["chunk", "ot", 1], ["offset", "ot", 8], ["offsetCS", "ot", 0], ["vec", "ot", 4], ["wmma_m", "ot", 32]]}, "result": [[0.000262032815, 2.353474647887324e-05], 0, 0.9952692985534668, 1697201381.3588238], "version": 0.2, "tvm_version": "0.8.0"}
{"input": ["cuda -keys=cuda,gpu -max_num_threads=1024 -thread_warp_size=32", "fused_reshape_permute_matmul_tensorcore.cuda", [["TENSOR", [64, 32, 32], "float16"], ["TENSOR", [1024, 1024], "float16"]], {}], "config": {"index": 8679, "code_hash": null, "entity": [["block_row_warps", "ot", 1], ["block_col_warps", "ot", 2], ["warp_row_tiles", "ot", 2], ["warp_col_tiles", "ot", 1], ["chunk", "ot", 8], ["offset", "ot", 0], ["offsetCS", "ot", 8], ["vec", "ot", 4], ["wmma_m", "ot", 16]]}, "result": [[0.000307245795, 2.5491030534351144e-05], 0, 0.9425642490386963, 1697201381.842009], "version": 0.2, "tvm_version": "0.8.0"}
{"input": ["cuda -keys=cuda,gpu -max_num_threads=1024 -thread_warp_size=32", "fused_reshape_permute_matmul_tensorcore.cuda", [["TENSOR", [64, 32, 32], "float16"], ["TENSOR", [1024, 1024], "float16"]], {}], "config": {"index": 13699, "code_hash": null, "entity": [["block_row_warps", "ot", 2], ["block_col_warps", "ot", 1], ["warp_row_tiles", "ot", 2], ["warp_col_tiles", "ot", 1], ["chunk", "ot", 2], ["offset", "ot", 0], ["offsetCS", "ot", 8], ["vec", "ot", 4], ["wmma_m", "ot", 8]]}, "result": [[0.00026386703000000003, 2.3129421203438395e-05], 0, 1.0629403591156006, 1697201382.3729737], "version": 0.2, "tvm_version": "0.8.0"}
{"input": ["cuda -keys=cuda,gpu -max_num_threads=1024 -thread_warp_size=32", "fused_reshape_permute_matmul_tensorcore.cuda", [["TENSOR", [64, 32, 32], "float16"], ["TENSOR", [1024, 1024], "float16"]], {}], "config": {"index": 6577, "code_hash": null, "entity": [["block_row_warps", "ot", 2], ["block_col_warps", "ot", 4], ["warp_row_tiles", "ot", 2], ["warp_col_tiles", "ot", 1], ["chunk", "ot", 2], ["offset", "ot", 0], ["offsetCS", "ot", 0], ["vec", "ot", 2], ["wmma_m", "ot", 16]]}, "result": [[0.00022591014999999998, 2.665366336633663e-05], 0, 0.9428551197052002, 1697201382.8514059], "version": 0.2, "tvm_version": "0.8.0"}
{"input": ["cuda -keys=cuda,gpu -max_num_threads=1024 -thread_warp_size=32", "fused_reshape_permute_matmul_tensorcore.cuda", [["TENSOR", [64, 32, 32], "float16"], ["TENSOR", [1024, 1024], "float16"]], {}], "config": {"index": 12658, "code_hash": null, "entity": [["block_row_warps", "ot", 2], ["block_col_warps", "ot", 2], ["warp_row_tiles", "ot", 4], ["warp_col_tiles", "ot", 1], ["chunk", "ot", 1], ["offset", "ot", 8], ["offsetCS", "ot", 8], ["vec", "ot", 2], ["wmma_m", "ot", 8]]}, "result": [[0.00028308113, 2.9179411078717198e-05], 0, 0.9735443592071533, 1697201383.3321853], "version": 0.2, "tvm_version": "0.8.0"}
{"input": ["cuda -keys=cuda,gpu -max_num_threads=1024 -thread_warp_size=32", "fused_reshape_permute_matmul_tensorcore.cuda", [["TENSOR", [64, 32, 32], "float16"], ["TENSOR", [1024, 1024], "float16"]], {}], "config": {"index": 6504, "code_hash": null, "entity": [["block_row_warps", "ot", 1], ["block_col_warps", "ot", 4], ["warp_row_tiles", "ot", 4], ["warp_col_tiles", "ot", 1], ["chunk", "ot", 1], ["offset", "ot", 0], ["offsetCS", "ot", 0], ["vec", "ot", 2], ["wmma_m", "ot", 16]]}, "result": [[0.00025968424, 2.9351346041055715e-05], 0, 0.9835681915283203, 1697201383.8516712], "version": 0.2, "tvm_version": "0.8.0"}
{"input": ["cuda -keys=cuda,gpu -max_num_threads=1024 -thread_warp_size=32", "fused_reshape_permute_matmul_tensorcore.cuda", [["TENSOR", [64, 32, 32], "float16"], ["TENSOR", [1024, 1024], "float16"]], {}], "config": {"index": 11519, "code_hash": null, "entity": [["block_row_warps", "ot", 4], ["block_col_warps", "ot", 4], ["warp_row_tiles", "ot", 2], ["warp_col_tiles", "ot", 1], ["chunk", "ot", 4], ["offset", "ot", 8], ["offsetCS", "ot", 8], ["vec", "ot", 1], ["wmma_m", "ot", 8]]}, "result": [[0.00028522816, 2.199805054945055e-05], 0, 0.9950540065765381, 1697201384.3254216], "version": 0.2, "tvm_version": "0.8.0"}
