python/models/swin_transformer/kernel_configs/swin_transform_auto_tvm_tune_fused_layer_normalization_matmul_1_64_64_128.log
{"input": ["cuda -keys=cuda,gpu -max_num_threads=1024 -thread_warp_size=32", "fused_layer_norm_matmul_tensorcore.cuda", [["TENSOR", [1024, 512], "float16"], ["TENSOR", [1024], "float16"], ["TENSOR", [1024], "float16"], ["TENSOR", [256, 512], "float16"], 0.001953125], {}], "config": {"index": 6455, "code_hash": null, "entity": [["block_row_warps", "ot", 4], ["block_col_warps", "ot", 1], ["warp_row_tiles", "ot", 1], ["warp_col_tiles", "ot", 4], ["chunk", "ot", 8], ["offset", "ot", 8], ["offsetCS", "ot", 8], ["vec", "ot", 1], ["wmma_m", "ot", 16]]}, "result": [[0.00011176465], 0, 3.2979257106781006, 1651747460.1011531], "version": 0.2, "tvm_version": "0.8.0"}
{"input": ["cuda -keys=cuda,gpu -max_num_threads=1024 -thread_warp_size=32", "fused_layer_norm_matmul_tensorcore.cuda", [["TENSOR", [1024, 512], "float16"], ["TENSOR", [1024], "float16"], ["TENSOR", [1024], "float16"], ["TENSOR", [256, 512], "float16"], 0.001953125], {}], "config": {"index": 11589, "code_hash": null, "entity": [["block_row_warps", "ot", 1], ["block_col_warps", "ot", 4], ["warp_row_tiles", "ot", 1], ["warp_col_tiles", "ot", 1], ["chunk", "ot", 8], ["offset", "ot", 8], ["offsetCS", "ot", 8], ["vec", "ot", 1], ["wmma_m", "ot", 8]]}, "result": [[4.7017840999999994e-05], 0, 3.2883098125457764, 1651747462.9649312], "version": 0.2, "tvm_version": "0.8.0"}
{"input": ["cuda -keys=cuda,gpu -max_num_threads=1024 -thread_warp_size=32", "fused_layer_norm_matmul_tensorcore.cuda", [["TENSOR", [1024, 512], "float16"], ["TENSOR", [1024], "float16"], ["TENSOR", [1024], "float16"], ["TENSOR", [256, 512], "float16"], 0.001953125], {}], "config": {"index": 6978, "code_hash": null, "entity": [["block_row_warps", "ot", 1], ["block_col_warps", "ot", 2], ["warp_row_tiles", "ot", 2], ["warp_col_tiles", "ot", 1], ["chunk", "ot", 4], ["offset", "ot", 8], ["offsetCS", "ot", 0], ["vec", "ot", 2], ["wmma_m", "ot", 16]]}, "result": [[7.7848635e-05], 0, 3.8178296089172363, 1651747465.7920735], "version": 0.2, "tvm_version": "0.8.0"}
{"input": ["cuda -keys=cuda,gpu -max_num_threads=1024 -thread_warp_size=32", "fused_layer_norm_matmul_tensorcore.cuda", [["TENSOR", [1024, 512], "float16"], ["TENSOR", [1024], "float16"], ["TENSOR", [1024], "float16"], ["TENSOR", [256, 512], "float16"], 0.001953125], {}], "config": {"index": 11130, "code_hash": null, "entity": [["block_row_warps", "ot", 1], ["block_col_warps", "ot", 4], ["warp_row_tiles", "ot", 1], ["warp_col_tiles", "ot", 2], ["chunk", "ot", 2], ["offset", "ot", 0], ["offsetCS", "ot", 8], ["vec", "ot", 1], ["wmma_m", "ot", 8]]}, "result": [[7.405399300000001e-05], 0, 3.301826238632202, 1651747468.717291], "version": 0.2, "tvm_version": "0.8.0"}
{"input": ["cuda -keys=cuda,gpu -max_num_threads=1024 -thread_warp_size=32", "fused_layer_norm_matmul_tensorcore.cuda", [["TENSOR", [1024, 512], "float16"], ["TENSOR", [1024], "float16"], ["TENSOR", [1024], "float16"], ["TENSOR", [256, 512], "float16"], 0.001953125], {}], "config": {"index": 8698, "code_hash": null, "entity": [["block_row_warps", "ot", 2], ["block_col_warps", "ot", 2], ["warp_row_tiles", "ot", 1], ["warp_col_tiles", "ot", 2], ["chunk", "ot", 8], ["offset", "ot", 0], ["offsetCS", "ot", 8], ["vec", "ot", 4], ["wmma_m", "ot", 16]]}, "result": [[6.467563e-05], 0, 3.7501823902130127, 1651747471.5192294], "version": 0.2, "tvm_version": "0.8.0"}
{"input": ["cuda -keys=cuda,gpu -max_num_threads=1024 -thread_warp_size=32", "fused_layer_norm_matmul_tensorcore.cuda", [["TENSOR", [1024, 512], "float16"], ["TENSOR", [1024], "float16"], ["TENSOR", [1024], "float16"], ["TENSOR", [256, 512], "float16"], 0.001953125], {}], "config": {"index": 5295, "code_hash": null, "entity": [["block_row_warps", "ot", 1], ["block_col_warps", "ot", 2], ["warp_row_tiles", "ot", 1], ["warp_col_tiles", "ot", 2], ["chunk", "ot", 2], ["offset", "ot", 0], ["offsetCS", "ot", 0], ["vec", "ot", 1], ["wmma_m", "ot", 16]]}, "result": [[8.814248100000001e-05], 0, 2.9672021865844727, 1651747474.491509], "version": 0.2, "tvm_version": "0.8.0"}
{"input": ["cuda -keys=cuda,gpu -max_num_threads=1024 -thread_warp_size=32", "fused_layer_norm_matmul_tensorcore.cuda", [["TENSOR", [1024, 512], "float16"], ["TENSOR", [1024], "float16"], ["TENSOR", [1024], "float16"], ["TENSOR", [256, 512], "float16"], 0.001953125], {}], "config": {"index": 5788, "code_hash": null, "entity": [["block_row_warps", "ot", 2], ["block_col_warps", "ot", 1], ["warp_row_tiles", "ot", 2], ["warp_col_tiles", "ot", 2], ["chunk", "ot", 8], ["offset", "ot", 8], ["offsetCS", "ot", 0], ["vec", "ot", 1], ["wmma_m", "ot", 16]]}, "result": [[0.000138403624], 0, 3.4160497188568115, 1651747477.724124], "version": 0.2, "tvm_version": "0.8.0"}
{"input": ["cuda -keys=cuda,gpu -max_num_threads=1024 -thread_warp_size=32", "fused_layer_norm_matmul_tensorcore.cuda", [["TENSOR", [1024, 512], "float16"], ["TENSOR", [1024], "float16"], ["TENSOR", [1024], "float16"], ["TENSOR", [256, 512], "float16"], 0.001953125], {}], "config": {"index": 11279, "code_hash": null, "entity": [["block_row_warps", "ot", 4], ["block_col_warps", "ot", 1], ["warp_row_tiles", "ot", 4], ["warp_col_tiles", "ot", 1], ["chunk", "ot", 8], ["offset", "ot", 0], ["offsetCS", "ot", 8], ["vec", "ot", 1], ["wmma_m", "ot", 8]]}, "result": [[0.00012990016700000002], 0, 3.8523037433624268, 1651747480.842038], "version": 0.2, "tvm_version": "0.8.0"}
{"input": ["cuda -keys=cuda,gpu -max_num_threads=1024 -thread_warp_size=32", "fused_layer_norm_matmul_tensorcore.cuda", [["TENSOR", [1024, 512], "float16"], ["TENSOR", [1024], "float16"], ["TENSOR", [1024], "float16"], ["TENSOR", [256, 512], "float16"], 0.001953125], {}], "config": {"index": 2739, "code_hash": null, "entity": [["block_row_warps", "ot", 1], ["block_col_warps", "ot", 2], ["warp_row_tiles", "ot", 2], ["warp_col_tiles", "ot", 4], ["chunk", "ot", 2], ["offset", "ot", 0], ["offsetCS", "ot", 0], ["vec", "ot", 4], ["wmma_m", "ot", 32]]}, "result": [[0.000107149878], 0, 3.145934820175171, 1651747483.8709], "version": 0.2, "tvm_version": "0.8.0"}
{"input": ["cuda -keys=cuda,gpu -max_num_threads=1024 -thread_warp_size=32", "fused_layer_norm_matmul_tensorcore.cuda", [["TENSOR", [1024, 512], "float16"], ["TENSOR", [1024], "float16"], ["TENSOR", [1024], "float16"], ["TENSOR", [256, 512], "float16"], 0.001953125], {}], "config": {"index": 282, "code_hash": null, "entity": [["block_row_warps", "ot", 1], ["block_col_warps", "ot", 2], ["warp_row_tiles", "ot", 2], ["warp_col_tiles", "ot", 2], ["chunk", "ot", 8], ["offset", "ot", 0], ["offsetCS", "ot", 0], ["vec", "ot", 1], ["wmma_m", "ot", 32]]}, "result": [[0.000143755682], 0, 3.2866804599761963, 1651747487.1365795], "version": 0.2, "tvm_version": "0.8.0"}
{"input": ["cuda -keys=cuda,gpu -max_num_threads=1024 -thread_warp_size=32", "fused_layer_norm_matmul_tensorcore.cuda", [["TENSOR", [1024, 512], "float16"], ["TENSOR", [1024], "float16"], ["TENSOR", [1024], "float16"], ["TENSOR", [256, 512], "float16"], 0.001953125], {}], "config": {"index": 195, "code_hash": null, "entity": [["block_row_warps", "ot", 1], ["block_col_warps", "ot", 4], ["warp_row_tiles", "ot", 1], ["warp_col_tiles", "ot", 2], ["chunk", "ot", 4], ["offset", "ot", 0], ["offsetCS", "ot", 0], ["vec", "ot", 1], ["wmma_m", "ot", 32]]}, "result": [[0.000101643638], 0, 3.470489263534546, 1651747489.9908469], "version": 0.2, "tvm_version": "0.8.0"}
{"input": ["cuda -keys=cuda,gpu -max_num_threads=1024 -thread_warp_size=32", "fused_layer_norm_matmul_tensorcore.cuda", [["TENSOR", [1024, 512], "float16"], ["TENSOR", [1024], "float16"], ["TENSOR", [1024], "float16"], ["TENSOR", [256, 512], "float16"], 0.001953125], {}], "config": {"index": 10626, "code_hash": null, "entity": [["block_row_warps", "ot", 1], ["block_col_warps", "ot", 4], ["warp_row_tiles", "ot", 2], ["warp_col_tiles", "ot", 1], ["chunk", "ot", 8], ["offset", "ot", 0], ["offsetCS", "ot", 0], ["vec", "ot", 1], ["wmma_m", "ot", 8]]}, "result": [[8.3659733e-05], 0, 3.1396515369415283, 1651747492.967764], "version": 0.2, "tvm_version": "0.8.0"}
{"input": ["cuda -keys=cuda,gpu -max_num_threads=1024 -thread_warp_size=32", "fused_layer_norm_matmul_tensorcore.cuda", [["TENSOR", [1024, 512], "float16"], ["TENSOR", [1024], "float16"], ["TENSOR", [1024], "float16"], ["TENSOR", [256, 512], "float16"], 0.001953125], {}], "config": {"index": 3309, "code_hash": null, "entity": [["block_row_warps", "ot", 1], ["block_col_warps", "ot", 4], ["warp_row_tiles", "ot", 2], ["warp_col_tiles", "ot", 4], ["chunk", "ot", 1], ["offset", "ot", 0], ["offsetCS", "ot", 8], ["vec", "ot", 4], ["wmma_m", "ot", 32]]}, "result": [[8.4464725e-05], 0, 3.5814995765686035, 1651747495.7675796], "version": 0.2, "tvm_version": "0.8.0"}
{"input": ["cuda -keys=cuda,gpu -max_num_threads=1024 -thread_warp_size=32", "fused_layer_norm_matmul_tensorcore.cuda", [["TENSOR", [1024, 512], "float16"], ["TENSOR", [1024], "float16"], ["TENSOR", [1024], "float16"], ["TENSOR", [256, 512], "float16"], 0.001953125], {}], "config": {"index": 2927, "code_hash": null, "entity": [["block_row_warps", "ot", 4], ["block_col_warps", "ot", 1], ["warp_row_tiles", "ot", 2], ["warp_col_tiles", "ot", 1], ["chunk", "ot", 1], ["offset", "ot", 8], ["offsetCS", "ot", 0], ["vec", "ot", 4], ["wmma_m", "ot", 32]]}, "result": [[0.000122256457], 0, 3.0649678707122803, 1651747498.9431195], "version": 0.2, "tvm_version": "0.8.0"}
{"input": ["cuda -keys=cuda,gpu -max_num_threads=1024 -thread_warp_size=32", "fused_layer_norm_matmul_tensorcore.cuda", [["TENSOR", [1024, 512], "float16"], ["TENSOR", [1024], "float16"], ["TENSOR", [1024], "float16"], ["TENSOR", [256, 512], "float16"], 0.001953125], {}], "config": {"index": 14583, "code_hash": null, "entity": [["block_row_warps", "ot", 1], ["block_col_warps", "ot", 2], ["warp_row_tiles", "ot", 1], ["warp_col_tiles", "ot", 1], ["chunk", "ot", 1], ["offset", "ot", 8], ["offsetCS", "ot", 0], ["vec", "ot", 8], ["wmma_m", "ot", 8]]}, "result": [[0.000100366132], 0, 3.480571746826172, 1651747501.747435], "version": 0.2, "tvm_version": "0.8.0"}
{"input": ["cuda -keys=cuda,gpu -max_num_threads=1024 -thread_warp_size=32", "fused_layer_norm_matmul_tensorcore.cuda", [["TENSOR", [1024, 512], "float16"], ["TENSOR", [1024], "float16"], ["TENSOR", [1024], "float16"], ["TENSOR", [256, 512], "float16"], 0.001953125], {}], "config": {"index": 7026, "code_hash": null, "entity": [["block_row_warps", "ot", 1], ["block_col_warps", "ot", 4], ["warp_row_tiles", "ot", 1], ["warp_col_tiles", "ot", 4], ["chunk", "ot", 4], ["offset", "ot", 8], ["offsetCS", "ot", 0], ["vec", "ot", 2], ["wmma_m", "ot", 16]]}, "result": [[3.9068321e-05], 0, 2.9318771362304688, 1651747505.1921525], "version": 0.2, "tvm_version": "0.8.0"}
{"input": ["cuda -keys=cuda,gpu -max_num_threads=1024 -thread_warp_size=32", "fused_layer_norm_matmul_tensorcore.cuda", [["TENSOR", [1024, 512], "float16"], ["TENSOR", [1024], "float16"], ["TENSOR", [1024], "float16"], ["TENSOR", [256, 512], "float16"], 0.001953125], {}], "config": {"index": 7089, "code_hash": null, "entity": [["block_row_warps", "ot", 1], ["block_col_warps", "ot", 4], ["warp_row_tiles", "ot", 2], ["warp_col_tiles", "ot", 2], ["chunk", "ot", 8], ["offset", "ot", 8], ["offsetCS", "ot", 0], ["vec", "ot", 2], ["wmma_m", "ot", 16]]}, "result": [[4.7742433e-05], 0, 3.1465306282043457, 1651747508.0773618], "version": 0.2, "tvm_version": "0.8.0"}
{"input": ["cuda -keys=cuda,gpu -max_num_threads=1024 -thread_warp_size=32", "fused_layer_norm_matmul_tensorcore.cuda", [["TENSOR", [1024, 512], "float16"], ["TENSOR", [1024], "float16"], ["TENSOR", [1024], "float16"], ["TENSOR", [256, 512], "float16"], 0.001953125], {}], "config": {"index": 758, "code_hash": null, "entity": [["block_row_warps", "ot", 4], ["block_col_warps", "ot", 1], ["warp_row_tiles", "ot", 1], ["warp_col_tiles", "ot", 2], ["chunk", "ot", 2], ["offset", "ot", 0], ["offsetCS", "ot", 8], ["vec", "ot", 1], ["wmma_m", "ot", 32]]}, "result": [[0.00012877492100000002], 0, 3.6586592197418213, 1651747511.100761], "version": 0.2, "tvm_version": "0.8.0"}
{"input": ["cuda -keys=cuda,gpu -max_num_threads=1024 -thread_warp_size=32", "fused_layer_norm_matmul_tensorcore.cuda", [["TENSOR", [1024, 512], "float16"], ["TENSOR", [1024], "float16"], ["TENSOR", [1024], "float16"], ["TENSOR", [256, 512], "float16"], 0.001953125], {}], "config": {"index": 11929, "code_hash": null, "entity": [["block_row_warps", "ot", 2], ["block_col_warps", "ot", 2], ["warp_row_tiles", "ot", 4], ["warp_col_tiles", "ot", 1], ["chunk", "ot", 8], ["offset", "ot", 0], ["offsetCS", "ot", 0], ["vec", "ot", 2], ["wmma_m", "ot", 8]]}, "result": [[8.8925806e-05], 0, 3.014354944229126, 1651747515.2529168], "version": 0.2, "tvm_version": "0.8.0"}
{"input": ["cuda -keys=cuda,gpu -max_num_threads=1024 -thread_warp_size=32", "fused_layer_norm_matmul_tensorcore.cuda", [["TENSOR", [1024, 512], "float16"], ["TENSOR", [1024], "float16"], ["TENSOR", [1024], "float16"], ["TENSOR", [256, 512], "float16"], 0.001953125], {}], "config": {"index": 8733, "code_hash": null, "entity": [["block_row_warps", "ot", 1], ["block_col_warps", "ot", 2], ["warp_row_tiles", "ot", 2], ["warp_col_tiles", "ot", 4], ["chunk", "ot", 8], ["offset", "ot", 0], ["offsetCS", "ot", 8], ["vec", "ot", 4], ["wmma_m", "ot", 16]]}, "result": [[6.674171300000001e-05], 0, 3.854924440383911, 1651747518.3641686], "version": 0.2, "tvm_version": "0.8.0"}
{"input": ["cuda -keys=cuda,gpu -max_num_threads=1024 -thread_warp_size=32", "fused_layer_norm_matmul_tensorcore.cuda", [["TENSOR", [1024, 512], "float16"], ["TENSOR", [1024], "float16"], ["TENSOR", [1024], "float16"], ["TENSOR", [256, 512], "float16"], 0.001953125], {}], "config": {"index": 13637, "code_hash": null, "entity": [["block_row_warps", "ot", 4], ["block_col_warps", "ot", 1], ["warp_row_tiles", "ot", 1], ["warp_col_tiles", "ot", 2], ["chunk", "ot", 1], ["offset", "ot", 0], ["offsetCS", "ot", 8], ["vec", "ot", 4], ["wmma_m", "ot", 8]]}, "result": [[4.950806999999999e-05], 0, 2.8982601165771484, 1651747521.2017827], "version": 0.2, "tvm_version": "0.8.0"}
{"input": ["cuda -keys=cuda,gpu -max_num_threads=1024 -thread_warp_size=32", "fused_layer_norm_matmul_tensorcore.cuda", [["TENSOR", [1024, 512], "float16"], ["TENSOR", [1024], "float16"], ["TENSOR", [1024], "float16"], ["TENSOR", [256, 512], "float16"], 0.001953125], {}], "config": {"index": 5232, "code_hash": null, "entity": [["block_row_warps", "ot", 1], ["block_col_warps", "ot", 2], ["warp_row_tiles", "ot", 4], ["warp_col_tiles", "ot", 2], ["chunk", "ot", 1], ["offset", "ot", 0], ["offsetCS", "ot", 0], ["vec", "ot", 1], ["wmma_m", "ot", 16]]}, "result": [[0.00013560066], 0, 3.797367811203003, 1651747524.259192], "version": 0.2, "tvm_version": "0.8.0"}
{"input": ["cuda -keys=cuda,gpu -max_num_threads=1024 -thread_warp_size=32", "fused_layer_norm_matmul_tensorcore.cuda", [["TENSOR", [1024, 512], "float16"], ["TENSOR", [1024], "float16"], ["TENSOR", [1024], "float16"], ["TENSOR", [256, 512], "float16"], 0.001953125], {}], "config": {"index": 1634, "code_hash": null, "entity": [["block_row_warps", "ot", 4], ["block_col_warps", "ot", 2], ["warp_row_tiles", "ot", 2], ["warp_col_tiles", "ot", 1], ["chunk", "ot", 1], ["offset", "ot", 8], ["offsetCS", "ot", 0], ["vec", "ot", 2], ["wmma_m", "ot", 32]]}, "result": [[0.000115109716], 0, 3.2261712551116943, 1651747527.323546], "version": 0.2, "tvm_version": "0.8.0"}
{"input": ["cuda -keys=cuda,gpu -max_num_threads=1024 -thread_warp_size=32", "fused_layer_norm_matmul_tensorcore.cuda", [["TENSOR", [1024, 512], "float16"], ["TENSOR", [1024], "float16"], ["TENSOR", [1024], "float16"], ["TENSOR", [256, 512], "float16"], 0.001953125], {}], "config": {"index": 13989, "code_hash": null, "entity": [["block_row_warps", "ot", 1], ["block_col_warps", "ot", 2], ["warp_row_tiles", "ot", 1], ["warp_col_tiles", "ot", 4], ["chunk", "ot", 1], ["offset", "ot", 8], ["offsetCS", "ot", 8], ["vec", "ot", 4], ["wmma_m", "ot", 8]]}, "result": [[8.7539454e-05], 0, 3.445295810699463, 1651747530.090083], "version": 0.2, "tvm_version": "0.8.0"}
{"input": ["cuda -keys=cuda,gpu -max_num_threads=1024 -thread_warp_size=32", "fused_layer_norm_matmul_tensorcore.cuda", [["TENSOR", [1024, 512], "float16"], ["TENSOR", [1024], "float16"], ["TENSOR", [1024], "float16"], ["TENSOR", [256, 512], "float16"], 0.001953125], {}], "config": {"index": 11214, "code_hash": null, "entity": [["block_row_warps", "ot", 1], ["block_col_warps", "ot", 1], ["warp_row_tiles", "ot", 2], ["warp_col_tiles", "ot", 2], ["chunk", "ot", 4], ["offset", "ot", 0], ["offsetCS", "ot", 8], ["vec", "ot", 1], ["wmma_m", "ot", 8]]}, "result": [[0.000102527256], 0, 3.252873182296753, 1651747533.793955], "version": 0.2, "tvm_version": "0.8.0"}
{"input": ["cuda -keys=cuda,gpu -max_num_threads=1024 -thread_warp_size=32", "fused_layer_norm_matmul_tensorcore.cuda", [["TENSOR", [1024, 512], "float16"], ["TENSOR", [1024], "float16"], ["TENSOR", [1024], "float16"], ["TENSOR", [256, 512], "float16"], 0.001953125], {}], "config": {"index": 10709, "code_hash": null, "entity": [["block_row_warps", "ot", 4], ["block_col_warps", "ot", 4], ["warp_row_tiles", "ot", 2], ["warp_col_tiles", "ot", 1], ["chunk", "ot", 1], ["offset", "ot", 8], ["offsetCS", "ot", 0], ["vec", "ot", 1], ["wmma_m", "ot", 8]]}, "result": [[5.8612124e-05], 0, 2.8825180530548096, 1651747537.2519057], "version": 0.2, "tvm_version": "0.8.0"}
{"input": ["cuda -keys=cuda,gpu -max_num_threads=1024 -thread_warp_size=32", "fused_layer_norm_matmul_tensorcore.cuda", [["TENSOR", [1024, 512], "float16"], ["TENSOR", [1024], "float16"], ["TENSOR", [1024], "float16"], ["TENSOR", [256, 512], "float16"], 0.001953125], {}], "config": {"index": 1325, "code_hash": null, "entity": [["block_row_warps", "ot", 4], ["block_col_warps", "ot", 1], ["warp_row_tiles", "ot", 1], ["warp_col_tiles", "ot", 2], ["chunk", "ot", 1], ["offset", "ot", 0], ["offsetCS", "ot", 0], ["vec", "ot", 2], ["wmma_m", "ot", 32]]}, "result": [[0.000118377968], 0, 3.1268417835235596, 1651747540.3311439], "version": 0.2, "tvm_version": "0.8.0"}
{"input": ["cuda -keys=cuda,gpu -max_num_threads=1024 -thread_warp_size=32", "fused_layer_norm_matmul_tensorcore.cuda", [["TENSOR", [1024, 512], "float16"], ["TENSOR", [1024], "float16"], ["TENSOR", [1024], "float16"], ["TENSOR", [256, 512], "float16"], 0.001953125], {}], "config": {"index": 2788, "code_hash": null, "entity": [["block_row_warps", "ot", 2], ["block_col_warps", "ot", 4], ["warp_row_tiles", "ot", 1], ["warp_col_tiles", "ot", 2], ["chunk", "ot", 4], ["offset", "ot", 0], ["offsetCS", "ot", 0], ["vec", "ot", 4], ["wmma_m", "ot", 32]]}, "result": [[6.6200148e-05], 0, 2.8383591175079346, 1651747543.2359688], "version": 0.2, "tvm_version": "0.8.0"}
{"input": ["cuda -keys=cuda,gpu -max_num_threads=1024 -thread_warp_size=32", "fused_layer_norm_matmul_tensorcore.cuda", [["TENSOR", [1024, 512], "float16"], ["TENSOR", [1024], "float16"], ["TENSOR", [1024], "float16"], ["TENSOR", [256, 512], "float16"], 0.001953125], {}], "config": {"index": 12444, "code_hash": null, "entity": [["block_row_warps", "ot", 1], ["block_col_warps", "ot", 4], ["warp_row_tiles", "ot", 4], ["warp_col_tiles", "ot", 2], ["chunk", "ot", 2], ["offset", "ot", 0], ["offsetCS", "ot", 8], ["vec", "ot", 2], ["wmma_m", "ot", 8]]}, "result": [[7.2459174e-05], 0, 3.439807653427124, 1651747546.066674], "version": 0.2, "tvm_version": "0.8.0"}
{"input": ["cuda -keys=cuda,gpu -max_num_threads=1024 -thread_warp_size=32", "fused_layer_norm_matmul_tensorcore.cuda", [["TENSOR", [1024, 512], "float16"], ["TENSOR", [1024], "float16"], ["TENSOR", [1024], "float16"], ["TENSOR", [256, 512], "float16"], 0.001953125], {}], "config": {"index": 14664, "code_hash": null, "entity": [["block_row_warps", "ot", 1], ["block_col_warps", "ot", 2], ["warp_row_tiles", "ot", 1], ["warp_col_tiles", "ot", 1], ["chunk", "ot", 2], ["offset", "ot", 8], ["offsetCS", "ot", 0], ["vec", "ot", 8], ["wmma_m", "ot", 8]]}, "result": [[5.6007682e-05], 0, 3.316035747528076, 1651747548.7553077], "version": 0.2, "tvm_version": "0.8.0"}
{"input": ["cuda -keys=cuda,gpu -max_num_threads=1024 -thread_warp_size=32", "fused_layer_norm_matmul_tensorcore.cuda", [["TENSOR", [1024, 512], "float16"], ["TENSOR", [1024], "float16"], ["TENSOR", [1024], "float16"], ["TENSOR", [256, 512], "float16"], 0.001953125], {}], "config": {"index": 7895, "code_hash": null, "entity": [["block_row_warps", "ot", 4], ["block_col_warps", "ot", 1], ["warp_row_tiles", "ot", 2], ["warp_col_tiles", "ot", 2], ["chunk", "ot", 2], ["offset", "ot", 0], ["offsetCS", "ot", 0], ["vec", "ot", 4], ["wmma_m", "ot", 16]]}, "result": [[0.000109365903], 0, 2.910996437072754, 1651747554.0435898], "version": 0.2, "tvm_version": "0.8.0"}
{"input": ["cuda -keys=cuda,gpu -max_num_threads=1024 -thread_warp_size=32", "fused_layer_norm_matmul_tensorcore.cuda", [["TENSOR", [1024, 512], "float16"], ["TENSOR", [1024], "float16"], ["TENSOR", [1024], "float16"], ["TENSOR", [256, 512], "float16"], 0.001953125], {}], "config": {"index": 8686, "code_hash": null, "entity": [["block_row_warps", "ot", 2], ["block_col_warps", "ot", 1], ["warp_row_tiles", "ot", 4], ["warp_col_tiles", "ot", 1], ["chunk", "ot", 8], ["offset", "ot", 0], ["offsetCS", "ot", 8], ["vec", "ot", 4], ["wmma_m", "ot", 16]]}, "result": [[0.000114809649], 0, 3.1298398971557617, 1651747557.2460704], "version": 0.2, "tvm_version": "0.8.0"}
{"input": ["cuda -keys=cuda,gpu -max_num_threads=1024 -thread_warp_size=32", "fused_layer_norm_matmul_tensorcore.cuda", [["TENSOR", [1024, 512], "float16"], ["TENSOR", [1024], "float16"], ["TENSOR", [1024], "float16"], ["TENSOR", [256, 512], "float16"], 0.001953125], {}], "config": {"index": 14605, "code_hash": null, "entity": [["block_row_warps", "ot", 2], ["block_col_warps", "ot", 4], ["warp_row_tiles", "ot", 4], ["warp_col_tiles", "ot", 1], ["chunk", "ot", 1], ["offset", "ot", 8], ["offsetCS", "ot", 0], ["vec", "ot", 8], ["wmma_m", "ot", 8]]}, "result": [[0.000108523984], 0, 3.3444745540618896, 1651747560.0829768], "version": 0.2, "tvm_version": "0.8.0"}
{"input": ["cuda -keys=cuda,gpu -max_num_threads=1024 -thread_warp_size=32", "fused_layer_norm_matmul_tensorcore.cuda", [["TENSOR", [1024, 512], "float16"], ["TENSOR", [1024], "float16"], ["TENSOR", [1024], "float16"], ["TENSOR", [256, 512], "float16"], 0.001953125], {}], "config": {"index": 7160, "code_hash": null, "entity": [["block_row_warps", "ot", 4], ["block_col_warps", "ot", 2], ["warp_row_tiles", "ot", 1], ["warp_col_tiles", "ot", 2], ["chunk", "ot", 1], ["offset", "ot", 0], ["offsetCS", "ot", 8], ["vec", "ot", 2], ["wmma_m", "ot", 16]]}, "result": [[5.7884965e-05], 0, 2.913160562515259, 1651747562.9864864], "version": 0.2, "tvm_version": "0.8.0"}
{"input": ["cuda -keys=cuda,gpu -max_num_threads=1024 -thread_warp_size=32", "fused_layer_norm_matmul_tensorcore.cuda", [["TENSOR", [1024, 512], "float16"], ["TENSOR", [1024], "float16"], ["TENSOR", [1024], "float16"], ["TENSOR", [256, 512], "float16"], 0.001953125], {}], "config": {"index": 2282, "code_hash": null, "entity": [["block_row_warps", "ot", 4], ["block_col_warps", "ot", 2], ["warp_row_tiles", "ot", 2], ["warp_col_tiles", "ot", 1], ["chunk", "ot", 1], ["offset", "ot", 8], ["offsetCS", "ot", 8], ["vec", "ot", 2], ["wmma_m", "ot", 32]]}, "result": [[0.000115269969], 0, 3.054914712905884, 1651747566.0740917], "version": 0.2, "tvm_version": "0.8.0"}
{"input": ["cuda -keys=cuda,gpu -max_num_threads=1024 -thread_warp_size=32", "fused_layer_norm_matmul_tensorcore.cuda", [["TENSOR", [1024, 512], "float16"], ["TENSOR", [1024], "float16"], ["TENSOR", [1024], "float16"], ["TENSOR", [256, 512], "float16"], 0.001953125], {}], "config": {"index": 11526, "code_hash": null, "entity": [["block_row_warps", "ot", 1], ["block_col_warps", "ot", 4], ["warp_row_tiles", "ot", 4], ["warp_col_tiles", "ot", 1], ["chunk", "ot", 4], ["offset", "ot", 8], ["offsetCS", "ot", 8], ["vec", "ot", 1], ["wmma_m", "ot", 8]]}, "result": [[7.3989733e-05], 0, 3.1197328567504883, 1651747569.666492], "version": 0.2, "tvm_version": "0.8.0"}
{"input": ["cuda -keys=cuda,gpu -max_num_threads=1024 -thread_warp_size=32", "fused_layer_norm_matmul_tensorcore.cuda", [["TENSOR", [1024, 512], "float16"], ["TENSOR", [1024], "float16"], ["TENSOR", [1024], "float16"], ["TENSOR", [256, 512], "float16"], 0.001953125], {}], "config": {"index": 1370, "code_hash": null, "entity": [["block_row_warps", "ot", 4], ["block_col_warps", "ot", 1], ["warp_row_tiles", "ot", 4], ["warp_col_tiles", "ot", 4], ["chunk", "ot", 1], ["offset", "ot", 0], ["offsetCS", "ot", 0], ["vec", "ot", 2], ["wmma_m", "ot", 32]]}, "result": [[0.00031806018399999997], 0, 4.265428066253662, 1651747573.3179886], "version": 0.2, "tvm_version": "0.8.0"}
{"input": ["cuda -keys=cuda,gpu -max_num_threads=1024 -thread_warp_size=32", "fused_layer_norm_matmul_tensorcore.cuda", [["TENSOR", [1024, 512], "float16"], ["TENSOR", [1024], "float16"], ["TENSOR", [1024], "float16"], ["TENSOR", [256, 512], "float16"], 0.001953125], {}], "config": {"index": 307, "code_hash": null, "entity": [["block_row_warps", "ot", 2], ["block_col_warps", "ot", 1], ["warp_row_tiles", "ot", 2], ["warp_col_tiles", "ot", 4], ["chunk", "ot", 8], ["offset", "ot", 0], ["offsetCS", "ot", 0], ["vec", "ot", 1], ["wmma_m", "ot", 32]]}, "result": [[0.000262893035], 0, 3.709871530532837, 1651747576.9609325], "version": 0.2, "tvm_version": "0.8.0"}
{"input": ["cuda -keys=cuda,gpu -max_num_threads=1024 -thread_warp_size=32", "fused_layer_norm_matmul_tensorcore.cuda", [["TENSOR", [1024, 512], "float16"], ["TENSOR", [1024], "float16"], ["TENSOR", [1024], "float16"], ["TENSOR", [256, 512], "float16"], 0.001953125], {}], "config": {"index": 945, "code_hash": null, "entity": [["block_row_warps", "ot", 1], ["block_col_warps", "ot", 1], ["warp_row_tiles", "ot", 1], ["warp_col_tiles", "ot", 4], ["chunk", "ot", 8], ["offset", "ot", 0], ["offsetCS", "ot", 8], ["vec", "ot", 1], ["wmma_m", "ot", 32]]}, "result": [[0.00015313081299999997], 0, 3.6999194622039795, 1651747580.0687814], "version": 0.2, "tvm_version": "0.8.0"}
{"input": ["cuda -keys=cuda,gpu -max_num_threads=1024 -thread_warp_size=32", "fused_layer_norm_matmul_tensorcore.cuda", [["TENSOR", [1024, 512], "float16"], ["TENSOR", [1024], "float16"], ["TENSOR", [1024], "float16"], ["TENSOR", [256, 512], "float16"], 0.001953125], {}], "config": {"index": 13785, "code_hash": null, "entity": [["block_row_warps", "ot", 1], ["block_col_warps", "ot", 4], ["warp_row_tiles", "ot", 2], ["warp_col_tiles", "ot", 1], ["chunk", "ot", 4], ["offset", "ot", 0], ["offsetCS", "ot", 8], ["vec", "ot", 4], ["wmma_m", "ot", 8]]}, "result": [[5.663655e-05], 0, 2.884746789932251, 1651747583.565882], "version": 0.2, "tvm_version": "0.8.0"}
{"input": ["cuda -keys=cuda,gpu -max_num_threads=1024 -thread_warp_size=32", "fused_layer_norm_matmul_tensorcore.cuda", [["TENSOR", [1024, 512], "float16"], ["TENSOR", [1024], "float16"], ["TENSOR", [1024], "float16"], ["TENSOR", [256, 512], "float16"], 0.001953125], {}], "config": {"index": 2311, "code_hash": null, "entity": [["block_row_warps", "ot", 2], ["block_col_warps", "ot", 4], ["warp_row_tiles", "ot", 2], ["warp_col_tiles", "ot", 2], ["chunk", "ot", 1], ["offset", "ot", 8], ["offsetCS", "ot", 8], ["vec", "ot", 2], ["wmma_m", "ot", 32]]}, "result": [[9.7419218e-05], 0, 3.357896089553833, 1651747586.348547], "version": 0.2, "tvm_version": "0.8.0"}
{"input": ["cuda -keys=cuda,gpu -max_num_threads=1024 -thread_warp_size=32", "fused_layer_norm_matmul_tensorcore.cuda", [["TENSOR", [1024, 512], "float16"], ["TENSOR", [1024], "float16"], ["TENSOR", [1024], "float16"], ["TENSOR", [256, 512], "float16"], 0.001953125], {}], "config": {"index": 11485, "code_hash": null, "entity": [["block_row_warps", "ot", 2], ["block_col_warps", "ot", 1], ["warp_row_tiles", "ot", 2], ["warp_col_tiles", "ot", 4], ["chunk", "ot", 2], ["offset", "ot", 8], ["offsetCS", "ot", 8], ["vec", "ot", 1], ["wmma_m", "ot", 8]]}, "result": [[9.7245685e-05], 0, 3.5693633556365967, 1651747589.2563653], "version": 0.2, "tvm_version": "0.8.0"}
{"input": ["cuda -keys=cuda,gpu -max_num_threads=1024 -thread_warp_size=32", "fused_layer_norm_matmul_tensorcore.cuda", [["TENSOR", [1024, 512], "float16"], ["TENSOR", [1024], "float16"], ["TENSOR", [1024], "float16"], ["TENSOR", [256, 512], "float16"], 0.001953125], {}], "config": {"index": 2637, "code_hash": null, "entity": [["block_row_warps", "ot", 1], ["block_col_warps", "ot", 1], ["warp_row_tiles", "ot", 4], ["warp_col_tiles", "ot", 2], ["chunk", "ot", 1], ["offset", "ot", 0], ["offsetCS", "ot", 0], ["vec", "ot", 4], ["wmma_m", "ot", 32]]}, "result": [[0.000218748593], 0, 3.5357789993286133, 1651747592.744644], "version": 0.2, "tvm_version": "0.8.0"}
{"input": ["cuda -keys=cuda,gpu -max_num_threads=1024 -thread_warp_size=32", "fused_layer_norm_matmul_tensorcore.cuda", [["TENSOR", [1024, 512], "float16"], ["TENSOR", [1024], "float16"], ["TENSOR", [1024], "float16"], ["TENSOR", [256, 512], "float16"], 0.001953125], {}], "config": {"index": 421, "code_hash": null, "entity": [["block_row_warps", "ot", 2], ["block_col_warps", "ot", 4], ["warp_row_tiles", "ot", 2], ["warp_col_tiles", "ot", 1], ["chunk", "ot", 2], ["offset", "ot", 8], ["offsetCS", "ot", 0], ["vec", "ot", 1], ["wmma_m", "ot", 32]]}, "result": [[0.00010882969300000001], 0, 3.4278266429901123, 1651747595.5877914], "version": 0.2, "tvm_version": "0.8.0"}
{"input": ["cuda -keys=cuda,gpu -max_num_threads=1024 -thread_warp_size=32", "fused_layer_norm_matmul_tensorcore.cuda", [["TENSOR", [1024, 512], "float16"], ["TENSOR", [1024], "float16"], ["TENSOR", [1024], "float16"], ["TENSOR", [256, 512], "float16"], 0.001953125], {}], "config": {"index": 2312, "code_hash": null, "entity": [["block_row_warps", "ot", 4], ["block_col_warps", "ot", 4], ["warp_row_tiles", "ot", 2], ["warp_col_tiles", "ot", 2], ["chunk", "ot", 1], ["offset", "ot", 8], ["offsetCS", "ot", 8], ["vec", "ot", 2], ["wmma_m", "ot", 32]]}, "result": [[0.00011269879800000001], 0, 3.0619494915008545, 1651747598.577865], "version": 0.2, "tvm_version": "0.8.0"}
{"input": ["cuda -keys=cuda,gpu -max_num_threads=1024 -thread_warp_size=32", "fused_layer_norm_matmul_tensorcore.cuda", [["TENSOR", [1024, 512], "float16"], ["TENSOR", [1024], "float16"], ["TENSOR", [1024], "float16"], ["TENSOR", [256, 512], "float16"], 0.001953125], {}], "config": {"index": 5920, "code_hash": null, "entity": [["block_row_warps", "ot", 2], ["block_col_warps", "ot", 4], ["warp_row_tiles", "ot", 1], ["warp_col_tiles", "ot", 1], ["chunk", "ot", 2], ["offset", "ot", 0], ["offsetCS", "ot", 8], ["vec", "ot", 1], ["wmma_m", "ot", 16]]}, "result": [[6.007861299999999e-05], 0, 2.773331642150879, 1651747601.4818268], "version": 0.2, "tvm_version": "0.8.0"}
{"input": ["cuda -keys=cuda,gpu -max_num_threads=1024 -thread_warp_size=32", "fused_layer_norm_matmul_tensorcore.cuda", [["TENSOR", [1024, 512], "float16"], ["TENSOR", [1024], "float16"], ["TENSOR", [1024], "float16"], ["TENSOR", [256, 512], "float16"], 0.001953125], {}], "config": {"index": 12094, "code_hash": null, "entity": [["block_row_warps", "ot", 2], ["block_col_warps", "ot", 4], ["warp_row_tiles", "ot", 4], ["warp_col_tiles", "ot", 1], ["chunk", "ot", 2], ["offset", "ot", 8], ["offsetCS", "ot", 0], ["vec", "ot", 2], ["wmma_m", "ot", 8]]}, "result": [[5.8424059e-05], 0, 2.8212037086486816, 1651747604.4018416], "version": 0.2, "tvm_version": "0.8.0"}
{"input": ["cuda -keys=cuda,gpu -max_num_threads=1024 -thread_warp_size=32", "fused_layer_norm_matmul_tensorcore.cuda", [["TENSOR", [1024, 512], "float16"], ["TENSOR", [1024], "float16"], ["TENSOR", [1024], "float16"], ["TENSOR", [256, 512], "float16"], 0.001953125], {}], "config": {"index": 8038, "code_hash": null, "entity": [["block_row_warps", "ot", 2], ["block_col_warps", "ot", 1], ["warp_row_tiles", "ot", 4], ["warp_col_tiles", "ot", 1], ["chunk", "ot", 8], ["offset", "ot", 0], ["offsetCS", "ot", 0], ["vec", "ot", 4], ["wmma_m", "ot", 16]]}, "result": [[0.000115321069], 0, 3.1137545108795166, 1651747607.5793736], "version": 0.2, "tvm_version": "0.8.0"}
{"input": ["cuda -keys=cuda,gpu -max_num_threads=1024 -thread_warp_size=32", "fused_layer_norm_matmul_tensorcore.cuda", [["TENSOR", [1024, 512], "float16"], ["TENSOR", [1024], "float16"], ["TENSOR", [1024], "float16"], ["TENSOR", [256, 512], "float16"], 0.001953125], {}], "config": {"index": 6275, "code_hash": null, "entity": [["block_row_warps", "ot", 4], ["block_col_warps", "ot", 1], ["warp_row_tiles", "ot", 2], ["warp_col_tiles", "ot", 2], ["chunk", "ot", 2], ["offset", "ot", 8], ["offsetCS", "ot", 8], ["vec", "ot", 1], ["wmma_m", "ot", 16]]}, "result": [[0.00012431235], 0, 3.758999824523926, 1651747610.675973], "version": 0.2, "tvm_version": "0.8.0"}
{"input": ["cuda -keys=cuda,gpu -max_num_threads=1024 -thread_warp_size=32", "fused_layer_norm_matmul_tensorcore.cuda", [["TENSOR", [1024, 512], "float16"], ["TENSOR", [1024], "float16"], ["TENSOR", [1024], "float16"], ["TENSOR", [256, 512], "float16"], 0.001953125], {}], "config": {"index": 5352, "code_hash": null, "entity": [["block_row_warps", "ot", 1], ["block_col_warps", "ot", 4], ["warp_row_tiles", "ot", 1], ["warp_col_tiles", "ot", 1], ["chunk", "ot", 4], ["offset", "ot", 0], ["offsetCS", "ot", 0], ["vec", "ot", 1], ["wmma_m", "ot", 16]]}, "result": [[7.237925099999999e-05], 0, 2.975215196609497, 1651747613.5954223], "version": 0.2, "tvm_version": "0.8.0"}
{"input": ["cuda -keys=cuda,gpu -max_num_threads=1024 -thread_warp_size=32", "fused_layer_norm_matmul_tensorcore.cuda", [["TENSOR", [1024, 512], "float16"], ["TENSOR", [1024], "float16"], ["TENSOR", [1024], "float16"], ["TENSOR", [256, 512], "float16"], 0.001953125], {}], "config": {"index": 480, "code_hash": null, "entity": [["block_row_warps", "ot", 1], ["block_col_warps", "ot", 2], ["warp_row_tiles", "ot", 4], ["warp_col_tiles", "ot", 4], ["chunk", "ot", 2], ["offset", "ot", 8], ["offsetCS", "ot", 0], ["vec", "ot", 1], ["wmma_m", "ot", 32]]}, "result": [[0.000243321711], 0, 3.5566537380218506, 1651747617.1975772], "version": 0.2, "tvm_version": "0.8.0"}
{"input": ["cuda -keys=cuda,gpu -max_num_threads=1024 -thread_warp_size=32", "fused_layer_norm_matmul_tensorcore.cuda", [["TENSOR", [1024, 512], "float16"], ["TENSOR", [1024], "float16"], ["TENSOR", [1024], "float16"], ["TENSOR", [256, 512], "float16"], 0.001953125], {}], "config": {"index": 169, "code_hash": null, "entity": [["block_row_warps", "ot", 2], ["block_col_warps", "ot", 4], ["warp_row_tiles", "ot", 1], ["warp_col_tiles", "ot", 1], ["chunk", "ot", 4], ["offset", "ot", 0], ["offsetCS", "ot", 0], ["vec", "ot", 1], ["wmma_m", "ot", 32]]}, "result": [[0.000110202884], 0, 2.8923141956329346, 1651747653.0091877], "version": 0.2, "tvm_version": "0.8.0"}
{"input": ["cuda -keys=cuda,gpu -max_num_threads=1024 -thread_warp_size=32", "fused_layer_norm_matmul_tensorcore.cuda", [["TENSOR", [1024, 512], "float16"], ["TENSOR", [1024], "float16"], ["TENSOR", [1024], "float16"], ["TENSOR", [256, 512], "float16"], 0.001953125], {}], "config": {"index": 1056, "code_hash": null, "entity": [["block_row_warps", "ot", 1], ["block_col_warps", "ot", 2], ["warp_row_tiles", "ot", 1], ["warp_col_tiles", "ot", 1], ["chunk", "ot", 2], ["offset", "ot", 8], ["offsetCS", "ot", 8], ["vec", "ot", 1], ["wmma_m", "ot", 32]]}, "result": [[0.000112884916], 0, 3.385802745819092, 1651747655.846616], "version": 0.2, "tvm_version": "0.8.0"}
{"input": ["cuda -keys=cuda,gpu -max_num_threads=1024 -thread_warp_size=32", "fused_layer_norm_matmul_tensorcore.cuda", [["TENSOR", [1024, 512], "float16"], ["TENSOR", [1024], "float16"], ["TENSOR", [1024], "float16"], ["TENSOR", [256, 512], "float16"], 0.001953125], {}], "config": {"index": 88, "code_hash": null, "entity": [["block_row_warps", "ot", 2], ["block_col_warps", "ot", 4], ["warp_row_tiles", "ot", 1], ["warp_col_tiles", "ot", 1], ["chunk", "ot", 2], ["offset", "ot", 0], ["offsetCS", "ot", 0], ["vec", "ot", 1], ["wmma_m", "ot", 32]]}, "result": [[9.033092600000001e-05], 0, 3.3869247436523438, 1651747658.670016], "version": 0.2, "tvm_version": "0.8.0"}
{"input": ["cuda -keys=cuda,gpu -max_num_threads=1024 -thread_warp_size=32", "fused_layer_norm_matmul_tensorcore.cuda", [["TENSOR", [1024, 512], "float16"], ["TENSOR", [1024], "float16"], ["TENSOR", [1024], "float16"], ["TENSOR", [256, 512], "float16"], 0.001953125], {}], "config": {"index": 84, "code_hash": null, "entity": [["block_row_warps", "ot", 1], ["block_col_warps", "ot", 2], ["warp_row_tiles", "ot", 1], ["warp_col_tiles", "ot", 1], ["chunk", "ot", 2], ["offset", "ot", 0], ["offsetCS", "ot", 0], ["vec", "ot", 1], ["wmma_m", "ot", 32]]}, "result": [[0.000112227339], 0, 3.3259971141815186, 1651747661.509442], "version": 0.2, "tvm_version": "0.8.0"}
{"input": ["cuda -keys=cuda,gpu -max_num_threads=1024 -thread_warp_size=32", "fused_layer_norm_matmul_tensorcore.cuda", [["TENSOR", [1024, 512], "float16"], ["TENSOR", [1024], "float16"], ["TENSOR", [1024], "float16"], ["TENSOR", [256, 512], "float16"], 0.001953125], {}], "config": {"index": 166, "code_hash": null, "entity": [["block_row_warps", "ot", 2], ["block_col_warps", "ot", 2], ["warp_row_tiles", "ot", 1], ["warp_col_tiles", "ot", 1], ["chunk", "ot", 4], ["offset", "ot", 0], ["offsetCS", "ot", 0], ["vec", "ot", 1], ["wmma_m", "ot", 32]]}, "result": [[0.00011641339000000001], 0, 3.347917079925537, 1651747664.3787556], "version": 0.2, "tvm_version": "0.8.0"}
{"input": ["cuda -keys=cuda,gpu -max_num_threads=1024 -thread_warp_size=32", "fused_layer_norm_matmul_tensorcore.cuda", [["TENSOR", [1024, 512], "float16"], ["TENSOR", [1024], "float16"], ["TENSOR", [1024], "float16"], ["TENSOR", [256, 512], "float16"], 0.001953125], {}], "config": {"index": 10616, "code_hash": null, "entity": [["block_row_warps", "ot", 4], ["block_col_warps", "ot", 2], ["warp_row_tiles", "ot", 1], ["warp_col_tiles", "ot", 1], ["chunk", "ot", 8], ["offset", "ot", 0], ["offsetCS", "ot", 0], ["vec", "ot", 1], ["wmma_m", "ot", 8]]}, "result": [[9.3060864e-05], 0, 3.4276366233825684, 1651747667.239571], "version": 0.2, "tvm_version": "0.8.0"}
{"input": ["cuda -keys=cuda,gpu -max_num_threads=1024 -thread_warp_size=32", "fused_layer_norm_matmul_tensorcore.cuda", [["TENSOR", [1024, 512], "float16"], ["TENSOR", [1024], "float16"], ["TENSOR", [1024], "float16"], ["TENSOR", [256, 512], "float16"], 0.001953125], {}], "config": {"index": 411, "code_hash": null, "entity": [["block_row_warps", "ot", 1], ["block_col_warps", "ot", 4], ["warp_row_tiles", "ot", 1], ["warp_col_tiles", "ot", 1], ["chunk", "ot", 2], ["offset", "ot", 8], ["offsetCS", "ot", 0], ["vec", "ot", 1], ["wmma_m", "ot", 32]]}, "result": [[7.003152599999999e-05], 0, 3.141777753829956, 1651747669.9590285], "version": 0.2, "tvm_version": "0.8.0"}
{"input": ["cuda -keys=cuda,gpu -max_num_threads=1024 -thread_warp_size=32", "fused_layer_norm_matmul_tensorcore.cuda", [["TENSOR", [1024, 512], "float16"], ["TENSOR", [1024], "float16"], ["TENSOR", [1024], "float16"], ["TENSOR", [256, 512], "float16"], 0.001953125], {}], "config": {"index": 490, "code_hash": null, "entity": [["block_row_warps", "ot", 2], ["block_col_warps", "ot", 2], ["warp_row_tiles", "ot", 1], ["warp_col_tiles", "ot", 1], ["chunk", "ot", 4], ["offset", "ot", 8], ["offsetCS", "ot", 0], ["vec", "ot", 1], ["wmma_m", "ot", 32]]}, "result": [[0.00011380878800000001], 0, 3.309420108795166, 1651747672.819464], "version": 0.2, "tvm_version": "0.8.0"}
{"input": ["cuda -keys=cuda,gpu -max_num_threads=1024 -thread_warp_size=32", "fused_layer_norm_matmul_tensorcore.cuda", [["TENSOR", [1024, 512], "float16"], ["TENSOR", [1024], "float16"], ["TENSOR", [1024], "float16"], ["TENSOR", [256, 512], "float16"], 0.001953125], {}], "config": {"index": 1141, "code_hash": null, "entity": [["block_row_warps", "ot", 2], ["block_col_warps", "ot", 4], ["warp_row_tiles", "ot", 1], ["warp_col_tiles", "ot", 1], ["chunk", "ot", 4], ["offset", "ot", 8], ["offsetCS", "ot", 8], ["vec", "ot", 1], ["wmma_m", "ot", 32]]}, "result": [[7.0048444e-05], 0, 3.2505714893341064, 1651747675.6058466], "version": 0.2, "tvm_version": "0.8.0"}
{"input": ["cuda -keys=cuda,gpu -max_num_threads=1024 -thread_warp_size=32", "fused_layer_norm_matmul_tensorcore.cuda", [["TENSOR", [1024, 512], "float16"], ["TENSOR", [1024], "float16"], ["TENSOR", [1024], "float16"], ["TENSOR", [256, 512], "float16"], 0.001953125], {}], "config": {"index": 732, "code_hash": null, "entity": [["block_row_warps", "ot", 1], ["block_col_warps", "ot", 2], ["warp_row_tiles", "ot", 1], ["warp_col_tiles", "ot", 1], ["chunk", "ot", 2], ["offset", "ot", 0], ["offsetCS", "ot", 8], ["vec", "ot", 1], ["wmma_m", "ot", 32]]}, "result": [[0.00011196627599999999], 0, 3.2426345348358154, 1651747678.457236], "version": 0.2, "tvm_version": "0.8.0"}
{"input": ["cuda -keys=cuda,gpu -max_num_threads=1024 -thread_warp_size=32", "fused_layer_norm_matmul_tensorcore.cuda", [["TENSOR", [1024, 512], "float16"], ["TENSOR", [1024], "float16"], ["TENSOR", [1024], "float16"], ["TENSOR", [256, 512], "float16"], 0.001953125], {}], "config": {"index": 5432, "code_hash": null, "entity": [["block_row_warps", "ot", 4], ["block_col_warps", "ot", 2], ["warp_row_tiles", "ot", 1], ["warp_col_tiles", "ot", 1], ["chunk", "ot", 8], ["offset", "ot", 0], ["offsetCS", "ot", 0], ["vec", "ot", 1], ["wmma_m", "ot", 16]]}, "result": [[0.000105426596], 0, 3.4214630126953125, 1651747681.280381], "version": 0.2, "tvm_version": "0.8.0"}
{"input": ["cuda -keys=cuda,gpu -max_num_threads=1024 -thread_warp_size=32", "fused_layer_norm_matmul_tensorcore.cuda", [["TENSOR", [1024, 512], "float16"], ["TENSOR", [1024], "float16"], ["TENSOR", [1024], "float16"], ["TENSOR", [256, 512], "float16"], 0.001953125], {}], "config": {"index": 493, "code_hash": null, "entity": [["block_row_warps", "ot", 2], ["block_col_warps", "ot", 4], ["warp_row_tiles", "ot", 1], ["warp_col_tiles", "ot", 1], ["chunk", "ot", 4], ["offset", "ot", 8], ["offsetCS", "ot", 0], ["vec", "ot", 1], ["wmma_m", "ot", 32]]}, "result": [[6.9778084e-05], 0, 3.3847334384918213, 1651747684.0894554], "version": 0.2, "tvm_version": "0.8.0"}
{"input": ["cuda -keys=cuda,gpu -max_num_threads=1024 -thread_warp_size=32", "fused_layer_norm_matmul_tensorcore.cuda", [["TENSOR", [1024, 512], "float16"], ["TENSOR", [1024], "float16"], ["TENSOR", [1024], "float16"], ["TENSOR", [256, 512], "float16"], 0.001953125], {}], "config": {"index": 5674, "code_hash": null, "entity": [["block_row_warps", "ot", 2], ["block_col_warps", "ot", 2], ["warp_row_tiles", "ot", 1], ["warp_col_tiles", "ot", 1], ["chunk", "ot", 4], ["offset", "ot", 8], ["offsetCS", "ot", 0], ["vec", "ot", 1], ["wmma_m", "ot", 16]]}, "result": [[6.9020429e-05], 0, 3.2352333068847656, 1651747686.8285732], "version": 0.2, "tvm_version": "0.8.0"}
{"input": ["cuda -keys=cuda,gpu -max_num_threads=1024 -thread_warp_size=32", "fused_layer_norm_matmul_tensorcore.cuda", [["TENSOR", [1024, 512], "float16"], ["TENSOR", [1024], "float16"], ["TENSOR", [1024], "float16"], ["TENSOR", [256, 512], "float16"], 0.001953125], {}], "config": {"index": 11267, "code_hash": null, "entity": [["block_row_warps", "ot", 4], ["block_col_warps", "ot", 4], ["warp_row_tiles", "ot", 1], ["warp_col_tiles", "ot", 1], ["chunk", "ot", 8], ["offset", "ot", 0], ["offsetCS", "ot", 8], ["vec", "ot", 1], ["wmma_m", "ot", 8]]}, "result": [[8.144765800000001e-05], 0, 3.321925163269043, 1651747689.6126206], "version": 0.2, "tvm_version": "0.8.0"}
{"input": ["cuda -keys=cuda,gpu -max_num_threads=1024 -thread_warp_size=32", "fused_layer_norm_matmul_tensorcore.cuda", [["TENSOR", [1024, 512], "float16"], ["TENSOR", [1024], "float16"], ["TENSOR", [1024], "float16"], ["TENSOR", [256, 512], "float16"], 0.001953125], {}], "config": {"index": 408, "code_hash": null, "entity": [["block_row_warps", "ot", 1], ["block_col_warps", "ot", 2], ["warp_row_tiles", "ot", 1], ["warp_col_tiles", "ot", 1], ["chunk", "ot", 2], ["offset", "ot", 8], ["offsetCS", "ot", 0], ["vec", "ot", 1], ["wmma_m", "ot", 32]]}, "result": [[0.000111231766], 0, 3.387256622314453, 1651747692.4946642], "version": 0.2, "tvm_version": "0.8.0"}
{"input": ["cuda -keys=cuda,gpu -max_num_threads=1024 -thread_warp_size=32", "fused_layer_norm_matmul_tensorcore.cuda", [["TENSOR", [1024, 512], "float16"], ["TENSOR", [1024], "float16"], ["TENSOR", [1024], "float16"], ["TENSOR", [256, 512], "float16"], 0.001953125], {}], "config": {"index": 412, "code_hash": null, "entity": [["block_row_warps", "ot", 2], ["block_col_warps", "ot", 4], ["warp_row_tiles", "ot", 1], ["warp_col_tiles", "ot", 1], ["chunk", "ot", 2], ["offset", "ot", 8], ["offsetCS", "ot", 0], ["vec", "ot", 1], ["wmma_m", "ot", 32]]}, "result": [[7.309562800000002e-05], 0, 3.2717771530151367, 1651747695.2753232], "version": 0.2, "tvm_version": "0.8.0"}
{"input": ["cuda -keys=cuda,gpu -max_num_threads=1024 -thread_warp_size=32", "fused_layer_norm_matmul_tensorcore.cuda", [["TENSOR", [1024, 512], "float16"], ["TENSOR", [1024], "float16"], ["TENSOR", [1024], "float16"], ["TENSOR", [256, 512], "float16"], 0.001953125], {}], "config": {"index": 85, "code_hash": null, "entity": [["block_row_warps", "ot", 2], ["block_col_warps", "ot", 2], ["warp_row_tiles", "ot", 1], ["warp_col_tiles", "ot", 1], ["chunk", "ot", 2], ["offset", "ot", 0], ["offsetCS", "ot", 0], ["vec", "ot", 1], ["wmma_m", "ot", 32]]}, "result": [[0.00011024925000000001], 0, 3.464794635772705, 1651747698.1365604], "version": 0.2, "tvm_version": "0.8.0"}
{"input": ["cuda -keys=cuda,gpu -max_num_threads=1024 -thread_warp_size=32", "fused_layer_norm_matmul_tensorcore.cuda", [["TENSOR", [1024, 512], "float16"], ["TENSOR", [1024], "float16"], ["TENSOR", [1024], "float16"], ["TENSOR", [256, 512], "float16"], 0.001953125], {}], "config": {"index": 5350, "code_hash": null, "entity": [["block_row_warps", "ot", 2], ["block_col_warps", "ot", 2], ["warp_row_tiles", "ot", 1], ["warp_col_tiles", "ot", 1], ["chunk", "ot", 4], ["offset", "ot", 0], ["offsetCS", "ot", 0], ["vec", "ot", 1], ["wmma_m", "ot", 16]]}, "result": [[9.3356373e-05], 0, 3.5173404216766357, 1651747700.9829137], "version": 0.2, "tvm_version": "0.8.0"}
{"input": ["cuda -keys=cuda,gpu -max_num_threads=1024 -thread_warp_size=32", "fused_layer_norm_matmul_tensorcore.cuda", [["TENSOR", [1024, 512], "float16"], ["TENSOR", [1024], "float16"], ["TENSOR", [1024], "float16"], ["TENSOR", [256, 512], "float16"], 0.001953125], {}], "config": {"index": 409, "code_hash": null, "entity": [["block_row_warps", "ot", 2], ["block_col_warps", "ot", 2], ["warp_row_tiles", "ot", 1], ["warp_col_tiles", "ot", 1], ["chunk", "ot", 2], ["offset", "ot", 8], ["offsetCS", "ot", 0], ["vec", "ot", 1], ["wmma_m", "ot", 32]]}, "result": [[0.00011170235599999998], 0, 3.443904161453247, 1651747703.8207362], "version": 0.2, "tvm_version": "0.8.0"}
{"input": ["cuda -keys=cuda,gpu -max_num_threads=1024 -thread_warp_size=32", "fused_layer_norm_matmul_tensorcore.cuda", [["TENSOR", [1024, 512], "float16"], ["TENSOR", [1024], "float16"], ["TENSOR", [1024], "float16"], ["TENSOR", [256, 512], "float16"], 0.001953125], {}], "config": {"index": 10940, "code_hash": null, "entity": [["block_row_warps", "ot", 4], ["block_col_warps", "ot", 2], ["warp_row_tiles", "ot", 1], ["warp_col_tiles", "ot", 1], ["chunk", "ot", 8], ["offset", "ot", 8], ["offsetCS", "ot", 0], ["vec", "ot", 1], ["wmma_m", "ot", 8]]}, "result": [[4.6943316000000005e-05], 0, 3.3818776607513428, 1651747706.5204172], "version": 0.2, "tvm_version": "0.8.0"}
{"input": ["cuda -keys=cuda,gpu -max_num_threads=1024 -thread_warp_size=32", "fused_layer_norm_matmul_tensorcore.cuda", [["TENSOR", [1024, 512], "float16"], ["TENSOR", [1024], "float16"], ["TENSOR", [1024], "float16"], ["TENSOR", [256, 512], "float16"], 0.001953125], {}], "config": {"index": 5756, "code_hash": null, "entity": [["block_row_warps", "ot", 4], ["block_col_warps", "ot", 2], ["warp_row_tiles", "ot", 1], ["warp_col_tiles", "ot", 1], ["chunk", "ot", 8], ["offset", "ot", 8], ["offsetCS", "ot", 0], ["vec", "ot", 1], ["wmma_m", "ot", 16]]}, "result": [[6.8502663e-05], 0, 3.485137701034546, 1651747709.3184617], "version": 0.2, "tvm_version": "0.8.0"}
{"input": ["cuda -keys=cuda,gpu -max_num_threads=1024 -thread_warp_size=32", "fused_layer_norm_matmul_tensorcore.cuda", [["TENSOR", [1024, 512], "float16"], ["TENSOR", [1024], "float16"], ["TENSOR", [1024], "float16"], ["TENSOR", [256, 512], "float16"], 0.001953125], {}], "config": {"index": 6404, "code_hash": null, "entity": [["block_row_warps", "ot", 4], ["block_col_warps", "ot", 2], ["warp_row_tiles", "ot", 1], ["warp_col_tiles", "ot", 1], ["chunk", "ot", 8], ["offset", "ot", 8], ["offsetCS", "ot", 8], ["vec", "ot", 1], ["wmma_m", "ot", 16]]}, "result": [[6.892842600000001e-05], 0, 3.3498010635375977, 1651747712.068999], "version": 0.2, "tvm_version": "0.8.0"}
{"input": ["cuda -keys=cuda,gpu -max_num_threads=1024 -thread_warp_size=32", "fused_layer_norm_matmul_tensorcore.cuda", [["TENSOR", [1024, 512], "float16"], ["TENSOR", [1024], "float16"], ["TENSOR", [1024], "float16"], ["TENSOR", [256, 512], "float16"], 0.001953125], {}], "config": {"index": 11264, "code_hash": null, "entity": [["block_row_warps", "ot", 4], ["block_col_warps", "ot", 2], ["warp_row_tiles", "ot", 1], ["warp_col_tiles", "ot", 1], ["chunk", "ot", 8], ["offset", "ot", 0], ["offsetCS", "ot", 8], ["vec", "ot", 1], ["wmma_m", "ot", 8]]}, "result": [[9.233938600000001e-05], 0, 3.4720237255096436, 1651747714.8767235], "version": 0.2, "tvm_version": "0.8.0"}
{"input": ["cuda -keys=cuda,gpu -max_num_threads=1024 -thread_warp_size=32", "fused_layer_norm_matmul_tensorcore.cuda", [["TENSOR", [1024, 512], "float16"], ["TENSOR", [1024], "float16"], ["TENSOR", [1024], "float16"], ["TENSOR", [256, 512], "float16"], 0.001953125], {}], "config": {"index": 10943, "code_hash": null, "entity": [["block_row_warps", "ot", 4], ["block_col_warps", "ot", 4], ["warp_row_tiles", "ot", 1], ["warp_col_tiles", "ot", 1], ["chunk", "ot", 8], ["offset", "ot", 8], ["offsetCS", "ot", 0], ["vec", "ot", 1], ["wmma_m", "ot", 8]]}, "result": [[3.4967794e-05], 0, 3.331470489501953, 1651747717.574556], "version": 0.2, "tvm_version": "0.8.0"}
{"input": ["cuda -keys=cuda,gpu -max_num_threads=1024 -thread_warp_size=32", "fused_layer_norm_matmul_tensorcore.cuda", [["TENSOR", [1024, 512], "float16"], ["TENSOR", [1024], "float16"], ["TENSOR", [1024], "float16"], ["TENSOR", [256, 512], "float16"], 0.001953125], {}], "config": {"index": 1060, "code_hash": null, "entity": [["block_row_warps", "ot", 2], ["block_col_warps", "ot", 4], ["warp_row_tiles", "ot", 1], ["warp_col_tiles", "ot", 1], ["chunk", "ot", 2], ["offset", "ot", 8], ["offsetCS", "ot", 8], ["vec", "ot", 1], ["wmma_m", "ot", 32]]}, "result": [[7.3272794e-05], 0, 3.3750412464141846, 1651747720.317164], "version": 0.2, "tvm_version": "0.8.0"}
{"input": ["cuda -keys=cuda,gpu -max_num_threads=1024 -thread_warp_size=32", "fused_layer_norm_matmul_tensorcore.cuda", [["TENSOR", [1024, 512], "float16"], ["TENSOR", [1024], "float16"], ["TENSOR", [1024], "float16"], ["TENSOR", [256, 512], "float16"], 0.001953125], {}], "config": {"index": 736, "code_hash": null, "entity": [["block_row_warps", "ot", 2], ["block_col_warps", "ot", 4], ["warp_row_tiles", "ot", 1], ["warp_col_tiles", "ot", 1], ["chunk", "ot", 2], ["offset", "ot", 0], ["offsetCS", "ot", 8], ["vec", "ot", 1], ["wmma_m", "ot", 32]]}, "result": [[9.0353896e-05], 0, 3.2407875061035156, 1651747723.09968], "version": 0.2, "tvm_version": "0.8.0"}
{"input": ["cuda -keys=cuda,gpu -max_num_threads=1024 -thread_warp_size=32", "fused_layer_norm_matmul_tensorcore.cuda", [["TENSOR", [1024, 512], "float16"], ["TENSOR", [1024], "float16"], ["TENSOR", [1024], "float16"], ["TENSOR", [256, 512], "float16"], 0.001953125], {}], "config": {"index": 817, "code_hash": null, "entity": [["block_row_warps", "ot", 2], ["block_col_warps", "ot", 4], ["warp_row_tiles", "ot", 1], ["warp_col_tiles", "ot", 1], ["chunk", "ot", 4], ["offset", "ot", 0], ["offsetCS", "ot", 8], ["vec", "ot", 1], ["wmma_m", "ot", 32]]}, "result": [[0.0001094232], 0, 3.503849744796753, 1651747725.986743], "version": 0.2, "tvm_version": "0.8.0"}
{"input": ["cuda -keys=cuda,gpu -max_num_threads=1024 -thread_warp_size=32", "fused_layer_norm_matmul_tensorcore.cuda", [["TENSOR", [1024, 512], "float16"], ["TENSOR", [1024], "float16"], ["TENSOR", [1024], "float16"], ["TENSOR", [256, 512], "float16"], 0.001953125], {}], "config": {"index": 6322, "code_hash": null, "entity": [["block_row_warps", "ot", 2], ["block_col_warps", "ot", 2], ["warp_row_tiles", "ot", 1], ["warp_col_tiles", "ot", 1], ["chunk", "ot", 4], ["offset", "ot", 8], ["offsetCS", "ot", 8], ["vec", "ot", 1], ["wmma_m", "ot", 16]]}, "result": [[6.832129e-05], 0, 3.3274292945861816, 1651747728.7337348], "version": 0.2, "tvm_version": "0.8.0"}
{"input": ["cuda -keys=cuda,gpu -max_num_threads=1024 -thread_warp_size=32", "fused_layer_norm_matmul_tensorcore.cuda", [["TENSOR", [1024, 512], "float16"], ["TENSOR", [1024], "float16"], ["TENSOR", [1024], "float16"], ["TENSOR", [256, 512], "float16"], 0.001953125], {}], "config": {"index": 1059, "code_hash": null, "entity": [["block_row_warps", "ot", 1], ["block_col_warps", "ot", 4], ["warp_row_tiles", "ot", 1], ["warp_col_tiles", "ot", 1], ["chunk", "ot", 2], ["offset", "ot", 8], ["offsetCS", "ot", 8], ["vec", "ot", 1], ["wmma_m", "ot", 32]]}, "result": [[6.955176299999999e-05], 0, 3.3316352367401123, 1651747731.5077298], "version": 0.2, "tvm_version": "0.8.0"}
{"input": ["cuda -keys=cuda,gpu -max_num_threads=1024 -thread_warp_size=32", "fused_layer_norm_matmul_tensorcore.cuda", [["TENSOR", [1024, 512], "float16"], ["TENSOR", [1024], "float16"], ["TENSOR", [1024], "float16"], ["TENSOR", [256, 512], "float16"], 0.001953125], {}], "config": {"index": 733, "code_hash": null, "entity": [["block_row_warps", "ot", 2], ["block_col_warps", "ot", 2], ["warp_row_tiles", "ot", 1], ["warp_col_tiles", "ot", 1], ["chunk", "ot", 2], ["offset", "ot", 0], ["offsetCS", "ot", 8], ["vec", "ot", 1], ["wmma_m", "ot", 32]]}, "result": [[0.000112422702], 0, 3.4294650554656982, 1651747734.4061992], "version": 0.2, "tvm_version": "0.8.0"}
{"input": ["cuda -keys=cuda,gpu -max_num_threads=1024 -thread_warp_size=32", "fused_layer_norm_matmul_tensorcore.cuda", [["TENSOR", [1024, 512], "float16"], ["TENSOR", [1024], "float16"], ["TENSOR", [1024], "float16"], ["TENSOR", [256, 512], "float16"], 0.001953125], {}], "config": {"index": 814, "code_hash": null, "entity": [["block_row_warps", "ot", 2], ["block_col_warps", "ot", 2], ["warp_row_tiles", "ot", 1], ["warp_col_tiles", "ot", 1], ["chunk", "ot", 4], ["offset", "ot", 0], ["offsetCS", "ot", 8], ["vec", "ot", 1], ["wmma_m", "ot", 32]]}, "result": [[0.00011431737], 0, 3.3468523025512695, 1651747737.2873166], "version": 0.2, "tvm_version": "0.8.0"}
{"input": ["cuda -keys=cuda,gpu -max_num_threads=1024 -thread_warp_size=32", "fused_layer_norm_matmul_tensorcore.cuda", [["TENSOR", [1024, 512], "float16"], ["TENSOR", [1024], "float16"], ["TENSOR", [1024], "float16"], ["TENSOR", [256, 512], "float16"], 0.001953125], {}], "config": {"index": 6325, "code_hash": null, "entity": [["block_row_warps", "ot", 2], ["block_col_warps", "ot", 4], ["warp_row_tiles", "ot", 1], ["warp_col_tiles", "ot", 1], ["chunk", "ot", 4], ["offset", "ot", 8], ["offsetCS", "ot", 8], ["vec", "ot", 1], ["wmma_m", "ot", 16]]}, "result": [[4.6419232999999995e-05], 0, 3.2396433353424072, 1651747739.9285538], "version": 0.2, "tvm_version": "0.8.0"}
{"input": ["cuda -keys=cuda,gpu -max_num_threads=1024 -thread_warp_size=32", "fused_layer_norm_matmul_tensorcore.cuda", [["TENSOR", [1024, 512], "float16"], ["TENSOR", [1024], "float16"], ["TENSOR", [1024], "float16"], ["TENSOR", [256, 512], "float16"], 0.001953125], {}], "config": {"index": 5677, "code_hash": null, "entity": [["block_row_warps", "ot", 2], ["block_col_warps", "ot", 4], ["warp_row_tiles", "ot", 1], ["warp_col_tiles", "ot", 1], ["chunk", "ot", 4], ["offset", "ot", 8], ["offsetCS", "ot", 0], ["vec", "ot", 1], ["wmma_m", "ot", 16]]}, "result": [[4.5267887e-05], 0, 3.2910547256469727, 1651747742.6638908], "version": 0.2, "tvm_version": "0.8.0"}
{"input": ["cuda -keys=cuda,gpu -max_num_threads=1024 -thread_warp_size=32", "fused_layer_norm_matmul_tensorcore.cuda", [["TENSOR", [1024, 512], "float16"], ["TENSOR", [1024], "float16"], ["TENSOR", [1024], "float16"], ["TENSOR", [256, 512], "float16"], 0.001953125], {}], "config": {"index": 5353, "code_hash": null, "entity": [["block_row_warps", "ot", 2], ["block_col_warps", "ot", 4], ["warp_row_tiles", "ot", 1], ["warp_col_tiles", "ot", 1], ["chunk", "ot", 4], ["offset", "ot", 0], ["offsetCS", "ot", 0], ["vec", "ot", 1], ["wmma_m", "ot", 16]]}, "result": [[8.2766989e-05], 0, 3.3150851726531982, 1651747745.4471006], "version": 0.2, "tvm_version": "0.8.0"}
{"input": ["cuda -keys=cuda,gpu -max_num_threads=1024 -thread_warp_size=32", "fused_layer_norm_matmul_tensorcore.cuda", [["TENSOR", [1024, 512], "float16"], ["TENSOR", [1024], "float16"], ["TENSOR", [1024], "float16"], ["TENSOR", [256, 512], "float16"], 0.001953125], {}], "config": {"index": 87, "code_hash": null, "entity": [["block_row_warps", "ot", 1], ["block_col_warps", "ot", 4], ["warp_row_tiles", "ot", 1], ["warp_col_tiles", "ot", 1], ["chunk", "ot", 2], ["offset", "ot", 0], ["offsetCS", "ot", 0], ["vec", "ot", 1], ["wmma_m", "ot", 32]]}, "result": [[8.071882999999999e-05], 0, 3.295229434967041, 1651747748.2070074], "version": 0.2, "tvm_version": "0.8.0"}
{"input": ["cuda -keys=cuda,gpu -max_num_threads=1024 -thread_warp_size=32", "fused_layer_norm_matmul_tensorcore.cuda", [["TENSOR", [1024, 512], "float16"], ["TENSOR", [1024], "float16"], ["TENSOR", [1024], "float16"], ["TENSOR", [256, 512], "float16"], 0.001953125], {}], "config": {"index": 1057, "code_hash": null, "entity": [["block_row_warps", "ot", 2], ["block_col_warps", "ot", 2], ["warp_row_tiles", "ot", 1], ["warp_col_tiles", "ot", 1], ["chunk", "ot", 2], ["offset", "ot", 8], ["offsetCS", "ot", 8], ["vec", "ot", 1], ["wmma_m", "ot", 32]]}, "result": [[0.000113417117], 0, 3.3814473152160645, 1651747751.1118264], "version": 0.2, "tvm_version": "0.8.0"}
{"input": ["cuda -keys=cuda,gpu -max_num_threads=1024 -thread_warp_size=32", "fused_layer_norm_matmul_tensorcore.cuda", [["TENSOR", [1024, 512], "float16"], ["TENSOR", [1024], "float16"], ["TENSOR", [1024], "float16"], ["TENSOR", [256, 512], "float16"], 0.001953125], {}], "config": {"index": 6001, "code_hash": null, "entity": [["block_row_warps", "ot", 2], ["block_col_warps", "ot", 4], ["warp_row_tiles", "ot", 1], ["warp_col_tiles", "ot", 1], ["chunk", "ot", 4], ["offset", "ot", 0], ["offsetCS", "ot", 8], ["vec", "ot", 1], ["wmma_m", "ot", 16]]}, "result": [[7.9395805e-05], 0, 3.352214813232422, 1651747753.856121], "version": 0.2, "tvm_version": "0.8.0"}
{"input": ["cuda -keys=cuda,gpu -max_num_threads=1024 -thread_warp_size=32", "fused_layer_norm_matmul_tensorcore.cuda", [["TENSOR", [1024, 512], "float16"], ["TENSOR", [1024], "float16"], ["TENSOR", [1024], "float16"], ["TENSOR", [256, 512], "float16"], 0.001953125], {}], "config": {"index": 10619, "code_hash": null, "entity": [["block_row_warps", "ot", 4], ["block_col_warps", "ot", 4], ["warp_row_tiles", "ot", 1], ["warp_col_tiles", "ot", 1], ["chunk", "ot", 8], ["offset", "ot", 0], ["offsetCS", "ot", 0], ["vec", "ot", 1], ["wmma_m", "ot", 8]]}, "result": [[8.2089707e-05], 0, 3.315962791442871, 1651747756.6196942], "version": 0.2, "tvm_version": "0.8.0"}
{"input": ["cuda -keys=cuda,gpu -max_num_threads=1024 -thread_warp_size=32", "fused_layer_norm_matmul_tensorcore.cuda", [["TENSOR", [1024, 512], "float16"], ["TENSOR", [1024], "float16"], ["TENSOR", [1024], "float16"], ["TENSOR", [256, 512], "float16"], 0.001953125], {}], "config": {"index": 735, "code_hash": null, "entity": [["block_row_warps", "ot", 1], ["block_col_warps", "ot", 4], ["warp_row_tiles", "ot", 1], ["warp_col_tiles", "ot", 1], ["chunk", "ot", 2], ["offset", "ot", 0], ["offsetCS", "ot", 8], ["vec", "ot", 1], ["wmma_m", "ot", 32]]}, "result": [[8.0791458e-05], 0, 3.385124683380127, 1651747759.461146], "version": 0.2, "tvm_version": "0.8.0"}
{"input": ["cuda -keys=cuda,gpu -max_num_threads=1024 -thread_warp_size=32", "fused_layer_norm_matmul_tensorcore.cuda", [["TENSOR", [1024, 512], "float16"], ["TENSOR", [1024], "float16"], ["TENSOR", [1024], "float16"], ["TENSOR", [256, 512], "float16"], 0.001953125], {}], "config": {"index": 6080, "code_hash": null, "entity": [["block_row_warps", "ot", 4], ["block_col_warps", "ot", 2], ["warp_row_tiles", "ot", 1], ["warp_col_tiles", "ot", 1], ["chunk", "ot", 8], ["offset", "ot", 0], ["offsetCS", "ot", 8], ["vec", "ot", 1], ["wmma_m", "ot", 16]]}, "result": [[0.00010538237899999999], 0, 3.4111883640289307, 1651747762.3008022], "version": 0.2, "tvm_version": "0.8.0"}
{"input": ["cuda -keys=cuda,gpu -max_num_threads=1024 -thread_warp_size=32", "fused_layer_norm_matmul_tensorcore.cuda", [["TENSOR", [1024, 512], "float16"], ["TENSOR", [1024], "float16"], ["TENSOR", [1024], "float16"], ["TENSOR", [256, 512], "float16"], 0.001953125], {}], "config": {"index": 11588, "code_hash": null, "entity": [["block_row_warps", "ot", 4], ["block_col_warps", "ot", 2], ["warp_row_tiles", "ot", 1], ["warp_col_tiles", "ot", 1], ["chunk", "ot", 8], ["offset", "ot", 8], ["offsetCS", "ot", 8], ["vec", "ot", 1], ["wmma_m", "ot", 8]]}, "result": [[4.659236e-05], 0, 2.755737543106079, 1651747766.2409189], "version": 0.2, "tvm_version": "0.8.0"}
{"input": ["cuda -keys=cuda,gpu -max_num_threads=1024 -thread_warp_size=32", "fused_layer_norm_matmul_tensorcore.cuda", [["TENSOR", [1024, 512], "float16"], ["TENSOR", [1024], "float16"], ["TENSOR", [1024], "float16"], ["TENSOR", [256, 512], "float16"], 0.001953125], {}], "config": {"index": 5998, "code_hash": null, "entity": [["block_row_warps", "ot", 2], ["block_col_warps", "ot", 2], ["warp_row_tiles", "ot", 1], ["warp_col_tiles", "ot", 1], ["chunk", "ot", 4], ["offset", "ot", 0], ["offsetCS", "ot", 8], ["vec", "ot", 1], ["wmma_m", "ot", 16]]}, "result": [[9.355135000000001e-05], 0, 3.3653600215911865, 1651747769.0986087], "version": 0.2, "tvm_version": "0.8.0"}
{"input": ["cuda -keys=cuda,gpu -max_num_threads=1024 -thread_warp_size=32", "fused_layer_norm_matmul_tensorcore.cuda", [["TENSOR", [1024, 512], "float16"], ["TENSOR", [1024], "float16"], ["TENSOR", [1024], "float16"], ["TENSOR", [256, 512], "float16"], 0.001953125], {}], "config": {"index": 811, "code_hash": null, "entity": [["block_row_warps", "ot", 2], ["block_col_warps", "ot", 1], ["warp_row_tiles", "ot", 1], ["warp_col_tiles", "ot", 1], ["chunk", "ot", 4], ["offset", "ot", 0], ["offsetCS", "ot", 8], ["vec", "ot", 1], ["wmma_m", "ot", 32]]}, "result": [[0.000133814656], 0, 3.4695024490356445, 1651747772.1400783], "version": 0.2, "tvm_version": "0.8.0"}
{"input": ["cuda -keys=cuda,gpu -max_num_threads=1024 -thread_warp_size=32", "fused_layer_norm_matmul_tensorcore.cuda", [["TENSOR", [1024, 512], "float16"], ["TENSOR", [1024], "float16"], ["TENSOR", [1024], "float16"], ["TENSOR", [256, 512], "float16"], 0.001953125], {}], "config": {"index": 1053, "code_hash": null, "entity": [["block_row_warps", "ot", 1], ["block_col_warps", "ot", 1], ["warp_row_tiles", "ot", 1], ["warp_col_tiles", "ot", 1], ["chunk", "ot", 2], ["offset", "ot", 8], ["offsetCS", "ot", 8], ["vec", "ot", 1], ["wmma_m", "ot", 32]]}, "result": [[0.00012619554999999998], 0, 3.4205164909362793, 1651747775.1237998], "version": 0.2, "tvm_version": "0.8.0"}
