python/models/swin_transformer/kernel_configs/swin_transformer_te_slice_1_28_28_256_[1, 1]_2.log
{"i": [["[\"te_slice\", 1, 28, 28, 256, [1, 1], 2, \"float16\"]", "cuda -keys=cuda,gpu -max_num_threads=1024 -model=unknown -thread_warp_size=32", [-1, 16, 64, 49152, 2147483647, 1024, 8, 32], "", 0, []], [[], [["FU", 1, [0, 1, 2, 3]], ["SP", 1, 0, 50176, [4], 1], ["AN", 1, 0, 5], ["AN", 1, 1, 6]]]], "r": [[1.19967e-05, 1.20047e-05, 1.20053e-05], 0, 2.73696, 1668065409], "v": "v0.6"}
{"i": [["[\"te_slice\", 1, 28, 28, 256, [1, 1], 2, \"float16\"]", "cuda -keys=cuda,gpu -max_num_threads=1024 -model=unknown -thread_warp_size=32", [-1, 16, 64, 49152, 2147483647, 1024, 8, 32], "", 0, []], [[], [["FU", 1, [0, 1, 2, 3]], ["SP", 1, 0, 50176, [1], 1], ["AN", 1, 0, 5], ["AN", 1, 1, 6]]]], "r": [[3.99324e-05, 3.9944e-05, 3.99434e-05], 0, 0.976226, 1668065408], "v": "v0.6"}
{"i": [["[\"te_slice\", 1, 28, 28, 256, [1, 1], 2, \"float16\"]", "cuda -keys=cuda,gpu -max_num_threads=1024 -model=unknown -thread_warp_size=32", [-1, 16, 64, 49152, 2147483647, 1024, 8, 32], "", 0, []], [[], [["FU", 1, [0, 1, 2, 3]], ["SP", 1, 0, 50176, [14], 1], ["AN", 1, 0, 5], ["AN", 1, 1, 6]]]], "r": [[5.48782e-06, 5.51395e-06, 5.49521e-06], 0, 1.65329, 1668065408], "v": "v0.6"}
{"i": [["[\"te_slice\", 1, 28, 28, 256, [1, 1], 2, \"float16\"]", "cuda -keys=cuda,gpu -max_num_threads=1024 -model=unknown -thread_warp_size=32", [-1, 16, 64, 49152, 2147483647, 1024, 8, 32], "", 0, []], [[], [["FU", 1, [0, 1, 2, 3]], ["SP", 1, 0, 50176, [8], 1], ["AN", 1, 0, 5], ["AN", 1, 1, 6]]]], "r": [[7.3909e-06, 7.40004e-06, 7.40391e-06], 0, 0.584895, 1668065407], "v": "v0.6"}
{"i": [["[\"te_slice\", 1, 28, 28, 256, [1, 1], 2, \"float16\"]", "cuda -keys=cuda,gpu -max_num_threads=1024 -model=unknown -thread_warp_size=32", [-1, 16, 64, 49152, 2147483647, 1024, 8, 32], "", 0, []], [[], [["FU", 1, [0, 1, 2, 3]], ["SP", 1, 0, 50176, [16], 1], ["AN", 1, 0, 5], ["AN", 1, 1, 6]]]], "r": [[4.90453e-06, 4.91821e-06, 4.91519e-06], 0, 1.32096, 1668065408], "v": "v0.6"}
{"i": [["[\"te_slice\", 1, 28, 28, 256, [1, 1], 2, \"float16\"]", "cuda -keys=cuda,gpu -max_num_threads=1024 -model=unknown -thread_warp_size=32", [-1, 16, 64, 49152, 2147483647, 1024, 8, 32], "", 0, []], [[], [["FU", 1, [0, 1, 2, 3]], ["SP", 1, 0, 50176, [49], 1], ["AN", 1, 0, 5], ["AN", 1, 1, 6]]]], "r": [[3.28235e-06, 3.28241e-06, 3.28173e-06], 0, 2.05146, 1668065409], "v": "v0.6"}
{"i": [["[\"te_slice\", 1, 28, 28, 256, [1, 1], 2, \"float16\"]", "cuda -keys=cuda,gpu -max_num_threads=1024 -model=unknown -thread_warp_size=32", [-1, 16, 64, 49152, 2147483647, 1024, 8, 32], "", 0, []], [[], [["FU", 1, [0, 1, 2, 3]], ["SP", 1, 0, 50176, [28], 1], ["AN", 1, 0, 5], ["AN", 1, 1, 6]]]], "r": [[3.87391e-06, 3.87609e-06, 3.87732e-06], 0, 2.39907, 1668065409], "v": "v0.6"}
{"i": [["[\"te_slice\", 1, 28, 28, 256, [1, 1], 2, \"float16\"]", "cuda -keys=cuda,gpu -max_num_threads=1024 -model=unknown -thread_warp_size=32", [-1, 16, 64, 49152, 2147483647, 1024, 8, 32], "", 0, []], [[], [["FU", 1, [0, 1, 2, 3]], ["SP", 1, 0, 50176, [2], 1], ["AN", 1, 0, 5], ["AN", 1, 1, 6]]]], "r": [[2.1396e-05, 2.14206e-05, 2.14211e-05], 0, 3.46237, 1668065410], "v": "v0.6"}
{"i": [["[\"te_slice\", 1, 28, 28, 256, [1, 1], 2, \"float16\"]", "cuda -keys=cuda,gpu -max_num_threads=1024 -model=unknown -thread_warp_size=32", [-1, 16, 64, 49152, 2147483647, 1024, 8, 32], "", 0, []], [[], [["FU", 1, [0, 1, 2, 3]], ["SP", 1, 0, 50176, [32], 1], ["AN", 1, 0, 5], ["AN", 1, 1, 6]]]], "r": [[3.71983e-06, 3.72604e-06, 3.72739e-06], 0, 3.11484, 1668065410], "v": "v0.6"}
{"i": [["[\"te_slice\", 1, 28, 28, 256, [1, 1], 2, \"float16\"]", "cuda -keys=cuda,gpu -max_num_threads=1024 -model=unknown -thread_warp_size=32", [-1, 16, 64, 49152, 2147483647, 1024, 8, 32], "", 0, []], [[], [["FU", 1, [0, 1, 2, 3]], ["SP", 1, 0, 50176, [64], 1], ["AN", 1, 0, 5], ["AN", 1, 1, 6]]]], "r": [[3.21194e-06, 3.22428e-06, 3.22242e-06], 0, 3.79386, 1668065411], "v": "v0.6"}
{"i": [["[\"te_slice\", 1, 28, 28, 256, [1, 1], 2, \"float16\"]", "cuda -keys=cuda,gpu -max_num_threads=1024 -model=unknown -thread_warp_size=32", [-1, 16, 64, 49152, 2147483647, 1024, 8, 32], "", 0, []], [[], [["FU", 1, [0, 1, 2, 3]], ["SP", 1, 0, 50176, [7], 1], ["AN", 1, 0, 5], ["AN", 1, 1, 6]]]], "r": [[7.95415e-06, 7.96505e-06, 7.9671e-06], 0, 4.15922, 1668065411], "v": "v0.6"}
{"i": [["[\"te_slice\", 1, 28, 28, 256, [1, 1], 2, \"float16\"]", "cuda -keys=cuda,gpu -max_num_threads=1024 -model=unknown -thread_warp_size=32", [-1, 16, 64, 49152, 2147483647, 1024, 8, 32], "", 0, []], [[], [["FU", 1, [0, 1, 2, 3]], ["SP", 1, 0, 50176, [56], 1], ["AN", 1, 0, 5], ["AN", 1, 1, 6]]]], "r": [[3.40798e-06, 3.42033e-06, 3.42078e-06], 0, 4.49921, 1668065411], "v": "v0.6"}
