python/models/swin_transformer/kernel_configs/swin_transformer_softmax_norm_1568_49.log
{"i": [["[\"softmax_norm\", 1568, 49]", "cuda -keys=cuda,gpu -max_num_threads=1024 -model=unknown -thread_warp_size=32", [-1, 16, 64, 49152, 2147483647, 1024, 8, 32], "", 0, []], [[], [["FU", 2, [0, 1, 2]], ["SP", 2, 0, 3764768, [32], 1], ["AN", 2, 0, 5], ["AN", 2, 1, 6]]]], "r": [[9.00396e-05, 9.00191e-05, 9.00102e-05], 0, 1.41026, 1668059952], "v": "v0.6"}
{"i": [["[\"softmax_norm\", 1568, 49]", "cuda -keys=cuda,gpu -max_num_threads=1024 -model=unknown -thread_warp_size=32", [-1, 16, 64, 49152, 2147483647, 1024, 8, 32], "", 0, []], [[], [["FU", 2, [0, 1, 2]], ["SP", 2, 0, 3764768, [8], 1], ["AN", 2, 0, 5], ["AN", 2, 1, 6]]]], "r": [[0.000351805, 0.000351762, 0.000351785], 0, 3.783, 1668059954], "v": "v0.6"}
{"i": [["[\"softmax_norm\", 1568, 49]", "cuda -keys=cuda,gpu -max_num_threads=1024 -model=unknown -thread_warp_size=32", [-1, 16, 64, 49152, 2147483647, 1024, 8, 32], "", 0, []], [[], [["FU", 2, [0, 1, 2]], ["SP", 2, 0, 3764768, [28], 1], ["AN", 2, 0, 5], ["AN", 2, 1, 6]]]], "r": [[0.000102487, 0.000102473, 0.000102464], 0, 0.828324, 1668059951], "v": "v0.6"}
{"i": [["[\"softmax_norm\", 1568, 49]", "cuda -keys=cuda,gpu -max_num_threads=1024 -model=unknown -thread_warp_size=32", [-1, 16, 64, 49152, 2147483647, 1024, 8, 32], "", 0, []], [[], [["FU", 2, [0, 1, 2]], ["SP", 2, 0, 3764768, [16], 1], ["AN", 2, 0, 5], ["AN", 2, 1, 6]]]], "r": [[0.000177219, 0.000177194, 0.000177219], 0, 3.17237, 1668059953], "v": "v0.6"}
{"i": [["[\"softmax_norm\", 1568, 49]", "cuda -keys=cuda,gpu -max_num_threads=1024 -model=unknown -thread_warp_size=32", [-1, 16, 64, 49152, 2147483647, 1024, 8, 32], "", 0, []], [[], [["FU", 2, [0, 1, 2]], ["SP", 2, 0, 3764768, [1], 1], ["AN", 2, 0, 5], ["AN", 2, 1, 6]]]], "r": [[0.00279445, 0.0027944, 0.00279416], 0, 2.03461, 1668059952], "v": "v0.6"}
{"i": [["[\"softmax_norm\", 1568, 49]", "cuda -keys=cuda,gpu -max_num_threads=1024 -model=unknown -thread_warp_size=32", [-1, 16, 64, 49152, 2147483647, 1024, 8, 32], "", 0, []], [[], [["FU", 2, [0, 1, 2]], ["SP", 2, 0, 3764768, [4], 1], ["AN", 2, 0, 5], ["AN", 2, 1, 6]]]], "r": [[0.000700881, 0.000700787, 0.000700749], 0, 2.60103, 1668059953], "v": "v0.6"}
{"i": [["[\"softmax_norm\", 1568, 49]", "cuda -keys=cuda,gpu -max_num_threads=1024 -model=unknown -thread_warp_size=32", [-1, 16, 64, 49152, 2147483647, 1024, 8, 32], "", 0, []], [[], [["FU", 2, [0, 1, 2]], ["SP", 2, 0, 3764768, [2], 1], ["AN", 2, 0, 5], ["AN", 2, 1, 6]]]], "r": [[0.00139887, 0.00139879, 0.00139902], 0, 4.93932, 1668059955], "v": "v0.6"}
{"i": [["[\"softmax_norm\", 1568, 49]", "cuda -keys=cuda,gpu -max_num_threads=1024 -model=unknown -thread_warp_size=32", [-1, 16, 64, 49152, 2147483647, 1024, 8, 32], "", 0, []], [[], [["FU", 2, [0, 1, 2]], ["SP", 2, 0, 3764768, [7], 1], ["AN", 2, 0, 5], ["AN", 2, 1, 6]]]], "r": [[0.000401712, 0.000401686, 0.000401606], 0, 5.55054, 1668059956], "v": "v0.6"}
{"i": [["[\"softmax_norm\", 1568, 49]", "cuda -keys=cuda,gpu -max_num_threads=1024 -model=unknown -thread_warp_size=32", [-1, 16, 64, 49152, 2147483647, 1024, 8, 32], "", 0, []], [[], [["FU", 2, [0, 1, 2]], ["SP", 2, 0, 3764768, [14], 1], ["AN", 2, 0, 5], ["AN", 2, 1, 6]]]], "r": [[0.000202313, 0.000202327, 0.000202317], 0, 4.36144, 1668059955], "v": "v0.6"}
{"i": [["[\"softmax_norm\", 1568, 49]", "cuda -keys=cuda,gpu -max_num_threads=1024 -model=unknown -thread_warp_size=32", [-1, 16, 64, 49152, 2147483647, 1024, 8, 32], "", 0, []], [[], [["FU", 2, [0, 1, 2]], ["SP", 2, 0, 3764768, [49], 1], ["AN", 2, 0, 5], ["AN", 2, 1, 6]]]], "r": [[5.93924e-05, 5.93971e-05, 5.93988e-05], 0, 6.12678, 1668059956], "v": "v0.6"}
{"i": [["[\"softmax_norm\", 1568, 49]", "cuda -keys=cuda,gpu -max_num_threads=1024 -model=unknown -thread_warp_size=32", [-1, 16, 64, 49152, 2147483647, 1024, 8, 32], "", 0, []], [[], [["FU", 2, [0, 1, 2]], ["SP", 2, 0, 3764768, [56], 1], ["AN", 2, 0, 5], ["AN", 2, 1, 6]]]], "r": [[5.22339e-05, 5.22352e-05, 5.22446e-05], 0, 6.72132, 1668059957], "v": "v0.6"}
{"i": [["[\"softmax_norm\", 1568, 49]", "cuda -keys=cuda,gpu -max_num_threads=1024 -model=unknown -thread_warp_size=32", [-1, 16, 64, 49152, 2147483647, 1024, 8, 32], "", 0, []], [[], [["FU", 2, [0, 1, 2]], ["SP", 2, 0, 3764768, [56], 1], ["AN", 2, 0, 5], ["AN", 2, 1, 6]]]], "r": [[5.23371e-05, 5.23571e-05, 5.23606e-05], 0, 2.02917, 1668061706], "v": "v0.6"}
{"i": [["[\"softmax_norm\", 1568, 49]", "cuda -keys=cuda,gpu -max_num_threads=1024 -model=unknown -thread_warp_size=32", [-1, 16, 64, 49152, 2147483647, 1024, 8, 32], "", 0, []], [[], [["FU", 2, [0, 1, 2]], ["SP", 2, 0, 3764768, [16], 1], ["AN", 2, 0, 5], ["AN", 2, 1, 6]]]], "r": [[0.00017732, 0.000177328, 0.000177377], 0, 0.832954, 1668061705], "v": "v0.6"}
{"i": [["[\"softmax_norm\", 1568, 49]", "cuda -keys=cuda,gpu -max_num_threads=1024 -model=unknown -thread_warp_size=32", [-1, 16, 64, 49152, 2147483647, 1024, 8, 32], "", 0, []], [[], [["FU", 2, [0, 1, 2]], ["SP", 2, 0, 3764768, [7], 1], ["AN", 2, 0, 5], ["AN", 2, 1, 6]]]], "r": [[0.000401632, 0.000401645, 0.000401611], 0, 4.37686, 1668061709], "v": "v0.6"}
{"i": [["[\"softmax_norm\", 1568, 49]", "cuda -keys=cuda,gpu -max_num_threads=1024 -model=unknown -thread_warp_size=32", [-1, 16, 64, 49152, 2147483647, 1024, 8, 32], "", 0, []], [[], [["FU", 2, [0, 1, 2]], ["SP", 2, 0, 3764768, [4], 1], ["AN", 2, 0, 5], ["AN", 2, 1, 6]]]], "r": [[0.0007009, 0.000700787, 0.000700723], 0, 2.58926, 1668061707], "v": "v0.6"}
{"i": [["[\"softmax_norm\", 1568, 49]", "cuda -keys=cuda,gpu -max_num_threads=1024 -model=unknown -thread_warp_size=32", [-1, 16, 64, 49152, 2147483647, 1024, 8, 32], "", 0, []], [[], [["FU", 2, [0, 1, 2]], ["SP", 2, 0, 3764768, [14], 1], ["AN", 2, 0, 5], ["AN", 2, 1, 6]]]], "r": [[0.000202347, 0.000202312, 0.000202302], 0, 1.38906, 1668061706], "v": "v0.6"}
{"i": [["[\"softmax_norm\", 1568, 49]", "cuda -keys=cuda,gpu -max_num_threads=1024 -model=unknown -thread_warp_size=32", [-1, 16, 64, 49152, 2147483647, 1024, 8, 32], "", 0, []], [[], [["FU", 2, [0, 1, 2]], ["SP", 2, 0, 3764768, [32], 1], ["AN", 2, 0, 5], ["AN", 2, 1, 6]]]], "r": [[9.01232e-05, 9.01061e-05, 9.01225e-05], 0, 3.17427, 1668061707], "v": "v0.6"}
{"i": [["[\"softmax_norm\", 1568, 49]", "cuda -keys=cuda,gpu -max_num_threads=1024 -model=unknown -thread_warp_size=32", [-1, 16, 64, 49152, 2147483647, 1024, 8, 32], "", 0, []], [[], [["FU", 2, [0, 1, 2]], ["SP", 2, 0, 3764768, [8], 1], ["AN", 2, 0, 5], ["AN", 2, 1, 6]]]], "r": [[0.000351808, 0.000351811, 0.000351818], 0, 3.79656, 1668061708], "v": "v0.6"}
{"i": [["[\"softmax_norm\", 1568, 49]", "cuda -keys=cuda,gpu -max_num_threads=1024 -model=unknown -thread_warp_size=32", [-1, 16, 64, 49152, 2147483647, 1024, 8, 32], "", 0, []], [[], [["FU", 2, [0, 1, 2]], ["SP", 2, 0, 3764768, [1], 1], ["AN", 2, 0, 5], ["AN", 2, 1, 6]]]], "r": [[0.00279409, 0.0027939, 0.00279416], 0, 6.15298, 1668061710], "v": "v0.6"}
{"i": [["[\"softmax_norm\", 1568, 49]", "cuda -keys=cuda,gpu -max_num_threads=1024 -model=unknown -thread_warp_size=32", [-1, 16, 64, 49152, 2147483647, 1024, 8, 32], "", 0, []], [[], [["FU", 2, [0, 1, 2]], ["SP", 2, 0, 3764768, [49], 1], ["AN", 2, 0, 5], ["AN", 2, 1, 6]]]], "r": [[5.93456e-05, 5.93382e-05, 5.93495e-05], 0, 5.56171, 1668061710], "v": "v0.6"}
{"i": [["[\"softmax_norm\", 1568, 49]", "cuda -keys=cuda,gpu -max_num_threads=1024 -model=unknown -thread_warp_size=32", [-1, 16, 64, 49152, 2147483647, 1024, 8, 32], "", 0, []], [[], [["FU", 2, [0, 1, 2]], ["SP", 2, 0, 3764768, [2], 1], ["AN", 2, 0, 5], ["AN", 2, 1, 6]]]], "r": [[0.0013988, 0.00139872, 0.00139895], 0, 6.73907, 1668061711], "v": "v0.6"}
{"i": [["[\"softmax_norm\", 1568, 49]", "cuda -keys=cuda,gpu -max_num_threads=1024 -model=unknown -thread_warp_size=32", [-1, 16, 64, 49152, 2147483647, 1024, 8, 32], "", 0, []], [[], [["FU", 2, [0, 1, 2]], ["SP", 2, 0, 3764768, [28], 1], ["AN", 2, 0, 5], ["AN", 2, 1, 6]]]], "r": [[0.000102449, 0.000102425, 0.000102438], 0, 4.94489, 1668061709], "v": "v0.6"}
{"i": [["[\"softmax_norm\", 1568, 49]", "cuda -keys=cuda,gpu -max_num_threads=1024 -model=unknown -thread_warp_size=32", [-1, 16, 64, 49152, 2147483647, 1024, 8, 32], "", 0, []], [[], [["FU", 2, [0, 1]], ["SP", 2, 0, 76832, [16], 1], ["AN", 2, 0, 5], ["AN", 2, 1, 6]]]], "r": [[6.34417e-06, 6.35057e-06, 6.35256e-06], 0, 1.59434, 1668919695], "v": "v0.6"}
{"i": [["[\"softmax_norm\", 1568, 49]", "cuda -keys=cuda,gpu -max_num_threads=1024 -model=unknown -thread_warp_size=32", [-1, 16, 64, 49152, 2147483647, 1024, 8, 32], "", 0, []], [[], [["FU", 2, [0, 1]], ["SP", 2, 0, 76832, [1], 1], ["AN", 2, 0, 5], ["AN", 2, 1, 6]]]], "r": [[5.97966e-05, 5.97963e-05, 5.9787e-05], 0, 1.24244, 1668919695], "v": "v0.6"}
{"i": [["[\"softmax_norm\", 1568, 49]", "cuda -keys=cuda,gpu -max_num_threads=1024 -model=unknown -thread_warp_size=32", [-1, 16, 64, 49152, 2147483647, 1024, 8, 32], "", 0, []], [[], [["FU", 2, [0, 1]], ["SP", 2, 0, 76832, [32], 1], ["AN", 2, 0, 5], ["AN", 2, 1, 6]]]], "r": [[4.47593e-06, 4.48373e-06, 4.48283e-06], 0, 0.574815, 1668919694], "v": "v0.6"}
{"i": [["[\"softmax_norm\", 1568, 49]", "cuda -keys=cuda,gpu -max_num_threads=1024 -model=unknown -thread_warp_size=32", [-1, 16, 64, 49152, 2147483647, 1024, 8, 32], "", 0, []], [[], [["FU", 2, [0, 1]], ["SP", 2, 0, 76832, [7], 1], ["AN", 2, 0, 5], ["AN", 2, 1, 6]]]], "r": [[1.08826e-05, 1.08816e-05, 1.08817e-05], 0, 0.896312, 1668919695], "v": "v0.6"}
{"i": [["[\"softmax_norm\", 1568, 49]", "cuda -keys=cuda,gpu -max_num_threads=1024 -model=unknown -thread_warp_size=32", [-1, 16, 64, 49152, 2147483647, 1024, 8, 32], "", 0, []], [[], [["FU", 2, [0, 1]], ["SP", 2, 0, 76832, [56], 1], ["AN", 2, 0, 5], ["AN", 2, 1, 6]]]], "r": [[3.56096e-06, 3.56105e-06, 3.56094e-06], 0, 1.96748, 1668919696], "v": "v0.6"}
{"i": [["[\"softmax_norm\", 1568, 49]", "cuda -keys=cuda,gpu -max_num_threads=1024 -model=unknown -thread_warp_size=32", [-1, 16, 64, 49152, 2147483647, 1024, 8, 32], "", 0, []], [[], [["FU", 2, [0, 1]], ["SP", 2, 0, 76832, [4], 1], ["AN", 2, 0, 5], ["AN", 2, 1, 6]]]], "r": [[1.70307e-05, 1.70283e-05, 1.70157e-05], 0, 2.29133, 1668919696], "v": "v0.6"}
{"i": [["[\"softmax_norm\", 1568, 49]", "cuda -keys=cuda,gpu -max_num_threads=1024 -model=unknown -thread_warp_size=32", [-1, 16, 64, 49152, 2147483647, 1024, 8, 32], "", 0, []], [[], [["FU", 2, [0, 1]], ["SP", 2, 0, 76832, [8], 1], ["AN", 2, 0, 5], ["AN", 2, 1, 6]]]], "r": [[9.77924e-06, 9.78355e-06, 9.78334e-06], 0, 2.78097, 1668919697], "v": "v0.6"}
{"i": [["[\"softmax_norm\", 1568, 49]", "cuda -keys=cuda,gpu -max_num_threads=1024 -model=unknown -thread_warp_size=32", [-1, 16, 64, 49152, 2147483647, 1024, 8, 32], "", 0, []], [[], [["FU", 2, [0, 1]], ["SP", 2, 0, 76832, [14], 1], ["AN", 2, 0, 5], ["AN", 2, 1, 6]]]], "r": [[6.72041e-06, 6.74687e-06, 6.74635e-06], 0, 3.36417, 1668919697], "v": "v0.6"}
{"i": [["[\"softmax_norm\", 1568, 49]", "cuda -keys=cuda,gpu -max_num_threads=1024 -model=unknown -thread_warp_size=32", [-1, 16, 64, 49152, 2147483647, 1024, 8, 32], "", 0, []], [[], [["FU", 2, [0, 1]], ["SP", 2, 0, 76832, [49], 1], ["AN", 2, 0, 5], ["AN", 2, 1, 6]]]], "r": [[3.86895e-06, 3.87592e-06, 3.87338e-06], 0, 3.02996, 1668919697], "v": "v0.6"}
{"i": [["[\"softmax_norm\", 1568, 49]", "cuda -keys=cuda,gpu -max_num_threads=1024 -model=unknown -thread_warp_size=32", [-1, 16, 64, 49152, 2147483647, 1024, 8, 32], "", 0, []], [[], [["FU", 2, [0, 1]], ["SP", 2, 0, 76832, [2], 1], ["AN", 2, 0, 5], ["AN", 2, 1, 6]]]], "r": [[3.12765e-05, 3.12851e-05, 3.12915e-05], 0, 4.04092, 1668919698], "v": "v0.6"}
{"i": [["[\"softmax_norm\", 1568, 49]", "cuda -keys=cuda,gpu -max_num_threads=1024 -model=unknown -thread_warp_size=32", [-1, 16, 64, 49152, 2147483647, 1024, 8, 32], "", 0, []], [[], [["FU", 2, [0, 1]], ["SP", 2, 0, 76832, [28], 1], ["AN", 2, 0, 5], ["AN", 2, 1, 6]]]], "r": [[4.64431e-06, 4.65058e-06, 4.64947e-06], 0, 3.71758, 1668919698], "v": "v0.6"}
