python/models/swin_transformer/kernel_configs/swin_transformer_add_1_7_7_1024_float16.log
{"i": [["[\"add\", 1, 7, 7, 1024, \"float16\"]", "cuda -keys=cuda,gpu -max_num_threads=1024 -model=unknown -thread_warp_size=32", [-1, 16, 64, 49152, 2147483647, 1024, 8, 32], "", 0, []], [[], [["FU", 2, [0, 1, 2, 3]], ["SP", 2, 0, 50176, [56], 1], ["AN", 2, 0, 5], ["AN", 2, 1, 6]]]], "r": [[3.19597e-06, 3.19996e-06, 3.19518e-06], 0, 1.3284, 1668060397], "v": "v0.6"}
{"i": [["[\"add\", 1, 7, 7, 1024, \"float16\"]", "cuda -keys=cuda,gpu -max_num_threads=1024 -model=unknown -thread_warp_size=32", [-1, 16, 64, 49152, 2147483647, 1024, 8, 32], "", 0, []], [[], [["FU", 2, [0, 1, 2, 3]], ["SP", 2, 0, 50176, [2], 1], ["AN", 2, 0, 5], ["AN", 2, 1, 6]]]], "r": [[2.14451e-05, 2.143e-05, 2.14421e-05], 0, 1.66917, 1668060398], "v": "v0.6"}
{"i": [["[\"add\", 1, 7, 7, 1024, \"float16\"]", "cuda -keys=cuda,gpu -max_num_threads=1024 -model=unknown -thread_warp_size=32", [-1, 16, 64, 49152, 2147483647, 1024, 8, 32], "", 0, []], [[], [["FU", 2, [0, 1, 2, 3]], ["SP", 2, 0, 50176, [64], 1], ["AN", 2, 0, 5], ["AN", 2, 1, 6]]]], "r": [[3.05884e-06, 3.06348e-06, 3.06045e-06], 0, 2.37756, 1668060398], "v": "v0.6"}
{"i": [["[\"add\", 1, 7, 7, 1024, \"float16\"]", "cuda -keys=cuda,gpu -max_num_threads=1024 -model=unknown -thread_warp_size=32", [-1, 16, 64, 49152, 2147483647, 1024, 8, 32], "", 0, []], [[], [["FU", 2, [0, 1, 2, 3]], ["SP", 2, 0, 50176, [14], 1], ["AN", 2, 0, 5], ["AN", 2, 1, 6]]]], "r": [[5.3006e-06, 5.29497e-06, 5.29726e-06], 0, 0.977854, 1668060397], "v": "v0.6"}
{"i": [["[\"add\", 1, 7, 7, 1024, \"float16\"]", "cuda -keys=cuda,gpu -max_num_threads=1024 -model=unknown -thread_warp_size=32", [-1, 16, 64, 49152, 2147483647, 1024, 8, 32], "", 0, []], [[], [["FU", 2, [0, 1, 2, 3]], ["SP", 2, 0, 50176, [32], 1], ["AN", 2, 0, 5], ["AN", 2, 1, 6]]]], "r": [[3.63453e-06, 3.63579e-06, 3.6374e-06], 0, 0.596624, 1668060397], "v": "v0.6"}
{"i": [["[\"add\", 1, 7, 7, 1024, \"float16\"]", "cuda -keys=cuda,gpu -max_num_threads=1024 -model=unknown -thread_warp_size=32", [-1, 16, 64, 49152, 2147483647, 1024, 8, 32], "", 0, []], [[], [["FU", 2, [0, 1, 2, 3]], ["SP", 2, 0, 50176, [1], 1], ["AN", 2, 0, 5], ["AN", 2, 1, 6]]]], "r": [[4.01964e-05, 4.0157e-05, 4.01531e-05], 0, 2.03218, 1668060398], "v": "v0.6"}
{"i": [["[\"add\", 1, 7, 7, 1024, \"float16\"]", "cuda -keys=cuda,gpu -max_num_threads=1024 -model=unknown -thread_warp_size=32", [-1, 16, 64, 49152, 2147483647, 1024, 8, 32], "", 0, []], [[], [["FU", 2, [0, 1, 2, 3]], ["SP", 2, 0, 50176, [4], 1], ["AN", 2, 0, 5], ["AN", 2, 1, 6]]]], "r": [[1.20379e-05, 1.20407e-05, 1.20334e-05], 0, 2.72115, 1668060399], "v": "v0.6"}
{"i": [["[\"add\", 1, 7, 7, 1024, \"float16\"]", "cuda -keys=cuda,gpu -max_num_threads=1024 -model=unknown -thread_warp_size=32", [-1, 16, 64, 49152, 2147483647, 1024, 8, 32], "", 0, []], [[], [["FU", 2, [0, 1, 2, 3]], ["SP", 2, 0, 50176, [7], 1], ["AN", 2, 0, 5], ["AN", 2, 1, 6]]]], "r": [[7.98491e-06, 7.98278e-06, 7.98139e-06], 0, 3.40955, 1668060400], "v": "v0.6"}
{"i": [["[\"add\", 1, 7, 7, 1024, \"float16\"]", "cuda -keys=cuda,gpu -max_num_threads=1024 -model=unknown -thread_warp_size=32", [-1, 16, 64, 49152, 2147483647, 1024, 8, 32], "", 0, []], [[], [["FU", 2, [0, 1, 2, 3]], ["SP", 2, 0, 50176, [49], 1], ["AN", 2, 0, 5], ["AN", 2, 1, 6]]]], "r": [[3.26962e-06, 3.26968e-06, 3.26703e-06], 0, 3.76592, 1668060400], "v": "v0.6"}
{"i": [["[\"add\", 1, 7, 7, 1024, \"float16\"]", "cuda -keys=cuda,gpu -max_num_threads=1024 -model=unknown -thread_warp_size=32", [-1, 16, 64, 49152, 2147483647, 1024, 8, 32], "", 0, []], [[], [["FU", 2, [0, 1, 2, 3]], ["SP", 2, 0, 50176, [8], 1], ["AN", 2, 0, 5], ["AN", 2, 1, 6]]]], "r": [[7.26428e-06, 7.27344e-06, 7.26662e-06], 0, 3.09748, 1668060399], "v": "v0.6"}
{"i": [["[\"add\", 1, 7, 7, 1024, \"float16\"]", "cuda -keys=cuda,gpu -max_num_threads=1024 -model=unknown -thread_warp_size=32", [-1, 16, 64, 49152, 2147483647, 1024, 8, 32], "", 0, []], [[], [["FU", 2, [0, 1, 2, 3]], ["SP", 2, 0, 50176, [28], 1], ["AN", 2, 0, 5], ["AN", 2, 1, 6]]]], "r": [[3.99283e-06, 3.99279e-06, 3.98982e-06], 0, 4.47305, 1668060401], "v": "v0.6"}
{"i": [["[\"add\", 1, 7, 7, 1024, \"float16\"]", "cuda -keys=cuda,gpu -max_num_threads=1024 -model=unknown -thread_warp_size=32", [-1, 16, 64, 49152, 2147483647, 1024, 8, 32], "", 0, []], [[], [["FU", 2, [0, 1, 2, 3]], ["SP", 2, 0, 50176, [16], 1], ["AN", 2, 0, 5], ["AN", 2, 1, 6]]]], "r": [[5.04379e-06, 5.05038e-06, 5.04539e-06], 0, 4.13383, 1668060400], "v": "v0.6"}
{"i": [["[\"add\", 1, 7, 7, 1024, \"float16\"]", "cuda -keys=cuda,gpu -max_num_threads=1024 -model=unknown -thread_warp_size=32", [-1, 16, 64, 49152, 2147483647, 1024, 8, 32], "", 0, []], [[], [["FU", 2, [0, 1, 2, 3]], ["SP", 2, 0, 50176, [64], 1], ["AN", 2, 0, 5], ["AN", 2, 1, 6]]]], "r": [[3.07823e-06, 3.08566e-06, 3.08358e-06], 0, 2.00723, 1668061458], "v": "v0.6"}
{"i": [["[\"add\", 1, 7, 7, 1024, \"float16\"]", "cuda -keys=cuda,gpu -max_num_threads=1024 -model=unknown -thread_warp_size=32", [-1, 16, 64, 49152, 2147483647, 1024, 8, 32], "", 0, []], [[], [["FU", 2, [0, 1, 2, 3]], ["SP", 2, 0, 50176, [8], 1], ["AN", 2, 0, 5], ["AN", 2, 1, 6]]]], "r": [[7.30981e-06, 7.30762e-06, 7.31254e-06], 0, 2.34565, 1668061459], "v": "v0.6"}
{"i": [["[\"add\", 1, 7, 7, 1024, \"float16\"]", "cuda -keys=cuda,gpu -max_num_threads=1024 -model=unknown -thread_warp_size=32", [-1, 16, 64, 49152, 2147483647, 1024, 8, 32], "", 0, []], [[], [["FU", 2, [0, 1, 2, 3]], ["SP", 2, 0, 50176, [14], 1], ["AN", 2, 0, 5], ["AN", 2, 1, 6]]]], "r": [[5.32623e-06, 5.32509e-06, 5.32952e-06], 0, 0.955253, 1668061457], "v": "v0.6"}
{"i": [["[\"add\", 1, 7, 7, 1024, \"float16\"]", "cuda -keys=cuda,gpu -max_num_threads=1024 -model=unknown -thread_warp_size=32", [-1, 16, 64, 49152, 2147483647, 1024, 8, 32], "", 0, []], [[], [["FU", 2, [0, 1, 2, 3]], ["SP", 2, 0, 50176, [16], 1], ["AN", 2, 0, 5], ["AN", 2, 1, 6]]]], "r": [[4.88842e-06, 4.88925e-06, 4.88886e-06], 0, 1.29505, 1668061458], "v": "v0.6"}
{"i": [["[\"add\", 1, 7, 7, 1024, \"float16\"]", "cuda -keys=cuda,gpu -max_num_threads=1024 -model=unknown -thread_warp_size=32", [-1, 16, 64, 49152, 2147483647, 1024, 8, 32], "", 0, []], [[], [["FU", 2, [0, 1, 2, 3]], ["SP", 2, 0, 50176, [49], 1], ["AN", 2, 0, 5], ["AN", 2, 1, 6]]]], "r": [[3.45808e-06, 3.45847e-06, 3.46346e-06], 0, 0.578684, 1668061457], "v": "v0.6"}
{"i": [["[\"add\", 1, 7, 7, 1024, \"float16\"]", "cuda -keys=cuda,gpu -max_num_threads=1024 -model=unknown -thread_warp_size=32", [-1, 16, 64, 49152, 2147483647, 1024, 8, 32], "", 0, []], [[], [["FU", 2, [0, 1, 2, 3]], ["SP", 2, 0, 50176, [28], 1], ["AN", 2, 0, 5], ["AN", 2, 1, 6]]]], "r": [[3.9804e-06, 3.97974e-06, 3.98054e-06], 0, 1.62586, 1668061458], "v": "v0.6"}
{"i": [["[\"add\", 1, 7, 7, 1024, \"float16\"]", "cuda -keys=cuda,gpu -max_num_threads=1024 -model=unknown -thread_warp_size=32", [-1, 16, 64, 49152, 2147483647, 1024, 8, 32], "", 0, []], [[], [["FU", 2, [0, 1, 2, 3]], ["SP", 2, 0, 50176, [7], 1], ["AN", 2, 0, 5], ["AN", 2, 1, 6]]]], "r": [[7.97444e-06, 7.97422e-06, 7.97406e-06], 0, 3.05385, 1668061460], "v": "v0.6"}
{"i": [["[\"add\", 1, 7, 7, 1024, \"float16\"]", "cuda -keys=cuda,gpu -max_num_threads=1024 -model=unknown -thread_warp_size=32", [-1, 16, 64, 49152, 2147483647, 1024, 8, 32], "", 0, []], [[], [["FU", 2, [0, 1, 2, 3]], ["SP", 2, 0, 50176, [56], 1], ["AN", 2, 0, 5], ["AN", 2, 1, 6]]]], "r": [[3.36751e-06, 3.36795e-06, 3.37289e-06], 0, 2.67978, 1668061459], "v": "v0.6"}
{"i": [["[\"add\", 1, 7, 7, 1024, \"float16\"]", "cuda -keys=cuda,gpu -max_num_threads=1024 -model=unknown -thread_warp_size=32", [-1, 16, 64, 49152, 2147483647, 1024, 8, 32], "", 0, []], [[], [["FU", 2, [0, 1, 2, 3]], ["SP", 2, 0, 50176, [1], 1], ["AN", 2, 0, 5], ["AN", 2, 1, 6]]]], "r": [[4.01327e-05, 4.01362e-05, 4.01196e-05], 0, 3.38528, 1668061460], "v": "v0.6"}
{"i": [["[\"add\", 1, 7, 7, 1024, \"float16\"]", "cuda -keys=cuda,gpu -max_num_threads=1024 -model=unknown -thread_warp_size=32", [-1, 16, 64, 49152, 2147483647, 1024, 8, 32], "", 0, []], [[], [["FU", 2, [0, 1, 2, 3]], ["SP", 2, 0, 50176, [32], 1], ["AN", 2, 0, 5], ["AN", 2, 1, 6]]]], "r": [[3.63944e-06, 3.64325e-06, 3.64269e-06], 0, 4.12583, 1668061461], "v": "v0.6"}
{"i": [["[\"add\", 1, 7, 7, 1024, \"float16\"]", "cuda -keys=cuda,gpu -max_num_threads=1024 -model=unknown -thread_warp_size=32", [-1, 16, 64, 49152, 2147483647, 1024, 8, 32], "", 0, []], [[], [["FU", 2, [0, 1, 2, 3]], ["SP", 2, 0, 50176, [2], 1], ["AN", 2, 0, 5], ["AN", 2, 1, 6]]]], "r": [[2.13334e-05, 2.13342e-05, 2.1336e-05], 0, 3.72811, 1668061460], "v": "v0.6"}
{"i": [["[\"add\", 1, 7, 7, 1024, \"float16\"]", "cuda -keys=cuda,gpu -max_num_threads=1024 -model=unknown -thread_warp_size=32", [-1, 16, 64, 49152, 2147483647, 1024, 8, 32], "", 0, []], [[], [["FU", 2, [0, 1, 2, 3]], ["SP", 2, 0, 50176, [4], 1], ["AN", 2, 0, 5], ["AN", 2, 1, 6]]]], "r": [[1.19914e-05, 1.19953e-05, 1.19994e-05], 0, 4.46084, 1668061461], "v": "v0.6"}
{"i": [["[\"add\", 1, 7, 7, 1024, \"float16\"]", "cuda -keys=cuda,gpu -max_num_threads=1024 -model=unknown -thread_warp_size=32", [-1, 16, 64, 49152, 2147483647, 1024, 8, 32], "", 0, []], [[], [["FU", 2, [0, 1, 2, 3]], ["SP", 2, 0, 50176, [4], 1], ["AN", 2, 0, 5], ["AN", 2, 1, 6]]]], "r": [[1.19918e-05, 1.19984e-05, 1.20033e-05], 0, 0.923463, 1668061782], "v": "v0.6"}
{"i": [["[\"add\", 1, 7, 7, 1024, \"float16\"]", "cuda -keys=cuda,gpu -max_num_threads=1024 -model=unknown -thread_warp_size=32", [-1, 16, 64, 49152, 2147483647, 1024, 8, 32], "", 0, []], [[], [["FU", 2, [0, 1, 2, 3]], ["SP", 2, 0, 50176, [8], 1], ["AN", 2, 0, 5], ["AN", 2, 1, 6]]]], "r": [[7.43845e-06, 7.44189e-06, 7.44072e-06], 0, 0.590296, 1668061782], "v": "v0.6"}
{"i": [["[\"add\", 1, 7, 7, 1024, \"float16\"]", "cuda -keys=cuda,gpu -max_num_threads=1024 -model=unknown -thread_warp_size=32", [-1, 16, 64, 49152, 2147483647, 1024, 8, 32], "", 0, []], [[], [["FU", 2, [0, 1, 2, 3]], ["SP", 2, 0, 50176, [7], 1], ["AN", 2, 0, 5], ["AN", 2, 1, 6]]]], "r": [[7.87699e-06, 7.87648e-06, 7.87459e-06], 0, 1.59838, 1668061783], "v": "v0.6"}
{"i": [["[\"add\", 1, 7, 7, 1024, \"float16\"]", "cuda -keys=cuda,gpu -max_num_threads=1024 -model=unknown -thread_warp_size=32", [-1, 16, 64, 49152, 2147483647, 1024, 8, 32], "", 0, []], [[], [["FU", 2, [0, 1, 2, 3]], ["SP", 2, 0, 50176, [1], 1], ["AN", 2, 0, 5], ["AN", 2, 1, 6]]]], "r": [[4.01484e-05, 4.01549e-05, 4.01467e-05], 0, 1.24978, 1668061783], "v": "v0.6"}
{"i": [["[\"add\", 1, 7, 7, 1024, \"float16\"]", "cuda -keys=cuda,gpu -max_num_threads=1024 -model=unknown -thread_warp_size=32", [-1, 16, 64, 49152, 2147483647, 1024, 8, 32], "", 0, []], [[], [["FU", 2, [0, 1, 2, 3]], ["SP", 2, 0, 50176, [56], 1], ["AN", 2, 0, 5], ["AN", 2, 1, 6]]]], "r": [[3.40174e-06, 3.40803e-06, 3.41291e-06], 0, 2.62647, 1668061784], "v": "v0.6"}
{"i": [["[\"add\", 1, 7, 7, 1024, \"float16\"]", "cuda -keys=cuda,gpu -max_num_threads=1024 -model=unknown -thread_warp_size=32", [-1, 16, 64, 49152, 2147483647, 1024, 8, 32], "", 0, []], [[], [["FU", 2, [0, 1, 2, 3]], ["SP", 2, 0, 50176, [49], 1], ["AN", 2, 0, 5], ["AN", 2, 1, 6]]]], "r": [[3.31484e-06, 3.31586e-06, 3.31711e-06], 0, 1.98216, 1668061783], "v": "v0.6"}
{"i": [["[\"add\", 1, 7, 7, 1024, \"float16\"]", "cuda -keys=cuda,gpu -max_num_threads=1024 -model=unknown -thread_warp_size=32", [-1, 16, 64, 49152, 2147483647, 1024, 8, 32], "", 0, []], [[], [["FU", 2, [0, 1, 2, 3]], ["SP", 2, 0, 50176, [16], 1], ["AN", 2, 0, 5], ["AN", 2, 1, 6]]]], "r": [[5.14931e-06, 5.14875e-06, 5.15406e-06], 0, 2.29087, 1668061784], "v": "v0.6"}
{"i": [["[\"add\", 1, 7, 7, 1024, \"float16\"]", "cuda -keys=cuda,gpu -max_num_threads=1024 -model=unknown -thread_warp_size=32", [-1, 16, 64, 49152, 2147483647, 1024, 8, 32], "", 0, []], [[], [["FU", 2, [0, 1, 2, 3]], ["SP", 2, 0, 50176, [2], 1], ["AN", 2, 0, 5], ["AN", 2, 1, 6]]]], "r": [[2.13741e-05, 2.13813e-05, 2.13757e-05], 0, 3.34879, 1668061785], "v": "v0.6"}
{"i": [["[\"add\", 1, 7, 7, 1024, \"float16\"]", "cuda -keys=cuda,gpu -max_num_threads=1024 -model=unknown -thread_warp_size=32", [-1, 16, 64, 49152, 2147483647, 1024, 8, 32], "", 0, []], [[], [["FU", 2, [0, 1, 2, 3]], ["SP", 2, 0, 50176, [64], 1], ["AN", 2, 0, 5], ["AN", 2, 1, 6]]]], "r": [[3.0974e-06, 3.09928e-06, 3.09997e-06], 0, 3.00085, 1668061784], "v": "v0.6"}
{"i": [["[\"add\", 1, 7, 7, 1024, \"float16\"]", "cuda -keys=cuda,gpu -max_num_threads=1024 -model=unknown -thread_warp_size=32", [-1, 16, 64, 49152, 2147483647, 1024, 8, 32], "", 0, []], [[], [["FU", 2, [0, 1, 2, 3]], ["SP", 2, 0, 50176, [14], 1], ["AN", 2, 0, 5], ["AN", 2, 1, 6]]]], "r": [[5.37828e-06, 5.38361e-06, 5.38167e-06], 0, 4.41161, 1668061786], "v": "v0.6"}
{"i": [["[\"add\", 1, 7, 7, 1024, \"float16\"]", "cuda -keys=cuda,gpu -max_num_threads=1024 -model=unknown -thread_warp_size=32", [-1, 16, 64, 49152, 2147483647, 1024, 8, 32], "", 0, []], [[], [["FU", 2, [0, 1, 2, 3]], ["SP", 2, 0, 50176, [32], 1], ["AN", 2, 0, 5], ["AN", 2, 1, 6]]]], "r": [[3.64495e-06, 3.64445e-06, 3.64369e-06], 0, 4.07236, 1668061785], "v": "v0.6"}
{"i": [["[\"add\", 1, 7, 7, 1024, \"float16\"]", "cuda -keys=cuda,gpu -max_num_threads=1024 -model=unknown -thread_warp_size=32", [-1, 16, 64, 49152, 2147483647, 1024, 8, 32], "", 0, []], [[], [["FU", 2, [0, 1, 2, 3]], ["SP", 2, 0, 50176, [28], 1], ["AN", 2, 0, 5], ["AN", 2, 1, 6]]]], "r": [[3.98389e-06, 3.98754e-06, 3.98004e-06], 0, 3.70129, 1668061785], "v": "v0.6"}
{"i": [["[\"add\", 1, 7, 7, 1024, \"float16\"]", "cuda -keys=cuda,gpu -max_num_threads=1024 -model=unknown -thread_warp_size=32", [-1, 16, 64, 49152, 2147483647, 1024, 8, 32], "", 0, []], [[], [["FU", 2, [0, 1, 2, 3]], ["SP", 2, 0, 50176, [1], 1], ["AN", 2, 0, 5], ["AN", 2, 1, 6]]]], "r": [[4.01682e-05, 4.01623e-05, 4.01655e-05], 0, 1.99211, 1668061865], "v": "v0.6"}
{"i": [["[\"add\", 1, 7, 7, 1024, \"float16\"]", "cuda -keys=cuda,gpu -max_num_threads=1024 -model=unknown -thread_warp_size=32", [-1, 16, 64, 49152, 2147483647, 1024, 8, 32], "", 0, []], [[], [["FU", 2, [0, 1, 2, 3]], ["SP", 2, 0, 50176, [8], 1], ["AN", 2, 0, 5], ["AN", 2, 1, 6]]]], "r": [[7.32678e-06, 7.32273e-06, 7.32434e-06], 0, 0.951902, 1668061864], "v": "v0.6"}
{"i": [["[\"add\", 1, 7, 7, 1024, \"float16\"]", "cuda -keys=cuda,gpu -max_num_threads=1024 -model=unknown -thread_warp_size=32", [-1, 16, 64, 49152, 2147483647, 1024, 8, 32], "", 0, []], [[], [["FU", 2, [0, 1, 2, 3]], ["SP", 2, 0, 50176, [49], 1], ["AN", 2, 0, 5], ["AN", 2, 1, 6]]]], "r": [[3.42627e-06, 3.42396e-06, 3.42776e-06], 0, 1.60163, 1668061865], "v": "v0.6"}
{"i": [["[\"add\", 1, 7, 7, 1024, \"float16\"]", "cuda -keys=cuda,gpu -max_num_threads=1024 -model=unknown -thread_warp_size=32", [-1, 16, 64, 49152, 2147483647, 1024, 8, 32], "", 0, []], [[], [["FU", 2, [0, 1, 2, 3]], ["SP", 2, 0, 50176, [4], 1], ["AN", 2, 0, 5], ["AN", 2, 1, 6]]]], "r": [[1.20528e-05, 1.20561e-05, 1.20594e-05], 0, 0.596608, 1668061864], "v": "v0.6"}
{"i": [["[\"add\", 1, 7, 7, 1024, \"float16\"]", "cuda -keys=cuda,gpu -max_num_threads=1024 -model=unknown -thread_warp_size=32", [-1, 16, 64, 49152, 2147483647, 1024, 8, 32], "", 0, []], [[], [["FU", 2, [0, 1, 2, 3]], ["SP", 2, 0, 50176, [28], 1], ["AN", 2, 0, 5], ["AN", 2, 1, 6]]]], "r": [[3.98179e-06, 3.97533e-06, 3.97959e-06], 0, 1.27885, 1668061864], "v": "v0.6"}
{"i": [["[\"add\", 1, 7, 7, 1024, \"float16\"]", "cuda -keys=cuda,gpu -max_num_threads=1024 -model=unknown -thread_warp_size=32", [-1, 16, 64, 49152, 2147483647, 1024, 8, 32], "", 0, []], [[], [["FU", 2, [0, 1, 2, 3]], ["SP", 2, 0, 50176, [56], 1], ["AN", 2, 0, 5], ["AN", 2, 1, 6]]]], "r": [[3.1721e-06, 3.17256e-06, 3.17202e-06], 0, 2.33099, 1668061865], "v": "v0.6"}
{"i": [["[\"add\", 1, 7, 7, 1024, \"float16\"]", "cuda -keys=cuda,gpu -max_num_threads=1024 -model=unknown -thread_warp_size=32", [-1, 16, 64, 49152, 2147483647, 1024, 8, 32], "", 0, []], [[], [["FU", 2, [0, 1, 2, 3]], ["SP", 2, 0, 50176, [2], 1], ["AN", 2, 0, 5], ["AN", 2, 1, 6]]]], "r": [[2.14679e-05, 2.14611e-05, 2.14682e-05], 0, 2.67125, 1668061866], "v": "v0.6"}
{"i": [["[\"add\", 1, 7, 7, 1024, \"float16\"]", "cuda -keys=cuda,gpu -max_num_threads=1024 -model=unknown -thread_warp_size=32", [-1, 16, 64, 49152, 2147483647, 1024, 8, 32], "", 0, []], [[], [["FU", 2, [0, 1, 2, 3]], ["SP", 2, 0, 50176, [16], 1], ["AN", 2, 0, 5], ["AN", 2, 1, 6]]]], "r": [[5.03889e-06, 5.03768e-06, 5.04629e-06], 0, 3.0361, 1668061866], "v": "v0.6"}
{"i": [["[\"add\", 1, 7, 7, 1024, \"float16\"]", "cuda -keys=cuda,gpu -max_num_threads=1024 -model=unknown -thread_warp_size=32", [-1, 16, 64, 49152, 2147483647, 1024, 8, 32], "", 0, []], [[], [["FU", 2, [0, 1, 2, 3]], ["SP", 2, 0, 50176, [32], 1], ["AN", 2, 0, 5], ["AN", 2, 1, 6]]]], "r": [[3.61744e-06, 3.61323e-06, 3.61386e-06], 0, 3.3753, 1668061867], "v": "v0.6"}
{"i": [["[\"add\", 1, 7, 7, 1024, \"float16\"]", "cuda -keys=cuda,gpu -max_num_threads=1024 -model=unknown -thread_warp_size=32", [-1, 16, 64, 49152, 2147483647, 1024, 8, 32], "", 0, []], [[], [["FU", 2, [0, 1, 2, 3]], ["SP", 2, 0, 50176, [64], 1], ["AN", 2, 0, 5], ["AN", 2, 1, 6]]]], "r": [[3.22499e-06, 3.22171e-06, 3.22455e-06], 0, 4.44123, 1668061868], "v": "v0.6"}
{"i": [["[\"add\", 1, 7, 7, 1024, \"float16\"]", "cuda -keys=cuda,gpu -max_num_threads=1024 -model=unknown -thread_warp_size=32", [-1, 16, 64, 49152, 2147483647, 1024, 8, 32], "", 0, []], [[], [["FU", 2, [0, 1, 2, 3]], ["SP", 2, 0, 50176, [14], 1], ["AN", 2, 0, 5], ["AN", 2, 1, 6]]]], "r": [[5.26363e-06, 5.26358e-06, 5.26052e-06], 0, 3.71895, 1668061867], "v": "v0.6"}
{"i": [["[\"add\", 1, 7, 7, 1024, \"float16\"]", "cuda -keys=cuda,gpu -max_num_threads=1024 -model=unknown -thread_warp_size=32", [-1, 16, 64, 49152, 2147483647, 1024, 8, 32], "", 0, []], [[], [["FU", 2, [0, 1, 2, 3]], ["SP", 2, 0, 50176, [7], 1], ["AN", 2, 0, 5], ["AN", 2, 1, 6]]]], "r": [[8.11402e-06, 8.11342e-06, 8.11306e-06], 0, 4.109, 1668061867], "v": "v0.6"}
