python/models/swin_transformer/kernel_configs/swin_transformer_fused_window_reverse_roll_add_1_14_14_512_0_7_float16.log
{"i": [["[\"fused_window_reverse_roll_add\", 1, 14, 14, 512, 0, 7, \"float16\"]", "cuda -keys=cuda,gpu -max_num_threads=1024 -model=unknown -thread_warp_size=32", [-1, 16, 64, 49152, 2147483647, 1024, 8, 32], "", 0, []], [[], [["FU", 2, [0, 1, 2, 3]], ["SP", 2, 0, 100352, [8], 1], ["AN", 2, 0, 5], ["AN", 2, 1, 6]]]], "r": [[1.20259e-05, 1.20264e-05, 1.20213e-05, 1.20229e-05, 1.20202e-05, 1.20214e-05, 1.20256e-05, 1.21531e-05, 1.20208e-05, 1.20211e-05], 0, 5.10646, 1652003291], "v": "v0.6"}
{"i": [["[\"fused_window_reverse_roll_add\", 1, 14, 14, 512, 0, 7, \"float16\"]", "cuda -keys=cuda,gpu -max_num_threads=1024 -model=unknown -thread_warp_size=32", [-1, 16, 64, 49152, 2147483647, 1024, 8, 32], "", 0, []], [[], [["FU", 2, [0, 1, 2, 3]], ["SP", 2, 0, 100352, [7], 1], ["AN", 2, 0, 5], ["AN", 2, 1, 6]]]], "r": [[1.34721e-05, 1.34721e-05, 1.34738e-05, 1.34723e-05, 1.3474e-05, 1.34731e-05, 1.34741e-05, 1.3474e-05, 1.34718e-05, 1.34744e-05], 0, 15.1084, 1652003301], "v": "v0.6"}
{"i": [["[\"fused_window_reverse_roll_add\", 1, 14, 14, 512, 0, 7, \"float16\"]", "cuda -keys=cuda,gpu -max_num_threads=1024 -model=unknown -thread_warp_size=32", [-1, 16, 64, 49152, 2147483647, 1024, 8, 32], "", 0, []], [[], [["FU", 2, [0, 1, 2, 3]], ["SP", 2, 0, 100352, [2], 1], ["AN", 2, 0, 5], ["AN", 2, 1, 6]]]], "r": [[4.00378e-05, 4.00445e-05, 4.00369e-05, 4.00395e-05, 4.00413e-05, 4.00455e-05, 4.00368e-05, 4.00362e-05, 4.00386e-05, 4.00505e-05], 0, 10.5701, 1652003296], "v": "v0.6"}
{"i": [["[\"fused_window_reverse_roll_add\", 1, 14, 14, 512, 0, 7, \"float16\"]", "cuda -keys=cuda,gpu -max_num_threads=1024 -model=unknown -thread_warp_size=32", [-1, 16, 64, 49152, 2147483647, 1024, 8, 32], "", 0, []], [[], [["FU", 2, [0, 1, 2, 3]], ["SP", 2, 0, 100352, [49], 1], ["AN", 2, 0, 5], ["AN", 2, 1, 6]]]], "r": [[5.01618e-06, 4.17955e-06, 4.45141e-06, 4.11356e-06, 4.11703e-06, 4.63483e-06, 4.85241e-06, 4.12182e-06, 4.68786e-06, 4.09611e-06], 0, 26.3409, 1652003312], "v": "v0.6"}
{"i": [["[\"fused_window_reverse_roll_add\", 1, 14, 14, 512, 0, 7, \"float16\"]", "cuda -keys=cuda,gpu -max_num_threads=1024 -model=unknown -thread_warp_size=32", [-1, 16, 64, 49152, 2147483647, 1024, 8, 32], "", 0, []], [[], [["FU", 2, [0, 1, 2, 3]], ["SP", 2, 0, 100352, [4], 1], ["AN", 2, 0, 5], ["AN", 2, 1, 6]]]], "r": [[2.13406e-05, 2.13452e-05, 2.13375e-05, 2.13418e-05, 2.13365e-05, 2.1336e-05, 2.1342e-05, 2.13544e-05, 2.13434e-05, 2.13425e-05], 0, 31.3331, 1652003317], "v": "v0.6"}
{"i": [["[\"fused_window_reverse_roll_add\", 1, 14, 14, 512, 0, 7, \"float16\"]", "cuda -keys=cuda,gpu -max_num_threads=1024 -model=unknown -thread_warp_size=32", [-1, 16, 64, 49152, 2147483647, 1024, 8, 32], "", 0, []], [[], [["FU", 2, [0, 1, 2, 3]], ["SP", 2, 0, 100352, [1], 1], ["AN", 2, 0, 5], ["AN", 2, 1, 6]]]], "r": [[7.71811e-05, 7.71636e-05, 7.71599e-05, 7.71581e-05, 7.71602e-05, 7.7172e-05, 7.71879e-05, 7.7156e-05, 7.71574e-05, 7.71584e-05], 0, 20.709, 1652003306], "v": "v0.6"}
{"i": [["[\"fused_window_reverse_roll_add\", 1, 14, 14, 512, 0, 7, \"float16\"]", "cuda -keys=cuda,gpu -max_num_threads=1024 -model=unknown -thread_warp_size=32", [-1, 16, 64, 49152, 2147483647, 1024, 8, 32], "", 0, []], [[], [["FU", 2, [0, 1, 2, 3]], ["SP", 2, 0, 100352, [16], 1], ["AN", 2, 0, 5], ["AN", 2, 1, 6]]]], "r": [[7.39208e-06, 7.39454e-06, 8.12456e-06, 7.39322e-06, 7.52624e-06, 7.40818e-06, 7.48882e-06, 7.58638e-06, 7.39205e-06, 7.4727e-06], 0, 35.5332, 1652003321], "v": "v0.6"}
{"i": [["[\"fused_window_reverse_roll_add\", 1, 14, 14, 512, 0, 7, \"float16\"]", "cuda -keys=cuda,gpu -max_num_threads=1024 -model=unknown -thread_warp_size=32", [-1, 16, 64, 49152, 2147483647, 1024, 8, 32], "", 0, []], [[], [["FU", 2, [0, 1, 2, 3]], ["SP", 2, 0, 100352, [14], 1], ["AN", 2, 0, 5], ["AN", 2, 1, 6]]]], "r": [[8.12838e-06, 8.12843e-06, 8.13061e-06, 8.13181e-06, 8.12899e-06, 8.13007e-06, 8.12974e-06, 8.12905e-06, 8.12924e-06, 8.13079e-06], 0, 39.2389, 1652003325], "v": "v0.6"}
{"i": [["[\"fused_window_reverse_roll_add\", 1, 14, 14, 512, 0, 7, \"float16\"]", "cuda -keys=cuda,gpu -max_num_threads=1024 -model=unknown -thread_warp_size=32", [-1, 16, 64, 49152, 2147483647, 1024, 8, 32], "", 0, []], [[], [["FU", 2, [0, 1, 2, 3]], ["SP", 2, 0, 100352, [64], 1], ["AN", 2, 0, 5], ["AN", 2, 1, 6]]]], "r": [[4.22363e-06, 4.08042e-06, 4.47331e-06, 5.11739e-06, 4.20791e-06, 4.17974e-06, 4.26051e-06, 4.28982e-06, 4.78577e-06, 4.46472e-06], 0, 45.0941, 1652003331], "v": "v0.6"}
{"i": [["[\"fused_window_reverse_roll_add\", 1, 14, 14, 512, 0, 7, \"float16\"]", "cuda -keys=cuda,gpu -max_num_threads=1024 -model=unknown -thread_warp_size=32", [-1, 16, 64, 49152, 2147483647, 1024, 8, 32], "", 0, []], [[], [["FU", 2, [0, 1, 2, 3]], ["SP", 2, 0, 100352, [32], 1], ["AN", 2, 0, 5], ["AN", 2, 1, 6]]]], "r": [[5.32367e-06, 5.39736e-06, 5.28882e-06, 5.67951e-06, 5.3602e-06, 5.16588e-06, 5.43838e-06, 5.13657e-06, 5.61549e-06, 5.45659e-06], 0, 50.7537, 1652003337], "v": "v0.6"}
{"i": [["[\"fused_window_reverse_roll_add\", 1, 14, 14, 512, 0, 7, \"float16\"]", "cuda -keys=cuda,gpu -max_num_threads=1024 -model=unknown -thread_warp_size=32", [-1, 16, 64, 49152, 2147483647, 1024, 8, 32], "", 0, []], [[], [["FU", 2, [0, 1, 2, 3]], ["SP", 2, 0, 100352, [28], 1], ["AN", 2, 0, 5], ["AN", 2, 1, 6]]]], "r": [[5.33881e-06, 5.57871e-06, 5.3145e-06, 5.31443e-06, 5.81475e-06, 5.34775e-06, 5.74658e-06, 5.34378e-06, 5.31461e-06, 5.51966e-06], 0, 60.3582, 1652003346], "v": "v0.6"}
{"i": [["[\"fused_window_reverse_roll_add\", 1, 14, 14, 512, 0, 7, \"float16\"]", "cuda -keys=cuda,gpu -max_num_threads=1024 -model=unknown -thread_warp_size=32", [-1, 16, 64, 49152, 2147483647, 1024, 8, 32], "", 0, []], [[], [["FU", 2, [0, 1, 2, 3]], ["SP", 2, 0, 100352, [56], 1], ["AN", 2, 0, 5], ["AN", 2, 1, 6]]]], "r": [[5.38812e-06, 3.99951e-06, 5.45773e-06, 5.29578e-06, 4.09909e-06, 4.15596e-06, 4.34973e-06, 4.00613e-06, 5.47814e-06, 5.43665e-06], 0, 56.5847, 1652003343], "v": "v0.6"}
