python/models/swin_transformer/kernel_configs/swin_transformer_permute_attn_q_k_v_1_56_56_128_7_4_float16.log
{"i": [["[\"permute_attn_q_k_v\", 1, 56, 56, 128, 7, 4, \"float16\"]", "cuda -keys=cuda,gpu -max_num_threads=1024 -model=unknown -thread_warp_size=32", [-1, 16, 64, 49152, 2147483647, 1024, 8, 32], "", 0, []], [[], [["FU", 1, [0, 1, 2, 3]], ["SP", 1, 0, 401408, [1], 1], ["AN", 1, 0, 5], ["AN", 1, 1, 6]]]], "r": [[0.000300471, 0.000300449, 0.000300437], 0, 2.84625, 1668016826], "v": "v0.6"}
{"i": [["[\"permute_attn_q_k_v\", 1, 56, 56, 128, 7, 4, \"float16\"]", "cuda -keys=cuda,gpu -max_num_threads=1024 -model=unknown -thread_warp_size=32", [-1, 16, 64, 49152, 2147483647, 1024, 8, 32], "", 0, []], [[], [["FU", 1, [0, 1, 2, 3]], ["SP", 1, 0, 401408, [28], 1], ["AN", 1, 0, 5], ["AN", 1, 1, 6]]]], "r": [[1.34694e-05, 1.34717e-05, 1.34728e-05], 0, 2.13673, 1668016825], "v": "v0.6"}
{"i": [["[\"permute_attn_q_k_v\", 1, 56, 56, 128, 7, 4, \"float16\"]", "cuda -keys=cuda,gpu -max_num_threads=1024 -model=unknown -thread_warp_size=32", [-1, 16, 64, 49152, 2147483647, 1024, 8, 32], "", 0, []], [[], [["FU", 1, [0, 1, 2, 3]], ["SP", 1, 0, 401408, [2], 1], ["AN", 1, 0, 5], ["AN", 1, 1, 6]]]], "r": [[0.000151621, 0.000151627, 0.000151661], 0, 1.36583, 1668016825], "v": "v0.6"}
{"i": [["[\"permute_attn_q_k_v\", 1, 56, 56, 128, 7, 4, \"float16\"]", "cuda -keys=cuda,gpu -max_num_threads=1024 -model=unknown -thread_warp_size=32", [-1, 16, 64, 49152, 2147483647, 1024, 8, 32], "", 0, []], [[], [["FU", 1, [0, 1, 2, 3]], ["SP", 1, 0, 401408, [16], 1], ["AN", 1, 0, 5], ["AN", 1, 1, 6]]]], "r": [[2.16129e-05, 2.16182e-05, 2.16294e-05], 0, 0.605774, 1668016824], "v": "v0.6"}
{"i": [["[\"permute_attn_q_k_v\", 1, 56, 56, 128, 7, 4, \"float16\"]", "cuda -keys=cuda,gpu -max_num_threads=1024 -model=unknown -thread_warp_size=32", [-1, 16, 64, 49152, 2147483647, 1024, 8, 32], "", 0, []], [[], [["FU", 1, [0, 1, 2, 3]], ["SP", 1, 0, 401408, [64], 1], ["AN", 1, 0, 5], ["AN", 1, 1, 6]]]], "r": [[7.19922e-06, 7.21342e-06, 7.21268e-06], 0, 1.72856, 1668016825], "v": "v0.6"}
{"i": [["[\"permute_attn_q_k_v\", 1, 56, 56, 128, 7, 4, \"float16\"]", "cuda -keys=cuda,gpu -max_num_threads=1024 -model=unknown -thread_warp_size=32", [-1, 16, 64, 49152, 2147483647, 1024, 8, 32], "", 0, []], [[], [["FU", 1, [0, 1, 2, 3]], ["SP", 1, 0, 401408, [32], 1], ["AN", 1, 0, 5], ["AN", 1, 1, 6]]]], "r": [[1.21878e-05, 1.21959e-05, 1.21926e-05], 0, 2.4937, 1668016826], "v": "v0.6"}
{"i": [["[\"permute_attn_q_k_v\", 1, 56, 56, 128, 7, 4, \"float16\"]", "cuda -keys=cuda,gpu -max_num_threads=1024 -model=unknown -thread_warp_size=32", [-1, 16, 64, 49152, 2147483647, 1024, 8, 32], "", 0, []], [[], [["FU", 1, [0, 1, 2, 3]], ["SP", 1, 0, 401408, [14], 1], ["AN", 1, 0, 5], ["AN", 1, 1, 6]]]], "r": [[2.42614e-05, 2.42801e-05, 2.42766e-05], 0, 1.01808, 1668016824], "v": "v0.6"}
{"i": [["[\"permute_attn_q_k_v\", 1, 56, 56, 128, 7, 4, \"float16\"]", "cuda -keys=cuda,gpu -max_num_threads=1024 -model=unknown -thread_warp_size=32", [-1, 16, 64, 49152, 2147483647, 1024, 8, 32], "", 0, []], [[], [["FU", 1, [0, 1, 2, 3]], ["SP", 1, 0, 401408, [49], 1], ["AN", 1, 0, 5], ["AN", 1, 1, 6]]]], "r": [[8.66028e-06, 8.66883e-06, 8.67047e-06], 0, 3.61825, 1668016827], "v": "v0.6"}
{"i": [["[\"permute_attn_q_k_v\", 1, 56, 56, 128, 7, 4, \"float16\"]", "cuda -keys=cuda,gpu -max_num_threads=1024 -model=unknown -thread_warp_size=32", [-1, 16, 64, 49152, 2147483647, 1024, 8, 32], "", 0, []], [[], [["FU", 1, [0, 1, 2, 3]], ["SP", 1, 0, 401408, [4], 1], ["AN", 1, 0, 5], ["AN", 1, 1, 6]]]], "r": [[7.73067e-05, 7.73124e-05, 7.7331e-05], 0, 3.98148, 1668016827], "v": "v0.6"}
{"i": [["[\"permute_attn_q_k_v\", 1, 56, 56, 128, 7, 4, \"float16\"]", "cuda -keys=cuda,gpu -max_num_threads=1024 -model=unknown -thread_warp_size=32", [-1, 16, 64, 49152, 2147483647, 1024, 8, 32], "", 0, []], [[], [["FU", 1, [0, 1, 2, 3]], ["SP", 1, 0, 401408, [8], 1], ["AN", 1, 0, 5], ["AN", 1, 1, 6]]]], "r": [[3.99028e-05, 3.9923e-05, 3.99243e-05], 0, 3.2344, 1668016826], "v": "v0.6"}
{"i": [["[\"permute_attn_q_k_v\", 1, 56, 56, 128, 7, 4, \"float16\"]", "cuda -keys=cuda,gpu -max_num_threads=1024 -model=unknown -thread_warp_size=32", [-1, 16, 64, 49152, 2147483647, 1024, 8, 32], "", 0, []], [[], [["FU", 1, [0, 1, 2, 3]], ["SP", 1, 0, 401408, [7], 1], ["AN", 1, 0, 5], ["AN", 1, 1, 6]]]], "r": [[4.52644e-05, 4.52816e-05, 4.52792e-05], 0, 4.39317, 1668016828], "v": "v0.6"}
{"i": [["[\"permute_attn_q_k_v\", 1, 56, 56, 128, 7, 4, \"float16\"]", "cuda -keys=cuda,gpu -max_num_threads=1024 -model=unknown -thread_warp_size=32", [-1, 16, 64, 49152, 2147483647, 1024, 8, 32], "", 0, []], [[], [["FU", 1, [0, 1, 2, 3]], ["SP", 1, 0, 401408, [56], 1], ["AN", 1, 0, 5], ["AN", 1, 1, 6]]]], "r": [[7.93343e-06, 7.93913e-06, 7.94283e-06], 0, 4.75027, 1668016828], "v": "v0.6"}
{"i": [["[\"permute_attn_q_k_v\", 1, 56, 56, 128, 7, 4, \"float16\"]", "cuda -keys=cuda,gpu -max_num_threads=1024 -model=unknown -thread_warp_size=32", [-1, 16, 64, 49152, 2147483647, 1024, 8, 32], "", 0, []], [[], [["FU", 1, [0, 1, 2, 3]], ["SP", 1, 0, 401408, [16], 1], ["AN", 1, 0, 5], ["AN", 1, 1, 6]]]], "r": [[2.15083e-05, 2.15283e-05, 2.15153e-05], 0, 0.894884, 1668016841], "v": "v0.6"}
{"i": [["[\"permute_attn_q_k_v\", 1, 56, 56, 128, 7, 4, \"float16\"]", "cuda -keys=cuda,gpu -max_num_threads=1024 -model=unknown -thread_warp_size=32", [-1, 16, 64, 49152, 2147483647, 1024, 8, 32], "", 0, []], [[], [["FU", 1, [0, 1, 2, 3]], ["SP", 1, 0, 401408, [64], 1], ["AN", 1, 0, 5], ["AN", 1, 1, 6]]]], "r": [[7.34197e-06, 7.33198e-06, 7.33666e-06], 0, 1.2642, 1668016841], "v": "v0.6"}
{"i": [["[\"permute_attn_q_k_v\", 1, 56, 56, 128, 7, 4, \"float16\"]", "cuda -keys=cuda,gpu -max_num_threads=1024 -model=unknown -thread_warp_size=32", [-1, 16, 64, 49152, 2147483647, 1024, 8, 32], "", 0, []], [[], [["FU", 1, [0, 1, 2, 3]], ["SP", 1, 0, 401408, [7], 1], ["AN", 1, 0, 5], ["AN", 1, 1, 6]]]], "r": [[4.52506e-05, 4.52545e-05, 4.52656e-05], 0, 2.64036, 1668016843], "v": "v0.6"}
{"i": [["[\"permute_attn_q_k_v\", 1, 56, 56, 128, 7, 4, \"float16\"]", "cuda -keys=cuda,gpu -max_num_threads=1024 -model=unknown -thread_warp_size=32", [-1, 16, 64, 49152, 2147483647, 1024, 8, 32], "", 0, []], [[], [["FU", 1, [0, 1, 2, 3]], ["SP", 1, 0, 401408, [49], 1], ["AN", 1, 0, 5], ["AN", 1, 1, 6]]]], "r": [[8.72838e-06, 8.73812e-06, 8.73412e-06], 0, 1.58773, 1668016842], "v": "v0.6"}
{"i": [["[\"permute_attn_q_k_v\", 1, 56, 56, 128, 7, 4, \"float16\"]", "cuda -keys=cuda,gpu -max_num_threads=1024 -model=unknown -thread_warp_size=32", [-1, 16, 64, 49152, 2147483647, 1024, 8, 32], "", 0, []], [[], [["FU", 1, [0, 1, 2, 3]], ["SP", 1, 0, 401408, [56], 1], ["AN", 1, 0, 5], ["AN", 1, 1, 6]]]], "r": [[8.0821e-06, 8.10189e-06, 8.09909e-06], 0, 1.92104, 1668016842], "v": "v0.6"}
{"i": [["[\"permute_attn_q_k_v\", 1, 56, 56, 128, 7, 4, \"float16\"]", "cuda -keys=cuda,gpu -max_num_threads=1024 -model=unknown -thread_warp_size=32", [-1, 16, 64, 49152, 2147483647, 1024, 8, 32], "", 0, []], [[], [["FU", 1, [0, 1, 2, 3]], ["SP", 1, 0, 401408, [28], 1], ["AN", 1, 0, 5], ["AN", 1, 1, 6]]]], "r": [[1.34106e-05, 1.34e-05, 1.33825e-05], 0, 0.577905, 1668016841], "v": "v0.6"}
{"i": [["[\"permute_attn_q_k_v\", 1, 56, 56, 128, 7, 4, \"float16\"]", "cuda -keys=cuda,gpu -max_num_threads=1024 -model=unknown -thread_warp_size=32", [-1, 16, 64, 49152, 2147483647, 1024, 8, 32], "", 0, []], [[], [["FU", 1, [0, 1, 2, 3]], ["SP", 1, 0, 401408, [1], 1], ["AN", 1, 0, 5], ["AN", 1, 1, 6]]]], "r": [[0.000300519, 0.000300564, 0.000300577], 0, 2.95467, 1668016843], "v": "v0.6"}
{"i": [["[\"permute_attn_q_k_v\", 1, 56, 56, 128, 7, 4, \"float16\"]", "cuda -keys=cuda,gpu -max_num_threads=1024 -model=unknown -thread_warp_size=32", [-1, 16, 64, 49152, 2147483647, 1024, 8, 32], "", 0, []], [[], [["FU", 1, [0, 1, 2, 3]], ["SP", 1, 0, 401408, [4], 1], ["AN", 1, 0, 5], ["AN", 1, 1, 6]]]], "r": [[7.72071e-05, 7.72047e-05, 7.72106e-05], 0, 2.29862, 1668016842], "v": "v0.6"}
{"i": [["[\"permute_attn_q_k_v\", 1, 56, 56, 128, 7, 4, \"float16\"]", "cuda -keys=cuda,gpu -max_num_threads=1024 -model=unknown -thread_warp_size=32", [-1, 16, 64, 49152, 2147483647, 1024, 8, 32], "", 0, []], [[], [["FU", 1, [0, 1, 2, 3]], ["SP", 1, 0, 401408, [14], 1], ["AN", 1, 0, 5], ["AN", 1, 1, 6]]]], "r": [[2.41504e-05, 2.41874e-05, 2.41773e-05], 0, 3.64551, 1668016844], "v": "v0.6"}
{"i": [["[\"permute_attn_q_k_v\", 1, 56, 56, 128, 7, 4, \"float16\"]", "cuda -keys=cuda,gpu -max_num_threads=1024 -model=unknown -thread_warp_size=32", [-1, 16, 64, 49152, 2147483647, 1024, 8, 32], "", 0, []], [[], [["FU", 1, [0, 1, 2, 3]], ["SP", 1, 0, 401408, [2], 1], ["AN", 1, 0, 5], ["AN", 1, 1, 6]]]], "r": [[0.00015173, 0.000151756, 0.000151737], 0, 4.31514, 1668016844], "v": "v0.6"}
{"i": [["[\"permute_attn_q_k_v\", 1, 56, 56, 128, 7, 4, \"float16\"]", "cuda -keys=cuda,gpu -max_num_threads=1024 -model=unknown -thread_warp_size=32", [-1, 16, 64, 49152, 2147483647, 1024, 8, 32], "", 0, []], [[], [["FU", 1, [0, 1, 2, 3]], ["SP", 1, 0, 401408, [32], 1], ["AN", 1, 0, 5], ["AN", 1, 1, 6]]]], "r": [[1.21385e-05, 1.21476e-05, 1.21396e-05], 0, 3.31472, 1668016843], "v": "v0.6"}
{"i": [["[\"permute_attn_q_k_v\", 1, 56, 56, 128, 7, 4, \"float16\"]", "cuda -keys=cuda,gpu -max_num_threads=1024 -model=unknown -thread_warp_size=32", [-1, 16, 64, 49152, 2147483647, 1024, 8, 32], "", 0, []], [[], [["FU", 1, [0, 1, 2, 3]], ["SP", 1, 0, 401408, [8], 1], ["AN", 1, 0, 5], ["AN", 1, 1, 6]]]], "r": [[3.99469e-05, 3.99566e-05, 3.99708e-05], 0, 3.95447, 1668016844], "v": "v0.6"}
{"i": [["[\"permute_attn_q_k_v\", 1, 56, 56, 128, 7, 4, \"float16\"]", "cuda -keys=cuda,gpu -max_num_threads=1024 -model=unknown -thread_warp_size=32", [-1, 16, 64, 49152, 2147483647, 1024, 8, 32], "", 0, []], [[], [["FU", 1, [0, 1, 2, 3]], ["SP", 1, 0, 401408, [1], 1], ["AN", 1, 0, 5], ["AN", 1, 1, 6]]]], "r": [[0.000300535, 0.000300476, 0.000300523], 0, 0.911122, 1668045849], "v": "v0.6"}
{"i": [["[\"permute_attn_q_k_v\", 1, 56, 56, 128, 7, 4, \"float16\"]", "cuda -keys=cuda,gpu -max_num_threads=1024 -model=unknown -thread_warp_size=32", [-1, 16, 64, 49152, 2147483647, 1024, 8, 32], "", 0, []], [[], [["FU", 1, [0, 1, 2, 3]], ["SP", 1, 0, 401408, [14], 1], ["AN", 1, 0, 5], ["AN", 1, 1, 6]]]], "r": [[2.40728e-05, 2.40847e-05, 2.40755e-05], 0, 0.589505, 1668045849], "v": "v0.6"}
{"i": [["[\"permute_attn_q_k_v\", 1, 56, 56, 128, 7, 4, \"float16\"]", "cuda -keys=cuda,gpu -max_num_threads=1024 -model=unknown -thread_warp_size=32", [-1, 16, 64, 49152, 2147483647, 1024, 8, 32], "", 0, []], [[], [["FU", 1, [0, 1, 2, 3]], ["SP", 1, 0, 401408, [32], 1], ["AN", 1, 0, 5], ["AN", 1, 1, 6]]]], "r": [[1.20468e-05, 1.2056e-05, 1.20515e-05], 0, 2.6996, 1668045851], "v": "v0.6"}
{"i": [["[\"permute_attn_q_k_v\", 1, 56, 56, 128, 7, 4, \"float16\"]", "cuda -keys=cuda,gpu -max_num_threads=1024 -model=unknown -thread_warp_size=32", [-1, 16, 64, 49152, 2147483647, 1024, 8, 32], "", 0, []], [[], [["FU", 1, [0, 1, 2, 3]], ["SP", 1, 0, 401408, [16], 1], ["AN", 1, 0, 5], ["AN", 1, 1, 6]]]], "r": [[2.13717e-05, 2.1384e-05, 2.13783e-05], 0, 1.29966, 1668045849], "v": "v0.6"}
{"i": [["[\"permute_attn_q_k_v\", 1, 56, 56, 128, 7, 4, \"float16\"]", "cuda -keys=cuda,gpu -max_num_threads=1024 -model=unknown -thread_warp_size=32", [-1, 16, 64, 49152, 2147483647, 1024, 8, 32], "", 0, []], [[], [["FU", 1, [0, 1, 2, 3]], ["SP", 1, 0, 401408, [4], 1], ["AN", 1, 0, 5], ["AN", 1, 1, 6]]]], "r": [[7.71404e-05, 7.71685e-05, 7.71758e-05], 0, 1.97974, 1668045850], "v": "v0.6"}
{"i": [["[\"permute_attn_q_k_v\", 1, 56, 56, 128, 7, 4, \"float16\"]", "cuda -keys=cuda,gpu -max_num_threads=1024 -model=unknown -thread_warp_size=32", [-1, 16, 64, 49152, 2147483647, 1024, 8, 32], "", 0, []], [[], [["FU", 1, [0, 1, 2, 3]], ["SP", 1, 0, 401408, [2], 1], ["AN", 1, 0, 5], ["AN", 1, 1, 6]]]], "r": [[0.000151673, 0.000151629, 0.000151663], 0, 2.36063, 1668045851], "v": "v0.6"}
{"i": [["[\"permute_attn_q_k_v\", 1, 56, 56, 128, 7, 4, \"float16\"]", "cuda -keys=cuda,gpu -max_num_threads=1024 -model=unknown -thread_warp_size=32", [-1, 16, 64, 49152, 2147483647, 1024, 8, 32], "", 0, []], [[], [["FU", 1, [0, 1, 2, 3]], ["SP", 1, 0, 401408, [28], 1], ["AN", 1, 0, 5], ["AN", 1, 1, 6]]]], "r": [[1.34905e-05, 1.34883e-05, 1.34878e-05], 0, 1.64156, 1668045850], "v": "v0.6"}
{"i": [["[\"permute_attn_q_k_v\", 1, 56, 56, 128, 7, 4, \"float16\"]", "cuda -keys=cuda,gpu -max_num_threads=1024 -model=unknown -thread_warp_size=32", [-1, 16, 64, 49152, 2147483647, 1024, 8, 32], "", 0, []], [[], [["FU", 1, [0, 1, 2, 3]], ["SP", 1, 0, 401408, [56], 1], ["AN", 1, 0, 5], ["AN", 1, 1, 6]]]], "r": [[7.95918e-06, 7.97187e-06, 7.96887e-06], 0, 3.03371, 1668045851], "v": "v0.6"}
{"i": [["[\"permute_attn_q_k_v\", 1, 56, 56, 128, 7, 4, \"float16\"]", "cuda -keys=cuda,gpu -max_num_threads=1024 -model=unknown -thread_warp_size=32", [-1, 16, 64, 49152, 2147483647, 1024, 8, 32], "", 0, []], [[], [["FU", 1, [0, 1, 2, 3]], ["SP", 1, 0, 401408, [8], 1], ["AN", 1, 0, 5], ["AN", 1, 1, 6]]]], "r": [[3.99496e-05, 3.9963e-05, 3.99283e-05], 0, 3.40953, 1668045852], "v": "v0.6"}
{"i": [["[\"permute_attn_q_k_v\", 1, 56, 56, 128, 7, 4, \"float16\"]", "cuda -keys=cuda,gpu -max_num_threads=1024 -model=unknown -thread_warp_size=32", [-1, 16, 64, 49152, 2147483647, 1024, 8, 32], "", 0, []], [[], [["FU", 1, [0, 1, 2, 3]], ["SP", 1, 0, 401408, [64], 1], ["AN", 1, 0, 5], ["AN", 1, 1, 6]]]], "r": [[7.23236e-06, 7.24123e-06, 7.24143e-06], 0, 3.74693, 1668045852], "v": "v0.6"}
{"i": [["[\"permute_attn_q_k_v\", 1, 56, 56, 128, 7, 4, \"float16\"]", "cuda -keys=cuda,gpu -max_num_threads=1024 -model=unknown -thread_warp_size=32", [-1, 16, 64, 49152, 2147483647, 1024, 8, 32], "", 0, []], [[], [["FU", 1, [0, 1, 2, 3]], ["SP", 1, 0, 401408, [49], 1], ["AN", 1, 0, 5], ["AN", 1, 1, 6]]]], "r": [[8.73665e-06, 8.74715e-06, 8.73904e-06], 0, 4.08036, 1668045852], "v": "v0.6"}
{"i": [["[\"permute_attn_q_k_v\", 1, 56, 56, 128, 7, 4, \"float16\"]", "cuda -keys=cuda,gpu -max_num_threads=1024 -model=unknown -thread_warp_size=32", [-1, 16, 64, 49152, 2147483647, 1024, 8, 32], "", 0, []], [[], [["FU", 1, [0, 1, 2, 3]], ["SP", 1, 0, 401408, [7], 1], ["AN", 1, 0, 5], ["AN", 1, 1, 6]]]], "r": [[4.52542e-05, 4.52704e-05, 4.5265e-05], 0, 4.46144, 1668045853], "v": "v0.6"}
{"i": [["[\"permute_attn_q_k_v\", 1, 56, 56, 128, 7, 4, \"float16\"]", "cuda -keys=cuda,gpu -max_num_threads=1024 -model=unknown -thread_warp_size=32", [-1, 16, 64, 49152, 2147483647, 1024, 8, 32], "", 0, []], [[], [["FU", 1, [0, 1, 2, 3]], ["SP", 1, 0, 401408, [16], 1], ["AN", 1, 0, 5], ["AN", 1, 1, 6]]]], "r": [[2.14728e-05, 2.14618e-05, 2.14837e-05], 0, 1.64739, 1668045867], "v": "v0.6"}
{"i": [["[\"permute_attn_q_k_v\", 1, 56, 56, 128, 7, 4, \"float16\"]", "cuda -keys=cuda,gpu -max_num_threads=1024 -model=unknown -thread_warp_size=32", [-1, 16, 64, 49152, 2147483647, 1024, 8, 32], "", 0, []], [[], [["FU", 1, [0, 1, 2, 3]], ["SP", 1, 0, 401408, [14], 1], ["AN", 1, 0, 5], ["AN", 1, 1, 6]]]], "r": [[2.40284e-05, 2.40248e-05, 2.40374e-05], 0, 1.99199, 1668045867], "v": "v0.6"}
{"i": [["[\"permute_attn_q_k_v\", 1, 56, 56, 128, 7, 4, \"float16\"]", "cuda -keys=cuda,gpu -max_num_threads=1024 -model=unknown -thread_warp_size=32", [-1, 16, 64, 49152, 2147483647, 1024, 8, 32], "", 0, []], [[], [["FU", 1, [0, 1, 2, 3]], ["SP", 1, 0, 401408, [49], 1], ["AN", 1, 0, 5], ["AN", 1, 1, 6]]]], "r": [[8.76024e-06, 8.77164e-06, 8.77252e-06], 0, 1.30148, 1668045866], "v": "v0.6"}
{"i": [["[\"permute_attn_q_k_v\", 1, 56, 56, 128, 7, 4, \"float16\"]", "cuda -keys=cuda,gpu -max_num_threads=1024 -model=unknown -thread_warp_size=32", [-1, 16, 64, 49152, 2147483647, 1024, 8, 32], "", 0, []], [[], [["FU", 1, [0, 1, 2, 3]], ["SP", 1, 0, 401408, [8], 1], ["AN", 1, 0, 5], ["AN", 1, 1, 6]]]], "r": [[4.00847e-05, 4.00993e-05, 4.01007e-05], 0, 0.914792, 1668045866], "v": "v0.6"}
{"i": [["[\"permute_attn_q_k_v\", 1, 56, 56, 128, 7, 4, \"float16\"]", "cuda -keys=cuda,gpu -max_num_threads=1024 -model=unknown -thread_warp_size=32", [-1, 16, 64, 49152, 2147483647, 1024, 8, 32], "", 0, []], [[], [["FU", 1, [0, 1, 2, 3]], ["SP", 1, 0, 401408, [1], 1], ["AN", 1, 0, 5], ["AN", 1, 1, 6]]]], "r": [[0.000300452, 0.000300419, 0.000300471], 0, 0.577182, 1668045866], "v": "v0.6"}
{"i": [["[\"permute_attn_q_k_v\", 1, 56, 56, 128, 7, 4, \"float16\"]", "cuda -keys=cuda,gpu -max_num_threads=1024 -model=unknown -thread_warp_size=32", [-1, 16, 64, 49152, 2147483647, 1024, 8, 32], "", 0, []], [[], [["FU", 1, [0, 1, 2, 3]], ["SP", 1, 0, 401408, [4], 1], ["AN", 1, 0, 5], ["AN", 1, 1, 6]]]], "r": [[7.72542e-05, 7.72824e-05, 7.72681e-05], 0, 2.38317, 1668045868], "v": "v0.6"}
{"i": [["[\"permute_attn_q_k_v\", 1, 56, 56, 128, 7, 4, \"float16\"]", "cuda -keys=cuda,gpu -max_num_threads=1024 -model=unknown -thread_warp_size=32", [-1, 16, 64, 49152, 2147483647, 1024, 8, 32], "", 0, []], [[], [["FU", 1, [0, 1, 2, 3]], ["SP", 1, 0, 401408, [7], 1], ["AN", 1, 0, 5], ["AN", 1, 1, 6]]]], "r": [[4.52965e-05, 4.53252e-05, 4.53243e-05], 0, 2.72763, 1668045868], "v": "v0.6"}
{"i": [["[\"permute_attn_q_k_v\", 1, 56, 56, 128, 7, 4, \"float16\"]", "cuda -keys=cuda,gpu -max_num_threads=1024 -model=unknown -thread_warp_size=32", [-1, 16, 64, 49152, 2147483647, 1024, 8, 32], "", 0, []], [[], [["FU", 1, [0, 1, 2, 3]], ["SP", 1, 0, 401408, [56], 1], ["AN", 1, 0, 5], ["AN", 1, 1, 6]]]], "r": [[7.93008e-06, 7.93536e-06, 7.93242e-06], 0, 3.04956, 1668045868], "v": "v0.6"}
{"i": [["[\"permute_attn_q_k_v\", 1, 56, 56, 128, 7, 4, \"float16\"]", "cuda -keys=cuda,gpu -max_num_threads=1024 -model=unknown -thread_warp_size=32", [-1, 16, 64, 49152, 2147483647, 1024, 8, 32], "", 0, []], [[], [["FU", 1, [0, 1, 2, 3]], ["SP", 1, 0, 401408, [2], 1], ["AN", 1, 0, 5], ["AN", 1, 1, 6]]]], "r": [[0.000151637, 0.000151587, 0.000151643], 0, 4.49338, 1668045870], "v": "v0.6"}
{"i": [["[\"permute_attn_q_k_v\", 1, 56, 56, 128, 7, 4, \"float16\"]", "cuda -keys=cuda,gpu -max_num_threads=1024 -model=unknown -thread_warp_size=32", [-1, 16, 64, 49152, 2147483647, 1024, 8, 32], "", 0, []], [[], [["FU", 1, [0, 1, 2, 3]], ["SP", 1, 0, 401408, [32], 1], ["AN", 1, 0, 5], ["AN", 1, 1, 6]]]], "r": [[1.21704e-05, 1.21915e-05, 1.21971e-05], 0, 3.42785, 1668045869], "v": "v0.6"}
{"i": [["[\"permute_attn_q_k_v\", 1, 56, 56, 128, 7, 4, \"float16\"]", "cuda -keys=cuda,gpu -max_num_threads=1024 -model=unknown -thread_warp_size=32", [-1, 16, 64, 49152, 2147483647, 1024, 8, 32], "", 0, []], [[], [["FU", 1, [0, 1, 2, 3]], ["SP", 1, 0, 401408, [64], 1], ["AN", 1, 0, 5], ["AN", 1, 1, 6]]]], "r": [[7.23161e-06, 7.24012e-06, 7.23684e-06], 0, 3.76069, 1668045869], "v": "v0.6"}
{"i": [["[\"permute_attn_q_k_v\", 1, 56, 56, 128, 7, 4, \"float16\"]", "cuda -keys=cuda,gpu -max_num_threads=1024 -model=unknown -thread_warp_size=32", [-1, 16, 64, 49152, 2147483647, 1024, 8, 32], "", 0, []], [[], [["FU", 1, [0, 1, 2, 3]], ["SP", 1, 0, 401408, [28], 1], ["AN", 1, 0, 5], ["AN", 1, 1, 6]]]], "r": [[1.36273e-05, 1.36607e-05, 1.36501e-05], 0, 4.12072, 1668045869], "v": "v0.6"}
{"i": [["[\"permute_attn_q_k_v\", 1, 56, 56, 128, 7, 4, \"float16\"]", "cuda -keys=cuda,gpu -max_num_threads=1024 -model=unknown -thread_warp_size=32", [-1, 16, 64, 49152, 2147483647, 1024, 8, 32], "", 0, []], [[], [["FU", 1, [0, 1, 2, 3]], ["SP", 1, 0, 401408, [28], 1], ["AN", 1, 0, 5], ["AN", 1, 1, 6]]]], "r": [[1.34092e-05, 1.34206e-05, 1.34171e-05], 0, 0.582542, 1668045882], "v": "v0.6"}
{"i": [["[\"permute_attn_q_k_v\", 1, 56, 56, 128, 7, 4, \"float16\"]", "cuda -keys=cuda,gpu -max_num_threads=1024 -model=unknown -thread_warp_size=32", [-1, 16, 64, 49152, 2147483647, 1024, 8, 32], "", 0, []], [[], [["FU", 1, [0, 1, 2, 3]], ["SP", 1, 0, 401408, [64], 1], ["AN", 1, 0, 5], ["AN", 1, 1, 6]]]], "r": [[7.33701e-06, 7.3421e-06, 7.34469e-06], 0, 0.931379, 1668045883], "v": "v0.6"}
{"i": [["[\"permute_attn_q_k_v\", 1, 56, 56, 128, 7, 4, \"float16\"]", "cuda -keys=cuda,gpu -max_num_threads=1024 -model=unknown -thread_warp_size=32", [-1, 16, 64, 49152, 2147483647, 1024, 8, 32], "", 0, []], [[], [["FU", 1, [0, 1, 2, 3]], ["SP", 1, 0, 401408, [8], 1], ["AN", 1, 0, 5], ["AN", 1, 1, 6]]]], "r": [[4.00827e-05, 4.01118e-05, 4.01099e-05], 0, 3.02033, 1668045885], "v": "v0.6"}
{"i": [["[\"permute_attn_q_k_v\", 1, 56, 56, 128, 7, 4, \"float16\"]", "cuda -keys=cuda,gpu -max_num_threads=1024 -model=unknown -thread_warp_size=32", [-1, 16, 64, 49152, 2147483647, 1024, 8, 32], "", 0, []], [[], [["FU", 1, [0, 1, 2, 3]], ["SP", 1, 0, 401408, [7], 1], ["AN", 1, 0, 5], ["AN", 1, 1, 6]]]], "r": [[4.53568e-05, 4.53657e-05, 4.5376e-05], 0, 1.63994, 1668045884], "v": "v0.6"}
{"i": [["[\"permute_attn_q_k_v\", 1, 56, 56, 128, 7, 4, \"float16\"]", "cuda -keys=cuda,gpu -max_num_threads=1024 -model=unknown -thread_warp_size=32", [-1, 16, 64, 49152, 2147483647, 1024, 8, 32], "", 0, []], [[], [["FU", 1, [0, 1, 2, 3]], ["SP", 1, 0, 401408, [49], 1], ["AN", 1, 0, 5], ["AN", 1, 1, 6]]]], "r": [[8.71393e-06, 8.72206e-06, 8.72389e-06], 0, 1.971, 1668045884], "v": "v0.6"}
{"i": [["[\"permute_attn_q_k_v\", 1, 56, 56, 128, 7, 4, \"float16\"]", "cuda -keys=cuda,gpu -max_num_threads=1024 -model=unknown -thread_warp_size=32", [-1, 16, 64, 49152, 2147483647, 1024, 8, 32], "", 0, []], [[], [["FU", 1, [0, 1, 2, 3]], ["SP", 1, 0, 401408, [1], 1], ["AN", 1, 0, 5], ["AN", 1, 1, 6]]]], "r": [[0.000300564, 0.000300524, 0.000300561], 0, 1.2962, 1668045883], "v": "v0.6"}
{"i": [["[\"permute_attn_q_k_v\", 1, 56, 56, 128, 7, 4, \"float16\"]", "cuda -keys=cuda,gpu -max_num_threads=1024 -model=unknown -thread_warp_size=32", [-1, 16, 64, 49152, 2147483647, 1024, 8, 32], "", 0, []], [[], [["FU", 1, [0, 1, 2, 3]], ["SP", 1, 0, 401408, [2], 1], ["AN", 1, 0, 5], ["AN", 1, 1, 6]]]], "r": [[0.000151719, 0.000151708, 0.000151732], 0, 2.34704, 1668045884], "v": "v0.6"}
{"i": [["[\"permute_attn_q_k_v\", 1, 56, 56, 128, 7, 4, \"float16\"]", "cuda -keys=cuda,gpu -max_num_threads=1024 -model=unknown -thread_warp_size=32", [-1, 16, 64, 49152, 2147483647, 1024, 8, 32], "", 0, []], [[], [["FU", 1, [0, 1, 2, 3]], ["SP", 1, 0, 401408, [56], 1], ["AN", 1, 0, 5], ["AN", 1, 1, 6]]]], "r": [[8.01225e-06, 8.02741e-06, 8.02391e-06], 0, 3.41199, 1668045885], "v": "v0.6"}
{"i": [["[\"permute_attn_q_k_v\", 1, 56, 56, 128, 7, 4, \"float16\"]", "cuda -keys=cuda,gpu -max_num_threads=1024 -model=unknown -thread_warp_size=32", [-1, 16, 64, 49152, 2147483647, 1024, 8, 32], "", 0, []], [[], [["FU", 1, [0, 1, 2, 3]], ["SP", 1, 0, 401408, [14], 1], ["AN", 1, 0, 5], ["AN", 1, 1, 6]]]], "r": [[2.42648e-05, 2.42827e-05, 2.42817e-05], 0, 2.67911, 1668045885], "v": "v0.6"}
{"i": [["[\"permute_attn_q_k_v\", 1, 56, 56, 128, 7, 4, \"float16\"]", "cuda -keys=cuda,gpu -max_num_threads=1024 -model=unknown -thread_warp_size=32", [-1, 16, 64, 49152, 2147483647, 1024, 8, 32], "", 0, []], [[], [["FU", 1, [0, 1, 2, 3]], ["SP", 1, 0, 401408, [4], 1], ["AN", 1, 0, 5], ["AN", 1, 1, 6]]]], "r": [[7.71904e-05, 7.71962e-05, 7.72214e-05], 0, 3.74713, 1668045886], "v": "v0.6"}
{"i": [["[\"permute_attn_q_k_v\", 1, 56, 56, 128, 7, 4, \"float16\"]", "cuda -keys=cuda,gpu -max_num_threads=1024 -model=unknown -thread_warp_size=32", [-1, 16, 64, 49152, 2147483647, 1024, 8, 32], "", 0, []], [[], [["FU", 1, [0, 1, 2, 3]], ["SP", 1, 0, 401408, [16], 1], ["AN", 1, 0, 5], ["AN", 1, 1, 6]]]], "r": [[2.13837e-05, 2.13948e-05, 2.13966e-05], 0, 4.09406, 1668045886], "v": "v0.6"}
{"i": [["[\"permute_attn_q_k_v\", 1, 56, 56, 128, 7, 4, \"float16\"]", "cuda -keys=cuda,gpu -max_num_threads=1024 -model=unknown -thread_warp_size=32", [-1, 16, 64, 49152, 2147483647, 1024, 8, 32], "", 0, []], [[], [["FU", 1, [0, 1, 2, 3]], ["SP", 1, 0, 401408, [32], 1], ["AN", 1, 0, 5], ["AN", 1, 1, 6]]]], "r": [[1.2205e-05, 1.22255e-05, 1.22232e-05], 0, 4.46748, 1668045886], "v": "v0.6"}
{"i": [["[\"permute_attn_q_k_v\", 1, 56, 56, 128, 7, 4, \"float16\"]", "cuda -keys=cuda,gpu -max_num_threads=1024 -model=unknown -thread_warp_size=32", [-1, 16, 64, 49152, 2147483647, 1024, 8, 32], "", 0, []], [[], [["FU", 1, [0, 1, 2, 3]], ["SP", 1, 0, 401408, [4], 1], ["AN", 1, 0, 5], ["AN", 1, 1, 6]]]], "r": [[7.71633e-05, 7.71737e-05, 7.71769e-05], 0, 0.599435, 1668048106], "v": "v0.6"}
{"i": [["[\"permute_attn_q_k_v\", 1, 56, 56, 128, 7, 4, \"float16\"]", "cuda -keys=cuda,gpu -max_num_threads=1024 -model=unknown -thread_warp_size=32", [-1, 16, 64, 49152, 2147483647, 1024, 8, 32], "", 0, []], [[], [["FU", 1, [0, 1, 2, 3]], ["SP", 1, 0, 401408, [56], 1], ["AN", 1, 0, 5], ["AN", 1, 1, 6]]]], "r": [[7.96301e-06, 7.97943e-06, 7.97758e-06], 0, 2.75275, 1668048108], "v": "v0.6"}
{"i": [["[\"permute_attn_q_k_v\", 1, 56, 56, 128, 7, 4, \"float16\"]", "cuda -keys=cuda,gpu -max_num_threads=1024 -model=unknown -thread_warp_size=32", [-1, 16, 64, 49152, 2147483647, 1024, 8, 32], "", 0, []], [[], [["FU", 1, [0, 1, 2, 3]], ["SP", 1, 0, 401408, [14], 1], ["AN", 1, 0, 5], ["AN", 1, 1, 6]]]], "r": [[2.42463e-05, 2.42793e-05, 2.42669e-05], 0, 0.959149, 1668048106], "v": "v0.6"}
{"i": [["[\"permute_attn_q_k_v\", 1, 56, 56, 128, 7, 4, \"float16\"]", "cuda -keys=cuda,gpu -max_num_threads=1024 -model=unknown -thread_warp_size=32", [-1, 16, 64, 49152, 2147483647, 1024, 8, 32], "", 0, []], [[], [["FU", 1, [0, 1, 2, 3]], ["SP", 1, 0, 401408, [64], 1], ["AN", 1, 0, 5], ["AN", 1, 1, 6]]]], "r": [[7.23785e-06, 7.26236e-06, 7.26301e-06], 0, 1.68264, 1668048107], "v": "v0.6"}
{"i": [["[\"permute_attn_q_k_v\", 1, 56, 56, 128, 7, 4, \"float16\"]", "cuda -keys=cuda,gpu -max_num_threads=1024 -model=unknown -thread_warp_size=32", [-1, 16, 64, 49152, 2147483647, 1024, 8, 32], "", 0, []], [[], [["FU", 1, [0, 1, 2, 3]], ["SP", 1, 0, 401408, [7], 1], ["AN", 1, 0, 5], ["AN", 1, 1, 6]]]], "r": [[4.52678e-05, 4.52714e-05, 4.5263e-05], 0, 2.02526, 1668048108], "v": "v0.6"}
{"i": [["[\"permute_attn_q_k_v\", 1, 56, 56, 128, 7, 4, \"float16\"]", "cuda -keys=cuda,gpu -max_num_threads=1024 -model=unknown -thread_warp_size=32", [-1, 16, 64, 49152, 2147483647, 1024, 8, 32], "", 0, []], [[], [["FU", 1, [0, 1, 2, 3]], ["SP", 1, 0, 401408, [1], 1], ["AN", 1, 0, 5], ["AN", 1, 1, 6]]]], "r": [[0.000300471, 0.000300468, 0.000300519], 0, 2.40828, 1668048108], "v": "v0.6"}
{"i": [["[\"permute_attn_q_k_v\", 1, 56, 56, 128, 7, 4, \"float16\"]", "cuda -keys=cuda,gpu -max_num_threads=1024 -model=unknown -thread_warp_size=32", [-1, 16, 64, 49152, 2147483647, 1024, 8, 32], "", 0, []], [[], [["FU", 1, [0, 1, 2, 3]], ["SP", 1, 0, 401408, [2], 1], ["AN", 1, 0, 5], ["AN", 1, 1, 6]]]], "r": [[0.000151609, 0.000151646, 0.000151611], 0, 1.32832, 1668048107], "v": "v0.6"}
{"i": [["[\"permute_attn_q_k_v\", 1, 56, 56, 128, 7, 4, \"float16\"]", "cuda -keys=cuda,gpu -max_num_threads=1024 -model=unknown -thread_warp_size=32", [-1, 16, 64, 49152, 2147483647, 1024, 8, 32], "", 0, []], [[], [["FU", 1, [0, 1, 2, 3]], ["SP", 1, 0, 401408, [16], 1], ["AN", 1, 0, 5], ["AN", 1, 1, 6]]]], "r": [[2.15403e-05, 2.15426e-05, 2.15429e-05], 0, 3.1003, 1668048109], "v": "v0.6"}
{"i": [["[\"permute_attn_q_k_v\", 1, 56, 56, 128, 7, 4, \"float16\"]", "cuda -keys=cuda,gpu -max_num_threads=1024 -model=unknown -thread_warp_size=32", [-1, 16, 64, 49152, 2147483647, 1024, 8, 32], "", 0, []], [[], [["FU", 1, [0, 1, 2, 3]], ["SP", 1, 0, 401408, [8], 1], ["AN", 1, 0, 5], ["AN", 1, 1, 6]]]], "r": [[3.99358e-05, 3.99155e-05, 3.99376e-05], 0, 3.49925, 1668048109], "v": "v0.6"}
{"i": [["[\"permute_attn_q_k_v\", 1, 56, 56, 128, 7, 4, \"float16\"]", "cuda -keys=cuda,gpu -max_num_threads=1024 -model=unknown -thread_warp_size=32", [-1, 16, 64, 49152, 2147483647, 1024, 8, 32], "", 0, []], [[], [["FU", 1, [0, 1, 2, 3]], ["SP", 1, 0, 401408, [49], 1], ["AN", 1, 0, 5], ["AN", 1, 1, 6]]]], "r": [[8.7288e-06, 8.74372e-06, 8.69629e-06], 0, 4.59811, 1668048110], "v": "v0.6"}
{"i": [["[\"permute_attn_q_k_v\", 1, 56, 56, 128, 7, 4, \"float16\"]", "cuda -keys=cuda,gpu -max_num_threads=1024 -model=unknown -thread_warp_size=32", [-1, 16, 64, 49152, 2147483647, 1024, 8, 32], "", 0, []], [[], [["FU", 1, [0, 1, 2, 3]], ["SP", 1, 0, 401408, [32], 1], ["AN", 1, 0, 5], ["AN", 1, 1, 6]]]], "r": [[1.20505e-05, 1.20486e-05, 1.20511e-05], 0, 4.18593, 1668048110], "v": "v0.6"}
{"i": [["[\"permute_attn_q_k_v\", 1, 56, 56, 128, 7, 4, \"float16\"]", "cuda -keys=cuda,gpu -max_num_threads=1024 -model=unknown -thread_warp_size=32", [-1, 16, 64, 49152, 2147483647, 1024, 8, 32], "", 0, []], [[], [["FU", 1, [0, 1, 2, 3]], ["SP", 1, 0, 401408, [28], 1], ["AN", 1, 0, 5], ["AN", 1, 1, 6]]]], "r": [[1.35383e-05, 1.35682e-05, 1.35708e-05], 0, 3.86512, 1668048109], "v": "v0.6"}
{"i": [["[\"permute_attn_q_k_v\", 1, 56, 56, 128, 7, 4, \"float16\"]", "cuda -keys=cuda,gpu -max_num_threads=1024 -model=unknown -thread_warp_size=32", [-1, 16, 64, 49152, 2147483647, 1024, 8, 32], "", 0, []], [[], [["FU", 1, [0, 1, 2, 3]], ["SP", 1, 0, 401408, [28], 1], ["AN", 1, 0, 5], ["AN", 1, 1, 6]]]], "r": [[1.34057e-05, 1.34277e-05, 1.34274e-05], 0, 3.58219, 1668048128], "v": "v0.6"}
{"i": [["[\"permute_attn_q_k_v\", 1, 56, 56, 128, 7, 4, \"float16\"]", "cuda -keys=cuda,gpu -max_num_threads=1024 -model=unknown -thread_warp_size=32", [-1, 16, 64, 49152, 2147483647, 1024, 8, 32], "", 0, []], [[], [["FU", 1, [0, 1, 2, 3]], ["SP", 1, 0, 401408, [2], 1], ["AN", 1, 0, 5], ["AN", 1, 1, 6]]]], "r": [[0.000151741, 0.000151839, 0.000151784], 0, 1.66495, 1668048125], "v": "v0.6"}
{"i": [["[\"permute_attn_q_k_v\", 1, 56, 56, 128, 7, 4, \"float16\"]", "cuda -keys=cuda,gpu -max_num_threads=1024 -model=unknown -thread_warp_size=32", [-1, 16, 64, 49152, 2147483647, 1024, 8, 32], "", 0, []], [[], [["FU", 1, [0, 1, 2, 3]], ["SP", 1, 0, 401408, [64], 1], ["AN", 1, 0, 5], ["AN", 1, 1, 6]]]], "r": [[7.4216e-06, 7.42539e-06, 7.43025e-06], 0, 1.13027, 1668048125], "v": "v0.6"}
{"i": [["[\"permute_attn_q_k_v\", 1, 56, 56, 128, 7, 4, \"float16\"]", "cuda -keys=cuda,gpu -max_num_threads=1024 -model=unknown -thread_warp_size=32", [-1, 16, 64, 49152, 2147483647, 1024, 8, 32], "", 0, []], [[], [["FU", 1, [0, 1, 2, 3]], ["SP", 1, 0, 401408, [32], 1], ["AN", 1, 0, 5], ["AN", 1, 1, 6]]]], "r": [[1.19977e-05, 1.20076e-05, 1.20038e-05], 0, 2.29371, 1668048127], "v": "v0.6"}
{"i": [["[\"permute_attn_q_k_v\", 1, 56, 56, 128, 7, 4, \"float16\"]", "cuda -keys=cuda,gpu -max_num_threads=1024 -model=unknown -thread_warp_size=32", [-1, 16, 64, 49152, 2147483647, 1024, 8, 32], "", 0, []], [[], [["FU", 1, [0, 1, 2, 3]], ["SP", 1, 0, 401408, [4], 1], ["AN", 1, 0, 5], ["AN", 1, 1, 6]]]], "r": [[7.72787e-05, 7.73158e-05, 7.73696e-05], 0, 1.73974, 1668048126], "v": "v0.6"}
{"i": [["[\"permute_attn_q_k_v\", 1, 56, 56, 128, 7, 4, \"float16\"]", "cuda -keys=cuda,gpu -max_num_threads=1024 -model=unknown -thread_warp_size=32", [-1, 16, 64, 49152, 2147483647, 1024, 8, 32], "", 0, []], [[], [["FU", 1, [0, 1, 2, 3]], ["SP", 1, 0, 401408, [8], 1], ["AN", 1, 0, 5], ["AN", 1, 1, 6]]]], "r": [[3.99869e-05, 4.00048e-05, 4.00022e-05], 0, 2.90661, 1668048127], "v": "v0.6"}
{"i": [["[\"permute_attn_q_k_v\", 1, 56, 56, 128, 7, 4, \"float16\"]", "cuda -keys=cuda,gpu -max_num_threads=1024 -model=unknown -thread_warp_size=32", [-1, 16, 64, 49152, 2147483647, 1024, 8, 32], "", 0, []], [[], [["FU", 1, [0, 1, 2, 3]], ["SP", 1, 0, 401408, [7], 1], ["AN", 1, 0, 5], ["AN", 1, 1, 6]]]], "r": [[4.54366e-05, 4.54701e-05, 4.54673e-05], 0, 1.92954, 1668048126], "v": "v0.6"}
{"i": [["[\"permute_attn_q_k_v\", 1, 56, 56, 128, 7, 4, \"float16\"]", "cuda -keys=cuda,gpu -max_num_threads=1024 -model=unknown -thread_warp_size=32", [-1, 16, 64, 49152, 2147483647, 1024, 8, 32], "", 0, []], [[], [["FU", 1, [0, 1, 2, 3]], ["SP", 1, 0, 401408, [14], 1], ["AN", 1, 0, 5], ["AN", 1, 1, 6]]]], "r": [[2.41299e-05, 2.41573e-05, 2.41605e-05], 0, 2.75122, 1668048127], "v": "v0.6"}
{"i": [["[\"permute_attn_q_k_v\", 1, 56, 56, 128, 7, 4, \"float16\"]", "cuda -keys=cuda,gpu -max_num_threads=1024 -model=unknown -thread_warp_size=32", [-1, 16, 64, 49152, 2147483647, 1024, 8, 32], "", 0, []], [[], [["FU", 1, [0, 1, 2, 3]], ["SP", 1, 0, 401408, [16], 1], ["AN", 1, 0, 5], ["AN", 1, 1, 6]]]], "r": [[2.15407e-05, 2.15381e-05, 2.15522e-05], 0, 4.6828, 1668048129], "v": "v0.6"}
{"i": [["[\"permute_attn_q_k_v\", 1, 56, 56, 128, 7, 4, \"float16\"]", "cuda -keys=cuda,gpu -max_num_threads=1024 -model=unknown -thread_warp_size=32", [-1, 16, 64, 49152, 2147483647, 1024, 8, 32], "", 0, []], [[], [["FU", 1, [0, 1, 2, 3]], ["SP", 1, 0, 401408, [56], 1], ["AN", 1, 0, 5], ["AN", 1, 1, 6]]]], "r": [[7.88302e-06, 7.89747e-06, 7.89724e-06], 0, 4.49776, 1668048129], "v": "v0.6"}
{"i": [["[\"permute_attn_q_k_v\", 1, 56, 56, 128, 7, 4, \"float16\"]", "cuda -keys=cuda,gpu -max_num_threads=1024 -model=unknown -thread_warp_size=32", [-1, 16, 64, 49152, 2147483647, 1024, 8, 32], "", 0, []], [[], [["FU", 1, [0, 1, 2, 3]], ["SP", 1, 0, 401408, [49], 1], ["AN", 1, 0, 5], ["AN", 1, 1, 6]]]], "r": [[8.85722e-06, 8.86331e-06, 8.86204e-06], 0, 4.22467, 1668048128], "v": "v0.6"}
{"i": [["[\"permute_attn_q_k_v\", 1, 56, 56, 128, 7, 4, \"float16\"]", "cuda -keys=cuda,gpu -max_num_threads=1024 -model=unknown -thread_warp_size=32", [-1, 16, 64, 49152, 2147483647, 1024, 8, 32], "", 0, []], [[], [["FU", 1, [0, 1, 2, 3]], ["SP", 1, 0, 401408, [1], 1], ["AN", 1, 0, 5], ["AN", 1, 1, 6]]]], "r": [[0.000300485, 0.000300466, 0.000300612], 0, 3.94014, 1668048128], "v": "v0.6"}
{"i": [["[\"permute_attn_q_k_v\", 1, 56, 56, 128, 7, 4, \"float16\"]", "cuda -keys=cuda,gpu -max_num_threads=1024 -model=unknown -thread_warp_size=32", [-1, 16, 64, 49152, 2147483647, 1024, 8, 32], "", 0, []], [[], [["FU", 1, [0, 1, 2, 3]], ["SP", 1, 0, 401408, [28], 1], ["AN", 1, 0, 5], ["AN", 1, 1, 6]]]], "r": [[1.3478e-05, 1.34925e-05, 1.34898e-05], 0, 4.1065, 1668048149], "v": "v0.6"}
{"i": [["[\"permute_attn_q_k_v\", 1, 56, 56, 128, 7, 4, \"float16\"]", "cuda -keys=cuda,gpu -max_num_threads=1024 -model=unknown -thread_warp_size=32", [-1, 16, 64, 49152, 2147483647, 1024, 8, 32], "", 0, []], [[], [["FU", 1, [0, 1, 2, 3]], ["SP", 1, 0, 401408, [4], 1], ["AN", 1, 0, 5], ["AN", 1, 1, 6]]]], "r": [[7.71468e-05, 7.71443e-05, 7.71665e-05], 0, 1.16749, 1668048146], "v": "v0.6"}
{"i": [["[\"permute_attn_q_k_v\", 1, 56, 56, 128, 7, 4, \"float16\"]", "cuda -keys=cuda,gpu -max_num_threads=1024 -model=unknown -thread_warp_size=32", [-1, 16, 64, 49152, 2147483647, 1024, 8, 32], "", 0, []], [[], [["FU", 1, [0, 1, 2, 3]], ["SP", 1, 0, 401408, [7], 1], ["AN", 1, 0, 5], ["AN", 1, 1, 6]]]], "r": [[4.53471e-05, 4.53845e-05, 4.53819e-05], 0, 0.967571, 1668048146], "v": "v0.6"}
{"i": [["[\"permute_attn_q_k_v\", 1, 56, 56, 128, 7, 4, \"float16\"]", "cuda -keys=cuda,gpu -max_num_threads=1024 -model=unknown -thread_warp_size=32", [-1, 16, 64, 49152, 2147483647, 1024, 8, 32], "", 0, []], [[], [["FU", 1, [0, 1, 2, 3]], ["SP", 1, 0, 401408, [1], 1], ["AN", 1, 0, 5], ["AN", 1, 1, 6]]]], "r": [[0.000300495, 0.0003005, 0.000300481], 0, 3.28455, 1668048149], "v": "v0.6"}
{"i": [["[\"permute_attn_q_k_v\", 1, 56, 56, 128, 7, 4, \"float16\"]", "cuda -keys=cuda,gpu -max_num_threads=1024 -model=unknown -thread_warp_size=32", [-1, 16, 64, 49152, 2147483647, 1024, 8, 32], "", 0, []], [[], [["FU", 1, [0, 1, 2, 3]], ["SP", 1, 0, 401408, [64], 1], ["AN", 1, 0, 5], ["AN", 1, 1, 6]]]], "r": [[7.40319e-06, 7.41395e-06, 7.41267e-06], 0, 4.34281, 1668048150], "v": "v0.6"}
{"i": [["[\"permute_attn_q_k_v\", 1, 56, 56, 128, 7, 4, \"float16\"]", "cuda -keys=cuda,gpu -max_num_threads=1024 -model=unknown -thread_warp_size=32", [-1, 16, 64, 49152, 2147483647, 1024, 8, 32], "", 0, []], [[], [["FU", 1, [0, 1, 2, 3]], ["SP", 1, 0, 401408, [16], 1], ["AN", 1, 0, 5], ["AN", 1, 1, 6]]]], "r": [[2.16434e-05, 2.16464e-05, 2.16498e-05], 0, 2.91527, 1668048148], "v": "v0.6"}
{"i": [["[\"permute_attn_q_k_v\", 1, 56, 56, 128, 7, 4, \"float16\"]", "cuda -keys=cuda,gpu -max_num_threads=1024 -model=unknown -thread_warp_size=32", [-1, 16, 64, 49152, 2147483647, 1024, 8, 32], "", 0, []], [[], [["FU", 1, [0, 1, 2, 3]], ["SP", 1, 0, 401408, [14], 1], ["AN", 1, 0, 5], ["AN", 1, 1, 6]]]], "r": [[2.40637e-05, 2.40767e-05, 2.40866e-05], 0, 3.69385, 1668048149], "v": "v0.6"}
{"i": [["[\"permute_attn_q_k_v\", 1, 56, 56, 128, 7, 4, \"float16\"]", "cuda -keys=cuda,gpu -max_num_threads=1024 -model=unknown -thread_warp_size=32", [-1, 16, 64, 49152, 2147483647, 1024, 8, 32], "", 0, []], [[], [["FU", 1, [0, 1, 2, 3]], ["SP", 1, 0, 401408, [2], 1], ["AN", 1, 0, 5], ["AN", 1, 1, 6]]]], "r": [[0.000151656, 0.000151709, 0.000151716], 0, 2.60585, 1668048148], "v": "v0.6"}
{"i": [["[\"permute_attn_q_k_v\", 1, 56, 56, 128, 7, 4, \"float16\"]", "cuda -keys=cuda,gpu -max_num_threads=1024 -model=unknown -thread_warp_size=32", [-1, 16, 64, 49152, 2147483647, 1024, 8, 32], "", 0, []], [[], [["FU", 1, [0, 1, 2, 3]], ["SP", 1, 0, 401408, [8], 1], ["AN", 1, 0, 5], ["AN", 1, 1, 6]]]], "r": [[3.99007e-05, 3.99084e-05, 3.99059e-05], 0, 2.23711, 1668048148], "v": "v0.6"}
{"i": [["[\"permute_attn_q_k_v\", 1, 56, 56, 128, 7, 4, \"float16\"]", "cuda -keys=cuda,gpu -max_num_threads=1024 -model=unknown -thread_warp_size=32", [-1, 16, 64, 49152, 2147483647, 1024, 8, 32], "", 0, []], [[], [["FU", 1, [0, 1, 2, 3]], ["SP", 1, 0, 401408, [49], 1], ["AN", 1, 0, 5], ["AN", 1, 1, 6]]]], "r": [[8.823e-06, 8.84376e-06, 8.84157e-06], 0, 1.37401, 1668048147], "v": "v0.6"}
{"i": [["[\"permute_attn_q_k_v\", 1, 56, 56, 128, 7, 4, \"float16\"]", "cuda -keys=cuda,gpu -max_num_threads=1024 -model=unknown -thread_warp_size=32", [-1, 16, 64, 49152, 2147483647, 1024, 8, 32], "", 0, []], [[], [["FU", 1, [0, 1, 2, 3]], ["SP", 1, 0, 401408, [32], 1], ["AN", 1, 0, 5], ["AN", 1, 1, 6]]]], "r": [[1.22426e-05, 1.22419e-05, 1.2247e-05], 0, 4.43831, 1668048150], "v": "v0.6"}
{"i": [["[\"permute_attn_q_k_v\", 1, 56, 56, 128, 7, 4, \"float16\"]", "cuda -keys=cuda,gpu -max_num_threads=1024 -model=unknown -thread_warp_size=32", [-1, 16, 64, 49152, 2147483647, 1024, 8, 32], "", 0, []], [[], [["FU", 1, [0, 1, 2, 3]], ["SP", 1, 0, 401408, [56], 1], ["AN", 1, 0, 5], ["AN", 1, 1, 6]]]], "r": [[7.97542e-06, 7.99124e-06, 7.98805e-06], 0, 1.8734, 1668048147], "v": "v0.6"}
{"i": [["[\"permute_attn_q_k_v\", 1, 56, 56, 128, 7, 4, \"float16\"]", "cuda -keys=cuda,gpu -max_num_threads=1024 -model=unknown -thread_warp_size=32", [-1, 16, 64, 49152, 2147483647, 1024, 8, 32], "", 0, []], [[], [["FU", 1, [0, 1, 2, 3]], ["SP", 1, 0, 401408, [14], 1], ["AN", 1, 0, 5], ["AN", 1, 1, 6]]]], "r": [[2.41099e-05, 2.41029e-05, 2.41293e-05], 0, 2.62462, 1668082999], "v": "v0.6"}
{"i": [["[\"permute_attn_q_k_v\", 1, 56, 56, 128, 7, 4, \"float16\"]", "cuda -keys=cuda,gpu -max_num_threads=1024 -model=unknown -thread_warp_size=32", [-1, 16, 64, 49152, 2147483647, 1024, 8, 32], "", 0, []], [[], [["FU", 1, [0, 1, 2, 3]], ["SP", 1, 0, 401408, [64], 1], ["AN", 1, 0, 5], ["AN", 1, 1, 6]]]], "r": [[7.211e-06, 7.21412e-06, 7.2169e-06], 0, 1.89624, 1668082998], "v": "v0.6"}
{"i": [["[\"permute_attn_q_k_v\", 1, 56, 56, 128, 7, 4, \"float16\"]", "cuda -keys=cuda,gpu -max_num_threads=1024 -model=unknown -thread_warp_size=32", [-1, 16, 64, 49152, 2147483647, 1024, 8, 32], "", 0, []], [[], [["FU", 1, [0, 1, 2, 3]], ["SP", 1, 0, 401408, [1], 1], ["AN", 1, 0, 5], ["AN", 1, 1, 6]]]], "r": [[0.000300522, 0.000300476, 0.00030056], 0, 1.58435, 1668082998], "v": "v0.6"}
{"i": [["[\"permute_attn_q_k_v\", 1, 56, 56, 128, 7, 4, \"float16\"]", "cuda -keys=cuda,gpu -max_num_threads=1024 -model=unknown -thread_warp_size=32", [-1, 16, 64, 49152, 2147483647, 1024, 8, 32], "", 0, []], [[], [["FU", 1, [0, 1, 2, 3]], ["SP", 1, 0, 401408, [32], 1], ["AN", 1, 0, 5], ["AN", 1, 1, 6]]]], "r": [[1.21055e-05, 1.21163e-05, 1.21132e-05], 0, 0.5593, 1668082997], "v": "v0.6"}
{"i": [["[\"permute_attn_q_k_v\", 1, 56, 56, 128, 7, 4, \"float16\"]", "cuda -keys=cuda,gpu -max_num_threads=1024 -model=unknown -thread_warp_size=32", [-1, 16, 64, 49152, 2147483647, 1024, 8, 32], "", 0, []], [[], [["FU", 1, [0, 1, 2, 3]], ["SP", 1, 0, 401408, [7], 1], ["AN", 1, 0, 5], ["AN", 1, 1, 6]]]], "r": [[4.54157e-05, 4.54392e-05, 4.54344e-05], 0, 1.25163, 1668082998], "v": "v0.6"}
{"i": [["[\"permute_attn_q_k_v\", 1, 56, 56, 128, 7, 4, \"float16\"]", "cuda -keys=cuda,gpu -max_num_threads=1024 -model=unknown -thread_warp_size=32", [-1, 16, 64, 49152, 2147483647, 1024, 8, 32], "", 0, []], [[], [["FU", 1, [0, 1, 2, 3]], ["SP", 1, 0, 401408, [16], 1], ["AN", 1, 0, 5], ["AN", 1, 1, 6]]]], "r": [[2.15171e-05, 2.1531e-05, 2.15492e-05], 0, 2.27669, 1668082999], "v": "v0.6"}
{"i": [["[\"permute_attn_q_k_v\", 1, 56, 56, 128, 7, 4, \"float16\"]", "cuda -keys=cuda,gpu -max_num_threads=1024 -model=unknown -thread_warp_size=32", [-1, 16, 64, 49152, 2147483647, 1024, 8, 32], "", 0, []], [[], [["FU", 1, [0, 1, 2, 3]], ["SP", 1, 0, 401408, [4], 1], ["AN", 1, 0, 5], ["AN", 1, 1, 6]]]], "r": [[7.71958e-05, 7.72148e-05, 7.71991e-05], 0, 0.877615, 1668082997], "v": "v0.6"}
{"i": [["[\"permute_attn_q_k_v\", 1, 56, 56, 128, 7, 4, \"float16\"]", "cuda -keys=cuda,gpu -max_num_threads=1024 -model=unknown -thread_warp_size=32", [-1, 16, 64, 49152, 2147483647, 1024, 8, 32], "", 0, []], [[], [["FU", 1, [0, 1, 2, 3]], ["SP", 1, 0, 401408, [56], 1], ["AN", 1, 0, 5], ["AN", 1, 1, 6]]]], "r": [[8.01502e-06, 8.02928e-06, 8.02344e-06], 0, 3.6663, 1668083000], "v": "v0.6"}
{"i": [["[\"permute_attn_q_k_v\", 1, 56, 56, 128, 7, 4, \"float16\"]", "cuda -keys=cuda,gpu -max_num_threads=1024 -model=unknown -thread_warp_size=32", [-1, 16, 64, 49152, 2147483647, 1024, 8, 32], "", 0, []], [[], [["FU", 1, [0, 1, 2, 3]], ["SP", 1, 0, 401408, [49], 1], ["AN", 1, 0, 5], ["AN", 1, 1, 6]]]], "r": [[8.8138e-06, 8.82246e-06, 8.81878e-06], 0, 2.95181, 1668082999], "v": "v0.6"}
{"i": [["[\"permute_attn_q_k_v\", 1, 56, 56, 128, 7, 4, \"float16\"]", "cuda -keys=cuda,gpu -max_num_threads=1024 -model=unknown -thread_warp_size=32", [-1, 16, 64, 49152, 2147483647, 1024, 8, 32], "", 0, []], [[], [["FU", 1, [0, 1, 2, 3]], ["SP", 1, 0, 401408, [8], 1], ["AN", 1, 0, 5], ["AN", 1, 1, 6]]]], "r": [[3.9957e-05, 3.99685e-05, 3.99666e-05], 0, 4.38032, 1668083001], "v": "v0.6"}
{"i": [["[\"permute_attn_q_k_v\", 1, 56, 56, 128, 7, 4, \"float16\"]", "cuda -keys=cuda,gpu -max_num_threads=1024 -model=unknown -thread_warp_size=32", [-1, 16, 64, 49152, 2147483647, 1024, 8, 32], "", 0, []], [[], [["FU", 1, [0, 1, 2, 3]], ["SP", 1, 0, 401408, [2], 1], ["AN", 1, 0, 5], ["AN", 1, 1, 6]]]], "r": [[0.000151641, 0.000151654, 0.000151662], 0, 3.34549, 1668083000], "v": "v0.6"}
{"i": [["[\"permute_attn_q_k_v\", 1, 56, 56, 128, 7, 4, \"float16\"]", "cuda -keys=cuda,gpu -max_num_threads=1024 -model=unknown -thread_warp_size=32", [-1, 16, 64, 49152, 2147483647, 1024, 8, 32], "", 0, []], [[], [["FU", 1, [0, 1, 2, 3]], ["SP", 1, 0, 401408, [28], 1], ["AN", 1, 0, 5], ["AN", 1, 1, 6]]]], "r": [[1.34741e-05, 1.34882e-05, 1.34875e-05], 0, 3.99446, 1668083000], "v": "v0.6"}
{"i": [["[\"permute_attn_q_k_v\", 1, 56, 56, 128, 7, 4, \"float16\"]", "cuda -keys=cuda,gpu -max_num_threads=1024 -model=unknown -thread_warp_size=32", [-1, 16, 64, 49152, 2147483647, 1024, 8, 32], "", 0, []], [[], [["FU", 1, [0, 1, 2, 3]], ["SP", 1, 0, 401408, [32], 1], ["AN", 1, 0, 5], ["AN", 1, 1, 6]]]], "r": [[1.20495e-05, 1.20608e-05, 1.2062e-05], 0, 1.89755, 1668083015], "v": "v0.6"}
{"i": [["[\"permute_attn_q_k_v\", 1, 56, 56, 128, 7, 4, \"float16\"]", "cuda -keys=cuda,gpu -max_num_threads=1024 -model=unknown -thread_warp_size=32", [-1, 16, 64, 49152, 2147483647, 1024, 8, 32], "", 0, []], [[], [["FU", 1, [0, 1, 2, 3]], ["SP", 1, 0, 401408, [4], 1], ["AN", 1, 0, 5], ["AN", 1, 1, 6]]]], "r": [[7.71282e-05, 7.71318e-05, 7.71507e-05], 0, 1.57831, 1668083015], "v": "v0.6"}
{"i": [["[\"permute_attn_q_k_v\", 1, 56, 56, 128, 7, 4, \"float16\"]", "cuda -keys=cuda,gpu -max_num_threads=1024 -model=unknown -thread_warp_size=32", [-1, 16, 64, 49152, 2147483647, 1024, 8, 32], "", 0, []], [[], [["FU", 1, [0, 1, 2, 3]], ["SP", 1, 0, 401408, [8], 1], ["AN", 1, 0, 5], ["AN", 1, 1, 6]]]], "r": [[3.99238e-05, 3.99325e-05, 3.99333e-05], 0, 2.27065, 1668083016], "v": "v0.6"}
{"i": [["[\"permute_attn_q_k_v\", 1, 56, 56, 128, 7, 4, \"float16\"]", "cuda -keys=cuda,gpu -max_num_threads=1024 -model=unknown -thread_warp_size=32", [-1, 16, 64, 49152, 2147483647, 1024, 8, 32], "", 0, []], [[], [["FU", 1, [0, 1, 2, 3]], ["SP", 1, 0, 401408, [28], 1], ["AN", 1, 0, 5], ["AN", 1, 1, 6]]]], "r": [[1.34427e-05, 1.34579e-05, 1.34531e-05], 0, 2.60884, 1668083016], "v": "v0.6"}
{"i": [["[\"permute_attn_q_k_v\", 1, 56, 56, 128, 7, 4, \"float16\"]", "cuda -keys=cuda,gpu -max_num_threads=1024 -model=unknown -thread_warp_size=32", [-1, 16, 64, 49152, 2147483647, 1024, 8, 32], "", 0, []], [[], [["FU", 1, [0, 1, 2, 3]], ["SP", 1, 0, 401408, [2], 1], ["AN", 1, 0, 5], ["AN", 1, 1, 6]]]], "r": [[0.000151594, 0.000151567, 0.000151599], 0, 0.554285, 1668083014], "v": "v0.6"}
{"i": [["[\"permute_attn_q_k_v\", 1, 56, 56, 128, 7, 4, \"float16\"]", "cuda -keys=cuda,gpu -max_num_threads=1024 -model=unknown -thread_warp_size=32", [-1, 16, 64, 49152, 2147483647, 1024, 8, 32], "", 0, []], [[], [["FU", 1, [0, 1, 2, 3]], ["SP", 1, 0, 401408, [7], 1], ["AN", 1, 0, 5], ["AN", 1, 1, 6]]]], "r": [[4.5239e-05, 4.52476e-05, 4.52448e-05], 0, 0.878084, 1668083014], "v": "v0.6"}
{"i": [["[\"permute_attn_q_k_v\", 1, 56, 56, 128, 7, 4, \"float16\"]", "cuda -keys=cuda,gpu -max_num_threads=1024 -model=unknown -thread_warp_size=32", [-1, 16, 64, 49152, 2147483647, 1024, 8, 32], "", 0, []], [[], [["FU", 1, [0, 1, 2, 3]], ["SP", 1, 0, 401408, [64], 1], ["AN", 1, 0, 5], ["AN", 1, 1, 6]]]], "r": [[7.20915e-06, 7.23089e-06, 7.2187e-06], 0, 2.93779, 1668083016], "v": "v0.6"}
{"i": [["[\"permute_attn_q_k_v\", 1, 56, 56, 128, 7, 4, \"float16\"]", "cuda -keys=cuda,gpu -max_num_threads=1024 -model=unknown -thread_warp_size=32", [-1, 16, 64, 49152, 2147483647, 1024, 8, 32], "", 0, []], [[], [["FU", 1, [0, 1, 2, 3]], ["SP", 1, 0, 401408, [1], 1], ["AN", 1, 0, 5], ["AN", 1, 1, 6]]]], "r": [[0.000300401, 0.000300422, 0.000300394], 0, 1.24563, 1668083015], "v": "v0.6"}
{"i": [["[\"permute_attn_q_k_v\", 1, 56, 56, 128, 7, 4, \"float16\"]", "cuda -keys=cuda,gpu -max_num_threads=1024 -model=unknown -thread_warp_size=32", [-1, 16, 64, 49152, 2147483647, 1024, 8, 32], "", 0, []], [[], [["FU", 1, [0, 1, 2, 3]], ["SP", 1, 0, 401408, [56], 1], ["AN", 1, 0, 5], ["AN", 1, 1, 6]]]], "r": [[7.88836e-06, 7.90385e-06, 7.89804e-06], 0, 3.28608, 1668083017], "v": "v0.6"}
{"i": [["[\"permute_attn_q_k_v\", 1, 56, 56, 128, 7, 4, \"float16\"]", "cuda -keys=cuda,gpu -max_num_threads=1024 -model=unknown -thread_warp_size=32", [-1, 16, 64, 49152, 2147483647, 1024, 8, 32], "", 0, []], [[], [["FU", 1, [0, 1, 2, 3]], ["SP", 1, 0, 401408, [49], 1], ["AN", 1, 0, 5], ["AN", 1, 1, 6]]]], "r": [[8.83714e-06, 8.85571e-06, 8.85293e-06], 0, 3.62112, 1668083017], "v": "v0.6"}
{"i": [["[\"permute_attn_q_k_v\", 1, 56, 56, 128, 7, 4, \"float16\"]", "cuda -keys=cuda,gpu -max_num_threads=1024 -model=unknown -thread_warp_size=32", [-1, 16, 64, 49152, 2147483647, 1024, 8, 32], "", 0, []], [[], [["FU", 1, [0, 1, 2, 3]], ["SP", 1, 0, 401408, [14], 1], ["AN", 1, 0, 5], ["AN", 1, 1, 6]]]], "r": [[2.42528e-05, 2.42626e-05, 2.42702e-05], 0, 3.94522, 1668083017], "v": "v0.6"}
{"i": [["[\"permute_attn_q_k_v\", 1, 56, 56, 128, 7, 4, \"float16\"]", "cuda -keys=cuda,gpu -max_num_threads=1024 -model=unknown -thread_warp_size=32", [-1, 16, 64, 49152, 2147483647, 1024, 8, 32], "", 0, []], [[], [["FU", 1, [0, 1, 2, 3]], ["SP", 1, 0, 401408, [16], 1], ["AN", 1, 0, 5], ["AN", 1, 1, 6]]]], "r": [[2.14908e-05, 2.14903e-05, 2.1497e-05], 0, 4.29792, 1668083018], "v": "v0.6"}
{"i": [["[\"permute_attn_q_k_v\", 1, 56, 56, 128, 7, 4, \"float16\"]", "cuda -keys=cuda,gpu -max_num_threads=1024 -model=unknown -thread_warp_size=32", [-1, 16, 64, 49152, 2147483647, 1024, 8, 32], "", 0, []], [[], [["FU", 1, [0, 1, 2, 3]], ["SP", 1, 0, 401408, [8], 1], ["AN", 1, 0, 5], ["AN", 1, 1, 6]]]], "r": [[3.99759e-05, 3.9996e-05, 3.99911e-05], 0, 1.9116, 1668083033], "v": "v0.6"}
{"i": [["[\"permute_attn_q_k_v\", 1, 56, 56, 128, 7, 4, \"float16\"]", "cuda -keys=cuda,gpu -max_num_threads=1024 -model=unknown -thread_warp_size=32", [-1, 16, 64, 49152, 2147483647, 1024, 8, 32], "", 0, []], [[], [["FU", 1, [0, 1, 2, 3]], ["SP", 1, 0, 401408, [64], 1], ["AN", 1, 0, 5], ["AN", 1, 1, 6]]]], "r": [[7.23002e-06, 7.24806e-06, 7.24604e-06], 0, 1.24208, 1668083032], "v": "v0.6"}
{"i": [["[\"permute_attn_q_k_v\", 1, 56, 56, 128, 7, 4, \"float16\"]", "cuda -keys=cuda,gpu -max_num_threads=1024 -model=unknown -thread_warp_size=32", [-1, 16, 64, 49152, 2147483647, 1024, 8, 32], "", 0, []], [[], [["FU", 1, [0, 1, 2, 3]], ["SP", 1, 0, 401408, [2], 1], ["AN", 1, 0, 5], ["AN", 1, 1, 6]]]], "r": [[0.000151627, 0.000151589, 0.00015163], 0, 0.889105, 1668083031], "v": "v0.6"}
{"i": [["[\"permute_attn_q_k_v\", 1, 56, 56, 128, 7, 4, \"float16\"]", "cuda -keys=cuda,gpu -max_num_threads=1024 -model=unknown -thread_warp_size=32", [-1, 16, 64, 49152, 2147483647, 1024, 8, 32], "", 0, []], [[], [["FU", 1, [0, 1, 2, 3]], ["SP", 1, 0, 401408, [4], 1], ["AN", 1, 0, 5], ["AN", 1, 1, 6]]]], "r": [[7.73182e-05, 7.72704e-05, 7.73088e-05], 0, 2.61973, 1668083033], "v": "v0.6"}
{"i": [["[\"permute_attn_q_k_v\", 1, 56, 56, 128, 7, 4, \"float16\"]", "cuda -keys=cuda,gpu -max_num_threads=1024 -model=unknown -thread_warp_size=32", [-1, 16, 64, 49152, 2147483647, 1024, 8, 32], "", 0, []], [[], [["FU", 1, [0, 1, 2, 3]], ["SP", 1, 0, 401408, [49], 1], ["AN", 1, 0, 5], ["AN", 1, 1, 6]]]], "r": [[8.64947e-06, 8.66091e-06, 8.66075e-06], 0, 2.28044, 1668083033], "v": "v0.6"}
{"i": [["[\"permute_attn_q_k_v\", 1, 56, 56, 128, 7, 4, \"float16\"]", "cuda -keys=cuda,gpu -max_num_threads=1024 -model=unknown -thread_warp_size=32", [-1, 16, 64, 49152, 2147483647, 1024, 8, 32], "", 0, []], [[], [["FU", 1, [0, 1, 2, 3]], ["SP", 1, 0, 401408, [1], 1], ["AN", 1, 0, 5], ["AN", 1, 1, 6]]]], "r": [[0.000300546, 0.000300446, 0.000300518], 0, 0.564548, 1668083031], "v": "v0.6"}
{"i": [["[\"permute_attn_q_k_v\", 1, 56, 56, 128, 7, 4, \"float16\"]", "cuda -keys=cuda,gpu -max_num_threads=1024 -model=unknown -thread_warp_size=32", [-1, 16, 64, 49152, 2147483647, 1024, 8, 32], "", 0, []], [[], [["FU", 1, [0, 1, 2, 3]], ["SP", 1, 0, 401408, [14], 1], ["AN", 1, 0, 5], ["AN", 1, 1, 6]]]], "r": [[2.40909e-05, 2.41053e-05, 2.41023e-05], 0, 1.57326, 1668083032], "v": "v0.6"}
{"i": [["[\"permute_attn_q_k_v\", 1, 56, 56, 128, 7, 4, \"float16\"]", "cuda -keys=cuda,gpu -max_num_threads=1024 -model=unknown -thread_warp_size=32", [-1, 16, 64, 49152, 2147483647, 1024, 8, 32], "", 0, []], [[], [["FU", 1, [0, 1, 2, 3]], ["SP", 1, 0, 401408, [56], 1], ["AN", 1, 0, 5], ["AN", 1, 1, 6]]]], "r": [[7.94663e-06, 7.96256e-06, 7.96208e-06], 0, 3.30676, 1668083034], "v": "v0.6"}
{"i": [["[\"permute_attn_q_k_v\", 1, 56, 56, 128, 7, 4, \"float16\"]", "cuda -keys=cuda,gpu -max_num_threads=1024 -model=unknown -thread_warp_size=32", [-1, 16, 64, 49152, 2147483647, 1024, 8, 32], "", 0, []], [[], [["FU", 1, [0, 1, 2, 3]], ["SP", 1, 0, 401408, [28], 1], ["AN", 1, 0, 5], ["AN", 1, 1, 6]]]], "r": [[1.35611e-05, 1.35815e-05, 1.35843e-05], 0, 3.62897, 1668083034], "v": "v0.6"}
{"i": [["[\"permute_attn_q_k_v\", 1, 56, 56, 128, 7, 4, \"float16\"]", "cuda -keys=cuda,gpu -max_num_threads=1024 -model=unknown -thread_warp_size=32", [-1, 16, 64, 49152, 2147483647, 1024, 8, 32], "", 0, []], [[], [["FU", 1, [0, 1, 2, 3]], ["SP", 1, 0, 401408, [16], 1], ["AN", 1, 0, 5], ["AN", 1, 1, 6]]]], "r": [[2.15208e-05, 2.15333e-05, 2.15205e-05], 0, 3.93298, 1668083035], "v": "v0.6"}
{"i": [["[\"permute_attn_q_k_v\", 1, 56, 56, 128, 7, 4, \"float16\"]", "cuda -keys=cuda,gpu -max_num_threads=1024 -model=unknown -thread_warp_size=32", [-1, 16, 64, 49152, 2147483647, 1024, 8, 32], "", 0, []], [[], [["FU", 1, [0, 1, 2, 3]], ["SP", 1, 0, 401408, [32], 1], ["AN", 1, 0, 5], ["AN", 1, 1, 6]]]], "r": [[1.21688e-05, 1.21851e-05, 1.21863e-05], 0, 4.31011, 1668083035], "v": "v0.6"}
{"i": [["[\"permute_attn_q_k_v\", 1, 56, 56, 128, 7, 4, \"float16\"]", "cuda -keys=cuda,gpu -max_num_threads=1024 -model=unknown -thread_warp_size=32", [-1, 16, 64, 49152, 2147483647, 1024, 8, 32], "", 0, []], [[], [["FU", 1, [0, 1, 2, 3]], ["SP", 1, 0, 401408, [7], 1], ["AN", 1, 0, 5], ["AN", 1, 1, 6]]]], "r": [[4.52625e-05, 4.52682e-05, 4.52665e-05], 0, 2.93552, 1668083034], "v": "v0.6"}
{"i": [["[\"permute_attn_q_k_v\", 1, 56, 56, 128, 7, 4, \"float16\"]", "cuda -keys=cuda,gpu -max_num_threads=1024 -model=unknown -thread_warp_size=32", [-1, 16, 64, 49152, 2147483647, 1024, 8, 32], "", 0, []], [[], [["FU", 1, [0, 1, 2, 3]], ["SP", 1, 0, 401408, [4], 1], ["AN", 1, 0, 5], ["AN", 1, 1, 6]]]], "r": [[7.71754e-05, 7.71771e-05, 7.71823e-05], 0, 0.949284, 1668083053], "v": "v0.6"}
{"i": [["[\"permute_attn_q_k_v\", 1, 56, 56, 128, 7, 4, \"float16\"]", "cuda -keys=cuda,gpu -max_num_threads=1024 -model=unknown -thread_warp_size=32", [-1, 16, 64, 49152, 2147483647, 1024, 8, 32], "", 0, []], [[], [["FU", 1, [0, 1, 2, 3]], ["SP", 1, 0, 401408, [16], 1], ["AN", 1, 0, 5], ["AN", 1, 1, 6]]]], "r": [[2.15301e-05, 2.15115e-05, 2.15041e-05], 0, 1.96927, 1668083054], "v": "v0.6"}
{"i": [["[\"permute_attn_q_k_v\", 1, 56, 56, 128, 7, 4, \"float16\"]", "cuda -keys=cuda,gpu -max_num_threads=1024 -model=unknown -thread_warp_size=32", [-1, 16, 64, 49152, 2147483647, 1024, 8, 32], "", 0, []], [[], [["FU", 1, [0, 1, 2, 3]], ["SP", 1, 0, 401408, [1], 1], ["AN", 1, 0, 5], ["AN", 1, 1, 6]]]], "r": [[0.000300513, 0.000300429, 0.000300508], 0, 1.60095, 1668083053], "v": "v0.6"}
{"i": [["[\"permute_attn_q_k_v\", 1, 56, 56, 128, 7, 4, \"float16\"]", "cuda -keys=cuda,gpu -max_num_threads=1024 -model=unknown -thread_warp_size=32", [-1, 16, 64, 49152, 2147483647, 1024, 8, 32], "", 0, []], [[], [["FU", 1, [0, 1, 2, 3]], ["SP", 1, 0, 401408, [32], 1], ["AN", 1, 0, 5], ["AN", 1, 1, 6]]]], "r": [[1.2162e-05, 1.21624e-05, 1.21709e-05], 0, 2.28897, 1668083054], "v": "v0.6"}
{"i": [["[\"permute_attn_q_k_v\", 1, 56, 56, 128, 7, 4, \"float16\"]", "cuda -keys=cuda,gpu -max_num_threads=1024 -model=unknown -thread_warp_size=32", [-1, 16, 64, 49152, 2147483647, 1024, 8, 32], "", 0, []], [[], [["FU", 1, [0, 1, 2, 3]], ["SP", 1, 0, 401408, [49], 1], ["AN", 1, 0, 5], ["AN", 1, 1, 6]]]], "r": [[8.77838e-06, 8.7862e-06, 8.78568e-06], 0, 0.576199, 1668083052], "v": "v0.6"}
{"i": [["[\"permute_attn_q_k_v\", 1, 56, 56, 128, 7, 4, \"float16\"]", "cuda -keys=cuda,gpu -max_num_threads=1024 -model=unknown -thread_warp_size=32", [-1, 16, 64, 49152, 2147483647, 1024, 8, 32], "", 0, []], [[], [["FU", 1, [0, 1, 2, 3]], ["SP", 1, 0, 401408, [64], 1], ["AN", 1, 0, 5], ["AN", 1, 1, 6]]]], "r": [[7.28711e-06, 7.29342e-06, 7.29449e-06], 0, 3.00122, 1668083055], "v": "v0.6"}
{"i": [["[\"permute_attn_q_k_v\", 1, 56, 56, 128, 7, 4, \"float16\"]", "cuda -keys=cuda,gpu -max_num_threads=1024 -model=unknown -thread_warp_size=32", [-1, 16, 64, 49152, 2147483647, 1024, 8, 32], "", 0, []], [[], [["FU", 1, [0, 1, 2, 3]], ["SP", 1, 0, 401408, [2], 1], ["AN", 1, 0, 5], ["AN", 1, 1, 6]]]], "r": [[0.00015168, 0.000151685, 0.000151725], 0, 1.2729, 1668083053], "v": "v0.6"}
{"i": [["[\"permute_attn_q_k_v\", 1, 56, 56, 128, 7, 4, \"float16\"]", "cuda -keys=cuda,gpu -max_num_threads=1024 -model=unknown -thread_warp_size=32", [-1, 16, 64, 49152, 2147483647, 1024, 8, 32], "", 0, []], [[], [["FU", 1, [0, 1, 2, 3]], ["SP", 1, 0, 401408, [8], 1], ["AN", 1, 0, 5], ["AN", 1, 1, 6]]]], "r": [[3.99365e-05, 3.99565e-05, 3.9946e-05], 0, 2.63421, 1668083055], "v": "v0.6"}
{"i": [["[\"permute_attn_q_k_v\", 1, 56, 56, 128, 7, 4, \"float16\"]", "cuda -keys=cuda,gpu -max_num_threads=1024 -model=unknown -thread_warp_size=32", [-1, 16, 64, 49152, 2147483647, 1024, 8, 32], "", 0, []], [[], [["FU", 1, [0, 1, 2, 3]], ["SP", 1, 0, 401408, [28], 1], ["AN", 1, 0, 5], ["AN", 1, 1, 6]]]], "r": [[1.36482e-05, 1.3659e-05, 1.36608e-05], 0, 3.33514, 1668083055], "v": "v0.6"}
{"i": [["[\"permute_attn_q_k_v\", 1, 56, 56, 128, 7, 4, \"float16\"]", "cuda -keys=cuda,gpu -max_num_threads=1024 -model=unknown -thread_warp_size=32", [-1, 16, 64, 49152, 2147483647, 1024, 8, 32], "", 0, []], [[], [["FU", 1, [0, 1, 2, 3]], ["SP", 1, 0, 401408, [56], 1], ["AN", 1, 0, 5], ["AN", 1, 1, 6]]]], "r": [[7.88412e-06, 7.8977e-06, 7.89274e-06], 0, 3.66355, 1668083056], "v": "v0.6"}
{"i": [["[\"permute_attn_q_k_v\", 1, 56, 56, 128, 7, 4, \"float16\"]", "cuda -keys=cuda,gpu -max_num_threads=1024 -model=unknown -thread_warp_size=32", [-1, 16, 64, 49152, 2147483647, 1024, 8, 32], "", 0, []], [[], [["FU", 1, [0, 1, 2, 3]], ["SP", 1, 0, 401408, [7], 1], ["AN", 1, 0, 5], ["AN", 1, 1, 6]]]], "r": [[4.53636e-05, 4.53702e-05, 4.53699e-05], 0, 4.00203, 1668083056], "v": "v0.6"}
{"i": [["[\"permute_attn_q_k_v\", 1, 56, 56, 128, 7, 4, \"float16\"]", "cuda -keys=cuda,gpu -max_num_threads=1024 -model=unknown -thread_warp_size=32", [-1, 16, 64, 49152, 2147483647, 1024, 8, 32], "", 0, []], [[], [["FU", 1, [0, 1, 2, 3]], ["SP", 1, 0, 401408, [14], 1], ["AN", 1, 0, 5], ["AN", 1, 1, 6]]]], "r": [[2.40238e-05, 2.40409e-05, 2.40483e-05], 0, 4.3405, 1668083056], "v": "v0.6"}
{"i": [["[\"permute_attn_q_k_v\", 1, 56, 56, 128, 7, 4, \"float16\"]", "cuda -keys=cuda,gpu -max_num_threads=1024 -model=unknown -thread_warp_size=32", [-1, 16, 64, 49152, 2147483647, 1024, 8, 32], "", 0, []], [[], [["FU", 1, [0, 1, 2, 3]], ["SP", 1, 0, 401408, [8], 1], ["AN", 1, 0, 5], ["AN", 1, 1, 6]]]], "r": [[3.99906e-05, 4.00351e-05, 4.00327e-05], 0, 1.28747, 1668083070], "v": "v0.6"}
{"i": [["[\"permute_attn_q_k_v\", 1, 56, 56, 128, 7, 4, \"float16\"]", "cuda -keys=cuda,gpu -max_num_threads=1024 -model=unknown -thread_warp_size=32", [-1, 16, 64, 49152, 2147483647, 1024, 8, 32], "", 0, []], [[], [["FU", 1, [0, 1, 2, 3]], ["SP", 1, 0, 401408, [64], 1], ["AN", 1, 0, 5], ["AN", 1, 1, 6]]]], "r": [[7.23582e-06, 7.24497e-06, 7.24662e-06], 0, 1.94273, 1668083071], "v": "v0.6"}
{"i": [["[\"permute_attn_q_k_v\", 1, 56, 56, 128, 7, 4, \"float16\"]", "cuda -keys=cuda,gpu -max_num_threads=1024 -model=unknown -thread_warp_size=32", [-1, 16, 64, 49152, 2147483647, 1024, 8, 32], "", 0, []], [[], [["FU", 1, [0, 1, 2, 3]], ["SP", 1, 0, 401408, [49], 1], ["AN", 1, 0, 5], ["AN", 1, 1, 6]]]], "r": [[8.65815e-06, 8.6668e-06, 8.65992e-06], 0, 2.3217, 1668083071], "v": "v0.6"}
{"i": [["[\"permute_attn_q_k_v\", 1, 56, 56, 128, 7, 4, \"float16\"]", "cuda -keys=cuda,gpu -max_num_threads=1024 -model=unknown -thread_warp_size=32", [-1, 16, 64, 49152, 2147483647, 1024, 8, 32], "", 0, []], [[], [["FU", 1, [0, 1, 2, 3]], ["SP", 1, 0, 401408, [14], 1], ["AN", 1, 0, 5], ["AN", 1, 1, 6]]]], "r": [[2.40844e-05, 2.40959e-05, 2.40979e-05], 0, 0.580016, 1668083070], "v": "v0.6"}
{"i": [["[\"permute_attn_q_k_v\", 1, 56, 56, 128, 7, 4, \"float16\"]", "cuda -keys=cuda,gpu -max_num_threads=1024 -model=unknown -thread_warp_size=32", [-1, 16, 64, 49152, 2147483647, 1024, 8, 32], "", 0, []], [[], [["FU", 1, [0, 1, 2, 3]], ["SP", 1, 0, 401408, [56], 1], ["AN", 1, 0, 5], ["AN", 1, 1, 6]]]], "r": [[7.94598e-06, 7.94925e-06, 7.9489e-06], 0, 0.907795, 1668083070], "v": "v0.6"}
{"i": [["[\"permute_attn_q_k_v\", 1, 56, 56, 128, 7, 4, \"float16\"]", "cuda -keys=cuda,gpu -max_num_threads=1024 -model=unknown -thread_warp_size=32", [-1, 16, 64, 49152, 2147483647, 1024, 8, 32], "", 0, []], [[], [["FU", 1, [0, 1, 2, 3]], ["SP", 1, 0, 401408, [2], 1], ["AN", 1, 0, 5], ["AN", 1, 1, 6]]]], "r": [[0.000151684, 0.000151666, 0.000151722], 0, 1.60655, 1668083071], "v": "v0.6"}
{"i": [["[\"permute_attn_q_k_v\", 1, 56, 56, 128, 7, 4, \"float16\"]", "cuda -keys=cuda,gpu -max_num_threads=1024 -model=unknown -thread_warp_size=32", [-1, 16, 64, 49152, 2147483647, 1024, 8, 32], "", 0, []], [[], [["FU", 1, [0, 1, 2, 3]], ["SP", 1, 0, 401408, [32], 1], ["AN", 1, 0, 5], ["AN", 1, 1, 6]]]], "r": [[1.20898e-05, 1.21043e-05, 1.21134e-05], 0, 2.63335, 1668083072], "v": "v0.6"}
{"i": [["[\"permute_attn_q_k_v\", 1, 56, 56, 128, 7, 4, \"float16\"]", "cuda -keys=cuda,gpu -max_num_threads=1024 -model=unknown -thread_warp_size=32", [-1, 16, 64, 49152, 2147483647, 1024, 8, 32], "", 0, []], [[], [["FU", 1, [0, 1, 2, 3]], ["SP", 1, 0, 401408, [28], 1], ["AN", 1, 0, 5], ["AN", 1, 1, 6]]]], "r": [[1.36532e-05, 1.36689e-05, 1.36669e-05], 0, 2.95318, 1668083072], "v": "v0.6"}
{"i": [["[\"permute_attn_q_k_v\", 1, 56, 56, 128, 7, 4, \"float16\"]", "cuda -keys=cuda,gpu -max_num_threads=1024 -model=unknown -thread_warp_size=32", [-1, 16, 64, 49152, 2147483647, 1024, 8, 32], "", 0, []], [[], [["FU", 1, [0, 1, 2, 3]], ["SP", 1, 0, 401408, [7], 1], ["AN", 1, 0, 5], ["AN", 1, 1, 6]]]], "r": [[4.52607e-05, 4.52544e-05, 4.52703e-05], 0, 3.667, 1668083073], "v": "v0.6"}
{"i": [["[\"permute_attn_q_k_v\", 1, 56, 56, 128, 7, 4, \"float16\"]", "cuda -keys=cuda,gpu -max_num_threads=1024 -model=unknown -thread_warp_size=32", [-1, 16, 64, 49152, 2147483647, 1024, 8, 32], "", 0, []], [[], [["FU", 1, [0, 1, 2, 3]], ["SP", 1, 0, 401408, [16], 1], ["AN", 1, 0, 5], ["AN", 1, 1, 6]]]], "r": [[2.14908e-05, 2.15047e-05, 2.15001e-05], 0, 3.32795, 1668083073], "v": "v0.6"}
{"i": [["[\"permute_attn_q_k_v\", 1, 56, 56, 128, 7, 4, \"float16\"]", "cuda -keys=cuda,gpu -max_num_threads=1024 -model=unknown -thread_warp_size=32", [-1, 16, 64, 49152, 2147483647, 1024, 8, 32], "", 0, []], [[], [["FU", 1, [0, 1, 2, 3]], ["SP", 1, 0, 401408, [4], 1], ["AN", 1, 0, 5], ["AN", 1, 1, 6]]]], "r": [[7.72361e-05, 7.72482e-05, 7.72583e-05], 0, 3.98412, 1668083073], "v": "v0.6"}
{"i": [["[\"permute_attn_q_k_v\", 1, 56, 56, 128, 7, 4, \"float16\"]", "cuda -keys=cuda,gpu -max_num_threads=1024 -model=unknown -thread_warp_size=32", [-1, 16, 64, 49152, 2147483647, 1024, 8, 32], "", 0, []], [[], [["FU", 1, [0, 1, 2, 3]], ["SP", 1, 0, 401408, [1], 1], ["AN", 1, 0, 5], ["AN", 1, 1, 6]]]], "r": [[0.000300491, 0.000300504, 0.000300494], 0, 4.35584, 1668083074], "v": "v0.6"}
{"i": [["[\"permute_attn_q_k_v\", 1, 56, 56, 128, 7, 4, \"float16\"]", "cuda -keys=cuda,gpu -max_num_threads=1024 -model=unknown -thread_warp_size=32", [-1, 16, 64, 49152, 2147483647, 1024, 8, 32], "", 0, []], [[], [["FU", 1, [0, 1, 2, 3]], ["SP", 1, 0, 401408, [32], 1], ["AN", 1, 0, 5], ["AN", 1, 1, 6]]]], "r": [[1.21189e-05, 1.21261e-05, 1.21331e-05], 0, 2.29393, 1668083089], "v": "v0.6"}
{"i": [["[\"permute_attn_q_k_v\", 1, 56, 56, 128, 7, 4, \"float16\"]", "cuda -keys=cuda,gpu -max_num_threads=1024 -model=unknown -thread_warp_size=32", [-1, 16, 64, 49152, 2147483647, 1024, 8, 32], "", 0, []], [[], [["FU", 1, [0, 1, 2, 3]], ["SP", 1, 0, 401408, [28], 1], ["AN", 1, 0, 5], ["AN", 1, 1, 6]]]], "r": [[1.34008e-05, 1.34197e-05, 1.34157e-05], 0, 1.59704, 1668083088], "v": "v0.6"}
{"i": [["[\"permute_attn_q_k_v\", 1, 56, 56, 128, 7, 4, \"float16\"]", "cuda -keys=cuda,gpu -max_num_threads=1024 -model=unknown -thread_warp_size=32", [-1, 16, 64, 49152, 2147483647, 1024, 8, 32], "", 0, []], [[], [["FU", 1, [0, 1, 2, 3]], ["SP", 1, 0, 401408, [7], 1], ["AN", 1, 0, 5], ["AN", 1, 1, 6]]]], "r": [[4.53238e-05, 4.53312e-05, 4.53227e-05], 0, 1.26232, 1668083088], "v": "v0.6"}
{"i": [["[\"permute_attn_q_k_v\", 1, 56, 56, 128, 7, 4, \"float16\"]", "cuda -keys=cuda,gpu -max_num_threads=1024 -model=unknown -thread_warp_size=32", [-1, 16, 64, 49152, 2147483647, 1024, 8, 32], "", 0, []], [[], [["FU", 1, [0, 1, 2, 3]], ["SP", 1, 0, 401408, [4], 1], ["AN", 1, 0, 5], ["AN", 1, 1, 6]]]], "r": [[7.7181e-05, 7.71798e-05, 7.71993e-05], 0, 2.94806, 1668083090], "v": "v0.6"}
{"i": [["[\"permute_attn_q_k_v\", 1, 56, 56, 128, 7, 4, \"float16\"]", "cuda -keys=cuda,gpu -max_num_threads=1024 -model=unknown -thread_warp_size=32", [-1, 16, 64, 49152, 2147483647, 1024, 8, 32], "", 0, []], [[], [["FU", 1, [0, 1, 2, 3]], ["SP", 1, 0, 401408, [56], 1], ["AN", 1, 0, 5], ["AN", 1, 1, 6]]]], "r": [[7.94712e-06, 7.95945e-06, 7.95519e-06], 0, 0.56901, 1668083087], "v": "v0.6"}
{"i": [["[\"permute_attn_q_k_v\", 1, 56, 56, 128, 7, 4, \"float16\"]", "cuda -keys=cuda,gpu -max_num_threads=1024 -model=unknown -thread_warp_size=32", [-1, 16, 64, 49152, 2147483647, 1024, 8, 32], "", 0, []], [[], [["FU", 1, [0, 1, 2, 3]], ["SP", 1, 0, 401408, [2], 1], ["AN", 1, 0, 5], ["AN", 1, 1, 6]]]], "r": [[0.0001516, 0.000151593, 0.000151603], 0, 0.882247, 1668083087], "v": "v0.6"}
