python/models/swin_transformer/kernel_configs/swin_transformer_fused_reshape_permute_1_32_32_256_8_8
{"i": [["[\"fused_reshape_permute\", 1, 32, 32, 256, 8, 8]", "cuda -keys=cuda,gpu -max_num_threads=1024 -model=unknown -thread_warp_size=32", [-1, 16, 64, 49152, 2147483647, 1024, 8, 32], "", 0, []], [[], [["FU", 1, [0, 1, 2, 3, 4]], ["SP", 1, 0, 786432, [24], 1], ["AN", 1, 0, 5], ["AN", 1, 1, 6]]]], "r": [[2.70036e-05, 2.70046e-05, 2.70049e-05, 2.75318e-05, 2.70052e-05, 2.70069e-05, 2.7016e-05, 2.70118e-05, 2.7003e-05, 2.70015e-05], 0, 11.3314, 1651933595], "v": "v0.6"}
{"i": [["[\"fused_reshape_permute\", 1, 32, 32, 256, 8, 8]", "cuda -keys=cuda,gpu -max_num_threads=1024 -model=unknown -thread_warp_size=32", [-1, 16, 64, 49152, 2147483647, 1024, 8, 32], "", 0, []], [[], [["FU", 1, [0, 1, 2, 3, 4]], ["SP", 1, 0, 786432, [32], 1], ["AN", 1, 0, 5], ["AN", 1, 1, 6]]]], "r": [[2.11305e-05, 2.11281e-05, 2.11315e-05, 2.11337e-05, 2.11317e-05, 2.11287e-05, 2.1127e-05, 2.11312e-05, 2.113e-05, 2.11311e-05], 0, 21.6556, 1651933605], "v": "v0.6"}
{"i": [["[\"fused_reshape_permute\", 1, 32, 32, 256, 8, 8]", "cuda -keys=cuda,gpu -max_num_threads=1024 -model=unknown -thread_warp_size=32", [-1, 16, 64, 49152, 2147483647, 1024, 8, 32], "", 0, []], [[], [["FU", 1, [0, 1, 2, 3, 4]], ["SP", 1, 0, 786432, [8], 1], ["AN", 1, 0, 5], ["AN", 1, 1, 6]]]], "r": [[7.57718e-05, 7.5912e-05, 7.5772e-05, 7.57722e-05, 7.57736e-05, 7.57687e-05, 7.57749e-05, 7.57672e-05, 7.57707e-05, 7.57729e-05], 0, 5.94794, 1651933589], "v": "v0.6"}
{"i": [["[\"fused_reshape_permute\", 1, 32, 32, 256, 8, 8]", "cuda -keys=cuda,gpu -max_num_threads=1024 -model=unknown -thread_warp_size=32", [-1, 16, 64, 49152, 2147483647, 1024, 8, 32], "", 0, []], [[], [["FU", 1, [0, 1, 2, 3, 4]], ["SP", 1, 0, 786432, [4], 1], ["AN", 1, 0, 5], ["AN", 1, 1, 6]]]], "r": [[0.000148484, 0.000148516, 0.000148461, 0.000148462, 0.000148463, 0.000148489, 0.000148469, 0.000148453, 0.00014846, 0.000148465], 0, 16.9479, 1651933601], "v": "v0.6"}
{"i": [["[\"fused_reshape_permute\", 1, 32, 32, 256, 8, 8]", "cuda -keys=cuda,gpu -max_num_threads=1024 -model=unknown -thread_warp_size=32", [-1, 16, 64, 49152, 2147483647, 1024, 8, 32], "", 0, []], [[], [["FU", 1, [0, 1, 2, 3, 4]], ["SP", 1, 0, 786432, [2], 1], ["AN", 1, 0, 5], ["AN", 1, 1, 6]]]], "r": [[0.00029511, 0.000294157, 0.000294042, 0.000294079, 0.000294143, 0.000294074, 0.0002941, 0.000294057, 0.000294054, 0.000294065], 0, 48.8104, 1651933633], "v": "v0.6"}
{"i": [["[\"fused_reshape_permute\", 1, 32, 32, 256, 8, 8]", "cuda -keys=cuda,gpu -max_num_threads=1024 -model=unknown -thread_warp_size=32", [-1, 16, 64, 49152, 2147483647, 1024, 8, 32], "", 0, []], [[], [["FU", 1, [0, 1, 2, 3, 4]], ["SP", 1, 0, 786432, [64], 1], ["AN", 1, 0, 5], ["AN", 1, 1, 6]]]], "r": [[1.17173e-05, 1.17221e-05, 1.1717e-05, 1.17223e-05, 1.1723e-05, 1.17217e-05, 1.17196e-05, 1.17193e-05, 1.17494e-05, 1.17181e-05], 0, 53.5339, 1651933637], "v": "v0.6"}
{"i": [["[\"fused_reshape_permute\", 1, 32, 32, 256, 8, 8]", "cuda -keys=cuda,gpu -max_num_threads=1024 -model=unknown -thread_warp_size=32", [-1, 16, 64, 49152, 2147483647, 1024, 8, 32], "", 0, []], [[], [["FU", 1, [0, 1, 2, 3, 4]], ["SP", 1, 0, 786432, [1], 1], ["AN", 1, 0, 5], ["AN", 1, 1, 6]]]], "r": [[0.000585408, 0.000585437, 0.000587442, 0.000585498, 0.000585441, 0.000585511, 0.000585423, 0.00058545, 0.000585553, 0.000585496], 0, 27.0041, 1651933611], "v": "v0.6"}
{"i": [["[\"fused_reshape_permute\", 1, 32, 32, 256, 8, 8]", "cuda -keys=cuda,gpu -max_num_threads=1024 -model=unknown -thread_warp_size=32", [-1, 16, 64, 49152, 2147483647, 1024, 8, 32], "", 0, []], [[], [["FU", 1, [0, 1, 2, 3, 4]], ["SP", 1, 0, 786432, [12], 1], ["AN", 1, 0, 5], ["AN", 1, 1, 6]]]], "r": [[5.13064e-05, 5.13164e-05, 5.1305e-05, 5.1305e-05, 5.13045e-05, 5.13044e-05, 5.13042e-05, 5.13065e-05, 5.13052e-05, 5.13073e-05], 0, 63.5845, 1651933648], "v": "v0.6"}
{"i": [["[\"fused_reshape_permute\", 1, 32, 32, 256, 8, 8]", "cuda -keys=cuda,gpu -max_num_threads=1024 -model=unknown -thread_warp_size=32", [-1, 16, 64, 49152, 2147483647, 1024, 8, 32], "", 0, []], [[], [["FU", 1, [0, 1, 2, 3, 4]], ["SP", 1, 0, 786432, [16], 1], ["AN", 1, 0, 5], ["AN", 1, 1, 6]]]], "r": [[3.90549e-05, 3.90532e-05, 3.90556e-05, 3.90588e-05, 3.90565e-05, 3.90568e-05, 3.90552e-05, 3.90594e-05, 3.90663e-05, 3.90569e-05], 0, 37.7472, 1651933622], "v": "v0.6"}
{"i": [["[\"fused_reshape_permute\", 1, 32, 32, 256, 8, 8]", "cuda -keys=cuda,gpu -max_num_threads=1024 -model=unknown -thread_warp_size=32", [-1, 16, 64, 49152, 2147483647, 1024, 8, 32], "", 0, []], [[], [["FU", 1, [0, 1, 2, 3, 4]], ["SP", 1, 0, 786432, [48], 1], ["AN", 1, 0, 5], ["AN", 1, 1, 6]]]], "r": [[1.48031e-05, 1.48076e-05, 1.47986e-05, 1.48642e-05, 1.48003e-05, 1.4799e-05, 1.47988e-05, 1.47988e-05, 1.47989e-05, 1.47992e-05], 0, 58.3384, 1651933642], "v": "v0.6"}
{"i": [["[\"fused_reshape_permute\", 1, 32, 32, 256, 8, 8]", "cuda -keys=cuda,gpu -max_num_threads=1024 -model=unknown -thread_warp_size=32", [-1, 16, 64, 49152, 2147483647, 1024, 8, 32], "", 0, []], [[], [["FU", 1, [0, 1, 2, 3, 4]], ["SP", 1, 0, 786432, [6], 1], ["AN", 1, 0, 5], ["AN", 1, 1, 6]]]], "r": [[9.98187e-05, 9.98107e-05, 9.98078e-05, 9.98131e-05, 9.97924e-05, 9.98022e-05, 9.98189e-05, 9.97894e-05, 9.98039e-05, 9.97999e-05], 0, 32.7879, 1651933617], "v": "v0.6"}
{"i": [["[\"fused_reshape_permute\", 1, 32, 32, 256, 8, 8]", "cuda -keys=cuda,gpu -max_num_threads=1024 -model=unknown -thread_warp_size=32", [-1, 16, 64, 49152, 2147483647, 1024, 8, 32], "", 0, []], [[], [["FU", 1, [0, 1, 2, 3, 4]], ["SP", 1, 0, 786432, [3], 1], ["AN", 1, 0, 5], ["AN", 1, 1, 6]]]], "r": [[0.00019714, 0.000197289, 0.000197021, 0.000197028, 0.000197024, 0.000197028, 0.000197359, 0.000197022, 0.000197024, 0.000197026], 0, 43.2991, 1651933627], "v": "v0.6"}
{"i": [["[\"fused_reshape_permute\", 1, 32, 32, 256, 8, 8]", "cuda -keys=cuda,gpu -max_num_threads=1024 -model=unknown -thread_warp_size=32", [-1, 16, 64, 49152, 2147483647, 1024, 8, 32], "", 0, []], [[], [["FU", 1, [0, 1, 2, 3, 4]], ["SP", 1, 0, 786432, [6], 1], ["AN", 1, 0, 5], ["AN", 1, 1, 6]]]], "r": [[9.99899e-05, 0.000100007, 9.99809e-05, 9.99723e-05, 9.99831e-05, 9.99812e-05, 9.99902e-05, 9.99919e-05, 0.000101049, 9.99827e-05], 0, 16.9377, 1651934064], "v": "v0.6"}
{"i": [["[\"fused_reshape_permute\", 1, 32, 32, 256, 8, 8]", "cuda -keys=cuda,gpu -max_num_threads=1024 -model=unknown -thread_warp_size=32", [-1, 16, 64, 49152, 2147483647, 1024, 8, 32], "", 0, []], [[], [["FU", 1, [0, 1, 2, 3, 4]], ["SP", 1, 0, 786432, [24], 1], ["AN", 1, 0, 5], ["AN", 1, 1, 6]]]], "r": [[2.69484e-05, 2.69478e-05, 2.69462e-05, 2.69472e-05, 2.69482e-05, 2.6946e-05, 2.69463e-05, 2.69464e-05, 2.6951e-05, 2.69475e-05], 0, 5.66559, 1651934052], "v": "v0.6"}
{"i": [["[\"fused_reshape_permute\", 1, 32, 32, 256, 8, 8]", "cuda -keys=cuda,gpu -max_num_threads=1024 -model=unknown -thread_warp_size=32", [-1, 16, 64, 49152, 2147483647, 1024, 8, 32], "", 0, []], [[], [["FU", 1, [0, 1, 2, 3, 4]], ["SP", 1, 0, 786432, [3], 1], ["AN", 1, 0, 5], ["AN", 1, 1, 6]]]], "r": [[0.000197051, 0.000197114, 0.000197007, 0.000197052, 0.000197056, 0.00019703, 0.00019704, 0.000197005, 0.000197027, 0.00019705], 0, 11.0918, 1651934058], "v": "v0.6"}
{"i": [["[\"fused_reshape_permute\", 1, 32, 32, 256, 8, 8]", "cuda -keys=cuda,gpu -max_num_threads=1024 -model=unknown -thread_warp_size=32", [-1, 16, 64, 49152, 2147483647, 1024, 8, 32], "", 0, []], [[], [["FU", 1, [0, 1, 2, 3, 4]], ["SP", 1, 0, 786432, [16], 1], ["AN", 1, 0, 5], ["AN", 1, 1, 6]]]], "r": [[3.91324e-05, 3.91313e-05, 3.9132e-05, 3.91303e-05, 3.91315e-05, 3.91312e-05, 3.91329e-05, 3.91409e-05, 3.92672e-05, 3.91457e-05], 0, 22.0724, 1651934069], "v": "v0.6"}
{"i": [["[\"fused_reshape_permute\", 1, 32, 32, 256, 8, 8]", "cuda -keys=cuda,gpu -max_num_threads=1024 -model=unknown -thread_warp_size=32", [-1, 16, 64, 49152, 2147483647, 1024, 8, 32], "", 0, []], [[], [["FU", 1, [0, 1, 2, 3, 4]], ["SP", 1, 0, 786432, [48], 1], ["AN", 1, 0, 5], ["AN", 1, 1, 6]]]], "r": [[1.46151e-05, 1.46226e-05, 1.46085e-05, 1.46088e-05, 1.4609e-05, 1.46145e-05, 1.46169e-05, 1.46121e-05, 1.46127e-05, 1.46128e-05], 0, 31.6415, 1651934079], "v": "v0.6"}
{"i": [["[\"fused_reshape_permute\", 1, 32, 32, 256, 8, 8]", "cuda -keys=cuda,gpu -max_num_threads=1024 -model=unknown -thread_warp_size=32", [-1, 16, 64, 49152, 2147483647, 1024, 8, 32], "", 0, []], [[], [["FU", 1, [0, 1, 2, 3, 4]], ["SP", 1, 0, 786432, [32], 1], ["AN", 1, 0, 5], ["AN", 1, 1, 6]]]], "r": [[2.09476e-05, 2.09502e-05, 2.09464e-05, 2.09485e-05, 2.09443e-05, 2.09421e-05, 2.09445e-05, 2.09453e-05, 2.0948e-05, 2.09467e-05], 0, 36.5886, 1651934083], "v": "v0.6"}
{"i": [["[\"fused_reshape_permute\", 1, 32, 32, 256, 8, 8]", "cuda -keys=cuda,gpu -max_num_threads=1024 -model=unknown -thread_warp_size=32", [-1, 16, 64, 49152, 2147483647, 1024, 8, 32], "", 0, []], [[], [["FU", 1, [0, 1, 2, 3, 4]], ["SP", 1, 0, 786432, [8], 1], ["AN", 1, 0, 5], ["AN", 1, 1, 6]]]], "r": [[7.57572e-05, 7.57542e-05, 7.57745e-05, 7.58111e-05, 7.57692e-05, 7.57594e-05, 7.5758e-05, 7.57541e-05, 7.57601e-05, 7.58016e-05], 0, 47.416, 1651934094], "v": "v0.6"}
{"i": [["[\"fused_reshape_permute\", 1, 32, 32, 256, 8, 8]", "cuda -keys=cuda,gpu -max_num_threads=1024 -model=unknown -thread_warp_size=32", [-1, 16, 64, 49152, 2147483647, 1024, 8, 32], "", 0, []], [[], [["FU", 1, [0, 1, 2, 3, 4]], ["SP", 1, 0, 786432, [64], 1], ["AN", 1, 0, 5], ["AN", 1, 1, 6]]]], "r": [[1.18432e-05, 1.18395e-05, 1.18422e-05, 1.1842e-05, 1.18406e-05, 1.18421e-05, 1.18435e-05, 1.18374e-05, 1.18386e-05, 1.18381e-05], 0, 26.8193, 1651934074], "v": "v0.6"}
{"i": [["[\"fused_reshape_permute\", 1, 32, 32, 256, 8, 8]", "cuda -keys=cuda,gpu -max_num_threads=1024 -model=unknown -thread_warp_size=32", [-1, 16, 64, 49152, 2147483647, 1024, 8, 32], "", 0, []], [[], [["FU", 1, [0, 1, 2, 3, 4]], ["SP", 1, 0, 786432, [12], 1], ["AN", 1, 0, 5], ["AN", 1, 1, 6]]]], "r": [[5.12909e-05, 5.13039e-05, 5.12872e-05, 5.12848e-05, 5.12977e-05, 5.12849e-05, 5.12867e-05, 5.12823e-05, 5.12781e-05, 5.12892e-05], 0, 42.1466, 1651934089], "v": "v0.6"}
{"i": [["[\"fused_reshape_permute\", 1, 32, 32, 256, 8, 8]", "cuda -keys=cuda,gpu -max_num_threads=1024 -model=unknown -thread_warp_size=32", [-1, 16, 64, 49152, 2147483647, 1024, 8, 32], "", 0, []], [[], [["FU", 1, [0, 1, 2, 3, 4]], ["SP", 1, 0, 786432, [2], 1], ["AN", 1, 0, 5], ["AN", 1, 1, 6]]]], "r": [[0.000294038, 0.000294085, 0.000293985, 0.000294005, 0.000293985, 0.000293997, 0.000294015, 0.000294022, 0.000293986, 0.000293984], 0, 53.1653, 1651934100], "v": "v0.6"}
{"i": [["[\"fused_reshape_permute\", 1, 32, 32, 256, 8, 8]", "cuda -keys=cuda,gpu -max_num_threads=1024 -model=unknown -thread_warp_size=32", [-1, 16, 64, 49152, 2147483647, 1024, 8, 32], "", 0, []], [[], [["FU", 1, [0, 1, 2, 3, 4]], ["SP", 1, 0, 786432, [1], 1], ["AN", 1, 0, 5], ["AN", 1, 1, 6]]]], "r": [[0.000585486, 0.000585662, 0.000585587, 0.000585668, 0.000585434, 0.000585451, 0.000585431, 0.000585406, 0.000585412, 0.000585453], 0, 57.166, 1651934104], "v": "v0.6"}
{"i": [["[\"fused_reshape_permute\", 1, 32, 32, 256, 8, 8]", "cuda -keys=cuda,gpu -max_num_threads=1024 -model=unknown -thread_warp_size=32", [-1, 16, 64, 49152, 2147483647, 1024, 8, 32], "", 0, []], [[], [["FU", 1, [0, 1, 2, 3, 4]], ["SP", 1, 0, 786432, [4], 1], ["AN", 1, 0, 5], ["AN", 1, 1, 6]]]], "r": [[0.000148341, 0.000158695, 0.000153967, 0.000148373, 0.00014834, 0.000148342, 0.000148349, 0.00014836, 0.000148341, 0.000148339], 0, 62.5486, 1651934110], "v": "v0.6"}
