python/models/swin_transformer/kernel_configs/swin_transform_auto_tvm_tune_patch_merge_matmul_tensorcore_1_64_64_128.log
{"input": ["cuda -keys=cuda,gpu -max_num_threads=1024 -thread_warp_size=32", "dense_tensorcore.cuda", [["TENSOR", [1024, 512], "float16"], ["TENSOR", [256, 512], "float16"]], {}], "config": {"index": 5315, "code_hash": null, "entity": [["block_row_warps", "ot", 4], ["block_col_warps", "ot", 2], ["warp_row_tiles", "ot", 4], ["warp_col_tiles", "ot", 2], ["chunk", "ot", 2], ["offset", "ot", 0], ["offsetCS", "ot", 0], ["vec", "ot", 1], ["wmma_m", "ot", 16]]}, "result": [[3.9491003999999996e-05], 0, 2.8723864555358887, 1651655475.1121771], "version": 0.2, "tvm_version": "0.8.0"}
{"input": ["cuda -keys=cuda,gpu -max_num_threads=1024 -thread_warp_size=32", "dense_tensorcore.cuda", [["TENSOR", [1024, 512], "float16"], ["TENSOR", [256, 512], "float16"]], {}], "config": {"index": 13629, "code_hash": null, "entity": [["block_row_warps", "ot", 1], ["block_col_warps", "ot", 2], ["warp_row_tiles", "ot", 4], ["warp_col_tiles", "ot", 1], ["chunk", "ot", 1], ["offset", "ot", 0], ["offsetCS", "ot", 8], ["vec", "ot", 4], ["wmma_m", "ot", 8]]}, "result": [[2.0100538000000002e-05], 0, 2.1565017700195312, 1651655476.296999], "version": 0.2, "tvm_version": "0.8.0"}
{"input": ["cuda -keys=cuda,gpu -max_num_threads=1024 -thread_warp_size=32", "dense_tensorcore.cuda", [["TENSOR", [1024, 512], "float16"], ["TENSOR", [256, 512], "float16"]], {}], "config": {"index": 12980, "code_hash": null, "entity": [["block_row_warps", "ot", 4], ["block_col_warps", "ot", 1], ["warp_row_tiles", "ot", 4], ["warp_col_tiles", "ot", 1], ["chunk", "ot", 1], ["offset", "ot", 0], ["offsetCS", "ot", 0], ["vec", "ot", 4], ["wmma_m", "ot", 8]]}, "result": [[2.6723923e-05], 0, 2.6358275413513184, 1651655478.5855796], "version": 0.2, "tvm_version": "0.8.0"}
{"input": ["cuda -keys=cuda,gpu -max_num_threads=1024 -thread_warp_size=32", "dense_tensorcore.cuda", [["TENSOR", [1024, 512], "float16"], ["TENSOR", [256, 512], "float16"]], {}], "config": {"index": 2494, "code_hash": null, "entity": [["block_row_warps", "ot", 2], ["block_col_warps", "ot", 1], ["warp_row_tiles", "ot", 2], ["warp_col_tiles", "ot", 4], ["chunk", "ot", 4], ["offset", "ot", 8], ["offsetCS", "ot", 8], ["vec", "ot", 2], ["wmma_m", "ot", 32]]}, "result": [[1.2578057e-05], 0, 2.520937204360962, 1651655479.9050698], "version": 0.2, "tvm_version": "0.8.0"}
{"input": ["cuda -keys=cuda,gpu -max_num_threads=1024 -thread_warp_size=32", "dense_tensorcore.cuda", [["TENSOR", [1024, 512], "float16"], ["TENSOR", [256, 512], "float16"]], {}], "config": {"index": 10378, "code_hash": null, "entity": [["block_row_warps", "ot", 2], ["block_col_warps", "ot", 1], ["warp_row_tiles", "ot", 2], ["warp_col_tiles", "ot", 1], ["chunk", "ot", 1], ["offset", "ot", 0], ["offsetCS", "ot", 0], ["vec", "ot", 1], ["wmma_m", "ot", 8]]}, "result": [[2.1842676999999997e-05], 0, 2.694891929626465, 1651655481.4179578], "version": 0.2, "tvm_version": "0.8.0"}
{"input": ["cuda -keys=cuda,gpu -max_num_threads=1024 -thread_warp_size=32", "dense_tensorcore.cuda", [["TENSOR", [1024, 512], "float16"], ["TENSOR", [256, 512], "float16"]], {}], "config": {"index": 475, "code_hash": null, "entity": [["block_row_warps", "ot", 2], ["block_col_warps", "ot", 4], ["warp_row_tiles", "ot", 2], ["warp_col_tiles", "ot", 4], ["chunk", "ot", 2], ["offset", "ot", 8], ["offsetCS", "ot", 0], ["vec", "ot", 1], ["wmma_m", "ot", 32]]}, "result": [[2.4767537e-05], 0, 2.349539279937744, 1651655483.5386786], "version": 0.2, "tvm_version": "0.8.0"}
{"input": ["cuda -keys=cuda,gpu -max_num_threads=1024 -thread_warp_size=32", "dense_tensorcore.cuda", [["TENSOR", [1024, 512], "float16"], ["TENSOR", [256, 512], "float16"]], {}], "config": {"index": 3352, "code_hash": null, "entity": [["block_row_warps", "ot", 2], ["block_col_warps", "ot", 2], ["warp_row_tiles", "ot", 1], ["warp_col_tiles", "ot", 2], ["chunk", "ot", 2], ["offset", "ot", 0], ["offsetCS", "ot", 8], ["vec", "ot", 4], ["wmma_m", "ot", 32]]}, "result": [[1.8454209999999998e-05], 0, 3.0274147987365723, 1651655487.5323467], "version": 0.2, "tvm_version": "0.8.0"}
{"input": ["cuda -keys=cuda,gpu -max_num_threads=1024 -thread_warp_size=32", "dense_tensorcore.cuda", [["TENSOR", [1024, 512], "float16"], ["TENSOR", [256, 512], "float16"]], {}], "config": {"index": 3655, "code_hash": null, "entity": [["block_row_warps", "ot", 2], ["block_col_warps", "ot", 1], ["warp_row_tiles", "ot", 2], ["warp_col_tiles", "ot", 1], ["chunk", "ot", 2], ["offset", "ot", 8], ["offsetCS", "ot", 8], ["vec", "ot", 4], ["wmma_m", "ot", 32]]}, "result": [[1.8628961e-05], 0, 2.5289721488952637, 1651655490.0964851], "version": 0.2, "tvm_version": "0.8.0"}
{"input": ["cuda -keys=cuda,gpu -max_num_threads=1024 -thread_warp_size=32", "dense_tensorcore.cuda", [["TENSOR", [1024, 512], "float16"], ["TENSOR", [256, 512], "float16"]], {}], "config": {"index": 14030, "code_hash": null, "entity": [["block_row_warps", "ot", 4], ["block_col_warps", "ot", 4], ["warp_row_tiles", "ot", 2], ["warp_col_tiles", "ot", 1], ["chunk", "ot", 2], ["offset", "ot", 8], ["offsetCS", "ot", 8], ["vec", "ot", 4], ["wmma_m", "ot", 8]]}, "result": [[1.3280107e-05], 0, 3.4437360763549805, 1651655492.5834546], "version": 0.2, "tvm_version": "0.8.0"}
{"input": ["cuda -keys=cuda,gpu -max_num_threads=1024 -thread_warp_size=32", "dense_tensorcore.cuda", [["TENSOR", [1024, 512], "float16"], ["TENSOR", [256, 512], "float16"]], {}], "config": {"index": 1897, "code_hash": null, "entity": [["block_row_warps", "ot", 2], ["block_col_warps", "ot", 4], ["warp_row_tiles", "ot", 1], ["warp_col_tiles", "ot", 2], ["chunk", "ot", 8], ["offset", "ot", 8], ["offsetCS", "ot", 0], ["vec", "ot", 2], ["wmma_m", "ot", 32]]}, "result": [[9.687362793572311e-06], 0, 2.221376657485962, 1651655494.8762786], "version": 0.2, "tvm_version": "0.8.0"}
{"input": ["cuda -keys=cuda,gpu -max_num_threads=1024 -thread_warp_size=32", "dense_tensorcore.cuda", [["TENSOR", [1024, 512], "float16"], ["TENSOR", [256, 512], "float16"]], {}], "config": {"index": 9765, "code_hash": null, "entity": [["block_row_warps", "ot", 1], ["block_col_warps", "ot", 1], ["warp_row_tiles", "ot", 4], ["warp_col_tiles", "ot", 2], ["chunk", "ot", 1], ["offset", "ot", 0], ["offsetCS", "ot", 8], ["vec", "ot", 8], ["wmma_m", "ot", 16]]}, "result": [[1.556751e-05], 0, 2.6104044914245605, 1651655496.3348987], "version": 0.2, "tvm_version": "0.8.0"}
{"input": ["cuda -keys=cuda,gpu -max_num_threads=1024 -thread_warp_size=32", "dense_tensorcore.cuda", [["TENSOR", [1024, 512], "float16"], ["TENSOR", [256, 512], "float16"]], {}], "config": {"index": 2723, "code_hash": null, "entity": [["block_row_warps", "ot", 4], ["block_col_warps", "ot", 2], ["warp_row_tiles", "ot", 4], ["warp_col_tiles", "ot", 2], ["chunk", "ot", 2], ["offset", "ot", 0], ["offsetCS", "ot", 0], ["vec", "ot", 4], ["wmma_m", "ot", 32]]}, "result": [[4.7680875e-05], 0, 3.1044921875, 1651655498.179572], "version": 0.2, "tvm_version": "0.8.0"}
{"input": ["cuda -keys=cuda,gpu -max_num_threads=1024 -thread_warp_size=32", "dense_tensorcore.cuda", [["TENSOR", [1024, 512], "float16"], ["TENSOR", [256, 512], "float16"]], {}], "config": {"index": 9915, "code_hash": null, "entity": [["block_row_warps", "ot", 1], ["block_col_warps", "ot", 4], ["warp_row_tiles", "ot", 1], ["warp_col_tiles", "ot", 2], ["chunk", "ot", 4], ["offset", "ot", 0], ["offsetCS", "ot", 8], ["vec", "ot", 8], ["wmma_m", "ot", 16]]}, "result": [[2.6133257e-05], 0, 2.500978469848633, 1651655500.6277797], "version": 0.2, "tvm_version": "0.8.0"}
{"input": ["cuda -keys=cuda,gpu -max_num_threads=1024 -thread_warp_size=32", "dense_tensorcore.cuda", [["TENSOR", [1024, 512], "float16"], ["TENSOR", [256, 512], "float16"]], {}], "config": {"index": 7594, "code_hash": null, "entity": [["block_row_warps", "ot", 2], ["block_col_warps", "ot", 4], ["warp_row_tiles", "ot", 1], ["warp_col_tiles", "ot", 4], ["chunk", "ot", 2], ["offset", "ot", 8], ["offsetCS", "ot", 8], ["vec", "ot", 2], ["wmma_m", "ot", 16]]}, "result": [[2.0355066999999997e-05], 0, 2.538111448287964, 1651655503.1853456], "version": 0.2, "tvm_version": "0.8.0"}
{"input": ["cuda -keys=cuda,gpu -max_num_threads=1024 -thread_warp_size=32", "dense_tensorcore.cuda", [["TENSOR", [1024, 512], "float16"], ["TENSOR", [256, 512], "float16"]], {}], "config": {"index": 1652, "code_hash": null, "entity": [["block_row_warps", "ot", 4], ["block_col_warps", "ot", 2], ["warp_row_tiles", "ot", 1], ["warp_col_tiles", "ot", 2], ["chunk", "ot", 1], ["offset", "ot", 8], ["offsetCS", "ot", 0], ["vec", "ot", 2], ["wmma_m", "ot", 32]]}, "result": [[1.3883345e-05], 0, 3.2622523307800293, 1651655505.1853907], "version": 0.2, "tvm_version": "0.8.0"}
{"input": ["cuda -keys=cuda,gpu -max_num_threads=1024 -thread_warp_size=32", "dense_tensorcore.cuda", [["TENSOR", [1024, 512], "float16"], ["TENSOR", [256, 512], "float16"]], {}], "config": {"index": 8544, "code_hash": null, "entity": [["block_row_warps", "ot", 1], ["block_col_warps", "ot", 2], ["warp_row_tiles", "ot", 2], ["warp_col_tiles", "ot", 2], ["chunk", "ot", 2], ["offset", "ot", 0], ["offsetCS", "ot", 8], ["vec", "ot", 4], ["wmma_m", "ot", 16]]}, "result": [[1.5845418e-05], 0, 2.2906954288482666, 1651655506.3705208], "version": 0.2, "tvm_version": "0.8.0"}
{"input": ["cuda -keys=cuda,gpu -max_num_threads=1024 -thread_warp_size=32", "dense_tensorcore.cuda", [["TENSOR", [1024, 512], "float16"], ["TENSOR", [256, 512], "float16"]], {}], "config": {"index": 12574, "code_hash": null, "entity": [["block_row_warps", "ot", 2], ["block_col_warps", "ot", 1], ["warp_row_tiles", "ot", 4], ["warp_col_tiles", "ot", 1], ["chunk", "ot", 8], ["offset", "ot", 0], ["offsetCS", "ot", 8], ["vec", "ot", 2], ["wmma_m", "ot", 8]]}, "result": [[1.9006445e-05], 0, 2.5994176864624023, 1651655508.6035843], "version": 0.2, "tvm_version": "0.8.0"}
