python/models/swin_transformer/kernel_configs/swin_transformer_fused_roll_window_partition_1_12_12_3_-3_4.log
{"i": [["[\"fused_roll_window_partition\", 1, 12, 12, 3, -3, 4]", "cuda -keys=cuda,gpu -max_num_threads=1024 -model=unknown -thread_warp_size=32", [-1, 16, 64, 49152, 2147483647, 1024, 8, 32], "", 0, []], [[], [["FU", 1, [0, 1, 2, 3]], ["SP", 1, 0, 432, [32], 1], ["AN", 1, 0, 5], ["AN", 1, 1, 6]]]], "r": [[4.45086e-06, 4.45857e-06, 4.50658e-06, 4.55729e-06, 4.5231e-06, 4.52553e-06, 4.54898e-06, 4.58786e-06, 4.64961e-06, 4.59563e-06], 0, 5.06908, 1651151575], "v": "v0.6"}
{"i": [["[\"fused_roll_window_partition\", 1, 12, 12, 3, -3, 4]", "cuda -keys=cuda,gpu -max_num_threads=1024 -model=unknown -thread_warp_size=32", [-1, 16, 64, 49152, 2147483647, 1024, 8, 32], "", 0, []], [[], [["FU", 1, [0, 1, 2, 3]], ["SP", 1, 0, 432, [12], 1], ["AN", 1, 0, 5], ["AN", 1, 1, 6]]]], "r": [[4.06288e-06, 3.25254e-06, 3.24762e-06, 3.18663e-06, 3.20852e-06, 3.15943e-06, 3.15023e-06, 3.14774e-06, 3.12819e-06, 3.15176e-06], 0, 2.88624, 1651151572], "v": "v0.6"}
{"i": [["[\"fused_roll_window_partition\", 1, 12, 12, 3, -3, 4]", "cuda -keys=cuda,gpu -max_num_threads=1024 -model=unknown -thread_warp_size=32", [-1, 16, 64, 49152, 2147483647, 1024, 8, 32], "", 0, []], [[], [["FU", 1, [0, 1, 2, 3]], ["SP", 1, 0, 432, [54], 1], ["AN", 1, 0, 5], ["AN", 1, 1, 6]]]], "r": [[3.28733e-06, 3.34334e-06, 3.33308e-06, 3.8773e-06, 3.26647e-06, 3.29397e-06, 3.27018e-06, 3.43734e-06, 3.33061e-06, 4.01663e-06], 0, 7.39832, 1651151577], "v": "v0.6"}
{"i": [["[\"fused_roll_window_partition\", 1, 12, 12, 3, -3, 4]", "cuda -keys=cuda,gpu -max_num_threads=1024 -model=unknown -thread_warp_size=32", [-1, 16, 64, 49152, 2147483647, 1024, 8, 32], "", 0, []], [[], [["FU", 1, [0, 1, 2, 3]], ["SP", 1, 0, 432, [18], 1], ["AN", 1, 0, 5], ["AN", 1, 1, 6]]]], "r": [[3.75738e-06, 3.82464e-06, 3.74289e-06, 3.69445e-06, 3.64178e-06, 3.6928e-06, 3.65921e-06, 3.64843e-06, 3.94136e-06, 3.67985e-06], 0, 14.2462, 1651151584], "v": "v0.6"}
{"i": [["[\"fused_roll_window_partition\", 1, 12, 12, 3, -3, 4]", "cuda -keys=cuda,gpu -max_num_threads=1024 -model=unknown -thread_warp_size=32", [-1, 16, 64, 49152, 2147483647, 1024, 8, 32], "", 0, []], [[], [["FU", 1, [0, 1, 2, 3]], ["SP", 1, 0, 432, [16], 1], ["AN", 1, 0, 5], ["AN", 1, 1, 6]]]], "r": [[3.21154e-06, 3.23819e-06, 3.23359e-06, 3.26008e-06, 3.22406e-06, 3.22998e-06, 3.16444e-06, 3.31655e-06, 3.27202e-06, 3.29732e-06], 0, 18.2417, 1651151588], "v": "v0.6"}
{"i": [["[\"fused_roll_window_partition\", 1, 12, 12, 3, -3, 4]", "cuda -keys=cuda,gpu -max_num_threads=1024 -model=unknown -thread_warp_size=32", [-1, 16, 64, 49152, 2147483647, 1024, 8, 32], "", 0, []], [[], [["FU", 1, [0, 1, 2, 3]], ["SP", 1, 0, 432, [2], 1], ["AN", 1, 0, 5], ["AN", 1, 1, 6]]]], "r": [[3.66125e-06, 3.63206e-06, 3.74394e-06, 3.67362e-06, 3.65067e-06, 3.61466e-06, 3.62928e-06, 3.64308e-06, 3.64968e-06, 3.65484e-06], 0, 12.1421, 1651151582], "v": "v0.6"}
{"i": [["[\"fused_roll_window_partition\", 1, 12, 12, 3, -3, 4]", "cuda -keys=cuda,gpu -max_num_threads=1024 -model=unknown -thread_warp_size=32", [-1, 16, 64, 49152, 2147483647, 1024, 8, 32], "", 0, []], [[], [["FU", 1, [0, 1, 2, 3]], ["SP", 1, 0, 432, [9], 1], ["AN", 1, 0, 5], ["AN", 1, 1, 6]]]], "r": [[4.31427e-06, 4.22086e-06, 4.29477e-06, 4.60056e-06, 4.39518e-06, 4.3973e-06, 4.43169e-06, 4.52305e-06, 4.52141e-06, 4.45764e-06], 0, 9.65349, 1651151579], "v": "v0.6"}
{"i": [["[\"fused_roll_window_partition\", 1, 12, 12, 3, -3, 4]", "cuda -keys=cuda,gpu -max_num_threads=1024 -model=unknown -thread_warp_size=32", [-1, 16, 64, 49152, 2147483647, 1024, 8, 32], "", 0, []], [[], [["FU", 1, [0, 1, 2, 3]], ["SP", 1, 0, 432, [6], 1], ["AN", 1, 0, 5], ["AN", 1, 1, 6]]]], "r": [[3.23659e-06, 3.26075e-06, 3.25891e-06, 3.26582e-06, 3.26856e-06, 3.28028e-06, 3.24922e-06, 3.27171e-06, 3.27126e-06, 3.34956e-06], 0, 25.7636, 1651151595], "v": "v0.6"}
{"i": [["[\"fused_roll_window_partition\", 1, 12, 12, 3, -3, 4]", "cuda -keys=cuda,gpu -max_num_threads=1024 -model=unknown -thread_warp_size=32", [-1, 16, 64, 49152, 2147483647, 1024, 8, 32], "", 0, []], [[], [["FU", 1, [0, 1, 2, 3]], ["SP", 1, 0, 432, [48], 1], ["AN", 1, 0, 5], ["AN", 1, 1, 6]]]], "r": [[3.22286e-06, 3.20948e-06, 3.29065e-06, 3.30781e-06, 3.25013e-06, 3.18409e-06, 3.48457e-06, 3.93902e-06, 3.32564e-06, 3.30506e-06], 0, 28.0651, 1651151598], "v": "v0.6"}
{"i": [["[\"fused_roll_window_partition\", 1, 12, 12, 3, -3, 4]", "cuda -keys=cuda,gpu -max_num_threads=1024 -model=unknown -thread_warp_size=32", [-1, 16, 64, 49152, 2147483647, 1024, 8, 32], "", 0, []], [[], [["FU", 1, [0, 1, 2, 3]], ["SP", 1, 0, 432, [3], 1], ["AN", 1, 0, 5], ["AN", 1, 1, 6]]]], "r": [[3.75893e-06, 6.01964e-06, 4.25462e-06, 4.00626e-06, 3.8701e-06, 3.95352e-06, 4.05794e-06, 4.0344e-06, 4.07207e-06, 4.0549e-06], 0, 23.3007, 1651151593], "v": "v0.6"}
{"i": [["[\"fused_roll_window_partition\", 1, 12, 12, 3, -3, 4]", "cuda -keys=cuda,gpu -max_num_threads=1024 -model=unknown -thread_warp_size=32", [-1, 16, 64, 49152, 2147483647, 1024, 8, 32], "", 0, []], [[], [["FU", 1, [0, 1, 2, 3]], ["SP", 1, 0, 432, [4], 1], ["AN", 1, 0, 5], ["AN", 1, 1, 6]]]], "r": [[3.16698e-06, 3.25204e-06, 3.24856e-06, 3.31045e-06, 3.25494e-06, 4.09363e-06, 3.37156e-06, 3.33263e-06, 3.26602e-06, 3.27473e-06], 0, 20.8901, 1651151591], "v": "v0.6"}
{"i": [["[\"fused_roll_window_partition\", 1, 12, 12, 3, -3, 4]", "cuda -keys=cuda,gpu -max_num_threads=1024 -model=unknown -thread_warp_size=32", [-1, 16, 64, 49152, 2147483647, 1024, 8, 32], "", 0, []], [[], [["FU", 1, [0, 1, 2, 3]], ["SP", 1, 0, 432, [1], 1], ["AN", 1, 0, 5], ["AN", 1, 1, 6]]]], "r": [[4.47876e-06, 3.76519e-06, 3.76812e-06, 3.77868e-06, 3.81377e-06, 3.77335e-06, 5.36396e-06, 3.92997e-06, 3.9059e-06, 3.93274e-06], 0, 29.708, 1651151600], "v": "v0.6"}
{"i": [["[\"fused_roll_window_partition\", 1, 12, 12, 3, -3, 4]", "cuda -keys=cuda,gpu -max_num_threads=1024 -model=unknown -thread_warp_size=32", [-1, 16, 64, 49152, 2147483647, 1024, 8, 32], "", 0, []], [[], [["FU", 1, [0, 1, 2, 3]], ["SP", 1, 0, 432, [8], 1], ["AN", 1, 0, 5], ["AN", 1, 1, 6]]]], "r": [[3.20172e-06, 3.24292e-06, 3.24117e-06, 3.23716e-06, 3.24996e-06, 3.25252e-06, 3.24435e-06, 3.2182e-06, 3.29529e-06, 3.3563e-06], 0, 16.1285, 1651151586], "v": "v0.6"}
{"i": [["[\"fused_roll_window_partition\", 1, 12, 12, 3, -3, 4]", "cuda -keys=cuda,gpu -max_num_threads=1024 -model=unknown -thread_warp_size=32", [-1, 16, 64, 49152, 2147483647, 1024, 8, 32], "", 0, []], [[], [["FU", 1, [0, 1, 2, 3]], ["SP", 1, 0, 432, [24], 1], ["AN", 1, 0, 5], ["AN", 1, 1, 6]]]], "r": [[3.35905e-06, 3.2859e-06, 3.24132e-06, 3.29114e-06, 3.27345e-06, 3.23458e-06, 3.25275e-06, 3.26511e-06, 3.32457e-06, 3.30401e-06], 0, 31.8261, 1651151602], "v": "v0.6"}
{"i": [["[\"fused_roll_window_partition\", 1, 12, 12, 3, -3, 4]", "cuda -keys=cuda,gpu -max_num_threads=1024 -model=unknown -thread_warp_size=32", [-1, 16, 64, 49152, 2147483647, 1024, 8, 32], "", 0, []], [[], [["FU", 1, [0, 1, 2, 3]], ["SP", 1, 0, 432, [36], 1], ["AN", 1, 0, 5], ["AN", 1, 1, 6]]]], "r": [[3.13187e-06, 3.17822e-06, 3.29325e-06, 3.15802e-06, 3.32618e-06, 3.30792e-06, 3.30358e-06, 3.31388e-06, 3.2192e-06, 3.18382e-06], 0, 36.4553, 1651151606], "v": "v0.6"}
{"i": [["[\"fused_roll_window_partition\", 1, 12, 12, 3, -3, 4]", "cuda -keys=cuda,gpu -max_num_threads=1024 -model=unknown -thread_warp_size=32", [-1, 16, 64, 49152, 2147483647, 1024, 8, 32], "", 0, []], [[], [["FU", 1, [0, 1, 2, 3]], ["SP", 1, 0, 432, [27], 1], ["AN", 1, 0, 5], ["AN", 1, 1, 6]]]], "r": [[3.36547e-06, 3.33489e-06, 3.337e-06, 3.36706e-06, 3.32214e-06, 3.35447e-06, 3.31966e-06, 3.24861e-06, 3.22613e-06, 3.2982e-06], 0, 34.1312, 1651151604], "v": "v0.6"}
