python/models/swin_transformer/kernel_configs/swin_transform_auto_tvm_tune_attn_v_pad_matmul_tensorcore_1_14_14_16_7.log
{"input": ["cuda -keys=cuda,gpu -max_num_threads=1024 -thread_warp_size=32", "attn_v_pad_matmul.cuda", [["TENSOR", [64, 49, 49], "float16"], ["TENSOR", [64, 32, 49], "float16"]], {}], "config": {"index": 5460, "code_hash": null, "entity": [["block_row_warps", "ot", 1], ["block_col_warps", "ot", 4], ["warp_row_tiles", "ot", 1], ["warp_col_tiles", "ot", 2], ["chunk", "ot", 8], ["offset", "ot", 0], ["offsetCS", "ot", 0], ["vec", "ot", 1], ["wmma_m", "ot", 16]]}, "result": [[1.3683984e-05], 0, 1.7113430500030518, 1651928837.6486897], "version": 0.2, "tvm_version": "0.8.0"}
{"input": ["cuda -keys=cuda,gpu -max_num_threads=1024 -thread_warp_size=32", "attn_v_pad_matmul.cuda", [["TENSOR", [64, 49, 49], "float16"], ["TENSOR", [64, 32, 49], "float16"]], {}], "config": {"index": 782, "code_hash": null, "entity": [["block_row_warps", "ot", 4], ["block_col_warps", "ot", 4], ["warp_row_tiles", "ot", 4], ["warp_col_tiles", "ot", 2], ["chunk", "ot", 2], ["offset", "ot", 0], ["offsetCS", "ot", 8], ["vec", "ot", 1], ["wmma_m", "ot", 32]]}, "result": [[2.3032915e-05], 0, 1.9010484218597412, 1651928838.4013436], "version": 0.2, "tvm_version": "0.8.0"}
{"input": ["cuda -keys=cuda,gpu -max_num_threads=1024 -thread_warp_size=32", "attn_v_pad_matmul.cuda", [["TENSOR", [64, 49, 49], "float16"], ["TENSOR", [64, 32, 49], "float16"]], {}], "config": {"index": 1577, "code_hash": null, "entity": [["block_row_warps", "ot", 4], ["block_col_warps", "ot", 1], ["warp_row_tiles", "ot", 2], ["warp_col_tiles", "ot", 2], ["chunk", "ot", 8], ["offset", "ot", 0], ["offsetCS", "ot", 0], ["vec", "ot", 2], ["wmma_m", "ot", 32]]}, "result": [[1.4114883e-05], 0, 1.3459959030151367, 1651928839.8727655], "version": 0.2, "tvm_version": "0.8.0"}
{"input": ["cuda -keys=cuda,gpu -max_num_threads=1024 -thread_warp_size=32", "attn_v_pad_matmul.cuda", [["TENSOR", [64, 49, 49], "float16"], ["TENSOR", [64, 32, 49], "float16"]], {}], "config": {"index": 323, "code_hash": null, "entity": [["block_row_warps", "ot", 4], ["block_col_warps", "ot", 4], ["warp_row_tiles", "ot", 4], ["warp_col_tiles", "ot", 4], ["chunk", "ot", 8], ["offset", "ot", 0], ["offsetCS", "ot", 0], ["vec", "ot", 1], ["wmma_m", "ot", 32]]}, "result": [[3.3092083e-05], 0, 1.6447579860687256, 1651928840.5032368], "version": 0.2, "tvm_version": "0.8.0"}
{"input": ["cuda -keys=cuda,gpu -max_num_threads=1024 -thread_warp_size=32", "attn_v_pad_matmul.cuda", [["TENSOR", [64, 49, 49], "float16"], ["TENSOR", [64, 32, 49], "float16"]], {}], "config": {"index": 15481, "code_hash": null, "entity": [["block_row_warps", "ot", 2], ["block_col_warps", "ot", 1], ["warp_row_tiles", "ot", 2], ["warp_col_tiles", "ot", 1], ["chunk", "ot", 8], ["offset", "ot", 8], ["offsetCS", "ot", 8], ["vec", "ot", 8], ["wmma_m", "ot", 8]]}, "result": [[8.135403584672435e-06], 0, 1.5984032154083252, 1651928842.2298515], "version": 0.2, "tvm_version": "0.8.0"}
{"input": ["cuda -keys=cuda,gpu -max_num_threads=1024 -thread_warp_size=32", "attn_v_pad_matmul.cuda", [["TENSOR", [64, 49, 49], "float16"], ["TENSOR", [64, 32, 49], "float16"]], {}], "config": {"index": 8783, "code_hash": null, "entity": [["block_row_warps", "ot", 4], ["block_col_warps", "ot", 4], ["warp_row_tiles", "ot", 1], ["warp_col_tiles", "ot", 2], ["chunk", "ot", 1], ["offset", "ot", 8], ["offsetCS", "ot", 8], ["vec", "ot", 4], ["wmma_m", "ot", 16]]}, "result": [[3.4598206999999996e-05], 0, 1.7626771926879883, 1651928843.7041357], "version": 0.2, "tvm_version": "0.8.0"}
{"input": ["cuda -keys=cuda,gpu -max_num_threads=1024 -thread_warp_size=32", "attn_v_pad_matmul.cuda", [["TENSOR", [64, 49, 49], "float16"], ["TENSOR", [64, 32, 49], "float16"]], {}], "config": {"index": 2719, "code_hash": null, "entity": [["block_row_warps", "ot", 2], ["block_col_warps", "ot", 1], ["warp_row_tiles", "ot", 4], ["warp_col_tiles", "ot", 2], ["chunk", "ot", 2], ["offset", "ot", 0], ["offsetCS", "ot", 0], ["vec", "ot", 4], ["wmma_m", "ot", 32]]}, "result": [[8.942103831891224e-06], 0, 1.712742805480957, 1651928845.3447957], "version": 0.2, "tvm_version": "0.8.0"}
{"input": ["cuda -keys=cuda,gpu -max_num_threads=1024 -thread_warp_size=32", "attn_v_pad_matmul.cuda", [["TENSOR", [64, 49, 49], "float16"], ["TENSOR", [64, 32, 49], "float16"]], {}], "config": {"index": 698, "code_hash": null, "entity": [["block_row_warps", "ot", 4], ["block_col_warps", "ot", 2], ["warp_row_tiles", "ot", 4], ["warp_col_tiles", "ot", 2], ["chunk", "ot", 1], ["offset", "ot", 0], ["offsetCS", "ot", 8], ["vec", "ot", 1], ["wmma_m", "ot", 32]]}, "result": [[1.2041287e-05], 0, 1.8677091598510742, 1651928846.0884173], "version": 0.2, "tvm_version": "0.8.0"}
{"input": ["cuda -keys=cuda,gpu -max_num_threads=1024 -thread_warp_size=32", "attn_v_pad_matmul.cuda", [["TENSOR", [64, 49, 49], "float16"], ["TENSOR", [64, 32, 49], "float16"]], {}], "config": {"index": 2237, "code_hash": null, "entity": [["block_row_warps", "ot", 4], ["block_col_warps", "ot", 2], ["warp_row_tiles", "ot", 4], ["warp_col_tiles", "ot", 2], ["chunk", "ot", 8], ["offset", "ot", 0], ["offsetCS", "ot", 8], ["vec", "ot", 2], ["wmma_m", "ot", 32]]}, "result": [[2.1908499e-05], 0, 1.9485344886779785, 1651928848.0865166], "version": 0.2, "tvm_version": "0.8.0"}
{"input": ["cuda -keys=cuda,gpu -max_num_threads=1024 -thread_warp_size=32", "attn_v_pad_matmul.cuda", [["TENSOR", [64, 49, 49], "float16"], ["TENSOR", [64, 32, 49], "float16"]], {}], "config": {"index": 11828, "code_hash": null, "entity": [["block_row_warps", "ot", 4], ["block_col_warps", "ot", 1], ["warp_row_tiles", "ot", 1], ["warp_col_tiles", "ot", 1], ["chunk", "ot", 4], ["offset", "ot", 0], ["offsetCS", "ot", 0], ["vec", "ot", 2], ["wmma_m", "ot", 8]]}, "result": [[2.0758489e-05], 0, 1.6119492053985596, 1651928850.7736633], "version": 0.2, "tvm_version": "0.8.0"}
{"input": ["cuda -keys=cuda,gpu -max_num_threads=1024 -thread_warp_size=32", "attn_v_pad_matmul.cuda", [["TENSOR", [64, 49, 49], "float16"], ["TENSOR", [64, 32, 49], "float16"]], {}], "config": {"index": 3353, "code_hash": null, "entity": [["block_row_warps", "ot", 4], ["block_col_warps", "ot", 2], ["warp_row_tiles", "ot", 1], ["warp_col_tiles", "ot", 2], ["chunk", "ot", 2], ["offset", "ot", 0], ["offsetCS", "ot", 8], ["vec", "ot", 4], ["wmma_m", "ot", 32]]}, "result": [[1.9492678000000004e-05], 0, 1.3524563312530518, 1651928851.31124], "version": 0.2, "tvm_version": "0.8.0"}
{"input": ["cuda -keys=cuda,gpu -max_num_threads=1024 -thread_warp_size=32", "attn_v_pad_matmul.cuda", [["TENSOR", [64, 49, 49], "float16"], ["TENSOR", [64, 32, 49], "float16"]], {}], "config": {"index": 6592, "code_hash": null, "entity": [["block_row_warps", "ot", 2], ["block_col_warps", "ot", 2], ["warp_row_tiles", "ot", 1], ["warp_col_tiles", "ot", 2], ["chunk", "ot", 2], ["offset", "ot", 0], ["offsetCS", "ot", 0], ["vec", "ot", 2], ["wmma_m", "ot", 16]]}, "result": [[1.2503334999999998e-05], 0, 1.6804866790771484, 1651928852.9622684], "version": 0.2, "tvm_version": "0.8.0"}
{"input": ["cuda -keys=cuda,gpu -max_num_threads=1024 -thread_warp_size=32", "attn_v_pad_matmul.cuda", [["TENSOR", [64, 49, 49], "float16"], ["TENSOR", [64, 32, 49], "float16"]], {}], "config": {"index": 4311, "code_hash": null, "entity": [["block_row_warps", "ot", 1], ["block_col_warps", "ot", 1], ["warp_row_tiles", "ot", 4], ["warp_col_tiles", "ot", 1], ["chunk", "ot", 2], ["offset", "ot", 8], ["offsetCS", "ot", 0], ["vec", "ot", 8], ["wmma_m", "ot", 32]]}, "result": [[1.5007015e-05], 0, 1.453312635421753, 1651928854.3491645], "version": 0.2, "tvm_version": "0.8.0"}
{"input": ["cuda -keys=cuda,gpu -max_num_threads=1024 -thread_warp_size=32", "attn_v_pad_matmul.cuda", [["TENSOR", [64, 49, 49], "float16"], ["TENSOR", [64, 32, 49], "float16"]], {}], "config": {"index": 6254, "code_hash": null, "entity": [["block_row_warps", "ot", 4], ["block_col_warps", "ot", 4], ["warp_row_tiles", "ot", 2], ["warp_col_tiles", "ot", 1], ["chunk", "ot", 2], ["offset", "ot", 8], ["offsetCS", "ot", 8], ["vec", "ot", 1], ["wmma_m", "ot", 16]]}, "result": [[1.2548744e-05], 0, 1.81900954246521, 1651928855.2917674], "version": 0.2, "tvm_version": "0.8.0"}
{"input": ["cuda -keys=cuda,gpu -max_num_threads=1024 -thread_warp_size=32", "attn_v_pad_matmul.cuda", [["TENSOR", [64, 49, 49], "float16"], ["TENSOR", [64, 32, 49], "float16"]], {}], "config": {"index": 4704, "code_hash": null, "entity": [["block_row_warps", "ot", 1], ["block_col_warps", "ot", 4], ["warp_row_tiles", "ot", 1], ["warp_col_tiles", "ot", 1], ["chunk", "ot", 4], ["offset", "ot", 0], ["offsetCS", "ot", 8], ["vec", "ot", 8], ["wmma_m", "ot", 32]]}, "result": [[2.6439543e-05], 0, 1.6397547721862793, 1651928856.8785722], "version": 0.2, "tvm_version": "0.8.0"}
{"input": ["cuda -keys=cuda,gpu -max_num_threads=1024 -thread_warp_size=32", "attn_v_pad_matmul.cuda", [["TENSOR", [64, 49, 49], "float16"], ["TENSOR", [64, 32, 49], "float16"]], {}], "config": {"index": 7985, "code_hash": null, "entity": [["block_row_warps", "ot", 4], ["block_col_warps", "ot", 1], ["warp_row_tiles", "ot", 4], ["warp_col_tiles", "ot", 2], ["chunk", "ot", 4], ["offset", "ot", 0], ["offsetCS", "ot", 0], ["vec", "ot", 4], ["wmma_m", "ot", 16]]}, "result": [[1.1661343e-05], 0, 1.6644396781921387, 1651928858.521984], "version": 0.2, "tvm_version": "0.8.0"}
{"input": ["cuda -keys=cuda,gpu -max_num_threads=1024 -thread_warp_size=32", "attn_v_pad_matmul.cuda", [["TENSOR", [64, 49, 49], "float16"], ["TENSOR", [64, 32, 49], "float16"]], {}], "config": {"index": 9103, "code_hash": null, "entity": [["block_row_warps", "ot", 2], ["block_col_warps", "ot", 2], ["warp_row_tiles", "ot", 1], ["warp_col_tiles", "ot", 2], ["chunk", "ot", 1], ["offset", "ot", 0], ["offsetCS", "ot", 0], ["vec", "ot", 8], ["wmma_m", "ot", 16]]}, "result": [[3.37533e-05], 0, 1.5330054759979248, 1651928859.1155083], "version": 0.2, "tvm_version": "0.8.0"}
{"input": ["cuda -keys=cuda,gpu -max_num_threads=1024 -thread_warp_size=32", "attn_v_pad_matmul.cuda", [["TENSOR", [64, 49, 49], "float16"], ["TENSOR", [64, 32, 49], "float16"]], {}], "config": {"index": 4425, "code_hash": null, "entity": [["block_row_warps", "ot", 1], ["block_col_warps", "ot", 4], ["warp_row_tiles", "ot", 4], ["warp_col_tiles", "ot", 2], ["chunk", "ot", 4], ["offset", "ot", 8], ["offsetCS", "ot", 0], ["vec", "ot", 8], ["wmma_m", "ot", 32]]}, "result": [[1.5807839e-05], 0, 1.6091866493225098, 1651928859.8960574], "version": 0.2, "tvm_version": "0.8.0"}
{"input": ["cuda -keys=cuda,gpu -max_num_threads=1024 -thread_warp_size=32", "attn_v_pad_matmul.cuda", [["TENSOR", [64, 49, 49], "float16"], ["TENSOR", [64, 32, 49], "float16"]], {}], "config": {"index": 7090, "code_hash": null, "entity": [["block_row_warps", "ot", 2], ["block_col_warps", "ot", 4], ["warp_row_tiles", "ot", 2], ["warp_col_tiles", "ot", 2], ["chunk", "ot", 8], ["offset", "ot", 8], ["offsetCS", "ot", 0], ["vec", "ot", 2], ["wmma_m", "ot", 16]]}, "result": [[1.1319673e-05], 0, 1.4789886474609375, 1651928861.6099253], "version": 0.2, "tvm_version": "0.8.0"}
{"input": ["cuda -keys=cuda,gpu -max_num_threads=1024 -thread_warp_size=32", "attn_v_pad_matmul.cuda", [["TENSOR", [64, 49, 49], "float16"], ["TENSOR", [64, 32, 49], "float16"]], {}], "config": {"index": 2714, "code_hash": null, "entity": [["block_row_warps", "ot", 4], ["block_col_warps", "ot", 2], ["warp_row_tiles", "ot", 2], ["warp_col_tiles", "ot", 2], ["chunk", "ot", 2], ["offset", "ot", 0], ["offsetCS", "ot", 0], ["vec", "ot", 4], ["wmma_m", "ot", 32]]}, "result": [[1.7589607e-05], 0, 2.002516746520996, 1651928864.684173], "version": 0.2, "tvm_version": "0.8.0"}
{"input": ["cuda -keys=cuda,gpu -max_num_threads=1024 -thread_warp_size=32", "attn_v_pad_matmul.cuda", [["TENSOR", [64, 49, 49], "float16"], ["TENSOR", [64, 32, 49], "float16"]], {}], "config": {"index": 5675, "code_hash": null, "entity": [["block_row_warps", "ot", 4], ["block_col_warps", "ot", 2], ["warp_row_tiles", "ot", 1], ["warp_col_tiles", "ot", 1], ["chunk", "ot", 4], ["offset", "ot", 8], ["offsetCS", "ot", 0], ["vec", "ot", 1], ["wmma_m", "ot", 16]]}, "result": [[1.1834841000000001e-05], 0, 1.1719574928283691, 1651928865.8905091], "version": 0.2, "tvm_version": "0.8.0"}
{"input": ["cuda -keys=cuda,gpu -max_num_threads=1024 -thread_warp_size=32", "attn_v_pad_matmul.cuda", [["TENSOR", [64, 49, 49], "float16"], ["TENSOR", [64, 32, 49], "float16"]], {}], "config": {"index": 4068, "code_hash": null, "entity": [["block_row_warps", "ot", 1], ["block_col_warps", "ot", 1], ["warp_row_tiles", "ot", 4], ["warp_col_tiles", "ot", 1], ["chunk", "ot", 4], ["offset", "ot", 0], ["offsetCS", "ot", 0], ["vec", "ot", 8], ["wmma_m", "ot", 32]]}, "result": [[1.7083659e-05], 0, 1.3265423774719238, 1651928868.5558217], "version": 0.2, "tvm_version": "0.8.0"}
{"input": ["cuda -keys=cuda,gpu -max_num_threads=1024 -thread_warp_size=32", "attn_v_pad_matmul.cuda", [["TENSOR", [64, 49, 49], "float16"], ["TENSOR", [64, 32, 49], "float16"]], {}], "config": {"index": 12242, "code_hash": null, "entity": [["block_row_warps", "ot", 4], ["block_col_warps", "ot", 1], ["warp_row_tiles", "ot", 2], ["warp_col_tiles", "ot", 1], ["chunk", "ot", 8], ["offset", "ot", 8], ["offsetCS", "ot", 0], ["vec", "ot", 2], ["wmma_m", "ot", 8]]}, "result": [[9.070796044499383e-06], 0, 1.2966463565826416, 1651928870.4789777], "version": 0.2, "tvm_version": "0.8.0"}
{"input": ["cuda -keys=cuda,gpu -max_num_threads=1024 -thread_warp_size=32", "attn_v_pad_matmul.cuda", [["TENSOR", [64, 49, 49], "float16"], ["TENSOR", [64, 32, 49], "float16"]], {}], "config": {"index": 4239, "code_hash": null, "entity": [["block_row_warps", "ot", 1], ["block_col_warps", "ot", 1], ["warp_row_tiles", "ot", 1], ["warp_col_tiles", "ot", 2], ["chunk", "ot", 1], ["offset", "ot", 8], ["offsetCS", "ot", 0], ["vec", "ot", 8], ["wmma_m", "ot", 32]]}, "result": [[1.1541219000000001e-05], 0, 1.081817388534546, 1651928871.7172296], "version": 0.2, "tvm_version": "0.8.0"}
{"input": ["cuda -keys=cuda,gpu -max_num_threads=1024 -thread_warp_size=32", "attn_v_pad_matmul.cuda", [["TENSOR", [64, 49, 49], "float16"], ["TENSOR", [64, 32, 49], "float16"]], {}], "config": {"index": 4919, "code_hash": null, "entity": [["block_row_warps", "ot", 4], ["block_col_warps", "ot", 2], ["warp_row_tiles", "ot", 1], ["warp_col_tiles", "ot", 4], ["chunk", "ot", 1], ["offset", "ot", 8], ["offsetCS", "ot", 8], ["vec", "ot", 8], ["wmma_m", "ot", 32]]}, "result": [[3.1642572e-05], 0, 1.3694653511047363, 1651928874.6069102], "version": 0.2, "tvm_version": "0.8.0"}
{"input": ["cuda -keys=cuda,gpu -max_num_threads=1024 -thread_warp_size=32", "attn_v_pad_matmul.cuda", [["TENSOR", [64, 49, 49], "float16"], ["TENSOR", [64, 32, 49], "float16"]], {}], "config": {"index": 12093, "code_hash": null, "entity": [["block_row_warps", "ot", 1], ["block_col_warps", "ot", 4], ["warp_row_tiles", "ot", 4], ["warp_col_tiles", "ot", 1], ["chunk", "ot", 2], ["offset", "ot", 8], ["offsetCS", "ot", 0], ["vec", "ot", 2], ["wmma_m", "ot", 8]]}, "result": [[8.740037700865266e-06], 0, 1.3597297668457031, 1651928876.3974543], "version": 0.2, "tvm_version": "0.8.0"}
{"input": ["cuda -keys=cuda,gpu -max_num_threads=1024 -thread_warp_size=32", "attn_v_pad_matmul.cuda", [["TENSOR", [64, 49, 49], "float16"], ["TENSOR", [64, 32, 49], "float16"]], {}], "config": {"index": 4022, "code_hash": null, "entity": [["block_row_warps", "ot", 4], ["block_col_warps", "ot", 4], ["warp_row_tiles", "ot", 4], ["warp_col_tiles", "ot", 2], ["chunk", "ot", 2], ["offset", "ot", 0], ["offsetCS", "ot", 0], ["vec", "ot", 8], ["wmma_m", "ot", 32]]}, "result": [[4.3678769e-05], 0, 1.4490933418273926, 1651928877.1068563], "version": 0.2, "tvm_version": "0.8.0"}
{"input": ["cuda -keys=cuda,gpu -max_num_threads=1024 -thread_warp_size=32", "attn_v_pad_matmul.cuda", [["TENSOR", [64, 49, 49], "float16"], ["TENSOR", [64, 32, 49], "float16"]], {}], "config": {"index": 10087, "code_hash": null, "entity": [["block_row_warps", "ot", 2], ["block_col_warps", "ot", 4], ["warp_row_tiles", "ot", 2], ["warp_col_tiles", "ot", 2], ["chunk", "ot", 1], ["offset", "ot", 8], ["offsetCS", "ot", 8], ["vec", "ot", 8], ["wmma_m", "ot", 16]]}, "result": [[3.0880568e-05], 0, 1.9043467044830322, 1651928880.9836874], "version": 0.2, "tvm_version": "0.8.0"}
{"input": ["cuda -keys=cuda,gpu -max_num_threads=1024 -thread_warp_size=32", "attn_v_pad_matmul.cuda", [["TENSOR", [64, 49, 49], "float16"], ["TENSOR", [64, 32, 49], "float16"]], {}], "config": {"index": 4087, "code_hash": null, "entity": [["block_row_warps", "ot", 2], ["block_col_warps", "ot", 1], ["warp_row_tiles", "ot", 2], ["warp_col_tiles", "ot", 2], ["chunk", "ot", 4], ["offset", "ot", 0], ["offsetCS", "ot", 0], ["vec", "ot", 8], ["wmma_m", "ot", 32]]}, "result": [[1.3863405e-05], 0, 1.7258074283599854, 1651928881.7884274], "version": 0.2, "tvm_version": "0.8.0"}
{"input": ["cuda -keys=cuda,gpu -max_num_threads=1024 -thread_warp_size=32", "attn_v_pad_matmul.cuda", [["TENSOR", [64, 49, 49], "float16"], ["TENSOR", [64, 32, 49], "float16"]], {}], "config": {"index": 1046, "code_hash": null, "entity": [["block_row_warps", "ot", 4], ["block_col_warps", "ot", 1], ["warp_row_tiles", "ot", 4], ["warp_col_tiles", "ot", 4], ["chunk", "ot", 1], ["offset", "ot", 8], ["offsetCS", "ot", 8], ["vec", "ot", 1], ["wmma_m", "ot", 32]]}, "result": [[1.0535397000000001e-05], 0, 1.4154441356658936, 1651928883.2641788], "version": 0.2, "tvm_version": "0.8.0"}
{"input": ["cuda -keys=cuda,gpu -max_num_threads=1024 -thread_warp_size=32", "attn_v_pad_matmul.cuda", [["TENSOR", [64, 49, 49], "float16"], ["TENSOR", [64, 32, 49], "float16"]], {}], "config": {"index": 3907, "code_hash": null, "entity": [["block_row_warps", "ot", 2], ["block_col_warps", "ot", 1], ["warp_row_tiles", "ot", 4], ["warp_col_tiles", "ot", 1], ["chunk", "ot", 1], ["offset", "ot", 0], ["offsetCS", "ot", 0], ["vec", "ot", 8], ["wmma_m", "ot", 32]]}, "result": [[1.9390247999999997e-05], 0, 1.6027593612670898, 1651928885.0064776], "version": 0.2, "tvm_version": "0.8.0"}
{"input": ["cuda -keys=cuda,gpu -max_num_threads=1024 -thread_warp_size=32", "attn_v_pad_matmul.cuda", [["TENSOR", [64, 49, 49], "float16"], ["TENSOR", [64, 32, 49], "float16"]], {}], "config": {"index": 966, "code_hash": null, "entity": [["block_row_warps", "ot", 1], ["block_col_warps", "ot", 2], ["warp_row_tiles", "ot", 4], ["warp_col_tiles", "ot", 4], ["chunk", "ot", 8], ["offset", "ot", 0], ["offsetCS", "ot", 8], ["vec", "ot", 1], ["wmma_m", "ot", 32]]}, "result": [[1.2857429e-05], 0, 1.5158014297485352, 1651928886.633024], "version": 0.2, "tvm_version": "0.8.0"}
{"input": ["cuda -keys=cuda,gpu -max_num_threads=1024 -thread_warp_size=32", "attn_v_pad_matmul.cuda", [["TENSOR", [64, 49, 49], "float16"], ["TENSOR", [64, 32, 49], "float16"]], {}], "config": {"index": 1987, "code_hash": null, "entity": [["block_row_warps", "ot", 2], ["block_col_warps", "ot", 4], ["warp_row_tiles", "ot", 2], ["warp_col_tiles", "ot", 2], ["chunk", "ot", 1], ["offset", "ot", 0], ["offsetCS", "ot", 8], ["vec", "ot", 2], ["wmma_m", "ot", 32]]}, "result": [[1.2307439e-05], 0, 1.5919311046600342, 1651928887.3073745], "version": 0.2, "tvm_version": "0.8.0"}
{"input": ["cuda -keys=cuda,gpu -max_num_threads=1024 -thread_warp_size=32", "attn_v_pad_matmul.cuda", [["TENSOR", [64, 49, 49], "float16"], ["TENSOR", [64, 32, 49], "float16"]], {}], "config": {"index": 13690, "code_hash": null, "entity": [["block_row_warps", "ot", 2], ["block_col_warps", "ot", 1], ["warp_row_tiles", "ot", 1], ["warp_col_tiles", "ot", 1], ["chunk", "ot", 2], ["offset", "ot", 0], ["offsetCS", "ot", 8], ["vec", "ot", 4], ["wmma_m", "ot", 8]]}, "result": [[1.1012788000000001e-05], 0, 1.4555644989013672, 1651928888.9034238], "version": 0.2, "tvm_version": "0.8.0"}
{"input": ["cuda -keys=cuda,gpu -max_num_threads=1024 -thread_warp_size=32", "attn_v_pad_matmul.cuda", [["TENSOR", [64, 49, 49], "float16"], ["TENSOR", [64, 32, 49], "float16"]], {}], "config": {"index": 8536, "code_hash": null, "entity": [["block_row_warps", "ot", 2], ["block_col_warps", "ot", 2], ["warp_row_tiles", "ot", 1], ["warp_col_tiles", "ot", 2], ["chunk", "ot", 2], ["offset", "ot", 0], ["offsetCS", "ot", 8], ["vec", "ot", 4], ["wmma_m", "ot", 16]]}, "result": [[1.3355543e-05], 0, 1.408646821975708, 1651928890.4334462], "version": 0.2, "tvm_version": "0.8.0"}
{"input": ["cuda -keys=cuda,gpu -max_num_threads=1024 -thread_warp_size=32", "attn_v_pad_matmul.cuda", [["TENSOR", [64, 49, 49], "float16"], ["TENSOR", [64, 32, 49], "float16"]], {}], "config": {"index": 801, "code_hash": null, "entity": [["block_row_warps", "ot", 1], ["block_col_warps", "ot", 1], ["warp_row_tiles", "ot", 4], ["warp_col_tiles", "ot", 4], ["chunk", "ot", 2], ["offset", "ot", 0], ["offsetCS", "ot", 8], ["vec", "ot", 1], ["wmma_m", "ot", 32]]}, "result": [[1.5655791999999998e-05], 0, 1.3028581142425537, 1651928891.9119873], "version": 0.2, "tvm_version": "0.8.0"}
{"input": ["cuda -keys=cuda,gpu -max_num_threads=1024 -thread_warp_size=32", "attn_v_pad_matmul.cuda", [["TENSOR", [64, 49, 49], "float16"], ["TENSOR", [64, 32, 49], "float16"]], {}], "config": {"index": 4808, "code_hash": null, "entity": [["block_row_warps", "ot", 4], ["block_col_warps", "ot", 1], ["warp_row_tiles", "ot", 1], ["warp_col_tiles", "ot", 2], ["chunk", "ot", 8], ["offset", "ot", 0], ["offsetCS", "ot", 8], ["vec", "ot", 8], ["wmma_m", "ot", 32]]}, "result": [[1.8359391999999997e-05], 0, 1.6323957443237305, 1651928892.8207095], "version": 0.2, "tvm_version": "0.8.0"}
{"input": ["cuda -keys=cuda,gpu -max_num_threads=1024 -thread_warp_size=32", "attn_v_pad_matmul.cuda", [["TENSOR", [64, 49, 49], "float16"], ["TENSOR", [64, 32, 49], "float16"]], {}], "config": {"index": 998, "code_hash": null, "entity": [["block_row_warps", "ot", 4], ["block_col_warps", "ot", 4], ["warp_row_tiles", "ot", 4], ["warp_col_tiles", "ot", 1], ["chunk", "ot", 1], ["offset", "ot", 8], ["offsetCS", "ot", 8], ["vec", "ot", 1], ["wmma_m", "ot", 32]]}, "result": [[1.8427741000000002e-05], 0, 1.6301538944244385, 1651928893.4497607], "version": 0.2, "tvm_version": "0.8.0"}
{"input": ["cuda -keys=cuda,gpu -max_num_threads=1024 -thread_warp_size=32", "attn_v_pad_matmul.cuda", [["TENSOR", [64, 49, 49], "float16"], ["TENSOR", [64, 32, 49], "float16"]], {}], "config": {"index": 369, "code_hash": null, "entity": [["block_row_warps", "ot", 1], ["block_col_warps", "ot", 1], ["warp_row_tiles", "ot", 4], ["warp_col_tiles", "ot", 2], ["chunk", "ot", 1], ["offset", "ot", 8], ["offsetCS", "ot", 0], ["vec", "ot", 1], ["wmma_m", "ot", 32]]}, "result": [[1.0136234999999999e-05], 0, 1.6027545928955078, 1651928894.8823483], "version": 0.2, "tvm_version": "0.8.0"}
{"input": ["cuda -keys=cuda,gpu -max_num_threads=1024 -thread_warp_size=32", "attn_v_pad_matmul.cuda", [["TENSOR", [64, 49, 49], "float16"], ["TENSOR", [64, 32, 49], "float16"]], {}], "config": {"index": 12641, "code_hash": null, "entity": [["block_row_warps", "ot", 4], ["block_col_warps", "ot", 2], ["warp_row_tiles", "ot", 1], ["warp_col_tiles", "ot", 1], ["chunk", "ot", 1], ["offset", "ot", 8], ["offsetCS", "ot", 8], ["vec", "ot", 2], ["wmma_m", "ot", 8]]}, "result": [[1.9924551e-05], 0, 1.5628554821014404, 1651928896.6008031], "version": 0.2, "tvm_version": "0.8.0"}
{"input": ["cuda -keys=cuda,gpu -max_num_threads=1024 -thread_warp_size=32", "attn_v_pad_matmul.cuda", [["TENSOR", [64, 49, 49], "float16"], ["TENSOR", [64, 32, 49], "float16"]], {}], "config": {"index": 444, "code_hash": null, "entity": [["block_row_warps", "ot", 1], ["block_col_warps", "ot", 2], ["warp_row_tiles", "ot", 2], ["warp_col_tiles", "ot", 2], ["chunk", "ot", 2], ["offset", "ot", 8], ["offsetCS", "ot", 0], ["vec", "ot", 1], ["wmma_m", "ot", 32]]}, "result": [[9.743258343634117e-06], 0, 1.525099515914917, 1651928897.4377239], "version": 0.2, "tvm_version": "0.8.0"}
{"input": ["cuda -keys=cuda,gpu -max_num_threads=1024 -thread_warp_size=32", "attn_v_pad_matmul.cuda", [["TENSOR", [64, 49, 49], "float16"], ["TENSOR", [64, 32, 49], "float16"]], {}], "config": {"index": 1499, "code_hash": null, "entity": [["block_row_warps", "ot", 4], ["block_col_warps", "ot", 2], ["warp_row_tiles", "ot", 2], ["warp_col_tiles", "ot", 2], ["chunk", "ot", 4], ["offset", "ot", 0], ["offsetCS", "ot", 0], ["vec", "ot", 2], ["wmma_m", "ot", 32]]}, "result": [[2.1383496999999998e-05], 0, 1.6476175785064697, 1651928899.0562181], "version": 0.2, "tvm_version": "0.8.0"}
{"input": ["cuda -keys=cuda,gpu -max_num_threads=1024 -thread_warp_size=32", "attn_v_pad_matmul.cuda", [["TENSOR", [64, 49, 49], "float16"], ["TENSOR", [64, 32, 49], "float16"]], {}], "config": {"index": 8102, "code_hash": null, "entity": [["block_row_warps", "ot", 4], ["block_col_warps", "ot", 1], ["warp_row_tiles", "ot", 1], ["warp_col_tiles", "ot", 1], ["chunk", "ot", 1], ["offset", "ot", 8], ["offsetCS", "ot", 0], ["vec", "ot", 4], ["wmma_m", "ot", 16]]}, "result": [[2.6251983e-05], 0, 1.5125176906585693, 1651928899.6697674], "version": 0.2, "tvm_version": "0.8.0"}
{"input": ["cuda -keys=cuda,gpu -max_num_threads=1024 -thread_warp_size=32", "attn_v_pad_matmul.cuda", [["TENSOR", [64, 49, 49], "float16"], ["TENSOR", [64, 32, 49], "float16"]], {}], "config": {"index": 9803, "code_hash": null, "entity": [["block_row_warps", "ot", 4], ["block_col_warps", "ot", 1], ["warp_row_tiles", "ot", 1], ["warp_col_tiles", "ot", 1], ["chunk", "ot", 2], ["offset", "ot", 0], ["offsetCS", "ot", 8], ["vec", "ot", 8], ["wmma_m", "ot", 16]]}, "result": [[3.6165504e-05], 0, 1.3678030967712402, 1651928900.9747384], "version": 0.2, "tvm_version": "0.8.0"}
{"input": ["cuda -keys=cuda,gpu -max_num_threads=1024 -thread_warp_size=32", "attn_v_pad_matmul.cuda", [["TENSOR", [64, 49, 49], "float16"], ["TENSOR", [64, 32, 49], "float16"]], {}], "config": {"index": 2303, "code_hash": null, "entity": [["block_row_warps", "ot", 4], ["block_col_warps", "ot", 4], ["warp_row_tiles", "ot", 1], ["warp_col_tiles", "ot", 2], ["chunk", "ot", 1], ["offset", "ot", 8], ["offsetCS", "ot", 8], ["vec", "ot", 2], ["wmma_m", "ot", 32]]}, "result": [[1.993047e-05], 0, 1.3330411911010742, 1651928902.710042], "version": 0.2, "tvm_version": "0.8.0"}
{"input": ["cuda -keys=cuda,gpu -max_num_threads=1024 -thread_warp_size=32", "attn_v_pad_matmul.cuda", [["TENSOR", [64, 49, 49], "float16"], ["TENSOR", [64, 32, 49], "float16"]], {}], "config": {"index": 4608, "code_hash": null, "entity": [["block_row_warps", "ot", 1], ["block_col_warps", "ot", 1], ["warp_row_tiles", "ot", 4], ["warp_col_tiles", "ot", 4], ["chunk", "ot", 1], ["offset", "ot", 0], ["offsetCS", "ot", 8], ["vec", "ot", 8], ["wmma_m", "ot", 32]]}, "result": [[1.6663095e-05], 0, 1.4364268779754639, 1651928903.2503269], "version": 0.2, "tvm_version": "0.8.0"}
{"input": ["cuda -keys=cuda,gpu -max_num_threads=1024 -thread_warp_size=32", "attn_v_pad_matmul.cuda", [["TENSOR", [64, 49, 49], "float16"], ["TENSOR", [64, 32, 49], "float16"]], {}], "config": {"index": 6269, "code_hash": null, "entity": [["block_row_warps", "ot", 4], ["block_col_warps", "ot", 2], ["warp_row_tiles", "ot", 1], ["warp_col_tiles", "ot", 2], ["chunk", "ot", 2], ["offset", "ot", 8], ["offsetCS", "ot", 8], ["vec", "ot", 1], ["wmma_m", "ot", 16]]}, "result": [[1.0351984e-05], 0, 1.2802925109863281, 1651928905.9368489], "version": 0.2, "tvm_version": "0.8.0"}
{"input": ["cuda -keys=cuda,gpu -max_num_threads=1024 -thread_warp_size=32", "attn_v_pad_matmul.cuda", [["TENSOR", [64, 49, 49], "float16"], ["TENSOR", [64, 32, 49], "float16"]], {}], "config": {"index": 6603, "code_hash": null, "entity": [["block_row_warps", "ot", 1], ["block_col_warps", "ot", 4], ["warp_row_tiles", "ot", 2], ["warp_col_tiles", "ot", 2], ["chunk", "ot", 2], ["offset", "ot", 0], ["offsetCS", "ot", 0], ["vec", "ot", 2], ["wmma_m", "ot", 16]]}, "result": [[1.1225906e-05], 0, 1.4705207347869873, 1651928906.46002], "version": 0.2, "tvm_version": "0.8.0"}
{"input": ["cuda -keys=cuda,gpu -max_num_threads=1024 -thread_warp_size=32", "attn_v_pad_matmul.cuda", [["TENSOR", [64, 49, 49], "float16"], ["TENSOR", [64, 32, 49], "float16"]], {}], "config": {"index": 2962, "code_hash": null, "entity": [["block_row_warps", "ot", 2], ["block_col_warps", "ot", 1], ["warp_row_tiles", "ot", 4], ["warp_col_tiles", "ot", 2], ["chunk", "ot", 1], ["offset", "ot", 8], ["offsetCS", "ot", 0], ["vec", "ot", 4], ["wmma_m", "ot", 32]]}, "result": [[1.1101756e-05], 0, 1.5207133293151855, 1651928908.1943033], "version": 0.2, "tvm_version": "0.8.0"}
{"input": ["cuda -keys=cuda,gpu -max_num_threads=1024 -thread_warp_size=32", "attn_v_pad_matmul.cuda", [["TENSOR", [64, 49, 49], "float16"], ["TENSOR", [64, 32, 49], "float16"]], {}], "config": {"index": 7494, "code_hash": null, "entity": [["block_row_warps", "ot", 1], ["block_col_warps", "ot", 4], ["warp_row_tiles", "ot", 2], ["warp_col_tiles", "ot", 2], ["chunk", "ot", 1], ["offset", "ot", 8], ["offsetCS", "ot", 8], ["vec", "ot", 2], ["wmma_m", "ot", 16]]}, "result": [[8.174548207663782e-06], 0, 1.588188886642456, 1651928908.8555312], "version": 0.2, "tvm_version": "0.8.0"}
{"input": ["cuda -keys=cuda,gpu -max_num_threads=1024 -thread_warp_size=32", "attn_v_pad_matmul.cuda", [["TENSOR", [64, 49, 49], "float16"], ["TENSOR", [64, 32, 49], "float16"]], {}], "config": {"index": 4084, "code_hash": null, "entity": [["block_row_warps", "ot", 2], ["block_col_warps", "ot", 4], ["warp_row_tiles", "ot", 1], ["warp_col_tiles", "ot", 2], ["chunk", "ot", 4], ["offset", "ot", 0], ["offsetCS", "ot", 0], ["vec", "ot", 8], ["wmma_m", "ot", 32]]}, "result": [[3.3839143000000004e-05], 0, 1.5955090522766113, 1651928909.4072018], "version": 0.2, "tvm_version": "0.8.0"}
{"input": ["cuda -keys=cuda,gpu -max_num_threads=1024 -thread_warp_size=32", "attn_v_pad_matmul.cuda", [["TENSOR", [64, 49, 49], "float16"], ["TENSOR", [64, 32, 49], "float16"]], {}], "config": {"index": 4656, "code_hash": null, "entity": [["block_row_warps", "ot", 1], ["block_col_warps", "ot", 2], ["warp_row_tiles", "ot", 2], ["warp_col_tiles", "ot", 2], ["chunk", "ot", 2], ["offset", "ot", 0], ["offsetCS", "ot", 8], ["vec", "ot", 8], ["wmma_m", "ot", 32]]}, "result": [[1.2233987e-05], 0, 1.5790302753448486, 1651928911.1839855], "version": 0.2, "tvm_version": "0.8.0"}
{"input": ["cuda -keys=cuda,gpu -max_num_threads=1024 -thread_warp_size=32", "attn_v_pad_matmul.cuda", [["TENSOR", [64, 49, 49], "float16"], ["TENSOR", [64, 32, 49], "float16"]], {}], "config": {"index": 8303, "code_hash": null, "entity": [["block_row_warps", "ot", 4], ["block_col_warps", "ot", 2], ["warp_row_tiles", "ot", 2], ["warp_col_tiles", "ot", 2], ["chunk", "ot", 4], ["offset", "ot", 8], ["offsetCS", "ot", 0], ["vec", "ot", 4], ["wmma_m", "ot", 16]]}, "result": [[1.1644708e-05], 0, 1.766819715499878, 1651928912.58808], "version": 0.2, "tvm_version": "0.8.0"}
{"input": ["cuda -keys=cuda,gpu -max_num_threads=1024 -thread_warp_size=32", "attn_v_pad_matmul.cuda", [["TENSOR", [64, 49, 49], "float16"], ["TENSOR", [64, 32, 49], "float16"]], {}], "config": {"index": 5539, "code_hash": null, "entity": [["block_row_warps", "ot", 2], ["block_col_warps", "ot", 2], ["warp_row_tiles", "ot", 1], ["warp_col_tiles", "ot", 2], ["chunk", "ot", 1], ["offset", "ot", 8], ["offsetCS", "ot", 0], ["vec", "ot", 1], ["wmma_m", "ot", 16]]}, "result": [[9.286735475896169e-06], 0, 1.0953795909881592, 1651928957.6482325], "version": 0.2, "tvm_version": "0.8.0"}
{"input": ["cuda -keys=cuda,gpu -max_num_threads=1024 -thread_warp_size=32", "attn_v_pad_matmul.cuda", [["TENSOR", [64, 49, 49], "float16"], ["TENSOR", [64, 32, 49], "float16"]], {}], "config": {"index": 5213, "code_hash": null, "entity": [["block_row_warps", "ot", 4], ["block_col_warps", "ot", 1], ["warp_row_tiles", "ot", 1], ["warp_col_tiles", "ot", 2], ["chunk", "ot", 1], ["offset", "ot", 0], ["offsetCS", "ot", 0], ["vec", "ot", 1], ["wmma_m", "ot", 16]]}, "result": [[1.1632516000000001e-05], 0, 1.1988258361816406, 1651928958.1274703], "version": 0.2, "tvm_version": "0.8.0"}
{"input": ["cuda -keys=cuda,gpu -max_num_threads=1024 -thread_warp_size=32", "attn_v_pad_matmul.cuda", [["TENSOR", [64, 49, 49], "float16"], ["TENSOR", [64, 32, 49], "float16"]], {}], "config": {"index": 5620, "code_hash": null, "entity": [["block_row_warps", "ot", 2], ["block_col_warps", "ot", 2], ["warp_row_tiles", "ot", 1], ["warp_col_tiles", "ot", 2], ["chunk", "ot", 2], ["offset", "ot", 8], ["offsetCS", "ot", 0], ["vec", "ot", 1], ["wmma_m", "ot", 16]]}, "result": [[9.60692583436341e-06], 0, 1.3060123920440674, 1651928958.729074], "version": 0.2, "tvm_version": "0.8.0"}
{"input": ["cuda -keys=cuda,gpu -max_num_threads=1024 -thread_warp_size=32", "attn_v_pad_matmul.cuda", [["TENSOR", [64, 49, 49], "float16"], ["TENSOR", [64, 32, 49], "float16"]], {}], "config": {"index": 5296, "code_hash": null, "entity": [["block_row_warps", "ot", 2], ["block_col_warps", "ot", 2], ["warp_row_tiles", "ot", 1], ["warp_col_tiles", "ot", 2], ["chunk", "ot", 2], ["offset", "ot", 0], ["offsetCS", "ot", 0], ["vec", "ot", 1], ["wmma_m", "ot", 16]]}, "result": [[1.2093296e-05], 0, 1.1026594638824463, 1651928959.164229], "version": 0.2, "tvm_version": "0.8.0"}
{"input": ["cuda -keys=cuda,gpu -max_num_threads=1024 -thread_warp_size=32", "attn_v_pad_matmul.cuda", [["TENSOR", [64, 49, 49], "float16"], ["TENSOR", [64, 32, 49], "float16"]], {}], "config": {"index": 6189, "code_hash": null, "entity": [["block_row_warps", "ot", 1], ["block_col_warps", "ot", 4], ["warp_row_tiles", "ot", 1], ["warp_col_tiles", "ot", 2], ["chunk", "ot", 1], ["offset", "ot", 8], ["offsetCS", "ot", 8], ["vec", "ot", 1], ["wmma_m", "ot", 16]]}, "result": [[7.712402966625464e-06], 0, 1.3627173900604248, 1651928959.972811], "version": 0.2, "tvm_version": "0.8.0"}
{"input": ["cuda -keys=cuda,gpu -max_num_threads=1024 -thread_warp_size=32", "attn_v_pad_matmul.cuda", [["TENSOR", [64, 49, 49], "float16"], ["TENSOR", [64, 32, 49], "float16"]], {}], "config": {"index": 5863, "code_hash": null, "entity": [["block_row_warps", "ot", 2], ["block_col_warps", "ot", 2], ["warp_row_tiles", "ot", 1], ["warp_col_tiles", "ot", 2], ["chunk", "ot", 1], ["offset", "ot", 0], ["offsetCS", "ot", 8], ["vec", "ot", 1], ["wmma_m", "ot", 16]]}, "result": [[9.061658220024723e-06], 0, 1.5692319869995117, 1651928960.5893488], "version": 0.2, "tvm_version": "0.8.0"}
{"input": ["cuda -keys=cuda,gpu -max_num_threads=1024 -thread_warp_size=32", "attn_v_pad_matmul.cuda", [["TENSOR", [64, 49, 49], "float16"], ["TENSOR", [64, 32, 49], "float16"]], {}], "config": {"index": 5942, "code_hash": null, "entity": [["block_row_warps", "ot", 4], ["block_col_warps", "ot", 1], ["warp_row_tiles", "ot", 1], ["warp_col_tiles", "ot", 2], ["chunk", "ot", 2], ["offset", "ot", 0], ["offsetCS", "ot", 8], ["vec", "ot", 1], ["wmma_m", "ot", 16]]}, "result": [[1.2558123e-05], 0, 1.359847068786621, 1651928961.0842962], "version": 0.2, "tvm_version": "0.8.0"}
{"input": ["cuda -keys=cuda,gpu -max_num_threads=1024 -thread_warp_size=32", "attn_v_pad_matmul.cuda", [["TENSOR", [64, 49, 49], "float16"], ["TENSOR", [64, 32, 49], "float16"]], {}], "config": {"index": 5294, "code_hash": null, "entity": [["block_row_warps", "ot", 4], ["block_col_warps", "ot", 1], ["warp_row_tiles", "ot", 1], ["warp_col_tiles", "ot", 2], ["chunk", "ot", 2], ["offset", "ot", 0], ["offsetCS", "ot", 0], ["vec", "ot", 1], ["wmma_m", "ot", 16]]}, "result": [[1.2072495999999999e-05], 0, 1.3647010326385498, 1651928961.6618886], "version": 0.2, "tvm_version": "0.8.0"}
{"input": ["cuda -keys=cuda,gpu -max_num_threads=1024 -thread_warp_size=32", "attn_v_pad_matmul.cuda", [["TENSOR", [64, 49, 49], "float16"], ["TENSOR", [64, 32, 49], "float16"]], {}], "config": {"index": 5217, "code_hash": null, "entity": [["block_row_warps", "ot", 1], ["block_col_warps", "ot", 4], ["warp_row_tiles", "ot", 1], ["warp_col_tiles", "ot", 2], ["chunk", "ot", 1], ["offset", "ot", 0], ["offsetCS", "ot", 0], ["vec", "ot", 1], ["wmma_m", "ot", 16]]}, "result": [[9.359874536464772e-06], 0, 1.1619160175323486, 1651928962.3088145], "version": 0.2, "tvm_version": "0.8.0"}
{"input": ["cuda -keys=cuda,gpu -max_num_threads=1024 -thread_warp_size=32", "attn_v_pad_matmul.cuda", [["TENSOR", [64, 49, 49], "float16"], ["TENSOR", [64, 32, 49], "float16"]], {}], "config": {"index": 5537, "code_hash": null, "entity": [["block_row_warps", "ot", 4], ["block_col_warps", "ot", 1], ["warp_row_tiles", "ot", 1], ["warp_col_tiles", "ot", 2], ["chunk", "ot", 1], ["offset", "ot", 8], ["offsetCS", "ot", 0], ["vec", "ot", 1], ["wmma_m", "ot", 16]]}, "result": [[9.390684177997527e-06], 0, 1.6739962100982666, 1651928963.0237417], "version": 0.2, "tvm_version": "0.8.0"}
{"input": ["cuda -keys=cuda,gpu -max_num_threads=1024 -thread_warp_size=32", "attn_v_pad_matmul.cuda", [["TENSOR", [64, 49, 49], "float16"], ["TENSOR", [64, 32, 49], "float16"]], {}], "config": {"index": 5861, "code_hash": null, "entity": [["block_row_warps", "ot", 4], ["block_col_warps", "ot", 1], ["warp_row_tiles", "ot", 1], ["warp_col_tiles", "ot", 2], ["chunk", "ot", 1], ["offset", "ot", 0], ["offsetCS", "ot", 8], ["vec", "ot", 1], ["wmma_m", "ot", 16]]}, "result": [[1.1654389e-05], 0, 1.304311990737915, 1651928963.5222864], "version": 0.2, "tvm_version": "0.8.0"}
{"input": ["cuda -keys=cuda,gpu -max_num_threads=1024 -thread_warp_size=32", "attn_v_pad_matmul.cuda", [["TENSOR", [64, 49, 49], "float16"], ["TENSOR", [64, 32, 49], "float16"]], {}], "config": {"index": 5215, "code_hash": null, "entity": [["block_row_warps", "ot", 2], ["block_col_warps", "ot", 2], ["warp_row_tiles", "ot", 1], ["warp_col_tiles", "ot", 2], ["chunk", "ot", 1], ["offset", "ot", 0], ["offsetCS", "ot", 0], ["vec", "ot", 1], ["wmma_m", "ot", 16]]}, "result": [[1.0414483e-05], 0, 1.3052735328674316, 1651928963.9825723], "version": 0.2, "tvm_version": "0.8.0"}
{"input": ["cuda -keys=cuda,gpu -max_num_threads=1024 -thread_warp_size=32", "attn_v_pad_matmul.cuda", [["TENSOR", [64, 49, 49], "float16"], ["TENSOR", [64, 32, 49], "float16"]], {}], "config": {"index": 5618, "code_hash": null, "entity": [["block_row_warps", "ot", 4], ["block_col_warps", "ot", 1], ["warp_row_tiles", "ot", 1], ["warp_col_tiles", "ot", 2], ["chunk", "ot", 2], ["offset", "ot", 8], ["offsetCS", "ot", 0], ["vec", "ot", 1], ["wmma_m", "ot", 16]]}, "result": [[9.585685414091471e-06], 0, 1.2860164642333984, 1651928964.680539], "version": 0.2, "tvm_version": "0.8.0"}
{"input": ["cuda -keys=cuda,gpu -max_num_threads=1024 -thread_warp_size=32", "attn_v_pad_matmul.cuda", [["TENSOR", [64, 49, 49], "float16"], ["TENSOR", [64, 32, 49], "float16"]], {}], "config": {"index": 6185, "code_hash": null, "entity": [["block_row_warps", "ot", 4], ["block_col_warps", "ot", 1], ["warp_row_tiles", "ot", 1], ["warp_col_tiles", "ot", 2], ["chunk", "ot", 1], ["offset", "ot", 8], ["offsetCS", "ot", 8], ["vec", "ot", 1], ["wmma_m", "ot", 16]]}, "result": [[9.454565512978986e-06], 0, 1.2180144786834717, 1651928965.2554207], "version": 0.2, "tvm_version": "0.8.0"}
{"input": ["cuda -keys=cuda,gpu -max_num_threads=1024 -thread_warp_size=32", "attn_v_pad_matmul.cuda", [["TENSOR", [64, 49, 49], "float16"], ["TENSOR", [64, 32, 49], "float16"]], {}], "config": {"index": 5541, "code_hash": null, "entity": [["block_row_warps", "ot", 1], ["block_col_warps", "ot", 4], ["warp_row_tiles", "ot", 1], ["warp_col_tiles", "ot", 2], ["chunk", "ot", 1], ["offset", "ot", 8], ["offsetCS", "ot", 0], ["vec", "ot", 1], ["wmma_m", "ot", 16]]}, "result": [[8.5921217552534e-06], 0, 1.2914440631866455, 1651928965.8091662], "version": 0.2, "tvm_version": "0.8.0"}
{"input": ["cuda -keys=cuda,gpu -max_num_threads=1024 -thread_warp_size=32", "attn_v_pad_matmul.cuda", [["TENSOR", [64, 49, 49], "float16"], ["TENSOR", [64, 32, 49], "float16"]], {}], "config": {"index": 10460, "code_hash": null, "entity": [["block_row_warps", "ot", 4], ["block_col_warps", "ot", 1], ["warp_row_tiles", "ot", 2], ["warp_col_tiles", "ot", 1], ["chunk", "ot", 2], ["offset", "ot", 0], ["offsetCS", "ot", 0], ["vec", "ot", 1], ["wmma_m", "ot", 8]]}, "result": [[1.2603478000000002e-05], 0, 1.3559315204620361, 1651928966.4278955], "version": 0.2, "tvm_version": "0.8.0"}
{"input": ["cuda -keys=cuda,gpu -max_num_threads=1024 -thread_warp_size=32", "attn_v_pad_matmul.cuda", [["TENSOR", [64, 49, 49], "float16"], ["TENSOR", [64, 32, 49], "float16"]], {}], "config": {"index": 10381, "code_hash": null, "entity": [["block_row_warps", "ot", 2], ["block_col_warps", "ot", 2], ["warp_row_tiles", "ot", 2], ["warp_col_tiles", "ot", 1], ["chunk", "ot", 1], ["offset", "ot", 0], ["offsetCS", "ot", 0], ["vec", "ot", 1], ["wmma_m", "ot", 8]]}, "result": [[1.0611868e-05], 0, 1.4195334911346436, 1651928967.0733397], "version": 0.2, "tvm_version": "0.8.0"}
{"input": ["cuda -keys=cuda,gpu -max_num_threads=1024 -thread_warp_size=32", "attn_v_pad_matmul.cuda", [["TENSOR", [64, 49, 49], "float16"], ["TENSOR", [64, 32, 49], "float16"]], {}], "config": {"index": 11108, "code_hash": null, "entity": [["block_row_warps", "ot", 4], ["block_col_warps", "ot", 1], ["warp_row_tiles", "ot", 2], ["warp_col_tiles", "ot", 1], ["chunk", "ot", 2], ["offset", "ot", 0], ["offsetCS", "ot", 8], ["vec", "ot", 1], ["wmma_m", "ot", 8]]}, "result": [[1.2559398e-05], 0, 1.3830657005310059, 1651928967.467404], "version": 0.2, "tvm_version": "0.8.0"}
{"input": ["cuda -keys=cuda,gpu -max_num_threads=1024 -thread_warp_size=32", "attn_v_pad_matmul.cuda", [["TENSOR", [64, 49, 49], "float16"], ["TENSOR", [64, 32, 49], "float16"]], {}], "config": {"index": 6270, "code_hash": null, "entity": [["block_row_warps", "ot", 1], ["block_col_warps", "ot", 4], ["warp_row_tiles", "ot", 1], ["warp_col_tiles", "ot", 2], ["chunk", "ot", 2], ["offset", "ot", 8], ["offsetCS", "ot", 8], ["vec", "ot", 1], ["wmma_m", "ot", 16]]}, "result": [[7.708225587144623e-06], 0, 1.1209449768066406, 1651928967.9286215], "version": 0.2, "tvm_version": "0.8.0"}
{"input": ["cuda -keys=cuda,gpu -max_num_threads=1024 -thread_warp_size=32", "attn_v_pad_matmul.cuda", [["TENSOR", [64, 49, 49], "float16"], ["TENSOR", [64, 32, 49], "float16"]], {}], "config": {"index": 11027, "code_hash": null, "entity": [["block_row_warps", "ot", 4], ["block_col_warps", "ot", 1], ["warp_row_tiles", "ot", 2], ["warp_col_tiles", "ot", 1], ["chunk", "ot", 1], ["offset", "ot", 0], ["offsetCS", "ot", 8], ["vec", "ot", 1], ["wmma_m", "ot", 8]]}, "result": [[1.1749355e-05], 0, 1.4077672958374023, 1651928968.557056], "version": 0.2, "tvm_version": "0.8.0"}
{"input": ["cuda -keys=cuda,gpu -max_num_threads=1024 -thread_warp_size=32", "attn_v_pad_matmul.cuda", [["TENSOR", [64, 49, 49], "float16"], ["TENSOR", [64, 32, 49], "float16"]], {}], "config": {"index": 10784, "code_hash": null, "entity": [["block_row_warps", "ot", 4], ["block_col_warps", "ot", 1], ["warp_row_tiles", "ot", 2], ["warp_col_tiles", "ot", 1], ["chunk", "ot", 2], ["offset", "ot", 8], ["offsetCS", "ot", 0], ["vec", "ot", 1], ["wmma_m", "ot", 8]]}, "result": [[9.697170580964154e-06], 0, 1.375685214996338, 1651928969.4211824], "version": 0.2, "tvm_version": "0.8.0"}
{"input": ["cuda -keys=cuda,gpu -max_num_threads=1024 -thread_warp_size=32", "attn_v_pad_matmul.cuda", [["TENSOR", [64, 49, 49], "float16"], ["TENSOR", [64, 32, 49], "float16"]], {}], "config": {"index": 11112, "code_hash": null, "entity": [["block_row_warps", "ot", 1], ["block_col_warps", "ot", 4], ["warp_row_tiles", "ot", 2], ["warp_col_tiles", "ot", 1], ["chunk", "ot", 2], ["offset", "ot", 0], ["offsetCS", "ot", 8], ["vec", "ot", 1], ["wmma_m", "ot", 8]]}, "result": [[1.0327884e-05], 0, 1.5613620281219482, 1651928970.0374494], "version": 0.2, "tvm_version": "0.8.0"}
{"input": ["cuda -keys=cuda,gpu -max_num_threads=1024 -thread_warp_size=32", "attn_v_pad_matmul.cuda", [["TENSOR", [64, 49, 49], "float16"], ["TENSOR", [64, 32, 49], "float16"]], {}], "config": {"index": 6187, "code_hash": null, "entity": [["block_row_warps", "ot", 2], ["block_col_warps", "ot", 2], ["warp_row_tiles", "ot", 1], ["warp_col_tiles", "ot", 2], ["chunk", "ot", 1], ["offset", "ot", 8], ["offsetCS", "ot", 8], ["vec", "ot", 1], ["wmma_m", "ot", 16]]}, "result": [[8.401806551297898e-06], 0, 1.4049406051635742, 1651928970.523033], "version": 0.2, "tvm_version": "0.8.0"}
{"input": ["cuda -keys=cuda,gpu -max_num_threads=1024 -thread_warp_size=32", "attn_v_pad_matmul.cuda", [["TENSOR", [64, 49, 49], "float16"], ["TENSOR", [64, 32, 49], "float16"]], {}], "config": {"index": 10383, "code_hash": null, "entity": [["block_row_warps", "ot", 1], ["block_col_warps", "ot", 4], ["warp_row_tiles", "ot", 2], ["warp_col_tiles", "ot", 1], ["chunk", "ot", 1], ["offset", "ot", 0], ["offsetCS", "ot", 0], ["vec", "ot", 1], ["wmma_m", "ot", 8]]}, "result": [[9.353923980222497e-06], 0, 1.921858787536621, 1651928971.4394388], "version": 0.2, "tvm_version": "0.8.0"}
{"input": ["cuda -keys=cuda,gpu -max_num_threads=1024 -thread_warp_size=32", "attn_v_pad_matmul.cuda", [["TENSOR", [64, 49, 49], "float16"], ["TENSOR", [64, 32, 49], "float16"]], {}], "config": {"index": 10705, "code_hash": null, "entity": [["block_row_warps", "ot", 2], ["block_col_warps", "ot", 2], ["warp_row_tiles", "ot", 2], ["warp_col_tiles", "ot", 1], ["chunk", "ot", 1], ["offset", "ot", 8], ["offsetCS", "ot", 0], ["vec", "ot", 1], ["wmma_m", "ot", 8]]}, "result": [[9.763948084054389e-06], 0, 1.4070196151733398, 1651928972.0368354], "version": 0.2, "tvm_version": "0.8.0"}
{"input": ["cuda -keys=cuda,gpu -max_num_threads=1024 -thread_warp_size=32", "attn_v_pad_matmul.cuda", [["TENSOR", [64, 49, 49], "float16"], ["TENSOR", [64, 32, 49], "float16"]], {}], "config": {"index": 10788, "code_hash": null, "entity": [["block_row_warps", "ot", 1], ["block_col_warps", "ot", 4], ["warp_row_tiles", "ot", 2], ["warp_col_tiles", "ot", 1], ["chunk", "ot", 2], ["offset", "ot", 8], ["offsetCS", "ot", 0], ["vec", "ot", 1], ["wmma_m", "ot", 8]]}, "result": [[8.560522867737948e-06], 0, 1.3489990234375, 1651928972.5858066], "version": 0.2, "tvm_version": "0.8.0"}
{"input": ["cuda -keys=cuda,gpu -max_num_threads=1024 -thread_warp_size=32", "attn_v_pad_matmul.cuda", [["TENSOR", [64, 49, 49], "float16"], ["TENSOR", [64, 32, 49], "float16"]], {}], "config": {"index": 5622, "code_hash": null, "entity": [["block_row_warps", "ot", 1], ["block_col_warps", "ot", 4], ["warp_row_tiles", "ot", 1], ["warp_col_tiles", "ot", 2], ["chunk", "ot", 2], ["offset", "ot", 8], ["offsetCS", "ot", 0], ["vec", "ot", 1], ["wmma_m", "ot", 16]]}, "result": [[8.290359085290482e-06], 0, 1.4917941093444824, 1651928973.0606081], "version": 0.2, "tvm_version": "0.8.0"}
{"input": ["cuda -keys=cuda,gpu -max_num_threads=1024 -thread_warp_size=32", "attn_v_pad_matmul.cuda", [["TENSOR", [64, 49, 49], "float16"], ["TENSOR", [64, 32, 49], "float16"]], {}], "config": {"index": 10703, "code_hash": null, "entity": [["block_row_warps", "ot", 4], ["block_col_warps", "ot", 1], ["warp_row_tiles", "ot", 2], ["warp_col_tiles", "ot", 1], ["chunk", "ot", 1], ["offset", "ot", 8], ["offsetCS", "ot", 0], ["vec", "ot", 1], ["wmma_m", "ot", 8]]}, "result": [[1.1109107e-05], 0, 1.5352256298065186, 1651928973.7893918], "version": 0.2, "tvm_version": "0.8.0"}
{"input": ["cuda -keys=cuda,gpu -max_num_threads=1024 -thread_warp_size=32", "attn_v_pad_matmul.cuda", [["TENSOR", [64, 49, 49], "float16"], ["TENSOR", [64, 32, 49], "float16"]], {}], "config": {"index": 10462, "code_hash": null, "entity": [["block_row_warps", "ot", 2], ["block_col_warps", "ot", 2], ["warp_row_tiles", "ot", 2], ["warp_col_tiles", "ot", 1], ["chunk", "ot", 2], ["offset", "ot", 0], ["offsetCS", "ot", 0], ["vec", "ot", 1], ["wmma_m", "ot", 8]]}, "result": [[1.2457509e-05], 0, 1.4048669338226318, 1651928974.409512], "version": 0.2, "tvm_version": "0.8.0"}
{"input": ["cuda -keys=cuda,gpu -max_num_threads=1024 -thread_warp_size=32", "attn_v_pad_matmul.cuda", [["TENSOR", [64, 49, 49], "float16"], ["TENSOR", [64, 32, 49], "float16"]], {}], "config": {"index": 5865, "code_hash": null, "entity": [["block_row_warps", "ot", 1], ["block_col_warps", "ot", 4], ["warp_row_tiles", "ot", 1], ["warp_col_tiles", "ot", 2], ["chunk", "ot", 1], ["offset", "ot", 0], ["offsetCS", "ot", 8], ["vec", "ot", 1], ["wmma_m", "ot", 16]]}, "result": [[8.848941903584673e-06], 0, 1.1554934978485107, 1651928974.9354725], "version": 0.2, "tvm_version": "0.8.0"}
{"input": ["cuda -keys=cuda,gpu -max_num_threads=1024 -thread_warp_size=32", "attn_v_pad_matmul.cuda", [["TENSOR", [64, 49, 49], "float16"], ["TENSOR", [64, 32, 49], "float16"]], {}], "config": {"index": 6268, "code_hash": null, "entity": [["block_row_warps", "ot", 2], ["block_col_warps", "ot", 2], ["warp_row_tiles", "ot", 1], ["warp_col_tiles", "ot", 2], ["chunk", "ot", 2], ["offset", "ot", 8], ["offsetCS", "ot", 8], ["vec", "ot", 1], ["wmma_m", "ot", 16]]}, "result": [[8.361092707045735e-06], 0, 1.645540714263916, 1651928975.6638246], "version": 0.2, "tvm_version": "0.8.0"}
{"input": ["cuda -keys=cuda,gpu -max_num_threads=1024 -thread_warp_size=32", "attn_v_pad_matmul.cuda", [["TENSOR", [64, 49, 49], "float16"], ["TENSOR", [64, 32, 49], "float16"]], {}], "config": {"index": 11351, "code_hash": null, "entity": [["block_row_warps", "ot", 4], ["block_col_warps", "ot", 1], ["warp_row_tiles", "ot", 2], ["warp_col_tiles", "ot", 1], ["chunk", "ot", 1], ["offset", "ot", 8], ["offsetCS", "ot", 8], ["vec", "ot", 1], ["wmma_m", "ot", 8]]}, "result": [[1.1170074e-05], 0, 1.3079357147216797, 1651928976.1519966], "version": 0.2, "tvm_version": "0.8.0"}
{"input": ["cuda -keys=cuda,gpu -max_num_threads=1024 -thread_warp_size=32", "attn_v_pad_matmul.cuda", [["TENSOR", [64, 49, 49], "float16"], ["TENSOR", [64, 32, 49], "float16"]], {}], "config": {"index": 10786, "code_hash": null, "entity": [["block_row_warps", "ot", 2], ["block_col_warps", "ot", 2], ["warp_row_tiles", "ot", 2], ["warp_col_tiles", "ot", 1], ["chunk", "ot", 2], ["offset", "ot", 8], ["offsetCS", "ot", 0], ["vec", "ot", 1], ["wmma_m", "ot", 8]]}, "result": [[9.583148949320149e-06], 0, 1.6749045848846436, 1651928976.8122044], "version": 0.2, "tvm_version": "0.8.0"}
{"input": ["cuda -keys=cuda,gpu -max_num_threads=1024 -thread_warp_size=32", "attn_v_pad_matmul.cuda", [["TENSOR", [64, 49, 49], "float16"], ["TENSOR", [64, 32, 49], "float16"]], {}], "config": {"index": 10464, "code_hash": null, "entity": [["block_row_warps", "ot", 1], ["block_col_warps", "ot", 4], ["warp_row_tiles", "ot", 2], ["warp_col_tiles", "ot", 1], ["chunk", "ot", 2], ["offset", "ot", 0], ["offsetCS", "ot", 0], ["vec", "ot", 1], ["wmma_m", "ot", 8]]}, "result": [[1.0930961e-05], 0, 1.4936659336090088, 1651928977.4532983], "version": 0.2, "tvm_version": "0.8.0"}
{"input": ["cuda -keys=cuda,gpu -max_num_threads=1024 -thread_warp_size=32", "attn_v_pad_matmul.cuda", [["TENSOR", [64, 49, 49], "float16"], ["TENSOR", [64, 32, 49], "float16"]], {}], "config": {"index": 10379, "code_hash": null, "entity": [["block_row_warps", "ot", 4], ["block_col_warps", "ot", 1], ["warp_row_tiles", "ot", 2], ["warp_col_tiles", "ot", 1], ["chunk", "ot", 1], ["offset", "ot", 0], ["offsetCS", "ot", 0], ["vec", "ot", 1], ["wmma_m", "ot", 8]]}, "result": [[1.1385817e-05], 0, 1.3726351261138916, 1651928977.9305434], "version": 0.2, "tvm_version": "0.8.0"}
{"input": ["cuda -keys=cuda,gpu -max_num_threads=1024 -thread_warp_size=32", "attn_v_pad_matmul.cuda", [["TENSOR", [64, 49, 49], "float16"], ["TENSOR", [64, 32, 49], "float16"]], {}], "config": {"index": 10707, "code_hash": null, "entity": [["block_row_warps", "ot", 1], ["block_col_warps", "ot", 4], ["warp_row_tiles", "ot", 2], ["warp_col_tiles", "ot", 1], ["chunk", "ot", 1], ["offset", "ot", 8], ["offsetCS", "ot", 0], ["vec", "ot", 1], ["wmma_m", "ot", 8]]}, "result": [[8.851097033374537e-06], 0, 1.5986859798431396, 1651928978.5688217], "version": 0.2, "tvm_version": "0.8.0"}
{"input": ["cuda -keys=cuda,gpu -max_num_threads=1024 -thread_warp_size=32", "attn_v_pad_matmul.cuda", [["TENSOR", [64, 49, 49], "float16"], ["TENSOR", [64, 32, 49], "float16"]], {}], "config": {"index": 11432, "code_hash": null, "entity": [["block_row_warps", "ot", 4], ["block_col_warps", "ot", 1], ["warp_row_tiles", "ot", 2], ["warp_col_tiles", "ot", 1], ["chunk", "ot", 2], ["offset", "ot", 8], ["offsetCS", "ot", 8], ["vec", "ot", 1], ["wmma_m", "ot", 8]]}, "result": [[9.735229295426453e-06], 0, 1.292388916015625, 1651928979.0241897], "version": 0.2, "tvm_version": "0.8.0"}
{"input": ["cuda -keys=cuda,gpu -max_num_threads=1024 -thread_warp_size=32", "attn_v_pad_matmul.cuda", [["TENSOR", [64, 49, 49], "float16"], ["TENSOR", [64, 32, 49], "float16"]], {}], "config": {"index": 5298, "code_hash": null, "entity": [["block_row_warps", "ot", 1], ["block_col_warps", "ot", 4], ["warp_row_tiles", "ot", 1], ["warp_col_tiles", "ot", 2], ["chunk", "ot", 2], ["offset", "ot", 0], ["offsetCS", "ot", 0], ["vec", "ot", 1], ["wmma_m", "ot", 16]]}, "result": [[1.0509431e-05], 0, 1.4832680225372314, 1651928979.6097727], "version": 0.2, "tvm_version": "0.8.0"}
{"input": ["cuda -keys=cuda,gpu -max_num_threads=1024 -thread_warp_size=32", "attn_v_pad_matmul.cuda", [["TENSOR", [64, 49, 49], "float16"], ["TENSOR", [64, 32, 49], "float16"]], {}], "config": {"index": 11436, "code_hash": null, "entity": [["block_row_warps", "ot", 1], ["block_col_warps", "ot", 4], ["warp_row_tiles", "ot", 2], ["warp_col_tiles", "ot", 1], ["chunk", "ot", 2], ["offset", "ot", 8], ["offsetCS", "ot", 8], ["vec", "ot", 1], ["wmma_m", "ot", 8]]}, "result": [[7.82386217552534e-06], 0, 1.3256378173828125, 1651928980.1460378], "version": 0.2, "tvm_version": "0.8.0"}
{"input": ["cuda -keys=cuda,gpu -max_num_threads=1024 -thread_warp_size=32", "attn_v_pad_matmul.cuda", [["TENSOR", [64, 49, 49], "float16"], ["TENSOR", [64, 32, 49], "float16"]], {}], "config": {"index": 11355, "code_hash": null, "entity": [["block_row_warps", "ot", 1], ["block_col_warps", "ot", 4], ["warp_row_tiles", "ot", 2], ["warp_col_tiles", "ot", 1], ["chunk", "ot", 1], ["offset", "ot", 8], ["offsetCS", "ot", 8], ["vec", "ot", 1], ["wmma_m", "ot", 8]]}, "result": [[7.819211372064277e-06], 0, 1.5800583362579346, 1651928980.8924406], "version": 0.2, "tvm_version": "0.8.0"}
{"input": ["cuda -keys=cuda,gpu -max_num_threads=1024 -thread_warp_size=32", "attn_v_pad_matmul.cuda", [["TENSOR", [64, 49, 49], "float16"], ["TENSOR", [64, 32, 49], "float16"]], {}], "config": {"index": 6266, "code_hash": null, "entity": [["block_row_warps", "ot", 4], ["block_col_warps", "ot", 1], ["warp_row_tiles", "ot", 1], ["warp_col_tiles", "ot", 2], ["chunk", "ot", 2], ["offset", "ot", 8], ["offsetCS", "ot", 8], ["vec", "ot", 1], ["wmma_m", "ot", 16]]}, "result": [[9.661082200247219e-06], 0, 1.5926802158355713, 1651928983.2557428], "version": 0.2, "tvm_version": "0.8.0"}
{"input": ["cuda -keys=cuda,gpu -max_num_threads=1024 -thread_warp_size=32", "attn_v_pad_matmul.cuda", [["TENSOR", [64, 49, 49], "float16"], ["TENSOR", [64, 32, 49], "float16"]], {}], "config": {"index": 5946, "code_hash": null, "entity": [["block_row_warps", "ot", 1], ["block_col_warps", "ot", 4], ["warp_row_tiles", "ot", 1], ["warp_col_tiles", "ot", 2], ["chunk", "ot", 2], ["offset", "ot", 0], ["offsetCS", "ot", 8], ["vec", "ot", 1], ["wmma_m", "ot", 16]]}, "result": [[1.0004963e-05], 0, 1.1828646659851074, 1651928983.7959476], "version": 0.2, "tvm_version": "0.8.0"}
{"input": ["cuda -keys=cuda,gpu -max_num_threads=1024 -thread_warp_size=32", "attn_v_pad_matmul.cuda", [["TENSOR", [64, 49, 49], "float16"], ["TENSOR", [64, 32, 49], "float16"]], {}], "config": {"index": 11353, "code_hash": null, "entity": [["block_row_warps", "ot", 2], ["block_col_warps", "ot", 2], ["warp_row_tiles", "ot", 2], ["warp_col_tiles", "ot", 1], ["chunk", "ot", 1], ["offset", "ot", 8], ["offsetCS", "ot", 8], ["vec", "ot", 1], ["wmma_m", "ot", 8]]}, "result": [[1.2312429e-05], 0, 1.1713318824768066, 1651928984.335995], "version": 0.2, "tvm_version": "0.8.0"}
{"input": ["cuda -keys=cuda,gpu -max_num_threads=1024 -thread_warp_size=32", "attn_v_pad_matmul.cuda", [["TENSOR", [64, 49, 49], "float16"], ["TENSOR", [64, 32, 49], "float16"]], {}], "config": {"index": 11110, "code_hash": null, "entity": [["block_row_warps", "ot", 2], ["block_col_warps", "ot", 2], ["warp_row_tiles", "ot", 2], ["warp_col_tiles", "ot", 1], ["chunk", "ot", 2], ["offset", "ot", 0], ["offsetCS", "ot", 8], ["vec", "ot", 1], ["wmma_m", "ot", 8]]}, "result": [[1.1427119e-05], 0, 1.222322702407837, 1651928984.810172], "version": 0.2, "tvm_version": "0.8.0"}
{"input": ["cuda -keys=cuda,gpu -max_num_threads=1024 -thread_warp_size=32", "attn_v_pad_matmul.cuda", [["TENSOR", [64, 49, 49], "float16"], ["TENSOR", [64, 32, 49], "float16"]], {}], "config": {"index": 11434, "code_hash": null, "entity": [["block_row_warps", "ot", 2], ["block_col_warps", "ot", 2], ["warp_row_tiles", "ot", 2], ["warp_col_tiles", "ot", 1], ["chunk", "ot", 2], ["offset", "ot", 8], ["offsetCS", "ot", 8], ["vec", "ot", 1], ["wmma_m", "ot", 8]]}, "result": [[8.87602410383189e-06], 0, 1.4633440971374512, 1651928985.5347745], "version": 0.2, "tvm_version": "0.8.0"}
{"input": ["cuda -keys=cuda,gpu -max_num_threads=1024 -thread_warp_size=32", "attn_v_pad_matmul.cuda", [["TENSOR", [64, 49, 49], "float16"], ["TENSOR", [64, 32, 49], "float16"]], {}], "config": {"index": 11031, "code_hash": null, "entity": [["block_row_warps", "ot", 1], ["block_col_warps", "ot", 4], ["warp_row_tiles", "ot", 2], ["warp_col_tiles", "ot", 1], ["chunk", "ot", 1], ["offset", "ot", 0], ["offsetCS", "ot", 8], ["vec", "ot", 1], ["wmma_m", "ot", 8]]}, "result": [[8.896345488257107e-06], 0, 1.2550806999206543, 1651928986.1789808], "version": 0.2, "tvm_version": "0.8.0"}
{"input": ["cuda -keys=cuda,gpu -max_num_threads=1024 -thread_warp_size=32", "attn_v_pad_matmul.cuda", [["TENSOR", [64, 49, 49], "float16"], ["TENSOR", [64, 32, 49], "float16"]], {}], "config": {"index": 5944, "code_hash": null, "entity": [["block_row_warps", "ot", 2], ["block_col_warps", "ot", 2], ["warp_row_tiles", "ot", 1], ["warp_col_tiles", "ot", 2], ["chunk", "ot", 2], ["offset", "ot", 0], ["offsetCS", "ot", 8], ["vec", "ot", 1], ["wmma_m", "ot", 16]]}, "result": [[1.1646946e-05], 0, 1.366469383239746, 1651928986.7908113], "version": 0.2, "tvm_version": "0.8.0"}
{"input": ["cuda -keys=cuda,gpu -max_num_threads=1024 -thread_warp_size=32", "attn_v_pad_matmul.cuda", [["TENSOR", [64, 49, 49], "float16"], ["TENSOR", [64, 32, 49], "float16"]], {}], "config": {"index": 11029, "code_hash": null, "entity": [["block_row_warps", "ot", 2], ["block_col_warps", "ot", 2], ["warp_row_tiles", "ot", 2], ["warp_col_tiles", "ot", 1], ["chunk", "ot", 1], ["offset", "ot", 0], ["offsetCS", "ot", 8], ["vec", "ot", 1], ["wmma_m", "ot", 8]]}, "result": [[9.382668108776267e-06], 0, 1.2416439056396484, 1651928987.3091779], "version": 0.2, "tvm_version": "0.8.0"}
{"input": ["cuda -keys=cuda,gpu -max_num_threads=1024 -thread_warp_size=32", "attn_v_pad_matmul.cuda", [["TENSOR", [64, 49, 49], "float16"], ["TENSOR", [64, 32, 49], "float16"]], {}], "config": {"index": 2325, "code_hash": null, "entity": [["block_row_warps", "ot", 1], ["block_col_warps", "ot", 2], ["warp_row_tiles", "ot", 1], ["warp_col_tiles", "ot", 4], ["chunk", "ot", 1], ["offset", "ot", 8], ["offsetCS", "ot", 8], ["vec", "ot", 2], ["wmma_m", "ot", 32]]}, "result": [[9.576522249690977e-06], 0, 1.1873674392700195, 1651928987.8983927], "version": 0.2, "tvm_version": "0.8.0"}
{"input": ["cuda -keys=cuda,gpu -max_num_threads=1024 -thread_warp_size=32", "attn_v_pad_matmul.cuda", [["TENSOR", [64, 49, 49], "float16"], ["TENSOR", [64, 32, 49], "float16"]], {}], "config": {"index": 2406, "code_hash": null, "entity": [["block_row_warps", "ot", 1], ["block_col_warps", "ot", 2], ["warp_row_tiles", "ot", 1], ["warp_col_tiles", "ot", 4], ["chunk", "ot", 2], ["offset", "ot", 8], ["offsetCS", "ot", 8], ["vec", "ot", 2], ["wmma_m", "ot", 32]]}, "result": [[8.592809023485786e-06], 0, 1.2221767902374268, 1651928988.426397], "version": 0.2, "tvm_version": "0.8.0"}
{"input": ["cuda -keys=cuda,gpu -max_num_threads=1024 -thread_warp_size=32", "attn_v_pad_matmul.cuda", [["TENSOR", [64, 49, 49], "float16"], ["TENSOR", [64, 32, 49], "float16"]], {}], "config": {"index": 7248, "code_hash": null, "entity": [["block_row_warps", "ot", 1], ["block_col_warps", "ot", 2], ["warp_row_tiles", "ot", 2], ["warp_col_tiles", "ot", 2], ["chunk", "ot", 2], ["offset", "ot", 0], ["offsetCS", "ot", 8], ["vec", "ot", 2], ["wmma_m", "ot", 16]]}, "result": [[8.275695302843016e-06], 0, 1.3783938884735107, 1651928989.1033845], "version": 0.2, "tvm_version": "0.8.0"}
{"input": ["cuda -keys=cuda,gpu -max_num_threads=1024 -thread_warp_size=32", "attn_v_pad_matmul.cuda", [["TENSOR", [64, 49, 49], "float16"], ["TENSOR", [64, 32, 49], "float16"]], {}], "config": {"index": 6843, "code_hash": null, "entity": [["block_row_warps", "ot", 1], ["block_col_warps", "ot", 2], ["warp_row_tiles", "ot", 2], ["warp_col_tiles", "ot", 2], ["chunk", "ot", 1], ["offset", "ot", 8], ["offsetCS", "ot", 0], ["vec", "ot", 2], ["wmma_m", "ot", 16]]}, "result": [[9.866533992583436e-06], 0, 1.2566585540771484, 1651928989.657827], "version": 0.2, "tvm_version": "0.8.0"}
{"input": ["cuda -keys=cuda,gpu -max_num_threads=1024 -thread_warp_size=32", "attn_v_pad_matmul.cuda", [["TENSOR", [64, 49, 49], "float16"], ["TENSOR", [64, 32, 49], "float16"]], {}], "config": {"index": 6519, "code_hash": null, "entity": [["block_row_warps", "ot", 1], ["block_col_warps", "ot", 2], ["warp_row_tiles", "ot", 2], ["warp_col_tiles", "ot", 2], ["chunk", "ot", 1], ["offset", "ot", 0], ["offsetCS", "ot", 0], ["vec", "ot", 2], ["wmma_m", "ot", 16]]}, "result": [[9.837731767614339e-06], 0, 1.2260923385620117, 1651928990.2808435], "version": 0.2, "tvm_version": "0.8.0"}
{"input": ["cuda -keys=cuda,gpu -max_num_threads=1024 -thread_warp_size=32", "attn_v_pad_matmul.cuda", [["TENSOR", [64, 49, 49], "float16"], ["TENSOR", [64, 32, 49], "float16"]], {}], "config": {"index": 7491, "code_hash": null, "entity": [["block_row_warps", "ot", 1], ["block_col_warps", "ot", 2], ["warp_row_tiles", "ot", 2], ["warp_col_tiles", "ot", 2], ["chunk", "ot", 1], ["offset", "ot", 8], ["offsetCS", "ot", 8], ["vec", "ot", 2], ["wmma_m", "ot", 16]]}, "result": [[9.1824956736712e-06], 0, 1.1950783729553223, 1651928990.7090898], "version": 0.2, "tvm_version": "0.8.0"}
{"input": ["cuda -keys=cuda,gpu -max_num_threads=1024 -thread_warp_size=32", "attn_v_pad_matmul.cuda", [["TENSOR", [64, 49, 49], "float16"], ["TENSOR", [64, 32, 49], "float16"]], {}], "config": {"index": 7572, "code_hash": null, "entity": [["block_row_warps", "ot", 1], ["block_col_warps", "ot", 2], ["warp_row_tiles", "ot", 2], ["warp_col_tiles", "ot", 2], ["chunk", "ot", 2], ["offset", "ot", 8], ["offsetCS", "ot", 8], ["vec", "ot", 2], ["wmma_m", "ot", 16]]}, "result": [[7.416442521631644e-06], 0, 1.455815315246582, 1651928991.3943732], "version": 0.2, "tvm_version": "0.8.0"}
{"input": ["cuda -keys=cuda,gpu -max_num_threads=1024 -thread_warp_size=32", "attn_v_pad_matmul.cuda", [["TENSOR", [64, 49, 49], "float16"], ["TENSOR", [64, 32, 49], "float16"]], {}], "config": {"index": 11766, "code_hash": null, "entity": [["block_row_warps", "ot", 1], ["block_col_warps", "ot", 2], ["warp_row_tiles", "ot", 4], ["warp_col_tiles", "ot", 1], ["chunk", "ot", 2], ["offset", "ot", 0], ["offsetCS", "ot", 0], ["vec", "ot", 2], ["wmma_m", "ot", 8]]}, "result": [[9.585737948084054e-06], 0, 1.3042399883270264, 1651928992.0311167], "version": 0.2, "tvm_version": "0.8.0"}
{"input": ["cuda -keys=cuda,gpu -max_num_threads=1024 -thread_warp_size=32", "attn_v_pad_matmul.cuda", [["TENSOR", [64, 49, 49], "float16"], ["TENSOR", [64, 32, 49], "float16"]], {}], "config": {"index": 12414, "code_hash": null, "entity": [["block_row_warps", "ot", 1], ["block_col_warps", "ot", 2], ["warp_row_tiles", "ot", 4], ["warp_col_tiles", "ot", 1], ["chunk", "ot", 2], ["offset", "ot", 0], ["offsetCS", "ot", 8], ["vec", "ot", 2], ["wmma_m", "ot", 8]]}, "result": [[9.182817676143387e-06], 0, 1.2788925170898438, 1651928992.5788455], "version": 0.2, "tvm_version": "0.8.0"}
