python/models/swin_transformer/kernel_configs/swin_transform_auto_tvm_tune_fused_layer_norm_matmul_tensorcore_gelu_1_16_16_512_2048.log
{"input": ["cuda -keys=cuda,gpu -max_num_threads=1024 -thread_warp_size=32", "fused_layer_norm_matmul_tensorcore_gelu.cuda", [["TENSOR", [256, 512], "float16"], ["TENSOR", [256], "float16"], ["TENSOR", [256], "float16"], ["TENSOR", [2048, 512], "float16"], 0.001953125], {}], "config": {"index": 1620, "code_hash": null, "entity": [["block_row_warps", "ot", 1], ["block_col_warps", "ot", 1], ["warp_row_tiles", "ot", 1], ["warp_col_tiles", "ot", 1], ["chunk", "ot", 1], ["offset", "ot", 8], ["offsetCS", "ot", 0], ["vec", "ot", 2], ["wmma_m", "ot", 32]]}, "result": [[0.00012551711400000002], 0, 1.2988266944885254, 1651808923.2636595], "version": 0.2, "tvm_version": "0.8.0"}
{"input": ["cuda -keys=cuda,gpu -max_num_threads=1024 -thread_warp_size=32", "fused_layer_norm_matmul_tensorcore_gelu.cuda", [["TENSOR", [256, 512], "float16"], ["TENSOR", [256], "float16"], ["TENSOR", [256], "float16"], ["TENSOR", [2048, 512], "float16"], 0.001953125], {}], "config": {"index": 6331, "code_hash": null, "entity": [["block_row_warps", "ot", 2], ["block_col_warps", "ot", 2], ["warp_row_tiles", "ot", 2], ["warp_col_tiles", "ot", 1], ["chunk", "ot", 4], ["offset", "ot", 8], ["offsetCS", "ot", 8], ["vec", "ot", 1], ["wmma_m", "ot", 16]]}, "result": [[7.4029158e-05], 0, 1.3167054653167725, 1651808924.5235384], "version": 0.2, "tvm_version": "0.8.0"}
{"input": ["cuda -keys=cuda,gpu -max_num_threads=1024 -thread_warp_size=32", "fused_layer_norm_matmul_tensorcore_gelu.cuda", [["TENSOR", [256, 512], "float16"], ["TENSOR", [256], "float16"], ["TENSOR", [256], "float16"], ["TENSOR", [2048, 512], "float16"], 0.001953125], {}], "config": {"index": 2025, "code_hash": null, "entity": [["block_row_warps", "ot", 1], ["block_col_warps", "ot", 1], ["warp_row_tiles", "ot", 1], ["warp_col_tiles", "ot", 1], ["chunk", "ot", 2], ["offset", "ot", 0], ["offsetCS", "ot", 8], ["vec", "ot", 2], ["wmma_m", "ot", 32]]}, "result": [[9.9202479e-05], 0, 1.2298543453216553, 1651808925.2763894], "version": 0.2, "tvm_version": "0.8.0"}
{"input": ["cuda -keys=cuda,gpu -max_num_threads=1024 -thread_warp_size=32", "fused_layer_norm_matmul_tensorcore_gelu.cuda", [["TENSOR", [256, 512], "float16"], ["TENSOR", [256], "float16"], ["TENSOR", [256], "float16"], ["TENSOR", [2048, 512], "float16"], 0.001953125], {}], "config": {"index": 2896, "code_hash": null, "entity": [["block_row_warps", "ot", 2], ["block_col_warps", "ot", 4], ["warp_row_tiles", "ot", 1], ["warp_col_tiles", "ot", 4], ["chunk", "ot", 8], ["offset", "ot", 0], ["offsetCS", "ot", 0], ["vec", "ot", 4], ["wmma_m", "ot", 32]]}, "result": [[5.2210859e-05], 0, 1.2947845458984375, 1651808927.1392553], "version": 0.2, "tvm_version": "0.8.0"}
{"input": ["cuda -keys=cuda,gpu -max_num_threads=1024 -thread_warp_size=32", "fused_layer_norm_matmul_tensorcore_gelu.cuda", [["TENSOR", [256, 512], "float16"], ["TENSOR", [256], "float16"], ["TENSOR", [256], "float16"], ["TENSOR", [2048, 512], "float16"], 0.001953125], {}], "config": {"index": 12656, "code_hash": null, "entity": [["block_row_warps", "ot", 4], ["block_col_warps", "ot", 1], ["warp_row_tiles", "ot", 4], ["warp_col_tiles", "ot", 1], ["chunk", "ot", 1], ["offset", "ot", 8], ["offsetCS", "ot", 8], ["vec", "ot", 2], ["wmma_m", "ot", 8]]}, "result": [[9.825363e-05], 0, 1.2016088962554932, 1651808929.0982866], "version": 0.2, "tvm_version": "0.8.0"}
{"input": ["cuda -keys=cuda,gpu -max_num_threads=1024 -thread_warp_size=32", "fused_layer_norm_matmul_tensorcore_gelu.cuda", [["TENSOR", [256, 512], "float16"], ["TENSOR", [256], "float16"], ["TENSOR", [256], "float16"], ["TENSOR", [2048, 512], "float16"], 0.001953125], {}], "config": {"index": 10410, "code_hash": null, "entity": [["block_row_warps", "ot", 1], ["block_col_warps", "ot", 4], ["warp_row_tiles", "ot", 2], ["warp_col_tiles", "ot", 2], ["chunk", "ot", 1], ["offset", "ot", 0], ["offsetCS", "ot", 0], ["vec", "ot", 1], ["wmma_m", "ot", 8]]}, "result": [[6.3112953e-05], 0, 1.1026549339294434, 1651808930.3464122], "version": 0.2, "tvm_version": "0.8.0"}
{"input": ["cuda -keys=cuda,gpu -max_num_threads=1024 -thread_warp_size=32", "fused_layer_norm_matmul_tensorcore_gelu.cuda", [["TENSOR", [256, 512], "float16"], ["TENSOR", [256], "float16"], ["TENSOR", [256], "float16"], ["TENSOR", [2048, 512], "float16"], 0.001953125], {}], "config": {"index": 1436, "code_hash": null, "entity": [["block_row_warps", "ot", 4], ["block_col_warps", "ot", 2], ["warp_row_tiles", "ot", 1], ["warp_col_tiles", "ot", 4], ["chunk", "ot", 2], ["offset", "ot", 0], ["offsetCS", "ot", 0], ["vec", "ot", 2], ["wmma_m", "ot", 32]]}, "result": [[6.6413166e-05], 0, 1.1447598934173584, 1651808931.5981336], "version": 0.2, "tvm_version": "0.8.0"}
{"input": ["cuda -keys=cuda,gpu -max_num_threads=1024 -thread_warp_size=32", "fused_layer_norm_matmul_tensorcore_gelu.cuda", [["TENSOR", [256, 512], "float16"], ["TENSOR", [256], "float16"], ["TENSOR", [256], "float16"], ["TENSOR", [2048, 512], "float16"], 0.001953125], {}], "config": {"index": 14096, "code_hash": null, "entity": [["block_row_warps", "ot", 4], ["block_col_warps", "ot", 1], ["warp_row_tiles", "ot", 1], ["warp_col_tiles", "ot", 1], ["chunk", "ot", 4], ["offset", "ot", 8], ["offsetCS", "ot", 8], ["vec", "ot", 4], ["wmma_m", "ot", 8]]}, "result": [[2.8221323000000003e-05], 0, 1.09867262840271, 1651808932.2187233], "version": 0.2, "tvm_version": "0.8.0"}
{"input": ["cuda -keys=cuda,gpu -max_num_threads=1024 -thread_warp_size=32", "fused_layer_norm_matmul_tensorcore_gelu.cuda", [["TENSOR", [256, 512], "float16"], ["TENSOR", [256], "float16"], ["TENSOR", [256], "float16"], ["TENSOR", [2048, 512], "float16"], 0.001953125], {}], "config": {"index": 13316, "code_hash": null, "entity": [["block_row_warps", "ot", 4], ["block_col_warps", "ot", 2], ["warp_row_tiles", "ot", 1], ["warp_col_tiles", "ot", 2], ["chunk", "ot", 1], ["offset", "ot", 8], ["offsetCS", "ot", 0], ["vec", "ot", 4], ["wmma_m", "ot", 8]]}, "result": [[7.8954388e-05], 0, 1.1539762020111084, 1651808934.0525563], "version": 0.2, "tvm_version": "0.8.0"}
{"input": ["cuda -keys=cuda,gpu -max_num_threads=1024 -thread_warp_size=32", "fused_layer_norm_matmul_tensorcore_gelu.cuda", [["TENSOR", [256, 512], "float16"], ["TENSOR", [256], "float16"], ["TENSOR", [256], "float16"], ["TENSOR", [2048, 512], "float16"], 0.001953125], {}], "config": {"index": 6790, "code_hash": null, "entity": [["block_row_warps", "ot", 2], ["block_col_warps", "ot", 2], ["warp_row_tiles", "ot", 2], ["warp_col_tiles", "ot", 4], ["chunk", "ot", 8], ["offset", "ot", 0], ["offsetCS", "ot", 0], ["vec", "ot", 2], ["wmma_m", "ot", 16]]}, "result": [[7.712956499999999e-05], 0, 1.4011142253875732, 1651808934.8324935], "version": 0.2, "tvm_version": "0.8.0"}
{"input": ["cuda -keys=cuda,gpu -max_num_threads=1024 -thread_warp_size=32", "fused_layer_norm_matmul_tensorcore_gelu.cuda", [["TENSOR", [256, 512], "float16"], ["TENSOR", [256], "float16"], ["TENSOR", [256], "float16"], ["TENSOR", [2048, 512], "float16"], 0.001953125], {}], "config": {"index": 3712, "code_hash": null, "entity": [["block_row_warps", "ot", 2], ["block_col_warps", "ot", 2], ["warp_row_tiles", "ot", 2], ["warp_col_tiles", "ot", 4], ["chunk", "ot", 2], ["offset", "ot", 8], ["offsetCS", "ot", 8], ["vec", "ot", 4], ["wmma_m", "ot", 32]]}, "result": [[9.926587000000001e-05], 0, 1.5863213539123535, 1651821029.6156907], "version": 0.2, "tvm_version": "0.8.0"}
{"input": ["cuda -keys=cuda,gpu -max_num_threads=1024 -thread_warp_size=32", "fused_layer_norm_matmul_tensorcore_gelu.cuda", [["TENSOR", [256, 512], "float16"], ["TENSOR", [256], "float16"], ["TENSOR", [256], "float16"], ["TENSOR", [2048, 512], "float16"], 0.001953125], {}], "config": {"index": 146, "code_hash": null, "entity": [["block_row_warps", "ot", 4], ["block_col_warps", "ot", 1], ["warp_row_tiles", "ot", 2], ["warp_col_tiles", "ot", 4], ["chunk", "ot", 2], ["offset", "ot", 0], ["offsetCS", "ot", 0], ["vec", "ot", 1], ["wmma_m", "ot", 32]]}, "result": [[0.00027023461700000003], 0, 2.0626978874206543, 1651821031.5019293], "version": 0.2, "tvm_version": "0.8.0"}
{"input": ["cuda -keys=cuda,gpu -max_num_threads=1024 -thread_warp_size=32", "fused_layer_norm_matmul_tensorcore_gelu.cuda", [["TENSOR", [256, 512], "float16"], ["TENSOR", [256], "float16"], ["TENSOR", [256], "float16"], ["TENSOR", [2048, 512], "float16"], 0.001953125], {}], "config": {"index": 7215, "code_hash": null, "entity": [["block_row_warps", "ot", 1], ["block_col_warps", "ot", 4], ["warp_row_tiles", "ot", 1], ["warp_col_tiles", "ot", 1], ["chunk", "ot", 2], ["offset", "ot", 0], ["offsetCS", "ot", 8], ["vec", "ot", 2], ["wmma_m", "ot", 16]]}, "result": [[6.0695306999999994e-05], 0, 1.27880859375, 1651821033.9457517], "version": 0.2, "tvm_version": "0.8.0"}
{"input": ["cuda -keys=cuda,gpu -max_num_threads=1024 -thread_warp_size=32", "fused_layer_norm_matmul_tensorcore_gelu.cuda", [["TENSOR", [256, 512], "float16"], ["TENSOR", [256], "float16"], ["TENSOR", [256], "float16"], ["TENSOR", [2048, 512], "float16"], 0.001953125], {}], "config": {"index": 12363, "code_hash": null, "entity": [["block_row_warps", "ot", 1], ["block_col_warps", "ot", 4], ["warp_row_tiles", "ot", 4], ["warp_col_tiles", "ot", 2], ["chunk", "ot", 1], ["offset", "ot", 0], ["offsetCS", "ot", 8], ["vec", "ot", 2], ["wmma_m", "ot", 8]]}, "result": [[7.737388199999999e-05], 0, 1.4425888061523438, 1651821036.438574], "version": 0.2, "tvm_version": "0.8.0"}
{"input": ["cuda -keys=cuda,gpu -max_num_threads=1024 -thread_warp_size=32", "fused_layer_norm_matmul_tensorcore_gelu.cuda", [["TENSOR", [256, 512], "float16"], ["TENSOR", [256], "float16"], ["TENSOR", [256], "float16"], ["TENSOR", [2048, 512], "float16"], 0.001953125], {}], "config": {"index": 13243, "code_hash": null, "entity": [["block_row_warps", "ot", 2], ["block_col_warps", "ot", 2], ["warp_row_tiles", "ot", 2], ["warp_col_tiles", "ot", 2], ["chunk", "ot", 8], ["offset", "ot", 0], ["offsetCS", "ot", 0], ["vec", "ot", 4], ["wmma_m", "ot", 8]]}, "result": [[5.5353045999999996e-05], 0, 1.728471040725708, 1651821037.2311816], "version": 0.2, "tvm_version": "0.8.0"}
{"input": ["cuda -keys=cuda,gpu -max_num_threads=1024 -thread_warp_size=32", "fused_layer_norm_matmul_tensorcore_gelu.cuda", [["TENSOR", [256, 512], "float16"], ["TENSOR", [256], "float16"], ["TENSOR", [256], "float16"], ["TENSOR", [2048, 512], "float16"], 0.001953125], {}], "config": {"index": 12457, "code_hash": null, "entity": [["block_row_warps", "ot", 2], ["block_col_warps", "ot", 1], ["warp_row_tiles", "ot", 2], ["warp_col_tiles", "ot", 4], ["chunk", "ot", 2], ["offset", "ot", 0], ["offsetCS", "ot", 8], ["vec", "ot", 2], ["wmma_m", "ot", 8]]}, "result": [[7.800486800000001e-05], 0, 1.549903392791748, 1651821037.9771774], "version": 0.2, "tvm_version": "0.8.0"}
{"input": ["cuda -keys=cuda,gpu -max_num_threads=1024 -thread_warp_size=32", "fused_layer_norm_matmul_tensorcore_gelu.cuda", [["TENSOR", [256, 512], "float16"], ["TENSOR", [256], "float16"], ["TENSOR", [256], "float16"], ["TENSOR", [2048, 512], "float16"], 0.001953125], {}], "config": {"index": 13987, "code_hash": null, "entity": [["block_row_warps", "ot", 2], ["block_col_warps", "ot", 1], ["warp_row_tiles", "ot", 1], ["warp_col_tiles", "ot", 4], ["chunk", "ot", 1], ["offset", "ot", 8], ["offsetCS", "ot", 8], ["vec", "ot", 4], ["wmma_m", "ot", 8]]}, "result": [[4.6823961e-05], 0, 1.2777743339538574, 1651821038.590462], "version": 0.2, "tvm_version": "0.8.0"}
{"input": ["cuda -keys=cuda,gpu -max_num_threads=1024 -thread_warp_size=32", "fused_layer_norm_matmul_tensorcore_gelu.cuda", [["TENSOR", [256, 512], "float16"], ["TENSOR", [256], "float16"], ["TENSOR", [256], "float16"], ["TENSOR", [2048, 512], "float16"], 0.001953125], {}], "config": {"index": 3487, "code_hash": null, "entity": [["block_row_warps", "ot", 2], ["block_col_warps", "ot", 2], ["warp_row_tiles", "ot", 1], ["warp_col_tiles", "ot", 1], ["chunk", "ot", 8], ["offset", "ot", 0], ["offsetCS", "ot", 8], ["vec", "ot", 4], ["wmma_m", "ot", 32]]}, "result": [[7.0784653e-05], 0, 1.3978495597839355, 1651821039.9130359], "version": 0.2, "tvm_version": "0.8.0"}
{"input": ["cuda -keys=cuda,gpu -max_num_threads=1024 -thread_warp_size=32", "fused_layer_norm_matmul_tensorcore_gelu.cuda", [["TENSOR", [256, 512], "float16"], ["TENSOR", [256], "float16"], ["TENSOR", [256], "float16"], ["TENSOR", [2048, 512], "float16"], 0.001953125], {}], "config": {"index": 14094, "code_hash": null, "entity": [["block_row_warps", "ot", 1], ["block_col_warps", "ot", 1], ["warp_row_tiles", "ot", 1], ["warp_col_tiles", "ot", 1], ["chunk", "ot", 4], ["offset", "ot", 8], ["offsetCS", "ot", 8], ["vec", "ot", 4], ["wmma_m", "ot", 8]]}, "result": [[3.1209499000000004e-05], 0, 1.1524384021759033, 1651821040.4936438], "version": 0.2, "tvm_version": "0.8.0"}
{"input": ["cuda -keys=cuda,gpu -max_num_threads=1024 -thread_warp_size=32", "fused_layer_norm_matmul_tensorcore_gelu.cuda", [["TENSOR", [256, 512], "float16"], ["TENSOR", [256], "float16"], ["TENSOR", [256], "float16"], ["TENSOR", [2048, 512], "float16"], 0.001953125], {}], "config": {"index": 8679, "code_hash": null, "entity": [["block_row_warps", "ot", 1], ["block_col_warps", "ot", 2], ["warp_row_tiles", "ot", 2], ["warp_col_tiles", "ot", 1], ["chunk", "ot", 8], ["offset", "ot", 0], ["offsetCS", "ot", 8], ["vec", "ot", 4], ["wmma_m", "ot", 16]]}, "result": [[5.5496442e-05], 0, 1.3393301963806152, 1651821041.7475383], "version": 0.2, "tvm_version": "0.8.0"}
{"input": ["cuda -keys=cuda,gpu -max_num_threads=1024 -thread_warp_size=32", "fused_layer_norm_matmul_tensorcore_gelu.cuda", [["TENSOR", [256, 512], "float16"], ["TENSOR", [256], "float16"], ["TENSOR", [256], "float16"], ["TENSOR", [2048, 512], "float16"], 0.001953125], {}], "config": {"index": 12080, "code_hash": null, "entity": [["block_row_warps", "ot", 4], ["block_col_warps", "ot", 1], ["warp_row_tiles", "ot", 2], ["warp_col_tiles", "ot", 1], ["chunk", "ot", 2], ["offset", "ot", 8], ["offsetCS", "ot", 0], ["vec", "ot", 2], ["wmma_m", "ot", 8]]}, "result": [[5.2328339e-05], 0, 1.3207118511199951, 1651821042.9820642], "version": 0.2, "tvm_version": "0.8.0"}
{"input": ["cuda -keys=cuda,gpu -max_num_threads=1024 -thread_warp_size=32", "fused_layer_norm_matmul_tensorcore_gelu.cuda", [["TENSOR", [256, 512], "float16"], ["TENSOR", [256], "float16"], ["TENSOR", [256], "float16"], ["TENSOR", [2048, 512], "float16"], 0.001953125], {}], "config": {"index": 5924, "code_hash": null, "entity": [["block_row_warps", "ot", 4], ["block_col_warps", "ot", 1], ["warp_row_tiles", "ot", 2], ["warp_col_tiles", "ot", 1], ["chunk", "ot", 2], ["offset", "ot", 0], ["offsetCS", "ot", 8], ["vec", "ot", 1], ["wmma_m", "ot", 16]]}, "result": [[0.00014049399399999998], 0, 1.5644466876983643, 1651821043.858764], "version": 0.2, "tvm_version": "0.8.0"}
{"input": ["cuda -keys=cuda,gpu -max_num_threads=1024 -thread_warp_size=32", "fused_layer_norm_matmul_tensorcore_gelu.cuda", [["TENSOR", [256, 512], "float16"], ["TENSOR", [256], "float16"], ["TENSOR", [256], "float16"], ["TENSOR", [2048, 512], "float16"], 0.001953125], {}], "config": {"index": 527, "code_hash": null, "entity": [["block_row_warps", "ot", 4], ["block_col_warps", "ot", 2], ["warp_row_tiles", "ot", 2], ["warp_col_tiles", "ot", 2], ["chunk", "ot", 4], ["offset", "ot", 8], ["offsetCS", "ot", 0], ["vec", "ot", 1], ["wmma_m", "ot", 32]]}, "result": [[0.00013583778699999998], 0, 1.647862195968628, 1651821045.3199494], "version": 0.2, "tvm_version": "0.8.0"}
{"input": ["cuda -keys=cuda,gpu -max_num_threads=1024 -thread_warp_size=32", "fused_layer_norm_matmul_tensorcore_gelu.cuda", [["TENSOR", [256, 512], "float16"], ["TENSOR", [256], "float16"], ["TENSOR", [256], "float16"], ["TENSOR", [2048, 512], "float16"], 0.001953125], {}], "config": {"index": 7275, "code_hash": null, "entity": [["block_row_warps", "ot", 1], ["block_col_warps", "ot", 2], ["warp_row_tiles", "ot", 2], ["warp_col_tiles", "ot", 4], ["chunk", "ot", 2], ["offset", "ot", 0], ["offsetCS", "ot", 8], ["vec", "ot", 2], ["wmma_m", "ot", 16]]}, "result": [[7.647692e-05], 0, 1.4585425853729248, 1651821046.0934076], "version": 0.2, "tvm_version": "0.8.0"}
{"input": ["cuda -keys=cuda,gpu -max_num_threads=1024 -thread_warp_size=32", "fused_layer_norm_matmul_tensorcore_gelu.cuda", [["TENSOR", [256, 512], "float16"], ["TENSOR", [256], "float16"], ["TENSOR", [256], "float16"], ["TENSOR", [2048, 512], "float16"], 0.001953125], {}], "config": {"index": 13944, "code_hash": null, "entity": [["block_row_warps", "ot", 1], ["block_col_warps", "ot", 2], ["warp_row_tiles", "ot", 2], ["warp_col_tiles", "ot", 1], ["chunk", "ot", 1], ["offset", "ot", 8], ["offsetCS", "ot", 8], ["vec", "ot", 4], ["wmma_m", "ot", 8]]}, "result": [[3.3821141e-05], 0, 1.2169756889343262, 1651821047.2456448], "version": 0.2, "tvm_version": "0.8.0"}
{"input": ["cuda -keys=cuda,gpu -max_num_threads=1024 -thread_warp_size=32", "fused_layer_norm_matmul_tensorcore_gelu.cuda", [["TENSOR", [256, 512], "float16"], ["TENSOR", [256], "float16"], ["TENSOR", [256], "float16"], ["TENSOR", [2048, 512], "float16"], 0.001953125], {}], "config": {"index": 12142, "code_hash": null, "entity": [["block_row_warps", "ot", 2], ["block_col_warps", "ot", 1], ["warp_row_tiles", "ot", 4], ["warp_col_tiles", "ot", 4], ["chunk", "ot", 2], ["offset", "ot", 8], ["offsetCS", "ot", 0], ["vec", "ot", 2], ["wmma_m", "ot", 8]]}, "result": [[0.00012353456900000002], 0, 1.5794525146484375, 1651821048.1409585], "version": 0.2, "tvm_version": "0.8.0"}
{"input": ["cuda -keys=cuda,gpu -max_num_threads=1024 -thread_warp_size=32", "fused_layer_norm_matmul_tensorcore_gelu.cuda", [["TENSOR", [256, 512], "float16"], ["TENSOR", [256], "float16"], ["TENSOR", [256], "float16"], ["TENSOR", [2048, 512], "float16"], 0.001953125], {}], "config": {"index": 980, "code_hash": null, "entity": [["block_row_warps", "ot", 4], ["block_col_warps", "ot", 4], ["warp_row_tiles", "ot", 1], ["warp_col_tiles", "ot", 1], ["chunk", "ot", 1], ["offset", "ot", 8], ["offsetCS", "ot", 8], ["vec", "ot", 1], ["wmma_m", "ot", 32]]}, "result": [[5.3637458e-05], 0, 1.102362871170044, 1651821049.3394682], "version": 0.2, "tvm_version": "0.8.0"}
{"input": ["cuda -keys=cuda,gpu -max_num_threads=1024 -thread_warp_size=32", "fused_layer_norm_matmul_tensorcore_gelu.cuda", [["TENSOR", [256, 512], "float16"], ["TENSOR", [256], "float16"], ["TENSOR", [256], "float16"], ["TENSOR", [2048, 512], "float16"], 0.001953125], {}], "config": {"index": 2643, "code_hash": null, "entity": [["block_row_warps", "ot", 1], ["block_col_warps", "ot", 4], ["warp_row_tiles", "ot", 4], ["warp_col_tiles", "ot", 2], ["chunk", "ot", 1], ["offset", "ot", 0], ["offsetCS", "ot", 0], ["vec", "ot", 4], ["wmma_m", "ot", 32]]}, "result": [[8.9027744e-05], 0, 1.3130056858062744, 1651821050.7048519], "version": 0.2, "tvm_version": "0.8.0"}
{"input": ["cuda -keys=cuda,gpu -max_num_threads=1024 -thread_warp_size=32", "fused_layer_norm_matmul_tensorcore_gelu.cuda", [["TENSOR", [256, 512], "float16"], ["TENSOR", [256], "float16"], ["TENSOR", [256], "float16"], ["TENSOR", [2048, 512], "float16"], 0.001953125], {}], "config": {"index": 6715, "code_hash": null, "entity": [["block_row_warps", "ot", 2], ["block_col_warps", "ot", 1], ["warp_row_tiles", "ot", 4], ["warp_col_tiles", "ot", 4], ["chunk", "ot", 4], ["offset", "ot", 0], ["offsetCS", "ot", 0], ["vec", "ot", 2], ["wmma_m", "ot", 16]]}, "result": [[0.00019596044100000001], 0, 1.7329366207122803, 1651821051.8179514], "version": 0.2, "tvm_version": "0.8.0"}
{"input": ["cuda -keys=cuda,gpu -max_num_threads=1024 -thread_warp_size=32", "fused_layer_norm_matmul_tensorcore_gelu.cuda", [["TENSOR", [256, 512], "float16"], ["TENSOR", [256], "float16"], ["TENSOR", [256], "float16"], ["TENSOR", [2048, 512], "float16"], 0.001953125], {}], "config": {"index": 1365, "code_hash": null, "entity": [["block_row_warps", "ot", 1], ["block_col_warps", "ot", 4], ["warp_row_tiles", "ot", 2], ["warp_col_tiles", "ot", 4], ["chunk", "ot", 1], ["offset", "ot", 0], ["offsetCS", "ot", 0], ["vec", "ot", 2], ["wmma_m", "ot", 32]]}, "result": [[7.4180635e-05], 0, 1.1318938732147217, 1651821053.1331387], "version": 0.2, "tvm_version": "0.8.0"}
{"input": ["cuda -keys=cuda,gpu -max_num_threads=1024 -thread_warp_size=32", "fused_layer_norm_matmul_tensorcore_gelu.cuda", [["TENSOR", [256, 512], "float16"], ["TENSOR", [256], "float16"], ["TENSOR", [256], "float16"], ["TENSOR", [2048, 512], "float16"], 0.001953125], {}], "config": {"index": 10906, "code_hash": null, "entity": [["block_row_warps", "ot", 2], ["block_col_warps", "ot", 4], ["warp_row_tiles", "ot", 4], ["warp_col_tiles", "ot", 2], ["chunk", "ot", 4], ["offset", "ot", 8], ["offsetCS", "ot", 0], ["vec", "ot", 1], ["wmma_m", "ot", 8]]}, "result": [[7.1276696e-05], 0, 1.3338661193847656, 1651821054.4736218], "version": 0.2, "tvm_version": "0.8.0"}
{"input": ["cuda -keys=cuda,gpu -max_num_threads=1024 -thread_warp_size=32", "fused_layer_norm_matmul_tensorcore_gelu.cuda", [["TENSOR", [256, 512], "float16"], ["TENSOR", [256], "float16"], ["TENSOR", [256], "float16"], ["TENSOR", [2048, 512], "float16"], 0.001953125], {}], "config": {"index": 12101, "code_hash": null, "entity": [["block_row_warps", "ot", 4], ["block_col_warps", "ot", 2], ["warp_row_tiles", "ot", 1], ["warp_col_tiles", "ot", 2], ["chunk", "ot", 2], ["offset", "ot", 8], ["offsetCS", "ot", 0], ["vec", "ot", 2], ["wmma_m", "ot", 8]]}, "result": [[3.4679197000000003e-05], 0, 1.0349712371826172, 1651821055.6338923], "version": 0.2, "tvm_version": "0.8.0"}
{"input": ["cuda -keys=cuda,gpu -max_num_threads=1024 -thread_warp_size=32", "fused_layer_norm_matmul_tensorcore_gelu.cuda", [["TENSOR", [256, 512], "float16"], ["TENSOR", [256], "float16"], ["TENSOR", [256], "float16"], ["TENSOR", [2048, 512], "float16"], 0.001953125], {}], "config": {"index": 6307, "code_hash": null, "entity": [["block_row_warps", "ot", 2], ["block_col_warps", "ot", 4], ["warp_row_tiles", "ot", 2], ["warp_col_tiles", "ot", 4], ["chunk", "ot", 2], ["offset", "ot", 8], ["offsetCS", "ot", 8], ["vec", "ot", 1], ["wmma_m", "ot", 16]]}, "result": [[7.326856e-05], 0, 1.1032171249389648, 1651821056.9179566], "version": 0.2, "tvm_version": "0.8.0"}
{"input": ["cuda -keys=cuda,gpu -max_num_threads=1024 -thread_warp_size=32", "fused_layer_norm_matmul_tensorcore_gelu.cuda", [["TENSOR", [256, 512], "float16"], ["TENSOR", [256], "float16"], ["TENSOR", [256], "float16"], ["TENSOR", [2048, 512], "float16"], 0.001953125], {}], "config": {"index": 3380, "code_hash": null, "entity": [["block_row_warps", "ot", 4], ["block_col_warps", "ot", 2], ["warp_row_tiles", "ot", 1], ["warp_col_tiles", "ot", 4], ["chunk", "ot", 2], ["offset", "ot", 0], ["offsetCS", "ot", 8], ["vec", "ot", 4], ["wmma_m", "ot", 32]]}, "result": [[5.5800412e-05], 0, 1.0972974300384521, 1651821057.5719008], "version": 0.2, "tvm_version": "0.8.0"}
{"input": ["cuda -keys=cuda,gpu -max_num_threads=1024 -thread_warp_size=32", "fused_layer_norm_matmul_tensorcore_gelu.cuda", [["TENSOR", [256, 512], "float16"], ["TENSOR", [256], "float16"], ["TENSOR", [256], "float16"], ["TENSOR", [2048, 512], "float16"], 0.001953125], {}], "config": {"index": 7802, "code_hash": null, "entity": [["block_row_warps", "ot", 4], ["block_col_warps", "ot", 4], ["warp_row_tiles", "ot", 4], ["warp_col_tiles", "ot", 1], ["chunk", "ot", 1], ["offset", "ot", 0], ["offsetCS", "ot", 0], ["vec", "ot", 4], ["wmma_m", "ot", 16]]}, "result": [[0.000128489287], 0, 1.3793220520019531, 1651821060.3695896], "version": 0.2, "tvm_version": "0.8.0"}
{"input": ["cuda -keys=cuda,gpu -max_num_threads=1024 -thread_warp_size=32", "fused_layer_norm_matmul_tensorcore_gelu.cuda", [["TENSOR", [256, 512], "float16"], ["TENSOR", [256], "float16"], ["TENSOR", [256], "float16"], ["TENSOR", [2048, 512], "float16"], 0.001953125], {}], "config": {"index": 8455, "code_hash": null, "entity": [["block_row_warps", "ot", 2], ["block_col_warps", "ot", 2], ["warp_row_tiles", "ot", 1], ["warp_col_tiles", "ot", 2], ["chunk", "ot", 1], ["offset", "ot", 0], ["offsetCS", "ot", 8], ["vec", "ot", 4], ["wmma_m", "ot", 16]]}, "result": [[3.3196971e-05], 0, 1.2845706939697266, 1651821061.004552], "version": 0.2, "tvm_version": "0.8.0"}
{"input": ["cuda -keys=cuda,gpu -max_num_threads=1024 -thread_warp_size=32", "fused_layer_norm_matmul_tensorcore_gelu.cuda", [["TENSOR", [256, 512], "float16"], ["TENSOR", [256], "float16"], ["TENSOR", [256], "float16"], ["TENSOR", [2048, 512], "float16"], 0.001953125], {}], "config": {"index": 6156, "code_hash": null, "entity": [["block_row_warps", "ot", 1], ["block_col_warps", "ot", 1], ["warp_row_tiles", "ot", 1], ["warp_col_tiles", "ot", 1], ["chunk", "ot", 1], ["offset", "ot", 8], ["offsetCS", "ot", 8], ["vec", "ot", 1], ["wmma_m", "ot", 16]]}, "result": [[7.8461439e-05], 0, 1.1361210346221924, 1651821062.2663484], "version": 0.2, "tvm_version": "0.8.0"}
{"input": ["cuda -keys=cuda,gpu -max_num_threads=1024 -thread_warp_size=32", "fused_layer_norm_matmul_tensorcore_gelu.cuda", [["TENSOR", [256, 512], "float16"], ["TENSOR", [256], "float16"], ["TENSOR", [256], "float16"], ["TENSOR", [2048, 512], "float16"], 0.001953125], {}], "config": {"index": 568, "code_hash": null, "entity": [["block_row_warps", "ot", 2], ["block_col_warps", "ot", 1], ["warp_row_tiles", "ot", 1], ["warp_col_tiles", "ot", 1], ["chunk", "ot", 8], ["offset", "ot", 8], ["offsetCS", "ot", 0], ["vec", "ot", 1], ["wmma_m", "ot", 32]]}, "result": [[0.00025999225300000003], 0, 1.8808138370513916, 1651821064.14984], "version": 0.2, "tvm_version": "0.8.0"}
{"input": ["cuda -keys=cuda,gpu -max_num_threads=1024 -thread_warp_size=32", "fused_layer_norm_matmul_tensorcore_gelu.cuda", [["TENSOR", [256, 512], "float16"], ["TENSOR", [256], "float16"], ["TENSOR", [256], "float16"], ["TENSOR", [2048, 512], "float16"], 0.001953125], {}], "config": {"index": 885, "code_hash": null, "entity": [["block_row_warps", "ot", 1], ["block_col_warps", "ot", 2], ["warp_row_tiles", "ot", 4], ["warp_col_tiles", "ot", 4], ["chunk", "ot", 4], ["offset", "ot", 0], ["offsetCS", "ot", 8], ["vec", "ot", 1], ["wmma_m", "ot", 32]]}, "result": [[0.000289496837], 0, 2.153498649597168, 1651821066.8898747], "version": 0.2, "tvm_version": "0.8.0"}
{"input": ["cuda -keys=cuda,gpu -max_num_threads=1024 -thread_warp_size=32", "fused_layer_norm_matmul_tensorcore_gelu.cuda", [["TENSOR", [256, 512], "float16"], ["TENSOR", [256], "float16"], ["TENSOR", [256], "float16"], ["TENSOR", [2048, 512], "float16"], 0.001953125], {}], "config": {"index": 6520, "code_hash": null, "entity": [["block_row_warps", "ot", 2], ["block_col_warps", "ot", 2], ["warp_row_tiles", "ot", 2], ["warp_col_tiles", "ot", 2], ["chunk", "ot", 1], ["offset", "ot", 0], ["offsetCS", "ot", 0], ["vec", "ot", 2], ["wmma_m", "ot", 16]]}, "result": [[6.3979894e-05], 0, 1.1955654621124268, 1651821068.1615233], "version": 0.2, "tvm_version": "0.8.0"}
{"input": ["cuda -keys=cuda,gpu -max_num_threads=1024 -thread_warp_size=32", "fused_layer_norm_matmul_tensorcore_gelu.cuda", [["TENSOR", [256, 512], "float16"], ["TENSOR", [256], "float16"], ["TENSOR", [256], "float16"], ["TENSOR", [2048, 512], "float16"], 0.001953125], {}], "config": {"index": 3265, "code_hash": null, "entity": [["block_row_warps", "ot", 2], ["block_col_warps", "ot", 4], ["warp_row_tiles", "ot", 4], ["warp_col_tiles", "ot", 1], ["chunk", "ot", 1], ["offset", "ot", 0], ["offsetCS", "ot", 8], ["vec", "ot", 4], ["wmma_m", "ot", 32]]}, "result": [[8.754445699999999e-05], 0, 1.4235799312591553, 1651821068.9192698], "version": 0.2, "tvm_version": "0.8.0"}
{"input": ["cuda -keys=cuda,gpu -max_num_threads=1024 -thread_warp_size=32", "fused_layer_norm_matmul_tensorcore_gelu.cuda", [["TENSOR", [256, 512], "float16"], ["TENSOR", [256], "float16"], ["TENSOR", [256], "float16"], ["TENSOR", [2048, 512], "float16"], 0.001953125], {}], "config": {"index": 1627, "code_hash": null, "entity": [["block_row_warps", "ot", 2], ["block_col_warps", "ot", 4], ["warp_row_tiles", "ot", 1], ["warp_col_tiles", "ot", 1], ["chunk", "ot", 1], ["offset", "ot", 8], ["offsetCS", "ot", 0], ["vec", "ot", 2], ["wmma_m", "ot", 32]]}, "result": [[3.8572513000000006e-05], 0, 1.123819351196289, 1651821070.6614847], "version": 0.2, "tvm_version": "0.8.0"}
{"input": ["cuda -keys=cuda,gpu -max_num_threads=1024 -thread_warp_size=32", "fused_layer_norm_matmul_tensorcore_gelu.cuda", [["TENSOR", [256, 512], "float16"], ["TENSOR", [256], "float16"], ["TENSOR", [256], "float16"], ["TENSOR", [2048, 512], "float16"], 0.001953125], {}], "config": {"index": 7258, "code_hash": null, "entity": [["block_row_warps", "ot", 2], ["block_col_warps", "ot", 2], ["warp_row_tiles", "ot", 4], ["warp_col_tiles", "ot", 2], ["chunk", "ot", 2], ["offset", "ot", 0], ["offsetCS", "ot", 8], ["vec", "ot", 2], ["wmma_m", "ot", 16]]}, "result": [[0.00010730796399999999], 0, 1.3514599800109863, 1651821072.0693357], "version": 0.2, "tvm_version": "0.8.0"}
{"input": ["cuda -keys=cuda,gpu -max_num_threads=1024 -thread_warp_size=32", "fused_layer_norm_matmul_tensorcore_gelu.cuda", [["TENSOR", [256, 512], "float16"], ["TENSOR", [256], "float16"], ["TENSOR", [256], "float16"], ["TENSOR", [2048, 512], "float16"], 0.001953125], {}], "config": {"index": 3619, "code_hash": null, "entity": [["block_row_warps", "ot", 2], ["block_col_warps", "ot", 1], ["warp_row_tiles", "ot", 1], ["warp_col_tiles", "ot", 4], ["chunk", "ot", 1], ["offset", "ot", 8], ["offsetCS", "ot", 8], ["vec", "ot", 4], ["wmma_m", "ot", 32]]}, "result": [[7.267441200000001e-05], 0, 1.3490872383117676, 1651821073.3444762], "version": 0.2, "tvm_version": "0.8.0"}
{"input": ["cuda -keys=cuda,gpu -max_num_threads=1024 -thread_warp_size=32", "fused_layer_norm_matmul_tensorcore_gelu.cuda", [["TENSOR", [256, 512], "float16"], ["TENSOR", [256], "float16"], ["TENSOR", [256], "float16"], ["TENSOR", [2048, 512], "float16"], 0.001953125], {}], "config": {"index": 5626, "code_hash": null, "entity": [["block_row_warps", "ot", 2], ["block_col_warps", "ot", 1], ["warp_row_tiles", "ot", 2], ["warp_col_tiles", "ot", 2], ["chunk", "ot", 2], ["offset", "ot", 8], ["offsetCS", "ot", 0], ["vec", "ot", 1], ["wmma_m", "ot", 16]]}, "result": [[0.00013562026800000002], 0, 1.4681923389434814, 1651821074.813853], "version": 0.2, "tvm_version": "0.8.0"}
{"input": ["cuda -keys=cuda,gpu -max_num_threads=1024 -thread_warp_size=32", "fused_layer_norm_matmul_tensorcore_gelu.cuda", [["TENSOR", [256, 512], "float16"], ["TENSOR", [256], "float16"], ["TENSOR", [256], "float16"], ["TENSOR", [2048, 512], "float16"], 0.001953125], {}], "config": {"index": 59, "code_hash": null, "entity": [["block_row_warps", "ot", 4], ["block_col_warps", "ot", 2], ["warp_row_tiles", "ot", 1], ["warp_col_tiles", "ot", 4], ["chunk", "ot", 1], ["offset", "ot", 0], ["offsetCS", "ot", 0], ["vec", "ot", 1], ["wmma_m", "ot", 32]]}, "result": [[8.841898899999998e-05], 0, 1.3320684432983398, 1651821075.5216577], "version": 0.2, "tvm_version": "0.8.0"}
{"input": ["cuda -keys=cuda,gpu -max_num_threads=1024 -thread_warp_size=32", "fused_layer_norm_matmul_tensorcore_gelu.cuda", [["TENSOR", [256, 512], "float16"], ["TENSOR", [256], "float16"], ["TENSOR", [256], "float16"], ["TENSOR", [2048, 512], "float16"], 0.001953125], {}], "config": {"index": 2762, "code_hash": null, "entity": [["block_row_warps", "ot", 4], ["block_col_warps", "ot", 4], ["warp_row_tiles", "ot", 1], ["warp_col_tiles", "ot", 1], ["chunk", "ot", 4], ["offset", "ot", 0], ["offsetCS", "ot", 0], ["vec", "ot", 4], ["wmma_m", "ot", 32]]}, "result": [[8.682151000000001e-05], 0, 1.3496780395507812, 1651821076.8336484], "version": 0.2, "tvm_version": "0.8.0"}
{"input": ["cuda -keys=cuda,gpu -max_num_threads=1024 -thread_warp_size=32", "fused_layer_norm_matmul_tensorcore_gelu.cuda", [["TENSOR", [256, 512], "float16"], ["TENSOR", [256], "float16"], ["TENSOR", [256], "float16"], ["TENSOR", [2048, 512], "float16"], 0.001953125], {}], "config": {"index": 11883, "code_hash": null, "entity": [["block_row_warps", "ot", 1], ["block_col_warps", "ot", 2], ["warp_row_tiles", "ot", 1], ["warp_col_tiles", "ot", 4], ["chunk", "ot", 4], ["offset", "ot", 0], ["offsetCS", "ot", 0], ["vec", "ot", 2], ["wmma_m", "ot", 8]]}, "result": [[7.2201897e-05], 0, 1.458660364151001, 1651821078.1283696], "version": 0.2, "tvm_version": "0.8.0"}
{"input": ["cuda -keys=cuda,gpu -max_num_threads=1024 -thread_warp_size=32", "fused_layer_norm_matmul_tensorcore_gelu.cuda", [["TENSOR", [256, 512], "float16"], ["TENSOR", [256], "float16"], ["TENSOR", [256], "float16"], ["TENSOR", [2048, 512], "float16"], 0.001953125], {}], "config": {"index": 440, "code_hash": null, "entity": [["block_row_warps", "ot", 4], ["block_col_warps", "ot", 4], ["warp_row_tiles", "ot", 1], ["warp_col_tiles", "ot", 2], ["chunk", "ot", 2], ["offset", "ot", 8], ["offsetCS", "ot", 0], ["vec", "ot", 1], ["wmma_m", "ot", 32]]}, "result": [[5.1442262e-05], 0, 1.1423413753509521, 1651821079.9427056], "version": 0.2, "tvm_version": "0.8.0"}
{"input": ["cuda -keys=cuda,gpu -max_num_threads=1024 -thread_warp_size=32", "fused_layer_norm_matmul_tensorcore_gelu.cuda", [["TENSOR", [256, 512], "float16"], ["TENSOR", [256], "float16"], ["TENSOR", [256], "float16"], ["TENSOR", [2048, 512], "float16"], 0.001953125], {}], "config": {"index": 2059, "code_hash": null, "entity": [["block_row_warps", "ot", 2], ["block_col_warps", "ot", 4], ["warp_row_tiles", "ot", 1], ["warp_col_tiles", "ot", 2], ["chunk", "ot", 2], ["offset", "ot", 0], ["offsetCS", "ot", 8], ["vec", "ot", 2], ["wmma_m", "ot", 32]]}, "result": [[5.0193029e-05], 0, 1.2347421646118164, 1651821080.559447], "version": 0.2, "tvm_version": "0.8.0"}
{"input": ["cuda -keys=cuda,gpu -max_num_threads=1024 -thread_warp_size=32", "fused_layer_norm_matmul_tensorcore_gelu.cuda", [["TENSOR", [256, 512], "float16"], ["TENSOR", [256], "float16"], ["TENSOR", [256], "float16"], ["TENSOR", [2048, 512], "float16"], 0.001953125], {}], "config": {"index": 8313, "code_hash": null, "entity": [["block_row_warps", "ot", 1], ["block_col_warps", "ot", 4], ["warp_row_tiles", "ot", 4], ["warp_col_tiles", "ot", 2], ["chunk", "ot", 4], ["offset", "ot", 8], ["offsetCS", "ot", 0], ["vec", "ot", 4], ["wmma_m", "ot", 16]]}, "result": [[7.4953461e-05], 0, 1.401186227798462, 1651821083.1342843], "version": 0.2, "tvm_version": "0.8.0"}
{"input": ["cuda -keys=cuda,gpu -max_num_threads=1024 -thread_warp_size=32", "fused_layer_norm_matmul_tensorcore_gelu.cuda", [["TENSOR", [256, 512], "float16"], ["TENSOR", [256], "float16"], ["TENSOR", [256], "float16"], ["TENSOR", [2048, 512], "float16"], 0.001953125], {}], "config": {"index": 186, "code_hash": null, "entity": [["block_row_warps", "ot", 1], ["block_col_warps", "ot", 4], ["warp_row_tiles", "ot", 4], ["warp_col_tiles", "ot", 1], ["chunk", "ot", 4], ["offset", "ot", 0], ["offsetCS", "ot", 0], ["vec", "ot", 1], ["wmma_m", "ot", 32]]}, "result": [[0.00017992466200000002], 0, 1.7071852684020996, 1651821084.1579747], "version": 0.2, "tvm_version": "0.8.0"}
{"input": ["cuda -keys=cuda,gpu -max_num_threads=1024 -thread_warp_size=32", "fused_layer_norm_matmul_tensorcore_gelu.cuda", [["TENSOR", [256, 512], "float16"], ["TENSOR", [256], "float16"], ["TENSOR", [256], "float16"], ["TENSOR", [2048, 512], "float16"], 0.001953125], {}], "config": {"index": 11144, "code_hash": null, "entity": [["block_row_warps", "ot", 4], ["block_col_warps", "ot", 1], ["warp_row_tiles", "ot", 4], ["warp_col_tiles", "ot", 2], ["chunk", "ot", 2], ["offset", "ot", 0], ["offsetCS", "ot", 8], ["vec", "ot", 1], ["wmma_m", "ot", 8]]}, "result": [[0.00015185034399999999], 0, 1.5841057300567627, 1651821085.6697989], "version": 0.2, "tvm_version": "0.8.0"}
{"input": ["cuda -keys=cuda,gpu -max_num_threads=1024 -thread_warp_size=32", "fused_layer_norm_matmul_tensorcore_gelu.cuda", [["TENSOR", [256, 512], "float16"], ["TENSOR", [256], "float16"], ["TENSOR", [256], "float16"], ["TENSOR", [2048, 512], "float16"], 0.001953125], {}], "config": {"index": 815, "code_hash": null, "entity": [["block_row_warps", "ot", 4], ["block_col_warps", "ot", 2], ["warp_row_tiles", "ot", 1], ["warp_col_tiles", "ot", 1], ["chunk", "ot", 4], ["offset", "ot", 0], ["offsetCS", "ot", 8], ["vec", "ot", 1], ["wmma_m", "ot", 32]]}, "result": [[0.00010968246299999999], 0, 1.25885009765625, 1651821087.1002047], "version": 0.2, "tvm_version": "0.8.0"}
{"input": ["cuda -keys=cuda,gpu -max_num_threads=1024 -thread_warp_size=32", "fused_layer_norm_matmul_tensorcore_gelu.cuda", [["TENSOR", [256, 512], "float16"], ["TENSOR", [256], "float16"], ["TENSOR", [256], "float16"], ["TENSOR", [2048, 512], "float16"], 0.001953125], {}], "config": {"index": 7883, "code_hash": null, "entity": [["block_row_warps", "ot", 4], ["block_col_warps", "ot", 4], ["warp_row_tiles", "ot", 4], ["warp_col_tiles", "ot", 1], ["chunk", "ot", 2], ["offset", "ot", 0], ["offsetCS", "ot", 0], ["vec", "ot", 4], ["wmma_m", "ot", 16]]}, "result": [[0.000131072822], 0, 1.3831088542938232, 1651821118.941753], "version": 0.2, "tvm_version": "0.8.0"}
{"input": ["cuda -keys=cuda,gpu -max_num_threads=1024 -thread_warp_size=32", "fused_layer_norm_matmul_tensorcore_gelu.cuda", [["TENSOR", [256, 512], "float16"], ["TENSOR", [256], "float16"], ["TENSOR", [256], "float16"], ["TENSOR", [2048, 512], "float16"], 0.001953125], {}], "config": {"index": 5856, "code_hash": null, "entity": [["block_row_warps", "ot", 1], ["block_col_warps", "ot", 4], ["warp_row_tiles", "ot", 4], ["warp_col_tiles", "ot", 1], ["chunk", "ot", 1], ["offset", "ot", 0], ["offsetCS", "ot", 8], ["vec", "ot", 1], ["wmma_m", "ot", 16]]}, "result": [[9.169364000000001e-05], 0, 1.3295934200286865, 1651821119.6840405], "version": 0.2, "tvm_version": "0.8.0"}
{"input": ["cuda -keys=cuda,gpu -max_num_threads=1024 -thread_warp_size=32", "fused_layer_norm_matmul_tensorcore_gelu.cuda", [["TENSOR", [256, 512], "float16"], ["TENSOR", [256], "float16"], ["TENSOR", [256], "float16"], ["TENSOR", [2048, 512], "float16"], 0.001953125], {}], "config": {"index": 1986, "code_hash": null, "entity": [["block_row_warps", "ot", 1], ["block_col_warps", "ot", 4], ["warp_row_tiles", "ot", 2], ["warp_col_tiles", "ot", 2], ["chunk", "ot", 1], ["offset", "ot", 0], ["offsetCS", "ot", 8], ["vec", "ot", 2], ["wmma_m", "ot", 32]]}, "result": [[6.5752081e-05], 0, 1.207775592803955, 1651821120.380875], "version": 0.2, "tvm_version": "0.8.0"}
{"input": ["cuda -keys=cuda,gpu -max_num_threads=1024 -thread_warp_size=32", "fused_layer_norm_matmul_tensorcore_gelu.cuda", [["TENSOR", [256, 512], "float16"], ["TENSOR", [256], "float16"], ["TENSOR", [256], "float16"], ["TENSOR", [2048, 512], "float16"], 0.001953125], {}], "config": {"index": 9012, "code_hash": null, "entity": [["block_row_warps", "ot", 1], ["block_col_warps", "ot", 2], ["warp_row_tiles", "ot", 4], ["warp_col_tiles", "ot", 1], ["chunk", "ot", 8], ["offset", "ot", 8], ["offsetCS", "ot", 8], ["vec", "ot", 4], ["wmma_m", "ot", 16]]}, "result": [[6.692538299999999e-05], 0, 1.3458442687988281, 1651821121.0915906], "version": 0.2, "tvm_version": "0.8.0"}
{"input": ["cuda -keys=cuda,gpu -max_num_threads=1024 -thread_warp_size=32", "fused_layer_norm_matmul_tensorcore_gelu.cuda", [["TENSOR", [256, 512], "float16"], ["TENSOR", [256], "float16"], ["TENSOR", [256], "float16"], ["TENSOR", [2048, 512], "float16"], 0.001953125], {}], "config": {"index": 409, "code_hash": null, "entity": [["block_row_warps", "ot", 2], ["block_col_warps", "ot", 2], ["warp_row_tiles", "ot", 1], ["warp_col_tiles", "ot", 1], ["chunk", "ot", 2], ["offset", "ot", 8], ["offsetCS", "ot", 0], ["vec", "ot", 1], ["wmma_m", "ot", 32]]}, "result": [[7.3146842e-05], 0, 1.1839542388916016, 1651821121.7743695], "version": 0.2, "tvm_version": "0.8.0"}
{"input": ["cuda -keys=cuda,gpu -max_num_threads=1024 -thread_warp_size=32", "fused_layer_norm_matmul_tensorcore_gelu.cuda", [["TENSOR", [256, 512], "float16"], ["TENSOR", [256], "float16"], ["TENSOR", [256], "float16"], ["TENSOR", [2048, 512], "float16"], 0.001953125], {}], "config": {"index": 8750, "code_hash": null, "entity": [["block_row_warps", "ot", 4], ["block_col_warps", "ot", 1], ["warp_row_tiles", "ot", 1], ["warp_col_tiles", "ot", 1], ["chunk", "ot", 1], ["offset", "ot", 8], ["offsetCS", "ot", 8], ["vec", "ot", 4], ["wmma_m", "ot", 16]]}, "result": [[5.1140056e-05], 0, 1.3080132007598877, 1651821122.4476254], "version": 0.2, "tvm_version": "0.8.0"}
{"input": ["cuda -keys=cuda,gpu -max_num_threads=1024 -thread_warp_size=32", "fused_layer_norm_matmul_tensorcore_gelu.cuda", [["TENSOR", [256, 512], "float16"], ["TENSOR", [256], "float16"], ["TENSOR", [256], "float16"], ["TENSOR", [2048, 512], "float16"], 0.001953125], {}], "config": {"index": 12015, "code_hash": null, "entity": [["block_row_warps", "ot", 1], ["block_col_warps", "ot", 1], ["warp_row_tiles", "ot", 1], ["warp_col_tiles", "ot", 2], ["chunk", "ot", 1], ["offset", "ot", 8], ["offsetCS", "ot", 0], ["vec", "ot", 2], ["wmma_m", "ot", 8]]}, "result": [[5.3832203000000004e-05], 0, 1.1550865173339844, 1651821123.0926814], "version": 0.2, "tvm_version": "0.8.0"}
{"input": ["cuda -keys=cuda,gpu -max_num_threads=1024 -thread_warp_size=32", "fused_layer_norm_matmul_tensorcore_gelu.cuda", [["TENSOR", [256, 512], "float16"], ["TENSOR", [256], "float16"], ["TENSOR", [256], "float16"], ["TENSOR", [2048, 512], "float16"], 0.001953125], {}], "config": {"index": 3445, "code_hash": null, "entity": [["block_row_warps", "ot", 2], ["block_col_warps", "ot", 4], ["warp_row_tiles", "ot", 2], ["warp_col_tiles", "ot", 2], ["chunk", "ot", 4], ["offset", "ot", 0], ["offsetCS", "ot", 8], ["vec", "ot", 4], ["wmma_m", "ot", 32]]}, "result": [[7.176033e-05], 0, 1.3866043090820312, 1651821123.8137822], "version": 0.2, "tvm_version": "0.8.0"}
{"input": ["cuda -keys=cuda,gpu -max_num_threads=1024 -thread_warp_size=32", "fused_layer_norm_matmul_tensorcore_gelu.cuda", [["TENSOR", [256, 512], "float16"], ["TENSOR", [256], "float16"], ["TENSOR", [256], "float16"], ["TENSOR", [2048, 512], "float16"], 0.001953125], {}], "config": {"index": 32, "code_hash": null, "entity": [["block_row_warps", "ot", 4], ["block_col_warps", "ot", 2], ["warp_row_tiles", "ot", 1], ["warp_col_tiles", "ot", 2], ["chunk", "ot", 1], ["offset", "ot", 0], ["offsetCS", "ot", 0], ["vec", "ot", 1], ["wmma_m", "ot", 32]]}, "result": [[8.669574799999999e-05], 0, 1.2757012844085693, 1651821124.5847516], "version": 0.2, "tvm_version": "0.8.0"}
{"input": ["cuda -keys=cuda,gpu -max_num_threads=1024 -thread_warp_size=32", "fused_layer_norm_matmul_tensorcore_gelu.cuda", [["TENSOR", [256, 512], "float16"], ["TENSOR", [256], "float16"], ["TENSOR", [256], "float16"], ["TENSOR", [2048, 512], "float16"], 0.001953125], {}], "config": {"index": 13410, "code_hash": null, "entity": [["block_row_warps", "ot", 1], ["block_col_warps", "ot", 1], ["warp_row_tiles", "ot", 4], ["warp_col_tiles", "ot", 2], ["chunk", "ot", 2], ["offset", "ot", 8], ["offsetCS", "ot", 0], ["vec", "ot", 4], ["wmma_m", "ot", 8]]}, "result": [[8.091806200000001e-05], 0, 1.318913459777832, 1651821125.312962], "version": 0.2, "tvm_version": "0.8.0"}
{"input": ["cuda -keys=cuda,gpu -max_num_threads=1024 -thread_warp_size=32", "fused_layer_norm_matmul_tensorcore_gelu.cuda", [["TENSOR", [256, 512], "float16"], ["TENSOR", [256], "float16"], ["TENSOR", [256], "float16"], ["TENSOR", [2048, 512], "float16"], 0.001953125], {}], "config": {"index": 12578, "code_hash": null, "entity": [["block_row_warps", "ot", 4], ["block_col_warps", "ot", 2], ["warp_row_tiles", "ot", 4], ["warp_col_tiles", "ot", 1], ["chunk", "ot", 8], ["offset", "ot", 0], ["offsetCS", "ot", 8], ["vec", "ot", 2], ["wmma_m", "ot", 8]]}, "result": [[7.4750601e-05], 0, 1.3856735229492188, 1651821126.0413604], "version": 0.2, "tvm_version": "0.8.0"}
{"input": ["cuda -keys=cuda,gpu -max_num_threads=1024 -thread_warp_size=32", "fused_layer_norm_matmul_tensorcore_gelu.cuda", [["TENSOR", [256, 512], "float16"], ["TENSOR", [256], "float16"], ["TENSOR", [256], "float16"], ["TENSOR", [2048, 512], "float16"], 0.001953125], {}], "config": {"index": 10484, "code_hash": null, "entity": [["block_row_warps", "ot", 4], ["block_col_warps", "ot", 4], ["warp_row_tiles", "ot", 1], ["warp_col_tiles", "ot", 2], ["chunk", "ot", 2], ["offset", "ot", 0], ["offsetCS", "ot", 0], ["vec", "ot", 1], ["wmma_m", "ot", 8]]}, "result": [[5.5161833e-05], 0, 1.1356797218322754, 1651821126.711323], "version": 0.2, "tvm_version": "0.8.0"}
{"input": ["cuda -keys=cuda,gpu -max_num_threads=1024 -thread_warp_size=32", "fused_layer_norm_matmul_tensorcore_gelu.cuda", [["TENSOR", [256, 512], "float16"], ["TENSOR", [256], "float16"], ["TENSOR", [256], "float16"], ["TENSOR", [2048, 512], "float16"], 0.001953125], {}], "config": {"index": 7786, "code_hash": null, "entity": [["block_row_warps", "ot", 2], ["block_col_warps", "ot", 1], ["warp_row_tiles", "ot", 2], ["warp_col_tiles", "ot", 1], ["chunk", "ot", 1], ["offset", "ot", 0], ["offsetCS", "ot", 0], ["vec", "ot", 4], ["wmma_m", "ot", 16]]}, "result": [[7.093160699999999e-05], 0, 1.2467968463897705, 1651821127.3981733], "version": 0.2, "tvm_version": "0.8.0"}
{"input": ["cuda -keys=cuda,gpu -max_num_threads=1024 -thread_warp_size=32", "fused_layer_norm_matmul_tensorcore_gelu.cuda", [["TENSOR", [256, 512], "float16"], ["TENSOR", [256], "float16"], ["TENSOR", [256], "float16"], ["TENSOR", [2048, 512], "float16"], 0.001953125], {}], "config": {"index": 2437, "code_hash": null, "entity": [["block_row_warps", "ot", 2], ["block_col_warps", "ot", 4], ["warp_row_tiles", "ot", 1], ["warp_col_tiles", "ot", 1], ["chunk", "ot", 4], ["offset", "ot", 8], ["offsetCS", "ot", 8], ["vec", "ot", 2], ["wmma_m", "ot", 32]]}, "result": [[3.3588964e-05], 0, 1.1642389297485352, 1651821127.9981298], "version": 0.2, "tvm_version": "0.8.0"}
{"input": ["cuda -keys=cuda,gpu -max_num_threads=1024 -thread_warp_size=32", "fused_layer_norm_matmul_tensorcore_gelu.cuda", [["TENSOR", [256, 512], "float16"], ["TENSOR", [256], "float16"], ["TENSOR", [256], "float16"], ["TENSOR", [2048, 512], "float16"], 0.001953125], {}], "config": {"index": 6897, "code_hash": null, "entity": [["block_row_warps", "ot", 1], ["block_col_warps", "ot", 2], ["warp_row_tiles", "ot", 2], ["warp_col_tiles", "ot", 1], ["chunk", "ot", 2], ["offset", "ot", 8], ["offsetCS", "ot", 0], ["vec", "ot", 2], ["wmma_m", "ot", 16]]}, "result": [[5.217741e-05], 0, 1.291600227355957, 1651821128.677433], "version": 0.2, "tvm_version": "0.8.0"}
{"input": ["cuda -keys=cuda,gpu -max_num_threads=1024 -thread_warp_size=32", "fused_layer_norm_matmul_tensorcore_gelu.cuda", [["TENSOR", [256, 512], "float16"], ["TENSOR", [256], "float16"], ["TENSOR", [256], "float16"], ["TENSOR", [2048, 512], "float16"], 0.001953125], {}], "config": {"index": 6759, "code_hash": null, "entity": [["block_row_warps", "ot", 1], ["block_col_warps", "ot", 1], ["warp_row_tiles", "ot", 2], ["warp_col_tiles", "ot", 2], ["chunk", "ot", 8], ["offset", "ot", 0], ["offsetCS", "ot", 0], ["vec", "ot", 2], ["wmma_m", "ot", 16]]}, "result": [[0.00011376372600000001], 0, 1.4195716381072998, 1651821129.5327435], "version": 0.2, "tvm_version": "0.8.0"}
{"input": ["cuda -keys=cuda,gpu -max_num_threads=1024 -thread_warp_size=32", "fused_layer_norm_matmul_tensorcore_gelu.cuda", [["TENSOR", [256, 512], "float16"], ["TENSOR", [256], "float16"], ["TENSOR", [256], "float16"], ["TENSOR", [2048, 512], "float16"], 0.001953125], {}], "config": {"index": 6219, "code_hash": null, "entity": [["block_row_warps", "ot", 1], ["block_col_warps", "ot", 1], ["warp_row_tiles", "ot", 2], ["warp_col_tiles", "ot", 4], ["chunk", "ot", 1], ["offset", "ot", 8], ["offsetCS", "ot", 8], ["vec", "ot", 1], ["wmma_m", "ot", 16]]}, "result": [[0.000156769411], 0, 1.5810611248016357, 1651821130.4599817], "version": 0.2, "tvm_version": "0.8.0"}
{"input": ["cuda -keys=cuda,gpu -max_num_threads=1024 -thread_warp_size=32", "fused_layer_norm_matmul_tensorcore_gelu.cuda", [["TENSOR", [256, 512], "float16"], ["TENSOR", [256], "float16"], ["TENSOR", [256], "float16"], ["TENSOR", [2048, 512], "float16"], 0.001953125], {}], "config": {"index": 3134, "code_hash": null, "entity": [["block_row_warps", "ot", 4], ["block_col_warps", "ot", 1], ["warp_row_tiles", "ot", 1], ["warp_col_tiles", "ot", 4], ["chunk", "ot", 4], ["offset", "ot", 8], ["offsetCS", "ot", 0], ["vec", "ot", 4], ["wmma_m", "ot", 32]]}, "result": [[7.1362069e-05], 0, 1.414947271347046, 1651821131.2129924], "version": 0.2, "tvm_version": "0.8.0"}
{"input": ["cuda -keys=cuda,gpu -max_num_threads=1024 -thread_warp_size=32", "fused_layer_norm_matmul_tensorcore_gelu.cuda", [["TENSOR", [256, 512], "float16"], ["TENSOR", [256], "float16"], ["TENSOR", [256], "float16"], ["TENSOR", [2048, 512], "float16"], 0.001953125], {}], "config": {"index": 13133, "code_hash": null, "entity": [["block_row_warps", "ot", 4], ["block_col_warps", "ot", 1], ["warp_row_tiles", "ot", 2], ["warp_col_tiles", "ot", 1], ["chunk", "ot", 4], ["offset", "ot", 0], ["offsetCS", "ot", 0], ["vec", "ot", 4], ["wmma_m", "ot", 8]]}, "result": [[6.2502262e-05], 0, 1.282599687576294, 1651821131.879648], "version": 0.2, "tvm_version": "0.8.0"}
{"input": ["cuda -keys=cuda,gpu -max_num_threads=1024 -thread_warp_size=32", "fused_layer_norm_matmul_tensorcore_gelu.cuda", [["TENSOR", [256, 512], "float16"], ["TENSOR", [256], "float16"], ["TENSOR", [256], "float16"], ["TENSOR", [2048, 512], "float16"], 0.001953125], {}], "config": {"index": 5254, "code_hash": null, "entity": [["block_row_warps", "ot", 2], ["block_col_warps", "ot", 4], ["warp_row_tiles", "ot", 2], ["warp_col_tiles", "ot", 4], ["chunk", "ot", 1], ["offset", "ot", 0], ["offsetCS", "ot", 0], ["vec", "ot", 1], ["wmma_m", "ot", 16]]}, "result": [[8.2445118e-05], 0, 1.3368291854858398, 1651821132.5899444], "version": 0.2, "tvm_version": "0.8.0"}
{"input": ["cuda -keys=cuda,gpu -max_num_threads=1024 -thread_warp_size=32", "fused_layer_norm_matmul_tensorcore_gelu.cuda", [["TENSOR", [256, 512], "float16"], ["TENSOR", [256], "float16"], ["TENSOR", [256], "float16"], ["TENSOR", [2048, 512], "float16"], 0.001953125], {}], "config": {"index": 834, "code_hash": null, "entity": [["block_row_warps", "ot", 1], ["block_col_warps", "ot", 4], ["warp_row_tiles", "ot", 4], ["warp_col_tiles", "ot", 1], ["chunk", "ot", 4], ["offset", "ot", 0], ["offsetCS", "ot", 8], ["vec", "ot", 1], ["wmma_m", "ot", 32]]}, "result": [[0.00017971561399999998], 0, 1.755086898803711, 1651821133.6603754], "version": 0.2, "tvm_version": "0.8.0"}
{"input": ["cuda -keys=cuda,gpu -max_num_threads=1024 -thread_warp_size=32", "fused_layer_norm_matmul_tensorcore_gelu.cuda", [["TENSOR", [256, 512], "float16"], ["TENSOR", [256], "float16"], ["TENSOR", [256], "float16"], ["TENSOR", [2048, 512], "float16"], 0.001953125], {}], "config": {"index": 12245, "code_hash": null, "entity": [["block_row_warps", "ot", 4], ["block_col_warps", "ot", 2], ["warp_row_tiles", "ot", 2], ["warp_col_tiles", "ot", 1], ["chunk", "ot", 8], ["offset", "ot", 8], ["offsetCS", "ot", 0], ["vec", "ot", 2], ["wmma_m", "ot", 8]]}, "result": [[3.6555314000000004e-05], 0, 1.2846999168395996, 1651821134.2863436], "version": 0.2, "tvm_version": "0.8.0"}
{"input": ["cuda -keys=cuda,gpu -max_num_threads=1024 -thread_warp_size=32", "fused_layer_norm_matmul_tensorcore_gelu.cuda", [["TENSOR", [256, 512], "float16"], ["TENSOR", [256], "float16"], ["TENSOR", [256], "float16"], ["TENSOR", [2048, 512], "float16"], 0.001953125], {}], "config": {"index": 13435, "code_hash": null, "entity": [["block_row_warps", "ot", 2], ["block_col_warps", "ot", 4], ["warp_row_tiles", "ot", 2], ["warp_col_tiles", "ot", 4], ["chunk", "ot", 2], ["offset", "ot", 8], ["offsetCS", "ot", 0], ["vec", "ot", 4], ["wmma_m", "ot", 8]]}, "result": [[5.201558399999999e-05], 0, 1.237290859222412, 1651821134.928285], "version": 0.2, "tvm_version": "0.8.0"}
{"input": ["cuda -keys=cuda,gpu -max_num_threads=1024 -thread_warp_size=32", "fused_layer_norm_matmul_tensorcore_gelu.cuda", [["TENSOR", [256, 512], "float16"], ["TENSOR", [256], "float16"], ["TENSOR", [256], "float16"], ["TENSOR", [2048, 512], "float16"], 0.001953125], {}], "config": {"index": 2795, "code_hash": null, "entity": [["block_row_warps", "ot", 4], ["block_col_warps", "ot", 2], ["warp_row_tiles", "ot", 2], ["warp_col_tiles", "ot", 2], ["chunk", "ot", 4], ["offset", "ot", 0], ["offsetCS", "ot", 0], ["vec", "ot", 4], ["wmma_m", "ot", 32]]}, "result": [[9.745268900000001e-05], 0, 1.5075912475585938, 1651821135.774446], "version": 0.2, "tvm_version": "0.8.0"}
{"input": ["cuda -keys=cuda,gpu -max_num_threads=1024 -thread_warp_size=32", "fused_layer_norm_matmul_tensorcore_gelu.cuda", [["TENSOR", [256, 512], "float16"], ["TENSOR", [256], "float16"], ["TENSOR", [256], "float16"], ["TENSOR", [2048, 512], "float16"], 0.001953125], {}], "config": {"index": 6339, "code_hash": null, "entity": [["block_row_warps", "ot", 1], ["block_col_warps", "ot", 2], ["warp_row_tiles", "ot", 4], ["warp_col_tiles", "ot", 1], ["chunk", "ot", 4], ["offset", "ot", 8], ["offsetCS", "ot", 8], ["vec", "ot", 1], ["wmma_m", "ot", 16]]}, "result": [[0.000134703451], 0, 1.548168420791626, 1651821138.2424471], "version": 0.2, "tvm_version": "0.8.0"}
{"input": ["cuda -keys=cuda,gpu -max_num_threads=1024 -thread_warp_size=32", "fused_layer_norm_matmul_tensorcore_gelu.cuda", [["TENSOR", [256, 512], "float16"], ["TENSOR", [256], "float16"], ["TENSOR", [256], "float16"], ["TENSOR", [2048, 512], "float16"], 0.001953125], {}], "config": {"index": 1301, "code_hash": null, "entity": [["block_row_warps", "ot", 4], ["block_col_warps", "ot", 2], ["warp_row_tiles", "ot", 1], ["warp_col_tiles", "ot", 1], ["chunk", "ot", 1], ["offset", "ot", 0], ["offsetCS", "ot", 0], ["vec", "ot", 2], ["wmma_m", "ot", 32]]}, "result": [[6.477499e-05], 0, 1.2607638835906982, 1651821138.9007242], "version": 0.2, "tvm_version": "0.8.0"}
{"input": ["cuda -keys=cuda,gpu -max_num_threads=1024 -thread_warp_size=32", "fused_layer_norm_matmul_tensorcore_gelu.cuda", [["TENSOR", [256, 512], "float16"], ["TENSOR", [256], "float16"], ["TENSOR", [256], "float16"], ["TENSOR", [2048, 512], "float16"], 0.001953125], {}], "config": {"index": 11219, "code_hash": null, "entity": [["block_row_warps", "ot", 4], ["block_col_warps", "ot", 2], ["warp_row_tiles", "ot", 2], ["warp_col_tiles", "ot", 2], ["chunk", "ot", 4], ["offset", "ot", 0], ["offsetCS", "ot", 8], ["vec", "ot", 1], ["wmma_m", "ot", 8]]}, "result": [[8.1443825e-05], 0, 1.341480016708374, 1651821139.6856973], "version": 0.2, "tvm_version": "0.8.0"}
{"input": ["cuda -keys=cuda,gpu -max_num_threads=1024 -thread_warp_size=32", "fused_layer_norm_matmul_tensorcore_gelu.cuda", [["TENSOR", [256, 512], "float16"], ["TENSOR", [256], "float16"], ["TENSOR", [256], "float16"], ["TENSOR", [2048, 512], "float16"], 0.001953125], {}], "config": {"index": 13027, "code_hash": null, "entity": [["block_row_warps", "ot", 2], ["block_col_warps", "ot", 2], ["warp_row_tiles", "ot", 2], ["warp_col_tiles", "ot", 4], ["chunk", "ot", 1], ["offset", "ot", 0], ["offsetCS", "ot", 0], ["vec", "ot", 4], ["wmma_m", "ot", 8]]}, "result": [[6.0027884999999994e-05], 0, 1.160231590270996, 1651821140.353644], "version": 0.2, "tvm_version": "0.8.0"}
{"input": ["cuda -keys=cuda,gpu -max_num_threads=1024 -thread_warp_size=32", "fused_layer_norm_matmul_tensorcore_gelu.cuda", [["TENSOR", [256, 512], "float16"], ["TENSOR", [256], "float16"], ["TENSOR", [256], "float16"], ["TENSOR", [2048, 512], "float16"], 0.001953125], {}], "config": {"index": 1210, "code_hash": null, "entity": [["block_row_warps", "ot", 2], ["block_col_warps", "ot", 2], ["warp_row_tiles", "ot", 4], ["warp_col_tiles", "ot", 4], ["chunk", "ot", 4], ["offset", "ot", 8], ["offsetCS", "ot", 8], ["vec", "ot", 1], ["wmma_m", "ot", 32]]}, "result": [[0.00028072065900000006], 0, 2.0392472743988037, 1651821141.7335434], "version": 0.2, "tvm_version": "0.8.0"}
{"input": ["cuda -keys=cuda,gpu -max_num_threads=1024 -thread_warp_size=32", "fused_layer_norm_matmul_tensorcore_gelu.cuda", [["TENSOR", [256, 512], "float16"], ["TENSOR", [256], "float16"], ["TENSOR", [256], "float16"], ["TENSOR", [2048, 512], "float16"], 0.001953125], {}], "config": {"index": 6281, "code_hash": null, "entity": [["block_row_warps", "ot", 4], ["block_col_warps", "ot", 4], ["warp_row_tiles", "ot", 2], ["warp_col_tiles", "ot", 2], ["chunk", "ot", 2], ["offset", "ot", 8], ["offsetCS", "ot", 8], ["vec", "ot", 1], ["wmma_m", "ot", 16]]}, "result": [[6.329248e-05], 0, 1.2924926280975342, 1651821142.4635968], "version": 0.2, "tvm_version": "0.8.0"}
{"input": ["cuda -keys=cuda,gpu -max_num_threads=1024 -thread_warp_size=32", "fused_layer_norm_matmul_tensorcore_gelu.cuda", [["TENSOR", [256, 512], "float16"], ["TENSOR", [256], "float16"], ["TENSOR", [256], "float16"], ["TENSOR", [2048, 512], "float16"], 0.001953125], {}], "config": {"index": 2732, "code_hash": null, "entity": [["block_row_warps", "ot", 4], ["block_col_warps", "ot", 2], ["warp_row_tiles", "ot", 1], ["warp_col_tiles", "ot", 4], ["chunk", "ot", 2], ["offset", "ot", 0], ["offsetCS", "ot", 0], ["vec", "ot", 4], ["wmma_m", "ot", 32]]}, "result": [[5.5945864e-05], 0, 1.225165605545044, 1651821143.14422], "version": 0.2, "tvm_version": "0.8.0"}
{"input": ["cuda -keys=cuda,gpu -max_num_threads=1024 -thread_warp_size=32", "fused_layer_norm_matmul_tensorcore_gelu.cuda", [["TENSOR", [256, 512], "float16"], ["TENSOR", [256], "float16"], ["TENSOR", [256], "float16"], ["TENSOR", [2048, 512], "float16"], 0.001953125], {}], "config": {"index": 12833, "code_hash": null, "entity": [["block_row_warps", "ot", 4], ["block_col_warps", "ot", 4], ["warp_row_tiles", "ot", 1], ["warp_col_tiles", "ot", 2], ["chunk", "ot", 4], ["offset", "ot", 8], ["offsetCS", "ot", 8], ["vec", "ot", 2], ["wmma_m", "ot", 8]]}, "result": [[2.7643377e-05], 0, 1.081308364868164, 1651821143.6999378], "version": 0.2, "tvm_version": "0.8.0"}
{"input": ["cuda -keys=cuda,gpu -max_num_threads=1024 -thread_warp_size=32", "fused_layer_norm_matmul_tensorcore_gelu.cuda", [["TENSOR", [256, 512], "float16"], ["TENSOR", [256], "float16"], ["TENSOR", [256], "float16"], ["TENSOR", [2048, 512], "float16"], 0.001953125], {}], "config": {"index": 12085, "code_hash": null, "entity": [["block_row_warps", "ot", 2], ["block_col_warps", "ot", 4], ["warp_row_tiles", "ot", 2], ["warp_col_tiles", "ot", 1], ["chunk", "ot", 2], ["offset", "ot", 8], ["offsetCS", "ot", 0], ["vec", "ot", 2], ["wmma_m", "ot", 8]]}, "result": [[3.255838399999999e-05], 0, 1.1505763530731201, 1651821144.3044424], "version": 0.2, "tvm_version": "0.8.0"}
{"input": ["cuda -keys=cuda,gpu -max_num_threads=1024 -thread_warp_size=32", "fused_layer_norm_matmul_tensorcore_gelu.cuda", [["TENSOR", [256, 512], "float16"], ["TENSOR", [256], "float16"], ["TENSOR", [256], "float16"], ["TENSOR", [2048, 512], "float16"], 0.001953125], {}], "config": {"index": 12965, "code_hash": null, "entity": [["block_row_warps", "ot", 4], ["block_col_warps", "ot", 2], ["warp_row_tiles", "ot", 1], ["warp_col_tiles", "ot", 1], ["chunk", "ot", 1], ["offset", "ot", 0], ["offsetCS", "ot", 0], ["vec", "ot", 4], ["wmma_m", "ot", 8]]}, "result": [[4.9043328e-05], 0, 1.1737158298492432, 1651821144.9029894], "version": 0.2, "tvm_version": "0.8.0"}
{"input": ["cuda -keys=cuda,gpu -max_num_threads=1024 -thread_warp_size=32", "fused_layer_norm_matmul_tensorcore_gelu.cuda", [["TENSOR", [256, 512], "float16"], ["TENSOR", [256], "float16"], ["TENSOR", [256], "float16"], ["TENSOR", [2048, 512], "float16"], 0.001953125], {}], "config": {"index": 14239, "code_hash": null, "entity": [["block_row_warps", "ot", 2], ["block_col_warps", "ot", 1], ["warp_row_tiles", "ot", 2], ["warp_col_tiles", "ot", 4], ["chunk", "ot", 8], ["offset", "ot", 8], ["offsetCS", "ot", 8], ["vec", "ot", 4], ["wmma_m", "ot", 8]]}, "result": [[5.3376514e-05], 0, 1.5329501628875732, 1651821145.6284046], "version": 0.2, "tvm_version": "0.8.0"}
{"input": ["cuda -keys=cuda,gpu -max_num_threads=1024 -thread_warp_size=32", "fused_layer_norm_matmul_tensorcore_gelu.cuda", [["TENSOR", [256, 512], "float16"], ["TENSOR", [256], "float16"], ["TENSOR", [256], "float16"], ["TENSOR", [2048, 512], "float16"], 0.001953125], {}], "config": {"index": 7144, "code_hash": null, "entity": [["block_row_warps", "ot", 2], ["block_col_warps", "ot", 4], ["warp_row_tiles", "ot", 2], ["warp_col_tiles", "ot", 1], ["chunk", "ot", 1], ["offset", "ot", 0], ["offsetCS", "ot", 8], ["vec", "ot", 2], ["wmma_m", "ot", 16]]}, "result": [[4.519297799999999e-05], 0, 1.2760167121887207, 1651821146.2884662], "version": 0.2, "tvm_version": "0.8.0"}
{"input": ["cuda -keys=cuda,gpu -max_num_threads=1024 -thread_warp_size=32", "fused_layer_norm_matmul_tensorcore_gelu.cuda", [["TENSOR", [256, 512], "float16"], ["TENSOR", [256], "float16"], ["TENSOR", [256], "float16"], ["TENSOR", [2048, 512], "float16"], 0.001953125], {}], "config": {"index": 5232, "code_hash": null, "entity": [["block_row_warps", "ot", 1], ["block_col_warps", "ot", 2], ["warp_row_tiles", "ot", 4], ["warp_col_tiles", "ot", 2], ["chunk", "ot", 1], ["offset", "ot", 0], ["offsetCS", "ot", 0], ["vec", "ot", 1], ["wmma_m", "ot", 16]]}, "result": [[0.00015831564], 0, 1.487539529800415, 1651821147.2457838], "version": 0.2, "tvm_version": "0.8.0"}
{"input": ["cuda -keys=cuda,gpu -max_num_threads=1024 -thread_warp_size=32", "fused_layer_norm_matmul_tensorcore_gelu.cuda", [["TENSOR", [256, 512], "float16"], ["TENSOR", [256], "float16"], ["TENSOR", [256], "float16"], ["TENSOR", [2048, 512], "float16"], 0.001953125], {}], "config": {"index": 5622, "code_hash": null, "entity": [["block_row_warps", "ot", 1], ["block_col_warps", "ot", 4], ["warp_row_tiles", "ot", 1], ["warp_col_tiles", "ot", 2], ["chunk", "ot", 2], ["offset", "ot", 8], ["offsetCS", "ot", 0], ["vec", "ot", 1], ["wmma_m", "ot", 16]]}, "result": [[4.1209403999999996e-05], 0, 1.1286447048187256, 1651821147.8301327], "version": 0.2, "tvm_version": "0.8.0"}
{"input": ["cuda -keys=cuda,gpu -max_num_threads=1024 -thread_warp_size=32", "fused_layer_norm_matmul_tensorcore_gelu.cuda", [["TENSOR", [256, 512], "float16"], ["TENSOR", [256], "float16"], ["TENSOR", [256], "float16"], ["TENSOR", [2048, 512], "float16"], 0.001953125], {}], "config": {"index": 11837, "code_hash": null, "entity": [["block_row_warps", "ot", 4], ["block_col_warps", "ot", 1], ["warp_row_tiles", "ot", 2], ["warp_col_tiles", "ot", 1], ["chunk", "ot", 4], ["offset", "ot", 0], ["offsetCS", "ot", 0], ["vec", "ot", 2], ["wmma_m", "ot", 8]]}, "result": [[7.1346147e-05], 0, 1.300565481185913, 1651821148.593178], "version": 0.2, "tvm_version": "0.8.0"}
{"input": ["cuda -keys=cuda,gpu -max_num_threads=1024 -thread_warp_size=32", "fused_layer_norm_matmul_tensorcore_gelu.cuda", [["TENSOR", [256, 512], "float16"], ["TENSOR", [256], "float16"], ["TENSOR", [256], "float16"], ["TENSOR", [2048, 512], "float16"], 0.001953125], {}], "config": {"index": 13220, "code_hash": null, "entity": [["block_row_warps", "ot", 4], ["block_col_warps", "ot", 4], ["warp_row_tiles", "ot", 2], ["warp_col_tiles", "ot", 1], ["chunk", "ot", 8], ["offset", "ot", 0], ["offsetCS", "ot", 0], ["vec", "ot", 4], ["wmma_m", "ot", 8]]}, "result": [[5.5150098999999996e-05], 0, 1.3256487846374512, 1651821149.266673], "version": 0.2, "tvm_version": "0.8.0"}
{"input": ["cuda -keys=cuda,gpu -max_num_threads=1024 -thread_warp_size=32", "fused_layer_norm_matmul_tensorcore_gelu.cuda", [["TENSOR", [256, 512], "float16"], ["TENSOR", [256], "float16"], ["TENSOR", [256], "float16"], ["TENSOR", [2048, 512], "float16"], 0.001953125], {}], "config": {"index": 11790, "code_hash": null, "entity": [["block_row_warps", "ot", 1], ["block_col_warps", "ot", 1], ["warp_row_tiles", "ot", 4], ["warp_col_tiles", "ot", 2], ["chunk", "ot", 2], ["offset", "ot", 0], ["offsetCS", "ot", 0], ["vec", "ot", 2], ["wmma_m", "ot", 8]]}, "result": [[0.000106429575], 0, 1.3125247955322266, 1651821150.060141], "version": 0.2, "tvm_version": "0.8.0"}
