python/models/swin_transformer/kernel_configs/swin_transformer_te_slice_1_28_28_256_[0, 1]_2.log
{"i": [["[\"te_slice\", 1, 28, 28, 256, [0, 1], 2, \"float16\"]", "cuda -keys=cuda,gpu -max_num_threads=1024 -model=unknown -thread_warp_size=32", [-1, 16, 64, 49152, 2147483647, 1024, 8, 32], "", 0, []], [[], [["FU", 1, [0, 1, 2, 3]], ["SP", 1, 0, 50176, [28], 1], ["AN", 1, 0, 5], ["AN", 1, 1, 6]]]], "r": [[3.83759e-06, 3.83537e-06, 3.83513e-06], 0, 1.32733, 1668065391], "v": "v0.6"}
{"i": [["[\"te_slice\", 1, 28, 28, 256, [0, 1], 2, \"float16\"]", "cuda -keys=cuda,gpu -max_num_threads=1024 -model=unknown -thread_warp_size=32", [-1, 16, 64, 49152, 2147483647, 1024, 8, 32], "", 0, []], [[], [["FU", 1, [0, 1, 2, 3]], ["SP", 1, 0, 50176, [56], 1], ["AN", 1, 0, 5], ["AN", 1, 1, 6]]]], "r": [[3.45803e-06, 3.46667e-06, 3.4706e-06], 0, 0.58128, 1668065390], "v": "v0.6"}
{"i": [["[\"te_slice\", 1, 28, 28, 256, [0, 1], 2, \"float16\"]", "cuda -keys=cuda,gpu -max_num_threads=1024 -model=unknown -thread_warp_size=32", [-1, 16, 64, 49152, 2147483647, 1024, 8, 32], "", 0, []], [[], [["FU", 1, [0, 1, 2, 3]], ["SP", 1, 0, 50176, [1], 1], ["AN", 1, 0, 5], ["AN", 1, 1, 6]]]], "r": [[3.99751e-05, 3.99776e-05, 3.99852e-05], 0, 2.41133, 1668065392], "v": "v0.6"}
{"i": [["[\"te_slice\", 1, 28, 28, 256, [0, 1], 2, \"float16\"]", "cuda -keys=cuda,gpu -max_num_threads=1024 -model=unknown -thread_warp_size=32", [-1, 16, 64, 49152, 2147483647, 1024, 8, 32], "", 0, []], [[], [["FU", 1, [0, 1, 2, 3]], ["SP", 1, 0, 50176, [2], 1], ["AN", 1, 0, 5], ["AN", 1, 1, 6]]]], "r": [[2.13632e-05, 2.13755e-05, 2.13737e-05], 0, 1.67457, 1668065391], "v": "v0.6"}
{"i": [["[\"te_slice\", 1, 28, 28, 256, [0, 1], 2, \"float16\"]", "cuda -keys=cuda,gpu -max_num_threads=1024 -model=unknown -thread_warp_size=32", [-1, 16, 64, 49152, 2147483647, 1024, 8, 32], "", 0, []], [[], [["FU", 1, [0, 1, 2, 3]], ["SP", 1, 0, 50176, [4], 1], ["AN", 1, 0, 5], ["AN", 1, 1, 6]]]], "r": [[1.20343e-05, 1.2049e-05, 1.20516e-05], 0, 2.06393, 1668065392], "v": "v0.6"}
{"i": [["[\"te_slice\", 1, 28, 28, 256, [0, 1], 2, \"float16\"]", "cuda -keys=cuda,gpu -max_num_threads=1024 -model=unknown -thread_warp_size=32", [-1, 16, 64, 49152, 2147483647, 1024, 8, 32], "", 0, []], [[], [["FU", 1, [0, 1, 2, 3]], ["SP", 1, 0, 50176, [64], 1], ["AN", 1, 0, 5], ["AN", 1, 1, 6]]]], "r": [[3.19413e-06, 3.19225e-06, 3.19823e-06], 0, 3.14513, 1668065393], "v": "v0.6"}
{"i": [["[\"te_slice\", 1, 28, 28, 256, [0, 1], 2, \"float16\"]", "cuda -keys=cuda,gpu -max_num_threads=1024 -model=unknown -thread_warp_size=32", [-1, 16, 64, 49152, 2147483647, 1024, 8, 32], "", 0, []], [[], [["FU", 1, [0, 1, 2, 3]], ["SP", 1, 0, 50176, [7], 1], ["AN", 1, 0, 5], ["AN", 1, 1, 6]]]], "r": [[8.12413e-06, 8.141e-06, 8.13584e-06], 0, 0.97403, 1668065391], "v": "v0.6"}
{"i": [["[\"te_slice\", 1, 28, 28, 256, [0, 1], 2, \"float16\"]", "cuda -keys=cuda,gpu -max_num_threads=1024 -model=unknown -thread_warp_size=32", [-1, 16, 64, 49152, 2147483647, 1024, 8, 32], "", 0, []], [[], [["FU", 1, [0, 1, 2, 3]], ["SP", 1, 0, 50176, [49], 1], ["AN", 1, 0, 5], ["AN", 1, 1, 6]]]], "r": [[3.46228e-06, 3.47317e-06, 3.47388e-06], 0, 3.49647, 1668065393], "v": "v0.6"}
{"i": [["[\"te_slice\", 1, 28, 28, 256, [0, 1], 2, \"float16\"]", "cuda -keys=cuda,gpu -max_num_threads=1024 -model=unknown -thread_warp_size=32", [-1, 16, 64, 49152, 2147483647, 1024, 8, 32], "", 0, []], [[], [["FU", 1, [0, 1, 2, 3]], ["SP", 1, 0, 50176, [14], 1], ["AN", 1, 0, 5], ["AN", 1, 1, 6]]]], "r": [[5.42225e-06, 5.42974e-06, 5.44127e-06], 0, 2.74855, 1668065392], "v": "v0.6"}
{"i": [["[\"te_slice\", 1, 28, 28, 256, [0, 1], 2, \"float16\"]", "cuda -keys=cuda,gpu -max_num_threads=1024 -model=unknown -thread_warp_size=32", [-1, 16, 64, 49152, 2147483647, 1024, 8, 32], "", 0, []], [[], [["FU", 1, [0, 1, 2, 3]], ["SP", 1, 0, 50176, [16], 1], ["AN", 1, 0, 5], ["AN", 1, 1, 6]]]], "r": [[4.95857e-06, 4.96556e-06, 4.96319e-06], 0, 3.80869, 1668065393], "v": "v0.6"}
{"i": [["[\"te_slice\", 1, 28, 28, 256, [0, 1], 2, \"float16\"]", "cuda -keys=cuda,gpu -max_num_threads=1024 -model=unknown -thread_warp_size=32", [-1, 16, 64, 49152, 2147483647, 1024, 8, 32], "", 0, []], [[], [["FU", 1, [0, 1, 2, 3]], ["SP", 1, 0, 50176, [8], 1], ["AN", 1, 0, 5], ["AN", 1, 1, 6]]]], "r": [[7.28464e-06, 7.30276e-06, 7.30566e-06], 0, 4.16008, 1668065394], "v": "v0.6"}
{"i": [["[\"te_slice\", 1, 28, 28, 256, [0, 1], 2, \"float16\"]", "cuda -keys=cuda,gpu -max_num_threads=1024 -model=unknown -thread_warp_size=32", [-1, 16, 64, 49152, 2147483647, 1024, 8, 32], "", 0, []], [[], [["FU", 1, [0, 1, 2, 3]], ["SP", 1, 0, 50176, [32], 1], ["AN", 1, 0, 5], ["AN", 1, 1, 6]]]], "r": [[3.66387e-06, 3.69553e-06, 3.69869e-06], 0, 4.5009, 1668065394], "v": "v0.6"}
