python/models/swin_transformer/kernel_configs/swin_transformer_dense_196_1536_512.log
{"input": ["cuda -keys=cuda,gpu -max_num_threads=1024 -thread_warp_size=32", "dense_tensorcore.cuda", [["TENSOR", [208, 512], "float16"], ["TENSOR", [1536, 512], "float16"]], {}], "config": {"index": 8160, "code_hash": null, "entity": [["block_row_warps", "ot", 1], ["block_col_warps", "ot", 4], ["warp_row_tiles", "ot", 1], ["warp_col_tiles", "ot", 4], ["chunk", "ot", 1], ["offset", "ot", 8], ["offsetCS", "ot", 0], ["vec", "ot", 4], ["wmma_m", "ot", 8]]}, "result": [[3.5023248e-05], 0, 0.9391815662384033, 1668103520.5396647], "version": 0.2, "tvm_version": "0.8.0"}
{"input": ["cuda -keys=cuda,gpu -max_num_threads=1024 -thread_warp_size=32", "dense_tensorcore.cuda", [["TENSOR", [208, 512], "float16"], ["TENSOR", [1536, 512], "float16"]], {}], "config": {"index": 7269, "code_hash": null, "entity": [["block_row_warps", "ot", 1], ["block_col_warps", "ot", 4], ["warp_row_tiles", "ot", 1], ["warp_col_tiles", "ot", 4], ["chunk", "ot", 2], ["offset", "ot", 0], ["offsetCS", "ot", 8], ["vec", "ot", 2], ["wmma_m", "ot", 8]]}, "result": [[3.1712235999999996e-05], 0, 1.1806752681732178, 1668103524.4728777], "version": 0.2, "tvm_version": "0.8.0"}
{"input": ["cuda -keys=cuda,gpu -max_num_threads=1024 -thread_warp_size=32", "dense_tensorcore.cuda", [["TENSOR", [208, 512], "float16"], ["TENSOR", [1536, 512], "float16"]], {}], "config": {"index": 6697, "code_hash": null, "entity": [["block_row_warps", "ot", 2], ["block_col_warps", "ot", 1], ["warp_row_tiles", "ot", 1], ["warp_col_tiles", "ot", 4], ["chunk", "ot", 4], ["offset", "ot", 0], ["offsetCS", "ot", 0], ["vec", "ot", 2], ["wmma_m", "ot", 8]]}, "result": [[3.5006997e-05], 0, 0.9573440551757812, 1668103525.500062], "version": 0.2, "tvm_version": "0.8.0"}
{"input": ["cuda -keys=cuda,gpu -max_num_threads=1024 -thread_warp_size=32", "dense_tensorcore.cuda", [["TENSOR", [208, 512], "float16"], ["TENSOR", [1536, 512], "float16"]], {}], "config": {"index": 9670, "code_hash": null, "entity": [["block_row_warps", "ot", 2], ["block_col_warps", "ot", 2], ["warp_row_tiles", "ot", 1], ["warp_col_tiles", "ot", 2], ["chunk", "ot", 8], ["offset", "ot", 8], ["offsetCS", "ot", 0], ["vec", "ot", 8], ["wmma_m", "ot", 8]]}, "result": [[1.2546037999999999e-05], 0, 0.7818925380706787, 1668103528.4179866], "version": 0.2, "tvm_version": "0.8.0"}
{"input": ["cuda -keys=cuda,gpu -max_num_threads=1024 -thread_warp_size=32", "dense_tensorcore.cuda", [["TENSOR", [208, 512], "float16"], ["TENSOR", [1536, 512], "float16"]], {}], "config": {"index": 6603, "code_hash": null, "entity": [["block_row_warps", "ot", 1], ["block_col_warps", "ot", 4], ["warp_row_tiles", "ot", 2], ["warp_col_tiles", "ot", 2], ["chunk", "ot", 2], ["offset", "ot", 0], ["offsetCS", "ot", 0], ["vec", "ot", 2], ["wmma_m", "ot", 8]]}, "result": [[2.1575921000000002e-05], 0, 0.7965102195739746, 1668103533.249877], "version": 0.2, "tvm_version": "0.8.0"}
{"input": ["cuda -keys=cuda,gpu -max_num_threads=1024 -thread_warp_size=32", "dense_tensorcore.cuda", [["TENSOR", [208, 512], "float16"], ["TENSOR", [1536, 512], "float16"]], {}], "config": {"index": 7248, "code_hash": null, "entity": [["block_row_warps", "ot", 1], ["block_col_warps", "ot", 2], ["warp_row_tiles", "ot", 2], ["warp_col_tiles", "ot", 2], ["chunk", "ot", 2], ["offset", "ot", 0], ["offsetCS", "ot", 8], ["vec", "ot", 2], ["wmma_m", "ot", 8]]}, "result": [[2.1942732e-05], 0, 0.782862663269043, 1668103534.2019122], "version": 0.2, "tvm_version": "0.8.0"}
{"input": ["cuda -keys=cuda,gpu -max_num_threads=1024 -thread_warp_size=32", "dense_tensorcore.cuda", [["TENSOR", [208, 512], "float16"], ["TENSOR", [1536, 512], "float16"]], {}], "config": {"index": 7077, "code_hash": null, "entity": [["block_row_warps", "ot", 1], ["block_col_warps", "ot", 2], ["warp_row_tiles", "ot", 1], ["warp_col_tiles", "ot", 2], ["chunk", "ot", 8], ["offset", "ot", 8], ["offsetCS", "ot", 0], ["vec", "ot", 2], ["wmma_m", "ot", 8]]}, "result": [[1.5637225000000002e-05], 0, 0.8617720603942871, 1668103534.7447877], "version": 0.2, "tvm_version": "0.8.0"}
{"input": ["cuda -keys=cuda,gpu -max_num_threads=1024 -thread_warp_size=32", "dense_tensorcore.cuda", [["TENSOR", [208, 512], "float16"], ["TENSOR", [1536, 512], "float16"]], {}], "config": {"index": 10185, "code_hash": null, "entity": [["block_row_warps", "ot", 1], ["block_col_warps", "ot", 4], ["warp_row_tiles", "ot", 1], ["warp_col_tiles", "ot", 4], ["chunk", "ot", 2], ["offset", "ot", 8], ["offsetCS", "ot", 8], ["vec", "ot", 8], ["wmma_m", "ot", 8]]}, "result": [[2.7455628999999998e-05], 0, 0.8236813545227051, 1668103536.715735], "version": 0.2, "tvm_version": "0.8.0"}
{"input": ["cuda -keys=cuda,gpu -max_num_threads=1024 -thread_warp_size=32", "dense_tensorcore.cuda", [["TENSOR", [208, 512], "float16"], ["TENSOR", [1536, 512], "float16"]], {}], "config": {"index": 9564, "code_hash": null, "entity": [["block_row_warps", "ot", 1], ["block_col_warps", "ot", 4], ["warp_row_tiles", "ot", 1], ["warp_col_tiles", "ot", 1], ["chunk", "ot", 4], ["offset", "ot", 8], ["offsetCS", "ot", 0], ["vec", "ot", 8], ["wmma_m", "ot", 8]]}, "result": [[1.5793498e-05], 0, 0.7554409503936768, 1668103538.165018], "version": 0.2, "tvm_version": "0.8.0"}
{"input": ["cuda -keys=cuda,gpu -max_num_threads=1024 -thread_warp_size=32", "dense_tensorcore.cuda", [["TENSOR", [208, 512], "float16"], ["TENSOR", [1536, 512], "float16"]], {}], "config": {"index": 87, "code_hash": null, "entity": [["block_row_warps", "ot", 1], ["block_col_warps", "ot", 4], ["warp_row_tiles", "ot", 1], ["warp_col_tiles", "ot", 1], ["chunk", "ot", 2], ["offset", "ot", 0], ["offsetCS", "ot", 0], ["vec", "ot", 1], ["wmma_m", "ot", 16]]}, "result": [[2.1304261000000002e-05], 0, 1.199096441268921, 1668103560.9953978], "version": 0.2, "tvm_version": "0.8.0"}
{"input": ["cuda -keys=cuda,gpu -max_num_threads=1024 -thread_warp_size=32", "dense_tensorcore.cuda", [["TENSOR", [208, 512], "float16"], ["TENSOR", [1536, 512], "float16"]], {}], "config": {"index": 138, "code_hash": null, "entity": [["block_row_warps", "ot", 1], ["block_col_warps", "ot", 2], ["warp_row_tiles", "ot", 1], ["warp_col_tiles", "ot", 4], ["chunk", "ot", 2], ["offset", "ot", 0], ["offsetCS", "ot", 0], ["vec", "ot", 1], ["wmma_m", "ot", 16]]}, "result": [[3.449398e-05], 0, 1.4374208450317383, 1668103561.58465], "version": 0.2, "tvm_version": "0.8.0"}
{"input": ["cuda -keys=cuda,gpu -max_num_threads=1024 -thread_warp_size=32", "dense_tensorcore.cuda", [["TENSOR", [208, 512], "float16"], ["TENSOR", [1536, 512], "float16"]], {}], "config": {"index": 408, "code_hash": null, "entity": [["block_row_warps", "ot", 1], ["block_col_warps", "ot", 2], ["warp_row_tiles", "ot", 1], ["warp_col_tiles", "ot", 1], ["chunk", "ot", 2], ["offset", "ot", 8], ["offsetCS", "ot", 0], ["vec", "ot", 1], ["wmma_m", "ot", 16]]}, "result": [[1.7224877e-05], 0, 1.303898572921753, 1668103562.0922768], "version": 0.2, "tvm_version": "0.8.0"}
{"input": ["cuda -keys=cuda,gpu -max_num_threads=1024 -thread_warp_size=32", "dense_tensorcore.cuda", [["TENSOR", [208, 512], "float16"], ["TENSOR", [1536, 512], "float16"]], {}], "config": {"index": 411, "code_hash": null, "entity": [["block_row_warps", "ot", 1], ["block_col_warps", "ot", 4], ["warp_row_tiles", "ot", 1], ["warp_col_tiles", "ot", 1], ["chunk", "ot", 2], ["offset", "ot", 8], ["offsetCS", "ot", 0], ["vec", "ot", 1], ["wmma_m", "ot", 16]]}, "result": [[1.5217854000000001e-05], 0, 1.191080093383789, 1668103562.6412127], "version": 0.2, "tvm_version": "0.8.0"}
{"input": ["cuda -keys=cuda,gpu -max_num_threads=1024 -thread_warp_size=32", "dense_tensorcore.cuda", [["TENSOR", [208, 512], "float16"], ["TENSOR", [1536, 512], "float16"]], {}], "config": {"index": 168, "code_hash": null, "entity": [["block_row_warps", "ot", 1], ["block_col_warps", "ot", 4], ["warp_row_tiles", "ot", 1], ["warp_col_tiles", "ot", 1], ["chunk", "ot", 4], ["offset", "ot", 0], ["offsetCS", "ot", 0], ["vec", "ot", 1], ["wmma_m", "ot", 16]]}, "result": [[2.9620969000000002e-05], 0, 1.3727381229400635, 1668103563.1975842], "version": 0.2, "tvm_version": "0.8.0"}
{"input": ["cuda -keys=cuda,gpu -max_num_threads=1024 -thread_warp_size=32", "dense_tensorcore.cuda", [["TENSOR", [208, 512], "float16"], ["TENSOR", [1536, 512], "float16"]], {}], "config": {"index": 435, "code_hash": null, "entity": [["block_row_warps", "ot", 1], ["block_col_warps", "ot", 2], ["warp_row_tiles", "ot", 1], ["warp_col_tiles", "ot", 2], ["chunk", "ot", 2], ["offset", "ot", 8], ["offsetCS", "ot", 0], ["vec", "ot", 1], ["wmma_m", "ot", 16]]}, "result": [[1.7949276e-05], 0, 1.3734350204467773, 1668103563.7128835], "version": 0.2, "tvm_version": "0.8.0"}
{"input": ["cuda -keys=cuda,gpu -max_num_threads=1024 -thread_warp_size=32", "dense_tensorcore.cuda", [["TENSOR", [208, 512], "float16"], ["TENSOR", [1536, 512], "float16"]], {}], "config": {"index": 1083, "code_hash": null, "entity": [["block_row_warps", "ot", 1], ["block_col_warps", "ot", 2], ["warp_row_tiles", "ot", 1], ["warp_col_tiles", "ot", 2], ["chunk", "ot", 2], ["offset", "ot", 8], ["offsetCS", "ot", 8], ["vec", "ot", 1], ["wmma_m", "ot", 16]]}, "result": [[1.7803985999999996e-05], 0, 1.4494290351867676, 1668103564.2841144], "version": 0.2, "tvm_version": "0.8.0"}
{"input": ["cuda -keys=cuda,gpu -max_num_threads=1024 -thread_warp_size=32", "dense_tensorcore.cuda", [["TENSOR", [208, 512], "float16"], ["TENSOR", [1536, 512], "float16"]], {}], "config": {"index": 3975, "code_hash": null, "entity": [["block_row_warps", "ot", 1], ["block_col_warps", "ot", 4], ["warp_row_tiles", "ot", 1], ["warp_col_tiles", "ot", 1], ["chunk", "ot", 2], ["offset", "ot", 0], ["offsetCS", "ot", 0], ["vec", "ot", 8], ["wmma_m", "ot", 16]]}, "result": [[2.4581946e-05], 0, 1.4002940654754639, 1668103564.8162694], "version": 0.2, "tvm_version": "0.8.0"}
{"input": ["cuda -keys=cuda,gpu -max_num_threads=1024 -thread_warp_size=32", "dense_tensorcore.cuda", [["TENSOR", [208, 512], "float16"], ["TENSOR", [1536, 512], "float16"]], {}], "config": {"index": 462, "code_hash": null, "entity": [["block_row_warps", "ot", 1], ["block_col_warps", "ot", 2], ["warp_row_tiles", "ot", 1], ["warp_col_tiles", "ot", 4], ["chunk", "ot", 2], ["offset", "ot", 8], ["offsetCS", "ot", 0], ["vec", "ot", 1], ["wmma_m", "ot", 16]]}, "result": [[2.2630485e-05], 0, 1.1163902282714844, 1668103565.3685348], "version": 0.2, "tvm_version": "0.8.0"}
{"input": ["cuda -keys=cuda,gpu -max_num_threads=1024 -thread_warp_size=32", "dense_tensorcore.cuda", [["TENSOR", [208, 512], "float16"], ["TENSOR", [1536, 512], "float16"]], {}], "config": {"index": 1515, "code_hash": null, "entity": [["block_row_warps", "ot", 1], ["block_col_warps", "ot", 2], ["warp_row_tiles", "ot", 1], ["warp_col_tiles", "ot", 4], ["chunk", "ot", 4], ["offset", "ot", 0], ["offsetCS", "ot", 0], ["vec", "ot", 2], ["wmma_m", "ot", 16]]}, "result": [[2.4690464e-05], 0, 1.485893726348877, 1668103565.9671645], "version": 0.2, "tvm_version": "0.8.0"}
{"input": ["cuda -keys=cuda,gpu -max_num_threads=1024 -thread_warp_size=32", "dense_tensorcore.cuda", [["TENSOR", [208, 512], "float16"], ["TENSOR", [1536, 512], "float16"]], {}], "config": {"index": 1785, "code_hash": null, "entity": [["block_row_warps", "ot", 1], ["block_col_warps", "ot", 2], ["warp_row_tiles", "ot", 1], ["warp_col_tiles", "ot", 1], ["chunk", "ot", 4], ["offset", "ot", 8], ["offsetCS", "ot", 0], ["vec", "ot", 2], ["wmma_m", "ot", 16]]}, "result": [[1.1933039e-05], 0, 1.3278772830963135, 1668103566.4699717], "version": 0.2, "tvm_version": "0.8.0"}
{"input": ["cuda -keys=cuda,gpu -max_num_threads=1024 -thread_warp_size=32", "dense_tensorcore.cuda", [["TENSOR", [208, 512], "float16"], ["TENSOR", [1536, 512], "float16"]], {}], "config": {"index": 759, "code_hash": null, "entity": [["block_row_warps", "ot", 1], ["block_col_warps", "ot", 2], ["warp_row_tiles", "ot", 1], ["warp_col_tiles", "ot", 2], ["chunk", "ot", 2], ["offset", "ot", 0], ["offsetCS", "ot", 8], ["vec", "ot", 1], ["wmma_m", "ot", 16]]}, "result": [[2.7313177000000002e-05], 0, 1.4541428089141846, 1668103567.0127556], "version": 0.2, "tvm_version": "0.8.0"}
{"input": ["cuda -keys=cuda,gpu -max_num_threads=1024 -thread_warp_size=32", "dense_tensorcore.cuda", [["TENSOR", [208, 512], "float16"], ["TENSOR", [1536, 512], "float16"]], {}], "config": {"index": 5028, "code_hash": null, "entity": [["block_row_warps", "ot", 1], ["block_col_warps", "ot", 4], ["warp_row_tiles", "ot", 1], ["warp_col_tiles", "ot", 1], ["chunk", "ot", 4], ["offset", "ot", 8], ["offsetCS", "ot", 8], ["vec", "ot", 8], ["wmma_m", "ot", 16]]}, "result": [[1.1039554e-05], 0, 1.3486149311065674, 1668103567.558486], "version": 0.2, "tvm_version": "0.8.0"}
{"input": ["cuda -keys=cuda,gpu -max_num_threads=1024 -thread_warp_size=32", "dense_tensorcore.cuda", [["TENSOR", [208, 512], "float16"], ["TENSOR", [1536, 512], "float16"]], {}], "config": {"index": 1407, "code_hash": null, "entity": [["block_row_warps", "ot", 1], ["block_col_warps", "ot", 2], ["warp_row_tiles", "ot", 1], ["warp_col_tiles", "ot", 2], ["chunk", "ot", 2], ["offset", "ot", 0], ["offsetCS", "ot", 0], ["vec", "ot", 2], ["wmma_m", "ot", 16]]}, "result": [[1.8572873e-05], 0, 1.2769560813903809, 1668103568.0771518], "version": 0.2, "tvm_version": "0.8.0"}
{"input": ["cuda -keys=cuda,gpu -max_num_threads=1024 -thread_warp_size=32", "dense_tensorcore.cuda", [["TENSOR", [208, 512], "float16"], ["TENSOR", [1536, 512], "float16"]], {}], "config": {"index": 1461, "code_hash": null, "entity": [["block_row_warps", "ot", 1], ["block_col_warps", "ot", 2], ["warp_row_tiles", "ot", 1], ["warp_col_tiles", "ot", 1], ["chunk", "ot", 4], ["offset", "ot", 0], ["offsetCS", "ot", 0], ["vec", "ot", 2], ["wmma_m", "ot", 16]]}, "result": [[2.7371285e-05], 0, 1.34765625, 1668103568.6180398], "version": 0.2, "tvm_version": "0.8.0"}
{"input": ["cuda -keys=cuda,gpu -max_num_threads=1024 -thread_warp_size=32", "dense_tensorcore.cuda", [["TENSOR", [208, 512], "float16"], ["TENSOR", [1536, 512], "float16"]], {}], "config": {"index": 6924, "code_hash": null, "entity": [["block_row_warps", "ot", 1], ["block_col_warps", "ot", 2], ["warp_row_tiles", "ot", 2], ["warp_col_tiles", "ot", 2], ["chunk", "ot", 2], ["offset", "ot", 8], ["offsetCS", "ot", 0], ["vec", "ot", 2], ["wmma_m", "ot", 8]]}, "result": [[1.5691953000000003e-05], 0, 1.473093032836914, 1668103569.1773617], "version": 0.2, "tvm_version": "0.8.0"}
{"input": ["cuda -keys=cuda,gpu -max_num_threads=1024 -thread_warp_size=32", "dense_tensorcore.cuda", [["TENSOR", [208, 512], "float16"], ["TENSOR", [1536, 512], "float16"]], {}], "config": {"index": 6276, "code_hash": null, "entity": [["block_row_warps", "ot", 1], ["block_col_warps", "ot", 2], ["warp_row_tiles", "ot", 2], ["warp_col_tiles", "ot", 2], ["chunk", "ot", 2], ["offset", "ot", 8], ["offsetCS", "ot", 8], ["vec", "ot", 1], ["wmma_m", "ot", 8]]}, "result": [[2.0476476e-05], 0, 1.464921474456787, 1668103569.7219596], "version": 0.2, "tvm_version": "0.8.0"}
{"input": ["cuda -keys=cuda,gpu -max_num_threads=1024 -thread_warp_size=32", "dense_tensorcore.cuda", [["TENSOR", [208, 512], "float16"], ["TENSOR", [1536, 512], "float16"]], {}], "config": {"index": 492, "code_hash": null, "entity": [["block_row_warps", "ot", 1], ["block_col_warps", "ot", 4], ["warp_row_tiles", "ot", 1], ["warp_col_tiles", "ot", 1], ["chunk", "ot", 4], ["offset", "ot", 8], ["offsetCS", "ot", 0], ["vec", "ot", 1], ["wmma_m", "ot", 16]]}, "result": [[1.4209177e-05], 0, 1.169368028640747, 1668103570.2246988], "version": 0.2, "tvm_version": "0.8.0"}
{"input": ["cuda -keys=cuda,gpu -max_num_threads=1024 -thread_warp_size=32", "dense_tensorcore.cuda", [["TENSOR", [208, 512], "float16"], ["TENSOR", [1536, 512], "float16"]], {}], "config": {"index": 6672, "code_hash": null, "entity": [["block_row_warps", "ot", 1], ["block_col_warps", "ot", 2], ["warp_row_tiles", "ot", 1], ["warp_col_tiles", "ot", 2], ["chunk", "ot", 4], ["offset", "ot", 0], ["offsetCS", "ot", 0], ["vec", "ot", 2], ["wmma_m", "ot", 8]]}, "result": [[3.1850282e-05], 0, 1.4397907257080078, 1668103570.8363907], "version": 0.2, "tvm_version": "0.8.0"}
{"input": ["cuda -keys=cuda,gpu -max_num_threads=1024 -thread_warp_size=32", "dense_tensorcore.cuda", [["TENSOR", [208, 512], "float16"], ["TENSOR", [1536, 512], "float16"]], {}], "config": {"index": 4380, "code_hash": null, "entity": [["block_row_warps", "ot", 1], ["block_col_warps", "ot", 4], ["warp_row_tiles", "ot", 1], ["warp_col_tiles", "ot", 1], ["chunk", "ot", 4], ["offset", "ot", 8], ["offsetCS", "ot", 0], ["vec", "ot", 8], ["wmma_m", "ot", 16]]}, "result": [[1.0189973e-05], 0, 1.3732151985168457, 1668103571.3382275], "version": 0.2, "tvm_version": "0.8.0"}
{"input": ["cuda -keys=cuda,gpu -max_num_threads=1024 -thread_warp_size=32", "dense_tensorcore.cuda", [["TENSOR", [208, 512], "float16"], ["TENSOR", [1536, 512], "float16"]], {}], "config": {"index": 4296, "code_hash": null, "entity": [["block_row_warps", "ot", 1], ["block_col_warps", "ot", 2], ["warp_row_tiles", "ot", 1], ["warp_col_tiles", "ot", 1], ["chunk", "ot", 2], ["offset", "ot", 8], ["offsetCS", "ot", 0], ["vec", "ot", 8], ["wmma_m", "ot", 16]]}, "result": [[1.4009058e-05], 0, 1.3530158996582031, 1668103571.8460407], "version": 0.2, "tvm_version": "0.8.0"}
{"input": ["cuda -keys=cuda,gpu -max_num_threads=1024 -thread_warp_size=32", "dense_tensorcore.cuda", [["TENSOR", [208, 512], "float16"], ["TENSOR", [1536, 512], "float16"]], {}], "config": {"index": 1812, "code_hash": null, "entity": [["block_row_warps", "ot", 1], ["block_col_warps", "ot", 2], ["warp_row_tiles", "ot", 1], ["warp_col_tiles", "ot", 2], ["chunk", "ot", 4], ["offset", "ot", 8], ["offsetCS", "ot", 0], ["vec", "ot", 2], ["wmma_m", "ot", 16]]}, "result": [[1.0533944999999999e-05], 0, 1.324749231338501, 1668103572.397511], "version": 0.2, "tvm_version": "0.8.0"}
{"input": ["cuda -keys=cuda,gpu -max_num_threads=1024 -thread_warp_size=32", "dense_tensorcore.cuda", [["TENSOR", [208, 512], "float16"], ["TENSOR", [1536, 512], "float16"]], {}], "config": {"index": 5280, "code_hash": null, "entity": [["block_row_warps", "ot", 1], ["block_col_warps", "ot", 4], ["warp_row_tiles", "ot", 2], ["warp_col_tiles", "ot", 1], ["chunk", "ot", 2], ["offset", "ot", 0], ["offsetCS", "ot", 0], ["vec", "ot", 1], ["wmma_m", "ot", 8]]}, "result": [[2.4327872e-05], 0, 1.3334829807281494, 1668103572.9326632], "version": 0.2, "tvm_version": "0.8.0"}
{"input": ["cuda -keys=cuda,gpu -max_num_threads=1024 -thread_warp_size=32", "dense_tensorcore.cuda", [["TENSOR", [208, 512], "float16"], ["TENSOR", [1536, 512], "float16"]], {}], "config": {"index": 3972, "code_hash": null, "entity": [["block_row_warps", "ot", 1], ["block_col_warps", "ot", 2], ["warp_row_tiles", "ot", 1], ["warp_col_tiles", "ot", 1], ["chunk", "ot", 2], ["offset", "ot", 0], ["offsetCS", "ot", 0], ["vec", "ot", 8], ["wmma_m", "ot", 16]]}, "result": [[1.8686773e-05], 0, 1.0424976348876953, 1668103573.4621818], "version": 0.2, "tvm_version": "0.8.0"}
{"input": ["cuda -keys=cuda,gpu -max_num_threads=1024 -thread_warp_size=32", "dense_tensorcore.cuda", [["TENSOR", [208, 512], "float16"], ["TENSOR", [1536, 512], "float16"]], {}], "config": {"index": 1056, "code_hash": null, "entity": [["block_row_warps", "ot", 1], ["block_col_warps", "ot", 2], ["warp_row_tiles", "ot", 1], ["warp_col_tiles", "ot", 1], ["chunk", "ot", 2], ["offset", "ot", 8], ["offsetCS", "ot", 8], ["vec", "ot", 1], ["wmma_m", "ot", 16]]}, "result": [[1.7168281e-05], 0, 1.3842799663543701, 1668103574.015764], "version": 0.2, "tvm_version": "0.8.0"}
{"input": ["cuda -keys=cuda,gpu -max_num_threads=1024 -thread_warp_size=32", "dense_tensorcore.cuda", [["TENSOR", [208, 512], "float16"], ["TENSOR", [1536, 512], "float16"]], {}], "config": {"index": 5277, "code_hash": null, "entity": [["block_row_warps", "ot", 1], ["block_col_warps", "ot", 2], ["warp_row_tiles", "ot", 2], ["warp_col_tiles", "ot", 1], ["chunk", "ot", 2], ["offset", "ot", 0], ["offsetCS", "ot", 0], ["vec", "ot", 1], ["wmma_m", "ot", 8]]}, "result": [[2.2917543e-05], 0, 1.3937914371490479, 1668103574.5476649], "version": 0.2, "tvm_version": "0.8.0"}
{"input": ["cuda -keys=cuda,gpu -max_num_threads=1024 -thread_warp_size=32", "dense_tensorcore.cuda", [["TENSOR", [208, 512], "float16"], ["TENSOR", [1536, 512], "float16"]], {}], "config": {"index": 6600, "code_hash": null, "entity": [["block_row_warps", "ot", 1], ["block_col_warps", "ot", 2], ["warp_row_tiles", "ot", 2], ["warp_col_tiles", "ot", 2], ["chunk", "ot", 2], ["offset", "ot", 0], ["offsetCS", "ot", 0], ["vec", "ot", 2], ["wmma_m", "ot", 8]]}, "result": [[2.2176065999999996e-05], 0, 1.0384809970855713, 1668103575.0882103], "version": 0.2, "tvm_version": "0.8.0"}
{"input": ["cuda -keys=cuda,gpu -max_num_threads=1024 -thread_warp_size=32", "dense_tensorcore.cuda", [["TENSOR", [208, 512], "float16"], ["TENSOR", [1536, 512], "float16"]], {}], "config": {"index": 1731, "code_hash": null, "entity": [["block_row_warps", "ot", 1], ["block_col_warps", "ot", 2], ["warp_row_tiles", "ot", 1], ["warp_col_tiles", "ot", 2], ["chunk", "ot", 2], ["offset", "ot", 8], ["offsetCS", "ot", 0], ["vec", "ot", 2], ["wmma_m", "ot", 16]]}, "result": [[1.3780334e-05], 0, 1.4024648666381836, 1668103575.6409729], "version": 0.2, "tvm_version": "0.8.0"}
{"input": ["cuda -keys=cuda,gpu -max_num_threads=1024 -thread_warp_size=32", "dense_tensorcore.cuda", [["TENSOR", [208, 512], "float16"], ["TENSOR", [1536, 512], "float16"]], {}], "config": {"index": 1704, "code_hash": null, "entity": [["block_row_warps", "ot", 1], ["block_col_warps", "ot", 2], ["warp_row_tiles", "ot", 1], ["warp_col_tiles", "ot", 1], ["chunk", "ot", 2], ["offset", "ot", 8], ["offsetCS", "ot", 0], ["vec", "ot", 2], ["wmma_m", "ot", 16]]}, "result": [[1.4527276e-05], 0, 1.3352155685424805, 1668103576.1447797], "version": 0.2, "tvm_version": "0.8.0"}
{"input": ["cuda -keys=cuda,gpu -max_num_threads=1024 -thread_warp_size=32", "dense_tensorcore.cuda", [["TENSOR", [208, 512], "float16"], ["TENSOR", [1536, 512], "float16"]], {}], "config": {"index": 5593, "code_hash": null, "entity": [["block_row_warps", "ot", 2], ["block_col_warps", "ot", 2], ["warp_row_tiles", "ot", 1], ["warp_col_tiles", "ot", 1], ["chunk", "ot", 2], ["offset", "ot", 8], ["offsetCS", "ot", 0], ["vec", "ot", 1], ["wmma_m", "ot", 8]]}, "result": [[1.9314749e-05], 0, 1.358954906463623, 1668103576.6598876], "version": 0.2, "tvm_version": "0.8.0"}
{"input": ["cuda -keys=cuda,gpu -max_num_threads=1024 -thread_warp_size=32", "dense_tensorcore.cuda", [["TENSOR", [208, 512], "float16"], ["TENSOR", [1536, 512], "float16"]], {}], "config": {"index": 4623, "code_hash": null, "entity": [["block_row_warps", "ot", 1], ["block_col_warps", "ot", 4], ["warp_row_tiles", "ot", 1], ["warp_col_tiles", "ot", 1], ["chunk", "ot", 2], ["offset", "ot", 0], ["offsetCS", "ot", 8], ["vec", "ot", 8], ["wmma_m", "ot", 16]]}, "result": [[2.4266501999999998e-05], 0, 1.389725685119629, 1668103577.2341416], "version": 0.2, "tvm_version": "0.8.0"}
{"input": ["cuda -keys=cuda,gpu -max_num_threads=1024 -thread_warp_size=32", "dense_tensorcore.cuda", [["TENSOR", [208, 512], "float16"], ["TENSOR", [1536, 512], "float16"]], {}], "config": {"index": 6978, "code_hash": null, "entity": [["block_row_warps", "ot", 1], ["block_col_warps", "ot", 2], ["warp_row_tiles", "ot", 2], ["warp_col_tiles", "ot", 1], ["chunk", "ot", 4], ["offset", "ot", 8], ["offsetCS", "ot", 0], ["vec", "ot", 2], ["wmma_m", "ot", 8]]}, "result": [[1.0978821e-05], 0, 1.2986116409301758, 1668103577.7372322], "version": 0.2, "tvm_version": "0.8.0"}
{"input": ["cuda -keys=cuda,gpu -max_num_threads=1024 -thread_warp_size=32", "dense_tensorcore.cuda", [["TENSOR", [208, 512], "float16"], ["TENSOR", [1536, 512], "float16"]], {}], "config": {"index": 9888, "code_hash": null, "entity": [["block_row_warps", "ot", 1], ["block_col_warps", "ot", 4], ["warp_row_tiles", "ot", 1], ["warp_col_tiles", "ot", 1], ["chunk", "ot", 4], ["offset", "ot", 0], ["offsetCS", "ot", 8], ["vec", "ot", 8], ["wmma_m", "ot", 8]]}, "result": [[3.5064018e-05], 0, 1.3701839447021484, 1668103578.307137], "version": 0.2, "tvm_version": "0.8.0"}
{"input": ["cuda -keys=cuda,gpu -max_num_threads=1024 -thread_warp_size=32", "dense_tensorcore.cuda", [["TENSOR", [208, 512], "float16"], ["TENSOR", [1536, 512], "float16"]], {}], "config": {"index": 6645, "code_hash": null, "entity": [["block_row_warps", "ot", 1], ["block_col_warps", "ot", 2], ["warp_row_tiles", "ot", 1], ["warp_col_tiles", "ot", 1], ["chunk", "ot", 4], ["offset", "ot", 0], ["offsetCS", "ot", 0], ["vec", "ot", 2], ["wmma_m", "ot", 8]]}, "result": [[3.3482525e-05], 0, 1.456345558166504, 1668103578.9203389], "version": 0.2, "tvm_version": "0.8.0"}
{"input": ["cuda -keys=cuda,gpu -max_num_threads=1024 -thread_warp_size=32", "dense_tensorcore.cuda", [["TENSOR", [208, 512], "float16"], ["TENSOR", [1536, 512], "float16"]], {}], "config": {"index": 9805, "code_hash": null, "entity": [["block_row_warps", "ot", 2], ["block_col_warps", "ot", 2], ["warp_row_tiles", "ot", 1], ["warp_col_tiles", "ot", 1], ["chunk", "ot", 2], ["offset", "ot", 0], ["offsetCS", "ot", 8], ["vec", "ot", 8], ["wmma_m", "ot", 8]]}, "result": [[2.7940767e-05], 0, 1.3874101638793945, 1668103579.4632688], "version": 0.2, "tvm_version": "0.8.0"}
{"input": ["cuda -keys=cuda,gpu -max_num_threads=1024 -thread_warp_size=32", "dense_tensorcore.cuda", [["TENSOR", [208, 512], "float16"], ["TENSOR", [1536, 512], "float16"]], {}], "config": {"index": 5601, "code_hash": null, "entity": [["block_row_warps", "ot", 1], ["block_col_warps", "ot", 2], ["warp_row_tiles", "ot", 2], ["warp_col_tiles", "ot", 1], ["chunk", "ot", 2], ["offset", "ot", 8], ["offsetCS", "ot", 0], ["vec", "ot", 1], ["wmma_m", "ot", 8]]}, "result": [[1.8202638e-05], 0, 1.3679633140563965, 1668103579.9838696], "version": 0.2, "tvm_version": "0.8.0"}
{"input": ["cuda -keys=cuda,gpu -max_num_threads=1024 -thread_warp_size=32", "dense_tensorcore.cuda", [["TENSOR", [208, 512], "float16"], ["TENSOR", [1536, 512], "float16"]], {}], "config": {"index": 4056, "code_hash": null, "entity": [["block_row_warps", "ot", 1], ["block_col_warps", "ot", 4], ["warp_row_tiles", "ot", 1], ["warp_col_tiles", "ot", 1], ["chunk", "ot", 4], ["offset", "ot", 0], ["offsetCS", "ot", 0], ["vec", "ot", 8], ["wmma_m", "ot", 16]]}, "result": [[2.5728074e-05], 0, 1.3728094100952148, 1668103580.5780368], "version": 0.2, "tvm_version": "0.8.0"}
{"input": ["cuda -keys=cuda,gpu -max_num_threads=1024 -thread_warp_size=32", "dense_tensorcore.cuda", [["TENSOR", [208, 512], "float16"], ["TENSOR", [1536, 512], "float16"]], {}], "config": {"index": 7005, "code_hash": null, "entity": [["block_row_warps", "ot", 1], ["block_col_warps", "ot", 2], ["warp_row_tiles", "ot", 2], ["warp_col_tiles", "ot", 2], ["chunk", "ot", 4], ["offset", "ot", 8], ["offsetCS", "ot", 0], ["vec", "ot", 2], ["wmma_m", "ot", 8]]}, "result": [[1.3334491000000001e-05], 0, 1.4035770893096924, 1668103581.0998325], "version": 0.2, "tvm_version": "0.8.0"}
{"input": ["cuda -keys=cuda,gpu -max_num_threads=1024 -thread_warp_size=32", "dense_tensorcore.cuda", [["TENSOR", [208, 512], "float16"], ["TENSOR", [1536, 512], "float16"]], {}], "config": {"index": 6996, "code_hash": null, "entity": [["block_row_warps", "ot", 1], ["block_col_warps", "ot", 2], ["warp_row_tiles", "ot", 1], ["warp_col_tiles", "ot", 2], ["chunk", "ot", 4], ["offset", "ot", 8], ["offsetCS", "ot", 0], ["vec", "ot", 2], ["wmma_m", "ot", 8]]}, "result": [[1.5360706e-05], 0, 1.297029733657837, 1668103581.624321], "version": 0.2, "tvm_version": "0.8.0"}
{"input": ["cuda -keys=cuda,gpu -max_num_threads=1024 -thread_warp_size=32", "dense_tensorcore.cuda", [["TENSOR", [208, 512], "float16"], ["TENSOR", [1536, 512], "float16"]], {}], "config": {"index": 4944, "code_hash": null, "entity": [["block_row_warps", "ot", 1], ["block_col_warps", "ot", 2], ["warp_row_tiles", "ot", 1], ["warp_col_tiles", "ot", 1], ["chunk", "ot", 2], ["offset", "ot", 8], ["offsetCS", "ot", 8], ["vec", "ot", 8], ["wmma_m", "ot", 16]]}, "result": [[1.3858382e-05], 0, 1.1058061122894287, 1668103582.1739895], "version": 0.2, "tvm_version": "0.8.0"}
{"input": ["cuda -keys=cuda,gpu -max_num_threads=1024 -thread_warp_size=32", "dense_tensorcore.cuda", [["TENSOR", [208, 512], "float16"], ["TENSOR", [1536, 512], "float16"]], {}], "config": {"index": 5620, "code_hash": null, "entity": [["block_row_warps", "ot", 2], ["block_col_warps", "ot", 2], ["warp_row_tiles", "ot", 1], ["warp_col_tiles", "ot", 2], ["chunk", "ot", 2], ["offset", "ot", 8], ["offsetCS", "ot", 0], ["vec", "ot", 1], ["wmma_m", "ot", 8]]}, "result": [[2.3715322e-05], 0, 0.8835082054138184, 1668103583.3216622], "version": 0.2, "tvm_version": "0.8.0"}
{"input": ["cuda -keys=cuda,gpu -max_num_threads=1024 -thread_warp_size=32", "dense_tensorcore.cuda", [["TENSOR", [208, 512], "float16"], ["TENSOR", [1536, 512], "float16"]], {}], "config": {"index": 5361, "code_hash": null, "entity": [["block_row_warps", "ot", 1], ["block_col_warps", "ot", 4], ["warp_row_tiles", "ot", 2], ["warp_col_tiles", "ot", 1], ["chunk", "ot", 4], ["offset", "ot", 0], ["offsetCS", "ot", 0], ["vec", "ot", 1], ["wmma_m", "ot", 8]]}, "result": [[3.2076448e-05], 0, 1.106579303741455, 1668103583.8967087], "version": 0.2, "tvm_version": "0.8.0"}
{"input": ["cuda -keys=cuda,gpu -max_num_threads=1024 -thread_warp_size=32", "dense_tensorcore.cuda", [["TENSOR", [208, 512], "float16"], ["TENSOR", [1536, 512], "float16"]], {}], "config": {"index": 9237, "code_hash": null, "entity": [["block_row_warps", "ot", 1], ["block_col_warps", "ot", 2], ["warp_row_tiles", "ot", 1], ["warp_col_tiles", "ot", 1], ["chunk", "ot", 4], ["offset", "ot", 0], ["offsetCS", "ot", 0], ["vec", "ot", 8], ["wmma_m", "ot", 8]]}, "result": [[3.3176959e-05], 0, 0.9984111785888672, 1668103584.5132504], "version": 0.2, "tvm_version": "0.8.0"}
{"input": ["cuda -keys=cuda,gpu -max_num_threads=1024 -thread_warp_size=32", "dense_tensorcore.cuda", [["TENSOR", [208, 512], "float16"], ["TENSOR", [1536, 512], "float16"]], {}], "config": {"index": 9240, "code_hash": null, "entity": [["block_row_warps", "ot", 1], ["block_col_warps", "ot", 4], ["warp_row_tiles", "ot", 1], ["warp_col_tiles", "ot", 1], ["chunk", "ot", 4], ["offset", "ot", 0], ["offsetCS", "ot", 0], ["vec", "ot", 8], ["wmma_m", "ot", 8]]}, "result": [[3.5180283e-05], 0, 0.9483394622802734, 1668103585.085327], "version": 0.2, "tvm_version": "0.8.0"}
{"input": ["cuda -keys=cuda,gpu -max_num_threads=1024 -thread_warp_size=32", "dense_tensorcore.cuda", [["TENSOR", [208, 512], "float16"], ["TENSOR", [1536, 512], "float16"]], {}], "config": {"index": 4620, "code_hash": null, "entity": [["block_row_warps", "ot", 1], ["block_col_warps", "ot", 2], ["warp_row_tiles", "ot", 1], ["warp_col_tiles", "ot", 1], ["chunk", "ot", 2], ["offset", "ot", 0], ["offsetCS", "ot", 8], ["vec", "ot", 8], ["wmma_m", "ot", 16]]}, "result": [[1.8662657e-05], 0, 0.8905947208404541, 1668103585.6136484], "version": 0.2, "tvm_version": "0.8.0"}
{"input": ["cuda -keys=cuda,gpu -max_num_threads=1024 -thread_warp_size=32", "dense_tensorcore.cuda", [["TENSOR", [208, 512], "float16"], ["TENSOR", [1536, 512], "float16"]], {}], "config": {"index": 5925, "code_hash": null, "entity": [["block_row_warps", "ot", 1], ["block_col_warps", "ot", 2], ["warp_row_tiles", "ot", 2], ["warp_col_tiles", "ot", 1], ["chunk", "ot", 2], ["offset", "ot", 0], ["offsetCS", "ot", 8], ["vec", "ot", 1], ["wmma_m", "ot", 8]]}, "result": [[2.2780682e-05], 0, 0.9851713180541992, 1668103586.1919558], "version": 0.2, "tvm_version": "0.8.0"}
{"input": ["cuda -keys=cuda,gpu -max_num_threads=1024 -thread_warp_size=32", "dense_tensorcore.cuda", [["TENSOR", [208, 512], "float16"], ["TENSOR", [1536, 512], "float16"]], {}], "config": {"index": 10210, "code_hash": null, "entity": [["block_row_warps", "ot", 2], ["block_col_warps", "ot", 2], ["warp_row_tiles", "ot", 1], ["warp_col_tiles", "ot", 1], ["chunk", "ot", 4], ["offset", "ot", 8], ["offsetCS", "ot", 8], ["vec", "ot", 8], ["wmma_m", "ot", 8]]}, "result": [[1.0737613e-05], 0, 0.9408338069915771, 1668103586.7279623], "version": 0.2, "tvm_version": "0.8.0"}
{"input": ["cuda -keys=cuda,gpu -max_num_threads=1024 -thread_warp_size=32", "dense_tensorcore.cuda", [["TENSOR", [208, 512], "float16"], ["TENSOR", [1536, 512], "float16"]], {}], "config": {"index": 5296, "code_hash": null, "entity": [["block_row_warps", "ot", 2], ["block_col_warps", "ot", 2], ["warp_row_tiles", "ot", 1], ["warp_col_tiles", "ot", 2], ["chunk", "ot", 2], ["offset", "ot", 0], ["offsetCS", "ot", 0], ["vec", "ot", 1], ["wmma_m", "ot", 8]]}, "result": [[3.1538574e-05], 0, 0.9610671997070312, 1668103587.2833314], "version": 0.2, "tvm_version": "0.8.0"}
{"input": ["cuda -keys=cuda,gpu -max_num_threads=1024 -thread_warp_size=32", "dense_tensorcore.cuda", [["TENSOR", [208, 512], "float16"], ["TENSOR", [1536, 512], "float16"]], {}], "config": {"index": 5377, "code_hash": null, "entity": [["block_row_warps", "ot", 2], ["block_col_warps", "ot", 2], ["warp_row_tiles", "ot", 1], ["warp_col_tiles", "ot", 2], ["chunk", "ot", 4], ["offset", "ot", 0], ["offsetCS", "ot", 0], ["vec", "ot", 1], ["wmma_m", "ot", 8]]}, "result": [[4.0050938000000004e-05], 0, 1.1648714542388916, 1668103587.9399445], "version": 0.2, "tvm_version": "0.8.0"}
{"input": ["cuda -keys=cuda,gpu -max_num_threads=1024 -thread_warp_size=32", "dense_tensorcore.cuda", [["TENSOR", [208, 512], "float16"], ["TENSOR", [1536, 512], "float16"]], {}], "config": {"index": 9886, "code_hash": null, "entity": [["block_row_warps", "ot", 2], ["block_col_warps", "ot", 2], ["warp_row_tiles", "ot", 1], ["warp_col_tiles", "ot", 1], ["chunk", "ot", 4], ["offset", "ot", 0], ["offsetCS", "ot", 8], ["vec", "ot", 8], ["wmma_m", "ot", 8]]}, "result": [[2.944893e-05], 0, 0.924180269241333, 1668103588.4984324], "version": 0.2, "tvm_version": "0.8.0"}
{"input": ["cuda -keys=cuda,gpu -max_num_threads=1024 -thread_warp_size=32", "dense_tensorcore.cuda", [["TENSOR", [208, 512], "float16"], ["TENSOR", [1536, 512], "float16"]], {}], "config": {"index": 5952, "code_hash": null, "entity": [["block_row_warps", "ot", 1], ["block_col_warps", "ot", 2], ["warp_row_tiles", "ot", 2], ["warp_col_tiles", "ot", 2], ["chunk", "ot", 2], ["offset", "ot", 0], ["offsetCS", "ot", 8], ["vec", "ot", 1], ["wmma_m", "ot", 8]]}, "result": [[2.9082274000000003e-05], 0, 1.0332534313201904, 1668103589.077755], "version": 0.2, "tvm_version": "0.8.0"}
{"input": ["cuda -keys=cuda,gpu -max_num_threads=1024 -thread_warp_size=32", "dense_tensorcore.cuda", [["TENSOR", [208, 512], "float16"], ["TENSOR", [1536, 512], "float16"]], {}], "config": {"index": 5350, "code_hash": null, "entity": [["block_row_warps", "ot", 2], ["block_col_warps", "ot", 2], ["warp_row_tiles", "ot", 1], ["warp_col_tiles", "ot", 1], ["chunk", "ot", 4], ["offset", "ot", 0], ["offsetCS", "ot", 0], ["vec", "ot", 1], ["wmma_m", "ot", 8]]}, "result": [[3.3263018999999995e-05], 0, 0.9968407154083252, 1668103589.6902006], "version": 0.2, "tvm_version": "0.8.0"}
{"input": ["cuda -keys=cuda,gpu -max_num_threads=1024 -thread_warp_size=32", "dense_tensorcore.cuda", [["TENSOR", [208, 512], "float16"], ["TENSOR", [1536, 512], "float16"]], {}], "config": {"index": 6969, "code_hash": null, "entity": [["block_row_warps", "ot", 1], ["block_col_warps", "ot", 2], ["warp_row_tiles", "ot", 1], ["warp_col_tiles", "ot", 1], ["chunk", "ot", 4], ["offset", "ot", 8], ["offsetCS", "ot", 0], ["vec", "ot", 2], ["wmma_m", "ot", 8]]}, "result": [[1.4383758e-05], 0, 0.9988079071044922, 1668103590.1957371], "version": 0.2, "tvm_version": "0.8.0"}
{"input": ["cuda -keys=cuda,gpu -max_num_threads=1024 -thread_warp_size=32", "dense_tensorcore.cuda", [["TENSOR", [208, 512], "float16"], ["TENSOR", [1536, 512], "float16"]], {}], "config": {"index": 9159, "code_hash": null, "entity": [["block_row_warps", "ot", 1], ["block_col_warps", "ot", 4], ["warp_row_tiles", "ot", 1], ["warp_col_tiles", "ot", 1], ["chunk", "ot", 2], ["offset", "ot", 0], ["offsetCS", "ot", 0], ["vec", "ot", 8], ["wmma_m", "ot", 8]]}, "result": [[2.9909096000000004e-05], 0, 1.030956745147705, 1668103590.7519314], "version": 0.2, "tvm_version": "0.8.0"}
{"input": ["cuda -keys=cuda,gpu -max_num_threads=1024 -thread_warp_size=32", "dense_tensorcore.cuda", [["TENSOR", [208, 512], "float16"], ["TENSOR", [1536, 512], "float16"]], {}], "config": {"index": 10212, "code_hash": null, "entity": [["block_row_warps", "ot", 1], ["block_col_warps", "ot", 4], ["warp_row_tiles", "ot", 1], ["warp_col_tiles", "ot", 1], ["chunk", "ot", 4], ["offset", "ot", 8], ["offsetCS", "ot", 8], ["vec", "ot", 8], ["wmma_m", "ot", 8]]}, "result": [[1.5582872e-05], 0, 1.0393438339233398, 1668103591.3067758], "version": 0.2, "tvm_version": "0.8.0"}
{"input": ["cuda -keys=cuda,gpu -max_num_threads=1024 -thread_warp_size=32", "dense_tensorcore.cuda", [["TENSOR", [208, 512], "float16"], ["TENSOR", [1536, 512], "float16"]], {}], "config": {"index": 6249, "code_hash": null, "entity": [["block_row_warps", "ot", 1], ["block_col_warps", "ot", 2], ["warp_row_tiles", "ot", 2], ["warp_col_tiles", "ot", 1], ["chunk", "ot", 2], ["offset", "ot", 8], ["offsetCS", "ot", 8], ["vec", "ot", 1], ["wmma_m", "ot", 8]]}, "result": [[1.8013072999999998e-05], 0, 0.8699855804443359, 1668103591.8196042], "version": 0.2, "tvm_version": "0.8.0"}
{"input": ["cuda -keys=cuda,gpu -max_num_threads=1024 -thread_warp_size=32", "dense_tensorcore.cuda", [["TENSOR", [208, 512], "float16"], ["TENSOR", [1536, 512], "float16"]], {}], "config": {"index": 9885, "code_hash": null, "entity": [["block_row_warps", "ot", 1], ["block_col_warps", "ot", 2], ["warp_row_tiles", "ot", 1], ["warp_col_tiles", "ot", 1], ["chunk", "ot", 4], ["offset", "ot", 0], ["offsetCS", "ot", 8], ["vec", "ot", 8], ["wmma_m", "ot", 8]]}, "result": [[3.3050757e-05], 0, 0.9626247882843018, 1668103592.38856], "version": 0.2, "tvm_version": "0.8.0"}
{"input": ["cuda -keys=cuda,gpu -max_num_threads=1024 -thread_warp_size=32", "dense_tensorcore.cuda", [["TENSOR", [208, 512], "float16"], ["TENSOR", [1536, 512], "float16"]], {}], "config": {"index": 9562, "code_hash": null, "entity": [["block_row_warps", "ot", 2], ["block_col_warps", "ot", 2], ["warp_row_tiles", "ot", 1], ["warp_col_tiles", "ot", 1], ["chunk", "ot", 4], ["offset", "ot", 8], ["offsetCS", "ot", 0], ["vec", "ot", 8], ["wmma_m", "ot", 8]]}, "result": [[1.1050683e-05], 0, 0.9104185104370117, 1668103592.9354947], "version": 0.2, "tvm_version": "0.8.0"}
{"input": ["cuda -keys=cuda,gpu -max_num_threads=1024 -thread_warp_size=32", "dense_tensorcore.cuda", [["TENSOR", [208, 512], "float16"], ["TENSOR", [1536, 512], "float16"]], {}], "config": {"index": 6897, "code_hash": null, "entity": [["block_row_warps", "ot", 1], ["block_col_warps", "ot", 2], ["warp_row_tiles", "ot", 2], ["warp_col_tiles", "ot", 1], ["chunk", "ot", 2], ["offset", "ot", 8], ["offsetCS", "ot", 0], ["vec", "ot", 2], ["wmma_m", "ot", 8]]}, "result": [[1.3723621e-05], 0, 0.8622703552246094, 1668103593.4353845], "version": 0.2, "tvm_version": "0.8.0"}
{"input": ["cuda -keys=cuda,gpu -max_num_threads=1024 -thread_warp_size=32", "dense_tensorcore.cuda", [["TENSOR", [208, 512], "float16"], ["TENSOR", [1536, 512], "float16"]], {}], "config": {"index": 5604, "code_hash": null, "entity": [["block_row_warps", "ot", 1], ["block_col_warps", "ot", 4], ["warp_row_tiles", "ot", 2], ["warp_col_tiles", "ot", 1], ["chunk", "ot", 2], ["offset", "ot", 8], ["offsetCS", "ot", 0], ["vec", "ot", 1], ["wmma_m", "ot", 8]]}, "result": [[1.8720237999999998e-05], 0, 1.002465009689331, 1668103593.9536462], "version": 0.2, "tvm_version": "0.8.0"}
{"input": ["cuda -keys=cuda,gpu -max_num_threads=1024 -thread_warp_size=32", "dense_tensorcore.cuda", [["TENSOR", [208, 512], "float16"], ["TENSOR", [1536, 512], "float16"]], {}], "config": {"index": 5628, "code_hash": null, "entity": [["block_row_warps", "ot", 1], ["block_col_warps", "ot", 2], ["warp_row_tiles", "ot", 2], ["warp_col_tiles", "ot", 2], ["chunk", "ot", 2], ["offset", "ot", 8], ["offsetCS", "ot", 0], ["vec", "ot", 1], ["wmma_m", "ot", 8]]}, "result": [[2.0695616e-05], 0, 0.9981992244720459, 1668103594.539442], "version": 0.2, "tvm_version": "0.8.0"}
{"input": ["cuda -keys=cuda,gpu -max_num_threads=1024 -thread_warp_size=32", "dense_tensorcore.cuda", [["TENSOR", [208, 512], "float16"], ["TENSOR", [1536, 512], "float16"]], {}], "config": {"index": 6819, "code_hash": null, "entity": [["block_row_warps", "ot", 1], ["block_col_warps", "ot", 4], ["warp_row_tiles", "ot", 2], ["warp_col_tiles", "ot", 1], ["chunk", "ot", 1], ["offset", "ot", 8], ["offsetCS", "ot", 0], ["vec", "ot", 2], ["wmma_m", "ot", 8]]}, "result": [[1.9514397e-05], 0, 0.8610982894897461, 1668103595.060475], "version": 0.2, "tvm_version": "0.8.0"}
{"input": ["cuda -keys=cuda,gpu -max_num_threads=1024 -thread_warp_size=32", "dense_tensorcore.cuda", [["TENSOR", [208, 512], "float16"], ["TENSOR", [1536, 512], "float16"]], {}], "config": {"index": 8274, "code_hash": null, "entity": [["block_row_warps", "ot", 1], ["block_col_warps", "ot", 2], ["warp_row_tiles", "ot", 2], ["warp_col_tiles", "ot", 1], ["chunk", "ot", 4], ["offset", "ot", 8], ["offsetCS", "ot", 0], ["vec", "ot", 4], ["wmma_m", "ot", 8]]}, "result": [[1.0262033999999999e-05], 0, 0.9129083156585693, 1668103595.5613725], "version": 0.2, "tvm_version": "0.8.0"}
{"input": ["cuda -keys=cuda,gpu -max_num_threads=1024 -thread_warp_size=32", "dense_tensorcore.cuda", [["TENSOR", [208, 512], "float16"], ["TENSOR", [1536, 512], "float16"]], {}], "config": {"index": 4377, "code_hash": null, "entity": [["block_row_warps", "ot", 1], ["block_col_warps", "ot", 2], ["warp_row_tiles", "ot", 1], ["warp_col_tiles", "ot", 1], ["chunk", "ot", 4], ["offset", "ot", 8], ["offsetCS", "ot", 0], ["vec", "ot", 8], ["wmma_m", "ot", 16]]}, "result": [[1.1487119e-05], 0, 1.2873420715332031, 1668103606.495025], "version": 0.2, "tvm_version": "0.8.0"}
{"input": ["cuda -keys=cuda,gpu -max_num_threads=1024 -thread_warp_size=32", "dense_tensorcore.cuda", [["TENSOR", [208, 512], "float16"], ["TENSOR", [1536, 512], "float16"]], {}], "config": {"index": 4458, "code_hash": null, "entity": [["block_row_warps", "ot", 1], ["block_col_warps", "ot", 2], ["warp_row_tiles", "ot", 1], ["warp_col_tiles", "ot", 1], ["chunk", "ot", 8], ["offset", "ot", 8], ["offsetCS", "ot", 0], ["vec", "ot", 8], ["wmma_m", "ot", 16]]}, "result": [[1.0933368e-05], 0, 1.376516342163086, 1668103607.0382917], "version": 0.2, "tvm_version": "0.8.0"}
{"input": ["cuda -keys=cuda,gpu -max_num_threads=1024 -thread_warp_size=32", "dense_tensorcore.cuda", [["TENSOR", [208, 512], "float16"], ["TENSOR", [1536, 512], "float16"]], {}], "config": {"index": 3108, "code_hash": null, "entity": [["block_row_warps", "ot", 1], ["block_col_warps", "ot", 2], ["warp_row_tiles", "ot", 1], ["warp_col_tiles", "ot", 2], ["chunk", "ot", 4], ["offset", "ot", 8], ["offsetCS", "ot", 0], ["vec", "ot", 4], ["wmma_m", "ot", 16]]}, "result": [[1.0611136000000001e-05], 0, 1.2611868381500244, 1668103607.539405], "version": 0.2, "tvm_version": "0.8.0"}
{"input": ["cuda -keys=cuda,gpu -max_num_threads=1024 -thread_warp_size=32", "dense_tensorcore.cuda", [["TENSOR", [208, 512], "float16"], ["TENSOR", [1536, 512], "float16"]], {}], "config": {"index": 5106, "code_hash": null, "entity": [["block_row_warps", "ot", 1], ["block_col_warps", "ot", 2], ["warp_row_tiles", "ot", 1], ["warp_col_tiles", "ot", 1], ["chunk", "ot", 8], ["offset", "ot", 8], ["offsetCS", "ot", 8], ["vec", "ot", 8], ["wmma_m", "ot", 16]]}, "result": [[1.0819625999999998e-05], 0, 1.2378945350646973, 1668103608.0364172], "version": 0.2, "tvm_version": "0.8.0"}
{"input": ["cuda -keys=cuda,gpu -max_num_threads=1024 -thread_warp_size=32", "dense_tensorcore.cuda", [["TENSOR", [208, 512], "float16"], ["TENSOR", [1536, 512], "float16"]], {}], "config": {"index": 5025, "code_hash": null, "entity": [["block_row_warps", "ot", 1], ["block_col_warps", "ot", 2], ["warp_row_tiles", "ot", 1], ["warp_col_tiles", "ot", 1], ["chunk", "ot", 4], ["offset", "ot", 8], ["offsetCS", "ot", 8], ["vec", "ot", 8], ["wmma_m", "ot", 16]]}, "result": [[1.1397875999999999e-05], 0, 1.1243155002593994, 1668103608.5773056], "version": 0.2, "tvm_version": "0.8.0"}
{"input": ["cuda -keys=cuda,gpu -max_num_threads=1024 -thread_warp_size=32", "dense_tensorcore.cuda", [["TENSOR", [208, 512], "float16"], ["TENSOR", [1536, 512], "float16"]], {}], "config": {"index": 9570, "code_hash": null, "entity": [["block_row_warps", "ot", 1], ["block_col_warps", "ot", 2], ["warp_row_tiles", "ot", 2], ["warp_col_tiles", "ot", 1], ["chunk", "ot", 4], ["offset", "ot", 8], ["offsetCS", "ot", 0], ["vec", "ot", 8], ["wmma_m", "ot", 8]]}, "result": [[1.0275351000000001e-05], 0, 1.0210835933685303, 1668103609.071417], "version": 0.2, "tvm_version": "0.8.0"}
{"input": ["cuda -keys=cuda,gpu -max_num_threads=1024 -thread_warp_size=32", "dense_tensorcore.cuda", [["TENSOR", [208, 512], "float16"], ["TENSOR", [1536, 512], "float16"]], {}], "config": {"index": 4404, "code_hash": null, "entity": [["block_row_warps", "ot", 1], ["block_col_warps", "ot", 2], ["warp_row_tiles", "ot", 1], ["warp_col_tiles", "ot", 2], ["chunk", "ot", 4], ["offset", "ot", 8], ["offsetCS", "ot", 0], ["vec", "ot", 8], ["wmma_m", "ot", 16]]}, "result": [[1.0646236e-05], 0, 1.0638577938079834, 1668103609.5655177], "version": 0.2, "tvm_version": "0.8.0"}
{"input": ["cuda -keys=cuda,gpu -max_num_threads=1024 -thread_warp_size=32", "dense_tensorcore.cuda", [["TENSOR", [208, 512], "float16"], ["TENSOR", [1536, 512], "float16"]], {}], "config": {"index": 3732, "code_hash": null, "entity": [["block_row_warps", "ot", 1], ["block_col_warps", "ot", 4], ["warp_row_tiles", "ot", 1], ["warp_col_tiles", "ot", 1], ["chunk", "ot", 4], ["offset", "ot", 8], ["offsetCS", "ot", 8], ["vec", "ot", 4], ["wmma_m", "ot", 16]]}, "result": [[1.0665241999999999e-05], 0, 1.3524131774902344, 1668103610.103063], "version": 0.2, "tvm_version": "0.8.0"}
{"input": ["cuda -keys=cuda,gpu -max_num_threads=1024 -thread_warp_size=32", "dense_tensorcore.cuda", [["TENSOR", [208, 512], "float16"], ["TENSOR", [1536, 512], "float16"]], {}], "config": {"index": 3084, "code_hash": null, "entity": [["block_row_warps", "ot", 1], ["block_col_warps", "ot", 4], ["warp_row_tiles", "ot", 1], ["warp_col_tiles", "ot", 1], ["chunk", "ot", 4], ["offset", "ot", 8], ["offsetCS", "ot", 0], ["vec", "ot", 4], ["wmma_m", "ot", 16]]}, "result": [[1.1044261000000002e-05], 0, 1.171654224395752, 1668103610.6069787], "version": 0.2, "tvm_version": "0.8.0"}
{"input": ["cuda -keys=cuda,gpu -max_num_threads=1024 -thread_warp_size=32", "dense_tensorcore.cuda", [["TENSOR", [208, 512], "float16"], ["TENSOR", [1536, 512], "float16"]], {}], "config": {"index": 4461, "code_hash": null, "entity": [["block_row_warps", "ot", 1], ["block_col_warps", "ot", 4], ["warp_row_tiles", "ot", 1], ["warp_col_tiles", "ot", 1], ["chunk", "ot", 8], ["offset", "ot", 8], ["offsetCS", "ot", 0], ["vec", "ot", 8], ["wmma_m", "ot", 16]]}, "result": [[1.0399856e-05], 0, 1.3084514141082764, 1668103611.1053379], "version": 0.2, "tvm_version": "0.8.0"}
{"input": ["cuda -keys=cuda,gpu -max_num_threads=1024 -thread_warp_size=32", "dense_tensorcore.cuda", [["TENSOR", [208, 512], "float16"], ["TENSOR", [1536, 512], "float16"]], {}], "config": {"index": 8922, "code_hash": null, "entity": [["block_row_warps", "ot", 1], ["block_col_warps", "ot", 2], ["warp_row_tiles", "ot", 2], ["warp_col_tiles", "ot", 1], ["chunk", "ot", 4], ["offset", "ot", 8], ["offsetCS", "ot", 8], ["vec", "ot", 4], ["wmma_m", "ot", 8]]}, "result": [[1.0019721e-05], 0, 1.4009239673614502, 1668103611.6445596], "version": 0.2, "tvm_version": "0.8.0"}
{"input": ["cuda -keys=cuda,gpu -max_num_threads=1024 -thread_warp_size=32", "dense_tensorcore.cuda", [["TENSOR", [208, 512], "float16"], ["TENSOR", [1536, 512], "float16"]], {}], "config": {"index": 3756, "code_hash": null, "entity": [["block_row_warps", "ot", 1], ["block_col_warps", "ot", 2], ["warp_row_tiles", "ot", 1], ["warp_col_tiles", "ot", 2], ["chunk", "ot", 4], ["offset", "ot", 8], ["offsetCS", "ot", 8], ["vec", "ot", 4], ["wmma_m", "ot", 16]]}, "result": [[1.0363168999999998e-05], 0, 1.3495569229125977, 1668103612.1424804], "version": 0.2, "tvm_version": "0.8.0"}
{"input": ["cuda -keys=cuda,gpu -max_num_threads=1024 -thread_warp_size=32", "dense_tensorcore.cuda", [["TENSOR", [208, 512], "float16"], ["TENSOR", [1536, 512], "float16"]], {}], "config": {"index": 3081, "code_hash": null, "entity": [["block_row_warps", "ot", 1], ["block_col_warps", "ot", 2], ["warp_row_tiles", "ot", 1], ["warp_col_tiles", "ot", 1], ["chunk", "ot", 4], ["offset", "ot", 8], ["offsetCS", "ot", 0], ["vec", "ot", 4], ["wmma_m", "ot", 16]]}, "result": [[1.1552085999999999e-05], 0, 1.3744456768035889, 1668103612.6341145], "version": 0.2, "tvm_version": "0.8.0"}
{"input": ["cuda -keys=cuda,gpu -max_num_threads=1024 -thread_warp_size=32", "dense_tensorcore.cuda", [["TENSOR", [208, 512], "float16"], ["TENSOR", [1536, 512], "float16"]], {}], "config": {"index": 7626, "code_hash": null, "entity": [["block_row_warps", "ot", 1], ["block_col_warps", "ot", 2], ["warp_row_tiles", "ot", 2], ["warp_col_tiles", "ot", 1], ["chunk", "ot", 4], ["offset", "ot", 8], ["offsetCS", "ot", 8], ["vec", "ot", 2], ["wmma_m", "ot", 8]]}, "result": [[1.0720186e-05], 0, 1.3719267845153809, 1668103613.1835163], "version": 0.2, "tvm_version": "0.8.0"}
{"input": ["cuda -keys=cuda,gpu -max_num_threads=1024 -thread_warp_size=32", "dense_tensorcore.cuda", [["TENSOR", [208, 512], "float16"], ["TENSOR", [1536, 512], "float16"]], {}], "config": {"index": 4485, "code_hash": null, "entity": [["block_row_warps", "ot", 1], ["block_col_warps", "ot", 2], ["warp_row_tiles", "ot", 1], ["warp_col_tiles", "ot", 2], ["chunk", "ot", 8], ["offset", "ot", 8], ["offsetCS", "ot", 0], ["vec", "ot", 8], ["wmma_m", "ot", 16]]}, "result": [[1.0032234000000002e-05], 0, 1.319187879562378, 1668103613.6941879], "version": 0.2, "tvm_version": "0.8.0"}
{"input": ["cuda -keys=cuda,gpu -max_num_threads=1024 -thread_warp_size=32", "dense_tensorcore.cuda", [["TENSOR", [208, 512], "float16"], ["TENSOR", [1536, 512], "float16"]], {}], "config": {"index": 3027, "code_hash": null, "entity": [["block_row_warps", "ot", 1], ["block_col_warps", "ot", 2], ["warp_row_tiles", "ot", 1], ["warp_col_tiles", "ot", 2], ["chunk", "ot", 2], ["offset", "ot", 8], ["offsetCS", "ot", 0], ["vec", "ot", 4], ["wmma_m", "ot", 16]]}, "result": [[1.4606461e-05], 0, 1.2658905982971191, 1668103614.201506], "version": 0.2, "tvm_version": "0.8.0"}
{"input": ["cuda -keys=cuda,gpu -max_num_threads=1024 -thread_warp_size=32", "dense_tensorcore.cuda", [["TENSOR", [208, 512], "float16"], ["TENSOR", [1536, 512], "float16"]], {}], "config": {"index": 9651, "code_hash": null, "entity": [["block_row_warps", "ot", 1], ["block_col_warps", "ot", 2], ["warp_row_tiles", "ot", 2], ["warp_col_tiles", "ot", 1], ["chunk", "ot", 8], ["offset", "ot", 8], ["offsetCS", "ot", 0], ["vec", "ot", 8], ["wmma_m", "ot", 8]]}, "result": [[9.967942e-06], 0, 1.2346413135528564, 1668103614.7507503], "version": 0.2, "tvm_version": "0.8.0"}
{"input": ["cuda -keys=cuda,gpu -max_num_threads=1024 -thread_warp_size=32", "dense_tensorcore.cuda", [["TENSOR", [208, 512], "float16"], ["TENSOR", [1536, 512], "float16"]], {}], "config": {"index": 2436, "code_hash": null, "entity": [["block_row_warps", "ot", 1], ["block_col_warps", "ot", 4], ["warp_row_tiles", "ot", 1], ["warp_col_tiles", "ot", 1], ["chunk", "ot", 4], ["offset", "ot", 8], ["offsetCS", "ot", 8], ["vec", "ot", 2], ["wmma_m", "ot", 16]]}, "result": [[1.2174749e-05], 0, 1.0955760478973389, 1668103615.2525547], "version": 0.2, "tvm_version": "0.8.0"}
{"input": ["cuda -keys=cuda,gpu -max_num_threads=1024 -thread_warp_size=32", "dense_tensorcore.cuda", [["TENSOR", [208, 512], "float16"], ["TENSOR", [1536, 512], "float16"]], {}], "config": {"index": 8193, "code_hash": null, "entity": [["block_row_warps", "ot", 1], ["block_col_warps", "ot", 2], ["warp_row_tiles", "ot", 2], ["warp_col_tiles", "ot", 1], ["chunk", "ot", 2], ["offset", "ot", 8], ["offsetCS", "ot", 0], ["vec", "ot", 4], ["wmma_m", "ot", 8]]}, "result": [[1.4118492e-05], 0, 1.2765226364135742, 1668103615.7636003], "version": 0.2, "tvm_version": "0.8.0"}
{"input": ["cuda -keys=cuda,gpu -max_num_threads=1024 -thread_warp_size=32", "dense_tensorcore.cuda", [["TENSOR", [208, 512], "float16"], ["TENSOR", [1536, 512], "float16"]], {}], "config": {"index": 3729, "code_hash": null, "entity": [["block_row_warps", "ot", 1], ["block_col_warps", "ot", 2], ["warp_row_tiles", "ot", 1], ["warp_col_tiles", "ot", 1], ["chunk", "ot", 4], ["offset", "ot", 8], ["offsetCS", "ot", 8], ["vec", "ot", 4], ["wmma_m", "ot", 16]]}, "result": [[1.1570722000000001e-05], 0, 1.3550329208374023, 1668103616.3024216], "version": 0.2, "tvm_version": "0.8.0"}
{"input": ["cuda -keys=cuda,gpu -max_num_threads=1024 -thread_warp_size=32", "dense_tensorcore.cuda", [["TENSOR", [208, 512], "float16"], ["TENSOR", [1536, 512], "float16"]], {}], "config": {"index": 1788, "code_hash": null, "entity": [["block_row_warps", "ot", 1], ["block_col_warps", "ot", 4], ["warp_row_tiles", "ot", 1], ["warp_col_tiles", "ot", 1], ["chunk", "ot", 4], ["offset", "ot", 8], ["offsetCS", "ot", 0], ["vec", "ot", 2], ["wmma_m", "ot", 16]]}, "result": [[1.087251e-05], 0, 1.3178057670593262, 1668103616.798186], "version": 0.2, "tvm_version": "0.8.0"}
{"input": ["cuda -keys=cuda,gpu -max_num_threads=1024 -thread_warp_size=32", "dense_tensorcore.cuda", [["TENSOR", [208, 512], "float16"], ["TENSOR", [1536, 512], "float16"]], {}], "config": {"index": 3189, "code_hash": null, "entity": [["block_row_warps", "ot", 1], ["block_col_warps", "ot", 2], ["warp_row_tiles", "ot", 1], ["warp_col_tiles", "ot", 2], ["chunk", "ot", 8], ["offset", "ot", 8], ["offsetCS", "ot", 0], ["vec", "ot", 4], ["wmma_m", "ot", 16]]}, "result": [[9.947852e-06], 0, 1.3513050079345703, 1668103617.3133743], "version": 0.2, "tvm_version": "0.8.0"}
{"input": ["cuda -keys=cuda,gpu -max_num_threads=1024 -thread_warp_size=32", "dense_tensorcore.cuda", [["TENSOR", [208, 512], "float16"], ["TENSOR", [1536, 512], "float16"]], {}], "config": {"index": 3813, "code_hash": null, "entity": [["block_row_warps", "ot", 1], ["block_col_warps", "ot", 4], ["warp_row_tiles", "ot", 1], ["warp_col_tiles", "ot", 1], ["chunk", "ot", 8], ["offset", "ot", 8], ["offsetCS", "ot", 8], ["vec", "ot", 4], ["wmma_m", "ot", 16]]}, "result": [[1.0186987e-05], 0, 1.3670403957366943, 1668103617.8523095], "version": 0.2, "tvm_version": "0.8.0"}
{"input": ["cuda -keys=cuda,gpu -max_num_threads=1024 -thread_warp_size=32", "dense_tensorcore.cuda", [["TENSOR", [208, 512], "float16"], ["TENSOR", [1536, 512], "float16"]], {}], "config": {"index": 5109, "code_hash": null, "entity": [["block_row_warps", "ot", 1], ["block_col_warps", "ot", 4], ["warp_row_tiles", "ot", 1], ["warp_col_tiles", "ot", 1], ["chunk", "ot", 8], ["offset", "ot", 8], ["offsetCS", "ot", 8], ["vec", "ot", 8], ["wmma_m", "ot", 16]]}, "result": [[1.0103515e-05], 0, 1.3385965824127197, 1668103618.3487747], "version": 0.2, "tvm_version": "0.8.0"}
{"input": ["cuda -keys=cuda,gpu -max_num_threads=1024 -thread_warp_size=32", "dense_tensorcore.cuda", [["TENSOR", [208, 512], "float16"], ["TENSOR", [1536, 512], "float16"]], {}], "config": {"index": 8841, "code_hash": null, "entity": [["block_row_warps", "ot", 1], ["block_col_warps", "ot", 2], ["warp_row_tiles", "ot", 2], ["warp_col_tiles", "ot", 1], ["chunk", "ot", 2], ["offset", "ot", 8], ["offsetCS", "ot", 8], ["vec", "ot", 4], ["wmma_m", "ot", 8]]}, "result": [[1.3886733e-05], 0, 1.3031892776489258, 1668103618.858013], "version": 0.2, "tvm_version": "0.8.0"}
{"input": ["cuda -keys=cuda,gpu -max_num_threads=1024 -thread_warp_size=32", "dense_tensorcore.cuda", [["TENSOR", [208, 512], "float16"], ["TENSOR", [1536, 512], "float16"]], {}], "config": {"index": 10218, "code_hash": null, "entity": [["block_row_warps", "ot", 1], ["block_col_warps", "ot", 2], ["warp_row_tiles", "ot", 2], ["warp_col_tiles", "ot", 1], ["chunk", "ot", 4], ["offset", "ot", 8], ["offsetCS", "ot", 8], ["vec", "ot", 8], ["wmma_m", "ot", 8]]}, "result": [[9.915791999999999e-06], 0, 1.3259856700897217, 1668103619.3942525], "version": 0.2, "tvm_version": "0.8.0"}
{"input": ["cuda -keys=cuda,gpu -max_num_threads=1024 -thread_warp_size=32", "dense_tensorcore.cuda", [["TENSOR", [208, 512], "float16"], ["TENSOR", [1536, 512], "float16"]], {}], "config": {"index": 8355, "code_hash": null, "entity": [["block_row_warps", "ot", 1], ["block_col_warps", "ot", 2], ["warp_row_tiles", "ot", 2], ["warp_col_tiles", "ot", 1], ["chunk", "ot", 8], ["offset", "ot", 8], ["offsetCS", "ot", 0], ["vec", "ot", 4], ["wmma_m", "ot", 8]]}, "result": [[9.995373e-06], 0, 1.3399605751037598, 1668103619.902338], "version": 0.2, "tvm_version": "0.8.0"}
{"input": ["cuda -keys=cuda,gpu -max_num_threads=1024 -thread_warp_size=32", "dense_tensorcore.cuda", [["TENSOR", [208, 512], "float16"], ["TENSOR", [1536, 512], "float16"]], {}], "config": {"index": 2433, "code_hash": null, "entity": [["block_row_warps", "ot", 1], ["block_col_warps", "ot", 2], ["warp_row_tiles", "ot", 1], ["warp_col_tiles", "ot", 1], ["chunk", "ot", 4], ["offset", "ot", 8], ["offsetCS", "ot", 8], ["vec", "ot", 2], ["wmma_m", "ot", 16]]}, "result": [[1.1822488e-05], 0, 1.2820048332214355, 1668103620.3949182], "version": 0.2, "tvm_version": "0.8.0"}
{"input": ["cuda -keys=cuda,gpu -max_num_threads=1024 -thread_warp_size=32", "dense_tensorcore.cuda", [["TENSOR", [208, 512], "float16"], ["TENSOR", [1536, 512], "float16"]], {}], "config": {"index": 9003, "code_hash": null, "entity": [["block_row_warps", "ot", 1], ["block_col_warps", "ot", 2], ["warp_row_tiles", "ot", 2], ["warp_col_tiles", "ot", 1], ["chunk", "ot", 8], ["offset", "ot", 8], ["offsetCS", "ot", 8], ["vec", "ot", 4], ["wmma_m", "ot", 8]]}, "result": [[9.846424000000002e-06], 0, 1.4387810230255127, 1668103620.9432445], "version": 0.2, "tvm_version": "0.8.0"}
{"input": ["cuda -keys=cuda,gpu -max_num_threads=1024 -thread_warp_size=32", "dense_tensorcore.cuda", [["TENSOR", [208, 512], "float16"], ["TENSOR", [1536, 512], "float16"]], {}], "config": {"index": 2460, "code_hash": null, "entity": [["block_row_warps", "ot", 1], ["block_col_warps", "ot", 2], ["warp_row_tiles", "ot", 1], ["warp_col_tiles", "ot", 2], ["chunk", "ot", 4], ["offset", "ot", 8], ["offsetCS", "ot", 8], ["vec", "ot", 2], ["wmma_m", "ot", 16]]}, "result": [[1.0255122e-05], 0, 1.2873413562774658, 1668103621.4380379], "version": 0.2, "tvm_version": "0.8.0"}
{"input": ["cuda -keys=cuda,gpu -max_num_threads=1024 -thread_warp_size=32", "dense_tensorcore.cuda", [["TENSOR", [208, 512], "float16"], ["TENSOR", [1536, 512], "float16"]], {}], "config": {"index": 3675, "code_hash": null, "entity": [["block_row_warps", "ot", 1], ["block_col_warps", "ot", 2], ["warp_row_tiles", "ot", 1], ["warp_col_tiles", "ot", 2], ["chunk", "ot", 2], ["offset", "ot", 8], ["offsetCS", "ot", 8], ["vec", "ot", 4], ["wmma_m", "ot", 16]]}, "result": [[1.4286159e-05], 0, 1.2934634685516357, 1668103621.9505498], "version": 0.2, "tvm_version": "0.8.0"}
{"input": ["cuda -keys=cuda,gpu -max_num_threads=1024 -thread_warp_size=32", "dense_tensorcore.cuda", [["TENSOR", [208, 512], "float16"], ["TENSOR", [1536, 512], "float16"]], {}], "config": {"index": 3165, "code_hash": null, "entity": [["block_row_warps", "ot", 1], ["block_col_warps", "ot", 4], ["warp_row_tiles", "ot", 1], ["warp_col_tiles", "ot", 1], ["chunk", "ot", 8], ["offset", "ot", 8], ["offsetCS", "ot", 0], ["vec", "ot", 4], ["wmma_m", "ot", 16]]}, "result": [[1.0388856e-05], 0, 1.1090009212493896, 1668103622.4904084], "version": 0.2, "tvm_version": "0.8.0"}
{"input": ["cuda -keys=cuda,gpu -max_num_threads=1024 -thread_warp_size=32", "dense_tensorcore.cuda", [["TENSOR", [208, 512], "float16"], ["TENSOR", [1536, 512], "float16"]], {}], "config": {"index": 3837, "code_hash": null, "entity": [["block_row_warps", "ot", 1], ["block_col_warps", "ot", 2], ["warp_row_tiles", "ot", 1], ["warp_col_tiles", "ot", 2], ["chunk", "ot", 8], ["offset", "ot", 8], ["offsetCS", "ot", 8], ["vec", "ot", 4], ["wmma_m", "ot", 16]]}, "result": [[9.791422000000001e-06], 0, 1.3731334209442139, 1668103622.9974656], "version": 0.2, "tvm_version": "0.8.0"}
{"input": ["cuda -keys=cuda,gpu -max_num_threads=1024 -thread_warp_size=32", "dense_tensorcore.cuda", [["TENSOR", [208, 512], "float16"], ["TENSOR", [1536, 512], "float16"]], {}], "config": {"index": 10299, "code_hash": null, "entity": [["block_row_warps", "ot", 1], ["block_col_warps", "ot", 2], ["warp_row_tiles", "ot", 2], ["warp_col_tiles", "ot", 1], ["chunk", "ot", 8], ["offset", "ot", 8], ["offsetCS", "ot", 8], ["vec", "ot", 8], ["wmma_m", "ot", 8]]}, "result": [[9.670441e-06], 0, 1.2950255870819092, 1668103623.5031462], "version": 0.2, "tvm_version": "0.8.0"}
{"input": ["cuda -keys=cuda,gpu -max_num_threads=1024 -thread_warp_size=32", "dense_tensorcore.cuda", [["TENSOR", [208, 512], "float16"], ["TENSOR", [1536, 512], "float16"]], {}], "config": {"index": 7545, "code_hash": null, "entity": [["block_row_warps", "ot", 1], ["block_col_warps", "ot", 2], ["warp_row_tiles", "ot", 2], ["warp_col_tiles", "ot", 1], ["chunk", "ot", 2], ["offset", "ot", 8], ["offsetCS", "ot", 8], ["vec", "ot", 2], ["wmma_m", "ot", 8]]}, "result": [[1.345928e-05], 0, 1.3665316104888916, 1668103624.0552473], "version": 0.2, "tvm_version": "0.8.0"}
{"input": ["cuda -keys=cuda,gpu -max_num_threads=1024 -thread_warp_size=32", "dense_tensorcore.cuda", [["TENSOR", [208, 512], "float16"], ["TENSOR", [1536, 512], "float16"]], {}], "config": {"index": 3162, "code_hash": null, "entity": [["block_row_warps", "ot", 1], ["block_col_warps", "ot", 2], ["warp_row_tiles", "ot", 1], ["warp_col_tiles", "ot", 1], ["chunk", "ot", 8], ["offset", "ot", 8], ["offsetCS", "ot", 0], ["vec", "ot", 4], ["wmma_m", "ot", 16]]}, "result": [[1.0875883999999998e-05], 0, 1.264158010482788, 1668103624.5601096], "version": 0.2, "tvm_version": "0.8.0"}
{"input": ["cuda -keys=cuda,gpu -max_num_threads=1024 -thread_warp_size=32", "dense_tensorcore.cuda", [["TENSOR", [208, 512], "float16"], ["TENSOR", [1536, 512], "float16"]], {}], "config": {"index": 9643, "code_hash": null, "entity": [["block_row_warps", "ot", 2], ["block_col_warps", "ot", 2], ["warp_row_tiles", "ot", 1], ["warp_col_tiles", "ot", 1], ["chunk", "ot", 8], ["offset", "ot", 8], ["offsetCS", "ot", 0], ["vec", "ot", 8], ["wmma_m", "ot", 8]]}, "result": [[1.1221122e-05], 0, 1.3316407203674316, 1668103625.0665593], "version": 0.2, "tvm_version": "0.8.0"}
{"input": ["cuda -keys=cuda,gpu -max_num_threads=1024 -thread_warp_size=32", "dense_tensorcore.cuda", [["TENSOR", [208, 512], "float16"], ["TENSOR", [1536, 512], "float16"]], {}], "config": {"index": 2514, "code_hash": null, "entity": [["block_row_warps", "ot", 1], ["block_col_warps", "ot", 2], ["warp_row_tiles", "ot", 1], ["warp_col_tiles", "ot", 1], ["chunk", "ot", 8], ["offset", "ot", 8], ["offsetCS", "ot", 8], ["vec", "ot", 2], ["wmma_m", "ot", 16]]}, "result": [[1.1130948e-05], 0, 1.3528289794921875, 1668103625.6069233], "version": 0.2, "tvm_version": "0.8.0"}
{"input": ["cuda -keys=cuda,gpu -max_num_threads=1024 -thread_warp_size=32", "dense_tensorcore.cuda", [["TENSOR", [208, 512], "float16"], ["TENSOR", [1536, 512], "float16"]], {}], "config": {"index": 3810, "code_hash": null, "entity": [["block_row_warps", "ot", 1], ["block_col_warps", "ot", 2], ["warp_row_tiles", "ot", 1], ["warp_col_tiles", "ot", 1], ["chunk", "ot", 8], ["offset", "ot", 8], ["offsetCS", "ot", 8], ["vec", "ot", 4], ["wmma_m", "ot", 16]]}, "result": [[1.0816882e-05], 0, 1.2782409191131592, 1668103626.110598], "version": 0.2, "tvm_version": "0.8.0"}
