python/models/swin_transformer/kernel_configs/swin_transformer_te_slice_1_14_14_512_[1, 1]_2.log
{"i": [["[\"te_slice\", 1, 14, 14, 512, [1, 1], 2, \"float16\"]", "cuda -keys=cuda,gpu -max_num_threads=1024 -model=unknown -thread_warp_size=32", [-1, 16, 64, 49152, 2147483647, 1024, 8, 32], "", 0, []], [[], [["FU", 1, [0, 1, 2, 3]], ["SP", 1, 0, 25088, [49], 1], ["AN", 1, 0, 5], ["AN", 1, 1, 6]]]], "r": [[2.98254e-06, 2.98052e-06, 2.98081e-06], 0, 0.598304, 1668065468], "v": "v0.6"}
{"i": [["[\"te_slice\", 1, 14, 14, 512, [1, 1], 2, \"float16\"]", "cuda -keys=cuda,gpu -max_num_threads=1024 -model=unknown -thread_warp_size=32", [-1, 16, 64, 49152, 2147483647, 1024, 8, 32], "", 0, []], [[], [["FU", 1, [0, 1, 2, 3]], ["SP", 1, 0, 25088, [64], 1], ["AN", 1, 0, 5], ["AN", 1, 1, 6]]]], "r": [[2.9034e-06, 2.90669e-06, 2.90294e-06], 0, 0.958566, 1668065468], "v": "v0.6"}
{"i": [["[\"te_slice\", 1, 14, 14, 512, [1, 1], 2, \"float16\"]", "cuda -keys=cuda,gpu -max_num_threads=1024 -model=unknown -thread_warp_size=32", [-1, 16, 64, 49152, 2147483647, 1024, 8, 32], "", 0, []], [[], [["FU", 1, [0, 1, 2, 3]], ["SP", 1, 0, 25088, [16], 1], ["AN", 1, 0, 5], ["AN", 1, 1, 6]]]], "r": [[3.58844e-06, 3.59886e-06, 3.59695e-06], 0, 2.00334, 1668065469], "v": "v0.6"}
{"i": [["[\"te_slice\", 1, 14, 14, 512, [1, 1], 2, \"float16\"]", "cuda -keys=cuda,gpu -max_num_threads=1024 -model=unknown -thread_warp_size=32", [-1, 16, 64, 49152, 2147483647, 1024, 8, 32], "", 0, []], [[], [["FU", 1, [0, 1, 2, 3]], ["SP", 1, 0, 25088, [2], 1], ["AN", 1, 0, 5], ["AN", 1, 1, 6]]]], "r": [[1.20841e-05, 1.2094e-05, 1.20986e-05], 0, 1.28101, 1668065468], "v": "v0.6"}
{"i": [["[\"te_slice\", 1, 14, 14, 512, [1, 1], 2, \"float16\"]", "cuda -keys=cuda,gpu -max_num_threads=1024 -model=unknown -thread_warp_size=32", [-1, 16, 64, 49152, 2147483647, 1024, 8, 32], "", 0, []], [[], [["FU", 1, [0, 1, 2, 3]], ["SP", 1, 0, 25088, [56], 1], ["AN", 1, 0, 5], ["AN", 1, 1, 6]]]], "r": [[3.2272e-06, 3.24053e-06, 3.2415e-06], 0, 2.65864, 1668065470], "v": "v0.6"}
{"i": [["[\"te_slice\", 1, 14, 14, 512, [1, 1], 2, \"float16\"]", "cuda -keys=cuda,gpu -max_num_threads=1024 -model=unknown -thread_warp_size=32", [-1, 16, 64, 49152, 2147483647, 1024, 8, 32], "", 0, []], [[], [["FU", 1, [0, 1, 2, 3]], ["SP", 1, 0, 25088, [28], 1], ["AN", 1, 0, 5], ["AN", 1, 1, 6]]]], "r": [[3.1921e-06, 3.1902e-06, 3.18822e-06], 0, 2.33743, 1668065469], "v": "v0.6"}
{"i": [["[\"te_slice\", 1, 14, 14, 512, [1, 1], 2, \"float16\"]", "cuda -keys=cuda,gpu -max_num_threads=1024 -model=unknown -thread_warp_size=32", [-1, 16, 64, 49152, 2147483647, 1024, 8, 32], "", 0, []], [[], [["FU", 1, [0, 1, 2, 3]], ["SP", 1, 0, 25088, [14], 1], ["AN", 1, 0, 5], ["AN", 1, 1, 6]]]], "r": [[3.86726e-06, 3.8798e-06, 3.88042e-06], 0, 1.62841, 1668065469], "v": "v0.6"}
{"i": [["[\"te_slice\", 1, 14, 14, 512, [1, 1], 2, \"float16\"]", "cuda -keys=cuda,gpu -max_num_threads=1024 -model=unknown -thread_warp_size=32", [-1, 16, 64, 49152, 2147483647, 1024, 8, 32], "", 0, []], [[], [["FU", 1, [0, 1, 2, 3]], ["SP", 1, 0, 25088, [32], 1], ["AN", 1, 0, 5], ["AN", 1, 1, 6]]]], "r": [[3.22264e-06, 3.23453e-06, 3.23836e-06], 0, 3.70885, 1668065471], "v": "v0.6"}
{"i": [["[\"te_slice\", 1, 14, 14, 512, [1, 1], 2, \"float16\"]", "cuda -keys=cuda,gpu -max_num_threads=1024 -model=unknown -thread_warp_size=32", [-1, 16, 64, 49152, 2147483647, 1024, 8, 32], "", 0, []], [[], [["FU", 1, [0, 1, 2, 3]], ["SP", 1, 0, 25088, [8], 1], ["AN", 1, 0, 5], ["AN", 1, 1, 6]]]], "r": [[4.8773e-06, 4.89132e-06, 4.88987e-06], 0, 3.37871, 1668065470], "v": "v0.6"}
{"i": [["[\"te_slice\", 1, 14, 14, 512, [1, 1], 2, \"float16\"]", "cuda -keys=cuda,gpu -max_num_threads=1024 -model=unknown -thread_warp_size=32", [-1, 16, 64, 49152, 2147483647, 1024, 8, 32], "", 0, []], [[], [["FU", 1, [0, 1, 2, 3]], ["SP", 1, 0, 25088, [7], 1], ["AN", 1, 0, 5], ["AN", 1, 1, 6]]]], "r": [[5.34378e-06, 5.35205e-06, 5.35228e-06], 0, 3.0374, 1668065470], "v": "v0.6"}
{"i": [["[\"te_slice\", 1, 14, 14, 512, [1, 1], 2, \"float16\"]", "cuda -keys=cuda,gpu -max_num_threads=1024 -model=unknown -thread_warp_size=32", [-1, 16, 64, 49152, 2147483647, 1024, 8, 32], "", 0, []], [[], [["FU", 1, [0, 1, 2, 3]], ["SP", 1, 0, 25088, [1], 1], ["AN", 1, 0, 5], ["AN", 1, 1, 6]]]], "r": [[2.14061e-05, 2.14348e-05, 2.14355e-05], 0, 4.40975, 1668065472], "v": "v0.6"}
{"i": [["[\"te_slice\", 1, 14, 14, 512, [1, 1], 2, \"float16\"]", "cuda -keys=cuda,gpu -max_num_threads=1024 -model=unknown -thread_warp_size=32", [-1, 16, 64, 49152, 2147483647, 1024, 8, 32], "", 0, []], [[], [["FU", 1, [0, 1, 2, 3]], ["SP", 1, 0, 25088, [4], 1], ["AN", 1, 0, 5], ["AN", 1, 1, 6]]]], "r": [[7.3212e-06, 7.33357e-06, 7.3282e-06], 0, 4.06194, 1668065471], "v": "v0.6"}
