python/models/swin_transformer/kernel_configs/swin_transformer_fused_roll_reshape_permute_reshape_tune_1_32_32_256_3_8.log
{"i": [["[\"fused_roll_reshape_permute_reshape\", 1, 32, 32, 256, 3, 8]", "cuda -keys=cuda,gpu -max_num_threads=1024 -model=unknown -thread_warp_size=32", [-1, 16, 64, 49152, 2147483647, 1024, 8, 32], "", 0, []], [[], [["FU", 1, [0, 1]], ["SP", 1, 0, 262144, [64], 1], ["AN", 1, 0, 5], ["AN", 1, 1, 6]]]], "r": [[5.52227e-06, 5.52237e-06, 5.52181e-06, 5.52226e-06, 5.52255e-06, 5.5231e-06, 5.52242e-06, 5.5224e-06, 5.52211e-06, 5.5219e-06], 0, 19.7084, 1652112933], "v": "v0.6"}
{"i": [["[\"fused_roll_reshape_permute_reshape\", 1, 32, 32, 256, 3, 8]", "cuda -keys=cuda,gpu -max_num_threads=1024 -model=unknown -thread_warp_size=32", [-1, 16, 64, 49152, 2147483647, 1024, 8, 32], "", 0, []], [[], [["FU", 1, [0, 1]], ["SP", 1, 0, 262144, [2], 1], ["AN", 1, 0, 5], ["AN", 1, 1, 6]]]], "r": [[9.97161e-05, 9.97151e-05, 9.97156e-05, 9.97153e-05, 9.97171e-05, 9.97119e-05, 9.97146e-05, 9.9716e-05, 9.9717e-05, 9.97159e-05], 0, 25.2107, 1652112939], "v": "v0.6"}
{"i": [["[\"fused_roll_reshape_permute_reshape\", 1, 32, 32, 256, 3, 8]", "cuda -keys=cuda,gpu -max_num_threads=1024 -model=unknown -thread_warp_size=32", [-1, 16, 64, 49152, 2147483647, 1024, 8, 32], "", 0, []], [[], [["FU", 1, [0, 1]], ["SP", 1, 0, 262144, [32], 1], ["AN", 1, 0, 5], ["AN", 1, 1, 6]]]], "r": [[8.63132e-06, 8.63163e-06, 8.63115e-06, 8.63118e-06, 8.63129e-06, 8.63159e-06, 8.63127e-06, 8.63126e-06, 8.63104e-06, 8.63112e-06], 0, 29.3243, 1652112943], "v": "v0.6"}
{"i": [["[\"fused_roll_reshape_permute_reshape\", 1, 32, 32, 256, 3, 8]", "cuda -keys=cuda,gpu -max_num_threads=1024 -model=unknown -thread_warp_size=32", [-1, 16, 64, 49152, 2147483647, 1024, 8, 32], "", 0, []], [[], [["FU", 1, [0, 1]], ["SP", 1, 0, 262144, [8], 1], ["AN", 1, 0, 5], ["AN", 1, 1, 6]]]], "r": [[2.68972e-05, 2.68969e-05, 2.68976e-05, 2.68981e-05, 2.68968e-05, 2.68991e-05, 2.68962e-05, 2.68971e-05, 2.68981e-05, 2.68977e-05], 0, 10.8255, 1652112924], "v": "v0.6"}
{"i": [["[\"fused_roll_reshape_permute_reshape\", 1, 32, 32, 256, 3, 8]", "cuda -keys=cuda,gpu -max_num_threads=1024 -model=unknown -thread_warp_size=32", [-1, 16, 64, 49152, 2147483647, 1024, 8, 32], "", 0, []], [[], [["FU", 1, [0, 1]], ["SP", 1, 0, 262144, [1], 1], ["AN", 1, 0, 5], ["AN", 1, 1, 6]]]], "r": [[0.000196963, 0.00019699, 0.000196932, 0.000196935, 0.000196948, 0.000196945, 0.00019695, 0.000196959, 0.000196975, 0.000196928], 0, 5.89082, 1652112919], "v": "v0.6"}
{"i": [["[\"fused_roll_reshape_permute_reshape\", 1, 32, 32, 256, 3, 8]", "cuda -keys=cuda,gpu -max_num_threads=1024 -model=unknown -thread_warp_size=32", [-1, 16, 64, 49152, 2147483647, 1024, 8, 32], "", 0, []], [[], [["FU", 1, [0, 1]], ["SP", 1, 0, 262144, [16], 1], ["AN", 1, 0, 5], ["AN", 1, 1, 6]]]], "r": [[1.4814e-05, 1.48146e-05, 1.4814e-05, 1.48136e-05, 1.48139e-05, 1.50017e-05, 1.48136e-05, 1.48139e-05, 1.48147e-05, 1.48146e-05], 0, 33.9215, 1652112947], "v": "v0.6"}
{"i": [["[\"fused_roll_reshape_permute_reshape\", 1, 32, 32, 256, 3, 8]", "cuda -keys=cuda,gpu -max_num_threads=1024 -model=unknown -thread_warp_size=32", [-1, 16, 64, 49152, 2147483647, 1024, 8, 32], "", 0, []], [[], [["FU", 1, [0, 1]], ["SP", 1, 0, 262144, [4], 1], ["AN", 1, 0, 5], ["AN", 1, 1, 6]]]], "r": [[5.13978e-05, 5.13999e-05, 5.13995e-05, 5.13997e-05, 5.13977e-05, 5.13969e-05, 5.13985e-05, 5.13986e-05, 5.13963e-05, 5.13971e-05], 0, 15.8914, 1652112929], "v": "v0.6"}
{"i": [["[\"fused_roll_reshape_permute_reshape\", 1, 32, 32, 256, 3, 8]", "cuda -keys=cuda,gpu -max_num_threads=1024 -model=unknown -thread_warp_size=32", [-1, 16, 64, 49152, 2147483647, 1024, 8, 32], "", 0, []], [[], [["FU", 1, [0, 1]], ["SP", 1, 0, 262144, [2], 1], ["AN", 1, 0, 5], ["AN", 1, 1, 6]]]], "r": [[9.98442e-05, 9.98451e-05, 9.98465e-05, 9.985e-05, 9.98426e-05, 9.98464e-05, 9.98428e-05, 9.98449e-05, 9.98519e-05, 9.9854e-05], 0, 19.619, 1652113580], "v": "v0.6"}
{"i": [["[\"fused_roll_reshape_permute_reshape\", 1, 32, 32, 256, 3, 8]", "cuda -keys=cuda,gpu -max_num_threads=1024 -model=unknown -thread_warp_size=32", [-1, 16, 64, 49152, 2147483647, 1024, 8, 32], "", 0, []], [[], [["FU", 1, [0, 1]], ["SP", 1, 0, 262144, [32], 1], ["AN", 1, 0, 5], ["AN", 1, 1, 6]]]], "r": [[8.58786e-06, 8.58789e-06, 8.58796e-06, 8.58805e-06, 8.58755e-06, 8.58849e-06, 8.58819e-06, 8.58832e-06, 8.5896e-06, 8.58871e-06], 0, 4.601, 1652113565], "v": "v0.6"}
{"i": [["[\"fused_roll_reshape_permute_reshape\", 1, 32, 32, 256, 3, 8]", "cuda -keys=cuda,gpu -max_num_threads=1024 -model=unknown -thread_warp_size=32", [-1, 16, 64, 49152, 2147483647, 1024, 8, 32], "", 0, []], [[], [["FU", 1, [0, 1]], ["SP", 1, 0, 262144, [16], 1], ["AN", 1, 0, 5], ["AN", 1, 1, 6]]]], "r": [[1.50744e-05, 1.5074e-05, 1.50749e-05, 1.50752e-05, 1.5075e-05, 1.50746e-05, 1.50747e-05, 1.50741e-05, 1.50746e-05, 1.50745e-05], 0, 9.3307, 1652113569], "v": "v0.6"}
{"i": [["[\"fused_roll_reshape_permute_reshape\", 1, 32, 32, 256, 3, 8]", "cuda -keys=cuda,gpu -max_num_threads=1024 -model=unknown -thread_warp_size=32", [-1, 16, 64, 49152, 2147483647, 1024, 8, 32], "", 0, []], [[], [["FU", 1, [0, 1]], ["SP", 1, 0, 262144, [4], 1], ["AN", 1, 0, 5], ["AN", 1, 1, 6]]]], "r": [[5.13694e-05, 5.13715e-05, 5.13725e-05, 5.13729e-05, 5.13695e-05, 5.20319e-05, 5.13744e-05, 5.13718e-05, 5.27131e-05, 5.13713e-05], 0, 24.8856, 1652113585], "v": "v0.6"}
{"i": [["[\"fused_roll_reshape_permute_reshape\", 1, 32, 32, 256, 3, 8]", "cuda -keys=cuda,gpu -max_num_threads=1024 -model=unknown -thread_warp_size=32", [-1, 16, 64, 49152, 2147483647, 1024, 8, 32], "", 0, []], [[], [["FU", 1, [0, 1]], ["SP", 1, 0, 262144, [8], 1], ["AN", 1, 0, 5], ["AN", 1, 1, 6]]]], "r": [[2.69779e-05, 2.69778e-05, 2.69779e-05, 2.6978e-05, 2.69783e-05, 2.69773e-05, 2.69767e-05, 2.69774e-05, 2.69777e-05, 2.69769e-05], 0, 14.3173, 1652113574], "v": "v0.6"}
{"i": [["[\"fused_roll_reshape_permute_reshape\", 1, 32, 32, 256, 3, 8]", "cuda -keys=cuda,gpu -max_num_threads=1024 -model=unknown -thread_warp_size=32", [-1, 16, 64, 49152, 2147483647, 1024, 8, 32], "", 0, []], [[], [["FU", 1, [0, 1]], ["SP", 1, 0, 262144, [64], 1], ["AN", 1, 0, 5], ["AN", 1, 1, 6]]]], "r": [[8.61542e-06, 9.7062e-06, 8.85883e-06, 8.20435e-06, 7.01187e-06, 7.05473e-06, 6.65872e-06, 5.95061e-06, 7.61021e-06, 8.00485e-06], 0, 29.4036, 1652113590], "v": "v0.6"}
{"i": [["[\"fused_roll_reshape_permute_reshape\", 1, 32, 32, 256, 3, 8]", "cuda -keys=cuda,gpu -max_num_threads=1024 -model=unknown -thread_warp_size=32", [-1, 16, 64, 49152, 2147483647, 1024, 8, 32], "", 0, []], [[], [["FU", 1, [0, 1]], ["SP", 1, 0, 262144, [1], 1], ["AN", 1, 0, 5], ["AN", 1, 1, 6]]]], "r": [[0.000199258, 0.000197041, 0.000197054, 0.000197007, 0.000197009, 0.000197018, 0.000197016, 0.000197017, 0.000197016, 0.000197016], 0, 34.8217, 1652113595], "v": "v0.6"}
