python/models/swin_transformer/kernel_configs/swin_transform_auto_tvm_fused_roll_reshape_qkv_matmul_tensorcore_1_32_32_256_3.log
{"input": ["cuda -keys=cuda,gpu -max_num_threads=1024 -thread_warp_size=32", "fused_roll_reshape_qkv_matmul.cuda", [["TENSOR", [1, 32, 32, 256], "float16"], ["TENSOR", [768, 256], "float16"], 1, 32, 32, 256, 3], {}], "config": {"index": 3983, "code_hash": null, "entity": [["block_row_warps", "ot", 4], ["block_col_warps", "ot", 2], ["warp_row_tiles", "ot", 2], ["warp_col_tiles", "ot", 1], ["chunk", "ot", 2], ["offset", "ot", 0], ["offsetCS", "ot", 0], ["vec", "ot", 8], ["wmma_m", "ot", 32]]}, "result": [[4.791781799999999e-05], 0, 1.285752773284912, 1651931106.0073574], "version": 0.2, "tvm_version": "0.8.0"}
{"input": ["cuda -keys=cuda,gpu -max_num_threads=1024 -thread_warp_size=32", "fused_roll_reshape_qkv_matmul.cuda", [["TENSOR", [1, 32, 32, 256], "float16"], ["TENSOR", [768, 256], "float16"], 1, 32, 32, 256, 3], {}], "config": {"index": 8804, "code_hash": null, "entity": [["block_row_warps", "ot", 4], ["block_col_warps", "ot", 1], ["warp_row_tiles", "ot", 1], ["warp_col_tiles", "ot", 4], ["chunk", "ot", 1], ["offset", "ot", 8], ["offsetCS", "ot", 8], ["vec", "ot", 4], ["wmma_m", "ot", 16]]}, "result": [[1.8315253999999998e-05], 0, 1.760535478591919, 1651931106.7837832], "version": 0.2, "tvm_version": "0.8.0"}
{"input": ["cuda -keys=cuda,gpu -max_num_threads=1024 -thread_warp_size=32", "fused_roll_reshape_qkv_matmul.cuda", [["TENSOR", [1, 32, 32, 256], "float16"], ["TENSOR", [768, 256], "float16"], 1, 32, 32, 256, 3], {}], "config": {"index": 7297, "code_hash": null, "entity": [["block_row_warps", "ot", 2], ["block_col_warps", "ot", 4], ["warp_row_tiles", "ot", 1], ["warp_col_tiles", "ot", 1], ["chunk", "ot", 4], ["offset", "ot", 0], ["offsetCS", "ot", 8], ["vec", "ot", 2], ["wmma_m", "ot", 16]]}, "result": [[5.3437426e-05], 0, 1.486759901046753, 1651931108.593051], "version": 0.2, "tvm_version": "0.8.0"}
{"input": ["cuda -keys=cuda,gpu -max_num_threads=1024 -thread_warp_size=32", "fused_roll_reshape_qkv_matmul.cuda", [["TENSOR", [1, 32, 32, 256], "float16"], ["TENSOR", [768, 256], "float16"], 1, 32, 32, 256, 3], {}], "config": {"index": 11559, "code_hash": null, "entity": [["block_row_warps", "ot", 1], ["block_col_warps", "ot", 2], ["warp_row_tiles", "ot", 1], ["warp_col_tiles", "ot", 4], ["chunk", "ot", 4], ["offset", "ot", 8], ["offsetCS", "ot", 8], ["vec", "ot", 1], ["wmma_m", "ot", 8]]}, "result": [[3.9560236000000006e-05], 0, 1.6236135959625244, 1651931109.3442142], "version": 0.2, "tvm_version": "0.8.0"}
{"input": ["cuda -keys=cuda,gpu -max_num_threads=1024 -thread_warp_size=32", "fused_roll_reshape_qkv_matmul.cuda", [["TENSOR", [1, 32, 32, 256], "float16"], ["TENSOR", [768, 256], "float16"], 1, 32, 32, 256, 3], {}], "config": {"index": 3701, "code_hash": null, "entity": [["block_row_warps", "ot", 4], ["block_col_warps", "ot", 1], ["warp_row_tiles", "ot", 1], ["warp_col_tiles", "ot", 4], ["chunk", "ot", 2], ["offset", "ot", 8], ["offsetCS", "ot", 8], ["vec", "ot", 4], ["wmma_m", "ot", 32]]}, "result": [[1.2424942e-05], 0, 1.5372707843780518, 1651931111.1135204], "version": 0.2, "tvm_version": "0.8.0"}
{"input": ["cuda -keys=cuda,gpu -max_num_threads=1024 -thread_warp_size=32", "fused_roll_reshape_qkv_matmul.cuda", [["TENSOR", [1, 32, 32, 256], "float16"], ["TENSOR", [768, 256], "float16"], 1, 32, 32, 256, 3], {}], "config": {"index": 4002, "code_hash": null, "entity": [["block_row_warps", "ot", 1], ["block_col_warps", "ot", 4], ["warp_row_tiles", "ot", 1], ["warp_col_tiles", "ot", 2], ["chunk", "ot", 2], ["offset", "ot", 0], ["offsetCS", "ot", 0], ["vec", "ot", 8], ["wmma_m", "ot", 32]]}, "result": [[3.0487683000000003e-05], 0, 1.452402114868164, 1651931111.6766396], "version": 0.2, "tvm_version": "0.8.0"}
{"input": ["cuda -keys=cuda,gpu -max_num_threads=1024 -thread_warp_size=32", "fused_roll_reshape_qkv_matmul.cuda", [["TENSOR", [1, 32, 32, 256], "float16"], ["TENSOR", [768, 256], "float16"], 1, 32, 32, 256, 3], {}], "config": {"index": 8199, "code_hash": null, "entity": [["block_row_warps", "ot", 1], ["block_col_warps", "ot", 1], ["warp_row_tiles", "ot", 4], ["warp_col_tiles", "ot", 1], ["chunk", "ot", 2], ["offset", "ot", 8], ["offsetCS", "ot", 0], ["vec", "ot", 4], ["wmma_m", "ot", 16]]}, "result": [[2.4790535999999998e-05], 0, 1.391815185546875, 1651931113.4103947], "version": 0.2, "tvm_version": "0.8.0"}
{"input": ["cuda -keys=cuda,gpu -max_num_threads=1024 -thread_warp_size=32", "fused_roll_reshape_qkv_matmul.cuda", [["TENSOR", [1, 32, 32, 256], "float16"], ["TENSOR", [768, 256], "float16"], 1, 32, 32, 256, 3], {}], "config": {"index": 3651, "code_hash": null, "entity": [["block_row_warps", "ot", 1], ["block_col_warps", "ot", 4], ["warp_row_tiles", "ot", 1], ["warp_col_tiles", "ot", 1], ["chunk", "ot", 2], ["offset", "ot", 8], ["offsetCS", "ot", 8], ["vec", "ot", 4], ["wmma_m", "ot", 32]]}, "result": [[2.5631386999999998e-05], 0, 1.2669801712036133, 1651931114.9241138], "version": 0.2, "tvm_version": "0.8.0"}
{"input": ["cuda -keys=cuda,gpu -max_num_threads=1024 -thread_warp_size=32", "fused_roll_reshape_qkv_matmul.cuda", [["TENSOR", [1, 32, 32, 256], "float16"], ["TENSOR", [768, 256], "float16"], 1, 32, 32, 256, 3], {}], "config": {"index": 3135, "code_hash": null, "entity": [["block_row_warps", "ot", 1], ["block_col_warps", "ot", 2], ["warp_row_tiles", "ot", 1], ["warp_col_tiles", "ot", 4], ["chunk", "ot", 4], ["offset", "ot", 8], ["offsetCS", "ot", 0], ["vec", "ot", 4], ["wmma_m", "ot", 32]]}, "result": [[1.7849414e-05], 0, 1.7345881462097168, 1651931116.8904433], "version": 0.2, "tvm_version": "0.8.0"}
{"input": ["cuda -keys=cuda,gpu -max_num_threads=1024 -thread_warp_size=32", "fused_roll_reshape_qkv_matmul.cuda", [["TENSOR", [1, 32, 32, 256], "float16"], ["TENSOR", [768, 256], "float16"], 1, 32, 32, 256, 3], {}], "config": {"index": 4726, "code_hash": null, "entity": [["block_row_warps", "ot", 2], ["block_col_warps", "ot", 1], ["warp_row_tiles", "ot", 1], ["warp_col_tiles", "ot", 2], ["chunk", "ot", 4], ["offset", "ot", 0], ["offsetCS", "ot", 8], ["vec", "ot", 8], ["wmma_m", "ot", 32]]}, "result": [[5.0058076e-05], 0, 1.6823081970214844, 1651931117.6130946], "version": 0.2, "tvm_version": "0.8.0"}
{"input": ["cuda -keys=cuda,gpu -max_num_threads=1024 -thread_warp_size=32", "fused_roll_reshape_qkv_matmul.cuda", [["TENSOR", [1, 32, 32, 256], "float16"], ["TENSOR", [768, 256], "float16"], 1, 32, 32, 256, 3], {}], "config": {"index": 3362, "code_hash": null, "entity": [["block_row_warps", "ot", 4], ["block_col_warps", "ot", 2], ["warp_row_tiles", "ot", 2], ["warp_col_tiles", "ot", 2], ["chunk", "ot", 2], ["offset", "ot", 0], ["offsetCS", "ot", 8], ["vec", "ot", 4], ["wmma_m", "ot", 32]]}, "result": [[1.7177193e-05], 0, 1.7293753623962402, 1651931119.3417318], "version": 0.2, "tvm_version": "0.8.0"}
{"input": ["cuda -keys=cuda,gpu -max_num_threads=1024 -thread_warp_size=32", "fused_roll_reshape_qkv_matmul.cuda", [["TENSOR", [1, 32, 32, 256], "float16"], ["TENSOR", [768, 256], "float16"], 1, 32, 32, 256, 3], {}], "config": {"index": 13188, "code_hash": null, "entity": [["block_row_warps", "ot", 1], ["block_col_warps", "ot", 2], ["warp_row_tiles", "ot", 2], ["warp_col_tiles", "ot", 4], ["chunk", "ot", 4], ["offset", "ot", 0], ["offsetCS", "ot", 0], ["vec", "ot", 4], ["wmma_m", "ot", 8]]}, "result": [[4.4256658000000004e-05], 0, 1.867276906967163, 1651931121.048292], "version": 0.2, "tvm_version": "0.8.0"}
{"input": ["cuda -keys=cuda,gpu -max_num_threads=1024 -thread_warp_size=32", "fused_roll_reshape_qkv_matmul.cuda", [["TENSOR", [1, 32, 32, 256], "float16"], ["TENSOR", [768, 256], "float16"], 1, 32, 32, 256, 3], {}], "config": {"index": 8851, "code_hash": null, "entity": [["block_row_warps", "ot", 2], ["block_col_warps", "ot", 2], ["warp_row_tiles", "ot", 4], ["warp_col_tiles", "ot", 1], ["chunk", "ot", 2], ["offset", "ot", 8], ["offsetCS", "ot", 8], ["vec", "ot", 4], ["wmma_m", "ot", 16]]}, "result": [[1.3738203000000002e-05], 0, 1.4298932552337646, 1651931121.6352477], "version": 0.2, "tvm_version": "0.8.0"}
{"input": ["cuda -keys=cuda,gpu -max_num_threads=1024 -thread_warp_size=32", "fused_roll_reshape_qkv_matmul.cuda", [["TENSOR", [1, 32, 32, 256], "float16"], ["TENSOR", [768, 256], "float16"], 1, 32, 32, 256, 3], {}], "config": {"index": 11795, "code_hash": null, "entity": [["block_row_warps", "ot", 4], ["block_col_warps", "ot", 2], ["warp_row_tiles", "ot", 4], ["warp_col_tiles", "ot", 2], ["chunk", "ot", 2], ["offset", "ot", 0], ["offsetCS", "ot", 0], ["vec", "ot", 2], ["wmma_m", "ot", 8]]}, "result": [[2.5313603e-05], 0, 1.6985180377960205, 1651931122.4541132], "version": 0.2, "tvm_version": "0.8.0"}
{"input": ["cuda -keys=cuda,gpu -max_num_threads=1024 -thread_warp_size=32", "fused_roll_reshape_qkv_matmul.cuda", [["TENSOR", [1, 32, 32, 256], "float16"], ["TENSOR", [768, 256], "float16"], 1, 32, 32, 256, 3], {}], "config": {"index": 6808, "code_hash": null, "entity": [["block_row_warps", "ot", 2], ["block_col_warps", "ot", 2], ["warp_row_tiles", "ot", 1], ["warp_col_tiles", "ot", 1], ["chunk", "ot", 1], ["offset", "ot", 8], ["offsetCS", "ot", 0], ["vec", "ot", 2], ["wmma_m", "ot", 16]]}, "result": [[3.1081651000000004e-05], 0, 1.4467287063598633, 1651931125.2757177], "version": 0.2, "tvm_version": "0.8.0"}
{"input": ["cuda -keys=cuda,gpu -max_num_threads=1024 -thread_warp_size=32", "fused_roll_reshape_qkv_matmul.cuda", [["TENSOR", [1, 32, 32, 256], "float16"], ["TENSOR", [768, 256], "float16"], 1, 32, 32, 256, 3], {}], "config": {"index": 12820, "code_hash": null, "entity": [["block_row_warps", "ot", 2], ["block_col_warps", "ot", 2], ["warp_row_tiles", "ot", 4], ["warp_col_tiles", "ot", 1], ["chunk", "ot", 4], ["offset", "ot", 8], ["offsetCS", "ot", 8], ["vec", "ot", 2], ["wmma_m", "ot", 8]]}, "result": [[1.6954210000000002e-05], 0, 1.624706506729126, 1651931127.035638], "version": 0.2, "tvm_version": "0.8.0"}
{"input": ["cuda -keys=cuda,gpu -max_num_threads=1024 -thread_warp_size=32", "fused_roll_reshape_qkv_matmul.cuda", [["TENSOR", [1, 32, 32, 256], "float16"], ["TENSOR", [768, 256], "float16"], 1, 32, 32, 256, 3], {}], "config": {"index": 1126, "code_hash": null, "entity": [["block_row_warps", "ot", 2], ["block_col_warps", "ot", 1], ["warp_row_tiles", "ot", 4], ["warp_col_tiles", "ot", 4], ["chunk", "ot", 2], ["offset", "ot", 8], ["offsetCS", "ot", 8], ["vec", "ot", 1], ["wmma_m", "ot", 32]]}, "result": [[5.5438688e-05], 0, 2.2040696144104004, 1651931128.3018928], "version": 0.2, "tvm_version": "0.8.0"}
{"input": ["cuda -keys=cuda,gpu -max_num_threads=1024 -thread_warp_size=32", "fused_roll_reshape_qkv_matmul.cuda", [["TENSOR", [1, 32, 32, 256], "float16"], ["TENSOR", [768, 256], "float16"], 1, 32, 32, 256, 3], {}], "config": {"index": 11830, "code_hash": null, "entity": [["block_row_warps", "ot", 2], ["block_col_warps", "ot", 2], ["warp_row_tiles", "ot", 1], ["warp_col_tiles", "ot", 1], ["chunk", "ot", 4], ["offset", "ot", 0], ["offsetCS", "ot", 0], ["vec", "ot", 2], ["wmma_m", "ot", 8]]}, "result": [[6.2894648e-05], 0, 1.750180959701538, 1651934197.2153316], "version": 0.2, "tvm_version": "0.8.0"}
{"input": ["cuda -keys=cuda,gpu -max_num_threads=1024 -thread_warp_size=32", "fused_roll_reshape_qkv_matmul.cuda", [["TENSOR", [1, 32, 32, 256], "float16"], ["TENSOR", [768, 256], "float16"], 1, 32, 32, 256, 3], {}], "config": {"index": 1334, "code_hash": null, "entity": [["block_row_warps", "ot", 4], ["block_col_warps", "ot", 1], ["warp_row_tiles", "ot", 2], ["warp_col_tiles", "ot", 2], ["chunk", "ot", 1], ["offset", "ot", 0], ["offsetCS", "ot", 0], ["vec", "ot", 2], ["wmma_m", "ot", 32]]}, "result": [[2.6018108000000003e-05], 0, 1.7292275428771973, 1651934198.703158], "version": 0.2, "tvm_version": "0.8.0"}
{"input": ["cuda -keys=cuda,gpu -max_num_threads=1024 -thread_warp_size=32", "fused_roll_reshape_qkv_matmul.cuda", [["TENSOR", [1, 32, 32, 256], "float16"], ["TENSOR", [768, 256], "float16"], 1, 32, 32, 256, 3], {}], "config": {"index": 1995, "code_hash": null, "entity": [["block_row_warps", "ot", 1], ["block_col_warps", "ot", 4], ["warp_row_tiles", "ot", 4], ["warp_col_tiles", "ot", 2], ["chunk", "ot", 1], ["offset", "ot", 0], ["offsetCS", "ot", 8], ["vec", "ot", 2], ["wmma_m", "ot", 32]]}, "result": [[2.5579927000000003e-05], 0, 1.6426966190338135, 1651934199.4951222], "version": 0.2, "tvm_version": "0.8.0"}
{"input": ["cuda -keys=cuda,gpu -max_num_threads=1024 -thread_warp_size=32", "fused_roll_reshape_qkv_matmul.cuda", [["TENSOR", [1, 32, 32, 256], "float16"], ["TENSOR", [768, 256], "float16"], 1, 32, 32, 256, 3], {}], "config": {"index": 14462, "code_hash": null, "entity": [["block_row_warps", "ot", 4], ["block_col_warps", "ot", 4], ["warp_row_tiles", "ot", 2], ["warp_col_tiles", "ot", 2], ["chunk", "ot", 4], ["offset", "ot", 0], ["offsetCS", "ot", 0], ["vec", "ot", 8], ["wmma_m", "ot", 8]]}, "result": [[6.974863399999998e-05], 0, 1.718613624572754, 1651934201.3687515], "version": 0.2, "tvm_version": "0.8.0"}
{"input": ["cuda -keys=cuda,gpu -max_num_threads=1024 -thread_warp_size=32", "fused_roll_reshape_qkv_matmul.cuda", [["TENSOR", [1, 32, 32, 256], "float16"], ["TENSOR", [768, 256], "float16"], 1, 32, 32, 256, 3], {}], "config": {"index": 1321, "code_hash": null, "entity": [["block_row_warps", "ot", 2], ["block_col_warps", "ot", 4], ["warp_row_tiles", "ot", 4], ["warp_col_tiles", "ot", 1], ["chunk", "ot", 1], ["offset", "ot", 0], ["offsetCS", "ot", 0], ["vec", "ot", 2], ["wmma_m", "ot", 32]]}, "result": [[2.1645313000000003e-05], 0, 1.574904441833496, 1651934201.9587579], "version": 0.2, "tvm_version": "0.8.0"}
{"input": ["cuda -keys=cuda,gpu -max_num_threads=1024 -thread_warp_size=32", "fused_roll_reshape_qkv_matmul.cuda", [["TENSOR", [1, 32, 32, 256], "float16"], ["TENSOR", [768, 256], "float16"], 1, 32, 32, 256, 3], {}], "config": {"index": 9203, "code_hash": null, "entity": [["block_row_warps", "ot", 4], ["block_col_warps", "ot", 2], ["warp_row_tiles", "ot", 4], ["warp_col_tiles", "ot", 2], ["chunk", "ot", 2], ["offset", "ot", 0], ["offsetCS", "ot", 0], ["vec", "ot", 8], ["wmma_m", "ot", 16]]}, "result": [[3.2990833999999996e-05], 0, 1.7165546417236328, 1651934203.6146452], "version": 0.2, "tvm_version": "0.8.0"}
{"input": ["cuda -keys=cuda,gpu -max_num_threads=1024 -thread_warp_size=32", "fused_roll_reshape_qkv_matmul.cuda", [["TENSOR", [1, 32, 32, 256], "float16"], ["TENSOR", [768, 256], "float16"], 1, 32, 32, 256, 3], {}], "config": {"index": 5105, "code_hash": null, "entity": [["block_row_warps", "ot", 4], ["block_col_warps", "ot", 1], ["warp_row_tiles", "ot", 1], ["warp_col_tiles", "ot", 1], ["chunk", "ot", 8], ["offset", "ot", 8], ["offsetCS", "ot", 8], ["vec", "ot", 8], ["wmma_m", "ot", 32]]}, "result": [[3.4309607999999996e-05], 0, 1.466606616973877, 1651934205.2807186], "version": 0.2, "tvm_version": "0.8.0"}
{"input": ["cuda -keys=cuda,gpu -max_num_threads=1024 -thread_warp_size=32", "fused_roll_reshape_qkv_matmul.cuda", [["TENSOR", [1, 32, 32, 256], "float16"], ["TENSOR", [768, 256], "float16"], 1, 32, 32, 256, 3], {}], "config": {"index": 6619, "code_hash": null, "entity": [["block_row_warps", "ot", 2], ["block_col_warps", "ot", 2], ["warp_row_tiles", "ot", 1], ["warp_col_tiles", "ot", 4], ["chunk", "ot", 2], ["offset", "ot", 0], ["offsetCS", "ot", 0], ["vec", "ot", 2], ["wmma_m", "ot", 16]]}, "result": [[2.5769605e-05], 0, 1.6001079082489014, 1651934206.9803584], "version": 0.2, "tvm_version": "0.8.0"}
{"input": ["cuda -keys=cuda,gpu -max_num_threads=1024 -thread_warp_size=32", "fused_roll_reshape_qkv_matmul.cuda", [["TENSOR", [1, 32, 32, 256], "float16"], ["TENSOR", [768, 256], "float16"], 1, 32, 32, 256, 3], {}], "config": {"index": 11220, "code_hash": null, "entity": [["block_row_warps", "ot", 1], ["block_col_warps", "ot", 4], ["warp_row_tiles", "ot", 2], ["warp_col_tiles", "ot", 2], ["chunk", "ot", 4], ["offset", "ot", 0], ["offsetCS", "ot", 8], ["vec", "ot", 1], ["wmma_m", "ot", 8]]}, "result": [[5.4577329e-05], 0, 2.0343220233917236, 1651934208.8420324], "version": 0.2, "tvm_version": "0.8.0"}
{"input": ["cuda -keys=cuda,gpu -max_num_threads=1024 -thread_warp_size=32", "fused_roll_reshape_qkv_matmul.cuda", [["TENSOR", [1, 32, 32, 256], "float16"], ["TENSOR", [768, 256], "float16"], 1, 32, 32, 256, 3], {}], "config": {"index": 6295, "code_hash": null, "entity": [["block_row_warps", "ot", 2], ["block_col_warps", "ot", 2], ["warp_row_tiles", "ot", 1], ["warp_col_tiles", "ot", 4], ["chunk", "ot", 2], ["offset", "ot", 8], ["offsetCS", "ot", 8], ["vec", "ot", 1], ["wmma_m", "ot", 16]]}, "result": [[1.6403931999999998e-05], 0, 1.5663979053497314, 1651934210.5056775], "version": 0.2, "tvm_version": "0.8.0"}
{"input": ["cuda -keys=cuda,gpu -max_num_threads=1024 -thread_warp_size=32", "fused_roll_reshape_qkv_matmul.cuda", [["TENSOR", [1, 32, 32, 256], "float16"], ["TENSOR", [768, 256], "float16"], 1, 32, 32, 256, 3], {}], "config": {"index": 6487, "code_hash": null, "entity": [["block_row_warps", "ot", 2], ["block_col_warps", "ot", 4], ["warp_row_tiles", "ot", 1], ["warp_col_tiles", "ot", 1], ["chunk", "ot", 1], ["offset", "ot", 0], ["offsetCS", "ot", 0], ["vec", "ot", 2], ["wmma_m", "ot", 16]]}, "result": [[3.0640451e-05], 0, 1.5499522686004639, 1651934211.2773192], "version": 0.2, "tvm_version": "0.8.0"}
{"input": ["cuda -keys=cuda,gpu -max_num_threads=1024 -thread_warp_size=32", "fused_roll_reshape_qkv_matmul.cuda", [["TENSOR", [1, 32, 32, 256], "float16"], ["TENSOR", [768, 256], "float16"], 1, 32, 32, 256, 3], {}], "config": {"index": 8902, "code_hash": null, "entity": [["block_row_warps", "ot", 2], ["block_col_warps", "ot", 1], ["warp_row_tiles", "ot", 4], ["warp_col_tiles", "ot", 4], ["chunk", "ot", 2], ["offset", "ot", 8], ["offsetCS", "ot", 8], ["vec", "ot", 4], ["wmma_m", "ot", 16]]}, "result": [[2.4686271999999998e-05], 0, 1.8453269004821777, 1651934212.052866], "version": 0.2, "tvm_version": "0.8.0"}
{"input": ["cuda -keys=cuda,gpu -max_num_threads=1024 -thread_warp_size=32", "fused_roll_reshape_qkv_matmul.cuda", [["TENSOR", [1, 32, 32, 256], "float16"], ["TENSOR", [768, 256], "float16"], 1, 32, 32, 256, 3], {}], "config": {"index": 11803, "code_hash": null, "entity": [["block_row_warps", "ot", 2], ["block_col_warps", "ot", 2], ["warp_row_tiles", "ot", 1], ["warp_col_tiles", "ot", 4], ["chunk", "ot", 2], ["offset", "ot", 0], ["offsetCS", "ot", 0], ["vec", "ot", 2], ["wmma_m", "ot", 8]]}, "result": [[4.2347522e-05], 0, 1.7691264152526855, 1651934213.7659078], "version": 0.2, "tvm_version": "0.8.0"}
{"input": ["cuda -keys=cuda,gpu -max_num_threads=1024 -thread_warp_size=32", "fused_roll_reshape_qkv_matmul.cuda", [["TENSOR", [1, 32, 32, 256], "float16"], ["TENSOR", [768, 256], "float16"], 1, 32, 32, 256, 3], {}], "config": {"index": 6911, "code_hash": null, "entity": [["block_row_warps", "ot", 4], ["block_col_warps", "ot", 4], ["warp_row_tiles", "ot", 4], ["warp_col_tiles", "ot", 1], ["chunk", "ot", 2], ["offset", "ot", 8], ["offsetCS", "ot", 0], ["vec", "ot", 2], ["wmma_m", "ot", 16]]}, "result": [[1.9541371000000003e-05], 0, 1.4285800457000732, 1651934214.447216], "version": 0.2, "tvm_version": "0.8.0"}
{"input": ["cuda -keys=cuda,gpu -max_num_threads=1024 -thread_warp_size=32", "fused_roll_reshape_qkv_matmul.cuda", [["TENSOR", [1, 32, 32, 256], "float16"], ["TENSOR", [768, 256], "float16"], 1, 32, 32, 256, 3], {}], "config": {"index": 11084, "code_hash": null, "entity": [["block_row_warps", "ot", 4], ["block_col_warps", "ot", 2], ["warp_row_tiles", "ot", 2], ["warp_col_tiles", "ot", 4], ["chunk", "ot", 1], ["offset", "ot", 0], ["offsetCS", "ot", 8], ["vec", "ot", 1], ["wmma_m", "ot", 8]]}, "result": [[4.1070412e-05], 0, 1.5588295459747314, 1651934216.183697], "version": 0.2, "tvm_version": "0.8.0"}
{"input": ["cuda -keys=cuda,gpu -max_num_threads=1024 -thread_warp_size=32", "fused_roll_reshape_qkv_matmul.cuda", [["TENSOR", [1, 32, 32, 256], "float16"], ["TENSOR", [768, 256], "float16"], 1, 32, 32, 256, 3], {}], "config": {"index": 5073, "code_hash": null, "entity": [["block_row_warps", "ot", 1], ["block_col_warps", "ot", 4], ["warp_row_tiles", "ot", 4], ["warp_col_tiles", "ot", 2], ["chunk", "ot", 4], ["offset", "ot", 8], ["offsetCS", "ot", 8], ["vec", "ot", 8], ["wmma_m", "ot", 32]]}, "result": [[1.4683837999999999e-05], 0, 1.622941017150879, 1651934216.8522155], "version": 0.2, "tvm_version": "0.8.0"}
{"input": ["cuda -keys=cuda,gpu -max_num_threads=1024 -thread_warp_size=32", "fused_roll_reshape_qkv_matmul.cuda", [["TENSOR", [1, 32, 32, 256], "float16"], ["TENSOR", [768, 256], "float16"], 1, 32, 32, 256, 3], {}], "config": {"index": 3492, "code_hash": null, "entity": [["block_row_warps", "ot", 1], ["block_col_warps", "ot", 1], ["warp_row_tiles", "ot", 2], ["warp_col_tiles", "ot", 1], ["chunk", "ot", 8], ["offset", "ot", 0], ["offsetCS", "ot", 8], ["vec", "ot", 4], ["wmma_m", "ot", 32]]}, "result": [[7.6250707e-05], 0, 1.5411643981933594, 1651934218.7611778], "version": 0.2, "tvm_version": "0.8.0"}
{"input": ["cuda -keys=cuda,gpu -max_num_threads=1024 -thread_warp_size=32", "fused_roll_reshape_qkv_matmul.cuda", [["TENSOR", [1, 32, 32, 256], "float16"], ["TENSOR", [768, 256], "float16"], 1, 32, 32, 256, 3], {}], "config": {"index": 8145, "code_hash": null, "entity": [["block_row_warps", "ot", 1], ["block_col_warps", "ot", 1], ["warp_row_tiles", "ot", 4], ["warp_col_tiles", "ot", 2], ["chunk", "ot", 1], ["offset", "ot", 8], ["offsetCS", "ot", 0], ["vec", "ot", 4], ["wmma_m", "ot", 16]]}, "result": [[1.6194615e-05], 0, 1.5465612411499023, 1651934220.332548], "version": 0.2, "tvm_version": "0.8.0"}
{"input": ["cuda -keys=cuda,gpu -max_num_threads=1024 -thread_warp_size=32", "fused_roll_reshape_qkv_matmul.cuda", [["TENSOR", [1, 32, 32, 256], "float16"], ["TENSOR", [768, 256], "float16"], 1, 32, 32, 256, 3], {}], "config": {"index": 3468, "code_hash": null, "entity": [["block_row_warps", "ot", 1], ["block_col_warps", "ot", 2], ["warp_row_tiles", "ot", 2], ["warp_col_tiles", "ot", 4], ["chunk", "ot", 4], ["offset", "ot", 0], ["offsetCS", "ot", 8], ["vec", "ot", 4], ["wmma_m", "ot", 32]]}, "result": [[3.0163341999999998e-05], 0, 1.7868680953979492, 1651934221.0872488], "version": 0.2, "tvm_version": "0.8.0"}
{"input": ["cuda -keys=cuda,gpu -max_num_threads=1024 -thread_warp_size=32", "fused_roll_reshape_qkv_matmul.cuda", [["TENSOR", [1, 32, 32, 256], "float16"], ["TENSOR", [768, 256], "float16"], 1, 32, 32, 256, 3], {}], "config": {"index": 5220, "code_hash": null, "entity": [["block_row_warps", "ot", 1], ["block_col_warps", "ot", 1], ["warp_row_tiles", "ot", 2], ["warp_col_tiles", "ot", 2], ["chunk", "ot", 1], ["offset", "ot", 0], ["offsetCS", "ot", 0], ["vec", "ot", 1], ["wmma_m", "ot", 16]]}, "result": [[3.2424579000000004e-05], 0, 1.592660903930664, 1651934222.6538937], "version": 0.2, "tvm_version": "0.8.0"}
{"input": ["cuda -keys=cuda,gpu -max_num_threads=1024 -thread_warp_size=32", "fused_roll_reshape_qkv_matmul.cuda", [["TENSOR", [1, 32, 32, 256], "float16"], ["TENSOR", [768, 256], "float16"], 1, 32, 32, 256, 3], {}], "config": {"index": 12124, "code_hash": null, "entity": [["block_row_warps", "ot", 2], ["block_col_warps", "ot", 1], ["warp_row_tiles", "ot", 1], ["warp_col_tiles", "ot", 4], ["chunk", "ot", 2], ["offset", "ot", 8], ["offsetCS", "ot", 0], ["vec", "ot", 2], ["wmma_m", "ot", 8]]}, "result": [[2.0907876e-05], 0, 1.6661694049835205, 1651934223.5409164], "version": 0.2, "tvm_version": "0.8.0"}
{"input": ["cuda -keys=cuda,gpu -max_num_threads=1024 -thread_warp_size=32", "fused_roll_reshape_qkv_matmul.cuda", [["TENSOR", [1, 32, 32, 256], "float16"], ["TENSOR", [768, 256], "float16"], 1, 32, 32, 256, 3], {}], "config": {"index": 13433, "code_hash": null, "entity": [["block_row_warps", "ot", 4], ["block_col_warps", "ot", 2], ["warp_row_tiles", "ot", 2], ["warp_col_tiles", "ot", 4], ["chunk", "ot", 2], ["offset", "ot", 8], ["offsetCS", "ot", 0], ["vec", "ot", 4], ["wmma_m", "ot", 8]]}, "result": [[2.6220363e-05], 0, 1.3907883167266846, 1651934225.1106563], "version": 0.2, "tvm_version": "0.8.0"}
{"input": ["cuda -keys=cuda,gpu -max_num_threads=1024 -thread_warp_size=32", "fused_roll_reshape_qkv_matmul.cuda", [["TENSOR", [1, 32, 32, 256], "float16"], ["TENSOR", [768, 256], "float16"], 1, 32, 32, 256, 3], {}], "config": {"index": 4270, "code_hash": null, "entity": [["block_row_warps", "ot", 2], ["block_col_warps", "ot", 2], ["warp_row_tiles", "ot", 1], ["warp_col_tiles", "ot", 4], ["chunk", "ot", 1], ["offset", "ot", 8], ["offsetCS", "ot", 0], ["vec", "ot", 8], ["wmma_m", "ot", 32]]}, "result": [[1.9662033000000003e-05], 0, 1.5253677368164062, 1651934225.8905442], "version": 0.2, "tvm_version": "0.8.0"}
{"input": ["cuda -keys=cuda,gpu -max_num_threads=1024 -thread_warp_size=32", "fused_roll_reshape_qkv_matmul.cuda", [["TENSOR", [1, 32, 32, 256], "float16"], ["TENSOR", [768, 256], "float16"], 1, 32, 32, 256, 3], {}], "config": {"index": 3363, "code_hash": null, "entity": [["block_row_warps", "ot", 1], ["block_col_warps", "ot", 4], ["warp_row_tiles", "ot", 2], ["warp_col_tiles", "ot", 2], ["chunk", "ot", 2], ["offset", "ot", 0], ["offsetCS", "ot", 8], ["vec", "ot", 4], ["wmma_m", "ot", 32]]}, "result": [[2.7811749e-05], 0, 1.4375464916229248, 1651934227.7238042], "version": 0.2, "tvm_version": "0.8.0"}
{"input": ["cuda -keys=cuda,gpu -max_num_threads=1024 -thread_warp_size=32", "fused_roll_reshape_qkv_matmul.cuda", [["TENSOR", [1, 32, 32, 256], "float16"], ["TENSOR", [768, 256], "float16"], 1, 32, 32, 256, 3], {}], "config": {"index": 3322, "code_hash": null, "entity": [["block_row_warps", "ot", 2], ["block_col_warps", "ot", 1], ["warp_row_tiles", "ot", 1], ["warp_col_tiles", "ot", 1], ["chunk", "ot", 2], ["offset", "ot", 0], ["offsetCS", "ot", 8], ["vec", "ot", 4], ["wmma_m", "ot", 32]]}, "result": [[5.4577027e-05], 0, 1.3308932781219482, 1651934230.5659742], "version": 0.2, "tvm_version": "0.8.0"}
{"input": ["cuda -keys=cuda,gpu -max_num_threads=1024 -thread_warp_size=32", "fused_roll_reshape_qkv_matmul.cuda", [["TENSOR", [1, 32, 32, 256], "float16"], ["TENSOR", [768, 256], "float16"], 1, 32, 32, 256, 3], {}], "config": {"index": 14111, "code_hash": null, "entity": [["block_row_warps", "ot", 4], ["block_col_warps", "ot", 4], ["warp_row_tiles", "ot", 2], ["warp_col_tiles", "ot", 1], ["chunk", "ot", 4], ["offset", "ot", 8], ["offsetCS", "ot", 8], ["vec", "ot", 4], ["wmma_m", "ot", 8]]}, "result": [[9.009403584672436e-06], 0, 1.3351950645446777, 1651934232.1970613], "version": 0.2, "tvm_version": "0.8.0"}
{"input": ["cuda -keys=cuda,gpu -max_num_threads=1024 -thread_warp_size=32", "fused_roll_reshape_qkv_matmul.cuda", [["TENSOR", [1, 32, 32, 256], "float16"], ["TENSOR", [768, 256], "float16"], 1, 32, 32, 256, 3], {}], "config": {"index": 10813, "code_hash": null, "entity": [["block_row_warps", "ot", 2], ["block_col_warps", "ot", 2], ["warp_row_tiles", "ot", 2], ["warp_col_tiles", "ot", 2], ["chunk", "ot", 2], ["offset", "ot", 8], ["offsetCS", "ot", 0], ["vec", "ot", 1], ["wmma_m", "ot", 8]]}, "result": [[2.8036302e-05], 0, 1.540795087814331, 1651934234.0588288], "version": 0.2, "tvm_version": "0.8.0"}
{"input": ["cuda -keys=cuda,gpu -max_num_threads=1024 -thread_warp_size=32", "fused_roll_reshape_qkv_matmul.cuda", [["TENSOR", [1, 32, 32, 256], "float16"], ["TENSOR", [768, 256], "float16"], 1, 32, 32, 256, 3], {}], "config": {"index": 7830, "code_hash": null, "entity": [["block_row_warps", "ot", 1], ["block_col_warps", "ot", 1], ["warp_row_tiles", "ot", 1], ["warp_col_tiles", "ot", 4], ["chunk", "ot", 1], ["offset", "ot", 0], ["offsetCS", "ot", 0], ["vec", "ot", 4], ["wmma_m", "ot", 16]]}, "result": [[3.6203696e-05], 0, 1.2670247554779053, 1651934235.942454], "version": 0.2, "tvm_version": "0.8.0"}
{"input": ["cuda -keys=cuda,gpu -max_num_threads=1024 -thread_warp_size=32", "fused_roll_reshape_qkv_matmul.cuda", [["TENSOR", [1, 32, 32, 256], "float16"], ["TENSOR", [768, 256], "float16"], 1, 32, 32, 256, 3], {}], "config": {"index": 4297, "code_hash": null, "entity": [["block_row_warps", "ot", 2], ["block_col_warps", "ot", 2], ["warp_row_tiles", "ot", 1], ["warp_col_tiles", "ot", 1], ["chunk", "ot", 2], ["offset", "ot", 8], ["offsetCS", "ot", 0], ["vec", "ot", 8], ["wmma_m", "ot", 32]]}, "result": [[3.5155597999999994e-05], 0, 1.1335854530334473, 1651934236.5691025], "version": 0.2, "tvm_version": "0.8.0"}
{"input": ["cuda -keys=cuda,gpu -max_num_threads=1024 -thread_warp_size=32", "fused_roll_reshape_qkv_matmul.cuda", [["TENSOR", [1, 32, 32, 256], "float16"], ["TENSOR", [768, 256], "float16"], 1, 32, 32, 256, 3], {}], "config": {"index": 3678, "code_hash": null, "entity": [["block_row_warps", "ot", 1], ["block_col_warps", "ot", 4], ["warp_row_tiles", "ot", 1], ["warp_col_tiles", "ot", 2], ["chunk", "ot", 2], ["offset", "ot", 8], ["offsetCS", "ot", 8], ["vec", "ot", 4], ["wmma_m", "ot", 32]]}, "result": [[1.1917469e-05], 0, 1.1512413024902344, 1651934238.3976238], "version": 0.2, "tvm_version": "0.8.0"}
{"input": ["cuda -keys=cuda,gpu -max_num_threads=1024 -thread_warp_size=32", "fused_roll_reshape_qkv_matmul.cuda", [["TENSOR", [1, 32, 32, 256], "float16"], ["TENSOR", [768, 256], "float16"], 1, 32, 32, 256, 3], {}], "config": {"index": 8695, "code_hash": null, "entity": [["block_row_warps", "ot", 2], ["block_col_warps", "ot", 1], ["warp_row_tiles", "ot", 1], ["warp_col_tiles", "ot", 2], ["chunk", "ot", 8], ["offset", "ot", 0], ["offsetCS", "ot", 8], ["vec", "ot", 4], ["wmma_m", "ot", 16]]}, "result": [[4.7642546e-05], 0, 1.3687999248504639, 1651934239.9816597], "version": 0.2, "tvm_version": "0.8.0"}
{"input": ["cuda -keys=cuda,gpu -max_num_threads=1024 -thread_warp_size=32", "fused_roll_reshape_qkv_matmul.cuda", [["TENSOR", [1, 32, 32, 256], "float16"], ["TENSOR", [768, 256], "float16"], 1, 32, 32, 256, 3], {}], "config": {"index": 9374, "code_hash": null, "entity": [["block_row_warps", "ot", 4], ["block_col_warps", "ot", 2], ["warp_row_tiles", "ot", 1], ["warp_col_tiles", "ot", 4], ["chunk", "ot", 8], ["offset", "ot", 0], ["offsetCS", "ot", 0], ["vec", "ot", 8], ["wmma_m", "ot", 16]]}, "result": [[3.4259894000000004e-05], 0, 1.229233741760254, 1651934241.9494762], "version": 0.2, "tvm_version": "0.8.0"}
{"input": ["cuda -keys=cuda,gpu -max_num_threads=1024 -thread_warp_size=32", "fused_roll_reshape_qkv_matmul.cuda", [["TENSOR", [1, 32, 32, 256], "float16"], ["TENSOR", [768, 256], "float16"], 1, 32, 32, 256, 3], {}], "config": {"index": 14352, "code_hash": null, "entity": [["block_row_warps", "ot", 1], ["block_col_warps", "ot", 4], ["warp_row_tiles", "ot", 2], ["warp_col_tiles", "ot", 1], ["chunk", "ot", 2], ["offset", "ot", 0], ["offsetCS", "ot", 0], ["vec", "ot", 8], ["wmma_m", "ot", 8]]}, "result": [[4.3068206000000005e-05], 0, 1.1677494049072266, 1651934242.5621033], "version": 0.2, "tvm_version": "0.8.0"}
{"input": ["cuda -keys=cuda,gpu -max_num_threads=1024 -thread_warp_size=32", "fused_roll_reshape_qkv_matmul.cuda", [["TENSOR", [1, 32, 32, 256], "float16"], ["TENSOR", [768, 256], "float16"], 1, 32, 32, 256, 3], {}], "config": {"index": 11089, "code_hash": null, "entity": [["block_row_warps", "ot", 2], ["block_col_warps", "ot", 1], ["warp_row_tiles", "ot", 4], ["warp_col_tiles", "ot", 4], ["chunk", "ot", 1], ["offset", "ot", 0], ["offsetCS", "ot", 8], ["vec", "ot", 1], ["wmma_m", "ot", 8]]}, "result": [[3.4575556e-05], 0, 1.5989856719970703, 1651934245.980356], "version": 0.2, "tvm_version": "0.8.0"}
{"input": ["cuda -keys=cuda,gpu -max_num_threads=1024 -thread_warp_size=32", "fused_roll_reshape_qkv_matmul.cuda", [["TENSOR", [1, 32, 32, 256], "float16"], ["TENSOR", [768, 256], "float16"], 1, 32, 32, 256, 3], {}], "config": {"index": 81, "code_hash": null, "entity": [["block_row_warps", "ot", 1], ["block_col_warps", "ot", 1], ["warp_row_tiles", "ot", 1], ["warp_col_tiles", "ot", 1], ["chunk", "ot", 2], ["offset", "ot", 0], ["offsetCS", "ot", 0], ["vec", "ot", 1], ["wmma_m", "ot", 32]]}, "result": [[7.2286224e-05], 0, 1.8054463863372803, 1651934246.919494], "version": 0.2, "tvm_version": "0.8.0"}
{"input": ["cuda -keys=cuda,gpu -max_num_threads=1024 -thread_warp_size=32", "fused_roll_reshape_qkv_matmul.cuda", [["TENSOR", [1, 32, 32, 256], "float16"], ["TENSOR", [768, 256], "float16"], 1, 32, 32, 256, 3], {}], "config": {"index": 5335, "code_hash": null, "entity": [["block_row_warps", "ot", 2], ["block_col_warps", "ot", 4], ["warp_row_tiles", "ot", 2], ["warp_col_tiles", "ot", 4], ["chunk", "ot", 2], ["offset", "ot", 0], ["offsetCS", "ot", 0], ["vec", "ot", 1], ["wmma_m", "ot", 16]]}, "result": [[2.2374005e-05], 0, 1.8976116180419922, 1651934248.5158467], "version": 0.2, "tvm_version": "0.8.0"}
{"input": ["cuda -keys=cuda,gpu -max_num_threads=1024 -thread_warp_size=32", "fused_roll_reshape_qkv_matmul.cuda", [["TENSOR", [1, 32, 32, 256], "float16"], ["TENSOR", [768, 256], "float16"], 1, 32, 32, 256, 3], {}], "config": {"index": 12801, "code_hash": null, "entity": [["block_row_warps", "ot", 1], ["block_col_warps", "ot", 2], ["warp_row_tiles", "ot", 1], ["warp_col_tiles", "ot", 1], ["chunk", "ot", 4], ["offset", "ot", 8], ["offsetCS", "ot", 8], ["vec", "ot", 2], ["wmma_m", "ot", 8]]}, "result": [[2.2110610000000002e-05], 0, 1.5092413425445557, 1651934249.118761], "version": 0.2, "tvm_version": "0.8.0"}
{"input": ["cuda -keys=cuda,gpu -max_num_threads=1024 -thread_warp_size=32", "fused_roll_reshape_qkv_matmul.cuda", [["TENSOR", [1, 32, 32, 256], "float16"], ["TENSOR", [768, 256], "float16"], 1, 32, 32, 256, 3], {}], "config": {"index": 4707, "code_hash": null, "entity": [["block_row_warps", "ot", 1], ["block_col_warps", "ot", 1], ["warp_row_tiles", "ot", 2], ["warp_col_tiles", "ot", 1], ["chunk", "ot", 4], ["offset", "ot", 0], ["offsetCS", "ot", 8], ["vec", "ot", 8], ["wmma_m", "ot", 32]]}, "result": [[7.0179452e-05], 0, 1.600127935409546, 1651934251.0173056], "version": 0.2, "tvm_version": "0.8.0"}
{"input": ["cuda -keys=cuda,gpu -max_num_threads=1024 -thread_warp_size=32", "fused_roll_reshape_qkv_matmul.cuda", [["TENSOR", [1, 32, 32, 256], "float16"], ["TENSOR", [768, 256], "float16"], 1, 32, 32, 256, 3], {}], "config": {"index": 8451, "code_hash": null, "entity": [["block_row_warps", "ot", 1], ["block_col_warps", "ot", 1], ["warp_row_tiles", "ot", 1], ["warp_col_tiles", "ot", 2], ["chunk", "ot", 1], ["offset", "ot", 0], ["offsetCS", "ot", 8], ["vec", "ot", 4], ["wmma_m", "ot", 16]]}, "result": [[2.2670274e-05], 0, 1.5672321319580078, 1651934251.5338514], "version": 0.2, "tvm_version": "0.8.0"}
{"input": ["cuda -keys=cuda,gpu -max_num_threads=1024 -thread_warp_size=32", "fused_roll_reshape_qkv_matmul.cuda", [["TENSOR", [1, 32, 32, 256], "float16"], ["TENSOR", [768, 256], "float16"], 1, 32, 32, 256, 3], {}], "config": {"index": 9028, "code_hash": null, "entity": [["block_row_warps", "ot", 2], ["block_col_warps", "ot", 1], ["warp_row_tiles", "ot", 2], ["warp_col_tiles", "ot", 2], ["chunk", "ot", 8], ["offset", "ot", 8], ["offsetCS", "ot", 8], ["vec", "ot", 4], ["wmma_m", "ot", 16]]}, "result": [[1.7652269000000002e-05], 0, 1.5933043956756592, 1651934253.4774423], "version": 0.2, "tvm_version": "0.8.0"}
{"input": ["cuda -keys=cuda,gpu -max_num_threads=1024 -thread_warp_size=32", "fused_roll_reshape_qkv_matmul.cuda", [["TENSOR", [1, 32, 32, 256], "float16"], ["TENSOR", [768, 256], "float16"], 1, 32, 32, 256, 3], {}], "config": {"index": 11597, "code_hash": null, "entity": [["block_row_warps", "ot", 4], ["block_col_warps", "ot", 2], ["warp_row_tiles", "ot", 2], ["warp_col_tiles", "ot", 1], ["chunk", "ot", 8], ["offset", "ot", 8], ["offsetCS", "ot", 8], ["vec", "ot", 1], ["wmma_m", "ot", 8]]}, "result": [[2.0027059e-05], 0, 1.6593034267425537, 1651934254.2187402], "version": 0.2, "tvm_version": "0.8.0"}
{"input": ["cuda -keys=cuda,gpu -max_num_threads=1024 -thread_warp_size=32", "fused_roll_reshape_qkv_matmul.cuda", [["TENSOR", [1, 32, 32, 256], "float16"], ["TENSOR", [768, 256], "float16"], 1, 32, 32, 256, 3], {}], "config": {"index": 15122, "code_hash": null, "entity": [["block_row_warps", "ot", 4], ["block_col_warps", "ot", 1], ["warp_row_tiles", "ot", 1], ["warp_col_tiles", "ot", 4], ["chunk", "ot", 4], ["offset", "ot", 0], ["offsetCS", "ot", 8], ["vec", "ot", 8], ["wmma_m", "ot", 8]]}, "result": [[5.8585250999999996e-05], 0, 1.7112700939178467, 1651934256.0374627], "version": 0.2, "tvm_version": "0.8.0"}
{"input": ["cuda -keys=cuda,gpu -max_num_threads=1024 -thread_warp_size=32", "fused_roll_reshape_qkv_matmul.cuda", [["TENSOR", [1, 32, 32, 256], "float16"], ["TENSOR", [768, 256], "float16"], 1, 32, 32, 256, 3], {}], "config": {"index": 1074, "code_hash": null, "entity": [["block_row_warps", "ot", 1], ["block_col_warps", "ot", 2], ["warp_row_tiles", "ot", 4], ["warp_col_tiles", "ot", 1], ["chunk", "ot", 2], ["offset", "ot", 8], ["offsetCS", "ot", 8], ["vec", "ot", 1], ["wmma_m", "ot", 32]]}, "result": [[2.5514080000000002e-05], 0, 1.5508761405944824, 1651934256.6998014], "version": 0.2, "tvm_version": "0.8.0"}
{"input": ["cuda -keys=cuda,gpu -max_num_threads=1024 -thread_warp_size=32", "fused_roll_reshape_qkv_matmul.cuda", [["TENSOR", [1, 32, 32, 256], "float16"], ["TENSOR", [768, 256], "float16"], 1, 32, 32, 256, 3], {}], "config": {"index": 6109, "code_hash": null, "entity": [["block_row_warps", "ot", 2], ["block_col_warps", "ot", 4], ["warp_row_tiles", "ot", 1], ["warp_col_tiles", "ot", 2], ["chunk", "ot", 8], ["offset", "ot", 0], ["offsetCS", "ot", 8], ["vec", "ot", 1], ["wmma_m", "ot", 16]]}, "result": [[4.8634299e-05], 0, 2.016789436340332, 1651934258.586659], "version": 0.2, "tvm_version": "0.8.0"}
{"input": ["cuda -keys=cuda,gpu -max_num_threads=1024 -thread_warp_size=32", "fused_roll_reshape_qkv_matmul.cuda", [["TENSOR", [1, 32, 32, 256], "float16"], ["TENSOR", [768, 256], "float16"], 1, 32, 32, 256, 3], {}], "config": {"index": 11217, "code_hash": null, "entity": [["block_row_warps", "ot", 1], ["block_col_warps", "ot", 2], ["warp_row_tiles", "ot", 2], ["warp_col_tiles", "ot", 2], ["chunk", "ot", 4], ["offset", "ot", 0], ["offsetCS", "ot", 8], ["vec", "ot", 1], ["wmma_m", "ot", 8]]}, "result": [[2.9241344999999997e-05], 0, 2.021157741546631, 1651934259.5509517], "version": 0.2, "tvm_version": "0.8.0"}
{"input": ["cuda -keys=cuda,gpu -max_num_threads=1024 -thread_warp_size=32", "fused_roll_reshape_qkv_matmul.cuda", [["TENSOR", [1, 32, 32, 256], "float16"], ["TENSOR", [768, 256], "float16"], 1, 32, 32, 256, 3], {}], "config": {"index": 5850, "code_hash": null, "entity": [["block_row_warps", "ot", 1], ["block_col_warps", "ot", 1], ["warp_row_tiles", "ot", 4], ["warp_col_tiles", "ot", 1], ["chunk", "ot", 1], ["offset", "ot", 0], ["offsetCS", "ot", 8], ["vec", "ot", 1], ["wmma_m", "ot", 16]]}, "result": [[2.1009895e-05], 0, 1.5225839614868164, 1651934260.9489994], "version": 0.2, "tvm_version": "0.8.0"}
{"input": ["cuda -keys=cuda,gpu -max_num_threads=1024 -thread_warp_size=32", "fused_roll_reshape_qkv_matmul.cuda", [["TENSOR", [1, 32, 32, 256], "float16"], ["TENSOR", [768, 256], "float16"], 1, 32, 32, 256, 3], {}], "config": {"index": 12414, "code_hash": null, "entity": [["block_row_warps", "ot", 1], ["block_col_warps", "ot", 2], ["warp_row_tiles", "ot", 4], ["warp_col_tiles", "ot", 1], ["chunk", "ot", 2], ["offset", "ot", 0], ["offsetCS", "ot", 8], ["vec", "ot", 2], ["wmma_m", "ot", 8]]}, "result": [[2.1668135e-05], 0, 1.7485642433166504, 1651934261.883518], "version": 0.2, "tvm_version": "0.8.0"}
{"input": ["cuda -keys=cuda,gpu -max_num_threads=1024 -thread_warp_size=32", "fused_roll_reshape_qkv_matmul.cuda", [["TENSOR", [1, 32, 32, 256], "float16"], ["TENSOR", [768, 256], "float16"], 1, 32, 32, 256, 3], {}], "config": {"index": 14630, "code_hash": null, "entity": [["block_row_warps", "ot", 4], ["block_col_warps", "ot", 2], ["warp_row_tiles", "ot", 4], ["warp_col_tiles", "ot", 2], ["chunk", "ot", 1], ["offset", "ot", 8], ["offsetCS", "ot", 0], ["vec", "ot", 8], ["wmma_m", "ot", 8]]}, "result": [[2.839828e-05], 0, 1.5415961742401123, 1651934263.4133813], "version": 0.2, "tvm_version": "0.8.0"}
{"input": ["cuda -keys=cuda,gpu -max_num_threads=1024 -thread_warp_size=32", "fused_roll_reshape_qkv_matmul.cuda", [["TENSOR", [1, 32, 32, 256], "float16"], ["TENSOR", [768, 256], "float16"], 1, 32, 32, 256, 3], {}], "config": {"index": 15108, "code_hash": null, "entity": [["block_row_warps", "ot", 1], ["block_col_warps", "ot", 4], ["warp_row_tiles", "ot", 2], ["warp_col_tiles", "ot", 2], ["chunk", "ot", 4], ["offset", "ot", 0], ["offsetCS", "ot", 8], ["vec", "ot", 8], ["wmma_m", "ot", 8]]}, "result": [[4.1987324e-05], 0, 1.716459035873413, 1651934265.3259203], "version": 0.2, "tvm_version": "0.8.0"}
{"input": ["cuda -keys=cuda,gpu -max_num_threads=1024 -thread_warp_size=32", "fused_roll_reshape_qkv_matmul.cuda", [["TENSOR", [1, 32, 32, 256], "float16"], ["TENSOR", [768, 256], "float16"], 1, 32, 32, 256, 3], {}], "config": {"index": 5160, "code_hash": null, "entity": [["block_row_warps", "ot", 1], ["block_col_warps", "ot", 2], ["warp_row_tiles", "ot", 1], ["warp_col_tiles", "ot", 4], ["chunk", "ot", 8], ["offset", "ot", 8], ["offsetCS", "ot", 8], ["vec", "ot", 8], ["wmma_m", "ot", 32]]}, "result": [[1.4553326e-05], 0, 1.7164227962493896, 1651934266.7840111], "version": 0.2, "tvm_version": "0.8.0"}
{"input": ["cuda -keys=cuda,gpu -max_num_threads=1024 -thread_warp_size=32", "fused_roll_reshape_qkv_matmul.cuda", [["TENSOR", [1, 32, 32, 256], "float16"], ["TENSOR", [768, 256], "float16"], 1, 32, 32, 256, 3], {}], "config": {"index": 10548, "code_hash": null, "entity": [["block_row_warps", "ot", 1], ["block_col_warps", "ot", 1], ["warp_row_tiles", "ot", 4], ["warp_col_tiles", "ot", 1], ["chunk", "ot", 4], ["offset", "ot", 0], ["offsetCS", "ot", 0], ["vec", "ot", 1], ["wmma_m", "ot", 8]]}, "result": [[5.7609989e-05], 0, 1.7743000984191895, 1651934268.6330535], "version": 0.2, "tvm_version": "0.8.0"}
{"input": ["cuda -keys=cuda,gpu -max_num_threads=1024 -thread_warp_size=32", "fused_roll_reshape_qkv_matmul.cuda", [["TENSOR", [1, 32, 32, 256], "float16"], ["TENSOR", [768, 256], "float16"], 1, 32, 32, 256, 3], {}], "config": {"index": 2767, "code_hash": null, "entity": [["block_row_warps", "ot", 2], ["block_col_warps", "ot", 2], ["warp_row_tiles", "ot", 2], ["warp_col_tiles", "ot", 1], ["chunk", "ot", 4], ["offset", "ot", 0], ["offsetCS", "ot", 0], ["vec", "ot", 4], ["wmma_m", "ot", 32]]}, "result": [[4.4015469e-05], 0, 1.5035247802734375, 1651934269.2278924], "version": 0.2, "tvm_version": "0.8.0"}
{"input": ["cuda -keys=cuda,gpu -max_num_threads=1024 -thread_warp_size=32", "fused_roll_reshape_qkv_matmul.cuda", [["TENSOR", [1, 32, 32, 256], "float16"], ["TENSOR", [768, 256], "float16"], 1, 32, 32, 256, 3], {}], "config": {"index": 7904, "code_hash": null, "entity": [["block_row_warps", "ot", 4], ["block_col_warps", "ot", 1], ["warp_row_tiles", "ot", 4], ["warp_col_tiles", "ot", 2], ["chunk", "ot", 2], ["offset", "ot", 0], ["offsetCS", "ot", 0], ["vec", "ot", 4], ["wmma_m", "ot", 16]]}, "result": [[2.656328e-05], 0, 1.7512822151184082, 1651934271.293178], "version": 0.2, "tvm_version": "0.8.0"}
{"input": ["cuda -keys=cuda,gpu -max_num_threads=1024 -thread_warp_size=32", "fused_roll_reshape_qkv_matmul.cuda", [["TENSOR", [1, 32, 32, 256], "float16"], ["TENSOR", [768, 256], "float16"], 1, 32, 32, 256, 3], {}], "config": {"index": 3267, "code_hash": null, "entity": [["block_row_warps", "ot", 1], ["block_col_warps", "ot", 1], ["warp_row_tiles", "ot", 1], ["warp_col_tiles", "ot", 2], ["chunk", "ot", 1], ["offset", "ot", 0], ["offsetCS", "ot", 8], ["vec", "ot", 4], ["wmma_m", "ot", 32]]}, "result": [[3.8066098e-05], 0, 1.5800254344940186, 1651934271.8430226], "version": 0.2, "tvm_version": "0.8.0"}
{"input": ["cuda -keys=cuda,gpu -max_num_threads=1024 -thread_warp_size=32", "fused_roll_reshape_qkv_matmul.cuda", [["TENSOR", [1, 32, 32, 256], "float16"], ["TENSOR", [768, 256], "float16"], 1, 32, 32, 256, 3], {}], "config": {"index": 14828, "code_hash": null, "entity": [["block_row_warps", "ot", 4], ["block_col_warps", "ot", 2], ["warp_row_tiles", "ot", 1], ["warp_col_tiles", "ot", 1], ["chunk", "ot", 8], ["offset", "ot", 8], ["offsetCS", "ot", 0], ["vec", "ot", 8], ["wmma_m", "ot", 8]]}, "result": [[1.6146142000000003e-05], 0, 1.4702749252319336, 1651934272.5252914], "version": 0.2, "tvm_version": "0.8.0"}
{"input": ["cuda -keys=cuda,gpu -max_num_threads=1024 -thread_warp_size=32", "fused_roll_reshape_qkv_matmul.cuda", [["TENSOR", [1, 32, 32, 256], "float16"], ["TENSOR", [768, 256], "float16"], 1, 32, 32, 256, 3], {}], "config": {"index": 6401, "code_hash": null, "entity": [["block_row_warps", "ot", 4], ["block_col_warps", "ot", 1], ["warp_row_tiles", "ot", 1], ["warp_col_tiles", "ot", 1], ["chunk", "ot", 8], ["offset", "ot", 8], ["offsetCS", "ot", 8], ["vec", "ot", 1], ["wmma_m", "ot", 16]]}, "result": [[2.3496138e-05], 0, 1.8706014156341553, 1651934273.5580435], "version": 0.2, "tvm_version": "0.8.0"}
{"input": ["cuda -keys=cuda,gpu -max_num_threads=1024 -thread_warp_size=32", "fused_roll_reshape_qkv_matmul.cuda", [["TENSOR", [1, 32, 32, 256], "float16"], ["TENSOR", [768, 256], "float16"], 1, 32, 32, 256, 3], {}], "config": {"index": 3717, "code_hash": null, "entity": [["block_row_warps", "ot", 1], ["block_col_warps", "ot", 1], ["warp_row_tiles", "ot", 4], ["warp_col_tiles", "ot", 4], ["chunk", "ot", 2], ["offset", "ot", 8], ["offsetCS", "ot", 8], ["vec", "ot", 4], ["wmma_m", "ot", 32]]}, "result": [[3.177511e-05], 0, 1.798779010772705, 1651934275.1400611], "version": 0.2, "tvm_version": "0.8.0"}
{"input": ["cuda -keys=cuda,gpu -max_num_threads=1024 -thread_warp_size=32", "fused_roll_reshape_qkv_matmul.cuda", [["TENSOR", [1, 32, 32, 256], "float16"], ["TENSOR", [768, 256], "float16"], 1, 32, 32, 256, 3], {}], "config": {"index": 10620, "code_hash": null, "entity": [["block_row_warps", "ot", 1], ["block_col_warps", "ot", 1], ["warp_row_tiles", "ot", 2], ["warp_col_tiles", "ot", 1], ["chunk", "ot", 8], ["offset", "ot", 0], ["offsetCS", "ot", 0], ["vec", "ot", 1], ["wmma_m", "ot", 8]]}, "result": [[6.494678999999999e-05], 0, 1.9248895645141602, 1651934276.2209609], "version": 0.2, "tvm_version": "0.8.0"}
{"input": ["cuda -keys=cuda,gpu -max_num_threads=1024 -thread_warp_size=32", "fused_roll_reshape_qkv_matmul.cuda", [["TENSOR", [1, 32, 32, 256], "float16"], ["TENSOR", [768, 256], "float16"], 1, 32, 32, 256, 3], {}], "config": {"index": 6380, "code_hash": null, "entity": [["block_row_warps", "ot", 4], ["block_col_warps", "ot", 4], ["warp_row_tiles", "ot", 1], ["warp_col_tiles", "ot", 4], ["chunk", "ot", 4], ["offset", "ot", 8], ["offsetCS", "ot", 8], ["vec", "ot", 1], ["wmma_m", "ot", 16]]}, "result": [[1.3944848e-05], 0, 1.4719550609588623, 1651934277.8909507], "version": 0.2, "tvm_version": "0.8.0"}
{"input": ["cuda -keys=cuda,gpu -max_num_threads=1024 -thread_warp_size=32", "fused_roll_reshape_qkv_matmul.cuda", [["TENSOR", [1, 32, 32, 256], "float16"], ["TENSOR", [768, 256], "float16"], 1, 32, 32, 256, 3], {}], "config": {"index": 11671, "code_hash": null, "entity": [["block_row_warps", "ot", 2], ["block_col_warps", "ot", 4], ["warp_row_tiles", "ot", 1], ["warp_col_tiles", "ot", 1], ["chunk", "ot", 1], ["offset", "ot", 0], ["offsetCS", "ot", 0], ["vec", "ot", 2], ["wmma_m", "ot", 8]]}, "result": [[4.3868513e-05], 0, 1.533292531967163, 1651934278.6186852], "version": 0.2, "tvm_version": "0.8.0"}
{"input": ["cuda -keys=cuda,gpu -max_num_threads=1024 -thread_warp_size=32", "fused_roll_reshape_qkv_matmul.cuda", [["TENSOR", [1, 32, 32, 256], "float16"], ["TENSOR", [768, 256], "float16"], 1, 32, 32, 256, 3], {}], "config": {"index": 14620, "code_hash": null, "entity": [["block_row_warps", "ot", 2], ["block_col_warps", "ot", 2], ["warp_row_tiles", "ot", 2], ["warp_col_tiles", "ot", 2], ["chunk", "ot", 1], ["offset", "ot", 8], ["offsetCS", "ot", 0], ["vec", "ot", 8], ["wmma_m", "ot", 8]]}, "result": [[3.9365674e-05], 0, 1.723090410232544, 1651934280.7103932], "version": 0.2, "tvm_version": "0.8.0"}
{"input": ["cuda -keys=cuda,gpu -max_num_threads=1024 -thread_warp_size=32", "fused_roll_reshape_qkv_matmul.cuda", [["TENSOR", [1, 32, 32, 256], "float16"], ["TENSOR", [768, 256], "float16"], 1, 32, 32, 256, 3], {}], "config": {"index": 6189, "code_hash": null, "entity": [["block_row_warps", "ot", 1], ["block_col_warps", "ot", 4], ["warp_row_tiles", "ot", 1], ["warp_col_tiles", "ot", 2], ["chunk", "ot", 1], ["offset", "ot", 8], ["offsetCS", "ot", 8], ["vec", "ot", 1], ["wmma_m", "ot", 16]]}, "result": [[2.7806952999999998e-05], 0, 1.5659866333007812, 1651934281.4445724], "version": 0.2, "tvm_version": "0.8.0"}
{"input": ["cuda -keys=cuda,gpu -max_num_threads=1024 -thread_warp_size=32", "fused_roll_reshape_qkv_matmul.cuda", [["TENSOR", [1, 32, 32, 256], "float16"], ["TENSOR", [768, 256], "float16"], 1, 32, 32, 256, 3], {}], "config": {"index": 6541, "code_hash": null, "entity": [["block_row_warps", "ot", 2], ["block_col_warps", "ot", 4], ["warp_row_tiles", "ot", 1], ["warp_col_tiles", "ot", 4], ["chunk", "ot", 1], ["offset", "ot", 0], ["offsetCS", "ot", 0], ["vec", "ot", 2], ["wmma_m", "ot", 16]]}, "result": [[2.6551535999999997e-05], 0, 1.4902229309082031, 1651934283.224512], "version": 0.2, "tvm_version": "0.8.0"}
{"input": ["cuda -keys=cuda,gpu -max_num_threads=1024 -thread_warp_size=32", "fused_roll_reshape_qkv_matmul.cuda", [["TENSOR", [1, 32, 32, 256], "float16"], ["TENSOR", [768, 256], "float16"], 1, 32, 32, 256, 3], {}], "config": {"index": 6834, "code_hash": null, "entity": [["block_row_warps", "ot", 1], ["block_col_warps", "ot", 2], ["warp_row_tiles", "ot", 1], ["warp_col_tiles", "ot", 2], ["chunk", "ot", 1], ["offset", "ot", 8], ["offsetCS", "ot", 0], ["vec", "ot", 2], ["wmma_m", "ot", 16]]}, "result": [[3.7997062e-05], 0, 1.46437406539917, 1651934283.7881072], "version": 0.2, "tvm_version": "0.8.0"}
{"input": ["cuda -keys=cuda,gpu -max_num_threads=1024 -thread_warp_size=32", "fused_roll_reshape_qkv_matmul.cuda", [["TENSOR", [1, 32, 32, 256], "float16"], ["TENSOR", [768, 256], "float16"], 1, 32, 32, 256, 3], {}], "config": {"index": 8300, "code_hash": null, "entity": [["block_row_warps", "ot", 4], ["block_col_warps", "ot", 1], ["warp_row_tiles", "ot", 2], ["warp_col_tiles", "ot", 2], ["chunk", "ot", 4], ["offset", "ot", 8], ["offsetCS", "ot", 0], ["vec", "ot", 4], ["wmma_m", "ot", 16]]}, "result": [[1.3122844e-05], 0, 1.586925983428955, 1651934285.6116655], "version": 0.2, "tvm_version": "0.8.0"}
{"input": ["cuda -keys=cuda,gpu -max_num_threads=1024 -thread_warp_size=32", "fused_roll_reshape_qkv_matmul.cuda", [["TENSOR", [1, 32, 32, 256], "float16"], ["TENSOR", [768, 256], "float16"], 1, 32, 32, 256, 3], {}], "config": {"index": 3624, "code_hash": null, "entity": [["block_row_warps", "ot", 1], ["block_col_warps", "ot", 4], ["warp_row_tiles", "ot", 1], ["warp_col_tiles", "ot", 4], ["chunk", "ot", 1], ["offset", "ot", 8], ["offsetCS", "ot", 8], ["vec", "ot", 4], ["wmma_m", "ot", 32]]}, "result": [[2.2501906999999998e-05], 0, 1.4882431030273438, 1651934286.2153401], "version": 0.2, "tvm_version": "0.8.0"}
{"input": ["cuda -keys=cuda,gpu -max_num_threads=1024 -thread_warp_size=32", "fused_roll_reshape_qkv_matmul.cuda", [["TENSOR", [1, 32, 32, 256], "float16"], ["TENSOR", [768, 256], "float16"], 1, 32, 32, 256, 3], {}], "config": {"index": 54, "code_hash": null, "entity": [["block_row_warps", "ot", 1], ["block_col_warps", "ot", 1], ["warp_row_tiles", "ot", 1], ["warp_col_tiles", "ot", 4], ["chunk", "ot", 1], ["offset", "ot", 0], ["offsetCS", "ot", 0], ["vec", "ot", 1], ["wmma_m", "ot", 32]]}, "result": [[3.6501172e-05], 0, 1.3819825649261475, 1651934309.7799811], "version": 0.2, "tvm_version": "0.8.0"}
{"input": ["cuda -keys=cuda,gpu -max_num_threads=1024 -thread_warp_size=32", "fused_roll_reshape_qkv_matmul.cuda", [["TENSOR", [1, 32, 32, 256], "float16"], ["TENSOR", [768, 256], "float16"], 1, 32, 32, 256, 3], {}], "config": {"index": 135, "code_hash": null, "entity": [["block_row_warps", "ot", 1], ["block_col_warps", "ot", 1], ["warp_row_tiles", "ot", 1], ["warp_col_tiles", "ot", 4], ["chunk", "ot", 2], ["offset", "ot", 0], ["offsetCS", "ot", 0], ["vec", "ot", 1], ["wmma_m", "ot", 32]]}, "result": [[2.6157551e-05], 0, 1.3770263195037842, 1651934310.457684], "version": 0.2, "tvm_version": "0.8.0"}
{"input": ["cuda -keys=cuda,gpu -max_num_threads=1024 -thread_warp_size=32", "fused_roll_reshape_qkv_matmul.cuda", [["TENSOR", [1, 32, 32, 256], "float16"], ["TENSOR", [768, 256], "float16"], 1, 32, 32, 256, 3], {}], "config": {"index": 378, "code_hash": null, "entity": [["block_row_warps", "ot", 1], ["block_col_warps", "ot", 1], ["warp_row_tiles", "ot", 1], ["warp_col_tiles", "ot", 4], ["chunk", "ot", 1], ["offset", "ot", 8], ["offsetCS", "ot", 0], ["vec", "ot", 1], ["wmma_m", "ot", 32]]}, "result": [[2.5444146000000002e-05], 0, 1.328002691268921, 1651934311.0926971], "version": 0.2, "tvm_version": "0.8.0"}
{"input": ["cuda -keys=cuda,gpu -max_num_threads=1024 -thread_warp_size=32", "fused_roll_reshape_qkv_matmul.cuda", [["TENSOR", [1, 32, 32, 256], "float16"], ["TENSOR", [768, 256], "float16"], 1, 32, 32, 256, 3], {}], "config": {"index": 219, "code_hash": null, "entity": [["block_row_warps", "ot", 1], ["block_col_warps", "ot", 2], ["warp_row_tiles", "ot", 1], ["warp_col_tiles", "ot", 4], ["chunk", "ot", 4], ["offset", "ot", 0], ["offsetCS", "ot", 0], ["vec", "ot", 1], ["wmma_m", "ot", 32]]}, "result": [[4.1400520000000006e-05], 0, 1.7666664123535156, 1651934312.1276848], "version": 0.2, "tvm_version": "0.8.0"}
{"input": ["cuda -keys=cuda,gpu -max_num_threads=1024 -thread_warp_size=32", "fused_roll_reshape_qkv_matmul.cuda", [["TENSOR", [1, 32, 32, 256], "float16"], ["TENSOR", [768, 256], "float16"], 1, 32, 32, 256, 3], {}], "config": {"index": 136, "code_hash": null, "entity": [["block_row_warps", "ot", 2], ["block_col_warps", "ot", 1], ["warp_row_tiles", "ot", 1], ["warp_col_tiles", "ot", 4], ["chunk", "ot", 2], ["offset", "ot", 0], ["offsetCS", "ot", 0], ["vec", "ot", 1], ["wmma_m", "ot", 32]]}, "result": [[3.7577004999999996e-05], 0, 1.4587600231170654, 1651934312.877526], "version": 0.2, "tvm_version": "0.8.0"}
{"input": ["cuda -keys=cuda,gpu -max_num_threads=1024 -thread_warp_size=32", "fused_roll_reshape_qkv_matmul.cuda", [["TENSOR", [1, 32, 32, 256], "float16"], ["TENSOR", [768, 256], "float16"], 1, 32, 32, 256, 3], {}], "config": {"index": 622, "code_hash": null, "entity": [["block_row_warps", "ot", 2], ["block_col_warps", "ot", 1], ["warp_row_tiles", "ot", 1], ["warp_col_tiles", "ot", 4], ["chunk", "ot", 8], ["offset", "ot", 8], ["offsetCS", "ot", 0], ["vec", "ot", 1], ["wmma_m", "ot", 32]]}, "result": [[2.9784154e-05], 0, 1.351236343383789, 1651934313.6385407], "version": 0.2, "tvm_version": "0.8.0"}
{"input": ["cuda -keys=cuda,gpu -max_num_threads=1024 -thread_warp_size=32", "fused_roll_reshape_qkv_matmul.cuda", [["TENSOR", [1, 32, 32, 256], "float16"], ["TENSOR", [768, 256], "float16"], 1, 32, 32, 256, 3], {}], "config": {"index": 460, "code_hash": null, "entity": [["block_row_warps", "ot", 2], ["block_col_warps", "ot", 1], ["warp_row_tiles", "ot", 1], ["warp_col_tiles", "ot", 4], ["chunk", "ot", 2], ["offset", "ot", 8], ["offsetCS", "ot", 0], ["vec", "ot", 1], ["wmma_m", "ot", 32]]}, "result": [[2.3812650999999996e-05], 0, 1.1370289325714111, 1651934314.201052], "version": 0.2, "tvm_version": "0.8.0"}
{"input": ["cuda -keys=cuda,gpu -max_num_threads=1024 -thread_warp_size=32", "fused_roll_reshape_qkv_matmul.cuda", [["TENSOR", [1, 32, 32, 256], "float16"], ["TENSOR", [768, 256], "float16"], 1, 32, 32, 256, 3], {}], "config": {"index": 630, "code_hash": null, "entity": [["block_row_warps", "ot", 1], ["block_col_warps", "ot", 1], ["warp_row_tiles", "ot", 2], ["warp_col_tiles", "ot", 4], ["chunk", "ot", 8], ["offset", "ot", 8], ["offsetCS", "ot", 0], ["vec", "ot", 1], ["wmma_m", "ot", 32]]}, "result": [[4.4902909999999994e-05], 0, 1.6855487823486328, 1651934315.0608022], "version": 0.2, "tvm_version": "0.8.0"}
{"input": ["cuda -keys=cuda,gpu -max_num_threads=1024 -thread_warp_size=32", "fused_roll_reshape_qkv_matmul.cuda", [["TENSOR", [1, 32, 32, 256], "float16"], ["TENSOR", [768, 256], "float16"], 1, 32, 32, 256, 3], {}], "config": {"index": 543, "code_hash": null, "entity": [["block_row_warps", "ot", 1], ["block_col_warps", "ot", 2], ["warp_row_tiles", "ot", 1], ["warp_col_tiles", "ot", 4], ["chunk", "ot", 4], ["offset", "ot", 8], ["offsetCS", "ot", 0], ["vec", "ot", 1], ["wmma_m", "ot", 32]]}, "result": [[1.2840746e-05], 0, 1.583113670349121, 1651934315.7743697], "version": 0.2, "tvm_version": "0.8.0"}
{"input": ["cuda -keys=cuda,gpu -max_num_threads=1024 -thread_warp_size=32", "fused_roll_reshape_qkv_matmul.cuda", [["TENSOR", [1, 32, 32, 256], "float16"], ["TENSOR", [768, 256], "float16"], 1, 32, 32, 256, 3], {}], "config": {"index": 138, "code_hash": null, "entity": [["block_row_warps", "ot", 1], ["block_col_warps", "ot", 2], ["warp_row_tiles", "ot", 1], ["warp_col_tiles", "ot", 4], ["chunk", "ot", 2], ["offset", "ot", 0], ["offsetCS", "ot", 0], ["vec", "ot", 1], ["wmma_m", "ot", 32]]}, "result": [[1.8526475e-05], 0, 1.2269983291625977, 1651934316.5655637], "version": 0.2, "tvm_version": "0.8.0"}
{"input": ["cuda -keys=cuda,gpu -max_num_threads=1024 -thread_warp_size=32", "fused_roll_reshape_qkv_matmul.cuda", [["TENSOR", [1, 32, 32, 256], "float16"], ["TENSOR", [768, 256], "float16"], 1, 32, 32, 256, 3], {}], "config": {"index": 379, "code_hash": null, "entity": [["block_row_warps", "ot", 2], ["block_col_warps", "ot", 1], ["warp_row_tiles", "ot", 1], ["warp_col_tiles", "ot", 4], ["chunk", "ot", 1], ["offset", "ot", 8], ["offsetCS", "ot", 0], ["vec", "ot", 1], ["wmma_m", "ot", 32]]}, "result": [[2.3756017e-05], 0, 1.243551254272461, 1651934317.1103861], "version": 0.2, "tvm_version": "0.8.0"}
{"input": ["cuda -keys=cuda,gpu -max_num_threads=1024 -thread_warp_size=32", "fused_roll_reshape_qkv_matmul.cuda", [["TENSOR", [1, 32, 32, 256], "float16"], ["TENSOR", [768, 256], "float16"], 1, 32, 32, 256, 3], {}], "config": {"index": 1029, "code_hash": null, "entity": [["block_row_warps", "ot", 1], ["block_col_warps", "ot", 2], ["warp_row_tiles", "ot", 1], ["warp_col_tiles", "ot", 4], ["chunk", "ot", 1], ["offset", "ot", 8], ["offsetCS", "ot", 8], ["vec", "ot", 1], ["wmma_m", "ot", 32]]}, "result": [[3.0051398e-05], 0, 1.3379008769989014, 1651934317.927371], "version": 0.2, "tvm_version": "0.8.0"}
{"input": ["cuda -keys=cuda,gpu -max_num_threads=1024 -thread_warp_size=32", "fused_roll_reshape_qkv_matmul.cuda", [["TENSOR", [1, 32, 32, 256], "float16"], ["TENSOR", [768, 256], "float16"], 1, 32, 32, 256, 3], {}], "config": {"index": 1683, "code_hash": null, "entity": [["block_row_warps", "ot", 1], ["block_col_warps", "ot", 1], ["warp_row_tiles", "ot", 2], ["warp_col_tiles", "ot", 4], ["chunk", "ot", 1], ["offset", "ot", 8], ["offsetCS", "ot", 0], ["vec", "ot", 2], ["wmma_m", "ot", 32]]}, "result": [[3.1275563e-05], 0, 1.5854907035827637, 1651934318.8110535], "version": 0.2, "tvm_version": "0.8.0"}
{"input": ["cuda -keys=cuda,gpu -max_num_threads=1024 -thread_warp_size=32", "fused_roll_reshape_qkv_matmul.cuda", [["TENSOR", [1, 32, 32, 256], "float16"], ["TENSOR", [768, 256], "float16"], 1, 32, 32, 256, 3], {}], "config": {"index": 2655, "code_hash": null, "entity": [["block_row_warps", "ot", 1], ["block_col_warps", "ot", 1], ["warp_row_tiles", "ot", 2], ["warp_col_tiles", "ot", 4], ["chunk", "ot", 1], ["offset", "ot", 0], ["offsetCS", "ot", 0], ["vec", "ot", 4], ["wmma_m", "ot", 32]]}, "result": [[2.5081231999999997e-05], 0, 1.2122821807861328, 1651934319.4393544], "version": 0.2, "tvm_version": "0.8.0"}
{"input": ["cuda -keys=cuda,gpu -max_num_threads=1024 -thread_warp_size=32", "fused_roll_reshape_qkv_matmul.cuda", [["TENSOR", [1, 32, 32, 256], "float16"], ["TENSOR", [768, 256], "float16"], 1, 32, 32, 256, 3], {}], "config": {"index": 2647, "code_hash": null, "entity": [["block_row_warps", "ot", 2], ["block_col_warps", "ot", 1], ["warp_row_tiles", "ot", 1], ["warp_col_tiles", "ot", 4], ["chunk", "ot", 1], ["offset", "ot", 0], ["offsetCS", "ot", 0], ["vec", "ot", 4], ["wmma_m", "ot", 32]]}, "result": [[2.3355964e-05], 0, 1.1663198471069336, 1651934320.0680923], "version": 0.2, "tvm_version": "0.8.0"}
{"input": ["cuda -keys=cuda,gpu -max_num_threads=1024 -thread_warp_size=32", "fused_roll_reshape_qkv_matmul.cuda", [["TENSOR", [1, 32, 32, 256], "float16"], ["TENSOR", [768, 256], "float16"], 1, 32, 32, 256, 3], {}], "config": {"index": 1351, "code_hash": null, "entity": [["block_row_warps", "ot", 2], ["block_col_warps", "ot", 1], ["warp_row_tiles", "ot", 1], ["warp_col_tiles", "ot", 4], ["chunk", "ot", 1], ["offset", "ot", 0], ["offsetCS", "ot", 0], ["vec", "ot", 2], ["wmma_m", "ot", 32]]}, "result": [[2.7816476000000005e-05], 0, 1.695117712020874, 1651934321.025119], "version": 0.2, "tvm_version": "0.8.0"}
{"input": ["cuda -keys=cuda,gpu -max_num_threads=1024 -thread_warp_size=32", "fused_roll_reshape_qkv_matmul.cuda", [["TENSOR", [1, 32, 32, 256], "float16"], ["TENSOR", [768, 256], "float16"], 1, 32, 32, 256, 3], {}], "config": {"index": 1116, "code_hash": null, "entity": [["block_row_warps", "ot", 1], ["block_col_warps", "ot", 1], ["warp_row_tiles", "ot", 2], ["warp_col_tiles", "ot", 4], ["chunk", "ot", 2], ["offset", "ot", 8], ["offsetCS", "ot", 8], ["vec", "ot", 1], ["wmma_m", "ot", 32]]}, "result": [[2.8616178000000002e-05], 0, 1.548680067062378, 1651934321.7112875], "version": 0.2, "tvm_version": "0.8.0"}
{"input": ["cuda -keys=cuda,gpu -max_num_threads=1024 -thread_warp_size=32", "fused_roll_reshape_qkv_matmul.cuda", [["TENSOR", [1, 32, 32, 256], "float16"], ["TENSOR", [768, 256], "float16"], 1, 32, 32, 256, 3], {}], "config": {"index": 1602, "code_hash": null, "entity": [["block_row_warps", "ot", 1], ["block_col_warps", "ot", 1], ["warp_row_tiles", "ot", 2], ["warp_col_tiles", "ot", 4], ["chunk", "ot", 8], ["offset", "ot", 0], ["offsetCS", "ot", 0], ["vec", "ot", 2], ["wmma_m", "ot", 32]]}, "result": [[5.7525635999999995e-05], 0, 1.7068731784820557, 1651934322.5255566], "version": 0.2, "tvm_version": "0.8.0"}
{"input": ["cuda -keys=cuda,gpu -max_num_threads=1024 -thread_warp_size=32", "fused_roll_reshape_qkv_matmul.cuda", [["TENSOR", [1, 32, 32, 256], "float16"], ["TENSOR", [768, 256], "float16"], 1, 32, 32, 256, 3], {}], "config": {"index": 3051, "code_hash": null, "entity": [["block_row_warps", "ot", 1], ["block_col_warps", "ot", 1], ["warp_row_tiles", "ot", 1], ["warp_col_tiles", "ot", 4], ["chunk", "ot", 2], ["offset", "ot", 8], ["offsetCS", "ot", 0], ["vec", "ot", 4], ["wmma_m", "ot", 32]]}, "result": [[1.2928027e-05], 0, 1.6649227142333984, 1651934323.4154956], "version": 0.2, "tvm_version": "0.8.0"}
{"input": ["cuda -keys=cuda,gpu -max_num_threads=1024 -thread_warp_size=32", "fused_roll_reshape_qkv_matmul.cuda", [["TENSOR", [1, 32, 32, 256], "float16"], ["TENSOR", [768, 256], "float16"], 1, 32, 32, 256, 3], {}], "config": {"index": 2568, "code_hash": null, "entity": [["block_row_warps", "ot", 1], ["block_col_warps", "ot", 2], ["warp_row_tiles", "ot", 1], ["warp_col_tiles", "ot", 4], ["chunk", "ot", 8], ["offset", "ot", 8], ["offsetCS", "ot", 8], ["vec", "ot", 2], ["wmma_m", "ot", 32]]}, "result": [[8.973115574783685e-06], 0, 1.5465271472930908, 1651934324.0893838], "version": 0.2, "tvm_version": "0.8.0"}
{"input": ["cuda -keys=cuda,gpu -max_num_threads=1024 -thread_warp_size=32", "fused_roll_reshape_qkv_matmul.cuda", [["TENSOR", [1, 32, 32, 256], "float16"], ["TENSOR", [768, 256], "float16"], 1, 32, 32, 256, 3], {}], "config": {"index": 702, "code_hash": null, "entity": [["block_row_warps", "ot", 1], ["block_col_warps", "ot", 1], ["warp_row_tiles", "ot", 1], ["warp_col_tiles", "ot", 4], ["chunk", "ot", 1], ["offset", "ot", 0], ["offsetCS", "ot", 8], ["vec", "ot", 1], ["wmma_m", "ot", 32]]}, "result": [[3.1026589e-05], 0, 1.3888511657714844, 1651934324.7487395], "version": 0.2, "tvm_version": "0.8.0"}
