python/models/swin_transformer/kernel_configs/swin_transformer_roll_1_28_28_256_-3_float16.log
{"i": [["[\"roll\", 1, 28, 28, 256, -3, \"float16\"]", "cuda -keys=cuda,gpu -max_num_threads=1024 -model=unknown -thread_warp_size=32", [-1, 16, 64, 49152, 2147483647, 1024, 8, 32], "", 0, []], [[], [["FU", 1, [0, 1, 2, 3]], ["SP", 1, 0, 200704, [4], 1], ["AN", 1, 0, 5], ["AN", 1, 1, 6]]]], "r": [[3.99513e-05, 3.99369e-05, 3.99593e-05], 0, 1.78838, 1668050173], "v": "v0.6"}
{"i": [["[\"roll\", 1, 28, 28, 256, -3, \"float16\"]", "cuda -keys=cuda,gpu -max_num_threads=1024 -model=unknown -thread_warp_size=32", [-1, 16, 64, 49152, 2147483647, 1024, 8, 32], "", 0, []], [[], [["FU", 1, [0, 1, 2, 3]], ["SP", 1, 0, 200704, [49], 1], ["AN", 1, 0, 5], ["AN", 1, 1, 6]]]], "r": [[5.64394e-06, 5.65357e-06, 5.65538e-06], 0, 2.17334, 1668050173], "v": "v0.6"}
{"i": [["[\"roll\", 1, 28, 28, 256, -3, \"float16\"]", "cuda -keys=cuda,gpu -max_num_threads=1024 -model=unknown -thread_warp_size=32", [-1, 16, 64, 49152, 2147483647, 1024, 8, 32], "", 0, []], [[], [["FU", 1, [0, 1, 2, 3]], ["SP", 1, 0, 200704, [28], 1], ["AN", 1, 0, 5], ["AN", 1, 1, 6]]]], "r": [[8.1596e-06, 8.16907e-06, 8.16672e-06], 0, 1.4195, 1668050172], "v": "v0.6"}
{"i": [["[\"roll\", 1, 28, 28, 256, -3, \"float16\"]", "cuda -keys=cuda,gpu -max_num_threads=1024 -model=unknown -thread_warp_size=32", [-1, 16, 64, 49152, 2147483647, 1024, 8, 32], "", 0, []], [[], [["FU", 1, [0, 1, 2, 3]], ["SP", 1, 0, 200704, [16], 1], ["AN", 1, 0, 5], ["AN", 1, 1, 6]]]], "r": [[1.20477e-05, 1.20623e-05, 1.20625e-05], 0, 1.02043, 1668050172], "v": "v0.6"}
{"i": [["[\"roll\", 1, 28, 28, 256, -3, \"float16\"]", "cuda -keys=cuda,gpu -max_num_threads=1024 -model=unknown -thread_warp_size=32", [-1, 16, 64, 49152, 2147483647, 1024, 8, 32], "", 0, []], [[], [["FU", 1, [0, 1, 2, 3]], ["SP", 1, 0, 200704, [64], 1], ["AN", 1, 0, 5], ["AN", 1, 1, 6]]]], "r": [[4.99008e-06, 5.00564e-06, 5.00302e-06], 0, 0.70404, 1668050171], "v": "v0.6"}
{"i": [["[\"roll\", 1, 28, 28, 256, -3, \"float16\"]", "cuda -keys=cuda,gpu -max_num_threads=1024 -model=unknown -thread_warp_size=32", [-1, 16, 64, 49152, 2147483647, 1024, 8, 32], "", 0, []], [[], [["FU", 1, [0, 1, 2, 3]], ["SP", 1, 0, 200704, [2], 1], ["AN", 1, 0, 5], ["AN", 1, 1, 6]]]], "r": [[7.7204e-05, 7.72182e-05, 7.72323e-05], 0, 2.9792, 1668050174], "v": "v0.6"}
{"i": [["[\"roll\", 1, 28, 28, 256, -3, \"float16\"]", "cuda -keys=cuda,gpu -max_num_threads=1024 -model=unknown -thread_warp_size=32", [-1, 16, 64, 49152, 2147483647, 1024, 8, 32], "", 0, []], [[], [["FU", 1, [0, 1, 2, 3]], ["SP", 1, 0, 200704, [7], 1], ["AN", 1, 0, 5], ["AN", 1, 1, 6]]]], "r": [[2.40628e-05, 2.40682e-05, 2.40724e-05], 0, 2.59822, 1668050173], "v": "v0.6"}
{"i": [["[\"roll\", 1, 28, 28, 256, -3, \"float16\"]", "cuda -keys=cuda,gpu -max_num_threads=1024 -model=unknown -thread_warp_size=32", [-1, 16, 64, 49152, 2147483647, 1024, 8, 32], "", 0, []], [[], [["FU", 1, [0, 1, 2, 3]], ["SP", 1, 0, 200704, [1], 1], ["AN", 1, 0, 5], ["AN", 1, 1, 6]]]], "r": [[0.00015179, 0.000151752, 0.000151779], 0, 4.1413, 1668050175], "v": "v0.6"}
{"i": [["[\"roll\", 1, 28, 28, 256, -3, \"float16\"]", "cuda -keys=cuda,gpu -max_num_threads=1024 -model=unknown -thread_warp_size=32", [-1, 16, 64, 49152, 2147483647, 1024, 8, 32], "", 0, []], [[], [["FU", 1, [0, 1, 2, 3]], ["SP", 1, 0, 200704, [14], 1], ["AN", 1, 0, 5], ["AN", 1, 1, 6]]]], "r": [[1.34364e-05, 1.34405e-05, 1.3444e-05], 0, 3.35828, 1668050174], "v": "v0.6"}
{"i": [["[\"roll\", 1, 28, 28, 256, -3, \"float16\"]", "cuda -keys=cuda,gpu -max_num_threads=1024 -model=unknown -thread_warp_size=32", [-1, 16, 64, 49152, 2147483647, 1024, 8, 32], "", 0, []], [[], [["FU", 1, [0, 1, 2, 3]], ["SP", 1, 0, 200704, [32], 1], ["AN", 1, 0, 5], ["AN", 1, 1, 6]]]], "r": [[7.26673e-06, 7.28177e-06, 7.27806e-06], 0, 3.75876, 1668050175], "v": "v0.6"}
{"i": [["[\"roll\", 1, 28, 28, 256, -3, \"float16\"]", "cuda -keys=cuda,gpu -max_num_threads=1024 -model=unknown -thread_warp_size=32", [-1, 16, 64, 49152, 2147483647, 1024, 8, 32], "", 0, []], [[], [["FU", 1, [0, 1, 2, 3]], ["SP", 1, 0, 200704, [8], 1], ["AN", 1, 0, 5], ["AN", 1, 1, 6]]]], "r": [[2.16156e-05, 2.16262e-05, 2.16319e-05], 0, 4.45217, 1668050175], "v": "v0.6"}
{"i": [["[\"roll\", 1, 28, 28, 256, -3, \"float16\"]", "cuda -keys=cuda,gpu -max_num_threads=1024 -model=unknown -thread_warp_size=32", [-1, 16, 64, 49152, 2147483647, 1024, 8, 32], "", 0, []], [[], [["FU", 1, [0, 1, 2, 3]], ["SP", 1, 0, 200704, [56], 1], ["AN", 1, 0, 5], ["AN", 1, 1, 6]]]], "r": [[5.1668e-06, 5.1731e-06, 5.17264e-06], 0, 4.88697, 1668050176], "v": "v0.6"}
{"i": [["[\"roll\", 1, 28, 28, 256, -3, \"float16\"]", "cuda -keys=cuda,gpu -max_num_threads=1024 -model=unknown -thread_warp_size=32", [-1, 16, 64, 49152, 2147483647, 1024, 8, 32], "", 0, []], [[], [["FU", 1, [0, 1, 2, 3]], ["SP", 1, 0, 200704, [49], 1], ["AN", 1, 0, 5], ["AN", 1, 1, 6]]]], "r": [[5.78421e-06, 5.7991e-06, 5.79959e-06], 0, 1.94824, 1668051425], "v": "v0.6"}
{"i": [["[\"roll\", 1, 28, 28, 256, -3, \"float16\"]", "cuda -keys=cuda,gpu -max_num_threads=1024 -model=unknown -thread_warp_size=32", [-1, 16, 64, 49152, 2147483647, 1024, 8, 32], "", 0, []], [[], [["FU", 1, [0, 1, 2, 3]], ["SP", 1, 0, 200704, [1], 1], ["AN", 1, 0, 5], ["AN", 1, 1, 6]]]], "r": [[0.000151777, 0.00015177, 0.000151763], 0, 1.61338, 1668051424], "v": "v0.6"}
{"i": [["[\"roll\", 1, 28, 28, 256, -3, \"float16\"]", "cuda -keys=cuda,gpu -max_num_threads=1024 -model=unknown -thread_warp_size=32", [-1, 16, 64, 49152, 2147483647, 1024, 8, 32], "", 0, []], [[], [["FU", 1, [0, 1, 2, 3]], ["SP", 1, 0, 200704, [28], 1], ["AN", 1, 0, 5], ["AN", 1, 1, 6]]]], "r": [[7.98769e-06, 7.99633e-06, 7.99689e-06], 0, 2.27741, 1668051425], "v": "v0.6"}
{"i": [["[\"roll\", 1, 28, 28, 256, -3, \"float16\"]", "cuda -keys=cuda,gpu -max_num_threads=1024 -model=unknown -thread_warp_size=32", [-1, 16, 64, 49152, 2147483647, 1024, 8, 32], "", 0, []], [[], [["FU", 1, [0, 1, 2, 3]], ["SP", 1, 0, 200704, [4], 1], ["AN", 1, 0, 5], ["AN", 1, 1, 6]]]], "r": [[4.00694e-05, 4.01036e-05, 4.00968e-05], 0, 0.578574, 1668051423], "v": "v0.6"}
{"i": [["[\"roll\", 1, 28, 28, 256, -3, \"float16\"]", "cuda -keys=cuda,gpu -max_num_threads=1024 -model=unknown -thread_warp_size=32", [-1, 16, 64, 49152, 2147483647, 1024, 8, 32], "", 0, []], [[], [["FU", 1, [0, 1, 2, 3]], ["SP", 1, 0, 200704, [64], 1], ["AN", 1, 0, 5], ["AN", 1, 1, 6]]]], "r": [[4.90406e-06, 4.91625e-06, 4.91564e-06], 0, 0.912851, 1668051424], "v": "v0.6"}
{"i": [["[\"roll\", 1, 28, 28, 256, -3, \"float16\"]", "cuda -keys=cuda,gpu -max_num_threads=1024 -model=unknown -thread_warp_size=32", [-1, 16, 64, 49152, 2147483647, 1024, 8, 32], "", 0, []], [[], [["FU", 1, [0, 1, 2, 3]], ["SP", 1, 0, 200704, [16], 1], ["AN", 1, 0, 5], ["AN", 1, 1, 6]]]], "r": [[1.20817e-05, 1.20989e-05, 1.21012e-05], 0, 1.24932, 1668051424], "v": "v0.6"}
{"i": [["[\"roll\", 1, 28, 28, 256, -3, \"float16\"]", "cuda -keys=cuda,gpu -max_num_threads=1024 -model=unknown -thread_warp_size=32", [-1, 16, 64, 49152, 2147483647, 1024, 8, 32], "", 0, []], [[], [["FU", 1, [0, 1, 2, 3]], ["SP", 1, 0, 200704, [7], 1], ["AN", 1, 0, 5], ["AN", 1, 1, 6]]]], "r": [[2.40497e-05, 2.40697e-05, 2.40439e-05], 0, 2.63046, 1668051425], "v": "v0.6"}
{"i": [["[\"roll\", 1, 28, 28, 256, -3, \"float16\"]", "cuda -keys=cuda,gpu -max_num_threads=1024 -model=unknown -thread_warp_size=32", [-1, 16, 64, 49152, 2147483647, 1024, 8, 32], "", 0, []], [[], [["FU", 1, [0, 1, 2, 3]], ["SP", 1, 0, 200704, [8], 1], ["AN", 1, 0, 5], ["AN", 1, 1, 6]]]], "r": [[2.14408e-05, 2.14603e-05, 2.14464e-05], 0, 3.67249, 1668051426], "v": "v0.6"}
{"i": [["[\"roll\", 1, 28, 28, 256, -3, \"float16\"]", "cuda -keys=cuda,gpu -max_num_threads=1024 -model=unknown -thread_warp_size=32", [-1, 16, 64, 49152, 2147483647, 1024, 8, 32], "", 0, []], [[], [["FU", 1, [0, 1, 2, 3]], ["SP", 1, 0, 200704, [2], 1], ["AN", 1, 0, 5], ["AN", 1, 1, 6]]]], "r": [[7.72481e-05, 7.72545e-05, 7.72683e-05], 0, 2.96216, 1668051426], "v": "v0.6"}
{"i": [["[\"roll\", 1, 28, 28, 256, -3, \"float16\"]", "cuda -keys=cuda,gpu -max_num_threads=1024 -model=unknown -thread_warp_size=32", [-1, 16, 64, 49152, 2147483647, 1024, 8, 32], "", 0, []], [[], [["FU", 1, [0, 1, 2, 3]], ["SP", 1, 0, 200704, [32], 1], ["AN", 1, 0, 5], ["AN", 1, 1, 6]]]], "r": [[7.45099e-06, 7.46082e-06, 7.46742e-06], 0, 3.29969, 1668051426], "v": "v0.6"}
{"i": [["[\"roll\", 1, 28, 28, 256, -3, \"float16\"]", "cuda -keys=cuda,gpu -max_num_threads=1024 -model=unknown -thread_warp_size=32", [-1, 16, 64, 49152, 2147483647, 1024, 8, 32], "", 0, []], [[], [["FU", 1, [0, 1, 2, 3]], ["SP", 1, 0, 200704, [14], 1], ["AN", 1, 0, 5], ["AN", 1, 1, 6]]]], "r": [[1.34344e-05, 1.34531e-05, 1.34526e-05], 0, 4.00867, 1668051427], "v": "v0.6"}
{"i": [["[\"roll\", 1, 28, 28, 256, -3, \"float16\"]", "cuda -keys=cuda,gpu -max_num_threads=1024 -model=unknown -thread_warp_size=32", [-1, 16, 64, 49152, 2147483647, 1024, 8, 32], "", 0, []], [[], [["FU", 1, [0, 1, 2, 3]], ["SP", 1, 0, 200704, [56], 1], ["AN", 1, 0, 5], ["AN", 1, 1, 6]]]], "r": [[5.21454e-06, 5.22378e-06, 5.22058e-06], 0, 4.31052, 1668051427], "v": "v0.6"}
