python/models/swin_transformer/kernel_configs/swin_transformer_softmax_norm_3136_49.log
{"i": [["[\"softmax_norm\", 3136, 49]", "cuda -keys=cuda,gpu -max_num_threads=1024 -model=unknown -thread_warp_size=32", [-1, 16, 64, 49152, 2147483647, 1024, 8, 32], "", 0, []], [[], [["FU", 2, [0, 1, 2]], ["SP", 2, 0, 7529536, [7], 1], ["AN", 2, 0, 5], ["AN", 2, 1, 6]]]], "r": [[0.000802205, 0.000802449, 0.000802303], 0, 1.88692, 1668052590], "v": "v0.6"}
{"i": [["[\"softmax_norm\", 3136, 49]", "cuda -keys=cuda,gpu -max_num_threads=1024 -model=unknown -thread_warp_size=32", [-1, 16, 64, 49152, 2147483647, 1024, 8, 32], "", 0, []], [[], [["FU", 2, [0, 1, 2]], ["SP", 2, 0, 7529536, [14], 1], ["AN", 2, 0, 5], ["AN", 2, 1, 6]]]], "r": [[0.000403088, 0.000403161, 0.000402901], 0, 1.08719, 1668052589], "v": "v0.6"}
{"i": [["[\"softmax_norm\", 3136, 49]", "cuda -keys=cuda,gpu -max_num_threads=1024 -model=unknown -thread_warp_size=32", [-1, 16, 64, 49152, 2147483647, 1024, 8, 32], "", 0, []], [[], [["FU", 2, [0, 1, 2]], ["SP", 2, 0, 7529536, [49], 1], ["AN", 2, 0, 5], ["AN", 2, 1, 6]]]], "r": [[0.000117319, 0.000117252, 0.00011724], 0, 2.75129, 1668052591], "v": "v0.6"}
{"i": [["[\"softmax_norm\", 3136, 49]", "cuda -keys=cuda,gpu -max_num_threads=1024 -model=unknown -thread_warp_size=32", [-1, 16, 64, 49152, 2147483647, 1024, 8, 32], "", 0, []], [[], [["FU", 2, [0, 1, 2]], ["SP", 2, 0, 7529536, [32], 1], ["AN", 2, 0, 5], ["AN", 2, 1, 6]]]], "r": [[0.00017833, 0.000178355, 0.000178312], 0, 3.60793, 1668052592], "v": "v0.6"}
{"i": [["[\"softmax_norm\", 3136, 49]", "cuda -keys=cuda,gpu -max_num_threads=1024 -model=unknown -thread_warp_size=32", [-1, 16, 64, 49152, 2147483647, 1024, 8, 32], "", 0, []], [[], [["FU", 2, [0, 1, 2]], ["SP", 2, 0, 7529536, [4], 1], ["AN", 2, 0, 5], ["AN", 2, 1, 6]]]], "r": [[0.00140229, 0.00140213, 0.00140166], 0, 5.32884, 1668052593], "v": "v0.6"}
{"i": [["[\"softmax_norm\", 3136, 49]", "cuda -keys=cuda,gpu -max_num_threads=1024 -model=unknown -thread_warp_size=32", [-1, 16, 64, 49152, 2147483647, 1024, 8, 32], "", 0, []], [[], [["FU", 2, [0, 1, 2]], ["SP", 2, 0, 7529536, [2], 1], ["AN", 2, 0, 5], ["AN", 2, 1, 6]]]], "r": [[0.00280037, 0.00279998, 0.00279985], 0, 4.44132, 1668052592], "v": "v0.6"}
{"i": [["[\"softmax_norm\", 3136, 49]", "cuda -keys=cuda,gpu -max_num_threads=1024 -model=unknown -thread_warp_size=32", [-1, 16, 64, 49152, 2147483647, 1024, 8, 32], "", 0, []], [[], [["FU", 2, [0, 1, 2]], ["SP", 2, 0, 7529536, [16], 1], ["AN", 2, 0, 5], ["AN", 2, 1, 6]]]], "r": [[0.000352433, 0.000352443, 0.000352405], 0, 6.16709, 1668052594], "v": "v0.6"}
{"i": [["[\"softmax_norm\", 3136, 49]", "cuda -keys=cuda,gpu -max_num_threads=1024 -model=unknown -thread_warp_size=32", [-1, 16, 64, 49152, 2147483647, 1024, 8, 32], "", 0, []], [[], [["FU", 2, [0, 1, 2]], ["SP", 2, 0, 7529536, [28], 1], ["AN", 2, 0, 5], ["AN", 2, 1, 6]]]], "r": [[0.000203565, 0.000203464, 0.000203477], 0, 8.76068, 1668052597], "v": "v0.6"}
{"i": [["[\"softmax_norm\", 3136, 49]", "cuda -keys=cuda,gpu -max_num_threads=1024 -model=unknown -thread_warp_size=32", [-1, 16, 64, 49152, 2147483647, 1024, 8, 32], "", 0, []], [[], [["FU", 2, [0, 1, 2]], ["SP", 2, 0, 7529536, [1], 1], ["AN", 2, 0, 5], ["AN", 2, 1, 6]]]], "r": [[0.00559432, 0.00559056, 0.00558962], 0, 7.90281, 1668052596], "v": "v0.6"}
{"i": [["[\"softmax_norm\", 3136, 49]", "cuda -keys=cuda,gpu -max_num_threads=1024 -model=unknown -thread_warp_size=32", [-1, 16, 64, 49152, 2147483647, 1024, 8, 32], "", 0, []], [[], [["FU", 2, [0, 1, 2]], ["SP", 2, 0, 7529536, [64], 1], ["AN", 2, 0, 5], ["AN", 2, 1, 6]]]], "r": [[9.05971e-05, 9.05798e-05, 9.05836e-05], 0, 10.468, 1668052599], "v": "v0.6"}
{"i": [["[\"softmax_norm\", 3136, 49]", "cuda -keys=cuda,gpu -max_num_threads=1024 -model=unknown -thread_warp_size=32", [-1, 16, 64, 49152, 2147483647, 1024, 8, 32], "", 0, []], [[], [["FU", 2, [0, 1, 2]], ["SP", 2, 0, 7529536, [56], 1], ["AN", 2, 0, 5], ["AN", 2, 1, 6]]]], "r": [[0.000103115, 0.000103079, 0.000103034], 0, 9.57997, 1668052598], "v": "v0.6"}
{"i": [["[\"softmax_norm\", 3136, 49]", "cuda -keys=cuda,gpu -max_num_threads=1024 -model=unknown -thread_warp_size=32", [-1, 16, 64, 49152, 2147483647, 1024, 8, 32], "", 0, []], [[], [["FU", 2, [0, 1, 2]], ["SP", 2, 0, 7529536, [8], 1], ["AN", 2, 0, 5], ["AN", 2, 1, 6]]]], "r": [[0.000702332, 0.000702441, 0.000702254], 0, 6.99276, 1668052595], "v": "v0.6"}
{"i": [["[\"softmax_norm\", 3136, 49]", "cuda -keys=cuda,gpu -max_num_threads=1024 -model=unknown -thread_warp_size=32", [-1, 16, 64, 49152, 2147483647, 1024, 8, 32], "", 0, []], [[], [["FU", 2, [0, 1, 2]], ["SP", 2, 0, 7529536, [2], 1], ["AN", 2, 0, 5], ["AN", 2, 1, 6]]]], "r": [[0.00279529, 0.00279526, 0.00279503], 0, 2.76393, 1668054185], "v": "v0.6"}
{"i": [["[\"softmax_norm\", 3136, 49]", "cuda -keys=cuda,gpu -max_num_threads=1024 -model=unknown -thread_warp_size=32", [-1, 16, 64, 49152, 2147483647, 1024, 8, 32], "", 0, []], [[], [["FU", 2, [0, 1, 2]], ["SP", 2, 0, 7529536, [7], 1], ["AN", 2, 0, 5], ["AN", 2, 1, 6]]]], "r": [[0.000801118, 0.000801206, 0.000801172], 0, 1.05716, 1668054183], "v": "v0.6"}
{"i": [["[\"softmax_norm\", 3136, 49]", "cuda -keys=cuda,gpu -max_num_threads=1024 -model=unknown -thread_warp_size=32", [-1, 16, 64, 49152, 2147483647, 1024, 8, 32], "", 0, []], [[], [["FU", 2, [0, 1, 2]], ["SP", 2, 0, 7529536, [4], 1], ["AN", 2, 0, 5], ["AN", 2, 1, 6]]]], "r": [[0.0013995, 0.00139934, 0.00139964], 0, 4.45172, 1668054187], "v": "v0.6"}
{"i": [["[\"softmax_norm\", 3136, 49]", "cuda -keys=cuda,gpu -max_num_threads=1024 -model=unknown -thread_warp_size=32", [-1, 16, 64, 49152, 2147483647, 1024, 8, 32], "", 0, []], [[], [["FU", 2, [0, 1, 2]], ["SP", 2, 0, 7529536, [1], 1], ["AN", 2, 0, 5], ["AN", 2, 1, 6]]]], "r": [[0.00558513, 0.00558439, 0.00558472], 0, 3.6299, 1668054186], "v": "v0.6"}
{"i": [["[\"softmax_norm\", 3136, 49]", "cuda -keys=cuda,gpu -max_num_threads=1024 -model=unknown -thread_warp_size=32", [-1, 16, 64, 49152, 2147483647, 1024, 8, 32], "", 0, []], [[], [["FU", 2, [0, 1, 2]], ["SP", 2, 0, 7529536, [16], 1], ["AN", 2, 0, 5], ["AN", 2, 1, 6]]]], "r": [[0.000352705, 0.000352698, 0.00035256], 0, 1.87894, 1668054184], "v": "v0.6"}
{"i": [["[\"softmax_norm\", 3136, 49]", "cuda -keys=cuda,gpu -max_num_threads=1024 -model=unknown -thread_warp_size=32", [-1, 16, 64, 49152, 2147483647, 1024, 8, 32], "", 0, []], [[], [["FU", 2, [0, 1, 2]], ["SP", 2, 0, 7529536, [28], 1], ["AN", 2, 0, 5], ["AN", 2, 1, 6]]]], "r": [[0.00020335, 0.00020326, 0.000203297], 0, 6.98115, 1668054189], "v": "v0.6"}
{"i": [["[\"softmax_norm\", 3136, 49]", "cuda -keys=cuda,gpu -max_num_threads=1024 -model=unknown -thread_warp_size=32", [-1, 16, 64, 49152, 2147483647, 1024, 8, 32], "", 0, []], [[], [["FU", 2, [0, 1, 2]], ["SP", 2, 0, 7529536, [32], 1], ["AN", 2, 0, 5], ["AN", 2, 1, 6]]]], "r": [[0.000178301, 0.000178287, 0.000178237], 0, 5.32521, 1668054188], "v": "v0.6"}
{"i": [["[\"softmax_norm\", 3136, 49]", "cuda -keys=cuda,gpu -max_num_threads=1024 -model=unknown -thread_warp_size=32", [-1, 16, 64, 49152, 2147483647, 1024, 8, 32], "", 0, []], [[], [["FU", 2, [0, 1, 2]], ["SP", 2, 0, 7529536, [64], 1], ["AN", 2, 0, 5], ["AN", 2, 1, 6]]]], "r": [[9.05903e-05, 9.05549e-05, 9.04976e-05], 0, 7.83821, 1668054190], "v": "v0.6"}
{"i": [["[\"softmax_norm\", 3136, 49]", "cuda -keys=cuda,gpu -max_num_threads=1024 -model=unknown -thread_warp_size=32", [-1, 16, 64, 49152, 2147483647, 1024, 8, 32], "", 0, []], [[], [["FU", 2, [0, 1, 2]], ["SP", 2, 0, 7529536, [49], 1], ["AN", 2, 0, 5], ["AN", 2, 1, 6]]]], "r": [[0.000117079, 0.000117075, 0.000117063], 0, 6.1467, 1668054189], "v": "v0.6"}
{"i": [["[\"softmax_norm\", 3136, 49]", "cuda -keys=cuda,gpu -max_num_threads=1024 -model=unknown -thread_warp_size=32", [-1, 16, 64, 49152, 2147483647, 1024, 8, 32], "", 0, []], [[], [["FU", 2, [0, 1, 2]], ["SP", 2, 0, 7529536, [14], 1], ["AN", 2, 0, 5], ["AN", 2, 1, 6]]]], "r": [[0.000402582, 0.000402582, 0.000402522], 0, 8.67338, 1668054191], "v": "v0.6"}
{"i": [["[\"softmax_norm\", 3136, 49]", "cuda -keys=cuda,gpu -max_num_threads=1024 -model=unknown -thread_warp_size=32", [-1, 16, 64, 49152, 2147483647, 1024, 8, 32], "", 0, []], [[], [["FU", 2, [0, 1, 2]], ["SP", 2, 0, 7529536, [56], 1], ["AN", 2, 0, 5], ["AN", 2, 1, 6]]]], "r": [[0.00010298, 0.000102996, 0.000102958], 0, 9.5084, 1668054192], "v": "v0.6"}
{"i": [["[\"softmax_norm\", 3136, 49]", "cuda -keys=cuda,gpu -max_num_threads=1024 -model=unknown -thread_warp_size=32", [-1, 16, 64, 49152, 2147483647, 1024, 8, 32], "", 0, []], [[], [["FU", 2, [0, 1, 2]], ["SP", 2, 0, 7529536, [8], 1], ["AN", 2, 0, 5], ["AN", 2, 1, 6]]]], "r": [[0.000701472, 0.000701334, 0.000701318], 0, 10.3171, 1668054193], "v": "v0.6"}
{"i": [["[\"softmax_norm\", 3136, 49]", "cuda -keys=cuda,gpu -max_num_threads=1024 -model=unknown -thread_warp_size=32", [-1, 16, 64, 49152, 2147483647, 1024, 8, 32], "", 0, []], [[], [["FU", 2, [0, 1, 2]], ["SP", 2, 0, 7529536, [16], 1], ["AN", 2, 0, 5], ["AN", 2, 1, 6]]]], "r": [[0.000352746, 0.000352631, 0.000352631], 0, 1.06715, 1668054618], "v": "v0.6"}
{"i": [["[\"softmax_norm\", 3136, 49]", "cuda -keys=cuda,gpu -max_num_threads=1024 -model=unknown -thread_warp_size=32", [-1, 16, 64, 49152, 2147483647, 1024, 8, 32], "", 0, []], [[], [["FU", 2, [0, 1, 2]], ["SP", 2, 0, 7529536, [14], 1], ["AN", 2, 0, 5], ["AN", 2, 1, 6]]]], "r": [[0.000402586, 0.000402615, 0.000402456], 0, 3.64469, 1668054621], "v": "v0.6"}
{"i": [["[\"softmax_norm\", 3136, 49]", "cuda -keys=cuda,gpu -max_num_threads=1024 -model=unknown -thread_warp_size=32", [-1, 16, 64, 49152, 2147483647, 1024, 8, 32], "", 0, []], [[], [["FU", 2, [0, 1, 2]], ["SP", 2, 0, 7529536, [64], 1], ["AN", 2, 0, 5], ["AN", 2, 1, 6]]]], "r": [[9.04883e-05, 9.0464e-05, 9.04217e-05], 0, 4.47126, 1668054621], "v": "v0.6"}
{"i": [["[\"softmax_norm\", 3136, 49]", "cuda -keys=cuda,gpu -max_num_threads=1024 -model=unknown -thread_warp_size=32", [-1, 16, 64, 49152, 2147483647, 1024, 8, 32], "", 0, []], [[], [["FU", 2, [0, 1, 2]], ["SP", 2, 0, 7529536, [1], 1], ["AN", 2, 0, 5], ["AN", 2, 1, 6]]]], "r": [[0.00558531, 0.0055849, 0.0055845], 0, 2.81474, 1668054620], "v": "v0.6"}
{"i": [["[\"softmax_norm\", 3136, 49]", "cuda -keys=cuda,gpu -max_num_threads=1024 -model=unknown -thread_warp_size=32", [-1, 16, 64, 49152, 2147483647, 1024, 8, 32], "", 0, []], [[], [["FU", 2, [0, 1, 2]], ["SP", 2, 0, 7529536, [2], 1], ["AN", 2, 0, 5], ["AN", 2, 1, 6]]]], "r": [[0.00279519, 0.00279514, 0.0027951], 0, 1.90166, 1668054619], "v": "v0.6"}
{"i": [["[\"softmax_norm\", 3136, 49]", "cuda -keys=cuda,gpu -max_num_threads=1024 -model=unknown -thread_warp_size=32", [-1, 16, 64, 49152, 2147483647, 1024, 8, 32], "", 0, []], [[], [["FU", 2, [0, 1, 2]], ["SP", 2, 0, 7529536, [4], 1], ["AN", 2, 0, 5], ["AN", 2, 1, 6]]]], "r": [[0.00139987, 0.00139956, 0.00139937], 0, 6.16671, 1668054623], "v": "v0.6"}
{"i": [["[\"softmax_norm\", 3136, 49]", "cuda -keys=cuda,gpu -max_num_threads=1024 -model=unknown -thread_warp_size=32", [-1, 16, 64, 49152, 2147483647, 1024, 8, 32], "", 0, []], [[], [["FU", 2, [0, 1, 2]], ["SP", 2, 0, 7529536, [8], 1], ["AN", 2, 0, 5], ["AN", 2, 1, 6]]]], "r": [[0.000701827, 0.000701708, 0.000701355], 0, 5.33972, 1668054622], "v": "v0.6"}
{"i": [["[\"softmax_norm\", 3136, 49]", "cuda -keys=cuda,gpu -max_num_threads=1024 -model=unknown -thread_warp_size=32", [-1, 16, 64, 49152, 2147483647, 1024, 8, 32], "", 0, []], [[], [["FU", 2, [0, 1, 2]], ["SP", 2, 0, 7529536, [28], 1], ["AN", 2, 0, 5], ["AN", 2, 1, 6]]]], "r": [[0.000203312, 0.000203217, 0.000203275], 0, 6.99182, 1668054624], "v": "v0.6"}
{"i": [["[\"softmax_norm\", 3136, 49]", "cuda -keys=cuda,gpu -max_num_threads=1024 -model=unknown -thread_warp_size=32", [-1, 16, 64, 49152, 2147483647, 1024, 8, 32], "", 0, []], [[], [["FU", 2, [0, 1, 2]], ["SP", 2, 0, 7529536, [56], 1], ["AN", 2, 0, 5], ["AN", 2, 1, 6]]]], "r": [[0.000102947, 0.000102928, 0.0001029], 0, 9.50755, 1668054627], "v": "v0.6"}
{"i": [["[\"softmax_norm\", 3136, 49]", "cuda -keys=cuda,gpu -max_num_threads=1024 -model=unknown -thread_warp_size=32", [-1, 16, 64, 49152, 2147483647, 1024, 8, 32], "", 0, []], [[], [["FU", 2, [0, 1, 2]], ["SP", 2, 0, 7529536, [32], 1], ["AN", 2, 0, 5], ["AN", 2, 1, 6]]]], "r": [[0.00017825, 0.000178272, 0.000178228], 0, 10.3918, 1668054627], "v": "v0.6"}
{"i": [["[\"softmax_norm\", 3136, 49]", "cuda -keys=cuda,gpu -max_num_threads=1024 -model=unknown -thread_warp_size=32", [-1, 16, 64, 49152, 2147483647, 1024, 8, 32], "", 0, []], [[], [["FU", 2, [0, 1, 2]], ["SP", 2, 0, 7529536, [49], 1], ["AN", 2, 0, 5], ["AN", 2, 1, 6]]]], "r": [[0.000117245, 0.000117193, 0.000117203], 0, 7.82629, 1668054625], "v": "v0.6"}
{"i": [["[\"softmax_norm\", 3136, 49]", "cuda -keys=cuda,gpu -max_num_threads=1024 -model=unknown -thread_warp_size=32", [-1, 16, 64, 49152, 2147483647, 1024, 8, 32], "", 0, []], [[], [["FU", 2, [0, 1, 2]], ["SP", 2, 0, 7529536, [7], 1], ["AN", 2, 0, 5], ["AN", 2, 1, 6]]]], "r": [[0.000801232, 0.000801031, 0.000801043], 0, 8.66206, 1668054626], "v": "v0.6"}
{"i": [["[\"softmax_norm\", 3136, 49]", "cuda -keys=cuda,gpu -max_num_threads=1024 -model=unknown -thread_warp_size=32", [-1, 16, 64, 49152, 2147483647, 1024, 8, 32], "", 0, []], [[], [["FU", 2, [0, 1, 2]], ["SP", 2, 0, 7529536, [14], 1], ["AN", 2, 0, 5], ["AN", 2, 1, 6]]]], "r": [[0.000402316, 0.0004024, 0.000402304], 0, 2.77365, 1668054999], "v": "v0.6"}
{"i": [["[\"softmax_norm\", 3136, 49]", "cuda -keys=cuda,gpu -max_num_threads=1024 -model=unknown -thread_warp_size=32", [-1, 16, 64, 49152, 2147483647, 1024, 8, 32], "", 0, []], [[], [["FU", 2, [0, 1, 2]], ["SP", 2, 0, 7529536, [4], 1], ["AN", 2, 0, 5], ["AN", 2, 1, 6]]]], "r": [[0.00139957, 0.00139939, 0.00139954], 0, 1.08288, 1668054997], "v": "v0.6"}
{"i": [["[\"softmax_norm\", 3136, 49]", "cuda -keys=cuda,gpu -max_num_threads=1024 -model=unknown -thread_warp_size=32", [-1, 16, 64, 49152, 2147483647, 1024, 8, 32], "", 0, []], [[], [["FU", 2, [0, 1, 2]], ["SP", 2, 0, 7529536, [8], 1], ["AN", 2, 0, 5], ["AN", 2, 1, 6]]]], "r": [[0.000701436, 0.00070133, 0.000701347], 0, 1.90795, 1668054998], "v": "v0.6"}
{"i": [["[\"softmax_norm\", 3136, 49]", "cuda -keys=cuda,gpu -max_num_threads=1024 -model=unknown -thread_warp_size=32", [-1, 16, 64, 49152, 2147483647, 1024, 8, 32], "", 0, []], [[], [["FU", 2, [0, 1, 2]], ["SP", 2, 0, 7529536, [56], 1], ["AN", 2, 0, 5], ["AN", 2, 1, 6]]]], "r": [[0.000102916, 0.000102914, 0.000102891], 0, 3.61683, 1668054999], "v": "v0.6"}
{"i": [["[\"softmax_norm\", 3136, 49]", "cuda -keys=cuda,gpu -max_num_threads=1024 -model=unknown -thread_warp_size=32", [-1, 16, 64, 49152, 2147483647, 1024, 8, 32], "", 0, []], [[], [["FU", 2, [0, 1, 2]], ["SP", 2, 0, 7529536, [2], 1], ["AN", 2, 0, 5], ["AN", 2, 1, 6]]]], "r": [[0.00279598, 0.00279562, 0.00279538], 0, 5.33575, 1668055001], "v": "v0.6"}
{"i": [["[\"softmax_norm\", 3136, 49]", "cuda -keys=cuda,gpu -max_num_threads=1024 -model=unknown -thread_warp_size=32", [-1, 16, 64, 49152, 2147483647, 1024, 8, 32], "", 0, []], [[], [["FU", 2, [0, 1, 2]], ["SP", 2, 0, 7529536, [49], 1], ["AN", 2, 0, 5], ["AN", 2, 1, 6]]]], "r": [[0.0001172, 0.000117133, 0.000117122], 0, 4.44217, 1668055000], "v": "v0.6"}
{"i": [["[\"softmax_norm\", 3136, 49]", "cuda -keys=cuda,gpu -max_num_threads=1024 -model=unknown -thread_warp_size=32", [-1, 16, 64, 49152, 2147483647, 1024, 8, 32], "", 0, []], [[], [["FU", 2, [0, 1, 2]], ["SP", 2, 0, 7529536, [7], 1], ["AN", 2, 0, 5], ["AN", 2, 1, 6]]]], "r": [[0.000801394, 0.000801364, 0.000801216], 0, 6.14612, 1668055002], "v": "v0.6"}
{"i": [["[\"softmax_norm\", 3136, 49]", "cuda -keys=cuda,gpu -max_num_threads=1024 -model=unknown -thread_warp_size=32", [-1, 16, 64, 49152, 2147483647, 1024, 8, 32], "", 0, []], [[], [["FU", 2, [0, 1, 2]], ["SP", 2, 0, 7529536, [1], 1], ["AN", 2, 0, 5], ["AN", 2, 1, 6]]]], "r": [[0.00558518, 0.00558476, 0.00558439], 0, 7.9069, 1668055004], "v": "v0.6"}
{"i": [["[\"softmax_norm\", 3136, 49]", "cuda -keys=cuda,gpu -max_num_threads=1024 -model=unknown -thread_warp_size=32", [-1, 16, 64, 49152, 2147483647, 1024, 8, 32], "", 0, []], [[], [["FU", 2, [0, 1, 2]], ["SP", 2, 0, 7529536, [16], 1], ["AN", 2, 0, 5], ["AN", 2, 1, 6]]]], "r": [[0.000352855, 0.000352706, 0.000352748], 0, 10.4187, 1668055006], "v": "v0.6"}
{"i": [["[\"softmax_norm\", 3136, 49]", "cuda -keys=cuda,gpu -max_num_threads=1024 -model=unknown -thread_warp_size=32", [-1, 16, 64, 49152, 2147483647, 1024, 8, 32], "", 0, []], [[], [["FU", 2, [0, 1, 2]], ["SP", 2, 0, 7529536, [32], 1], ["AN", 2, 0, 5], ["AN", 2, 1, 6]]]], "r": [[0.000178285, 0.000178274, 0.000178298], 0, 6.97906, 1668055003], "v": "v0.6"}
{"i": [["[\"softmax_norm\", 3136, 49]", "cuda -keys=cuda,gpu -max_num_threads=1024 -model=unknown -thread_warp_size=32", [-1, 16, 64, 49152, 2147483647, 1024, 8, 32], "", 0, []], [[], [["FU", 2, [0, 1, 2]], ["SP", 2, 0, 7529536, [64], 1], ["AN", 2, 0, 5], ["AN", 2, 1, 6]]]], "r": [[9.04847e-05, 9.04814e-05, 9.05158e-05], 0, 9.53992, 1668055005], "v": "v0.6"}
{"i": [["[\"softmax_norm\", 3136, 49]", "cuda -keys=cuda,gpu -max_num_threads=1024 -model=unknown -thread_warp_size=32", [-1, 16, 64, 49152, 2147483647, 1024, 8, 32], "", 0, []], [[], [["FU", 2, [0, 1, 2]], ["SP", 2, 0, 7529536, [28], 1], ["AN", 2, 0, 5], ["AN", 2, 1, 6]]]], "r": [[0.000203264, 0.000203199, 0.000203231], 0, 8.71834, 1668055005], "v": "v0.6"}
{"i": [["[\"softmax_norm\", 3136, 49]", "cuda -keys=cuda,gpu -max_num_threads=1024 -model=unknown -thread_warp_size=32", [-1, 16, 64, 49152, 2147483647, 1024, 8, 32], "", 0, []], [[], [["FU", 2, [0, 1, 2]], ["SP", 2, 0, 7529536, [4], 1], ["AN", 2, 0, 5], ["AN", 2, 1, 6]]]], "r": [[0.0013997, 0.00139944, 0.00139961], 0, 1.07973, 1668055280], "v": "v0.6"}
{"i": [["[\"softmax_norm\", 3136, 49]", "cuda -keys=cuda,gpu -max_num_threads=1024 -model=unknown -thread_warp_size=32", [-1, 16, 64, 49152, 2147483647, 1024, 8, 32], "", 0, []], [[], [["FU", 2, [0, 1, 2]], ["SP", 2, 0, 7529536, [2], 1], ["AN", 2, 0, 5], ["AN", 2, 1, 6]]]], "r": [[0.00279561, 0.00279529, 0.00279524], 0, 3.57587, 1668055282], "v": "v0.6"}
{"i": [["[\"softmax_norm\", 3136, 49]", "cuda -keys=cuda,gpu -max_num_threads=1024 -model=unknown -thread_warp_size=32", [-1, 16, 64, 49152, 2147483647, 1024, 8, 32], "", 0, []], [[], [["FU", 2, [0, 1, 2]], ["SP", 2, 0, 7529536, [8], 1], ["AN", 2, 0, 5], ["AN", 2, 1, 6]]]], "r": [[0.000701411, 0.000701453, 0.000701389], 0, 1.87665, 1668055281], "v": "v0.6"}
{"i": [["[\"softmax_norm\", 3136, 49]", "cuda -keys=cuda,gpu -max_num_threads=1024 -model=unknown -thread_warp_size=32", [-1, 16, 64, 49152, 2147483647, 1024, 8, 32], "", 0, []], [[], [["FU", 2, [0, 1, 2]], ["SP", 2, 0, 7529536, [7], 1], ["AN", 2, 0, 5], ["AN", 2, 1, 6]]]], "r": [[0.000801344, 0.000801146, 0.000801321], 0, 5.31434, 1668055284], "v": "v0.6"}
{"i": [["[\"softmax_norm\", 3136, 49]", "cuda -keys=cuda,gpu -max_num_threads=1024 -model=unknown -thread_warp_size=32", [-1, 16, 64, 49152, 2147483647, 1024, 8, 32], "", 0, []], [[], [["FU", 2, [0, 1, 2]], ["SP", 2, 0, 7529536, [1], 1], ["AN", 2, 0, 5], ["AN", 2, 1, 6]]]], "r": [[0.00558512, 0.00558451, 0.00558461], 0, 4.45933, 1668055283], "v": "v0.6"}
{"i": [["[\"softmax_norm\", 3136, 49]", "cuda -keys=cuda,gpu -max_num_threads=1024 -model=unknown -thread_warp_size=32", [-1, 16, 64, 49152, 2147483647, 1024, 8, 32], "", 0, []], [[], [["FU", 2, [0, 1, 2]], ["SP", 2, 0, 7529536, [16], 1], ["AN", 2, 0, 5], ["AN", 2, 1, 6]]]], "r": [[0.000352646, 0.000352717, 0.000352688], 0, 2.75029, 1668055281], "v": "v0.6"}
{"i": [["[\"softmax_norm\", 3136, 49]", "cuda -keys=cuda,gpu -max_num_threads=1024 -model=unknown -thread_warp_size=32", [-1, 16, 64, 49152, 2147483647, 1024, 8, 32], "", 0, []], [[], [["FU", 2, [0, 1, 2]], ["SP", 2, 0, 7529536, [28], 1], ["AN", 2, 0, 5], ["AN", 2, 1, 6]]]], "r": [[0.000203357, 0.000203298, 0.000203273], 0, 6.95999, 1668055286], "v": "v0.6"}
{"i": [["[\"softmax_norm\", 3136, 49]", "cuda -keys=cuda,gpu -max_num_threads=1024 -model=unknown -thread_warp_size=32", [-1, 16, 64, 49152, 2147483647, 1024, 8, 32], "", 0, []], [[], [["FU", 2, [0, 1, 2]], ["SP", 2, 0, 7529536, [32], 1], ["AN", 2, 0, 5], ["AN", 2, 1, 6]]]], "r": [[0.000178248, 0.000178236, 0.000178209], 0, 8.64749, 1668055287], "v": "v0.6"}
{"i": [["[\"softmax_norm\", 3136, 49]", "cuda -keys=cuda,gpu -max_num_threads=1024 -model=unknown -thread_warp_size=32", [-1, 16, 64, 49152, 2147483647, 1024, 8, 32], "", 0, []], [[], [["FU", 2, [0, 1, 2]], ["SP", 2, 0, 7529536, [56], 1], ["AN", 2, 0, 5], ["AN", 2, 1, 6]]]], "r": [[0.000102906, 0.000102914, 0.000102856], 0, 9.48825, 1668055288], "v": "v0.6"}
{"i": [["[\"softmax_norm\", 3136, 49]", "cuda -keys=cuda,gpu -max_num_threads=1024 -model=unknown -thread_warp_size=32", [-1, 16, 64, 49152, 2147483647, 1024, 8, 32], "", 0, []], [[], [["FU", 2, [0, 1, 2]], ["SP", 2, 0, 7529536, [14], 1], ["AN", 2, 0, 5], ["AN", 2, 1, 6]]]], "r": [[0.000402493, 0.000402378, 0.00040239], 0, 6.14163, 1668055285], "v": "v0.6"}
{"i": [["[\"softmax_norm\", 3136, 49]", "cuda -keys=cuda,gpu -max_num_threads=1024 -model=unknown -thread_warp_size=32", [-1, 16, 64, 49152, 2147483647, 1024, 8, 32], "", 0, []], [[], [["FU", 2, [0, 1, 2]], ["SP", 2, 0, 7529536, [49], 1], ["AN", 2, 0, 5], ["AN", 2, 1, 6]]]], "r": [[0.00011709, 0.000117117, 0.000117087], 0, 10.3819, 1668055289], "v": "v0.6"}
{"i": [["[\"softmax_norm\", 3136, 49]", "cuda -keys=cuda,gpu -max_num_threads=1024 -model=unknown -thread_warp_size=32", [-1, 16, 64, 49152, 2147483647, 1024, 8, 32], "", 0, []], [[], [["FU", 2, [0, 1, 2]], ["SP", 2, 0, 7529536, [64], 1], ["AN", 2, 0, 5], ["AN", 2, 1, 6]]]], "r": [[9.05402e-05, 9.05556e-05, 9.05323e-05], 0, 7.80666, 1668055287], "v": "v0.6"}
{"i": [["[\"softmax_norm\", 3136, 49]", "cuda -keys=cuda,gpu -max_num_threads=1024 -model=unknown -thread_warp_size=32", [-1, 16, 64, 49152, 2147483647, 1024, 8, 32], "", 0, []], [[], [["FU", 2, [0, 1, 2]], ["SP", 2, 0, 7529536, [7], 1], ["AN", 2, 0, 5], ["AN", 2, 1, 6]]]], "r": [[0.000801111, 0.000801042, 0.000800932], 0, 1.91969, 1668055564], "v": "v0.6"}
{"i": [["[\"softmax_norm\", 3136, 49]", "cuda -keys=cuda,gpu -max_num_threads=1024 -model=unknown -thread_warp_size=32", [-1, 16, 64, 49152, 2147483647, 1024, 8, 32], "", 0, []], [[], [["FU", 2, [0, 1, 2]], ["SP", 2, 0, 7529536, [56], 1], ["AN", 2, 0, 5], ["AN", 2, 1, 6]]]], "r": [[0.000102937, 0.000102912, 0.00010289], 0, 1.0842, 1668055563], "v": "v0.6"}
{"i": [["[\"softmax_norm\", 3136, 49]", "cuda -keys=cuda,gpu -max_num_threads=1024 -model=unknown -thread_warp_size=32", [-1, 16, 64, 49152, 2147483647, 1024, 8, 32], "", 0, []], [[], [["FU", 2, [0, 1, 2]], ["SP", 2, 0, 7529536, [8], 1], ["AN", 2, 0, 5], ["AN", 2, 1, 6]]]], "r": [[0.000701446, 0.0007015, 0.000701366], 0, 3.60607, 1668055565], "v": "v0.6"}
{"i": [["[\"softmax_norm\", 3136, 49]", "cuda -keys=cuda,gpu -max_num_threads=1024 -model=unknown -thread_warp_size=32", [-1, 16, 64, 49152, 2147483647, 1024, 8, 32], "", 0, []], [[], [["FU", 2, [0, 1, 2]], ["SP", 2, 0, 7529536, [32], 1], ["AN", 2, 0, 5], ["AN", 2, 1, 6]]]], "r": [[0.000178093, 0.000178125, 0.000178104], 0, 5.3279, 1668055567], "v": "v0.6"}
{"i": [["[\"softmax_norm\", 3136, 49]", "cuda -keys=cuda,gpu -max_num_threads=1024 -model=unknown -thread_warp_size=32", [-1, 16, 64, 49152, 2147483647, 1024, 8, 32], "", 0, []], [[], [["FU", 2, [0, 1, 2]], ["SP", 2, 0, 7529536, [4], 1], ["AN", 2, 0, 5], ["AN", 2, 1, 6]]]], "r": [[0.00139931, 0.00139915, 0.00139928], 0, 2.79048, 1668055565], "v": "v0.6"}
{"i": [["[\"softmax_norm\", 3136, 49]", "cuda -keys=cuda,gpu -max_num_threads=1024 -model=unknown -thread_warp_size=32", [-1, 16, 64, 49152, 2147483647, 1024, 8, 32], "", 0, []], [[], [["FU", 2, [0, 1, 2]], ["SP", 2, 0, 7529536, [16], 1], ["AN", 2, 0, 5], ["AN", 2, 1, 6]]]], "r": [[0.000352594, 0.000352536, 0.000352551], 0, 9.54038, 1668055571], "v": "v0.6"}
{"i": [["[\"softmax_norm\", 3136, 49]", "cuda -keys=cuda,gpu -max_num_threads=1024 -model=unknown -thread_warp_size=32", [-1, 16, 64, 49152, 2147483647, 1024, 8, 32], "", 0, []], [[], [["FU", 2, [0, 1, 2]], ["SP", 2, 0, 7529536, [2], 1], ["AN", 2, 0, 5], ["AN", 2, 1, 6]]]], "r": [[0.00279529, 0.00279515, 0.00279517], 0, 4.44069, 1668055566], "v": "v0.6"}
{"i": [["[\"softmax_norm\", 3136, 49]", "cuda -keys=cuda,gpu -max_num_threads=1024 -model=unknown -thread_warp_size=32", [-1, 16, 64, 49152, 2147483647, 1024, 8, 32], "", 0, []], [[], [["FU", 2, [0, 1, 2]], ["SP", 2, 0, 7529536, [1], 1], ["AN", 2, 0, 5], ["AN", 2, 1, 6]]]], "r": [[0.00558389, 0.00558408, 0.00558374], 0, 6.18371, 1668055568], "v": "v0.6"}
{"i": [["[\"softmax_norm\", 3136, 49]", "cuda -keys=cuda,gpu -max_num_threads=1024 -model=unknown -thread_warp_size=32", [-1, 16, 64, 49152, 2147483647, 1024, 8, 32], "", 0, []], [[], [["FU", 2, [0, 1, 2]], ["SP", 2, 0, 7529536, [14], 1], ["AN", 2, 0, 5], ["AN", 2, 1, 6]]]], "r": [[0.000402417, 0.000402421, 0.000402372], 0, 7.02463, 1668055569], "v": "v0.6"}
{"i": [["[\"softmax_norm\", 3136, 49]", "cuda -keys=cuda,gpu -max_num_threads=1024 -model=unknown -thread_warp_size=32", [-1, 16, 64, 49152, 2147483647, 1024, 8, 32], "", 0, []], [[], [["FU", 2, [0, 1, 2]], ["SP", 2, 0, 7529536, [64], 1], ["AN", 2, 0, 5], ["AN", 2, 1, 6]]]], "r": [[9.05461e-05, 9.05077e-05, 9.05207e-05], 0, 10.434, 1668055572], "v": "v0.6"}
{"i": [["[\"softmax_norm\", 3136, 49]", "cuda -keys=cuda,gpu -max_num_threads=1024 -model=unknown -thread_warp_size=32", [-1, 16, 64, 49152, 2147483647, 1024, 8, 32], "", 0, []], [[], [["FU", 2, [0, 1, 2]], ["SP", 2, 0, 7529536, [28], 1], ["AN", 2, 0, 5], ["AN", 2, 1, 6]]]], "r": [[0.000203339, 0.00020325, 0.000203294], 0, 8.7047, 1668055571], "v": "v0.6"}
{"i": [["[\"softmax_norm\", 3136, 49]", "cuda -keys=cuda,gpu -max_num_threads=1024 -model=unknown -thread_warp_size=32", [-1, 16, 64, 49152, 2147483647, 1024, 8, 32], "", 0, []], [[], [["FU", 2, [0, 1, 2]], ["SP", 2, 0, 7529536, [49], 1], ["AN", 2, 0, 5], ["AN", 2, 1, 6]]]], "r": [[0.000117144, 0.000117141, 0.000117139], 0, 7.87199, 1668055570], "v": "v0.6"}
{"i": [["[\"softmax_norm\", 3136, 49]", "cuda -keys=cuda,gpu -max_num_threads=1024 -model=unknown -thread_warp_size=32", [-1, 16, 64, 49152, 2147483647, 1024, 8, 32], "", 0, []], [[], [["FU", 2, [0, 1, 2]], ["SP", 2, 0, 7529536, [7], 1], ["AN", 2, 0, 5], ["AN", 2, 1, 6]]]], "r": [[0.000801052, 0.000801104, 0.000800998], 0, 4.4694, 1668055851], "v": "v0.6"}
{"i": [["[\"softmax_norm\", 3136, 49]", "cuda -keys=cuda,gpu -max_num_threads=1024 -model=unknown -thread_warp_size=32", [-1, 16, 64, 49152, 2147483647, 1024, 8, 32], "", 0, []], [[], [["FU", 2, [0, 1, 2]], ["SP", 2, 0, 7529536, [49], 1], ["AN", 2, 0, 5], ["AN", 2, 1, 6]]]], "r": [[0.000117116, 0.000117112, 0.000117134], 0, 5.3605, 1668055852], "v": "v0.6"}
{"i": [["[\"softmax_norm\", 3136, 49]", "cuda -keys=cuda,gpu -max_num_threads=1024 -model=unknown -thread_warp_size=32", [-1, 16, 64, 49152, 2147483647, 1024, 8, 32], "", 0, []], [[], [["FU", 2, [0, 1, 2]], ["SP", 2, 0, 7529536, [2], 1], ["AN", 2, 0, 5], ["AN", 2, 1, 6]]]], "r": [[0.00279555, 0.00279526, 0.00279514], 0, 3.63609, 1668055850], "v": "v0.6"}
{"i": [["[\"softmax_norm\", 3136, 49]", "cuda -keys=cuda,gpu -max_num_threads=1024 -model=unknown -thread_warp_size=32", [-1, 16, 64, 49152, 2147483647, 1024, 8, 32], "", 0, []], [[], [["FU", 2, [0, 1, 2]], ["SP", 2, 0, 7529536, [32], 1], ["AN", 2, 0, 5], ["AN", 2, 1, 6]]]], "r": [[0.000178218, 0.000178207, 0.000178242], 0, 2.79252, 1668055849], "v": "v0.6"}
{"i": [["[\"softmax_norm\", 3136, 49]", "cuda -keys=cuda,gpu -max_num_threads=1024 -model=unknown -thread_warp_size=32", [-1, 16, 64, 49152, 2147483647, 1024, 8, 32], "", 0, []], [[], [["FU", 2, [0, 1, 2]], ["SP", 2, 0, 7529536, [56], 1], ["AN", 2, 0, 5], ["AN", 2, 1, 6]]]], "r": [[0.000102969, 0.000102936, 0.000102942], 0, 1.08166, 1668055847], "v": "v0.6"}
{"i": [["[\"softmax_norm\", 3136, 49]", "cuda -keys=cuda,gpu -max_num_threads=1024 -model=unknown -thread_warp_size=32", [-1, 16, 64, 49152, 2147483647, 1024, 8, 32], "", 0, []], [[], [["FU", 2, [0, 1, 2]], ["SP", 2, 0, 7529536, [8], 1], ["AN", 2, 0, 5], ["AN", 2, 1, 6]]]], "r": [[0.000701463, 0.000701456, 0.000701354], 0, 1.9081, 1668055848], "v": "v0.6"}
{"i": [["[\"softmax_norm\", 3136, 49]", "cuda -keys=cuda,gpu -max_num_threads=1024 -model=unknown -thread_warp_size=32", [-1, 16, 64, 49152, 2147483647, 1024, 8, 32], "", 0, []], [[], [["FU", 2, [0, 1, 2]], ["SP", 2, 0, 7529536, [64], 1], ["AN", 2, 0, 5], ["AN", 2, 1, 6]]]], "r": [[9.04759e-05, 9.04608e-05, 9.045e-05], 0, 6.19788, 1668055853], "v": "v0.6"}
{"i": [["[\"softmax_norm\", 3136, 49]", "cuda -keys=cuda,gpu -max_num_threads=1024 -model=unknown -thread_warp_size=32", [-1, 16, 64, 49152, 2147483647, 1024, 8, 32], "", 0, []], [[], [["FU", 2, [0, 1, 2]], ["SP", 2, 0, 7529536, [16], 1], ["AN", 2, 0, 5], ["AN", 2, 1, 6]]]], "r": [[0.000352713, 0.000352573, 0.000352607], 0, 7.02373, 1668055853], "v": "v0.6"}
{"i": [["[\"softmax_norm\", 3136, 49]", "cuda -keys=cuda,gpu -max_num_threads=1024 -model=unknown -thread_warp_size=32", [-1, 16, 64, 49152, 2147483647, 1024, 8, 32], "", 0, []], [[], [["FU", 2, [0, 1, 2]], ["SP", 2, 0, 7529536, [28], 1], ["AN", 2, 0, 5], ["AN", 2, 1, 6]]]], "r": [[0.000203359, 0.000203322, 0.00020332], 0, 9.58883, 1668055856], "v": "v0.6"}
{"i": [["[\"softmax_norm\", 3136, 49]", "cuda -keys=cuda,gpu -max_num_threads=1024 -model=unknown -thread_warp_size=32", [-1, 16, 64, 49152, 2147483647, 1024, 8, 32], "", 0, []], [[], [["FU", 2, [0, 1, 2]], ["SP", 2, 0, 7529536, [14], 1], ["AN", 2, 0, 5], ["AN", 2, 1, 6]]]], "r": [[0.000402478, 0.000402502, 0.000402428], 0, 7.87726, 1668055854], "v": "v0.6"}
{"i": [["[\"softmax_norm\", 3136, 49]", "cuda -keys=cuda,gpu -max_num_threads=1024 -model=unknown -thread_warp_size=32", [-1, 16, 64, 49152, 2147483647, 1024, 8, 32], "", 0, []], [[], [["FU", 2, [0, 1, 2]], ["SP", 2, 0, 7529536, [4], 1], ["AN", 2, 0, 5], ["AN", 2, 1, 6]]]], "r": [[0.00140025, 0.0013998, 0.00139982], 0, 10.433, 1668055857], "v": "v0.6"}
{"i": [["[\"softmax_norm\", 3136, 49]", "cuda -keys=cuda,gpu -max_num_threads=1024 -model=unknown -thread_warp_size=32", [-1, 16, 64, 49152, 2147483647, 1024, 8, 32], "", 0, []], [[], [["FU", 2, [0, 1, 2]], ["SP", 2, 0, 7529536, [1], 1], ["AN", 2, 0, 5], ["AN", 2, 1, 6]]]], "r": [[0.00558548, 0.00558485, 0.00558473], 0, 8.74099, 1668055855], "v": "v0.6"}
{"i": [["[\"softmax_norm\", 3136, 49]", "cuda -keys=cuda,gpu -max_num_threads=1024 -model=unknown -thread_warp_size=32", [-1, 16, 64, 49152, 2147483647, 1024, 8, 32], "", 0, []], [[], [["FU", 2, [0, 1, 2]], ["SP", 2, 0, 7529536, [32], 1], ["AN", 2, 0, 5], ["AN", 2, 1, 6]]]], "r": [[0.000178152, 0.000178187, 0.000178134], 0, 1.89296, 1668056131], "v": "v0.6"}
{"i": [["[\"softmax_norm\", 3136, 49]", "cuda -keys=cuda,gpu -max_num_threads=1024 -model=unknown -thread_warp_size=32", [-1, 16, 64, 49152, 2147483647, 1024, 8, 32], "", 0, []], [[], [["FU", 2, [0, 1, 2]], ["SP", 2, 0, 7529536, [28], 1], ["AN", 2, 0, 5], ["AN", 2, 1, 6]]]], "r": [[0.000203312, 0.000203233, 0.000203209], 0, 2.76151, 1668056132], "v": "v0.6"}
{"i": [["[\"softmax_norm\", 3136, 49]", "cuda -keys=cuda,gpu -max_num_threads=1024 -model=unknown -thread_warp_size=32", [-1, 16, 64, 49152, 2147483647, 1024, 8, 32], "", 0, []], [[], [["FU", 2, [0, 1, 2]], ["SP", 2, 0, 7529536, [2], 1], ["AN", 2, 0, 5], ["AN", 2, 1, 6]]]], "r": [[0.00279501, 0.00279506, 0.00279479], 0, 4.4465, 1668056134], "v": "v0.6"}
{"i": [["[\"softmax_norm\", 3136, 49]", "cuda -keys=cuda,gpu -max_num_threads=1024 -model=unknown -thread_warp_size=32", [-1, 16, 64, 49152, 2147483647, 1024, 8, 32], "", 0, []], [[], [["FU", 2, [0, 1, 2]], ["SP", 2, 0, 7529536, [16], 1], ["AN", 2, 0, 5], ["AN", 2, 1, 6]]]], "r": [[0.00035267, 0.000352786, 0.000352639], 0, 1.07106, 1668056131], "v": "v0.6"}
{"i": [["[\"softmax_norm\", 3136, 49]", "cuda -keys=cuda,gpu -max_num_threads=1024 -model=unknown -thread_warp_size=32", [-1, 16, 64, 49152, 2147483647, 1024, 8, 32], "", 0, []], [[], [["FU", 2, [0, 1, 2]], ["SP", 2, 0, 7529536, [49], 1], ["AN", 2, 0, 5], ["AN", 2, 1, 6]]]], "r": [[0.000117124, 0.000117115, 0.000117101], 0, 3.60083, 1668056133], "v": "v0.6"}
{"i": [["[\"softmax_norm\", 3136, 49]", "cuda -keys=cuda,gpu -max_num_threads=1024 -model=unknown -thread_warp_size=32", [-1, 16, 64, 49152, 2147483647, 1024, 8, 32], "", 0, []], [[], [["FU", 2, [0, 1, 2]], ["SP", 2, 0, 7529536, [7], 1], ["AN", 2, 0, 5], ["AN", 2, 1, 6]]]], "r": [[0.000801032, 0.000800962, 0.000801009], 0, 6.95303, 1668056137], "v": "v0.6"}
{"i": [["[\"softmax_norm\", 3136, 49]", "cuda -keys=cuda,gpu -max_num_threads=1024 -model=unknown -thread_warp_size=32", [-1, 16, 64, 49152, 2147483647, 1024, 8, 32], "", 0, []], [[], [["FU", 2, [0, 1, 2]], ["SP", 2, 0, 7529536, [14], 1], ["AN", 2, 0, 5], ["AN", 2, 1, 6]]]], "r": [[0.000402425, 0.000402434, 0.00040227], 0, 6.13644, 1668056136], "v": "v0.6"}
{"i": [["[\"softmax_norm\", 3136, 49]", "cuda -keys=cuda,gpu -max_num_threads=1024 -model=unknown -thread_warp_size=32", [-1, 16, 64, 49152, 2147483647, 1024, 8, 32], "", 0, []], [[], [["FU", 2, [0, 1, 2]], ["SP", 2, 0, 7529536, [4], 1], ["AN", 2, 0, 5], ["AN", 2, 1, 6]]]], "r": [[0.00139941, 0.0013991, 0.00139938], 0, 5.30704, 1668056135], "v": "v0.6"}
{"i": [["[\"softmax_norm\", 3136, 49]", "cuda -keys=cuda,gpu -max_num_threads=1024 -model=unknown -thread_warp_size=32", [-1, 16, 64, 49152, 2147483647, 1024, 8, 32], "", 0, []], [[], [["FU", 2, [0, 1, 2]], ["SP", 2, 0, 7529536, [1], 1], ["AN", 2, 0, 5], ["AN", 2, 1, 6]]]], "r": [[0.00558361, 0.00558352, 0.00558383], 0, 8.71395, 1668056138], "v": "v0.6"}
{"i": [["[\"softmax_norm\", 3136, 49]", "cuda -keys=cuda,gpu -max_num_threads=1024 -model=unknown -thread_warp_size=32", [-1, 16, 64, 49152, 2147483647, 1024, 8, 32], "", 0, []], [[], [["FU", 2, [0, 1, 2]], ["SP", 2, 0, 7529536, [64], 1], ["AN", 2, 0, 5], ["AN", 2, 1, 6]]]], "r": [[9.04612e-05, 9.04226e-05, 9.04332e-05], 0, 7.84016, 1668056137], "v": "v0.6"}
{"i": [["[\"softmax_norm\", 3136, 49]", "cuda -keys=cuda,gpu -max_num_threads=1024 -model=unknown -thread_warp_size=32", [-1, 16, 64, 49152, 2147483647, 1024, 8, 32], "", 0, []], [[], [["FU", 2, [0, 1, 2]], ["SP", 2, 0, 7529536, [56], 1], ["AN", 2, 0, 5], ["AN", 2, 1, 6]]]], "r": [[0.000102905, 0.000102918, 0.000102876], 0, 10.4293, 1668056140], "v": "v0.6"}
{"i": [["[\"softmax_norm\", 3136, 49]", "cuda -keys=cuda,gpu -max_num_threads=1024 -model=unknown -thread_warp_size=32", [-1, 16, 64, 49152, 2147483647, 1024, 8, 32], "", 0, []], [[], [["FU", 2, [0, 1, 2]], ["SP", 2, 0, 7529536, [8], 1], ["AN", 2, 0, 5], ["AN", 2, 1, 6]]]], "r": [[0.000701486, 0.000701461, 0.000701299], 0, 9.53259, 1668056139], "v": "v0.6"}
{"i": [["[\"softmax_norm\", 3136, 49]", "cuda -keys=cuda,gpu -max_num_threads=1024 -model=unknown -thread_warp_size=32", [-1, 16, 64, 49152, 2147483647, 1024, 8, 32], "", 0, []], [[], [["FU", 2, [0, 1, 2]], ["SP", 2, 0, 7529536, [8], 1], ["AN", 2, 0, 5], ["AN", 2, 1, 6]]]], "r": [[0.00070141, 0.000701426, 0.000701396], 0, 2.78546, 1668056416], "v": "v0.6"}
{"i": [["[\"softmax_norm\", 3136, 49]", "cuda -keys=cuda,gpu -max_num_threads=1024 -model=unknown -thread_warp_size=32", [-1, 16, 64, 49152, 2147483647, 1024, 8, 32], "", 0, []], [[], [["FU", 2, [0, 1, 2]], ["SP", 2, 0, 7529536, [64], 1], ["AN", 2, 0, 5], ["AN", 2, 1, 6]]]], "r": [[9.05891e-05, 9.05853e-05, 9.0568e-05], 0, 4.49883, 1668056418], "v": "v0.6"}
{"i": [["[\"softmax_norm\", 3136, 49]", "cuda -keys=cuda,gpu -max_num_threads=1024 -model=unknown -thread_warp_size=32", [-1, 16, 64, 49152, 2147483647, 1024, 8, 32], "", 0, []], [[], [["FU", 2, [0, 1, 2]], ["SP", 2, 0, 7529536, [7], 1], ["AN", 2, 0, 5], ["AN", 2, 1, 6]]]], "r": [[0.000801082, 0.000801143, 0.000801053], 0, 1.90548, 1668056415], "v": "v0.6"}
{"i": [["[\"softmax_norm\", 3136, 49]", "cuda -keys=cuda,gpu -max_num_threads=1024 -model=unknown -thread_warp_size=32", [-1, 16, 64, 49152, 2147483647, 1024, 8, 32], "", 0, []], [[], [["FU", 2, [0, 1, 2]], ["SP", 2, 0, 7529536, [1], 1], ["AN", 2, 0, 5], ["AN", 2, 1, 6]]]], "r": [[0.00558765, 0.00558555, 0.00558549], 0, 3.65722, 1668056417], "v": "v0.6"}
{"i": [["[\"softmax_norm\", 3136, 49]", "cuda -keys=cuda,gpu -max_num_threads=1024 -model=unknown -thread_warp_size=32", [-1, 16, 64, 49152, 2147483647, 1024, 8, 32], "", 0, []], [[], [["FU", 2, [0, 1, 2]], ["SP", 2, 0, 7529536, [49], 1], ["AN", 2, 0, 5], ["AN", 2, 1, 6]]]], "r": [[0.000117164, 0.000117201, 0.000117168], 0, 1.07843, 1668056414], "v": "v0.6"}
{"i": [["[\"softmax_norm\", 3136, 49]", "cuda -keys=cuda,gpu -max_num_threads=1024 -model=unknown -thread_warp_size=32", [-1, 16, 64, 49152, 2147483647, 1024, 8, 32], "", 0, []], [[], [["FU", 2, [0, 1, 2]], ["SP", 2, 0, 7529536, [16], 1], ["AN", 2, 0, 5], ["AN", 2, 1, 6]]]], "r": [[0.000352604, 0.000352607, 0.00035264], 0, 6.19252, 1668056419], "v": "v0.6"}
{"i": [["[\"softmax_norm\", 3136, 49]", "cuda -keys=cuda,gpu -max_num_threads=1024 -model=unknown -thread_warp_size=32", [-1, 16, 64, 49152, 2147483647, 1024, 8, 32], "", 0, []], [[], [["FU", 2, [0, 1, 2]], ["SP", 2, 0, 7529536, [14], 1], ["AN", 2, 0, 5], ["AN", 2, 1, 6]]]], "r": [[0.000402423, 0.000402385, 0.00040231], 0, 5.36637, 1668056419], "v": "v0.6"}
{"i": [["[\"softmax_norm\", 3136, 49]", "cuda -keys=cuda,gpu -max_num_threads=1024 -model=unknown -thread_warp_size=32", [-1, 16, 64, 49152, 2147483647, 1024, 8, 32], "", 0, []], [[], [["FU", 2, [0, 1, 2]], ["SP", 2, 0, 7529536, [32], 1], ["AN", 2, 0, 5], ["AN", 2, 1, 6]]]], "r": [[0.000178195, 0.00017817, 0.000178156], 0, 6.99911, 1668056420], "v": "v0.6"}
{"i": [["[\"softmax_norm\", 3136, 49]", "cuda -keys=cuda,gpu -max_num_threads=1024 -model=unknown -thread_warp_size=32", [-1, 16, 64, 49152, 2147483647, 1024, 8, 32], "", 0, []], [[], [["FU", 2, [0, 1, 2]], ["SP", 2, 0, 7529536, [4], 1], ["AN", 2, 0, 5], ["AN", 2, 1, 6]]]], "r": [[0.00140006, 0.00139961, 0.0013996], 0, 10.4338, 1668056424], "v": "v0.6"}
{"i": [["[\"softmax_norm\", 3136, 49]", "cuda -keys=cuda,gpu -max_num_threads=1024 -model=unknown -thread_warp_size=32", [-1, 16, 64, 49152, 2147483647, 1024, 8, 32], "", 0, []], [[], [["FU", 2, [0, 1, 2]], ["SP", 2, 0, 7529536, [28], 1], ["AN", 2, 0, 5], ["AN", 2, 1, 6]]]], "r": [[0.000203348, 0.000203226, 0.000203286], 0, 8.72576, 1668056422], "v": "v0.6"}
{"i": [["[\"softmax_norm\", 3136, 49]", "cuda -keys=cuda,gpu -max_num_threads=1024 -model=unknown -thread_warp_size=32", [-1, 16, 64, 49152, 2147483647, 1024, 8, 32], "", 0, []], [[], [["FU", 2, [0, 1, 2]], ["SP", 2, 0, 7529536, [56], 1], ["AN", 2, 0, 5], ["AN", 2, 1, 6]]]], "r": [[0.000102908, 0.000102932, 0.000102858], 0, 9.57051, 1668056423], "v": "v0.6"}
{"i": [["[\"softmax_norm\", 3136, 49]", "cuda -keys=cuda,gpu -max_num_threads=1024 -model=unknown -thread_warp_size=32", [-1, 16, 64, 49152, 2147483647, 1024, 8, 32], "", 0, []], [[], [["FU", 2, [0, 1, 2]], ["SP", 2, 0, 7529536, [2], 1], ["AN", 2, 0, 5], ["AN", 2, 1, 6]]]], "r": [[0.00279546, 0.00279553, 0.0027954], 0, 7.8952, 1668056421], "v": "v0.6"}
{"i": [["[\"softmax_norm\", 3136, 49]", "cuda -keys=cuda,gpu -max_num_threads=1024 -model=unknown -thread_warp_size=32", [-1, 16, 64, 49152, 2147483647, 1024, 8, 32], "", 0, []], [[], [["FU", 2, [0, 1, 2]], ["SP", 2, 0, 7529536, [2], 1], ["AN", 2, 0, 5], ["AN", 2, 1, 6]]]], "r": [[0.00279501, 0.00279482, 0.00279456], 0, 3.62426, 1668056700], "v": "v0.6"}
{"i": [["[\"softmax_norm\", 3136, 49]", "cuda -keys=cuda,gpu -max_num_threads=1024 -model=unknown -thread_warp_size=32", [-1, 16, 64, 49152, 2147483647, 1024, 8, 32], "", 0, []], [[], [["FU", 2, [0, 1, 2]], ["SP", 2, 0, 7529536, [28], 1], ["AN", 2, 0, 5], ["AN", 2, 1, 6]]]], "r": [[0.000203262, 0.000203277, 0.000203219], 0, 2.80166, 1668056700], "v": "v0.6"}
{"i": [["[\"softmax_norm\", 3136, 49]", "cuda -keys=cuda,gpu -max_num_threads=1024 -model=unknown -thread_warp_size=32", [-1, 16, 64, 49152, 2147483647, 1024, 8, 32], "", 0, []], [[], [["FU", 2, [0, 1, 2]], ["SP", 2, 0, 7529536, [8], 1], ["AN", 2, 0, 5], ["AN", 2, 1, 6]]]], "r": [[0.000701408, 0.000701339, 0.000701191], 0, 1.07382, 1668056698], "v": "v0.6"}
{"i": [["[\"softmax_norm\", 3136, 49]", "cuda -keys=cuda,gpu -max_num_threads=1024 -model=unknown -thread_warp_size=32", [-1, 16, 64, 49152, 2147483647, 1024, 8, 32], "", 0, []], [[], [["FU", 2, [0, 1, 2]], ["SP", 2, 0, 7529536, [64], 1], ["AN", 2, 0, 5], ["AN", 2, 1, 6]]]], "r": [[9.04842e-05, 9.04878e-05, 9.04355e-05], 0, 4.45814, 1668056701], "v": "v0.6"}
{"i": [["[\"softmax_norm\", 3136, 49]", "cuda -keys=cuda,gpu -max_num_threads=1024 -model=unknown -thread_warp_size=32", [-1, 16, 64, 49152, 2147483647, 1024, 8, 32], "", 0, []], [[], [["FU", 2, [0, 1, 2]], ["SP", 2, 0, 7529536, [56], 1], ["AN", 2, 0, 5], ["AN", 2, 1, 6]]]], "r": [[0.000102866, 0.000102855, 0.00010284], 0, 1.91834, 1668056699], "v": "v0.6"}
{"i": [["[\"softmax_norm\", 3136, 49]", "cuda -keys=cuda,gpu -max_num_threads=1024 -model=unknown -thread_warp_size=32", [-1, 16, 64, 49152, 2147483647, 1024, 8, 32], "", 0, []], [[], [["FU", 2, [0, 1, 2]], ["SP", 2, 0, 7529536, [14], 1], ["AN", 2, 0, 5], ["AN", 2, 1, 6]]]], "r": [[0.000402303, 0.000402308, 0.000402252], 0, 6.13642, 1668056703], "v": "v0.6"}
{"i": [["[\"softmax_norm\", 3136, 49]", "cuda -keys=cuda,gpu -max_num_threads=1024 -model=unknown -thread_warp_size=32", [-1, 16, 64, 49152, 2147483647, 1024, 8, 32], "", 0, []], [[], [["FU", 2, [0, 1, 2]], ["SP", 2, 0, 7529536, [16], 1], ["AN", 2, 0, 5], ["AN", 2, 1, 6]]]], "r": [[0.000352623, 0.000352577, 0.000352525], 0, 5.30786, 1668056702], "v": "v0.6"}
{"i": [["[\"softmax_norm\", 3136, 49]", "cuda -keys=cuda,gpu -max_num_threads=1024 -model=unknown -thread_warp_size=32", [-1, 16, 64, 49152, 2147483647, 1024, 8, 32], "", 0, []], [[], [["FU", 2, [0, 1, 2]], ["SP", 2, 0, 7529536, [4], 1], ["AN", 2, 0, 5], ["AN", 2, 1, 6]]]], "r": [[0.00139955, 0.00139936, 0.00139926], 0, 7.83631, 1668056705], "v": "v0.6"}
{"i": [["[\"softmax_norm\", 3136, 49]", "cuda -keys=cuda,gpu -max_num_threads=1024 -model=unknown -thread_warp_size=32", [-1, 16, 64, 49152, 2147483647, 1024, 8, 32], "", 0, []], [[], [["FU", 2, [0, 1, 2]], ["SP", 2, 0, 7529536, [1], 1], ["AN", 2, 0, 5], ["AN", 2, 1, 6]]]], "r": [[0.00558377, 0.00558385, 0.00558362], 0, 9.53488, 1668056707], "v": "v0.6"}
{"i": [["[\"softmax_norm\", 3136, 49]", "cuda -keys=cuda,gpu -max_num_threads=1024 -model=unknown -thread_warp_size=32", [-1, 16, 64, 49152, 2147483647, 1024, 8, 32], "", 0, []], [[], [["FU", 2, [0, 1, 2]], ["SP", 2, 0, 7529536, [32], 1], ["AN", 2, 0, 5], ["AN", 2, 1, 6]]]], "r": [[0.000178147, 0.000178162, 0.000178147], 0, 6.97175, 1668056704], "v": "v0.6"}
{"i": [["[\"softmax_norm\", 3136, 49]", "cuda -keys=cuda,gpu -max_num_threads=1024 -model=unknown -thread_warp_size=32", [-1, 16, 64, 49152, 2147483647, 1024, 8, 32], "", 0, []], [[], [["FU", 2, [0, 1, 2]], ["SP", 2, 0, 7529536, [49], 1], ["AN", 2, 0, 5], ["AN", 2, 1, 6]]]], "r": [[0.000117061, 0.000117059, 0.000117052], 0, 10.4255, 1668056707], "v": "v0.6"}
{"i": [["[\"softmax_norm\", 3136, 49]", "cuda -keys=cuda,gpu -max_num_threads=1024 -model=unknown -thread_warp_size=32", [-1, 16, 64, 49152, 2147483647, 1024, 8, 32], "", 0, []], [[], [["FU", 2, [0, 1, 2]], ["SP", 2, 0, 7529536, [7], 1], ["AN", 2, 0, 5], ["AN", 2, 1, 6]]]], "r": [[0.000801171, 0.000800951, 0.000801152], 0, 8.65569, 1668056706], "v": "v0.6"}
{"i": [["[\"softmax_norm\", 3136, 49]", "cuda -keys=cuda,gpu -max_num_threads=1024 -model=unknown -thread_warp_size=32", [-1, 16, 64, 49152, 2147483647, 1024, 8, 32], "", 0, []], [[], [["FU", 2, [0, 1, 2]], ["SP", 2, 0, 7529536, [4], 1], ["AN", 2, 0, 5], ["AN", 2, 1, 6]]]], "r": [[0.00139999, 0.00139987, 0.00139975], 0, 4.44898, 1668056985], "v": "v0.6"}
{"i": [["[\"softmax_norm\", 3136, 49]", "cuda -keys=cuda,gpu -max_num_threads=1024 -model=unknown -thread_warp_size=32", [-1, 16, 64, 49152, 2147483647, 1024, 8, 32], "", 0, []], [[], [["FU", 2, [0, 1, 2]], ["SP", 2, 0, 7529536, [64], 1], ["AN", 2, 0, 5], ["AN", 2, 1, 6]]]], "r": [[9.05883e-05, 9.05632e-05, 9.05151e-05], 0, 1.93804, 1668056983], "v": "v0.6"}
{"i": [["[\"softmax_norm\", 3136, 49]", "cuda -keys=cuda,gpu -max_num_threads=1024 -model=unknown -thread_warp_size=32", [-1, 16, 64, 49152, 2147483647, 1024, 8, 32], "", 0, []], [[], [["FU", 2, [0, 1, 2]], ["SP", 2, 0, 7529536, [28], 1], ["AN", 2, 0, 5], ["AN", 2, 1, 6]]]], "r": [[0.000203335, 0.000203324, 0.000203371], 0, 2.79853, 1668056984], "v": "v0.6"}
{"i": [["[\"softmax_norm\", 3136, 49]", "cuda -keys=cuda,gpu -max_num_threads=1024 -model=unknown -thread_warp_size=32", [-1, 16, 64, 49152, 2147483647, 1024, 8, 32], "", 0, []], [[], [["FU", 2, [0, 1, 2]], ["SP", 2, 0, 7529536, [8], 1], ["AN", 2, 0, 5], ["AN", 2, 1, 6]]]], "r": [[0.000701496, 0.000701524, 0.000701278], 0, 3.61556, 1668056984], "v": "v0.6"}
{"i": [["[\"softmax_norm\", 3136, 49]", "cuda -keys=cuda,gpu -max_num_threads=1024 -model=unknown -thread_warp_size=32", [-1, 16, 64, 49152, 2147483647, 1024, 8, 32], "", 0, []], [[], [["FU", 2, [0, 1, 2]], ["SP", 2, 0, 7529536, [2], 1], ["AN", 2, 0, 5], ["AN", 2, 1, 6]]]], "r": [[0.00279512, 0.00279513, 0.00279509], 0, 1.08803, 1668056982], "v": "v0.6"}
{"i": [["[\"softmax_norm\", 3136, 49]", "cuda -keys=cuda,gpu -max_num_threads=1024 -model=unknown -thread_warp_size=32", [-1, 16, 64, 49152, 2147483647, 1024, 8, 32], "", 0, []], [[], [["FU", 2, [0, 1, 2]], ["SP", 2, 0, 7529536, [56], 1], ["AN", 2, 0, 5], ["AN", 2, 1, 6]]]], "r": [[0.000102882, 0.0001029, 0.000102876], 0, 5.33308, 1668056986], "v": "v0.6"}
{"i": [["[\"softmax_norm\", 3136, 49]", "cuda -keys=cuda,gpu -max_num_threads=1024 -model=unknown -thread_warp_size=32", [-1, 16, 64, 49152, 2147483647, 1024, 8, 32], "", 0, []], [[], [["FU", 2, [0, 1, 2]], ["SP", 2, 0, 7529536, [14], 1], ["AN", 2, 0, 5], ["AN", 2, 1, 6]]]], "r": [[0.000402525, 0.000402447, 0.000402402], 0, 7.02379, 1668056988], "v": "v0.6"}
{"i": [["[\"softmax_norm\", 3136, 49]", "cuda -keys=cuda,gpu -max_num_threads=1024 -model=unknown -thread_warp_size=32", [-1, 16, 64, 49152, 2147483647, 1024, 8, 32], "", 0, []], [[], [["FU", 2, [0, 1, 2]], ["SP", 2, 0, 7529536, [1], 1], ["AN", 2, 0, 5], ["AN", 2, 1, 6]]]], "r": [[0.00558475, 0.00558466, 0.00558496], 0, 6.20505, 1668056987], "v": "v0.6"}
{"i": [["[\"softmax_norm\", 3136, 49]", "cuda -keys=cuda,gpu -max_num_threads=1024 -model=unknown -thread_warp_size=32", [-1, 16, 64, 49152, 2147483647, 1024, 8, 32], "", 0, []], [[], [["FU", 2, [0, 1, 2]], ["SP", 2, 0, 7529536, [49], 1], ["AN", 2, 0, 5], ["AN", 2, 1, 6]]]], "r": [[0.000117116, 0.0001171, 0.000117084], 0, 8.7326, 1668056990], "v": "v0.6"}
{"i": [["[\"softmax_norm\", 3136, 49]", "cuda -keys=cuda,gpu -max_num_threads=1024 -model=unknown -thread_warp_size=32", [-1, 16, 64, 49152, 2147483647, 1024, 8, 32], "", 0, []], [[], [["FU", 2, [0, 1, 2]], ["SP", 2, 0, 7529536, [7], 1], ["AN", 2, 0, 5], ["AN", 2, 1, 6]]]], "r": [[0.000801222, 0.000801023, 0.000801159], 0, 9.56327, 1668056990], "v": "v0.6"}
{"i": [["[\"softmax_norm\", 3136, 49]", "cuda -keys=cuda,gpu -max_num_threads=1024 -model=unknown -thread_warp_size=32", [-1, 16, 64, 49152, 2147483647, 1024, 8, 32], "", 0, []], [[], [["FU", 2, [0, 1, 2]], ["SP", 2, 0, 7529536, [32], 1], ["AN", 2, 0, 5], ["AN", 2, 1, 6]]]], "r": [[0.000178238, 0.000178248, 0.00017824], 0, 7.89781, 1668056989], "v": "v0.6"}
{"i": [["[\"softmax_norm\", 3136, 49]", "cuda -keys=cuda,gpu -max_num_threads=1024 -model=unknown -thread_warp_size=32", [-1, 16, 64, 49152, 2147483647, 1024, 8, 32], "", 0, []], [[], [["FU", 2, [0, 1, 2]], ["SP", 2, 0, 7529536, [16], 1], ["AN", 2, 0, 5], ["AN", 2, 1, 6]]]], "r": [[0.000352722, 0.000352617, 0.000352602], 0, 10.4201, 1668056991], "v": "v0.6"}
{"i": [["[\"softmax_norm\", 3136, 49]", "cuda -keys=cuda,gpu -max_num_threads=1024 -model=unknown -thread_warp_size=32", [-1, 16, 64, 49152, 2147483647, 1024, 8, 32], "", 0, []], [[], [["FU", 2, [0, 1, 2]], ["SP", 2, 0, 7529536, [14], 1], ["AN", 2, 0, 5], ["AN", 2, 1, 6]]]], "r": [[0.000402296, 0.000402419, 0.000402441], 0, 3.63217, 1668057268], "v": "v0.6"}
{"i": [["[\"softmax_norm\", 3136, 49]", "cuda -keys=cuda,gpu -max_num_threads=1024 -model=unknown -thread_warp_size=32", [-1, 16, 64, 49152, 2147483647, 1024, 8, 32], "", 0, []], [[], [["FU", 2, [0, 1, 2]], ["SP", 2, 0, 7529536, [64], 1], ["AN", 2, 0, 5], ["AN", 2, 1, 6]]]], "r": [[9.05033e-05, 9.04936e-05, 9.04667e-05], 0, 4.45696, 1668057269], "v": "v0.6"}
{"i": [["[\"softmax_norm\", 3136, 49]", "cuda -keys=cuda,gpu -max_num_threads=1024 -model=unknown -thread_warp_size=32", [-1, 16, 64, 49152, 2147483647, 1024, 8, 32], "", 0, []], [[], [["FU", 2, [0, 1, 2]], ["SP", 2, 0, 7529536, [32], 1], ["AN", 2, 0, 5], ["AN", 2, 1, 6]]]], "r": [[0.000178228, 0.000178191, 0.000178155], 0, 1.08282, 1668057266], "v": "v0.6"}
{"i": [["[\"softmax_norm\", 3136, 49]", "cuda -keys=cuda,gpu -max_num_threads=1024 -model=unknown -thread_warp_size=32", [-1, 16, 64, 49152, 2147483647, 1024, 8, 32], "", 0, []], [[], [["FU", 2, [0, 1, 2]], ["SP", 2, 0, 7529536, [28], 1], ["AN", 2, 0, 5], ["AN", 2, 1, 6]]]], "r": [[0.000203325, 0.000203249, 0.000203301], 0, 2.78448, 1668057268], "v": "v0.6"}
{"i": [["[\"softmax_norm\", 3136, 49]", "cuda -keys=cuda,gpu -max_num_threads=1024 -model=unknown -thread_warp_size=32", [-1, 16, 64, 49152, 2147483647, 1024, 8, 32], "", 0, []], [[], [["FU", 2, [0, 1, 2]], ["SP", 2, 0, 7529536, [1], 1], ["AN", 2, 0, 5], ["AN", 2, 1, 6]]]], "r": [[0.00558568, 0.00558535, 0.0055846], 0, 1.95251, 1668057267], "v": "v0.6"}
{"i": [["[\"softmax_norm\", 3136, 49]", "cuda -keys=cuda,gpu -max_num_threads=1024 -model=unknown -thread_warp_size=32", [-1, 16, 64, 49152, 2147483647, 1024, 8, 32], "", 0, []], [[], [["FU", 2, [0, 1, 2]], ["SP", 2, 0, 7529536, [16], 1], ["AN", 2, 0, 5], ["AN", 2, 1, 6]]]], "r": [[0.000352773, 0.0003528, 0.000352777], 0, 5.31871, 1668057270], "v": "v0.6"}
{"i": [["[\"softmax_norm\", 3136, 49]", "cuda -keys=cuda,gpu -max_num_threads=1024 -model=unknown -thread_warp_size=32", [-1, 16, 64, 49152, 2147483647, 1024, 8, 32], "", 0, []], [[], [["FU", 2, [0, 1, 2]], ["SP", 2, 0, 7529536, [7], 1], ["AN", 2, 0, 5], ["AN", 2, 1, 6]]]], "r": [[0.000801233, 0.000801198, 0.000801066], 0, 6.15096, 1668057271], "v": "v0.6"}
{"i": [["[\"softmax_norm\", 3136, 49]", "cuda -keys=cuda,gpu -max_num_threads=1024 -model=unknown -thread_warp_size=32", [-1, 16, 64, 49152, 2147483647, 1024, 8, 32], "", 0, []], [[], [["FU", 2, [0, 1, 2]], ["SP", 2, 0, 7529536, [2], 1], ["AN", 2, 0, 5], ["AN", 2, 1, 6]]]], "r": [[0.0027951, 0.00279499, 0.0027948], 0, 8.71542, 1668057274], "v": "v0.6"}
{"i": [["[\"softmax_norm\", 3136, 49]", "cuda -keys=cuda,gpu -max_num_threads=1024 -model=unknown -thread_warp_size=32", [-1, 16, 64, 49152, 2147483647, 1024, 8, 32], "", 0, []], [[], [["FU", 2, [0, 1, 2]], ["SP", 2, 0, 7529536, [49], 1], ["AN", 2, 0, 5], ["AN", 2, 1, 6]]]], "r": [[0.00011721, 0.000117193, 0.000117141], 0, 6.99641, 1668057272], "v": "v0.6"}
{"i": [["[\"softmax_norm\", 3136, 49]", "cuda -keys=cuda,gpu -max_num_threads=1024 -model=unknown -thread_warp_size=32", [-1, 16, 64, 49152, 2147483647, 1024, 8, 32], "", 0, []], [[], [["FU", 2, [0, 1, 2]], ["SP", 2, 0, 7529536, [4], 1], ["AN", 2, 0, 5], ["AN", 2, 1, 6]]]], "r": [[0.00139944, 0.00139938, 0.00139957], 0, 7.88728, 1668057273], "v": "v0.6"}
{"i": [["[\"softmax_norm\", 3136, 49]", "cuda -keys=cuda,gpu -max_num_threads=1024 -model=unknown -thread_warp_size=32", [-1, 16, 64, 49152, 2147483647, 1024, 8, 32], "", 0, []], [[], [["FU", 2, [0, 1, 2]], ["SP", 2, 0, 7529536, [56], 1], ["AN", 2, 0, 5], ["AN", 2, 1, 6]]]], "r": [[0.000102969, 0.000102945, 0.000102976], 0, 10.3963, 1668057275], "v": "v0.6"}
{"i": [["[\"softmax_norm\", 3136, 49]", "cuda -keys=cuda,gpu -max_num_threads=1024 -model=unknown -thread_warp_size=32", [-1, 16, 64, 49152, 2147483647, 1024, 8, 32], "", 0, []], [[], [["FU", 2, [0, 1, 2]], ["SP", 2, 0, 7529536, [8], 1], ["AN", 2, 0, 5], ["AN", 2, 1, 6]]]], "r": [[0.000701411, 0.000701487, 0.000701443], 0, 9.52367, 1668057274], "v": "v0.6"}
{"i": [["[\"softmax_norm\", 3136, 49]", "cuda -keys=cuda,gpu -max_num_threads=1024 -model=unknown -thread_warp_size=32", [-1, 16, 64, 49152, 2147483647, 1024, 8, 32], "", 0, []], [[], [["FU", 2, [0, 1, 2]], ["SP", 2, 0, 7529536, [64], 1], ["AN", 2, 0, 5], ["AN", 2, 1, 6]]]], "r": [[9.05922e-05, 9.05596e-05, 9.05254e-05], 0, 1.08976, 1668057549], "v": "v0.6"}
{"i": [["[\"softmax_norm\", 3136, 49]", "cuda -keys=cuda,gpu -max_num_threads=1024 -model=unknown -thread_warp_size=32", [-1, 16, 64, 49152, 2147483647, 1024, 8, 32], "", 0, []], [[], [["FU", 2, [0, 1, 2]], ["SP", 2, 0, 7529536, [4], 1], ["AN", 2, 0, 5], ["AN", 2, 1, 6]]]], "r": [[0.00139971, 0.00139981, 0.00139976], 0, 3.67319, 1668057552], "v": "v0.6"}
{"i": [["[\"softmax_norm\", 3136, 49]", "cuda -keys=cuda,gpu -max_num_threads=1024 -model=unknown -thread_warp_size=32", [-1, 16, 64, 49152, 2147483647, 1024, 8, 32], "", 0, []], [[], [["FU", 2, [0, 1, 2]], ["SP", 2, 0, 7529536, [28], 1], ["AN", 2, 0, 5], ["AN", 2, 1, 6]]]], "r": [[0.000203266, 0.000203186, 0.000203174], 0, 4.50623, 1668057553], "v": "v0.6"}
{"i": [["[\"softmax_norm\", 3136, 49]", "cuda -keys=cuda,gpu -max_num_threads=1024 -model=unknown -thread_warp_size=32", [-1, 16, 64, 49152, 2147483647, 1024, 8, 32], "", 0, []], [[], [["FU", 2, [0, 1, 2]], ["SP", 2, 0, 7529536, [1], 1], ["AN", 2, 0, 5], ["AN", 2, 1, 6]]]], "r": [[0.00558521, 0.00558452, 0.0055846], 0, 2.83601, 1668057551], "v": "v0.6"}
{"i": [["[\"softmax_norm\", 3136, 49]", "cuda -keys=cuda,gpu -max_num_threads=1024 -model=unknown -thread_warp_size=32", [-1, 16, 64, 49152, 2147483647, 1024, 8, 32], "", 0, []], [[], [["FU", 2, [0, 1, 2]], ["SP", 2, 0, 7529536, [2], 1], ["AN", 2, 0, 5], ["AN", 2, 1, 6]]]], "r": [[0.00279616, 0.00279612, 0.00279531], 0, 1.92458, 1668057550], "v": "v0.6"}
{"i": [["[\"softmax_norm\", 3136, 49]", "cuda -keys=cuda,gpu -max_num_threads=1024 -model=unknown -thread_warp_size=32", [-1, 16, 64, 49152, 2147483647, 1024, 8, 32], "", 0, []], [[], [["FU", 2, [0, 1, 2]], ["SP", 2, 0, 7529536, [7], 1], ["AN", 2, 0, 5], ["AN", 2, 1, 6]]]], "r": [[0.000801302, 0.000801308, 0.000801138], 0, 7.95154, 1668057556], "v": "v0.6"}
{"i": [["[\"softmax_norm\", 3136, 49]", "cuda -keys=cuda,gpu -max_num_threads=1024 -model=unknown -thread_warp_size=32", [-1, 16, 64, 49152, 2147483647, 1024, 8, 32], "", 0, []], [[], [["FU", 2, [0, 1, 2]], ["SP", 2, 0, 7529536, [56], 1], ["AN", 2, 0, 5], ["AN", 2, 1, 6]]]], "r": [[0.000102891, 0.000102907, 0.000102872], 0, 5.38203, 1668057554], "v": "v0.6"}
{"i": [["[\"softmax_norm\", 3136, 49]", "cuda -keys=cuda,gpu -max_num_threads=1024 -model=unknown -thread_warp_size=32", [-1, 16, 64, 49152, 2147483647, 1024, 8, 32], "", 0, []], [[], [["FU", 2, [0, 1, 2]], ["SP", 2, 0, 7529536, [32], 1], ["AN", 2, 0, 5], ["AN", 2, 1, 6]]]], "r": [[0.000178217, 0.000178241, 0.000178204], 0, 7.07139, 1668057555], "v": "v0.6"}
{"i": [["[\"softmax_norm\", 3136, 49]", "cuda -keys=cuda,gpu -max_num_threads=1024 -model=unknown -thread_warp_size=32", [-1, 16, 64, 49152, 2147483647, 1024, 8, 32], "", 0, []], [[], [["FU", 2, [0, 1, 2]], ["SP", 2, 0, 7529536, [8], 1], ["AN", 2, 0, 5], ["AN", 2, 1, 6]]]], "r": [[0.000701587, 0.000701709, 0.00070151], 0, 6.22575, 1668057555], "v": "v0.6"}
{"i": [["[\"softmax_norm\", 3136, 49]", "cuda -keys=cuda,gpu -max_num_threads=1024 -model=unknown -thread_warp_size=32", [-1, 16, 64, 49152, 2147483647, 1024, 8, 32], "", 0, []], [[], [["FU", 2, [0, 1, 2]], ["SP", 2, 0, 7529536, [49], 1], ["AN", 2, 0, 5], ["AN", 2, 1, 6]]]], "r": [[0.000117094, 0.000117103, 0.000117057], 0, 8.76691, 1668057557], "v": "v0.6"}
{"i": [["[\"softmax_norm\", 3136, 49]", "cuda -keys=cuda,gpu -max_num_threads=1024 -model=unknown -thread_warp_size=32", [-1, 16, 64, 49152, 2147483647, 1024, 8, 32], "", 0, []], [[], [["FU", 2, [0, 1, 2]], ["SP", 2, 0, 7529536, [14], 1], ["AN", 2, 0, 5], ["AN", 2, 1, 6]]]], "r": [[0.000402523, 0.00040257, 0.000402467], 0, 9.59298, 1668057558], "v": "v0.6"}
{"i": [["[\"softmax_norm\", 3136, 49]", "cuda -keys=cuda,gpu -max_num_threads=1024 -model=unknown -thread_warp_size=32", [-1, 16, 64, 49152, 2147483647, 1024, 8, 32], "", 0, []], [[], [["FU", 2, [0, 1, 2]], ["SP", 2, 0, 7529536, [16], 1], ["AN", 2, 0, 5], ["AN", 2, 1, 6]]]], "r": [[0.000352839, 0.000352783, 0.000352722], 0, 10.4723, 1668057559], "v": "v0.6"}
{"i": [["[\"softmax_norm\", 3136, 49]", "cuda -keys=cuda,gpu -max_num_threads=1024 -model=unknown -thread_warp_size=32", [-1, 16, 64, 49152, 2147483647, 1024, 8, 32], "", 0, []], [[], [["FU", 2, [0, 1, 2]], ["SP", 2, 0, 7529536, [49], 1], ["AN", 2, 0, 5], ["AN", 2, 1, 6]]]], "r": [[0.000117156, 0.000117153, 0.000117169], 0, 4.46441, 1668057837], "v": "v0.6"}
{"i": [["[\"softmax_norm\", 3136, 49]", "cuda -keys=cuda,gpu -max_num_threads=1024 -model=unknown -thread_warp_size=32", [-1, 16, 64, 49152, 2147483647, 1024, 8, 32], "", 0, []], [[], [["FU", 2, [0, 1, 2]], ["SP", 2, 0, 7529536, [7], 1], ["AN", 2, 0, 5], ["AN", 2, 1, 6]]]], "r": [[0.000801222, 0.0008012, 0.000801128], 0, 1.91079, 1668057835], "v": "v0.6"}
{"i": [["[\"softmax_norm\", 3136, 49]", "cuda -keys=cuda,gpu -max_num_threads=1024 -model=unknown -thread_warp_size=32", [-1, 16, 64, 49152, 2147483647, 1024, 8, 32], "", 0, []], [[], [["FU", 2, [0, 1, 2]], ["SP", 2, 0, 7529536, [8], 1], ["AN", 2, 0, 5], ["AN", 2, 1, 6]]]], "r": [[0.000701722, 0.000701649, 0.000701605], 0, 2.78698, 1668057836], "v": "v0.6"}
{"i": [["[\"softmax_norm\", 3136, 49]", "cuda -keys=cuda,gpu -max_num_threads=1024 -model=unknown -thread_warp_size=32", [-1, 16, 64, 49152, 2147483647, 1024, 8, 32], "", 0, []], [[], [["FU", 2, [0, 1, 2]], ["SP", 2, 0, 7529536, [16], 1], ["AN", 2, 0, 5], ["AN", 2, 1, 6]]]], "r": [[0.000352849, 0.000352567, 0.000352712], 0, 3.61534, 1668057836], "v": "v0.6"}
{"i": [["[\"softmax_norm\", 3136, 49]", "cuda -keys=cuda,gpu -max_num_threads=1024 -model=unknown -thread_warp_size=32", [-1, 16, 64, 49152, 2147483647, 1024, 8, 32], "", 0, []], [[], [["FU", 2, [0, 1, 2]], ["SP", 2, 0, 7529536, [28], 1], ["AN", 2, 0, 5], ["AN", 2, 1, 6]]]], "r": [[0.000203426, 0.000203328, 0.000203335], 0, 1.07922, 1668057834], "v": "v0.6"}
{"i": [["[\"softmax_norm\", 3136, 49]", "cuda -keys=cuda,gpu -max_num_threads=1024 -model=unknown -thread_warp_size=32", [-1, 16, 64, 49152, 2147483647, 1024, 8, 32], "", 0, []], [[], [["FU", 2, [0, 1, 2]], ["SP", 2, 0, 7529536, [32], 1], ["AN", 2, 0, 5], ["AN", 2, 1, 6]]]], "r": [[0.000178275, 0.000178262, 0.000178235], 0, 5.32891, 1668057838], "v": "v0.6"}
{"i": [["[\"softmax_norm\", 3136, 49]", "cuda -keys=cuda,gpu -max_num_threads=1024 -model=unknown -thread_warp_size=32", [-1, 16, 64, 49152, 2147483647, 1024, 8, 32], "", 0, []], [[], [["FU", 2, [0, 1, 2]], ["SP", 2, 0, 7529536, [1], 1], ["AN", 2, 0, 5], ["AN", 2, 1, 6]]]], "r": [[0.00558574, 0.0055851, 0.00558585], 0, 7.91662, 1668057841], "v": "v0.6"}
{"i": [["[\"softmax_norm\", 3136, 49]", "cuda -keys=cuda,gpu -max_num_threads=1024 -model=unknown -thread_warp_size=32", [-1, 16, 64, 49152, 2147483647, 1024, 8, 32], "", 0, []], [[], [["FU", 2, [0, 1, 2]], ["SP", 2, 0, 7529536, [2], 1], ["AN", 2, 0, 5], ["AN", 2, 1, 6]]]], "r": [[0.00279559, 0.00279554, 0.00279492], 0, 6.1651, 1668057839], "v": "v0.6"}
{"i": [["[\"softmax_norm\", 3136, 49]", "cuda -keys=cuda,gpu -max_num_threads=1024 -model=unknown -thread_warp_size=32", [-1, 16, 64, 49152, 2147483647, 1024, 8, 32], "", 0, []], [[], [["FU", 2, [0, 1, 2]], ["SP", 2, 0, 7529536, [14], 1], ["AN", 2, 0, 5], ["AN", 2, 1, 6]]]], "r": [[0.000402543, 0.000402589, 0.000402551], 0, 8.73106, 1668057842], "v": "v0.6"}
{"i": [["[\"softmax_norm\", 3136, 49]", "cuda -keys=cuda,gpu -max_num_threads=1024 -model=unknown -thread_warp_size=32", [-1, 16, 64, 49152, 2147483647, 1024, 8, 32], "", 0, []], [[], [["FU", 2, [0, 1, 2]], ["SP", 2, 0, 7529536, [56], 1], ["AN", 2, 0, 5], ["AN", 2, 1, 6]]]], "r": [[0.000102918, 0.000102906, 0.000102845], 0, 7.00013, 1668057840], "v": "v0.6"}
{"i": [["[\"softmax_norm\", 3136, 49]", "cuda -keys=cuda,gpu -max_num_threads=1024 -model=unknown -thread_warp_size=32", [-1, 16, 64, 49152, 2147483647, 1024, 8, 32], "", 0, []], [[], [["FU", 2, [0, 1, 2]], ["SP", 2, 0, 7529536, [4], 1], ["AN", 2, 0, 5], ["AN", 2, 1, 6]]]], "r": [[0.00140015, 0.0014, 0.00139965], 0, 9.56707, 1668057842], "v": "v0.6"}
{"i": [["[\"softmax_norm\", 3136, 49]", "cuda -keys=cuda,gpu -max_num_threads=1024 -model=unknown -thread_warp_size=32", [-1, 16, 64, 49152, 2147483647, 1024, 8, 32], "", 0, []], [[], [["FU", 2, [0, 1, 2]], ["SP", 2, 0, 7529536, [64], 1], ["AN", 2, 0, 5], ["AN", 2, 1, 6]]]], "r": [[9.05705e-05, 9.05434e-05, 9.05499e-05], 0, 10.4561, 1668057843], "v": "v0.6"}
{"i": [["[\"softmax_norm\", 3136, 49]", "cuda -keys=cuda,gpu -max_num_threads=1024 -model=unknown -thread_warp_size=32", [-1, 16, 64, 49152, 2147483647, 1024, 8, 32], "", 0, []], [[], [["FU", 2, [0, 1, 2]], ["SP", 2, 0, 7529536, [4], 1], ["AN", 2, 0, 5], ["AN", 2, 1, 6]]]], "r": [[0.00139981, 0.00139985, 0.00139997], 0, 2.80082, 1668058070], "v": "v0.6"}
{"i": [["[\"softmax_norm\", 3136, 49]", "cuda -keys=cuda,gpu -max_num_threads=1024 -model=unknown -thread_warp_size=32", [-1, 16, 64, 49152, 2147483647, 1024, 8, 32], "", 0, []], [[], [["FU", 2, [0, 1, 2]], ["SP", 2, 0, 7529536, [49], 1], ["AN", 2, 0, 5], ["AN", 2, 1, 6]]]], "r": [[0.000117114, 0.000117136, 0.000117099], 0, 1.92462, 1668058069], "v": "v0.6"}
{"i": [["[\"softmax_norm\", 3136, 49]", "cuda -keys=cuda,gpu -max_num_threads=1024 -model=unknown -thread_warp_size=32", [-1, 16, 64, 49152, 2147483647, 1024, 8, 32], "", 0, []], [[], [["FU", 2, [0, 1, 2]], ["SP", 2, 0, 7529536, [32], 1], ["AN", 2, 0, 5], ["AN", 2, 1, 6]]]], "r": [[0.000178193, 0.000178176, 0.000178156], 0, 3.64247, 1668058071], "v": "v0.6"}
{"i": [["[\"softmax_norm\", 3136, 49]", "cuda -keys=cuda,gpu -max_num_threads=1024 -model=unknown -thread_warp_size=32", [-1, 16, 64, 49152, 2147483647, 1024, 8, 32], "", 0, []], [[], [["FU", 2, [0, 1, 2]], ["SP", 2, 0, 7529536, [1], 1], ["AN", 2, 0, 5], ["AN", 2, 1, 6]]]], "r": [[0.00558644, 0.00558627, 0.0055857], 0, 4.49153, 1668058072], "v": "v0.6"}
{"i": [["[\"softmax_norm\", 3136, 49]", "cuda -keys=cuda,gpu -max_num_threads=1024 -model=unknown -thread_warp_size=32", [-1, 16, 64, 49152, 2147483647, 1024, 8, 32], "", 0, []], [[], [["FU", 2, [0, 1, 2]], ["SP", 2, 0, 7529536, [64], 1], ["AN", 2, 0, 5], ["AN", 2, 1, 6]]]], "r": [[9.04815e-05, 9.04761e-05, 9.04707e-05], 0, 1.09238, 1668058068], "v": "v0.6"}
{"i": [["[\"softmax_norm\", 3136, 49]", "cuda -keys=cuda,gpu -max_num_threads=1024 -model=unknown -thread_warp_size=32", [-1, 16, 64, 49152, 2147483647, 1024, 8, 32], "", 0, []], [[], [["FU", 2, [0, 1, 2]], ["SP", 2, 0, 7529536, [28], 1], ["AN", 2, 0, 5], ["AN", 2, 1, 6]]]], "r": [[0.000203438, 0.000203406, 0.000203439], 0, 5.34293, 1668058073], "v": "v0.6"}
{"i": [["[\"softmax_norm\", 3136, 49]", "cuda -keys=cuda,gpu -max_num_threads=1024 -model=unknown -thread_warp_size=32", [-1, 16, 64, 49152, 2147483647, 1024, 8, 32], "", 0, []], [[], [["FU", 2, [0, 1, 2]], ["SP", 2, 0, 7529536, [14], 1], ["AN", 2, 0, 5], ["AN", 2, 1, 6]]]], "r": [[0.000402605, 0.000402522, 0.000402452], 0, 8.7218, 1668058076], "v": "v0.6"}
{"i": [["[\"softmax_norm\", 3136, 49]", "cuda -keys=cuda,gpu -max_num_threads=1024 -model=unknown -thread_warp_size=32", [-1, 16, 64, 49152, 2147483647, 1024, 8, 32], "", 0, []], [[], [["FU", 2, [0, 1, 2]], ["SP", 2, 0, 7529536, [8], 1], ["AN", 2, 0, 5], ["AN", 2, 1, 6]]]], "r": [[0.000701559, 0.000701608, 0.000701462], 0, 6.17663, 1668058073], "v": "v0.6"}
{"i": [["[\"softmax_norm\", 3136, 49]", "cuda -keys=cuda,gpu -max_num_threads=1024 -model=unknown -thread_warp_size=32", [-1, 16, 64, 49152, 2147483647, 1024, 8, 32], "", 0, []], [[], [["FU", 2, [0, 1, 2]], ["SP", 2, 0, 7529536, [56], 1], ["AN", 2, 0, 5], ["AN", 2, 1, 6]]]], "r": [[0.00010302, 0.000103045, 0.000102962], 0, 7.01603, 1668058074], "v": "v0.6"}
{"i": [["[\"softmax_norm\", 3136, 49]", "cuda -keys=cuda,gpu -max_num_threads=1024 -model=unknown -thread_warp_size=32", [-1, 16, 64, 49152, 2147483647, 1024, 8, 32], "", 0, []], [[], [["FU", 2, [0, 1, 2]], ["SP", 2, 0, 7529536, [16], 1], ["AN", 2, 0, 5], ["AN", 2, 1, 6]]]], "r": [[0.000352805, 0.000352809, 0.000352781], 0, 7.88654, 1668058075], "v": "v0.6"}
