python/models/swin_transformer/kernel_configs/swin_transformer_fused_roll_reshape_permute_reshape_tune_1_16_16_512_3_8.log
{"i": [["[\"fused_roll_reshape_permute_reshape\", 1, 16, 16, 512, 3, 8]", "cuda -keys=cuda,gpu -max_num_threads=1024 -model=unknown -thread_warp_size=32", [-1, 16, 64, 49152, 2147483647, 1024, 8, 32], "", 0, []], [[], [["FU", 1, [0, 1]], ["SP", 1, 0, 131072, [32], 1], ["AN", 1, 0, 5], ["AN", 1, 1, 6]]]], "r": [[5.61882e-06, 5.61841e-06, 5.61804e-06, 5.61812e-06, 5.61788e-06, 5.61789e-06, 5.61864e-06, 5.61862e-06, 5.6184e-06, 5.61842e-06], 0, 9.21635, 1652112979], "v": "v0.6"}
{"i": [["[\"fused_roll_reshape_permute_reshape\", 1, 16, 16, 512, 3, 8]", "cuda -keys=cuda,gpu -max_num_threads=1024 -model=unknown -thread_warp_size=32", [-1, 16, 64, 49152, 2147483647, 1024, 8, 32], "", 0, []], [[], [["FU", 1, [0, 1]], ["SP", 1, 0, 131072, [4], 1], ["AN", 1, 0, 5], ["AN", 1, 1, 6]]]], "r": [[2.70363e-05, 2.70362e-05, 2.70359e-05, 2.70368e-05, 2.70379e-05, 2.70379e-05, 2.70381e-05, 2.7037e-05, 2.70367e-05, 2.70366e-05], 0, 14.1406, 1652112984], "v": "v0.6"}
{"i": [["[\"fused_roll_reshape_permute_reshape\", 1, 16, 16, 512, 3, 8]", "cuda -keys=cuda,gpu -max_num_threads=1024 -model=unknown -thread_warp_size=32", [-1, 16, 64, 49152, 2147483647, 1024, 8, 32], "", 0, []], [[], [["FU", 1, [0, 1]], ["SP", 1, 0, 131072, [64], 1], ["AN", 1, 0, 5], ["AN", 1, 1, 6]]]], "r": [[3.94438e-06, 3.94557e-06, 3.94534e-06, 3.94472e-06, 3.94537e-06, 3.9448e-06, 3.94531e-06, 3.94525e-06, 3.94498e-06, 3.94527e-06], 0, 22.3399, 1652112992], "v": "v0.6"}
{"i": [["[\"fused_roll_reshape_permute_reshape\", 1, 16, 16, 512, 3, 8]", "cuda -keys=cuda,gpu -max_num_threads=1024 -model=unknown -thread_warp_size=32", [-1, 16, 64, 49152, 2147483647, 1024, 8, 32], "", 0, []], [[], [["FU", 1, [0, 1]], ["SP", 1, 0, 131072, [2], 1], ["AN", 1, 0, 5], ["AN", 1, 1, 6]]]], "r": [[5.12516e-05, 5.1253e-05, 5.12507e-05, 5.12535e-05, 5.12553e-05, 5.12518e-05, 5.12516e-05, 5.12513e-05, 5.12523e-05, 5.12513e-05], 0, 31.8141, 1652113002], "v": "v0.6"}
{"i": [["[\"fused_roll_reshape_permute_reshape\", 1, 16, 16, 512, 3, 8]", "cuda -keys=cuda,gpu -max_num_threads=1024 -model=unknown -thread_warp_size=32", [-1, 16, 64, 49152, 2147483647, 1024, 8, 32], "", 0, []], [[], [["FU", 1, [0, 1]], ["SP", 1, 0, 131072, [1], 1], ["AN", 1, 0, 5], ["AN", 1, 1, 6]]]], "r": [[9.96655e-05, 9.96649e-05, 9.96686e-05, 9.96728e-05, 9.96736e-05, 9.96675e-05, 9.96671e-05, 9.96824e-05, 9.96947e-05, 9.96654e-05], 0, 5.33376, 1652112975], "v": "v0.6"}
{"i": [["[\"fused_roll_reshape_permute_reshape\", 1, 16, 16, 512, 3, 8]", "cuda -keys=cuda,gpu -max_num_threads=1024 -model=unknown -thread_warp_size=32", [-1, 16, 64, 49152, 2147483647, 1024, 8, 32], "", 0, []], [[], [["FU", 1, [0, 1]], ["SP", 1, 0, 131072, [8], 1], ["AN", 1, 0, 5], ["AN", 1, 1, 6]]]], "r": [[1.48799e-05, 1.48804e-05, 1.48797e-05, 1.48808e-05, 1.48804e-05, 1.48795e-05, 1.48798e-05, 1.4879e-05, 1.48793e-05, 1.48792e-05], 0, 18.8706, 1652112989], "v": "v0.6"}
{"i": [["[\"fused_roll_reshape_permute_reshape\", 1, 16, 16, 512, 3, 8]", "cuda -keys=cuda,gpu -max_num_threads=1024 -model=unknown -thread_warp_size=32", [-1, 16, 64, 49152, 2147483647, 1024, 8, 32], "", 0, []], [[], [["FU", 1, [0, 1]], ["SP", 1, 0, 131072, [16], 1], ["AN", 1, 0, 5], ["AN", 1, 1, 6]]]], "r": [[8.85073e-06, 8.73563e-06, 8.8017e-06, 8.73279e-06, 8.73199e-06, 8.73417e-06, 8.73374e-06, 8.73349e-06, 8.73293e-06, 8.7342e-06], 0, 26.6233, 1652112996], "v": "v0.6"}
{"i": [["[\"fused_roll_reshape_permute_reshape\", 1, 16, 16, 512, 3, 8]", "cuda -keys=cuda,gpu -max_num_threads=1024 -model=unknown -thread_warp_size=32", [-1, 16, 64, 49152, 2147483647, 1024, 8, 32], "", 0, []], [[], [["FU", 1, [0, 1]], ["SP", 1, 0, 131072, [2], 1], ["AN", 1, 0, 5], ["AN", 1, 1, 6]]]], "r": [[5.1397e-05, 5.13962e-05, 5.13959e-05, 5.13983e-05, 5.13962e-05, 5.13956e-05, 5.13961e-05, 5.13969e-05, 5.13956e-05, 5.13962e-05], 0, 21.8003, 1652113641], "v": "v0.6"}
{"i": [["[\"fused_roll_reshape_permute_reshape\", 1, 16, 16, 512, 3, 8]", "cuda -keys=cuda,gpu -max_num_threads=1024 -model=unknown -thread_warp_size=32", [-1, 16, 64, 49152, 2147483647, 1024, 8, 32], "", 0, []], [[], [["FU", 1, [0, 1]], ["SP", 1, 0, 131072, [64], 1], ["AN", 1, 0, 5], ["AN", 1, 1, 6]]]], "r": [[3.96743e-06, 3.96755e-06, 3.96742e-06, 3.96752e-06, 3.96745e-06, 3.96753e-06, 3.9681e-06, 3.96769e-06, 3.96739e-06, 3.96731e-06], 0, 11.9792, 1652113631], "v": "v0.6"}
{"i": [["[\"fused_roll_reshape_permute_reshape\", 1, 16, 16, 512, 3, 8]", "cuda -keys=cuda,gpu -max_num_threads=1024 -model=unknown -thread_warp_size=32", [-1, 16, 64, 49152, 2147483647, 1024, 8, 32], "", 0, []], [[], [["FU", 1, [0, 1]], ["SP", 1, 0, 131072, [32], 1], ["AN", 1, 0, 5], ["AN", 1, 1, 6]]]], "r": [[5.88761e-06, 5.88713e-06, 5.88732e-06, 5.88751e-06, 5.88754e-06, 5.88598e-06, 5.88693e-06, 5.88704e-06, 5.88677e-06, 5.8875e-06], 0, 4.33905, 1652113624], "v": "v0.6"}
{"i": [["[\"fused_roll_reshape_permute_reshape\", 1, 16, 16, 512, 3, 8]", "cuda -keys=cuda,gpu -max_num_threads=1024 -model=unknown -thread_warp_size=32", [-1, 16, 64, 49152, 2147483647, 1024, 8, 32], "", 0, []], [[], [["FU", 1, [0, 1]], ["SP", 1, 0, 131072, [8], 1], ["AN", 1, 0, 5], ["AN", 1, 1, 6]]]], "r": [[1.48988e-05, 1.48987e-05, 1.48988e-05, 1.48987e-05, 1.48993e-05, 1.48992e-05, 1.48979e-05, 1.4901e-05, 1.48982e-05, 1.49014e-05], 0, 16.6169, 1652113636], "v": "v0.6"}
{"i": [["[\"fused_roll_reshape_permute_reshape\", 1, 16, 16, 512, 3, 8]", "cuda -keys=cuda,gpu -max_num_threads=1024 -model=unknown -thread_warp_size=32", [-1, 16, 64, 49152, 2147483647, 1024, 8, 32], "", 0, []], [[], [["FU", 1, [0, 1]], ["SP", 1, 0, 131072, [16], 1], ["AN", 1, 0, 5], ["AN", 1, 1, 6]]]], "r": [[8.58583e-06, 8.58594e-06, 8.58635e-06, 8.58583e-06, 8.58621e-06, 8.58615e-06, 8.5858e-06, 8.58566e-06, 8.58609e-06, 8.58611e-06], 0, 8.58496, 1652113628], "v": "v0.6"}
{"i": [["[\"fused_roll_reshape_permute_reshape\", 1, 16, 16, 512, 3, 8]", "cuda -keys=cuda,gpu -max_num_threads=1024 -model=unknown -thread_warp_size=32", [-1, 16, 64, 49152, 2147483647, 1024, 8, 32], "", 0, []], [[], [["FU", 1, [0, 1]], ["SP", 1, 0, 131072, [4], 1], ["AN", 1, 0, 5], ["AN", 1, 1, 6]]]], "r": [[2.70042e-05, 2.7006e-05, 2.70059e-05, 2.80978e-05, 2.70053e-05, 2.70046e-05, 2.70071e-05, 2.70074e-05, 2.70061e-05, 2.70054e-05], 0, 31.8499, 1652113651], "v": "v0.6"}
{"i": [["[\"fused_roll_reshape_permute_reshape\", 1, 16, 16, 512, 3, 8]", "cuda -keys=cuda,gpu -max_num_threads=1024 -model=unknown -thread_warp_size=32", [-1, 16, 64, 49152, 2147483647, 1024, 8, 32], "", 0, []], [[], [["FU", 1, [0, 1]], ["SP", 1, 0, 131072, [1], 1], ["AN", 1, 0, 5], ["AN", 1, 1, 6]]]], "r": [[0.000108159, 9.98201e-05, 9.98239e-05, 9.98186e-05, 9.98225e-05, 9.98166e-05, 9.98238e-05, 9.98204e-05, 9.98242e-05, 9.98202e-05], 0, 26.9202, 1652113646], "v": "v0.6"}
