python/models/swin_transformer/kernel_configs/swin_transformer_attn_v_permute_1_7_7_1024_7_32.log
{"i": [["[\"attn_v_permute\", 1, 7, 7, 1024, 7, 32]", "cuda -keys=cuda,gpu -max_num_threads=1024 -model=unknown -thread_warp_size=32", [-1, 16, 64, 49152, 2147483647, 1024, 8, 32], "", 0, []], [[], [["FU", 1, [0, 1, 2, 3]], ["SP", 1, 0, 50176, [49], 1], ["AN", 1, 0, 5], ["AN", 1, 1, 6]]]], "r": [[3.21128e-06, 3.20882e-06, 3.20878e-06], 0, 0.617247, 1668060340], "v": "v0.6"}
{"i": [["[\"attn_v_permute\", 1, 7, 7, 1024, 7, 32]", "cuda -keys=cuda,gpu -max_num_threads=1024 -model=unknown -thread_warp_size=32", [-1, 16, 64, 49152, 2147483647, 1024, 8, 32], "", 0, []], [[], [["FU", 1, [0, 1, 2, 3]], ["SP", 1, 0, 50176, [32], 1], ["AN", 1, 0, 5], ["AN", 1, 1, 6]]]], "r": [[3.77838e-06, 3.78555e-06, 3.78114e-06], 0, 2.09219, 1668060342], "v": "v0.6"}
{"i": [["[\"attn_v_permute\", 1, 7, 7, 1024, 7, 32]", "cuda -keys=cuda,gpu -max_num_threads=1024 -model=unknown -thread_warp_size=32", [-1, 16, 64, 49152, 2147483647, 1024, 8, 32], "", 0, []], [[], [["FU", 1, [0, 1, 2, 3]], ["SP", 1, 0, 50176, [16], 1], ["AN", 1, 0, 5], ["AN", 1, 1, 6]]]], "r": [[4.91255e-06, 4.91646e-06, 4.91707e-06], 0, 1.7393, 1668060342], "v": "v0.6"}
{"i": [["[\"attn_v_permute\", 1, 7, 7, 1024, 7, 32]", "cuda -keys=cuda,gpu -max_num_threads=1024 -model=unknown -thread_warp_size=32", [-1, 16, 64, 49152, 2147483647, 1024, 8, 32], "", 0, []], [[], [["FU", 1, [0, 1, 2, 3]], ["SP", 1, 0, 50176, [4], 1], ["AN", 1, 0, 5], ["AN", 1, 1, 6]]]], "r": [[1.20903e-05, 1.2116e-05, 1.21032e-05], 0, 1.37062, 1668060341], "v": "v0.6"}
{"i": [["[\"attn_v_permute\", 1, 7, 7, 1024, 7, 32]", "cuda -keys=cuda,gpu -max_num_threads=1024 -model=unknown -thread_warp_size=32", [-1, 16, 64, 49152, 2147483647, 1024, 8, 32], "", 0, []], [[], [["FU", 1, [0, 1, 2, 3]], ["SP", 1, 0, 50176, [7], 1], ["AN", 1, 0, 5], ["AN", 1, 1, 6]]]], "r": [[7.89436e-06, 7.90719e-06, 7.90709e-06], 0, 0.978304, 1668060341], "v": "v0.6"}
{"i": [["[\"attn_v_permute\", 1, 7, 7, 1024, 7, 32]", "cuda -keys=cuda,gpu -max_num_threads=1024 -model=unknown -thread_warp_size=32", [-1, 16, 64, 49152, 2147483647, 1024, 8, 32], "", 0, []], [[], [["FU", 1, [0, 1, 2, 3]], ["SP", 1, 0, 50176, [1], 1], ["AN", 1, 0, 5], ["AN", 1, 1, 6]]]], "r": [[3.99194e-05, 3.99318e-05, 3.99197e-05], 0, 2.85903, 1668060343], "v": "v0.6"}
{"i": [["[\"attn_v_permute\", 1, 7, 7, 1024, 7, 32]", "cuda -keys=cuda,gpu -max_num_threads=1024 -model=unknown -thread_warp_size=32", [-1, 16, 64, 49152, 2147483647, 1024, 8, 32], "", 0, []], [[], [["FU", 1, [0, 1, 2, 3]], ["SP", 1, 0, 50176, [28], 1], ["AN", 1, 0, 5], ["AN", 1, 1, 6]]]], "r": [[3.93412e-06, 3.9449e-06, 3.94242e-06], 0, 2.48724, 1668060342], "v": "v0.6"}
{"i": [["[\"attn_v_permute\", 1, 7, 7, 1024, 7, 32]", "cuda -keys=cuda,gpu -max_num_threads=1024 -model=unknown -thread_warp_size=32", [-1, 16, 64, 49152, 2147483647, 1024, 8, 32], "", 0, []], [[], [["FU", 1, [0, 1, 2, 3]], ["SP", 1, 0, 50176, [64], 1], ["AN", 1, 0, 5], ["AN", 1, 1, 6]]]], "r": [[3.15094e-06, 3.15843e-06, 3.16371e-06], 0, 3.20806, 1668060343], "v": "v0.6"}
{"i": [["[\"attn_v_permute\", 1, 7, 7, 1024, 7, 32]", "cuda -keys=cuda,gpu -max_num_threads=1024 -model=unknown -thread_warp_size=32", [-1, 16, 64, 49152, 2147483647, 1024, 8, 32], "", 0, []], [[], [["FU", 1, [0, 1, 2, 3]], ["SP", 1, 0, 50176, [2], 1], ["AN", 1, 0, 5], ["AN", 1, 1, 6]]]], "r": [[2.13294e-05, 2.13496e-05, 2.13506e-05], 0, 3.63339, 1668060343], "v": "v0.6"}
{"i": [["[\"attn_v_permute\", 1, 7, 7, 1024, 7, 32]", "cuda -keys=cuda,gpu -max_num_threads=1024 -model=unknown -thread_warp_size=32", [-1, 16, 64, 49152, 2147483647, 1024, 8, 32], "", 0, []], [[], [["FU", 1, [0, 1, 2, 3]], ["SP", 1, 0, 50176, [56], 1], ["AN", 1, 0, 5], ["AN", 1, 1, 6]]]], "r": [[3.29484e-06, 3.3182e-06, 3.31733e-06], 0, 3.99008, 1668060344], "v": "v0.6"}
{"i": [["[\"attn_v_permute\", 1, 7, 7, 1024, 7, 32]", "cuda -keys=cuda,gpu -max_num_threads=1024 -model=unknown -thread_warp_size=32", [-1, 16, 64, 49152, 2147483647, 1024, 8, 32], "", 0, []], [[], [["FU", 1, [0, 1, 2, 3]], ["SP", 1, 0, 50176, [8], 1], ["AN", 1, 0, 5], ["AN", 1, 1, 6]]]], "r": [[7.40124e-06, 7.42042e-06, 7.41908e-06], 0, 4.36531, 1668060344], "v": "v0.6"}
{"i": [["[\"attn_v_permute\", 1, 7, 7, 1024, 7, 32]", "cuda -keys=cuda,gpu -max_num_threads=1024 -model=unknown -thread_warp_size=32", [-1, 16, 64, 49152, 2147483647, 1024, 8, 32], "", 0, []], [[], [["FU", 1, [0, 1, 2, 3]], ["SP", 1, 0, 50176, [14], 1], ["AN", 1, 0, 5], ["AN", 1, 1, 6]]]], "r": [[5.39123e-06, 5.39478e-06, 5.39007e-06], 0, 4.77804, 1668060345], "v": "v0.6"}
{"i": [["[\"attn_v_permute\", 1, 7, 7, 1024, 7, 32]", "cuda -keys=cuda,gpu -max_num_threads=1024 -model=unknown -thread_warp_size=32", [-1, 16, 64, 49152, 2147483647, 1024, 8, 32], "", 0, []], [[], [["FU", 1, [0, 1, 2, 3]], ["SP", 1, 0, 50176, [16], 1], ["AN", 1, 0, 5], ["AN", 1, 1, 6]]]], "r": [[4.94509e-06, 4.96496e-06, 4.96146e-06], 0, 1.95767, 1668061726], "v": "v0.6"}
{"i": [["[\"attn_v_permute\", 1, 7, 7, 1024, 7, 32]", "cuda -keys=cuda,gpu -max_num_threads=1024 -model=unknown -thread_warp_size=32", [-1, 16, 64, 49152, 2147483647, 1024, 8, 32], "", 0, []], [[], [["FU", 1, [0, 1, 2, 3]], ["SP", 1, 0, 50176, [32], 1], ["AN", 1, 0, 5], ["AN", 1, 1, 6]]]], "r": [[3.79101e-06, 3.8004e-06, 3.79773e-06], 0, 0.569757, 1668061725], "v": "v0.6"}
{"i": [["[\"attn_v_permute\", 1, 7, 7, 1024, 7, 32]", "cuda -keys=cuda,gpu -max_num_threads=1024 -model=unknown -thread_warp_size=32", [-1, 16, 64, 49152, 2147483647, 1024, 8, 32], "", 0, []], [[], [["FU", 1, [0, 1, 2, 3]], ["SP", 1, 0, 50176, [4], 1], ["AN", 1, 0, 5], ["AN", 1, 1, 6]]]], "r": [[1.19899e-05, 1.20052e-05, 1.20058e-05], 0, 1.61209, 1668061726], "v": "v0.6"}
{"i": [["[\"attn_v_permute\", 1, 7, 7, 1024, 7, 32]", "cuda -keys=cuda,gpu -max_num_threads=1024 -model=unknown -thread_warp_size=32", [-1, 16, 64, 49152, 2147483647, 1024, 8, 32], "", 0, []], [[], [["FU", 1, [0, 1, 2, 3]], ["SP", 1, 0, 50176, [64], 1], ["AN", 1, 0, 5], ["AN", 1, 1, 6]]]], "r": [[3.0174e-06, 3.01265e-06, 3.0135e-06], 0, 1.2667, 1668061726], "v": "v0.6"}
{"i": [["[\"attn_v_permute\", 1, 7, 7, 1024, 7, 32]", "cuda -keys=cuda,gpu -max_num_threads=1024 -model=unknown -thread_warp_size=32", [-1, 16, 64, 49152, 2147483647, 1024, 8, 32], "", 0, []], [[], [["FU", 1, [0, 1, 2, 3]], ["SP", 1, 0, 50176, [8], 1], ["AN", 1, 0, 5], ["AN", 1, 1, 6]]]], "r": [[7.19808e-06, 7.21114e-06, 7.21156e-06], 0, 0.892569, 1668061725], "v": "v0.6"}
{"i": [["[\"attn_v_permute\", 1, 7, 7, 1024, 7, 32]", "cuda -keys=cuda,gpu -max_num_threads=1024 -model=unknown -thread_warp_size=32", [-1, 16, 64, 49152, 2147483647, 1024, 8, 32], "", 0, []], [[], [["FU", 1, [0, 1, 2, 3]], ["SP", 1, 0, 50176, [1], 1], ["AN", 1, 0, 5], ["AN", 1, 1, 6]]]], "r": [[3.98874e-05, 3.99024e-05, 3.98964e-05], 0, 2.34948, 1668061727], "v": "v0.6"}
{"i": [["[\"attn_v_permute\", 1, 7, 7, 1024, 7, 32]", "cuda -keys=cuda,gpu -max_num_threads=1024 -model=unknown -thread_warp_size=32", [-1, 16, 64, 49152, 2147483647, 1024, 8, 32], "", 0, []], [[], [["FU", 1, [0, 1, 2, 3]], ["SP", 1, 0, 50176, [49], 1], ["AN", 1, 0, 5], ["AN", 1, 1, 6]]]], "r": [[3.23511e-06, 3.22977e-06, 3.22831e-06], 0, 3.03135, 1668061727], "v": "v0.6"}
{"i": [["[\"attn_v_permute\", 1, 7, 7, 1024, 7, 32]", "cuda -keys=cuda,gpu -max_num_threads=1024 -model=unknown -thread_warp_size=32", [-1, 16, 64, 49152, 2147483647, 1024, 8, 32], "", 0, []], [[], [["FU", 1, [0, 1, 2, 3]], ["SP", 1, 0, 50176, [7], 1], ["AN", 1, 0, 5], ["AN", 1, 1, 6]]]], "r": [[7.91127e-06, 7.92474e-06, 7.92301e-06], 0, 2.67705, 1668061727], "v": "v0.6"}
{"i": [["[\"attn_v_permute\", 1, 7, 7, 1024, 7, 32]", "cuda -keys=cuda,gpu -max_num_threads=1024 -model=unknown -thread_warp_size=32", [-1, 16, 64, 49152, 2147483647, 1024, 8, 32], "", 0, []], [[], [["FU", 1, [0, 1, 2, 3]], ["SP", 1, 0, 50176, [28], 1], ["AN", 1, 0, 5], ["AN", 1, 1, 6]]]], "r": [[3.95963e-06, 3.9572e-06, 3.9641e-06], 0, 3.38435, 1668061728], "v": "v0.6"}
{"i": [["[\"attn_v_permute\", 1, 7, 7, 1024, 7, 32]", "cuda -keys=cuda,gpu -max_num_threads=1024 -model=unknown -thread_warp_size=32", [-1, 16, 64, 49152, 2147483647, 1024, 8, 32], "", 0, []], [[], [["FU", 1, [0, 1, 2, 3]], ["SP", 1, 0, 50176, [2], 1], ["AN", 1, 0, 5], ["AN", 1, 1, 6]]]], "r": [[2.13006e-05, 2.13169e-05, 2.13222e-05], 0, 4.43765, 1668061729], "v": "v0.6"}
{"i": [["[\"attn_v_permute\", 1, 7, 7, 1024, 7, 32]", "cuda -keys=cuda,gpu -max_num_threads=1024 -model=unknown -thread_warp_size=32", [-1, 16, 64, 49152, 2147483647, 1024, 8, 32], "", 0, []], [[], [["FU", 1, [0, 1, 2, 3]], ["SP", 1, 0, 50176, [56], 1], ["AN", 1, 0, 5], ["AN", 1, 1, 6]]]], "r": [[3.18006e-06, 3.17882e-06, 3.17807e-06], 0, 3.72972, 1668061728], "v": "v0.6"}
{"i": [["[\"attn_v_permute\", 1, 7, 7, 1024, 7, 32]", "cuda -keys=cuda,gpu -max_num_threads=1024 -model=unknown -thread_warp_size=32", [-1, 16, 64, 49152, 2147483647, 1024, 8, 32], "", 0, []], [[], [["FU", 1, [0, 1, 2, 3]], ["SP", 1, 0, 50176, [14], 1], ["AN", 1, 0, 5], ["AN", 1, 1, 6]]]], "r": [[5.2488e-06, 5.26221e-06, 5.26062e-06], 0, 4.05006, 1668061728], "v": "v0.6"}
