python/models/swin_transformer/kernel_configs/swin_transformer_softmax_norm_12544_49.log
{"i": [["[\"softmax_norm\", 12544, 49]", "cuda -keys=cuda,gpu -max_num_threads=1024 -model=unknown -thread_warp_size=32", [-1, 16, 64, 49152, 2147483647, 1024, 8, 32], "", 0, []], [[], [["FU", 2, [0, 1, 2]], ["SP", 2, 0, 30118144, [7], 1], ["AN", 2, 0, 5], ["AN", 2, 1, 6]]]], "r": [[0.00319471, 0.00319455, 0.00319455], 0, 4.96118, 1668017370], "v": "v0.6"}
{"i": [["[\"softmax_norm\", 12544, 49]", "cuda -keys=cuda,gpu -max_num_threads=1024 -model=unknown -thread_warp_size=32", [-1, 16, 64, 49152, 2147483647, 1024, 8, 32], "", 0, []], [[], [["FU", 2, [0, 1, 2]], ["SP", 2, 0, 30118144, [56], 1], ["AN", 2, 0, 5], ["AN", 2, 1, 6]]]], "r": [[0.000402514, 0.000402408, 0.000402369], 0, 12.1538, 1668017377], "v": "v0.6"}
{"i": [["[\"softmax_norm\", 12544, 49]", "cuda -keys=cuda,gpu -max_num_threads=1024 -model=unknown -thread_warp_size=32", [-1, 16, 64, 49152, 2147483647, 1024, 8, 32], "", 0, []], [[], [["FU", 2, [0, 1, 2]], ["SP", 2, 0, 30118144, [4], 1], ["AN", 2, 0, 5], ["AN", 2, 1, 6]]]], "r": [[0.00558685, 0.00558694, 0.00558768], 0, 9.79636, 1668017374], "v": "v0.6"}
{"i": [["[\"softmax_norm\", 12544, 49]", "cuda -keys=cuda,gpu -max_num_threads=1024 -model=unknown -thread_warp_size=32", [-1, 16, 64, 49152, 2147483647, 1024, 8, 32], "", 0, []], [[], [["FU", 2, [0, 1, 2]], ["SP", 2, 0, 30118144, [16], 1], ["AN", 2, 0, 5], ["AN", 2, 1, 6]]]], "r": [[0.00140113, 0.00140109, 0.00140083], 0, 14.559, 1668017379], "v": "v0.6"}
{"i": [["[\"softmax_norm\", 12544, 49]", "cuda -keys=cuda,gpu -max_num_threads=1024 -model=unknown -thread_warp_size=32", [-1, 16, 64, 49152, 2147483647, 1024, 8, 32], "", 0, []], [[], [["FU", 2, [0, 1, 2]], ["SP", 2, 0, 30118144, [32], 1], ["AN", 2, 0, 5], ["AN", 2, 1, 6]]]], "r": [[0.000702291, 0.000702325, 0.000702139], 0, 7.37267, 1668017372], "v": "v0.6"}
{"i": [["[\"softmax_norm\", 12544, 49]", "cuda -keys=cuda,gpu -max_num_threads=1024 -model=unknown -thread_warp_size=32", [-1, 16, 64, 49152, 2147483647, 1024, 8, 32], "", 0, []], [[], [["FU", 2, [0, 1, 2]], ["SP", 2, 0, 30118144, [49], 1], ["AN", 2, 0, 5], ["AN", 2, 1, 6]]]], "r": [[0.000459045, 0.000458975, 0.000459046], 0, 2.57684, 1668017367], "v": "v0.6"}
{"i": [["[\"softmax_norm\", 12544, 49]", "cuda -keys=cuda,gpu -max_num_threads=1024 -model=unknown -thread_warp_size=32", [-1, 16, 64, 49152, 2147483647, 1024, 8, 32], "", 0, []], [[], [["FU", 2, [0, 1, 2]], ["SP", 2, 0, 30118144, [8], 1], ["AN", 2, 0, 5], ["AN", 2, 1, 6]]]], "r": [[0.00279657, 0.00279661, 0.002797], 0, 24.3507, 1668017389], "v": "v0.6"}
{"i": [["[\"softmax_norm\", 12544, 49]", "cuda -keys=cuda,gpu -max_num_threads=1024 -model=unknown -thread_warp_size=32", [-1, 16, 64, 49152, 2147483647, 1024, 8, 32], "", 0, []], [[], [["FU", 2, [0, 1, 2]], ["SP", 2, 0, 30118144, [1], 1], ["AN", 2, 0, 5], ["AN", 2, 1, 6]]]], "r": [[0.0223262, 0.0223146, 0.022329], 0, 17.1348, 1668017382], "v": "v0.6"}
{"i": [["[\"softmax_norm\", 12544, 49]", "cuda -keys=cuda,gpu -max_num_threads=1024 -model=unknown -thread_warp_size=32", [-1, 16, 64, 49152, 2147483647, 1024, 8, 32], "", 0, []], [[], [["FU", 2, [0, 1, 2]], ["SP", 2, 0, 30118144, [64], 1], ["AN", 2, 0, 5], ["AN", 2, 1, 6]]]], "r": [[0.000352689, 0.000352647, 0.000352496], 0, 21.9796, 1668017387], "v": "v0.6"}
{"i": [["[\"softmax_norm\", 12544, 49]", "cuda -keys=cuda,gpu -max_num_threads=1024 -model=unknown -thread_warp_size=32", [-1, 16, 64, 49152, 2147483647, 1024, 8, 32], "", 0, []], [[], [["FU", 2, [0, 1, 2]], ["SP", 2, 0, 30118144, [2], 1], ["AN", 2, 0, 5], ["AN", 2, 1, 6]]]], "r": [[0.011167, 0.0111681, 0.0111674], 0, 19.5827, 1668017384], "v": "v0.6"}
{"i": [["[\"softmax_norm\", 12544, 49]", "cuda -keys=cuda,gpu -max_num_threads=1024 -model=unknown -thread_warp_size=32", [-1, 16, 64, 49152, 2147483647, 1024, 8, 32], "", 0, []], [[], [["FU", 2, [0, 1, 2]], ["SP", 2, 0, 30118144, [28], 1], ["AN", 2, 0, 5], ["AN", 2, 1, 6]]]], "r": [[0.000801722, 0.000801239, 0.000801185], 0, 29.106, 1668017394], "v": "v0.6"}
{"i": [["[\"softmax_norm\", 12544, 49]", "cuda -keys=cuda,gpu -max_num_threads=1024 -model=unknown -thread_warp_size=32", [-1, 16, 64, 49152, 2147483647, 1024, 8, 32], "", 0, []], [[], [["FU", 2, [0, 1, 2]], ["SP", 2, 0, 30118144, [14], 1], ["AN", 2, 0, 5], ["AN", 2, 1, 6]]]], "r": [[0.00160016, 0.00159971, 0.00159988], 0, 26.6931, 1668017391], "v": "v0.6"}
{"i": [["[\"softmax_norm\", 12544, 49]", "cuda -keys=cuda,gpu -max_num_threads=1024 -model=unknown -thread_warp_size=32", [-1, 16, 64, 49152, 2147483647, 1024, 8, 32], "", 0, []], [[], [["FU", 2, [0, 1, 2]], ["SP", 2, 0, 30118144, [56], 1], ["AN", 2, 0, 5], ["AN", 2, 1, 6]]]], "r": [[0.000402689, 0.000402668, 0.000402509], 0, 19.1255, 1668017508], "v": "v0.6"}
{"i": [["[\"softmax_norm\", 12544, 49]", "cuda -keys=cuda,gpu -max_num_threads=1024 -model=unknown -thread_warp_size=32", [-1, 16, 64, 49152, 2147483647, 1024, 8, 32], "", 0, []], [[], [["FU", 2, [0, 1, 2]], ["SP", 2, 0, 30118144, [14], 1], ["AN", 2, 0, 5], ["AN", 2, 1, 6]]]], "r": [[0.00160024, 0.00160004, 0.00159996], 0, 9.61766, 1668017498], "v": "v0.6"}
{"i": [["[\"softmax_norm\", 12544, 49]", "cuda -keys=cuda,gpu -max_num_threads=1024 -model=unknown -thread_warp_size=32", [-1, 16, 64, 49152, 2147483647, 1024, 8, 32], "", 0, []], [[], [["FU", 2, [0, 1, 2]], ["SP", 2, 0, 30118144, [49], 1], ["AN", 2, 0, 5], ["AN", 2, 1, 6]]]], "r": [[0.000459613, 0.000459446, 0.000459586], 0, 2.54889, 1668017491], "v": "v0.6"}
{"i": [["[\"softmax_norm\", 12544, 49]", "cuda -keys=cuda,gpu -max_num_threads=1024 -model=unknown -thread_warp_size=32", [-1, 16, 64, 49152, 2147483647, 1024, 8, 32], "", 0, []], [[], [["FU", 2, [0, 1, 2]], ["SP", 2, 0, 30118144, [64], 1], ["AN", 2, 0, 5], ["AN", 2, 1, 6]]]], "r": [[0.000352599, 0.000352558, 0.000352565], 0, 4.86327, 1668017494], "v": "v0.6"}
{"i": [["[\"softmax_norm\", 12544, 49]", "cuda -keys=cuda,gpu -max_num_threads=1024 -model=unknown -thread_warp_size=32", [-1, 16, 64, 49152, 2147483647, 1024, 8, 32], "", 0, []], [[], [["FU", 2, [0, 1, 2]], ["SP", 2, 0, 30118144, [32], 1], ["AN", 2, 0, 5], ["AN", 2, 1, 6]]]], "r": [[0.00070244, 0.000702363, 0.00070224], 0, 11.9483, 1668017501], "v": "v0.6"}
{"i": [["[\"softmax_norm\", 12544, 49]", "cuda -keys=cuda,gpu -max_num_threads=1024 -model=unknown -thread_warp_size=32", [-1, 16, 64, 49152, 2147483647, 1024, 8, 32], "", 0, []], [[], [["FU", 2, [0, 1, 2]], ["SP", 2, 0, 30118144, [4], 1], ["AN", 2, 0, 5], ["AN", 2, 1, 6]]]], "r": [[0.00558681, 0.00558646, 0.00558659], 0, 7.28111, 1668017496], "v": "v0.6"}
{"i": [["[\"softmax_norm\", 12544, 49]", "cuda -keys=cuda,gpu -max_num_threads=1024 -model=unknown -thread_warp_size=32", [-1, 16, 64, 49152, 2147483647, 1024, 8, 32], "", 0, []], [[], [["FU", 2, [0, 1, 2]], ["SP", 2, 0, 30118144, [2], 1], ["AN", 2, 0, 5], ["AN", 2, 1, 6]]]], "r": [[0.0111696, 0.0111679, 0.0111683], 0, 14.4744, 1668017503], "v": "v0.6"}
{"i": [["[\"softmax_norm\", 12544, 49]", "cuda -keys=cuda,gpu -max_num_threads=1024 -model=unknown -thread_warp_size=32", [-1, 16, 64, 49152, 2147483647, 1024, 8, 32], "", 0, []], [[], [["FU", 2, [0, 1, 2]], ["SP", 2, 0, 30118144, [8], 1], ["AN", 2, 0, 5], ["AN", 2, 1, 6]]]], "r": [[0.00279654, 0.00279692, 0.0027972], 0, 16.8041, 1668017506], "v": "v0.6"}
{"i": [["[\"softmax_norm\", 12544, 49]", "cuda -keys=cuda,gpu -max_num_threads=1024 -model=unknown -thread_warp_size=32", [-1, 16, 64, 49152, 2147483647, 1024, 8, 32], "", 0, []], [[], [["FU", 2, [0, 1, 2]], ["SP", 2, 0, 30118144, [7], 1], ["AN", 2, 0, 5], ["AN", 2, 1, 6]]]], "r": [[0.00319514, 0.00319545, 0.00319456], 0, 21.5184, 1668017510], "v": "v0.6"}
{"i": [["[\"softmax_norm\", 12544, 49]", "cuda -keys=cuda,gpu -max_num_threads=1024 -model=unknown -thread_warp_size=32", [-1, 16, 64, 49152, 2147483647, 1024, 8, 32], "", 0, []], [[], [["FU", 2, [0, 1, 2]], ["SP", 2, 0, 30118144, [28], 1], ["AN", 2, 0, 5], ["AN", 2, 1, 6]]]], "r": [[0.00080269, 0.000802354, 0.000802637], 0, 23.828, 1668017513], "v": "v0.6"}
{"i": [["[\"softmax_norm\", 12544, 49]", "cuda -keys=cuda,gpu -max_num_threads=1024 -model=unknown -thread_warp_size=32", [-1, 16, 64, 49152, 2147483647, 1024, 8, 32], "", 0, []], [[], [["FU", 2, [0, 1, 2]], ["SP", 2, 0, 30118144, [16], 1], ["AN", 2, 0, 5], ["AN", 2, 1, 6]]]], "r": [[0.00140081, 0.00140115, 0.00140126], 0, 26.142, 1668017515], "v": "v0.6"}
{"i": [["[\"softmax_norm\", 12544, 49]", "cuda -keys=cuda,gpu -max_num_threads=1024 -model=unknown -thread_warp_size=32", [-1, 16, 64, 49152, 2147483647, 1024, 8, 32], "", 0, []], [[], [["FU", 2, [0, 1, 2]], ["SP", 2, 0, 30118144, [1], 1], ["AN", 2, 0, 5], ["AN", 2, 1, 6]]]], "r": [[0.0223244, 0.0223264, 0.0223245], 0, 28.742, 1668017518], "v": "v0.6"}
{"i": [["[\"softmax_norm\", 12544, 49]", "cuda -keys=cuda,gpu -max_num_threads=1024 -model=unknown -thread_warp_size=32", [-1, 16, 64, 49152, 2147483647, 1024, 8, 32], "", 0, []], [[], [["FU", 2, [0, 1, 2]], ["SP", 2, 0, 30118144, [14], 1], ["AN", 2, 0, 5], ["AN", 2, 1, 6]]]], "r": [[0.00159929, 0.00159931, 0.00159903], 0, 12.001, 1668046543], "v": "v0.6"}
{"i": [["[\"softmax_norm\", 12544, 49]", "cuda -keys=cuda,gpu -max_num_threads=1024 -model=unknown -thread_warp_size=32", [-1, 16, 64, 49152, 2147483647, 1024, 8, 32], "", 0, []], [[], [["FU", 2, [0, 1, 2]], ["SP", 2, 0, 30118144, [4], 1], ["AN", 2, 0, 5], ["AN", 2, 1, 6]]]], "r": [[0.00558491, 0.00558505, 0.00558505], 0, 7.33537, 1668046538], "v": "v0.6"}
{"i": [["[\"softmax_norm\", 12544, 49]", "cuda -keys=cuda,gpu -max_num_threads=1024 -model=unknown -thread_warp_size=32", [-1, 16, 64, 49152, 2147483647, 1024, 8, 32], "", 0, []], [[], [["FU", 2, [0, 1, 2]], ["SP", 2, 0, 30118144, [64], 1], ["AN", 2, 0, 5], ["AN", 2, 1, 6]]]], "r": [[0.000352552, 0.000352555, 0.000352505], 0, 2.57766, 1668046533], "v": "v0.6"}
{"i": [["[\"softmax_norm\", 12544, 49]", "cuda -keys=cuda,gpu -max_num_threads=1024 -model=unknown -thread_warp_size=32", [-1, 16, 64, 49152, 2147483647, 1024, 8, 32], "", 0, []], [[], [["FU", 2, [0, 1, 2]], ["SP", 2, 0, 30118144, [56], 1], ["AN", 2, 0, 5], ["AN", 2, 1, 6]]]], "r": [[0.000402411, 0.000402359, 0.000402346], 0, 21.7098, 1668046553], "v": "v0.6"}
{"i": [["[\"softmax_norm\", 12544, 49]", "cuda -keys=cuda,gpu -max_num_threads=1024 -model=unknown -thread_warp_size=32", [-1, 16, 64, 49152, 2147483647, 1024, 8, 32], "", 0, []], [[], [["FU", 2, [0, 1, 2]], ["SP", 2, 0, 30118144, [16], 1], ["AN", 2, 0, 5], ["AN", 2, 1, 6]]]], "r": [[0.0014001, 0.00140008, 0.00140005], 0, 4.90053, 1668046536], "v": "v0.6"}
{"i": [["[\"softmax_norm\", 12544, 49]", "cuda -keys=cuda,gpu -max_num_threads=1024 -model=unknown -thread_warp_size=32", [-1, 16, 64, 49152, 2147483647, 1024, 8, 32], "", 0, []], [[], [["FU", 2, [0, 1, 2]], ["SP", 2, 0, 30118144, [49], 1], ["AN", 2, 0, 5], ["AN", 2, 1, 6]]]], "r": [[0.00045935, 0.00045935, 0.000459371], 0, 9.67323, 1668046541], "v": "v0.6"}
{"i": [["[\"softmax_norm\", 12544, 49]", "cuda -keys=cuda,gpu -max_num_threads=1024 -model=unknown -thread_warp_size=32", [-1, 16, 64, 49152, 2147483647, 1024, 8, 32], "", 0, []], [[], [["FU", 2, [0, 1, 2]], ["SP", 2, 0, 30118144, [8], 1], ["AN", 2, 0, 5], ["AN", 2, 1, 6]]]], "r": [[0.00279494, 0.00279526, 0.00279496], 0, 14.3966, 1668046545], "v": "v0.6"}
{"i": [["[\"softmax_norm\", 12544, 49]", "cuda -keys=cuda,gpu -max_num_threads=1024 -model=unknown -thread_warp_size=32", [-1, 16, 64, 49152, 2147483647, 1024, 8, 32], "", 0, []], [[], [["FU", 2, [0, 1, 2]], ["SP", 2, 0, 30118144, [7], 1], ["AN", 2, 0, 5], ["AN", 2, 1, 6]]]], "r": [[0.00319342, 0.00319351, 0.00319346], 0, 16.7525, 1668046548], "v": "v0.6"}
{"i": [["[\"softmax_norm\", 12544, 49]", "cuda -keys=cuda,gpu -max_num_threads=1024 -model=unknown -thread_warp_size=32", [-1, 16, 64, 49152, 2147483647, 1024, 8, 32], "", 0, []], [[], [["FU", 2, [0, 1, 2]], ["SP", 2, 0, 30118144, [1], 1], ["AN", 2, 0, 5], ["AN", 2, 1, 6]]]], "r": [[0.0223206, 0.0223222, 0.0223206], 0, 19.3297, 1668046550], "v": "v0.6"}
{"i": [["[\"softmax_norm\", 12544, 49]", "cuda -keys=cuda,gpu -max_num_threads=1024 -model=unknown -thread_warp_size=32", [-1, 16, 64, 49152, 2147483647, 1024, 8, 32], "", 0, []], [[], [["FU", 2, [0, 1, 2]], ["SP", 2, 0, 30118144, [32], 1], ["AN", 2, 0, 5], ["AN", 2, 1, 6]]]], "r": [[0.000702261, 0.000702287, 0.000702107], 0, 24.0369, 1668046555], "v": "v0.6"}
{"i": [["[\"softmax_norm\", 12544, 49]", "cuda -keys=cuda,gpu -max_num_threads=1024 -model=unknown -thread_warp_size=32", [-1, 16, 64, 49152, 2147483647, 1024, 8, 32], "", 0, []], [[], [["FU", 2, [0, 1, 2]], ["SP", 2, 0, 30118144, [2], 1], ["AN", 2, 0, 5], ["AN", 2, 1, 6]]]], "r": [[0.0111663, 0.0111646, 0.0111648], 0, 26.4371, 1668046557], "v": "v0.6"}
{"i": [["[\"softmax_norm\", 12544, 49]", "cuda -keys=cuda,gpu -max_num_threads=1024 -model=unknown -thread_warp_size=32", [-1, 16, 64, 49152, 2147483647, 1024, 8, 32], "", 0, []], [[], [["FU", 2, [0, 1, 2]], ["SP", 2, 0, 30118144, [28], 1], ["AN", 2, 0, 5], ["AN", 2, 1, 6]]]], "r": [[0.000802118, 0.000802059, 0.000802028], 0, 28.845, 1668046560], "v": "v0.6"}
{"i": [["[\"softmax_norm\", 12544, 49]", "cuda -keys=cuda,gpu -max_num_threads=1024 -model=unknown -thread_warp_size=32", [-1, 16, 64, 49152, 2147483647, 1024, 8, 32], "", 0, []], [[], [["FU", 2, [0, 1, 2]], ["SP", 2, 0, 30118144, [14], 1], ["AN", 2, 0, 5], ["AN", 2, 1, 6]]]], "r": [[0.00159958, 0.00159985, 0.00159978], 0, 10.1132, 1668048400], "v": "v0.6"}
{"i": [["[\"softmax_norm\", 12544, 49]", "cuda -keys=cuda,gpu -max_num_threads=1024 -model=unknown -thread_warp_size=32", [-1, 16, 64, 49152, 2147483647, 1024, 8, 32], "", 0, []], [[], [["FU", 2, [0, 1, 2]], ["SP", 2, 0, 30118144, [16], 1], ["AN", 2, 0, 5], ["AN", 2, 1, 6]]]], "r": [[0.00139952, 0.00139963, 0.00139959], 0, 7.55779, 1668048398], "v": "v0.6"}
{"i": [["[\"softmax_norm\", 12544, 49]", "cuda -keys=cuda,gpu -max_num_threads=1024 -model=unknown -thread_warp_size=32", [-1, 16, 64, 49152, 2147483647, 1024, 8, 32], "", 0, []], [[], [["FU", 2, [0, 1, 2]], ["SP", 2, 0, 30118144, [64], 1], ["AN", 2, 0, 5], ["AN", 2, 1, 6]]]], "r": [[0.000352564, 0.000352466, 0.000352464], 0, 19.42, 1668048410], "v": "v0.6"}
{"i": [["[\"softmax_norm\", 12544, 49]", "cuda -keys=cuda,gpu -max_num_threads=1024 -model=unknown -thread_warp_size=32", [-1, 16, 64, 49152, 2147483647, 1024, 8, 32], "", 0, []], [[], [["FU", 2, [0, 1, 2]], ["SP", 2, 0, 30118144, [49], 1], ["AN", 2, 0, 5], ["AN", 2, 1, 6]]]], "r": [[0.000458874, 0.000458987, 0.000458987], 0, 3.05018, 1668048393], "v": "v0.6"}
{"i": [["[\"softmax_norm\", 12544, 49]", "cuda -keys=cuda,gpu -max_num_threads=1024 -model=unknown -thread_warp_size=32", [-1, 16, 64, 49152, 2147483647, 1024, 8, 32], "", 0, []], [[], [["FU", 2, [0, 1, 2]], ["SP", 2, 0, 30118144, [1], 1], ["AN", 2, 0, 5], ["AN", 2, 1, 6]]]], "r": [[0.0223211, 0.0223195, 0.0223198], 0, 26.8585, 1668048417], "v": "v0.6"}
{"i": [["[\"softmax_norm\", 12544, 49]", "cuda -keys=cuda,gpu -max_num_threads=1024 -model=unknown -thread_warp_size=32", [-1, 16, 64, 49152, 2147483647, 1024, 8, 32], "", 0, []], [[], [["FU", 2, [0, 1, 2]], ["SP", 2, 0, 30118144, [4], 1], ["AN", 2, 0, 5], ["AN", 2, 1, 6]]]], "r": [[0.00558775, 0.00558914, 0.00558499], 0, 12.1726, 1668048403], "v": "v0.6"}
{"i": [["[\"softmax_norm\", 12544, 49]", "cuda -keys=cuda,gpu -max_num_threads=1024 -model=unknown -thread_warp_size=32", [-1, 16, 64, 49152, 2147483647, 1024, 8, 32], "", 0, []], [[], [["FU", 2, [0, 1, 2]], ["SP", 2, 0, 30118144, [2], 1], ["AN", 2, 0, 5], ["AN", 2, 1, 6]]]], "r": [[0.0111653, 0.0111645, 0.0111647], 0, 17.0427, 1668048408], "v": "v0.6"}
{"i": [["[\"softmax_norm\", 12544, 49]", "cuda -keys=cuda,gpu -max_num_threads=1024 -model=unknown -thread_warp_size=32", [-1, 16, 64, 49152, 2147483647, 1024, 8, 32], "", 0, []], [[], [["FU", 2, [0, 1, 2]], ["SP", 2, 0, 30118144, [56], 1], ["AN", 2, 0, 5], ["AN", 2, 1, 6]]]], "r": [[0.000402513, 0.000402432, 0.000402361], 0, 5.13721, 1668048396], "v": "v0.6"}
{"i": [["[\"softmax_norm\", 12544, 49]", "cuda -keys=cuda,gpu -max_num_threads=1024 -model=unknown -thread_warp_size=32", [-1, 16, 64, 49152, 2147483647, 1024, 8, 32], "", 0, []], [[], [["FU", 2, [0, 1, 2]], ["SP", 2, 0, 30118144, [32], 1], ["AN", 2, 0, 5], ["AN", 2, 1, 6]]]], "r": [[0.000702626, 0.000702452, 0.00070258], 0, 24.1428, 1668048415], "v": "v0.6"}
{"i": [["[\"softmax_norm\", 12544, 49]", "cuda -keys=cuda,gpu -max_num_threads=1024 -model=unknown -thread_warp_size=32", [-1, 16, 64, 49152, 2147483647, 1024, 8, 32], "", 0, []], [[], [["FU", 2, [0, 1, 2]], ["SP", 2, 0, 30118144, [8], 1], ["AN", 2, 0, 5], ["AN", 2, 1, 6]]]], "r": [[0.00279526, 0.00279508, 0.00279516], 0, 29.1473, 1668048420], "v": "v0.6"}
{"i": [["[\"softmax_norm\", 12544, 49]", "cuda -keys=cuda,gpu -max_num_threads=1024 -model=unknown -thread_warp_size=32", [-1, 16, 64, 49152, 2147483647, 1024, 8, 32], "", 0, []], [[], [["FU", 2, [0, 1, 2]], ["SP", 2, 0, 30118144, [7], 1], ["AN", 2, 0, 5], ["AN", 2, 1, 6]]]], "r": [[0.00319437, 0.00319417, 0.00319346], 0, 21.8446, 1668048412], "v": "v0.6"}
{"i": [["[\"softmax_norm\", 12544, 49]", "cuda -keys=cuda,gpu -max_num_threads=1024 -model=unknown -thread_warp_size=32", [-1, 16, 64, 49152, 2147483647, 1024, 8, 32], "", 0, []], [[], [["FU", 2, [0, 1, 2]], ["SP", 2, 0, 30118144, [28], 1], ["AN", 2, 0, 5], ["AN", 2, 1, 6]]]], "r": [[0.000801295, 0.000801236, 0.000801132], 0, 14.473, 1668048405], "v": "v0.6"}
{"i": [["[\"softmax_norm\", 12544, 49]", "cuda -keys=cuda,gpu -max_num_threads=1024 -model=unknown -thread_warp_size=32", [-1, 16, 64, 49152, 2147483647, 1024, 8, 32], "", 0, []], [[], [["FU", 2, [0, 1]], ["SP", 2, 0, 614656, [64], 1], ["AN", 2, 0, 5], ["AN", 2, 1, 6]]]], "r": [[9.7541e-06, 9.75074e-06, 9.74861e-06], 0, 0.627186, 1668919650], "v": "v0.6"}
{"i": [["[\"softmax_norm\", 12544, 49]", "cuda -keys=cuda,gpu -max_num_threads=1024 -model=unknown -thread_warp_size=32", [-1, 16, 64, 49152, 2147483647, 1024, 8, 32], "", 0, []], [[], [["FU", 2, [0, 1]], ["SP", 2, 0, 614656, [32], 1], ["AN", 2, 0, 5], ["AN", 2, 1, 6]]]], "r": [[1.71352e-05, 1.71194e-05, 1.71206e-05], 0, 1.45638, 1668919651], "v": "v0.6"}
{"i": [["[\"softmax_norm\", 12544, 49]", "cuda -keys=cuda,gpu -max_num_threads=1024 -model=unknown -thread_warp_size=32", [-1, 16, 64, 49152, 2147483647, 1024, 8, 32], "", 0, []], [[], [["FU", 2, [0, 1]], ["SP", 2, 0, 614656, [4], 1], ["AN", 2, 0, 5], ["AN", 2, 1, 6]]]], "r": [[0.000116707, 0.000116707, 0.000116718], 0, 2.71447, 1668919652], "v": "v0.6"}
{"i": [["[\"softmax_norm\", 12544, 49]", "cuda -keys=cuda,gpu -max_num_threads=1024 -model=unknown -thread_warp_size=32", [-1, 16, 64, 49152, 2147483647, 1024, 8, 32], "", 0, []], [[], [["FU", 2, [0, 1]], ["SP", 2, 0, 614656, [8], 1], ["AN", 2, 0, 5], ["AN", 2, 1, 6]]]], "r": [[5.97973e-05, 5.97969e-05, 5.97962e-05], 0, 1.00914, 1668919650], "v": "v0.6"}
{"i": [["[\"softmax_norm\", 12544, 49]", "cuda -keys=cuda,gpu -max_num_threads=1024 -model=unknown -thread_warp_size=32", [-1, 16, 64, 49152, 2147483647, 1024, 8, 32], "", 0, []], [[], [["FU", 2, [0, 1]], ["SP", 2, 0, 614656, [49], 1], ["AN", 2, 0, 5], ["AN", 2, 1, 6]]]], "r": [[1.19173e-05, 1.19009e-05, 1.19007e-05], 0, 1.8072, 1668919651], "v": "v0.6"}
{"i": [["[\"softmax_norm\", 12544, 49]", "cuda -keys=cuda,gpu -max_num_threads=1024 -model=unknown -thread_warp_size=32", [-1, 16, 64, 49152, 2147483647, 1024, 8, 32], "", 0, []], [[], [["FU", 2, [0, 1]], ["SP", 2, 0, 614656, [28], 1], ["AN", 2, 0, 5], ["AN", 2, 1, 6]]]], "r": [[1.91853e-05, 1.91793e-05, 1.91757e-05], 0, 3.13435, 1668919653], "v": "v0.6"}
{"i": [["[\"softmax_norm\", 12544, 49]", "cuda -keys=cuda,gpu -max_num_threads=1024 -model=unknown -thread_warp_size=32", [-1, 16, 64, 49152, 2147483647, 1024, 8, 32], "", 0, []], [[], [["FU", 2, [0, 1]], ["SP", 2, 0, 614656, [14], 1], ["AN", 2, 0, 5], ["AN", 2, 1, 6]]]], "r": [[3.53289e-05, 3.53234e-05, 3.53182e-05], 0, 2.19143, 1668919652], "v": "v0.6"}
{"i": [["[\"softmax_norm\", 12544, 49]", "cuda -keys=cuda,gpu -max_num_threads=1024 -model=unknown -thread_warp_size=32", [-1, 16, 64, 49152, 2147483647, 1024, 8, 32], "", 0, []], [[], [["FU", 2, [0, 1]], ["SP", 2, 0, 614656, [1], 1], ["AN", 2, 0, 5], ["AN", 2, 1, 6]]]], "r": [[0.00045834, 0.00045837, 0.000458299], 0, 3.45026, 1668919653], "v": "v0.6"}
{"i": [["[\"softmax_norm\", 12544, 49]", "cuda -keys=cuda,gpu -max_num_threads=1024 -model=unknown -thread_warp_size=32", [-1, 16, 64, 49152, 2147483647, 1024, 8, 32], "", 0, []], [[], [["FU", 2, [0, 1]], ["SP", 2, 0, 614656, [16], 1], ["AN", 2, 0, 5], ["AN", 2, 1, 6]]]], "r": [[3.12469e-05, 3.12434e-05, 3.12436e-05], 0, 4.54792, 1668919654], "v": "v0.6"}
{"i": [["[\"softmax_norm\", 12544, 49]", "cuda -keys=cuda,gpu -max_num_threads=1024 -model=unknown -thread_warp_size=32", [-1, 16, 64, 49152, 2147483647, 1024, 8, 32], "", 0, []], [[], [["FU", 2, [0, 1]], ["SP", 2, 0, 614656, [2], 1], ["AN", 2, 0, 5], ["AN", 2, 1, 6]]]], "r": [[0.000230618, 0.000230581, 0.000230584], 0, 5.02473, 1668919655], "v": "v0.6"}
{"i": [["[\"softmax_norm\", 12544, 49]", "cuda -keys=cuda,gpu -max_num_threads=1024 -model=unknown -thread_warp_size=32", [-1, 16, 64, 49152, 2147483647, 1024, 8, 32], "", 0, []], [[], [["FU", 2, [0, 1]], ["SP", 2, 0, 614656, [56], 1], ["AN", 2, 0, 5], ["AN", 2, 1, 6]]]], "r": [[1.08188e-05, 1.08079e-05, 1.08056e-05], 0, 3.81418, 1668919653], "v": "v0.6"}
{"i": [["[\"softmax_norm\", 12544, 49]", "cuda -keys=cuda,gpu -max_num_threads=1024 -model=unknown -thread_warp_size=32", [-1, 16, 64, 49152, 2147483647, 1024, 8, 32], "", 0, []], [[], [["FU", 2, [0, 1]], ["SP", 2, 0, 614656, [7], 1], ["AN", 2, 0, 5], ["AN", 2, 1, 6]]]], "r": [[6.78385e-05, 6.78308e-05, 6.78297e-05], 0, 4.16807, 1668919654], "v": "v0.6"}
