python/models/swin_transformer/kernel_configs/swin_transform_auto_tvm_fused_roll_reshape_qkv_matmul_tensorcore_1_16_16_512_3.log
{"input": ["cuda -keys=cuda,gpu -max_num_threads=1024 -thread_warp_size=32", "fused_roll_reshape_qkv_matmul.cuda", [["TENSOR", [1, 16, 16, 512], "float16"], ["TENSOR", [1536, 512], "float16"], 1, 16, 16, 512, 3], {}], "config": {"index": 11412, "code_hash": null, "entity": [["block_row_warps", "ot", 1], ["block_col_warps", "ot", 1], ["warp_row_tiles", "ot", 4], ["warp_col_tiles", "ot", 4], ["chunk", "ot", 1], ["offset", "ot", 8], ["offsetCS", "ot", 8], ["vec", "ot", 1], ["wmma_m", "ot", 8]]}, "result": [[7.6733598e-05], 0, 1.655308485031128, 1651931136.7959738], "version": 0.2, "tvm_version": "0.8.0"}
{"input": ["cuda -keys=cuda,gpu -max_num_threads=1024 -thread_warp_size=32", "fused_roll_reshape_qkv_matmul.cuda", [["TENSOR", [1, 16, 16, 512], "float16"], ["TENSOR", [1536, 512], "float16"], 1, 16, 16, 512, 3], {}], "config": {"index": 7551, "code_hash": null, "entity": [["block_row_warps", "ot", 1], ["block_col_warps", "ot", 1], ["warp_row_tiles", "ot", 4], ["warp_col_tiles", "ot", 1], ["chunk", "ot", 2], ["offset", "ot", 8], ["offsetCS", "ot", 8], ["vec", "ot", 2], ["wmma_m", "ot", 16]]}, "result": [[2.6823804e-05], 0, 1.256498098373413, 1651931137.4511218], "version": 0.2, "tvm_version": "0.8.0"}
{"input": ["cuda -keys=cuda,gpu -max_num_threads=1024 -thread_warp_size=32", "fused_roll_reshape_qkv_matmul.cuda", [["TENSOR", [1, 16, 16, 512], "float16"], ["TENSOR", [1536, 512], "float16"], 1, 16, 16, 512, 3], {}], "config": {"index": 5596, "code_hash": null, "entity": [["block_row_warps", "ot", 2], ["block_col_warps", "ot", 4], ["warp_row_tiles", "ot", 1], ["warp_col_tiles", "ot", 1], ["chunk", "ot", 2], ["offset", "ot", 8], ["offsetCS", "ot", 0], ["vec", "ot", 1], ["wmma_m", "ot", 16]]}, "result": [[2.7815193000000002e-05], 0, 1.169560432434082, 1651931139.4253666], "version": 0.2, "tvm_version": "0.8.0"}
{"input": ["cuda -keys=cuda,gpu -max_num_threads=1024 -thread_warp_size=32", "fused_roll_reshape_qkv_matmul.cuda", [["TENSOR", [1, 16, 16, 512], "float16"], ["TENSOR", [1536, 512], "float16"], 1, 16, 16, 512, 3], {}], "config": {"index": 4005, "code_hash": null, "entity": [["block_row_warps", "ot", 1], ["block_col_warps", "ot", 1], ["warp_row_tiles", "ot", 2], ["warp_col_tiles", "ot", 2], ["chunk", "ot", 2], ["offset", "ot", 0], ["offsetCS", "ot", 0], ["vec", "ot", 8], ["wmma_m", "ot", 32]]}, "result": [[3.869823e-05], 0, 1.503549337387085, 1651931140.3943775], "version": 0.2, "tvm_version": "0.8.0"}
{"input": ["cuda -keys=cuda,gpu -max_num_threads=1024 -thread_warp_size=32", "fused_roll_reshape_qkv_matmul.cuda", [["TENSOR", [1, 16, 16, 512], "float16"], ["TENSOR", [1536, 512], "float16"], 1, 16, 16, 512, 3], {}], "config": {"index": 14726, "code_hash": null, "entity": [["block_row_warps", "ot", 4], ["block_col_warps", "ot", 1], ["warp_row_tiles", "ot", 2], ["warp_col_tiles", "ot", 4], ["chunk", "ot", 2], ["offset", "ot", 8], ["offsetCS", "ot", 0], ["vec", "ot", 8], ["wmma_m", "ot", 8]]}, "result": [[2.2390935e-05], 0, 1.3232464790344238, 1651931142.1897624], "version": 0.2, "tvm_version": "0.8.0"}
{"input": ["cuda -keys=cuda,gpu -max_num_threads=1024 -thread_warp_size=32", "fused_roll_reshape_qkv_matmul.cuda", [["TENSOR", [1, 16, 16, 512], "float16"], ["TENSOR", [1536, 512], "float16"], 1, 16, 16, 512, 3], {}], "config": {"index": 13468, "code_hash": null, "entity": [["block_row_warps", "ot", 2], ["block_col_warps", "ot", 2], ["warp_row_tiles", "ot", 4], ["warp_col_tiles", "ot", 1], ["chunk", "ot", 4], ["offset", "ot", 8], ["offsetCS", "ot", 0], ["vec", "ot", 4], ["wmma_m", "ot", 8]]}, "result": [[2.2881193e-05], 0, 1.26985764503479, 1651931142.8952765], "version": 0.2, "tvm_version": "0.8.0"}
{"input": ["cuda -keys=cuda,gpu -max_num_threads=1024 -thread_warp_size=32", "fused_roll_reshape_qkv_matmul.cuda", [["TENSOR", [1, 16, 16, 512], "float16"], ["TENSOR", [1536, 512], "float16"], 1, 16, 16, 512, 3], {}], "config": {"index": 8340, "code_hash": null, "entity": [["block_row_warps", "ot", 1], ["block_col_warps", "ot", 4], ["warp_row_tiles", "ot", 4], ["warp_col_tiles", "ot", 4], ["chunk", "ot", 4], ["offset", "ot", 8], ["offsetCS", "ot", 0], ["vec", "ot", 4], ["wmma_m", "ot", 16]]}, "result": [[3.4931857999999995e-05], 0, 1.8751215934753418, 1651931145.114815], "version": 0.2, "tvm_version": "0.8.0"}
{"input": ["cuda -keys=cuda,gpu -max_num_threads=1024 -thread_warp_size=32", "fused_roll_reshape_qkv_matmul.cuda", [["TENSOR", [1, 16, 16, 512], "float16"], ["TENSOR", [1536, 512], "float16"], 1, 16, 16, 512, 3], {}], "config": {"index": 5939, "code_hash": null, "entity": [["block_row_warps", "ot", 4], ["block_col_warps", "ot", 4], ["warp_row_tiles", "ot", 4], ["warp_col_tiles", "ot", 1], ["chunk", "ot", 2], ["offset", "ot", 0], ["offsetCS", "ot", 8], ["vec", "ot", 1], ["wmma_m", "ot", 16]]}, "result": [[8.211687999999999e-05], 0, 1.40372896194458, 1651931145.825008], "version": 0.2, "tvm_version": "0.8.0"}
{"input": ["cuda -keys=cuda,gpu -max_num_threads=1024 -thread_warp_size=32", "fused_roll_reshape_qkv_matmul.cuda", [["TENSOR", [1, 16, 16, 512], "float16"], ["TENSOR", [1536, 512], "float16"], 1, 16, 16, 512, 3], {}], "config": {"index": 10056, "code_hash": null, "entity": [["block_row_warps", "ot", 1], ["block_col_warps", "ot", 2], ["warp_row_tiles", "ot", 2], ["warp_col_tiles", "ot", 1], ["chunk", "ot", 1], ["offset", "ot", 8], ["offsetCS", "ot", 8], ["vec", "ot", 8], ["wmma_m", "ot", 16]]}, "result": [[1.5449859e-05], 0, 1.2610998153686523, 1651931147.622665], "version": 0.2, "tvm_version": "0.8.0"}
{"input": ["cuda -keys=cuda,gpu -max_num_threads=1024 -thread_warp_size=32", "fused_roll_reshape_qkv_matmul.cuda", [["TENSOR", [1, 16, 16, 512], "float16"], ["TENSOR", [1536, 512], "float16"], 1, 16, 16, 512, 3], {}], "config": {"index": 5445, "code_hash": null, "entity": [["block_row_warps", "ot", 1], ["block_col_warps", "ot", 1], ["warp_row_tiles", "ot", 4], ["warp_col_tiles", "ot", 1], ["chunk", "ot", 8], ["offset", "ot", 0], ["offsetCS", "ot", 0], ["vec", "ot", 1], ["wmma_m", "ot", 16]]}, "result": [[8.1971659e-05], 0, 1.4904539585113525, 1651931149.4181068], "version": 0.2, "tvm_version": "0.8.0"}
{"input": ["cuda -keys=cuda,gpu -max_num_threads=1024 -thread_warp_size=32", "fused_roll_reshape_qkv_matmul.cuda", [["TENSOR", [1, 16, 16, 512], "float16"], ["TENSOR", [1536, 512], "float16"], 1, 16, 16, 512, 3], {}], "config": {"index": 7477, "code_hash": null, "entity": [["block_row_warps", "ot", 2], ["block_col_warps", "ot", 4], ["warp_row_tiles", "ot", 4], ["warp_col_tiles", "ot", 1], ["chunk", "ot", 1], ["offset", "ot", 8], ["offsetCS", "ot", 8], ["vec", "ot", 2], ["wmma_m", "ot", 16]]}, "result": [[1.9372208000000003e-05], 0, 1.1176414489746094, 1651931151.1321392], "version": 0.2, "tvm_version": "0.8.0"}
{"input": ["cuda -keys=cuda,gpu -max_num_threads=1024 -thread_warp_size=32", "fused_roll_reshape_qkv_matmul.cuda", [["TENSOR", [1, 16, 16, 512], "float16"], ["TENSOR", [1536, 512], "float16"], 1, 16, 16, 512, 3], {}], "config": {"index": 7627, "code_hash": null, "entity": [["block_row_warps", "ot", 2], ["block_col_warps", "ot", 2], ["warp_row_tiles", "ot", 2], ["warp_col_tiles", "ot", 1], ["chunk", "ot", 4], ["offset", "ot", 8], ["offsetCS", "ot", 8], ["vec", "ot", 2], ["wmma_m", "ot", 16]]}, "result": [[1.8928066e-05], 0, 1.4602892398834229, 1651931152.8483214], "version": 0.2, "tvm_version": "0.8.0"}
{"input": ["cuda -keys=cuda,gpu -max_num_threads=1024 -thread_warp_size=32", "fused_roll_reshape_qkv_matmul.cuda", [["TENSOR", [1, 16, 16, 512], "float16"], ["TENSOR", [1536, 512], "float16"], 1, 16, 16, 512, 3], {}], "config": {"index": 6618, "code_hash": null, "entity": [["block_row_warps", "ot", 1], ["block_col_warps", "ot", 2], ["warp_row_tiles", "ot", 1], ["warp_col_tiles", "ot", 4], ["chunk", "ot", 2], ["offset", "ot", 0], ["offsetCS", "ot", 0], ["vec", "ot", 2], ["wmma_m", "ot", 16]]}, "result": [[5.7613072e-05], 0, 1.4602315425872803, 1651931153.6820307], "version": 0.2, "tvm_version": "0.8.0"}
{"input": ["cuda -keys=cuda,gpu -max_num_threads=1024 -thread_warp_size=32", "fused_roll_reshape_qkv_matmul.cuda", [["TENSOR", [1, 16, 16, 512], "float16"], ["TENSOR", [1536, 512], "float16"], 1, 16, 16, 512, 3], {}], "config": {"index": 14878, "code_hash": null, "entity": [["block_row_warps", "ot", 2], ["block_col_warps", "ot", 1], ["warp_row_tiles", "ot", 1], ["warp_col_tiles", "ot", 4], ["chunk", "ot", 8], ["offset", "ot", 8], ["offsetCS", "ot", 0], ["vec", "ot", 8], ["wmma_m", "ot", 8]]}, "result": [[1.4028624e-05], 0, 1.617842435836792, 1651931155.1456444], "version": 0.2, "tvm_version": "0.8.0"}
{"input": ["cuda -keys=cuda,gpu -max_num_threads=1024 -thread_warp_size=32", "fused_roll_reshape_qkv_matmul.cuda", [["TENSOR", [1, 16, 16, 512], "float16"], ["TENSOR", [1536, 512], "float16"], 1, 16, 16, 512, 3], {}], "config": {"index": 11376, "code_hash": null, "entity": [["block_row_warps", "ot", 1], ["block_col_warps", "ot", 1], ["warp_row_tiles", "ot", 2], ["warp_col_tiles", "ot", 2], ["chunk", "ot", 1], ["offset", "ot", 8], ["offsetCS", "ot", 8], ["vec", "ot", 1], ["wmma_m", "ot", 8]]}, "result": [[4.2719609e-05], 0, 1.5213887691497803, 1651931155.8866215], "version": 0.2, "tvm_version": "0.8.0"}
{"input": ["cuda -keys=cuda,gpu -max_num_threads=1024 -thread_warp_size=32", "fused_roll_reshape_qkv_matmul.cuda", [["TENSOR", [1, 16, 16, 512], "float16"], ["TENSOR", [1536, 512], "float16"], 1, 16, 16, 512, 3], {}], "config": {"index": 13103, "code_hash": null, "entity": [["block_row_warps", "ot", 4], ["block_col_warps", "ot", 4], ["warp_row_tiles", "ot", 1], ["warp_col_tiles", "ot", 4], ["chunk", "ot", 2], ["offset", "ot", 0], ["offsetCS", "ot", 0], ["vec", "ot", 4], ["wmma_m", "ot", 8]]}, "result": [[7.2562922e-05], 0, 1.5128803253173828, 1651931157.5151062], "version": 0.2, "tvm_version": "0.8.0"}
{"input": ["cuda -keys=cuda,gpu -max_num_threads=1024 -thread_warp_size=32", "fused_roll_reshape_qkv_matmul.cuda", [["TENSOR", [1, 16, 16, 512], "float16"], ["TENSOR", [1536, 512], "float16"], 1, 16, 16, 512, 3], {}], "config": {"index": 9984, "code_hash": null, "entity": [["block_row_warps", "ot", 1], ["block_col_warps", "ot", 2], ["warp_row_tiles", "ot", 4], ["warp_col_tiles", "ot", 1], ["chunk", "ot", 8], ["offset", "ot", 0], ["offsetCS", "ot", 8], ["vec", "ot", 8], ["wmma_m", "ot", 16]]}, "result": [[3.942914300000001e-05], 0, 1.518263816833496, 1651931159.4615152], "version": 0.2, "tvm_version": "0.8.0"}
{"input": ["cuda -keys=cuda,gpu -max_num_threads=1024 -thread_warp_size=32", "fused_roll_reshape_qkv_matmul.cuda", [["TENSOR", [1, 16, 16, 512], "float16"], ["TENSOR", [1536, 512], "float16"], 1, 16, 16, 512, 3], {}], "config": {"index": 11062, "code_hash": null, "entity": [["block_row_warps", "ot", 2], ["block_col_warps", "ot", 1], ["warp_row_tiles", "ot", 4], ["warp_col_tiles", "ot", 2], ["chunk", "ot", 1], ["offset", "ot", 0], ["offsetCS", "ot", 8], ["vec", "ot", 1], ["wmma_m", "ot", 8]]}, "result": [[4.9996160999999994e-05], 0, 1.4924209117889404, 1651931160.1742313], "version": 0.2, "tvm_version": "0.8.0"}
{"input": ["cuda -keys=cuda,gpu -max_num_threads=1024 -thread_warp_size=32", "fused_roll_reshape_qkv_matmul.cuda", [["TENSOR", [1, 16, 16, 512], "float16"], ["TENSOR", [1536, 512], "float16"], 1, 16, 16, 512, 3], {}], "config": {"index": 4242, "code_hash": null, "entity": [["block_row_warps", "ot", 1], ["block_col_warps", "ot", 2], ["warp_row_tiles", "ot", 1], ["warp_col_tiles", "ot", 2], ["chunk", "ot", 1], ["offset", "ot", 8], ["offsetCS", "ot", 0], ["vec", "ot", 8], ["wmma_m", "ot", 32]]}, "result": [[2.870392e-05], 0, 1.5034403800964355, 1651936003.6000564], "version": 0.2, "tvm_version": "0.8.0"}
{"input": ["cuda -keys=cuda,gpu -max_num_threads=1024 -thread_warp_size=32", "fused_roll_reshape_qkv_matmul.cuda", [["TENSOR", [1, 16, 16, 512], "float16"], ["TENSOR", [1536, 512], "float16"], 1, 16, 16, 512, 3], {}], "config": {"index": 12238, "code_hash": null, "entity": [["block_row_warps", "ot", 2], ["block_col_warps", "ot", 4], ["warp_row_tiles", "ot", 1], ["warp_col_tiles", "ot", 1], ["chunk", "ot", 8], ["offset", "ot", 8], ["offsetCS", "ot", 0], ["vec", "ot", 2], ["wmma_m", "ot", 8]]}, "result": [[2.3949405999999998e-05], 0, 1.8123486042022705, 1651936004.3479402], "version": 0.2, "tvm_version": "0.8.0"}
{"input": ["cuda -keys=cuda,gpu -max_num_threads=1024 -thread_warp_size=32", "fused_roll_reshape_qkv_matmul.cuda", [["TENSOR", [1, 16, 16, 512], "float16"], ["TENSOR", [1536, 512], "float16"], 1, 16, 16, 512, 3], {}], "config": {"index": 3163, "code_hash": null, "entity": [["block_row_warps", "ot", 2], ["block_col_warps", "ot", 2], ["warp_row_tiles", "ot", 1], ["warp_col_tiles", "ot", 1], ["chunk", "ot", 8], ["offset", "ot", 8], ["offsetCS", "ot", 0], ["vec", "ot", 4], ["wmma_m", "ot", 32]]}, "result": [[2.354177e-05], 0, 1.4471991062164307, 1651936005.9695382], "version": 0.2, "tvm_version": "0.8.0"}
{"input": ["cuda -keys=cuda,gpu -max_num_threads=1024 -thread_warp_size=32", "fused_roll_reshape_qkv_matmul.cuda", [["TENSOR", [1, 16, 16, 512], "float16"], ["TENSOR", [1536, 512], "float16"], 1, 16, 16, 512, 3], {}], "config": {"index": 11136, "code_hash": null, "entity": [["block_row_warps", "ot", 1], ["block_col_warps", "ot", 2], ["warp_row_tiles", "ot", 2], ["warp_col_tiles", "ot", 2], ["chunk", "ot", 2], ["offset", "ot", 0], ["offsetCS", "ot", 8], ["vec", "ot", 1], ["wmma_m", "ot", 8]]}, "result": [[5.8232624e-05], 0, 2.246852397918701, 1651936006.8596258], "version": 0.2, "tvm_version": "0.8.0"}
{"input": ["cuda -keys=cuda,gpu -max_num_threads=1024 -thread_warp_size=32", "fused_roll_reshape_qkv_matmul.cuda", [["TENSOR", [1, 16, 16, 512], "float16"], ["TENSOR", [1536, 512], "float16"], 1, 16, 16, 512, 3], {}], "config": {"index": 5560, "code_hash": null, "entity": [["block_row_warps", "ot", 2], ["block_col_warps", "ot", 4], ["warp_row_tiles", "ot", 4], ["warp_col_tiles", "ot", 2], ["chunk", "ot", 1], ["offset", "ot", 8], ["offsetCS", "ot", 0], ["vec", "ot", 1], ["wmma_m", "ot", 16]]}, "result": [[3.2088418e-05], 0, 1.8999309539794922, 1651936008.6064725], "version": 0.2, "tvm_version": "0.8.0"}
{"input": ["cuda -keys=cuda,gpu -max_num_threads=1024 -thread_warp_size=32", "fused_roll_reshape_qkv_matmul.cuda", [["TENSOR", [1, 16, 16, 512], "float16"], ["TENSOR", [1536, 512], "float16"], 1, 16, 16, 512, 3], {}], "config": {"index": 13157, "code_hash": null, "entity": [["block_row_warps", "ot", 4], ["block_col_warps", "ot", 4], ["warp_row_tiles", "ot", 1], ["warp_col_tiles", "ot", 2], ["chunk", "ot", 4], ["offset", "ot", 0], ["offsetCS", "ot", 0], ["vec", "ot", 4], ["wmma_m", "ot", 8]]}, "result": [[8.938919300000001e-05], 0, 1.7797014713287354, 1651936010.7883763], "version": 0.2, "tvm_version": "0.8.0"}
{"input": ["cuda -keys=cuda,gpu -max_num_threads=1024 -thread_warp_size=32", "fused_roll_reshape_qkv_matmul.cuda", [["TENSOR", [1, 16, 16, 512], "float16"], ["TENSOR", [1536, 512], "float16"], 1, 16, 16, 512, 3], {}], "config": {"index": 4186, "code_hash": null, "entity": [["block_row_warps", "ot", 2], ["block_col_warps", "ot", 1], ["warp_row_tiles", "ot", 1], ["warp_col_tiles", "ot", 4], ["chunk", "ot", 8], ["offset", "ot", 0], ["offsetCS", "ot", 0], ["vec", "ot", 8], ["wmma_m", "ot", 32]]}, "result": [[1.8836344e-05], 0, 1.983142614364624, 1651936012.3295202], "version": 0.2, "tvm_version": "0.8.0"}
{"input": ["cuda -keys=cuda,gpu -max_num_threads=1024 -thread_warp_size=32", "fused_roll_reshape_qkv_matmul.cuda", [["TENSOR", [1, 16, 16, 512], "float16"], ["TENSOR", [1536, 512], "float16"], 1, 16, 16, 512, 3], {}], "config": {"index": 2950, "code_hash": null, "entity": [["block_row_warps", "ot", 2], ["block_col_warps", "ot", 4], ["warp_row_tiles", "ot", 1], ["warp_col_tiles", "ot", 2], ["chunk", "ot", 1], ["offset", "ot", 8], ["offsetCS", "ot", 0], ["vec", "ot", 4], ["wmma_m", "ot", 32]]}, "result": [[2.2993026e-05], 0, 1.6936218738555908, 1651936014.0615811], "version": 0.2, "tvm_version": "0.8.0"}
{"input": ["cuda -keys=cuda,gpu -max_num_threads=1024 -thread_warp_size=32", "fused_roll_reshape_qkv_matmul.cuda", [["TENSOR", [1, 16, 16, 512], "float16"], ["TENSOR", [1536, 512], "float16"], 1, 16, 16, 512, 3], {}], "config": {"index": 11218, "code_hash": null, "entity": [["block_row_warps", "ot", 2], ["block_col_warps", "ot", 2], ["warp_row_tiles", "ot", 2], ["warp_col_tiles", "ot", 2], ["chunk", "ot", 4], ["offset", "ot", 0], ["offsetCS", "ot", 8], ["vec", "ot", 1], ["wmma_m", "ot", 8]]}, "result": [[5.8657198e-05], 0, 1.9812555313110352, 1651936014.751795], "version": 0.2, "tvm_version": "0.8.0"}
{"input": ["cuda -keys=cuda,gpu -max_num_threads=1024 -thread_warp_size=32", "fused_roll_reshape_qkv_matmul.cuda", [["TENSOR", [1, 16, 16, 512], "float16"], ["TENSOR", [1536, 512], "float16"], 1, 16, 16, 512, 3], {}], "config": {"index": 1118, "code_hash": null, "entity": [["block_row_warps", "ot", 4], ["block_col_warps", "ot", 1], ["warp_row_tiles", "ot", 2], ["warp_col_tiles", "ot", 4], ["chunk", "ot", 2], ["offset", "ot", 8], ["offsetCS", "ot", 8], ["vec", "ot", 1], ["wmma_m", "ot", 32]]}, "result": [[5.8505415e-05], 0, 1.785386562347412, 1651936016.7569313], "version": 0.2, "tvm_version": "0.8.0"}
{"input": ["cuda -keys=cuda,gpu -max_num_threads=1024 -thread_warp_size=32", "fused_roll_reshape_qkv_matmul.cuda", [["TENSOR", [1, 16, 16, 512], "float16"], ["TENSOR", [1536, 512], "float16"], 1, 16, 16, 512, 3], {}], "config": {"index": 5941, "code_hash": null, "entity": [["block_row_warps", "ot", 2], ["block_col_warps", "ot", 1], ["warp_row_tiles", "ot", 1], ["warp_col_tiles", "ot", 2], ["chunk", "ot", 2], ["offset", "ot", 0], ["offsetCS", "ot", 8], ["vec", "ot", 1], ["wmma_m", "ot", 16]]}, "result": [[2.3037863999999997e-05], 0, 1.9878768920898438, 1651936018.483868], "version": 0.2, "tvm_version": "0.8.0"}
{"input": ["cuda -keys=cuda,gpu -max_num_threads=1024 -thread_warp_size=32", "fused_roll_reshape_qkv_matmul.cuda", [["TENSOR", [1, 16, 16, 512], "float16"], ["TENSOR", [1536, 512], "float16"], 1, 16, 16, 512, 3], {}], "config": {"index": 8327, "code_hash": null, "entity": [["block_row_warps", "ot", 4], ["block_col_warps", "ot", 1], ["warp_row_tiles", "ot", 2], ["warp_col_tiles", "ot", 4], ["chunk", "ot", 4], ["offset", "ot", 8], ["offsetCS", "ot", 0], ["vec", "ot", 4], ["wmma_m", "ot", 16]]}, "result": [[2.7253793e-05], 0, 2.026411294937134, 1651936020.2230165], "version": 0.2, "tvm_version": "0.8.0"}
{"input": ["cuda -keys=cuda,gpu -max_num_threads=1024 -thread_warp_size=32", "fused_roll_reshape_qkv_matmul.cuda", [["TENSOR", [1, 16, 16, 512], "float16"], ["TENSOR", [1536, 512], "float16"], 1, 16, 16, 512, 3], {}], "config": {"index": 6168, "code_hash": null, "entity": [["block_row_warps", "ot", 1], ["block_col_warps", "ot", 2], ["warp_row_tiles", "ot", 2], ["warp_col_tiles", "ot", 1], ["chunk", "ot", 1], ["offset", "ot", 8], ["offsetCS", "ot", 8], ["vec", "ot", 1], ["wmma_m", "ot", 16]]}, "result": [[3.90335e-05], 0, 1.7499895095825195, 1651936020.883519], "version": 0.2, "tvm_version": "0.8.0"}
{"input": ["cuda -keys=cuda,gpu -max_num_threads=1024 -thread_warp_size=32", "fused_roll_reshape_qkv_matmul.cuda", [["TENSOR", [1, 16, 16, 512], "float16"], ["TENSOR", [1536, 512], "float16"], 1, 16, 16, 512, 3], {}], "config": {"index": 6021, "code_hash": null, "entity": [["block_row_warps", "ot", 1], ["block_col_warps", "ot", 1], ["warp_row_tiles", "ot", 1], ["warp_col_tiles", "ot", 2], ["chunk", "ot", 4], ["offset", "ot", 0], ["offsetCS", "ot", 8], ["vec", "ot", 1], ["wmma_m", "ot", 16]]}, "result": [[5.0560983999999995e-05], 0, 2.0402042865753174, 1651936021.7845497], "version": 0.2, "tvm_version": "0.8.0"}
{"input": ["cuda -keys=cuda,gpu -max_num_threads=1024 -thread_warp_size=32", "fused_roll_reshape_qkv_matmul.cuda", [["TENSOR", [1, 16, 16, 512], "float16"], ["TENSOR", [1536, 512], "float16"], 1, 16, 16, 512, 3], {}], "config": {"index": 9054, "code_hash": null, "entity": [["block_row_warps", "ot", 1], ["block_col_warps", "ot", 1], ["warp_row_tiles", "ot", 2], ["warp_col_tiles", "ot", 4], ["chunk", "ot", 8], ["offset", "ot", 8], ["offsetCS", "ot", 8], ["vec", "ot", 4], ["wmma_m", "ot", 16]]}, "result": [[1.2563874e-05], 0, 2.095635414123535, 1651936022.5062814], "version": 0.2, "tvm_version": "0.8.0"}
{"input": ["cuda -keys=cuda,gpu -max_num_threads=1024 -thread_warp_size=32", "fused_roll_reshape_qkv_matmul.cuda", [["TENSOR", [1, 16, 16, 512], "float16"], ["TENSOR", [1536, 512], "float16"], 1, 16, 16, 512, 3], {}], "config": {"index": 6655, "code_hash": null, "entity": [["block_row_warps", "ot", 2], ["block_col_warps", "ot", 2], ["warp_row_tiles", "ot", 2], ["warp_col_tiles", "ot", 1], ["chunk", "ot", 4], ["offset", "ot", 0], ["offsetCS", "ot", 0], ["vec", "ot", 2], ["wmma_m", "ot", 16]]}, "result": [[4.5577874000000005e-05], 0, 1.9854950904846191, 1651936024.0545816], "version": 0.2, "tvm_version": "0.8.0"}
{"input": ["cuda -keys=cuda,gpu -max_num_threads=1024 -thread_warp_size=32", "fused_roll_reshape_qkv_matmul.cuda", [["TENSOR", [1, 16, 16, 512], "float16"], ["TENSOR", [1536, 512], "float16"], 1, 16, 16, 512, 3], {}], "config": {"index": 12781, "code_hash": null, "entity": [["block_row_warps", "ot", 2], ["block_col_warps", "ot", 1], ["warp_row_tiles", "ot", 2], ["warp_col_tiles", "ot", 4], ["chunk", "ot", 2], ["offset", "ot", 8], ["offsetCS", "ot", 8], ["vec", "ot", 2], ["wmma_m", "ot", 8]]}, "result": [[4.1952534e-05], 0, 1.7869086265563965, 1651936024.8761053], "version": 0.2, "tvm_version": "0.8.0"}
{"input": ["cuda -keys=cuda,gpu -max_num_threads=1024 -thread_warp_size=32", "fused_roll_reshape_qkv_matmul.cuda", [["TENSOR", [1, 16, 16, 512], "float16"], ["TENSOR", [1536, 512], "float16"], 1, 16, 16, 512, 3], {}], "config": {"index": 14126, "code_hash": null, "entity": [["block_row_warps", "ot", 4], ["block_col_warps", "ot", 2], ["warp_row_tiles", "ot", 1], ["warp_col_tiles", "ot", 2], ["chunk", "ot", 4], ["offset", "ot", 8], ["offsetCS", "ot", 8], ["vec", "ot", 4], ["wmma_m", "ot", 8]]}, "result": [[2.3025527e-05], 0, 2.006673574447632, 1651936026.6623802], "version": 0.2, "tvm_version": "0.8.0"}
{"input": ["cuda -keys=cuda,gpu -max_num_threads=1024 -thread_warp_size=32", "fused_roll_reshape_qkv_matmul.cuda", [["TENSOR", [1, 16, 16, 512], "float16"], ["TENSOR", [1536, 512], "float16"], 1, 16, 16, 512, 3], {}], "config": {"index": 12345, "code_hash": null, "entity": [["block_row_warps", "ot", 1], ["block_col_warps", "ot", 4], ["warp_row_tiles", "ot", 1], ["warp_col_tiles", "ot", 2], ["chunk", "ot", 1], ["offset", "ot", 0], ["offsetCS", "ot", 8], ["vec", "ot", 2], ["wmma_m", "ot", 8]]}, "result": [[7.158737299999999e-05], 0, 1.9400670528411865, 1651936027.623215], "version": 0.2, "tvm_version": "0.8.0"}
{"input": ["cuda -keys=cuda,gpu -max_num_threads=1024 -thread_warp_size=32", "fused_roll_reshape_qkv_matmul.cuda", [["TENSOR", [1, 16, 16, 512], "float16"], ["TENSOR", [1536, 512], "float16"], 1, 16, 16, 512, 3], {}], "config": {"index": 699, "code_hash": null, "entity": [["block_row_warps", "ot", 1], ["block_col_warps", "ot", 4], ["warp_row_tiles", "ot", 4], ["warp_col_tiles", "ot", 2], ["chunk", "ot", 1], ["offset", "ot", 0], ["offsetCS", "ot", 8], ["vec", "ot", 1], ["wmma_m", "ot", 32]]}, "result": [[3.4233811e-05], 0, 1.6085071563720703, 1651936029.2030008], "version": 0.2, "tvm_version": "0.8.0"}
{"input": ["cuda -keys=cuda,gpu -max_num_threads=1024 -thread_warp_size=32", "fused_roll_reshape_qkv_matmul.cuda", [["TENSOR", [1, 16, 16, 512], "float16"], ["TENSOR", [1536, 512], "float16"], 1, 16, 16, 512, 3], {}], "config": {"index": 2539, "code_hash": null, "entity": [["block_row_warps", "ot", 2], ["block_col_warps", "ot", 1], ["warp_row_tiles", "ot", 1], ["warp_col_tiles", "ot", 2], ["chunk", "ot", 8], ["offset", "ot", 8], ["offsetCS", "ot", 8], ["vec", "ot", 2], ["wmma_m", "ot", 32]]}, "result": [[1.1974634e-05], 0, 1.7301218509674072, 1651936029.9156365], "version": 0.2, "tvm_version": "0.8.0"}
{"input": ["cuda -keys=cuda,gpu -max_num_threads=1024 -thread_warp_size=32", "fused_roll_reshape_qkv_matmul.cuda", [["TENSOR", [1, 16, 16, 512], "float16"], ["TENSOR", [1536, 512], "float16"], 1, 16, 16, 512, 3], {}], "config": {"index": 3462, "code_hash": null, "entity": [["block_row_warps", "ot", 1], ["block_col_warps", "ot", 4], ["warp_row_tiles", "ot", 1], ["warp_col_tiles", "ot", 4], ["chunk", "ot", 4], ["offset", "ot", 0], ["offsetCS", "ot", 8], ["vec", "ot", 4], ["wmma_m", "ot", 32]]}, "result": [[2.0633682e-05], 0, 1.7083532810211182, 1651936030.6121387], "version": 0.2, "tvm_version": "0.8.0"}
{"input": ["cuda -keys=cuda,gpu -max_num_threads=1024 -thread_warp_size=32", "fused_roll_reshape_qkv_matmul.cuda", [["TENSOR", [1, 16, 16, 512], "float16"], ["TENSOR", [1536, 512], "float16"], 1, 16, 16, 512, 3], {}], "config": {"index": 13819, "code_hash": null, "entity": [["block_row_warps", "ot", 2], ["block_col_warps", "ot", 2], ["warp_row_tiles", "ot", 4], ["warp_col_tiles", "ot", 2], ["chunk", "ot", 4], ["offset", "ot", 0], ["offsetCS", "ot", 8], ["vec", "ot", 4], ["wmma_m", "ot", 8]]}, "result": [[4.5651379e-05], 0, 2.0853993892669678, 1651936031.5258243], "version": 0.2, "tvm_version": "0.8.0"}
{"input": ["cuda -keys=cuda,gpu -max_num_threads=1024 -thread_warp_size=32", "fused_roll_reshape_qkv_matmul.cuda", [["TENSOR", [1, 16, 16, 512], "float16"], ["TENSOR", [1536, 512], "float16"], 1, 16, 16, 512, 3], {}], "config": {"index": 3507, "code_hash": null, "entity": [["block_row_warps", "ot", 1], ["block_col_warps", "ot", 4], ["warp_row_tiles", "ot", 4], ["warp_col_tiles", "ot", 1], ["chunk", "ot", 8], ["offset", "ot", 0], ["offsetCS", "ot", 8], ["vec", "ot", 4], ["wmma_m", "ot", 32]]}, "result": [[6.2021207e-05], 0, 1.995103359222412, 1651936033.3039744], "version": 0.2, "tvm_version": "0.8.0"}
{"input": ["cuda -keys=cuda,gpu -max_num_threads=1024 -thread_warp_size=32", "fused_roll_reshape_qkv_matmul.cuda", [["TENSOR", [1, 16, 16, 512], "float16"], ["TENSOR", [1536, 512], "float16"], 1, 16, 16, 512, 3], {}], "config": {"index": 2431, "code_hash": null, "entity": [["block_row_warps", "ot", 2], ["block_col_warps", "ot", 1], ["warp_row_tiles", "ot", 1], ["warp_col_tiles", "ot", 1], ["chunk", "ot", 4], ["offset", "ot", 8], ["offsetCS", "ot", 8], ["vec", "ot", 2], ["wmma_m", "ot", 32]]}, "result": [[2.0238827e-05], 0, 1.7059659957885742, 1651936033.9592135], "version": 0.2, "tvm_version": "0.8.0"}
{"input": ["cuda -keys=cuda,gpu -max_num_threads=1024 -thread_warp_size=32", "fused_roll_reshape_qkv_matmul.cuda", [["TENSOR", [1, 16, 16, 512], "float16"], ["TENSOR", [1536, 512], "float16"], 1, 16, 16, 512, 3], {}], "config": {"index": 214, "code_hash": null, "entity": [["block_row_warps", "ot", 2], ["block_col_warps", "ot", 4], ["warp_row_tiles", "ot", 4], ["warp_col_tiles", "ot", 2], ["chunk", "ot", 4], ["offset", "ot", 0], ["offsetCS", "ot", 0], ["vec", "ot", 1], ["wmma_m", "ot", 32]]}, "result": [[0.000125016766], 0, 1.9567127227783203, 1651936035.787898], "version": 0.2, "tvm_version": "0.8.0"}
{"input": ["cuda -keys=cuda,gpu -max_num_threads=1024 -thread_warp_size=32", "fused_roll_reshape_qkv_matmul.cuda", [["TENSOR", [1, 16, 16, 512], "float16"], ["TENSOR", [1536, 512], "float16"], 1, 16, 16, 512, 3], {}], "config": {"index": 1896, "code_hash": null, "entity": [["block_row_warps", "ot", 1], ["block_col_warps", "ot", 4], ["warp_row_tiles", "ot", 1], ["warp_col_tiles", "ot", 2], ["chunk", "ot", 8], ["offset", "ot", 8], ["offsetCS", "ot", 0], ["vec", "ot", 2], ["wmma_m", "ot", 32]]}, "result": [[1.0694457e-05], 0, 1.5794603824615479, 1651936036.477775], "version": 0.2, "tvm_version": "0.8.0"}
{"input": ["cuda -keys=cuda,gpu -max_num_threads=1024 -thread_warp_size=32", "fused_roll_reshape_qkv_matmul.cuda", [["TENSOR", [1, 16, 16, 512], "float16"], ["TENSOR", [1536, 512], "float16"], 1, 16, 16, 512, 3], {}], "config": {"index": 15020, "code_hash": null, "entity": [["block_row_warps", "ot", 4], ["block_col_warps", "ot", 4], ["warp_row_tiles", "ot", 1], ["warp_col_tiles", "ot", 2], ["chunk", "ot", 2], ["offset", "ot", 0], ["offsetCS", "ot", 8], ["vec", "ot", 8], ["wmma_m", "ot", 8]]}, "result": [[8.6149899e-05], 0, 1.840559720993042, 1651936038.1181052], "version": 0.2, "tvm_version": "0.8.0"}
{"input": ["cuda -keys=cuda,gpu -max_num_threads=1024 -thread_warp_size=32", "fused_roll_reshape_qkv_matmul.cuda", [["TENSOR", [1, 16, 16, 512], "float16"], ["TENSOR", [1536, 512], "float16"], 1, 16, 16, 512, 3], {}], "config": {"index": 14184, "code_hash": null, "entity": [["block_row_warps", "ot", 1], ["block_col_warps", "ot", 1], ["warp_row_tiles", "ot", 2], ["warp_col_tiles", "ot", 1], ["chunk", "ot", 8], ["offset", "ot", 8], ["offsetCS", "ot", 8], ["vec", "ot", 4], ["wmma_m", "ot", 8]]}, "result": [[1.2808944e-05], 0, 1.6869993209838867, 1651936038.830593], "version": 0.2, "tvm_version": "0.8.0"}
{"input": ["cuda -keys=cuda,gpu -max_num_threads=1024 -thread_warp_size=32", "fused_roll_reshape_qkv_matmul.cuda", [["TENSOR", [1, 16, 16, 512], "float16"], ["TENSOR", [1536, 512], "float16"], 1, 16, 16, 512, 3], {}], "config": {"index": 15485, "code_hash": null, "entity": [["block_row_warps", "ot", 4], ["block_col_warps", "ot", 2], ["warp_row_tiles", "ot", 2], ["warp_col_tiles", "ot", 1], ["chunk", "ot", 8], ["offset", "ot", 8], ["offsetCS", "ot", 8], ["vec", "ot", 8], ["wmma_m", "ot", 8]]}, "result": [[1.7465715999999998e-05], 0, 1.563628911972046, 1651936040.5344434], "version": 0.2, "tvm_version": "0.8.0"}
{"input": ["cuda -keys=cuda,gpu -max_num_threads=1024 -thread_warp_size=32", "fused_roll_reshape_qkv_matmul.cuda", [["TENSOR", [1, 16, 16, 512], "float16"], ["TENSOR", [1536, 512], "float16"], 1, 16, 16, 512, 3], {}], "config": {"index": 4018, "code_hash": null, "entity": [["block_row_warps", "ot", 2], ["block_col_warps", "ot", 2], ["warp_row_tiles", "ot", 4], ["warp_col_tiles", "ot", 2], ["chunk", "ot", 2], ["offset", "ot", 0], ["offsetCS", "ot", 0], ["vec", "ot", 8], ["wmma_m", "ot", 32]]}, "result": [[4.9978091000000004e-05], 0, 1.660069465637207, 1651936041.4659915], "version": 0.2, "tvm_version": "0.8.0"}
{"input": ["cuda -keys=cuda,gpu -max_num_threads=1024 -thread_warp_size=32", "fused_roll_reshape_qkv_matmul.cuda", [["TENSOR", [1, 16, 16, 512], "float16"], ["TENSOR", [1536, 512], "float16"], 1, 16, 16, 512, 3], {}], "config": {"index": 10867, "code_hash": null, "entity": [["block_row_warps", "ot", 2], ["block_col_warps", "ot", 2], ["warp_row_tiles", "ot", 2], ["warp_col_tiles", "ot", 1], ["chunk", "ot", 4], ["offset", "ot", 8], ["offsetCS", "ot", 0], ["vec", "ot", 1], ["wmma_m", "ot", 8]]}, "result": [[1.7957771e-05], 0, 1.5454957485198975, 1651936043.0171807], "version": 0.2, "tvm_version": "0.8.0"}
{"input": ["cuda -keys=cuda,gpu -max_num_threads=1024 -thread_warp_size=32", "fused_roll_reshape_qkv_matmul.cuda", [["TENSOR", [1, 16, 16, 512], "float16"], ["TENSOR", [1536, 512], "float16"], 1, 16, 16, 512, 3], {}], "config": {"index": 6372, "code_hash": null, "entity": [["block_row_warps", "ot", 1], ["block_col_warps", "ot", 1], ["warp_row_tiles", "ot", 1], ["warp_col_tiles", "ot", 4], ["chunk", "ot", 4], ["offset", "ot", 8], ["offsetCS", "ot", 8], ["vec", "ot", 1], ["wmma_m", "ot", 16]]}, "result": [[7.271458900000001e-05], 0, 1.7803716659545898, 1651936044.8240414], "version": 0.2, "tvm_version": "0.8.0"}
{"input": ["cuda -keys=cuda,gpu -max_num_threads=1024 -thread_warp_size=32", "fused_roll_reshape_qkv_matmul.cuda", [["TENSOR", [1, 16, 16, 512], "float16"], ["TENSOR", [1536, 512], "float16"], 1, 16, 16, 512, 3], {}], "config": {"index": 7147, "code_hash": null, "entity": [["block_row_warps", "ot", 2], ["block_col_warps", "ot", 1], ["warp_row_tiles", "ot", 4], ["warp_col_tiles", "ot", 1], ["chunk", "ot", 1], ["offset", "ot", 0], ["offsetCS", "ot", 8], ["vec", "ot", 2], ["wmma_m", "ot", 16]]}, "result": [[4.1994449000000006e-05], 0, 1.2841176986694336, 1651936046.3994496], "version": 0.2, "tvm_version": "0.8.0"}
{"input": ["cuda -keys=cuda,gpu -max_num_threads=1024 -thread_warp_size=32", "fused_roll_reshape_qkv_matmul.cuda", [["TENSOR", [1, 16, 16, 512], "float16"], ["TENSOR", [1536, 512], "float16"], 1, 16, 16, 512, 3], {}], "config": {"index": 11347, "code_hash": null, "entity": [["block_row_warps", "ot", 2], ["block_col_warps", "ot", 4], ["warp_row_tiles", "ot", 1], ["warp_col_tiles", "ot", 1], ["chunk", "ot", 1], ["offset", "ot", 8], ["offsetCS", "ot", 8], ["vec", "ot", 1], ["wmma_m", "ot", 8]]}, "result": [[3.8989338999999996e-05], 0, 1.3058505058288574, 1651936049.1179638], "version": 0.2, "tvm_version": "0.8.0"}
{"input": ["cuda -keys=cuda,gpu -max_num_threads=1024 -thread_warp_size=32", "fused_roll_reshape_qkv_matmul.cuda", [["TENSOR", [1, 16, 16, 512], "float16"], ["TENSOR", [1536, 512], "float16"], 1, 16, 16, 512, 3], {}], "config": {"index": 10389, "code_hash": null, "entity": [["block_row_warps", "ot", 1], ["block_col_warps", "ot", 2], ["warp_row_tiles", "ot", 4], ["warp_col_tiles", "ot", 1], ["chunk", "ot", 1], ["offset", "ot", 0], ["offsetCS", "ot", 0], ["vec", "ot", 1], ["wmma_m", "ot", 8]]}, "result": [[3.2840663e-05], 0, 1.7852015495300293, 1651936050.164315], "version": 0.2, "tvm_version": "0.8.0"}
{"input": ["cuda -keys=cuda,gpu -max_num_threads=1024 -thread_warp_size=32", "fused_roll_reshape_qkv_matmul.cuda", [["TENSOR", [1, 16, 16, 512], "float16"], ["TENSOR", [1536, 512], "float16"], 1, 16, 16, 512, 3], {}], "config": {"index": 7727, "code_hash": null, "entity": [["block_row_warps", "ot", 4], ["block_col_warps", "ot", 2], ["warp_row_tiles", "ot", 1], ["warp_col_tiles", "ot", 2], ["chunk", "ot", 8], ["offset", "ot", 8], ["offsetCS", "ot", 8], ["vec", "ot", 2], ["wmma_m", "ot", 16]]}, "result": [[1.1558948e-05], 0, 1.3005459308624268, 1651936051.7808154], "version": 0.2, "tvm_version": "0.8.0"}
{"input": ["cuda -keys=cuda,gpu -max_num_threads=1024 -thread_warp_size=32", "fused_roll_reshape_qkv_matmul.cuda", [["TENSOR", [1, 16, 16, 512], "float16"], ["TENSOR", [1536, 512], "float16"], 1, 16, 16, 512, 3], {}], "config": {"index": 139, "code_hash": null, "entity": [["block_row_warps", "ot", 2], ["block_col_warps", "ot", 2], ["warp_row_tiles", "ot", 1], ["warp_col_tiles", "ot", 4], ["chunk", "ot", 2], ["offset", "ot", 0], ["offsetCS", "ot", 0], ["vec", "ot", 1], ["wmma_m", "ot", 32]]}, "result": [[4.5055754000000004e-05], 0, 1.4124350547790527, 1651936052.4997985], "version": 0.2, "tvm_version": "0.8.0"}
{"input": ["cuda -keys=cuda,gpu -max_num_threads=1024 -thread_warp_size=32", "fused_roll_reshape_qkv_matmul.cuda", [["TENSOR", [1, 16, 16, 512], "float16"], ["TENSOR", [1536, 512], "float16"], 1, 16, 16, 512, 3], {}], "config": {"index": 10067, "code_hash": null, "entity": [["block_row_warps", "ot", 4], ["block_col_warps", "ot", 2], ["warp_row_tiles", "ot", 4], ["warp_col_tiles", "ot", 1], ["chunk", "ot", 1], ["offset", "ot", 8], ["offsetCS", "ot", 8], ["vec", "ot", 8], ["wmma_m", "ot", 16]]}, "result": [[5.8534702e-05], 0, 1.481299877166748, 1651936055.7935615], "version": 0.2, "tvm_version": "0.8.0"}
{"input": ["cuda -keys=cuda,gpu -max_num_threads=1024 -thread_warp_size=32", "fused_roll_reshape_qkv_matmul.cuda", [["TENSOR", [1, 16, 16, 512], "float16"], ["TENSOR", [1536, 512], "float16"], 1, 16, 16, 512, 3], {}], "config": {"index": 14915, "code_hash": null, "entity": [["block_row_warps", "ot", 4], ["block_col_warps", "ot", 1], ["warp_row_tiles", "ot", 2], ["warp_col_tiles", "ot", 1], ["chunk", "ot", 1], ["offset", "ot", 0], ["offsetCS", "ot", 8], ["vec", "ot", 8], ["wmma_m", "ot", 8]]}, "result": [[3.1406603e-05], 0, 1.6716415882110596, 1651936056.525381], "version": 0.2, "tvm_version": "0.8.0"}
{"input": ["cuda -keys=cuda,gpu -max_num_threads=1024 -thread_warp_size=32", "fused_roll_reshape_qkv_matmul.cuda", [["TENSOR", [1, 16, 16, 512], "float16"], ["TENSOR", [1536, 512], "float16"], 1, 16, 16, 512, 3], {}], "config": {"index": 4895, "code_hash": null, "entity": [["block_row_warps", "ot", 4], ["block_col_warps", "ot", 4], ["warp_row_tiles", "ot", 1], ["warp_col_tiles", "ot", 2], ["chunk", "ot", 1], ["offset", "ot", 8], ["offsetCS", "ot", 8], ["vec", "ot", 8], ["wmma_m", "ot", 32]]}, "result": [[8.0081464e-05], 0, 1.5514473915100098, 1651936058.2661517], "version": 0.2, "tvm_version": "0.8.0"}
{"input": ["cuda -keys=cuda,gpu -max_num_threads=1024 -thread_warp_size=32", "fused_roll_reshape_qkv_matmul.cuda", [["TENSOR", [1, 16, 16, 512], "float16"], ["TENSOR", [1536, 512], "float16"], 1, 16, 16, 512, 3], {}], "config": {"index": 4702, "code_hash": null, "entity": [["block_row_warps", "ot", 2], ["block_col_warps", "ot", 2], ["warp_row_tiles", "ot", 1], ["warp_col_tiles", "ot", 1], ["chunk", "ot", 4], ["offset", "ot", 0], ["offsetCS", "ot", 8], ["vec", "ot", 8], ["wmma_m", "ot", 32]]}, "result": [[3.737421e-05], 0, 1.7170202732086182, 1651936059.2695546], "version": 0.2, "tvm_version": "0.8.0"}
{"input": ["cuda -keys=cuda,gpu -max_num_threads=1024 -thread_warp_size=32", "fused_roll_reshape_qkv_matmul.cuda", [["TENSOR", [1, 16, 16, 512], "float16"], ["TENSOR", [1536, 512], "float16"], 1, 16, 16, 512, 3], {}], "config": {"index": 4166, "code_hash": null, "entity": [["block_row_warps", "ot", 4], ["block_col_warps", "ot", 4], ["warp_row_tiles", "ot", 1], ["warp_col_tiles", "ot", 2], ["chunk", "ot", 8], ["offset", "ot", 0], ["offsetCS", "ot", 0], ["vec", "ot", 8], ["wmma_m", "ot", 32]]}, "result": [[4.3065344e-05], 0, 1.435256004333496, 1651936060.9806013], "version": 0.2, "tvm_version": "0.8.0"}
{"input": ["cuda -keys=cuda,gpu -max_num_threads=1024 -thread_warp_size=32", "fused_roll_reshape_qkv_matmul.cuda", [["TENSOR", [1, 16, 16, 512], "float16"], ["TENSOR", [1536, 512], "float16"], 1, 16, 16, 512, 3], {}], "config": {"index": 7961, "code_hash": null, "entity": [["block_row_warps", "ot", 4], ["block_col_warps", "ot", 2], ["warp_row_tiles", "ot", 4], ["warp_col_tiles", "ot", 1], ["chunk", "ot", 4], ["offset", "ot", 0], ["offsetCS", "ot", 0], ["vec", "ot", 4], ["wmma_m", "ot", 16]]}, "result": [[4.0167599e-05], 0, 1.5755901336669922, 1651936061.89521], "version": 0.2, "tvm_version": "0.8.0"}
{"input": ["cuda -keys=cuda,gpu -max_num_threads=1024 -thread_warp_size=32", "fused_roll_reshape_qkv_matmul.cuda", [["TENSOR", [1, 16, 16, 512], "float16"], ["TENSOR", [1536, 512], "float16"], 1, 16, 16, 512, 3], {}], "config": {"index": 11460, "code_hash": null, "entity": [["block_row_warps", "ot", 1], ["block_col_warps", "ot", 2], ["warp_row_tiles", "ot", 2], ["warp_col_tiles", "ot", 2], ["chunk", "ot", 2], ["offset", "ot", 8], ["offsetCS", "ot", 8], ["vec", "ot", 1], ["wmma_m", "ot", 8]]}, "result": [[4.0501992e-05], 0, 1.8394458293914795, 1651936063.786188], "version": 0.2, "tvm_version": "0.8.0"}
{"input": ["cuda -keys=cuda,gpu -max_num_threads=1024 -thread_warp_size=32", "fused_roll_reshape_qkv_matmul.cuda", [["TENSOR", [1, 16, 16, 512], "float16"], ["TENSOR", [1536, 512], "float16"], 1, 16, 16, 512, 3], {}], "config": {"index": 9503, "code_hash": null, "entity": [["block_row_warps", "ot", 4], ["block_col_warps", "ot", 4], ["warp_row_tiles", "ot", 4], ["warp_col_tiles", "ot", 1], ["chunk", "ot", 2], ["offset", "ot", 8], ["offsetCS", "ot", 0], ["vec", "ot", 8], ["wmma_m", "ot", 16]]}, "result": [[4.9261554e-05], 0, 1.5210719108581543, 1651936065.7066195], "version": 0.2, "tvm_version": "0.8.0"}
{"input": ["cuda -keys=cuda,gpu -max_num_threads=1024 -thread_warp_size=32", "fused_roll_reshape_qkv_matmul.cuda", [["TENSOR", [1, 16, 16, 512], "float16"], ["TENSOR", [1536, 512], "float16"], 1, 16, 16, 512, 3], {}], "config": {"index": 3912, "code_hash": null, "entity": [["block_row_warps", "ot", 1], ["block_col_warps", "ot", 4], ["warp_row_tiles", "ot", 4], ["warp_col_tiles", "ot", 1], ["chunk", "ot", 1], ["offset", "ot", 0], ["offsetCS", "ot", 0], ["vec", "ot", 8], ["wmma_m", "ot", 32]]}, "result": [[3.4706535000000006e-05], 0, 1.5015976428985596, 1651936067.2754283], "version": 0.2, "tvm_version": "0.8.0"}
{"input": ["cuda -keys=cuda,gpu -max_num_threads=1024 -thread_warp_size=32", "fused_roll_reshape_qkv_matmul.cuda", [["TENSOR", [1, 16, 16, 512], "float16"], ["TENSOR", [1536, 512], "float16"], 1, 16, 16, 512, 3], {}], "config": {"index": 9285, "code_hash": null, "entity": [["block_row_warps", "ot", 1], ["block_col_warps", "ot", 4], ["warp_row_tiles", "ot", 4], ["warp_col_tiles", "ot", 2], ["chunk", "ot", 4], ["offset", "ot", 0], ["offsetCS", "ot", 0], ["vec", "ot", 8], ["wmma_m", "ot", 16]]}, "result": [[2.7133694e-05], 0, 1.7297930717468262, 1651936068.0690517], "version": 0.2, "tvm_version": "0.8.0"}
{"input": ["cuda -keys=cuda,gpu -max_num_threads=1024 -thread_warp_size=32", "fused_roll_reshape_qkv_matmul.cuda", [["TENSOR", [1, 16, 16, 512], "float16"], ["TENSOR", [1536, 512], "float16"], 1, 16, 16, 512, 3], {}], "config": {"index": 9831, "code_hash": null, "entity": [["block_row_warps", "ot", 1], ["block_col_warps", "ot", 2], ["warp_row_tiles", "ot", 1], ["warp_col_tiles", "ot", 2], ["chunk", "ot", 2], ["offset", "ot", 0], ["offsetCS", "ot", 8], ["vec", "ot", 8], ["wmma_m", "ot", 16]]}, "result": [[3.5547285e-05], 0, 1.4093220233917236, 1651936069.7204995], "version": 0.2, "tvm_version": "0.8.0"}
{"input": ["cuda -keys=cuda,gpu -max_num_threads=1024 -thread_warp_size=32", "fused_roll_reshape_qkv_matmul.cuda", [["TENSOR", [1, 16, 16, 512], "float16"], ["TENSOR", [1536, 512], "float16"], 1, 16, 16, 512, 3], {}], "config": {"index": 9477, "code_hash": null, "entity": [["block_row_warps", "ot", 1], ["block_col_warps", "ot", 1], ["warp_row_tiles", "ot", 1], ["warp_col_tiles", "ot", 1], ["chunk", "ot", 2], ["offset", "ot", 8], ["offsetCS", "ot", 0], ["vec", "ot", 8], ["wmma_m", "ot", 16]]}, "result": [[2.7147626e-05], 0, 1.6952142715454102, 1651936070.7018223], "version": 0.2, "tvm_version": "0.8.0"}
{"input": ["cuda -keys=cuda,gpu -max_num_threads=1024 -thread_warp_size=32", "fused_roll_reshape_qkv_matmul.cuda", [["TENSOR", [1, 16, 16, 512], "float16"], ["TENSOR", [1536, 512], "float16"], 1, 16, 16, 512, 3], {}], "config": {"index": 14378, "code_hash": null, "entity": [["block_row_warps", "ot", 4], ["block_col_warps", "ot", 2], ["warp_row_tiles", "ot", 2], ["warp_col_tiles", "ot", 2], ["chunk", "ot", 2], ["offset", "ot", 0], ["offsetCS", "ot", 0], ["vec", "ot", 8], ["wmma_m", "ot", 8]]}, "result": [[3.3966334e-05], 0, 1.3599112033843994, 1651936072.324363], "version": 0.2, "tvm_version": "0.8.0"}
{"input": ["cuda -keys=cuda,gpu -max_num_threads=1024 -thread_warp_size=32", "fused_roll_reshape_qkv_matmul.cuda", [["TENSOR", [1, 16, 16, 512], "float16"], ["TENSOR", [1536, 512], "float16"], 1, 16, 16, 512, 3], {}], "config": {"index": 14420, "code_hash": null, "entity": [["block_row_warps", "ot", 4], ["block_col_warps", "ot", 1], ["warp_row_tiles", "ot", 1], ["warp_col_tiles", "ot", 1], ["chunk", "ot", 4], ["offset", "ot", 0], ["offsetCS", "ot", 0], ["vec", "ot", 8], ["wmma_m", "ot", 8]]}, "result": [[3.9249137e-05], 0, 1.5704233646392822, 1651936074.173326], "version": 0.2, "tvm_version": "0.8.0"}
{"input": ["cuda -keys=cuda,gpu -max_num_threads=1024 -thread_warp_size=32", "fused_roll_reshape_qkv_matmul.cuda", [["TENSOR", [1, 16, 16, 512], "float16"], ["TENSOR", [1536, 512], "float16"], 1, 16, 16, 512, 3], {}], "config": {"index": 3745, "code_hash": null, "entity": [["block_row_warps", "ot", 2], ["block_col_warps", "ot", 1], ["warp_row_tiles", "ot", 4], ["warp_col_tiles", "ot", 1], ["chunk", "ot", 4], ["offset", "ot", 8], ["offsetCS", "ot", 8], ["vec", "ot", 4], ["wmma_m", "ot", 32]]}, "result": [[2.1457485999999997e-05], 0, 1.585082769393921, 1651936074.906825], "version": 0.2, "tvm_version": "0.8.0"}
{"input": ["cuda -keys=cuda,gpu -max_num_threads=1024 -thread_warp_size=32", "fused_roll_reshape_qkv_matmul.cuda", [["TENSOR", [1, 16, 16, 512], "float16"], ["TENSOR", [1536, 512], "float16"], 1, 16, 16, 512, 3], {}], "config": {"index": 2984, "code_hash": null, "entity": [["block_row_warps", "ot", 4], ["block_col_warps", "ot", 2], ["warp_row_tiles", "ot", 2], ["warp_col_tiles", "ot", 4], ["chunk", "ot", 1], ["offset", "ot", 8], ["offsetCS", "ot", 0], ["vec", "ot", 4], ["wmma_m", "ot", 32]]}, "result": [[4.7261872e-05], 0, 1.609788417816162, 1651936076.751679], "version": 0.2, "tvm_version": "0.8.0"}
{"input": ["cuda -keys=cuda,gpu -max_num_threads=1024 -thread_warp_size=32", "fused_roll_reshape_qkv_matmul.cuda", [["TENSOR", [1, 16, 16, 512], "float16"], ["TENSOR", [1536, 512], "float16"], 1, 16, 16, 512, 3], {}], "config": {"index": 2173, "code_hash": null, "entity": [["block_row_warps", "ot", 2], ["block_col_warps", "ot", 2], ["warp_row_tiles", "ot", 2], ["warp_col_tiles", "ot", 4], ["chunk", "ot", 4], ["offset", "ot", 0], ["offsetCS", "ot", 8], ["vec", "ot", 2], ["wmma_m", "ot", 32]]}, "result": [[2.8463789e-05], 0, 1.592160940170288, 1651936078.3115158], "version": 0.2, "tvm_version": "0.8.0"}
{"input": ["cuda -keys=cuda,gpu -max_num_threads=1024 -thread_warp_size=32", "fused_roll_reshape_qkv_matmul.cuda", [["TENSOR", [1, 16, 16, 512], "float16"], ["TENSOR", [1536, 512], "float16"], 1, 16, 16, 512, 3], {}], "config": {"index": 5302, "code_hash": null, "entity": [["block_row_warps", "ot", 2], ["block_col_warps", "ot", 1], ["warp_row_tiles", "ot", 2], ["warp_col_tiles", "ot", 2], ["chunk", "ot", 2], ["offset", "ot", 0], ["offsetCS", "ot", 0], ["vec", "ot", 1], ["wmma_m", "ot", 16]]}, "result": [[2.0836398e-05], 0, 1.7163734436035156, 1651936078.9637973], "version": 0.2, "tvm_version": "0.8.0"}
{"input": ["cuda -keys=cuda,gpu -max_num_threads=1024 -thread_warp_size=32", "fused_roll_reshape_qkv_matmul.cuda", [["TENSOR", [1, 16, 16, 512], "float16"], ["TENSOR", [1536, 512], "float16"], 1, 16, 16, 512, 3], {}], "config": {"index": 7540, "code_hash": null, "entity": [["block_row_warps", "ot", 2], ["block_col_warps", "ot", 4], ["warp_row_tiles", "ot", 1], ["warp_col_tiles", "ot", 1], ["chunk", "ot", 2], ["offset", "ot", 8], ["offsetCS", "ot", 8], ["vec", "ot", 2], ["wmma_m", "ot", 16]]}, "result": [[2.2068628e-05], 0, 1.422849178314209, 1651936080.7642527], "version": 0.2, "tvm_version": "0.8.0"}
{"input": ["cuda -keys=cuda,gpu -max_num_threads=1024 -thread_warp_size=32", "fused_roll_reshape_qkv_matmul.cuda", [["TENSOR", [1, 16, 16, 512], "float16"], ["TENSOR", [1536, 512], "float16"], 1, 16, 16, 512, 3], {}], "config": {"index": 4641, "code_hash": null, "entity": [["block_row_warps", "ot", 1], ["block_col_warps", "ot", 4], ["warp_row_tiles", "ot", 4], ["warp_col_tiles", "ot", 1], ["chunk", "ot", 2], ["offset", "ot", 0], ["offsetCS", "ot", 8], ["vec", "ot", 8], ["wmma_m", "ot", 32]]}, "result": [[4.1637387e-05], 0, 1.3920996189117432, 1651936081.3776953], "version": 0.2, "tvm_version": "0.8.0"}
{"input": ["cuda -keys=cuda,gpu -max_num_threads=1024 -thread_warp_size=32", "fused_roll_reshape_qkv_matmul.cuda", [["TENSOR", [1, 16, 16, 512], "float16"], ["TENSOR", [1536, 512], "float16"], 1, 16, 16, 512, 3], {}], "config": {"index": 4224, "code_hash": null, "entity": [["block_row_warps", "ot", 1], ["block_col_warps", "ot", 2], ["warp_row_tiles", "ot", 2], ["warp_col_tiles", "ot", 1], ["chunk", "ot", 1], ["offset", "ot", 8], ["offsetCS", "ot", 0], ["vec", "ot", 8], ["wmma_m", "ot", 32]]}, "result": [[4.0833257e-05], 0, 1.4108631610870361, 1651936083.227294], "version": 0.2, "tvm_version": "0.8.0"}
{"input": ["cuda -keys=cuda,gpu -max_num_threads=1024 -thread_warp_size=32", "fused_roll_reshape_qkv_matmul.cuda", [["TENSOR", [1, 16, 16, 512], "float16"], ["TENSOR", [1536, 512], "float16"], 1, 16, 16, 512, 3], {}], "config": {"index": 14386, "code_hash": null, "entity": [["block_row_warps", "ot", 2], ["block_col_warps", "ot", 2], ["warp_row_tiles", "ot", 4], ["warp_col_tiles", "ot", 2], ["chunk", "ot", 2], ["offset", "ot", 0], ["offsetCS", "ot", 0], ["vec", "ot", 8], ["wmma_m", "ot", 8]]}, "result": [[2.1849609000000003e-05], 0, 1.3942298889160156, 1651936083.833445], "version": 0.2, "tvm_version": "0.8.0"}
{"input": ["cuda -keys=cuda,gpu -max_num_threads=1024 -thread_warp_size=32", "fused_roll_reshape_qkv_matmul.cuda", [["TENSOR", [1, 16, 16, 512], "float16"], ["TENSOR", [1536, 512], "float16"], 1, 16, 16, 512, 3], {}], "config": {"index": 355, "code_hash": null, "entity": [["block_row_warps", "ot", 2], ["block_col_warps", "ot", 2], ["warp_row_tiles", "ot", 1], ["warp_col_tiles", "ot", 2], ["chunk", "ot", 1], ["offset", "ot", 8], ["offsetCS", "ot", 0], ["vec", "ot", 1], ["wmma_m", "ot", 32]]}, "result": [[1.9565112e-05], 0, 1.5760154724121094, 1651936084.6383884], "version": 0.2, "tvm_version": "0.8.0"}
{"input": ["cuda -keys=cuda,gpu -max_num_threads=1024 -thread_warp_size=32", "fused_roll_reshape_qkv_matmul.cuda", [["TENSOR", [1, 16, 16, 512], "float16"], ["TENSOR", [1536, 512], "float16"], 1, 16, 16, 512, 3], {}], "config": {"index": 10049, "code_hash": null, "entity": [["block_row_warps", "ot", 4], ["block_col_warps", "ot", 2], ["warp_row_tiles", "ot", 1], ["warp_col_tiles", "ot", 1], ["chunk", "ot", 1], ["offset", "ot", 8], ["offsetCS", "ot", 8], ["vec", "ot", 8], ["wmma_m", "ot", 16]]}, "result": [[7.9611248e-05], 0, 1.8041841983795166, 1651936085.5620375], "version": 0.2, "tvm_version": "0.8.0"}
{"input": ["cuda -keys=cuda,gpu -max_num_threads=1024 -thread_warp_size=32", "fused_roll_reshape_qkv_matmul.cuda", [["TENSOR", [1, 16, 16, 512], "float16"], ["TENSOR", [1536, 512], "float16"], 1, 16, 16, 512, 3], {}], "config": {"index": 13248, "code_hash": null, "entity": [["block_row_warps", "ot", 1], ["block_col_warps", "ot", 1], ["warp_row_tiles", "ot", 4], ["warp_col_tiles", "ot", 2], ["chunk", "ot", 8], ["offset", "ot", 0], ["offsetCS", "ot", 0], ["vec", "ot", 4], ["wmma_m", "ot", 8]]}, "result": [[1.9809763e-05], 0, 1.9344351291656494, 1651936087.1081116], "version": 0.2, "tvm_version": "0.8.0"}
{"input": ["cuda -keys=cuda,gpu -max_num_threads=1024 -thread_warp_size=32", "fused_roll_reshape_qkv_matmul.cuda", [["TENSOR", [1, 16, 16, 512], "float16"], ["TENSOR", [1536, 512], "float16"], 1, 16, 16, 512, 3], {}], "config": {"index": 14624, "code_hash": null, "entity": [["block_row_warps", "ot", 4], ["block_col_warps", "ot", 4], ["warp_row_tiles", "ot", 2], ["warp_col_tiles", "ot", 2], ["chunk", "ot", 1], ["offset", "ot", 8], ["offsetCS", "ot", 0], ["vec", "ot", 8], ["wmma_m", "ot", 8]]}, "result": [[8.3161545e-05], 0, 1.6623115539550781, 1651936087.9372702], "version": 0.2, "tvm_version": "0.8.0"}
{"input": ["cuda -keys=cuda,gpu -max_num_threads=1024 -thread_warp_size=32", "fused_roll_reshape_qkv_matmul.cuda", [["TENSOR", [1, 16, 16, 512], "float16"], ["TENSOR", [1536, 512], "float16"], 1, 16, 16, 512, 3], {}], "config": {"index": 6824, "code_hash": null, "entity": [["block_row_warps", "ot", 4], ["block_col_warps", "ot", 1], ["warp_row_tiles", "ot", 4], ["warp_col_tiles", "ot", 1], ["chunk", "ot", 1], ["offset", "ot", 8], ["offsetCS", "ot", 0], ["vec", "ot", 2], ["wmma_m", "ot", 16]]}, "result": [[2.8052243e-05], 0, 1.5252814292907715, 1651936088.6107433], "version": 0.2, "tvm_version": "0.8.0"}
{"input": ["cuda -keys=cuda,gpu -max_num_threads=1024 -thread_warp_size=32", "fused_roll_reshape_qkv_matmul.cuda", [["TENSOR", [1, 16, 16, 512], "float16"], ["TENSOR", [1536, 512], "float16"], 1, 16, 16, 512, 3], {}], "config": {"index": 3475, "code_hash": null, "entity": [["block_row_warps", "ot", 2], ["block_col_warps", "ot", 1], ["warp_row_tiles", "ot", 4], ["warp_col_tiles", "ot", 4], ["chunk", "ot", 4], ["offset", "ot", 0], ["offsetCS", "ot", 8], ["vec", "ot", 4], ["wmma_m", "ot", 32]]}, "result": [[2.9200175999999996e-05], 0, 1.8252801895141602, 1651936089.5538518], "version": 0.2, "tvm_version": "0.8.0"}
{"input": ["cuda -keys=cuda,gpu -max_num_threads=1024 -thread_warp_size=32", "fused_roll_reshape_qkv_matmul.cuda", [["TENSOR", [1, 16, 16, 512], "float16"], ["TENSOR", [1536, 512], "float16"], 1, 16, 16, 512, 3], {}], "config": {"index": 7549, "code_hash": null, "entity": [["block_row_warps", "ot", 2], ["block_col_warps", "ot", 4], ["warp_row_tiles", "ot", 2], ["warp_col_tiles", "ot", 1], ["chunk", "ot", 2], ["offset", "ot", 8], ["offsetCS", "ot", 8], ["vec", "ot", 2], ["wmma_m", "ot", 16]]}, "result": [[2.1422119e-05], 0, 1.6215486526489258, 1651936091.0586224], "version": 0.2, "tvm_version": "0.8.0"}
{"input": ["cuda -keys=cuda,gpu -max_num_threads=1024 -thread_warp_size=32", "fused_roll_reshape_qkv_matmul.cuda", [["TENSOR", [1, 16, 16, 512], "float16"], ["TENSOR", [1536, 512], "float16"], 1, 16, 16, 512, 3], {}], "config": {"index": 4916, "code_hash": null, "entity": [["block_row_warps", "ot", 4], ["block_col_warps", "ot", 1], ["warp_row_tiles", "ot", 1], ["warp_col_tiles", "ot", 4], ["chunk", "ot", 1], ["offset", "ot", 8], ["offsetCS", "ot", 8], ["vec", "ot", 8], ["wmma_m", "ot", 32]]}, "result": [[4.6033296e-05], 0, 1.5945017337799072, 1651936092.0073464], "version": 0.2, "tvm_version": "0.8.0"}
{"input": ["cuda -keys=cuda,gpu -max_num_threads=1024 -thread_warp_size=32", "fused_roll_reshape_qkv_matmul.cuda", [["TENSOR", [1, 16, 16, 512], "float16"], ["TENSOR", [1536, 512], "float16"], 1, 16, 16, 512, 3], {}], "config": {"index": 13166, "code_hash": null, "entity": [["block_row_warps", "ot", 4], ["block_col_warps", "ot", 4], ["warp_row_tiles", "ot", 2], ["warp_col_tiles", "ot", 2], ["chunk", "ot", 4], ["offset", "ot", 0], ["offsetCS", "ot", 0], ["vec", "ot", 4], ["wmma_m", "ot", 8]]}, "result": [[0.00010508047899999999], 0, 1.7457067966461182, 1651936093.7695537], "version": 0.2, "tvm_version": "0.8.0"}
{"input": ["cuda -keys=cuda,gpu -max_num_threads=1024 -thread_warp_size=32", "fused_roll_reshape_qkv_matmul.cuda", [["TENSOR", [1, 16, 16, 512], "float16"], ["TENSOR", [1536, 512], "float16"], 1, 16, 16, 512, 3], {}], "config": {"index": 4449, "code_hash": null, "entity": [["block_row_warps", "ot", 1], ["block_col_warps", "ot", 2], ["warp_row_tiles", "ot", 4], ["warp_col_tiles", "ot", 4], ["chunk", "ot", 4], ["offset", "ot", 8], ["offsetCS", "ot", 0], ["vec", "ot", 8], ["wmma_m", "ot", 32]]}, "result": [[1.6711318e-05], 0, 1.6441593170166016, 1651936095.5375946], "version": 0.2, "tvm_version": "0.8.0"}
{"input": ["cuda -keys=cuda,gpu -max_num_threads=1024 -thread_warp_size=32", "fused_roll_reshape_qkv_matmul.cuda", [["TENSOR", [1, 16, 16, 512], "float16"], ["TENSOR", [1536, 512], "float16"], 1, 16, 16, 512, 3], {}], "config": {"index": 8677, "code_hash": null, "entity": [["block_row_warps", "ot", 2], ["block_col_warps", "ot", 1], ["warp_row_tiles", "ot", 2], ["warp_col_tiles", "ot", 1], ["chunk", "ot", 8], ["offset", "ot", 0], ["offsetCS", "ot", 8], ["vec", "ot", 4], ["wmma_m", "ot", 16]]}, "result": [[4.8961135e-05], 0, 1.8359942436218262, 1651936096.5323336], "version": 0.2, "tvm_version": "0.8.0"}
{"input": ["cuda -keys=cuda,gpu -max_num_threads=1024 -thread_warp_size=32", "fused_roll_reshape_qkv_matmul.cuda", [["TENSOR", [1, 16, 16, 512], "float16"], ["TENSOR", [1536, 512], "float16"], 1, 16, 16, 512, 3], {}], "config": {"index": 280, "code_hash": null, "entity": [["block_row_warps", "ot", 2], ["block_col_warps", "ot", 1], ["warp_row_tiles", "ot", 2], ["warp_col_tiles", "ot", 2], ["chunk", "ot", 8], ["offset", "ot", 0], ["offsetCS", "ot", 0], ["vec", "ot", 1], ["wmma_m", "ot", 32]]}, "result": [[8.926158599999999e-05], 0, 2.549074411392212, 1651936099.3786976], "version": 0.2, "tvm_version": "0.8.0"}
{"input": ["cuda -keys=cuda,gpu -max_num_threads=1024 -thread_warp_size=32", "fused_roll_reshape_qkv_matmul.cuda", [["TENSOR", [1, 16, 16, 512], "float16"], ["TENSOR", [1536, 512], "float16"], 1, 16, 16, 512, 3], {}], "config": {"index": 3346, "code_hash": null, "entity": [["block_row_warps", "ot", 2], ["block_col_warps", "ot", 4], ["warp_row_tiles", "ot", 4], ["warp_col_tiles", "ot", 1], ["chunk", "ot", 2], ["offset", "ot", 0], ["offsetCS", "ot", 8], ["vec", "ot", 4], ["wmma_m", "ot", 32]]}, "result": [[3.8710931999999996e-05], 0, 1.4724876880645752, 1651936100.1148481], "version": 0.2, "tvm_version": "0.8.0"}
{"input": ["cuda -keys=cuda,gpu -max_num_threads=1024 -thread_warp_size=32", "fused_roll_reshape_qkv_matmul.cuda", [["TENSOR", [1, 16, 16, 512], "float16"], ["TENSOR", [1536, 512], "float16"], 1, 16, 16, 512, 3], {}], "config": {"index": 7056, "code_hash": null, "entity": [["block_row_warps", "ot", 1], ["block_col_warps", "ot", 1], ["warp_row_tiles", "ot", 2], ["warp_col_tiles", "ot", 1], ["chunk", "ot", 8], ["offset", "ot", 8], ["offsetCS", "ot", 0], ["vec", "ot", 2], ["wmma_m", "ot", 16]]}, "result": [[3.642013099999999e-05], 0, 2.0184059143066406, 1651936137.499196], "version": 0.2, "tvm_version": "0.8.0"}
{"input": ["cuda -keys=cuda,gpu -max_num_threads=1024 -thread_warp_size=32", "fused_roll_reshape_qkv_matmul.cuda", [["TENSOR", [1, 16, 16, 512], "float16"], ["TENSOR", [1536, 512], "float16"], 1, 16, 16, 512, 3], {}], "config": {"index": 9324, "code_hash": null, "entity": [["block_row_warps", "ot", 1], ["block_col_warps", "ot", 1], ["warp_row_tiles", "ot", 2], ["warp_col_tiles", "ot", 1], ["chunk", "ot", 8], ["offset", "ot", 0], ["offsetCS", "ot", 0], ["vec", "ot", 8], ["wmma_m", "ot", 16]]}, "result": [[5.2336698e-05], 0, 1.5328006744384766, 1651936138.1494508], "version": 0.2, "tvm_version": "0.8.0"}
{"input": ["cuda -keys=cuda,gpu -max_num_threads=1024 -thread_warp_size=32", "fused_roll_reshape_qkv_matmul.cuda", [["TENSOR", [1, 16, 16, 512], "float16"], ["TENSOR", [1536, 512], "float16"], 1, 16, 16, 512, 3], {}], "config": {"index": 8676, "code_hash": null, "entity": [["block_row_warps", "ot", 1], ["block_col_warps", "ot", 1], ["warp_row_tiles", "ot", 2], ["warp_col_tiles", "ot", 1], ["chunk", "ot", 8], ["offset", "ot", 0], ["offsetCS", "ot", 8], ["vec", "ot", 4], ["wmma_m", "ot", 16]]}, "result": [[3.9617305e-05], 0, 1.8731474876403809, 1651936138.894333], "version": 0.2, "tvm_version": "0.8.0"}
{"input": ["cuda -keys=cuda,gpu -max_num_threads=1024 -thread_warp_size=32", "fused_roll_reshape_qkv_matmul.cuda", [["TENSOR", [1, 16, 16, 512], "float16"], ["TENSOR", [1536, 512], "float16"], 1, 16, 16, 512, 3], {}], "config": {"index": 6732, "code_hash": null, "entity": [["block_row_warps", "ot", 1], ["block_col_warps", "ot", 1], ["warp_row_tiles", "ot", 2], ["warp_col_tiles", "ot", 1], ["chunk", "ot", 8], ["offset", "ot", 0], ["offsetCS", "ot", 0], ["vec", "ot", 2], ["wmma_m", "ot", 16]]}, "result": [[5.0236743e-05], 0, 2.0342235565185547, 1651936139.8799703], "version": 0.2, "tvm_version": "0.8.0"}
{"input": ["cuda -keys=cuda,gpu -max_num_threads=1024 -thread_warp_size=32", "fused_roll_reshape_qkv_matmul.cuda", [["TENSOR", [1, 16, 16, 512], "float16"], ["TENSOR", [1536, 512], "float16"], 1, 16, 16, 512, 3], {}], "config": {"index": 9972, "code_hash": null, "entity": [["block_row_warps", "ot", 1], ["block_col_warps", "ot", 1], ["warp_row_tiles", "ot", 2], ["warp_col_tiles", "ot", 1], ["chunk", "ot", 8], ["offset", "ot", 0], ["offsetCS", "ot", 8], ["vec", "ot", 8], ["wmma_m", "ot", 16]]}, "result": [[2.837156e-05], 0, 1.5916118621826172, 1651936140.5519187], "version": 0.2, "tvm_version": "0.8.0"}
{"input": ["cuda -keys=cuda,gpu -max_num_threads=1024 -thread_warp_size=32", "fused_roll_reshape_qkv_matmul.cuda", [["TENSOR", [1, 16, 16, 512], "float16"], ["TENSOR", [1536, 512], "float16"], 1, 16, 16, 512, 3], {}], "config": {"index": 10296, "code_hash": null, "entity": [["block_row_warps", "ot", 1], ["block_col_warps", "ot", 1], ["warp_row_tiles", "ot", 2], ["warp_col_tiles", "ot", 1], ["chunk", "ot", 8], ["offset", "ot", 8], ["offsetCS", "ot", 8], ["vec", "ot", 8], ["wmma_m", "ot", 16]]}, "result": [[1.227551e-05], 0, 1.3969440460205078, 1651936141.0546434], "version": 0.2, "tvm_version": "0.8.0"}
{"input": ["cuda -keys=cuda,gpu -max_num_threads=1024 -thread_warp_size=32", "fused_roll_reshape_qkv_matmul.cuda", [["TENSOR", [1, 16, 16, 512], "float16"], ["TENSOR", [1536, 512], "float16"], 1, 16, 16, 512, 3], {}], "config": {"index": 9648, "code_hash": null, "entity": [["block_row_warps", "ot", 1], ["block_col_warps", "ot", 1], ["warp_row_tiles", "ot", 2], ["warp_col_tiles", "ot", 1], ["chunk", "ot", 8], ["offset", "ot", 8], ["offsetCS", "ot", 0], ["vec", "ot", 8], ["wmma_m", "ot", 16]]}, "result": [[1.2267878e-05], 0, 1.6064279079437256, 1651936141.8286476], "version": 0.2, "tvm_version": "0.8.0"}
{"input": ["cuda -keys=cuda,gpu -max_num_threads=1024 -thread_warp_size=32", "fused_roll_reshape_qkv_matmul.cuda", [["TENSOR", [1, 16, 16, 512], "float16"], ["TENSOR", [1536, 512], "float16"], 1, 16, 16, 512, 3], {}], "config": {"index": 9000, "code_hash": null, "entity": [["block_row_warps", "ot", 1], ["block_col_warps", "ot", 1], ["warp_row_tiles", "ot", 2], ["warp_col_tiles", "ot", 1], ["chunk", "ot", 8], ["offset", "ot", 8], ["offsetCS", "ot", 8], ["vec", "ot", 4], ["wmma_m", "ot", 16]]}, "result": [[1.2056544000000001e-05], 0, 1.7300493717193604, 1651936142.4937873], "version": 0.2, "tvm_version": "0.8.0"}
{"input": ["cuda -keys=cuda,gpu -max_num_threads=1024 -thread_warp_size=32", "fused_roll_reshape_qkv_matmul.cuda", [["TENSOR", [1, 16, 16, 512], "float16"], ["TENSOR", [1536, 512], "float16"], 1, 16, 16, 512, 3], {}], "config": {"index": 7704, "code_hash": null, "entity": [["block_row_warps", "ot", 1], ["block_col_warps", "ot", 1], ["warp_row_tiles", "ot", 2], ["warp_col_tiles", "ot", 1], ["chunk", "ot", 8], ["offset", "ot", 8], ["offsetCS", "ot", 8], ["vec", "ot", 2], ["wmma_m", "ot", 16]]}, "result": [[3.6523425999999994e-05], 0, 2.057507038116455, 1651936143.288277], "version": 0.2, "tvm_version": "0.8.0"}
{"input": ["cuda -keys=cuda,gpu -max_num_threads=1024 -thread_warp_size=32", "fused_roll_reshape_qkv_matmul.cuda", [["TENSOR", [1, 16, 16, 512], "float16"], ["TENSOR", [1536, 512], "float16"], 1, 16, 16, 512, 3], {}], "config": {"index": 7380, "code_hash": null, "entity": [["block_row_warps", "ot", 1], ["block_col_warps", "ot", 1], ["warp_row_tiles", "ot", 2], ["warp_col_tiles", "ot", 1], ["chunk", "ot", 8], ["offset", "ot", 0], ["offsetCS", "ot", 8], ["vec", "ot", 2], ["wmma_m", "ot", 16]]}, "result": [[4.9040701e-05], 0, 1.6212399005889893, 1651936144.100411], "version": 0.2, "tvm_version": "0.8.0"}
{"input": ["cuda -keys=cuda,gpu -max_num_threads=1024 -thread_warp_size=32", "fused_roll_reshape_qkv_matmul.cuda", [["TENSOR", [1, 16, 16, 512], "float16"], ["TENSOR", [1536, 512], "float16"], 1, 16, 16, 512, 3], {}], "config": {"index": 8352, "code_hash": null, "entity": [["block_row_warps", "ot", 1], ["block_col_warps", "ot", 1], ["warp_row_tiles", "ot", 2], ["warp_col_tiles", "ot", 1], ["chunk", "ot", 8], ["offset", "ot", 8], ["offsetCS", "ot", 0], ["vec", "ot", 4], ["wmma_m", "ot", 16]]}, "result": [[1.2062956e-05], 0, 1.686988353729248, 1651936144.793746], "version": 0.2, "tvm_version": "0.8.0"}
{"input": ["cuda -keys=cuda,gpu -max_num_threads=1024 -thread_warp_size=32", "fused_roll_reshape_qkv_matmul.cuda", [["TENSOR", [1, 16, 16, 512], "float16"], ["TENSOR", [1536, 512], "float16"], 1, 16, 16, 512, 3], {}], "config": {"index": 8028, "code_hash": null, "entity": [["block_row_warps", "ot", 1], ["block_col_warps", "ot", 1], ["warp_row_tiles", "ot", 2], ["warp_col_tiles", "ot", 1], ["chunk", "ot", 8], ["offset", "ot", 0], ["offsetCS", "ot", 0], ["vec", "ot", 4], ["wmma_m", "ot", 16]]}, "result": [[2.8155844e-05], 0, 1.8655178546905518, 1651936145.4587488], "version": 0.2, "tvm_version": "0.8.0"}
{"input": ["cuda -keys=cuda,gpu -max_num_threads=1024 -thread_warp_size=32", "fused_roll_reshape_qkv_matmul.cuda", [["TENSOR", [1, 16, 16, 512], "float16"], ["TENSOR", [1536, 512], "float16"], 1, 16, 16, 512, 3], {}], "config": {"index": 3162, "code_hash": null, "entity": [["block_row_warps", "ot", 1], ["block_col_warps", "ot", 2], ["warp_row_tiles", "ot", 1], ["warp_col_tiles", "ot", 1], ["chunk", "ot", 8], ["offset", "ot", 8], ["offsetCS", "ot", 0], ["vec", "ot", 4], ["wmma_m", "ot", 32]]}, "result": [[1.3505375999999999e-05], 0, 1.633185625076294, 1651936146.2943907], "version": 0.2, "tvm_version": "0.8.0"}
