python/models/swin_transformer/kernel_configs/swin_transformer_attn_v_permute_1_28_28_256_7_8.log
{"i": [["[\"attn_v_permute\", 1, 28, 28, 256, 7, 8]", "cuda -keys=cuda,gpu -max_num_threads=1024 -model=unknown -thread_warp_size=32", [-1, 16, 64, 49152, 2147483647, 1024, 8, 32], "", 0, []], [[], [["FU", 1, [0, 1, 2, 3]], ["SP", 1, 0, 200704, [16], 1], ["AN", 1, 0, 5], ["AN", 1, 1, 6]]]], "r": [[1.20033e-05, 1.20225e-05, 1.20161e-05], 0, 0.591002, 1668050123], "v": "v0.6"}
{"i": [["[\"attn_v_permute\", 1, 28, 28, 256, 7, 8]", "cuda -keys=cuda,gpu -max_num_threads=1024 -model=unknown -thread_warp_size=32", [-1, 16, 64, 49152, 2147483647, 1024, 8, 32], "", 0, []], [[], [["FU", 1, [0, 1, 2, 3]], ["SP", 1, 0, 200704, [1], 1], ["AN", 1, 0, 5], ["AN", 1, 1, 6]]]], "r": [[0.000151604, 0.000151585, 0.000151637], 0, 2.73991, 1668050125], "v": "v0.6"}
{"i": [["[\"attn_v_permute\", 1, 28, 28, 256, 7, 8]", "cuda -keys=cuda,gpu -max_num_threads=1024 -model=unknown -thread_warp_size=32", [-1, 16, 64, 49152, 2147483647, 1024, 8, 32], "", 0, []], [[], [["FU", 1, [0, 1, 2, 3]], ["SP", 1, 0, 200704, [32], 1], ["AN", 1, 0, 5], ["AN", 1, 1, 6]]]], "r": [[7.33982e-06, 7.35803e-06, 7.35996e-06], 0, 2.02515, 1668050124], "v": "v0.6"}
{"i": [["[\"attn_v_permute\", 1, 28, 28, 256, 7, 8]", "cuda -keys=cuda,gpu -max_num_threads=1024 -model=unknown -thread_warp_size=32", [-1, 16, 64, 49152, 2147483647, 1024, 8, 32], "", 0, []], [[], [["FU", 1, [0, 1, 2, 3]], ["SP", 1, 0, 200704, [2], 1], ["AN", 1, 0, 5], ["AN", 1, 1, 6]]]], "r": [[7.71407e-05, 7.71513e-05, 7.71545e-05], 0, 1.32909, 1668050124], "v": "v0.6"}
{"i": [["[\"attn_v_permute\", 1, 28, 28, 256, 7, 8]", "cuda -keys=cuda,gpu -max_num_threads=1024 -model=unknown -thread_warp_size=32", [-1, 16, 64, 49152, 2147483647, 1024, 8, 32], "", 0, []], [[], [["FU", 1, [0, 1, 2, 3]], ["SP", 1, 0, 200704, [8], 1], ["AN", 1, 0, 5], ["AN", 1, 1, 6]]]], "r": [[2.14134e-05, 2.14288e-05, 2.14311e-05], 0, 2.41635, 1668050125], "v": "v0.6"}
{"i": [["[\"attn_v_permute\", 1, 28, 28, 256, 7, 8]", "cuda -keys=cuda,gpu -max_num_threads=1024 -model=unknown -thread_warp_size=32", [-1, 16, 64, 49152, 2147483647, 1024, 8, 32], "", 0, []], [[], [["FU", 1, [0, 1, 2, 3]], ["SP", 1, 0, 200704, [49], 1], ["AN", 1, 0, 5], ["AN", 1, 1, 6]]]], "r": [[5.57684e-06, 5.58627e-06, 5.59143e-06], 0, 1.68308, 1668050124], "v": "v0.6"}
{"i": [["[\"attn_v_permute\", 1, 28, 28, 256, 7, 8]", "cuda -keys=cuda,gpu -max_num_threads=1024 -model=unknown -thread_warp_size=32", [-1, 16, 64, 49152, 2147483647, 1024, 8, 32], "", 0, []], [[], [["FU", 1, [0, 1, 2, 3]], ["SP", 1, 0, 200704, [64], 1], ["AN", 1, 0, 5], ["AN", 1, 1, 6]]]], "r": [[4.99266e-06, 5.00732e-06, 5.00479e-06], 0, 3.08983, 1668050126], "v": "v0.6"}
{"i": [["[\"attn_v_permute\", 1, 28, 28, 256, 7, 8]", "cuda -keys=cuda,gpu -max_num_threads=1024 -model=unknown -thread_warp_size=32", [-1, 16, 64, 49152, 2147483647, 1024, 8, 32], "", 0, []], [[], [["FU", 1, [0, 1, 2, 3]], ["SP", 1, 0, 200704, [56], 1], ["AN", 1, 0, 5], ["AN", 1, 1, 6]]]], "r": [[5.38396e-06, 5.40167e-06, 5.40402e-06], 0, 3.46884, 1668050126], "v": "v0.6"}
{"i": [["[\"attn_v_permute\", 1, 28, 28, 256, 7, 8]", "cuda -keys=cuda,gpu -max_num_threads=1024 -model=unknown -thread_warp_size=32", [-1, 16, 64, 49152, 2147483647, 1024, 8, 32], "", 0, []], [[], [["FU", 1, [0, 1, 2, 3]], ["SP", 1, 0, 200704, [28], 1], ["AN", 1, 0, 5], ["AN", 1, 1, 6]]]], "r": [[8.01195e-06, 8.02697e-06, 8.03511e-06], 0, 4.14599, 1668050127], "v": "v0.6"}
{"i": [["[\"attn_v_permute\", 1, 28, 28, 256, 7, 8]", "cuda -keys=cuda,gpu -max_num_threads=1024 -model=unknown -thread_warp_size=32", [-1, 16, 64, 49152, 2147483647, 1024, 8, 32], "", 0, []], [[], [["FU", 1, [0, 1, 2, 3]], ["SP", 1, 0, 200704, [7], 1], ["AN", 1, 0, 5], ["AN", 1, 1, 6]]]], "r": [[2.40974e-05, 2.40971e-05, 2.41089e-05], 0, 3.79482, 1668050126], "v": "v0.6"}
{"i": [["[\"attn_v_permute\", 1, 28, 28, 256, 7, 8]", "cuda -keys=cuda,gpu -max_num_threads=1024 -model=unknown -thread_warp_size=32", [-1, 16, 64, 49152, 2147483647, 1024, 8, 32], "", 0, []], [[], [["FU", 1, [0, 1, 2, 3]], ["SP", 1, 0, 200704, [14], 1], ["AN", 1, 0, 5], ["AN", 1, 1, 6]]]], "r": [[1.35675e-05, 1.35729e-05, 1.35756e-05], 0, 4.51144, 1668050127], "v": "v0.6"}
{"i": [["[\"attn_v_permute\", 1, 28, 28, 256, 7, 8]", "cuda -keys=cuda,gpu -max_num_threads=1024 -model=unknown -thread_warp_size=32", [-1, 16, 64, 49152, 2147483647, 1024, 8, 32], "", 0, []], [[], [["FU", 1, [0, 1, 2, 3]], ["SP", 1, 0, 200704, [4], 1], ["AN", 1, 0, 5], ["AN", 1, 1, 6]]]], "r": [[3.98704e-05, 3.98836e-05, 3.98846e-05], 0, 0.930938, 1668050123], "v": "v0.6"}
{"i": [["[\"attn_v_permute\", 1, 28, 28, 256, 7, 8]", "cuda -keys=cuda,gpu -max_num_threads=1024 -model=unknown -thread_warp_size=32", [-1, 16, 64, 49152, 2147483647, 1024, 8, 32], "", 0, []], [[], [["FU", 1, [0, 1, 2, 3]], ["SP", 1, 0, 200704, [16], 1], ["AN", 1, 0, 5], ["AN", 1, 1, 6]]]], "r": [[1.22089e-05, 1.22212e-05, 1.22274e-05], 0, 1.5782, 1668051384], "v": "v0.6"}
{"i": [["[\"attn_v_permute\", 1, 28, 28, 256, 7, 8]", "cuda -keys=cuda,gpu -max_num_threads=1024 -model=unknown -thread_warp_size=32", [-1, 16, 64, 49152, 2147483647, 1024, 8, 32], "", 0, []], [[], [["FU", 1, [0, 1, 2, 3]], ["SP", 1, 0, 200704, [8], 1], ["AN", 1, 0, 5], ["AN", 1, 1, 6]]]], "r": [[2.14027e-05, 2.14093e-05, 2.14085e-05], 0, 0.583173, 1668051383], "v": "v0.6"}
{"i": [["[\"attn_v_permute\", 1, 28, 28, 256, 7, 8]", "cuda -keys=cuda,gpu -max_num_threads=1024 -model=unknown -thread_warp_size=32", [-1, 16, 64, 49152, 2147483647, 1024, 8, 32], "", 0, []], [[], [["FU", 1, [0, 1, 2, 3]], ["SP", 1, 0, 200704, [56], 1], ["AN", 1, 0, 5], ["AN", 1, 1, 6]]]], "r": [[5.24129e-06, 5.25258e-06, 5.25277e-06], 0, 1.90502, 1668051385], "v": "v0.6"}
{"i": [["[\"attn_v_permute\", 1, 28, 28, 256, 7, 8]", "cuda -keys=cuda,gpu -max_num_threads=1024 -model=unknown -thread_warp_size=32", [-1, 16, 64, 49152, 2147483647, 1024, 8, 32], "", 0, []], [[], [["FU", 1, [0, 1, 2, 3]], ["SP", 1, 0, 200704, [49], 1], ["AN", 1, 0, 5], ["AN", 1, 1, 6]]]], "r": [[5.82975e-06, 5.83517e-06, 5.8346e-06], 0, 0.900468, 1668051384], "v": "v0.6"}
{"i": [["[\"attn_v_permute\", 1, 28, 28, 256, 7, 8]", "cuda -keys=cuda,gpu -max_num_threads=1024 -model=unknown -thread_warp_size=32", [-1, 16, 64, 49152, 2147483647, 1024, 8, 32], "", 0, []], [[], [["FU", 1, [0, 1, 2, 3]], ["SP", 1, 0, 200704, [1], 1], ["AN", 1, 0, 5], ["AN", 1, 1, 6]]]], "r": [[0.000151527, 0.000151547, 0.000151567], 0, 1.26386, 1668051384], "v": "v0.6"}
{"i": [["[\"attn_v_permute\", 1, 28, 28, 256, 7, 8]", "cuda -keys=cuda,gpu -max_num_threads=1024 -model=unknown -thread_warp_size=32", [-1, 16, 64, 49152, 2147483647, 1024, 8, 32], "", 0, []], [[], [["FU", 1, [0, 1, 2, 3]], ["SP", 1, 0, 200704, [64], 1], ["AN", 1, 0, 5], ["AN", 1, 1, 6]]]], "r": [[4.82543e-06, 4.83699e-06, 4.83965e-06], 0, 2.27137, 1668051385], "v": "v0.6"}
{"i": [["[\"attn_v_permute\", 1, 28, 28, 256, 7, 8]", "cuda -keys=cuda,gpu -max_num_threads=1024 -model=unknown -thread_warp_size=32", [-1, 16, 64, 49152, 2147483647, 1024, 8, 32], "", 0, []], [[], [["FU", 1, [0, 1, 2, 3]], ["SP", 1, 0, 200704, [28], 1], ["AN", 1, 0, 5], ["AN", 1, 1, 6]]]], "r": [[8.16731e-06, 8.18404e-06, 8.17629e-06], 0, 2.9328, 1668051386], "v": "v0.6"}
{"i": [["[\"attn_v_permute\", 1, 28, 28, 256, 7, 8]", "cuda -keys=cuda,gpu -max_num_threads=1024 -model=unknown -thread_warp_size=32", [-1, 16, 64, 49152, 2147483647, 1024, 8, 32], "", 0, []], [[], [["FU", 1, [0, 1, 2, 3]], ["SP", 1, 0, 200704, [4], 1], ["AN", 1, 0, 5], ["AN", 1, 1, 6]]]], "r": [[3.99416e-05, 3.99552e-05, 3.99497e-05], 0, 2.61167, 1668051385], "v": "v0.6"}
{"i": [["[\"attn_v_permute\", 1, 28, 28, 256, 7, 8]", "cuda -keys=cuda,gpu -max_num_threads=1024 -model=unknown -thread_warp_size=32", [-1, 16, 64, 49152, 2147483647, 1024, 8, 32], "", 0, []], [[], [["FU", 1, [0, 1, 2, 3]], ["SP", 1, 0, 200704, [32], 1], ["AN", 1, 0, 5], ["AN", 1, 1, 6]]]], "r": [[7.44114e-06, 7.44743e-06, 7.44497e-06], 0, 3.30889, 1668051386], "v": "v0.6"}
{"i": [["[\"attn_v_permute\", 1, 28, 28, 256, 7, 8]", "cuda -keys=cuda,gpu -max_num_threads=1024 -model=unknown -thread_warp_size=32", [-1, 16, 64, 49152, 2147483647, 1024, 8, 32], "", 0, []], [[], [["FU", 1, [0, 1, 2, 3]], ["SP", 1, 0, 200704, [14], 1], ["AN", 1, 0, 5], ["AN", 1, 1, 6]]]], "r": [[1.33861e-05, 1.33993e-05, 1.34031e-05], 0, 3.97712, 1668051387], "v": "v0.6"}
{"i": [["[\"attn_v_permute\", 1, 28, 28, 256, 7, 8]", "cuda -keys=cuda,gpu -max_num_threads=1024 -model=unknown -thread_warp_size=32", [-1, 16, 64, 49152, 2147483647, 1024, 8, 32], "", 0, []], [[], [["FU", 1, [0, 1, 2, 3]], ["SP", 1, 0, 200704, [7], 1], ["AN", 1, 0, 5], ["AN", 1, 1, 6]]]], "r": [[2.40652e-05, 2.4075e-05, 2.40736e-05], 0, 3.6486, 1668051387], "v": "v0.6"}
{"i": [["[\"attn_v_permute\", 1, 28, 28, 256, 7, 8]", "cuda -keys=cuda,gpu -max_num_threads=1024 -model=unknown -thread_warp_size=32", [-1, 16, 64, 49152, 2147483647, 1024, 8, 32], "", 0, []], [[], [["FU", 1, [0, 1, 2, 3]], ["SP", 1, 0, 200704, [2], 1], ["AN", 1, 0, 5], ["AN", 1, 1, 6]]]], "r": [[7.71248e-05, 7.71309e-05, 7.71385e-05], 0, 4.35651, 1668051387], "v": "v0.6"}
