python/models/swin_transformer/kernel_configs/swin_transformer_auto_tvm_qeury_key_matmul_tensorcore_64_4_64_32.log
{"input": ["cuda -keys=cuda,gpu -max_num_threads=1024 -thread_warp_size=32", "batch_matmul_tensorcore.cuda", [["TENSOR", [256, 64, 32], "float16"], ["TENSOR", [256, 64, 32], "float16"]], {}], "config": {"index": 6764, "code_hash": null, "entity": [["block_row_warps", "ot", 4], ["block_col_warps", "ot", 2], ["warp_row_tiles", "ot", 2], ["warp_col_tiles", "ot", 2], ["chunk", "ot", 8], ["offset", "ot", 0], ["offsetCS", "ot", 0], ["vec", "ot", 2], ["wmma_m", "ot", 16]]}, "result": [[5.800661e-05], 0, 2.009702682495117, 1651210771.2434044], "version": 0.2, "tvm_version": "0.8.0"}
{"input": ["cuda -keys=cuda,gpu -max_num_threads=1024 -thread_warp_size=32", "batch_matmul_tensorcore.cuda", [["TENSOR", [256, 64, 32], "float16"], ["TENSOR", [256, 64, 32], "float16"]], {}], "config": {"index": 9549, "code_hash": null, "entity": [["block_row_warps", "ot", 1], ["block_col_warps", "ot", 1], ["warp_row_tiles", "ot", 4], ["warp_col_tiles", "ot", 4], ["chunk", "ot", 2], ["offset", "ot", 8], ["offsetCS", "ot", 0], ["vec", "ot", 8], ["wmma_m", "ot", 16]]}, "result": [[6.056592661924373e-06], 0, 2.0772688388824463, 1651210771.9056737], "version": 0.2, "tvm_version": "0.8.0"}
{"input": ["cuda -keys=cuda,gpu -max_num_threads=1024 -thread_warp_size=32", "batch_matmul_tensorcore.cuda", [["TENSOR", [256, 64, 32], "float16"], ["TENSOR", [256, 64, 32], "float16"]], {}], "config": {"index": 11372, "code_hash": null, "entity": [["block_row_warps", "ot", 4], ["block_col_warps", "ot", 2], ["warp_row_tiles", "ot", 1], ["warp_col_tiles", "ot", 2], ["chunk", "ot", 1], ["offset", "ot", 8], ["offsetCS", "ot", 8], ["vec", "ot", 1], ["wmma_m", "ot", 8]]}, "result": [[1.3464318000000002e-05], 0, 1.6737620830535889, 1651210772.9952784], "version": 0.2, "tvm_version": "0.8.0"}
{"input": ["cuda -keys=cuda,gpu -max_num_threads=1024 -thread_warp_size=32", "batch_matmul_tensorcore.cuda", [["TENSOR", [256, 64, 32], "float16"], ["TENSOR", [256, 64, 32], "float16"]], {}], "config": {"index": 14211, "code_hash": null, "entity": [["block_row_warps", "ot", 1], ["block_col_warps", "ot", 1], ["warp_row_tiles", "ot", 2], ["warp_col_tiles", "ot", 2], ["chunk", "ot", 8], ["offset", "ot", 8], ["offsetCS", "ot", 8], ["vec", "ot", 4], ["wmma_m", "ot", 8]]}, "result": [[1.0698480999999999e-05], 0, 1.6836864948272705, 1651210774.1361525], "version": 0.2, "tvm_version": "0.8.0"}
{"input": ["cuda -keys=cuda,gpu -max_num_threads=1024 -thread_warp_size=32", "batch_matmul_tensorcore.cuda", [["TENSOR", [256, 64, 32], "float16"], ["TENSOR", [256, 64, 32], "float16"]], {}], "config": {"index": 8160, "code_hash": null, "entity": [["block_row_warps", "ot", 1], ["block_col_warps", "ot", 4], ["warp_row_tiles", "ot", 1], ["warp_col_tiles", "ot", 4], ["chunk", "ot", 1], ["offset", "ot", 8], ["offsetCS", "ot", 0], ["vec", "ot", 4], ["wmma_m", "ot", 16]]}, "result": [[1.7628689000000003e-05], 0, 1.9062035083770752, 1651210774.8730025], "version": 0.2, "tvm_version": "0.8.0"}
{"input": ["cuda -keys=cuda,gpu -max_num_threads=1024 -thread_warp_size=32", "batch_matmul_tensorcore.cuda", [["TENSOR", [256, 64, 32], "float16"], ["TENSOR", [256, 64, 32], "float16"]], {}], "config": {"index": 139, "code_hash": null, "entity": [["block_row_warps", "ot", 2], ["block_col_warps", "ot", 2], ["warp_row_tiles", "ot", 1], ["warp_col_tiles", "ot", 4], ["chunk", "ot", 2], ["offset", "ot", 0], ["offsetCS", "ot", 0], ["vec", "ot", 1], ["wmma_m", "ot", 32]]}, "result": [[2.0316147999999998e-05], 0, 1.759737253189087, 1651210776.0269706], "version": 0.2, "tvm_version": "0.8.0"}
{"input": ["cuda -keys=cuda,gpu -max_num_threads=1024 -thread_warp_size=32", "batch_matmul_tensorcore.cuda", [["TENSOR", [256, 64, 32], "float16"], ["TENSOR", [256, 64, 32], "float16"]], {}], "config": {"index": 15277, "code_hash": null, "entity": [["block_row_warps", "ot", 2], ["block_col_warps", "ot", 2], ["warp_row_tiles", "ot", 4], ["warp_col_tiles", "ot", 2], ["chunk", "ot", 1], ["offset", "ot", 8], ["offsetCS", "ot", 8], ["vec", "ot", 8], ["wmma_m", "ot", 8]]}, "result": [[1.9140566e-05], 0, 1.9312665462493896, 1651210776.7935712], "version": 0.2, "tvm_version": "0.8.0"}
{"input": ["cuda -keys=cuda,gpu -max_num_threads=1024 -thread_warp_size=32", "batch_matmul_tensorcore.cuda", [["TENSOR", [256, 64, 32], "float16"], ["TENSOR", [256, 64, 32], "float16"]], {}], "config": {"index": 14627, "code_hash": null, "entity": [["block_row_warps", "ot", 4], ["block_col_warps", "ot", 1], ["warp_row_tiles", "ot", 4], ["warp_col_tiles", "ot", 2], ["chunk", "ot", 1], ["offset", "ot", 8], ["offsetCS", "ot", 0], ["vec", "ot", 8], ["wmma_m", "ot", 8]]}, "result": [[2.7852363e-05], 0, 2.048722267150879, 1651210778.0110037], "version": 0.2, "tvm_version": "0.8.0"}
{"input": ["cuda -keys=cuda,gpu -max_num_threads=1024 -thread_warp_size=32", "batch_matmul_tensorcore.cuda", [["TENSOR", [256, 64, 32], "float16"], ["TENSOR", [256, 64, 32], "float16"]], {}], "config": {"index": 2006, "code_hash": null, "entity": [["block_row_warps", "ot", 4], ["block_col_warps", "ot", 4], ["warp_row_tiles", "ot", 1], ["warp_col_tiles", "ot", 4], ["chunk", "ot", 1], ["offset", "ot", 0], ["offsetCS", "ot", 8], ["vec", "ot", 2], ["wmma_m", "ot", 32]]}, "result": [[3.5208973e-05], 0, 1.9490320682525635, 1651210778.8232012], "version": 0.2, "tvm_version": "0.8.0"}
{"input": ["cuda -keys=cuda,gpu -max_num_threads=1024 -thread_warp_size=32", "batch_matmul_tensorcore.cuda", [["TENSOR", [256, 64, 32], "float16"], ["TENSOR", [256, 64, 32], "float16"]], {}], "config": {"index": 7027, "code_hash": null, "entity": [["block_row_warps", "ot", 2], ["block_col_warps", "ot", 4], ["warp_row_tiles", "ot", 1], ["warp_col_tiles", "ot", 4], ["chunk", "ot", 4], ["offset", "ot", 8], ["offsetCS", "ot", 0], ["vec", "ot", 2], ["wmma_m", "ot", 16]]}, "result": [[2.0919148e-05], 0, 1.793548822402954, 1651210779.9380298], "version": 0.2, "tvm_version": "0.8.0"}
{"input": ["cuda -keys=cuda,gpu -max_num_threads=1024 -thread_warp_size=32", "batch_matmul_tensorcore.cuda", [["TENSOR", [256, 64, 32], "float16"], ["TENSOR", [256, 64, 32], "float16"]], {}], "config": {"index": 10133, "code_hash": null, "entity": [["block_row_warps", "ot", 4], ["block_col_warps", "ot", 4], ["warp_row_tiles", "ot", 1], ["warp_col_tiles", "ot", 1], ["chunk", "ot", 2], ["offset", "ot", 8], ["offsetCS", "ot", 8], ["vec", "ot", 8], ["wmma_m", "ot", 16]]}, "result": [[7.311318e-05], 0, 2.116936683654785, 1651210781.2968802], "version": 0.2, "tvm_version": "0.8.0"}
{"input": ["cuda -keys=cuda,gpu -max_num_threads=1024 -thread_warp_size=32", "batch_matmul_tensorcore.cuda", [["TENSOR", [256, 64, 32], "float16"], ["TENSOR", [256, 64, 32], "float16"]], {}], "config": {"index": 5518, "code_hash": null, "entity": [["block_row_warps", "ot", 2], ["block_col_warps", "ot", 1], ["warp_row_tiles", "ot", 2], ["warp_col_tiles", "ot", 1], ["chunk", "ot", 1], ["offset", "ot", 8], ["offsetCS", "ot", 0], ["vec", "ot", 1], ["wmma_m", "ot", 16]]}, "result": [[6.926275030902349e-06], 0, 1.7025694847106934, 1651210782.4090803], "version": 0.2, "tvm_version": "0.8.0"}
{"input": ["cuda -keys=cuda,gpu -max_num_threads=1024 -thread_warp_size=32", "batch_matmul_tensorcore.cuda", [["TENSOR", [256, 64, 32], "float16"], ["TENSOR", [256, 64, 32], "float16"]], {}], "config": {"index": 9712, "code_hash": null, "entity": [["block_row_warps", "ot", 2], ["block_col_warps", "ot", 1], ["warp_row_tiles", "ot", 4], ["warp_col_tiles", "ot", 4], ["chunk", "ot", 8], ["offset", "ot", 8], ["offsetCS", "ot", 0], ["vec", "ot", 8], ["wmma_m", "ot", 16]]}, "result": [[1.9126289e-05], 0, 1.6804087162017822, 1651210783.609204], "version": 0.2, "tvm_version": "0.8.0"}
{"input": ["cuda -keys=cuda,gpu -max_num_threads=1024 -thread_warp_size=32", "batch_matmul_tensorcore.cuda", [["TENSOR", [256, 64, 32], "float16"], ["TENSOR", [256, 64, 32], "float16"]], {}], "config": {"index": 11379, "code_hash": null, "entity": [["block_row_warps", "ot", 1], ["block_col_warps", "ot", 2], ["warp_row_tiles", "ot", 2], ["warp_col_tiles", "ot", 2], ["chunk", "ot", 1], ["offset", "ot", 8], ["offsetCS", "ot", 8], ["vec", "ot", 1], ["wmma_m", "ot", 8]]}, "result": [[1.3304896e-05], 0, 1.467322587966919, 1651210784.7593129], "version": 0.2, "tvm_version": "0.8.0"}
{"input": ["cuda -keys=cuda,gpu -max_num_threads=1024 -thread_warp_size=32", "batch_matmul_tensorcore.cuda", [["TENSOR", [256, 64, 32], "float16"], ["TENSOR", [256, 64, 32], "float16"]], {}], "config": {"index": 1995, "code_hash": null, "entity": [["block_row_warps", "ot", 1], ["block_col_warps", "ot", 4], ["warp_row_tiles", "ot", 4], ["warp_col_tiles", "ot", 2], ["chunk", "ot", 1], ["offset", "ot", 0], ["offsetCS", "ot", 8], ["vec", "ot", 2], ["wmma_m", "ot", 32]]}, "result": [[1.4947610999999999e-05], 0, 1.6762480735778809, 1651210785.477548], "version": 0.2, "tvm_version": "0.8.0"}
{"input": ["cuda -keys=cuda,gpu -max_num_threads=1024 -thread_warp_size=32", "batch_matmul_tensorcore.cuda", [["TENSOR", [256, 64, 32], "float16"], ["TENSOR", [256, 64, 32], "float16"]], {}], "config": {"index": 15508, "code_hash": null, "entity": [["block_row_warps", "ot", 2], ["block_col_warps", "ot", 1], ["warp_row_tiles", "ot", 2], ["warp_col_tiles", "ot", 2], ["chunk", "ot", 8], ["offset", "ot", 8], ["offsetCS", "ot", 8], ["vec", "ot", 8], ["wmma_m", "ot", 8]]}, "result": [[9.629770704573547e-06], 0, 1.665825366973877, 1651210786.251992], "version": 0.2, "tvm_version": "0.8.0"}
{"input": ["cuda -keys=cuda,gpu -max_num_threads=1024 -thread_warp_size=32", "batch_matmul_tensorcore.cuda", [["TENSOR", [256, 64, 32], "float16"], ["TENSOR", [256, 64, 32], "float16"]], {}], "config": {"index": 10190, "code_hash": null, "entity": [["block_row_warps", "ot", 4], ["block_col_warps", "ot", 1], ["warp_row_tiles", "ot", 2], ["warp_col_tiles", "ot", 4], ["chunk", "ot", 2], ["offset", "ot", 8], ["offsetCS", "ot", 8], ["vec", "ot", 8], ["wmma_m", "ot", 16]]}, "result": [[1.5120083e-05], 0, 1.8829338550567627, 1651210786.992473], "version": 0.2, "tvm_version": "0.8.0"}
{"input": ["cuda -keys=cuda,gpu -max_num_threads=1024 -thread_warp_size=32", "batch_matmul_tensorcore.cuda", [["TENSOR", [256, 64, 32], "float16"], ["TENSOR", [256, 64, 32], "float16"]], {}], "config": {"index": 14954, "code_hash": null, "entity": [["block_row_warps", "ot", 4], ["block_col_warps", "ot", 2], ["warp_row_tiles", "ot", 4], ["warp_col_tiles", "ot", 2], ["chunk", "ot", 1], ["offset", "ot", 0], ["offsetCS", "ot", 8], ["vec", "ot", 8], ["wmma_m", "ot", 8]]}, "result": [[2.8882959e-05], 0, 1.7518062591552734, 1651210788.1853724], "version": 0.2, "tvm_version": "0.8.0"}
{"input": ["cuda -keys=cuda,gpu -max_num_threads=1024 -thread_warp_size=32", "batch_matmul_tensorcore.cuda", [["TENSOR", [256, 64, 32], "float16"], ["TENSOR", [256, 64, 32], "float16"]], {}], "config": {"index": 3091, "code_hash": null, "entity": [["block_row_warps", "ot", 2], ["block_col_warps", "ot", 2], ["warp_row_tiles", "ot", 2], ["warp_col_tiles", "ot", 1], ["chunk", "ot", 4], ["offset", "ot", 8], ["offsetCS", "ot", 0], ["vec", "ot", 4], ["wmma_m", "ot", 32]]}, "result": [[1.7529841e-05], 0, 1.7350263595581055, 1651210788.90969], "version": 0.2, "tvm_version": "0.8.0"}
{"input": ["cuda -keys=cuda,gpu -max_num_threads=1024 -thread_warp_size=32", "batch_matmul_tensorcore.cuda", [["TENSOR", [256, 64, 32], "float16"], ["TENSOR", [256, 64, 32], "float16"]], {}], "config": {"index": 14383, "code_hash": null, "entity": [["block_row_warps", "ot", 2], ["block_col_warps", "ot", 1], ["warp_row_tiles", "ot", 4], ["warp_col_tiles", "ot", 2], ["chunk", "ot", 2], ["offset", "ot", 0], ["offsetCS", "ot", 0], ["vec", "ot", 8], ["wmma_m", "ot", 8]]}, "result": [[1.2226260999999998e-05], 0, 1.5669288635253906, 1651210789.5356026], "version": 0.2, "tvm_version": "0.8.0"}
{"input": ["cuda -keys=cuda,gpu -max_num_threads=1024 -thread_warp_size=32", "batch_matmul_tensorcore.cuda", [["TENSOR", [256, 64, 32], "float16"], ["TENSOR", [256, 64, 32], "float16"]], {}], "config": {"index": 10707, "code_hash": null, "entity": [["block_row_warps", "ot", 1], ["block_col_warps", "ot", 4], ["warp_row_tiles", "ot", 2], ["warp_col_tiles", "ot", 1], ["chunk", "ot", 1], ["offset", "ot", 8], ["offsetCS", "ot", 0], ["vec", "ot", 1], ["wmma_m", "ot", 8]]}, "result": [[2.0046083999999997e-05], 0, 1.4205944538116455, 1651210790.2595918], "version": 0.2, "tvm_version": "0.8.0"}
{"input": ["cuda -keys=cuda,gpu -max_num_threads=1024 -thread_warp_size=32", "batch_matmul_tensorcore.cuda", [["TENSOR", [256, 64, 32], "float16"], ["TENSOR", [256, 64, 32], "float16"]], {}], "config": {"index": 1194, "code_hash": null, "entity": [["block_row_warps", "ot", 1], ["block_col_warps", "ot", 4], ["warp_row_tiles", "ot", 1], ["warp_col_tiles", "ot", 4], ["chunk", "ot", 4], ["offset", "ot", 8], ["offsetCS", "ot", 8], ["vec", "ot", 1], ["wmma_m", "ot", 32]]}, "result": [[1.1876468e-05], 0, 1.4200694561004639, 1651210791.4301853], "version": 0.2, "tvm_version": "0.8.0"}
{"input": ["cuda -keys=cuda,gpu -max_num_threads=1024 -thread_warp_size=32", "batch_matmul_tensorcore.cuda", [["TENSOR", [256, 64, 32], "float16"], ["TENSOR", [256, 64, 32], "float16"]], {}], "config": {"index": 2851, "code_hash": null, "entity": [["block_row_warps", "ot", 2], ["block_col_warps", "ot", 4], ["warp_row_tiles", "ot", 2], ["warp_col_tiles", "ot", 1], ["chunk", "ot", 8], ["offset", "ot", 0], ["offsetCS", "ot", 0], ["vec", "ot", 4], ["wmma_m", "ot", 32]]}, "result": [[6.5377377e-05], 0, 1.7310576438903809, 1651210792.3069708], "version": 0.2, "tvm_version": "0.8.0"}
{"input": ["cuda -keys=cuda,gpu -max_num_threads=1024 -thread_warp_size=32", "batch_matmul_tensorcore.cuda", [["TENSOR", [256, 64, 32], "float16"], ["TENSOR", [256, 64, 32], "float16"]], {}], "config": {"index": 12317, "code_hash": null, "entity": [["block_row_warps", "ot", 4], ["block_col_warps", "ot", 2], ["warp_row_tiles", "ot", 1], ["warp_col_tiles", "ot", 1], ["chunk", "ot", 1], ["offset", "ot", 0], ["offsetCS", "ot", 8], ["vec", "ot", 2], ["wmma_m", "ot", 8]]}, "result": [[1.8249165000000002e-05], 0, 1.285522699356079, 1651210793.4217293], "version": 0.2, "tvm_version": "0.8.0"}
{"input": ["cuda -keys=cuda,gpu -max_num_threads=1024 -thread_warp_size=32", "batch_matmul_tensorcore.cuda", [["TENSOR", [256, 64, 32], "float16"], ["TENSOR", [256, 64, 32], "float16"]], {}], "config": {"index": 9853, "code_hash": null, "entity": [["block_row_warps", "ot", 2], ["block_col_warps", "ot", 4], ["warp_row_tiles", "ot", 4], ["warp_col_tiles", "ot", 2], ["chunk", "ot", 2], ["offset", "ot", 0], ["offsetCS", "ot", 8], ["vec", "ot", 8], ["wmma_m", "ot", 16]]}, "result": [[2.4403381e-05], 0, 1.4870223999023438, 1651210794.6059456], "version": 0.2, "tvm_version": "0.8.0"}
{"input": ["cuda -keys=cuda,gpu -max_num_threads=1024 -thread_warp_size=32", "batch_matmul_tensorcore.cuda", [["TENSOR", [256, 64, 32], "float16"], ["TENSOR", [256, 64, 32], "float16"]], {}], "config": {"index": 4081, "code_hash": null, "entity": [["block_row_warps", "ot", 2], ["block_col_warps", "ot", 2], ["warp_row_tiles", "ot", 1], ["warp_col_tiles", "ot", 2], ["chunk", "ot", 4], ["offset", "ot", 0], ["offsetCS", "ot", 0], ["vec", "ot", 8], ["wmma_m", "ot", 32]]}, "result": [[3.0699313e-05], 0, 1.3959267139434814, 1651210795.7680528], "version": 0.2, "tvm_version": "0.8.0"}
{"input": ["cuda -keys=cuda,gpu -max_num_threads=1024 -thread_warp_size=32", "batch_matmul_tensorcore.cuda", [["TENSOR", [256, 64, 32], "float16"], ["TENSOR", [256, 64, 32], "float16"]], {}], "config": {"index": 532, "code_hash": null, "entity": [["block_row_warps", "ot", 2], ["block_col_warps", "ot", 1], ["warp_row_tiles", "ot", 4], ["warp_col_tiles", "ot", 2], ["chunk", "ot", 4], ["offset", "ot", 8], ["offsetCS", "ot", 0], ["vec", "ot", 1], ["wmma_m", "ot", 32]]}, "result": [[1.0158625000000001e-05], 0, 1.3233938217163086, 1651210796.851773], "version": 0.2, "tvm_version": "0.8.0"}
{"input": ["cuda -keys=cuda,gpu -max_num_threads=1024 -thread_warp_size=32", "batch_matmul_tensorcore.cuda", [["TENSOR", [256, 64, 32], "float16"], ["TENSOR", [256, 64, 32], "float16"]], {}], "config": {"index": 13214, "code_hash": null, "entity": [["block_row_warps", "ot", 4], ["block_col_warps", "ot", 1], ["warp_row_tiles", "ot", 2], ["warp_col_tiles", "ot", 1], ["chunk", "ot", 8], ["offset", "ot", 0], ["offsetCS", "ot", 0], ["vec", "ot", 4], ["wmma_m", "ot", 8]]}, "result": [[2.3593613000000003e-05], 0, 1.4734418392181396, 1651210797.5795848], "version": 0.2, "tvm_version": "0.8.0"}
{"input": ["cuda -keys=cuda,gpu -max_num_threads=1024 -thread_warp_size=32", "batch_matmul_tensorcore.cuda", [["TENSOR", [256, 64, 32], "float16"], ["TENSOR", [256, 64, 32], "float16"]], {}], "config": {"index": 12808, "code_hash": null, "entity": [["block_row_warps", "ot", 2], ["block_col_warps", "ot", 1], ["warp_row_tiles", "ot", 2], ["warp_col_tiles", "ot", 1], ["chunk", "ot", 4], ["offset", "ot", 8], ["offsetCS", "ot", 8], ["vec", "ot", 2], ["wmma_m", "ot", 8]]}, "result": [[9.888125463535227e-06], 0, 1.3046329021453857, 1651210798.2759829], "version": 0.2, "tvm_version": "0.8.0"}
{"input": ["cuda -keys=cuda,gpu -max_num_threads=1024 -thread_warp_size=32", "batch_matmul_tensorcore.cuda", [["TENSOR", [256, 64, 32], "float16"], ["TENSOR", [256, 64, 32], "float16"]], {}], "config": {"index": 6900, "code_hash": null, "entity": [["block_row_warps", "ot", 1], ["block_col_warps", "ot", 4], ["warp_row_tiles", "ot", 2], ["warp_col_tiles", "ot", 1], ["chunk", "ot", 2], ["offset", "ot", 8], ["offsetCS", "ot", 0], ["vec", "ot", 2], ["wmma_m", "ot", 16]]}, "result": [[1.7561105e-05], 0, 1.357149600982666, 1651210799.4467888], "version": 0.2, "tvm_version": "0.8.0"}
{"input": ["cuda -keys=cuda,gpu -max_num_threads=1024 -thread_warp_size=32", "batch_matmul_tensorcore.cuda", [["TENSOR", [256, 64, 32], "float16"], ["TENSOR", [256, 64, 32], "float16"]], {}], "config": {"index": 778, "code_hash": null, "entity": [["block_row_warps", "ot", 2], ["block_col_warps", "ot", 2], ["warp_row_tiles", "ot", 4], ["warp_col_tiles", "ot", 2], ["chunk", "ot", 2], ["offset", "ot", 0], ["offsetCS", "ot", 8], ["vec", "ot", 1], ["wmma_m", "ot", 32]]}, "result": [[2.0565273999999997e-05], 0, 1.457158088684082, 1651210800.707875], "version": 0.2, "tvm_version": "0.8.0"}
{"input": ["cuda -keys=cuda,gpu -max_num_threads=1024 -thread_warp_size=32", "batch_matmul_tensorcore.cuda", [["TENSOR", [256, 64, 32], "float16"], ["TENSOR", [256, 64, 32], "float16"]], {}], "config": {"index": 5252, "code_hash": null, "entity": [["block_row_warps", "ot", 4], ["block_col_warps", "ot", 2], ["warp_row_tiles", "ot", 2], ["warp_col_tiles", "ot", 4], ["chunk", "ot", 1], ["offset", "ot", 0], ["offsetCS", "ot", 0], ["vec", "ot", 1], ["wmma_m", "ot", 16]]}, "result": [[3.2012967e-05], 0, 1.4750852584838867, 1651210801.9321718], "version": 0.2, "tvm_version": "0.8.0"}
{"input": ["cuda -keys=cuda,gpu -max_num_threads=1024 -thread_warp_size=32", "batch_matmul_tensorcore.cuda", [["TENSOR", [256, 64, 32], "float16"], ["TENSOR", [256, 64, 32], "float16"]], {}], "config": {"index": 1081, "code_hash": null, "entity": [["block_row_warps", "ot", 2], ["block_col_warps", "ot", 1], ["warp_row_tiles", "ot", 1], ["warp_col_tiles", "ot", 2], ["chunk", "ot", 2], ["offset", "ot", 8], ["offsetCS", "ot", 8], ["vec", "ot", 1], ["wmma_m", "ot", 32]]}, "result": [[9.078656983930778e-06], 0, 1.4757542610168457, 1651210802.6068797], "version": 0.2, "tvm_version": "0.8.0"}
{"input": ["cuda -keys=cuda,gpu -max_num_threads=1024 -thread_warp_size=32", "batch_matmul_tensorcore.cuda", [["TENSOR", [256, 64, 32], "float16"], ["TENSOR", [256, 64, 32], "float16"]], {}], "config": {"index": 5188, "code_hash": null, "entity": [["block_row_warps", "ot", 2], ["block_col_warps", "ot", 2], ["warp_row_tiles", "ot", 1], ["warp_col_tiles", "ot", 1], ["chunk", "ot", 1], ["offset", "ot", 0], ["offsetCS", "ot", 0], ["vec", "ot", 1], ["wmma_m", "ot", 16]]}, "result": [[1.5344958e-05], 0, 1.2029027938842773, 1651210803.6992764], "version": 0.2, "tvm_version": "0.8.0"}
{"input": ["cuda -keys=cuda,gpu -max_num_threads=1024 -thread_warp_size=32", "batch_matmul_tensorcore.cuda", [["TENSOR", [256, 64, 32], "float16"], ["TENSOR", [256, 64, 32], "float16"]], {}], "config": {"index": 9339, "code_hash": null, "entity": [["block_row_warps", "ot", 1], ["block_col_warps", "ot", 4], ["warp_row_tiles", "ot", 4], ["warp_col_tiles", "ot", 1], ["chunk", "ot", 8], ["offset", "ot", 0], ["offsetCS", "ot", 0], ["vec", "ot", 8], ["wmma_m", "ot", 16]]}, "result": [[3.2992283999999995e-05], 0, 1.4267451763153076, 1651210804.8828735], "version": 0.2, "tvm_version": "0.8.0"}
{"input": ["cuda -keys=cuda,gpu -max_num_threads=1024 -thread_warp_size=32", "batch_matmul_tensorcore.cuda", [["TENSOR", [256, 64, 32], "float16"], ["TENSOR", [256, 64, 32], "float16"]], {}], "config": {"index": 7826, "code_hash": null, "entity": [["block_row_warps", "ot", 4], ["block_col_warps", "ot", 2], ["warp_row_tiles", "ot", 4], ["warp_col_tiles", "ot", 2], ["chunk", "ot", 1], ["offset", "ot", 0], ["offsetCS", "ot", 0], ["vec", "ot", 4], ["wmma_m", "ot", 16]]}, "result": [[3.0656312e-05], 0, 1.5988402366638184, 1651210805.6206973], "version": 0.2, "tvm_version": "0.8.0"}
{"input": ["cuda -keys=cuda,gpu -max_num_threads=1024 -thread_warp_size=32", "batch_matmul_tensorcore.cuda", [["TENSOR", [256, 64, 32], "float16"], ["TENSOR", [256, 64, 32], "float16"]], {}], "config": {"index": 2664, "code_hash": null, "entity": [["block_row_warps", "ot", 1], ["block_col_warps", "ot", 1], ["warp_row_tiles", "ot", 4], ["warp_col_tiles", "ot", 4], ["chunk", "ot", 1], ["offset", "ot", 0], ["offsetCS", "ot", 0], ["vec", "ot", 4], ["wmma_m", "ot", 32]]}, "result": [[9.963496291718172e-06], 0, 1.4546515941619873, 1651210806.3297958], "version": 0.2, "tvm_version": "0.8.0"}
{"input": ["cuda -keys=cuda,gpu -max_num_threads=1024 -thread_warp_size=32", "batch_matmul_tensorcore.cuda", [["TENSOR", [256, 64, 32], "float16"], ["TENSOR", [256, 64, 32], "float16"]], {}], "config": {"index": 5245, "code_hash": null, "entity": [["block_row_warps", "ot", 2], ["block_col_warps", "ot", 4], ["warp_row_tiles", "ot", 1], ["warp_col_tiles", "ot", 4], ["chunk", "ot", 1], ["offset", "ot", 0], ["offsetCS", "ot", 0], ["vec", "ot", 1], ["wmma_m", "ot", 16]]}, "result": [[2.1939646e-05], 0, 1.14736008644104, 1651210807.456315], "version": 0.2, "tvm_version": "0.8.0"}
{"input": ["cuda -keys=cuda,gpu -max_num_threads=1024 -thread_warp_size=32", "batch_matmul_tensorcore.cuda", [["TENSOR", [256, 64, 32], "float16"], ["TENSOR", [256, 64, 32], "float16"]], {}], "config": {"index": 10070, "code_hash": null, "entity": [["block_row_warps", "ot", 4], ["block_col_warps", "ot", 4], ["warp_row_tiles", "ot", 4], ["warp_col_tiles", "ot", 1], ["chunk", "ot", 1], ["offset", "ot", 8], ["offsetCS", "ot", 8], ["vec", "ot", 8], ["wmma_m", "ot", 16]]}, "result": [[6.7769387e-05], 0, 1.5960195064544678, 1651210808.7711248], "version": 0.2, "tvm_version": "0.8.0"}
{"input": ["cuda -keys=cuda,gpu -max_num_threads=1024 -thread_warp_size=32", "batch_matmul_tensorcore.cuda", [["TENSOR", [256, 64, 32], "float16"], ["TENSOR", [256, 64, 32], "float16"]], {}], "config": {"index": 7037, "code_hash": null, "entity": [["block_row_warps", "ot", 4], ["block_col_warps", "ot", 4], ["warp_row_tiles", "ot", 2], ["warp_col_tiles", "ot", 4], ["chunk", "ot", 4], ["offset", "ot", 8], ["offsetCS", "ot", 0], ["vec", "ot", 2], ["wmma_m", "ot", 16]]}, "result": [[3.3444279000000004e-05], 0, 1.3908824920654297, 1651210809.511399], "version": 0.2, "tvm_version": "0.8.0"}
{"input": ["cuda -keys=cuda,gpu -max_num_threads=1024 -thread_warp_size=32", "batch_matmul_tensorcore.cuda", [["TENSOR", [256, 64, 32], "float16"], ["TENSOR", [256, 64, 32], "float16"]], {}], "config": {"index": 12828, "code_hash": null, "entity": [["block_row_warps", "ot", 1], ["block_col_warps", "ot", 2], ["warp_row_tiles", "ot", 1], ["warp_col_tiles", "ot", 2], ["chunk", "ot", 4], ["offset", "ot", 8], ["offsetCS", "ot", 8], ["vec", "ot", 2], ["wmma_m", "ot", 8]]}, "result": [[8.888062422744129e-06], 0, 1.2194137573242188, 1651210810.569301], "version": 0.2, "tvm_version": "0.8.0"}
{"input": ["cuda -keys=cuda,gpu -max_num_threads=1024 -thread_warp_size=32", "batch_matmul_tensorcore.cuda", [["TENSOR", [256, 64, 32], "float16"], ["TENSOR", [256, 64, 32], "float16"]], {}], "config": {"index": 5861, "code_hash": null, "entity": [["block_row_warps", "ot", 4], ["block_col_warps", "ot", 1], ["warp_row_tiles", "ot", 1], ["warp_col_tiles", "ot", 2], ["chunk", "ot", 1], ["offset", "ot", 0], ["offsetCS", "ot", 8], ["vec", "ot", 1], ["wmma_m", "ot", 16]]}, "result": [[1.1686109e-05], 0, 1.2715187072753906, 1651210811.2524722], "version": 0.2, "tvm_version": "0.8.0"}
{"input": ["cuda -keys=cuda,gpu -max_num_threads=1024 -thread_warp_size=32", "batch_matmul_tensorcore.cuda", [["TENSOR", [256, 64, 32], "float16"], ["TENSOR", [256, 64, 32], "float16"]], {}], "config": {"index": 12920, "code_hash": null, "entity": [["block_row_warps", "ot", 4], ["block_col_warps", "ot", 2], ["warp_row_tiles", "ot", 2], ["warp_col_tiles", "ot", 2], ["chunk", "ot", 8], ["offset", "ot", 8], ["offsetCS", "ot", 8], ["vec", "ot", 2], ["wmma_m", "ot", 8]]}, "result": [[1.6159399e-05], 0, 1.4865539073944092, 1651210812.92229], "version": 0.2, "tvm_version": "0.8.0"}
{"input": ["cuda -keys=cuda,gpu -max_num_threads=1024 -thread_warp_size=32", "batch_matmul_tensorcore.cuda", [["TENSOR", [256, 64, 32], "float16"], ["TENSOR", [256, 64, 32], "float16"]], {}], "config": {"index": 3629, "code_hash": null, "entity": [["block_row_warps", "ot", 4], ["block_col_warps", "ot", 1], ["warp_row_tiles", "ot", 2], ["warp_col_tiles", "ot", 4], ["chunk", "ot", 1], ["offset", "ot", 8], ["offsetCS", "ot", 8], ["vec", "ot", 4], ["wmma_m", "ot", 32]]}, "result": [[1.3776641e-05], 0, 1.2127976417541504, 1651210813.6229203], "version": 0.2, "tvm_version": "0.8.0"}
{"input": ["cuda -keys=cuda,gpu -max_num_threads=1024 -thread_warp_size=32", "batch_matmul_tensorcore.cuda", [["TENSOR", [256, 64, 32], "float16"], ["TENSOR", [256, 64, 32], "float16"]], {}], "config": {"index": 15358, "code_hash": null, "entity": [["block_row_warps", "ot", 2], ["block_col_warps", "ot", 2], ["warp_row_tiles", "ot", 4], ["warp_col_tiles", "ot", 2], ["chunk", "ot", 2], ["offset", "ot", 8], ["offsetCS", "ot", 8], ["vec", "ot", 8], ["wmma_m", "ot", 8]]}, "result": [[1.4963060999999999e-05], 0, 1.3005928993225098, 1651210814.7729497], "version": 0.2, "tvm_version": "0.8.0"}
{"input": ["cuda -keys=cuda,gpu -max_num_threads=1024 -thread_warp_size=32", "batch_matmul_tensorcore.cuda", [["TENSOR", [256, 64, 32], "float16"], ["TENSOR", [256, 64, 32], "float16"]], {}], "config": {"index": 3441, "code_hash": null, "entity": [["block_row_warps", "ot", 1], ["block_col_warps", "ot", 2], ["warp_row_tiles", "ot", 2], ["warp_col_tiles", "ot", 2], ["chunk", "ot", 4], ["offset", "ot", 0], ["offsetCS", "ot", 8], ["vec", "ot", 4], ["wmma_m", "ot", 32]]}, "result": [[1.5889964e-05], 0, 1.4668476581573486, 1651210815.536933], "version": 0.2, "tvm_version": "0.8.0"}
{"input": ["cuda -keys=cuda,gpu -max_num_threads=1024 -thread_warp_size=32", "batch_matmul_tensorcore.cuda", [["TENSOR", [256, 64, 32], "float16"], ["TENSOR", [256, 64, 32], "float16"]], {}], "config": {"index": 8343, "code_hash": null, "entity": [["block_row_warps", "ot", 1], ["block_col_warps", "ot", 1], ["warp_row_tiles", "ot", 1], ["warp_col_tiles", "ot", 1], ["chunk", "ot", 8], ["offset", "ot", 8], ["offsetCS", "ot", 0], ["vec", "ot", 4], ["wmma_m", "ot", 16]]}, "result": [[1.0302083e-05], 0, 1.1328551769256592, 1651210816.6151414], "version": 0.2, "tvm_version": "0.8.0"}
{"input": ["cuda -keys=cuda,gpu -max_num_threads=1024 -thread_warp_size=32", "batch_matmul_tensorcore.cuda", [["TENSOR", [256, 64, 32], "float16"], ["TENSOR", [256, 64, 32], "float16"]], {}], "config": {"index": 8527, "code_hash": null, "entity": [["block_row_warps", "ot", 2], ["block_col_warps", "ot", 2], ["warp_row_tiles", "ot", 4], ["warp_col_tiles", "ot", 1], ["chunk", "ot", 2], ["offset", "ot", 0], ["offsetCS", "ot", 8], ["vec", "ot", 4], ["wmma_m", "ot", 16]]}, "result": [[1.6605980999999998e-05], 0, 1.2636990547180176, 1651210817.743632], "version": 0.2, "tvm_version": "0.8.0"}
{"input": ["cuda -keys=cuda,gpu -max_num_threads=1024 -thread_warp_size=32", "batch_matmul_tensorcore.cuda", [["TENSOR", [256, 64, 32], "float16"], ["TENSOR", [256, 64, 32], "float16"]], {}], "config": {"index": 3679, "code_hash": null, "entity": [["block_row_warps", "ot", 2], ["block_col_warps", "ot", 4], ["warp_row_tiles", "ot", 1], ["warp_col_tiles", "ot", 2], ["chunk", "ot", 2], ["offset", "ot", 8], ["offsetCS", "ot", 8], ["vec", "ot", 4], ["wmma_m", "ot", 32]]}, "result": [[1.6044828e-05], 0, 1.4282097816467285, 1651210818.5081017], "version": 0.2, "tvm_version": "0.8.0"}
{"input": ["cuda -keys=cuda,gpu -max_num_threads=1024 -thread_warp_size=32", "batch_matmul_tensorcore.cuda", [["TENSOR", [256, 64, 32], "float16"], ["TENSOR", [256, 64, 32], "float16"]], {}], "config": {"index": 13312, "code_hash": null, "entity": [["block_row_warps", "ot", 2], ["block_col_warps", "ot", 1], ["warp_row_tiles", "ot", 1], ["warp_col_tiles", "ot", 2], ["chunk", "ot", 1], ["offset", "ot", 8], ["offsetCS", "ot", 0], ["vec", "ot", 4], ["wmma_m", "ot", 8]]}, "result": [[1.6399258e-05], 0, 1.10428786277771, 1651210819.5746348], "version": 0.2, "tvm_version": "0.8.0"}
{"input": ["cuda -keys=cuda,gpu -max_num_threads=1024 -thread_warp_size=32", "batch_matmul_tensorcore.cuda", [["TENSOR", [256, 64, 32], "float16"], ["TENSOR", [256, 64, 32], "float16"]], {}], "config": {"index": 9356, "code_hash": null, "entity": [["block_row_warps", "ot", 4], ["block_col_warps", "ot", 2], ["warp_row_tiles", "ot", 2], ["warp_col_tiles", "ot", 2], ["chunk", "ot", 8], ["offset", "ot", 0], ["offsetCS", "ot", 0], ["vec", "ot", 8], ["wmma_m", "ot", 16]]}, "result": [[7.3272796e-05], 0, 1.3698863983154297, 1651210820.8813562], "version": 0.2, "tvm_version": "0.8.0"}
{"input": ["cuda -keys=cuda,gpu -max_num_threads=1024 -thread_warp_size=32", "batch_matmul_tensorcore.cuda", [["TENSOR", [256, 64, 32], "float16"], ["TENSOR", [256, 64, 32], "float16"]], {}], "config": {"index": 4526, "code_hash": null, "entity": [["block_row_warps", "ot", 4], ["block_col_warps", "ot", 4], ["warp_row_tiles", "ot", 2], ["warp_col_tiles", "ot", 4], ["chunk", "ot", 8], ["offset", "ot", 8], ["offsetCS", "ot", 0], ["vec", "ot", 8], ["wmma_m", "ot", 32]]}, "result": [[4.0076109000000005e-05], 0, 1.1725926399230957, 1651210822.0484836], "version": 0.2, "tvm_version": "0.8.0"}
{"input": ["cuda -keys=cuda,gpu -max_num_threads=1024 -thread_warp_size=32", "batch_matmul_tensorcore.cuda", [["TENSOR", [256, 64, 32], "float16"], ["TENSOR", [256, 64, 32], "float16"]], {}], "config": {"index": 11772, "code_hash": null, "entity": [["block_row_warps", "ot", 1], ["block_col_warps", "ot", 1], ["warp_row_tiles", "ot", 1], ["warp_col_tiles", "ot", 2], ["chunk", "ot", 2], ["offset", "ot", 0], ["offsetCS", "ot", 0], ["vec", "ot", 2], ["wmma_m", "ot", 8]]}, "result": [[8.627769468479604e-06], 0, 0.9971227645874023, 1651210823.0575936], "version": 0.2, "tvm_version": "0.8.0"}
{"input": ["cuda -keys=cuda,gpu -max_num_threads=1024 -thread_warp_size=32", "batch_matmul_tensorcore.cuda", [["TENSOR", [256, 64, 32], "float16"], ["TENSOR", [256, 64, 32], "float16"]], {}], "config": {"index": 188, "code_hash": null, "entity": [["block_row_warps", "ot", 4], ["block_col_warps", "ot", 4], ["warp_row_tiles", "ot", 4], ["warp_col_tiles", "ot", 1], ["chunk", "ot", 4], ["offset", "ot", 0], ["offsetCS", "ot", 0], ["vec", "ot", 1], ["wmma_m", "ot", 32]]}, "result": [[8.145559199999999e-05], 0, 1.436164140701294, 1651210823.8763971], "version": 0.2, "tvm_version": "0.8.0"}
{"input": ["cuda -keys=cuda,gpu -max_num_threads=1024 -thread_warp_size=32", "batch_matmul_tensorcore.cuda", [["TENSOR", [256, 64, 32], "float16"], ["TENSOR", [256, 64, 32], "float16"]], {}], "config": {"index": 2038, "code_hash": null, "entity": [["block_row_warps", "ot", 2], ["block_col_warps", "ot", 2], ["warp_row_tiles", "ot", 2], ["warp_col_tiles", "ot", 1], ["chunk", "ot", 2], ["offset", "ot", 0], ["offsetCS", "ot", 8], ["vec", "ot", 2], ["wmma_m", "ot", 32]]}, "result": [[1.4733872e-05], 0, 1.1086065769195557, 1651210824.5272107], "version": 0.2, "tvm_version": "0.8.0"}
{"input": ["cuda -keys=cuda,gpu -max_num_threads=1024 -thread_warp_size=32", "batch_matmul_tensorcore.cuda", [["TENSOR", [256, 64, 32], "float16"], ["TENSOR", [256, 64, 32], "float16"]], {}], "config": {"index": 5166, "code_hash": null, "entity": [["block_row_warps", "ot", 1], ["block_col_warps", "ot", 1], ["warp_row_tiles", "ot", 2], ["warp_col_tiles", "ot", 4], ["chunk", "ot", 8], ["offset", "ot", 8], ["offsetCS", "ot", 8], ["vec", "ot", 8], ["wmma_m", "ot", 32]]}, "result": [[4.802333432304038e-06], 0, 1.0946130752563477, 1651210825.596286], "version": 0.2, "tvm_version": "0.8.0"}
{"input": ["cuda -keys=cuda,gpu -max_num_threads=1024 -thread_warp_size=32", "batch_matmul_tensorcore.cuda", [["TENSOR", [256, 64, 32], "float16"], ["TENSOR", [256, 64, 32], "float16"]], {}], "config": {"index": 6258, "code_hash": null, "entity": [["block_row_warps", "ot", 1], ["block_col_warps", "ot", 2], ["warp_row_tiles", "ot", 4], ["warp_col_tiles", "ot", 1], ["chunk", "ot", 2], ["offset", "ot", 8], ["offsetCS", "ot", 8], ["vec", "ot", 1], ["wmma_m", "ot", 16]]}, "result": [[8.960980840543882e-06], 0, 1.115807056427002, 1651210826.2571647], "version": 0.2, "tvm_version": "0.8.0"}
{"input": ["cuda -keys=cuda,gpu -max_num_threads=1024 -thread_warp_size=32", "batch_matmul_tensorcore.cuda", [["TENSOR", [256, 64, 32], "float16"], ["TENSOR", [256, 64, 32], "float16"]], {}], "config": {"index": 13563, "code_hash": null, "entity": [["block_row_warps", "ot", 1], ["block_col_warps", "ot", 1], ["warp_row_tiles", "ot", 2], ["warp_col_tiles", "ot", 2], ["chunk", "ot", 8], ["offset", "ot", 8], ["offsetCS", "ot", 0], ["vec", "ot", 4], ["wmma_m", "ot", 8]]}, "result": [[1.0267255999999999e-05], 0, 1.128025770187378, 1651210826.9797957], "version": 0.2, "tvm_version": "0.8.0"}
{"input": ["cuda -keys=cuda,gpu -max_num_threads=1024 -thread_warp_size=32", "batch_matmul_tensorcore.cuda", [["TENSOR", [256, 64, 32], "float16"], ["TENSOR", [256, 64, 32], "float16"]], {}], "config": {"index": 1839, "code_hash": null, "entity": [["block_row_warps", "ot", 1], ["block_col_warps", "ot", 2], ["warp_row_tiles", "ot", 1], ["warp_col_tiles", "ot", 4], ["chunk", "ot", 4], ["offset", "ot", 8], ["offsetCS", "ot", 0], ["vec", "ot", 2], ["wmma_m", "ot", 32]]}, "result": [[1.2260698e-05], 0, 1.1494011878967285, 1651210827.7251654], "version": 0.2, "tvm_version": "0.8.0"}
{"input": ["cuda -keys=cuda,gpu -max_num_threads=1024 -thread_warp_size=32", "batch_matmul_tensorcore.cuda", [["TENSOR", [256, 64, 32], "float16"], ["TENSOR", [256, 64, 32], "float16"]], {}], "config": {"index": 5257, "code_hash": null, "entity": [["block_row_warps", "ot", 2], ["block_col_warps", "ot", 1], ["warp_row_tiles", "ot", 4], ["warp_col_tiles", "ot", 4], ["chunk", "ot", 1], ["offset", "ot", 0], ["offsetCS", "ot", 0], ["vec", "ot", 1], ["wmma_m", "ot", 16]]}, "result": [[1.5020775e-05], 0, 1.2415189743041992, 1651210828.4754677], "version": 0.2, "tvm_version": "0.8.0"}
{"input": ["cuda -keys=cuda,gpu -max_num_threads=1024 -thread_warp_size=32", "batch_matmul_tensorcore.cuda", [["TENSOR", [256, 64, 32], "float16"], ["TENSOR", [256, 64, 32], "float16"]], {}], "config": {"index": 2628, "code_hash": null, "entity": [["block_row_warps", "ot", 1], ["block_col_warps", "ot", 1], ["warp_row_tiles", "ot", 2], ["warp_col_tiles", "ot", 2], ["chunk", "ot", 1], ["offset", "ot", 0], ["offsetCS", "ot", 0], ["vec", "ot", 4], ["wmma_m", "ot", 32]]}, "result": [[1.0692282e-05], 0, 1.26918625831604, 1651210829.2244768], "version": 0.2, "tvm_version": "0.8.0"}
{"input": ["cuda -keys=cuda,gpu -max_num_threads=1024 -thread_warp_size=32", "batch_matmul_tensorcore.cuda", [["TENSOR", [256, 64, 32], "float16"], ["TENSOR", [256, 64, 32], "float16"]], {}], "config": {"index": 11459, "code_hash": null, "entity": [["block_row_warps", "ot", 4], ["block_col_warps", "ot", 1], ["warp_row_tiles", "ot", 2], ["warp_col_tiles", "ot", 2], ["chunk", "ot", 2], ["offset", "ot", 8], ["offsetCS", "ot", 8], ["vec", "ot", 1], ["wmma_m", "ot", 8]]}, "result": [[1.3089931000000001e-05], 0, 1.8041610717773438, 1651210830.35582], "version": 0.2, "tvm_version": "0.8.0"}
{"input": ["cuda -keys=cuda,gpu -max_num_threads=1024 -thread_warp_size=32", "batch_matmul_tensorcore.cuda", [["TENSOR", [256, 64, 32], "float16"], ["TENSOR", [256, 64, 32], "float16"]], {}], "config": {"index": 2161, "code_hash": null, "entity": [["block_row_warps", "ot", 2], ["block_col_warps", "ot", 1], ["warp_row_tiles", "ot", 1], ["warp_col_tiles", "ot", 4], ["chunk", "ot", 4], ["offset", "ot", 0], ["offsetCS", "ot", 8], ["vec", "ot", 2], ["wmma_m", "ot", 32]]}, "result": [[1.4485018e-05], 0, 1.203596830368042, 1651210831.0825217], "version": 0.2, "tvm_version": "0.8.0"}
{"input": ["cuda -keys=cuda,gpu -max_num_threads=1024 -thread_warp_size=32", "batch_matmul_tensorcore.cuda", [["TENSOR", [256, 64, 32], "float16"], ["TENSOR", [256, 64, 32], "float16"]], {}], "config": {"index": 5549, "code_hash": null, "entity": [["block_row_warps", "ot", 4], ["block_col_warps", "ot", 2], ["warp_row_tiles", "ot", 2], ["warp_col_tiles", "ot", 2], ["chunk", "ot", 1], ["offset", "ot", 8], ["offsetCS", "ot", 0], ["vec", "ot", 1], ["wmma_m", "ot", 16]]}, "result": [[2.8500471e-05], 0, 1.313981056213379, 1651210831.9073255], "version": 0.2, "tvm_version": "0.8.0"}
{"input": ["cuda -keys=cuda,gpu -max_num_threads=1024 -thread_warp_size=32", "batch_matmul_tensorcore.cuda", [["TENSOR", [256, 64, 32], "float16"], ["TENSOR", [256, 64, 32], "float16"]], {}], "config": {"index": 15433, "code_hash": null, "entity": [["block_row_warps", "ot", 2], ["block_col_warps", "ot", 4], ["warp_row_tiles", "ot", 2], ["warp_col_tiles", "ot", 2], ["chunk", "ot", 4], ["offset", "ot", 8], ["offsetCS", "ot", 8], ["vec", "ot", 8], ["wmma_m", "ot", 8]]}, "result": [[1.7025837e-05], 0, 1.1120009422302246, 1651210833.0173783], "version": 0.2, "tvm_version": "0.8.0"}
{"input": ["cuda -keys=cuda,gpu -max_num_threads=1024 -thread_warp_size=32", "batch_matmul_tensorcore.cuda", [["TENSOR", [256, 64, 32], "float16"], ["TENSOR", [256, 64, 32], "float16"]], {}], "config": {"index": 8451, "code_hash": null, "entity": [["block_row_warps", "ot", 1], ["block_col_warps", "ot", 1], ["warp_row_tiles", "ot", 1], ["warp_col_tiles", "ot", 2], ["chunk", "ot", 1], ["offset", "ot", 0], ["offsetCS", "ot", 8], ["vec", "ot", 4], ["wmma_m", "ot", 16]]}, "result": [[8.32699629171817e-06], 0, 1.0522172451019287, 1651210833.6770334], "version": 0.2, "tvm_version": "0.8.0"}
{"input": ["cuda -keys=cuda,gpu -max_num_threads=1024 -thread_warp_size=32", "batch_matmul_tensorcore.cuda", [["TENSOR", [256, 64, 32], "float16"], ["TENSOR", [256, 64, 32], "float16"]], {}], "config": {"index": 2529, "code_hash": null, "entity": [["block_row_warps", "ot", 1], ["block_col_warps", "ot", 1], ["warp_row_tiles", "ot", 4], ["warp_col_tiles", "ot", 1], ["chunk", "ot", 8], ["offset", "ot", 8], ["offsetCS", "ot", 8], ["vec", "ot", 2], ["wmma_m", "ot", 32]]}, "result": [[1.8081855e-05], 0, 1.0217182636260986, 1651210834.7615077], "version": 0.2, "tvm_version": "0.8.0"}
{"input": ["cuda -keys=cuda,gpu -max_num_threads=1024 -thread_warp_size=32", "batch_matmul_tensorcore.cuda", [["TENSOR", [256, 64, 32], "float16"], ["TENSOR", [256, 64, 32], "float16"]], {}], "config": {"index": 2805, "code_hash": null, "entity": [["block_row_warps", "ot", 1], ["block_col_warps", "ot", 4], ["warp_row_tiles", "ot", 4], ["warp_col_tiles", "ot", 2], ["chunk", "ot", 4], ["offset", "ot", 0], ["offsetCS", "ot", 0], ["vec", "ot", 4], ["wmma_m", "ot", 32]]}, "result": [[3.9769448e-05], 0, 1.2123034000396729, 1651210835.9974148], "version": 0.2, "tvm_version": "0.8.0"}
{"input": ["cuda -keys=cuda,gpu -max_num_threads=1024 -thread_warp_size=32", "batch_matmul_tensorcore.cuda", [["TENSOR", [256, 64, 32], "float16"], ["TENSOR", [256, 64, 32], "float16"]], {}], "config": {"index": 13489, "code_hash": null, "entity": [["block_row_warps", "ot", 2], ["block_col_warps", "ot", 4], ["warp_row_tiles", "ot", 2], ["warp_col_tiles", "ot", 2], ["chunk", "ot", 4], ["offset", "ot", 8], ["offsetCS", "ot", 0], ["vec", "ot", 4], ["wmma_m", "ot", 8]]}, "result": [[2.2096488e-05], 0, 1.64060640335083, 1651210837.1007102], "version": 0.2, "tvm_version": "0.8.0"}
{"input": ["cuda -keys=cuda,gpu -max_num_threads=1024 -thread_warp_size=32", "batch_matmul_tensorcore.cuda", [["TENSOR", [256, 64, 32], "float16"], ["TENSOR", [256, 64, 32], "float16"]], {}], "config": {"index": 10895, "code_hash": null, "entity": [["block_row_warps", "ot", 4], ["block_col_warps", "ot", 2], ["warp_row_tiles", "ot", 2], ["warp_col_tiles", "ot", 2], ["chunk", "ot", 4], ["offset", "ot", 8], ["offsetCS", "ot", 0], ["vec", "ot", 1], ["wmma_m", "ot", 8]]}, "result": [[2.7183003000000002e-05], 0, 1.082780361175537, 1651210838.2723458], "version": 0.2, "tvm_version": "0.8.0"}
{"input": ["cuda -keys=cuda,gpu -max_num_threads=1024 -thread_warp_size=32", "batch_matmul_tensorcore.cuda", [["TENSOR", [256, 64, 32], "float16"], ["TENSOR", [256, 64, 32], "float16"]], {}], "config": {"index": 4638, "code_hash": null, "entity": [["block_row_warps", "ot", 1], ["block_col_warps", "ot", 2], ["warp_row_tiles", "ot", 4], ["warp_col_tiles", "ot", 1], ["chunk", "ot", 2], ["offset", "ot", 0], ["offsetCS", "ot", 8], ["vec", "ot", 8], ["wmma_m", "ot", 32]]}, "result": [[3.3924714e-05], 0, 1.015960693359375, 1651210839.4157705], "version": 0.2, "tvm_version": "0.8.0"}
{"input": ["cuda -keys=cuda,gpu -max_num_threads=1024 -thread_warp_size=32", "batch_matmul_tensorcore.cuda", [["TENSOR", [256, 64, 32], "float16"], ["TENSOR", [256, 64, 32], "float16"]], {}], "config": {"index": 7488, "code_hash": null, "entity": [["block_row_warps", "ot", 1], ["block_col_warps", "ot", 1], ["warp_row_tiles", "ot", 2], ["warp_col_tiles", "ot", 2], ["chunk", "ot", 1], ["offset", "ot", 8], ["offsetCS", "ot", 8], ["vec", "ot", 2], ["wmma_m", "ot", 16]]}, "result": [[7.57846477132262e-06], 0, 0.9044749736785889, 1651210863.5768392], "version": 0.2, "tvm_version": "0.8.0"}
{"input": ["cuda -keys=cuda,gpu -max_num_threads=1024 -thread_warp_size=32", "batch_matmul_tensorcore.cuda", [["TENSOR", [256, 64, 32], "float16"], ["TENSOR", [256, 64, 32], "float16"]], {}], "config": {"index": 7479, "code_hash": null, "entity": [["block_row_warps", "ot", 1], ["block_col_warps", "ot", 1], ["warp_row_tiles", "ot", 1], ["warp_col_tiles", "ot", 2], ["chunk", "ot", 1], ["offset", "ot", 8], ["offsetCS", "ot", 8], ["vec", "ot", 2], ["wmma_m", "ot", 16]]}, "result": [[8.772781829419036e-06], 0, 0.9666416645050049, 1651210864.2411425], "version": 0.2, "tvm_version": "0.8.0"}
{"input": ["cuda -keys=cuda,gpu -max_num_threads=1024 -thread_warp_size=32", "batch_matmul_tensorcore.cuda", [["TENSOR", [256, 64, 32], "float16"], ["TENSOR", [256, 64, 32], "float16"]], {}], "config": {"index": 6840, "code_hash": null, "entity": [["block_row_warps", "ot", 1], ["block_col_warps", "ot", 1], ["warp_row_tiles", "ot", 2], ["warp_col_tiles", "ot", 2], ["chunk", "ot", 1], ["offset", "ot", 8], ["offsetCS", "ot", 0], ["vec", "ot", 2], ["wmma_m", "ot", 16]]}, "result": [[8.818596415327565e-06], 0, 1.260460376739502, 1651210865.3292882], "version": 0.2, "tvm_version": "0.8.0"}
{"input": ["cuda -keys=cuda,gpu -max_num_threads=1024 -thread_warp_size=32", "batch_matmul_tensorcore.cuda", [["TENSOR", [256, 64, 32], "float16"], ["TENSOR", [256, 64, 32], "float16"]], {}], "config": {"index": 7155, "code_hash": null, "entity": [["block_row_warps", "ot", 1], ["block_col_warps", "ot", 1], ["warp_row_tiles", "ot", 1], ["warp_col_tiles", "ot", 2], ["chunk", "ot", 1], ["offset", "ot", 0], ["offsetCS", "ot", 8], ["vec", "ot", 2], ["wmma_m", "ot", 16]]}, "result": [[9.406265760197775e-06], 0, 1.3586323261260986, 1651210866.0291877], "version": 0.2, "tvm_version": "0.8.0"}
{"input": ["cuda -keys=cuda,gpu -max_num_threads=1024 -thread_warp_size=32", "batch_matmul_tensorcore.cuda", [["TENSOR", [256, 64, 32], "float16"], ["TENSOR", [256, 64, 32], "float16"]], {}], "config": {"index": 12645, "code_hash": null, "entity": [["block_row_warps", "ot", 1], ["block_col_warps", "ot", 1], ["warp_row_tiles", "ot", 2], ["warp_col_tiles", "ot", 1], ["chunk", "ot", 1], ["offset", "ot", 8], ["offsetCS", "ot", 8], ["vec", "ot", 2], ["wmma_m", "ot", 8]]}, "result": [[9.601516687268232e-06], 0, 1.274360179901123, 1651210867.1452913], "version": 0.2, "tvm_version": "0.8.0"}
{"input": ["cuda -keys=cuda,gpu -max_num_threads=1024 -thread_warp_size=32", "batch_matmul_tensorcore.cuda", [["TENSOR", [256, 64, 32], "float16"], ["TENSOR", [256, 64, 32], "float16"]], {}], "config": {"index": 7560, "code_hash": null, "entity": [["block_row_warps", "ot", 1], ["block_col_warps", "ot", 1], ["warp_row_tiles", "ot", 1], ["warp_col_tiles", "ot", 2], ["chunk", "ot", 2], ["offset", "ot", 8], ["offsetCS", "ot", 8], ["vec", "ot", 2], ["wmma_m", "ot", 16]]}, "result": [[8.91871260815822e-06], 0, 1.2153563499450684, 1651210868.2438478], "version": 0.2, "tvm_version": "0.8.0"}
{"input": ["cuda -keys=cuda,gpu -max_num_threads=1024 -thread_warp_size=32", "batch_matmul_tensorcore.cuda", [["TENSOR", [256, 64, 32], "float16"], ["TENSOR", [256, 64, 32], "float16"]], {}], "config": {"index": 7164, "code_hash": null, "entity": [["block_row_warps", "ot", 1], ["block_col_warps", "ot", 1], ["warp_row_tiles", "ot", 2], ["warp_col_tiles", "ot", 2], ["chunk", "ot", 1], ["offset", "ot", 0], ["offsetCS", "ot", 8], ["vec", "ot", 2], ["wmma_m", "ot", 16]]}, "result": [[8.438902348578492e-06], 0, 1.3916397094726562, 1651210868.935364], "version": 0.2, "tvm_version": "0.8.0"}
{"input": ["cuda -keys=cuda,gpu -max_num_threads=1024 -thread_warp_size=32", "batch_matmul_tensorcore.cuda", [["TENSOR", [256, 64, 32], "float16"], ["TENSOR", [256, 64, 32], "float16"]], {}], "config": {"index": 8784, "code_hash": null, "entity": [["block_row_warps", "ot", 1], ["block_col_warps", "ot", 1], ["warp_row_tiles", "ot", 2], ["warp_col_tiles", "ot", 2], ["chunk", "ot", 1], ["offset", "ot", 8], ["offsetCS", "ot", 8], ["vec", "ot", 4], ["wmma_m", "ot", 16]]}, "result": [[7.589092707045735e-06], 0, 1.3040580749511719, 1651210869.6126134], "version": 0.2, "tvm_version": "0.8.0"}
{"input": ["cuda -keys=cuda,gpu -max_num_threads=1024 -thread_warp_size=32", "batch_matmul_tensorcore.cuda", [["TENSOR", [256, 64, 32], "float16"], ["TENSOR", [256, 64, 32], "float16"]], {}], "config": {"index": 7236, "code_hash": null, "entity": [["block_row_warps", "ot", 1], ["block_col_warps", "ot", 1], ["warp_row_tiles", "ot", 1], ["warp_col_tiles", "ot", 2], ["chunk", "ot", 2], ["offset", "ot", 0], ["offsetCS", "ot", 8], ["vec", "ot", 2], ["wmma_m", "ot", 16]]}, "result": [[9.323475278121138e-06], 0, 1.2024738788604736, 1651210870.694097], "version": 0.2, "tvm_version": "0.8.0"}
{"input": ["cuda -keys=cuda,gpu -max_num_threads=1024 -thread_warp_size=32", "batch_matmul_tensorcore.cuda", [["TENSOR", [256, 64, 32], "float16"], ["TENSOR", [256, 64, 32], "float16"]], {}], "config": {"index": 12726, "code_hash": null, "entity": [["block_row_warps", "ot", 1], ["block_col_warps", "ot", 1], ["warp_row_tiles", "ot", 2], ["warp_col_tiles", "ot", 1], ["chunk", "ot", 2], ["offset", "ot", 8], ["offsetCS", "ot", 8], ["vec", "ot", 2], ["wmma_m", "ot", 8]]}, "result": [[9.271967861557479e-06], 0, 1.281468152999878, 1651210871.347063], "version": 0.2, "tvm_version": "0.8.0"}
{"input": ["cuda -keys=cuda,gpu -max_num_threads=1024 -thread_warp_size=32", "batch_matmul_tensorcore.cuda", [["TENSOR", [256, 64, 32], "float16"], ["TENSOR", [256, 64, 32], "float16"]], {}], "config": {"index": 2304, "code_hash": null, "entity": [["block_row_warps", "ot", 1], ["block_col_warps", "ot", 1], ["warp_row_tiles", "ot", 2], ["warp_col_tiles", "ot", 2], ["chunk", "ot", 1], ["offset", "ot", 8], ["offsetCS", "ot", 8], ["vec", "ot", 2], ["wmma_m", "ot", 32]]}, "result": [[8.691998763906057e-06], 0, 1.3126163482666016, 1651210872.4755478], "version": 0.2, "tvm_version": "0.8.0"}
{"input": ["cuda -keys=cuda,gpu -max_num_threads=1024 -thread_warp_size=32", "batch_matmul_tensorcore.cuda", [["TENSOR", [256, 64, 32], "float16"], ["TENSOR", [256, 64, 32], "float16"]], {}], "config": {"index": 7461, "code_hash": null, "entity": [["block_row_warps", "ot", 1], ["block_col_warps", "ot", 1], ["warp_row_tiles", "ot", 2], ["warp_col_tiles", "ot", 1], ["chunk", "ot", 1], ["offset", "ot", 8], ["offsetCS", "ot", 8], ["vec", "ot", 2], ["wmma_m", "ot", 16]]}, "result": [[9.075841161928306e-06], 0, 1.2532660961151123, 1651210873.5417974], "version": 0.2, "tvm_version": "0.8.0"}
{"input": ["cuda -keys=cuda,gpu -max_num_threads=1024 -thread_warp_size=32", "batch_matmul_tensorcore.cuda", [["TENSOR", [256, 64, 32], "float16"], ["TENSOR", [256, 64, 32], "float16"]], {}], "config": {"index": 8460, "code_hash": null, "entity": [["block_row_warps", "ot", 1], ["block_col_warps", "ot", 1], ["warp_row_tiles", "ot", 2], ["warp_col_tiles", "ot", 2], ["chunk", "ot", 1], ["offset", "ot", 0], ["offsetCS", "ot", 8], ["vec", "ot", 4], ["wmma_m", "ot", 16]]}, "result": [[7.656611866501854e-06], 0, 1.2580735683441162, 1651210874.6392858], "version": 0.2, "tvm_version": "0.8.0"}
{"input": ["cuda -keys=cuda,gpu -max_num_threads=1024 -thread_warp_size=32", "batch_matmul_tensorcore.cuda", [["TENSOR", [256, 64, 32], "float16"], ["TENSOR", [256, 64, 32], "float16"]], {}], "config": {"index": 11997, "code_hash": null, "entity": [["block_row_warps", "ot", 1], ["block_col_warps", "ot", 1], ["warp_row_tiles", "ot", 2], ["warp_col_tiles", "ot", 1], ["chunk", "ot", 1], ["offset", "ot", 8], ["offsetCS", "ot", 0], ["vec", "ot", 2], ["wmma_m", "ot", 8]]}, "result": [[8.73525587144623e-06], 0, 1.297285795211792, 1651210875.2917511], "version": 0.2, "tvm_version": "0.8.0"}
{"input": ["cuda -keys=cuda,gpu -max_num_threads=1024 -thread_warp_size=32", "batch_matmul_tensorcore.cuda", [["TENSOR", [256, 64, 32], "float16"], ["TENSOR", [256, 64, 32], "float16"]], {}], "config": {"index": 12078, "code_hash": null, "entity": [["block_row_warps", "ot", 1], ["block_col_warps", "ot", 1], ["warp_row_tiles", "ot", 2], ["warp_col_tiles", "ot", 1], ["chunk", "ot", 2], ["offset", "ot", 8], ["offsetCS", "ot", 0], ["vec", "ot", 2], ["wmma_m", "ot", 8]]}, "result": [[8.650978986402966e-06], 0, 1.3223505020141602, 1651210875.9859574], "version": 0.2, "tvm_version": "0.8.0"}
{"input": ["cuda -keys=cuda,gpu -max_num_threads=1024 -thread_warp_size=32", "batch_matmul_tensorcore.cuda", [["TENSOR", [256, 64, 32], "float16"], ["TENSOR", [256, 64, 32], "float16"]], {}], "config": {"index": 2322, "code_hash": null, "entity": [["block_row_warps", "ot", 1], ["block_col_warps", "ot", 1], ["warp_row_tiles", "ot", 1], ["warp_col_tiles", "ot", 4], ["chunk", "ot", 1], ["offset", "ot", 8], ["offsetCS", "ot", 8], ["vec", "ot", 2], ["wmma_m", "ot", 32]]}, "result": [[7.81582323856613e-06], 0, 1.2324397563934326, 1651210877.082162], "version": 0.2, "tvm_version": "0.8.0"}
{"input": ["cuda -keys=cuda,gpu -max_num_threads=1024 -thread_warp_size=32", "batch_matmul_tensorcore.cuda", [["TENSOR", [256, 64, 32], "float16"], ["TENSOR", [256, 64, 32], "float16"]], {}], "config": {"index": 6516, "code_hash": null, "entity": [["block_row_warps", "ot", 1], ["block_col_warps", "ot", 1], ["warp_row_tiles", "ot", 2], ["warp_col_tiles", "ot", 2], ["chunk", "ot", 1], ["offset", "ot", 0], ["offsetCS", "ot", 0], ["vec", "ot", 2], ["wmma_m", "ot", 16]]}, "result": [[8.206332509270705e-06], 0, 1.2053775787353516, 1651210878.154814], "version": 0.2, "tvm_version": "0.8.0"}
{"input": ["cuda -keys=cuda,gpu -max_num_threads=1024 -thread_warp_size=32", "batch_matmul_tensorcore.cuda", [["TENSOR", [256, 64, 32], "float16"], ["TENSOR", [256, 64, 32], "float16"]], {}], "config": {"index": 12753, "code_hash": null, "entity": [["block_row_warps", "ot", 1], ["block_col_warps", "ot", 1], ["warp_row_tiles", "ot", 2], ["warp_col_tiles", "ot", 2], ["chunk", "ot", 2], ["offset", "ot", 8], ["offsetCS", "ot", 8], ["vec", "ot", 2], ["wmma_m", "ot", 8]]}, "result": [[7.422148949320147e-06], 0, 1.3492050170898438, 1651210878.8584232], "version": 0.2, "tvm_version": "0.8.0"}
{"input": ["cuda -keys=cuda,gpu -max_num_threads=1024 -thread_warp_size=32", "batch_matmul_tensorcore.cuda", [["TENSOR", [256, 64, 32], "float16"], ["TENSOR", [256, 64, 32], "float16"]], {}], "config": {"index": 2385, "code_hash": null, "entity": [["block_row_warps", "ot", 1], ["block_col_warps", "ot", 1], ["warp_row_tiles", "ot", 2], ["warp_col_tiles", "ot", 2], ["chunk", "ot", 2], ["offset", "ot", 8], ["offsetCS", "ot", 8], ["vec", "ot", 2], ["wmma_m", "ot", 32]]}, "result": [[7.916363411619282e-06], 0, 1.3129854202270508, 1651210879.5036836], "version": 0.2, "tvm_version": "0.8.0"}
{"input": ["cuda -keys=cuda,gpu -max_num_threads=1024 -thread_warp_size=32", "batch_matmul_tensorcore.cuda", [["TENSOR", [256, 64, 32], "float16"], ["TENSOR", [256, 64, 32], "float16"]], {}], "config": {"index": 6831, "code_hash": null, "entity": [["block_row_warps", "ot", 1], ["block_col_warps", "ot", 1], ["warp_row_tiles", "ot", 1], ["warp_col_tiles", "ot", 2], ["chunk", "ot", 1], ["offset", "ot", 8], ["offsetCS", "ot", 0], ["vec", "ot", 2], ["wmma_m", "ot", 16]]}, "result": [[1.1165309e-05], 0, 1.181014060974121, 1651210880.5487032], "version": 0.2, "tvm_version": "0.8.0"}
{"input": ["cuda -keys=cuda,gpu -max_num_threads=1024 -thread_warp_size=32", "batch_matmul_tensorcore.cuda", [["TENSOR", [256, 64, 32], "float16"], ["TENSOR", [256, 64, 32], "float16"]], {}], "config": {"index": 6912, "code_hash": null, "entity": [["block_row_warps", "ot", 1], ["block_col_warps", "ot", 1], ["warp_row_tiles", "ot", 1], ["warp_col_tiles", "ot", 2], ["chunk", "ot", 2], ["offset", "ot", 8], ["offsetCS", "ot", 0], ["vec", "ot", 2], ["wmma_m", "ot", 16]]}, "result": [[8.526762051915946e-06], 0, 1.3785536289215088, 1651210881.3017416], "version": 0.2, "tvm_version": "0.8.0"}
{"input": ["cuda -keys=cuda,gpu -max_num_threads=1024 -thread_warp_size=32", "batch_matmul_tensorcore.cuda", [["TENSOR", [256, 64, 32], "float16"], ["TENSOR", [256, 64, 32], "float16"]], {}], "config": {"index": 7569, "code_hash": null, "entity": [["block_row_warps", "ot", 1], ["block_col_warps", "ot", 1], ["warp_row_tiles", "ot", 2], ["warp_col_tiles", "ot", 2], ["chunk", "ot", 2], ["offset", "ot", 8], ["offsetCS", "ot", 8], ["vec", "ot", 2], ["wmma_m", "ot", 16]]}, "result": [[7.397587762669962e-06], 0, 1.2094948291778564, 1651210882.38611], "version": 0.2, "tvm_version": "0.8.0"}
{"input": ["cuda -keys=cuda,gpu -max_num_threads=1024 -thread_warp_size=32", "batch_matmul_tensorcore.cuda", [["TENSOR", [256, 64, 32], "float16"], ["TENSOR", [256, 64, 32], "float16"]], {}], "config": {"index": 2295, "code_hash": null, "entity": [["block_row_warps", "ot", 1], ["block_col_warps", "ot", 1], ["warp_row_tiles", "ot", 1], ["warp_col_tiles", "ot", 2], ["chunk", "ot", 1], ["offset", "ot", 8], ["offsetCS", "ot", 8], ["vec", "ot", 2], ["wmma_m", "ot", 32]]}, "result": [[8.9022521631644e-06], 0, 1.244696855545044, 1651210883.5088587], "version": 0.2, "tvm_version": "0.8.0"}
{"input": ["cuda -keys=cuda,gpu -max_num_threads=1024 -thread_warp_size=32", "batch_matmul_tensorcore.cuda", [["TENSOR", [256, 64, 32], "float16"], ["TENSOR", [256, 64, 32], "float16"]], {}], "config": {"index": 12654, "code_hash": null, "entity": [["block_row_warps", "ot", 1], ["block_col_warps", "ot", 1], ["warp_row_tiles", "ot", 4], ["warp_col_tiles", "ot", 1], ["chunk", "ot", 1], ["offset", "ot", 8], ["offsetCS", "ot", 8], ["vec", "ot", 2], ["wmma_m", "ot", 8]]}, "result": [[7.643789864029666e-06], 0, 1.2655909061431885, 1651210884.203121], "version": 0.2, "tvm_version": "0.8.0"}
{"input": ["cuda -keys=cuda,gpu -max_num_threads=1024 -thread_warp_size=32", "batch_matmul_tensorcore.cuda", [["TENSOR", [256, 64, 32], "float16"], ["TENSOR", [256, 64, 32], "float16"]], {}], "config": {"index": 6813, "code_hash": null, "entity": [["block_row_warps", "ot", 1], ["block_col_warps", "ot", 1], ["warp_row_tiles", "ot", 2], ["warp_col_tiles", "ot", 1], ["chunk", "ot", 1], ["offset", "ot", 8], ["offsetCS", "ot", 0], ["vec", "ot", 2], ["wmma_m", "ot", 16]]}, "result": [[8.563498145859085e-06], 0, 1.1655585765838623, 1651210885.2853506], "version": 0.2, "tvm_version": "0.8.0"}
{"input": ["cuda -keys=cuda,gpu -max_num_threads=1024 -thread_warp_size=32", "batch_matmul_tensorcore.cuda", [["TENSOR", [256, 64, 32], "float16"], ["TENSOR", [256, 64, 32], "float16"]], {}], "config": {"index": 6921, "code_hash": null, "entity": [["block_row_warps", "ot", 1], ["block_col_warps", "ot", 1], ["warp_row_tiles", "ot", 2], ["warp_col_tiles", "ot", 2], ["chunk", "ot", 2], ["offset", "ot", 8], ["offsetCS", "ot", 0], ["vec", "ot", 2], ["wmma_m", "ot", 16]]}, "result": [[7.426333745364647e-06], 0, 1.1639471054077148, 1651210886.3442512], "version": 0.2, "tvm_version": "0.8.0"}
{"input": ["cuda -keys=cuda,gpu -max_num_threads=1024 -thread_warp_size=32", "batch_matmul_tensorcore.cuda", [["TENSOR", [256, 64, 32], "float16"], ["TENSOR", [256, 64, 32], "float16"]], {}], "config": {"index": 1737, "code_hash": null, "entity": [["block_row_warps", "ot", 1], ["block_col_warps", "ot", 1], ["warp_row_tiles", "ot", 2], ["warp_col_tiles", "ot", 2], ["chunk", "ot", 2], ["offset", "ot", 8], ["offsetCS", "ot", 0], ["vec", "ot", 2], ["wmma_m", "ot", 32]]}, "result": [[8.731017923362176e-06], 0, 1.3240947723388672, 1651210887.0413544], "version": 0.2, "tvm_version": "0.8.0"}
{"input": ["cuda -keys=cuda,gpu -max_num_threads=1024 -thread_warp_size=32", "batch_matmul_tensorcore.cuda", [["TENSOR", [256, 64, 32], "float16"], ["TENSOR", [256, 64, 32], "float16"]], {}], "config": {"index": 6507, "code_hash": null, "entity": [["block_row_warps", "ot", 1], ["block_col_warps", "ot", 1], ["warp_row_tiles", "ot", 1], ["warp_col_tiles", "ot", 2], ["chunk", "ot", 1], ["offset", "ot", 0], ["offsetCS", "ot", 0], ["vec", "ot", 2], ["wmma_m", "ot", 16]]}, "result": [[9.309571075401732e-06], 0, 1.2757515907287598, 1651210887.7437892], "version": 0.2, "tvm_version": "0.8.0"}
{"input": ["cuda -keys=cuda,gpu -max_num_threads=1024 -thread_warp_size=32", "batch_matmul_tensorcore.cuda", [["TENSOR", [256, 64, 32], "float16"], ["TENSOR", [256, 64, 32], "float16"]], {}], "config": {"index": 1998, "code_hash": null, "entity": [["block_row_warps", "ot", 1], ["block_col_warps", "ot", 1], ["warp_row_tiles", "ot", 1], ["warp_col_tiles", "ot", 4], ["chunk", "ot", 1], ["offset", "ot", 0], ["offsetCS", "ot", 8], ["vec", "ot", 2], ["wmma_m", "ot", 32]]}, "result": [[7.971202719406674e-06], 0, 1.18880033493042, 1651210888.8163166], "version": 0.2, "tvm_version": "0.8.0"}
{"input": ["cuda -keys=cuda,gpu -max_num_threads=1024 -thread_warp_size=32", "batch_matmul_tensorcore.cuda", [["TENSOR", [256, 64, 32], "float16"], ["TENSOR", [256, 64, 32], "float16"]], {}], "config": {"index": 6588, "code_hash": null, "entity": [["block_row_warps", "ot", 1], ["block_col_warps", "ot", 1], ["warp_row_tiles", "ot", 1], ["warp_col_tiles", "ot", 2], ["chunk", "ot", 2], ["offset", "ot", 0], ["offsetCS", "ot", 0], ["vec", "ot", 2], ["wmma_m", "ot", 16]]}, "result": [[9.016242892459827e-06], 0, 1.317523717880249, 1651210889.530212], "version": 0.2, "tvm_version": "0.8.0"}
{"input": ["cuda -keys=cuda,gpu -max_num_threads=1024 -thread_warp_size=32", "batch_matmul_tensorcore.cuda", [["TENSOR", [256, 64, 32], "float16"], ["TENSOR", [256, 64, 32], "float16"]], {}], "config": {"index": 8136, "code_hash": null, "entity": [["block_row_warps", "ot", 1], ["block_col_warps", "ot", 1], ["warp_row_tiles", "ot", 2], ["warp_col_tiles", "ot", 2], ["chunk", "ot", 1], ["offset", "ot", 8], ["offsetCS", "ot", 0], ["vec", "ot", 4], ["wmma_m", "ot", 16]]}, "result": [[7.446552533992584e-06], 0, 1.184727668762207, 1651210890.6250708], "version": 0.2, "tvm_version": "0.8.0"}
{"input": ["cuda -keys=cuda,gpu -max_num_threads=1024 -thread_warp_size=32", "batch_matmul_tensorcore.cuda", [["TENSOR", [256, 64, 32], "float16"], ["TENSOR", [256, 64, 32], "float16"]], {}], "config": {"index": 6247, "code_hash": null, "entity": [["block_row_warps", "ot", 2], ["block_col_warps", "ot", 1], ["warp_row_tiles", "ot", 2], ["warp_col_tiles", "ot", 1], ["chunk", "ot", 2], ["offset", "ot", 8], ["offsetCS", "ot", 8], ["vec", "ot", 1], ["wmma_m", "ot", 16]]}, "result": [[9.942619283065511e-06], 0, 1.2240447998046875, 1651210891.752861], "version": 0.2, "tvm_version": "0.8.0"}
{"input": ["cuda -keys=cuda,gpu -max_num_threads=1024 -thread_warp_size=32", "batch_matmul_tensorcore.cuda", [["TENSOR", [256, 64, 32], "float16"], ["TENSOR", [256, 64, 32], "float16"]], {}], "config": {"index": 8865, "code_hash": null, "entity": [["block_row_warps", "ot", 1], ["block_col_warps", "ot", 1], ["warp_row_tiles", "ot", 2], ["warp_col_tiles", "ot", 2], ["chunk", "ot", 2], ["offset", "ot", 8], ["offsetCS", "ot", 8], ["vec", "ot", 4], ["wmma_m", "ot", 16]]}, "result": [[7.3897595797280595e-06], 0, 1.2852840423583984, 1651210892.4625561], "version": 0.2, "tvm_version": "0.8.0"}
{"input": ["cuda -keys=cuda,gpu -max_num_threads=1024 -thread_warp_size=32", "batch_matmul_tensorcore.cuda", [["TENSOR", [256, 64, 32], "float16"], ["TENSOR", [256, 64, 32], "float16"]], {}], "config": {"index": 1980, "code_hash": null, "entity": [["block_row_warps", "ot", 1], ["block_col_warps", "ot", 1], ["warp_row_tiles", "ot", 2], ["warp_col_tiles", "ot", 2], ["chunk", "ot", 1], ["offset", "ot", 0], ["offsetCS", "ot", 8], ["vec", "ot", 2], ["wmma_m", "ot", 32]]}, "result": [[8.423044499381953e-06], 0, 1.1475086212158203, 1651210893.5279334], "version": 0.2, "tvm_version": "0.8.0"}
{"input": ["cuda -keys=cuda,gpu -max_num_threads=1024 -thread_warp_size=32", "batch_matmul_tensorcore.cuda", [["TENSOR", [256, 64, 32], "float16"], ["TENSOR", [256, 64, 32], "float16"]], {}], "config": {"index": 1656, "code_hash": null, "entity": [["block_row_warps", "ot", 1], ["block_col_warps", "ot", 1], ["warp_row_tiles", "ot", 2], ["warp_col_tiles", "ot", 2], ["chunk", "ot", 1], ["offset", "ot", 8], ["offsetCS", "ot", 0], ["vec", "ot", 2], ["wmma_m", "ot", 32]]}, "result": [[8.033698393077874e-06], 0, 1.1868302822113037, 1651210894.5988066], "version": 0.2, "tvm_version": "0.8.0"}
{"input": ["cuda -keys=cuda,gpu -max_num_threads=1024 -thread_warp_size=32", "batch_matmul_tensorcore.cuda", [["TENSOR", [256, 64, 32], "float16"], ["TENSOR", [256, 64, 32], "float16"]], {}], "config": {"index": 7515, "code_hash": null, "entity": [["block_row_warps", "ot", 1], ["block_col_warps", "ot", 1], ["warp_row_tiles", "ot", 2], ["warp_col_tiles", "ot", 4], ["chunk", "ot", 1], ["offset", "ot", 8], ["offsetCS", "ot", 8], ["vec", "ot", 2], ["wmma_m", "ot", 16]]}, "result": [[7.758860321384426e-06], 0, 1.3279931545257568, 1651210895.3052616], "version": 0.2, "tvm_version": "0.8.0"}
{"input": ["cuda -keys=cuda,gpu -max_num_threads=1024 -thread_warp_size=32", "batch_matmul_tensorcore.cuda", [["TENSOR", [256, 64, 32], "float16"], ["TENSOR", [256, 64, 32], "float16"]], {}], "config": {"index": 12321, "code_hash": null, "entity": [["block_row_warps", "ot", 1], ["block_col_warps", "ot", 1], ["warp_row_tiles", "ot", 2], ["warp_col_tiles", "ot", 1], ["chunk", "ot", 1], ["offset", "ot", 0], ["offsetCS", "ot", 8], ["vec", "ot", 2], ["wmma_m", "ot", 8]]}, "result": [[1.0376867000000002e-05], 0, 1.2558748722076416, 1651210895.9963477], "version": 0.2, "tvm_version": "0.8.0"}
