python/models/swin_transformer/kernel_configs/swin_transform_auto_tvm_tune_fused_matmul_tensorcore_add_1_64_64_512_128.log
{"input": ["cuda -keys=cuda,gpu -max_num_threads=1024 -thread_warp_size=32", "fused_matmul_tensorcore_add.cuda", [["TENSOR", [4096, 512], "float16"], ["TENSOR", [4096, 512], "float16"], ["TENSOR", [128, 512], "float16"]], {}], "config": {"index": 11696, "code_hash": null, "entity": [["block_row_warps", "ot", 4], ["block_col_warps", "ot", 2], ["warp_row_tiles", "ot", 1], ["warp_col_tiles", "ot", 2], ["chunk", "ot", 1], ["offset", "ot", 0], ["offsetCS", "ot", 0], ["vec", "ot", 2], ["wmma_m", "ot", 8]]}, "result": [[5.236946799999999e-05], 0, 1.1665832996368408, 1651810855.0677004], "version": 0.2, "tvm_version": "0.8.0"}
{"input": ["cuda -keys=cuda,gpu -max_num_threads=1024 -thread_warp_size=32", "fused_matmul_tensorcore_add.cuda", [["TENSOR", [4096, 512], "float16"], ["TENSOR", [4096, 512], "float16"], ["TENSOR", [128, 512], "float16"]], {}], "config": {"index": 1321, "code_hash": null, "entity": [["block_row_warps", "ot", 2], ["block_col_warps", "ot", 4], ["warp_row_tiles", "ot", 4], ["warp_col_tiles", "ot", 1], ["chunk", "ot", 1], ["offset", "ot", 0], ["offsetCS", "ot", 0], ["vec", "ot", 2], ["wmma_m", "ot", 32]]}, "result": [[3.9938026e-05], 0, 1.2425978183746338, 1651810855.8698301], "version": 0.2, "tvm_version": "0.8.0"}
{"input": ["cuda -keys=cuda,gpu -max_num_threads=1024 -thread_warp_size=32", "fused_matmul_tensorcore_add.cuda", [["TENSOR", [4096, 512], "float16"], ["TENSOR", [4096, 512], "float16"], ["TENSOR", [128, 512], "float16"]], {}], "config": {"index": 14130, "code_hash": null, "entity": [["block_row_warps", "ot", 1], ["block_col_warps", "ot", 1], ["warp_row_tiles", "ot", 2], ["warp_col_tiles", "ot", 2], ["chunk", "ot", 4], ["offset", "ot", 8], ["offsetCS", "ot", 8], ["vec", "ot", 4], ["wmma_m", "ot", 8]]}, "result": [[1.9269462999999998e-05], 0, 1.161604642868042, 1651810857.1288314], "version": 0.2, "tvm_version": "0.8.0"}
{"input": ["cuda -keys=cuda,gpu -max_num_threads=1024 -thread_warp_size=32", "fused_matmul_tensorcore_add.cuda", [["TENSOR", [4096, 512], "float16"], ["TENSOR", [4096, 512], "float16"], ["TENSOR", [128, 512], "float16"]], {}], "config": {"index": 4983, "code_hash": null, "entity": [["block_row_warps", "ot", 1], ["block_col_warps", "ot", 4], ["warp_row_tiles", "ot", 2], ["warp_col_tiles", "ot", 2], ["chunk", "ot", 2], ["offset", "ot", 8], ["offsetCS", "ot", 8], ["vec", "ot", 8], ["wmma_m", "ot", 32]]}, "result": [[2.9989337e-05], 0, 1.2684624195098877, 1651810857.9161198], "version": 0.2, "tvm_version": "0.8.0"}
{"input": ["cuda -keys=cuda,gpu -max_num_threads=1024 -thread_warp_size=32", "fused_matmul_tensorcore_add.cuda", [["TENSOR", [4096, 512], "float16"], ["TENSOR", [4096, 512], "float16"], ["TENSOR", [128, 512], "float16"]], {}], "config": {"index": 1923, "code_hash": null, "entity": [["block_row_warps", "ot", 1], ["block_col_warps", "ot", 4], ["warp_row_tiles", "ot", 1], ["warp_col_tiles", "ot", 4], ["chunk", "ot", 8], ["offset", "ot", 8], ["offsetCS", "ot", 0], ["vec", "ot", 2], ["wmma_m", "ot", 32]]}, "result": [[2.6658391e-05], 0, 1.2644047737121582, 1651810859.2160351], "version": 0.2, "tvm_version": "0.8.0"}
{"input": ["cuda -keys=cuda,gpu -max_num_threads=1024 -thread_warp_size=32", "fused_matmul_tensorcore_add.cuda", [["TENSOR", [4096, 512], "float16"], ["TENSOR", [4096, 512], "float16"], ["TENSOR", [128, 512], "float16"]], {}], "config": {"index": 4915, "code_hash": null, "entity": [["block_row_warps", "ot", 2], ["block_col_warps", "ot", 1], ["warp_row_tiles", "ot", 1], ["warp_col_tiles", "ot", 4], ["chunk", "ot", 1], ["offset", "ot", 8], ["offsetCS", "ot", 8], ["vec", "ot", 8], ["wmma_m", "ot", 32]]}, "result": [[3.4473401000000004e-05], 0, 1.1846561431884766, 1651810860.507781], "version": 0.2, "tvm_version": "0.8.0"}
{"input": ["cuda -keys=cuda,gpu -max_num_threads=1024 -thread_warp_size=32", "fused_matmul_tensorcore_add.cuda", [["TENSOR", [4096, 512], "float16"], ["TENSOR", [4096, 512], "float16"], ["TENSOR", [128, 512], "float16"]], {}], "config": {"index": 5850, "code_hash": null, "entity": [["block_row_warps", "ot", 1], ["block_col_warps", "ot", 1], ["warp_row_tiles", "ot", 4], ["warp_col_tiles", "ot", 1], ["chunk", "ot", 1], ["offset", "ot", 0], ["offsetCS", "ot", 8], ["vec", "ot", 1], ["wmma_m", "ot", 16]]}, "result": [[5.686608e-05], 0, 1.2132985591888428, 1651810861.8650525], "version": 0.2, "tvm_version": "0.8.0"}
{"input": ["cuda -keys=cuda,gpu -max_num_threads=1024 -thread_warp_size=32", "fused_matmul_tensorcore_add.cuda", [["TENSOR", [4096, 512], "float16"], ["TENSOR", [4096, 512], "float16"], ["TENSOR", [128, 512], "float16"]], {}], "config": {"index": 4119, "code_hash": null, "entity": [["block_row_warps", "ot", 1], ["block_col_warps", "ot", 4], ["warp_row_tiles", "ot", 2], ["warp_col_tiles", "ot", 4], ["chunk", "ot", 4], ["offset", "ot", 0], ["offsetCS", "ot", 0], ["vec", "ot", 8], ["wmma_m", "ot", 32]]}, "result": [[2.7653865e-05], 0, 1.239123821258545, 1651810862.657967], "version": 0.2, "tvm_version": "0.8.0"}
{"input": ["cuda -keys=cuda,gpu -max_num_threads=1024 -thread_warp_size=32", "fused_matmul_tensorcore_add.cuda", [["TENSOR", [4096, 512], "float16"], ["TENSOR", [4096, 512], "float16"], ["TENSOR", [128, 512], "float16"]], {}], "config": {"index": 3053, "code_hash": null, "entity": [["block_row_warps", "ot", 4], ["block_col_warps", "ot", 1], ["warp_row_tiles", "ot", 1], ["warp_col_tiles", "ot", 4], ["chunk", "ot", 2], ["offset", "ot", 8], ["offsetCS", "ot", 0], ["vec", "ot", 4], ["wmma_m", "ot", 32]]}, "result": [[1.8035206e-05], 0, 1.0900356769561768, 1651810863.8818262], "version": 0.2, "tvm_version": "0.8.0"}
{"input": ["cuda -keys=cuda,gpu -max_num_threads=1024 -thread_warp_size=32", "fused_matmul_tensorcore_add.cuda", [["TENSOR", [4096, 512], "float16"], ["TENSOR", [4096, 512], "float16"], ["TENSOR", [128, 512], "float16"]], {}], "config": {"index": 7102, "code_hash": null, "entity": [["block_row_warps", "ot", 2], ["block_col_warps", "ot", 1], ["warp_row_tiles", "ot", 1], ["warp_col_tiles", "ot", 4], ["chunk", "ot", 8], ["offset", "ot", 8], ["offsetCS", "ot", 0], ["vec", "ot", 2], ["wmma_m", "ot", 16]]}, "result": [[2.3933759e-05], 0, 1.3456218242645264, 1651810864.6683326], "version": 0.2, "tvm_version": "0.8.0"}
{"input": ["cuda -keys=cuda,gpu -max_num_threads=1024 -thread_warp_size=32", "fused_matmul_tensorcore_add.cuda", [["TENSOR", [4096, 512], "float16"], ["TENSOR", [4096, 512], "float16"], ["TENSOR", [128, 512], "float16"]], {}], "config": {"index": 5279, "code_hash": null, "entity": [["block_row_warps", "ot", 4], ["block_col_warps", "ot", 2], ["warp_row_tiles", "ot", 2], ["warp_col_tiles", "ot", 1], ["chunk", "ot", 2], ["offset", "ot", 0], ["offsetCS", "ot", 0], ["vec", "ot", 1], ["wmma_m", "ot", 16]]}, "result": [[5.9345013000000004e-05], 0, 1.3052926063537598, 1651810865.514375], "version": 0.2, "tvm_version": "0.8.0"}
{"input": ["cuda -keys=cuda,gpu -max_num_threads=1024 -thread_warp_size=32", "fused_matmul_tensorcore_add.cuda", [["TENSOR", [4096, 512], "float16"], ["TENSOR", [4096, 512], "float16"], ["TENSOR", [128, 512], "float16"]], {}], "config": {"index": 12323, "code_hash": null, "entity": [["block_row_warps", "ot", 4], ["block_col_warps", "ot", 1], ["warp_row_tiles", "ot", 2], ["warp_col_tiles", "ot", 1], ["chunk", "ot", 1], ["offset", "ot", 0], ["offsetCS", "ot", 8], ["vec", "ot", 2], ["wmma_m", "ot", 8]]}, "result": [[2.1781626e-05], 0, 1.1885080337524414, 1651810866.2989273], "version": 0.2, "tvm_version": "0.8.0"}
{"input": ["cuda -keys=cuda,gpu -max_num_threads=1024 -thread_warp_size=32", "fused_matmul_tensorcore_add.cuda", [["TENSOR", [4096, 512], "float16"], ["TENSOR", [4096, 512], "float16"], ["TENSOR", [128, 512], "float16"]], {}], "config": {"index": 14175, "code_hash": null, "entity": [["block_row_warps", "ot", 1], ["block_col_warps", "ot", 1], ["warp_row_tiles", "ot", 1], ["warp_col_tiles", "ot", 1], ["chunk", "ot", 8], ["offset", "ot", 8], ["offsetCS", "ot", 8], ["vec", "ot", 4], ["wmma_m", "ot", 8]]}, "result": [[4.0361321e-05], 0, 1.1942603588104248, 1651810867.6070974], "version": 0.2, "tvm_version": "0.8.0"}
{"input": ["cuda -keys=cuda,gpu -max_num_threads=1024 -thread_warp_size=32", "fused_matmul_tensorcore_add.cuda", [["TENSOR", [4096, 512], "float16"], ["TENSOR", [4096, 512], "float16"], ["TENSOR", [128, 512], "float16"]], {}], "config": {"index": 11510, "code_hash": null, "entity": [["block_row_warps", "ot", 4], ["block_col_warps", "ot", 4], ["warp_row_tiles", "ot", 1], ["warp_col_tiles", "ot", 1], ["chunk", "ot", 4], ["offset", "ot", 8], ["offsetCS", "ot", 8], ["vec", "ot", 1], ["wmma_m", "ot", 8]]}, "result": [[3.3685899999999995e-05], 0, 1.2090699672698975, 1651810868.3898194], "version": 0.2, "tvm_version": "0.8.0"}
{"input": ["cuda -keys=cuda,gpu -max_num_threads=1024 -thread_warp_size=32", "fused_matmul_tensorcore_add.cuda", [["TENSOR", [4096, 512], "float16"], ["TENSOR", [4096, 512], "float16"], ["TENSOR", [128, 512], "float16"]], {}], "config": {"index": 4254, "code_hash": null, "entity": [["block_row_warps", "ot", 1], ["block_col_warps", "ot", 4], ["warp_row_tiles", "ot", 2], ["warp_col_tiles", "ot", 2], ["chunk", "ot", 1], ["offset", "ot", 8], ["offsetCS", "ot", 0], ["vec", "ot", 8], ["wmma_m", "ot", 32]]}, "result": [[3.663033e-05], 0, 1.1162843704223633, 1651810869.6703365], "version": 0.2, "tvm_version": "0.8.0"}
{"input": ["cuda -keys=cuda,gpu -max_num_threads=1024 -thread_warp_size=32", "fused_matmul_tensorcore_add.cuda", [["TENSOR", [4096, 512], "float16"], ["TENSOR", [4096, 512], "float16"], ["TENSOR", [128, 512], "float16"]], {}], "config": {"index": 12294, "code_hash": null, "entity": [["block_row_warps", "ot", 1], ["block_col_warps", "ot", 1], ["warp_row_tiles", "ot", 2], ["warp_col_tiles", "ot", 4], ["chunk", "ot", 8], ["offset", "ot", 8], ["offsetCS", "ot", 0], ["vec", "ot", 2], ["wmma_m", "ot", 8]]}, "result": [[3.8170075e-05], 0, 1.6752798557281494, 1651810870.8370924], "version": 0.2, "tvm_version": "0.8.0"}
{"input": ["cuda -keys=cuda,gpu -max_num_threads=1024 -thread_warp_size=32", "fused_matmul_tensorcore_add.cuda", [["TENSOR", [4096, 512], "float16"], ["TENSOR", [4096, 512], "float16"], ["TENSOR", [128, 512], "float16"]], {}], "config": {"index": 13196, "code_hash": null, "entity": [["block_row_warps", "ot", 4], ["block_col_warps", "ot", 1], ["warp_row_tiles", "ot", 4], ["warp_col_tiles", "ot", 4], ["chunk", "ot", 4], ["offset", "ot", 0], ["offsetCS", "ot", 0], ["vec", "ot", 4], ["wmma_m", "ot", 8]]}, "result": [[4.5009338e-05], 0, 1.2837903499603271, 1651810872.2197518], "version": 0.2, "tvm_version": "0.8.0"}
{"input": ["cuda -keys=cuda,gpu -max_num_threads=1024 -thread_warp_size=32", "fused_matmul_tensorcore_add.cuda", [["TENSOR", [4096, 512], "float16"], ["TENSOR", [4096, 512], "float16"], ["TENSOR", [128, 512], "float16"]], {}], "config": {"index": 6511, "code_hash": null, "entity": [["block_row_warps", "ot", 2], ["block_col_warps", "ot", 2], ["warp_row_tiles", "ot", 1], ["warp_col_tiles", "ot", 2], ["chunk", "ot", 1], ["offset", "ot", 0], ["offsetCS", "ot", 0], ["vec", "ot", 2], ["wmma_m", "ot", 16]]}, "result": [[3.856954000000001e-05], 0, 1.1336696147918701, 1651810873.5034862], "version": 0.2, "tvm_version": "0.8.0"}
{"input": ["cuda -keys=cuda,gpu -max_num_threads=1024 -thread_warp_size=32", "fused_matmul_tensorcore_add.cuda", [["TENSOR", [4096, 512], "float16"], ["TENSOR", [4096, 512], "float16"], ["TENSOR", [128, 512], "float16"]], {}], "config": {"index": 4023, "code_hash": null, "entity": [["block_row_warps", "ot", 1], ["block_col_warps", "ot", 1], ["warp_row_tiles", "ot", 1], ["warp_col_tiles", "ot", 4], ["chunk", "ot", 2], ["offset", "ot", 0], ["offsetCS", "ot", 0], ["vec", "ot", 8], ["wmma_m", "ot", 32]]}, "result": [[2.5523169e-05], 0, 1.1112675666809082, 1651810874.7915418], "version": 0.2, "tvm_version": "0.8.0"}
{"input": ["cuda -keys=cuda,gpu -max_num_threads=1024 -thread_warp_size=32", "fused_matmul_tensorcore_add.cuda", [["TENSOR", [4096, 512], "float16"], ["TENSOR", [4096, 512], "float16"], ["TENSOR", [128, 512], "float16"]], {}], "config": {"index": 7051, "code_hash": null, "entity": [["block_row_warps", "ot", 2], ["block_col_warps", "ot", 2], ["warp_row_tiles", "ot", 1], ["warp_col_tiles", "ot", 1], ["chunk", "ot", 8], ["offset", "ot", 8], ["offsetCS", "ot", 0], ["vec", "ot", 2], ["wmma_m", "ot", 16]]}, "result": [[2.4839745e-05], 0, 1.342557668685913, 1651811014.333618], "version": 0.2, "tvm_version": "0.8.0"}
{"input": ["cuda -keys=cuda,gpu -max_num_threads=1024 -thread_warp_size=32", "fused_matmul_tensorcore_add.cuda", [["TENSOR", [4096, 512], "float16"], ["TENSOR", [4096, 512], "float16"], ["TENSOR", [128, 512], "float16"]], {}], "config": {"index": 2878, "code_hash": null, "entity": [["block_row_warps", "ot", 2], ["block_col_warps", "ot", 4], ["warp_row_tiles", "ot", 2], ["warp_col_tiles", "ot", 2], ["chunk", "ot", 8], ["offset", "ot", 0], ["offsetCS", "ot", 0], ["vec", "ot", 4], ["wmma_m", "ot", 32]]}, "result": [[7.076824899999999e-05], 0, 1.5640487670898438, 1651811015.744597], "version": 0.2, "tvm_version": "0.8.0"}
{"input": ["cuda -keys=cuda,gpu -max_num_threads=1024 -thread_warp_size=32", "fused_matmul_tensorcore_add.cuda", [["TENSOR", [4096, 512], "float16"], ["TENSOR", [4096, 512], "float16"], ["TENSOR", [128, 512], "float16"]], {}], "config": {"index": 537, "code_hash": null, "entity": [["block_row_warps", "ot", 1], ["block_col_warps", "ot", 4], ["warp_row_tiles", "ot", 4], ["warp_col_tiles", "ot", 2], ["chunk", "ot", 4], ["offset", "ot", 8], ["offsetCS", "ot", 0], ["vec", "ot", 1], ["wmma_m", "ot", 32]]}, "result": [[2.0910474e-05], 0, 1.5738978385925293, 1651811017.0145266], "version": 0.2, "tvm_version": "0.8.0"}
{"input": ["cuda -keys=cuda,gpu -max_num_threads=1024 -thread_warp_size=32", "fused_matmul_tensorcore_add.cuda", [["TENSOR", [4096, 512], "float16"], ["TENSOR", [4096, 512], "float16"], ["TENSOR", [128, 512], "float16"]], {}], "config": {"index": 8776, "code_hash": null, "entity": [["block_row_warps", "ot", 2], ["block_col_warps", "ot", 1], ["warp_row_tiles", "ot", 1], ["warp_col_tiles", "ot", 2], ["chunk", "ot", 1], ["offset", "ot", 8], ["offsetCS", "ot", 8], ["vec", "ot", 4], ["wmma_m", "ot", 16]]}, "result": [[3.7342427e-05], 0, 1.4288411140441895, 1651811018.2900429], "version": 0.2, "tvm_version": "0.8.0"}
{"input": ["cuda -keys=cuda,gpu -max_num_threads=1024 -thread_warp_size=32", "fused_matmul_tensorcore_add.cuda", [["TENSOR", [4096, 512], "float16"], ["TENSOR", [4096, 512], "float16"], ["TENSOR", [128, 512], "float16"]], {}], "config": {"index": 7137, "code_hash": null, "entity": [["block_row_warps", "ot", 1], ["block_col_warps", "ot", 1], ["warp_row_tiles", "ot", 2], ["warp_col_tiles", "ot", 1], ["chunk", "ot", 1], ["offset", "ot", 0], ["offsetCS", "ot", 8], ["vec", "ot", 2], ["wmma_m", "ot", 16]]}, "result": [[3.6994470000000004e-05], 0, 1.3165197372436523, 1651811020.1182694], "version": 0.2, "tvm_version": "0.8.0"}
{"input": ["cuda -keys=cuda,gpu -max_num_threads=1024 -thread_warp_size=32", "fused_matmul_tensorcore_add.cuda", [["TENSOR", [4096, 512], "float16"], ["TENSOR", [4096, 512], "float16"], ["TENSOR", [128, 512], "float16"]], {}], "config": {"index": 6771, "code_hash": null, "entity": [["block_row_warps", "ot", 1], ["block_col_warps", "ot", 2], ["warp_row_tiles", "ot", 4], ["warp_col_tiles", "ot", 2], ["chunk", "ot", 8], ["offset", "ot", 0], ["offsetCS", "ot", 0], ["vec", "ot", 2], ["wmma_m", "ot", 16]]}, "result": [[2.7630416000000003e-05], 0, 1.805518388748169, 1651811020.9287212], "version": 0.2, "tvm_version": "0.8.0"}
{"input": ["cuda -keys=cuda,gpu -max_num_threads=1024 -thread_warp_size=32", "fused_matmul_tensorcore_add.cuda", [["TENSOR", [4096, 512], "float16"], ["TENSOR", [4096, 512], "float16"], ["TENSOR", [128, 512], "float16"]], {}], "config": {"index": 3733, "code_hash": null, "entity": [["block_row_warps", "ot", 2], ["block_col_warps", "ot", 4], ["warp_row_tiles", "ot", 1], ["warp_col_tiles", "ot", 1], ["chunk", "ot", 4], ["offset", "ot", 8], ["offsetCS", "ot", 8], ["vec", "ot", 4], ["wmma_m", "ot", 32]]}, "result": [[1.4131579e-05], 0, 1.0811846256256104, 1651811022.1421177], "version": 0.2, "tvm_version": "0.8.0"}
{"input": ["cuda -keys=cuda,gpu -max_num_threads=1024 -thread_warp_size=32", "fused_matmul_tensorcore_add.cuda", [["TENSOR", [4096, 512], "float16"], ["TENSOR", [4096, 512], "float16"], ["TENSOR", [128, 512], "float16"]], {}], "config": {"index": 9890, "code_hash": null, "entity": [["block_row_warps", "ot", 4], ["block_col_warps", "ot", 4], ["warp_row_tiles", "ot", 1], ["warp_col_tiles", "ot", 1], ["chunk", "ot", 4], ["offset", "ot", 0], ["offsetCS", "ot", 8], ["vec", "ot", 8], ["wmma_m", "ot", 16]]}, "result": [[9.6113187e-05], 0, 1.5220189094543457, 1651811023.040491], "version": 0.2, "tvm_version": "0.8.0"}
{"input": ["cuda -keys=cuda,gpu -max_num_threads=1024 -thread_warp_size=32", "fused_matmul_tensorcore_add.cuda", [["TENSOR", [4096, 512], "float16"], ["TENSOR", [4096, 512], "float16"], ["TENSOR", [128, 512], "float16"]], {}], "config": {"index": 7688, "code_hash": null, "entity": [["block_row_warps", "ot", 4], ["block_col_warps", "ot", 1], ["warp_row_tiles", "ot", 4], ["warp_col_tiles", "ot", 4], ["chunk", "ot", 4], ["offset", "ot", 8], ["offsetCS", "ot", 8], ["vec", "ot", 2], ["wmma_m", "ot", 16]]}, "result": [[1.9076913000000003e-05], 0, 1.3531181812286377, 1651811024.3565977], "version": 0.2, "tvm_version": "0.8.0"}
{"input": ["cuda -keys=cuda,gpu -max_num_threads=1024 -thread_warp_size=32", "fused_matmul_tensorcore_add.cuda", [["TENSOR", [4096, 512], "float16"], ["TENSOR", [4096, 512], "float16"], ["TENSOR", [128, 512], "float16"]], {}], "config": {"index": 683, "code_hash": null, "entity": [["block_row_warps", "ot", 4], ["block_col_warps", "ot", 4], ["warp_row_tiles", "ot", 1], ["warp_col_tiles", "ot", 2], ["chunk", "ot", 1], ["offset", "ot", 0], ["offsetCS", "ot", 8], ["vec", "ot", 1], ["wmma_m", "ot", 32]]}, "result": [[4.1307720000000006e-05], 0, 1.4963884353637695, 1651811025.171397], "version": 0.2, "tvm_version": "0.8.0"}
{"input": ["cuda -keys=cuda,gpu -max_num_threads=1024 -thread_warp_size=32", "fused_matmul_tensorcore_add.cuda", [["TENSOR", [4096, 512], "float16"], ["TENSOR", [4096, 512], "float16"], ["TENSOR", [128, 512], "float16"]], {}], "config": {"index": 1380, "code_hash": null, "entity": [["block_row_warps", "ot", 1], ["block_col_warps", "ot", 2], ["warp_row_tiles", "ot", 1], ["warp_col_tiles", "ot", 1], ["chunk", "ot", 2], ["offset", "ot", 0], ["offsetCS", "ot", 0], ["vec", "ot", 2], ["wmma_m", "ot", 32]]}, "result": [[3.6200595999999996e-05], 0, 1.2588856220245361, 1651811026.4467733], "version": 0.2, "tvm_version": "0.8.0"}
{"input": ["cuda -keys=cuda,gpu -max_num_threads=1024 -thread_warp_size=32", "fused_matmul_tensorcore_add.cuda", [["TENSOR", [4096, 512], "float16"], ["TENSOR", [4096, 512], "float16"], ["TENSOR", [128, 512], "float16"]], {}], "config": {"index": 14921, "code_hash": null, "entity": [["block_row_warps", "ot", 4], ["block_col_warps", "ot", 4], ["warp_row_tiles", "ot", 2], ["warp_col_tiles", "ot", 1], ["chunk", "ot", 1], ["offset", "ot", 0], ["offsetCS", "ot", 8], ["vec", "ot", 8], ["wmma_m", "ot", 8]]}, "result": [[7.809013299999999e-05], 0, 1.4634735584259033, 1651811027.3532407], "version": 0.2, "tvm_version": "0.8.0"}
{"input": ["cuda -keys=cuda,gpu -max_num_threads=1024 -thread_warp_size=32", "fused_matmul_tensorcore_add.cuda", [["TENSOR", [4096, 512], "float16"], ["TENSOR", [4096, 512], "float16"], ["TENSOR", [128, 512], "float16"]], {}], "config": {"index": 6953, "code_hash": null, "entity": [["block_row_warps", "ot", 4], ["block_col_warps", "ot", 2], ["warp_row_tiles", "ot", 2], ["warp_col_tiles", "ot", 4], ["chunk", "ot", 2], ["offset", "ot", 8], ["offsetCS", "ot", 0], ["vec", "ot", 2], ["wmma_m", "ot", 16]]}, "result": [[2.1076269000000002e-05], 0, 1.2676727771759033, 1651811028.5831964], "version": 0.2, "tvm_version": "0.8.0"}
{"input": ["cuda -keys=cuda,gpu -max_num_threads=1024 -thread_warp_size=32", "fused_matmul_tensorcore_add.cuda", [["TENSOR", [4096, 512], "float16"], ["TENSOR", [4096, 512], "float16"], ["TENSOR", [128, 512], "float16"]], {}], "config": {"index": 14787, "code_hash": null, "entity": [["block_row_warps", "ot", 1], ["block_col_warps", "ot", 1], ["warp_row_tiles", "ot", 4], ["warp_col_tiles", "ot", 2], ["chunk", "ot", 4], ["offset", "ot", 8], ["offsetCS", "ot", 0], ["vec", "ot", 8], ["wmma_m", "ot", 8]]}, "result": [[2.1235917e-05], 0, 1.4523189067840576, 1651811029.353257], "version": 0.2, "tvm_version": "0.8.0"}
{"input": ["cuda -keys=cuda,gpu -max_num_threads=1024 -thread_warp_size=32", "fused_matmul_tensorcore_add.cuda", [["TENSOR", [4096, 512], "float16"], ["TENSOR", [4096, 512], "float16"], ["TENSOR", [128, 512], "float16"]], {}], "config": {"index": 11189, "code_hash": null, "entity": [["block_row_warps", "ot", 4], ["block_col_warps", "ot", 1], ["warp_row_tiles", "ot", 2], ["warp_col_tiles", "ot", 1], ["chunk", "ot", 4], ["offset", "ot", 0], ["offsetCS", "ot", 8], ["vec", "ot", 1], ["wmma_m", "ot", 8]]}, "result": [[6.5339875e-05], 0, 1.4351296424865723, 1651811030.7201977], "version": 0.2, "tvm_version": "0.8.0"}
{"input": ["cuda -keys=cuda,gpu -max_num_threads=1024 -thread_warp_size=32", "fused_matmul_tensorcore_add.cuda", [["TENSOR", [4096, 512], "float16"], ["TENSOR", [4096, 512], "float16"], ["TENSOR", [128, 512], "float16"]], {}], "config": {"index": 5428, "code_hash": null, "entity": [["block_row_warps", "ot", 2], ["block_col_warps", "ot", 1], ["warp_row_tiles", "ot", 1], ["warp_col_tiles", "ot", 1], ["chunk", "ot", 8], ["offset", "ot", 0], ["offsetCS", "ot", 0], ["vec", "ot", 1], ["wmma_m", "ot", 16]]}, "result": [[6.3735007e-05], 0, 1.5945496559143066, 1651811031.6638052], "version": 0.2, "tvm_version": "0.8.0"}
{"input": ["cuda -keys=cuda,gpu -max_num_threads=1024 -thread_warp_size=32", "fused_matmul_tensorcore_add.cuda", [["TENSOR", [4096, 512], "float16"], ["TENSOR", [4096, 512], "float16"], ["TENSOR", [128, 512], "float16"]], {}], "config": {"index": 4304, "code_hash": null, "entity": [["block_row_warps", "ot", 4], ["block_col_warps", "ot", 1], ["warp_row_tiles", "ot", 2], ["warp_col_tiles", "ot", 1], ["chunk", "ot", 2], ["offset", "ot", 8], ["offsetCS", "ot", 0], ["vec", "ot", 8], ["wmma_m", "ot", 32]]}, "result": [[3.8053534e-05], 0, 1.3049445152282715, 1651811032.9763753], "version": 0.2, "tvm_version": "0.8.0"}
{"input": ["cuda -keys=cuda,gpu -max_num_threads=1024 -thread_warp_size=32", "fused_matmul_tensorcore_add.cuda", [["TENSOR", [4096, 512], "float16"], ["TENSOR", [4096, 512], "float16"], ["TENSOR", [128, 512], "float16"]], {}], "config": {"index": 6628, "code_hash": null, "entity": [["block_row_warps", "ot", 2], ["block_col_warps", "ot", 2], ["warp_row_tiles", "ot", 2], ["warp_col_tiles", "ot", 4], ["chunk", "ot", 2], ["offset", "ot", 0], ["offsetCS", "ot", 0], ["vec", "ot", 2], ["wmma_m", "ot", 16]]}, "result": [[2.2167105e-05], 0, 1.2723119258880615, 1651811034.2190323], "version": 0.2, "tvm_version": "0.8.0"}
{"input": ["cuda -keys=cuda,gpu -max_num_threads=1024 -thread_warp_size=32", "fused_matmul_tensorcore_add.cuda", [["TENSOR", [4096, 512], "float16"], ["TENSOR", [4096, 512], "float16"], ["TENSOR", [128, 512], "float16"]], {}], "config": {"index": 11843, "code_hash": null, "entity": [["block_row_warps", "ot", 4], ["block_col_warps", "ot", 4], ["warp_row_tiles", "ot", 2], ["warp_col_tiles", "ot", 1], ["chunk", "ot", 4], ["offset", "ot", 0], ["offsetCS", "ot", 0], ["vec", "ot", 2], ["wmma_m", "ot", 8]]}, "result": [[8.284584099999998e-05], 0, 1.4640095233917236, 1651811035.650251], "version": 0.2, "tvm_version": "0.8.0"}
{"input": ["cuda -keys=cuda,gpu -max_num_threads=1024 -thread_warp_size=32", "fused_matmul_tensorcore_add.cuda", [["TENSOR", [4096, 512], "float16"], ["TENSOR", [4096, 512], "float16"], ["TENSOR", [128, 512], "float16"]], {}], "config": {"index": 5648, "code_hash": null, "entity": [["block_row_warps", "ot", 4], ["block_col_warps", "ot", 2], ["warp_row_tiles", "ot", 1], ["warp_col_tiles", "ot", 4], ["chunk", "ot", 2], ["offset", "ot", 8], ["offsetCS", "ot", 0], ["vec", "ot", 1], ["wmma_m", "ot", 16]]}, "result": [[2.0035147e-05], 0, 1.300812005996704, 1651811037.453769], "version": 0.2, "tvm_version": "0.8.0"}
{"input": ["cuda -keys=cuda,gpu -max_num_threads=1024 -thread_warp_size=32", "fused_matmul_tensorcore_add.cuda", [["TENSOR", [4096, 512], "float16"], ["TENSOR", [4096, 512], "float16"], ["TENSOR", [128, 512], "float16"]], {}], "config": {"index": 7896, "code_hash": null, "entity": [["block_row_warps", "ot", 1], ["block_col_warps", "ot", 2], ["warp_row_tiles", "ot", 2], ["warp_col_tiles", "ot", 2], ["chunk", "ot", 2], ["offset", "ot", 0], ["offsetCS", "ot", 0], ["vec", "ot", 4], ["wmma_m", "ot", 16]]}, "result": [[3.8052413e-05], 0, 1.3535735607147217, 1651811038.7257082], "version": 0.2, "tvm_version": "0.8.0"}
{"input": ["cuda -keys=cuda,gpu -max_num_threads=1024 -thread_warp_size=32", "fused_matmul_tensorcore_add.cuda", [["TENSOR", [4096, 512], "float16"], ["TENSOR", [4096, 512], "float16"], ["TENSOR", [128, 512], "float16"]], {}], "config": {"index": 5309, "code_hash": null, "entity": [["block_row_warps", "ot", 4], ["block_col_warps", "ot", 4], ["warp_row_tiles", "ot", 2], ["warp_col_tiles", "ot", 2], ["chunk", "ot", 2], ["offset", "ot", 0], ["offsetCS", "ot", 0], ["vec", "ot", 1], ["wmma_m", "ot", 16]]}, "result": [[7.582766e-05], 0, 1.3499701023101807, 1651811040.1252952], "version": 0.2, "tvm_version": "0.8.0"}
{"input": ["cuda -keys=cuda,gpu -max_num_threads=1024 -thread_warp_size=32", "fused_matmul_tensorcore_add.cuda", [["TENSOR", [4096, 512], "float16"], ["TENSOR", [4096, 512], "float16"], ["TENSOR", [128, 512], "float16"]], {}], "config": {"index": 4675, "code_hash": null, "entity": [["block_row_warps", "ot", 2], ["block_col_warps", "ot", 2], ["warp_row_tiles", "ot", 1], ["warp_col_tiles", "ot", 4], ["chunk", "ot", 2], ["offset", "ot", 0], ["offsetCS", "ot", 8], ["vec", "ot", 8], ["wmma_m", "ot", 32]]}, "result": [[4.0374991e-05], 0, 1.2147166728973389, 1651811041.998999], "version": 0.2, "tvm_version": "0.8.0"}
{"input": ["cuda -keys=cuda,gpu -max_num_threads=1024 -thread_warp_size=32", "fused_matmul_tensorcore_add.cuda", [["TENSOR", [4096, 512], "float16"], ["TENSOR", [4096, 512], "float16"], ["TENSOR", [128, 512], "float16"]], {}], "config": {"index": 7033, "code_hash": null, "entity": [["block_row_warps", "ot", 2], ["block_col_warps", "ot", 2], ["warp_row_tiles", "ot", 2], ["warp_col_tiles", "ot", 4], ["chunk", "ot", 4], ["offset", "ot", 8], ["offsetCS", "ot", 0], ["vec", "ot", 2], ["wmma_m", "ot", 16]]}, "result": [[2.6042871e-05], 0, 1.3955261707305908, 1651811043.2820084], "version": 0.2, "tvm_version": "0.8.0"}
{"input": ["cuda -keys=cuda,gpu -max_num_threads=1024 -thread_warp_size=32", "fused_matmul_tensorcore_add.cuda", [["TENSOR", [4096, 512], "float16"], ["TENSOR", [4096, 512], "float16"], ["TENSOR", [128, 512], "float16"]], {}], "config": {"index": 8060, "code_hash": null, "entity": [["block_row_warps", "ot", 4], ["block_col_warps", "ot", 2], ["warp_row_tiles", "ot", 2], ["warp_col_tiles", "ot", 2], ["chunk", "ot", 8], ["offset", "ot", 0], ["offsetCS", "ot", 0], ["vec", "ot", 4], ["wmma_m", "ot", 16]]}, "result": [[6.0845343e-05], 0, 1.4753458499908447, 1651811044.6637468], "version": 0.2, "tvm_version": "0.8.0"}
{"input": ["cuda -keys=cuda,gpu -max_num_threads=1024 -thread_warp_size=32", "fused_matmul_tensorcore_add.cuda", [["TENSOR", [4096, 512], "float16"], ["TENSOR", [4096, 512], "float16"], ["TENSOR", [128, 512], "float16"]], {}], "config": {"index": 8449, "code_hash": null, "entity": [["block_row_warps", "ot", 2], ["block_col_warps", "ot", 4], ["warp_row_tiles", "ot", 4], ["warp_col_tiles", "ot", 1], ["chunk", "ot", 1], ["offset", "ot", 0], ["offsetCS", "ot", 8], ["vec", "ot", 4], ["wmma_m", "ot", 16]]}, "result": [[2.4868408e-05], 0, 1.303079605102539, 1651811045.9224267], "version": 0.2, "tvm_version": "0.8.0"}
{"input": ["cuda -keys=cuda,gpu -max_num_threads=1024 -thread_warp_size=32", "fused_matmul_tensorcore_add.cuda", [["TENSOR", [4096, 512], "float16"], ["TENSOR", [4096, 512], "float16"], ["TENSOR", [128, 512], "float16"]], {}], "config": {"index": 2412, "code_hash": null, "entity": [["block_row_warps", "ot", 1], ["block_col_warps", "ot", 1], ["warp_row_tiles", "ot", 2], ["warp_col_tiles", "ot", 4], ["chunk", "ot", 2], ["offset", "ot", 8], ["offsetCS", "ot", 8], ["vec", "ot", 2], ["wmma_m", "ot", 32]]}, "result": [[3.4178269999999996e-05], 0, 1.3475537300109863, 1651811047.1963236], "version": 0.2, "tvm_version": "0.8.0"}
{"input": ["cuda -keys=cuda,gpu -max_num_threads=1024 -thread_warp_size=32", "fused_matmul_tensorcore_add.cuda", [["TENSOR", [4096, 512], "float16"], ["TENSOR", [4096, 512], "float16"], ["TENSOR", [128, 512], "float16"]], {}], "config": {"index": 9977, "code_hash": null, "entity": [["block_row_warps", "ot", 4], ["block_col_warps", "ot", 2], ["warp_row_tiles", "ot", 2], ["warp_col_tiles", "ot", 1], ["chunk", "ot", 8], ["offset", "ot", 0], ["offsetCS", "ot", 8], ["vec", "ot", 8], ["wmma_m", "ot", 16]]}, "result": [[8.2177582e-05], 0, 1.4363136291503906, 1651811048.5958827], "version": 0.2, "tvm_version": "0.8.0"}
{"input": ["cuda -keys=cuda,gpu -max_num_threads=1024 -thread_warp_size=32", "fused_matmul_tensorcore_add.cuda", [["TENSOR", [4096, 512], "float16"], ["TENSOR", [4096, 512], "float16"], ["TENSOR", [128, 512], "float16"]], {}], "config": {"index": 334, "code_hash": null, "entity": [["block_row_warps", "ot", 2], ["block_col_warps", "ot", 1], ["warp_row_tiles", "ot", 2], ["warp_col_tiles", "ot", 1], ["chunk", "ot", 1], ["offset", "ot", 8], ["offsetCS", "ot", 0], ["vec", "ot", 1], ["wmma_m", "ot", 32]]}, "result": [[4.3926952e-05], 0, 1.2842628955841064, 1651811049.8852665], "version": 0.2, "tvm_version": "0.8.0"}
{"input": ["cuda -keys=cuda,gpu -max_num_threads=1024 -thread_warp_size=32", "fused_matmul_tensorcore_add.cuda", [["TENSOR", [4096, 512], "float16"], ["TENSOR", [4096, 512], "float16"], ["TENSOR", [128, 512], "float16"]], {}], "config": {"index": 6608, "code_hash": null, "entity": [["block_row_warps", "ot", 4], ["block_col_warps", "ot", 1], ["warp_row_tiles", "ot", 4], ["warp_col_tiles", "ot", 2], ["chunk", "ot", 2], ["offset", "ot", 0], ["offsetCS", "ot", 0], ["vec", "ot", 2], ["wmma_m", "ot", 16]]}, "result": [[2.7114925e-05], 0, 1.2981483936309814, 1651811051.1377838], "version": 0.2, "tvm_version": "0.8.0"}
{"input": ["cuda -keys=cuda,gpu -max_num_threads=1024 -thread_warp_size=32", "fused_matmul_tensorcore_add.cuda", [["TENSOR", [4096, 512], "float16"], ["TENSOR", [4096, 512], "float16"], ["TENSOR", [128, 512], "float16"]], {}], "config": {"index": 2830, "code_hash": null, "entity": [["block_row_warps", "ot", 2], ["block_col_warps", "ot", 2], ["warp_row_tiles", "ot", 4], ["warp_col_tiles", "ot", 4], ["chunk", "ot", 4], ["offset", "ot", 0], ["offsetCS", "ot", 0], ["vec", "ot", 4], ["wmma_m", "ot", 32]]}, "result": [[4.698703799999999e-05], 0, 1.4398090839385986, 1651811052.5372615], "version": 0.2, "tvm_version": "0.8.0"}
{"input": ["cuda -keys=cuda,gpu -max_num_threads=1024 -thread_warp_size=32", "fused_matmul_tensorcore_add.cuda", [["TENSOR", [4096, 512], "float16"], ["TENSOR", [4096, 512], "float16"], ["TENSOR", [128, 512], "float16"]], {}], "config": {"index": 12415, "code_hash": null, "entity": [["block_row_warps", "ot", 2], ["block_col_warps", "ot", 2], ["warp_row_tiles", "ot", 4], ["warp_col_tiles", "ot", 1], ["chunk", "ot", 2], ["offset", "ot", 0], ["offsetCS", "ot", 8], ["vec", "ot", 2], ["wmma_m", "ot", 8]]}, "result": [[2.3211075e-05], 0, 1.1654958724975586, 1651811053.7618635], "version": 0.2, "tvm_version": "0.8.0"}
{"input": ["cuda -keys=cuda,gpu -max_num_threads=1024 -thread_warp_size=32", "fused_matmul_tensorcore_add.cuda", [["TENSOR", [4096, 512], "float16"], ["TENSOR", [4096, 512], "float16"], ["TENSOR", [128, 512], "float16"]], {}], "config": {"index": 6717, "code_hash": null, "entity": [["block_row_warps", "ot", 1], ["block_col_warps", "ot", 2], ["warp_row_tiles", "ot", 4], ["warp_col_tiles", "ot", 4], ["chunk", "ot", 4], ["offset", "ot", 0], ["offsetCS", "ot", 0], ["vec", "ot", 2], ["wmma_m", "ot", 16]]}, "result": [[4.734052e-05], 0, 1.5136466026306152, 1651811056.6486597], "version": 0.2, "tvm_version": "0.8.0"}
{"input": ["cuda -keys=cuda,gpu -max_num_threads=1024 -thread_warp_size=32", "fused_matmul_tensorcore_add.cuda", [["TENSOR", [4096, 512], "float16"], ["TENSOR", [4096, 512], "float16"], ["TENSOR", [128, 512], "float16"]], {}], "config": {"index": 13950, "code_hash": null, "entity": [["block_row_warps", "ot", 1], ["block_col_warps", "ot", 1], ["warp_row_tiles", "ot", 4], ["warp_col_tiles", "ot", 1], ["chunk", "ot", 1], ["offset", "ot", 8], ["offsetCS", "ot", 8], ["vec", "ot", 4], ["wmma_m", "ot", 8]]}, "result": [[3.1135022e-05], 0, 1.1154134273529053, 1651811057.9441836], "version": 0.2, "tvm_version": "0.8.0"}
{"input": ["cuda -keys=cuda,gpu -max_num_threads=1024 -thread_warp_size=32", "fused_matmul_tensorcore_add.cuda", [["TENSOR", [4096, 512], "float16"], ["TENSOR", [4096, 512], "float16"], ["TENSOR", [128, 512], "float16"]], {}], "config": {"index": 7410, "code_hash": null, "entity": [["block_row_warps", "ot", 1], ["block_col_warps", "ot", 2], ["warp_row_tiles", "ot", 2], ["warp_col_tiles", "ot", 2], ["chunk", "ot", 8], ["offset", "ot", 0], ["offsetCS", "ot", 8], ["vec", "ot", 2], ["wmma_m", "ot", 16]]}, "result": [[3.6763078999999996e-05], 0, 1.5473148822784424, 1651811058.7574735], "version": 0.2, "tvm_version": "0.8.0"}
{"input": ["cuda -keys=cuda,gpu -max_num_threads=1024 -thread_warp_size=32", "fused_matmul_tensorcore_add.cuda", [["TENSOR", [4096, 512], "float16"], ["TENSOR", [4096, 512], "float16"], ["TENSOR", [128, 512], "float16"]], {}], "config": {"index": 10096, "code_hash": null, "entity": [["block_row_warps", "ot", 2], ["block_col_warps", "ot", 4], ["warp_row_tiles", "ot", 4], ["warp_col_tiles", "ot", 2], ["chunk", "ot", 1], ["offset", "ot", 8], ["offsetCS", "ot", 8], ["vec", "ot", 8], ["wmma_m", "ot", 16]]}, "result": [[2.235933e-05], 0, 1.4569551944732666, 1651811059.5224376], "version": 0.2, "tvm_version": "0.8.0"}
{"input": ["cuda -keys=cuda,gpu -max_num_threads=1024 -thread_warp_size=32", "fused_matmul_tensorcore_add.cuda", [["TENSOR", [4096, 512], "float16"], ["TENSOR", [4096, 512], "float16"], ["TENSOR", [128, 512], "float16"]], {}], "config": {"index": 15491, "code_hash": null, "entity": [["block_row_warps", "ot", 4], ["block_col_warps", "ot", 1], ["warp_row_tiles", "ot", 4], ["warp_col_tiles", "ot", 1], ["chunk", "ot", 8], ["offset", "ot", 8], ["offsetCS", "ot", 8], ["vec", "ot", 8], ["wmma_m", "ot", 8]]}, "result": [[1.3288085999999999e-05], 0, 1.3344111442565918, 1651811060.3130572], "version": 0.2, "tvm_version": "0.8.0"}
{"input": ["cuda -keys=cuda,gpu -max_num_threads=1024 -thread_warp_size=32", "fused_matmul_tensorcore_add.cuda", [["TENSOR", [4096, 512], "float16"], ["TENSOR", [4096, 512], "float16"], ["TENSOR", [128, 512], "float16"]], {}], "config": {"index": 8303, "code_hash": null, "entity": [["block_row_warps", "ot", 4], ["block_col_warps", "ot", 2], ["warp_row_tiles", "ot", 2], ["warp_col_tiles", "ot", 2], ["chunk", "ot", 4], ["offset", "ot", 8], ["offsetCS", "ot", 0], ["vec", "ot", 4], ["wmma_m", "ot", 16]]}, "result": [[2.6206201e-05], 0, 1.3958029747009277, 1651811061.065226], "version": 0.2, "tvm_version": "0.8.0"}
{"input": ["cuda -keys=cuda,gpu -max_num_threads=1024 -thread_warp_size=32", "fused_matmul_tensorcore_add.cuda", [["TENSOR", [4096, 512], "float16"], ["TENSOR", [4096, 512], "float16"], ["TENSOR", [128, 512], "float16"]], {}], "config": {"index": 10228, "code_hash": null, "entity": [["block_row_warps", "ot", 2], ["block_col_warps", "ot", 2], ["warp_row_tiles", "ot", 4], ["warp_col_tiles", "ot", 1], ["chunk", "ot", 4], ["offset", "ot", 8], ["offsetCS", "ot", 8], ["vec", "ot", 8], ["wmma_m", "ot", 16]]}, "result": [[2.7517175e-05], 0, 1.3960776329040527, 1651811061.8206058], "version": 0.2, "tvm_version": "0.8.0"}
{"input": ["cuda -keys=cuda,gpu -max_num_threads=1024 -thread_warp_size=32", "fused_matmul_tensorcore_add.cuda", [["TENSOR", [4096, 512], "float16"], ["TENSOR", [4096, 512], "float16"], ["TENSOR", [128, 512], "float16"]], {}], "config": {"index": 12836, "code_hash": null, "entity": [["block_row_warps", "ot", 4], ["block_col_warps", "ot", 1], ["warp_row_tiles", "ot", 2], ["warp_col_tiles", "ot", 2], ["chunk", "ot", 4], ["offset", "ot", 8], ["offsetCS", "ot", 8], ["vec", "ot", 2], ["wmma_m", "ot", 8]]}, "result": [[2.5244934e-05], 0, 1.39809250831604, 1651811062.573004], "version": 0.2, "tvm_version": "0.8.0"}
{"input": ["cuda -keys=cuda,gpu -max_num_threads=1024 -thread_warp_size=32", "fused_matmul_tensorcore_add.cuda", [["TENSOR", [4096, 512], "float16"], ["TENSOR", [4096, 512], "float16"], ["TENSOR", [128, 512], "float16"]], {}], "config": {"index": 5057, "code_hash": null, "entity": [["block_row_warps", "ot", 4], ["block_col_warps", "ot", 4], ["warp_row_tiles", "ot", 1], ["warp_col_tiles", "ot", 2], ["chunk", "ot", 4], ["offset", "ot", 8], ["offsetCS", "ot", 8], ["vec", "ot", 8], ["wmma_m", "ot", 32]]}, "result": [[2.3699405e-05], 0, 1.2154943943023682, 1651811063.3112164], "version": 0.2, "tvm_version": "0.8.0"}
{"input": ["cuda -keys=cuda,gpu -max_num_threads=1024 -thread_warp_size=32", "fused_matmul_tensorcore_add.cuda", [["TENSOR", [4096, 512], "float16"], ["TENSOR", [4096, 512], "float16"], ["TENSOR", [128, 512], "float16"]], {}], "config": {"index": 1900, "code_hash": null, "entity": [["block_row_warps", "ot", 2], ["block_col_warps", "ot", 1], ["warp_row_tiles", "ot", 2], ["warp_col_tiles", "ot", 2], ["chunk", "ot", 8], ["offset", "ot", 8], ["offsetCS", "ot", 0], ["vec", "ot", 2], ["wmma_m", "ot", 32]]}, "result": [[3.293925e-05], 0, 1.267951488494873, 1651811064.6503842], "version": 0.2, "tvm_version": "0.8.0"}
{"input": ["cuda -keys=cuda,gpu -max_num_threads=1024 -thread_warp_size=32", "fused_matmul_tensorcore_add.cuda", [["TENSOR", [4096, 512], "float16"], ["TENSOR", [4096, 512], "float16"], ["TENSOR", [128, 512], "float16"]], {}], "config": {"index": 2695, "code_hash": null, "entity": [["block_row_warps", "ot", 2], ["block_col_warps", "ot", 2], ["warp_row_tiles", "ot", 4], ["warp_col_tiles", "ot", 1], ["chunk", "ot", 2], ["offset", "ot", 0], ["offsetCS", "ot", 0], ["vec", "ot", 4], ["wmma_m", "ot", 32]]}, "result": [[5.8561761e-05], 0, 1.4940025806427002, 1651811065.5573816], "version": 0.2, "tvm_version": "0.8.0"}
{"input": ["cuda -keys=cuda,gpu -max_num_threads=1024 -thread_warp_size=32", "fused_matmul_tensorcore_add.cuda", [["TENSOR", [4096, 512], "float16"], ["TENSOR", [4096, 512], "float16"], ["TENSOR", [128, 512], "float16"]], {}], "config": {"index": 2592, "code_hash": null, "entity": [["block_row_warps", "ot", 1], ["block_col_warps", "ot", 1], ["warp_row_tiles", "ot", 1], ["warp_col_tiles", "ot", 1], ["chunk", "ot", 1], ["offset", "ot", 0], ["offsetCS", "ot", 0], ["vec", "ot", 4], ["wmma_m", "ot", 32]]}, "result": [[5.1204268999999995e-05], 0, 1.2763125896453857, 1651811066.8648229], "version": 0.2, "tvm_version": "0.8.0"}
{"input": ["cuda -keys=cuda,gpu -max_num_threads=1024 -thread_warp_size=32", "fused_matmul_tensorcore_add.cuda", [["TENSOR", [4096, 512], "float16"], ["TENSOR", [4096, 512], "float16"], ["TENSOR", [128, 512], "float16"]], {}], "config": {"index": 1001, "code_hash": null, "entity": [["block_row_warps", "ot", 4], ["block_col_warps", "ot", 1], ["warp_row_tiles", "ot", 1], ["warp_col_tiles", "ot", 2], ["chunk", "ot", 1], ["offset", "ot", 8], ["offsetCS", "ot", 8], ["vec", "ot", 1], ["wmma_m", "ot", 32]]}, "result": [[2.8648465000000003e-05], 0, 1.1678721904754639, 1651811067.5859618], "version": 0.2, "tvm_version": "0.8.0"}
{"input": ["cuda -keys=cuda,gpu -max_num_threads=1024 -thread_warp_size=32", "fused_matmul_tensorcore_add.cuda", [["TENSOR", [4096, 512], "float16"], ["TENSOR", [4096, 512], "float16"], ["TENSOR", [128, 512], "float16"]], {}], "config": {"index": 2933, "code_hash": null, "entity": [["block_row_warps", "ot", 4], ["block_col_warps", "ot", 4], ["warp_row_tiles", "ot", 2], ["warp_col_tiles", "ot", 1], ["chunk", "ot", 1], ["offset", "ot", 8], ["offsetCS", "ot", 0], ["vec", "ot", 4], ["wmma_m", "ot", 32]]}, "result": [[3.2628691000000004e-05], 0, 1.2028446197509766, 1651811069.4226105], "version": 0.2, "tvm_version": "0.8.0"}
{"input": ["cuda -keys=cuda,gpu -max_num_threads=1024 -thread_warp_size=32", "fused_matmul_tensorcore_add.cuda", [["TENSOR", [4096, 512], "float16"], ["TENSOR", [4096, 512], "float16"], ["TENSOR", [128, 512], "float16"]], {}], "config": {"index": 14643, "code_hash": null, "entity": [["block_row_warps", "ot", 1], ["block_col_warps", "ot", 1], ["warp_row_tiles", "ot", 2], ["warp_col_tiles", "ot", 4], ["chunk", "ot", 1], ["offset", "ot", 8], ["offsetCS", "ot", 0], ["vec", "ot", 8], ["wmma_m", "ot", 8]]}, "result": [[2.5971309e-05], 0, 1.2534258365631104, 1651811070.1702056], "version": 0.2, "tvm_version": "0.8.0"}
{"input": ["cuda -keys=cuda,gpu -max_num_threads=1024 -thread_warp_size=32", "fused_matmul_tensorcore_add.cuda", [["TENSOR", [4096, 512], "float16"], ["TENSOR", [4096, 512], "float16"], ["TENSOR", [128, 512], "float16"]], {}], "config": {"index": 8076, "code_hash": null, "entity": [["block_row_warps", "ot", 1], ["block_col_warps", "ot", 2], ["warp_row_tiles", "ot", 1], ["warp_col_tiles", "ot", 4], ["chunk", "ot", 8], ["offset", "ot", 0], ["offsetCS", "ot", 0], ["vec", "ot", 4], ["wmma_m", "ot", 16]]}, "result": [[3.3613424000000005e-05], 0, 1.5300583839416504, 1651811070.9564908], "version": 0.2, "tvm_version": "0.8.0"}
{"input": ["cuda -keys=cuda,gpu -max_num_threads=1024 -thread_warp_size=32", "fused_matmul_tensorcore_add.cuda", [["TENSOR", [4096, 512], "float16"], ["TENSOR", [4096, 512], "float16"], ["TENSOR", [128, 512], "float16"]], {}], "config": {"index": 3612, "code_hash": null, "entity": [["block_row_warps", "ot", 1], ["block_col_warps", "ot", 2], ["warp_row_tiles", "ot", 4], ["warp_col_tiles", "ot", 2], ["chunk", "ot", 1], ["offset", "ot", 8], ["offsetCS", "ot", 8], ["vec", "ot", 4], ["wmma_m", "ot", 32]]}, "result": [[3.901323099999999e-05], 0, 1.4680352210998535, 1651811071.7856736], "version": 0.2, "tvm_version": "0.8.0"}
{"input": ["cuda -keys=cuda,gpu -max_num_threads=1024 -thread_warp_size=32", "fused_matmul_tensorcore_add.cuda", [["TENSOR", [4096, 512], "float16"], ["TENSOR", [4096, 512], "float16"], ["TENSOR", [128, 512], "float16"]], {}], "config": {"index": 11223, "code_hash": null, "entity": [["block_row_warps", "ot", 1], ["block_col_warps", "ot", 1], ["warp_row_tiles", "ot", 4], ["warp_col_tiles", "ot", 2], ["chunk", "ot", 4], ["offset", "ot", 0], ["offsetCS", "ot", 8], ["vec", "ot", 1], ["wmma_m", "ot", 8]]}, "result": [[7.3907008e-05], 0, 1.446918249130249, 1651811073.1913424], "version": 0.2, "tvm_version": "0.8.0"}
{"input": ["cuda -keys=cuda,gpu -max_num_threads=1024 -thread_warp_size=32", "fused_matmul_tensorcore_add.cuda", [["TENSOR", [4096, 512], "float16"], ["TENSOR", [4096, 512], "float16"], ["TENSOR", [128, 512], "float16"]], {}], "config": {"index": 25, "code_hash": null, "entity": [["block_row_warps", "ot", 2], ["block_col_warps", "ot", 4], ["warp_row_tiles", "ot", 4], ["warp_col_tiles", "ot", 1], ["chunk", "ot", 1], ["offset", "ot", 0], ["offsetCS", "ot", 0], ["vec", "ot", 1], ["wmma_m", "ot", 32]]}, "result": [[3.7632156e-05], 0, 1.2119951248168945, 1651811073.943296], "version": 0.2, "tvm_version": "0.8.0"}
{"input": ["cuda -keys=cuda,gpu -max_num_threads=1024 -thread_warp_size=32", "fused_matmul_tensorcore_add.cuda", [["TENSOR", [4096, 512], "float16"], ["TENSOR", [4096, 512], "float16"], ["TENSOR", [128, 512], "float16"]], {}], "config": {"index": 12262, "code_hash": null, "entity": [["block_row_warps", "ot", 2], ["block_col_warps", "ot", 2], ["warp_row_tiles", "ot", 1], ["warp_col_tiles", "ot", 2], ["chunk", "ot", 8], ["offset", "ot", 8], ["offsetCS", "ot", 0], ["vec", "ot", 2], ["wmma_m", "ot", 8]]}, "result": [[1.8361280000000002e-05], 0, 1.4875996112823486, 1651811074.7388675], "version": 0.2, "tvm_version": "0.8.0"}
{"input": ["cuda -keys=cuda,gpu -max_num_threads=1024 -thread_warp_size=32", "fused_matmul_tensorcore_add.cuda", [["TENSOR", [4096, 512], "float16"], ["TENSOR", [4096, 512], "float16"], ["TENSOR", [128, 512], "float16"]], {}], "config": {"index": 5629, "code_hash": null, "entity": [["block_row_warps", "ot", 2], ["block_col_warps", "ot", 2], ["warp_row_tiles", "ot", 2], ["warp_col_tiles", "ot", 2], ["chunk", "ot", 2], ["offset", "ot", 8], ["offsetCS", "ot", 0], ["vec", "ot", 1], ["wmma_m", "ot", 16]]}, "result": [[1.9351175e-05], 0, 1.2979142665863037, 1651811075.4413908], "version": 0.2, "tvm_version": "0.8.0"}
{"input": ["cuda -keys=cuda,gpu -max_num_threads=1024 -thread_warp_size=32", "fused_matmul_tensorcore_add.cuda", [["TENSOR", [4096, 512], "float16"], ["TENSOR", [4096, 512], "float16"], ["TENSOR", [128, 512], "float16"]], {}], "config": {"index": 2089, "code_hash": null, "entity": [["block_row_warps", "ot", 2], ["block_col_warps", "ot", 1], ["warp_row_tiles", "ot", 2], ["warp_col_tiles", "ot", 4], ["chunk", "ot", 2], ["offset", "ot", 0], ["offsetCS", "ot", 8], ["vec", "ot", 2], ["wmma_m", "ot", 32]]}, "result": [[4.3432930000000004e-05], 0, 1.2607207298278809, 1651811076.7497683], "version": 0.2, "tvm_version": "0.8.0"}
{"input": ["cuda -keys=cuda,gpu -max_num_threads=1024 -thread_warp_size=32", "fused_matmul_tensorcore_add.cuda", [["TENSOR", [4096, 512], "float16"], ["TENSOR", [4096, 512], "float16"], ["TENSOR", [128, 512], "float16"]], {}], "config": {"index": 10569, "code_hash": null, "entity": [["block_row_warps", "ot", 1], ["block_col_warps", "ot", 2], ["warp_row_tiles", "ot", 2], ["warp_col_tiles", "ot", 2], ["chunk", "ot", 4], ["offset", "ot", 0], ["offsetCS", "ot", 0], ["vec", "ot", 1], ["wmma_m", "ot", 8]]}, "result": [[4.9672412e-05], 0, 1.4594862461090088, 1651811077.6549613], "version": 0.2, "tvm_version": "0.8.0"}
{"input": ["cuda -keys=cuda,gpu -max_num_threads=1024 -thread_warp_size=32", "fused_matmul_tensorcore_add.cuda", [["TENSOR", [4096, 512], "float16"], ["TENSOR", [4096, 512], "float16"], ["TENSOR", [128, 512], "float16"]], {}], "config": {"index": 10189, "code_hash": null, "entity": [["block_row_warps", "ot", 2], ["block_col_warps", "ot", 1], ["warp_row_tiles", "ot", 2], ["warp_col_tiles", "ot", 4], ["chunk", "ot", 2], ["offset", "ot", 8], ["offsetCS", "ot", 8], ["vec", "ot", 8], ["wmma_m", "ot", 16]]}, "result": [[1.6426529e-05], 0, 1.2972135543823242, 1651811078.3876472], "version": 0.2, "tvm_version": "0.8.0"}
{"input": ["cuda -keys=cuda,gpu -max_num_threads=1024 -thread_warp_size=32", "fused_matmul_tensorcore_add.cuda", [["TENSOR", [4096, 512], "float16"], ["TENSOR", [4096, 512], "float16"], ["TENSOR", [128, 512], "float16"]], {}], "config": {"index": 5258, "code_hash": null, "entity": [["block_row_warps", "ot", 4], ["block_col_warps", "ot", 1], ["warp_row_tiles", "ot", 4], ["warp_col_tiles", "ot", 4], ["chunk", "ot", 1], ["offset", "ot", 0], ["offsetCS", "ot", 0], ["vec", "ot", 1], ["wmma_m", "ot", 16]]}, "result": [[7.048887000000001e-05], 0, 1.33756422996521, 1651811079.7860985], "version": 0.2, "tvm_version": "0.8.0"}
{"input": ["cuda -keys=cuda,gpu -max_num_threads=1024 -thread_warp_size=32", "fused_matmul_tensorcore_add.cuda", [["TENSOR", [4096, 512], "float16"], ["TENSOR", [4096, 512], "float16"], ["TENSOR", [128, 512], "float16"]], {}], "config": {"index": 12320, "code_hash": null, "entity": [["block_row_warps", "ot", 4], ["block_col_warps", "ot", 4], ["warp_row_tiles", "ot", 1], ["warp_col_tiles", "ot", 1], ["chunk", "ot", 1], ["offset", "ot", 0], ["offsetCS", "ot", 8], ["vec", "ot", 2], ["wmma_m", "ot", 8]]}, "result": [[3.4228585000000005e-05], 0, 1.1196343898773193, 1651811081.0847208], "version": 0.2, "tvm_version": "0.8.0"}
{"input": ["cuda -keys=cuda,gpu -max_num_threads=1024 -thread_warp_size=32", "fused_matmul_tensorcore_add.cuda", [["TENSOR", [4096, 512], "float16"], ["TENSOR", [4096, 512], "float16"], ["TENSOR", [128, 512], "float16"]], {}], "config": {"index": 10293, "code_hash": null, "entity": [["block_row_warps", "ot", 1], ["block_col_warps", "ot", 4], ["warp_row_tiles", "ot", 1], ["warp_col_tiles", "ot", 1], ["chunk", "ot", 8], ["offset", "ot", 8], ["offsetCS", "ot", 8], ["vec", "ot", 8], ["wmma_m", "ot", 16]]}, "result": [[1.5160643999999999e-05], 0, 1.161308765411377, 1651811082.3007433], "version": 0.2, "tvm_version": "0.8.0"}
{"input": ["cuda -keys=cuda,gpu -max_num_threads=1024 -thread_warp_size=32", "fused_matmul_tensorcore_add.cuda", [["TENSOR", [4096, 512], "float16"], ["TENSOR", [4096, 512], "float16"], ["TENSOR", [128, 512], "float16"]], {}], "config": {"index": 6932, "code_hash": null, "entity": [["block_row_warps", "ot", 4], ["block_col_warps", "ot", 1], ["warp_row_tiles", "ot", 4], ["warp_col_tiles", "ot", 2], ["chunk", "ot", 2], ["offset", "ot", 8], ["offsetCS", "ot", 0], ["vec", "ot", 2], ["wmma_m", "ot", 16]]}, "result": [[2.5871986e-05], 0, 1.2460508346557617, 1651811083.0450423], "version": 0.2, "tvm_version": "0.8.0"}
{"input": ["cuda -keys=cuda,gpu -max_num_threads=1024 -thread_warp_size=32", "fused_matmul_tensorcore_add.cuda", [["TENSOR", [4096, 512], "float16"], ["TENSOR", [4096, 512], "float16"], ["TENSOR", [128, 512], "float16"]], {}], "config": {"index": 7040, "code_hash": null, "entity": [["block_row_warps", "ot", 4], ["block_col_warps", "ot", 1], ["warp_row_tiles", "ot", 4], ["warp_col_tiles", "ot", 4], ["chunk", "ot", 4], ["offset", "ot", 8], ["offsetCS", "ot", 0], ["vec", "ot", 2], ["wmma_m", "ot", 16]]}, "result": [[3.7312278999999994e-05], 0, 1.6158385276794434, 1651811083.9281425], "version": 0.2, "tvm_version": "0.8.0"}
{"input": ["cuda -keys=cuda,gpu -max_num_threads=1024 -thread_warp_size=32", "fused_matmul_tensorcore_add.cuda", [["TENSOR", [4096, 512], "float16"], ["TENSOR", [4096, 512], "float16"], ["TENSOR", [128, 512], "float16"]], {}], "config": {"index": 840, "code_hash": null, "entity": [["block_row_warps", "ot", 1], ["block_col_warps", "ot", 2], ["warp_row_tiles", "ot", 1], ["warp_col_tiles", "ot", 2], ["chunk", "ot", 4], ["offset", "ot", 0], ["offsetCS", "ot", 8], ["vec", "ot", 1], ["wmma_m", "ot", 32]]}, "result": [[4.8829747e-05], 0, 1.3876001834869385, 1651811084.7460675], "version": 0.2, "tvm_version": "0.8.0"}
{"input": ["cuda -keys=cuda,gpu -max_num_threads=1024 -thread_warp_size=32", "fused_matmul_tensorcore_add.cuda", [["TENSOR", [4096, 512], "float16"], ["TENSOR", [4096, 512], "float16"], ["TENSOR", [128, 512], "float16"]], {}], "config": {"index": 12075, "code_hash": null, "entity": [["block_row_warps", "ot", 1], ["block_col_warps", "ot", 4], ["warp_row_tiles", "ot", 1], ["warp_col_tiles", "ot", 1], ["chunk", "ot", 2], ["offset", "ot", 8], ["offsetCS", "ot", 0], ["vec", "ot", 2], ["wmma_m", "ot", 8]]}, "result": [[5.0779973e-05], 0, 1.259629249572754, 1651811120.6910112], "version": 0.2, "tvm_version": "0.8.0"}
{"input": ["cuda -keys=cuda,gpu -max_num_threads=1024 -thread_warp_size=32", "fused_matmul_tensorcore_add.cuda", [["TENSOR", [4096, 512], "float16"], ["TENSOR", [4096, 512], "float16"], ["TENSOR", [128, 512], "float16"]], {}], "config": {"index": 12723, "code_hash": null, "entity": [["block_row_warps", "ot", 1], ["block_col_warps", "ot", 4], ["warp_row_tiles", "ot", 1], ["warp_col_tiles", "ot", 1], ["chunk", "ot", 2], ["offset", "ot", 8], ["offsetCS", "ot", 8], ["vec", "ot", 2], ["wmma_m", "ot", 8]]}, "result": [[3.8379894999999994e-05], 0, 1.3381998538970947, 1651811121.4639516], "version": 0.2, "tvm_version": "0.8.0"}
{"input": ["cuda -keys=cuda,gpu -max_num_threads=1024 -thread_warp_size=32", "fused_matmul_tensorcore_add.cuda", [["TENSOR", [4096, 512], "float16"], ["TENSOR", [4096, 512], "float16"], ["TENSOR", [128, 512], "float16"]], {}], "config": {"index": 13371, "code_hash": null, "entity": [["block_row_warps", "ot", 1], ["block_col_warps", "ot", 4], ["warp_row_tiles", "ot", 1], ["warp_col_tiles", "ot", 1], ["chunk", "ot", 2], ["offset", "ot", 8], ["offsetCS", "ot", 0], ["vec", "ot", 4], ["wmma_m", "ot", 8]]}, "result": [[2.9730139000000002e-05], 0, 1.3717176914215088, 1651811122.272477], "version": 0.2, "tvm_version": "0.8.0"}
{"input": ["cuda -keys=cuda,gpu -max_num_threads=1024 -thread_warp_size=32", "fused_matmul_tensorcore_add.cuda", [["TENSOR", [4096, 512], "float16"], ["TENSOR", [4096, 512], "float16"], ["TENSOR", [128, 512], "float16"]], {}], "config": {"index": 14991, "code_hash": null, "entity": [["block_row_warps", "ot", 1], ["block_col_warps", "ot", 4], ["warp_row_tiles", "ot", 1], ["warp_col_tiles", "ot", 1], ["chunk", "ot", 2], ["offset", "ot", 0], ["offsetCS", "ot", 8], ["vec", "ot", 8], ["wmma_m", "ot", 8]]}, "result": [[4.3172188e-05], 0, 1.335700511932373, 1651811123.062494], "version": 0.2, "tvm_version": "0.8.0"}
{"input": ["cuda -keys=cuda,gpu -max_num_threads=1024 -thread_warp_size=32", "fused_matmul_tensorcore_add.cuda", [["TENSOR", [4096, 512], "float16"], ["TENSOR", [4096, 512], "float16"], ["TENSOR", [128, 512], "float16"]], {}], "config": {"index": 13695, "code_hash": null, "entity": [["block_row_warps", "ot", 1], ["block_col_warps", "ot", 4], ["warp_row_tiles", "ot", 1], ["warp_col_tiles", "ot", 1], ["chunk", "ot", 2], ["offset", "ot", 0], ["offsetCS", "ot", 8], ["vec", "ot", 4], ["wmma_m", "ot", 8]]}, "result": [[3.9107275e-05], 0, 1.2873682975769043, 1651811123.8432677], "version": 0.2, "tvm_version": "0.8.0"}
{"input": ["cuda -keys=cuda,gpu -max_num_threads=1024 -thread_warp_size=32", "fused_matmul_tensorcore_add.cuda", [["TENSOR", [4096, 512], "float16"], ["TENSOR", [4096, 512], "float16"], ["TENSOR", [128, 512], "float16"]], {}], "config": {"index": 14019, "code_hash": null, "entity": [["block_row_warps", "ot", 1], ["block_col_warps", "ot", 4], ["warp_row_tiles", "ot", 1], ["warp_col_tiles", "ot", 1], ["chunk", "ot", 2], ["offset", "ot", 8], ["offsetCS", "ot", 8], ["vec", "ot", 4], ["wmma_m", "ot", 8]]}, "result": [[2.9424783000000003e-05], 0, 1.3212335109710693, 1651811124.5926518], "version": 0.2, "tvm_version": "0.8.0"}
{"input": ["cuda -keys=cuda,gpu -max_num_threads=1024 -thread_warp_size=32", "fused_matmul_tensorcore_add.cuda", [["TENSOR", [4096, 512], "float16"], ["TENSOR", [4096, 512], "float16"], ["TENSOR", [128, 512], "float16"]], {}], "config": {"index": 13047, "code_hash": null, "entity": [["block_row_warps", "ot", 1], ["block_col_warps", "ot", 4], ["warp_row_tiles", "ot", 1], ["warp_col_tiles", "ot", 1], ["chunk", "ot", 2], ["offset", "ot", 0], ["offsetCS", "ot", 0], ["vec", "ot", 4], ["wmma_m", "ot", 8]]}, "result": [[3.9422772e-05], 0, 1.3522930145263672, 1651811125.3740687], "version": 0.2, "tvm_version": "0.8.0"}
{"input": ["cuda -keys=cuda,gpu -max_num_threads=1024 -thread_warp_size=32", "fused_matmul_tensorcore_add.cuda", [["TENSOR", [4096, 512], "float16"], ["TENSOR", [4096, 512], "float16"], ["TENSOR", [128, 512], "float16"]], {}], "config": {"index": 14343, "code_hash": null, "entity": [["block_row_warps", "ot", 1], ["block_col_warps", "ot", 4], ["warp_row_tiles", "ot", 1], ["warp_col_tiles", "ot", 1], ["chunk", "ot", 2], ["offset", "ot", 0], ["offsetCS", "ot", 0], ["vec", "ot", 8], ["wmma_m", "ot", 8]]}, "result": [[4.3572128e-05], 0, 1.3418419361114502, 1651811126.1599627], "version": 0.2, "tvm_version": "0.8.0"}
{"input": ["cuda -keys=cuda,gpu -max_num_threads=1024 -thread_warp_size=32", "fused_matmul_tensorcore_add.cuda", [["TENSOR", [4096, 512], "float16"], ["TENSOR", [4096, 512], "float16"], ["TENSOR", [128, 512], "float16"]], {}], "config": {"index": 11751, "code_hash": null, "entity": [["block_row_warps", "ot", 1], ["block_col_warps", "ot", 4], ["warp_row_tiles", "ot", 1], ["warp_col_tiles", "ot", 1], ["chunk", "ot", 2], ["offset", "ot", 0], ["offsetCS", "ot", 0], ["vec", "ot", 2], ["wmma_m", "ot", 8]]}, "result": [[3.7104401e-05], 0, 1.3037891387939453, 1651811126.9703012], "version": 0.2, "tvm_version": "0.8.0"}
{"input": ["cuda -keys=cuda,gpu -max_num_threads=1024 -thread_warp_size=32", "fused_matmul_tensorcore_add.cuda", [["TENSOR", [4096, 512], "float16"], ["TENSOR", [4096, 512], "float16"], ["TENSOR", [128, 512], "float16"]], {}], "config": {"index": 14667, "code_hash": null, "entity": [["block_row_warps", "ot", 1], ["block_col_warps", "ot", 4], ["warp_row_tiles", "ot", 1], ["warp_col_tiles", "ot", 1], ["chunk", "ot", 2], ["offset", "ot", 8], ["offsetCS", "ot", 0], ["vec", "ot", 8], ["wmma_m", "ot", 8]]}, "result": [[4.1379142e-05], 0, 1.2833712100982666, 1651811127.7457485], "version": 0.2, "tvm_version": "0.8.0"}
{"input": ["cuda -keys=cuda,gpu -max_num_threads=1024 -thread_warp_size=32", "fused_matmul_tensorcore_add.cuda", [["TENSOR", [4096, 512], "float16"], ["TENSOR", [4096, 512], "float16"], ["TENSOR", [128, 512], "float16"]], {}], "config": {"index": 12399, "code_hash": null, "entity": [["block_row_warps", "ot", 1], ["block_col_warps", "ot", 4], ["warp_row_tiles", "ot", 1], ["warp_col_tiles", "ot", 1], ["chunk", "ot", 2], ["offset", "ot", 0], ["offsetCS", "ot", 8], ["vec", "ot", 2], ["wmma_m", "ot", 8]]}, "result": [[5.4742768e-05], 0, 1.347327470779419, 1651811128.5503123], "version": 0.2, "tvm_version": "0.8.0"}
{"input": ["cuda -keys=cuda,gpu -max_num_threads=1024 -thread_warp_size=32", "fused_matmul_tensorcore_add.cuda", [["TENSOR", [4096, 512], "float16"], ["TENSOR", [4096, 512], "float16"], ["TENSOR", [128, 512], "float16"]], {}], "config": {"index": 15315, "code_hash": null, "entity": [["block_row_warps", "ot", 1], ["block_col_warps", "ot", 4], ["warp_row_tiles", "ot", 1], ["warp_col_tiles", "ot", 1], ["chunk", "ot", 2], ["offset", "ot", 8], ["offsetCS", "ot", 8], ["vec", "ot", 8], ["wmma_m", "ot", 8]]}, "result": [[3.7255754000000004e-05], 0, 1.4008026123046875, 1651811129.3505907], "version": 0.2, "tvm_version": "0.8.0"}
{"input": ["cuda -keys=cuda,gpu -max_num_threads=1024 -thread_warp_size=32", "fused_matmul_tensorcore_add.cuda", [["TENSOR", [4096, 512], "float16"], ["TENSOR", [4096, 512], "float16"], ["TENSOR", [128, 512], "float16"]], {}], "config": {"index": 2085, "code_hash": null, "entity": [["block_row_warps", "ot", 1], ["block_col_warps", "ot", 4], ["warp_row_tiles", "ot", 1], ["warp_col_tiles", "ot", 4], ["chunk", "ot", 2], ["offset", "ot", 0], ["offsetCS", "ot", 8], ["vec", "ot", 2], ["wmma_m", "ot", 32]]}, "result": [[2.7105925e-05], 0, 1.3187289237976074, 1651811130.1088448], "version": 0.2, "tvm_version": "0.8.0"}
{"input": ["cuda -keys=cuda,gpu -max_num_threads=1024 -thread_warp_size=32", "fused_matmul_tensorcore_add.cuda", [["TENSOR", [4096, 512], "float16"], ["TENSOR", [4096, 512], "float16"], ["TENSOR", [128, 512], "float16"]], {}], "config": {"index": 2733, "code_hash": null, "entity": [["block_row_warps", "ot", 1], ["block_col_warps", "ot", 4], ["warp_row_tiles", "ot", 1], ["warp_col_tiles", "ot", 4], ["chunk", "ot", 2], ["offset", "ot", 0], ["offsetCS", "ot", 0], ["vec", "ot", 4], ["wmma_m", "ot", 32]]}, "result": [[2.6643798e-05], 0, 1.326235294342041, 1651811130.8501728], "version": 0.2, "tvm_version": "0.8.0"}
{"input": ["cuda -keys=cuda,gpu -max_num_threads=1024 -thread_warp_size=32", "fused_matmul_tensorcore_add.cuda", [["TENSOR", [4096, 512], "float16"], ["TENSOR", [4096, 512], "float16"], ["TENSOR", [128, 512], "float16"]], {}], "config": {"index": 3057, "code_hash": null, "entity": [["block_row_warps", "ot", 1], ["block_col_warps", "ot", 4], ["warp_row_tiles", "ot", 1], ["warp_col_tiles", "ot", 4], ["chunk", "ot", 2], ["offset", "ot", 8], ["offsetCS", "ot", 0], ["vec", "ot", 4], ["wmma_m", "ot", 32]]}, "result": [[2.0558550000000003e-05], 0, 1.3819029331207275, 1651811131.6427684], "version": 0.2, "tvm_version": "0.8.0"}
{"input": ["cuda -keys=cuda,gpu -max_num_threads=1024 -thread_warp_size=32", "fused_matmul_tensorcore_add.cuda", [["TENSOR", [4096, 512], "float16"], ["TENSOR", [4096, 512], "float16"], ["TENSOR", [128, 512], "float16"]], {}], "config": {"index": 4353, "code_hash": null, "entity": [["block_row_warps", "ot", 1], ["block_col_warps", "ot", 4], ["warp_row_tiles", "ot", 1], ["warp_col_tiles", "ot", 4], ["chunk", "ot", 2], ["offset", "ot", 8], ["offsetCS", "ot", 0], ["vec", "ot", 8], ["wmma_m", "ot", 32]]}, "result": [[3.0413516999999996e-05], 0, 1.4017245769500732, 1651811132.447415], "version": 0.2, "tvm_version": "0.8.0"}
{"input": ["cuda -keys=cuda,gpu -max_num_threads=1024 -thread_warp_size=32", "fused_matmul_tensorcore_add.cuda", [["TENSOR", [4096, 512], "float16"], ["TENSOR", [4096, 512], "float16"], ["TENSOR", [128, 512], "float16"]], {}], "config": {"index": 6594, "code_hash": null, "entity": [["block_row_warps", "ot", 1], ["block_col_warps", "ot", 4], ["warp_row_tiles", "ot", 1], ["warp_col_tiles", "ot", 2], ["chunk", "ot", 2], ["offset", "ot", 0], ["offsetCS", "ot", 0], ["vec", "ot", 2], ["wmma_m", "ot", 16]]}, "result": [[3.9368955e-05], 0, 1.3946192264556885, 1651811133.2174926], "version": 0.2, "tvm_version": "0.8.0"}
{"input": ["cuda -keys=cuda,gpu -max_num_threads=1024 -thread_warp_size=32", "fused_matmul_tensorcore_add.cuda", [["TENSOR", [4096, 512], "float16"], ["TENSOR", [4096, 512], "float16"], ["TENSOR", [128, 512], "float16"]], {}], "config": {"index": 5001, "code_hash": null, "entity": [["block_row_warps", "ot", 1], ["block_col_warps", "ot", 4], ["warp_row_tiles", "ot", 1], ["warp_col_tiles", "ot", 4], ["chunk", "ot", 2], ["offset", "ot", 8], ["offsetCS", "ot", 8], ["vec", "ot", 8], ["wmma_m", "ot", 32]]}, "result": [[2.5812068e-05], 0, 1.4828567504882812, 1651811134.020962], "version": 0.2, "tvm_version": "0.8.0"}
{"input": ["cuda -keys=cuda,gpu -max_num_threads=1024 -thread_warp_size=32", "fused_matmul_tensorcore_add.cuda", [["TENSOR", [4096, 512], "float16"], ["TENSOR", [4096, 512], "float16"], ["TENSOR", [128, 512], "float16"]], {}], "config": {"index": 3381, "code_hash": null, "entity": [["block_row_warps", "ot", 1], ["block_col_warps", "ot", 4], ["warp_row_tiles", "ot", 1], ["warp_col_tiles", "ot", 4], ["chunk", "ot", 2], ["offset", "ot", 0], ["offsetCS", "ot", 8], ["vec", "ot", 4], ["wmma_m", "ot", 32]]}, "result": [[4.1124251e-05], 0, 1.3218882083892822, 1651811134.8057284], "version": 0.2, "tvm_version": "0.8.0"}
{"input": ["cuda -keys=cuda,gpu -max_num_threads=1024 -thread_warp_size=32", "fused_matmul_tensorcore_add.cuda", [["TENSOR", [4096, 512], "float16"], ["TENSOR", [4096, 512], "float16"], ["TENSOR", [128, 512], "float16"]], {}], "config": {"index": 6943, "code_hash": null, "entity": [["block_row_warps", "ot", 2], ["block_col_warps", "ot", 2], ["warp_row_tiles", "ot", 1], ["warp_col_tiles", "ot", 4], ["chunk", "ot", 2], ["offset", "ot", 8], ["offsetCS", "ot", 0], ["vec", "ot", 2], ["wmma_m", "ot", 16]]}, "result": [[3.7140152e-05], 0, 1.3519415855407715, 1651811135.5780964], "version": 0.2, "tvm_version": "0.8.0"}
{"input": ["cuda -keys=cuda,gpu -max_num_threads=1024 -thread_warp_size=32", "fused_matmul_tensorcore_add.cuda", [["TENSOR", [4096, 512], "float16"], ["TENSOR", [4096, 512], "float16"], ["TENSOR", [128, 512], "float16"]], {}], "config": {"index": 4677, "code_hash": null, "entity": [["block_row_warps", "ot", 1], ["block_col_warps", "ot", 4], ["warp_row_tiles", "ot", 1], ["warp_col_tiles", "ot", 4], ["chunk", "ot", 2], ["offset", "ot", 0], ["offsetCS", "ot", 8], ["vec", "ot", 8], ["wmma_m", "ot", 32]]}, "result": [[3.8853932e-05], 0, 1.4100391864776611, 1651811136.4223926], "version": 0.2, "tvm_version": "0.8.0"}
