python/models/swin_transformer/kernel_configs/swin_transformer_softmax_reduce_12544_49.log
{"i": [["[\"softmax_reduce\", 12544, 49]", "cuda -keys=cuda,gpu -max_num_threads=1024 -model=unknown -thread_warp_size=32", [-1, 16, 64, 49152, 2147483647, 1024, 8, 32], "", 0, []], [[], [["SP", 1, 2, 49, [7], 1], ["AN", 1, 3, 6], ["FU", 1, [0, 1]], ["AN", 1, 0, 5], ["PR", 1, 0, "auto_unroll_max_step$1024"]]]], "r": [[0.000461025, 0.00046081, 0.000460423], 0, 7.04233, 1668017334], "v": "v0.6"}
{"i": [["[\"softmax_reduce\", 12544, 49]", "cuda -keys=cuda,gpu -max_num_threads=1024 -model=unknown -thread_warp_size=32", [-1, 16, 64, 49152, 2147483647, 1024, 8, 32], "", 0, []], [[], [["FU", 1, [0, 1]], ["SP", 1, 0, 614656, [32], 1], ["AN", 1, 0, 5], ["AN", 1, 1, 6], ["PR", 1, 0, "auto_unroll_max_step$64"]]]], "r": [[8.42872e-05, 8.4267e-05, 8.42009e-05], 0, 8.38933, 1668017335], "v": "v0.6"}
{"i": [["[\"softmax_reduce\", 12544, 49]", "cuda -keys=cuda,gpu -max_num_threads=1024 -model=unknown -thread_warp_size=32", [-1, 16, 64, 49152, 2147483647, 1024, 8, 32], "", 0, []], [[], [["FU", 1, [0, 1]], ["SP", 1, 0, 614656, [64], 1], ["AN", 1, 0, 5], ["AN", 1, 1, 6], ["PR", 1, 0, "auto_unroll_max_step$512"]]]], "r": [[8.98886e-05, 8.99793e-05, 8.99153e-05], 0, 5.67745, 1668017332], "v": "v0.6"}
{"i": [["[\"softmax_reduce\", 12544, 49]", "cuda -keys=cuda,gpu -max_num_threads=1024 -model=unknown -thread_warp_size=32", [-1, 16, 64, 49152, 2147483647, 1024, 8, 32], "", 0, []], [[], [["SP", 1, 2, 49, [12], 1], ["AN", 1, 3, 6], ["FU", 1, [0, 1]], ["AN", 1, 0, 5], ["PR", 1, 0, "auto_unroll_max_step$64"]]]], "r": [[0.000461229, 0.000461186, 0.000461017], 0, 4.30416, 1668017331], "v": "v0.6"}
{"i": [["[\"softmax_reduce\", 12544, 49]", "cuda -keys=cuda,gpu -max_num_threads=1024 -model=unknown -thread_warp_size=32", [-1, 16, 64, 49152, 2147483647, 1024, 8, 32], "", 0, []], [[], [["FU", 1, [0, 1]], ["SP", 1, 0, 614656, [8], 1], ["AN", 1, 0, 5], ["AN", 1, 1, 6], ["PR", 1, 0, "auto_unroll_max_step$0"]]]], "r": [[0.000140459, 0.000140393, 0.00014037], 0, 12.5153, 1668017339], "v": "v0.6"}
{"i": [["[\"softmax_reduce\", 12544, 49]", "cuda -keys=cuda,gpu -max_num_threads=1024 -model=unknown -thread_warp_size=32", [-1, 16, 64, 49152, 2147483647, 1024, 8, 32], "", 0, []], [[], [["SP", 1, 2, 49, [8], 1], ["AN", 1, 3, 6], ["FU", 1, [0, 1]], ["AN", 1, 0, 5], ["PR", 1, 0, "auto_unroll_max_step$1024"]]]], "r": [[0.000459979, 0.000459886, 0.000459995], 0, 2.93522, 1668017330], "v": "v0.6"}
{"i": [["[\"softmax_reduce\", 12544, 49]", "cuda -keys=cuda,gpu -max_num_threads=1024 -model=unknown -thread_warp_size=32", [-1, 16, 64, 49152, 2147483647, 1024, 8, 32], "", 0, []], [[], [["SP", 1, 2, 49, [8], 1], ["AN", 1, 3, 6], ["FU", 1, [0, 1]], ["AN", 1, 0, 5], ["PR", 1, 0, "auto_unroll_max_step$16"]]]], "r": [[0.000461244, 0.000461154, 0.000461144], 0, 1.61047, 1668017328], "v": "v0.6"}
{"i": [["[\"softmax_reduce\", 12544, 49]", "cuda -keys=cuda,gpu -max_num_threads=1024 -model=unknown -thread_warp_size=32", [-1, 16, 64, 49152, 2147483647, 1024, 8, 32], "", 0, []], [[], [["FU", 1, [0, 1]], ["SP", 1, 0, 614656, [1], 1], ["AN", 1, 0, 5], ["AN", 1, 1, 6], ["PR", 1, 0, "auto_unroll_max_step$64"]]]], "r": [[0.00158629, 0.00158878, 0.00158813], 0, 13.948, 1668017341], "v": "v0.6"}
{"i": [["[\"softmax_reduce\", 12544, 49]", "cuda -keys=cuda,gpu -max_num_threads=1024 -model=unknown -thread_warp_size=32", [-1, 16, 64, 49152, 2147483647, 1024, 8, 32], "", 0, []], [[], [["FU", 1, [0, 1]], ["SP", 1, 0, 614656, [14], 1], ["AN", 1, 0, 5], ["AN", 1, 1, 6], ["PR", 1, 0, "auto_unroll_max_step$1024"]]]], "r": [[0.000105926, 0.000105926, 0.000105892], 0, 11.2035, 1668017338], "v": "v0.6"}
{"i": [["[\"softmax_reduce\", 12544, 49]", "cuda -keys=cuda,gpu -max_num_threads=1024 -model=unknown -thread_warp_size=32", [-1, 16, 64, 49152, 2147483647, 1024, 8, 32], "", 0, []], [[], [["FU", 1, [0, 1]], ["SP", 1, 0, 614656, [8], 1], ["AN", 1, 0, 5], ["AN", 1, 1, 6], ["PR", 1, 0, "auto_unroll_max_step$1024"]]]], "r": [[0.000140442, 0.000140423, 0.000140298], 0, 9.80623, 1668017337], "v": "v0.6"}
{"i": [["[\"softmax_reduce\", 12544, 49]", "cuda -keys=cuda,gpu -max_num_threads=1024 -model=unknown -thread_warp_size=32", [-1, 16, 64, 49152, 2147483647, 1024, 8, 32], "", 0, []], [[], [["SP", 1, 2, 49, [1], 1], ["AN", 1, 3, 6], ["FU", 1, [0, 1]], ["AN", 1, 0, 5], ["PR", 1, 0, "auto_unroll_max_step$1024"]]]], "r": [[0.000942854, 0.000942607, 0.000942445], 0, 16.6534, 1668017343], "v": "v0.6"}
{"i": [["[\"softmax_reduce\", 12544, 49]", "cuda -keys=cuda,gpu -max_num_threads=1024 -model=unknown -thread_warp_size=32", [-1, 16, 64, 49152, 2147483647, 1024, 8, 32], "", 0, []], [[], [["FU", 1, [0, 1]], ["SP", 1, 0, 614656, [32], 1], ["AN", 1, 0, 5], ["AN", 1, 1, 6], ["PR", 1, 0, "auto_unroll_max_step$16"]]]], "r": [[8.43599e-05, 8.42888e-05, 8.42474e-05], 0, 15.2624, 1668017342], "v": "v0.6"}
{"i": [["[\"softmax_reduce\", 12544, 49]", "cuda -keys=cuda,gpu -max_num_threads=1024 -model=unknown -thread_warp_size=32", [-1, 16, 64, 49152, 2147483647, 1024, 8, 32], "", 0, []], [[], [["FU", 1, [0, 1]], ["SP", 1, 0, 614656, [4], 1], ["AN", 1, 0, 5], ["AN", 1, 1, 6], ["PR", 1, 0, "auto_unroll_max_step$1024"]]]], "r": [[0.000289075, 0.00028911, 0.000289011], 0, 19.3553, 1668017346], "v": "v0.6"}
{"i": [["[\"softmax_reduce\", 12544, 49]", "cuda -keys=cuda,gpu -max_num_threads=1024 -model=unknown -thread_warp_size=32", [-1, 16, 64, 49152, 2147483647, 1024, 8, 32], "", 0, []], [[], [["SP", 1, 2, 49, [7], 1], ["AN", 1, 3, 6], ["FU", 1, [0, 1]], ["AN", 1, 0, 5], ["PR", 1, 0, "auto_unroll_max_step$64"]]]], "r": [[0.000461123, 0.000460343, 0.000459891], 0, 23.3509, 1668017350], "v": "v0.6"}
{"i": [["[\"softmax_reduce\", 12544, 49]", "cuda -keys=cuda,gpu -max_num_threads=1024 -model=unknown -thread_warp_size=32", [-1, 16, 64, 49152, 2147483647, 1024, 8, 32], "", 0, []], [[], [["FU", 1, [0, 1]], ["SP", 1, 0, 614656, [1], 1], ["AN", 1, 0, 5], ["AN", 1, 1, 6], ["PR", 1, 0, "auto_unroll_max_step$512"]]]], "r": [[0.00158877, 0.00158922, 0.0015875], 0, 18.0022, 1668017345], "v": "v0.6"}
{"i": [["[\"softmax_reduce\", 12544, 49]", "cuda -keys=cuda,gpu -max_num_threads=1024 -model=unknown -thread_warp_size=32", [-1, 16, 64, 49152, 2147483647, 1024, 8, 32], "", 0, []], [[], [["SP", 1, 2, 49, [48], 1], ["AN", 1, 3, 6], ["FU", 1, [0, 1]], ["AN", 1, 0, 5], ["PR", 1, 0, "auto_unroll_max_step$0"]]]], "r": [[0.00046028, 0.00046022, 0.000460336], 0, 20.7104, 1668017348], "v": "v0.6"}
{"i": [["[\"softmax_reduce\", 12544, 49]", "cuda -keys=cuda,gpu -max_num_threads=1024 -model=unknown -thread_warp_size=32", [-1, 16, 64, 49152, 2147483647, 1024, 8, 32], "", 0, []], [[], [["SP", 1, 2, 49, [7], 1], ["AN", 1, 3, 6], ["FU", 1, [0, 1]], ["AN", 1, 0, 5], ["PR", 1, 0, "auto_unroll_max_step$0"]]]], "r": [[0.000461264, 0.000461051, 0.000460918], 0, 22.0308, 1668017349], "v": "v0.6"}
{"i": [["[\"softmax_reduce\", 12544, 49]", "cuda -keys=cuda,gpu -max_num_threads=1024 -model=unknown -thread_warp_size=32", [-1, 16, 64, 49152, 2147483647, 1024, 8, 32], "", 0, []], [[], [["SP", 1, 2, 49, [8], 1], ["AN", 1, 3, 6], ["FU", 1, [0, 1]], ["AN", 1, 0, 5], ["PR", 1, 0, "auto_unroll_max_step$64"]]]], "r": [[0.00046106, 0.000460883, 0.000460922], 0, 26.0901, 1668017353], "v": "v0.6"}
{"i": [["[\"softmax_reduce\", 12544, 49]", "cuda -keys=cuda,gpu -max_num_threads=1024 -model=unknown -thread_warp_size=32", [-1, 16, 64, 49152, 2147483647, 1024, 8, 32], "", 0, []], [[], [["FU", 1, [0, 1]], ["SP", 1, 0, 614656, [14], 1], ["AN", 1, 0, 5], ["AN", 1, 1, 6], ["PR", 1, 0, "auto_unroll_max_step$0"]]]], "r": [[0.000105899, 0.000105858, 0.000105703], 0, 27.4439, 1668017354], "v": "v0.6"}
{"i": [["[\"softmax_reduce\", 12544, 49]", "cuda -keys=cuda,gpu -max_num_threads=1024 -model=unknown -thread_warp_size=32", [-1, 16, 64, 49152, 2147483647, 1024, 8, 32], "", 0, []], [[], [["SP", 1, 2, 49, [32], 1], ["AN", 1, 3, 6], ["FU", 1, [0, 1]], ["AN", 1, 0, 5], ["PR", 1, 0, "auto_unroll_max_step$16"]]]], "r": [[0.000460946, 0.000460886, 0.000460893], 0, 24.7223, 1668017352], "v": "v0.6"}
{"i": [["[\"softmax_reduce\", 12544, 49]", "cuda -keys=cuda,gpu -max_num_threads=1024 -model=unknown -thread_warp_size=32", [-1, 16, 64, 49152, 2147483647, 1024, 8, 32], "", 0, []], [[], [["SP", 1, 2, 49, [4], 1], ["AN", 1, 3, 6], ["FU", 1, [0, 1]], ["AN", 1, 0, 5], ["PR", 1, 0, "auto_unroll_max_step$1024"]]]], "r": [[0.00049835, 0.000498057, 0.000498289], 0, 6.28878, 1668046346], "v": "v0.6"}
{"i": [["[\"softmax_reduce\", 12544, 49]", "cuda -keys=cuda,gpu -max_num_threads=1024 -model=unknown -thread_warp_size=32", [-1, 16, 64, 49152, 2147483647, 1024, 8, 32], "", 0, []], [[], [["FU", 1, [0, 1]], ["SP", 1, 0, 614656, [64], 1], ["AN", 1, 0, 5], ["AN", 1, 1, 6], ["PR", 1, 0, "auto_unroll_max_step$64"]]]], "r": [[9.00547e-05, 9.00066e-05, 8.96182e-05], 0, 27.8224, 1668046368], "v": "v0.6"}
{"i": [["[\"softmax_reduce\", 12544, 49]", "cuda -keys=cuda,gpu -max_num_threads=1024 -model=unknown -thread_warp_size=32", [-1, 16, 64, 49152, 2147483647, 1024, 8, 32], "", 0, []], [[], [["SP", 1, 2, 49, [1], 1], ["AN", 1, 3, 6], ["FU", 1, [0, 1]], ["AN", 1, 0, 5], ["PR", 1, 0, "auto_unroll_max_step$0"]]]], "r": [[0.000942033, 0.000941929, 0.00094189], 0, 16.9213, 1668046357], "v": "v0.6"}
{"i": [["[\"softmax_reduce\", 12544, 49]", "cuda -keys=cuda,gpu -max_num_threads=1024 -model=unknown -thread_warp_size=32", [-1, 16, 64, 49152, 2147483647, 1024, 8, 32], "", 0, []], [[], [["SP", 1, 2, 49, [4], 1], ["AN", 1, 3, 6], ["FU", 1, [0, 1]], ["AN", 1, 0, 5], ["PR", 1, 0, "auto_unroll_max_step$64"]]]], "r": [[0.00049835, 0.000498357, 0.000498185], 0, 10.2688, 1668046350], "v": "v0.6"}
{"i": [["[\"softmax_reduce\", 12544, 49]", "cuda -keys=cuda,gpu -max_num_threads=1024 -model=unknown -thread_warp_size=32", [-1, 16, 64, 49152, 2147483647, 1024, 8, 32], "", 0, []], [[], [["SP", 1, 2, 49, [6], 1], ["AN", 1, 3, 6], ["FU", 1, [0, 1]], ["AN", 1, 0, 5], ["PR", 1, 0, "auto_unroll_max_step$16"]]]], "r": [[0.000460012, 0.000459889, 0.000459856], 0, 15.5899, 1668046355], "v": "v0.6"}
{"i": [["[\"softmax_reduce\", 12544, 49]", "cuda -keys=cuda,gpu -max_num_threads=1024 -model=unknown -thread_warp_size=32", [-1, 16, 64, 49152, 2147483647, 1024, 8, 32], "", 0, []], [[], [["SP", 1, 2, 49, [2], 1], ["AN", 1, 3, 6], ["FU", 1, [0, 1]], ["AN", 1, 0, 5], ["PR", 1, 0, "auto_unroll_max_step$1024"]]]], "r": [[0.000702695, 0.000702639, 0.000702511], 0, 8.7748, 1668046348], "v": "v0.6"}
{"i": [["[\"softmax_reduce\", 12544, 49]", "cuda -keys=cuda,gpu -max_num_threads=1024 -model=unknown -thread_warp_size=32", [-1, 16, 64, 49152, 2147483647, 1024, 8, 32], "", 0, []], [[], [["SP", 1, 2, 49, [2], 1], ["AN", 1, 3, 6], ["FU", 1, [0, 1]], ["AN", 1, 0, 5], ["PR", 1, 0, "auto_unroll_max_step$512"]]]], "r": [[0.000702659, 0.000702691, 0.000702537], 0, 14.0851, 1668046354], "v": "v0.6"}
{"i": [["[\"softmax_reduce\", 12544, 49]", "cuda -keys=cuda,gpu -max_num_threads=1024 -model=unknown -thread_warp_size=32", [-1, 16, 64, 49152, 2147483647, 1024, 8, 32], "", 0, []], [[], [["SP", 1, 2, 49, [48], 1], ["AN", 1, 3, 6], ["FU", 1, [0, 1]], ["AN", 1, 0, 5], ["PR", 1, 0, "auto_unroll_max_step$0"]]]], "r": [[0.000460045, 0.000459988, 0.000459872], 0, 19.6603, 1668046359], "v": "v0.6"}
{"i": [["[\"softmax_reduce\", 12544, 49]", "cuda -keys=cuda,gpu -max_num_threads=1024 -model=unknown -thread_warp_size=32", [-1, 16, 64, 49152, 2147483647, 1024, 8, 32], "", 0, []], [[], [["SP", 1, 2, 49, [3], 1], ["AN", 1, 3, 6], ["FU", 1, [0, 1]], ["AN", 1, 0, 5], ["PR", 1, 0, "auto_unroll_max_step$16"]]]], "r": [[0.000564597, 0.000564653, 0.00056448], 0, 22.2942, 1668046362], "v": "v0.6"}
{"i": [["[\"softmax_reduce\", 12544, 49]", "cuda -keys=cuda,gpu -max_num_threads=1024 -model=unknown -thread_warp_size=32", [-1, 16, 64, 49152, 2147483647, 1024, 8, 32], "", 0, []], [[], [["FU", 1, [0, 1]], ["SP", 1, 0, 614656, [2], 1], ["AN", 1, 0, 5], ["AN", 1, 1, 6], ["PR", 1, 0, "auto_unroll_max_step$1024"]]]], "r": [[0.000668457, 0.000667942, 0.000667858], 0, 23.7332, 1668046364], "v": "v0.6"}
{"i": [["[\"softmax_reduce\", 12544, 49]", "cuda -keys=cuda,gpu -max_num_threads=1024 -model=unknown -thread_warp_size=32", [-1, 16, 64, 49152, 2147483647, 1024, 8, 32], "", 0, []], [[], [["FU", 1, [0, 1]], ["SP", 1, 0, 614656, [56], 1], ["AN", 1, 0, 5], ["AN", 1, 1, 6], ["PR", 1, 0, "auto_unroll_max_step$0"]]]], "r": [[9.14985e-05, 9.14686e-05, 9.1457e-05], 0, 12.9189, 1668046353], "v": "v0.6"}
{"i": [["[\"softmax_reduce\", 12544, 49]", "cuda -keys=cuda,gpu -max_num_threads=1024 -model=unknown -thread_warp_size=32", [-1, 16, 64, 49152, 2147483647, 1024, 8, 32], "", 0, []], [[], [["SP", 1, 2, 49, [12], 1], ["AN", 1, 3, 6], ["FU", 1, [0, 1]], ["AN", 1, 0, 5], ["PR", 1, 0, "auto_unroll_max_step$16"]]]], "r": [[0.000460916, 0.000460854, 0.00046096], 0, 2.15594, 1668046342], "v": "v0.6"}
{"i": [["[\"softmax_reduce\", 12544, 49]", "cuda -keys=cuda,gpu -max_num_threads=1024 -model=unknown -thread_warp_size=32", [-1, 16, 64, 49152, 2147483647, 1024, 8, 32], "", 0, []], [[], [["SP", 1, 2, 49, [8], 1], ["AN", 1, 3, 6], ["FU", 1, [0, 1]], ["AN", 1, 0, 5], ["PR", 1, 0, "auto_unroll_max_step$1024"]]]], "r": [[0.00046121, 0.000461074, 0.000461055], 0, 26.4452, 1668046366], "v": "v0.6"}
{"i": [["[\"softmax_reduce\", 12544, 49]", "cuda -keys=cuda,gpu -max_num_threads=1024 -model=unknown -thread_warp_size=32", [-1, 16, 64, 49152, 2147483647, 1024, 8, 32], "", 0, []], [[], [["SP", 1, 2, 49, [3], 1], ["AN", 1, 3, 6], ["FU", 1, [0, 1]], ["AN", 1, 0, 5], ["PR", 1, 0, "auto_unroll_max_step$512"]]]], "r": [[0.000564397, 0.000564383, 0.000564467], 0, 35.7356, 1668046376], "v": "v0.6"}
{"i": [["[\"softmax_reduce\", 12544, 49]", "cuda -keys=cuda,gpu -max_num_threads=1024 -model=unknown -thread_warp_size=32", [-1, 16, 64, 49152, 2147483647, 1024, 8, 32], "", 0, []], [[], [["SP", 1, 2, 49, [16], 1], ["AN", 1, 3, 6], ["FU", 1, [0, 1]], ["AN", 1, 0, 5], ["PR", 1, 0, "auto_unroll_max_step$16"]]]], "r": [[0.000461207, 0.000461009, 0.000460925], 0, 4.73555, 1668046344], "v": "v0.6"}
{"i": [["[\"softmax_reduce\", 12544, 49]", "cuda -keys=cuda,gpu -max_num_threads=1024 -model=unknown -thread_warp_size=32", [-1, 16, 64, 49152, 2147483647, 1024, 8, 32], "", 0, []], [[], [["SP", 1, 2, 49, [7], 1], ["AN", 1, 3, 6], ["FU", 1, [0, 1]], ["AN", 1, 0, 5], ["PR", 1, 0, "auto_unroll_max_step$512"]]]], "r": [[0.000461055, 0.000460908, 0.000460933], 0, 34.3127, 1668046374], "v": "v0.6"}
{"i": [["[\"softmax_reduce\", 12544, 49]", "cuda -keys=cuda,gpu -max_num_threads=1024 -model=unknown -thread_warp_size=32", [-1, 16, 64, 49152, 2147483647, 1024, 8, 32], "", 0, []], [[], [["FU", 1, [0, 1]], ["SP", 1, 0, 614656, [8], 1], ["AN", 1, 0, 5], ["AN", 1, 1, 6], ["PR", 1, 0, "auto_unroll_max_step$64"]]]], "r": [[0.000140399, 0.000140351, 0.000140322], 0, 7.25469, 1668046347], "v": "v0.6"}
{"i": [["[\"softmax_reduce\", 12544, 49]", "cuda -keys=cuda,gpu -max_num_threads=1024 -model=unknown -thread_warp_size=32", [-1, 16, 64, 49152, 2147483647, 1024, 8, 32], "", 0, []], [[], [["SP", 1, 2, 49, [16], 1], ["AN", 1, 3, 6], ["FU", 1, [0, 1]], ["AN", 1, 0, 5], ["PR", 1, 0, "auto_unroll_max_step$64"]]]], "r": [[0.000461038, 0.000461104, 0.000461121], 0, 11.5187, 1668046351], "v": "v0.6"}
{"i": [["[\"softmax_reduce\", 12544, 49]", "cuda -keys=cuda,gpu -max_num_threads=1024 -model=unknown -thread_warp_size=32", [-1, 16, 64, 49152, 2147483647, 1024, 8, 32], "", 0, []], [[], [["FU", 1, [0, 1]], ["SP", 1, 0, 614656, [32], 1], ["AN", 1, 0, 5], ["AN", 1, 1, 6], ["PR", 1, 0, "auto_unroll_max_step$1024"]]]], "r": [[8.43788e-05, 8.43467e-05, 8.43322e-05], 0, 31.7268, 1668046372], "v": "v0.6"}
{"i": [["[\"softmax_reduce\", 12544, 49]", "cuda -keys=cuda,gpu -max_num_threads=1024 -model=unknown -thread_warp_size=32", [-1, 16, 64, 49152, 2147483647, 1024, 8, 32], "", 0, []], [[], [["SP", 1, 2, 49, [7], 1], ["AN", 1, 3, 6], ["FU", 1, [0, 1]], ["AN", 1, 0, 5], ["PR", 1, 0, "auto_unroll_max_step$1024"]]]], "r": [[0.000460833, 0.000460779, 0.000460881], 0, 30.4194, 1668046370], "v": "v0.6"}
{"i": [["[\"softmax_reduce\", 12544, 49]", "cuda -keys=cuda,gpu -max_num_threads=1024 -model=unknown -thread_warp_size=32", [-1, 16, 64, 49152, 2147483647, 1024, 8, 32], "", 0, []], [[], [["FU", 1, [0, 1]], ["SP", 1, 0, 614656, [4], 1], ["AN", 1, 0, 5], ["AN", 1, 1, 6], ["PR", 1, 0, "auto_unroll_max_step$512"]]]], "r": [[0.00028941, 0.000289477, 0.000289418], 0, 18.3478, 1668046358], "v": "v0.6"}
{"i": [["[\"softmax_reduce\", 12544, 49]", "cuda -keys=cuda,gpu -max_num_threads=1024 -model=unknown -thread_warp_size=32", [-1, 16, 64, 49152, 2147483647, 1024, 8, 32], "", 0, []], [[], [["FU", 1, [0, 1]], ["SP", 1, 0, 614656, [28], 1], ["AN", 1, 0, 5], ["AN", 1, 1, 6], ["PR", 1, 0, "auto_unroll_max_step$512"]]]], "r": [[8.46452e-05, 8.45878e-05, 8.4569e-05], 0, 48.084, 1668046388], "v": "v0.6"}
{"i": [["[\"softmax_reduce\", 12544, 49]", "cuda -keys=cuda,gpu -max_num_threads=1024 -model=unknown -thread_warp_size=32", [-1, 16, 64, 49152, 2147483647, 1024, 8, 32], "", 0, []], [[], [["FU", 1, [0, 1]], ["SP", 1, 0, 614656, [16], 1], ["AN", 1, 0, 5], ["AN", 1, 1, 6], ["PR", 1, 0, "auto_unroll_max_step$64"]]]], "r": [[9.34351e-05, 9.33799e-05, 9.33257e-05], 0, 37.1091, 1668046377], "v": "v0.6"}
{"i": [["[\"softmax_reduce\", 12544, 49]", "cuda -keys=cuda,gpu -max_num_threads=1024 -model=unknown -thread_warp_size=32", [-1, 16, 64, 49152, 2147483647, 1024, 8, 32], "", 0, []], [[], [["SP", 1, 2, 49, [49], 1], ["AN", 1, 3, 6], ["FU", 1, [0, 1]], ["AN", 1, 0, 5], ["PR", 1, 0, "auto_unroll_max_step$64"]]]], "r": [[0.000459526, 0.000459493, 0.000459332], 0, 43.8875, 1668046384], "v": "v0.6"}
{"i": [["[\"softmax_reduce\", 12544, 49]", "cuda -keys=cuda,gpu -max_num_threads=1024 -model=unknown -thread_warp_size=32", [-1, 16, 64, 49152, 2147483647, 1024, 8, 32], "", 0, []], [[], [["SP", 1, 2, 49, [12], 1], ["AN", 1, 3, 6], ["FU", 1, [0, 1]], ["AN", 1, 0, 5], ["PR", 1, 0, "auto_unroll_max_step$64"]]]], "r": [[0.000460894, 0.00046095, 0.000460879], 0, 46.7602, 1668046387], "v": "v0.6"}
{"i": [["[\"softmax_reduce\", 12544, 49]", "cuda -keys=cuda,gpu -max_num_threads=1024 -model=unknown -thread_warp_size=32", [-1, 16, 64, 49152, 2147483647, 1024, 8, 32], "", 0, []], [[], [["FU", 1, [0, 1]], ["SP", 1, 0, 614656, [28], 1], ["AN", 1, 0, 5], ["AN", 1, 1, 6], ["PR", 1, 0, "auto_unroll_max_step$0"]]]], "r": [[8.46679e-05, 8.46463e-05, 8.46496e-05], 0, 3.29242, 1668046343], "v": "v0.6"}
{"i": [["[\"softmax_reduce\", 12544, 49]", "cuda -keys=cuda,gpu -max_num_threads=1024 -model=unknown -thread_warp_size=32", [-1, 16, 64, 49152, 2147483647, 1024, 8, 32], "", 0, []], [[], [["SP", 1, 2, 49, [32], 1], ["AN", 1, 3, 6], ["FU", 1, [0, 1]], ["AN", 1, 0, 5], ["PR", 1, 0, "auto_unroll_max_step$16"]]]], "r": [[0.000460807, 0.0004608, 0.000460915], 0, 25.0757, 1668046365], "v": "v0.6"}
{"i": [["[\"softmax_reduce\", 12544, 49]", "cuda -keys=cuda,gpu -max_num_threads=1024 -model=unknown -thread_warp_size=32", [-1, 16, 64, 49152, 2147483647, 1024, 8, 32], "", 0, []], [[], [["FU", 1, [0, 1]], ["SP", 1, 0, 614656, [49], 1], ["AN", 1, 0, 5], ["AN", 1, 1, 6], ["PR", 1, 0, "auto_unroll_max_step$1024"]]]], "r": [[9.13142e-05, 9.13824e-05, 9.12102e-05], 0, 21.0122, 1668046361], "v": "v0.6"}
{"i": [["[\"softmax_reduce\", 12544, 49]", "cuda -keys=cuda,gpu -max_num_threads=1024 -model=unknown -thread_warp_size=32", [-1, 16, 64, 49152, 2147483647, 1024, 8, 32], "", 0, []], [[], [["FU", 1, [0, 1]], ["SP", 1, 0, 614656, [16], 1], ["AN", 1, 0, 5], ["AN", 1, 1, 6], ["PR", 1, 0, "auto_unroll_max_step$1024"]]]], "r": [[9.33255e-05, 9.33489e-05, 9.33183e-05], 0, 29.108, 1668046369], "v": "v0.6"}
{"i": [["[\"softmax_reduce\", 12544, 49]", "cuda -keys=cuda,gpu -max_num_threads=1024 -model=unknown -thread_warp_size=32", [-1, 16, 64, 49152, 2147483647, 1024, 8, 32], "", 0, []], [[], [["FU", 1, [0, 1]], ["SP", 1, 0, 614656, [56], 1], ["AN", 1, 0, 5], ["AN", 1, 1, 6], ["PR", 1, 0, "auto_unroll_max_step$512"]]]], "r": [[9.15491e-05, 9.15241e-05, 9.14931e-05], 0, 33.1167, 1668046373], "v": "v0.6"}
{"i": [["[\"softmax_reduce\", 12544, 49]", "cuda -keys=cuda,gpu -max_num_threads=1024 -model=unknown -thread_warp_size=32", [-1, 16, 64, 49152, 2147483647, 1024, 8, 32], "", 0, []], [[], [["SP", 1, 2, 49, [24], 1], ["AN", 1, 3, 6], ["FU", 1, [0, 1]], ["AN", 1, 0, 5], ["PR", 1, 0, "auto_unroll_max_step$64"]]]], "r": [[0.000460985, 0.000460924, 0.000460931], 0, 38.4957, 1668046379], "v": "v0.6"}
{"i": [["[\"softmax_reduce\", 12544, 49]", "cuda -keys=cuda,gpu -max_num_threads=1024 -model=unknown -thread_warp_size=32", [-1, 16, 64, 49152, 2147483647, 1024, 8, 32], "", 0, []], [[], [["FU", 1, [0, 1]], ["SP", 1, 0, 614656, [8], 1], ["AN", 1, 0, 5], ["AN", 1, 1, 6], ["PR", 1, 0, "auto_unroll_max_step$16"]]]], "r": [[0.000140439, 0.000140385, 0.000140349], 0, 42.5649, 1668046383], "v": "v0.6"}
{"i": [["[\"softmax_reduce\", 12544, 49]", "cuda -keys=cuda,gpu -max_num_threads=1024 -model=unknown -thread_warp_size=32", [-1, 16, 64, 49152, 2147483647, 1024, 8, 32], "", 0, []], [[], [["FU", 1, [0, 1]], ["SP", 1, 0, 614656, [28], 1], ["AN", 1, 0, 5], ["AN", 1, 1, 6], ["PR", 1, 0, "auto_unroll_max_step$1024"]]]], "r": [[8.47262e-05, 8.47049e-05, 8.47011e-05], 0, 45.4325, 1668046385], "v": "v0.6"}
{"i": [["[\"softmax_reduce\", 12544, 49]", "cuda -keys=cuda,gpu -max_num_threads=1024 -model=unknown -thread_warp_size=32", [-1, 16, 64, 49152, 2147483647, 1024, 8, 32], "", 0, []], [[], [["FU", 1, [0, 1]], ["SP", 1, 0, 614656, [28], 1], ["AN", 1, 0, 5], ["AN", 1, 1, 6], ["PR", 1, 0, "auto_unroll_max_step$16"]]]], "r": [[8.45391e-05, 8.46103e-05, 8.46233e-05], 0, 53.4071, 1668046394], "v": "v0.6"}
{"i": [["[\"softmax_reduce\", 12544, 49]", "cuda -keys=cuda,gpu -max_num_threads=1024 -model=unknown -thread_warp_size=32", [-1, 16, 64, 49152, 2147483647, 1024, 8, 32], "", 0, []], [[], [["FU", 1, [0, 1]], ["SP", 1, 0, 614656, [2], 1], ["AN", 1, 0, 5], ["AN", 1, 1, 6], ["PR", 1, 0, "auto_unroll_max_step$0"]]]], "r": [[0.00066846, 0.000668785, 0.000668123], 0, 41.1174, 1668046381], "v": "v0.6"}
{"i": [["[\"softmax_reduce\", 12544, 49]", "cuda -keys=cuda,gpu -max_num_threads=1024 -model=unknown -thread_warp_size=32", [-1, 16, 64, 49152, 2147483647, 1024, 8, 32], "", 0, []], [[], [["FU", 1, [0, 1]], ["SP", 1, 0, 614656, [32], 1], ["AN", 1, 0, 5], ["AN", 1, 1, 6], ["PR", 1, 0, "auto_unroll_max_step$0"]]]], "r": [[8.43795e-05, 8.43947e-05, 8.44008e-05], 0, 54.7144, 1668046395], "v": "v0.6"}
{"i": [["[\"softmax_reduce\", 12544, 49]", "cuda -keys=cuda,gpu -max_num_threads=1024 -model=unknown -thread_warp_size=32", [-1, 16, 64, 49152, 2147483647, 1024, 8, 32], "", 0, []], [[], [["FU", 1, [0, 1]], ["SP", 1, 0, 614656, [1], 1], ["AN", 1, 0, 5], ["AN", 1, 1, 6], ["PR", 1, 0, "auto_unroll_max_step$0"]]]], "r": [[0.00158871, 0.00158925, 0.00158943], 0, 49.3799, 1668046389], "v": "v0.6"}
{"i": [["[\"softmax_reduce\", 12544, 49]", "cuda -keys=cuda,gpu -max_num_threads=1024 -model=unknown -thread_warp_size=32", [-1, 16, 64, 49152, 2147483647, 1024, 8, 32], "", 0, []], [[], [["SP", 1, 2, 49, [48], 1], ["AN", 1, 3, 6], ["FU", 1, [0, 1]], ["AN", 1, 0, 5], ["PR", 1, 0, "auto_unroll_max_step$512"]]]], "r": [[0.00045997, 0.00045994, 0.000459848], 0, 50.669, 1668046391], "v": "v0.6"}
{"i": [["[\"softmax_reduce\", 12544, 49]", "cuda -keys=cuda,gpu -max_num_threads=1024 -model=unknown -thread_warp_size=32", [-1, 16, 64, 49152, 2147483647, 1024, 8, 32], "", 0, []], [[], [["FU", 1, [0, 1]], ["SP", 1, 0, 614656, [8], 1], ["AN", 1, 0, 5], ["AN", 1, 1, 6], ["PR", 1, 0, "auto_unroll_max_step$1024"]]]], "r": [[0.000140385, 0.000140361, 0.000140303], 0, 39.8787, 1668046380], "v": "v0.6"}
{"i": [["[\"softmax_reduce\", 12544, 49]", "cuda -keys=cuda,gpu -max_num_threads=1024 -model=unknown -thread_warp_size=32", [-1, 16, 64, 49152, 2147483647, 1024, 8, 32], "", 0, []], [[], [["FU", 1, [0, 1]], ["SP", 1, 0, 614656, [28], 1], ["AN", 1, 0, 5], ["AN", 1, 1, 6], ["PR", 1, 0, "auto_unroll_max_step$64"]]]], "r": [[8.47211e-05, 8.46963e-05, 8.46558e-05], 0, 52.018, 1668046392], "v": "v0.6"}
{"i": [["[\"softmax_reduce\", 12544, 49]", "cuda -keys=cuda,gpu -max_num_threads=1024 -model=unknown -thread_warp_size=32", [-1, 16, 64, 49152, 2147483647, 1024, 8, 32], "", 0, []], [[], [["SP", 1, 2, 49, [4], 1], ["AN", 1, 3, 6], ["FU", 1, [0, 1]], ["AN", 1, 0, 5], ["PR", 1, 0, "auto_unroll_max_step$0"]]]], "r": [[0.000498286, 0.000498183, 0.000498181], 0, 55.2129, 1668046396], "v": "v0.6"}
{"i": [["[\"softmax_reduce\", 12544, 49]", "cuda -keys=cuda,gpu -max_num_threads=1024 -model=unknown -thread_warp_size=32", [-1, 16, 64, 49152, 2147483647, 1024, 8, 32], "", 0, []], [[], [["FU", 1, [0, 1]], ["SP", 1, 0, 614656, [49], 1], ["AN", 1, 0, 5], ["AN", 1, 1, 6], ["PR", 1, 0, "auto_unroll_max_step$512"]]]], "r": [[9.1457e-05, 9.13026e-05, 9.13253e-05], 0, 55.3094, 1668046398], "v": "v0.6"}
{"i": [["[\"softmax_reduce\", 12544, 49]", "cuda -keys=cuda,gpu -max_num_threads=1024 -model=unknown -thread_warp_size=32", [-1, 16, 64, 49152, 2147483647, 1024, 8, 32], "", 0, []], [[], [["FU", 1, [0, 1]], ["SP", 1, 0, 614656, [4], 1], ["AN", 1, 0, 5], ["AN", 1, 1, 6], ["PR", 1, 0, "auto_unroll_max_step$16"]]]], "r": [[0.000289485, 0.000289266, 0.000289281], 0, 55.1937, 1668046399], "v": "v0.6"}
{"i": [["[\"softmax_reduce\", 12544, 49]", "cuda -keys=cuda,gpu -max_num_threads=1024 -model=unknown -thread_warp_size=32", [-1, 16, 64, 49152, 2147483647, 1024, 8, 32], "", 0, []], [[], [["SP", 1, 2, 49, [32], 1], ["AN", 1, 3, 6], ["FU", 1, [0, 1]], ["AN", 1, 0, 5], ["PR", 1, 0, "auto_unroll_max_step$64"]]]], "r": [[0.000460828, 0.000460663, 0.000460782], 0, 55.1027, 1668046400], "v": "v0.6"}
{"i": [["[\"softmax_reduce\", 12544, 49]", "cuda -keys=cuda,gpu -max_num_threads=1024 -model=unknown -thread_warp_size=32", [-1, 16, 64, 49152, 2147483647, 1024, 8, 32], "", 0, []], [[], [["SP", 1, 2, 49, [2], 1], ["AN", 1, 3, 6], ["FU", 1, [0, 1]], ["AN", 1, 0, 5], ["PR", 1, 0, "auto_unroll_max_step$64"]]]], "r": [[0.000702929, 0.000702758, 0.000702328], 0, 55.1731, 1668046402], "v": "v0.6"}
{"i": [["[\"softmax_reduce\", 12544, 49]", "cuda -keys=cuda,gpu -max_num_threads=1024 -model=unknown -thread_warp_size=32", [-1, 16, 64, 49152, 2147483647, 1024, 8, 32], "", 0, []], [[], [["FU", 1, [0, 1]], ["SP", 1, 0, 614656, [1], 1], ["AN", 1, 0, 5], ["AN", 1, 1, 6], ["PR", 1, 0, "auto_unroll_max_step$64"]]]], "r": [[0.00158827, 0.0015912, 0.00158952], 0, 55.1247, 1668046403], "v": "v0.6"}
{"i": [["[\"softmax_reduce\", 12544, 49]", "cuda -keys=cuda,gpu -max_num_threads=1024 -model=unknown -thread_warp_size=32", [-1, 16, 64, 49152, 2147483647, 1024, 8, 32], "", 0, []], [[], [["SP", 1, 2, 49, [4], 1], ["AN", 1, 3, 6], ["FU", 1, [0, 1]], ["AN", 1, 0, 5], ["PR", 1, 0, "auto_unroll_max_step$16"]]]], "r": [[0.000498986, 0.000498347, 0.000498335], 0, 55.1091, 1668046404], "v": "v0.6"}
{"i": [["[\"softmax_reduce\", 12544, 49]", "cuda -keys=cuda,gpu -max_num_threads=1024 -model=unknown -thread_warp_size=32", [-1, 16, 64, 49152, 2147483647, 1024, 8, 32], "", 0, []], [[], [["SP", 1, 2, 49, [49], 1], ["AN", 1, 3, 6], ["FU", 1, [0, 1]], ["AN", 1, 0, 5], ["PR", 1, 0, "auto_unroll_max_step$0"]]]], "r": [[0.000459748, 0.000459663, 0.000459654], 0, 55.2021, 1668046406], "v": "v0.6"}
{"i": [["[\"softmax_reduce\", 12544, 49]", "cuda -keys=cuda,gpu -max_num_threads=1024 -model=unknown -thread_warp_size=32", [-1, 16, 64, 49152, 2147483647, 1024, 8, 32], "", 0, []], [[], [["FU", 1, [0, 1]], ["SP", 1, 0, 614656, [16], 1], ["AN", 1, 0, 5], ["AN", 1, 1, 6], ["PR", 1, 0, "auto_unroll_max_step$16"]]]], "r": [[9.3396e-05, 9.33228e-05, 9.33193e-05], 0, 55.1523, 1668046407], "v": "v0.6"}
{"i": [["[\"softmax_reduce\", 12544, 49]", "cuda -keys=cuda,gpu -max_num_threads=1024 -model=unknown -thread_warp_size=32", [-1, 16, 64, 49152, 2147483647, 1024, 8, 32], "", 0, []], [[], [["SP", 1, 2, 49, [49], 1], ["AN", 1, 3, 6], ["FU", 1, [0, 1]], ["AN", 1, 0, 5], ["PR", 1, 0, "auto_unroll_max_step$512"]]]], "r": [[0.000459791, 0.000459737, 0.00045957], 0, 55.1625, 1668046409], "v": "v0.6"}
{"i": [["[\"softmax_reduce\", 12544, 49]", "cuda -keys=cuda,gpu -max_num_threads=1024 -model=unknown -thread_warp_size=32", [-1, 16, 64, 49152, 2147483647, 1024, 8, 32], "", 0, []], [[], [["SP", 1, 2, 49, [1], 1], ["AN", 1, 3, 6], ["FU", 1, [0, 1]], ["AN", 1, 0, 5], ["PR", 1, 0, "auto_unroll_max_step$64"]]]], "r": [[0.00094174, 0.000941523, 0.000941405], 0, 55.158, 1668046410], "v": "v0.6"}
{"i": [["[\"softmax_reduce\", 12544, 49]", "cuda -keys=cuda,gpu -max_num_threads=1024 -model=unknown -thread_warp_size=32", [-1, 16, 64, 49152, 2147483647, 1024, 8, 32], "", 0, []], [[], [["FU", 1, [0, 1]], ["SP", 1, 0, 614656, [49], 1], ["AN", 1, 0, 5], ["AN", 1, 1, 6], ["PR", 1, 0, "auto_unroll_max_step$16"]]]], "r": [[9.13933e-05, 9.13928e-05, 9.14399e-05], 0, 55.1112, 1668046411], "v": "v0.6"}
{"i": [["[\"softmax_reduce\", 12544, 49]", "cuda -keys=cuda,gpu -max_num_threads=1024 -model=unknown -thread_warp_size=32", [-1, 16, 64, 49152, 2147483647, 1024, 8, 32], "", 0, []], [[], [["SP", 1, 2, 49, [3], 1], ["AN", 1, 3, 6], ["FU", 1, [0, 1]], ["AN", 1, 0, 5], ["PR", 1, 0, "auto_unroll_max_step$1024"]]]], "r": [[0.000564589, 0.000564332, 0.000564444], 0, 55.1344, 1668046413], "v": "v0.6"}
{"i": [["[\"softmax_reduce\", 12544, 49]", "cuda -keys=cuda,gpu -max_num_threads=1024 -model=unknown -thread_warp_size=32", [-1, 16, 64, 49152, 2147483647, 1024, 8, 32], "", 0, []], [[], [["FU", 1, [0, 1]], ["SP", 1, 0, 614656, [64], 1], ["AN", 1, 0, 5], ["AN", 1, 1, 6], ["PR", 1, 0, "auto_unroll_max_step$512"]]]], "r": [[8.99742e-05, 8.99791e-05, 8.99466e-05], 0, 55.2291, 1668046414], "v": "v0.6"}
{"i": [["[\"softmax_reduce\", 12544, 49]", "cuda -keys=cuda,gpu -max_num_threads=1024 -model=unknown -thread_warp_size=32", [-1, 16, 64, 49152, 2147483647, 1024, 8, 32], "", 0, []], [[], [["FU", 1, [0, 1]], ["SP", 1, 0, 614656, [14], 1], ["AN", 1, 0, 5], ["AN", 1, 1, 6], ["PR", 1, 0, "auto_unroll_max_step$0"]]]], "r": [[0.00010579, 0.000105756, 0.000105706], 0, 55.1497, 1668046415], "v": "v0.6"}
{"i": [["[\"softmax_reduce\", 12544, 49]", "cuda -keys=cuda,gpu -max_num_threads=1024 -model=unknown -thread_warp_size=32", [-1, 16, 64, 49152, 2147483647, 1024, 8, 32], "", 0, []], [[], [["SP", 1, 2, 49, [16], 1], ["AN", 1, 3, 6], ["FU", 1, [0, 1]], ["AN", 1, 0, 5], ["PR", 1, 0, "auto_unroll_max_step$0"]]]], "r": [[0.000460924, 0.000460948, 0.000460853], 0, 55.0697, 1668046417], "v": "v0.6"}
{"i": [["[\"softmax_reduce\", 12544, 49]", "cuda -keys=cuda,gpu -max_num_threads=1024 -model=unknown -thread_warp_size=32", [-1, 16, 64, 49152, 2147483647, 1024, 8, 32], "", 0, []], [[], [["SP", 1, 2, 49, [6], 1], ["AN", 1, 3, 6], ["FU", 1, [0, 1]], ["AN", 1, 0, 5], ["PR", 1, 0, "auto_unroll_max_step$64"]]]], "r": [[0.00045986, 0.000459767, 0.000459803], 0, 55.1274, 1668046418], "v": "v0.6"}
{"i": [["[\"softmax_reduce\", 12544, 49]", "cuda -keys=cuda,gpu -max_num_threads=1024 -model=unknown -thread_warp_size=32", [-1, 16, 64, 49152, 2147483647, 1024, 8, 32], "", 0, []], [[], [["SP", 1, 2, 49, [6], 1], ["AN", 1, 3, 6], ["FU", 1, [0, 1]], ["AN", 1, 0, 5], ["PR", 1, 0, "auto_unroll_max_step$0"]]]], "r": [[0.000460188, 0.000459986, 0.000460004], 0, 55.1092, 1668046420], "v": "v0.6"}
{"i": [["[\"softmax_reduce\", 12544, 49]", "cuda -keys=cuda,gpu -max_num_threads=1024 -model=unknown -thread_warp_size=32", [-1, 16, 64, 49152, 2147483647, 1024, 8, 32], "", 0, []], [[], [["SP", 1, 2, 49, [3], 1], ["AN", 1, 3, 6], ["FU", 1, [0, 1]], ["AN", 1, 0, 5], ["PR", 1, 0, "auto_unroll_max_step$64"]]]], "r": [[0.000564541, 0.000564412, 0.000564396], 0, 55.0564, 1668046421], "v": "v0.6"}
{"i": [["[\"softmax_reduce\", 12544, 49]", "cuda -keys=cuda,gpu -max_num_threads=1024 -model=unknown -thread_warp_size=32", [-1, 16, 64, 49152, 2147483647, 1024, 8, 32], "", 0, []], [[], [["FU", 1, [0, 1]], ["SP", 1, 0, 614656, [4], 1], ["AN", 1, 0, 5], ["AN", 1, 1, 6], ["PR", 1, 0, "auto_unroll_max_step$64"]]]], "r": [[0.000289398, 0.000289421, 0.000289188], 0, 55.0728, 1668046422], "v": "v0.6"}
{"i": [["[\"softmax_reduce\", 12544, 49]", "cuda -keys=cuda,gpu -max_num_threads=1024 -model=unknown -thread_warp_size=32", [-1, 16, 64, 49152, 2147483647, 1024, 8, 32], "", 0, []], [[], [["FU", 1, [0, 1]], ["SP", 1, 0, 614656, [8], 1], ["AN", 1, 0, 5], ["AN", 1, 1, 6], ["PR", 1, 0, "auto_unroll_max_step$512"]]]], "r": [[0.000140348, 0.000140352, 0.000140296], 0, 54.9992, 1668046424], "v": "v0.6"}
{"i": [["[\"softmax_reduce\", 12544, 49]", "cuda -keys=cuda,gpu -max_num_threads=1024 -model=unknown -thread_warp_size=32", [-1, 16, 64, 49152, 2147483647, 1024, 8, 32], "", 0, []], [[], [["SP", 1, 2, 49, [32], 1], ["AN", 1, 3, 6], ["FU", 1, [0, 1]], ["AN", 1, 0, 5], ["PR", 1, 0, "auto_unroll_max_step$512"]]]], "r": [[0.00046066, 0.000460625, 0.000460834], 0, 55.03, 1668046425], "v": "v0.6"}
{"i": [["[\"softmax_reduce\", 12544, 49]", "cuda -keys=cuda,gpu -max_num_threads=1024 -model=unknown -thread_warp_size=32", [-1, 16, 64, 49152, 2147483647, 1024, 8, 32], "", 0, []], [[], [["FU", 1, [0, 1]], ["SP", 1, 0, 614656, [32], 1], ["AN", 1, 0, 5], ["AN", 1, 1, 6], ["PR", 1, 0, "auto_unroll_max_step$64"]]]], "r": [[8.43631e-05, 8.43468e-05, 8.42898e-05], 0, 55.1026, 1668046426], "v": "v0.6"}
{"i": [["[\"softmax_reduce\", 12544, 49]", "cuda -keys=cuda,gpu -max_num_threads=1024 -model=unknown -thread_warp_size=32", [-1, 16, 64, 49152, 2147483647, 1024, 8, 32], "", 0, []], [[], [["SP", 1, 2, 49, [32], 1], ["AN", 1, 3, 6], ["FU", 1, [0, 1]], ["AN", 1, 0, 5], ["PR", 1, 0, "auto_unroll_max_step$0"]]]], "r": [[0.000460883, 0.000460666, 0.000460803], 0, 55.077, 1668046428], "v": "v0.6"}
{"i": [["[\"softmax_reduce\", 12544, 49]", "cuda -keys=cuda,gpu -max_num_threads=1024 -model=unknown -thread_warp_size=32", [-1, 16, 64, 49152, 2147483647, 1024, 8, 32], "", 0, []], [[], [["SP", 1, 2, 49, [49], 1], ["AN", 1, 3, 6], ["FU", 1, [0, 1]], ["AN", 1, 0, 5], ["PR", 1, 0, "auto_unroll_max_step$16"]]]], "r": [[0.000459747, 0.000459711, 0.000459723], 0, 53.3418, 1668046488], "v": "v0.6"}
{"i": [["[\"softmax_reduce\", 12544, 49]", "cuda -keys=cuda,gpu -max_num_threads=1024 -model=unknown -thread_warp_size=32", [-1, 16, 64, 49152, 2147483647, 1024, 8, 32], "", 0, []], [[], [["FU", 1, [0, 1]], ["SP", 1, 0, 614656, [7], 1], ["AN", 1, 0, 5], ["AN", 1, 1, 6], ["PR", 1, 0, "auto_unroll_max_step$16"]]]], "r": [[0.000168659, 0.0001686, 0.00016854], 0, 20.7745, 1668046455], "v": "v0.6"}
{"i": [["[\"softmax_reduce\", 12544, 49]", "cuda -keys=cuda,gpu -max_num_threads=1024 -model=unknown -thread_warp_size=32", [-1, 16, 64, 49152, 2147483647, 1024, 8, 32], "", 0, []], [[], [["SP", 1, 2, 49, [24], 1], ["AN", 1, 3, 6], ["FU", 1, [0, 1]], ["AN", 1, 0, 5], ["PR", 1, 0, "auto_unroll_max_step$16"]]]], "r": [[0.000461099, 0.000461095, 0.000460986], 0, 8.81274, 1668046443], "v": "v0.6"}
{"i": [["[\"softmax_reduce\", 12544, 49]", "cuda -keys=cuda,gpu -max_num_threads=1024 -model=unknown -thread_warp_size=32", [-1, 16, 64, 49152, 2147483647, 1024, 8, 32], "", 0, []], [[], [["FU", 1, [0, 1]], ["SP", 1, 0, 614656, [49], 1], ["AN", 1, 0, 5], ["AN", 1, 1, 6], ["PR", 1, 0, "auto_unroll_max_step$64"]]]], "r": [[9.13806e-05, 9.12673e-05, 9.13838e-05], 0, 2.0414, 1668046436], "v": "v0.6"}
{"i": [["[\"softmax_reduce\", 12544, 49]", "cuda -keys=cuda,gpu -max_num_threads=1024 -model=unknown -thread_warp_size=32", [-1, 16, 64, 49152, 2147483647, 1024, 8, 32], "", 0, []], [[], [["FU", 1, [0, 1]], ["SP", 1, 0, 614656, [7], 1], ["AN", 1, 0, 5], ["AN", 1, 1, 6], ["PR", 1, 0, "auto_unroll_max_step$64"]]]], "r": [[0.000168675, 0.000168626, 0.000168578], 0, 22.1224, 1668046456], "v": "v0.6"}
{"i": [["[\"softmax_reduce\", 12544, 49]", "cuda -keys=cuda,gpu -max_num_threads=1024 -model=unknown -thread_warp_size=32", [-1, 16, 64, 49152, 2147483647, 1024, 8, 32], "", 0, []], [[], [["SP", 1, 2, 49, [24], 1], ["AN", 1, 3, 6], ["FU", 1, [0, 1]], ["AN", 1, 0, 5], ["PR", 1, 0, "auto_unroll_max_step$1024"]]]], "r": [[0.000460818, 0.000460773, 0.000460749], 0, 4.86713, 1668046439], "v": "v0.6"}
{"i": [["[\"softmax_reduce\", 12544, 49]", "cuda -keys=cuda,gpu -max_num_threads=1024 -model=unknown -thread_warp_size=32", [-1, 16, 64, 49152, 2147483647, 1024, 8, 32], "", 0, []], [[], [["SP", 1, 2, 49, [12], 1], ["AN", 1, 3, 6], ["FU", 1, [0, 1]], ["AN", 1, 0, 5], ["PR", 1, 0, "auto_unroll_max_step$1024"]]]], "r": [[0.000461015, 0.000460825, 0.000460696], 0, 9.98937, 1668046444], "v": "v0.6"}
{"i": [["[\"softmax_reduce\", 12544, 49]", "cuda -keys=cuda,gpu -max_num_threads=1024 -model=unknown -thread_warp_size=32", [-1, 16, 64, 49152, 2147483647, 1024, 8, 32], "", 0, []], [[], [["FU", 1, [0, 1]], ["SP", 1, 0, 614656, [49], 1], ["AN", 1, 0, 5], ["AN", 1, 1, 6], ["PR", 1, 0, "auto_unroll_max_step$0"]]]], "r": [[9.13386e-05, 9.13394e-05, 9.13302e-05], 0, 7.3807, 1668046441], "v": "v0.6"}
{"i": [["[\"softmax_reduce\", 12544, 49]", "cuda -keys=cuda,gpu -max_num_threads=1024 -model=unknown -thread_warp_size=32", [-1, 16, 64, 49152, 2147483647, 1024, 8, 32], "", 0, []], [[], [["FU", 1, [0, 1]], ["SP", 1, 0, 614656, [1], 1], ["AN", 1, 0, 5], ["AN", 1, 1, 6], ["PR", 1, 0, "auto_unroll_max_step$512"]]]], "r": [[0.00158732, 0.00158812, 0.00158718], 0, 16.814, 1668046451], "v": "v0.6"}
{"i": [["[\"softmax_reduce\", 12544, 49]", "cuda -keys=cuda,gpu -max_num_threads=1024 -model=unknown -thread_warp_size=32", [-1, 16, 64, 49152, 2147483647, 1024, 8, 32], "", 0, []], [[], [["FU", 1, [0, 1]], ["SP", 1, 0, 614656, [56], 1], ["AN", 1, 0, 5], ["AN", 1, 1, 6], ["PR", 1, 0, "auto_unroll_max_step$64"]]]], "r": [[9.15496e-05, 9.153e-05, 9.156e-05], 0, 3.51288, 1668046437], "v": "v0.6"}
{"i": [["[\"softmax_reduce\", 12544, 49]", "cuda -keys=cuda,gpu -max_num_threads=1024 -model=unknown -thread_warp_size=32", [-1, 16, 64, 49152, 2147483647, 1024, 8, 32], "", 0, []], [[], [["FU", 1, [0, 1]], ["SP", 1, 0, 614656, [2], 1], ["AN", 1, 0, 5], ["AN", 1, 1, 6], ["PR", 1, 0, "auto_unroll_max_step$16"]]]], "r": [[0.000668361, 0.000667567, 0.000667779], 0, 54.6397, 1668046489], "v": "v0.6"}
{"i": [["[\"softmax_reduce\", 12544, 49]", "cuda -keys=cuda,gpu -max_num_threads=1024 -model=unknown -thread_warp_size=32", [-1, 16, 64, 49152, 2147483647, 1024, 8, 32], "", 0, []], [[], [["FU", 1, [0, 1]], ["SP", 1, 0, 614656, [32], 1], ["AN", 1, 0, 5], ["AN", 1, 1, 6], ["PR", 1, 0, "auto_unroll_max_step$16"]]]], "r": [[8.42909e-05, 8.42426e-05, 8.42351e-05], 0, 26.3388, 1668046460], "v": "v0.6"}
{"i": [["[\"softmax_reduce\", 12544, 49]", "cuda -keys=cuda,gpu -max_num_threads=1024 -model=unknown -thread_warp_size=32", [-1, 16, 64, 49152, 2147483647, 1024, 8, 32], "", 0, []], [[], [["FU", 1, [0, 1]], ["SP", 1, 0, 614656, [16], 1], ["AN", 1, 0, 5], ["AN", 1, 1, 6], ["PR", 1, 0, "auto_unroll_max_step$512"]]]], "r": [[9.34784e-05, 9.34632e-05, 9.34132e-05], 0, 14.1116, 1668046448], "v": "v0.6"}
{"i": [["[\"softmax_reduce\", 12544, 49]", "cuda -keys=cuda,gpu -max_num_threads=1024 -model=unknown -thread_warp_size=32", [-1, 16, 64, 49152, 2147483647, 1024, 8, 32], "", 0, []], [[], [["FU", 1, [0, 1]], ["SP", 1, 0, 614656, [16], 1], ["AN", 1, 0, 5], ["AN", 1, 1, 6], ["PR", 1, 0, "auto_unroll_max_step$0"]]]], "r": [[9.33785e-05, 9.33348e-05, 9.32855e-05], 0, 11.3518, 1668046445], "v": "v0.6"}
{"i": [["[\"softmax_reduce\", 12544, 49]", "cuda -keys=cuda,gpu -max_num_threads=1024 -model=unknown -thread_warp_size=32", [-1, 16, 64, 49152, 2147483647, 1024, 8, 32], "", 0, []], [[], [["SP", 1, 2, 49, [8], 1], ["AN", 1, 3, 6], ["FU", 1, [0, 1]], ["AN", 1, 0, 5], ["PR", 1, 0, "auto_unroll_max_step$64"]]]], "r": [[0.000460833, 0.000460891, 0.000460704], 0, 19.4526, 1668046454], "v": "v0.6"}
{"i": [["[\"softmax_reduce\", 12544, 49]", "cuda -keys=cuda,gpu -max_num_threads=1024 -model=unknown -thread_warp_size=32", [-1, 16, 64, 49152, 2147483647, 1024, 8, 32], "", 0, []], [[], [["SP", 1, 2, 49, [16], 1], ["AN", 1, 3, 6], ["FU", 1, [0, 1]], ["AN", 1, 0, 5], ["PR", 1, 0, "auto_unroll_max_step$1024"]]]], "r": [[0.000461014, 0.00046078, 0.000460633], 0, 23.671, 1668046458], "v": "v0.6"}
{"i": [["[\"softmax_reduce\", 12544, 49]", "cuda -keys=cuda,gpu -max_num_threads=1024 -model=unknown -thread_warp_size=32", [-1, 16, 64, 49152, 2147483647, 1024, 8, 32], "", 0, []], [[], [["FU", 1, [0, 1]], ["SP", 1, 0, 614656, [32], 1], ["AN", 1, 0, 5], ["AN", 1, 1, 6], ["PR", 1, 0, "auto_unroll_max_step$512"]]]], "r": [[8.42599e-05, 8.4265e-05, 8.41972e-05], 0, 30.3911, 1668046465], "v": "v0.6"}
{"i": [["[\"softmax_reduce\", 12544, 49]", "cuda -keys=cuda,gpu -max_num_threads=1024 -model=unknown -thread_warp_size=32", [-1, 16, 64, 49152, 2147483647, 1024, 8, 32], "", 0, []], [[], [["FU", 1, [0, 1]], ["SP", 1, 0, 614656, [56], 1], ["AN", 1, 0, 5], ["AN", 1, 1, 6], ["PR", 1, 0, "auto_unroll_max_step$16"]]]], "r": [[9.14549e-05, 9.15219e-05, 9.14828e-05], 0, 35.8901, 1668046470], "v": "v0.6"}
{"i": [["[\"softmax_reduce\", 12544, 49]", "cuda -keys=cuda,gpu -max_num_threads=1024 -model=unknown -thread_warp_size=32", [-1, 16, 64, 49152, 2147483647, 1024, 8, 32], "", 0, []], [[], [["SP", 1, 2, 49, [16], 1], ["AN", 1, 3, 6], ["FU", 1, [0, 1]], ["AN", 1, 0, 5], ["PR", 1, 0, "auto_unroll_max_step$512"]]]], "r": [[0.000460941, 0.00046083, 0.000460792], 0, 12.8566, 1668046447], "v": "v0.6"}
{"i": [["[\"softmax_reduce\", 12544, 49]", "cuda -keys=cuda,gpu -max_num_threads=1024 -model=unknown -thread_warp_size=32", [-1, 16, 64, 49152, 2147483647, 1024, 8, 32], "", 0, []], [[], [["SP", 1, 2, 49, [49], 1], ["AN", 1, 3, 6], ["FU", 1, [0, 1]], ["AN", 1, 0, 5], ["PR", 1, 0, "auto_unroll_max_step$1024"]]]], "r": [[0.000459492, 0.000459523, 0.000459598], 0, 34.5968, 1668046469], "v": "v0.6"}
{"i": [["[\"softmax_reduce\", 12544, 49]", "cuda -keys=cuda,gpu -max_num_threads=1024 -model=unknown -thread_warp_size=32", [-1, 16, 64, 49152, 2147483647, 1024, 8, 32], "", 0, []], [[], [["SP", 1, 2, 49, [6], 1], ["AN", 1, 3, 6], ["FU", 1, [0, 1]], ["AN", 1, 0, 5], ["PR", 1, 0, "auto_unroll_max_step$1024"]]]], "r": [[0.000459714, 0.000459589, 0.000459688], 0, 37.2245, 1668046471], "v": "v0.6"}
{"i": [["[\"softmax_reduce\", 12544, 49]", "cuda -keys=cuda,gpu -max_num_threads=1024 -model=unknown -thread_warp_size=32", [-1, 16, 64, 49152, 2147483647, 1024, 8, 32], "", 0, []], [[], [["FU", 1, [0, 1]], ["SP", 1, 0, 614656, [64], 1], ["AN", 1, 0, 5], ["AN", 1, 1, 6], ["PR", 1, 0, "auto_unroll_max_step$0"]]]], "r": [[8.97763e-05, 8.98603e-05, 8.983e-05], 0, 15.5989, 1668046450], "v": "v0.6"}
{"i": [["[\"softmax_reduce\", 12544, 49]", "cuda -keys=cuda,gpu -max_num_threads=1024 -model=unknown -thread_warp_size=32", [-1, 16, 64, 49152, 2147483647, 1024, 8, 32], "", 0, []], [[], [["SP", 1, 2, 49, [6], 1], ["AN", 1, 3, 6], ["FU", 1, [0, 1]], ["AN", 1, 0, 5], ["PR", 1, 0, "auto_unroll_max_step$512"]]]], "r": [[0.000459682, 0.0004597, 0.000459741], 0, 18.1839, 1668046452], "v": "v0.6"}
{"i": [["[\"softmax_reduce\", 12544, 49]", "cuda -keys=cuda,gpu -max_num_threads=1024 -model=unknown -thread_warp_size=32", [-1, 16, 64, 49152, 2147483647, 1024, 8, 32], "", 0, []], [[], [["SP", 1, 2, 49, [7], 1], ["AN", 1, 3, 6], ["FU", 1, [0, 1]], ["AN", 1, 0, 5], ["PR", 1, 0, "auto_unroll_max_step$16"]]]], "r": [[0.0004609, 0.000460751, 0.000460826], 0, 5.96045, 1668046440], "v": "v0.6"}
{"i": [["[\"softmax_reduce\", 12544, 49]", "cuda -keys=cuda,gpu -max_num_threads=1024 -model=unknown -thread_warp_size=32", [-1, 16, 64, 49152, 2147483647, 1024, 8, 32], "", 0, []], [[], [["SP", 1, 2, 49, [12], 1], ["AN", 1, 3, 6], ["FU", 1, [0, 1]], ["AN", 1, 0, 5], ["PR", 1, 0, "auto_unroll_max_step$512"]]]], "r": [[0.000460952, 0.000460931, 0.000460735], 0, 31.6858, 1668046466], "v": "v0.6"}
{"i": [["[\"softmax_reduce\", 12544, 49]", "cuda -keys=cuda,gpu -max_num_threads=1024 -model=unknown -thread_warp_size=32", [-1, 16, 64, 49152, 2147483647, 1024, 8, 32], "", 0, []], [[], [["SP", 1, 2, 49, [3], 1], ["AN", 1, 3, 6], ["FU", 1, [0, 1]], ["AN", 1, 0, 5], ["PR", 1, 0, "auto_unroll_max_step$0"]]]], "r": [[0.000564524, 0.000564476, 0.000564527], 0, 47.9519, 1668046482], "v": "v0.6"}
{"i": [["[\"softmax_reduce\", 12544, 49]", "cuda -keys=cuda,gpu -max_num_threads=1024 -model=unknown -thread_warp_size=32", [-1, 16, 64, 49152, 2147483647, 1024, 8, 32], "", 0, []], [[], [["SP", 1, 2, 49, [48], 1], ["AN", 1, 3, 6], ["FU", 1, [0, 1]], ["AN", 1, 0, 5], ["PR", 1, 0, "auto_unroll_max_step$64"]]]], "r": [[0.000459594, 0.000459624, 0.000459633], 0, 33.2003, 1668046467], "v": "v0.6"}
{"i": [["[\"softmax_reduce\", 12544, 49]", "cuda -keys=cuda,gpu -max_num_threads=1024 -model=unknown -thread_warp_size=32", [-1, 16, 64, 49152, 2147483647, 1024, 8, 32], "", 0, []], [[], [["FU", 1, [0, 1]], ["SP", 1, 0, 614656, [7], 1], ["AN", 1, 0, 5], ["AN", 1, 1, 6], ["PR", 1, 0, "auto_unroll_max_step$0"]]]], "r": [[0.000168698, 0.000168519, 0.000168587], 0, 46.7071, 1668046481], "v": "v0.6"}
{"i": [["[\"softmax_reduce\", 12544, 49]", "cuda -keys=cuda,gpu -max_num_threads=1024 -model=unknown -thread_warp_size=32", [-1, 16, 64, 49152, 2147483647, 1024, 8, 32], "", 0, []], [[], [["FU", 1, [0, 1]], ["SP", 1, 0, 614656, [2], 1], ["AN", 1, 0, 5], ["AN", 1, 1, 6], ["PR", 1, 0, "auto_unroll_max_step$512"]]]], "r": [[0.000668803, 0.00066783, 0.000667745], 0, 27.4768, 1668046462], "v": "v0.6"}
{"i": [["[\"softmax_reduce\", 12544, 49]", "cuda -keys=cuda,gpu -max_num_threads=1024 -model=unknown -thread_warp_size=32", [-1, 16, 64, 49152, 2147483647, 1024, 8, 32], "", 0, []], [[], [["FU", 1, [0, 1]], ["SP", 1, 0, 614656, [56], 1], ["AN", 1, 0, 5], ["AN", 1, 1, 6], ["PR", 1, 0, "auto_unroll_max_step$1024"]]]], "r": [[9.14785e-05, 9.15122e-05, 9.14477e-05], 0, 39.9444, 1668046474], "v": "v0.6"}
{"i": [["[\"softmax_reduce\", 12544, 49]", "cuda -keys=cuda,gpu -max_num_threads=1024 -model=unknown -thread_warp_size=32", [-1, 16, 64, 49152, 2147483647, 1024, 8, 32], "", 0, []], [[], [["FU", 1, [0, 1]], ["SP", 1, 0, 614656, [64], 1], ["AN", 1, 0, 5], ["AN", 1, 1, 6], ["PR", 1, 0, "auto_unroll_max_step$16"]]]], "r": [[8.98034e-05, 8.99045e-05, 8.98001e-05], 0, 41.2756, 1668046476], "v": "v0.6"}
{"i": [["[\"softmax_reduce\", 12544, 49]", "cuda -keys=cuda,gpu -max_num_threads=1024 -model=unknown -thread_warp_size=32", [-1, 16, 64, 49152, 2147483647, 1024, 8, 32], "", 0, []], [[], [["FU", 1, [0, 1]], ["SP", 1, 0, 614656, [7], 1], ["AN", 1, 0, 5], ["AN", 1, 1, 6], ["PR", 1, 0, "auto_unroll_max_step$1024"]]]], "r": [[0.00016868, 0.000168606, 0.00016867], 0, 43.9677, 1668046478], "v": "v0.6"}
{"i": [["[\"softmax_reduce\", 12544, 49]", "cuda -keys=cuda,gpu -max_num_threads=1024 -model=unknown -thread_warp_size=32", [-1, 16, 64, 49152, 2147483647, 1024, 8, 32], "", 0, []], [[], [["FU", 1, [0, 1]], ["SP", 1, 0, 614656, [14], 1], ["AN", 1, 0, 5], ["AN", 1, 1, 6], ["PR", 1, 0, "auto_unroll_max_step$64"]]]], "r": [[0.000105821, 0.000105778, 0.000105705], 0, 28.9779, 1668046463], "v": "v0.6"}
{"i": [["[\"softmax_reduce\", 12544, 49]", "cuda -keys=cuda,gpu -max_num_threads=1024 -model=unknown -thread_warp_size=32", [-1, 16, 64, 49152, 2147483647, 1024, 8, 32], "", 0, []], [[], [["SP", 1, 2, 49, [4], 1], ["AN", 1, 3, 6], ["FU", 1, [0, 1]], ["AN", 1, 0, 5], ["PR", 1, 0, "auto_unroll_max_step$512"]]]], "r": [[0.000498165, 0.000498337, 0.000498165], 0, 38.5478, 1668046473], "v": "v0.6"}
{"i": [["[\"softmax_reduce\", 12544, 49]", "cuda -keys=cuda,gpu -max_num_threads=1024 -model=unknown -thread_warp_size=32", [-1, 16, 64, 49152, 2147483647, 1024, 8, 32], "", 0, []], [[], [["SP", 1, 2, 49, [48], 1], ["AN", 1, 3, 6], ["FU", 1, [0, 1]], ["AN", 1, 0, 5], ["PR", 1, 0, "auto_unroll_max_step$1024"]]]], "r": [[0.00045968, 0.000459606, 0.000459633], 0, 49.4122, 1668046484], "v": "v0.6"}
{"i": [["[\"softmax_reduce\", 12544, 49]", "cuda -keys=cuda,gpu -max_num_threads=1024 -model=unknown -thread_warp_size=32", [-1, 16, 64, 49152, 2147483647, 1024, 8, 32], "", 0, []], [[], [["FU", 1, [0, 1]], ["SP", 1, 0, 614656, [7], 1], ["AN", 1, 0, 5], ["AN", 1, 1, 6], ["PR", 1, 0, "auto_unroll_max_step$512"]]]], "r": [[0.000168583, 0.000168567, 0.000168551], 0, 50.6432, 1668046485], "v": "v0.6"}
{"i": [["[\"softmax_reduce\", 12544, 49]", "cuda -keys=cuda,gpu -max_num_threads=1024 -model=unknown -thread_warp_size=32", [-1, 16, 64, 49152, 2147483647, 1024, 8, 32], "", 0, []], [[], [["FU", 1, [0, 1]], ["SP", 1, 0, 614656, [8], 1], ["AN", 1, 0, 5], ["AN", 1, 1, 6], ["PR", 1, 0, "auto_unroll_max_step$0"]]]], "r": [[0.000140429, 0.000140289, 0.00014037], 0, 42.6742, 1668046477], "v": "v0.6"}
{"i": [["[\"softmax_reduce\", 12544, 49]", "cuda -keys=cuda,gpu -max_num_threads=1024 -model=unknown -thread_warp_size=32", [-1, 16, 64, 49152, 2147483647, 1024, 8, 32], "", 0, []], [[], [["FU", 1, [0, 1]], ["SP", 1, 0, 614656, [64], 1], ["AN", 1, 0, 5], ["AN", 1, 1, 6], ["PR", 1, 0, "auto_unroll_max_step$1024"]]]], "r": [[8.97936e-05, 8.97922e-05, 8.99128e-05], 0, 24.8047, 1668046459], "v": "v0.6"}
{"i": [["[\"softmax_reduce\", 12544, 49]", "cuda -keys=cuda,gpu -max_num_threads=1024 -model=unknown -thread_warp_size=32", [-1, 16, 64, 49152, 2147483647, 1024, 8, 32], "", 0, []], [[], [["SP", 1, 2, 49, [12], 1], ["AN", 1, 3, 6], ["FU", 1, [0, 1]], ["AN", 1, 0, 5], ["PR", 1, 0, "auto_unroll_max_step$0"]]]], "r": [[0.000460955, 0.000460892, 0.00046088], 0, 51.9464, 1668046486], "v": "v0.6"}
{"i": [["[\"softmax_reduce\", 12544, 49]", "cuda -keys=cuda,gpu -max_num_threads=1024 -model=unknown -thread_warp_size=32", [-1, 16, 64, 49152, 2147483647, 1024, 8, 32], "", 0, []], [[], [["SP", 1, 2, 49, [8], 1], ["AN", 1, 3, 6], ["FU", 1, [0, 1]], ["AN", 1, 0, 5], ["PR", 1, 0, "auto_unroll_max_step$512"]]]], "r": [[0.000461176, 0.000461031, 0.000460891], 0, 45.0747, 1668046480], "v": "v0.6"}
{"i": [["[\"softmax_reduce\", 12544, 49]", "cuda -keys=cuda,gpu -max_num_threads=1024 -model=unknown -thread_warp_size=32", [-1, 16, 64, 49152, 2147483647, 1024, 8, 32], "", 0, []], [[], [["SP", 1, 2, 49, [8], 1], ["AN", 1, 3, 6], ["FU", 1, [0, 1]], ["AN", 1, 0, 5], ["PR", 1, 0, "auto_unroll_max_step$16"]]]], "r": [[0.000460914, 0.000460823, 0.00046077], 0, 55.2579, 1668046490], "v": "v0.6"}
{"i": [["[\"softmax_reduce\", 12544, 49]", "cuda -keys=cuda,gpu -max_num_threads=1024 -model=unknown -thread_warp_size=32", [-1, 16, 64, 49152, 2147483647, 1024, 8, 32], "", 0, []], [[], [["SP", 1, 2, 49, [2], 1], ["AN", 1, 3, 6], ["FU", 1, [0, 1]], ["AN", 1, 0, 5], ["PR", 1, 0, "auto_unroll_max_step$0"]]]], "r": [[0.00070257, 0.000702526, 0.000702447], 0, 55.035, 1668046492], "v": "v0.6"}
{"i": [["[\"softmax_reduce\", 12544, 49]", "cuda -keys=cuda,gpu -max_num_threads=1024 -model=unknown -thread_warp_size=32", [-1, 16, 64, 49152, 2147483647, 1024, 8, 32], "", 0, []], [[], [["FU", 1, [0, 1]], ["SP", 1, 0, 614656, [14], 1], ["AN", 1, 0, 5], ["AN", 1, 1, 6], ["PR", 1, 0, "auto_unroll_max_step$512"]]]], "r": [[0.00010579, 0.000105782, 0.000105767], 0, 55.0032, 1668046493], "v": "v0.6"}
{"i": [["[\"softmax_reduce\", 12544, 49]", "cuda -keys=cuda,gpu -max_num_threads=1024 -model=unknown -thread_warp_size=32", [-1, 16, 64, 49152, 2147483647, 1024, 8, 32], "", 0, []], [[], [["SP", 1, 2, 49, [7], 1], ["AN", 1, 3, 6], ["FU", 1, [0, 1]], ["AN", 1, 0, 5], ["PR", 1, 0, "auto_unroll_max_step$64"]]]], "r": [[0.000460805, 0.000460661, 0.000460673], 0, 55.0754, 1668046495], "v": "v0.6"}
{"i": [["[\"softmax_reduce\", 12544, 49]", "cuda -keys=cuda,gpu -max_num_threads=1024 -model=unknown -thread_warp_size=32", [-1, 16, 64, 49152, 2147483647, 1024, 8, 32], "", 0, []], [[], [["SP", 1, 2, 49, [24], 1], ["AN", 1, 3, 6], ["FU", 1, [0, 1]], ["AN", 1, 0, 5], ["PR", 1, 0, "auto_unroll_max_step$0"]]]], "r": [[0.000460878, 0.000460694, 0.0004607], 0, 55.0118, 1668046496], "v": "v0.6"}
{"i": [["[\"softmax_reduce\", 12544, 49]", "cuda -keys=cuda,gpu -max_num_threads=1024 -model=unknown -thread_warp_size=32", [-1, 16, 64, 49152, 2147483647, 1024, 8, 32], "", 0, []], [[], [["SP", 1, 2, 49, [8], 1], ["AN", 1, 3, 6], ["FU", 1, [0, 1]], ["AN", 1, 0, 5], ["PR", 1, 0, "auto_unroll_max_step$0"]]]], "r": [[0.000460929, 0.000460813, 0.000460867], 0, 55.0354, 1668046497], "v": "v0.6"}
{"i": [["[\"softmax_reduce\", 12544, 49]", "cuda -keys=cuda,gpu -max_num_threads=1024 -model=unknown -thread_warp_size=32", [-1, 16, 64, 49152, 2147483647, 1024, 8, 32], "", 0, []], [[], [["FU", 1, [0, 1]], ["SP", 1, 0, 614656, [1], 1], ["AN", 1, 0, 5], ["AN", 1, 1, 6], ["PR", 1, 0, "auto_unroll_max_step$16"]]]], "r": [[0.00159021, 0.00158884, 0.00159065], 0, 55.0388, 1668046499], "v": "v0.6"}
{"i": [["[\"softmax_reduce\", 12544, 49]", "cuda -keys=cuda,gpu -max_num_threads=1024 -model=unknown -thread_warp_size=32", [-1, 16, 64, 49152, 2147483647, 1024, 8, 32], "", 0, []], [[], [["SP", 1, 2, 49, [2], 1], ["AN", 1, 3, 6], ["FU", 1, [0, 1]], ["AN", 1, 0, 5], ["PR", 1, 0, "auto_unroll_max_step$16"]]]], "r": [[0.000702752, 0.000702731, 0.000702668], 0, 54.9528, 1668046500], "v": "v0.6"}
{"i": [["[\"softmax_reduce\", 12544, 49]", "cuda -keys=cuda,gpu -max_num_threads=1024 -model=unknown -thread_warp_size=32", [-1, 16, 64, 49152, 2147483647, 1024, 8, 32], "", 0, []], [[], [["FU", 1, [0, 1]], ["SP", 1, 0, 614656, [4], 1], ["AN", 1, 0, 5], ["AN", 1, 1, 6], ["PR", 1, 0, "auto_unroll_max_step$1024"]]]], "r": [[0.000289165, 0.000289181, 0.000289123], 0, 55.0583, 1668046501], "v": "v0.6"}
{"i": [["[\"softmax_reduce\", 12544, 49]", "cuda -keys=cuda,gpu -max_num_threads=1024 -model=unknown -thread_warp_size=32", [-1, 16, 64, 49152, 2147483647, 1024, 8, 32], "", 0, []], [[], [["FU", 1, [0, 1]], ["SP", 1, 0, 614656, [2], 1], ["AN", 1, 0, 5], ["AN", 1, 1, 6], ["PR", 1, 0, "auto_unroll_max_step$64"]]]], "r": [[0.000668436, 0.00066746, 0.000667576], 0, 54.9831, 1668046503], "v": "v0.6"}
{"i": [["[\"softmax_reduce\", 12544, 49]", "cuda -keys=cuda,gpu -max_num_threads=1024 -model=unknown -thread_warp_size=32", [-1, 16, 64, 49152, 2147483647, 1024, 8, 32], "", 0, []], [[], [["SP", 1, 2, 49, [1], 1], ["AN", 1, 3, 6], ["FU", 1, [0, 1]], ["AN", 1, 0, 5], ["PR", 1, 0, "auto_unroll_max_step$512"]]]], "r": [[0.000941525, 0.000941246, 0.000941513], 0, 54.9121, 1668046504], "v": "v0.6"}
{"i": [["[\"softmax_reduce\", 12544, 49]", "cuda -keys=cuda,gpu -max_num_threads=1024 -model=unknown -thread_warp_size=32", [-1, 16, 64, 49152, 2147483647, 1024, 8, 32], "", 0, []], [[], [["SP", 1, 2, 49, [24], 1], ["AN", 1, 3, 6], ["FU", 1, [0, 1]], ["AN", 1, 0, 5], ["PR", 1, 0, "auto_unroll_max_step$512"]]]], "r": [[0.000460838, 0.000460668, 0.000460634], 0, 54.9558, 1668046505], "v": "v0.6"}
{"i": [["[\"softmax_reduce\", 12544, 49]", "cuda -keys=cuda,gpu -max_num_threads=1024 -model=unknown -thread_warp_size=32", [-1, 16, 64, 49152, 2147483647, 1024, 8, 32], "", 0, []], [[], [["FU", 1, [0, 1]], ["SP", 1, 0, 614656, [14], 1], ["AN", 1, 0, 5], ["AN", 1, 1, 6], ["PR", 1, 0, "auto_unroll_max_step$16"]]]], "r": [[0.000105918, 0.000105882, 0.000105857], 0, 54.9626, 1668046507], "v": "v0.6"}
{"i": [["[\"softmax_reduce\", 12544, 49]", "cuda -keys=cuda,gpu -max_num_threads=1024 -model=unknown -thread_warp_size=32", [-1, 16, 64, 49152, 2147483647, 1024, 8, 32], "", 0, []], [[], [["SP", 1, 2, 49, [32], 1], ["AN", 1, 3, 6], ["FU", 1, [0, 1]], ["AN", 1, 0, 5], ["PR", 1, 0, "auto_unroll_max_step$1024"]]]], "r": [[0.000460806, 0.000460658, 0.000460579], 0, 54.8665, 1668046508], "v": "v0.6"}
{"i": [["[\"softmax_reduce\", 12544, 49]", "cuda -keys=cuda,gpu -max_num_threads=1024 -model=unknown -thread_warp_size=32", [-1, 16, 64, 49152, 2147483647, 1024, 8, 32], "", 0, []], [[], [["SP", 1, 2, 49, [7], 1], ["AN", 1, 3, 6], ["FU", 1, [0, 1]], ["AN", 1, 0, 5], ["PR", 1, 0, "auto_unroll_max_step$0"]]]], "r": [[0.00046074, 0.000460768, 0.000460497], 0, 54.8642, 1668046509], "v": "v0.6"}
{"i": [["[\"softmax_reduce\", 12544, 49]", "cuda -keys=cuda,gpu -max_num_threads=1024 -model=unknown -thread_warp_size=32", [-1, 16, 64, 49152, 2147483647, 1024, 8, 32], "", 0, []], [[], [["FU", 1, [0, 1]], ["SP", 1, 0, 614656, [14], 1], ["AN", 1, 0, 5], ["AN", 1, 1, 6], ["PR", 1, 0, "auto_unroll_max_step$1024"]]]], "r": [[0.000105813, 0.000105767, 0.000105748], 0, 54.9234, 1668046511], "v": "v0.6"}
{"i": [["[\"softmax_reduce\", 12544, 49]", "cuda -keys=cuda,gpu -max_num_threads=1024 -model=unknown -thread_warp_size=32", [-1, 16, 64, 49152, 2147483647, 1024, 8, 32], "", 0, []], [[], [["SP", 1, 2, 49, [1], 1], ["AN", 1, 3, 6], ["FU", 1, [0, 1]], ["AN", 1, 0, 5], ["PR", 1, 0, "auto_unroll_max_step$16"]]]], "r": [[0.000941848, 0.000941469, 0.000941618], 0, 54.8563, 1668046512], "v": "v0.6"}
{"i": [["[\"softmax_reduce\", 12544, 49]", "cuda -keys=cuda,gpu -max_num_threads=1024 -model=unknown -thread_warp_size=32", [-1, 16, 64, 49152, 2147483647, 1024, 8, 32], "", 0, []], [[], [["FU", 1, [0, 1]], ["SP", 1, 0, 614656, [1], 1], ["AN", 1, 0, 5], ["AN", 1, 1, 6], ["PR", 1, 0, "auto_unroll_max_step$1024"]]]], "r": [[0.00158702, 0.00158878, 0.0015861], 0, 54.8502, 1668046514], "v": "v0.6"}
{"i": [["[\"softmax_reduce\", 12544, 49]", "cuda -keys=cuda,gpu -max_num_threads=1024 -model=unknown -thread_warp_size=32", [-1, 16, 64, 49152, 2147483647, 1024, 8, 32], "", 0, []], [[], [["SP", 1, 2, 49, [48], 1], ["AN", 1, 3, 6], ["FU", 1, [0, 1]], ["AN", 1, 0, 5], ["PR", 1, 0, "auto_unroll_max_step$16"]]]], "r": [[0.000459853, 0.00045984, 0.00045975], 0, 54.9421, 1668046515], "v": "v0.6"}
{"i": [["[\"softmax_reduce\", 12544, 49]", "cuda -keys=cuda,gpu -max_num_threads=1024 -model=unknown -thread_warp_size=32", [-1, 16, 64, 49152, 2147483647, 1024, 8, 32], "", 0, []], [[], [["SP", 1, 2, 49, [1], 1], ["AN", 1, 3, 6], ["FU", 1, [0, 1]], ["AN", 1, 0, 5], ["PR", 1, 0, "auto_unroll_max_step$1024"]]]], "r": [[0.000941859, 0.00094151, 0.000941586], 0, 54.9093, 1668046516], "v": "v0.6"}
{"i": [["[\"softmax_reduce\", 12544, 49]", "cuda -keys=cuda,gpu -max_num_threads=1024 -model=unknown -thread_warp_size=32", [-1, 16, 64, 49152, 2147483647, 1024, 8, 32], "", 0, []], [[], [["FU", 1, [0, 1]], ["SP", 1, 0, 614656, [4], 1], ["AN", 1, 0, 5], ["AN", 1, 1, 6], ["PR", 1, 0, "auto_unroll_max_step$0"]]]], "r": [[0.00028932, 0.000289198, 0.000288998], 0, 54.8787, 1668046518], "v": "v0.6"}
{"i": [["[\"softmax_reduce\", 12544, 49]", "cuda -keys=cuda,gpu -max_num_threads=1024 -model=unknown -thread_warp_size=32", [-1, 16, 64, 49152, 2147483647, 1024, 8, 32], "", 0, []], [[], [["SP", 1, 2, 49, [49], 1], ["AN", 1, 3, 6], ["FU", 1, [0, 1]], ["AN", 1, 0, 5], ["PR", 1, 0, "auto_unroll_max_step$16"]]]], "r": [[0.00045973, 0.000459631, 0.000459617], 0, 21.023, 1668048206], "v": "v0.6"}
{"i": [["[\"softmax_reduce\", 12544, 49]", "cuda -keys=cuda,gpu -max_num_threads=1024 -model=unknown -thread_warp_size=32", [-1, 16, 64, 49152, 2147483647, 1024, 8, 32], "", 0, []], [[], [["FU", 1, [0, 1]], ["SP", 1, 0, 614656, [1], 1], ["AN", 1, 0, 5], ["AN", 1, 1, 6], ["PR", 1, 0, "auto_unroll_max_step$0"]]]], "r": [[0.00158723, 0.00159098, 0.00158763], 0, 12.8372, 1668048198], "v": "v0.6"}
{"i": [["[\"softmax_reduce\", 12544, 49]", "cuda -keys=cuda,gpu -max_num_threads=1024 -model=unknown -thread_warp_size=32", [-1, 16, 64, 49152, 2147483647, 1024, 8, 32], "", 0, []], [[], [["FU", 1, [0, 1]], ["SP", 1, 0, 614656, [64], 1], ["AN", 1, 0, 5], ["AN", 1, 1, 6], ["PR", 1, 0, "auto_unroll_max_step$1024"]]]], "r": [[8.98795e-05, 8.99235e-05, 8.97038e-05], 0, 18.2259, 1668048204], "v": "v0.6"}
{"i": [["[\"softmax_reduce\", 12544, 49]", "cuda -keys=cuda,gpu -max_num_threads=1024 -model=unknown -thread_warp_size=32", [-1, 16, 64, 49152, 2147483647, 1024, 8, 32], "", 0, []], [[], [["SP", 1, 2, 49, [24], 1], ["AN", 1, 3, 6], ["FU", 1, [0, 1]], ["AN", 1, 0, 5], ["PR", 1, 0, "auto_unroll_max_step$64"]]]], "r": [[0.000461126, 0.000461015, 0.000460976], 0, 14.2104, 1668048199], "v": "v0.6"}
{"i": [["[\"softmax_reduce\", 12544, 49]", "cuda -keys=cuda,gpu -max_num_threads=1024 -model=unknown -thread_warp_size=32", [-1, 16, 64, 49152, 2147483647, 1024, 8, 32], "", 0, []], [[], [["FU", 1, [0, 1]], ["SP", 1, 0, 614656, [7], 1], ["AN", 1, 0, 5], ["AN", 1, 1, 6], ["PR", 1, 0, "auto_unroll_max_step$512"]]]], "r": [[0.000168703, 0.000168677, 0.000168615], 0, 4.86659, 1668048190], "v": "v0.6"}
{"i": [["[\"softmax_reduce\", 12544, 49]", "cuda -keys=cuda,gpu -max_num_threads=1024 -model=unknown -thread_warp_size=32", [-1, 16, 64, 49152, 2147483647, 1024, 8, 32], "", 0, []], [[], [["FU", 1, [0, 1]], ["SP", 1, 0, 614656, [1], 1], ["AN", 1, 0, 5], ["AN", 1, 1, 6], ["PR", 1, 0, "auto_unroll_max_step$512"]]]], "r": [[0.0015925, 0.00159221, 0.00158899], 0, 10.1746, 1668048195], "v": "v0.6"}
{"i": [["[\"softmax_reduce\", 12544, 49]", "cuda -keys=cuda,gpu -max_num_threads=1024 -model=unknown -thread_warp_size=32", [-1, 16, 64, 49152, 2147483647, 1024, 8, 32], "", 0, []], [[], [["FU", 1, [0, 1]], ["SP", 1, 0, 614656, [28], 1], ["AN", 1, 0, 5], ["AN", 1, 1, 6], ["PR", 1, 0, "auto_unroll_max_step$0"]]]], "r": [[8.46628e-05, 8.46789e-05, 8.46785e-05], 0, 2.40015, 1668048187], "v": "v0.6"}
{"i": [["[\"softmax_reduce\", 12544, 49]", "cuda -keys=cuda,gpu -max_num_threads=1024 -model=unknown -thread_warp_size=32", [-1, 16, 64, 49152, 2147483647, 1024, 8, 32], "", 0, []], [[], [["FU", 1, [0, 1]], ["SP", 1, 0, 614656, [64], 1], ["AN", 1, 0, 5], ["AN", 1, 1, 6], ["PR", 1, 0, "auto_unroll_max_step$0"]]]], "r": [[8.97556e-05, 8.98288e-05, 8.99356e-05], 0, 30.4506, 1668048216], "v": "v0.6"}
{"i": [["[\"softmax_reduce\", 12544, 49]", "cuda -keys=cuda,gpu -max_num_threads=1024 -model=unknown -thread_warp_size=32", [-1, 16, 64, 49152, 2147483647, 1024, 8, 32], "", 0, []], [[], [["FU", 1, [0, 1]], ["SP", 1, 0, 614656, [49], 1], ["AN", 1, 0, 5], ["AN", 1, 1, 6], ["PR", 1, 0, "auto_unroll_max_step$16"]]]], "r": [[9.13773e-05, 9.12563e-05, 9.1286e-05], 0, 26.3811, 1668048212], "v": "v0.6"}
{"i": [["[\"softmax_reduce\", 12544, 49]", "cuda -keys=cuda,gpu -max_num_threads=1024 -model=unknown -thread_warp_size=32", [-1, 16, 64, 49152, 2147483647, 1024, 8, 32], "", 0, []], [[], [["SP", 1, 2, 49, [48], 1], ["AN", 1, 3, 6], ["FU", 1, [0, 1]], ["AN", 1, 0, 5], ["PR", 1, 0, "auto_unroll_max_step$512"]]]], "r": [[0.00046025, 0.000460039, 0.00046008], 0, 25.1132, 1668048210], "v": "v0.6"}
{"i": [["[\"softmax_reduce\", 12544, 49]", "cuda -keys=cuda,gpu -max_num_threads=1024 -model=unknown -thread_warp_size=32", [-1, 16, 64, 49152, 2147483647, 1024, 8, 32], "", 0, []], [[], [["SP", 1, 2, 49, [3], 1], ["AN", 1, 3, 6], ["FU", 1, [0, 1]], ["AN", 1, 0, 5], ["PR", 1, 0, "auto_unroll_max_step$64"]]]], "r": [[0.000564648, 0.000564494, 0.000564373], 0, 15.5826, 1668048201], "v": "v0.6"}
{"i": [["[\"softmax_reduce\", 12544, 49]", "cuda -keys=cuda,gpu -max_num_threads=1024 -model=unknown -thread_warp_size=32", [-1, 16, 64, 49152, 2147483647, 1024, 8, 32], "", 0, []], [[], [["SP", 1, 2, 49, [7], 1], ["AN", 1, 3, 6], ["FU", 1, [0, 1]], ["AN", 1, 0, 5], ["PR", 1, 0, "auto_unroll_max_step$1024"]]]], "r": [[0.000460959, 0.000460907, 0.000460797], 0, 23.8927, 1668048209], "v": "v0.6"}
{"i": [["[\"softmax_reduce\", 12544, 49]", "cuda -keys=cuda,gpu -max_num_threads=1024 -model=unknown -thread_warp_size=32", [-1, 16, 64, 49152, 2147483647, 1024, 8, 32], "", 0, []], [[], [["FU", 1, [0, 1]], ["SP", 1, 0, 614656, [2], 1], ["AN", 1, 0, 5], ["AN", 1, 1, 6], ["PR", 1, 0, "auto_unroll_max_step$512"]]]], "r": [[0.000669018, 0.00066817, 0.000667534], 0, 17.045, 1668048202], "v": "v0.6"}
{"i": [["[\"softmax_reduce\", 12544, 49]", "cuda -keys=cuda,gpu -max_num_threads=1024 -model=unknown -thread_warp_size=32", [-1, 16, 64, 49152, 2147483647, 1024, 8, 32], "", 0, []], [[], [["SP", 1, 2, 49, [16], 1], ["AN", 1, 3, 6], ["FU", 1, [0, 1]], ["AN", 1, 0, 5], ["PR", 1, 0, "auto_unroll_max_step$64"]]]], "r": [[0.000460967, 0.00046092, 0.00046098], 0, 27.8513, 1668048213], "v": "v0.6"}
{"i": [["[\"softmax_reduce\", 12544, 49]", "cuda -keys=cuda,gpu -max_num_threads=1024 -model=unknown -thread_warp_size=32", [-1, 16, 64, 49152, 2147483647, 1024, 8, 32], "", 0, []], [[], [["SP", 1, 2, 49, [2], 1], ["AN", 1, 3, 6], ["FU", 1, [0, 1]], ["AN", 1, 0, 5], ["PR", 1, 0, "auto_unroll_max_step$16"]]]], "r": [[0.000702643, 0.000702577, 0.000702551], 0, 7.34403, 1668048193], "v": "v0.6"}
