python/models/swin_transformer/kernel_configs/swin_transformer_mul_1_56_56_256.log
{"i": [["[\"mul\", 1, 56, 56, 256]", "cuda -keys=cuda,gpu -max_num_threads=1024 -model=unknown -thread_warp_size=32", [-1, 16, 64, 49152, 2147483647, 1024, 8, 32], "", 0, []], [[], [["FU", 2, [0, 1, 2, 3]], ["SP", 2, 0, 802816, [32], 1], ["AN", 2, 0, 5], ["AN", 2, 1, 6]]]], "r": [[2.14229e-05, 2.14305e-05, 2.14354e-05], 0, 1.00747, 1668018467], "v": "v0.6"}
{"i": [["[\"mul\", 1, 56, 56, 256]", "cuda -keys=cuda,gpu -max_num_threads=1024 -model=unknown -thread_warp_size=32", [-1, 16, 64, 49152, 2147483647, 1024, 8, 32], "", 0, []], [[], [["FU", 2, [0, 1, 2, 3]], ["SP", 2, 0, 802816, [8], 1], ["AN", 2, 0, 5], ["AN", 2, 1, 6]]]], "r": [[7.71146e-05, 7.71055e-05, 7.71007e-05], 0, 1.71576, 1668018467], "v": "v0.6"}
{"i": [["[\"mul\", 1, 56, 56, 256]", "cuda -keys=cuda,gpu -max_num_threads=1024 -model=unknown -thread_warp_size=32", [-1, 16, 64, 49152, 2147483647, 1024, 8, 32], "", 0, []], [[], [["FU", 2, [0, 1, 2, 3]], ["SP", 2, 0, 802816, [56], 1], ["AN", 2, 0, 5], ["AN", 2, 1, 6]]]], "r": [[1.32543e-05, 1.32643e-05, 1.32538e-05], 0, 1.36043, 1668018467], "v": "v0.6"}
{"i": [["[\"mul\", 1, 56, 56, 256]", "cuda -keys=cuda,gpu -max_num_threads=1024 -model=unknown -thread_warp_size=32", [-1, 16, 64, 49152, 2147483647, 1024, 8, 32], "", 0, []], [[], [["FU", 2, [0, 1, 2, 3]], ["SP", 2, 0, 802816, [16], 1], ["AN", 2, 0, 5], ["AN", 2, 1, 6]]]], "r": [[3.98931e-05, 3.99466e-05, 3.98779e-05], 0, 0.61878, 1668018466], "v": "v0.6"}
{"i": [["[\"mul\", 1, 56, 56, 256]", "cuda -keys=cuda,gpu -max_num_threads=1024 -model=unknown -thread_warp_size=32", [-1, 16, 64, 49152, 2147483647, 1024, 8, 32], "", 0, []], [[], [["FU", 2, [0, 1, 2, 3]], ["SP", 2, 0, 802816, [2], 1], ["AN", 2, 0, 5], ["AN", 2, 1, 6]]]], "r": [[0.000300352, 0.000300461, 0.000300369], 0, 2.45555, 1668018468], "v": "v0.6"}
{"i": [["[\"mul\", 1, 56, 56, 256]", "cuda -keys=cuda,gpu -max_num_threads=1024 -model=unknown -thread_warp_size=32", [-1, 16, 64, 49152, 2147483647, 1024, 8, 32], "", 0, []], [[], [["FU", 2, [0, 1, 2, 3]], ["SP", 2, 0, 802816, [28], 1], ["AN", 2, 0, 5], ["AN", 2, 1, 6]]]], "r": [[2.39591e-05, 2.3961e-05, 2.39639e-05], 0, 2.11166, 1668018468], "v": "v0.6"}
{"i": [["[\"mul\", 1, 56, 56, 256]", "cuda -keys=cuda,gpu -max_num_threads=1024 -model=unknown -thread_warp_size=32", [-1, 16, 64, 49152, 2147483647, 1024, 8, 32], "", 0, []], [[], [["FU", 2, [0, 1, 2, 3]], ["SP", 2, 0, 802816, [14], 1], ["AN", 2, 0, 5], ["AN", 2, 1, 6]]]], "r": [[4.52913e-05, 4.52437e-05, 4.52394e-05], 0, 2.81534, 1668018468], "v": "v0.6"}
{"i": [["[\"mul\", 1, 56, 56, 256]", "cuda -keys=cuda,gpu -max_num_threads=1024 -model=unknown -thread_warp_size=32", [-1, 16, 64, 49152, 2147483647, 1024, 8, 32], "", 0, []], [[], [["FU", 2, [0, 1, 2, 3]], ["SP", 2, 0, 802816, [64], 1], ["AN", 2, 0, 5], ["AN", 2, 1, 6]]]], "r": [[1.18972e-05, 1.18963e-05, 1.18912e-05], 0, 3.53834, 1668018469], "v": "v0.6"}
{"i": [["[\"mul\", 1, 56, 56, 256]", "cuda -keys=cuda,gpu -max_num_threads=1024 -model=unknown -thread_warp_size=32", [-1, 16, 64, 49152, 2147483647, 1024, 8, 32], "", 0, []], [[], [["FU", 2, [0, 1, 2, 3]], ["SP", 2, 0, 802816, [49], 1], ["AN", 2, 0, 5], ["AN", 2, 1, 6]]]], "r": [[1.47001e-05, 1.46926e-05, 1.4685e-05], 0, 3.20993, 1668018469], "v": "v0.6"}
{"i": [["[\"mul\", 1, 56, 56, 256]", "cuda -keys=cuda,gpu -max_num_threads=1024 -model=unknown -thread_warp_size=32", [-1, 16, 64, 49152, 2147483647, 1024, 8, 32], "", 0, []], [[], [["FU", 2, [0, 1, 2, 3]], ["SP", 2, 0, 802816, [4], 1], ["AN", 2, 0, 5], ["AN", 2, 1, 6]]]], "r": [[0.000151423, 0.000151399, 0.000151424], 0, 4.28252, 1668018470], "v": "v0.6"}
{"i": [["[\"mul\", 1, 56, 56, 256]", "cuda -keys=cuda,gpu -max_num_threads=1024 -model=unknown -thread_warp_size=32", [-1, 16, 64, 49152, 2147483647, 1024, 8, 32], "", 0, []], [[], [["FU", 2, [0, 1, 2, 3]], ["SP", 2, 0, 802816, [1], 1], ["AN", 2, 0, 5], ["AN", 2, 1, 6]]]], "r": [[0.000598054, 0.000598027, 0.000598069], 0, 3.87987, 1668018470], "v": "v0.6"}
{"i": [["[\"mul\", 1, 56, 56, 256]", "cuda -keys=cuda,gpu -max_num_threads=1024 -model=unknown -thread_warp_size=32", [-1, 16, 64, 49152, 2147483647, 1024, 8, 32], "", 0, []], [[], [["FU", 2, [0, 1, 2, 3]], ["SP", 2, 0, 802816, [7], 1], ["AN", 2, 0, 5], ["AN", 2, 1, 6]]]], "r": [[8.77874e-05, 8.77819e-05, 8.77928e-05], 0, 4.63731, 1668018470], "v": "v0.6"}
{"i": [["[\"mul\", 1, 56, 56, 256]", "cuda -keys=cuda,gpu -max_num_threads=1024 -model=unknown -thread_warp_size=32", [-1, 16, 64, 49152, 2147483647, 1024, 8, 32], "", 0, []], [[], [["FU", 2, [0, 1, 2, 3]], ["SP", 2, 0, 802816, [56], 1], ["AN", 2, 0, 5], ["AN", 2, 1, 6]]]], "r": [[1.31907e-05, 1.31969e-05, 1.31708e-05], 0, 0.965094, 1668018848], "v": "v0.6"}
{"i": [["[\"mul\", 1, 56, 56, 256]", "cuda -keys=cuda,gpu -max_num_threads=1024 -model=unknown -thread_warp_size=32", [-1, 16, 64, 49152, 2147483647, 1024, 8, 32], "", 0, []], [[], [["FU", 2, [0, 1, 2, 3]], ["SP", 2, 0, 802816, [14], 1], ["AN", 2, 0, 5], ["AN", 2, 1, 6]]]], "r": [[4.52255e-05, 4.52229e-05, 4.52387e-05], 0, 2.77922, 1668018850], "v": "v0.6"}
{"i": [["[\"mul\", 1, 56, 56, 256]", "cuda -keys=cuda,gpu -max_num_threads=1024 -model=unknown -thread_warp_size=32", [-1, 16, 64, 49152, 2147483647, 1024, 8, 32], "", 0, []], [[], [["FU", 2, [0, 1, 2, 3]], ["SP", 2, 0, 802816, [7], 1], ["AN", 2, 0, 5], ["AN", 2, 1, 6]]]], "r": [[8.76953e-05, 8.76752e-05, 8.76956e-05], 0, 1.32433, 1668018849], "v": "v0.6"}
{"i": [["[\"mul\", 1, 56, 56, 256]", "cuda -keys=cuda,gpu -max_num_threads=1024 -model=unknown -thread_warp_size=32", [-1, 16, 64, 49152, 2147483647, 1024, 8, 32], "", 0, []], [[], [["FU", 2, [0, 1, 2, 3]], ["SP", 2, 0, 802816, [49], 1], ["AN", 2, 0, 5], ["AN", 2, 1, 6]]]], "r": [[1.46987e-05, 1.47034e-05, 1.46922e-05], 0, 0.56631, 1668018848], "v": "v0.6"}
{"i": [["[\"mul\", 1, 56, 56, 256]", "cuda -keys=cuda,gpu -max_num_threads=1024 -model=unknown -thread_warp_size=32", [-1, 16, 64, 49152, 2147483647, 1024, 8, 32], "", 0, []], [[], [["FU", 2, [0, 1, 2, 3]], ["SP", 2, 0, 802816, [4], 1], ["AN", 2, 0, 5], ["AN", 2, 1, 6]]]], "r": [[0.000151581, 0.000151541, 0.000151581], 0, 2.43745, 1668018850], "v": "v0.6"}
{"i": [["[\"mul\", 1, 56, 56, 256]", "cuda -keys=cuda,gpu -max_num_threads=1024 -model=unknown -thread_warp_size=32", [-1, 16, 64, 49152, 2147483647, 1024, 8, 32], "", 0, []], [[], [["FU", 2, [0, 1, 2, 3]], ["SP", 2, 0, 802816, [8], 1], ["AN", 2, 0, 5], ["AN", 2, 1, 6]]]], "r": [[7.70841e-05, 7.70488e-05, 7.70697e-05], 0, 1.70844, 1668018849], "v": "v0.6"}
{"i": [["[\"mul\", 1, 56, 56, 256]", "cuda -keys=cuda,gpu -max_num_threads=1024 -model=unknown -thread_warp_size=32", [-1, 16, 64, 49152, 2147483647, 1024, 8, 32], "", 0, []], [[], [["FU", 2, [0, 1, 2, 3]], ["SP", 2, 0, 802816, [16], 1], ["AN", 2, 0, 5], ["AN", 2, 1, 6]]]], "r": [[3.99762e-05, 3.99689e-05, 3.99741e-05], 0, 2.09823, 1668018849], "v": "v0.6"}
{"i": [["[\"mul\", 1, 56, 56, 256]", "cuda -keys=cuda,gpu -max_num_threads=1024 -model=unknown -thread_warp_size=32", [-1, 16, 64, 49152, 2147483647, 1024, 8, 32], "", 0, []], [[], [["FU", 2, [0, 1, 2, 3]], ["SP", 2, 0, 802816, [32], 1], ["AN", 2, 0, 5], ["AN", 2, 1, 6]]]], "r": [[2.1394e-05, 2.1396e-05, 2.13951e-05], 0, 3.52736, 1668018851], "v": "v0.6"}
{"i": [["[\"mul\", 1, 56, 56, 256]", "cuda -keys=cuda,gpu -max_num_threads=1024 -model=unknown -thread_warp_size=32", [-1, 16, 64, 49152, 2147483647, 1024, 8, 32], "", 0, []], [[], [["FU", 2, [0, 1, 2, 3]], ["SP", 2, 0, 802816, [28], 1], ["AN", 2, 0, 5], ["AN", 2, 1, 6]]]], "r": [[2.40703e-05, 2.40647e-05, 2.40557e-05], 0, 4.2553, 1668018852], "v": "v0.6"}
{"i": [["[\"mul\", 1, 56, 56, 256]", "cuda -keys=cuda,gpu -max_num_threads=1024 -model=unknown -thread_warp_size=32", [-1, 16, 64, 49152, 2147483647, 1024, 8, 32], "", 0, []], [[], [["FU", 2, [0, 1, 2, 3]], ["SP", 2, 0, 802816, [64], 1], ["AN", 2, 0, 5], ["AN", 2, 1, 6]]]], "r": [[1.19385e-05, 1.19308e-05, 1.19235e-05], 0, 3.86276, 1668018851], "v": "v0.6"}
{"i": [["[\"mul\", 1, 56, 56, 256]", "cuda -keys=cuda,gpu -max_num_threads=1024 -model=unknown -thread_warp_size=32", [-1, 16, 64, 49152, 2147483647, 1024, 8, 32], "", 0, []], [[], [["FU", 2, [0, 1, 2, 3]], ["SP", 2, 0, 802816, [1], 1], ["AN", 2, 0, 5], ["AN", 2, 1, 6]]]], "r": [[0.000598089, 0.0005981, 0.00059804], 0, 3.17233, 1668018850], "v": "v0.6"}
{"i": [["[\"mul\", 1, 56, 56, 256]", "cuda -keys=cuda,gpu -max_num_threads=1024 -model=unknown -thread_warp_size=32", [-1, 16, 64, 49152, 2147483647, 1024, 8, 32], "", 0, []], [[], [["FU", 2, [0, 1, 2, 3]], ["SP", 2, 0, 802816, [2], 1], ["AN", 2, 0, 5], ["AN", 2, 1, 6]]]], "r": [[0.000300442, 0.000300433, 0.00030046], 0, 4.57998, 1668018852], "v": "v0.6"}
