python/models/swin_transformer/kernel_configs/swin_transformer_roll_1_56_56_128_-3_float16.log
{"i": [["[\"roll\", 1, 56, 56, 128, -3, \"float16\"]", "cuda -keys=cuda,gpu -max_num_threads=1024 -model=unknown -thread_warp_size=32", [-1, 16, 64, 49152, 2147483647, 1024, 8, 32], "", 0, []], [[], [["FU", 1, [0, 1, 2, 3]], ["SP", 1, 0, 401408, [1], 1], ["AN", 1, 0, 5], ["AN", 1, 1, 6]]]], "r": [[0.000300611, 0.000300608, 0.000300576], 0, 0.947791, 1668018178], "v": "v0.6"}
{"i": [["[\"roll\", 1, 56, 56, 128, -3, \"float16\"]", "cuda -keys=cuda,gpu -max_num_threads=1024 -model=unknown -thread_warp_size=32", [-1, 16, 64, 49152, 2147483647, 1024, 8, 32], "", 0, []], [[], [["FU", 1, [0, 1, 2, 3]], ["SP", 1, 0, 401408, [4], 1], ["AN", 1, 0, 5], ["AN", 1, 1, 6]]]], "r": [[7.71737e-05, 7.71972e-05, 7.71953e-05], 0, 2.83946, 1668018180], "v": "v0.6"}
{"i": [["[\"roll\", 1, 56, 56, 128, -3, \"float16\"]", "cuda -keys=cuda,gpu -max_num_threads=1024 -model=unknown -thread_warp_size=32", [-1, 16, 64, 49152, 2147483647, 1024, 8, 32], "", 0, []], [[], [["FU", 1, [0, 1, 2, 3]], ["SP", 1, 0, 401408, [8], 1], ["AN", 1, 0, 5], ["AN", 1, 1, 6]]]], "r": [[3.99584e-05, 3.99817e-05, 3.99843e-05], 0, 0.603695, 1668018178], "v": "v0.6"}
{"i": [["[\"roll\", 1, 56, 56, 128, -3, \"float16\"]", "cuda -keys=cuda,gpu -max_num_threads=1024 -model=unknown -thread_warp_size=32", [-1, 16, 64, 49152, 2147483647, 1024, 8, 32], "", 0, []], [[], [["FU", 1, [0, 1, 2, 3]], ["SP", 1, 0, 401408, [14], 1], ["AN", 1, 0, 5], ["AN", 1, 1, 6]]]], "r": [[2.42449e-05, 2.42536e-05, 2.42461e-05], 0, 3.20171, 1668018180], "v": "v0.6"}
{"i": [["[\"roll\", 1, 56, 56, 128, -3, \"float16\"]", "cuda -keys=cuda,gpu -max_num_threads=1024 -model=unknown -thread_warp_size=32", [-1, 16, 64, 49152, 2147483647, 1024, 8, 32], "", 0, []], [[], [["FU", 1, [0, 1, 2, 3]], ["SP", 1, 0, 401408, [7], 1], ["AN", 1, 0, 5], ["AN", 1, 1, 6]]]], "r": [[4.53795e-05, 4.54013e-05, 4.5404e-05], 0, 1.72426, 1668018179], "v": "v0.6"}
{"i": [["[\"roll\", 1, 56, 56, 128, -3, \"float16\"]", "cuda -keys=cuda,gpu -max_num_threads=1024 -model=unknown -thread_warp_size=32", [-1, 16, 64, 49152, 2147483647, 1024, 8, 32], "", 0, []], [[], [["FU", 1, [0, 1, 2, 3]], ["SP", 1, 0, 401408, [28], 1], ["AN", 1, 0, 5], ["AN", 1, 1, 6]]]], "r": [[1.34176e-05, 1.34212e-05, 1.34223e-05], 0, 1.30676, 1668018178], "v": "v0.6"}
{"i": [["[\"roll\", 1, 56, 56, 128, -3, \"float16\"]", "cuda -keys=cuda,gpu -max_num_threads=1024 -model=unknown -thread_warp_size=32", [-1, 16, 64, 49152, 2147483647, 1024, 8, 32], "", 0, []], [[], [["FU", 1, [0, 1, 2, 3]], ["SP", 1, 0, 401408, [2], 1], ["AN", 1, 0, 5], ["AN", 1, 1, 6]]]], "r": [[0.000151762, 0.000151749, 0.000151763], 0, 2.07641, 1668018179], "v": "v0.6"}
{"i": [["[\"roll\", 1, 56, 56, 128, -3, \"float16\"]", "cuda -keys=cuda,gpu -max_num_threads=1024 -model=unknown -thread_warp_size=32", [-1, 16, 64, 49152, 2147483647, 1024, 8, 32], "", 0, []], [[], [["FU", 1, [0, 1, 2, 3]], ["SP", 1, 0, 401408, [16], 1], ["AN", 1, 0, 5], ["AN", 1, 1, 6]]]], "r": [[2.14963e-05, 2.15261e-05, 2.15112e-05], 0, 3.57434, 1668018181], "v": "v0.6"}
{"i": [["[\"roll\", 1, 56, 56, 128, -3, \"float16\"]", "cuda -keys=cuda,gpu -max_num_threads=1024 -model=unknown -thread_warp_size=32", [-1, 16, 64, 49152, 2147483647, 1024, 8, 32], "", 0, []], [[], [["FU", 1, [0, 1, 2, 3]], ["SP", 1, 0, 401408, [56], 1], ["AN", 1, 0, 5], ["AN", 1, 1, 6]]]], "r": [[8.03345e-06, 8.04313e-06, 8.04023e-06], 0, 2.42662, 1668018180], "v": "v0.6"}
{"i": [["[\"roll\", 1, 56, 56, 128, -3, \"float16\"]", "cuda -keys=cuda,gpu -max_num_threads=1024 -model=unknown -thread_warp_size=32", [-1, 16, 64, 49152, 2147483647, 1024, 8, 32], "", 0, []], [[], [["FU", 1, [0, 1, 2, 3]], ["SP", 1, 0, 401408, [32], 1], ["AN", 1, 0, 5], ["AN", 1, 1, 6]]]], "r": [[1.20741e-05, 1.20881e-05, 1.20892e-05], 0, 3.96946, 1668018181], "v": "v0.6"}
{"i": [["[\"roll\", 1, 56, 56, 128, -3, \"float16\"]", "cuda -keys=cuda,gpu -max_num_threads=1024 -model=unknown -thread_warp_size=32", [-1, 16, 64, 49152, 2147483647, 1024, 8, 32], "", 0, []], [[], [["FU", 1, [0, 1, 2, 3]], ["SP", 1, 0, 401408, [49], 1], ["AN", 1, 0, 5], ["AN", 1, 1, 6]]]], "r": [[8.65202e-06, 8.66029e-06, 8.65904e-06], 0, 4.2987, 1668018182], "v": "v0.6"}
{"i": [["[\"roll\", 1, 56, 56, 128, -3, \"float16\"]", "cuda -keys=cuda,gpu -max_num_threads=1024 -model=unknown -thread_warp_size=32", [-1, 16, 64, 49152, 2147483647, 1024, 8, 32], "", 0, []], [[], [["FU", 1, [0, 1, 2, 3]], ["SP", 1, 0, 401408, [64], 1], ["AN", 1, 0, 5], ["AN", 1, 1, 6]]]], "r": [[7.3482e-06, 7.36924e-06, 7.36905e-06], 0, 4.6471, 1668018182], "v": "v0.6"}
{"i": [["[\"roll\", 1, 56, 56, 128, -3, \"float16\"]", "cuda -keys=cuda,gpu -max_num_threads=1024 -model=unknown -thread_warp_size=32", [-1, 16, 64, 49152, 2147483647, 1024, 8, 32], "", 0, []], [[], [["FU", 1, [0, 1, 2, 3]], ["SP", 1, 0, 401408, [56], 1], ["AN", 1, 0, 5], ["AN", 1, 1, 6]]]], "r": [[8.01719e-06, 8.03176e-06, 8.02283e-06], 0, 1.23441, 1668018310], "v": "v0.6"}
{"i": [["[\"roll\", 1, 56, 56, 128, -3, \"float16\"]", "cuda -keys=cuda,gpu -max_num_threads=1024 -model=unknown -thread_warp_size=32", [-1, 16, 64, 49152, 2147483647, 1024, 8, 32], "", 0, []], [[], [["FU", 1, [0, 1, 2, 3]], ["SP", 1, 0, 401408, [32], 1], ["AN", 1, 0, 5], ["AN", 1, 1, 6]]]], "r": [[1.23065e-05, 1.23178e-05, 1.23172e-05], 0, 0.57948, 1668018310], "v": "v0.6"}
{"i": [["[\"roll\", 1, 56, 56, 128, -3, \"float16\"]", "cuda -keys=cuda,gpu -max_num_threads=1024 -model=unknown -thread_warp_size=32", [-1, 16, 64, 49152, 2147483647, 1024, 8, 32], "", 0, []], [[], [["FU", 1, [0, 1, 2, 3]], ["SP", 1, 0, 401408, [4], 1], ["AN", 1, 0, 5], ["AN", 1, 1, 6]]]], "r": [[7.71874e-05, 7.71982e-05, 7.71928e-05], 0, 2.63316, 1668018312], "v": "v0.6"}
{"i": [["[\"roll\", 1, 56, 56, 128, -3, \"float16\"]", "cuda -keys=cuda,gpu -max_num_threads=1024 -model=unknown -thread_warp_size=32", [-1, 16, 64, 49152, 2147483647, 1024, 8, 32], "", 0, []], [[], [["FU", 1, [0, 1, 2, 3]], ["SP", 1, 0, 401408, [64], 1], ["AN", 1, 0, 5], ["AN", 1, 1, 6]]]], "r": [[7.23466e-06, 7.24243e-06, 7.24563e-06], 0, 0.91081, 1668018310], "v": "v0.6"}
{"i": [["[\"roll\", 1, 56, 56, 128, -3, \"float16\"]", "cuda -keys=cuda,gpu -max_num_threads=1024 -model=unknown -thread_warp_size=32", [-1, 16, 64, 49152, 2147483647, 1024, 8, 32], "", 0, []], [[], [["FU", 1, [0, 1, 2, 3]], ["SP", 1, 0, 401408, [2], 1], ["AN", 1, 0, 5], ["AN", 1, 1, 6]]]], "r": [[0.000151711, 0.000151652, 0.000151664], 0, 1.58847, 1668018311], "v": "v0.6"}
{"i": [["[\"roll\", 1, 56, 56, 128, -3, \"float16\"]", "cuda -keys=cuda,gpu -max_num_threads=1024 -model=unknown -thread_warp_size=32", [-1, 16, 64, 49152, 2147483647, 1024, 8, 32], "", 0, []], [[], [["FU", 1, [0, 1, 2, 3]], ["SP", 1, 0, 401408, [16], 1], ["AN", 1, 0, 5], ["AN", 1, 1, 6]]]], "r": [[2.14631e-05, 2.14763e-05, 2.1479e-05], 0, 2.24995, 1668018311], "v": "v0.6"}
{"i": [["[\"roll\", 1, 56, 56, 128, -3, \"float16\"]", "cuda -keys=cuda,gpu -max_num_threads=1024 -model=unknown -thread_warp_size=32", [-1, 16, 64, 49152, 2147483647, 1024, 8, 32], "", 0, []], [[], [["FU", 1, [0, 1, 2, 3]], ["SP", 1, 0, 401408, [28], 1], ["AN", 1, 0, 5], ["AN", 1, 1, 6]]]], "r": [[1.36397e-05, 1.3644e-05, 1.36447e-05], 0, 1.91563, 1668018311], "v": "v0.6"}
{"i": [["[\"roll\", 1, 56, 56, 128, -3, \"float16\"]", "cuda -keys=cuda,gpu -max_num_threads=1024 -model=unknown -thread_warp_size=32", [-1, 16, 64, 49152, 2147483647, 1024, 8, 32], "", 0, []], [[], [["FU", 1, [0, 1, 2, 3]], ["SP", 1, 0, 401408, [1], 1], ["AN", 1, 0, 5], ["AN", 1, 1, 6]]]], "r": [[0.000300622, 0.00030061, 0.000300581], 0, 2.95433, 1668018312], "v": "v0.6"}
{"i": [["[\"roll\", 1, 56, 56, 128, -3, \"float16\"]", "cuda -keys=cuda,gpu -max_num_threads=1024 -model=unknown -thread_warp_size=32", [-1, 16, 64, 49152, 2147483647, 1024, 8, 32], "", 0, []], [[], [["FU", 1, [0, 1, 2, 3]], ["SP", 1, 0, 401408, [8], 1], ["AN", 1, 0, 5], ["AN", 1, 1, 6]]]], "r": [[3.99573e-05, 3.99633e-05, 3.99549e-05], 0, 3.97053, 1668018313], "v": "v0.6"}
{"i": [["[\"roll\", 1, 56, 56, 128, -3, \"float16\"]", "cuda -keys=cuda,gpu -max_num_threads=1024 -model=unknown -thread_warp_size=32", [-1, 16, 64, 49152, 2147483647, 1024, 8, 32], "", 0, []], [[], [["FU", 1, [0, 1, 2, 3]], ["SP", 1, 0, 401408, [7], 1], ["AN", 1, 0, 5], ["AN", 1, 1, 6]]]], "r": [[4.53938e-05, 4.54006e-05, 4.54101e-05], 0, 3.25984, 1668018312], "v": "v0.6"}
{"i": [["[\"roll\", 1, 56, 56, 128, -3, \"float16\"]", "cuda -keys=cuda,gpu -max_num_threads=1024 -model=unknown -thread_warp_size=32", [-1, 16, 64, 49152, 2147483647, 1024, 8, 32], "", 0, []], [[], [["FU", 1, [0, 1, 2, 3]], ["SP", 1, 0, 401408, [14], 1], ["AN", 1, 0, 5], ["AN", 1, 1, 6]]]], "r": [[2.41731e-05, 2.41712e-05, 2.41777e-05], 0, 3.63072, 1668018313], "v": "v0.6"}
{"i": [["[\"roll\", 1, 56, 56, 128, -3, \"float16\"]", "cuda -keys=cuda,gpu -max_num_threads=1024 -model=unknown -thread_warp_size=32", [-1, 16, 64, 49152, 2147483647, 1024, 8, 32], "", 0, []], [[], [["FU", 1, [0, 1, 2, 3]], ["SP", 1, 0, 401408, [49], 1], ["AN", 1, 0, 5], ["AN", 1, 1, 6]]]], "r": [[8.78177e-06, 8.79413e-06, 8.7931e-06], 0, 4.30504, 1668018313], "v": "v0.6"}
{"i": [["[\"roll\", 1, 56, 56, 128, -3, \"float16\"]", "cuda -keys=cuda,gpu -max_num_threads=1024 -model=unknown -thread_warp_size=32", [-1, 16, 64, 49152, 2147483647, 1024, 8, 32], "", 0, []], [[], [["FU", 1, [0, 1, 2, 3]], ["SP", 1, 0, 401408, [7], 1], ["AN", 1, 0, 5], ["AN", 1, 1, 6]]]], "r": [[4.53023e-05, 4.53143e-05, 4.53288e-05], 0, 1.6657, 1668047009], "v": "v0.6"}
{"i": [["[\"roll\", 1, 56, 56, 128, -3, \"float16\"]", "cuda -keys=cuda,gpu -max_num_threads=1024 -model=unknown -thread_warp_size=32", [-1, 16, 64, 49152, 2147483647, 1024, 8, 32], "", 0, []], [[], [["FU", 1, [0, 1, 2, 3]], ["SP", 1, 0, 401408, [1], 1], ["AN", 1, 0, 5], ["AN", 1, 1, 6]]]], "r": [[0.000300549, 0.000300525, 0.00030053], 0, 0.977604, 1668047008], "v": "v0.6"}
{"i": [["[\"roll\", 1, 56, 56, 128, -3, \"float16\"]", "cuda -keys=cuda,gpu -max_num_threads=1024 -model=unknown -thread_warp_size=32", [-1, 16, 64, 49152, 2147483647, 1024, 8, 32], "", 0, []], [[], [["FU", 1, [0, 1, 2, 3]], ["SP", 1, 0, 401408, [64], 1], ["AN", 1, 0, 5], ["AN", 1, 1, 6]]]], "r": [[7.18248e-06, 7.18485e-06, 7.18184e-06], 0, 0.592236, 1668047008], "v": "v0.6"}
{"i": [["[\"roll\", 1, 56, 56, 128, -3, \"float16\"]", "cuda -keys=cuda,gpu -max_num_threads=1024 -model=unknown -thread_warp_size=32", [-1, 16, 64, 49152, 2147483647, 1024, 8, 32], "", 0, []], [[], [["FU", 1, [0, 1, 2, 3]], ["SP", 1, 0, 401408, [32], 1], ["AN", 1, 0, 5], ["AN", 1, 1, 6]]]], "r": [[1.21823e-05, 1.21921e-05, 1.21907e-05], 0, 1.31693, 1668047009], "v": "v0.6"}
{"i": [["[\"roll\", 1, 56, 56, 128, -3, \"float16\"]", "cuda -keys=cuda,gpu -max_num_threads=1024 -model=unknown -thread_warp_size=32", [-1, 16, 64, 49152, 2147483647, 1024, 8, 32], "", 0, []], [[], [["FU", 1, [0, 1, 2, 3]], ["SP", 1, 0, 401408, [49], 1], ["AN", 1, 0, 5], ["AN", 1, 1, 6]]]], "r": [[8.68878e-06, 8.68824e-06, 8.68931e-06], 0, 2.047, 1668047009], "v": "v0.6"}
{"i": [["[\"roll\", 1, 56, 56, 128, -3, \"float16\"]", "cuda -keys=cuda,gpu -max_num_threads=1024 -model=unknown -thread_warp_size=32", [-1, 16, 64, 49152, 2147483647, 1024, 8, 32], "", 0, []], [[], [["FU", 1, [0, 1, 2, 3]], ["SP", 1, 0, 401408, [14], 1], ["AN", 1, 0, 5], ["AN", 1, 1, 6]]]], "r": [[2.42735e-05, 2.42992e-05, 2.4298e-05], 0, 2.38879, 1668047010], "v": "v0.6"}
{"i": [["[\"roll\", 1, 56, 56, 128, -3, \"float16\"]", "cuda -keys=cuda,gpu -max_num_threads=1024 -model=unknown -thread_warp_size=32", [-1, 16, 64, 49152, 2147483647, 1024, 8, 32], "", 0, []], [[], [["FU", 1, [0, 1, 2, 3]], ["SP", 1, 0, 401408, [16], 1], ["AN", 1, 0, 5], ["AN", 1, 1, 6]]]], "r": [[2.15665e-05, 2.15959e-05, 2.15776e-05], 0, 2.71262, 1668047010], "v": "v0.6"}
{"i": [["[\"roll\", 1, 56, 56, 128, -3, \"float16\"]", "cuda -keys=cuda,gpu -max_num_threads=1024 -model=unknown -thread_warp_size=32", [-1, 16, 64, 49152, 2147483647, 1024, 8, 32], "", 0, []], [[], [["FU", 1, [0, 1, 2, 3]], ["SP", 1, 0, 401408, [8], 1], ["AN", 1, 0, 5], ["AN", 1, 1, 6]]]], "r": [[3.99386e-05, 3.99517e-05, 3.99632e-05], 0, 3.09765, 1668047010], "v": "v0.6"}
{"i": [["[\"roll\", 1, 56, 56, 128, -3, \"float16\"]", "cuda -keys=cuda,gpu -max_num_threads=1024 -model=unknown -thread_warp_size=32", [-1, 16, 64, 49152, 2147483647, 1024, 8, 32], "", 0, []], [[], [["FU", 1, [0, 1, 2, 3]], ["SP", 1, 0, 401408, [56], 1], ["AN", 1, 0, 5], ["AN", 1, 1, 6]]]], "r": [[7.92291e-06, 7.93462e-06, 7.93333e-06], 0, 3.76619, 1668047011], "v": "v0.6"}
{"i": [["[\"roll\", 1, 56, 56, 128, -3, \"float16\"]", "cuda -keys=cuda,gpu -max_num_threads=1024 -model=unknown -thread_warp_size=32", [-1, 16, 64, 49152, 2147483647, 1024, 8, 32], "", 0, []], [[], [["FU", 1, [0, 1, 2, 3]], ["SP", 1, 0, 401408, [4], 1], ["AN", 1, 0, 5], ["AN", 1, 1, 6]]]], "r": [[7.71983e-05, 7.72072e-05, 7.72138e-05], 0, 3.44026, 1668047011], "v": "v0.6"}
{"i": [["[\"roll\", 1, 56, 56, 128, -3, \"float16\"]", "cuda -keys=cuda,gpu -max_num_threads=1024 -model=unknown -thread_warp_size=32", [-1, 16, 64, 49152, 2147483647, 1024, 8, 32], "", 0, []], [[], [["FU", 1, [0, 1, 2, 3]], ["SP", 1, 0, 401408, [2], 1], ["AN", 1, 0, 5], ["AN", 1, 1, 6]]]], "r": [[0.000151658, 0.000151656, 0.000151688], 0, 4.49765, 1668047012], "v": "v0.6"}
{"i": [["[\"roll\", 1, 56, 56, 128, -3, \"float16\"]", "cuda -keys=cuda,gpu -max_num_threads=1024 -model=unknown -thread_warp_size=32", [-1, 16, 64, 49152, 2147483647, 1024, 8, 32], "", 0, []], [[], [["FU", 1, [0, 1, 2, 3]], ["SP", 1, 0, 401408, [28], 1], ["AN", 1, 0, 5], ["AN", 1, 1, 6]]]], "r": [[1.35556e-05, 1.35803e-05, 1.35615e-05], 0, 4.15514, 1668047012], "v": "v0.6"}
{"i": [["[\"roll\", 1, 56, 56, 128, -3, \"float16\"]", "cuda -keys=cuda,gpu -max_num_threads=1024 -model=unknown -thread_warp_size=32", [-1, 16, 64, 49152, 2147483647, 1024, 8, 32], "", 0, []], [[], [["FU", 1, [0, 1, 2, 3]], ["SP", 1, 0, 401408, [14], 1], ["AN", 1, 0, 5], ["AN", 1, 1, 6]]]], "r": [[2.42293e-05, 2.42768e-05, 2.42816e-05], 0, 1.29695, 1668048477], "v": "v0.6"}
{"i": [["[\"roll\", 1, 56, 56, 128, -3, \"float16\"]", "cuda -keys=cuda,gpu -max_num_threads=1024 -model=unknown -thread_warp_size=32", [-1, 16, 64, 49152, 2147483647, 1024, 8, 32], "", 0, []], [[], [["FU", 1, [0, 1, 2, 3]], ["SP", 1, 0, 401408, [2], 1], ["AN", 1, 0, 5], ["AN", 1, 1, 6]]]], "r": [[0.000151609, 0.000151612, 0.000151637], 0, 1.66929, 1668048478], "v": "v0.6"}
{"i": [["[\"roll\", 1, 56, 56, 128, -3, \"float16\"]", "cuda -keys=cuda,gpu -max_num_threads=1024 -model=unknown -thread_warp_size=32", [-1, 16, 64, 49152, 2147483647, 1024, 8, 32], "", 0, []], [[], [["FU", 1, [0, 1, 2, 3]], ["SP", 1, 0, 401408, [32], 1], ["AN", 1, 0, 5], ["AN", 1, 1, 6]]]], "r": [[1.21436e-05, 1.21508e-05, 1.21534e-05], 0, 2.02093, 1668048478], "v": "v0.6"}
{"i": [["[\"roll\", 1, 56, 56, 128, -3, \"float16\"]", "cuda -keys=cuda,gpu -max_num_threads=1024 -model=unknown -thread_warp_size=32", [-1, 16, 64, 49152, 2147483647, 1024, 8, 32], "", 0, []], [[], [["FU", 1, [0, 1, 2, 3]], ["SP", 1, 0, 401408, [49], 1], ["AN", 1, 0, 5], ["AN", 1, 1, 6]]]], "r": [[8.75141e-06, 8.75755e-06, 8.75514e-06], 0, 0.941616, 1668048477], "v": "v0.6"}
{"i": [["[\"roll\", 1, 56, 56, 128, -3, \"float16\"]", "cuda -keys=cuda,gpu -max_num_threads=1024 -model=unknown -thread_warp_size=32", [-1, 16, 64, 49152, 2147483647, 1024, 8, 32], "", 0, []], [[], [["FU", 1, [0, 1, 2, 3]], ["SP", 1, 0, 401408, [64], 1], ["AN", 1, 0, 5], ["AN", 1, 1, 6]]]], "r": [[7.31723e-06, 7.34043e-06, 7.32917e-06], 0, 0.590936, 1668048476], "v": "v0.6"}
{"i": [["[\"roll\", 1, 56, 56, 128, -3, \"float16\"]", "cuda -keys=cuda,gpu -max_num_threads=1024 -model=unknown -thread_warp_size=32", [-1, 16, 64, 49152, 2147483647, 1024, 8, 32], "", 0, []], [[], [["FU", 1, [0, 1, 2, 3]], ["SP", 1, 0, 401408, [16], 1], ["AN", 1, 0, 5], ["AN", 1, 1, 6]]]], "r": [[2.13842e-05, 2.13984e-05, 2.13984e-05], 0, 2.37251, 1668048478], "v": "v0.6"}
{"i": [["[\"roll\", 1, 56, 56, 128, -3, \"float16\"]", "cuda -keys=cuda,gpu -max_num_threads=1024 -model=unknown -thread_warp_size=32", [-1, 16, 64, 49152, 2147483647, 1024, 8, 32], "", 0, []], [[], [["FU", 1, [0, 1, 2, 3]], ["SP", 1, 0, 401408, [56], 1], ["AN", 1, 0, 5], ["AN", 1, 1, 6]]]], "r": [[8.02275e-06, 8.04049e-06, 8.03674e-06], 0, 2.76265, 1668048479], "v": "v0.6"}
{"i": [["[\"roll\", 1, 56, 56, 128, -3, \"float16\"]", "cuda -keys=cuda,gpu -max_num_threads=1024 -model=unknown -thread_warp_size=32", [-1, 16, 64, 49152, 2147483647, 1024, 8, 32], "", 0, []], [[], [["FU", 1, [0, 1, 2, 3]], ["SP", 1, 0, 401408, [8], 1], ["AN", 1, 0, 5], ["AN", 1, 1, 6]]]], "r": [[4.01017e-05, 4.01016e-05, 4.01088e-05], 0, 3.10523, 1668048479], "v": "v0.6"}
{"i": [["[\"roll\", 1, 56, 56, 128, -3, \"float16\"]", "cuda -keys=cuda,gpu -max_num_threads=1024 -model=unknown -thread_warp_size=32", [-1, 16, 64, 49152, 2147483647, 1024, 8, 32], "", 0, []], [[], [["FU", 1, [0, 1, 2, 3]], ["SP", 1, 0, 401408, [28], 1], ["AN", 1, 0, 5], ["AN", 1, 1, 6]]]], "r": [[1.34021e-05, 1.34156e-05, 1.34157e-05], 0, 3.82683, 1668048480], "v": "v0.6"}
{"i": [["[\"roll\", 1, 56, 56, 128, -3, \"float16\"]", "cuda -keys=cuda,gpu -max_num_threads=1024 -model=unknown -thread_warp_size=32", [-1, 16, 64, 49152, 2147483647, 1024, 8, 32], "", 0, []], [[], [["FU", 1, [0, 1, 2, 3]], ["SP", 1, 0, 401408, [1], 1], ["AN", 1, 0, 5], ["AN", 1, 1, 6]]]], "r": [[0.000300518, 0.000300522, 0.000300534], 0, 3.43728, 1668048479], "v": "v0.6"}
{"i": [["[\"roll\", 1, 56, 56, 128, -3, \"float16\"]", "cuda -keys=cuda,gpu -max_num_threads=1024 -model=unknown -thread_warp_size=32", [-1, 16, 64, 49152, 2147483647, 1024, 8, 32], "", 0, []], [[], [["FU", 1, [0, 1, 2, 3]], ["SP", 1, 0, 401408, [7], 1], ["AN", 1, 0, 5], ["AN", 1, 1, 6]]]], "r": [[4.52655e-05, 4.52828e-05, 4.52838e-05], 0, 4.52586, 1668048480], "v": "v0.6"}
{"i": [["[\"roll\", 1, 56, 56, 128, -3, \"float16\"]", "cuda -keys=cuda,gpu -max_num_threads=1024 -model=unknown -thread_warp_size=32", [-1, 16, 64, 49152, 2147483647, 1024, 8, 32], "", 0, []], [[], [["FU", 1, [0, 1, 2, 3]], ["SP", 1, 0, 401408, [4], 1], ["AN", 1, 0, 5], ["AN", 1, 1, 6]]]], "r": [[7.72191e-05, 7.72233e-05, 7.72208e-05], 0, 4.18341, 1668048480], "v": "v0.6"}
