python/models/swin_transformer/kernel_configs/swin_transformer_te_slice_1_28_28_256_[1, 0]_2.log
{"i": [["[\"te_slice\", 1, 28, 28, 256, [1, 0], 2, \"float16\"]", "cuda -keys=cuda,gpu -max_num_threads=1024 -model=unknown -thread_warp_size=32", [-1, 16, 64, 49152, 2147483647, 1024, 8, 32], "", 0, []], [[], [["FU", 1, [0, 1, 2, 3]], ["SP", 1, 0, 50176, [7], 1], ["AN", 1, 0, 5], ["AN", 1, 1, 6]]]], "r": [[7.9592e-06, 7.95997e-06, 7.95885e-06, 7.9601e-06, 7.96042e-06, 7.95971e-06, 7.96025e-06, 7.9594e-06, 7.95983e-06, 7.96063e-06], 0, 17.2205, 1652156095], "v": "v0.6"}
{"i": [["[\"te_slice\", 1, 28, 28, 256, [1, 0], 2, \"float16\"]", "cuda -keys=cuda,gpu -max_num_threads=1024 -model=unknown -thread_warp_size=32", [-1, 16, 64, 49152, 2147483647, 1024, 8, 32], "", 0, []], [[], [["FU", 1, [0, 1, 2, 3]], ["SP", 1, 0, 50176, [28], 1], ["AN", 1, 0, 5], ["AN", 1, 1, 6]]]], "r": [[4.00954e-06, 4.00933e-06, 4.00968e-06, 4.00961e-06, 4.00975e-06, 4.00896e-06, 4.00978e-06, 4.00964e-06, 4.00962e-06, 4.0095e-06], 0, 26.2299, 1652156104], "v": "v0.6"}
{"i": [["[\"te_slice\", 1, 28, 28, 256, [1, 0], 2, \"float16\"]", "cuda -keys=cuda,gpu -max_num_threads=1024 -model=unknown -thread_warp_size=32", [-1, 16, 64, 49152, 2147483647, 1024, 8, 32], "", 0, []], [[], [["FU", 1, [0, 1, 2, 3]], ["SP", 1, 0, 50176, [16], 1], ["AN", 1, 0, 5], ["AN", 1, 1, 6]]]], "r": [[5.07238e-06, 5.07194e-06, 5.07193e-06, 5.07119e-06, 5.07058e-06, 5.07071e-06, 5.07162e-06, 5.07068e-06, 5.07101e-06, 5.07172e-06], 0, 13.0997, 1652156091], "v": "v0.6"}
{"i": [["[\"te_slice\", 1, 28, 28, 256, [1, 0], 2, \"float16\"]", "cuda -keys=cuda,gpu -max_num_threads=1024 -model=unknown -thread_warp_size=32", [-1, 16, 64, 49152, 2147483647, 1024, 8, 32], "", 0, []], [[], [["FU", 1, [0, 1, 2, 3]], ["SP", 1, 0, 50176, [49], 1], ["AN", 1, 0, 5], ["AN", 1, 1, 6]]]], "r": [[3.44754e-06, 3.44695e-06, 3.44761e-06, 3.44807e-06, 3.44738e-06, 3.44793e-06, 3.44725e-06, 3.44774e-06, 3.44757e-06, 3.44716e-06], 0, 29.7367, 1652156108], "v": "v0.6"}
{"i": [["[\"te_slice\", 1, 28, 28, 256, [1, 0], 2, \"float16\"]", "cuda -keys=cuda,gpu -max_num_threads=1024 -model=unknown -thread_warp_size=32", [-1, 16, 64, 49152, 2147483647, 1024, 8, 32], "", 0, []], [[], [["FU", 1, [0, 1, 2, 3]], ["SP", 1, 0, 50176, [1], 1], ["AN", 1, 0, 5], ["AN", 1, 1, 6]]]], "r": [[3.98319e-05, 3.98332e-05, 3.98314e-05, 3.98314e-05, 3.98327e-05, 3.98328e-05, 3.98334e-05, 3.98328e-05, 3.98322e-05, 3.98316e-05], 0, 22.4119, 1652156100], "v": "v0.6"}
{"i": [["[\"te_slice\", 1, 28, 28, 256, [1, 0], 2, \"float16\"]", "cuda -keys=cuda,gpu -max_num_threads=1024 -model=unknown -thread_warp_size=32", [-1, 16, 64, 49152, 2147483647, 1024, 8, 32], "", 0, []], [[], [["FU", 1, [0, 1, 2, 3]], ["SP", 1, 0, 50176, [64], 1], ["AN", 1, 0, 5], ["AN", 1, 1, 6]]]], "r": [[3.094e-06, 3.09386e-06, 3.09398e-06, 3.09402e-06, 3.09411e-06, 3.094e-06, 3.09388e-06, 3.09406e-06, 3.09411e-06, 3.09389e-06], 0, 36.5126, 1652156114], "v": "v0.6"}
{"i": [["[\"te_slice\", 1, 28, 28, 256, [1, 0], 2, \"float16\"]", "cuda -keys=cuda,gpu -max_num_threads=1024 -model=unknown -thread_warp_size=32", [-1, 16, 64, 49152, 2147483647, 1024, 8, 32], "", 0, []], [[], [["FU", 1, [0, 1, 2, 3]], ["SP", 1, 0, 50176, [4], 1], ["AN", 1, 0, 5], ["AN", 1, 1, 6]]]], "r": [[1.22158e-05, 1.22166e-05, 1.22172e-05, 1.22176e-05, 1.22168e-05, 1.22153e-05, 1.22141e-05, 1.2215e-05, 1.22165e-05, 1.22156e-05], 0, 9.23596, 1652156087], "v": "v0.6"}
{"i": [["[\"te_slice\", 1, 28, 28, 256, [1, 0], 2, \"float16\"]", "cuda -keys=cuda,gpu -max_num_threads=1024 -model=unknown -thread_warp_size=32", [-1, 16, 64, 49152, 2147483647, 1024, 8, 32], "", 0, []], [[], [["FU", 1, [0, 1, 2, 3]], ["SP", 1, 0, 50176, [8], 1], ["AN", 1, 0, 5], ["AN", 1, 1, 6]]]], "r": [[7.25869e-06, 7.25882e-06, 7.25862e-06, 7.25954e-06, 7.25951e-06, 7.25994e-06, 7.25969e-06, 7.25962e-06, 7.25884e-06, 7.25968e-06], 0, 4.58074, 1652156082], "v": "v0.6"}
{"i": [["[\"te_slice\", 1, 28, 28, 256, [1, 0], 2, \"float16\"]", "cuda -keys=cuda,gpu -max_num_threads=1024 -model=unknown -thread_warp_size=32", [-1, 16, 64, 49152, 2147483647, 1024, 8, 32], "", 0, []], [[], [["FU", 1, [0, 1, 2, 3]], ["SP", 1, 0, 50176, [32], 1], ["AN", 1, 0, 5], ["AN", 1, 1, 6]]]], "r": [[3.66465e-06, 3.66487e-06, 3.66487e-06, 3.66452e-06, 3.66457e-06, 3.66454e-06, 3.66513e-06, 3.66479e-06, 3.66456e-06, 3.66455e-06], 0, 33.0937, 1652156111], "v": "v0.6"}
{"i": [["[\"te_slice\", 1, 28, 28, 256, [1, 0], 2, \"float16\"]", "cuda -keys=cuda,gpu -max_num_threads=1024 -model=unknown -thread_warp_size=32", [-1, 16, 64, 49152, 2147483647, 1024, 8, 32], "", 0, []], [[], [["FU", 1, [0, 1, 2, 3]], ["SP", 1, 0, 50176, [14], 1], ["AN", 1, 0, 5], ["AN", 1, 1, 6]]]], "r": [[5.2497e-06, 5.24932e-06, 5.25019e-06, 5.24934e-06, 5.24979e-06, 5.24932e-06, 5.24991e-06, 5.24967e-06, 5.2495e-06, 5.24982e-06], 0, 43.6392, 1652156122], "v": "v0.6"}
{"i": [["[\"te_slice\", 1, 28, 28, 256, [1, 0], 2, \"float16\"]", "cuda -keys=cuda,gpu -max_num_threads=1024 -model=unknown -thread_warp_size=32", [-1, 16, 64, 49152, 2147483647, 1024, 8, 32], "", 0, []], [[], [["FU", 1, [0, 1, 2, 3]], ["SP", 1, 0, 50176, [2], 1], ["AN", 1, 0, 5], ["AN", 1, 1, 6]]]], "r": [[2.1339e-05, 2.13392e-05, 2.13391e-05, 2.13393e-05, 2.13398e-05, 2.13402e-05, 2.13393e-05, 2.13381e-05, 2.1339e-05, 2.13394e-05], 0, 48.635, 1652156127], "v": "v0.6"}
{"i": [["[\"te_slice\", 1, 28, 28, 256, [1, 0], 2, \"float16\"]", "cuda -keys=cuda,gpu -max_num_threads=1024 -model=unknown -thread_warp_size=32", [-1, 16, 64, 49152, 2147483647, 1024, 8, 32], "", 0, []], [[], [["FU", 1, [0, 1, 2, 3]], ["SP", 1, 0, 50176, [56], 1], ["AN", 1, 0, 5], ["AN", 1, 1, 6]]]], "r": [[3.39095e-06, 3.39114e-06, 3.39113e-06, 3.39124e-06, 3.39127e-06, 3.39102e-06, 3.39159e-06, 3.3916e-06, 3.39142e-06, 3.39172e-06], 0, 39.9005, 1652156118], "v": "v0.6"}
