python/models/swin_transformer/kernel_configs/swin_transformer_layer_normalization_normal_1_56_56_128_1_0_float16.log
{"i": [["[\"layer_normalization_normal\", 1, 56, 56, 128, 1, 0, \"float16\"]", "cuda -keys=cuda,gpu -max_num_threads=1024 -model=unknown -thread_warp_size=32", [-1, 16, 64, 49152, 2147483647, 1024, 8, 32], "", 0, []], [[], [["CHW", 4, "local"], ["CI", 4], ["CI", 3], ["FU", 5, [0, 1]], ["SP", 5, 0, 401408, [8], 1], ["AN", 5, 0, 5], ["AN", 5, 1, 6]]]], "r": [[4.01639e-05, 4.017e-05, 4.01516e-05], 0, 0.699442, 1668016041], "v": "v0.6"}
{"i": [["[\"layer_normalization_normal\", 1, 56, 56, 128, 1, 0, \"float16\"]", "cuda -keys=cuda,gpu -max_num_threads=1024 -model=unknown -thread_warp_size=32", [-1, 16, 64, 49152, 2147483647, 1024, 8, 32], "", 0, []], [[], [["CHW", 4, "local"], ["CI", 4], ["CI", 3], ["FU", 5, [0, 1]], ["SP", 5, 0, 401408, [7], 1], ["AN", 5, 0, 5], ["AN", 5, 1, 6]]]], "r": [[4.56267e-05, 4.5615e-05, 4.56315e-05], 0, 2.60982, 1668016043], "v": "v0.6"}
{"i": [["[\"layer_normalization_normal\", 1, 56, 56, 128, 1, 0, \"float16\"]", "cuda -keys=cuda,gpu -max_num_threads=1024 -model=unknown -thread_warp_size=32", [-1, 16, 64, 49152, 2147483647, 1024, 8, 32], "", 0, []], [[], [["CHW", 4, "local"], ["CI", 4], ["CI", 3], ["FU", 5, [0, 1]], ["SP", 5, 0, 401408, [4], 1], ["AN", 5, 0, 5], ["AN", 5, 1, 6]]]], "r": [[7.75313e-05, 7.75232e-05, 7.75105e-05], 0, 1.84418, 1668016042], "v": "v0.6"}
{"i": [["[\"layer_normalization_normal\", 1, 56, 56, 128, 1, 0, \"float16\"]", "cuda -keys=cuda,gpu -max_num_threads=1024 -model=unknown -thread_warp_size=32", [-1, 16, 64, 49152, 2147483647, 1024, 8, 32], "", 0, []], [[], [["CHW", 4, "local"], ["CI", 4], ["CI", 3], ["FU", 5, [0, 1]], ["SP", 5, 0, 401408, [49], 1], ["AN", 5, 0, 5], ["AN", 5, 1, 6]]]], "r": [[8.97932e-06, 8.97513e-06, 8.98702e-06], 0, 3.33526, 1668016044], "v": "v0.6"}
{"i": [["[\"layer_normalization_normal\", 1, 56, 56, 128, 1, 0, \"float16\"]", "cuda -keys=cuda,gpu -max_num_threads=1024 -model=unknown -thread_warp_size=32", [-1, 16, 64, 49152, 2147483647, 1024, 8, 32], "", 0, []], [[], [["CHW", 4, "local"], ["CI", 4], ["CI", 3], ["FU", 5, [0, 1]], ["SP", 5, 0, 401408, [56], 1], ["AN", 5, 0, 5], ["AN", 5, 1, 6]]]], "r": [[8.10898e-06, 8.1068e-06, 8.11443e-06], 0, 1.05558, 1668016041], "v": "v0.6"}
{"i": [["[\"layer_normalization_normal\", 1, 56, 56, 128, 1, 0, \"float16\"]", "cuda -keys=cuda,gpu -max_num_threads=1024 -model=unknown -thread_warp_size=32", [-1, 16, 64, 49152, 2147483647, 1024, 8, 32], "", 0, []], [[], [["CHW", 4, "local"], ["CI", 4], ["CI", 3], ["FU", 5, [0, 1]], ["SP", 5, 0, 401408, [64], 1], ["AN", 5, 0, 5], ["AN", 5, 1, 6]]]], "r": [[7.4986e-06, 7.50016e-06, 7.49952e-06], 0, 1.45717, 1668016042], "v": "v0.6"}
{"i": [["[\"layer_normalization_normal\", 1, 56, 56, 128, 1, 0, \"float16\"]", "cuda -keys=cuda,gpu -max_num_threads=1024 -model=unknown -thread_warp_size=32", [-1, 16, 64, 49152, 2147483647, 1024, 8, 32], "", 0, []], [[], [["CHW", 4, "local"], ["CI", 4], ["CI", 3], ["FU", 5, [0, 1]], ["SP", 5, 0, 401408, [28], 1], ["AN", 5, 0, 5], ["AN", 5, 1, 6]]]], "r": [[1.37305e-05, 1.36799e-05, 1.36717e-05], 0, 2.18025, 1668016043], "v": "v0.6"}
{"i": [["[\"layer_normalization_normal\", 1, 56, 56, 128, 1, 0, \"float16\"]", "cuda -keys=cuda,gpu -max_num_threads=1024 -model=unknown -thread_warp_size=32", [-1, 16, 64, 49152, 2147483647, 1024, 8, 32], "", 0, []], [[], [["CHW", 4, "local"], ["CI", 4], ["CI", 3], ["FU", 5, [0, 1]], ["SP", 5, 0, 401408, [2], 1], ["AN", 5, 0, 5], ["AN", 5, 1, 6]]]], "r": [[0.000152049, 0.000152023, 0.000152007], 0, 4.81368, 1668016045], "v": "v0.6"}
{"i": [["[\"layer_normalization_normal\", 1, 56, 56, 128, 1, 0, \"float16\"]", "cuda -keys=cuda,gpu -max_num_threads=1024 -model=unknown -thread_warp_size=32", [-1, 16, 64, 49152, 2147483647, 1024, 8, 32], "", 0, []], [[], [["CHW", 4, "local"], ["CI", 4], ["CI", 3], ["FU", 5, [0, 1]], ["SP", 5, 0, 401408, [16], 1], ["AN", 5, 0, 5], ["AN", 5, 1, 6]]]], "r": [[2.1675e-05, 2.16559e-05, 2.16662e-05], 0, 2.94762, 1668016043], "v": "v0.6"}
{"i": [["[\"layer_normalization_normal\", 1, 56, 56, 128, 1, 0, \"float16\"]", "cuda -keys=cuda,gpu -max_num_threads=1024 -model=unknown -thread_warp_size=32", [-1, 16, 64, 49152, 2147483647, 1024, 8, 32], "", 0, []], [[], [["CHW", 4, "local"], ["CI", 4], ["CI", 3], ["FU", 5, [0, 1]], ["SP", 5, 0, 401408, [14], 1], ["AN", 5, 0, 5], ["AN", 5, 1, 6]]]], "r": [[2.43068e-05, 2.43006e-05, 2.43012e-05], 0, 4.41036, 1668016045], "v": "v0.6"}
{"i": [["[\"layer_normalization_normal\", 1, 56, 56, 128, 1, 0, \"float16\"]", "cuda -keys=cuda,gpu -max_num_threads=1024 -model=unknown -thread_warp_size=32", [-1, 16, 64, 49152, 2147483647, 1024, 8, 32], "", 0, []], [[], [["CHW", 4, "local"], ["CI", 4], ["CI", 3], ["FU", 5, [0, 1]], ["SP", 5, 0, 401408, [1], 1], ["AN", 5, 0, 5], ["AN", 5, 1, 6]]]], "r": [[0.000300731, 0.000300691, 0.000300663], 0, 4.0429, 1668016044], "v": "v0.6"}
{"i": [["[\"layer_normalization_normal\", 1, 56, 56, 128, 1, 0, \"float16\"]", "cuda -keys=cuda,gpu -max_num_threads=1024 -model=unknown -thread_warp_size=32", [-1, 16, 64, 49152, 2147483647, 1024, 8, 32], "", 0, []], [[], [["CHW", 4, "local"], ["CI", 4], ["CI", 3], ["FU", 5, [0, 1]], ["SP", 5, 0, 401408, [32], 1], ["AN", 5, 0, 5], ["AN", 5, 1, 6]]]], "r": [[1.24491e-05, 1.24478e-05, 1.24508e-05], 0, 3.68494, 1668016044], "v": "v0.6"}
{"i": [["[\"layer_normalization_normal\", 1, 56, 56, 128, 1, 0, \"float16\"]", "cuda -keys=cuda,gpu -max_num_threads=1024 -model=unknown -thread_warp_size=32", [-1, 16, 64, 49152, 2147483647, 1024, 8, 32], "", 0, []], [[], [["CHW", 4, "local"], ["CI", 4], ["CI", 3], ["FU", 5, [0, 1]], ["SP", 5, 0, 401408, [1], 1], ["AN", 5, 0, 5], ["AN", 5, 1, 6]]]], "r": [[0.000300658, 0.000300675, 0.000300667], 0, 1.5584, 1668016171], "v": "v0.6"}
{"i": [["[\"layer_normalization_normal\", 1, 56, 56, 128, 1, 0, \"float16\"]", "cuda -keys=cuda,gpu -max_num_threads=1024 -model=unknown -thread_warp_size=32", [-1, 16, 64, 49152, 2147483647, 1024, 8, 32], "", 0, []], [[], [["CHW", 4, "local"], ["CI", 4], ["CI", 3], ["FU", 5, [0, 1]], ["SP", 5, 0, 401408, [4], 1], ["AN", 5, 0, 5], ["AN", 5, 1, 6]]]], "r": [[7.74672e-05, 7.7463e-05, 7.74695e-05], 0, 0.943873, 1668016171], "v": "v0.6"}
{"i": [["[\"layer_normalization_normal\", 1, 56, 56, 128, 1, 0, \"float16\"]", "cuda -keys=cuda,gpu -max_num_threads=1024 -model=unknown -thread_warp_size=32", [-1, 16, 64, 49152, 2147483647, 1024, 8, 32], "", 0, []], [[], [["CHW", 4, "local"], ["CI", 4], ["CI", 3], ["FU", 5, [0, 1]], ["SP", 5, 0, 401408, [56], 1], ["AN", 5, 0, 5], ["AN", 5, 1, 6]]]], "r": [[8.20786e-06, 8.20232e-06, 8.20694e-06], 0, 1.93111, 1668016172], "v": "v0.6"}
{"i": [["[\"layer_normalization_normal\", 1, 56, 56, 128, 1, 0, \"float16\"]", "cuda -keys=cuda,gpu -max_num_threads=1024 -model=unknown -thread_warp_size=32", [-1, 16, 64, 49152, 2147483647, 1024, 8, 32], "", 0, []], [[], [["CHW", 4, "local"], ["CI", 4], ["CI", 3], ["FU", 5, [0, 1]], ["SP", 5, 0, 401408, [64], 1], ["AN", 5, 0, 5], ["AN", 5, 1, 6]]]], "r": [[7.41342e-06, 7.40748e-06, 7.40112e-06], 0, 2.93504, 1668016173], "v": "v0.6"}
{"i": [["[\"layer_normalization_normal\", 1, 56, 56, 128, 1, 0, \"float16\"]", "cuda -keys=cuda,gpu -max_num_threads=1024 -model=unknown -thread_warp_size=32", [-1, 16, 64, 49152, 2147483647, 1024, 8, 32], "", 0, []], [[], [["CHW", 4, "local"], ["CI", 4], ["CI", 3], ["FU", 5, [0, 1]], ["SP", 5, 0, 401408, [2], 1], ["AN", 5, 0, 5], ["AN", 5, 1, 6]]]], "r": [[0.000151855, 0.00015184, 0.000151859], 0, 1.25014, 1668016171], "v": "v0.6"}
{"i": [["[\"layer_normalization_normal\", 1, 56, 56, 128, 1, 0, \"float16\"]", "cuda -keys=cuda,gpu -max_num_threads=1024 -model=unknown -thread_warp_size=32", [-1, 16, 64, 49152, 2147483647, 1024, 8, 32], "", 0, []], [[], [["CHW", 4, "local"], ["CI", 4], ["CI", 3], ["FU", 5, [0, 1]], ["SP", 5, 0, 401408, [16], 1], ["AN", 5, 0, 5], ["AN", 5, 1, 6]]]], "r": [[2.18e-05, 2.17863e-05, 2.17921e-05], 0, 2.56147, 1668016172], "v": "v0.6"}
{"i": [["[\"layer_normalization_normal\", 1, 56, 56, 128, 1, 0, \"float16\"]", "cuda -keys=cuda,gpu -max_num_threads=1024 -model=unknown -thread_warp_size=32", [-1, 16, 64, 49152, 2147483647, 1024, 8, 32], "", 0, []], [[], [["CHW", 4, "local"], ["CI", 4], ["CI", 3], ["FU", 5, [0, 1]], ["SP", 5, 0, 401408, [7], 1], ["AN", 5, 0, 5], ["AN", 5, 1, 6]]]], "r": [[4.5409e-05, 4.54102e-05, 4.53907e-05], 0, 2.25146, 1668016172], "v": "v0.6"}
{"i": [["[\"layer_normalization_normal\", 1, 56, 56, 128, 1, 0, \"float16\"]", "cuda -keys=cuda,gpu -max_num_threads=1024 -model=unknown -thread_warp_size=32", [-1, 16, 64, 49152, 2147483647, 1024, 8, 32], "", 0, []], [[], [["CHW", 4, "local"], ["CI", 4], ["CI", 3], ["FU", 5, [0, 1]], ["SP", 5, 0, 401408, [8], 1], ["AN", 5, 0, 5], ["AN", 5, 1, 6]]]], "r": [[4.02346e-05, 4.02115e-05, 4.02275e-05], 0, 0.580662, 1668016170], "v": "v0.6"}
{"i": [["[\"layer_normalization_normal\", 1, 56, 56, 128, 1, 0, \"float16\"]", "cuda -keys=cuda,gpu -max_num_threads=1024 -model=unknown -thread_warp_size=32", [-1, 16, 64, 49152, 2147483647, 1024, 8, 32], "", 0, []], [[], [["CHW", 4, "local"], ["CI", 4], ["CI", 3], ["FU", 5, [0, 1]], ["SP", 5, 0, 401408, [14], 1], ["AN", 5, 0, 5], ["AN", 5, 1, 6]]]], "r": [[2.42185e-05, 2.4213e-05, 2.42223e-05], 0, 3.25354, 1668016173], "v": "v0.6"}
{"i": [["[\"layer_normalization_normal\", 1, 56, 56, 128, 1, 0, \"float16\"]", "cuda -keys=cuda,gpu -max_num_threads=1024 -model=unknown -thread_warp_size=32", [-1, 16, 64, 49152, 2147483647, 1024, 8, 32], "", 0, []], [[], [["CHW", 4, "local"], ["CI", 4], ["CI", 3], ["FU", 5, [0, 1]], ["SP", 5, 0, 401408, [49], 1], ["AN", 5, 0, 5], ["AN", 5, 1, 6]]]], "r": [[8.89497e-06, 8.89133e-06, 8.90061e-06], 0, 3.93039, 1668016174], "v": "v0.6"}
{"i": [["[\"layer_normalization_normal\", 1, 56, 56, 128, 1, 0, \"float16\"]", "cuda -keys=cuda,gpu -max_num_threads=1024 -model=unknown -thread_warp_size=32", [-1, 16, 64, 49152, 2147483647, 1024, 8, 32], "", 0, []], [[], [["CHW", 4, "local"], ["CI", 4], ["CI", 3], ["FU", 5, [0, 1]], ["SP", 5, 0, 401408, [28], 1], ["AN", 5, 0, 5], ["AN", 5, 1, 6]]]], "r": [[1.36377e-05, 1.36433e-05, 1.36406e-05], 0, 3.55543, 1668016173], "v": "v0.6"}
{"i": [["[\"layer_normalization_normal\", 1, 56, 56, 128, 1, 0, \"float16\"]", "cuda -keys=cuda,gpu -max_num_threads=1024 -model=unknown -thread_warp_size=32", [-1, 16, 64, 49152, 2147483647, 1024, 8, 32], "", 0, []], [[], [["CHW", 4, "local"], ["CI", 4], ["CI", 3], ["FU", 5, [0, 1]], ["SP", 5, 0, 401408, [32], 1], ["AN", 5, 0, 5], ["AN", 5, 1, 6]]]], "r": [[1.23276e-05, 1.23275e-05, 1.23279e-05], 0, 4.24996, 1668016174], "v": "v0.6"}
{"i": [["[\"layer_normalization_normal\", 1, 56, 56, 128, 1, 0, \"float16\"]", "cuda -keys=cuda,gpu -max_num_threads=1024 -model=unknown -thread_warp_size=32", [-1, 16, 64, 49152, 2147483647, 1024, 8, 32], "", 0, []], [[], [["CHW", 4, "local"], ["CI", 4], ["CI", 3], ["FU", 5, [0, 1]], ["SP", 5, 0, 401408, [4], 1], ["AN", 5, 0, 5], ["AN", 5, 1, 6]]]], "r": [[7.74863e-05, 7.74536e-05, 7.74525e-05], 0, 1.29944, 1668021044], "v": "v0.6"}
{"i": [["[\"layer_normalization_normal\", 1, 56, 56, 128, 1, 0, \"float16\"]", "cuda -keys=cuda,gpu -max_num_threads=1024 -model=unknown -thread_warp_size=32", [-1, 16, 64, 49152, 2147483647, 1024, 8, 32], "", 0, []], [[], [["CHW", 4, "local"], ["CI", 4], ["CI", 3], ["FU", 5, [0, 1]], ["SP", 5, 0, 401408, [8], 1], ["AN", 5, 0, 5], ["AN", 5, 1, 6]]]], "r": [[4.02358e-05, 4.02245e-05, 4.02322e-05], 0, 2.34219, 1668021045], "v": "v0.6"}
{"i": [["[\"layer_normalization_normal\", 1, 56, 56, 128, 1, 0, \"float16\"]", "cuda -keys=cuda,gpu -max_num_threads=1024 -model=unknown -thread_warp_size=32", [-1, 16, 64, 49152, 2147483647, 1024, 8, 32], "", 0, []], [[], [["CHW", 4, "local"], ["CI", 4], ["CI", 3], ["FU", 5, [0, 1]], ["SP", 5, 0, 401408, [28], 1], ["AN", 5, 0, 5], ["AN", 5, 1, 6]]]], "r": [[1.35939e-05, 1.35981e-05, 1.35973e-05], 0, 0.592314, 1668021044], "v": "v0.6"}
{"i": [["[\"layer_normalization_normal\", 1, 56, 56, 128, 1, 0, \"float16\"]", "cuda -keys=cuda,gpu -max_num_threads=1024 -model=unknown -thread_warp_size=32", [-1, 16, 64, 49152, 2147483647, 1024, 8, 32], "", 0, []], [[], [["CHW", 4, "local"], ["CI", 4], ["CI", 3], ["FU", 5, [0, 1]], ["SP", 5, 0, 401408, [64], 1], ["AN", 5, 0, 5], ["AN", 5, 1, 6]]]], "r": [[7.42219e-06, 7.4264e-06, 7.42695e-06], 0, 2.68045, 1668021046], "v": "v0.6"}
{"i": [["[\"layer_normalization_normal\", 1, 56, 56, 128, 1, 0, \"float16\"]", "cuda -keys=cuda,gpu -max_num_threads=1024 -model=unknown -thread_warp_size=32", [-1, 16, 64, 49152, 2147483647, 1024, 8, 32], "", 0, []], [[], [["CHW", 4, "local"], ["CI", 4], ["CI", 3], ["FU", 5, [0, 1]], ["SP", 5, 0, 401408, [56], 1], ["AN", 5, 0, 5], ["AN", 5, 1, 6]]]], "r": [[8.14397e-06, 8.14541e-06, 8.14749e-06], 0, 1.96835, 1668021045], "v": "v0.6"}
{"i": [["[\"layer_normalization_normal\", 1, 56, 56, 128, 1, 0, \"float16\"]", "cuda -keys=cuda,gpu -max_num_threads=1024 -model=unknown -thread_warp_size=32", [-1, 16, 64, 49152, 2147483647, 1024, 8, 32], "", 0, []], [[], [["CHW", 4, "local"], ["CI", 4], ["CI", 3], ["FU", 5, [0, 1]], ["SP", 5, 0, 401408, [32], 1], ["AN", 5, 0, 5], ["AN", 5, 1, 6]]]], "r": [[1.22825e-05, 1.22852e-05, 1.22853e-05], 0, 1.63626, 1668021045], "v": "v0.6"}
{"i": [["[\"layer_normalization_normal\", 1, 56, 56, 128, 1, 0, \"float16\"]", "cuda -keys=cuda,gpu -max_num_threads=1024 -model=unknown -thread_warp_size=32", [-1, 16, 64, 49152, 2147483647, 1024, 8, 32], "", 0, []], [[], [["CHW", 4, "local"], ["CI", 4], ["CI", 3], ["FU", 5, [0, 1]], ["SP", 5, 0, 401408, [1], 1], ["AN", 5, 0, 5], ["AN", 5, 1, 6]]]], "r": [[0.000300656, 0.000300706, 0.000300668], 0, 0.912467, 1668021044], "v": "v0.6"}
{"i": [["[\"layer_normalization_normal\", 1, 56, 56, 128, 1, 0, \"float16\"]", "cuda -keys=cuda,gpu -max_num_threads=1024 -model=unknown -thread_warp_size=32", [-1, 16, 64, 49152, 2147483647, 1024, 8, 32], "", 0, []], [[], [["CHW", 4, "local"], ["CI", 4], ["CI", 3], ["FU", 5, [0, 1]], ["SP", 5, 0, 401408, [49], 1], ["AN", 5, 0, 5], ["AN", 5, 1, 6]]]], "r": [[8.87933e-06, 8.88072e-06, 8.87917e-06], 0, 4.03684, 1668021047], "v": "v0.6"}
{"i": [["[\"layer_normalization_normal\", 1, 56, 56, 128, 1, 0, \"float16\"]", "cuda -keys=cuda,gpu -max_num_threads=1024 -model=unknown -thread_warp_size=32", [-1, 16, 64, 49152, 2147483647, 1024, 8, 32], "", 0, []], [[], [["CHW", 4, "local"], ["CI", 4], ["CI", 3], ["FU", 5, [0, 1]], ["SP", 5, 0, 401408, [7], 1], ["AN", 5, 0, 5], ["AN", 5, 1, 6]]]], "r": [[4.54205e-05, 4.54218e-05, 4.54079e-05], 0, 3.37604, 1668021046], "v": "v0.6"}
{"i": [["[\"layer_normalization_normal\", 1, 56, 56, 128, 1, 0, \"float16\"]", "cuda -keys=cuda,gpu -max_num_threads=1024 -model=unknown -thread_warp_size=32", [-1, 16, 64, 49152, 2147483647, 1024, 8, 32], "", 0, []], [[], [["CHW", 4, "local"], ["CI", 4], ["CI", 3], ["FU", 5, [0, 1]], ["SP", 5, 0, 401408, [2], 1], ["AN", 5, 0, 5], ["AN", 5, 1, 6]]]], "r": [[0.00015201, 0.00015196, 0.000151984], 0, 3.00742, 1668021046], "v": "v0.6"}
{"i": [["[\"layer_normalization_normal\", 1, 56, 56, 128, 1, 0, \"float16\"]", "cuda -keys=cuda,gpu -max_num_threads=1024 -model=unknown -thread_warp_size=32", [-1, 16, 64, 49152, 2147483647, 1024, 8, 32], "", 0, []], [[], [["CHW", 4, "local"], ["CI", 4], ["CI", 3], ["FU", 5, [0, 1]], ["SP", 5, 0, 401408, [14], 1], ["AN", 5, 0, 5], ["AN", 5, 1, 6]]]], "r": [[2.43074e-05, 2.4298e-05, 2.42931e-05], 0, 4.42747, 1668021047], "v": "v0.6"}
{"i": [["[\"layer_normalization_normal\", 1, 56, 56, 128, 1, 0, \"float16\"]", "cuda -keys=cuda,gpu -max_num_threads=1024 -model=unknown -thread_warp_size=32", [-1, 16, 64, 49152, 2147483647, 1024, 8, 32], "", 0, []], [[], [["CHW", 4, "local"], ["CI", 4], ["CI", 3], ["FU", 5, [0, 1]], ["SP", 5, 0, 401408, [16], 1], ["AN", 5, 0, 5], ["AN", 5, 1, 6]]]], "r": [[2.15734e-05, 2.15845e-05, 2.15708e-05], 0, 3.70168, 1668021047], "v": "v0.6"}
{"i": [["[\"layer_normalization_normal\", 1, 56, 56, 128, 1, 0, \"float16\"]", "cuda -keys=cuda,gpu -max_num_threads=1024 -model=unknown -thread_warp_size=32", [-1, 16, 64, 49152, 2147483647, 1024, 8, 32], "", 0, []], [[], [["CHW", 4, "local"], ["CI", 4], ["CI", 3], ["FU", 5, [0, 1]], ["SP", 5, 0, 401408, [14], 1], ["AN", 5, 0, 5], ["AN", 5, 1, 6]]]], "r": [[2.42137e-05, 2.42085e-05, 2.42021e-05], 0, 1.66037, 1668045792], "v": "v0.6"}
{"i": [["[\"layer_normalization_normal\", 1, 56, 56, 128, 1, 0, \"float16\"]", "cuda -keys=cuda,gpu -max_num_threads=1024 -model=unknown -thread_warp_size=32", [-1, 16, 64, 49152, 2147483647, 1024, 8, 32], "", 0, []], [[], [["CHW", 4, "local"], ["CI", 4], ["CI", 3], ["FU", 5, [0, 1]], ["SP", 5, 0, 401408, [16], 1], ["AN", 5, 0, 5], ["AN", 5, 1, 6]]]], "r": [[2.16605e-05, 2.16583e-05, 2.1665e-05], 0, 0.589933, 1668045791], "v": "v0.6"}
{"i": [["[\"layer_normalization_normal\", 1, 56, 56, 128, 1, 0, \"float16\"]", "cuda -keys=cuda,gpu -max_num_threads=1024 -model=unknown -thread_warp_size=32", [-1, 16, 64, 49152, 2147483647, 1024, 8, 32], "", 0, []], [[], [["CHW", 4, "local"], ["CI", 4], ["CI", 3], ["FU", 5, [0, 1]], ["SP", 5, 0, 401408, [56], 1], ["AN", 5, 0, 5], ["AN", 5, 1, 6]]]], "r": [[8.17946e-06, 8.18534e-06, 8.18447e-06], 0, 1.32748, 1668045792], "v": "v0.6"}
{"i": [["[\"layer_normalization_normal\", 1, 56, 56, 128, 1, 0, \"float16\"]", "cuda -keys=cuda,gpu -max_num_threads=1024 -model=unknown -thread_warp_size=32", [-1, 16, 64, 49152, 2147483647, 1024, 8, 32], "", 0, []], [[], [["CHW", 4, "local"], ["CI", 4], ["CI", 3], ["FU", 5, [0, 1]], ["SP", 5, 0, 401408, [49], 1], ["AN", 5, 0, 5], ["AN", 5, 1, 6]]]], "r": [[8.95145e-06, 8.95217e-06, 8.94681e-06], 0, 0.990325, 1668045791], "v": "v0.6"}
{"i": [["[\"layer_normalization_normal\", 1, 56, 56, 128, 1, 0, \"float16\"]", "cuda -keys=cuda,gpu -max_num_threads=1024 -model=unknown -thread_warp_size=32", [-1, 16, 64, 49152, 2147483647, 1024, 8, 32], "", 0, []], [[], [["CHW", 4, "local"], ["CI", 4], ["CI", 3], ["FU", 5, [0, 1]], ["SP", 5, 0, 401408, [8], 1], ["AN", 5, 0, 5], ["AN", 5, 1, 6]]]], "r": [[4.01436e-05, 4.01518e-05, 4.01524e-05], 0, 2.04475, 1668045792], "v": "v0.6"}
{"i": [["[\"layer_normalization_normal\", 1, 56, 56, 128, 1, 0, \"float16\"]", "cuda -keys=cuda,gpu -max_num_threads=1024 -model=unknown -thread_warp_size=32", [-1, 16, 64, 49152, 2147483647, 1024, 8, 32], "", 0, []], [[], [["CHW", 4, "local"], ["CI", 4], ["CI", 3], ["FU", 5, [0, 1]], ["SP", 5, 0, 401408, [28], 1], ["AN", 5, 0, 5], ["AN", 5, 1, 6]]]], "r": [[1.36704e-05, 1.36709e-05, 1.36757e-05], 0, 2.37984, 1668045793], "v": "v0.6"}
{"i": [["[\"layer_normalization_normal\", 1, 56, 56, 128, 1, 0, \"float16\"]", "cuda -keys=cuda,gpu -max_num_threads=1024 -model=unknown -thread_warp_size=32", [-1, 16, 64, 49152, 2147483647, 1024, 8, 32], "", 0, []], [[], [["CHW", 4, "local"], ["CI", 4], ["CI", 3], ["FU", 5, [0, 1]], ["SP", 5, 0, 401408, [1], 1], ["AN", 5, 0, 5], ["AN", 5, 1, 6]]]], "r": [[0.000300681, 0.000300659, 0.00030066], 0, 2.70925, 1668045793], "v": "v0.6"}
{"i": [["[\"layer_normalization_normal\", 1, 56, 56, 128, 1, 0, \"float16\"]", "cuda -keys=cuda,gpu -max_num_threads=1024 -model=unknown -thread_warp_size=32", [-1, 16, 64, 49152, 2147483647, 1024, 8, 32], "", 0, []], [[], [["CHW", 4, "local"], ["CI", 4], ["CI", 3], ["FU", 5, [0, 1]], ["SP", 5, 0, 401408, [4], 1], ["AN", 5, 0, 5], ["AN", 5, 1, 6]]]], "r": [[7.75046e-05, 7.75199e-05, 7.74845e-05], 0, 3.41616, 1668045794], "v": "v0.6"}
{"i": [["[\"layer_normalization_normal\", 1, 56, 56, 128, 1, 0, \"float16\"]", "cuda -keys=cuda,gpu -max_num_threads=1024 -model=unknown -thread_warp_size=32", [-1, 16, 64, 49152, 2147483647, 1024, 8, 32], "", 0, []], [[], [["CHW", 4, "local"], ["CI", 4], ["CI", 3], ["FU", 5, [0, 1]], ["SP", 5, 0, 401408, [32], 1], ["AN", 5, 0, 5], ["AN", 5, 1, 6]]]], "r": [[1.23021e-05, 1.23093e-05, 1.23015e-05], 0, 3.74127, 1668045794], "v": "v0.6"}
{"i": [["[\"layer_normalization_normal\", 1, 56, 56, 128, 1, 0, \"float16\"]", "cuda -keys=cuda,gpu -max_num_threads=1024 -model=unknown -thread_warp_size=32", [-1, 16, 64, 49152, 2147483647, 1024, 8, 32], "", 0, []], [[], [["CHW", 4, "local"], ["CI", 4], ["CI", 3], ["FU", 5, [0, 1]], ["SP", 5, 0, 401408, [2], 1], ["AN", 5, 0, 5], ["AN", 5, 1, 6]]]], "r": [[0.000151928, 0.000151917, 0.000151912], 0, 3.07704, 1668045793], "v": "v0.6"}
{"i": [["[\"layer_normalization_normal\", 1, 56, 56, 128, 1, 0, \"float16\"]", "cuda -keys=cuda,gpu -max_num_threads=1024 -model=unknown -thread_warp_size=32", [-1, 16, 64, 49152, 2147483647, 1024, 8, 32], "", 0, []], [[], [["CHW", 4, "local"], ["CI", 4], ["CI", 3], ["FU", 5, [0, 1]], ["SP", 5, 0, 401408, [7], 1], ["AN", 5, 0, 5], ["AN", 5, 1, 6]]]], "r": [[4.54132e-05, 4.54122e-05, 4.54068e-05], 0, 4.46579, 1668045795], "v": "v0.6"}
{"i": [["[\"layer_normalization_normal\", 1, 56, 56, 128, 1, 0, \"float16\"]", "cuda -keys=cuda,gpu -max_num_threads=1024 -model=unknown -thread_warp_size=32", [-1, 16, 64, 49152, 2147483647, 1024, 8, 32], "", 0, []], [[], [["CHW", 4, "local"], ["CI", 4], ["CI", 3], ["FU", 5, [0, 1]], ["SP", 5, 0, 401408, [64], 1], ["AN", 5, 0, 5], ["AN", 5, 1, 6]]]], "r": [[7.4792e-06, 7.47798e-06, 7.47955e-06], 0, 4.11688, 1668045794], "v": "v0.6"}
{"i": [["[\"layer_normalization_normal\", 1, 56, 56, 128, 1, 0, \"float16\"]", "cuda -keys=cuda,gpu -max_num_threads=1024 -model=unknown -thread_warp_size=32", [-1, 16, 64, 49152, 2147483647, 1024, 8, 32], "", 0, []], [[], [["CHW", 4, "local"], ["CI", 4], ["CI", 3], ["FU", 5, [0, 1]], ["SP", 5, 0, 401408, [64], 1], ["AN", 5, 0, 5], ["AN", 5, 1, 6]]]], "r": [[7.45704e-06, 7.45929e-06, 7.46334e-06], 0, 2.07513, 1668047099], "v": "v0.6"}
{"i": [["[\"layer_normalization_normal\", 1, 56, 56, 128, 1, 0, \"float16\"]", "cuda -keys=cuda,gpu -max_num_threads=1024 -model=unknown -thread_warp_size=32", [-1, 16, 64, 49152, 2147483647, 1024, 8, 32], "", 0, []], [[], [["CHW", 4, "local"], ["CI", 4], ["CI", 3], ["FU", 5, [0, 1]], ["SP", 5, 0, 401408, [14], 1], ["AN", 5, 0, 5], ["AN", 5, 1, 6]]]], "r": [[2.42198e-05, 2.42071e-05, 2.42026e-05], 0, 1.68441, 1668047099], "v": "v0.6"}
{"i": [["[\"layer_normalization_normal\", 1, 56, 56, 128, 1, 0, \"float16\"]", "cuda -keys=cuda,gpu -max_num_threads=1024 -model=unknown -thread_warp_size=32", [-1, 16, 64, 49152, 2147483647, 1024, 8, 32], "", 0, []], [[], [["CHW", 4, "local"], ["CI", 4], ["CI", 3], ["FU", 5, [0, 1]], ["SP", 5, 0, 401408, [1], 1], ["AN", 5, 0, 5], ["AN", 5, 1, 6]]]], "r": [[0.00030069, 0.000300767, 0.000300654], 0, 0.582818, 1668047098], "v": "v0.6"}
{"i": [["[\"layer_normalization_normal\", 1, 56, 56, 128, 1, 0, \"float16\"]", "cuda -keys=cuda,gpu -max_num_threads=1024 -model=unknown -thread_warp_size=32", [-1, 16, 64, 49152, 2147483647, 1024, 8, 32], "", 0, []], [[], [["CHW", 4, "local"], ["CI", 4], ["CI", 3], ["FU", 5, [0, 1]], ["SP", 5, 0, 401408, [7], 1], ["AN", 5, 0, 5], ["AN", 5, 1, 6]]]], "r": [[4.55767e-05, 4.55742e-05, 4.55504e-05], 0, 0.978759, 1668047098], "v": "v0.6"}
{"i": [["[\"layer_normalization_normal\", 1, 56, 56, 128, 1, 0, \"float16\"]", "cuda -keys=cuda,gpu -max_num_threads=1024 -model=unknown -thread_warp_size=32", [-1, 16, 64, 49152, 2147483647, 1024, 8, 32], "", 0, []], [[], [["CHW", 4, "local"], ["CI", 4], ["CI", 3], ["FU", 5, [0, 1]], ["SP", 5, 0, 401408, [56], 1], ["AN", 5, 0, 5], ["AN", 5, 1, 6]]]], "r": [[8.05159e-06, 8.06003e-06, 8.05339e-06], 0, 1.33529, 1668047098], "v": "v0.6"}
{"i": [["[\"layer_normalization_normal\", 1, 56, 56, 128, 1, 0, \"float16\"]", "cuda -keys=cuda,gpu -max_num_threads=1024 -model=unknown -thread_warp_size=32", [-1, 16, 64, 49152, 2147483647, 1024, 8, 32], "", 0, []], [[], [["CHW", 4, "local"], ["CI", 4], ["CI", 3], ["FU", 5, [0, 1]], ["SP", 5, 0, 401408, [49], 1], ["AN", 5, 0, 5], ["AN", 5, 1, 6]]]], "r": [[8.8701e-06, 8.85688e-06, 8.86695e-06], 0, 2.41573, 1668047099], "v": "v0.6"}
{"i": [["[\"layer_normalization_normal\", 1, 56, 56, 128, 1, 0, \"float16\"]", "cuda -keys=cuda,gpu -max_num_threads=1024 -model=unknown -thread_warp_size=32", [-1, 16, 64, 49152, 2147483647, 1024, 8, 32], "", 0, []], [[], [["CHW", 4, "local"], ["CI", 4], ["CI", 3], ["FU", 5, [0, 1]], ["SP", 5, 0, 401408, [4], 1], ["AN", 5, 0, 5], ["AN", 5, 1, 6]]]], "r": [[7.74622e-05, 7.74525e-05, 7.74519e-05], 0, 2.75672, 1668047100], "v": "v0.6"}
{"i": [["[\"layer_normalization_normal\", 1, 56, 56, 128, 1, 0, \"float16\"]", "cuda -keys=cuda,gpu -max_num_threads=1024 -model=unknown -thread_warp_size=32", [-1, 16, 64, 49152, 2147483647, 1024, 8, 32], "", 0, []], [[], [["CHW", 4, "local"], ["CI", 4], ["CI", 3], ["FU", 5, [0, 1]], ["SP", 5, 0, 401408, [28], 1], ["AN", 5, 0, 5], ["AN", 5, 1, 6]]]], "r": [[1.36127e-05, 1.36131e-05, 1.36135e-05], 0, 3.49129, 1668047101], "v": "v0.6"}
{"i": [["[\"layer_normalization_normal\", 1, 56, 56, 128, 1, 0, \"float16\"]", "cuda -keys=cuda,gpu -max_num_threads=1024 -model=unknown -thread_warp_size=32", [-1, 16, 64, 49152, 2147483647, 1024, 8, 32], "", 0, []], [[], [["CHW", 4, "local"], ["CI", 4], ["CI", 3], ["FU", 5, [0, 1]], ["SP", 5, 0, 401408, [16], 1], ["AN", 5, 0, 5], ["AN", 5, 1, 6]]]], "r": [[2.18473e-05, 2.18421e-05, 2.18386e-05], 0, 3.14715, 1668047100], "v": "v0.6"}
{"i": [["[\"layer_normalization_normal\", 1, 56, 56, 128, 1, 0, \"float16\"]", "cuda -keys=cuda,gpu -max_num_threads=1024 -model=unknown -thread_warp_size=32", [-1, 16, 64, 49152, 2147483647, 1024, 8, 32], "", 0, []], [[], [["CHW", 4, "local"], ["CI", 4], ["CI", 3], ["FU", 5, [0, 1]], ["SP", 5, 0, 401408, [32], 1], ["AN", 5, 0, 5], ["AN", 5, 1, 6]]]], "r": [[1.24938e-05, 1.24928e-05, 1.24965e-05], 0, 3.81427, 1668047101], "v": "v0.6"}
{"i": [["[\"layer_normalization_normal\", 1, 56, 56, 128, 1, 0, \"float16\"]", "cuda -keys=cuda,gpu -max_num_threads=1024 -model=unknown -thread_warp_size=32", [-1, 16, 64, 49152, 2147483647, 1024, 8, 32], "", 0, []], [[], [["CHW", 4, "local"], ["CI", 4], ["CI", 3], ["FU", 5, [0, 1]], ["SP", 5, 0, 401408, [8], 1], ["AN", 5, 0, 5], ["AN", 5, 1, 6]]]], "r": [[4.02691e-05, 4.02725e-05, 4.02653e-05], 0, 4.53508, 1668047102], "v": "v0.6"}
{"i": [["[\"layer_normalization_normal\", 1, 56, 56, 128, 1, 0, \"float16\"]", "cuda -keys=cuda,gpu -max_num_threads=1024 -model=unknown -thread_warp_size=32", [-1, 16, 64, 49152, 2147483647, 1024, 8, 32], "", 0, []], [[], [["CHW", 4, "local"], ["CI", 4], ["CI", 3], ["FU", 5, [0, 1]], ["SP", 5, 0, 401408, [2], 1], ["AN", 5, 0, 5], ["AN", 5, 1, 6]]]], "r": [[0.000151837, 0.000151859, 0.000151849], 0, 4.19195, 1668047101], "v": "v0.6"}
{"i": [["[\"layer_normalization_normal\", 1, 56, 56, 128, 1, 0, \"float16\"]", "cuda -keys=cuda,gpu -max_num_threads=1024 -model=unknown -thread_warp_size=32", [-1, 16, 64, 49152, 2147483647, 1024, 8, 32], "", 0, []], [[], [["CHW", 4, "local"], ["CI", 4], ["CI", 3], ["FU", 5, [0, 1]], ["SP", 5, 0, 401408, [14], 1], ["AN", 5, 0, 5], ["AN", 5, 1, 6]]]], "r": [[2.44771e-05, 2.44715e-05, 2.44751e-05], 0, 0.984763, 1668048049], "v": "v0.6"}
{"i": [["[\"layer_normalization_normal\", 1, 56, 56, 128, 1, 0, \"float16\"]", "cuda -keys=cuda,gpu -max_num_threads=1024 -model=unknown -thread_warp_size=32", [-1, 16, 64, 49152, 2147483647, 1024, 8, 32], "", 0, []], [[], [["CHW", 4, "local"], ["CI", 4], ["CI", 3], ["FU", 5, [0, 1]], ["SP", 5, 0, 401408, [7], 1], ["AN", 5, 0, 5], ["AN", 5, 1, 6]]]], "r": [[4.55656e-05, 4.55622e-05, 4.55505e-05], 0, 1.33931, 1668048049], "v": "v0.6"}
{"i": [["[\"layer_normalization_normal\", 1, 56, 56, 128, 1, 0, \"float16\"]", "cuda -keys=cuda,gpu -max_num_threads=1024 -model=unknown -thread_warp_size=32", [-1, 16, 64, 49152, 2147483647, 1024, 8, 32], "", 0, []], [[], [["CHW", 4, "local"], ["CI", 4], ["CI", 3], ["FU", 5, [0, 1]], ["SP", 5, 0, 401408, [16], 1], ["AN", 5, 0, 5], ["AN", 5, 1, 6]]]], "r": [[2.16947e-05, 2.16851e-05, 2.16854e-05], 0, 2.41278, 1668048050], "v": "v0.6"}
{"i": [["[\"layer_normalization_normal\", 1, 56, 56, 128, 1, 0, \"float16\"]", "cuda -keys=cuda,gpu -max_num_threads=1024 -model=unknown -thread_warp_size=32", [-1, 16, 64, 49152, 2147483647, 1024, 8, 32], "", 0, []], [[], [["CHW", 4, "local"], ["CI", 4], ["CI", 3], ["FU", 5, [0, 1]], ["SP", 5, 0, 401408, [1], 1], ["AN", 5, 0, 5], ["AN", 5, 1, 6]]]], "r": [[0.000300741, 0.000300842, 0.000300734], 0, 2.06183, 1668048050], "v": "v0.6"}
{"i": [["[\"layer_normalization_normal\", 1, 56, 56, 128, 1, 0, \"float16\"]", "cuda -keys=cuda,gpu -max_num_threads=1024 -model=unknown -thread_warp_size=32", [-1, 16, 64, 49152, 2147483647, 1024, 8, 32], "", 0, []], [[], [["CHW", 4, "local"], ["CI", 4], ["CI", 3], ["FU", 5, [0, 1]], ["SP", 5, 0, 401408, [64], 1], ["AN", 5, 0, 5], ["AN", 5, 1, 6]]]], "r": [[7.53706e-06, 7.54499e-06, 7.53825e-06], 0, 0.603557, 1668048048], "v": "v0.6"}
{"i": [["[\"layer_normalization_normal\", 1, 56, 56, 128, 1, 0, \"float16\"]", "cuda -keys=cuda,gpu -max_num_threads=1024 -model=unknown -thread_warp_size=32", [-1, 16, 64, 49152, 2147483647, 1024, 8, 32], "", 0, []], [[], [["CHW", 4, "local"], ["CI", 4], ["CI", 3], ["FU", 5, [0, 1]], ["SP", 5, 0, 401408, [4], 1], ["AN", 5, 0, 5], ["AN", 5, 1, 6]]]], "r": [[7.73209e-05, 7.73246e-05, 7.73295e-05], 0, 2.75817, 1668048050], "v": "v0.6"}
{"i": [["[\"layer_normalization_normal\", 1, 56, 56, 128, 1, 0, \"float16\"]", "cuda -keys=cuda,gpu -max_num_threads=1024 -model=unknown -thread_warp_size=32", [-1, 16, 64, 49152, 2147483647, 1024, 8, 32], "", 0, []], [[], [["CHW", 4, "local"], ["CI", 4], ["CI", 3], ["FU", 5, [0, 1]], ["SP", 5, 0, 401408, [8], 1], ["AN", 5, 0, 5], ["AN", 5, 1, 6]]]], "r": [[4.01308e-05, 4.01315e-05, 4.0132e-05], 0, 3.13199, 1668048051], "v": "v0.6"}
{"i": [["[\"layer_normalization_normal\", 1, 56, 56, 128, 1, 0, \"float16\"]", "cuda -keys=cuda,gpu -max_num_threads=1024 -model=unknown -thread_warp_size=32", [-1, 16, 64, 49152, 2147483647, 1024, 8, 32], "", 0, []], [[], [["CHW", 4, "local"], ["CI", 4], ["CI", 3], ["FU", 5, [0, 1]], ["SP", 5, 0, 401408, [56], 1], ["AN", 5, 0, 5], ["AN", 5, 1, 6]]]], "r": [[8.12026e-06, 8.12087e-06, 8.12018e-06], 0, 3.47482, 1668048051], "v": "v0.6"}
{"i": [["[\"layer_normalization_normal\", 1, 56, 56, 128, 1, 0, \"float16\"]", "cuda -keys=cuda,gpu -max_num_threads=1024 -model=unknown -thread_warp_size=32", [-1, 16, 64, 49152, 2147483647, 1024, 8, 32], "", 0, []], [[], [["CHW", 4, "local"], ["CI", 4], ["CI", 3], ["FU", 5, [0, 1]], ["SP", 5, 0, 401408, [2], 1], ["AN", 5, 0, 5], ["AN", 5, 1, 6]]]], "r": [[0.000151931, 0.000151975, 0.00015193], 0, 1.67151, 1668048049], "v": "v0.6"}
{"i": [["[\"layer_normalization_normal\", 1, 56, 56, 128, 1, 0, \"float16\"]", "cuda -keys=cuda,gpu -max_num_threads=1024 -model=unknown -thread_warp_size=32", [-1, 16, 64, 49152, 2147483647, 1024, 8, 32], "", 0, []], [[], [["CHW", 4, "local"], ["CI", 4], ["CI", 3], ["FU", 5, [0, 1]], ["SP", 5, 0, 401408, [28], 1], ["AN", 5, 0, 5], ["AN", 5, 1, 6]]]], "r": [[1.36095e-05, 1.36024e-05, 1.36149e-05], 0, 4.20241, 1668048052], "v": "v0.6"}
{"i": [["[\"layer_normalization_normal\", 1, 56, 56, 128, 1, 0, \"float16\"]", "cuda -keys=cuda,gpu -max_num_threads=1024 -model=unknown -thread_warp_size=32", [-1, 16, 64, 49152, 2147483647, 1024, 8, 32], "", 0, []], [[], [["CHW", 4, "local"], ["CI", 4], ["CI", 3], ["FU", 5, [0, 1]], ["SP", 5, 0, 401408, [32], 1], ["AN", 5, 0, 5], ["AN", 5, 1, 6]]]], "r": [[1.23597e-05, 1.23554e-05, 1.23526e-05], 0, 3.81223, 1668048052], "v": "v0.6"}
{"i": [["[\"layer_normalization_normal\", 1, 56, 56, 128, 1, 0, \"float16\"]", "cuda -keys=cuda,gpu -max_num_threads=1024 -model=unknown -thread_warp_size=32", [-1, 16, 64, 49152, 2147483647, 1024, 8, 32], "", 0, []], [[], [["CHW", 4, "local"], ["CI", 4], ["CI", 3], ["FU", 5, [0, 1]], ["SP", 5, 0, 401408, [49], 1], ["AN", 5, 0, 5], ["AN", 5, 1, 6]]]], "r": [[8.80403e-06, 8.80595e-06, 8.79902e-06], 0, 4.53304, 1668048052], "v": "v0.6"}
{"i": [["[\"layer_normalization_normal\", 1, 56, 56, 128, 1, 0, \"float16\"]", "cuda -keys=cuda,gpu -max_num_threads=1024 -model=unknown -thread_warp_size=32", [-1, 16, 64, 49152, 2147483647, 1024, 8, 32], "", 0, []], [[], [["CHW", 4, "local"], ["CI", 4], ["CI", 3], ["FU", 5, [0, 1]], ["SP", 5, 0, 401408, [8], 1], ["AN", 5, 0, 5], ["AN", 5, 1, 6]]]], "r": [[4.02313e-05, 4.02258e-05, 4.02365e-05], 0, 1.67592, 1668048568], "v": "v0.6"}
{"i": [["[\"layer_normalization_normal\", 1, 56, 56, 128, 1, 0, \"float16\"]", "cuda -keys=cuda,gpu -max_num_threads=1024 -model=unknown -thread_warp_size=32", [-1, 16, 64, 49152, 2147483647, 1024, 8, 32], "", 0, []], [[], [["CHW", 4, "local"], ["CI", 4], ["CI", 3], ["FU", 5, [0, 1]], ["SP", 5, 0, 401408, [4], 1], ["AN", 5, 0, 5], ["AN", 5, 1, 6]]]], "r": [[7.73496e-05, 7.73344e-05, 7.73365e-05], 0, 0.595201, 1668048567], "v": "v0.6"}
{"i": [["[\"layer_normalization_normal\", 1, 56, 56, 128, 1, 0, \"float16\"]", "cuda -keys=cuda,gpu -max_num_threads=1024 -model=unknown -thread_warp_size=32", [-1, 16, 64, 49152, 2147483647, 1024, 8, 32], "", 0, []], [[], [["CHW", 4, "local"], ["CI", 4], ["CI", 3], ["FU", 5, [0, 1]], ["SP", 5, 0, 401408, [1], 1], ["AN", 5, 0, 5], ["AN", 5, 1, 6]]]], "r": [[0.000300674, 0.000300699, 0.00030066], 0, 3.09581, 1668048570], "v": "v0.6"}
{"i": [["[\"layer_normalization_normal\", 1, 56, 56, 128, 1, 0, \"float16\"]", "cuda -keys=cuda,gpu -max_num_threads=1024 -model=unknown -thread_warp_size=32", [-1, 16, 64, 49152, 2147483647, 1024, 8, 32], "", 0, []], [[], [["CHW", 4, "local"], ["CI", 4], ["CI", 3], ["FU", 5, [0, 1]], ["SP", 5, 0, 401408, [16], 1], ["AN", 5, 0, 5], ["AN", 5, 1, 6]]]], "r": [[2.17206e-05, 2.17164e-05, 2.17194e-05], 0, 1.33615, 1668048568], "v": "v0.6"}
{"i": [["[\"layer_normalization_normal\", 1, 56, 56, 128, 1, 0, \"float16\"]", "cuda -keys=cuda,gpu -max_num_threads=1024 -model=unknown -thread_warp_size=32", [-1, 16, 64, 49152, 2147483647, 1024, 8, 32], "", 0, []], [[], [["CHW", 4, "local"], ["CI", 4], ["CI", 3], ["FU", 5, [0, 1]], ["SP", 5, 0, 401408, [49], 1], ["AN", 5, 0, 5], ["AN", 5, 1, 6]]]], "r": [[8.83057e-06, 8.83074e-06, 8.82352e-06], 0, 0.94814, 1668048567], "v": "v0.6"}
{"i": [["[\"layer_normalization_normal\", 1, 56, 56, 128, 1, 0, \"float16\"]", "cuda -keys=cuda,gpu -max_num_threads=1024 -model=unknown -thread_warp_size=32", [-1, 16, 64, 49152, 2147483647, 1024, 8, 32], "", 0, []], [[], [["CHW", 4, "local"], ["CI", 4], ["CI", 3], ["FU", 5, [0, 1]], ["SP", 5, 0, 401408, [32], 1], ["AN", 5, 0, 5], ["AN", 5, 1, 6]]]], "r": [[1.2345e-05, 1.23498e-05, 1.23459e-05], 0, 2.75386, 1668048569], "v": "v0.6"}
{"i": [["[\"layer_normalization_normal\", 1, 56, 56, 128, 1, 0, \"float16\"]", "cuda -keys=cuda,gpu -max_num_threads=1024 -model=unknown -thread_warp_size=32", [-1, 16, 64, 49152, 2147483647, 1024, 8, 32], "", 0, []], [[], [["CHW", 4, "local"], ["CI", 4], ["CI", 3], ["FU", 5, [0, 1]], ["SP", 5, 0, 401408, [14], 1], ["AN", 5, 0, 5], ["AN", 5, 1, 6]]]], "r": [[2.42013e-05, 2.42015e-05, 2.42038e-05], 0, 2.01377, 1668048568], "v": "v0.6"}
{"i": [["[\"layer_normalization_normal\", 1, 56, 56, 128, 1, 0, \"float16\"]", "cuda -keys=cuda,gpu -max_num_threads=1024 -model=unknown -thread_warp_size=32", [-1, 16, 64, 49152, 2147483647, 1024, 8, 32], "", 0, []], [[], [["CHW", 4, "local"], ["CI", 4], ["CI", 3], ["FU", 5, [0, 1]], ["SP", 5, 0, 401408, [56], 1], ["AN", 5, 0, 5], ["AN", 5, 1, 6]]]], "r": [[8.09738e-06, 8.10368e-06, 8.0977e-06], 0, 2.40169, 1668048569], "v": "v0.6"}
{"i": [["[\"layer_normalization_normal\", 1, 56, 56, 128, 1, 0, \"float16\"]", "cuda -keys=cuda,gpu -max_num_threads=1024 -model=unknown -thread_warp_size=32", [-1, 16, 64, 49152, 2147483647, 1024, 8, 32], "", 0, []], [[], [["CHW", 4, "local"], ["CI", 4], ["CI", 3], ["FU", 5, [0, 1]], ["SP", 5, 0, 401408, [64], 1], ["AN", 5, 0, 5], ["AN", 5, 1, 6]]]], "r": [[7.38261e-06, 7.38119e-06, 7.37862e-06], 0, 3.46522, 1668048570], "v": "v0.6"}
{"i": [["[\"layer_normalization_normal\", 1, 56, 56, 128, 1, 0, \"float16\"]", "cuda -keys=cuda,gpu -max_num_threads=1024 -model=unknown -thread_warp_size=32", [-1, 16, 64, 49152, 2147483647, 1024, 8, 32], "", 0, []], [[], [["CHW", 4, "local"], ["CI", 4], ["CI", 3], ["FU", 5, [0, 1]], ["SP", 5, 0, 401408, [28], 1], ["AN", 5, 0, 5], ["AN", 5, 1, 6]]]], "r": [[1.3745e-05, 1.37329e-05, 1.37451e-05], 0, 4.13611, 1668048571], "v": "v0.6"}
{"i": [["[\"layer_normalization_normal\", 1, 56, 56, 128, 1, 0, \"float16\"]", "cuda -keys=cuda,gpu -max_num_threads=1024 -model=unknown -thread_warp_size=32", [-1, 16, 64, 49152, 2147483647, 1024, 8, 32], "", 0, []], [[], [["CHW", 4, "local"], ["CI", 4], ["CI", 3], ["FU", 5, [0, 1]], ["SP", 5, 0, 401408, [7], 1], ["AN", 5, 0, 5], ["AN", 5, 1, 6]]]], "r": [[4.54088e-05, 4.54156e-05, 4.54082e-05], 0, 3.79571, 1668048570], "v": "v0.6"}
{"i": [["[\"layer_normalization_normal\", 1, 56, 56, 128, 1, 0, \"float16\"]", "cuda -keys=cuda,gpu -max_num_threads=1024 -model=unknown -thread_warp_size=32", [-1, 16, 64, 49152, 2147483647, 1024, 8, 32], "", 0, []], [[], [["CHW", 4, "local"], ["CI", 4], ["CI", 3], ["FU", 5, [0, 1]], ["SP", 5, 0, 401408, [2], 1], ["AN", 5, 0, 5], ["AN", 5, 1, 6]]]], "r": [[0.000151772, 0.000151751, 0.000151756], 0, 4.49709, 1668048571], "v": "v0.6"}
