python/models/swin_transformer/kernel_configs/swin_transformer_fused_window_reverse_roll_add_1_7_7_1024_3_7_float16.log
{"i": [["[\"fused_window_reverse_roll_add\", 1, 7, 7, 1024, 3, 7, \"float16\"]", "cuda -keys=cuda,gpu -max_num_threads=1024 -model=unknown -thread_warp_size=32", [-1, 16, 64, 49152, 2147483647, 1024, 8, 32], "", 0, []], [[], [["FU", 2, [0, 1, 2, 3]], ["SP", 2, 0, 50176, [16], 1], ["AN", 2, 0, 5], ["AN", 2, 1, 6]]]], "r": [[5.03807e-06, 5.03811e-06, 5.03873e-06, 5.03787e-06, 5.03831e-06, 5.03872e-06, 5.04086e-06, 5.03531e-06, 5.04934e-06, 5.05978e-06], 0, 3.8228, 1651679194], "v": "v0.6"}
{"i": [["[\"fused_window_reverse_roll_add\", 1, 7, 7, 1024, 3, 7, \"float16\"]", "cuda -keys=cuda,gpu -max_num_threads=1024 -model=unknown -thread_warp_size=32", [-1, 16, 64, 49152, 2147483647, 1024, 8, 32], "", 0, []], [[], [["FU", 2, [0, 1, 2, 3]], ["SP", 2, 0, 50176, [4], 1], ["AN", 2, 0, 5], ["AN", 2, 1, 6]]]], "r": [[1.20522e-05, 1.20508e-05, 1.20514e-05, 1.20513e-05, 1.20512e-05, 1.20515e-05, 1.2052e-05, 1.24916e-05, 1.20767e-05, 1.20474e-05], 0, 5.83586, 1651679196], "v": "v0.6"}
{"i": [["[\"fused_window_reverse_roll_add\", 1, 7, 7, 1024, 3, 7, \"float16\"]", "cuda -keys=cuda,gpu -max_num_threads=1024 -model=unknown -thread_warp_size=32", [-1, 16, 64, 49152, 2147483647, 1024, 8, 32], "", 0, []], [[], [["FU", 2, [0, 1, 2, 3]], ["SP", 2, 0, 50176, [2], 1], ["AN", 2, 0, 5], ["AN", 2, 1, 6]]]], "r": [[2.17653e-05, 2.15767e-05, 2.19081e-05, 2.23155e-05, 2.27158e-05, 2.23818e-05, 2.39641e-05, 2.23258e-05, 2.23719e-05, 2.15662e-05], 0, 11.5098, 1651679202], "v": "v0.6"}
{"i": [["[\"fused_window_reverse_roll_add\", 1, 7, 7, 1024, 3, 7, \"float16\"]", "cuda -keys=cuda,gpu -max_num_threads=1024 -model=unknown -thread_warp_size=32", [-1, 16, 64, 49152, 2147483647, 1024, 8, 32], "", 0, []], [[], [["FU", 2, [0, 1, 2, 3]], ["SP", 2, 0, 50176, [32], 1], ["AN", 2, 0, 5], ["AN", 2, 1, 6]]]], "r": [[3.99885e-06, 3.99868e-06, 3.99901e-06, 3.99889e-06, 3.99872e-06, 3.99902e-06, 3.99901e-06, 3.99895e-06, 3.9993e-06, 3.99896e-06], 0, 25.7449, 1651679216], "v": "v0.6"}
{"i": [["[\"fused_window_reverse_roll_add\", 1, 7, 7, 1024, 3, 7, \"float16\"]", "cuda -keys=cuda,gpu -max_num_threads=1024 -model=unknown -thread_warp_size=32", [-1, 16, 64, 49152, 2147483647, 1024, 8, 32], "", 0, []], [[], [["FU", 2, [0, 1, 2, 3]], ["SP", 2, 0, 50176, [56], 1], ["AN", 2, 0, 5], ["AN", 2, 1, 6]]]], "r": [[3.38077e-06, 3.40593e-06, 3.42218e-06, 3.36136e-06, 3.31105e-06, 3.28368e-06, 3.30853e-06, 3.35182e-06, 3.79612e-06, 4.47864e-06], 0, 9.06588, 1651679199], "v": "v0.6"}
{"i": [["[\"fused_window_reverse_roll_add\", 1, 7, 7, 1024, 3, 7, \"float16\"]", "cuda -keys=cuda,gpu -max_num_threads=1024 -model=unknown -thread_warp_size=32", [-1, 16, 64, 49152, 2147483647, 1024, 8, 32], "", 0, []], [[], [["FU", 2, [0, 1, 2, 3]], ["SP", 2, 0, 50176, [1], 1], ["AN", 2, 0, 5], ["AN", 2, 1, 6]]]], "r": [[4.01855e-05, 4.06235e-05, 4.01872e-05, 4.03691e-05, 4.45611e-05, 4.14791e-05, 4.01794e-05, 4.01872e-05, 4.01797e-05, 4.01812e-05], 0, 24.3275, 1651679215], "v": "v0.6"}
{"i": [["[\"fused_window_reverse_roll_add\", 1, 7, 7, 1024, 3, 7, \"float16\"]", "cuda -keys=cuda,gpu -max_num_threads=1024 -model=unknown -thread_warp_size=32", [-1, 16, 64, 49152, 2147483647, 1024, 8, 32], "", 0, []], [[], [["FU", 2, [0, 1, 2, 3]], ["SP", 2, 0, 50176, [14], 1], ["AN", 2, 0, 5], ["AN", 2, 1, 6]]]], "r": [[9.99517e-06, 5.52748e-06, 5.53129e-06, 5.53099e-06, 5.53115e-06, 5.53211e-06, 5.5304e-06, 5.53038e-06, 5.52999e-06, 5.56856e-06], 0, 21.3956, 1651679212], "v": "v0.6"}
{"i": [["[\"fused_window_reverse_roll_add\", 1, 7, 7, 1024, 3, 7, \"float16\"]", "cuda -keys=cuda,gpu -max_num_threads=1024 -model=unknown -thread_warp_size=32", [-1, 16, 64, 49152, 2147483647, 1024, 8, 32], "", 0, []], [[], [["FU", 2, [0, 1, 2, 3]], ["SP", 2, 0, 50176, [49], 1], ["AN", 2, 0, 5], ["AN", 2, 1, 6]]]], "r": [[4.50529e-06, 4.50592e-06, 4.6514e-06, 4.49204e-06, 4.48954e-06, 4.49825e-06, 4.53644e-06, 4.5126e-06, 4.50866e-06, 4.56828e-06], 0, 17.0891, 1651679207], "v": "v0.6"}
{"i": [["[\"fused_window_reverse_roll_add\", 1, 7, 7, 1024, 3, 7, \"float16\"]", "cuda -keys=cuda,gpu -max_num_threads=1024 -model=unknown -thread_warp_size=32", [-1, 16, 64, 49152, 2147483647, 1024, 8, 32], "", 0, []], [[], [["FU", 2, [0, 1, 2, 3]], ["SP", 2, 0, 50176, [64], 1], ["AN", 2, 0, 5], ["AN", 2, 1, 6]]]], "r": [[3.9506e-06, 3.5696e-06, 3.51564e-06, 3.97948e-06, 4.49973e-06, 3.57063e-06, 3.58374e-06, 3.59952e-06, 3.4829e-06, 3.43493e-06], 0, 14.3146, 1651679205], "v": "v0.6"}
{"i": [["[\"fused_window_reverse_roll_add\", 1, 7, 7, 1024, 3, 7, \"float16\"]", "cuda -keys=cuda,gpu -max_num_threads=1024 -model=unknown -thread_warp_size=32", [-1, 16, 64, 49152, 2147483647, 1024, 8, 32], "", 0, []], [[], [["FU", 2, [0, 1, 2, 3]], ["SP", 2, 0, 50176, [7], 1], ["AN", 2, 0, 5], ["AN", 2, 1, 6]]]], "r": [[8.25476e-06, 8.19543e-06, 8.19531e-06, 8.19547e-06, 8.19496e-06, 8.19525e-06, 8.19499e-06, 8.19306e-06, 8.19466e-06, 8.19681e-06], 0, 19.2558, 1651679210], "v": "v0.6"}
{"i": [["[\"fused_window_reverse_roll_add\", 1, 7, 7, 1024, 3, 7, \"float16\"]", "cuda -keys=cuda,gpu -max_num_threads=1024 -model=unknown -thread_warp_size=32", [-1, 16, 64, 49152, 2147483647, 1024, 8, 32], "", 0, []], [[], [["FU", 2, [0, 1, 2, 3]], ["SP", 2, 0, 50176, [8], 1], ["AN", 2, 0, 5], ["AN", 2, 1, 6]]]], "r": [[7.3739e-06, 7.37489e-06, 7.37337e-06, 7.37428e-06, 7.37703e-06, 7.37348e-06, 7.37308e-06, 7.37335e-06, 7.37368e-06, 7.37348e-06], 0, 8.07543, 1651682574], "v": "v0.6"}
{"i": [["[\"fused_window_reverse_roll_add\", 1, 7, 7, 1024, 3, 7, \"float16\"]", "cuda -keys=cuda,gpu -max_num_threads=1024 -model=unknown -thread_warp_size=32", [-1, 16, 64, 49152, 2147483647, 1024, 8, 32], "", 0, []], [[], [["FU", 2, [0, 1, 2, 3]], ["SP", 2, 0, 50176, [28], 1], ["AN", 2, 0, 5], ["AN", 2, 1, 6]]]], "r": [[4.40149e-06, 4.37037e-06, 4.29187e-06, 4.1007e-06, 4.3744e-06, 4.17651e-06, 4.39561e-06, 4.1226e-06, 4.02373e-06, 4.18756e-06], 0, 5.52015, 1651682572], "v": "v0.6"}
{"i": [["[\"fused_window_reverse_roll_add\", 1, 7, 7, 1024, 3, 7, \"float16\"]", "cuda -keys=cuda,gpu -max_num_threads=1024 -model=unknown -thread_warp_size=32", [-1, 16, 64, 49152, 2147483647, 1024, 8, 32], "", 0, []], [[], [["FU", 2, [0, 1, 2, 3]], ["SP", 2, 0, 50176, [32], 1], ["AN", 2, 0, 5], ["AN", 2, 1, 6]]]], "r": [[3.85504e-06, 3.85477e-06, 3.85622e-06, 3.85757e-06, 3.85637e-06, 3.86881e-06, 3.86159e-06, 3.89115e-06, 3.87942e-06, 4.33972e-06], 0, 18.0889, 1651682584], "v": "v0.6"}
{"i": [["[\"fused_window_reverse_roll_add\", 1, 7, 7, 1024, 3, 7, \"float16\"]", "cuda -keys=cuda,gpu -max_num_threads=1024 -model=unknown -thread_warp_size=32", [-1, 16, 64, 49152, 2147483647, 1024, 8, 32], "", 0, []], [[], [["FU", 2, [0, 1, 2, 3]], ["SP", 2, 0, 50176, [4], 1], ["AN", 2, 0, 5], ["AN", 2, 1, 6]]]], "r": [[1.26275e-05, 1.23387e-05, 1.23393e-05, 1.23413e-05, 1.23367e-05, 1.23364e-05, 1.23358e-05, 1.23365e-05, 1.23376e-05, 1.23517e-05], 0, 14.2675, 1651682580], "v": "v0.6"}
{"i": [["[\"fused_window_reverse_roll_add\", 1, 7, 7, 1024, 3, 7, \"float16\"]", "cuda -keys=cuda,gpu -max_num_threads=1024 -model=unknown -thread_warp_size=32", [-1, 16, 64, 49152, 2147483647, 1024, 8, 32], "", 0, []], [[], [["FU", 2, [0, 1, 2, 3]], ["SP", 2, 0, 50176, [1], 1], ["AN", 2, 0, 5], ["AN", 2, 1, 6]]]], "r": [[4.01617e-05, 4.01841e-05, 4.0162e-05, 4.01628e-05, 4.2658e-05, 4.02475e-05, 4.02491e-05, 4.33525e-05, 4.09734e-05, 4.76842e-05], 0, 20.2772, 1651682587], "v": "v0.6"}
{"i": [["[\"fused_window_reverse_roll_add\", 1, 7, 7, 1024, 3, 7, \"float16\"]", "cuda -keys=cuda,gpu -max_num_threads=1024 -model=unknown -thread_warp_size=32", [-1, 16, 64, 49152, 2147483647, 1024, 8, 32], "", 0, []], [[], [["FU", 2, [0, 1, 2, 3]], ["SP", 2, 0, 50176, [7], 1], ["AN", 2, 0, 5], ["AN", 2, 1, 6]]]], "r": [[7.99489e-06, 7.9944e-06, 7.9944e-06, 7.99477e-06, 8.24461e-06, 8.00594e-06, 7.98493e-06, 8.0089e-06, 7.98977e-06, 8.06101e-06], 0, 27.2249, 1651682594], "v": "v0.6"}
{"i": [["[\"fused_window_reverse_roll_add\", 1, 7, 7, 1024, 3, 7, \"float16\"]", "cuda -keys=cuda,gpu -max_num_threads=1024 -model=unknown -thread_warp_size=32", [-1, 16, 64, 49152, 2147483647, 1024, 8, 32], "", 0, []], [[], [["FU", 2, [0, 1, 2, 3]], ["SP", 2, 0, 50176, [56], 1], ["AN", 2, 0, 5], ["AN", 2, 1, 6]]]], "r": [[3.28126e-06, 3.4447e-06, 3.43888e-06, 3.33648e-06, 3.94126e-06, 3.31714e-06, 3.24014e-06, 3.9243e-06, 3.78934e-06, 3.60191e-06], 0, 23.3305, 1651682590], "v": "v0.6"}
{"i": [["[\"fused_window_reverse_roll_add\", 1, 7, 7, 1024, 3, 7, \"float16\"]", "cuda -keys=cuda,gpu -max_num_threads=1024 -model=unknown -thread_warp_size=32", [-1, 16, 64, 49152, 2147483647, 1024, 8, 32], "", 0, []], [[], [["FU", 2, [0, 1, 2, 3]], ["SP", 2, 0, 50176, [2], 1], ["AN", 2, 0, 5], ["AN", 2, 1, 6]]]], "r": [[2.25273e-05, 2.16438e-05, 2.34671e-05, 2.28773e-05, 3.7997e-05, 2.14742e-05, 2.14733e-05, 2.14751e-05, 2.14755e-05, 2.14745e-05], 0, 3.223, 1651682569], "v": "v0.6"}
{"i": [["[\"fused_window_reverse_roll_add\", 1, 7, 7, 1024, 3, 7, \"float16\"]", "cuda -keys=cuda,gpu -max_num_threads=1024 -model=unknown -thread_warp_size=32", [-1, 16, 64, 49152, 2147483647, 1024, 8, 32], "", 0, []], [[], [["FU", 2, [0, 1, 2, 3]], ["SP", 2, 0, 50176, [64], 1], ["AN", 2, 0, 5], ["AN", 2, 1, 6]]]], "r": [[3.82663e-06, 3.43194e-06, 3.38407e-06, 9.63147e-06, 3.75763e-06, 3.84222e-06, 3.68147e-06, 6.45653e-06, 3.5672e-06, 3.69933e-06], 0, 11.593, 1651682578], "v": "v0.6"}
{"i": [["[\"fused_window_reverse_roll_add\", 1, 7, 7, 1024, 3, 7, \"float16\"]", "cuda -keys=cuda,gpu -max_num_threads=1024 -model=unknown -thread_warp_size=32", [-1, 16, 64, 49152, 2147483647, 1024, 8, 32], "", 0, []], [[], [["FU", 2, [0, 1, 2, 3]], ["SP", 2, 0, 50176, [49], 1], ["AN", 2, 0, 5], ["AN", 2, 1, 6]]]], "r": [[7.11581e-06, 3.95165e-06, 3.60807e-06, 4.16169e-06, 4.3667e-06, 4.78337e-06, 4.94111e-06, 4.33561e-06, 4.32476e-06, 4.36014e-06], 0, 31.9429, 1651682598], "v": "v0.6"}
{"i": [["[\"fused_window_reverse_roll_add\", 1, 7, 7, 1024, 3, 7, \"float16\"]", "cuda -keys=cuda,gpu -max_num_threads=1024 -model=unknown -thread_warp_size=32", [-1, 16, 64, 49152, 2147483647, 1024, 8, 32], "", 0, []], [[], [["FU", 2, [0, 1, 2, 3]], ["SP", 2, 0, 50176, [16], 1], ["AN", 2, 0, 5], ["AN", 2, 1, 6]]]], "r": [[4.99069e-06, 4.99094e-06, 4.99224e-06, 4.99146e-06, 4.99094e-06, 4.99174e-06, 4.99088e-06, 4.99071e-06, 4.99098e-06, 4.99122e-06], 0, 16.2263, 1651682582], "v": "v0.6"}
{"i": [["[\"fused_window_reverse_roll_add\", 1, 7, 7, 1024, 3, 7, \"float16\"]", "cuda -keys=cuda,gpu -max_num_threads=1024 -model=unknown -thread_warp_size=32", [-1, 16, 64, 49152, 2147483647, 1024, 8, 32], "", 0, []], [[], [["FU", 2, [0, 1, 2, 3]], ["SP", 2, 0, 50176, [14], 1], ["AN", 2, 0, 5], ["AN", 2, 1, 6]]]], "r": [[5.49727e-06, 5.49764e-06, 5.49695e-06, 5.49743e-06, 5.49785e-06, 5.49738e-06, 5.49762e-06, 5.49728e-06, 5.49747e-06, 5.49723e-06], 0, 25.4342, 1651682592], "v": "v0.6"}
{"i": [["[\"fused_window_reverse_roll_add\", 1, 7, 7, 1024, 3, 7, \"float16\"]", "cuda -keys=cuda,gpu -max_num_threads=1024 -model=unknown -thread_warp_size=32", [-1, 16, 64, 49152, 2147483647, 1024, 8, 32], "", 0, []], [[], [["FU", 2, [0, 1, 2, 3]], ["SP", 2, 0, 50176, [64], 1], ["AN", 2, 0, 5], ["AN", 2, 1, 6]]]], "r": [[3.36104e-06, 3.35031e-06, 3.35393e-06, 3.36058e-06, 3.34869e-06, 3.37698e-06, 3.34593e-06, 3.42203e-06, 3.36052e-06, 3.363e-06], 0, 15.0043, 1652003341], "v": "v0.6"}
{"i": [["[\"fused_window_reverse_roll_add\", 1, 7, 7, 1024, 3, 7, \"float16\"]", "cuda -keys=cuda,gpu -max_num_threads=1024 -model=unknown -thread_warp_size=32", [-1, 16, 64, 49152, 2147483647, 1024, 8, 32], "", 0, []], [[], [["FU", 2, [0, 1, 2, 3]], ["SP", 2, 0, 50176, [56], 1], ["AN", 2, 0, 5], ["AN", 2, 1, 6]]]], "r": [[3.30448e-06, 3.36251e-06, 3.36763e-06, 3.37192e-06, 3.37717e-06, 3.35594e-06, 3.39428e-06, 3.4522e-06, 3.36417e-06, 3.37317e-06], 0, 5.19494, 1652003331], "v": "v0.6"}
{"i": [["[\"fused_window_reverse_roll_add\", 1, 7, 7, 1024, 3, 7, \"float16\"]", "cuda -keys=cuda,gpu -max_num_threads=1024 -model=unknown -thread_warp_size=32", [-1, 16, 64, 49152, 2147483647, 1024, 8, 32], "", 0, []], [[], [["FU", 2, [0, 1, 2, 3]], ["SP", 2, 0, 50176, [28], 1], ["AN", 2, 0, 5], ["AN", 2, 1, 6]]]], "r": [[3.87108e-06, 3.87111e-06, 3.87132e-06, 3.87092e-06, 3.871e-06, 3.87099e-06, 3.87108e-06, 3.87091e-06, 3.87101e-06, 3.87132e-06], 0, 56.6009, 1652003382], "v": "v0.6"}
{"i": [["[\"fused_window_reverse_roll_add\", 1, 7, 7, 1024, 3, 7, \"float16\"]", "cuda -keys=cuda,gpu -max_num_threads=1024 -model=unknown -thread_warp_size=32", [-1, 16, 64, 49152, 2147483647, 1024, 8, 32], "", 0, []], [[], [["FU", 2, [0, 1, 2, 3]], ["SP", 2, 0, 50176, [7], 1], ["AN", 2, 0, 5], ["AN", 2, 1, 6]]]], "r": [[8.04254e-06, 8.04405e-06, 8.04417e-06, 8.04475e-06, 8.0442e-06, 8.04381e-06, 8.0448e-06, 8.04371e-06, 8.04501e-06, 8.04503e-06], 0, 9.46723, 1652003335], "v": "v0.6"}
{"i": [["[\"fused_window_reverse_roll_add\", 1, 7, 7, 1024, 3, 7, \"float16\"]", "cuda -keys=cuda,gpu -max_num_threads=1024 -model=unknown -thread_warp_size=32", [-1, 16, 64, 49152, 2147483647, 1024, 8, 32], "", 0, []], [[], [["FU", 2, [0, 1, 2, 3]], ["SP", 2, 0, 50176, [1], 1], ["AN", 2, 0, 5], ["AN", 2, 1, 6]]]], "r": [[4.01761e-05, 4.01753e-05, 4.01738e-05, 4.01727e-05, 4.01759e-05, 4.01745e-05, 4.01753e-05, 4.01708e-05, 4.01748e-05, 4.01748e-05], 0, 27.8141, 1652003354], "v": "v0.6"}
{"i": [["[\"fused_window_reverse_roll_add\", 1, 7, 7, 1024, 3, 7, \"float16\"]", "cuda -keys=cuda,gpu -max_num_threads=1024 -model=unknown -thread_warp_size=32", [-1, 16, 64, 49152, 2147483647, 1024, 8, 32], "", 0, []], [[], [["FU", 2, [0, 1, 2, 3]], ["SP", 2, 0, 50176, [8], 1], ["AN", 2, 0, 5], ["AN", 2, 1, 6]]]], "r": [[7.51178e-06, 7.51058e-06, 7.51242e-06, 7.5168e-06, 7.51422e-06, 7.50832e-06, 7.51238e-06, 7.5143e-06, 7.50985e-06, 7.51087e-06], 0, 22.7742, 1652003349], "v": "v0.6"}
{"i": [["[\"fused_window_reverse_roll_add\", 1, 7, 7, 1024, 3, 7, \"float16\"]", "cuda -keys=cuda,gpu -max_num_threads=1024 -model=unknown -thread_warp_size=32", [-1, 16, 64, 49152, 2147483647, 1024, 8, 32], "", 0, []], [[], [["FU", 2, [0, 1, 2, 3]], ["SP", 2, 0, 50176, [32], 1], ["AN", 2, 0, 5], ["AN", 2, 1, 6]]]], "r": [[3.88675e-06, 3.88683e-06, 3.91162e-06, 3.92697e-06, 3.88651e-06, 3.88669e-06, 3.88633e-06, 3.88656e-06, 3.88646e-06, 3.88679e-06], 0, 18.5812, 1652003344], "v": "v0.6"}
{"i": [["[\"fused_window_reverse_roll_add\", 1, 7, 7, 1024, 3, 7, \"float16\"]", "cuda -keys=cuda,gpu -max_num_threads=1024 -model=unknown -thread_warp_size=32", [-1, 16, 64, 49152, 2147483647, 1024, 8, 32], "", 0, []], [[], [["FU", 2, [0, 1, 2, 3]], ["SP", 2, 0, 50176, [16], 1], ["AN", 2, 0, 5], ["AN", 2, 1, 6]]]], "r": [[5.19208e-06, 5.1951e-06, 5.19461e-06, 5.19592e-06, 5.19501e-06, 5.19266e-06, 5.19309e-06, 5.19334e-06, 5.19331e-06, 5.19522e-06], 0, 37.4134, 1652003363], "v": "v0.6"}
{"i": [["[\"fused_window_reverse_roll_add\", 1, 7, 7, 1024, 3, 7, \"float16\"]", "cuda -keys=cuda,gpu -max_num_threads=1024 -model=unknown -thread_warp_size=32", [-1, 16, 64, 49152, 2147483647, 1024, 8, 32], "", 0, []], [[], [["FU", 2, [0, 1, 2, 3]], ["SP", 2, 0, 50176, [49], 1], ["AN", 2, 0, 5], ["AN", 2, 1, 6]]]], "r": [[3.3687e-06, 3.36566e-06, 3.38085e-06, 3.39057e-06, 3.41641e-06, 3.42981e-06, 3.55699e-06, 3.38329e-06, 3.62723e-06, 3.40015e-06], 0, 33.638, 1652003360], "v": "v0.6"}
{"i": [["[\"fused_window_reverse_roll_add\", 1, 7, 7, 1024, 3, 7, \"float16\"]", "cuda -keys=cuda,gpu -max_num_threads=1024 -model=unknown -thread_warp_size=32", [-1, 16, 64, 49152, 2147483647, 1024, 8, 32], "", 0, []], [[], [["FU", 2, [0, 1, 2, 3]], ["SP", 2, 0, 50176, [2], 1], ["AN", 2, 0, 5], ["AN", 2, 1, 6]]]], "r": [[2.14284e-05, 2.14287e-05, 2.14316e-05, 2.14305e-05, 2.14309e-05, 2.14327e-05, 2.14332e-05, 2.14333e-05, 2.143e-05, 2.14314e-05], 0, 42.4394, 1652003368], "v": "v0.6"}
{"i": [["[\"fused_window_reverse_roll_add\", 1, 7, 7, 1024, 3, 7, \"float16\"]", "cuda -keys=cuda,gpu -max_num_threads=1024 -model=unknown -thread_warp_size=32", [-1, 16, 64, 49152, 2147483647, 1024, 8, 32], "", 0, []], [[], [["FU", 2, [0, 1, 2, 3]], ["SP", 2, 0, 50176, [4], 1], ["AN", 2, 0, 5], ["AN", 2, 1, 6]]]], "r": [[1.21611e-05, 1.21604e-05, 1.2159e-05, 1.21591e-05, 1.21597e-05, 1.21597e-05, 1.21607e-05, 1.2159e-05, 1.21575e-05, 1.2159e-05], 0, 50.6298, 1652003377], "v": "v0.6"}
{"i": [["[\"fused_window_reverse_roll_add\", 1, 7, 7, 1024, 3, 7, \"float16\"]", "cuda -keys=cuda,gpu -max_num_threads=1024 -model=unknown -thread_warp_size=32", [-1, 16, 64, 49152, 2147483647, 1024, 8, 32], "", 0, []], [[], [["FU", 2, [0, 1, 2, 3]], ["SP", 2, 0, 50176, [14], 1], ["AN", 2, 0, 5], ["AN", 2, 1, 6]]]], "r": [[5.2422e-06, 5.24237e-06, 5.24244e-06, 5.24324e-06, 5.24311e-06, 5.2426e-06, 5.24225e-06, 5.24191e-06, 5.2424e-06, 5.24222e-06], 0, 46.1159, 1652003372], "v": "v0.6"}
