python/models/swin_transformer/kernel_configs/swin_transformer_attn_v_permute_1_14_14_512_7_16.log
{"i": [["[\"attn_v_permute\", 1, 14, 14, 512, 7, 16]", "cuda -keys=cuda,gpu -max_num_threads=1024 -model=unknown -thread_warp_size=32", [-1, 16, 64, 49152, 2147483647, 1024, 8, 32], "", 0, []], [[], [["FU", 1, [0, 1, 2, 3]], ["SP", 1, 0, 100352, [8], 1], ["AN", 1, 0, 5], ["AN", 1, 1, 6]]]], "r": [[1.19712e-05, 1.19877e-05, 1.19971e-05], 0, 2.07942, 1668053005], "v": "v0.6"}
{"i": [["[\"attn_v_permute\", 1, 14, 14, 512, 7, 16]", "cuda -keys=cuda,gpu -max_num_threads=1024 -model=unknown -thread_warp_size=32", [-1, 16, 64, 49152, 2147483647, 1024, 8, 32], "", 0, []], [[], [["FU", 1, [0, 1, 2, 3]], ["SP", 1, 0, 100352, [1], 1], ["AN", 1, 0, 5], ["AN", 1, 1, 6]]]], "r": [[7.71994e-05, 7.72113e-05, 7.71941e-05], 0, 1.36822, 1668053004], "v": "v0.6"}
{"i": [["[\"attn_v_permute\", 1, 14, 14, 512, 7, 16]", "cuda -keys=cuda,gpu -max_num_threads=1024 -model=unknown -thread_warp_size=32", [-1, 16, 64, 49152, 2147483647, 1024, 8, 32], "", 0, []], [[], [["FU", 1, [0, 1, 2, 3]], ["SP", 1, 0, 100352, [28], 1], ["AN", 1, 0, 5], ["AN", 1, 1, 6]]]], "r": [[5.42035e-06, 5.43222e-06, 5.43293e-06], 0, 0.961276, 1668053004], "v": "v0.6"}
{"i": [["[\"attn_v_permute\", 1, 14, 14, 512, 7, 16]", "cuda -keys=cuda,gpu -max_num_threads=1024 -model=unknown -thread_warp_size=32", [-1, 16, 64, 49152, 2147483647, 1024, 8, 32], "", 0, []], [[], [["FU", 1, [0, 1, 2, 3]], ["SP", 1, 0, 100352, [64], 1], ["AN", 1, 0, 5], ["AN", 1, 1, 6]]]], "r": [[3.74789e-06, 3.75368e-06, 3.7535e-06], 0, 2.83281, 1668053006], "v": "v0.6"}
{"i": [["[\"attn_v_permute\", 1, 14, 14, 512, 7, 16]", "cuda -keys=cuda,gpu -max_num_threads=1024 -model=unknown -thread_warp_size=32", [-1, 16, 64, 49152, 2147483647, 1024, 8, 32], "", 0, []], [[], [["FU", 1, [0, 1, 2, 3]], ["SP", 1, 0, 100352, [32], 1], ["AN", 1, 0, 5], ["AN", 1, 1, 6]]]], "r": [[4.9673e-06, 4.97751e-06, 4.97656e-06], 0, 0.600203, 1668053004], "v": "v0.6"}
{"i": [["[\"attn_v_permute\", 1, 14, 14, 512, 7, 16]", "cuda -keys=cuda,gpu -max_num_threads=1024 -model=unknown -thread_warp_size=32", [-1, 16, 64, 49152, 2147483647, 1024, 8, 32], "", 0, []], [[], [["FU", 1, [0, 1, 2, 3]], ["SP", 1, 0, 100352, [4], 1], ["AN", 1, 0, 5], ["AN", 1, 1, 6]]]], "r": [[2.12983e-05, 2.13077e-05, 2.13052e-05], 0, 2.48474, 1668053006], "v": "v0.6"}
{"i": [["[\"attn_v_permute\", 1, 14, 14, 512, 7, 16]", "cuda -keys=cuda,gpu -max_num_threads=1024 -model=unknown -thread_warp_size=32", [-1, 16, 64, 49152, 2147483647, 1024, 8, 32], "", 0, []], [[], [["FU", 1, [0, 1, 2, 3]], ["SP", 1, 0, 100352, [49], 1], ["AN", 1, 0, 5], ["AN", 1, 1, 6]]]], "r": [[4.00152e-06, 4.0127e-06, 4.0117e-06], 0, 1.72499, 1668053005], "v": "v0.6"}
{"i": [["[\"attn_v_permute\", 1, 14, 14, 512, 7, 16]", "cuda -keys=cuda,gpu -max_num_threads=1024 -model=unknown -thread_warp_size=32", [-1, 16, 64, 49152, 2147483647, 1024, 8, 32], "", 0, []], [[], [["FU", 1, [0, 1, 2, 3]], ["SP", 1, 0, 100352, [2], 1], ["AN", 1, 0, 5], ["AN", 1, 1, 6]]]], "r": [[3.99712e-05, 3.99752e-05, 3.99851e-05], 0, 3.20134, 1668053006], "v": "v0.6"}
{"i": [["[\"attn_v_permute\", 1, 14, 14, 512, 7, 16]", "cuda -keys=cuda,gpu -max_num_threads=1024 -model=unknown -thread_warp_size=32", [-1, 16, 64, 49152, 2147483647, 1024, 8, 32], "", 0, []], [[], [["FU", 1, [0, 1, 2, 3]], ["SP", 1, 0, 100352, [7], 1], ["AN", 1, 0, 5], ["AN", 1, 1, 6]]]], "r": [[1.33678e-05, 1.33811e-05, 1.33794e-05], 0, 3.59249, 1668053007], "v": "v0.6"}
{"i": [["[\"attn_v_permute\", 1, 14, 14, 512, 7, 16]", "cuda -keys=cuda,gpu -max_num_threads=1024 -model=unknown -thread_warp_size=32", [-1, 16, 64, 49152, 2147483647, 1024, 8, 32], "", 0, []], [[], [["FU", 1, [0, 1, 2, 3]], ["SP", 1, 0, 100352, [14], 1], ["AN", 1, 0, 5], ["AN", 1, 1, 6]]]], "r": [[8.12462e-06, 8.11991e-06, 8.12588e-06], 0, 4.29513, 1668053007], "v": "v0.6"}
{"i": [["[\"attn_v_permute\", 1, 14, 14, 512, 7, 16]", "cuda -keys=cuda,gpu -max_num_threads=1024 -model=unknown -thread_warp_size=32", [-1, 16, 64, 49152, 2147483647, 1024, 8, 32], "", 0, []], [[], [["FU", 1, [0, 1, 2, 3]], ["SP", 1, 0, 100352, [56], 1], ["AN", 1, 0, 5], ["AN", 1, 1, 6]]]], "r": [[3.8437e-06, 3.85486e-06, 3.85425e-06], 0, 3.95892, 1668053007], "v": "v0.6"}
{"i": [["[\"attn_v_permute\", 1, 14, 14, 512, 7, 16]", "cuda -keys=cuda,gpu -max_num_threads=1024 -model=unknown -thread_warp_size=32", [-1, 16, 64, 49152, 2147483647, 1024, 8, 32], "", 0, []], [[], [["FU", 1, [0, 1, 2, 3]], ["SP", 1, 0, 100352, [16], 1], ["AN", 1, 0, 5], ["AN", 1, 1, 6]]]], "r": [[7.1706e-06, 7.18016e-06, 7.18393e-06], 0, 4.69091, 1668053008], "v": "v0.6"}
{"i": [["[\"attn_v_permute\", 1, 14, 14, 512, 7, 16]", "cuda -keys=cuda,gpu -max_num_threads=1024 -model=unknown -thread_warp_size=32", [-1, 16, 64, 49152, 2147483647, 1024, 8, 32], "", 0, []], [[], [["FU", 1, [0, 1, 2, 3]], ["SP", 1, 0, 100352, [4], 1], ["AN", 1, 0, 5], ["AN", 1, 1, 6]]]], "r": [[2.13181e-05, 2.13207e-05, 2.1312e-05], 0, 0.929461, 1668054207], "v": "v0.6"}
{"i": [["[\"attn_v_permute\", 1, 14, 14, 512, 7, 16]", "cuda -keys=cuda,gpu -max_num_threads=1024 -model=unknown -thread_warp_size=32", [-1, 16, 64, 49152, 2147483647, 1024, 8, 32], "", 0, []], [[], [["FU", 1, [0, 1, 2, 3]], ["SP", 1, 0, 100352, [64], 1], ["AN", 1, 0, 5], ["AN", 1, 1, 6]]]], "r": [[3.72198e-06, 3.73208e-06, 3.73339e-06], 0, 0.570493, 1668054207], "v": "v0.6"}
{"i": [["[\"attn_v_permute\", 1, 14, 14, 512, 7, 16]", "cuda -keys=cuda,gpu -max_num_threads=1024 -model=unknown -thread_warp_size=32", [-1, 16, 64, 49152, 2147483647, 1024, 8, 32], "", 0, []], [[], [["FU", 1, [0, 1, 2, 3]], ["SP", 1, 0, 100352, [56], 1], ["AN", 1, 0, 5], ["AN", 1, 1, 6]]]], "r": [[3.94423e-06, 3.9605e-06, 3.95733e-06], 0, 1.62162, 1668054208], "v": "v0.6"}
{"i": [["[\"attn_v_permute\", 1, 14, 14, 512, 7, 16]", "cuda -keys=cuda,gpu -max_num_threads=1024 -model=unknown -thread_warp_size=32", [-1, 16, 64, 49152, 2147483647, 1024, 8, 32], "", 0, []], [[], [["FU", 1, [0, 1, 2, 3]], ["SP", 1, 0, 100352, [7], 1], ["AN", 1, 0, 5], ["AN", 1, 1, 6]]]], "r": [[1.33035e-05, 1.3308e-05, 1.33087e-05], 0, 1.30071, 1668054208], "v": "v0.6"}
{"i": [["[\"attn_v_permute\", 1, 14, 14, 512, 7, 16]", "cuda -keys=cuda,gpu -max_num_threads=1024 -model=unknown -thread_warp_size=32", [-1, 16, 64, 49152, 2147483647, 1024, 8, 32], "", 0, []], [[], [["FU", 1, [0, 1, 2, 3]], ["SP", 1, 0, 100352, [28], 1], ["AN", 1, 0, 5], ["AN", 1, 1, 6]]]], "r": [[5.29217e-06, 5.30689e-06, 5.30591e-06], 0, 1.95933, 1668054208], "v": "v0.6"}
{"i": [["[\"attn_v_permute\", 1, 14, 14, 512, 7, 16]", "cuda -keys=cuda,gpu -max_num_threads=1024 -model=unknown -thread_warp_size=32", [-1, 16, 64, 49152, 2147483647, 1024, 8, 32], "", 0, []], [[], [["FU", 1, [0, 1, 2, 3]], ["SP", 1, 0, 100352, [32], 1], ["AN", 1, 0, 5], ["AN", 1, 1, 6]]]], "r": [[4.89284e-06, 4.90392e-06, 4.90309e-06], 0, 3.00193, 1668054209], "v": "v0.6"}
{"i": [["[\"attn_v_permute\", 1, 14, 14, 512, 7, 16]", "cuda -keys=cuda,gpu -max_num_threads=1024 -model=unknown -thread_warp_size=32", [-1, 16, 64, 49152, 2147483647, 1024, 8, 32], "", 0, []], [[], [["FU", 1, [0, 1, 2, 3]], ["SP", 1, 0, 100352, [16], 1], ["AN", 1, 0, 5], ["AN", 1, 1, 6]]]], "r": [[7.22594e-06, 7.246e-06, 7.23625e-06], 0, 2.67392, 1668054209], "v": "v0.6"}
{"i": [["[\"attn_v_permute\", 1, 14, 14, 512, 7, 16]", "cuda -keys=cuda,gpu -max_num_threads=1024 -model=unknown -thread_warp_size=32", [-1, 16, 64, 49152, 2147483647, 1024, 8, 32], "", 0, []], [[], [["FU", 1, [0, 1, 2, 3]], ["SP", 1, 0, 100352, [1], 1], ["AN", 1, 0, 5], ["AN", 1, 1, 6]]]], "r": [[7.73126e-05, 7.73227e-05, 7.73284e-05], 0, 2.32819, 1668054209], "v": "v0.6"}
{"i": [["[\"attn_v_permute\", 1, 14, 14, 512, 7, 16]", "cuda -keys=cuda,gpu -max_num_threads=1024 -model=unknown -thread_warp_size=32", [-1, 16, 64, 49152, 2147483647, 1024, 8, 32], "", 0, []], [[], [["FU", 1, [0, 1, 2, 3]], ["SP", 1, 0, 100352, [2], 1], ["AN", 1, 0, 5], ["AN", 1, 1, 6]]]], "r": [[3.99978e-05, 4.00041e-05, 4.00108e-05], 0, 3.38348, 1668054210], "v": "v0.6"}
{"i": [["[\"attn_v_permute\", 1, 14, 14, 512, 7, 16]", "cuda -keys=cuda,gpu -max_num_threads=1024 -model=unknown -thread_warp_size=32", [-1, 16, 64, 49152, 2147483647, 1024, 8, 32], "", 0, []], [[], [["FU", 1, [0, 1, 2, 3]], ["SP", 1, 0, 100352, [14], 1], ["AN", 1, 0, 5], ["AN", 1, 1, 6]]]], "r": [[7.90715e-06, 7.91691e-06, 7.91432e-06], 0, 3.72271, 1668054210], "v": "v0.6"}
{"i": [["[\"attn_v_permute\", 1, 14, 14, 512, 7, 16]", "cuda -keys=cuda,gpu -max_num_threads=1024 -model=unknown -thread_warp_size=32", [-1, 16, 64, 49152, 2147483647, 1024, 8, 32], "", 0, []], [[], [["FU", 1, [0, 1, 2, 3]], ["SP", 1, 0, 100352, [49], 1], ["AN", 1, 0, 5], ["AN", 1, 1, 6]]]], "r": [[4.10596e-06, 4.12271e-06, 4.12313e-06], 0, 4.05871, 1668054210], "v": "v0.6"}
{"i": [["[\"attn_v_permute\", 1, 14, 14, 512, 7, 16]", "cuda -keys=cuda,gpu -max_num_threads=1024 -model=unknown -thread_warp_size=32", [-1, 16, 64, 49152, 2147483647, 1024, 8, 32], "", 0, []], [[], [["FU", 1, [0, 1, 2, 3]], ["SP", 1, 0, 100352, [8], 1], ["AN", 1, 0, 5], ["AN", 1, 1, 6]]]], "r": [[1.21514e-05, 1.21799e-05, 1.21844e-05], 0, 4.4432, 1668054211], "v": "v0.6"}
{"i": [["[\"attn_v_permute\", 1, 14, 14, 512, 7, 16]", "cuda -keys=cuda,gpu -max_num_threads=1024 -model=unknown -thread_warp_size=32", [-1, 16, 64, 49152, 2147483647, 1024, 8, 32], "", 0, []], [[], [["FU", 1, [0, 1, 2, 3]], ["SP", 1, 0, 100352, [16], 1], ["AN", 1, 0, 5], ["AN", 1, 1, 6]]]], "r": [[7.21945e-06, 7.23619e-06, 7.2331e-06], 0, 1.31008, 1668054642], "v": "v0.6"}
{"i": [["[\"attn_v_permute\", 1, 14, 14, 512, 7, 16]", "cuda -keys=cuda,gpu -max_num_threads=1024 -model=unknown -thread_warp_size=32", [-1, 16, 64, 49152, 2147483647, 1024, 8, 32], "", 0, []], [[], [["FU", 1, [0, 1, 2, 3]], ["SP", 1, 0, 100352, [4], 1], ["AN", 1, 0, 5], ["AN", 1, 1, 6]]]], "r": [[2.14132e-05, 2.14303e-05, 2.14128e-05], 0, 0.582433, 1668054641], "v": "v0.6"}
{"i": [["[\"attn_v_permute\", 1, 14, 14, 512, 7, 16]", "cuda -keys=cuda,gpu -max_num_threads=1024 -model=unknown -thread_warp_size=32", [-1, 16, 64, 49152, 2147483647, 1024, 8, 32], "", 0, []], [[], [["FU", 1, [0, 1, 2, 3]], ["SP", 1, 0, 100352, [56], 1], ["AN", 1, 0, 5], ["AN", 1, 1, 6]]]], "r": [[3.87662e-06, 3.88819e-06, 3.88619e-06], 0, 1.64698, 1668054642], "v": "v0.6"}
{"i": [["[\"attn_v_permute\", 1, 14, 14, 512, 7, 16]", "cuda -keys=cuda,gpu -max_num_threads=1024 -model=unknown -thread_warp_size=32", [-1, 16, 64, 49152, 2147483647, 1024, 8, 32], "", 0, []], [[], [["FU", 1, [0, 1, 2, 3]], ["SP", 1, 0, 100352, [64], 1], ["AN", 1, 0, 5], ["AN", 1, 1, 6]]]], "r": [[3.74331e-06, 3.75834e-06, 3.75602e-06], 0, 0.917702, 1668054642], "v": "v0.6"}
{"i": [["[\"attn_v_permute\", 1, 14, 14, 512, 7, 16]", "cuda -keys=cuda,gpu -max_num_threads=1024 -model=unknown -thread_warp_size=32", [-1, 16, 64, 49152, 2147483647, 1024, 8, 32], "", 0, []], [[], [["FU", 1, [0, 1, 2, 3]], ["SP", 1, 0, 100352, [1], 1], ["AN", 1, 0, 5], ["AN", 1, 1, 6]]]], "r": [[7.71953e-05, 7.72279e-05, 7.72052e-05], 0, 2.68763, 1668054644], "v": "v0.6"}
{"i": [["[\"attn_v_permute\", 1, 14, 14, 512, 7, 16]", "cuda -keys=cuda,gpu -max_num_threads=1024 -model=unknown -thread_warp_size=32", [-1, 16, 64, 49152, 2147483647, 1024, 8, 32], "", 0, []], [[], [["FU", 1, [0, 1, 2, 3]], ["SP", 1, 0, 100352, [28], 1], ["AN", 1, 0, 5], ["AN", 1, 1, 6]]]], "r": [[5.28851e-06, 5.30108e-06, 5.29952e-06], 0, 1.96239, 1668054643], "v": "v0.6"}
{"i": [["[\"attn_v_permute\", 1, 14, 14, 512, 7, 16]", "cuda -keys=cuda,gpu -max_num_threads=1024 -model=unknown -thread_warp_size=32", [-1, 16, 64, 49152, 2147483647, 1024, 8, 32], "", 0, []], [[], [["FU", 1, [0, 1, 2, 3]], ["SP", 1, 0, 100352, [49], 1], ["AN", 1, 0, 5], ["AN", 1, 1, 6]]]], "r": [[4.06007e-06, 4.07119e-06, 4.06687e-06], 0, 3.02324, 1668054644], "v": "v0.6"}
{"i": [["[\"attn_v_permute\", 1, 14, 14, 512, 7, 16]", "cuda -keys=cuda,gpu -max_num_threads=1024 -model=unknown -thread_warp_size=32", [-1, 16, 64, 49152, 2147483647, 1024, 8, 32], "", 0, []], [[], [["FU", 1, [0, 1, 2, 3]], ["SP", 1, 0, 100352, [14], 1], ["AN", 1, 0, 5], ["AN", 1, 1, 6]]]], "r": [[8.15945e-06, 8.1715e-06, 8.16549e-06], 0, 2.33642, 1668054643], "v": "v0.6"}
{"i": [["[\"attn_v_permute\", 1, 14, 14, 512, 7, 16]", "cuda -keys=cuda,gpu -max_num_threads=1024 -model=unknown -thread_warp_size=32", [-1, 16, 64, 49152, 2147483647, 1024, 8, 32], "", 0, []], [[], [["FU", 1, [0, 1, 2, 3]], ["SP", 1, 0, 100352, [32], 1], ["AN", 1, 0, 5], ["AN", 1, 1, 6]]]], "r": [[5.08083e-06, 5.08621e-06, 5.08764e-06], 0, 3.37541, 1668054644], "v": "v0.6"}
{"i": [["[\"attn_v_permute\", 1, 14, 14, 512, 7, 16]", "cuda -keys=cuda,gpu -max_num_threads=1024 -model=unknown -thread_warp_size=32", [-1, 16, 64, 49152, 2147483647, 1024, 8, 32], "", 0, []], [[], [["FU", 1, [0, 1, 2, 3]], ["SP", 1, 0, 100352, [8], 1], ["AN", 1, 0, 5], ["AN", 1, 1, 6]]]], "r": [[1.20334e-05, 1.204e-05, 1.20396e-05], 0, 3.72201, 1668054645], "v": "v0.6"}
{"i": [["[\"attn_v_permute\", 1, 14, 14, 512, 7, 16]", "cuda -keys=cuda,gpu -max_num_threads=1024 -model=unknown -thread_warp_size=32", [-1, 16, 64, 49152, 2147483647, 1024, 8, 32], "", 0, []], [[], [["FU", 1, [0, 1, 2, 3]], ["SP", 1, 0, 100352, [2], 1], ["AN", 1, 0, 5], ["AN", 1, 1, 6]]]], "r": [[3.99218e-05, 3.9934e-05, 3.99291e-05], 0, 4.07626, 1668054645], "v": "v0.6"}
{"i": [["[\"attn_v_permute\", 1, 14, 14, 512, 7, 16]", "cuda -keys=cuda,gpu -max_num_threads=1024 -model=unknown -thread_warp_size=32", [-1, 16, 64, 49152, 2147483647, 1024, 8, 32], "", 0, []], [[], [["FU", 1, [0, 1, 2, 3]], ["SP", 1, 0, 100352, [7], 1], ["AN", 1, 0, 5], ["AN", 1, 1, 6]]]], "r": [[1.33967e-05, 1.34021e-05, 1.34094e-05], 0, 4.46075, 1668054645], "v": "v0.6"}
{"i": [["[\"attn_v_permute\", 1, 14, 14, 512, 7, 16]", "cuda -keys=cuda,gpu -max_num_threads=1024 -model=unknown -thread_warp_size=32", [-1, 16, 64, 49152, 2147483647, 1024, 8, 32], "", 0, []], [[], [["FU", 1, [0, 1, 2, 3]], ["SP", 1, 0, 100352, [56], 1], ["AN", 1, 0, 5], ["AN", 1, 1, 6]]]], "r": [[3.9239e-06, 3.94103e-06, 3.93907e-06], 0, 2.64617, 1668055022], "v": "v0.6"}
{"i": [["[\"attn_v_permute\", 1, 14, 14, 512, 7, 16]", "cuda -keys=cuda,gpu -max_num_threads=1024 -model=unknown -thread_warp_size=32", [-1, 16, 64, 49152, 2147483647, 1024, 8, 32], "", 0, []], [[], [["FU", 1, [0, 1, 2, 3]], ["SP", 1, 0, 100352, [1], 1], ["AN", 1, 0, 5], ["AN", 1, 1, 6]]]], "r": [[7.72262e-05, 7.7244e-05, 7.72259e-05], 0, 1.6166, 1668055021], "v": "v0.6"}
{"i": [["[\"attn_v_permute\", 1, 14, 14, 512, 7, 16]", "cuda -keys=cuda,gpu -max_num_threads=1024 -model=unknown -thread_warp_size=32", [-1, 16, 64, 49152, 2147483647, 1024, 8, 32], "", 0, []], [[], [["FU", 1, [0, 1, 2, 3]], ["SP", 1, 0, 100352, [2], 1], ["AN", 1, 0, 5], ["AN", 1, 1, 6]]]], "r": [[3.99374e-05, 3.99492e-05, 3.99215e-05], 0, 0.588446, 1668055020], "v": "v0.6"}
{"i": [["[\"attn_v_permute\", 1, 14, 14, 512, 7, 16]", "cuda -keys=cuda,gpu -max_num_threads=1024 -model=unknown -thread_warp_size=32", [-1, 16, 64, 49152, 2147483647, 1024, 8, 32], "", 0, []], [[], [["FU", 1, [0, 1, 2, 3]], ["SP", 1, 0, 100352, [32], 1], ["AN", 1, 0, 5], ["AN", 1, 1, 6]]]], "r": [[5.13719e-06, 5.14792e-06, 5.14822e-06], 0, 1.28161, 1668055021], "v": "v0.6"}
{"i": [["[\"attn_v_permute\", 1, 14, 14, 512, 7, 16]", "cuda -keys=cuda,gpu -max_num_threads=1024 -model=unknown -thread_warp_size=32", [-1, 16, 64, 49152, 2147483647, 1024, 8, 32], "", 0, []], [[], [["FU", 1, [0, 1, 2, 3]], ["SP", 1, 0, 100352, [64], 1], ["AN", 1, 0, 5], ["AN", 1, 1, 6]]]], "r": [[3.91562e-06, 3.92936e-06, 3.93064e-06], 0, 0.927329, 1668055021], "v": "v0.6"}
{"i": [["[\"attn_v_permute\", 1, 14, 14, 512, 7, 16]", "cuda -keys=cuda,gpu -max_num_threads=1024 -model=unknown -thread_warp_size=32", [-1, 16, 64, 49152, 2147483647, 1024, 8, 32], "", 0, []], [[], [["FU", 1, [0, 1, 2, 3]], ["SP", 1, 0, 100352, [7], 1], ["AN", 1, 0, 5], ["AN", 1, 1, 6]]]], "r": [[1.34492e-05, 1.34591e-05, 1.3457e-05], 0, 1.95912, 1668055022], "v": "v0.6"}
{"i": [["[\"attn_v_permute\", 1, 14, 14, 512, 7, 16]", "cuda -keys=cuda,gpu -max_num_threads=1024 -model=unknown -thread_warp_size=32", [-1, 16, 64, 49152, 2147483647, 1024, 8, 32], "", 0, []], [[], [["FU", 1, [0, 1, 2, 3]], ["SP", 1, 0, 100352, [16], 1], ["AN", 1, 0, 5], ["AN", 1, 1, 6]]]], "r": [[7.40271e-06, 7.41547e-06, 7.41681e-06], 0, 2.32462, 1668055022], "v": "v0.6"}
{"i": [["[\"attn_v_permute\", 1, 14, 14, 512, 7, 16]", "cuda -keys=cuda,gpu -max_num_threads=1024 -model=unknown -thread_warp_size=32", [-1, 16, 64, 49152, 2147483647, 1024, 8, 32], "", 0, []], [[], [["FU", 1, [0, 1, 2, 3]], ["SP", 1, 0, 100352, [8], 1], ["AN", 1, 0, 5], ["AN", 1, 1, 6]]]], "r": [[1.21579e-05, 1.21497e-05, 1.21601e-05], 0, 4.44862, 1668055024], "v": "v0.6"}
{"i": [["[\"attn_v_permute\", 1, 14, 14, 512, 7, 16]", "cuda -keys=cuda,gpu -max_num_threads=1024 -model=unknown -thread_warp_size=32", [-1, 16, 64, 49152, 2147483647, 1024, 8, 32], "", 0, []], [[], [["FU", 1, [0, 1, 2, 3]], ["SP", 1, 0, 100352, [28], 1], ["AN", 1, 0, 5], ["AN", 1, 1, 6]]]], "r": [[5.22432e-06, 5.23297e-06, 5.23389e-06], 0, 3.70925, 1668055023], "v": "v0.6"}
{"i": [["[\"attn_v_permute\", 1, 14, 14, 512, 7, 16]", "cuda -keys=cuda,gpu -max_num_threads=1024 -model=unknown -thread_warp_size=32", [-1, 16, 64, 49152, 2147483647, 1024, 8, 32], "", 0, []], [[], [["FU", 1, [0, 1, 2, 3]], ["SP", 1, 0, 100352, [14], 1], ["AN", 1, 0, 5], ["AN", 1, 1, 6]]]], "r": [[8.04256e-06, 8.04725e-06, 8.03667e-06], 0, 3.3635, 1668055023], "v": "v0.6"}
{"i": [["[\"attn_v_permute\", 1, 14, 14, 512, 7, 16]", "cuda -keys=cuda,gpu -max_num_threads=1024 -model=unknown -thread_warp_size=32", [-1, 16, 64, 49152, 2147483647, 1024, 8, 32], "", 0, []], [[], [["FU", 1, [0, 1, 2, 3]], ["SP", 1, 0, 100352, [49], 1], ["AN", 1, 0, 5], ["AN", 1, 1, 6]]]], "r": [[4.14132e-06, 4.15878e-06, 4.15715e-06], 0, 2.96676, 1668055023], "v": "v0.6"}
{"i": [["[\"attn_v_permute\", 1, 14, 14, 512, 7, 16]", "cuda -keys=cuda,gpu -max_num_threads=1024 -model=unknown -thread_warp_size=32", [-1, 16, 64, 49152, 2147483647, 1024, 8, 32], "", 0, []], [[], [["FU", 1, [0, 1, 2, 3]], ["SP", 1, 0, 100352, [4], 1], ["AN", 1, 0, 5], ["AN", 1, 1, 6]]]], "r": [[2.13586e-05, 2.13709e-05, 2.13724e-05], 0, 4.04765, 1668055024], "v": "v0.6"}
{"i": [["[\"attn_v_permute\", 1, 14, 14, 512, 7, 16]", "cuda -keys=cuda,gpu -max_num_threads=1024 -model=unknown -thread_warp_size=32", [-1, 16, 64, 49152, 2147483647, 1024, 8, 32], "", 0, []], [[], [["FU", 1, [0, 1, 2, 3]], ["SP", 1, 0, 100352, [1], 1], ["AN", 1, 0, 5], ["AN", 1, 1, 6]]]], "r": [[7.72249e-05, 7.72328e-05, 7.723e-05], 0, 1.96162, 1668055305], "v": "v0.6"}
{"i": [["[\"attn_v_permute\", 1, 14, 14, 512, 7, 16]", "cuda -keys=cuda,gpu -max_num_threads=1024 -model=unknown -thread_warp_size=32", [-1, 16, 64, 49152, 2147483647, 1024, 8, 32], "", 0, []], [[], [["FU", 1, [0, 1, 2, 3]], ["SP", 1, 0, 100352, [16], 1], ["AN", 1, 0, 5], ["AN", 1, 1, 6]]]], "r": [[7.19069e-06, 7.20406e-06, 7.20179e-06], 0, 2.34049, 1668055305], "v": "v0.6"}
{"i": [["[\"attn_v_permute\", 1, 14, 14, 512, 7, 16]", "cuda -keys=cuda,gpu -max_num_threads=1024 -model=unknown -thread_warp_size=32", [-1, 16, 64, 49152, 2147483647, 1024, 8, 32], "", 0, []], [[], [["FU", 1, [0, 1, 2, 3]], ["SP", 1, 0, 100352, [7], 1], ["AN", 1, 0, 5], ["AN", 1, 1, 6]]]], "r": [[1.32982e-05, 1.33125e-05, 1.33057e-05], 0, 0.909846, 1668055304], "v": "v0.6"}
{"i": [["[\"attn_v_permute\", 1, 14, 14, 512, 7, 16]", "cuda -keys=cuda,gpu -max_num_threads=1024 -model=unknown -thread_warp_size=32", [-1, 16, 64, 49152, 2147483647, 1024, 8, 32], "", 0, []], [[], [["FU", 1, [0, 1, 2, 3]], ["SP", 1, 0, 100352, [2], 1], ["AN", 1, 0, 5], ["AN", 1, 1, 6]]]], "r": [[3.99089e-05, 3.99145e-05, 3.99138e-05], 0, 1.30533, 1668055304], "v": "v0.6"}
{"i": [["[\"attn_v_permute\", 1, 14, 14, 512, 7, 16]", "cuda -keys=cuda,gpu -max_num_threads=1024 -model=unknown -thread_warp_size=32", [-1, 16, 64, 49152, 2147483647, 1024, 8, 32], "", 0, []], [[], [["FU", 1, [0, 1, 2, 3]], ["SP", 1, 0, 100352, [28], 1], ["AN", 1, 0, 5], ["AN", 1, 1, 6]]]], "r": [[5.3853e-06, 5.38656e-06, 5.38681e-06], 0, 0.578186, 1668055303], "v": "v0.6"}
{"i": [["[\"attn_v_permute\", 1, 14, 14, 512, 7, 16]", "cuda -keys=cuda,gpu -max_num_threads=1024 -model=unknown -thread_warp_size=32", [-1, 16, 64, 49152, 2147483647, 1024, 8, 32], "", 0, []], [[], [["FU", 1, [0, 1, 2, 3]], ["SP", 1, 0, 100352, [4], 1], ["AN", 1, 0, 5], ["AN", 1, 1, 6]]]], "r": [[2.1386e-05, 2.13975e-05, 2.14041e-05], 0, 1.62199, 1668055304], "v": "v0.6"}
{"i": [["[\"attn_v_permute\", 1, 14, 14, 512, 7, 16]", "cuda -keys=cuda,gpu -max_num_threads=1024 -model=unknown -thread_warp_size=32", [-1, 16, 64, 49152, 2147483647, 1024, 8, 32], "", 0, []], [[], [["FU", 1, [0, 1, 2, 3]], ["SP", 1, 0, 100352, [64], 1], ["AN", 1, 0, 5], ["AN", 1, 1, 6]]]], "r": [[3.85836e-06, 3.8866e-06, 3.88165e-06], 0, 2.68277, 1668055305], "v": "v0.6"}
{"i": [["[\"attn_v_permute\", 1, 14, 14, 512, 7, 16]", "cuda -keys=cuda,gpu -max_num_threads=1024 -model=unknown -thread_warp_size=32", [-1, 16, 64, 49152, 2147483647, 1024, 8, 32], "", 0, []], [[], [["FU", 1, [0, 1, 2, 3]], ["SP", 1, 0, 100352, [14], 1], ["AN", 1, 0, 5], ["AN", 1, 1, 6]]]], "r": [[8.17771e-06, 8.19003e-06, 8.19466e-06], 0, 3.72678, 1668055306], "v": "v0.6"}
{"i": [["[\"attn_v_permute\", 1, 14, 14, 512, 7, 16]", "cuda -keys=cuda,gpu -max_num_threads=1024 -model=unknown -thread_warp_size=32", [-1, 16, 64, 49152, 2147483647, 1024, 8, 32], "", 0, []], [[], [["FU", 1, [0, 1, 2, 3]], ["SP", 1, 0, 100352, [32], 1], ["AN", 1, 0, 5], ["AN", 1, 1, 6]]]], "r": [[4.86905e-06, 4.88496e-06, 4.87851e-06], 0, 3.00082, 1668055306], "v": "v0.6"}
{"i": [["[\"attn_v_permute\", 1, 14, 14, 512, 7, 16]", "cuda -keys=cuda,gpu -max_num_threads=1024 -model=unknown -thread_warp_size=32", [-1, 16, 64, 49152, 2147483647, 1024, 8, 32], "", 0, []], [[], [["FU", 1, [0, 1, 2, 3]], ["SP", 1, 0, 100352, [8], 1], ["AN", 1, 0, 5], ["AN", 1, 1, 6]]]], "r": [[1.20567e-05, 1.20672e-05, 1.20646e-05], 0, 4.45613, 1668055307], "v": "v0.6"}
{"i": [["[\"attn_v_permute\", 1, 14, 14, 512, 7, 16]", "cuda -keys=cuda,gpu -max_num_threads=1024 -model=unknown -thread_warp_size=32", [-1, 16, 64, 49152, 2147483647, 1024, 8, 32], "", 0, []], [[], [["FU", 1, [0, 1, 2, 3]], ["SP", 1, 0, 100352, [56], 1], ["AN", 1, 0, 5], ["AN", 1, 1, 6]]]], "r": [[3.82809e-06, 3.8342e-06, 3.83349e-06], 0, 4.06674, 1668055307], "v": "v0.6"}
{"i": [["[\"attn_v_permute\", 1, 14, 14, 512, 7, 16]", "cuda -keys=cuda,gpu -max_num_threads=1024 -model=unknown -thread_warp_size=32", [-1, 16, 64, 49152, 2147483647, 1024, 8, 32], "", 0, []], [[], [["FU", 1, [0, 1, 2, 3]], ["SP", 1, 0, 100352, [49], 1], ["AN", 1, 0, 5], ["AN", 1, 1, 6]]]], "r": [[4.21748e-06, 4.23976e-06, 4.23861e-06], 0, 3.38504, 1668055306], "v": "v0.6"}
{"i": [["[\"attn_v_permute\", 1, 14, 14, 512, 7, 16]", "cuda -keys=cuda,gpu -max_num_threads=1024 -model=unknown -thread_warp_size=32", [-1, 16, 64, 49152, 2147483647, 1024, 8, 32], "", 0, []], [[], [["FU", 1, [0, 1, 2, 3]], ["SP", 1, 0, 100352, [2], 1], ["AN", 1, 0, 5], ["AN", 1, 1, 6]]]], "r": [[3.99749e-05, 3.99669e-05, 3.99696e-05], 0, 1.95645, 1668055588], "v": "v0.6"}
{"i": [["[\"attn_v_permute\", 1, 14, 14, 512, 7, 16]", "cuda -keys=cuda,gpu -max_num_threads=1024 -model=unknown -thread_warp_size=32", [-1, 16, 64, 49152, 2147483647, 1024, 8, 32], "", 0, []], [[], [["FU", 1, [0, 1, 2, 3]], ["SP", 1, 0, 100352, [7], 1], ["AN", 1, 0, 5], ["AN", 1, 1, 6]]]], "r": [[1.34427e-05, 1.34552e-05, 1.34496e-05], 0, 1.61198, 1668055587], "v": "v0.6"}
{"i": [["[\"attn_v_permute\", 1, 14, 14, 512, 7, 16]", "cuda -keys=cuda,gpu -max_num_threads=1024 -model=unknown -thread_warp_size=32", [-1, 16, 64, 49152, 2147483647, 1024, 8, 32], "", 0, []], [[], [["FU", 1, [0, 1, 2, 3]], ["SP", 1, 0, 100352, [64], 1], ["AN", 1, 0, 5], ["AN", 1, 1, 6]]]], "r": [[3.6992e-06, 3.71772e-06, 3.70807e-06], 0, 0.581174, 1668055586], "v": "v0.6"}
{"i": [["[\"attn_v_permute\", 1, 14, 14, 512, 7, 16]", "cuda -keys=cuda,gpu -max_num_threads=1024 -model=unknown -thread_warp_size=32", [-1, 16, 64, 49152, 2147483647, 1024, 8, 32], "", 0, []], [[], [["FU", 1, [0, 1, 2, 3]], ["SP", 1, 0, 100352, [8], 1], ["AN", 1, 0, 5], ["AN", 1, 1, 6]]]], "r": [[1.20632e-05, 1.20805e-05, 1.20792e-05], 0, 0.897172, 1668055587], "v": "v0.6"}
{"i": [["[\"attn_v_permute\", 1, 14, 14, 512, 7, 16]", "cuda -keys=cuda,gpu -max_num_threads=1024 -model=unknown -thread_warp_size=32", [-1, 16, 64, 49152, 2147483647, 1024, 8, 32], "", 0, []], [[], [["FU", 1, [0, 1, 2, 3]], ["SP", 1, 0, 100352, [4], 1], ["AN", 1, 0, 5], ["AN", 1, 1, 6]]]], "r": [[2.13769e-05, 2.13869e-05, 2.13928e-05], 0, 1.28907, 1668055587], "v": "v0.6"}
{"i": [["[\"attn_v_permute\", 1, 14, 14, 512, 7, 16]", "cuda -keys=cuda,gpu -max_num_threads=1024 -model=unknown -thread_warp_size=32", [-1, 16, 64, 49152, 2147483647, 1024, 8, 32], "", 0, []], [[], [["FU", 1, [0, 1, 2, 3]], ["SP", 1, 0, 100352, [28], 1], ["AN", 1, 0, 5], ["AN", 1, 1, 6]]]], "r": [[5.29367e-06, 5.3157e-06, 5.32047e-06], 0, 2.32519, 1668055588], "v": "v0.6"}
{"i": [["[\"attn_v_permute\", 1, 14, 14, 512, 7, 16]", "cuda -keys=cuda,gpu -max_num_threads=1024 -model=unknown -thread_warp_size=32", [-1, 16, 64, 49152, 2147483647, 1024, 8, 32], "", 0, []], [[], [["FU", 1, [0, 1, 2, 3]], ["SP", 1, 0, 100352, [14], 1], ["AN", 1, 0, 5], ["AN", 1, 1, 6]]]], "r": [[8.03036e-06, 8.04687e-06, 8.03876e-06], 0, 2.66133, 1668055588], "v": "v0.6"}
{"i": [["[\"attn_v_permute\", 1, 14, 14, 512, 7, 16]", "cuda -keys=cuda,gpu -max_num_threads=1024 -model=unknown -thread_warp_size=32", [-1, 16, 64, 49152, 2147483647, 1024, 8, 32], "", 0, []], [[], [["FU", 1, [0, 1, 2, 3]], ["SP", 1, 0, 100352, [1], 1], ["AN", 1, 0, 5], ["AN", 1, 1, 6]]]], "r": [[7.72152e-05, 7.72223e-05, 7.72233e-05], 0, 3.71711, 1668055589], "v": "v0.6"}
{"i": [["[\"attn_v_permute\", 1, 14, 14, 512, 7, 16]", "cuda -keys=cuda,gpu -max_num_threads=1024 -model=unknown -thread_warp_size=32", [-1, 16, 64, 49152, 2147483647, 1024, 8, 32], "", 0, []], [[], [["FU", 1, [0, 1, 2, 3]], ["SP", 1, 0, 100352, [32], 1], ["AN", 1, 0, 5], ["AN", 1, 1, 6]]]], "r": [[5.007e-06, 5.02546e-06, 5.02866e-06], 0, 2.99666, 1668055589], "v": "v0.6"}
{"i": [["[\"attn_v_permute\", 1, 14, 14, 512, 7, 16]", "cuda -keys=cuda,gpu -max_num_threads=1024 -model=unknown -thread_warp_size=32", [-1, 16, 64, 49152, 2147483647, 1024, 8, 32], "", 0, []], [[], [["FU", 1, [0, 1, 2, 3]], ["SP", 1, 0, 100352, [16], 1], ["AN", 1, 0, 5], ["AN", 1, 1, 6]]]], "r": [[7.26165e-06, 7.27543e-06, 7.27583e-06], 0, 4.03102, 1668055590], "v": "v0.6"}
{"i": [["[\"attn_v_permute\", 1, 14, 14, 512, 7, 16]", "cuda -keys=cuda,gpu -max_num_threads=1024 -model=unknown -thread_warp_size=32", [-1, 16, 64, 49152, 2147483647, 1024, 8, 32], "", 0, []], [[], [["FU", 1, [0, 1, 2, 3]], ["SP", 1, 0, 100352, [56], 1], ["AN", 1, 0, 5], ["AN", 1, 1, 6]]]], "r": [[3.90755e-06, 3.92622e-06, 3.93083e-06], 0, 3.3712, 1668055589], "v": "v0.6"}
{"i": [["[\"attn_v_permute\", 1, 14, 14, 512, 7, 16]", "cuda -keys=cuda,gpu -max_num_threads=1024 -model=unknown -thread_warp_size=32", [-1, 16, 64, 49152, 2147483647, 1024, 8, 32], "", 0, []], [[], [["FU", 1, [0, 1, 2, 3]], ["SP", 1, 0, 100352, [49], 1], ["AN", 1, 0, 5], ["AN", 1, 1, 6]]]], "r": [[4.10166e-06, 4.11185e-06, 4.11257e-06], 0, 4.41327, 1668055590], "v": "v0.6"}
{"i": [["[\"attn_v_permute\", 1, 14, 14, 512, 7, 16]", "cuda -keys=cuda,gpu -max_num_threads=1024 -model=unknown -thread_warp_size=32", [-1, 16, 64, 49152, 2147483647, 1024, 8, 32], "", 0, []], [[], [["FU", 1, [0, 1, 2, 3]], ["SP", 1, 0, 100352, [8], 1], ["AN", 1, 0, 5], ["AN", 1, 1, 6]]]], "r": [[1.2024e-05, 1.20343e-05, 1.2036e-05], 0, 0.582929, 1668055871], "v": "v0.6"}
{"i": [["[\"attn_v_permute\", 1, 14, 14, 512, 7, 16]", "cuda -keys=cuda,gpu -max_num_threads=1024 -model=unknown -thread_warp_size=32", [-1, 16, 64, 49152, 2147483647, 1024, 8, 32], "", 0, []], [[], [["FU", 1, [0, 1, 2, 3]], ["SP", 1, 0, 100352, [49], 1], ["AN", 1, 0, 5], ["AN", 1, 1, 6]]]], "r": [[4.02783e-06, 4.03336e-06, 4.04049e-06], 0, 0.901795, 1668055871], "v": "v0.6"}
{"i": [["[\"attn_v_permute\", 1, 14, 14, 512, 7, 16]", "cuda -keys=cuda,gpu -max_num_threads=1024 -model=unknown -thread_warp_size=32", [-1, 16, 64, 49152, 2147483647, 1024, 8, 32], "", 0, []], [[], [["FU", 1, [0, 1, 2, 3]], ["SP", 1, 0, 100352, [4], 1], ["AN", 1, 0, 5], ["AN", 1, 1, 6]]]], "r": [[2.15512e-05, 2.15604e-05, 2.15622e-05], 0, 1.63999, 1668055872], "v": "v0.6"}
{"i": [["[\"attn_v_permute\", 1, 14, 14, 512, 7, 16]", "cuda -keys=cuda,gpu -max_num_threads=1024 -model=unknown -thread_warp_size=32", [-1, 16, 64, 49152, 2147483647, 1024, 8, 32], "", 0, []], [[], [["FU", 1, [0, 1, 2, 3]], ["SP", 1, 0, 100352, [1], 1], ["AN", 1, 0, 5], ["AN", 1, 1, 6]]]], "r": [[7.72255e-05, 7.72539e-05, 7.72578e-05], 0, 1.2898, 1668055871], "v": "v0.6"}
{"i": [["[\"attn_v_permute\", 1, 14, 14, 512, 7, 16]", "cuda -keys=cuda,gpu -max_num_threads=1024 -model=unknown -thread_warp_size=32", [-1, 16, 64, 49152, 2147483647, 1024, 8, 32], "", 0, []], [[], [["FU", 1, [0, 1, 2, 3]], ["SP", 1, 0, 100352, [16], 1], ["AN", 1, 0, 5], ["AN", 1, 1, 6]]]], "r": [[7.23238e-06, 7.24719e-06, 7.24586e-06], 0, 2.01363, 1668055872], "v": "v0.6"}
{"i": [["[\"attn_v_permute\", 1, 14, 14, 512, 7, 16]", "cuda -keys=cuda,gpu -max_num_threads=1024 -model=unknown -thread_warp_size=32", [-1, 16, 64, 49152, 2147483647, 1024, 8, 32], "", 0, []], [[], [["FU", 1, [0, 1, 2, 3]], ["SP", 1, 0, 100352, [56], 1], ["AN", 1, 0, 5], ["AN", 1, 1, 6]]]], "r": [[3.86543e-06, 3.87994e-06, 3.87921e-06], 0, 2.36504, 1668055873], "v": "v0.6"}
{"i": [["[\"attn_v_permute\", 1, 14, 14, 512, 7, 16]", "cuda -keys=cuda,gpu -max_num_threads=1024 -model=unknown -thread_warp_size=32", [-1, 16, 64, 49152, 2147483647, 1024, 8, 32], "", 0, []], [[], [["FU", 1, [0, 1, 2, 3]], ["SP", 1, 0, 100352, [7], 1], ["AN", 1, 0, 5], ["AN", 1, 1, 6]]]], "r": [[1.34518e-05, 1.34616e-05, 1.34669e-05], 0, 2.71531, 1668055873], "v": "v0.6"}
{"i": [["[\"attn_v_permute\", 1, 14, 14, 512, 7, 16]", "cuda -keys=cuda,gpu -max_num_threads=1024 -model=unknown -thread_warp_size=32", [-1, 16, 64, 49152, 2147483647, 1024, 8, 32], "", 0, []], [[], [["FU", 1, [0, 1, 2, 3]], ["SP", 1, 0, 100352, [14], 1], ["AN", 1, 0, 5], ["AN", 1, 1, 6]]]], "r": [[7.98769e-06, 7.99932e-06, 8.00185e-06], 0, 3.06193, 1668055873], "v": "v0.6"}
{"i": [["[\"attn_v_permute\", 1, 14, 14, 512, 7, 16]", "cuda -keys=cuda,gpu -max_num_threads=1024 -model=unknown -thread_warp_size=32", [-1, 16, 64, 49152, 2147483647, 1024, 8, 32], "", 0, []], [[], [["FU", 1, [0, 1, 2, 3]], ["SP", 1, 0, 100352, [32], 1], ["AN", 1, 0, 5], ["AN", 1, 1, 6]]]], "r": [[5.1322e-06, 5.14687e-06, 5.14501e-06], 0, 3.41619, 1668055874], "v": "v0.6"}
{"i": [["[\"attn_v_permute\", 1, 14, 14, 512, 7, 16]", "cuda -keys=cuda,gpu -max_num_threads=1024 -model=unknown -thread_warp_size=32", [-1, 16, 64, 49152, 2147483647, 1024, 8, 32], "", 0, []], [[], [["FU", 1, [0, 1, 2, 3]], ["SP", 1, 0, 100352, [64], 1], ["AN", 1, 0, 5], ["AN", 1, 1, 6]]]], "r": [[3.70302e-06, 3.71721e-06, 3.71941e-06], 0, 4.10691, 1668055874], "v": "v0.6"}
{"i": [["[\"attn_v_permute\", 1, 14, 14, 512, 7, 16]", "cuda -keys=cuda,gpu -max_num_threads=1024 -model=unknown -thread_warp_size=32", [-1, 16, 64, 49152, 2147483647, 1024, 8, 32], "", 0, []], [[], [["FU", 1, [0, 1, 2, 3]], ["SP", 1, 0, 100352, [2], 1], ["AN", 1, 0, 5], ["AN", 1, 1, 6]]]], "r": [[4.00132e-05, 4.00134e-05, 4.00147e-05], 0, 3.76713, 1668055874], "v": "v0.6"}
{"i": [["[\"attn_v_permute\", 1, 14, 14, 512, 7, 16]", "cuda -keys=cuda,gpu -max_num_threads=1024 -model=unknown -thread_warp_size=32", [-1, 16, 64, 49152, 2147483647, 1024, 8, 32], "", 0, []], [[], [["FU", 1, [0, 1, 2, 3]], ["SP", 1, 0, 100352, [28], 1], ["AN", 1, 0, 5], ["AN", 1, 1, 6]]]], "r": [[5.27916e-06, 5.28807e-06, 5.28682e-06], 0, 4.5036, 1668055875], "v": "v0.6"}
{"i": [["[\"attn_v_permute\", 1, 14, 14, 512, 7, 16]", "cuda -keys=cuda,gpu -max_num_threads=1024 -model=unknown -thread_warp_size=32", [-1, 16, 64, 49152, 2147483647, 1024, 8, 32], "", 0, []], [[], [["FU", 1, [0, 1, 2, 3]], ["SP", 1, 0, 100352, [16], 1], ["AN", 1, 0, 5], ["AN", 1, 1, 6]]]], "r": [[7.33872e-06, 7.35165e-06, 7.35035e-06], 0, 1.30546, 1668056155], "v": "v0.6"}
{"i": [["[\"attn_v_permute\", 1, 14, 14, 512, 7, 16]", "cuda -keys=cuda,gpu -max_num_threads=1024 -model=unknown -thread_warp_size=32", [-1, 16, 64, 49152, 2147483647, 1024, 8, 32], "", 0, []], [[], [["FU", 1, [0, 1, 2, 3]], ["SP", 1, 0, 100352, [8], 1], ["AN", 1, 0, 5], ["AN", 1, 1, 6]]]], "r": [[1.20712e-05, 1.20808e-05, 1.20847e-05], 0, 1.97507, 1668056155], "v": "v0.6"}
{"i": [["[\"attn_v_permute\", 1, 14, 14, 512, 7, 16]", "cuda -keys=cuda,gpu -max_num_threads=1024 -model=unknown -thread_warp_size=32", [-1, 16, 64, 49152, 2147483647, 1024, 8, 32], "", 0, []], [[], [["FU", 1, [0, 1, 2, 3]], ["SP", 1, 0, 100352, [1], 1], ["AN", 1, 0, 5], ["AN", 1, 1, 6]]]], "r": [[7.73094e-05, 7.73545e-05, 7.73562e-05], 0, 3.04966, 1668056157], "v": "v0.6"}
{"i": [["[\"attn_v_permute\", 1, 14, 14, 512, 7, 16]", "cuda -keys=cuda,gpu -max_num_threads=1024 -model=unknown -thread_warp_size=32", [-1, 16, 64, 49152, 2147483647, 1024, 8, 32], "", 0, []], [[], [["FU", 1, [0, 1, 2, 3]], ["SP", 1, 0, 100352, [28], 1], ["AN", 1, 0, 5], ["AN", 1, 1, 6]]]], "r": [[5.29276e-06, 5.31394e-06, 5.3065e-06], 0, 0.579582, 1668056154], "v": "v0.6"}
{"i": [["[\"attn_v_permute\", 1, 14, 14, 512, 7, 16]", "cuda -keys=cuda,gpu -max_num_threads=1024 -model=unknown -thread_warp_size=32", [-1, 16, 64, 49152, 2147483647, 1024, 8, 32], "", 0, []], [[], [["FU", 1, [0, 1, 2, 3]], ["SP", 1, 0, 100352, [56], 1], ["AN", 1, 0, 5], ["AN", 1, 1, 6]]]], "r": [[3.81486e-06, 3.82113e-06, 3.82282e-06], 0, 0.921533, 1668056154], "v": "v0.6"}
{"i": [["[\"attn_v_permute\", 1, 14, 14, 512, 7, 16]", "cuda -keys=cuda,gpu -max_num_threads=1024 -model=unknown -thread_warp_size=32", [-1, 16, 64, 49152, 2147483647, 1024, 8, 32], "", 0, []], [[], [["FU", 1, [0, 1, 2, 3]], ["SP", 1, 0, 100352, [2], 1], ["AN", 1, 0, 5], ["AN", 1, 1, 6]]]], "r": [[3.98515e-05, 3.98733e-05, 3.98638e-05], 0, 1.65028, 1668056155], "v": "v0.6"}
{"i": [["[\"attn_v_permute\", 1, 14, 14, 512, 7, 16]", "cuda -keys=cuda,gpu -max_num_threads=1024 -model=unknown -thread_warp_size=32", [-1, 16, 64, 49152, 2147483647, 1024, 8, 32], "", 0, []], [[], [["FU", 1, [0, 1, 2, 3]], ["SP", 1, 0, 100352, [7], 1], ["AN", 1, 0, 5], ["AN", 1, 1, 6]]]], "r": [[1.33717e-05, 1.33872e-05, 1.33863e-05], 0, 2.36243, 1668056156], "v": "v0.6"}
{"i": [["[\"attn_v_permute\", 1, 14, 14, 512, 7, 16]", "cuda -keys=cuda,gpu -max_num_threads=1024 -model=unknown -thread_warp_size=32", [-1, 16, 64, 49152, 2147483647, 1024, 8, 32], "", 0, []], [[], [["FU", 1, [0, 1, 2, 3]], ["SP", 1, 0, 100352, [49], 1], ["AN", 1, 0, 5], ["AN", 1, 1, 6]]]], "r": [[4.01153e-06, 4.02539e-06, 4.02301e-06], 0, 2.70532, 1668056156], "v": "v0.6"}
{"i": [["[\"attn_v_permute\", 1, 14, 14, 512, 7, 16]", "cuda -keys=cuda,gpu -max_num_threads=1024 -model=unknown -thread_warp_size=32", [-1, 16, 64, 49152, 2147483647, 1024, 8, 32], "", 0, []], [[], [["FU", 1, [0, 1, 2, 3]], ["SP", 1, 0, 100352, [4], 1], ["AN", 1, 0, 5], ["AN", 1, 1, 6]]]], "r": [[2.13956e-05, 2.14111e-05, 2.14119e-05], 0, 3.45393, 1668056157], "v": "v0.6"}
{"i": [["[\"attn_v_permute\", 1, 14, 14, 512, 7, 16]", "cuda -keys=cuda,gpu -max_num_threads=1024 -model=unknown -thread_warp_size=32", [-1, 16, 64, 49152, 2147483647, 1024, 8, 32], "", 0, []], [[], [["FU", 1, [0, 1, 2, 3]], ["SP", 1, 0, 100352, [32], 1], ["AN", 1, 0, 5], ["AN", 1, 1, 6]]]], "r": [[4.9463e-06, 4.96791e-06, 4.96315e-06], 0, 3.77899, 1668056157], "v": "v0.6"}
{"i": [["[\"attn_v_permute\", 1, 14, 14, 512, 7, 16]", "cuda -keys=cuda,gpu -max_num_threads=1024 -model=unknown -thread_warp_size=32", [-1, 16, 64, 49152, 2147483647, 1024, 8, 32], "", 0, []], [[], [["FU", 1, [0, 1, 2, 3]], ["SP", 1, 0, 100352, [64], 1], ["AN", 1, 0, 5], ["AN", 1, 1, 6]]]], "r": [[3.71937e-06, 3.7348e-06, 3.73647e-06], 0, 4.12291, 1668056158], "v": "v0.6"}
{"i": [["[\"attn_v_permute\", 1, 14, 14, 512, 7, 16]", "cuda -keys=cuda,gpu -max_num_threads=1024 -model=unknown -thread_warp_size=32", [-1, 16, 64, 49152, 2147483647, 1024, 8, 32], "", 0, []], [[], [["FU", 1, [0, 1, 2, 3]], ["SP", 1, 0, 100352, [14], 1], ["AN", 1, 0, 5], ["AN", 1, 1, 6]]]], "r": [[7.97443e-06, 7.98664e-06, 7.98445e-06], 0, 4.52391, 1668056158], "v": "v0.6"}
{"i": [["[\"attn_v_permute\", 1, 14, 14, 512, 7, 16]", "cuda -keys=cuda,gpu -max_num_threads=1024 -model=unknown -thread_warp_size=32", [-1, 16, 64, 49152, 2147483647, 1024, 8, 32], "", 0, []], [[], [["FU", 1, [0, 1, 2, 3]], ["SP", 1, 0, 100352, [16], 1], ["AN", 1, 0, 5], ["AN", 1, 1, 6]]]], "r": [[7.29348e-06, 7.30729e-06, 7.30992e-06], 0, 1.29381, 1668056439], "v": "v0.6"}
{"i": [["[\"attn_v_permute\", 1, 14, 14, 512, 7, 16]", "cuda -keys=cuda,gpu -max_num_threads=1024 -model=unknown -thread_warp_size=32", [-1, 16, 64, 49152, 2147483647, 1024, 8, 32], "", 0, []], [[], [["FU", 1, [0, 1, 2, 3]], ["SP", 1, 0, 100352, [28], 1], ["AN", 1, 0, 5], ["AN", 1, 1, 6]]]], "r": [[5.40266e-06, 5.41397e-06, 5.41383e-06], 0, 0.574768, 1668056438], "v": "v0.6"}
{"i": [["[\"attn_v_permute\", 1, 14, 14, 512, 7, 16]", "cuda -keys=cuda,gpu -max_num_threads=1024 -model=unknown -thread_warp_size=32", [-1, 16, 64, 49152, 2147483647, 1024, 8, 32], "", 0, []], [[], [["FU", 1, [0, 1, 2, 3]], ["SP", 1, 0, 100352, [32], 1], ["AN", 1, 0, 5], ["AN", 1, 1, 6]]]], "r": [[4.95594e-06, 4.96481e-06, 4.96686e-06], 0, 0.908719, 1668056438], "v": "v0.6"}
{"i": [["[\"attn_v_permute\", 1, 14, 14, 512, 7, 16]", "cuda -keys=cuda,gpu -max_num_threads=1024 -model=unknown -thread_warp_size=32", [-1, 16, 64, 49152, 2147483647, 1024, 8, 32], "", 0, []], [[], [["FU", 1, [0, 1, 2, 3]], ["SP", 1, 0, 100352, [4], 1], ["AN", 1, 0, 5], ["AN", 1, 1, 6]]]], "r": [[2.13756e-05, 2.13785e-05, 2.13812e-05], 0, 2.3576, 1668056440], "v": "v0.6"}
{"i": [["[\"attn_v_permute\", 1, 14, 14, 512, 7, 16]", "cuda -keys=cuda,gpu -max_num_threads=1024 -model=unknown -thread_warp_size=32", [-1, 16, 64, 49152, 2147483647, 1024, 8, 32], "", 0, []], [[], [["FU", 1, [0, 1, 2, 3]], ["SP", 1, 0, 100352, [14], 1], ["AN", 1, 0, 5], ["AN", 1, 1, 6]]]], "r": [[7.9599e-06, 7.9741e-06, 7.97518e-06], 0, 1.96714, 1668056439], "v": "v0.6"}
{"i": [["[\"attn_v_permute\", 1, 14, 14, 512, 7, 16]", "cuda -keys=cuda,gpu -max_num_threads=1024 -model=unknown -thread_warp_size=32", [-1, 16, 64, 49152, 2147483647, 1024, 8, 32], "", 0, []], [[], [["FU", 1, [0, 1, 2, 3]], ["SP", 1, 0, 100352, [64], 1], ["AN", 1, 0, 5], ["AN", 1, 1, 6]]]], "r": [[3.93116e-06, 3.9391e-06, 3.94145e-06], 0, 1.62014, 1668056439], "v": "v0.6"}
{"i": [["[\"attn_v_permute\", 1, 14, 14, 512, 7, 16]", "cuda -keys=cuda,gpu -max_num_threads=1024 -model=unknown -thread_warp_size=32", [-1, 16, 64, 49152, 2147483647, 1024, 8, 32], "", 0, []], [[], [["FU", 1, [0, 1, 2, 3]], ["SP", 1, 0, 100352, [8], 1], ["AN", 1, 0, 5], ["AN", 1, 1, 6]]]], "r": [[1.21122e-05, 1.21191e-05, 1.2123e-05], 0, 3.03564, 1668056440], "v": "v0.6"}
{"i": [["[\"attn_v_permute\", 1, 14, 14, 512, 7, 16]", "cuda -keys=cuda,gpu -max_num_threads=1024 -model=unknown -thread_warp_size=32", [-1, 16, 64, 49152, 2147483647, 1024, 8, 32], "", 0, []], [[], [["FU", 1, [0, 1, 2, 3]], ["SP", 1, 0, 100352, [49], 1], ["AN", 1, 0, 5], ["AN", 1, 1, 6]]]], "r": [[4.26523e-06, 4.27554e-06, 4.28034e-06], 0, 2.68711, 1668056440], "v": "v0.6"}
{"i": [["[\"attn_v_permute\", 1, 14, 14, 512, 7, 16]", "cuda -keys=cuda,gpu -max_num_threads=1024 -model=unknown -thread_warp_size=32", [-1, 16, 64, 49152, 2147483647, 1024, 8, 32], "", 0, []], [[], [["FU", 1, [0, 1, 2, 3]], ["SP", 1, 0, 100352, [7], 1], ["AN", 1, 0, 5], ["AN", 1, 1, 6]]]], "r": [[1.32944e-05, 1.33001e-05, 1.33025e-05], 0, 3.40454, 1668056441], "v": "v0.6"}
{"i": [["[\"attn_v_permute\", 1, 14, 14, 512, 7, 16]", "cuda -keys=cuda,gpu -max_num_threads=1024 -model=unknown -thread_warp_size=32", [-1, 16, 64, 49152, 2147483647, 1024, 8, 32], "", 0, []], [[], [["FU", 1, [0, 1, 2, 3]], ["SP", 1, 0, 100352, [56], 1], ["AN", 1, 0, 5], ["AN", 1, 1, 6]]]], "r": [[3.91989e-06, 3.92908e-06, 3.93282e-06], 0, 4.08359, 1668056441], "v": "v0.6"}
{"i": [["[\"attn_v_permute\", 1, 14, 14, 512, 7, 16]", "cuda -keys=cuda,gpu -max_num_threads=1024 -model=unknown -thread_warp_size=32", [-1, 16, 64, 49152, 2147483647, 1024, 8, 32], "", 0, []], [[], [["FU", 1, [0, 1, 2, 3]], ["SP", 1, 0, 100352, [1], 1], ["AN", 1, 0, 5], ["AN", 1, 1, 6]]]], "r": [[7.72038e-05, 7.72354e-05, 7.72192e-05], 0, 4.48356, 1668056442], "v": "v0.6"}
{"i": [["[\"attn_v_permute\", 1, 14, 14, 512, 7, 16]", "cuda -keys=cuda,gpu -max_num_threads=1024 -model=unknown -thread_warp_size=32", [-1, 16, 64, 49152, 2147483647, 1024, 8, 32], "", 0, []], [[], [["FU", 1, [0, 1, 2, 3]], ["SP", 1, 0, 100352, [2], 1], ["AN", 1, 0, 5], ["AN", 1, 1, 6]]]], "r": [[3.99656e-05, 3.99869e-05, 3.9971e-05], 0, 3.75614, 1668056441], "v": "v0.6"}
{"i": [["[\"attn_v_permute\", 1, 14, 14, 512, 7, 16]", "cuda -keys=cuda,gpu -max_num_threads=1024 -model=unknown -thread_warp_size=32", [-1, 16, 64, 49152, 2147483647, 1024, 8, 32], "", 0, []], [[], [["FU", 1, [0, 1, 2, 3]], ["SP", 1, 0, 100352, [56], 1], ["AN", 1, 0, 5], ["AN", 1, 1, 6]]]], "r": [[3.88007e-06, 3.89126e-06, 3.89062e-06], 0, 0.579996, 1668056721], "v": "v0.6"}
{"i": [["[\"attn_v_permute\", 1, 14, 14, 512, 7, 16]", "cuda -keys=cuda,gpu -max_num_threads=1024 -model=unknown -thread_warp_size=32", [-1, 16, 64, 49152, 2147483647, 1024, 8, 32], "", 0, []], [[], [["FU", 1, [0, 1, 2, 3]], ["SP", 1, 0, 100352, [32], 1], ["AN", 1, 0, 5], ["AN", 1, 1, 6]]]], "r": [[4.99385e-06, 5.01235e-06, 5.01198e-06], 0, 2.35058, 1668056723], "v": "v0.6"}
{"i": [["[\"attn_v_permute\", 1, 14, 14, 512, 7, 16]", "cuda -keys=cuda,gpu -max_num_threads=1024 -model=unknown -thread_warp_size=32", [-1, 16, 64, 49152, 2147483647, 1024, 8, 32], "", 0, []], [[], [["FU", 1, [0, 1, 2, 3]], ["SP", 1, 0, 100352, [64], 1], ["AN", 1, 0, 5], ["AN", 1, 1, 6]]]], "r": [[3.66071e-06, 3.67415e-06, 3.67079e-06], 0, 1.29955, 1668056722], "v": "v0.6"}
{"i": [["[\"attn_v_permute\", 1, 14, 14, 512, 7, 16]", "cuda -keys=cuda,gpu -max_num_threads=1024 -model=unknown -thread_warp_size=32", [-1, 16, 64, 49152, 2147483647, 1024, 8, 32], "", 0, []], [[], [["FU", 1, [0, 1, 2, 3]], ["SP", 1, 0, 100352, [16], 1], ["AN", 1, 0, 5], ["AN", 1, 1, 6]]]], "r": [[7.42591e-06, 7.43747e-06, 7.43458e-06], 0, 0.922389, 1668056722], "v": "v0.6"}
{"i": [["[\"attn_v_permute\", 1, 14, 14, 512, 7, 16]", "cuda -keys=cuda,gpu -max_num_threads=1024 -model=unknown -thread_warp_size=32", [-1, 16, 64, 49152, 2147483647, 1024, 8, 32], "", 0, []], [[], [["FU", 1, [0, 1, 2, 3]], ["SP", 1, 0, 100352, [1], 1], ["AN", 1, 0, 5], ["AN", 1, 1, 6]]]], "r": [[7.73313e-05, 7.73242e-05, 7.73452e-05], 0, 1.64686, 1668056723], "v": "v0.6"}
{"i": [["[\"attn_v_permute\", 1, 14, 14, 512, 7, 16]", "cuda -keys=cuda,gpu -max_num_threads=1024 -model=unknown -thread_warp_size=32", [-1, 16, 64, 49152, 2147483647, 1024, 8, 32], "", 0, []], [[], [["FU", 1, [0, 1, 2, 3]], ["SP", 1, 0, 100352, [49], 1], ["AN", 1, 0, 5], ["AN", 1, 1, 6]]]], "r": [[4.05551e-06, 4.06266e-06, 4.05887e-06], 0, 3.04313, 1668056724], "v": "v0.6"}
{"i": [["[\"attn_v_permute\", 1, 14, 14, 512, 7, 16]", "cuda -keys=cuda,gpu -max_num_threads=1024 -model=unknown -thread_warp_size=32", [-1, 16, 64, 49152, 2147483647, 1024, 8, 32], "", 0, []], [[], [["FU", 1, [0, 1, 2, 3]], ["SP", 1, 0, 100352, [14], 1], ["AN", 1, 0, 5], ["AN", 1, 1, 6]]]], "r": [[7.97817e-06, 7.98504e-06, 7.98985e-06], 0, 1.96901, 1668056723], "v": "v0.6"}
{"i": [["[\"attn_v_permute\", 1, 14, 14, 512, 7, 16]", "cuda -keys=cuda,gpu -max_num_threads=1024 -model=unknown -thread_warp_size=32", [-1, 16, 64, 49152, 2147483647, 1024, 8, 32], "", 0, []], [[], [["FU", 1, [0, 1, 2, 3]], ["SP", 1, 0, 100352, [28], 1], ["AN", 1, 0, 5], ["AN", 1, 1, 6]]]], "r": [[5.31926e-06, 5.34608e-06, 5.33887e-06], 0, 2.69693, 1668056724], "v": "v0.6"}
{"i": [["[\"attn_v_permute\", 1, 14, 14, 512, 7, 16]", "cuda -keys=cuda,gpu -max_num_threads=1024 -model=unknown -thread_warp_size=32", [-1, 16, 64, 49152, 2147483647, 1024, 8, 32], "", 0, []], [[], [["FU", 1, [0, 1, 2, 3]], ["SP", 1, 0, 100352, [4], 1], ["AN", 1, 0, 5], ["AN", 1, 1, 6]]]], "r": [[2.12911e-05, 2.13038e-05, 2.13064e-05], 0, 3.42562, 1668056724], "v": "v0.6"}
{"i": [["[\"attn_v_permute\", 1, 14, 14, 512, 7, 16]", "cuda -keys=cuda,gpu -max_num_threads=1024 -model=unknown -thread_warp_size=32", [-1, 16, 64, 49152, 2147483647, 1024, 8, 32], "", 0, []], [[], [["FU", 1, [0, 1, 2, 3]], ["SP", 1, 0, 100352, [2], 1], ["AN", 1, 0, 5], ["AN", 1, 1, 6]]]], "r": [[3.98509e-05, 3.98761e-05, 3.98672e-05], 0, 4.48518, 1668056725], "v": "v0.6"}
{"i": [["[\"attn_v_permute\", 1, 14, 14, 512, 7, 16]", "cuda -keys=cuda,gpu -max_num_threads=1024 -model=unknown -thread_warp_size=32", [-1, 16, 64, 49152, 2147483647, 1024, 8, 32], "", 0, []], [[], [["FU", 1, [0, 1, 2, 3]], ["SP", 1, 0, 100352, [7], 1], ["AN", 1, 0, 5], ["AN", 1, 1, 6]]]], "r": [[1.33446e-05, 1.33564e-05, 1.33476e-05], 0, 4.0921, 1668056725], "v": "v0.6"}
{"i": [["[\"attn_v_permute\", 1, 14, 14, 512, 7, 16]", "cuda -keys=cuda,gpu -max_num_threads=1024 -model=unknown -thread_warp_size=32", [-1, 16, 64, 49152, 2147483647, 1024, 8, 32], "", 0, []], [[], [["FU", 1, [0, 1, 2, 3]], ["SP", 1, 0, 100352, [8], 1], ["AN", 1, 0, 5], ["AN", 1, 1, 6]]]], "r": [[1.2189e-05, 1.22101e-05, 1.22001e-05], 0, 3.7552, 1668056725], "v": "v0.6"}
{"i": [["[\"attn_v_permute\", 1, 14, 14, 512, 7, 16]", "cuda -keys=cuda,gpu -max_num_threads=1024 -model=unknown -thread_warp_size=32", [-1, 16, 64, 49152, 2147483647, 1024, 8, 32], "", 0, []], [[], [["FU", 1, [0, 1, 2, 3]], ["SP", 1, 0, 100352, [16], 1], ["AN", 1, 0, 5], ["AN", 1, 1, 6]]]], "r": [[7.29614e-06, 7.31095e-06, 7.31368e-06], 0, 1.30262, 1668057006], "v": "v0.6"}
{"i": [["[\"attn_v_permute\", 1, 14, 14, 512, 7, 16]", "cuda -keys=cuda,gpu -max_num_threads=1024 -model=unknown -thread_warp_size=32", [-1, 16, 64, 49152, 2147483647, 1024, 8, 32], "", 0, []], [[], [["FU", 1, [0, 1, 2, 3]], ["SP", 1, 0, 100352, [2], 1], ["AN", 1, 0, 5], ["AN", 1, 1, 6]]]], "r": [[3.98584e-05, 3.98573e-05, 3.98681e-05], 0, 2.0307, 1668057007], "v": "v0.6"}
{"i": [["[\"attn_v_permute\", 1, 14, 14, 512, 7, 16]", "cuda -keys=cuda,gpu -max_num_threads=1024 -model=unknown -thread_warp_size=32", [-1, 16, 64, 49152, 2147483647, 1024, 8, 32], "", 0, []], [[], [["FU", 1, [0, 1, 2, 3]], ["SP", 1, 0, 100352, [32], 1], ["AN", 1, 0, 5], ["AN", 1, 1, 6]]]], "r": [[5.06609e-06, 5.0743e-06, 5.07008e-06], 0, 0.580522, 1668057006], "v": "v0.6"}
{"i": [["[\"attn_v_permute\", 1, 14, 14, 512, 7, 16]", "cuda -keys=cuda,gpu -max_num_threads=1024 -model=unknown -thread_warp_size=32", [-1, 16, 64, 49152, 2147483647, 1024, 8, 32], "", 0, []], [[], [["FU", 1, [0, 1, 2, 3]], ["SP", 1, 0, 100352, [28], 1], ["AN", 1, 0, 5], ["AN", 1, 1, 6]]]], "r": [[5.42876e-06, 5.44672e-06, 5.45083e-06], 0, 2.71286, 1668057008], "v": "v0.6"}
{"i": [["[\"attn_v_permute\", 1, 14, 14, 512, 7, 16]", "cuda -keys=cuda,gpu -max_num_threads=1024 -model=unknown -thread_warp_size=32", [-1, 16, 64, 49152, 2147483647, 1024, 8, 32], "", 0, []], [[], [["FU", 1, [0, 1, 2, 3]], ["SP", 1, 0, 100352, [49], 1], ["AN", 1, 0, 5], ["AN", 1, 1, 6]]]], "r": [[4.01334e-06, 4.02466e-06, 4.02712e-06], 0, 0.961118, 1668057006], "v": "v0.6"}
{"i": [["[\"attn_v_permute\", 1, 14, 14, 512, 7, 16]", "cuda -keys=cuda,gpu -max_num_threads=1024 -model=unknown -thread_warp_size=32", [-1, 16, 64, 49152, 2147483647, 1024, 8, 32], "", 0, []], [[], [["FU", 1, [0, 1, 2, 3]], ["SP", 1, 0, 100352, [1], 1], ["AN", 1, 0, 5], ["AN", 1, 1, 6]]]], "r": [[7.72023e-05, 7.72102e-05, 7.72156e-05], 0, 1.63212, 1668057007], "v": "v0.6"}
{"i": [["[\"attn_v_permute\", 1, 14, 14, 512, 7, 16]", "cuda -keys=cuda,gpu -max_num_threads=1024 -model=unknown -thread_warp_size=32", [-1, 16, 64, 49152, 2147483647, 1024, 8, 32], "", 0, []], [[], [["FU", 1, [0, 1, 2, 3]], ["SP", 1, 0, 100352, [7], 1], ["AN", 1, 0, 5], ["AN", 1, 1, 6]]]], "r": [[1.34387e-05, 1.34547e-05, 1.34586e-05], 0, 2.37797, 1668057007], "v": "v0.6"}
{"i": [["[\"attn_v_permute\", 1, 14, 14, 512, 7, 16]", "cuda -keys=cuda,gpu -max_num_threads=1024 -model=unknown -thread_warp_size=32", [-1, 16, 64, 49152, 2147483647, 1024, 8, 32], "", 0, []], [[], [["FU", 1, [0, 1, 2, 3]], ["SP", 1, 0, 100352, [14], 1], ["AN", 1, 0, 5], ["AN", 1, 1, 6]]]], "r": [[7.97887e-06, 7.99904e-06, 8.00008e-06], 0, 3.76028, 1668057009], "v": "v0.6"}
{"i": [["[\"attn_v_permute\", 1, 14, 14, 512, 7, 16]", "cuda -keys=cuda,gpu -max_num_threads=1024 -model=unknown -thread_warp_size=32", [-1, 16, 64, 49152, 2147483647, 1024, 8, 32], "", 0, []], [[], [["FU", 1, [0, 1, 2, 3]], ["SP", 1, 0, 100352, [64], 1], ["AN", 1, 0, 5], ["AN", 1, 1, 6]]]], "r": [[3.86226e-06, 3.86374e-06, 3.86623e-06], 0, 4.1361, 1668057009], "v": "v0.6"}
{"i": [["[\"attn_v_permute\", 1, 14, 14, 512, 7, 16]", "cuda -keys=cuda,gpu -max_num_threads=1024 -model=unknown -thread_warp_size=32", [-1, 16, 64, 49152, 2147483647, 1024, 8, 32], "", 0, []], [[], [["FU", 1, [0, 1, 2, 3]], ["SP", 1, 0, 100352, [4], 1], ["AN", 1, 0, 5], ["AN", 1, 1, 6]]]], "r": [[2.14194e-05, 2.14203e-05, 2.14197e-05], 0, 3.41901, 1668057009], "v": "v0.6"}
{"i": [["[\"attn_v_permute\", 1, 14, 14, 512, 7, 16]", "cuda -keys=cuda,gpu -max_num_threads=1024 -model=unknown -thread_warp_size=32", [-1, 16, 64, 49152, 2147483647, 1024, 8, 32], "", 0, []], [[], [["FU", 1, [0, 1, 2, 3]], ["SP", 1, 0, 100352, [56], 1], ["AN", 1, 0, 5], ["AN", 1, 1, 6]]]], "r": [[3.87875e-06, 3.89133e-06, 3.88885e-06], 0, 3.07786, 1668057008], "v": "v0.6"}
{"i": [["[\"attn_v_permute\", 1, 14, 14, 512, 7, 16]", "cuda -keys=cuda,gpu -max_num_threads=1024 -model=unknown -thread_warp_size=32", [-1, 16, 64, 49152, 2147483647, 1024, 8, 32], "", 0, []], [[], [["FU", 1, [0, 1, 2, 3]], ["SP", 1, 0, 100352, [8], 1], ["AN", 1, 0, 5], ["AN", 1, 1, 6]]]], "r": [[1.20607e-05, 1.20692e-05, 1.20723e-05], 0, 4.47485, 1668057010], "v": "v0.6"}
{"i": [["[\"attn_v_permute\", 1, 14, 14, 512, 7, 16]", "cuda -keys=cuda,gpu -max_num_threads=1024 -model=unknown -thread_warp_size=32", [-1, 16, 64, 49152, 2147483647, 1024, 8, 32], "", 0, []], [[], [["FU", 1, [0, 1, 2, 3]], ["SP", 1, 0, 100352, [4], 1], ["AN", 1, 0, 5], ["AN", 1, 1, 6]]]], "r": [[2.13968e-05, 2.14024e-05, 2.14023e-05], 0, 0.928745, 1668057290], "v": "v0.6"}
{"i": [["[\"attn_v_permute\", 1, 14, 14, 512, 7, 16]", "cuda -keys=cuda,gpu -max_num_threads=1024 -model=unknown -thread_warp_size=32", [-1, 16, 64, 49152, 2147483647, 1024, 8, 32], "", 0, []], [[], [["FU", 1, [0, 1, 2, 3]], ["SP", 1, 0, 100352, [56], 1], ["AN", 1, 0, 5], ["AN", 1, 1, 6]]]], "r": [[3.86735e-06, 3.87742e-06, 3.87837e-06], 0, 1.28889, 1668057290], "v": "v0.6"}
{"i": [["[\"attn_v_permute\", 1, 14, 14, 512, 7, 16]", "cuda -keys=cuda,gpu -max_num_threads=1024 -model=unknown -thread_warp_size=32", [-1, 16, 64, 49152, 2147483647, 1024, 8, 32], "", 0, []], [[], [["FU", 1, [0, 1, 2, 3]], ["SP", 1, 0, 100352, [64], 1], ["AN", 1, 0, 5], ["AN", 1, 1, 6]]]], "r": [[3.90674e-06, 3.90263e-06, 3.91008e-06], 0, 1.97797, 1668057291], "v": "v0.6"}
{"i": [["[\"attn_v_permute\", 1, 14, 14, 512, 7, 16]", "cuda -keys=cuda,gpu -max_num_threads=1024 -model=unknown -thread_warp_size=32", [-1, 16, 64, 49152, 2147483647, 1024, 8, 32], "", 0, []], [[], [["FU", 1, [0, 1, 2, 3]], ["SP", 1, 0, 100352, [16], 1], ["AN", 1, 0, 5], ["AN", 1, 1, 6]]]], "r": [[7.33482e-06, 7.35497e-06, 7.3515e-06], 0, 1.63889, 1668057291], "v": "v0.6"}
{"i": [["[\"attn_v_permute\", 1, 14, 14, 512, 7, 16]", "cuda -keys=cuda,gpu -max_num_threads=1024 -model=unknown -thread_warp_size=32", [-1, 16, 64, 49152, 2147483647, 1024, 8, 32], "", 0, []], [[], [["FU", 1, [0, 1, 2, 3]], ["SP", 1, 0, 100352, [49], 1], ["AN", 1, 0, 5], ["AN", 1, 1, 6]]]], "r": [[4.05863e-06, 4.07115e-06, 4.06592e-06], 0, 0.577776, 1668057289], "v": "v0.6"}
{"i": [["[\"attn_v_permute\", 1, 14, 14, 512, 7, 16]", "cuda -keys=cuda,gpu -max_num_threads=1024 -model=unknown -thread_warp_size=32", [-1, 16, 64, 49152, 2147483647, 1024, 8, 32], "", 0, []], [[], [["FU", 1, [0, 1, 2, 3]], ["SP", 1, 0, 100352, [2], 1], ["AN", 1, 0, 5], ["AN", 1, 1, 6]]]], "r": [[3.99429e-05, 3.99435e-05, 3.99356e-05], 0, 2.37554, 1668057291], "v": "v0.6"}
{"i": [["[\"attn_v_permute\", 1, 14, 14, 512, 7, 16]", "cuda -keys=cuda,gpu -max_num_threads=1024 -model=unknown -thread_warp_size=32", [-1, 16, 64, 49152, 2147483647, 1024, 8, 32], "", 0, []], [[], [["FU", 1, [0, 1, 2, 3]], ["SP", 1, 0, 100352, [14], 1], ["AN", 1, 0, 5], ["AN", 1, 1, 6]]]], "r": [[7.92778e-06, 7.94141e-06, 7.93972e-06], 0, 3.04927, 1668057292], "v": "v0.6"}
{"i": [["[\"attn_v_permute\", 1, 14, 14, 512, 7, 16]", "cuda -keys=cuda,gpu -max_num_threads=1024 -model=unknown -thread_warp_size=32", [-1, 16, 64, 49152, 2147483647, 1024, 8, 32], "", 0, []], [[], [["FU", 1, [0, 1, 2, 3]], ["SP", 1, 0, 100352, [28], 1], ["AN", 1, 0, 5], ["AN", 1, 1, 6]]]], "r": [[5.34164e-06, 5.35361e-06, 5.3556e-06], 0, 2.69523, 1668057292], "v": "v0.6"}
{"i": [["[\"attn_v_permute\", 1, 14, 14, 512, 7, 16]", "cuda -keys=cuda,gpu -max_num_threads=1024 -model=unknown -thread_warp_size=32", [-1, 16, 64, 49152, 2147483647, 1024, 8, 32], "", 0, []], [[], [["FU", 1, [0, 1, 2, 3]], ["SP", 1, 0, 100352, [7], 1], ["AN", 1, 0, 5], ["AN", 1, 1, 6]]]], "r": [[1.34386e-05, 1.34531e-05, 1.3451e-05], 0, 3.44164, 1668057292], "v": "v0.6"}
{"i": [["[\"attn_v_permute\", 1, 14, 14, 512, 7, 16]", "cuda -keys=cuda,gpu -max_num_threads=1024 -model=unknown -thread_warp_size=32", [-1, 16, 64, 49152, 2147483647, 1024, 8, 32], "", 0, []], [[], [["FU", 1, [0, 1, 2, 3]], ["SP", 1, 0, 100352, [8], 1], ["AN", 1, 0, 5], ["AN", 1, 1, 6]]]], "r": [[1.20713e-05, 1.20776e-05, 1.2085e-05], 0, 3.77599, 1668057293], "v": "v0.6"}
{"i": [["[\"attn_v_permute\", 1, 14, 14, 512, 7, 16]", "cuda -keys=cuda,gpu -max_num_threads=1024 -model=unknown -thread_warp_size=32", [-1, 16, 64, 49152, 2147483647, 1024, 8, 32], "", 0, []], [[], [["FU", 1, [0, 1, 2, 3]], ["SP", 1, 0, 100352, [1], 1], ["AN", 1, 0, 5], ["AN", 1, 1, 6]]]], "r": [[7.73097e-05, 7.72961e-05, 7.72819e-05], 0, 4.12039, 1668057293], "v": "v0.6"}
{"i": [["[\"attn_v_permute\", 1, 14, 14, 512, 7, 16]", "cuda -keys=cuda,gpu -max_num_threads=1024 -model=unknown -thread_warp_size=32", [-1, 16, 64, 49152, 2147483647, 1024, 8, 32], "", 0, []], [[], [["FU", 1, [0, 1, 2, 3]], ["SP", 1, 0, 100352, [32], 1], ["AN", 1, 0, 5], ["AN", 1, 1, 6]]]], "r": [[4.963e-06, 4.97033e-06, 4.9703e-06], 0, 4.49612, 1668057294], "v": "v0.6"}
{"i": [["[\"attn_v_permute\", 1, 14, 14, 512, 7, 16]", "cuda -keys=cuda,gpu -max_num_threads=1024 -model=unknown -thread_warp_size=32", [-1, 16, 64, 49152, 2147483647, 1024, 8, 32], "", 0, []], [[], [["FU", 1, [0, 1, 2, 3]], ["SP", 1, 0, 100352, [64], 1], ["AN", 1, 0, 5], ["AN", 1, 1, 6]]]], "r": [[3.92859e-06, 3.93991e-06, 3.94073e-06], 0, 1.68678, 1668057574], "v": "v0.6"}
{"i": [["[\"attn_v_permute\", 1, 14, 14, 512, 7, 16]", "cuda -keys=cuda,gpu -max_num_threads=1024 -model=unknown -thread_warp_size=32", [-1, 16, 64, 49152, 2147483647, 1024, 8, 32], "", 0, []], [[], [["FU", 1, [0, 1, 2, 3]], ["SP", 1, 0, 100352, [1], 1], ["AN", 1, 0, 5], ["AN", 1, 1, 6]]]], "r": [[7.7268e-05, 7.72477e-05, 7.725e-05], 0, 0.931739, 1668057573], "v": "v0.6"}
{"i": [["[\"attn_v_permute\", 1, 14, 14, 512, 7, 16]", "cuda -keys=cuda,gpu -max_num_threads=1024 -model=unknown -thread_warp_size=32", [-1, 16, 64, 49152, 2147483647, 1024, 8, 32], "", 0, []], [[], [["FU", 1, [0, 1, 2, 3]], ["SP", 1, 0, 100352, [2], 1], ["AN", 1, 0, 5], ["AN", 1, 1, 6]]]], "r": [[3.98768e-05, 3.98812e-05, 3.9882e-05], 0, 2.03072, 1668057574], "v": "v0.6"}
{"i": [["[\"attn_v_permute\", 1, 14, 14, 512, 7, 16]", "cuda -keys=cuda,gpu -max_num_threads=1024 -model=unknown -thread_warp_size=32", [-1, 16, 64, 49152, 2147483647, 1024, 8, 32], "", 0, []], [[], [["FU", 1, [0, 1, 2, 3]], ["SP", 1, 0, 100352, [49], 1], ["AN", 1, 0, 5], ["AN", 1, 1, 6]]]], "r": [[4.30344e-06, 4.31273e-06, 4.31321e-06], 0, 2.40265, 1668057575], "v": "v0.6"}
{"i": [["[\"attn_v_permute\", 1, 14, 14, 512, 7, 16]", "cuda -keys=cuda,gpu -max_num_threads=1024 -model=unknown -thread_warp_size=32", [-1, 16, 64, 49152, 2147483647, 1024, 8, 32], "", 0, []], [[], [["FU", 1, [0, 1, 2, 3]], ["SP", 1, 0, 100352, [28], 1], ["AN", 1, 0, 5], ["AN", 1, 1, 6]]]], "r": [[5.25175e-06, 5.26542e-06, 5.26417e-06], 0, 0.592336, 1668057573], "v": "v0.6"}
{"i": [["[\"attn_v_permute\", 1, 14, 14, 512, 7, 16]", "cuda -keys=cuda,gpu -max_num_threads=1024 -model=unknown -thread_warp_size=32", [-1, 16, 64, 49152, 2147483647, 1024, 8, 32], "", 0, []], [[], [["FU", 1, [0, 1, 2, 3]], ["SP", 1, 0, 100352, [4], 1], ["AN", 1, 0, 5], ["AN", 1, 1, 6]]]], "r": [[2.13505e-05, 2.13615e-05, 2.13582e-05], 0, 1.32491, 1668057574], "v": "v0.6"}
{"i": [["[\"attn_v_permute\", 1, 14, 14, 512, 7, 16]", "cuda -keys=cuda,gpu -max_num_threads=1024 -model=unknown -thread_warp_size=32", [-1, 16, 64, 49152, 2147483647, 1024, 8, 32], "", 0, []], [[], [["FU", 1, [0, 1, 2, 3]], ["SP", 1, 0, 100352, [14], 1], ["AN", 1, 0, 5], ["AN", 1, 1, 6]]]], "r": [[7.95516e-06, 7.96847e-06, 7.97073e-06], 0, 3.07936, 1668057575], "v": "v0.6"}
{"i": [["[\"attn_v_permute\", 1, 14, 14, 512, 7, 16]", "cuda -keys=cuda,gpu -max_num_threads=1024 -model=unknown -thread_warp_size=32", [-1, 16, 64, 49152, 2147483647, 1024, 8, 32], "", 0, []], [[], [["FU", 1, [0, 1, 2, 3]], ["SP", 1, 0, 100352, [8], 1], ["AN", 1, 0, 5], ["AN", 1, 1, 6]]]], "r": [[1.20701e-05, 1.2079e-05, 1.20807e-05], 0, 2.7412, 1668057575], "v": "v0.6"}
{"i": [["[\"attn_v_permute\", 1, 14, 14, 512, 7, 16]", "cuda -keys=cuda,gpu -max_num_threads=1024 -model=unknown -thread_warp_size=32", [-1, 16, 64, 49152, 2147483647, 1024, 8, 32], "", 0, []], [[], [["FU", 1, [0, 1, 2, 3]], ["SP", 1, 0, 100352, [56], 1], ["AN", 1, 0, 5], ["AN", 1, 1, 6]]]], "r": [[4.06352e-06, 4.07481e-06, 4.07512e-06], 0, 4.14952, 1668057576], "v": "v0.6"}
{"i": [["[\"attn_v_permute\", 1, 14, 14, 512, 7, 16]", "cuda -keys=cuda,gpu -max_num_threads=1024 -model=unknown -thread_warp_size=32", [-1, 16, 64, 49152, 2147483647, 1024, 8, 32], "", 0, []], [[], [["FU", 1, [0, 1, 2, 3]], ["SP", 1, 0, 100352, [16], 1], ["AN", 1, 0, 5], ["AN", 1, 1, 6]]]], "r": [[7.22267e-06, 7.23501e-06, 7.23174e-06], 0, 3.50864, 1668057576], "v": "v0.6"}
{"i": [["[\"attn_v_permute\", 1, 14, 14, 512, 7, 16]", "cuda -keys=cuda,gpu -max_num_threads=1024 -model=unknown -thread_warp_size=32", [-1, 16, 64, 49152, 2147483647, 1024, 8, 32], "", 0, []], [[], [["FU", 1, [0, 1, 2, 3]], ["SP", 1, 0, 100352, [32], 1], ["AN", 1, 0, 5], ["AN", 1, 1, 6]]]], "r": [[4.88741e-06, 4.89768e-06, 4.89648e-06], 0, 3.80137, 1668057576], "v": "v0.6"}
{"i": [["[\"attn_v_permute\", 1, 14, 14, 512, 7, 16]", "cuda -keys=cuda,gpu -max_num_threads=1024 -model=unknown -thread_warp_size=32", [-1, 16, 64, 49152, 2147483647, 1024, 8, 32], "", 0, []], [[], [["FU", 1, [0, 1, 2, 3]], ["SP", 1, 0, 100352, [7], 1], ["AN", 1, 0, 5], ["AN", 1, 1, 6]]]], "r": [[1.3375e-05, 1.33906e-05, 1.33875e-05], 0, 4.51912, 1668057577], "v": "v0.6"}
{"i": [["[\"attn_v_permute\", 1, 14, 14, 512, 7, 16]", "cuda -keys=cuda,gpu -max_num_threads=1024 -model=unknown -thread_warp_size=32", [-1, 16, 64, 49152, 2147483647, 1024, 8, 32], "", 0, []], [[], [["FU", 1, [0, 1, 2, 3]], ["SP", 1, 0, 100352, [8], 1], ["AN", 1, 0, 5], ["AN", 1, 1, 6]]]], "r": [[1.2221e-05, 1.22509e-05, 1.22407e-05], 0, 1.287, 1668057858], "v": "v0.6"}
{"i": [["[\"attn_v_permute\", 1, 14, 14, 512, 7, 16]", "cuda -keys=cuda,gpu -max_num_threads=1024 -model=unknown -thread_warp_size=32", [-1, 16, 64, 49152, 2147483647, 1024, 8, 32], "", 0, []], [[], [["FU", 1, [0, 1, 2, 3]], ["SP", 1, 0, 100352, [56], 1], ["AN", 1, 0, 5], ["AN", 1, 1, 6]]]], "r": [[3.89554e-06, 3.90136e-06, 3.90406e-06], 0, 0.582566, 1668057857], "v": "v0.6"}
{"i": [["[\"attn_v_permute\", 1, 14, 14, 512, 7, 16]", "cuda -keys=cuda,gpu -max_num_threads=1024 -model=unknown -thread_warp_size=32", [-1, 16, 64, 49152, 2147483647, 1024, 8, 32], "", 0, []], [[], [["FU", 1, [0, 1, 2, 3]], ["SP", 1, 0, 100352, [2], 1], ["AN", 1, 0, 5], ["AN", 1, 1, 6]]]], "r": [[3.99498e-05, 3.99693e-05, 3.99682e-05], 0, 2.71784, 1668057860], "v": "v0.6"}
{"i": [["[\"attn_v_permute\", 1, 14, 14, 512, 7, 16]", "cuda -keys=cuda,gpu -max_num_threads=1024 -model=unknown -thread_warp_size=32", [-1, 16, 64, 49152, 2147483647, 1024, 8, 32], "", 0, []], [[], [["FU", 1, [0, 1, 2, 3]], ["SP", 1, 0, 100352, [4], 1], ["AN", 1, 0, 5], ["AN", 1, 1, 6]]]], "r": [[2.14944e-05, 2.15068e-05, 2.15048e-05], 0, 1.9718, 1668057859], "v": "v0.6"}
{"i": [["[\"attn_v_permute\", 1, 14, 14, 512, 7, 16]", "cuda -keys=cuda,gpu -max_num_threads=1024 -model=unknown -thread_warp_size=32", [-1, 16, 64, 49152, 2147483647, 1024, 8, 32], "", 0, []], [[], [["FU", 1, [0, 1, 2, 3]], ["SP", 1, 0, 100352, [32], 1], ["AN", 1, 0, 5], ["AN", 1, 1, 6]]]], "r": [[4.90445e-06, 4.91684e-06, 4.9184e-06], 0, 0.910212, 1668057858], "v": "v0.6"}
{"i": [["[\"attn_v_permute\", 1, 14, 14, 512, 7, 16]", "cuda -keys=cuda,gpu -max_num_threads=1024 -model=unknown -thread_warp_size=32", [-1, 16, 64, 49152, 2147483647, 1024, 8, 32], "", 0, []], [[], [["FU", 1, [0, 1, 2, 3]], ["SP", 1, 0, 100352, [49], 1], ["AN", 1, 0, 5], ["AN", 1, 1, 6]]]], "r": [[4.02656e-06, 4.03524e-06, 4.03152e-06], 0, 2.35869, 1668057859], "v": "v0.6"}
{"i": [["[\"attn_v_permute\", 1, 14, 14, 512, 7, 16]", "cuda -keys=cuda,gpu -max_num_threads=1024 -model=unknown -thread_warp_size=32", [-1, 16, 64, 49152, 2147483647, 1024, 8, 32], "", 0, []], [[], [["FU", 1, [0, 1, 2, 3]], ["SP", 1, 0, 100352, [28], 1], ["AN", 1, 0, 5], ["AN", 1, 1, 6]]]], "r": [[5.30633e-06, 5.32385e-06, 5.3275e-06], 0, 3.77824, 1668057861], "v": "v0.6"}
{"i": [["[\"attn_v_permute\", 1, 14, 14, 512, 7, 16]", "cuda -keys=cuda,gpu -max_num_threads=1024 -model=unknown -thread_warp_size=32", [-1, 16, 64, 49152, 2147483647, 1024, 8, 32], "", 0, []], [[], [["FU", 1, [0, 1, 2, 3]], ["SP", 1, 0, 100352, [64], 1], ["AN", 1, 0, 5], ["AN", 1, 1, 6]]]], "r": [[3.66053e-06, 3.67088e-06, 3.6708e-06], 0, 1.61248, 1668057859], "v": "v0.6"}
{"i": [["[\"attn_v_permute\", 1, 14, 14, 512, 7, 16]", "cuda -keys=cuda,gpu -max_num_threads=1024 -model=unknown -thread_warp_size=32", [-1, 16, 64, 49152, 2147483647, 1024, 8, 32], "", 0, []], [[], [["FU", 1, [0, 1, 2, 3]], ["SP", 1, 0, 100352, [14], 1], ["AN", 1, 0, 5], ["AN", 1, 1, 6]]]], "r": [[7.98213e-06, 8.00422e-06, 8.00229e-06], 0, 4.11975, 1668057861], "v": "v0.6"}
{"i": [["[\"attn_v_permute\", 1, 14, 14, 512, 7, 16]", "cuda -keys=cuda,gpu -max_num_threads=1024 -model=unknown -thread_warp_size=32", [-1, 16, 64, 49152, 2147483647, 1024, 8, 32], "", 0, []], [[], [["FU", 1, [0, 1, 2, 3]], ["SP", 1, 0, 100352, [16], 1], ["AN", 1, 0, 5], ["AN", 1, 1, 6]]]], "r": [[7.19188e-06, 7.20511e-06, 7.20707e-06], 0, 3.03682, 1668057860], "v": "v0.6"}
{"i": [["[\"attn_v_permute\", 1, 14, 14, 512, 7, 16]", "cuda -keys=cuda,gpu -max_num_threads=1024 -model=unknown -thread_warp_size=32", [-1, 16, 64, 49152, 2147483647, 1024, 8, 32], "", 0, []], [[], [["FU", 1, [0, 1, 2, 3]], ["SP", 1, 0, 100352, [1], 1], ["AN", 1, 0, 5], ["AN", 1, 1, 6]]]], "r": [[7.73255e-05, 7.73317e-05, 7.73433e-05], 0, 3.42882, 1668057860], "v": "v0.6"}
{"i": [["[\"attn_v_permute\", 1, 14, 14, 512, 7, 16]", "cuda -keys=cuda,gpu -max_num_threads=1024 -model=unknown -thread_warp_size=32", [-1, 16, 64, 49152, 2147483647, 1024, 8, 32], "", 0, []], [[], [["FU", 1, [0, 1, 2, 3]], ["SP", 1, 0, 100352, [7], 1], ["AN", 1, 0, 5], ["AN", 1, 1, 6]]]], "r": [[1.34461e-05, 1.34602e-05, 1.34557e-05], 0, 4.51592, 1668057861], "v": "v0.6"}
{"i": [["[\"attn_v_permute\", 1, 14, 14, 512, 7, 16]", "cuda -keys=cuda,gpu -max_num_threads=1024 -model=unknown -thread_warp_size=32", [-1, 16, 64, 49152, 2147483647, 1024, 8, 32], "", 0, []], [[], [["FU", 1, [0, 1, 2, 3]], ["SP", 1, 0, 100352, [64], 1], ["AN", 1, 0, 5], ["AN", 1, 1, 6]]]], "r": [[3.74181e-06, 3.75629e-06, 3.75661e-06], 0, 0.579379, 1668058092], "v": "v0.6"}
