python/models/swin_transformer/kernel_configs/swin_transformer_mul_1_56_56_512.log
{"i": [["[\"mul\", 1, 56, 56, 512]", "cuda -keys=cuda,gpu -max_num_threads=1024 -model=unknown -thread_warp_size=32", [-1, 16, 64, 49152, 2147483647, 1024, 8, 32], "", 0, []], [[], [["FU", 2, [0, 1, 2, 3]], ["SP", 2, 0, 1605632, [49], 1], ["AN", 2, 0, 5], ["AN", 2, 1, 6]]]], "r": [[2.6997e-05, 2.69877e-05, 2.69946e-05], 0, 1.85502, 1668019142], "v": "v0.6"}
{"i": [["[\"mul\", 1, 56, 56, 512]", "cuda -keys=cuda,gpu -max_num_threads=1024 -model=unknown -thread_warp_size=32", [-1, 16, 64, 49152, 2147483647, 1024, 8, 32], "", 0, []], [[], [["FU", 2, [0, 1, 2, 3]], ["SP", 2, 0, 1605632, [14], 1], ["AN", 2, 0, 5], ["AN", 2, 1, 6]]]], "r": [[8.8055e-05, 8.80883e-05, 8.80894e-05], 0, 2.30031, 1668019142], "v": "v0.6"}
{"i": [["[\"mul\", 1, 56, 56, 512]", "cuda -keys=cuda,gpu -max_num_threads=1024 -model=unknown -thread_warp_size=32", [-1, 16, 64, 49152, 2147483647, 1024, 8, 32], "", 0, []], [[], [["FU", 2, [0, 1, 2, 3]], ["SP", 2, 0, 1605632, [28], 1], ["AN", 2, 0, 5], ["AN", 2, 1, 6]]]], "r": [[4.55182e-05, 4.5505e-05, 4.54996e-05], 0, 1.45576, 1668019141], "v": "v0.6"}
{"i": [["[\"mul\", 1, 56, 56, 512]", "cuda -keys=cuda,gpu -max_num_threads=1024 -model=unknown -thread_warp_size=32", [-1, 16, 64, 49152, 2147483647, 1024, 8, 32], "", 0, []], [[], [["FU", 2, [0, 1, 2, 3]], ["SP", 2, 0, 1605632, [64], 1], ["AN", 2, 0, 5], ["AN", 2, 1, 6]]]], "r": [[2.1267e-05, 2.1264e-05, 2.1252e-05], 0, 1.0517, 1668019141], "v": "v0.6"}
{"i": [["[\"mul\", 1, 56, 56, 512]", "cuda -keys=cuda,gpu -max_num_threads=1024 -model=unknown -thread_warp_size=32", [-1, 16, 64, 49152, 2147483647, 1024, 8, 32], "", 0, []], [[], [["FU", 2, [0, 1, 2, 3]], ["SP", 2, 0, 1605632, [56], 1], ["AN", 2, 0, 5], ["AN", 2, 1, 6]]]], "r": [[2.40135e-05, 2.4014e-05, 2.39951e-05], 0, 0.616959, 1668019140], "v": "v0.6"}
{"i": [["[\"mul\", 1, 56, 56, 512]", "cuda -keys=cuda,gpu -max_num_threads=1024 -model=unknown -thread_warp_size=32", [-1, 16, 64, 49152, 2147483647, 1024, 8, 32], "", 0, []], [[], [["FU", 2, [0, 1, 2, 3]], ["SP", 2, 0, 1605632, [1], 1], ["AN", 2, 0, 5], ["AN", 2, 1, 6]]]], "r": [[0.00119319, 0.00119315, 0.00119318], 0, 2.70041, 1668019142], "v": "v0.6"}
{"i": [["[\"mul\", 1, 56, 56, 512]", "cuda -keys=cuda,gpu -max_num_threads=1024 -model=unknown -thread_warp_size=32", [-1, 16, 64, 49152, 2147483647, 1024, 8, 32], "", 0, []], [[], [["FU", 2, [0, 1, 2, 3]], ["SP", 2, 0, 1605632, [32], 1], ["AN", 2, 0, 5], ["AN", 2, 1, 6]]]], "r": [[4.01658e-05, 4.01257e-05, 4.01264e-05], 0, 3.09197, 1668019143], "v": "v0.6"}
{"i": [["[\"mul\", 1, 56, 56, 512]", "cuda -keys=cuda,gpu -max_num_threads=1024 -model=unknown -thread_warp_size=32", [-1, 16, 64, 49152, 2147483647, 1024, 8, 32], "", 0, []], [[], [["FU", 2, [0, 1, 2, 3]], ["SP", 2, 0, 1605632, [2], 1], ["AN", 2, 0, 5], ["AN", 2, 1, 6]]]], "r": [[0.00059798, 0.000597983, 0.000598019], 0, 3.51115, 1668019143], "v": "v0.6"}
{"i": [["[\"mul\", 1, 56, 56, 512]", "cuda -keys=cuda,gpu -max_num_threads=1024 -model=unknown -thread_warp_size=32", [-1, 16, 64, 49152, 2147483647, 1024, 8, 32], "", 0, []], [[], [["FU", 2, [0, 1, 2, 3]], ["SP", 2, 0, 1605632, [16], 1], ["AN", 2, 0, 5], ["AN", 2, 1, 6]]]], "r": [[7.73492e-05, 7.73668e-05, 7.73511e-05], 0, 3.91879, 1668019144], "v": "v0.6"}
{"i": [["[\"mul\", 1, 56, 56, 512]", "cuda -keys=cuda,gpu -max_num_threads=1024 -model=unknown -thread_warp_size=32", [-1, 16, 64, 49152, 2147483647, 1024, 8, 32], "", 0, []], [[], [["FU", 2, [0, 1, 2, 3]], ["SP", 2, 0, 1605632, [4], 1], ["AN", 2, 0, 5], ["AN", 2, 1, 6]]]], "r": [[0.00030057, 0.000300548, 0.000300561], 0, 4.3036, 1668019144], "v": "v0.6"}
{"i": [["[\"mul\", 1, 56, 56, 512]", "cuda -keys=cuda,gpu -max_num_threads=1024 -model=unknown -thread_warp_size=32", [-1, 16, 64, 49152, 2147483647, 1024, 8, 32], "", 0, []], [[], [["FU", 2, [0, 1, 2, 3]], ["SP", 2, 0, 1605632, [7], 1], ["AN", 2, 0, 5], ["AN", 2, 1, 6]]]], "r": [[0.000173088, 0.000173027, 0.000173056], 0, 5.13368, 1668019145], "v": "v0.6"}
{"i": [["[\"mul\", 1, 56, 56, 512]", "cuda -keys=cuda,gpu -max_num_threads=1024 -model=unknown -thread_warp_size=32", [-1, 16, 64, 49152, 2147483647, 1024, 8, 32], "", 0, []], [[], [["FU", 2, [0, 1, 2, 3]], ["SP", 2, 0, 1605632, [8], 1], ["AN", 2, 0, 5], ["AN", 2, 1, 6]]]], "r": [[0.00015185, 0.000151825, 0.000151827], 0, 4.73764, 1668019145], "v": "v0.6"}
{"i": [["[\"mul\", 1, 56, 56, 512]", "cuda -keys=cuda,gpu -max_num_threads=1024 -model=unknown -thread_warp_size=32", [-1, 16, 64, 49152, 2147483647, 1024, 8, 32], "", 0, []], [[], [["FU", 2, [0, 1, 2, 3]], ["SP", 2, 0, 1605632, [16], 1], ["AN", 2, 0, 5], ["AN", 2, 1, 6]]]], "r": [[7.73665e-05, 7.7362e-05, 7.73834e-05], 0, 2.30888, 1668019645], "v": "v0.6"}
{"i": [["[\"mul\", 1, 56, 56, 512]", "cuda -keys=cuda,gpu -max_num_threads=1024 -model=unknown -thread_warp_size=32", [-1, 16, 64, 49152, 2147483647, 1024, 8, 32], "", 0, []], [[], [["FU", 2, [0, 1, 2, 3]], ["SP", 2, 0, 1605632, [28], 1], ["AN", 2, 0, 5], ["AN", 2, 1, 6]]]], "r": [[4.54888e-05, 4.55108e-05, 4.54984e-05], 0, 1.04925, 1668019644], "v": "v0.6"}
{"i": [["[\"mul\", 1, 56, 56, 512]", "cuda -keys=cuda,gpu -max_num_threads=1024 -model=unknown -thread_warp_size=32", [-1, 16, 64, 49152, 2147483647, 1024, 8, 32], "", 0, []], [[], [["FU", 2, [0, 1, 2, 3]], ["SP", 2, 0, 1605632, [49], 1], ["AN", 2, 0, 5], ["AN", 2, 1, 6]]]], "r": [[2.70597e-05, 2.70554e-05, 2.70321e-05], 0, 1.85635, 1668019644], "v": "v0.6"}
{"i": [["[\"mul\", 1, 56, 56, 512]", "cuda -keys=cuda,gpu -max_num_threads=1024 -model=unknown -thread_warp_size=32", [-1, 16, 64, 49152, 2147483647, 1024, 8, 32], "", 0, []], [[], [["FU", 2, [0, 1, 2, 3]], ["SP", 2, 0, 1605632, [7], 1], ["AN", 2, 0, 5], ["AN", 2, 1, 6]]]], "r": [[0.000173014, 0.000173068, 0.000173057], 0, 2.67913, 1668019645], "v": "v0.6"}
{"i": [["[\"mul\", 1, 56, 56, 512]", "cuda -keys=cuda,gpu -max_num_threads=1024 -model=unknown -thread_warp_size=32", [-1, 16, 64, 49152, 2147483647, 1024, 8, 32], "", 0, []], [[], [["FU", 2, [0, 1, 2, 3]], ["SP", 2, 0, 1605632, [32], 1], ["AN", 2, 0, 5], ["AN", 2, 1, 6]]]], "r": [[4.01244e-05, 4.01008e-05, 4.01034e-05], 0, 1.45143, 1668019644], "v": "v0.6"}
{"i": [["[\"mul\", 1, 56, 56, 512]", "cuda -keys=cuda,gpu -max_num_threads=1024 -model=unknown -thread_warp_size=32", [-1, 16, 64, 49152, 2147483647, 1024, 8, 32], "", 0, []], [[], [["FU", 2, [0, 1, 2, 3]], ["SP", 2, 0, 1605632, [8], 1], ["AN", 2, 0, 5], ["AN", 2, 1, 6]]]], "r": [[0.000151902, 0.000151896, 0.000151888], 0, 0.599499, 1668019643], "v": "v0.6"}
{"i": [["[\"mul\", 1, 56, 56, 512]", "cuda -keys=cuda,gpu -max_num_threads=1024 -model=unknown -thread_warp_size=32", [-1, 16, 64, 49152, 2147483647, 1024, 8, 32], "", 0, []], [[], [["FU", 2, [0, 1, 2, 3]], ["SP", 2, 0, 1605632, [1], 1], ["AN", 2, 0, 5], ["AN", 2, 1, 6]]]], "r": [[0.00119341, 0.00119333, 0.00119344], 0, 4.34896, 1668019647], "v": "v0.6"}
{"i": [["[\"mul\", 1, 56, 56, 512]", "cuda -keys=cuda,gpu -max_num_threads=1024 -model=unknown -thread_warp_size=32", [-1, 16, 64, 49152, 2147483647, 1024, 8, 32], "", 0, []], [[], [["FU", 2, [0, 1, 2, 3]], ["SP", 2, 0, 1605632, [56], 1], ["AN", 2, 0, 5], ["AN", 2, 1, 6]]]], "r": [[2.39881e-05, 2.3981e-05, 2.39741e-05], 0, 3.53736, 1668019646], "v": "v0.6"}
{"i": [["[\"mul\", 1, 56, 56, 512]", "cuda -keys=cuda,gpu -max_num_threads=1024 -model=unknown -thread_warp_size=32", [-1, 16, 64, 49152, 2147483647, 1024, 8, 32], "", 0, []], [[], [["FU", 2, [0, 1, 2, 3]], ["SP", 2, 0, 1605632, [14], 1], ["AN", 2, 0, 5], ["AN", 2, 1, 6]]]], "r": [[8.79899e-05, 8.79917e-05, 8.80023e-05], 0, 3.08779, 1668019646], "v": "v0.6"}
{"i": [["[\"mul\", 1, 56, 56, 512]", "cuda -keys=cuda,gpu -max_num_threads=1024 -model=unknown -thread_warp_size=32", [-1, 16, 64, 49152, 2147483647, 1024, 8, 32], "", 0, []], [[], [["FU", 2, [0, 1, 2, 3]], ["SP", 2, 0, 1605632, [64], 1], ["AN", 2, 0, 5], ["AN", 2, 1, 6]]]], "r": [[2.11961e-05, 2.12027e-05, 2.11971e-05], 0, 3.94915, 1668019647], "v": "v0.6"}
{"i": [["[\"mul\", 1, 56, 56, 512]", "cuda -keys=cuda,gpu -max_num_threads=1024 -model=unknown -thread_warp_size=32", [-1, 16, 64, 49152, 2147483647, 1024, 8, 32], "", 0, []], [[], [["FU", 2, [0, 1, 2, 3]], ["SP", 2, 0, 1605632, [4], 1], ["AN", 2, 0, 5], ["AN", 2, 1, 6]]]], "r": [[0.000300541, 0.000300592, 0.000300548], 0, 4.78463, 1668019647], "v": "v0.6"}
{"i": [["[\"mul\", 1, 56, 56, 512]", "cuda -keys=cuda,gpu -max_num_threads=1024 -model=unknown -thread_warp_size=32", [-1, 16, 64, 49152, 2147483647, 1024, 8, 32], "", 0, []], [[], [["FU", 2, [0, 1, 2, 3]], ["SP", 2, 0, 1605632, [2], 1], ["AN", 2, 0, 5], ["AN", 2, 1, 6]]]], "r": [[0.000598054, 0.000598048, 0.000598099], 0, 5.15335, 1668019648], "v": "v0.6"}
