python/models/swin_transformer/kernel_configs/swin_transform_auto_tvm_tune_attn_v_pad_matmul_tensorcore_1_7_7_32_7.log
{"input": ["cuda -keys=cuda,gpu -max_num_threads=1024 -thread_warp_size=32", "attn_v_pad_matmul.cuda", [["TENSOR", [32, 49, 49], "float16"], ["TENSOR", [32, 32, 49], "float16"]], {}], "config": {"index": 201, "code_hash": null, "entity": [["block_row_warps", "ot", 1], ["block_col_warps", "ot", 2], ["warp_row_tiles", "ot", 2], ["warp_col_tiles", "ot", 2], ["chunk", "ot", 4], ["offset", "ot", 0], ["offsetCS", "ot", 0], ["vec", "ot", 1], ["wmma_m", "ot", 32]]}, "result": [[1.4520098e-05], 0, 1.9228639602661133, 1651930883.345103], "version": 0.2, "tvm_version": "0.8.0"}
{"input": ["cuda -keys=cuda,gpu -max_num_threads=1024 -thread_warp_size=32", "attn_v_pad_matmul.cuda", [["TENSOR", [32, 49, 49], "float16"], ["TENSOR", [32, 32, 49], "float16"]], {}], "config": {"index": 205, "code_hash": null, "entity": [["block_row_warps", "ot", 2], ["block_col_warps", "ot", 4], ["warp_row_tiles", "ot", 2], ["warp_col_tiles", "ot", 2], ["chunk", "ot", 4], ["offset", "ot", 0], ["offsetCS", "ot", 0], ["vec", "ot", 1], ["wmma_m", "ot", 32]]}, "result": [[2.2686046000000002e-05], 0, 1.7724742889404297, 1651930883.9566886], "version": 0.2, "tvm_version": "0.8.0"}
{"input": ["cuda -keys=cuda,gpu -max_num_threads=1024 -thread_warp_size=32", "attn_v_pad_matmul.cuda", [["TENSOR", [32, 49, 49], "float16"], ["TENSOR", [32, 32, 49], "float16"]], {}], "config": {"index": 3907, "code_hash": null, "entity": [["block_row_warps", "ot", 2], ["block_col_warps", "ot", 1], ["warp_row_tiles", "ot", 4], ["warp_col_tiles", "ot", 1], ["chunk", "ot", 1], ["offset", "ot", 0], ["offsetCS", "ot", 0], ["vec", "ot", 8], ["wmma_m", "ot", 32]]}, "result": [[1.8779139e-05], 0, 1.556976318359375, 1651930884.4176269], "version": 0.2, "tvm_version": "0.8.0"}
{"input": ["cuda -keys=cuda,gpu -max_num_threads=1024 -thread_warp_size=32", "attn_v_pad_matmul.cuda", [["TENSOR", [32, 49, 49], "float16"], ["TENSOR", [32, 32, 49], "float16"]], {}], "config": {"index": 7953, "code_hash": null, "entity": [["block_row_warps", "ot", 1], ["block_col_warps", "ot", 4], ["warp_row_tiles", "ot", 2], ["warp_col_tiles", "ot", 1], ["chunk", "ot", 4], ["offset", "ot", 0], ["offsetCS", "ot", 0], ["vec", "ot", 4], ["wmma_m", "ot", 16]]}, "result": [[1.1321652999999998e-05], 0, 1.4058294296264648, 1651930885.9408503], "version": 0.2, "tvm_version": "0.8.0"}
{"input": ["cuda -keys=cuda,gpu -max_num_threads=1024 -thread_warp_size=32", "attn_v_pad_matmul.cuda", [["TENSOR", [32, 49, 49], "float16"], ["TENSOR", [32, 32, 49], "float16"]], {}], "config": {"index": 13296, "code_hash": null, "entity": [["block_row_warps", "ot", 1], ["block_col_warps", "ot", 2], ["warp_row_tiles", "ot", 2], ["warp_col_tiles", "ot", 1], ["chunk", "ot", 1], ["offset", "ot", 8], ["offsetCS", "ot", 0], ["vec", "ot", 4], ["wmma_m", "ot", 8]]}, "result": [[7.983428306551299e-06], 0, 1.4251041412353516, 1651930886.5059712], "version": 0.2, "tvm_version": "0.8.0"}
{"input": ["cuda -keys=cuda,gpu -max_num_threads=1024 -thread_warp_size=32", "attn_v_pad_matmul.cuda", [["TENSOR", [32, 49, 49], "float16"], ["TENSOR", [32, 32, 49], "float16"]], {}], "config": {"index": 7716, "code_hash": null, "entity": [["block_row_warps", "ot", 1], ["block_col_warps", "ot", 2], ["warp_row_tiles", "ot", 4], ["warp_col_tiles", "ot", 1], ["chunk", "ot", 8], ["offset", "ot", 8], ["offsetCS", "ot", 8], ["vec", "ot", 2], ["wmma_m", "ot", 16]]}, "result": [[1.0930631e-05], 0, 1.70869779586792, 1651930888.1210458], "version": 0.2, "tvm_version": "0.8.0"}
{"input": ["cuda -keys=cuda,gpu -max_num_threads=1024 -thread_warp_size=32", "attn_v_pad_matmul.cuda", [["TENSOR", [32, 49, 49], "float16"], ["TENSOR", [32, 32, 49], "float16"]], {}], "config": {"index": 279, "code_hash": null, "entity": [["block_row_warps", "ot", 1], ["block_col_warps", "ot", 1], ["warp_row_tiles", "ot", 2], ["warp_col_tiles", "ot", 2], ["chunk", "ot", 8], ["offset", "ot", 0], ["offsetCS", "ot", 0], ["vec", "ot", 1], ["wmma_m", "ot", 32]]}, "result": [[1.7048621e-05], 0, 1.340024471282959, 1651930890.689584], "version": 0.2, "tvm_version": "0.8.0"}
{"input": ["cuda -keys=cuda,gpu -max_num_threads=1024 -thread_warp_size=32", "attn_v_pad_matmul.cuda", [["TENSOR", [32, 49, 49], "float16"], ["TENSOR", [32, 32, 49], "float16"]], {}], "config": {"index": 542, "code_hash": null, "entity": [["block_row_warps", "ot", 4], ["block_col_warps", "ot", 1], ["warp_row_tiles", "ot", 1], ["warp_col_tiles", "ot", 4], ["chunk", "ot", 4], ["offset", "ot", 8], ["offsetCS", "ot", 0], ["vec", "ot", 1], ["wmma_m", "ot", 32]]}, "result": [[8.22883930778739e-06], 0, 1.5668754577636719, 1651930891.2214484], "version": 0.2, "tvm_version": "0.8.0"}
{"input": ["cuda -keys=cuda,gpu -max_num_threads=1024 -thread_warp_size=32", "attn_v_pad_matmul.cuda", [["TENSOR", [32, 49, 49], "float16"], ["TENSOR", [32, 32, 49], "float16"]], {}], "config": {"index": 6334, "code_hash": null, "entity": [["block_row_warps", "ot", 2], ["block_col_warps", "ot", 4], ["warp_row_tiles", "ot", 2], ["warp_col_tiles", "ot", 1], ["chunk", "ot", 4], ["offset", "ot", 8], ["offsetCS", "ot", 8], ["vec", "ot", 1], ["wmma_m", "ot", 16]]}, "result": [[9.198346106304079e-06], 0, 1.465907096862793, 1651930892.8448079], "version": 0.2, "tvm_version": "0.8.0"}
{"input": ["cuda -keys=cuda,gpu -max_num_threads=1024 -thread_warp_size=32", "attn_v_pad_matmul.cuda", [["TENSOR", [32, 49, 49], "float16"], ["TENSOR", [32, 32, 49], "float16"]], {}], "config": {"index": 1347, "code_hash": null, "entity": [["block_row_warps", "ot", 1], ["block_col_warps", "ot", 4], ["warp_row_tiles", "ot", 4], ["warp_col_tiles", "ot", 2], ["chunk", "ot", 1], ["offset", "ot", 0], ["offsetCS", "ot", 0], ["vec", "ot", 2], ["wmma_m", "ot", 32]]}, "result": [[1.1006504e-05], 0, 1.5079333782196045, 1651930893.3369293], "version": 0.2, "tvm_version": "0.8.0"}
{"input": ["cuda -keys=cuda,gpu -max_num_threads=1024 -thread_warp_size=32", "attn_v_pad_matmul.cuda", [["TENSOR", [32, 49, 49], "float16"], ["TENSOR", [32, 32, 49], "float16"]], {}], "config": {"index": 6360, "code_hash": null, "entity": [["block_row_warps", "ot", 1], ["block_col_warps", "ot", 4], ["warp_row_tiles", "ot", 2], ["warp_col_tiles", "ot", 2], ["chunk", "ot", 4], ["offset", "ot", 8], ["offsetCS", "ot", 8], ["vec", "ot", 1], ["wmma_m", "ot", 16]]}, "result": [[6.603590234857849e-06], 0, 1.3872087001800537, 1651930894.5079153], "version": 0.2, "tvm_version": "0.8.0"}
{"input": ["cuda -keys=cuda,gpu -max_num_threads=1024 -thread_warp_size=32", "attn_v_pad_matmul.cuda", [["TENSOR", [32, 49, 49], "float16"], ["TENSOR", [32, 32, 49], "float16"]], {}], "config": {"index": 7253, "code_hash": null, "entity": [["block_row_warps", "ot", 4], ["block_col_warps", "ot", 4], ["warp_row_tiles", "ot", 2], ["warp_col_tiles", "ot", 2], ["chunk", "ot", 2], ["offset", "ot", 0], ["offsetCS", "ot", 8], ["vec", "ot", 2], ["wmma_m", "ot", 16]]}, "result": [[1.9149686e-05], 0, 1.5101561546325684, 1651930896.4532638], "version": 0.2, "tvm_version": "0.8.0"}
{"input": ["cuda -keys=cuda,gpu -max_num_threads=1024 -thread_warp_size=32", "attn_v_pad_matmul.cuda", [["TENSOR", [32, 49, 49], "float16"], ["TENSOR", [32, 32, 49], "float16"]], {}], "config": {"index": 7859, "code_hash": null, "entity": [["block_row_warps", "ot", 4], ["block_col_warps", "ot", 1], ["warp_row_tiles", "ot", 1], ["warp_col_tiles", "ot", 1], ["chunk", "ot", 2], ["offset", "ot", 0], ["offsetCS", "ot", 0], ["vec", "ot", 4], ["wmma_m", "ot", 16]]}, "result": [[1.0483206999999999e-05], 0, 1.4254505634307861, 1651930897.92622], "version": 0.2, "tvm_version": "0.8.0"}
{"input": ["cuda -keys=cuda,gpu -max_num_threads=1024 -thread_warp_size=32", "attn_v_pad_matmul.cuda", [["TENSOR", [32, 49, 49], "float16"], ["TENSOR", [32, 32, 49], "float16"]], {}], "config": {"index": 12013, "code_hash": null, "entity": [["block_row_warps", "ot", 2], ["block_col_warps", "ot", 4], ["warp_row_tiles", "ot", 4], ["warp_col_tiles", "ot", 1], ["chunk", "ot", 1], ["offset", "ot", 8], ["offsetCS", "ot", 0], ["vec", "ot", 2], ["wmma_m", "ot", 8]]}, "result": [[1.1660818999999999e-05], 0, 1.5206971168518066, 1651930899.6767519], "version": 0.2, "tvm_version": "0.8.0"}
{"input": ["cuda -keys=cuda,gpu -max_num_threads=1024 -thread_warp_size=32", "attn_v_pad_matmul.cuda", [["TENSOR", [32, 49, 49], "float16"], ["TENSOR", [32, 32, 49], "float16"]], {}], "config": {"index": 2817, "code_hash": null, "entity": [["block_row_warps", "ot", 1], ["block_col_warps", "ot", 1], ["warp_row_tiles", "ot", 2], ["warp_col_tiles", "ot", 4], ["chunk", "ot", 4], ["offset", "ot", 0], ["offsetCS", "ot", 0], ["vec", "ot", 4], ["wmma_m", "ot", 32]]}, "result": [[1.6559741e-05], 0, 1.2747690677642822, 1651930902.479418], "version": 0.2, "tvm_version": "0.8.0"}
{"input": ["cuda -keys=cuda,gpu -max_num_threads=1024 -thread_warp_size=32", "attn_v_pad_matmul.cuda", [["TENSOR", [32, 49, 49], "float16"], ["TENSOR", [32, 32, 49], "float16"]], {}], "config": {"index": 2740, "code_hash": null, "entity": [["block_row_warps", "ot", 2], ["block_col_warps", "ot", 2], ["warp_row_tiles", "ot", 2], ["warp_col_tiles", "ot", 4], ["chunk", "ot", 2], ["offset", "ot", 0], ["offsetCS", "ot", 0], ["vec", "ot", 4], ["wmma_m", "ot", 32]]}, "result": [[1.2545134e-05], 0, 1.3291444778442383, 1651930905.1321185], "version": 0.2, "tvm_version": "0.8.0"}
{"input": ["cuda -keys=cuda,gpu -max_num_threads=1024 -thread_warp_size=32", "attn_v_pad_matmul.cuda", [["TENSOR", [32, 49, 49], "float16"], ["TENSOR", [32, 32, 49], "float16"]], {}], "config": {"index": 1709, "code_hash": null, "entity": [["block_row_warps", "ot", 4], ["block_col_warps", "ot", 4], ["warp_row_tiles", "ot", 1], ["warp_col_tiles", "ot", 1], ["chunk", "ot", 2], ["offset", "ot", 8], ["offsetCS", "ot", 0], ["vec", "ot", 2], ["wmma_m", "ot", 32]]}, "result": [[2.1906551e-05], 0, 1.1914513111114502, 1651930905.5372841], "version": 0.2, "tvm_version": "0.8.0"}
{"input": ["cuda -keys=cuda,gpu -max_num_threads=1024 -thread_warp_size=32", "attn_v_pad_matmul.cuda", [["TENSOR", [32, 49, 49], "float16"], ["TENSOR", [32, 32, 49], "float16"]], {}], "config": {"index": 8941, "code_hash": null, "entity": [["block_row_warps", "ot", 2], ["block_col_warps", "ot", 2], ["warp_row_tiles", "ot", 1], ["warp_col_tiles", "ot", 2], ["chunk", "ot", 4], ["offset", "ot", 8], ["offsetCS", "ot", 8], ["vec", "ot", 4], ["wmma_m", "ot", 16]]}, "result": [[6.958674289245983e-06], 0, 1.4583687782287598, 1651930906.1951966], "version": 0.2, "tvm_version": "0.8.0"}
{"input": ["cuda -keys=cuda,gpu -max_num_threads=1024 -thread_warp_size=32", "attn_v_pad_matmul.cuda", [["TENSOR", [32, 49, 49], "float16"], ["TENSOR", [32, 32, 49], "float16"]], {}], "config": {"index": 7154, "code_hash": null, "entity": [["block_row_warps", "ot", 4], ["block_col_warps", "ot", 4], ["warp_row_tiles", "ot", 4], ["warp_col_tiles", "ot", 1], ["chunk", "ot", 1], ["offset", "ot", 0], ["offsetCS", "ot", 8], ["vec", "ot", 2], ["wmma_m", "ot", 16]]}, "result": [[1.8073811e-05], 0, 1.3430004119873047, 1651930907.8718238], "version": 0.2, "tvm_version": "0.8.0"}
{"input": ["cuda -keys=cuda,gpu -max_num_threads=1024 -thread_warp_size=32", "attn_v_pad_matmul.cuda", [["TENSOR", [32, 49, 49], "float16"], ["TENSOR", [32, 32, 49], "float16"]], {}], "config": {"index": 2182, "code_hash": null, "entity": [["block_row_warps", "ot", 2], ["block_col_warps", "ot", 2], ["warp_row_tiles", "ot", 4], ["warp_col_tiles", "ot", 4], ["chunk", "ot", 4], ["offset", "ot", 0], ["offsetCS", "ot", 8], ["vec", "ot", 2], ["wmma_m", "ot", 32]]}, "result": [[1.1856512e-05], 0, 1.540515661239624, 1651930909.511758], "version": 0.2, "tvm_version": "0.8.0"}
{"input": ["cuda -keys=cuda,gpu -max_num_threads=1024 -thread_warp_size=32", "attn_v_pad_matmul.cuda", [["TENSOR", [32, 49, 49], "float16"], ["TENSOR", [32, 32, 49], "float16"]], {}], "config": {"index": 9029, "code_hash": null, "entity": [["block_row_warps", "ot", 4], ["block_col_warps", "ot", 1], ["warp_row_tiles", "ot", 2], ["warp_col_tiles", "ot", 2], ["chunk", "ot", 8], ["offset", "ot", 8], ["offsetCS", "ot", 8], ["vec", "ot", 4], ["wmma_m", "ot", 16]]}, "result": [[8.529687886279358e-06], 0, 1.6694259643554688, 1651930911.2101953], "version": 0.2, "tvm_version": "0.8.0"}
{"input": ["cuda -keys=cuda,gpu -max_num_threads=1024 -thread_warp_size=32", "attn_v_pad_matmul.cuda", [["TENSOR", [32, 49, 49], "float16"], ["TENSOR", [32, 32, 49], "float16"]], {}], "config": {"index": 5554, "code_hash": null, "entity": [["block_row_warps", "ot", 2], ["block_col_warps", "ot", 1], ["warp_row_tiles", "ot", 4], ["warp_col_tiles", "ot", 2], ["chunk", "ot", 1], ["offset", "ot", 8], ["offsetCS", "ot", 0], ["vec", "ot", 1], ["wmma_m", "ot", 16]]}, "result": [[1.0306764e-05], 0, 1.2995190620422363, 1651930911.7728467], "version": 0.2, "tvm_version": "0.8.0"}
{"input": ["cuda -keys=cuda,gpu -max_num_threads=1024 -thread_warp_size=32", "attn_v_pad_matmul.cuda", [["TENSOR", [32, 49, 49], "float16"], ["TENSOR", [32, 32, 49], "float16"]], {}], "config": {"index": 46, "code_hash": null, "entity": [["block_row_warps", "ot", 2], ["block_col_warps", "ot", 1], ["warp_row_tiles", "ot", 4], ["warp_col_tiles", "ot", 2], ["chunk", "ot", 1], ["offset", "ot", 0], ["offsetCS", "ot", 0], ["vec", "ot", 1], ["wmma_m", "ot", 32]]}, "result": [[9.759395550061805e-06], 0, 1.4387719631195068, 1651930913.6182475], "version": 0.2, "tvm_version": "0.8.0"}
{"input": ["cuda -keys=cuda,gpu -max_num_threads=1024 -thread_warp_size=32", "attn_v_pad_matmul.cuda", [["TENSOR", [32, 49, 49], "float16"], ["TENSOR", [32, 32, 49], "float16"]], {}], "config": {"index": 10080, "code_hash": null, "entity": [["block_row_warps", "ot", 1], ["block_col_warps", "ot", 1], ["warp_row_tiles", "ot", 2], ["warp_col_tiles", "ot", 2], ["chunk", "ot", 1], ["offset", "ot", 8], ["offsetCS", "ot", 8], ["vec", "ot", 8], ["wmma_m", "ot", 16]]}, "result": [[1.0330301999999999e-05], 0, 1.177278995513916, 1651930914.070723], "version": 0.2, "tvm_version": "0.8.0"}
{"input": ["cuda -keys=cuda,gpu -max_num_threads=1024 -thread_warp_size=32", "attn_v_pad_matmul.cuda", [["TENSOR", [32, 49, 49], "float16"], ["TENSOR", [32, 32, 49], "float16"]], {}], "config": {"index": 9492, "code_hash": null, "entity": [["block_row_warps", "ot", 1], ["block_col_warps", "ot", 4], ["warp_row_tiles", "ot", 2], ["warp_col_tiles", "ot", 1], ["chunk", "ot", 2], ["offset", "ot", 8], ["offsetCS", "ot", 0], ["vec", "ot", 8], ["wmma_m", "ot", 16]]}, "result": [[1.105106e-05], 0, 1.0935914516448975, 1651930919.6443136], "version": 0.2, "tvm_version": "0.8.0"}
{"input": ["cuda -keys=cuda,gpu -max_num_threads=1024 -thread_warp_size=32", "attn_v_pad_matmul.cuda", [["TENSOR", [32, 49, 49], "float16"], ["TENSOR", [32, 32, 49], "float16"]], {}], "config": {"index": 3282, "code_hash": null, "entity": [["block_row_warps", "ot", 1], ["block_col_warps", "ot", 4], ["warp_row_tiles", "ot", 2], ["warp_col_tiles", "ot", 2], ["chunk", "ot", 1], ["offset", "ot", 0], ["offsetCS", "ot", 8], ["vec", "ot", 4], ["wmma_m", "ot", 32]]}, "result": [[1.2323892e-05], 0, 1.2696747779846191, 1651930920.1718876], "version": 0.2, "tvm_version": "0.8.0"}
{"input": ["cuda -keys=cuda,gpu -max_num_threads=1024 -thread_warp_size=32", "attn_v_pad_matmul.cuda", [["TENSOR", [32, 49, 49], "float16"], ["TENSOR", [32, 32, 49], "float16"]], {}], "config": {"index": 4061, "code_hash": null, "entity": [["block_row_warps", "ot", 4], ["block_col_warps", "ot", 1], ["warp_row_tiles", "ot", 2], ["warp_col_tiles", "ot", 1], ["chunk", "ot", 4], ["offset", "ot", 0], ["offsetCS", "ot", 0], ["vec", "ot", 8], ["wmma_m", "ot", 32]]}, "result": [[1.5560066e-05], 0, 1.2924261093139648, 1651930922.9192178], "version": 0.2, "tvm_version": "0.8.0"}
{"input": ["cuda -keys=cuda,gpu -max_num_threads=1024 -thread_warp_size=32", "attn_v_pad_matmul.cuda", [["TENSOR", [32, 49, 49], "float16"], ["TENSOR", [32, 32, 49], "float16"]], {}], "config": {"index": 9975, "code_hash": null, "entity": [["block_row_warps", "ot", 1], ["block_col_warps", "ot", 2], ["warp_row_tiles", "ot", 2], ["warp_col_tiles", "ot", 1], ["chunk", "ot", 8], ["offset", "ot", 0], ["offsetCS", "ot", 8], ["vec", "ot", 8], ["wmma_m", "ot", 16]]}, "result": [[1.1635616999999999e-05], 0, 1.0158743858337402, 1651930923.4341466], "version": 0.2, "tvm_version": "0.8.0"}
{"input": ["cuda -keys=cuda,gpu -max_num_threads=1024 -thread_warp_size=32", "attn_v_pad_matmul.cuda", [["TENSOR", [32, 49, 49], "float16"], ["TENSOR", [32, 32, 49], "float16"]], {}], "config": {"index": 635, "code_hash": null, "entity": [["block_row_warps", "ot", 4], ["block_col_warps", "ot", 2], ["warp_row_tiles", "ot", 2], ["warp_col_tiles", "ot", 4], ["chunk", "ot", 8], ["offset", "ot", 8], ["offsetCS", "ot", 0], ["vec", "ot", 1], ["wmma_m", "ot", 32]]}, "result": [[1.172574e-05], 0, 1.7323310375213623, 1651930925.3515499], "version": 0.2, "tvm_version": "0.8.0"}
{"input": ["cuda -keys=cuda,gpu -max_num_threads=1024 -thread_warp_size=32", "attn_v_pad_matmul.cuda", [["TENSOR", [32, 49, 49], "float16"], ["TENSOR", [32, 32, 49], "float16"]], {}], "config": {"index": 3167, "code_hash": null, "entity": [["block_row_warps", "ot", 4], ["block_col_warps", "ot", 4], ["warp_row_tiles", "ot", 1], ["warp_col_tiles", "ot", 1], ["chunk", "ot", 8], ["offset", "ot", 8], ["offsetCS", "ot", 0], ["vec", "ot", 4], ["wmma_m", "ot", 32]]}, "result": [[2.5470972e-05], 0, 1.4942677021026611, 1651930926.943501], "version": 0.2, "tvm_version": "0.8.0"}
{"input": ["cuda -keys=cuda,gpu -max_num_threads=1024 -thread_warp_size=32", "attn_v_pad_matmul.cuda", [["TENSOR", [32, 49, 49], "float16"], ["TENSOR", [32, 32, 49], "float16"]], {}], "config": {"index": 3452, "code_hash": null, "entity": [["block_row_warps", "ot", 4], ["block_col_warps", "ot", 2], ["warp_row_tiles", "ot", 4], ["warp_col_tiles", "ot", 2], ["chunk", "ot", 4], ["offset", "ot", 0], ["offsetCS", "ot", 8], ["vec", "ot", 4], ["wmma_m", "ot", 32]]}, "result": [[2.2550793e-05], 0, 1.46016526222229, 1651930928.4882395], "version": 0.2, "tvm_version": "0.8.0"}
{"input": ["cuda -keys=cuda,gpu -max_num_threads=1024 -thread_warp_size=32", "attn_v_pad_matmul.cuda", [["TENSOR", [32, 49, 49], "float16"], ["TENSOR", [32, 32, 49], "float16"]], {}], "config": {"index": 14743, "code_hash": null, "entity": [["block_row_warps", "ot", 2], ["block_col_warps", "ot", 1], ["warp_row_tiles", "ot", 1], ["warp_col_tiles", "ot", 1], ["chunk", "ot", 4], ["offset", "ot", 8], ["offsetCS", "ot", 0], ["vec", "ot", 8], ["wmma_m", "ot", 8]]}, "result": [[8.934780593325092e-06], 0, 1.3705148696899414, 1651930929.1502464], "version": 0.2, "tvm_version": "0.8.0"}
{"input": ["cuda -keys=cuda,gpu -max_num_threads=1024 -thread_warp_size=32", "attn_v_pad_matmul.cuda", [["TENSOR", [32, 49, 49], "float16"], ["TENSOR", [32, 32, 49], "float16"]], {}], "config": {"index": 3447, "code_hash": null, "entity": [["block_row_warps", "ot", 1], ["block_col_warps", "ot", 1], ["warp_row_tiles", "ot", 4], ["warp_col_tiles", "ot", 2], ["chunk", "ot", 4], ["offset", "ot", 0], ["offsetCS", "ot", 8], ["vec", "ot", 4], ["wmma_m", "ot", 32]]}, "result": [[1.5376224e-05], 0, 1.3274214267730713, 1651930930.72871], "version": 0.2, "tvm_version": "0.8.0"}
{"input": ["cuda -keys=cuda,gpu -max_num_threads=1024 -thread_warp_size=32", "attn_v_pad_matmul.cuda", [["TENSOR", [32, 49, 49], "float16"], ["TENSOR", [32, 32, 49], "float16"]], {}], "config": {"index": 10463, "code_hash": null, "entity": [["block_row_warps", "ot", 4], ["block_col_warps", "ot", 2], ["warp_row_tiles", "ot", 2], ["warp_col_tiles", "ot", 1], ["chunk", "ot", 2], ["offset", "ot", 0], ["offsetCS", "ot", 0], ["vec", "ot", 1], ["wmma_m", "ot", 8]]}, "result": [[1.9117053999999998e-05], 0, 1.6794567108154297, 1651930932.218001], "version": 0.2, "tvm_version": "0.8.0"}
{"input": ["cuda -keys=cuda,gpu -max_num_threads=1024 -thread_warp_size=32", "attn_v_pad_matmul.cuda", [["TENSOR", [32, 49, 49], "float16"], ["TENSOR", [32, 32, 49], "float16"]], {}], "config": {"index": 5182, "code_hash": null, "entity": [["block_row_warps", "ot", 2], ["block_col_warps", "ot", 4], ["warp_row_tiles", "ot", 4], ["warp_col_tiles", "ot", 4], ["chunk", "ot", 8], ["offset", "ot", 8], ["offsetCS", "ot", 8], ["vec", "ot", 8], ["wmma_m", "ot", 32]]}, "result": [[1.2642925999999998e-05], 0, 1.4665167331695557, 1651930932.834495], "version": 0.2, "tvm_version": "0.8.0"}
{"input": ["cuda -keys=cuda,gpu -max_num_threads=1024 -thread_warp_size=32", "attn_v_pad_matmul.cuda", [["TENSOR", [32, 49, 49], "float16"], ["TENSOR", [32, 32, 49], "float16"]], {}], "config": {"index": 5549, "code_hash": null, "entity": [["block_row_warps", "ot", 4], ["block_col_warps", "ot", 2], ["warp_row_tiles", "ot", 2], ["warp_col_tiles", "ot", 2], ["chunk", "ot", 1], ["offset", "ot", 8], ["offsetCS", "ot", 0], ["vec", "ot", 1], ["wmma_m", "ot", 16]]}, "result": [[1.1151709000000002e-05], 0, 1.7649071216583252, 1651930934.4837732], "version": 0.2, "tvm_version": "0.8.0"}
{"input": ["cuda -keys=cuda,gpu -max_num_threads=1024 -thread_warp_size=32", "attn_v_pad_matmul.cuda", [["TENSOR", [32, 49, 49], "float16"], ["TENSOR", [32, 32, 49], "float16"]], {}], "config": {"index": 1835, "code_hash": null, "entity": [["block_row_warps", "ot", 4], ["block_col_warps", "ot", 4], ["warp_row_tiles", "ot", 4], ["warp_col_tiles", "ot", 2], ["chunk", "ot", 4], ["offset", "ot", 8], ["offsetCS", "ot", 0], ["vec", "ot", 2], ["wmma_m", "ot", 32]]}, "result": [[1.7656624999999998e-05], 0, 1.550323724746704, 1651930935.2185555], "version": 0.2, "tvm_version": "0.8.0"}
{"input": ["cuda -keys=cuda,gpu -max_num_threads=1024 -thread_warp_size=32", "attn_v_pad_matmul.cuda", [["TENSOR", [32, 49, 49], "float16"], ["TENSOR", [32, 32, 49], "float16"]], {}], "config": {"index": 1424, "code_hash": null, "entity": [["block_row_warps", "ot", 4], ["block_col_warps", "ot", 1], ["warp_row_tiles", "ot", 4], ["warp_col_tiles", "ot", 2], ["chunk", "ot", 2], ["offset", "ot", 0], ["offsetCS", "ot", 0], ["vec", "ot", 2], ["wmma_m", "ot", 32]]}, "result": [[8.841880716934486e-06], 0, 1.5419907569885254, 1651930936.8765352], "version": 0.2, "tvm_version": "0.8.0"}
{"input": ["cuda -keys=cuda,gpu -max_num_threads=1024 -thread_warp_size=32", "attn_v_pad_matmul.cuda", [["TENSOR", [32, 49, 49], "float16"], ["TENSOR", [32, 32, 49], "float16"]], {}], "config": {"index": 4551, "code_hash": null, "entity": [["block_row_warps", "ot", 1], ["block_col_warps", "ot", 4], ["warp_row_tiles", "ot", 2], ["warp_col_tiles", "ot", 1], ["chunk", "ot", 1], ["offset", "ot", 0], ["offsetCS", "ot", 8], ["vec", "ot", 8], ["wmma_m", "ot", 32]]}, "result": [[2.4927816e-05], 0, 1.5708503723144531, 1651930937.5417619], "version": 0.2, "tvm_version": "0.8.0"}
{"input": ["cuda -keys=cuda,gpu -max_num_threads=1024 -thread_warp_size=32", "attn_v_pad_matmul.cuda", [["TENSOR", [32, 49, 49], "float16"], ["TENSOR", [32, 32, 49], "float16"]], {}], "config": {"index": 3132, "code_hash": null, "entity": [["block_row_warps", "ot", 1], ["block_col_warps", "ot", 1], ["warp_row_tiles", "ot", 1], ["warp_col_tiles", "ot", 4], ["chunk", "ot", 4], ["offset", "ot", 8], ["offsetCS", "ot", 0], ["vec", "ot", 4], ["wmma_m", "ot", 32]]}, "result": [[9.273718788627935e-06], 0, 1.461958646774292, 1651930939.268388], "version": 0.2, "tvm_version": "0.8.0"}
{"input": ["cuda -keys=cuda,gpu -max_num_threads=1024 -thread_warp_size=32", "attn_v_pad_matmul.cuda", [["TENSOR", [32, 49, 49], "float16"], ["TENSOR", [32, 32, 49], "float16"]], {}], "config": {"index": 5556, "code_hash": null, "entity": [["block_row_warps", "ot", 1], ["block_col_warps", "ot", 2], ["warp_row_tiles", "ot", 4], ["warp_col_tiles", "ot", 2], ["chunk", "ot", 1], ["offset", "ot", 8], ["offsetCS", "ot", 0], ["vec", "ot", 1], ["wmma_m", "ot", 16]]}, "result": [[9.874599505562422e-06], 0, 1.3355119228363037, 1651930939.6970668], "version": 0.2, "tvm_version": "0.8.0"}
{"input": ["cuda -keys=cuda,gpu -max_num_threads=1024 -thread_warp_size=32", "attn_v_pad_matmul.cuda", [["TENSOR", [32, 49, 49], "float16"], ["TENSOR", [32, 32, 49], "float16"]], {}], "config": {"index": 7100, "code_hash": null, "entity": [["block_row_warps", "ot", 4], ["block_col_warps", "ot", 4], ["warp_row_tiles", "ot", 4], ["warp_col_tiles", "ot", 2], ["chunk", "ot", 8], ["offset", "ot", 8], ["offsetCS", "ot", 0], ["vec", "ot", 2], ["wmma_m", "ot", 16]]}, "result": [[1.6817066000000002e-05], 0, 1.5927412509918213, 1651930941.6314957], "version": 0.2, "tvm_version": "0.8.0"}
{"input": ["cuda -keys=cuda,gpu -max_num_threads=1024 -thread_warp_size=32", "attn_v_pad_matmul.cuda", [["TENSOR", [32, 49, 49], "float16"], ["TENSOR", [32, 32, 49], "float16"]], {}], "config": {"index": 9759, "code_hash": null, "entity": [["block_row_warps", "ot", 1], ["block_col_warps", "ot", 2], ["warp_row_tiles", "ot", 2], ["warp_col_tiles", "ot", 2], ["chunk", "ot", 1], ["offset", "ot", 0], ["offsetCS", "ot", 8], ["vec", "ot", 8], ["wmma_m", "ot", 16]]}, "result": [[9.197406056860323e-06], 0, 1.3328900337219238, 1651930942.140679], "version": 0.2, "tvm_version": "0.8.0"}
{"input": ["cuda -keys=cuda,gpu -max_num_threads=1024 -thread_warp_size=32", "attn_v_pad_matmul.cuda", [["TENSOR", [32, 49, 49], "float16"], ["TENSOR", [32, 32, 49], "float16"]], {}], "config": {"index": 1985, "code_hash": null, "entity": [["block_row_warps", "ot", 4], ["block_col_warps", "ot", 2], ["warp_row_tiles", "ot", 2], ["warp_col_tiles", "ot", 2], ["chunk", "ot", 1], ["offset", "ot", 0], ["offsetCS", "ot", 8], ["vec", "ot", 2], ["wmma_m", "ot", 32]]}, "result": [[1.2614218999999999e-05], 0, 1.900773048400879, 1651930943.9159503], "version": 0.2, "tvm_version": "0.8.0"}
{"input": ["cuda -keys=cuda,gpu -max_num_threads=1024 -thread_warp_size=32", "attn_v_pad_matmul.cuda", [["TENSOR", [32, 49, 49], "float16"], ["TENSOR", [32, 32, 49], "float16"]], {}], "config": {"index": 9422, "code_hash": null, "entity": [["block_row_warps", "ot", 4], ["block_col_warps", "ot", 4], ["warp_row_tiles", "ot", 4], ["warp_col_tiles", "ot", 1], ["chunk", "ot", 1], ["offset", "ot", 8], ["offsetCS", "ot", 0], ["vec", "ot", 8], ["wmma_m", "ot", 16]]}, "result": [[4.4327472e-05], 0, 1.7187988758087158, 1651930945.6328719], "version": 0.2, "tvm_version": "0.8.0"}
{"input": ["cuda -keys=cuda,gpu -max_num_threads=1024 -thread_warp_size=32", "attn_v_pad_matmul.cuda", [["TENSOR", [32, 49, 49], "float16"], ["TENSOR", [32, 32, 49], "float16"]], {}], "config": {"index": 378, "code_hash": null, "entity": [["block_row_warps", "ot", 1], ["block_col_warps", "ot", 1], ["warp_row_tiles", "ot", 1], ["warp_col_tiles", "ot", 4], ["chunk", "ot", 1], ["offset", "ot", 8], ["offsetCS", "ot", 0], ["vec", "ot", 1], ["wmma_m", "ot", 32]]}, "result": [[6.005707082833134e-06], 0, 1.5540783405303955, 1651930946.3604155], "version": 0.2, "tvm_version": "0.8.0"}
{"input": ["cuda -keys=cuda,gpu -max_num_threads=1024 -thread_warp_size=32", "attn_v_pad_matmul.cuda", [["TENSOR", [32, 49, 49], "float16"], ["TENSOR", [32, 32, 49], "float16"]], {}], "config": {"index": 2239, "code_hash": null, "entity": [["block_row_warps", "ot", 2], ["block_col_warps", "ot", 4], ["warp_row_tiles", "ot", 4], ["warp_col_tiles", "ot", 2], ["chunk", "ot", 8], ["offset", "ot", 0], ["offsetCS", "ot", 8], ["vec", "ot", 2], ["wmma_m", "ot", 32]]}, "result": [[2.1694423e-05], 0, 1.5851900577545166, 1651930948.0001667], "version": 0.2, "tvm_version": "0.8.0"}
{"input": ["cuda -keys=cuda,gpu -max_num_threads=1024 -thread_warp_size=32", "attn_v_pad_matmul.cuda", [["TENSOR", [32, 49, 49], "float16"], ["TENSOR", [32, 32, 49], "float16"]], {}], "config": {"index": 2110, "code_hash": null, "entity": [["block_row_warps", "ot", 2], ["block_col_warps", "ot", 2], ["warp_row_tiles", "ot", 1], ["warp_col_tiles", "ot", 1], ["chunk", "ot", 4], ["offset", "ot", 0], ["offsetCS", "ot", 8], ["vec", "ot", 2], ["wmma_m", "ot", 32]]}, "result": [[1.4216863e-05], 0, 1.4552223682403564, 1651930948.6750524], "version": 0.2, "tvm_version": "0.8.0"}
{"input": ["cuda -keys=cuda,gpu -max_num_threads=1024 -thread_warp_size=32", "attn_v_pad_matmul.cuda", [["TENSOR", [32, 49, 49], "float16"], ["TENSOR", [32, 32, 49], "float16"]], {}], "config": {"index": 9435, "code_hash": null, "entity": [["block_row_warps", "ot", 1], ["block_col_warps", "ot", 2], ["warp_row_tiles", "ot", 2], ["warp_col_tiles", "ot", 2], ["chunk", "ot", 1], ["offset", "ot", 8], ["offsetCS", "ot", 0], ["vec", "ot", 8], ["wmma_m", "ot", 16]]}, "result": [[9.70118108776267e-06], 0, 1.4324102401733398, 1651930950.450878], "version": 0.2, "tvm_version": "0.8.0"}
{"input": ["cuda -keys=cuda,gpu -max_num_threads=1024 -thread_warp_size=32", "attn_v_pad_matmul.cuda", [["TENSOR", [32, 49, 49], "float16"], ["TENSOR", [32, 32, 49], "float16"]], {}], "config": {"index": 1473, "code_hash": null, "entity": [["block_row_warps", "ot", 1], ["block_col_warps", "ot", 4], ["warp_row_tiles", "ot", 2], ["warp_col_tiles", "ot", 1], ["chunk", "ot", 4], ["offset", "ot", 0], ["offsetCS", "ot", 0], ["vec", "ot", 2], ["wmma_m", "ot", 32]]}, "result": [[1.9901201e-05], 0, 1.4294815063476562, 1651930951.0874207], "version": 0.2, "tvm_version": "0.8.0"}
{"input": ["cuda -keys=cuda,gpu -max_num_threads=1024 -thread_warp_size=32", "attn_v_pad_matmul.cuda", [["TENSOR", [32, 49, 49], "float16"], ["TENSOR", [32, 32, 49], "float16"]], {}], "config": {"index": 3751, "code_hash": null, "entity": [["block_row_warps", "ot", 2], ["block_col_warps", "ot", 4], ["warp_row_tiles", "ot", 4], ["warp_col_tiles", "ot", 1], ["chunk", "ot", 4], ["offset", "ot", 8], ["offsetCS", "ot", 8], ["vec", "ot", 4], ["wmma_m", "ot", 32]]}, "result": [[1.5158978e-05], 0, 1.4403281211853027, 1651930952.5812037], "version": 0.2, "tvm_version": "0.8.0"}
{"input": ["cuda -keys=cuda,gpu -max_num_threads=1024 -thread_warp_size=32", "attn_v_pad_matmul.cuda", [["TENSOR", [32, 49, 49], "float16"], ["TENSOR", [32, 32, 49], "float16"]], {}], "config": {"index": 507, "code_hash": null, "entity": [["block_row_warps", "ot", 1], ["block_col_warps", "ot", 2], ["warp_row_tiles", "ot", 4], ["warp_col_tiles", "ot", 1], ["chunk", "ot", 4], ["offset", "ot", 8], ["offsetCS", "ot", 0], ["vec", "ot", 1], ["wmma_m", "ot", 32]]}, "result": [[1.1023616e-05], 0, 1.4174551963806152, 1651930954.1238966], "version": 0.2, "tvm_version": "0.8.0"}
{"input": ["cuda -keys=cuda,gpu -max_num_threads=1024 -thread_warp_size=32", "attn_v_pad_matmul.cuda", [["TENSOR", [32, 49, 49], "float16"], ["TENSOR", [32, 32, 49], "float16"]], {}], "config": {"index": 11446, "code_hash": null, "entity": [["block_row_warps", "ot", 2], ["block_col_warps", "ot", 4], ["warp_row_tiles", "ot", 4], ["warp_col_tiles", "ot", 1], ["chunk", "ot", 2], ["offset", "ot", 8], ["offsetCS", "ot", 8], ["vec", "ot", 1], ["wmma_m", "ot", 8]]}, "result": [[1.0052667e-05], 0, 1.5326855182647705, 1651930954.8065894], "version": 0.2, "tvm_version": "0.8.0"}
{"input": ["cuda -keys=cuda,gpu -max_num_threads=1024 -thread_warp_size=32", "attn_v_pad_matmul.cuda", [["TENSOR", [32, 49, 49], "float16"], ["TENSOR", [32, 32, 49], "float16"]], {}], "config": {"index": 10460, "code_hash": null, "entity": [["block_row_warps", "ot", 4], ["block_col_warps", "ot", 1], ["warp_row_tiles", "ot", 2], ["warp_col_tiles", "ot", 1], ["chunk", "ot", 2], ["offset", "ot", 0], ["offsetCS", "ot", 0], ["vec", "ot", 1], ["wmma_m", "ot", 8]]}, "result": [[1.2559449000000001e-05], 0, 1.2739546298980713, 1651930956.354817], "version": 0.2, "tvm_version": "0.8.0"}
{"input": ["cuda -keys=cuda,gpu -max_num_threads=1024 -thread_warp_size=32", "attn_v_pad_matmul.cuda", [["TENSOR", [32, 49, 49], "float16"], ["TENSOR", [32, 32, 49], "float16"]], {}], "config": {"index": 14181, "code_hash": null, "entity": [["block_row_warps", "ot", 1], ["block_col_warps", "ot", 4], ["warp_row_tiles", "ot", 1], ["warp_col_tiles", "ot", 1], ["chunk", "ot", 8], ["offset", "ot", 8], ["offsetCS", "ot", 8], ["vec", "ot", 4], ["wmma_m", "ot", 8]]}, "result": [[7.5219456118665015e-06], 0, 1.2972910404205322, 1651930956.7967832], "version": 0.2, "tvm_version": "0.8.0"}
{"input": ["cuda -keys=cuda,gpu -max_num_threads=1024 -thread_warp_size=32", "attn_v_pad_matmul.cuda", [["TENSOR", [32, 49, 49], "float16"], ["TENSOR", [32, 32, 49], "float16"]], {}], "config": {"index": 10451, "code_hash": null, "entity": [["block_row_warps", "ot", 4], ["block_col_warps", "ot", 1], ["warp_row_tiles", "ot", 1], ["warp_col_tiles", "ot", 1], ["chunk", "ot", 2], ["offset", "ot", 0], ["offsetCS", "ot", 0], ["vec", "ot", 1], ["wmma_m", "ot", 8]]}, "result": [[1.0927799999999999e-05], 0, 1.3094661235809326, 1651931001.3986628], "version": 0.2, "tvm_version": "0.8.0"}
{"input": ["cuda -keys=cuda,gpu -max_num_threads=1024 -thread_warp_size=32", "attn_v_pad_matmul.cuda", [["TENSOR", [32, 49, 49], "float16"], ["TENSOR", [32, 32, 49], "float16"]], {}], "config": {"index": 11423, "code_hash": null, "entity": [["block_row_warps", "ot", 4], ["block_col_warps", "ot", 1], ["warp_row_tiles", "ot", 1], ["warp_col_tiles", "ot", 1], ["chunk", "ot", 2], ["offset", "ot", 8], ["offsetCS", "ot", 8], ["vec", "ot", 1], ["wmma_m", "ot", 8]]}, "result": [[8.755993819530285e-06], 0, 1.118849754333496, 1651931001.8995922], "version": 0.2, "tvm_version": "0.8.0"}
{"input": ["cuda -keys=cuda,gpu -max_num_threads=1024 -thread_warp_size=32", "attn_v_pad_matmul.cuda", [["TENSOR", [32, 49, 49], "float16"], ["TENSOR", [32, 32, 49], "float16"]], {}], "config": {"index": 11102, "code_hash": null, "entity": [["block_row_warps", "ot", 4], ["block_col_warps", "ot", 2], ["warp_row_tiles", "ot", 1], ["warp_col_tiles", "ot", 1], ["chunk", "ot", 2], ["offset", "ot", 0], ["offsetCS", "ot", 8], ["vec", "ot", 1], ["wmma_m", "ot", 8]]}, "result": [[1.4637723e-05], 0, 1.064469575881958, 1651931002.4221594], "version": 0.2, "tvm_version": "0.8.0"}
{"input": ["cuda -keys=cuda,gpu -max_num_threads=1024 -thread_warp_size=32", "attn_v_pad_matmul.cuda", [["TENSOR", [32, 49, 49], "float16"], ["TENSOR", [32, 32, 49], "float16"]], {}], "config": {"index": 11426, "code_hash": null, "entity": [["block_row_warps", "ot", 4], ["block_col_warps", "ot", 2], ["warp_row_tiles", "ot", 1], ["warp_col_tiles", "ot", 1], ["chunk", "ot", 2], ["offset", "ot", 8], ["offsetCS", "ot", 8], ["vec", "ot", 1], ["wmma_m", "ot", 8]]}, "result": [[9.730504944375773e-06], 0, 0.9751532077789307, 1651931002.871534], "version": 0.2, "tvm_version": "0.8.0"}
{"input": ["cuda -keys=cuda,gpu -max_num_threads=1024 -thread_warp_size=32", "attn_v_pad_matmul.cuda", [["TENSOR", [32, 49, 49], "float16"], ["TENSOR", [32, 32, 49], "float16"]], {}], "config": {"index": 10775, "code_hash": null, "entity": [["block_row_warps", "ot", 4], ["block_col_warps", "ot", 1], ["warp_row_tiles", "ot", 1], ["warp_col_tiles", "ot", 1], ["chunk", "ot", 2], ["offset", "ot", 8], ["offsetCS", "ot", 0], ["vec", "ot", 1], ["wmma_m", "ot", 8]]}, "result": [[8.672471569839307e-06], 0, 1.4235434532165527, 1651931003.510923], "version": 0.2, "tvm_version": "0.8.0"}
{"input": ["cuda -keys=cuda,gpu -max_num_threads=1024 -thread_warp_size=32", "attn_v_pad_matmul.cuda", [["TENSOR", [32, 49, 49], "float16"], ["TENSOR", [32, 32, 49], "float16"]], {}], "config": {"index": 10778, "code_hash": null, "entity": [["block_row_warps", "ot", 4], ["block_col_warps", "ot", 2], ["warp_row_tiles", "ot", 1], ["warp_col_tiles", "ot", 1], ["chunk", "ot", 2], ["offset", "ot", 8], ["offsetCS", "ot", 0], ["vec", "ot", 1], ["wmma_m", "ot", 8]]}, "result": [[9.947562422744127e-06], 0, 1.2455596923828125, 1651931004.0935273], "version": 0.2, "tvm_version": "0.8.0"}
{"input": ["cuda -keys=cuda,gpu -max_num_threads=1024 -thread_warp_size=32", "attn_v_pad_matmul.cuda", [["TENSOR", [32, 49, 49], "float16"], ["TENSOR", [32, 32, 49], "float16"]], {}], "config": {"index": 11099, "code_hash": null, "entity": [["block_row_warps", "ot", 4], ["block_col_warps", "ot", 1], ["warp_row_tiles", "ot", 1], ["warp_col_tiles", "ot", 1], ["chunk", "ot", 2], ["offset", "ot", 0], ["offsetCS", "ot", 8], ["vec", "ot", 1], ["wmma_m", "ot", 8]]}, "result": [[1.0804563e-05], 0, 1.0260188579559326, 1651931004.545622], "version": 0.2, "tvm_version": "0.8.0"}
{"input": ["cuda -keys=cuda,gpu -max_num_threads=1024 -thread_warp_size=32", "attn_v_pad_matmul.cuda", [["TENSOR", [32, 49, 49], "float16"], ["TENSOR", [32, 32, 49], "float16"]], {}], "config": {"index": 10454, "code_hash": null, "entity": [["block_row_warps", "ot", 4], ["block_col_warps", "ot", 2], ["warp_row_tiles", "ot", 1], ["warp_col_tiles", "ot", 1], ["chunk", "ot", 2], ["offset", "ot", 0], ["offsetCS", "ot", 0], ["vec", "ot", 1], ["wmma_m", "ot", 8]]}, "result": [[1.4898811e-05], 0, 1.1718506813049316, 1651931005.100064], "version": 0.2, "tvm_version": "0.8.0"}
{"input": ["cuda -keys=cuda,gpu -max_num_threads=1024 -thread_warp_size=32", "attn_v_pad_matmul.cuda", [["TENSOR", [32, 49, 49], "float16"], ["TENSOR", [32, 32, 49], "float16"]], {}], "config": {"index": 5190, "code_hash": null, "entity": [["block_row_warps", "ot", 1], ["block_col_warps", "ot", 4], ["warp_row_tiles", "ot", 1], ["warp_col_tiles", "ot", 1], ["chunk", "ot", 1], ["offset", "ot", 0], ["offsetCS", "ot", 0], ["vec", "ot", 1], ["wmma_m", "ot", 16]]}, "result": [[8.160414091470951e-06], 0, 1.4271886348724365, 1651931005.884928], "version": 0.2, "tvm_version": "0.8.0"}
{"input": ["cuda -keys=cuda,gpu -max_num_threads=1024 -thread_warp_size=32", "attn_v_pad_matmul.cuda", [["TENSOR", [32, 49, 49], "float16"], ["TENSOR", [32, 32, 49], "float16"]], {}], "config": {"index": 5838, "code_hash": null, "entity": [["block_row_warps", "ot", 1], ["block_col_warps", "ot", 4], ["warp_row_tiles", "ot", 1], ["warp_col_tiles", "ot", 1], ["chunk", "ot", 1], ["offset", "ot", 0], ["offsetCS", "ot", 8], ["vec", "ot", 1], ["wmma_m", "ot", 16]]}, "result": [[8.033304079110012e-06], 0, 0.9326896667480469, 1651931006.2718172], "version": 0.2, "tvm_version": "0.8.0"}
{"input": ["cuda -keys=cuda,gpu -max_num_threads=1024 -thread_warp_size=32", "attn_v_pad_matmul.cuda", [["TENSOR", [32, 49, 49], "float16"], ["TENSOR", [32, 32, 49], "float16"]], {}], "config": {"index": 5514, "code_hash": null, "entity": [["block_row_warps", "ot", 1], ["block_col_warps", "ot", 4], ["warp_row_tiles", "ot", 1], ["warp_col_tiles", "ot", 1], ["chunk", "ot", 1], ["offset", "ot", 8], ["offsetCS", "ot", 0], ["vec", "ot", 1], ["wmma_m", "ot", 16]]}, "result": [[8.377973423980224e-06], 0, 1.1695034503936768, 1651931006.791256], "version": 0.2, "tvm_version": "0.8.0"}
{"input": ["cuda -keys=cuda,gpu -max_num_threads=1024 -thread_warp_size=32", "attn_v_pad_matmul.cuda", [["TENSOR", [32, 49, 49], "float16"], ["TENSOR", [32, 32, 49], "float16"]], {}], "config": {"index": 5835, "code_hash": null, "entity": [["block_row_warps", "ot", 1], ["block_col_warps", "ot", 2], ["warp_row_tiles", "ot", 1], ["warp_col_tiles", "ot", 1], ["chunk", "ot", 1], ["offset", "ot", 0], ["offsetCS", "ot", 8], ["vec", "ot", 1], ["wmma_m", "ot", 16]]}, "result": [[8.20355933250927e-06], 0, 1.1555280685424805, 1651931007.3625956], "version": 0.2, "tvm_version": "0.8.0"}
{"input": ["cuda -keys=cuda,gpu -max_num_threads=1024 -thread_warp_size=32", "attn_v_pad_matmul.cuda", [["TENSOR", [32, 49, 49], "float16"], ["TENSOR", [32, 32, 49], "float16"]], {}], "config": {"index": 6159, "code_hash": null, "entity": [["block_row_warps", "ot", 1], ["block_col_warps", "ot", 2], ["warp_row_tiles", "ot", 1], ["warp_col_tiles", "ot", 1], ["chunk", "ot", 1], ["offset", "ot", 8], ["offsetCS", "ot", 8], ["vec", "ot", 1], ["wmma_m", "ot", 16]]}, "result": [[8.012714462299134e-06], 0, 1.1209681034088135, 1651931007.859023], "version": 0.2, "tvm_version": "0.8.0"}
{"input": ["cuda -keys=cuda,gpu -max_num_threads=1024 -thread_warp_size=32", "attn_v_pad_matmul.cuda", [["TENSOR", [32, 49, 49], "float16"], ["TENSOR", [32, 32, 49], "float16"]], {}], "config": {"index": 5187, "code_hash": null, "entity": [["block_row_warps", "ot", 1], ["block_col_warps", "ot", 2], ["warp_row_tiles", "ot", 1], ["warp_col_tiles", "ot", 1], ["chunk", "ot", 1], ["offset", "ot", 0], ["offsetCS", "ot", 0], ["vec", "ot", 1], ["wmma_m", "ot", 16]]}, "result": [[8.601721878862794e-06], 0, 1.2222676277160645, 1651931008.5406568], "version": 0.2, "tvm_version": "0.8.0"}
{"input": ["cuda -keys=cuda,gpu -max_num_threads=1024 -thread_warp_size=32", "attn_v_pad_matmul.cuda", [["TENSOR", [32, 49, 49], "float16"], ["TENSOR", [32, 32, 49], "float16"]], {}], "config": {"index": 6162, "code_hash": null, "entity": [["block_row_warps", "ot", 1], ["block_col_warps", "ot", 4], ["warp_row_tiles", "ot", 1], ["warp_col_tiles", "ot", 1], ["chunk", "ot", 1], ["offset", "ot", 8], ["offsetCS", "ot", 8], ["vec", "ot", 1], ["wmma_m", "ot", 16]]}, "result": [[8.109370828182942e-06], 0, 1.1140515804290771, 1651931009.0091832], "version": 0.2, "tvm_version": "0.8.0"}
{"input": ["cuda -keys=cuda,gpu -max_num_threads=1024 -thread_warp_size=32", "attn_v_pad_matmul.cuda", [["TENSOR", [32, 49, 49], "float16"], ["TENSOR", [32, 32, 49], "float16"]], {}], "config": {"index": 11427, "code_hash": null, "entity": [["block_row_warps", "ot", 1], ["block_col_warps", "ot", 4], ["warp_row_tiles", "ot", 1], ["warp_col_tiles", "ot", 1], ["chunk", "ot", 2], ["offset", "ot", 8], ["offsetCS", "ot", 8], ["vec", "ot", 1], ["wmma_m", "ot", 8]]}, "result": [[7.402262051915946e-06], 0, 1.053105354309082, 1651931009.5006409], "version": 0.2, "tvm_version": "0.8.0"}
{"input": ["cuda -keys=cuda,gpu -max_num_threads=1024 -thread_warp_size=32", "attn_v_pad_matmul.cuda", [["TENSOR", [32, 49, 49], "float16"], ["TENSOR", [32, 32, 49], "float16"]], {}], "config": {"index": 10449, "code_hash": null, "entity": [["block_row_warps", "ot", 1], ["block_col_warps", "ot", 1], ["warp_row_tiles", "ot", 1], ["warp_col_tiles", "ot", 1], ["chunk", "ot", 2], ["offset", "ot", 0], ["offsetCS", "ot", 0], ["vec", "ot", 1], ["wmma_m", "ot", 8]]}, "result": [[7.610592707045735e-06], 0, 1.1827170848846436, 1651931010.0672677], "version": 0.2, "tvm_version": "0.8.0"}
{"input": ["cuda -keys=cuda,gpu -max_num_threads=1024 -thread_warp_size=32", "attn_v_pad_matmul.cuda", [["TENSOR", [32, 49, 49], "float16"], ["TENSOR", [32, 32, 49], "float16"]], {}], "config": {"index": 10779, "code_hash": null, "entity": [["block_row_warps", "ot", 1], ["block_col_warps", "ot", 4], ["warp_row_tiles", "ot", 1], ["warp_col_tiles", "ot", 1], ["chunk", "ot", 2], ["offset", "ot", 8], ["offsetCS", "ot", 0], ["vec", "ot", 1], ["wmma_m", "ot", 8]]}, "result": [[7.779254017305316e-06], 0, 1.202866554260254, 1651931010.7188127], "version": 0.2, "tvm_version": "0.8.0"}
{"input": ["cuda -keys=cuda,gpu -max_num_threads=1024 -thread_warp_size=32", "attn_v_pad_matmul.cuda", [["TENSOR", [32, 49, 49], "float16"], ["TENSOR", [32, 32, 49], "float16"]], {}], "config": {"index": 11100, "code_hash": null, "entity": [["block_row_warps", "ot", 1], ["block_col_warps", "ot", 2], ["warp_row_tiles", "ot", 1], ["warp_col_tiles", "ot", 1], ["chunk", "ot", 2], ["offset", "ot", 0], ["offsetCS", "ot", 8], ["vec", "ot", 1], ["wmma_m", "ot", 8]]}, "result": [[8.186631025957972e-06], 0, 1.0869174003601074, 1651931011.2157383], "version": 0.2, "tvm_version": "0.8.0"}
{"input": ["cuda -keys=cuda,gpu -max_num_threads=1024 -thread_warp_size=32", "attn_v_pad_matmul.cuda", [["TENSOR", [32, 49, 49], "float16"], ["TENSOR", [32, 32, 49], "float16"]], {}], "config": {"index": 10455, "code_hash": null, "entity": [["block_row_warps", "ot", 1], ["block_col_warps", "ot", 4], ["warp_row_tiles", "ot", 1], ["warp_col_tiles", "ot", 1], ["chunk", "ot", 2], ["offset", "ot", 0], ["offsetCS", "ot", 0], ["vec", "ot", 1], ["wmma_m", "ot", 8]]}, "result": [[9.476202101359703e-06], 0, 0.9589488506317139, 1651931011.615366], "version": 0.2, "tvm_version": "0.8.0"}
{"input": ["cuda -keys=cuda,gpu -max_num_threads=1024 -thread_warp_size=32", "attn_v_pad_matmul.cuda", [["TENSOR", [32, 49, 49], "float16"], ["TENSOR", [32, 32, 49], "float16"]], {}], "config": {"index": 10773, "code_hash": null, "entity": [["block_row_warps", "ot", 1], ["block_col_warps", "ot", 1], ["warp_row_tiles", "ot", 1], ["warp_col_tiles", "ot", 1], ["chunk", "ot", 2], ["offset", "ot", 8], ["offsetCS", "ot", 0], ["vec", "ot", 1], ["wmma_m", "ot", 8]]}, "result": [[7.095226823238566e-06], 0, 1.166069507598877, 1651931012.112533], "version": 0.2, "tvm_version": "0.8.0"}
{"input": ["cuda -keys=cuda,gpu -max_num_threads=1024 -thread_warp_size=32", "attn_v_pad_matmul.cuda", [["TENSOR", [32, 49, 49], "float16"], ["TENSOR", [32, 32, 49], "float16"]], {}], "config": {"index": 11103, "code_hash": null, "entity": [["block_row_warps", "ot", 1], ["block_col_warps", "ot", 4], ["warp_row_tiles", "ot", 1], ["warp_col_tiles", "ot", 1], ["chunk", "ot", 2], ["offset", "ot", 0], ["offsetCS", "ot", 8], ["vec", "ot", 1], ["wmma_m", "ot", 8]]}, "result": [[9.345718788627935e-06], 0, 1.1439223289489746, 1651931012.64801], "version": 0.2, "tvm_version": "0.8.0"}
{"input": ["cuda -keys=cuda,gpu -max_num_threads=1024 -thread_warp_size=32", "attn_v_pad_matmul.cuda", [["TENSOR", [32, 49, 49], "float16"], ["TENSOR", [32, 32, 49], "float16"]], {}], "config": {"index": 10776, "code_hash": null, "entity": [["block_row_warps", "ot", 1], ["block_col_warps", "ot", 2], ["warp_row_tiles", "ot", 1], ["warp_col_tiles", "ot", 1], ["chunk", "ot", 2], ["offset", "ot", 8], ["offsetCS", "ot", 0], ["vec", "ot", 1], ["wmma_m", "ot", 8]]}, "result": [[7.635391223733004e-06], 0, 1.1529908180236816, 1651931013.2122428], "version": 0.2, "tvm_version": "0.8.0"}
{"input": ["cuda -keys=cuda,gpu -max_num_threads=1024 -thread_warp_size=32", "attn_v_pad_matmul.cuda", [["TENSOR", [32, 49, 49], "float16"], ["TENSOR", [32, 32, 49], "float16"]], {}], "config": {"index": 11424, "code_hash": null, "entity": [["block_row_warps", "ot", 1], ["block_col_warps", "ot", 2], ["warp_row_tiles", "ot", 1], ["warp_col_tiles", "ot", 1], ["chunk", "ot", 2], ["offset", "ot", 8], ["offsetCS", "ot", 8], ["vec", "ot", 1], ["wmma_m", "ot", 8]]}, "result": [[7.328611248454882e-06], 0, 1.1759090423583984, 1651931013.702164], "version": 0.2, "tvm_version": "0.8.0"}
{"input": ["cuda -keys=cuda,gpu -max_num_threads=1024 -thread_warp_size=32", "attn_v_pad_matmul.cuda", [["TENSOR", [32, 49, 49], "float16"], ["TENSOR", [32, 32, 49], "float16"]], {}], "config": {"index": 10452, "code_hash": null, "entity": [["block_row_warps", "ot", 1], ["block_col_warps", "ot", 2], ["warp_row_tiles", "ot", 1], ["warp_col_tiles", "ot", 1], ["chunk", "ot", 2], ["offset", "ot", 0], ["offsetCS", "ot", 0], ["vec", "ot", 1], ["wmma_m", "ot", 8]]}, "result": [[8.0995e-06], 0, 1.1587309837341309, 1651931014.1868885], "version": 0.2, "tvm_version": "0.8.0"}
{"input": ["cuda -keys=cuda,gpu -max_num_threads=1024 -thread_warp_size=32", "attn_v_pad_matmul.cuda", [["TENSOR", [32, 49, 49], "float16"], ["TENSOR", [32, 32, 49], "float16"]], {}], "config": {"index": 11097, "code_hash": null, "entity": [["block_row_warps", "ot", 1], ["block_col_warps", "ot", 1], ["warp_row_tiles", "ot", 1], ["warp_col_tiles", "ot", 1], ["chunk", "ot", 2], ["offset", "ot", 0], ["offsetCS", "ot", 8], ["vec", "ot", 1], ["wmma_m", "ot", 8]]}, "result": [[7.514116192830655e-06], 0, 1.070464849472046, 1651931014.5796719], "version": 0.2, "tvm_version": "0.8.0"}
{"input": ["cuda -keys=cuda,gpu -max_num_threads=1024 -thread_warp_size=32", "attn_v_pad_matmul.cuda", [["TENSOR", [32, 49, 49], "float16"], ["TENSOR", [32, 32, 49], "float16"]], {}], "config": {"index": 11421, "code_hash": null, "entity": [["block_row_warps", "ot", 1], ["block_col_warps", "ot", 1], ["warp_row_tiles", "ot", 1], ["warp_col_tiles", "ot", 1], ["chunk", "ot", 2], ["offset", "ot", 8], ["offsetCS", "ot", 8], ["vec", "ot", 1], ["wmma_m", "ot", 8]]}, "result": [[7.274713844252163e-06], 0, 1.6365728378295898, 1651931015.465865], "version": 0.2, "tvm_version": "0.8.0"}
{"input": ["cuda -keys=cuda,gpu -max_num_threads=1024 -thread_warp_size=32", "attn_v_pad_matmul.cuda", [["TENSOR", [32, 49, 49], "float16"], ["TENSOR", [32, 32, 49], "float16"]], {}], "config": {"index": 5836, "code_hash": null, "entity": [["block_row_warps", "ot", 2], ["block_col_warps", "ot", 2], ["warp_row_tiles", "ot", 1], ["warp_col_tiles", "ot", 1], ["chunk", "ot", 1], ["offset", "ot", 0], ["offsetCS", "ot", 8], ["vec", "ot", 1], ["wmma_m", "ot", 16]]}, "result": [[8.484970333745364e-06], 0, 1.28006911277771, 1651931015.9598973], "version": 0.2, "tvm_version": "0.8.0"}
{"input": ["cuda -keys=cuda,gpu -max_num_threads=1024 -thread_warp_size=32", "attn_v_pad_matmul.cuda", [["TENSOR", [32, 49, 49], "float16"], ["TENSOR", [32, 32, 49], "float16"]], {}], "config": {"index": 5837, "code_hash": null, "entity": [["block_row_warps", "ot", 4], ["block_col_warps", "ot", 2], ["warp_row_tiles", "ot", 1], ["warp_col_tiles", "ot", 1], ["chunk", "ot", 1], ["offset", "ot", 0], ["offsetCS", "ot", 8], ["vec", "ot", 1], ["wmma_m", "ot", 16]]}, "result": [[1.5226804e-05], 0, 1.11783766746521, 1651931016.4449677], "version": 0.2, "tvm_version": "0.8.0"}
{"input": ["cuda -keys=cuda,gpu -max_num_threads=1024 -thread_warp_size=32", "attn_v_pad_matmul.cuda", [["TENSOR", [32, 49, 49], "float16"], ["TENSOR", [32, 32, 49], "float16"]], {}], "config": {"index": 6160, "code_hash": null, "entity": [["block_row_warps", "ot", 2], ["block_col_warps", "ot", 2], ["warp_row_tiles", "ot", 1], ["warp_col_tiles", "ot", 1], ["chunk", "ot", 1], ["offset", "ot", 8], ["offsetCS", "ot", 8], ["vec", "ot", 1], ["wmma_m", "ot", 16]]}, "result": [[7.848634734239802e-06], 0, 1.3680262565612793, 1651931017.0395756], "version": 0.2, "tvm_version": "0.8.0"}
{"input": ["cuda -keys=cuda,gpu -max_num_threads=1024 -thread_warp_size=32", "attn_v_pad_matmul.cuda", [["TENSOR", [32, 49, 49], "float16"], ["TENSOR", [32, 32, 49], "float16"]], {}], "config": {"index": 5839, "code_hash": null, "entity": [["block_row_warps", "ot", 2], ["block_col_warps", "ot", 4], ["warp_row_tiles", "ot", 1], ["warp_col_tiles", "ot", 1], ["chunk", "ot", 1], ["offset", "ot", 0], ["offsetCS", "ot", 8], ["vec", "ot", 1], ["wmma_m", "ot", 16]]}, "result": [[9.932663782447465e-06], 0, 1.419618844985962, 1651931017.674105], "version": 0.2, "tvm_version": "0.8.0"}
{"input": ["cuda -keys=cuda,gpu -max_num_threads=1024 -thread_warp_size=32", "attn_v_pad_matmul.cuda", [["TENSOR", [32, 49, 49], "float16"], ["TENSOR", [32, 32, 49], "float16"]], {}], "config": {"index": 6184, "code_hash": null, "entity": [["block_row_warps", "ot", 2], ["block_col_warps", "ot", 1], ["warp_row_tiles", "ot", 1], ["warp_col_tiles", "ot", 2], ["chunk", "ot", 1], ["offset", "ot", 8], ["offsetCS", "ot", 8], ["vec", "ot", 1], ["wmma_m", "ot", 16]]}, "result": [[7.334121755253399e-06], 0, 1.4008769989013672, 1651931018.180009], "version": 0.2, "tvm_version": "0.8.0"}
{"input": ["cuda -keys=cuda,gpu -max_num_threads=1024 -thread_warp_size=32", "attn_v_pad_matmul.cuda", [["TENSOR", [32, 49, 49], "float16"], ["TENSOR", [32, 32, 49], "float16"]], {}], "config": {"index": 10369, "code_hash": null, "entity": [["block_row_warps", "ot", 2], ["block_col_warps", "ot", 1], ["warp_row_tiles", "ot", 1], ["warp_col_tiles", "ot", 1], ["chunk", "ot", 1], ["offset", "ot", 0], ["offsetCS", "ot", 0], ["vec", "ot", 1], ["wmma_m", "ot", 8]]}, "result": [[8.036284919653894e-06], 0, 1.2055387496948242, 1651931018.7109509], "version": 0.2, "tvm_version": "0.8.0"}
{"input": ["cuda -keys=cuda,gpu -max_num_threads=1024 -thread_warp_size=32", "attn_v_pad_matmul.cuda", [["TENSOR", [32, 49, 49], "float16"], ["TENSOR", [32, 32, 49], "float16"]], {}], "config": {"index": 10706, "code_hash": null, "entity": [["block_row_warps", "ot", 4], ["block_col_warps", "ot", 2], ["warp_row_tiles", "ot", 2], ["warp_col_tiles", "ot", 1], ["chunk", "ot", 1], ["offset", "ot", 8], ["offsetCS", "ot", 0], ["vec", "ot", 1], ["wmma_m", "ot", 8]]}, "result": [[1.4291966e-05], 0, 1.0830142498016357, 1651931019.158053], "version": 0.2, "tvm_version": "0.8.0"}
{"input": ["cuda -keys=cuda,gpu -max_num_threads=1024 -thread_warp_size=32", "attn_v_pad_matmul.cuda", [["TENSOR", [32, 49, 49], "float16"], ["TENSOR", [32, 32, 49], "float16"]], {}], "config": {"index": 5864, "code_hash": null, "entity": [["block_row_warps", "ot", 4], ["block_col_warps", "ot", 2], ["warp_row_tiles", "ot", 1], ["warp_col_tiles", "ot", 2], ["chunk", "ot", 1], ["offset", "ot", 0], ["offsetCS", "ot", 8], ["vec", "ot", 1], ["wmma_m", "ot", 16]]}, "result": [[1.2608496e-05], 0, 1.3053638935089111, 1651931019.7058759], "version": 0.2, "tvm_version": "0.8.0"}
{"input": ["cuda -keys=cuda,gpu -max_num_threads=1024 -thread_warp_size=32", "attn_v_pad_matmul.cuda", [["TENSOR", [32, 49, 49], "float16"], ["TENSOR", [32, 32, 49], "float16"]], {}], "config": {"index": 5861, "code_hash": null, "entity": [["block_row_warps", "ot", 4], ["block_col_warps", "ot", 1], ["warp_row_tiles", "ot", 1], ["warp_col_tiles", "ot", 2], ["chunk", "ot", 1], ["offset", "ot", 0], ["offsetCS", "ot", 8], ["vec", "ot", 1], ["wmma_m", "ot", 16]]}, "result": [[1.1674431000000001e-05], 0, 1.2574186325073242, 1651931020.271035], "version": 0.2, "tvm_version": "0.8.0"}
{"input": ["cuda -keys=cuda,gpu -max_num_threads=1024 -thread_warp_size=32", "attn_v_pad_matmul.cuda", [["TENSOR", [32, 49, 49], "float16"], ["TENSOR", [32, 32, 49], "float16"]], {}], "config": {"index": 6187, "code_hash": null, "entity": [["block_row_warps", "ot", 2], ["block_col_warps", "ot", 2], ["warp_row_tiles", "ot", 1], ["warp_col_tiles", "ot", 2], ["chunk", "ot", 1], ["offset", "ot", 8], ["offsetCS", "ot", 8], ["vec", "ot", 1], ["wmma_m", "ot", 16]]}, "result": [[7.525956118665019e-06], 0, 1.2464380264282227, 1651931020.842515], "version": 0.2, "tvm_version": "0.8.0"}
{"input": ["cuda -keys=cuda,gpu -max_num_threads=1024 -thread_warp_size=32", "attn_v_pad_matmul.cuda", [["TENSOR", [32, 49, 49], "float16"], ["TENSOR", [32, 32, 49], "float16"]], {}], "config": {"index": 10694, "code_hash": null, "entity": [["block_row_warps", "ot", 4], ["block_col_warps", "ot", 1], ["warp_row_tiles", "ot", 1], ["warp_col_tiles", "ot", 1], ["chunk", "ot", 1], ["offset", "ot", 8], ["offsetCS", "ot", 0], ["vec", "ot", 1], ["wmma_m", "ot", 8]]}, "result": [[9.32309456118665e-06], 0, 1.207690954208374, 1651931021.415622], "version": 0.2, "tvm_version": "0.8.0"}
{"input": ["cuda -keys=cuda,gpu -max_num_threads=1024 -thread_warp_size=32", "attn_v_pad_matmul.cuda", [["TENSOR", [32, 49, 49], "float16"], ["TENSOR", [32, 32, 49], "float16"]], {}], "config": {"index": 10375, "code_hash": null, "entity": [["block_row_warps", "ot", 2], ["block_col_warps", "ot", 4], ["warp_row_tiles", "ot", 1], ["warp_col_tiles", "ot", 1], ["chunk", "ot", 1], ["offset", "ot", 0], ["offsetCS", "ot", 0], ["vec", "ot", 1], ["wmma_m", "ot", 8]]}, "result": [[1.3439792000000001e-05], 0, 1.1239829063415527, 1651931021.9262285], "version": 0.2, "tvm_version": "0.8.0"}
{"input": ["cuda -keys=cuda,gpu -max_num_threads=1024 -thread_warp_size=32", "attn_v_pad_matmul.cuda", [["TENSOR", [32, 49, 49], "float16"], ["TENSOR", [32, 32, 49], "float16"]], {}], "config": {"index": 10697, "code_hash": null, "entity": [["block_row_warps", "ot", 4], ["block_col_warps", "ot", 2], ["warp_row_tiles", "ot", 1], ["warp_col_tiles", "ot", 1], ["chunk", "ot", 1], ["offset", "ot", 8], ["offsetCS", "ot", 0], ["vec", "ot", 1], ["wmma_m", "ot", 8]]}, "result": [[1.5909033e-05], 0, 1.2795932292938232, 1651931022.6850595], "version": 0.2, "tvm_version": "0.8.0"}
{"input": ["cuda -keys=cuda,gpu -max_num_threads=1024 -thread_warp_size=32", "attn_v_pad_matmul.cuda", [["TENSOR", [32, 49, 49], "float16"], ["TENSOR", [32, 32, 49], "float16"]], {}], "config": {"index": 11027, "code_hash": null, "entity": [["block_row_warps", "ot", 4], ["block_col_warps", "ot", 1], ["warp_row_tiles", "ot", 2], ["warp_col_tiles", "ot", 1], ["chunk", "ot", 1], ["offset", "ot", 0], ["offsetCS", "ot", 8], ["vec", "ot", 1], ["wmma_m", "ot", 8]]}, "result": [[1.1535205e-05], 0, 1.420482873916626, 1651931025.139567], "version": 0.2, "tvm_version": "0.8.0"}
{"input": ["cuda -keys=cuda,gpu -max_num_threads=1024 -thread_warp_size=32", "attn_v_pad_matmul.cuda", [["TENSOR", [32, 49, 49], "float16"], ["TENSOR", [32, 32, 49], "float16"]], {}], "config": {"index": 11029, "code_hash": null, "entity": [["block_row_warps", "ot", 2], ["block_col_warps", "ot", 2], ["warp_row_tiles", "ot", 2], ["warp_col_tiles", "ot", 1], ["chunk", "ot", 1], ["offset", "ot", 0], ["offsetCS", "ot", 8], ["vec", "ot", 1], ["wmma_m", "ot", 8]]}, "result": [[7.778689122373302e-06], 0, 1.5503754615783691, 1651931025.7229257], "version": 0.2, "tvm_version": "0.8.0"}
{"input": ["cuda -keys=cuda,gpu -max_num_threads=1024 -thread_warp_size=32", "attn_v_pad_matmul.cuda", [["TENSOR", [32, 49, 49], "float16"], ["TENSOR", [32, 32, 49], "float16"]], {}], "config": {"index": 6163, "code_hash": null, "entity": [["block_row_warps", "ot", 2], ["block_col_warps", "ot", 4], ["warp_row_tiles", "ot", 1], ["warp_col_tiles", "ot", 1], ["chunk", "ot", 1], ["offset", "ot", 8], ["offsetCS", "ot", 8], ["vec", "ot", 1], ["wmma_m", "ot", 16]]}, "result": [[8.16153152039555e-06], 0, 0.9735352993011475, 1651931026.109598], "version": 0.2, "tvm_version": "0.8.0"}
{"input": ["cuda -keys=cuda,gpu -max_num_threads=1024 -thread_warp_size=32", "attn_v_pad_matmul.cuda", [["TENSOR", [32, 49, 49], "float16"], ["TENSOR", [32, 32, 49], "float16"]], {}], "config": {"index": 11018, "code_hash": null, "entity": [["block_row_warps", "ot", 4], ["block_col_warps", "ot", 1], ["warp_row_tiles", "ot", 1], ["warp_col_tiles", "ot", 1], ["chunk", "ot", 1], ["offset", "ot", 0], ["offsetCS", "ot", 8], ["vec", "ot", 1], ["wmma_m", "ot", 8]]}, "result": [[9.594733621755253e-06], 0, 1.075160264968872, 1651931026.5197864], "version": 0.2, "tvm_version": "0.8.0"}
{"input": ["cuda -keys=cuda,gpu -max_num_threads=1024 -thread_warp_size=32", "attn_v_pad_matmul.cuda", [["TENSOR", [32, 49, 49], "float16"], ["TENSOR", [32, 32, 49], "float16"]], {}], "config": {"index": 10373, "code_hash": null, "entity": [["block_row_warps", "ot", 4], ["block_col_warps", "ot", 2], ["warp_row_tiles", "ot", 1], ["warp_col_tiles", "ot", 1], ["chunk", "ot", 1], ["offset", "ot", 0], ["offsetCS", "ot", 0], ["vec", "ot", 1], ["wmma_m", "ot", 8]]}, "result": [[1.7197687e-05], 0, 1.4419167041778564, 1651931027.1981254], "version": 0.2, "tvm_version": "0.8.0"}
{"input": ["cuda -keys=cuda,gpu -max_num_threads=1024 -thread_warp_size=32", "attn_v_pad_matmul.cuda", [["TENSOR", [32, 49, 49], "float16"], ["TENSOR", [32, 32, 49], "float16"]], {}], "config": {"index": 6157, "code_hash": null, "entity": [["block_row_warps", "ot", 2], ["block_col_warps", "ot", 1], ["warp_row_tiles", "ot", 1], ["warp_col_tiles", "ot", 1], ["chunk", "ot", 1], ["offset", "ot", 8], ["offsetCS", "ot", 8], ["vec", "ot", 1], ["wmma_m", "ot", 16]]}, "result": [[7.07392521631644e-06], 0, 1.1726658344268799, 1651931027.656709], "version": 0.2, "tvm_version": "0.8.0"}
{"input": ["cuda -keys=cuda,gpu -max_num_threads=1024 -thread_warp_size=32", "attn_v_pad_matmul.cuda", [["TENSOR", [32, 49, 49], "float16"], ["TENSOR", [32, 32, 49], "float16"]], {}], "config": {"index": 11021, "code_hash": null, "entity": [["block_row_warps", "ot", 4], ["block_col_warps", "ot", 2], ["warp_row_tiles", "ot", 1], ["warp_col_tiles", "ot", 1], ["chunk", "ot", 1], ["offset", "ot", 0], ["offsetCS", "ot", 8], ["vec", "ot", 1], ["wmma_m", "ot", 8]]}, "result": [[1.6936574e-05], 0, 1.3434326648712158, 1651931028.1282296], "version": 0.2, "tvm_version": "0.8.0"}
{"input": ["cuda -keys=cuda,gpu -max_num_threads=1024 -thread_warp_size=32", "attn_v_pad_matmul.cuda", [["TENSOR", [32, 49, 49], "float16"], ["TENSOR", [32, 32, 49], "float16"]], {}], "config": {"index": 10370, "code_hash": null, "entity": [["block_row_warps", "ot", 4], ["block_col_warps", "ot", 1], ["warp_row_tiles", "ot", 1], ["warp_col_tiles", "ot", 1], ["chunk", "ot", 1], ["offset", "ot", 0], ["offsetCS", "ot", 0], ["vec", "ot", 1], ["wmma_m", "ot", 8]]}, "result": [[9.604313967861558e-06], 0, 1.4999301433563232, 1651931028.644907], "version": 0.2, "tvm_version": "0.8.0"}
{"input": ["cuda -keys=cuda,gpu -max_num_threads=1024 -thread_warp_size=32", "attn_v_pad_matmul.cuda", [["TENSOR", [32, 49, 49], "float16"], ["TENSOR", [32, 32, 49], "float16"]], {}], "config": {"index": 10696, "code_hash": null, "entity": [["block_row_warps", "ot", 2], ["block_col_warps", "ot", 2], ["warp_row_tiles", "ot", 1], ["warp_col_tiles", "ot", 1], ["chunk", "ot", 1], ["offset", "ot", 8], ["offsetCS", "ot", 0], ["vec", "ot", 1], ["wmma_m", "ot", 8]]}, "result": [[8.170760815822003e-06], 0, 1.172248125076294, 1651931029.0441744], "version": 0.2, "tvm_version": "0.8.0"}
{"input": ["cuda -keys=cuda,gpu -max_num_threads=1024 -thread_warp_size=32", "attn_v_pad_matmul.cuda", [["TENSOR", [32, 49, 49], "float16"], ["TENSOR", [32, 32, 49], "float16"]], {}], "config": {"index": 11017, "code_hash": null, "entity": [["block_row_warps", "ot", 2], ["block_col_warps", "ot", 1], ["warp_row_tiles", "ot", 1], ["warp_col_tiles", "ot", 1], ["chunk", "ot", 1], ["offset", "ot", 0], ["offsetCS", "ot", 8], ["vec", "ot", 1], ["wmma_m", "ot", 8]]}, "result": [[8.13551545117429e-06], 0, 1.3190531730651855, 1651931029.6663704], "version": 0.2, "tvm_version": "0.8.0"}
{"input": ["cuda -keys=cuda,gpu -max_num_threads=1024 -thread_warp_size=32", "attn_v_pad_matmul.cuda", [["TENSOR", [32, 49, 49], "float16"], ["TENSOR", [32, 32, 49], "float16"]], {}], "config": {"index": 11342, "code_hash": null, "entity": [["block_row_warps", "ot", 4], ["block_col_warps", "ot", 1], ["warp_row_tiles", "ot", 1], ["warp_col_tiles", "ot", 1], ["chunk", "ot", 1], ["offset", "ot", 8], ["offsetCS", "ot", 8], ["vec", "ot", 1], ["wmma_m", "ot", 8]]}, "result": [[8.92412978986403e-06], 0, 1.3809237480163574, 1651931030.2703023], "version": 0.2, "tvm_version": "0.8.0"}
{"input": ["cuda -keys=cuda,gpu -max_num_threads=1024 -thread_warp_size=32", "attn_v_pad_matmul.cuda", [["TENSOR", [32, 49, 49], "float16"], ["TENSOR", [32, 32, 49], "float16"]], {}], "config": {"index": 11356, "code_hash": null, "entity": [["block_row_warps", "ot", 2], ["block_col_warps", "ot", 4], ["warp_row_tiles", "ot", 2], ["warp_col_tiles", "ot", 1], ["chunk", "ot", 1], ["offset", "ot", 8], ["offsetCS", "ot", 8], ["vec", "ot", 1], ["wmma_m", "ot", 8]]}, "result": [[8.10748454882571e-06], 0, 1.611217975616455, 1651931030.7413797], "version": 0.2, "tvm_version": "0.8.0"}
{"input": ["cuda -keys=cuda,gpu -max_num_threads=1024 -thread_warp_size=32", "attn_v_pad_matmul.cuda", [["TENSOR", [32, 49, 49], "float16"], ["TENSOR", [32, 32, 49], "float16"]], {}], "config": {"index": 10699, "code_hash": null, "entity": [["block_row_warps", "ot", 2], ["block_col_warps", "ot", 4], ["warp_row_tiles", "ot", 1], ["warp_col_tiles", "ot", 1], ["chunk", "ot", 1], ["offset", "ot", 8], ["offsetCS", "ot", 0], ["vec", "ot", 1], ["wmma_m", "ot", 8]]}, "result": [[1.2247279000000001e-05], 0, 1.317847490310669, 1651931031.1758678], "version": 0.2, "tvm_version": "0.8.0"}
{"input": ["cuda -keys=cuda,gpu -max_num_threads=1024 -thread_warp_size=32", "attn_v_pad_matmul.cuda", [["TENSOR", [32, 49, 49], "float16"], ["TENSOR", [32, 32, 49], "float16"]], {}], "config": {"index": 11341, "code_hash": null, "entity": [["block_row_warps", "ot", 2], ["block_col_warps", "ot", 1], ["warp_row_tiles", "ot", 1], ["warp_col_tiles", "ot", 1], ["chunk", "ot", 1], ["offset", "ot", 8], ["offsetCS", "ot", 8], ["vec", "ot", 1], ["wmma_m", "ot", 8]]}, "result": [[7.432307787391843e-06], 0, 1.3976645469665527, 1651931031.8013978], "version": 0.2, "tvm_version": "0.8.0"}
{"input": ["cuda -keys=cuda,gpu -max_num_threads=1024 -thread_warp_size=32", "attn_v_pad_matmul.cuda", [["TENSOR", [32, 49, 49], "float16"], ["TENSOR", [32, 32, 49], "float16"]], {}], "config": {"index": 11347, "code_hash": null, "entity": [["block_row_warps", "ot", 2], ["block_col_warps", "ot", 4], ["warp_row_tiles", "ot", 1], ["warp_col_tiles", "ot", 1], ["chunk", "ot", 1], ["offset", "ot", 8], ["offsetCS", "ot", 8], ["vec", "ot", 1], ["wmma_m", "ot", 8]]}, "result": [[1.1074781e-05], 0, 1.2797176837921143, 1651931032.186917], "version": 0.2, "tvm_version": "0.8.0"}
