python/models/swin_transformer/kernel_configs/swin_transformer_te_slice_1_14_14_512_[0, 0]_2.log
{"i": [["[\"te_slice\", 1, 14, 14, 512, [0, 0], 2, \"float16\"]", "cuda -keys=cuda,gpu -max_num_threads=1024 -model=unknown -thread_warp_size=32", [-1, 16, 64, 49152, 2147483647, 1024, 8, 32], "", 0, []], [[], [["FU", 1, [0, 1, 2, 3]], ["SP", 1, 0, 25088, [1], 1], ["AN", 1, 0, 5], ["AN", 1, 1, 6]]]], "r": [[2.14333e-05, 2.14617e-05, 2.14627e-05], 0, 0.913474, 1668065433], "v": "v0.6"}
{"i": [["[\"te_slice\", 1, 14, 14, 512, [0, 0], 2, \"float16\"]", "cuda -keys=cuda,gpu -max_num_threads=1024 -model=unknown -thread_warp_size=32", [-1, 16, 64, 49152, 2147483647, 1024, 8, 32], "", 0, []], [[], [["FU", 1, [0, 1, 2, 3]], ["SP", 1, 0, 25088, [2], 1], ["AN", 1, 0, 5], ["AN", 1, 1, 6]]]], "r": [[1.19852e-05, 1.19931e-05, 1.19976e-05], 0, 1.97853, 1668065434], "v": "v0.6"}
{"i": [["[\"te_slice\", 1, 14, 14, 512, [0, 0], 2, \"float16\"]", "cuda -keys=cuda,gpu -max_num_threads=1024 -model=unknown -thread_warp_size=32", [-1, 16, 64, 49152, 2147483647, 1024, 8, 32], "", 0, []], [[], [["FU", 1, [0, 1, 2, 3]], ["SP", 1, 0, 25088, [28], 1], ["AN", 1, 0, 5], ["AN", 1, 1, 6]]]], "r": [[3.22123e-06, 3.21955e-06, 3.21867e-06], 0, 1.63476, 1668065434], "v": "v0.6"}
{"i": [["[\"te_slice\", 1, 14, 14, 512, [0, 0], 2, \"float16\"]", "cuda -keys=cuda,gpu -max_num_threads=1024 -model=unknown -thread_warp_size=32", [-1, 16, 64, 49152, 2147483647, 1024, 8, 32], "", 0, []], [[], [["FU", 1, [0, 1, 2, 3]], ["SP", 1, 0, 25088, [7], 1], ["AN", 1, 0, 5], ["AN", 1, 1, 6]]]], "r": [[5.41368e-06, 5.41963e-06, 5.42905e-06], 0, 2.36555, 1668065435], "v": "v0.6"}
{"i": [["[\"te_slice\", 1, 14, 14, 512, [0, 0], 2, \"float16\"]", "cuda -keys=cuda,gpu -max_num_threads=1024 -model=unknown -thread_warp_size=32", [-1, 16, 64, 49152, 2147483647, 1024, 8, 32], "", 0, []], [[], [["FU", 1, [0, 1, 2, 3]], ["SP", 1, 0, 25088, [49], 1], ["AN", 1, 0, 5], ["AN", 1, 1, 6]]]], "r": [[2.94718e-06, 2.94524e-06, 2.94574e-06], 0, 1.29453, 1668065434], "v": "v0.6"}
{"i": [["[\"te_slice\", 1, 14, 14, 512, [0, 0], 2, \"float16\"]", "cuda -keys=cuda,gpu -max_num_threads=1024 -model=unknown -thread_warp_size=32", [-1, 16, 64, 49152, 2147483647, 1024, 8, 32], "", 0, []], [[], [["FU", 1, [0, 1, 2, 3]], ["SP", 1, 0, 25088, [14], 1], ["AN", 1, 0, 5], ["AN", 1, 1, 6]]]], "r": [[3.86882e-06, 3.8837e-06, 3.87994e-06], 0, 0.569797, 1668065433], "v": "v0.6"}
{"i": [["[\"te_slice\", 1, 14, 14, 512, [0, 0], 2, \"float16\"]", "cuda -keys=cuda,gpu -max_num_threads=1024 -model=unknown -thread_warp_size=32", [-1, 16, 64, 49152, 2147483647, 1024, 8, 32], "", 0, []], [[], [["FU", 1, [0, 1, 2, 3]], ["SP", 1, 0, 25088, [8], 1], ["AN", 1, 0, 5], ["AN", 1, 1, 6]]]], "r": [[5.09708e-06, 5.10985e-06, 5.11163e-06], 0, 2.68847, 1668065435], "v": "v0.6"}
{"i": [["[\"te_slice\", 1, 14, 14, 512, [0, 0], 2, \"float16\"]", "cuda -keys=cuda,gpu -max_num_threads=1024 -model=unknown -thread_warp_size=32", [-1, 16, 64, 49152, 2147483647, 1024, 8, 32], "", 0, []], [[], [["FU", 1, [0, 1, 2, 3]], ["SP", 1, 0, 25088, [4], 1], ["AN", 1, 0, 5], ["AN", 1, 1, 6]]]], "r": [[7.28771e-06, 7.3018e-06, 7.30615e-06], 0, 3.73242, 1668065436], "v": "v0.6"}
{"i": [["[\"te_slice\", 1, 14, 14, 512, [0, 0], 2, \"float16\"]", "cuda -keys=cuda,gpu -max_num_threads=1024 -model=unknown -thread_warp_size=32", [-1, 16, 64, 49152, 2147483647, 1024, 8, 32], "", 0, []], [[], [["FU", 1, [0, 1, 2, 3]], ["SP", 1, 0, 25088, [16], 1], ["AN", 1, 0, 5], ["AN", 1, 1, 6]]]], "r": [[3.72811e-06, 3.73375e-06, 3.73019e-06], 0, 3.40166, 1668065436], "v": "v0.6"}
{"i": [["[\"te_slice\", 1, 14, 14, 512, [0, 0], 2, \"float16\"]", "cuda -keys=cuda,gpu -max_num_threads=1024 -model=unknown -thread_warp_size=32", [-1, 16, 64, 49152, 2147483647, 1024, 8, 32], "", 0, []], [[], [["FU", 1, [0, 1, 2, 3]], ["SP", 1, 0, 25088, [32], 1], ["AN", 1, 0, 5], ["AN", 1, 1, 6]]]], "r": [[3.08866e-06, 3.08775e-06, 3.08599e-06], 0, 4.06223, 1668065437], "v": "v0.6"}
{"i": [["[\"te_slice\", 1, 14, 14, 512, [0, 0], 2, \"float16\"]", "cuda -keys=cuda,gpu -max_num_threads=1024 -model=unknown -thread_warp_size=32", [-1, 16, 64, 49152, 2147483647, 1024, 8, 32], "", 0, []], [[], [["FU", 1, [0, 1, 2, 3]], ["SP", 1, 0, 25088, [64], 1], ["AN", 1, 0, 5], ["AN", 1, 1, 6]]]], "r": [[2.90934e-06, 2.90979e-06, 2.90932e-06], 0, 3.02788, 1668065435], "v": "v0.6"}
{"i": [["[\"te_slice\", 1, 14, 14, 512, [0, 0], 2, \"float16\"]", "cuda -keys=cuda,gpu -max_num_threads=1024 -model=unknown -thread_warp_size=32", [-1, 16, 64, 49152, 2147483647, 1024, 8, 32], "", 0, []], [[], [["FU", 1, [0, 1, 2, 3]], ["SP", 1, 0, 25088, [56], 1], ["AN", 1, 0, 5], ["AN", 1, 1, 6]]]], "r": [[2.91521e-06, 2.91556e-06, 2.91499e-06], 0, 4.45514, 1668065437], "v": "v0.6"}
