python/models/swin_transformer/kernel_configs/swin_transformer_fused_roll_reshape_permute_reshape_tune_1_8_8_1024_3_8.log
{"i": [["[\"fused_roll_reshape_permute_reshape\", 1, 8, 8, 1024, 3, 8]", "cuda -keys=cuda,gpu -max_num_threads=1024 -model=unknown -thread_warp_size=32", [-1, 16, 64, 49152, 2147483647, 1024, 8, 32], "", 0, []], [[], [["FU", 1, [0, 1]], ["SP", 1, 0, 65536, [2], 1], ["AN", 1, 0, 5], ["AN", 1, 1, 6]]]], "r": [[2.68002e-05, 2.68015e-05, 2.68003e-05, 2.68029e-05, 2.6803e-05, 2.68007e-05, 2.68006e-05, 2.67988e-05, 2.68005e-05, 2.68024e-05], 0, 5.14705, 1652113028], "v": "v0.6"}
{"i": [["[\"fused_roll_reshape_permute_reshape\", 1, 8, 8, 1024, 3, 8]", "cuda -keys=cuda,gpu -max_num_threads=1024 -model=unknown -thread_warp_size=32", [-1, 16, 64, 49152, 2147483647, 1024, 8, 32], "", 0, []], [[], [["FU", 1, [0, 1]], ["SP", 1, 0, 65536, [64], 1], ["AN", 1, 0, 5], ["AN", 1, 1, 6]]]], "r": [[3.42658e-06, 3.42665e-06, 3.42684e-06, 3.4266e-06, 3.42652e-06, 3.42673e-06, 3.42654e-06, 3.42668e-06, 3.42685e-06, 3.42667e-06], 0, 12.2609, 1652113035], "v": "v0.6"}
{"i": [["[\"fused_roll_reshape_permute_reshape\", 1, 8, 8, 1024, 3, 8]", "cuda -keys=cuda,gpu -max_num_threads=1024 -model=unknown -thread_warp_size=32", [-1, 16, 64, 49152, 2147483647, 1024, 8, 32], "", 0, []], [[], [["FU", 1, [0, 1]], ["SP", 1, 0, 65536, [4], 1], ["AN", 1, 0, 5], ["AN", 1, 1, 6]]]], "r": [[1.48353e-05, 1.48371e-05, 1.48353e-05, 1.48364e-05, 1.48376e-05, 1.48356e-05, 1.48356e-05, 1.48363e-05, 1.48359e-05, 1.48356e-05], 0, 16.9923, 1652113039], "v": "v0.6"}
{"i": [["[\"fused_roll_reshape_permute_reshape\", 1, 8, 8, 1024, 3, 8]", "cuda -keys=cuda,gpu -max_num_threads=1024 -model=unknown -thread_warp_size=32", [-1, 16, 64, 49152, 2147483647, 1024, 8, 32], "", 0, []], [[], [["FU", 1, [0, 1]], ["SP", 1, 0, 65536, [32], 1], ["AN", 1, 0, 5], ["AN", 1, 1, 6]]]], "r": [[4.03527e-06, 4.03634e-06, 4.03412e-06, 4.03469e-06, 4.03494e-06, 4.03557e-06, 4.03577e-06, 4.03583e-06, 4.03527e-06, 4.03589e-06], 0, 20.5139, 1652113043], "v": "v0.6"}
{"i": [["[\"fused_roll_reshape_permute_reshape\", 1, 8, 8, 1024, 3, 8]", "cuda -keys=cuda,gpu -max_num_threads=1024 -model=unknown -thread_warp_size=32", [-1, 16, 64, 49152, 2147483647, 1024, 8, 32], "", 0, []], [[], [["FU", 1, [0, 1]], ["SP", 1, 0, 65536, [16], 1], ["AN", 1, 0, 5], ["AN", 1, 1, 6]]]], "r": [[5.65069e-06, 5.65007e-06, 5.65008e-06, 5.65067e-06, 5.65049e-06, 5.65083e-06, 5.65056e-06, 5.65041e-06, 5.65016e-06, 5.64997e-06], 0, 8.82421, 1652113031], "v": "v0.6"}
{"i": [["[\"fused_roll_reshape_permute_reshape\", 1, 8, 8, 1024, 3, 8]", "cuda -keys=cuda,gpu -max_num_threads=1024 -model=unknown -thread_warp_size=32", [-1, 16, 64, 49152, 2147483647, 1024, 8, 32], "", 0, []], [[], [["FU", 1, [0, 1]], ["SP", 1, 0, 65536, [1], 1], ["AN", 1, 0, 5], ["AN", 1, 1, 6]]]], "r": [[5.11417e-05, 5.11433e-05, 5.11426e-05, 5.1139e-05, 5.11419e-05, 5.11411e-05, 5.11459e-05, 5.11446e-05, 5.11437e-05, 5.11426e-05], 0, 25.7164, 1652113048], "v": "v0.6"}
{"i": [["[\"fused_roll_reshape_permute_reshape\", 1, 8, 8, 1024, 3, 8]", "cuda -keys=cuda,gpu -max_num_threads=1024 -model=unknown -thread_warp_size=32", [-1, 16, 64, 49152, 2147483647, 1024, 8, 32], "", 0, []], [[], [["FU", 1, [0, 1]], ["SP", 1, 0, 65536, [8], 1], ["AN", 1, 0, 5], ["AN", 1, 1, 6]]]], "r": [[8.73972e-06, 8.73933e-06, 8.73964e-06, 8.73917e-06, 8.74008e-06, 8.73929e-06, 8.73957e-06, 8.74015e-06, 8.73996e-06, 8.74086e-06], 0, 29.9829, 1652113053], "v": "v0.6"}
{"i": [["[\"fused_roll_reshape_permute_reshape\", 1, 8, 8, 1024, 3, 8]", "cuda -keys=cuda,gpu -max_num_threads=1024 -model=unknown -thread_warp_size=32", [-1, 16, 64, 49152, 2147483647, 1024, 8, 32], "", 0, []], [[], [["FU", 1, [0, 1]], ["SP", 1, 0, 65536, [16], 1], ["AN", 1, 0, 5], ["AN", 1, 1, 6]]]], "r": [[5.57497e-06, 5.57489e-06, 5.57481e-06, 5.57513e-06, 5.57588e-06, 5.57551e-06, 5.57518e-06, 5.57571e-06, 5.57564e-06, 5.57395e-06], 0, 30.2217, 1652113703], "v": "v0.6"}
{"i": [["[\"fused_roll_reshape_permute_reshape\", 1, 8, 8, 1024, 3, 8]", "cuda -keys=cuda,gpu -max_num_threads=1024 -model=unknown -thread_warp_size=32", [-1, 16, 64, 49152, 2147483647, 1024, 8, 32], "", 0, []], [[], [["FU", 1, [0, 1]], ["SP", 1, 0, 65536, [1], 1], ["AN", 1, 0, 5], ["AN", 1, 1, 6]]]], "r": [[5.1147e-05, 5.11463e-05, 5.20475e-05, 5.11499e-05, 5.11432e-05, 5.11461e-05, 5.11446e-05, 5.11479e-05, 5.11487e-05, 5.11446e-05], 0, 18.7126, 1652113692], "v": "v0.6"}
{"i": [["[\"fused_roll_reshape_permute_reshape\", 1, 8, 8, 1024, 3, 8]", "cuda -keys=cuda,gpu -max_num_threads=1024 -model=unknown -thread_warp_size=32", [-1, 16, 64, 49152, 2147483647, 1024, 8, 32], "", 0, []], [[], [["FU", 1, [0, 1]], ["SP", 1, 0, 65536, [32], 1], ["AN", 1, 0, 5], ["AN", 1, 1, 6]]]], "r": [[4.21879e-06, 4.21923e-06, 4.21926e-06, 4.41472e-06, 4.21915e-06, 4.21909e-06, 4.21921e-06, 4.37467e-06, 4.2189e-06, 4.21892e-06], 0, 4.25369, 1652113677], "v": "v0.6"}
{"i": [["[\"fused_roll_reshape_permute_reshape\", 1, 8, 8, 1024, 3, 8]", "cuda -keys=cuda,gpu -max_num_threads=1024 -model=unknown -thread_warp_size=32", [-1, 16, 64, 49152, 2147483647, 1024, 8, 32], "", 0, []], [[], [["FU", 1, [0, 1]], ["SP", 1, 0, 65536, [64], 1], ["AN", 1, 0, 5], ["AN", 1, 1, 6]]]], "r": [[3.45664e-06, 3.45702e-06, 3.4573e-06, 3.45732e-06, 3.45781e-06, 3.45747e-06, 3.45731e-06, 3.45797e-06, 3.458e-06, 3.45795e-06], 0, 26.7896, 1652113700], "v": "v0.6"}
{"i": [["[\"fused_roll_reshape_permute_reshape\", 1, 8, 8, 1024, 3, 8]", "cuda -keys=cuda,gpu -max_num_threads=1024 -model=unknown -thread_warp_size=32", [-1, 16, 64, 49152, 2147483647, 1024, 8, 32], "", 0, []], [[], [["FU", 1, [0, 1]], ["SP", 1, 0, 65536, [8], 1], ["AN", 1, 0, 5], ["AN", 1, 1, 6]]]], "r": [[8.8944e-06, 8.8016e-06, 8.80079e-06, 8.80127e-06, 8.80154e-06, 8.8023e-06, 8.8012e-06, 8.80086e-06, 8.8013e-06, 8.80086e-06], 0, 13.5742, 1652113686], "v": "v0.6"}
{"i": [["[\"fused_roll_reshape_permute_reshape\", 1, 8, 8, 1024, 3, 8]", "cuda -keys=cuda,gpu -max_num_threads=1024 -model=unknown -thread_warp_size=32", [-1, 16, 64, 49152, 2147483647, 1024, 8, 32], "", 0, []], [[], [["FU", 1, [0, 1]], ["SP", 1, 0, 65536, [2], 1], ["AN", 1, 0, 5], ["AN", 1, 1, 6]]]], "r": [[2.68651e-05, 2.74498e-05, 2.74497e-05, 2.68661e-05, 2.76768e-05, 2.71992e-05, 2.75919e-05, 2.75257e-05, 2.68644e-05, 2.68626e-05], 0, 9.31295, 1652113682], "v": "v0.6"}
{"i": [["[\"fused_roll_reshape_permute_reshape\", 1, 8, 8, 1024, 3, 8]", "cuda -keys=cuda,gpu -max_num_threads=1024 -model=unknown -thread_warp_size=32", [-1, 16, 64, 49152, 2147483647, 1024, 8, 32], "", 0, []], [[], [["FU", 1, [0, 1]], ["SP", 1, 0, 65536, [4], 1], ["AN", 1, 0, 5], ["AN", 1, 1, 6]]]], "r": [[1.49131e-05, 1.48928e-05, 1.47955e-05, 1.47958e-05, 1.47953e-05, 1.47959e-05, 1.5173e-05, 1.47948e-05, 1.48172e-05, 1.47951e-05], 0, 23.4005, 1652113696], "v": "v0.6"}
