python/models/swin_transformer/kernel_configs/swin_transform_auto_tvm_fused_roll_reshape_permute_reshape_qkv_dense_tensorcore_1_32_32_256_3_8.log
{"input": ["cuda -keys=cuda,gpu -max_num_threads=1024 -thread_warp_size=32", "fused_roll_reshape_permute_reshape_qkv_dense_tensorcore.cuda", [["TENSOR", [1, 32, 32, 256], "float16"], ["TENSOR", [768, 256], "float16"], 1, 32, 32, 256, 3, 8], {}], "config": {"index": 7131, "code_hash": null, "entity": [["block_row_warps", "ot", 1], ["block_col_warps", "ot", 2], ["warp_row_tiles", "ot", 1], ["warp_col_tiles", "ot", 1], ["chunk", "ot", 1], ["offset", "ot", 0], ["offsetCS", "ot", 8], ["vec", "ot", 2], ["wmma_m", "ot", 16]]}, "result": [[3.9094098000000004e-05], 0, 1.1335148811340332, 1652113517.6680152], "version": 0.2, "tvm_version": "0.8.0"}
{"input": ["cuda -keys=cuda,gpu -max_num_threads=1024 -thread_warp_size=32", "fused_roll_reshape_permute_reshape_qkv_dense_tensorcore.cuda", [["TENSOR", [1, 32, 32, 256], "float16"], ["TENSOR", [768, 256], "float16"], 1, 32, 32, 256, 3, 8], {}], "config": {"index": 4999, "code_hash": null, "entity": [["block_row_warps", "ot", 2], ["block_col_warps", "ot", 2], ["warp_row_tiles", "ot", 1], ["warp_col_tiles", "ot", 4], ["chunk", "ot", 2], ["offset", "ot", 8], ["offsetCS", "ot", 8], ["vec", "ot", 8], ["wmma_m", "ot", 32]]}, "result": [[1.4674501e-05], 0, 1.1977813243865967, 1652113518.1796072], "version": 0.2, "tvm_version": "0.8.0"}
{"input": ["cuda -keys=cuda,gpu -max_num_threads=1024 -thread_warp_size=32", "fused_roll_reshape_permute_reshape_qkv_dense_tensorcore.cuda", [["TENSOR", [1, 32, 32, 256], "float16"], ["TENSOR", [768, 256], "float16"], 1, 32, 32, 256, 3, 8], {}], "config": {"index": 11416, "code_hash": null, "entity": [["block_row_warps", "ot", 2], ["block_col_warps", "ot", 2], ["warp_row_tiles", "ot", 4], ["warp_col_tiles", "ot", 4], ["chunk", "ot", 1], ["offset", "ot", 8], ["offsetCS", "ot", 8], ["vec", "ot", 1], ["wmma_m", "ot", 8]]}, "result": [[3.1063657e-05], 0, 1.2949142456054688, 1652113519.28774], "version": 0.2, "tvm_version": "0.8.0"}
{"input": ["cuda -keys=cuda,gpu -max_num_threads=1024 -thread_warp_size=32", "fused_roll_reshape_permute_reshape_qkv_dense_tensorcore.cuda", [["TENSOR", [1, 32, 32, 256], "float16"], ["TENSOR", [768, 256], "float16"], 1, 32, 32, 256, 3, 8], {}], "config": {"index": 4459, "code_hash": null, "entity": [["block_row_warps", "ot", 2], ["block_col_warps", "ot", 2], ["warp_row_tiles", "ot", 1], ["warp_col_tiles", "ot", 1], ["chunk", "ot", 8], ["offset", "ot", 8], ["offsetCS", "ot", 0], ["vec", "ot", 8], ["wmma_m", "ot", 32]]}, "result": [[2.1061401e-05], 0, 1.133763313293457, 1652113519.785513], "version": 0.2, "tvm_version": "0.8.0"}
{"input": ["cuda -keys=cuda,gpu -max_num_threads=1024 -thread_warp_size=32", "fused_roll_reshape_permute_reshape_qkv_dense_tensorcore.cuda", [["TENSOR", [1, 32, 32, 256], "float16"], ["TENSOR", [768, 256], "float16"], 1, 32, 32, 256, 3, 8], {}], "config": {"index": 10133, "code_hash": null, "entity": [["block_row_warps", "ot", 4], ["block_col_warps", "ot", 4], ["warp_row_tiles", "ot", 1], ["warp_col_tiles", "ot", 1], ["chunk", "ot", 2], ["offset", "ot", 8], ["offsetCS", "ot", 8], ["vec", "ot", 8], ["wmma_m", "ot", 16]]}, "result": [[5.3098798e-05], 0, 1.2449283599853516, 1652113520.9596384], "version": 0.2, "tvm_version": "0.8.0"}
{"input": ["cuda -keys=cuda,gpu -max_num_threads=1024 -thread_warp_size=32", "fused_roll_reshape_permute_reshape_qkv_dense_tensorcore.cuda", [["TENSOR", [1, 32, 32, 256], "float16"], ["TENSOR", [768, 256], "float16"], 1, 32, 32, 256, 3, 8], {}], "config": {"index": 12429, "code_hash": null, "entity": [["block_row_warps", "ot", 1], ["block_col_warps", "ot", 1], ["warp_row_tiles", "ot", 2], ["warp_col_tiles", "ot", 2], ["chunk", "ot", 2], ["offset", "ot", 0], ["offsetCS", "ot", 8], ["vec", "ot", 2], ["wmma_m", "ot", 8]]}, "result": [[2.7994108e-05], 0, 1.30985426902771, 1652113522.0681443], "version": 0.2, "tvm_version": "0.8.0"}
{"input": ["cuda -keys=cuda,gpu -max_num_threads=1024 -thread_warp_size=32", "fused_roll_reshape_permute_reshape_qkv_dense_tensorcore.cuda", [["TENSOR", [1, 32, 32, 256], "float16"], ["TENSOR", [768, 256], "float16"], 1, 32, 32, 256, 3, 8], {}], "config": {"index": 15268, "code_hash": null, "entity": [["block_row_warps", "ot", 2], ["block_col_warps", "ot", 2], ["warp_row_tiles", "ot", 2], ["warp_col_tiles", "ot", 2], ["chunk", "ot", 1], ["offset", "ot", 8], ["offsetCS", "ot", 8], ["vec", "ot", 8], ["wmma_m", "ot", 8]]}, "result": [[2.8926627e-05], 0, 1.2254722118377686, 1652113522.6375375], "version": 0.2, "tvm_version": "0.8.0"}
{"input": ["cuda -keys=cuda,gpu -max_num_threads=1024 -thread_warp_size=32", "fused_roll_reshape_permute_reshape_qkv_dense_tensorcore.cuda", [["TENSOR", [1, 32, 32, 256], "float16"], ["TENSOR", [768, 256], "float16"], 1, 32, 32, 256, 3, 8], {}], "config": {"index": 13413, "code_hash": null, "entity": [["block_row_warps", "ot", 1], ["block_col_warps", "ot", 2], ["warp_row_tiles", "ot", 4], ["warp_col_tiles", "ot", 2], ["chunk", "ot", 2], ["offset", "ot", 8], ["offsetCS", "ot", 0], ["vec", "ot", 4], ["wmma_m", "ot", 8]]}, "result": [[1.6848478e-05], 0, 1.194432258605957, 1652113523.728029], "version": 0.2, "tvm_version": "0.8.0"}
{"input": ["cuda -keys=cuda,gpu -max_num_threads=1024 -thread_warp_size=32", "fused_roll_reshape_permute_reshape_qkv_dense_tensorcore.cuda", [["TENSOR", [1, 32, 32, 256], "float16"], ["TENSOR", [768, 256], "float16"], 1, 32, 32, 256, 3, 8], {}], "config": {"index": 5856, "code_hash": null, "entity": [["block_row_warps", "ot", 1], ["block_col_warps", "ot", 4], ["warp_row_tiles", "ot", 4], ["warp_col_tiles", "ot", 1], ["chunk", "ot", 1], ["offset", "ot", 0], ["offsetCS", "ot", 8], ["vec", "ot", 1], ["wmma_m", "ot", 16]]}, "result": [[1.8999909e-05], 0, 1.0840144157409668, 1652113524.1958861], "version": 0.2, "tvm_version": "0.8.0"}
{"input": ["cuda -keys=cuda,gpu -max_num_threads=1024 -thread_warp_size=32", "fused_roll_reshape_permute_reshape_qkv_dense_tensorcore.cuda", [["TENSOR", [1, 32, 32, 256], "float16"], ["TENSOR", [768, 256], "float16"], 1, 32, 32, 256, 3, 8], {}], "config": {"index": 3957, "code_hash": null, "entity": [["block_row_warps", "ot", 1], ["block_col_warps", "ot", 4], ["warp_row_tiles", "ot", 2], ["warp_col_tiles", "ot", 4], ["chunk", "ot", 1], ["offset", "ot", 0], ["offsetCS", "ot", 0], ["vec", "ot", 8], ["wmma_m", "ot", 32]]}, "result": [[2.3108565e-05], 0, 1.2005019187927246, 1652113525.2982657], "version": 0.2, "tvm_version": "0.8.0"}
{"input": ["cuda -keys=cuda,gpu -max_num_threads=1024 -thread_warp_size=32", "fused_roll_reshape_permute_reshape_qkv_dense_tensorcore.cuda", [["TENSOR", [1, 32, 32, 256], "float16"], ["TENSOR", [768, 256], "float16"], 1, 32, 32, 256, 3, 8], {}], "config": {"index": 13573, "code_hash": null, "entity": [["block_row_warps", "ot", 2], ["block_col_warps", "ot", 1], ["warp_row_tiles", "ot", 4], ["warp_col_tiles", "ot", 2], ["chunk", "ot", 8], ["offset", "ot", 8], ["offsetCS", "ot", 0], ["vec", "ot", 4], ["wmma_m", "ot", 8]]}, "result": [[1.5929971000000002e-05], 0, 1.495478630065918, 1652113525.8801517], "version": 0.2, "tvm_version": "0.8.0"}
{"input": ["cuda -keys=cuda,gpu -max_num_threads=1024 -thread_warp_size=32", "fused_roll_reshape_permute_reshape_qkv_dense_tensorcore.cuda", [["TENSOR", [1, 32, 32, 256], "float16"], ["TENSOR", [768, 256], "float16"], 1, 32, 32, 256, 3, 8], {}], "config": {"index": 3799, "code_hash": null, "entity": [["block_row_warps", "ot", 2], ["block_col_warps", "ot", 1], ["warp_row_tiles", "ot", 4], ["warp_col_tiles", "ot", 4], ["chunk", "ot", 4], ["offset", "ot", 8], ["offsetCS", "ot", 8], ["vec", "ot", 4], ["wmma_m", "ot", 32]]}, "result": [[2.1250942999999998e-05], 0, 1.388347864151001, 1652113527.0688453], "version": 0.2, "tvm_version": "0.8.0"}
{"input": ["cuda -keys=cuda,gpu -max_num_threads=1024 -thread_warp_size=32", "fused_roll_reshape_permute_reshape_qkv_dense_tensorcore.cuda", [["TENSOR", [1, 32, 32, 256], "float16"], ["TENSOR", [768, 256], "float16"], 1, 32, 32, 256, 3, 8], {}], "config": {"index": 6197, "code_hash": null, "entity": [["block_row_warps", "ot", 4], ["block_col_warps", "ot", 2], ["warp_row_tiles", "ot", 2], ["warp_col_tiles", "ot", 2], ["chunk", "ot", 1], ["offset", "ot", 8], ["offsetCS", "ot", 8], ["vec", "ot", 1], ["wmma_m", "ot", 16]]}, "result": [[2.2339226e-05], 0, 1.0537755489349365, 1652113528.1525128], "version": 0.2, "tvm_version": "0.8.0"}
{"input": ["cuda -keys=cuda,gpu -max_num_threads=1024 -thread_warp_size=32", "fused_roll_reshape_permute_reshape_qkv_dense_tensorcore.cuda", [["TENSOR", [1, 32, 32, 256], "float16"], ["TENSOR", [768, 256], "float16"], 1, 32, 32, 256, 3, 8], {}], "config": {"index": 2624, "code_hash": null, "entity": [["block_row_warps", "ot", 4], ["block_col_warps", "ot", 2], ["warp_row_tiles", "ot", 1], ["warp_col_tiles", "ot", 2], ["chunk", "ot", 1], ["offset", "ot", 0], ["offsetCS", "ot", 0], ["vec", "ot", 4], ["wmma_m", "ot", 32]]}, "result": [[3.0923807e-05], 0, 1.1422615051269531, 1652113528.7043083], "version": 0.2, "tvm_version": "0.8.0"}
{"input": ["cuda -keys=cuda,gpu -max_num_threads=1024 -thread_warp_size=32", "fused_roll_reshape_permute_reshape_qkv_dense_tensorcore.cuda", [["TENSOR", [1, 32, 32, 256], "float16"], ["TENSOR", [768, 256], "float16"], 1, 32, 32, 256, 3, 8], {}], "config": {"index": 13855, "code_hash": null, "entity": [["block_row_warps", "ot", 2], ["block_col_warps", "ot", 2], ["warp_row_tiles", "ot", 1], ["warp_col_tiles", "ot", 1], ["chunk", "ot", 8], ["offset", "ot", 0], ["offsetCS", "ot", 8], ["vec", "ot", 4], ["wmma_m", "ot", 8]]}, "result": [[6.0124604e-05], 0, 1.2595129013061523, 1652113529.9167554], "version": 0.2, "tvm_version": "0.8.0"}
{"input": ["cuda -keys=cuda,gpu -max_num_threads=1024 -thread_warp_size=32", "fused_roll_reshape_permute_reshape_qkv_dense_tensorcore.cuda", [["TENSOR", [1, 32, 32, 256], "float16"], ["TENSOR", [768, 256], "float16"], 1, 32, 32, 256, 3, 8], {}], "config": {"index": 6911, "code_hash": null, "entity": [["block_row_warps", "ot", 4], ["block_col_warps", "ot", 4], ["warp_row_tiles", "ot", 4], ["warp_col_tiles", "ot", 1], ["chunk", "ot", 2], ["offset", "ot", 8], ["offsetCS", "ot", 0], ["vec", "ot", 2], ["wmma_m", "ot", 16]]}, "result": [[1.4220499999999999e-05], 0, 1.0639526844024658, 1652113530.9701328], "version": 0.2, "tvm_version": "0.8.0"}
{"input": ["cuda -keys=cuda,gpu -max_num_threads=1024 -thread_warp_size=32", "fused_roll_reshape_permute_reshape_qkv_dense_tensorcore.cuda", [["TENSOR", [1, 32, 32, 256], "float16"], ["TENSOR", [768, 256], "float16"], 1, 32, 32, 256, 3, 8], {}], "config": {"index": 13892, "code_hash": null, "entity": [["block_row_warps", "ot", 4], ["block_col_warps", "ot", 2], ["warp_row_tiles", "ot", 2], ["warp_col_tiles", "ot", 2], ["chunk", "ot", 8], ["offset", "ot", 0], ["offsetCS", "ot", 8], ["vec", "ot", 4], ["wmma_m", "ot", 8]]}, "result": [[3.8128627e-05], 0, 1.2779908180236816, 1652113532.1632862], "version": 0.2, "tvm_version": "0.8.0"}
{"input": ["cuda -keys=cuda,gpu -max_num_threads=1024 -thread_warp_size=32", "fused_roll_reshape_permute_reshape_qkv_dense_tensorcore.cuda", [["TENSOR", [1, 32, 32, 256], "float16"], ["TENSOR", [768, 256], "float16"], 1, 32, 32, 256, 3, 8], {}], "config": {"index": 1896, "code_hash": null, "entity": [["block_row_warps", "ot", 1], ["block_col_warps", "ot", 4], ["warp_row_tiles", "ot", 1], ["warp_col_tiles", "ot", 2], ["chunk", "ot", 8], ["offset", "ot", 8], ["offsetCS", "ot", 0], ["vec", "ot", 2], ["wmma_m", "ot", 32]]}, "result": [[1.6236007e-05], 0, 1.2621924877166748, 1652113533.2937512], "version": 0.2, "tvm_version": "0.8.0"}
{"input": ["cuda -keys=cuda,gpu -max_num_threads=1024 -thread_warp_size=32", "fused_roll_reshape_permute_reshape_qkv_dense_tensorcore.cuda", [["TENSOR", [1, 32, 32, 256], "float16"], ["TENSOR", [768, 256], "float16"], 1, 32, 32, 256, 3, 8], {}], "config": {"index": 7341, "code_hash": null, "entity": [["block_row_warps", "ot", 1], ["block_col_warps", "ot", 4], ["warp_row_tiles", "ot", 4], ["warp_col_tiles", "ot", 2], ["chunk", "ot", 4], ["offset", "ot", 0], ["offsetCS", "ot", 8], ["vec", "ot", 2], ["wmma_m", "ot", 16]]}, "result": [[2.7150615999999998e-05], 0, 1.1584532260894775, 1652113533.8128316], "version": 0.2, "tvm_version": "0.8.0"}
{"input": ["cuda -keys=cuda,gpu -max_num_threads=1024 -thread_warp_size=32", "fused_roll_reshape_permute_reshape_qkv_dense_tensorcore.cuda", [["TENSOR", [1, 32, 32, 256], "float16"], ["TENSOR", [768, 256], "float16"], 1, 32, 32, 256, 3, 8], {}], "config": {"index": 10883, "code_hash": null, "entity": [["block_row_warps", "ot", 4], ["block_col_warps", "ot", 1], ["warp_row_tiles", "ot", 1], ["warp_col_tiles", "ot", 2], ["chunk", "ot", 4], ["offset", "ot", 8], ["offsetCS", "ot", 0], ["vec", "ot", 1], ["wmma_m", "ot", 8]]}, "result": [[2.6590198000000003e-05], 0, 1.0761840343475342, 1652113534.9119918], "version": 0.2, "tvm_version": "0.8.0"}
{"input": ["cuda -keys=cuda,gpu -max_num_threads=1024 -thread_warp_size=32", "fused_roll_reshape_permute_reshape_qkv_dense_tensorcore.cuda", [["TENSOR", [1, 32, 32, 256], "float16"], ["TENSOR", [768, 256], "float16"], 1, 32, 32, 256, 3, 8], {}], "config": {"index": 709, "code_hash": null, "entity": [["block_row_warps", "ot", 2], ["block_col_warps", "ot", 4], ["warp_row_tiles", "ot", 1], ["warp_col_tiles", "ot", 4], ["chunk", "ot", 1], ["offset", "ot", 0], ["offsetCS", "ot", 8], ["vec", "ot", 1], ["wmma_m", "ot", 32]]}, "result": [[2.3167327e-05], 0, 1.0592238903045654, 1652113535.3894446], "version": 0.2, "tvm_version": "0.8.0"}
{"input": ["cuda -keys=cuda,gpu -max_num_threads=1024 -thread_warp_size=32", "fused_roll_reshape_permute_reshape_qkv_dense_tensorcore.cuda", [["TENSOR", [1, 32, 32, 256], "float16"], ["TENSOR", [768, 256], "float16"], 1, 32, 32, 256, 3, 8], {}], "config": {"index": 3977, "code_hash": null, "entity": [["block_row_warps", "ot", 4], ["block_col_warps", "ot", 4], ["warp_row_tiles", "ot", 1], ["warp_col_tiles", "ot", 1], ["chunk", "ot", 2], ["offset", "ot", 0], ["offsetCS", "ot", 0], ["vec", "ot", 8], ["wmma_m", "ot", 32]]}, "result": [[5.209640600000001e-05], 0, 1.1731188297271729, 1652113536.548292], "version": 0.2, "tvm_version": "0.8.0"}
{"input": ["cuda -keys=cuda,gpu -max_num_threads=1024 -thread_warp_size=32", "fused_roll_reshape_permute_reshape_qkv_dense_tensorcore.cuda", [["TENSOR", [1, 32, 32, 256], "float16"], ["TENSOR", [768, 256], "float16"], 1, 32, 32, 256, 3, 8], {}], "config": {"index": 624, "code_hash": null, "entity": [["block_row_warps", "ot", 1], ["block_col_warps", "ot", 2], ["warp_row_tiles", "ot", 1], ["warp_col_tiles", "ot", 4], ["chunk", "ot", 8], ["offset", "ot", 8], ["offsetCS", "ot", 0], ["vec", "ot", 1], ["wmma_m", "ot", 32]]}, "result": [[1.8834463e-05], 0, 1.1713500022888184, 1652113537.1061978], "version": 0.2, "tvm_version": "0.8.0"}
{"input": ["cuda -keys=cuda,gpu -max_num_threads=1024 -thread_warp_size=32", "fused_roll_reshape_permute_reshape_qkv_dense_tensorcore.cuda", [["TENSOR", [1, 32, 32, 256], "float16"], ["TENSOR", [768, 256], "float16"], 1, 32, 32, 256, 3, 8], {}], "config": {"index": 14895, "code_hash": null, "entity": [["block_row_warps", "ot", 1], ["block_col_warps", "ot", 1], ["warp_row_tiles", "ot", 4], ["warp_col_tiles", "ot", 4], ["chunk", "ot", 8], ["offset", "ot", 8], ["offsetCS", "ot", 0], ["vec", "ot", 8], ["wmma_m", "ot", 8]]}, "result": [[1.2417106e-05], 0, 1.4105908870697021, 1652113538.3003638], "version": 0.2, "tvm_version": "0.8.0"}
{"input": ["cuda -keys=cuda,gpu -max_num_threads=1024 -thread_warp_size=32", "fused_roll_reshape_permute_reshape_qkv_dense_tensorcore.cuda", [["TENSOR", [1, 32, 32, 256], "float16"], ["TENSOR", [768, 256], "float16"], 1, 32, 32, 256, 3, 8], {}], "config": {"index": 6404, "code_hash": null, "entity": [["block_row_warps", "ot", 4], ["block_col_warps", "ot", 2], ["warp_row_tiles", "ot", 1], ["warp_col_tiles", "ot", 1], ["chunk", "ot", 8], ["offset", "ot", 8], ["offsetCS", "ot", 8], ["vec", "ot", 1], ["wmma_m", "ot", 16]]}, "result": [[2.1228527e-05], 0, 1.1687541007995605, 1652113539.554154], "version": 0.2, "tvm_version": "0.8.0"}
{"input": ["cuda -keys=cuda,gpu -max_num_threads=1024 -thread_warp_size=32", "fused_roll_reshape_permute_reshape_qkv_dense_tensorcore.cuda", [["TENSOR", [1, 32, 32, 256], "float16"], ["TENSOR", [768, 256], "float16"], 1, 32, 32, 256, 3, 8], {}], "config": {"index": 15165, "code_hash": null, "entity": [["block_row_warps", "ot", 1], ["block_col_warps", "ot", 1], ["warp_row_tiles", "ot", 4], ["warp_col_tiles", "ot", 1], ["chunk", "ot", 8], ["offset", "ot", 0], ["offsetCS", "ot", 8], ["vec", "ot", 8], ["wmma_m", "ot", 8]]}, "result": [[3.8134331e-05], 0, 1.098114013671875, 1652113540.22416], "version": 0.2, "tvm_version": "0.8.0"}
{"input": ["cuda -keys=cuda,gpu -max_num_threads=1024 -thread_warp_size=32", "fused_roll_reshape_permute_reshape_qkv_dense_tensorcore.cuda", [["TENSOR", [1, 32, 32, 256], "float16"], ["TENSOR", [768, 256], "float16"], 1, 32, 32, 256, 3, 8], {}], "config": {"index": 5311, "code_hash": null, "entity": [["block_row_warps", "ot", 2], ["block_col_warps", "ot", 1], ["warp_row_tiles", "ot", 4], ["warp_col_tiles", "ot", 2], ["chunk", "ot", 2], ["offset", "ot", 0], ["offsetCS", "ot", 0], ["vec", "ot", 1], ["wmma_m", "ot", 16]]}, "result": [[4.0854214e-05], 0, 1.1927497386932373, 1652113541.534915], "version": 0.2, "tvm_version": "0.8.0"}
{"input": ["cuda -keys=cuda,gpu -max_num_threads=1024 -thread_warp_size=32", "fused_roll_reshape_permute_reshape_qkv_dense_tensorcore.cuda", [["TENSOR", [1, 32, 32, 256], "float16"], ["TENSOR", [768, 256], "float16"], 1, 32, 32, 256, 3, 8], {}], "config": {"index": 12349, "code_hash": null, "entity": [["block_row_warps", "ot", 2], ["block_col_warps", "ot", 1], ["warp_row_tiles", "ot", 2], ["warp_col_tiles", "ot", 2], ["chunk", "ot", 1], ["offset", "ot", 0], ["offsetCS", "ot", 8], ["vec", "ot", 2], ["wmma_m", "ot", 8]]}, "result": [[1.8035904999999998e-05], 0, 0.9289076328277588, 1652113542.0151324], "version": 0.2, "tvm_version": "0.8.0"}
{"input": ["cuda -keys=cuda,gpu -max_num_threads=1024 -thread_warp_size=32", "fused_roll_reshape_permute_reshape_qkv_dense_tensorcore.cuda", [["TENSOR", [1, 32, 32, 256], "float16"], ["TENSOR", [768, 256], "float16"], 1, 32, 32, 256, 3, 8], {}], "config": {"index": 10702, "code_hash": null, "entity": [["block_row_warps", "ot", 2], ["block_col_warps", "ot", 1], ["warp_row_tiles", "ot", 2], ["warp_col_tiles", "ot", 1], ["chunk", "ot", 1], ["offset", "ot", 8], ["offsetCS", "ot", 0], ["vec", "ot", 1], ["wmma_m", "ot", 8]]}, "result": [[2.0496504000000004e-05], 0, 1.0007591247558594, 1652113543.080842], "version": 0.2, "tvm_version": "0.8.0"}
{"input": ["cuda -keys=cuda,gpu -max_num_threads=1024 -thread_warp_size=32", "fused_roll_reshape_permute_reshape_qkv_dense_tensorcore.cuda", [["TENSOR", [1, 32, 32, 256], "float16"], ["TENSOR", [768, 256], "float16"], 1, 32, 32, 256, 3, 8], {}], "config": {"index": 14584, "code_hash": null, "entity": [["block_row_warps", "ot", 2], ["block_col_warps", "ot", 2], ["warp_row_tiles", "ot", 1], ["warp_col_tiles", "ot", 1], ["chunk", "ot", 1], ["offset", "ot", 8], ["offsetCS", "ot", 0], ["vec", "ot", 8], ["wmma_m", "ot", 8]]}, "result": [[5.1537047e-05], 0, 1.0270848274230957, 1652113543.6511319], "version": 0.2, "tvm_version": "0.8.0"}
{"input": ["cuda -keys=cuda,gpu -max_num_threads=1024 -thread_warp_size=32", "fused_roll_reshape_permute_reshape_qkv_dense_tensorcore.cuda", [["TENSOR", [1, 32, 32, 256], "float16"], ["TENSOR", [768, 256], "float16"], 1, 32, 32, 256, 3, 8], {}], "config": {"index": 6992, "code_hash": null, "entity": [["block_row_warps", "ot", 4], ["block_col_warps", "ot", 4], ["warp_row_tiles", "ot", 4], ["warp_col_tiles", "ot", 1], ["chunk", "ot", 4], ["offset", "ot", 8], ["offsetCS", "ot", 0], ["vec", "ot", 2], ["wmma_m", "ot", 16]]}, "result": [[1.2628664000000001e-05], 0, 0.9264874458312988, 1652113544.8567712], "version": 0.2, "tvm_version": "0.8.0"}
{"input": ["cuda -keys=cuda,gpu -max_num_threads=1024 -thread_warp_size=32", "fused_roll_reshape_permute_reshape_qkv_dense_tensorcore.cuda", [["TENSOR", [1, 32, 32, 256], "float16"], ["TENSOR", [768, 256], "float16"], 1, 32, 32, 256, 3, 8], {}], "config": {"index": 7269, "code_hash": null, "entity": [["block_row_warps", "ot", 1], ["block_col_warps", "ot", 4], ["warp_row_tiles", "ot", 1], ["warp_col_tiles", "ot", 4], ["chunk", "ot", 2], ["offset", "ot", 0], ["offsetCS", "ot", 8], ["vec", "ot", 2], ["wmma_m", "ot", 16]]}, "result": [[3.5245663999999995e-05], 0, 0.9384081363677979, 1652113546.1340475], "version": 0.2, "tvm_version": "0.8.0"}
{"input": ["cuda -keys=cuda,gpu -max_num_threads=1024 -thread_warp_size=32", "fused_roll_reshape_permute_reshape_qkv_dense_tensorcore.cuda", [["TENSOR", [1, 32, 32, 256], "float16"], ["TENSOR", [768, 256], "float16"], 1, 32, 32, 256, 3, 8], {}], "config": {"index": 14483, "code_hash": null, "entity": [["block_row_warps", "ot", 4], ["block_col_warps", "ot", 1], ["warp_row_tiles", "ot", 2], ["warp_col_tiles", "ot", 4], ["chunk", "ot", 4], ["offset", "ot", 0], ["offsetCS", "ot", 0], ["vec", "ot", 8], ["wmma_m", "ot", 8]]}, "result": [[3.2076605000000004e-05], 0, 1.0107073783874512, 1652113547.4987686], "version": 0.2, "tvm_version": "0.8.0"}
{"input": ["cuda -keys=cuda,gpu -max_num_threads=1024 -thread_warp_size=32", "fused_roll_reshape_permute_reshape_qkv_dense_tensorcore.cuda", [["TENSOR", [1, 32, 32, 256], "float16"], ["TENSOR", [768, 256], "float16"], 1, 32, 32, 256, 3, 8], {}], "config": {"index": 14996, "code_hash": null, "entity": [["block_row_warps", "ot", 4], ["block_col_warps", "ot", 1], ["warp_row_tiles", "ot", 2], ["warp_col_tiles", "ot", 1], ["chunk", "ot", 2], ["offset", "ot", 0], ["offsetCS", "ot", 8], ["vec", "ot", 8], ["wmma_m", "ot", 8]]}, "result": [[2.8796915e-05], 0, 1.327972412109375, 1652113550.2075927], "version": 0.2, "tvm_version": "0.8.0"}
{"input": ["cuda -keys=cuda,gpu -max_num_threads=1024 -thread_warp_size=32", "fused_roll_reshape_permute_reshape_qkv_dense_tensorcore.cuda", [["TENSOR", [1, 32, 32, 256], "float16"], ["TENSOR", [768, 256], "float16"], 1, 32, 32, 256, 3, 8], {}], "config": {"index": 8214, "code_hash": null, "entity": [["block_row_warps", "ot", 1], ["block_col_warps", "ot", 4], ["warp_row_tiles", "ot", 1], ["warp_col_tiles", "ot", 2], ["chunk", "ot", 2], ["offset", "ot", 8], ["offsetCS", "ot", 0], ["vec", "ot", 4], ["wmma_m", "ot", 16]]}, "result": [[2.5138313e-05], 0, 1.2328662872314453, 1652113550.7167542], "version": 0.2, "tvm_version": "0.8.0"}
{"input": ["cuda -keys=cuda,gpu -max_num_threads=1024 -thread_warp_size=32", "fused_roll_reshape_permute_reshape_qkv_dense_tensorcore.cuda", [["TENSOR", [1, 32, 32, 256], "float16"], ["TENSOR", [768, 256], "float16"], 1, 32, 32, 256, 3, 8], {}], "config": {"index": 1299, "code_hash": null, "entity": [["block_row_warps", "ot", 1], ["block_col_warps", "ot", 2], ["warp_row_tiles", "ot", 1], ["warp_col_tiles", "ot", 1], ["chunk", "ot", 1], ["offset", "ot", 0], ["offsetCS", "ot", 0], ["vec", "ot", 2], ["wmma_m", "ot", 32]]}, "result": [[4.2406996999999994e-05], 0, 1.2213969230651855, 1652113552.8057265], "version": 0.2, "tvm_version": "0.8.0"}
{"input": ["cuda -keys=cuda,gpu -max_num_threads=1024 -thread_warp_size=32", "fused_roll_reshape_permute_reshape_qkv_dense_tensorcore.cuda", [["TENSOR", [1, 32, 32, 256], "float16"], ["TENSOR", [768, 256], "float16"], 1, 32, 32, 256, 3, 8], {}], "config": {"index": 12386, "code_hash": null, "entity": [["block_row_warps", "ot", 4], ["block_col_warps", "ot", 1], ["warp_row_tiles", "ot", 4], ["warp_col_tiles", "ot", 4], ["chunk", "ot", 1], ["offset", "ot", 0], ["offsetCS", "ot", 8], ["vec", "ot", 2], ["wmma_m", "ot", 8]]}, "result": [[2.0197514000000003e-05], 0, 1.4047303199768066, 1652113554.0532286], "version": 0.2, "tvm_version": "0.8.0"}
{"input": ["cuda -keys=cuda,gpu -max_num_threads=1024 -thread_warp_size=32", "fused_roll_reshape_permute_reshape_qkv_dense_tensorcore.cuda", [["TENSOR", [1, 32, 32, 256], "float16"], ["TENSOR", [768, 256], "float16"], 1, 32, 32, 256, 3, 8], {}], "config": {"index": 9158, "code_hash": null, "entity": [["block_row_warps", "ot", 4], ["block_col_warps", "ot", 2], ["warp_row_tiles", "ot", 1], ["warp_col_tiles", "ot", 1], ["chunk", "ot", 2], ["offset", "ot", 0], ["offsetCS", "ot", 0], ["vec", "ot", 8], ["wmma_m", "ot", 16]]}, "result": [[3.7009818e-05], 0, 1.1703414916992188, 1652113554.5903296], "version": 0.2, "tvm_version": "0.8.0"}
{"input": ["cuda -keys=cuda,gpu -max_num_threads=1024 -thread_warp_size=32", "fused_roll_reshape_permute_reshape_qkv_dense_tensorcore.cuda", [["TENSOR", [1, 32, 32, 256], "float16"], ["TENSOR", [768, 256], "float16"], 1, 32, 32, 256, 3, 8], {}], "config": {"index": 6491, "code_hash": null, "entity": [["block_row_warps", "ot", 4], ["block_col_warps", "ot", 1], ["warp_row_tiles", "ot", 2], ["warp_col_tiles", "ot", 1], ["chunk", "ot", 1], ["offset", "ot", 0], ["offsetCS", "ot", 0], ["vec", "ot", 2], ["wmma_m", "ot", 16]]}, "result": [[2.0946574e-05], 0, 1.1214675903320312, 1652113555.8320692], "version": 0.2, "tvm_version": "0.8.0"}
{"input": ["cuda -keys=cuda,gpu -max_num_threads=1024 -thread_warp_size=32", "fused_roll_reshape_permute_reshape_qkv_dense_tensorcore.cuda", [["TENSOR", [1, 32, 32, 256], "float16"], ["TENSOR", [768, 256], "float16"], 1, 32, 32, 256, 3, 8], {}], "config": {"index": 10536, "code_hash": null, "entity": [["block_row_warps", "ot", 1], ["block_col_warps", "ot", 4], ["warp_row_tiles", "ot", 1], ["warp_col_tiles", "ot", 1], ["chunk", "ot", 4], ["offset", "ot", 0], ["offsetCS", "ot", 0], ["vec", "ot", 1], ["wmma_m", "ot", 8]]}, "result": [[5.907532e-05], 0, 1.3648405075073242, 1652113556.4833372], "version": 0.2, "tvm_version": "0.8.0"}
{"input": ["cuda -keys=cuda,gpu -max_num_threads=1024 -thread_warp_size=32", "fused_roll_reshape_permute_reshape_qkv_dense_tensorcore.cuda", [["TENSOR", [1, 32, 32, 256], "float16"], ["TENSOR", [768, 256], "float16"], 1, 32, 32, 256, 3, 8], {}], "config": {"index": 4610, "code_hash": null, "entity": [["block_row_warps", "ot", 4], ["block_col_warps", "ot", 1], ["warp_row_tiles", "ot", 4], ["warp_col_tiles", "ot", 4], ["chunk", "ot", 1], ["offset", "ot", 0], ["offsetCS", "ot", 8], ["vec", "ot", 8], ["wmma_m", "ot", 32]]}, "result": [[4.618491199999999e-05], 0, 1.3439228534698486, 1652113558.5374699], "version": 0.2, "tvm_version": "0.8.0"}
{"input": ["cuda -keys=cuda,gpu -max_num_threads=1024 -thread_warp_size=32", "fused_roll_reshape_permute_reshape_qkv_dense_tensorcore.cuda", [["TENSOR", [1, 32, 32, 256], "float16"], ["TENSOR", [768, 256], "float16"], 1, 32, 32, 256, 3, 8], {}], "config": {"index": 813, "code_hash": null, "entity": [["block_row_warps", "ot", 1], ["block_col_warps", "ot", 2], ["warp_row_tiles", "ot", 1], ["warp_col_tiles", "ot", 1], ["chunk", "ot", 4], ["offset", "ot", 0], ["offsetCS", "ot", 8], ["vec", "ot", 1], ["wmma_m", "ot", 32]]}, "result": [[5.0185313000000004e-05], 0, 1.3957874774932861, 1652113559.1197453], "version": 0.2, "tvm_version": "0.8.0"}
{"input": ["cuda -keys=cuda,gpu -max_num_threads=1024 -thread_warp_size=32", "fused_roll_reshape_permute_reshape_qkv_dense_tensorcore.cuda", [["TENSOR", [1, 32, 32, 256], "float16"], ["TENSOR", [768, 256], "float16"], 1, 32, 32, 256, 3, 8], {}], "config": {"index": 7743, "code_hash": null, "entity": [["block_row_warps", "ot", 1], ["block_col_warps", "ot", 2], ["warp_row_tiles", "ot", 4], ["warp_col_tiles", "ot", 2], ["chunk", "ot", 8], ["offset", "ot", 8], ["offsetCS", "ot", 8], ["vec", "ot", 2], ["wmma_m", "ot", 16]]}, "result": [[8.038758961681088e-06], 0, 1.5550868511199951, 1652113560.2885108], "version": 0.2, "tvm_version": "0.8.0"}
{"input": ["cuda -keys=cuda,gpu -max_num_threads=1024 -thread_warp_size=32", "fused_roll_reshape_permute_reshape_qkv_dense_tensorcore.cuda", [["TENSOR", [1, 32, 32, 256], "float16"], ["TENSOR", [768, 256], "float16"], 1, 32, 32, 256, 3, 8], {}], "config": {"index": 8439, "code_hash": null, "entity": [["block_row_warps", "ot", 1], ["block_col_warps", "ot", 4], ["warp_row_tiles", "ot", 2], ["warp_col_tiles", "ot", 1], ["chunk", "ot", 1], ["offset", "ot", 0], ["offsetCS", "ot", 8], ["vec", "ot", 4], ["wmma_m", "ot", 16]]}, "result": [[1.3857772000000001e-05], 0, 1.136240005493164, 1652113560.748463], "version": 0.2, "tvm_version": "0.8.0"}
{"input": ["cuda -keys=cuda,gpu -max_num_threads=1024 -thread_warp_size=32", "fused_roll_reshape_permute_reshape_qkv_dense_tensorcore.cuda", [["TENSOR", [1, 32, 32, 256], "float16"], ["TENSOR", [768, 256], "float16"], 1, 32, 32, 256, 3, 8], {}], "config": {"index": 7943, "code_hash": null, "entity": [["block_row_warps", "ot", 4], ["block_col_warps", "ot", 2], ["warp_row_tiles", "ot", 1], ["warp_col_tiles", "ot", 1], ["chunk", "ot", 4], ["offset", "ot", 0], ["offsetCS", "ot", 0], ["vec", "ot", 4], ["wmma_m", "ot", 16]]}, "result": [[5.4435618e-05], 0, 1.2232365608215332, 1652113561.925458], "version": 0.2, "tvm_version": "0.8.0"}
{"input": ["cuda -keys=cuda,gpu -max_num_threads=1024 -thread_warp_size=32", "fused_roll_reshape_permute_reshape_qkv_dense_tensorcore.cuda", [["TENSOR", [1, 32, 32, 256], "float16"], ["TENSOR", [768, 256], "float16"], 1, 32, 32, 256, 3, 8], {}], "config": {"index": 12160, "code_hash": null, "entity": [["block_row_warps", "ot", 2], ["block_col_warps", "ot", 1], ["warp_row_tiles", "ot", 2], ["warp_col_tiles", "ot", 1], ["chunk", "ot", 4], ["offset", "ot", 8], ["offsetCS", "ot", 0], ["vec", "ot", 2], ["wmma_m", "ot", 8]]}, "result": [[1.0811066999999999e-05], 0, 1.2129263877868652, 1652113563.000623], "version": 0.2, "tvm_version": "0.8.0"}
{"input": ["cuda -keys=cuda,gpu -max_num_threads=1024 -thread_warp_size=32", "fused_roll_reshape_permute_reshape_qkv_dense_tensorcore.cuda", [["TENSOR", [1, 32, 32, 256], "float16"], ["TENSOR", [768, 256], "float16"], 1, 32, 32, 256, 3, 8], {}], "config": {"index": 9796, "code_hash": null, "entity": [["block_row_warps", "ot", 2], ["block_col_warps", "ot", 2], ["warp_row_tiles", "ot", 4], ["warp_col_tiles", "ot", 4], ["chunk", "ot", 1], ["offset", "ot", 0], ["offsetCS", "ot", 8], ["vec", "ot", 8], ["wmma_m", "ot", 16]]}, "result": [[2.7372e-05], 0, 1.1867318153381348, 1652113564.1456962], "version": 0.2, "tvm_version": "0.8.0"}
{"input": ["cuda -keys=cuda,gpu -max_num_threads=1024 -thread_warp_size=32", "fused_roll_reshape_permute_reshape_qkv_dense_tensorcore.cuda", [["TENSOR", [1, 32, 32, 256], "float16"], ["TENSOR", [768, 256], "float16"], 1, 32, 32, 256, 3, 8], {}], "config": {"index": 13538, "code_hash": null, "entity": [["block_row_warps", "ot", 4], ["block_col_warps", "ot", 1], ["warp_row_tiles", "ot", 2], ["warp_col_tiles", "ot", 1], ["chunk", "ot", 8], ["offset", "ot", 8], ["offsetCS", "ot", 0], ["vec", "ot", 4], ["wmma_m", "ot", 8]]}, "result": [[1.6117364999999997e-05], 0, 1.1862287521362305, 1652113565.226583], "version": 0.2, "tvm_version": "0.8.0"}
{"input": ["cuda -keys=cuda,gpu -max_num_threads=1024 -thread_warp_size=32", "fused_roll_reshape_permute_reshape_qkv_dense_tensorcore.cuda", [["TENSOR", [1, 32, 32, 256], "float16"], ["TENSOR", [768, 256], "float16"], 1, 32, 32, 256, 3, 8], {}], "config": {"index": 6131, "code_hash": null, "entity": [["block_row_warps", "ot", 4], ["block_col_warps", "ot", 1], ["warp_row_tiles", "ot", 1], ["warp_col_tiles", "ot", 4], ["chunk", "ot", 8], ["offset", "ot", 0], ["offsetCS", "ot", 8], ["vec", "ot", 1], ["wmma_m", "ot", 16]]}, "result": [[4.0228993999999994e-05], 0, 1.4236128330230713, 1652113565.8550003], "version": 0.2, "tvm_version": "0.8.0"}
{"input": ["cuda -keys=cuda,gpu -max_num_threads=1024 -thread_warp_size=32", "fused_roll_reshape_permute_reshape_qkv_dense_tensorcore.cuda", [["TENSOR", [1, 32, 32, 256], "float16"], ["TENSOR", [768, 256], "float16"], 1, 32, 32, 256, 3, 8], {}], "config": {"index": 8061, "code_hash": null, "entity": [["block_row_warps", "ot", 1], ["block_col_warps", "ot", 4], ["warp_row_tiles", "ot", 2], ["warp_col_tiles", "ot", 2], ["chunk", "ot", 8], ["offset", "ot", 0], ["offsetCS", "ot", 0], ["vec", "ot", 4], ["wmma_m", "ot", 16]]}, "result": [[3.3322462e-05], 0, 1.3221595287322998, 1652113566.9966059], "version": 0.2, "tvm_version": "0.8.0"}
{"input": ["cuda -keys=cuda,gpu -max_num_threads=1024 -thread_warp_size=32", "fused_roll_reshape_permute_reshape_qkv_dense_tensorcore.cuda", [["TENSOR", [1, 32, 32, 256], "float16"], ["TENSOR", [768, 256], "float16"], 1, 32, 32, 256, 3, 8], {}], "config": {"index": 144, "code_hash": null, "entity": [["block_row_warps", "ot", 1], ["block_col_warps", "ot", 1], ["warp_row_tiles", "ot", 2], ["warp_col_tiles", "ot", 4], ["chunk", "ot", 2], ["offset", "ot", 0], ["offsetCS", "ot", 0], ["vec", "ot", 1], ["wmma_m", "ot", 32]]}, "result": [[2.6665626000000002e-05], 0, 1.3341865539550781, 1652113567.5196154], "version": 0.2, "tvm_version": "0.8.0"}
{"input": ["cuda -keys=cuda,gpu -max_num_threads=1024 -thread_warp_size=32", "fused_roll_reshape_permute_reshape_qkv_dense_tensorcore.cuda", [["TENSOR", [1, 32, 32, 256], "float16"], ["TENSOR", [768, 256], "float16"], 1, 32, 32, 256, 3, 8], {}], "config": {"index": 5971, "code_hash": null, "entity": [["block_row_warps", "ot", 2], ["block_col_warps", "ot", 2], ["warp_row_tiles", "ot", 1], ["warp_col_tiles", "ot", 4], ["chunk", "ot", 2], ["offset", "ot", 0], ["offsetCS", "ot", 8], ["vec", "ot", 1], ["wmma_m", "ot", 16]]}, "result": [[3.1278656e-05], 0, 1.1413536071777344, 1652113568.6383796], "version": 0.2, "tvm_version": "0.8.0"}
{"input": ["cuda -keys=cuda,gpu -max_num_threads=1024 -thread_warp_size=32", "fused_roll_reshape_permute_reshape_qkv_dense_tensorcore.cuda", [["TENSOR", [1, 32, 32, 256], "float16"], ["TENSOR", [768, 256], "float16"], 1, 32, 32, 256, 3, 8], {}], "config": {"index": 9327, "code_hash": null, "entity": [["block_row_warps", "ot", 1], ["block_col_warps", "ot", 2], ["warp_row_tiles", "ot", 2], ["warp_col_tiles", "ot", 1], ["chunk", "ot", 8], ["offset", "ot", 0], ["offsetCS", "ot", 0], ["vec", "ot", 8], ["wmma_m", "ot", 16]]}, "result": [[4.6702063e-05], 0, 1.2771077156066895, 1652113569.854022], "version": 0.2, "tvm_version": "0.8.0"}
{"input": ["cuda -keys=cuda,gpu -max_num_threads=1024 -thread_warp_size=32", "fused_roll_reshape_permute_reshape_qkv_dense_tensorcore.cuda", [["TENSOR", [1, 32, 32, 256], "float16"], ["TENSOR", [768, 256], "float16"], 1, 32, 32, 256, 3, 8], {}], "config": {"index": 2736, "code_hash": null, "entity": [["block_row_warps", "ot", 1], ["block_col_warps", "ot", 1], ["warp_row_tiles", "ot", 2], ["warp_col_tiles", "ot", 4], ["chunk", "ot", 2], ["offset", "ot", 0], ["offsetCS", "ot", 0], ["vec", "ot", 4], ["wmma_m", "ot", 32]]}, "result": [[2.4684263000000002e-05], 0, 1.293503999710083, 1652113570.9504342], "version": 0.2, "tvm_version": "0.8.0"}
{"input": ["cuda -keys=cuda,gpu -max_num_threads=1024 -thread_warp_size=32", "fused_roll_reshape_permute_reshape_qkv_dense_tensorcore.cuda", [["TENSOR", [1, 32, 32, 256], "float16"], ["TENSOR", [768, 256], "float16"], 1, 32, 32, 256, 3, 8], {}], "config": {"index": 14329, "code_hash": null, "entity": [["block_row_warps", "ot", 2], ["block_col_warps", "ot", 1], ["warp_row_tiles", "ot", 4], ["warp_col_tiles", "ot", 4], ["chunk", "ot", 1], ["offset", "ot", 0], ["offsetCS", "ot", 0], ["vec", "ot", 8], ["wmma_m", "ot", 8]]}, "result": [[2.2842067e-05], 0, 1.2449724674224854, 1652113572.0715513], "version": 0.2, "tvm_version": "0.8.0"}
{"input": ["cuda -keys=cuda,gpu -max_num_threads=1024 -thread_warp_size=32", "fused_roll_reshape_permute_reshape_qkv_dense_tensorcore.cuda", [["TENSOR", [1, 32, 32, 256], "float16"], ["TENSOR", [768, 256], "float16"], 1, 32, 32, 256, 3, 8], {}], "config": {"index": 7350, "code_hash": null, "entity": [["block_row_warps", "ot", 1], ["block_col_warps", "ot", 4], ["warp_row_tiles", "ot", 1], ["warp_col_tiles", "ot", 4], ["chunk", "ot", 4], ["offset", "ot", 0], ["offsetCS", "ot", 8], ["vec", "ot", 2], ["wmma_m", "ot", 16]]}, "result": [[4.4517406000000005e-05], 0, 1.4330811500549316, 1652113572.6398063], "version": 0.2, "tvm_version": "0.8.0"}
{"input": ["cuda -keys=cuda,gpu -max_num_threads=1024 -thread_warp_size=32", "fused_roll_reshape_permute_reshape_qkv_dense_tensorcore.cuda", [["TENSOR", [1, 32, 32, 256], "float16"], ["TENSOR", [768, 256], "float16"], 1, 32, 32, 256, 3, 8], {}], "config": {"index": 7249, "code_hash": null, "entity": [["block_row_warps", "ot", 2], ["block_col_warps", "ot", 2], ["warp_row_tiles", "ot", 2], ["warp_col_tiles", "ot", 2], ["chunk", "ot", 2], ["offset", "ot", 0], ["offsetCS", "ot", 8], ["vec", "ot", 2], ["wmma_m", "ot", 16]]}, "result": [[1.6857818e-05], 0, 1.200833797454834, 1652113573.7168143], "version": 0.2, "tvm_version": "0.8.0"}
{"input": ["cuda -keys=cuda,gpu -max_num_threads=1024 -thread_warp_size=32", "fused_roll_reshape_permute_reshape_qkv_dense_tensorcore.cuda", [["TENSOR", [1, 32, 32, 256], "float16"], ["TENSOR", [768, 256], "float16"], 1, 32, 32, 256, 3, 8], {}], "config": {"index": 2789, "code_hash": null, "entity": [["block_row_warps", "ot", 4], ["block_col_warps", "ot", 4], ["warp_row_tiles", "ot", 1], ["warp_col_tiles", "ot", 2], ["chunk", "ot", 4], ["offset", "ot", 0], ["offsetCS", "ot", 0], ["vec", "ot", 4], ["wmma_m", "ot", 32]]}, "result": [[4.4878254e-05], 0, 1.1971182823181152, 1652113574.851643], "version": 0.2, "tvm_version": "0.8.0"}
{"input": ["cuda -keys=cuda,gpu -max_num_threads=1024 -thread_warp_size=32", "fused_roll_reshape_permute_reshape_qkv_dense_tensorcore.cuda", [["TENSOR", [1, 32, 32, 256], "float16"], ["TENSOR", [768, 256], "float16"], 1, 32, 32, 256, 3, 8], {}], "config": {"index": 3199, "code_hash": null, "entity": [["block_row_warps", "ot", 2], ["block_col_warps", "ot", 2], ["warp_row_tiles", "ot", 2], ["warp_col_tiles", "ot", 2], ["chunk", "ot", 8], ["offset", "ot", 8], ["offsetCS", "ot", 0], ["vec", "ot", 4], ["wmma_m", "ot", 32]]}, "result": [[1.1735377e-05], 0, 1.3685178756713867, 1652113575.3850002], "version": 0.2, "tvm_version": "0.8.0"}
{"input": ["cuda -keys=cuda,gpu -max_num_threads=1024 -thread_warp_size=32", "fused_roll_reshape_permute_reshape_qkv_dense_tensorcore.cuda", [["TENSOR", [1, 32, 32, 256], "float16"], ["TENSOR", [768, 256], "float16"], 1, 32, 32, 256, 3, 8], {}], "config": {"index": 5341, "code_hash": null, "entity": [["block_row_warps", "ot", 2], ["block_col_warps", "ot", 2], ["warp_row_tiles", "ot", 4], ["warp_col_tiles", "ot", 4], ["chunk", "ot", 2], ["offset", "ot", 0], ["offsetCS", "ot", 0], ["vec", "ot", 1], ["wmma_m", "ot", 16]]}, "result": [[3.5304601e-05], 0, 1.557114601135254, 1652113618.9791613], "version": 0.2, "tvm_version": "0.8.0"}
{"input": ["cuda -keys=cuda,gpu -max_num_threads=1024 -thread_warp_size=32", "fused_roll_reshape_permute_reshape_qkv_dense_tensorcore.cuda", [["TENSOR", [1, 32, 32, 256], "float16"], ["TENSOR", [768, 256], "float16"], 1, 32, 32, 256, 3, 8], {}], "config": {"index": 5422, "code_hash": null, "entity": [["block_row_warps", "ot", 2], ["block_col_warps", "ot", 2], ["warp_row_tiles", "ot", 4], ["warp_col_tiles", "ot", 4], ["chunk", "ot", 4], ["offset", "ot", 0], ["offsetCS", "ot", 0], ["vec", "ot", 1], ["wmma_m", "ot", 16]]}, "result": [[4.4071768e-05], 0, 1.7748405933380127, 1652113619.688703], "version": 0.2, "tvm_version": "0.8.0"}
{"input": ["cuda -keys=cuda,gpu -max_num_threads=1024 -thread_warp_size=32", "fused_roll_reshape_permute_reshape_qkv_dense_tensorcore.cuda", [["TENSOR", [1, 32, 32, 256], "float16"], ["TENSOR", [768, 256], "float16"], 1, 32, 32, 256, 3, 8], {}], "config": {"index": 5584, "code_hash": null, "entity": [["block_row_warps", "ot", 2], ["block_col_warps", "ot", 2], ["warp_row_tiles", "ot", 4], ["warp_col_tiles", "ot", 4], ["chunk", "ot", 1], ["offset", "ot", 8], ["offsetCS", "ot", 0], ["vec", "ot", 1], ["wmma_m", "ot", 16]]}, "result": [[2.2055806e-05], 0, 1.3806772232055664, 1652113620.194948], "version": 0.2, "tvm_version": "0.8.0"}
{"input": ["cuda -keys=cuda,gpu -max_num_threads=1024 -thread_warp_size=32", "fused_roll_reshape_permute_reshape_qkv_dense_tensorcore.cuda", [["TENSOR", [1, 32, 32, 256], "float16"], ["TENSOR", [768, 256], "float16"], 1, 32, 32, 256, 3, 8], {}], "config": {"index": 5989, "code_hash": null, "entity": [["block_row_warps", "ot", 2], ["block_col_warps", "ot", 2], ["warp_row_tiles", "ot", 4], ["warp_col_tiles", "ot", 4], ["chunk", "ot", 2], ["offset", "ot", 0], ["offsetCS", "ot", 8], ["vec", "ot", 1], ["wmma_m", "ot", 16]]}, "result": [[1.992282e-05], 0, 1.4174797534942627, 1652113620.731065], "version": 0.2, "tvm_version": "0.8.0"}
{"input": ["cuda -keys=cuda,gpu -max_num_threads=1024 -thread_warp_size=32", "fused_roll_reshape_permute_reshape_qkv_dense_tensorcore.cuda", [["TENSOR", [1, 32, 32, 256], "float16"], ["TENSOR", [768, 256], "float16"], 1, 32, 32, 256, 3, 8], {}], "config": {"index": 6232, "code_hash": null, "entity": [["block_row_warps", "ot", 2], ["block_col_warps", "ot", 2], ["warp_row_tiles", "ot", 4], ["warp_col_tiles", "ot", 4], ["chunk", "ot", 1], ["offset", "ot", 8], ["offsetCS", "ot", 8], ["vec", "ot", 1], ["wmma_m", "ot", 16]]}, "result": [[2.0475142e-05], 0, 1.3919174671173096, 1652113621.275194], "version": 0.2, "tvm_version": "0.8.0"}
{"input": ["cuda -keys=cuda,gpu -max_num_threads=1024 -thread_warp_size=32", "fused_roll_reshape_permute_reshape_qkv_dense_tensorcore.cuda", [["TENSOR", [1, 32, 32, 256], "float16"], ["TENSOR", [768, 256], "float16"], 1, 32, 32, 256, 3, 8], {}], "config": {"index": 5260, "code_hash": null, "entity": [["block_row_warps", "ot", 2], ["block_col_warps", "ot", 2], ["warp_row_tiles", "ot", 4], ["warp_col_tiles", "ot", 4], ["chunk", "ot", 1], ["offset", "ot", 0], ["offsetCS", "ot", 0], ["vec", "ot", 1], ["wmma_m", "ot", 16]]}, "result": [[3.223881e-05], 0, 1.2424688339233398, 1652113621.8253183], "version": 0.2, "tvm_version": "0.8.0"}
{"input": ["cuda -keys=cuda,gpu -max_num_threads=1024 -thread_warp_size=32", "fused_roll_reshape_permute_reshape_qkv_dense_tensorcore.cuda", [["TENSOR", [1, 32, 32, 256], "float16"], ["TENSOR", [768, 256], "float16"], 1, 32, 32, 256, 3, 8], {}], "config": {"index": 6313, "code_hash": null, "entity": [["block_row_warps", "ot", 2], ["block_col_warps", "ot", 2], ["warp_row_tiles", "ot", 4], ["warp_col_tiles", "ot", 4], ["chunk", "ot", 2], ["offset", "ot", 8], ["offsetCS", "ot", 8], ["vec", "ot", 1], ["wmma_m", "ot", 16]]}, "result": [[2.2446471e-05], 0, 1.4621591567993164, 1652113622.3614118], "version": 0.2, "tvm_version": "0.8.0"}
{"input": ["cuda -keys=cuda,gpu -max_num_threads=1024 -thread_warp_size=32", "fused_roll_reshape_permute_reshape_qkv_dense_tensorcore.cuda", [["TENSOR", [1, 32, 32, 256], "float16"], ["TENSOR", [768, 256], "float16"], 1, 32, 32, 256, 3, 8], {}], "config": {"index": 5908, "code_hash": null, "entity": [["block_row_warps", "ot", 2], ["block_col_warps", "ot", 2], ["warp_row_tiles", "ot", 4], ["warp_col_tiles", "ot", 4], ["chunk", "ot", 1], ["offset", "ot", 0], ["offsetCS", "ot", 8], ["vec", "ot", 1], ["wmma_m", "ot", 16]]}, "result": [[2.9345742e-05], 0, 1.352017879486084, 1652113622.9396698], "version": 0.2, "tvm_version": "0.8.0"}
{"input": ["cuda -keys=cuda,gpu -max_num_threads=1024 -thread_warp_size=32", "fused_roll_reshape_permute_reshape_qkv_dense_tensorcore.cuda", [["TENSOR", [1, 32, 32, 256], "float16"], ["TENSOR", [768, 256], "float16"], 1, 32, 32, 256, 3, 8], {}], "config": {"index": 10444, "code_hash": null, "entity": [["block_row_warps", "ot", 2], ["block_col_warps", "ot", 2], ["warp_row_tiles", "ot", 4], ["warp_col_tiles", "ot", 4], ["chunk", "ot", 1], ["offset", "ot", 0], ["offsetCS", "ot", 0], ["vec", "ot", 1], ["wmma_m", "ot", 8]]}, "result": [[2.9056533000000002e-05], 0, 1.320038080215454, 1652113623.4672947], "version": 0.2, "tvm_version": "0.8.0"}
{"input": ["cuda -keys=cuda,gpu -max_num_threads=1024 -thread_warp_size=32", "fused_roll_reshape_permute_reshape_qkv_dense_tensorcore.cuda", [["TENSOR", [1, 32, 32, 256], "float16"], ["TENSOR", [768, 256], "float16"], 1, 32, 32, 256, 3, 8], {}], "config": {"index": 10525, "code_hash": null, "entity": [["block_row_warps", "ot", 2], ["block_col_warps", "ot", 2], ["warp_row_tiles", "ot", 4], ["warp_col_tiles", "ot", 4], ["chunk", "ot", 2], ["offset", "ot", 0], ["offsetCS", "ot", 0], ["vec", "ot", 1], ["wmma_m", "ot", 8]]}, "result": [[2.8601512e-05], 0, 1.4656333923339844, 1652113624.022012], "version": 0.2, "tvm_version": "0.8.0"}
{"input": ["cuda -keys=cuda,gpu -max_num_threads=1024 -thread_warp_size=32", "fused_roll_reshape_permute_reshape_qkv_dense_tensorcore.cuda", [["TENSOR", [1, 32, 32, 256], "float16"], ["TENSOR", [768, 256], "float16"], 1, 32, 32, 256, 3, 8], {}], "config": {"index": 10849, "code_hash": null, "entity": [["block_row_warps", "ot", 2], ["block_col_warps", "ot", 2], ["warp_row_tiles", "ot", 4], ["warp_col_tiles", "ot", 4], ["chunk", "ot", 2], ["offset", "ot", 8], ["offsetCS", "ot", 0], ["vec", "ot", 1], ["wmma_m", "ot", 8]]}, "result": [[2.3756325000000003e-05], 0, 1.426098108291626, 1652113624.6456835], "version": 0.2, "tvm_version": "0.8.0"}
{"input": ["cuda -keys=cuda,gpu -max_num_threads=1024 -thread_warp_size=32", "fused_roll_reshape_permute_reshape_qkv_dense_tensorcore.cuda", [["TENSOR", [1, 32, 32, 256], "float16"], ["TENSOR", [768, 256], "float16"], 1, 32, 32, 256, 3, 8], {}], "config": {"index": 10768, "code_hash": null, "entity": [["block_row_warps", "ot", 2], ["block_col_warps", "ot", 2], ["warp_row_tiles", "ot", 4], ["warp_col_tiles", "ot", 4], ["chunk", "ot", 1], ["offset", "ot", 8], ["offsetCS", "ot", 0], ["vec", "ot", 1], ["wmma_m", "ot", 8]]}, "result": [[2.5054043000000002e-05], 0, 1.3043625354766846, 1652113625.1614606], "version": 0.2, "tvm_version": "0.8.0"}
{"input": ["cuda -keys=cuda,gpu -max_num_threads=1024 -thread_warp_size=32", "fused_roll_reshape_permute_reshape_qkv_dense_tensorcore.cuda", [["TENSOR", [1, 32, 32, 256], "float16"], ["TENSOR", [768, 256], "float16"], 1, 32, 32, 256, 3, 8], {}], "config": {"index": 11092, "code_hash": null, "entity": [["block_row_warps", "ot", 2], ["block_col_warps", "ot", 2], ["warp_row_tiles", "ot", 4], ["warp_col_tiles", "ot", 4], ["chunk", "ot", 1], ["offset", "ot", 0], ["offsetCS", "ot", 8], ["vec", "ot", 1], ["wmma_m", "ot", 8]]}, "result": [[3.1388615e-05], 0, 1.2672476768493652, 1652113625.6947763], "version": 0.2, "tvm_version": "0.8.0"}
{"input": ["cuda -keys=cuda,gpu -max_num_threads=1024 -thread_warp_size=32", "fused_roll_reshape_permute_reshape_qkv_dense_tensorcore.cuda", [["TENSOR", [1, 32, 32, 256], "float16"], ["TENSOR", [768, 256], "float16"], 1, 32, 32, 256, 3, 8], {}], "config": {"index": 14274, "code_hash": null, "entity": [["block_row_warps", "ot", 1], ["block_col_warps", "ot", 1], ["warp_row_tiles", "ot", 4], ["warp_col_tiles", "ot", 1], ["chunk", "ot", 1], ["offset", "ot", 0], ["offsetCS", "ot", 0], ["vec", "ot", 8], ["wmma_m", "ot", 8]]}, "result": [[2.2071901e-05], 0, 1.17854905128479, 1652113626.2303367], "version": 0.2, "tvm_version": "0.8.0"}
{"input": ["cuda -keys=cuda,gpu -max_num_threads=1024 -thread_warp_size=32", "fused_roll_reshape_permute_reshape_qkv_dense_tensorcore.cuda", [["TENSOR", [1, 32, 32, 256], "float16"], ["TENSOR", [768, 256], "float16"], 1, 32, 32, 256, 3, 8], {}], "config": {"index": 4872, "code_hash": null, "entity": [["block_row_warps", "ot", 1], ["block_col_warps", "ot", 2], ["warp_row_tiles", "ot", 2], ["warp_col_tiles", "ot", 1], ["chunk", "ot", 1], ["offset", "ot", 8], ["offsetCS", "ot", 8], ["vec", "ot", 8], ["wmma_m", "ot", 32]]}, "result": [[4.1038238999999996e-05], 0, 1.1093406677246094, 1652113626.7777858], "version": 0.2, "tvm_version": "0.8.0"}
{"input": ["cuda -keys=cuda,gpu -max_num_threads=1024 -thread_warp_size=32", "fused_roll_reshape_permute_reshape_qkv_dense_tensorcore.cuda", [["TENSOR", [1, 32, 32, 256], "float16"], ["TENSOR", [768, 256], "float16"], 1, 32, 32, 256, 3, 8], {}], "config": {"index": 10390, "code_hash": null, "entity": [["block_row_warps", "ot", 2], ["block_col_warps", "ot", 2], ["warp_row_tiles", "ot", 4], ["warp_col_tiles", "ot", 1], ["chunk", "ot", 1], ["offset", "ot", 0], ["offsetCS", "ot", 0], ["vec", "ot", 1], ["wmma_m", "ot", 8]]}, "result": [[1.4007621e-05], 0, 1.1542720794677734, 1652113627.2404447], "version": 0.2, "tvm_version": "0.8.0"}
{"input": ["cuda -keys=cuda,gpu -max_num_threads=1024 -thread_warp_size=32", "fused_roll_reshape_permute_reshape_qkv_dense_tensorcore.cuda", [["TENSOR", [1, 32, 32, 256], "float16"], ["TENSOR", [768, 256], "float16"], 1, 32, 32, 256, 3, 8], {}], "config": {"index": 1686, "code_hash": null, "entity": [["block_row_warps", "ot", 1], ["block_col_warps", "ot", 2], ["warp_row_tiles", "ot", 2], ["warp_col_tiles", "ot", 4], ["chunk", "ot", 1], ["offset", "ot", 8], ["offsetCS", "ot", 0], ["vec", "ot", 2], ["wmma_m", "ot", 32]]}, "result": [[1.3254986e-05], 0, 1.1827058792114258, 1652113627.7368293], "version": 0.2, "tvm_version": "0.8.0"}
{"input": ["cuda -keys=cuda,gpu -max_num_threads=1024 -thread_warp_size=32", "fused_roll_reshape_permute_reshape_qkv_dense_tensorcore.cuda", [["TENSOR", [1, 32, 32, 256], "float16"], ["TENSOR", [768, 256], "float16"], 1, 32, 32, 256, 3, 8], {}], "config": {"index": 2098, "code_hash": null, "entity": [["block_row_warps", "ot", 2], ["block_col_warps", "ot", 1], ["warp_row_tiles", "ot", 4], ["warp_col_tiles", "ot", 4], ["chunk", "ot", 2], ["offset", "ot", 0], ["offsetCS", "ot", 8], ["vec", "ot", 2], ["wmma_m", "ot", 32]]}, "result": [[1.7861112999999996e-05], 0, 1.2823712825775146, 1652113628.2579942], "version": 0.2, "tvm_version": "0.8.0"}
{"input": ["cuda -keys=cuda,gpu -max_num_threads=1024 -thread_warp_size=32", "fused_roll_reshape_permute_reshape_qkv_dense_tensorcore.cuda", [["TENSOR", [1, 32, 32, 256], "float16"], ["TENSOR", [768, 256], "float16"], 1, 32, 32, 256, 3, 8], {}], "config": {"index": 7588, "code_hash": null, "entity": [["block_row_warps", "ot", 2], ["block_col_warps", "ot", 1], ["warp_row_tiles", "ot", 1], ["warp_col_tiles", "ot", 4], ["chunk", "ot", 2], ["offset", "ot", 8], ["offsetCS", "ot", 8], ["vec", "ot", 2], ["wmma_m", "ot", 16]]}, "result": [[1.6203105e-05], 0, 1.2284014225006104, 1652113628.7293146], "version": 0.2, "tvm_version": "0.8.0"}
{"input": ["cuda -keys=cuda,gpu -max_num_threads=1024 -thread_warp_size=32", "fused_roll_reshape_permute_reshape_qkv_dense_tensorcore.cuda", [["TENSOR", [1, 32, 32, 256], "float16"], ["TENSOR", [768, 256], "float16"], 1, 32, 32, 256, 3, 8], {}], "config": {"index": 8876, "code_hash": null, "entity": [["block_row_warps", "ot", 4], ["block_col_warps", "ot", 1], ["warp_row_tiles", "ot", 4], ["warp_col_tiles", "ot", 2], ["chunk", "ot", 2], ["offset", "ot", 8], ["offsetCS", "ot", 8], ["vec", "ot", 4], ["wmma_m", "ot", 16]]}, "result": [[1.71497e-05], 0, 1.2153167724609375, 1652113629.2540066], "version": 0.2, "tvm_version": "0.8.0"}
{"input": ["cuda -keys=cuda,gpu -max_num_threads=1024 -thread_warp_size=32", "fused_roll_reshape_permute_reshape_qkv_dense_tensorcore.cuda", [["TENSOR", [1, 32, 32, 256], "float16"], ["TENSOR", [768, 256], "float16"], 1, 32, 32, 256, 3, 8], {}], "config": {"index": 463, "code_hash": null, "entity": [["block_row_warps", "ot", 2], ["block_col_warps", "ot", 2], ["warp_row_tiles", "ot", 1], ["warp_col_tiles", "ot", 4], ["chunk", "ot", 2], ["offset", "ot", 8], ["offsetCS", "ot", 0], ["vec", "ot", 1], ["wmma_m", "ot", 32]]}, "result": [[2.0536518e-05], 0, 1.161595106124878, 1652113629.729724], "version": 0.2, "tvm_version": "0.8.0"}
{"input": ["cuda -keys=cuda,gpu -max_num_threads=1024 -thread_warp_size=32", "fused_roll_reshape_permute_reshape_qkv_dense_tensorcore.cuda", [["TENSOR", [1, 32, 32, 256], "float16"], ["TENSOR", [768, 256], "float16"], 1, 32, 32, 256, 3, 8], {}], "config": {"index": 14302, "code_hash": null, "entity": [["block_row_warps", "ot", 2], ["block_col_warps", "ot", 1], ["warp_row_tiles", "ot", 4], ["warp_col_tiles", "ot", 2], ["chunk", "ot", 1], ["offset", "ot", 0], ["offsetCS", "ot", 0], ["vec", "ot", 8], ["wmma_m", "ot", 8]]}, "result": [[2.2901135e-05], 0, 1.257249116897583, 1652113630.242168], "version": 0.2, "tvm_version": "0.8.0"}
{"input": ["cuda -keys=cuda,gpu -max_num_threads=1024 -thread_warp_size=32", "fused_roll_reshape_permute_reshape_qkv_dense_tensorcore.cuda", [["TENSOR", [1, 32, 32, 256], "float16"], ["TENSOR", [768, 256], "float16"], 1, 32, 32, 256, 3, 8], {}], "config": {"index": 2291, "code_hash": null, "entity": [["block_row_warps", "ot", 4], ["block_col_warps", "ot", 2], ["warp_row_tiles", "ot", 4], ["warp_col_tiles", "ot", 1], ["chunk", "ot", 1], ["offset", "ot", 8], ["offsetCS", "ot", 8], ["vec", "ot", 2], ["wmma_m", "ot", 32]]}, "result": [[4.8506187e-05], 0, 1.3540363311767578, 1652113630.8414485], "version": 0.2, "tvm_version": "0.8.0"}
{"input": ["cuda -keys=cuda,gpu -max_num_threads=1024 -thread_warp_size=32", "fused_roll_reshape_permute_reshape_qkv_dense_tensorcore.cuda", [["TENSOR", [1, 32, 32, 256], "float16"], ["TENSOR", [768, 256], "float16"], 1, 32, 32, 256, 3, 8], {}], "config": {"index": 6220, "code_hash": null, "entity": [["block_row_warps", "ot", 2], ["block_col_warps", "ot", 1], ["warp_row_tiles", "ot", 2], ["warp_col_tiles", "ot", 4], ["chunk", "ot", 1], ["offset", "ot", 8], ["offsetCS", "ot", 8], ["vec", "ot", 1], ["wmma_m", "ot", 16]]}, "result": [[2.5582262e-05], 0, 1.230358362197876, 1652113631.3497374], "version": 0.2, "tvm_version": "0.8.0"}
{"input": ["cuda -keys=cuda,gpu -max_num_threads=1024 -thread_warp_size=32", "fused_roll_reshape_permute_reshape_qkv_dense_tensorcore.cuda", [["TENSOR", [1, 32, 32, 256], "float16"], ["TENSOR", [768, 256], "float16"], 1, 32, 32, 256, 3, 8], {}], "config": {"index": 9979, "code_hash": null, "entity": [["block_row_warps", "ot", 2], ["block_col_warps", "ot", 4], ["warp_row_tiles", "ot", 2], ["warp_col_tiles", "ot", 1], ["chunk", "ot", 8], ["offset", "ot", 0], ["offsetCS", "ot", 8], ["vec", "ot", 8], ["wmma_m", "ot", 16]]}, "result": [[3.3978266e-05], 0, 1.3228554725646973, 1652113631.8911552], "version": 0.2, "tvm_version": "0.8.0"}
{"input": ["cuda -keys=cuda,gpu -max_num_threads=1024 -thread_warp_size=32", "fused_roll_reshape_permute_reshape_qkv_dense_tensorcore.cuda", [["TENSOR", [1, 32, 32, 256], "float16"], ["TENSOR", [768, 256], "float16"], 1, 32, 32, 256, 3, 8], {}], "config": {"index": 11212, "code_hash": null, "entity": [["block_row_warps", "ot", 2], ["block_col_warps", "ot", 4], ["warp_row_tiles", "ot", 1], ["warp_col_tiles", "ot", 2], ["chunk", "ot", 4], ["offset", "ot", 0], ["offsetCS", "ot", 8], ["vec", "ot", 1], ["wmma_m", "ot", 8]]}, "result": [[5.8218471e-05], 0, 1.414975643157959, 1652113632.542417], "version": 0.2, "tvm_version": "0.8.0"}
{"input": ["cuda -keys=cuda,gpu -max_num_threads=1024 -thread_warp_size=32", "fused_roll_reshape_permute_reshape_qkv_dense_tensorcore.cuda", [["TENSOR", [1, 32, 32, 256], "float16"], ["TENSOR", [768, 256], "float16"], 1, 32, 32, 256, 3, 8], {}], "config": {"index": 3177, "code_hash": null, "entity": [["block_row_warps", "ot", 1], ["block_col_warps", "ot", 1], ["warp_row_tiles", "ot", 4], ["warp_col_tiles", "ot", 1], ["chunk", "ot", 8], ["offset", "ot", 8], ["offsetCS", "ot", 0], ["vec", "ot", 4], ["wmma_m", "ot", 32]]}, "result": [[1.5269316e-05], 0, 1.1559576988220215, 1652113633.128034], "version": 0.2, "tvm_version": "0.8.0"}
{"input": ["cuda -keys=cuda,gpu -max_num_threads=1024 -thread_warp_size=32", "fused_roll_reshape_permute_reshape_qkv_dense_tensorcore.cuda", [["TENSOR", [1, 32, 32, 256], "float16"], ["TENSOR", [768, 256], "float16"], 1, 32, 32, 256, 3, 8], {}], "config": {"index": 14153, "code_hash": null, "entity": [["block_row_warps", "ot", 4], ["block_col_warps", "ot", 2], ["warp_row_tiles", "ot", 1], ["warp_col_tiles", "ot", 4], ["chunk", "ot", 4], ["offset", "ot", 8], ["offsetCS", "ot", 8], ["vec", "ot", 4], ["wmma_m", "ot", 8]]}, "result": [[1.1790105000000001e-05], 0, 1.1490755081176758, 1652113633.5984032], "version": 0.2, "tvm_version": "0.8.0"}
{"input": ["cuda -keys=cuda,gpu -max_num_threads=1024 -thread_warp_size=32", "fused_roll_reshape_permute_reshape_qkv_dense_tensorcore.cuda", [["TENSOR", [1, 32, 32, 256], "float16"], ["TENSOR", [768, 256], "float16"], 1, 32, 32, 256, 3, 8], {}], "config": {"index": 11461, "code_hash": null, "entity": [["block_row_warps", "ot", 2], ["block_col_warps", "ot", 2], ["warp_row_tiles", "ot", 2], ["warp_col_tiles", "ot", 2], ["chunk", "ot", 2], ["offset", "ot", 8], ["offsetCS", "ot", 8], ["vec", "ot", 1], ["wmma_m", "ot", 8]]}, "result": [[3.4259448e-05], 0, 1.1035852432250977, 1652113651.2333004], "version": 0.2, "tvm_version": "0.8.0"}
{"input": ["cuda -keys=cuda,gpu -max_num_threads=1024 -thread_warp_size=32", "fused_roll_reshape_permute_reshape_qkv_dense_tensorcore.cuda", [["TENSOR", [1, 32, 32, 256], "float16"], ["TENSOR", [768, 256], "float16"], 1, 32, 32, 256, 3, 8], {}], "config": {"index": 3331, "code_hash": null, "entity": [["block_row_warps", "ot", 2], ["block_col_warps", "ot", 1], ["warp_row_tiles", "ot", 2], ["warp_col_tiles", "ot", 1], ["chunk", "ot", 2], ["offset", "ot", 0], ["offsetCS", "ot", 8], ["vec", "ot", 4], ["wmma_m", "ot", 32]]}, "result": [[4.4644966e-05], 0, 1.1324119567871094, 1652113651.8278494], "version": 0.2, "tvm_version": "0.8.0"}
{"input": ["cuda -keys=cuda,gpu -max_num_threads=1024 -thread_warp_size=32", "fused_roll_reshape_permute_reshape_qkv_dense_tensorcore.cuda", [["TENSOR", [1, 32, 32, 256], "float16"], ["TENSOR", [768, 256], "float16"], 1, 32, 32, 256, 3, 8], {}], "config": {"index": 10649, "code_hash": null, "entity": [["block_row_warps", "ot", 4], ["block_col_warps", "ot", 1], ["warp_row_tiles", "ot", 2], ["warp_col_tiles", "ot", 2], ["chunk", "ot", 8], ["offset", "ot", 0], ["offsetCS", "ot", 0], ["vec", "ot", 1], ["wmma_m", "ot", 8]]}, "result": [[3.4132444e-05], 0, 1.339545726776123, 1652113652.4509258], "version": 0.2, "tvm_version": "0.8.0"}
{"input": ["cuda -keys=cuda,gpu -max_num_threads=1024 -thread_warp_size=32", "fused_roll_reshape_permute_reshape_qkv_dense_tensorcore.cuda", [["TENSOR", [1, 32, 32, 256], "float16"], ["TENSOR", [768, 256], "float16"], 1, 32, 32, 256, 3, 8], {}], "config": {"index": 4911, "code_hash": null, "entity": [["block_row_warps", "ot", 1], ["block_col_warps", "ot", 4], ["warp_row_tiles", "ot", 4], ["warp_col_tiles", "ot", 2], ["chunk", "ot", 1], ["offset", "ot", 8], ["offsetCS", "ot", 8], ["vec", "ot", 8], ["wmma_m", "ot", 32]]}, "result": [[1.3454570000000001e-05], 0, 0.9795436859130859, 1652113652.9583764], "version": 0.2, "tvm_version": "0.8.0"}
{"input": ["cuda -keys=cuda,gpu -max_num_threads=1024 -thread_warp_size=32", "fused_roll_reshape_permute_reshape_qkv_dense_tensorcore.cuda", [["TENSOR", [1, 32, 32, 256], "float16"], ["TENSOR", [768, 256], "float16"], 1, 32, 32, 256, 3, 8], {}], "config": {"index": 15372, "code_hash": null, "entity": [["block_row_warps", "ot", 1], ["block_col_warps", "ot", 1], ["warp_row_tiles", "ot", 2], ["warp_col_tiles", "ot", 4], ["chunk", "ot", 2], ["offset", "ot", 8], ["offsetCS", "ot", 8], ["vec", "ot", 8], ["wmma_m", "ot", 8]]}, "result": [[1.6268429999999997e-05], 0, 1.1698884963989258, 1652113653.513155], "version": 0.2, "tvm_version": "0.8.0"}
{"input": ["cuda -keys=cuda,gpu -max_num_threads=1024 -thread_warp_size=32", "fused_roll_reshape_permute_reshape_qkv_dense_tensorcore.cuda", [["TENSOR", [1, 32, 32, 256], "float16"], ["TENSOR", [768, 256], "float16"], 1, 32, 32, 256, 3, 8], {}], "config": {"index": 8567, "code_hash": null, "entity": [["block_row_warps", "ot", 4], ["block_col_warps", "ot", 4], ["warp_row_tiles", "ot", 1], ["warp_col_tiles", "ot", 4], ["chunk", "ot", 2], ["offset", "ot", 0], ["offsetCS", "ot", 8], ["vec", "ot", 4], ["wmma_m", "ot", 16]]}, "result": [[2.6578095999999998e-05], 0, 0.9966893196105957, 1652113654.0518224], "version": 0.2, "tvm_version": "0.8.0"}
{"input": ["cuda -keys=cuda,gpu -max_num_threads=1024 -thread_warp_size=32", "fused_roll_reshape_permute_reshape_qkv_dense_tensorcore.cuda", [["TENSOR", [1, 32, 32, 256], "float16"], ["TENSOR", [768, 256], "float16"], 1, 32, 32, 256, 3, 8], {}], "config": {"index": 1814, "code_hash": null, "entity": [["block_row_warps", "ot", 4], ["block_col_warps", "ot", 2], ["warp_row_tiles", "ot", 1], ["warp_col_tiles", "ot", 2], ["chunk", "ot", 4], ["offset", "ot", 8], ["offsetCS", "ot", 0], ["vec", "ot", 2], ["wmma_m", "ot", 32]]}, "result": [[1.1668119000000001e-05], 0, 0.9325613975524902, 1652113654.533439], "version": 0.2, "tvm_version": "0.8.0"}
{"input": ["cuda -keys=cuda,gpu -max_num_threads=1024 -thread_warp_size=32", "fused_roll_reshape_permute_reshape_qkv_dense_tensorcore.cuda", [["TENSOR", [1, 32, 32, 256], "float16"], ["TENSOR", [768, 256], "float16"], 1, 32, 32, 256, 3, 8], {}], "config": {"index": 3700, "code_hash": null, "entity": [["block_row_warps", "ot", 2], ["block_col_warps", "ot", 1], ["warp_row_tiles", "ot", 1], ["warp_col_tiles", "ot", 4], ["chunk", "ot", 2], ["offset", "ot", 8], ["offsetCS", "ot", 8], ["vec", "ot", 4], ["wmma_m", "ot", 32]]}, "result": [[1.7691564e-05], 0, 1.013404130935669, 1652113655.0491388], "version": 0.2, "tvm_version": "0.8.0"}
{"input": ["cuda -keys=cuda,gpu -max_num_threads=1024 -thread_warp_size=32", "fused_roll_reshape_permute_reshape_qkv_dense_tensorcore.cuda", [["TENSOR", [1, 32, 32, 256], "float16"], ["TENSOR", [768, 256], "float16"], 1, 32, 32, 256, 3, 8], {}], "config": {"index": 13204, "code_hash": null, "entity": [["block_row_warps", "ot", 2], ["block_col_warps", "ot", 1], ["warp_row_tiles", "ot", 1], ["warp_col_tiles", "ot", 1], ["chunk", "ot", 8], ["offset", "ot", 0], ["offsetCS", "ot", 0], ["vec", "ot", 4], ["wmma_m", "ot", 8]]}, "result": [[6.1984522e-05], 0, 1.0826306343078613, 1652113655.6626427], "version": 0.2, "tvm_version": "0.8.0"}
{"input": ["cuda -keys=cuda,gpu -max_num_threads=1024 -thread_warp_size=32", "fused_roll_reshape_permute_reshape_qkv_dense_tensorcore.cuda", [["TENSOR", [1, 32, 32, 256], "float16"], ["TENSOR", [768, 256], "float16"], 1, 32, 32, 256, 3, 8], {}], "config": {"index": 6635, "code_hash": null, "entity": [["block_row_warps", "ot", 4], ["block_col_warps", "ot", 1], ["warp_row_tiles", "ot", 4], ["warp_col_tiles", "ot", 4], ["chunk", "ot", 2], ["offset", "ot", 0], ["offsetCS", "ot", 0], ["vec", "ot", 2], ["wmma_m", "ot", 16]]}, "result": [[2.0954306e-05], 0, 1.0941834449768066, 1652113656.1907995], "version": 0.2, "tvm_version": "0.8.0"}
{"input": ["cuda -keys=cuda,gpu -max_num_threads=1024 -thread_warp_size=32", "fused_roll_reshape_permute_reshape_qkv_dense_tensorcore.cuda", [["TENSOR", [1, 32, 32, 256], "float16"], ["TENSOR", [768, 256], "float16"], 1, 32, 32, 256, 3, 8], {}], "config": {"index": 2033, "code_hash": null, "entity": [["block_row_warps", "ot", 4], ["block_col_warps", "ot", 4], ["warp_row_tiles", "ot", 1], ["warp_col_tiles", "ot", 1], ["chunk", "ot", 2], ["offset", "ot", 0], ["offsetCS", "ot", 8], ["vec", "ot", 2], ["wmma_m", "ot", 32]]}, "result": [[2.7507739e-05], 0, 1.021416187286377, 1652113656.736224], "version": 0.2, "tvm_version": "0.8.0"}
{"input": ["cuda -keys=cuda,gpu -max_num_threads=1024 -thread_warp_size=32", "fused_roll_reshape_permute_reshape_qkv_dense_tensorcore.cuda", [["TENSOR", [1, 32, 32, 256], "float16"], ["TENSOR", [768, 256], "float16"], 1, 32, 32, 256, 3, 8], {}], "config": {"index": 14693, "code_hash": null, "entity": [["block_row_warps", "ot", 4], ["block_col_warps", "ot", 2], ["warp_row_tiles", "ot", 1], ["warp_col_tiles", "ot", 2], ["chunk", "ot", 2], ["offset", "ot", 8], ["offsetCS", "ot", 0], ["vec", "ot", 8], ["wmma_m", "ot", 8]]}, "result": [[2.0733791e-05], 0, 1.0306546688079834, 1652113657.223081], "version": 0.2, "tvm_version": "0.8.0"}
