python/models/swin_transformer/kernel_configs/swin_transformer_fused_reshape_permute_1_16_16_512_8_16
{"i": [["[\"fused_reshape_permute\", 1, 16, 16, 512, 8, 16]", "cuda -keys=cuda,gpu -max_num_threads=1024 -model=unknown -thread_warp_size=32", [-1, 16, 64, 49152, 2147483647, 1024, 8, 32], "", 0, []], [[], [["FU", 1, [0, 1, 2, 3, 4]], ["SP", 1, 0, 393216, [1], 1], ["AN", 1, 0, 5], ["AN", 1, 1, 6]]]], "r": [[0.000294245, 0.000294307, 0.000294218, 0.00029424, 0.000294256, 0.000294372, 0.000294202, 0.000294347, 0.000294457, 0.000294306], 0, 11.3818, 1651933687], "v": "v0.6"}
{"i": [["[\"fused_reshape_permute\", 1, 16, 16, 512, 8, 16]", "cuda -keys=cuda,gpu -max_num_threads=1024 -model=unknown -thread_warp_size=32", [-1, 16, 64, 49152, 2147483647, 1024, 8, 32], "", 0, []], [[], [["FU", 1, [0, 1, 2, 3, 4]], ["SP", 1, 0, 393216, [6], 1], ["AN", 1, 0, 5], ["AN", 1, 1, 6]]]], "r": [[5.13499e-05, 5.13456e-05, 5.13454e-05, 5.13495e-05, 5.13518e-05, 5.13431e-05, 5.13438e-05, 5.13453e-05, 5.1344e-05, 5.13447e-05], 0, 5.82399, 1651933681], "v": "v0.6"}
{"i": [["[\"fused_reshape_permute\", 1, 16, 16, 512, 8, 16]", "cuda -keys=cuda,gpu -max_num_threads=1024 -model=unknown -thread_warp_size=32", [-1, 16, 64, 49152, 2147483647, 1024, 8, 32], "", 0, []], [[], [["FU", 1, [0, 1, 2, 3, 4]], ["SP", 1, 0, 393216, [32], 1], ["AN", 1, 0, 5], ["AN", 1, 1, 6]]]], "r": [[1.19514e-05, 1.19508e-05, 1.20023e-05, 1.20492e-05, 1.19972e-05, 1.24971e-05, 1.20279e-05, 1.27044e-05, 1.21461e-05, 1.24786e-05], 0, 21.3254, 1651933697], "v": "v0.6"}
{"i": [["[\"fused_reshape_permute\", 1, 16, 16, 512, 8, 16]", "cuda -keys=cuda,gpu -max_num_threads=1024 -model=unknown -thread_warp_size=32", [-1, 16, 64, 49152, 2147483647, 1024, 8, 32], "", 0, []], [[], [["FU", 1, [0, 1, 2, 3, 4]], ["SP", 1, 0, 393216, [16], 1], ["AN", 1, 0, 5], ["AN", 1, 1, 6]]]], "r": [[2.39798e-05, 2.22307e-05, 2.11159e-05, 2.1111e-05, 2.11062e-05, 2.27271e-05, 2.21535e-05, 2.4042e-05, 2.11103e-05, 2.11144e-05], 0, 26.6761, 1651933702], "v": "v0.6"}
{"i": [["[\"fused_reshape_permute\", 1, 16, 16, 512, 8, 16]", "cuda -keys=cuda,gpu -max_num_threads=1024 -model=unknown -thread_warp_size=32", [-1, 16, 64, 49152, 2147483647, 1024, 8, 32], "", 0, []], [[], [["FU", 1, [0, 1, 2, 3, 4]], ["SP", 1, 0, 393216, [3], 1], ["AN", 1, 0, 5], ["AN", 1, 1, 6]]]], "r": [[9.98386e-05, 9.98362e-05, 9.98619e-05, 9.98495e-05, 9.9828e-05, 9.9829e-05, 9.98241e-05, 9.9822e-05, 9.98264e-05, 9.9831e-05], 0, 16.9043, 1651933692], "v": "v0.6"}
{"i": [["[\"fused_reshape_permute\", 1, 16, 16, 512, 8, 16]", "cuda -keys=cuda,gpu -max_num_threads=1024 -model=unknown -thread_warp_size=32", [-1, 16, 64, 49152, 2147483647, 1024, 8, 32], "", 0, []], [[], [["FU", 1, [0, 1, 2, 3, 4]], ["SP", 1, 0, 393216, [8], 1], ["AN", 1, 0, 5], ["AN", 1, 1, 6]]]], "r": [[3.91315e-05, 3.91305e-05, 3.91279e-05, 3.91307e-05, 3.91304e-05, 3.91297e-05, 3.91297e-05, 3.91302e-05, 3.91318e-05, 3.91315e-05], 0, 32.2174, 1651933708], "v": "v0.6"}
{"i": [["[\"fused_reshape_permute\", 1, 16, 16, 512, 8, 16]", "cuda -keys=cuda,gpu -max_num_threads=1024 -model=unknown -thread_warp_size=32", [-1, 16, 64, 49152, 2147483647, 1024, 8, 32], "", 0, []], [[], [["FU", 1, [0, 1, 2, 3, 4]], ["SP", 1, 0, 393216, [12], 1], ["AN", 1, 0, 5], ["AN", 1, 1, 6]]]], "r": [[2.6998e-05, 2.69958e-05, 2.69968e-05, 2.70003e-05, 2.69988e-05, 2.6999e-05, 2.69971e-05, 2.69954e-05, 2.69989e-05, 2.70008e-05], 0, 37.4677, 1651933713], "v": "v0.6"}
{"i": [["[\"fused_reshape_permute\", 1, 16, 16, 512, 8, 16]", "cuda -keys=cuda,gpu -max_num_threads=1024 -model=unknown -thread_warp_size=32", [-1, 16, 64, 49152, 2147483647, 1024, 8, 32], "", 0, []], [[], [["FU", 1, [0, 1, 2, 3, 4]], ["SP", 1, 0, 393216, [64], 1], ["AN", 1, 0, 5], ["AN", 1, 1, 6]]]], "r": [[7.0955e-06, 7.0953e-06, 7.09619e-06, 7.26204e-06, 7.09549e-06, 7.10083e-06, 7.0942e-06, 7.09418e-06, 7.1138e-06, 7.09455e-06], 0, 45.1264, 1651933721], "v": "v0.6"}
{"i": [["[\"fused_reshape_permute\", 1, 16, 16, 512, 8, 16]", "cuda -keys=cuda,gpu -max_num_threads=1024 -model=unknown -thread_warp_size=32", [-1, 16, 64, 49152, 2147483647, 1024, 8, 32], "", 0, []], [[], [["FU", 1, [0, 1, 2, 3, 4]], ["SP", 1, 0, 393216, [2], 1], ["AN", 1, 0, 5], ["AN", 1, 1, 6]]]], "r": [[0.00014838, 0.000148411, 0.000148375, 0.000148376, 0.000148375, 0.000148378, 0.000148376, 0.000148421, 0.000148407, 0.000148386], 0, 56.181, 1651933732], "v": "v0.6"}
{"i": [["[\"fused_reshape_permute\", 1, 16, 16, 512, 8, 16]", "cuda -keys=cuda,gpu -max_num_threads=1024 -model=unknown -thread_warp_size=32", [-1, 16, 64, 49152, 2147483647, 1024, 8, 32], "", 0, []], [[], [["FU", 1, [0, 1, 2, 3, 4]], ["SP", 1, 0, 393216, [48], 1], ["AN", 1, 0, 5], ["AN", 1, 1, 6]]]], "r": [[8.62844e-06, 8.62817e-06, 8.63268e-06, 8.62942e-06, 8.62736e-06, 8.62865e-06, 8.63009e-06, 8.62984e-06, 8.62898e-06, 8.62785e-06], 0, 40.8911, 1651933717], "v": "v0.6"}
{"i": [["[\"fused_reshape_permute\", 1, 16, 16, 512, 8, 16]", "cuda -keys=cuda,gpu -max_num_threads=1024 -model=unknown -thread_warp_size=32", [-1, 16, 64, 49152, 2147483647, 1024, 8, 32], "", 0, []], [[], [["FU", 1, [0, 1, 2, 3, 4]], ["SP", 1, 0, 393216, [4], 1], ["AN", 1, 0, 5], ["AN", 1, 1, 6]]]], "r": [[7.56665e-05, 7.56495e-05, 7.56313e-05, 7.56284e-05, 7.56308e-05, 7.56322e-05, 7.56311e-05, 7.56361e-05, 7.56282e-05, 7.563e-05], 0, 50.7828, 1651933726], "v": "v0.6"}
{"i": [["[\"fused_reshape_permute\", 1, 16, 16, 512, 8, 16]", "cuda -keys=cuda,gpu -max_num_threads=1024 -model=unknown -thread_warp_size=32", [-1, 16, 64, 49152, 2147483647, 1024, 8, 32], "", 0, []], [[], [["FU", 1, [0, 1, 2, 3, 4]], ["SP", 1, 0, 393216, [24], 1], ["AN", 1, 0, 5], ["AN", 1, 1, 6]]]], "r": [[1.50271e-05, 1.50286e-05, 1.50283e-05, 1.50337e-05, 1.50292e-05, 1.50281e-05, 1.50306e-05, 1.50359e-05, 1.50304e-05, 1.5031e-05], 0, 61.0418, 1651933737], "v": "v0.6"}
{"i": [["[\"fused_reshape_permute\", 1, 16, 16, 512, 8, 16]", "cuda -keys=cuda,gpu -max_num_threads=1024 -model=unknown -thread_warp_size=32", [-1, 16, 64, 49152, 2147483647, 1024, 8, 32], "", 0, []], [[], [["FU", 1, [0, 1, 2, 3, 4]], ["SP", 1, 0, 393216, [16], 1], ["AN", 1, 0, 5], ["AN", 1, 1, 6]]]], "r": [[2.12405e-05, 2.12521e-05, 2.12411e-05, 2.1244e-05, 2.12439e-05, 2.12433e-05, 2.12451e-05, 2.12457e-05, 2.12476e-05, 2.12465e-05], 0, 30.1154, 1651934167], "v": "v0.6"}
{"i": [["[\"fused_reshape_permute\", 1, 16, 16, 512, 8, 16]", "cuda -keys=cuda,gpu -max_num_threads=1024 -model=unknown -thread_warp_size=32", [-1, 16, 64, 49152, 2147483647, 1024, 8, 32], "", 0, []], [[], [["FU", 1, [0, 1, 2, 3, 4]], ["SP", 1, 0, 393216, [3], 1], ["AN", 1, 0, 5], ["AN", 1, 1, 6]]]], "r": [[9.97975e-05, 9.97906e-05, 9.97922e-05, 9.98056e-05, 9.98179e-05, 9.97932e-05, 9.97953e-05, 9.97958e-05, 9.97941e-05, 9.98063e-05], 0, 15.6535, 1651934153], "v": "v0.6"}
{"i": [["[\"fused_reshape_permute\", 1, 16, 16, 512, 8, 16]", "cuda -keys=cuda,gpu -max_num_threads=1024 -model=unknown -thread_warp_size=32", [-1, 16, 64, 49152, 2147483647, 1024, 8, 32], "", 0, []], [[], [["FU", 1, [0, 1, 2, 3, 4]], ["SP", 1, 0, 393216, [64], 1], ["AN", 1, 0, 5], ["AN", 1, 1, 6]]]], "r": [[7.11879e-06, 7.11845e-06, 7.11904e-06, 7.20839e-06, 7.11931e-06, 7.11988e-06, 7.12051e-06, 7.33406e-06, 7.12211e-06, 7.11946e-06], 0, 19.8217, 1651934157], "v": "v0.6"}
{"i": [["[\"fused_reshape_permute\", 1, 16, 16, 512, 8, 16]", "cuda -keys=cuda,gpu -max_num_threads=1024 -model=unknown -thread_warp_size=32", [-1, 16, 64, 49152, 2147483647, 1024, 8, 32], "", 0, []], [[], [["FU", 1, [0, 1, 2, 3, 4]], ["SP", 1, 0, 393216, [32], 1], ["AN", 1, 0, 5], ["AN", 1, 1, 6]]]], "r": [[1.17957e-05, 1.17952e-05, 1.17961e-05, 1.17946e-05, 1.17958e-05, 1.17975e-05, 1.17939e-05, 1.17948e-05, 1.17997e-05, 1.1794e-05], 0, 4.92766, 1651934142], "v": "v0.6"}
{"i": [["[\"fused_reshape_permute\", 1, 16, 16, 512, 8, 16]", "cuda -keys=cuda,gpu -max_num_threads=1024 -model=unknown -thread_warp_size=32", [-1, 16, 64, 49152, 2147483647, 1024, 8, 32], "", 0, []], [[], [["FU", 1, [0, 1, 2, 3, 4]], ["SP", 1, 0, 393216, [24], 1], ["AN", 1, 0, 5], ["AN", 1, 1, 6]]]], "r": [[1.51345e-05, 1.51283e-05, 1.51292e-05, 1.51274e-05, 1.51274e-05, 1.51278e-05, 1.51269e-05, 1.5129e-05, 1.51271e-05, 1.51287e-05], 0, 33.7642, 1651934171], "v": "v0.6"}
{"i": [["[\"fused_reshape_permute\", 1, 16, 16, 512, 8, 16]", "cuda -keys=cuda,gpu -max_num_threads=1024 -model=unknown -thread_warp_size=32", [-1, 16, 64, 49152, 2147483647, 1024, 8, 32], "", 0, []], [[], [["FU", 1, [0, 1, 2, 3, 4]], ["SP", 1, 0, 393216, [4], 1], ["AN", 1, 0, 5], ["AN", 1, 1, 6]]]], "r": [[7.56978e-05, 7.57053e-05, 7.57072e-05, 7.57215e-05, 7.57002e-05, 7.57114e-05, 7.57196e-05, 7.57085e-05, 7.57032e-05, 7.56994e-05], 0, 10.2001, 1651934147], "v": "v0.6"}
{"i": [["[\"fused_reshape_permute\", 1, 16, 16, 512, 8, 16]", "cuda -keys=cuda,gpu -max_num_threads=1024 -model=unknown -thread_warp_size=32", [-1, 16, 64, 49152, 2147483647, 1024, 8, 32], "", 0, []], [[], [["FU", 1, [0, 1, 2, 3, 4]], ["SP", 1, 0, 393216, [1], 1], ["AN", 1, 0, 5], ["AN", 1, 1, 6]]]], "r": [[0.00029409, 0.000294043, 0.000294044, 0.000294179, 0.00029407, 0.000294065, 0.000294128, 0.000294029, 0.000294031, 0.000294157], 0, 25.0236, 1651934162], "v": "v0.6"}
{"i": [["[\"fused_reshape_permute\", 1, 16, 16, 512, 8, 16]", "cuda -keys=cuda,gpu -max_num_threads=1024 -model=unknown -thread_warp_size=32", [-1, 16, 64, 49152, 2147483647, 1024, 8, 32], "", 0, []], [[], [["FU", 1, [0, 1, 2, 3, 4]], ["SP", 1, 0, 393216, [8], 1], ["AN", 1, 0, 5], ["AN", 1, 1, 6]]]], "r": [[3.91487e-05, 3.91775e-05, 3.91514e-05, 3.91507e-05, 3.91491e-05, 3.9138e-05, 3.91385e-05, 3.91501e-05, 3.91362e-05, 3.91377e-05], 0, 38.827, 1651934176], "v": "v0.6"}
{"i": [["[\"fused_reshape_permute\", 1, 16, 16, 512, 8, 16]", "cuda -keys=cuda,gpu -max_num_threads=1024 -model=unknown -thread_warp_size=32", [-1, 16, 64, 49152, 2147483647, 1024, 8, 32], "", 0, []], [[], [["FU", 1, [0, 1, 2, 3, 4]], ["SP", 1, 0, 393216, [6], 1], ["AN", 1, 0, 5], ["AN", 1, 1, 6]]]], "r": [[5.12402e-05, 5.12593e-05, 5.1227e-05, 5.29056e-05, 5.12401e-05, 5.12307e-05, 5.1235e-05, 5.12284e-05, 5.12262e-05, 5.12283e-05], 0, 43.6871, 1651934181], "v": "v0.6"}
{"i": [["[\"fused_reshape_permute\", 1, 16, 16, 512, 8, 16]", "cuda -keys=cuda,gpu -max_num_threads=1024 -model=unknown -thread_warp_size=32", [-1, 16, 64, 49152, 2147483647, 1024, 8, 32], "", 0, []], [[], [["FU", 1, [0, 1, 2, 3, 4]], ["SP", 1, 0, 393216, [48], 1], ["AN", 1, 0, 5], ["AN", 1, 1, 6]]]], "r": [[8.69049e-06, 8.68119e-06, 8.67749e-06, 8.6764e-06, 8.67778e-06, 8.68181e-06, 8.68146e-06, 8.67869e-06, 8.67904e-06, 8.67895e-06], 0, 58.1734, 1651934196], "v": "v0.6"}
{"i": [["[\"fused_reshape_permute\", 1, 16, 16, 512, 8, 16]", "cuda -keys=cuda,gpu -max_num_threads=1024 -model=unknown -thread_warp_size=32", [-1, 16, 64, 49152, 2147483647, 1024, 8, 32], "", 0, []], [[], [["FU", 1, [0, 1, 2, 3, 4]], ["SP", 1, 0, 393216, [2], 1], ["AN", 1, 0, 5], ["AN", 1, 1, 6]]]], "r": [[0.000148708, 0.000148534, 0.000148471, 0.000148476, 0.000148476, 0.000148497, 0.000148537, 0.000148517, 0.000148526, 0.000148476], 0, 54.3389, 1651934192], "v": "v0.6"}
{"i": [["[\"fused_reshape_permute\", 1, 16, 16, 512, 8, 16]", "cuda -keys=cuda,gpu -max_num_threads=1024 -model=unknown -thread_warp_size=32", [-1, 16, 64, 49152, 2147483647, 1024, 8, 32], "", 0, []], [[], [["FU", 1, [0, 1, 2, 3, 4]], ["SP", 1, 0, 393216, [12], 1], ["AN", 1, 0, 5], ["AN", 1, 1, 6]]]], "r": [[2.70545e-05, 2.7058e-05, 2.70567e-05, 2.70571e-05, 2.70562e-05, 2.70557e-05, 2.70559e-05, 2.70555e-05, 2.70553e-05, 2.7058e-05], 0, 48.8194, 1651934186], "v": "v0.6"}
