python/models/swin_transformer/kernel_configs/swin_transformer_window_partition_1_56_56_128_7_float16.log
{"i": [["[\"window_partition\", 1, 56, 56, 128, 7, \"float16\"]", "cuda -keys=cuda,gpu -max_num_threads=1024 -model=unknown -thread_warp_size=32", [-1, 16, 64, 49152, 2147483647, 1024, 8, 32], "", 0, []], [[], [["FU", 1, [0, 1, 2, 3]], ["SP", 1, 0, 401408, [64], 1], ["AN", 1, 0, 5], ["AN", 1, 1, 6]]]], "r": [[7.24362e-06, 7.2444e-06, 7.25963e-06], 0, 0.597442, 1668016188], "v": "v0.6"}
{"i": [["[\"window_partition\", 1, 56, 56, 128, 7, \"float16\"]", "cuda -keys=cuda,gpu -max_num_threads=1024 -model=unknown -thread_warp_size=32", [-1, 16, 64, 49152, 2147483647, 1024, 8, 32], "", 0, []], [[], [["FU", 1, [0, 1, 2, 3]], ["SP", 1, 0, 401408, [2], 1], ["AN", 1, 0, 5], ["AN", 1, 1, 6]]]], "r": [[0.0001517, 0.000151671, 0.000151678], 0, 0.976703, 1668016189], "v": "v0.6"}
{"i": [["[\"window_partition\", 1, 56, 56, 128, 7, \"float16\"]", "cuda -keys=cuda,gpu -max_num_threads=1024 -model=unknown -thread_warp_size=32", [-1, 16, 64, 49152, 2147483647, 1024, 8, 32], "", 0, []], [[], [["FU", 1, [0, 1, 2, 3]], ["SP", 1, 0, 401408, [16], 1], ["AN", 1, 0, 5], ["AN", 1, 1, 6]]]], "r": [[2.14577e-05, 2.14691e-05, 2.14634e-05], 0, 1.33457, 1668016189], "v": "v0.6"}
{"i": [["[\"window_partition\", 1, 56, 56, 128, 7, \"float16\"]", "cuda -keys=cuda,gpu -max_num_threads=1024 -model=unknown -thread_warp_size=32", [-1, 16, 64, 49152, 2147483647, 1024, 8, 32], "", 0, []], [[], [["FU", 1, [0, 1, 2, 3]], ["SP", 1, 0, 401408, [28], 1], ["AN", 1, 0, 5], ["AN", 1, 1, 6]]]], "r": [[1.34429e-05, 1.34551e-05, 1.34523e-05], 0, 1.67947, 1668016190], "v": "v0.6"}
{"i": [["[\"window_partition\", 1, 56, 56, 128, 7, \"float16\"]", "cuda -keys=cuda,gpu -max_num_threads=1024 -model=unknown -thread_warp_size=32", [-1, 16, 64, 49152, 2147483647, 1024, 8, 32], "", 0, []], [[], [["FU", 1, [0, 1, 2, 3]], ["SP", 1, 0, 401408, [4], 1], ["AN", 1, 0, 5], ["AN", 1, 1, 6]]]], "r": [[7.72378e-05, 7.72541e-05, 7.72634e-05], 0, 4.34152, 1668016193], "v": "v0.6"}
{"i": [["[\"window_partition\", 1, 56, 56, 128, 7, \"float16\"]", "cuda -keys=cuda,gpu -max_num_threads=1024 -model=unknown -thread_warp_size=32", [-1, 16, 64, 49152, 2147483647, 1024, 8, 32], "", 0, []], [[], [["FU", 1, [0, 1, 2, 3]], ["SP", 1, 0, 401408, [8], 1], ["AN", 1, 0, 5], ["AN", 1, 1, 6]]]], "r": [[3.99766e-05, 3.99981e-05, 3.99901e-05], 0, 2.08369, 1668016190], "v": "v0.6"}
{"i": [["[\"window_partition\", 1, 56, 56, 128, 7, \"float16\"]", "cuda -keys=cuda,gpu -max_num_threads=1024 -model=unknown -thread_warp_size=32", [-1, 16, 64, 49152, 2147483647, 1024, 8, 32], "", 0, []], [[], [["FU", 1, [0, 1, 2, 3]], ["SP", 1, 0, 401408, [32], 1], ["AN", 1, 0, 5], ["AN", 1, 1, 6]]]], "r": [[1.21354e-05, 1.21401e-05, 1.21353e-05], 0, 2.44157, 1668016190], "v": "v0.6"}
{"i": [["[\"window_partition\", 1, 56, 56, 128, 7, \"float16\"]", "cuda -keys=cuda,gpu -max_num_threads=1024 -model=unknown -thread_warp_size=32", [-1, 16, 64, 49152, 2147483647, 1024, 8, 32], "", 0, []], [[], [["FU", 1, [0, 1, 2, 3]], ["SP", 1, 0, 401408, [49], 1], ["AN", 1, 0, 5], ["AN", 1, 1, 6]]]], "r": [[8.76285e-06, 8.76423e-06, 8.76757e-06], 0, 3.1859, 1668016191], "v": "v0.6"}
{"i": [["[\"window_partition\", 1, 56, 56, 128, 7, \"float16\"]", "cuda -keys=cuda,gpu -max_num_threads=1024 -model=unknown -thread_warp_size=32", [-1, 16, 64, 49152, 2147483647, 1024, 8, 32], "", 0, []], [[], [["FU", 1, [0, 1, 2, 3]], ["SP", 1, 0, 401408, [7], 1], ["AN", 1, 0, 5], ["AN", 1, 1, 6]]]], "r": [[4.54034e-05, 4.54198e-05, 4.54245e-05], 0, 2.78916, 1668016191], "v": "v0.6"}
{"i": [["[\"window_partition\", 1, 56, 56, 128, 7, \"float16\"]", "cuda -keys=cuda,gpu -max_num_threads=1024 -model=unknown -thread_warp_size=32", [-1, 16, 64, 49152, 2147483647, 1024, 8, 32], "", 0, []], [[], [["FU", 1, [0, 1, 2, 3]], ["SP", 1, 0, 401408, [56], 1], ["AN", 1, 0, 5], ["AN", 1, 1, 6]]]], "r": [[7.95051e-06, 7.96225e-06, 7.9662e-06], 0, 3.53181, 1668016191], "v": "v0.6"}
{"i": [["[\"window_partition\", 1, 56, 56, 128, 7, \"float16\"]", "cuda -keys=cuda,gpu -max_num_threads=1024 -model=unknown -thread_warp_size=32", [-1, 16, 64, 49152, 2147483647, 1024, 8, 32], "", 0, []], [[], [["FU", 1, [0, 1, 2, 3]], ["SP", 1, 0, 401408, [1], 1], ["AN", 1, 0, 5], ["AN", 1, 1, 6]]]], "r": [[0.000300604, 0.000300523, 0.000300565], 0, 3.86953, 1668016192], "v": "v0.6"}
{"i": [["[\"window_partition\", 1, 56, 56, 128, 7, \"float16\"]", "cuda -keys=cuda,gpu -max_num_threads=1024 -model=unknown -thread_warp_size=32", [-1, 16, 64, 49152, 2147483647, 1024, 8, 32], "", 0, []], [[], [["FU", 1, [0, 1, 2, 3]], ["SP", 1, 0, 401408, [14], 1], ["AN", 1, 0, 5], ["AN", 1, 1, 6]]]], "r": [[2.40757e-05, 2.40823e-05, 2.40735e-05], 0, 4.27386, 1668016192], "v": "v0.6"}
{"i": [["[\"window_partition\", 1, 56, 56, 128, 7, \"float16\"]", "cuda -keys=cuda,gpu -max_num_threads=1024 -model=unknown -thread_warp_size=32", [-1, 16, 64, 49152, 2147483647, 1024, 8, 32], "", 0, []], [[], [["FU", 1, [0, 1, 2, 3]], ["SP", 1, 0, 401408, [1], 1], ["AN", 1, 0, 5], ["AN", 1, 1, 6]]]], "r": [[0.000300511, 0.00030052, 0.000300488], 0, 3.24954, 1668016340], "v": "v0.6"}
{"i": [["[\"window_partition\", 1, 56, 56, 128, 7, \"float16\"]", "cuda -keys=cuda,gpu -max_num_threads=1024 -model=unknown -thread_warp_size=32", [-1, 16, 64, 49152, 2147483647, 1024, 8, 32], "", 0, []], [[], [["FU", 1, [0, 1, 2, 3]], ["SP", 1, 0, 401408, [14], 1], ["AN", 1, 0, 5], ["AN", 1, 1, 6]]]], "r": [[2.41232e-05, 2.41401e-05, 2.41326e-05], 0, 2.24476, 1668016339], "v": "v0.6"}
{"i": [["[\"window_partition\", 1, 56, 56, 128, 7, \"float16\"]", "cuda -keys=cuda,gpu -max_num_threads=1024 -model=unknown -thread_warp_size=32", [-1, 16, 64, 49152, 2147483647, 1024, 8, 32], "", 0, []], [[], [["FU", 1, [0, 1, 2, 3]], ["SP", 1, 0, 401408, [28], 1], ["AN", 1, 0, 5], ["AN", 1, 1, 6]]]], "r": [[1.34595e-05, 1.34755e-05, 1.34662e-05], 0, 0.568887, 1668016338], "v": "v0.6"}
{"i": [["[\"window_partition\", 1, 56, 56, 128, 7, \"float16\"]", "cuda -keys=cuda,gpu -max_num_threads=1024 -model=unknown -thread_warp_size=32", [-1, 16, 64, 49152, 2147483647, 1024, 8, 32], "", 0, []], [[], [["FU", 1, [0, 1, 2, 3]], ["SP", 1, 0, 401408, [32], 1], ["AN", 1, 0, 5], ["AN", 1, 1, 6]]]], "r": [[1.22339e-05, 1.22357e-05, 1.22361e-05], 0, 1.22874, 1668016338], "v": "v0.6"}
{"i": [["[\"window_partition\", 1, 56, 56, 128, 7, \"float16\"]", "cuda -keys=cuda,gpu -max_num_threads=1024 -model=unknown -thread_warp_size=32", [-1, 16, 64, 49152, 2147483647, 1024, 8, 32], "", 0, []], [[], [["FU", 1, [0, 1, 2, 3]], ["SP", 1, 0, 401408, [64], 1], ["AN", 1, 0, 5], ["AN", 1, 1, 6]]]], "r": [[7.32064e-06, 7.32831e-06, 7.3247e-06], 0, 1.91448, 1668016339], "v": "v0.6"}
{"i": [["[\"window_partition\", 1, 56, 56, 128, 7, \"float16\"]", "cuda -keys=cuda,gpu -max_num_threads=1024 -model=unknown -thread_warp_size=32", [-1, 16, 64, 49152, 2147483647, 1024, 8, 32], "", 0, []], [[], [["FU", 1, [0, 1, 2, 3]], ["SP", 1, 0, 401408, [49], 1], ["AN", 1, 0, 5], ["AN", 1, 1, 6]]]], "r": [[8.83058e-06, 8.83852e-06, 8.84502e-06], 0, 1.60301, 1668016339], "v": "v0.6"}
{"i": [["[\"window_partition\", 1, 56, 56, 128, 7, \"float16\"]", "cuda -keys=cuda,gpu -max_num_threads=1024 -model=unknown -thread_warp_size=32", [-1, 16, 64, 49152, 2147483647, 1024, 8, 32], "", 0, []], [[], [["FU", 1, [0, 1, 2, 3]], ["SP", 1, 0, 401408, [8], 1], ["AN", 1, 0, 5], ["AN", 1, 1, 6]]]], "r": [[4.01692e-05, 4.01738e-05, 4.01808e-05], 0, 0.901084, 1668016338], "v": "v0.6"}
{"i": [["[\"window_partition\", 1, 56, 56, 128, 7, \"float16\"]", "cuda -keys=cuda,gpu -max_num_threads=1024 -model=unknown -thread_warp_size=32", [-1, 16, 64, 49152, 2147483647, 1024, 8, 32], "", 0, []], [[], [["FU", 1, [0, 1, 2, 3]], ["SP", 1, 0, 401408, [56], 1], ["AN", 1, 0, 5], ["AN", 1, 1, 6]]]], "r": [[8.01126e-06, 8.02591e-06, 8.02574e-06], 0, 4.28644, 1668016342], "v": "v0.6"}
{"i": [["[\"window_partition\", 1, 56, 56, 128, 7, \"float16\"]", "cuda -keys=cuda,gpu -max_num_threads=1024 -model=unknown -thread_warp_size=32", [-1, 16, 64, 49152, 2147483647, 1024, 8, 32], "", 0, []], [[], [["FU", 1, [0, 1, 2, 3]], ["SP", 1, 0, 401408, [7], 1], ["AN", 1, 0, 5], ["AN", 1, 1, 6]]]], "r": [[4.52948e-05, 4.52961e-05, 4.53077e-05], 0, 2.60463, 1668016340], "v": "v0.6"}
{"i": [["[\"window_partition\", 1, 56, 56, 128, 7, \"float16\"]", "cuda -keys=cuda,gpu -max_num_threads=1024 -model=unknown -thread_warp_size=32", [-1, 16, 64, 49152, 2147483647, 1024, 8, 32], "", 0, []], [[], [["FU", 1, [0, 1, 2, 3]], ["SP", 1, 0, 401408, [4], 1], ["AN", 1, 0, 5], ["AN", 1, 1, 6]]]], "r": [[7.72439e-05, 7.72508e-05, 7.72502e-05], 0, 3.61511, 1668016341], "v": "v0.6"}
{"i": [["[\"window_partition\", 1, 56, 56, 128, 7, \"float16\"]", "cuda -keys=cuda,gpu -max_num_threads=1024 -model=unknown -thread_warp_size=32", [-1, 16, 64, 49152, 2147483647, 1024, 8, 32], "", 0, []], [[], [["FU", 1, [0, 1, 2, 3]], ["SP", 1, 0, 401408, [2], 1], ["AN", 1, 0, 5], ["AN", 1, 1, 6]]]], "r": [[0.000151684, 0.000151724, 0.000151775], 0, 2.9212, 1668016340], "v": "v0.6"}
{"i": [["[\"window_partition\", 1, 56, 56, 128, 7, \"float16\"]", "cuda -keys=cuda,gpu -max_num_threads=1024 -model=unknown -thread_warp_size=32", [-1, 16, 64, 49152, 2147483647, 1024, 8, 32], "", 0, []], [[], [["FU", 1, [0, 1, 2, 3]], ["SP", 1, 0, 401408, [16], 1], ["AN", 1, 0, 5], ["AN", 1, 1, 6]]]], "r": [[2.13871e-05, 2.13998e-05, 2.14071e-05], 0, 3.91721, 1668016341], "v": "v0.6"}
{"i": [["[\"window_partition\", 1, 56, 56, 128, 7, \"float16\"]", "cuda -keys=cuda,gpu -max_num_threads=1024 -model=unknown -thread_warp_size=32", [-1, 16, 64, 49152, 2147483647, 1024, 8, 32], "", 0, []], [[], [["FU", 1, [0, 1, 2, 3]], ["SP", 1, 0, 401408, [64], 1], ["AN", 1, 0, 5], ["AN", 1, 1, 6]]]], "r": [[7.22483e-06, 7.23108e-06, 7.22984e-06], 0, 1.30467, 1668021083], "v": "v0.6"}
{"i": [["[\"window_partition\", 1, 56, 56, 128, 7, \"float16\"]", "cuda -keys=cuda,gpu -max_num_threads=1024 -model=unknown -thread_warp_size=32", [-1, 16, 64, 49152, 2147483647, 1024, 8, 32], "", 0, []], [[], [["FU", 1, [0, 1, 2, 3]], ["SP", 1, 0, 401408, [7], 1], ["AN", 1, 0, 5], ["AN", 1, 1, 6]]]], "r": [[4.52495e-05, 4.52659e-05, 4.52536e-05], 0, 2.03311, 1668021083], "v": "v0.6"}
{"i": [["[\"window_partition\", 1, 56, 56, 128, 7, \"float16\"]", "cuda -keys=cuda,gpu -max_num_threads=1024 -model=unknown -thread_warp_size=32", [-1, 16, 64, 49152, 2147483647, 1024, 8, 32], "", 0, []], [[], [["FU", 1, [0, 1, 2, 3]], ["SP", 1, 0, 401408, [32], 1], ["AN", 1, 0, 5], ["AN", 1, 1, 6]]]], "r": [[1.21574e-05, 1.21789e-05, 1.2171e-05], 0, 1.6493, 1668021083], "v": "v0.6"}
{"i": [["[\"window_partition\", 1, 56, 56, 128, 7, \"float16\"]", "cuda -keys=cuda,gpu -max_num_threads=1024 -model=unknown -thread_warp_size=32", [-1, 16, 64, 49152, 2147483647, 1024, 8, 32], "", 0, []], [[], [["FU", 1, [0, 1, 2, 3]], ["SP", 1, 0, 401408, [1], 1], ["AN", 1, 0, 5], ["AN", 1, 1, 6]]]], "r": [[0.000300551, 0.0003005, 0.00030058], 0, 0.581124, 1668021082], "v": "v0.6"}
{"i": [["[\"window_partition\", 1, 56, 56, 128, 7, \"float16\"]", "cuda -keys=cuda,gpu -max_num_threads=1024 -model=unknown -thread_warp_size=32", [-1, 16, 64, 49152, 2147483647, 1024, 8, 32], "", 0, []], [[], [["FU", 1, [0, 1, 2, 3]], ["SP", 1, 0, 401408, [8], 1], ["AN", 1, 0, 5], ["AN", 1, 1, 6]]]], "r": [[3.98908e-05, 3.99097e-05, 3.98991e-05], 0, 0.963762, 1668021082], "v": "v0.6"}
{"i": [["[\"window_partition\", 1, 56, 56, 128, 7, \"float16\"]", "cuda -keys=cuda,gpu -max_num_threads=1024 -model=unknown -thread_warp_size=32", [-1, 16, 64, 49152, 2147483647, 1024, 8, 32], "", 0, []], [[], [["FU", 1, [0, 1, 2, 3]], ["SP", 1, 0, 401408, [56], 1], ["AN", 1, 0, 5], ["AN", 1, 1, 6]]]], "r": [[7.8871e-06, 7.89186e-06, 7.89178e-06], 0, 2.37002, 1668021084], "v": "v0.6"}
{"i": [["[\"window_partition\", 1, 56, 56, 128, 7, \"float16\"]", "cuda -keys=cuda,gpu -max_num_threads=1024 -model=unknown -thread_warp_size=32", [-1, 16, 64, 49152, 2147483647, 1024, 8, 32], "", 0, []], [[], [["FU", 1, [0, 1, 2, 3]], ["SP", 1, 0, 401408, [49], 1], ["AN", 1, 0, 5], ["AN", 1, 1, 6]]]], "r": [[8.73153e-06, 8.75116e-06, 8.73985e-06], 0, 4.14169, 1668021086], "v": "v0.6"}
{"i": [["[\"window_partition\", 1, 56, 56, 128, 7, \"float16\"]", "cuda -keys=cuda,gpu -max_num_threads=1024 -model=unknown -thread_warp_size=32", [-1, 16, 64, 49152, 2147483647, 1024, 8, 32], "", 0, []], [[], [["FU", 1, [0, 1, 2, 3]], ["SP", 1, 0, 401408, [28], 1], ["AN", 1, 0, 5], ["AN", 1, 1, 6]]]], "r": [[1.34879e-05, 1.34963e-05, 1.34846e-05], 0, 2.70203, 1668021084], "v": "v0.6"}
{"i": [["[\"window_partition\", 1, 56, 56, 128, 7, \"float16\"]", "cuda -keys=cuda,gpu -max_num_threads=1024 -model=unknown -thread_warp_size=32", [-1, 16, 64, 49152, 2147483647, 1024, 8, 32], "", 0, []], [[], [["FU", 1, [0, 1, 2, 3]], ["SP", 1, 0, 401408, [14], 1], ["AN", 1, 0, 5], ["AN", 1, 1, 6]]]], "r": [[2.40857e-05, 2.40922e-05, 2.40949e-05], 0, 3.07793, 1668021085], "v": "v0.6"}
{"i": [["[\"window_partition\", 1, 56, 56, 128, 7, \"float16\"]", "cuda -keys=cuda,gpu -max_num_threads=1024 -model=unknown -thread_warp_size=32", [-1, 16, 64, 49152, 2147483647, 1024, 8, 32], "", 0, []], [[], [["FU", 1, [0, 1, 2, 3]], ["SP", 1, 0, 401408, [4], 1], ["AN", 1, 0, 5], ["AN", 1, 1, 6]]]], "r": [[7.7144e-05, 7.71615e-05, 7.71558e-05], 0, 4.48929, 1668021086], "v": "v0.6"}
{"i": [["[\"window_partition\", 1, 56, 56, 128, 7, \"float16\"]", "cuda -keys=cuda,gpu -max_num_threads=1024 -model=unknown -thread_warp_size=32", [-1, 16, 64, 49152, 2147483647, 1024, 8, 32], "", 0, []], [[], [["FU", 1, [0, 1, 2, 3]], ["SP", 1, 0, 401408, [2], 1], ["AN", 1, 0, 5], ["AN", 1, 1, 6]]]], "r": [[0.000151607, 0.000151595, 0.000151695], 0, 3.74869, 1668021085], "v": "v0.6"}
{"i": [["[\"window_partition\", 1, 56, 56, 128, 7, \"float16\"]", "cuda -keys=cuda,gpu -max_num_threads=1024 -model=unknown -thread_warp_size=32", [-1, 16, 64, 49152, 2147483647, 1024, 8, 32], "", 0, []], [[], [["FU", 1, [0, 1, 2, 3]], ["SP", 1, 0, 401408, [16], 1], ["AN", 1, 0, 5], ["AN", 1, 1, 6]]]], "r": [[2.1371e-05, 2.13757e-05, 2.13744e-05], 0, 3.42575, 1668021085], "v": "v0.6"}
{"i": [["[\"window_partition\", 1, 56, 56, 128, 7, \"float16\"]", "cuda -keys=cuda,gpu -max_num_threads=1024 -model=unknown -thread_warp_size=32", [-1, 16, 64, 49152, 2147483647, 1024, 8, 32], "", 0, []], [[], [["FU", 1, [0, 1, 2, 3]], ["SP", 1, 0, 401408, [49], 1], ["AN", 1, 0, 5], ["AN", 1, 1, 6]]]], "r": [[8.6937e-06, 8.70093e-06, 8.70431e-06], 0, 0.591465, 1668045829], "v": "v0.6"}
{"i": [["[\"window_partition\", 1, 56, 56, 128, 7, \"float16\"]", "cuda -keys=cuda,gpu -max_num_threads=1024 -model=unknown -thread_warp_size=32", [-1, 16, 64, 49152, 2147483647, 1024, 8, 32], "", 0, []], [[], [["FU", 1, [0, 1, 2, 3]], ["SP", 1, 0, 401408, [1], 1], ["AN", 1, 0, 5], ["AN", 1, 1, 6]]]], "r": [[0.00030045, 0.000300423, 0.000300427], 0, 1.6467, 1668045831], "v": "v0.6"}
{"i": [["[\"window_partition\", 1, 56, 56, 128, 7, \"float16\"]", "cuda -keys=cuda,gpu -max_num_threads=1024 -model=unknown -thread_warp_size=32", [-1, 16, 64, 49152, 2147483647, 1024, 8, 32], "", 0, []], [[], [["FU", 1, [0, 1, 2, 3]], ["SP", 1, 0, 401408, [2], 1], ["AN", 1, 0, 5], ["AN", 1, 1, 6]]]], "r": [[0.000151712, 0.000151726, 0.000151721], 0, 1.30723, 1668045830], "v": "v0.6"}
{"i": [["[\"window_partition\", 1, 56, 56, 128, 7, \"float16\"]", "cuda -keys=cuda,gpu -max_num_threads=1024 -model=unknown -thread_warp_size=32", [-1, 16, 64, 49152, 2147483647, 1024, 8, 32], "", 0, []], [[], [["FU", 1, [0, 1, 2, 3]], ["SP", 1, 0, 401408, [8], 1], ["AN", 1, 0, 5], ["AN", 1, 1, 6]]]], "r": [[3.99132e-05, 3.99297e-05, 3.99181e-05], 0, 2.72298, 1668045832], "v": "v0.6"}
{"i": [["[\"window_partition\", 1, 56, 56, 128, 7, \"float16\"]", "cuda -keys=cuda,gpu -max_num_threads=1024 -model=unknown -thread_warp_size=32", [-1, 16, 64, 49152, 2147483647, 1024, 8, 32], "", 0, []], [[], [["FU", 1, [0, 1, 2, 3]], ["SP", 1, 0, 401408, [64], 1], ["AN", 1, 0, 5], ["AN", 1, 1, 6]]]], "r": [[7.31841e-06, 7.32924e-06, 7.33033e-06], 0, 0.980565, 1668045830], "v": "v0.6"}
{"i": [["[\"window_partition\", 1, 56, 56, 128, 7, \"float16\"]", "cuda -keys=cuda,gpu -max_num_threads=1024 -model=unknown -thread_warp_size=32", [-1, 16, 64, 49152, 2147483647, 1024, 8, 32], "", 0, []], [[], [["FU", 1, [0, 1, 2, 3]], ["SP", 1, 0, 401408, [56], 1], ["AN", 1, 0, 5], ["AN", 1, 1, 6]]]], "r": [[7.9809e-06, 7.99437e-06, 7.98969e-06], 0, 3.12058, 1668045832], "v": "v0.6"}
{"i": [["[\"window_partition\", 1, 56, 56, 128, 7, \"float16\"]", "cuda -keys=cuda,gpu -max_num_threads=1024 -model=unknown -thread_warp_size=32", [-1, 16, 64, 49152, 2147483647, 1024, 8, 32], "", 0, []], [[], [["FU", 1, [0, 1, 2, 3]], ["SP", 1, 0, 401408, [7], 1], ["AN", 1, 0, 5], ["AN", 1, 1, 6]]]], "r": [[4.52235e-05, 4.52352e-05, 4.52299e-05], 0, 2.03455, 1668045831], "v": "v0.6"}
{"i": [["[\"window_partition\", 1, 56, 56, 128, 7, \"float16\"]", "cuda -keys=cuda,gpu -max_num_threads=1024 -model=unknown -thread_warp_size=32", [-1, 16, 64, 49152, 2147483647, 1024, 8, 32], "", 0, []], [[], [["FU", 1, [0, 1, 2, 3]], ["SP", 1, 0, 401408, [16], 1], ["AN", 1, 0, 5], ["AN", 1, 1, 6]]]], "r": [[2.14948e-05, 2.15055e-05, 2.15184e-05], 0, 4.1869, 1668045833], "v": "v0.6"}
{"i": [["[\"window_partition\", 1, 56, 56, 128, 7, \"float16\"]", "cuda -keys=cuda,gpu -max_num_threads=1024 -model=unknown -thread_warp_size=32", [-1, 16, 64, 49152, 2147483647, 1024, 8, 32], "", 0, []], [[], [["FU", 1, [0, 1, 2, 3]], ["SP", 1, 0, 401408, [28], 1], ["AN", 1, 0, 5], ["AN", 1, 1, 6]]]], "r": [[1.34097e-05, 1.34234e-05, 1.34174e-05], 0, 2.37748, 1668045831], "v": "v0.6"}
{"i": [["[\"window_partition\", 1, 56, 56, 128, 7, \"float16\"]", "cuda -keys=cuda,gpu -max_num_threads=1024 -model=unknown -thread_warp_size=32", [-1, 16, 64, 49152, 2147483647, 1024, 8, 32], "", 0, []], [[], [["FU", 1, [0, 1, 2, 3]], ["SP", 1, 0, 401408, [14], 1], ["AN", 1, 0, 5], ["AN", 1, 1, 6]]]], "r": [[2.40696e-05, 2.40785e-05, 2.40754e-05], 0, 3.45582, 1668045832], "v": "v0.6"}
{"i": [["[\"window_partition\", 1, 56, 56, 128, 7, \"float16\"]", "cuda -keys=cuda,gpu -max_num_threads=1024 -model=unknown -thread_warp_size=32", [-1, 16, 64, 49152, 2147483647, 1024, 8, 32], "", 0, []], [[], [["FU", 1, [0, 1, 2, 3]], ["SP", 1, 0, 401408, [4], 1], ["AN", 1, 0, 5], ["AN", 1, 1, 6]]]], "r": [[7.71294e-05, 7.71429e-05, 7.71491e-05], 0, 3.78894, 1668045833], "v": "v0.6"}
{"i": [["[\"window_partition\", 1, 56, 56, 128, 7, \"float16\"]", "cuda -keys=cuda,gpu -max_num_threads=1024 -model=unknown -thread_warp_size=32", [-1, 16, 64, 49152, 2147483647, 1024, 8, 32], "", 0, []], [[], [["FU", 1, [0, 1, 2, 3]], ["SP", 1, 0, 401408, [32], 1], ["AN", 1, 0, 5], ["AN", 1, 1, 6]]]], "r": [[1.20848e-05, 1.20947e-05, 1.20898e-05], 0, 4.52553, 1668045833], "v": "v0.6"}
{"i": [["[\"window_partition\", 1, 56, 56, 128, 7, \"float16\"]", "cuda -keys=cuda,gpu -max_num_threads=1024 -model=unknown -thread_warp_size=32", [-1, 16, 64, 49152, 2147483647, 1024, 8, 32], "", 0, []], [[], [["FU", 1, [0, 1, 2, 3]], ["SP", 1, 0, 401408, [2], 1], ["AN", 1, 0, 5], ["AN", 1, 1, 6]]]], "r": [[0.000151601, 0.000151591, 0.000151636], 0, 1.33214, 1668048088], "v": "v0.6"}
{"i": [["[\"window_partition\", 1, 56, 56, 128, 7, \"float16\"]", "cuda -keys=cuda,gpu -max_num_threads=1024 -model=unknown -thread_warp_size=32", [-1, 16, 64, 49152, 2147483647, 1024, 8, 32], "", 0, []], [[], [["FU", 1, [0, 1, 2, 3]], ["SP", 1, 0, 401408, [28], 1], ["AN", 1, 0, 5], ["AN", 1, 1, 6]]]], "r": [[1.35063e-05, 1.35193e-05, 1.35131e-05], 0, 0.596347, 1668048087], "v": "v0.6"}
{"i": [["[\"window_partition\", 1, 56, 56, 128, 7, \"float16\"]", "cuda -keys=cuda,gpu -max_num_threads=1024 -model=unknown -thread_warp_size=32", [-1, 16, 64, 49152, 2147483647, 1024, 8, 32], "", 0, []], [[], [["FU", 1, [0, 1, 2, 3]], ["SP", 1, 0, 401408, [64], 1], ["AN", 1, 0, 5], ["AN", 1, 1, 6]]]], "r": [[7.35822e-06, 7.36514e-06, 7.3594e-06], 0, 2.07469, 1668048089], "v": "v0.6"}
{"i": [["[\"window_partition\", 1, 56, 56, 128, 7, \"float16\"]", "cuda -keys=cuda,gpu -max_num_threads=1024 -model=unknown -thread_warp_size=32", [-1, 16, 64, 49152, 2147483647, 1024, 8, 32], "", 0, []], [[], [["FU", 1, [0, 1, 2, 3]], ["SP", 1, 0, 401408, [7], 1], ["AN", 1, 0, 5], ["AN", 1, 1, 6]]]], "r": [[4.53218e-05, 4.53249e-05, 4.5322e-05], 0, 1.67507, 1668048088], "v": "v0.6"}
{"i": [["[\"window_partition\", 1, 56, 56, 128, 7, \"float16\"]", "cuda -keys=cuda,gpu -max_num_threads=1024 -model=unknown -thread_warp_size=32", [-1, 16, 64, 49152, 2147483647, 1024, 8, 32], "", 0, []], [[], [["FU", 1, [0, 1, 2, 3]], ["SP", 1, 0, 401408, [4], 1], ["AN", 1, 0, 5], ["AN", 1, 1, 6]]]], "r": [[7.71838e-05, 7.719e-05, 7.71874e-05], 0, 0.99435, 1668048087], "v": "v0.6"}
{"i": [["[\"window_partition\", 1, 56, 56, 128, 7, \"float16\"]", "cuda -keys=cuda,gpu -max_num_threads=1024 -model=unknown -thread_warp_size=32", [-1, 16, 64, 49152, 2147483647, 1024, 8, 32], "", 0, []], [[], [["FU", 1, [0, 1, 2, 3]], ["SP", 1, 0, 401408, [56], 1], ["AN", 1, 0, 5], ["AN", 1, 1, 6]]]], "r": [[7.94572e-06, 7.95152e-06, 7.95558e-06], 0, 2.4262, 1668048089], "v": "v0.6"}
{"i": [["[\"window_partition\", 1, 56, 56, 128, 7, \"float16\"]", "cuda -keys=cuda,gpu -max_num_threads=1024 -model=unknown -thread_warp_size=32", [-1, 16, 64, 49152, 2147483647, 1024, 8, 32], "", 0, []], [[], [["FU", 1, [0, 1, 2, 3]], ["SP", 1, 0, 401408, [32], 1], ["AN", 1, 0, 5], ["AN", 1, 1, 6]]]], "r": [[1.22138e-05, 1.22165e-05, 1.22234e-05], 0, 2.73379, 1668048089], "v": "v0.6"}
{"i": [["[\"window_partition\", 1, 56, 56, 128, 7, \"float16\"]", "cuda -keys=cuda,gpu -max_num_threads=1024 -model=unknown -thread_warp_size=32", [-1, 16, 64, 49152, 2147483647, 1024, 8, 32], "", 0, []], [[], [["FU", 1, [0, 1, 2, 3]], ["SP", 1, 0, 401408, [16], 1], ["AN", 1, 0, 5], ["AN", 1, 1, 6]]]], "r": [[2.15299e-05, 2.15283e-05, 2.15519e-05], 0, 3.11924, 1668048090], "v": "v0.6"}
{"i": [["[\"window_partition\", 1, 56, 56, 128, 7, \"float16\"]", "cuda -keys=cuda,gpu -max_num_threads=1024 -model=unknown -thread_warp_size=32", [-1, 16, 64, 49152, 2147483647, 1024, 8, 32], "", 0, []], [[], [["FU", 1, [0, 1, 2, 3]], ["SP", 1, 0, 401408, [49], 1], ["AN", 1, 0, 5], ["AN", 1, 1, 6]]]], "r": [[8.7002e-06, 8.71392e-06, 8.70173e-06], 0, 3.47547, 1668048090], "v": "v0.6"}
{"i": [["[\"window_partition\", 1, 56, 56, 128, 7, \"float16\"]", "cuda -keys=cuda,gpu -max_num_threads=1024 -model=unknown -thread_warp_size=32", [-1, 16, 64, 49152, 2147483647, 1024, 8, 32], "", 0, []], [[], [["FU", 1, [0, 1, 2, 3]], ["SP", 1, 0, 401408, [1], 1], ["AN", 1, 0, 5], ["AN", 1, 1, 6]]]], "r": [[0.000300532, 0.000300525, 0.000300535], 0, 4.18316, 1668048091], "v": "v0.6"}
{"i": [["[\"window_partition\", 1, 56, 56, 128, 7, \"float16\"]", "cuda -keys=cuda,gpu -max_num_threads=1024 -model=unknown -thread_warp_size=32", [-1, 16, 64, 49152, 2147483647, 1024, 8, 32], "", 0, []], [[], [["FU", 1, [0, 1, 2, 3]], ["SP", 1, 0, 401408, [8], 1], ["AN", 1, 0, 5], ["AN", 1, 1, 6]]]], "r": [[4.00033e-05, 4.00394e-05, 4.0031e-05], 0, 3.80143, 1668048090], "v": "v0.6"}
{"i": [["[\"window_partition\", 1, 56, 56, 128, 7, \"float16\"]", "cuda -keys=cuda,gpu -max_num_threads=1024 -model=unknown -thread_warp_size=32", [-1, 16, 64, 49152, 2147483647, 1024, 8, 32], "", 0, []], [[], [["FU", 1, [0, 1, 2, 3]], ["SP", 1, 0, 401408, [14], 1], ["AN", 1, 0, 5], ["AN", 1, 1, 6]]]], "r": [[2.41125e-05, 2.41281e-05, 2.41377e-05], 0, 4.52079, 1668048091], "v": "v0.6"}
