python/models/swin_transformer/kernel_configs/swin_transformer_fused_window_reverse_roll_add_1_28_28_256_3_7_float16.log
{"i": [["[\"fused_window_reverse_roll_add\", 1, 28, 28, 256, 3, 7, \"float16\"]", "cuda -keys=cuda,gpu -max_num_threads=1024 -model=unknown -thread_warp_size=32", [-1, 16, 64, 49152, 2147483647, 1024, 8, 32], "", 0, []], [[], [["FU", 2, [0, 1, 2, 3]], ["SP", 2, 0, 200704, [4], 1], ["AN", 2, 0, 5], ["AN", 2, 1, 6]]]], "r": [[4.36034e-05, 4.15091e-05, 4.01315e-05, 4.01318e-05, 4.01297e-05, 4.01316e-05, 4.01288e-05, 4.06423e-05, 4.01439e-05, 4.02644e-05], 0, 7.64426, 1651679036], "v": "v0.6"}
{"i": [["[\"fused_window_reverse_roll_add\", 1, 28, 28, 256, 3, 7, \"float16\"]", "cuda -keys=cuda,gpu -max_num_threads=1024 -model=unknown -thread_warp_size=32", [-1, 16, 64, 49152, 2147483647, 1024, 8, 32], "", 0, []], [[], [["FU", 2, [0, 1, 2, 3]], ["SP", 2, 0, 200704, [8], 1], ["AN", 2, 0, 5], ["AN", 2, 1, 6]]]], "r": [[2.14681e-05, 2.14659e-05, 2.1628e-05, 2.1456e-05, 2.1596e-05, 2.30388e-05, 2.24325e-05, 2.14653e-05, 2.14673e-05, 2.14678e-05], 0, 2.98442, 1651679031], "v": "v0.6"}
{"i": [["[\"fused_window_reverse_roll_add\", 1, 28, 28, 256, 3, 7, \"float16\"]", "cuda -keys=cuda,gpu -max_num_threads=1024 -model=unknown -thread_warp_size=32", [-1, 16, 64, 49152, 2147483647, 1024, 8, 32], "", 0, []], [[], [["FU", 2, [0, 1, 2, 3]], ["SP", 2, 0, 200704, [7], 1], ["AN", 2, 0, 5], ["AN", 2, 1, 6]]]], "r": [[2.42102e-05, 2.42285e-05, 2.49434e-05, 2.42823e-05, 2.42956e-05, 2.54122e-05, 2.67645e-05, 3.00009e-05, 2.48965e-05, 2.43458e-05], 0, 13.291, 1651679042], "v": "v0.6"}
{"i": [["[\"fused_window_reverse_roll_add\", 1, 28, 28, 256, 3, 7, \"float16\"]", "cuda -keys=cuda,gpu -max_num_threads=1024 -model=unknown -thread_warp_size=32", [-1, 16, 64, 49152, 2147483647, 1024, 8, 32], "", 0, []], [[], [["FU", 2, [0, 1, 2, 3]], ["SP", 2, 0, 200704, [56], 1], ["AN", 2, 0, 5], ["AN", 2, 1, 6]]]], "r": [[5.39478e-06, 5.39103e-06, 5.44812e-06, 5.38763e-06, 6.45396e-06, 5.62221e-06, 5.44614e-06, 5.39214e-06, 5.39185e-06, 5.39186e-06], 0, 17.5732, 1651679046], "v": "v0.6"}
{"i": [["[\"fused_window_reverse_roll_add\", 1, 28, 28, 256, 3, 7, \"float16\"]", "cuda -keys=cuda,gpu -max_num_threads=1024 -model=unknown -thread_warp_size=32", [-1, 16, 64, 49152, 2147483647, 1024, 8, 32], "", 0, []], [[], [["FU", 2, [0, 1, 2, 3]], ["SP", 2, 0, 200704, [64], 1], ["AN", 2, 0, 5], ["AN", 2, 1, 6]]]], "r": [[4.99993e-06, 5.00154e-06, 5.40105e-06, 5.27321e-06, 5.01125e-06, 4.97772e-06, 4.96623e-06, 4.96615e-06, 4.96664e-06, 4.96836e-06], 0, 19.7306, 1651679048], "v": "v0.6"}
{"i": [["[\"fused_window_reverse_roll_add\", 1, 28, 28, 256, 3, 7, \"float16\"]", "cuda -keys=cuda,gpu -max_num_threads=1024 -model=unknown -thread_warp_size=32", [-1, 16, 64, 49152, 2147483647, 1024, 8, 32], "", 0, []], [[], [["FU", 2, [0, 1, 2, 3]], ["SP", 2, 0, 200704, [32], 1], ["AN", 2, 0, 5], ["AN", 2, 1, 6]]]], "r": [[8.88613e-06, 8.20174e-06, 7.74585e-06, 7.56565e-06, 7.9191e-06, 1.62488e-05, 7.38736e-06, 7.40596e-06, 9.5081e-06, 7.65368e-06], 0, 10.8405, 1651679039], "v": "v0.6"}
{"i": [["[\"fused_window_reverse_roll_add\", 1, 28, 28, 256, 3, 7, \"float16\"]", "cuda -keys=cuda,gpu -max_num_threads=1024 -model=unknown -thread_warp_size=32", [-1, 16, 64, 49152, 2147483647, 1024, 8, 32], "", 0, []], [[], [["FU", 2, [0, 1, 2, 3]], ["SP", 2, 0, 200704, [1], 1], ["AN", 2, 0, 5], ["AN", 2, 1, 6]]]], "r": [[0.000151668, 0.000151668, 0.000151675, 0.000151674, 0.00015167, 0.000152969, 0.000151858, 0.000151915, 0.000166779, 0.000157855], 0, 15.8448, 1651679044], "v": "v0.6"}
{"i": [["[\"fused_window_reverse_roll_add\", 1, 28, 28, 256, 3, 7, \"float16\"]", "cuda -keys=cuda,gpu -max_num_threads=1024 -model=unknown -thread_warp_size=32", [-1, 16, 64, 49152, 2147483647, 1024, 8, 32], "", 0, []], [[], [["FU", 2, [0, 1, 2, 3]], ["SP", 2, 0, 200704, [49], 1], ["AN", 2, 0, 5], ["AN", 2, 1, 6]]]], "r": [[5.75075e-06, 5.74514e-06, 5.71283e-06, 5.71815e-06, 5.78392e-06, 5.75993e-06, 5.72983e-06, 7.34685e-06, 6.69193e-06, 6.90008e-06], 0, 21.7683, 1651679051], "v": "v0.6"}
{"i": [["[\"fused_window_reverse_roll_add\", 1, 28, 28, 256, 3, 7, \"float16\"]", "cuda -keys=cuda,gpu -max_num_threads=1024 -model=unknown -thread_warp_size=32", [-1, 16, 64, 49152, 2147483647, 1024, 8, 32], "", 0, []], [[], [["FU", 2, [0, 1, 2, 3]], ["SP", 2, 0, 200704, [2], 1], ["AN", 2, 0, 5], ["AN", 2, 1, 6]]]], "r": [[7.73732e-05, 7.73722e-05, 7.7377e-05, 7.73853e-05, 7.98829e-05, 7.75192e-05, 7.7476e-05, 7.76669e-05, 7.75111e-05, 8.54357e-05], 0, 5.38646, 1651679034], "v": "v0.6"}
{"i": [["[\"fused_window_reverse_roll_add\", 1, 28, 28, 256, 3, 7, \"float16\"]", "cuda -keys=cuda,gpu -max_num_threads=1024 -model=unknown -thread_warp_size=32", [-1, 16, 64, 49152, 2147483647, 1024, 8, 32], "", 0, []], [[], [["FU", 2, [0, 1, 2, 3]], ["SP", 2, 0, 200704, [28], 1], ["AN", 2, 0, 5], ["AN", 2, 1, 6]]]], "r": [[8.12997e-06, 8.12996e-06, 8.2947e-06, 8.13608e-06, 8.15915e-06, 8.17117e-06, 8.73252e-06, 8.42585e-06, 8.15426e-06, 8.1301e-06], 0, 23.8135, 1651679053], "v": "v0.6"}
{"i": [["[\"fused_window_reverse_roll_add\", 1, 28, 28, 256, 3, 7, \"float16\"]", "cuda -keys=cuda,gpu -max_num_threads=1024 -model=unknown -thread_warp_size=32", [-1, 16, 64, 49152, 2147483647, 1024, 8, 32], "", 0, []], [[], [["FU", 2, [0, 1, 2, 3]], ["SP", 2, 0, 200704, [28], 1], ["AN", 2, 0, 5], ["AN", 2, 1, 6]]]], "r": [[8.1201e-06, 8.10902e-06, 8.17493e-06, 8.19758e-06, 8.1085e-06, 9.45494e-06, 8.88665e-06, 8.61874e-06, 8.15272e-06, 8.15199e-06], 0, 11.2192, 1651682394], "v": "v0.6"}
{"i": [["[\"fused_window_reverse_roll_add\", 1, 28, 28, 256, 3, 7, \"float16\"]", "cuda -keys=cuda,gpu -max_num_threads=1024 -model=unknown -thread_warp_size=32", [-1, 16, 64, 49152, 2147483647, 1024, 8, 32], "", 0, []], [[], [["FU", 2, [0, 1, 2, 3]], ["SP", 2, 0, 200704, [64], 1], ["AN", 2, 0, 5], ["AN", 2, 1, 6]]]], "r": [[5.41289e-06, 5.98972e-06, 5.47211e-06, 6.46458e-06, 5.10784e-06, 5.1527e-06, 5.05822e-06, 5.03271e-06, 5.06321e-06, 5.06619e-06], 0, 3.92545, 1651682387], "v": "v0.6"}
{"i": [["[\"fused_window_reverse_roll_add\", 1, 28, 28, 256, 3, 7, \"float16\"]", "cuda -keys=cuda,gpu -max_num_threads=1024 -model=unknown -thread_warp_size=32", [-1, 16, 64, 49152, 2147483647, 1024, 8, 32], "", 0, []], [[], [["FU", 2, [0, 1, 2, 3]], ["SP", 2, 0, 200704, [56], 1], ["AN", 2, 0, 5], ["AN", 2, 1, 6]]]], "r": [[5.41285e-06, 5.45777e-06, 5.39458e-06, 6.33055e-06, 5.4451e-06, 5.86912e-06, 5.48628e-06, 5.77147e-06, 6.39031e-06, 6.78635e-06], 0, 7.60035, 1651682391], "v": "v0.6"}
{"i": [["[\"fused_window_reverse_roll_add\", 1, 28, 28, 256, 3, 7, \"float16\"]", "cuda -keys=cuda,gpu -max_num_threads=1024 -model=unknown -thread_warp_size=32", [-1, 16, 64, 49152, 2147483647, 1024, 8, 32], "", 0, []], [[], [["FU", 2, [0, 1, 2, 3]], ["SP", 2, 0, 200704, [16], 1], ["AN", 2, 0, 5], ["AN", 2, 1, 6]]]], "r": [[1.37212e-05, 1.25061e-05, 1.24052e-05, 1.26158e-05, 1.22209e-05, 1.21673e-05, 1.26198e-05, 1.22874e-05, 1.27479e-05, 1.37737e-05], 0, 14.027, 1651682397], "v": "v0.6"}
{"i": [["[\"fused_window_reverse_roll_add\", 1, 28, 28, 256, 3, 7, \"float16\"]", "cuda -keys=cuda,gpu -max_num_threads=1024 -model=unknown -thread_warp_size=32", [-1, 16, 64, 49152, 2147483647, 1024, 8, 32], "", 0, []], [[], [["FU", 2, [0, 1, 2, 3]], ["SP", 2, 0, 200704, [8], 1], ["AN", 2, 0, 5], ["AN", 2, 1, 6]]]], "r": [[2.18732e-05, 2.15185e-05, 2.15459e-05, 2.479e-05, 2.21509e-05, 2.14897e-05, 2.16014e-05, 2.23655e-05, 2.43392e-05, 2.16843e-05], 0, 21.0382, 1651682404], "v": "v0.6"}
{"i": [["[\"fused_window_reverse_roll_add\", 1, 28, 28, 256, 3, 7, \"float16\"]", "cuda -keys=cuda,gpu -max_num_threads=1024 -model=unknown -thread_warp_size=32", [-1, 16, 64, 49152, 2147483647, 1024, 8, 32], "", 0, []], [[], [["FU", 2, [0, 1, 2, 3]], ["SP", 2, 0, 200704, [4], 1], ["AN", 2, 0, 5], ["AN", 2, 1, 6]]]], "r": [[3.99471e-05, 4.39077e-05, 4.34112e-05, 7.61083e-05, 3.99298e-05, 4.07517e-05, 7.93701e-05, 4.12589e-05, 3.99644e-05, 4.04485e-05], 0, 17.5011, 1651682401], "v": "v0.6"}
{"i": [["[\"fused_window_reverse_roll_add\", 1, 28, 28, 256, 3, 7, \"float16\"]", "cuda -keys=cuda,gpu -max_num_threads=1024 -model=unknown -thread_warp_size=32", [-1, 16, 64, 49152, 2147483647, 1024, 8, 32], "", 0, []], [[], [["FU", 2, [0, 1, 2, 3]], ["SP", 2, 0, 200704, [49], 1], ["AN", 2, 0, 5], ["AN", 2, 1, 6]]]], "r": [[6.65963e-06, 6.15327e-06, 6.77666e-06, 5.67362e-06, 6.0752e-06, 5.9071e-06, 5.83309e-06, 5.75916e-06, 5.7001e-06, 5.67934e-06], 0, 31.4168, 1651682415], "v": "v0.6"}
{"i": [["[\"fused_window_reverse_roll_add\", 1, 28, 28, 256, 3, 7, \"float16\"]", "cuda -keys=cuda,gpu -max_num_threads=1024 -model=unknown -thread_warp_size=32", [-1, 16, 64, 49152, 2147483647, 1024, 8, 32], "", 0, []], [[], [["FU", 2, [0, 1, 2, 3]], ["SP", 2, 0, 200704, [2], 1], ["AN", 2, 0, 5], ["AN", 2, 1, 6]]]], "r": [[0.000356021, 7.86177e-05, 7.96473e-05, 7.98367e-05, 7.74539e-05, 8.53645e-05, 8.07402e-05, 8.39348e-05, 7.89178e-05, 7.968e-05], 0, 28.0979, 1651682411], "v": "v0.6"}
{"i": [["[\"fused_window_reverse_roll_add\", 1, 28, 28, 256, 3, 7, \"float16\"]", "cuda -keys=cuda,gpu -max_num_threads=1024 -model=unknown -thread_warp_size=32", [-1, 16, 64, 49152, 2147483647, 1024, 8, 32], "", 0, []], [[], [["FU", 2, [0, 1, 2, 3]], ["SP", 2, 0, 200704, [32], 1], ["AN", 2, 0, 5], ["AN", 2, 1, 6]]]], "r": [[7.72655e-06, 7.49531e-06, 7.48663e-06, 7.52496e-06, 7.53186e-06, 8.38975e-06, 7.84088e-06, 7.80388e-06, 7.60429e-06, 7.80391e-06], 0, 34.2629, 1651682418], "v": "v0.6"}
{"i": [["[\"fused_window_reverse_roll_add\", 1, 28, 28, 256, 3, 7, \"float16\"]", "cuda -keys=cuda,gpu -max_num_threads=1024 -model=unknown -thread_warp_size=32", [-1, 16, 64, 49152, 2147483647, 1024, 8, 32], "", 0, []], [[], [["FU", 2, [0, 1, 2, 3]], ["SP", 2, 0, 200704, [14], 1], ["AN", 2, 0, 5], ["AN", 2, 1, 6]]]], "r": [[1.42265e-05, 1.44371e-05, 1.45424e-05, 1.35913e-05, 1.35729e-05, 1.36835e-05, 1.42503e-05, 1.47116e-05, 1.35858e-05, 1.36055e-05], 0, 37.2982, 1651682421], "v": "v0.6"}
{"i": [["[\"fused_window_reverse_roll_add\", 1, 28, 28, 256, 3, 7, \"float16\"]", "cuda -keys=cuda,gpu -max_num_threads=1024 -model=unknown -thread_warp_size=32", [-1, 16, 64, 49152, 2147483647, 1024, 8, 32], "", 0, []], [[], [["FU", 2, [0, 1, 2, 3]], ["SP", 2, 0, 200704, [1], 1], ["AN", 2, 0, 5], ["AN", 2, 1, 6]]]], "r": [[0.000156309, 0.000154896, 0.000151685, 0.000168679, 0.000151889, 0.000151843, 0.000151835, 0.000151947, 0.000151738, 0.000164878], 0, 24.3125, 1651682408], "v": "v0.6"}
{"i": [["[\"fused_window_reverse_roll_add\", 1, 28, 28, 256, 3, 7, \"float16\"]", "cuda -keys=cuda,gpu -max_num_threads=1024 -model=unknown -thread_warp_size=32", [-1, 16, 64, 49152, 2147483647, 1024, 8, 32], "", 0, []], [[], [["FU", 2, [0, 1, 2, 3]], ["SP", 2, 0, 200704, [7], 1], ["AN", 2, 0, 5], ["AN", 2, 1, 6]]]], "r": [[9.15886e-05, 2.4994e-05, 2.43268e-05, 2.42868e-05, 2.42073e-05, 2.69115e-05, 2.84939e-05, 2.82857e-05, 2.44025e-05, 2.4281e-05], 0, 40.8158, 1651682424], "v": "v0.6"}
{"i": [["[\"fused_window_reverse_roll_add\", 1, 28, 28, 256, 3, 7, \"float16\"]", "cuda -keys=cuda,gpu -max_num_threads=1024 -model=unknown -thread_warp_size=32", [-1, 16, 64, 49152, 2147483647, 1024, 8, 32], "", 0, []], [[], [["FU", 2, [0, 1, 2, 3]], ["SP", 2, 0, 200704, [14], 1], ["AN", 2, 0, 5], ["AN", 2, 1, 6]]]], "r": [[1.34413e-05, 1.34415e-05, 1.34424e-05, 1.34435e-05, 1.34434e-05, 1.3441e-05, 1.34426e-05, 1.34395e-05, 1.34402e-05, 1.34392e-05], 0, 19.5884, 1652003094], "v": "v0.6"}
{"i": [["[\"fused_window_reverse_roll_add\", 1, 28, 28, 256, 3, 7, \"float16\"]", "cuda -keys=cuda,gpu -max_num_threads=1024 -model=unknown -thread_warp_size=32", [-1, 16, 64, 49152, 2147483647, 1024, 8, 32], "", 0, []], [[], [["FU", 2, [0, 1, 2, 3]], ["SP", 2, 0, 200704, [8], 1], ["AN", 2, 0, 5], ["AN", 2, 1, 6]]]], "r": [[2.16229e-05, 2.16243e-05, 2.16221e-05, 2.16226e-05, 2.16232e-05, 2.16224e-05, 2.16184e-05, 2.16187e-05, 2.16224e-05, 2.16187e-05], 0, 5.7553, 1652003081], "v": "v0.6"}
{"i": [["[\"fused_window_reverse_roll_add\", 1, 28, 28, 256, 3, 7, \"float16\"]", "cuda -keys=cuda,gpu -max_num_threads=1024 -model=unknown -thread_warp_size=32", [-1, 16, 64, 49152, 2147483647, 1024, 8, 32], "", 0, []], [[], [["FU", 2, [0, 1, 2, 3]], ["SP", 2, 0, 200704, [32], 1], ["AN", 2, 0, 5], ["AN", 2, 1, 6]]]], "r": [[7.50192e-06, 7.50006e-06, 7.49782e-06, 7.49787e-06, 7.4998e-06, 7.5005e-06, 7.50292e-06, 7.50519e-06, 7.50449e-06, 7.50228e-06], 0, 27.9599, 1652003103], "v": "v0.6"}
{"i": [["[\"fused_window_reverse_roll_add\", 1, 28, 28, 256, 3, 7, \"float16\"]", "cuda -keys=cuda,gpu -max_num_threads=1024 -model=unknown -thread_warp_size=32", [-1, 16, 64, 49152, 2147483647, 1024, 8, 32], "", 0, []], [[], [["FU", 2, [0, 1, 2, 3]], ["SP", 2, 0, 200704, [64], 1], ["AN", 2, 0, 5], ["AN", 2, 1, 6]]]], "r": [[4.99705e-06, 4.99695e-06, 4.99701e-06, 4.9965e-06, 4.99658e-06, 4.99661e-06, 4.99629e-06, 4.99677e-06, 4.99673e-06, 4.99607e-06], 0, 14.8176, 1652003090], "v": "v0.6"}
{"i": [["[\"fused_window_reverse_roll_add\", 1, 28, 28, 256, 3, 7, \"float16\"]", "cuda -keys=cuda,gpu -max_num_threads=1024 -model=unknown -thread_warp_size=32", [-1, 16, 64, 49152, 2147483647, 1024, 8, 32], "", 0, []], [[], [["FU", 2, [0, 1, 2, 3]], ["SP", 2, 0, 200704, [49], 1], ["AN", 2, 0, 5], ["AN", 2, 1, 6]]]], "r": [[5.72589e-06, 5.72653e-06, 5.72313e-06, 5.7243e-06, 5.72286e-06, 5.7236e-06, 5.72282e-06, 5.723e-06, 5.72416e-06, 5.7234e-06], 0, 23.658, 1652003098], "v": "v0.6"}
{"i": [["[\"fused_window_reverse_roll_add\", 1, 28, 28, 256, 3, 7, \"float16\"]", "cuda -keys=cuda,gpu -max_num_threads=1024 -model=unknown -thread_warp_size=32", [-1, 16, 64, 49152, 2147483647, 1024, 8, 32], "", 0, []], [[], [["FU", 2, [0, 1, 2, 3]], ["SP", 2, 0, 200704, [4], 1], ["AN", 2, 0, 5], ["AN", 2, 1, 6]]]], "r": [[3.99382e-05, 3.99378e-05, 3.99372e-05, 3.99406e-05, 3.994e-05, 3.9944e-05, 3.99419e-05, 3.99397e-05, 3.99373e-05, 3.99402e-05], 0, 11.0208, 1652003086], "v": "v0.6"}
{"i": [["[\"fused_window_reverse_roll_add\", 1, 28, 28, 256, 3, 7, \"float16\"]", "cuda -keys=cuda,gpu -max_num_threads=1024 -model=unknown -thread_warp_size=32", [-1, 16, 64, 49152, 2147483647, 1024, 8, 32], "", 0, []], [[], [["FU", 2, [0, 1, 2, 3]], ["SP", 2, 0, 200704, [1], 1], ["AN", 2, 0, 5], ["AN", 2, 1, 6]]]], "r": [[0.000151743, 0.000151727, 0.000151736, 0.000151749, 0.000151732, 0.000151733, 0.000151741, 0.000151737, 0.000151747, 0.000151745], 0, 33.5057, 1652003108], "v": "v0.6"}
{"i": [["[\"fused_window_reverse_roll_add\", 1, 28, 28, 256, 3, 7, \"float16\"]", "cuda -keys=cuda,gpu -max_num_threads=1024 -model=unknown -thread_warp_size=32", [-1, 16, 64, 49152, 2147483647, 1024, 8, 32], "", 0, []], [[], [["FU", 2, [0, 1, 2, 3]], ["SP", 2, 0, 200704, [16], 1], ["AN", 2, 0, 5], ["AN", 2, 1, 6]]]], "r": [[1.23589e-05, 1.23622e-05, 1.23617e-05, 1.2358e-05, 1.23657e-05, 1.23657e-05, 1.23618e-05, 1.23589e-05, 1.23653e-05, 1.23621e-05], 0, 38.2119, 1652003113], "v": "v0.6"}
{"i": [["[\"fused_window_reverse_roll_add\", 1, 28, 28, 256, 3, 7, \"float16\"]", "cuda -keys=cuda,gpu -max_num_threads=1024 -model=unknown -thread_warp_size=32", [-1, 16, 64, 49152, 2147483647, 1024, 8, 32], "", 0, []], [[], [["FU", 2, [0, 1, 2, 3]], ["SP", 2, 0, 200704, [2], 1], ["AN", 2, 0, 5], ["AN", 2, 1, 6]]]], "r": [[7.73486e-05, 7.73458e-05, 7.73486e-05, 7.73496e-05, 7.73485e-05, 7.73516e-05, 7.73549e-05, 7.73514e-05, 7.73511e-05, 7.73552e-05], 0, 43.6489, 1652003119], "v": "v0.6"}
{"i": [["[\"fused_window_reverse_roll_add\", 1, 28, 28, 256, 3, 7, \"float16\"]", "cuda -keys=cuda,gpu -max_num_threads=1024 -model=unknown -thread_warp_size=32", [-1, 16, 64, 49152, 2147483647, 1024, 8, 32], "", 0, []], [[], [["FU", 2, [0, 1, 2, 3]], ["SP", 2, 0, 200704, [28], 1], ["AN", 2, 0, 5], ["AN", 2, 1, 6]]]], "r": [[8.30646e-06, 8.30641e-06, 8.30601e-06, 8.30587e-06, 8.30622e-06, 8.30639e-06, 8.30602e-06, 8.30507e-06, 8.3046e-06, 8.30617e-06], 0, 48.0426, 1652003123], "v": "v0.6"}
{"i": [["[\"fused_window_reverse_roll_add\", 1, 28, 28, 256, 3, 7, \"float16\"]", "cuda -keys=cuda,gpu -max_num_threads=1024 -model=unknown -thread_warp_size=32", [-1, 16, 64, 49152, 2147483647, 1024, 8, 32], "", 0, []], [[], [["FU", 2, [0, 1, 2, 3]], ["SP", 2, 0, 200704, [56], 1], ["AN", 2, 0, 5], ["AN", 2, 1, 6]]]], "r": [[5.34192e-06, 5.34186e-06, 5.34189e-06, 5.3416e-06, 5.34153e-06, 5.34146e-06, 5.34191e-06, 5.34191e-06, 5.34219e-06, 5.34234e-06], 0, 51.8329, 1652003127], "v": "v0.6"}
{"i": [["[\"fused_window_reverse_roll_add\", 1, 28, 28, 256, 3, 7, \"float16\"]", "cuda -keys=cuda,gpu -max_num_threads=1024 -model=unknown -thread_warp_size=32", [-1, 16, 64, 49152, 2147483647, 1024, 8, 32], "", 0, []], [[], [["FU", 2, [0, 1, 2, 3]], ["SP", 2, 0, 200704, [7], 1], ["AN", 2, 0, 5], ["AN", 2, 1, 6]]]], "r": [[2.41291e-05, 2.41272e-05, 2.41282e-05, 2.41277e-05, 2.41274e-05, 2.4128e-05, 2.41235e-05, 2.41248e-05, 2.41258e-05, 2.41268e-05], 0, 56.8376, 1652003132], "v": "v0.6"}
