python/models/swin_transformer/kernel_configs/swin_transformer_add_1_56_56_256_float16.log
{"i": [["[\"add\", 1, 56, 56, 256, \"float16\"]", "cuda -keys=cuda,gpu -max_num_threads=1024 -model=unknown -thread_warp_size=32", [-1, 16, 64, 49152, 2147483647, 1024, 8, 32], "", 0, []], [[], [["FU", 2, [0, 1, 2, 3]], ["SP", 2, 0, 802816, [8], 1], ["AN", 2, 0, 5], ["AN", 2, 1, 6]]]], "r": [[7.70724e-05, 7.70628e-05, 7.70709e-05], 0, 1.46502, 1668018701], "v": "v0.6"}
{"i": [["[\"add\", 1, 56, 56, 256, \"float16\"]", "cuda -keys=cuda,gpu -max_num_threads=1024 -model=unknown -thread_warp_size=32", [-1, 16, 64, 49152, 2147483647, 1024, 8, 32], "", 0, []], [[], [["FU", 2, [0, 1, 2, 3]], ["SP", 2, 0, 802816, [64], 1], ["AN", 2, 0, 5], ["AN", 2, 1, 6]]]], "r": [[1.1945e-05, 1.19526e-05, 1.19509e-05], 0, 1.85139, 1668018702], "v": "v0.6"}
{"i": [["[\"add\", 1, 56, 56, 256, \"float16\"]", "cuda -keys=cuda,gpu -max_num_threads=1024 -model=unknown -thread_warp_size=32", [-1, 16, 64, 49152, 2147483647, 1024, 8, 32], "", 0, []], [[], [["FU", 2, [0, 1, 2, 3]], ["SP", 2, 0, 802816, [1], 1], ["AN", 2, 0, 5], ["AN", 2, 1, 6]]]], "r": [[0.000598052, 0.00059805, 0.000598117], 0, 2.63165, 1668018702], "v": "v0.6"}
{"i": [["[\"add\", 1, 56, 56, 256, \"float16\"]", "cuda -keys=cuda,gpu -max_num_threads=1024 -model=unknown -thread_warp_size=32", [-1, 16, 64, 49152, 2147483647, 1024, 8, 32], "", 0, []], [[], [["FU", 2, [0, 1, 2, 3]], ["SP", 2, 0, 802816, [4], 1], ["AN", 2, 0, 5], ["AN", 2, 1, 6]]]], "r": [[0.000151521, 0.000151538, 0.000151525], 0, 2.26702, 1668018702], "v": "v0.6"}
{"i": [["[\"add\", 1, 56, 56, 256, \"float16\"]", "cuda -keys=cuda,gpu -max_num_threads=1024 -model=unknown -thread_warp_size=32", [-1, 16, 64, 49152, 2147483647, 1024, 8, 32], "", 0, []], [[], [["FU", 2, [0, 1, 2, 3]], ["SP", 2, 0, 802816, [7], 1], ["AN", 2, 0, 5], ["AN", 2, 1, 6]]]], "r": [[8.78325e-05, 8.7842e-05, 8.78263e-05], 0, 1.06558, 1668018701], "v": "v0.6"}
{"i": [["[\"add\", 1, 56, 56, 256, \"float16\"]", "cuda -keys=cuda,gpu -max_num_threads=1024 -model=unknown -thread_warp_size=32", [-1, 16, 64, 49152, 2147483647, 1024, 8, 32], "", 0, []], [[], [["FU", 2, [0, 1, 2, 3]], ["SP", 2, 0, 802816, [56], 1], ["AN", 2, 0, 5], ["AN", 2, 1, 6]]]], "r": [[1.3143e-05, 1.31329e-05, 1.3123e-05], 0, 3.02056, 1668018703], "v": "v0.6"}
{"i": [["[\"add\", 1, 56, 56, 256, \"float16\"]", "cuda -keys=cuda,gpu -max_num_threads=1024 -model=unknown -thread_warp_size=32", [-1, 16, 64, 49152, 2147483647, 1024, 8, 32], "", 0, []], [[], [["FU", 2, [0, 1, 2, 3]], ["SP", 2, 0, 802816, [14], 1], ["AN", 2, 0, 5], ["AN", 2, 1, 6]]]], "r": [[4.52496e-05, 4.52301e-05, 4.52237e-05], 0, 0.64123, 1668018700], "v": "v0.6"}
{"i": [["[\"add\", 1, 56, 56, 256, \"float16\"]", "cuda -keys=cuda,gpu -max_num_threads=1024 -model=unknown -thread_warp_size=32", [-1, 16, 64, 49152, 2147483647, 1024, 8, 32], "", 0, []], [[], [["FU", 2, [0, 1, 2, 3]], ["SP", 2, 0, 802816, [49], 1], ["AN", 2, 0, 5], ["AN", 2, 1, 6]]]], "r": [[1.46023e-05, 1.46008e-05, 1.4608e-05], 0, 3.43825, 1668018703], "v": "v0.6"}
{"i": [["[\"add\", 1, 56, 56, 256, \"float16\"]", "cuda -keys=cuda,gpu -max_num_threads=1024 -model=unknown -thread_warp_size=32", [-1, 16, 64, 49152, 2147483647, 1024, 8, 32], "", 0, []], [[], [["FU", 2, [0, 1, 2, 3]], ["SP", 2, 0, 802816, [32], 1], ["AN", 2, 0, 5], ["AN", 2, 1, 6]]]], "r": [[2.14255e-05, 2.14201e-05, 2.14233e-05], 0, 4.21115, 1668018704], "v": "v0.6"}
{"i": [["[\"add\", 1, 56, 56, 256, \"float16\"]", "cuda -keys=cuda,gpu -max_num_threads=1024 -model=unknown -thread_warp_size=32", [-1, 16, 64, 49152, 2147483647, 1024, 8, 32], "", 0, []], [[], [["FU", 2, [0, 1, 2, 3]], ["SP", 2, 0, 802816, [28], 1], ["AN", 2, 0, 5], ["AN", 2, 1, 6]]]], "r": [[2.42183e-05, 2.4225e-05, 2.42251e-05], 0, 3.86663, 1668018704], "v": "v0.6"}
{"i": [["[\"add\", 1, 56, 56, 256, \"float16\"]", "cuda -keys=cuda,gpu -max_num_threads=1024 -model=unknown -thread_warp_size=32", [-1, 16, 64, 49152, 2147483647, 1024, 8, 32], "", 0, []], [[], [["FU", 2, [0, 1, 2, 3]], ["SP", 2, 0, 802816, [16], 1], ["AN", 2, 0, 5], ["AN", 2, 1, 6]]]], "r": [[3.99459e-05, 3.99505e-05, 3.9952e-05], 0, 5.05647, 1668018705], "v": "v0.6"}
{"i": [["[\"add\", 1, 56, 56, 256, \"float16\"]", "cuda -keys=cuda,gpu -max_num_threads=1024 -model=unknown -thread_warp_size=32", [-1, 16, 64, 49152, 2147483647, 1024, 8, 32], "", 0, []], [[], [["FU", 2, [0, 1, 2, 3]], ["SP", 2, 0, 802816, [2], 1], ["AN", 2, 0, 5], ["AN", 2, 1, 6]]]], "r": [[0.000300442, 0.000300502, 0.000300441], 0, 4.66295, 1668018704], "v": "v0.6"}
{"i": [["[\"add\", 1, 56, 56, 256, \"float16\"]", "cuda -keys=cuda,gpu -max_num_threads=1024 -model=unknown -thread_warp_size=32", [-1, 16, 64, 49152, 2147483647, 1024, 8, 32], "", 0, []], [[], [["FU", 2, [0, 1, 2, 3]], ["SP", 2, 0, 802816, [56], 1], ["AN", 2, 0, 5], ["AN", 2, 1, 6]]]], "r": [[1.31669e-05, 1.31627e-05, 1.3153e-05], 0, 1.84135, 1668018788], "v": "v0.6"}
{"i": [["[\"add\", 1, 56, 56, 256, \"float16\"]", "cuda -keys=cuda,gpu -max_num_threads=1024 -model=unknown -thread_warp_size=32", [-1, 16, 64, 49152, 2147483647, 1024, 8, 32], "", 0, []], [[], [["FU", 2, [0, 1, 2, 3]], ["SP", 2, 0, 802816, [28], 1], ["AN", 2, 0, 5], ["AN", 2, 1, 6]]]], "r": [[2.4109e-05, 2.41088e-05, 2.40886e-05], 0, 3.8365, 1668018790], "v": "v0.6"}
{"i": [["[\"add\", 1, 56, 56, 256, \"float16\"]", "cuda -keys=cuda,gpu -max_num_threads=1024 -model=unknown -thread_warp_size=32", [-1, 16, 64, 49152, 2147483647, 1024, 8, 32], "", 0, []], [[], [["FU", 2, [0, 1, 2, 3]], ["SP", 2, 0, 802816, [1], 1], ["AN", 2, 0, 5], ["AN", 2, 1, 6]]]], "r": [[0.000598133, 0.000598135, 0.000598112], 0, 0.639181, 1668018787], "v": "v0.6"}
{"i": [["[\"add\", 1, 56, 56, 256, \"float16\"]", "cuda -keys=cuda,gpu -max_num_threads=1024 -model=unknown -thread_warp_size=32", [-1, 16, 64, 49152, 2147483647, 1024, 8, 32], "", 0, []], [[], [["FU", 2, [0, 1, 2, 3]], ["SP", 2, 0, 802816, [16], 1], ["AN", 2, 0, 5], ["AN", 2, 1, 6]]]], "r": [[3.9833e-05, 3.98377e-05, 3.9832e-05], 0, 1.46707, 1668018787], "v": "v0.6"}
{"i": [["[\"add\", 1, 56, 56, 256, \"float16\"]", "cuda -keys=cuda,gpu -max_num_threads=1024 -model=unknown -thread_warp_size=32", [-1, 16, 64, 49152, 2147483647, 1024, 8, 32], "", 0, []], [[], [["FU", 2, [0, 1, 2, 3]], ["SP", 2, 0, 802816, [32], 1], ["AN", 2, 0, 5], ["AN", 2, 1, 6]]]], "r": [[2.13957e-05, 2.13901e-05, 2.13904e-05], 0, 1.07365, 1668018787], "v": "v0.6"}
{"i": [["[\"add\", 1, 56, 56, 256, \"float16\"]", "cuda -keys=cuda,gpu -max_num_threads=1024 -model=unknown -thread_warp_size=32", [-1, 16, 64, 49152, 2147483647, 1024, 8, 32], "", 0, []], [[], [["FU", 2, [0, 1, 2, 3]], ["SP", 2, 0, 802816, [14], 1], ["AN", 2, 0, 5], ["AN", 2, 1, 6]]]], "r": [[4.52862e-05, 4.52654e-05, 4.52647e-05], 0, 2.63833, 1668018789], "v": "v0.6"}
{"i": [["[\"add\", 1, 56, 56, 256, \"float16\"]", "cuda -keys=cuda,gpu -max_num_threads=1024 -model=unknown -thread_warp_size=32", [-1, 16, 64, 49152, 2147483647, 1024, 8, 32], "", 0, []], [[], [["FU", 2, [0, 1, 2, 3]], ["SP", 2, 0, 802816, [2], 1], ["AN", 2, 0, 5], ["AN", 2, 1, 6]]]], "r": [[0.000300354, 0.000300344, 0.000300349], 0, 2.25864, 1668018788], "v": "v0.6"}
{"i": [["[\"add\", 1, 56, 56, 256, \"float16\"]", "cuda -keys=cuda,gpu -max_num_threads=1024 -model=unknown -thread_warp_size=32", [-1, 16, 64, 49152, 2147483647, 1024, 8, 32], "", 0, []], [[], [["FU", 2, [0, 1, 2, 3]], ["SP", 2, 0, 802816, [49], 1], ["AN", 2, 0, 5], ["AN", 2, 1, 6]]]], "r": [[1.47159e-05, 1.47184e-05, 1.47129e-05], 0, 3.4574, 1668018789], "v": "v0.6"}
{"i": [["[\"add\", 1, 56, 56, 256, \"float16\"]", "cuda -keys=cuda,gpu -max_num_threads=1024 -model=unknown -thread_warp_size=32", [-1, 16, 64, 49152, 2147483647, 1024, 8, 32], "", 0, []], [[], [["FU", 2, [0, 1, 2, 3]], ["SP", 2, 0, 802816, [8], 1], ["AN", 2, 0, 5], ["AN", 2, 1, 6]]]], "r": [[7.70091e-05, 7.70137e-05, 7.70155e-05], 0, 3.03702, 1668018789], "v": "v0.6"}
{"i": [["[\"add\", 1, 56, 56, 256, \"float16\"]", "cuda -keys=cuda,gpu -max_num_threads=1024 -model=unknown -thread_warp_size=32", [-1, 16, 64, 49152, 2147483647, 1024, 8, 32], "", 0, []], [[], [["FU", 2, [0, 1, 2, 3]], ["SP", 2, 0, 802816, [4], 1], ["AN", 2, 0, 5], ["AN", 2, 1, 6]]]], "r": [[0.00015165, 0.000151618, 0.000151642], 0, 4.20491, 1668018790], "v": "v0.6"}
{"i": [["[\"add\", 1, 56, 56, 256, \"float16\"]", "cuda -keys=cuda,gpu -max_num_threads=1024 -model=unknown -thread_warp_size=32", [-1, 16, 64, 49152, 2147483647, 1024, 8, 32], "", 0, []], [[], [["FU", 2, [0, 1, 2, 3]], ["SP", 2, 0, 802816, [7], 1], ["AN", 2, 0, 5], ["AN", 2, 1, 6]]]], "r": [[8.79161e-05, 8.78943e-05, 8.79025e-05], 0, 4.6286, 1668018791], "v": "v0.6"}
{"i": [["[\"add\", 1, 56, 56, 256, \"float16\"]", "cuda -keys=cuda,gpu -max_num_threads=1024 -model=unknown -thread_warp_size=32", [-1, 16, 64, 49152, 2147483647, 1024, 8, 32], "", 0, []], [[], [["FU", 2, [0, 1, 2, 3]], ["SP", 2, 0, 802816, [64], 1], ["AN", 2, 0, 5], ["AN", 2, 1, 6]]]], "r": [[1.19589e-05, 1.19711e-05, 1.19602e-05], 0, 5.01635, 1668018791], "v": "v0.6"}
