python/models/swin_transformer/kernel_configs/swin_transformer_roll_1_14_14_512_-3_float16.log
{"i": [["[\"roll\", 1, 14, 14, 512, -3, \"float16\"]", "cuda -keys=cuda,gpu -max_num_threads=1024 -model=unknown -thread_warp_size=32", [-1, 16, 64, 49152, 2147483647, 1024, 8, 32], "", 0, []], [[], [["FU", 1, [0, 1, 2, 3]], ["SP", 1, 0, 100352, [16], 1], ["AN", 1, 0, 5], ["AN", 1, 1, 6]]]], "r": [[7.36546e-06, 7.36935e-06, 7.37113e-06], 0, 0.628857, 1668053044], "v": "v0.6"}
{"i": [["[\"roll\", 1, 14, 14, 512, -3, \"float16\"]", "cuda -keys=cuda,gpu -max_num_threads=1024 -model=unknown -thread_warp_size=32", [-1, 16, 64, 49152, 2147483647, 1024, 8, 32], "", 0, []], [[], [["FU", 1, [0, 1, 2, 3]], ["SP", 1, 0, 100352, [64], 1], ["AN", 1, 0, 5], ["AN", 1, 1, 6]]]], "r": [[3.79413e-06, 3.80307e-06, 3.80561e-06], 0, 2.17229, 1668053046], "v": "v0.6"}
{"i": [["[\"roll\", 1, 14, 14, 512, -3, \"float16\"]", "cuda -keys=cuda,gpu -max_num_threads=1024 -model=unknown -thread_warp_size=32", [-1, 16, 64, 49152, 2147483647, 1024, 8, 32], "", 0, []], [[], [["FU", 1, [0, 1, 2, 3]], ["SP", 1, 0, 100352, [1], 1], ["AN", 1, 0, 5], ["AN", 1, 1, 6]]]], "r": [[7.71439e-05, 7.71424e-05, 7.71524e-05], 0, 1.39024, 1668053045], "v": "v0.6"}
{"i": [["[\"roll\", 1, 14, 14, 512, -3, \"float16\"]", "cuda -keys=cuda,gpu -max_num_threads=1024 -model=unknown -thread_warp_size=32", [-1, 16, 64, 49152, 2147483647, 1024, 8, 32], "", 0, []], [[], [["FU", 1, [0, 1, 2, 3]], ["SP", 1, 0, 100352, [28], 1], ["AN", 1, 0, 5], ["AN", 1, 1, 6]]]], "r": [[5.35248e-06, 5.37548e-06, 5.3797e-06], 0, 1.0027, 1668053045], "v": "v0.6"}
{"i": [["[\"roll\", 1, 14, 14, 512, -3, \"float16\"]", "cuda -keys=cuda,gpu -max_num_threads=1024 -model=unknown -thread_warp_size=32", [-1, 16, 64, 49152, 2147483647, 1024, 8, 32], "", 0, []], [[], [["FU", 1, [0, 1, 2, 3]], ["SP", 1, 0, 100352, [2], 1], ["AN", 1, 0, 5], ["AN", 1, 1, 6]]]], "r": [[3.99833e-05, 4.00036e-05, 3.99773e-05], 0, 1.79848, 1668053046], "v": "v0.6"}
{"i": [["[\"roll\", 1, 14, 14, 512, -3, \"float16\"]", "cuda -keys=cuda,gpu -max_num_threads=1024 -model=unknown -thread_warp_size=32", [-1, 16, 64, 49152, 2147483647, 1024, 8, 32], "", 0, []], [[], [["FU", 1, [0, 1, 2, 3]], ["SP", 1, 0, 100352, [4], 1], ["AN", 1, 0, 5], ["AN", 1, 1, 6]]]], "r": [[2.14705e-05, 2.14826e-05, 2.14748e-05], 0, 2.5462, 1668053046], "v": "v0.6"}
{"i": [["[\"roll\", 1, 14, 14, 512, -3, \"float16\"]", "cuda -keys=cuda,gpu -max_num_threads=1024 -model=unknown -thread_warp_size=32", [-1, 16, 64, 49152, 2147483647, 1024, 8, 32], "", 0, []], [[], [["FU", 1, [0, 1, 2, 3]], ["SP", 1, 0, 100352, [49], 1], ["AN", 1, 0, 5], ["AN", 1, 1, 6]]]], "r": [[4.1998e-06, 4.21556e-06, 4.21476e-06], 0, 3.34632, 1668053047], "v": "v0.6"}
{"i": [["[\"roll\", 1, 14, 14, 512, -3, \"float16\"]", "cuda -keys=cuda,gpu -max_num_threads=1024 -model=unknown -thread_warp_size=32", [-1, 16, 64, 49152, 2147483647, 1024, 8, 32], "", 0, []], [[], [["FU", 1, [0, 1, 2, 3]], ["SP", 1, 0, 100352, [14], 1], ["AN", 1, 0, 5], ["AN", 1, 1, 6]]]], "r": [[8.08706e-06, 8.09831e-06, 8.0949e-06], 0, 4.8967, 1668053049], "v": "v0.6"}
{"i": [["[\"roll\", 1, 14, 14, 512, -3, \"float16\"]", "cuda -keys=cuda,gpu -max_num_threads=1024 -model=unknown -thread_warp_size=32", [-1, 16, 64, 49152, 2147483647, 1024, 8, 32], "", 0, []], [[], [["FU", 1, [0, 1, 2, 3]], ["SP", 1, 0, 100352, [32], 1], ["AN", 1, 0, 5], ["AN", 1, 1, 6]]]], "r": [[5.08553e-06, 5.11292e-06, 5.11079e-06], 0, 3.70305, 1668053048], "v": "v0.6"}
{"i": [["[\"roll\", 1, 14, 14, 512, -3, \"float16\"]", "cuda -keys=cuda,gpu -max_num_threads=1024 -model=unknown -thread_warp_size=32", [-1, 16, 64, 49152, 2147483647, 1024, 8, 32], "", 0, []], [[], [["FU", 1, [0, 1, 2, 3]], ["SP", 1, 0, 100352, [56], 1], ["AN", 1, 0, 5], ["AN", 1, 1, 6]]]], "r": [[3.94527e-06, 3.96056e-06, 3.96152e-06], 0, 4.51704, 1668053048], "v": "v0.6"}
{"i": [["[\"roll\", 1, 14, 14, 512, -3, \"float16\"]", "cuda -keys=cuda,gpu -max_num_threads=1024 -model=unknown -thread_warp_size=32", [-1, 16, 64, 49152, 2147483647, 1024, 8, 32], "", 0, []], [[], [["FU", 1, [0, 1, 2, 3]], ["SP", 1, 0, 100352, [8], 1], ["AN", 1, 0, 5], ["AN", 1, 1, 6]]]], "r": [[1.20646e-05, 1.2092e-05, 1.2087e-05], 0, 2.96747, 1668053047], "v": "v0.6"}
{"i": [["[\"roll\", 1, 14, 14, 512, -3, \"float16\"]", "cuda -keys=cuda,gpu -max_num_threads=1024 -model=unknown -thread_warp_size=32", [-1, 16, 64, 49152, 2147483647, 1024, 8, 32], "", 0, []], [[], [["FU", 1, [0, 1, 2, 3]], ["SP", 1, 0, 100352, [7], 1], ["AN", 1, 0, 5], ["AN", 1, 1, 6]]]], "r": [[1.33885e-05, 1.33991e-05, 1.3398e-05], 0, 4.13597, 1668053048], "v": "v0.6"}
{"i": [["[\"roll\", 1, 14, 14, 512, -3, \"float16\"]", "cuda -keys=cuda,gpu -max_num_threads=1024 -model=unknown -thread_warp_size=32", [-1, 16, 64, 49152, 2147483647, 1024, 8, 32], "", 0, []], [[], [["FU", 1, [0, 1, 2, 3]], ["SP", 1, 0, 100352, [49], 1], ["AN", 1, 0, 5], ["AN", 1, 1, 6]]]], "r": [[4.14925e-06, 4.16048e-06, 4.15951e-06], 0, 1.95991, 1668054248], "v": "v0.6"}
{"i": [["[\"roll\", 1, 14, 14, 512, -3, \"float16\"]", "cuda -keys=cuda,gpu -max_num_threads=1024 -model=unknown -thread_warp_size=32", [-1, 16, 64, 49152, 2147483647, 1024, 8, 32], "", 0, []], [[], [["FU", 1, [0, 1, 2, 3]], ["SP", 1, 0, 100352, [2], 1], ["AN", 1, 0, 5], ["AN", 1, 1, 6]]]], "r": [[3.98976e-05, 3.99198e-05, 3.99092e-05], 0, 2.66689, 1668054249], "v": "v0.6"}
{"i": [["[\"roll\", 1, 14, 14, 512, -3, \"float16\"]", "cuda -keys=cuda,gpu -max_num_threads=1024 -model=unknown -thread_warp_size=32", [-1, 16, 64, 49152, 2147483647, 1024, 8, 32], "", 0, []], [[], [["FU", 1, [0, 1, 2, 3]], ["SP", 1, 0, 100352, [14], 1], ["AN", 1, 0, 5], ["AN", 1, 1, 6]]]], "r": [[8.01098e-06, 8.036e-06, 8.03714e-06], 0, 0.57483, 1668054247], "v": "v0.6"}
{"i": [["[\"roll\", 1, 14, 14, 512, -3, \"float16\"]", "cuda -keys=cuda,gpu -max_num_threads=1024 -model=unknown -thread_warp_size=32", [-1, 16, 64, 49152, 2147483647, 1024, 8, 32], "", 0, []], [[], [["FU", 1, [0, 1, 2, 3]], ["SP", 1, 0, 100352, [64], 1], ["AN", 1, 0, 5], ["AN", 1, 1, 6]]]], "r": [[3.73894e-06, 3.74673e-06, 3.75033e-06], 0, 1.2334, 1668054248], "v": "v0.6"}
{"i": [["[\"roll\", 1, 14, 14, 512, -3, \"float16\"]", "cuda -keys=cuda,gpu -max_num_threads=1024 -model=unknown -thread_warp_size=32", [-1, 16, 64, 49152, 2147483647, 1024, 8, 32], "", 0, []], [[], [["FU", 1, [0, 1, 2, 3]], ["SP", 1, 0, 100352, [28], 1], ["AN", 1, 0, 5], ["AN", 1, 1, 6]]]], "r": [[5.3618e-06, 5.38515e-06, 5.38135e-06], 0, 0.909724, 1668054247], "v": "v0.6"}
{"i": [["[\"roll\", 1, 14, 14, 512, -3, \"float16\"]", "cuda -keys=cuda,gpu -max_num_threads=1024 -model=unknown -thread_warp_size=32", [-1, 16, 64, 49152, 2147483647, 1024, 8, 32], "", 0, []], [[], [["FU", 1, [0, 1, 2, 3]], ["SP", 1, 0, 100352, [1], 1], ["AN", 1, 0, 5], ["AN", 1, 1, 6]]]], "r": [[7.71714e-05, 7.71901e-05, 7.7178e-05], 0, 1.61725, 1668054248], "v": "v0.6"}
{"i": [["[\"roll\", 1, 14, 14, 512, -3, \"float16\"]", "cuda -keys=cuda,gpu -max_num_threads=1024 -model=unknown -thread_warp_size=32", [-1, 16, 64, 49152, 2147483647, 1024, 8, 32], "", 0, []], [[], [["FU", 1, [0, 1, 2, 3]], ["SP", 1, 0, 100352, [16], 1], ["AN", 1, 0, 5], ["AN", 1, 1, 6]]]], "r": [[7.26073e-06, 7.27522e-06, 7.27695e-06], 0, 2.28084, 1668054249], "v": "v0.6"}
{"i": [["[\"roll\", 1, 14, 14, 512, -3, \"float16\"]", "cuda -keys=cuda,gpu -max_num_threads=1024 -model=unknown -thread_warp_size=32", [-1, 16, 64, 49152, 2147483647, 1024, 8, 32], "", 0, []], [[], [["FU", 1, [0, 1, 2, 3]], ["SP", 1, 0, 100352, [7], 1], ["AN", 1, 0, 5], ["AN", 1, 1, 6]]]], "r": [[1.34675e-05, 1.34893e-05, 1.34836e-05], 0, 3.71943, 1668054250], "v": "v0.6"}
{"i": [["[\"roll\", 1, 14, 14, 512, -3, \"float16\"]", "cuda -keys=cuda,gpu -max_num_threads=1024 -model=unknown -thread_warp_size=32", [-1, 16, 64, 49152, 2147483647, 1024, 8, 32], "", 0, []], [[], [["FU", 1, [0, 1, 2, 3]], ["SP", 1, 0, 100352, [8], 1], ["AN", 1, 0, 5], ["AN", 1, 1, 6]]]], "r": [[1.21043e-05, 1.21178e-05, 1.21175e-05], 0, 3.32999, 1668054250], "v": "v0.6"}
{"i": [["[\"roll\", 1, 14, 14, 512, -3, \"float16\"]", "cuda -keys=cuda,gpu -max_num_threads=1024 -model=unknown -thread_warp_size=32", [-1, 16, 64, 49152, 2147483647, 1024, 8, 32], "", 0, []], [[], [["FU", 1, [0, 1, 2, 3]], ["SP", 1, 0, 100352, [4], 1], ["AN", 1, 0, 5], ["AN", 1, 1, 6]]]], "r": [[2.14579e-05, 2.14727e-05, 2.14686e-05], 0, 4.04648, 1668054251], "v": "v0.6"}
{"i": [["[\"roll\", 1, 14, 14, 512, -3, \"float16\"]", "cuda -keys=cuda,gpu -max_num_threads=1024 -model=unknown -thread_warp_size=32", [-1, 16, 64, 49152, 2147483647, 1024, 8, 32], "", 0, []], [[], [["FU", 1, [0, 1, 2, 3]], ["SP", 1, 0, 100352, [32], 1], ["AN", 1, 0, 5], ["AN", 1, 1, 6]]]], "r": [[5.01337e-06, 5.02716e-06, 5.02453e-06], 0, 3.00574, 1668054250], "v": "v0.6"}
{"i": [["[\"roll\", 1, 14, 14, 512, -3, \"float16\"]", "cuda -keys=cuda,gpu -max_num_threads=1024 -model=unknown -thread_warp_size=32", [-1, 16, 64, 49152, 2147483647, 1024, 8, 32], "", 0, []], [[], [["FU", 1, [0, 1, 2, 3]], ["SP", 1, 0, 100352, [56], 1], ["AN", 1, 0, 5], ["AN", 1, 1, 6]]]], "r": [[4.07816e-06, 4.08765e-06, 4.08736e-06], 0, 4.38636, 1668054251], "v": "v0.6"}
{"i": [["[\"roll\", 1, 14, 14, 512, -3, \"float16\"]", "cuda -keys=cuda,gpu -max_num_threads=1024 -model=unknown -thread_warp_size=32", [-1, 16, 64, 49152, 2147483647, 1024, 8, 32], "", 0, []], [[], [["FU", 1, [0, 1, 2, 3]], ["SP", 1, 0, 100352, [4], 1], ["AN", 1, 0, 5], ["AN", 1, 1, 6]]]], "r": [[2.13773e-05, 2.13882e-05, 2.13881e-05], 0, 1.2435, 1668054682], "v": "v0.6"}
{"i": [["[\"roll\", 1, 14, 14, 512, -3, \"float16\"]", "cuda -keys=cuda,gpu -max_num_threads=1024 -model=unknown -thread_warp_size=32", [-1, 16, 64, 49152, 2147483647, 1024, 8, 32], "", 0, []], [[], [["FU", 1, [0, 1, 2, 3]], ["SP", 1, 0, 100352, [7], 1], ["AN", 1, 0, 5], ["AN", 1, 1, 6]]]], "r": [[1.36558e-05, 1.36673e-05, 1.36604e-05], 0, 1.62245, 1668054683], "v": "v0.6"}
{"i": [["[\"roll\", 1, 14, 14, 512, -3, \"float16\"]", "cuda -keys=cuda,gpu -max_num_threads=1024 -model=unknown -thread_warp_size=32", [-1, 16, 64, 49152, 2147483647, 1024, 8, 32], "", 0, []], [[], [["FU", 1, [0, 1, 2, 3]], ["SP", 1, 0, 100352, [32], 1], ["AN", 1, 0, 5], ["AN", 1, 1, 6]]]], "r": [[5.07382e-06, 5.08741e-06, 5.08884e-06], 0, 0.577007, 1668054681], "v": "v0.6"}
{"i": [["[\"roll\", 1, 14, 14, 512, -3, \"float16\"]", "cuda -keys=cuda,gpu -max_num_threads=1024 -model=unknown -thread_warp_size=32", [-1, 16, 64, 49152, 2147483647, 1024, 8, 32], "", 0, []], [[], [["FU", 1, [0, 1, 2, 3]], ["SP", 1, 0, 100352, [49], 1], ["AN", 1, 0, 5], ["AN", 1, 1, 6]]]], "r": [[3.99848e-06, 4.0132e-06, 4.01287e-06], 0, 1.96673, 1668054683], "v": "v0.6"}
{"i": [["[\"roll\", 1, 14, 14, 512, -3, \"float16\"]", "cuda -keys=cuda,gpu -max_num_threads=1024 -model=unknown -thread_warp_size=32", [-1, 16, 64, 49152, 2147483647, 1024, 8, 32], "", 0, []], [[], [["FU", 1, [0, 1, 2, 3]], ["SP", 1, 0, 100352, [1], 1], ["AN", 1, 0, 5], ["AN", 1, 1, 6]]]], "r": [[7.72159e-05, 7.72282e-05, 7.7229e-05], 0, 2.293, 1668054683], "v": "v0.6"}
{"i": [["[\"roll\", 1, 14, 14, 512, -3, \"float16\"]", "cuda -keys=cuda,gpu -max_num_threads=1024 -model=unknown -thread_warp_size=32", [-1, 16, 64, 49152, 2147483647, 1024, 8, 32], "", 0, []], [[], [["FU", 1, [0, 1, 2, 3]], ["SP", 1, 0, 100352, [16], 1], ["AN", 1, 0, 5], ["AN", 1, 1, 6]]]], "r": [[7.45434e-06, 7.47016e-06, 7.46377e-06], 0, 0.895844, 1668054682], "v": "v0.6"}
{"i": [["[\"roll\", 1, 14, 14, 512, -3, \"float16\"]", "cuda -keys=cuda,gpu -max_num_threads=1024 -model=unknown -thread_warp_size=32", [-1, 16, 64, 49152, 2147483647, 1024, 8, 32], "", 0, []], [[], [["FU", 1, [0, 1, 2, 3]], ["SP", 1, 0, 100352, [14], 1], ["AN", 1, 0, 5], ["AN", 1, 1, 6]]]], "r": [[7.9556e-06, 7.96641e-06, 7.96523e-06], 0, 2.68239, 1668054684], "v": "v0.6"}
{"i": [["[\"roll\", 1, 14, 14, 512, -3, \"float16\"]", "cuda -keys=cuda,gpu -max_num_threads=1024 -model=unknown -thread_warp_size=32", [-1, 16, 64, 49152, 2147483647, 1024, 8, 32], "", 0, []], [[], [["FU", 1, [0, 1, 2, 3]], ["SP", 1, 0, 100352, [64], 1], ["AN", 1, 0, 5], ["AN", 1, 1, 6]]]], "r": [[3.9097e-06, 3.91967e-06, 3.92044e-06], 0, 3.73309, 1668054685], "v": "v0.6"}
{"i": [["[\"roll\", 1, 14, 14, 512, -3, \"float16\"]", "cuda -keys=cuda,gpu -max_num_threads=1024 -model=unknown -thread_warp_size=32", [-1, 16, 64, 49152, 2147483647, 1024, 8, 32], "", 0, []], [[], [["FU", 1, [0, 1, 2, 3]], ["SP", 1, 0, 100352, [56], 1], ["AN", 1, 0, 5], ["AN", 1, 1, 6]]]], "r": [[3.88282e-06, 3.89456e-06, 3.89998e-06], 0, 3.35099, 1668054684], "v": "v0.6"}
{"i": [["[\"roll\", 1, 14, 14, 512, -3, \"float16\"]", "cuda -keys=cuda,gpu -max_num_threads=1024 -model=unknown -thread_warp_size=32", [-1, 16, 64, 49152, 2147483647, 1024, 8, 32], "", 0, []], [[], [["FU", 1, [0, 1, 2, 3]], ["SP", 1, 0, 100352, [2], 1], ["AN", 1, 0, 5], ["AN", 1, 1, 6]]]], "r": [[3.99983e-05, 3.9993e-05, 3.99919e-05], 0, 3.00832, 1668054684], "v": "v0.6"}
{"i": [["[\"roll\", 1, 14, 14, 512, -3, \"float16\"]", "cuda -keys=cuda,gpu -max_num_threads=1024 -model=unknown -thread_warp_size=32", [-1, 16, 64, 49152, 2147483647, 1024, 8, 32], "", 0, []], [[], [["FU", 1, [0, 1, 2, 3]], ["SP", 1, 0, 100352, [28], 1], ["AN", 1, 0, 5], ["AN", 1, 1, 6]]]], "r": [[5.37123e-06, 5.38605e-06, 5.39189e-06], 0, 4.40887, 1668054685], "v": "v0.6"}
{"i": [["[\"roll\", 1, 14, 14, 512, -3, \"float16\"]", "cuda -keys=cuda,gpu -max_num_threads=1024 -model=unknown -thread_warp_size=32", [-1, 16, 64, 49152, 2147483647, 1024, 8, 32], "", 0, []], [[], [["FU", 1, [0, 1, 2, 3]], ["SP", 1, 0, 100352, [8], 1], ["AN", 1, 0, 5], ["AN", 1, 1, 6]]]], "r": [[1.20678e-05, 1.20834e-05, 1.20846e-05], 0, 4.06655, 1668054685], "v": "v0.6"}
{"i": [["[\"roll\", 1, 14, 14, 512, -3, \"float16\"]", "cuda -keys=cuda,gpu -max_num_threads=1024 -model=unknown -thread_warp_size=32", [-1, 16, 64, 49152, 2147483647, 1024, 8, 32], "", 0, []], [[], [["FU", 1, [0, 1, 2, 3]], ["SP", 1, 0, 100352, [49], 1], ["AN", 1, 0, 5], ["AN", 1, 1, 6]]]], "r": [[4.1761e-06, 4.1843e-06, 4.18698e-06], 0, 1.95972, 1668055062], "v": "v0.6"}
{"i": [["[\"roll\", 1, 14, 14, 512, -3, \"float16\"]", "cuda -keys=cuda,gpu -max_num_threads=1024 -model=unknown -thread_warp_size=32", [-1, 16, 64, 49152, 2147483647, 1024, 8, 32], "", 0, []], [[], [["FU", 1, [0, 1, 2, 3]], ["SP", 1, 0, 100352, [4], 1], ["AN", 1, 0, 5], ["AN", 1, 1, 6]]]], "r": [[2.14169e-05, 2.14378e-05, 2.14332e-05], 0, 0.916816, 1668055061], "v": "v0.6"}
{"i": [["[\"roll\", 1, 14, 14, 512, -3, \"float16\"]", "cuda -keys=cuda,gpu -max_num_threads=1024 -model=unknown -thread_warp_size=32", [-1, 16, 64, 49152, 2147483647, 1024, 8, 32], "", 0, []], [[], [["FU", 1, [0, 1, 2, 3]], ["SP", 1, 0, 100352, [28], 1], ["AN", 1, 0, 5], ["AN", 1, 1, 6]]]], "r": [[5.32981e-06, 5.3441e-06, 5.33857e-06], 0, 1.25732, 1668055061], "v": "v0.6"}
{"i": [["[\"roll\", 1, 14, 14, 512, -3, \"float16\"]", "cuda -keys=cuda,gpu -max_num_threads=1024 -model=unknown -thread_warp_size=32", [-1, 16, 64, 49152, 2147483647, 1024, 8, 32], "", 0, []], [[], [["FU", 1, [0, 1, 2, 3]], ["SP", 1, 0, 100352, [64], 1], ["AN", 1, 0, 5], ["AN", 1, 1, 6]]]], "r": [[3.84209e-06, 3.85572e-06, 3.85703e-06], 0, 1.6337, 1668055061], "v": "v0.6"}
{"i": [["[\"roll\", 1, 14, 14, 512, -3, \"float16\"]", "cuda -keys=cuda,gpu -max_num_threads=1024 -model=unknown -thread_warp_size=32", [-1, 16, 64, 49152, 2147483647, 1024, 8, 32], "", 0, []], [[], [["FU", 1, [0, 1, 2, 3]], ["SP", 1, 0, 100352, [2], 1], ["AN", 1, 0, 5], ["AN", 1, 1, 6]]]], "r": [[4.00081e-05, 4.00306e-05, 4.00116e-05], 0, 0.586544, 1668055060], "v": "v0.6"}
{"i": [["[\"roll\", 1, 14, 14, 512, -3, \"float16\"]", "cuda -keys=cuda,gpu -max_num_threads=1024 -model=unknown -thread_warp_size=32", [-1, 16, 64, 49152, 2147483647, 1024, 8, 32], "", 0, []], [[], [["FU", 1, [0, 1, 2, 3]], ["SP", 1, 0, 100352, [56], 1], ["AN", 1, 0, 5], ["AN", 1, 1, 6]]]], "r": [[3.96673e-06, 3.97686e-06, 3.97235e-06], 0, 3.36556, 1668055063], "v": "v0.6"}
{"i": [["[\"roll\", 1, 14, 14, 512, -3, \"float16\"]", "cuda -keys=cuda,gpu -max_num_threads=1024 -model=unknown -thread_warp_size=32", [-1, 16, 64, 49152, 2147483647, 1024, 8, 32], "", 0, []], [[], [["FU", 1, [0, 1, 2, 3]], ["SP", 1, 0, 100352, [16], 1], ["AN", 1, 0, 5], ["AN", 1, 1, 6]]]], "r": [[7.25617e-06, 7.28532e-06, 7.28005e-06], 0, 2.68619, 1668055063], "v": "v0.6"}
{"i": [["[\"roll\", 1, 14, 14, 512, -3, \"float16\"]", "cuda -keys=cuda,gpu -max_num_threads=1024 -model=unknown -thread_warp_size=32", [-1, 16, 64, 49152, 2147483647, 1024, 8, 32], "", 0, []], [[], [["FU", 1, [0, 1, 2, 3]], ["SP", 1, 0, 100352, [32], 1], ["AN", 1, 0, 5], ["AN", 1, 1, 6]]]], "r": [[5.03323e-06, 5.04676e-06, 5.04554e-06], 0, 3.02007, 1668055063], "v": "v0.6"}
{"i": [["[\"roll\", 1, 14, 14, 512, -3, \"float16\"]", "cuda -keys=cuda,gpu -max_num_threads=1024 -model=unknown -thread_warp_size=32", [-1, 16, 64, 49152, 2147483647, 1024, 8, 32], "", 0, []], [[], [["FU", 1, [0, 1, 2, 3]], ["SP", 1, 0, 100352, [14], 1], ["AN", 1, 0, 5], ["AN", 1, 1, 6]]]], "r": [[8.14777e-06, 8.1512e-06, 8.15326e-06], 0, 2.29923, 1668055062], "v": "v0.6"}
{"i": [["[\"roll\", 1, 14, 14, 512, -3, \"float16\"]", "cuda -keys=cuda,gpu -max_num_threads=1024 -model=unknown -thread_warp_size=32", [-1, 16, 64, 49152, 2147483647, 1024, 8, 32], "", 0, []], [[], [["FU", 1, [0, 1, 2, 3]], ["SP", 1, 0, 100352, [1], 1], ["AN", 1, 0, 5], ["AN", 1, 1, 6]]]], "r": [[7.71151e-05, 7.71196e-05, 7.7124e-05], 0, 3.72945, 1668055064], "v": "v0.6"}
{"i": [["[\"roll\", 1, 14, 14, 512, -3, \"float16\"]", "cuda -keys=cuda,gpu -max_num_threads=1024 -model=unknown -thread_warp_size=32", [-1, 16, 64, 49152, 2147483647, 1024, 8, 32], "", 0, []], [[], [["FU", 1, [0, 1, 2, 3]], ["SP", 1, 0, 100352, [7], 1], ["AN", 1, 0, 5], ["AN", 1, 1, 6]]]], "r": [[1.34245e-05, 1.34366e-05, 1.3436e-05], 0, 4.0723, 1668055064], "v": "v0.6"}
{"i": [["[\"roll\", 1, 14, 14, 512, -3, \"float16\"]", "cuda -keys=cuda,gpu -max_num_threads=1024 -model=unknown -thread_warp_size=32", [-1, 16, 64, 49152, 2147483647, 1024, 8, 32], "", 0, []], [[], [["FU", 1, [0, 1, 2, 3]], ["SP", 1, 0, 100352, [8], 1], ["AN", 1, 0, 5], ["AN", 1, 1, 6]]]], "r": [[1.208e-05, 1.20933e-05, 1.20896e-05], 0, 4.41806, 1668055064], "v": "v0.6"}
{"i": [["[\"roll\", 1, 14, 14, 512, -3, \"float16\"]", "cuda -keys=cuda,gpu -max_num_threads=1024 -model=unknown -thread_warp_size=32", [-1, 16, 64, 49152, 2147483647, 1024, 8, 32], "", 0, []], [[], [["FU", 1, [0, 1, 2, 3]], ["SP", 1, 0, 100352, [32], 1], ["AN", 1, 0, 5], ["AN", 1, 1, 6]]]], "r": [[4.94558e-06, 4.96015e-06, 4.9591e-06], 0, 0.577352, 1668055343], "v": "v0.6"}
{"i": [["[\"roll\", 1, 14, 14, 512, -3, \"float16\"]", "cuda -keys=cuda,gpu -max_num_threads=1024 -model=unknown -thread_warp_size=32", [-1, 16, 64, 49152, 2147483647, 1024, 8, 32], "", 0, []], [[], [["FU", 1, [0, 1, 2, 3]], ["SP", 1, 0, 100352, [4], 1], ["AN", 1, 0, 5], ["AN", 1, 1, 6]]]], "r": [[2.14311e-05, 2.14209e-05, 2.14189e-05], 0, 1.27824, 1668055344], "v": "v0.6"}
{"i": [["[\"roll\", 1, 14, 14, 512, -3, \"float16\"]", "cuda -keys=cuda,gpu -max_num_threads=1024 -model=unknown -thread_warp_size=32", [-1, 16, 64, 49152, 2147483647, 1024, 8, 32], "", 0, []], [[], [["FU", 1, [0, 1, 2, 3]], ["SP", 1, 0, 100352, [14], 1], ["AN", 1, 0, 5], ["AN", 1, 1, 6]]]], "r": [[7.98119e-06, 7.99415e-06, 7.99346e-06], 0, 1.67356, 1668055344], "v": "v0.6"}
{"i": [["[\"roll\", 1, 14, 14, 512, -3, \"float16\"]", "cuda -keys=cuda,gpu -max_num_threads=1024 -model=unknown -thread_warp_size=32", [-1, 16, 64, 49152, 2147483647, 1024, 8, 32], "", 0, []], [[], [["FU", 1, [0, 1, 2, 3]], ["SP", 1, 0, 100352, [1], 1], ["AN", 1, 0, 5], ["AN", 1, 1, 6]]]], "r": [[7.71312e-05, 7.71548e-05, 7.71412e-05], 0, 0.927791, 1668055343], "v": "v0.6"}
{"i": [["[\"roll\", 1, 14, 14, 512, -3, \"float16\"]", "cuda -keys=cuda,gpu -max_num_threads=1024 -model=unknown -thread_warp_size=32", [-1, 16, 64, 49152, 2147483647, 1024, 8, 32], "", 0, []], [[], [["FU", 1, [0, 1, 2, 3]], ["SP", 1, 0, 100352, [28], 1], ["AN", 1, 0, 5], ["AN", 1, 1, 6]]]], "r": [[5.28183e-06, 5.29337e-06, 5.29729e-06], 0, 1.98331, 1668055345], "v": "v0.6"}
{"i": [["[\"roll\", 1, 14, 14, 512, -3, \"float16\"]", "cuda -keys=cuda,gpu -max_num_threads=1024 -model=unknown -thread_warp_size=32", [-1, 16, 64, 49152, 2147483647, 1024, 8, 32], "", 0, []], [[], [["FU", 1, [0, 1, 2, 3]], ["SP", 1, 0, 100352, [2], 1], ["AN", 1, 0, 5], ["AN", 1, 1, 6]]]], "r": [[4.00257e-05, 4.00287e-05, 4.00529e-05], 0, 2.32949, 1668055345], "v": "v0.6"}
{"i": [["[\"roll\", 1, 14, 14, 512, -3, \"float16\"]", "cuda -keys=cuda,gpu -max_num_threads=1024 -model=unknown -thread_warp_size=32", [-1, 16, 64, 49152, 2147483647, 1024, 8, 32], "", 0, []], [[], [["FU", 1, [0, 1, 2, 3]], ["SP", 1, 0, 100352, [8], 1], ["AN", 1, 0, 5], ["AN", 1, 1, 6]]]], "r": [[1.20838e-05, 1.21005e-05, 1.20979e-05], 0, 2.71778, 1668055345], "v": "v0.6"}
{"i": [["[\"roll\", 1, 14, 14, 512, -3, \"float16\"]", "cuda -keys=cuda,gpu -max_num_threads=1024 -model=unknown -thread_warp_size=32", [-1, 16, 64, 49152, 2147483647, 1024, 8, 32], "", 0, []], [[], [["FU", 1, [0, 1, 2, 3]], ["SP", 1, 0, 100352, [64], 1], ["AN", 1, 0, 5], ["AN", 1, 1, 6]]]], "r": [[3.65508e-06, 3.66442e-06, 3.66612e-06], 0, 3.74864, 1668055346], "v": "v0.6"}
{"i": [["[\"roll\", 1, 14, 14, 512, -3, \"float16\"]", "cuda -keys=cuda,gpu -max_num_threads=1024 -model=unknown -thread_warp_size=32", [-1, 16, 64, 49152, 2147483647, 1024, 8, 32], "", 0, []], [[], [["FU", 1, [0, 1, 2, 3]], ["SP", 1, 0, 100352, [56], 1], ["AN", 1, 0, 5], ["AN", 1, 1, 6]]]], "r": [[3.90836e-06, 3.92744e-06, 3.92535e-06], 0, 3.03348, 1668055346], "v": "v0.6"}
{"i": [["[\"roll\", 1, 14, 14, 512, -3, \"float16\"]", "cuda -keys=cuda,gpu -max_num_threads=1024 -model=unknown -thread_warp_size=32", [-1, 16, 64, 49152, 2147483647, 1024, 8, 32], "", 0, []], [[], [["FU", 1, [0, 1, 2, 3]], ["SP", 1, 0, 100352, [7], 1], ["AN", 1, 0, 5], ["AN", 1, 1, 6]]]], "r": [[1.35894e-05, 1.36135e-05, 1.35975e-05], 0, 3.38001, 1668055346], "v": "v0.6"}
{"i": [["[\"roll\", 1, 14, 14, 512, -3, \"float16\"]", "cuda -keys=cuda,gpu -max_num_threads=1024 -model=unknown -thread_warp_size=32", [-1, 16, 64, 49152, 2147483647, 1024, 8, 32], "", 0, []], [[], [["FU", 1, [0, 1, 2, 3]], ["SP", 1, 0, 100352, [16], 1], ["AN", 1, 0, 5], ["AN", 1, 1, 6]]]], "r": [[7.25416e-06, 7.27333e-06, 7.27151e-06], 0, 4.08456, 1668055347], "v": "v0.6"}
{"i": [["[\"roll\", 1, 14, 14, 512, -3, \"float16\"]", "cuda -keys=cuda,gpu -max_num_threads=1024 -model=unknown -thread_warp_size=32", [-1, 16, 64, 49152, 2147483647, 1024, 8, 32], "", 0, []], [[], [["FU", 1, [0, 1, 2, 3]], ["SP", 1, 0, 100352, [49], 1], ["AN", 1, 0, 5], ["AN", 1, 1, 6]]]], "r": [[3.9673e-06, 3.98196e-06, 3.97872e-06], 0, 4.42078, 1668055347], "v": "v0.6"}
{"i": [["[\"roll\", 1, 14, 14, 512, -3, \"float16\"]", "cuda -keys=cuda,gpu -max_num_threads=1024 -model=unknown -thread_warp_size=32", [-1, 16, 64, 49152, 2147483647, 1024, 8, 32], "", 0, []], [[], [["FU", 1, [0, 1, 2, 3]], ["SP", 1, 0, 100352, [14], 1], ["AN", 1, 0, 5], ["AN", 1, 1, 6]]]], "r": [[8.16038e-06, 8.17978e-06, 8.17344e-06], 0, 0.579451, 1668055626], "v": "v0.6"}
{"i": [["[\"roll\", 1, 14, 14, 512, -3, \"float16\"]", "cuda -keys=cuda,gpu -max_num_threads=1024 -model=unknown -thread_warp_size=32", [-1, 16, 64, 49152, 2147483647, 1024, 8, 32], "", 0, []], [[], [["FU", 1, [0, 1, 2, 3]], ["SP", 1, 0, 100352, [1], 1], ["AN", 1, 0, 5], ["AN", 1, 1, 6]]]], "r": [[7.71983e-05, 7.71895e-05, 7.71951e-05], 0, 1.28458, 1668055627], "v": "v0.6"}
{"i": [["[\"roll\", 1, 14, 14, 512, -3, \"float16\"]", "cuda -keys=cuda,gpu -max_num_threads=1024 -model=unknown -thread_warp_size=32", [-1, 16, 64, 49152, 2147483647, 1024, 8, 32], "", 0, []], [[], [["FU", 1, [0, 1, 2, 3]], ["SP", 1, 0, 100352, [64], 1], ["AN", 1, 0, 5], ["AN", 1, 1, 6]]]], "r": [[3.85351e-06, 3.85365e-06, 3.86705e-06], 0, 2.36207, 1668055628], "v": "v0.6"}
{"i": [["[\"roll\", 1, 14, 14, 512, -3, \"float16\"]", "cuda -keys=cuda,gpu -max_num_threads=1024 -model=unknown -thread_warp_size=32", [-1, 16, 64, 49152, 2147483647, 1024, 8, 32], "", 0, []], [[], [["FU", 1, [0, 1, 2, 3]], ["SP", 1, 0, 100352, [7], 1], ["AN", 1, 0, 5], ["AN", 1, 1, 6]]]], "r": [[1.34623e-05, 1.34719e-05, 1.34729e-05], 0, 0.913757, 1668055627], "v": "v0.6"}
{"i": [["[\"roll\", 1, 14, 14, 512, -3, \"float16\"]", "cuda -keys=cuda,gpu -max_num_threads=1024 -model=unknown -thread_warp_size=32", [-1, 16, 64, 49152, 2147483647, 1024, 8, 32], "", 0, []], [[], [["FU", 1, [0, 1, 2, 3]], ["SP", 1, 0, 100352, [4], 1], ["AN", 1, 0, 5], ["AN", 1, 1, 6]]]], "r": [[2.14367e-05, 2.14419e-05, 2.14419e-05], 0, 1.63248, 1668055627], "v": "v0.6"}
{"i": [["[\"roll\", 1, 14, 14, 512, -3, \"float16\"]", "cuda -keys=cuda,gpu -max_num_threads=1024 -model=unknown -thread_warp_size=32", [-1, 16, 64, 49152, 2147483647, 1024, 8, 32], "", 0, []], [[], [["FU", 1, [0, 1, 2, 3]], ["SP", 1, 0, 100352, [2], 1], ["AN", 1, 0, 5], ["AN", 1, 1, 6]]]], "r": [[4.00723e-05, 4.00882e-05, 4.00789e-05], 0, 1.9863, 1668055628], "v": "v0.6"}
{"i": [["[\"roll\", 1, 14, 14, 512, -3, \"float16\"]", "cuda -keys=cuda,gpu -max_num_threads=1024 -model=unknown -thread_warp_size=32", [-1, 16, 64, 49152, 2147483647, 1024, 8, 32], "", 0, []], [[], [["FU", 1, [0, 1, 2, 3]], ["SP", 1, 0, 100352, [49], 1], ["AN", 1, 0, 5], ["AN", 1, 1, 6]]]], "r": [[4.17815e-06, 4.19066e-06, 4.19171e-06], 0, 2.70232, 1668055628], "v": "v0.6"}
{"i": [["[\"roll\", 1, 14, 14, 512, -3, \"float16\"]", "cuda -keys=cuda,gpu -max_num_threads=1024 -model=unknown -thread_warp_size=32", [-1, 16, 64, 49152, 2147483647, 1024, 8, 32], "", 0, []], [[], [["FU", 1, [0, 1, 2, 3]], ["SP", 1, 0, 100352, [28], 1], ["AN", 1, 0, 5], ["AN", 1, 1, 6]]]], "r": [[5.27005e-06, 5.2864e-06, 5.27945e-06], 0, 3.02193, 1668055629], "v": "v0.6"}
{"i": [["[\"roll\", 1, 14, 14, 512, -3, \"float16\"]", "cuda -keys=cuda,gpu -max_num_threads=1024 -model=unknown -thread_warp_size=32", [-1, 16, 64, 49152, 2147483647, 1024, 8, 32], "", 0, []], [[], [["FU", 1, [0, 1, 2, 3]], ["SP", 1, 0, 100352, [16], 1], ["AN", 1, 0, 5], ["AN", 1, 1, 6]]]], "r": [[7.25515e-06, 7.25943e-06, 7.26335e-06], 0, 3.39178, 1668055629], "v": "v0.6"}
{"i": [["[\"roll\", 1, 14, 14, 512, -3, \"float16\"]", "cuda -keys=cuda,gpu -max_num_threads=1024 -model=unknown -thread_warp_size=32", [-1, 16, 64, 49152, 2147483647, 1024, 8, 32], "", 0, []], [[], [["FU", 1, [0, 1, 2, 3]], ["SP", 1, 0, 100352, [56], 1], ["AN", 1, 0, 5], ["AN", 1, 1, 6]]]], "r": [[3.92611e-06, 3.94119e-06, 3.94079e-06], 0, 4.07677, 1668055630], "v": "v0.6"}
{"i": [["[\"roll\", 1, 14, 14, 512, -3, \"float16\"]", "cuda -keys=cuda,gpu -max_num_threads=1024 -model=unknown -thread_warp_size=32", [-1, 16, 64, 49152, 2147483647, 1024, 8, 32], "", 0, []], [[], [["FU", 1, [0, 1, 2, 3]], ["SP", 1, 0, 100352, [32], 1], ["AN", 1, 0, 5], ["AN", 1, 1, 6]]]], "r": [[4.91896e-06, 4.93258e-06, 4.92922e-06], 0, 4.45288, 1668055630], "v": "v0.6"}
{"i": [["[\"roll\", 1, 14, 14, 512, -3, \"float16\"]", "cuda -keys=cuda,gpu -max_num_threads=1024 -model=unknown -thread_warp_size=32", [-1, 16, 64, 49152, 2147483647, 1024, 8, 32], "", 0, []], [[], [["FU", 1, [0, 1, 2, 3]], ["SP", 1, 0, 100352, [8], 1], ["AN", 1, 0, 5], ["AN", 1, 1, 6]]]], "r": [[1.20206e-05, 1.20335e-05, 1.2034e-05], 0, 3.72255, 1668055629], "v": "v0.6"}
{"i": [["[\"roll\", 1, 14, 14, 512, -3, \"float16\"]", "cuda -keys=cuda,gpu -max_num_threads=1024 -model=unknown -thread_warp_size=32", [-1, 16, 64, 49152, 2147483647, 1024, 8, 32], "", 0, []], [[], [["FU", 1, [0, 1, 2, 3]], ["SP", 1, 0, 100352, [1], 1], ["AN", 1, 0, 5], ["AN", 1, 1, 6]]]], "r": [[7.71302e-05, 7.71438e-05, 7.71562e-05], 0, 2.34154, 1668055912], "v": "v0.6"}
{"i": [["[\"roll\", 1, 14, 14, 512, -3, \"float16\"]", "cuda -keys=cuda,gpu -max_num_threads=1024 -model=unknown -thread_warp_size=32", [-1, 16, 64, 49152, 2147483647, 1024, 8, 32], "", 0, []], [[], [["FU", 1, [0, 1, 2, 3]], ["SP", 1, 0, 100352, [14], 1], ["AN", 1, 0, 5], ["AN", 1, 1, 6]]]], "r": [[8.16479e-06, 8.18577e-06, 8.18593e-06], 0, 0.611896, 1668055911], "v": "v0.6"}
{"i": [["[\"roll\", 1, 14, 14, 512, -3, \"float16\"]", "cuda -keys=cuda,gpu -max_num_threads=1024 -model=unknown -thread_warp_size=32", [-1, 16, 64, 49152, 2147483647, 1024, 8, 32], "", 0, []], [[], [["FU", 1, [0, 1, 2, 3]], ["SP", 1, 0, 100352, [16], 1], ["AN", 1, 0, 5], ["AN", 1, 1, 6]]]], "r": [[7.37596e-06, 7.39146e-06, 7.38996e-06], 0, 2.01106, 1668055912], "v": "v0.6"}
{"i": [["[\"roll\", 1, 14, 14, 512, -3, \"float16\"]", "cuda -keys=cuda,gpu -max_num_threads=1024 -model=unknown -thread_warp_size=32", [-1, 16, 64, 49152, 2147483647, 1024, 8, 32], "", 0, []], [[], [["FU", 1, [0, 1, 2, 3]], ["SP", 1, 0, 100352, [4], 1], ["AN", 1, 0, 5], ["AN", 1, 1, 6]]]], "r": [[2.15157e-05, 2.15298e-05, 2.15371e-05], 0, 1.27818, 1668055911], "v": "v0.6"}
{"i": [["[\"roll\", 1, 14, 14, 512, -3, \"float16\"]", "cuda -keys=cuda,gpu -max_num_threads=1024 -model=unknown -thread_warp_size=32", [-1, 16, 64, 49152, 2147483647, 1024, 8, 32], "", 0, []], [[], [["FU", 1, [0, 1, 2, 3]], ["SP", 1, 0, 100352, [49], 1], ["AN", 1, 0, 5], ["AN", 1, 1, 6]]]], "r": [[3.99913e-06, 4.01089e-06, 4.01075e-06], 0, 0.932912, 1668055911], "v": "v0.6"}
{"i": [["[\"roll\", 1, 14, 14, 512, -3, \"float16\"]", "cuda -keys=cuda,gpu -max_num_threads=1024 -model=unknown -thread_warp_size=32", [-1, 16, 64, 49152, 2147483647, 1024, 8, 32], "", 0, []], [[], [["FU", 1, [0, 1, 2, 3]], ["SP", 1, 0, 100352, [8], 1], ["AN", 1, 0, 5], ["AN", 1, 1, 6]]]], "r": [[1.20764e-05, 1.20926e-05, 1.20916e-05], 0, 1.6696, 1668055912], "v": "v0.6"}
{"i": [["[\"roll\", 1, 14, 14, 512, -3, \"float16\"]", "cuda -keys=cuda,gpu -max_num_threads=1024 -model=unknown -thread_warp_size=32", [-1, 16, 64, 49152, 2147483647, 1024, 8, 32], "", 0, []], [[], [["FU", 1, [0, 1, 2, 3]], ["SP", 1, 0, 100352, [32], 1], ["AN", 1, 0, 5], ["AN", 1, 1, 6]]]], "r": [[4.98603e-06, 4.99066e-06, 4.99304e-06], 0, 2.70886, 1668055913], "v": "v0.6"}
{"i": [["[\"roll\", 1, 14, 14, 512, -3, \"float16\"]", "cuda -keys=cuda,gpu -max_num_threads=1024 -model=unknown -thread_warp_size=32", [-1, 16, 64, 49152, 2147483647, 1024, 8, 32], "", 0, []], [[], [["FU", 1, [0, 1, 2, 3]], ["SP", 1, 0, 100352, [28], 1], ["AN", 1, 0, 5], ["AN", 1, 1, 6]]]], "r": [[5.24678e-06, 5.25603e-06, 5.25853e-06], 0, 3.74583, 1668055914], "v": "v0.6"}
{"i": [["[\"roll\", 1, 14, 14, 512, -3, \"float16\"]", "cuda -keys=cuda,gpu -max_num_threads=1024 -model=unknown -thread_warp_size=32", [-1, 16, 64, 49152, 2147483647, 1024, 8, 32], "", 0, []], [[], [["FU", 1, [0, 1, 2, 3]], ["SP", 1, 0, 100352, [56], 1], ["AN", 1, 0, 5], ["AN", 1, 1, 6]]]], "r": [[3.89583e-06, 3.90748e-06, 3.90517e-06], 0, 3.37373, 1668055914], "v": "v0.6"}
{"i": [["[\"roll\", 1, 14, 14, 512, -3, \"float16\"]", "cuda -keys=cuda,gpu -max_num_threads=1024 -model=unknown -thread_warp_size=32", [-1, 16, 64, 49152, 2147483647, 1024, 8, 32], "", 0, []], [[], [["FU", 1, [0, 1, 2, 3]], ["SP", 1, 0, 100352, [2], 1], ["AN", 1, 0, 5], ["AN", 1, 1, 6]]]], "r": [[4.0097e-05, 4.01216e-05, 4.01229e-05], 0, 3.03039, 1668055913], "v": "v0.6"}
{"i": [["[\"roll\", 1, 14, 14, 512, -3, \"float16\"]", "cuda -keys=cuda,gpu -max_num_threads=1024 -model=unknown -thread_warp_size=32", [-1, 16, 64, 49152, 2147483647, 1024, 8, 32], "", 0, []], [[], [["FU", 1, [0, 1, 2, 3]], ["SP", 1, 0, 100352, [7], 1], ["AN", 1, 0, 5], ["AN", 1, 1, 6]]]], "r": [[1.35565e-05, 1.358e-05, 1.35789e-05], 0, 4.0878, 1668055914], "v": "v0.6"}
{"i": [["[\"roll\", 1, 14, 14, 512, -3, \"float16\"]", "cuda -keys=cuda,gpu -max_num_threads=1024 -model=unknown -thread_warp_size=32", [-1, 16, 64, 49152, 2147483647, 1024, 8, 32], "", 0, []], [[], [["FU", 1, [0, 1, 2, 3]], ["SP", 1, 0, 100352, [64], 1], ["AN", 1, 0, 5], ["AN", 1, 1, 6]]]], "r": [[3.84085e-06, 3.84538e-06, 3.84319e-06], 0, 4.42469, 1668055915], "v": "v0.6"}
{"i": [["[\"roll\", 1, 14, 14, 512, -3, \"float16\"]", "cuda -keys=cuda,gpu -max_num_threads=1024 -model=unknown -thread_warp_size=32", [-1, 16, 64, 49152, 2147483647, 1024, 8, 32], "", 0, []], [[], [["FU", 1, [0, 1, 2, 3]], ["SP", 1, 0, 100352, [2], 1], ["AN", 1, 0, 5], ["AN", 1, 1, 6]]]], "r": [[4.00715e-05, 4.00696e-05, 4.00508e-05], 0, 0.586659, 1668056194], "v": "v0.6"}
{"i": [["[\"roll\", 1, 14, 14, 512, -3, \"float16\"]", "cuda -keys=cuda,gpu -max_num_threads=1024 -model=unknown -thread_warp_size=32", [-1, 16, 64, 49152, 2147483647, 1024, 8, 32], "", 0, []], [[], [["FU", 1, [0, 1, 2, 3]], ["SP", 1, 0, 100352, [56], 1], ["AN", 1, 0, 5], ["AN", 1, 1, 6]]]], "r": [[3.92864e-06, 3.94228e-06, 3.94266e-06], 0, 2.32147, 1668056196], "v": "v0.6"}
{"i": [["[\"roll\", 1, 14, 14, 512, -3, \"float16\"]", "cuda -keys=cuda,gpu -max_num_threads=1024 -model=unknown -thread_warp_size=32", [-1, 16, 64, 49152, 2147483647, 1024, 8, 32], "", 0, []], [[], [["FU", 1, [0, 1, 2, 3]], ["SP", 1, 0, 100352, [28], 1], ["AN", 1, 0, 5], ["AN", 1, 1, 6]]]], "r": [[5.31092e-06, 5.3143e-06, 5.31636e-06], 0, 2.01443, 1668056196], "v": "v0.6"}
{"i": [["[\"roll\", 1, 14, 14, 512, -3, \"float16\"]", "cuda -keys=cuda,gpu -max_num_threads=1024 -model=unknown -thread_warp_size=32", [-1, 16, 64, 49152, 2147483647, 1024, 8, 32], "", 0, []], [[], [["FU", 1, [0, 1, 2, 3]], ["SP", 1, 0, 100352, [7], 1], ["AN", 1, 0, 5], ["AN", 1, 1, 6]]]], "r": [[1.35902e-05, 1.36023e-05, 1.35983e-05], 0, 0.961748, 1668056195], "v": "v0.6"}
{"i": [["[\"roll\", 1, 14, 14, 512, -3, \"float16\"]", "cuda -keys=cuda,gpu -max_num_threads=1024 -model=unknown -thread_warp_size=32", [-1, 16, 64, 49152, 2147483647, 1024, 8, 32], "", 0, []], [[], [["FU", 1, [0, 1, 2, 3]], ["SP", 1, 0, 100352, [8], 1], ["AN", 1, 0, 5], ["AN", 1, 1, 6]]]], "r": [[1.21744e-05, 1.22026e-05, 1.2189e-05], 0, 1.28584, 1668056195], "v": "v0.6"}
{"i": [["[\"roll\", 1, 14, 14, 512, -3, \"float16\"]", "cuda -keys=cuda,gpu -max_num_threads=1024 -model=unknown -thread_warp_size=32", [-1, 16, 64, 49152, 2147483647, 1024, 8, 32], "", 0, []], [[], [["FU", 1, [0, 1, 2, 3]], ["SP", 1, 0, 100352, [4], 1], ["AN", 1, 0, 5], ["AN", 1, 1, 6]]]], "r": [[2.13671e-05, 2.13791e-05, 2.13747e-05], 0, 1.62761, 1668056195], "v": "v0.6"}
{"i": [["[\"roll\", 1, 14, 14, 512, -3, \"float16\"]", "cuda -keys=cuda,gpu -max_num_threads=1024 -model=unknown -thread_warp_size=32", [-1, 16, 64, 49152, 2147483647, 1024, 8, 32], "", 0, []], [[], [["FU", 1, [0, 1, 2, 3]], ["SP", 1, 0, 100352, [49], 1], ["AN", 1, 0, 5], ["AN", 1, 1, 6]]]], "r": [[3.99757e-06, 4.01225e-06, 4.01432e-06], 0, 3.35698, 1668056197], "v": "v0.6"}
{"i": [["[\"roll\", 1, 14, 14, 512, -3, \"float16\"]", "cuda -keys=cuda,gpu -max_num_threads=1024 -model=unknown -thread_warp_size=32", [-1, 16, 64, 49152, 2147483647, 1024, 8, 32], "", 0, []], [[], [["FU", 1, [0, 1, 2, 3]], ["SP", 1, 0, 100352, [64], 1], ["AN", 1, 0, 5], ["AN", 1, 1, 6]]]], "r": [[3.65612e-06, 3.66426e-06, 3.66457e-06], 0, 2.64702, 1668056196], "v": "v0.6"}
{"i": [["[\"roll\", 1, 14, 14, 512, -3, \"float16\"]", "cuda -keys=cuda,gpu -max_num_threads=1024 -model=unknown -thread_warp_size=32", [-1, 16, 64, 49152, 2147483647, 1024, 8, 32], "", 0, []], [[], [["FU", 1, [0, 1, 2, 3]], ["SP", 1, 0, 100352, [32], 1], ["AN", 1, 0, 5], ["AN", 1, 1, 6]]]], "r": [[5.00364e-06, 5.02109e-06, 5.01939e-06], 0, 3.03405, 1668056197], "v": "v0.6"}
{"i": [["[\"roll\", 1, 14, 14, 512, -3, \"float16\"]", "cuda -keys=cuda,gpu -max_num_threads=1024 -model=unknown -thread_warp_size=32", [-1, 16, 64, 49152, 2147483647, 1024, 8, 32], "", 0, []], [[], [["FU", 1, [0, 1, 2, 3]], ["SP", 1, 0, 100352, [16], 1], ["AN", 1, 0, 5], ["AN", 1, 1, 6]]]], "r": [[7.26455e-06, 7.28001e-06, 7.27783e-06], 0, 3.70038, 1668056197], "v": "v0.6"}
{"i": [["[\"roll\", 1, 14, 14, 512, -3, \"float16\"]", "cuda -keys=cuda,gpu -max_num_threads=1024 -model=unknown -thread_warp_size=32", [-1, 16, 64, 49152, 2147483647, 1024, 8, 32], "", 0, []], [[], [["FU", 1, [0, 1, 2, 3]], ["SP", 1, 0, 100352, [1], 1], ["AN", 1, 0, 5], ["AN", 1, 1, 6]]]], "r": [[7.72045e-05, 7.72116e-05, 7.72147e-05], 0, 4.43706, 1668056198], "v": "v0.6"}
{"i": [["[\"roll\", 1, 14, 14, 512, -3, \"float16\"]", "cuda -keys=cuda,gpu -max_num_threads=1024 -model=unknown -thread_warp_size=32", [-1, 16, 64, 49152, 2147483647, 1024, 8, 32], "", 0, []], [[], [["FU", 1, [0, 1, 2, 3]], ["SP", 1, 0, 100352, [14], 1], ["AN", 1, 0, 5], ["AN", 1, 1, 6]]]], "r": [[8.02064e-06, 8.03467e-06, 8.04342e-06], 0, 4.08097, 1668056198], "v": "v0.6"}
{"i": [["[\"roll\", 1, 14, 14, 512, -3, \"float16\"]", "cuda -keys=cuda,gpu -max_num_threads=1024 -model=unknown -thread_warp_size=32", [-1, 16, 64, 49152, 2147483647, 1024, 8, 32], "", 0, []], [[], [["FU", 1, [0, 1, 2, 3]], ["SP", 1, 0, 100352, [8], 1], ["AN", 1, 0, 5], ["AN", 1, 1, 6]]]], "r": [[1.20766e-05, 1.20854e-05, 1.20824e-05], 0, 0.937838, 1668056478], "v": "v0.6"}
{"i": [["[\"roll\", 1, 14, 14, 512, -3, \"float16\"]", "cuda -keys=cuda,gpu -max_num_threads=1024 -model=unknown -thread_warp_size=32", [-1, 16, 64, 49152, 2147483647, 1024, 8, 32], "", 0, []], [[], [["FU", 1, [0, 1, 2, 3]], ["SP", 1, 0, 100352, [16], 1], ["AN", 1, 0, 5], ["AN", 1, 1, 6]]]], "r": [[7.29314e-06, 7.30264e-06, 7.3043e-06], 0, 1.65196, 1668056479], "v": "v0.6"}
{"i": [["[\"roll\", 1, 14, 14, 512, -3, \"float16\"]", "cuda -keys=cuda,gpu -max_num_threads=1024 -model=unknown -thread_warp_size=32", [-1, 16, 64, 49152, 2147483647, 1024, 8, 32], "", 0, []], [[], [["FU", 1, [0, 1, 2, 3]], ["SP", 1, 0, 100352, [32], 1], ["AN", 1, 0, 5], ["AN", 1, 1, 6]]]], "r": [[4.97681e-06, 4.99082e-06, 4.98609e-06], 0, 1.27294, 1668056479], "v": "v0.6"}
{"i": [["[\"roll\", 1, 14, 14, 512, -3, \"float16\"]", "cuda -keys=cuda,gpu -max_num_threads=1024 -model=unknown -thread_warp_size=32", [-1, 16, 64, 49152, 2147483647, 1024, 8, 32], "", 0, []], [[], [["FU", 1, [0, 1, 2, 3]], ["SP", 1, 0, 100352, [7], 1], ["AN", 1, 0, 5], ["AN", 1, 1, 6]]]], "r": [[1.3471e-05, 1.34809e-05, 1.34805e-05], 0, 3.01093, 1668056481], "v": "v0.6"}
{"i": [["[\"roll\", 1, 14, 14, 512, -3, \"float16\"]", "cuda -keys=cuda,gpu -max_num_threads=1024 -model=unknown -thread_warp_size=32", [-1, 16, 64, 49152, 2147483647, 1024, 8, 32], "", 0, []], [[], [["FU", 1, [0, 1, 2, 3]], ["SP", 1, 0, 100352, [2], 1], ["AN", 1, 0, 5], ["AN", 1, 1, 6]]]], "r": [[3.99321e-05, 3.99496e-05, 3.99479e-05], 0, 0.590497, 1668056478], "v": "v0.6"}
{"i": [["[\"roll\", 1, 14, 14, 512, -3, \"float16\"]", "cuda -keys=cuda,gpu -max_num_threads=1024 -model=unknown -thread_warp_size=32", [-1, 16, 64, 49152, 2147483647, 1024, 8, 32], "", 0, []], [[], [["FU", 1, [0, 1, 2, 3]], ["SP", 1, 0, 100352, [1], 1], ["AN", 1, 0, 5], ["AN", 1, 1, 6]]]], "r": [[7.72012e-05, 7.72006e-05, 7.71826e-05], 0, 1.96506, 1668056480], "v": "v0.6"}
{"i": [["[\"roll\", 1, 14, 14, 512, -3, \"float16\"]", "cuda -keys=cuda,gpu -max_num_threads=1024 -model=unknown -thread_warp_size=32", [-1, 16, 64, 49152, 2147483647, 1024, 8, 32], "", 0, []], [[], [["FU", 1, [0, 1, 2, 3]], ["SP", 1, 0, 100352, [14], 1], ["AN", 1, 0, 5], ["AN", 1, 1, 6]]]], "r": [[7.97057e-06, 7.9844e-06, 7.98108e-06], 0, 2.31721, 1668056480], "v": "v0.6"}
{"i": [["[\"roll\", 1, 14, 14, 512, -3, \"float16\"]", "cuda -keys=cuda,gpu -max_num_threads=1024 -model=unknown -thread_warp_size=32", [-1, 16, 64, 49152, 2147483647, 1024, 8, 32], "", 0, []], [[], [["FU", 1, [0, 1, 2, 3]], ["SP", 1, 0, 100352, [56], 1], ["AN", 1, 0, 5], ["AN", 1, 1, 6]]]], "r": [[4.01986e-06, 4.0297e-06, 4.03563e-06], 0, 2.69249, 1668056480], "v": "v0.6"}
{"i": [["[\"roll\", 1, 14, 14, 512, -3, \"float16\"]", "cuda -keys=cuda,gpu -max_num_threads=1024 -model=unknown -thread_warp_size=32", [-1, 16, 64, 49152, 2147483647, 1024, 8, 32], "", 0, []], [[], [["FU", 1, [0, 1, 2, 3]], ["SP", 1, 0, 100352, [4], 1], ["AN", 1, 0, 5], ["AN", 1, 1, 6]]]], "r": [[2.14914e-05, 2.15098e-05, 2.15174e-05], 0, 4.09004, 1668056482], "v": "v0.6"}
{"i": [["[\"roll\", 1, 14, 14, 512, -3, \"float16\"]", "cuda -keys=cuda,gpu -max_num_threads=1024 -model=unknown -thread_warp_size=32", [-1, 16, 64, 49152, 2147483647, 1024, 8, 32], "", 0, []], [[], [["FU", 1, [0, 1, 2, 3]], ["SP", 1, 0, 100352, [64], 1], ["AN", 1, 0, 5], ["AN", 1, 1, 6]]]], "r": [[3.919e-06, 3.92931e-06, 3.93067e-06], 0, 4.43429, 1668056482], "v": "v0.6"}
{"i": [["[\"roll\", 1, 14, 14, 512, -3, \"float16\"]", "cuda -keys=cuda,gpu -max_num_threads=1024 -model=unknown -thread_warp_size=32", [-1, 16, 64, 49152, 2147483647, 1024, 8, 32], "", 0, []], [[], [["FU", 1, [0, 1, 2, 3]], ["SP", 1, 0, 100352, [28], 1], ["AN", 1, 0, 5], ["AN", 1, 1, 6]]]], "r": [[5.3067e-06, 5.31849e-06, 5.31572e-06], 0, 3.35331, 1668056481], "v": "v0.6"}
{"i": [["[\"roll\", 1, 14, 14, 512, -3, \"float16\"]", "cuda -keys=cuda,gpu -max_num_threads=1024 -model=unknown -thread_warp_size=32", [-1, 16, 64, 49152, 2147483647, 1024, 8, 32], "", 0, []], [[], [["FU", 1, [0, 1, 2, 3]], ["SP", 1, 0, 100352, [49], 1], ["AN", 1, 0, 5], ["AN", 1, 1, 6]]]], "r": [[3.96679e-06, 3.98324e-06, 3.98123e-06], 0, 3.74282, 1668056481], "v": "v0.6"}
{"i": [["[\"roll\", 1, 14, 14, 512, -3, \"float16\"]", "cuda -keys=cuda,gpu -max_num_threads=1024 -model=unknown -thread_warp_size=32", [-1, 16, 64, 49152, 2147483647, 1024, 8, 32], "", 0, []], [[], [["FU", 1, [0, 1, 2, 3]], ["SP", 1, 0, 100352, [16], 1], ["AN", 1, 0, 5], ["AN", 1, 1, 6]]]], "r": [[7.4293e-06, 7.43246e-06, 7.43817e-06], 0, 1.32023, 1668056762], "v": "v0.6"}
{"i": [["[\"roll\", 1, 14, 14, 512, -3, \"float16\"]", "cuda -keys=cuda,gpu -max_num_threads=1024 -model=unknown -thread_warp_size=32", [-1, 16, 64, 49152, 2147483647, 1024, 8, 32], "", 0, []], [[], [["FU", 1, [0, 1, 2, 3]], ["SP", 1, 0, 100352, [4], 1], ["AN", 1, 0, 5], ["AN", 1, 1, 6]]]], "r": [[2.15638e-05, 2.15807e-05, 2.15827e-05], 0, 4.4133, 1668056765], "v": "v0.6"}
{"i": [["[\"roll\", 1, 14, 14, 512, -3, \"float16\"]", "cuda -keys=cuda,gpu -max_num_threads=1024 -model=unknown -thread_warp_size=32", [-1, 16, 64, 49152, 2147483647, 1024, 8, 32], "", 0, []], [[], [["FU", 1, [0, 1, 2, 3]], ["SP", 1, 0, 100352, [1], 1], ["AN", 1, 0, 5], ["AN", 1, 1, 6]]]], "r": [[7.71497e-05, 7.71699e-05, 7.71643e-05], 0, 0.939038, 1668056762], "v": "v0.6"}
{"i": [["[\"roll\", 1, 14, 14, 512, -3, \"float16\"]", "cuda -keys=cuda,gpu -max_num_threads=1024 -model=unknown -thread_warp_size=32", [-1, 16, 64, 49152, 2147483647, 1024, 8, 32], "", 0, []], [[], [["FU", 1, [0, 1, 2, 3]], ["SP", 1, 0, 100352, [8], 1], ["AN", 1, 0, 5], ["AN", 1, 1, 6]]]], "r": [[1.2033e-05, 1.20432e-05, 1.20395e-05], 0, 0.588027, 1668056761], "v": "v0.6"}
{"i": [["[\"roll\", 1, 14, 14, 512, -3, \"float16\"]", "cuda -keys=cuda,gpu -max_num_threads=1024 -model=unknown -thread_warp_size=32", [-1, 16, 64, 49152, 2147483647, 1024, 8, 32], "", 0, []], [[], [["FU", 1, [0, 1, 2, 3]], ["SP", 1, 0, 100352, [2], 1], ["AN", 1, 0, 5], ["AN", 1, 1, 6]]]], "r": [[3.99651e-05, 3.9967e-05, 3.99749e-05], 0, 1.68391, 1668056763], "v": "v0.6"}
{"i": [["[\"roll\", 1, 14, 14, 512, -3, \"float16\"]", "cuda -keys=cuda,gpu -max_num_threads=1024 -model=unknown -thread_warp_size=32", [-1, 16, 64, 49152, 2147483647, 1024, 8, 32], "", 0, []], [[], [["FU", 1, [0, 1, 2, 3]], ["SP", 1, 0, 100352, [14], 1], ["AN", 1, 0, 5], ["AN", 1, 1, 6]]]], "r": [[8.08924e-06, 8.11214e-06, 8.12088e-06], 0, 1.95536, 1668056763], "v": "v0.6"}
{"i": [["[\"roll\", 1, 14, 14, 512, -3, \"float16\"]", "cuda -keys=cuda,gpu -max_num_threads=1024 -model=unknown -thread_warp_size=32", [-1, 16, 64, 49152, 2147483647, 1024, 8, 32], "", 0, []], [[], [["FU", 1, [0, 1, 2, 3]], ["SP", 1, 0, 100352, [64], 1], ["AN", 1, 0, 5], ["AN", 1, 1, 6]]]], "r": [[3.91521e-06, 3.92934e-06, 3.92821e-06], 0, 2.28233, 1668056763], "v": "v0.6"}
{"i": [["[\"roll\", 1, 14, 14, 512, -3, \"float16\"]", "cuda -keys=cuda,gpu -max_num_threads=1024 -model=unknown -thread_warp_size=32", [-1, 16, 64, 49152, 2147483647, 1024, 8, 32], "", 0, []], [[], [["FU", 1, [0, 1, 2, 3]], ["SP", 1, 0, 100352, [56], 1], ["AN", 1, 0, 5], ["AN", 1, 1, 6]]]], "r": [[4.05426e-06, 4.06771e-06, 4.06387e-06], 0, 4.06648, 1668056765], "v": "v0.6"}
{"i": [["[\"roll\", 1, 14, 14, 512, -3, \"float16\"]", "cuda -keys=cuda,gpu -max_num_threads=1024 -model=unknown -thread_warp_size=32", [-1, 16, 64, 49152, 2147483647, 1024, 8, 32], "", 0, []], [[], [["FU", 1, [0, 1, 2, 3]], ["SP", 1, 0, 100352, [32], 1], ["AN", 1, 0, 5], ["AN", 1, 1, 6]]]], "r": [[5.16677e-06, 5.17832e-06, 5.18074e-06], 0, 3.34223, 1668056764], "v": "v0.6"}
{"i": [["[\"roll\", 1, 14, 14, 512, -3, \"float16\"]", "cuda -keys=cuda,gpu -max_num_threads=1024 -model=unknown -thread_warp_size=32", [-1, 16, 64, 49152, 2147483647, 1024, 8, 32], "", 0, []], [[], [["FU", 1, [0, 1, 2, 3]], ["SP", 1, 0, 100352, [28], 1], ["AN", 1, 0, 5], ["AN", 1, 1, 6]]]], "r": [[5.23132e-06, 5.25471e-06, 5.24641e-06], 0, 3.74068, 1668056765], "v": "v0.6"}
{"i": [["[\"roll\", 1, 14, 14, 512, -3, \"float16\"]", "cuda -keys=cuda,gpu -max_num_threads=1024 -model=unknown -thread_warp_size=32", [-1, 16, 64, 49152, 2147483647, 1024, 8, 32], "", 0, []], [[], [["FU", 1, [0, 1, 2, 3]], ["SP", 1, 0, 100352, [49], 1], ["AN", 1, 0, 5], ["AN", 1, 1, 6]]]], "r": [[4.11444e-06, 4.12729e-06, 4.1296e-06], 0, 2.99663, 1668056764], "v": "v0.6"}
{"i": [["[\"roll\", 1, 14, 14, 512, -3, \"float16\"]", "cuda -keys=cuda,gpu -max_num_threads=1024 -model=unknown -thread_warp_size=32", [-1, 16, 64, 49152, 2147483647, 1024, 8, 32], "", 0, []], [[], [["FU", 1, [0, 1, 2, 3]], ["SP", 1, 0, 100352, [7], 1], ["AN", 1, 0, 5], ["AN", 1, 1, 6]]]], "r": [[1.35962e-05, 1.36033e-05, 1.35951e-05], 0, 2.67565, 1668056764], "v": "v0.6"}
{"i": [["[\"roll\", 1, 14, 14, 512, -3, \"float16\"]", "cuda -keys=cuda,gpu -max_num_threads=1024 -model=unknown -thread_warp_size=32", [-1, 16, 64, 49152, 2147483647, 1024, 8, 32], "", 0, []], [[], [["FU", 1, [0, 1, 2, 3]], ["SP", 1, 0, 100352, [1], 1], ["AN", 1, 0, 5], ["AN", 1, 1, 6]]]], "r": [[7.71723e-05, 7.71678e-05, 7.71583e-05], 0, 0.930396, 1668057046], "v": "v0.6"}
{"i": [["[\"roll\", 1, 14, 14, 512, -3, \"float16\"]", "cuda -keys=cuda,gpu -max_num_threads=1024 -model=unknown -thread_warp_size=32", [-1, 16, 64, 49152, 2147483647, 1024, 8, 32], "", 0, []], [[], [["FU", 1, [0, 1, 2, 3]], ["SP", 1, 0, 100352, [4], 1], ["AN", 1, 0, 5], ["AN", 1, 1, 6]]]], "r": [[2.13653e-05, 2.13709e-05, 2.13713e-05], 0, 0.588345, 1668057046], "v": "v0.6"}
{"i": [["[\"roll\", 1, 14, 14, 512, -3, \"float16\"]", "cuda -keys=cuda,gpu -max_num_threads=1024 -model=unknown -thread_warp_size=32", [-1, 16, 64, 49152, 2147483647, 1024, 8, 32], "", 0, []], [[], [["FU", 1, [0, 1, 2, 3]], ["SP", 1, 0, 100352, [2], 1], ["AN", 1, 0, 5], ["AN", 1, 1, 6]]]], "r": [[3.9987e-05, 4.00138e-05, 3.9992e-05], 0, 1.97001, 1668057047], "v": "v0.6"}
{"i": [["[\"roll\", 1, 14, 14, 512, -3, \"float16\"]", "cuda -keys=cuda,gpu -max_num_threads=1024 -model=unknown -thread_warp_size=32", [-1, 16, 64, 49152, 2147483647, 1024, 8, 32], "", 0, []], [[], [["FU", 1, [0, 1, 2, 3]], ["SP", 1, 0, 100352, [28], 1], ["AN", 1, 0, 5], ["AN", 1, 1, 6]]]], "r": [[5.26675e-06, 5.27485e-06, 5.2703e-06], 0, 2.31405, 1668057047], "v": "v0.6"}
{"i": [["[\"roll\", 1, 14, 14, 512, -3, \"float16\"]", "cuda -keys=cuda,gpu -max_num_threads=1024 -model=unknown -thread_warp_size=32", [-1, 16, 64, 49152, 2147483647, 1024, 8, 32], "", 0, []], [[], [["FU", 1, [0, 1, 2, 3]], ["SP", 1, 0, 100352, [56], 1], ["AN", 1, 0, 5], ["AN", 1, 1, 6]]]], "r": [[3.92622e-06, 3.9388e-06, 3.93759e-06], 0, 1.27206, 1668057046], "v": "v0.6"}
{"i": [["[\"roll\", 1, 14, 14, 512, -3, \"float16\"]", "cuda -keys=cuda,gpu -max_num_threads=1024 -model=unknown -thread_warp_size=32", [-1, 16, 64, 49152, 2147483647, 1024, 8, 32], "", 0, []], [[], [["FU", 1, [0, 1, 2, 3]], ["SP", 1, 0, 100352, [14], 1], ["AN", 1, 0, 5], ["AN", 1, 1, 6]]]], "r": [[7.95274e-06, 7.96389e-06, 7.96602e-06], 0, 2.7094, 1668057048], "v": "v0.6"}
{"i": [["[\"roll\", 1, 14, 14, 512, -3, \"float16\"]", "cuda -keys=cuda,gpu -max_num_threads=1024 -model=unknown -thread_warp_size=32", [-1, 16, 64, 49152, 2147483647, 1024, 8, 32], "", 0, []], [[], [["FU", 1, [0, 1, 2, 3]], ["SP", 1, 0, 100352, [64], 1], ["AN", 1, 0, 5], ["AN", 1, 1, 6]]]], "r": [[3.70883e-06, 3.72688e-06, 3.72578e-06], 0, 1.63464, 1668057047], "v": "v0.6"}
{"i": [["[\"roll\", 1, 14, 14, 512, -3, \"float16\"]", "cuda -keys=cuda,gpu -max_num_threads=1024 -model=unknown -thread_warp_size=32", [-1, 16, 64, 49152, 2147483647, 1024, 8, 32], "", 0, []], [[], [["FU", 1, [0, 1, 2, 3]], ["SP", 1, 0, 100352, [49], 1], ["AN", 1, 0, 5], ["AN", 1, 1, 6]]]], "r": [[4.19287e-06, 4.20321e-06, 4.20152e-06], 0, 3.02879, 1668057048], "v": "v0.6"}
{"i": [["[\"roll\", 1, 14, 14, 512, -3, \"float16\"]", "cuda -keys=cuda,gpu -max_num_threads=1024 -model=unknown -thread_warp_size=32", [-1, 16, 64, 49152, 2147483647, 1024, 8, 32], "", 0, []], [[], [["FU", 1, [0, 1, 2, 3]], ["SP", 1, 0, 100352, [7], 1], ["AN", 1, 0, 5], ["AN", 1, 1, 6]]]], "r": [[1.34066e-05, 1.34089e-05, 1.34105e-05], 0, 3.3583, 1668057048], "v": "v0.6"}
{"i": [["[\"roll\", 1, 14, 14, 512, -3, \"float16\"]", "cuda -keys=cuda,gpu -max_num_threads=1024 -model=unknown -thread_warp_size=32", [-1, 16, 64, 49152, 2147483647, 1024, 8, 32], "", 0, []], [[], [["FU", 1, [0, 1, 2, 3]], ["SP", 1, 0, 100352, [32], 1], ["AN", 1, 0, 5], ["AN", 1, 1, 6]]]], "r": [[4.91851e-06, 4.93186e-06, 4.93322e-06], 0, 3.72029, 1668057049], "v": "v0.6"}
{"i": [["[\"roll\", 1, 14, 14, 512, -3, \"float16\"]", "cuda -keys=cuda,gpu -max_num_threads=1024 -model=unknown -thread_warp_size=32", [-1, 16, 64, 49152, 2147483647, 1024, 8, 32], "", 0, []], [[], [["FU", 1, [0, 1, 2, 3]], ["SP", 1, 0, 100352, [8], 1], ["AN", 1, 0, 5], ["AN", 1, 1, 6]]]], "r": [[1.20805e-05, 1.20938e-05, 1.20941e-05], 0, 4.06001, 1668057049], "v": "v0.6"}
{"i": [["[\"roll\", 1, 14, 14, 512, -3, \"float16\"]", "cuda -keys=cuda,gpu -max_num_threads=1024 -model=unknown -thread_warp_size=32", [-1, 16, 64, 49152, 2147483647, 1024, 8, 32], "", 0, []], [[], [["FU", 1, [0, 1, 2, 3]], ["SP", 1, 0, 100352, [16], 1], ["AN", 1, 0, 5], ["AN", 1, 1, 6]]]], "r": [[7.26608e-06, 7.28116e-06, 7.28359e-06], 0, 4.36828, 1668057049], "v": "v0.6"}
{"i": [["[\"roll\", 1, 14, 14, 512, -3, \"float16\"]", "cuda -keys=cuda,gpu -max_num_threads=1024 -model=unknown -thread_warp_size=32", [-1, 16, 64, 49152, 2147483647, 1024, 8, 32], "", 0, []], [[], [["FU", 1, [0, 1, 2, 3]], ["SP", 1, 0, 100352, [49], 1], ["AN", 1, 0, 5], ["AN", 1, 1, 6]]]], "r": [[4.19211e-06, 4.19994e-06, 4.20177e-06], 0, 1.27291, 1668057330], "v": "v0.6"}
{"i": [["[\"roll\", 1, 14, 14, 512, -3, \"float16\"]", "cuda -keys=cuda,gpu -max_num_threads=1024 -model=unknown -thread_warp_size=32", [-1, 16, 64, 49152, 2147483647, 1024, 8, 32], "", 0, []], [[], [["FU", 1, [0, 1, 2, 3]], ["SP", 1, 0, 100352, [56], 1], ["AN", 1, 0, 5], ["AN", 1, 1, 6]]]], "r": [[3.93766e-06, 3.94023e-06, 3.93366e-06], 0, 0.927927, 1668057330], "v": "v0.6"}
{"i": [["[\"roll\", 1, 14, 14, 512, -3, \"float16\"]", "cuda -keys=cuda,gpu -max_num_threads=1024 -model=unknown -thread_warp_size=32", [-1, 16, 64, 49152, 2147483647, 1024, 8, 32], "", 0, []], [[], [["FU", 1, [0, 1, 2, 3]], ["SP", 1, 0, 100352, [8], 1], ["AN", 1, 0, 5], ["AN", 1, 1, 6]]]], "r": [[1.20294e-05, 1.20412e-05, 1.2041e-05], 0, 2.33221, 1668057331], "v": "v0.6"}
{"i": [["[\"roll\", 1, 14, 14, 512, -3, \"float16\"]", "cuda -keys=cuda,gpu -max_num_threads=1024 -model=unknown -thread_warp_size=32", [-1, 16, 64, 49152, 2147483647, 1024, 8, 32], "", 0, []], [[], [["FU", 1, [0, 1, 2, 3]], ["SP", 1, 0, 100352, [4], 1], ["AN", 1, 0, 5], ["AN", 1, 1, 6]]]], "r": [[2.14265e-05, 2.14454e-05, 2.1438e-05], 0, 1.6643, 1668057330], "v": "v0.6"}
{"i": [["[\"roll\", 1, 14, 14, 512, -3, \"float16\"]", "cuda -keys=cuda,gpu -max_num_threads=1024 -model=unknown -thread_warp_size=32", [-1, 16, 64, 49152, 2147483647, 1024, 8, 32], "", 0, []], [[], [["FU", 1, [0, 1, 2, 3]], ["SP", 1, 0, 100352, [32], 1], ["AN", 1, 0, 5], ["AN", 1, 1, 6]]]], "r": [[4.94676e-06, 4.96028e-06, 4.96093e-06], 0, 0.57855, 1668057329], "v": "v0.6"}
{"i": [["[\"roll\", 1, 14, 14, 512, -3, \"float16\"]", "cuda -keys=cuda,gpu -max_num_threads=1024 -model=unknown -thread_warp_size=32", [-1, 16, 64, 49152, 2147483647, 1024, 8, 32], "", 0, []], [[], [["FU", 1, [0, 1, 2, 3]], ["SP", 1, 0, 100352, [14], 1], ["AN", 1, 0, 5], ["AN", 1, 1, 6]]]], "r": [[7.93491e-06, 7.94672e-06, 7.9471e-06], 0, 3.41621, 1668057332], "v": "v0.6"}
{"i": [["[\"roll\", 1, 14, 14, 512, -3, \"float16\"]", "cuda -keys=cuda,gpu -max_num_threads=1024 -model=unknown -thread_warp_size=32", [-1, 16, 64, 49152, 2147483647, 1024, 8, 32], "", 0, []], [[], [["FU", 1, [0, 1, 2, 3]], ["SP", 1, 0, 100352, [16], 1], ["AN", 1, 0, 5], ["AN", 1, 1, 6]]]], "r": [[7.19812e-06, 7.20863e-06, 7.20898e-06], 0, 3.06268, 1668057332], "v": "v0.6"}
{"i": [["[\"roll\", 1, 14, 14, 512, -3, \"float16\"]", "cuda -keys=cuda,gpu -max_num_threads=1024 -model=unknown -thread_warp_size=32", [-1, 16, 64, 49152, 2147483647, 1024, 8, 32], "", 0, []], [[], [["FU", 1, [0, 1, 2, 3]], ["SP", 1, 0, 100352, [2], 1], ["AN", 1, 0, 5], ["AN", 1, 1, 6]]]], "r": [[3.99349e-05, 3.99595e-05, 3.99566e-05], 0, 1.98625, 1668057331], "v": "v0.6"}
{"i": [["[\"roll\", 1, 14, 14, 512, -3, \"float16\"]", "cuda -keys=cuda,gpu -max_num_threads=1024 -model=unknown -thread_warp_size=32", [-1, 16, 64, 49152, 2147483647, 1024, 8, 32], "", 0, []], [[], [["FU", 1, [0, 1, 2, 3]], ["SP", 1, 0, 100352, [64], 1], ["AN", 1, 0, 5], ["AN", 1, 1, 6]]]], "r": [[3.67622e-06, 3.68617e-06, 3.69226e-06], 0, 2.71562, 1668057332], "v": "v0.6"}
{"i": [["[\"roll\", 1, 14, 14, 512, -3, \"float16\"]", "cuda -keys=cuda,gpu -max_num_threads=1024 -model=unknown -thread_warp_size=32", [-1, 16, 64, 49152, 2147483647, 1024, 8, 32], "", 0, []], [[], [["FU", 1, [0, 1, 2, 3]], ["SP", 1, 0, 100352, [7], 1], ["AN", 1, 0, 5], ["AN", 1, 1, 6]]]], "r": [[1.3465e-05, 1.34689e-05, 1.34675e-05], 0, 3.76582, 1668057333], "v": "v0.6"}
{"i": [["[\"roll\", 1, 14, 14, 512, -3, \"float16\"]", "cuda -keys=cuda,gpu -max_num_threads=1024 -model=unknown -thread_warp_size=32", [-1, 16, 64, 49152, 2147483647, 1024, 8, 32], "", 0, []], [[], [["FU", 1, [0, 1, 2, 3]], ["SP", 1, 0, 100352, [28], 1], ["AN", 1, 0, 5], ["AN", 1, 1, 6]]]], "r": [[5.22982e-06, 5.23801e-06, 5.24264e-06], 0, 4.10151, 1668057333], "v": "v0.6"}
{"i": [["[\"roll\", 1, 14, 14, 512, -3, \"float16\"]", "cuda -keys=cuda,gpu -max_num_threads=1024 -model=unknown -thread_warp_size=32", [-1, 16, 64, 49152, 2147483647, 1024, 8, 32], "", 0, []], [[], [["FU", 1, [0, 1, 2, 3]], ["SP", 1, 0, 100352, [1], 1], ["AN", 1, 0, 5], ["AN", 1, 1, 6]]]], "r": [[7.72171e-05, 7.7231e-05, 7.72256e-05], 0, 4.44874, 1668057333], "v": "v0.6"}
{"i": [["[\"roll\", 1, 14, 14, 512, -3, \"float16\"]", "cuda -keys=cuda,gpu -max_num_threads=1024 -model=unknown -thread_warp_size=32", [-1, 16, 64, 49152, 2147483647, 1024, 8, 32], "", 0, []], [[], [["FU", 1, [0, 1, 2, 3]], ["SP", 1, 0, 100352, [2], 1], ["AN", 1, 0, 5], ["AN", 1, 1, 6]]]], "r": [[3.99705e-05, 3.99723e-05, 3.99798e-05], 0, 0.932547, 1668057613], "v": "v0.6"}
{"i": [["[\"roll\", 1, 14, 14, 512, -3, \"float16\"]", "cuda -keys=cuda,gpu -max_num_threads=1024 -model=unknown -thread_warp_size=32", [-1, 16, 64, 49152, 2147483647, 1024, 8, 32], "", 0, []], [[], [["FU", 1, [0, 1, 2, 3]], ["SP", 1, 0, 100352, [7], 1], ["AN", 1, 0, 5], ["AN", 1, 1, 6]]]], "r": [[1.36565e-05, 1.36742e-05, 1.36629e-05], 0, 1.63949, 1668057614], "v": "v0.6"}
{"i": [["[\"roll\", 1, 14, 14, 512, -3, \"float16\"]", "cuda -keys=cuda,gpu -max_num_threads=1024 -model=unknown -thread_warp_size=32", [-1, 16, 64, 49152, 2147483647, 1024, 8, 32], "", 0, []], [[], [["FU", 1, [0, 1, 2, 3]], ["SP", 1, 0, 100352, [4], 1], ["AN", 1, 0, 5], ["AN", 1, 1, 6]]]], "r": [[2.14296e-05, 2.14421e-05, 2.14438e-05], 0, 2.32604, 1668057615], "v": "v0.6"}
{"i": [["[\"roll\", 1, 14, 14, 512, -3, \"float16\"]", "cuda -keys=cuda,gpu -max_num_threads=1024 -model=unknown -thread_warp_size=32", [-1, 16, 64, 49152, 2147483647, 1024, 8, 32], "", 0, []], [[], [["FU", 1, [0, 1, 2, 3]], ["SP", 1, 0, 100352, [64], 1], ["AN", 1, 0, 5], ["AN", 1, 1, 6]]]], "r": [[3.67225e-06, 3.68744e-06, 3.68563e-06], 0, 1.2609, 1668057614], "v": "v0.6"}
{"i": [["[\"roll\", 1, 14, 14, 512, -3, \"float16\"]", "cuda -keys=cuda,gpu -max_num_threads=1024 -model=unknown -thread_warp_size=32", [-1, 16, 64, 49152, 2147483647, 1024, 8, 32], "", 0, []], [[], [["FU", 1, [0, 1, 2, 3]], ["SP", 1, 0, 100352, [49], 1], ["AN", 1, 0, 5], ["AN", 1, 1, 6]]]], "r": [[3.99934e-06, 4.00863e-06, 4.01071e-06], 0, 0.586541, 1668057613], "v": "v0.6"}
{"i": [["[\"roll\", 1, 14, 14, 512, -3, \"float16\"]", "cuda -keys=cuda,gpu -max_num_threads=1024 -model=unknown -thread_warp_size=32", [-1, 16, 64, 49152, 2147483647, 1024, 8, 32], "", 0, []], [[], [["FU", 1, [0, 1, 2, 3]], ["SP", 1, 0, 100352, [32], 1], ["AN", 1, 0, 5], ["AN", 1, 1, 6]]]], "r": [[4.89247e-06, 4.90647e-06, 4.90556e-06], 0, 1.98795, 1668057614], "v": "v0.6"}
{"i": [["[\"roll\", 1, 14, 14, 512, -3, \"float16\"]", "cuda -keys=cuda,gpu -max_num_threads=1024 -model=unknown -thread_warp_size=32", [-1, 16, 64, 49152, 2147483647, 1024, 8, 32], "", 0, []], [[], [["FU", 1, [0, 1, 2, 3]], ["SP", 1, 0, 100352, [56], 1], ["AN", 1, 0, 5], ["AN", 1, 1, 6]]]], "r": [[4.07066e-06, 4.09071e-06, 4.085e-06], 0, 2.72046, 1668057615], "v": "v0.6"}
{"i": [["[\"roll\", 1, 14, 14, 512, -3, \"float16\"]", "cuda -keys=cuda,gpu -max_num_threads=1024 -model=unknown -thread_warp_size=32", [-1, 16, 64, 49152, 2147483647, 1024, 8, 32], "", 0, []], [[], [["FU", 1, [0, 1, 2, 3]], ["SP", 1, 0, 100352, [28], 1], ["AN", 1, 0, 5], ["AN", 1, 1, 6]]]], "r": [[5.3328e-06, 5.34189e-06, 5.34026e-06], 0, 3.40939, 1668057616], "v": "v0.6"}
{"i": [["[\"roll\", 1, 14, 14, 512, -3, \"float16\"]", "cuda -keys=cuda,gpu -max_num_threads=1024 -model=unknown -thread_warp_size=32", [-1, 16, 64, 49152, 2147483647, 1024, 8, 32], "", 0, []], [[], [["FU", 1, [0, 1, 2, 3]], ["SP", 1, 0, 100352, [1], 1], ["AN", 1, 0, 5], ["AN", 1, 1, 6]]]], "r": [[7.71453e-05, 7.71913e-05, 7.71983e-05], 0, 3.06345, 1668057616], "v": "v0.6"}
{"i": [["[\"roll\", 1, 14, 14, 512, -3, \"float16\"]", "cuda -keys=cuda,gpu -max_num_threads=1024 -model=unknown -thread_warp_size=32", [-1, 16, 64, 49152, 2147483647, 1024, 8, 32], "", 0, []], [[], [["FU", 1, [0, 1, 2, 3]], ["SP", 1, 0, 100352, [14], 1], ["AN", 1, 0, 5], ["AN", 1, 1, 6]]]], "r": [[8.07534e-06, 8.08018e-06, 8.08062e-06], 0, 4.08881, 1668057617], "v": "v0.6"}
{"i": [["[\"roll\", 1, 14, 14, 512, -3, \"float16\"]", "cuda -keys=cuda,gpu -max_num_threads=1024 -model=unknown -thread_warp_size=32", [-1, 16, 64, 49152, 2147483647, 1024, 8, 32], "", 0, []], [[], [["FU", 1, [0, 1, 2, 3]], ["SP", 1, 0, 100352, [16], 1], ["AN", 1, 0, 5], ["AN", 1, 1, 6]]]], "r": [[7.24797e-06, 7.25441e-06, 7.25583e-06], 0, 3.75038, 1668057616], "v": "v0.6"}
{"i": [["[\"roll\", 1, 14, 14, 512, -3, \"float16\"]", "cuda -keys=cuda,gpu -max_num_threads=1024 -model=unknown -thread_warp_size=32", [-1, 16, 64, 49152, 2147483647, 1024, 8, 32], "", 0, []], [[], [["FU", 1, [0, 1, 2, 3]], ["SP", 1, 0, 100352, [8], 1], ["AN", 1, 0, 5], ["AN", 1, 1, 6]]]], "r": [[1.20357e-05, 1.20372e-05, 1.20397e-05], 0, 4.44183, 1668057617], "v": "v0.6"}
{"i": [["[\"roll\", 1, 14, 14, 512, -3, \"float16\"]", "cuda -keys=cuda,gpu -max_num_threads=1024 -model=unknown -thread_warp_size=32", [-1, 16, 64, 49152, 2147483647, 1024, 8, 32], "", 0, []], [[], [["FU", 1, [0, 1, 2, 3]], ["SP", 1, 0, 100352, [8], 1], ["AN", 1, 0, 5], ["AN", 1, 1, 6]]]], "r": [[1.20888e-05, 1.20837e-05, 1.20938e-05], 0, 2.38511, 1668057899], "v": "v0.6"}
{"i": [["[\"roll\", 1, 14, 14, 512, -3, \"float16\"]", "cuda -keys=cuda,gpu -max_num_threads=1024 -model=unknown -thread_warp_size=32", [-1, 16, 64, 49152, 2147483647, 1024, 8, 32], "", 0, []], [[], [["FU", 1, [0, 1, 2, 3]], ["SP", 1, 0, 100352, [7], 1], ["AN", 1, 0, 5], ["AN", 1, 1, 6]]]], "r": [[1.33897e-05, 1.34096e-05, 1.34054e-05], 0, 0.585174, 1668057898], "v": "v0.6"}
{"i": [["[\"roll\", 1, 14, 14, 512, -3, \"float16\"]", "cuda -keys=cuda,gpu -max_num_threads=1024 -model=unknown -thread_warp_size=32", [-1, 16, 64, 49152, 2147483647, 1024, 8, 32], "", 0, []], [[], [["FU", 1, [0, 1, 2, 3]], ["SP", 1, 0, 100352, [1], 1], ["AN", 1, 0, 5], ["AN", 1, 1, 6]]]], "r": [[7.71372e-05, 7.71807e-05, 7.71668e-05], 0, 1.32945, 1668057898], "v": "v0.6"}
{"i": [["[\"roll\", 1, 14, 14, 512, -3, \"float16\"]", "cuda -keys=cuda,gpu -max_num_threads=1024 -model=unknown -thread_warp_size=32", [-1, 16, 64, 49152, 2147483647, 1024, 8, 32], "", 0, []], [[], [["FU", 1, [0, 1, 2, 3]], ["SP", 1, 0, 100352, [16], 1], ["AN", 1, 0, 5], ["AN", 1, 1, 6]]]], "r": [[7.30096e-06, 7.31923e-06, 7.32127e-06], 0, 1.67392, 1668057899], "v": "v0.6"}
{"i": [["[\"roll\", 1, 14, 14, 512, -3, \"float16\"]", "cuda -keys=cuda,gpu -max_num_threads=1024 -model=unknown -thread_warp_size=32", [-1, 16, 64, 49152, 2147483647, 1024, 8, 32], "", 0, []], [[], [["FU", 1, [0, 1, 2, 3]], ["SP", 1, 0, 100352, [49], 1], ["AN", 1, 0, 5], ["AN", 1, 1, 6]]]], "r": [[4.17839e-06, 4.1805e-06, 4.17783e-06], 0, 0.966348, 1668057898], "v": "v0.6"}
{"i": [["[\"roll\", 1, 14, 14, 512, -3, \"float16\"]", "cuda -keys=cuda,gpu -max_num_threads=1024 -model=unknown -thread_warp_size=32", [-1, 16, 64, 49152, 2147483647, 1024, 8, 32], "", 0, []], [[], [["FU", 1, [0, 1, 2, 3]], ["SP", 1, 0, 100352, [56], 1], ["AN", 1, 0, 5], ["AN", 1, 1, 6]]]], "r": [[4.07557e-06, 4.08451e-06, 4.08525e-06], 0, 3.45887, 1668057900], "v": "v0.6"}
{"i": [["[\"roll\", 1, 14, 14, 512, -3, \"float16\"]", "cuda -keys=cuda,gpu -max_num_threads=1024 -model=unknown -thread_warp_size=32", [-1, 16, 64, 49152, 2147483647, 1024, 8, 32], "", 0, []], [[], [["FU", 1, [0, 1, 2, 3]], ["SP", 1, 0, 100352, [2], 1], ["AN", 1, 0, 5], ["AN", 1, 1, 6]]]], "r": [[4.00092e-05, 4.00165e-05, 4.00198e-05], 0, 2.72552, 1668057900], "v": "v0.6"}
{"i": [["[\"roll\", 1, 14, 14, 512, -3, \"float16\"]", "cuda -keys=cuda,gpu -max_num_threads=1024 -model=unknown -thread_warp_size=32", [-1, 16, 64, 49152, 2147483647, 1024, 8, 32], "", 0, []], [[], [["FU", 1, [0, 1, 2, 3]], ["SP", 1, 0, 100352, [64], 1], ["AN", 1, 0, 5], ["AN", 1, 1, 6]]]], "r": [[3.81321e-06, 3.82748e-06, 3.8263e-06], 0, 2.02752, 1668057899], "v": "v0.6"}
{"i": [["[\"roll\", 1, 14, 14, 512, -3, \"float16\"]", "cuda -keys=cuda,gpu -max_num_threads=1024 -model=unknown -thread_warp_size=32", [-1, 16, 64, 49152, 2147483647, 1024, 8, 32], "", 0, []], [[], [["FU", 1, [0, 1, 2, 3]], ["SP", 1, 0, 100352, [28], 1], ["AN", 1, 0, 5], ["AN", 1, 1, 6]]]], "r": [[5.26088e-06, 5.26931e-06, 5.27072e-06], 0, 4.53125, 1668057902], "v": "v0.6"}
{"i": [["[\"roll\", 1, 14, 14, 512, -3, \"float16\"]", "cuda -keys=cuda,gpu -max_num_threads=1024 -model=unknown -thread_warp_size=32", [-1, 16, 64, 49152, 2147483647, 1024, 8, 32], "", 0, []], [[], [["FU", 1, [0, 1, 2, 3]], ["SP", 1, 0, 100352, [32], 1], ["AN", 1, 0, 5], ["AN", 1, 1, 6]]]], "r": [[4.93606e-06, 4.94836e-06, 4.94567e-06], 0, 4.17683, 1668057901], "v": "v0.6"}
{"i": [["[\"roll\", 1, 14, 14, 512, -3, \"float16\"]", "cuda -keys=cuda,gpu -max_num_threads=1024 -model=unknown -thread_warp_size=32", [-1, 16, 64, 49152, 2147483647, 1024, 8, 32], "", 0, []], [[], [["FU", 1, [0, 1, 2, 3]], ["SP", 1, 0, 100352, [14], 1], ["AN", 1, 0, 5], ["AN", 1, 1, 6]]]], "r": [[7.97083e-06, 7.98288e-06, 7.98666e-06], 0, 3.1139, 1668057900], "v": "v0.6"}
{"i": [["[\"roll\", 1, 14, 14, 512, -3, \"float16\"]", "cuda -keys=cuda,gpu -max_num_threads=1024 -model=unknown -thread_warp_size=32", [-1, 16, 64, 49152, 2147483647, 1024, 8, 32], "", 0, []], [[], [["FU", 1, [0, 1, 2, 3]], ["SP", 1, 0, 100352, [4], 1], ["AN", 1, 0, 5], ["AN", 1, 1, 6]]]], "r": [[2.14392e-05, 2.14532e-05, 2.14533e-05], 0, 3.78436, 1668057901], "v": "v0.6"}
{"i": [["[\"roll\", 1, 14, 14, 512, -3, \"float16\"]", "cuda -keys=cuda,gpu -max_num_threads=1024 -model=unknown -thread_warp_size=32", [-1, 16, 64, 49152, 2147483647, 1024, 8, 32], "", 0, []], [[], [["FU", 1, [0, 1, 2, 3]], ["SP", 1, 0, 100352, [4], 1], ["AN", 1, 0, 5], ["AN", 1, 1, 6]]]], "r": [[2.13744e-05, 2.13822e-05, 2.13857e-05], 0, 2.34014, 1668058134], "v": "v0.6"}
