python/models/swin_transformer/kernel_configs/swin_transform_auto_tvm_fused_roll_reshape_permute_reshape_qkv_dense_tensorcore_1_8_8_1024_3_8.log
{"input": ["cuda -keys=cuda,gpu -max_num_threads=1024 -thread_warp_size=32", "fused_roll_reshape_permute_reshape_qkv_dense_tensorcore.cuda", [["TENSOR", [1, 8, 8, 1024], "float16"], ["TENSOR", [3072, 1024], "float16"], 1, 8, 8, 1024, 3, 8], {}], "config": {"index": 5300, "code_hash": null, "entity": [["block_row_warps", "ot", 4], ["block_col_warps", "ot", 4], ["warp_row_tiles", "ot", 1], ["warp_col_tiles", "ot", 2], ["chunk", "ot", 2], ["offset", "ot", 0], ["offsetCS", "ot", 0], ["vec", "ot", 1], ["wmma_m", "ot", 16]]}, "result": [[0.000103122456], 0, 1.6454274654388428, 1652116255.322914], "version": 0.2, "tvm_version": "0.8.0"}
{"input": ["cuda -keys=cuda,gpu -max_num_threads=1024 -thread_warp_size=32", "fused_roll_reshape_permute_reshape_qkv_dense_tensorcore.cuda", [["TENSOR", [1, 8, 8, 1024], "float16"], ["TENSOR", [3072, 1024], "float16"], 1, 8, 8, 1024, 3, 8], {}], "config": {"index": 14101, "code_hash": null, "entity": [["block_row_warps", "ot", 2], ["block_col_warps", "ot", 4], ["warp_row_tiles", "ot", 1], ["warp_col_tiles", "ot", 1], ["chunk", "ot", 4], ["offset", "ot", 8], ["offsetCS", "ot", 8], ["vec", "ot", 4], ["wmma_m", "ot", 8]]}, "result": [[1.666223e-05], 0, 1.0457370281219482, 1652116256.4665663], "version": 0.2, "tvm_version": "0.8.0"}
{"input": ["cuda -keys=cuda,gpu -max_num_threads=1024 -thread_warp_size=32", "fused_roll_reshape_permute_reshape_qkv_dense_tensorcore.cuda", [["TENSOR", [1, 8, 8, 1024], "float16"], ["TENSOR", [3072, 1024], "float16"], 1, 8, 8, 1024, 3, 8], {}], "config": {"index": 11831, "code_hash": null, "entity": [["block_row_warps", "ot", 4], ["block_col_warps", "ot", 2], ["warp_row_tiles", "ot", 1], ["warp_col_tiles", "ot", 1], ["chunk", "ot", 4], ["offset", "ot", 0], ["offsetCS", "ot", 0], ["vec", "ot", 2], ["wmma_m", "ot", 8]]}, "result": [[3.7432158e-05], 0, 1.238844394683838, 1652116257.0601656], "version": 0.2, "tvm_version": "0.8.0"}
{"input": ["cuda -keys=cuda,gpu -max_num_threads=1024 -thread_warp_size=32", "fused_roll_reshape_permute_reshape_qkv_dense_tensorcore.cuda", [["TENSOR", [1, 8, 8, 1024], "float16"], ["TENSOR", [3072, 1024], "float16"], 1, 8, 8, 1024, 3, 8], {}], "config": {"index": 14943, "code_hash": null, "entity": [["block_row_warps", "ot", 1], ["block_col_warps", "ot", 2], ["warp_row_tiles", "ot", 2], ["warp_col_tiles", "ot", 2], ["chunk", "ot", 1], ["offset", "ot", 0], ["offsetCS", "ot", 8], ["vec", "ot", 8], ["wmma_m", "ot", 8]]}, "result": [[4.2707391999999995e-05], 0, 1.229245901107788, 1652116258.262691], "version": 0.2, "tvm_version": "0.8.0"}
{"input": ["cuda -keys=cuda,gpu -max_num_threads=1024 -thread_warp_size=32", "fused_roll_reshape_permute_reshape_qkv_dense_tensorcore.cuda", [["TENSOR", [1, 8, 8, 1024], "float16"], ["TENSOR", [3072, 1024], "float16"], 1, 8, 8, 1024, 3, 8], {}], "config": {"index": 5443, "code_hash": null, "entity": [["block_row_warps", "ot", 2], ["block_col_warps", "ot", 4], ["warp_row_tiles", "ot", 2], ["warp_col_tiles", "ot", 1], ["chunk", "ot", 8], ["offset", "ot", 0], ["offsetCS", "ot", 0], ["vec", "ot", 1], ["wmma_m", "ot", 16]]}, "result": [[4.7296292e-05], 0, 1.3494315147399902, 1652116259.5213187], "version": 0.2, "tvm_version": "0.8.0"}
{"input": ["cuda -keys=cuda,gpu -max_num_threads=1024 -thread_warp_size=32", "fused_roll_reshape_permute_reshape_qkv_dense_tensorcore.cuda", [["TENSOR", [1, 8, 8, 1024], "float16"], ["TENSOR", [3072, 1024], "float16"], 1, 8, 8, 1024, 3, 8], {}], "config": {"index": 14859, "code_hash": null, "entity": [["block_row_warps", "ot", 1], ["block_col_warps", "ot", 1], ["warp_row_tiles", "ot", 2], ["warp_col_tiles", "ot", 2], ["chunk", "ot", 8], ["offset", "ot", 8], ["offsetCS", "ot", 0], ["vec", "ot", 8], ["wmma_m", "ot", 8]]}, "result": [[1.4940344e-05], 0, 1.2963182926177979, 1652116260.0800314], "version": 0.2, "tvm_version": "0.8.0"}
{"input": ["cuda -keys=cuda,gpu -max_num_threads=1024 -thread_warp_size=32", "fused_roll_reshape_permute_reshape_qkv_dense_tensorcore.cuda", [["TENSOR", [1, 8, 8, 1024], "float16"], ["TENSOR", [3072, 1024], "float16"], 1, 8, 8, 1024, 3, 8], {}], "config": {"index": 11199, "code_hash": null, "entity": [["block_row_warps", "ot", 1], ["block_col_warps", "ot", 2], ["warp_row_tiles", "ot", 4], ["warp_col_tiles", "ot", 1], ["chunk", "ot", 4], ["offset", "ot", 0], ["offsetCS", "ot", 8], ["vec", "ot", 1], ["wmma_m", "ot", 8]]}, "result": [[2.8160272e-05], 0, 1.290945053100586, 1652116261.272768], "version": 0.2, "tvm_version": "0.8.0"}
{"input": ["cuda -keys=cuda,gpu -max_num_threads=1024 -thread_warp_size=32", "fused_roll_reshape_permute_reshape_qkv_dense_tensorcore.cuda", [["TENSOR", [1, 8, 8, 1024], "float16"], ["TENSOR", [3072, 1024], "float16"], 1, 8, 8, 1024, 3, 8], {}], "config": {"index": 2517, "code_hash": null, "entity": [["block_row_warps", "ot", 1], ["block_col_warps", "ot", 4], ["warp_row_tiles", "ot", 1], ["warp_col_tiles", "ot", 1], ["chunk", "ot", 8], ["offset", "ot", 8], ["offsetCS", "ot", 8], ["vec", "ot", 2], ["wmma_m", "ot", 32]]}, "result": [[1.0692633e-05], 0, 1.2221169471740723, 1652116262.407837], "version": 0.2, "tvm_version": "0.8.0"}
{"input": ["cuda -keys=cuda,gpu -max_num_threads=1024 -thread_warp_size=32", "fused_roll_reshape_permute_reshape_qkv_dense_tensorcore.cuda", [["TENSOR", [1, 8, 8, 1024], "float16"], ["TENSOR", [3072, 1024], "float16"], 1, 8, 8, 1024, 3, 8], {}], "config": {"index": 6898, "code_hash": null, "entity": [["block_row_warps", "ot", 2], ["block_col_warps", "ot", 2], ["warp_row_tiles", "ot", 2], ["warp_col_tiles", "ot", 1], ["chunk", "ot", 2], ["offset", "ot", 8], ["offsetCS", "ot", 0], ["vec", "ot", 2], ["wmma_m", "ot", 16]]}, "result": [[2.8451033e-05], 0, 1.1812820434570312, 1652116263.5890667], "version": 0.2, "tvm_version": "0.8.0"}
{"input": ["cuda -keys=cuda,gpu -max_num_threads=1024 -thread_warp_size=32", "fused_roll_reshape_permute_reshape_qkv_dense_tensorcore.cuda", [["TENSOR", [1, 8, 8, 1024], "float16"], ["TENSOR", [3072, 1024], "float16"], 1, 8, 8, 1024, 3, 8], {}], "config": {"index": 9363, "code_hash": null, "entity": [["block_row_warps", "ot", 1], ["block_col_warps", "ot", 2], ["warp_row_tiles", "ot", 4], ["warp_col_tiles", "ot", 2], ["chunk", "ot", 8], ["offset", "ot", 0], ["offsetCS", "ot", 0], ["vec", "ot", 8], ["wmma_m", "ot", 16]]}, "result": [[4.7955503999999996e-05], 0, 1.722486972808838, 1652116264.5377398], "version": 0.2, "tvm_version": "0.8.0"}
{"input": ["cuda -keys=cuda,gpu -max_num_threads=1024 -thread_warp_size=32", "fused_roll_reshape_permute_reshape_qkv_dense_tensorcore.cuda", [["TENSOR", [1, 8, 8, 1024], "float16"], ["TENSOR", [3072, 1024], "float16"], 1, 8, 8, 1024, 3, 8], {}], "config": {"index": 4135, "code_hash": null, "entity": [["block_row_warps", "ot", 2], ["block_col_warps", "ot", 2], ["warp_row_tiles", "ot", 1], ["warp_col_tiles", "ot", 1], ["chunk", "ot", 8], ["offset", "ot", 0], ["offsetCS", "ot", 0], ["vec", "ot", 8], ["wmma_m", "ot", 32]]}, "result": [[3.7049037e-05], 0, 1.2328739166259766, 1652116265.743457], "version": 0.2, "tvm_version": "0.8.0"}
{"input": ["cuda -keys=cuda,gpu -max_num_threads=1024 -thread_warp_size=32", "fused_roll_reshape_permute_reshape_qkv_dense_tensorcore.cuda", [["TENSOR", [1, 8, 8, 1024], "float16"], ["TENSOR", [3072, 1024], "float16"], 1, 8, 8, 1024, 3, 8], {}], "config": {"index": 10417, "code_hash": null, "entity": [["block_row_warps", "ot", 2], ["block_col_warps", "ot", 2], ["warp_row_tiles", "ot", 4], ["warp_col_tiles", "ot", 2], ["chunk", "ot", 1], ["offset", "ot", 0], ["offsetCS", "ot", 0], ["vec", "ot", 1], ["wmma_m", "ot", 8]]}, "result": [[4.6275631e-05], 0, 1.3680577278137207, 1652116267.610463], "version": 0.2, "tvm_version": "0.8.0"}
{"input": ["cuda -keys=cuda,gpu -max_num_threads=1024 -thread_warp_size=32", "fused_roll_reshape_permute_reshape_qkv_dense_tensorcore.cuda", [["TENSOR", [1, 8, 8, 1024], "float16"], ["TENSOR", [3072, 1024], "float16"], 1, 8, 8, 1024, 3, 8], {}], "config": {"index": 13625, "code_hash": null, "entity": [["block_row_warps", "ot", 4], ["block_col_warps", "ot", 4], ["warp_row_tiles", "ot", 2], ["warp_col_tiles", "ot", 1], ["chunk", "ot", 1], ["offset", "ot", 0], ["offsetCS", "ot", 8], ["vec", "ot", 4], ["wmma_m", "ot", 8]]}, "result": [[6.0572103e-05], 0, 1.5567944049835205, 1652116269.0902166], "version": 0.2, "tvm_version": "0.8.0"}
{"input": ["cuda -keys=cuda,gpu -max_num_threads=1024 -thread_warp_size=32", "fused_roll_reshape_permute_reshape_qkv_dense_tensorcore.cuda", [["TENSOR", [1, 8, 8, 1024], "float16"], ["TENSOR", [3072, 1024], "float16"], 1, 8, 8, 1024, 3, 8], {}], "config": {"index": 10245, "code_hash": null, "entity": [["block_row_warps", "ot", 1], ["block_col_warps", "ot", 2], ["warp_row_tiles", "ot", 2], ["warp_col_tiles", "ot", 2], ["chunk", "ot", 4], ["offset", "ot", 8], ["offsetCS", "ot", 8], ["vec", "ot", 8], ["wmma_m", "ot", 16]]}, "result": [[1.2829753000000002e-05], 0, 1.17230224609375, 1652116269.667445], "version": 0.2, "tvm_version": "0.8.0"}
{"input": ["cuda -keys=cuda,gpu -max_num_threads=1024 -thread_warp_size=32", "fused_roll_reshape_permute_reshape_qkv_dense_tensorcore.cuda", [["TENSOR", [1, 8, 8, 1024], "float16"], ["TENSOR", [3072, 1024], "float16"], 1, 8, 8, 1024, 3, 8], {}], "config": {"index": 8487, "code_hash": null, "entity": [["block_row_warps", "ot", 1], ["block_col_warps", "ot", 1], ["warp_row_tiles", "ot", 2], ["warp_col_tiles", "ot", 4], ["chunk", "ot", 1], ["offset", "ot", 0], ["offsetCS", "ot", 8], ["vec", "ot", 4], ["wmma_m", "ot", 16]]}, "result": [[3.9036130999999995e-05], 0, 1.1131384372711182, 1652116270.8840134], "version": 0.2, "tvm_version": "0.8.0"}
{"input": ["cuda -keys=cuda,gpu -max_num_threads=1024 -thread_warp_size=32", "fused_roll_reshape_permute_reshape_qkv_dense_tensorcore.cuda", [["TENSOR", [1, 8, 8, 1024], "float16"], ["TENSOR", [3072, 1024], "float16"], 1, 8, 8, 1024, 3, 8], {}], "config": {"index": 9833, "code_hash": null, "entity": [["block_row_warps", "ot", 4], ["block_col_warps", "ot", 2], ["warp_row_tiles", "ot", 1], ["warp_col_tiles", "ot", 2], ["chunk", "ot", 2], ["offset", "ot", 0], ["offsetCS", "ot", 8], ["vec", "ot", 8], ["wmma_m", "ot", 16]]}, "result": [[2.7177873000000002e-05], 0, 1.191173791885376, 1652116271.4577029], "version": 0.2, "tvm_version": "0.8.0"}
{"input": ["cuda -keys=cuda,gpu -max_num_threads=1024 -thread_warp_size=32", "fused_roll_reshape_permute_reshape_qkv_dense_tensorcore.cuda", [["TENSOR", [1, 8, 8, 1024], "float16"], ["TENSOR", [3072, 1024], "float16"], 1, 8, 8, 1024, 3, 8], {}], "config": {"index": 10937, "code_hash": null, "entity": [["block_row_warps", "ot", 4], ["block_col_warps", "ot", 1], ["warp_row_tiles", "ot", 1], ["warp_col_tiles", "ot", 1], ["chunk", "ot", 8], ["offset", "ot", 8], ["offsetCS", "ot", 0], ["vec", "ot", 1], ["wmma_m", "ot", 8]]}, "result": [[1.3942634e-05], 0, 1.2037992477416992, 1652116272.596051], "version": 0.2, "tvm_version": "0.8.0"}
{"input": ["cuda -keys=cuda,gpu -max_num_threads=1024 -thread_warp_size=32", "fused_roll_reshape_permute_reshape_qkv_dense_tensorcore.cuda", [["TENSOR", [1, 8, 8, 1024], "float16"], ["TENSOR", [3072, 1024], "float16"], 1, 8, 8, 1024, 3, 8], {}], "config": {"index": 10893, "code_hash": null, "entity": [["block_row_warps", "ot", 1], ["block_col_warps", "ot", 2], ["warp_row_tiles", "ot", 2], ["warp_col_tiles", "ot", 2], ["chunk", "ot", 4], ["offset", "ot", 8], ["offsetCS", "ot", 0], ["vec", "ot", 1], ["wmma_m", "ot", 8]]}, "result": [[4.4916705000000003e-05], 0, 1.220597267150879, 1652116273.2592638], "version": 0.2, "tvm_version": "0.8.0"}
{"input": ["cuda -keys=cuda,gpu -max_num_threads=1024 -thread_warp_size=32", "fused_roll_reshape_permute_reshape_qkv_dense_tensorcore.cuda", [["TENSOR", [1, 8, 8, 1024], "float16"], ["TENSOR", [3072, 1024], "float16"], 1, 8, 8, 1024, 3, 8], {}], "config": {"index": 13890, "code_hash": null, "entity": [["block_row_warps", "ot", 1], ["block_col_warps", "ot", 2], ["warp_row_tiles", "ot", 2], ["warp_col_tiles", "ot", 2], ["chunk", "ot", 8], ["offset", "ot", 0], ["offsetCS", "ot", 8], ["vec", "ot", 4], ["wmma_m", "ot", 8]]}, "result": [[4.9425066e-05], 0, 1.3986148834228516, 1652116274.5500283], "version": 0.2, "tvm_version": "0.8.0"}
{"input": ["cuda -keys=cuda,gpu -max_num_threads=1024 -thread_warp_size=32", "fused_roll_reshape_permute_reshape_qkv_dense_tensorcore.cuda", [["TENSOR", [1, 8, 8, 1024], "float16"], ["TENSOR", [3072, 1024], "float16"], 1, 8, 8, 1024, 3, 8], {}], "config": {"index": 8289, "code_hash": null, "entity": [["block_row_warps", "ot", 1], ["block_col_warps", "ot", 1], ["warp_row_tiles", "ot", 1], ["warp_col_tiles", "ot", 2], ["chunk", "ot", 4], ["offset", "ot", 8], ["offsetCS", "ot", 0], ["vec", "ot", 4], ["wmma_m", "ot", 16]]}, "result": [[1.3834898e-05], 0, 1.1580893993377686, 1652116275.8209581], "version": 0.2, "tvm_version": "0.8.0"}
{"input": ["cuda -keys=cuda,gpu -max_num_threads=1024 -thread_warp_size=32", "fused_roll_reshape_permute_reshape_qkv_dense_tensorcore.cuda", [["TENSOR", [1, 8, 8, 1024], "float16"], ["TENSOR", [3072, 1024], "float16"], 1, 8, 8, 1024, 3, 8], {}], "config": {"index": 4335, "code_hash": null, "entity": [["block_row_warps", "ot", 1], ["block_col_warps", "ot", 4], ["warp_row_tiles", "ot", 2], ["warp_col_tiles", "ot", 2], ["chunk", "ot", 2], ["offset", "ot", 8], ["offsetCS", "ot", 0], ["vec", "ot", 8], ["wmma_m", "ot", 32]]}, "result": [[3.4819045e-05], 0, 1.1124672889709473, 1652116277.0633228], "version": 0.2, "tvm_version": "0.8.0"}
{"input": ["cuda -keys=cuda,gpu -max_num_threads=1024 -thread_warp_size=32", "fused_roll_reshape_permute_reshape_qkv_dense_tensorcore.cuda", [["TENSOR", [1, 8, 8, 1024], "float16"], ["TENSOR", [3072, 1024], "float16"], 1, 8, 8, 1024, 3, 8], {}], "config": {"index": 8634, "code_hash": null, "entity": [["block_row_warps", "ot", 1], ["block_col_warps", "ot", 2], ["warp_row_tiles", "ot", 4], ["warp_col_tiles", "ot", 2], ["chunk", "ot", 4], ["offset", "ot", 0], ["offsetCS", "ot", 8], ["vec", "ot", 4], ["wmma_m", "ot", 16]]}, "result": [[5.1491531e-05], 0, 1.0781564712524414, 1652116278.9533043], "version": 0.2, "tvm_version": "0.8.0"}
{"input": ["cuda -keys=cuda,gpu -max_num_threads=1024 -thread_warp_size=32", "fused_roll_reshape_permute_reshape_qkv_dense_tensorcore.cuda", [["TENSOR", [1, 8, 8, 1024], "float16"], ["TENSOR", [3072, 1024], "float16"], 1, 8, 8, 1024, 3, 8], {}], "config": {"index": 8602, "code_hash": null, "entity": [["block_row_warps", "ot", 2], ["block_col_warps", "ot", 4], ["warp_row_tiles", "ot", 2], ["warp_col_tiles", "ot", 1], ["chunk", "ot", 4], ["offset", "ot", 0], ["offsetCS", "ot", 8], ["vec", "ot", 4], ["wmma_m", "ot", 16]]}, "result": [[6.707268399999999e-05], 0, 1.151292324066162, 1652116279.6877918], "version": 0.2, "tvm_version": "0.8.0"}
{"input": ["cuda -keys=cuda,gpu -max_num_threads=1024 -thread_warp_size=32", "fused_roll_reshape_permute_reshape_qkv_dense_tensorcore.cuda", [["TENSOR", [1, 8, 8, 1024], "float16"], ["TENSOR", [3072, 1024], "float16"], 1, 8, 8, 1024, 3, 8], {}], "config": {"index": 9778, "code_hash": null, "entity": [["block_row_warps", "ot", 2], ["block_col_warps", "ot", 2], ["warp_row_tiles", "ot", 1], ["warp_col_tiles", "ot", 4], ["chunk", "ot", 1], ["offset", "ot", 0], ["offsetCS", "ot", 8], ["vec", "ot", 8], ["wmma_m", "ot", 16]]}, "result": [[5.3675273e-05], 0, 1.0363008975982666, 1652116280.939968], "version": 0.2, "tvm_version": "0.8.0"}
{"input": ["cuda -keys=cuda,gpu -max_num_threads=1024 -thread_warp_size=32", "fused_roll_reshape_permute_reshape_qkv_dense_tensorcore.cuda", [["TENSOR", [1, 8, 8, 1024], "float16"], ["TENSOR", [3072, 1024], "float16"], 1, 8, 8, 1024, 3, 8], {}], "config": {"index": 7767, "code_hash": null, "entity": [["block_row_warps", "ot", 1], ["block_col_warps", "ot", 1], ["warp_row_tiles", "ot", 4], ["warp_col_tiles", "ot", 4], ["chunk", "ot", 8], ["offset", "ot", 8], ["offsetCS", "ot", 8], ["vec", "ot", 2], ["wmma_m", "ot", 16]]}, "result": [[7.2050992e-05], 0, 1.3728086948394775, 1652116281.7566562], "version": 0.2, "tvm_version": "0.8.0"}
{"input": ["cuda -keys=cuda,gpu -max_num_threads=1024 -thread_warp_size=32", "fused_roll_reshape_permute_reshape_qkv_dense_tensorcore.cuda", [["TENSOR", [1, 8, 8, 1024], "float16"], ["TENSOR", [3072, 1024], "float16"], 1, 8, 8, 1024, 3, 8], {}], "config": {"index": 7659, "code_hash": null, "entity": [["block_row_warps", "ot", 1], ["block_col_warps", "ot", 1], ["warp_row_tiles", "ot", 4], ["warp_col_tiles", "ot", 2], ["chunk", "ot", 4], ["offset", "ot", 8], ["offsetCS", "ot", 8], ["vec", "ot", 2], ["wmma_m", "ot", 16]]}, "result": [[1.8051566000000002e-05], 0, 1.0848731994628906, 1652116282.371193], "version": 0.2, "tvm_version": "0.8.0"}
{"input": ["cuda -keys=cuda,gpu -max_num_threads=1024 -thread_warp_size=32", "fused_roll_reshape_permute_reshape_qkv_dense_tensorcore.cuda", [["TENSOR", [1, 8, 8, 1024], "float16"], ["TENSOR", [3072, 1024], "float16"], 1, 8, 8, 1024, 3, 8], {}], "config": {"index": 5055, "code_hash": null, "entity": [["block_row_warps", "ot", 1], ["block_col_warps", "ot", 4], ["warp_row_tiles", "ot", 1], ["warp_col_tiles", "ot", 2], ["chunk", "ot", 4], ["offset", "ot", 8], ["offsetCS", "ot", 8], ["vec", "ot", 8], ["wmma_m", "ot", 32]]}, "result": [[2.1616069e-05], 0, 0.9527509212493896, 1652116283.5584445], "version": 0.2, "tvm_version": "0.8.0"}
{"input": ["cuda -keys=cuda,gpu -max_num_threads=1024 -thread_warp_size=32", "fused_roll_reshape_permute_reshape_qkv_dense_tensorcore.cuda", [["TENSOR", [1, 8, 8, 1024], "float16"], ["TENSOR", [3072, 1024], "float16"], 1, 8, 8, 1024, 3, 8], {}], "config": {"index": 7943, "code_hash": null, "entity": [["block_row_warps", "ot", 4], ["block_col_warps", "ot", 2], ["warp_row_tiles", "ot", 1], ["warp_col_tiles", "ot", 1], ["chunk", "ot", 4], ["offset", "ot", 0], ["offsetCS", "ot", 0], ["vec", "ot", 4], ["wmma_m", "ot", 16]]}, "result": [[5.6837582e-05], 0, 1.2707152366638184, 1652116285.0771098], "version": 0.2, "tvm_version": "0.8.0"}
{"input": ["cuda -keys=cuda,gpu -max_num_threads=1024 -thread_warp_size=32", "fused_roll_reshape_permute_reshape_qkv_dense_tensorcore.cuda", [["TENSOR", [1, 8, 8, 1024], "float16"], ["TENSOR", [3072, 1024], "float16"], 1, 8, 8, 1024, 3, 8], {}], "config": {"index": 2424, "code_hash": null, "entity": [["block_row_warps", "ot", 1], ["block_col_warps", "ot", 2], ["warp_row_tiles", "ot", 4], ["warp_col_tiles", "ot", 4], ["chunk", "ot", 2], ["offset", "ot", 8], ["offsetCS", "ot", 8], ["vec", "ot", 2], ["wmma_m", "ot", 32]]}, "result": [[2.2142488e-05], 0, 1.0207507610321045, 1652116285.6929505], "version": 0.2, "tvm_version": "0.8.0"}
{"input": ["cuda -keys=cuda,gpu -max_num_threads=1024 -thread_warp_size=32", "fused_roll_reshape_permute_reshape_qkv_dense_tensorcore.cuda", [["TENSOR", [1, 8, 8, 1024], "float16"], ["TENSOR", [3072, 1024], "float16"], 1, 8, 8, 1024, 3, 8], {}], "config": {"index": 14458, "code_hash": null, "entity": [["block_row_warps", "ot", 2], ["block_col_warps", "ot", 2], ["warp_row_tiles", "ot", 2], ["warp_col_tiles", "ot", 2], ["chunk", "ot", 4], ["offset", "ot", 0], ["offsetCS", "ot", 0], ["vec", "ot", 8], ["wmma_m", "ot", 8]]}, "result": [[6.6636785e-05], 0, 1.1722004413604736, 1652116288.4262567], "version": 0.2, "tvm_version": "0.8.0"}
{"input": ["cuda -keys=cuda,gpu -max_num_threads=1024 -thread_warp_size=32", "fused_roll_reshape_permute_reshape_qkv_dense_tensorcore.cuda", [["TENSOR", [1, 8, 8, 1024], "float16"], ["TENSOR", [3072, 1024], "float16"], 1, 8, 8, 1024, 3, 8], {}], "config": {"index": 14508, "code_hash": null, "entity": [["block_row_warps", "ot", 1], ["block_col_warps", "ot", 1], ["warp_row_tiles", "ot", 2], ["warp_col_tiles", "ot", 1], ["chunk", "ot", 8], ["offset", "ot", 0], ["offsetCS", "ot", 0], ["vec", "ot", 8], ["wmma_m", "ot", 8]]}, "result": [[5.5316572e-05], 0, 1.0812792778015137, 1652116290.959139], "version": 0.2, "tvm_version": "0.8.0"}
{"input": ["cuda -keys=cuda,gpu -max_num_threads=1024 -thread_warp_size=32", "fused_roll_reshape_permute_reshape_qkv_dense_tensorcore.cuda", [["TENSOR", [1, 8, 8, 1024], "float16"], ["TENSOR", [3072, 1024], "float16"], 1, 8, 8, 1024, 3, 8], {}], "config": {"index": 2436, "code_hash": null, "entity": [["block_row_warps", "ot", 1], ["block_col_warps", "ot", 4], ["warp_row_tiles", "ot", 1], ["warp_col_tiles", "ot", 1], ["chunk", "ot", 4], ["offset", "ot", 8], ["offsetCS", "ot", 8], ["vec", "ot", 2], ["wmma_m", "ot", 32]]}, "result": [[1.2198289000000001e-05], 0, 0.9424505233764648, 1652116292.11493], "version": 0.2, "tvm_version": "0.8.0"}
{"input": ["cuda -keys=cuda,gpu -max_num_threads=1024 -thread_warp_size=32", "fused_roll_reshape_permute_reshape_qkv_dense_tensorcore.cuda", [["TENSOR", [1, 8, 8, 1024], "float16"], ["TENSOR", [3072, 1024], "float16"], 1, 8, 8, 1024, 3, 8], {}], "config": {"index": 11944, "code_hash": null, "entity": [["block_row_warps", "ot", 2], ["block_col_warps", "ot", 1], ["warp_row_tiles", "ot", 2], ["warp_col_tiles", "ot", 2], ["chunk", "ot", 8], ["offset", "ot", 0], ["offsetCS", "ot", 0], ["vec", "ot", 2], ["wmma_m", "ot", 8]]}, "result": [[4.590745600000001e-05], 0, 1.2397980690002441, 1652116293.999593], "version": 0.2, "tvm_version": "0.8.0"}
{"input": ["cuda -keys=cuda,gpu -max_num_threads=1024 -thread_warp_size=32", "fused_roll_reshape_permute_reshape_qkv_dense_tensorcore.cuda", [["TENSOR", [1, 8, 8, 1024], "float16"], ["TENSOR", [3072, 1024], "float16"], 1, 8, 8, 1024, 3, 8], {}], "config": {"index": 6967, "code_hash": null, "entity": [["block_row_warps", "ot", 2], ["block_col_warps", "ot", 1], ["warp_row_tiles", "ot", 1], ["warp_col_tiles", "ot", 1], ["chunk", "ot", 4], ["offset", "ot", 8], ["offsetCS", "ot", 0], ["vec", "ot", 2], ["wmma_m", "ot", 16]]}, "result": [[1.8972327000000002e-05], 0, 1.0691511631011963, 1652116294.5352893], "version": 0.2, "tvm_version": "0.8.0"}
{"input": ["cuda -keys=cuda,gpu -max_num_threads=1024 -thread_warp_size=32", "fused_roll_reshape_permute_reshape_qkv_dense_tensorcore.cuda", [["TENSOR", [1, 8, 8, 1024], "float16"], ["TENSOR", [3072, 1024], "float16"], 1, 8, 8, 1024, 3, 8], {}], "config": {"index": 2865, "code_hash": null, "entity": [["block_row_warps", "ot", 1], ["block_col_warps", "ot", 2], ["warp_row_tiles", "ot", 1], ["warp_col_tiles", "ot", 2], ["chunk", "ot", 8], ["offset", "ot", 0], ["offsetCS", "ot", 0], ["vec", "ot", 4], ["wmma_m", "ot", 32]]}, "result": [[4.4716365e-05], 0, 1.2983663082122803, 1652116296.6328325], "version": 0.2, "tvm_version": "0.8.0"}
{"input": ["cuda -keys=cuda,gpu -max_num_threads=1024 -thread_warp_size=32", "fused_roll_reshape_permute_reshape_qkv_dense_tensorcore.cuda", [["TENSOR", [1, 8, 8, 1024], "float16"], ["TENSOR", [3072, 1024], "float16"], 1, 8, 8, 1024, 3, 8], {}], "config": {"index": 4269, "code_hash": null, "entity": [["block_row_warps", "ot", 1], ["block_col_warps", "ot", 2], ["warp_row_tiles", "ot", 1], ["warp_col_tiles", "ot", 4], ["chunk", "ot", 1], ["offset", "ot", 8], ["offsetCS", "ot", 0], ["vec", "ot", 8], ["wmma_m", "ot", 32]]}, "result": [[3.8750889999999994e-05], 0, 1.0299975872039795, 1652116297.252829], "version": 0.2, "tvm_version": "0.8.0"}
{"input": ["cuda -keys=cuda,gpu -max_num_threads=1024 -thread_warp_size=32", "fused_roll_reshape_permute_reshape_qkv_dense_tensorcore.cuda", [["TENSOR", [1, 8, 8, 1024], "float16"], ["TENSOR", [3072, 1024], "float16"], 1, 8, 8, 1024, 3, 8], {}], "config": {"index": 15096, "code_hash": null, "entity": [["block_row_warps", "ot", 1], ["block_col_warps", "ot", 2], ["warp_row_tiles", "ot", 1], ["warp_col_tiles", "ot", 2], ["chunk", "ot", 4], ["offset", "ot", 0], ["offsetCS", "ot", 8], ["vec", "ot", 8], ["wmma_m", "ot", 8]]}, "result": [[5.9656726e-05], 0, 1.0460436344146729, 1652116297.9280431], "version": 0.2, "tvm_version": "0.8.0"}
{"input": ["cuda -keys=cuda,gpu -max_num_threads=1024 -thread_warp_size=32", "fused_roll_reshape_permute_reshape_qkv_dense_tensorcore.cuda", [["TENSOR", [1, 8, 8, 1024], "float16"], ["TENSOR", [3072, 1024], "float16"], 1, 8, 8, 1024, 3, 8], {}], "config": {"index": 5402, "code_hash": null, "entity": [["block_row_warps", "ot", 4], ["block_col_warps", "ot", 1], ["warp_row_tiles", "ot", 1], ["warp_col_tiles", "ot", 4], ["chunk", "ot", 4], ["offset", "ot", 0], ["offsetCS", "ot", 0], ["vec", "ot", 1], ["wmma_m", "ot", 16]]}, "result": [[5.0489081e-05], 0, 1.2191689014434814, 1652116299.2072613], "version": 0.2, "tvm_version": "0.8.0"}
{"input": ["cuda -keys=cuda,gpu -max_num_threads=1024 -thread_warp_size=32", "fused_roll_reshape_permute_reshape_qkv_dense_tensorcore.cuda", [["TENSOR", [1, 8, 8, 1024], "float16"], ["TENSOR", [3072, 1024], "float16"], 1, 8, 8, 1024, 3, 8], {}], "config": {"index": 12951, "code_hash": null, "entity": [["block_row_warps", "ot", 1], ["block_col_warps", "ot", 1], ["warp_row_tiles", "ot", 4], ["warp_col_tiles", "ot", 4], ["chunk", "ot", 8], ["offset", "ot", 8], ["offsetCS", "ot", 8], ["vec", "ot", 2], ["wmma_m", "ot", 8]]}, "result": [[9.4897484e-05], 0, 1.5280311107635498, 1652116300.6974764], "version": 0.2, "tvm_version": "0.8.0"}
{"input": ["cuda -keys=cuda,gpu -max_num_threads=1024 -thread_warp_size=32", "fused_roll_reshape_permute_reshape_qkv_dense_tensorcore.cuda", [["TENSOR", [1, 8, 8, 1024], "float16"], ["TENSOR", [3072, 1024], "float16"], 1, 8, 8, 1024, 3, 8], {}], "config": {"index": 5491, "code_hash": null, "entity": [["block_row_warps", "ot", 2], ["block_col_warps", "ot", 1], ["warp_row_tiles", "ot", 2], ["warp_col_tiles", "ot", 4], ["chunk", "ot", 8], ["offset", "ot", 0], ["offsetCS", "ot", 0], ["vec", "ot", 1], ["wmma_m", "ot", 16]]}, "result": [[5.8198726999999996e-05], 0, 1.2547738552093506, 1652116301.4262984], "version": 0.2, "tvm_version": "0.8.0"}
{"input": ["cuda -keys=cuda,gpu -max_num_threads=1024 -thread_warp_size=32", "fused_roll_reshape_permute_reshape_qkv_dense_tensorcore.cuda", [["TENSOR", [1, 8, 8, 1024], "float16"], ["TENSOR", [3072, 1024], "float16"], 1, 8, 8, 1024, 3, 8], {}], "config": {"index": 10656, "code_hash": null, "entity": [["block_row_warps", "ot", 1], ["block_col_warps", "ot", 1], ["warp_row_tiles", "ot", 4], ["warp_col_tiles", "ot", 2], ["chunk", "ot", 8], ["offset", "ot", 0], ["offsetCS", "ot", 0], ["vec", "ot", 1], ["wmma_m", "ot", 8]]}, "result": [[0.000111898761], 0, 1.377267599105835, 1652116304.1634855], "version": 0.2, "tvm_version": "0.8.0"}
{"input": ["cuda -keys=cuda,gpu -max_num_threads=1024 -thread_warp_size=32", "fused_roll_reshape_permute_reshape_qkv_dense_tensorcore.cuda", [["TENSOR", [1, 8, 8, 1024], "float16"], ["TENSOR", [3072, 1024], "float16"], 1, 8, 8, 1024, 3, 8], {}], "config": {"index": 8861, "code_hash": null, "entity": [["block_row_warps", "ot", 4], ["block_col_warps", "ot", 2], ["warp_row_tiles", "ot", 1], ["warp_col_tiles", "ot", 2], ["chunk", "ot", 2], ["offset", "ot", 8], ["offsetCS", "ot", 8], ["vec", "ot", 4], ["wmma_m", "ot", 16]]}, "result": [[1.8200774e-05], 0, 1.052628517150879, 1652116305.3093655], "version": 0.2, "tvm_version": "0.8.0"}
{"input": ["cuda -keys=cuda,gpu -max_num_threads=1024 -thread_warp_size=32", "fused_roll_reshape_permute_reshape_qkv_dense_tensorcore.cuda", [["TENSOR", [1, 8, 8, 1024], "float16"], ["TENSOR", [3072, 1024], "float16"], 1, 8, 8, 1024, 3, 8], {}], "config": {"index": 7602, "code_hash": null, "entity": [["block_row_warps", "ot", 1], ["block_col_warps", "ot", 4], ["warp_row_tiles", "ot", 2], ["warp_col_tiles", "ot", 4], ["chunk", "ot", 2], ["offset", "ot", 8], ["offsetCS", "ot", 8], ["vec", "ot", 2], ["wmma_m", "ot", 16]]}, "result": [[4.098734e-05], 0, 1.1894855499267578, 1652116305.9327455], "version": 0.2, "tvm_version": "0.8.0"}
{"input": ["cuda -keys=cuda,gpu -max_num_threads=1024 -thread_warp_size=32", "fused_roll_reshape_permute_reshape_qkv_dense_tensorcore.cuda", [["TENSOR", [1, 8, 8, 1024], "float16"], ["TENSOR", [3072, 1024], "float16"], 1, 8, 8, 1024, 3, 8], {}], "config": {"index": 1629, "code_hash": null, "entity": [["block_row_warps", "ot", 1], ["block_col_warps", "ot", 1], ["warp_row_tiles", "ot", 2], ["warp_col_tiles", "ot", 1], ["chunk", "ot", 1], ["offset", "ot", 8], ["offsetCS", "ot", 0], ["vec", "ot", 2], ["wmma_m", "ot", 32]]}, "result": [[3.8994669e-05], 0, 1.0967798233032227, 1652116307.1274157], "version": 0.2, "tvm_version": "0.8.0"}
{"input": ["cuda -keys=cuda,gpu -max_num_threads=1024 -thread_warp_size=32", "fused_roll_reshape_permute_reshape_qkv_dense_tensorcore.cuda", [["TENSOR", [1, 8, 8, 1024], "float16"], ["TENSOR", [3072, 1024], "float16"], 1, 8, 8, 1024, 3, 8], {}], "config": {"index": 13296, "code_hash": null, "entity": [["block_row_warps", "ot", 1], ["block_col_warps", "ot", 2], ["warp_row_tiles", "ot", 2], ["warp_col_tiles", "ot", 1], ["chunk", "ot", 1], ["offset", "ot", 8], ["offsetCS", "ot", 0], ["vec", "ot", 4], ["wmma_m", "ot", 8]]}, "result": [[5.0230372e-05], 0, 1.3022356033325195, 1652116308.0164695], "version": 0.2, "tvm_version": "0.8.0"}
{"input": ["cuda -keys=cuda,gpu -max_num_threads=1024 -thread_warp_size=32", "fused_roll_reshape_permute_reshape_qkv_dense_tensorcore.cuda", [["TENSOR", [1, 8, 8, 1024], "float16"], ["TENSOR", [3072, 1024], "float16"], 1, 8, 8, 1024, 3, 8], {}], "config": {"index": 10107, "code_hash": null, "entity": [["block_row_warps", "ot", 1], ["block_col_warps", "ot", 1], ["warp_row_tiles", "ot", 2], ["warp_col_tiles", "ot", 4], ["chunk", "ot", 1], ["offset", "ot", 8], ["offsetCS", "ot", 8], ["vec", "ot", 8], ["wmma_m", "ot", 16]]}, "result": [[3.268354e-05], 0, 0.9847228527069092, 1652116309.229091], "version": 0.2, "tvm_version": "0.8.0"}
{"input": ["cuda -keys=cuda,gpu -max_num_threads=1024 -thread_warp_size=32", "fused_roll_reshape_permute_reshape_qkv_dense_tensorcore.cuda", [["TENSOR", [1, 8, 8, 1024], "float16"], ["TENSOR", [3072, 1024], "float16"], 1, 8, 8, 1024, 3, 8], {}], "config": {"index": 1998, "code_hash": null, "entity": [["block_row_warps", "ot", 1], ["block_col_warps", "ot", 1], ["warp_row_tiles", "ot", 1], ["warp_col_tiles", "ot", 4], ["chunk", "ot", 1], ["offset", "ot", 0], ["offsetCS", "ot", 8], ["vec", "ot", 2], ["wmma_m", "ot", 32]]}, "result": [[2.5927341e-05], 0, 0.9430272579193115, 1652116310.407479], "version": 0.2, "tvm_version": "0.8.0"}
{"input": ["cuda -keys=cuda,gpu -max_num_threads=1024 -thread_warp_size=32", "fused_roll_reshape_permute_reshape_qkv_dense_tensorcore.cuda", [["TENSOR", [1, 8, 8, 1024], "float16"], ["TENSOR", [3072, 1024], "float16"], 1, 8, 8, 1024, 3, 8], {}], "config": {"index": 5564, "code_hash": null, "entity": [["block_row_warps", "ot", 4], ["block_col_warps", "ot", 1], ["warp_row_tiles", "ot", 1], ["warp_col_tiles", "ot", 4], ["chunk", "ot", 1], ["offset", "ot", 8], ["offsetCS", "ot", 0], ["vec", "ot", 1], ["wmma_m", "ot", 16]]}, "result": [[5.3404704000000005e-05], 0, 1.2090396881103516, 1652116328.274211], "version": 0.2, "tvm_version": "0.8.0"}
{"input": ["cuda -keys=cuda,gpu -max_num_threads=1024 -thread_warp_size=32", "fused_roll_reshape_permute_reshape_qkv_dense_tensorcore.cuda", [["TENSOR", [1, 8, 8, 1024], "float16"], ["TENSOR", [3072, 1024], "float16"], 1, 8, 8, 1024, 3, 8], {}], "config": {"index": 5815, "code_hash": null, "entity": [["block_row_warps", "ot", 2], ["block_col_warps", "ot", 1], ["warp_row_tiles", "ot", 2], ["warp_col_tiles", "ot", 4], ["chunk", "ot", 8], ["offset", "ot", 8], ["offsetCS", "ot", 0], ["vec", "ot", 1], ["wmma_m", "ot", 16]]}, "result": [[7.4792067e-05], 0, 1.5373013019561768, 1652116329.056985], "version": 0.2, "tvm_version": "0.8.0"}
{"input": ["cuda -keys=cuda,gpu -max_num_threads=1024 -thread_warp_size=32", "fused_roll_reshape_permute_reshape_qkv_dense_tensorcore.cuda", [["TENSOR", [1, 8, 8, 1024], "float16"], ["TENSOR", [3072, 1024], "float16"], 1, 8, 8, 1024, 3, 8], {}], "config": {"index": 5572, "code_hash": null, "entity": [["block_row_warps", "ot", 2], ["block_col_warps", "ot", 1], ["warp_row_tiles", "ot", 2], ["warp_col_tiles", "ot", 4], ["chunk", "ot", 1], ["offset", "ot", 8], ["offsetCS", "ot", 0], ["vec", "ot", 1], ["wmma_m", "ot", 16]]}, "result": [[3.8065964e-05], 0, 1.3313517570495605, 1652116329.670656], "version": 0.2, "tvm_version": "0.8.0"}
{"input": ["cuda -keys=cuda,gpu -max_num_threads=1024 -thread_warp_size=32", "fused_roll_reshape_permute_reshape_qkv_dense_tensorcore.cuda", [["TENSOR", [1, 8, 8, 1024], "float16"], ["TENSOR", [3072, 1024], "float16"], 1, 8, 8, 1024, 3, 8], {}], "config": {"index": 6787, "code_hash": null, "entity": [["block_row_warps", "ot", 2], ["block_col_warps", "ot", 1], ["warp_row_tiles", "ot", 2], ["warp_col_tiles", "ot", 4], ["chunk", "ot", 8], ["offset", "ot", 0], ["offsetCS", "ot", 0], ["vec", "ot", 2], ["wmma_m", "ot", 16]]}, "result": [[2.8065100000000003e-05], 0, 1.5239369869232178, 1652116330.355727], "version": 0.2, "tvm_version": "0.8.0"}
{"input": ["cuda -keys=cuda,gpu -max_num_threads=1024 -thread_warp_size=32", "fused_roll_reshape_permute_reshape_qkv_dense_tensorcore.cuda", [["TENSOR", [1, 8, 8, 1024], "float16"], ["TENSOR", [3072, 1024], "float16"], 1, 8, 8, 1024, 3, 8], {}], "config": {"index": 6625, "code_hash": null, "entity": [["block_row_warps", "ot", 2], ["block_col_warps", "ot", 1], ["warp_row_tiles", "ot", 2], ["warp_col_tiles", "ot", 4], ["chunk", "ot", 2], ["offset", "ot", 0], ["offsetCS", "ot", 0], ["vec", "ot", 2], ["wmma_m", "ot", 16]]}, "result": [[2.8321504e-05], 0, 1.2230255603790283, 1652116330.9444816], "version": 0.2, "tvm_version": "0.8.0"}
{"input": ["cuda -keys=cuda,gpu -max_num_threads=1024 -thread_warp_size=32", "fused_roll_reshape_permute_reshape_qkv_dense_tensorcore.cuda", [["TENSOR", [1, 8, 8, 1024], "float16"], ["TENSOR", [3072, 1024], "float16"], 1, 8, 8, 1024, 3, 8], {}], "config": {"index": 6455, "code_hash": null, "entity": [["block_row_warps", "ot", 4], ["block_col_warps", "ot", 1], ["warp_row_tiles", "ot", 1], ["warp_col_tiles", "ot", 4], ["chunk", "ot", 8], ["offset", "ot", 8], ["offsetCS", "ot", 8], ["vec", "ot", 1], ["wmma_m", "ot", 16]]}, "result": [[1.5098248e-05], 0, 1.567023754119873, 1652116331.7179577], "version": 0.2, "tvm_version": "0.8.0"}
{"input": ["cuda -keys=cuda,gpu -max_num_threads=1024 -thread_warp_size=32", "fused_roll_reshape_permute_reshape_qkv_dense_tensorcore.cuda", [["TENSOR", [1, 8, 8, 1024], "float16"], ["TENSOR", [3072, 1024], "float16"], 1, 8, 8, 1024, 3, 8], {}], "config": {"index": 5734, "code_hash": null, "entity": [["block_row_warps", "ot", 2], ["block_col_warps", "ot", 1], ["warp_row_tiles", "ot", 2], ["warp_col_tiles", "ot", 4], ["chunk", "ot", 4], ["offset", "ot", 8], ["offsetCS", "ot", 0], ["vec", "ot", 1], ["wmma_m", "ot", 16]]}, "result": [[3.6645475e-05], 0, 1.538804292678833, 1652116332.3992436], "version": 0.2, "tvm_version": "0.8.0"}
{"input": ["cuda -keys=cuda,gpu -max_num_threads=1024 -thread_warp_size=32", "fused_roll_reshape_permute_reshape_qkv_dense_tensorcore.cuda", [["TENSOR", [1, 8, 8, 1024], "float16"], ["TENSOR", [3072, 1024], "float16"], 1, 8, 8, 1024, 3, 8], {}], "config": {"index": 7273, "code_hash": null, "entity": [["block_row_warps", "ot", 2], ["block_col_warps", "ot", 1], ["warp_row_tiles", "ot", 2], ["warp_col_tiles", "ot", 4], ["chunk", "ot", 2], ["offset", "ot", 0], ["offsetCS", "ot", 8], ["vec", "ot", 2], ["wmma_m", "ot", 16]]}, "result": [[2.7894798e-05], 0, 1.1554620265960693, 1652116332.9941366], "version": 0.2, "tvm_version": "0.8.0"}
{"input": ["cuda -keys=cuda,gpu -max_num_threads=1024 -thread_warp_size=32", "fused_roll_reshape_permute_reshape_qkv_dense_tensorcore.cuda", [["TENSOR", [1, 8, 8, 1024], "float16"], ["TENSOR", [3072, 1024], "float16"], 1, 8, 8, 1024, 3, 8], {}], "config": {"index": 7435, "code_hash": null, "entity": [["block_row_warps", "ot", 2], ["block_col_warps", "ot", 1], ["warp_row_tiles", "ot", 2], ["warp_col_tiles", "ot", 4], ["chunk", "ot", 8], ["offset", "ot", 0], ["offsetCS", "ot", 8], ["vec", "ot", 2], ["wmma_m", "ot", 16]]}, "result": [[2.9592841e-05], 0, 1.409235954284668, 1652116333.6451733], "version": 0.2, "tvm_version": "0.8.0"}
{"input": ["cuda -keys=cuda,gpu -max_num_threads=1024 -thread_warp_size=32", "fused_roll_reshape_permute_reshape_qkv_dense_tensorcore.cuda", [["TENSOR", [1, 8, 8, 1024], "float16"], ["TENSOR", [3072, 1024], "float16"], 1, 8, 8, 1024, 3, 8], {}], "config": {"index": 7184, "code_hash": null, "entity": [["block_row_warps", "ot", 4], ["block_col_warps", "ot", 1], ["warp_row_tiles", "ot", 1], ["warp_col_tiles", "ot", 4], ["chunk", "ot", 1], ["offset", "ot", 0], ["offsetCS", "ot", 8], ["vec", "ot", 2], ["wmma_m", "ot", 16]]}, "result": [[2.6920106e-05], 0, 1.1333768367767334, 1652116334.2719603], "version": 0.2, "tvm_version": "0.8.0"}
{"input": ["cuda -keys=cuda,gpu -max_num_threads=1024 -thread_warp_size=32", "fused_roll_reshape_permute_reshape_qkv_dense_tensorcore.cuda", [["TENSOR", [1, 8, 8, 1024], "float16"], ["TENSOR", [3072, 1024], "float16"], 1, 8, 8, 1024, 3, 8], {}], "config": {"index": 7346, "code_hash": null, "entity": [["block_row_warps", "ot", 4], ["block_col_warps", "ot", 1], ["warp_row_tiles", "ot", 1], ["warp_col_tiles", "ot", 4], ["chunk", "ot", 4], ["offset", "ot", 0], ["offsetCS", "ot", 8], ["vec", "ot", 2], ["wmma_m", "ot", 16]]}, "result": [[3.9172011999999996e-05], 0, 1.181147813796997, 1652116334.881837], "version": 0.2, "tvm_version": "0.8.0"}
{"input": ["cuda -keys=cuda,gpu -max_num_threads=1024 -thread_warp_size=32", "fused_roll_reshape_permute_reshape_qkv_dense_tensorcore.cuda", [["TENSOR", [1, 8, 8, 1024], "float16"], ["TENSOR", [3072, 1024], "float16"], 1, 8, 8, 1024, 3, 8], {}], "config": {"index": 7427, "code_hash": null, "entity": [["block_row_warps", "ot", 4], ["block_col_warps", "ot", 1], ["warp_row_tiles", "ot", 1], ["warp_col_tiles", "ot", 4], ["chunk", "ot", 8], ["offset", "ot", 0], ["offsetCS", "ot", 8], ["vec", "ot", 2], ["wmma_m", "ot", 16]]}, "result": [[3.6257257e-05], 0, 1.255688190460205, 1652116335.5154858], "version": 0.2, "tvm_version": "0.8.0"}
{"input": ["cuda -keys=cuda,gpu -max_num_threads=1024 -thread_warp_size=32", "fused_roll_reshape_permute_reshape_qkv_dense_tensorcore.cuda", [["TENSOR", [1, 8, 8, 1024], "float16"], ["TENSOR", [3072, 1024], "float16"], 1, 8, 8, 1024, 3, 8], {}], "config": {"index": 7103, "code_hash": null, "entity": [["block_row_warps", "ot", 4], ["block_col_warps", "ot", 1], ["warp_row_tiles", "ot", 1], ["warp_col_tiles", "ot", 4], ["chunk", "ot", 8], ["offset", "ot", 8], ["offsetCS", "ot", 0], ["vec", "ot", 2], ["wmma_m", "ot", 16]]}, "result": [[1.2149373000000002e-05], 0, 1.414083480834961, 1652116336.288876], "version": 0.2, "tvm_version": "0.8.0"}
{"input": ["cuda -keys=cuda,gpu -max_num_threads=1024 -thread_warp_size=32", "fused_roll_reshape_permute_reshape_qkv_dense_tensorcore.cuda", [["TENSOR", [1, 8, 8, 1024], "float16"], ["TENSOR", [3072, 1024], "float16"], 1, 8, 8, 1024, 3, 8], {}], "config": {"index": 6212, "code_hash": null, "entity": [["block_row_warps", "ot", 4], ["block_col_warps", "ot", 1], ["warp_row_tiles", "ot", 1], ["warp_col_tiles", "ot", 4], ["chunk", "ot", 1], ["offset", "ot", 8], ["offsetCS", "ot", 8], ["vec", "ot", 1], ["wmma_m", "ot", 16]]}, "result": [[2.6114478999999998e-05], 0, 1.2479143142700195, 1652116336.8590596], "version": 0.2, "tvm_version": "0.8.0"}
{"input": ["cuda -keys=cuda,gpu -max_num_threads=1024 -thread_warp_size=32", "fused_roll_reshape_permute_reshape_qkv_dense_tensorcore.cuda", [["TENSOR", [1, 8, 8, 1024], "float16"], ["TENSOR", [3072, 1024], "float16"], 1, 8, 8, 1024, 3, 8], {}], "config": {"index": 6374, "code_hash": null, "entity": [["block_row_warps", "ot", 4], ["block_col_warps", "ot", 1], ["warp_row_tiles", "ot", 1], ["warp_col_tiles", "ot", 4], ["chunk", "ot", 4], ["offset", "ot", 8], ["offsetCS", "ot", 8], ["vec", "ot", 1], ["wmma_m", "ot", 16]]}, "result": [[2.880088e-05], 0, 1.2113723754882812, 1652116337.447747], "version": 0.2, "tvm_version": "0.8.0"}
{"input": ["cuda -keys=cuda,gpu -max_num_threads=1024 -thread_warp_size=32", "fused_roll_reshape_permute_reshape_qkv_dense_tensorcore.cuda", [["TENSOR", [1, 8, 8, 1024], "float16"], ["TENSOR", [3072, 1024], "float16"], 1, 8, 8, 1024, 3, 8], {}], "config": {"index": 7597, "code_hash": null, "entity": [["block_row_warps", "ot", 2], ["block_col_warps", "ot", 1], ["warp_row_tiles", "ot", 2], ["warp_col_tiles", "ot", 4], ["chunk", "ot", 2], ["offset", "ot", 8], ["offsetCS", "ot", 8], ["vec", "ot", 2], ["wmma_m", "ot", 16]]}, "result": [[2.2830632999999998e-05], 0, 1.1742393970489502, 1652116338.0645676], "version": 0.2, "tvm_version": "0.8.0"}
{"input": ["cuda -keys=cuda,gpu -max_num_threads=1024 -thread_warp_size=32", "fused_roll_reshape_permute_reshape_qkv_dense_tensorcore.cuda", [["TENSOR", [1, 8, 8, 1024], "float16"], ["TENSOR", [3072, 1024], "float16"], 1, 8, 8, 1024, 3, 8], {}], "config": {"index": 8974, "code_hash": null, "entity": [["block_row_warps", "ot", 2], ["block_col_warps", "ot", 1], ["warp_row_tiles", "ot", 2], ["warp_col_tiles", "ot", 4], ["chunk", "ot", 4], ["offset", "ot", 8], ["offsetCS", "ot", 8], ["vec", "ot", 4], ["wmma_m", "ot", 16]]}, "result": [[1.7467653e-05], 0, 1.2684228420257568, 1652116338.6950662], "version": 0.2, "tvm_version": "0.8.0"}
{"input": ["cuda -keys=cuda,gpu -max_num_threads=1024 -thread_warp_size=32", "fused_roll_reshape_permute_reshape_qkv_dense_tensorcore.cuda", [["TENSOR", [1, 8, 8, 1024], "float16"], ["TENSOR", [3072, 1024], "float16"], 1, 8, 8, 1024, 3, 8], {}], "config": {"index": 9136, "code_hash": null, "entity": [["block_row_warps", "ot", 2], ["block_col_warps", "ot", 1], ["warp_row_tiles", "ot", 2], ["warp_col_tiles", "ot", 4], ["chunk", "ot", 1], ["offset", "ot", 0], ["offsetCS", "ot", 0], ["vec", "ot", 8], ["wmma_m", "ot", 16]]}, "result": [[3.3031734e-05], 0, 1.1693470478057861, 1652116339.2940555], "version": 0.2, "tvm_version": "0.8.0"}
{"input": ["cuda -keys=cuda,gpu -max_num_threads=1024 -thread_warp_size=32", "fused_roll_reshape_permute_reshape_qkv_dense_tensorcore.cuda", [["TENSOR", [1, 8, 8, 1024], "float16"], ["TENSOR", [3072, 1024], "float16"], 1, 8, 8, 1024, 3, 8], {}], "config": {"index": 9533, "code_hash": null, "entity": [["block_row_warps", "ot", 4], ["block_col_warps", "ot", 1], ["warp_row_tiles", "ot", 1], ["warp_col_tiles", "ot", 4], ["chunk", "ot", 2], ["offset", "ot", 8], ["offsetCS", "ot", 0], ["vec", "ot", 8], ["wmma_m", "ot", 16]]}, "result": [[2.0624426e-05], 0, 1.120079755783081, 1652116339.902349], "version": 0.2, "tvm_version": "0.8.0"}
{"input": ["cuda -keys=cuda,gpu -max_num_threads=1024 -thread_warp_size=32", "fused_roll_reshape_permute_reshape_qkv_dense_tensorcore.cuda", [["TENSOR", [1, 8, 8, 1024], "float16"], ["TENSOR", [3072, 1024], "float16"], 1, 8, 8, 1024, 3, 8], {}], "config": {"index": 7759, "code_hash": null, "entity": [["block_row_warps", "ot", 2], ["block_col_warps", "ot", 1], ["warp_row_tiles", "ot", 2], ["warp_col_tiles", "ot", 4], ["chunk", "ot", 8], ["offset", "ot", 8], ["offsetCS", "ot", 8], ["vec", "ot", 2], ["wmma_m", "ot", 16]]}, "result": [[1.5405820000000002e-05], 0, 1.4135453701019287, 1652116340.5019183], "version": 0.2, "tvm_version": "0.8.0"}
{"input": ["cuda -keys=cuda,gpu -max_num_threads=1024 -thread_warp_size=32", "fused_roll_reshape_permute_reshape_qkv_dense_tensorcore.cuda", [["TENSOR", [1, 8, 8, 1024], "float16"], ["TENSOR", [3072, 1024], "float16"], 1, 8, 8, 1024, 3, 8], {}], "config": {"index": 8326, "code_hash": null, "entity": [["block_row_warps", "ot", 2], ["block_col_warps", "ot", 1], ["warp_row_tiles", "ot", 2], ["warp_col_tiles", "ot", 4], ["chunk", "ot", 4], ["offset", "ot", 8], ["offsetCS", "ot", 0], ["vec", "ot", 4], ["wmma_m", "ot", 16]]}, "result": [[1.5922995e-05], 0, 1.1713027954101562, 1652116341.062771], "version": 0.2, "tvm_version": "0.8.0"}
{"input": ["cuda -keys=cuda,gpu -max_num_threads=1024 -thread_warp_size=32", "fused_roll_reshape_permute_reshape_qkv_dense_tensorcore.cuda", [["TENSOR", [1, 8, 8, 1024], "float16"], ["TENSOR", [3072, 1024], "float16"], 1, 8, 8, 1024, 3, 8], {}], "config": {"index": 7921, "code_hash": null, "entity": [["block_row_warps", "ot", 2], ["block_col_warps", "ot", 1], ["warp_row_tiles", "ot", 2], ["warp_col_tiles", "ot", 4], ["chunk", "ot", 2], ["offset", "ot", 0], ["offsetCS", "ot", 0], ["vec", "ot", 4], ["wmma_m", "ot", 16]]}, "result": [[4.3995831e-05], 0, 1.2477543354034424, 1652116341.7422304], "version": 0.2, "tvm_version": "0.8.0"}
{"input": ["cuda -keys=cuda,gpu -max_num_threads=1024 -thread_warp_size=32", "fused_roll_reshape_permute_reshape_qkv_dense_tensorcore.cuda", [["TENSOR", [1, 8, 8, 1024], "float16"], ["TENSOR", [3072, 1024], "float16"], 1, 8, 8, 1024, 3, 8], {}], "config": {"index": 9460, "code_hash": null, "entity": [["block_row_warps", "ot", 2], ["block_col_warps", "ot", 1], ["warp_row_tiles", "ot", 2], ["warp_col_tiles", "ot", 4], ["chunk", "ot", 1], ["offset", "ot", 8], ["offsetCS", "ot", 0], ["vec", "ot", 8], ["wmma_m", "ot", 16]]}, "result": [[3.015985e-05], 0, 1.215724229812622, 1652116342.3300002], "version": 0.2, "tvm_version": "0.8.0"}
{"input": ["cuda -keys=cuda,gpu -max_num_threads=1024 -thread_warp_size=32", "fused_roll_reshape_permute_reshape_qkv_dense_tensorcore.cuda", [["TENSOR", [1, 8, 8, 1024], "float16"], ["TENSOR", [3072, 1024], "float16"], 1, 8, 8, 1024, 3, 8], {}], "config": {"index": 7751, "code_hash": null, "entity": [["block_row_warps", "ot", 4], ["block_col_warps", "ot", 1], ["warp_row_tiles", "ot", 1], ["warp_col_tiles", "ot", 4], ["chunk", "ot", 8], ["offset", "ot", 8], ["offsetCS", "ot", 8], ["vec", "ot", 2], ["wmma_m", "ot", 16]]}, "result": [[1.1995234e-05], 0, 1.4831490516662598, 1652116343.1331758], "version": 0.2, "tvm_version": "0.8.0"}
{"input": ["cuda -keys=cuda,gpu -max_num_threads=1024 -thread_warp_size=32", "fused_roll_reshape_permute_reshape_qkv_dense_tensorcore.cuda", [["TENSOR", [1, 8, 8, 1024], "float16"], ["TENSOR", [3072, 1024], "float16"], 1, 8, 8, 1024, 3, 8], {}], "config": {"index": 11162, "code_hash": null, "entity": [["block_row_warps", "ot", 4], ["block_col_warps", "ot", 1], ["warp_row_tiles", "ot", 2], ["warp_col_tiles", "ot", 4], ["chunk", "ot", 2], ["offset", "ot", 0], ["offsetCS", "ot", 8], ["vec", "ot", 1], ["wmma_m", "ot", 8]]}, "result": [[5.018041199999999e-05], 0, 1.3172731399536133, 1652116343.8355932], "version": 0.2, "tvm_version": "0.8.0"}
{"input": ["cuda -keys=cuda,gpu -max_num_threads=1024 -thread_warp_size=32", "fused_roll_reshape_permute_reshape_qkv_dense_tensorcore.cuda", [["TENSOR", [1, 8, 8, 1024], "float16"], ["TENSOR", [3072, 1024], "float16"], 1, 8, 8, 1024, 3, 8], {}], "config": {"index": 8731, "code_hash": null, "entity": [["block_row_warps", "ot", 2], ["block_col_warps", "ot", 1], ["warp_row_tiles", "ot", 2], ["warp_col_tiles", "ot", 4], ["chunk", "ot", 8], ["offset", "ot", 0], ["offsetCS", "ot", 8], ["vec", "ot", 4], ["wmma_m", "ot", 16]]}, "result": [[3.3662525999999996e-05], 0, 1.400583028793335, 1652116344.488275], "version": 0.2, "tvm_version": "0.8.0"}
{"input": ["cuda -keys=cuda,gpu -max_num_threads=1024 -thread_warp_size=32", "fused_roll_reshape_permute_reshape_qkv_dense_tensorcore.cuda", [["TENSOR", [1, 8, 8, 1024], "float16"], ["TENSOR", [3072, 1024], "float16"], 1, 8, 8, 1024, 3, 8], {}], "config": {"index": 7840, "code_hash": null, "entity": [["block_row_warps", "ot", 2], ["block_col_warps", "ot", 1], ["warp_row_tiles", "ot", 2], ["warp_col_tiles", "ot", 4], ["chunk", "ot", 1], ["offset", "ot", 0], ["offsetCS", "ot", 0], ["vec", "ot", 4], ["wmma_m", "ot", 16]]}, "result": [[2.7697507000000003e-05], 0, 1.1411128044128418, 1652116345.0658684], "version": 0.2, "tvm_version": "0.8.0"}
{"input": ["cuda -keys=cuda,gpu -max_num_threads=1024 -thread_warp_size=32", "fused_roll_reshape_permute_reshape_qkv_dense_tensorcore.cuda", [["TENSOR", [1, 8, 8, 1024], "float16"], ["TENSOR", [3072, 1024], "float16"], 1, 8, 8, 1024, 3, 8], {}], "config": {"index": 7265, "code_hash": null, "entity": [["block_row_warps", "ot", 4], ["block_col_warps", "ot", 1], ["warp_row_tiles", "ot", 1], ["warp_col_tiles", "ot", 4], ["chunk", "ot", 2], ["offset", "ot", 0], ["offsetCS", "ot", 8], ["vec", "ot", 2], ["wmma_m", "ot", 16]]}, "result": [[2.6255763000000002e-05], 0, 1.2755086421966553, 1652116345.6718774], "version": 0.2, "tvm_version": "0.8.0"}
{"input": ["cuda -keys=cuda,gpu -max_num_threads=1024 -thread_warp_size=32", "fused_roll_reshape_permute_reshape_qkv_dense_tensorcore.cuda", [["TENSOR", [1, 8, 8, 1024], "float16"], ["TENSOR", [3072, 1024], "float16"], 1, 8, 8, 1024, 3, 8], {}], "config": {"index": 7022, "code_hash": null, "entity": [["block_row_warps", "ot", 4], ["block_col_warps", "ot", 1], ["warp_row_tiles", "ot", 1], ["warp_col_tiles", "ot", 4], ["chunk", "ot", 4], ["offset", "ot", 8], ["offsetCS", "ot", 0], ["vec", "ot", 2], ["wmma_m", "ot", 16]]}, "result": [[1.4598134999999999e-05], 0, 1.160555362701416, 1652116346.2090526], "version": 0.2, "tvm_version": "0.8.0"}
{"input": ["cuda -keys=cuda,gpu -max_num_threads=1024 -thread_warp_size=32", "fused_roll_reshape_permute_reshape_qkv_dense_tensorcore.cuda", [["TENSOR", [1, 8, 8, 1024], "float16"], ["TENSOR", [3072, 1024], "float16"], 1, 8, 8, 1024, 3, 8], {}], "config": {"index": 10181, "code_hash": null, "entity": [["block_row_warps", "ot", 4], ["block_col_warps", "ot", 1], ["warp_row_tiles", "ot", 1], ["warp_col_tiles", "ot", 4], ["chunk", "ot", 2], ["offset", "ot", 8], ["offsetCS", "ot", 8], ["vec", "ot", 8], ["wmma_m", "ot", 16]]}, "result": [[2.0131873e-05], 0, 1.139216661453247, 1652116346.7619781], "version": 0.2, "tvm_version": "0.8.0"}
{"input": ["cuda -keys=cuda,gpu -max_num_threads=1024 -thread_warp_size=32", "fused_roll_reshape_permute_reshape_qkv_dense_tensorcore.cuda", [["TENSOR", [1, 8, 8, 1024], "float16"], ["TENSOR", [3072, 1024], "float16"], 1, 8, 8, 1024, 3, 8], {}], "config": {"index": 8002, "code_hash": null, "entity": [["block_row_warps", "ot", 2], ["block_col_warps", "ot", 1], ["warp_row_tiles", "ot", 2], ["warp_col_tiles", "ot", 4], ["chunk", "ot", 4], ["offset", "ot", 0], ["offsetCS", "ot", 0], ["vec", "ot", 4], ["wmma_m", "ot", 16]]}, "result": [[4.1475347e-05], 0, 1.3935186862945557, 1652116347.441452], "version": 0.2, "tvm_version": "0.8.0"}
{"input": ["cuda -keys=cuda,gpu -max_num_threads=1024 -thread_warp_size=32", "fused_roll_reshape_permute_reshape_qkv_dense_tensorcore.cuda", [["TENSOR", [1, 8, 8, 1024], "float16"], ["TENSOR", [3072, 1024], "float16"], 1, 8, 8, 1024, 3, 8], {}], "config": {"index": 9128, "code_hash": null, "entity": [["block_row_warps", "ot", 4], ["block_col_warps", "ot", 1], ["warp_row_tiles", "ot", 1], ["warp_col_tiles", "ot", 4], ["chunk", "ot", 1], ["offset", "ot", 0], ["offsetCS", "ot", 0], ["vec", "ot", 8], ["wmma_m", "ot", 16]]}, "result": [[3.0680472e-05], 0, 1.1872797012329102, 1652116348.0579956], "version": 0.2, "tvm_version": "0.8.0"}
{"input": ["cuda -keys=cuda,gpu -max_num_threads=1024 -thread_warp_size=32", "fused_roll_reshape_permute_reshape_qkv_dense_tensorcore.cuda", [["TENSOR", [1, 8, 8, 1024], "float16"], ["TENSOR", [3072, 1024], "float16"], 1, 8, 8, 1024, 3, 8], {}], "config": {"index": 11324, "code_hash": null, "entity": [["block_row_warps", "ot", 4], ["block_col_warps", "ot", 1], ["warp_row_tiles", "ot", 2], ["warp_col_tiles", "ot", 4], ["chunk", "ot", 8], ["offset", "ot", 0], ["offsetCS", "ot", 8], ["vec", "ot", 1], ["wmma_m", "ot", 8]]}, "result": [[8.616209199999999e-05], 0, 1.6630947589874268, 1652116348.9051807], "version": 0.2, "tvm_version": "0.8.0"}
{"input": ["cuda -keys=cuda,gpu -max_num_threads=1024 -thread_warp_size=32", "fused_roll_reshape_permute_reshape_qkv_dense_tensorcore.cuda", [["TENSOR", [1, 8, 8, 1024], "float16"], ["TENSOR", [3072, 1024], "float16"], 1, 8, 8, 1024, 3, 8], {}], "config": {"index": 9379, "code_hash": null, "entity": [["block_row_warps", "ot", 2], ["block_col_warps", "ot", 1], ["warp_row_tiles", "ot", 2], ["warp_col_tiles", "ot", 4], ["chunk", "ot", 8], ["offset", "ot", 0], ["offsetCS", "ot", 0], ["vec", "ot", 8], ["wmma_m", "ot", 16]]}, "result": [[2.6704083e-05], 0, 1.3854925632476807, 1652116349.5823286], "version": 0.2, "tvm_version": "0.8.0"}
{"input": ["cuda -keys=cuda,gpu -max_num_threads=1024 -thread_warp_size=32", "fused_roll_reshape_permute_reshape_qkv_dense_tensorcore.cuda", [["TENSOR", [1, 8, 8, 1024], "float16"], ["TENSOR", [3072, 1024], "float16"], 1, 8, 8, 1024, 3, 8], {}], "config": {"index": 10343, "code_hash": null, "entity": [["block_row_warps", "ot", 4], ["block_col_warps", "ot", 1], ["warp_row_tiles", "ot", 1], ["warp_col_tiles", "ot", 4], ["chunk", "ot", 8], ["offset", "ot", 8], ["offsetCS", "ot", 8], ["vec", "ot", 8], ["wmma_m", "ot", 16]]}, "result": [[1.1383148999999999e-05], 0, 1.2387664318084717, 1652116350.1752408], "version": 0.2, "tvm_version": "0.8.0"}
{"input": ["cuda -keys=cuda,gpu -max_num_threads=1024 -thread_warp_size=32", "fused_roll_reshape_permute_reshape_qkv_dense_tensorcore.cuda", [["TENSOR", [1, 8, 8, 1024], "float16"], ["TENSOR", [3072, 1024], "float16"], 1, 8, 8, 1024, 3, 8], {}], "config": {"index": 9452, "code_hash": null, "entity": [["block_row_warps", "ot", 4], ["block_col_warps", "ot", 1], ["warp_row_tiles", "ot", 1], ["warp_col_tiles", "ot", 4], ["chunk", "ot", 1], ["offset", "ot", 8], ["offsetCS", "ot", 0], ["vec", "ot", 8], ["wmma_m", "ot", 16]]}, "result": [[2.011963e-05], 0, 1.096529483795166, 1652116350.7576], "version": 0.2, "tvm_version": "0.8.0"}
{"input": ["cuda -keys=cuda,gpu -max_num_threads=1024 -thread_warp_size=32", "fused_roll_reshape_permute_reshape_qkv_dense_tensorcore.cuda", [["TENSOR", [1, 8, 8, 1024], "float16"], ["TENSOR", [3072, 1024], "float16"], 1, 8, 8, 1024, 3, 8], {}], "config": {"index": 10433, "code_hash": null, "entity": [["block_row_warps", "ot", 4], ["block_col_warps", "ot", 1], ["warp_row_tiles", "ot", 2], ["warp_col_tiles", "ot", 4], ["chunk", "ot", 1], ["offset", "ot", 0], ["offsetCS", "ot", 0], ["vec", "ot", 1], ["wmma_m", "ot", 8]]}, "result": [[6.554169e-05], 0, 1.3874921798706055, 1652116351.4930084], "version": 0.2, "tvm_version": "0.8.0"}
{"input": ["cuda -keys=cuda,gpu -max_num_threads=1024 -thread_warp_size=32", "fused_roll_reshape_permute_reshape_qkv_dense_tensorcore.cuda", [["TENSOR", [1, 8, 8, 1024], "float16"], ["TENSOR", [3072, 1024], "float16"], 1, 8, 8, 1024, 3, 8], {}], "config": {"index": 12458, "code_hash": null, "entity": [["block_row_warps", "ot", 4], ["block_col_warps", "ot", 1], ["warp_row_tiles", "ot", 2], ["warp_col_tiles", "ot", 4], ["chunk", "ot", 2], ["offset", "ot", 0], ["offsetCS", "ot", 8], ["vec", "ot", 2], ["wmma_m", "ot", 8]]}, "result": [[4.2674933000000004e-05], 0, 1.4498324394226074, 1652116352.3710015], "version": 0.2, "tvm_version": "0.8.0"}
{"input": ["cuda -keys=cuda,gpu -max_num_threads=1024 -thread_warp_size=32", "fused_roll_reshape_permute_reshape_qkv_dense_tensorcore.cuda", [["TENSOR", [1, 8, 8, 1024], "float16"], ["TENSOR", [3072, 1024], "float16"], 1, 8, 8, 1024, 3, 8], {}], "config": {"index": 13025, "code_hash": null, "entity": [["block_row_warps", "ot", 4], ["block_col_warps", "ot", 1], ["warp_row_tiles", "ot", 2], ["warp_col_tiles", "ot", 4], ["chunk", "ot", 1], ["offset", "ot", 0], ["offsetCS", "ot", 0], ["vec", "ot", 4], ["wmma_m", "ot", 8]]}, "result": [[4.7163513000000006e-05], 0, 1.2095129489898682, 1652116353.0071929], "version": 0.2, "tvm_version": "0.8.0"}
{"input": ["cuda -keys=cuda,gpu -max_num_threads=1024 -thread_warp_size=32", "fused_roll_reshape_permute_reshape_qkv_dense_tensorcore.cuda", [["TENSOR", [1, 8, 8, 1024], "float16"], ["TENSOR", [3072, 1024], "float16"], 1, 8, 8, 1024, 3, 8], {}], "config": {"index": 13106, "code_hash": null, "entity": [["block_row_warps", "ot", 4], ["block_col_warps", "ot", 1], ["warp_row_tiles", "ot", 2], ["warp_col_tiles", "ot", 4], ["chunk", "ot", 2], ["offset", "ot", 0], ["offsetCS", "ot", 0], ["vec", "ot", 4], ["wmma_m", "ot", 8]]}, "result": [[4.7557358e-05], 0, 1.322798252105713, 1652116353.6940682], "version": 0.2, "tvm_version": "0.8.0"}
{"input": ["cuda -keys=cuda,gpu -max_num_threads=1024 -thread_warp_size=32", "fused_roll_reshape_permute_reshape_qkv_dense_tensorcore.cuda", [["TENSOR", [1, 8, 8, 1024], "float16"], ["TENSOR", [3072, 1024], "float16"], 1, 8, 8, 1024, 3, 8], {}], "config": {"index": 11486, "code_hash": null, "entity": [["block_row_warps", "ot", 4], ["block_col_warps", "ot", 1], ["warp_row_tiles", "ot", 2], ["warp_col_tiles", "ot", 4], ["chunk", "ot", 2], ["offset", "ot", 8], ["offsetCS", "ot", 8], ["vec", "ot", 1], ["wmma_m", "ot", 8]]}, "result": [[5.9475672999999997e-05], 0, 1.2649593353271484, 1652116355.7600672], "version": 0.2, "tvm_version": "0.8.0"}
{"input": ["cuda -keys=cuda,gpu -max_num_threads=1024 -thread_warp_size=32", "fused_roll_reshape_permute_reshape_qkv_dense_tensorcore.cuda", [["TENSOR", [1, 8, 8, 1024], "float16"], ["TENSOR", [3072, 1024], "float16"], 1, 8, 8, 1024, 3, 8], {}], "config": {"index": 9371, "code_hash": null, "entity": [["block_row_warps", "ot", 4], ["block_col_warps", "ot", 1], ["warp_row_tiles", "ot", 1], ["warp_col_tiles", "ot", 4], ["chunk", "ot", 8], ["offset", "ot", 0], ["offsetCS", "ot", 0], ["vec", "ot", 8], ["wmma_m", "ot", 16]]}, "result": [[4.7041037e-05], 0, 1.2288365364074707, 1652116356.4224858], "version": 0.2, "tvm_version": "0.8.0"}
{"input": ["cuda -keys=cuda,gpu -max_num_threads=1024 -thread_warp_size=32", "fused_roll_reshape_permute_reshape_qkv_dense_tensorcore.cuda", [["TENSOR", [1, 8, 8, 1024], "float16"], ["TENSOR", [3072, 1024], "float16"], 1, 8, 8, 1024, 3, 8], {}], "config": {"index": 14564, "code_hash": null, "entity": [["block_row_warps", "ot", 4], ["block_col_warps", "ot", 1], ["warp_row_tiles", "ot", 2], ["warp_col_tiles", "ot", 4], ["chunk", "ot", 8], ["offset", "ot", 0], ["offsetCS", "ot", 0], ["vec", "ot", 8], ["wmma_m", "ot", 8]]}, "result": [[6.409814299999999e-05], 0, 1.3391928672790527, 1652116357.3095336], "version": 0.2, "tvm_version": "0.8.0"}
{"input": ["cuda -keys=cuda,gpu -max_num_threads=1024 -thread_warp_size=32", "fused_roll_reshape_permute_reshape_qkv_dense_tensorcore.cuda", [["TENSOR", [1, 8, 8, 1024], "float16"], ["TENSOR", [3072, 1024], "float16"], 1, 8, 8, 1024, 3, 8], {}], "config": {"index": 11243, "code_hash": null, "entity": [["block_row_warps", "ot", 4], ["block_col_warps", "ot", 1], ["warp_row_tiles", "ot", 2], ["warp_col_tiles", "ot", 4], ["chunk", "ot", 4], ["offset", "ot", 0], ["offsetCS", "ot", 8], ["vec", "ot", 1], ["wmma_m", "ot", 8]]}, "result": [[7.3842033e-05], 0, 1.4585769176483154, 1652116358.0719342], "version": 0.2, "tvm_version": "0.8.0"}
{"input": ["cuda -keys=cuda,gpu -max_num_threads=1024 -thread_warp_size=32", "fused_roll_reshape_permute_reshape_qkv_dense_tensorcore.cuda", [["TENSOR", [1, 8, 8, 1024], "float16"], ["TENSOR", [3072, 1024], "float16"], 1, 8, 8, 1024, 3, 8], {}], "config": {"index": 13754, "code_hash": null, "entity": [["block_row_warps", "ot", 4], ["block_col_warps", "ot", 1], ["warp_row_tiles", "ot", 2], ["warp_col_tiles", "ot", 4], ["chunk", "ot", 2], ["offset", "ot", 0], ["offsetCS", "ot", 8], ["vec", "ot", 4], ["wmma_m", "ot", 8]]}, "result": [[4.1598335e-05], 0, 1.182424783706665, 1652116358.695986], "version": 0.2, "tvm_version": "0.8.0"}
{"input": ["cuda -keys=cuda,gpu -max_num_threads=1024 -thread_warp_size=32", "fused_roll_reshape_permute_reshape_qkv_dense_tensorcore.cuda", [["TENSOR", [1, 8, 8, 1024], "float16"], ["TENSOR", [3072, 1024], "float16"], 1, 8, 8, 1024, 3, 8], {}], "config": {"index": 13916, "code_hash": null, "entity": [["block_row_warps", "ot", 4], ["block_col_warps", "ot", 1], ["warp_row_tiles", "ot", 2], ["warp_col_tiles", "ot", 4], ["chunk", "ot", 8], ["offset", "ot", 0], ["offsetCS", "ot", 8], ["vec", "ot", 4], ["wmma_m", "ot", 8]]}, "result": [[6.3407738e-05], 0, 1.5408804416656494, 1652116359.6183877], "version": 0.2, "tvm_version": "0.8.0"}
{"input": ["cuda -keys=cuda,gpu -max_num_threads=1024 -thread_warp_size=32", "fused_roll_reshape_permute_reshape_qkv_dense_tensorcore.cuda", [["TENSOR", [1, 8, 8, 1024], "float16"], ["TENSOR", [3072, 1024], "float16"], 1, 8, 8, 1024, 3, 8], {}], "config": {"index": 9622, "code_hash": null, "entity": [["block_row_warps", "ot", 2], ["block_col_warps", "ot", 1], ["warp_row_tiles", "ot", 2], ["warp_col_tiles", "ot", 4], ["chunk", "ot", 4], ["offset", "ot", 8], ["offsetCS", "ot", 0], ["vec", "ot", 8], ["wmma_m", "ot", 16]]}, "result": [[1.5978169e-05], 0, 1.074756383895874, 1652116360.1824698], "version": 0.2, "tvm_version": "0.8.0"}
{"input": ["cuda -keys=cuda,gpu -max_num_threads=1024 -thread_warp_size=32", "fused_roll_reshape_permute_reshape_qkv_dense_tensorcore.cuda", [["TENSOR", [1, 8, 8, 1024], "float16"], ["TENSOR", [3072, 1024], "float16"], 1, 8, 8, 1024, 3, 8], {}], "config": {"index": 8650, "code_hash": null, "entity": [["block_row_warps", "ot", 2], ["block_col_warps", "ot", 1], ["warp_row_tiles", "ot", 2], ["warp_col_tiles", "ot", 4], ["chunk", "ot", 4], ["offset", "ot", 0], ["offsetCS", "ot", 8], ["vec", "ot", 4], ["wmma_m", "ot", 16]]}, "result": [[2.8448810000000002e-05], 0, 1.1999197006225586, 1652116360.7755625], "version": 0.2, "tvm_version": "0.8.0"}
{"input": ["cuda -keys=cuda,gpu -max_num_threads=1024 -thread_warp_size=32", "fused_roll_reshape_permute_reshape_qkv_dense_tensorcore.cuda", [["TENSOR", [1, 8, 8, 1024], "float16"], ["TENSOR", [3072, 1024], "float16"], 1, 8, 8, 1024, 3, 8], {}], "config": {"index": 10595, "code_hash": null, "entity": [["block_row_warps", "ot", 4], ["block_col_warps", "ot", 1], ["warp_row_tiles", "ot", 2], ["warp_col_tiles", "ot", 4], ["chunk", "ot", 4], ["offset", "ot", 0], ["offsetCS", "ot", 0], ["vec", "ot", 1], ["wmma_m", "ot", 8]]}, "result": [[7.4345179e-05], 0, 1.6646294593811035, 1652116361.7737093], "version": 0.2, "tvm_version": "0.8.0"}
{"input": ["cuda -keys=cuda,gpu -max_num_threads=1024 -thread_warp_size=32", "fused_roll_reshape_permute_reshape_qkv_dense_tensorcore.cuda", [["TENSOR", [1, 8, 8, 1024], "float16"], ["TENSOR", [3072, 1024], "float16"], 1, 8, 8, 1024, 3, 8], {}], "config": {"index": 14321, "code_hash": null, "entity": [["block_row_warps", "ot", 4], ["block_col_warps", "ot", 1], ["warp_row_tiles", "ot", 2], ["warp_col_tiles", "ot", 4], ["chunk", "ot", 1], ["offset", "ot", 0], ["offsetCS", "ot", 0], ["vec", "ot", 8], ["wmma_m", "ot", 8]]}, "result": [[4.1648787e-05], 0, 1.2456238269805908, 1652116362.4181523], "version": 0.2, "tvm_version": "0.8.0"}
{"input": ["cuda -keys=cuda,gpu -max_num_threads=1024 -thread_warp_size=32", "fused_roll_reshape_permute_reshape_qkv_dense_tensorcore.cuda", [["TENSOR", [1, 8, 8, 1024], "float16"], ["TENSOR", [3072, 1024], "float16"], 1, 8, 8, 1024, 3, 8], {}], "config": {"index": 14402, "code_hash": null, "entity": [["block_row_warps", "ot", 4], ["block_col_warps", "ot", 1], ["warp_row_tiles", "ot", 2], ["warp_col_tiles", "ot", 4], ["chunk", "ot", 2], ["offset", "ot", 0], ["offsetCS", "ot", 0], ["vec", "ot", 8], ["wmma_m", "ot", 8]]}, "result": [[4.3574124e-05], 0, 1.2322096824645996, 1652116363.062965], "version": 0.2, "tvm_version": "0.8.0"}
{"input": ["cuda -keys=cuda,gpu -max_num_threads=1024 -thread_warp_size=32", "fused_roll_reshape_permute_reshape_qkv_dense_tensorcore.cuda", [["TENSOR", [1, 8, 8, 1024], "float16"], ["TENSOR", [3072, 1024], "float16"], 1, 8, 8, 1024, 3, 8], {}], "config": {"index": 10757, "code_hash": null, "entity": [["block_row_warps", "ot", 4], ["block_col_warps", "ot", 1], ["warp_row_tiles", "ot", 2], ["warp_col_tiles", "ot", 4], ["chunk", "ot", 1], ["offset", "ot", 8], ["offsetCS", "ot", 0], ["vec", "ot", 1], ["wmma_m", "ot", 8]]}, "result": [[3.848688400000001e-05], 0, 1.396982192993164, 1652116363.9222965], "version": 0.2, "tvm_version": "0.8.0"}
