python/models/swin_transformer/kernel_configs/swin_transformer_window_reverse_1_14_14_512_7_float16.log
{"i": [["[\"window_reverse\", 1, 14, 14, 512, 7, \"float16\"]", "cuda -keys=cuda,gpu -max_num_threads=1024 -model=unknown -thread_warp_size=32", [-1, 16, 64, 49152, 2147483647, 1024, 8, 32], "", 0, []], [[], [["FU", 1, [0, 1, 2, 3]], ["SP", 1, 0, 100352, [4], 1], ["AN", 1, 0, 5], ["AN", 1, 1, 6]]]], "r": [[2.1489e-05, 2.15041e-05, 2.14976e-05], 0, 1.00211, 1668053025], "v": "v0.6"}
{"i": [["[\"window_reverse\", 1, 14, 14, 512, 7, \"float16\"]", "cuda -keys=cuda,gpu -max_num_threads=1024 -model=unknown -thread_warp_size=32", [-1, 16, 64, 49152, 2147483647, 1024, 8, 32], "", 0, []], [[], [["FU", 1, [0, 1, 2, 3]], ["SP", 1, 0, 100352, [56], 1], ["AN", 1, 0, 5], ["AN", 1, 1, 6]]]], "r": [[4.05235e-06, 4.06086e-06, 4.06192e-06], 0, 2.98653, 1668053027], "v": "v0.6"}
{"i": [["[\"window_reverse\", 1, 14, 14, 512, 7, \"float16\"]", "cuda -keys=cuda,gpu -max_num_threads=1024 -model=unknown -thread_warp_size=32", [-1, 16, 64, 49152, 2147483647, 1024, 8, 32], "", 0, []], [[], [["FU", 1, [0, 1, 2, 3]], ["SP", 1, 0, 100352, [16], 1], ["AN", 1, 0, 5], ["AN", 1, 1, 6]]]], "r": [[7.26781e-06, 7.28366e-06, 7.27871e-06], 0, 2.56114, 1668053026], "v": "v0.6"}
{"i": [["[\"window_reverse\", 1, 14, 14, 512, 7, \"float16\"]", "cuda -keys=cuda,gpu -max_num_threads=1024 -model=unknown -thread_warp_size=32", [-1, 16, 64, 49152, 2147483647, 1024, 8, 32], "", 0, []], [[], [["FU", 1, [0, 1, 2, 3]], ["SP", 1, 0, 100352, [8], 1], ["AN", 1, 0, 5], ["AN", 1, 1, 6]]]], "r": [[1.21826e-05, 1.21894e-05, 1.21882e-05], 0, 1.80762, 1668053025], "v": "v0.6"}
{"i": [["[\"window_reverse\", 1, 14, 14, 512, 7, \"float16\"]", "cuda -keys=cuda,gpu -max_num_threads=1024 -model=unknown -thread_warp_size=32", [-1, 16, 64, 49152, 2147483647, 1024, 8, 32], "", 0, []], [[], [["FU", 1, [0, 1, 2, 3]], ["SP", 1, 0, 100352, [7], 1], ["AN", 1, 0, 5], ["AN", 1, 1, 6]]]], "r": [[1.32905e-05, 1.33006e-05, 1.32992e-05], 0, 1.38996, 1668053025], "v": "v0.6"}
{"i": [["[\"window_reverse\", 1, 14, 14, 512, 7, \"float16\"]", "cuda -keys=cuda,gpu -max_num_threads=1024 -model=unknown -thread_warp_size=32", [-1, 16, 64, 49152, 2147483647, 1024, 8, 32], "", 0, []], [[], [["FU", 1, [0, 1, 2, 3]], ["SP", 1, 0, 100352, [32], 1], ["AN", 1, 0, 5], ["AN", 1, 1, 6]]]], "r": [[5.1244e-06, 5.14171e-06, 5.14371e-06], 0, 0.613539, 1668053024], "v": "v0.6"}
{"i": [["[\"window_reverse\", 1, 14, 14, 512, 7, \"float16\"]", "cuda -keys=cuda,gpu -max_num_threads=1024 -model=unknown -thread_warp_size=32", [-1, 16, 64, 49152, 2147483647, 1024, 8, 32], "", 0, []], [[], [["FU", 1, [0, 1, 2, 3]], ["SP", 1, 0, 100352, [2], 1], ["AN", 1, 0, 5], ["AN", 1, 1, 6]]]], "r": [[3.98814e-05, 3.98932e-05, 3.98889e-05], 0, 2.16979, 1668053026], "v": "v0.6"}
{"i": [["[\"window_reverse\", 1, 14, 14, 512, 7, \"float16\"]", "cuda -keys=cuda,gpu -max_num_threads=1024 -model=unknown -thread_warp_size=32", [-1, 16, 64, 49152, 2147483647, 1024, 8, 32], "", 0, []], [[], [["FU", 1, [0, 1, 2, 3]], ["SP", 1, 0, 100352, [1], 1], ["AN", 1, 0, 5], ["AN", 1, 1, 6]]]], "r": [[7.70838e-05, 7.71088e-05, 7.70982e-05], 0, 3.75563, 1668053027], "v": "v0.6"}
{"i": [["[\"window_reverse\", 1, 14, 14, 512, 7, \"float16\"]", "cuda -keys=cuda,gpu -max_num_threads=1024 -model=unknown -thread_warp_size=32", [-1, 16, 64, 49152, 2147483647, 1024, 8, 32], "", 0, []], [[], [["FU", 1, [0, 1, 2, 3]], ["SP", 1, 0, 100352, [28], 1], ["AN", 1, 0, 5], ["AN", 1, 1, 6]]]], "r": [[5.37832e-06, 5.39915e-06, 5.39146e-06], 0, 3.37462, 1668053027], "v": "v0.6"}
{"i": [["[\"window_reverse\", 1, 14, 14, 512, 7, \"float16\"]", "cuda -keys=cuda,gpu -max_num_threads=1024 -model=unknown -thread_warp_size=32", [-1, 16, 64, 49152, 2147483647, 1024, 8, 32], "", 0, []], [[], [["FU", 1, [0, 1, 2, 3]], ["SP", 1, 0, 100352, [64], 1], ["AN", 1, 0, 5], ["AN", 1, 1, 6]]]], "r": [[3.64846e-06, 3.6585e-06, 3.6599e-06], 0, 4.16062, 1668053028], "v": "v0.6"}
{"i": [["[\"window_reverse\", 1, 14, 14, 512, 7, \"float16\"]", "cuda -keys=cuda,gpu -max_num_threads=1024 -model=unknown -thread_warp_size=32", [-1, 16, 64, 49152, 2147483647, 1024, 8, 32], "", 0, []], [[], [["FU", 1, [0, 1, 2, 3]], ["SP", 1, 0, 100352, [49], 1], ["AN", 1, 0, 5], ["AN", 1, 1, 6]]]], "r": [[4.07877e-06, 4.09138e-06, 4.09001e-06], 0, 4.90893, 1668053029], "v": "v0.6"}
{"i": [["[\"window_reverse\", 1, 14, 14, 512, 7, \"float16\"]", "cuda -keys=cuda,gpu -max_num_threads=1024 -model=unknown -thread_warp_size=32", [-1, 16, 64, 49152, 2147483647, 1024, 8, 32], "", 0, []], [[], [["FU", 1, [0, 1, 2, 3]], ["SP", 1, 0, 100352, [14], 1], ["AN", 1, 0, 5], ["AN", 1, 1, 6]]]], "r": [[8.07769e-06, 8.0891e-06, 8.09056e-06], 0, 4.54514, 1668053028], "v": "v0.6"}
{"i": [["[\"window_reverse\", 1, 14, 14, 512, 7, \"float16\"]", "cuda -keys=cuda,gpu -max_num_threads=1024 -model=unknown -thread_warp_size=32", [-1, 16, 64, 49152, 2147483647, 1024, 8, 32], "", 0, []], [[], [["FU", 1, [0, 1, 2, 3]], ["SP", 1, 0, 100352, [14], 1], ["AN", 1, 0, 5], ["AN", 1, 1, 6]]]], "r": [[7.90658e-06, 7.92204e-06, 7.91892e-06], 0, 1.97335, 1668054229], "v": "v0.6"}
{"i": [["[\"window_reverse\", 1, 14, 14, 512, 7, \"float16\"]", "cuda -keys=cuda,gpu -max_num_threads=1024 -model=unknown -thread_warp_size=32", [-1, 16, 64, 49152, 2147483647, 1024, 8, 32], "", 0, []], [[], [["FU", 1, [0, 1, 2, 3]], ["SP", 1, 0, 100352, [28], 1], ["AN", 1, 0, 5], ["AN", 1, 1, 6]]]], "r": [[5.28667e-06, 5.30374e-06, 5.30434e-06], 0, 2.68565, 1668054229], "v": "v0.6"}
{"i": [["[\"window_reverse\", 1, 14, 14, 512, 7, \"float16\"]", "cuda -keys=cuda,gpu -max_num_threads=1024 -model=unknown -thread_warp_size=32", [-1, 16, 64, 49152, 2147483647, 1024, 8, 32], "", 0, []], [[], [["FU", 1, [0, 1, 2, 3]], ["SP", 1, 0, 100352, [7], 1], ["AN", 1, 0, 5], ["AN", 1, 1, 6]]]], "r": [[1.34927e-05, 1.34992e-05, 1.34832e-05], 0, 2.31513, 1668054229], "v": "v0.6"}
{"i": [["[\"window_reverse\", 1, 14, 14, 512, 7, \"float16\"]", "cuda -keys=cuda,gpu -max_num_threads=1024 -model=unknown -thread_warp_size=32", [-1, 16, 64, 49152, 2147483647, 1024, 8, 32], "", 0, []], [[], [["FU", 1, [0, 1, 2, 3]], ["SP", 1, 0, 100352, [32], 1], ["AN", 1, 0, 5], ["AN", 1, 1, 6]]]], "r": [[5.08139e-06, 5.10968e-06, 5.10518e-06], 0, 0.909944, 1668054228], "v": "v0.6"}
{"i": [["[\"window_reverse\", 1, 14, 14, 512, 7, \"float16\"]", "cuda -keys=cuda,gpu -max_num_threads=1024 -model=unknown -thread_warp_size=32", [-1, 16, 64, 49152, 2147483647, 1024, 8, 32], "", 0, []], [[], [["FU", 1, [0, 1, 2, 3]], ["SP", 1, 0, 100352, [56], 1], ["AN", 1, 0, 5], ["AN", 1, 1, 6]]]], "r": [[3.89288e-06, 3.90326e-06, 3.90123e-06], 0, 0.581563, 1668054227], "v": "v0.6"}
{"i": [["[\"window_reverse\", 1, 14, 14, 512, 7, \"float16\"]", "cuda -keys=cuda,gpu -max_num_threads=1024 -model=unknown -thread_warp_size=32", [-1, 16, 64, 49152, 2147483647, 1024, 8, 32], "", 0, []], [[], [["FU", 1, [0, 1, 2, 3]], ["SP", 1, 0, 100352, [2], 1], ["AN", 1, 0, 5], ["AN", 1, 1, 6]]]], "r": [[3.99285e-05, 3.99501e-05, 3.9938e-05], 0, 1.24645, 1668054228], "v": "v0.6"}
{"i": [["[\"window_reverse\", 1, 14, 14, 512, 7, \"float16\"]", "cuda -keys=cuda,gpu -max_num_threads=1024 -model=unknown -thread_warp_size=32", [-1, 16, 64, 49152, 2147483647, 1024, 8, 32], "", 0, []], [[], [["FU", 1, [0, 1, 2, 3]], ["SP", 1, 0, 100352, [49], 1], ["AN", 1, 0, 5], ["AN", 1, 1, 6]]]], "r": [[3.97467e-06, 3.98972e-06, 3.98803e-06], 0, 1.62984, 1668054228], "v": "v0.6"}
{"i": [["[\"window_reverse\", 1, 14, 14, 512, 7, \"float16\"]", "cuda -keys=cuda,gpu -max_num_threads=1024 -model=unknown -thread_warp_size=32", [-1, 16, 64, 49152, 2147483647, 1024, 8, 32], "", 0, []], [[], [["FU", 1, [0, 1, 2, 3]], ["SP", 1, 0, 100352, [16], 1], ["AN", 1, 0, 5], ["AN", 1, 1, 6]]]], "r": [[7.18346e-06, 7.19617e-06, 7.19616e-06], 0, 3.36189, 1668054230], "v": "v0.6"}
{"i": [["[\"window_reverse\", 1, 14, 14, 512, 7, \"float16\"]", "cuda -keys=cuda,gpu -max_num_threads=1024 -model=unknown -thread_warp_size=32", [-1, 16, 64, 49152, 2147483647, 1024, 8, 32], "", 0, []], [[], [["FU", 1, [0, 1, 2, 3]], ["SP", 1, 0, 100352, [64], 1], ["AN", 1, 0, 5], ["AN", 1, 1, 6]]]], "r": [[3.63797e-06, 3.65493e-06, 3.65812e-06], 0, 3.03393, 1668054230], "v": "v0.6"}
{"i": [["[\"window_reverse\", 1, 14, 14, 512, 7, \"float16\"]", "cuda -keys=cuda,gpu -max_num_threads=1024 -model=unknown -thread_warp_size=32", [-1, 16, 64, 49152, 2147483647, 1024, 8, 32], "", 0, []], [[], [["FU", 1, [0, 1, 2, 3]], ["SP", 1, 0, 100352, [1], 1], ["AN", 1, 0, 5], ["AN", 1, 1, 6]]]], "r": [[7.71685e-05, 7.71868e-05, 7.72055e-05], 0, 4.43458, 1668054231], "v": "v0.6"}
{"i": [["[\"window_reverse\", 1, 14, 14, 512, 7, \"float16\"]", "cuda -keys=cuda,gpu -max_num_threads=1024 -model=unknown -thread_warp_size=32", [-1, 16, 64, 49152, 2147483647, 1024, 8, 32], "", 0, []], [[], [["FU", 1, [0, 1, 2, 3]], ["SP", 1, 0, 100352, [8], 1], ["AN", 1, 0, 5], ["AN", 1, 1, 6]]]], "r": [[1.20223e-05, 1.20393e-05, 1.20307e-05], 0, 4.08387, 1668054231], "v": "v0.6"}
{"i": [["[\"window_reverse\", 1, 14, 14, 512, 7, \"float16\"]", "cuda -keys=cuda,gpu -max_num_threads=1024 -model=unknown -thread_warp_size=32", [-1, 16, 64, 49152, 2147483647, 1024, 8, 32], "", 0, []], [[], [["FU", 1, [0, 1, 2, 3]], ["SP", 1, 0, 100352, [4], 1], ["AN", 1, 0, 5], ["AN", 1, 1, 6]]]], "r": [[2.13621e-05, 2.13763e-05, 2.13755e-05], 0, 3.73551, 1668054231], "v": "v0.6"}
{"i": [["[\"window_reverse\", 1, 14, 14, 512, 7, \"float16\"]", "cuda -keys=cuda,gpu -max_num_threads=1024 -model=unknown -thread_warp_size=32", [-1, 16, 64, 49152, 2147483647, 1024, 8, 32], "", 0, []], [[], [["FU", 1, [0, 1, 2, 3]], ["SP", 1, 0, 100352, [28], 1], ["AN", 1, 0, 5], ["AN", 1, 1, 6]]]], "r": [[5.32247e-06, 5.33515e-06, 5.33539e-06], 0, 1.66955, 1668054663], "v": "v0.6"}
{"i": [["[\"window_reverse\", 1, 14, 14, 512, 7, \"float16\"]", "cuda -keys=cuda,gpu -max_num_threads=1024 -model=unknown -thread_warp_size=32", [-1, 16, 64, 49152, 2147483647, 1024, 8, 32], "", 0, []], [[], [["FU", 1, [0, 1, 2, 3]], ["SP", 1, 0, 100352, [2], 1], ["AN", 1, 0, 5], ["AN", 1, 1, 6]]]], "r": [[3.98757e-05, 3.98869e-05, 3.98843e-05], 0, 1.276, 1668054662], "v": "v0.6"}
{"i": [["[\"window_reverse\", 1, 14, 14, 512, 7, \"float16\"]", "cuda -keys=cuda,gpu -max_num_threads=1024 -model=unknown -thread_warp_size=32", [-1, 16, 64, 49152, 2147483647, 1024, 8, 32], "", 0, []], [[], [["FU", 1, [0, 1, 2, 3]], ["SP", 1, 0, 100352, [16], 1], ["AN", 1, 0, 5], ["AN", 1, 1, 6]]]], "r": [[7.46046e-06, 7.47412e-06, 7.47224e-06], 0, 0.931936, 1668054662], "v": "v0.6"}
{"i": [["[\"window_reverse\", 1, 14, 14, 512, 7, \"float16\"]", "cuda -keys=cuda,gpu -max_num_threads=1024 -model=unknown -thread_warp_size=32", [-1, 16, 64, 49152, 2147483647, 1024, 8, 32], "", 0, []], [[], [["FU", 1, [0, 1, 2, 3]], ["SP", 1, 0, 100352, [8], 1], ["AN", 1, 0, 5], ["AN", 1, 1, 6]]]], "r": [[1.21052e-05, 1.21134e-05, 1.2121e-05], 0, 1.99804, 1668054663], "v": "v0.6"}
{"i": [["[\"window_reverse\", 1, 14, 14, 512, 7, \"float16\"]", "cuda -keys=cuda,gpu -max_num_threads=1024 -model=unknown -thread_warp_size=32", [-1, 16, 64, 49152, 2147483647, 1024, 8, 32], "", 0, []], [[], [["FU", 1, [0, 1, 2, 3]], ["SP", 1, 0, 100352, [4], 1], ["AN", 1, 0, 5], ["AN", 1, 1, 6]]]], "r": [[2.13216e-05, 2.13308e-05, 2.13284e-05], 0, 0.583826, 1668054662], "v": "v0.6"}
{"i": [["[\"window_reverse\", 1, 14, 14, 512, 7, \"float16\"]", "cuda -keys=cuda,gpu -max_num_threads=1024 -model=unknown -thread_warp_size=32", [-1, 16, 64, 49152, 2147483647, 1024, 8, 32], "", 0, []], [[], [["FU", 1, [0, 1, 2, 3]], ["SP", 1, 0, 100352, [56], 1], ["AN", 1, 0, 5], ["AN", 1, 1, 6]]]], "r": [[3.94539e-06, 3.96014e-06, 3.95885e-06], 0, 2.7038, 1668054664], "v": "v0.6"}
{"i": [["[\"window_reverse\", 1, 14, 14, 512, 7, \"float16\"]", "cuda -keys=cuda,gpu -max_num_threads=1024 -model=unknown -thread_warp_size=32", [-1, 16, 64, 49152, 2147483647, 1024, 8, 32], "", 0, []], [[], [["FU", 1, [0, 1, 2, 3]], ["SP", 1, 0, 100352, [14], 1], ["AN", 1, 0, 5], ["AN", 1, 1, 6]]]], "r": [[7.99637e-06, 8.01317e-06, 8.01599e-06], 0, 2.3375, 1668054663], "v": "v0.6"}
{"i": [["[\"window_reverse\", 1, 14, 14, 512, 7, \"float16\"]", "cuda -keys=cuda,gpu -max_num_threads=1024 -model=unknown -thread_warp_size=32", [-1, 16, 64, 49152, 2147483647, 1024, 8, 32], "", 0, []], [[], [["FU", 1, [0, 1, 2, 3]], ["SP", 1, 0, 100352, [49], 1], ["AN", 1, 0, 5], ["AN", 1, 1, 6]]]], "r": [[4.06484e-06, 4.09288e-06, 4.09562e-06], 0, 3.01769, 1668054664], "v": "v0.6"}
{"i": [["[\"window_reverse\", 1, 14, 14, 512, 7, \"float16\"]", "cuda -keys=cuda,gpu -max_num_threads=1024 -model=unknown -thread_warp_size=32", [-1, 16, 64, 49152, 2147483647, 1024, 8, 32], "", 0, []], [[], [["FU", 1, [0, 1, 2, 3]], ["SP", 1, 0, 100352, [64], 1], ["AN", 1, 0, 5], ["AN", 1, 1, 6]]]], "r": [[3.76033e-06, 3.76882e-06, 3.77098e-06], 0, 4.14531, 1668054665], "v": "v0.6"}
{"i": [["[\"window_reverse\", 1, 14, 14, 512, 7, \"float16\"]", "cuda -keys=cuda,gpu -max_num_threads=1024 -model=unknown -thread_warp_size=32", [-1, 16, 64, 49152, 2147483647, 1024, 8, 32], "", 0, []], [[], [["FU", 1, [0, 1, 2, 3]], ["SP", 1, 0, 100352, [32], 1], ["AN", 1, 0, 5], ["AN", 1, 1, 6]]]], "r": [[4.95e-06, 4.96146e-06, 4.96165e-06], 0, 3.36373, 1668054665], "v": "v0.6"}
{"i": [["[\"window_reverse\", 1, 14, 14, 512, 7, \"float16\"]", "cuda -keys=cuda,gpu -max_num_threads=1024 -model=unknown -thread_warp_size=32", [-1, 16, 64, 49152, 2147483647, 1024, 8, 32], "", 0, []], [[], [["FU", 1, [0, 1, 2, 3]], ["SP", 1, 0, 100352, [7], 1], ["AN", 1, 0, 5], ["AN", 1, 1, 6]]]], "r": [[1.3267e-05, 1.32862e-05, 1.32853e-05], 0, 3.75536, 1668054665], "v": "v0.6"}
{"i": [["[\"window_reverse\", 1, 14, 14, 512, 7, \"float16\"]", "cuda -keys=cuda,gpu -max_num_threads=1024 -model=unknown -thread_warp_size=32", [-1, 16, 64, 49152, 2147483647, 1024, 8, 32], "", 0, []], [[], [["FU", 1, [0, 1, 2, 3]], ["SP", 1, 0, 100352, [1], 1], ["AN", 1, 0, 5], ["AN", 1, 1, 6]]]], "r": [[7.70568e-05, 7.70869e-05, 7.70915e-05], 0, 4.49389, 1668054666], "v": "v0.6"}
{"i": [["[\"window_reverse\", 1, 14, 14, 512, 7, \"float16\"]", "cuda -keys=cuda,gpu -max_num_threads=1024 -model=unknown -thread_warp_size=32", [-1, 16, 64, 49152, 2147483647, 1024, 8, 32], "", 0, []], [[], [["FU", 1, [0, 1, 2, 3]], ["SP", 1, 0, 100352, [14], 1], ["AN", 1, 0, 5], ["AN", 1, 1, 6]]]], "r": [[7.96339e-06, 7.97972e-06, 7.97865e-06], 0, 1.98256, 1668055042], "v": "v0.6"}
{"i": [["[\"window_reverse\", 1, 14, 14, 512, 7, \"float16\"]", "cuda -keys=cuda,gpu -max_num_threads=1024 -model=unknown -thread_warp_size=32", [-1, 16, 64, 49152, 2147483647, 1024, 8, 32], "", 0, []], [[], [["FU", 1, [0, 1, 2, 3]], ["SP", 1, 0, 100352, [4], 1], ["AN", 1, 0, 5], ["AN", 1, 1, 6]]]], "r": [[2.13535e-05, 2.13795e-05, 2.13804e-05], 0, 1.64334, 1668055042], "v": "v0.6"}
{"i": [["[\"window_reverse\", 1, 14, 14, 512, 7, \"float16\"]", "cuda -keys=cuda,gpu -max_num_threads=1024 -model=unknown -thread_warp_size=32", [-1, 16, 64, 49152, 2147483647, 1024, 8, 32], "", 0, []], [[], [["FU", 1, [0, 1, 2, 3]], ["SP", 1, 0, 100352, [2], 1], ["AN", 1, 0, 5], ["AN", 1, 1, 6]]]], "r": [[3.99129e-05, 3.99187e-05, 3.99271e-05], 0, 0.591165, 1668055041], "v": "v0.6"}
{"i": [["[\"window_reverse\", 1, 14, 14, 512, 7, \"float16\"]", "cuda -keys=cuda,gpu -max_num_threads=1024 -model=unknown -thread_warp_size=32", [-1, 16, 64, 49152, 2147483647, 1024, 8, 32], "", 0, []], [[], [["FU", 1, [0, 1, 2, 3]], ["SP", 1, 0, 100352, [28], 1], ["AN", 1, 0, 5], ["AN", 1, 1, 6]]]], "r": [[5.28512e-06, 5.29477e-06, 5.30109e-06], 0, 0.91133, 1668055041], "v": "v0.6"}
{"i": [["[\"window_reverse\", 1, 14, 14, 512, 7, \"float16\"]", "cuda -keys=cuda,gpu -max_num_threads=1024 -model=unknown -thread_warp_size=32", [-1, 16, 64, 49152, 2147483647, 1024, 8, 32], "", 0, []], [[], [["FU", 1, [0, 1, 2, 3]], ["SP", 1, 0, 100352, [8], 1], ["AN", 1, 0, 5], ["AN", 1, 1, 6]]]], "r": [[1.21145e-05, 1.21272e-05, 1.21226e-05], 0, 1.2551, 1668055041], "v": "v0.6"}
{"i": [["[\"window_reverse\", 1, 14, 14, 512, 7, \"float16\"]", "cuda -keys=cuda,gpu -max_num_threads=1024 -model=unknown -thread_warp_size=32", [-1, 16, 64, 49152, 2147483647, 1024, 8, 32], "", 0, []], [[], [["FU", 1, [0, 1, 2, 3]], ["SP", 1, 0, 100352, [1], 1], ["AN", 1, 0, 5], ["AN", 1, 1, 6]]]], "r": [[7.70572e-05, 7.7082e-05, 7.70633e-05], 0, 2.33518, 1668055042], "v": "v0.6"}
{"i": [["[\"window_reverse\", 1, 14, 14, 512, 7, \"float16\"]", "cuda -keys=cuda,gpu -max_num_threads=1024 -model=unknown -thread_warp_size=32", [-1, 16, 64, 49152, 2147483647, 1024, 8, 32], "", 0, []], [[], [["FU", 1, [0, 1, 2, 3]], ["SP", 1, 0, 100352, [49], 1], ["AN", 1, 0, 5], ["AN", 1, 1, 6]]]], "r": [[3.99918e-06, 4.01709e-06, 4.0127e-06], 0, 2.7128, 1668055043], "v": "v0.6"}
{"i": [["[\"window_reverse\", 1, 14, 14, 512, 7, \"float16\"]", "cuda -keys=cuda,gpu -max_num_threads=1024 -model=unknown -thread_warp_size=32", [-1, 16, 64, 49152, 2147483647, 1024, 8, 32], "", 0, []], [[], [["FU", 1, [0, 1, 2, 3]], ["SP", 1, 0, 100352, [32], 1], ["AN", 1, 0, 5], ["AN", 1, 1, 6]]]], "r": [[4.9717e-06, 4.98105e-06, 4.97955e-06], 0, 3.38439, 1668055044], "v": "v0.6"}
{"i": [["[\"window_reverse\", 1, 14, 14, 512, 7, \"float16\"]", "cuda -keys=cuda,gpu -max_num_threads=1024 -model=unknown -thread_warp_size=32", [-1, 16, 64, 49152, 2147483647, 1024, 8, 32], "", 0, []], [[], [["FU", 1, [0, 1, 2, 3]], ["SP", 1, 0, 100352, [56], 1], ["AN", 1, 0, 5], ["AN", 1, 1, 6]]]], "r": [[3.93735e-06, 3.94423e-06, 3.95121e-06], 0, 4.09233, 1668055044], "v": "v0.6"}
{"i": [["[\"window_reverse\", 1, 14, 14, 512, 7, \"float16\"]", "cuda -keys=cuda,gpu -max_num_threads=1024 -model=unknown -thread_warp_size=32", [-1, 16, 64, 49152, 2147483647, 1024, 8, 32], "", 0, []], [[], [["FU", 1, [0, 1, 2, 3]], ["SP", 1, 0, 100352, [64], 1], ["AN", 1, 0, 5], ["AN", 1, 1, 6]]]], "r": [[3.90868e-06, 3.91839e-06, 3.91976e-06], 0, 3.02977, 1668055043], "v": "v0.6"}
{"i": [["[\"window_reverse\", 1, 14, 14, 512, 7, \"float16\"]", "cuda -keys=cuda,gpu -max_num_threads=1024 -model=unknown -thread_warp_size=32", [-1, 16, 64, 49152, 2147483647, 1024, 8, 32], "", 0, []], [[], [["FU", 1, [0, 1, 2, 3]], ["SP", 1, 0, 100352, [7], 1], ["AN", 1, 0, 5], ["AN", 1, 1, 6]]]], "r": [[1.34794e-05, 1.34901e-05, 1.35007e-05], 0, 3.72775, 1668055044], "v": "v0.6"}
{"i": [["[\"window_reverse\", 1, 14, 14, 512, 7, \"float16\"]", "cuda -keys=cuda,gpu -max_num_threads=1024 -model=unknown -thread_warp_size=32", [-1, 16, 64, 49152, 2147483647, 1024, 8, 32], "", 0, []], [[], [["FU", 1, [0, 1, 2, 3]], ["SP", 1, 0, 100352, [16], 1], ["AN", 1, 0, 5], ["AN", 1, 1, 6]]]], "r": [[7.26939e-06, 7.28245e-06, 7.27998e-06], 0, 4.41759, 1668055045], "v": "v0.6"}
{"i": [["[\"window_reverse\", 1, 14, 14, 512, 7, \"float16\"]", "cuda -keys=cuda,gpu -max_num_threads=1024 -model=unknown -thread_warp_size=32", [-1, 16, 64, 49152, 2147483647, 1024, 8, 32], "", 0, []], [[], [["FU", 1, [0, 1, 2, 3]], ["SP", 1, 0, 100352, [14], 1], ["AN", 1, 0, 5], ["AN", 1, 1, 6]]]], "r": [[7.98811e-06, 8.00482e-06, 7.99884e-06], 0, 1.17642, 1668055324], "v": "v0.6"}
{"i": [["[\"window_reverse\", 1, 14, 14, 512, 7, \"float16\"]", "cuda -keys=cuda,gpu -max_num_threads=1024 -model=unknown -thread_warp_size=32", [-1, 16, 64, 49152, 2147483647, 1024, 8, 32], "", 0, []], [[], [["FU", 1, [0, 1, 2, 3]], ["SP", 1, 0, 100352, [16], 1], ["AN", 1, 0, 5], ["AN", 1, 1, 6]]]], "r": [[7.46289e-06, 7.47773e-06, 7.47741e-06], 0, 0.579057, 1668055323], "v": "v0.6"}
{"i": [["[\"window_reverse\", 1, 14, 14, 512, 7, \"float16\"]", "cuda -keys=cuda,gpu -max_num_threads=1024 -model=unknown -thread_warp_size=32", [-1, 16, 64, 49152, 2147483647, 1024, 8, 32], "", 0, []], [[], [["FU", 1, [0, 1, 2, 3]], ["SP", 1, 0, 100352, [49], 1], ["AN", 1, 0, 5], ["AN", 1, 1, 6]]]], "r": [[3.99161e-06, 4.0015e-06, 4.00073e-06], 0, 1.55097, 1668055325], "v": "v0.6"}
{"i": [["[\"window_reverse\", 1, 14, 14, 512, 7, \"float16\"]", "cuda -keys=cuda,gpu -max_num_threads=1024 -model=unknown -thread_warp_size=32", [-1, 16, 64, 49152, 2147483647, 1024, 8, 32], "", 0, []], [[], [["FU", 1, [0, 1, 2, 3]], ["SP", 1, 0, 100352, [4], 1], ["AN", 1, 0, 5], ["AN", 1, 1, 6]]]], "r": [[2.13315e-05, 2.13288e-05, 2.13459e-05], 0, 0.843124, 1668055324], "v": "v0.6"}
{"i": [["[\"window_reverse\", 1, 14, 14, 512, 7, \"float16\"]", "cuda -keys=cuda,gpu -max_num_threads=1024 -model=unknown -thread_warp_size=32", [-1, 16, 64, 49152, 2147483647, 1024, 8, 32], "", 0, []], [[], [["FU", 1, [0, 1, 2, 3]], ["SP", 1, 0, 100352, [56], 1], ["AN", 1, 0, 5], ["AN", 1, 1, 6]]]], "r": [[3.82347e-06, 3.83828e-06, 3.83406e-06], 0, 2.2047, 1668055325], "v": "v0.6"}
{"i": [["[\"window_reverse\", 1, 14, 14, 512, 7, \"float16\"]", "cuda -keys=cuda,gpu -max_num_threads=1024 -model=unknown -thread_warp_size=32", [-1, 16, 64, 49152, 2147483647, 1024, 8, 32], "", 0, []], [[], [["FU", 1, [0, 1, 2, 3]], ["SP", 1, 0, 100352, [28], 1], ["AN", 1, 0, 5], ["AN", 1, 1, 6]]]], "r": [[5.32454e-06, 5.33788e-06, 5.34305e-06], 0, 1.88519, 1668055325], "v": "v0.6"}
{"i": [["[\"window_reverse\", 1, 14, 14, 512, 7, \"float16\"]", "cuda -keys=cuda,gpu -max_num_threads=1024 -model=unknown -thread_warp_size=32", [-1, 16, 64, 49152, 2147483647, 1024, 8, 32], "", 0, []], [[], [["FU", 1, [0, 1, 2, 3]], ["SP", 1, 0, 100352, [1], 1], ["AN", 1, 0, 5], ["AN", 1, 1, 6]]]], "r": [[7.71234e-05, 7.71479e-05, 7.71785e-05], 0, 2.91741, 1668055326], "v": "v0.6"}
{"i": [["[\"window_reverse\", 1, 14, 14, 512, 7, \"float16\"]", "cuda -keys=cuda,gpu -max_num_threads=1024 -model=unknown -thread_warp_size=32", [-1, 16, 64, 49152, 2147483647, 1024, 8, 32], "", 0, []], [[], [["FU", 1, [0, 1, 2, 3]], ["SP", 1, 0, 100352, [64], 1], ["AN", 1, 0, 5], ["AN", 1, 1, 6]]]], "r": [[3.73744e-06, 3.75113e-06, 3.7533e-06], 0, 3.25664, 1668055326], "v": "v0.6"}
{"i": [["[\"window_reverse\", 1, 14, 14, 512, 7, \"float16\"]", "cuda -keys=cuda,gpu -max_num_threads=1024 -model=unknown -thread_warp_size=32", [-1, 16, 64, 49152, 2147483647, 1024, 8, 32], "", 0, []], [[], [["FU", 1, [0, 1, 2, 3]], ["SP", 1, 0, 100352, [8], 1], ["AN", 1, 0, 5], ["AN", 1, 1, 6]]]], "r": [[1.22043e-05, 1.22211e-05, 1.2219e-05], 0, 2.59319, 1668055326], "v": "v0.6"}
{"i": [["[\"window_reverse\", 1, 14, 14, 512, 7, \"float16\"]", "cuda -keys=cuda,gpu -max_num_threads=1024 -model=unknown -thread_warp_size=32", [-1, 16, 64, 49152, 2147483647, 1024, 8, 32], "", 0, []], [[], [["FU", 1, [0, 1, 2, 3]], ["SP", 1, 0, 100352, [7], 1], ["AN", 1, 0, 5], ["AN", 1, 1, 6]]]], "r": [[1.33489e-05, 1.33582e-05, 1.33496e-05], 0, 3.61063, 1668055327], "v": "v0.6"}
{"i": [["[\"window_reverse\", 1, 14, 14, 512, 7, \"float16\"]", "cuda -keys=cuda,gpu -max_num_threads=1024 -model=unknown -thread_warp_size=32", [-1, 16, 64, 49152, 2147483647, 1024, 8, 32], "", 0, []], [[], [["FU", 1, [0, 1, 2, 3]], ["SP", 1, 0, 100352, [2], 1], ["AN", 1, 0, 5], ["AN", 1, 1, 6]]]], "r": [[3.99397e-05, 3.995e-05, 3.996e-05], 0, 4.30662, 1668055327], "v": "v0.6"}
{"i": [["[\"window_reverse\", 1, 14, 14, 512, 7, \"float16\"]", "cuda -keys=cuda,gpu -max_num_threads=1024 -model=unknown -thread_warp_size=32", [-1, 16, 64, 49152, 2147483647, 1024, 8, 32], "", 0, []], [[], [["FU", 1, [0, 1, 2, 3]], ["SP", 1, 0, 100352, [32], 1], ["AN", 1, 0, 5], ["AN", 1, 1, 6]]]], "r": [[5.04036e-06, 5.05275e-06, 5.04967e-06], 0, 3.95269, 1668055327], "v": "v0.6"}
{"i": [["[\"window_reverse\", 1, 14, 14, 512, 7, \"float16\"]", "cuda -keys=cuda,gpu -max_num_threads=1024 -model=unknown -thread_warp_size=32", [-1, 16, 64, 49152, 2147483647, 1024, 8, 32], "", 0, []], [[], [["FU", 1, [0, 1, 2, 3]], ["SP", 1, 0, 100352, [16], 1], ["AN", 1, 0, 5], ["AN", 1, 1, 6]]]], "r": [[7.46226e-06, 7.47318e-06, 7.47338e-06], 0, 0.93077, 1668055607], "v": "v0.6"}
{"i": [["[\"window_reverse\", 1, 14, 14, 512, 7, \"float16\"]", "cuda -keys=cuda,gpu -max_num_threads=1024 -model=unknown -thread_warp_size=32", [-1, 16, 64, 49152, 2147483647, 1024, 8, 32], "", 0, []], [[], [["FU", 1, [0, 1, 2, 3]], ["SP", 1, 0, 100352, [64], 1], ["AN", 1, 0, 5], ["AN", 1, 1, 6]]]], "r": [[3.90935e-06, 3.91628e-06, 3.91926e-06], 0, 1.60774, 1668055607], "v": "v0.6"}
{"i": [["[\"window_reverse\", 1, 14, 14, 512, 7, \"float16\"]", "cuda -keys=cuda,gpu -max_num_threads=1024 -model=unknown -thread_warp_size=32", [-1, 16, 64, 49152, 2147483647, 1024, 8, 32], "", 0, []], [[], [["FU", 1, [0, 1, 2, 3]], ["SP", 1, 0, 100352, [56], 1], ["AN", 1, 0, 5], ["AN", 1, 1, 6]]]], "r": [[4.07637e-06, 4.08326e-06, 4.08317e-06], 0, 0.57483, 1668055606], "v": "v0.6"}
{"i": [["[\"window_reverse\", 1, 14, 14, 512, 7, \"float16\"]", "cuda -keys=cuda,gpu -max_num_threads=1024 -model=unknown -thread_warp_size=32", [-1, 16, 64, 49152, 2147483647, 1024, 8, 32], "", 0, []], [[], [["FU", 1, [0, 1, 2, 3]], ["SP", 1, 0, 100352, [14], 1], ["AN", 1, 0, 5], ["AN", 1, 1, 6]]]], "r": [[8.08072e-06, 8.09619e-06, 8.09521e-06], 0, 2.29567, 1668055608], "v": "v0.6"}
{"i": [["[\"window_reverse\", 1, 14, 14, 512, 7, \"float16\"]", "cuda -keys=cuda,gpu -max_num_threads=1024 -model=unknown -thread_warp_size=32", [-1, 16, 64, 49152, 2147483647, 1024, 8, 32], "", 0, []], [[], [["FU", 1, [0, 1, 2, 3]], ["SP", 1, 0, 100352, [7], 1], ["AN", 1, 0, 5], ["AN", 1, 1, 6]]]], "r": [[1.34326e-05, 1.34373e-05, 1.34417e-05], 0, 1.23852, 1668055607], "v": "v0.6"}
{"i": [["[\"window_reverse\", 1, 14, 14, 512, 7, \"float16\"]", "cuda -keys=cuda,gpu -max_num_threads=1024 -model=unknown -thread_warp_size=32", [-1, 16, 64, 49152, 2147483647, 1024, 8, 32], "", 0, []], [[], [["FU", 1, [0, 1, 2, 3]], ["SP", 1, 0, 100352, [49], 1], ["AN", 1, 0, 5], ["AN", 1, 1, 6]]]], "r": [[4.03585e-06, 4.04883e-06, 4.04892e-06], 0, 1.94908, 1668055608], "v": "v0.6"}
{"i": [["[\"window_reverse\", 1, 14, 14, 512, 7, \"float16\"]", "cuda -keys=cuda,gpu -max_num_threads=1024 -model=unknown -thread_warp_size=32", [-1, 16, 64, 49152, 2147483647, 1024, 8, 32], "", 0, []], [[], [["FU", 1, [0, 1, 2, 3]], ["SP", 1, 0, 100352, [1], 1], ["AN", 1, 0, 5], ["AN", 1, 1, 6]]]], "r": [[7.71497e-05, 7.71534e-05, 7.71649e-05], 0, 3.32266, 1668055609], "v": "v0.6"}
{"i": [["[\"window_reverse\", 1, 14, 14, 512, 7, \"float16\"]", "cuda -keys=cuda,gpu -max_num_threads=1024 -model=unknown -thread_warp_size=32", [-1, 16, 64, 49152, 2147483647, 1024, 8, 32], "", 0, []], [[], [["FU", 1, [0, 1, 2, 3]], ["SP", 1, 0, 100352, [8], 1], ["AN", 1, 0, 5], ["AN", 1, 1, 6]]]], "r": [[1.19302e-05, 1.19356e-05, 1.19361e-05], 0, 2.99636, 1668055609], "v": "v0.6"}
{"i": [["[\"window_reverse\", 1, 14, 14, 512, 7, \"float16\"]", "cuda -keys=cuda,gpu -max_num_threads=1024 -model=unknown -thread_warp_size=32", [-1, 16, 64, 49152, 2147483647, 1024, 8, 32], "", 0, []], [[], [["FU", 1, [0, 1, 2, 3]], ["SP", 1, 0, 100352, [4], 1], ["AN", 1, 0, 5], ["AN", 1, 1, 6]]]], "r": [[2.14447e-05, 2.14759e-05, 2.14514e-05], 0, 2.66952, 1668055609], "v": "v0.6"}
{"i": [["[\"window_reverse\", 1, 14, 14, 512, 7, \"float16\"]", "cuda -keys=cuda,gpu -max_num_threads=1024 -model=unknown -thread_warp_size=32", [-1, 16, 64, 49152, 2147483647, 1024, 8, 32], "", 0, []], [[], [["FU", 1, [0, 1, 2, 3]], ["SP", 1, 0, 100352, [2], 1], ["AN", 1, 0, 5], ["AN", 1, 1, 6]]]], "r": [[3.98541e-05, 3.98789e-05, 3.98724e-05], 0, 4.06509, 1668055610], "v": "v0.6"}
{"i": [["[\"window_reverse\", 1, 14, 14, 512, 7, \"float16\"]", "cuda -keys=cuda,gpu -max_num_threads=1024 -model=unknown -thread_warp_size=32", [-1, 16, 64, 49152, 2147483647, 1024, 8, 32], "", 0, []], [[], [["FU", 1, [0, 1, 2, 3]], ["SP", 1, 0, 100352, [28], 1], ["AN", 1, 0, 5], ["AN", 1, 1, 6]]]], "r": [[5.46617e-06, 5.47467e-06, 5.47306e-06], 0, 3.71491, 1668055610], "v": "v0.6"}
{"i": [["[\"window_reverse\", 1, 14, 14, 512, 7, \"float16\"]", "cuda -keys=cuda,gpu -max_num_threads=1024 -model=unknown -thread_warp_size=32", [-1, 16, 64, 49152, 2147483647, 1024, 8, 32], "", 0, []], [[], [["FU", 1, [0, 1, 2, 3]], ["SP", 1, 0, 100352, [32], 1], ["AN", 1, 0, 5], ["AN", 1, 1, 6]]]], "r": [[4.88995e-06, 4.90146e-06, 4.90119e-06], 0, 4.39534, 1668055610], "v": "v0.6"}
{"i": [["[\"window_reverse\", 1, 14, 14, 512, 7, \"float16\"]", "cuda -keys=cuda,gpu -max_num_threads=1024 -model=unknown -thread_warp_size=32", [-1, 16, 64, 49152, 2147483647, 1024, 8, 32], "", 0, []], [[], [["FU", 1, [0, 1, 2, 3]], ["SP", 1, 0, 100352, [14], 1], ["AN", 1, 0, 5], ["AN", 1, 1, 6]]]], "r": [[8.03777e-06, 8.05291e-06, 8.05453e-06], 0, 2.30437, 1668055893], "v": "v0.6"}
{"i": [["[\"window_reverse\", 1, 14, 14, 512, 7, \"float16\"]", "cuda -keys=cuda,gpu -max_num_threads=1024 -model=unknown -thread_warp_size=32", [-1, 16, 64, 49152, 2147483647, 1024, 8, 32], "", 0, []], [[], [["FU", 1, [0, 1, 2, 3]], ["SP", 1, 0, 100352, [49], 1], ["AN", 1, 0, 5], ["AN", 1, 1, 6]]]], "r": [[4.05926e-06, 4.07274e-06, 4.07124e-06], 0, 1.64257, 1668055892], "v": "v0.6"}
{"i": [["[\"window_reverse\", 1, 14, 14, 512, 7, \"float16\"]", "cuda -keys=cuda,gpu -max_num_threads=1024 -model=unknown -thread_warp_size=32", [-1, 16, 64, 49152, 2147483647, 1024, 8, 32], "", 0, []], [[], [["FU", 1, [0, 1, 2, 3]], ["SP", 1, 0, 100352, [2], 1], ["AN", 1, 0, 5], ["AN", 1, 1, 6]]]], "r": [[4.00008e-05, 4.00015e-05, 4.00055e-05], 0, 3.04415, 1668055893], "v": "v0.6"}
{"i": [["[\"window_reverse\", 1, 14, 14, 512, 7, \"float16\"]", "cuda -keys=cuda,gpu -max_num_threads=1024 -model=unknown -thread_warp_size=32", [-1, 16, 64, 49152, 2147483647, 1024, 8, 32], "", 0, []], [[], [["FU", 1, [0, 1, 2, 3]], ["SP", 1, 0, 100352, [1], 1], ["AN", 1, 0, 5], ["AN", 1, 1, 6]]]], "r": [[7.70666e-05, 7.7096e-05, 7.70818e-05], 0, 0.585866, 1668055891], "v": "v0.6"}
{"i": [["[\"window_reverse\", 1, 14, 14, 512, 7, \"float16\"]", "cuda -keys=cuda,gpu -max_num_threads=1024 -model=unknown -thread_warp_size=32", [-1, 16, 64, 49152, 2147483647, 1024, 8, 32], "", 0, []], [[], [["FU", 1, [0, 1, 2, 3]], ["SP", 1, 0, 100352, [4], 1], ["AN", 1, 0, 5], ["AN", 1, 1, 6]]]], "r": [[2.14326e-05, 2.14401e-05, 2.14384e-05], 0, 1.24968, 1668055892], "v": "v0.6"}
{"i": [["[\"window_reverse\", 1, 14, 14, 512, 7, \"float16\"]", "cuda -keys=cuda,gpu -max_num_threads=1024 -model=unknown -thread_warp_size=32", [-1, 16, 64, 49152, 2147483647, 1024, 8, 32], "", 0, []], [[], [["FU", 1, [0, 1, 2, 3]], ["SP", 1, 0, 100352, [7], 1], ["AN", 1, 0, 5], ["AN", 1, 1, 6]]]], "r": [[1.32902e-05, 1.33079e-05, 1.33017e-05], 0, 0.920612, 1668055891], "v": "v0.6"}
{"i": [["[\"window_reverse\", 1, 14, 14, 512, 7, \"float16\"]", "cuda -keys=cuda,gpu -max_num_threads=1024 -model=unknown -thread_warp_size=32", [-1, 16, 64, 49152, 2147483647, 1024, 8, 32], "", 0, []], [[], [["FU", 1, [0, 1, 2, 3]], ["SP", 1, 0, 100352, [8], 1], ["AN", 1, 0, 5], ["AN", 1, 1, 6]]]], "r": [[1.19842e-05, 1.19896e-05, 1.19775e-05], 0, 2.69513, 1668055893], "v": "v0.6"}
{"i": [["[\"window_reverse\", 1, 14, 14, 512, 7, \"float16\"]", "cuda -keys=cuda,gpu -max_num_threads=1024 -model=unknown -thread_warp_size=32", [-1, 16, 64, 49152, 2147483647, 1024, 8, 32], "", 0, []], [[], [["FU", 1, [0, 1, 2, 3]], ["SP", 1, 0, 100352, [64], 1], ["AN", 1, 0, 5], ["AN", 1, 1, 6]]]], "r": [[3.82782e-06, 3.83365e-06, 3.82609e-06], 0, 3.35726, 1668055894], "v": "v0.6"}
{"i": [["[\"window_reverse\", 1, 14, 14, 512, 7, \"float16\"]", "cuda -keys=cuda,gpu -max_num_threads=1024 -model=unknown -thread_warp_size=32", [-1, 16, 64, 49152, 2147483647, 1024, 8, 32], "", 0, []], [[], [["FU", 1, [0, 1, 2, 3]], ["SP", 1, 0, 100352, [28], 1], ["AN", 1, 0, 5], ["AN", 1, 1, 6]]]], "r": [[5.42013e-06, 5.44005e-06, 5.44475e-06], 0, 1.98832, 1668055892], "v": "v0.6"}
{"i": [["[\"window_reverse\", 1, 14, 14, 512, 7, \"float16\"]", "cuda -keys=cuda,gpu -max_num_threads=1024 -model=unknown -thread_warp_size=32", [-1, 16, 64, 49152, 2147483647, 1024, 8, 32], "", 0, []], [[], [["FU", 1, [0, 1, 2, 3]], ["SP", 1, 0, 100352, [56], 1], ["AN", 1, 0, 5], ["AN", 1, 1, 6]]]], "r": [[3.9331e-06, 3.94164e-06, 3.93528e-06], 0, 4.42264, 1668055895], "v": "v0.6"}
{"i": [["[\"window_reverse\", 1, 14, 14, 512, 7, \"float16\"]", "cuda -keys=cuda,gpu -max_num_threads=1024 -model=unknown -thread_warp_size=32", [-1, 16, 64, 49152, 2147483647, 1024, 8, 32], "", 0, []], [[], [["FU", 1, [0, 1, 2, 3]], ["SP", 1, 0, 100352, [16], 1], ["AN", 1, 0, 5], ["AN", 1, 1, 6]]]], "r": [[7.25396e-06, 7.26807e-06, 7.26768e-06], 0, 4.08005, 1668055894], "v": "v0.6"}
{"i": [["[\"window_reverse\", 1, 14, 14, 512, 7, \"float16\"]", "cuda -keys=cuda,gpu -max_num_threads=1024 -model=unknown -thread_warp_size=32", [-1, 16, 64, 49152, 2147483647, 1024, 8, 32], "", 0, []], [[], [["FU", 1, [0, 1, 2, 3]], ["SP", 1, 0, 100352, [32], 1], ["AN", 1, 0, 5], ["AN", 1, 1, 6]]]], "r": [[5.08037e-06, 5.10809e-06, 5.10572e-06], 0, 3.73085, 1668055894], "v": "v0.6"}
{"i": [["[\"window_reverse\", 1, 14, 14, 512, 7, \"float16\"]", "cuda -keys=cuda,gpu -max_num_threads=1024 -model=unknown -thread_warp_size=32", [-1, 16, 64, 49152, 2147483647, 1024, 8, 32], "", 0, []], [[], [["FU", 1, [0, 1, 2, 3]], ["SP", 1, 0, 100352, [64], 1], ["AN", 1, 0, 5], ["AN", 1, 1, 6]]]], "r": [[3.73911e-06, 3.7496e-06, 3.74789e-06], 0, 1.56594, 1668056176], "v": "v0.6"}
{"i": [["[\"window_reverse\", 1, 14, 14, 512, 7, \"float16\"]", "cuda -keys=cuda,gpu -max_num_threads=1024 -model=unknown -thread_warp_size=32", [-1, 16, 64, 49152, 2147483647, 1024, 8, 32], "", 0, []], [[], [["FU", 1, [0, 1, 2, 3]], ["SP", 1, 0, 100352, [4], 1], ["AN", 1, 0, 5], ["AN", 1, 1, 6]]]], "r": [[2.13784e-05, 2.13886e-05, 2.13878e-05], 0, 2.23992, 1668056176], "v": "v0.6"}
{"i": [["[\"window_reverse\", 1, 14, 14, 512, 7, \"float16\"]", "cuda -keys=cuda,gpu -max_num_threads=1024 -model=unknown -thread_warp_size=32", [-1, 16, 64, 49152, 2147483647, 1024, 8, 32], "", 0, []], [[], [["FU", 1, [0, 1, 2, 3]], ["SP", 1, 0, 100352, [16], 1], ["AN", 1, 0, 5], ["AN", 1, 1, 6]]]], "r": [[7.24293e-06, 7.26014e-06, 7.26175e-06], 0, 2.62995, 1668056177], "v": "v0.6"}
{"i": [["[\"window_reverse\", 1, 14, 14, 512, 7, \"float16\"]", "cuda -keys=cuda,gpu -max_num_threads=1024 -model=unknown -thread_warp_size=32", [-1, 16, 64, 49152, 2147483647, 1024, 8, 32], "", 0, []], [[], [["FU", 1, [0, 1, 2, 3]], ["SP", 1, 0, 100352, [1], 1], ["AN", 1, 0, 5], ["AN", 1, 1, 6]]]], "r": [[7.71395e-05, 7.71634e-05, 7.71538e-05], 0, 1.25269, 1668056175], "v": "v0.6"}
{"i": [["[\"window_reverse\", 1, 14, 14, 512, 7, \"float16\"]", "cuda -keys=cuda,gpu -max_num_threads=1024 -model=unknown -thread_warp_size=32", [-1, 16, 64, 49152, 2147483647, 1024, 8, 32], "", 0, []], [[], [["FU", 1, [0, 1, 2, 3]], ["SP", 1, 0, 100352, [8], 1], ["AN", 1, 0, 5], ["AN", 1, 1, 6]]]], "r": [[1.19284e-05, 1.19413e-05, 1.19383e-05], 0, 0.564902, 1668056174], "v": "v0.6"}
{"i": [["[\"window_reverse\", 1, 14, 14, 512, 7, \"float16\"]", "cuda -keys=cuda,gpu -max_num_threads=1024 -model=unknown -thread_warp_size=32", [-1, 16, 64, 49152, 2147483647, 1024, 8, 32], "", 0, []], [[], [["FU", 1, [0, 1, 2, 3]], ["SP", 1, 0, 100352, [49], 1], ["AN", 1, 0, 5], ["AN", 1, 1, 6]]]], "r": [[4.0545e-06, 4.06478e-06, 4.06061e-06], 0, 0.909287, 1668056175], "v": "v0.6"}
{"i": [["[\"window_reverse\", 1, 14, 14, 512, 7, \"float16\"]", "cuda -keys=cuda,gpu -max_num_threads=1024 -model=unknown -thread_warp_size=32", [-1, 16, 64, 49152, 2147483647, 1024, 8, 32], "", 0, []], [[], [["FU", 1, [0, 1, 2, 3]], ["SP", 1, 0, 100352, [56], 1], ["AN", 1, 0, 5], ["AN", 1, 1, 6]]]], "r": [[3.85587e-06, 3.86568e-06, 3.85809e-06], 0, 1.90723, 1668056176], "v": "v0.6"}
{"i": [["[\"window_reverse\", 1, 14, 14, 512, 7, \"float16\"]", "cuda -keys=cuda,gpu -max_num_threads=1024 -model=unknown -thread_warp_size=32", [-1, 16, 64, 49152, 2147483647, 1024, 8, 32], "", 0, []], [[], [["FU", 1, [0, 1, 2, 3]], ["SP", 1, 0, 100352, [7], 1], ["AN", 1, 0, 5], ["AN", 1, 1, 6]]]], "r": [[1.33577e-05, 1.33686e-05, 1.33691e-05], 0, 4.39309, 1668056178], "v": "v0.6"}
{"i": [["[\"window_reverse\", 1, 14, 14, 512, 7, \"float16\"]", "cuda -keys=cuda,gpu -max_num_threads=1024 -model=unknown -thread_warp_size=32", [-1, 16, 64, 49152, 2147483647, 1024, 8, 32], "", 0, []], [[], [["FU", 1, [0, 1, 2, 3]], ["SP", 1, 0, 100352, [28], 1], ["AN", 1, 0, 5], ["AN", 1, 1, 6]]]], "r": [[5.30105e-06, 5.31013e-06, 5.31517e-06], 0, 2.97221, 1668056177], "v": "v0.6"}
{"i": [["[\"window_reverse\", 1, 14, 14, 512, 7, \"float16\"]", "cuda -keys=cuda,gpu -max_num_threads=1024 -model=unknown -thread_warp_size=32", [-1, 16, 64, 49152, 2147483647, 1024, 8, 32], "", 0, []], [[], [["FU", 1, [0, 1, 2, 3]], ["SP", 1, 0, 100352, [32], 1], ["AN", 1, 0, 5], ["AN", 1, 1, 6]]]], "r": [[5.16374e-06, 5.17469e-06, 5.17479e-06], 0, 4.04391, 1668056178], "v": "v0.6"}
{"i": [["[\"window_reverse\", 1, 14, 14, 512, 7, \"float16\"]", "cuda -keys=cuda,gpu -max_num_threads=1024 -model=unknown -thread_warp_size=32", [-1, 16, 64, 49152, 2147483647, 1024, 8, 32], "", 0, []], [[], [["FU", 1, [0, 1, 2, 3]], ["SP", 1, 0, 100352, [14], 1], ["AN", 1, 0, 5], ["AN", 1, 1, 6]]]], "r": [[8.06254e-06, 8.06111e-06, 8.07834e-06], 0, 3.69301, 1668056178], "v": "v0.6"}
{"i": [["[\"window_reverse\", 1, 14, 14, 512, 7, \"float16\"]", "cuda -keys=cuda,gpu -max_num_threads=1024 -model=unknown -thread_warp_size=32", [-1, 16, 64, 49152, 2147483647, 1024, 8, 32], "", 0, []], [[], [["FU", 1, [0, 1, 2, 3]], ["SP", 1, 0, 100352, [2], 1], ["AN", 1, 0, 5], ["AN", 1, 1, 6]]]], "r": [[3.99546e-05, 3.99658e-05, 3.9946e-05], 0, 3.30809, 1668056177], "v": "v0.6"}
{"i": [["[\"window_reverse\", 1, 14, 14, 512, 7, \"float16\"]", "cuda -keys=cuda,gpu -max_num_threads=1024 -model=unknown -thread_warp_size=32", [-1, 16, 64, 49152, 2147483647, 1024, 8, 32], "", 0, []], [[], [["FU", 1, [0, 1, 2, 3]], ["SP", 1, 0, 100352, [2], 1], ["AN", 1, 0, 5], ["AN", 1, 1, 6]]]], "r": [[3.98601e-05, 3.98861e-05, 3.98717e-05], 0, 1.66161, 1668056460], "v": "v0.6"}
{"i": [["[\"window_reverse\", 1, 14, 14, 512, 7, \"float16\"]", "cuda -keys=cuda,gpu -max_num_threads=1024 -model=unknown -thread_warp_size=32", [-1, 16, 64, 49152, 2147483647, 1024, 8, 32], "", 0, []], [[], [["FU", 1, [0, 1, 2, 3]], ["SP", 1, 0, 100352, [16], 1], ["AN", 1, 0, 5], ["AN", 1, 1, 6]]]], "r": [[7.46204e-06, 7.47825e-06, 7.47483e-06], 0, 1.29208, 1668056459], "v": "v0.6"}
{"i": [["[\"window_reverse\", 1, 14, 14, 512, 7, \"float16\"]", "cuda -keys=cuda,gpu -max_num_threads=1024 -model=unknown -thread_warp_size=32", [-1, 16, 64, 49152, 2147483647, 1024, 8, 32], "", 0, []], [[], [["FU", 1, [0, 1, 2, 3]], ["SP", 1, 0, 100352, [4], 1], ["AN", 1, 0, 5], ["AN", 1, 1, 6]]]], "r": [[2.13412e-05, 2.13588e-05, 2.13451e-05], 0, 2.00567, 1668056460], "v": "v0.6"}
{"i": [["[\"window_reverse\", 1, 14, 14, 512, 7, \"float16\"]", "cuda -keys=cuda,gpu -max_num_threads=1024 -model=unknown -thread_warp_size=32", [-1, 16, 64, 49152, 2147483647, 1024, 8, 32], "", 0, []], [[], [["FU", 1, [0, 1, 2, 3]], ["SP", 1, 0, 100352, [49], 1], ["AN", 1, 0, 5], ["AN", 1, 1, 6]]]], "r": [[4.26712e-06, 4.27816e-06, 4.27848e-06], 0, 0.606562, 1668056458], "v": "v0.6"}
{"i": [["[\"window_reverse\", 1, 14, 14, 512, 7, \"float16\"]", "cuda -keys=cuda,gpu -max_num_threads=1024 -model=unknown -thread_warp_size=32", [-1, 16, 64, 49152, 2147483647, 1024, 8, 32], "", 0, []], [[], [["FU", 1, [0, 1, 2, 3]], ["SP", 1, 0, 100352, [8], 1], ["AN", 1, 0, 5], ["AN", 1, 1, 6]]]], "r": [[1.20357e-05, 1.20518e-05, 1.20544e-05], 0, 0.931698, 1668056459], "v": "v0.6"}
{"i": [["[\"window_reverse\", 1, 14, 14, 512, 7, \"float16\"]", "cuda -keys=cuda,gpu -max_num_threads=1024 -model=unknown -thread_warp_size=32", [-1, 16, 64, 49152, 2147483647, 1024, 8, 32], "", 0, []], [[], [["FU", 1, [0, 1, 2, 3]], ["SP", 1, 0, 100352, [32], 1], ["AN", 1, 0, 5], ["AN", 1, 1, 6]]]], "r": [[4.98008e-06, 4.99972e-06, 4.99461e-06], 0, 2.32494, 1668056460], "v": "v0.6"}
{"i": [["[\"window_reverse\", 1, 14, 14, 512, 7, \"float16\"]", "cuda -keys=cuda,gpu -max_num_threads=1024 -model=unknown -thread_warp_size=32", [-1, 16, 64, 49152, 2147483647, 1024, 8, 32], "", 0, []], [[], [["FU", 1, [0, 1, 2, 3]], ["SP", 1, 0, 100352, [7], 1], ["AN", 1, 0, 5], ["AN", 1, 1, 6]]]], "r": [[1.33549e-05, 1.33908e-05, 1.33818e-05], 0, 2.71549, 1668056461], "v": "v0.6"}
{"i": [["[\"window_reverse\", 1, 14, 14, 512, 7, \"float16\"]", "cuda -keys=cuda,gpu -max_num_threads=1024 -model=unknown -thread_warp_size=32", [-1, 16, 64, 49152, 2147483647, 1024, 8, 32], "", 0, []], [[], [["FU", 1, [0, 1, 2, 3]], ["SP", 1, 0, 100352, [14], 1], ["AN", 1, 0, 5], ["AN", 1, 1, 6]]]], "r": [[7.92666e-06, 7.93576e-06, 7.93219e-06], 0, 3.06284, 1668056461], "v": "v0.6"}
{"i": [["[\"window_reverse\", 1, 14, 14, 512, 7, \"float16\"]", "cuda -keys=cuda,gpu -max_num_threads=1024 -model=unknown -thread_warp_size=32", [-1, 16, 64, 49152, 2147483647, 1024, 8, 32], "", 0, []], [[], [["FU", 1, [0, 1, 2, 3]], ["SP", 1, 0, 100352, [28], 1], ["AN", 1, 0, 5], ["AN", 1, 1, 6]]]], "r": [[5.30981e-06, 5.32394e-06, 5.32127e-06], 0, 3.37989, 1668056461], "v": "v0.6"}
{"i": [["[\"window_reverse\", 1, 14, 14, 512, 7, \"float16\"]", "cuda -keys=cuda,gpu -max_num_threads=1024 -model=unknown -thread_warp_size=32", [-1, 16, 64, 49152, 2147483647, 1024, 8, 32], "", 0, []], [[], [["FU", 1, [0, 1, 2, 3]], ["SP", 1, 0, 100352, [1], 1], ["AN", 1, 0, 5], ["AN", 1, 1, 6]]]], "r": [[7.70846e-05, 7.70995e-05, 7.70963e-05], 0, 3.76376, 1668056462], "v": "v0.6"}
{"i": [["[\"window_reverse\", 1, 14, 14, 512, 7, \"float16\"]", "cuda -keys=cuda,gpu -max_num_threads=1024 -model=unknown -thread_warp_size=32", [-1, 16, 64, 49152, 2147483647, 1024, 8, 32], "", 0, []], [[], [["FU", 1, [0, 1, 2, 3]], ["SP", 1, 0, 100352, [64], 1], ["AN", 1, 0, 5], ["AN", 1, 1, 6]]]], "r": [[3.71988e-06, 3.73149e-06, 3.73104e-06], 0, 4.437, 1668056462], "v": "v0.6"}
{"i": [["[\"window_reverse\", 1, 14, 14, 512, 7, \"float16\"]", "cuda -keys=cuda,gpu -max_num_threads=1024 -model=unknown -thread_warp_size=32", [-1, 16, 64, 49152, 2147483647, 1024, 8, 32], "", 0, []], [[], [["FU", 1, [0, 1, 2, 3]], ["SP", 1, 0, 100352, [56], 1], ["AN", 1, 0, 5], ["AN", 1, 1, 6]]]], "r": [[3.89698e-06, 3.90547e-06, 3.90417e-06], 0, 4.1024, 1668056462], "v": "v0.6"}
{"i": [["[\"window_reverse\", 1, 14, 14, 512, 7, \"float16\"]", "cuda -keys=cuda,gpu -max_num_threads=1024 -model=unknown -thread_warp_size=32", [-1, 16, 64, 49152, 2147483647, 1024, 8, 32], "", 0, []], [[], [["FU", 1, [0, 1, 2, 3]], ["SP", 1, 0, 100352, [7], 1], ["AN", 1, 0, 5], ["AN", 1, 1, 6]]]], "r": [[1.33568e-05, 1.33727e-05, 1.33645e-05], 0, 1.62824, 1668056743], "v": "v0.6"}
{"i": [["[\"window_reverse\", 1, 14, 14, 512, 7, \"float16\"]", "cuda -keys=cuda,gpu -max_num_threads=1024 -model=unknown -thread_warp_size=32", [-1, 16, 64, 49152, 2147483647, 1024, 8, 32], "", 0, []], [[], [["FU", 1, [0, 1, 2, 3]], ["SP", 1, 0, 100352, [8], 1], ["AN", 1, 0, 5], ["AN", 1, 1, 6]]]], "r": [[1.2063e-05, 1.20632e-05, 1.20666e-05], 0, 2.31862, 1668056744], "v": "v0.6"}
{"i": [["[\"window_reverse\", 1, 14, 14, 512, 7, \"float16\"]", "cuda -keys=cuda,gpu -max_num_threads=1024 -model=unknown -thread_warp_size=32", [-1, 16, 64, 49152, 2147483647, 1024, 8, 32], "", 0, []], [[], [["FU", 1, [0, 1, 2, 3]], ["SP", 1, 0, 100352, [64], 1], ["AN", 1, 0, 5], ["AN", 1, 1, 6]]]], "r": [[3.75777e-06, 3.7726e-06, 3.76951e-06], 0, 0.575265, 1668056742], "v": "v0.6"}
{"i": [["[\"window_reverse\", 1, 14, 14, 512, 7, \"float16\"]", "cuda -keys=cuda,gpu -max_num_threads=1024 -model=unknown -thread_warp_size=32", [-1, 16, 64, 49152, 2147483647, 1024, 8, 32], "", 0, []], [[], [["FU", 1, [0, 1, 2, 3]], ["SP", 1, 0, 100352, [28], 1], ["AN", 1, 0, 5], ["AN", 1, 1, 6]]]], "r": [[5.2432e-06, 5.25589e-06, 5.25691e-06], 0, 0.886915, 1668056742], "v": "v0.6"}
{"i": [["[\"window_reverse\", 1, 14, 14, 512, 7, \"float16\"]", "cuda -keys=cuda,gpu -max_num_threads=1024 -model=unknown -thread_warp_size=32", [-1, 16, 64, 49152, 2147483647, 1024, 8, 32], "", 0, []], [[], [["FU", 1, [0, 1, 2, 3]], ["SP", 1, 0, 100352, [2], 1], ["AN", 1, 0, 5], ["AN", 1, 1, 6]]]], "r": [[3.99366e-05, 3.99362e-05, 3.99513e-05], 0, 1.23506, 1668056742], "v": "v0.6"}
{"i": [["[\"window_reverse\", 1, 14, 14, 512, 7, \"float16\"]", "cuda -keys=cuda,gpu -max_num_threads=1024 -model=unknown -thread_warp_size=32", [-1, 16, 64, 49152, 2147483647, 1024, 8, 32], "", 0, []], [[], [["FU", 1, [0, 1, 2, 3]], ["SP", 1, 0, 100352, [32], 1], ["AN", 1, 0, 5], ["AN", 1, 1, 6]]]], "r": [[4.97866e-06, 4.98836e-06, 4.99098e-06], 0, 2.67514, 1668056744], "v": "v0.6"}
{"i": [["[\"window_reverse\", 1, 14, 14, 512, 7, \"float16\"]", "cuda -keys=cuda,gpu -max_num_threads=1024 -model=unknown -thread_warp_size=32", [-1, 16, 64, 49152, 2147483647, 1024, 8, 32], "", 0, []], [[], [["FU", 1, [0, 1, 2, 3]], ["SP", 1, 0, 100352, [14], 1], ["AN", 1, 0, 5], ["AN", 1, 1, 6]]]], "r": [[8.04558e-06, 8.05314e-06, 8.05772e-06], 0, 3.34081, 1668056745], "v": "v0.6"}
{"i": [["[\"window_reverse\", 1, 14, 14, 512, 7, \"float16\"]", "cuda -keys=cuda,gpu -max_num_threads=1024 -model=unknown -thread_warp_size=32", [-1, 16, 64, 49152, 2147483647, 1024, 8, 32], "", 0, []], [[], [["FU", 1, [0, 1, 2, 3]], ["SP", 1, 0, 100352, [1], 1], ["AN", 1, 0, 5], ["AN", 1, 1, 6]]]], "r": [[7.71319e-05, 7.71685e-05, 7.71623e-05], 0, 1.96602, 1668056743], "v": "v0.6"}
{"i": [["[\"window_reverse\", 1, 14, 14, 512, 7, \"float16\"]", "cuda -keys=cuda,gpu -max_num_threads=1024 -model=unknown -thread_warp_size=32", [-1, 16, 64, 49152, 2147483647, 1024, 8, 32], "", 0, []], [[], [["FU", 1, [0, 1, 2, 3]], ["SP", 1, 0, 100352, [56], 1], ["AN", 1, 0, 5], ["AN", 1, 1, 6]]]], "r": [[3.91582e-06, 3.93816e-06, 3.9404e-06], 0, 3.01353, 1668056744], "v": "v0.6"}
{"i": [["[\"window_reverse\", 1, 14, 14, 512, 7, \"float16\"]", "cuda -keys=cuda,gpu -max_num_threads=1024 -model=unknown -thread_warp_size=32", [-1, 16, 64, 49152, 2147483647, 1024, 8, 32], "", 0, []], [[], [["FU", 1, [0, 1, 2, 3]], ["SP", 1, 0, 100352, [49], 1], ["AN", 1, 0, 5], ["AN", 1, 1, 6]]]], "r": [[4.07115e-06, 4.10223e-06, 4.10206e-06], 0, 3.72753, 1668056745], "v": "v0.6"}
{"i": [["[\"window_reverse\", 1, 14, 14, 512, 7, \"float16\"]", "cuda -keys=cuda,gpu -max_num_threads=1024 -model=unknown -thread_warp_size=32", [-1, 16, 64, 49152, 2147483647, 1024, 8, 32], "", 0, []], [[], [["FU", 1, [0, 1, 2, 3]], ["SP", 1, 0, 100352, [4], 1], ["AN", 1, 0, 5], ["AN", 1, 1, 6]]]], "r": [[2.13502e-05, 2.13609e-05, 2.13647e-05], 0, 4.38631, 1668056746], "v": "v0.6"}
{"i": [["[\"window_reverse\", 1, 14, 14, 512, 7, \"float16\"]", "cuda -keys=cuda,gpu -max_num_threads=1024 -model=unknown -thread_warp_size=32", [-1, 16, 64, 49152, 2147483647, 1024, 8, 32], "", 0, []], [[], [["FU", 1, [0, 1, 2, 3]], ["SP", 1, 0, 100352, [16], 1], ["AN", 1, 0, 5], ["AN", 1, 1, 6]]]], "r": [[7.29634e-06, 7.31581e-06, 7.31208e-06], 0, 4.05574, 1668056745], "v": "v0.6"}
{"i": [["[\"window_reverse\", 1, 14, 14, 512, 7, \"float16\"]", "cuda -keys=cuda,gpu -max_num_threads=1024 -model=unknown -thread_warp_size=32", [-1, 16, 64, 49152, 2147483647, 1024, 8, 32], "", 0, []], [[], [["FU", 1, [0, 1, 2, 3]], ["SP", 1, 0, 100352, [16], 1], ["AN", 1, 0, 5], ["AN", 1, 1, 6]]]], "r": [[7.21877e-06, 7.23329e-06, 7.23096e-06], 0, 2.29001, 1668057028], "v": "v0.6"}
{"i": [["[\"window_reverse\", 1, 14, 14, 512, 7, \"float16\"]", "cuda -keys=cuda,gpu -max_num_threads=1024 -model=unknown -thread_warp_size=32", [-1, 16, 64, 49152, 2147483647, 1024, 8, 32], "", 0, []], [[], [["FU", 1, [0, 1, 2, 3]], ["SP", 1, 0, 100352, [64], 1], ["AN", 1, 0, 5], ["AN", 1, 1, 6]]]], "r": [[3.7321e-06, 3.7445e-06, 3.74342e-06], 0, 0.575704, 1668057026], "v": "v0.6"}
{"i": [["[\"window_reverse\", 1, 14, 14, 512, 7, \"float16\"]", "cuda -keys=cuda,gpu -max_num_threads=1024 -model=unknown -thread_warp_size=32", [-1, 16, 64, 49152, 2147483647, 1024, 8, 32], "", 0, []], [[], [["FU", 1, [0, 1, 2, 3]], ["SP", 1, 0, 100352, [8], 1], ["AN", 1, 0, 5], ["AN", 1, 1, 6]]]], "r": [[1.20111e-05, 1.20232e-05, 1.20197e-05], 0, 1.59962, 1668057027], "v": "v0.6"}
{"i": [["[\"window_reverse\", 1, 14, 14, 512, 7, \"float16\"]", "cuda -keys=cuda,gpu -max_num_threads=1024 -model=unknown -thread_warp_size=32", [-1, 16, 64, 49152, 2147483647, 1024, 8, 32], "", 0, []], [[], [["FU", 1, [0, 1, 2, 3]], ["SP", 1, 0, 100352, [49], 1], ["AN", 1, 0, 5], ["AN", 1, 1, 6]]]], "r": [[3.97642e-06, 3.98733e-06, 3.98662e-06], 0, 1.22682, 1668057027], "v": "v0.6"}
{"i": [["[\"window_reverse\", 1, 14, 14, 512, 7, \"float16\"]", "cuda -keys=cuda,gpu -max_num_threads=1024 -model=unknown -thread_warp_size=32", [-1, 16, 64, 49152, 2147483647, 1024, 8, 32], "", 0, []], [[], [["FU", 1, [0, 1, 2, 3]], ["SP", 1, 0, 100352, [28], 1], ["AN", 1, 0, 5], ["AN", 1, 1, 6]]]], "r": [[5.28739e-06, 5.30344e-06, 5.30296e-06], 0, 0.924088, 1668057026], "v": "v0.6"}
{"i": [["[\"window_reverse\", 1, 14, 14, 512, 7, \"float16\"]", "cuda -keys=cuda,gpu -max_num_threads=1024 -model=unknown -thread_warp_size=32", [-1, 16, 64, 49152, 2147483647, 1024, 8, 32], "", 0, []], [[], [["FU", 1, [0, 1, 2, 3]], ["SP", 1, 0, 100352, [4], 1], ["AN", 1, 0, 5], ["AN", 1, 1, 6]]]], "r": [[2.14243e-05, 2.1433e-05, 2.14342e-05], 0, 1.9343, 1668057027], "v": "v0.6"}
{"i": [["[\"window_reverse\", 1, 14, 14, 512, 7, \"float16\"]", "cuda -keys=cuda,gpu -max_num_threads=1024 -model=unknown -thread_warp_size=32", [-1, 16, 64, 49152, 2147483647, 1024, 8, 32], "", 0, []], [[], [["FU", 1, [0, 1, 2, 3]], ["SP", 1, 0, 100352, [1], 1], ["AN", 1, 0, 5], ["AN", 1, 1, 6]]]], "r": [[7.707e-05, 7.70879e-05, 7.70935e-05], 0, 2.99639, 1668057028], "v": "v0.6"}
{"i": [["[\"window_reverse\", 1, 14, 14, 512, 7, \"float16\"]", "cuda -keys=cuda,gpu -max_num_threads=1024 -model=unknown -thread_warp_size=32", [-1, 16, 64, 49152, 2147483647, 1024, 8, 32], "", 0, []], [[], [["FU", 1, [0, 1, 2, 3]], ["SP", 1, 0, 100352, [7], 1], ["AN", 1, 0, 5], ["AN", 1, 1, 6]]]], "r": [[1.34022e-05, 1.34068e-05, 1.34132e-05], 0, 2.66063, 1668057028], "v": "v0.6"}
{"i": [["[\"window_reverse\", 1, 14, 14, 512, 7, \"float16\"]", "cuda -keys=cuda,gpu -max_num_threads=1024 -model=unknown -thread_warp_size=32", [-1, 16, 64, 49152, 2147483647, 1024, 8, 32], "", 0, []], [[], [["FU", 1, [0, 1, 2, 3]], ["SP", 1, 0, 100352, [56], 1], ["AN", 1, 0, 5], ["AN", 1, 1, 6]]]], "r": [[3.8416e-06, 3.85497e-06, 3.85624e-06], 0, 4.04939, 1668057029], "v": "v0.6"}
{"i": [["[\"window_reverse\", 1, 14, 14, 512, 7, \"float16\"]", "cuda -keys=cuda,gpu -max_num_threads=1024 -model=unknown -thread_warp_size=32", [-1, 16, 64, 49152, 2147483647, 1024, 8, 32], "", 0, []], [[], [["FU", 1, [0, 1, 2, 3]], ["SP", 1, 0, 100352, [14], 1], ["AN", 1, 0, 5], ["AN", 1, 1, 6]]]], "r": [[7.96711e-06, 7.97605e-06, 7.97793e-06], 0, 3.34696, 1668057029], "v": "v0.6"}
{"i": [["[\"window_reverse\", 1, 14, 14, 512, 7, \"float16\"]", "cuda -keys=cuda,gpu -max_num_threads=1024 -model=unknown -thread_warp_size=32", [-1, 16, 64, 49152, 2147483647, 1024, 8, 32], "", 0, []], [[], [["FU", 1, [0, 1, 2, 3]], ["SP", 1, 0, 100352, [2], 1], ["AN", 1, 0, 5], ["AN", 1, 1, 6]]]], "r": [[3.98661e-05, 3.98612e-05, 3.98677e-05], 0, 4.39991, 1668057030], "v": "v0.6"}
{"i": [["[\"window_reverse\", 1, 14, 14, 512, 7, \"float16\"]", "cuda -keys=cuda,gpu -max_num_threads=1024 -model=unknown -thread_warp_size=32", [-1, 16, 64, 49152, 2147483647, 1024, 8, 32], "", 0, []], [[], [["FU", 1, [0, 1, 2, 3]], ["SP", 1, 0, 100352, [32], 1], ["AN", 1, 0, 5], ["AN", 1, 1, 6]]]], "r": [[5.11953e-06, 5.13187e-06, 5.13303e-06], 0, 3.70592, 1668057029], "v": "v0.6"}
{"i": [["[\"window_reverse\", 1, 14, 14, 512, 7, \"float16\"]", "cuda -keys=cuda,gpu -max_num_threads=1024 -model=unknown -thread_warp_size=32", [-1, 16, 64, 49152, 2147483647, 1024, 8, 32], "", 0, []], [[], [["FU", 1, [0, 1, 2, 3]], ["SP", 1, 0, 100352, [7], 1], ["AN", 1, 0, 5], ["AN", 1, 1, 6]]]], "r": [[1.32835e-05, 1.32916e-05, 1.32926e-05], 0, 0.585944, 1668057310], "v": "v0.6"}
{"i": [["[\"window_reverse\", 1, 14, 14, 512, 7, \"float16\"]", "cuda -keys=cuda,gpu -max_num_threads=1024 -model=unknown -thread_warp_size=32", [-1, 16, 64, 49152, 2147483647, 1024, 8, 32], "", 0, []], [[], [["FU", 1, [0, 1, 2, 3]], ["SP", 1, 0, 100352, [64], 1], ["AN", 1, 0, 5], ["AN", 1, 1, 6]]]], "r": [[3.81907e-06, 3.83582e-06, 3.83413e-06], 0, 1.97578, 1668057311], "v": "v0.6"}
{"i": [["[\"window_reverse\", 1, 14, 14, 512, 7, \"float16\"]", "cuda -keys=cuda,gpu -max_num_threads=1024 -model=unknown -thread_warp_size=32", [-1, 16, 64, 49152, 2147483647, 1024, 8, 32], "", 0, []], [[], [["FU", 1, [0, 1, 2, 3]], ["SP", 1, 0, 100352, [16], 1], ["AN", 1, 0, 5], ["AN", 1, 1, 6]]]], "r": [[7.3555e-06, 7.38259e-06, 7.38493e-06], 0, 0.905029, 1668057310], "v": "v0.6"}
{"i": [["[\"window_reverse\", 1, 14, 14, 512, 7, \"float16\"]", "cuda -keys=cuda,gpu -max_num_threads=1024 -model=unknown -thread_warp_size=32", [-1, 16, 64, 49152, 2147483647, 1024, 8, 32], "", 0, []], [[], [["FU", 1, [0, 1, 2, 3]], ["SP", 1, 0, 100352, [1], 1], ["AN", 1, 0, 5], ["AN", 1, 1, 6]]]], "r": [[7.70772e-05, 7.71016e-05, 7.70937e-05], 0, 1.24535, 1668057310], "v": "v0.6"}
{"i": [["[\"window_reverse\", 1, 14, 14, 512, 7, \"float16\"]", "cuda -keys=cuda,gpu -max_num_threads=1024 -model=unknown -thread_warp_size=32", [-1, 16, 64, 49152, 2147483647, 1024, 8, 32], "", 0, []], [[], [["FU", 1, [0, 1, 2, 3]], ["SP", 1, 0, 100352, [28], 1], ["AN", 1, 0, 5], ["AN", 1, 1, 6]]]], "r": [[5.29161e-06, 5.31044e-06, 5.31292e-06], 0, 1.63026, 1668057311], "v": "v0.6"}
{"i": [["[\"window_reverse\", 1, 14, 14, 512, 7, \"float16\"]", "cuda -keys=cuda,gpu -max_num_threads=1024 -model=unknown -thread_warp_size=32", [-1, 16, 64, 49152, 2147483647, 1024, 8, 32], "", 0, []], [[], [["FU", 1, [0, 1, 2, 3]], ["SP", 1, 0, 100352, [4], 1], ["AN", 1, 0, 5], ["AN", 1, 1, 6]]]], "r": [[2.13408e-05, 2.1369e-05, 2.13654e-05], 0, 2.67946, 1668057312], "v": "v0.6"}
{"i": [["[\"window_reverse\", 1, 14, 14, 512, 7, \"float16\"]", "cuda -keys=cuda,gpu -max_num_threads=1024 -model=unknown -thread_warp_size=32", [-1, 16, 64, 49152, 2147483647, 1024, 8, 32], "", 0, []], [[], [["FU", 1, [0, 1, 2, 3]], ["SP", 1, 0, 100352, [56], 1], ["AN", 1, 0, 5], ["AN", 1, 1, 6]]]], "r": [[3.84298e-06, 3.85697e-06, 3.85572e-06], 0, 2.28319, 1668057311], "v": "v0.6"}
{"i": [["[\"window_reverse\", 1, 14, 14, 512, 7, \"float16\"]", "cuda -keys=cuda,gpu -max_num_threads=1024 -model=unknown -thread_warp_size=32", [-1, 16, 64, 49152, 2147483647, 1024, 8, 32], "", 0, []], [[], [["FU", 1, [0, 1, 2, 3]], ["SP", 1, 0, 100352, [8], 1], ["AN", 1, 0, 5], ["AN", 1, 1, 6]]]], "r": [[1.19814e-05, 1.19893e-05, 1.20019e-05], 0, 3.00673, 1668057312], "v": "v0.6"}
{"i": [["[\"window_reverse\", 1, 14, 14, 512, 7, \"float16\"]", "cuda -keys=cuda,gpu -max_num_threads=1024 -model=unknown -thread_warp_size=32", [-1, 16, 64, 49152, 2147483647, 1024, 8, 32], "", 0, []], [[], [["FU", 1, [0, 1, 2, 3]], ["SP", 1, 0, 100352, [32], 1], ["AN", 1, 0, 5], ["AN", 1, 1, 6]]]], "r": [[4.9318e-06, 4.94288e-06, 4.94486e-06], 0, 3.35533, 1668057313], "v": "v0.6"}
{"i": [["[\"window_reverse\", 1, 14, 14, 512, 7, \"float16\"]", "cuda -keys=cuda,gpu -max_num_threads=1024 -model=unknown -thread_warp_size=32", [-1, 16, 64, 49152, 2147483647, 1024, 8, 32], "", 0, []], [[], [["FU", 1, [0, 1, 2, 3]], ["SP", 1, 0, 100352, [14], 1], ["AN", 1, 0, 5], ["AN", 1, 1, 6]]]], "r": [[8.02671e-06, 8.02403e-06, 8.0249e-06], 0, 3.72372, 1668057313], "v": "v0.6"}
{"i": [["[\"window_reverse\", 1, 14, 14, 512, 7, \"float16\"]", "cuda -keys=cuda,gpu -max_num_threads=1024 -model=unknown -thread_warp_size=32", [-1, 16, 64, 49152, 2147483647, 1024, 8, 32], "", 0, []], [[], [["FU", 1, [0, 1, 2, 3]], ["SP", 1, 0, 100352, [49], 1], ["AN", 1, 0, 5], ["AN", 1, 1, 6]]]], "r": [[4.21805e-06, 4.23194e-06, 4.22893e-06], 0, 4.05831, 1668057313], "v": "v0.6"}
{"i": [["[\"window_reverse\", 1, 14, 14, 512, 7, \"float16\"]", "cuda -keys=cuda,gpu -max_num_threads=1024 -model=unknown -thread_warp_size=32", [-1, 16, 64, 49152, 2147483647, 1024, 8, 32], "", 0, []], [[], [["FU", 1, [0, 1, 2, 3]], ["SP", 1, 0, 100352, [2], 1], ["AN", 1, 0, 5], ["AN", 1, 1, 6]]]], "r": [[3.98759e-05, 3.98962e-05, 3.98825e-05], 0, 4.41224, 1668057314], "v": "v0.6"}
{"i": [["[\"window_reverse\", 1, 14, 14, 512, 7, \"float16\"]", "cuda -keys=cuda,gpu -max_num_threads=1024 -model=unknown -thread_warp_size=32", [-1, 16, 64, 49152, 2147483647, 1024, 8, 32], "", 0, []], [[], [["FU", 1, [0, 1, 2, 3]], ["SP", 1, 0, 100352, [7], 1], ["AN", 1, 0, 5], ["AN", 1, 1, 6]]]], "r": [[1.32595e-05, 1.32625e-05, 1.32668e-05], 0, 1.6359, 1668057594], "v": "v0.6"}
{"i": [["[\"window_reverse\", 1, 14, 14, 512, 7, \"float16\"]", "cuda -keys=cuda,gpu -max_num_threads=1024 -model=unknown -thread_warp_size=32", [-1, 16, 64, 49152, 2147483647, 1024, 8, 32], "", 0, []], [[], [["FU", 1, [0, 1, 2, 3]], ["SP", 1, 0, 100352, [32], 1], ["AN", 1, 0, 5], ["AN", 1, 1, 6]]]], "r": [[4.97553e-06, 4.98214e-06, 4.98169e-06], 0, 1.96232, 1668057595], "v": "v0.6"}
{"i": [["[\"window_reverse\", 1, 14, 14, 512, 7, \"float16\"]", "cuda -keys=cuda,gpu -max_num_threads=1024 -model=unknown -thread_warp_size=32", [-1, 16, 64, 49152, 2147483647, 1024, 8, 32], "", 0, []], [[], [["FU", 1, [0, 1, 2, 3]], ["SP", 1, 0, 100352, [4], 1], ["AN", 1, 0, 5], ["AN", 1, 1, 6]]]], "r": [[2.14409e-05, 2.14537e-05, 2.14436e-05], 0, 1.29951, 1668057594], "v": "v0.6"}
{"i": [["[\"window_reverse\", 1, 14, 14, 512, 7, \"float16\"]", "cuda -keys=cuda,gpu -max_num_threads=1024 -model=unknown -thread_warp_size=32", [-1, 16, 64, 49152, 2147483647, 1024, 8, 32], "", 0, []], [[], [["FU", 1, [0, 1, 2, 3]], ["SP", 1, 0, 100352, [14], 1], ["AN", 1, 0, 5], ["AN", 1, 1, 6]]]], "r": [[7.9794e-06, 7.99272e-06, 7.982e-06], 0, 0.936959, 1668057594], "v": "v0.6"}
{"i": [["[\"window_reverse\", 1, 14, 14, 512, 7, \"float16\"]", "cuda -keys=cuda,gpu -max_num_threads=1024 -model=unknown -thread_warp_size=32", [-1, 16, 64, 49152, 2147483647, 1024, 8, 32], "", 0, []], [[], [["FU", 1, [0, 1, 2, 3]], ["SP", 1, 0, 100352, [16], 1], ["AN", 1, 0, 5], ["AN", 1, 1, 6]]]], "r": [[7.37351e-06, 7.36727e-06, 7.36662e-06], 0, 0.58863, 1668057593], "v": "v0.6"}
{"i": [["[\"window_reverse\", 1, 14, 14, 512, 7, \"float16\"]", "cuda -keys=cuda,gpu -max_num_threads=1024 -model=unknown -thread_warp_size=32", [-1, 16, 64, 49152, 2147483647, 1024, 8, 32], "", 0, []], [[], [["FU", 1, [0, 1, 2, 3]], ["SP", 1, 0, 100352, [2], 1], ["AN", 1, 0, 5], ["AN", 1, 1, 6]]]], "r": [[3.98983e-05, 3.99187e-05, 3.98867e-05], 0, 2.31842, 1668057595], "v": "v0.6"}
{"i": [["[\"window_reverse\", 1, 14, 14, 512, 7, \"float16\"]", "cuda -keys=cuda,gpu -max_num_threads=1024 -model=unknown -thread_warp_size=32", [-1, 16, 64, 49152, 2147483647, 1024, 8, 32], "", 0, []], [[], [["FU", 1, [0, 1, 2, 3]], ["SP", 1, 0, 100352, [56], 1], ["AN", 1, 0, 5], ["AN", 1, 1, 6]]]], "r": [[3.94714e-06, 3.96118e-06, 3.95927e-06], 0, 2.70617, 1668057595], "v": "v0.6"}
{"i": [["[\"window_reverse\", 1, 14, 14, 512, 7, \"float16\"]", "cuda -keys=cuda,gpu -max_num_threads=1024 -model=unknown -thread_warp_size=32", [-1, 16, 64, 49152, 2147483647, 1024, 8, 32], "", 0, []], [[], [["FU", 1, [0, 1, 2, 3]], ["SP", 1, 0, 100352, [8], 1], ["AN", 1, 0, 5], ["AN", 1, 1, 6]]]], "r": [[1.20421e-05, 1.20651e-05, 1.20593e-05], 0, 3.05253, 1668057596], "v": "v0.6"}
{"i": [["[\"window_reverse\", 1, 14, 14, 512, 7, \"float16\"]", "cuda -keys=cuda,gpu -max_num_threads=1024 -model=unknown -thread_warp_size=32", [-1, 16, 64, 49152, 2147483647, 1024, 8, 32], "", 0, []], [[], [["FU", 1, [0, 1, 2, 3]], ["SP", 1, 0, 100352, [1], 1], ["AN", 1, 0, 5], ["AN", 1, 1, 6]]]], "r": [[7.71361e-05, 7.71454e-05, 7.71519e-05], 0, 4.12068, 1668057597], "v": "v0.6"}
{"i": [["[\"window_reverse\", 1, 14, 14, 512, 7, \"float16\"]", "cuda -keys=cuda,gpu -max_num_threads=1024 -model=unknown -thread_warp_size=32", [-1, 16, 64, 49152, 2147483647, 1024, 8, 32], "", 0, []], [[], [["FU", 1, [0, 1, 2, 3]], ["SP", 1, 0, 100352, [28], 1], ["AN", 1, 0, 5], ["AN", 1, 1, 6]]]], "r": [[5.29112e-06, 5.30469e-06, 5.3056e-06], 0, 3.40451, 1668057596], "v": "v0.6"}
{"i": [["[\"window_reverse\", 1, 14, 14, 512, 7, \"float16\"]", "cuda -keys=cuda,gpu -max_num_threads=1024 -model=unknown -thread_warp_size=32", [-1, 16, 64, 49152, 2147483647, 1024, 8, 32], "", 0, []], [[], [["FU", 1, [0, 1, 2, 3]], ["SP", 1, 0, 100352, [64], 1], ["AN", 1, 0, 5], ["AN", 1, 1, 6]]]], "r": [[3.9057e-06, 3.91849e-06, 3.91674e-06], 0, 3.78193, 1668057596], "v": "v0.6"}
{"i": [["[\"window_reverse\", 1, 14, 14, 512, 7, \"float16\"]", "cuda -keys=cuda,gpu -max_num_threads=1024 -model=unknown -thread_warp_size=32", [-1, 16, 64, 49152, 2147483647, 1024, 8, 32], "", 0, []], [[], [["FU", 1, [0, 1, 2, 3]], ["SP", 1, 0, 100352, [49], 1], ["AN", 1, 0, 5], ["AN", 1, 1, 6]]]], "r": [[4.23609e-06, 4.2575e-06, 4.25949e-06], 0, 4.46811, 1668057597], "v": "v0.6"}
{"i": [["[\"window_reverse\", 1, 14, 14, 512, 7, \"float16\"]", "cuda -keys=cuda,gpu -max_num_threads=1024 -model=unknown -thread_warp_size=32", [-1, 16, 64, 49152, 2147483647, 1024, 8, 32], "", 0, []], [[], [["FU", 1, [0, 1, 2, 3]], ["SP", 1, 0, 100352, [28], 1], ["AN", 1, 0, 5], ["AN", 1, 1, 6]]]], "r": [[5.37217e-06, 5.38241e-06, 5.3805e-06], 0, 1.64935, 1668057879], "v": "v0.6"}
{"i": [["[\"window_reverse\", 1, 14, 14, 512, 7, \"float16\"]", "cuda -keys=cuda,gpu -max_num_threads=1024 -model=unknown -thread_warp_size=32", [-1, 16, 64, 49152, 2147483647, 1024, 8, 32], "", 0, []], [[], [["FU", 1, [0, 1, 2, 3]], ["SP", 1, 0, 100352, [14], 1], ["AN", 1, 0, 5], ["AN", 1, 1, 6]]]], "r": [[7.9807e-06, 7.99037e-06, 7.9938e-06], 0, 0.924022, 1668057878], "v": "v0.6"}
{"i": [["[\"window_reverse\", 1, 14, 14, 512, 7, \"float16\"]", "cuda -keys=cuda,gpu -max_num_threads=1024 -model=unknown -thread_warp_size=32", [-1, 16, 64, 49152, 2147483647, 1024, 8, 32], "", 0, []], [[], [["FU", 1, [0, 1, 2, 3]], ["SP", 1, 0, 100352, [2], 1], ["AN", 1, 0, 5], ["AN", 1, 1, 6]]]], "r": [[3.98588e-05, 3.98736e-05, 3.98687e-05], 0, 2.01303, 1668057879], "v": "v0.6"}
{"i": [["[\"window_reverse\", 1, 14, 14, 512, 7, \"float16\"]", "cuda -keys=cuda,gpu -max_num_threads=1024 -model=unknown -thread_warp_size=32", [-1, 16, 64, 49152, 2147483647, 1024, 8, 32], "", 0, []], [[], [["FU", 1, [0, 1, 2, 3]], ["SP", 1, 0, 100352, [4], 1], ["AN", 1, 0, 5], ["AN", 1, 1, 6]]]], "r": [[2.14427e-05, 2.14416e-05, 2.14321e-05], 0, 1.26862, 1668057879], "v": "v0.6"}
{"i": [["[\"window_reverse\", 1, 14, 14, 512, 7, \"float16\"]", "cuda -keys=cuda,gpu -max_num_threads=1024 -model=unknown -thread_warp_size=32", [-1, 16, 64, 49152, 2147483647, 1024, 8, 32], "", 0, []], [[], [["FU", 1, [0, 1, 2, 3]], ["SP", 1, 0, 100352, [1], 1], ["AN", 1, 0, 5], ["AN", 1, 1, 6]]]], "r": [[7.70859e-05, 7.70831e-05, 7.70744e-05], 0, 0.59233, 1668057878], "v": "v0.6"}
{"i": [["[\"window_reverse\", 1, 14, 14, 512, 7, \"float16\"]", "cuda -keys=cuda,gpu -max_num_threads=1024 -model=unknown -thread_warp_size=32", [-1, 16, 64, 49152, 2147483647, 1024, 8, 32], "", 0, []], [[], [["FU", 1, [0, 1, 2, 3]], ["SP", 1, 0, 100352, [56], 1], ["AN", 1, 0, 5], ["AN", 1, 1, 6]]]], "r": [[3.92317e-06, 3.94115e-06, 3.94172e-06], 0, 2.35826, 1668057880], "v": "v0.6"}
{"i": [["[\"window_reverse\", 1, 14, 14, 512, 7, \"float16\"]", "cuda -keys=cuda,gpu -max_num_threads=1024 -model=unknown -thread_warp_size=32", [-1, 16, 64, 49152, 2147483647, 1024, 8, 32], "", 0, []], [[], [["FU", 1, [0, 1, 2, 3]], ["SP", 1, 0, 100352, [49], 1], ["AN", 1, 0, 5], ["AN", 1, 1, 6]]]], "r": [[4.22304e-06, 4.24162e-06, 4.24392e-06], 0, 2.73227, 1668057880], "v": "v0.6"}
{"i": [["[\"window_reverse\", 1, 14, 14, 512, 7, \"float16\"]", "cuda -keys=cuda,gpu -max_num_threads=1024 -model=unknown -thread_warp_size=32", [-1, 16, 64, 49152, 2147483647, 1024, 8, 32], "", 0, []], [[], [["FU", 1, [0, 1, 2, 3]], ["SP", 1, 0, 100352, [8], 1], ["AN", 1, 0, 5], ["AN", 1, 1, 6]]]], "r": [[1.2031e-05, 1.20333e-05, 1.20365e-05], 0, 3.06359, 1668057880], "v": "v0.6"}
{"i": [["[\"window_reverse\", 1, 14, 14, 512, 7, \"float16\"]", "cuda -keys=cuda,gpu -max_num_threads=1024 -model=unknown -thread_warp_size=32", [-1, 16, 64, 49152, 2147483647, 1024, 8, 32], "", 0, []], [[], [["FU", 1, [0, 1, 2, 3]], ["SP", 1, 0, 100352, [32], 1], ["AN", 1, 0, 5], ["AN", 1, 1, 6]]]], "r": [[4.94675e-06, 4.96316e-06, 4.96238e-06], 0, 3.39214, 1668057881], "v": "v0.6"}
