python/models/swin_transformer/kernel_configs/swin_transform_auto_tvm_tune_fused_layer_norm_matmul_tensorcore_gelu_1_8_8_1024_4096.log
{"input": ["cuda -keys=cuda,gpu -max_num_threads=1024 -thread_warp_size=32", "fused_layer_norm_matmul_tensorcore_gelu.cuda", [["TENSOR", [64, 1024], "float16"], ["TENSOR", [64], "float16"], ["TENSOR", [64], "float16"], ["TENSOR", [4096, 1024], "float16"], 0.0009765625], {}], "config": {"index": 13041, "code_hash": null, "entity": [["block_row_warps", "ot", 1], ["block_col_warps", "ot", 1], ["warp_row_tiles", "ot", 1], ["warp_col_tiles", "ot", 1], ["chunk", "ot", 2], ["offset", "ot", 0], ["offsetCS", "ot", 0], ["vec", "ot", 4], ["wmma_m", "ot", 8]]}, "result": [[0.00010337547000000001], 0, 1.6057472229003906, 1651824368.2085037], "version": 0.2, "tvm_version": "0.8.0"}
{"input": ["cuda -keys=cuda,gpu -max_num_threads=1024 -thread_warp_size=32", "fused_layer_norm_matmul_tensorcore_gelu.cuda", [["TENSOR", [64, 1024], "float16"], ["TENSOR", [64], "float16"], ["TENSOR", [64], "float16"], ["TENSOR", [4096, 1024], "float16"], 0.0009765625], {}], "config": {"index": 11785, "code_hash": null, "entity": [["block_row_warps", "ot", 2], ["block_col_warps", "ot", 2], ["warp_row_tiles", "ot", 2], ["warp_col_tiles", "ot", 2], ["chunk", "ot", 2], ["offset", "ot", 0], ["offsetCS", "ot", 0], ["vec", "ot", 2], ["wmma_m", "ot", 8]]}, "result": [[7.4782262e-05], 0, 1.5901458263397217, 1651824369.5979724], "version": 0.2, "tvm_version": "0.8.0"}
{"input": ["cuda -keys=cuda,gpu -max_num_threads=1024 -thread_warp_size=32", "fused_layer_norm_matmul_tensorcore_gelu.cuda", [["TENSOR", [64, 1024], "float16"], ["TENSOR", [64], "float16"], ["TENSOR", [64], "float16"], ["TENSOR", [4096, 1024], "float16"], 0.0009765625], {}], "config": {"index": 648, "code_hash": null, "entity": [["block_row_warps", "ot", 1], ["block_col_warps", "ot", 1], ["warp_row_tiles", "ot", 1], ["warp_col_tiles", "ot", 1], ["chunk", "ot", 1], ["offset", "ot", 0], ["offsetCS", "ot", 8], ["vec", "ot", 1], ["wmma_m", "ot", 32]]}, "result": [[0.00024847045399999996], 0, 1.946124792098999, 1651824371.4973552], "version": 0.2, "tvm_version": "0.8.0"}
{"input": ["cuda -keys=cuda,gpu -max_num_threads=1024 -thread_warp_size=32", "fused_layer_norm_matmul_tensorcore_gelu.cuda", [["TENSOR", [64, 1024], "float16"], ["TENSOR", [64], "float16"], ["TENSOR", [64], "float16"], ["TENSOR", [4096, 1024], "float16"], 0.0009765625], {}], "config": {"index": 7075, "code_hash": null, "entity": [["block_row_warps", "ot", 2], ["block_col_warps", "ot", 1], ["warp_row_tiles", "ot", 1], ["warp_col_tiles", "ot", 2], ["chunk", "ot", 8], ["offset", "ot", 8], ["offsetCS", "ot", 0], ["vec", "ot", 2], ["wmma_m", "ot", 16]]}, "result": [[8.5242707e-05], 0, 1.3760066032409668, 1651824372.3430896], "version": 0.2, "tvm_version": "0.8.0"}
{"input": ["cuda -keys=cuda,gpu -max_num_threads=1024 -thread_warp_size=32", "fused_layer_norm_matmul_tensorcore_gelu.cuda", [["TENSOR", [64, 1024], "float16"], ["TENSOR", [64], "float16"], ["TENSOR", [64], "float16"], ["TENSOR", [4096, 1024], "float16"], 0.0009765625], {}], "config": {"index": 7681, "code_hash": null, "entity": [["block_row_warps", "ot", 2], ["block_col_warps", "ot", 2], ["warp_row_tiles", "ot", 2], ["warp_col_tiles", "ot", 4], ["chunk", "ot", 4], ["offset", "ot", 8], ["offsetCS", "ot", 8], ["vec", "ot", 2], ["wmma_m", "ot", 16]]}, "result": [[0.00010747623100000001], 0, 1.7297368049621582, 1651824373.8733778], "version": 0.2, "tvm_version": "0.8.0"}
{"input": ["cuda -keys=cuda,gpu -max_num_threads=1024 -thread_warp_size=32", "fused_layer_norm_matmul_tensorcore_gelu.cuda", [["TENSOR", [64, 1024], "float16"], ["TENSOR", [64], "float16"], ["TENSOR", [64], "float16"], ["TENSOR", [4096, 1024], "float16"], 0.0009765625], {}], "config": {"index": 219, "code_hash": null, "entity": [["block_row_warps", "ot", 1], ["block_col_warps", "ot", 2], ["warp_row_tiles", "ot", 1], ["warp_col_tiles", "ot", 4], ["chunk", "ot", 4], ["offset", "ot", 0], ["offsetCS", "ot", 0], ["vec", "ot", 1], ["wmma_m", "ot", 32]]}, "result": [[0.000165510456], 0, 1.8355576992034912, 1651824374.9450865], "version": 0.2, "tvm_version": "0.8.0"}
{"input": ["cuda -keys=cuda,gpu -max_num_threads=1024 -thread_warp_size=32", "fused_layer_norm_matmul_tensorcore_gelu.cuda", [["TENSOR", [64, 1024], "float16"], ["TENSOR", [64], "float16"], ["TENSOR", [64], "float16"], ["TENSOR", [4096, 1024], "float16"], 0.0009765625], {}], "config": {"index": 11637, "code_hash": null, "entity": [["block_row_warps", "ot", 1], ["block_col_warps", "ot", 1], ["warp_row_tiles", "ot", 1], ["warp_col_tiles", "ot", 4], ["chunk", "ot", 8], ["offset", "ot", 8], ["offsetCS", "ot", 8], ["vec", "ot", 1], ["wmma_m", "ot", 8]]}, "result": [[0.000209094605], 0, 1.8060297966003418, 1651824376.7574277], "version": 0.2, "tvm_version": "0.8.0"}
{"input": ["cuda -keys=cuda,gpu -max_num_threads=1024 -thread_warp_size=32", "fused_layer_norm_matmul_tensorcore_gelu.cuda", [["TENSOR", [64, 1024], "float16"], ["TENSOR", [64], "float16"], ["TENSOR", [64], "float16"], ["TENSOR", [4096, 1024], "float16"], 0.0009765625], {}], "config": {"index": 8571, "code_hash": null, "entity": [["block_row_warps", "ot", 1], ["block_col_warps", "ot", 2], ["warp_row_tiles", "ot", 2], ["warp_col_tiles", "ot", 4], ["chunk", "ot", 2], ["offset", "ot", 0], ["offsetCS", "ot", 8], ["vec", "ot", 4], ["wmma_m", "ot", 16]]}, "result": [[0.000103844031], 0, 1.855607509613037, 1651824380.0881104], "version": 0.2, "tvm_version": "0.8.0"}
{"input": ["cuda -keys=cuda,gpu -max_num_threads=1024 -thread_warp_size=32", "fused_layer_norm_matmul_tensorcore_gelu.cuda", [["TENSOR", [64, 1024], "float16"], ["TENSOR", [64], "float16"], ["TENSOR", [64], "float16"], ["TENSOR", [4096, 1024], "float16"], 0.0009765625], {}], "config": {"index": 11224, "code_hash": null, "entity": [["block_row_warps", "ot", 2], ["block_col_warps", "ot", 1], ["warp_row_tiles", "ot", 4], ["warp_col_tiles", "ot", 2], ["chunk", "ot", 4], ["offset", "ot", 0], ["offsetCS", "ot", 8], ["vec", "ot", 1], ["wmma_m", "ot", 8]]}, "result": [[0.000278747186], 0, 2.0797278881073, 1651824382.1238594], "version": 0.2, "tvm_version": "0.8.0"}
{"input": ["cuda -keys=cuda,gpu -max_num_threads=1024 -thread_warp_size=32", "fused_layer_norm_matmul_tensorcore_gelu.cuda", [["TENSOR", [64, 1024], "float16"], ["TENSOR", [64], "float16"], ["TENSOR", [64], "float16"], ["TENSOR", [4096, 1024], "float16"], 0.0009765625], {}], "config": {"index": 12718, "code_hash": null, "entity": [["block_row_warps", "ot", 2], ["block_col_warps", "ot", 1], ["warp_row_tiles", "ot", 1], ["warp_col_tiles", "ot", 1], ["chunk", "ot", 2], ["offset", "ot", 8], ["offsetCS", "ot", 8], ["vec", "ot", 2], ["wmma_m", "ot", 8]]}, "result": [[7.6322781e-05], 0, 1.2984282970428467, 1651824384.7841804], "version": 0.2, "tvm_version": "0.8.0"}
{"input": ["cuda -keys=cuda,gpu -max_num_threads=1024 -thread_warp_size=32", "fused_layer_norm_matmul_tensorcore_gelu.cuda", [["TENSOR", [64, 1024], "float16"], ["TENSOR", [64], "float16"], ["TENSOR", [64], "float16"], ["TENSOR", [4096, 1024], "float16"], 0.0009765625], {}], "config": {"index": 13139, "code_hash": null, "entity": [["block_row_warps", "ot", 4], ["block_col_warps", "ot", 4], ["warp_row_tiles", "ot", 2], ["warp_col_tiles", "ot", 1], ["chunk", "ot", 4], ["offset", "ot", 0], ["offsetCS", "ot", 0], ["vec", "ot", 4], ["wmma_m", "ot", 8]]}, "result": [[0.000100640089], 0, 1.5343351364135742, 1651824385.6807823], "version": 0.2, "tvm_version": "0.8.0"}
{"input": ["cuda -keys=cuda,gpu -max_num_threads=1024 -thread_warp_size=32", "fused_layer_norm_matmul_tensorcore_gelu.cuda", [["TENSOR", [64, 1024], "float16"], ["TENSOR", [64], "float16"], ["TENSOR", [64], "float16"], ["TENSOR", [4096, 1024], "float16"], 0.0009765625], {}], "config": {"index": 447, "code_hash": null, "entity": [["block_row_warps", "ot", 1], ["block_col_warps", "ot", 4], ["warp_row_tiles", "ot", 2], ["warp_col_tiles", "ot", 2], ["chunk", "ot", 2], ["offset", "ot", 8], ["offsetCS", "ot", 0], ["vec", "ot", 1], ["wmma_m", "ot", 32]]}, "result": [[0.000147822431], 0, 1.55045747756958, 1651824386.7080328], "version": 0.2, "tvm_version": "0.8.0"}
{"input": ["cuda -keys=cuda,gpu -max_num_threads=1024 -thread_warp_size=32", "fused_layer_norm_matmul_tensorcore_gelu.cuda", [["TENSOR", [64, 1024], "float16"], ["TENSOR", [64], "float16"], ["TENSOR", [64], "float16"], ["TENSOR", [4096, 1024], "float16"], 0.0009765625], {}], "config": {"index": 13488, "code_hash": null, "entity": [["block_row_warps", "ot", 1], ["block_col_warps", "ot", 4], ["warp_row_tiles", "ot", 2], ["warp_col_tiles", "ot", 2], ["chunk", "ot", 4], ["offset", "ot", 8], ["offsetCS", "ot", 0], ["vec", "ot", 4], ["wmma_m", "ot", 8]]}, "result": [[4.1057437e-05], 0, 1.4400012493133545, 1651824388.0428302], "version": 0.2, "tvm_version": "0.8.0"}
{"input": ["cuda -keys=cuda,gpu -max_num_threads=1024 -thread_warp_size=32", "fused_layer_norm_matmul_tensorcore_gelu.cuda", [["TENSOR", [64, 1024], "float16"], ["TENSOR", [64], "float16"], ["TENSOR", [64], "float16"], ["TENSOR", [4096, 1024], "float16"], 0.0009765625], {}], "config": {"index": 2569, "code_hash": null, "entity": [["block_row_warps", "ot", 2], ["block_col_warps", "ot", 2], ["warp_row_tiles", "ot", 1], ["warp_col_tiles", "ot", 4], ["chunk", "ot", 8], ["offset", "ot", 8], ["offsetCS", "ot", 8], ["vec", "ot", 2], ["wmma_m", "ot", 32]]}, "result": [[8.984274000000001e-05], 0, 1.5463974475860596, 1651824389.5978138], "version": 0.2, "tvm_version": "0.8.0"}
{"input": ["cuda -keys=cuda,gpu -max_num_threads=1024 -thread_warp_size=32", "fused_layer_norm_matmul_tensorcore_gelu.cuda", [["TENSOR", [64, 1024], "float16"], ["TENSOR", [64], "float16"], ["TENSOR", [64], "float16"], ["TENSOR", [4096, 1024], "float16"], 0.0009765625], {}], "config": {"index": 12475, "code_hash": null, "entity": [["block_row_warps", "ot", 2], ["block_col_warps", "ot", 1], ["warp_row_tiles", "ot", 1], ["warp_col_tiles", "ot", 1], ["chunk", "ot", 4], ["offset", "ot", 0], ["offsetCS", "ot", 8], ["vec", "ot", 2], ["wmma_m", "ot", 8]]}, "result": [[7.4983256e-05], 0, 1.52839994430542, 1651824390.980938], "version": 0.2, "tvm_version": "0.8.0"}
{"input": ["cuda -keys=cuda,gpu -max_num_threads=1024 -thread_warp_size=32", "fused_layer_norm_matmul_tensorcore_gelu.cuda", [["TENSOR", [64, 1024], "float16"], ["TENSOR", [64], "float16"], ["TENSOR", [64], "float16"], ["TENSOR", [4096, 1024], "float16"], 0.0009765625], {}], "config": {"index": 2259, "code_hash": null, "entity": [["block_row_warps", "ot", 1], ["block_col_warps", "ot", 1], ["warp_row_tiles", "ot", 4], ["warp_col_tiles", "ot", 4], ["chunk", "ot", 8], ["offset", "ot", 0], ["offsetCS", "ot", 8], ["vec", "ot", 2], ["wmma_m", "ot", 32]]}, "result": [[0.00036085666], 0, 2.36185359954834, 1651824393.3302336], "version": 0.2, "tvm_version": "0.8.0"}
{"input": ["cuda -keys=cuda,gpu -max_num_threads=1024 -thread_warp_size=32", "fused_layer_norm_matmul_tensorcore_gelu.cuda", [["TENSOR", [64, 1024], "float16"], ["TENSOR", [64], "float16"], ["TENSOR", [64], "float16"], ["TENSOR", [4096, 1024], "float16"], 0.0009765625], {}], "config": {"index": 11628, "code_hash": null, "entity": [["block_row_warps", "ot", 1], ["block_col_warps", "ot", 1], ["warp_row_tiles", "ot", 4], ["warp_col_tiles", "ot", 2], ["chunk", "ot", 8], ["offset", "ot", 8], ["offsetCS", "ot", 8], ["vec", "ot", 1], ["wmma_m", "ot", 8]]}, "result": [[0.00033951965], 0, 2.283108949661255, 1651824395.5664847], "version": 0.2, "tvm_version": "0.8.0"}
{"input": ["cuda -keys=cuda,gpu -max_num_threads=1024 -thread_warp_size=32", "fused_layer_norm_matmul_tensorcore_gelu.cuda", [["TENSOR", [64, 1024], "float16"], ["TENSOR", [64], "float16"], ["TENSOR", [64], "float16"], ["TENSOR", [4096, 1024], "float16"], 0.0009765625], {}], "config": {"index": 10792, "code_hash": null, "entity": [["block_row_warps", "ot", 2], ["block_col_warps", "ot", 1], ["warp_row_tiles", "ot", 4], ["warp_col_tiles", "ot", 1], ["chunk", "ot", 2], ["offset", "ot", 8], ["offsetCS", "ot", 0], ["vec", "ot", 1], ["wmma_m", "ot", 8]]}, "result": [[0.00025548699], 0, 1.9152755737304688, 1651824396.9061394], "version": 0.2, "tvm_version": "0.8.0"}
{"input": ["cuda -keys=cuda,gpu -max_num_threads=1024 -thread_warp_size=32", "fused_layer_norm_matmul_tensorcore_gelu.cuda", [["TENSOR", [64, 1024], "float16"], ["TENSOR", [64], "float16"], ["TENSOR", [64], "float16"], ["TENSOR", [4096, 1024], "float16"], 0.0009765625], {}], "config": {"index": 10872, "code_hash": null, "entity": [["block_row_warps", "ot", 1], ["block_col_warps", "ot", 1], ["warp_row_tiles", "ot", 4], ["warp_col_tiles", "ot", 1], ["chunk", "ot", 4], ["offset", "ot", 8], ["offsetCS", "ot", 0], ["vec", "ot", 1], ["wmma_m", "ot", 8]]}, "result": [[0.00029992169000000004], 0, 2.0400874614715576, 1651824399.5939975], "version": 0.2, "tvm_version": "0.8.0"}
{"input": ["cuda -keys=cuda,gpu -max_num_threads=1024 -thread_warp_size=32", "fused_layer_norm_matmul_tensorcore_gelu.cuda", [["TENSOR", [64, 1024], "float16"], ["TENSOR", [64], "float16"], ["TENSOR", [64], "float16"], ["TENSOR", [4096, 1024], "float16"], 0.0009765625], {}], "config": {"index": 3843, "code_hash": null, "entity": [["block_row_warps", "ot", 1], ["block_col_warps", "ot", 1], ["warp_row_tiles", "ot", 2], ["warp_col_tiles", "ot", 2], ["chunk", "ot", 8], ["offset", "ot", 8], ["offsetCS", "ot", 8], ["vec", "ot", 4], ["wmma_m", "ot", 32]]}, "result": [[0.000212790048], 0, 1.8910059928894043, 1651824401.4093535], "version": 0.2, "tvm_version": "0.8.0"}
{"input": ["cuda -keys=cuda,gpu -max_num_threads=1024 -thread_warp_size=32", "fused_layer_norm_matmul_tensorcore_gelu.cuda", [["TENSOR", [64, 1024], "float16"], ["TENSOR", [64], "float16"], ["TENSOR", [64], "float16"], ["TENSOR", [4096, 1024], "float16"], 0.0009765625], {}], "config": {"index": 14132, "code_hash": null, "entity": [["block_row_warps", "ot", 4], ["block_col_warps", "ot", 1], ["warp_row_tiles", "ot", 2], ["warp_col_tiles", "ot", 2], ["chunk", "ot", 4], ["offset", "ot", 8], ["offsetCS", "ot", 8], ["vec", "ot", 4], ["wmma_m", "ot", 8]]}, "result": [[7.2211707e-05], 0, 1.3203890323638916, 1651824402.2242112], "version": 0.2, "tvm_version": "0.8.0"}
{"input": ["cuda -keys=cuda,gpu -max_num_threads=1024 -thread_warp_size=32", "fused_layer_norm_matmul_tensorcore_gelu.cuda", [["TENSOR", [64, 1024], "float16"], ["TENSOR", [64], "float16"], ["TENSOR", [64], "float16"], ["TENSOR", [4096, 1024], "float16"], 0.0009765625], {}], "config": {"index": 10400, "code_hash": null, "entity": [["block_row_warps", "ot", 4], ["block_col_warps", "ot", 2], ["warp_row_tiles", "ot", 1], ["warp_col_tiles", "ot", 2], ["chunk", "ot", 1], ["offset", "ot", 0], ["offsetCS", "ot", 0], ["vec", "ot", 1], ["wmma_m", "ot", 8]]}, "result": [[0.00011448209199999999], 0, 1.31465482711792, 1651824405.1236663], "version": 0.2, "tvm_version": "0.8.0"}
{"input": ["cuda -keys=cuda,gpu -max_num_threads=1024 -thread_warp_size=32", "fused_layer_norm_matmul_tensorcore_gelu.cuda", [["TENSOR", [64, 1024], "float16"], ["TENSOR", [64], "float16"], ["TENSOR", [64], "float16"], ["TENSOR", [4096, 1024], "float16"], 0.0009765625], {}], "config": {"index": 10393, "code_hash": null, "entity": [["block_row_warps", "ot", 2], ["block_col_warps", "ot", 4], ["warp_row_tiles", "ot", 4], ["warp_col_tiles", "ot", 1], ["chunk", "ot", 1], ["offset", "ot", 0], ["offsetCS", "ot", 0], ["vec", "ot", 1], ["wmma_m", "ot", 8]]}, "result": [[0.000105483608], 0, 1.385911464691162, 1651824406.6288044], "version": 0.2, "tvm_version": "0.8.0"}
{"input": ["cuda -keys=cuda,gpu -max_num_threads=1024 -thread_warp_size=32", "fused_layer_norm_matmul_tensorcore_gelu.cuda", [["TENSOR", [64, 1024], "float16"], ["TENSOR", [64], "float16"], ["TENSOR", [64], "float16"], ["TENSOR", [4096, 1024], "float16"], 0.0009765625], {}], "config": {"index": 11434, "code_hash": null, "entity": [["block_row_warps", "ot", 2], ["block_col_warps", "ot", 2], ["warp_row_tiles", "ot", 2], ["warp_col_tiles", "ot", 1], ["chunk", "ot", 2], ["offset", "ot", 8], ["offsetCS", "ot", 8], ["vec", "ot", 1], ["wmma_m", "ot", 8]]}, "result": [[8.354191299999999e-05], 0, 1.3608553409576416, 1651824408.0558133], "version": 0.2, "tvm_version": "0.8.0"}
{"input": ["cuda -keys=cuda,gpu -max_num_threads=1024 -thread_warp_size=32", "fused_layer_norm_matmul_tensorcore_gelu.cuda", [["TENSOR", [64, 1024], "float16"], ["TENSOR", [64], "float16"], ["TENSOR", [64], "float16"], ["TENSOR", [4096, 1024], "float16"], 0.0009765625], {}], "config": {"index": 12817, "code_hash": null, "entity": [["block_row_warps", "ot", 2], ["block_col_warps", "ot", 1], ["warp_row_tiles", "ot", 4], ["warp_col_tiles", "ot", 1], ["chunk", "ot", 4], ["offset", "ot", 8], ["offsetCS", "ot", 8], ["vec", "ot", 2], ["wmma_m", "ot", 8]]}, "result": [[0.000160831127], 0, 1.5385124683380127, 1651824409.7341533], "version": 0.2, "tvm_version": "0.8.0"}
{"input": ["cuda -keys=cuda,gpu -max_num_threads=1024 -thread_warp_size=32", "fused_layer_norm_matmul_tensorcore_gelu.cuda", [["TENSOR", [64, 1024], "float16"], ["TENSOR", [64], "float16"], ["TENSOR", [64], "float16"], ["TENSOR", [4096, 1024], "float16"], 0.0009765625], {}], "config": {"index": 90, "code_hash": null, "entity": [["block_row_warps", "ot", 1], ["block_col_warps", "ot", 1], ["warp_row_tiles", "ot", 2], ["warp_col_tiles", "ot", 1], ["chunk", "ot", 2], ["offset", "ot", 0], ["offsetCS", "ot", 0], ["vec", "ot", 1], ["wmma_m", "ot", 32]]}, "result": [[0.00048597389700000005], 0, 2.5742764472961426, 1651824412.96603], "version": 0.2, "tvm_version": "0.8.0"}
{"input": ["cuda -keys=cuda,gpu -max_num_threads=1024 -thread_warp_size=32", "fused_layer_norm_matmul_tensorcore_gelu.cuda", [["TENSOR", [64, 1024], "float16"], ["TENSOR", [64], "float16"], ["TENSOR", [64], "float16"], ["TENSOR", [4096, 1024], "float16"], 0.0009765625], {}], "config": {"index": 13838, "code_hash": null, "entity": [["block_row_warps", "ot", 4], ["block_col_warps", "ot", 2], ["warp_row_tiles", "ot", 2], ["warp_col_tiles", "ot", 4], ["chunk", "ot", 4], ["offset", "ot", 0], ["offsetCS", "ot", 8], ["vec", "ot", 4], ["wmma_m", "ot", 8]]}, "result": [[0.00017742445100000001], 0, 1.7212319374084473, 1651824415.3437104], "version": 0.2, "tvm_version": "0.8.0"}
{"input": ["cuda -keys=cuda,gpu -max_num_threads=1024 -thread_warp_size=32", "fused_layer_norm_matmul_tensorcore_gelu.cuda", [["TENSOR", [64, 1024], "float16"], ["TENSOR", [64], "float16"], ["TENSOR", [64], "float16"], ["TENSOR", [4096, 1024], "float16"], 0.0009765625], {}], "config": {"index": 6267, "code_hash": null, "entity": [["block_row_warps", "ot", 1], ["block_col_warps", "ot", 2], ["warp_row_tiles", "ot", 1], ["warp_col_tiles", "ot", 2], ["chunk", "ot", 2], ["offset", "ot", 8], ["offsetCS", "ot", 8], ["vec", "ot", 1], ["wmma_m", "ot", 16]]}, "result": [[9.0845131e-05], 0, 1.2808592319488525, 1651824416.778298], "version": 0.2, "tvm_version": "0.8.0"}
{"input": ["cuda -keys=cuda,gpu -max_num_threads=1024 -thread_warp_size=32", "fused_layer_norm_matmul_tensorcore_gelu.cuda", [["TENSOR", [64, 1024], "float16"], ["TENSOR", [64], "float16"], ["TENSOR", [64], "float16"], ["TENSOR", [4096, 1024], "float16"], 0.0009765625], {}], "config": {"index": 13126, "code_hash": null, "entity": [["block_row_warps", "ot", 2], ["block_col_warps", "ot", 2], ["warp_row_tiles", "ot", 1], ["warp_col_tiles", "ot", 1], ["chunk", "ot", 4], ["offset", "ot", 0], ["offsetCS", "ot", 0], ["vec", "ot", 4], ["wmma_m", "ot", 8]]}, "result": [[6.741407300000001e-05], 0, 1.2883250713348389, 1651824417.5555806], "version": 0.2, "tvm_version": "0.8.0"}
{"input": ["cuda -keys=cuda,gpu -max_num_threads=1024 -thread_warp_size=32", "fused_layer_norm_matmul_tensorcore_gelu.cuda", [["TENSOR", [64, 1024], "float16"], ["TENSOR", [64], "float16"], ["TENSOR", [64], "float16"], ["TENSOR", [4096, 1024], "float16"], 0.0009765625], {}], "config": {"index": 1938, "code_hash": null, "entity": [["block_row_warps", "ot", 1], ["block_col_warps", "ot", 2], ["warp_row_tiles", "ot", 4], ["warp_col_tiles", "ot", 4], ["chunk", "ot", 8], ["offset", "ot", 8], ["offsetCS", "ot", 0], ["vec", "ot", 2], ["wmma_m", "ot", 32]]}, "result": [[0.00017686959100000001], 0, 1.757310152053833, 1651824419.3421445], "version": 0.2, "tvm_version": "0.8.0"}
{"input": ["cuda -keys=cuda,gpu -max_num_threads=1024 -thread_warp_size=32", "fused_layer_norm_matmul_tensorcore_gelu.cuda", [["TENSOR", [64, 1024], "float16"], ["TENSOR", [64], "float16"], ["TENSOR", [64], "float16"], ["TENSOR", [4096, 1024], "float16"], 0.0009765625], {}], "config": {"index": 13098, "code_hash": null, "entity": [["block_row_warps", "ot", 1], ["block_col_warps", "ot", 2], ["warp_row_tiles", "ot", 1], ["warp_col_tiles", "ot", 4], ["chunk", "ot", 2], ["offset", "ot", 0], ["offsetCS", "ot", 0], ["vec", "ot", 4], ["wmma_m", "ot", 8]]}, "result": [[6.723173199999998e-05], 0, 1.5165021419525146, 1651824420.7226155], "version": 0.2, "tvm_version": "0.8.0"}
{"input": ["cuda -keys=cuda,gpu -max_num_threads=1024 -thread_warp_size=32", "fused_layer_norm_matmul_tensorcore_gelu.cuda", [["TENSOR", [64, 1024], "float16"], ["TENSOR", [64], "float16"], ["TENSOR", [64], "float16"], ["TENSOR", [4096, 1024], "float16"], 0.0009765625], {}], "config": {"index": 621, "code_hash": null, "entity": [["block_row_warps", "ot", 1], ["block_col_warps", "ot", 1], ["warp_row_tiles", "ot", 1], ["warp_col_tiles", "ot", 4], ["chunk", "ot", 8], ["offset", "ot", 8], ["offsetCS", "ot", 0], ["vec", "ot", 1], ["wmma_m", "ot", 32]]}, "result": [[0.000299371927], 0, 2.065192461013794, 1651824422.2279785], "version": 0.2, "tvm_version": "0.8.0"}
{"input": ["cuda -keys=cuda,gpu -max_num_threads=1024 -thread_warp_size=32", "fused_layer_norm_matmul_tensorcore_gelu.cuda", [["TENSOR", [64, 1024], "float16"], ["TENSOR", [64], "float16"], ["TENSOR", [64], "float16"], ["TENSOR", [4096, 1024], "float16"], 0.0009765625], {}], "config": {"index": 8796, "code_hash": null, "entity": [["block_row_warps", "ot", 1], ["block_col_warps", "ot", 2], ["warp_row_tiles", "ot", 4], ["warp_col_tiles", "ot", 2], ["chunk", "ot", 1], ["offset", "ot", 8], ["offsetCS", "ot", 8], ["vec", "ot", 4], ["wmma_m", "ot", 16]]}, "result": [[0.000141762586], 0, 1.6174402236938477, 1651824423.85104], "version": 0.2, "tvm_version": "0.8.0"}
{"input": ["cuda -keys=cuda,gpu -max_num_threads=1024 -thread_warp_size=32", "fused_layer_norm_matmul_tensorcore_gelu.cuda", [["TENSOR", [64, 1024], "float16"], ["TENSOR", [64], "float16"], ["TENSOR", [64], "float16"], ["TENSOR", [4096, 1024], "float16"], 0.0009765625], {}], "config": {"index": 13462, "code_hash": null, "entity": [["block_row_warps", "ot", 2], ["block_col_warps", "ot", 4], ["warp_row_tiles", "ot", 2], ["warp_col_tiles", "ot", 1], ["chunk", "ot", 4], ["offset", "ot", 8], ["offsetCS", "ot", 0], ["vec", "ot", 4], ["wmma_m", "ot", 8]]}, "result": [[3.4356606e-05], 0, 1.300647497177124, 1651824424.6284993], "version": 0.2, "tvm_version": "0.8.0"}
{"input": ["cuda -keys=cuda,gpu -max_num_threads=1024 -thread_warp_size=32", "fused_layer_norm_matmul_tensorcore_gelu.cuda", [["TENSOR", [64, 1024], "float16"], ["TENSOR", [64], "float16"], ["TENSOR", [64], "float16"], ["TENSOR", [4096, 1024], "float16"], 0.0009765625], {}], "config": {"index": 3666, "code_hash": null, "entity": [["block_row_warps", "ot", 1], ["block_col_warps", "ot", 2], ["warp_row_tiles", "ot", 4], ["warp_col_tiles", "ot", 1], ["chunk", "ot", 2], ["offset", "ot", 8], ["offsetCS", "ot", 8], ["vec", "ot", 4], ["wmma_m", "ot", 32]]}, "result": [[0.000128183043], 0, 1.4979050159454346, 1651824426.794168], "version": 0.2, "tvm_version": "0.8.0"}
{"input": ["cuda -keys=cuda,gpu -max_num_threads=1024 -thread_warp_size=32", "fused_layer_norm_matmul_tensorcore_gelu.cuda", [["TENSOR", [64, 1024], "float16"], ["TENSOR", [64], "float16"], ["TENSOR", [64], "float16"], ["TENSOR", [4096, 1024], "float16"], 0.0009765625], {}], "config": {"index": 11346, "code_hash": null, "entity": [["block_row_warps", "ot", 1], ["block_col_warps", "ot", 4], ["warp_row_tiles", "ot", 1], ["warp_col_tiles", "ot", 1], ["chunk", "ot", 1], ["offset", "ot", 8], ["offsetCS", "ot", 8], ["vec", "ot", 1], ["wmma_m", "ot", 8]]}, "result": [[6.8534412e-05], 0, 1.161858320236206, 1651824428.1289485], "version": 0.2, "tvm_version": "0.8.0"}
{"input": ["cuda -keys=cuda,gpu -max_num_threads=1024 -thread_warp_size=32", "fused_layer_norm_matmul_tensorcore_gelu.cuda", [["TENSOR", [64, 1024], "float16"], ["TENSOR", [64], "float16"], ["TENSOR", [64], "float16"], ["TENSOR", [4096, 1024], "float16"], 0.0009765625], {}], "config": {"index": 2835, "code_hash": null, "entity": [["block_row_warps", "ot", 1], ["block_col_warps", "ot", 1], ["warp_row_tiles", "ot", 1], ["warp_col_tiles", "ot", 1], ["chunk", "ot", 8], ["offset", "ot", 0], ["offsetCS", "ot", 0], ["vec", "ot", 4], ["wmma_m", "ot", 32]]}, "result": [[0.00016000276799999998], 0, 1.7884271144866943, 1651824455.3287122], "version": 0.2, "tvm_version": "0.8.0"}
{"input": ["cuda -keys=cuda,gpu -max_num_threads=1024 -thread_warp_size=32", "fused_layer_norm_matmul_tensorcore_gelu.cuda", [["TENSOR", [64, 1024], "float16"], ["TENSOR", [64], "float16"], ["TENSOR", [64], "float16"], ["TENSOR", [4096, 1024], "float16"], 0.0009765625], {}], "config": {"index": 3159, "code_hash": null, "entity": [["block_row_warps", "ot", 1], ["block_col_warps", "ot", 1], ["warp_row_tiles", "ot", 1], ["warp_col_tiles", "ot", 1], ["chunk", "ot", 8], ["offset", "ot", 8], ["offsetCS", "ot", 0], ["vec", "ot", 4], ["wmma_m", "ot", 32]]}, "result": [[0.000111718625], 0, 1.6335744857788086, 1651824456.2796147], "version": 0.2, "tvm_version": "0.8.0"}
{"input": ["cuda -keys=cuda,gpu -max_num_threads=1024 -thread_warp_size=32", "fused_layer_norm_matmul_tensorcore_gelu.cuda", [["TENSOR", [64, 1024], "float16"], ["TENSOR", [64], "float16"], ["TENSOR", [64], "float16"], ["TENSOR", [4096, 1024], "float16"], 0.0009765625], {}], "config": {"index": 3483, "code_hash": null, "entity": [["block_row_warps", "ot", 1], ["block_col_warps", "ot", 1], ["warp_row_tiles", "ot", 1], ["warp_col_tiles", "ot", 1], ["chunk", "ot", 8], ["offset", "ot", 0], ["offsetCS", "ot", 8], ["vec", "ot", 4], ["wmma_m", "ot", 32]]}, "result": [[0.000136894568], 0, 1.713146448135376, 1651824457.294238], "version": 0.2, "tvm_version": "0.8.0"}
{"input": ["cuda -keys=cuda,gpu -max_num_threads=1024 -thread_warp_size=32", "fused_layer_norm_matmul_tensorcore_gelu.cuda", [["TENSOR", [64, 1024], "float16"], ["TENSOR", [64], "float16"], ["TENSOR", [64], "float16"], ["TENSOR", [4096, 1024], "float16"], 0.0009765625], {}], "config": {"index": 3807, "code_hash": null, "entity": [["block_row_warps", "ot", 1], ["block_col_warps", "ot", 1], ["warp_row_tiles", "ot", 1], ["warp_col_tiles", "ot", 1], ["chunk", "ot", 8], ["offset", "ot", 8], ["offsetCS", "ot", 8], ["vec", "ot", 4], ["wmma_m", "ot", 32]]}, "result": [[0.000111789631], 0, 1.6990766525268555, 1651824458.301685], "version": 0.2, "tvm_version": "0.8.0"}
{"input": ["cuda -keys=cuda,gpu -max_num_threads=1024 -thread_warp_size=32", "fused_layer_norm_matmul_tensorcore_gelu.cuda", [["TENSOR", [64, 1024], "float16"], ["TENSOR", [64], "float16"], ["TENSOR", [64], "float16"], ["TENSOR", [4096, 1024], "float16"], 0.0009765625], {}], "config": {"index": 3492, "code_hash": null, "entity": [["block_row_warps", "ot", 1], ["block_col_warps", "ot", 1], ["warp_row_tiles", "ot", 2], ["warp_col_tiles", "ot", 1], ["chunk", "ot", 8], ["offset", "ot", 0], ["offsetCS", "ot", 8], ["vec", "ot", 4], ["wmma_m", "ot", 32]]}, "result": [[0.000237277848], 0, 2.0640852451324463, 1651824459.625586], "version": 0.2, "tvm_version": "0.8.0"}
{"input": ["cuda -keys=cuda,gpu -max_num_threads=1024 -thread_warp_size=32", "fused_layer_norm_matmul_tensorcore_gelu.cuda", [["TENSOR", [64, 1024], "float16"], ["TENSOR", [64], "float16"], ["TENSOR", [64], "float16"], ["TENSOR", [4096, 1024], "float16"], 0.0009765625], {}], "config": {"index": 2188, "code_hash": null, "entity": [["block_row_warps", "ot", 2], ["block_col_warps", "ot", 1], ["warp_row_tiles", "ot", 1], ["warp_col_tiles", "ot", 1], ["chunk", "ot", 8], ["offset", "ot", 0], ["offsetCS", "ot", 8], ["vec", "ot", 2], ["wmma_m", "ot", 32]]}, "result": [[0.00018308881999999998], 0, 1.7265899181365967, 1651824460.780166], "version": 0.2, "tvm_version": "0.8.0"}
{"input": ["cuda -keys=cuda,gpu -max_num_threads=1024 -thread_warp_size=32", "fused_layer_norm_matmul_tensorcore_gelu.cuda", [["TENSOR", [64, 1024], "float16"], ["TENSOR", [64], "float16"], ["TENSOR", [64], "float16"], ["TENSOR", [4096, 1024], "float16"], 0.0009765625], {}], "config": {"index": 1864, "code_hash": null, "entity": [["block_row_warps", "ot", 2], ["block_col_warps", "ot", 1], ["warp_row_tiles", "ot", 1], ["warp_col_tiles", "ot", 1], ["chunk", "ot", 8], ["offset", "ot", 8], ["offsetCS", "ot", 0], ["vec", "ot", 2], ["wmma_m", "ot", 32]]}, "result": [[0.00015381329], 0, 1.814314603805542, 1651824461.900369], "version": 0.2, "tvm_version": "0.8.0"}
{"input": ["cuda -keys=cuda,gpu -max_num_threads=1024 -thread_warp_size=32", "fused_layer_norm_matmul_tensorcore_gelu.cuda", [["TENSOR", [64, 1024], "float16"], ["TENSOR", [64], "float16"], ["TENSOR", [64], "float16"], ["TENSOR", [4096, 1024], "float16"], 0.0009765625], {}], "config": {"index": 2844, "code_hash": null, "entity": [["block_row_warps", "ot", 1], ["block_col_warps", "ot", 1], ["warp_row_tiles", "ot", 2], ["warp_col_tiles", "ot", 1], ["chunk", "ot", 8], ["offset", "ot", 0], ["offsetCS", "ot", 0], ["vec", "ot", 4], ["wmma_m", "ot", 32]]}, "result": [[0.000235355463], 0, 2.014035940170288, 1651824463.2565582], "version": 0.2, "tvm_version": "0.8.0"}
{"input": ["cuda -keys=cuda,gpu -max_num_threads=1024 -thread_warp_size=32", "fused_layer_norm_matmul_tensorcore_gelu.cuda", [["TENSOR", [64, 1024], "float16"], ["TENSOR", [64], "float16"], ["TENSOR", [64], "float16"], ["TENSOR", [4096, 1024], "float16"], 0.0009765625], {}], "config": {"index": 3825, "code_hash": null, "entity": [["block_row_warps", "ot", 1], ["block_col_warps", "ot", 1], ["warp_row_tiles", "ot", 4], ["warp_col_tiles", "ot", 1], ["chunk", "ot", 8], ["offset", "ot", 8], ["offsetCS", "ot", 8], ["vec", "ot", 4], ["wmma_m", "ot", 32]]}, "result": [[0.000213651647], 0, 1.906358003616333, 1651824464.4890678], "version": 0.2, "tvm_version": "0.8.0"}
{"input": ["cuda -keys=cuda,gpu -max_num_threads=1024 -thread_warp_size=32", "fused_layer_norm_matmul_tensorcore_gelu.cuda", [["TENSOR", [64, 1024], "float16"], ["TENSOR", [64], "float16"], ["TENSOR", [64], "float16"], ["TENSOR", [4096, 1024], "float16"], 0.0009765625], {}], "config": {"index": 2853, "code_hash": null, "entity": [["block_row_warps", "ot", 1], ["block_col_warps", "ot", 1], ["warp_row_tiles", "ot", 4], ["warp_col_tiles", "ot", 1], ["chunk", "ot", 8], ["offset", "ot", 0], ["offsetCS", "ot", 0], ["vec", "ot", 4], ["wmma_m", "ot", 32]]}, "result": [[0.000240635826], 0, 2.0207035541534424, 1651824465.901219], "version": 0.2, "tvm_version": "0.8.0"}
{"input": ["cuda -keys=cuda,gpu -max_num_threads=1024 -thread_warp_size=32", "fused_layer_norm_matmul_tensorcore_gelu.cuda", [["TENSOR", [64, 1024], "float16"], ["TENSOR", [64], "float16"], ["TENSOR", [64], "float16"], ["TENSOR", [4096, 1024], "float16"], 0.0009765625], {}], "config": {"index": 3816, "code_hash": null, "entity": [["block_row_warps", "ot", 1], ["block_col_warps", "ot", 1], ["warp_row_tiles", "ot", 2], ["warp_col_tiles", "ot", 1], ["chunk", "ot", 8], ["offset", "ot", 8], ["offsetCS", "ot", 8], ["vec", "ot", 4], ["wmma_m", "ot", 32]]}, "result": [[0.000208036578], 0, 1.8971810340881348, 1651824467.1537678], "version": 0.2, "tvm_version": "0.8.0"}
{"input": ["cuda -keys=cuda,gpu -max_num_threads=1024 -thread_warp_size=32", "fused_layer_norm_matmul_tensorcore_gelu.cuda", [["TENSOR", [64, 1024], "float16"], ["TENSOR", [64], "float16"], ["TENSOR", [64], "float16"], ["TENSOR", [4096, 1024], "float16"], 0.0009765625], {}], "config": {"index": 2512, "code_hash": null, "entity": [["block_row_warps", "ot", 2], ["block_col_warps", "ot", 1], ["warp_row_tiles", "ot", 1], ["warp_col_tiles", "ot", 1], ["chunk", "ot", 8], ["offset", "ot", 8], ["offsetCS", "ot", 8], ["vec", "ot", 2], ["wmma_m", "ot", 32]]}, "result": [[0.00015392450400000002], 0, 1.664795160293579, 1651824468.2054288], "version": 0.2, "tvm_version": "0.8.0"}
{"input": ["cuda -keys=cuda,gpu -max_num_threads=1024 -thread_warp_size=32", "fused_layer_norm_matmul_tensorcore_gelu.cuda", [["TENSOR", [64, 1024], "float16"], ["TENSOR", [64], "float16"], ["TENSOR", [64], "float16"], ["TENSOR", [4096, 1024], "float16"], 0.0009765625], {}], "config": {"index": 3501, "code_hash": null, "entity": [["block_row_warps", "ot", 1], ["block_col_warps", "ot", 1], ["warp_row_tiles", "ot", 4], ["warp_col_tiles", "ot", 1], ["chunk", "ot", 8], ["offset", "ot", 0], ["offsetCS", "ot", 8], ["vec", "ot", 4], ["wmma_m", "ot", 32]]}, "result": [[0.000239234803], 0, 2.004411220550537, 1651824469.5680432], "version": 0.2, "tvm_version": "0.8.0"}
{"input": ["cuda -keys=cuda,gpu -max_num_threads=1024 -thread_warp_size=32", "fused_layer_norm_matmul_tensorcore_gelu.cuda", [["TENSOR", [64, 1024], "float16"], ["TENSOR", [64], "float16"], ["TENSOR", [64], "float16"], ["TENSOR", [4096, 1024], "float16"], 0.0009765625], {}], "config": {"index": 3168, "code_hash": null, "entity": [["block_row_warps", "ot", 1], ["block_col_warps", "ot", 1], ["warp_row_tiles", "ot", 2], ["warp_col_tiles", "ot", 1], ["chunk", "ot", 8], ["offset", "ot", 8], ["offsetCS", "ot", 0], ["vec", "ot", 4], ["wmma_m", "ot", 32]]}, "result": [[0.000211438956], 0, 1.92215895652771, 1651824470.8400643], "version": 0.2, "tvm_version": "0.8.0"}
{"input": ["cuda -keys=cuda,gpu -max_num_threads=1024 -thread_warp_size=32", "fused_layer_norm_matmul_tensorcore_gelu.cuda", [["TENSOR", [64, 1024], "float16"], ["TENSOR", [64], "float16"], ["TENSOR", [64], "float16"], ["TENSOR", [4096, 1024], "float16"], 0.0009765625], {}], "config": {"index": 3177, "code_hash": null, "entity": [["block_row_warps", "ot", 1], ["block_col_warps", "ot", 1], ["warp_row_tiles", "ot", 4], ["warp_col_tiles", "ot", 1], ["chunk", "ot", 8], ["offset", "ot", 8], ["offsetCS", "ot", 0], ["vec", "ot", 4], ["wmma_m", "ot", 32]]}, "result": [[0.000213712085], 0, 1.9746830463409424, 1651824472.094023], "version": 0.2, "tvm_version": "0.8.0"}
{"input": ["cuda -keys=cuda,gpu -max_num_threads=1024 -thread_warp_size=32", "fused_layer_norm_matmul_tensorcore_gelu.cuda", [["TENSOR", [64, 1024], "float16"], ["TENSOR", [64], "float16"], ["TENSOR", [64], "float16"], ["TENSOR", [4096, 1024], "float16"], 0.0009765625], {}], "config": {"index": 3861, "code_hash": null, "entity": [["block_row_warps", "ot", 1], ["block_col_warps", "ot", 1], ["warp_row_tiles", "ot", 1], ["warp_col_tiles", "ot", 4], ["chunk", "ot", 8], ["offset", "ot", 8], ["offsetCS", "ot", 8], ["vec", "ot", 4], ["wmma_m", "ot", 32]]}, "result": [[0.000117196725], 0, 1.878002405166626, 1651824473.1229644], "version": 0.2, "tvm_version": "0.8.0"}
{"input": ["cuda -keys=cuda,gpu -max_num_threads=1024 -thread_warp_size=32", "fused_layer_norm_matmul_tensorcore_gelu.cuda", [["TENSOR", [64, 1024], "float16"], ["TENSOR", [64], "float16"], ["TENSOR", [64], "float16"], ["TENSOR", [4096, 1024], "float16"], 0.0009765625], {}], "config": {"index": 3213, "code_hash": null, "entity": [["block_row_warps", "ot", 1], ["block_col_warps", "ot", 1], ["warp_row_tiles", "ot", 1], ["warp_col_tiles", "ot", 4], ["chunk", "ot", 8], ["offset", "ot", 8], ["offsetCS", "ot", 0], ["vec", "ot", 4], ["wmma_m", "ot", 32]]}, "result": [[0.00011612510000000001], 0, 1.7644212245941162, 1651824474.1035137], "version": 0.2, "tvm_version": "0.8.0"}
{"input": ["cuda -keys=cuda,gpu -max_num_threads=1024 -thread_warp_size=32", "fused_layer_norm_matmul_tensorcore_gelu.cuda", [["TENSOR", [64, 1024], "float16"], ["TENSOR", [64], "float16"], ["TENSOR", [64], "float16"], ["TENSOR", [4096, 1024], "float16"], 0.0009765625], {}], "config": {"index": 3537, "code_hash": null, "entity": [["block_row_warps", "ot", 1], ["block_col_warps", "ot", 1], ["warp_row_tiles", "ot", 1], ["warp_col_tiles", "ot", 4], ["chunk", "ot", 8], ["offset", "ot", 0], ["offsetCS", "ot", 8], ["vec", "ot", 4], ["wmma_m", "ot", 32]]}, "result": [[0.000131203932], 0, 1.7575278282165527, 1651824475.1138299], "version": 0.2, "tvm_version": "0.8.0"}
{"input": ["cuda -keys=cuda,gpu -max_num_threads=1024 -thread_warp_size=32", "fused_layer_norm_matmul_tensorcore_gelu.cuda", [["TENSOR", [64, 1024], "float16"], ["TENSOR", [64], "float16"], ["TENSOR", [64], "float16"], ["TENSOR", [4096, 1024], "float16"], 0.0009765625], {}], "config": {"index": 2889, "code_hash": null, "entity": [["block_row_warps", "ot", 1], ["block_col_warps", "ot", 1], ["warp_row_tiles", "ot", 1], ["warp_col_tiles", "ot", 4], ["chunk", "ot", 8], ["offset", "ot", 0], ["offsetCS", "ot", 0], ["vec", "ot", 4], ["wmma_m", "ot", 32]]}, "result": [[0.000131345132], 0, 1.8887557983398438, 1651824476.181755], "version": 0.2, "tvm_version": "0.8.0"}
{"input": ["cuda -keys=cuda,gpu -max_num_threads=1024 -thread_warp_size=32", "fused_layer_norm_matmul_tensorcore_gelu.cuda", [["TENSOR", [64, 1024], "float16"], ["TENSOR", [64], "float16"], ["TENSOR", [64], "float16"], ["TENSOR", [4096, 1024], "float16"], 0.0009765625], {}], "config": {"index": 3484, "code_hash": null, "entity": [["block_row_warps", "ot", 2], ["block_col_warps", "ot", 1], ["warp_row_tiles", "ot", 1], ["warp_col_tiles", "ot", 1], ["chunk", "ot", 8], ["offset", "ot", 0], ["offsetCS", "ot", 8], ["vec", "ot", 4], ["wmma_m", "ot", 32]]}, "result": [[0.000140091005], 0, 1.7119481563568115, 1651824477.2136886], "version": 0.2, "tvm_version": "0.8.0"}
{"input": ["cuda -keys=cuda,gpu -max_num_threads=1024 -thread_warp_size=32", "fused_layer_norm_matmul_tensorcore_gelu.cuda", [["TENSOR", [64, 1024], "float16"], ["TENSOR", [64], "float16"], ["TENSOR", [64], "float16"], ["TENSOR", [4096, 1024], "float16"], 0.0009765625], {}], "config": {"index": 3160, "code_hash": null, "entity": [["block_row_warps", "ot", 2], ["block_col_warps", "ot", 1], ["warp_row_tiles", "ot", 1], ["warp_col_tiles", "ot", 1], ["chunk", "ot", 8], ["offset", "ot", 8], ["offsetCS", "ot", 0], ["vec", "ot", 4], ["wmma_m", "ot", 32]]}, "result": [[0.00011279593199999998], 0, 1.6632277965545654, 1651824478.1631234], "version": 0.2, "tvm_version": "0.8.0"}
{"input": ["cuda -keys=cuda,gpu -max_num_threads=1024 -thread_warp_size=32", "fused_layer_norm_matmul_tensorcore_gelu.cuda", [["TENSOR", [64, 1024], "float16"], ["TENSOR", [64], "float16"], ["TENSOR", [64], "float16"], ["TENSOR", [4096, 1024], "float16"], 0.0009765625], {}], "config": {"index": 2836, "code_hash": null, "entity": [["block_row_warps", "ot", 2], ["block_col_warps", "ot", 1], ["warp_row_tiles", "ot", 1], ["warp_col_tiles", "ot", 1], ["chunk", "ot", 8], ["offset", "ot", 0], ["offsetCS", "ot", 0], ["vec", "ot", 4], ["wmma_m", "ot", 32]]}, "result": [[0.00014177415999999999], 0, 1.7298243045806885, 1651824479.2109075], "version": 0.2, "tvm_version": "0.8.0"}
{"input": ["cuda -keys=cuda,gpu -max_num_threads=1024 -thread_warp_size=32", "fused_layer_norm_matmul_tensorcore_gelu.cuda", [["TENSOR", [64, 1024], "float16"], ["TENSOR", [64], "float16"], ["TENSOR", [64], "float16"], ["TENSOR", [4096, 1024], "float16"], 0.0009765625], {}], "config": {"index": 3808, "code_hash": null, "entity": [["block_row_warps", "ot", 2], ["block_col_warps", "ot", 1], ["warp_row_tiles", "ot", 1], ["warp_col_tiles", "ot", 1], ["chunk", "ot", 8], ["offset", "ot", 8], ["offsetCS", "ot", 8], ["vec", "ot", 4], ["wmma_m", "ot", 32]]}, "result": [[0.00011270250599999999], 0, 1.630617380142212, 1651824480.163051], "version": 0.2, "tvm_version": "0.8.0"}
{"input": ["cuda -keys=cuda,gpu -max_num_threads=1024 -thread_warp_size=32", "fused_layer_norm_matmul_tensorcore_gelu.cuda", [["TENSOR", [64, 1024], "float16"], ["TENSOR", [64], "float16"], ["TENSOR", [64], "float16"], ["TENSOR", [4096, 1024], "float16"], 0.0009765625], {}], "config": {"index": 1809, "code_hash": null, "entity": [["block_row_warps", "ot", 1], ["block_col_warps", "ot", 1], ["warp_row_tiles", "ot", 1], ["warp_col_tiles", "ot", 2], ["chunk", "ot", 4], ["offset", "ot", 8], ["offsetCS", "ot", 0], ["vec", "ot", 2], ["wmma_m", "ot", 32]]}, "result": [[0.000154377642], 0, 1.7264246940612793, 1651824481.21445], "version": 0.2, "tvm_version": "0.8.0"}
{"input": ["cuda -keys=cuda,gpu -max_num_threads=1024 -thread_warp_size=32", "fused_layer_norm_matmul_tensorcore_gelu.cuda", [["TENSOR", [64, 1024], "float16"], ["TENSOR", [64], "float16"], ["TENSOR", [64], "float16"], ["TENSOR", [4096, 1024], "float16"], 0.0009765625], {}], "config": {"index": 2457, "code_hash": null, "entity": [["block_row_warps", "ot", 1], ["block_col_warps", "ot", 1], ["warp_row_tiles", "ot", 1], ["warp_col_tiles", "ot", 2], ["chunk", "ot", 4], ["offset", "ot", 8], ["offsetCS", "ot", 8], ["vec", "ot", 2], ["wmma_m", "ot", 32]]}, "result": [[0.000154381252], 0, 1.8292694091796875, 1651824482.3411953], "version": 0.2, "tvm_version": "0.8.0"}
{"input": ["cuda -keys=cuda,gpu -max_num_threads=1024 -thread_warp_size=32", "fused_layer_norm_matmul_tensorcore_gelu.cuda", [["TENSOR", [64, 1024], "float16"], ["TENSOR", [64], "float16"], ["TENSOR", [64], "float16"], ["TENSOR", [4096, 1024], "float16"], 0.0009765625], {}], "config": {"index": 2106, "code_hash": null, "entity": [["block_row_warps", "ot", 1], ["block_col_warps", "ot", 1], ["warp_row_tiles", "ot", 1], ["warp_col_tiles", "ot", 1], ["chunk", "ot", 4], ["offset", "ot", 0], ["offsetCS", "ot", 8], ["vec", "ot", 2], ["wmma_m", "ot", 32]]}, "result": [[0.000184833623], 0, 1.8046541213989258, 1651824483.499199], "version": 0.2, "tvm_version": "0.8.0"}
{"input": ["cuda -keys=cuda,gpu -max_num_threads=1024 -thread_warp_size=32", "fused_layer_norm_matmul_tensorcore_gelu.cuda", [["TENSOR", [64, 1024], "float16"], ["TENSOR", [64], "float16"], ["TENSOR", [64], "float16"], ["TENSOR", [4096, 1024], "float16"], 0.0009765625], {}], "config": {"index": 1782, "code_hash": null, "entity": [["block_row_warps", "ot", 1], ["block_col_warps", "ot", 1], ["warp_row_tiles", "ot", 1], ["warp_col_tiles", "ot", 1], ["chunk", "ot", 4], ["offset", "ot", 8], ["offsetCS", "ot", 0], ["vec", "ot", 2], ["wmma_m", "ot", 32]]}, "result": [[0.000153746603], 0, 1.6893410682678223, 1651824484.5297456], "version": 0.2, "tvm_version": "0.8.0"}
{"input": ["cuda -keys=cuda,gpu -max_num_threads=1024 -thread_warp_size=32", "fused_layer_norm_matmul_tensorcore_gelu.cuda", [["TENSOR", [64, 1024], "float16"], ["TENSOR", [64], "float16"], ["TENSOR", [64], "float16"], ["TENSOR", [4096, 1024], "float16"], 0.0009765625], {}], "config": {"index": 2133, "code_hash": null, "entity": [["block_row_warps", "ot", 1], ["block_col_warps", "ot", 1], ["warp_row_tiles", "ot", 1], ["warp_col_tiles", "ot", 2], ["chunk", "ot", 4], ["offset", "ot", 0], ["offsetCS", "ot", 8], ["vec", "ot", 2], ["wmma_m", "ot", 32]]}, "result": [[0.00017036211399999997], 0, 1.8142516613006592, 1651824485.686113], "version": 0.2, "tvm_version": "0.8.0"}
{"input": ["cuda -keys=cuda,gpu -max_num_threads=1024 -thread_warp_size=32", "fused_layer_norm_matmul_tensorcore_gelu.cuda", [["TENSOR", [64, 1024], "float16"], ["TENSOR", [64], "float16"], ["TENSOR", [64], "float16"], ["TENSOR", [4096, 1024], "float16"], 0.0009765625], {}], "config": {"index": 6651, "code_hash": null, "entity": [["block_row_warps", "ot", 1], ["block_col_warps", "ot", 1], ["warp_row_tiles", "ot", 2], ["warp_col_tiles", "ot", 1], ["chunk", "ot", 4], ["offset", "ot", 0], ["offsetCS", "ot", 0], ["vec", "ot", 2], ["wmma_m", "ot", 16]]}, "result": [[0.00017081089600000002], 0, 1.7508654594421387, 1651824486.7797139], "version": 0.2, "tvm_version": "0.8.0"}
{"input": ["cuda -keys=cuda,gpu -max_num_threads=1024 -thread_warp_size=32", "fused_layer_norm_matmul_tensorcore_gelu.cuda", [["TENSOR", [64, 1024], "float16"], ["TENSOR", [64], "float16"], ["TENSOR", [64], "float16"], ["TENSOR", [4096, 1024], "float16"], 0.0009765625], {}], "config": {"index": 1485, "code_hash": null, "entity": [["block_row_warps", "ot", 1], ["block_col_warps", "ot", 1], ["warp_row_tiles", "ot", 1], ["warp_col_tiles", "ot", 2], ["chunk", "ot", 4], ["offset", "ot", 0], ["offsetCS", "ot", 0], ["vec", "ot", 2], ["wmma_m", "ot", 32]]}, "result": [[0.000170883278], 0, 1.7961571216583252, 1651824487.87675], "version": 0.2, "tvm_version": "0.8.0"}
{"input": ["cuda -keys=cuda,gpu -max_num_threads=1024 -thread_warp_size=32", "fused_layer_norm_matmul_tensorcore_gelu.cuda", [["TENSOR", [64, 1024], "float16"], ["TENSOR", [64], "float16"], ["TENSOR", [64], "float16"], ["TENSOR", [4096, 1024], "float16"], 0.0009765625], {}], "config": {"index": 2430, "code_hash": null, "entity": [["block_row_warps", "ot", 1], ["block_col_warps", "ot", 1], ["warp_row_tiles", "ot", 1], ["warp_col_tiles", "ot", 1], ["chunk", "ot", 4], ["offset", "ot", 8], ["offsetCS", "ot", 8], ["vec", "ot", 2], ["wmma_m", "ot", 32]]}, "result": [[0.000153442593], 0, 1.7544925212860107, 1651824488.963006], "version": 0.2, "tvm_version": "0.8.0"}
{"input": ["cuda -keys=cuda,gpu -max_num_threads=1024 -thread_warp_size=32", "fused_layer_norm_matmul_tensorcore_gelu.cuda", [["TENSOR", [64, 1024], "float16"], ["TENSOR", [64], "float16"], ["TENSOR", [64], "float16"], ["TENSOR", [4096, 1024], "float16"], 0.0009765625], {}], "config": {"index": 7299, "code_hash": null, "entity": [["block_row_warps", "ot", 1], ["block_col_warps", "ot", 1], ["warp_row_tiles", "ot", 2], ["warp_col_tiles", "ot", 1], ["chunk", "ot", 4], ["offset", "ot", 0], ["offsetCS", "ot", 8], ["vec", "ot", 2], ["wmma_m", "ot", 16]]}, "result": [[0.000171500492], 0, 1.7726163864135742, 1651824490.0544462], "version": 0.2, "tvm_version": "0.8.0"}
{"input": ["cuda -keys=cuda,gpu -max_num_threads=1024 -thread_warp_size=32", "fused_layer_norm_matmul_tensorcore_gelu.cuda", [["TENSOR", [64, 1024], "float16"], ["TENSOR", [64], "float16"], ["TENSOR", [64], "float16"], ["TENSOR", [4096, 1024], "float16"], 0.0009765625], {}], "config": {"index": 7623, "code_hash": null, "entity": [["block_row_warps", "ot", 1], ["block_col_warps", "ot", 1], ["warp_row_tiles", "ot", 2], ["warp_col_tiles", "ot", 1], ["chunk", "ot", 4], ["offset", "ot", 8], ["offsetCS", "ot", 8], ["vec", "ot", 2], ["wmma_m", "ot", 16]]}, "result": [[0.000153945897], 0, 1.7202839851379395, 1651824491.1124744], "version": 0.2, "tvm_version": "0.8.0"}
{"input": ["cuda -keys=cuda,gpu -max_num_threads=1024 -thread_warp_size=32", "fused_layer_norm_matmul_tensorcore_gelu.cuda", [["TENSOR", [64, 1024], "float16"], ["TENSOR", [64], "float16"], ["TENSOR", [64], "float16"], ["TENSOR", [4096, 1024], "float16"], 0.0009765625], {}], "config": {"index": 1458, "code_hash": null, "entity": [["block_row_warps", "ot", 1], ["block_col_warps", "ot", 1], ["warp_row_tiles", "ot", 1], ["warp_col_tiles", "ot", 1], ["chunk", "ot", 4], ["offset", "ot", 0], ["offsetCS", "ot", 0], ["vec", "ot", 2], ["wmma_m", "ot", 32]]}, "result": [[0.000183957401], 0, 1.8868916034698486, 1651824492.3018174], "version": 0.2, "tvm_version": "0.8.0"}
{"input": ["cuda -keys=cuda,gpu -max_num_threads=1024 -thread_warp_size=32", "fused_layer_norm_matmul_tensorcore_gelu.cuda", [["TENSOR", [64, 1024], "float16"], ["TENSOR", [64], "float16"], ["TENSOR", [64], "float16"], ["TENSOR", [4096, 1024], "float16"], 0.0009765625], {}], "config": {"index": 2190, "code_hash": null, "entity": [["block_row_warps", "ot", 1], ["block_col_warps", "ot", 2], ["warp_row_tiles", "ot", 1], ["warp_col_tiles", "ot", 1], ["chunk", "ot", 8], ["offset", "ot", 0], ["offsetCS", "ot", 8], ["vec", "ot", 2], ["wmma_m", "ot", 32]]}, "result": [[0.00010998839200000001], 0, 1.6817693710327148, 1651824493.240245], "version": 0.2, "tvm_version": "0.8.0"}
{"input": ["cuda -keys=cuda,gpu -max_num_threads=1024 -thread_warp_size=32", "fused_layer_norm_matmul_tensorcore_gelu.cuda", [["TENSOR", [64, 1024], "float16"], ["TENSOR", [64], "float16"], ["TENSOR", [64], "float16"], ["TENSOR", [4096, 1024], "float16"], 0.0009765625], {}], "config": {"index": 2217, "code_hash": null, "entity": [["block_row_warps", "ot", 1], ["block_col_warps", "ot", 2], ["warp_row_tiles", "ot", 1], ["warp_col_tiles", "ot", 2], ["chunk", "ot", 8], ["offset", "ot", 0], ["offsetCS", "ot", 8], ["vec", "ot", 2], ["wmma_m", "ot", 32]]}, "result": [[0.000102636985], 0, 1.691072940826416, 1651824494.143623], "version": 0.2, "tvm_version": "0.8.0"}
{"input": ["cuda -keys=cuda,gpu -max_num_threads=1024 -thread_warp_size=32", "fused_layer_norm_matmul_tensorcore_gelu.cuda", [["TENSOR", [64, 1024], "float16"], ["TENSOR", [64], "float16"], ["TENSOR", [64], "float16"], ["TENSOR", [4096, 1024], "float16"], 0.0009765625], {}], "config": {"index": 2862, "code_hash": null, "entity": [["block_row_warps", "ot", 1], ["block_col_warps", "ot", 1], ["warp_row_tiles", "ot", 1], ["warp_col_tiles", "ot", 2], ["chunk", "ot", 8], ["offset", "ot", 0], ["offsetCS", "ot", 0], ["vec", "ot", 4], ["wmma_m", "ot", 32]]}, "result": [[0.00012603810199999997], 0, 1.766141414642334, 1651824495.1694863], "version": 0.2, "tvm_version": "0.8.0"}
{"input": ["cuda -keys=cuda,gpu -max_num_threads=1024 -thread_warp_size=32", "fused_layer_norm_matmul_tensorcore_gelu.cuda", [["TENSOR", [64, 1024], "float16"], ["TENSOR", [64], "float16"], ["TENSOR", [64], "float16"], ["TENSOR", [4096, 1024], "float16"], 0.0009765625], {}], "config": {"index": 7048, "code_hash": null, "entity": [["block_row_warps", "ot", 2], ["block_col_warps", "ot", 1], ["warp_row_tiles", "ot", 1], ["warp_col_tiles", "ot", 1], ["chunk", "ot", 8], ["offset", "ot", 8], ["offsetCS", "ot", 0], ["vec", "ot", 2], ["wmma_m", "ot", 16]]}, "result": [[8.3255914e-05], 0, 1.5391054153442383, 1651824495.9783254], "version": 0.2, "tvm_version": "0.8.0"}
{"input": ["cuda -keys=cuda,gpu -max_num_threads=1024 -thread_warp_size=32", "fused_layer_norm_matmul_tensorcore_gelu.cuda", [["TENSOR", [64, 1024], "float16"], ["TENSOR", [64], "float16"], ["TENSOR", [64], "float16"], ["TENSOR", [4096, 1024], "float16"], 0.0009765625], {}], "config": {"index": 2514, "code_hash": null, "entity": [["block_row_warps", "ot", 1], ["block_col_warps", "ot", 2], ["warp_row_tiles", "ot", 1], ["warp_col_tiles", "ot", 1], ["chunk", "ot", 8], ["offset", "ot", 8], ["offsetCS", "ot", 8], ["vec", "ot", 2], ["wmma_m", "ot", 32]]}, "result": [[8.3301487e-05], 0, 1.5375704765319824, 1651824496.7885046], "version": 0.2, "tvm_version": "0.8.0"}
{"input": ["cuda -keys=cuda,gpu -max_num_threads=1024 -thread_warp_size=32", "fused_layer_norm_matmul_tensorcore_gelu.cuda", [["TENSOR", [64, 1024], "float16"], ["TENSOR", [64], "float16"], ["TENSOR", [64], "float16"], ["TENSOR", [4096, 1024], "float16"], 0.0009765625], {}], "config": {"index": 7059, "code_hash": null, "entity": [["block_row_warps", "ot", 1], ["block_col_warps", "ot", 2], ["warp_row_tiles", "ot", 2], ["warp_col_tiles", "ot", 1], ["chunk", "ot", 8], ["offset", "ot", 8], ["offsetCS", "ot", 0], ["vec", "ot", 2], ["wmma_m", "ot", 16]]}, "result": [[8.548669e-05], 0, 1.5591089725494385, 1651824497.6800942], "version": 0.2, "tvm_version": "0.8.0"}
{"input": ["cuda -keys=cuda,gpu -max_num_threads=1024 -thread_warp_size=32", "fused_layer_norm_matmul_tensorcore_gelu.cuda", [["TENSOR", [64, 1024], "float16"], ["TENSOR", [64], "float16"], ["TENSOR", [64], "float16"], ["TENSOR", [4096, 1024], "float16"], 0.0009765625], {}], "config": {"index": 6724, "code_hash": null, "entity": [["block_row_warps", "ot", 2], ["block_col_warps", "ot", 1], ["warp_row_tiles", "ot", 1], ["warp_col_tiles", "ot", 1], ["chunk", "ot", 8], ["offset", "ot", 0], ["offsetCS", "ot", 0], ["vec", "ot", 2], ["wmma_m", "ot", 16]]}, "result": [[0.000127686173], 0, 1.4640603065490723, 1651824500.2001972], "version": 0.2, "tvm_version": "0.8.0"}
{"input": ["cuda -keys=cuda,gpu -max_num_threads=1024 -thread_warp_size=32", "fused_layer_norm_matmul_tensorcore_gelu.cuda", [["TENSOR", [64, 1024], "float16"], ["TENSOR", [64], "float16"], ["TENSOR", [64], "float16"], ["TENSOR", [4096, 1024], "float16"], 0.0009765625], {}], "config": {"index": 7372, "code_hash": null, "entity": [["block_row_warps", "ot", 2], ["block_col_warps", "ot", 1], ["warp_row_tiles", "ot", 1], ["warp_col_tiles", "ot", 1], ["chunk", "ot", 8], ["offset", "ot", 0], ["offsetCS", "ot", 8], ["vec", "ot", 2], ["wmma_m", "ot", 16]]}, "result": [[0.00010412215700000001], 0, 1.596308708190918, 1651824501.2304113], "version": 0.2, "tvm_version": "0.8.0"}
{"input": ["cuda -keys=cuda,gpu -max_num_threads=1024 -thread_warp_size=32", "fused_layer_norm_matmul_tensorcore_gelu.cuda", [["TENSOR", [64, 1024], "float16"], ["TENSOR", [64], "float16"], ["TENSOR", [64], "float16"], ["TENSOR", [4096, 1024], "float16"], 0.0009765625], {}], "config": {"index": 7723, "code_hash": null, "entity": [["block_row_warps", "ot", 2], ["block_col_warps", "ot", 1], ["warp_row_tiles", "ot", 1], ["warp_col_tiles", "ot", 2], ["chunk", "ot", 8], ["offset", "ot", 8], ["offsetCS", "ot", 8], ["vec", "ot", 2], ["wmma_m", "ot", 16]]}, "result": [[8.5106695e-05], 0, 1.4935932159423828, 1651824502.137323], "version": 0.2, "tvm_version": "0.8.0"}
{"input": ["cuda -keys=cuda,gpu -max_num_threads=1024 -thread_warp_size=32", "fused_layer_norm_matmul_tensorcore_gelu.cuda", [["TENSOR", [64, 1024], "float16"], ["TENSOR", [64], "float16"], ["TENSOR", [64], "float16"], ["TENSOR", [4096, 1024], "float16"], 0.0009765625], {}], "config": {"index": 3186, "code_hash": null, "entity": [["block_row_warps", "ot", 1], ["block_col_warps", "ot", 1], ["warp_row_tiles", "ot", 1], ["warp_col_tiles", "ot", 2], ["chunk", "ot", 8], ["offset", "ot", 8], ["offsetCS", "ot", 0], ["vec", "ot", 4], ["wmma_m", "ot", 32]]}, "result": [[0.000111270267], 0, 1.4270398616790771, 1651824503.0502849], "version": 0.2, "tvm_version": "0.8.0"}
{"input": ["cuda -keys=cuda,gpu -max_num_threads=1024 -thread_warp_size=32", "fused_layer_norm_matmul_tensorcore_gelu.cuda", [["TENSOR", [64, 1024], "float16"], ["TENSOR", [64], "float16"], ["TENSOR", [64], "float16"], ["TENSOR", [4096, 1024], "float16"], 0.0009765625], {}], "config": {"index": 2541, "code_hash": null, "entity": [["block_row_warps", "ot", 1], ["block_col_warps", "ot", 2], ["warp_row_tiles", "ot", 1], ["warp_col_tiles", "ot", 2], ["chunk", "ot", 8], ["offset", "ot", 8], ["offsetCS", "ot", 8], ["vec", "ot", 2], ["wmma_m", "ot", 32]]}, "result": [[8.515555500000001e-05], 0, 1.515042781829834, 1651824503.8866546], "version": 0.2, "tvm_version": "0.8.0"}
{"input": ["cuda -keys=cuda,gpu -max_num_threads=1024 -thread_warp_size=32", "fused_layer_norm_matmul_tensorcore_gelu.cuda", [["TENSOR", [64, 1024], "float16"], ["TENSOR", [64], "float16"], ["TENSOR", [64], "float16"], ["TENSOR", [4096, 1024], "float16"], 0.0009765625], {}], "config": {"index": 7696, "code_hash": null, "entity": [["block_row_warps", "ot", 2], ["block_col_warps", "ot", 1], ["warp_row_tiles", "ot", 1], ["warp_col_tiles", "ot", 1], ["chunk", "ot", 8], ["offset", "ot", 8], ["offsetCS", "ot", 8], ["vec", "ot", 2], ["wmma_m", "ot", 16]]}, "result": [[8.2671633e-05], 0, 1.4780826568603516, 1651824504.7544596], "version": 0.2, "tvm_version": "0.8.0"}
{"input": ["cuda -keys=cuda,gpu -max_num_threads=1024 -thread_warp_size=32", "fused_layer_norm_matmul_tensorcore_gelu.cuda", [["TENSOR", [64, 1024], "float16"], ["TENSOR", [64], "float16"], ["TENSOR", [64], "float16"], ["TENSOR", [4096, 1024], "float16"], 0.0009765625], {}], "config": {"index": 7399, "code_hash": null, "entity": [["block_row_warps", "ot", 2], ["block_col_warps", "ot", 1], ["warp_row_tiles", "ot", 1], ["warp_col_tiles", "ot", 2], ["chunk", "ot", 8], ["offset", "ot", 0], ["offsetCS", "ot", 8], ["vec", "ot", 2], ["wmma_m", "ot", 16]]}, "result": [[0.00010427045000000001], 0, 1.5186808109283447, 1651824505.6729047], "version": 0.2, "tvm_version": "0.8.0"}
{"input": ["cuda -keys=cuda,gpu -max_num_threads=1024 -thread_warp_size=32", "fused_layer_norm_matmul_tensorcore_gelu.cuda", [["TENSOR", [64, 1024], "float16"], ["TENSOR", [64], "float16"], ["TENSOR", [64], "float16"], ["TENSOR", [4096, 1024], "float16"], 0.0009765625], {}], "config": {"index": 8703, "code_hash": null, "entity": [["block_row_warps", "ot", 1], ["block_col_warps", "ot", 1], ["warp_row_tiles", "ot", 2], ["warp_col_tiles", "ot", 2], ["chunk", "ot", 8], ["offset", "ot", 0], ["offsetCS", "ot", 8], ["vec", "ot", 4], ["wmma_m", "ot", 16]]}, "result": [[0.000130211362], 0, 1.7712435722351074, 1651824506.6717548], "version": 0.2, "tvm_version": "0.8.0"}
{"input": ["cuda -keys=cuda,gpu -max_num_threads=1024 -thread_warp_size=32", "fused_layer_norm_matmul_tensorcore_gelu.cuda", [["TENSOR", [64, 1024], "float16"], ["TENSOR", [64], "float16"], ["TENSOR", [64], "float16"], ["TENSOR", [4096, 1024], "float16"], 0.0009765625], {}], "config": {"index": 6751, "code_hash": null, "entity": [["block_row_warps", "ot", 2], ["block_col_warps", "ot", 1], ["warp_row_tiles", "ot", 1], ["warp_col_tiles", "ot", 2], ["chunk", "ot", 8], ["offset", "ot", 0], ["offsetCS", "ot", 0], ["vec", "ot", 2], ["wmma_m", "ot", 16]]}, "result": [[0.000104340217], 0, 1.6776306629180908, 1651824507.607355], "version": 0.2, "tvm_version": "0.8.0"}
{"input": ["cuda -keys=cuda,gpu -max_num_threads=1024 -thread_warp_size=32", "fused_layer_norm_matmul_tensorcore_gelu.cuda", [["TENSOR", [64, 1024], "float16"], ["TENSOR", [64], "float16"], ["TENSOR", [64], "float16"], ["TENSOR", [4096, 1024], "float16"], 0.0009765625], {}], "config": {"index": 13545, "code_hash": null, "entity": [["block_row_warps", "ot", 1], ["block_col_warps", "ot", 1], ["warp_row_tiles", "ot", 4], ["warp_col_tiles", "ot", 1], ["chunk", "ot", 8], ["offset", "ot", 8], ["offsetCS", "ot", 0], ["vec", "ot", 4], ["wmma_m", "ot", 8]]}, "result": [[0.000116486721], 0, 1.605229139328003, 1651824508.5629842], "version": 0.2, "tvm_version": "0.8.0"}
{"input": ["cuda -keys=cuda,gpu -max_num_threads=1024 -thread_warp_size=32", "fused_layer_norm_matmul_tensorcore_gelu.cuda", [["TENSOR", [64, 1024], "float16"], ["TENSOR", [64], "float16"], ["TENSOR", [64], "float16"], ["TENSOR", [4096, 1024], "float16"], 0.0009765625], {}], "config": {"index": 7383, "code_hash": null, "entity": [["block_row_warps", "ot", 1], ["block_col_warps", "ot", 2], ["warp_row_tiles", "ot", 2], ["warp_col_tiles", "ot", 1], ["chunk", "ot", 8], ["offset", "ot", 0], ["offsetCS", "ot", 8], ["vec", "ot", 2], ["wmma_m", "ot", 16]]}, "result": [[0.000103730296], 0, 1.5272042751312256, 1651824509.4477851], "version": 0.2, "tvm_version": "0.8.0"}
{"input": ["cuda -keys=cuda,gpu -max_num_threads=1024 -thread_warp_size=32", "fused_layer_norm_matmul_tensorcore_gelu.cuda", [["TENSOR", [64, 1024], "float16"], ["TENSOR", [64], "float16"], ["TENSOR", [64], "float16"], ["TENSOR", [4096, 1024], "float16"], 0.0009765625], {}], "config": {"index": 8028, "code_hash": null, "entity": [["block_row_warps", "ot", 1], ["block_col_warps", "ot", 1], ["warp_row_tiles", "ot", 2], ["warp_col_tiles", "ot", 1], ["chunk", "ot", 8], ["offset", "ot", 0], ["offsetCS", "ot", 0], ["vec", "ot", 4], ["wmma_m", "ot", 16]]}, "result": [[0.00012674274299999999], 0, 1.6312403678894043, 1651824510.4423122], "version": 0.2, "tvm_version": "0.8.0"}
{"input": ["cuda -keys=cuda,gpu -max_num_threads=1024 -thread_warp_size=32", "fused_layer_norm_matmul_tensorcore_gelu.cuda", [["TENSOR", [64, 1024], "float16"], ["TENSOR", [64], "float16"], ["TENSOR", [64], "float16"], ["TENSOR", [4096, 1024], "float16"], 0.0009765625], {}], "config": {"index": 3834, "code_hash": null, "entity": [["block_row_warps", "ot", 1], ["block_col_warps", "ot", 1], ["warp_row_tiles", "ot", 1], ["warp_col_tiles", "ot", 2], ["chunk", "ot", 8], ["offset", "ot", 8], ["offsetCS", "ot", 8], ["vec", "ot", 4], ["wmma_m", "ot", 32]]}, "result": [[0.00011073182799999999], 0, 1.5064873695373535, 1651824511.3756595], "version": 0.2, "tvm_version": "0.8.0"}
{"input": ["cuda -keys=cuda,gpu -max_num_threads=1024 -thread_warp_size=32", "fused_layer_norm_matmul_tensorcore_gelu.cuda", [["TENSOR", [64, 1024], "float16"], ["TENSOR", [64], "float16"], ["TENSOR", [64], "float16"], ["TENSOR", [4096, 1024], "float16"], 0.0009765625], {}], "config": {"index": 3510, "code_hash": null, "entity": [["block_row_warps", "ot", 1], ["block_col_warps", "ot", 1], ["warp_row_tiles", "ot", 1], ["warp_col_tiles", "ot", 2], ["chunk", "ot", 8], ["offset", "ot", 0], ["offsetCS", "ot", 8], ["vec", "ot", 4], ["wmma_m", "ot", 32]]}, "result": [[0.000127613415], 0, 1.649266004562378, 1651824512.3451393], "version": 0.2, "tvm_version": "0.8.0"}
{"input": ["cuda -keys=cuda,gpu -max_num_threads=1024 -thread_warp_size=32", "fused_layer_norm_matmul_tensorcore_gelu.cuda", [["TENSOR", [64, 1024], "float16"], ["TENSOR", [64], "float16"], ["TENSOR", [64], "float16"], ["TENSOR", [4096, 1024], "float16"], 0.0009765625], {}], "config": {"index": 7707, "code_hash": null, "entity": [["block_row_warps", "ot", 1], ["block_col_warps", "ot", 2], ["warp_row_tiles", "ot", 2], ["warp_col_tiles", "ot", 1], ["chunk", "ot", 8], ["offset", "ot", 8], ["offsetCS", "ot", 8], ["vec", "ot", 2], ["wmma_m", "ot", 16]]}, "result": [[8.5617334e-05], 0, 1.484844446182251, 1651824513.2614074], "version": 0.2, "tvm_version": "0.8.0"}
{"input": ["cuda -keys=cuda,gpu -max_num_threads=1024 -thread_warp_size=32", "fused_layer_norm_matmul_tensorcore_gelu.cuda", [["TENSOR", [64, 1024], "float16"], ["TENSOR", [64], "float16"], ["TENSOR", [64], "float16"], ["TENSOR", [4096, 1024], "float16"], 0.0009765625], {}], "config": {"index": 14193, "code_hash": null, "entity": [["block_row_warps", "ot", 1], ["block_col_warps", "ot", 1], ["warp_row_tiles", "ot", 4], ["warp_col_tiles", "ot", 1], ["chunk", "ot", 8], ["offset", "ot", 8], ["offsetCS", "ot", 8], ["vec", "ot", 4], ["wmma_m", "ot", 8]]}, "result": [[0.00011686175900000001], 0, 1.7579805850982666, 1651824514.2526767], "version": 0.2, "tvm_version": "0.8.0"}
{"input": ["cuda -keys=cuda,gpu -max_num_threads=1024 -thread_warp_size=32", "fused_layer_norm_matmul_tensorcore_gelu.cuda", [["TENSOR", [64, 1024], "float16"], ["TENSOR", [64], "float16"], ["TENSOR", [64], "float16"], ["TENSOR", [4096, 1024], "float16"], 0.0009765625], {}], "config": {"index": 8055, "code_hash": null, "entity": [["block_row_warps", "ot", 1], ["block_col_warps", "ot", 1], ["warp_row_tiles", "ot", 2], ["warp_col_tiles", "ot", 2], ["chunk", "ot", 8], ["offset", "ot", 0], ["offsetCS", "ot", 0], ["vec", "ot", 4], ["wmma_m", "ot", 16]]}, "result": [[0.00013030407], 0, 1.6855394840240479, 1651824515.2385836], "version": 0.2, "tvm_version": "0.8.0"}
{"input": ["cuda -keys=cuda,gpu -max_num_threads=1024 -thread_warp_size=32", "fused_layer_norm_matmul_tensorcore_gelu.cuda", [["TENSOR", [64, 1024], "float16"], ["TENSOR", [64], "float16"], ["TENSOR", [64], "float16"], ["TENSOR", [4096, 1024], "float16"], 0.0009765625], {}], "config": {"index": 12889, "code_hash": null, "entity": [["block_row_warps", "ot", 2], ["block_col_warps", "ot", 1], ["warp_row_tiles", "ot", 2], ["warp_col_tiles", "ot", 1], ["chunk", "ot", 8], ["offset", "ot", 8], ["offsetCS", "ot", 8], ["vec", "ot", 2], ["wmma_m", "ot", 8]]}, "result": [[8.5876115e-05], 0, 1.626784324645996, 1651824516.1583045], "version": 0.2, "tvm_version": "0.8.0"}
{"input": ["cuda -keys=cuda,gpu -max_num_threads=1024 -thread_warp_size=32", "fused_layer_norm_matmul_tensorcore_gelu.cuda", [["TENSOR", [64, 1024], "float16"], ["TENSOR", [64], "float16"], ["TENSOR", [64], "float16"], ["TENSOR", [4096, 1024], "float16"], 0.0009765625], {}], "config": {"index": 13869, "code_hash": null, "entity": [["block_row_warps", "ot", 1], ["block_col_warps", "ot", 1], ["warp_row_tiles", "ot", 4], ["warp_col_tiles", "ot", 1], ["chunk", "ot", 8], ["offset", "ot", 0], ["offsetCS", "ot", 8], ["vec", "ot", 4], ["wmma_m", "ot", 8]]}, "result": [[0.000130737115], 0, 1.7806355953216553, 1651824517.165624], "version": 0.2, "tvm_version": "0.8.0"}
