python/models/swin_transformer/kernel_configs/swin_transformer_te_slice_1_56_56_128_[1, 0]_2.log
{"i": [["[\"te_slice\", 1, 56, 56, 128, [1, 0], 2, \"float16\"]", "cuda -keys=cuda,gpu -max_num_threads=1024 -model=unknown -thread_warp_size=32", [-1, 16, 64, 49152, 2147483647, 1024, 8, 32], "", 0, []], [[], [["FU", 1, [0, 1, 2, 3]], ["SP", 1, 0, 100352, [32], 1], ["AN", 1, 0, 5], ["AN", 1, 1, 6]]]], "r": [[4.90495e-06, 4.91474e-06, 4.91846e-06], 0, 2.78163, 1668065307], "v": "v0.6"}
{"i": [["[\"te_slice\", 1, 56, 56, 128, [1, 0], 2, \"float16\"]", "cuda -keys=cuda,gpu -max_num_threads=1024 -model=unknown -thread_warp_size=32", [-1, 16, 64, 49152, 2147483647, 1024, 8, 32], "", 0, []], [[], [["FU", 1, [0, 1, 2, 3]], ["SP", 1, 0, 100352, [28], 1], ["AN", 1, 0, 5], ["AN", 1, 1, 6]]]], "r": [[5.36665e-06, 5.37411e-06, 5.37242e-06], 0, 1.68541, 1668065305], "v": "v0.6"}
{"i": [["[\"te_slice\", 1, 56, 56, 128, [1, 0], 2, \"float16\"]", "cuda -keys=cuda,gpu -max_num_threads=1024 -model=unknown -thread_warp_size=32", [-1, 16, 64, 49152, 2147483647, 1024, 8, 32], "", 0, []], [[], [["FU", 1, [0, 1, 2, 3]], ["SP", 1, 0, 100352, [56], 1], ["AN", 1, 0, 5], ["AN", 1, 1, 6]]]], "r": [[3.80681e-06, 3.81988e-06, 3.82001e-06], 0, 0.584663, 1668065304], "v": "v0.6"}
{"i": [["[\"te_slice\", 1, 56, 56, 128, [1, 0], 2, \"float16\"]", "cuda -keys=cuda,gpu -max_num_threads=1024 -model=unknown -thread_warp_size=32", [-1, 16, 64, 49152, 2147483647, 1024, 8, 32], "", 0, []], [[], [["FU", 1, [0, 1, 2, 3]], ["SP", 1, 0, 100352, [2], 1], ["AN", 1, 0, 5], ["AN", 1, 1, 6]]]], "r": [[4.0063e-05, 4.00665e-05, 4.00804e-05], 0, 0.930154, 1668065305], "v": "v0.6"}
{"i": [["[\"te_slice\", 1, 56, 56, 128, [1, 0], 2, \"float16\"]", "cuda -keys=cuda,gpu -max_num_threads=1024 -model=unknown -thread_warp_size=32", [-1, 16, 64, 49152, 2147483647, 1024, 8, 32], "", 0, []], [[], [["FU", 1, [0, 1, 2, 3]], ["SP", 1, 0, 100352, [7], 1], ["AN", 1, 0, 5], ["AN", 1, 1, 6]]]], "r": [[1.34576e-05, 1.34697e-05, 1.34692e-05], 0, 2.392, 1668065306], "v": "v0.6"}
{"i": [["[\"te_slice\", 1, 56, 56, 128, [1, 0], 2, \"float16\"]", "cuda -keys=cuda,gpu -max_num_threads=1024 -model=unknown -thread_warp_size=32", [-1, 16, 64, 49152, 2147483647, 1024, 8, 32], "", 0, []], [[], [["FU", 1, [0, 1, 2, 3]], ["SP", 1, 0, 100352, [16], 1], ["AN", 1, 0, 5], ["AN", 1, 1, 6]]]], "r": [[7.23596e-06, 7.24901e-06, 7.24817e-06], 0, 3.86353, 1668065308], "v": "v0.6"}
{"i": [["[\"te_slice\", 1, 56, 56, 128, [1, 0], 2, \"float16\"]", "cuda -keys=cuda,gpu -max_num_threads=1024 -model=unknown -thread_warp_size=32", [-1, 16, 64, 49152, 2147483647, 1024, 8, 32], "", 0, []], [[], [["FU", 1, [0, 1, 2, 3]], ["SP", 1, 0, 100352, [8], 1], ["AN", 1, 0, 5], ["AN", 1, 1, 6]]]], "r": [[1.20782e-05, 1.20846e-05, 1.20851e-05], 0, 2.04134, 1668065306], "v": "v0.6"}
{"i": [["[\"te_slice\", 1, 56, 56, 128, [1, 0], 2, \"float16\"]", "cuda -keys=cuda,gpu -max_num_threads=1024 -model=unknown -thread_warp_size=32", [-1, 16, 64, 49152, 2147483647, 1024, 8, 32], "", 0, []], [[], [["FU", 1, [0, 1, 2, 3]], ["SP", 1, 0, 100352, [1], 1], ["AN", 1, 0, 5], ["AN", 1, 1, 6]]]], "r": [[7.71063e-05, 7.71299e-05, 7.71225e-05], 0, 3.48689, 1668065307], "v": "v0.6"}
{"i": [["[\"te_slice\", 1, 56, 56, 128, [1, 0], 2, \"float16\"]", "cuda -keys=cuda,gpu -max_num_threads=1024 -model=unknown -thread_warp_size=32", [-1, 16, 64, 49152, 2147483647, 1024, 8, 32], "", 0, []], [[], [["FU", 1, [0, 1, 2, 3]], ["SP", 1, 0, 100352, [49], 1], ["AN", 1, 0, 5], ["AN", 1, 1, 6]]]], "r": [[4.14339e-06, 4.15651e-06, 4.15609e-06], 0, 1.28012, 1668065305], "v": "v0.6"}
{"i": [["[\"te_slice\", 1, 56, 56, 128, [1, 0], 2, \"float16\"]", "cuda -keys=cuda,gpu -max_num_threads=1024 -model=unknown -thread_warp_size=32", [-1, 16, 64, 49152, 2147483647, 1024, 8, 32], "", 0, []], [[], [["FU", 1, [0, 1, 2, 3]], ["SP", 1, 0, 100352, [4], 1], ["AN", 1, 0, 5], ["AN", 1, 1, 6]]]], "r": [[2.13823e-05, 2.13967e-05, 2.13967e-05], 0, 4.21816, 1668065308], "v": "v0.6"}
{"i": [["[\"te_slice\", 1, 56, 56, 128, [1, 0], 2, \"float16\"]", "cuda -keys=cuda,gpu -max_num_threads=1024 -model=unknown -thread_warp_size=32", [-1, 16, 64, 49152, 2147483647, 1024, 8, 32], "", 0, []], [[], [["FU", 1, [0, 1, 2, 3]], ["SP", 1, 0, 100352, [64], 1], ["AN", 1, 0, 5], ["AN", 1, 1, 6]]]], "r": [[3.59767e-06, 3.59478e-06, 3.5939e-06], 0, 3.1373, 1668065307], "v": "v0.6"}
{"i": [["[\"te_slice\", 1, 56, 56, 128, [1, 0], 2, \"float16\"]", "cuda -keys=cuda,gpu -max_num_threads=1024 -model=unknown -thread_warp_size=32", [-1, 16, 64, 49152, 2147483647, 1024, 8, 32], "", 0, []], [[], [["FU", 1, [0, 1, 2, 3]], ["SP", 1, 0, 100352, [14], 1], ["AN", 1, 0, 5], ["AN", 1, 1, 6]]]], "r": [[7.97369e-06, 7.98393e-06, 7.98255e-06], 0, 4.57517, 1668065308], "v": "v0.6"}
