python/models/swin_transformer/kernel_configs/swin_transformer_fused_roll_reshape_permute_reshape_tune_1_64_64_128_3_8.log
{"i": [["[\"fused_roll_reshape_permute_reshape\", 1, 64, 64, 128, 3, 8]", "cuda -keys=cuda,gpu -max_num_threads=1024 -model=unknown -thread_warp_size=32", [-1, 16, 64, 49152, 2147483647, 1024, 8, 32], "", 0, []], [[], [["FU", 1, [0, 1]], ["SP", 1, 0, 524288, [2], 1], ["AN", 1, 0, 5], ["AN", 1, 1, 6]]]], "r": [[0.000196821, 0.000196817, 0.000196818, 0.000196819, 0.000196818, 0.000196817, 0.00019682, 0.000196818, 0.000196816, 0.000196818], 0, 30.3189, 1652112886], "v": "v0.6"}
{"i": [["[\"fused_roll_reshape_permute_reshape\", 1, 64, 64, 128, 3, 8]", "cuda -keys=cuda,gpu -max_num_threads=1024 -model=unknown -thread_warp_size=32", [-1, 16, 64, 49152, 2147483647, 1024, 8, 32], "", 0, []], [[], [["FU", 1, [0, 1]], ["SP", 1, 0, 524288, [4], 1], ["AN", 1, 0, 5], ["AN", 1, 1, 6]]]], "r": [[9.97572e-05, 9.97579e-05, 9.97553e-05, 9.97567e-05, 9.97559e-05, 9.97572e-05, 9.97596e-05, 9.97542e-05, 9.97547e-05, 9.97542e-05], 0, 20.2598, 1652112876], "v": "v0.6"}
{"i": [["[\"fused_roll_reshape_permute_reshape\", 1, 64, 64, 128, 3, 8]", "cuda -keys=cuda,gpu -max_num_threads=1024 -model=unknown -thread_warp_size=32", [-1, 16, 64, 49152, 2147483647, 1024, 8, 32], "", 0, []], [[], [["FU", 1, [0, 1]], ["SP", 1, 0, 524288, [64], 1], ["AN", 1, 0, 5], ["AN", 1, 1, 6]]]], "r": [[8.64472e-06, 8.64383e-06, 8.64405e-06, 8.641e-06, 8.64197e-06, 8.64209e-06, 8.64327e-06, 8.64259e-06, 8.63948e-06, 8.64102e-06], 0, 14.8864, 1652112870], "v": "v0.6"}
{"i": [["[\"fused_roll_reshape_permute_reshape\", 1, 64, 64, 128, 3, 8]", "cuda -keys=cuda,gpu -max_num_threads=1024 -model=unknown -thread_warp_size=32", [-1, 16, 64, 49152, 2147483647, 1024, 8, 32], "", 0, []], [[], [["FU", 1, [0, 1]], ["SP", 1, 0, 524288, [1], 1], ["AN", 1, 0, 5], ["AN", 1, 1, 6]]]], "r": [[0.00039107, 0.000391066, 0.000391099, 0.00039117, 0.000391051, 0.000391047, 0.000391043, 0.000391045, 0.000391049, 0.00039105], 0, 5.42652, 1652112861], "v": "v0.6"}
{"i": [["[\"fused_roll_reshape_permute_reshape\", 1, 64, 64, 128, 3, 8]", "cuda -keys=cuda,gpu -max_num_threads=1024 -model=unknown -thread_warp_size=32", [-1, 16, 64, 49152, 2147483647, 1024, 8, 32], "", 0, []], [[], [["FU", 1, [0, 1]], ["SP", 1, 0, 524288, [8], 1], ["AN", 1, 0, 5], ["AN", 1, 1, 6]]]], "r": [[5.12573e-05, 5.12589e-05, 5.12584e-05, 5.12582e-05, 5.12567e-05, 5.12579e-05, 5.12567e-05, 5.12567e-05, 5.12569e-05, 5.12571e-05], 0, 10.6477, 1652112866], "v": "v0.6"}
{"i": [["[\"fused_roll_reshape_permute_reshape\", 1, 64, 64, 128, 3, 8]", "cuda -keys=cuda,gpu -max_num_threads=1024 -model=unknown -thread_warp_size=32", [-1, 16, 64, 49152, 2147483647, 1024, 8, 32], "", 0, []], [[], [["FU", 1, [0, 1]], ["SP", 1, 0, 524288, [32], 1], ["AN", 1, 0, 5], ["AN", 1, 1, 6]]]], "r": [[1.483e-05, 1.48328e-05, 1.48293e-05, 1.48299e-05, 1.48309e-05, 1.48312e-05, 1.48297e-05, 1.48312e-05, 1.48296e-05, 1.48299e-05], 0, 24.9071, 1652112880], "v": "v0.6"}
{"i": [["[\"fused_roll_reshape_permute_reshape\", 1, 64, 64, 128, 3, 8]", "cuda -keys=cuda,gpu -max_num_threads=1024 -model=unknown -thread_warp_size=32", [-1, 16, 64, 49152, 2147483647, 1024, 8, 32], "", 0, []], [[], [["FU", 1, [0, 1]], ["SP", 1, 0, 524288, [16], 1], ["AN", 1, 0, 5], ["AN", 1, 1, 6]]]], "r": [[2.69476e-05, 2.6946e-05, 2.69455e-05, 2.6947e-05, 2.69478e-05, 2.69481e-05, 2.69514e-05, 2.69468e-05, 2.69487e-05, 2.69483e-05], 0, 35.2533, 1652112891], "v": "v0.6"}
{"i": [["[\"fused_roll_reshape_permute_reshape\", 1, 64, 64, 128, 3, 8]", "cuda -keys=cuda,gpu -max_num_threads=1024 -model=unknown -thread_warp_size=32", [-1, 16, 64, 49152, 2147483647, 1024, 8, 32], "", 0, []], [[], [["FU", 1, [0, 1]], ["SP", 1, 0, 524288, [4], 1], ["AN", 1, 0, 5], ["AN", 1, 1, 6]]]], "r": [[9.98048e-05, 9.98028e-05, 9.98003e-05, 9.98035e-05, 9.98013e-05, 9.98028e-05, 9.98019e-05, 9.98026e-05, 9.98027e-05, 9.98024e-05], 0, 5.91938, 1652113508], "v": "v0.6"}
{"i": [["[\"fused_roll_reshape_permute_reshape\", 1, 64, 64, 128, 3, 8]", "cuda -keys=cuda,gpu -max_num_threads=1024 -model=unknown -thread_warp_size=32", [-1, 16, 64, 49152, 2147483647, 1024, 8, 32], "", 0, []], [[], [["FU", 1, [0, 1]], ["SP", 1, 0, 524288, [32], 1], ["AN", 1, 0, 5], ["AN", 1, 1, 6]]]], "r": [[1.48198e-05, 1.48206e-05, 1.48234e-05, 1.48239e-05, 1.48233e-05, 1.48236e-05, 1.48225e-05, 1.48229e-05, 1.48229e-05, 1.48213e-05], 0, 15.0445, 1652113517], "v": "v0.6"}
{"i": [["[\"fused_roll_reshape_permute_reshape\", 1, 64, 64, 128, 3, 8]", "cuda -keys=cuda,gpu -max_num_threads=1024 -model=unknown -thread_warp_size=32", [-1, 16, 64, 49152, 2147483647, 1024, 8, 32], "", 0, []], [[], [["FU", 1, [0, 1]], ["SP", 1, 0, 524288, [1], 1], ["AN", 1, 0, 5], ["AN", 1, 1, 6]]]], "r": [[0.000391155, 0.000391167, 0.000391166, 0.00039119, 0.000391205, 0.000391161, 0.000391164, 0.00039116, 0.000391164, 0.000391162], 0, 30.1888, 1652113532], "v": "v0.6"}
{"i": [["[\"fused_roll_reshape_permute_reshape\", 1, 64, 64, 128, 3, 8]", "cuda -keys=cuda,gpu -max_num_threads=1024 -model=unknown -thread_warp_size=32", [-1, 16, 64, 49152, 2147483647, 1024, 8, 32], "", 0, []], [[], [["FU", 1, [0, 1]], ["SP", 1, 0, 524288, [2], 1], ["AN", 1, 0, 5], ["AN", 1, 1, 6]]]], "r": [[0.000196805, 0.000196807, 0.000196818, 0.000196812, 0.000196807, 0.000196809, 0.00019681, 0.000196811, 0.000196801, 0.000196802], 0, 24.9076, 1652113527], "v": "v0.6"}
{"i": [["[\"fused_roll_reshape_permute_reshape\", 1, 64, 64, 128, 3, 8]", "cuda -keys=cuda,gpu -max_num_threads=1024 -model=unknown -thread_warp_size=32", [-1, 16, 64, 49152, 2147483647, 1024, 8, 32], "", 0, []], [[], [["FU", 1, [0, 1]], ["SP", 1, 0, 524288, [8], 1], ["AN", 1, 0, 5], ["AN", 1, 1, 6]]]], "r": [[5.13039e-05, 5.13004e-05, 5.13031e-05, 5.13019e-05, 5.13009e-05, 5.13031e-05, 5.13011e-05, 5.13031e-05, 5.13023e-05, 5.13027e-05], 0, 35.4482, 1652113538], "v": "v0.6"}
{"i": [["[\"fused_roll_reshape_permute_reshape\", 1, 64, 64, 128, 3, 8]", "cuda -keys=cuda,gpu -max_num_threads=1024 -model=unknown -thread_warp_size=32", [-1, 16, 64, 49152, 2147483647, 1024, 8, 32], "", 0, []], [[], [["FU", 1, [0, 1]], ["SP", 1, 0, 524288, [64], 1], ["AN", 1, 0, 5], ["AN", 1, 1, 6]]]], "r": [[8.79417e-06, 8.79313e-06, 8.79245e-06, 8.79364e-06, 8.79379e-06, 8.79302e-06, 8.79344e-06, 8.79386e-06, 8.79438e-06, 8.79303e-06], 0, 19.6229, 1652113522], "v": "v0.6"}
{"i": [["[\"fused_roll_reshape_permute_reshape\", 1, 64, 64, 128, 3, 8]", "cuda -keys=cuda,gpu -max_num_threads=1024 -model=unknown -thread_warp_size=32", [-1, 16, 64, 49152, 2147483647, 1024, 8, 32], "", 0, []], [[], [["FU", 1, [0, 1]], ["SP", 1, 0, 524288, [16], 1], ["AN", 1, 0, 5], ["AN", 1, 1, 6]]]], "r": [[2.69896e-05, 2.69909e-05, 2.69905e-05, 2.69908e-05, 2.69916e-05, 2.69904e-05, 2.69927e-05, 2.69914e-05, 2.69899e-05, 2.6991e-05], 0, 10.6963, 1652113513], "v": "v0.6"}
