python/models/swin_transformer/kernel_configs/swin_transformer_te_slice_1_14_14_512_[0, 1]_2.log
{"i": [["[\"te_slice\", 1, 14, 14, 512, [0, 1], 2, \"float16\"]", "cuda -keys=cuda,gpu -max_num_threads=1024 -model=unknown -thread_warp_size=32", [-1, 16, 64, 49152, 2147483647, 1024, 8, 32], "", 0, []], [[], [["FU", 1, [0, 1, 2, 3]], ["SP", 1, 0, 25088, [28], 1], ["AN", 1, 0, 5], ["AN", 1, 1, 6]]]], "r": [[3.21272e-06, 3.21256e-06, 3.21166e-06, 3.21324e-06, 3.21286e-06, 3.21345e-06, 3.21355e-06, 3.21317e-06, 3.21283e-06, 3.21238e-06], 0, 33.7165, 1652156178], "v": "v0.6"}
{"i": [["[\"te_slice\", 1, 14, 14, 512, [0, 1], 2, \"float16\"]", "cuda -keys=cuda,gpu -max_num_threads=1024 -model=unknown -thread_warp_size=32", [-1, 16, 64, 49152, 2147483647, 1024, 8, 32], "", 0, []], [[], [["FU", 1, [0, 1, 2, 3]], ["SP", 1, 0, 25088, [2], 1], ["AN", 1, 0, 5], ["AN", 1, 1, 6]]]], "r": [[1.21203e-05, 1.21225e-05, 1.21224e-05, 1.21224e-05, 1.21224e-05, 1.21197e-05, 1.2122e-05, 1.21216e-05, 1.21217e-05, 1.21215e-05], 0, 12.5915, 1652156157], "v": "v0.6"}
{"i": [["[\"te_slice\", 1, 14, 14, 512, [0, 1], 2, \"float16\"]", "cuda -keys=cuda,gpu -max_num_threads=1024 -model=unknown -thread_warp_size=32", [-1, 16, 64, 49152, 2147483647, 1024, 8, 32], "", 0, []], [[], [["FU", 1, [0, 1, 2, 3]], ["SP", 1, 0, 25088, [64], 1], ["AN", 1, 0, 5], ["AN", 1, 1, 6]]]], "r": [[2.78631e-06, 2.78583e-06, 2.78648e-06, 2.78636e-06, 2.78623e-06, 2.78627e-06, 2.78621e-06, 2.7862e-06, 2.78601e-06, 2.78578e-06], 0, 40.8257, 1652156186], "v": "v0.6"}
{"i": [["[\"te_slice\", 1, 14, 14, 512, [0, 1], 2, \"float16\"]", "cuda -keys=cuda,gpu -max_num_threads=1024 -model=unknown -thread_warp_size=32", [-1, 16, 64, 49152, 2147483647, 1024, 8, 32], "", 0, []], [[], [["FU", 1, [0, 1, 2, 3]], ["SP", 1, 0, 25088, [8], 1], ["AN", 1, 0, 5], ["AN", 1, 1, 6]]]], "r": [[4.93374e-06, 4.93405e-06, 4.93427e-06, 4.93427e-06, 4.93448e-06, 4.93464e-06, 4.93426e-06, 4.93355e-06, 4.93443e-06, 4.93403e-06], 0, 25.4035, 1652156170], "v": "v0.6"}
{"i": [["[\"te_slice\", 1, 14, 14, 512, [0, 1], 2, \"float16\"]", "cuda -keys=cuda,gpu -max_num_threads=1024 -model=unknown -thread_warp_size=32", [-1, 16, 64, 49152, 2147483647, 1024, 8, 32], "", 0, []], [[], [["FU", 1, [0, 1, 2, 3]], ["SP", 1, 0, 25088, [56], 1], ["AN", 1, 0, 5], ["AN", 1, 1, 6]]]], "r": [[2.89743e-06, 2.90076e-06, 2.89791e-06, 2.89799e-06, 2.89969e-06, 2.90447e-06, 2.9056e-06, 2.90202e-06, 2.90427e-06, 2.89505e-06], 0, 21.5607, 1652156166], "v": "v0.6"}
{"i": [["[\"te_slice\", 1, 14, 14, 512, [0, 1], 2, \"float16\"]", "cuda -keys=cuda,gpu -max_num_threads=1024 -model=unknown -thread_warp_size=32", [-1, 16, 64, 49152, 2147483647, 1024, 8, 32], "", 0, []], [[], [["FU", 1, [0, 1, 2, 3]], ["SP", 1, 0, 25088, [4], 1], ["AN", 1, 0, 5], ["AN", 1, 1, 6]]]], "r": [[7.21798e-06, 7.21817e-06, 7.21818e-06, 7.21815e-06, 7.21776e-06, 7.2184e-06, 7.21884e-06, 7.21797e-06, 7.21797e-06, 7.2181e-06], 0, 44.8194, 1652156190], "v": "v0.6"}
{"i": [["[\"te_slice\", 1, 14, 14, 512, [0, 1], 2, \"float16\"]", "cuda -keys=cuda,gpu -max_num_threads=1024 -model=unknown -thread_warp_size=32", [-1, 16, 64, 49152, 2147483647, 1024, 8, 32], "", 0, []], [[], [["FU", 1, [0, 1, 2, 3]], ["SP", 1, 0, 25088, [1], 1], ["AN", 1, 0, 5], ["AN", 1, 1, 6]]]], "r": [[2.14315e-05, 2.14314e-05, 2.14297e-05, 2.14315e-05, 2.14304e-05, 2.14298e-05, 2.1431e-05, 2.14305e-05, 2.14309e-05, 2.14309e-05], 0, 30.2816, 1652156175], "v": "v0.6"}
{"i": [["[\"te_slice\", 1, 14, 14, 512, [0, 1], 2, \"float16\"]", "cuda -keys=cuda,gpu -max_num_threads=1024 -model=unknown -thread_warp_size=32", [-1, 16, 64, 49152, 2147483647, 1024, 8, 32], "", 0, []], [[], [["FU", 1, [0, 1, 2, 3]], ["SP", 1, 0, 25088, [16], 1], ["AN", 1, 0, 5], ["AN", 1, 1, 6]]]], "r": [[3.84047e-06, 3.84063e-06, 3.84087e-06, 3.8404e-06, 3.8401e-06, 3.8408e-06, 3.84062e-06, 3.84053e-06, 3.84068e-06, 3.84103e-06], 0, 7.9321, 1652156153], "v": "v0.6"}
{"i": [["[\"te_slice\", 1, 14, 14, 512, [0, 1], 2, \"float16\"]", "cuda -keys=cuda,gpu -max_num_threads=1024 -model=unknown -thread_warp_size=32", [-1, 16, 64, 49152, 2147483647, 1024, 8, 32], "", 0, []], [[], [["FU", 1, [0, 1, 2, 3]], ["SP", 1, 0, 25088, [7], 1], ["AN", 1, 0, 5], ["AN", 1, 1, 6]]]], "r": [[5.46359e-06, 5.46333e-06, 5.46422e-06, 5.46491e-06, 5.46484e-06, 5.4646e-06, 5.46467e-06, 5.46395e-06, 5.46389e-06, 5.46421e-06], 0, 4.45628, 1652156149], "v": "v0.6"}
{"i": [["[\"te_slice\", 1, 14, 14, 512, [0, 1], 2, \"float16\"]", "cuda -keys=cuda,gpu -max_num_threads=1024 -model=unknown -thread_warp_size=32", [-1, 16, 64, 49152, 2147483647, 1024, 8, 32], "", 0, []], [[], [["FU", 1, [0, 1, 2, 3]], ["SP", 1, 0, 25088, [32], 1], ["AN", 1, 0, 5], ["AN", 1, 1, 6]]]], "r": [[3.05973e-06, 3.06031e-06, 3.06053e-06, 3.06027e-06, 3.06015e-06, 3.06032e-06, 3.06047e-06, 3.06025e-06, 3.06034e-06, 3.06048e-06], 0, 15.9983, 1652156161], "v": "v0.6"}
{"i": [["[\"te_slice\", 1, 14, 14, 512, [0, 1], 2, \"float16\"]", "cuda -keys=cuda,gpu -max_num_threads=1024 -model=unknown -thread_warp_size=32", [-1, 16, 64, 49152, 2147483647, 1024, 8, 32], "", 0, []], [[], [["FU", 1, [0, 1, 2, 3]], ["SP", 1, 0, 25088, [49], 1], ["AN", 1, 0, 5], ["AN", 1, 1, 6]]]], "r": [[2.89916e-06, 2.8993e-06, 2.89931e-06, 2.89931e-06, 2.89941e-06, 2.89912e-06, 2.89944e-06, 2.89942e-06, 2.89937e-06, 2.89932e-06], 0, 37.3455, 1652156182], "v": "v0.6"}
{"i": [["[\"te_slice\", 1, 14, 14, 512, [0, 1], 2, \"float16\"]", "cuda -keys=cuda,gpu -max_num_threads=1024 -model=unknown -thread_warp_size=32", [-1, 16, 64, 49152, 2147483647, 1024, 8, 32], "", 0, []], [[], [["FU", 1, [0, 1, 2, 3]], ["SP", 1, 0, 25088, [14], 1], ["AN", 1, 0, 5], ["AN", 1, 1, 6]]]], "r": [[3.99391e-06, 3.99382e-06, 3.99382e-06, 3.99393e-06, 3.99396e-06, 3.99332e-06, 3.99396e-06, 3.99386e-06, 3.99418e-06, 3.99419e-06], 0, 48.6634, 1652156194], "v": "v0.6"}
