python/models/swin_transformer/kernel_configs/swin_transformer_mul_1_56_56_128.log
{"i": [["[\"mul\", 1, 56, 56, 128]", "cuda -keys=cuda,gpu -max_num_threads=1024 -model=unknown -thread_warp_size=32", [-1, 16, 64, 49152, 2147483647, 1024, 8, 32], "", 0, []], [[], [["FU", 2, [0, 1, 2, 3]], ["SP", 2, 0, 401408, [7], 1], ["AN", 2, 0, 5], ["AN", 2, 1, 6]]]], "r": [[4.54133e-05, 4.53927e-05, 4.53926e-05], 0, 1.67766, 1668016970], "v": "v0.6"}
{"i": [["[\"mul\", 1, 56, 56, 128]", "cuda -keys=cuda,gpu -max_num_threads=1024 -model=unknown -thread_warp_size=32", [-1, 16, 64, 49152, 2147483647, 1024, 8, 32], "", 0, []], [[], [["FU", 2, [0, 1, 2, 3]], ["SP", 2, 0, 401408, [16], 1], ["AN", 2, 0, 5], ["AN", 2, 1, 6]]]], "r": [[2.14026e-05, 2.13989e-05, 2.13974e-05], 0, 0.610963, 1668016969], "v": "v0.6"}
{"i": [["[\"mul\", 1, 56, 56, 128]", "cuda -keys=cuda,gpu -max_num_threads=1024 -model=unknown -thread_warp_size=32", [-1, 16, 64, 49152, 2147483647, 1024, 8, 32], "", 0, []], [[], [["FU", 2, [0, 1, 2, 3]], ["SP", 2, 0, 401408, [28], 1], ["AN", 2, 0, 5], ["AN", 2, 1, 6]]]], "r": [[1.33359e-05, 1.3336e-05, 1.33397e-05], 0, 1.27539, 1668016970], "v": "v0.6"}
{"i": [["[\"mul\", 1, 56, 56, 128]", "cuda -keys=cuda,gpu -max_num_threads=1024 -model=unknown -thread_warp_size=32", [-1, 16, 64, 49152, 2147483647, 1024, 8, 32], "", 0, []], [[], [["FU", 2, [0, 1, 2, 3]], ["SP", 2, 0, 401408, [49], 1], ["AN", 2, 0, 5], ["AN", 2, 1, 6]]]], "r": [[8.67045e-06, 8.67282e-06, 8.67032e-06], 0, 0.94656, 1668016969], "v": "v0.6"}
{"i": [["[\"mul\", 1, 56, 56, 128]", "cuda -keys=cuda,gpu -max_num_threads=1024 -model=unknown -thread_warp_size=32", [-1, 16, 64, 49152, 2147483647, 1024, 8, 32], "", 0, []], [[], [["FU", 2, [0, 1, 2, 3]], ["SP", 2, 0, 401408, [32], 1], ["AN", 2, 0, 5], ["AN", 2, 1, 6]]]], "r": [[1.21428e-05, 1.21438e-05, 1.21515e-05], 0, 2.79265, 1668016971], "v": "v0.6"}
{"i": [["[\"mul\", 1, 56, 56, 128]", "cuda -keys=cuda,gpu -max_num_threads=1024 -model=unknown -thread_warp_size=32", [-1, 16, 64, 49152, 2147483647, 1024, 8, 32], "", 0, []], [[], [["FU", 2, [0, 1, 2, 3]], ["SP", 2, 0, 401408, [2], 1], ["AN", 2, 0, 5], ["AN", 2, 1, 6]]]], "r": [[0.000151602, 0.000151593, 0.000151621], 0, 2.38736, 1668016971], "v": "v0.6"}
{"i": [["[\"mul\", 1, 56, 56, 128]", "cuda -keys=cuda,gpu -max_num_threads=1024 -model=unknown -thread_warp_size=32", [-1, 16, 64, 49152, 2147483647, 1024, 8, 32], "", 0, []], [[], [["FU", 2, [0, 1, 2, 3]], ["SP", 2, 0, 401408, [14], 1], ["AN", 2, 0, 5], ["AN", 2, 1, 6]]]], "r": [[2.40185e-05, 2.40118e-05, 2.40144e-05], 0, 2.03997, 1668016971], "v": "v0.6"}
{"i": [["[\"mul\", 1, 56, 56, 128]", "cuda -keys=cuda,gpu -max_num_threads=1024 -model=unknown -thread_warp_size=32", [-1, 16, 64, 49152, 2147483647, 1024, 8, 32], "", 0, []], [[], [["FU", 2, [0, 1, 2, 3]], ["SP", 2, 0, 401408, [56], 1], ["AN", 2, 0, 5], ["AN", 2, 1, 6]]]], "r": [[7.92612e-06, 7.93041e-06, 7.93131e-06], 0, 3.49764, 1668016972], "v": "v0.6"}
{"i": [["[\"mul\", 1, 56, 56, 128]", "cuda -keys=cuda,gpu -max_num_threads=1024 -model=unknown -thread_warp_size=32", [-1, 16, 64, 49152, 2147483647, 1024, 8, 32], "", 0, []], [[], [["FU", 2, [0, 1, 2, 3]], ["SP", 2, 0, 401408, [1], 1], ["AN", 2, 0, 5], ["AN", 2, 1, 6]]]], "r": [[0.000300504, 0.000300501, 0.000300547], 0, 3.15059, 1668016972], "v": "v0.6"}
{"i": [["[\"mul\", 1, 56, 56, 128]", "cuda -keys=cuda,gpu -max_num_threads=1024 -model=unknown -thread_warp_size=32", [-1, 16, 64, 49152, 2147483647, 1024, 8, 32], "", 0, []], [[], [["FU", 2, [0, 1, 2, 3]], ["SP", 2, 0, 401408, [8], 1], ["AN", 2, 0, 5], ["AN", 2, 1, 6]]]], "r": [[3.98655e-05, 3.98751e-05, 3.98669e-05], 0, 3.88885, 1668016972], "v": "v0.6"}
{"i": [["[\"mul\", 1, 56, 56, 128]", "cuda -keys=cuda,gpu -max_num_threads=1024 -model=unknown -thread_warp_size=32", [-1, 16, 64, 49152, 2147483647, 1024, 8, 32], "", 0, []], [[], [["FU", 2, [0, 1, 2, 3]], ["SP", 2, 0, 401408, [64], 1], ["AN", 2, 0, 5], ["AN", 2, 1, 6]]]], "r": [[7.32637e-06, 7.3242e-06, 7.32508e-06], 0, 4.58589, 1668016973], "v": "v0.6"}
{"i": [["[\"mul\", 1, 56, 56, 128]", "cuda -keys=cuda,gpu -max_num_threads=1024 -model=unknown -thread_warp_size=32", [-1, 16, 64, 49152, 2147483647, 1024, 8, 32], "", 0, []], [[], [["FU", 2, [0, 1, 2, 3]], ["SP", 2, 0, 401408, [4], 1], ["AN", 2, 0, 5], ["AN", 2, 1, 6]]]], "r": [[7.71634e-05, 7.7175e-05, 7.71673e-05], 0, 4.22693, 1668016973], "v": "v0.6"}
{"i": [["[\"mul\", 1, 56, 56, 128]", "cuda -keys=cuda,gpu -max_num_threads=1024 -model=unknown -thread_warp_size=32", [-1, 16, 64, 49152, 2147483647, 1024, 8, 32], "", 0, []], [[], [["FU", 2, [0, 1, 2, 3]], ["SP", 2, 0, 401408, [16], 1], ["AN", 2, 0, 5], ["AN", 2, 1, 6]]]], "r": [[2.13953e-05, 2.13944e-05, 2.13953e-05], 0, 1.23401, 1668017297], "v": "v0.6"}
{"i": [["[\"mul\", 1, 56, 56, 128]", "cuda -keys=cuda,gpu -max_num_threads=1024 -model=unknown -thread_warp_size=32", [-1, 16, 64, 49152, 2147483647, 1024, 8, 32], "", 0, []], [[], [["FU", 2, [0, 1, 2, 3]], ["SP", 2, 0, 401408, [14], 1], ["AN", 2, 0, 5], ["AN", 2, 1, 6]]]], "r": [[2.40427e-05, 2.40489e-05, 2.40457e-05], 0, 0.90284, 1668017296], "v": "v0.6"}
{"i": [["[\"mul\", 1, 56, 56, 128]", "cuda -keys=cuda,gpu -max_num_threads=1024 -model=unknown -thread_warp_size=32", [-1, 16, 64, 49152, 2147483647, 1024, 8, 32], "", 0, []], [[], [["FU", 2, [0, 1, 2, 3]], ["SP", 2, 0, 401408, [28], 1], ["AN", 2, 0, 5], ["AN", 2, 1, 6]]]], "r": [[1.33419e-05, 1.33394e-05, 1.33346e-05], 0, 1.53955, 1668017297], "v": "v0.6"}
{"i": [["[\"mul\", 1, 56, 56, 128]", "cuda -keys=cuda,gpu -max_num_threads=1024 -model=unknown -thread_warp_size=32", [-1, 16, 64, 49152, 2147483647, 1024, 8, 32], "", 0, []], [[], [["FU", 2, [0, 1, 2, 3]], ["SP", 2, 0, 401408, [2], 1], ["AN", 2, 0, 5], ["AN", 2, 1, 6]]]], "r": [[0.000151551, 0.00015155, 0.000151524], 0, 0.532602, 1668017296], "v": "v0.6"}
{"i": [["[\"mul\", 1, 56, 56, 128]", "cuda -keys=cuda,gpu -max_num_threads=1024 -model=unknown -thread_warp_size=32", [-1, 16, 64, 49152, 2147483647, 1024, 8, 32], "", 0, []], [[], [["FU", 2, [0, 1, 2, 3]], ["SP", 2, 0, 401408, [4], 1], ["AN", 2, 0, 5], ["AN", 2, 1, 6]]]], "r": [[7.72156e-05, 7.72125e-05, 7.72345e-05], 0, 1.91487, 1668017297], "v": "v0.6"}
{"i": [["[\"mul\", 1, 56, 56, 128]", "cuda -keys=cuda,gpu -max_num_threads=1024 -model=unknown -thread_warp_size=32", [-1, 16, 64, 49152, 2147483647, 1024, 8, 32], "", 0, []], [[], [["FU", 2, [0, 1, 2, 3]], ["SP", 2, 0, 401408, [56], 1], ["AN", 2, 0, 5], ["AN", 2, 1, 6]]]], "r": [[7.94374e-06, 7.94342e-06, 7.94303e-06], 0, 2.24173, 1668017298], "v": "v0.6"}
{"i": [["[\"mul\", 1, 56, 56, 128]", "cuda -keys=cuda,gpu -max_num_threads=1024 -model=unknown -thread_warp_size=32", [-1, 16, 64, 49152, 2147483647, 1024, 8, 32], "", 0, []], [[], [["FU", 2, [0, 1, 2, 3]], ["SP", 2, 0, 401408, [8], 1], ["AN", 2, 0, 5], ["AN", 2, 1, 6]]]], "r": [[3.9854e-05, 3.98495e-05, 3.9838e-05], 0, 2.94713, 1668017298], "v": "v0.6"}
{"i": [["[\"mul\", 1, 56, 56, 128]", "cuda -keys=cuda,gpu -max_num_threads=1024 -model=unknown -thread_warp_size=32", [-1, 16, 64, 49152, 2147483647, 1024, 8, 32], "", 0, []], [[], [["FU", 2, [0, 1, 2, 3]], ["SP", 2, 0, 401408, [49], 1], ["AN", 2, 0, 5], ["AN", 2, 1, 6]]]], "r": [[8.74596e-06, 8.74342e-06, 8.7456e-06], 0, 3.95415, 1668017299], "v": "v0.6"}
{"i": [["[\"mul\", 1, 56, 56, 128]", "cuda -keys=cuda,gpu -max_num_threads=1024 -model=unknown -thread_warp_size=32", [-1, 16, 64, 49152, 2147483647, 1024, 8, 32], "", 0, []], [[], [["FU", 2, [0, 1, 2, 3]], ["SP", 2, 0, 401408, [7], 1], ["AN", 2, 0, 5], ["AN", 2, 1, 6]]]], "r": [[4.53926e-05, 4.53802e-05, 4.53949e-05], 0, 2.57422, 1668017298], "v": "v0.6"}
{"i": [["[\"mul\", 1, 56, 56, 128]", "cuda -keys=cuda,gpu -max_num_threads=1024 -model=unknown -thread_warp_size=32", [-1, 16, 64, 49152, 2147483647, 1024, 8, 32], "", 0, []], [[], [["FU", 2, [0, 1, 2, 3]], ["SP", 2, 0, 401408, [32], 1], ["AN", 2, 0, 5], ["AN", 2, 1, 6]]]], "r": [[1.22058e-05, 1.22068e-05, 1.22108e-05], 0, 3.27554, 1668017299], "v": "v0.6"}
{"i": [["[\"mul\", 1, 56, 56, 128]", "cuda -keys=cuda,gpu -max_num_threads=1024 -model=unknown -thread_warp_size=32", [-1, 16, 64, 49152, 2147483647, 1024, 8, 32], "", 0, []], [[], [["FU", 2, [0, 1, 2, 3]], ["SP", 2, 0, 401408, [64], 1], ["AN", 2, 0, 5], ["AN", 2, 1, 6]]]], "r": [[7.16675e-06, 7.16524e-06, 7.16414e-06], 0, 4.27582, 1668017300], "v": "v0.6"}
{"i": [["[\"mul\", 1, 56, 56, 128]", "cuda -keys=cuda,gpu -max_num_threads=1024 -model=unknown -thread_warp_size=32", [-1, 16, 64, 49152, 2147483647, 1024, 8, 32], "", 0, []], [[], [["FU", 2, [0, 1, 2, 3]], ["SP", 2, 0, 401408, [1], 1], ["AN", 2, 0, 5], ["AN", 2, 1, 6]]]], "r": [[0.000300548, 0.000300555, 0.000300437], 0, 3.57524, 1668017299], "v": "v0.6"}
{"i": [["[\"mul\", 1, 56, 56, 128]", "cuda -keys=cuda,gpu -max_num_threads=1024 -model=unknown -thread_warp_size=32", [-1, 16, 64, 49152, 2147483647, 1024, 8, 32], "", 0, []], [[], [["FU", 2, [0, 1, 2, 3]], ["SP", 2, 0, 401408, [4], 1], ["AN", 2, 0, 5], ["AN", 2, 1, 6]]]], "r": [[7.72482e-05, 7.72506e-05, 7.72405e-05], 0, 2.01692, 1668045903], "v": "v0.6"}
{"i": [["[\"mul\", 1, 56, 56, 128]", "cuda -keys=cuda,gpu -max_num_threads=1024 -model=unknown -thread_warp_size=32", [-1, 16, 64, 49152, 2147483647, 1024, 8, 32], "", 0, []], [[], [["FU", 2, [0, 1, 2, 3]], ["SP", 2, 0, 401408, [56], 1], ["AN", 2, 0, 5], ["AN", 2, 1, 6]]]], "r": [[7.92313e-06, 7.92531e-06, 7.92537e-06], 0, 1.28477, 1668045902], "v": "v0.6"}
{"i": [["[\"mul\", 1, 56, 56, 128]", "cuda -keys=cuda,gpu -max_num_threads=1024 -model=unknown -thread_warp_size=32", [-1, 16, 64, 49152, 2147483647, 1024, 8, 32], "", 0, []], [[], [["FU", 2, [0, 1, 2, 3]], ["SP", 2, 0, 401408, [64], 1], ["AN", 2, 0, 5], ["AN", 2, 1, 6]]]], "r": [[7.24798e-06, 7.24502e-06, 7.25385e-06], 0, 2.70189, 1668045903], "v": "v0.6"}
{"i": [["[\"mul\", 1, 56, 56, 128]", "cuda -keys=cuda,gpu -max_num_threads=1024 -model=unknown -thread_warp_size=32", [-1, 16, 64, 49152, 2147483647, 1024, 8, 32], "", 0, []], [[], [["FU", 2, [0, 1, 2, 3]], ["SP", 2, 0, 401408, [14], 1], ["AN", 2, 0, 5], ["AN", 2, 1, 6]]]], "r": [[2.40388e-05, 2.40384e-05, 2.40339e-05], 0, 0.559255, 1668045901], "v": "v0.6"}
{"i": [["[\"mul\", 1, 56, 56, 128]", "cuda -keys=cuda,gpu -max_num_threads=1024 -model=unknown -thread_warp_size=32", [-1, 16, 64, 49152, 2147483647, 1024, 8, 32], "", 0, []], [[], [["FU", 2, [0, 1, 2, 3]], ["SP", 2, 0, 401408, [2], 1], ["AN", 2, 0, 5], ["AN", 2, 1, 6]]]], "r": [[0.000151628, 0.000151641, 0.00015166], 0, 1.61789, 1668045902], "v": "v0.6"}
{"i": [["[\"mul\", 1, 56, 56, 128]", "cuda -keys=cuda,gpu -max_num_threads=1024 -model=unknown -thread_warp_size=32", [-1, 16, 64, 49152, 2147483647, 1024, 8, 32], "", 0, []], [[], [["FU", 2, [0, 1, 2, 3]], ["SP", 2, 0, 401408, [1], 1], ["AN", 2, 0, 5], ["AN", 2, 1, 6]]]], "r": [[0.000300513, 0.000300504, 0.000300501], 0, 0.934936, 1668045901], "v": "v0.6"}
{"i": [["[\"mul\", 1, 56, 56, 128]", "cuda -keys=cuda,gpu -max_num_threads=1024 -model=unknown -thread_warp_size=32", [-1, 16, 64, 49152, 2147483647, 1024, 8, 32], "", 0, []], [[], [["FU", 2, [0, 1, 2, 3]], ["SP", 2, 0, 401408, [8], 1], ["AN", 2, 0, 5], ["AN", 2, 1, 6]]]], "r": [[3.98707e-05, 3.98716e-05, 3.98672e-05], 0, 2.372, 1668045903], "v": "v0.6"}
{"i": [["[\"mul\", 1, 56, 56, 128]", "cuda -keys=cuda,gpu -max_num_threads=1024 -model=unknown -thread_warp_size=32", [-1, 16, 64, 49152, 2147483647, 1024, 8, 32], "", 0, []], [[], [["FU", 2, [0, 1, 2, 3]], ["SP", 2, 0, 401408, [28], 1], ["AN", 2, 0, 5], ["AN", 2, 1, 6]]]], "r": [[1.34063e-05, 1.34055e-05, 1.34e-05], 0, 3.09471, 1668045904], "v": "v0.6"}
{"i": [["[\"mul\", 1, 56, 56, 128]", "cuda -keys=cuda,gpu -max_num_threads=1024 -model=unknown -thread_warp_size=32", [-1, 16, 64, 49152, 2147483647, 1024, 8, 32], "", 0, []], [[], [["FU", 2, [0, 1, 2, 3]], ["SP", 2, 0, 401408, [32], 1], ["AN", 2, 0, 5], ["AN", 2, 1, 6]]]], "r": [[1.21682e-05, 1.2166e-05, 1.21615e-05], 0, 3.42619, 1668045904], "v": "v0.6"}
{"i": [["[\"mul\", 1, 56, 56, 128]", "cuda -keys=cuda,gpu -max_num_threads=1024 -model=unknown -thread_warp_size=32", [-1, 16, 64, 49152, 2147483647, 1024, 8, 32], "", 0, []], [[], [["FU", 2, [0, 1, 2, 3]], ["SP", 2, 0, 401408, [7], 1], ["AN", 2, 0, 5], ["AN", 2, 1, 6]]]], "r": [[4.51923e-05, 4.51993e-05, 4.51946e-05], 0, 3.75913, 1668045904], "v": "v0.6"}
{"i": [["[\"mul\", 1, 56, 56, 128]", "cuda -keys=cuda,gpu -max_num_threads=1024 -model=unknown -thread_warp_size=32", [-1, 16, 64, 49152, 2147483647, 1024, 8, 32], "", 0, []], [[], [["FU", 2, [0, 1, 2, 3]], ["SP", 2, 0, 401408, [49], 1], ["AN", 2, 0, 5], ["AN", 2, 1, 6]]]], "r": [[8.71441e-06, 8.70867e-06, 8.70532e-06], 0, 4.49415, 1668045905], "v": "v0.6"}
{"i": [["[\"mul\", 1, 56, 56, 128]", "cuda -keys=cuda,gpu -max_num_threads=1024 -model=unknown -thread_warp_size=32", [-1, 16, 64, 49152, 2147483647, 1024, 8, 32], "", 0, []], [[], [["FU", 2, [0, 1, 2, 3]], ["SP", 2, 0, 401408, [16], 1], ["AN", 2, 0, 5], ["AN", 2, 1, 6]]]], "r": [[2.13637e-05, 2.13623e-05, 2.13635e-05], 0, 4.14935, 1668045905], "v": "v0.6"}
{"i": [["[\"mul\", 1, 56, 56, 128]", "cuda -keys=cuda,gpu -max_num_threads=1024 -model=unknown -thread_warp_size=32", [-1, 16, 64, 49152, 2147483647, 1024, 8, 32], "", 0, []], [[], [["FU", 2, [0, 1, 2, 3]], ["SP", 2, 0, 401408, [2], 1], ["AN", 2, 0, 5], ["AN", 2, 1, 6]]]], "r": [[0.000151594, 0.000151608, 0.000151631], 0, 0.60441, 1668048167], "v": "v0.6"}
{"i": [["[\"mul\", 1, 56, 56, 128]", "cuda -keys=cuda,gpu -max_num_threads=1024 -model=unknown -thread_warp_size=32", [-1, 16, 64, 49152, 2147483647, 1024, 8, 32], "", 0, []], [[], [["FU", 2, [0, 1, 2, 3]], ["SP", 2, 0, 401408, [28], 1], ["AN", 2, 0, 5], ["AN", 2, 1, 6]]]], "r": [[1.33789e-05, 1.3377e-05, 1.33772e-05], 0, 4.1307, 1668048171], "v": "v0.6"}
{"i": [["[\"mul\", 1, 56, 56, 128]", "cuda -keys=cuda,gpu -max_num_threads=1024 -model=unknown -thread_warp_size=32", [-1, 16, 64, 49152, 2147483647, 1024, 8, 32], "", 0, []], [[], [["FU", 2, [0, 1, 2, 3]], ["SP", 2, 0, 401408, [1], 1], ["AN", 2, 0, 5], ["AN", 2, 1, 6]]]], "r": [[0.000300442, 0.000300474, 0.000300418], 0, 0.908005, 1668048168], "v": "v0.6"}
{"i": [["[\"mul\", 1, 56, 56, 128]", "cuda -keys=cuda,gpu -max_num_threads=1024 -model=unknown -thread_warp_size=32", [-1, 16, 64, 49152, 2147483647, 1024, 8, 32], "", 0, []], [[], [["FU", 2, [0, 1, 2, 3]], ["SP", 2, 0, 401408, [16], 1], ["AN", 2, 0, 5], ["AN", 2, 1, 6]]]], "r": [[2.14389e-05, 2.14315e-05, 2.14335e-05], 0, 1.21801, 1668048168], "v": "v0.6"}
{"i": [["[\"mul\", 1, 56, 56, 128]", "cuda -keys=cuda,gpu -max_num_threads=1024 -model=unknown -thread_warp_size=32", [-1, 16, 64, 49152, 2147483647, 1024, 8, 32], "", 0, []], [[], [["FU", 2, [0, 1, 2, 3]], ["SP", 2, 0, 401408, [7], 1], ["AN", 2, 0, 5], ["AN", 2, 1, 6]]]], "r": [[4.52419e-05, 4.52413e-05, 4.52404e-05], 0, 1.95774, 1668048169], "v": "v0.6"}
{"i": [["[\"mul\", 1, 56, 56, 128]", "cuda -keys=cuda,gpu -max_num_threads=1024 -model=unknown -thread_warp_size=32", [-1, 16, 64, 49152, 2147483647, 1024, 8, 32], "", 0, []], [[], [["FU", 2, [0, 1, 2, 3]], ["SP", 2, 0, 401408, [49], 1], ["AN", 2, 0, 5], ["AN", 2, 1, 6]]]], "r": [[8.69223e-06, 8.69481e-06, 8.68897e-06], 0, 2.71344, 1668048169], "v": "v0.6"}
{"i": [["[\"mul\", 1, 56, 56, 128]", "cuda -keys=cuda,gpu -max_num_threads=1024 -model=unknown -thread_warp_size=32", [-1, 16, 64, 49152, 2147483647, 1024, 8, 32], "", 0, []], [[], [["FU", 2, [0, 1, 2, 3]], ["SP", 2, 0, 401408, [64], 1], ["AN", 2, 0, 5], ["AN", 2, 1, 6]]]], "r": [[7.20842e-06, 7.20843e-06, 7.20684e-06], 0, 2.2963, 1668048169], "v": "v0.6"}
{"i": [["[\"mul\", 1, 56, 56, 128]", "cuda -keys=cuda,gpu -max_num_threads=1024 -model=unknown -thread_warp_size=32", [-1, 16, 64, 49152, 2147483647, 1024, 8, 32], "", 0, []], [[], [["FU", 2, [0, 1, 2, 3]], ["SP", 2, 0, 401408, [8], 1], ["AN", 2, 0, 5], ["AN", 2, 1, 6]]]], "r": [[3.99817e-05, 3.99812e-05, 3.99652e-05], 0, 3.39169, 1668048170], "v": "v0.6"}
{"i": [["[\"mul\", 1, 56, 56, 128]", "cuda -keys=cuda,gpu -max_num_threads=1024 -model=unknown -thread_warp_size=32", [-1, 16, 64, 49152, 2147483647, 1024, 8, 32], "", 0, []], [[], [["FU", 2, [0, 1, 2, 3]], ["SP", 2, 0, 401408, [14], 1], ["AN", 2, 0, 5], ["AN", 2, 1, 6]]]], "r": [[2.4008e-05, 2.40095e-05, 2.40022e-05], 0, 1.59055, 1668048168], "v": "v0.6"}
{"i": [["[\"mul\", 1, 56, 56, 128]", "cuda -keys=cuda,gpu -max_num_threads=1024 -model=unknown -thread_warp_size=32", [-1, 16, 64, 49152, 2147483647, 1024, 8, 32], "", 0, []], [[], [["FU", 2, [0, 1, 2, 3]], ["SP", 2, 0, 401408, [4], 1], ["AN", 2, 0, 5], ["AN", 2, 1, 6]]]], "r": [[7.71547e-05, 7.71917e-05, 7.71665e-05], 0, 3.76968, 1668048171], "v": "v0.6"}
{"i": [["[\"mul\", 1, 56, 56, 128]", "cuda -keys=cuda,gpu -max_num_threads=1024 -model=unknown -thread_warp_size=32", [-1, 16, 64, 49152, 2147483647, 1024, 8, 32], "", 0, []], [[], [["FU", 2, [0, 1, 2, 3]], ["SP", 2, 0, 401408, [32], 1], ["AN", 2, 0, 5], ["AN", 2, 1, 6]]]], "r": [[1.21042e-05, 1.21036e-05, 1.20991e-05], 0, 3.00533, 1668048170], "v": "v0.6"}
{"i": [["[\"mul\", 1, 56, 56, 128]", "cuda -keys=cuda,gpu -max_num_threads=1024 -model=unknown -thread_warp_size=32", [-1, 16, 64, 49152, 2147483647, 1024, 8, 32], "", 0, []], [[], [["FU", 2, [0, 1, 2, 3]], ["SP", 2, 0, 401408, [56], 1], ["AN", 2, 0, 5], ["AN", 2, 1, 6]]]], "r": [[7.94358e-06, 7.94437e-06, 7.95368e-06], 0, 4.41832, 1668048171], "v": "v0.6"}
