python/models/swin_transformer/kernel_configs/swin_transformer_fused_patch_merging_reshape_reduce_sum_1_14_14_512_float16.log
{"i": [["[\"fused_patch_merging_reshape_reduce_sum\", 1, 14, 14, 512, \"float16\"]", "cuda -keys=cuda,gpu -max_num_threads=1024 -model=unknown -thread_warp_size=32", [-1, 16, 64, 49152, 2147483647, 1024, 8, 32], "", 0, []], [[], [["SP", 2, 1, 2048, [64], 1], ["AN", 2, 2, 6], ["CI", 1], ["AN", 2, 0, 5], ["PR", 2, 0, "auto_unroll_max_step$1024"]]]], "r": [[3.34154e-06, 3.34409e-06, 3.34619e-06, 3.34594e-06, 3.34585e-06, 3.34481e-06, 3.3464e-06, 3.34679e-06, 3.34429e-06, 3.34339e-06], 0, 13.1431, 1651593003], "v": "v0.6"}
{"i": [["[\"fused_patch_merging_reshape_reduce_sum\", 1, 14, 14, 512, \"float16\"]", "cuda -keys=cuda,gpu -max_num_threads=1024 -model=unknown -thread_warp_size=32", [-1, 16, 64, 49152, 2147483647, 1024, 8, 32], "", 0, []], [[], [["SP", 2, 1, 2048, [1], 1], ["AN", 2, 2, 6], ["CI", 1], ["AN", 2, 0, 5], ["PR", 2, 0, "auto_unroll_max_step$64"]]]], "r": [[5.25864e-05, 3.7317e-05, 3.72939e-05, 3.73246e-05, 3.73411e-05, 3.73419e-05, 3.72997e-05, 3.7301e-05, 3.73204e-05, 3.72469e-05], 0, 2.23188, 1651592992], "v": "v0.6"}
{"i": [["[\"fused_patch_merging_reshape_reduce_sum\", 1, 14, 14, 512, \"float16\"]", "cuda -keys=cuda,gpu -max_num_threads=1024 -model=unknown -thread_warp_size=32", [-1, 16, 64, 49152, 2147483647, 1024, 8, 32], "", 0, []], [[], [["CI", 1], ["SP", 2, 0, 49, [1], 1], ["AN", 2, 0, 5], ["AN", 2, 1, 6], ["PR", 2, 0, "auto_unroll_max_step$1024"]]]], "r": [[4.01149e-05, 3.98103e-05, 3.99469e-05, 3.97387e-05, 3.96199e-05, 3.95923e-05, 4.01954e-05, 4.04122e-05, 4.0135e-05, 4.02607e-05], 0, 18.5734, 1651593008], "v": "v0.6"}
{"i": [["[\"fused_patch_merging_reshape_reduce_sum\", 1, 14, 14, 512, \"float16\"]", "cuda -keys=cuda,gpu -max_num_threads=1024 -model=unknown -thread_warp_size=32", [-1, 16, 64, 49152, 2147483647, 1024, 8, 32], "", 0, []], [[], [["CI", 1], ["SP", 2, 0, 49, [48], 1], ["AN", 2, 0, 5], ["AN", 2, 1, 6], ["PR", 2, 0, "auto_unroll_max_step$0"]]]], "r": [[0.000181823, 0.000181762, 0.000181817, 0.000181869, 0.000181845, 0.000181893, 0.00018191, 0.000181901, 0.000181881, 0.000181853], 0, 6.12253, 1651592996], "v": "v0.6"}
{"i": [["[\"fused_patch_merging_reshape_reduce_sum\", 1, 14, 14, 512, \"float16\"]", "cuda -keys=cuda,gpu -max_num_threads=1024 -model=unknown -thread_warp_size=32", [-1, 16, 64, 49152, 2147483647, 1024, 8, 32], "", 0, []], [[], [["CI", 1], ["SP", 2, 0, 49, [32], 1], ["AN", 2, 0, 5], ["AN", 2, 1, 6], ["PR", 2, 0, "auto_unroll_max_step$16"]]]], "r": [[0.000172215, 0.000172237, 0.000172234, 0.000172236, 0.00017223, 0.000172234, 0.00017223, 0.000172226, 0.00017223, 0.000172229], 0, 4.15841, 1651592994], "v": "v0.6"}
{"i": [["[\"fused_patch_merging_reshape_reduce_sum\", 1, 14, 14, 512, \"float16\"]", "cuda -keys=cuda,gpu -max_num_threads=1024 -model=unknown -thread_warp_size=32", [-1, 16, 64, 49152, 2147483647, 1024, 8, 32], "", 0, []], [[], [["SP", 2, 1, 2048, [16], 1], ["AN", 2, 2, 6], ["CI", 1], ["AN", 2, 0, 5], ["PR", 2, 0, "auto_unroll_max_step$1024"]]]], "r": [[6.88308e-06, 6.88293e-06, 6.88285e-06, 6.88293e-06, 6.88283e-06, 6.88298e-06, 6.88278e-06, 6.88287e-06, 6.88283e-06, 6.88291e-06], 0, 16.6731, 1651593006], "v": "v0.6"}
{"i": [["[\"fused_patch_merging_reshape_reduce_sum\", 1, 14, 14, 512, \"float16\"]", "cuda -keys=cuda,gpu -max_num_threads=1024 -model=unknown -thread_warp_size=32", [-1, 16, 64, 49152, 2147483647, 1024, 8, 32], "", 0, []], [[], [["CI", 1], ["SP", 2, 0, 49, [8], 1], ["AN", 2, 0, 5], ["AN", 2, 1, 6], ["PR", 2, 0, "auto_unroll_max_step$16"]]]], "r": [[0.000108834, 0.00010878, 0.000108793, 0.000108786, 0.000108784, 0.000108789, 0.000108774, 0.000108791, 0.000108839, 0.000108796], 0, 10.0627, 1651593000], "v": "v0.6"}
{"i": [["[\"fused_patch_merging_reshape_reduce_sum\", 1, 14, 14, 512, \"float16\"]", "cuda -keys=cuda,gpu -max_num_threads=1024 -model=unknown -thread_warp_size=32", [-1, 16, 64, 49152, 2147483647, 1024, 8, 32], "", 0, []], [[], [["SP", 2, 1, 2048, [8], 1], ["AN", 2, 2, 6], ["CI", 1], ["AN", 2, 0, 5], ["PR", 2, 0, "auto_unroll_max_step$1024"]]]], "r": [[1.09202e-05, 1.09271e-05, 1.09314e-05, 1.09339e-05, 1.09255e-05, 1.09181e-05, 1.08833e-05, 1.09148e-05, 1.09134e-05, 1.0922e-05], 0, 11.7975, 1651593002], "v": "v0.6"}
{"i": [["[\"fused_patch_merging_reshape_reduce_sum\", 1, 14, 14, 512, \"float16\"]", "cuda -keys=cuda,gpu -max_num_threads=1024 -model=unknown -thread_warp_size=32", [-1, 16, 64, 49152, 2147483647, 1024, 8, 32], "", 0, []], [[], [["CI", 1], ["SP", 2, 0, 49, [12], 1], ["AN", 2, 0, 5], ["AN", 2, 1, 6], ["PR", 2, 0, "auto_unroll_max_step$64"]]]], "r": [[0.000118583, 0.000118589, 0.000118583, 0.000118595, 0.000118598, 0.000118601, 0.000118595, 0.000118598, 0.000118558, 0.000118549], 0, 8.19033, 1651592998], "v": "v0.6"}
{"i": [["[\"fused_patch_merging_reshape_reduce_sum\", 1, 14, 14, 512, \"float16\"]", "cuda -keys=cuda,gpu -max_num_threads=1024 -model=unknown -thread_warp_size=32", [-1, 16, 64, 49152, 2147483647, 1024, 8, 32], "", 0, []], [[], [["CI", 1], ["SP", 2, 0, 49, [2], 1], ["AN", 2, 0, 5], ["AN", 2, 1, 6], ["PR", 2, 0, "auto_unroll_max_step$512"]]]], "r": [[0.000185443, 0.000185431, 0.000185451, 0.00018545, 0.000185454, 0.00018552, 0.000185472, 0.000185466, 0.000185467, 0.000185486], 0, 15.0608, 1651593005], "v": "v0.6"}
{"i": [["[\"fused_patch_merging_reshape_reduce_sum\", 1, 14, 14, 512, \"float16\"]", "cuda -keys=cuda,gpu -max_num_threads=1024 -model=unknown -thread_warp_size=32", [-1, 16, 64, 49152, 2147483647, 1024, 8, 32], "", 0, []], [[], [["SP", 2, 1, 2048, [16], 1], ["AN", 2, 2, 6], ["CI", 1], ["AN", 2, 0, 5], ["PR", 2, 0, "auto_unroll_max_step$64"]]]], "r": [[7.01349e-06, 6.97786e-06, 6.97876e-06, 6.98453e-06, 6.99067e-06, 6.97095e-06, 6.99787e-06, 6.99097e-06, 7.01556e-06, 6.99725e-06], 0, 25.3668, 1651593015], "v": "v0.6"}
{"i": [["[\"fused_patch_merging_reshape_reduce_sum\", 1, 14, 14, 512, \"float16\"]", "cuda -keys=cuda,gpu -max_num_threads=1024 -model=unknown -thread_warp_size=32", [-1, 16, 64, 49152, 2147483647, 1024, 8, 32], "", 0, []], [[], [["CI", 1], ["SP", 2, 0, 49, [4], 1], ["AN", 2, 0, 5], ["AN", 2, 1, 6], ["PR", 2, 0, "auto_unroll_max_step$16"]]]], "r": [[0.0001657, 0.000165502, 0.000164513, 0.000163878, 0.000164, 0.00016501, 0.000165516, 0.000165515, 0.000165665, 0.000165692], 0, 27.1902, 1651593017], "v": "v0.6"}
{"i": [["[\"fused_patch_merging_reshape_reduce_sum\", 1, 14, 14, 512, \"float16\"]", "cuda -keys=cuda,gpu -max_num_threads=1024 -model=unknown -thread_warp_size=32", [-1, 16, 64, 49152, 2147483647, 1024, 8, 32], "", 0, []], [[], [["CI", 1], ["SP", 2, 0, 49, [8], 1], ["AN", 2, 0, 5], ["AN", 2, 1, 6], ["PR", 2, 0, "auto_unroll_max_step$512"]]]], "r": [[0.000108808, 0.000108807, 0.000108798, 0.000108768, 0.000108765, 0.000108776, 0.000108789, 0.000108795, 0.00010879, 0.000108791], 0, 31.0551, 1651593021], "v": "v0.6"}
{"i": [["[\"fused_patch_merging_reshape_reduce_sum\", 1, 14, 14, 512, \"float16\"]", "cuda -keys=cuda,gpu -max_num_threads=1024 -model=unknown -thread_warp_size=32", [-1, 16, 64, 49152, 2147483647, 1024, 8, 32], "", 0, []], [[], [["SP", 2, 1, 2048, [16], 1], ["AN", 2, 2, 6], ["CI", 1], ["AN", 2, 0, 5], ["PR", 2, 0, "auto_unroll_max_step$16"]]]], "r": [[6.95424e-06, 6.95769e-06, 6.95727e-06, 6.95975e-06, 6.95904e-06, 6.95352e-06, 6.95893e-06, 6.95766e-06, 6.94829e-06, 6.95337e-06], 0, 20.0736, 1651593010], "v": "v0.6"}
{"i": [["[\"fused_patch_merging_reshape_reduce_sum\", 1, 14, 14, 512, \"float16\"]", "cuda -keys=cuda,gpu -max_num_threads=1024 -model=unknown -thread_warp_size=32", [-1, 16, 64, 49152, 2147483647, 1024, 8, 32], "", 0, []], [[], [["CI", 1], ["SP", 2, 0, 49, [8], 1], ["AN", 2, 0, 5], ["AN", 2, 1, 6], ["PR", 2, 0, "auto_unroll_max_step$0"]]]], "r": [[0.00010884, 0.000108793, 0.000108785, 0.000108789, 0.000108787, 0.000108792, 0.000108789, 0.000108793, 0.000108788, 0.000108791], 0, 21.9314, 1651593012], "v": "v0.6"}
{"i": [["[\"fused_patch_merging_reshape_reduce_sum\", 1, 14, 14, 512, \"float16\"]", "cuda -keys=cuda,gpu -max_num_threads=1024 -model=unknown -thread_warp_size=32", [-1, 16, 64, 49152, 2147483647, 1024, 8, 32], "", 0, []], [[], [["SP", 2, 1, 2048, [64], 1], ["AN", 2, 2, 6], ["CI", 1], ["AN", 2, 0, 5], ["PR", 2, 0, "auto_unroll_max_step$64"]]]], "r": [[3.40862e-06, 3.40848e-06, 3.40837e-06, 3.40854e-06, 3.40822e-06, 3.40824e-06, 3.4087e-06, 3.40859e-06, 3.40851e-06, 3.40846e-06], 0, 33.6959, 1651593024], "v": "v0.6"}
{"i": [["[\"fused_patch_merging_reshape_reduce_sum\", 1, 14, 14, 512, \"float16\"]", "cuda -keys=cuda,gpu -max_num_threads=1024 -model=unknown -thread_warp_size=32", [-1, 16, 64, 49152, 2147483647, 1024, 8, 32], "", 0, []], [[], [["SP", 2, 1, 2048, [4], 1], ["AN", 2, 2, 6], ["CI", 1], ["AN", 2, 0, 5], ["PR", 2, 0, "auto_unroll_max_step$64"]]]], "r": [[1.93624e-05, 1.93622e-05, 1.93521e-05, 1.93657e-05, 1.93661e-05, 1.93651e-05, 1.93601e-05, 1.93608e-05, 1.93561e-05, 1.93636e-05], 0, 23.6756, 1651593014], "v": "v0.6"}
{"i": [["[\"fused_patch_merging_reshape_reduce_sum\", 1, 14, 14, 512, \"float16\"]", "cuda -keys=cuda,gpu -max_num_threads=1024 -model=unknown -thread_warp_size=32", [-1, 16, 64, 49152, 2147483647, 1024, 8, 32], "", 0, []], [[], [["SP", 2, 1, 2048, [2], 1], ["AN", 2, 2, 6], ["CI", 1], ["AN", 2, 0, 5], ["PR", 2, 0, "auto_unroll_max_step$64"]]]], "r": [[3.37852e-05, 3.37681e-05, 3.37855e-05, 3.37594e-05, 3.37638e-05, 3.37739e-05, 3.37739e-05, 3.37419e-05, 3.37425e-05, 3.37425e-05], 0, 35.6356, 1651593026], "v": "v0.6"}
{"i": [["[\"fused_patch_merging_reshape_reduce_sum\", 1, 14, 14, 512, \"float16\"]", "cuda -keys=cuda,gpu -max_num_threads=1024 -model=unknown -thread_warp_size=32", [-1, 16, 64, 49152, 2147483647, 1024, 8, 32], "", 0, []], [[], [["CI", 1], ["SP", 2, 0, 49, [4], 1], ["AN", 2, 0, 5], ["AN", 2, 1, 6], ["PR", 2, 0, "auto_unroll_max_step$0"]]]], "r": [[0.00016385, 0.000164165, 0.000164596, 0.00016464, 0.00016455, 0.000164541, 0.000164689, 0.000164776, 0.00016486, 0.00016425], 0, 29.0655, 1651593019], "v": "v0.6"}
{"i": [["[\"fused_patch_merging_reshape_reduce_sum\", 1, 14, 14, 512, \"float16\"]", "cuda -keys=cuda,gpu -max_num_threads=1024 -model=unknown -thread_warp_size=32", [-1, 16, 64, 49152, 2147483647, 1024, 8, 32], "", 0, []], [[], [["SP", 2, 1, 2048, [32], 1], ["AN", 2, 2, 6], ["CI", 1], ["AN", 2, 0, 5], ["PR", 2, 0, "auto_unroll_max_step$1024"]]]], "r": [[4.65543e-06, 4.65452e-06, 4.65739e-06, 4.65935e-06, 4.65538e-06, 4.6562e-06, 4.65574e-06, 4.65518e-06, 4.65567e-06, 4.65641e-06], 0, 32.5044, 1651593022], "v": "v0.6"}
{"i": [["[\"fused_patch_merging_reshape_reduce_sum\", 1, 14, 14, 512, \"float16\"]", "cuda -keys=cuda,gpu -max_num_threads=1024 -model=unknown -thread_warp_size=32", [-1, 16, 64, 49152, 2147483647, 1024, 8, 32], "", 0, []], [[], [["CI", 1], ["SP", 2, 0, 49, [12], 1], ["AN", 2, 0, 5], ["AN", 2, 1, 6], ["PR", 2, 0, "auto_unroll_max_step$16"]]]], "r": [[0.000118579, 0.000118584, 0.000118655, 0.000118684, 0.000118605, 0.00011854, 0.000118534, 0.000118536, 0.000118543, 0.000118534], 0, 9.37032, 1651593811], "v": "v0.6"}
{"i": [["[\"fused_patch_merging_reshape_reduce_sum\", 1, 14, 14, 512, \"float16\"]", "cuda -keys=cuda,gpu -max_num_threads=1024 -model=unknown -thread_warp_size=32", [-1, 16, 64, 49152, 2147483647, 1024, 8, 32], "", 0, []], [[], [["SP", 2, 1, 2048, [1], 1], ["AN", 2, 2, 6], ["CI", 1], ["AN", 2, 0, 5], ["PR", 2, 0, "auto_unroll_max_step$16"]]]], "r": [[3.73634e-05, 3.73543e-05, 3.73593e-05, 3.73688e-05, 3.73732e-05, 3.73701e-05, 3.73686e-05, 3.73677e-05, 3.73732e-05, 3.73556e-05], 0, 13.211, 1651593815], "v": "v0.6"}
{"i": [["[\"fused_patch_merging_reshape_reduce_sum\", 1, 14, 14, 512, \"float16\"]", "cuda -keys=cuda,gpu -max_num_threads=1024 -model=unknown -thread_warp_size=32", [-1, 16, 64, 49152, 2147483647, 1024, 8, 32], "", 0, []], [[], [["CI", 1], ["SP", 2, 0, 49, [16], 1], ["AN", 2, 0, 5], ["AN", 2, 1, 6], ["PR", 2, 0, "auto_unroll_max_step$512"]]]], "r": [[0.000127648, 0.000127662, 0.000127674, 0.000127668, 0.000127668, 0.000127669, 0.000127666, 0.000127664, 0.000127661, 0.00012766], 0, 11.4048, 1651593813], "v": "v0.6"}
{"i": [["[\"fused_patch_merging_reshape_reduce_sum\", 1, 14, 14, 512, \"float16\"]", "cuda -keys=cuda,gpu -max_num_threads=1024 -model=unknown -thread_warp_size=32", [-1, 16, 64, 49152, 2147483647, 1024, 8, 32], "", 0, []], [[], [["CI", 1], ["SP", 2, 0, 49, [48], 1], ["AN", 2, 0, 5], ["AN", 2, 1, 6], ["PR", 2, 0, "auto_unroll_max_step$0"]]]], "r": [[0.000181632, 0.000181577, 0.000181717, 0.000181677, 0.000181583, 0.000181639, 0.000181775, 0.000181624, 0.000181718, 0.000181856], 0, 4.2366, 1651593806], "v": "v0.6"}
{"i": [["[\"fused_patch_merging_reshape_reduce_sum\", 1, 14, 14, 512, \"float16\"]", "cuda -keys=cuda,gpu -max_num_threads=1024 -model=unknown -thread_warp_size=32", [-1, 16, 64, 49152, 2147483647, 1024, 8, 32], "", 0, []], [[], [["SP", 2, 1, 2048, [32], 1], ["AN", 2, 2, 6], ["CI", 1], ["AN", 2, 0, 5], ["PR", 2, 0, "auto_unroll_max_step$64"]]]], "r": [[4.63412e-06, 4.63477e-06, 4.6406e-06, 4.63849e-06, 4.63507e-06, 4.6356e-06, 4.63462e-06, 4.63436e-06, 4.63467e-06, 4.63557e-06], 0, 7.49747, 1651593809], "v": "v0.6"}
{"i": [["[\"fused_patch_merging_reshape_reduce_sum\", 1, 14, 14, 512, \"float16\"]", "cuda -keys=cuda,gpu -max_num_threads=1024 -model=unknown -thread_warp_size=32", [-1, 16, 64, 49152, 2147483647, 1024, 8, 32], "", 0, []], [[], [["CI", 1], ["SP", 2, 0, 49, [8], 1], ["AN", 2, 0, 5], ["AN", 2, 1, 6], ["PR", 2, 0, "auto_unroll_max_step$1024"]]]], "r": [[0.000108737, 0.000108777, 0.000108771, 0.000108771, 0.000108781, 0.000108811, 0.000108801, 0.000108777, 0.000108765, 0.000108765], 0, 18.3809, 1651593820], "v": "v0.6"}
{"i": [["[\"fused_patch_merging_reshape_reduce_sum\", 1, 14, 14, 512, \"float16\"]", "cuda -keys=cuda,gpu -max_num_threads=1024 -model=unknown -thread_warp_size=32", [-1, 16, 64, 49152, 2147483647, 1024, 8, 32], "", 0, []], [[], [["CI", 1], ["SP", 2, 0, 49, [2], 1], ["AN", 2, 0, 5], ["AN", 2, 1, 6], ["PR", 2, 0, "auto_unroll_max_step$16"]]]], "r": [[0.00018559, 0.000185617, 0.000185585, 0.000185593, 0.000185578, 0.000185587, 0.000185575, 0.000185613, 0.000185602, 0.000185577], 0, 25.999, 1651593828], "v": "v0.6"}
{"i": [["[\"fused_patch_merging_reshape_reduce_sum\", 1, 14, 14, 512, \"float16\"]", "cuda -keys=cuda,gpu -max_num_threads=1024 -model=unknown -thread_warp_size=32", [-1, 16, 64, 49152, 2147483647, 1024, 8, 32], "", 0, []], [[], [["CI", 1], ["SP", 2, 0, 49, [2], 1], ["AN", 2, 0, 5], ["AN", 2, 1, 6], ["PR", 2, 0, "auto_unroll_max_step$64"]]]], "r": [[0.000185602, 0.000185566, 0.00018558, 0.000185539, 0.000185513, 0.000185538, 0.000185521, 0.000185554, 0.000185545, 0.000185517], 0, 15.2703, 1651593817], "v": "v0.6"}
{"i": [["[\"fused_patch_merging_reshape_reduce_sum\", 1, 14, 14, 512, \"float16\"]", "cuda -keys=cuda,gpu -max_num_threads=1024 -model=unknown -thread_warp_size=32", [-1, 16, 64, 49152, 2147483647, 1024, 8, 32], "", 0, []], [[], [["CI", 1], ["SP", 2, 0, 49, [6], 1], ["AN", 2, 0, 5], ["AN", 2, 1, 6], ["PR", 2, 0, "auto_unroll_max_step$64"]]]], "r": [[0.000115857, 0.000115834, 0.000115833, 0.0001158, 0.000115803, 0.000115886, 0.00011591, 0.000115738, 0.000116023, 0.000115878], 0, 6.14967, 1651593808], "v": "v0.6"}
{"i": [["[\"fused_patch_merging_reshape_reduce_sum\", 1, 14, 14, 512, \"float16\"]", "cuda -keys=cuda,gpu -max_num_threads=1024 -model=unknown -thread_warp_size=32", [-1, 16, 64, 49152, 2147483647, 1024, 8, 32], "", 0, []], [[], [["SP", 2, 1, 2048, [64], 1], ["AN", 2, 2, 6], ["CI", 1], ["AN", 2, 0, 5], ["PR", 2, 0, "auto_unroll_max_step$16"]]]], "r": [[3.67641e-06, 3.6764e-06, 3.67616e-06, 3.67653e-06, 3.67651e-06, 3.6766e-06, 3.67687e-06, 3.67616e-06, 3.67588e-06, 3.67589e-06], 0, 16.5674, 1651593818], "v": "v0.6"}
{"i": [["[\"fused_patch_merging_reshape_reduce_sum\", 1, 14, 14, 512, \"float16\"]", "cuda -keys=cuda,gpu -max_num_threads=1024 -model=unknown -thread_warp_size=32", [-1, 16, 64, 49152, 2147483647, 1024, 8, 32], "", 0, []], [[], [["SP", 2, 1, 2048, [2], 1], ["AN", 2, 2, 6], ["CI", 1], ["AN", 2, 0, 5], ["PR", 2, 0, "auto_unroll_max_step$64"]]]], "r": [[4.46972e-05, 4.19855e-05, 3.3688e-05, 3.36831e-05, 3.36879e-05, 3.36931e-05, 3.36931e-05, 3.37018e-05, 3.36942e-05, 3.36922e-05], 0, 2.2871, 1651593804], "v": "v0.6"}
{"i": [["[\"fused_patch_merging_reshape_reduce_sum\", 1, 14, 14, 512, \"float16\"]", "cuda -keys=cuda,gpu -max_num_threads=1024 -model=unknown -thread_warp_size=32", [-1, 16, 64, 49152, 2147483647, 1024, 8, 32], "", 0, []], [[], [["CI", 1], ["SP", 2, 0, 49, [48], 1], ["AN", 2, 0, 5], ["AN", 2, 1, 6], ["PR", 2, 0, "auto_unroll_max_step$512"]]]], "r": [[0.000181201, 0.000181279, 0.000181154, 0.000181021, 0.000180982, 0.000181036, 0.000181216, 0.000181272, 0.000181239, 0.00018114], 0, 20.3214, 1651593822], "v": "v0.6"}
{"i": [["[\"fused_patch_merging_reshape_reduce_sum\", 1, 14, 14, 512, \"float16\"]", "cuda -keys=cuda,gpu -max_num_threads=1024 -model=unknown -thread_warp_size=32", [-1, 16, 64, 49152, 2147483647, 1024, 8, 32], "", 0, []], [[], [["CI", 1], ["SP", 2, 0, 49, [48], 1], ["AN", 2, 0, 5], ["AN", 2, 1, 6], ["PR", 2, 0, "auto_unroll_max_step$16"]]]], "r": [[0.000181255, 0.000181267, 0.000181266, 0.000181128, 0.000181124, 0.00018124, 0.000181338, 0.000181291, 0.000181381, 0.000181425], 0, 22.2623, 1651593824], "v": "v0.6"}
{"i": [["[\"fused_patch_merging_reshape_reduce_sum\", 1, 14, 14, 512, \"float16\"]", "cuda -keys=cuda,gpu -max_num_threads=1024 -model=unknown -thread_warp_size=32", [-1, 16, 64, 49152, 2147483647, 1024, 8, 32], "", 0, []], [[], [["CI", 1], ["SP", 2, 0, 49, [4], 1], ["AN", 2, 0, 5], ["AN", 2, 1, 6], ["PR", 2, 0, "auto_unroll_max_step$1024"]]]], "r": [[0.00016609, 0.000165727, 0.000165854, 0.000165808, 0.000165674, 0.000165608, 0.000165629, 0.000165741, 0.000165674, 0.000165743], 0, 29.744, 1651593832], "v": "v0.6"}
{"i": [["[\"fused_patch_merging_reshape_reduce_sum\", 1, 14, 14, 512, \"float16\"]", "cuda -keys=cuda,gpu -max_num_threads=1024 -model=unknown -thread_warp_size=32", [-1, 16, 64, 49152, 2147483647, 1024, 8, 32], "", 0, []], [[], [["CI", 1], ["SP", 2, 0, 49, [24], 1], ["AN", 2, 0, 5], ["AN", 2, 1, 6], ["PR", 2, 0, "auto_unroll_max_step$0"]]]], "r": [[0.000148433, 0.000148462, 0.000148469, 0.000148467, 0.000148455, 0.000148455, 0.000148465, 0.000148452, 0.000148446, 0.000148448], 0, 31.7341, 1651593834], "v": "v0.6"}
{"i": [["[\"fused_patch_merging_reshape_reduce_sum\", 1, 14, 14, 512, \"float16\"]", "cuda -keys=cuda,gpu -max_num_threads=1024 -model=unknown -thread_warp_size=32", [-1, 16, 64, 49152, 2147483647, 1024, 8, 32], "", 0, []], [[], [["CI", 1], ["SP", 2, 0, 49, [48], 1], ["AN", 2, 0, 5], ["AN", 2, 1, 6], ["PR", 2, 0, "auto_unroll_max_step$1024"]]]], "r": [[0.00018141, 0.000181432, 0.000181413, 0.000181342, 0.000181208, 0.000181247, 0.000181249, 0.0001812, 0.000181259, 0.000181258], 0, 24.09, 1651593826], "v": "v0.6"}
{"i": [["[\"fused_patch_merging_reshape_reduce_sum\", 1, 14, 14, 512, \"float16\"]", "cuda -keys=cuda,gpu -max_num_threads=1024 -model=unknown -thread_warp_size=32", [-1, 16, 64, 49152, 2147483647, 1024, 8, 32], "", 0, []], [[], [["CI", 1], ["SP", 2, 0, 49, [2], 1], ["AN", 2, 0, 5], ["AN", 2, 1, 6], ["PR", 2, 0, "auto_unroll_max_step$512"]]]], "r": [[0.000185471, 0.000185475, 0.000185472, 0.000185439, 0.000185433, 0.000185469, 0.000185468, 0.000185456, 0.000185475, 0.000185467], 0, 47.7159, 1651593850], "v": "v0.6"}
{"i": [["[\"fused_patch_merging_reshape_reduce_sum\", 1, 14, 14, 512, \"float16\"]", "cuda -keys=cuda,gpu -max_num_threads=1024 -model=unknown -thread_warp_size=32", [-1, 16, 64, 49152, 2147483647, 1024, 8, 32], "", 0, []], [[], [["CI", 1], ["SP", 2, 0, 49, [8], 1], ["AN", 2, 0, 5], ["AN", 2, 1, 6], ["PR", 2, 0, "auto_unroll_max_step$512"]]]], "r": [[0.000108708, 0.000108712, 0.000108716, 0.000108726, 0.000108729, 0.000108729, 0.000108724, 0.000108733, 0.000108721, 0.000108728], 0, 27.8424, 1651593830], "v": "v0.6"}
{"i": [["[\"fused_patch_merging_reshape_reduce_sum\", 1, 14, 14, 512, \"float16\"]", "cuda -keys=cuda,gpu -max_num_threads=1024 -model=unknown -thread_warp_size=32", [-1, 16, 64, 49152, 2147483647, 1024, 8, 32], "", 0, []], [[], [["CI", 1], ["SP", 2, 0, 49, [6], 1], ["AN", 2, 0, 5], ["AN", 2, 1, 6], ["PR", 2, 0, "auto_unroll_max_step$512"]]]], "r": [[0.000116334, 0.000115523, 0.000115414, 0.000115391, 0.000115435, 0.000115846, 0.000115769, 0.000115442, 0.00011552, 0.000115392], 0, 38.1127, 1651593840], "v": "v0.6"}
{"i": [["[\"fused_patch_merging_reshape_reduce_sum\", 1, 14, 14, 512, \"float16\"]", "cuda -keys=cuda,gpu -max_num_threads=1024 -model=unknown -thread_warp_size=32", [-1, 16, 64, 49152, 2147483647, 1024, 8, 32], "", 0, []], [[], [["CI", 1], ["SP", 2, 0, 49, [48], 1], ["AN", 2, 0, 5], ["AN", 2, 1, 6], ["PR", 2, 0, "auto_unroll_max_step$64"]]]], "r": [[0.000181771, 0.000181995, 0.000182015, 0.000181911, 0.000181797, 0.000181811, 0.000181681, 0.000181705, 0.00018169, 0.000181624], 0, 40.0056, 1651593842], "v": "v0.6"}
{"i": [["[\"fused_patch_merging_reshape_reduce_sum\", 1, 14, 14, 512, \"float16\"]", "cuda -keys=cuda,gpu -max_num_threads=1024 -model=unknown -thread_warp_size=32", [-1, 16, 64, 49152, 2147483647, 1024, 8, 32], "", 0, []], [[], [["SP", 2, 1, 2048, [1], 1], ["AN", 2, 2, 6], ["CI", 1], ["AN", 2, 0, 5], ["PR", 2, 0, "auto_unroll_max_step$512"]]]], "r": [[3.7161e-05, 3.71563e-05, 3.71571e-05, 3.7156e-05, 3.71557e-05, 3.71558e-05, 3.71567e-05, 3.71562e-05, 3.71567e-05, 3.71556e-05], 0, 33.6128, 1651593836], "v": "v0.6"}
{"i": [["[\"fused_patch_merging_reshape_reduce_sum\", 1, 14, 14, 512, \"float16\"]", "cuda -keys=cuda,gpu -max_num_threads=1024 -model=unknown -thread_warp_size=32", [-1, 16, 64, 49152, 2147483647, 1024, 8, 32], "", 0, []], [[], [["CI", 1], ["SP", 2, 0, 49, [12], 1], ["AN", 2, 0, 5], ["AN", 2, 1, 6], ["PR", 2, 0, "auto_unroll_max_step$64"]]]], "r": [[0.000118558, 0.000118582, 0.000118583, 0.000118574, 0.000118577, 0.000118592, 0.000118591, 0.000118625, 0.00011864, 0.000118592], 0, 45.7925, 1651593848], "v": "v0.6"}
{"i": [["[\"fused_patch_merging_reshape_reduce_sum\", 1, 14, 14, 512, \"float16\"]", "cuda -keys=cuda,gpu -max_num_threads=1024 -model=unknown -thread_warp_size=32", [-1, 16, 64, 49152, 2147483647, 1024, 8, 32], "", 0, []], [[], [["CI", 1], ["SP", 2, 0, 49, [8], 1], ["AN", 2, 0, 5], ["AN", 2, 1, 6], ["PR", 2, 0, "auto_unroll_max_step$0"]]]], "r": [[0.000108758, 0.000108777, 0.000108785, 0.000108764, 0.000108755, 0.00010877, 0.000108773, 0.000108774, 0.000108768, 0.000108755], 0, 41.9469, 1651593844], "v": "v0.6"}
{"i": [["[\"fused_patch_merging_reshape_reduce_sum\", 1, 14, 14, 512, \"float16\"]", "cuda -keys=cuda,gpu -max_num_threads=1024 -model=unknown -thread_warp_size=32", [-1, 16, 64, 49152, 2147483647, 1024, 8, 32], "", 0, []], [[], [["SP", 2, 1, 2048, [32], 1], ["AN", 2, 2, 6], ["CI", 1], ["AN", 2, 0, 5], ["PR", 2, 0, "auto_unroll_max_step$16"]]]], "r": [[4.89506e-06, 4.92078e-06, 4.89859e-06, 4.89872e-06, 4.89338e-06, 4.89132e-06, 4.85256e-06, 4.87428e-06, 4.83087e-06, 4.8098e-06], 0, 36.3171, 1651593838], "v": "v0.6"}
{"i": [["[\"fused_patch_merging_reshape_reduce_sum\", 1, 14, 14, 512, \"float16\"]", "cuda -keys=cuda,gpu -max_num_threads=1024 -model=unknown -thread_warp_size=32", [-1, 16, 64, 49152, 2147483647, 1024, 8, 32], "", 0, []], [[], [["CI", 1], ["SP", 2, 0, 49, [49], 1], ["AN", 2, 0, 5], ["AN", 2, 1, 6], ["PR", 2, 0, "auto_unroll_max_step$0"]]]], "r": [[9.70673e-05, 9.79156e-05, 9.85898e-05, 9.70278e-05, 9.69271e-05, 9.78452e-05, 9.8672e-05, 9.81937e-05, 9.76882e-05, 9.72937e-05], 0, 34.8038, 1651593837], "v": "v0.6"}
{"i": [["[\"fused_patch_merging_reshape_reduce_sum\", 1, 14, 14, 512, \"float16\"]", "cuda -keys=cuda,gpu -max_num_threads=1024 -model=unknown -thread_warp_size=32", [-1, 16, 64, 49152, 2147483647, 1024, 8, 32], "", 0, []], [[], [["CI", 1], ["SP", 2, 0, 49, [6], 1], ["AN", 2, 0, 5], ["AN", 2, 1, 6], ["PR", 2, 0, "auto_unroll_max_step$16"]]]], "r": [[0.000116613, 0.00011664, 0.0001164, 0.000116353, 0.000116207, 0.000116194, 0.000116277, 0.000116306, 0.000116279, 0.000116334], 0, 55.3217, 1651593858], "v": "v0.6"}
{"i": [["[\"fused_patch_merging_reshape_reduce_sum\", 1, 14, 14, 512, \"float16\"]", "cuda -keys=cuda,gpu -max_num_threads=1024 -model=unknown -thread_warp_size=32", [-1, 16, 64, 49152, 2147483647, 1024, 8, 32], "", 0, []], [[], [["CI", 1], ["SP", 2, 0, 49, [1], 1], ["AN", 2, 0, 5], ["AN", 2, 1, 6], ["PR", 2, 0, "auto_unroll_max_step$512"]]]], "r": [[3.93193e-05, 3.93021e-05, 3.98592e-05, 3.97588e-05, 3.96215e-05, 3.95229e-05, 3.9513e-05, 3.92733e-05, 3.95903e-05, 3.99645e-05], 0, 49.6872, 1651593852], "v": "v0.6"}
{"i": [["[\"fused_patch_merging_reshape_reduce_sum\", 1, 14, 14, 512, \"float16\"]", "cuda -keys=cuda,gpu -max_num_threads=1024 -model=unknown -thread_warp_size=32", [-1, 16, 64, 49152, 2147483647, 1024, 8, 32], "", 0, []], [[], [["CI", 1], ["SP", 2, 0, 49, [3], 1], ["AN", 2, 0, 5], ["AN", 2, 1, 6], ["PR", 2, 0, "auto_unroll_max_step$64"]]]], "r": [[0.000162056, 0.000161982, 0.000161952, 0.000161887, 0.000161853, 0.00016188, 0.000161856, 0.000161882, 0.000161887, 0.000161622], 0, 43.9062, 1651593846], "v": "v0.6"}
{"i": [["[\"fused_patch_merging_reshape_reduce_sum\", 1, 14, 14, 512, \"float16\"]", "cuda -keys=cuda,gpu -max_num_threads=1024 -model=unknown -thread_warp_size=32", [-1, 16, 64, 49152, 2147483647, 1024, 8, 32], "", 0, []], [[], [["SP", 2, 1, 2048, [16], 1], ["AN", 2, 2, 6], ["CI", 1], ["AN", 2, 0, 5], ["PR", 2, 0, "auto_unroll_max_step$1024"]]]], "r": [[6.98624e-06, 6.98897e-06, 7.0095e-06, 6.97889e-06, 6.99489e-06, 6.99168e-06, 6.9724e-06, 6.96737e-06, 6.95293e-06, 6.97586e-06], 0, 56.7609, 1651593859], "v": "v0.6"}
{"i": [["[\"fused_patch_merging_reshape_reduce_sum\", 1, 14, 14, 512, \"float16\"]", "cuda -keys=cuda,gpu -max_num_threads=1024 -model=unknown -thread_warp_size=32", [-1, 16, 64, 49152, 2147483647, 1024, 8, 32], "", 0, []], [[], [["CI", 1], ["SP", 2, 0, 49, [6], 1], ["AN", 2, 0, 5], ["AN", 2, 1, 6], ["PR", 2, 0, "auto_unroll_max_step$1024"]]]], "r": [[0.000115903, 0.000115616, 0.000116153, 0.000116719, 0.000116567, 0.00011656, 0.000116465, 0.000116412, 0.000116427, 0.000116419], 0, 51.4763, 1651593854], "v": "v0.6"}
{"i": [["[\"fused_patch_merging_reshape_reduce_sum\", 1, 14, 14, 512, \"float16\"]", "cuda -keys=cuda,gpu -max_num_threads=1024 -model=unknown -thread_warp_size=32", [-1, 16, 64, 49152, 2147483647, 1024, 8, 32], "", 0, []], [[], [["CI", 1], ["SP", 2, 0, 49, [1], 1], ["AN", 2, 0, 5], ["AN", 2, 1, 6], ["PR", 2, 0, "auto_unroll_max_step$0"]]]], "r": [[3.90653e-05, 3.92875e-05, 3.8977e-05, 3.89955e-05, 3.91527e-05, 3.94042e-05, 3.96123e-05, 3.95953e-05, 3.95495e-05, 4.00102e-05], 0, 53.4188, 1651593856], "v": "v0.6"}
{"i": [["[\"fused_patch_merging_reshape_reduce_sum\", 1, 14, 14, 512, \"float16\"]", "cuda -keys=cuda,gpu -max_num_threads=1024 -model=unknown -thread_warp_size=32", [-1, 16, 64, 49152, 2147483647, 1024, 8, 32], "", 0, []], [[], [["SP", 2, 1, 2048, [2], 1], ["AN", 2, 2, 6], ["CI", 1], ["AN", 2, 0, 5], ["PR", 2, 0, "auto_unroll_max_step$1024"]]]], "r": [[3.39296e-05, 3.39432e-05, 3.39522e-05, 3.3947e-05, 3.39423e-05, 3.3939e-05, 3.39371e-05, 3.39477e-05, 3.39502e-05, 3.39533e-05], 0, 65.7279, 1651593868], "v": "v0.6"}
{"i": [["[\"fused_patch_merging_reshape_reduce_sum\", 1, 14, 14, 512, \"float16\"]", "cuda -keys=cuda,gpu -max_num_threads=1024 -model=unknown -thread_warp_size=32", [-1, 16, 64, 49152, 2147483647, 1024, 8, 32], "", 0, []], [[], [["CI", 1], ["SP", 2, 0, 49, [32], 1], ["AN", 2, 0, 5], ["AN", 2, 1, 6], ["PR", 2, 0, "auto_unroll_max_step$0"]]]], "r": [[0.000172347, 0.000172339, 0.000172345, 0.000172336, 0.000172329, 0.000172351, 0.000172362, 0.000172366, 0.000172377, 0.00017237], 0, 61.9467, 1651593864], "v": "v0.6"}
{"i": [["[\"fused_patch_merging_reshape_reduce_sum\", 1, 14, 14, 512, \"float16\"]", "cuda -keys=cuda,gpu -max_num_threads=1024 -model=unknown -thread_warp_size=32", [-1, 16, 64, 49152, 2147483647, 1024, 8, 32], "", 0, []], [[], [["SP", 2, 1, 2048, [4], 1], ["AN", 2, 2, 6], ["CI", 1], ["AN", 2, 0, 5], ["PR", 2, 0, "auto_unroll_max_step$64"]]]], "r": [[1.91032e-05, 1.91183e-05, 1.91095e-05, 1.91034e-05, 1.9104e-05, 1.91888e-05, 1.92955e-05, 1.91608e-05, 1.92828e-05, 1.91059e-05], 0, 58.5729, 1651593861], "v": "v0.6"}
{"i": [["[\"fused_patch_merging_reshape_reduce_sum\", 1, 14, 14, 512, \"float16\"]", "cuda -keys=cuda,gpu -max_num_threads=1024 -model=unknown -thread_warp_size=32", [-1, 16, 64, 49152, 2147483647, 1024, 8, 32], "", 0, []], [[], [["SP", 2, 1, 2048, [16], 1], ["AN", 2, 2, 6], ["CI", 1], ["AN", 2, 0, 5], ["PR", 2, 0, "auto_unroll_max_step$16"]]]], "r": [[7.09228e-06, 7.09477e-06, 7.09528e-06, 7.09513e-06, 7.09365e-06, 7.09312e-06, 7.09363e-06, 7.09433e-06, 7.09172e-06, 7.09426e-06], 0, 60.076, 1651593862], "v": "v0.6"}
{"i": [["[\"fused_patch_merging_reshape_reduce_sum\", 1, 14, 14, 512, \"float16\"]", "cuda -keys=cuda,gpu -max_num_threads=1024 -model=unknown -thread_warp_size=32", [-1, 16, 64, 49152, 2147483647, 1024, 8, 32], "", 0, []], [[], [["CI", 1], ["SP", 2, 0, 49, [8], 1], ["AN", 2, 0, 5], ["AN", 2, 1, 6], ["PR", 2, 0, "auto_unroll_max_step$64"]]]], "r": [[0.000108698, 0.000108721, 0.000108742, 0.000108742, 0.000108744, 0.000108745, 0.000108722, 0.000108738, 0.000108734, 0.000108712], 0, 63.8885, 1651593866], "v": "v0.6"}
{"i": [["[\"fused_patch_merging_reshape_reduce_sum\", 1, 14, 14, 512, \"float16\"]", "cuda -keys=cuda,gpu -max_num_threads=1024 -model=unknown -thread_warp_size=32", [-1, 16, 64, 49152, 2147483647, 1024, 8, 32], "", 0, []], [[], [["CI", 1], ["SP", 2, 0, 49, [4], 1], ["AN", 2, 0, 5], ["AN", 2, 1, 6], ["PR", 2, 0, "auto_unroll_max_step$16"]]]], "r": [[0.000165353, 0.000165553, 0.000165452, 0.000165463, 0.000165508, 0.000165577, 0.000165528, 0.000165448, 0.000165379, 0.00016547], 0, 71.1378, 1651593874], "v": "v0.6"}
{"i": [["[\"fused_patch_merging_reshape_reduce_sum\", 1, 14, 14, 512, \"float16\"]", "cuda -keys=cuda,gpu -max_num_threads=1024 -model=unknown -thread_warp_size=32", [-1, 16, 64, 49152, 2147483647, 1024, 8, 32], "", 0, []], [[], [["SP", 2, 1, 2048, [2], 1], ["AN", 2, 2, 6], ["CI", 1], ["AN", 2, 0, 5], ["PR", 2, 0, "auto_unroll_max_step$0"]]]], "r": [[3.3683e-05, 3.36871e-05, 3.37103e-05, 3.36875e-05, 3.36831e-05, 3.36855e-05, 3.36827e-05, 3.36868e-05, 3.36859e-05, 3.36816e-05], 0, 72.9395, 1651593875], "v": "v0.6"}
{"i": [["[\"fused_patch_merging_reshape_reduce_sum\", 1, 14, 14, 512, \"float16\"]", "cuda -keys=cuda,gpu -max_num_threads=1024 -model=unknown -thread_warp_size=32", [-1, 16, 64, 49152, 2147483647, 1024, 8, 32], "", 0, []], [[], [["CI", 1], ["SP", 2, 0, 49, [1], 1], ["AN", 2, 0, 5], ["AN", 2, 1, 6], ["PR", 2, 0, "auto_unroll_max_step$16"]]]], "r": [[4.00986e-05, 4.01904e-05, 4.0099e-05, 3.97337e-05, 3.96182e-05, 3.89152e-05, 3.91123e-05, 3.94815e-05, 3.95143e-05, 3.93125e-05], 0, 67.4944, 1651593870], "v": "v0.6"}
{"i": [["[\"fused_patch_merging_reshape_reduce_sum\", 1, 14, 14, 512, \"float16\"]", "cuda -keys=cuda,gpu -max_num_threads=1024 -model=unknown -thread_warp_size=32", [-1, 16, 64, 49152, 2147483647, 1024, 8, 32], "", 0, []], [[], [["SP", 2, 1, 2048, [8], 1], ["AN", 2, 2, 6], ["CI", 1], ["AN", 2, 0, 5], ["PR", 2, 0, "auto_unroll_max_step$64"]]]], "r": [[1.11377e-05, 1.11376e-05, 1.11377e-05, 1.11378e-05, 1.11377e-05, 1.11379e-05, 1.11379e-05, 1.11379e-05, 1.1138e-05, 1.11381e-05], 0, 69.1614, 1651593872], "v": "v0.6"}
{"i": [["[\"fused_patch_merging_reshape_reduce_sum\", 1, 14, 14, 512, \"float16\"]", "cuda -keys=cuda,gpu -max_num_threads=1024 -model=unknown -thread_warp_size=32", [-1, 16, 64, 49152, 2147483647, 1024, 8, 32], "", 0, []], [[], [["CI", 1], ["SP", 2, 0, 49, [1], 1], ["AN", 2, 0, 5], ["AN", 2, 1, 6], ["PR", 2, 0, "auto_unroll_max_step$64"]]]], "r": [[3.90535e-05, 3.93732e-05, 3.94453e-05, 3.95985e-05, 3.93048e-05, 3.96812e-05, 3.95957e-05, 3.98602e-05, 4.00994e-05, 3.93988e-05], 0, 73.8868, 1651593877], "v": "v0.6"}
{"i": [["[\"fused_patch_merging_reshape_reduce_sum\", 1, 14, 14, 512, \"float16\"]", "cuda -keys=cuda,gpu -max_num_threads=1024 -model=unknown -thread_warp_size=32", [-1, 16, 64, 49152, 2147483647, 1024, 8, 32], "", 0, []], [[], [["CI", 1], ["SP", 2, 0, 49, [12], 1], ["AN", 2, 0, 5], ["AN", 2, 1, 6], ["PR", 2, 0, "auto_unroll_max_step$512"]]]], "r": [[0.000118567, 0.000118581, 0.000118581, 0.000118582, 0.000118583, 0.00011858, 0.000118581, 0.000118582, 0.000118582, 0.000118581], 0, 73.7917, 1651593879], "v": "v0.6"}
{"i": [["[\"fused_patch_merging_reshape_reduce_sum\", 1, 14, 14, 512, \"float16\"]", "cuda -keys=cuda,gpu -max_num_threads=1024 -model=unknown -thread_warp_size=32", [-1, 16, 64, 49152, 2147483647, 1024, 8, 32], "", 0, []], [[], [["CI", 1], ["SP", 2, 0, 49, [24], 1], ["AN", 2, 0, 5], ["AN", 2, 1, 6], ["PR", 2, 0, "auto_unroll_max_step$16"]]]], "r": [[0.000148437, 0.000148458, 0.000148443, 0.000148431, 0.000148432, 0.000148431, 0.000148433, 0.000148435, 0.000148431, 0.000148432], 0, 73.7884, 1651593881], "v": "v0.6"}
{"i": [["[\"fused_patch_merging_reshape_reduce_sum\", 1, 14, 14, 512, \"float16\"]", "cuda -keys=cuda,gpu -max_num_threads=1024 -model=unknown -thread_warp_size=32", [-1, 16, 64, 49152, 2147483647, 1024, 8, 32], "", 0, []], [[], [["CI", 1], ["SP", 2, 0, 49, [32], 1], ["AN", 2, 0, 5], ["AN", 2, 1, 6], ["PR", 2, 0, "auto_unroll_max_step$16"]]]], "r": [[0.000172338, 0.000172332, 0.000172329, 0.000172312, 0.000172319, 0.000172324, 0.000172322, 0.000172326, 0.000172316, 0.000172312], 0, 74.36, 1651593883], "v": "v0.6"}
{"i": [["[\"fused_patch_merging_reshape_reduce_sum\", 1, 14, 14, 512, \"float16\"]", "cuda -keys=cuda,gpu -max_num_threads=1024 -model=unknown -thread_warp_size=32", [-1, 16, 64, 49152, 2147483647, 1024, 8, 32], "", 0, []], [[], [["CI", 1], ["SP", 2, 0, 49, [49], 1], ["AN", 2, 0, 5], ["AN", 2, 1, 6], ["PR", 2, 0, "auto_unroll_max_step$512"]]]], "r": [[9.81253e-05, 9.63846e-05, 9.62627e-05, 9.59838e-05, 9.64218e-05, 9.65844e-05, 9.79244e-05, 9.80628e-05, 9.89168e-05, 9.85313e-05], 0, 74.2166, 1651593885], "v": "v0.6"}
{"i": [["[\"fused_patch_merging_reshape_reduce_sum\", 1, 14, 14, 512, \"float16\"]", "cuda -keys=cuda,gpu -max_num_threads=1024 -model=unknown -thread_warp_size=32", [-1, 16, 64, 49152, 2147483647, 1024, 8, 32], "", 0, []], [[], [["SP", 2, 1, 2048, [64], 1], ["AN", 2, 2, 6], ["CI", 1], ["AN", 2, 0, 5], ["PR", 2, 0, "auto_unroll_max_step$1024"]]]], "r": [[3.51934e-06, 3.51367e-06, 3.5041e-06, 3.51712e-06, 3.51725e-06, 3.504e-06, 3.50359e-06, 3.50523e-06, 3.51145e-06, 3.50873e-06], 0, 74.324, 1651593887], "v": "v0.6"}
{"i": [["[\"fused_patch_merging_reshape_reduce_sum\", 1, 14, 14, 512, \"float16\"]", "cuda -keys=cuda,gpu -max_num_threads=1024 -model=unknown -thread_warp_size=32", [-1, 16, 64, 49152, 2147483647, 1024, 8, 32], "", 0, []], [[], [["CI", 1], ["SP", 2, 0, 49, [16], 1], ["AN", 2, 0, 5], ["AN", 2, 1, 6], ["PR", 2, 0, "auto_unroll_max_step$0"]]]], "r": [[0.000127549, 0.00012758, 0.000127586, 0.000127596, 0.00012759, 0.00012759, 0.000127582, 0.000127587, 0.00012757, 0.000127562], 0, 74.4206, 1651593889], "v": "v0.6"}
{"i": [["[\"fused_patch_merging_reshape_reduce_sum\", 1, 14, 14, 512, \"float16\"]", "cuda -keys=cuda,gpu -max_num_threads=1024 -model=unknown -thread_warp_size=32", [-1, 16, 64, 49152, 2147483647, 1024, 8, 32], "", 0, []], [[], [["CI", 1], ["SP", 2, 0, 49, [3], 1], ["AN", 2, 0, 5], ["AN", 2, 1, 6], ["PR", 2, 0, "auto_unroll_max_step$0"]]]], "r": [[0.000162622, 0.000162813, 0.000162713, 0.000162807, 0.000162829, 0.000162795, 0.000162764, 0.000162757, 0.00016289, 0.000162822], 0, 74.3587, 1651593891], "v": "v0.6"}
{"i": [["[\"fused_patch_merging_reshape_reduce_sum\", 1, 14, 14, 512, \"float16\"]", "cuda -keys=cuda,gpu -max_num_threads=1024 -model=unknown -thread_warp_size=32", [-1, 16, 64, 49152, 2147483647, 1024, 8, 32], "", 0, []], [[], [["CI", 1], ["SP", 2, 0, 49, [12], 1], ["AN", 2, 0, 5], ["AN", 2, 1, 6], ["PR", 2, 0, "auto_unroll_max_step$0"]]]], "r": [[0.000118503, 0.000118514, 0.000118515, 0.000118517, 0.000118517, 0.000118514, 0.000118517, 0.000118513, 0.000118513, 0.000118513], 0, 74.8367, 1651593893], "v": "v0.6"}
{"i": [["[\"fused_patch_merging_reshape_reduce_sum\", 1, 14, 14, 512, \"float16\"]", "cuda -keys=cuda,gpu -max_num_threads=1024 -model=unknown -thread_warp_size=32", [-1, 16, 64, 49152, 2147483647, 1024, 8, 32], "", 0, []], [[], [["CI", 1], ["SP", 2, 0, 49, [7], 1], ["AN", 2, 0, 5], ["AN", 2, 1, 6], ["PR", 2, 0, "auto_unroll_max_step$16"]]]], "r": [[3.11453e-05, 3.115e-05, 3.1152e-05, 3.11468e-05, 3.11368e-05, 3.11592e-05, 3.11552e-05, 3.11504e-05, 3.11622e-05, 3.11626e-05], 0, 74.9589, 1651593895], "v": "v0.6"}
{"i": [["[\"fused_patch_merging_reshape_reduce_sum\", 1, 14, 14, 512, \"float16\"]", "cuda -keys=cuda,gpu -max_num_threads=1024 -model=unknown -thread_warp_size=32", [-1, 16, 64, 49152, 2147483647, 1024, 8, 32], "", 0, []], [[], [["CI", 1], ["SP", 2, 0, 49, [3], 1], ["AN", 2, 0, 5], ["AN", 2, 1, 6], ["PR", 2, 0, "auto_unroll_max_step$1024"]]]], "r": [[0.000162201, 0.000162365, 0.000162282, 0.000162128, 0.000162267, 0.000162181, 0.000162245, 0.000162182, 0.0001622, 0.00016193], 0, 74.9183, 1651593897], "v": "v0.6"}
{"i": [["[\"fused_patch_merging_reshape_reduce_sum\", 1, 14, 14, 512, \"float16\"]", "cuda -keys=cuda,gpu -max_num_threads=1024 -model=unknown -thread_warp_size=32", [-1, 16, 64, 49152, 2147483647, 1024, 8, 32], "", 0, []], [[], [["SP", 2, 1, 2048, [16], 1], ["AN", 2, 2, 6], ["CI", 1], ["AN", 2, 0, 5], ["PR", 2, 0, "auto_unroll_max_step$0"]]]], "r": [[6.95738e-06, 6.95343e-06, 6.95578e-06, 6.95828e-06, 6.95739e-06, 6.9532e-06, 6.95844e-06, 6.95905e-06, 6.95709e-06, 6.96003e-06], 0, 74.5037, 1651593898], "v": "v0.6"}
{"i": [["[\"fused_patch_merging_reshape_reduce_sum\", 1, 14, 14, 512, \"float16\"]", "cuda -keys=cuda,gpu -max_num_threads=1024 -model=unknown -thread_warp_size=32", [-1, 16, 64, 49152, 2147483647, 1024, 8, 32], "", 0, []], [[], [["CI", 1], ["SP", 2, 0, 49, [32], 1], ["AN", 2, 0, 5], ["AN", 2, 1, 6], ["PR", 2, 0, "auto_unroll_max_step$64"]]]], "r": [[0.000172403, 0.00017243, 0.00017243, 0.000172403, 0.000172417, 0.000172426, 0.000172434, 0.000172434, 0.00017243, 0.000172432], 0, 74.4682, 1651593900], "v": "v0.6"}
{"i": [["[\"fused_patch_merging_reshape_reduce_sum\", 1, 14, 14, 512, \"float16\"]", "cuda -keys=cuda,gpu -max_num_threads=1024 -model=unknown -thread_warp_size=32", [-1, 16, 64, 49152, 2147483647, 1024, 8, 32], "", 0, []], [[], [["SP", 2, 1, 2048, [32], 1], ["AN", 2, 2, 6], ["CI", 1], ["AN", 2, 0, 5], ["PR", 2, 0, "auto_unroll_max_step$1024"]]]], "r": [[4.63545e-06, 4.63748e-06, 4.64045e-06, 4.63884e-06, 4.63552e-06, 4.6349e-06, 4.63576e-06, 4.63646e-06, 4.63645e-06, 4.63619e-06], 0, 73.8572, 1651593901], "v": "v0.6"}
{"i": [["[\"fused_patch_merging_reshape_reduce_sum\", 1, 14, 14, 512, \"float16\"]", "cuda -keys=cuda,gpu -max_num_threads=1024 -model=unknown -thread_warp_size=32", [-1, 16, 64, 49152, 2147483647, 1024, 8, 32], "", 0, []], [[], [["CI", 1], ["SP", 2, 0, 49, [49], 1], ["AN", 2, 0, 5], ["AN", 2, 1, 6], ["PR", 2, 0, "auto_unroll_max_step$64"]]]], "r": [[9.24437e-05, 9.51562e-05, 9.56991e-05, 9.51077e-05, 9.41206e-05, 9.46837e-05, 9.43006e-05, 9.3929e-05, 9.41881e-05, 9.51278e-05], 0, 73.986, 1651593903], "v": "v0.6"}
{"i": [["[\"fused_patch_merging_reshape_reduce_sum\", 1, 14, 14, 512, \"float16\"]", "cuda -keys=cuda,gpu -max_num_threads=1024 -model=unknown -thread_warp_size=32", [-1, 16, 64, 49152, 2147483647, 1024, 8, 32], "", 0, []], [[], [["CI", 1], ["SP", 2, 0, 49, [7], 1], ["AN", 2, 0, 5], ["AN", 2, 1, 6], ["PR", 2, 0, "auto_unroll_max_step$512"]]]], "r": [[3.11962e-05, 3.11854e-05, 3.11726e-05, 3.11537e-05, 3.11493e-05, 3.11503e-05, 3.11498e-05, 3.11491e-05, 3.11483e-05, 3.11505e-05], 0, 73.8746, 1651593905], "v": "v0.6"}
{"i": [["[\"fused_patch_merging_reshape_reduce_sum\", 1, 14, 14, 512, \"float16\"]", "cuda -keys=cuda,gpu -max_num_threads=1024 -model=unknown -thread_warp_size=32", [-1, 16, 64, 49152, 2147483647, 1024, 8, 32], "", 0, []], [[], [["SP", 2, 1, 2048, [4], 1], ["AN", 2, 2, 6], ["CI", 1], ["AN", 2, 0, 5], ["PR", 2, 0, "auto_unroll_max_step$0"]]]], "r": [[1.91887e-05, 1.9204e-05, 1.91845e-05, 1.91415e-05, 1.91463e-05, 1.91558e-05, 1.92045e-05, 1.91497e-05, 1.91841e-05, 1.91627e-05], 0, 73.659, 1651593907], "v": "v0.6"}
{"i": [["[\"fused_patch_merging_reshape_reduce_sum\", 1, 14, 14, 512, \"float16\"]", "cuda -keys=cuda,gpu -max_num_threads=1024 -model=unknown -thread_warp_size=32", [-1, 16, 64, 49152, 2147483647, 1024, 8, 32], "", 0, []], [[], [["CI", 1], ["SP", 2, 0, 49, [7], 1], ["AN", 2, 0, 5], ["AN", 2, 1, 6], ["PR", 2, 0, "auto_unroll_max_step$64"]]]], "r": [[3.11424e-05, 3.11412e-05, 3.11408e-05, 3.11413e-05, 3.11411e-05, 3.11437e-05, 3.11665e-05, 3.11518e-05, 3.11483e-05, 3.11496e-05], 0, 73.5687, 1651593909], "v": "v0.6"}
{"i": [["[\"fused_patch_merging_reshape_reduce_sum\", 1, 14, 14, 512, \"float16\"]", "cuda -keys=cuda,gpu -max_num_threads=1024 -model=unknown -thread_warp_size=32", [-1, 16, 64, 49152, 2147483647, 1024, 8, 32], "", 0, []], [[], [["SP", 2, 1, 2048, [1], 1], ["AN", 2, 2, 6], ["CI", 1], ["AN", 2, 0, 5], ["PR", 2, 0, "auto_unroll_max_step$1024"]]]], "r": [[3.74339e-05, 3.74342e-05, 3.74337e-05, 3.74334e-05, 3.74334e-05, 3.74327e-05, 3.74291e-05, 3.74345e-05, 3.74335e-05, 3.74333e-05], 0, 74.2068, 1651593911], "v": "v0.6"}
{"i": [["[\"fused_patch_merging_reshape_reduce_sum\", 1, 14, 14, 512, \"float16\"]", "cuda -keys=cuda,gpu -max_num_threads=1024 -model=unknown -thread_warp_size=32", [-1, 16, 64, 49152, 2147483647, 1024, 8, 32], "", 0, []], [[], [["CI", 1], ["SP", 2, 0, 49, [6], 1], ["AN", 2, 0, 5], ["AN", 2, 1, 6], ["PR", 2, 0, "auto_unroll_max_step$0"]]]], "r": [[0.000116487, 0.000116536, 0.000116604, 0.000116376, 0.00011633, 0.000116415, 0.000116229, 0.000116635, 0.000117225, 0.000117046], 0, 74.5991, 1651593913], "v": "v0.6"}
{"i": [["[\"fused_patch_merging_reshape_reduce_sum\", 1, 14, 14, 512, \"float16\"]", "cuda -keys=cuda,gpu -max_num_threads=1024 -model=unknown -thread_warp_size=32", [-1, 16, 64, 49152, 2147483647, 1024, 8, 32], "", 0, []], [[], [["SP", 2, 1, 2048, [32], 1], ["AN", 2, 2, 6], ["CI", 1], ["AN", 2, 0, 5], ["PR", 2, 0, "auto_unroll_max_step$0"]]]], "r": [[4.64108e-06, 4.64008e-06, 4.63604e-06, 4.63543e-06, 4.63492e-06, 4.63542e-06, 4.64079e-06, 4.63953e-06, 4.63423e-06, 4.63406e-06], 0, 74.1755, 1651593914], "v": "v0.6"}
{"i": [["[\"fused_patch_merging_reshape_reduce_sum\", 1, 14, 14, 512, \"float16\"]", "cuda -keys=cuda,gpu -max_num_threads=1024 -model=unknown -thread_warp_size=32", [-1, 16, 64, 49152, 2147483647, 1024, 8, 32], "", 0, []], [[], [["CI", 1], ["SP", 2, 0, 49, [32], 1], ["AN", 2, 0, 5], ["AN", 2, 1, 6], ["PR", 2, 0, "auto_unroll_max_step$512"]]]], "r": [[0.000172336, 0.000172345, 0.000172355, 0.000172339, 0.000172354, 0.00017236, 0.000172373, 0.000172377, 0.000172343, 0.000172343], 0, 74.1569, 1651593916], "v": "v0.6"}
{"i": [["[\"fused_patch_merging_reshape_reduce_sum\", 1, 14, 14, 512, \"float16\"]", "cuda -keys=cuda,gpu -max_num_threads=1024 -model=unknown -thread_warp_size=32", [-1, 16, 64, 49152, 2147483647, 1024, 8, 32], "", 0, []], [[], [["CI", 1], ["SP", 2, 0, 49, [4], 1], ["AN", 2, 0, 5], ["AN", 2, 1, 6], ["PR", 2, 0, "auto_unroll_max_step$512"]]]], "r": [[0.000165859, 0.000165742, 0.000165874, 0.000165712, 0.000165433, 0.000165349, 0.000165393, 0.000165224, 0.00016538, 0.000165365], 0, 74.1276, 1651593918], "v": "v0.6"}
{"i": [["[\"fused_patch_merging_reshape_reduce_sum\", 1, 14, 14, 512, \"float16\"]", "cuda -keys=cuda,gpu -max_num_threads=1024 -model=unknown -thread_warp_size=32", [-1, 16, 64, 49152, 2147483647, 1024, 8, 32], "", 0, []], [[], [["CI", 1], ["SP", 2, 0, 49, [2], 1], ["AN", 2, 0, 5], ["AN", 2, 1, 6], ["PR", 2, 0, "auto_unroll_max_step$1024"]]]], "r": [[0.00018552, 0.000185526, 0.000185533, 0.0001855, 0.000185477, 0.00018551, 0.000185506, 0.000185499, 0.000185522, 0.000185518], 0, 74.178, 1651593920], "v": "v0.6"}
{"i": [["[\"fused_patch_merging_reshape_reduce_sum\", 1, 14, 14, 512, \"float16\"]", "cuda -keys=cuda,gpu -max_num_threads=1024 -model=unknown -thread_warp_size=32", [-1, 16, 64, 49152, 2147483647, 1024, 8, 32], "", 0, []], [[], [["CI", 1], ["SP", 2, 0, 49, [49], 1], ["AN", 2, 0, 5], ["AN", 2, 1, 6], ["PR", 2, 0, "auto_unroll_max_step$1024"]]]], "r": [[9.78526e-05, 9.72774e-05, 9.68367e-05, 9.54118e-05, 9.61978e-05, 9.52653e-05, 9.59963e-05, 9.56027e-05, 9.4919e-05, 9.45351e-05], 0, 22.2029, 1651593947], "v": "v0.6"}
{"i": [["[\"fused_patch_merging_reshape_reduce_sum\", 1, 14, 14, 512, \"float16\"]", "cuda -keys=cuda,gpu -max_num_threads=1024 -model=unknown -thread_warp_size=32", [-1, 16, 64, 49152, 2147483647, 1024, 8, 32], "", 0, []], [[], [["SP", 2, 1, 2048, [4], 1], ["AN", 2, 2, 6], ["CI", 1], ["AN", 2, 0, 5], ["PR", 2, 0, "auto_unroll_max_step$1024"]]]], "r": [[1.9158e-05, 1.91565e-05, 1.91618e-05, 1.91586e-05, 1.9158e-05, 1.91583e-05, 1.91589e-05, 1.93189e-05, 1.94482e-05, 1.92032e-05], 0, 10.4676, 1651593935], "v": "v0.6"}
{"i": [["[\"fused_patch_merging_reshape_reduce_sum\", 1, 14, 14, 512, \"float16\"]", "cuda -keys=cuda,gpu -max_num_threads=1024 -model=unknown -thread_warp_size=32", [-1, 16, 64, 49152, 2147483647, 1024, 8, 32], "", 0, []], [[], [["SP", 2, 1, 2048, [32], 1], ["AN", 2, 2, 6], ["CI", 1], ["AN", 2, 0, 5], ["PR", 2, 0, "auto_unroll_max_step$512"]]]], "r": [[4.68766e-06, 4.68733e-06, 4.68704e-06, 4.687e-06, 4.68732e-06, 4.68743e-06, 4.68866e-06, 4.68713e-06, 4.68698e-06, 4.68718e-06], 0, 15.0617, 1651593939], "v": "v0.6"}
{"i": [["[\"fused_patch_merging_reshape_reduce_sum\", 1, 14, 14, 512, \"float16\"]", "cuda -keys=cuda,gpu -max_num_threads=1024 -model=unknown -thread_warp_size=32", [-1, 16, 64, 49152, 2147483647, 1024, 8, 32], "", 0, []], [[], [["SP", 2, 1, 2048, [8], 1], ["AN", 2, 2, 6], ["CI", 1], ["AN", 2, 0, 5], ["PR", 2, 0, "auto_unroll_max_step$0"]]]], "r": [[1.11399e-05, 1.11399e-05, 1.11386e-05, 1.11397e-05, 1.11398e-05, 1.11399e-05, 1.11395e-05, 1.11399e-05, 1.11397e-05, 1.11389e-05], 0, 8.69203, 1651593933], "v": "v0.6"}
{"i": [["[\"fused_patch_merging_reshape_reduce_sum\", 1, 14, 14, 512, \"float16\"]", "cuda -keys=cuda,gpu -max_num_threads=1024 -model=unknown -thread_warp_size=32", [-1, 16, 64, 49152, 2147483647, 1024, 8, 32], "", 0, []], [[], [["SP", 2, 1, 2048, [64], 1], ["AN", 2, 2, 6], ["CI", 1], ["AN", 2, 0, 5], ["PR", 2, 0, "auto_unroll_max_step$512"]]]], "r": [[3.68897e-06, 3.68983e-06, 3.68983e-06, 3.68908e-06, 3.68932e-06, 3.68947e-06, 3.68931e-06, 3.69032e-06, 3.68987e-06, 3.68951e-06], 0, 5.5765, 1651593930], "v": "v0.6"}
{"i": [["[\"fused_patch_merging_reshape_reduce_sum\", 1, 14, 14, 512, \"float16\"]", "cuda -keys=cuda,gpu -max_num_threads=1024 -model=unknown -thread_warp_size=32", [-1, 16, 64, 49152, 2147483647, 1024, 8, 32], "", 0, []], [[], [["CI", 1], ["SP", 2, 0, 49, [3], 1], ["AN", 2, 0, 5], ["AN", 2, 1, 6], ["PR", 2, 0, "auto_unroll_max_step$512"]]]], "r": [[0.000163317, 0.000163179, 0.000163177, 0.000163106, 0.000163221, 0.000163174, 0.000163273, 0.000163229, 0.000163292, 0.000163269], 0, 12.37, 1651593937], "v": "v0.6"}
{"i": [["[\"fused_patch_merging_reshape_reduce_sum\", 1, 14, 14, 512, \"float16\"]", "cuda -keys=cuda,gpu -max_num_threads=1024 -model=unknown -thread_warp_size=32", [-1, 16, 64, 49152, 2147483647, 1024, 8, 32], "", 0, []], [[], [["SP", 2, 1, 2048, [2], 1], ["AN", 2, 2, 6], ["CI", 1], ["AN", 2, 0, 5], ["PR", 2, 0, "auto_unroll_max_step$16"]]]], "r": [[4.34515e-05, 3.37592e-05, 3.37907e-05, 3.37685e-05, 3.37627e-05, 3.37528e-05, 3.37541e-05, 3.37565e-05, 3.37578e-05, 3.37584e-05], 0, 2.29514, 1651593927], "v": "v0.6"}
{"i": [["[\"fused_patch_merging_reshape_reduce_sum\", 1, 14, 14, 512, \"float16\"]", "cuda -keys=cuda,gpu -max_num_threads=1024 -model=unknown -thread_warp_size=32", [-1, 16, 64, 49152, 2147483647, 1024, 8, 32], "", 0, []], [[], [["SP", 2, 1, 2048, [16], 1], ["AN", 2, 2, 6], ["CI", 1], ["AN", 2, 0, 5], ["PR", 2, 0, "auto_unroll_max_step$64"]]]], "r": [[6.84192e-06, 6.86536e-06, 6.85004e-06, 6.83089e-06, 6.82885e-06, 6.83033e-06, 6.81586e-06, 6.83496e-06, 6.84566e-06, 6.85611e-06], 0, 7.03113, 1651593931], "v": "v0.6"}
{"i": [["[\"fused_patch_merging_reshape_reduce_sum\", 1, 14, 14, 512, \"float16\"]", "cuda -keys=cuda,gpu -max_num_threads=1024 -model=unknown -thread_warp_size=32", [-1, 16, 64, 49152, 2147483647, 1024, 8, 32], "", 0, []], [[], [["CI", 1], ["SP", 2, 0, 49, [3], 1], ["AN", 2, 0, 5], ["AN", 2, 1, 6], ["PR", 2, 0, "auto_unroll_max_step$16"]]]], "r": [[0.000161757, 0.000161955, 0.000161917, 0.000161959, 0.000162007, 0.000161809, 0.000162304, 0.000162999, 0.000162954, 0.000162993], 0, 4.18818, 1651593929], "v": "v0.6"}
{"i": [["[\"fused_patch_merging_reshape_reduce_sum\", 1, 14, 14, 512, \"float16\"]", "cuda -keys=cuda,gpu -max_num_threads=1024 -model=unknown -thread_warp_size=32", [-1, 16, 64, 49152, 2147483647, 1024, 8, 32], "", 0, []], [[], [["CI", 1], ["SP", 2, 0, 49, [16], 1], ["AN", 2, 0, 5], ["AN", 2, 1, 6], ["PR", 2, 0, "auto_unroll_max_step$16"]]]], "r": [[0.000127717, 0.00012773, 0.000127733, 0.000127731, 0.000127734, 0.000127736, 0.000127733, 0.000127709, 0.000127713, 0.000127713], 0, 16.8856, 1651593941], "v": "v0.6"}
{"i": [["[\"fused_patch_merging_reshape_reduce_sum\", 1, 14, 14, 512, \"float16\"]", "cuda -keys=cuda,gpu -max_num_threads=1024 -model=unknown -thread_warp_size=32", [-1, 16, 64, 49152, 2147483647, 1024, 8, 32], "", 0, []], [[], [["SP", 2, 1, 2048, [4], 1], ["AN", 2, 2, 6], ["CI", 1], ["AN", 2, 0, 5], ["PR", 2, 0, "auto_unroll_max_step$16"]]]], "r": [[1.93072e-05, 1.92951e-05, 1.9308e-05, 1.9257e-05, 1.92415e-05, 1.92377e-05, 1.92614e-05, 1.93121e-05, 1.92655e-05, 1.92694e-05], 0, 18.6634, 1651593943], "v": "v0.6"}
{"i": [["[\"fused_patch_merging_reshape_reduce_sum\", 1, 14, 14, 512, \"float16\"]", "cuda -keys=cuda,gpu -max_num_threads=1024 -model=unknown -thread_warp_size=32", [-1, 16, 64, 49152, 2147483647, 1024, 8, 32], "", 0, []], [[], [["SP", 2, 1, 2048, [64], 1], ["AN", 2, 2, 6], ["CI", 1], ["AN", 2, 0, 5], ["PR", 2, 0, "auto_unroll_max_step$0"]]]], "r": [[3.50718e-06, 3.5077e-06, 3.51682e-06, 3.53437e-06, 3.53641e-06, 3.53297e-06, 3.53608e-06, 3.53354e-06, 3.52411e-06, 3.5497e-06], 0, 13.6851, 1651593938], "v": "v0.6"}
{"i": [["[\"fused_patch_merging_reshape_reduce_sum\", 1, 14, 14, 512, \"float16\"]", "cuda -keys=cuda,gpu -max_num_threads=1024 -model=unknown -thread_warp_size=32", [-1, 16, 64, 49152, 2147483647, 1024, 8, 32], "", 0, []], [[], [["SP", 2, 1, 2048, [8], 1], ["AN", 2, 2, 6], ["CI", 1], ["AN", 2, 0, 5], ["PR", 2, 0, "auto_unroll_max_step$1024"]]]], "r": [[1.09447e-05, 1.09445e-05, 1.09461e-05, 1.09458e-05, 1.09448e-05, 1.09446e-05, 1.09447e-05, 1.09447e-05, 1.09446e-05, 1.09445e-05], 0, 20.3539, 1651593945], "v": "v0.6"}
{"i": [["[\"fused_patch_merging_reshape_reduce_sum\", 1, 14, 14, 512, \"float16\"]", "cuda -keys=cuda,gpu -max_num_threads=1024 -model=unknown -thread_warp_size=32", [-1, 16, 64, 49152, 2147483647, 1024, 8, 32], "", 0, []], [[], [["CI", 1], ["SP", 2, 0, 49, [24], 1], ["AN", 2, 0, 5], ["AN", 2, 1, 6], ["PR", 2, 0, "auto_unroll_max_step$512"]]]], "r": [[0.000148575, 0.000148591, 0.000148588, 0.00014859, 0.000148589, 0.00014859, 0.000148589, 0.00014859, 0.000148606, 0.000148612], 0, 24.1095, 1651593949], "v": "v0.6"}
{"i": [["[\"fused_patch_merging_reshape_reduce_sum\", 1, 14, 14, 512, \"float16\"]", "cuda -keys=cuda,gpu -max_num_threads=1024 -model=unknown -thread_warp_size=32", [-1, 16, 64, 49152, 2147483647, 1024, 8, 32], "", 0, []], [[], [["CI", 1], ["SP", 2, 0, 49, [7], 1], ["AN", 2, 0, 5], ["AN", 2, 1, 6], ["PR", 2, 0, "auto_unroll_max_step$0"]]]], "r": [[3.11334e-05, 3.1126e-05, 3.11291e-05, 3.11274e-05, 3.11212e-05, 3.11203e-05, 3.11136e-05, 3.11148e-05, 3.11223e-05, 3.11273e-05], 0, 27.6721, 1651593952], "v": "v0.6"}
{"i": [["[\"fused_patch_merging_reshape_reduce_sum\", 1, 14, 14, 512, \"float16\"]", "cuda -keys=cuda,gpu -max_num_threads=1024 -model=unknown -thread_warp_size=32", [-1, 16, 64, 49152, 2147483647, 1024, 8, 32], "", 0, []], [[], [["SP", 2, 1, 2048, [4], 1], ["AN", 2, 2, 6], ["CI", 1], ["AN", 2, 0, 5], ["PR", 2, 0, "auto_unroll_max_step$512"]]]], "r": [[1.91285e-05, 1.91279e-05, 1.91253e-05, 1.91255e-05, 1.91412e-05, 1.91281e-05, 1.91251e-05, 1.91249e-05, 1.91286e-05, 1.91261e-05], 0, 25.7668, 1651593950], "v": "v0.6"}
{"i": [["[\"fused_patch_merging_reshape_reduce_sum\", 1, 14, 14, 512, \"float16\"]", "cuda -keys=cuda,gpu -max_num_threads=1024 -model=unknown -thread_warp_size=32", [-1, 16, 64, 49152, 2147483647, 1024, 8, 32], "", 0, []], [[], [["CI", 1], ["SP", 2, 0, 49, [7], 1], ["AN", 2, 0, 5], ["AN", 2, 1, 6], ["PR", 2, 0, "auto_unroll_max_step$1024"]]]], "r": [[3.13544e-05, 3.13588e-05, 3.13613e-05, 3.136e-05, 3.13537e-05, 3.13523e-05, 3.13528e-05, 3.13526e-05, 3.1351e-05, 3.13517e-05], 0, 34.5688, 1651593959], "v": "v0.6"}
{"i": [["[\"fused_patch_merging_reshape_reduce_sum\", 1, 14, 14, 512, \"float16\"]", "cuda -keys=cuda,gpu -max_num_threads=1024 -model=unknown -thread_warp_size=32", [-1, 16, 64, 49152, 2147483647, 1024, 8, 32], "", 0, []], [[], [["SP", 2, 1, 2048, [64], 1], ["AN", 2, 2, 6], ["CI", 1], ["AN", 2, 0, 5], ["PR", 2, 0, "auto_unroll_max_step$64"]]]], "r": [[3.63729e-06, 3.64321e-06, 3.64452e-06, 3.64428e-06, 3.6438e-06, 3.6424e-06, 3.64211e-06, 3.64261e-06, 3.64384e-06, 3.6438e-06], 0, 30.883, 1651593956], "v": "v0.6"}
{"i": [["[\"fused_patch_merging_reshape_reduce_sum\", 1, 14, 14, 512, \"float16\"]", "cuda -keys=cuda,gpu -max_num_threads=1024 -model=unknown -thread_warp_size=32", [-1, 16, 64, 49152, 2147483647, 1024, 8, 32], "", 0, []], [[], [["CI", 1], ["SP", 2, 0, 49, [4], 1], ["AN", 2, 0, 5], ["AN", 2, 1, 6], ["PR", 2, 0, "auto_unroll_max_step$0"]]]], "r": [[0.00016452, 0.000164724, 0.00016479, 0.000164803, 0.000164882, 0.000164766, 0.000164934, 0.000166471, 0.000166619, 0.000166638], 0, 29.5093, 1651593954], "v": "v0.6"}
{"i": [["[\"fused_patch_merging_reshape_reduce_sum\", 1, 14, 14, 512, \"float16\"]", "cuda -keys=cuda,gpu -max_num_threads=1024 -model=unknown -thread_warp_size=32", [-1, 16, 64, 49152, 2147483647, 1024, 8, 32], "", 0, []], [[], [["CI", 1], ["SP", 2, 0, 49, [4], 1], ["AN", 2, 0, 5], ["AN", 2, 1, 6], ["PR", 2, 0, "auto_unroll_max_step$64"]]]], "r": [[0.000165232, 0.000165249, 0.000165034, 0.000164828, 0.000165064, 0.0001652, 0.000165229, 0.00016527, 0.000165639, 0.000165818], 0, 32.7026, 1651593957], "v": "v0.6"}
{"i": [["[\"fused_patch_merging_reshape_reduce_sum\", 1, 14, 14, 512, \"float16\"]", "cuda -keys=cuda,gpu -max_num_threads=1024 -model=unknown -thread_warp_size=32", [-1, 16, 64, 49152, 2147483647, 1024, 8, 32], "", 0, []], [[], [["SP", 2, 1, 2048, [1], 1], ["AN", 2, 2, 6], ["CI", 1], ["AN", 2, 0, 5], ["PR", 2, 0, "auto_unroll_max_step$64"]]]], "r": [[3.72091e-05, 3.72384e-05, 3.72175e-05, 3.71981e-05, 3.72009e-05, 3.72072e-05, 3.72255e-05, 3.72044e-05, 3.7215e-05, 3.72204e-05], 0, 40.1877, 1651593965], "v": "v0.6"}
{"i": [["[\"fused_patch_merging_reshape_reduce_sum\", 1, 14, 14, 512, \"float16\"]", "cuda -keys=cuda,gpu -max_num_threads=1024 -model=unknown -thread_warp_size=32", [-1, 16, 64, 49152, 2147483647, 1024, 8, 32], "", 0, []], [[], [["CI", 1], ["SP", 2, 0, 49, [16], 1], ["AN", 2, 0, 5], ["AN", 2, 1, 6], ["PR", 2, 0, "auto_unroll_max_step$64"]]]], "r": [[0.000127519, 0.000127539, 0.000127535, 0.000127531, 0.00012753, 0.000127532, 0.000127533, 0.000127531, 0.000127531, 0.000127531], 0, 43.9702, 1651593969], "v": "v0.6"}
{"i": [["[\"fused_patch_merging_reshape_reduce_sum\", 1, 14, 14, 512, \"float16\"]", "cuda -keys=cuda,gpu -max_num_threads=1024 -model=unknown -thread_warp_size=32", [-1, 16, 64, 49152, 2147483647, 1024, 8, 32], "", 0, []], [[], [["CI", 1], ["SP", 2, 0, 49, [16], 1], ["AN", 2, 0, 5], ["AN", 2, 1, 6], ["PR", 2, 0, "auto_unroll_max_step$1024"]]]], "r": [[0.000127616, 0.00012763, 0.000127627, 0.000127619, 0.00012762, 0.000127613, 0.000127627, 0.00012762, 0.000127618, 0.000127618], 0, 36.326, 1651593961], "v": "v0.6"}
{"i": [["[\"fused_patch_merging_reshape_reduce_sum\", 1, 14, 14, 512, \"float16\"]", "cuda -keys=cuda,gpu -max_num_threads=1024 -model=unknown -thread_warp_size=32", [-1, 16, 64, 49152, 2147483647, 1024, 8, 32], "", 0, []], [[], [["CI", 1], ["SP", 2, 0, 49, [32], 1], ["AN", 2, 0, 5], ["AN", 2, 1, 6], ["PR", 2, 0, "auto_unroll_max_step$1024"]]]], "r": [[0.000172278, 0.000172305, 0.000172304, 0.000172288, 0.000172311, 0.000172327, 0.000172326, 0.000172325, 0.000172326, 0.00017233], 0, 49.4196, 1651593974], "v": "v0.6"}
{"i": [["[\"fused_patch_merging_reshape_reduce_sum\", 1, 14, 14, 512, \"float16\"]", "cuda -keys=cuda,gpu -max_num_threads=1024 -model=unknown -thread_warp_size=32", [-1, 16, 64, 49152, 2147483647, 1024, 8, 32], "", 0, []], [[], [["CI", 1], ["SP", 2, 0, 49, [12], 1], ["AN", 2, 0, 5], ["AN", 2, 1, 6], ["PR", 2, 0, "auto_unroll_max_step$1024"]]]], "r": [[0.000118529, 0.000118541, 0.00011854, 0.000118535, 0.000118533, 0.000118532, 0.000118537, 0.000118542, 0.000118549, 0.00011854], 0, 38.3422, 1651593963], "v": "v0.6"}
{"i": [["[\"fused_patch_merging_reshape_reduce_sum\", 1, 14, 14, 512, \"float16\"]", "cuda -keys=cuda,gpu -max_num_threads=1024 -model=unknown -thread_warp_size=32", [-1, 16, 64, 49152, 2147483647, 1024, 8, 32], "", 0, []], [[], [["SP", 2, 1, 2048, [1], 1], ["AN", 2, 2, 6], ["CI", 1], ["AN", 2, 0, 5], ["PR", 2, 0, "auto_unroll_max_step$0"]]]], "r": [[3.71868e-05, 3.71878e-05, 3.719e-05, 3.71906e-05, 3.71916e-05, 3.71889e-05, 3.71885e-05, 3.71892e-05, 3.71923e-05, 3.71877e-05], 0, 51.2359, 1651593976], "v": "v0.6"}
{"i": [["[\"fused_patch_merging_reshape_reduce_sum\", 1, 14, 14, 512, \"float16\"]", "cuda -keys=cuda,gpu -max_num_threads=1024 -model=unknown -thread_warp_size=32", [-1, 16, 64, 49152, 2147483647, 1024, 8, 32], "", 0, []], [[], [["CI", 1], ["SP", 2, 0, 49, [8], 1], ["AN", 2, 0, 5], ["AN", 2, 1, 6], ["PR", 2, 0, "auto_unroll_max_step$16"]]]], "r": [[0.000108729, 0.000108744, 0.000108735, 0.000108708, 0.0001087, 0.000108698, 0.000108721, 0.000108744, 0.000108728, 0.000108713], 0, 56.9851, 1651593982], "v": "v0.6"}
{"i": [["[\"fused_patch_merging_reshape_reduce_sum\", 1, 14, 14, 512, \"float16\"]", "cuda -keys=cuda,gpu -max_num_threads=1024 -model=unknown -thread_warp_size=32", [-1, 16, 64, 49152, 2147483647, 1024, 8, 32], "", 0, []], [[], [["SP", 2, 1, 2048, [8], 1], ["AN", 2, 2, 6], ["CI", 1], ["AN", 2, 0, 5], ["PR", 2, 0, "auto_unroll_max_step$16"]]]], "r": [[1.09427e-05, 1.09431e-05, 1.09436e-05, 1.09433e-05, 1.09432e-05, 1.09431e-05, 1.0943e-05, 1.09432e-05, 1.09434e-05, 1.09433e-05], 0, 45.6435, 1651593971], "v": "v0.6"}
{"i": [["[\"fused_patch_merging_reshape_reduce_sum\", 1, 14, 14, 512, \"float16\"]", "cuda -keys=cuda,gpu -max_num_threads=1024 -model=unknown -thread_warp_size=32", [-1, 16, 64, 49152, 2147483647, 1024, 8, 32], "", 0, []], [[], [["CI", 1], ["SP", 2, 0, 49, [1], 1], ["AN", 2, 0, 5], ["AN", 2, 1, 6], ["PR", 2, 0, "auto_unroll_max_step$1024"]]]], "r": [[3.93328e-05, 3.91075e-05, 3.92575e-05, 3.87422e-05, 3.86455e-05, 3.94046e-05, 3.95875e-05, 3.99313e-05, 3.98321e-05, 3.92324e-05], 0, 47.4514, 1651593972], "v": "v0.6"}
{"i": [["[\"fused_patch_merging_reshape_reduce_sum\", 1, 14, 14, 512, \"float16\"]", "cuda -keys=cuda,gpu -max_num_threads=1024 -model=unknown -thread_warp_size=32", [-1, 16, 64, 49152, 2147483647, 1024, 8, 32], "", 0, []], [[], [["CI", 1], ["SP", 2, 0, 49, [24], 1], ["AN", 2, 0, 5], ["AN", 2, 1, 6], ["PR", 2, 0, "auto_unroll_max_step$64"]]]], "r": [[0.000148531, 0.000148544, 0.00014854, 0.000148543, 0.000148539, 0.000148543, 0.000148541, 0.000148544, 0.00014854, 0.00014854], 0, 42.1111, 1651593967], "v": "v0.6"}
{"i": [["[\"fused_patch_merging_reshape_reduce_sum\", 1, 14, 14, 512, \"float16\"]", "cuda -keys=cuda,gpu -max_num_threads=1024 -model=unknown -thread_warp_size=32", [-1, 16, 64, 49152, 2147483647, 1024, 8, 32], "", 0, []], [[], [["CI", 1], ["SP", 2, 0, 49, [24], 1], ["AN", 2, 0, 5], ["AN", 2, 1, 6], ["PR", 2, 0, "auto_unroll_max_step$1024"]]]], "r": [[0.000148406, 0.000148418, 0.000148406, 0.000148406, 0.00014841, 0.000148407, 0.000148406, 0.000148404, 0.00014841, 0.000148408], 0, 53.181, 1651593978], "v": "v0.6"}
{"i": [["[\"fused_patch_merging_reshape_reduce_sum\", 1, 14, 14, 512, \"float16\"]", "cuda -keys=cuda,gpu -max_num_threads=1024 -model=unknown -thread_warp_size=32", [-1, 16, 64, 49152, 2147483647, 1024, 8, 32], "", 0, []], [[], [["SP", 2, 1, 2048, [8], 1], ["AN", 2, 2, 6], ["CI", 1], ["AN", 2, 0, 5], ["PR", 2, 0, "auto_unroll_max_step$512"]]]], "r": [[1.08908e-05, 1.08877e-05, 1.08859e-05, 1.08875e-05, 1.09037e-05, 1.08908e-05, 1.08881e-05, 1.08882e-05, 1.08914e-05, 1.08873e-05], 0, 62.177, 1651593987], "v": "v0.6"}
{"i": [["[\"fused_patch_merging_reshape_reduce_sum\", 1, 14, 14, 512, \"float16\"]", "cuda -keys=cuda,gpu -max_num_threads=1024 -model=unknown -thread_warp_size=32", [-1, 16, 64, 49152, 2147483647, 1024, 8, 32], "", 0, []], [[], [["CI", 1], ["SP", 2, 0, 49, [2], 1], ["AN", 2, 0, 5], ["AN", 2, 1, 6], ["PR", 2, 0, "auto_unroll_max_step$0"]]]], "r": [[0.000185498, 0.000185509, 0.000185493, 0.000185478, 0.0001855, 0.000185497, 0.0001855, 0.000185513, 0.000185523, 0.000185514], 0, 55.0779, 1651593980], "v": "v0.6"}
{"i": [["[\"fused_patch_merging_reshape_reduce_sum\", 1, 14, 14, 512, \"float16\"]", "cuda -keys=cuda,gpu -max_num_threads=1024 -model=unknown -thread_warp_size=32", [-1, 16, 64, 49152, 2147483647, 1024, 8, 32], "", 0, []], [[], [["SP", 2, 1, 2048, [16], 1], ["AN", 2, 2, 6], ["CI", 1], ["AN", 2, 0, 5], ["PR", 2, 0, "auto_unroll_max_step$512"]]]], "r": [[7.07807e-06, 7.07809e-06, 7.0805e-06, 7.07876e-06, 7.07909e-06, 7.07763e-06, 7.07897e-06, 7.07842e-06, 7.07874e-06, 7.07684e-06], 0, 60.3959, 1651593986], "v": "v0.6"}
{"i": [["[\"fused_patch_merging_reshape_reduce_sum\", 1, 14, 14, 512, \"float16\"]", "cuda -keys=cuda,gpu -max_num_threads=1024 -model=unknown -thread_warp_size=32", [-1, 16, 64, 49152, 2147483647, 1024, 8, 32], "", 0, []], [[], [["CI", 1], ["SP", 2, 0, 49, [49], 1], ["AN", 2, 0, 5], ["AN", 2, 1, 6], ["PR", 2, 0, "auto_unroll_max_step$16"]]]], "r": [[9.50942e-05, 9.49673e-05, 9.63349e-05, 9.72907e-05, 9.71701e-05, 9.61281e-05, 9.70583e-05, 9.80449e-05, 9.8794e-05, 9.86888e-05], 0, 58.851, 1651593984], "v": "v0.6"}
{"i": [["[\"fused_patch_merging_reshape_reduce_sum\", 1, 14, 14, 512, \"float16\"]", "cuda -keys=cuda,gpu -max_num_threads=1024 -model=unknown -thread_warp_size=32", [-1, 16, 64, 49152, 2147483647, 1024, 8, 32], "", 0, []], [[], [["SP", 2, 1, 2048, [2], 1], ["AN", 2, 2, 6], ["CI", 1], ["AN", 2, 0, 5], ["PR", 2, 0, "auto_unroll_max_step$512"]]]], "r": [[3.36842e-05, 3.36988e-05, 3.37044e-05, 3.37322e-05, 3.37496e-05, 3.38489e-05, 3.37902e-05, 3.37484e-05, 3.36847e-05, 3.37057e-05], 0, 63.8622, 1651593989], "v": "v0.6"}
