python/models/swin_transformer/kernel_configs/swin_transformer_roll_tune_1_56_56_128_3_float16.log
{"i": [["[\"roll\", 1, 56, 56, 128, 3, \"float16\"]", "cuda -keys=cuda,gpu -max_num_threads=1024 -model=unknown -thread_warp_size=32", [-1, 16, 64, 49152, 2147483647, 1024, 8, 32], "", 0, []], [[], [["FU", 1, [0, 1, 2, 3]], ["SP", 1, 0, 401408, [4], 1], ["AN", 1, 0, 5], ["AN", 1, 1, 6]]]], "r": [[7.71339e-05, 7.71347e-05, 7.71485e-05, 7.71827e-05, 7.72145e-05, 7.71397e-05, 7.71494e-05, 7.71444e-05, 7.71366e-05, 7.71526e-05], 0, 5.37689, 1652026328], "v": "v0.6"}
{"i": [["[\"roll\", 1, 56, 56, 128, 3, \"float16\"]", "cuda -keys=cuda,gpu -max_num_threads=1024 -model=unknown -thread_warp_size=32", [-1, 16, 64, 49152, 2147483647, 1024, 8, 32], "", 0, []], [[], [["FU", 1, [0, 1, 2, 3]], ["SP", 1, 0, 401408, [1], 1], ["AN", 1, 0, 5], ["AN", 1, 1, 6]]]], "r": [[0.000300094, 0.000300182, 0.000300288, 0.000300116, 0.000300109, 0.000300127, 0.000300211, 0.000300221, 0.000300102, 0.000300097], 0, 27.688, 1652026350], "v": "v0.6"}
{"i": [["[\"roll\", 1, 56, 56, 128, 3, \"float16\"]", "cuda -keys=cuda,gpu -max_num_threads=1024 -model=unknown -thread_warp_size=32", [-1, 16, 64, 49152, 2147483647, 1024, 8, 32], "", 0, []], [[], [["FU", 1, [0, 1, 2, 3]], ["SP", 1, 0, 401408, [32], 1], ["AN", 1, 0, 5], ["AN", 1, 1, 6]]]], "r": [[1.2035e-05, 1.20381e-05, 1.20468e-05, 1.20347e-05, 1.2035e-05, 1.20437e-05, 1.21876e-05, 1.20349e-05, 1.20352e-05, 1.20398e-05], 0, 22.4459, 1652026345], "v": "v0.6"}
{"i": [["[\"roll\", 1, 56, 56, 128, 3, \"float16\"]", "cuda -keys=cuda,gpu -max_num_threads=1024 -model=unknown -thread_warp_size=32", [-1, 16, 64, 49152, 2147483647, 1024, 8, 32], "", 0, []], [[], [["FU", 1, [0, 1, 2, 3]], ["SP", 1, 0, 401408, [8], 1], ["AN", 1, 0, 5], ["AN", 1, 1, 6]]]], "r": [[3.99426e-05, 3.99434e-05, 3.9946e-05, 3.99609e-05, 3.99401e-05, 3.99405e-05, 3.99411e-05, 3.99451e-05, 3.99403e-05, 3.99416e-05], 0, 41.2633, 1652026364], "v": "v0.6"}
{"i": [["[\"roll\", 1, 56, 56, 128, 3, \"float16\"]", "cuda -keys=cuda,gpu -max_num_threads=1024 -model=unknown -thread_warp_size=32", [-1, 16, 64, 49152, 2147483647, 1024, 8, 32], "", 0, []], [[], [["FU", 1, [0, 1, 2, 3]], ["SP", 1, 0, 401408, [56], 1], ["AN", 1, 0, 5], ["AN", 1, 1, 6]]]], "r": [[7.94406e-06, 7.94601e-06, 7.94871e-06, 8.297e-06, 7.94551e-06, 7.94657e-06, 7.94781e-06, 7.95329e-06, 7.95067e-06, 7.94828e-06], 0, 9.19064, 1652026332], "v": "v0.6"}
{"i": [["[\"roll\", 1, 56, 56, 128, 3, \"float16\"]", "cuda -keys=cuda,gpu -max_num_threads=1024 -model=unknown -thread_warp_size=32", [-1, 16, 64, 49152, 2147483647, 1024, 8, 32], "", 0, []], [[], [["FU", 1, [0, 1, 2, 3]], ["SP", 1, 0, 401408, [14], 1], ["AN", 1, 0, 5], ["AN", 1, 1, 6]]]], "r": [[2.39758e-05, 2.39778e-05, 2.3977e-05, 2.39767e-05, 2.39789e-05, 2.3987e-05, 2.39776e-05, 2.39828e-05, 2.39757e-05, 2.39779e-05], 0, 14.2454, 1652026337], "v": "v0.6"}
{"i": [["[\"roll\", 1, 56, 56, 128, 3, \"float16\"]", "cuda -keys=cuda,gpu -max_num_threads=1024 -model=unknown -thread_warp_size=32", [-1, 16, 64, 49152, 2147483647, 1024, 8, 32], "", 0, []], [[], [["FU", 1, [0, 1, 2, 3]], ["SP", 1, 0, 401408, [64], 1], ["AN", 1, 0, 5], ["AN", 1, 1, 6]]]], "r": [[7.25853e-06, 7.19111e-06, 7.19052e-06, 7.35707e-06, 7.19168e-06, 7.19126e-06, 7.19177e-06, 7.19012e-06, 7.22608e-06, 7.19115e-06], 0, 36.1525, 1652026359], "v": "v0.6"}
{"i": [["[\"roll\", 1, 56, 56, 128, 3, \"float16\"]", "cuda -keys=cuda,gpu -max_num_threads=1024 -model=unknown -thread_warp_size=32", [-1, 16, 64, 49152, 2147483647, 1024, 8, 32], "", 0, []], [[], [["FU", 1, [0, 1, 2, 3]], ["SP", 1, 0, 401408, [7], 1], ["AN", 1, 0, 5], ["AN", 1, 1, 6]]]], "r": [[4.54525e-05, 4.54421e-05, 4.54421e-05, 4.54433e-05, 4.54437e-05, 4.54498e-05, 4.54715e-05, 4.54457e-05, 4.54479e-05, 4.54425e-05], 0, 19.0373, 1652026342], "v": "v0.6"}
{"i": [["[\"roll\", 1, 56, 56, 128, 3, \"float16\"]", "cuda -keys=cuda,gpu -max_num_threads=1024 -model=unknown -thread_warp_size=32", [-1, 16, 64, 49152, 2147483647, 1024, 8, 32], "", 0, []], [[], [["FU", 1, [0, 1, 2, 3]], ["SP", 1, 0, 401408, [49], 1], ["AN", 1, 0, 5], ["AN", 1, 1, 6]]]], "r": [[8.61216e-06, 8.61646e-06, 8.61366e-06, 8.61032e-06, 8.77364e-06, 8.6104e-06, 8.62065e-06, 8.9136e-06, 8.61328e-06, 8.60934e-06], 0, 31.9932, 1652026355], "v": "v0.6"}
{"i": [["[\"roll\", 1, 56, 56, 128, 3, \"float16\"]", "cuda -keys=cuda,gpu -max_num_threads=1024 -model=unknown -thread_warp_size=32", [-1, 16, 64, 49152, 2147483647, 1024, 8, 32], "", 0, []], [[], [["FU", 1, [0, 1, 2, 3]], ["SP", 1, 0, 401408, [28], 1], ["AN", 1, 0, 5], ["AN", 1, 1, 6]]]], "r": [[1.3474e-05, 1.34739e-05, 1.34734e-05, 1.3473e-05, 1.34741e-05, 1.3474e-05, 1.34752e-05, 1.34736e-05, 1.34745e-05, 1.34747e-05], 0, 56.2657, 1652026379], "v": "v0.6"}
{"i": [["[\"roll\", 1, 56, 56, 128, 3, \"float16\"]", "cuda -keys=cuda,gpu -max_num_threads=1024 -model=unknown -thread_warp_size=32", [-1, 16, 64, 49152, 2147483647, 1024, 8, 32], "", 0, []], [[], [["FU", 1, [0, 1, 2, 3]], ["SP", 1, 0, 401408, [2], 1], ["AN", 1, 0, 5], ["AN", 1, 1, 6]]]], "r": [[0.000151456, 0.000151467, 0.000151493, 0.000151458, 0.000151452, 0.000151451, 0.000151452, 0.000151461, 0.000151471, 0.000151461], 0, 46.8254, 1652026370], "v": "v0.6"}
{"i": [["[\"roll\", 1, 56, 56, 128, 3, \"float16\"]", "cuda -keys=cuda,gpu -max_num_threads=1024 -model=unknown -thread_warp_size=32", [-1, 16, 64, 49152, 2147483647, 1024, 8, 32], "", 0, []], [[], [["FU", 1, [0, 1, 2, 3]], ["SP", 1, 0, 401408, [16], 1], ["AN", 1, 0, 5], ["AN", 1, 1, 6]]]], "r": [[2.14006e-05, 2.14002e-05, 2.14029e-05, 2.14088e-05, 2.14013e-05, 2.14003e-05, 2.13994e-05, 2.13986e-05, 2.14023e-05, 2.14011e-05], 0, 51.7227, 1652026375], "v": "v0.6"}
{"i": [["[\"roll\", 1, 56, 56, 128, 3, \"float16\"]", "cuda -keys=cuda,gpu -max_num_threads=1024 -model=unknown -thread_warp_size=32", [-1, 16, 64, 49152, 2147483647, 1024, 8, 32], "", 0, []], [[], [["FU", 1, [0, 1, 2, 3]], ["SP", 1, 0, 401408, [14], 1], ["AN", 1, 0, 5], ["AN", 1, 1, 6]]]], "r": [[2.41349e-05, 2.41379e-05, 2.4148e-05], 0, 1.37123, 1668016060], "v": "v0.6"}
{"i": [["[\"roll\", 1, 56, 56, 128, 3, \"float16\"]", "cuda -keys=cuda,gpu -max_num_threads=1024 -model=unknown -thread_warp_size=32", [-1, 16, 64, 49152, 2147483647, 1024, 8, 32], "", 0, []], [[], [["FU", 1, [0, 1, 2, 3]], ["SP", 1, 0, 401408, [64], 1], ["AN", 1, 0, 5], ["AN", 1, 1, 6]]]], "r": [[7.27018e-06, 7.27431e-06, 7.27985e-06], 0, 2.41813, 1668016061], "v": "v0.6"}
{"i": [["[\"roll\", 1, 56, 56, 128, 3, \"float16\"]", "cuda -keys=cuda,gpu -max_num_threads=1024 -model=unknown -thread_warp_size=32", [-1, 16, 64, 49152, 2147483647, 1024, 8, 32], "", 0, []], [[], [["FU", 1, [0, 1, 2, 3]], ["SP", 1, 0, 401408, [28], 1], ["AN", 1, 0, 5], ["AN", 1, 1, 6]]]], "r": [[1.34772e-05, 1.35033e-05, 1.35029e-05], 0, 4.67563, 1668016064], "v": "v0.6"}
{"i": [["[\"roll\", 1, 56, 56, 128, 3, \"float16\"]", "cuda -keys=cuda,gpu -max_num_threads=1024 -model=unknown -thread_warp_size=32", [-1, 16, 64, 49152, 2147483647, 1024, 8, 32], "", 0, []], [[], [["FU", 1, [0, 1, 2, 3]], ["SP", 1, 0, 401408, [49], 1], ["AN", 1, 0, 5], ["AN", 1, 1, 6]]]], "r": [[8.64834e-06, 8.66495e-06, 8.66861e-06], 0, 0.998675, 1668016060], "v": "v0.6"}
{"i": [["[\"roll\", 1, 56, 56, 128, 3, \"float16\"]", "cuda -keys=cuda,gpu -max_num_threads=1024 -model=unknown -thread_warp_size=32", [-1, 16, 64, 49152, 2147483647, 1024, 8, 32], "", 0, []], [[], [["FU", 1, [0, 1, 2, 3]], ["SP", 1, 0, 401408, [56], 1], ["AN", 1, 0, 5], ["AN", 1, 1, 6]]]], "r": [[8.01744e-06, 8.026e-06, 8.02966e-06], 0, 1.70188, 1668016061], "v": "v0.6"}
{"i": [["[\"roll\", 1, 56, 56, 128, 3, \"float16\"]", "cuda -keys=cuda,gpu -max_num_threads=1024 -model=unknown -thread_warp_size=32", [-1, 16, 64, 49152, 2147483647, 1024, 8, 32], "", 0, []], [[], [["FU", 1, [0, 1, 2, 3]], ["SP", 1, 0, 401408, [16], 1], ["AN", 1, 0, 5], ["AN", 1, 1, 6]]]], "r": [[2.15006e-05, 2.15099e-05, 2.15099e-05], 0, 0.603065, 1668016060], "v": "v0.6"}
{"i": [["[\"roll\", 1, 56, 56, 128, 3, \"float16\"]", "cuda -keys=cuda,gpu -max_num_threads=1024 -model=unknown -thread_warp_size=32", [-1, 16, 64, 49152, 2147483647, 1024, 8, 32], "", 0, []], [[], [["FU", 1, [0, 1, 2, 3]], ["SP", 1, 0, 401408, [2], 1], ["AN", 1, 0, 5], ["AN", 1, 1, 6]]]], "r": [[0.000151678, 0.000151715, 0.000151703], 0, 2.06595, 1668016061], "v": "v0.6"}
{"i": [["[\"roll\", 1, 56, 56, 128, 3, \"float16\"]", "cuda -keys=cuda,gpu -max_num_threads=1024 -model=unknown -thread_warp_size=32", [-1, 16, 64, 49152, 2147483647, 1024, 8, 32], "", 0, []], [[], [["FU", 1, [0, 1, 2, 3]], ["SP", 1, 0, 401408, [7], 1], ["AN", 1, 0, 5], ["AN", 1, 1, 6]]]], "r": [[4.52997e-05, 4.53124e-05, 4.53106e-05], 0, 2.74983, 1668016062], "v": "v0.6"}
{"i": [["[\"roll\", 1, 56, 56, 128, 3, \"float16\"]", "cuda -keys=cuda,gpu -max_num_threads=1024 -model=unknown -thread_warp_size=32", [-1, 16, 64, 49152, 2147483647, 1024, 8, 32], "", 0, []], [[], [["FU", 1, [0, 1, 2, 3]], ["SP", 1, 0, 401408, [1], 1], ["AN", 1, 0, 5], ["AN", 1, 1, 6]]]], "r": [[0.000300547, 0.000300473, 0.000300502], 0, 3.86695, 1668016063], "v": "v0.6"}
{"i": [["[\"roll\", 1, 56, 56, 128, 3, \"float16\"]", "cuda -keys=cuda,gpu -max_num_threads=1024 -model=unknown -thread_warp_size=32", [-1, 16, 64, 49152, 2147483647, 1024, 8, 32], "", 0, []], [[], [["FU", 1, [0, 1, 2, 3]], ["SP", 1, 0, 401408, [8], 1], ["AN", 1, 0, 5], ["AN", 1, 1, 6]]]], "r": [[3.99705e-05, 3.99812e-05, 3.9972e-05], 0, 4.27969, 1668016063], "v": "v0.6"}
{"i": [["[\"roll\", 1, 56, 56, 128, 3, \"float16\"]", "cuda -keys=cuda,gpu -max_num_threads=1024 -model=unknown -thread_warp_size=32", [-1, 16, 64, 49152, 2147483647, 1024, 8, 32], "", 0, []], [[], [["FU", 1, [0, 1, 2, 3]], ["SP", 1, 0, 401408, [4], 1], ["AN", 1, 0, 5], ["AN", 1, 1, 6]]]], "r": [[7.71748e-05, 7.7181e-05, 7.71783e-05], 0, 3.51041, 1668016063], "v": "v0.6"}
{"i": [["[\"roll\", 1, 56, 56, 128, 3, \"float16\"]", "cuda -keys=cuda,gpu -max_num_threads=1024 -model=unknown -thread_warp_size=32", [-1, 16, 64, 49152, 2147483647, 1024, 8, 32], "", 0, []], [[], [["FU", 1, [0, 1, 2, 3]], ["SP", 1, 0, 401408, [32], 1], ["AN", 1, 0, 5], ["AN", 1, 1, 6]]]], "r": [[1.21806e-05, 1.2198e-05, 1.22012e-05], 0, 3.14638, 1668016062], "v": "v0.6"}
{"i": [["[\"roll\", 1, 56, 56, 128, 3, \"float16\"]", "cuda -keys=cuda,gpu -max_num_threads=1024 -model=unknown -thread_warp_size=32", [-1, 16, 64, 49152, 2147483647, 1024, 8, 32], "", 0, []], [[], [["FU", 1, [0, 1, 2, 3]], ["SP", 1, 0, 401408, [2], 1], ["AN", 1, 0, 5], ["AN", 1, 1, 6]]]], "r": [[0.000151612, 0.000151613, 0.000151635], 0, 1.9837, 1668021064], "v": "v0.6"}
{"i": [["[\"roll\", 1, 56, 56, 128, 3, \"float16\"]", "cuda -keys=cuda,gpu -max_num_threads=1024 -model=unknown -thread_warp_size=32", [-1, 16, 64, 49152, 2147483647, 1024, 8, 32], "", 0, []], [[], [["FU", 1, [0, 1, 2, 3]], ["SP", 1, 0, 401408, [4], 1], ["AN", 1, 0, 5], ["AN", 1, 1, 6]]]], "r": [[7.71485e-05, 7.71392e-05, 7.71504e-05], 0, 2.32547, 1668021065], "v": "v0.6"}
{"i": [["[\"roll\", 1, 56, 56, 128, 3, \"float16\"]", "cuda -keys=cuda,gpu -max_num_threads=1024 -model=unknown -thread_warp_size=32", [-1, 16, 64, 49152, 2147483647, 1024, 8, 32], "", 0, []], [[], [["FU", 1, [0, 1, 2, 3]], ["SP", 1, 0, 401408, [16], 1], ["AN", 1, 0, 5], ["AN", 1, 1, 6]]]], "r": [[2.14713e-05, 2.14933e-05, 2.14898e-05], 0, 3.39604, 1668021066], "v": "v0.6"}
{"i": [["[\"roll\", 1, 56, 56, 128, 3, \"float16\"]", "cuda -keys=cuda,gpu -max_num_threads=1024 -model=unknown -thread_warp_size=32", [-1, 16, 64, 49152, 2147483647, 1024, 8, 32], "", 0, []], [[], [["FU", 1, [0, 1, 2, 3]], ["SP", 1, 0, 401408, [49], 1], ["AN", 1, 0, 5], ["AN", 1, 1, 6]]]], "r": [[8.74662e-06, 8.76692e-06, 8.77464e-06], 0, 0.941923, 1668021063], "v": "v0.6"}
{"i": [["[\"roll\", 1, 56, 56, 128, 3, \"float16\"]", "cuda -keys=cuda,gpu -max_num_threads=1024 -model=unknown -thread_warp_size=32", [-1, 16, 64, 49152, 2147483647, 1024, 8, 32], "", 0, []], [[], [["FU", 1, [0, 1, 2, 3]], ["SP", 1, 0, 401408, [7], 1], ["AN", 1, 0, 5], ["AN", 1, 1, 6]]]], "r": [[4.52963e-05, 4.532e-05, 4.5307e-05], 0, 0.590961, 1668021063], "v": "v0.6"}
{"i": [["[\"roll\", 1, 56, 56, 128, 3, \"float16\"]", "cuda -keys=cuda,gpu -max_num_threads=1024 -model=unknown -thread_warp_size=32", [-1, 16, 64, 49152, 2147483647, 1024, 8, 32], "", 0, []], [[], [["FU", 1, [0, 1, 2, 3]], ["SP", 1, 0, 401408, [56], 1], ["AN", 1, 0, 5], ["AN", 1, 1, 6]]]], "r": [[8.02021e-06, 8.01823e-06, 8.02133e-06], 0, 1.65772, 1668021064], "v": "v0.6"}
{"i": [["[\"roll\", 1, 56, 56, 128, 3, \"float16\"]", "cuda -keys=cuda,gpu -max_num_threads=1024 -model=unknown -thread_warp_size=32", [-1, 16, 64, 49152, 2147483647, 1024, 8, 32], "", 0, []], [[], [["FU", 1, [0, 1, 2, 3]], ["SP", 1, 0, 401408, [28], 1], ["AN", 1, 0, 5], ["AN", 1, 1, 6]]]], "r": [[1.3427e-05, 1.34393e-05, 1.3434e-05], 0, 1.25935, 1668021064], "v": "v0.6"}
{"i": [["[\"roll\", 1, 56, 56, 128, 3, \"float16\"]", "cuda -keys=cuda,gpu -max_num_threads=1024 -model=unknown -thread_warp_size=32", [-1, 16, 64, 49152, 2147483647, 1024, 8, 32], "", 0, []], [[], [["FU", 1, [0, 1, 2, 3]], ["SP", 1, 0, 401408, [32], 1], ["AN", 1, 0, 5], ["AN", 1, 1, 6]]]], "r": [[1.22442e-05, 1.22627e-05, 1.22675e-05], 0, 2.70288, 1668021065], "v": "v0.6"}
{"i": [["[\"roll\", 1, 56, 56, 128, 3, \"float16\"]", "cuda -keys=cuda,gpu -max_num_threads=1024 -model=unknown -thread_warp_size=32", [-1, 16, 64, 49152, 2147483647, 1024, 8, 32], "", 0, []], [[], [["FU", 1, [0, 1, 2, 3]], ["SP", 1, 0, 401408, [1], 1], ["AN", 1, 0, 5], ["AN", 1, 1, 6]]]], "r": [[0.000300486, 0.000300451, 0.000300475], 0, 4.42223, 1668021067], "v": "v0.6"}
{"i": [["[\"roll\", 1, 56, 56, 128, 3, \"float16\"]", "cuda -keys=cuda,gpu -max_num_threads=1024 -model=unknown -thread_warp_size=32", [-1, 16, 64, 49152, 2147483647, 1024, 8, 32], "", 0, []], [[], [["FU", 1, [0, 1, 2, 3]], ["SP", 1, 0, 401408, [8], 1], ["AN", 1, 0, 5], ["AN", 1, 1, 6]]]], "r": [[4.01434e-05, 4.01469e-05, 4.01389e-05], 0, 3.05091, 1668021065], "v": "v0.6"}
{"i": [["[\"roll\", 1, 56, 56, 128, 3, \"float16\"]", "cuda -keys=cuda,gpu -max_num_threads=1024 -model=unknown -thread_warp_size=32", [-1, 16, 64, 49152, 2147483647, 1024, 8, 32], "", 0, []], [[], [["FU", 1, [0, 1, 2, 3]], ["SP", 1, 0, 401408, [14], 1], ["AN", 1, 0, 5], ["AN", 1, 1, 6]]]], "r": [[2.41537e-05, 2.4162e-05, 2.41738e-05], 0, 4.08413, 1668021066], "v": "v0.6"}
{"i": [["[\"roll\", 1, 56, 56, 128, 3, \"float16\"]", "cuda -keys=cuda,gpu -max_num_threads=1024 -model=unknown -thread_warp_size=32", [-1, 16, 64, 49152, 2147483647, 1024, 8, 32], "", 0, []], [[], [["FU", 1, [0, 1, 2, 3]], ["SP", 1, 0, 401408, [64], 1], ["AN", 1, 0, 5], ["AN", 1, 1, 6]]]], "r": [[7.19398e-06, 7.20558e-06, 7.20375e-06], 0, 3.76533, 1668021066], "v": "v0.6"}
{"i": [["[\"roll\", 1, 56, 56, 128, 3, \"float16\"]", "cuda -keys=cuda,gpu -max_num_threads=1024 -model=unknown -thread_warp_size=32", [-1, 16, 64, 49152, 2147483647, 1024, 8, 32], "", 0, []], [[], [["FU", 1, [0, 1, 2, 3]], ["SP", 1, 0, 401408, [8], 1], ["AN", 1, 0, 5], ["AN", 1, 1, 6]]]], "r": [[3.99658e-05, 3.99728e-05, 3.99694e-05], 0, 4.54244, 1668045814], "v": "v0.6"}
{"i": [["[\"roll\", 1, 56, 56, 128, 3, \"float16\"]", "cuda -keys=cuda,gpu -max_num_threads=1024 -model=unknown -thread_warp_size=32", [-1, 16, 64, 49152, 2147483647, 1024, 8, 32], "", 0, []], [[], [["FU", 1, [0, 1, 2, 3]], ["SP", 1, 0, 401408, [64], 1], ["AN", 1, 0, 5], ["AN", 1, 1, 6]]]], "r": [[7.17607e-06, 7.18557e-06, 7.1894e-06], 0, 1.6683, 1668045811], "v": "v0.6"}
{"i": [["[\"roll\", 1, 56, 56, 128, 3, \"float16\"]", "cuda -keys=cuda,gpu -max_num_threads=1024 -model=unknown -thread_warp_size=32", [-1, 16, 64, 49152, 2147483647, 1024, 8, 32], "", 0, []], [[], [["FU", 1, [0, 1, 2, 3]], ["SP", 1, 0, 401408, [16], 1], ["AN", 1, 0, 5], ["AN", 1, 1, 6]]]], "r": [[2.16316e-05, 2.16529e-05, 2.16487e-05], 0, 0.600945, 1668045810], "v": "v0.6"}
{"i": [["[\"roll\", 1, 56, 56, 128, 3, \"float16\"]", "cuda -keys=cuda,gpu -max_num_threads=1024 -model=unknown -thread_warp_size=32", [-1, 16, 64, 49152, 2147483647, 1024, 8, 32], "", 0, []], [[], [["FU", 1, [0, 1, 2, 3]], ["SP", 1, 0, 401408, [56], 1], ["AN", 1, 0, 5], ["AN", 1, 1, 6]]]], "r": [[7.87968e-06, 7.89036e-06, 7.89156e-06], 0, 0.949454, 1668045811], "v": "v0.6"}
{"i": [["[\"roll\", 1, 56, 56, 128, 3, \"float16\"]", "cuda -keys=cuda,gpu -max_num_threads=1024 -model=unknown -thread_warp_size=32", [-1, 16, 64, 49152, 2147483647, 1024, 8, 32], "", 0, []], [[], [["FU", 1, [0, 1, 2, 3]], ["SP", 1, 0, 401408, [32], 1], ["AN", 1, 0, 5], ["AN", 1, 1, 6]]]], "r": [[1.21432e-05, 1.21502e-05, 1.21521e-05], 0, 1.29283, 1668045811], "v": "v0.6"}
{"i": [["[\"roll\", 1, 56, 56, 128, 3, \"float16\"]", "cuda -keys=cuda,gpu -max_num_threads=1024 -model=unknown -thread_warp_size=32", [-1, 16, 64, 49152, 2147483647, 1024, 8, 32], "", 0, []], [[], [["FU", 1, [0, 1, 2, 3]], ["SP", 1, 0, 401408, [49], 1], ["AN", 1, 0, 5], ["AN", 1, 1, 6]]]], "r": [[8.7042e-06, 8.71479e-06, 8.71685e-06], 0, 3.08625, 1668045813], "v": "v0.6"}
{"i": [["[\"roll\", 1, 56, 56, 128, 3, \"float16\"]", "cuda -keys=cuda,gpu -max_num_threads=1024 -model=unknown -thread_warp_size=32", [-1, 16, 64, 49152, 2147483647, 1024, 8, 32], "", 0, []], [[], [["FU", 1, [0, 1, 2, 3]], ["SP", 1, 0, 401408, [7], 1], ["AN", 1, 0, 5], ["AN", 1, 1, 6]]]], "r": [[4.52633e-05, 4.52703e-05, 4.52638e-05], 0, 2.73869, 1668045812], "v": "v0.6"}
{"i": [["[\"roll\", 1, 56, 56, 128, 3, \"float16\"]", "cuda -keys=cuda,gpu -max_num_threads=1024 -model=unknown -thread_warp_size=32", [-1, 16, 64, 49152, 2147483647, 1024, 8, 32], "", 0, []], [[], [["FU", 1, [0, 1, 2, 3]], ["SP", 1, 0, 401408, [14], 1], ["AN", 1, 0, 5], ["AN", 1, 1, 6]]]], "r": [[2.41286e-05, 2.41401e-05, 2.41396e-05], 0, 2.01104, 1668045812], "v": "v0.6"}
{"i": [["[\"roll\", 1, 56, 56, 128, 3, \"float16\"]", "cuda -keys=cuda,gpu -max_num_threads=1024 -model=unknown -thread_warp_size=32", [-1, 16, 64, 49152, 2147483647, 1024, 8, 32], "", 0, []], [[], [["FU", 1, [0, 1, 2, 3]], ["SP", 1, 0, 401408, [4], 1], ["AN", 1, 0, 5], ["AN", 1, 1, 6]]]], "r": [[7.73178e-05, 7.73339e-05, 7.73212e-05], 0, 4.12924, 1668045814], "v": "v0.6"}
{"i": [["[\"roll\", 1, 56, 56, 128, 3, \"float16\"]", "cuda -keys=cuda,gpu -max_num_threads=1024 -model=unknown -thread_warp_size=32", [-1, 16, 64, 49152, 2147483647, 1024, 8, 32], "", 0, []], [[], [["FU", 1, [0, 1, 2, 3]], ["SP", 1, 0, 401408, [2], 1], ["AN", 1, 0, 5], ["AN", 1, 1, 6]]]], "r": [[0.000151722, 0.000151766, 0.000151728], 0, 2.34894, 1668045812], "v": "v0.6"}
{"i": [["[\"roll\", 1, 56, 56, 128, 3, \"float16\"]", "cuda -keys=cuda,gpu -max_num_threads=1024 -model=unknown -thread_warp_size=32", [-1, 16, 64, 49152, 2147483647, 1024, 8, 32], "", 0, []], [[], [["FU", 1, [0, 1, 2, 3]], ["SP", 1, 0, 401408, [28], 1], ["AN", 1, 0, 5], ["AN", 1, 1, 6]]]], "r": [[1.346e-05, 1.34734e-05, 1.34729e-05], 0, 3.78072, 1668045813], "v": "v0.6"}
{"i": [["[\"roll\", 1, 56, 56, 128, 3, \"float16\"]", "cuda -keys=cuda,gpu -max_num_threads=1024 -model=unknown -thread_warp_size=32", [-1, 16, 64, 49152, 2147483647, 1024, 8, 32], "", 0, []], [[], [["FU", 1, [0, 1, 2, 3]], ["SP", 1, 0, 401408, [1], 1], ["AN", 1, 0, 5], ["AN", 1, 1, 6]]]], "r": [[0.000300488, 0.0003005, 0.0003005], 0, 3.39392, 1668045813], "v": "v0.6"}
{"i": [["[\"roll\", 1, 56, 56, 128, 3, \"float16\"]", "cuda -keys=cuda,gpu -max_num_threads=1024 -model=unknown -thread_warp_size=32", [-1, 16, 64, 49152, 2147483647, 1024, 8, 32], "", 0, []], [[], [["FU", 1, [0, 1, 2, 3]], ["SP", 1, 0, 401408, [64], 1], ["AN", 1, 0, 5], ["AN", 1, 1, 6]]]], "r": [[7.16449e-06, 7.15446e-06, 7.13112e-06], 0, 0.939879, 1668048068], "v": "v0.6"}
{"i": [["[\"roll\", 1, 56, 56, 128, 3, \"float16\"]", "cuda -keys=cuda,gpu -max_num_threads=1024 -model=unknown -thread_warp_size=32", [-1, 16, 64, 49152, 2147483647, 1024, 8, 32], "", 0, []], [[], [["FU", 1, [0, 1, 2, 3]], ["SP", 1, 0, 401408, [49], 1], ["AN", 1, 0, 5], ["AN", 1, 1, 6]]]], "r": [[8.66005e-06, 8.66566e-06, 8.66926e-06], 0, 2.78846, 1668048070], "v": "v0.6"}
{"i": [["[\"roll\", 1, 56, 56, 128, 3, \"float16\"]", "cuda -keys=cuda,gpu -max_num_threads=1024 -model=unknown -thread_warp_size=32", [-1, 16, 64, 49152, 2147483647, 1024, 8, 32], "", 0, []], [[], [["FU", 1, [0, 1, 2, 3]], ["SP", 1, 0, 401408, [7], 1], ["AN", 1, 0, 5], ["AN", 1, 1, 6]]]], "r": [[4.52554e-05, 4.52526e-05, 4.52661e-05], 0, 0.598062, 1668048068], "v": "v0.6"}
{"i": [["[\"roll\", 1, 56, 56, 128, 3, \"float16\"]", "cuda -keys=cuda,gpu -max_num_threads=1024 -model=unknown -thread_warp_size=32", [-1, 16, 64, 49152, 2147483647, 1024, 8, 32], "", 0, []], [[], [["FU", 1, [0, 1, 2, 3]], ["SP", 1, 0, 401408, [28], 1], ["AN", 1, 0, 5], ["AN", 1, 1, 6]]]], "r": [[1.34003e-05, 1.34172e-05, 1.3415e-05], 0, 2.04496, 1668048069], "v": "v0.6"}
{"i": [["[\"roll\", 1, 56, 56, 128, 3, \"float16\"]", "cuda -keys=cuda,gpu -max_num_threads=1024 -model=unknown -thread_warp_size=32", [-1, 16, 64, 49152, 2147483647, 1024, 8, 32], "", 0, []], [[], [["FU", 1, [0, 1, 2, 3]], ["SP", 1, 0, 401408, [32], 1], ["AN", 1, 0, 5], ["AN", 1, 1, 6]]]], "r": [[1.21268e-05, 1.21399e-05, 1.21374e-05], 0, 1.68768, 1668048069], "v": "v0.6"}
{"i": [["[\"roll\", 1, 56, 56, 128, 3, \"float16\"]", "cuda -keys=cuda,gpu -max_num_threads=1024 -model=unknown -thread_warp_size=32", [-1, 16, 64, 49152, 2147483647, 1024, 8, 32], "", 0, []], [[], [["FU", 1, [0, 1, 2, 3]], ["SP", 1, 0, 401408, [2], 1], ["AN", 1, 0, 5], ["AN", 1, 1, 6]]]], "r": [[0.000151708, 0.000151701, 0.000151711], 0, 3.11395, 1668048070], "v": "v0.6"}
{"i": [["[\"roll\", 1, 56, 56, 128, 3, \"float16\"]", "cuda -keys=cuda,gpu -max_num_threads=1024 -model=unknown -thread_warp_size=32", [-1, 16, 64, 49152, 2147483647, 1024, 8, 32], "", 0, []], [[], [["FU", 1, [0, 1, 2, 3]], ["SP", 1, 0, 401408, [4], 1], ["AN", 1, 0, 5], ["AN", 1, 1, 6]]]], "r": [[7.71795e-05, 7.71785e-05, 7.71966e-05], 0, 1.29207, 1668048069], "v": "v0.6"}
{"i": [["[\"roll\", 1, 56, 56, 128, 3, \"float16\"]", "cuda -keys=cuda,gpu -max_num_threads=1024 -model=unknown -thread_warp_size=32", [-1, 16, 64, 49152, 2147483647, 1024, 8, 32], "", 0, []], [[], [["FU", 1, [0, 1, 2, 3]], ["SP", 1, 0, 401408, [8], 1], ["AN", 1, 0, 5], ["AN", 1, 1, 6]]]], "r": [[4.00973e-05, 4.01113e-05, 4.00901e-05], 0, 3.46312, 1668048071], "v": "v0.6"}
{"i": [["[\"roll\", 1, 56, 56, 128, 3, \"float16\"]", "cuda -keys=cuda,gpu -max_num_threads=1024 -model=unknown -thread_warp_size=32", [-1, 16, 64, 49152, 2147483647, 1024, 8, 32], "", 0, []], [[], [["FU", 1, [0, 1, 2, 3]], ["SP", 1, 0, 401408, [14], 1], ["AN", 1, 0, 5], ["AN", 1, 1, 6]]]], "r": [[2.41718e-05, 2.41777e-05, 2.4185e-05], 0, 2.39583, 1668048070], "v": "v0.6"}
{"i": [["[\"roll\", 1, 56, 56, 128, 3, \"float16\"]", "cuda -keys=cuda,gpu -max_num_threads=1024 -model=unknown -thread_warp_size=32", [-1, 16, 64, 49152, 2147483647, 1024, 8, 32], "", 0, []], [[], [["FU", 1, [0, 1, 2, 3]], ["SP", 1, 0, 401408, [16], 1], ["AN", 1, 0, 5], ["AN", 1, 1, 6]]]], "r": [[2.15422e-05, 2.15473e-05, 2.15498e-05], 0, 4.17801, 1668048071], "v": "v0.6"}
{"i": [["[\"roll\", 1, 56, 56, 128, 3, \"float16\"]", "cuda -keys=cuda,gpu -max_num_threads=1024 -model=unknown -thread_warp_size=32", [-1, 16, 64, 49152, 2147483647, 1024, 8, 32], "", 0, []], [[], [["FU", 1, [0, 1, 2, 3]], ["SP", 1, 0, 401408, [1], 1], ["AN", 1, 0, 5], ["AN", 1, 1, 6]]]], "r": [[0.000300643, 0.000300587, 0.000300631], 0, 4.52304, 1668048072], "v": "v0.6"}
{"i": [["[\"roll\", 1, 56, 56, 128, 3, \"float16\"]", "cuda -keys=cuda,gpu -max_num_threads=1024 -model=unknown -thread_warp_size=32", [-1, 16, 64, 49152, 2147483647, 1024, 8, 32], "", 0, []], [[], [["FU", 1, [0, 1, 2, 3]], ["SP", 1, 0, 401408, [56], 1], ["AN", 1, 0, 5], ["AN", 1, 1, 6]]]], "r": [[7.98998e-06, 8.00278e-06, 7.99912e-06], 0, 3.81381, 1668048071], "v": "v0.6"}
