python/models/swin_transformer/kernel_configs/swin_transformer_fused_roll_window_partition_1_14_14_512_3_7_float16.log
{"i": [["[\"fused_roll_window_partition\", 1, 14, 14, 512, 3, 7, \"float16\"]", "cuda -keys=cuda,gpu -max_num_threads=1024 -model=unknown -thread_warp_size=32", [-1, 16, 64, 49152, 2147483647, 1024, 8, 32], "", 0, []], [[], [["FU", 1, [0, 1, 2, 3]], ["SP", 1, 0, 100352, [8], 1], ["AN", 1, 0, 5], ["AN", 1, 1, 6]]]], "r": [[1.21163e-05, 1.22444e-05, 1.21243e-05, 1.22327e-05, 1.29228e-05, 1.28086e-05, 1.21492e-05, 1.2192e-05, 1.21302e-05, 1.26386e-05], 0, 10.1802, 1651678800], "v": "v0.6"}
{"i": [["[\"fused_roll_window_partition\", 1, 14, 14, 512, 3, 7, \"float16\"]", "cuda -keys=cuda,gpu -max_num_threads=1024 -model=unknown -thread_warp_size=32", [-1, 16, 64, 49152, 2147483647, 1024, 8, 32], "", 0, []], [[], [["FU", 1, [0, 1, 2, 3]], ["SP", 1, 0, 100352, [49], 1], ["AN", 1, 0, 5], ["AN", 1, 1, 6]]]], "r": [[4.38129e-06, 4.36943e-06, 4.42e-06, 4.37104e-06, 4.42556e-06, 4.37411e-06, 4.73733e-06, 4.55695e-06, 4.36594e-06, 4.36849e-06], 0, 8.085, 1651678798], "v": "v0.6"}
{"i": [["[\"fused_roll_window_partition\", 1, 14, 14, 512, 3, 7, \"float16\"]", "cuda -keys=cuda,gpu -max_num_threads=1024 -model=unknown -thread_warp_size=32", [-1, 16, 64, 49152, 2147483647, 1024, 8, 32], "", 0, []], [[], [["FU", 1, [0, 1, 2, 3]], ["SP", 1, 0, 100352, [28], 1], ["AN", 1, 0, 5], ["AN", 1, 1, 6]]]], "r": [[6.44261e-06, 5.83046e-06, 5.45794e-06, 5.37745e-06, 5.41498e-06, 5.38938e-06, 5.88775e-06, 5.63904e-06, 6.23854e-06, 1.13248e-05], 0, 3.52652, 1651678794], "v": "v0.6"}
{"i": [["[\"fused_roll_window_partition\", 1, 14, 14, 512, 3, 7, \"float16\"]", "cuda -keys=cuda,gpu -max_num_threads=1024 -model=unknown -thread_warp_size=32", [-1, 16, 64, 49152, 2147483647, 1024, 8, 32], "", 0, []], [[], [["FU", 1, [0, 1, 2, 3]], ["SP", 1, 0, 100352, [64], 1], ["AN", 1, 0, 5], ["AN", 1, 1, 6]]]], "r": [[1.47987e-05, 5.02672e-06, 4.61102e-06, 4.27669e-06, 4.27209e-06, 4.46248e-06, 4.38518e-06, 4.34828e-06, 4.31787e-06, 4.35176e-06], 0, 20.4676, 1651678811], "v": "v0.6"}
{"i": [["[\"fused_roll_window_partition\", 1, 14, 14, 512, 3, 7, \"float16\"]", "cuda -keys=cuda,gpu -max_num_threads=1024 -model=unknown -thread_warp_size=32", [-1, 16, 64, 49152, 2147483647, 1024, 8, 32], "", 0, []], [[], [["FU", 1, [0, 1, 2, 3]], ["SP", 1, 0, 100352, [1], 1], ["AN", 1, 0, 5], ["AN", 1, 1, 6]]]], "r": [[7.73182e-05, 7.74241e-05, 7.73792e-05, 7.74631e-05, 8.35028e-05, 9.85056e-05, 7.73186e-05, 7.81204e-05, 7.73186e-05, 7.73215e-05], 0, 12.6423, 1651678803], "v": "v0.6"}
{"i": [["[\"fused_roll_window_partition\", 1, 14, 14, 512, 3, 7, \"float16\"]", "cuda -keys=cuda,gpu -max_num_threads=1024 -model=unknown -thread_warp_size=32", [-1, 16, 64, 49152, 2147483647, 1024, 8, 32], "", 0, []], [[], [["FU", 1, [0, 1, 2, 3]], ["SP", 1, 0, 100352, [56], 1], ["AN", 1, 0, 5], ["AN", 1, 1, 6]]]], "r": [[4.02891e-06, 4.02503e-06, 4.02599e-06, 4.0274e-06, 4.02538e-06, 4.02714e-06, 4.06589e-06, 4.03446e-06, 4.06244e-06, 4.05692e-06], 0, 24.9126, 1651678815], "v": "v0.6"}
{"i": [["[\"fused_roll_window_partition\", 1, 14, 14, 512, 3, 7, \"float16\"]", "cuda -keys=cuda,gpu -max_num_threads=1024 -model=unknown -thread_warp_size=32", [-1, 16, 64, 49152, 2147483647, 1024, 8, 32], "", 0, []], [[], [["FU", 1, [0, 1, 2, 3]], ["SP", 1, 0, 100352, [16], 1], ["AN", 1, 0, 5], ["AN", 1, 1, 6]]]], "r": [[7.3042e-06, 7.30531e-06, 7.31956e-06, 7.30498e-06, 7.3074e-06, 7.30806e-06, 7.30688e-06, 7.30534e-06, 7.35899e-06, 7.31084e-06], 0, 22.7668, 1651678813], "v": "v0.6"}
{"i": [["[\"fused_roll_window_partition\", 1, 14, 14, 512, 3, 7, \"float16\"]", "cuda -keys=cuda,gpu -max_num_threads=1024 -model=unknown -thread_warp_size=32", [-1, 16, 64, 49152, 2147483647, 1024, 8, 32], "", 0, []], [[], [["FU", 1, [0, 1, 2, 3]], ["SP", 1, 0, 100352, [7], 1], ["AN", 1, 0, 5], ["AN", 1, 1, 6]]]], "r": [[1.35401e-05, 1.37097e-05, 1.35839e-05, 1.35688e-05, 1.34949e-05, 1.58469e-05, 1.52302e-05, 1.51143e-05, 1.41298e-05, 1.53367e-05], 0, 15.1255, 1651678805], "v": "v0.6"}
{"i": [["[\"fused_roll_window_partition\", 1, 14, 14, 512, 3, 7, \"float16\"]", "cuda -keys=cuda,gpu -max_num_threads=1024 -model=unknown -thread_warp_size=32", [-1, 16, 64, 49152, 2147483647, 1024, 8, 32], "", 0, []], [[], [["FU", 1, [0, 1, 2, 3]], ["SP", 1, 0, 100352, [2], 1], ["AN", 1, 0, 5], ["AN", 1, 1, 6]]]], "r": [[4.00001e-05, 4.00004e-05, 3.99995e-05, 3.99999e-05, 3.99989e-05, 3.99958e-05, 4.00007e-05, 4.0001e-05, 4.00012e-05, 3.99978e-05], 0, 6.44583, 1651678796], "v": "v0.6"}
{"i": [["[\"fused_roll_window_partition\", 1, 14, 14, 512, 3, 7, \"float16\"]", "cuda -keys=cuda,gpu -max_num_threads=1024 -model=unknown -thread_warp_size=32", [-1, 16, 64, 49152, 2147483647, 1024, 8, 32], "", 0, []], [[], [["FU", 1, [0, 1, 2, 3]], ["SP", 1, 0, 100352, [4], 1], ["AN", 1, 0, 5], ["AN", 1, 1, 6]]]], "r": [[2.40652e-05, 2.16652e-05, 2.18469e-05, 2.44024e-05, 2.29767e-05, 2.18986e-05, 2.16958e-05, 2.16919e-05, 2.16949e-05, 2.16936e-05], 0, 17.7039, 1651678808], "v": "v0.6"}
{"i": [["[\"fused_roll_window_partition\", 1, 14, 14, 512, 3, 7, \"float16\"]", "cuda -keys=cuda,gpu -max_num_threads=1024 -model=unknown -thread_warp_size=32", [-1, 16, 64, 49152, 2147483647, 1024, 8, 32], "", 0, []], [[], [["FU", 1, [0, 1, 2, 3]], ["SP", 1, 0, 100352, [16], 1], ["AN", 1, 0, 5], ["AN", 1, 1, 6]]]], "r": [[7.45445e-06, 7.45274e-06, 7.45113e-06, 7.54627e-06, 7.45202e-06, 7.45128e-06, 7.45104e-06, 7.5046e-06, 7.45153e-06, 7.45223e-06], 0, 9.15875, 1651682126], "v": "v0.6"}
{"i": [["[\"fused_roll_window_partition\", 1, 14, 14, 512, 3, 7, \"float16\"]", "cuda -keys=cuda,gpu -max_num_threads=1024 -model=unknown -thread_warp_size=32", [-1, 16, 64, 49152, 2147483647, 1024, 8, 32], "", 0, []], [[], [["FU", 1, [0, 1, 2, 3]], ["SP", 1, 0, 100352, [49], 1], ["AN", 1, 0, 5], ["AN", 1, 1, 6]]]], "r": [[4.12191e-06, 4.45439e-06, 4.24124e-06, 4.26327e-06, 8.59986e-06, 4.09846e-06, 4.09853e-06, 4.29255e-06, 4.16514e-06, 4.15567e-06], 0, 3.42708, 1651682121], "v": "v0.6"}
{"i": [["[\"fused_roll_window_partition\", 1, 14, 14, 512, 3, 7, \"float16\"]", "cuda -keys=cuda,gpu -max_num_threads=1024 -model=unknown -thread_warp_size=32", [-1, 16, 64, 49152, 2147483647, 1024, 8, 32], "", 0, []], [[], [["FU", 1, [0, 1, 2, 3]], ["SP", 1, 0, 100352, [4], 1], ["AN", 1, 0, 5], ["AN", 1, 1, 6]]]], "r": [[2.16209e-05, 2.16156e-05, 2.16174e-05, 2.16163e-05, 2.16193e-05, 2.26167e-05, 2.16067e-05, 2.21704e-05, 2.1711e-05, 2.17831e-05], 0, 15.9454, 1651682133], "v": "v0.6"}
{"i": [["[\"fused_roll_window_partition\", 1, 14, 14, 512, 3, 7, \"float16\"]", "cuda -keys=cuda,gpu -max_num_threads=1024 -model=unknown -thread_warp_size=32", [-1, 16, 64, 49152, 2147483647, 1024, 8, 32], "", 0, []], [[], [["FU", 1, [0, 1, 2, 3]], ["SP", 1, 0, 100352, [2], 1], ["AN", 1, 0, 5], ["AN", 1, 1, 6]]]], "r": [[4.00031e-05, 4.00012e-05, 3.99921e-05, 4.00426e-05, 4.01589e-05, 4.2667e-05, 4.19423e-05, 5.07485e-05, 3.99662e-05, 3.99617e-05], 0, 7.09947, 1651682124], "v": "v0.6"}
{"i": [["[\"fused_roll_window_partition\", 1, 14, 14, 512, 3, 7, \"float16\"]", "cuda -keys=cuda,gpu -max_num_threads=1024 -model=unknown -thread_warp_size=32", [-1, 16, 64, 49152, 2147483647, 1024, 8, 32], "", 0, []], [[], [["FU", 1, [0, 1, 2, 3]], ["SP", 1, 0, 100352, [8], 1], ["AN", 1, 0, 5], ["AN", 1, 1, 6]]]], "r": [[1.21657e-05, 1.32498e-05, 1.28129e-05, 1.23231e-05, 1.3636e-05, 1.2614e-05, 1.39438e-05, 1.31097e-05, 1.43115e-05, 1.30095e-05], 0, 13.654, 1651682131], "v": "v0.6"}
{"i": [["[\"fused_roll_window_partition\", 1, 14, 14, 512, 3, 7, \"float16\"]", "cuda -keys=cuda,gpu -max_num_threads=1024 -model=unknown -thread_warp_size=32", [-1, 16, 64, 49152, 2147483647, 1024, 8, 32], "", 0, []], [[], [["FU", 1, [0, 1, 2, 3]], ["SP", 1, 0, 100352, [32], 1], ["AN", 1, 0, 5], ["AN", 1, 1, 6]]]], "r": [[4.94129e-06, 4.93421e-06, 4.93628e-06, 4.93659e-06, 4.93725e-06, 4.9396e-06, 4.93737e-06, 4.93732e-06, 5.20362e-06, 4.94038e-06], 0, 11.0877, 1651682128], "v": "v0.6"}
{"i": [["[\"fused_roll_window_partition\", 1, 14, 14, 512, 3, 7, \"float16\"]", "cuda -keys=cuda,gpu -max_num_threads=1024 -model=unknown -thread_warp_size=32", [-1, 16, 64, 49152, 2147483647, 1024, 8, 32], "", 0, []], [[], [["FU", 1, [0, 1, 2, 3]], ["SP", 1, 0, 100352, [1], 1], ["AN", 1, 0, 5], ["AN", 1, 1, 6]]]], "r": [[8.03088e-05, 7.74015e-05, 8.07399e-05, 8.09063e-05, 8.67427e-05, 7.73211e-05, 7.72884e-05, 8.55998e-05, 0.000125831, 7.71996e-05], 0, 28.5424, 1651682146], "v": "v0.6"}
{"i": [["[\"fused_roll_window_partition\", 1, 14, 14, 512, 3, 7, \"float16\"]", "cuda -keys=cuda,gpu -max_num_threads=1024 -model=unknown -thread_warp_size=32", [-1, 16, 64, 49152, 2147483647, 1024, 8, 32], "", 0, []], [[], [["FU", 1, [0, 1, 2, 3]], ["SP", 1, 0, 100352, [28], 1], ["AN", 1, 0, 5], ["AN", 1, 1, 6]]]], "r": [[5.396e-06, 5.39669e-06, 5.39459e-06, 5.39387e-06, 5.39648e-06, 5.39603e-06, 5.39553e-06, 5.39444e-06, 5.38829e-06, 5.38849e-06], 0, 18.1253, 1651682135], "v": "v0.6"}
{"i": [["[\"fused_roll_window_partition\", 1, 14, 14, 512, 3, 7, \"float16\"]", "cuda -keys=cuda,gpu -max_num_threads=1024 -model=unknown -thread_warp_size=32", [-1, 16, 64, 49152, 2147483647, 1024, 8, 32], "", 0, []], [[], [["FU", 1, [0, 1, 2, 3]], ["SP", 1, 0, 100352, [7], 1], ["AN", 1, 0, 5], ["AN", 1, 1, 6]]]], "r": [[1.36254e-05, 1.36258e-05, 1.36245e-05, 1.36248e-05, 1.36296e-05, 1.36225e-05, 1.36245e-05, 1.36224e-05, 1.36228e-05, 1.36238e-05], 0, 26.1747, 1651682143], "v": "v0.6"}
{"i": [["[\"fused_roll_window_partition\", 1, 14, 14, 512, 3, 7, \"float16\"]", "cuda -keys=cuda,gpu -max_num_threads=1024 -model=unknown -thread_warp_size=32", [-1, 16, 64, 49152, 2147483647, 1024, 8, 32], "", 0, []], [[], [["FU", 1, [0, 1, 2, 3]], ["SP", 1, 0, 100352, [14], 1], ["AN", 1, 0, 5], ["AN", 1, 1, 6]]]], "r": [[7.93856e-06, 7.9395e-06, 7.93951e-06, 7.94018e-06, 7.93986e-06, 7.93923e-06, 7.99809e-06, 7.95872e-06, 7.9673e-06, 7.99346e-06], 0, 24.0705, 1651682141], "v": "v0.6"}
{"i": [["[\"fused_roll_window_partition\", 1, 14, 14, 512, 3, 7, \"float16\"]", "cuda -keys=cuda,gpu -max_num_threads=1024 -model=unknown -thread_warp_size=32", [-1, 16, 64, 49152, 2147483647, 1024, 8, 32], "", 0, []], [[], [["FU", 1, [0, 1, 2, 3]], ["SP", 1, 0, 100352, [56], 1], ["AN", 1, 0, 5], ["AN", 1, 1, 6]]]], "r": [[2.05845e-05, 4.22962e-06, 4.23117e-06, 4.2505e-06, 4.24353e-06, 4.31446e-06, 4.24856e-06, 4.30727e-06, 4.19017e-06, 4.28425e-06], 0, 31.2702, 1651682149], "v": "v0.6"}
{"i": [["[\"fused_roll_window_partition\", 1, 14, 14, 512, 3, 7, \"float16\"]", "cuda -keys=cuda,gpu -max_num_threads=1024 -model=unknown -thread_warp_size=32", [-1, 16, 64, 49152, 2147483647, 1024, 8, 32], "", 0, []], [[], [["FU", 1, [0, 1, 2, 3]], ["SP", 1, 0, 100352, [64], 1], ["AN", 1, 0, 5], ["AN", 1, 1, 6]]]], "r": [[3.89962e-06, 4.06245e-06, 4.24409e-06, 4.54449e-06, 3.91027e-06, 3.89473e-06, 4.06627e-06, 3.89784e-06, 4.1397e-06, 4.08254e-06], 0, 21.2347, 1651682139], "v": "v0.6"}
