python/models/swin_transformer/kernel_configs/swin_transformer_mul_1_7_7_1024.log
{"i": [["[\"mul\", 1, 7, 7, 1024]", "cuda -keys=cuda,gpu -max_num_threads=1024 -model=unknown -thread_warp_size=32", [-1, 16, 64, 49152, 2147483647, 1024, 8, 32], "", 0, []], [[], [["FU", 2, [0, 1, 2, 3]], ["SP", 2, 0, 50176, [56], 1], ["AN", 2, 0, 5], ["AN", 2, 1, 6]]]], "r": [[3.37332e-06, 3.3742e-06, 3.38107e-06], 0, 1.56426, 1668059469], "v": "v0.6"}
{"i": [["[\"mul\", 1, 7, 7, 1024]", "cuda -keys=cuda,gpu -max_num_threads=1024 -model=unknown -thread_warp_size=32", [-1, 16, 64, 49152, 2147483647, 1024, 8, 32], "", 0, []], [[], [["FU", 2, [0, 1, 2, 3]], ["SP", 2, 0, 50176, [8], 1], ["AN", 2, 0, 5], ["AN", 2, 1, 6]]]], "r": [[7.35047e-06, 7.34582e-06, 7.35278e-06], 0, 0.544642, 1668059467], "v": "v0.6"}
{"i": [["[\"mul\", 1, 7, 7, 1024]", "cuda -keys=cuda,gpu -max_num_threads=1024 -model=unknown -thread_warp_size=32", [-1, 16, 64, 49152, 2147483647, 1024, 8, 32], "", 0, []], [[], [["FU", 2, [0, 1, 2, 3]], ["SP", 2, 0, 50176, [4], 1], ["AN", 2, 0, 5], ["AN", 2, 1, 6]]]], "r": [[1.20627e-05, 1.20563e-05, 1.20499e-05], 0, 0.923944, 1668059468], "v": "v0.6"}
{"i": [["[\"mul\", 1, 7, 7, 1024]", "cuda -keys=cuda,gpu -max_num_threads=1024 -model=unknown -thread_warp_size=32", [-1, 16, 64, 49152, 2147483647, 1024, 8, 32], "", 0, []], [[], [["FU", 2, [0, 1, 2, 3]], ["SP", 2, 0, 50176, [49], 1], ["AN", 2, 0, 5], ["AN", 2, 1, 6]]]], "r": [[3.3046e-06, 3.3027e-06, 3.30522e-06], 0, 1.24971, 1668059468], "v": "v0.6"}
{"i": [["[\"mul\", 1, 7, 7, 1024]", "cuda -keys=cuda,gpu -max_num_threads=1024 -model=unknown -thread_warp_size=32", [-1, 16, 64, 49152, 2147483647, 1024, 8, 32], "", 0, []], [[], [["FU", 2, [0, 1, 2, 3]], ["SP", 2, 0, 50176, [2], 1], ["AN", 2, 0, 5], ["AN", 2, 1, 6]]]], "r": [[2.13891e-05, 2.13943e-05, 2.13835e-05], 0, 1.94127, 1668059469], "v": "v0.6"}
{"i": [["[\"mul\", 1, 7, 7, 1024]", "cuda -keys=cuda,gpu -max_num_threads=1024 -model=unknown -thread_warp_size=32", [-1, 16, 64, 49152, 2147483647, 1024, 8, 32], "", 0, []], [[], [["FU", 2, [0, 1, 2, 3]], ["SP", 2, 0, 50176, [28], 1], ["AN", 2, 0, 5], ["AN", 2, 1, 6]]]], "r": [[3.88128e-06, 3.88367e-06, 3.88774e-06], 0, 2.27173, 1668059469], "v": "v0.6"}
{"i": [["[\"mul\", 1, 7, 7, 1024]", "cuda -keys=cuda,gpu -max_num_threads=1024 -model=unknown -thread_warp_size=32", [-1, 16, 64, 49152, 2147483647, 1024, 8, 32], "", 0, []], [[], [["FU", 2, [0, 1, 2, 3]], ["SP", 2, 0, 50176, [32], 1], ["AN", 2, 0, 5], ["AN", 2, 1, 6]]]], "r": [[3.59018e-06, 3.59252e-06, 3.59408e-06], 0, 3.29584, 1668059470], "v": "v0.6"}
{"i": [["[\"mul\", 1, 7, 7, 1024]", "cuda -keys=cuda,gpu -max_num_threads=1024 -model=unknown -thread_warp_size=32", [-1, 16, 64, 49152, 2147483647, 1024, 8, 32], "", 0, []], [[], [["FU", 2, [0, 1, 2, 3]], ["SP", 2, 0, 50176, [64], 1], ["AN", 2, 0, 5], ["AN", 2, 1, 6]]]], "r": [[3.09951e-06, 3.10118e-06, 3.10156e-06], 0, 2.9762, 1668059470], "v": "v0.6"}
{"i": [["[\"mul\", 1, 7, 7, 1024]", "cuda -keys=cuda,gpu -max_num_threads=1024 -model=unknown -thread_warp_size=32", [-1, 16, 64, 49152, 2147483647, 1024, 8, 32], "", 0, []], [[], [["FU", 2, [0, 1, 2, 3]], ["SP", 2, 0, 50176, [7], 1], ["AN", 2, 0, 5], ["AN", 2, 1, 6]]]], "r": [[8.07019e-06, 8.07022e-06, 8.06292e-06], 0, 2.58362, 1668059470], "v": "v0.6"}
{"i": [["[\"mul\", 1, 7, 7, 1024]", "cuda -keys=cuda,gpu -max_num_threads=1024 -model=unknown -thread_warp_size=32", [-1, 16, 64, 49152, 2147483647, 1024, 8, 32], "", 0, []], [[], [["FU", 2, [0, 1, 2, 3]], ["SP", 2, 0, 50176, [16], 1], ["AN", 2, 0, 5], ["AN", 2, 1, 6]]]], "r": [[5.14841e-06, 5.14942e-06, 5.14439e-06], 0, 4.34695, 1668059471], "v": "v0.6"}
{"i": [["[\"mul\", 1, 7, 7, 1024]", "cuda -keys=cuda,gpu -max_num_threads=1024 -model=unknown -thread_warp_size=32", [-1, 16, 64, 49152, 2147483647, 1024, 8, 32], "", 0, []], [[], [["FU", 2, [0, 1, 2, 3]], ["SP", 2, 0, 50176, [1], 1], ["AN", 2, 0, 5], ["AN", 2, 1, 6]]]], "r": [[3.99266e-05, 3.99106e-05, 3.99042e-05], 0, 3.6392, 1668059471], "v": "v0.6"}
{"i": [["[\"mul\", 1, 7, 7, 1024]", "cuda -keys=cuda,gpu -max_num_threads=1024 -model=unknown -thread_warp_size=32", [-1, 16, 64, 49152, 2147483647, 1024, 8, 32], "", 0, []], [[], [["FU", 2, [0, 1, 2, 3]], ["SP", 2, 0, 50176, [14], 1], ["AN", 2, 0, 5], ["AN", 2, 1, 6]]]], "r": [[5.22005e-06, 5.22259e-06, 5.22221e-06], 0, 4.00879, 1668059471], "v": "v0.6"}
{"i": [["[\"mul\", 1, 7, 7, 1024]", "cuda -keys=cuda,gpu -max_num_threads=1024 -model=unknown -thread_warp_size=32", [-1, 16, 64, 49152, 2147483647, 1024, 8, 32], "", 0, []], [[], [["FU", 2, [0, 1, 2, 3]], ["SP", 2, 0, 50176, [32], 1], ["AN", 2, 0, 5], ["AN", 2, 1, 6]]]], "r": [[3.70584e-06, 3.70504e-06, 3.70766e-06], 0, 2.28285, 1668061612], "v": "v0.6"}
{"i": [["[\"mul\", 1, 7, 7, 1024]", "cuda -keys=cuda,gpu -max_num_threads=1024 -model=unknown -thread_warp_size=32", [-1, 16, 64, 49152, 2147483647, 1024, 8, 32], "", 0, []], [[], [["FU", 2, [0, 1, 2, 3]], ["SP", 2, 0, 50176, [28], 1], ["AN", 2, 0, 5], ["AN", 2, 1, 6]]]], "r": [[4.00295e-06, 3.99533e-06, 4.00341e-06], 0, 0.53883, 1668061610], "v": "v0.6"}
{"i": [["[\"mul\", 1, 7, 7, 1024]", "cuda -keys=cuda,gpu -max_num_threads=1024 -model=unknown -thread_warp_size=32", [-1, 16, 64, 49152, 2147483647, 1024, 8, 32], "", 0, []], [[], [["FU", 2, [0, 1, 2, 3]], ["SP", 2, 0, 50176, [14], 1], ["AN", 2, 0, 5], ["AN", 2, 1, 6]]]], "r": [[5.30516e-06, 5.31043e-06, 5.306e-06], 0, 0.909873, 1668061610], "v": "v0.6"}
{"i": [["[\"mul\", 1, 7, 7, 1024]", "cuda -keys=cuda,gpu -max_num_threads=1024 -model=unknown -thread_warp_size=32", [-1, 16, 64, 49152, 2147483647, 1024, 8, 32], "", 0, []], [[], [["FU", 2, [0, 1, 2, 3]], ["SP", 2, 0, 50176, [16], 1], ["AN", 2, 0, 5], ["AN", 2, 1, 6]]]], "r": [[5.14184e-06, 5.14195e-06, 5.15037e-06], 0, 1.2537, 1668061610], "v": "v0.6"}
{"i": [["[\"mul\", 1, 7, 7, 1024]", "cuda -keys=cuda,gpu -max_num_threads=1024 -model=unknown -thread_warp_size=32", [-1, 16, 64, 49152, 2147483647, 1024, 8, 32], "", 0, []], [[], [["FU", 2, [0, 1, 2, 3]], ["SP", 2, 0, 50176, [7], 1], ["AN", 2, 0, 5], ["AN", 2, 1, 6]]]], "r": [[7.85075e-06, 7.84871e-06, 7.84927e-06], 0, 1.56604, 1668061611], "v": "v0.6"}
{"i": [["[\"mul\", 1, 7, 7, 1024]", "cuda -keys=cuda,gpu -max_num_threads=1024 -model=unknown -thread_warp_size=32", [-1, 16, 64, 49152, 2147483647, 1024, 8, 32], "", 0, []], [[], [["FU", 2, [0, 1, 2, 3]], ["SP", 2, 0, 50176, [49], 1], ["AN", 2, 0, 5], ["AN", 2, 1, 6]]]], "r": [[3.36262e-06, 3.36547e-06, 3.36609e-06], 0, 1.94926, 1668061611], "v": "v0.6"}
{"i": [["[\"mul\", 1, 7, 7, 1024]", "cuda -keys=cuda,gpu -max_num_threads=1024 -model=unknown -thread_warp_size=32", [-1, 16, 64, 49152, 2147483647, 1024, 8, 32], "", 0, []], [[], [["FU", 2, [0, 1, 2, 3]], ["SP", 2, 0, 50176, [64], 1], ["AN", 2, 0, 5], ["AN", 2, 1, 6]]]], "r": [[3.1223e-06, 3.12198e-06, 3.12429e-06], 0, 2.60437, 1668061612], "v": "v0.6"}
{"i": [["[\"mul\", 1, 7, 7, 1024]", "cuda -keys=cuda,gpu -max_num_threads=1024 -model=unknown -thread_warp_size=32", [-1, 16, 64, 49152, 2147483647, 1024, 8, 32], "", 0, []], [[], [["FU", 2, [0, 1, 2, 3]], ["SP", 2, 0, 50176, [8], 1], ["AN", 2, 0, 5], ["AN", 2, 1, 6]]]], "r": [[7.28472e-06, 7.28671e-06, 7.28149e-06], 0, 2.97309, 1668061612], "v": "v0.6"}
{"i": [["[\"mul\", 1, 7, 7, 1024]", "cuda -keys=cuda,gpu -max_num_threads=1024 -model=unknown -thread_warp_size=32", [-1, 16, 64, 49152, 2147483647, 1024, 8, 32], "", 0, []], [[], [["FU", 2, [0, 1, 2, 3]], ["SP", 2, 0, 50176, [4], 1], ["AN", 2, 0, 5], ["AN", 2, 1, 6]]]], "r": [[1.20606e-05, 1.20649e-05, 1.2061e-05], 0, 4.02009, 1668061613], "v": "v0.6"}
{"i": [["[\"mul\", 1, 7, 7, 1024]", "cuda -keys=cuda,gpu -max_num_threads=1024 -model=unknown -thread_warp_size=32", [-1, 16, 64, 49152, 2147483647, 1024, 8, 32], "", 0, []], [[], [["FU", 2, [0, 1, 2, 3]], ["SP", 2, 0, 50176, [1], 1], ["AN", 2, 0, 5], ["AN", 2, 1, 6]]]], "r": [[3.99558e-05, 3.99534e-05, 3.99595e-05], 0, 3.31687, 1668061613], "v": "v0.6"}
{"i": [["[\"mul\", 1, 7, 7, 1024]", "cuda -keys=cuda,gpu -max_num_threads=1024 -model=unknown -thread_warp_size=32", [-1, 16, 64, 49152, 2147483647, 1024, 8, 32], "", 0, []], [[], [["FU", 2, [0, 1, 2, 3]], ["SP", 2, 0, 50176, [56], 1], ["AN", 2, 0, 5], ["AN", 2, 1, 6]]]], "r": [[3.33602e-06, 3.33558e-06, 3.34094e-06], 0, 3.65863, 1668061613], "v": "v0.6"}
{"i": [["[\"mul\", 1, 7, 7, 1024]", "cuda -keys=cuda,gpu -max_num_threads=1024 -model=unknown -thread_warp_size=32", [-1, 16, 64, 49152, 2147483647, 1024, 8, 32], "", 0, []], [[], [["FU", 2, [0, 1, 2, 3]], ["SP", 2, 0, 50176, [2], 1], ["AN", 2, 0, 5], ["AN", 2, 1, 6]]]], "r": [[2.12891e-05, 2.12915e-05, 2.12903e-05], 0, 4.3664, 1668061614], "v": "v0.6"}
