python/models/swin_transformer/kernel_configs/swin_transformer_te_slice_1_14_14_512_[1, 0]_2.log
{"i": [["[\"te_slice\", 1, 14, 14, 512, [1, 0], 2, \"float16\"]", "cuda -keys=cuda,gpu -max_num_threads=1024 -model=unknown -thread_warp_size=32", [-1, 16, 64, 49152, 2147483647, 1024, 8, 32], "", 0, []], [[], [["FU", 1, [0, 1, 2, 3]], ["SP", 1, 0, 25088, [28], 1], ["AN", 1, 0, 5], ["AN", 1, 1, 6]]]], "r": [[3.17825e-06, 3.17809e-06, 3.17899e-06], 0, 1.65658, 1668065451], "v": "v0.6"}
{"i": [["[\"te_slice\", 1, 14, 14, 512, [1, 0], 2, \"float16\"]", "cuda -keys=cuda,gpu -max_num_threads=1024 -model=unknown -thread_warp_size=32", [-1, 16, 64, 49152, 2147483647, 1024, 8, 32], "", 0, []], [[], [["FU", 1, [0, 1, 2, 3]], ["SP", 1, 0, 25088, [2], 1], ["AN", 1, 0, 5], ["AN", 1, 1, 6]]]], "r": [[1.19697e-05, 1.1981e-05, 1.19794e-05], 0, 2.04013, 1668065452], "v": "v0.6"}
{"i": [["[\"te_slice\", 1, 14, 14, 512, [1, 0], 2, \"float16\"]", "cuda -keys=cuda,gpu -max_num_threads=1024 -model=unknown -thread_warp_size=32", [-1, 16, 64, 49152, 2147483647, 1024, 8, 32], "", 0, []], [[], [["FU", 1, [0, 1, 2, 3]], ["SP", 1, 0, 25088, [14], 1], ["AN", 1, 0, 5], ["AN", 1, 1, 6]]]], "r": [[3.90291e-06, 3.91534e-06, 3.91474e-06], 0, 2.38248, 1668065452], "v": "v0.6"}
{"i": [["[\"te_slice\", 1, 14, 14, 512, [1, 0], 2, \"float16\"]", "cuda -keys=cuda,gpu -max_num_threads=1024 -model=unknown -thread_warp_size=32", [-1, 16, 64, 49152, 2147483647, 1024, 8, 32], "", 0, []], [[], [["FU", 1, [0, 1, 2, 3]], ["SP", 1, 0, 25088, [32], 1], ["AN", 1, 0, 5], ["AN", 1, 1, 6]]]], "r": [[3.09588e-06, 3.09575e-06, 3.09373e-06], 0, 0.97678, 1668065450], "v": "v0.6"}
{"i": [["[\"te_slice\", 1, 14, 14, 512, [1, 0], 2, \"float16\"]", "cuda -keys=cuda,gpu -max_num_threads=1024 -model=unknown -thread_warp_size=32", [-1, 16, 64, 49152, 2147483647, 1024, 8, 32], "", 0, []], [[], [["FU", 1, [0, 1, 2, 3]], ["SP", 1, 0, 25088, [56], 1], ["AN", 1, 0, 5], ["AN", 1, 1, 6]]]], "r": [[3.15162e-06, 3.15549e-06, 3.15395e-06], 0, 0.58791, 1668065450], "v": "v0.6"}
{"i": [["[\"te_slice\", 1, 14, 14, 512, [1, 0], 2, \"float16\"]", "cuda -keys=cuda,gpu -max_num_threads=1024 -model=unknown -thread_warp_size=32", [-1, 16, 64, 49152, 2147483647, 1024, 8, 32], "", 0, []], [[], [["FU", 1, [0, 1, 2, 3]], ["SP", 1, 0, 25088, [49], 1], ["AN", 1, 0, 5], ["AN", 1, 1, 6]]]], "r": [[2.97328e-06, 2.97162e-06, 2.97e-06], 0, 1.31051, 1668065451], "v": "v0.6"}
{"i": [["[\"te_slice\", 1, 14, 14, 512, [1, 0], 2, \"float16\"]", "cuda -keys=cuda,gpu -max_num_threads=1024 -model=unknown -thread_warp_size=32", [-1, 16, 64, 49152, 2147483647, 1024, 8, 32], "", 0, []], [[], [["FU", 1, [0, 1, 2, 3]], ["SP", 1, 0, 25088, [4], 1], ["AN", 1, 0, 5], ["AN", 1, 1, 6]]]], "r": [[7.36073e-06, 7.37508e-06, 7.37503e-06], 0, 2.7287, 1668065452], "v": "v0.6"}
{"i": [["[\"te_slice\", 1, 14, 14, 512, [1, 0], 2, \"float16\"]", "cuda -keys=cuda,gpu -max_num_threads=1024 -model=unknown -thread_warp_size=32", [-1, 16, 64, 49152, 2147483647, 1024, 8, 32], "", 0, []], [[], [["FU", 1, [0, 1, 2, 3]], ["SP", 1, 0, 25088, [7], 1], ["AN", 1, 0, 5], ["AN", 1, 1, 6]]]], "r": [[5.34775e-06, 5.36656e-06, 5.36272e-06], 0, 3.78178, 1668065453], "v": "v0.6"}
{"i": [["[\"te_slice\", 1, 14, 14, 512, [1, 0], 2, \"float16\"]", "cuda -keys=cuda,gpu -max_num_threads=1024 -model=unknown -thread_warp_size=32", [-1, 16, 64, 49152, 2147483647, 1024, 8, 32], "", 0, []], [[], [["FU", 1, [0, 1, 2, 3]], ["SP", 1, 0, 25088, [16], 1], ["AN", 1, 0, 5], ["AN", 1, 1, 6]]]], "r": [[3.58638e-06, 3.57468e-06, 3.5677e-06], 0, 3.45461, 1668065453], "v": "v0.6"}
{"i": [["[\"te_slice\", 1, 14, 14, 512, [1, 0], 2, \"float16\"]", "cuda -keys=cuda,gpu -max_num_threads=1024 -model=unknown -thread_warp_size=32", [-1, 16, 64, 49152, 2147483647, 1024, 8, 32], "", 0, []], [[], [["FU", 1, [0, 1, 2, 3]], ["SP", 1, 0, 25088, [8], 1], ["AN", 1, 0, 5], ["AN", 1, 1, 6]]]], "r": [[5.10952e-06, 5.12573e-06, 5.12578e-06], 0, 3.10663, 1668065453], "v": "v0.6"}
{"i": [["[\"te_slice\", 1, 14, 14, 512, [1, 0], 2, \"float16\"]", "cuda -keys=cuda,gpu -max_num_threads=1024 -model=unknown -thread_warp_size=32", [-1, 16, 64, 49152, 2147483647, 1024, 8, 32], "", 0, []], [[], [["FU", 1, [0, 1, 2, 3]], ["SP", 1, 0, 25088, [64], 1], ["AN", 1, 0, 5], ["AN", 1, 1, 6]]]], "r": [[2.89885e-06, 2.8982e-06, 2.89803e-06], 0, 4.16653, 1668065454], "v": "v0.6"}
{"i": [["[\"te_slice\", 1, 14, 14, 512, [1, 0], 2, \"float16\"]", "cuda -keys=cuda,gpu -max_num_threads=1024 -model=unknown -thread_warp_size=32", [-1, 16, 64, 49152, 2147483647, 1024, 8, 32], "", 0, []], [[], [["FU", 1, [0, 1, 2, 3]], ["SP", 1, 0, 25088, [1], 1], ["AN", 1, 0, 5], ["AN", 1, 1, 6]]]], "r": [[2.15622e-05, 2.15797e-05, 2.15764e-05], 0, 4.49196, 1668065454], "v": "v0.6"}
