python/models/swin_transformer/kernel_configs/swin_transformer_fused_reshape_permute_1_28_28_256_7_8
{"i": [["[\"fused_reshape_permute\", 1, 28, 28, 256, 7, 8, \"float16\"]", "cuda -keys=cuda,gpu -max_num_threads=1024 -model=unknown -thread_warp_size=32", [-1, 16, 64, 49152, 2147483647, 1024, 8, 32], "", 0, []], [[], [["FU", 1, [0, 1, 2, 3, 4]], ["SP", 1, 0, 602112, [12], 1], ["AN", 1, 0, 5], ["AN", 1, 1, 6]]]], "r": [[3.99938e-05, 4.00052e-05, 4.00165e-05], 0, 1.83264, 1668103504], "v": "v0.6"}
{"i": [["[\"fused_reshape_permute\", 1, 28, 28, 256, 7, 8, \"float16\"]", "cuda -keys=cuda,gpu -max_num_threads=1024 -model=unknown -thread_warp_size=32", [-1, 16, 64, 49152, 2147483647, 1024, 8, 32], "", 0, []], [[], [["FU", 1, [0, 1, 2, 3, 4]], ["SP", 1, 0, 602112, [7], 1], ["AN", 1, 0, 5], ["AN", 1, 1, 6]]]], "r": [[6.66642e-05, 6.66843e-05, 6.66812e-05], 0, 2.2053, 1668103504], "v": "v0.6"}
{"i": [["[\"fused_reshape_permute\", 1, 28, 28, 256, 7, 8, \"float16\"]", "cuda -keys=cuda,gpu -max_num_threads=1024 -model=unknown -thread_warp_size=32", [-1, 16, 64, 49152, 2147483647, 1024, 8, 32], "", 0, []], [[], [["FU", 1, [0, 1, 2, 3, 4]], ["SP", 1, 0, 602112, [48], 1], ["AN", 1, 0, 5], ["AN", 1, 1, 6]]]], "r": [[1.20126e-05, 1.2025e-05, 1.20262e-05], 0, 2.57544, 1668103505], "v": "v0.6"}
{"i": [["[\"fused_reshape_permute\", 1, 28, 28, 256, 7, 8, \"float16\"]", "cuda -keys=cuda,gpu -max_num_threads=1024 -model=unknown -thread_warp_size=32", [-1, 16, 64, 49152, 2147483647, 1024, 8, 32], "", 0, []], [[], [["FU", 1, [0, 1, 2, 3, 4]], ["SP", 1, 0, 602112, [4], 1], ["AN", 1, 0, 5], ["AN", 1, 1, 6]]]], "r": [[0.000114501, 0.000114529, 0.000114507], 0, 0.661862, 1668103503], "v": "v0.6"}
{"i": [["[\"fused_reshape_permute\", 1, 28, 28, 256, 7, 8, \"float16\"]", "cuda -keys=cuda,gpu -max_num_threads=1024 -model=unknown -thread_warp_size=32", [-1, 16, 64, 49152, 2147483647, 1024, 8, 32], "", 0, []], [[], [["FU", 1, [0, 1, 2, 3, 4]], ["SP", 1, 0, 602112, [3], 1], ["AN", 1, 0, 5], ["AN", 1, 1, 6]]]], "r": [[0.000151789, 0.000151758, 0.000151798], 0, 0.999159, 1668103503], "v": "v0.6"}
{"i": [["[\"fused_reshape_permute\", 1, 28, 28, 256, 7, 8, \"float16\"]", "cuda -keys=cuda,gpu -max_num_threads=1024 -model=unknown -thread_warp_size=32", [-1, 16, 64, 49152, 2147483647, 1024, 8, 32], "", 0, []], [[], [["FU", 1, [0, 1, 2, 3, 4]], ["SP", 1, 0, 602112, [49], 1], ["AN", 1, 0, 5], ["AN", 1, 1, 6]]]], "r": [[1.18264e-05, 1.18397e-05, 1.18287e-05], 0, 4.18148, 1668103506], "v": "v0.6"}
{"i": [["[\"fused_reshape_permute\", 1, 28, 28, 256, 7, 8, \"float16\"]", "cuda -keys=cuda,gpu -max_num_threads=1024 -model=unknown -thread_warp_size=32", [-1, 16, 64, 49152, 2147483647, 1024, 8, 32], "", 0, []], [[], [["FU", 1, [0, 1, 2, 3, 4]], ["SP", 1, 0, 602112, [64], 1], ["AN", 1, 0, 5], ["AN", 1, 1, 6]]]], "r": [[9.66293e-06, 9.67639e-06, 9.67255e-06], 0, 1.43083, 1668103504], "v": "v0.6"}
{"i": [["[\"fused_reshape_permute\", 1, 28, 28, 256, 7, 8, \"float16\"]", "cuda -keys=cuda,gpu -max_num_threads=1024 -model=unknown -thread_warp_size=32", [-1, 16, 64, 49152, 2147483647, 1024, 8, 32], "", 0, []], [[], [["FU", 1, [0, 1, 2, 3, 4]], ["SP", 1, 0, 602112, [24], 1], ["AN", 1, 0, 5], ["AN", 1, 1, 6]]]], "r": [[2.16075e-05, 2.16283e-05, 2.16159e-05], 0, 3.38736, 1668103506], "v": "v0.6"}
{"i": [["[\"fused_reshape_permute\", 1, 28, 28, 256, 7, 8, \"float16\"]", "cuda -keys=cuda,gpu -max_num_threads=1024 -model=unknown -thread_warp_size=32", [-1, 16, 64, 49152, 2147483647, 1024, 8, 32], "", 0, []], [[], [["FU", 1, [0, 1, 2, 3, 4]], ["SP", 1, 0, 602112, [6], 1], ["AN", 1, 0, 5], ["AN", 1, 1, 6]]]], "r": [[7.73682e-05, 7.73357e-05, 7.73619e-05], 0, 4.92956, 1668103507], "v": "v0.6"}
{"i": [["[\"fused_reshape_permute\", 1, 28, 28, 256, 7, 8, \"float16\"]", "cuda -keys=cuda,gpu -max_num_threads=1024 -model=unknown -thread_warp_size=32", [-1, 16, 64, 49152, 2147483647, 1024, 8, 32], "", 0, []], [[], [["FU", 1, [0, 1, 2, 3, 4]], ["SP", 1, 0, 602112, [21], 1], ["AN", 1, 0, 5], ["AN", 1, 1, 6]]]], "r": [[2.4098e-05, 2.41009e-05, 2.40976e-05], 0, 3.03567, 1668103505], "v": "v0.6"}
{"i": [["[\"fused_reshape_permute\", 1, 28, 28, 256, 7, 8, \"float16\"]", "cuda -keys=cuda,gpu -max_num_threads=1024 -model=unknown -thread_warp_size=32", [-1, 16, 64, 49152, 2147483647, 1024, 8, 32], "", 0, []], [[], [["FU", 1, [0, 1, 2, 3, 4]], ["SP", 1, 0, 602112, [56], 1], ["AN", 1, 0, 5], ["AN", 1, 1, 6]]]], "r": [[1.0642e-05, 1.06509e-05, 1.0651e-05], 0, 4.55196, 1668103507], "v": "v0.6"}
{"i": [["[\"fused_reshape_permute\", 1, 28, 28, 256, 7, 8, \"float16\"]", "cuda -keys=cuda,gpu -max_num_threads=1024 -model=unknown -thread_warp_size=32", [-1, 16, 64, 49152, 2147483647, 1024, 8, 32], "", 0, []], [[], [["FU", 1, [0, 1, 2, 3, 4]], ["SP", 1, 0, 602112, [14], 1], ["AN", 1, 0, 5], ["AN", 1, 1, 6]]]], "r": [[3.4974e-05, 3.49807e-05, 3.49861e-05], 0, 5.68691, 1668103508], "v": "v0.6"}
{"i": [["[\"fused_reshape_permute\", 1, 28, 28, 256, 7, 8, \"float16\"]", "cuda -keys=cuda,gpu -max_num_threads=1024 -model=unknown -thread_warp_size=32", [-1, 16, 64, 49152, 2147483647, 1024, 8, 32], "", 0, []], [[], [["FU", 1, [0, 1, 2, 3, 4]], ["SP", 1, 0, 602112, [16], 1], ["AN", 1, 0, 5], ["AN", 1, 1, 6]]]], "r": [[3.0787e-05, 3.08066e-05, 3.08038e-05], 0, 6.86133, 1668103509], "v": "v0.6"}
{"i": [["[\"fused_reshape_permute\", 1, 28, 28, 256, 7, 8, \"float16\"]", "cuda -keys=cuda,gpu -max_num_threads=1024 -model=unknown -thread_warp_size=32", [-1, 16, 64, 49152, 2147483647, 1024, 8, 32], "", 0, []], [[], [["FU", 1, [0, 1, 2, 3, 4]], ["SP", 1, 0, 602112, [1], 1], ["AN", 1, 0, 5], ["AN", 1, 1, 6]]]], "r": [[0.000449443, 0.000449439, 0.00044951], 0, 5.28118, 1668103508], "v": "v0.6"}
{"i": [["[\"fused_reshape_permute\", 1, 28, 28, 256, 7, 8, \"float16\"]", "cuda -keys=cuda,gpu -max_num_threads=1024 -model=unknown -thread_warp_size=32", [-1, 16, 64, 49152, 2147483647, 1024, 8, 32], "", 0, []], [[], [["FU", 1, [0, 1, 2, 3, 4]], ["SP", 1, 0, 602112, [42], 1], ["AN", 1, 0, 5], ["AN", 1, 1, 6]]]], "r": [[1.32619e-05, 1.32753e-05, 1.32741e-05], 0, 6.0648, 1668103508], "v": "v0.6"}
{"i": [["[\"fused_reshape_permute\", 1, 28, 28, 256, 7, 8, \"float16\"]", "cuda -keys=cuda,gpu -max_num_threads=1024 -model=unknown -thread_warp_size=32", [-1, 16, 64, 49152, 2147483647, 1024, 8, 32], "", 0, []], [[], [["FU", 1, [0, 1, 2, 3, 4]], ["SP", 1, 0, 602112, [28], 1], ["AN", 1, 0, 5], ["AN", 1, 1, 6]]]], "r": [[1.90512e-05, 1.90773e-05, 1.90709e-05], 0, 3.75424, 1668103506], "v": "v0.6"}
{"i": [["[\"fused_reshape_permute\", 1, 28, 28, 256, 7, 8, \"float16\"]", "cuda -keys=cuda,gpu -max_num_threads=1024 -model=unknown -thread_warp_size=32", [-1, 16, 64, 49152, 2147483647, 1024, 8, 32], "", 0, []], [[], [["FU", 1, [0, 1, 2, 3, 4]], ["SP", 1, 0, 602112, [32], 1], ["AN", 1, 0, 5], ["AN", 1, 1, 6]]]], "r": [[1.69259e-05, 1.69426e-05, 1.69404e-05], 0, 7.21051, 1668103509], "v": "v0.6"}
{"i": [["[\"fused_reshape_permute\", 1, 28, 28, 256, 7, 8, \"float16\"]", "cuda -keys=cuda,gpu -max_num_threads=1024 -model=unknown -thread_warp_size=32", [-1, 16, 64, 49152, 2147483647, 1024, 8, 32], "", 0, []], [[], [["FU", 1, [0, 1, 2, 3, 4]], ["SP", 1, 0, 602112, [2], 1], ["AN", 1, 0, 5], ["AN", 1, 1, 6]]]], "r": [[0.000226046, 0.000226045, 0.000226052], 0, 6.47262, 1668103509], "v": "v0.6"}
{"i": [["[\"fused_reshape_permute\", 1, 28, 28, 256, 7, 8, \"float16\"]", "cuda -keys=cuda,gpu -max_num_threads=1024 -model=unknown -thread_warp_size=32", [-1, 16, 64, 49152, 2147483647, 1024, 8, 32], "", 0, []], [[], [["FU", 1, [0, 1, 2, 3, 4]], ["SP", 1, 0, 602112, [8], 1], ["AN", 1, 0, 5], ["AN", 1, 1, 6]]]], "r": [[5.86516e-05, 5.86839e-05, 5.86772e-05], 0, 7.59771, 1668103510], "v": "v0.6"}
