python/models/swin_transformer/kernel_configs/swin_transformer_layer_normalization_normal_1_28_28_256_1_0_float16.log
{"i": [["[\"layer_normalization_normal\", 1, 28, 28, 256, 1, 0, \"float16\"]", "cuda -keys=cuda,gpu -max_num_threads=1024 -model=unknown -thread_warp_size=32", [-1, 16, 64, 49152, 2147483647, 1024, 8, 32], "", 0, []], [[], [["CHW", 4, "local"], ["CI", 4], ["CI", 3], ["FU", 5, [0, 1]], ["SP", 5, 0, 200704, [32], 1], ["AN", 5, 0, 5], ["AN", 5, 1, 6]]]], "r": [[7.36128e-06, 7.36282e-06, 7.36177e-06], 0, 2.93902, 1668020754], "v": "v0.6"}
{"i": [["[\"layer_normalization_normal\", 1, 28, 28, 256, 1, 0, \"float16\"]", "cuda -keys=cuda,gpu -max_num_threads=1024 -model=unknown -thread_warp_size=32", [-1, 16, 64, 49152, 2147483647, 1024, 8, 32], "", 0, []], [[], [["CHW", 4, "local"], ["CI", 4], ["CI", 3], ["FU", 5, [0, 1]], ["SP", 5, 0, 200704, [7], 1], ["AN", 5, 0, 5], ["AN", 5, 1, 6]]]], "r": [[2.42552e-05, 2.4279e-05, 2.42693e-05], 0, 0.576519, 1668020752], "v": "v0.6"}
{"i": [["[\"layer_normalization_normal\", 1, 28, 28, 256, 1, 0, \"float16\"]", "cuda -keys=cuda,gpu -max_num_threads=1024 -model=unknown -thread_warp_size=32", [-1, 16, 64, 49152, 2147483647, 1024, 8, 32], "", 0, []], [[], [["CHW", 4, "local"], ["CI", 4], ["CI", 3], ["FU", 5, [0, 1]], ["SP", 5, 0, 200704, [2], 1], ["AN", 5, 0, 5], ["AN", 5, 1, 6]]]], "r": [[7.74814e-05, 7.74839e-05, 7.74861e-05], 0, 1.5683, 1668020753], "v": "v0.6"}
{"i": [["[\"layer_normalization_normal\", 1, 28, 28, 256, 1, 0, \"float16\"]", "cuda -keys=cuda,gpu -max_num_threads=1024 -model=unknown -thread_warp_size=32", [-1, 16, 64, 49152, 2147483647, 1024, 8, 32], "", 0, []], [[], [["CHW", 4, "local"], ["CI", 4], ["CI", 3], ["FU", 5, [0, 1]], ["SP", 5, 0, 200704, [4], 1], ["AN", 5, 0, 5], ["AN", 5, 1, 6]]]], "r": [[4.02266e-05, 4.02191e-05, 4.02301e-05], 0, 0.946014, 1668020752], "v": "v0.6"}
{"i": [["[\"layer_normalization_normal\", 1, 28, 28, 256, 1, 0, \"float16\"]", "cuda -keys=cuda,gpu -max_num_threads=1024 -model=unknown -thread_warp_size=32", [-1, 16, 64, 49152, 2147483647, 1024, 8, 32], "", 0, []], [[], [["CHW", 4, "local"], ["CI", 4], ["CI", 3], ["FU", 5, [0, 1]], ["SP", 5, 0, 200704, [49], 1], ["AN", 5, 0, 5], ["AN", 5, 1, 6]]]], "r": [[5.85988e-06, 5.86109e-06, 5.86319e-06], 0, 1.9375, 1668020753], "v": "v0.6"}
{"i": [["[\"layer_normalization_normal\", 1, 28, 28, 256, 1, 0, \"float16\"]", "cuda -keys=cuda,gpu -max_num_threads=1024 -model=unknown -thread_warp_size=32", [-1, 16, 64, 49152, 2147483647, 1024, 8, 32], "", 0, []], [[], [["CHW", 4, "local"], ["CI", 4], ["CI", 3], ["FU", 5, [0, 1]], ["SP", 5, 0, 200704, [64], 1], ["AN", 5, 0, 5], ["AN", 5, 1, 6]]]], "r": [[5.03482e-06, 5.03636e-06, 5.03093e-06], 0, 2.57594, 1668020754], "v": "v0.6"}
{"i": [["[\"layer_normalization_normal\", 1, 28, 28, 256, 1, 0, \"float16\"]", "cuda -keys=cuda,gpu -max_num_threads=1024 -model=unknown -thread_warp_size=32", [-1, 16, 64, 49152, 2147483647, 1024, 8, 32], "", 0, []], [[], [["CHW", 4, "local"], ["CI", 4], ["CI", 3], ["FU", 5, [0, 1]], ["SP", 5, 0, 200704, [8], 1], ["AN", 5, 0, 5], ["AN", 5, 1, 6]]]], "r": [[2.15344e-05, 2.15378e-05, 2.15284e-05], 0, 3.58046, 1668020755], "v": "v0.6"}
{"i": [["[\"layer_normalization_normal\", 1, 28, 28, 256, 1, 0, \"float16\"]", "cuda -keys=cuda,gpu -max_num_threads=1024 -model=unknown -thread_warp_size=32", [-1, 16, 64, 49152, 2147483647, 1024, 8, 32], "", 0, []], [[], [["CHW", 4, "local"], ["CI", 4], ["CI", 3], ["FU", 5, [0, 1]], ["SP", 5, 0, 200704, [16], 1], ["AN", 5, 0, 5], ["AN", 5, 1, 6]]]], "r": [[1.22619e-05, 1.22703e-05, 1.22583e-05], 0, 1.23726, 1668020752], "v": "v0.6"}
{"i": [["[\"layer_normalization_normal\", 1, 28, 28, 256, 1, 0, \"float16\"]", "cuda -keys=cuda,gpu -max_num_threads=1024 -model=unknown -thread_warp_size=32", [-1, 16, 64, 49152, 2147483647, 1024, 8, 32], "", 0, []], [[], [["CHW", 4, "local"], ["CI", 4], ["CI", 3], ["FU", 5, [0, 1]], ["SP", 5, 0, 200704, [28], 1], ["AN", 5, 0, 5], ["AN", 5, 1, 6]]]], "r": [[8.21971e-06, 8.22704e-06, 8.2255e-06], 0, 2.25892, 1668020754], "v": "v0.6"}
{"i": [["[\"layer_normalization_normal\", 1, 28, 28, 256, 1, 0, \"float16\"]", "cuda -keys=cuda,gpu -max_num_threads=1024 -model=unknown -thread_warp_size=32", [-1, 16, 64, 49152, 2147483647, 1024, 8, 32], "", 0, []], [[], [["CHW", 4, "local"], ["CI", 4], ["CI", 3], ["FU", 5, [0, 1]], ["SP", 5, 0, 200704, [14], 1], ["AN", 5, 0, 5], ["AN", 5, 1, 6]]]], "r": [[1.36189e-05, 1.36282e-05, 1.36178e-05], 0, 3.91164, 1668020755], "v": "v0.6"}
{"i": [["[\"layer_normalization_normal\", 1, 28, 28, 256, 1, 0, \"float16\"]", "cuda -keys=cuda,gpu -max_num_threads=1024 -model=unknown -thread_warp_size=32", [-1, 16, 64, 49152, 2147483647, 1024, 8, 32], "", 0, []], [[], [["CHW", 4, "local"], ["CI", 4], ["CI", 3], ["FU", 5, [0, 1]], ["SP", 5, 0, 200704, [56], 1], ["AN", 5, 0, 5], ["AN", 5, 1, 6]]]], "r": [[5.39e-06, 5.39689e-06, 5.39599e-06], 0, 3.25593, 1668020755], "v": "v0.6"}
{"i": [["[\"layer_normalization_normal\", 1, 28, 28, 256, 1, 0, \"float16\"]", "cuda -keys=cuda,gpu -max_num_threads=1024 -model=unknown -thread_warp_size=32", [-1, 16, 64, 49152, 2147483647, 1024, 8, 32], "", 0, []], [[], [["CHW", 4, "local"], ["CI", 4], ["CI", 3], ["FU", 5, [0, 1]], ["SP", 5, 0, 200704, [1], 1], ["AN", 5, 0, 5], ["AN", 5, 1, 6]]]], "r": [[0.000151731, 0.000151731, 0.000151704], 0, 4.21609, 1668020756], "v": "v0.6"}
{"i": [["[\"layer_normalization_normal\", 1, 28, 28, 256, 1, 0, \"float16\"]", "cuda -keys=cuda,gpu -max_num_threads=1024 -model=unknown -thread_warp_size=32", [-1, 16, 64, 49152, 2147483647, 1024, 8, 32], "", 0, []], [[], [["CHW", 4, "local"], ["CI", 4], ["CI", 3], ["FU", 5, [0, 1]], ["SP", 5, 0, 200704, [28], 1], ["AN", 5, 0, 5], ["AN", 5, 1, 6]]]], "r": [[8.1327e-06, 8.13558e-06, 8.13887e-06], 0, 1.98483, 1668048698], "v": "v0.6"}
{"i": [["[\"layer_normalization_normal\", 1, 28, 28, 256, 1, 0, \"float16\"]", "cuda -keys=cuda,gpu -max_num_threads=1024 -model=unknown -thread_warp_size=32", [-1, 16, 64, 49152, 2147483647, 1024, 8, 32], "", 0, []], [[], [["CHW", 4, "local"], ["CI", 4], ["CI", 3], ["FU", 5, [0, 1]], ["SP", 5, 0, 200704, [56], 1], ["AN", 5, 0, 5], ["AN", 5, 1, 6]]]], "r": [[5.52256e-06, 5.52104e-06, 5.5279e-06], 0, 1.63007, 1668048698], "v": "v0.6"}
{"i": [["[\"layer_normalization_normal\", 1, 28, 28, 256, 1, 0, \"float16\"]", "cuda -keys=cuda,gpu -max_num_threads=1024 -model=unknown -thread_warp_size=32", [-1, 16, 64, 49152, 2147483647, 1024, 8, 32], "", 0, []], [[], [["CHW", 4, "local"], ["CI", 4], ["CI", 3], ["FU", 5, [0, 1]], ["SP", 5, 0, 200704, [2], 1], ["AN", 5, 0, 5], ["AN", 5, 1, 6]]]], "r": [[7.73955e-05, 7.73813e-05, 7.73901e-05], 0, 0.592324, 1668048697], "v": "v0.6"}
{"i": [["[\"layer_normalization_normal\", 1, 28, 28, 256, 1, 0, \"float16\"]", "cuda -keys=cuda,gpu -max_num_threads=1024 -model=unknown -thread_warp_size=32", [-1, 16, 64, 49152, 2147483647, 1024, 8, 32], "", 0, []], [[], [["CHW", 4, "local"], ["CI", 4], ["CI", 3], ["FU", 5, [0, 1]], ["SP", 5, 0, 200704, [32], 1], ["AN", 5, 0, 5], ["AN", 5, 1, 6]]]], "r": [[7.46688e-06, 7.46296e-06, 7.46586e-06], 0, 0.965843, 1668048697], "v": "v0.6"}
{"i": [["[\"layer_normalization_normal\", 1, 28, 28, 256, 1, 0, \"float16\"]", "cuda -keys=cuda,gpu -max_num_threads=1024 -model=unknown -thread_warp_size=32", [-1, 16, 64, 49152, 2147483647, 1024, 8, 32], "", 0, []], [[], [["CHW", 4, "local"], ["CI", 4], ["CI", 3], ["FU", 5, [0, 1]], ["SP", 5, 0, 200704, [4], 1], ["AN", 5, 0, 5], ["AN", 5, 1, 6]]]], "r": [[4.01686e-05, 4.01672e-05, 4.01679e-05], 0, 1.30607, 1668048698], "v": "v0.6"}
{"i": [["[\"layer_normalization_normal\", 1, 28, 28, 256, 1, 0, \"float16\"]", "cuda -keys=cuda,gpu -max_num_threads=1024 -model=unknown -thread_warp_size=32", [-1, 16, 64, 49152, 2147483647, 1024, 8, 32], "", 0, []], [[], [["CHW", 4, "local"], ["CI", 4], ["CI", 3], ["FU", 5, [0, 1]], ["SP", 5, 0, 200704, [64], 1], ["AN", 5, 0, 5], ["AN", 5, 1, 6]]]], "r": [[5.20374e-06, 5.19595e-06, 5.19845e-06], 0, 2.32721, 1668048699], "v": "v0.6"}
{"i": [["[\"layer_normalization_normal\", 1, 28, 28, 256, 1, 0, \"float16\"]", "cuda -keys=cuda,gpu -max_num_threads=1024 -model=unknown -thread_warp_size=32", [-1, 16, 64, 49152, 2147483647, 1024, 8, 32], "", 0, []], [[], [["CHW", 4, "local"], ["CI", 4], ["CI", 3], ["FU", 5, [0, 1]], ["SP", 5, 0, 200704, [49], 1], ["AN", 5, 0, 5], ["AN", 5, 1, 6]]]], "r": [[5.70041e-06, 5.70143e-06, 5.69577e-06], 0, 3.04825, 1668048699], "v": "v0.6"}
{"i": [["[\"layer_normalization_normal\", 1, 28, 28, 256, 1, 0, \"float16\"]", "cuda -keys=cuda,gpu -max_num_threads=1024 -model=unknown -thread_warp_size=32", [-1, 16, 64, 49152, 2147483647, 1024, 8, 32], "", 0, []], [[], [["CHW", 4, "local"], ["CI", 4], ["CI", 3], ["FU", 5, [0, 1]], ["SP", 5, 0, 200704, [7], 1], ["AN", 5, 0, 5], ["AN", 5, 1, 6]]]], "r": [[2.43397e-05, 2.43439e-05, 2.43461e-05], 0, 3.3889, 1668048700], "v": "v0.6"}
{"i": [["[\"layer_normalization_normal\", 1, 28, 28, 256, 1, 0, \"float16\"]", "cuda -keys=cuda,gpu -max_num_threads=1024 -model=unknown -thread_warp_size=32", [-1, 16, 64, 49152, 2147483647, 1024, 8, 32], "", 0, []], [[], [["CHW", 4, "local"], ["CI", 4], ["CI", 3], ["FU", 5, [0, 1]], ["SP", 5, 0, 200704, [16], 1], ["AN", 5, 0, 5], ["AN", 5, 1, 6]]]], "r": [[1.25066e-05, 1.25029e-05, 1.25056e-05], 0, 4.40855, 1668048701], "v": "v0.6"}
{"i": [["[\"layer_normalization_normal\", 1, 28, 28, 256, 1, 0, \"float16\"]", "cuda -keys=cuda,gpu -max_num_threads=1024 -model=unknown -thread_warp_size=32", [-1, 16, 64, 49152, 2147483647, 1024, 8, 32], "", 0, []], [[], [["CHW", 4, "local"], ["CI", 4], ["CI", 3], ["FU", 5, [0, 1]], ["SP", 5, 0, 200704, [14], 1], ["AN", 5, 0, 5], ["AN", 5, 1, 6]]]], "r": [[1.35169e-05, 1.3512e-05, 1.3507e-05], 0, 3.69885, 1668048700], "v": "v0.6"}
{"i": [["[\"layer_normalization_normal\", 1, 28, 28, 256, 1, 0, \"float16\"]", "cuda -keys=cuda,gpu -max_num_threads=1024 -model=unknown -thread_warp_size=32", [-1, 16, 64, 49152, 2147483647, 1024, 8, 32], "", 0, []], [[], [["CHW", 4, "local"], ["CI", 4], ["CI", 3], ["FU", 5, [0, 1]], ["SP", 5, 0, 200704, [1], 1], ["AN", 5, 0, 5], ["AN", 5, 1, 6]]]], "r": [[0.00015189, 0.000151882, 0.000151902], 0, 4.06693, 1668048701], "v": "v0.6"}
{"i": [["[\"layer_normalization_normal\", 1, 28, 28, 256, 1, 0, \"float16\"]", "cuda -keys=cuda,gpu -max_num_threads=1024 -model=unknown -thread_warp_size=32", [-1, 16, 64, 49152, 2147483647, 1024, 8, 32], "", 0, []], [[], [["CHW", 4, "local"], ["CI", 4], ["CI", 3], ["FU", 5, [0, 1]], ["SP", 5, 0, 200704, [8], 1], ["AN", 5, 0, 5], ["AN", 5, 1, 6]]]], "r": [[2.16119e-05, 2.16165e-05, 2.16121e-05], 0, 2.67057, 1668048699], "v": "v0.6"}
{"i": [["[\"layer_normalization_normal\", 1, 28, 28, 256, 1, 0, \"float16\"]", "cuda -keys=cuda,gpu -max_num_threads=1024 -model=unknown -thread_warp_size=32", [-1, 16, 64, 49152, 2147483647, 1024, 8, 32], "", 0, []], [[], [["CHW", 4, "local"], ["CI", 4], ["CI", 3], ["FU", 5, [0, 1]], ["SP", 5, 0, 200704, [16], 1], ["AN", 5, 0, 5], ["AN", 5, 1, 6]]]], "r": [[1.23561e-05, 1.23624e-05, 1.23525e-05], 0, 1.26282, 1668050281], "v": "v0.6"}
{"i": [["[\"layer_normalization_normal\", 1, 28, 28, 256, 1, 0, \"float16\"]", "cuda -keys=cuda,gpu -max_num_threads=1024 -model=unknown -thread_warp_size=32", [-1, 16, 64, 49152, 2147483647, 1024, 8, 32], "", 0, []], [[], [["CHW", 4, "local"], ["CI", 4], ["CI", 3], ["FU", 5, [0, 1]], ["SP", 5, 0, 200704, [64], 1], ["AN", 5, 0, 5], ["AN", 5, 1, 6]]]], "r": [[5.13939e-06, 5.135e-06, 5.13366e-06], 0, 0.891407, 1668050281], "v": "v0.6"}
{"i": [["[\"layer_normalization_normal\", 1, 28, 28, 256, 1, 0, \"float16\"]", "cuda -keys=cuda,gpu -max_num_threads=1024 -model=unknown -thread_warp_size=32", [-1, 16, 64, 49152, 2147483647, 1024, 8, 32], "", 0, []], [[], [["CHW", 4, "local"], ["CI", 4], ["CI", 3], ["FU", 5, [0, 1]], ["SP", 5, 0, 200704, [8], 1], ["AN", 5, 0, 5], ["AN", 5, 1, 6]]]], "r": [[2.16537e-05, 2.16553e-05, 2.16539e-05], 0, 1.91681, 1668050282], "v": "v0.6"}
{"i": [["[\"layer_normalization_normal\", 1, 28, 28, 256, 1, 0, \"float16\"]", "cuda -keys=cuda,gpu -max_num_threads=1024 -model=unknown -thread_warp_size=32", [-1, 16, 64, 49152, 2147483647, 1024, 8, 32], "", 0, []], [[], [["CHW", 4, "local"], ["CI", 4], ["CI", 3], ["FU", 5, [0, 1]], ["SP", 5, 0, 200704, [14], 1], ["AN", 5, 0, 5], ["AN", 5, 1, 6]]]], "r": [[1.35056e-05, 1.35011e-05, 1.35103e-05], 0, 1.60609, 1668050282], "v": "v0.6"}
{"i": [["[\"layer_normalization_normal\", 1, 28, 28, 256, 1, 0, \"float16\"]", "cuda -keys=cuda,gpu -max_num_threads=1024 -model=unknown -thread_warp_size=32", [-1, 16, 64, 49152, 2147483647, 1024, 8, 32], "", 0, []], [[], [["CHW", 4, "local"], ["CI", 4], ["CI", 3], ["FU", 5, [0, 1]], ["SP", 5, 0, 200704, [32], 1], ["AN", 5, 0, 5], ["AN", 5, 1, 6]]]], "r": [[7.47119e-06, 7.47004e-06, 7.47478e-06], 0, 0.579981, 1668050281], "v": "v0.6"}
{"i": [["[\"layer_normalization_normal\", 1, 28, 28, 256, 1, 0, \"float16\"]", "cuda -keys=cuda,gpu -max_num_threads=1024 -model=unknown -thread_warp_size=32", [-1, 16, 64, 49152, 2147483647, 1024, 8, 32], "", 0, []], [[], [["CHW", 4, "local"], ["CI", 4], ["CI", 3], ["FU", 5, [0, 1]], ["SP", 5, 0, 200704, [4], 1], ["AN", 5, 0, 5], ["AN", 5, 1, 6]]]], "r": [[4.01907e-05, 4.01879e-05, 4.01833e-05], 0, 2.30257, 1668050282], "v": "v0.6"}
{"i": [["[\"layer_normalization_normal\", 1, 28, 28, 256, 1, 0, \"float16\"]", "cuda -keys=cuda,gpu -max_num_threads=1024 -model=unknown -thread_warp_size=32", [-1, 16, 64, 49152, 2147483647, 1024, 8, 32], "", 0, []], [[], [["CHW", 4, "local"], ["CI", 4], ["CI", 3], ["FU", 5, [0, 1]], ["SP", 5, 0, 200704, [28], 1], ["AN", 5, 0, 5], ["AN", 5, 1, 6]]]], "r": [[8.12668e-06, 8.12159e-06, 8.12454e-06], 0, 2.62856, 1668050283], "v": "v0.6"}
{"i": [["[\"layer_normalization_normal\", 1, 28, 28, 256, 1, 0, \"float16\"]", "cuda -keys=cuda,gpu -max_num_threads=1024 -model=unknown -thread_warp_size=32", [-1, 16, 64, 49152, 2147483647, 1024, 8, 32], "", 0, []], [[], [["CHW", 4, "local"], ["CI", 4], ["CI", 3], ["FU", 5, [0, 1]], ["SP", 5, 0, 200704, [2], 1], ["AN", 5, 0, 5], ["AN", 5, 1, 6]]]], "r": [[7.74405e-05, 7.74089e-05, 7.74131e-05], 0, 2.95481, 1668050283], "v": "v0.6"}
{"i": [["[\"layer_normalization_normal\", 1, 28, 28, 256, 1, 0, \"float16\"]", "cuda -keys=cuda,gpu -max_num_threads=1024 -model=unknown -thread_warp_size=32", [-1, 16, 64, 49152, 2147483647, 1024, 8, 32], "", 0, []], [[], [["CHW", 4, "local"], ["CI", 4], ["CI", 3], ["FU", 5, [0, 1]], ["SP", 5, 0, 200704, [1], 1], ["AN", 5, 0, 5], ["AN", 5, 1, 6]]]], "r": [[0.000151872, 0.000151818, 0.000151811], 0, 3.66839, 1668050284], "v": "v0.6"}
{"i": [["[\"layer_normalization_normal\", 1, 28, 28, 256, 1, 0, \"float16\"]", "cuda -keys=cuda,gpu -max_num_threads=1024 -model=unknown -thread_warp_size=32", [-1, 16, 64, 49152, 2147483647, 1024, 8, 32], "", 0, []], [[], [["CHW", 4, "local"], ["CI", 4], ["CI", 3], ["FU", 5, [0, 1]], ["SP", 5, 0, 200704, [56], 1], ["AN", 5, 0, 5], ["AN", 5, 1, 6]]]], "r": [[5.42874e-06, 5.43059e-06, 5.42556e-06], 0, 3.98676, 1668050284], "v": "v0.6"}
{"i": [["[\"layer_normalization_normal\", 1, 28, 28, 256, 1, 0, \"float16\"]", "cuda -keys=cuda,gpu -max_num_threads=1024 -model=unknown -thread_warp_size=32", [-1, 16, 64, 49152, 2147483647, 1024, 8, 32], "", 0, []], [[], [["CHW", 4, "local"], ["CI", 4], ["CI", 3], ["FU", 5, [0, 1]], ["SP", 5, 0, 200704, [7], 1], ["AN", 5, 0, 5], ["AN", 5, 1, 6]]]], "r": [[2.43523e-05, 2.43401e-05, 2.43012e-05], 0, 3.34091, 1668050284], "v": "v0.6"}
{"i": [["[\"layer_normalization_normal\", 1, 28, 28, 256, 1, 0, \"float16\"]", "cuda -keys=cuda,gpu -max_num_threads=1024 -model=unknown -thread_warp_size=32", [-1, 16, 64, 49152, 2147483647, 1024, 8, 32], "", 0, []], [[], [["CHW", 4, "local"], ["CI", 4], ["CI", 3], ["FU", 5, [0, 1]], ["SP", 5, 0, 200704, [49], 1], ["AN", 5, 0, 5], ["AN", 5, 1, 6]]]], "r": [[5.81186e-06, 5.81477e-06, 5.81211e-06], 0, 4.3614, 1668050285], "v": "v0.6"}
{"i": [["[\"layer_normalization_normal\", 1, 28, 28, 256, 1, 0, \"float16\"]", "cuda -keys=cuda,gpu -max_num_threads=1024 -model=unknown -thread_warp_size=32", [-1, 16, 64, 49152, 2147483647, 1024, 8, 32], "", 0, []], [[], [["CHW", 4, "local"], ["CI", 4], ["CI", 3], ["FU", 5, [0, 1]], ["SP", 5, 0, 200704, [8], 1], ["AN", 5, 0, 5], ["AN", 5, 1, 6]]]], "r": [[2.16635e-05, 2.16582e-05, 2.1664e-05], 0, 2.31942, 1668051102], "v": "v0.6"}
{"i": [["[\"layer_normalization_normal\", 1, 28, 28, 256, 1, 0, \"float16\"]", "cuda -keys=cuda,gpu -max_num_threads=1024 -model=unknown -thread_warp_size=32", [-1, 16, 64, 49152, 2147483647, 1024, 8, 32], "", 0, []], [[], [["CHW", 4, "local"], ["CI", 4], ["CI", 3], ["FU", 5, [0, 1]], ["SP", 5, 0, 200704, [64], 1], ["AN", 5, 0, 5], ["AN", 5, 1, 6]]]], "r": [[5.05225e-06, 5.05383e-06, 5.04994e-06], 0, 1.98103, 1668051102], "v": "v0.6"}
{"i": [["[\"layer_normalization_normal\", 1, 28, 28, 256, 1, 0, \"float16\"]", "cuda -keys=cuda,gpu -max_num_threads=1024 -model=unknown -thread_warp_size=32", [-1, 16, 64, 49152, 2147483647, 1024, 8, 32], "", 0, []], [[], [["CHW", 4, "local"], ["CI", 4], ["CI", 3], ["FU", 5, [0, 1]], ["SP", 5, 0, 200704, [49], 1], ["AN", 5, 0, 5], ["AN", 5, 1, 6]]]], "r": [[5.82109e-06, 5.8226e-06, 5.82666e-06], 0, 0.951817, 1668051101], "v": "v0.6"}
{"i": [["[\"layer_normalization_normal\", 1, 28, 28, 256, 1, 0, \"float16\"]", "cuda -keys=cuda,gpu -max_num_threads=1024 -model=unknown -thread_warp_size=32", [-1, 16, 64, 49152, 2147483647, 1024, 8, 32], "", 0, []], [[], [["CHW", 4, "local"], ["CI", 4], ["CI", 3], ["FU", 5, [0, 1]], ["SP", 5, 0, 200704, [32], 1], ["AN", 5, 0, 5], ["AN", 5, 1, 6]]]], "r": [[7.59196e-06, 7.5893e-06, 7.58612e-06], 0, 1.30574, 1668051101], "v": "v0.6"}
{"i": [["[\"layer_normalization_normal\", 1, 28, 28, 256, 1, 0, \"float16\"]", "cuda -keys=cuda,gpu -max_num_threads=1024 -model=unknown -thread_warp_size=32", [-1, 16, 64, 49152, 2147483647, 1024, 8, 32], "", 0, []], [[], [["CHW", 4, "local"], ["CI", 4], ["CI", 3], ["FU", 5, [0, 1]], ["SP", 5, 0, 200704, [16], 1], ["AN", 5, 0, 5], ["AN", 5, 1, 6]]]], "r": [[1.22373e-05, 1.22432e-05, 1.22399e-05], 0, 1.60726, 1668051102], "v": "v0.6"}
{"i": [["[\"layer_normalization_normal\", 1, 28, 28, 256, 1, 0, \"float16\"]", "cuda -keys=cuda,gpu -max_num_threads=1024 -model=unknown -thread_warp_size=32", [-1, 16, 64, 49152, 2147483647, 1024, 8, 32], "", 0, []], [[], [["CHW", 4, "local"], ["CI", 4], ["CI", 3], ["FU", 5, [0, 1]], ["SP", 5, 0, 200704, [56], 1], ["AN", 5, 0, 5], ["AN", 5, 1, 6]]]], "r": [[5.4652e-06, 5.45793e-06, 5.46364e-06], 0, 0.58212, 1668051101], "v": "v0.6"}
{"i": [["[\"layer_normalization_normal\", 1, 28, 28, 256, 1, 0, \"float16\"]", "cuda -keys=cuda,gpu -max_num_threads=1024 -model=unknown -thread_warp_size=32", [-1, 16, 64, 49152, 2147483647, 1024, 8, 32], "", 0, []], [[], [["CHW", 4, "local"], ["CI", 4], ["CI", 3], ["FU", 5, [0, 1]], ["SP", 5, 0, 200704, [14], 1], ["AN", 5, 0, 5], ["AN", 5, 1, 6]]]], "r": [[1.35709e-05, 1.35745e-05, 1.35684e-05], 0, 3.35992, 1668051104], "v": "v0.6"}
{"i": [["[\"layer_normalization_normal\", 1, 28, 28, 256, 1, 0, \"float16\"]", "cuda -keys=cuda,gpu -max_num_threads=1024 -model=unknown -thread_warp_size=32", [-1, 16, 64, 49152, 2147483647, 1024, 8, 32], "", 0, []], [[], [["CHW", 4, "local"], ["CI", 4], ["CI", 3], ["FU", 5, [0, 1]], ["SP", 5, 0, 200704, [4], 1], ["AN", 5, 0, 5], ["AN", 5, 1, 6]]]], "r": [[4.0096e-05, 4.00924e-05, 4.00948e-05], 0, 2.6278, 1668051103], "v": "v0.6"}
{"i": [["[\"layer_normalization_normal\", 1, 28, 28, 256, 1, 0, \"float16\"]", "cuda -keys=cuda,gpu -max_num_threads=1024 -model=unknown -thread_warp_size=32", [-1, 16, 64, 49152, 2147483647, 1024, 8, 32], "", 0, []], [[], [["CHW", 4, "local"], ["CI", 4], ["CI", 3], ["FU", 5, [0, 1]], ["SP", 5, 0, 200704, [28], 1], ["AN", 5, 0, 5], ["AN", 5, 1, 6]]]], "r": [[8.31198e-06, 8.31452e-06, 8.31331e-06], 0, 3.01347, 1668051103], "v": "v0.6"}
{"i": [["[\"layer_normalization_normal\", 1, 28, 28, 256, 1, 0, \"float16\"]", "cuda -keys=cuda,gpu -max_num_threads=1024 -model=unknown -thread_warp_size=32", [-1, 16, 64, 49152, 2147483647, 1024, 8, 32], "", 0, []], [[], [["CHW", 4, "local"], ["CI", 4], ["CI", 3], ["FU", 5, [0, 1]], ["SP", 5, 0, 200704, [2], 1], ["AN", 5, 0, 5], ["AN", 5, 1, 6]]]], "r": [[7.73774e-05, 7.73867e-05, 7.73904e-05], 0, 4.05327, 1668051104], "v": "v0.6"}
{"i": [["[\"layer_normalization_normal\", 1, 28, 28, 256, 1, 0, \"float16\"]", "cuda -keys=cuda,gpu -max_num_threads=1024 -model=unknown -thread_warp_size=32", [-1, 16, 64, 49152, 2147483647, 1024, 8, 32], "", 0, []], [[], [["CHW", 4, "local"], ["CI", 4], ["CI", 3], ["FU", 5, [0, 1]], ["SP", 5, 0, 200704, [1], 1], ["AN", 5, 0, 5], ["AN", 5, 1, 6]]]], "r": [[0.000151797, 0.000151777, 0.000151808], 0, 4.38367, 1668051105], "v": "v0.6"}
{"i": [["[\"layer_normalization_normal\", 1, 28, 28, 256, 1, 0, \"float16\"]", "cuda -keys=cuda,gpu -max_num_threads=1024 -model=unknown -thread_warp_size=32", [-1, 16, 64, 49152, 2147483647, 1024, 8, 32], "", 0, []], [[], [["CHW", 4, "local"], ["CI", 4], ["CI", 3], ["FU", 5, [0, 1]], ["SP", 5, 0, 200704, [7], 1], ["AN", 5, 0, 5], ["AN", 5, 1, 6]]]], "r": [[2.44879e-05, 2.4484e-05, 2.44959e-05], 0, 3.69646, 1668051104], "v": "v0.6"}
{"i": [["[\"layer_normalization_normal\", 1, 28, 28, 256, 1, 0, \"float16\"]", "cuda -keys=cuda,gpu -max_num_threads=1024 -model=unknown -thread_warp_size=32", [-1, 16, 64, 49152, 2147483647, 1024, 8, 32], "", 0, []], [[], [["CHW", 4, "local"], ["CI", 4], ["CI", 3], ["FU", 5, [0, 1]], ["SP", 5, 0, 200704, [49], 1], ["AN", 5, 0, 5], ["AN", 5, 1, 6]]]], "r": [[5.75646e-06, 5.76376e-06, 5.7613e-06], 0, 1.2536, 1668051461], "v": "v0.6"}
{"i": [["[\"layer_normalization_normal\", 1, 28, 28, 256, 1, 0, \"float16\"]", "cuda -keys=cuda,gpu -max_num_threads=1024 -model=unknown -thread_warp_size=32", [-1, 16, 64, 49152, 2147483647, 1024, 8, 32], "", 0, []], [[], [["CHW", 4, "local"], ["CI", 4], ["CI", 3], ["FU", 5, [0, 1]], ["SP", 5, 0, 200704, [32], 1], ["AN", 5, 0, 5], ["AN", 5, 1, 6]]]], "r": [[7.4219e-06, 7.42005e-06, 7.42106e-06], 0, 1.95545, 1668051461], "v": "v0.6"}
{"i": [["[\"layer_normalization_normal\", 1, 28, 28, 256, 1, 0, \"float16\"]", "cuda -keys=cuda,gpu -max_num_threads=1024 -model=unknown -thread_warp_size=32", [-1, 16, 64, 49152, 2147483647, 1024, 8, 32], "", 0, []], [[], [["CHW", 4, "local"], ["CI", 4], ["CI", 3], ["FU", 5, [0, 1]], ["SP", 5, 0, 200704, [28], 1], ["AN", 5, 0, 5], ["AN", 5, 1, 6]]]], "r": [[8.23104e-06, 8.23216e-06, 8.2349e-06], 0, 1.5868, 1668051461], "v": "v0.6"}
{"i": [["[\"layer_normalization_normal\", 1, 28, 28, 256, 1, 0, \"float16\"]", "cuda -keys=cuda,gpu -max_num_threads=1024 -model=unknown -thread_warp_size=32", [-1, 16, 64, 49152, 2147483647, 1024, 8, 32], "", 0, []], [[], [["CHW", 4, "local"], ["CI", 4], ["CI", 3], ["FU", 5, [0, 1]], ["SP", 5, 0, 200704, [1], 1], ["AN", 5, 0, 5], ["AN", 5, 1, 6]]]], "r": [[0.000151862, 0.000151859, 0.000151869], 0, 0.925736, 1668051460], "v": "v0.6"}
{"i": [["[\"layer_normalization_normal\", 1, 28, 28, 256, 1, 0, \"float16\"]", "cuda -keys=cuda,gpu -max_num_threads=1024 -model=unknown -thread_warp_size=32", [-1, 16, 64, 49152, 2147483647, 1024, 8, 32], "", 0, []], [[], [["CHW", 4, "local"], ["CI", 4], ["CI", 3], ["FU", 5, [0, 1]], ["SP", 5, 0, 200704, [16], 1], ["AN", 5, 0, 5], ["AN", 5, 1, 6]]]], "r": [[1.22958e-05, 1.22852e-05, 1.22819e-05], 0, 0.581014, 1668051460], "v": "v0.6"}
{"i": [["[\"layer_normalization_normal\", 1, 28, 28, 256, 1, 0, \"float16\"]", "cuda -keys=cuda,gpu -max_num_threads=1024 -model=unknown -thread_warp_size=32", [-1, 16, 64, 49152, 2147483647, 1024, 8, 32], "", 0, []], [[], [["CHW", 4, "local"], ["CI", 4], ["CI", 3], ["FU", 5, [0, 1]], ["SP", 5, 0, 200704, [2], 1], ["AN", 5, 0, 5], ["AN", 5, 1, 6]]]], "r": [[7.74041e-05, 7.73882e-05, 7.73938e-05], 0, 2.27901, 1668051462], "v": "v0.6"}
{"i": [["[\"layer_normalization_normal\", 1, 28, 28, 256, 1, 0, \"float16\"]", "cuda -keys=cuda,gpu -max_num_threads=1024 -model=unknown -thread_warp_size=32", [-1, 16, 64, 49152, 2147483647, 1024, 8, 32], "", 0, []], [[], [["CHW", 4, "local"], ["CI", 4], ["CI", 3], ["FU", 5, [0, 1]], ["SP", 5, 0, 200704, [8], 1], ["AN", 5, 0, 5], ["AN", 5, 1, 6]]]], "r": [[2.16753e-05, 2.16727e-05, 2.16673e-05], 0, 2.60531, 1668051462], "v": "v0.6"}
{"i": [["[\"layer_normalization_normal\", 1, 28, 28, 256, 1, 0, \"float16\"]", "cuda -keys=cuda,gpu -max_num_threads=1024 -model=unknown -thread_warp_size=32", [-1, 16, 64, 49152, 2147483647, 1024, 8, 32], "", 0, []], [[], [["CHW", 4, "local"], ["CI", 4], ["CI", 3], ["FU", 5, [0, 1]], ["SP", 5, 0, 200704, [4], 1], ["AN", 5, 0, 5], ["AN", 5, 1, 6]]]], "r": [[4.01028e-05, 4.00895e-05, 4.00925e-05], 0, 3.32312, 1668051463], "v": "v0.6"}
{"i": [["[\"layer_normalization_normal\", 1, 28, 28, 256, 1, 0, \"float16\"]", "cuda -keys=cuda,gpu -max_num_threads=1024 -model=unknown -thread_warp_size=32", [-1, 16, 64, 49152, 2147483647, 1024, 8, 32], "", 0, []], [[], [["CHW", 4, "local"], ["CI", 4], ["CI", 3], ["FU", 5, [0, 1]], ["SP", 5, 0, 200704, [56], 1], ["AN", 5, 0, 5], ["AN", 5, 1, 6]]]], "r": [[5.47731e-06, 5.47649e-06, 5.47749e-06], 0, 3.62621, 1668051463], "v": "v0.6"}
{"i": [["[\"layer_normalization_normal\", 1, 28, 28, 256, 1, 0, \"float16\"]", "cuda -keys=cuda,gpu -max_num_threads=1024 -model=unknown -thread_warp_size=32", [-1, 16, 64, 49152, 2147483647, 1024, 8, 32], "", 0, []], [[], [["CHW", 4, "local"], ["CI", 4], ["CI", 3], ["FU", 5, [0, 1]], ["SP", 5, 0, 200704, [64], 1], ["AN", 5, 0, 5], ["AN", 5, 1, 6]]]], "r": [[5.12928e-06, 5.12032e-06, 5.11552e-06], 0, 3.99812, 1668051464], "v": "v0.6"}
{"i": [["[\"layer_normalization_normal\", 1, 28, 28, 256, 1, 0, \"float16\"]", "cuda -keys=cuda,gpu -max_num_threads=1024 -model=unknown -thread_warp_size=32", [-1, 16, 64, 49152, 2147483647, 1024, 8, 32], "", 0, []], [[], [["CHW", 4, "local"], ["CI", 4], ["CI", 3], ["FU", 5, [0, 1]], ["SP", 5, 0, 200704, [14], 1], ["AN", 5, 0, 5], ["AN", 5, 1, 6]]]], "r": [[1.35765e-05, 1.35857e-05, 1.35931e-05], 0, 2.98082, 1668051462], "v": "v0.6"}
{"i": [["[\"layer_normalization_normal\", 1, 28, 28, 256, 1, 0, \"float16\"]", "cuda -keys=cuda,gpu -max_num_threads=1024 -model=unknown -thread_warp_size=32", [-1, 16, 64, 49152, 2147483647, 1024, 8, 32], "", 0, []], [[], [["CHW", 4, "local"], ["CI", 4], ["CI", 3], ["FU", 5, [0, 1]], ["SP", 5, 0, 200704, [7], 1], ["AN", 5, 0, 5], ["AN", 5, 1, 6]]]], "r": [[2.42616e-05, 2.42431e-05, 2.42397e-05], 0, 4.34085, 1668051464], "v": "v0.6"}
