python/models/swin_transformer/kernel_configs/swin_transformer_softmax_norm_6400_64.log
{"i": [["[\"softmax_norm\", 6400, 64]", "cuda -keys=cuda,gpu -max_num_threads=1024 -model=unknown -thread_warp_size=32", [-1, 16, 64, 49152, 2147483647, 1024, 8, 32], "", 0, []], [[], [["FU", 2, [0, 1, 2]], ["SP", 2, 0, 26214400, [8], 1], ["AN", 2, 0, 5], ["AN", 2, 1, 6]]]], "r": [[0.00243237, 0.00243224, 0.00243197], 0, 15.2021, 1668919272], "v": "v0.6"}
{"i": [["[\"softmax_norm\", 6400, 64]", "cuda -keys=cuda,gpu -max_num_threads=1024 -model=unknown -thread_warp_size=32", [-1, 16, 64, 49152, 2147483647, 1024, 8, 32], "", 0, []], [[], [["FU", 2, [0, 1, 2]], ["SP", 2, 0, 26214400, [25], 1], ["AN", 2, 0, 5], ["AN", 2, 1, 6]]]], "r": [[0.000781261, 0.000781303, 0.00078112], 0, 2.3054, 1668919259], "v": "v0.6"}
{"i": [["[\"softmax_norm\", 6400, 64]", "cuda -keys=cuda,gpu -max_num_threads=1024 -model=unknown -thread_warp_size=32", [-1, 16, 64, 49152, 2147483647, 1024, 8, 32], "", 0, []], [[], [["FU", 2, [0, 1, 2]], ["SP", 2, 0, 26214400, [2], 1], ["AN", 2, 0, 5], ["AN", 2, 1, 6]]]], "r": [[0.00971627, 0.00971548, 0.0097186], 0, 10.8793, 1668919268], "v": "v0.6"}
{"i": [["[\"softmax_norm\", 6400, 64]", "cuda -keys=cuda,gpu -max_num_threads=1024 -model=unknown -thread_warp_size=32", [-1, 16, 64, 49152, 2147483647, 1024, 8, 32], "", 0, []], [[], [["FU", 2, [0, 1, 2]], ["SP", 2, 0, 26214400, [32], 1], ["AN", 2, 0, 5], ["AN", 2, 1, 6]]]], "r": [[0.000611074, 0.000611089, 0.000611049], 0, 17.3664, 1668919274], "v": "v0.6"}
{"i": [["[\"softmax_norm\", 6400, 64]", "cuda -keys=cuda,gpu -max_num_threads=1024 -model=unknown -thread_warp_size=32", [-1, 16, 64, 49152, 2147483647, 1024, 8, 32], "", 0, []], [[], [["FU", 2, [0, 1, 2]], ["SP", 2, 0, 26214400, [10], 1], ["AN", 2, 0, 5], ["AN", 2, 1, 6]]]], "r": [[0.00194651, 0.00194634, 0.00194632], 0, 13.0491, 1668919270], "v": "v0.6"}
{"i": [["[\"softmax_norm\", 6400, 64]", "cuda -keys=cuda,gpu -max_num_threads=1024 -model=unknown -thread_warp_size=32", [-1, 16, 64, 49152, 2147483647, 1024, 8, 32], "", 0, []], [[], [["FU", 2, [0, 1, 2]], ["SP", 2, 0, 26214400, [1], 1], ["AN", 2, 0, 5], ["AN", 2, 1, 6]]]], "r": [[0.0194286, 0.0194325, 0.0194255], 0, 6.63425, 1668919264], "v": "v0.6"}
{"i": [["[\"softmax_norm\", 6400, 64]", "cuda -keys=cuda,gpu -max_num_threads=1024 -model=unknown -thread_warp_size=32", [-1, 16, 64, 49152, 2147483647, 1024, 8, 32], "", 0, []], [[], [["FU", 2, [0, 1, 2]], ["SP", 2, 0, 26214400, [16], 1], ["AN", 2, 0, 5], ["AN", 2, 1, 6]]]], "r": [[0.00121791, 0.00121794, 0.00121804], 0, 4.40914, 1668919261], "v": "v0.6"}
{"i": [["[\"softmax_norm\", 6400, 64]", "cuda -keys=cuda,gpu -max_num_threads=1024 -model=unknown -thread_warp_size=32", [-1, 16, 64, 49152, 2147483647, 1024, 8, 32], "", 0, []], [[], [["FU", 2, [0, 1, 2]], ["SP", 2, 0, 26214400, [40], 1], ["AN", 2, 0, 5], ["AN", 2, 1, 6]]]], "r": [[0.000489383, 0.000489245, 0.000489166], 0, 21.7706, 1668919279], "v": "v0.6"}
{"i": [["[\"softmax_norm\", 6400, 64]", "cuda -keys=cuda,gpu -max_num_threads=1024 -model=unknown -thread_warp_size=32", [-1, 16, 64, 49152, 2147483647, 1024, 8, 32], "", 0, []], [[], [["FU", 2, [0, 1, 2]], ["SP", 2, 0, 26214400, [64], 1], ["AN", 2, 0, 5], ["AN", 2, 1, 6]]]], "r": [[0.000306917, 0.000306929, 0.000306905], 0, 19.538, 1668919277], "v": "v0.6"}
{"i": [["[\"softmax_norm\", 6400, 64]", "cuda -keys=cuda,gpu -max_num_threads=1024 -model=unknown -thread_warp_size=32", [-1, 16, 64, 49152, 2147483647, 1024, 8, 32], "", 0, []], [[], [["FU", 2, [0, 1, 2]], ["SP", 2, 0, 26214400, [5], 1], ["AN", 2, 0, 5], ["AN", 2, 1, 6]]]], "r": [[0.00388947, 0.00388955, 0.00388944], 0, 26.1824, 1668919283], "v": "v0.6"}
{"i": [["[\"softmax_norm\", 6400, 64]", "cuda -keys=cuda,gpu -max_num_threads=1024 -model=unknown -thread_warp_size=32", [-1, 16, 64, 49152, 2147483647, 1024, 8, 32], "", 0, []], [[], [["FU", 2, [0, 1, 2]], ["SP", 2, 0, 26214400, [50], 1], ["AN", 2, 0, 5], ["AN", 2, 1, 6]]]], "r": [[0.000392089, 0.000392052, 0.000392008], 0, 8.73249, 1668919266], "v": "v0.6"}
{"i": [["[\"softmax_norm\", 6400, 64]", "cuda -keys=cuda,gpu -max_num_threads=1024 -model=unknown -thread_warp_size=32", [-1, 16, 64, 49152, 2147483647, 1024, 8, 32], "", 0, []], [[], [["FU", 2, [0, 1, 2]], ["SP", 2, 0, 26214400, [20], 1], ["AN", 2, 0, 5], ["AN", 2, 1, 6]]]], "r": [[0.000975305, 0.000975462, 0.000975286], 0, 23.9645, 1668919281], "v": "v0.6"}
{"i": [["[\"softmax_norm\", 6400, 64]", "cuda -keys=cuda,gpu -max_num_threads=1024 -model=unknown -thread_warp_size=32", [-1, 16, 64, 49152, 2147483647, 1024, 8, 32], "", 0, []], [[], [["FU", 2, [0, 1, 2]], ["SP", 2, 0, 26214400, [4], 1], ["AN", 2, 0, 5], ["AN", 2, 1, 6]]]], "r": [[0.00486084, 0.00486077, 0.00486061], 0, 28.3507, 1668919285], "v": "v0.6"}
