python/models/swin_transformer/kernel_configs/swin_transformer_softmax_norm_6272_49.log
{"i": [["[\"softmax_norm\", 6272, 49]", "cuda -keys=cuda,gpu -max_num_threads=1024 -model=unknown -thread_warp_size=32", [-1, 16, 64, 49152, 2147483647, 1024, 8, 32], "", 0, []], [[], [["FU", 2, [0, 1, 2]], ["SP", 2, 0, 15059072, [1], 1], ["AN", 2, 0, 5], ["AN", 2, 1, 6]]]], "r": [[0.0111629, 0.0111627, 0.0111621], 0, 8.39825, 1668049695], "v": "v0.6"}
{"i": [["[\"softmax_norm\", 6272, 49]", "cuda -keys=cuda,gpu -max_num_threads=1024 -model=unknown -thread_warp_size=32", [-1, 16, 64, 49152, 2147483647, 1024, 8, 32], "", 0, []], [[], [["FU", 2, [0, 1, 2]], ["SP", 2, 0, 15059072, [8], 1], ["AN", 2, 0, 5], ["AN", 2, 1, 6]]]], "r": [[0.00139972, 0.00139935, 0.00139962], 0, 2.88392, 1668049689], "v": "v0.6"}
{"i": [["[\"softmax_norm\", 6272, 49]", "cuda -keys=cuda,gpu -max_num_threads=1024 -model=unknown -thread_warp_size=32", [-1, 16, 64, 49152, 2147483647, 1024, 8, 32], "", 0, []], [[], [["FU", 2, [0, 1, 2]], ["SP", 2, 0, 15059072, [16], 1], ["AN", 2, 0, 5], ["AN", 2, 1, 6]]]], "r": [[0.000701721, 0.000701733, 0.000701709], 0, 4.26411, 1668049690], "v": "v0.6"}
{"i": [["[\"softmax_norm\", 6272, 49]", "cuda -keys=cuda,gpu -max_num_threads=1024 -model=unknown -thread_warp_size=32", [-1, 16, 64, 49152, 2147483647, 1024, 8, 32], "", 0, []], [[], [["FU", 2, [0, 1, 2]], ["SP", 2, 0, 15059072, [14], 1], ["AN", 2, 0, 5], ["AN", 2, 1, 6]]]], "r": [[0.000801601, 0.000801341, 0.000801312], 0, 6.9348, 1668049693], "v": "v0.6"}
{"i": [["[\"softmax_norm\", 6272, 49]", "cuda -keys=cuda,gpu -max_num_threads=1024 -model=unknown -thread_warp_size=32", [-1, 16, 64, 49152, 2147483647, 1024, 8, 32], "", 0, []], [[], [["FU", 2, [0, 1, 2]], ["SP", 2, 0, 15059072, [64], 1], ["AN", 2, 0, 5], ["AN", 2, 1, 6]]]], "r": [[0.000177781, 0.000177809, 0.000177761], 0, 5.6011, 1668049692], "v": "v0.6"}
{"i": [["[\"softmax_norm\", 6272, 49]", "cuda -keys=cuda,gpu -max_num_threads=1024 -model=unknown -thread_warp_size=32", [-1, 16, 64, 49152, 2147483647, 1024, 8, 32], "", 0, []], [[], [["FU", 2, [0, 1, 2]], ["SP", 2, 0, 15059072, [56], 1], ["AN", 2, 0, 5], ["AN", 2, 1, 6]]]], "r": [[0.00020289, 0.000202793, 0.000202847], 0, 1.54635, 1668049688], "v": "v0.6"}
{"i": [["[\"softmax_norm\", 6272, 49]", "cuda -keys=cuda,gpu -max_num_threads=1024 -model=unknown -thread_warp_size=32", [-1, 16, 64, 49152, 2147483647, 1024, 8, 32], "", 0, []], [[], [["FU", 2, [0, 1, 2]], ["SP", 2, 0, 15059072, [49], 1], ["AN", 2, 0, 5], ["AN", 2, 1, 6]]]], "r": [[0.000231275, 0.000231215, 0.000231176], 0, 11.0499, 1668049697], "v": "v0.6"}
{"i": [["[\"softmax_norm\", 6272, 49]", "cuda -keys=cuda,gpu -max_num_threads=1024 -model=unknown -thread_warp_size=32", [-1, 16, 64, 49152, 2147483647, 1024, 8, 32], "", 0, []], [[], [["FU", 2, [0, 1, 2]], ["SP", 2, 0, 15059072, [2], 1], ["AN", 2, 0, 5], ["AN", 2, 1, 6]]]], "r": [[0.00558471, 0.00558412, 0.00558437], 0, 12.4546, 1668049699], "v": "v0.6"}
{"i": [["[\"softmax_norm\", 6272, 49]", "cuda -keys=cuda,gpu -max_num_threads=1024 -model=unknown -thread_warp_size=32", [-1, 16, 64, 49152, 2147483647, 1024, 8, 32], "", 0, []], [[], [["FU", 2, [0, 1, 2]], ["SP", 2, 0, 15059072, [32], 1], ["AN", 2, 0, 5], ["AN", 2, 1, 6]]]], "r": [[0.000352967, 0.000352932, 0.00035285], 0, 9.71021, 1668049696], "v": "v0.6"}
{"i": [["[\"softmax_norm\", 6272, 49]", "cuda -keys=cuda,gpu -max_num_threads=1024 -model=unknown -thread_warp_size=32", [-1, 16, 64, 49152, 2147483647, 1024, 8, 32], "", 0, []], [[], [["FU", 2, [0, 1, 2]], ["SP", 2, 0, 15059072, [28], 1], ["AN", 2, 0, 5], ["AN", 2, 1, 6]]]], "r": [[0.000403064, 0.000402912, 0.000402958], 0, 13.7665, 1668049700], "v": "v0.6"}
{"i": [["[\"softmax_norm\", 6272, 49]", "cuda -keys=cuda,gpu -max_num_threads=1024 -model=unknown -thread_warp_size=32", [-1, 16, 64, 49152, 2147483647, 1024, 8, 32], "", 0, []], [[], [["FU", 2, [0, 1, 2]], ["SP", 2, 0, 15059072, [4], 1], ["AN", 2, 0, 5], ["AN", 2, 1, 6]]]], "r": [[0.00279461, 0.00279514, 0.00279455], 0, 16.4932, 1668049703], "v": "v0.6"}
{"i": [["[\"softmax_norm\", 6272, 49]", "cuda -keys=cuda,gpu -max_num_threads=1024 -model=unknown -thread_warp_size=32", [-1, 16, 64, 49152, 2147483647, 1024, 8, 32], "", 0, []], [[], [["FU", 2, [0, 1, 2]], ["SP", 2, 0, 15059072, [7], 1], ["AN", 2, 0, 5], ["AN", 2, 1, 6]]]], "r": [[0.00159865, 0.00159858, 0.00159863], 0, 15.0982, 1668049701], "v": "v0.6"}
{"i": [["[\"softmax_norm\", 6272, 49]", "cuda -keys=cuda,gpu -max_num_threads=1024 -model=unknown -thread_warp_size=32", [-1, 16, 64, 49152, 2147483647, 1024, 8, 32], "", 0, []], [[], [["FU", 2, [0, 1, 2]], ["SP", 2, 0, 15059072, [64], 1], ["AN", 2, 0, 5], ["AN", 2, 1, 6]]]], "r": [[0.000177874, 0.000177816, 0.000177842], 0, 4.24745, 1668051357], "v": "v0.6"}
{"i": [["[\"softmax_norm\", 6272, 49]", "cuda -keys=cuda,gpu -max_num_threads=1024 -model=unknown -thread_warp_size=32", [-1, 16, 64, 49152, 2147483647, 1024, 8, 32], "", 0, []], [[], [["FU", 2, [0, 1, 2]], ["SP", 2, 0, 15059072, [28], 1], ["AN", 2, 0, 5], ["AN", 2, 1, 6]]]], "r": [[0.000403219, 0.000403183, 0.000403092], 0, 2.8737, 1668051355], "v": "v0.6"}
{"i": [["[\"softmax_norm\", 6272, 49]", "cuda -keys=cuda,gpu -max_num_threads=1024 -model=unknown -thread_warp_size=32", [-1, 16, 64, 49152, 2147483647, 1024, 8, 32], "", 0, []], [[], [["FU", 2, [0, 1, 2]], ["SP", 2, 0, 15059072, [56], 1], ["AN", 2, 0, 5], ["AN", 2, 1, 6]]]], "r": [[0.000202891, 0.000202889, 0.000202896], 0, 1.55399, 1668051354], "v": "v0.6"}
{"i": [["[\"softmax_norm\", 6272, 49]", "cuda -keys=cuda,gpu -max_num_threads=1024 -model=unknown -thread_warp_size=32", [-1, 16, 64, 49152, 2147483647, 1024, 8, 32], "", 0, []], [[], [["FU", 2, [0, 1, 2]], ["SP", 2, 0, 15059072, [1], 1], ["AN", 2, 0, 5], ["AN", 2, 1, 6]]]], "r": [[0.0111695, 0.011165, 0.0111646], 0, 5.69027, 1668051358], "v": "v0.6"}
{"i": [["[\"softmax_norm\", 6272, 49]", "cuda -keys=cuda,gpu -max_num_threads=1024 -model=unknown -thread_warp_size=32", [-1, 16, 64, 49152, 2147483647, 1024, 8, 32], "", 0, []], [[], [["FU", 2, [0, 1, 2]], ["SP", 2, 0, 15059072, [16], 1], ["AN", 2, 0, 5], ["AN", 2, 1, 6]]]], "r": [[0.000702066, 0.000702162, 0.000701879], 0, 7.02899, 1668051360], "v": "v0.6"}
{"i": [["[\"softmax_norm\", 6272, 49]", "cuda -keys=cuda,gpu -max_num_threads=1024 -model=unknown -thread_warp_size=32", [-1, 16, 64, 49152, 2147483647, 1024, 8, 32], "", 0, []], [[], [["FU", 2, [0, 1, 2]], ["SP", 2, 0, 15059072, [32], 1], ["AN", 2, 0, 5], ["AN", 2, 1, 6]]]], "r": [[0.000353335, 0.000353201, 0.000353234], 0, 9.71272, 1668051362], "v": "v0.6"}
{"i": [["[\"softmax_norm\", 6272, 49]", "cuda -keys=cuda,gpu -max_num_threads=1024 -model=unknown -thread_warp_size=32", [-1, 16, 64, 49152, 2147483647, 1024, 8, 32], "", 0, []], [[], [["FU", 2, [0, 1, 2]], ["SP", 2, 0, 15059072, [14], 1], ["AN", 2, 0, 5], ["AN", 2, 1, 6]]]], "r": [[0.000801974, 0.000801768, 0.000801818], 0, 8.38843, 1668051361], "v": "v0.6"}
{"i": [["[\"softmax_norm\", 6272, 49]", "cuda -keys=cuda,gpu -max_num_threads=1024 -model=unknown -thread_warp_size=32", [-1, 16, 64, 49152, 2147483647, 1024, 8, 32], "", 0, []], [[], [["FU", 2, [0, 1, 2]], ["SP", 2, 0, 15059072, [49], 1], ["AN", 2, 0, 5], ["AN", 2, 1, 6]]]], "r": [[0.000231328, 0.000231276, 0.000231281], 0, 15.0751, 1668051368], "v": "v0.6"}
{"i": [["[\"softmax_norm\", 6272, 49]", "cuda -keys=cuda,gpu -max_num_threads=1024 -model=unknown -thread_warp_size=32", [-1, 16, 64, 49152, 2147483647, 1024, 8, 32], "", 0, []], [[], [["FU", 2, [0, 1, 2]], ["SP", 2, 0, 15059072, [4], 1], ["AN", 2, 0, 5], ["AN", 2, 1, 6]]]], "r": [[0.00279586, 0.00279535, 0.00279544], 0, 12.4208, 1668051365], "v": "v0.6"}
{"i": [["[\"softmax_norm\", 6272, 49]", "cuda -keys=cuda,gpu -max_num_threads=1024 -model=unknown -thread_warp_size=32", [-1, 16, 64, 49152, 2147483647, 1024, 8, 32], "", 0, []], [[], [["FU", 2, [0, 1, 2]], ["SP", 2, 0, 15059072, [8], 1], ["AN", 2, 0, 5], ["AN", 2, 1, 6]]]], "r": [[0.00140025, 0.00139999, 0.00140048], 0, 11.0348, 1668051364], "v": "v0.6"}
{"i": [["[\"softmax_norm\", 6272, 49]", "cuda -keys=cuda,gpu -max_num_threads=1024 -model=unknown -thread_warp_size=32", [-1, 16, 64, 49152, 2147483647, 1024, 8, 32], "", 0, []], [[], [["FU", 2, [0, 1, 2]], ["SP", 2, 0, 15059072, [7], 1], ["AN", 2, 0, 5], ["AN", 2, 1, 6]]]], "r": [[0.00159906, 0.00159899, 0.00159902], 0, 13.7487, 1668051366], "v": "v0.6"}
{"i": [["[\"softmax_norm\", 6272, 49]", "cuda -keys=cuda,gpu -max_num_threads=1024 -model=unknown -thread_warp_size=32", [-1, 16, 64, 49152, 2147483647, 1024, 8, 32], "", 0, []], [[], [["FU", 2, [0, 1, 2]], ["SP", 2, 0, 15059072, [2], 1], ["AN", 2, 0, 5], ["AN", 2, 1, 6]]]], "r": [[0.00558572, 0.00558605, 0.00558549], 0, 16.4921, 1668051369], "v": "v0.6"}
{"i": [["[\"softmax_norm\", 6272, 49]", "cuda -keys=cuda,gpu -max_num_threads=1024 -model=unknown -thread_warp_size=32", [-1, 16, 64, 49152, 2147483647, 1024, 8, 32], "", 0, []], [[], [["FU", 2, [0, 1]], ["SP", 2, 0, 307328, [28], 1], ["AN", 2, 0, 5], ["AN", 2, 1, 6]]]], "r": [[1.11098e-05, 1.11049e-05, 1.1102e-05], 0, 0.836997, 1668919666], "v": "v0.6"}
{"i": [["[\"softmax_norm\", 6272, 49]", "cuda -keys=cuda,gpu -max_num_threads=1024 -model=unknown -thread_warp_size=32", [-1, 16, 64, 49152, 2147483647, 1024, 8, 32], "", 0, []], [[], [["FU", 2, [0, 1]], ["SP", 2, 0, 307328, [56], 1], ["AN", 2, 0, 5], ["AN", 2, 1, 6]]]], "r": [[6.73909e-06, 6.74697e-06, 6.74333e-06], 0, 1.4003, 1668919666], "v": "v0.6"}
{"i": [["[\"softmax_norm\", 6272, 49]", "cuda -keys=cuda,gpu -max_num_threads=1024 -model=unknown -thread_warp_size=32", [-1, 16, 64, 49152, 2147483647, 1024, 8, 32], "", 0, []], [[], [["FU", 2, [0, 1]], ["SP", 2, 0, 307328, [16], 1], ["AN", 2, 0, 5], ["AN", 2, 1, 6]]]], "r": [[1.7336e-05, 1.73317e-05, 1.73382e-05], 0, 2.13584, 1668919667], "v": "v0.6"}
{"i": [["[\"softmax_norm\", 6272, 49]", "cuda -keys=cuda,gpu -max_num_threads=1024 -model=unknown -thread_warp_size=32", [-1, 16, 64, 49152, 2147483647, 1024, 8, 32], "", 0, []], [[], [["FU", 2, [0, 1]], ["SP", 2, 0, 307328, [7], 1], ["AN", 2, 0, 5], ["AN", 2, 1, 6]]]], "r": [[3.53589e-05, 3.53645e-05, 3.53598e-05], 0, 1.07054, 1668919666], "v": "v0.6"}
{"i": [["[\"softmax_norm\", 6272, 49]", "cuda -keys=cuda,gpu -max_num_threads=1024 -model=unknown -thread_warp_size=32", [-1, 16, 64, 49152, 2147483647, 1024, 8, 32], "", 0, []], [[], [["FU", 2, [0, 1]], ["SP", 2, 0, 307328, [49], 1], ["AN", 2, 0, 5], ["AN", 2, 1, 6]]]], "r": [[7.24323e-06, 7.24837e-06, 7.24369e-06], 0, 3.04096, 1668919668], "v": "v0.6"}
{"i": [["[\"softmax_norm\", 6272, 49]", "cuda -keys=cuda,gpu -max_num_threads=1024 -model=unknown -thread_warp_size=32", [-1, 16, 64, 49152, 2147483647, 1024, 8, 32], "", 0, []], [[], [["FU", 2, [0, 1]], ["SP", 2, 0, 307328, [1], 1], ["AN", 2, 0, 5], ["AN", 2, 1, 6]]]], "r": [[0.000230593, 0.000230641, 0.000230593], 0, 1.78952, 1668919667], "v": "v0.6"}
{"i": [["[\"softmax_norm\", 6272, 49]", "cuda -keys=cuda,gpu -max_num_threads=1024 -model=unknown -thread_warp_size=32", [-1, 16, 64, 49152, 2147483647, 1024, 8, 32], "", 0, []], [[], [["FU", 2, [0, 1]], ["SP", 2, 0, 307328, [64], 1], ["AN", 2, 0, 5], ["AN", 2, 1, 6]]]], "r": [[6.3072e-06, 6.31281e-06, 6.31835e-06], 0, 3.59641, 1668919668], "v": "v0.6"}
{"i": [["[\"softmax_norm\", 6272, 49]", "cuda -keys=cuda,gpu -max_num_threads=1024 -model=unknown -thread_warp_size=32", [-1, 16, 64, 49152, 2147483647, 1024, 8, 32], "", 0, []], [[], [["FU", 2, [0, 1]], ["SP", 2, 0, 307328, [32], 1], ["AN", 2, 0, 5], ["AN", 2, 1, 6]]]], "r": [[1.00132e-05, 1.0026e-05, 1.00244e-05], 0, 3.32393, 1668919668], "v": "v0.6"}
{"i": [["[\"softmax_norm\", 6272, 49]", "cuda -keys=cuda,gpu -max_num_threads=1024 -model=unknown -thread_warp_size=32", [-1, 16, 64, 49152, 2147483647, 1024, 8, 32], "", 0, []], [[], [["FU", 2, [0, 1]], ["SP", 2, 0, 307328, [2], 1], ["AN", 2, 0, 5], ["AN", 2, 1, 6]]]], "r": [[0.000116696, 0.000116704, 0.00011671], 0, 2.55089, 1668919667], "v": "v0.6"}
{"i": [["[\"softmax_norm\", 6272, 49]", "cuda -keys=cuda,gpu -max_num_threads=1024 -model=unknown -thread_warp_size=32", [-1, 16, 64, 49152, 2147483647, 1024, 8, 32], "", 0, []], [[], [["FU", 2, [0, 1]], ["SP", 2, 0, 307328, [14], 1], ["AN", 2, 0, 5], ["AN", 2, 1, 6]]]], "r": [[1.92134e-05, 1.92169e-05, 1.92055e-05], 0, 4.03267, 1668919669], "v": "v0.6"}
{"i": [["[\"softmax_norm\", 6272, 49]", "cuda -keys=cuda,gpu -max_num_threads=1024 -model=unknown -thread_warp_size=32", [-1, 16, 64, 49152, 2147483647, 1024, 8, 32], "", 0, []], [[], [["FU", 2, [0, 1]], ["SP", 2, 0, 307328, [8], 1], ["AN", 2, 0, 5], ["AN", 2, 1, 6]]]], "r": [[3.13399e-05, 3.13463e-05, 3.13043e-05], 0, 4.66711, 1668919670], "v": "v0.6"}
{"i": [["[\"softmax_norm\", 6272, 49]", "cuda -keys=cuda,gpu -max_num_threads=1024 -model=unknown -thread_warp_size=32", [-1, 16, 64, 49152, 2147483647, 1024, 8, 32], "", 0, []], [[], [["FU", 2, [0, 1]], ["SP", 2, 0, 307328, [4], 1], ["AN", 2, 0, 5], ["AN", 2, 1, 6]]]], "r": [[5.97698e-05, 5.97536e-05, 5.9773e-05], 0, 4.34679, 1668919669], "v": "v0.6"}
