python/models/swin_transformer/kernel_configs/swin_transform_auto_tvm_tune_fused_reshape_permute_matmul_tensorcore_64_64_64_4_128.log
{"input": ["cuda -keys=cuda,gpu -max_num_threads=1024 -thread_warp_size=32", "fused_reshape_permute_matmul_tensorcore.cuda", [["TENSOR", [4096, 32, 4], "float16"], ["TENSOR", [128, 128], "float16"]], {}], "config": {"index": 9353, "code_hash": null, "entity": [["block_row_warps", "ot", 4], ["block_col_warps", "ot", 1], ["warp_row_tiles", "ot", 2], ["warp_col_tiles", "ot", 2], ["chunk", "ot", 8], ["offset", "ot", 0], ["offsetCS", "ot", 0], ["vec", "ot", 8], ["wmma_m", "ot", 16]]}, "result": [[0.000339893115, 1.1498165007112373e-05], 0, 1.0581560134887695, 1697195055.4484699], "version": 0.2, "tvm_version": "0.8.0"}
{"input": ["cuda -keys=cuda,gpu -max_num_threads=1024 -thread_warp_size=32", "fused_reshape_permute_matmul_tensorcore.cuda", [["TENSOR", [4096, 32, 4], "float16"], ["TENSOR", [128, 128], "float16"]], {}], "config": {"index": 12078, "code_hash": null, "entity": [["block_row_warps", "ot", 1], ["block_col_warps", "ot", 1], ["warp_row_tiles", "ot", 2], ["warp_col_tiles", "ot", 1], ["chunk", "ot", 2], ["offset", "ot", 8], ["offsetCS", "ot", 0], ["vec", "ot", 2], ["wmma_m", "ot", 8]]}, "result": [[0.000257042885, 7.57067512929008e-06], 0, 1.1362969875335693, 1697195056.014978], "version": 0.2, "tvm_version": "0.8.0"}
{"input": ["cuda -keys=cuda,gpu -max_num_threads=1024 -thread_warp_size=32", "fused_reshape_permute_matmul_tensorcore.cuda", [["TENSOR", [4096, 32, 4], "float16"], ["TENSOR", [128, 128], "float16"]], {}], "config": {"index": 715, "code_hash": null, "entity": [["block_row_warps", "ot", 2], ["block_col_warps", "ot", 2], ["warp_row_tiles", "ot", 2], ["warp_col_tiles", "ot", 4], ["chunk", "ot", 1], ["offset", "ot", 0], ["offsetCS", "ot", 8], ["vec", "ot", 1], ["wmma_m", "ot", 32]]}, "result": [[0.00028937481, 9.722564118001204e-06], 0, 1.16074538230896, 1697195056.546959], "version": 0.2, "tvm_version": "0.8.0"}
{"input": ["cuda -keys=cuda,gpu -max_num_threads=1024 -thread_warp_size=32", "fused_reshape_permute_matmul_tensorcore.cuda", [["TENSOR", [4096, 32, 4], "float16"], ["TENSOR", [128, 128], "float16"]], {}], "config": {"index": 610, "code_hash": null, "entity": [["block_row_warps", "ot", 2], ["block_col_warps", "ot", 4], ["warp_row_tiles", "ot", 2], ["warp_col_tiles", "ot", 2], ["chunk", "ot", 8], ["offset", "ot", 8], ["offsetCS", "ot", 0], ["vec", "ot", 1], ["wmma_m", "ot", 32]]}, "result": [[0.00041288969, 7.892200685266765e-06], 0, 1.2396626472473145, 1697195057.1049016], "version": 0.2, "tvm_version": "0.8.0"}
{"input": ["cuda -keys=cuda,gpu -max_num_threads=1024 -thread_warp_size=32", "fused_reshape_permute_matmul_tensorcore.cuda", [["TENSOR", [4096, 32, 4], "float16"], ["TENSOR", [128, 128], "float16"]], {}], "config": {"index": 2604, "code_hash": null, "entity": [["block_row_warps", "ot", 1], ["block_col_warps", "ot", 2], ["warp_row_tiles", "ot", 2], ["warp_col_tiles", "ot", 1], ["chunk", "ot", 1], ["offset", "ot", 0], ["offsetCS", "ot", 0], ["vec", "ot", 4], ["wmma_m", "ot", 32]]}, "result": [[0.000289056245, 8.44484058730991e-06], 0, 1.119485855102539, 1697195057.6769395], "version": 0.2, "tvm_version": "0.8.0"}
{"input": ["cuda -keys=cuda,gpu -max_num_threads=1024 -thread_warp_size=32", "fused_reshape_permute_matmul_tensorcore.cuda", [["TENSOR", [4096, 32, 4], "float16"], ["TENSOR", [128, 128], "float16"]], {}], "config": {"index": 1100, "code_hash": null, "entity": [["block_row_warps", "ot", 4], ["block_col_warps", "ot", 1], ["warp_row_tiles", "ot", 4], ["warp_col_tiles", "ot", 2], ["chunk", "ot", 2], ["offset", "ot", 8], ["offsetCS", "ot", 8], ["vec", "ot", 1], ["wmma_m", "ot", 32]]}, "result": [[0.000415796385, 1.0390544165054804e-05], 0, 1.2436509132385254, 1697195058.236305], "version": 0.2, "tvm_version": "0.8.0"}
{"input": ["cuda -keys=cuda,gpu -max_num_threads=1024 -thread_warp_size=32", "fused_reshape_permute_matmul_tensorcore.cuda", [["TENSOR", [4096, 32, 4], "float16"], ["TENSOR", [128, 128], "float16"]], {}], "config": {"index": 14994, "code_hash": null, "entity": [["block_row_warps", "ot", 1], ["block_col_warps", "ot", 1], ["warp_row_tiles", "ot", 2], ["warp_col_tiles", "ot", 1], ["chunk", "ot", 2], ["offset", "ot", 0], ["offsetCS", "ot", 8], ["vec", "ot", 8], ["wmma_m", "ot", 8]]}, "result": [[0.000295492545, 1.0493234873129473e-05], 0, 1.0696983337402344, 1697195058.7810504], "version": 0.2, "tvm_version": "0.8.0"}
{"input": ["cuda -keys=cuda,gpu -max_num_threads=1024 -thread_warp_size=32", "fused_reshape_permute_matmul_tensorcore.cuda", [["TENSOR", [4096, 32, 4], "float16"], ["TENSOR", [128, 128], "float16"]], {}], "config": {"index": 13225, "code_hash": null, "entity": [["block_row_warps", "ot", 2], ["block_col_warps", "ot", 2], ["warp_row_tiles", "ot", 4], ["warp_col_tiles", "ot", 1], ["chunk", "ot", 8], ["offset", "ot", 0], ["offsetCS", "ot", 0], ["vec", "ot", 4], ["wmma_m", "ot", 8]]}, "result": [[0.00040940207, 1.1828612619222306e-05], 0, 1.1383275985717773, 1697195059.3830152], "version": 0.2, "tvm_version": "0.8.0"}
{"input": ["cuda -keys=cuda,gpu -max_num_threads=1024 -thread_warp_size=32", "fused_reshape_permute_matmul_tensorcore.cuda", [["TENSOR", [4096, 32, 4], "float16"], ["TENSOR", [128, 128], "float16"]], {}], "config": {"index": 12844, "code_hash": null, "entity": [["block_row_warps", "ot", 2], ["block_col_warps", "ot", 1], ["warp_row_tiles", "ot", 4], ["warp_col_tiles", "ot", 2], ["chunk", "ot", 4], ["offset", "ot", 8], ["offsetCS", "ot", 8], ["vec", "ot", 2], ["wmma_m", "ot", 8]]}, "result": [[0.000413748695, 6.108963677639046e-06], 0, 1.2721257209777832, 1697195059.9480374], "version": 0.2, "tvm_version": "0.8.0"}
{"input": ["cuda -keys=cuda,gpu -max_num_threads=1024 -thread_warp_size=32", "fused_reshape_permute_matmul_tensorcore.cuda", [["TENSOR", [4096, 32, 4], "float16"], ["TENSOR", [128, 128], "float16"]], {}], "config": {"index": 3463, "code_hash": null, "entity": [["block_row_warps", "ot", 2], ["block_col_warps", "ot", 4], ["warp_row_tiles", "ot", 1], ["warp_col_tiles", "ot", 4], ["chunk", "ot", 4], ["offset", "ot", 0], ["offsetCS", "ot", 8], ["vec", "ot", 4], ["wmma_m", "ot", 32]]}, "result": [[0.000389272345, 1.080240735785953e-05], 0, 1.1198124885559082, 1697195060.5078707], "version": 0.2, "tvm_version": "0.8.0"}
{"input": ["cuda -keys=cuda,gpu -max_num_threads=1024 -thread_warp_size=32", "fused_reshape_permute_matmul_tensorcore.cuda", [["TENSOR", [4096, 32, 4], "float16"], ["TENSOR", [128, 128], "float16"]], {}], "config": {"index": 5374, "code_hash": null, "entity": [["block_row_warps", "ot", 2], ["block_col_warps", "ot", 1], ["warp_row_tiles", "ot", 1], ["warp_col_tiles", "ot", 2], ["chunk", "ot", 4], ["offset", "ot", 0], ["offsetCS", "ot", 0], ["vec", "ot", 1], ["wmma_m", "ot", 16]]}, "result": [[0.00029869435500000006, 1.3157011400651466e-05], 0, 1.077533483505249, 1697195061.0861926], "version": 0.2, "tvm_version": "0.8.0"}
{"input": ["cuda -keys=cuda,gpu -max_num_threads=1024 -thread_warp_size=32", "fused_reshape_permute_matmul_tensorcore.cuda", [["TENSOR", [4096, 32, 4], "float16"], ["TENSOR", [128, 128], "float16"]], {}], "config": {"index": 7223, "code_hash": null, "entity": [["block_row_warps", "ot", 4], ["block_col_warps", "ot", 2], ["warp_row_tiles", "ot", 2], ["warp_col_tiles", "ot", 1], ["chunk", "ot", 2], ["offset", "ot", 0], ["offsetCS", "ot", 8], ["vec", "ot", 2], ["wmma_m", "ot", 16]]}, "result": [[0.00025333792, 9.370353899883587e-06], 0, 0.9613442420959473, 1697195061.6123614], "version": 0.2, "tvm_version": "0.8.0"}
{"input": ["cuda -keys=cuda,gpu -max_num_threads=1024 -thread_warp_size=32", "fused_reshape_permute_matmul_tensorcore.cuda", [["TENSOR", [4096, 32, 4], "float16"], ["TENSOR", [128, 128], "float16"]], {}], "config": {"index": 11972, "code_hash": null, "entity": [["block_row_warps", "ot", 4], ["block_col_warps", "ot", 1], ["warp_row_tiles", "ot", 2], ["warp_col_tiles", "ot", 4], ["chunk", "ot", 8], ["offset", "ot", 0], ["offsetCS", "ot", 0], ["vec", "ot", 2], ["wmma_m", "ot", 8]]}, "result": [[0.00059397583, 1.2038522744220732e-05], 0, 1.1619665622711182, 1697195062.2070112], "version": 0.2, "tvm_version": "0.8.0"}
{"input": ["cuda -keys=cuda,gpu -max_num_threads=1024 -thread_warp_size=32", "fused_reshape_permute_matmul_tensorcore.cuda", [["TENSOR", [4096, 32, 4], "float16"], ["TENSOR", [128, 128], "float16"]], {}], "config": {"index": 10306, "code_hash": null, "entity": [["block_row_warps", "ot", 2], ["block_col_warps", "ot", 1], ["warp_row_tiles", "ot", 4], ["warp_col_tiles", "ot", 1], ["chunk", "ot", 8], ["offset", "ot", 8], ["offsetCS", "ot", 8], ["vec", "ot", 8], ["wmma_m", "ot", 16]]}, "result": [[0.00037117277000000003, 6.415300916699881e-06], 0, 0.9492776393890381, 1697195062.7979474], "version": 0.2, "tvm_version": "0.8.0"}
{"input": ["cuda -keys=cuda,gpu -max_num_threads=1024 -thread_warp_size=32", "fused_reshape_permute_matmul_tensorcore.cuda", [["TENSOR", [4096, 32, 4], "float16"], ["TENSOR", [128, 128], "float16"]], {}], "config": {"index": 8401, "code_hash": null, "entity": [["block_row_warps", "ot", 2], ["block_col_warps", "ot", 2], ["warp_row_tiles", "ot", 1], ["warp_col_tiles", "ot", 4], ["chunk", "ot", 8], ["offset", "ot", 8], ["offsetCS", "ot", 0], ["vec", "ot", 4], ["wmma_m", "ot", 16]]}, "result": [[0.00038151441, 7.111247017233761e-06], 0, 1.0552680492401123, 1697195063.3496902], "version": 0.2, "tvm_version": "0.8.0"}
{"input": ["cuda -keys=cuda,gpu -max_num_threads=1024 -thread_warp_size=32", "fused_reshape_permute_matmul_tensorcore.cuda", [["TENSOR", [4096, 32, 4], "float16"], ["TENSOR", [128, 128], "float16"]], {}], "config": {"index": 13707, "code_hash": null, "entity": [["block_row_warps", "ot", 1], ["block_col_warps", "ot", 1], ["warp_row_tiles", "ot", 4], ["warp_col_tiles", "ot", 1], ["chunk", "ot", 2], ["offset", "ot", 0], ["offsetCS", "ot", 8], ["vec", "ot", 4], ["wmma_m", "ot", 8]]}, "result": [[0.00029894602, 8.136521695257315e-06], 0, 0.9421272277832031, 1697195063.8902125], "version": 0.2, "tvm_version": "0.8.0"}
{"input": ["cuda -keys=cuda,gpu -max_num_threads=1024 -thread_warp_size=32", "fused_reshape_permute_matmul_tensorcore.cuda", [["TENSOR", [4096, 32, 4], "float16"], ["TENSOR", [128, 128], "float16"]], {}], "config": {"index": 10804, "code_hash": null, "entity": [["block_row_warps", "ot", 2], ["block_col_warps", "ot", 2], ["warp_row_tiles", "ot", 1], ["warp_col_tiles", "ot", 2], ["chunk", "ot", 2], ["offset", "ot", 8], ["offsetCS", "ot", 0], ["vec", "ot", 1], ["wmma_m", "ot", 8]]}, "result": [[0.00023950246499999998, 8.708877022653721e-06], 0, 1.0514802932739258, 1697195064.461486], "version": 0.2, "tvm_version": "0.8.0"}
{"input": ["cuda -keys=cuda,gpu -max_num_threads=1024 -thread_warp_size=32", "fused_reshape_permute_matmul_tensorcore.cuda", [["TENSOR", [4096, 32, 4], "float16"], ["TENSOR", [128, 128], "float16"]], {}], "config": {"index": 15485, "code_hash": null, "entity": [["block_row_warps", "ot", 4], ["block_col_warps", "ot", 2], ["warp_row_tiles", "ot", 2], ["warp_col_tiles", "ot", 1], ["chunk", "ot", 8], ["offset", "ot", 8], ["offsetCS", "ot", 8], ["vec", "ot", 8], ["wmma_m", "ot", 8]]}, "result": [[0.000292224835, 5.975584352984798e-06], 0, 0.9854607582092285, 1697195064.9960082], "version": 0.2, "tvm_version": "0.8.0"}
{"input": ["cuda -keys=cuda,gpu -max_num_threads=1024 -thread_warp_size=32", "fused_reshape_permute_matmul_tensorcore.cuda", [["TENSOR", [4096, 32, 4], "float16"], ["TENSOR", [128, 128], "float16"]], {}], "config": {"index": 3164, "code_hash": null, "entity": [["block_row_warps", "ot", 4], ["block_col_warps", "ot", 2], ["warp_row_tiles", "ot", 1], ["warp_col_tiles", "ot", 1], ["chunk", "ot", 8], ["offset", "ot", 8], ["offsetCS", "ot", 0], ["vec", "ot", 4], ["wmma_m", "ot", 32]]}, "result": [[0.000252053485, 8.512616684266104e-06], 0, 0.9407570362091064, 1697195065.521489], "version": 0.2, "tvm_version": "0.8.0"}
{"input": ["cuda -keys=cuda,gpu -max_num_threads=1024 -thread_warp_size=32", "fused_reshape_permute_matmul_tensorcore.cuda", [["TENSOR", [4096, 32, 4], "float16"], ["TENSOR", [128, 128], "float16"]], {}], "config": {"index": 10859, "code_hash": null, "entity": [["block_row_warps", "ot", 4], ["block_col_warps", "ot", 2], ["warp_row_tiles", "ot", 1], ["warp_col_tiles", "ot", 1], ["chunk", "ot", 4], ["offset", "ot", 8], ["offsetCS", "ot", 0], ["vec", "ot", 1], ["wmma_m", "ot", 8]]}, "result": [[0.00024901654, 7.400469509399358e-06], 0, 1.056232213973999, 1697195066.0932558], "version": 0.2, "tvm_version": "0.8.0"}
{"input": ["cuda -keys=cuda,gpu -max_num_threads=1024 -thread_warp_size=32", "fused_reshape_permute_matmul_tensorcore.cuda", [["TENSOR", [4096, 32, 4], "float16"], ["TENSOR", [128, 128], "float16"]], {}], "config": {"index": 100, "code_hash": null, "entity": [["block_row_warps", "ot", 2], ["block_col_warps", "ot", 1], ["warp_row_tiles", "ot", 4], ["warp_col_tiles", "ot", 1], ["chunk", "ot", 2], ["offset", "ot", 0], ["offsetCS", "ot", 0], ["vec", "ot", 1], ["wmma_m", "ot", 32]]}, "result": [[0.00029979191, 1.5440194444444444e-05], 0, 0.9386799335479736, 1697195066.6212008], "version": 0.2, "tvm_version": "0.8.0"}
{"input": ["cuda -keys=cuda,gpu -max_num_threads=1024 -thread_warp_size=32", "fused_reshape_permute_matmul_tensorcore.cuda", [["TENSOR", [4096, 32, 4], "float16"], ["TENSOR", [128, 128], "float16"]], {}], "config": {"index": 13417, "code_hash": null, "entity": [["block_row_warps", "ot", 2], ["block_col_warps", "ot", 4], ["warp_row_tiles", "ot", 4], ["warp_col_tiles", "ot", 2], ["chunk", "ot", 2], ["offset", "ot", 8], ["offsetCS", "ot", 0], ["vec", "ot", 4], ["wmma_m", "ot", 8]]}, "result": [[0.000308258245, 7.294667873303168e-06], 0, 0.9325463771820068, 1697195067.1576016], "version": 0.2, "tvm_version": "0.8.0"}
{"input": ["cuda -keys=cuda,gpu -max_num_threads=1024 -thread_warp_size=32", "fused_reshape_permute_matmul_tensorcore.cuda", [["TENSOR", [4096, 32, 4], "float16"], ["TENSOR", [128, 128], "float16"]], {}], "config": {"index": 3032, "code_hash": null, "entity": [["block_row_warps", "ot", 4], ["block_col_warps", "ot", 4], ["warp_row_tiles", "ot", 1], ["warp_col_tiles", "ot", 2], ["chunk", "ot", 2], ["offset", "ot", 8], ["offsetCS", "ot", 0], ["vec", "ot", 4], ["wmma_m", "ot", 32]]}, "result": [[0.00029030899000000003, 7.439549815498155e-06], 0, 0.9220261573791504, 1697195068.5044723], "version": 0.2, "tvm_version": "0.8.0"}
{"input": ["cuda -keys=cuda,gpu -max_num_threads=1024 -thread_warp_size=32", "fused_reshape_permute_matmul_tensorcore.cuda", [["TENSOR", [4096, 32, 4], "float16"], ["TENSOR", [128, 128], "float16"]], {}], "config": {"index": 2139, "code_hash": null, "entity": [["block_row_warps", "ot", 1], ["block_col_warps", "ot", 4], ["warp_row_tiles", "ot", 1], ["warp_col_tiles", "ot", 2], ["chunk", "ot", 4], ["offset", "ot", 0], ["offsetCS", "ot", 8], ["vec", "ot", 2], ["wmma_m", "ot", 32]]}, "result": [[0.000265829025, 1.1403697953422724e-05], 0, 1.006401538848877, 1697195069.0362186], "version": 0.2, "tvm_version": "0.8.0"}
{"input": ["cuda -keys=cuda,gpu -max_num_threads=1024 -thread_warp_size=32", "fused_reshape_permute_matmul_tensorcore.cuda", [["TENSOR", [4096, 32, 4], "float16"], ["TENSOR", [128, 128], "float16"]], {}], "config": {"index": 1960, "code_hash": null, "entity": [["block_row_warps", "ot", 2], ["block_col_warps", "ot", 4], ["warp_row_tiles", "ot", 2], ["warp_col_tiles", "ot", 1], ["chunk", "ot", 1], ["offset", "ot", 0], ["offsetCS", "ot", 8], ["vec", "ot", 2], ["wmma_m", "ot", 32]]}, "result": [[0.00026269683, 9.496748968768415e-06], 0, 1.0291905403137207, 1697195069.5668514], "version": 0.2, "tvm_version": "0.8.0"}
{"input": ["cuda -keys=cuda,gpu -max_num_threads=1024 -thread_warp_size=32", "fused_reshape_permute_matmul_tensorcore.cuda", [["TENSOR", [4096, 32, 4], "float16"], ["TENSOR", [128, 128], "float16"]], {}], "config": {"index": 11847, "code_hash": null, "entity": [["block_row_warps", "ot", 1], ["block_col_warps", "ot", 2], ["warp_row_tiles", "ot", 4], ["warp_col_tiles", "ot", 1], ["chunk", "ot", 4], ["offset", "ot", 0], ["offsetCS", "ot", 0], ["vec", "ot", 2], ["wmma_m", "ot", 8]]}, "result": [[0.00035502357999999995, 1.1922014032496306e-05], 0, 1.0522735118865967, 1697195070.161325], "version": 0.2, "tvm_version": "0.8.0"}
{"input": ["cuda -keys=cuda,gpu -max_num_threads=1024 -thread_warp_size=32", "fused_reshape_permute_matmul_tensorcore.cuda", [["TENSOR", [4096, 32, 4], "float16"], ["TENSOR", [128, 128], "float16"]], {}], "config": {"index": 7536, "code_hash": null, "entity": [["block_row_warps", "ot", 1], ["block_col_warps", "ot", 2], ["warp_row_tiles", "ot", 1], ["warp_col_tiles", "ot", 1], ["chunk", "ot", 2], ["offset", "ot", 8], ["offsetCS", "ot", 8], ["vec", "ot", 2], ["wmma_m", "ot", 16]]}, "result": [[0.000248354815, 7.103727593818986e-06], 0, 0.9845976829528809, 1697195070.695967], "version": 0.2, "tvm_version": "0.8.0"}
{"input": ["cuda -keys=cuda,gpu -max_num_threads=1024 -thread_warp_size=32", "fused_reshape_permute_matmul_tensorcore.cuda", [["TENSOR", [4096, 32, 4], "float16"], ["TENSOR", [128, 128], "float16"]], {}], "config": {"index": 3516, "code_hash": null, "entity": [["block_row_warps", "ot", 1], ["block_col_warps", "ot", 4], ["warp_row_tiles", "ot", 1], ["warp_col_tiles", "ot", 2], ["chunk", "ot", 8], ["offset", "ot", 0], ["offsetCS", "ot", 8], ["vec", "ot", 4], ["wmma_m", "ot", 32]]}, "result": [[0.000287111005, 1.1832738077769627e-05], 0, 1.0129420757293701, 1697195071.2308207], "version": 0.2, "tvm_version": "0.8.0"}
{"input": ["cuda -keys=cuda,gpu -max_num_threads=1024 -thread_warp_size=32", "fused_reshape_permute_matmul_tensorcore.cuda", [["TENSOR", [4096, 32, 4], "float16"], ["TENSOR", [128, 128], "float16"]], {}], "config": {"index": 13855, "code_hash": null, "entity": [["block_row_warps", "ot", 2], ["block_col_warps", "ot", 2], ["warp_row_tiles", "ot", 1], ["warp_col_tiles", "ot", 1], ["chunk", "ot", 8], ["offset", "ot", 0], ["offsetCS", "ot", 8], ["vec", "ot", 4], ["wmma_m", "ot", 8]]}, "result": [[0.00025682061999999996, 1.4743228310502281e-05], 0, 1.0252785682678223, 1697195071.8063855], "version": 0.2, "tvm_version": "0.8.0"}
{"input": ["cuda -keys=cuda,gpu -max_num_threads=1024 -thread_warp_size=32", "fused_reshape_permute_matmul_tensorcore.cuda", [["TENSOR", [4096, 32, 4], "float16"], ["TENSOR", [128, 128], "float16"]], {}], "config": {"index": 15268, "code_hash": null, "entity": [["block_row_warps", "ot", 2], ["block_col_warps", "ot", 2], ["warp_row_tiles", "ot", 2], ["warp_col_tiles", "ot", 2], ["chunk", "ot", 1], ["offset", "ot", 8], ["offsetCS", "ot", 8], ["vec", "ot", 8], ["wmma_m", "ot", 8]]}, "result": [[0.00026183596, 1.1938060133630287e-05], 0, 1.1156985759735107, 1697195072.3370934], "version": 0.2, "tvm_version": "0.8.0"}
{"input": ["cuda -keys=cuda,gpu -max_num_threads=1024 -thread_warp_size=32", "fused_reshape_permute_matmul_tensorcore.cuda", [["TENSOR", [4096, 32, 4], "float16"], ["TENSOR", [128, 128], "float16"]], {}], "config": {"index": 8361, "code_hash": null, "entity": [["block_row_warps", "ot", 1], ["block_col_warps", "ot", 1], ["warp_row_tiles", "ot", 4], ["warp_col_tiles", "ot", 1], ["chunk", "ot", 8], ["offset", "ot", 8], ["offsetCS", "ot", 0], ["vec", "ot", 4], ["wmma_m", "ot", 16]]}, "result": [[0.000362326985, 6.5499244516653135e-06], 0, 1.0190536975860596, 1697195072.8952975], "version": 0.2, "tvm_version": "0.8.0"}
{"input": ["cuda -keys=cuda,gpu -max_num_threads=1024 -thread_warp_size=32", "fused_reshape_permute_matmul_tensorcore.cuda", [["TENSOR", [4096, 32, 4], "float16"], ["TENSOR", [128, 128], "float16"]], {}], "config": {"index": 5202, "code_hash": null, "entity": [["block_row_warps", "ot", 1], ["block_col_warps", "ot", 1], ["warp_row_tiles", "ot", 4], ["warp_col_tiles", "ot", 1], ["chunk", "ot", 1], ["offset", "ot", 0], ["offsetCS", "ot", 0], ["vec", "ot", 1], ["wmma_m", "ot", 16]]}, "result": [[0.000234310555, 1.2141506777108433e-05], 0, 1.0131230354309082, 1697195073.4614532], "version": 0.2, "tvm_version": "0.8.0"}
{"input": ["cuda -keys=cuda,gpu -max_num_threads=1024 -thread_warp_size=32", "fused_reshape_permute_matmul_tensorcore.cuda", [["TENSOR", [4096, 32, 4], "float16"], ["TENSOR", [128, 128], "float16"]], {}], "config": {"index": 2087, "code_hash": null, "entity": [["block_row_warps", "ot", 4], ["block_col_warps", "ot", 4], ["warp_row_tiles", "ot", 1], ["warp_col_tiles", "ot", 4], ["chunk", "ot", 2], ["offset", "ot", 0], ["offsetCS", "ot", 8], ["vec", "ot", 2], ["wmma_m", "ot", 32]]}, "result": [[0.000250390865, 8.940993895671477e-06], 0, 1.1072795391082764, 1697195073.9890678], "version": 0.2, "tvm_version": "0.8.0"}
{"input": ["cuda -keys=cuda,gpu -max_num_threads=1024 -thread_warp_size=32", "fused_reshape_permute_matmul_tensorcore.cuda", [["TENSOR", [4096, 32, 4], "float16"], ["TENSOR", [128, 128], "float16"]], {}], "config": {"index": 15229, "code_hash": null, "entity": [["block_row_warps", "ot", 2], ["block_col_warps", "ot", 1], ["warp_row_tiles", "ot", 1], ["warp_col_tiles", "ot", 1], ["chunk", "ot", 1], ["offset", "ot", 8], ["offsetCS", "ot", 8], ["vec", "ot", 8], ["wmma_m", "ot", 8]]}, "result": [[0.00024191385499999998, 1.5357293447293448e-05], 0, 1.1138584613800049, 1697195074.5209293], "version": 0.2, "tvm_version": "0.8.0"}
{"input": ["cuda -keys=cuda,gpu -max_num_threads=1024 -thread_warp_size=32", "fused_reshape_permute_matmul_tensorcore.cuda", [["TENSOR", [4096, 32, 4], "float16"], ["TENSOR", [128, 128], "float16"]], {}], "config": {"index": 2222, "code_hash": null, "entity": [["block_row_warps", "ot", 4], ["block_col_warps", "ot", 4], ["warp_row_tiles", "ot", 1], ["warp_col_tiles", "ot", 2], ["chunk", "ot", 8], ["offset", "ot", 0], ["offsetCS", "ot", 8], ["vec", "ot", 2], ["wmma_m", "ot", 32]]}, "result": [[0.00031795123, 1.2477520092735705e-05], 0, 1.0062119960784912, 1697195075.1060445], "version": 0.2, "tvm_version": "0.8.0"}
{"input": ["cuda -keys=cuda,gpu -max_num_threads=1024 -thread_warp_size=32", "fused_reshape_permute_matmul_tensorcore.cuda", [["TENSOR", [4096, 32, 4], "float16"], ["TENSOR", [128, 128], "float16"]], {}], "config": {"index": 7395, "code_hash": null, "entity": [["block_row_warps", "ot", 1], ["block_col_warps", "ot", 4], ["warp_row_tiles", "ot", 4], ["warp_col_tiles", "ot", 1], ["chunk", "ot", 8], ["offset", "ot", 0], ["offsetCS", "ot", 8], ["vec", "ot", 2], ["wmma_m", "ot", 16]]}, "result": [[0.000388458125, 1.2185552790346908e-05], 0, 1.1331040859222412, 1697195075.6646335], "version": 0.2, "tvm_version": "0.8.0"}
{"input": ["cuda -keys=cuda,gpu -max_num_threads=1024 -thread_warp_size=32", "fused_reshape_permute_matmul_tensorcore.cuda", [["TENSOR", [4096, 32, 4], "float16"], ["TENSOR", [128, 128], "float16"]], {}], "config": {"index": 1991, "code_hash": null, "entity": [["block_row_warps", "ot", 4], ["block_col_warps", "ot", 1], ["warp_row_tiles", "ot", 4], ["warp_col_tiles", "ot", 2], ["chunk", "ot", 1], ["offset", "ot", 0], ["offsetCS", "ot", 8], ["vec", "ot", 2], ["wmma_m", "ot", 32]]}, "result": [[0.00027608817, 1.2131678705793828e-05], 0, 0.9835727214813232, 1697195076.198012], "version": 0.2, "tvm_version": "0.8.0"}
{"input": ["cuda -keys=cuda,gpu -max_num_threads=1024 -thread_warp_size=32", "fused_reshape_permute_matmul_tensorcore.cuda", [["TENSOR", [4096, 32, 4], "float16"], ["TENSOR", [128, 128], "float16"]], {}], "config": {"index": 8003, "code_hash": null, "entity": [["block_row_warps", "ot", 4], ["block_col_warps", "ot", 1], ["warp_row_tiles", "ot", 2], ["warp_col_tiles", "ot", 4], ["chunk", "ot", 4], ["offset", "ot", 0], ["offsetCS", "ot", 0], ["vec", "ot", 4], ["wmma_m", "ot", 16]]}, "result": [[0.0004203929200000001, 1.0066806230529594e-05], 0, 1.2300076484680176, 1697195076.8018913], "version": 0.2, "tvm_version": "0.8.0"}
{"input": ["cuda -keys=cuda,gpu -max_num_threads=1024 -thread_warp_size=32", "fused_reshape_permute_matmul_tensorcore.cuda", [["TENSOR", [4096, 32, 4], "float16"], ["TENSOR", [128, 128], "float16"]], {}], "config": {"index": 6341, "code_hash": null, "entity": [["block_row_warps", "ot", 4], ["block_col_warps", "ot", 2], ["warp_row_tiles", "ot", 4], ["warp_col_tiles", "ot", 1], ["chunk", "ot", 4], ["offset", "ot", 8], ["offsetCS", "ot", 8], ["vec", "ot", 1], ["wmma_m", "ot", 16]]}, "result": [[0.000397933445, 1.0172935768261964e-05], 0, 1.2055871486663818, 1697195077.3607516], "version": 0.2, "tvm_version": "0.8.0"}
{"input": ["cuda -keys=cuda,gpu -max_num_threads=1024 -thread_warp_size=32", "fused_reshape_permute_matmul_tensorcore.cuda", [["TENSOR", [4096, 32, 4], "float16"], ["TENSOR", [128, 128], "float16"]], {}], "config": {"index": 8683, "code_hash": null, "entity": [["block_row_warps", "ot", 2], ["block_col_warps", "ot", 4], ["warp_row_tiles", "ot", 2], ["warp_col_tiles", "ot", 1], ["chunk", "ot", 8], ["offset", "ot", 0], ["offsetCS", "ot", 8], ["vec", "ot", 4], ["wmma_m", "ot", 16]]}, "result": [[0.000289759505, 1.205025421686747e-05], 0, 1.0499522686004639, 1697195077.8818636], "version": 0.2, "tvm_version": "0.8.0"}
{"input": ["cuda -keys=cuda,gpu -max_num_threads=1024 -thread_warp_size=32", "fused_reshape_permute_matmul_tensorcore.cuda", [["TENSOR", [4096, 32, 4], "float16"], ["TENSOR", [128, 128], "float16"]], {}], "config": {"index": 2137, "code_hash": null, "entity": [["block_row_warps", "ot", 2], ["block_col_warps", "ot", 2], ["warp_row_tiles", "ot", 1], ["warp_col_tiles", "ot", 2], ["chunk", "ot", 4], ["offset", "ot", 0], ["offsetCS", "ot", 8], ["vec", "ot", 2], ["wmma_m", "ot", 32]]}, "result": [[0.000273967665, 1.171352177068215e-05], 0, 1.1533424854278564, 1697195078.457798], "version": 0.2, "tvm_version": "0.8.0"}
{"input": ["cuda -keys=cuda,gpu -max_num_threads=1024 -thread_warp_size=32", "fused_reshape_permute_matmul_tensorcore.cuda", [["TENSOR", [4096, 32, 4], "float16"], ["TENSOR", [128, 128], "float16"]], {}], "config": {"index": 112, "code_hash": null, "entity": [["block_row_warps", "ot", 2], ["block_col_warps", "ot", 2], ["warp_row_tiles", "ot", 1], ["warp_col_tiles", "ot", 2], ["chunk", "ot", 2], ["offset", "ot", 0], ["offsetCS", "ot", 0], ["vec", "ot", 1], ["wmma_m", "ot", 32]]}, "result": [[0.00022500067000000003, 9.29577970011534e-06], 0, 1.114884376525879, 1697195078.9814718], "version": 0.2, "tvm_version": "0.8.0"}
{"input": ["cuda -keys=cuda,gpu -max_num_threads=1024 -thread_warp_size=32", "fused_reshape_permute_matmul_tensorcore.cuda", [["TENSOR", [4096, 32, 4], "float16"], ["TENSOR", [128, 128], "float16"]], {}], "config": {"index": 14515, "code_hash": null, "entity": [["block_row_warps", "ot", 2], ["block_col_warps", "ot", 4], ["warp_row_tiles", "ot", 2], ["warp_col_tiles", "ot", 1], ["chunk", "ot", 8], ["offset", "ot", 0], ["offsetCS", "ot", 0], ["vec", "ot", 8], ["wmma_m", "ot", 8]]}, "result": [[0.00030213114999999997, 1.2556220062208398e-05], 0, 1.108778953552246, 1697195079.5311267], "version": 0.2, "tvm_version": "0.8.0"}
{"input": ["cuda -keys=cuda,gpu -max_num_threads=1024 -thread_warp_size=32", "fused_reshape_permute_matmul_tensorcore.cuda", [["TENSOR", [4096, 32, 4], "float16"], ["TENSOR", [128, 128], "float16"]], {}], "config": {"index": 8037, "code_hash": null, "entity": [["block_row_warps", "ot", 1], ["block_col_warps", "ot", 1], ["warp_row_tiles", "ot", 4], ["warp_col_tiles", "ot", 1], ["chunk", "ot", 8], ["offset", "ot", 0], ["offsetCS", "ot", 0], ["vec", "ot", 4], ["wmma_m", "ot", 16]]}, "result": [[0.00036675891999999997, 1.2990624598070738e-05], 0, 1.0027029514312744, 1697195080.1288621], "version": 0.2, "tvm_version": "0.8.0"}
{"input": ["cuda -keys=cuda,gpu -max_num_threads=1024 -thread_warp_size=32", "fused_reshape_permute_matmul_tensorcore.cuda", [["TENSOR", [4096, 32, 4], "float16"], ["TENSOR", [128, 128], "float16"]], {}], "config": {"index": 7063, "code_hash": null, "entity": [["block_row_warps", "ot", 2], ["block_col_warps", "ot", 4], ["warp_row_tiles", "ot", 2], ["warp_col_tiles", "ot", 1], ["chunk", "ot", 8], ["offset", "ot", 8], ["offsetCS", "ot", 0], ["vec", "ot", 2], ["wmma_m", "ot", 16]]}, "result": [[0.00029211798, 6.264680000000001e-06], 0, 1.0615482330322266, 1697195080.6642096], "version": 0.2, "tvm_version": "0.8.0"}
{"input": ["cuda -keys=cuda,gpu -max_num_threads=1024 -thread_warp_size=32", "fused_reshape_permute_matmul_tensorcore.cuda", [["TENSOR", [4096, 32, 4], "float16"], ["TENSOR", [128, 128], "float16"]], {}], "config": {"index": 42, "code_hash": null, "entity": [["block_row_warps", "ot", 1], ["block_col_warps", "ot", 4], ["warp_row_tiles", "ot", 2], ["warp_col_tiles", "ot", 2], ["chunk", "ot", 1], ["offset", "ot", 0], ["offsetCS", "ot", 0], ["vec", "ot", 1], ["wmma_m", "ot", 32]]}, "result": [[0.00022959382999999999, 9.675614508393286e-06], 0, 0.9464426040649414, 1697195081.1872673], "version": 0.2, "tvm_version": "0.8.0"}
{"input": ["cuda -keys=cuda,gpu -max_num_threads=1024 -thread_warp_size=32", "fused_reshape_permute_matmul_tensorcore.cuda", [["TENSOR", [4096, 32, 4], "float16"], ["TENSOR", [128, 128], "float16"]], {}], "config": {"index": 102, "code_hash": null, "entity": [["block_row_warps", "ot", 1], ["block_col_warps", "ot", 2], ["warp_row_tiles", "ot", 4], ["warp_col_tiles", "ot", 1], ["chunk", "ot", 2], ["offset", "ot", 0], ["offsetCS", "ot", 0], ["vec", "ot", 1], ["wmma_m", "ot", 32]]}, "result": [[0.00027193459, 1.4250115724381625e-05], 0, 0.9874289035797119, 1697195081.7605135], "version": 0.2, "tvm_version": "0.8.0"}
{"input": ["cuda -keys=cuda,gpu -max_num_threads=1024 -thread_warp_size=32", "fused_reshape_permute_matmul_tensorcore.cuda", [["TENSOR", [4096, 32, 4], "float16"], ["TENSOR", [128, 128], "float16"]], {}], "config": {"index": 5788, "code_hash": null, "entity": [["block_row_warps", "ot", 2], ["block_col_warps", "ot", 1], ["warp_row_tiles", "ot", 2], ["warp_col_tiles", "ot", 2], ["chunk", "ot", 8], ["offset", "ot", 8], ["offsetCS", "ot", 0], ["vec", "ot", 1], ["wmma_m", "ot", 16]]}, "result": [[0.00044860145, 7.288664111812445e-06], 0, 1.1483314037322998, 1697195082.326973], "version": 0.2, "tvm_version": "0.8.0"}
{"input": ["cuda -keys=cuda,gpu -max_num_threads=1024 -thread_warp_size=32", "fused_reshape_permute_matmul_tensorcore.cuda", [["TENSOR", [4096, 32, 4], "float16"], ["TENSOR", [128, 128], "float16"]], {}], "config": {"index": 8635, "code_hash": null, "entity": [["block_row_warps", "ot", 2], ["block_col_warps", "ot", 2], ["warp_row_tiles", "ot", 4], ["warp_col_tiles", "ot", 2], ["chunk", "ot", 4], ["offset", "ot", 0], ["offsetCS", "ot", 8], ["vec", "ot", 4], ["wmma_m", "ot", 16]]}, "result": [[0.00044229967000000003, 9.399961538461538e-06], 0, 1.1653287410736084, 1697195082.895408], "version": 0.2, "tvm_version": "0.8.0"}
{"input": ["cuda -keys=cuda,gpu -max_num_threads=1024 -thread_warp_size=32", "fused_reshape_permute_matmul_tensorcore.cuda", [["TENSOR", [4096, 32, 4], "float16"], ["TENSOR", [128, 128], "float16"]], {}], "config": {"index": 14986, "code_hash": null, "entity": [["block_row_warps", "ot", 2], ["block_col_warps", "ot", 1], ["warp_row_tiles", "ot", 1], ["warp_col_tiles", "ot", 1], ["chunk", "ot", 2], ["offset", "ot", 0], ["offsetCS", "ot", 8], ["vec", "ot", 8], ["wmma_m", "ot", 8]]}, "result": [[0.000267081345, 1.307988978930308e-05], 0, 0.944413423538208, 1697195083.4718251], "version": 0.2, "tvm_version": "0.8.0"}
{"input": ["cuda -keys=cuda,gpu -max_num_threads=1024 -thread_warp_size=32", "fused_reshape_permute_matmul_tensorcore.cuda", [["TENSOR", [4096, 32, 4], "float16"], ["TENSOR", [128, 128], "float16"]], {}], "config": {"index": 8119, "code_hash": null, "entity": [["block_row_warps", "ot", 2], ["block_col_warps", "ot", 1], ["warp_row_tiles", "ot", 4], ["warp_col_tiles", "ot", 1], ["chunk", "ot", 1], ["offset", "ot", 8], ["offsetCS", "ot", 0], ["vec", "ot", 4], ["wmma_m", "ot", 16]]}, "result": [[0.00029723134999999997, 7.932649631449632e-06], 0, 1.055654764175415, 1697195084.0099678], "version": 0.2, "tvm_version": "0.8.0"}
{"input": ["cuda -keys=cuda,gpu -max_num_threads=1024 -thread_warp_size=32", "fused_reshape_permute_matmul_tensorcore.cuda", [["TENSOR", [4096, 32, 4], "float16"], ["TENSOR", [128, 128], "float16"]], {}], "config": {"index": 383, "code_hash": null, "entity": [["block_row_warps", "ot", 4], ["block_col_warps", "ot", 2], ["warp_row_tiles", "ot", 1], ["warp_col_tiles", "ot", 4], ["chunk", "ot", 1], ["offset", "ot", 8], ["offsetCS", "ot", 0], ["vec", "ot", 1], ["wmma_m", "ot", 32]]}, "result": [[0.000236499025, 9.488371764705881e-06], 0, 1.0966269969940186, 1697195084.535546], "version": 0.2, "tvm_version": "0.8.0"}
{"input": ["cuda -keys=cuda,gpu -max_num_threads=1024 -thread_warp_size=32", "fused_reshape_permute_matmul_tensorcore.cuda", [["TENSOR", [4096, 32, 4], "float16"], ["TENSOR", [128, 128], "float16"]], {}], "config": {"index": 5524, "code_hash": null, "entity": [["block_row_warps", "ot", 2], ["block_col_warps", "ot", 4], ["warp_row_tiles", "ot", 2], ["warp_col_tiles", "ot", 1], ["chunk", "ot", 1], ["offset", "ot", 8], ["offsetCS", "ot", 0], ["vec", "ot", 1], ["wmma_m", "ot", 16]]}, "result": [[0.00022585336, 8.057873063468266e-06], 0, 0.8510024547576904, 1697195119.7226999], "version": 0.2, "tvm_version": "0.8.0"}
{"input": ["cuda -keys=cuda,gpu -max_num_threads=1024 -thread_warp_size=32", "fused_reshape_permute_matmul_tensorcore.cuda", [["TENSOR", [4096, 32, 4], "float16"], ["TENSOR", [128, 128], "float16"]], {}], "config": {"index": 6157, "code_hash": null, "entity": [["block_row_warps", "ot", 2], ["block_col_warps", "ot", 1], ["warp_row_tiles", "ot", 1], ["warp_col_tiles", "ot", 1], ["chunk", "ot", 1], ["offset", "ot", 8], ["offsetCS", "ot", 8], ["vec", "ot", 1], ["wmma_m", "ot", 16]]}, "result": [[0.00023804961500000003, 7.891178658835047e-06], 0, 0.8805608749389648, 1697195120.234315], "version": 0.2, "tvm_version": "0.8.0"}
{"input": ["cuda -keys=cuda,gpu -max_num_threads=1024 -thread_warp_size=32", "fused_reshape_permute_matmul_tensorcore.cuda", [["TENSOR", [4096, 32, 4], "float16"], ["TENSOR", [128, 128], "float16"]], {}], "config": {"index": 5515, "code_hash": null, "entity": [["block_row_warps", "ot", 2], ["block_col_warps", "ot", 4], ["warp_row_tiles", "ot", 1], ["warp_col_tiles", "ot", 1], ["chunk", "ot", 1], ["offset", "ot", 8], ["offsetCS", "ot", 0], ["vec", "ot", 1], ["wmma_m", "ot", 16]]}, "result": [[0.000225352825, 8.121978841309823e-06], 0, 0.841106653213501, 1697195120.7000427], "version": 0.2, "tvm_version": "0.8.0"}
{"input": ["cuda -keys=cuda,gpu -max_num_threads=1024 -thread_warp_size=32", "fused_reshape_permute_matmul_tensorcore.cuda", [["TENSOR", [4096, 32, 4], "float16"], ["TENSOR", [128, 128], "float16"]], {}], "config": {"index": 6172, "code_hash": null, "entity": [["block_row_warps", "ot", 2], ["block_col_warps", "ot", 4], ["warp_row_tiles", "ot", 2], ["warp_col_tiles", "ot", 1], ["chunk", "ot", 1], ["offset", "ot", 8], ["offsetCS", "ot", 8], ["vec", "ot", 1], ["wmma_m", "ot", 16]]}, "result": [[0.00022472699999999998, 7.793751210067765e-06], 0, 0.843247652053833, 1697195121.1695623], "version": 0.2, "tvm_version": "0.8.0"}
{"input": ["cuda -keys=cuda,gpu -max_num_threads=1024 -thread_warp_size=32", "fused_reshape_permute_matmul_tensorcore.cuda", [["TENSOR", [4096, 32, 4], "float16"], ["TENSOR", [128, 128], "float16"]], {}], "config": {"index": 6163, "code_hash": null, "entity": [["block_row_warps", "ot", 2], ["block_col_warps", "ot", 4], ["warp_row_tiles", "ot", 1], ["warp_col_tiles", "ot", 1], ["chunk", "ot", 1], ["offset", "ot", 8], ["offsetCS", "ot", 8], ["vec", "ot", 1], ["wmma_m", "ot", 16]]}, "result": [[8.024594219010561e-06, 8.035163424124514e-06], 0, 0.8314898014068604, 1697195121.6429987], "version": 0.2, "tvm_version": "0.8.0"}
{"input": ["cuda -keys=cuda,gpu -max_num_threads=1024 -thread_warp_size=32", "fused_reshape_permute_matmul_tensorcore.cuda", [["TENSOR", [4096, 32, 4], "float16"], ["TENSOR", [128, 128], "float16"]], {}], "config": {"index": 10700, "code_hash": null, "entity": [["block_row_warps", "ot", 4], ["block_col_warps", "ot", 4], ["warp_row_tiles", "ot", 1], ["warp_col_tiles", "ot", 1], ["chunk", "ot", 1], ["offset", "ot", 8], ["offsetCS", "ot", 0], ["vec", "ot", 1], ["wmma_m", "ot", 8]]}, "result": [[0.00022901558999999998, 8.328115762273901e-06], 0, 0.8506906032562256, 1697195122.1047432], "version": 0.2, "tvm_version": "0.8.0"}
{"input": ["cuda -keys=cuda,gpu -max_num_threads=1024 -thread_warp_size=32", "fused_reshape_permute_matmul_tensorcore.cuda", [["TENSOR", [4096, 32, 4], "float16"], ["TENSOR", [128, 128], "float16"]], {}], "config": {"index": 5200, "code_hash": null, "entity": [["block_row_warps", "ot", 2], ["block_col_warps", "ot", 4], ["warp_row_tiles", "ot", 2], ["warp_col_tiles", "ot", 1], ["chunk", "ot", 1], ["offset", "ot", 0], ["offsetCS", "ot", 0], ["vec", "ot", 1], ["wmma_m", "ot", 16]]}, "result": [[0.000262743915, 8.779253536452668e-06], 0, 0.8577661514282227, 1697195122.5731242], "version": 0.2, "tvm_version": "0.8.0"}
{"input": ["cuda -keys=cuda,gpu -max_num_threads=1024 -thread_warp_size=32", "fused_reshape_permute_matmul_tensorcore.cuda", [["TENSOR", [4096, 32, 4], "float16"], ["TENSOR", [128, 128], "float16"]], {}], "config": {"index": 5509, "code_hash": null, "entity": [["block_row_warps", "ot", 2], ["block_col_warps", "ot", 1], ["warp_row_tiles", "ot", 1], ["warp_col_tiles", "ot", 1], ["chunk", "ot", 1], ["offset", "ot", 8], ["offsetCS", "ot", 0], ["vec", "ot", 1], ["wmma_m", "ot", 16]]}, "result": [[8.000098731384447e-06, 8.008587424158854e-06], 0, 0.8546144962310791, 1697195123.0497108], "version": 0.2, "tvm_version": "0.8.0"}
{"input": ["cuda -keys=cuda,gpu -max_num_threads=1024 -thread_warp_size=32", "fused_reshape_permute_matmul_tensorcore.cuda", [["TENSOR", [4096, 32, 4], "float16"], ["TENSOR", [128, 128], "float16"]], {}], "config": {"index": 6160, "code_hash": null, "entity": [["block_row_warps", "ot", 2], ["block_col_warps", "ot", 2], ["warp_row_tiles", "ot", 1], ["warp_col_tiles", "ot", 1], ["chunk", "ot", 1], ["offset", "ot", 8], ["offsetCS", "ot", 8], ["vec", "ot", 1], ["wmma_m", "ot", 16]]}, "result": [[7.967660429279032e-06, 7.973659878921299e-06], 0, 0.8670370578765869, 1697195123.4772973], "version": 0.2, "tvm_version": "0.8.0"}
{"input": ["cuda -keys=cuda,gpu -max_num_threads=1024 -thread_warp_size=32", "fused_reshape_permute_matmul_tensorcore.cuda", [["TENSOR", [4096, 32, 4], "float16"], ["TENSOR", [128, 128], "float16"]], {}], "config": {"index": 5191, "code_hash": null, "entity": [["block_row_warps", "ot", 2], ["block_col_warps", "ot", 4], ["warp_row_tiles", "ot", 1], ["warp_col_tiles", "ot", 1], ["chunk", "ot", 1], ["offset", "ot", 0], ["offsetCS", "ot", 0], ["vec", "ot", 1], ["wmma_m", "ot", 16]]}, "result": [[0.00022756971, 8.952719200887902e-06], 0, 0.8883929252624512, 1697195123.9388497], "version": 0.2, "tvm_version": "0.8.0"}
{"input": ["cuda -keys=cuda,gpu -max_num_threads=1024 -thread_warp_size=32", "fused_reshape_permute_matmul_tensorcore.cuda", [["TENSOR", [4096, 32, 4], "float16"], ["TENSOR", [128, 128], "float16"]], {}], "config": {"index": 10694, "code_hash": null, "entity": [["block_row_warps", "ot", 4], ["block_col_warps", "ot", 1], ["warp_row_tiles", "ot", 1], ["warp_col_tiles", "ot", 1], ["chunk", "ot", 1], ["offset", "ot", 8], ["offsetCS", "ot", 0], ["vec", "ot", 1], ["wmma_m", "ot", 8]]}, "result": [[8.25288335220838e-06, 8.25735617214043e-06], 0, 0.850348711013794, 1697195124.4110432], "version": 0.2, "tvm_version": "0.8.0"}
{"input": ["cuda -keys=cuda,gpu -max_num_threads=1024 -thread_warp_size=32", "fused_reshape_permute_matmul_tensorcore.cuda", [["TENSOR", [4096, 32, 4], "float16"], ["TENSOR", [128, 128], "float16"]], {}], "config": {"index": 5848, "code_hash": null, "entity": [["block_row_warps", "ot", 2], ["block_col_warps", "ot", 4], ["warp_row_tiles", "ot", 2], ["warp_col_tiles", "ot", 1], ["chunk", "ot", 1], ["offset", "ot", 0], ["offsetCS", "ot", 8], ["vec", "ot", 1], ["wmma_m", "ot", 16]]}, "result": [[0.00025872865999999997, 8.414410015649453e-06], 0, 0.8743984699249268, 1697195124.8799183], "version": 0.2, "tvm_version": "0.8.0"}
{"input": ["cuda -keys=cuda,gpu -max_num_threads=1024 -thread_warp_size=32", "fused_reshape_permute_matmul_tensorcore.cuda", [["TENSOR", [4096, 32, 4], "float16"], ["TENSOR", [128, 128], "float16"]], {}], "config": {"index": 10697, "code_hash": null, "entity": [["block_row_warps", "ot", 4], ["block_col_warps", "ot", 2], ["warp_row_tiles", "ot", 1], ["warp_col_tiles", "ot", 1], ["chunk", "ot", 1], ["offset", "ot", 8], ["offsetCS", "ot", 0], ["vec", "ot", 1], ["wmma_m", "ot", 8]]}, "result": [[8.337777904979966e-06, 8.341616485403549e-06], 0, 0.8123340606689453, 1697195125.3094735], "version": 0.2, "tvm_version": "0.8.0"}
{"input": ["cuda -keys=cuda,gpu -max_num_threads=1024 -thread_warp_size=32", "fused_reshape_permute_matmul_tensorcore.cuda", [["TENSOR", [4096, 32, 4], "float16"], ["TENSOR", [128, 128], "float16"]], {}], "config": {"index": 6166, "code_hash": null, "entity": [["block_row_warps", "ot", 2], ["block_col_warps", "ot", 1], ["warp_row_tiles", "ot", 2], ["warp_col_tiles", "ot", 1], ["chunk", "ot", 1], ["offset", "ot", 8], ["offsetCS", "ot", 8], ["vec", "ot", 1], ["wmma_m", "ot", 16]]}, "result": [[7.83540411700975e-06, 7.84003954496208e-06], 0, 0.855536699295044, 1697195125.77718], "version": 0.2, "tvm_version": "0.8.0"}
{"input": ["cuda -keys=cuda,gpu -max_num_threads=1024 -thread_warp_size=32", "fused_reshape_permute_matmul_tensorcore.cuda", [["TENSOR", [4096, 32, 4], "float16"], ["TENSOR", [128, 128], "float16"]], {}], "config": {"index": 5512, "code_hash": null, "entity": [["block_row_warps", "ot", 2], ["block_col_warps", "ot", 2], ["warp_row_tiles", "ot", 1], ["warp_col_tiles", "ot", 1], ["chunk", "ot", 1], ["offset", "ot", 8], ["offsetCS", "ot", 0], ["vec", "ot", 1], ["wmma_m", "ot", 16]]}, "result": [[8.008136413641364e-06, 8.01270407040704e-06], 0, 0.8433270454406738, 1697195126.210339], "version": 0.2, "tvm_version": "0.8.0"}
{"input": ["cuda -keys=cuda,gpu -max_num_threads=1024 -thread_warp_size=32", "fused_reshape_permute_matmul_tensorcore.cuda", [["TENSOR", [4096, 32, 4], "float16"], ["TENSOR", [128, 128], "float16"]], {}], "config": {"index": 5833, "code_hash": null, "entity": [["block_row_warps", "ot", 2], ["block_col_warps", "ot", 1], ["warp_row_tiles", "ot", 1], ["warp_col_tiles", "ot", 1], ["chunk", "ot", 1], ["offset", "ot", 0], ["offsetCS", "ot", 8], ["vec", "ot", 1], ["wmma_m", "ot", 16]]}, "result": [[0.00023809141499999998, 8.934772299168974e-06], 0, 0.8589036464691162, 1697195126.6750097], "version": 0.2, "tvm_version": "0.8.0"}
{"input": ["cuda -keys=cuda,gpu -max_num_threads=1024 -thread_warp_size=32", "fused_reshape_permute_matmul_tensorcore.cuda", [["TENSOR", [4096, 32, 4], "float16"], ["TENSOR", [128, 128], "float16"]], {}], "config": {"index": 11342, "code_hash": null, "entity": [["block_row_warps", "ot", 4], ["block_col_warps", "ot", 1], ["warp_row_tiles", "ot", 1], ["warp_col_tiles", "ot", 1], ["chunk", "ot", 1], ["offset", "ot", 8], ["offsetCS", "ot", 8], ["vec", "ot", 1], ["wmma_m", "ot", 8]]}, "result": [[0.00023079550500000002, 8.114234642497483e-06], 0, 0.9034669399261475, 1697195127.1884751], "version": 0.2, "tvm_version": "0.8.0"}
{"input": ["cuda -keys=cuda,gpu -max_num_threads=1024 -thread_warp_size=32", "fused_reshape_permute_matmul_tensorcore.cuda", [["TENSOR", [4096, 32, 4], "float16"], ["TENSOR", [128, 128], "float16"]], {}], "config": {"index": 5839, "code_hash": null, "entity": [["block_row_warps", "ot", 2], ["block_col_warps", "ot", 4], ["warp_row_tiles", "ot", 1], ["warp_col_tiles", "ot", 1], ["chunk", "ot", 1], ["offset", "ot", 0], ["offsetCS", "ot", 8], ["vec", "ot", 1], ["wmma_m", "ot", 16]]}, "result": [[8.909295731707317e-06, 8.914726219512196e-06], 0, 0.8407084941864014, 1697195127.617995], "version": 0.2, "tvm_version": "0.8.0"}
{"input": ["cuda -keys=cuda,gpu -max_num_threads=1024 -thread_warp_size=32", "fused_reshape_permute_matmul_tensorcore.cuda", [["TENSOR", [4096, 32, 4], "float16"], ["TENSOR", [128, 128], "float16"]], {}], "config": {"index": 11348, "code_hash": null, "entity": [["block_row_warps", "ot", 4], ["block_col_warps", "ot", 4], ["warp_row_tiles", "ot", 1], ["warp_col_tiles", "ot", 1], ["chunk", "ot", 1], ["offset", "ot", 8], ["offsetCS", "ot", 8], ["vec", "ot", 1], ["wmma_m", "ot", 8]]}, "result": [[8.289480802292265e-06, 8.2954e-06], 0, 0.8256473541259766, 1697195128.0453026], "version": 0.2, "tvm_version": "0.8.0"}
{"input": ["cuda -keys=cuda,gpu -max_num_threads=1024 -thread_warp_size=32", "fused_reshape_permute_matmul_tensorcore.cuda", [["TENSOR", [4096, 32, 4], "float16"], ["TENSOR", [128, 128], "float16"]], {}], "config": {"index": 5185, "code_hash": null, "entity": [["block_row_warps", "ot", 2], ["block_col_warps", "ot", 1], ["warp_row_tiles", "ot", 1], ["warp_col_tiles", "ot", 1], ["chunk", "ot", 1], ["offset", "ot", 0], ["offsetCS", "ot", 0], ["vec", "ot", 1], ["wmma_m", "ot", 16]]}, "result": [[9.053868193069306e-06, 9.062632425742574e-06], 0, 0.8499596118927002, 1697195128.521886], "version": 0.2, "tvm_version": "0.8.0"}
{"input": ["cuda -keys=cuda,gpu -max_num_threads=1024 -thread_warp_size=32", "fused_reshape_permute_matmul_tensorcore.cuda", [["TENSOR", [4096, 32, 4], "float16"], ["TENSOR", [128, 128], "float16"]], {}], "config": {"index": 6874, "code_hash": null, "entity": [["block_row_warps", "ot", 2], ["block_col_warps", "ot", 4], ["warp_row_tiles", "ot", 2], ["warp_col_tiles", "ot", 4], ["chunk", "ot", 1], ["offset", "ot", 8], ["offsetCS", "ot", 0], ["vec", "ot", 2], ["wmma_m", "ot", 16]]}, "result": [[0.00025732178500000003, 8.28600975359343e-06], 0, 1.1438801288604736, 1697196674.1539333], "version": 0.2, "tvm_version": "0.8.0"}
{"input": ["cuda -keys=cuda,gpu -max_num_threads=1024 -thread_warp_size=32", "fused_reshape_permute_matmul_tensorcore.cuda", [["TENSOR", [4096, 32, 4], "float16"], ["TENSOR", [128, 128], "float16"]], {}], "config": {"index": 680, "code_hash": null, "entity": [["block_row_warps", "ot", 4], ["block_col_warps", "ot", 2], ["warp_row_tiles", "ot", 1], ["warp_col_tiles", "ot", 2], ["chunk", "ot", 1], ["offset", "ot", 0], ["offsetCS", "ot", 8], ["vec", "ot", 1], ["wmma_m", "ot", 32]]}, "result": [[0.000207807165, 1.0707282868525896e-05], 0, 1.1518983840942383, 1697196674.7166119], "version": 0.2, "tvm_version": "0.8.0"}
{"input": ["cuda -keys=cuda,gpu -max_num_threads=1024 -thread_warp_size=32", "fused_reshape_permute_matmul_tensorcore.cuda", [["TENSOR", [4096, 32, 4], "float16"], ["TENSOR", [128, 128], "float16"]], {}], "config": {"index": 11041, "code_hash": null, "entity": [["block_row_warps", "ot", 2], ["block_col_warps", "ot", 4], ["warp_row_tiles", "ot", 4], ["warp_col_tiles", "ot", 1], ["chunk", "ot", 1], ["offset", "ot", 0], ["offsetCS", "ot", 8], ["vec", "ot", 1], ["wmma_m", "ot", 8]]}, "result": [[0.00023921635, 9.613779964221826e-06], 0, 1.025275468826294, 1697196675.2389672], "version": 0.2, "tvm_version": "0.8.0"}
{"input": ["cuda -keys=cuda,gpu -max_num_threads=1024 -thread_warp_size=32", "fused_reshape_permute_matmul_tensorcore.cuda", [["TENSOR", [4096, 32, 4], "float16"], ["TENSOR", [128, 128], "float16"]], {}], "config": {"index": 3607, "code_hash": null, "entity": [["block_row_warps", "ot", 2], ["block_col_warps", "ot", 4], ["warp_row_tiles", "ot", 2], ["warp_col_tiles", "ot", 2], ["chunk", "ot", 1], ["offset", "ot", 8], ["offsetCS", "ot", 8], ["vec", "ot", 4], ["wmma_m", "ot", 32]]}, "result": [[0.00028699316, 7.74363400576369e-06], 0, 1.1971220970153809, 1697196675.7706065], "version": 0.2, "tvm_version": "0.8.0"}
{"input": ["cuda -keys=cuda,gpu -max_num_threads=1024 -thread_warp_size=32", "fused_reshape_permute_matmul_tensorcore.cuda", [["TENSOR", [4096, 32, 4], "float16"], ["TENSOR", [128, 128], "float16"]], {}], "config": {"index": 12041, "code_hash": null, "entity": [["block_row_warps", "ot", 4], ["block_col_warps", "ot", 4], ["warp_row_tiles", "ot", 4], ["warp_col_tiles", "ot", 2], ["chunk", "ot", 1], ["offset", "ot", 8], ["offsetCS", "ot", 0], ["vec", "ot", 2], ["wmma_m", "ot", 8]]}, "result": [[0.000264684695, 8.721666846944295e-06], 0, 1.2061045169830322, 1697196676.3414977], "version": 0.2, "tvm_version": "0.8.0"}
{"input": ["cuda -keys=cuda,gpu -max_num_threads=1024 -thread_warp_size=32", "fused_reshape_permute_matmul_tensorcore.cuda", [["TENSOR", [4096, 32, 4], "float16"], ["TENSOR", [128, 128], "float16"]], {}], "config": {"index": 487, "code_hash": null, "entity": [["block_row_warps", "ot", 2], ["block_col_warps", "ot", 1], ["warp_row_tiles", "ot", 1], ["warp_col_tiles", "ot", 1], ["chunk", "ot", 4], ["offset", "ot", 8], ["offsetCS", "ot", 0], ["vec", "ot", 1], ["wmma_m", "ot", 32]]}, "result": [[0.00025025881, 8.2128679245283e-06], 0, 1.0521800518035889, 1697196676.868889], "version": 0.2, "tvm_version": "0.8.0"}
{"input": ["cuda -keys=cuda,gpu -max_num_threads=1024 -thread_warp_size=32", "fused_reshape_permute_matmul_tensorcore.cuda", [["TENSOR", [4096, 32, 4], "float16"], ["TENSOR", [128, 128], "float16"]], {}], "config": {"index": 12419, "code_hash": null, "entity": [["block_row_warps", "ot", 4], ["block_col_warps", "ot", 4], ["warp_row_tiles", "ot", 4], ["warp_col_tiles", "ot", 1], ["chunk", "ot", 2], ["offset", "ot", 0], ["offsetCS", "ot", 8], ["vec", "ot", 2], ["wmma_m", "ot", 8]]}, "result": [[0.00025933499999999997, 8.549839702760084e-06], 0, 1.015105962753296, 1697196677.3961227], "version": 0.2, "tvm_version": "0.8.0"}
{"input": ["cuda -keys=cuda,gpu -max_num_threads=1024 -thread_warp_size=32", "fused_reshape_permute_matmul_tensorcore.cuda", [["TENSOR", [4096, 32, 4], "float16"], ["TENSOR", [128, 128], "float16"]], {}], "config": {"index": 13202, "code_hash": null, "entity": [["block_row_warps", "ot", 4], ["block_col_warps", "ot", 4], ["warp_row_tiles", "ot", 4], ["warp_col_tiles", "ot", 4], ["chunk", "ot", 4], ["offset", "ot", 0], ["offsetCS", "ot", 0], ["vec", "ot", 4], ["wmma_m", "ot", 8]]}, "result": [[0.00068951965, 1.4375286476868326e-05], 0, 1.3238966464996338, 1697196678.053147], "version": 0.2, "tvm_version": "0.8.0"}
{"input": ["cuda -keys=cuda,gpu -max_num_threads=1024 -thread_warp_size=32", "fused_reshape_permute_matmul_tensorcore.cuda", [["TENSOR", [4096, 32, 4], "float16"], ["TENSOR", [128, 128], "float16"]], {}], "config": {"index": 1496, "code_hash": null, "entity": [["block_row_warps", "ot", 4], ["block_col_warps", "ot", 1], ["warp_row_tiles", "ot", 2], ["warp_col_tiles", "ot", 2], ["chunk", "ot", 4], ["offset", "ot", 0], ["offsetCS", "ot", 0], ["vec", "ot", 2], ["wmma_m", "ot", 32]]}, "result": [[0.00031912711999999995, 1.3856127787307033e-05], 0, 1.1097729206085205, 1697196678.593795], "version": 0.2, "tvm_version": "0.8.0"}
{"input": ["cuda -keys=cuda,gpu -max_num_threads=1024 -thread_warp_size=32", "fused_reshape_permute_matmul_tensorcore.cuda", [["TENSOR", [4096, 32, 4], "float16"], ["TENSOR", [128, 128], "float16"]], {}], "config": {"index": 3285, "code_hash": null, "entity": [["block_row_warps", "ot", 1], ["block_col_warps", "ot", 1], ["warp_row_tiles", "ot", 4], ["warp_col_tiles", "ot", 2], ["chunk", "ot", 1], ["offset", "ot", 0], ["offsetCS", "ot", 8], ["vec", "ot", 4], ["wmma_m", "ot", 32]]}, "result": [[0.000290886085, 8.974637668161435e-06], 0, 0.9903466701507568, 1697196679.1127658], "version": 0.2, "tvm_version": "0.8.0"}
{"input": ["cuda -keys=cuda,gpu -max_num_threads=1024 -thread_warp_size=32", "fused_reshape_permute_matmul_tensorcore.cuda", [["TENSOR", [4096, 32, 4], "float16"], ["TENSOR", [128, 128], "float16"]], {}], "config": {"index": 2845, "code_hash": null, "entity": [["block_row_warps", "ot", 2], ["block_col_warps", "ot", 1], ["warp_row_tiles", "ot", 2], ["warp_col_tiles", "ot", 1], ["chunk", "ot", 8], ["offset", "ot", 0], ["offsetCS", "ot", 0], ["vec", "ot", 4], ["wmma_m", "ot", 32]]}, "result": [[0.00031161248499999997, 1.5910798228346457e-05], 0, 1.2331767082214355, 1697196679.6993496], "version": 0.2, "tvm_version": "0.8.0"}
{"input": ["cuda -keys=cuda,gpu -max_num_threads=1024 -thread_warp_size=32", "fused_reshape_permute_matmul_tensorcore.cuda", [["TENSOR", [4096, 32, 4], "float16"], ["TENSOR", [128, 128], "float16"]], {}], "config": {"index": 14742, "code_hash": null, "entity": [["block_row_warps", "ot", 1], ["block_col_warps", "ot", 1], ["warp_row_tiles", "ot", 1], ["warp_col_tiles", "ot", 1], ["chunk", "ot", 4], ["offset", "ot", 8], ["offsetCS", "ot", 0], ["vec", "ot", 8], ["wmma_m", "ot", 8]]}, "result": [[0.00026591338, 8.422307772561294e-06], 0, 1.0199310779571533, 1697196680.2302186], "version": 0.2, "tvm_version": "0.8.0"}
{"input": ["cuda -keys=cuda,gpu -max_num_threads=1024 -thread_warp_size=32", "fused_reshape_permute_matmul_tensorcore.cuda", [["TENSOR", [4096, 32, 4], "float16"], ["TENSOR", [128, 128], "float16"]], {}], "config": {"index": 10617, "code_hash": null, "entity": [["block_row_warps", "ot", 1], ["block_col_warps", "ot", 4], ["warp_row_tiles", "ot", 1], ["warp_col_tiles", "ot", 1], ["chunk", "ot", 8], ["offset", "ot", 0], ["offsetCS", "ot", 0], ["vec", "ot", 1], ["wmma_m", "ot", 8]]}, "result": [[0.000287333945, 1.8904143667296786e-05], 0, 0.9673936367034912, 1697196680.749039], "version": 0.2, "tvm_version": "0.8.0"}
{"input": ["cuda -keys=cuda,gpu -max_num_threads=1024 -thread_warp_size=32", "fused_reshape_permute_matmul_tensorcore.cuda", [["TENSOR", [4096, 32, 4], "float16"], ["TENSOR", [128, 128], "float16"]], {}], "config": {"index": 5954, "code_hash": null, "entity": [["block_row_warps", "ot", 4], ["block_col_warps", "ot", 2], ["warp_row_tiles", "ot", 2], ["warp_col_tiles", "ot", 2], ["chunk", "ot", 2], ["offset", "ot", 0], ["offsetCS", "ot", 8], ["vec", "ot", 1], ["wmma_m", "ot", 16]]}, "result": [[0.00026088152, 1.01487858040201e-05], 0, 1.018249750137329, 1697196681.3245625], "version": 0.2, "tvm_version": "0.8.0"}
{"input": ["cuda -keys=cuda,gpu -max_num_threads=1024 -thread_warp_size=32", "fused_reshape_permute_matmul_tensorcore.cuda", [["TENSOR", [4096, 32, 4], "float16"], ["TENSOR", [128, 128], "float16"]], {}], "config": {"index": 278, "code_hash": null, "entity": [["block_row_warps", "ot", 4], ["block_col_warps", "ot", 4], ["warp_row_tiles", "ot", 1], ["warp_col_tiles", "ot", 2], ["chunk", "ot", 8], ["offset", "ot", 0], ["offsetCS", "ot", 0], ["vec", "ot", 1], ["wmma_m", "ot", 32]]}, "result": [[0.000318564475, 1.4370566607460035e-05], 0, 1.0669264793395996, 1697196681.8648937], "version": 0.2, "tvm_version": "0.8.0"}
{"input": ["cuda -keys=cuda,gpu -max_num_threads=1024 -thread_warp_size=32", "fused_reshape_permute_matmul_tensorcore.cuda", [["TENSOR", [4096, 32, 4], "float16"], ["TENSOR", [128, 128], "float16"]], {}], "config": {"index": 1413, "code_hash": null, "entity": [["block_row_warps", "ot", 1], ["block_col_warps", "ot", 1], ["warp_row_tiles", "ot", 2], ["warp_col_tiles", "ot", 2], ["chunk", "ot", 2], ["offset", "ot", 0], ["offsetCS", "ot", 0], ["vec", "ot", 2], ["wmma_m", "ot", 32]]}, "result": [[0.000286717415, 9.365777842227378e-06], 0, 1.1856253147125244, 1697196682.3967953], "version": 0.2, "tvm_version": "0.8.0"}
{"input": ["cuda -keys=cuda,gpu -max_num_threads=1024 -thread_warp_size=32", "fused_reshape_permute_matmul_tensorcore.cuda", [["TENSOR", [4096, 32, 4], "float16"], ["TENSOR", [128, 128], "float16"]], {}], "config": {"index": 14517, "code_hash": null, "entity": [["block_row_warps", "ot", 1], ["block_col_warps", "ot", 1], ["warp_row_tiles", "ot", 4], ["warp_col_tiles", "ot", 1], ["chunk", "ot", 8], ["offset", "ot", 0], ["offsetCS", "ot", 0], ["vec", "ot", 8], ["wmma_m", "ot", 8]]}, "result": [[0.00039228738999999997, 1.2343646788990825e-05], 0, 1.209627389907837, 1697196683.0014074], "version": 0.2, "tvm_version": "0.8.0"}
{"input": ["cuda -keys=cuda,gpu -max_num_threads=1024 -thread_warp_size=32", "fused_reshape_permute_matmul_tensorcore.cuda", [["TENSOR", [4096, 32, 4], "float16"], ["TENSOR", [128, 128], "float16"]], {}], "config": {"index": 7319, "code_hash": null, "entity": [["block_row_warps", "ot", 4], ["block_col_warps", "ot", 1], ["warp_row_tiles", "ot", 1], ["warp_col_tiles", "ot", 2], ["chunk", "ot", 4], ["offset", "ot", 0], ["offsetCS", "ot", 8], ["vec", "ot", 2], ["wmma_m", "ot", 16]]}, "result": [[0.00026108058, 1.1543291338582676e-05], 0, 1.0817513465881348, 1697196683.5352504], "version": 0.2, "tvm_version": "0.8.0"}
{"input": ["cuda -keys=cuda,gpu -max_num_threads=1024 -thread_warp_size=32", "fused_reshape_permute_matmul_tensorcore.cuda", [["TENSOR", [4096, 32, 4], "float16"], ["TENSOR", [128, 128], "float16"]], {}], "config": {"index": 7195, "code_hash": null, "entity": [["block_row_warps", "ot", 2], ["block_col_warps", "ot", 2], ["warp_row_tiles", "ot", 2], ["warp_col_tiles", "ot", 4], ["chunk", "ot", 1], ["offset", "ot", 0], ["offsetCS", "ot", 8], ["vec", "ot", 2], ["wmma_m", "ot", 16]]}, "result": [[0.00025642175499999997, 8.165895696202531e-06], 0, 1.004262924194336, 1697196684.0612862], "version": 0.2, "tvm_version": "0.8.0"}
{"input": ["cuda -keys=cuda,gpu -max_num_threads=1024 -thread_warp_size=32", "fused_reshape_permute_matmul_tensorcore.cuda", [["TENSOR", [4096, 32, 4], "float16"], ["TENSOR", [128, 128], "float16"]], {}], "config": {"index": 13467, "code_hash": null, "entity": [["block_row_warps", "ot", 1], ["block_col_warps", "ot", 2], ["warp_row_tiles", "ot", 4], ["warp_col_tiles", "ot", 1], ["chunk", "ot", 4], ["offset", "ot", 8], ["offsetCS", "ot", 0], ["vec", "ot", 4], ["wmma_m", "ot", 8]]}, "result": [[0.00039336868500000003, 6.472833065164923e-06], 0, 1.1344270706176758, 1697196684.65804], "version": 0.2, "tvm_version": "0.8.0"}
{"input": ["cuda -keys=cuda,gpu -max_num_threads=1024 -thread_warp_size=32", "fused_reshape_permute_matmul_tensorcore.cuda", [["TENSOR", [4096, 32, 4], "float16"], ["TENSOR", [128, 128], "float16"]], {}], "config": {"index": 3774, "code_hash": null, "entity": [["block_row_warps", "ot", 1], ["block_col_warps", "ot", 2], ["warp_row_tiles", "ot", 4], ["warp_col_tiles", "ot", 2], ["chunk", "ot", 4], ["offset", "ot", 8], ["offsetCS", "ot", 8], ["vec", "ot", 4], ["wmma_m", "ot", 32]]}, "result": [[0.00040819174, 5.575340055632823e-06], 0, 1.1810028553009033, 1697196685.213775], "version": 0.2, "tvm_version": "0.8.0"}
{"input": ["cuda -keys=cuda,gpu -max_num_threads=1024 -thread_warp_size=32", "fused_reshape_permute_matmul_tensorcore.cuda", [["TENSOR", [4096, 32, 4], "float16"], ["TENSOR", [128, 128], "float16"]], {}], "config": {"index": 11783, "code_hash": null, "entity": [["block_row_warps", "ot", 4], ["block_col_warps", "ot", 1], ["warp_row_tiles", "ot", 2], ["warp_col_tiles", "ot", 2], ["chunk", "ot", 2], ["offset", "ot", 0], ["offsetCS", "ot", 0], ["vec", "ot", 2], ["wmma_m", "ot", 8]]}, "result": [[0.000298767345, 9.379880302149912e-06], 0, 1.036801815032959, 1697196685.7481272], "version": 0.2, "tvm_version": "0.8.0"}
{"input": ["cuda -keys=cuda,gpu -max_num_threads=1024 -thread_warp_size=32", "fused_reshape_permute_matmul_tensorcore.cuda", [["TENSOR", [4096, 32, 4], "float16"], ["TENSOR", [128, 128], "float16"]], {}], "config": {"index": 13136, "code_hash": null, "entity": [["block_row_warps", "ot", 4], ["block_col_warps", "ot", 2], ["warp_row_tiles", "ot", 2], ["warp_col_tiles", "ot", 1], ["chunk", "ot", 4], ["offset", "ot", 0], ["offsetCS", "ot", 0], ["vec", "ot", 4], ["wmma_m", "ot", 8]]}, "result": [[0.000314173495, 1.171248115942029e-05], 0, 1.0973751544952393, 1697196686.338005], "version": 0.2, "tvm_version": "0.8.0"}
{"input": ["cuda -keys=cuda,gpu -max_num_threads=1024 -thread_warp_size=32", "fused_reshape_permute_matmul_tensorcore.cuda", [["TENSOR", [4096, 32, 4], "float16"], ["TENSOR", [128, 128], "float16"]], {}], "config": {"index": 252, "code_hash": null, "entity": [["block_row_warps", "ot", 1], ["block_col_warps", "ot", 1], ["warp_row_tiles", "ot", 2], ["warp_col_tiles", "ot", 1], ["chunk", "ot", 8], ["offset", "ot", 0], ["offsetCS", "ot", 0], ["vec", "ot", 1], ["wmma_m", "ot", 32]]}, "result": [[0.00033893013000000006, 1.5974003952569168e-05], 0, 0.9986090660095215, 1697196686.8827963], "version": 0.2, "tvm_version": "0.8.0"}
{"input": ["cuda -keys=cuda,gpu -max_num_threads=1024 -thread_warp_size=32", "fused_reshape_permute_matmul_tensorcore.cuda", [["TENSOR", [4096, 32, 4], "float16"], ["TENSOR", [128, 128], "float16"]], {}], "config": {"index": 8940, "code_hash": null, "entity": [["block_row_warps", "ot", 1], ["block_col_warps", "ot", 2], ["warp_row_tiles", "ot", 1], ["warp_col_tiles", "ot", 2], ["chunk", "ot", 4], ["offset", "ot", 8], ["offsetCS", "ot", 8], ["vec", "ot", 4], ["wmma_m", "ot", 16]]}, "result": [[0.00028802381, 6.0990064320847524e-06], 0, 1.0102016925811768, 1697196687.4165974], "version": 0.2, "tvm_version": "0.8.0"}
{"input": ["cuda -keys=cuda,gpu -max_num_threads=1024 -thread_warp_size=32", "fused_reshape_permute_matmul_tensorcore.cuda", [["TENSOR", [4096, 32, 4], "float16"], ["TENSOR", [128, 128], "float16"]], {}], "config": {"index": 14863, "code_hash": null, "entity": [["block_row_warps", "ot", 2], ["block_col_warps", "ot", 2], ["warp_row_tiles", "ot", 2], ["warp_col_tiles", "ot", 2], ["chunk", "ot", 8], ["offset", "ot", 8], ["offsetCS", "ot", 0], ["vec", "ot", 8], ["wmma_m", "ot", 8]]}, "result": [[0.000376936935, 7.062756886751203e-06], 0, 1.0994219779968262, 1697196688.0155034], "version": 0.2, "tvm_version": "0.8.0"}
{"input": ["cuda -keys=cuda,gpu -max_num_threads=1024 -thread_warp_size=32", "fused_reshape_permute_matmul_tensorcore.cuda", [["TENSOR", [4096, 32, 4], "float16"], ["TENSOR", [128, 128], "float16"]], {}], "config": {"index": 2139, "code_hash": null, "entity": [["block_row_warps", "ot", 1], ["block_col_warps", "ot", 4], ["warp_row_tiles", "ot", 1], ["warp_col_tiles", "ot", 2], ["chunk", "ot", 4], ["offset", "ot", 0], ["offsetCS", "ot", 8], ["vec", "ot", 2], ["wmma_m", "ot", 32]]}, "result": [[1.1515088006230528e-05, 1.1521309190031155e-05], 0, 0.85190749168396, 1697196689.388383], "version": 0.2, "tvm_version": "0.8.0"}
{"input": ["cuda -keys=cuda,gpu -max_num_threads=1024 -thread_warp_size=32", "fused_reshape_permute_matmul_tensorcore.cuda", [["TENSOR", [4096, 32, 4], "float16"], ["TENSOR", [128, 128], "float16"]], {}], "config": {"index": 6950, "code_hash": null, "entity": [["block_row_warps", "ot", 4], ["block_col_warps", "ot", 1], ["warp_row_tiles", "ot", 2], ["warp_col_tiles", "ot", 4], ["chunk", "ot", 2], ["offset", "ot", 8], ["offsetCS", "ot", 0], ["vec", "ot", 2], ["wmma_m", "ot", 16]]}, "result": [[0.00030450268999999996, 7.234547661870503e-06], 0, 1.1198134422302246, 1697196689.9265864], "version": 0.2, "tvm_version": "0.8.0"}
{"input": ["cuda -keys=cuda,gpu -max_num_threads=1024 -thread_warp_size=32", "fused_reshape_permute_matmul_tensorcore.cuda", [["TENSOR", [4096, 32, 4], "float16"], ["TENSOR", [128, 128], "float16"]], {}], "config": {"index": 7410, "code_hash": null, "entity": [["block_row_warps", "ot", 1], ["block_col_warps", "ot", 2], ["warp_row_tiles", "ot", 2], ["warp_col_tiles", "ot", 2], ["chunk", "ot", 8], ["offset", "ot", 0], ["offsetCS", "ot", 8], ["vec", "ot", 2], ["wmma_m", "ot", 16]]}, "result": [[0.00038077089, 1.1537318799142245e-05], 0, 1.0584471225738525, 1697196690.5266902], "version": 0.2, "tvm_version": "0.8.0"}
{"input": ["cuda -keys=cuda,gpu -max_num_threads=1024 -thread_warp_size=32", "fused_reshape_permute_matmul_tensorcore.cuda", [["TENSOR", [4096, 32, 4], "float16"], ["TENSOR", [128, 128], "float16"]], {}], "config": {"index": 1123, "code_hash": null, "entity": [["block_row_warps", "ot", 2], ["block_col_warps", "ot", 4], ["warp_row_tiles", "ot", 2], ["warp_col_tiles", "ot", 4], ["chunk", "ot", 2], ["offset", "ot", 8], ["offsetCS", "ot", 8], ["vec", "ot", 1], ["wmma_m", "ot", 32]]}, "result": [[0.000350349385, 8.048169508525577e-06], 0, 1.128739595413208, 1697196691.0731473], "version": 0.2, "tvm_version": "0.8.0"}
