python/models/swin_transformer/kernel_configs/swin_transform_auto_tvm_tune_fused_layer_norm_matmul_tensorcore_gelu_1_32_32_256_1024.log
{"input": ["cuda -keys=cuda,gpu -max_num_threads=1024 -thread_warp_size=32", "fused_layer_norm_matmul_tensorcore_gelu.cuda", [["TENSOR", [1024, 256], "float16"], ["TENSOR", [1024], "float16"], ["TENSOR", [1024], "float16"], ["TENSOR", [1024, 256], "float16"], 0.00390625], {}], "config": {"index": 11135, "code_hash": null, "entity": [["block_row_warps", "ot", 4], ["block_col_warps", "ot", 1], ["warp_row_tiles", "ot", 2], ["warp_col_tiles", "ot", 2], ["chunk", "ot", 2], ["offset", "ot", 0], ["offsetCS", "ot", 8], ["vec", "ot", 1], ["wmma_m", "ot", 8]]}, "result": [[0.00010774348000000001], 0, 1.162649154663086, 1651808906.6479156], "version": 0.2, "tvm_version": "0.8.0"}
{"input": ["cuda -keys=cuda,gpu -max_num_threads=1024 -thread_warp_size=32", "fused_layer_norm_matmul_tensorcore_gelu.cuda", [["TENSOR", [1024, 256], "float16"], ["TENSOR", [1024], "float16"], ["TENSOR", [1024], "float16"], ["TENSOR", [1024, 256], "float16"], 0.00390625], {}], "config": {"index": 10869, "code_hash": null, "entity": [["block_row_warps", "ot", 1], ["block_col_warps", "ot", 4], ["warp_row_tiles", "ot", 2], ["warp_col_tiles", "ot", 1], ["chunk", "ot", 4], ["offset", "ot", 8], ["offsetCS", "ot", 0], ["vec", "ot", 1], ["wmma_m", "ot", 8]]}, "result": [[3.0100196e-05], 0, 1.0997450351715088, 1651808907.253717], "version": 0.2, "tvm_version": "0.8.0"}
{"input": ["cuda -keys=cuda,gpu -max_num_threads=1024 -thread_warp_size=32", "fused_layer_norm_matmul_tensorcore_gelu.cuda", [["TENSOR", [1024, 256], "float16"], ["TENSOR", [1024], "float16"], ["TENSOR", [1024], "float16"], ["TENSOR", [1024, 256], "float16"], 0.00390625], {}], "config": {"index": 12649, "code_hash": null, "entity": [["block_row_warps", "ot", 2], ["block_col_warps", "ot", 2], ["warp_row_tiles", "ot", 2], ["warp_col_tiles", "ot", 1], ["chunk", "ot", 1], ["offset", "ot", 8], ["offsetCS", "ot", 8], ["vec", "ot", 2], ["wmma_m", "ot", 8]]}, "result": [[3.0198727e-05], 0, 0.9445860385894775, 1651808908.3959382], "version": 0.2, "tvm_version": "0.8.0"}
{"input": ["cuda -keys=cuda,gpu -max_num_threads=1024 -thread_warp_size=32", "fused_layer_norm_matmul_tensorcore_gelu.cuda", [["TENSOR", [1024, 256], "float16"], ["TENSOR", [1024], "float16"], ["TENSOR", [1024], "float16"], ["TENSOR", [1024, 256], "float16"], 0.00390625], {}], "config": {"index": 5558, "code_hash": null, "entity": [["block_row_warps", "ot", 4], ["block_col_warps", "ot", 2], ["warp_row_tiles", "ot", 4], ["warp_col_tiles", "ot", 2], ["chunk", "ot", 1], ["offset", "ot", 8], ["offsetCS", "ot", 0], ["vec", "ot", 1], ["wmma_m", "ot", 16]]}, "result": [[9.3061673e-05], 0, 1.1919400691986084, 1651808910.3135278], "version": 0.2, "tvm_version": "0.8.0"}
{"input": ["cuda -keys=cuda,gpu -max_num_threads=1024 -thread_warp_size=32", "fused_layer_norm_matmul_tensorcore_gelu.cuda", [["TENSOR", [1024, 256], "float16"], ["TENSOR", [1024], "float16"], ["TENSOR", [1024], "float16"], ["TENSOR", [1024, 256], "float16"], 0.00390625], {}], "config": {"index": 13711, "code_hash": null, "entity": [["block_row_warps", "ot", 2], ["block_col_warps", "ot", 2], ["warp_row_tiles", "ot", 4], ["warp_col_tiles", "ot", 1], ["chunk", "ot", 2], ["offset", "ot", 0], ["offsetCS", "ot", 8], ["vec", "ot", 4], ["wmma_m", "ot", 8]]}, "result": [[4.007342599999999e-05], 0, 1.109766960144043, 1651808911.495698], "version": 0.2, "tvm_version": "0.8.0"}
{"input": ["cuda -keys=cuda,gpu -max_num_threads=1024 -thread_warp_size=32", "fused_layer_norm_matmul_tensorcore_gelu.cuda", [["TENSOR", [1024, 256], "float16"], ["TENSOR", [1024], "float16"], ["TENSOR", [1024], "float16"], ["TENSOR", [1024, 256], "float16"], 0.00390625], {}], "config": {"index": 5483, "code_hash": null, "entity": [["block_row_warps", "ot", 4], ["block_col_warps", "ot", 1], ["warp_row_tiles", "ot", 1], ["warp_col_tiles", "ot", 4], ["chunk", "ot", 8], ["offset", "ot", 0], ["offsetCS", "ot", 0], ["vec", "ot", 1], ["wmma_m", "ot", 16]]}, "result": [[0.000110972469], 0, 1.4093613624572754, 1651808912.9022696], "version": 0.2, "tvm_version": "0.8.0"}
{"input": ["cuda -keys=cuda,gpu -max_num_threads=1024 -thread_warp_size=32", "fused_layer_norm_matmul_tensorcore_gelu.cuda", [["TENSOR", [1024, 256], "float16"], ["TENSOR", [1024], "float16"], ["TENSOR", [1024], "float16"], ["TENSOR", [1024, 256], "float16"], 0.00390625], {}], "config": {"index": 10501, "code_hash": null, "entity": [["block_row_warps", "ot", 2], ["block_col_warps", "ot", 4], ["warp_row_tiles", "ot", 4], ["warp_col_tiles", "ot", 2], ["chunk", "ot", 2], ["offset", "ot", 0], ["offsetCS", "ot", 0], ["vec", "ot", 1], ["wmma_m", "ot", 8]]}, "result": [[5.5918581000000005e-05], 0, 1.1117405891418457, 1651808913.5426686], "version": 0.2, "tvm_version": "0.8.0"}
{"input": ["cuda -keys=cuda,gpu -max_num_threads=1024 -thread_warp_size=32", "fused_layer_norm_matmul_tensorcore_gelu.cuda", [["TENSOR", [1024, 256], "float16"], ["TENSOR", [1024], "float16"], ["TENSOR", [1024], "float16"], ["TENSOR", [1024, 256], "float16"], 0.00390625], {}], "config": {"index": 10485, "code_hash": null, "entity": [["block_row_warps", "ot", 1], ["block_col_warps", "ot", 1], ["warp_row_tiles", "ot", 2], ["warp_col_tiles", "ot", 2], ["chunk", "ot", 2], ["offset", "ot", 0], ["offsetCS", "ot", 0], ["vec", "ot", 1], ["wmma_m", "ot", 8]]}, "result": [[6.1095467e-05], 0, 1.201988935470581, 1651808914.2523181], "version": 0.2, "tvm_version": "0.8.0"}
{"input": ["cuda -keys=cuda,gpu -max_num_threads=1024 -thread_warp_size=32", "fused_layer_norm_matmul_tensorcore_gelu.cuda", [["TENSOR", [1024, 256], "float16"], ["TENSOR", [1024], "float16"], ["TENSOR", [1024], "float16"], ["TENSOR", [1024, 256], "float16"], 0.00390625], {}], "config": {"index": 6079, "code_hash": null, "entity": [["block_row_warps", "ot", 2], ["block_col_warps", "ot", 2], ["warp_row_tiles", "ot", 1], ["warp_col_tiles", "ot", 1], ["chunk", "ot", 8], ["offset", "ot", 0], ["offsetCS", "ot", 8], ["vec", "ot", 1], ["wmma_m", "ot", 16]]}, "result": [[7.856844899999999e-05], 0, 1.1988191604614258, 1651808916.799295], "version": 0.2, "tvm_version": "0.8.0"}
{"input": ["cuda -keys=cuda,gpu -max_num_threads=1024 -thread_warp_size=32", "fused_layer_norm_matmul_tensorcore_gelu.cuda", [["TENSOR", [1024, 256], "float16"], ["TENSOR", [1024], "float16"], ["TENSOR", [1024], "float16"], ["TENSOR", [1024, 256], "float16"], 0.00390625], {}], "config": {"index": 3380, "code_hash": null, "entity": [["block_row_warps", "ot", 4], ["block_col_warps", "ot", 2], ["warp_row_tiles", "ot", 1], ["warp_col_tiles", "ot", 4], ["chunk", "ot", 2], ["offset", "ot", 0], ["offsetCS", "ot", 8], ["vec", "ot", 4], ["wmma_m", "ot", 32]]}, "result": [[8.3504829e-05], 0, 1.4360387325286865, 1651819665.2559798], "version": 0.2, "tvm_version": "0.8.0"}
{"input": ["cuda -keys=cuda,gpu -max_num_threads=1024 -thread_warp_size=32", "fused_layer_norm_matmul_tensorcore_gelu.cuda", [["TENSOR", [1024, 256], "float16"], ["TENSOR", [1024], "float16"], ["TENSOR", [1024], "float16"], ["TENSOR", [1024, 256], "float16"], 0.00390625], {}], "config": {"index": 6411, "code_hash": null, "entity": [["block_row_warps", "ot", 1], ["block_col_warps", "ot", 2], ["warp_row_tiles", "ot", 2], ["warp_col_tiles", "ot", 1], ["chunk", "ot", 8], ["offset", "ot", 8], ["offsetCS", "ot", 8], ["vec", "ot", 1], ["wmma_m", "ot", 16]]}, "result": [[8.548200900000001e-05], 0, 1.4887399673461914, 1651819666.03747], "version": 0.2, "tvm_version": "0.8.0"}
{"input": ["cuda -keys=cuda,gpu -max_num_threads=1024 -thread_warp_size=32", "fused_layer_norm_matmul_tensorcore_gelu.cuda", [["TENSOR", [1024, 256], "float16"], ["TENSOR", [1024], "float16"], ["TENSOR", [1024], "float16"], ["TENSOR", [1024, 256], "float16"], 0.00390625], {}], "config": {"index": 422, "code_hash": null, "entity": [["block_row_warps", "ot", 4], ["block_col_warps", "ot", 4], ["warp_row_tiles", "ot", 2], ["warp_col_tiles", "ot", 1], ["chunk", "ot", 2], ["offset", "ot", 8], ["offsetCS", "ot", 0], ["vec", "ot", 1], ["wmma_m", "ot", 32]]}, "result": [[5.7532611e-05], 0, 1.3329145908355713, 1651819667.2482193], "version": 0.2, "tvm_version": "0.8.0"}
{"input": ["cuda -keys=cuda,gpu -max_num_threads=1024 -thread_warp_size=32", "fused_layer_norm_matmul_tensorcore_gelu.cuda", [["TENSOR", [1024, 256], "float16"], ["TENSOR", [1024], "float16"], ["TENSOR", [1024], "float16"], ["TENSOR", [1024, 256], "float16"], 0.00390625], {}], "config": {"index": 413, "code_hash": null, "entity": [["block_row_warps", "ot", 4], ["block_col_warps", "ot", 4], ["warp_row_tiles", "ot", 1], ["warp_col_tiles", "ot", 1], ["chunk", "ot", 2], ["offset", "ot", 8], ["offsetCS", "ot", 0], ["vec", "ot", 1], ["wmma_m", "ot", 32]]}, "result": [[3.9653714e-05], 0, 1.244783878326416, 1651819667.804248], "version": 0.2, "tvm_version": "0.8.0"}
{"input": ["cuda -keys=cuda,gpu -max_num_threads=1024 -thread_warp_size=32", "fused_layer_norm_matmul_tensorcore_gelu.cuda", [["TENSOR", [1024, 256], "float16"], ["TENSOR", [1024], "float16"], ["TENSOR", [1024], "float16"], ["TENSOR", [1024, 256], "float16"], 0.00390625], {}], "config": {"index": 2844, "code_hash": null, "entity": [["block_row_warps", "ot", 1], ["block_col_warps", "ot", 1], ["warp_row_tiles", "ot", 2], ["warp_col_tiles", "ot", 1], ["chunk", "ot", 8], ["offset", "ot", 0], ["offsetCS", "ot", 0], ["vec", "ot", 4], ["wmma_m", "ot", 32]]}, "result": [[0.000193231082], 0, 1.7618324756622314, 1651819669.4468703], "version": 0.2, "tvm_version": "0.8.0"}
{"input": ["cuda -keys=cuda,gpu -max_num_threads=1024 -thread_warp_size=32", "fused_layer_norm_matmul_tensorcore_gelu.cuda", [["TENSOR", [1024, 256], "float16"], ["TENSOR", [1024], "float16"], ["TENSOR", [1024], "float16"], ["TENSOR", [1024, 256], "float16"], 0.00390625], {}], "config": {"index": 10675, "code_hash": null, "entity": [["block_row_warps", "ot", 2], ["block_col_warps", "ot", 1], ["warp_row_tiles", "ot", 2], ["warp_col_tiles", "ot", 4], ["chunk", "ot", 8], ["offset", "ot", 0], ["offsetCS", "ot", 0], ["vec", "ot", 1], ["wmma_m", "ot", 8]]}, "result": [[8.586048099999998e-05], 0, 1.5986573696136475, 1651819670.8422775], "version": 0.2, "tvm_version": "0.8.0"}
{"input": ["cuda -keys=cuda,gpu -max_num_threads=1024 -thread_warp_size=32", "fused_layer_norm_matmul_tensorcore_gelu.cuda", [["TENSOR", [1024, 256], "float16"], ["TENSOR", [1024], "float16"], ["TENSOR", [1024], "float16"], ["TENSOR", [1024, 256], "float16"], 0.00390625], {}], "config": {"index": 7717, "code_hash": null, "entity": [["block_row_warps", "ot", 2], ["block_col_warps", "ot", 2], ["warp_row_tiles", "ot", 4], ["warp_col_tiles", "ot", 1], ["chunk", "ot", 8], ["offset", "ot", 8], ["offsetCS", "ot", 8], ["vec", "ot", 2], ["wmma_m", "ot", 16]]}, "result": [[5.5415351000000004e-05], 0, 1.4295761585235596, 1651819671.504676], "version": 0.2, "tvm_version": "0.8.0"}
{"input": ["cuda -keys=cuda,gpu -max_num_threads=1024 -thread_warp_size=32", "fused_layer_norm_matmul_tensorcore_gelu.cuda", [["TENSOR", [1024, 256], "float16"], ["TENSOR", [1024], "float16"], ["TENSOR", [1024], "float16"], ["TENSOR", [1024, 256], "float16"], 0.00390625], {}], "config": {"index": 8992, "code_hash": null, "entity": [["block_row_warps", "ot", 2], ["block_col_warps", "ot", 1], ["warp_row_tiles", "ot", 1], ["warp_col_tiles", "ot", 1], ["chunk", "ot", 8], ["offset", "ot", 8], ["offsetCS", "ot", 8], ["vec", "ot", 4], ["wmma_m", "ot", 16]]}, "result": [[4.3803148e-05], 0, 1.365677833557129, 1651819672.687747], "version": 0.2, "tvm_version": "0.8.0"}
{"input": ["cuda -keys=cuda,gpu -max_num_threads=1024 -thread_warp_size=32", "fused_layer_norm_matmul_tensorcore_gelu.cuda", [["TENSOR", [1024, 256], "float16"], ["TENSOR", [1024], "float16"], ["TENSOR", [1024], "float16"], ["TENSOR", [1024, 256], "float16"], 0.00390625], {}], "config": {"index": 10509, "code_hash": null, "entity": [["block_row_warps", "ot", 1], ["block_col_warps", "ot", 4], ["warp_row_tiles", "ot", 1], ["warp_col_tiles", "ot", 4], ["chunk", "ot", 2], ["offset", "ot", 0], ["offsetCS", "ot", 0], ["vec", "ot", 1], ["wmma_m", "ot", 8]]}, "result": [[6.6296349e-05], 0, 1.3577840328216553, 1651819674.5276003], "version": 0.2, "tvm_version": "0.8.0"}
{"input": ["cuda -keys=cuda,gpu -max_num_threads=1024 -thread_warp_size=32", "fused_layer_norm_matmul_tensorcore_gelu.cuda", [["TENSOR", [1024, 256], "float16"], ["TENSOR", [1024], "float16"], ["TENSOR", [1024], "float16"], ["TENSOR", [1024, 256], "float16"], 0.00390625], {}], "config": {"index": 11869, "code_hash": null, "entity": [["block_row_warps", "ot", 2], ["block_col_warps", "ot", 4], ["warp_row_tiles", "ot", 2], ["warp_col_tiles", "ot", 2], ["chunk", "ot", 4], ["offset", "ot", 0], ["offsetCS", "ot", 0], ["vec", "ot", 2], ["wmma_m", "ot", 8]]}, "result": [[5.5917085e-05], 0, 1.363464593887329, 1651819675.744537], "version": 0.2, "tvm_version": "0.8.0"}
{"input": ["cuda -keys=cuda,gpu -max_num_threads=1024 -thread_warp_size=32", "fused_layer_norm_matmul_tensorcore_gelu.cuda", [["TENSOR", [1024, 256], "float16"], ["TENSOR", [1024], "float16"], ["TENSOR", [1024], "float16"], ["TENSOR", [1024, 256], "float16"], 0.00390625], {}], "config": {"index": 1719, "code_hash": null, "entity": [["block_row_warps", "ot", 1], ["block_col_warps", "ot", 1], ["warp_row_tiles", "ot", 4], ["warp_col_tiles", "ot", 1], ["chunk", "ot", 2], ["offset", "ot", 8], ["offsetCS", "ot", 0], ["vec", "ot", 2], ["wmma_m", "ot", 32]]}, "result": [[0.000161904949], 0, 1.63881254196167, 1651819676.7459593], "version": 0.2, "tvm_version": "0.8.0"}
{"input": ["cuda -keys=cuda,gpu -max_num_threads=1024 -thread_warp_size=32", "fused_layer_norm_matmul_tensorcore_gelu.cuda", [["TENSOR", [1024, 256], "float16"], ["TENSOR", [1024], "float16"], ["TENSOR", [1024], "float16"], ["TENSOR", [1024, 256], "float16"], 0.00390625], {}], "config": {"index": 5516, "code_hash": null, "entity": [["block_row_warps", "ot", 4], ["block_col_warps", "ot", 4], ["warp_row_tiles", "ot", 1], ["warp_col_tiles", "ot", 1], ["chunk", "ot", 1], ["offset", "ot", 8], ["offsetCS", "ot", 0], ["vec", "ot", 1], ["wmma_m", "ot", 16]]}, "result": [[3.24085e-05], 0, 1.1404154300689697, 1651819677.8929503], "version": 0.2, "tvm_version": "0.8.0"}
{"input": ["cuda -keys=cuda,gpu -max_num_threads=1024 -thread_warp_size=32", "fused_layer_norm_matmul_tensorcore_gelu.cuda", [["TENSOR", [1024, 256], "float16"], ["TENSOR", [1024], "float16"], ["TENSOR", [1024], "float16"], ["TENSOR", [1024, 256], "float16"], 0.00390625], {}], "config": {"index": 147, "code_hash": null, "entity": [["block_row_warps", "ot", 1], ["block_col_warps", "ot", 2], ["warp_row_tiles", "ot", 2], ["warp_col_tiles", "ot", 4], ["chunk", "ot", 2], ["offset", "ot", 0], ["offsetCS", "ot", 0], ["vec", "ot", 1], ["wmma_m", "ot", 32]]}, "result": [[9.303453e-05], 0, 1.4516570568084717, 1651819679.2303193], "version": 0.2, "tvm_version": "0.8.0"}
{"input": ["cuda -keys=cuda,gpu -max_num_threads=1024 -thread_warp_size=32", "fused_layer_norm_matmul_tensorcore_gelu.cuda", [["TENSOR", [1024, 256], "float16"], ["TENSOR", [1024], "float16"], ["TENSOR", [1024], "float16"], ["TENSOR", [1024, 256], "float16"], 0.00390625], {}], "config": {"index": 8379, "code_hash": null, "entity": [["block_row_warps", "ot", 1], ["block_col_warps", "ot", 1], ["warp_row_tiles", "ot", 2], ["warp_col_tiles", "ot", 2], ["chunk", "ot", 8], ["offset", "ot", 8], ["offsetCS", "ot", 0], ["vec", "ot", 4], ["wmma_m", "ot", 16]]}, "result": [[7.3518033e-05], 0, 1.3621864318847656, 1651819680.54992], "version": 0.2, "tvm_version": "0.8.0"}
{"input": ["cuda -keys=cuda,gpu -max_num_threads=1024 -thread_warp_size=32", "fused_layer_norm_matmul_tensorcore_gelu.cuda", [["TENSOR", [1024, 256], "float16"], ["TENSOR", [1024], "float16"], ["TENSOR", [1024], "float16"], ["TENSOR", [1024, 256], "float16"], 0.00390625], {}], "config": {"index": 7136, "code_hash": null, "entity": [["block_row_warps", "ot", 4], ["block_col_warps", "ot", 4], ["warp_row_tiles", "ot", 1], ["warp_col_tiles", "ot", 1], ["chunk", "ot", 1], ["offset", "ot", 0], ["offsetCS", "ot", 8], ["vec", "ot", 2], ["wmma_m", "ot", 16]]}, "result": [[3.1139284e-05], 0, 1.2769150733947754, 1651819681.0980363], "version": 0.2, "tvm_version": "0.8.0"}
{"input": ["cuda -keys=cuda,gpu -max_num_threads=1024 -thread_warp_size=32", "fused_layer_norm_matmul_tensorcore_gelu.cuda", [["TENSOR", [1024, 256], "float16"], ["TENSOR", [1024], "float16"], ["TENSOR", [1024], "float16"], ["TENSOR", [1024, 256], "float16"], 0.00390625], {}], "config": {"index": 2922, "code_hash": null, "entity": [["block_row_warps", "ot", 1], ["block_col_warps", "ot", 4], ["warp_row_tiles", "ot", 1], ["warp_col_tiles", "ot", 1], ["chunk", "ot", 1], ["offset", "ot", 8], ["offsetCS", "ot", 0], ["vec", "ot", 4], ["wmma_m", "ot", 32]]}, "result": [[3.1592117e-05], 0, 1.2843213081359863, 1651819682.2537699], "version": 0.2, "tvm_version": "0.8.0"}
{"input": ["cuda -keys=cuda,gpu -max_num_threads=1024 -thread_warp_size=32", "fused_layer_norm_matmul_tensorcore_gelu.cuda", [["TENSOR", [1024, 256], "float16"], ["TENSOR", [1024], "float16"], ["TENSOR", [1024], "float16"], ["TENSOR", [1024, 256], "float16"], 0.00390625], {}], "config": {"index": 12738, "code_hash": null, "entity": [["block_row_warps", "ot", 1], ["block_col_warps", "ot", 2], ["warp_row_tiles", "ot", 4], ["warp_col_tiles", "ot", 1], ["chunk", "ot", 2], ["offset", "ot", 8], ["offsetCS", "ot", 8], ["vec", "ot", 2], ["wmma_m", "ot", 8]]}, "result": [[3.9800275e-05], 0, 1.1758098602294922, 1651819683.453246], "version": 0.2, "tvm_version": "0.8.0"}
{"input": ["cuda -keys=cuda,gpu -max_num_threads=1024 -thread_warp_size=32", "fused_layer_norm_matmul_tensorcore_gelu.cuda", [["TENSOR", [1024, 256], "float16"], ["TENSOR", [1024], "float16"], ["TENSOR", [1024], "float16"], ["TENSOR", [1024, 256], "float16"], 0.00390625], {}], "config": {"index": 8298, "code_hash": null, "entity": [["block_row_warps", "ot", 1], ["block_col_warps", "ot", 1], ["warp_row_tiles", "ot", 2], ["warp_col_tiles", "ot", 2], ["chunk", "ot", 4], ["offset", "ot", 8], ["offsetCS", "ot", 0], ["vec", "ot", 4], ["wmma_m", "ot", 16]]}, "result": [[4.4758589e-05], 0, 1.2732677459716797, 1651819684.6679957], "version": 0.2, "tvm_version": "0.8.0"}
{"input": ["cuda -keys=cuda,gpu -max_num_threads=1024 -thread_warp_size=32", "fused_layer_norm_matmul_tensorcore_gelu.cuda", [["TENSOR", [1024, 256], "float16"], ["TENSOR", [1024], "float16"], ["TENSOR", [1024], "float16"], ["TENSOR", [1024, 256], "float16"], 0.00390625], {}], "config": {"index": 7659, "code_hash": null, "entity": [["block_row_warps", "ot", 1], ["block_col_warps", "ot", 1], ["warp_row_tiles", "ot", 4], ["warp_col_tiles", "ot", 2], ["chunk", "ot", 4], ["offset", "ot", 8], ["offsetCS", "ot", 8], ["vec", "ot", 2], ["wmma_m", "ot", 16]]}, "result": [[9.7698531e-05], 0, 1.4047973155975342, 1651819686.07145], "version": 0.2, "tvm_version": "0.8.0"}
{"input": ["cuda -keys=cuda,gpu -max_num_threads=1024 -thread_warp_size=32", "fused_layer_norm_matmul_tensorcore_gelu.cuda", [["TENSOR", [1024, 256], "float16"], ["TENSOR", [1024], "float16"], ["TENSOR", [1024], "float16"], ["TENSOR", [1024, 256], "float16"], 0.00390625], {}], "config": {"index": 11484, "code_hash": null, "entity": [["block_row_warps", "ot", 1], ["block_col_warps", "ot", 1], ["warp_row_tiles", "ot", 2], ["warp_col_tiles", "ot", 4], ["chunk", "ot", 2], ["offset", "ot", 8], ["offsetCS", "ot", 8], ["vec", "ot", 1], ["wmma_m", "ot", 8]]}, "result": [[7.5937063e-05], 0, 1.2989823818206787, 1651819687.412073], "version": 0.2, "tvm_version": "0.8.0"}
{"input": ["cuda -keys=cuda,gpu -max_num_threads=1024 -thread_warp_size=32", "fused_layer_norm_matmul_tensorcore_gelu.cuda", [["TENSOR", [1024, 256], "float16"], ["TENSOR", [1024], "float16"], ["TENSOR", [1024], "float16"], ["TENSOR", [1024, 256], "float16"], 0.00390625], {}], "config": {"index": 14094, "code_hash": null, "entity": [["block_row_warps", "ot", 1], ["block_col_warps", "ot", 1], ["warp_row_tiles", "ot", 1], ["warp_col_tiles", "ot", 1], ["chunk", "ot", 4], ["offset", "ot", 8], ["offsetCS", "ot", 8], ["vec", "ot", 4], ["wmma_m", "ot", 8]]}, "result": [[3.3913089e-05], 0, 1.3015787601470947, 1651819688.5773737], "version": 0.2, "tvm_version": "0.8.0"}
{"input": ["cuda -keys=cuda,gpu -max_num_threads=1024 -thread_warp_size=32", "fused_layer_norm_matmul_tensorcore_gelu.cuda", [["TENSOR", [1024, 256], "float16"], ["TENSOR", [1024], "float16"], ["TENSOR", [1024], "float16"], ["TENSOR", [1024, 256], "float16"], 0.00390625], {}], "config": {"index": 6661, "code_hash": null, "entity": [["block_row_warps", "ot", 2], ["block_col_warps", "ot", 1], ["warp_row_tiles", "ot", 4], ["warp_col_tiles", "ot", 1], ["chunk", "ot", 4], ["offset", "ot", 0], ["offsetCS", "ot", 0], ["vec", "ot", 2], ["wmma_m", "ot", 16]]}, "result": [[0.000105250617], 0, 1.327042818069458, 1651819689.3611908], "version": 0.2, "tvm_version": "0.8.0"}
{"input": ["cuda -keys=cuda,gpu -max_num_threads=1024 -thread_warp_size=32", "fused_layer_norm_matmul_tensorcore_gelu.cuda", [["TENSOR", [1024, 256], "float16"], ["TENSOR", [1024], "float16"], ["TENSOR", [1024], "float16"], ["TENSOR", [1024, 256], "float16"], 0.00390625], {}], "config": {"index": 13107, "code_hash": null, "entity": [["block_row_warps", "ot", 1], ["block_col_warps", "ot", 2], ["warp_row_tiles", "ot", 2], ["warp_col_tiles", "ot", 4], ["chunk", "ot", 2], ["offset", "ot", 0], ["offsetCS", "ot", 0], ["vec", "ot", 4], ["wmma_m", "ot", 8]]}, "result": [[4.6844101e-05], 0, 1.1604835987091064, 1651819690.6093626], "version": 0.2, "tvm_version": "0.8.0"}
{"input": ["cuda -keys=cuda,gpu -max_num_threads=1024 -thread_warp_size=32", "fused_layer_norm_matmul_tensorcore_gelu.cuda", [["TENSOR", [1024, 256], "float16"], ["TENSOR", [1024], "float16"], ["TENSOR", [1024], "float16"], ["TENSOR", [1024, 256], "float16"], 0.00390625], {}], "config": {"index": 1453, "code_hash": null, "entity": [["block_row_warps", "ot", 2], ["block_col_warps", "ot", 2], ["warp_row_tiles", "ot", 4], ["warp_col_tiles", "ot", 4], ["chunk", "ot", 2], ["offset", "ot", 0], ["offsetCS", "ot", 0], ["vec", "ot", 2], ["wmma_m", "ot", 32]]}, "result": [[0.00012147390400000001], 0, 1.3211774826049805, 1651819692.1352918], "version": 0.2, "tvm_version": "0.8.0"}
{"input": ["cuda -keys=cuda,gpu -max_num_threads=1024 -thread_warp_size=32", "fused_layer_norm_matmul_tensorcore_gelu.cuda", [["TENSOR", [1024, 256], "float16"], ["TENSOR", [1024], "float16"], ["TENSOR", [1024], "float16"], ["TENSOR", [1024, 256], "float16"], 0.00390625], {}], "config": {"index": 11862, "code_hash": null, "entity": [["block_row_warps", "ot", 1], ["block_col_warps", "ot", 1], ["warp_row_tiles", "ot", 2], ["warp_col_tiles", "ot", 2], ["chunk", "ot", 4], ["offset", "ot", 0], ["offsetCS", "ot", 0], ["vec", "ot", 2], ["wmma_m", "ot", 8]]}, "result": [[5.8828025e-05], 0, 1.1512773036956787, 1651819693.3690464], "version": 0.2, "tvm_version": "0.8.0"}
{"input": ["cuda -keys=cuda,gpu -max_num_threads=1024 -thread_warp_size=32", "fused_layer_norm_matmul_tensorcore_gelu.cuda", [["TENSOR", [1024, 256], "float16"], ["TENSOR", [1024], "float16"], ["TENSOR", [1024], "float16"], ["TENSOR", [1024, 256], "float16"], 0.00390625], {}], "config": {"index": 12303, "code_hash": null, "entity": [["block_row_warps", "ot", 1], ["block_col_warps", "ot", 1], ["warp_row_tiles", "ot", 4], ["warp_col_tiles", "ot", 4], ["chunk", "ot", 8], ["offset", "ot", 8], ["offsetCS", "ot", 0], ["vec", "ot", 2], ["wmma_m", "ot", 8]]}, "result": [[9.818777e-05], 0, 1.5260279178619385, 1651819694.315478], "version": 0.2, "tvm_version": "0.8.0"}
{"input": ["cuda -keys=cuda,gpu -max_num_threads=1024 -thread_warp_size=32", "fused_layer_norm_matmul_tensorcore_gelu.cuda", [["TENSOR", [1024, 256], "float16"], ["TENSOR", [1024], "float16"], ["TENSOR", [1024], "float16"], ["TENSOR", [1024, 256], "float16"], 0.00390625], {}], "config": {"index": 12071, "code_hash": null, "entity": [["block_row_warps", "ot", 4], ["block_col_warps", "ot", 1], ["warp_row_tiles", "ot", 1], ["warp_col_tiles", "ot", 1], ["chunk", "ot", 2], ["offset", "ot", 8], ["offsetCS", "ot", 0], ["vec", "ot", 2], ["wmma_m", "ot", 8]]}, "result": [[5.6365304000000005e-05], 0, 1.1590347290039062, 1651819696.9800851], "version": 0.2, "tvm_version": "0.8.0"}
{"input": ["cuda -keys=cuda,gpu -max_num_threads=1024 -thread_warp_size=32", "fused_layer_norm_matmul_tensorcore_gelu.cuda", [["TENSOR", [1024, 256], "float16"], ["TENSOR", [1024], "float16"], ["TENSOR", [1024], "float16"], ["TENSOR", [1024, 256], "float16"], 0.00390625], {}], "config": {"index": 5835, "code_hash": null, "entity": [["block_row_warps", "ot", 1], ["block_col_warps", "ot", 2], ["warp_row_tiles", "ot", 1], ["warp_col_tiles", "ot", 1], ["chunk", "ot", 1], ["offset", "ot", 0], ["offsetCS", "ot", 8], ["vec", "ot", 1], ["wmma_m", "ot", 16]]}, "result": [[4.6241146999999995e-05], 0, 1.1566977500915527, 1651819697.6039474], "version": 0.2, "tvm_version": "0.8.0"}
{"input": ["cuda -keys=cuda,gpu -max_num_threads=1024 -thread_warp_size=32", "fused_layer_norm_matmul_tensorcore_gelu.cuda", [["TENSOR", [1024, 256], "float16"], ["TENSOR", [1024], "float16"], ["TENSOR", [1024], "float16"], ["TENSOR", [1024, 256], "float16"], 0.00390625], {}], "config": {"index": 12233, "code_hash": null, "entity": [["block_row_warps", "ot", 4], ["block_col_warps", "ot", 1], ["warp_row_tiles", "ot", 1], ["warp_col_tiles", "ot", 1], ["chunk", "ot", 8], ["offset", "ot", 8], ["offsetCS", "ot", 0], ["vec", "ot", 2], ["wmma_m", "ot", 8]]}, "result": [[3.4038567e-05], 0, 1.1368892192840576, 1651819698.75493], "version": 0.2, "tvm_version": "0.8.0"}
{"input": ["cuda -keys=cuda,gpu -max_num_threads=1024 -thread_warp_size=32", "fused_layer_norm_matmul_tensorcore_gelu.cuda", [["TENSOR", [1024, 256], "float16"], ["TENSOR", [1024], "float16"], ["TENSOR", [1024], "float16"], ["TENSOR", [1024, 256], "float16"], 0.00390625], {}], "config": {"index": 8982, "code_hash": null, "entity": [["block_row_warps", "ot", 1], ["block_col_warps", "ot", 1], ["warp_row_tiles", "ot", 4], ["warp_col_tiles", "ot", 4], ["chunk", "ot", 4], ["offset", "ot", 8], ["offsetCS", "ot", 8], ["vec", "ot", 4], ["wmma_m", "ot", 16]]}, "result": [[9.108288500000001e-05], 0, 1.533360242843628, 1651819700.15706], "version": 0.2, "tvm_version": "0.8.0"}
{"input": ["cuda -keys=cuda,gpu -max_num_threads=1024 -thread_warp_size=32", "fused_layer_norm_matmul_tensorcore_gelu.cuda", [["TENSOR", [1024, 256], "float16"], ["TENSOR", [1024], "float16"], ["TENSOR", [1024], "float16"], ["TENSOR", [1024, 256], "float16"], 0.00390625], {}], "config": {"index": 5629, "code_hash": null, "entity": [["block_row_warps", "ot", 2], ["block_col_warps", "ot", 2], ["warp_row_tiles", "ot", 2], ["warp_col_tiles", "ot", 2], ["chunk", "ot", 2], ["offset", "ot", 8], ["offsetCS", "ot", 0], ["vec", "ot", 1], ["wmma_m", "ot", 16]]}, "result": [[5.2178693e-05], 0, 1.3300707340240479, 1651819700.8349473], "version": 0.2, "tvm_version": "0.8.0"}
{"input": ["cuda -keys=cuda,gpu -max_num_threads=1024 -thread_warp_size=32", "fused_layer_norm_matmul_tensorcore_gelu.cuda", [["TENSOR", [1024, 256], "float16"], ["TENSOR", [1024], "float16"], ["TENSOR", [1024], "float16"], ["TENSOR", [1024, 256], "float16"], 0.00390625], {}], "config": {"index": 12240, "code_hash": null, "entity": [["block_row_warps", "ot", 1], ["block_col_warps", "ot", 1], ["warp_row_tiles", "ot", 2], ["warp_col_tiles", "ot", 1], ["chunk", "ot", 8], ["offset", "ot", 8], ["offsetCS", "ot", 0], ["vec", "ot", 2], ["wmma_m", "ot", 8]]}, "result": [[6.537631e-05], 0, 1.3382375240325928, 1651819702.091205], "version": 0.2, "tvm_version": "0.8.0"}
{"input": ["cuda -keys=cuda,gpu -max_num_threads=1024 -thread_warp_size=32", "fused_layer_norm_matmul_tensorcore_gelu.cuda", [["TENSOR", [1024, 256], "float16"], ["TENSOR", [1024], "float16"], ["TENSOR", [1024], "float16"], ["TENSOR", [1024, 256], "float16"], 0.00390625], {}], "config": {"index": 3661, "code_hash": null, "entity": [["block_row_warps", "ot", 2], ["block_col_warps", "ot", 4], ["warp_row_tiles", "ot", 2], ["warp_col_tiles", "ot", 1], ["chunk", "ot", 2], ["offset", "ot", 8], ["offsetCS", "ot", 8], ["vec", "ot", 4], ["wmma_m", "ot", 32]]}, "result": [[3.4234352e-05], 0, 1.2174851894378662, 1651819702.6446786], "version": 0.2, "tvm_version": "0.8.0"}
{"input": ["cuda -keys=cuda,gpu -max_num_threads=1024 -thread_warp_size=32", "fused_layer_norm_matmul_tensorcore_gelu.cuda", [["TENSOR", [1024, 256], "float16"], ["TENSOR", [1024], "float16"], ["TENSOR", [1024], "float16"], ["TENSOR", [1024, 256], "float16"], 0.00390625], {}], "config": {"index": 2014, "code_hash": null, "entity": [["block_row_warps", "ot", 2], ["block_col_warps", "ot", 4], ["warp_row_tiles", "ot", 2], ["warp_col_tiles", "ot", 4], ["chunk", "ot", 1], ["offset", "ot", 0], ["offsetCS", "ot", 8], ["vec", "ot", 2], ["wmma_m", "ot", 32]]}, "result": [[5.1986475e-05], 0, 1.1307885646820068, 1651819703.8430681], "version": 0.2, "tvm_version": "0.8.0"}
{"input": ["cuda -keys=cuda,gpu -max_num_threads=1024 -thread_warp_size=32", "fused_layer_norm_matmul_tensorcore_gelu.cuda", [["TENSOR", [1024, 256], "float16"], ["TENSOR", [1024], "float16"], ["TENSOR", [1024], "float16"], ["TENSOR", [1024, 256], "float16"], 0.00390625], {}], "config": {"index": 7454, "code_hash": null, "entity": [["block_row_warps", "ot", 4], ["block_col_warps", "ot", 1], ["warp_row_tiles", "ot", 1], ["warp_col_tiles", "ot", 1], ["chunk", "ot", 1], ["offset", "ot", 8], ["offsetCS", "ot", 8], ["vec", "ot", 2], ["wmma_m", "ot", 16]]}, "result": [[4.765504e-05], 0, 1.1137518882751465, 1651819704.4225845], "version": 0.2, "tvm_version": "0.8.0"}
{"input": ["cuda -keys=cuda,gpu -max_num_threads=1024 -thread_warp_size=32", "fused_layer_norm_matmul_tensorcore_gelu.cuda", [["TENSOR", [1024, 256], "float16"], ["TENSOR", [1024], "float16"], ["TENSOR", [1024], "float16"], ["TENSOR", [1024, 256], "float16"], 0.00390625], {}], "config": {"index": 8647, "code_hash": null, "entity": [["block_row_warps", "ot", 2], ["block_col_warps", "ot", 4], ["warp_row_tiles", "ot", 1], ["warp_col_tiles", "ot", 4], ["chunk", "ot", 4], ["offset", "ot", 0], ["offsetCS", "ot", 8], ["vec", "ot", 4], ["wmma_m", "ot", 16]]}, "result": [[5.4275844999999996e-05], 0, 1.3033466339111328, 1651819705.6550527], "version": 0.2, "tvm_version": "0.8.0"}
{"input": ["cuda -keys=cuda,gpu -max_num_threads=1024 -thread_warp_size=32", "fused_layer_norm_matmul_tensorcore_gelu.cuda", [["TENSOR", [1024, 256], "float16"], ["TENSOR", [1024], "float16"], ["TENSOR", [1024], "float16"], ["TENSOR", [1024, 256], "float16"], 0.00390625], {}], "config": {"index": 10722, "code_hash": null, "entity": [["block_row_warps", "ot", 1], ["block_col_warps", "ot", 2], ["warp_row_tiles", "ot", 1], ["warp_col_tiles", "ot", 2], ["chunk", "ot", 1], ["offset", "ot", 8], ["offsetCS", "ot", 0], ["vec", "ot", 1], ["wmma_m", "ot", 8]]}, "result": [[4.9095176000000005e-05], 0, 1.235236644744873, 1651819706.2844338], "version": 0.2, "tvm_version": "0.8.0"}
{"input": ["cuda -keys=cuda,gpu -max_num_threads=1024 -thread_warp_size=32", "fused_layer_norm_matmul_tensorcore_gelu.cuda", [["TENSOR", [1024, 256], "float16"], ["TENSOR", [1024], "float16"], ["TENSOR", [1024], "float16"], ["TENSOR", [1024, 256], "float16"], 0.00390625], {}], "config": {"index": 355, "code_hash": null, "entity": [["block_row_warps", "ot", 2], ["block_col_warps", "ot", 2], ["warp_row_tiles", "ot", 1], ["warp_col_tiles", "ot", 2], ["chunk", "ot", 1], ["offset", "ot", 8], ["offsetCS", "ot", 0], ["vec", "ot", 1], ["wmma_m", "ot", 32]]}, "result": [[4.8419522999999996e-05], 0, 1.083815574645996, 1651819708.0552044], "version": 0.2, "tvm_version": "0.8.0"}
{"input": ["cuda -keys=cuda,gpu -max_num_threads=1024 -thread_warp_size=32", "fused_layer_norm_matmul_tensorcore_gelu.cuda", [["TENSOR", [1024, 256], "float16"], ["TENSOR", [1024], "float16"], ["TENSOR", [1024], "float16"], ["TENSOR", [1024, 256], "float16"], 0.00390625], {}], "config": {"index": 14104, "code_hash": null, "entity": [["block_row_warps", "ot", 2], ["block_col_warps", "ot", 1], ["warp_row_tiles", "ot", 2], ["warp_col_tiles", "ot", 1], ["chunk", "ot", 4], ["offset", "ot", 8], ["offsetCS", "ot", 8], ["vec", "ot", 4], ["wmma_m", "ot", 8]]}, "result": [[3.0393588000000004e-05], 0, 1.2205195426940918, 1651819709.82293], "version": 0.2, "tvm_version": "0.8.0"}
{"input": ["cuda -keys=cuda,gpu -max_num_threads=1024 -thread_warp_size=32", "fused_layer_norm_matmul_tensorcore_gelu.cuda", [["TENSOR", [1024, 256], "float16"], ["TENSOR", [1024], "float16"], ["TENSOR", [1024], "float16"], ["TENSOR", [1024, 256], "float16"], 0.00390625], {}], "config": {"index": 5632, "code_hash": null, "entity": [["block_row_warps", "ot", 2], ["block_col_warps", "ot", 4], ["warp_row_tiles", "ot", 2], ["warp_col_tiles", "ot", 2], ["chunk", "ot", 2], ["offset", "ot", 8], ["offsetCS", "ot", 0], ["vec", "ot", 1], ["wmma_m", "ot", 16]]}, "result": [[4.2775191e-05], 0, 1.1690294742584229, 1651819710.450939], "version": 0.2, "tvm_version": "0.8.0"}
{"input": ["cuda -keys=cuda,gpu -max_num_threads=1024 -thread_warp_size=32", "fused_layer_norm_matmul_tensorcore_gelu.cuda", [["TENSOR", [1024, 256], "float16"], ["TENSOR", [1024], "float16"], ["TENSOR", [1024], "float16"], ["TENSOR", [1024, 256], "float16"], 0.00390625], {}], "config": {"index": 14121, "code_hash": null, "entity": [["block_row_warps", "ot", 1], ["block_col_warps", "ot", 1], ["warp_row_tiles", "ot", 1], ["warp_col_tiles", "ot", 2], ["chunk", "ot", 4], ["offset", "ot", 8], ["offsetCS", "ot", 8], ["vec", "ot", 4], ["wmma_m", "ot", 8]]}, "result": [[3.5552539e-05], 0, 1.2633192539215088, 1651819711.6338718], "version": 0.2, "tvm_version": "0.8.0"}
{"input": ["cuda -keys=cuda,gpu -max_num_threads=1024 -thread_warp_size=32", "fused_layer_norm_matmul_tensorcore_gelu.cuda", [["TENSOR", [1024, 256], "float16"], ["TENSOR", [1024], "float16"], ["TENSOR", [1024], "float16"], ["TENSOR", [1024, 256], "float16"], 0.00390625], {}], "config": {"index": 1516, "code_hash": null, "entity": [["block_row_warps", "ot", 2], ["block_col_warps", "ot", 2], ["warp_row_tiles", "ot", 1], ["warp_col_tiles", "ot", 4], ["chunk", "ot", 4], ["offset", "ot", 0], ["offsetCS", "ot", 0], ["vec", "ot", 2], ["wmma_m", "ot", 32]]}, "result": [[5.260023000000001e-05], 0, 1.2930908203125, 1651819713.5349627], "version": 0.2, "tvm_version": "0.8.0"}
{"input": ["cuda -keys=cuda,gpu -max_num_threads=1024 -thread_warp_size=32", "fused_layer_norm_matmul_tensorcore_gelu.cuda", [["TENSOR", [1024, 256], "float16"], ["TENSOR", [1024], "float16"], ["TENSOR", [1024], "float16"], ["TENSOR", [1024, 256], "float16"], 0.00390625], {}], "config": {"index": 2165, "code_hash": null, "entity": [["block_row_warps", "ot", 4], ["block_col_warps", "ot", 2], ["warp_row_tiles", "ot", 1], ["warp_col_tiles", "ot", 4], ["chunk", "ot", 4], ["offset", "ot", 0], ["offsetCS", "ot", 8], ["vec", "ot", 2], ["wmma_m", "ot", 32]]}, "result": [[7.4314454e-05], 0, 1.2589256763458252, 1651819715.4932613], "version": 0.2, "tvm_version": "0.8.0"}
{"input": ["cuda -keys=cuda,gpu -max_num_threads=1024 -thread_warp_size=32", "fused_layer_norm_matmul_tensorcore_gelu.cuda", [["TENSOR", [1024, 256], "float16"], ["TENSOR", [1024], "float16"], ["TENSOR", [1024], "float16"], ["TENSOR", [1024, 256], "float16"], 0.00390625], {}], "config": {"index": 11685, "code_hash": null, "entity": [["block_row_warps", "ot", 1], ["block_col_warps", "ot", 2], ["warp_row_tiles", "ot", 4], ["warp_col_tiles", "ot", 1], ["chunk", "ot", 1], ["offset", "ot", 0], ["offsetCS", "ot", 0], ["vec", "ot", 2], ["wmma_m", "ot", 8]]}, "result": [[4.313241e-05], 0, 1.1878294944763184, 1651819716.6660647], "version": 0.2, "tvm_version": "0.8.0"}
{"input": ["cuda -keys=cuda,gpu -max_num_threads=1024 -thread_warp_size=32", "fused_layer_norm_matmul_tensorcore_gelu.cuda", [["TENSOR", [1024, 256], "float16"], ["TENSOR", [1024], "float16"], ["TENSOR", [1024], "float16"], ["TENSOR", [1024, 256], "float16"], 0.00390625], {}], "config": {"index": 10555, "code_hash": null, "entity": [["block_row_warps", "ot", 2], ["block_col_warps", "ot", 4], ["warp_row_tiles", "ot", 4], ["warp_col_tiles", "ot", 1], ["chunk", "ot", 4], ["offset", "ot", 0], ["offsetCS", "ot", 0], ["vec", "ot", 1], ["wmma_m", "ot", 8]]}, "result": [[6.0869906e-05], 0, 1.251835584640503, 1651819717.9389987], "version": 0.2, "tvm_version": "0.8.0"}
{"input": ["cuda -keys=cuda,gpu -max_num_threads=1024 -thread_warp_size=32", "fused_layer_norm_matmul_tensorcore_gelu.cuda", [["TENSOR", [1024, 256], "float16"], ["TENSOR", [1024], "float16"], ["TENSOR", [1024], "float16"], ["TENSOR", [1024, 256], "float16"], 0.00390625], {}], "config": {"index": 2910, "code_hash": null, "entity": [["block_row_warps", "ot", 1], ["block_col_warps", "ot", 2], ["warp_row_tiles", "ot", 4], ["warp_col_tiles", "ot", 4], ["chunk", "ot", 8], ["offset", "ot", 0], ["offsetCS", "ot", 0], ["vec", "ot", 4], ["wmma_m", "ot", 32]]}, "result": [[0.00011368827], 0, 1.7935104370117188, 1651819720.168221], "version": 0.2, "tvm_version": "0.8.0"}
{"input": ["cuda -keys=cuda,gpu -max_num_threads=1024 -thread_warp_size=32", "fused_layer_norm_matmul_tensorcore_gelu.cuda", [["TENSOR", [1024, 256], "float16"], ["TENSOR", [1024], "float16"], ["TENSOR", [1024], "float16"], ["TENSOR", [1024, 256], "float16"], 0.00390625], {}], "config": {"index": 10649, "code_hash": null, "entity": [["block_row_warps", "ot", 4], ["block_col_warps", "ot", 1], ["warp_row_tiles", "ot", 2], ["warp_col_tiles", "ot", 2], ["chunk", "ot", 8], ["offset", "ot", 0], ["offsetCS", "ot", 0], ["vec", "ot", 1], ["wmma_m", "ot", 8]]}, "result": [[6.939243300000001e-05], 0, 1.3337674140930176, 1651819721.4797657], "version": 0.2, "tvm_version": "0.8.0"}
{"input": ["cuda -keys=cuda,gpu -max_num_threads=1024 -thread_warp_size=32", "fused_layer_norm_matmul_tensorcore_gelu.cuda", [["TENSOR", [1024, 256], "float16"], ["TENSOR", [1024], "float16"], ["TENSOR", [1024], "float16"], ["TENSOR", [1024, 256], "float16"], 0.00390625], {}], "config": {"index": 2813, "code_hash": null, "entity": [["block_row_warps", "ot", 4], ["block_col_warps", "ot", 2], ["warp_row_tiles", "ot", 1], ["warp_col_tiles", "ot", 4], ["chunk", "ot", 4], ["offset", "ot", 0], ["offsetCS", "ot", 0], ["vec", "ot", 4], ["wmma_m", "ot", 32]]}, "result": [[0.000103584452], 0, 1.4452712535858154, 1651819750.400036], "version": 0.2, "tvm_version": "0.8.0"}
{"input": ["cuda -keys=cuda,gpu -max_num_threads=1024 -thread_warp_size=32", "fused_layer_norm_matmul_tensorcore_gelu.cuda", [["TENSOR", [1024, 256], "float16"], ["TENSOR", [1024], "float16"], ["TENSOR", [1024], "float16"], ["TENSOR", [1024, 256], "float16"], 0.00390625], {}], "config": {"index": 1045, "code_hash": null, "entity": [["block_row_warps", "ot", 2], ["block_col_warps", "ot", 1], ["warp_row_tiles", "ot", 4], ["warp_col_tiles", "ot", 4], ["chunk", "ot", 1], ["offset", "ot", 8], ["offsetCS", "ot", 8], ["vec", "ot", 1], ["wmma_m", "ot", 32]]}, "result": [[0.00027434876000000005], 0, 1.8534801006317139, 1651819751.6981058], "version": 0.2, "tvm_version": "0.8.0"}
{"input": ["cuda -keys=cuda,gpu -max_num_threads=1024 -thread_warp_size=32", "fused_layer_norm_matmul_tensorcore_gelu.cuda", [["TENSOR", [1024, 256], "float16"], ["TENSOR", [1024], "float16"], ["TENSOR", [1024], "float16"], ["TENSOR", [1024, 256], "float16"], 0.00390625], {}], "config": {"index": 6604, "code_hash": null, "entity": [["block_row_warps", "ot", 2], ["block_col_warps", "ot", 4], ["warp_row_tiles", "ot", 2], ["warp_col_tiles", "ot", 2], ["chunk", "ot", 2], ["offset", "ot", 0], ["offsetCS", "ot", 0], ["vec", "ot", 2], ["wmma_m", "ot", 16]]}, "result": [[4.2235261999999995e-05], 0, 1.2687809467315674, 1651819752.296499], "version": 0.2, "tvm_version": "0.8.0"}
{"input": ["cuda -keys=cuda,gpu -max_num_threads=1024 -thread_warp_size=32", "fused_layer_norm_matmul_tensorcore_gelu.cuda", [["TENSOR", [1024, 256], "float16"], ["TENSOR", [1024], "float16"], ["TENSOR", [1024], "float16"], ["TENSOR", [1024, 256], "float16"], 0.00390625], {}], "config": {"index": 1935, "code_hash": null, "entity": [["block_row_warps", "ot", 1], ["block_col_warps", "ot", 1], ["warp_row_tiles", "ot", 4], ["warp_col_tiles", "ot", 4], ["chunk", "ot", 8], ["offset", "ot", 8], ["offsetCS", "ot", 0], ["vec", "ot", 2], ["wmma_m", "ot", 32]]}, "result": [[0.000197090282], 0, 1.9479753971099854, 1651819753.510469], "version": 0.2, "tvm_version": "0.8.0"}
{"input": ["cuda -keys=cuda,gpu -max_num_threads=1024 -thread_warp_size=32", "fused_layer_norm_matmul_tensorcore_gelu.cuda", [["TENSOR", [1024, 256], "float16"], ["TENSOR", [1024], "float16"], ["TENSOR", [1024], "float16"], ["TENSOR", [1024, 256], "float16"], 0.00390625], {}], "config": {"index": 8953, "code_hash": null, "entity": [["block_row_warps", "ot", 2], ["block_col_warps", "ot", 4], ["warp_row_tiles", "ot", 2], ["warp_col_tiles", "ot", 2], ["chunk", "ot", 4], ["offset", "ot", 8], ["offsetCS", "ot", 8], ["vec", "ot", 4], ["wmma_m", "ot", 16]]}, "result": [[3.0182044e-05], 0, 1.3263494968414307, 1651819754.095736], "version": 0.2, "tvm_version": "0.8.0"}
{"input": ["cuda -keys=cuda,gpu -max_num_threads=1024 -thread_warp_size=32", "fused_layer_norm_matmul_tensorcore_gelu.cuda", [["TENSOR", [1024, 256], "float16"], ["TENSOR", [1024], "float16"], ["TENSOR", [1024], "float16"], ["TENSOR", [1024, 256], "float16"], 0.00390625], {}], "config": {"index": 12321, "code_hash": null, "entity": [["block_row_warps", "ot", 1], ["block_col_warps", "ot", 1], ["warp_row_tiles", "ot", 2], ["warp_col_tiles", "ot", 1], ["chunk", "ot", 1], ["offset", "ot", 0], ["offsetCS", "ot", 8], ["vec", "ot", 2], ["wmma_m", "ot", 8]]}, "result": [[4.2570104999999994e-05], 0, 1.2482500076293945, 1651819754.6596854], "version": 0.2, "tvm_version": "0.8.0"}
{"input": ["cuda -keys=cuda,gpu -max_num_threads=1024 -thread_warp_size=32", "fused_layer_norm_matmul_tensorcore_gelu.cuda", [["TENSOR", [1024, 256], "float16"], ["TENSOR", [1024], "float16"], ["TENSOR", [1024], "float16"], ["TENSOR", [1024, 256], "float16"], 0.00390625], {}], "config": {"index": 3675, "code_hash": null, "entity": [["block_row_warps", "ot", 1], ["block_col_warps", "ot", 2], ["warp_row_tiles", "ot", 1], ["warp_col_tiles", "ot", 2], ["chunk", "ot", 2], ["offset", "ot", 8], ["offsetCS", "ot", 8], ["vec", "ot", 4], ["wmma_m", "ot", 32]]}, "result": [[3.1142862e-05], 0, 1.2515270709991455, 1651819755.2777302], "version": 0.2, "tvm_version": "0.8.0"}
{"input": ["cuda -keys=cuda,gpu -max_num_threads=1024 -thread_warp_size=32", "fused_layer_norm_matmul_tensorcore_gelu.cuda", [["TENSOR", [1024, 256], "float16"], ["TENSOR", [1024], "float16"], ["TENSOR", [1024], "float16"], ["TENSOR", [1024, 256], "float16"], 0.00390625], {}], "config": {"index": 7487, "code_hash": null, "entity": [["block_row_warps", "ot", 4], ["block_col_warps", "ot", 4], ["warp_row_tiles", "ot", 1], ["warp_col_tiles", "ot", 2], ["chunk", "ot", 1], ["offset", "ot", 8], ["offsetCS", "ot", 8], ["vec", "ot", 2], ["wmma_m", "ot", 16]]}, "result": [[3.20167e-05], 0, 1.116265058517456, 1651819755.8212245], "version": 0.2, "tvm_version": "0.8.0"}
{"input": ["cuda -keys=cuda,gpu -max_num_threads=1024 -thread_warp_size=32", "fused_layer_norm_matmul_tensorcore_gelu.cuda", [["TENSOR", [1024, 256], "float16"], ["TENSOR", [1024], "float16"], ["TENSOR", [1024], "float16"], ["TENSOR", [1024, 256], "float16"], 0.00390625], {}], "config": {"index": 5411, "code_hash": null, "entity": [["block_row_warps", "ot", 4], ["block_col_warps", "ot", 1], ["warp_row_tiles", "ot", 2], ["warp_col_tiles", "ot", 4], ["chunk", "ot", 4], ["offset", "ot", 0], ["offsetCS", "ot", 0], ["vec", "ot", 1], ["wmma_m", "ot", 16]]}, "result": [[0.00010292599199999999], 0, 1.435624361038208, 1651819756.628312], "version": 0.2, "tvm_version": "0.8.0"}
{"input": ["cuda -keys=cuda,gpu -max_num_threads=1024 -thread_warp_size=32", "fused_layer_norm_matmul_tensorcore_gelu.cuda", [["TENSOR", [1024, 256], "float16"], ["TENSOR", [1024], "float16"], ["TENSOR", [1024], "float16"], ["TENSOR", [1024, 256], "float16"], 0.00390625], {}], "config": {"index": 6844, "code_hash": null, "entity": [["block_row_warps", "ot", 2], ["block_col_warps", "ot", 2], ["warp_row_tiles", "ot", 2], ["warp_col_tiles", "ot", 2], ["chunk", "ot", 1], ["offset", "ot", 8], ["offsetCS", "ot", 0], ["vec", "ot", 2], ["wmma_m", "ot", 16]]}, "result": [[4.1608529e-05], 0, 1.1813557147979736, 1651819757.2341824], "version": 0.2, "tvm_version": "0.8.0"}
{"input": ["cuda -keys=cuda,gpu -max_num_threads=1024 -thread_warp_size=32", "fused_layer_norm_matmul_tensorcore_gelu.cuda", [["TENSOR", [1024, 256], "float16"], ["TENSOR", [1024], "float16"], ["TENSOR", [1024], "float16"], ["TENSOR", [1024, 256], "float16"], 0.00390625], {}], "config": {"index": 8688, "code_hash": null, "entity": [["block_row_warps", "ot", 1], ["block_col_warps", "ot", 2], ["warp_row_tiles", "ot", 4], ["warp_col_tiles", "ot", 1], ["chunk", "ot", 8], ["offset", "ot", 0], ["offsetCS", "ot", 8], ["vec", "ot", 4], ["wmma_m", "ot", 16]]}, "result": [[5.9209783000000004e-05], 0, 1.4612691402435303, 1651819757.9217496], "version": 0.2, "tvm_version": "0.8.0"}
{"input": ["cuda -keys=cuda,gpu -max_num_threads=1024 -thread_warp_size=32", "fused_layer_norm_matmul_tensorcore_gelu.cuda", [["TENSOR", [1024, 256], "float16"], ["TENSOR", [1024], "float16"], ["TENSOR", [1024], "float16"], ["TENSOR", [1024, 256], "float16"], 0.00390625], {}], "config": {"index": 6612, "code_hash": null, "entity": [["block_row_warps", "ot", 1], ["block_col_warps", "ot", 4], ["warp_row_tiles", "ot", 4], ["warp_col_tiles", "ot", 2], ["chunk", "ot", 2], ["offset", "ot", 0], ["offsetCS", "ot", 0], ["vec", "ot", 2], ["wmma_m", "ot", 16]]}, "result": [[5.4579557000000004e-05], 0, 1.2224721908569336, 1651819758.5512083], "version": 0.2, "tvm_version": "0.8.0"}
{"input": ["cuda -keys=cuda,gpu -max_num_threads=1024 -thread_warp_size=32", "fused_layer_norm_matmul_tensorcore_gelu.cuda", [["TENSOR", [1024, 256], "float16"], ["TENSOR", [1024], "float16"], ["TENSOR", [1024], "float16"], ["TENSOR", [1024, 256], "float16"], 0.00390625], {}], "config": {"index": 507, "code_hash": null, "entity": [["block_row_warps", "ot", 1], ["block_col_warps", "ot", 2], ["warp_row_tiles", "ot", 4], ["warp_col_tiles", "ot", 1], ["chunk", "ot", 4], ["offset", "ot", 8], ["offsetCS", "ot", 0], ["vec", "ot", 1], ["wmma_m", "ot", 32]]}, "result": [[0.00013480104700000001], 0, 1.5809977054595947, 1651819759.476252], "version": 0.2, "tvm_version": "0.8.0"}
{"input": ["cuda -keys=cuda,gpu -max_num_threads=1024 -thread_warp_size=32", "fused_layer_norm_matmul_tensorcore_gelu.cuda", [["TENSOR", [1024, 256], "float16"], ["TENSOR", [1024], "float16"], ["TENSOR", [1024], "float16"], ["TENSOR", [1024, 256], "float16"], 0.00390625], {}], "config": {"index": 363, "code_hash": null, "entity": [["block_row_warps", "ot", 1], ["block_col_warps", "ot", 2], ["warp_row_tiles", "ot", 2], ["warp_col_tiles", "ot", 2], ["chunk", "ot", 1], ["offset", "ot", 8], ["offsetCS", "ot", 0], ["vec", "ot", 1], ["wmma_m", "ot", 32]]}, "result": [[7.9928714e-05], 0, 1.327620506286621, 1651819760.1648908], "version": 0.2, "tvm_version": "0.8.0"}
{"input": ["cuda -keys=cuda,gpu -max_num_threads=1024 -thread_warp_size=32", "fused_layer_norm_matmul_tensorcore_gelu.cuda", [["TENSOR", [1024, 256], "float16"], ["TENSOR", [1024], "float16"], ["TENSOR", [1024], "float16"], ["TENSOR", [1024, 256], "float16"], 0.00390625], {}], "config": {"index": 5401, "code_hash": null, "entity": [["block_row_warps", "ot", 2], ["block_col_warps", "ot", 1], ["warp_row_tiles", "ot", 1], ["warp_col_tiles", "ot", 4], ["chunk", "ot", 4], ["offset", "ot", 0], ["offsetCS", "ot", 0], ["vec", "ot", 1], ["wmma_m", "ot", 16]]}, "result": [[6.5441554e-05], 0, 1.4045095443725586, 1651819760.8308253], "version": 0.2, "tvm_version": "0.8.0"}
{"input": ["cuda -keys=cuda,gpu -max_num_threads=1024 -thread_warp_size=32", "fused_layer_norm_matmul_tensorcore_gelu.cuda", [["TENSOR", [1024, 256], "float16"], ["TENSOR", [1024], "float16"], ["TENSOR", [1024], "float16"], ["TENSOR", [1024, 256], "float16"], 0.00390625], {}], "config": {"index": 7403, "code_hash": null, "entity": [["block_row_warps", "ot", 4], ["block_col_warps", "ot", 2], ["warp_row_tiles", "ot", 1], ["warp_col_tiles", "ot", 2], ["chunk", "ot", 8], ["offset", "ot", 0], ["offsetCS", "ot", 8], ["vec", "ot", 2], ["wmma_m", "ot", 16]]}, "result": [[4.8117374e-05], 0, 1.351651668548584, 1651819761.499142], "version": 0.2, "tvm_version": "0.8.0"}
{"input": ["cuda -keys=cuda,gpu -max_num_threads=1024 -thread_warp_size=32", "fused_layer_norm_matmul_tensorcore_gelu.cuda", [["TENSOR", [1024, 256], "float16"], ["TENSOR", [1024], "float16"], ["TENSOR", [1024], "float16"], ["TENSOR", [1024, 256], "float16"], 0.00390625], {}], "config": {"index": 13642, "code_hash": null, "entity": [["block_row_warps", "ot", 2], ["block_col_warps", "ot", 4], ["warp_row_tiles", "ot", 1], ["warp_col_tiles", "ot", 2], ["chunk", "ot", 1], ["offset", "ot", 0], ["offsetCS", "ot", 8], ["vec", "ot", 4], ["wmma_m", "ot", 8]]}, "result": [[4.308458e-05], 0, 1.1416363716125488, 1651819762.086869], "version": 0.2, "tvm_version": "0.8.0"}
{"input": ["cuda -keys=cuda,gpu -max_num_threads=1024 -thread_warp_size=32", "fused_layer_norm_matmul_tensorcore_gelu.cuda", [["TENSOR", [1024, 256], "float16"], ["TENSOR", [1024], "float16"], ["TENSOR", [1024], "float16"], ["TENSOR", [1024, 256], "float16"], 0.00390625], {}], "config": {"index": 11071, "code_hash": null, "entity": [["block_row_warps", "ot", 2], ["block_col_warps", "ot", 1], ["warp_row_tiles", "ot", 1], ["warp_col_tiles", "ot", 4], ["chunk", "ot", 1], ["offset", "ot", 0], ["offsetCS", "ot", 8], ["vec", "ot", 1], ["wmma_m", "ot", 8]]}, "result": [[5.276486299999999e-05], 0, 1.216745138168335, 1651819762.7448938], "version": 0.2, "tvm_version": "0.8.0"}
{"input": ["cuda -keys=cuda,gpu -max_num_threads=1024 -thread_warp_size=32", "fused_layer_norm_matmul_tensorcore_gelu.cuda", [["TENSOR", [1024, 256], "float16"], ["TENSOR", [1024], "float16"], ["TENSOR", [1024], "float16"], ["TENSOR", [1024, 256], "float16"], 0.00390625], {}], "config": {"index": 5238, "code_hash": null, "entity": [["block_row_warps", "ot", 1], ["block_col_warps", "ot", 1], ["warp_row_tiles", "ot", 1], ["warp_col_tiles", "ot", 4], ["chunk", "ot", 1], ["offset", "ot", 0], ["offsetCS", "ot", 0], ["vec", "ot", 1], ["wmma_m", "ot", 16]]}, "result": [[5.9262362000000006e-05], 0, 1.1981956958770752, 1651819763.4218931], "version": 0.2, "tvm_version": "0.8.0"}
{"input": ["cuda -keys=cuda,gpu -max_num_threads=1024 -thread_warp_size=32", "fused_layer_norm_matmul_tensorcore_gelu.cuda", [["TENSOR", [1024, 256], "float16"], ["TENSOR", [1024], "float16"], ["TENSOR", [1024], "float16"], ["TENSOR", [1024, 256], "float16"], 0.00390625], {}], "config": {"index": 6453, "code_hash": null, "entity": [["block_row_warps", "ot", 1], ["block_col_warps", "ot", 1], ["warp_row_tiles", "ot", 1], ["warp_col_tiles", "ot", 4], ["chunk", "ot", 8], ["offset", "ot", 8], ["offsetCS", "ot", 8], ["vec", "ot", 1], ["wmma_m", "ot", 16]]}, "result": [[0.00011832887200000001], 0, 1.3957579135894775, 1651819764.273746], "version": 0.2, "tvm_version": "0.8.0"}
{"input": ["cuda -keys=cuda,gpu -max_num_threads=1024 -thread_warp_size=32", "fused_layer_norm_matmul_tensorcore_gelu.cuda", [["TENSOR", [1024, 256], "float16"], ["TENSOR", [1024], "float16"], ["TENSOR", [1024], "float16"], ["TENSOR", [1024, 256], "float16"], 0.00390625], {}], "config": {"index": 300, "code_hash": null, "entity": [["block_row_warps", "ot", 1], ["block_col_warps", "ot", 2], ["warp_row_tiles", "ot", 1], ["warp_col_tiles", "ot", 4], ["chunk", "ot", 8], ["offset", "ot", 0], ["offsetCS", "ot", 0], ["vec", "ot", 1], ["wmma_m", "ot", 32]]}, "result": [[6.8202978e-05], 0, 1.3239214420318604, 1651819764.983709], "version": 0.2, "tvm_version": "0.8.0"}
{"input": ["cuda -keys=cuda,gpu -max_num_threads=1024 -thread_warp_size=32", "fused_layer_norm_matmul_tensorcore_gelu.cuda", [["TENSOR", [1024, 256], "float16"], ["TENSOR", [1024], "float16"], ["TENSOR", [1024], "float16"], ["TENSOR", [1024, 256], "float16"], 0.00390625], {}], "config": {"index": 5363, "code_hash": null, "entity": [["block_row_warps", "ot", 4], ["block_col_warps", "ot", 4], ["warp_row_tiles", "ot", 2], ["warp_col_tiles", "ot", 1], ["chunk", "ot", 4], ["offset", "ot", 0], ["offsetCS", "ot", 0], ["vec", "ot", 1], ["wmma_m", "ot", 16]]}, "result": [[6.790668800000001e-05], 0, 1.3117947578430176, 1651819765.6991878], "version": 0.2, "tvm_version": "0.8.0"}
{"input": ["cuda -keys=cuda,gpu -max_num_threads=1024 -thread_warp_size=32", "fused_layer_norm_matmul_tensorcore_gelu.cuda", [["TENSOR", [1024, 256], "float16"], ["TENSOR", [1024], "float16"], ["TENSOR", [1024], "float16"], ["TENSOR", [1024, 256], "float16"], 0.00390625], {}], "config": {"index": 13332, "code_hash": null, "entity": [["block_row_warps", "ot", 1], ["block_col_warps", "ot", 2], ["warp_row_tiles", "ot", 4], ["warp_col_tiles", "ot", 2], ["chunk", "ot", 1], ["offset", "ot", 8], ["offsetCS", "ot", 0], ["vec", "ot", 4], ["wmma_m", "ot", 8]]}, "result": [[4.8456358000000004e-05], 0, 1.3107032775878906, 1651819766.3215501], "version": 0.2, "tvm_version": "0.8.0"}
{"input": ["cuda -keys=cuda,gpu -max_num_threads=1024 -thread_warp_size=32", "fused_layer_norm_matmul_tensorcore_gelu.cuda", [["TENSOR", [1024, 256], "float16"], ["TENSOR", [1024], "float16"], ["TENSOR", [1024], "float16"], ["TENSOR", [1024, 256], "float16"], 0.00390625], {}], "config": {"index": 1670, "code_hash": null, "entity": [["block_row_warps", "ot", 4], ["block_col_warps", "ot", 2], ["warp_row_tiles", "ot", 4], ["warp_col_tiles", "ot", 2], ["chunk", "ot", 1], ["offset", "ot", 8], ["offsetCS", "ot", 0], ["vec", "ot", 2], ["wmma_m", "ot", 32]]}, "result": [[0.000108265761], 0, 1.448279857635498, 1651819767.1138432], "version": 0.2, "tvm_version": "0.8.0"}
{"input": ["cuda -keys=cuda,gpu -max_num_threads=1024 -thread_warp_size=32", "fused_layer_norm_matmul_tensorcore_gelu.cuda", [["TENSOR", [1024, 256], "float16"], ["TENSOR", [1024], "float16"], ["TENSOR", [1024], "float16"], ["TENSOR", [1024, 256], "float16"], 0.00390625], {}], "config": {"index": 682, "code_hash": null, "entity": [["block_row_warps", "ot", 2], ["block_col_warps", "ot", 4], ["warp_row_tiles", "ot", 1], ["warp_col_tiles", "ot", 2], ["chunk", "ot", 1], ["offset", "ot", 0], ["offsetCS", "ot", 8], ["vec", "ot", 1], ["wmma_m", "ot", 32]]}, "result": [[3.9978528e-05], 0, 1.1244993209838867, 1651819767.6828365], "version": 0.2, "tvm_version": "0.8.0"}
{"input": ["cuda -keys=cuda,gpu -max_num_threads=1024 -thread_warp_size=32", "fused_layer_norm_matmul_tensorcore_gelu.cuda", [["TENSOR", [1024, 256], "float16"], ["TENSOR", [1024], "float16"], ["TENSOR", [1024], "float16"], ["TENSOR", [1024, 256], "float16"], 0.00390625], {}], "config": {"index": 9057, "code_hash": null, "entity": [["block_row_warps", "ot", 1], ["block_col_warps", "ot", 2], ["warp_row_tiles", "ot", 2], ["warp_col_tiles", "ot", 4], ["chunk", "ot", 8], ["offset", "ot", 8], ["offsetCS", "ot", 8], ["vec", "ot", 4], ["wmma_m", "ot", 16]]}, "result": [[4.217009e-05], 0, 1.4851861000061035, 1651819768.3586478], "version": 0.2, "tvm_version": "0.8.0"}
{"input": ["cuda -keys=cuda,gpu -max_num_threads=1024 -thread_warp_size=32", "fused_layer_norm_matmul_tensorcore_gelu.cuda", [["TENSOR", [1024, 256], "float16"], ["TENSOR", [1024], "float16"], ["TENSOR", [1024], "float16"], ["TENSOR", [1024, 256], "float16"], 0.00390625], {}], "config": {"index": 6403, "code_hash": null, "entity": [["block_row_warps", "ot", 2], ["block_col_warps", "ot", 2], ["warp_row_tiles", "ot", 1], ["warp_col_tiles", "ot", 1], ["chunk", "ot", 8], ["offset", "ot", 8], ["offsetCS", "ot", 8], ["vec", "ot", 1], ["wmma_m", "ot", 16]]}, "result": [[4.5192502e-05], 0, 1.1803483963012695, 1651819768.9513836], "version": 0.2, "tvm_version": "0.8.0"}
{"input": ["cuda -keys=cuda,gpu -max_num_threads=1024 -thread_warp_size=32", "fused_layer_norm_matmul_tensorcore_gelu.cuda", [["TENSOR", [1024, 256], "float16"], ["TENSOR", [1024], "float16"], ["TENSOR", [1024], "float16"], ["TENSOR", [1024, 256], "float16"], 0.00390625], {}], "config": {"index": 1598, "code_hash": null, "entity": [["block_row_warps", "ot", 4], ["block_col_warps", "ot", 2], ["warp_row_tiles", "ot", 1], ["warp_col_tiles", "ot", 4], ["chunk", "ot", 8], ["offset", "ot", 0], ["offsetCS", "ot", 0], ["vec", "ot", 2], ["wmma_m", "ot", 32]]}, "result": [[0.000110614423], 0, 1.3352172374725342, 1651819771.1407695], "version": 0.2, "tvm_version": "0.8.0"}
{"input": ["cuda -keys=cuda,gpu -max_num_threads=1024 -thread_warp_size=32", "fused_layer_norm_matmul_tensorcore_gelu.cuda", [["TENSOR", [1024, 256], "float16"], ["TENSOR", [1024], "float16"], ["TENSOR", [1024], "float16"], ["TENSOR", [1024, 256], "float16"], 0.00390625], {}], "config": {"index": 8295, "code_hash": null, "entity": [["block_row_warps", "ot", 1], ["block_col_warps", "ot", 4], ["warp_row_tiles", "ot", 1], ["warp_col_tiles", "ot", 2], ["chunk", "ot", 4], ["offset", "ot", 8], ["offsetCS", "ot", 0], ["vec", "ot", 4], ["wmma_m", "ot", 16]]}, "result": [[2.2951153000000003e-05], 0, 1.1808462142944336, 1651819771.6864712], "version": 0.2, "tvm_version": "0.8.0"}
{"input": ["cuda -keys=cuda,gpu -max_num_threads=1024 -thread_warp_size=32", "fused_layer_norm_matmul_tensorcore_gelu.cuda", [["TENSOR", [1024, 256], "float16"], ["TENSOR", [1024], "float16"], ["TENSOR", [1024], "float16"], ["TENSOR", [1024, 256], "float16"], 0.00390625], {}], "config": {"index": 11844, "code_hash": null, "entity": [["block_row_warps", "ot", 1], ["block_col_warps", "ot", 1], ["warp_row_tiles", "ot", 4], ["warp_col_tiles", "ot", 1], ["chunk", "ot", 4], ["offset", "ot", 0], ["offsetCS", "ot", 0], ["vec", "ot", 2], ["wmma_m", "ot", 8]]}, "result": [[6.7979493e-05], 0, 1.2489705085754395, 1651819772.343673], "version": 0.2, "tvm_version": "0.8.0"}
{"input": ["cuda -keys=cuda,gpu -max_num_threads=1024 -thread_warp_size=32", "fused_layer_norm_matmul_tensorcore_gelu.cuda", [["TENSOR", [1024, 256], "float16"], ["TENSOR", [1024], "float16"], ["TENSOR", [1024], "float16"], ["TENSOR", [1024, 256], "float16"], 0.00390625], {}], "config": {"index": 12806, "code_hash": null, "entity": [["block_row_warps", "ot", 4], ["block_col_warps", "ot", 4], ["warp_row_tiles", "ot", 1], ["warp_col_tiles", "ot", 1], ["chunk", "ot", 4], ["offset", "ot", 8], ["offsetCS", "ot", 8], ["vec", "ot", 2], ["wmma_m", "ot", 8]]}, "result": [[2.4841432e-05], 0, 1.1430716514587402, 1651819772.9059477], "version": 0.2, "tvm_version": "0.8.0"}
{"input": ["cuda -keys=cuda,gpu -max_num_threads=1024 -thread_warp_size=32", "fused_layer_norm_matmul_tensorcore_gelu.cuda", [["TENSOR", [1024, 256], "float16"], ["TENSOR", [1024], "float16"], ["TENSOR", [1024], "float16"], ["TENSOR", [1024, 256], "float16"], 0.00390625], {}], "config": {"index": 10603, "code_hash": null, "entity": [["block_row_warps", "ot", 2], ["block_col_warps", "ot", 1], ["warp_row_tiles", "ot", 4], ["warp_col_tiles", "ot", 4], ["chunk", "ot", 4], ["offset", "ot", 0], ["offsetCS", "ot", 0], ["vec", "ot", 1], ["wmma_m", "ot", 8]]}, "result": [[0.000121442109], 0, 1.5376534461975098, 1651819773.8092175], "version": 0.2, "tvm_version": "0.8.0"}
{"input": ["cuda -keys=cuda,gpu -max_num_threads=1024 -thread_warp_size=32", "fused_layer_norm_matmul_tensorcore_gelu.cuda", [["TENSOR", [1024, 256], "float16"], ["TENSOR", [1024], "float16"], ["TENSOR", [1024], "float16"], ["TENSOR", [1024, 256], "float16"], 0.00390625], {}], "config": {"index": 12235, "code_hash": null, "entity": [["block_row_warps", "ot", 2], ["block_col_warps", "ot", 2], ["warp_row_tiles", "ot", 1], ["warp_col_tiles", "ot", 1], ["chunk", "ot", 8], ["offset", "ot", 8], ["offsetCS", "ot", 0], ["vec", "ot", 2], ["wmma_m", "ot", 8]]}, "result": [[2.6947961e-05], 0, 1.2012569904327393, 1651819774.3735847], "version": 0.2, "tvm_version": "0.8.0"}
{"input": ["cuda -keys=cuda,gpu -max_num_threads=1024 -thread_warp_size=32", "fused_layer_norm_matmul_tensorcore_gelu.cuda", [["TENSOR", [1024, 256], "float16"], ["TENSOR", [1024], "float16"], ["TENSOR", [1024], "float16"], ["TENSOR", [1024, 256], "float16"], 0.00390625], {}], "config": {"index": 12889, "code_hash": null, "entity": [["block_row_warps", "ot", 2], ["block_col_warps", "ot", 1], ["warp_row_tiles", "ot", 2], ["warp_col_tiles", "ot", 1], ["chunk", "ot", 8], ["offset", "ot", 8], ["offsetCS", "ot", 8], ["vec", "ot", 2], ["wmma_m", "ot", 8]]}, "result": [[5.2200005e-05], 0, 1.378218412399292, 1651819775.0662415], "version": 0.2, "tvm_version": "0.8.0"}
{"input": ["cuda -keys=cuda,gpu -max_num_threads=1024 -thread_warp_size=32", "fused_layer_norm_matmul_tensorcore_gelu.cuda", [["TENSOR", [1024, 256], "float16"], ["TENSOR", [1024], "float16"], ["TENSOR", [1024], "float16"], ["TENSOR", [1024, 256], "float16"], 0.00390625], {}], "config": {"index": 7552, "code_hash": null, "entity": [["block_row_warps", "ot", 2], ["block_col_warps", "ot", 1], ["warp_row_tiles", "ot", 4], ["warp_col_tiles", "ot", 1], ["chunk", "ot", 2], ["offset", "ot", 8], ["offsetCS", "ot", 8], ["vec", "ot", 2], ["wmma_m", "ot", 16]]}, "result": [[9.0658293e-05], 0, 1.2974438667297363, 1651819775.7965388], "version": 0.2, "tvm_version": "0.8.0"}
{"input": ["cuda -keys=cuda,gpu -max_num_threads=1024 -thread_warp_size=32", "fused_layer_norm_matmul_tensorcore_gelu.cuda", [["TENSOR", [1024, 256], "float16"], ["TENSOR", [1024], "float16"], ["TENSOR", [1024], "float16"], ["TENSOR", [1024, 256], "float16"], 0.00390625], {}], "config": {"index": 11418, "code_hash": null, "entity": [["block_row_warps", "ot", 1], ["block_col_warps", "ot", 4], ["warp_row_tiles", "ot", 4], ["warp_col_tiles", "ot", 4], ["chunk", "ot", 1], ["offset", "ot", 8], ["offsetCS", "ot", 8], ["vec", "ot", 1], ["wmma_m", "ot", 8]]}, "result": [[7.8004488e-05], 0, 1.4347953796386719, 1651819776.5120018], "version": 0.2, "tvm_version": "0.8.0"}
{"input": ["cuda -keys=cuda,gpu -max_num_threads=1024 -thread_warp_size=32", "fused_layer_norm_matmul_tensorcore_gelu.cuda", [["TENSOR", [1024, 256], "float16"], ["TENSOR", [1024], "float16"], ["TENSOR", [1024], "float16"], ["TENSOR", [1024, 256], "float16"], 0.00390625], {}], "config": {"index": 5696, "code_hash": null, "entity": [["block_row_warps", "ot", 4], ["block_col_warps", "ot", 4], ["warp_row_tiles", "ot", 4], ["warp_col_tiles", "ot", 1], ["chunk", "ot", 4], ["offset", "ot", 8], ["offsetCS", "ot", 0], ["vec", "ot", 1], ["wmma_m", "ot", 16]]}, "result": [[5.5805149999999995e-05], 0, 1.1854758262634277, 1651819777.1611407], "version": 0.2, "tvm_version": "0.8.0"}
{"input": ["cuda -keys=cuda,gpu -max_num_threads=1024 -thread_warp_size=32", "fused_layer_norm_matmul_tensorcore_gelu.cuda", [["TENSOR", [1024, 256], "float16"], ["TENSOR", [1024], "float16"], ["TENSOR", [1024], "float16"], ["TENSOR", [1024, 256], "float16"], 0.00390625], {}], "config": {"index": 6788, "code_hash": null, "entity": [["block_row_warps", "ot", 4], ["block_col_warps", "ot", 1], ["warp_row_tiles", "ot", 2], ["warp_col_tiles", "ot", 4], ["chunk", "ot", 8], ["offset", "ot", 0], ["offsetCS", "ot", 0], ["vec", "ot", 2], ["wmma_m", "ot", 16]]}, "result": [[7.892957e-05], 0, 1.43214750289917, 1651819777.9275355], "version": 0.2, "tvm_version": "0.8.0"}
{"input": ["cuda -keys=cuda,gpu -max_num_threads=1024 -thread_warp_size=32", "fused_layer_norm_matmul_tensorcore_gelu.cuda", [["TENSOR", [1024, 256], "float16"], ["TENSOR", [1024], "float16"], ["TENSOR", [1024], "float16"], ["TENSOR", [1024, 256], "float16"], 0.00390625], {}], "config": {"index": 4, "code_hash": null, "entity": [["block_row_warps", "ot", 2], ["block_col_warps", "ot", 2], ["warp_row_tiles", "ot", 1], ["warp_col_tiles", "ot", 1], ["chunk", "ot", 1], ["offset", "ot", 0], ["offsetCS", "ot", 0], ["vec", "ot", 1], ["wmma_m", "ot", 32]]}, "result": [[5.6502659999999994e-05], 0, 1.2088127136230469, 1651819778.5379412], "version": 0.2, "tvm_version": "0.8.0"}
