python/models/swin_transformer/kernel_configs/swin_transform_auto_tvm_tune_fused_layer_normalization_matmul_1_32_32_256.log
{"input": ["cuda -keys=cuda,gpu -max_num_threads=1024 -thread_warp_size=32", "fused_layer_norm_matmul_tensorcore.cuda", [["TENSOR", [256, 1024], "float16"], ["TENSOR", [256], "float16"], ["TENSOR", [256], "float16"], ["TENSOR", [512, 1024], "float16"], 0.0009765625], {}], "config": {"index": 8732, "code_hash": null, "entity": [["block_row_warps", "ot", 4], ["block_col_warps", "ot", 1], ["warp_row_tiles", "ot", 2], ["warp_col_tiles", "ot", 4], ["chunk", "ot", 8], ["offset", "ot", 0], ["offsetCS", "ot", 8], ["vec", "ot", 4], ["wmma_m", "ot", 16]]}, "result": [[0.000140985332], 0, 2.0368096828460693, 1651750232.3963153], "version": 0.2, "tvm_version": "0.8.0"}
{"input": ["cuda -keys=cuda,gpu -max_num_threads=1024 -thread_warp_size=32", "fused_layer_norm_matmul_tensorcore.cuda", [["TENSOR", [256, 1024], "float16"], ["TENSOR", [256], "float16"], ["TENSOR", [256], "float16"], ["TENSOR", [512, 1024], "float16"], 0.0009765625], {}], "config": {"index": 8807, "code_hash": null, "entity": [["block_row_warps", "ot", 4], ["block_col_warps", "ot", 2], ["warp_row_tiles", "ot", 1], ["warp_col_tiles", "ot", 4], ["chunk", "ot", 1], ["offset", "ot", 8], ["offsetCS", "ot", 8], ["vec", "ot", 4], ["wmma_m", "ot", 16]]}, "result": [[5.3810187999999996e-05], 0, 1.434098720550537, 1651750233.5635448], "version": 0.2, "tvm_version": "0.8.0"}
{"input": ["cuda -keys=cuda,gpu -max_num_threads=1024 -thread_warp_size=32", "fused_layer_norm_matmul_tensorcore.cuda", [["TENSOR", [256, 1024], "float16"], ["TENSOR", [256], "float16"], ["TENSOR", [256], "float16"], ["TENSOR", [512, 1024], "float16"], 0.0009765625], {}], "config": {"index": 12671, "code_hash": null, "entity": [["block_row_warps", "ot", 4], ["block_col_warps", "ot", 4], ["warp_row_tiles", "ot", 1], ["warp_col_tiles", "ot", 2], ["chunk", "ot", 1], ["offset", "ot", 8], ["offsetCS", "ot", 8], ["vec", "ot", 2], ["wmma_m", "ot", 8]]}, "result": [[7.0842479e-05], 0, 1.383561372756958, 1651750234.1843903], "version": 0.2, "tvm_version": "0.8.0"}
{"input": ["cuda -keys=cuda,gpu -max_num_threads=1024 -thread_warp_size=32", "fused_layer_norm_matmul_tensorcore.cuda", [["TENSOR", [256, 1024], "float16"], ["TENSOR", [256], "float16"], ["TENSOR", [256], "float16"], ["TENSOR", [512, 1024], "float16"], 0.0009765625], {}], "config": {"index": 175, "code_hash": null, "entity": [["block_row_warps", "ot", 2], ["block_col_warps", "ot", 2], ["warp_row_tiles", "ot", 2], ["warp_col_tiles", "ot", 1], ["chunk", "ot", 4], ["offset", "ot", 0], ["offsetCS", "ot", 0], ["vec", "ot", 1], ["wmma_m", "ot", 32]]}, "result": [[0.000261816422], 0, 1.932633638381958, 1651750235.999103], "version": 0.2, "tvm_version": "0.8.0"}
{"input": ["cuda -keys=cuda,gpu -max_num_threads=1024 -thread_warp_size=32", "fused_layer_norm_matmul_tensorcore.cuda", [["TENSOR", [256, 1024], "float16"], ["TENSOR", [256], "float16"], ["TENSOR", [256], "float16"], ["TENSOR", [512, 1024], "float16"], 0.0009765625], {}], "config": {"index": 10187, "code_hash": null, "entity": [["block_row_warps", "ot", 4], ["block_col_warps", "ot", 4], ["warp_row_tiles", "ot", 1], ["warp_col_tiles", "ot", 4], ["chunk", "ot", 2], ["offset", "ot", 8], ["offsetCS", "ot", 8], ["vec", "ot", 8], ["wmma_m", "ot", 16]]}, "result": [[8.049307500000002e-05], 0, 1.5388984680175781, 1651750236.6903324], "version": 0.2, "tvm_version": "0.8.0"}
{"input": ["cuda -keys=cuda,gpu -max_num_threads=1024 -thread_warp_size=32", "fused_layer_norm_matmul_tensorcore.cuda", [["TENSOR", [256, 1024], "float16"], ["TENSOR", [256], "float16"], ["TENSOR", [256], "float16"], ["TENSOR", [512, 1024], "float16"], 0.0009765625], {}], "config": {"index": 5654, "code_hash": null, "entity": [["block_row_warps", "ot", 4], ["block_col_warps", "ot", 1], ["warp_row_tiles", "ot", 2], ["warp_col_tiles", "ot", 4], ["chunk", "ot", 2], ["offset", "ot", 8], ["offsetCS", "ot", 0], ["vec", "ot", 1], ["wmma_m", "ot", 16]]}, "result": [[0.00025167673600000003], 0, 2.1079776287078857, 1651750238.4951408], "version": 0.2, "tvm_version": "0.8.0"}
{"input": ["cuda -keys=cuda,gpu -max_num_threads=1024 -thread_warp_size=32", "fused_layer_norm_matmul_tensorcore.cuda", [["TENSOR", [256, 1024], "float16"], ["TENSOR", [256], "float16"], ["TENSOR", [256], "float16"], ["TENSOR", [512, 1024], "float16"], 0.0009765625], {}], "config": {"index": 13423, "code_hash": null, "entity": [["block_row_warps", "ot", 2], ["block_col_warps", "ot", 2], ["warp_row_tiles", "ot", 1], ["warp_col_tiles", "ot", 4], ["chunk", "ot", 2], ["offset", "ot", 8], ["offsetCS", "ot", 0], ["vec", "ot", 4], ["wmma_m", "ot", 8]]}, "result": [[4.1470784000000006e-05], 0, 1.3633158206939697, 1651750239.1216962], "version": 0.2, "tvm_version": "0.8.0"}
{"input": ["cuda -keys=cuda,gpu -max_num_threads=1024 -thread_warp_size=32", "fused_layer_norm_matmul_tensorcore.cuda", [["TENSOR", [256, 1024], "float16"], ["TENSOR", [256], "float16"], ["TENSOR", [256], "float16"], ["TENSOR", [512, 1024], "float16"], 0.0009765625], {}], "config": {"index": 3540, "code_hash": null, "entity": [["block_row_warps", "ot", 1], ["block_col_warps", "ot", 2], ["warp_row_tiles", "ot", 1], ["warp_col_tiles", "ot", 4], ["chunk", "ot", 8], ["offset", "ot", 0], ["offsetCS", "ot", 8], ["vec", "ot", 4], ["wmma_m", "ot", 32]]}, "result": [[6.817688400000001e-05], 0, 1.5214147567749023, 1651750240.6844292], "version": 0.2, "tvm_version": "0.8.0"}
{"input": ["cuda -keys=cuda,gpu -max_num_threads=1024 -thread_warp_size=32", "fused_layer_norm_matmul_tensorcore.cuda", [["TENSOR", [256, 1024], "float16"], ["TENSOR", [256], "float16"], ["TENSOR", [256], "float16"], ["TENSOR", [512, 1024], "float16"], 0.0009765625], {}], "config": {"index": 12243, "code_hash": null, "entity": [["block_row_warps", "ot", 1], ["block_col_warps", "ot", 2], ["warp_row_tiles", "ot", 2], ["warp_col_tiles", "ot", 1], ["chunk", "ot", 8], ["offset", "ot", 8], ["offsetCS", "ot", 0], ["vec", "ot", 2], ["wmma_m", "ot", 8]]}, "result": [[4.5793319e-05], 0, 1.3819859027862549, 1651750241.8673015], "version": 0.2, "tvm_version": "0.8.0"}
{"input": ["cuda -keys=cuda,gpu -max_num_threads=1024 -thread_warp_size=32", "fused_layer_norm_matmul_tensorcore.cuda", [["TENSOR", [256, 1024], "float16"], ["TENSOR", [256], "float16"], ["TENSOR", [256], "float16"], ["TENSOR", [512, 1024], "float16"], 0.0009765625], {}], "config": {"index": 11599, "code_hash": null, "entity": [["block_row_warps", "ot", 2], ["block_col_warps", "ot", 4], ["warp_row_tiles", "ot", 2], ["warp_col_tiles", "ot", 1], ["chunk", "ot", 8], ["offset", "ot", 8], ["offsetCS", "ot", 8], ["vec", "ot", 1], ["wmma_m", "ot", 8]]}, "result": [[4.5336125e-05], 0, 1.4422597885131836, 1651750243.3190475], "version": 0.2, "tvm_version": "0.8.0"}
{"input": ["cuda -keys=cuda,gpu -max_num_threads=1024 -thread_warp_size=32", "fused_layer_norm_matmul_tensorcore.cuda", [["TENSOR", [256, 1024], "float16"], ["TENSOR", [256], "float16"], ["TENSOR", [256], "float16"], ["TENSOR", [512, 1024], "float16"], 0.0009765625], {}], "config": {"index": 6725, "code_hash": null, "entity": [["block_row_warps", "ot", 4], ["block_col_warps", "ot", 1], ["warp_row_tiles", "ot", 1], ["warp_col_tiles", "ot", 1], ["chunk", "ot", 8], ["offset", "ot", 0], ["offsetCS", "ot", 0], ["vec", "ot", 2], ["wmma_m", "ot", 16]]}, "result": [[9.9347612e-05], 0, 1.3905868530273438, 1651750244.646805], "version": 0.2, "tvm_version": "0.8.0"}
{"input": ["cuda -keys=cuda,gpu -max_num_threads=1024 -thread_warp_size=32", "fused_layer_norm_matmul_tensorcore.cuda", [["TENSOR", [256, 1024], "float16"], ["TENSOR", [256], "float16"], ["TENSOR", [256], "float16"], ["TENSOR", [512, 1024], "float16"], 0.0009765625], {}], "config": {"index": 6921, "code_hash": null, "entity": [["block_row_warps", "ot", 1], ["block_col_warps", "ot", 1], ["warp_row_tiles", "ot", 2], ["warp_col_tiles", "ot", 2], ["chunk", "ot", 2], ["offset", "ot", 8], ["offsetCS", "ot", 0], ["vec", "ot", 2], ["wmma_m", "ot", 16]]}, "result": [[0.000156089352], 0, 1.5894231796264648, 1651750246.193879], "version": 0.2, "tvm_version": "0.8.0"}
{"input": ["cuda -keys=cuda,gpu -max_num_threads=1024 -thread_warp_size=32", "fused_layer_norm_matmul_tensorcore.cuda", [["TENSOR", [256, 1024], "float16"], ["TENSOR", [256], "float16"], ["TENSOR", [256], "float16"], ["TENSOR", [512, 1024], "float16"], 0.0009765625], {}], "config": {"index": 3054, "code_hash": null, "entity": [["block_row_warps", "ot", 1], ["block_col_warps", "ot", 2], ["warp_row_tiles", "ot", 1], ["warp_col_tiles", "ot", 4], ["chunk", "ot", 2], ["offset", "ot", 8], ["offsetCS", "ot", 0], ["vec", "ot", 4], ["wmma_m", "ot", 32]]}, "result": [[8.2531655e-05], 0, 1.432783603668213, 1651750248.768319], "version": 0.2, "tvm_version": "0.8.0"}
{"input": ["cuda -keys=cuda,gpu -max_num_threads=1024 -thread_warp_size=32", "fused_layer_norm_matmul_tensorcore.cuda", [["TENSOR", [256, 1024], "float16"], ["TENSOR", [256], "float16"], ["TENSOR", [256], "float16"], ["TENSOR", [512, 1024], "float16"], 0.0009765625], {}], "config": {"index": 3730, "code_hash": null, "entity": [["block_row_warps", "ot", 2], ["block_col_warps", "ot", 2], ["warp_row_tiles", "ot", 1], ["warp_col_tiles", "ot", 1], ["chunk", "ot", 4], ["offset", "ot", 8], ["offsetCS", "ot", 8], ["vec", "ot", 4], ["wmma_m", "ot", 32]]}, "result": [[6.299149400000001e-05], 0, 1.2378218173980713, 1651750249.3749852], "version": 0.2, "tvm_version": "0.8.0"}
{"input": ["cuda -keys=cuda,gpu -max_num_threads=1024 -thread_warp_size=32", "fused_layer_norm_matmul_tensorcore.cuda", [["TENSOR", [256, 1024], "float16"], ["TENSOR", [256], "float16"], ["TENSOR", [256], "float16"], ["TENSOR", [512, 1024], "float16"], 0.0009765625], {}], "config": {"index": 596, "code_hash": null, "entity": [["block_row_warps", "ot", 4], ["block_col_warps", "ot", 1], ["warp_row_tiles", "ot", 1], ["warp_col_tiles", "ot", 2], ["chunk", "ot", 8], ["offset", "ot", 8], ["offsetCS", "ot", 0], ["vec", "ot", 1], ["wmma_m", "ot", 32]]}, "result": [[0.000234665331], 0, 1.8084986209869385, 1651750251.1089368], "version": 0.2, "tvm_version": "0.8.0"}
{"input": ["cuda -keys=cuda,gpu -max_num_threads=1024 -thread_warp_size=32", "fused_layer_norm_matmul_tensorcore.cuda", [["TENSOR", [256, 1024], "float16"], ["TENSOR", [256], "float16"], ["TENSOR", [256], "float16"], ["TENSOR", [512, 1024], "float16"], 0.0009765625], {}], "config": {"index": 6754, "code_hash": null, "entity": [["block_row_warps", "ot", 2], ["block_col_warps", "ot", 2], ["warp_row_tiles", "ot", 1], ["warp_col_tiles", "ot", 2], ["chunk", "ot", 8], ["offset", "ot", 0], ["offsetCS", "ot", 0], ["vec", "ot", 2], ["wmma_m", "ot", 16]]}, "result": [[5.9221003e-05], 0, 1.6676788330078125, 1651750252.020302], "version": 0.2, "tvm_version": "0.8.0"}
{"input": ["cuda -keys=cuda,gpu -max_num_threads=1024 -thread_warp_size=32", "fused_layer_norm_matmul_tensorcore.cuda", [["TENSOR", [256, 1024], "float16"], ["TENSOR", [256], "float16"], ["TENSOR", [256], "float16"], ["TENSOR", [512, 1024], "float16"], 0.0009765625], {}], "config": {"index": 2921, "code_hash": null, "entity": [["block_row_warps", "ot", 4], ["block_col_warps", "ot", 2], ["warp_row_tiles", "ot", 1], ["warp_col_tiles", "ot", 1], ["chunk", "ot", 1], ["offset", "ot", 8], ["offsetCS", "ot", 0], ["vec", "ot", 4], ["wmma_m", "ot", 32]]}, "result": [[7.874707899999999e-05], 0, 1.3126308917999268, 1651750253.27201], "version": 0.2, "tvm_version": "0.8.0"}
{"input": ["cuda -keys=cuda,gpu -max_num_threads=1024 -thread_warp_size=32", "fused_layer_norm_matmul_tensorcore.cuda", [["TENSOR", [256, 1024], "float16"], ["TENSOR", [256], "float16"], ["TENSOR", [256], "float16"], ["TENSOR", [512, 1024], "float16"], 0.0009765625], {}], "config": {"index": 12980, "code_hash": null, "entity": [["block_row_warps", "ot", 4], ["block_col_warps", "ot", 1], ["warp_row_tiles", "ot", 4], ["warp_col_tiles", "ot", 1], ["chunk", "ot", 1], ["offset", "ot", 0], ["offsetCS", "ot", 0], ["vec", "ot", 4], ["wmma_m", "ot", 8]]}, "result": [[0.00012938119300000001], 0, 1.5069169998168945, 1651750254.0814183], "version": 0.2, "tvm_version": "0.8.0"}
{"input": ["cuda -keys=cuda,gpu -max_num_threads=1024 -thread_warp_size=32", "fused_layer_norm_matmul_tensorcore.cuda", [["TENSOR", [256, 1024], "float16"], ["TENSOR", [256], "float16"], ["TENSOR", [256], "float16"], ["TENSOR", [512, 1024], "float16"], 0.0009765625], {}], "config": {"index": 8056, "code_hash": null, "entity": [["block_row_warps", "ot", 2], ["block_col_warps", "ot", 1], ["warp_row_tiles", "ot", 2], ["warp_col_tiles", "ot", 2], ["chunk", "ot", 8], ["offset", "ot", 0], ["offsetCS", "ot", 0], ["vec", "ot", 4], ["wmma_m", "ot", 16]]}, "result": [[0.000115581853], 0, 1.4652299880981445, 1651750255.7483315], "version": 0.2, "tvm_version": "0.8.0"}
{"input": ["cuda -keys=cuda,gpu -max_num_threads=1024 -thread_warp_size=32", "fused_layer_norm_matmul_tensorcore.cuda", [["TENSOR", [256, 1024], "float16"], ["TENSOR", [256], "float16"], ["TENSOR", [256], "float16"], ["TENSOR", [512, 1024], "float16"], 0.0009765625], {}], "config": {"index": 7155, "code_hash": null, "entity": [["block_row_warps", "ot", 1], ["block_col_warps", "ot", 1], ["warp_row_tiles", "ot", 1], ["warp_col_tiles", "ot", 2], ["chunk", "ot", 1], ["offset", "ot", 0], ["offsetCS", "ot", 8], ["vec", "ot", 2], ["wmma_m", "ot", 16]]}, "result": [[9.242298700000002e-05], 0, 1.3270208835601807, 1651750256.432543], "version": 0.2, "tvm_version": "0.8.0"}
{"input": ["cuda -keys=cuda,gpu -max_num_threads=1024 -thread_warp_size=32", "fused_layer_norm_matmul_tensorcore.cuda", [["TENSOR", [256, 1024], "float16"], ["TENSOR", [256], "float16"], ["TENSOR", [256], "float16"], ["TENSOR", [512, 1024], "float16"], 0.0009765625], {}], "config": {"index": 8299, "code_hash": null, "entity": [["block_row_warps", "ot", 2], ["block_col_warps", "ot", 1], ["warp_row_tiles", "ot", 2], ["warp_col_tiles", "ot", 2], ["chunk", "ot", 4], ["offset", "ot", 8], ["offsetCS", "ot", 0], ["vec", "ot", 4], ["wmma_m", "ot", 16]]}, "result": [[0.00011189951], 0, 1.4338769912719727, 1651750258.0205097], "version": 0.2, "tvm_version": "0.8.0"}
{"input": ["cuda -keys=cuda,gpu -max_num_threads=1024 -thread_warp_size=32", "fused_layer_norm_matmul_tensorcore.cuda", [["TENSOR", [256, 1024], "float16"], ["TENSOR", [256], "float16"], ["TENSOR", [256], "float16"], ["TENSOR", [512, 1024], "float16"], 0.0009765625], {}], "config": {"index": 13303, "code_hash": null, "entity": [["block_row_warps", "ot", 2], ["block_col_warps", "ot", 1], ["warp_row_tiles", "ot", 4], ["warp_col_tiles", "ot", 1], ["chunk", "ot", 1], ["offset", "ot", 8], ["offsetCS", "ot", 0], ["vec", "ot", 4], ["wmma_m", "ot", 8]]}, "result": [[0.000123571954], 0, 1.44398832321167, 1651750258.8503857], "version": 0.2, "tvm_version": "0.8.0"}
{"input": ["cuda -keys=cuda,gpu -max_num_threads=1024 -thread_warp_size=32", "fused_layer_norm_matmul_tensorcore.cuda", [["TENSOR", [256, 1024], "float16"], ["TENSOR", [256], "float16"], ["TENSOR", [256], "float16"], ["TENSOR", [512, 1024], "float16"], 0.0009765625], {}], "config": {"index": 6175, "code_hash": null, "entity": [["block_row_warps", "ot", 2], ["block_col_warps", "ot", 1], ["warp_row_tiles", "ot", 4], ["warp_col_tiles", "ot", 1], ["chunk", "ot", 1], ["offset", "ot", 8], ["offsetCS", "ot", 8], ["vec", "ot", 1], ["wmma_m", "ot", 16]]}, "result": [[0.00047916575299999996], 0, 2.492649793624878, 1651750261.385037], "version": 0.2, "tvm_version": "0.8.0"}
{"input": ["cuda -keys=cuda,gpu -max_num_threads=1024 -thread_warp_size=32", "fused_layer_norm_matmul_tensorcore.cuda", [["TENSOR", [256, 1024], "float16"], ["TENSOR", [256], "float16"], ["TENSOR", [256], "float16"], ["TENSOR", [512, 1024], "float16"], 0.0009765625], {}], "config": {"index": 8951, "code_hash": null, "entity": [["block_row_warps", "ot", 4], ["block_col_warps", "ot", 2], ["warp_row_tiles", "ot", 2], ["warp_col_tiles", "ot", 2], ["chunk", "ot", 4], ["offset", "ot", 8], ["offsetCS", "ot", 8], ["vec", "ot", 4], ["wmma_m", "ot", 16]]}, "result": [[6.784095199999999e-05], 0, 1.1893885135650635, 1651750262.6456363], "version": 0.2, "tvm_version": "0.8.0"}
{"input": ["cuda -keys=cuda,gpu -max_num_threads=1024 -thread_warp_size=32", "fused_layer_norm_matmul_tensorcore.cuda", [["TENSOR", [256, 1024], "float16"], ["TENSOR", [256], "float16"], ["TENSOR", [256], "float16"], ["TENSOR", [512, 1024], "float16"], 0.0009765625], {}], "config": {"index": 5656, "code_hash": null, "entity": [["block_row_warps", "ot", 2], ["block_col_warps", "ot", 2], ["warp_row_tiles", "ot", 2], ["warp_col_tiles", "ot", 4], ["chunk", "ot", 2], ["offset", "ot", 8], ["offsetCS", "ot", 0], ["vec", "ot", 1], ["wmma_m", "ot", 16]]}, "result": [[0.000145004036], 0, 1.760373830795288, 1651750263.7356043], "version": 0.2, "tvm_version": "0.8.0"}
{"input": ["cuda -keys=cuda,gpu -max_num_threads=1024 -thread_warp_size=32", "fused_layer_norm_matmul_tensorcore.cuda", [["TENSOR", [256, 1024], "float16"], ["TENSOR", [256], "float16"], ["TENSOR", [256], "float16"], ["TENSOR", [512, 1024], "float16"], 0.0009765625], {}], "config": {"index": 1549, "code_hash": null, "entity": [["block_row_warps", "ot", 2], ["block_col_warps", "ot", 1], ["warp_row_tiles", "ot", 2], ["warp_col_tiles", "ot", 1], ["chunk", "ot", 8], ["offset", "ot", 0], ["offsetCS", "ot", 0], ["vec", "ot", 2], ["wmma_m", "ot", 32]]}, "result": [[0.000309662108], 0, 1.9403648376464844, 1651750265.7093925], "version": 0.2, "tvm_version": "0.8.0"}
{"input": ["cuda -keys=cuda,gpu -max_num_threads=1024 -thread_warp_size=32", "fused_layer_norm_matmul_tensorcore.cuda", [["TENSOR", [256, 1024], "float16"], ["TENSOR", [256], "float16"], ["TENSOR", [256], "float16"], ["TENSOR", [512, 1024], "float16"], 0.0009765625], {}], "config": {"index": 11416, "code_hash": null, "entity": [["block_row_warps", "ot", 2], ["block_col_warps", "ot", 2], ["warp_row_tiles", "ot", 4], ["warp_col_tiles", "ot", 4], ["chunk", "ot", 1], ["offset", "ot", 8], ["offsetCS", "ot", 8], ["vec", "ot", 1], ["wmma_m", "ot", 8]]}, "result": [[0.000162616265], 0, 1.423546552658081, 1651750267.2871156], "version": 0.2, "tvm_version": "0.8.0"}
{"input": ["cuda -keys=cuda,gpu -max_num_threads=1024 -thread_warp_size=32", "fused_layer_norm_matmul_tensorcore.cuda", [["TENSOR", [256, 1024], "float16"], ["TENSOR", [256], "float16"], ["TENSOR", [256], "float16"], ["TENSOR", [512, 1024], "float16"], 0.0009765625], {}], "config": {"index": 8440, "code_hash": null, "entity": [["block_row_warps", "ot", 2], ["block_col_warps", "ot", 4], ["warp_row_tiles", "ot", 2], ["warp_col_tiles", "ot", 1], ["chunk", "ot", 1], ["offset", "ot", 0], ["offsetCS", "ot", 8], ["vec", "ot", 4], ["wmma_m", "ot", 16]]}, "result": [[5.1792291e-05], 0, 1.0240757465362549, 1651750267.8894794], "version": 0.2, "tvm_version": "0.8.0"}
{"input": ["cuda -keys=cuda,gpu -max_num_threads=1024 -thread_warp_size=32", "fused_layer_norm_matmul_tensorcore.cuda", [["TENSOR", [256, 1024], "float16"], ["TENSOR", [256], "float16"], ["TENSOR", [256], "float16"], ["TENSOR", [512, 1024], "float16"], 0.0009765625], {}], "config": {"index": 15285, "code_hash": null, "entity": [["block_row_warps", "ot", 1], ["block_col_warps", "ot", 2], ["warp_row_tiles", "ot", 1], ["warp_col_tiles", "ot", 4], ["chunk", "ot", 1], ["offset", "ot", 8], ["offsetCS", "ot", 8], ["vec", "ot", 8], ["wmma_m", "ot", 8]]}, "result": [[0.000125392844], 0, 1.2093279361724854, 1651750268.68238], "version": 0.2, "tvm_version": "0.8.0"}
{"input": ["cuda -keys=cuda,gpu -max_num_threads=1024 -thread_warp_size=32", "fused_layer_norm_matmul_tensorcore.cuda", [["TENSOR", [256, 1024], "float16"], ["TENSOR", [256], "float16"], ["TENSOR", [256], "float16"], ["TENSOR", [512, 1024], "float16"], 0.0009765625], {}], "config": {"index": 8358, "code_hash": null, "entity": [["block_row_warps", "ot", 1], ["block_col_warps", "ot", 4], ["warp_row_tiles", "ot", 2], ["warp_col_tiles", "ot", 1], ["chunk", "ot", 8], ["offset", "ot", 8], ["offsetCS", "ot", 0], ["vec", "ot", 4], ["wmma_m", "ot", 16]]}, "result": [[6.0257402e-05], 0, 1.0821266174316406, 1651750271.5837696], "version": 0.2, "tvm_version": "0.8.0"}
{"input": ["cuda -keys=cuda,gpu -max_num_threads=1024 -thread_warp_size=32", "fused_layer_norm_matmul_tensorcore.cuda", [["TENSOR", [256, 1024], "float16"], ["TENSOR", [256], "float16"], ["TENSOR", [256], "float16"], ["TENSOR", [512, 1024], "float16"], 0.0009765625], {}], "config": {"index": 7907, "code_hash": null, "entity": [["block_row_warps", "ot", 4], ["block_col_warps", "ot", 2], ["warp_row_tiles", "ot", 4], ["warp_col_tiles", "ot", 2], ["chunk", "ot", 2], ["offset", "ot", 0], ["offsetCS", "ot", 0], ["vec", "ot", 4], ["wmma_m", "ot", 16]]}, "result": [[0.000155899592], 0, 1.5827195644378662, 1651750273.7471461], "version": 0.2, "tvm_version": "0.8.0"}
{"input": ["cuda -keys=cuda,gpu -max_num_threads=1024 -thread_warp_size=32", "fused_layer_norm_matmul_tensorcore.cuda", [["TENSOR", [256, 1024], "float16"], ["TENSOR", [256], "float16"], ["TENSOR", [256], "float16"], ["TENSOR", [512, 1024], "float16"], 0.0009765625], {}], "config": {"index": 13834, "code_hash": null, "entity": [["block_row_warps", "ot", 2], ["block_col_warps", "ot", 1], ["warp_row_tiles", "ot", 2], ["warp_col_tiles", "ot", 4], ["chunk", "ot", 4], ["offset", "ot", 0], ["offsetCS", "ot", 8], ["vec", "ot", 4], ["wmma_m", "ot", 8]]}, "result": [[8.9497683e-05], 0, 1.452704906463623, 1651750275.104404], "version": 0.2, "tvm_version": "0.8.0"}
{"input": ["cuda -keys=cuda,gpu -max_num_threads=1024 -thread_warp_size=32", "fused_layer_norm_matmul_tensorcore.cuda", [["TENSOR", [256, 1024], "float16"], ["TENSOR", [256], "float16"], ["TENSOR", [256], "float16"], ["TENSOR", [512, 1024], "float16"], 0.0009765625], {}], "config": {"index": 10516, "code_hash": null, "entity": [["block_row_warps", "ot", 2], ["block_col_warps", "ot", 2], ["warp_row_tiles", "ot", 2], ["warp_col_tiles", "ot", 4], ["chunk", "ot", 2], ["offset", "ot", 0], ["offsetCS", "ot", 0], ["vec", "ot", 1], ["wmma_m", "ot", 8]]}, "result": [[0.000141947863], 0, 1.5594966411590576, 1651750276.5938675], "version": 0.2, "tvm_version": "0.8.0"}
{"input": ["cuda -keys=cuda,gpu -max_num_threads=1024 -thread_warp_size=32", "fused_layer_norm_matmul_tensorcore.cuda", [["TENSOR", [256, 1024], "float16"], ["TENSOR", [256], "float16"], ["TENSOR", [256], "float16"], ["TENSOR", [512, 1024], "float16"], 0.0009765625], {}], "config": {"index": 5212, "code_hash": null, "entity": [["block_row_warps", "ot", 2], ["block_col_warps", "ot", 1], ["warp_row_tiles", "ot", 1], ["warp_col_tiles", "ot", 2], ["chunk", "ot", 1], ["offset", "ot", 0], ["offsetCS", "ot", 0], ["vec", "ot", 1], ["wmma_m", "ot", 16]]}, "result": [[0.00016028774], 0, 1.5591022968292236, 1651750279.0003486], "version": 0.2, "tvm_version": "0.8.0"}
{"input": ["cuda -keys=cuda,gpu -max_num_threads=1024 -thread_warp_size=32", "fused_layer_norm_matmul_tensorcore.cuda", [["TENSOR", [256, 1024], "float16"], ["TENSOR", [256], "float16"], ["TENSOR", [256], "float16"], ["TENSOR", [512, 1024], "float16"], 0.0009765625], {}], "config": {"index": 2910, "code_hash": null, "entity": [["block_row_warps", "ot", 1], ["block_col_warps", "ot", 2], ["warp_row_tiles", "ot", 4], ["warp_col_tiles", "ot", 4], ["chunk", "ot", 8], ["offset", "ot", 0], ["offsetCS", "ot", 0], ["vec", "ot", 4], ["wmma_m", "ot", 32]]}, "result": [[0.000231656164], 0, 2.314682722091675, 1651750281.0777142], "version": 0.2, "tvm_version": "0.8.0"}
{"input": ["cuda -keys=cuda,gpu -max_num_threads=1024 -thread_warp_size=32", "fused_layer_norm_matmul_tensorcore.cuda", [["TENSOR", [256, 1024], "float16"], ["TENSOR", [256], "float16"], ["TENSOR", [256], "float16"], ["TENSOR", [512, 1024], "float16"], 0.0009765625], {}], "config": {"index": 1303, "code_hash": null, "entity": [["block_row_warps", "ot", 2], ["block_col_warps", "ot", 4], ["warp_row_tiles", "ot", 1], ["warp_col_tiles", "ot", 1], ["chunk", "ot", 1], ["offset", "ot", 0], ["offsetCS", "ot", 0], ["vec", "ot", 2], ["wmma_m", "ot", 32]]}, "result": [[5.779909e-05], 0, 1.1948697566986084, 1651750281.715858], "version": 0.2, "tvm_version": "0.8.0"}
{"input": ["cuda -keys=cuda,gpu -max_num_threads=1024 -thread_warp_size=32", "fused_layer_norm_matmul_tensorcore.cuda", [["TENSOR", [256, 1024], "float16"], ["TENSOR", [256], "float16"], ["TENSOR", [256], "float16"], ["TENSOR", [512, 1024], "float16"], 0.0009765625], {}], "config": {"index": 3495, "code_hash": null, "entity": [["block_row_warps", "ot", 1], ["block_col_warps", "ot", 2], ["warp_row_tiles", "ot", 2], ["warp_col_tiles", "ot", 1], ["chunk", "ot", 8], ["offset", "ot", 0], ["offsetCS", "ot", 8], ["vec", "ot", 4], ["wmma_m", "ot", 32]]}, "result": [[0.000130122403], 0, 1.3938875198364258, 1651750283.150056], "version": 0.2, "tvm_version": "0.8.0"}
{"input": ["cuda -keys=cuda,gpu -max_num_threads=1024 -thread_warp_size=32", "fused_layer_norm_matmul_tensorcore.cuda", [["TENSOR", [256, 1024], "float16"], ["TENSOR", [256], "float16"], ["TENSOR", [256], "float16"], ["TENSOR", [512, 1024], "float16"], 0.0009765625], {}], "config": {"index": 14451, "code_hash": null, "entity": [["block_row_warps", "ot", 1], ["block_col_warps", "ot", 4], ["warp_row_tiles", "ot", 1], ["warp_col_tiles", "ot", 2], ["chunk", "ot", 4], ["offset", "ot", 0], ["offsetCS", "ot", 0], ["vec", "ot", 8], ["wmma_m", "ot", 8]]}, "result": [[5.9636335000000006e-05], 0, 1.065293788909912, 1651750283.7470174], "version": 0.2, "tvm_version": "0.8.0"}
{"input": ["cuda -keys=cuda,gpu -max_num_threads=1024 -thread_warp_size=32", "fused_layer_norm_matmul_tensorcore.cuda", [["TENSOR", [256, 1024], "float16"], ["TENSOR", [256], "float16"], ["TENSOR", [256], "float16"], ["TENSOR", [512, 1024], "float16"], 0.0009765625], {}], "config": {"index": 13862, "code_hash": null, "entity": [["block_row_warps", "ot", 4], ["block_col_warps", "ot", 1], ["warp_row_tiles", "ot", 2], ["warp_col_tiles", "ot", 1], ["chunk", "ot", 8], ["offset", "ot", 0], ["offsetCS", "ot", 8], ["vec", "ot", 4], ["wmma_m", "ot", 8]]}, "result": [[7.3499854e-05], 0, 1.2600691318511963, 1651750285.4542866], "version": 0.2, "tvm_version": "0.8.0"}
{"input": ["cuda -keys=cuda,gpu -max_num_threads=1024 -thread_warp_size=32", "fused_layer_norm_matmul_tensorcore.cuda", [["TENSOR", [256, 1024], "float16"], ["TENSOR", [256], "float16"], ["TENSOR", [256], "float16"], ["TENSOR", [512, 1024], "float16"], 0.0009765625], {}], "config": {"index": 5331, "code_hash": null, "entity": [["block_row_warps", "ot", 1], ["block_col_warps", "ot", 2], ["warp_row_tiles", "ot", 2], ["warp_col_tiles", "ot", 4], ["chunk", "ot", 2], ["offset", "ot", 0], ["offsetCS", "ot", 0], ["vec", "ot", 1], ["wmma_m", "ot", 16]]}, "result": [[0.00017471215699999999], 0, 1.681793451309204, 1651750287.3019304], "version": 0.2, "tvm_version": "0.8.0"}
{"input": ["cuda -keys=cuda,gpu -max_num_threads=1024 -thread_warp_size=32", "fused_layer_norm_matmul_tensorcore.cuda", [["TENSOR", [256, 1024], "float16"], ["TENSOR", [256], "float16"], ["TENSOR", [256], "float16"], ["TENSOR", [512, 1024], "float16"], 0.0009765625], {}], "config": {"index": 2127, "code_hash": null, "entity": [["block_row_warps", "ot", 1], ["block_col_warps", "ot", 2], ["warp_row_tiles", "ot", 4], ["warp_col_tiles", "ot", 1], ["chunk", "ot", 4], ["offset", "ot", 0], ["offsetCS", "ot", 8], ["vec", "ot", 2], ["wmma_m", "ot", 32]]}, "result": [[0.000312793038], 0, 1.994699239730835, 1651750289.9509237], "version": 0.2, "tvm_version": "0.8.0"}
{"input": ["cuda -keys=cuda,gpu -max_num_threads=1024 -thread_warp_size=32", "fused_layer_norm_matmul_tensorcore.cuda", [["TENSOR", [256, 1024], "float16"], ["TENSOR", [256], "float16"], ["TENSOR", [256], "float16"], ["TENSOR", [512, 1024], "float16"], 0.0009765625], {}], "config": {"index": 11694, "code_hash": null, "entity": [["block_row_warps", "ot", 1], ["block_col_warps", "ot", 2], ["warp_row_tiles", "ot", 1], ["warp_col_tiles", "ot", 2], ["chunk", "ot", 1], ["offset", "ot", 0], ["offsetCS", "ot", 0], ["vec", "ot", 2], ["wmma_m", "ot", 8]]}, "result": [[5.9025022e-05], 0, 1.3191277980804443, 1651750290.5961218], "version": 0.2, "tvm_version": "0.8.0"}
{"input": ["cuda -keys=cuda,gpu -max_num_threads=1024 -thread_warp_size=32", "fused_layer_norm_matmul_tensorcore.cuda", [["TENSOR", [256, 1024], "float16"], ["TENSOR", [256], "float16"], ["TENSOR", [256], "float16"], ["TENSOR", [512, 1024], "float16"], 0.0009765625], {}], "config": {"index": 10715, "code_hash": null, "entity": [["block_row_warps", "ot", 4], ["block_col_warps", "ot", 2], ["warp_row_tiles", "ot", 4], ["warp_col_tiles", "ot", 1], ["chunk", "ot", 1], ["offset", "ot", 8], ["offsetCS", "ot", 0], ["vec", "ot", 1], ["wmma_m", "ot", 8]]}, "result": [[0.00014527992], 0, 1.4023857116699219, 1651750292.0916448], "version": 0.2, "tvm_version": "0.8.0"}
{"input": ["cuda -keys=cuda,gpu -max_num_threads=1024 -thread_warp_size=32", "fused_layer_norm_matmul_tensorcore.cuda", [["TENSOR", [256, 1024], "float16"], ["TENSOR", [256], "float16"], ["TENSOR", [256], "float16"], ["TENSOR", [512, 1024], "float16"], 0.0009765625], {}], "config": {"index": 7870, "code_hash": null, "entity": [["block_row_warps", "ot", 2], ["block_col_warps", "ot", 2], ["warp_row_tiles", "ot", 2], ["warp_col_tiles", "ot", 1], ["chunk", "ot", 2], ["offset", "ot", 0], ["offsetCS", "ot", 0], ["vec", "ot", 4], ["wmma_m", "ot", 16]]}, "result": [[6.9654952e-05], 0, 1.178528070449829, 1651750292.7089398], "version": 0.2, "tvm_version": "0.8.0"}
{"input": ["cuda -keys=cuda,gpu -max_num_threads=1024 -thread_warp_size=32", "fused_layer_norm_matmul_tensorcore.cuda", [["TENSOR", [256, 1024], "float16"], ["TENSOR", [256], "float16"], ["TENSOR", [256], "float16"], ["TENSOR", [512, 1024], "float16"], 0.0009765625], {}], "config": {"index": 6535, "code_hash": null, "entity": [["block_row_warps", "ot", 2], ["block_col_warps", "ot", 1], ["warp_row_tiles", "ot", 1], ["warp_col_tiles", "ot", 4], ["chunk", "ot", 1], ["offset", "ot", 0], ["offsetCS", "ot", 0], ["vec", "ot", 2], ["wmma_m", "ot", 16]]}, "result": [[0.000108314593], 0, 1.3489997386932373, 1651750294.0730762], "version": 0.2, "tvm_version": "0.8.0"}
{"input": ["cuda -keys=cuda,gpu -max_num_threads=1024 -thread_warp_size=32", "fused_layer_norm_matmul_tensorcore.cuda", [["TENSOR", [256, 1024], "float16"], ["TENSOR", [256], "float16"], ["TENSOR", [256], "float16"], ["TENSOR", [512, 1024], "float16"], 0.0009765625], {}], "config": {"index": 6113, "code_hash": null, "entity": [["block_row_warps", "ot", 4], ["block_col_warps", "ot", 1], ["warp_row_tiles", "ot", 2], ["warp_col_tiles", "ot", 2], ["chunk", "ot", 8], ["offset", "ot", 0], ["offsetCS", "ot", 8], ["vec", "ot", 1], ["wmma_m", "ot", 16]]}, "result": [[0.000256938429], 0, 1.8587279319763184, 1651750295.3126714], "version": 0.2, "tvm_version": "0.8.0"}
{"input": ["cuda -keys=cuda,gpu -max_num_threads=1024 -thread_warp_size=32", "fused_layer_norm_matmul_tensorcore.cuda", [["TENSOR", [256, 1024], "float16"], ["TENSOR", [256], "float16"], ["TENSOR", [256], "float16"], ["TENSOR", [512, 1024], "float16"], 0.0009765625], {}], "config": {"index": 12161, "code_hash": null, "entity": [["block_row_warps", "ot", 4], ["block_col_warps", "ot", 1], ["warp_row_tiles", "ot", 2], ["warp_col_tiles", "ot", 1], ["chunk", "ot", 4], ["offset", "ot", 8], ["offsetCS", "ot", 0], ["vec", "ot", 2], ["wmma_m", "ot", 8]]}, "result": [[8.0289768e-05], 0, 1.2307004928588867, 1651750296.6323853], "version": 0.2, "tvm_version": "0.8.0"}
{"input": ["cuda -keys=cuda,gpu -max_num_threads=1024 -thread_warp_size=32", "fused_layer_norm_matmul_tensorcore.cuda", [["TENSOR", [256, 1024], "float16"], ["TENSOR", [256], "float16"], ["TENSOR", [256], "float16"], ["TENSOR", [512, 1024], "float16"], 0.0009765625], {}], "config": {"index": 13705, "code_hash": null, "entity": [["block_row_warps", "ot", 2], ["block_col_warps", "ot", 4], ["warp_row_tiles", "ot", 2], ["warp_col_tiles", "ot", 1], ["chunk", "ot", 2], ["offset", "ot", 0], ["offsetCS", "ot", 8], ["vec", "ot", 4], ["wmma_m", "ot", 8]]}, "result": [[4.2591008e-05], 0, 1.1566407680511475, 1651750297.2137508], "version": 0.2, "tvm_version": "0.8.0"}
{"input": ["cuda -keys=cuda,gpu -max_num_threads=1024 -thread_warp_size=32", "fused_layer_norm_matmul_tensorcore.cuda", [["TENSOR", [256, 1024], "float16"], ["TENSOR", [256], "float16"], ["TENSOR", [256], "float16"], ["TENSOR", [512, 1024], "float16"], 0.0009765625], {}], "config": {"index": 11585, "code_hash": null, "entity": [["block_row_warps", "ot", 4], ["block_col_warps", "ot", 1], ["warp_row_tiles", "ot", 1], ["warp_col_tiles", "ot", 1], ["chunk", "ot", 8], ["offset", "ot", 8], ["offsetCS", "ot", 8], ["vec", "ot", 1], ["wmma_m", "ot", 8]]}, "result": [[6.8357844e-05], 0, 1.2615704536437988, 1651750298.4745948], "version": 0.2, "tvm_version": "0.8.0"}
{"input": ["cuda -keys=cuda,gpu -max_num_threads=1024 -thread_warp_size=32", "fused_layer_norm_matmul_tensorcore.cuda", [["TENSOR", [256, 1024], "float16"], ["TENSOR", [256], "float16"], ["TENSOR", [256], "float16"], ["TENSOR", [512, 1024], "float16"], 0.0009765625], {}], "config": {"index": 7657, "code_hash": null, "entity": [["block_row_warps", "ot", 2], ["block_col_warps", "ot", 4], ["warp_row_tiles", "ot", 2], ["warp_col_tiles", "ot", 2], ["chunk", "ot", 4], ["offset", "ot", 8], ["offsetCS", "ot", 8], ["vec", "ot", 2], ["wmma_m", "ot", 16]]}, "result": [[5.3316738e-05], 0, 1.1598799228668213, 1651750299.6686797], "version": 0.2, "tvm_version": "0.8.0"}
{"input": ["cuda -keys=cuda,gpu -max_num_threads=1024 -thread_warp_size=32", "fused_layer_norm_matmul_tensorcore.cuda", [["TENSOR", [256, 1024], "float16"], ["TENSOR", [256], "float16"], ["TENSOR", [256], "float16"], ["TENSOR", [512, 1024], "float16"], 0.0009765625], {}], "config": {"index": 12969, "code_hash": null, "entity": [["block_row_warps", "ot", 1], ["block_col_warps", "ot", 1], ["warp_row_tiles", "ot", 2], ["warp_col_tiles", "ot", 1], ["chunk", "ot", 1], ["offset", "ot", 0], ["offsetCS", "ot", 0], ["vec", "ot", 4], ["wmma_m", "ot", 8]]}, "result": [[7.0692998e-05], 0, 1.2395448684692383, 1651750300.3387246], "version": 0.2, "tvm_version": "0.8.0"}
{"input": ["cuda -keys=cuda,gpu -max_num_threads=1024 -thread_warp_size=32", "fused_layer_norm_matmul_tensorcore.cuda", [["TENSOR", [256, 1024], "float16"], ["TENSOR", [256], "float16"], ["TENSOR", [256], "float16"], ["TENSOR", [512, 1024], "float16"], 0.0009765625], {}], "config": {"index": 5485, "code_hash": null, "entity": [["block_row_warps", "ot", 2], ["block_col_warps", "ot", 2], ["warp_row_tiles", "ot", 1], ["warp_col_tiles", "ot", 4], ["chunk", "ot", 8], ["offset", "ot", 0], ["offsetCS", "ot", 0], ["vec", "ot", 1], ["wmma_m", "ot", 16]]}, "result": [[0.000100483849], 0, 1.298213243484497, 1651750301.7126226], "version": 0.2, "tvm_version": "0.8.0"}
{"input": ["cuda -keys=cuda,gpu -max_num_threads=1024 -thread_warp_size=32", "fused_layer_norm_matmul_tensorcore.cuda", [["TENSOR", [256, 1024], "float16"], ["TENSOR", [256], "float16"], ["TENSOR", [256], "float16"], ["TENSOR", [512, 1024], "float16"], 0.0009765625], {}], "config": {"index": 2592, "code_hash": null, "entity": [["block_row_warps", "ot", 1], ["block_col_warps", "ot", 1], ["warp_row_tiles", "ot", 1], ["warp_col_tiles", "ot", 1], ["chunk", "ot", 1], ["offset", "ot", 0], ["offsetCS", "ot", 0], ["vec", "ot", 4], ["wmma_m", "ot", 32]]}, "result": [[0.000117919681], 0, 1.2456135749816895, 1651750302.4724638], "version": 0.2, "tvm_version": "0.8.0"}
{"input": ["cuda -keys=cuda,gpu -max_num_threads=1024 -thread_warp_size=32", "fused_layer_norm_matmul_tensorcore.cuda", [["TENSOR", [256, 1024], "float16"], ["TENSOR", [256], "float16"], ["TENSOR", [256], "float16"], ["TENSOR", [512, 1024], "float16"], 0.0009765625], {}], "config": {"index": 10473, "code_hash": null, "entity": [["block_row_warps", "ot", 1], ["block_col_warps", "ot", 4], ["warp_row_tiles", "ot", 4], ["warp_col_tiles", "ot", 1], ["chunk", "ot", 2], ["offset", "ot", 0], ["offsetCS", "ot", 0], ["vec", "ot", 1], ["wmma_m", "ot", 8]]}, "result": [[8.8538774e-05], 0, 1.3086440563201904, 1651750303.7627575], "version": 0.2, "tvm_version": "0.8.0"}
{"input": ["cuda -keys=cuda,gpu -max_num_threads=1024 -thread_warp_size=32", "fused_layer_norm_matmul_tensorcore.cuda", [["TENSOR", [256, 1024], "float16"], ["TENSOR", [256], "float16"], ["TENSOR", [256], "float16"], ["TENSOR", [512, 1024], "float16"], 0.0009765625], {}], "config": {"index": 5898, "code_hash": null, "entity": [["block_row_warps", "ot", 1], ["block_col_warps", "ot", 2], ["warp_row_tiles", "ot", 2], ["warp_col_tiles", "ot", 4], ["chunk", "ot", 1], ["offset", "ot", 0], ["offsetCS", "ot", 8], ["vec", "ot", 1], ["wmma_m", "ot", 16]]}, "result": [[0.00018307432499999998], 0, 1.536473274230957, 1651750304.7356458], "version": 0.2, "tvm_version": "0.8.0"}
{"input": ["cuda -keys=cuda,gpu -max_num_threads=1024 -thread_warp_size=32", "fused_layer_norm_matmul_tensorcore.cuda", [["TENSOR", [256, 1024], "float16"], ["TENSOR", [256], "float16"], ["TENSOR", [256], "float16"], ["TENSOR", [512, 1024], "float16"], 0.0009765625], {}], "config": {"index": 1415, "code_hash": null, "entity": [["block_row_warps", "ot", 4], ["block_col_warps", "ot", 1], ["warp_row_tiles", "ot", 2], ["warp_col_tiles", "ot", 2], ["chunk", "ot", 2], ["offset", "ot", 0], ["offsetCS", "ot", 0], ["vec", "ot", 2], ["wmma_m", "ot", 32]]}, "result": [[0.00031318270000000003], 0, 2.1378064155578613, 1651750347.0261889], "version": 0.2, "tvm_version": "0.8.0"}
{"input": ["cuda -keys=cuda,gpu -max_num_threads=1024 -thread_warp_size=32", "fused_layer_norm_matmul_tensorcore.cuda", [["TENSOR", [256, 1024], "float16"], ["TENSOR", [256], "float16"], ["TENSOR", [256], "float16"], ["TENSOR", [512, 1024], "float16"], 0.0009765625], {}], "config": {"index": 1739, "code_hash": null, "entity": [["block_row_warps", "ot", 4], ["block_col_warps", "ot", 1], ["warp_row_tiles", "ot", 2], ["warp_col_tiles", "ot", 2], ["chunk", "ot", 2], ["offset", "ot", 8], ["offsetCS", "ot", 0], ["vec", "ot", 2], ["wmma_m", "ot", 32]]}, "result": [[0.000300506324], 0, 1.9634122848510742, 1651750348.3705032], "version": 0.2, "tvm_version": "0.8.0"}
{"input": ["cuda -keys=cuda,gpu -max_num_threads=1024 -thread_warp_size=32", "fused_layer_norm_matmul_tensorcore.cuda", [["TENSOR", [256, 1024], "float16"], ["TENSOR", [256], "float16"], ["TENSOR", [256], "float16"], ["TENSOR", [512, 1024], "float16"], 0.0009765625], {}], "config": {"index": 2738, "code_hash": null, "entity": [["block_row_warps", "ot", 4], ["block_col_warps", "ot", 1], ["warp_row_tiles", "ot", 2], ["warp_col_tiles", "ot", 4], ["chunk", "ot", 2], ["offset", "ot", 0], ["offsetCS", "ot", 0], ["vec", "ot", 4], ["wmma_m", "ot", 32]]}, "result": [[0.000237140129], 0, 2.082868814468384, 1651750349.7569902], "version": 0.2, "tvm_version": "0.8.0"}
{"input": ["cuda -keys=cuda,gpu -max_num_threads=1024 -thread_warp_size=32", "fused_layer_norm_matmul_tensorcore.cuda", [["TENSOR", [256, 1024], "float16"], ["TENSOR", [256], "float16"], ["TENSOR", [256], "float16"], ["TENSOR", [512, 1024], "float16"], 0.0009765625], {}], "config": {"index": 2090, "code_hash": null, "entity": [["block_row_warps", "ot", 4], ["block_col_warps", "ot", 1], ["warp_row_tiles", "ot", 2], ["warp_col_tiles", "ot", 4], ["chunk", "ot", 2], ["offset", "ot", 0], ["offsetCS", "ot", 8], ["vec", "ot", 2], ["wmma_m", "ot", 32]]}, "result": [[0.000318174136], 0, 2.018148899078369, 1651750351.1692321], "version": 0.2, "tvm_version": "0.8.0"}
{"input": ["cuda -keys=cuda,gpu -max_num_threads=1024 -thread_warp_size=32", "fused_layer_norm_matmul_tensorcore.cuda", [["TENSOR", [256, 1024], "float16"], ["TENSOR", [256], "float16"], ["TENSOR", [256], "float16"], ["TENSOR", [512, 1024], "float16"], 0.0009765625], {}], "config": {"index": 2695, "code_hash": null, "entity": [["block_row_warps", "ot", 2], ["block_col_warps", "ot", 2], ["warp_row_tiles", "ot", 4], ["warp_col_tiles", "ot", 1], ["chunk", "ot", 2], ["offset", "ot", 0], ["offsetCS", "ot", 0], ["vec", "ot", 4], ["wmma_m", "ot", 32]]}, "result": [[0.000240778852], 0, 1.6283330917358398, 1651750352.341333], "version": 0.2, "tvm_version": "0.8.0"}
{"input": ["cuda -keys=cuda,gpu -max_num_threads=1024 -thread_warp_size=32", "fused_layer_norm_matmul_tensorcore.cuda", [["TENSOR", [256, 1024], "float16"], ["TENSOR", [256], "float16"], ["TENSOR", [256], "float16"], ["TENSOR", [512, 1024], "float16"], 0.0009765625], {}], "config": {"index": 3343, "code_hash": null, "entity": [["block_row_warps", "ot", 2], ["block_col_warps", "ot", 2], ["warp_row_tiles", "ot", 4], ["warp_col_tiles", "ot", 1], ["chunk", "ot", 2], ["offset", "ot", 0], ["offsetCS", "ot", 8], ["vec", "ot", 4], ["wmma_m", "ot", 32]]}, "result": [[0.000242009053], 0, 1.725581169128418, 1651750353.5540586], "version": 0.2, "tvm_version": "0.8.0"}
{"input": ["cuda -keys=cuda,gpu -max_num_threads=1024 -thread_warp_size=32", "fused_layer_norm_matmul_tensorcore.cuda", [["TENSOR", [256, 1024], "float16"], ["TENSOR", [256], "float16"], ["TENSOR", [256], "float16"], ["TENSOR", [512, 1024], "float16"], 0.0009765625], {}], "config": {"index": 3070, "code_hash": null, "entity": [["block_row_warps", "ot", 2], ["block_col_warps", "ot", 1], ["warp_row_tiles", "ot", 4], ["warp_col_tiles", "ot", 4], ["chunk", "ot", 2], ["offset", "ot", 8], ["offsetCS", "ot", 0], ["vec", "ot", 4], ["wmma_m", "ot", 32]]}, "result": [[0.000429271262], 0, 2.583733320236206, 1651750355.328519], "version": 0.2, "tvm_version": "0.8.0"}
{"input": ["cuda -keys=cuda,gpu -max_num_threads=1024 -thread_warp_size=32", "fused_layer_norm_matmul_tensorcore.cuda", [["TENSOR", [256, 1024], "float16"], ["TENSOR", [256], "float16"], ["TENSOR", [256], "float16"], ["TENSOR", [512, 1024], "float16"], 0.0009765625], {}], "config": {"index": 2387, "code_hash": null, "entity": [["block_row_warps", "ot", 4], ["block_col_warps", "ot", 1], ["warp_row_tiles", "ot", 2], ["warp_col_tiles", "ot", 2], ["chunk", "ot", 2], ["offset", "ot", 8], ["offsetCS", "ot", 8], ["vec", "ot", 2], ["wmma_m", "ot", 32]]}, "result": [[0.000301174502], 0, 1.8252339363098145, 1651750356.7027934], "version": 0.2, "tvm_version": "0.8.0"}
{"input": ["cuda -keys=cuda,gpu -max_num_threads=1024 -thread_warp_size=32", "fused_layer_norm_matmul_tensorcore.cuda", [["TENSOR", [256, 1024], "float16"], ["TENSOR", [256], "float16"], ["TENSOR", [256], "float16"], ["TENSOR", [512, 1024], "float16"], 0.0009765625], {}], "config": {"index": 1442, "code_hash": null, "entity": [["block_row_warps", "ot", 4], ["block_col_warps", "ot", 1], ["warp_row_tiles", "ot", 2], ["warp_col_tiles", "ot", 4], ["chunk", "ot", 2], ["offset", "ot", 0], ["offsetCS", "ot", 0], ["vec", "ot", 2], ["wmma_m", "ot", 32]]}, "result": [[0.00031787246399999996], 0, 1.91774582862854, 1651750358.1543393], "version": 0.2, "tvm_version": "0.8.0"}
{"input": ["cuda -keys=cuda,gpu -max_num_threads=1024 -thread_warp_size=32", "fused_layer_norm_matmul_tensorcore.cuda", [["TENSOR", [256, 1024], "float16"], ["TENSOR", [256], "float16"], ["TENSOR", [256], "float16"], ["TENSOR", [512, 1024], "float16"], 0.0009765625], {}], "config": {"index": 2711, "code_hash": null, "entity": [["block_row_warps", "ot", 4], ["block_col_warps", "ot", 1], ["warp_row_tiles", "ot", 2], ["warp_col_tiles", "ot", 2], ["chunk", "ot", 2], ["offset", "ot", 0], ["offsetCS", "ot", 0], ["vec", "ot", 4], ["wmma_m", "ot", 32]]}, "result": [[0.000229794526], 0, 1.585822582244873, 1651750359.2929704], "version": 0.2, "tvm_version": "0.8.0"}
{"input": ["cuda -keys=cuda,gpu -max_num_threads=1024 -thread_warp_size=32", "fused_layer_norm_matmul_tensorcore.cuda", [["TENSOR", [256, 1024], "float16"], ["TENSOR", [256], "float16"], ["TENSOR", [256], "float16"], ["TENSOR", [512, 1024], "float16"], 0.0009765625], {}], "config": {"index": 2414, "code_hash": null, "entity": [["block_row_warps", "ot", 4], ["block_col_warps", "ot", 1], ["warp_row_tiles", "ot", 2], ["warp_col_tiles", "ot", 4], ["chunk", "ot", 2], ["offset", "ot", 8], ["offsetCS", "ot", 8], ["vec", "ot", 2], ["wmma_m", "ot", 32]]}, "result": [[0.00030474984300000004], 0, 2.0153393745422363, 1651750360.6624863], "version": 0.2, "tvm_version": "0.8.0"}
{"input": ["cuda -keys=cuda,gpu -max_num_threads=1024 -thread_warp_size=32", "fused_layer_norm_matmul_tensorcore.cuda", [["TENSOR", [256, 1024], "float16"], ["TENSOR", [256], "float16"], ["TENSOR", [256], "float16"], ["TENSOR", [512, 1024], "float16"], 0.0009765625], {}], "config": {"index": 3718, "code_hash": null, "entity": [["block_row_warps", "ot", 2], ["block_col_warps", "ot", 1], ["warp_row_tiles", "ot", 4], ["warp_col_tiles", "ot", 4], ["chunk", "ot", 2], ["offset", "ot", 8], ["offsetCS", "ot", 8], ["vec", "ot", 4], ["wmma_m", "ot", 32]]}, "result": [[0.00042836649999999997], 0, 2.488518476486206, 1651750362.4794364], "version": 0.2, "tvm_version": "0.8.0"}
{"input": ["cuda -keys=cuda,gpu -max_num_threads=1024 -thread_warp_size=32", "fused_layer_norm_matmul_tensorcore.cuda", [["TENSOR", [256, 1024], "float16"], ["TENSOR", [256], "float16"], ["TENSOR", [256], "float16"], ["TENSOR", [512, 1024], "float16"], 0.0009765625], {}], "config": {"index": 7553, "code_hash": null, "entity": [["block_row_warps", "ot", 4], ["block_col_warps", "ot", 1], ["warp_row_tiles", "ot", 4], ["warp_col_tiles", "ot", 1], ["chunk", "ot", 2], ["offset", "ot", 8], ["offsetCS", "ot", 8], ["vec", "ot", 2], ["wmma_m", "ot", 16]]}, "result": [[0.000300298062], 0, 2.0548462867736816, 1651750363.83469], "version": 0.2, "tvm_version": "0.8.0"}
{"input": ["cuda -keys=cuda,gpu -max_num_threads=1024 -thread_warp_size=32", "fused_layer_norm_matmul_tensorcore.cuda", [["TENSOR", [256, 1024], "float16"], ["TENSOR", [256], "float16"], ["TENSOR", [256], "float16"], ["TENSOR", [512, 1024], "float16"], 0.0009765625], {}], "config": {"index": 3043, "code_hash": null, "entity": [["block_row_warps", "ot", 2], ["block_col_warps", "ot", 1], ["warp_row_tiles", "ot", 4], ["warp_col_tiles", "ot", 2], ["chunk", "ot", 2], ["offset", "ot", 8], ["offsetCS", "ot", 0], ["vec", "ot", 4], ["wmma_m", "ot", 32]]}, "result": [[0.00041922088400000003], 0, 2.1700775623321533, 1651750365.544818], "version": 0.2, "tvm_version": "0.8.0"}
{"input": ["cuda -keys=cuda,gpu -max_num_threads=1024 -thread_warp_size=32", "fused_layer_norm_matmul_tensorcore.cuda", [["TENSOR", [256, 1024], "float16"], ["TENSOR", [256], "float16"], ["TENSOR", [256], "float16"], ["TENSOR", [512, 1024], "float16"], 0.0009765625], {}], "config": {"index": 3667, "code_hash": null, "entity": [["block_row_warps", "ot", 2], ["block_col_warps", "ot", 2], ["warp_row_tiles", "ot", 4], ["warp_col_tiles", "ot", 1], ["chunk", "ot", 2], ["offset", "ot", 8], ["offsetCS", "ot", 8], ["vec", "ot", 4], ["wmma_m", "ot", 32]]}, "result": [[0.000222721377], 0, 2.0033786296844482, 1651750366.9065442], "version": 0.2, "tvm_version": "0.8.0"}
{"input": ["cuda -keys=cuda,gpu -max_num_threads=1024 -thread_warp_size=32", "fused_layer_norm_matmul_tensorcore.cuda", [["TENSOR", [256, 1024], "float16"], ["TENSOR", [256], "float16"], ["TENSOR", [256], "float16"], ["TENSOR", [512, 1024], "float16"], 0.0009765625], {}], "config": {"index": 3367, "code_hash": null, "entity": [["block_row_warps", "ot", 2], ["block_col_warps", "ot", 1], ["warp_row_tiles", "ot", 4], ["warp_col_tiles", "ot", 2], ["chunk", "ot", 2], ["offset", "ot", 0], ["offsetCS", "ot", 8], ["vec", "ot", 4], ["wmma_m", "ot", 32]]}, "result": [[0.000423704006], 0, 2.3255388736724854, 1651750368.629481], "version": 0.2, "tvm_version": "0.8.0"}
{"input": ["cuda -keys=cuda,gpu -max_num_threads=1024 -thread_warp_size=32", "fused_layer_norm_matmul_tensorcore.cuda", [["TENSOR", [256, 1024], "float16"], ["TENSOR", [256], "float16"], ["TENSOR", [256], "float16"], ["TENSOR", [512, 1024], "float16"], 0.0009765625], {}], "config": {"index": 3386, "code_hash": null, "entity": [["block_row_warps", "ot", 4], ["block_col_warps", "ot", 1], ["warp_row_tiles", "ot", 2], ["warp_col_tiles", "ot", 4], ["chunk", "ot", 2], ["offset", "ot", 0], ["offsetCS", "ot", 8], ["vec", "ot", 4], ["wmma_m", "ot", 32]]}, "result": [[0.00023509407], 0, 1.8209128379821777, 1651750369.787006], "version": 0.2, "tvm_version": "0.8.0"}
{"input": ["cuda -keys=cuda,gpu -max_num_threads=1024 -thread_warp_size=32", "fused_layer_norm_matmul_tensorcore.cuda", [["TENSOR", [256, 1024], "float16"], ["TENSOR", [256], "float16"], ["TENSOR", [256], "float16"], ["TENSOR", [512, 1024], "float16"], 0.0009765625], {}], "config": {"index": 3073, "code_hash": null, "entity": [["block_row_warps", "ot", 2], ["block_col_warps", "ot", 2], ["warp_row_tiles", "ot", 4], ["warp_col_tiles", "ot", 4], ["chunk", "ot", 2], ["offset", "ot", 8], ["offsetCS", "ot", 0], ["vec", "ot", 4], ["wmma_m", "ot", 32]]}, "result": [[0.00023058552], 0, 2.0097076892852783, 1651750371.01163], "version": 0.2, "tvm_version": "0.8.0"}
{"input": ["cuda -keys=cuda,gpu -max_num_threads=1024 -thread_warp_size=32", "fused_layer_norm_matmul_tensorcore.cuda", [["TENSOR", [256, 1024], "float16"], ["TENSOR", [256], "float16"], ["TENSOR", [256], "float16"], ["TENSOR", [512, 1024], "float16"], 0.0009765625], {}], "config": {"index": 3046, "code_hash": null, "entity": [["block_row_warps", "ot", 2], ["block_col_warps", "ot", 2], ["warp_row_tiles", "ot", 4], ["warp_col_tiles", "ot", 2], ["chunk", "ot", 2], ["offset", "ot", 8], ["offsetCS", "ot", 0], ["vec", "ot", 4], ["wmma_m", "ot", 32]]}, "result": [[0.000224455677], 0, 1.7013554573059082, 1651750372.1407275], "version": 0.2, "tvm_version": "0.8.0"}
{"input": ["cuda -keys=cuda,gpu -max_num_threads=1024 -thread_warp_size=32", "fused_layer_norm_matmul_tensorcore.cuda", [["TENSOR", [256, 1024], "float16"], ["TENSOR", [256], "float16"], ["TENSOR", [256], "float16"], ["TENSOR", [512, 1024], "float16"], 0.0009765625], {}], "config": {"index": 3062, "code_hash": null, "entity": [["block_row_warps", "ot", 4], ["block_col_warps", "ot", 1], ["warp_row_tiles", "ot", 2], ["warp_col_tiles", "ot", 4], ["chunk", "ot", 2], ["offset", "ot", 8], ["offsetCS", "ot", 0], ["vec", "ot", 4], ["wmma_m", "ot", 32]]}, "result": [[0.00022146190899999997], 0, 1.7815732955932617, 1651750373.2538364], "version": 0.2, "tvm_version": "0.8.0"}
{"input": ["cuda -keys=cuda,gpu -max_num_threads=1024 -thread_warp_size=32", "fused_layer_norm_matmul_tensorcore.cuda", [["TENSOR", [256, 1024], "float16"], ["TENSOR", [256], "float16"], ["TENSOR", [256], "float16"], ["TENSOR", [512, 1024], "float16"], 0.0009765625], {}], "config": {"index": 2722, "code_hash": null, "entity": [["block_row_warps", "ot", 2], ["block_col_warps", "ot", 2], ["warp_row_tiles", "ot", 4], ["warp_col_tiles", "ot", 2], ["chunk", "ot", 2], ["offset", "ot", 0], ["offsetCS", "ot", 0], ["vec", "ot", 4], ["wmma_m", "ot", 32]]}, "result": [[0.00024470558399999995], 0, 1.768005609512329, 1651750374.4899833], "version": 0.2, "tvm_version": "0.8.0"}
{"input": ["cuda -keys=cuda,gpu -max_num_threads=1024 -thread_warp_size=32", "fused_layer_norm_matmul_tensorcore.cuda", [["TENSOR", [256, 1024], "float16"], ["TENSOR", [256], "float16"], ["TENSOR", [256], "float16"], ["TENSOR", [512, 1024], "float16"], 0.0009765625], {}], "config": {"index": 2746, "code_hash": null, "entity": [["block_row_warps", "ot", 2], ["block_col_warps", "ot", 1], ["warp_row_tiles", "ot", 4], ["warp_col_tiles", "ot", 4], ["chunk", "ot", 2], ["offset", "ot", 0], ["offsetCS", "ot", 0], ["vec", "ot", 4], ["wmma_m", "ot", 32]]}, "result": [[0.000433059052], 0, 2.551464319229126, 1651750376.2657328], "version": 0.2, "tvm_version": "0.8.0"}
{"input": ["cuda -keys=cuda,gpu -max_num_threads=1024 -thread_warp_size=32", "fused_layer_norm_matmul_tensorcore.cuda", [["TENSOR", [256, 1024], "float16"], ["TENSOR", [256], "float16"], ["TENSOR", [256], "float16"], ["TENSOR", [512, 1024], "float16"], 0.0009765625], {}], "config": {"index": 3710, "code_hash": null, "entity": [["block_row_warps", "ot", 4], ["block_col_warps", "ot", 1], ["warp_row_tiles", "ot", 2], ["warp_col_tiles", "ot", 4], ["chunk", "ot", 2], ["offset", "ot", 8], ["offsetCS", "ot", 8], ["vec", "ot", 4], ["wmma_m", "ot", 32]]}, "result": [[0.000221703966], 0, 1.82747220993042, 1651750377.379209], "version": 0.2, "tvm_version": "0.8.0"}
{"input": ["cuda -keys=cuda,gpu -max_num_threads=1024 -thread_warp_size=32", "fused_layer_norm_matmul_tensorcore.cuda", [["TENSOR", [256, 1024], "float16"], ["TENSOR", [256], "float16"], ["TENSOR", [256], "float16"], ["TENSOR", [512, 1024], "float16"], 0.0009765625], {}], "config": {"index": 3394, "code_hash": null, "entity": [["block_row_warps", "ot", 2], ["block_col_warps", "ot", 1], ["warp_row_tiles", "ot", 4], ["warp_col_tiles", "ot", 4], ["chunk", "ot", 2], ["offset", "ot", 0], ["offsetCS", "ot", 8], ["vec", "ot", 4], ["wmma_m", "ot", 32]]}, "result": [[0.000431596143], 0, 2.5486948490142822, 1651750379.2029994], "version": 0.2, "tvm_version": "0.8.0"}
{"input": ["cuda -keys=cuda,gpu -max_num_threads=1024 -thread_warp_size=32", "fused_layer_norm_matmul_tensorcore.cuda", [["TENSOR", [256, 1024], "float16"], ["TENSOR", [256], "float16"], ["TENSOR", [256], "float16"], ["TENSOR", [512, 1024], "float16"], 0.0009765625], {}], "config": {"index": 2719, "code_hash": null, "entity": [["block_row_warps", "ot", 2], ["block_col_warps", "ot", 1], ["warp_row_tiles", "ot", 4], ["warp_col_tiles", "ot", 2], ["chunk", "ot", 2], ["offset", "ot", 0], ["offsetCS", "ot", 0], ["vec", "ot", 4], ["wmma_m", "ot", 32]]}, "result": [[0.000427767948], 0, 2.3137166500091553, 1651750380.9340367], "version": 0.2, "tvm_version": "0.8.0"}
{"input": ["cuda -keys=cuda,gpu -max_num_threads=1024 -thread_warp_size=32", "fused_layer_norm_matmul_tensorcore.cuda", [["TENSOR", [256, 1024], "float16"], ["TENSOR", [256], "float16"], ["TENSOR", [256], "float16"], ["TENSOR", [512, 1024], "float16"], 0.0009765625], {}], "config": {"index": 3694, "code_hash": null, "entity": [["block_row_warps", "ot", 2], ["block_col_warps", "ot", 2], ["warp_row_tiles", "ot", 4], ["warp_col_tiles", "ot", 2], ["chunk", "ot", 2], ["offset", "ot", 8], ["offsetCS", "ot", 8], ["vec", "ot", 4], ["wmma_m", "ot", 32]]}, "result": [[0.000223826727], 0, 1.7931392192840576, 1651750382.0570607], "version": 0.2, "tvm_version": "0.8.0"}
{"input": ["cuda -keys=cuda,gpu -max_num_threads=1024 -thread_warp_size=32", "fused_layer_norm_matmul_tensorcore.cuda", [["TENSOR", [256, 1024], "float16"], ["TENSOR", [256], "float16"], ["TENSOR", [256], "float16"], ["TENSOR", [512, 1024], "float16"], 0.0009765625], {}], "config": {"index": 7256, "code_hash": null, "entity": [["block_row_warps", "ot", 4], ["block_col_warps", "ot", 1], ["warp_row_tiles", "ot", 4], ["warp_col_tiles", "ot", 2], ["chunk", "ot", 2], ["offset", "ot", 0], ["offsetCS", "ot", 8], ["vec", "ot", 2], ["wmma_m", "ot", 16]]}, "result": [[0.000317914021], 0, 2.137779951095581, 1651750383.4904509], "version": 0.2, "tvm_version": "0.8.0"}
{"input": ["cuda -keys=cuda,gpu -max_num_threads=1024 -thread_warp_size=32", "fused_layer_norm_matmul_tensorcore.cuda", [["TENSOR", [256, 1024], "float16"], ["TENSOR", [256], "float16"], ["TENSOR", [256], "float16"], ["TENSOR", [512, 1024], "float16"], 0.0009765625], {}], "config": {"index": 3721, "code_hash": null, "entity": [["block_row_warps", "ot", 2], ["block_col_warps", "ot", 2], ["warp_row_tiles", "ot", 4], ["warp_col_tiles", "ot", 4], ["chunk", "ot", 2], ["offset", "ot", 8], ["offsetCS", "ot", 8], ["vec", "ot", 4], ["wmma_m", "ot", 32]]}, "result": [[0.00022990197800000002], 0, 1.8837909698486328, 1651750384.6625748], "version": 0.2, "tvm_version": "0.8.0"}
{"input": ["cuda -keys=cuda,gpu -max_num_threads=1024 -thread_warp_size=32", "fused_layer_norm_matmul_tensorcore.cuda", [["TENSOR", [256, 1024], "float16"], ["TENSOR", [256], "float16"], ["TENSOR", [256], "float16"], ["TENSOR", [512, 1024], "float16"], 0.0009765625], {}], "config": {"index": 6932, "code_hash": null, "entity": [["block_row_warps", "ot", 4], ["block_col_warps", "ot", 1], ["warp_row_tiles", "ot", 4], ["warp_col_tiles", "ot", 2], ["chunk", "ot", 2], ["offset", "ot", 8], ["offsetCS", "ot", 0], ["vec", "ot", 2], ["wmma_m", "ot", 16]]}, "result": [[0.000306295194], 0, 1.934206485748291, 1651750386.0335436], "version": 0.2, "tvm_version": "0.8.0"}
{"input": ["cuda -keys=cuda,gpu -max_num_threads=1024 -thread_warp_size=32", "fused_layer_norm_matmul_tensorcore.cuda", [["TENSOR", [256, 1024], "float16"], ["TENSOR", [256], "float16"], ["TENSOR", [256], "float16"], ["TENSOR", [512, 1024], "float16"], 0.0009765625], {}], "config": {"index": 8201, "code_hash": null, "entity": [["block_row_warps", "ot", 4], ["block_col_warps", "ot", 1], ["warp_row_tiles", "ot", 4], ["warp_col_tiles", "ot", 1], ["chunk", "ot", 2], ["offset", "ot", 8], ["offsetCS", "ot", 0], ["vec", "ot", 4], ["wmma_m", "ot", 16]]}, "result": [[0.000218889028], 0, 1.772064447402954, 1651750387.1813934], "version": 0.2, "tvm_version": "0.8.0"}
{"input": ["cuda -keys=cuda,gpu -max_num_threads=1024 -thread_warp_size=32", "fused_layer_norm_matmul_tensorcore.cuda", [["TENSOR", [256, 1024], "float16"], ["TENSOR", [256], "float16"], ["TENSOR", [256], "float16"], ["TENSOR", [512, 1024], "float16"], 0.0009765625], {}], "config": {"index": 8525, "code_hash": null, "entity": [["block_row_warps", "ot", 4], ["block_col_warps", "ot", 1], ["warp_row_tiles", "ot", 4], ["warp_col_tiles", "ot", 1], ["chunk", "ot", 2], ["offset", "ot", 0], ["offsetCS", "ot", 8], ["vec", "ot", 4], ["wmma_m", "ot", 16]]}, "result": [[0.00023365856700000002], 0, 1.7619330883026123, 1651750388.3226418], "version": 0.2, "tvm_version": "0.8.0"}
{"input": ["cuda -keys=cuda,gpu -max_num_threads=1024 -thread_warp_size=32", "fused_layer_norm_matmul_tensorcore.cuda", [["TENSOR", [256, 1024], "float16"], ["TENSOR", [256], "float16"], ["TENSOR", [256], "float16"], ["TENSOR", [512, 1024], "float16"], 0.0009765625], {}], "config": {"index": 3359, "code_hash": null, "entity": [["block_row_warps", "ot", 4], ["block_col_warps", "ot", 1], ["warp_row_tiles", "ot", 2], ["warp_col_tiles", "ot", 2], ["chunk", "ot", 2], ["offset", "ot", 0], ["offsetCS", "ot", 8], ["vec", "ot", 4], ["wmma_m", "ot", 32]]}, "result": [[0.000229639978], 0, 1.7802014350891113, 1651750389.477014], "version": 0.2, "tvm_version": "0.8.0"}
{"input": ["cuda -keys=cuda,gpu -max_num_threads=1024 -thread_warp_size=32", "fused_layer_norm_matmul_tensorcore.cuda", [["TENSOR", [256, 1024], "float16"], ["TENSOR", [256], "float16"], ["TENSOR", [256], "float16"], ["TENSOR", [512, 1024], "float16"], 0.0009765625], {}], "config": {"index": 7580, "code_hash": null, "entity": [["block_row_warps", "ot", 4], ["block_col_warps", "ot", 1], ["warp_row_tiles", "ot", 4], ["warp_col_tiles", "ot", 2], ["chunk", "ot", 2], ["offset", "ot", 8], ["offsetCS", "ot", 8], ["vec", "ot", 2], ["wmma_m", "ot", 16]]}, "result": [[0.00030601137899999997], 0, 2.0812463760375977, 1651750390.9016712], "version": 0.2, "tvm_version": "0.8.0"}
{"input": ["cuda -keys=cuda,gpu -max_num_threads=1024 -thread_warp_size=32", "fused_layer_norm_matmul_tensorcore.cuda", [["TENSOR", [256, 1024], "float16"], ["TENSOR", [256], "float16"], ["TENSOR", [256], "float16"], ["TENSOR", [512, 1024], "float16"], 0.0009765625], {}], "config": {"index": 8552, "code_hash": null, "entity": [["block_row_warps", "ot", 4], ["block_col_warps", "ot", 1], ["warp_row_tiles", "ot", 4], ["warp_col_tiles", "ot", 2], ["chunk", "ot", 2], ["offset", "ot", 0], ["offsetCS", "ot", 8], ["vec", "ot", 4], ["wmma_m", "ot", 16]]}, "result": [[0.000233941092], 0, 1.8339142799377441, 1651750392.064241], "version": 0.2, "tvm_version": "0.8.0"}
{"input": ["cuda -keys=cuda,gpu -max_num_threads=1024 -thread_warp_size=32", "fused_layer_norm_matmul_tensorcore.cuda", [["TENSOR", [256, 1024], "float16"], ["TENSOR", [256], "float16"], ["TENSOR", [256], "float16"], ["TENSOR", [512, 1024], "float16"], 0.0009765625], {}], "config": {"index": 8228, "code_hash": null, "entity": [["block_row_warps", "ot", 4], ["block_col_warps", "ot", 1], ["warp_row_tiles", "ot", 4], ["warp_col_tiles", "ot", 2], ["chunk", "ot", 2], ["offset", "ot", 8], ["offsetCS", "ot", 0], ["vec", "ot", 4], ["wmma_m", "ot", 16]]}, "result": [[0.000223394427], 0, 1.7805302143096924, 1651750393.1950953], "version": 0.2, "tvm_version": "0.8.0"}
{"input": ["cuda -keys=cuda,gpu -max_num_threads=1024 -thread_warp_size=32", "fused_layer_norm_matmul_tensorcore.cuda", [["TENSOR", [256, 1024], "float16"], ["TENSOR", [256], "float16"], ["TENSOR", [256], "float16"], ["TENSOR", [512, 1024], "float16"], 0.0009765625], {}], "config": {"index": 8876, "code_hash": null, "entity": [["block_row_warps", "ot", 4], ["block_col_warps", "ot", 1], ["warp_row_tiles", "ot", 4], ["warp_col_tiles", "ot", 2], ["chunk", "ot", 2], ["offset", "ot", 8], ["offsetCS", "ot", 8], ["vec", "ot", 4], ["wmma_m", "ot", 16]]}, "result": [[0.00022246248700000002], 0, 1.8726577758789062, 1651750394.3741271], "version": 0.2, "tvm_version": "0.8.0"}
{"input": ["cuda -keys=cuda,gpu -max_num_threads=1024 -thread_warp_size=32", "fused_layer_norm_matmul_tensorcore.cuda", [["TENSOR", [256, 1024], "float16"], ["TENSOR", [256], "float16"], ["TENSOR", [256], "float16"], ["TENSOR", [512, 1024], "float16"], 0.0009765625], {}], "config": {"index": 3370, "code_hash": null, "entity": [["block_row_warps", "ot", 2], ["block_col_warps", "ot", 2], ["warp_row_tiles", "ot", 4], ["warp_col_tiles", "ot", 2], ["chunk", "ot", 2], ["offset", "ot", 0], ["offsetCS", "ot", 8], ["vec", "ot", 4], ["wmma_m", "ot", 32]]}, "result": [[0.000244772311], 0, 1.886359691619873, 1651750395.5850468], "version": 0.2, "tvm_version": "0.8.0"}
{"input": ["cuda -keys=cuda,gpu -max_num_threads=1024 -thread_warp_size=32", "fused_layer_norm_matmul_tensorcore.cuda", [["TENSOR", [256, 1024], "float16"], ["TENSOR", [256], "float16"], ["TENSOR", [256], "float16"], ["TENSOR", [512, 1024], "float16"], 0.0009765625], {}], "config": {"index": 7283, "code_hash": null, "entity": [["block_row_warps", "ot", 4], ["block_col_warps", "ot", 1], ["warp_row_tiles", "ot", 4], ["warp_col_tiles", "ot", 4], ["chunk", "ot", 2], ["offset", "ot", 0], ["offsetCS", "ot", 8], ["vec", "ot", 2], ["wmma_m", "ot", 16]]}, "result": [[0.000319734532], 0, 2.113405466079712, 1651750397.0316732], "version": 0.2, "tvm_version": "0.8.0"}
{"input": ["cuda -keys=cuda,gpu -max_num_threads=1024 -thread_warp_size=32", "fused_layer_norm_matmul_tensorcore.cuda", [["TENSOR", [256, 1024], "float16"], ["TENSOR", [256], "float16"], ["TENSOR", [256], "float16"], ["TENSOR", [512, 1024], "float16"], 0.0009765625], {}], "config": {"index": 7931, "code_hash": null, "entity": [["block_row_warps", "ot", 4], ["block_col_warps", "ot", 1], ["warp_row_tiles", "ot", 4], ["warp_col_tiles", "ot", 4], ["chunk", "ot", 2], ["offset", "ot", 0], ["offsetCS", "ot", 0], ["vec", "ot", 4], ["wmma_m", "ot", 16]]}, "result": [[0.000242198412], 0, 1.869401454925537, 1651750398.2883828], "version": 0.2, "tvm_version": "0.8.0"}
{"input": ["cuda -keys=cuda,gpu -max_num_threads=1024 -thread_warp_size=32", "fused_layer_norm_matmul_tensorcore.cuda", [["TENSOR", [256, 1024], "float16"], ["TENSOR", [256], "float16"], ["TENSOR", [256], "float16"], ["TENSOR", [512, 1024], "float16"], 0.0009765625], {}], "config": {"index": 8849, "code_hash": null, "entity": [["block_row_warps", "ot", 4], ["block_col_warps", "ot", 1], ["warp_row_tiles", "ot", 4], ["warp_col_tiles", "ot", 1], ["chunk", "ot", 2], ["offset", "ot", 8], ["offsetCS", "ot", 8], ["vec", "ot", 4], ["wmma_m", "ot", 16]]}, "result": [[0.00021885775899999998], 0, 1.77681303024292, 1651750399.3870933], "version": 0.2, "tvm_version": "0.8.0"}
