python/models/swin_transformer/kernel_configs/swin_transformer_fused_window_reverse_roll_add_1_14_14_512_3_7_float16.log
{"i": [["[\"fused_window_reverse_roll_add\", 1, 14, 14, 512, 3, 7, \"float16\"]", "cuda -keys=cuda,gpu -max_num_threads=1024 -model=unknown -thread_warp_size=32", [-1, 16, 64, 49152, 2147483647, 1024, 8, 32], "", 0, []], [[], [["FU", 2, [0, 1, 2, 3]], ["SP", 2, 0, 100352, [1], 1], ["AN", 2, 0, 5], ["AN", 2, 1, 6]]]], "r": [[7.72521e-05, 7.72529e-05, 7.72548e-05, 7.72518e-05, 7.72602e-05, 7.72494e-05, 7.72523e-05, 7.72489e-05, 7.83207e-05, 7.7393e-05], 0, 12.1088, 1651679115], "v": "v0.6"}
{"i": [["[\"fused_window_reverse_roll_add\", 1, 14, 14, 512, 3, 7, \"float16\"]", "cuda -keys=cuda,gpu -max_num_threads=1024 -model=unknown -thread_warp_size=32", [-1, 16, 64, 49152, 2147483647, 1024, 8, 32], "", 0, []], [[], [["FU", 2, [0, 1, 2, 3]], ["SP", 2, 0, 100352, [4], 1], ["AN", 2, 0, 5], ["AN", 2, 1, 6]]]], "r": [[2.14714e-05, 2.14725e-05, 2.17893e-05, 2.14874e-05, 2.15834e-05, 2.3217e-05, 2.22225e-05, 2.1473e-05, 2.15987e-05, 2.23583e-05], 0, 23.9965, 1651679127], "v": "v0.6"}
{"i": [["[\"fused_window_reverse_roll_add\", 1, 14, 14, 512, 3, 7, \"float16\"]", "cuda -keys=cuda,gpu -max_num_threads=1024 -model=unknown -thread_warp_size=32", [-1, 16, 64, 49152, 2147483647, 1024, 8, 32], "", 0, []], [[], [["FU", 2, [0, 1, 2, 3]], ["SP", 2, 0, 100352, [28], 1], ["AN", 2, 0, 5], ["AN", 2, 1, 6]]]], "r": [[5.35745e-06, 5.3572e-06, 5.35638e-06, 5.35566e-06, 5.35522e-06, 5.35719e-06, 5.35723e-06, 5.35451e-06, 5.35486e-06, 5.35406e-06], 0, 14.0256, 1651679117], "v": "v0.6"}
{"i": [["[\"fused_window_reverse_roll_add\", 1, 14, 14, 512, 3, 7, \"float16\"]", "cuda -keys=cuda,gpu -max_num_threads=1024 -model=unknown -thread_warp_size=32", [-1, 16, 64, 49152, 2147483647, 1024, 8, 32], "", 0, []], [[], [["FU", 2, [0, 1, 2, 3]], ["SP", 2, 0, 100352, [49], 1], ["AN", 2, 0, 5], ["AN", 2, 1, 6]]]], "r": [[4.57648e-06, 4.18012e-06, 4.17071e-06, 4.17163e-06, 4.17082e-06, 4.17089e-06, 4.17065e-06, 4.17057e-06, 4.17076e-06, 4.17059e-06], 0, 4.27872, 1651679107], "v": "v0.6"}
{"i": [["[\"fused_window_reverse_roll_add\", 1, 14, 14, 512, 3, 7, \"float16\"]", "cuda -keys=cuda,gpu -max_num_threads=1024 -model=unknown -thread_warp_size=32", [-1, 16, 64, 49152, 2147483647, 1024, 8, 32], "", 0, []], [[], [["FU", 2, [0, 1, 2, 3]], ["SP", 2, 0, 100352, [2], 1], ["AN", 2, 0, 5], ["AN", 2, 1, 6]]]], "r": [[4.31107e-05, 4.43418e-05, 4.20882e-05, 4.51175e-05, 4.14497e-05, 4.10564e-05, 4.22669e-05, 4.34555e-05, 6.05016e-05, 4.00981e-05], 0, 9.69678, 1651679112], "v": "v0.6"}
{"i": [["[\"fused_window_reverse_roll_add\", 1, 14, 14, 512, 3, 7, \"float16\"]", "cuda -keys=cuda,gpu -max_num_threads=1024 -model=unknown -thread_warp_size=32", [-1, 16, 64, 49152, 2147483647, 1024, 8, 32], "", 0, []], [[], [["FU", 2, [0, 1, 2, 3]], ["SP", 2, 0, 100352, [32], 1], ["AN", 2, 0, 5], ["AN", 2, 1, 6]]]], "r": [[4.99076e-06, 5.03064e-06, 4.99989e-06, 5.01121e-06, 5.55826e-06, 5.07125e-06, 4.98965e-06, 5.32743e-06, 5.01341e-06, 5.16538e-06], 0, 21.8311, 1651679125], "v": "v0.6"}
{"i": [["[\"fused_window_reverse_roll_add\", 1, 14, 14, 512, 3, 7, \"float16\"]", "cuda -keys=cuda,gpu -max_num_threads=1024 -model=unknown -thread_warp_size=32", [-1, 16, 64, 49152, 2147483647, 1024, 8, 32], "", 0, []], [[], [["FU", 2, [0, 1, 2, 3]], ["SP", 2, 0, 100352, [7], 1], ["AN", 2, 0, 5], ["AN", 2, 1, 6]]]], "r": [[1.48156e-05, 1.41737e-05, 1.58968e-05, 1.41126e-05, 1.355e-05, 1.34255e-05, 1.34251e-05, 1.34264e-05, 1.34263e-05, 1.34249e-05], 0, 6.76185, 1651679109], "v": "v0.6"}
{"i": [["[\"fused_window_reverse_roll_add\", 1, 14, 14, 512, 3, 7, \"float16\"]", "cuda -keys=cuda,gpu -max_num_threads=1024 -model=unknown -thread_warp_size=32", [-1, 16, 64, 49152, 2147483647, 1024, 8, 32], "", 0, []], [[], [["FU", 2, [0, 1, 2, 3]], ["SP", 2, 0, 100352, [14], 1], ["AN", 2, 0, 5], ["AN", 2, 1, 6]]]], "r": [[8.12522e-06, 8.12877e-06, 8.12935e-06, 8.12412e-06, 8.14559e-06, 8.13086e-06, 8.20944e-06, 8.13582e-06, 9.33617e-06, 1.3565e-05], 0, 26.5617, 1651679129], "v": "v0.6"}
{"i": [["[\"fused_window_reverse_roll_add\", 1, 14, 14, 512, 3, 7, \"float16\"]", "cuda -keys=cuda,gpu -max_num_threads=1024 -model=unknown -thread_warp_size=32", [-1, 16, 64, 49152, 2147483647, 1024, 8, 32], "", 0, []], [[], [["FU", 2, [0, 1, 2, 3]], ["SP", 2, 0, 100352, [56], 1], ["AN", 2, 0, 5], ["AN", 2, 1, 6]]]], "r": [[3.93635e-06, 3.93558e-06, 3.93607e-06, 3.936e-06, 3.93641e-06, 3.93621e-06, 3.93601e-06, 4.17996e-06, 4.13095e-06, 4.01304e-06], 0, 15.6922, 1651679118], "v": "v0.6"}
{"i": [["[\"fused_window_reverse_roll_add\", 1, 14, 14, 512, 3, 7, \"float16\"]", "cuda -keys=cuda,gpu -max_num_threads=1024 -model=unknown -thread_warp_size=32", [-1, 16, 64, 49152, 2147483647, 1024, 8, 32], "", 0, []], [[], [["FU", 2, [0, 1, 2, 3]], ["SP", 2, 0, 100352, [64], 1], ["AN", 2, 0, 5], ["AN", 2, 1, 6]]]], "r": [[4.58864e-06, 4.48261e-06, 4.52773e-06, 4.90177e-06, 4.42435e-06, 4.35612e-06, 4.30225e-06, 4.34173e-06, 4.65885e-06, 4.33747e-06], 0, 18.6866, 1651679121], "v": "v0.6"}
{"i": [["[\"fused_window_reverse_roll_add\", 1, 14, 14, 512, 3, 7, \"float16\"]", "cuda -keys=cuda,gpu -max_num_threads=1024 -model=unknown -thread_warp_size=32", [-1, 16, 64, 49152, 2147483647, 1024, 8, 32], "", 0, []], [[], [["FU", 2, [0, 1, 2, 3]], ["SP", 2, 0, 100352, [14], 1], ["AN", 2, 0, 5], ["AN", 2, 1, 6]]]], "r": [[8.62721e-06, 8.26383e-06, 1.00488e-05, 1.0831e-05, 8.06954e-06, 8.31257e-06, 8.26494e-06, 1.75604e-05, 8.07057e-06, 8.08402e-06], 0, 19.121, 1651682495], "v": "v0.6"}
{"i": [["[\"fused_window_reverse_roll_add\", 1, 14, 14, 512, 3, 7, \"float16\"]", "cuda -keys=cuda,gpu -max_num_threads=1024 -model=unknown -thread_warp_size=32", [-1, 16, 64, 49152, 2147483647, 1024, 8, 32], "", 0, []], [[], [["FU", 2, [0, 1, 2, 3]], ["SP", 2, 0, 100352, [1], 1], ["AN", 2, 0, 5], ["AN", 2, 1, 6]]]], "r": [[8.16953e-05, 8.21689e-05, 7.74735e-05, 7.82108e-05, 7.752e-05, 7.9751e-05, 8.06843e-05, 7.92921e-05, 8.69239e-05, 8.30712e-05], 0, 15.5979, 1651682491], "v": "v0.6"}
{"i": [["[\"fused_window_reverse_roll_add\", 1, 14, 14, 512, 3, 7, \"float16\"]", "cuda -keys=cuda,gpu -max_num_threads=1024 -model=unknown -thread_warp_size=32", [-1, 16, 64, 49152, 2147483647, 1024, 8, 32], "", 0, []], [[], [["FU", 2, [0, 1, 2, 3]], ["SP", 2, 0, 100352, [32], 1], ["AN", 2, 0, 5], ["AN", 2, 1, 6]]]], "r": [[4.96392e-06, 4.97799e-06, 5.2039e-06, 4.9617e-06, 4.98537e-06, 5.94717e-06, 5.11642e-06, 5.4946e-06, 5.21794e-06, 5.15613e-06], 0, 3.80091, 1651682479], "v": "v0.6"}
{"i": [["[\"fused_window_reverse_roll_add\", 1, 14, 14, 512, 3, 7, \"float16\"]", "cuda -keys=cuda,gpu -max_num_threads=1024 -model=unknown -thread_warp_size=32", [-1, 16, 64, 49152, 2147483647, 1024, 8, 32], "", 0, []], [[], [["FU", 2, [0, 1, 2, 3]], ["SP", 2, 0, 100352, [28], 1], ["AN", 2, 0, 5], ["AN", 2, 1, 6]]]], "r": [[5.50476e-06, 5.6981e-06, 5.52878e-06, 5.49993e-06, 5.6832e-06, 5.70624e-06, 6.95363e-06, 5.36702e-06, 5.66186e-06, 5.49974e-06], 0, 9.28558, 1651682485], "v": "v0.6"}
{"i": [["[\"fused_window_reverse_roll_add\", 1, 14, 14, 512, 3, 7, \"float16\"]", "cuda -keys=cuda,gpu -max_num_threads=1024 -model=unknown -thread_warp_size=32", [-1, 16, 64, 49152, 2147483647, 1024, 8, 32], "", 0, []], [[], [["FU", 2, [0, 1, 2, 3]], ["SP", 2, 0, 100352, [49], 1], ["AN", 2, 0, 5], ["AN", 2, 1, 6]]]], "r": [[9.60928e-06, 4.27208e-06, 4.94154e-06, 4.75251e-06, 4.52768e-06, 6.41168e-06, 4.27258e-06, 4.44649e-06, 4.29455e-06, 4.30317e-06], 0, 29.8474, 1651682506], "v": "v0.6"}
{"i": [["[\"fused_window_reverse_roll_add\", 1, 14, 14, 512, 3, 7, \"float16\"]", "cuda -keys=cuda,gpu -max_num_threads=1024 -model=unknown -thread_warp_size=32", [-1, 16, 64, 49152, 2147483647, 1024, 8, 32], "", 0, []], [[], [["FU", 2, [0, 1, 2, 3]], ["SP", 2, 0, 100352, [16], 1], ["AN", 2, 0, 5], ["AN", 2, 1, 6]]]], "r": [[7.68814e-06, 1.85509e-05, 7.33969e-06, 7.33943e-06, 7.35173e-06, 7.96318e-06, 7.80358e-06, 7.63129e-06, 8.11494e-06, 8.34376e-06], 0, 12.0348, 1651682488], "v": "v0.6"}
{"i": [["[\"fused_window_reverse_roll_add\", 1, 14, 14, 512, 3, 7, \"float16\"]", "cuda -keys=cuda,gpu -max_num_threads=1024 -model=unknown -thread_warp_size=32", [-1, 16, 64, 49152, 2147483647, 1024, 8, 32], "", 0, []], [[], [["FU", 2, [0, 1, 2, 3]], ["SP", 2, 0, 100352, [4], 1], ["AN", 2, 0, 5], ["AN", 2, 1, 6]]]], "r": [[2.1526e-05, 2.42487e-05, 2.57438e-05, 2.15171e-05, 2.15055e-05, 2.15376e-05, 2.14773e-05, 2.16498e-05, 2.30145e-05, 2.2411e-05], 0, 6.52307, 1651682482], "v": "v0.6"}
{"i": [["[\"fused_window_reverse_roll_add\", 1, 14, 14, 512, 3, 7, \"float16\"]", "cuda -keys=cuda,gpu -max_num_threads=1024 -model=unknown -thread_warp_size=32", [-1, 16, 64, 49152, 2147483647, 1024, 8, 32], "", 0, []], [[], [["FU", 2, [0, 1, 2, 3]], ["SP", 2, 0, 100352, [7], 1], ["AN", 2, 0, 5], ["AN", 2, 1, 6]]]], "r": [[1.39609e-05, 1.34748e-05, 1.35183e-05, 1.35708e-05, 1.35052e-05, 1.52677e-05, 1.51008e-05, 1.47042e-05, 1.93192e-05, 1.3473e-05], 0, 22.1464, 1651682498], "v": "v0.6"}
{"i": [["[\"fused_window_reverse_roll_add\", 1, 14, 14, 512, 3, 7, \"float16\"]", "cuda -keys=cuda,gpu -max_num_threads=1024 -model=unknown -thread_warp_size=32", [-1, 16, 64, 49152, 2147483647, 1024, 8, 32], "", 0, []], [[], [["FU", 2, [0, 1, 2, 3]], ["SP", 2, 0, 100352, [64], 1], ["AN", 2, 0, 5], ["AN", 2, 1, 6]]]], "r": [[3.86604e-06, 3.88495e-06, 3.90171e-06, 3.87641e-06, 3.88624e-06, 4.19338e-06, 4.35365e-06, 4.252e-06, 6.43887e-06, 3.89526e-06], 0, 24.2102, 1651682500], "v": "v0.6"}
{"i": [["[\"fused_window_reverse_roll_add\", 1, 14, 14, 512, 3, 7, \"float16\"]", "cuda -keys=cuda,gpu -max_num_threads=1024 -model=unknown -thread_warp_size=32", [-1, 16, 64, 49152, 2147483647, 1024, 8, 32], "", 0, []], [[], [["FU", 2, [0, 1, 2, 3]], ["SP", 2, 0, 100352, [8], 1], ["AN", 2, 0, 5], ["AN", 2, 1, 6]]]], "r": [[1.2169e-05, 1.30426e-05, 1.25628e-05, 1.21343e-05, 1.21442e-05, 1.21849e-05, 1.22685e-05, 1.29241e-05, 1.25339e-05, 1.2116e-05], 0, 26.5977, 1651682502], "v": "v0.6"}
{"i": [["[\"fused_window_reverse_roll_add\", 1, 14, 14, 512, 3, 7, \"float16\"]", "cuda -keys=cuda,gpu -max_num_threads=1024 -model=unknown -thread_warp_size=32", [-1, 16, 64, 49152, 2147483647, 1024, 8, 32], "", 0, []], [[], [["FU", 2, [0, 1, 2, 3]], ["SP", 2, 0, 100352, [56], 1], ["AN", 2, 0, 5], ["AN", 2, 1, 6]]]], "r": [[4.18413e-06, 4.19416e-06, 4.68133e-06, 4.9557e-06, 4.3525e-06, 4.44357e-06, 4.27742e-06, 4.36322e-06, 4.60861e-06, 4.31041e-06], 0, 32.6796, 1651682508], "v": "v0.6"}
{"i": [["[\"fused_window_reverse_roll_add\", 1, 14, 14, 512, 3, 7, \"float16\"]", "cuda -keys=cuda,gpu -max_num_threads=1024 -model=unknown -thread_warp_size=32", [-1, 16, 64, 49152, 2147483647, 1024, 8, 32], "", 0, []], [[], [["FU", 2, [0, 1, 2, 3]], ["SP", 2, 0, 100352, [2], 1], ["AN", 2, 0, 5], ["AN", 2, 1, 6]]]], "r": [[6.51176e-05, 4.45425e-05, 4.69916e-05, 4.11129e-05, 4.00735e-05, 4.11154e-05, 4.02087e-05, 4.0102e-05, 4.00926e-05, 4.31342e-05], 0, 35.9597, 1651682512], "v": "v0.6"}
{"i": [["[\"fused_window_reverse_roll_add\", 1, 14, 14, 512, 3, 7, \"float16\"]", "cuda -keys=cuda,gpu -max_num_threads=1024 -model=unknown -thread_warp_size=32", [-1, 16, 64, 49152, 2147483647, 1024, 8, 32], "", 0, []], [[], [["FU", 2, [0, 1, 2, 3]], ["SP", 2, 0, 100352, [56], 1], ["AN", 2, 0, 5], ["AN", 2, 1, 6]]]], "r": [[4.0166e-06, 4.01629e-06, 4.01639e-06, 4.01686e-06, 4.0164e-06, 4.01697e-06, 4.01673e-06, 4.01701e-06, 4.01701e-06, 4.0169e-06], 0, 20.0061, 1652003225], "v": "v0.6"}
{"i": [["[\"fused_window_reverse_roll_add\", 1, 14, 14, 512, 3, 7, \"float16\"]", "cuda -keys=cuda,gpu -max_num_threads=1024 -model=unknown -thread_warp_size=32", [-1, 16, 64, 49152, 2147483647, 1024, 8, 32], "", 0, []], [[], [["FU", 2, [0, 1, 2, 3]], ["SP", 2, 0, 100352, [4], 1], ["AN", 2, 0, 5], ["AN", 2, 1, 6]]]], "r": [[2.14847e-05, 2.14879e-05, 2.14801e-05, 2.14804e-05, 2.14837e-05, 2.1491e-05, 2.14922e-05, 2.14843e-05, 2.14838e-05, 2.14959e-05], 0, 10.8143, 1652003216], "v": "v0.6"}
{"i": [["[\"fused_window_reverse_roll_add\", 1, 14, 14, 512, 3, 7, \"float16\"]", "cuda -keys=cuda,gpu -max_num_threads=1024 -model=unknown -thread_warp_size=32", [-1, 16, 64, 49152, 2147483647, 1024, 8, 32], "", 0, []], [[], [["FU", 2, [0, 1, 2, 3]], ["SP", 2, 0, 100352, [16], 1], ["AN", 2, 0, 5], ["AN", 2, 1, 6]]]], "r": [[7.42543e-06, 7.42574e-06, 7.42469e-06, 7.42528e-06, 7.42518e-06, 7.42479e-06, 7.42542e-06, 7.42468e-06, 7.4255e-06, 7.42504e-06], 0, 28.7502, 1652003234], "v": "v0.6"}
{"i": [["[\"fused_window_reverse_roll_add\", 1, 14, 14, 512, 3, 7, \"float16\"]", "cuda -keys=cuda,gpu -max_num_threads=1024 -model=unknown -thread_warp_size=32", [-1, 16, 64, 49152, 2147483647, 1024, 8, 32], "", 0, []], [[], [["FU", 2, [0, 1, 2, 3]], ["SP", 2, 0, 100352, [64], 1], ["AN", 2, 0, 5], ["AN", 2, 1, 6]]]], "r": [[3.92557e-06, 3.94383e-06, 3.92493e-06, 3.92882e-06, 3.92543e-06, 3.92518e-06, 3.92546e-06, 3.92508e-06, 3.92539e-06, 3.92548e-06], 0, 16.4212, 1652003222], "v": "v0.6"}
{"i": [["[\"fused_window_reverse_roll_add\", 1, 14, 14, 512, 3, 7, \"float16\"]", "cuda -keys=cuda,gpu -max_num_threads=1024 -model=unknown -thread_warp_size=32", [-1, 16, 64, 49152, 2147483647, 1024, 8, 32], "", 0, []], [[], [["FU", 2, [0, 1, 2, 3]], ["SP", 2, 0, 100352, [8], 1], ["AN", 2, 0, 5], ["AN", 2, 1, 6]]]], "r": [[1.22968e-05, 1.23017e-05, 1.23034e-05, 1.22991e-05, 1.23006e-05, 1.23025e-05, 1.23019e-05, 1.2302e-05, 1.2301e-05, 1.23024e-05], 0, 24.6609, 1652003230], "v": "v0.6"}
{"i": [["[\"fused_window_reverse_roll_add\", 1, 14, 14, 512, 3, 7, \"float16\"]", "cuda -keys=cuda,gpu -max_num_threads=1024 -model=unknown -thread_warp_size=32", [-1, 16, 64, 49152, 2147483647, 1024, 8, 32], "", 0, []], [[], [["FU", 2, [0, 1, 2, 3]], ["SP", 2, 0, 100352, [1], 1], ["AN", 2, 0, 5], ["AN", 2, 1, 6]]]], "r": [[7.73774e-05, 7.73792e-05, 7.73807e-05, 7.7382e-05, 7.73842e-05, 7.73759e-05, 7.73774e-05, 7.73798e-05, 7.73781e-05, 7.73802e-05], 0, 5.81251, 1652003211], "v": "v0.6"}
{"i": [["[\"fused_window_reverse_roll_add\", 1, 14, 14, 512, 3, 7, \"float16\"]", "cuda -keys=cuda,gpu -max_num_threads=1024 -model=unknown -thread_warp_size=32", [-1, 16, 64, 49152, 2147483647, 1024, 8, 32], "", 0, []], [[], [["FU", 2, [0, 1, 2, 3]], ["SP", 2, 0, 100352, [2], 1], ["AN", 2, 0, 5], ["AN", 2, 1, 6]]]], "r": [[4.01037e-05, 4.00851e-05, 4.00889e-05, 4.00849e-05, 4.00875e-05, 4.00863e-05, 4.00829e-05, 4.00826e-05, 4.00852e-05, 4.00845e-05], 0, 39.7007, 1652003245], "v": "v0.6"}
{"i": [["[\"fused_window_reverse_roll_add\", 1, 14, 14, 512, 3, 7, \"float16\"]", "cuda -keys=cuda,gpu -max_num_threads=1024 -model=unknown -thread_warp_size=32", [-1, 16, 64, 49152, 2147483647, 1024, 8, 32], "", 0, []], [[], [["FU", 2, [0, 1, 2, 3]], ["SP", 2, 0, 100352, [49], 1], ["AN", 2, 0, 5], ["AN", 2, 1, 6]]]], "r": [[4.20359e-06, 4.20306e-06, 4.20512e-06, 4.20502e-06, 4.20503e-06, 4.2006e-06, 4.20476e-06, 4.20539e-06, 4.20234e-06, 4.20297e-06], 0, 34.4679, 1652003240], "v": "v0.6"}
{"i": [["[\"fused_window_reverse_roll_add\", 1, 14, 14, 512, 3, 7, \"float16\"]", "cuda -keys=cuda,gpu -max_num_threads=1024 -model=unknown -thread_warp_size=32", [-1, 16, 64, 49152, 2147483647, 1024, 8, 32], "", 0, []], [[], [["FU", 2, [0, 1, 2, 3]], ["SP", 2, 0, 100352, [28], 1], ["AN", 2, 0, 5], ["AN", 2, 1, 6]]]], "r": [[5.54224e-06, 5.54189e-06, 5.5426e-06, 5.54218e-06, 5.54187e-06, 5.54145e-06, 5.54195e-06, 5.54251e-06, 5.54256e-06, 5.54241e-06], 0, 43.5593, 1652003249], "v": "v0.6"}
{"i": [["[\"fused_window_reverse_roll_add\", 1, 14, 14, 512, 3, 7, \"float16\"]", "cuda -keys=cuda,gpu -max_num_threads=1024 -model=unknown -thread_warp_size=32", [-1, 16, 64, 49152, 2147483647, 1024, 8, 32], "", 0, []], [[], [["FU", 2, [0, 1, 2, 3]], ["SP", 2, 0, 100352, [7], 1], ["AN", 2, 0, 5], ["AN", 2, 1, 6]]]], "r": [[1.36707e-05, 1.36692e-05, 1.36728e-05, 1.36677e-05, 1.36712e-05, 1.36701e-05, 1.36633e-05, 1.36692e-05, 1.3671e-05, 1.3661e-05], 0, 47.8153, 1652003253], "v": "v0.6"}
{"i": [["[\"fused_window_reverse_roll_add\", 1, 14, 14, 512, 3, 7, \"float16\"]", "cuda -keys=cuda,gpu -max_num_threads=1024 -model=unknown -thread_warp_size=32", [-1, 16, 64, 49152, 2147483647, 1024, 8, 32], "", 0, []], [[], [["FU", 2, [0, 1, 2, 3]], ["SP", 2, 0, 100352, [32], 1], ["AN", 2, 0, 5], ["AN", 2, 1, 6]]]], "r": [[4.89337e-06, 4.89386e-06, 4.89412e-06, 4.89372e-06, 4.8935e-06, 4.89386e-06, 4.89413e-06, 4.8942e-06, 4.89428e-06, 4.89432e-06], 0, 57.7462, 1652003263], "v": "v0.6"}
{"i": [["[\"fused_window_reverse_roll_add\", 1, 14, 14, 512, 3, 7, \"float16\"]", "cuda -keys=cuda,gpu -max_num_threads=1024 -model=unknown -thread_warp_size=32", [-1, 16, 64, 49152, 2147483647, 1024, 8, 32], "", 0, []], [[], [["FU", 2, [0, 1, 2, 3]], ["SP", 2, 0, 100352, [14], 1], ["AN", 2, 0, 5], ["AN", 2, 1, 6]]]], "r": [[8.1184e-06, 8.11934e-06, 8.12039e-06, 8.12005e-06, 8.12065e-06, 8.12041e-06, 8.11908e-06, 8.12025e-06, 8.11984e-06, 8.12013e-06], 0, 51.9348, 1652003258], "v": "v0.6"}
