python/models/swin_transformer/kernel_configs/swin_transformer_window_reverse_1_7_7_1024_7_float16.log
{"i": [["[\"window_reverse\", 1, 7, 7, 1024, 7, \"float16\"]", "cuda -keys=cuda,gpu -max_num_threads=1024 -model=unknown -thread_warp_size=32", [-1, 16, 64, 49152, 2147483647, 1024, 8, 32], "", 0, []], [[], [["FU", 1, [0, 1, 2, 3]], ["SP", 1, 0, 50176, [14], 1], ["AN", 1, 0, 5], ["AN", 1, 1, 6]]]], "r": [[5.42437e-06, 5.43036e-06, 5.43213e-06], 0, 0.945305, 1668060359], "v": "v0.6"}
{"i": [["[\"window_reverse\", 1, 7, 7, 1024, 7, \"float16\"]", "cuda -keys=cuda,gpu -max_num_threads=1024 -model=unknown -thread_warp_size=32", [-1, 16, 64, 49152, 2147483647, 1024, 8, 32], "", 0, []], [[], [["FU", 1, [0, 1, 2, 3]], ["SP", 1, 0, 50176, [7], 1], ["AN", 1, 0, 5], ["AN", 1, 1, 6]]]], "r": [[7.92095e-06, 7.93892e-06, 7.94348e-06], 0, 2.34376, 1668060360], "v": "v0.6"}
{"i": [["[\"window_reverse\", 1, 7, 7, 1024, 7, \"float16\"]", "cuda -keys=cuda,gpu -max_num_threads=1024 -model=unknown -thread_warp_size=32", [-1, 16, 64, 49152, 2147483647, 1024, 8, 32], "", 0, []], [[], [["FU", 1, [0, 1, 2, 3]], ["SP", 1, 0, 50176, [56], 1], ["AN", 1, 0, 5], ["AN", 1, 1, 6]]]], "r": [[3.20173e-06, 3.20765e-06, 3.20284e-06], 0, 0.584417, 1668060359], "v": "v0.6"}
{"i": [["[\"window_reverse\", 1, 7, 7, 1024, 7, \"float16\"]", "cuda -keys=cuda,gpu -max_num_threads=1024 -model=unknown -thread_warp_size=32", [-1, 16, 64, 49152, 2147483647, 1024, 8, 32], "", 0, []], [[], [["FU", 1, [0, 1, 2, 3]], ["SP", 1, 0, 50176, [2], 1], ["AN", 1, 0, 5], ["AN", 1, 1, 6]]]], "r": [[2.12849e-05, 2.13127e-05, 2.13056e-05], 0, 3.05934, 1668060361], "v": "v0.6"}
{"i": [["[\"window_reverse\", 1, 7, 7, 1024, 7, \"float16\"]", "cuda -keys=cuda,gpu -max_num_threads=1024 -model=unknown -thread_warp_size=32", [-1, 16, 64, 49152, 2147483647, 1024, 8, 32], "", 0, []], [[], [["FU", 1, [0, 1, 2, 3]], ["SP", 1, 0, 50176, [8], 1], ["AN", 1, 0, 5], ["AN", 1, 1, 6]]]], "r": [[7.21213e-06, 7.22454e-06, 7.22581e-06], 0, 1.62482, 1668060360], "v": "v0.6"}
{"i": [["[\"window_reverse\", 1, 7, 7, 1024, 7, \"float16\"]", "cuda -keys=cuda,gpu -max_num_threads=1024 -model=unknown -thread_warp_size=32", [-1, 16, 64, 49152, 2147483647, 1024, 8, 32], "", 0, []], [[], [["FU", 1, [0, 1, 2, 3]], ["SP", 1, 0, 50176, [28], 1], ["AN", 1, 0, 5], ["AN", 1, 1, 6]]]], "r": [[3.92677e-06, 3.93996e-06, 3.94085e-06], 0, 1.27857, 1668060359], "v": "v0.6"}
{"i": [["[\"window_reverse\", 1, 7, 7, 1024, 7, \"float16\"]", "cuda -keys=cuda,gpu -max_num_threads=1024 -model=unknown -thread_warp_size=32", [-1, 16, 64, 49152, 2147483647, 1024, 8, 32], "", 0, []], [[], [["FU", 1, [0, 1, 2, 3]], ["SP", 1, 0, 50176, [32], 1], ["AN", 1, 0, 5], ["AN", 1, 1, 6]]]], "r": [[3.56458e-06, 3.57754e-06, 3.57788e-06], 0, 2.00552, 1668060360], "v": "v0.6"}
{"i": [["[\"window_reverse\", 1, 7, 7, 1024, 7, \"float16\"]", "cuda -keys=cuda,gpu -max_num_threads=1024 -model=unknown -thread_warp_size=32", [-1, 16, 64, 49152, 2147483647, 1024, 8, 32], "", 0, []], [[], [["FU", 1, [0, 1, 2, 3]], ["SP", 1, 0, 50176, [49], 1], ["AN", 1, 0, 5], ["AN", 1, 1, 6]]]], "r": [[3.43948e-06, 3.45391e-06, 3.45425e-06], 0, 2.67536, 1668060361], "v": "v0.6"}
{"i": [["[\"window_reverse\", 1, 7, 7, 1024, 7, \"float16\"]", "cuda -keys=cuda,gpu -max_num_threads=1024 -model=unknown -thread_warp_size=32", [-1, 16, 64, 49152, 2147483647, 1024, 8, 32], "", 0, []], [[], [["FU", 1, [0, 1, 2, 3]], ["SP", 1, 0, 50176, [16], 1], ["AN", 1, 0, 5], ["AN", 1, 1, 6]]]], "r": [[4.91112e-06, 4.91931e-06, 4.92302e-06], 0, 3.39304, 1668060361], "v": "v0.6"}
{"i": [["[\"window_reverse\", 1, 7, 7, 1024, 7, \"float16\"]", "cuda -keys=cuda,gpu -max_num_threads=1024 -model=unknown -thread_warp_size=32", [-1, 16, 64, 49152, 2147483647, 1024, 8, 32], "", 0, []], [[], [["FU", 1, [0, 1, 2, 3]], ["SP", 1, 0, 50176, [4], 1], ["AN", 1, 0, 5], ["AN", 1, 1, 6]]]], "r": [[1.19905e-05, 1.19957e-05, 1.19956e-05], 0, 3.67947, 1668060362], "v": "v0.6"}
{"i": [["[\"window_reverse\", 1, 7, 7, 1024, 7, \"float16\"]", "cuda -keys=cuda,gpu -max_num_threads=1024 -model=unknown -thread_warp_size=32", [-1, 16, 64, 49152, 2147483647, 1024, 8, 32], "", 0, []], [[], [["FU", 1, [0, 1, 2, 3]], ["SP", 1, 0, 50176, [64], 1], ["AN", 1, 0, 5], ["AN", 1, 1, 6]]]], "r": [[3.04061e-06, 3.04007e-06, 3.03937e-06], 0, 4.07033, 1668060362], "v": "v0.6"}
{"i": [["[\"window_reverse\", 1, 7, 7, 1024, 7, \"float16\"]", "cuda -keys=cuda,gpu -max_num_threads=1024 -model=unknown -thread_warp_size=32", [-1, 16, 64, 49152, 2147483647, 1024, 8, 32], "", 0, []], [[], [["FU", 1, [0, 1, 2, 3]], ["SP", 1, 0, 50176, [1], 1], ["AN", 1, 0, 5], ["AN", 1, 1, 6]]]], "r": [[3.97559e-05, 3.97702e-05, 3.9768e-05], 0, 4.40337, 1668060363], "v": "v0.6"}
{"i": [["[\"window_reverse\", 1, 7, 7, 1024, 7, \"float16\"]", "cuda -keys=cuda,gpu -max_num_threads=1024 -model=unknown -thread_warp_size=32", [-1, 16, 64, 49152, 2147483647, 1024, 8, 32], "", 0, []], [[], [["FU", 1, [0, 1, 2, 3]], ["SP", 1, 0, 50176, [56], 1], ["AN", 1, 0, 5], ["AN", 1, 1, 6]]]], "r": [[3.35878e-06, 3.37197e-06, 3.37192e-06], 0, 2.34768, 1668061745], "v": "v0.6"}
{"i": [["[\"window_reverse\", 1, 7, 7, 1024, 7, \"float16\"]", "cuda -keys=cuda,gpu -max_num_threads=1024 -model=unknown -thread_warp_size=32", [-1, 16, 64, 49152, 2147483647, 1024, 8, 32], "", 0, []], [[], [["FU", 1, [0, 1, 2, 3]], ["SP", 1, 0, 50176, [8], 1], ["AN", 1, 0, 5], ["AN", 1, 1, 6]]]], "r": [[7.44131e-06, 7.46145e-06, 7.45691e-06], 0, 0.574782, 1668061743], "v": "v0.6"}
{"i": [["[\"window_reverse\", 1, 7, 7, 1024, 7, \"float16\"]", "cuda -keys=cuda,gpu -max_num_threads=1024 -model=unknown -thread_warp_size=32", [-1, 16, 64, 49152, 2147483647, 1024, 8, 32], "", 0, []], [[], [["FU", 1, [0, 1, 2, 3]], ["SP", 1, 0, 50176, [4], 1], ["AN", 1, 0, 5], ["AN", 1, 1, 6]]]], "r": [[1.19343e-05, 1.1942e-05, 1.19412e-05], 0, 1.64776, 1668061744], "v": "v0.6"}
{"i": [["[\"window_reverse\", 1, 7, 7, 1024, 7, \"float16\"]", "cuda -keys=cuda,gpu -max_num_threads=1024 -model=unknown -thread_warp_size=32", [-1, 16, 64, 49152, 2147483647, 1024, 8, 32], "", 0, []], [[], [["FU", 1, [0, 1, 2, 3]], ["SP", 1, 0, 50176, [49], 1], ["AN", 1, 0, 5], ["AN", 1, 1, 6]]]], "r": [[3.20584e-06, 3.20438e-06, 3.2035e-06], 0, 1.31744, 1668061744], "v": "v0.6"}
{"i": [["[\"window_reverse\", 1, 7, 7, 1024, 7, \"float16\"]", "cuda -keys=cuda,gpu -max_num_threads=1024 -model=unknown -thread_warp_size=32", [-1, 16, 64, 49152, 2147483647, 1024, 8, 32], "", 0, []], [[], [["FU", 1, [0, 1, 2, 3]], ["SP", 1, 0, 50176, [7], 1], ["AN", 1, 0, 5], ["AN", 1, 1, 6]]]], "r": [[7.88763e-06, 7.90552e-06, 7.90142e-06], 0, 0.96146, 1668061744], "v": "v0.6"}
{"i": [["[\"window_reverse\", 1, 7, 7, 1024, 7, \"float16\"]", "cuda -keys=cuda,gpu -max_num_threads=1024 -model=unknown -thread_warp_size=32", [-1, 16, 64, 49152, 2147483647, 1024, 8, 32], "", 0, []], [[], [["FU", 1, [0, 1, 2, 3]], ["SP", 1, 0, 50176, [64], 1], ["AN", 1, 0, 5], ["AN", 1, 1, 6]]]], "r": [[3.14499e-06, 3.16688e-06, 3.16186e-06], 0, 2.01571, 1668061745], "v": "v0.6"}
{"i": [["[\"window_reverse\", 1, 7, 7, 1024, 7, \"float16\"]", "cuda -keys=cuda,gpu -max_num_threads=1024 -model=unknown -thread_warp_size=32", [-1, 16, 64, 49152, 2147483647, 1024, 8, 32], "", 0, []], [[], [["FU", 1, [0, 1, 2, 3]], ["SP", 1, 0, 50176, [1], 1], ["AN", 1, 0, 5], ["AN", 1, 1, 6]]]], "r": [[3.97963e-05, 3.98125e-05, 3.98107e-05], 0, 2.68437, 1668061746], "v": "v0.6"}
{"i": [["[\"window_reverse\", 1, 7, 7, 1024, 7, \"float16\"]", "cuda -keys=cuda,gpu -max_num_threads=1024 -model=unknown -thread_warp_size=32", [-1, 16, 64, 49152, 2147483647, 1024, 8, 32], "", 0, []], [[], [["FU", 1, [0, 1, 2, 3]], ["SP", 1, 0, 50176, [2], 1], ["AN", 1, 0, 5], ["AN", 1, 1, 6]]]], "r": [[2.12778e-05, 2.12947e-05, 2.12892e-05], 0, 3.06996, 1668061746], "v": "v0.6"}
{"i": [["[\"window_reverse\", 1, 7, 7, 1024, 7, \"float16\"]", "cuda -keys=cuda,gpu -max_num_threads=1024 -model=unknown -thread_warp_size=32", [-1, 16, 64, 49152, 2147483647, 1024, 8, 32], "", 0, []], [[], [["FU", 1, [0, 1, 2, 3]], ["SP", 1, 0, 50176, [14], 1], ["AN", 1, 0, 5], ["AN", 1, 1, 6]]]], "r": [[5.20093e-06, 5.21512e-06, 5.21653e-06], 0, 3.39035, 1668061746], "v": "v0.6"}
{"i": [["[\"window_reverse\", 1, 7, 7, 1024, 7, \"float16\"]", "cuda -keys=cuda,gpu -max_num_threads=1024 -model=unknown -thread_warp_size=32", [-1, 16, 64, 49152, 2147483647, 1024, 8, 32], "", 0, []], [[], [["FU", 1, [0, 1, 2, 3]], ["SP", 1, 0, 50176, [16], 1], ["AN", 1, 0, 5], ["AN", 1, 1, 6]]]], "r": [[5.08098e-06, 5.09474e-06, 5.09845e-06], 0, 4.09714, 1668061747], "v": "v0.6"}
{"i": [["[\"window_reverse\", 1, 7, 7, 1024, 7, \"float16\"]", "cuda -keys=cuda,gpu -max_num_threads=1024 -model=unknown -thread_warp_size=32", [-1, 16, 64, 49152, 2147483647, 1024, 8, 32], "", 0, []], [[], [["FU", 1, [0, 1, 2, 3]], ["SP", 1, 0, 50176, [28], 1], ["AN", 1, 0, 5], ["AN", 1, 1, 6]]]], "r": [[3.94287e-06, 3.95407e-06, 3.95527e-06], 0, 3.71718, 1668061747], "v": "v0.6"}
{"i": [["[\"window_reverse\", 1, 7, 7, 1024, 7, \"float16\"]", "cuda -keys=cuda,gpu -max_num_threads=1024 -model=unknown -thread_warp_size=32", [-1, 16, 64, 49152, 2147483647, 1024, 8, 32], "", 0, []], [[], [["FU", 1, [0, 1, 2, 3]], ["SP", 1, 0, 50176, [32], 1], ["AN", 1, 0, 5], ["AN", 1, 1, 6]]]], "r": [[3.75058e-06, 3.76117e-06, 3.76138e-06], 0, 4.41934, 1668061747], "v": "v0.6"}
