python/models/swin_transformer/kernel_configs/swin_transformer_permute_attn_q_k_v_1_14_14_512_7_16_float16.log
{"i": [["[\"permute_attn_q_k_v\", 1, 14, 14, 512, 7, 16, \"float16\"]", "cuda -keys=cuda,gpu -max_num_threads=1024 -model=unknown -thread_warp_size=32", [-1, 16, 64, 49152, 2147483647, 1024, 8, 32], "", 0, []], [[], [["FU", 1, [0, 1, 2, 3]], ["SP", 1, 0, 100352, [1], 1], ["AN", 1, 0, 5], ["AN", 1, 1, 6]]]], "r": [[7.7332e-05, 7.7321e-05, 7.7329e-05], 0, 1.94349, 1668051942], "v": "v0.6"}
{"i": [["[\"permute_attn_q_k_v\", 1, 14, 14, 512, 7, 16, \"float16\"]", "cuda -keys=cuda,gpu -max_num_threads=1024 -model=unknown -thread_warp_size=32", [-1, 16, 64, 49152, 2147483647, 1024, 8, 32], "", 0, []], [[], [["FU", 1, [0, 1, 2, 3]], ["SP", 1, 0, 100352, [7], 1], ["AN", 1, 0, 5], ["AN", 1, 1, 6]]]], "r": [[1.34187e-05, 1.34051e-05, 1.34096e-05], 0, 0.878593, 1668051941], "v": "v0.6"}
{"i": [["[\"permute_attn_q_k_v\", 1, 14, 14, 512, 7, 16, \"float16\"]", "cuda -keys=cuda,gpu -max_num_threads=1024 -model=unknown -thread_warp_size=32", [-1, 16, 64, 49152, 2147483647, 1024, 8, 32], "", 0, []], [[], [["FU", 1, [0, 1, 2, 3]], ["SP", 1, 0, 100352, [8], 1], ["AN", 1, 0, 5], ["AN", 1, 1, 6]]]], "r": [[1.204e-05, 1.20553e-05, 1.20498e-05], 0, 1.26365, 1668051941], "v": "v0.6"}
{"i": [["[\"permute_attn_q_k_v\", 1, 14, 14, 512, 7, 16, \"float16\"]", "cuda -keys=cuda,gpu -max_num_threads=1024 -model=unknown -thread_warp_size=32", [-1, 16, 64, 49152, 2147483647, 1024, 8, 32], "", 0, []], [[], [["FU", 1, [0, 1, 2, 3]], ["SP", 1, 0, 100352, [56], 1], ["AN", 1, 0, 5], ["AN", 1, 1, 6]]]], "r": [[3.8625e-06, 3.8736e-06, 3.87935e-06], 0, 0.554847, 1668051940], "v": "v0.6"}
{"i": [["[\"permute_attn_q_k_v\", 1, 14, 14, 512, 7, 16, \"float16\"]", "cuda -keys=cuda,gpu -max_num_threads=1024 -model=unknown -thread_warp_size=32", [-1, 16, 64, 49152, 2147483647, 1024, 8, 32], "", 0, []], [[], [["FU", 1, [0, 1, 2, 3]], ["SP", 1, 0, 100352, [2], 1], ["AN", 1, 0, 5], ["AN", 1, 1, 6]]]], "r": [[4.00391e-05, 4.00694e-05, 4.00546e-05], 0, 1.60016, 1668051941], "v": "v0.6"}
{"i": [["[\"permute_attn_q_k_v\", 1, 14, 14, 512, 7, 16, \"float16\"]", "cuda -keys=cuda,gpu -max_num_threads=1024 -model=unknown -thread_warp_size=32", [-1, 16, 64, 49152, 2147483647, 1024, 8, 32], "", 0, []], [[], [["FU", 1, [0, 1, 2, 3]], ["SP", 1, 0, 100352, [32], 1], ["AN", 1, 0, 5], ["AN", 1, 1, 6]]]], "r": [[4.96534e-06, 4.97411e-06, 4.97643e-06], 0, 2.30119, 1668051942], "v": "v0.6"}
{"i": [["[\"permute_attn_q_k_v\", 1, 14, 14, 512, 7, 16, \"float16\"]", "cuda -keys=cuda,gpu -max_num_threads=1024 -model=unknown -thread_warp_size=32", [-1, 16, 64, 49152, 2147483647, 1024, 8, 32], "", 0, []], [[], [["FU", 1, [0, 1, 2, 3]], ["SP", 1, 0, 100352, [14], 1], ["AN", 1, 0, 5], ["AN", 1, 1, 6]]]], "r": [[7.97636e-06, 7.98916e-06, 7.98853e-06], 0, 2.64682, 1668051943], "v": "v0.6"}
{"i": [["[\"permute_attn_q_k_v\", 1, 14, 14, 512, 7, 16, \"float16\"]", "cuda -keys=cuda,gpu -max_num_threads=1024 -model=unknown -thread_warp_size=32", [-1, 16, 64, 49152, 2147483647, 1024, 8, 32], "", 0, []], [[], [["FU", 1, [0, 1, 2, 3]], ["SP", 1, 0, 100352, [28], 1], ["AN", 1, 0, 5], ["AN", 1, 1, 6]]]], "r": [[5.37636e-06, 5.39056e-06, 5.38929e-06], 0, 2.95667, 1668051943], "v": "v0.6"}
{"i": [["[\"permute_attn_q_k_v\", 1, 14, 14, 512, 7, 16, \"float16\"]", "cuda -keys=cuda,gpu -max_num_threads=1024 -model=unknown -thread_warp_size=32", [-1, 16, 64, 49152, 2147483647, 1024, 8, 32], "", 0, []], [[], [["FU", 1, [0, 1, 2, 3]], ["SP", 1, 0, 100352, [64], 1], ["AN", 1, 0, 5], ["AN", 1, 1, 6]]]], "r": [[3.70075e-06, 3.72149e-06, 3.72321e-06], 0, 4.00495, 1668051944], "v": "v0.6"}
{"i": [["[\"permute_attn_q_k_v\", 1, 14, 14, 512, 7, 16, \"float16\"]", "cuda -keys=cuda,gpu -max_num_threads=1024 -model=unknown -thread_warp_size=32", [-1, 16, 64, 49152, 2147483647, 1024, 8, 32], "", 0, []], [[], [["FU", 1, [0, 1, 2, 3]], ["SP", 1, 0, 100352, [49], 1], ["AN", 1, 0, 5], ["AN", 1, 1, 6]]]], "r": [[4.24449e-06, 4.26125e-06, 4.25925e-06], 0, 3.67291, 1668051944], "v": "v0.6"}
{"i": [["[\"permute_attn_q_k_v\", 1, 14, 14, 512, 7, 16, \"float16\"]", "cuda -keys=cuda,gpu -max_num_threads=1024 -model=unknown -thread_warp_size=32", [-1, 16, 64, 49152, 2147483647, 1024, 8, 32], "", 0, []], [[], [["FU", 1, [0, 1, 2, 3]], ["SP", 1, 0, 100352, [16], 1], ["AN", 1, 0, 5], ["AN", 1, 1, 6]]]], "r": [[7.20597e-06, 7.22084e-06, 7.22189e-06], 0, 3.32923, 1668051943], "v": "v0.6"}
{"i": [["[\"permute_attn_q_k_v\", 1, 14, 14, 512, 7, 16, \"float16\"]", "cuda -keys=cuda,gpu -max_num_threads=1024 -model=unknown -thread_warp_size=32", [-1, 16, 64, 49152, 2147483647, 1024, 8, 32], "", 0, []], [[], [["FU", 1, [0, 1, 2, 3]], ["SP", 1, 0, 100352, [4], 1], ["AN", 1, 0, 5], ["AN", 1, 1, 6]]]], "r": [[2.1398e-05, 2.14082e-05, 2.14057e-05], 0, 4.33739, 1668051944], "v": "v0.6"}
{"i": [["[\"permute_attn_q_k_v\", 1, 14, 14, 512, 7, 16, \"float16\"]", "cuda -keys=cuda,gpu -max_num_threads=1024 -model=unknown -thread_warp_size=32", [-1, 16, 64, 49152, 2147483647, 1024, 8, 32], "", 0, []], [[], [["FU", 1, [0, 1, 2, 3]], ["SP", 1, 0, 100352, [49], 1], ["AN", 1, 0, 5], ["AN", 1, 1, 6]]]], "r": [[4.02268e-06, 4.03005e-06, 4.02745e-06], 0, 1.21978, 1668051958], "v": "v0.6"}
{"i": [["[\"permute_attn_q_k_v\", 1, 14, 14, 512, 7, 16, \"float16\"]", "cuda -keys=cuda,gpu -max_num_threads=1024 -model=unknown -thread_warp_size=32", [-1, 16, 64, 49152, 2147483647, 1024, 8, 32], "", 0, []], [[], [["FU", 1, [0, 1, 2, 3]], ["SP", 1, 0, 100352, [56], 1], ["AN", 1, 0, 5], ["AN", 1, 1, 6]]]], "r": [[3.85938e-06, 3.87413e-06, 3.87292e-06], 0, 1.53709, 1668051958], "v": "v0.6"}
{"i": [["[\"permute_attn_q_k_v\", 1, 14, 14, 512, 7, 16, \"float16\"]", "cuda -keys=cuda,gpu -max_num_threads=1024 -model=unknown -thread_warp_size=32", [-1, 16, 64, 49152, 2147483647, 1024, 8, 32], "", 0, []], [[], [["FU", 1, [0, 1, 2, 3]], ["SP", 1, 0, 100352, [28], 1], ["AN", 1, 0, 5], ["AN", 1, 1, 6]]]], "r": [[5.31294e-06, 5.32466e-06, 5.32365e-06], 0, 2.88121, 1668051959], "v": "v0.6"}
{"i": [["[\"permute_attn_q_k_v\", 1, 14, 14, 512, 7, 16, \"float16\"]", "cuda -keys=cuda,gpu -max_num_threads=1024 -model=unknown -thread_warp_size=32", [-1, 16, 64, 49152, 2147483647, 1024, 8, 32], "", 0, []], [[], [["FU", 1, [0, 1, 2, 3]], ["SP", 1, 0, 100352, [8], 1], ["AN", 1, 0, 5], ["AN", 1, 1, 6]]]], "r": [[1.20292e-05, 1.20429e-05, 1.20416e-05], 0, 0.84009, 1668051957], "v": "v0.6"}
{"i": [["[\"permute_attn_q_k_v\", 1, 14, 14, 512, 7, 16, \"float16\"]", "cuda -keys=cuda,gpu -max_num_threads=1024 -model=unknown -thread_warp_size=32", [-1, 16, 64, 49152, 2147483647, 1024, 8, 32], "", 0, []], [[], [["FU", 1, [0, 1, 2, 3]], ["SP", 1, 0, 100352, [2], 1], ["AN", 1, 0, 5], ["AN", 1, 1, 6]]]], "r": [[3.99369e-05, 3.99598e-05, 3.99532e-05], 0, 0.576173, 1668051957], "v": "v0.6"}
{"i": [["[\"permute_attn_q_k_v\", 1, 14, 14, 512, 7, 16, \"float16\"]", "cuda -keys=cuda,gpu -max_num_threads=1024 -model=unknown -thread_warp_size=32", [-1, 16, 64, 49152, 2147483647, 1024, 8, 32], "", 0, []], [[], [["FU", 1, [0, 1, 2, 3]], ["SP", 1, 0, 100352, [7], 1], ["AN", 1, 0, 5], ["AN", 1, 1, 6]]]], "r": [[1.34281e-05, 1.34546e-05, 1.34538e-05], 0, 1.86694, 1668051958], "v": "v0.6"}
{"i": [["[\"permute_attn_q_k_v\", 1, 14, 14, 512, 7, 16, \"float16\"]", "cuda -keys=cuda,gpu -max_num_threads=1024 -model=unknown -thread_warp_size=32", [-1, 16, 64, 49152, 2147483647, 1024, 8, 32], "", 0, []], [[], [["FU", 1, [0, 1, 2, 3]], ["SP", 1, 0, 100352, [64], 1], ["AN", 1, 0, 5], ["AN", 1, 1, 6]]]], "r": [[3.74396e-06, 3.75597e-06, 3.75358e-06], 0, 2.54144, 1668051959], "v": "v0.6"}
{"i": [["[\"permute_attn_q_k_v\", 1, 14, 14, 512, 7, 16, \"float16\"]", "cuda -keys=cuda,gpu -max_num_threads=1024 -model=unknown -thread_warp_size=32", [-1, 16, 64, 49152, 2147483647, 1024, 8, 32], "", 0, []], [[], [["FU", 1, [0, 1, 2, 3]], ["SP", 1, 0, 100352, [4], 1], ["AN", 1, 0, 5], ["AN", 1, 1, 6]]]], "r": [[2.14227e-05, 2.14265e-05, 2.14277e-05], 0, 3.25332, 1668051960], "v": "v0.6"}
{"i": [["[\"permute_attn_q_k_v\", 1, 14, 14, 512, 7, 16, \"float16\"]", "cuda -keys=cuda,gpu -max_num_threads=1024 -model=unknown -thread_warp_size=32", [-1, 16, 64, 49152, 2147483647, 1024, 8, 32], "", 0, []], [[], [["FU", 1, [0, 1, 2, 3]], ["SP", 1, 0, 100352, [32], 1], ["AN", 1, 0, 5], ["AN", 1, 1, 6]]]], "r": [[4.79724e-06, 4.80717e-06, 4.80708e-06], 0, 2.23178, 1668051959], "v": "v0.6"}
{"i": [["[\"permute_attn_q_k_v\", 1, 14, 14, 512, 7, 16, \"float16\"]", "cuda -keys=cuda,gpu -max_num_threads=1024 -model=unknown -thread_warp_size=32", [-1, 16, 64, 49152, 2147483647, 1024, 8, 32], "", 0, []], [[], [["FU", 1, [0, 1, 2, 3]], ["SP", 1, 0, 100352, [14], 1], ["AN", 1, 0, 5], ["AN", 1, 1, 6]]]], "r": [[8.03106e-06, 8.04643e-06, 8.05326e-06], 0, 3.55299, 1668051960], "v": "v0.6"}
{"i": [["[\"permute_attn_q_k_v\", 1, 14, 14, 512, 7, 16, \"float16\"]", "cuda -keys=cuda,gpu -max_num_threads=1024 -model=unknown -thread_warp_size=32", [-1, 16, 64, 49152, 2147483647, 1024, 8, 32], "", 0, []], [[], [["FU", 1, [0, 1, 2, 3]], ["SP", 1, 0, 100352, [16], 1], ["AN", 1, 0, 5], ["AN", 1, 1, 6]]]], "r": [[7.25295e-06, 7.26958e-06, 7.26799e-06], 0, 4.25925, 1668051961], "v": "v0.6"}
{"i": [["[\"permute_attn_q_k_v\", 1, 14, 14, 512, 7, 16, \"float16\"]", "cuda -keys=cuda,gpu -max_num_threads=1024 -model=unknown -thread_warp_size=32", [-1, 16, 64, 49152, 2147483647, 1024, 8, 32], "", 0, []], [[], [["FU", 1, [0, 1, 2, 3]], ["SP", 1, 0, 100352, [1], 1], ["AN", 1, 0, 5], ["AN", 1, 1, 6]]]], "r": [[7.72423e-05, 7.72507e-05, 7.72465e-05], 0, 3.88255, 1668051960], "v": "v0.6"}
{"i": [["[\"permute_attn_q_k_v\", 1, 14, 14, 512, 7, 16, \"float16\"]", "cuda -keys=cuda,gpu -max_num_threads=1024 -model=unknown -thread_warp_size=32", [-1, 16, 64, 49152, 2147483647, 1024, 8, 32], "", 0, []], [[], [["FU", 1, [0, 1, 2, 3]], ["SP", 1, 0, 100352, [56], 1], ["AN", 1, 0, 5], ["AN", 1, 1, 6]]]], "r": [[4.04429e-06, 4.05489e-06, 4.05626e-06], 0, 2.28929, 1668051975], "v": "v0.6"}
{"i": [["[\"permute_attn_q_k_v\", 1, 14, 14, 512, 7, 16, \"float16\"]", "cuda -keys=cuda,gpu -max_num_threads=1024 -model=unknown -thread_warp_size=32", [-1, 16, 64, 49152, 2147483647, 1024, 8, 32], "", 0, []], [[], [["FU", 1, [0, 1, 2, 3]], ["SP", 1, 0, 100352, [14], 1], ["AN", 1, 0, 5], ["AN", 1, 1, 6]]]], "r": [[8.02398e-06, 8.0353e-06, 8.0328e-06], 0, 0.898996, 1668051974], "v": "v0.6"}
{"i": [["[\"permute_attn_q_k_v\", 1, 14, 14, 512, 7, 16, \"float16\"]", "cuda -keys=cuda,gpu -max_num_threads=1024 -model=unknown -thread_warp_size=32", [-1, 16, 64, 49152, 2147483647, 1024, 8, 32], "", 0, []], [[], [["FU", 1, [0, 1, 2, 3]], ["SP", 1, 0, 100352, [49], 1], ["AN", 1, 0, 5], ["AN", 1, 1, 6]]]], "r": [[4.22043e-06, 4.23621e-06, 4.23853e-06], 0, 0.568017, 1668051974], "v": "v0.6"}
{"i": [["[\"permute_attn_q_k_v\", 1, 14, 14, 512, 7, 16, \"float16\"]", "cuda -keys=cuda,gpu -max_num_threads=1024 -model=unknown -thread_warp_size=32", [-1, 16, 64, 49152, 2147483647, 1024, 8, 32], "", 0, []], [[], [["FU", 1, [0, 1, 2, 3]], ["SP", 1, 0, 100352, [64], 1], ["AN", 1, 0, 5], ["AN", 1, 1, 6]]]], "r": [[3.68769e-06, 3.69996e-06, 3.6997e-06], 0, 1.25609, 1668051974], "v": "v0.6"}
{"i": [["[\"permute_attn_q_k_v\", 1, 14, 14, 512, 7, 16, \"float16\"]", "cuda -keys=cuda,gpu -max_num_threads=1024 -model=unknown -thread_warp_size=32", [-1, 16, 64, 49152, 2147483647, 1024, 8, 32], "", 0, []], [[], [["FU", 1, [0, 1, 2, 3]], ["SP", 1, 0, 100352, [1], 1], ["AN", 1, 0, 5], ["AN", 1, 1, 6]]]], "r": [[7.71706e-05, 7.71797e-05, 7.72012e-05], 0, 1.91749, 1668051975], "v": "v0.6"}
{"i": [["[\"permute_attn_q_k_v\", 1, 14, 14, 512, 7, 16, \"float16\"]", "cuda -keys=cuda,gpu -max_num_threads=1024 -model=unknown -thread_warp_size=32", [-1, 16, 64, 49152, 2147483647, 1024, 8, 32], "", 0, []], [[], [["FU", 1, [0, 1, 2, 3]], ["SP", 1, 0, 100352, [4], 1], ["AN", 1, 0, 5], ["AN", 1, 1, 6]]]], "r": [[2.13753e-05, 2.13881e-05, 2.13885e-05], 0, 1.57732, 1668051975], "v": "v0.6"}
{"i": [["[\"permute_attn_q_k_v\", 1, 14, 14, 512, 7, 16, \"float16\"]", "cuda -keys=cuda,gpu -max_num_threads=1024 -model=unknown -thread_warp_size=32", [-1, 16, 64, 49152, 2147483647, 1024, 8, 32], "", 0, []], [[], [["FU", 1, [0, 1, 2, 3]], ["SP", 1, 0, 100352, [7], 1], ["AN", 1, 0, 5], ["AN", 1, 1, 6]]]], "r": [[1.34236e-05, 1.34403e-05, 1.34346e-05], 0, 2.60285, 1668051976], "v": "v0.6"}
{"i": [["[\"permute_attn_q_k_v\", 1, 14, 14, 512, 7, 16, \"float16\"]", "cuda -keys=cuda,gpu -max_num_threads=1024 -model=unknown -thread_warp_size=32", [-1, 16, 64, 49152, 2147483647, 1024, 8, 32], "", 0, []], [[], [["FU", 1, [0, 1, 2, 3]], ["SP", 1, 0, 100352, [32], 1], ["AN", 1, 0, 5], ["AN", 1, 1, 6]]]], "r": [[4.87138e-06, 4.88576e-06, 4.88602e-06], 0, 2.92866, 1668051976], "v": "v0.6"}
{"i": [["[\"permute_attn_q_k_v\", 1, 14, 14, 512, 7, 16, \"float16\"]", "cuda -keys=cuda,gpu -max_num_threads=1024 -model=unknown -thread_warp_size=32", [-1, 16, 64, 49152, 2147483647, 1024, 8, 32], "", 0, []], [[], [["FU", 1, [0, 1, 2, 3]], ["SP", 1, 0, 100352, [2], 1], ["AN", 1, 0, 5], ["AN", 1, 1, 6]]]], "r": [[3.99984e-05, 4.00232e-05, 4.00116e-05], 0, 4.33212, 1668051978], "v": "v0.6"}
{"i": [["[\"permute_attn_q_k_v\", 1, 14, 14, 512, 7, 16, \"float16\"]", "cuda -keys=cuda,gpu -max_num_threads=1024 -model=unknown -thread_warp_size=32", [-1, 16, 64, 49152, 2147483647, 1024, 8, 32], "", 0, []], [[], [["FU", 1, [0, 1, 2, 3]], ["SP", 1, 0, 100352, [28], 1], ["AN", 1, 0, 5], ["AN", 1, 1, 6]]]], "r": [[5.33056e-06, 5.34179e-06, 5.3428e-06], 0, 3.2948, 1668051977], "v": "v0.6"}
{"i": [["[\"permute_attn_q_k_v\", 1, 14, 14, 512, 7, 16, \"float16\"]", "cuda -keys=cuda,gpu -max_num_threads=1024 -model=unknown -thread_warp_size=32", [-1, 16, 64, 49152, 2147483647, 1024, 8, 32], "", 0, []], [[], [["FU", 1, [0, 1, 2, 3]], ["SP", 1, 0, 100352, [16], 1], ["AN", 1, 0, 5], ["AN", 1, 1, 6]]]], "r": [[7.27756e-06, 7.2949e-06, 7.2944e-06], 0, 3.61706, 1668051977], "v": "v0.6"}
{"i": [["[\"permute_attn_q_k_v\", 1, 14, 14, 512, 7, 16, \"float16\"]", "cuda -keys=cuda,gpu -max_num_threads=1024 -model=unknown -thread_warp_size=32", [-1, 16, 64, 49152, 2147483647, 1024, 8, 32], "", 0, []], [[], [["FU", 1, [0, 1, 2, 3]], ["SP", 1, 0, 100352, [8], 1], ["AN", 1, 0, 5], ["AN", 1, 1, 6]]]], "r": [[1.20131e-05, 1.2024e-05, 1.20227e-05], 0, 3.95571, 1668051977], "v": "v0.6"}
{"i": [["[\"permute_attn_q_k_v\", 1, 14, 14, 512, 7, 16, \"float16\"]", "cuda -keys=cuda,gpu -max_num_threads=1024 -model=unknown -thread_warp_size=32", [-1, 16, 64, 49152, 2147483647, 1024, 8, 32], "", 0, []], [[], [["FU", 1, [0, 1, 2, 3]], ["SP", 1, 0, 100352, [49], 1], ["AN", 1, 0, 5], ["AN", 1, 1, 6]]]], "r": [[4.29875e-06, 4.31374e-06, 4.31621e-06], 0, 2.34403, 1668054019], "v": "v0.6"}
{"i": [["[\"permute_attn_q_k_v\", 1, 14, 14, 512, 7, 16, \"float16\"]", "cuda -keys=cuda,gpu -max_num_threads=1024 -model=unknown -thread_warp_size=32", [-1, 16, 64, 49152, 2147483647, 1024, 8, 32], "", 0, []], [[], [["FU", 1, [0, 1, 2, 3]], ["SP", 1, 0, 100352, [7], 1], ["AN", 1, 0, 5], ["AN", 1, 1, 6]]]], "r": [[1.33958e-05, 1.34077e-05, 1.3401e-05], 0, 1.30039, 1668054018], "v": "v0.6"}
{"i": [["[\"permute_attn_q_k_v\", 1, 14, 14, 512, 7, 16, \"float16\"]", "cuda -keys=cuda,gpu -max_num_threads=1024 -model=unknown -thread_warp_size=32", [-1, 16, 64, 49152, 2147483647, 1024, 8, 32], "", 0, []], [[], [["FU", 1, [0, 1, 2, 3]], ["SP", 1, 0, 100352, [32], 1], ["AN", 1, 0, 5], ["AN", 1, 1, 6]]]], "r": [[4.89602e-06, 4.90962e-06, 4.90507e-06], 0, 0.574012, 1668054017], "v": "v0.6"}
{"i": [["[\"permute_attn_q_k_v\", 1, 14, 14, 512, 7, 16, \"float16\"]", "cuda -keys=cuda,gpu -max_num_threads=1024 -model=unknown -thread_warp_size=32", [-1, 16, 64, 49152, 2147483647, 1024, 8, 32], "", 0, []], [[], [["FU", 1, [0, 1, 2, 3]], ["SP", 1, 0, 100352, [56], 1], ["AN", 1, 0, 5], ["AN", 1, 1, 6]]]], "r": [[3.92993e-06, 3.94097e-06, 3.94113e-06], 0, 1.62829, 1668054018], "v": "v0.6"}
{"i": [["[\"permute_attn_q_k_v\", 1, 14, 14, 512, 7, 16, \"float16\"]", "cuda -keys=cuda,gpu -max_num_threads=1024 -model=unknown -thread_warp_size=32", [-1, 16, 64, 49152, 2147483647, 1024, 8, 32], "", 0, []], [[], [["FU", 1, [0, 1, 2, 3]], ["SP", 1, 0, 100352, [28], 1], ["AN", 1, 0, 5], ["AN", 1, 1, 6]]]], "r": [[5.25137e-06, 5.2634e-06, 5.26486e-06], 0, 0.902495, 1668054017], "v": "v0.6"}
{"i": [["[\"permute_attn_q_k_v\", 1, 14, 14, 512, 7, 16, \"float16\"]", "cuda -keys=cuda,gpu -max_num_threads=1024 -model=unknown -thread_warp_size=32", [-1, 16, 64, 49152, 2147483647, 1024, 8, 32], "", 0, []], [[], [["FU", 1, [0, 1, 2, 3]], ["SP", 1, 0, 100352, [14], 1], ["AN", 1, 0, 5], ["AN", 1, 1, 6]]]], "r": [[8.00938e-06, 8.03102e-06, 8.02434e-06], 0, 3.00895, 1668054019], "v": "v0.6"}
{"i": [["[\"permute_attn_q_k_v\", 1, 14, 14, 512, 7, 16, \"float16\"]", "cuda -keys=cuda,gpu -max_num_threads=1024 -model=unknown -thread_warp_size=32", [-1, 16, 64, 49152, 2147483647, 1024, 8, 32], "", 0, []], [[], [["FU", 1, [0, 1, 2, 3]], ["SP", 1, 0, 100352, [8], 1], ["AN", 1, 0, 5], ["AN", 1, 1, 6]]]], "r": [[1.21411e-05, 1.21555e-05, 1.21552e-05], 0, 1.97053, 1668054018], "v": "v0.6"}
{"i": [["[\"permute_attn_q_k_v\", 1, 14, 14, 512, 7, 16, \"float16\"]", "cuda -keys=cuda,gpu -max_num_threads=1024 -model=unknown -thread_warp_size=32", [-1, 16, 64, 49152, 2147483647, 1024, 8, 32], "", 0, []], [[], [["FU", 1, [0, 1, 2, 3]], ["SP", 1, 0, 100352, [4], 1], ["AN", 1, 0, 5], ["AN", 1, 1, 6]]]], "r": [[2.14424e-05, 2.14605e-05, 2.1455e-05], 0, 3.73724, 1668054020], "v": "v0.6"}
{"i": [["[\"permute_attn_q_k_v\", 1, 14, 14, 512, 7, 16, \"float16\"]", "cuda -keys=cuda,gpu -max_num_threads=1024 -model=unknown -thread_warp_size=32", [-1, 16, 64, 49152, 2147483647, 1024, 8, 32], "", 0, []], [[], [["FU", 1, [0, 1, 2, 3]], ["SP", 1, 0, 100352, [1], 1], ["AN", 1, 0, 5], ["AN", 1, 1, 6]]]], "r": [[7.71653e-05, 7.71774e-05, 7.71838e-05], 0, 3.39129, 1668054020], "v": "v0.6"}
{"i": [["[\"permute_attn_q_k_v\", 1, 14, 14, 512, 7, 16, \"float16\"]", "cuda -keys=cuda,gpu -max_num_threads=1024 -model=unknown -thread_warp_size=32", [-1, 16, 64, 49152, 2147483647, 1024, 8, 32], "", 0, []], [[], [["FU", 1, [0, 1, 2, 3]], ["SP", 1, 0, 100352, [2], 1], ["AN", 1, 0, 5], ["AN", 1, 1, 6]]]], "r": [[4.00407e-05, 4.0037e-05, 4.00347e-05], 0, 2.66462, 1668054019], "v": "v0.6"}
{"i": [["[\"permute_attn_q_k_v\", 1, 14, 14, 512, 7, 16, \"float16\"]", "cuda -keys=cuda,gpu -max_num_threads=1024 -model=unknown -thread_warp_size=32", [-1, 16, 64, 49152, 2147483647, 1024, 8, 32], "", 0, []], [[], [["FU", 1, [0, 1, 2, 3]], ["SP", 1, 0, 100352, [64], 1], ["AN", 1, 0, 5], ["AN", 1, 1, 6]]]], "r": [[3.9154e-06, 3.92836e-06, 3.92948e-06], 0, 4.43301, 1668054021], "v": "v0.6"}
{"i": [["[\"permute_attn_q_k_v\", 1, 14, 14, 512, 7, 16, \"float16\"]", "cuda -keys=cuda,gpu -max_num_threads=1024 -model=unknown -thread_warp_size=32", [-1, 16, 64, 49152, 2147483647, 1024, 8, 32], "", 0, []], [[], [["FU", 1, [0, 1, 2, 3]], ["SP", 1, 0, 100352, [16], 1], ["AN", 1, 0, 5], ["AN", 1, 1, 6]]]], "r": [[7.35771e-06, 7.38801e-06, 7.38959e-06], 0, 4.05836, 1668054020], "v": "v0.6"}
{"i": [["[\"permute_attn_q_k_v\", 1, 14, 14, 512, 7, 16, \"float16\"]", "cuda -keys=cuda,gpu -max_num_threads=1024 -model=unknown -thread_warp_size=32", [-1, 16, 64, 49152, 2147483647, 1024, 8, 32], "", 0, []], [[], [["FU", 1, [0, 1, 2, 3]], ["SP", 1, 0, 100352, [7], 1], ["AN", 1, 0, 5], ["AN", 1, 1, 6]]]], "r": [[1.34359e-05, 1.34349e-05, 1.34446e-05], 0, 1.60773, 1668054035], "v": "v0.6"}
{"i": [["[\"permute_attn_q_k_v\", 1, 14, 14, 512, 7, 16, \"float16\"]", "cuda -keys=cuda,gpu -max_num_threads=1024 -model=unknown -thread_warp_size=32", [-1, 16, 64, 49152, 2147483647, 1024, 8, 32], "", 0, []], [[], [["FU", 1, [0, 1, 2, 3]], ["SP", 1, 0, 100352, [14], 1], ["AN", 1, 0, 5], ["AN", 1, 1, 6]]]], "r": [[8.21721e-06, 8.22901e-06, 8.22932e-06], 0, 1.96762, 1668054035], "v": "v0.6"}
{"i": [["[\"permute_attn_q_k_v\", 1, 14, 14, 512, 7, 16, \"float16\"]", "cuda -keys=cuda,gpu -max_num_threads=1024 -model=unknown -thread_warp_size=32", [-1, 16, 64, 49152, 2147483647, 1024, 8, 32], "", 0, []], [[], [["FU", 1, [0, 1, 2, 3]], ["SP", 1, 0, 100352, [32], 1], ["AN", 1, 0, 5], ["AN", 1, 1, 6]]]], "r": [[5.11416e-06, 5.11891e-06, 5.12679e-06], 0, 0.911619, 1668054034], "v": "v0.6"}
{"i": [["[\"permute_attn_q_k_v\", 1, 14, 14, 512, 7, 16, \"float16\"]", "cuda -keys=cuda,gpu -max_num_threads=1024 -model=unknown -thread_warp_size=32", [-1, 16, 64, 49152, 2147483647, 1024, 8, 32], "", 0, []], [[], [["FU", 1, [0, 1, 2, 3]], ["SP", 1, 0, 100352, [16], 1], ["AN", 1, 0, 5], ["AN", 1, 1, 6]]]], "r": [[7.24402e-06, 7.25553e-06, 7.25497e-06], 0, 0.581134, 1668054034], "v": "v0.6"}
{"i": [["[\"permute_attn_q_k_v\", 1, 14, 14, 512, 7, 16, \"float16\"]", "cuda -keys=cuda,gpu -max_num_threads=1024 -model=unknown -thread_warp_size=32", [-1, 16, 64, 49152, 2147483647, 1024, 8, 32], "", 0, []], [[], [["FU", 1, [0, 1, 2, 3]], ["SP", 1, 0, 100352, [8], 1], ["AN", 1, 0, 5], ["AN", 1, 1, 6]]]], "r": [[1.20322e-05, 1.20459e-05, 1.2042e-05], 0, 1.29002, 1668054035], "v": "v0.6"}
{"i": [["[\"permute_attn_q_k_v\", 1, 14, 14, 512, 7, 16, \"float16\"]", "cuda -keys=cuda,gpu -max_num_threads=1024 -model=unknown -thread_warp_size=32", [-1, 16, 64, 49152, 2147483647, 1024, 8, 32], "", 0, []], [[], [["FU", 1, [0, 1, 2, 3]], ["SP", 1, 0, 100352, [28], 1], ["AN", 1, 0, 5], ["AN", 1, 1, 6]]]], "r": [[5.28748e-06, 5.28866e-06, 5.29604e-06], 0, 2.68524, 1668054036], "v": "v0.6"}
{"i": [["[\"permute_attn_q_k_v\", 1, 14, 14, 512, 7, 16, \"float16\"]", "cuda -keys=cuda,gpu -max_num_threads=1024 -model=unknown -thread_warp_size=32", [-1, 16, 64, 49152, 2147483647, 1024, 8, 32], "", 0, []], [[], [["FU", 1, [0, 1, 2, 3]], ["SP", 1, 0, 100352, [4], 1], ["AN", 1, 0, 5], ["AN", 1, 1, 6]]]], "r": [[2.15206e-05, 2.15536e-05, 2.15505e-05], 0, 2.34778, 1668054036], "v": "v0.6"}
{"i": [["[\"permute_attn_q_k_v\", 1, 14, 14, 512, 7, 16, \"float16\"]", "cuda -keys=cuda,gpu -max_num_threads=1024 -model=unknown -thread_warp_size=32", [-1, 16, 64, 49152, 2147483647, 1024, 8, 32], "", 0, []], [[], [["FU", 1, [0, 1, 2, 3]], ["SP", 1, 0, 100352, [1], 1], ["AN", 1, 0, 5], ["AN", 1, 1, 6]]]], "r": [[7.72626e-05, 7.72782e-05, 7.72492e-05], 0, 2.98906, 1668054036], "v": "v0.6"}
{"i": [["[\"permute_attn_q_k_v\", 1, 14, 14, 512, 7, 16, \"float16\"]", "cuda -keys=cuda,gpu -max_num_threads=1024 -model=unknown -thread_warp_size=32", [-1, 16, 64, 49152, 2147483647, 1024, 8, 32], "", 0, []], [[], [["FU", 1, [0, 1, 2, 3]], ["SP", 1, 0, 100352, [56], 1], ["AN", 1, 0, 5], ["AN", 1, 1, 6]]]], "r": [[4.05346e-06, 4.0641e-06, 4.06447e-06], 0, 3.71624, 1668054037], "v": "v0.6"}
{"i": [["[\"permute_attn_q_k_v\", 1, 14, 14, 512, 7, 16, \"float16\"]", "cuda -keys=cuda,gpu -max_num_threads=1024 -model=unknown -thread_warp_size=32", [-1, 16, 64, 49152, 2147483647, 1024, 8, 32], "", 0, []], [[], [["FU", 1, [0, 1, 2, 3]], ["SP", 1, 0, 100352, [64], 1], ["AN", 1, 0, 5], ["AN", 1, 1, 6]]]], "r": [[3.71125e-06, 3.71811e-06, 3.71647e-06], 0, 3.37441, 1668054037], "v": "v0.6"}
{"i": [["[\"permute_attn_q_k_v\", 1, 14, 14, 512, 7, 16, \"float16\"]", "cuda -keys=cuda,gpu -max_num_threads=1024 -model=unknown -thread_warp_size=32", [-1, 16, 64, 49152, 2147483647, 1024, 8, 32], "", 0, []], [[], [["FU", 1, [0, 1, 2, 3]], ["SP", 1, 0, 100352, [2], 1], ["AN", 1, 0, 5], ["AN", 1, 1, 6]]]], "r": [[3.98757e-05, 3.98803e-05, 3.9874e-05], 0, 4.43679, 1668054038], "v": "v0.6"}
{"i": [["[\"permute_attn_q_k_v\", 1, 14, 14, 512, 7, 16, \"float16\"]", "cuda -keys=cuda,gpu -max_num_threads=1024 -model=unknown -thread_warp_size=32", [-1, 16, 64, 49152, 2147483647, 1024, 8, 32], "", 0, []], [[], [["FU", 1, [0, 1, 2, 3]], ["SP", 1, 0, 100352, [49], 1], ["AN", 1, 0, 5], ["AN", 1, 1, 6]]]], "r": [[4.26654e-06, 4.28281e-06, 4.28133e-06], 0, 4.05046, 1668054038], "v": "v0.6"}
{"i": [["[\"permute_attn_q_k_v\", 1, 14, 14, 512, 7, 16, \"float16\"]", "cuda -keys=cuda,gpu -max_num_threads=1024 -model=unknown -thread_warp_size=32", [-1, 16, 64, 49152, 2147483647, 1024, 8, 32], "", 0, []], [[], [["FU", 1, [0, 1, 2, 3]], ["SP", 1, 0, 100352, [56], 1], ["AN", 1, 0, 5], ["AN", 1, 1, 6]]]], "r": [[3.91661e-06, 3.92917e-06, 3.93214e-06], 0, 0.576933, 1668054051], "v": "v0.6"}
{"i": [["[\"permute_attn_q_k_v\", 1, 14, 14, 512, 7, 16, \"float16\"]", "cuda -keys=cuda,gpu -max_num_threads=1024 -model=unknown -thread_warp_size=32", [-1, 16, 64, 49152, 2147483647, 1024, 8, 32], "", 0, []], [[], [["FU", 1, [0, 1, 2, 3]], ["SP", 1, 0, 100352, [14], 1], ["AN", 1, 0, 5], ["AN", 1, 1, 6]]]], "r": [[8.0912e-06, 8.09612e-06, 8.09407e-06], 0, 1.29968, 1668054052], "v": "v0.6"}
{"i": [["[\"permute_attn_q_k_v\", 1, 14, 14, 512, 7, 16, \"float16\"]", "cuda -keys=cuda,gpu -max_num_threads=1024 -model=unknown -thread_warp_size=32", [-1, 16, 64, 49152, 2147483647, 1024, 8, 32], "", 0, []], [[], [["FU", 1, [0, 1, 2, 3]], ["SP", 1, 0, 100352, [8], 1], ["AN", 1, 0, 5], ["AN", 1, 1, 6]]]], "r": [[1.20779e-05, 1.20947e-05, 1.20979e-05], 0, 2.33278, 1668054053], "v": "v0.6"}
{"i": [["[\"permute_attn_q_k_v\", 1, 14, 14, 512, 7, 16, \"float16\"]", "cuda -keys=cuda,gpu -max_num_threads=1024 -model=unknown -thread_warp_size=32", [-1, 16, 64, 49152, 2147483647, 1024, 8, 32], "", 0, []], [[], [["FU", 1, [0, 1, 2, 3]], ["SP", 1, 0, 100352, [2], 1], ["AN", 1, 0, 5], ["AN", 1, 1, 6]]]], "r": [[3.99715e-05, 3.9987e-05, 3.99764e-05], 0, 0.923933, 1668054051], "v": "v0.6"}
{"i": [["[\"permute_attn_q_k_v\", 1, 14, 14, 512, 7, 16, \"float16\"]", "cuda -keys=cuda,gpu -max_num_threads=1024 -model=unknown -thread_warp_size=32", [-1, 16, 64, 49152, 2147483647, 1024, 8, 32], "", 0, []], [[], [["FU", 1, [0, 1, 2, 3]], ["SP", 1, 0, 100352, [28], 1], ["AN", 1, 0, 5], ["AN", 1, 1, 6]]]], "r": [[5.43542e-06, 5.45933e-06, 5.4608e-06], 0, 1.64984, 1668054052], "v": "v0.6"}
{"i": [["[\"permute_attn_q_k_v\", 1, 14, 14, 512, 7, 16, \"float16\"]", "cuda -keys=cuda,gpu -max_num_threads=1024 -model=unknown -thread_warp_size=32", [-1, 16, 64, 49152, 2147483647, 1024, 8, 32], "", 0, []], [[], [["FU", 1, [0, 1, 2, 3]], ["SP", 1, 0, 100352, [7], 1], ["AN", 1, 0, 5], ["AN", 1, 1, 6]]]], "r": [[1.3571e-05, 1.35798e-05, 1.35735e-05], 0, 2.67573, 1668054053], "v": "v0.6"}
{"i": [["[\"permute_attn_q_k_v\", 1, 14, 14, 512, 7, 16, \"float16\"]", "cuda -keys=cuda,gpu -max_num_threads=1024 -model=unknown -thread_warp_size=32", [-1, 16, 64, 49152, 2147483647, 1024, 8, 32], "", 0, []], [[], [["FU", 1, [0, 1, 2, 3]], ["SP", 1, 0, 100352, [16], 1], ["AN", 1, 0, 5], ["AN", 1, 1, 6]]]], "r": [[7.29325e-06, 7.30353e-06, 7.29848e-06], 0, 1.95598, 1668054052], "v": "v0.6"}
{"i": [["[\"permute_attn_q_k_v\", 1, 14, 14, 512, 7, 16, \"float16\"]", "cuda -keys=cuda,gpu -max_num_threads=1024 -model=unknown -thread_warp_size=32", [-1, 16, 64, 49152, 2147483647, 1024, 8, 32], "", 0, []], [[], [["FU", 1, [0, 1, 2, 3]], ["SP", 1, 0, 100352, [1], 1], ["AN", 1, 0, 5], ["AN", 1, 1, 6]]]], "r": [[7.71731e-05, 7.71529e-05, 7.7162e-05], 0, 3.01486, 1668054054], "v": "v0.6"}
{"i": [["[\"permute_attn_q_k_v\", 1, 14, 14, 512, 7, 16, \"float16\"]", "cuda -keys=cuda,gpu -max_num_threads=1024 -model=unknown -thread_warp_size=32", [-1, 16, 64, 49152, 2147483647, 1024, 8, 32], "", 0, []], [[], [["FU", 1, [0, 1, 2, 3]], ["SP", 1, 0, 100352, [49], 1], ["AN", 1, 0, 5], ["AN", 1, 1, 6]]]], "r": [[4.15329e-06, 4.15766e-06, 4.16089e-06], 0, 4.45227, 1668054055], "v": "v0.6"}
{"i": [["[\"permute_attn_q_k_v\", 1, 14, 14, 512, 7, 16, \"float16\"]", "cuda -keys=cuda,gpu -max_num_threads=1024 -model=unknown -thread_warp_size=32", [-1, 16, 64, 49152, 2147483647, 1024, 8, 32], "", 0, []], [[], [["FU", 1, [0, 1, 2, 3]], ["SP", 1, 0, 100352, [32], 1], ["AN", 1, 0, 5], ["AN", 1, 1, 6]]]], "r": [[4.95752e-06, 4.96993e-06, 4.96784e-06], 0, 3.72077, 1668054054], "v": "v0.6"}
{"i": [["[\"permute_attn_q_k_v\", 1, 14, 14, 512, 7, 16, \"float16\"]", "cuda -keys=cuda,gpu -max_num_threads=1024 -model=unknown -thread_warp_size=32", [-1, 16, 64, 49152, 2147483647, 1024, 8, 32], "", 0, []], [[], [["FU", 1, [0, 1, 2, 3]], ["SP", 1, 0, 100352, [64], 1], ["AN", 1, 0, 5], ["AN", 1, 1, 6]]]], "r": [[3.93122e-06, 3.94551e-06, 3.93993e-06], 0, 3.38712, 1668054054], "v": "v0.6"}
{"i": [["[\"permute_attn_q_k_v\", 1, 14, 14, 512, 7, 16, \"float16\"]", "cuda -keys=cuda,gpu -max_num_threads=1024 -model=unknown -thread_warp_size=32", [-1, 16, 64, 49152, 2147483647, 1024, 8, 32], "", 0, []], [[], [["FU", 1, [0, 1, 2, 3]], ["SP", 1, 0, 100352, [4], 1], ["AN", 1, 0, 5], ["AN", 1, 1, 6]]]], "r": [[2.15719e-05, 2.15857e-05, 2.15747e-05], 0, 4.0675, 1668054055], "v": "v0.6"}
{"i": [["[\"permute_attn_q_k_v\", 1, 14, 14, 512, 7, 16, \"float16\"]", "cuda -keys=cuda,gpu -max_num_threads=1024 -model=unknown -thread_warp_size=32", [-1, 16, 64, 49152, 2147483647, 1024, 8, 32], "", 0, []], [[], [["FU", 1, [0, 1, 2, 3]], ["SP", 1, 0, 100352, [2], 1], ["AN", 1, 0, 5], ["AN", 1, 1, 6]]]], "r": [[3.99816e-05, 3.99908e-05, 3.99941e-05], 0, 1.64054, 1668054452], "v": "v0.6"}
{"i": [["[\"permute_attn_q_k_v\", 1, 14, 14, 512, 7, 16, \"float16\"]", "cuda -keys=cuda,gpu -max_num_threads=1024 -model=unknown -thread_warp_size=32", [-1, 16, 64, 49152, 2147483647, 1024, 8, 32], "", 0, []], [[], [["FU", 1, [0, 1, 2, 3]], ["SP", 1, 0, 100352, [16], 1], ["AN", 1, 0, 5], ["AN", 1, 1, 6]]]], "r": [[7.24421e-06, 7.26046e-06, 7.25686e-06], 0, 0.58859, 1668054451], "v": "v0.6"}
{"i": [["[\"permute_attn_q_k_v\", 1, 14, 14, 512, 7, 16, \"float16\"]", "cuda -keys=cuda,gpu -max_num_threads=1024 -model=unknown -thread_warp_size=32", [-1, 16, 64, 49152, 2147483647, 1024, 8, 32], "", 0, []], [[], [["FU", 1, [0, 1, 2, 3]], ["SP", 1, 0, 100352, [4], 1], ["AN", 1, 0, 5], ["AN", 1, 1, 6]]]], "r": [[2.13386e-05, 2.13502e-05, 2.13486e-05], 0, 1.97976, 1668054453], "v": "v0.6"}
{"i": [["[\"permute_attn_q_k_v\", 1, 14, 14, 512, 7, 16, \"float16\"]", "cuda -keys=cuda,gpu -max_num_threads=1024 -model=unknown -thread_warp_size=32", [-1, 16, 64, 49152, 2147483647, 1024, 8, 32], "", 0, []], [[], [["FU", 1, [0, 1, 2, 3]], ["SP", 1, 0, 100352, [56], 1], ["AN", 1, 0, 5], ["AN", 1, 1, 6]]]], "r": [[3.90684e-06, 3.91951e-06, 3.91775e-06], 0, 0.908783, 1668054452], "v": "v0.6"}
{"i": [["[\"permute_attn_q_k_v\", 1, 14, 14, 512, 7, 16, \"float16\"]", "cuda -keys=cuda,gpu -max_num_threads=1024 -model=unknown -thread_warp_size=32", [-1, 16, 64, 49152, 2147483647, 1024, 8, 32], "", 0, []], [[], [["FU", 1, [0, 1, 2, 3]], ["SP", 1, 0, 100352, [7], 1], ["AN", 1, 0, 5], ["AN", 1, 1, 6]]]], "r": [[1.33888e-05, 1.34057e-05, 1.33981e-05], 0, 1.30125, 1668054452], "v": "v0.6"}
{"i": [["[\"permute_attn_q_k_v\", 1, 14, 14, 512, 7, 16, \"float16\"]", "cuda -keys=cuda,gpu -max_num_threads=1024 -model=unknown -thread_warp_size=32", [-1, 16, 64, 49152, 2147483647, 1024, 8, 32], "", 0, []], [[], [["FU", 1, [0, 1, 2, 3]], ["SP", 1, 0, 100352, [1], 1], ["AN", 1, 0, 5], ["AN", 1, 1, 6]]]], "r": [[7.72193e-05, 7.72562e-05, 7.72302e-05], 0, 2.70798, 1668054453], "v": "v0.6"}
{"i": [["[\"permute_attn_q_k_v\", 1, 14, 14, 512, 7, 16, \"float16\"]", "cuda -keys=cuda,gpu -max_num_threads=1024 -model=unknown -thread_warp_size=32", [-1, 16, 64, 49152, 2147483647, 1024, 8, 32], "", 0, []], [[], [["FU", 1, [0, 1, 2, 3]], ["SP", 1, 0, 100352, [14], 1], ["AN", 1, 0, 5], ["AN", 1, 1, 6]]]], "r": [[7.95252e-06, 7.96078e-06, 7.96071e-06], 0, 2.3504, 1668054453], "v": "v0.6"}
{"i": [["[\"permute_attn_q_k_v\", 1, 14, 14, 512, 7, 16, \"float16\"]", "cuda -keys=cuda,gpu -max_num_threads=1024 -model=unknown -thread_warp_size=32", [-1, 16, 64, 49152, 2147483647, 1024, 8, 32], "", 0, []], [[], [["FU", 1, [0, 1, 2, 3]], ["SP", 1, 0, 100352, [64], 1], ["AN", 1, 0, 5], ["AN", 1, 1, 6]]]], "r": [[3.86276e-06, 3.88661e-06, 3.88802e-06], 0, 3.02728, 1668054454], "v": "v0.6"}
{"i": [["[\"permute_attn_q_k_v\", 1, 14, 14, 512, 7, 16, \"float16\"]", "cuda -keys=cuda,gpu -max_num_threads=1024 -model=unknown -thread_warp_size=32", [-1, 16, 64, 49152, 2147483647, 1024, 8, 32], "", 0, []], [[], [["FU", 1, [0, 1, 2, 3]], ["SP", 1, 0, 100352, [49], 1], ["AN", 1, 0, 5], ["AN", 1, 1, 6]]]], "r": [[4.06243e-06, 4.0737e-06, 4.07318e-06], 0, 3.72892, 1668054454], "v": "v0.6"}
{"i": [["[\"permute_attn_q_k_v\", 1, 14, 14, 512, 7, 16, \"float16\"]", "cuda -keys=cuda,gpu -max_num_threads=1024 -model=unknown -thread_warp_size=32", [-1, 16, 64, 49152, 2147483647, 1024, 8, 32], "", 0, []], [[], [["FU", 1, [0, 1, 2, 3]], ["SP", 1, 0, 100352, [28], 1], ["AN", 1, 0, 5], ["AN", 1, 1, 6]]]], "r": [[5.47598e-06, 5.49424e-06, 5.49326e-06], 0, 4.45678, 1668054455], "v": "v0.6"}
{"i": [["[\"permute_attn_q_k_v\", 1, 14, 14, 512, 7, 16, \"float16\"]", "cuda -keys=cuda,gpu -max_num_threads=1024 -model=unknown -thread_warp_size=32", [-1, 16, 64, 49152, 2147483647, 1024, 8, 32], "", 0, []], [[], [["FU", 1, [0, 1, 2, 3]], ["SP", 1, 0, 100352, [8], 1], ["AN", 1, 0, 5], ["AN", 1, 1, 6]]]], "r": [[1.20753e-05, 1.20834e-05, 1.2086e-05], 0, 4.07535, 1668054455], "v": "v0.6"}
{"i": [["[\"permute_attn_q_k_v\", 1, 14, 14, 512, 7, 16, \"float16\"]", "cuda -keys=cuda,gpu -max_num_threads=1024 -model=unknown -thread_warp_size=32", [-1, 16, 64, 49152, 2147483647, 1024, 8, 32], "", 0, []], [[], [["FU", 1, [0, 1, 2, 3]], ["SP", 1, 0, 100352, [32], 1], ["AN", 1, 0, 5], ["AN", 1, 1, 6]]]], "r": [[4.87196e-06, 4.88402e-06, 4.88524e-06], 0, 3.40477, 1668054454], "v": "v0.6"}
{"i": [["[\"permute_attn_q_k_v\", 1, 14, 14, 512, 7, 16, \"float16\"]", "cuda -keys=cuda,gpu -max_num_threads=1024 -model=unknown -thread_warp_size=32", [-1, 16, 64, 49152, 2147483647, 1024, 8, 32], "", 0, []], [[], [["FU", 1, [0, 1, 2, 3]], ["SP", 1, 0, 100352, [8], 1], ["AN", 1, 0, 5], ["AN", 1, 1, 6]]]], "r": [[1.20368e-05, 1.20519e-05, 1.20495e-05], 0, 1.31774, 1668054469], "v": "v0.6"}
{"i": [["[\"permute_attn_q_k_v\", 1, 14, 14, 512, 7, 16, \"float16\"]", "cuda -keys=cuda,gpu -max_num_threads=1024 -model=unknown -thread_warp_size=32", [-1, 16, 64, 49152, 2147483647, 1024, 8, 32], "", 0, []], [[], [["FU", 1, [0, 1, 2, 3]], ["SP", 1, 0, 100352, [32], 1], ["AN", 1, 0, 5], ["AN", 1, 1, 6]]]], "r": [[4.96763e-06, 4.97731e-06, 4.97825e-06], 0, 1.97353, 1668054470], "v": "v0.6"}
{"i": [["[\"permute_attn_q_k_v\", 1, 14, 14, 512, 7, 16, \"float16\"]", "cuda -keys=cuda,gpu -max_num_threads=1024 -model=unknown -thread_warp_size=32", [-1, 16, 64, 49152, 2147483647, 1024, 8, 32], "", 0, []], [[], [["FU", 1, [0, 1, 2, 3]], ["SP", 1, 0, 100352, [1], 1], ["AN", 1, 0, 5], ["AN", 1, 1, 6]]]], "r": [[7.7213e-05, 7.72413e-05, 7.72343e-05], 0, 0.589077, 1668054468], "v": "v0.6"}
{"i": [["[\"permute_attn_q_k_v\", 1, 14, 14, 512, 7, 16, \"float16\"]", "cuda -keys=cuda,gpu -max_num_threads=1024 -model=unknown -thread_warp_size=32", [-1, 16, 64, 49152, 2147483647, 1024, 8, 32], "", 0, []], [[], [["FU", 1, [0, 1, 2, 3]], ["SP", 1, 0, 100352, [4], 1], ["AN", 1, 0, 5], ["AN", 1, 1, 6]]]], "r": [[2.14473e-05, 2.14634e-05, 2.14557e-05], 0, 1.65716, 1668054469], "v": "v0.6"}
{"i": [["[\"permute_attn_q_k_v\", 1, 14, 14, 512, 7, 16, \"float16\"]", "cuda -keys=cuda,gpu -max_num_threads=1024 -model=unknown -thread_warp_size=32", [-1, 16, 64, 49152, 2147483647, 1024, 8, 32], "", 0, []], [[], [["FU", 1, [0, 1, 2, 3]], ["SP", 1, 0, 100352, [64], 1], ["AN", 1, 0, 5], ["AN", 1, 1, 6]]]], "r": [[3.74354e-06, 3.75586e-06, 3.75656e-06], 0, 0.935981, 1668054469], "v": "v0.6"}
{"i": [["[\"permute_attn_q_k_v\", 1, 14, 14, 512, 7, 16, \"float16\"]", "cuda -keys=cuda,gpu -max_num_threads=1024 -model=unknown -thread_warp_size=32", [-1, 16, 64, 49152, 2147483647, 1024, 8, 32], "", 0, []], [[], [["FU", 1, [0, 1, 2, 3]], ["SP", 1, 0, 100352, [16], 1], ["AN", 1, 0, 5], ["AN", 1, 1, 6]]]], "r": [[7.25966e-06, 7.28467e-06, 7.28472e-06], 0, 3.06515, 1668054471], "v": "v0.6"}
{"i": [["[\"permute_attn_q_k_v\", 1, 14, 14, 512, 7, 16, \"float16\"]", "cuda -keys=cuda,gpu -max_num_threads=1024 -model=unknown -thread_warp_size=32", [-1, 16, 64, 49152, 2147483647, 1024, 8, 32], "", 0, []], [[], [["FU", 1, [0, 1, 2, 3]], ["SP", 1, 0, 100352, [2], 1], ["AN", 1, 0, 5], ["AN", 1, 1, 6]]]], "r": [[3.98991e-05, 3.99167e-05, 3.99287e-05], 0, 2.38619, 1668054470], "v": "v0.6"}
{"i": [["[\"permute_attn_q_k_v\", 1, 14, 14, 512, 7, 16, \"float16\"]", "cuda -keys=cuda,gpu -max_num_threads=1024 -model=unknown -thread_warp_size=32", [-1, 16, 64, 49152, 2147483647, 1024, 8, 32], "", 0, []], [[], [["FU", 1, [0, 1, 2, 3]], ["SP", 1, 0, 100352, [28], 1], ["AN", 1, 0, 5], ["AN", 1, 1, 6]]]], "r": [[5.30313e-06, 5.32045e-06, 5.32138e-06], 0, 2.70874, 1668054471], "v": "v0.6"}
{"i": [["[\"permute_attn_q_k_v\", 1, 14, 14, 512, 7, 16, \"float16\"]", "cuda -keys=cuda,gpu -max_num_threads=1024 -model=unknown -thread_warp_size=32", [-1, 16, 64, 49152, 2147483647, 1024, 8, 32], "", 0, []], [[], [["FU", 1, [0, 1, 2, 3]], ["SP", 1, 0, 100352, [14], 1], ["AN", 1, 0, 5], ["AN", 1, 1, 6]]]], "r": [[7.93693e-06, 7.94926e-06, 7.95033e-06], 0, 3.46083, 1668054471], "v": "v0.6"}
{"i": [["[\"permute_attn_q_k_v\", 1, 14, 14, 512, 7, 16, \"float16\"]", "cuda -keys=cuda,gpu -max_num_threads=1024 -model=unknown -thread_warp_size=32", [-1, 16, 64, 49152, 2147483647, 1024, 8, 32], "", 0, []], [[], [["FU", 1, [0, 1, 2, 3]], ["SP", 1, 0, 100352, [49], 1], ["AN", 1, 0, 5], ["AN", 1, 1, 6]]]], "r": [[4.06629e-06, 4.07598e-06, 4.07415e-06], 0, 4.11178, 1668054472], "v": "v0.6"}
{"i": [["[\"permute_attn_q_k_v\", 1, 14, 14, 512, 7, 16, \"float16\"]", "cuda -keys=cuda,gpu -max_num_threads=1024 -model=unknown -thread_warp_size=32", [-1, 16, 64, 49152, 2147483647, 1024, 8, 32], "", 0, []], [[], [["FU", 1, [0, 1, 2, 3]], ["SP", 1, 0, 100352, [56], 1], ["AN", 1, 0, 5], ["AN", 1, 1, 6]]]], "r": [[4.0696e-06, 4.08044e-06, 4.0818e-06], 0, 3.77129, 1668054472], "v": "v0.6"}
{"i": [["[\"permute_attn_q_k_v\", 1, 14, 14, 512, 7, 16, \"float16\"]", "cuda -keys=cuda,gpu -max_num_threads=1024 -model=unknown -thread_warp_size=32", [-1, 16, 64, 49152, 2147483647, 1024, 8, 32], "", 0, []], [[], [["FU", 1, [0, 1, 2, 3]], ["SP", 1, 0, 100352, [7], 1], ["AN", 1, 0, 5], ["AN", 1, 1, 6]]]], "r": [[1.35268e-05, 1.35288e-05, 1.3525e-05], 0, 4.48709, 1668054472], "v": "v0.6"}
{"i": [["[\"permute_attn_q_k_v\", 1, 14, 14, 512, 7, 16, \"float16\"]", "cuda -keys=cuda,gpu -max_num_threads=1024 -model=unknown -thread_warp_size=32", [-1, 16, 64, 49152, 2147483647, 1024, 8, 32], "", 0, []], [[], [["FU", 1, [0, 1, 2, 3]], ["SP", 1, 0, 100352, [28], 1], ["AN", 1, 0, 5], ["AN", 1, 1, 6]]]], "r": [[5.49774e-06, 5.51626e-06, 5.50945e-06], 0, 1.64543, 1668054486], "v": "v0.6"}
{"i": [["[\"permute_attn_q_k_v\", 1, 14, 14, 512, 7, 16, \"float16\"]", "cuda -keys=cuda,gpu -max_num_threads=1024 -model=unknown -thread_warp_size=32", [-1, 16, 64, 49152, 2147483647, 1024, 8, 32], "", 0, []], [[], [["FU", 1, [0, 1, 2, 3]], ["SP", 1, 0, 100352, [49], 1], ["AN", 1, 0, 5], ["AN", 1, 1, 6]]]], "r": [[4.02678e-06, 4.03817e-06, 4.03806e-06], 0, 0.921136, 1668054486], "v": "v0.6"}
{"i": [["[\"permute_attn_q_k_v\", 1, 14, 14, 512, 7, 16, \"float16\"]", "cuda -keys=cuda,gpu -max_num_threads=1024 -model=unknown -thread_warp_size=32", [-1, 16, 64, 49152, 2147483647, 1024, 8, 32], "", 0, []], [[], [["FU", 1, [0, 1, 2, 3]], ["SP", 1, 0, 100352, [4], 1], ["AN", 1, 0, 5], ["AN", 1, 1, 6]]]], "r": [[2.13224e-05, 2.13368e-05, 2.13417e-05], 0, 2.36516, 1668054487], "v": "v0.6"}
{"i": [["[\"permute_attn_q_k_v\", 1, 14, 14, 512, 7, 16, \"float16\"]", "cuda -keys=cuda,gpu -max_num_threads=1024 -model=unknown -thread_warp_size=32", [-1, 16, 64, 49152, 2147483647, 1024, 8, 32], "", 0, []], [[], [["FU", 1, [0, 1, 2, 3]], ["SP", 1, 0, 100352, [2], 1], ["AN", 1, 0, 5], ["AN", 1, 1, 6]]]], "r": [[4.00325e-05, 4.00252e-05, 4.00521e-05], 0, 1.31758, 1668054486], "v": "v0.6"}
{"i": [["[\"permute_attn_q_k_v\", 1, 14, 14, 512, 7, 16, \"float16\"]", "cuda -keys=cuda,gpu -max_num_threads=1024 -model=unknown -thread_warp_size=32", [-1, 16, 64, 49152, 2147483647, 1024, 8, 32], "", 0, []], [[], [["FU", 1, [0, 1, 2, 3]], ["SP", 1, 0, 100352, [56], 1], ["AN", 1, 0, 5], ["AN", 1, 1, 6]]]], "r": [[3.93014e-06, 3.93848e-06, 3.94479e-06], 0, 0.585387, 1668054485], "v": "v0.6"}
{"i": [["[\"permute_attn_q_k_v\", 1, 14, 14, 512, 7, 16, \"float16\"]", "cuda -keys=cuda,gpu -max_num_threads=1024 -model=unknown -thread_warp_size=32", [-1, 16, 64, 49152, 2147483647, 1024, 8, 32], "", 0, []], [[], [["FU", 1, [0, 1, 2, 3]], ["SP", 1, 0, 100352, [14], 1], ["AN", 1, 0, 5], ["AN", 1, 1, 6]]]], "r": [[8.12888e-06, 8.14998e-06, 8.14425e-06], 0, 1.97169, 1668054487], "v": "v0.6"}
{"i": [["[\"permute_attn_q_k_v\", 1, 14, 14, 512, 7, 16, \"float16\"]", "cuda -keys=cuda,gpu -max_num_threads=1024 -model=unknown -thread_warp_size=32", [-1, 16, 64, 49152, 2147483647, 1024, 8, 32], "", 0, []], [[], [["FU", 1, [0, 1, 2, 3]], ["SP", 1, 0, 100352, [32], 1], ["AN", 1, 0, 5], ["AN", 1, 1, 6]]]], "r": [[4.94925e-06, 4.96602e-06, 4.96366e-06], 0, 3.04271, 1668054488], "v": "v0.6"}
{"i": [["[\"permute_attn_q_k_v\", 1, 14, 14, 512, 7, 16, \"float16\"]", "cuda -keys=cuda,gpu -max_num_threads=1024 -model=unknown -thread_warp_size=32", [-1, 16, 64, 49152, 2147483647, 1024, 8, 32], "", 0, []], [[], [["FU", 1, [0, 1, 2, 3]], ["SP", 1, 0, 100352, [1], 1], ["AN", 1, 0, 5], ["AN", 1, 1, 6]]]], "r": [[7.71492e-05, 7.71736e-05, 7.71569e-05], 0, 3.43398, 1668054488], "v": "v0.6"}
{"i": [["[\"permute_attn_q_k_v\", 1, 14, 14, 512, 7, 16, \"float16\"]", "cuda -keys=cuda,gpu -max_num_threads=1024 -model=unknown -thread_warp_size=32", [-1, 16, 64, 49152, 2147483647, 1024, 8, 32], "", 0, []], [[], [["FU", 1, [0, 1, 2, 3]], ["SP", 1, 0, 100352, [16], 1], ["AN", 1, 0, 5], ["AN", 1, 1, 6]]]], "r": [[7.26251e-06, 7.27666e-06, 7.27459e-06], 0, 2.70122, 1668054487], "v": "v0.6"}
{"i": [["[\"permute_attn_q_k_v\", 1, 14, 14, 512, 7, 16, \"float16\"]", "cuda -keys=cuda,gpu -max_num_threads=1024 -model=unknown -thread_warp_size=32", [-1, 16, 64, 49152, 2147483647, 1024, 8, 32], "", 0, []], [[], [["FU", 1, [0, 1, 2, 3]], ["SP", 1, 0, 100352, [8], 1], ["AN", 1, 0, 5], ["AN", 1, 1, 6]]]], "r": [[1.19844e-05, 1.19963e-05, 1.19964e-05], 0, 4.10534, 1668054489], "v": "v0.6"}
{"i": [["[\"permute_attn_q_k_v\", 1, 14, 14, 512, 7, 16, \"float16\"]", "cuda -keys=cuda,gpu -max_num_threads=1024 -model=unknown -thread_warp_size=32", [-1, 16, 64, 49152, 2147483647, 1024, 8, 32], "", 0, []], [[], [["FU", 1, [0, 1, 2, 3]], ["SP", 1, 0, 100352, [64], 1], ["AN", 1, 0, 5], ["AN", 1, 1, 6]]]], "r": [[3.72258e-06, 3.73588e-06, 3.73484e-06], 0, 4.49486, 1668054489], "v": "v0.6"}
{"i": [["[\"permute_attn_q_k_v\", 1, 14, 14, 512, 7, 16, \"float16\"]", "cuda -keys=cuda,gpu -max_num_threads=1024 -model=unknown -thread_warp_size=32", [-1, 16, 64, 49152, 2147483647, 1024, 8, 32], "", 0, []], [[], [["FU", 1, [0, 1, 2, 3]], ["SP", 1, 0, 100352, [7], 1], ["AN", 1, 0, 5], ["AN", 1, 1, 6]]]], "r": [[1.35523e-05, 1.35566e-05, 1.3564e-05], 0, 3.76806, 1668054489], "v": "v0.6"}
{"i": [["[\"permute_attn_q_k_v\", 1, 14, 14, 512, 7, 16, \"float16\"]", "cuda -keys=cuda,gpu -max_num_threads=1024 -model=unknown -thread_warp_size=32", [-1, 16, 64, 49152, 2147483647, 1024, 8, 32], "", 0, []], [[], [["FU", 1, [0, 1, 2, 3]], ["SP", 1, 0, 100352, [4], 1], ["AN", 1, 0, 5], ["AN", 1, 1, 6]]]], "r": [[2.14625e-05, 2.14789e-05, 2.14888e-05], 0, 0.623639, 1668054830], "v": "v0.6"}
{"i": [["[\"permute_attn_q_k_v\", 1, 14, 14, 512, 7, 16, \"float16\"]", "cuda -keys=cuda,gpu -max_num_threads=1024 -model=unknown -thread_warp_size=32", [-1, 16, 64, 49152, 2147483647, 1024, 8, 32], "", 0, []], [[], [["FU", 1, [0, 1, 2, 3]], ["SP", 1, 0, 100352, [64], 1], ["AN", 1, 0, 5], ["AN", 1, 1, 6]]]], "r": [[3.66272e-06, 3.67397e-06, 3.67126e-06], 0, 0.92116, 1668054831], "v": "v0.6"}
{"i": [["[\"permute_attn_q_k_v\", 1, 14, 14, 512, 7, 16, \"float16\"]", "cuda -keys=cuda,gpu -max_num_threads=1024 -model=unknown -thread_warp_size=32", [-1, 16, 64, 49152, 2147483647, 1024, 8, 32], "", 0, []], [[], [["FU", 1, [0, 1, 2, 3]], ["SP", 1, 0, 100352, [8], 1], ["AN", 1, 0, 5], ["AN", 1, 1, 6]]]], "r": [[1.20851e-05, 1.20989e-05, 1.21008e-05], 0, 1.99353, 1668054832], "v": "v0.6"}
{"i": [["[\"permute_attn_q_k_v\", 1, 14, 14, 512, 7, 16, \"float16\"]", "cuda -keys=cuda,gpu -max_num_threads=1024 -model=unknown -thread_warp_size=32", [-1, 16, 64, 49152, 2147483647, 1024, 8, 32], "", 0, []], [[], [["FU", 1, [0, 1, 2, 3]], ["SP", 1, 0, 100352, [16], 1], ["AN", 1, 0, 5], ["AN", 1, 1, 6]]]], "r": [[7.39191e-06, 7.39716e-06, 7.40015e-06], 0, 1.31839, 1668054831], "v": "v0.6"}
{"i": [["[\"permute_attn_q_k_v\", 1, 14, 14, 512, 7, 16, \"float16\"]", "cuda -keys=cuda,gpu -max_num_threads=1024 -model=unknown -thread_warp_size=32", [-1, 16, 64, 49152, 2147483647, 1024, 8, 32], "", 0, []], [[], [["FU", 1, [0, 1, 2, 3]], ["SP", 1, 0, 100352, [28], 1], ["AN", 1, 0, 5], ["AN", 1, 1, 6]]]], "r": [[5.37925e-06, 5.37969e-06, 5.38159e-06], 0, 1.63208, 1668054831], "v": "v0.6"}
{"i": [["[\"permute_attn_q_k_v\", 1, 14, 14, 512, 7, 16, \"float16\"]", "cuda -keys=cuda,gpu -max_num_threads=1024 -model=unknown -thread_warp_size=32", [-1, 16, 64, 49152, 2147483647, 1024, 8, 32], "", 0, []], [[], [["FU", 1, [0, 1, 2, 3]], ["SP", 1, 0, 100352, [1], 1], ["AN", 1, 0, 5], ["AN", 1, 1, 6]]]], "r": [[7.7156e-05, 7.71705e-05, 7.71837e-05], 0, 2.34949, 1668054832], "v": "v0.6"}
{"i": [["[\"permute_attn_q_k_v\", 1, 14, 14, 512, 7, 16, \"float16\"]", "cuda -keys=cuda,gpu -max_num_threads=1024 -model=unknown -thread_warp_size=32", [-1, 16, 64, 49152, 2147483647, 1024, 8, 32], "", 0, []], [[], [["FU", 1, [0, 1, 2, 3]], ["SP", 1, 0, 100352, [7], 1], ["AN", 1, 0, 5], ["AN", 1, 1, 6]]]], "r": [[1.34888e-05, 1.34957e-05, 1.35043e-05], 0, 3.02847, 1668054833], "v": "v0.6"}
{"i": [["[\"permute_attn_q_k_v\", 1, 14, 14, 512, 7, 16, \"float16\"]", "cuda -keys=cuda,gpu -max_num_threads=1024 -model=unknown -thread_warp_size=32", [-1, 16, 64, 49152, 2147483647, 1024, 8, 32], "", 0, []], [[], [["FU", 1, [0, 1, 2, 3]], ["SP", 1, 0, 100352, [2], 1], ["AN", 1, 0, 5], ["AN", 1, 1, 6]]]], "r": [[3.99209e-05, 3.99254e-05, 3.99283e-05], 0, 2.68171, 1668054832], "v": "v0.6"}
{"i": [["[\"permute_attn_q_k_v\", 1, 14, 14, 512, 7, 16, \"float16\"]", "cuda -keys=cuda,gpu -max_num_threads=1024 -model=unknown -thread_warp_size=32", [-1, 16, 64, 49152, 2147483647, 1024, 8, 32], "", 0, []], [[], [["FU", 1, [0, 1, 2, 3]], ["SP", 1, 0, 100352, [49], 1], ["AN", 1, 0, 5], ["AN", 1, 1, 6]]]], "r": [[4.15104e-06, 4.16038e-06, 4.15467e-06], 0, 3.40589, 1668054833], "v": "v0.6"}
{"i": [["[\"permute_attn_q_k_v\", 1, 14, 14, 512, 7, 16, \"float16\"]", "cuda -keys=cuda,gpu -max_num_threads=1024 -model=unknown -thread_warp_size=32", [-1, 16, 64, 49152, 2147483647, 1024, 8, 32], "", 0, []], [[], [["FU", 1, [0, 1, 2, 3]], ["SP", 1, 0, 100352, [32], 1], ["AN", 1, 0, 5], ["AN", 1, 1, 6]]]], "r": [[4.91955e-06, 4.93171e-06, 4.93138e-06], 0, 3.75525, 1668054834], "v": "v0.6"}
{"i": [["[\"permute_attn_q_k_v\", 1, 14, 14, 512, 7, 16, \"float16\"]", "cuda -keys=cuda,gpu -max_num_threads=1024 -model=unknown -thread_warp_size=32", [-1, 16, 64, 49152, 2147483647, 1024, 8, 32], "", 0, []], [[], [["FU", 1, [0, 1, 2, 3]], ["SP", 1, 0, 100352, [56], 1], ["AN", 1, 0, 5], ["AN", 1, 1, 6]]]], "r": [[3.84586e-06, 3.85846e-06, 3.85877e-06], 0, 4.05828, 1668054834], "v": "v0.6"}
{"i": [["[\"permute_attn_q_k_v\", 1, 14, 14, 512, 7, 16, \"float16\"]", "cuda -keys=cuda,gpu -max_num_threads=1024 -model=unknown -thread_warp_size=32", [-1, 16, 64, 49152, 2147483647, 1024, 8, 32], "", 0, []], [[], [["FU", 1, [0, 1, 2, 3]], ["SP", 1, 0, 100352, [14], 1], ["AN", 1, 0, 5], ["AN", 1, 1, 6]]]], "r": [[7.95917e-06, 7.9674e-06, 7.97108e-06], 0, 4.45976, 1668054834], "v": "v0.6"}
{"i": [["[\"permute_attn_q_k_v\", 1, 14, 14, 512, 7, 16, \"float16\"]", "cuda -keys=cuda,gpu -max_num_threads=1024 -model=unknown -thread_warp_size=32", [-1, 16, 64, 49152, 2147483647, 1024, 8, 32], "", 0, []], [[], [["FU", 1, [0, 1, 2, 3]], ["SP", 1, 0, 100352, [14], 1], ["AN", 1, 0, 5], ["AN", 1, 1, 6]]]], "r": [[7.99617e-06, 8.00788e-06, 8.00688e-06], 0, 1.31866, 1668054848], "v": "v0.6"}
{"i": [["[\"permute_attn_q_k_v\", 1, 14, 14, 512, 7, 16, \"float16\"]", "cuda -keys=cuda,gpu -max_num_threads=1024 -model=unknown -thread_warp_size=32", [-1, 16, 64, 49152, 2147483647, 1024, 8, 32], "", 0, []], [[], [["FU", 1, [0, 1, 2, 3]], ["SP", 1, 0, 100352, [56], 1], ["AN", 1, 0, 5], ["AN", 1, 1, 6]]]], "r": [[3.8985e-06, 3.90861e-06, 3.91023e-06], 0, 2.35621, 1668054849], "v": "v0.6"}
{"i": [["[\"permute_attn_q_k_v\", 1, 14, 14, 512, 7, 16, \"float16\"]", "cuda -keys=cuda,gpu -max_num_threads=1024 -model=unknown -thread_warp_size=32", [-1, 16, 64, 49152, 2147483647, 1024, 8, 32], "", 0, []], [[], [["FU", 1, [0, 1, 2, 3]], ["SP", 1, 0, 100352, [8], 1], ["AN", 1, 0, 5], ["AN", 1, 1, 6]]]], "r": [[1.20292e-05, 1.20478e-05, 1.20457e-05], 0, 0.597752, 1668054847], "v": "v0.6"}
{"i": [["[\"permute_attn_q_k_v\", 1, 14, 14, 512, 7, 16, \"float16\"]", "cuda -keys=cuda,gpu -max_num_threads=1024 -model=unknown -thread_warp_size=32", [-1, 16, 64, 49152, 2147483647, 1024, 8, 32], "", 0, []], [[], [["FU", 1, [0, 1, 2, 3]], ["SP", 1, 0, 100352, [32], 1], ["AN", 1, 0, 5], ["AN", 1, 1, 6]]]], "r": [[4.87716e-06, 4.87889e-06, 4.88292e-06], 0, 1.98773, 1668054849], "v": "v0.6"}
{"i": [["[\"permute_attn_q_k_v\", 1, 14, 14, 512, 7, 16, \"float16\"]", "cuda -keys=cuda,gpu -max_num_threads=1024 -model=unknown -thread_warp_size=32", [-1, 16, 64, 49152, 2147483647, 1024, 8, 32], "", 0, []], [[], [["FU", 1, [0, 1, 2, 3]], ["SP", 1, 0, 100352, [7], 1], ["AN", 1, 0, 5], ["AN", 1, 1, 6]]]], "r": [[1.3378e-05, 1.3391e-05, 1.33884e-05], 0, 0.943079, 1668054848], "v": "v0.6"}
{"i": [["[\"permute_attn_q_k_v\", 1, 14, 14, 512, 7, 16, \"float16\"]", "cuda -keys=cuda,gpu -max_num_threads=1024 -model=unknown -thread_warp_size=32", [-1, 16, 64, 49152, 2147483647, 1024, 8, 32], "", 0, []], [[], [["FU", 1, [0, 1, 2, 3]], ["SP", 1, 0, 100352, [2], 1], ["AN", 1, 0, 5], ["AN", 1, 1, 6]]]], "r": [[3.99205e-05, 3.99442e-05, 3.99453e-05], 0, 1.65313, 1668054848], "v": "v0.6"}
{"i": [["[\"permute_attn_q_k_v\", 1, 14, 14, 512, 7, 16, \"float16\"]", "cuda -keys=cuda,gpu -max_num_threads=1024 -model=unknown -thread_warp_size=32", [-1, 16, 64, 49152, 2147483647, 1024, 8, 32], "", 0, []], [[], [["FU", 1, [0, 1, 2, 3]], ["SP", 1, 0, 100352, [1], 1], ["AN", 1, 0, 5], ["AN", 1, 1, 6]]]], "r": [[7.7181e-05, 7.71822e-05, 7.7189e-05], 0, 2.6969, 1668054850], "v": "v0.6"}
{"i": [["[\"permute_attn_q_k_v\", 1, 14, 14, 512, 7, 16, \"float16\"]", "cuda -keys=cuda,gpu -max_num_threads=1024 -model=unknown -thread_warp_size=32", [-1, 16, 64, 49152, 2147483647, 1024, 8, 32], "", 0, []], [[], [["FU", 1, [0, 1, 2, 3]], ["SP", 1, 0, 100352, [64], 1], ["AN", 1, 0, 5], ["AN", 1, 1, 6]]]], "r": [[3.80504e-06, 3.81945e-06, 3.82114e-06], 0, 3.41032, 1668054850], "v": "v0.6"}
{"i": [["[\"permute_attn_q_k_v\", 1, 14, 14, 512, 7, 16, \"float16\"]", "cuda -keys=cuda,gpu -max_num_threads=1024 -model=unknown -thread_warp_size=32", [-1, 16, 64, 49152, 2147483647, 1024, 8, 32], "", 0, []], [[], [["FU", 1, [0, 1, 2, 3]], ["SP", 1, 0, 100352, [16], 1], ["AN", 1, 0, 5], ["AN", 1, 1, 6]]]], "r": [[7.29032e-06, 7.29969e-06, 7.29998e-06], 0, 4.49773, 1668054851], "v": "v0.6"}
{"i": [["[\"permute_attn_q_k_v\", 1, 14, 14, 512, 7, 16, \"float16\"]", "cuda -keys=cuda,gpu -max_num_threads=1024 -model=unknown -thread_warp_size=32", [-1, 16, 64, 49152, 2147483647, 1024, 8, 32], "", 0, []], [[], [["FU", 1, [0, 1, 2, 3]], ["SP", 1, 0, 100352, [28], 1], ["AN", 1, 0, 5], ["AN", 1, 1, 6]]]], "r": [[5.50594e-06, 5.51569e-06, 5.51536e-06], 0, 3.02413, 1668054850], "v": "v0.6"}
{"i": [["[\"permute_attn_q_k_v\", 1, 14, 14, 512, 7, 16, \"float16\"]", "cuda -keys=cuda,gpu -max_num_threads=1024 -model=unknown -thread_warp_size=32", [-1, 16, 64, 49152, 2147483647, 1024, 8, 32], "", 0, []], [[], [["FU", 1, [0, 1, 2, 3]], ["SP", 1, 0, 100352, [49], 1], ["AN", 1, 0, 5], ["AN", 1, 1, 6]]]], "r": [[4.15171e-06, 4.16901e-06, 4.17023e-06], 0, 4.09245, 1668054851], "v": "v0.6"}
{"i": [["[\"permute_attn_q_k_v\", 1, 14, 14, 512, 7, 16, \"float16\"]", "cuda -keys=cuda,gpu -max_num_threads=1024 -model=unknown -thread_warp_size=32", [-1, 16, 64, 49152, 2147483647, 1024, 8, 32], "", 0, []], [[], [["FU", 1, [0, 1, 2, 3]], ["SP", 1, 0, 100352, [4], 1], ["AN", 1, 0, 5], ["AN", 1, 1, 6]]]], "r": [[2.14434e-05, 2.14543e-05, 2.14569e-05], 0, 3.78424, 1668054851], "v": "v0.6"}
{"i": [["[\"permute_attn_q_k_v\", 1, 14, 14, 512, 7, 16, \"float16\"]", "cuda -keys=cuda,gpu -max_num_threads=1024 -model=unknown -thread_warp_size=32", [-1, 16, 64, 49152, 2147483647, 1024, 8, 32], "", 0, []], [[], [["FU", 1, [0, 1, 2, 3]], ["SP", 1, 0, 100352, [1], 1], ["AN", 1, 0, 5], ["AN", 1, 1, 6]]]], "r": [[7.7161e-05, 7.72004e-05, 7.71698e-05], 0, 1.29813, 1668054865], "v": "v0.6"}
{"i": [["[\"permute_attn_q_k_v\", 1, 14, 14, 512, 7, 16, \"float16\"]", "cuda -keys=cuda,gpu -max_num_threads=1024 -model=unknown -thread_warp_size=32", [-1, 16, 64, 49152, 2147483647, 1024, 8, 32], "", 0, []], [[], [["FU", 1, [0, 1, 2, 3]], ["SP", 1, 0, 100352, [56], 1], ["AN", 1, 0, 5], ["AN", 1, 1, 6]]]], "r": [[3.92667e-06, 3.93035e-06, 3.93383e-06], 0, 3.03832, 1668054867], "v": "v0.6"}
{"i": [["[\"permute_attn_q_k_v\", 1, 14, 14, 512, 7, 16, \"float16\"]", "cuda -keys=cuda,gpu -max_num_threads=1024 -model=unknown -thread_warp_size=32", [-1, 16, 64, 49152, 2147483647, 1024, 8, 32], "", 0, []], [[], [["FU", 1, [0, 1, 2, 3]], ["SP", 1, 0, 100352, [49], 1], ["AN", 1, 0, 5], ["AN", 1, 1, 6]]]], "r": [[4.05007e-06, 4.06235e-06, 4.06261e-06], 0, 2.36063, 1668054866], "v": "v0.6"}
{"i": [["[\"permute_attn_q_k_v\", 1, 14, 14, 512, 7, 16, \"float16\"]", "cuda -keys=cuda,gpu -max_num_threads=1024 -model=unknown -thread_warp_size=32", [-1, 16, 64, 49152, 2147483647, 1024, 8, 32], "", 0, []], [[], [["FU", 1, [0, 1, 2, 3]], ["SP", 1, 0, 100352, [16], 1], ["AN", 1, 0, 5], ["AN", 1, 1, 6]]]], "r": [[7.25748e-06, 7.26501e-06, 7.26521e-06], 0, 1.9725, 1668054866], "v": "v0.6"}
{"i": [["[\"permute_attn_q_k_v\", 1, 14, 14, 512, 7, 16, \"float16\"]", "cuda -keys=cuda,gpu -max_num_threads=1024 -model=unknown -thread_warp_size=32", [-1, 16, 64, 49152, 2147483647, 1024, 8, 32], "", 0, []], [[], [["FU", 1, [0, 1, 2, 3]], ["SP", 1, 0, 100352, [14], 1], ["AN", 1, 0, 5], ["AN", 1, 1, 6]]]], "r": [[8.0361e-06, 8.05373e-06, 8.04975e-06], 0, 0.914101, 1668054865], "v": "v0.6"}
{"i": [["[\"permute_attn_q_k_v\", 1, 14, 14, 512, 7, 16, \"float16\"]", "cuda -keys=cuda,gpu -max_num_threads=1024 -model=unknown -thread_warp_size=32", [-1, 16, 64, 49152, 2147483647, 1024, 8, 32], "", 0, []], [[], [["FU", 1, [0, 1, 2, 3]], ["SP", 1, 0, 100352, [2], 1], ["AN", 1, 0, 5], ["AN", 1, 1, 6]]]], "r": [[3.98924e-05, 3.99171e-05, 3.99098e-05], 0, 0.588126, 1668054864], "v": "v0.6"}
{"i": [["[\"permute_attn_q_k_v\", 1, 14, 14, 512, 7, 16, \"float16\"]", "cuda -keys=cuda,gpu -max_num_threads=1024 -model=unknown -thread_warp_size=32", [-1, 16, 64, 49152, 2147483647, 1024, 8, 32], "", 0, []], [[], [["FU", 1, [0, 1, 2, 3]], ["SP", 1, 0, 100352, [64], 1], ["AN", 1, 0, 5], ["AN", 1, 1, 6]]]], "r": [[3.76794e-06, 3.77929e-06, 3.77497e-06], 0, 2.70463, 1668054867], "v": "v0.6"}
{"i": [["[\"permute_attn_q_k_v\", 1, 14, 14, 512, 7, 16, \"float16\"]", "cuda -keys=cuda,gpu -max_num_threads=1024 -model=unknown -thread_warp_size=32", [-1, 16, 64, 49152, 2147483647, 1024, 8, 32], "", 0, []], [[], [["FU", 1, [0, 1, 2, 3]], ["SP", 1, 0, 100352, [8], 1], ["AN", 1, 0, 5], ["AN", 1, 1, 6]]]], "r": [[1.21288e-05, 1.21447e-05, 1.21609e-05], 0, 1.63139, 1668054865], "v": "v0.6"}
{"i": [["[\"permute_attn_q_k_v\", 1, 14, 14, 512, 7, 16, \"float16\"]", "cuda -keys=cuda,gpu -max_num_threads=1024 -model=unknown -thread_warp_size=32", [-1, 16, 64, 49152, 2147483647, 1024, 8, 32], "", 0, []], [[], [["FU", 1, [0, 1, 2, 3]], ["SP", 1, 0, 100352, [7], 1], ["AN", 1, 0, 5], ["AN", 1, 1, 6]]]], "r": [[1.34937e-05, 1.34968e-05, 1.34925e-05], 0, 3.3883, 1668054867], "v": "v0.6"}
{"i": [["[\"permute_attn_q_k_v\", 1, 14, 14, 512, 7, 16, \"float16\"]", "cuda -keys=cuda,gpu -max_num_threads=1024 -model=unknown -thread_warp_size=32", [-1, 16, 64, 49152, 2147483647, 1024, 8, 32], "", 0, []], [[], [["FU", 1, [0, 1, 2, 3]], ["SP", 1, 0, 100352, [32], 1], ["AN", 1, 0, 5], ["AN", 1, 1, 6]]]], "r": [[4.95595e-06, 4.96959e-06, 4.96784e-06], 0, 3.73191, 1668054868], "v": "v0.6"}
{"i": [["[\"permute_attn_q_k_v\", 1, 14, 14, 512, 7, 16, \"float16\"]", "cuda -keys=cuda,gpu -max_num_threads=1024 -model=unknown -thread_warp_size=32", [-1, 16, 64, 49152, 2147483647, 1024, 8, 32], "", 0, []], [[], [["FU", 1, [0, 1, 2, 3]], ["SP", 1, 0, 100352, [4], 1], ["AN", 1, 0, 5], ["AN", 1, 1, 6]]]], "r": [[2.14432e-05, 2.14493e-05, 2.14461e-05], 0, 4.0695, 1668054868], "v": "v0.6"}
{"i": [["[\"permute_attn_q_k_v\", 1, 14, 14, 512, 7, 16, \"float16\"]", "cuda -keys=cuda,gpu -max_num_threads=1024 -model=unknown -thread_warp_size=32", [-1, 16, 64, 49152, 2147483647, 1024, 8, 32], "", 0, []], [[], [["FU", 1, [0, 1, 2, 3]], ["SP", 1, 0, 100352, [28], 1], ["AN", 1, 0, 5], ["AN", 1, 1, 6]]]], "r": [[5.29662e-06, 5.31352e-06, 5.30963e-06], 0, 4.46257, 1668054868], "v": "v0.6"}
{"i": [["[\"permute_attn_q_k_v\", 1, 14, 14, 512, 7, 16, \"float16\"]", "cuda -keys=cuda,gpu -max_num_threads=1024 -model=unknown -thread_warp_size=32", [-1, 16, 64, 49152, 2147483647, 1024, 8, 32], "", 0, []], [[], [["FU", 1, [0, 1, 2, 3]], ["SP", 1, 0, 100352, [4], 1], ["AN", 1, 0, 5], ["AN", 1, 1, 6]]]], "r": [[2.13584e-05, 2.13692e-05, 2.13659e-05], 0, 2.63328, 1668055211], "v": "v0.6"}
{"i": [["[\"permute_attn_q_k_v\", 1, 14, 14, 512, 7, 16, \"float16\"]", "cuda -keys=cuda,gpu -max_num_threads=1024 -model=unknown -thread_warp_size=32", [-1, 16, 64, 49152, 2147483647, 1024, 8, 32], "", 0, []], [[], [["FU", 1, [0, 1, 2, 3]], ["SP", 1, 0, 100352, [7], 1], ["AN", 1, 0, 5], ["AN", 1, 1, 6]]]], "r": [[1.33227e-05, 1.33205e-05, 1.33251e-05], 0, 0.561843, 1668055209], "v": "v0.6"}
{"i": [["[\"permute_attn_q_k_v\", 1, 14, 14, 512, 7, 16, \"float16\"]", "cuda -keys=cuda,gpu -max_num_threads=1024 -model=unknown -thread_warp_size=32", [-1, 16, 64, 49152, 2147483647, 1024, 8, 32], "", 0, []], [[], [["FU", 1, [0, 1, 2, 3]], ["SP", 1, 0, 100352, [56], 1], ["AN", 1, 0, 5], ["AN", 1, 1, 6]]]], "r": [[3.89588e-06, 3.90755e-06, 3.90388e-06], 0, 1.90013, 1668055210], "v": "v0.6"}
{"i": [["[\"permute_attn_q_k_v\", 1, 14, 14, 512, 7, 16, \"float16\"]", "cuda -keys=cuda,gpu -max_num_threads=1024 -model=unknown -thread_warp_size=32", [-1, 16, 64, 49152, 2147483647, 1024, 8, 32], "", 0, []], [[], [["FU", 1, [0, 1, 2, 3]], ["SP", 1, 0, 100352, [8], 1], ["AN", 1, 0, 5], ["AN", 1, 1, 6]]]], "r": [[1.20439e-05, 1.20543e-05, 1.20529e-05], 0, 0.864362, 1668055209], "v": "v0.6"}
{"i": [["[\"permute_attn_q_k_v\", 1, 14, 14, 512, 7, 16, \"float16\"]", "cuda -keys=cuda,gpu -max_num_threads=1024 -model=unknown -thread_warp_size=32", [-1, 16, 64, 49152, 2147483647, 1024, 8, 32], "", 0, []], [[], [["FU", 1, [0, 1, 2, 3]], ["SP", 1, 0, 100352, [1], 1], ["AN", 1, 0, 5], ["AN", 1, 1, 6]]]], "r": [[7.72369e-05, 7.7224e-05, 7.72416e-05], 0, 1.26776, 1668055210], "v": "v0.6"}
{"i": [["[\"permute_attn_q_k_v\", 1, 14, 14, 512, 7, 16, \"float16\"]", "cuda -keys=cuda,gpu -max_num_threads=1024 -model=unknown -thread_warp_size=32", [-1, 16, 64, 49152, 2147483647, 1024, 8, 32], "", 0, []], [[], [["FU", 1, [0, 1, 2, 3]], ["SP", 1, 0, 100352, [16], 1], ["AN", 1, 0, 5], ["AN", 1, 1, 6]]]], "r": [[7.40984e-06, 7.42173e-06, 7.42152e-06], 0, 2.28956, 1668055211], "v": "v0.6"}
{"i": [["[\"permute_attn_q_k_v\", 1, 14, 14, 512, 7, 16, \"float16\"]", "cuda -keys=cuda,gpu -max_num_threads=1024 -model=unknown -thread_warp_size=32", [-1, 16, 64, 49152, 2147483647, 1024, 8, 32], "", 0, []], [[], [["FU", 1, [0, 1, 2, 3]], ["SP", 1, 0, 100352, [32], 1], ["AN", 1, 0, 5], ["AN", 1, 1, 6]]]], "r": [[4.87037e-06, 4.88672e-06, 4.88514e-06], 0, 2.95792, 1668055211], "v": "v0.6"}
{"i": [["[\"permute_attn_q_k_v\", 1, 14, 14, 512, 7, 16, \"float16\"]", "cuda -keys=cuda,gpu -max_num_threads=1024 -model=unknown -thread_warp_size=32", [-1, 16, 64, 49152, 2147483647, 1024, 8, 32], "", 0, []], [[], [["FU", 1, [0, 1, 2, 3]], ["SP", 1, 0, 100352, [64], 1], ["AN", 1, 0, 5], ["AN", 1, 1, 6]]]], "r": [[3.90555e-06, 3.91271e-06, 3.91529e-06], 0, 3.34593, 1668055212], "v": "v0.6"}
{"i": [["[\"permute_attn_q_k_v\", 1, 14, 14, 512, 7, 16, \"float16\"]", "cuda -keys=cuda,gpu -max_num_threads=1024 -model=unknown -thread_warp_size=32", [-1, 16, 64, 49152, 2147483647, 1024, 8, 32], "", 0, []], [[], [["FU", 1, [0, 1, 2, 3]], ["SP", 1, 0, 100352, [2], 1], ["AN", 1, 0, 5], ["AN", 1, 1, 6]]]], "r": [[4.00111e-05, 4.00124e-05, 4.001e-05], 0, 1.55971, 1668055210], "v": "v0.6"}
{"i": [["[\"permute_attn_q_k_v\", 1, 14, 14, 512, 7, 16, \"float16\"]", "cuda -keys=cuda,gpu -max_num_threads=1024 -model=unknown -thread_warp_size=32", [-1, 16, 64, 49152, 2147483647, 1024, 8, 32], "", 0, []], [[], [["FU", 1, [0, 1, 2, 3]], ["SP", 1, 0, 100352, [14], 1], ["AN", 1, 0, 5], ["AN", 1, 1, 6]]]], "r": [[8.08527e-06, 8.0996e-06, 8.10082e-06], 0, 3.62768, 1668055212], "v": "v0.6"}
{"i": [["[\"permute_attn_q_k_v\", 1, 14, 14, 512, 7, 16, \"float16\"]", "cuda -keys=cuda,gpu -max_num_threads=1024 -model=unknown -thread_warp_size=32", [-1, 16, 64, 49152, 2147483647, 1024, 8, 32], "", 0, []], [[], [["FU", 1, [0, 1, 2, 3]], ["SP", 1, 0, 100352, [28], 1], ["AN", 1, 0, 5], ["AN", 1, 1, 6]]]], "r": [[5.38078e-06, 5.37527e-06, 5.38239e-06], 0, 3.97685, 1668055212], "v": "v0.6"}
{"i": [["[\"permute_attn_q_k_v\", 1, 14, 14, 512, 7, 16, \"float16\"]", "cuda -keys=cuda,gpu -max_num_threads=1024 -model=unknown -thread_warp_size=32", [-1, 16, 64, 49152, 2147483647, 1024, 8, 32], "", 0, []], [[], [["FU", 1, [0, 1, 2, 3]], ["SP", 1, 0, 100352, [49], 1], ["AN", 1, 0, 5], ["AN", 1, 1, 6]]]], "r": [[4.08013e-06, 4.09913e-06, 4.10188e-06], 0, 4.35883, 1668055213], "v": "v0.6"}
{"i": [["[\"permute_attn_q_k_v\", 1, 14, 14, 512, 7, 16, \"float16\"]", "cuda -keys=cuda,gpu -max_num_threads=1024 -model=unknown -thread_warp_size=32", [-1, 16, 64, 49152, 2147483647, 1024, 8, 32], "", 0, []], [[], [["FU", 1, [0, 1, 2, 3]], ["SP", 1, 0, 100352, [32], 1], ["AN", 1, 0, 5], ["AN", 1, 1, 6]]]], "r": [[4.95738e-06, 4.97935e-06, 4.97976e-06], 0, 1.97423, 1668055227], "v": "v0.6"}
{"i": [["[\"permute_attn_q_k_v\", 1, 14, 14, 512, 7, 16, \"float16\"]", "cuda -keys=cuda,gpu -max_num_threads=1024 -model=unknown -thread_warp_size=32", [-1, 16, 64, 49152, 2147483647, 1024, 8, 32], "", 0, []], [[], [["FU", 1, [0, 1, 2, 3]], ["SP", 1, 0, 100352, [64], 1], ["AN", 1, 0, 5], ["AN", 1, 1, 6]]]], "r": [[3.66309e-06, 3.67321e-06, 3.67085e-06], 0, 0.916444, 1668055226], "v": "v0.6"}
{"i": [["[\"permute_attn_q_k_v\", 1, 14, 14, 512, 7, 16, \"float16\"]", "cuda -keys=cuda,gpu -max_num_threads=1024 -model=unknown -thread_warp_size=32", [-1, 16, 64, 49152, 2147483647, 1024, 8, 32], "", 0, []], [[], [["FU", 1, [0, 1, 2, 3]], ["SP", 1, 0, 100352, [2], 1], ["AN", 1, 0, 5], ["AN", 1, 1, 6]]]], "r": [[3.99434e-05, 3.99632e-05, 3.99648e-05], 0, 2.36125, 1668055227], "v": "v0.6"}
{"i": [["[\"permute_attn_q_k_v\", 1, 14, 14, 512, 7, 16, \"float16\"]", "cuda -keys=cuda,gpu -max_num_threads=1024 -model=unknown -thread_warp_size=32", [-1, 16, 64, 49152, 2147483647, 1024, 8, 32], "", 0, []], [[], [["FU", 1, [0, 1, 2, 3]], ["SP", 1, 0, 100352, [14], 1], ["AN", 1, 0, 5], ["AN", 1, 1, 6]]]], "r": [[8.0956e-06, 8.09629e-06, 8.09572e-06], 0, 1.30176, 1668055226], "v": "v0.6"}
{"i": [["[\"permute_attn_q_k_v\", 1, 14, 14, 512, 7, 16, \"float16\"]", "cuda -keys=cuda,gpu -max_num_threads=1024 -model=unknown -thread_warp_size=32", [-1, 16, 64, 49152, 2147483647, 1024, 8, 32], "", 0, []], [[], [["FU", 1, [0, 1, 2, 3]], ["SP", 1, 0, 100352, [4], 1], ["AN", 1, 0, 5], ["AN", 1, 1, 6]]]], "r": [[2.14035e-05, 2.14194e-05, 2.14226e-05], 0, 0.581656, 1668055226], "v": "v0.6"}
{"i": [["[\"permute_attn_q_k_v\", 1, 14, 14, 512, 7, 16, \"float16\"]", "cuda -keys=cuda,gpu -max_num_threads=1024 -model=unknown -thread_warp_size=32", [-1, 16, 64, 49152, 2147483647, 1024, 8, 32], "", 0, []], [[], [["FU", 1, [0, 1, 2, 3]], ["SP", 1, 0, 100352, [56], 1], ["AN", 1, 0, 5], ["AN", 1, 1, 6]]]], "r": [[3.9054e-06, 3.922e-06, 3.91924e-06], 0, 1.64028, 1668055227], "v": "v0.6"}
