python/models/swin_transformer/kernel_configs/swin_transformer_softmax_norm_25088_49.log
{"i": [["[\"softmax_norm\", 25088, 49]", "cuda -keys=cuda,gpu -max_num_threads=1024 -model=unknown -thread_warp_size=32", [-1, 16, 64, 49152, 2147483647, 1024, 8, 32], "", 0, []], [[], [["FU", 2, [0, 1, 2]], ["SP", 2, 0, 60236288, [56], 1], ["AN", 2, 0, 5], ["AN", 2, 1, 6]]]], "r": [[0.000801224, 0.000801286, 0.000800999], 0, 18.0783, 1668018577], "v": "v0.6"}
{"i": [["[\"softmax_norm\", 25088, 49]", "cuda -keys=cuda,gpu -max_num_threads=1024 -model=unknown -thread_warp_size=32", [-1, 16, 64, 49152, 2147483647, 1024, 8, 32], "", 0, []], [[], [["FU", 2, [0, 1, 2]], ["SP", 2, 0, 60236288, [28], 1], ["AN", 2, 0, 5], ["AN", 2, 1, 6]]]], "r": [[0.00160025, 0.00159979, 0.00159987], 0, 35.717, 1668018594], "v": "v0.6"}
{"i": [["[\"softmax_norm\", 25088, 49]", "cuda -keys=cuda,gpu -max_num_threads=1024 -model=unknown -thread_warp_size=32", [-1, 16, 64, 49152, 2147483647, 1024, 8, 32], "", 0, []], [[], [["FU", 2, [0, 1, 2]], ["SP", 2, 0, 60236288, [1], 1], ["AN", 2, 0, 5], ["AN", 2, 1, 6]]]], "r": [[0.0446338, 0.0446325, 0.0446349], 0, 9.37427, 1668018568], "v": "v0.6"}
{"i": [["[\"softmax_norm\", 25088, 49]", "cuda -keys=cuda,gpu -max_num_threads=1024 -model=unknown -thread_warp_size=32", [-1, 16, 64, 49152, 2147483647, 1024, 8, 32], "", 0, []], [[], [["FU", 2, [0, 1, 2]], ["SP", 2, 0, 60236288, [32], 1], ["AN", 2, 0, 5], ["AN", 2, 1, 6]]]], "r": [[0.00140057, 0.00140066, 0.0014004], 0, 4.56461, 1668018563], "v": "v0.6"}
{"i": [["[\"softmax_norm\", 25088, 49]", "cuda -keys=cuda,gpu -max_num_threads=1024 -model=unknown -thread_warp_size=32", [-1, 16, 64, 49152, 2147483647, 1024, 8, 32], "", 0, []], [[], [["FU", 2, [0, 1, 2]], ["SP", 2, 0, 60236288, [16], 1], ["AN", 2, 0, 5], ["AN", 2, 1, 6]]]], "r": [[0.00279523, 0.00279507, 0.00279483], 0, 13.7602, 1668018572], "v": "v0.6"}
{"i": [["[\"softmax_norm\", 25088, 49]", "cuda -keys=cuda,gpu -max_num_threads=1024 -model=unknown -thread_warp_size=32", [-1, 16, 64, 49152, 2147483647, 1024, 8, 32], "", 0, []], [[], [["FU", 2, [0, 1, 2]], ["SP", 2, 0, 60236288, [64], 1], ["AN", 2, 0, 5], ["AN", 2, 1, 6]]]], "r": [[0.000701563, 0.000701412, 0.00070137], 0, 31.3727, 1668018590], "v": "v0.6"}
{"i": [["[\"softmax_norm\", 25088, 49]", "cuda -keys=cuda,gpu -max_num_threads=1024 -model=unknown -thread_warp_size=32", [-1, 16, 64, 49152, 2147483647, 1024, 8, 32], "", 0, []], [[], [["FU", 2, [0, 1, 2]], ["SP", 2, 0, 60236288, [14], 1], ["AN", 2, 0, 5], ["AN", 2, 1, 6]]]], "r": [[0.00319374, 0.00319388, 0.00319358], 0, 27.0434, 1668018586], "v": "v0.6"}
{"i": [["[\"softmax_norm\", 25088, 49]", "cuda -keys=cuda,gpu -max_num_threads=1024 -model=unknown -thread_warp_size=32", [-1, 16, 64, 49152, 2147483647, 1024, 8, 32], "", 0, []], [[], [["FU", 2, [0, 1, 2]], ["SP", 2, 0, 60236288, [2], 1], ["AN", 2, 0, 5], ["AN", 2, 1, 6]]]], "r": [[0.0223198, 0.0223198, 0.0223195], 0, 22.6514, 1668018581], "v": "v0.6"}
{"i": [["[\"softmax_norm\", 25088, 49]", "cuda -keys=cuda,gpu -max_num_threads=1024 -model=unknown -thread_warp_size=32", [-1, 16, 64, 49152, 2147483647, 1024, 8, 32], "", 0, []], [[], [["FU", 2, [0, 1, 2]], ["SP", 2, 0, 60236288, [7], 1], ["AN", 2, 0, 5], ["AN", 2, 1, 6]]]], "r": [[0.0063804, 0.00638006, 0.00638037], 0, 40.1297, 1668018599], "v": "v0.6"}
{"i": [["[\"softmax_norm\", 25088, 49]", "cuda -keys=cuda,gpu -max_num_threads=1024 -model=unknown -thread_warp_size=32", [-1, 16, 64, 49152, 2147483647, 1024, 8, 32], "", 0, []], [[], [["FU", 2, [0, 1, 2]], ["SP", 2, 0, 60236288, [49], 1], ["AN", 2, 0, 5], ["AN", 2, 1, 6]]]], "r": [[0.000914955, 0.000914943, 0.00091504], 0, 44.4477, 1668018603], "v": "v0.6"}
{"i": [["[\"softmax_norm\", 25088, 49]", "cuda -keys=cuda,gpu -max_num_threads=1024 -model=unknown -thread_warp_size=32", [-1, 16, 64, 49152, 2147483647, 1024, 8, 32], "", 0, []], [[], [["FU", 2, [0, 1, 2]], ["SP", 2, 0, 60236288, [8], 1], ["AN", 2, 0, 5], ["AN", 2, 1, 6]]]], "r": [[0.0055838, 0.00558367, 0.0055839], 0, 48.8157, 1668018608], "v": "v0.6"}
{"i": [["[\"softmax_norm\", 25088, 49]", "cuda -keys=cuda,gpu -max_num_threads=1024 -model=unknown -thread_warp_size=32", [-1, 16, 64, 49152, 2147483647, 1024, 8, 32], "", 0, []], [[], [["FU", 2, [0, 1, 2]], ["SP", 2, 0, 60236288, [4], 1], ["AN", 2, 0, 5], ["AN", 2, 1, 6]]]], "r": [[0.0111628, 0.011163, 0.0111629], 0, 53.2892, 1668018612], "v": "v0.6"}
{"i": [["[\"softmax_norm\", 25088, 49]", "cuda -keys=cuda,gpu -max_num_threads=1024 -model=unknown -thread_warp_size=32", [-1, 16, 64, 49152, 2147483647, 1024, 8, 32], "", 0, []], [[], [["FU", 2, [0, 1, 2]], ["SP", 2, 0, 60236288, [2], 1], ["AN", 2, 0, 5], ["AN", 2, 1, 6]]]], "r": [[0.0223209, 0.0223209, 0.0223217], 0, 4.79761, 1668018871], "v": "v0.6"}
{"i": [["[\"softmax_norm\", 25088, 49]", "cuda -keys=cuda,gpu -max_num_threads=1024 -model=unknown -thread_warp_size=32", [-1, 16, 64, 49152, 2147483647, 1024, 8, 32], "", 0, []], [[], [["FU", 2, [0, 1, 2]], ["SP", 2, 0, 60236288, [7], 1], ["AN", 2, 0, 5], ["AN", 2, 1, 6]]]], "r": [[0.00638069, 0.0063804, 0.00638042], 0, 18.3121, 1668018885], "v": "v0.6"}
{"i": [["[\"softmax_norm\", 25088, 49]", "cuda -keys=cuda,gpu -max_num_threads=1024 -model=unknown -thread_warp_size=32", [-1, 16, 64, 49152, 2147483647, 1024, 8, 32], "", 0, []], [[], [["FU", 2, [0, 1, 2]], ["SP", 2, 0, 60236288, [14], 1], ["AN", 2, 0, 5], ["AN", 2, 1, 6]]]], "r": [[0.00319338, 0.00319375, 0.00319371], 0, 31.4159, 1668018898], "v": "v0.6"}
{"i": [["[\"softmax_norm\", 25088, 49]", "cuda -keys=cuda,gpu -max_num_threads=1024 -model=unknown -thread_warp_size=32", [-1, 16, 64, 49152, 2147483647, 1024, 8, 32], "", 0, []], [[], [["FU", 2, [0, 1, 2]], ["SP", 2, 0, 60236288, [32], 1], ["AN", 2, 0, 5], ["AN", 2, 1, 6]]]], "r": [[0.00140039, 0.00140021, 0.00140045], 0, 35.7594, 1668018902], "v": "v0.6"}
{"i": [["[\"softmax_norm\", 25088, 49]", "cuda -keys=cuda,gpu -max_num_threads=1024 -model=unknown -thread_warp_size=32", [-1, 16, 64, 49152, 2147483647, 1024, 8, 32], "", 0, []], [[], [["FU", 2, [0, 1, 2]], ["SP", 2, 0, 60236288, [1], 1], ["AN", 2, 0, 5], ["AN", 2, 1, 6]]]], "r": [[0.0446307, 0.0446304, 0.0446295], 0, 13.9458, 1668018880], "v": "v0.6"}
{"i": [["[\"softmax_norm\", 25088, 49]", "cuda -keys=cuda,gpu -max_num_threads=1024 -model=unknown -thread_warp_size=32", [-1, 16, 64, 49152, 2147483647, 1024, 8, 32], "", 0, []], [[], [["FU", 2, [0, 1, 2]], ["SP", 2, 0, 60236288, [8], 1], ["AN", 2, 0, 5], ["AN", 2, 1, 6]]]], "r": [[0.00558366, 0.00558342, 0.00558336], 0, 22.6871, 1668018889], "v": "v0.6"}
{"i": [["[\"softmax_norm\", 25088, 49]", "cuda -keys=cuda,gpu -max_num_threads=1024 -model=unknown -thread_warp_size=32", [-1, 16, 64, 49152, 2147483647, 1024, 8, 32], "", 0, []], [[], [["FU", 2, [0, 1, 2]], ["SP", 2, 0, 60236288, [56], 1], ["AN", 2, 0, 5], ["AN", 2, 1, 6]]]], "r": [[0.00080112, 0.000801178, 0.000801091], 0, 9.09645, 1668018876], "v": "v0.6"}
{"i": [["[\"softmax_norm\", 25088, 49]", "cuda -keys=cuda,gpu -max_num_threads=1024 -model=unknown -thread_warp_size=32", [-1, 16, 64, 49152, 2147483647, 1024, 8, 32], "", 0, []], [[], [["FU", 2, [0, 1, 2]], ["SP", 2, 0, 60236288, [16], 1], ["AN", 2, 0, 5], ["AN", 2, 1, 6]]]], "r": [[0.00279521, 0.00279531, 0.0027956], 0, 27.0574, 1668018894], "v": "v0.6"}
{"i": [["[\"softmax_norm\", 25088, 49]", "cuda -keys=cuda,gpu -max_num_threads=1024 -model=unknown -thread_warp_size=32", [-1, 16, 64, 49152, 2147483647, 1024, 8, 32], "", 0, []], [[], [["FU", 2, [0, 1, 2]], ["SP", 2, 0, 60236288, [4], 1], ["AN", 2, 0, 5], ["AN", 2, 1, 6]]]], "r": [[0.011162, 0.0111618, 0.0111625], 0, 40.2227, 1668018907], "v": "v0.6"}
{"i": [["[\"softmax_norm\", 25088, 49]", "cuda -keys=cuda,gpu -max_num_threads=1024 -model=unknown -thread_warp_size=32", [-1, 16, 64, 49152, 2147483647, 1024, 8, 32], "", 0, []], [[], [["FU", 2, [0, 1, 2]], ["SP", 2, 0, 60236288, [28], 1], ["AN", 2, 0, 5], ["AN", 2, 1, 6]]]], "r": [[0.00160019, 0.00159991, 0.00159994], 0, 48.8727, 1668018915], "v": "v0.6"}
{"i": [["[\"softmax_norm\", 25088, 49]", "cuda -keys=cuda,gpu -max_num_threads=1024 -model=unknown -thread_warp_size=32", [-1, 16, 64, 49152, 2147483647, 1024, 8, 32], "", 0, []], [[], [["FU", 2, [0, 1, 2]], ["SP", 2, 0, 60236288, [64], 1], ["AN", 2, 0, 5], ["AN", 2, 1, 6]]]], "r": [[0.00070135, 0.000701435, 0.0007014], 0, 44.5649, 1668018911], "v": "v0.6"}
{"i": [["[\"softmax_norm\", 25088, 49]", "cuda -keys=cuda,gpu -max_num_threads=1024 -model=unknown -thread_warp_size=32", [-1, 16, 64, 49152, 2147483647, 1024, 8, 32], "", 0, []], [[], [["FU", 2, [0, 1, 2]], ["SP", 2, 0, 60236288, [49], 1], ["AN", 2, 0, 5], ["AN", 2, 1, 6]]]], "r": [[0.000915167, 0.000915005, 0.000914991], 0, 53.2383, 1668018920], "v": "v0.6"}
