python/models/swin_transformer/kernel_configs/transformer_auto_tvm_qeury_key_matmul_q_k_1_12_384_64.log
{"input": ["cuda -keys=cuda,gpu -max_num_threads=1024 -thread_warp_size=32", "batch_matmul_tensorcore_q_k.cuda", [["TENSOR", [12, 384, 64], "float16"], ["TENSOR", [12, 384, 64], "float16"]], {}], "config": {"index": 3495, "code_hash": null, "entity": [["block_row_warps", "ot", 1], ["warp_row_tiles", "ot", 2], ["warp_col_tiles", "ot", 8], ["chunk", "ot", 2], ["offset", "ot", 8], ["offsetCS", "ot", 8], ["vec", "ot", 1], ["wmma_m", "ot", 16]]}, "result": [[0.000113982235], 0, 1.3259694576263428, 1650613989.1419804], "version": 0.2, "tvm_version": "0.8.0"}
{"input": ["cuda -keys=cuda,gpu -max_num_threads=1024 -thread_warp_size=32", "batch_matmul_tensorcore_q_k.cuda", [["TENSOR", [12, 384, 64], "float16"], ["TENSOR", [12, 384, 64], "float16"]], {}], "config": {"index": 5652, "code_hash": null, "entity": [["block_row_warps", "ot", 1], ["warp_row_tiles", "ot", 1], ["warp_col_tiles", "ot", 8], ["chunk", "ot", 2], ["offset", "ot", 8], ["offsetCS", "ot", 8], ["vec", "ot", 8], ["wmma_m", "ot", 16]]}, "result": [[6.8569301e-05], 0, 1.1765031814575195, 1650613991.9426463], "version": 0.2, "tvm_version": "0.8.0"}
{"input": ["cuda -keys=cuda,gpu -max_num_threads=1024 -thread_warp_size=32", "batch_matmul_tensorcore_q_k.cuda", [["TENSOR", [12, 384, 64], "float16"], ["TENSOR", [12, 384, 64], "float16"]], {}], "config": {"index": 7578, "code_hash": null, "entity": [["block_row_warps", "ot", 1], ["warp_row_tiles", "ot", 1], ["warp_col_tiles", "ot", 4], ["chunk", "ot", 1], ["offset", "ot", 0], ["offsetCS", "ot", 8], ["vec", "ot", 4], ["wmma_m", "ot", 8]]}, "result": [[8.2876882e-05], 0, 1.1631598472595215, 1650613994.2049246], "version": 0.2, "tvm_version": "0.8.0"}
{"input": ["cuda -keys=cuda,gpu -max_num_threads=1024 -thread_warp_size=32", "batch_matmul_tensorcore_q_k.cuda", [["TENSOR", [12, 384, 64], "float16"], ["TENSOR", [12, 384, 64], "float16"]], {}], "config": {"index": 7744, "code_hash": null, "entity": [["block_row_warps", "ot", 2], ["warp_row_tiles", "ot", 2], ["warp_col_tiles", "ot", 1], ["chunk", "ot", 1], ["offset", "ot", 8], ["offsetCS", "ot", 8], ["vec", "ot", 4], ["wmma_m", "ot", 8]]}, "result": [[0.00018726911000000002], 0, 1.6026732921600342, 1650613998.431559], "version": 0.2, "tvm_version": "0.8.0"}
{"input": ["cuda -keys=cuda,gpu -max_num_threads=1024 -thread_warp_size=32", "batch_matmul_tensorcore_q_k.cuda", [["TENSOR", [12, 384, 64], "float16"], ["TENSOR", [12, 384, 64], "float16"]], {}], "config": {"index": 4284, "code_hash": null, "entity": [["block_row_warps", "ot", 1], ["warp_row_tiles", "ot", 1], ["warp_col_tiles", "ot", 2], ["chunk", "ot", 8], ["offset", "ot", 8], ["offsetCS", "ot", 8], ["vec", "ot", 2], ["wmma_m", "ot", 16]]}, "result": [[3.1834903e-05], 0, 0.899939775466919, 1650613999.4693205], "version": 0.2, "tvm_version": "0.8.0"}
{"input": ["cuda -keys=cuda,gpu -max_num_threads=1024 -thread_warp_size=32", "batch_matmul_tensorcore_q_k.cuda", [["TENSOR", [12, 384, 64], "float16"], ["TENSOR", [12, 384, 64], "float16"]], {}], "config": {"index": 108, "code_hash": null, "entity": [["block_row_warps", "ot", 1], ["warp_row_tiles", "ot", 1], ["warp_col_tiles", "ot", 4], ["chunk", "ot", 4], ["offset", "ot", 0], ["offsetCS", "ot", 0], ["vec", "ot", 1], ["wmma_m", "ot", 32]]}, "result": [[0.00014868323], 0, 1.4336049556732178, 1650614001.4395182], "version": 0.2, "tvm_version": "0.8.0"}
{"input": ["cuda -keys=cuda,gpu -max_num_threads=1024 -thread_warp_size=32", "batch_matmul_tensorcore_q_k.cuda", [["TENSOR", [12, 384, 64], "float16"], ["TENSOR", [12, 384, 64], "float16"]], {}], "config": {"index": 414, "code_hash": null, "entity": [["block_row_warps", "ot", 1], ["warp_row_tiles", "ot", 1], ["warp_col_tiles", "ot", 2], ["chunk", "ot", 2], ["offset", "ot", 0], ["offsetCS", "ot", 8], ["vec", "ot", 1], ["wmma_m", "ot", 32]]}, "result": [[0.000183541349], 0, 1.5130157470703125, 1650614004.1956034], "version": 0.2, "tvm_version": "0.8.0"}
{"input": ["cuda -keys=cuda,gpu -max_num_threads=1024 -thread_warp_size=32", "batch_matmul_tensorcore_q_k.cuda", [["TENSOR", [12, 384, 64], "float16"], ["TENSOR", [12, 384, 64], "float16"]], {}], "config": {"index": 6075, "code_hash": null, "entity": [["block_row_warps", "ot", 1], ["warp_row_tiles", "ot", 1], ["warp_col_tiles", "ot", 1], ["chunk", "ot", 8], ["offset", "ot", 8], ["offsetCS", "ot", 0], ["vec", "ot", 1], ["wmma_m", "ot", 8]]}, "result": [[8.025521299999999e-05], 0, 1.151414394378662, 1650614007.5549142], "version": 0.2, "tvm_version": "0.8.0"}
{"input": ["cuda -keys=cuda,gpu -max_num_threads=1024 -thread_warp_size=32", "batch_matmul_tensorcore_q_k.cuda", [["TENSOR", [12, 384, 64], "float16"], ["TENSOR", [12, 384, 64], "float16"]], {}], "config": {"index": 6852, "code_hash": null, "entity": [["block_row_warps", "ot", 1], ["warp_row_tiles", "ot", 2], ["warp_col_tiles", "ot", 2], ["chunk", "ot", 1], ["offset", "ot", 0], ["offsetCS", "ot", 8], ["vec", "ot", 2], ["wmma_m", "ot", 8]]}, "result": [[3.2997625999999995e-05], 0, 0.9212102890014648, 1650614009.140765], "version": 0.2, "tvm_version": "0.8.0"}
{"input": ["cuda -keys=cuda,gpu -max_num_threads=1024 -thread_warp_size=32", "batch_matmul_tensorcore_q_k.cuda", [["TENSOR", [12, 384, 64], "float16"], ["TENSOR", [12, 384, 64], "float16"]], {}], "config": {"index": 3214, "code_hash": null, "entity": [["block_row_warps", "ot", 2], ["warp_row_tiles", "ot", 1], ["warp_col_tiles", "ot", 4], ["chunk", "ot", 8], ["offset", "ot", 8], ["offsetCS", "ot", 0], ["vec", "ot", 1], ["wmma_m", "ot", 16]]}, "result": [[6.9451921e-05], 0, 1.107689380645752, 1650614010.3880816], "version": 0.2, "tvm_version": "0.8.0"}
{"input": ["cuda -keys=cuda,gpu -max_num_threads=1024 -thread_warp_size=32", "batch_matmul_tensorcore_q_k.cuda", [["TENSOR", [12, 384, 64], "float16"], ["TENSOR", [12, 384, 64], "float16"]], {}], "config": {"index": 7944, "code_hash": null, "entity": [["block_row_warps", "ot", 1], ["warp_row_tiles", "ot", 4], ["warp_col_tiles", "ot", 4], ["chunk", "ot", 1], ["offset", "ot", 0], ["offsetCS", "ot", 0], ["vec", "ot", 8], ["wmma_m", "ot", 8]]}, "result": [[4.8679526e-05], 0, 1.1048672199249268, 1650614011.6236954], "version": 0.2, "tvm_version": "0.8.0"}
{"input": ["cuda -keys=cuda,gpu -max_num_threads=1024 -thread_warp_size=32", "batch_matmul_tensorcore_q_k.cuda", [["TENSOR", [12, 384, 64], "float16"], ["TENSOR", [12, 384, 64], "float16"]], {}], "config": {"index": 2286, "code_hash": null, "entity": [["block_row_warps", "ot", 1], ["warp_row_tiles", "ot", 1], ["warp_col_tiles", "ot", 16], ["chunk", "ot", 4], ["offset", "ot", 0], ["offsetCS", "ot", 0], ["vec", "ot", 8], ["wmma_m", "ot", 32]]}, "result": [[4.1424982e-05], 0, 1.1791305541992188, 1650614012.4069698], "version": 0.2, "tvm_version": "0.8.0"}
{"input": ["cuda -keys=cuda,gpu -max_num_threads=1024 -thread_warp_size=32", "batch_matmul_tensorcore_q_k.cuda", [["TENSOR", [12, 384, 64], "float16"], ["TENSOR", [12, 384, 64], "float16"]], {}], "config": {"index": 4527, "code_hash": null, "entity": [["block_row_warps", "ot", 1], ["warp_row_tiles", "ot", 1], ["warp_col_tiles", "ot", 8], ["chunk", "ot", 1], ["offset", "ot", 8], ["offsetCS", "ot", 0], ["vec", "ot", 4], ["wmma_m", "ot", 16]]}, "result": [[3.6355849e-05], 0, 0.944737434387207, 1650614013.503512], "version": 0.2, "tvm_version": "0.8.0"}
{"input": ["cuda -keys=cuda,gpu -max_num_threads=1024 -thread_warp_size=32", "batch_matmul_tensorcore_q_k.cuda", [["TENSOR", [12, 384, 64], "float16"], ["TENSOR", [12, 384, 64], "float16"]], {}], "config": {"index": 7257, "code_hash": null, "entity": [["block_row_warps", "ot", 1], ["warp_row_tiles", "ot", 2], ["warp_col_tiles", "ot", 2], ["chunk", "ot", 2], ["offset", "ot", 0], ["offsetCS", "ot", 0], ["vec", "ot", 4], ["wmma_m", "ot", 8]]}, "result": [[8.252451499999999e-05], 0, 1.17808198928833, 1650614017.2682197], "version": 0.2, "tvm_version": "0.8.0"}
{"input": ["cuda -keys=cuda,gpu -max_num_threads=1024 -thread_warp_size=32", "batch_matmul_tensorcore_q_k.cuda", [["TENSOR", [12, 384, 64], "float16"], ["TENSOR", [12, 384, 64], "float16"]], {}], "config": {"index": 7932, "code_hash": null, "entity": [["block_row_warps", "ot", 1], ["warp_row_tiles", "ot", 2], ["warp_col_tiles", "ot", 2], ["chunk", "ot", 1], ["offset", "ot", 0], ["offsetCS", "ot", 0], ["vec", "ot", 8], ["wmma_m", "ot", 8]]}, "result": [[7.6838777e-05], 0, 1.151123046875, 1650614018.0773911], "version": 0.2, "tvm_version": "0.8.0"}
{"input": ["cuda -keys=cuda,gpu -max_num_threads=1024 -thread_warp_size=32", "batch_matmul_tensorcore_q_k.cuda", [["TENSOR", [12, 384, 64], "float16"], ["TENSOR", [12, 384, 64], "float16"]], {}], "config": {"index": 6581, "code_hash": null, "entity": [["block_row_warps", "ot", 4], ["warp_row_tiles", "ot", 1], ["warp_col_tiles", "ot", 2], ["chunk", "ot", 4], ["offset", "ot", 0], ["offsetCS", "ot", 0], ["vec", "ot", 2], ["wmma_m", "ot", 8]]}, "result": [[0.0005535896370000001], 0, 2.487259864807129, 1650614020.7610974], "version": 0.2, "tvm_version": "0.8.0"}
{"input": ["cuda -keys=cuda,gpu -max_num_threads=1024 -thread_warp_size=32", "batch_matmul_tensorcore_q_k.cuda", [["TENSOR", [12, 384, 64], "float16"], ["TENSOR", [12, 384, 64], "float16"]], {}], "config": {"index": 378, "code_hash": null, "entity": [["block_row_warps", "ot", 1], ["warp_row_tiles", "ot", 1], ["warp_col_tiles", "ot", 4], ["chunk", "ot", 1], ["offset", "ot", 0], ["offsetCS", "ot", 8], ["vec", "ot", 1], ["wmma_m", "ot", 32]]}, "result": [[6.796563799999999e-05], 0, 1.1086363792419434, 1650614024.0509777], "version": 0.2, "tvm_version": "0.8.0"}
{"input": ["cuda -keys=cuda,gpu -max_num_threads=1024 -thread_warp_size=32", "batch_matmul_tensorcore_q_k.cuda", [["TENSOR", [12, 384, 64], "float16"], ["TENSOR", [12, 384, 64], "float16"]], {}], "config": {"index": 6306, "code_hash": null, "entity": [["block_row_warps", "ot", 1], ["warp_row_tiles", "ot", 4], ["warp_col_tiles", "ot", 1], ["chunk", "ot", 1], ["offset", "ot", 8], ["offsetCS", "ot", 8], ["vec", "ot", 1], ["wmma_m", "ot", 8]]}, "result": [[5.3628830999999995e-05], 0, 1.0870091915130615, 1650614047.4003317], "version": 0.2, "tvm_version": "0.8.0"}
{"input": ["cuda -keys=cuda,gpu -max_num_threads=1024 -thread_warp_size=32", "batch_matmul_tensorcore_q_k.cuda", [["TENSOR", [12, 384, 64], "float16"], ["TENSOR", [12, 384, 64], "float16"]], {}], "config": {"index": 5946, "code_hash": null, "entity": [["block_row_warps", "ot", 1], ["warp_row_tiles", "ot", 4], ["warp_col_tiles", "ot", 1], ["chunk", "ot", 1], ["offset", "ot", 8], ["offsetCS", "ot", 0], ["vec", "ot", 1], ["wmma_m", "ot", 8]]}, "result": [[5.912357e-05], 0, 1.0421056747436523, 1650614048.12197], "version": 0.2, "tvm_version": "0.8.0"}
{"input": ["cuda -keys=cuda,gpu -max_num_threads=1024 -thread_warp_size=32", "batch_matmul_tensorcore_q_k.cuda", [["TENSOR", [12, 384, 64], "float16"], ["TENSOR", [12, 384, 64], "float16"]], {}], "config": {"index": 6933, "code_hash": null, "entity": [["block_row_warps", "ot", 1], ["warp_row_tiles", "ot", 2], ["warp_col_tiles", "ot", 1], ["chunk", "ot", 4], ["offset", "ot", 0], ["offsetCS", "ot", 8], ["vec", "ot", 2], ["wmma_m", "ot", 8]]}, "result": [[0.00013821454600000002], 0, 1.2331676483154297, 1650614049.5388055], "version": 0.2, "tvm_version": "0.8.0"}
{"input": ["cuda -keys=cuda,gpu -max_num_threads=1024 -thread_warp_size=32", "batch_matmul_tensorcore_q_k.cuda", [["TENSOR", [12, 384, 64], "float16"], ["TENSOR", [12, 384, 64], "float16"]], {}], "config": {"index": 6573, "code_hash": null, "entity": [["block_row_warps", "ot", 1], ["warp_row_tiles", "ot", 2], ["warp_col_tiles", "ot", 1], ["chunk", "ot", 4], ["offset", "ot", 0], ["offsetCS", "ot", 0], ["vec", "ot", 2], ["wmma_m", "ot", 8]]}, "result": [[0.000154621782], 0, 1.343285083770752, 1650614050.5658946], "version": 0.2, "tvm_version": "0.8.0"}
{"input": ["cuda -keys=cuda,gpu -max_num_threads=1024 -thread_warp_size=32", "batch_matmul_tensorcore_q_k.cuda", [["TENSOR", [12, 384, 64], "float16"], ["TENSOR", [12, 384, 64], "float16"]], {}], "config": {"index": 6798, "code_hash": null, "entity": [["block_row_warps", "ot", 1], ["warp_row_tiles", "ot", 2], ["warp_col_tiles", "ot", 1], ["chunk", "ot", 8], ["offset", "ot", 8], ["offsetCS", "ot", 0], ["vec", "ot", 2], ["wmma_m", "ot", 8]]}, "result": [[5.1309058999999994e-05], 0, 0.9459619522094727, 1650614051.6565816], "version": 0.2, "tvm_version": "0.8.0"}
{"input": ["cuda -keys=cuda,gpu -max_num_threads=1024 -thread_warp_size=32", "batch_matmul_tensorcore_q_k.cuda", [["TENSOR", [12, 384, 64], "float16"], ["TENSOR", [12, 384, 64], "float16"]], {}], "config": {"index": 7158, "code_hash": null, "entity": [["block_row_warps", "ot", 1], ["warp_row_tiles", "ot", 2], ["warp_col_tiles", "ot", 1], ["chunk", "ot", 8], ["offset", "ot", 8], ["offsetCS", "ot", 8], ["vec", "ot", 2], ["wmma_m", "ot", 8]]}, "result": [[3.4874757e-05], 0, 0.962899923324585, 1650614052.299664], "version": 0.2, "tvm_version": "0.8.0"}
{"input": ["cuda -keys=cuda,gpu -max_num_threads=1024 -thread_warp_size=32", "batch_matmul_tensorcore_q_k.cuda", [["TENSOR", [12, 384, 64], "float16"], ["TENSOR", [12, 384, 64], "float16"]], {}], "config": {"index": 7032, "code_hash": null, "entity": [["block_row_warps", "ot", 1], ["warp_row_tiles", "ot", 2], ["warp_col_tiles", "ot", 2], ["chunk", "ot", 1], ["offset", "ot", 8], ["offsetCS", "ot", 8], ["vec", "ot", 2], ["wmma_m", "ot", 8]]}, "result": [[2.8676243e-05], 0, 0.9581112861633301, 1650614052.898986], "version": 0.2, "tvm_version": "0.8.0"}
{"input": ["cuda -keys=cuda,gpu -max_num_threads=1024 -thread_warp_size=32", "batch_matmul_tensorcore_q_k.cuda", [["TENSOR", [12, 384, 64], "float16"], ["TENSOR", [12, 384, 64], "float16"]], {}], "config": {"index": 6672, "code_hash": null, "entity": [["block_row_warps", "ot", 1], ["warp_row_tiles", "ot", 2], ["warp_col_tiles", "ot", 2], ["chunk", "ot", 1], ["offset", "ot", 8], ["offsetCS", "ot", 0], ["vec", "ot", 2], ["wmma_m", "ot", 8]]}, "result": [[3.7158927e-05], 0, 0.9337553977966309, 1650614053.9854898], "version": 0.2, "tvm_version": "0.8.0"}
{"input": ["cuda -keys=cuda,gpu -max_num_threads=1024 -thread_warp_size=32", "batch_matmul_tensorcore_q_k.cuda", [["TENSOR", [12, 384, 64], "float16"], ["TENSOR", [12, 384, 64], "float16"]], {}], "config": {"index": 7113, "code_hash": null, "entity": [["block_row_warps", "ot", 1], ["warp_row_tiles", "ot", 2], ["warp_col_tiles", "ot", 1], ["chunk", "ot", 4], ["offset", "ot", 8], ["offsetCS", "ot", 8], ["vec", "ot", 2], ["wmma_m", "ot", 8]]}, "result": [[5.4644826e-05], 0, 0.9649367332458496, 1650614055.1064441], "version": 0.2, "tvm_version": "0.8.0"}
{"input": ["cuda -keys=cuda,gpu -max_num_threads=1024 -thread_warp_size=32", "batch_matmul_tensorcore_q_k.cuda", [["TENSOR", [12, 384, 64], "float16"], ["TENSOR", [12, 384, 64], "float16"]], {}], "config": {"index": 6618, "code_hash": null, "entity": [["block_row_warps", "ot", 1], ["warp_row_tiles", "ot", 2], ["warp_col_tiles", "ot", 1], ["chunk", "ot", 8], ["offset", "ot", 0], ["offsetCS", "ot", 0], ["vec", "ot", 2], ["wmma_m", "ot", 8]]}, "result": [[0.000154648073], 0, 1.3522679805755615, 1650614056.1206176], "version": 0.2, "tvm_version": "0.8.0"}
{"input": ["cuda -keys=cuda,gpu -max_num_threads=1024 -thread_warp_size=32", "batch_matmul_tensorcore_q_k.cuda", [["TENSOR", [12, 384, 64], "float16"], ["TENSOR", [12, 384, 64], "float16"]], {}], "config": {"index": 6753, "code_hash": null, "entity": [["block_row_warps", "ot", 1], ["warp_row_tiles", "ot", 2], ["warp_col_tiles", "ot", 1], ["chunk", "ot", 4], ["offset", "ot", 8], ["offsetCS", "ot", 0], ["vec", "ot", 2], ["wmma_m", "ot", 8]]}, "result": [[5.1295578000000004e-05], 0, 1.0551509857177734, 1650614056.8284674], "version": 0.2, "tvm_version": "0.8.0"}
{"input": ["cuda -keys=cuda,gpu -max_num_threads=1024 -thread_warp_size=32", "batch_matmul_tensorcore_q_k.cuda", [["TENSOR", [12, 384, 64], "float16"], ["TENSOR", [12, 384, 64], "float16"]], {}], "config": {"index": 6978, "code_hash": null, "entity": [["block_row_warps", "ot", 1], ["warp_row_tiles", "ot", 2], ["warp_col_tiles", "ot", 1], ["chunk", "ot", 8], ["offset", "ot", 0], ["offsetCS", "ot", 8], ["vec", "ot", 2], ["wmma_m", "ot", 8]]}, "result": [[0.00013830524600000002], 0, 1.348196268081665, 1650614057.8473148], "version": 0.2, "tvm_version": "0.8.0"}
{"input": ["cuda -keys=cuda,gpu -max_num_threads=1024 -thread_warp_size=32", "batch_matmul_tensorcore_q_k.cuda", [["TENSOR", [12, 384, 64], "float16"], ["TENSOR", [12, 384, 64], "float16"]], {}], "config": {"index": 7401, "code_hash": null, "entity": [["block_row_warps", "ot", 1], ["warp_row_tiles", "ot", 2], ["warp_col_tiles", "ot", 4], ["chunk", "ot", 1], ["offset", "ot", 8], ["offsetCS", "ot", 0], ["vec", "ot", 4], ["wmma_m", "ot", 8]]}, "result": [[4.0157713e-05], 0, 1.102534294128418, 1650614058.50509], "version": 0.2, "tvm_version": "0.8.0"}
{"input": ["cuda -keys=cuda,gpu -max_num_threads=1024 -thread_warp_size=32", "batch_matmul_tensorcore_q_k.cuda", [["TENSOR", [12, 384, 64], "float16"], ["TENSOR", [12, 384, 64], "float16"]], {}], "config": {"index": 7761, "code_hash": null, "entity": [["block_row_warps", "ot", 1], ["warp_row_tiles", "ot", 2], ["warp_col_tiles", "ot", 4], ["chunk", "ot", 1], ["offset", "ot", 8], ["offsetCS", "ot", 8], ["vec", "ot", 4], ["wmma_m", "ot", 8]]}, "result": [[3.5875523e-05], 0, 1.0768582820892334, 1650614059.1700518], "version": 0.2, "tvm_version": "0.8.0"}
{"input": ["cuda -keys=cuda,gpu -max_num_threads=1024 -thread_warp_size=32", "batch_matmul_tensorcore_q_k.cuda", [["TENSOR", [12, 384, 64], "float16"], ["TENSOR", [12, 384, 64], "float16"]], {}], "config": {"index": 7392, "code_hash": null, "entity": [["block_row_warps", "ot", 1], ["warp_row_tiles", "ot", 2], ["warp_col_tiles", "ot", 2], ["chunk", "ot", 1], ["offset", "ot", 8], ["offsetCS", "ot", 0], ["vec", "ot", 4], ["wmma_m", "ot", 8]]}, "result": [[4.8902007e-05], 0, 1.1716527938842773, 1650614059.9512954], "version": 0.2, "tvm_version": "0.8.0"}
{"input": ["cuda -keys=cuda,gpu -max_num_threads=1024 -thread_warp_size=32", "batch_matmul_tensorcore_q_k.cuda", [["TENSOR", [12, 384, 64], "float16"], ["TENSOR", [12, 384, 64], "float16"]], {}], "config": {"index": 7752, "code_hash": null, "entity": [["block_row_warps", "ot", 1], ["warp_row_tiles", "ot", 2], ["warp_col_tiles", "ot", 2], ["chunk", "ot", 1], ["offset", "ot", 8], ["offsetCS", "ot", 8], ["vec", "ot", 4], ["wmma_m", "ot", 8]]}, "result": [[4.030487e-05], 0, 1.028900146484375, 1650614061.0878906], "version": 0.2, "tvm_version": "0.8.0"}
{"input": ["cuda -keys=cuda,gpu -max_num_threads=1024 -thread_warp_size=32", "batch_matmul_tensorcore_q_k.cuda", [["TENSOR", [12, 384, 64], "float16"], ["TENSOR", [12, 384, 64], "float16"]], {}], "config": {"index": 6492, "code_hash": null, "entity": [["block_row_warps", "ot", 1], ["warp_row_tiles", "ot", 2], ["warp_col_tiles", "ot", 2], ["chunk", "ot", 1], ["offset", "ot", 0], ["offsetCS", "ot", 0], ["vec", "ot", 2], ["wmma_m", "ot", 8]]}, "result": [[4.1485355000000005e-05], 0, 0.9955008029937744, 1650614062.2168558], "version": 0.2, "tvm_version": "0.8.0"}
{"input": ["cuda -keys=cuda,gpu -max_num_threads=1024 -thread_warp_size=32", "batch_matmul_tensorcore_q_k.cuda", [["TENSOR", [12, 384, 64], "float16"], ["TENSOR", [12, 384, 64], "float16"]], {}], "config": {"index": 6214, "code_hash": null, "entity": [["block_row_warps", "ot", 2], ["warp_row_tiles", "ot", 2], ["warp_col_tiles", "ot", 1], ["chunk", "ot", 4], ["offset", "ot", 0], ["offsetCS", "ot", 8], ["vec", "ot", 1], ["wmma_m", "ot", 8]]}, "result": [[0.000347803525], 0, 2.0430080890655518, 1650614063.8811808], "version": 0.2, "tvm_version": "0.8.0"}
{"input": ["cuda -keys=cuda,gpu -max_num_threads=1024 -thread_warp_size=32", "batch_matmul_tensorcore_q_k.cuda", [["TENSOR", [12, 384, 64], "float16"], ["TENSOR", [12, 384, 64], "float16"]], {}], "config": {"index": 5854, "code_hash": null, "entity": [["block_row_warps", "ot", 2], ["warp_row_tiles", "ot", 2], ["warp_col_tiles", "ot", 1], ["chunk", "ot", 4], ["offset", "ot", 0], ["offsetCS", "ot", 0], ["vec", "ot", 1], ["wmma_m", "ot", 8]]}, "result": [[0.00039214214500000007], 0, 2.1050832271575928, 1650614065.6192617], "version": 0.2, "tvm_version": "0.8.0"}
{"input": ["cuda -keys=cuda,gpu -max_num_threads=1024 -thread_warp_size=32", "batch_matmul_tensorcore_q_k.cuda", [["TENSOR", [12, 384, 64], "float16"], ["TENSOR", [12, 384, 64], "float16"]], {}], "config": {"index": 3699, "code_hash": null, "entity": [["block_row_warps", "ot", 1], ["warp_row_tiles", "ot", 1], ["warp_col_tiles", "ot", 2], ["chunk", "ot", 4], ["offset", "ot", 0], ["offsetCS", "ot", 0], ["vec", "ot", 2], ["wmma_m", "ot", 16]]}, "result": [[0.00015180648999999998], 0, 1.2959425449371338, 1650614067.0524552], "version": 0.2, "tvm_version": "0.8.0"}
{"input": ["cuda -keys=cuda,gpu -max_num_threads=1024 -thread_warp_size=32", "batch_matmul_tensorcore_q_k.cuda", [["TENSOR", [12, 384, 64], "float16"], ["TENSOR", [12, 384, 64], "float16"]], {}], "config": {"index": 4059, "code_hash": null, "entity": [["block_row_warps", "ot", 1], ["warp_row_tiles", "ot", 1], ["warp_col_tiles", "ot", 2], ["chunk", "ot", 4], ["offset", "ot", 0], ["offsetCS", "ot", 8], ["vec", "ot", 2], ["wmma_m", "ot", 16]]}, "result": [[0.000135445693], 0, 1.3426835536956787, 1650614068.0576642], "version": 0.2, "tvm_version": "0.8.0"}
{"input": ["cuda -keys=cuda,gpu -max_num_threads=1024 -thread_warp_size=32", "batch_matmul_tensorcore_q_k.cuda", [["TENSOR", [12, 384, 64], "float16"], ["TENSOR", [12, 384, 64], "float16"]], {}], "config": {"index": 7800, "code_hash": null, "entity": [["block_row_warps", "ot", 1], ["warp_row_tiles", "ot", 4], ["warp_col_tiles", "ot", 2], ["chunk", "ot", 2], ["offset", "ot", 8], ["offsetCS", "ot", 8], ["vec", "ot", 4], ["wmma_m", "ot", 8]]}, "result": [[3.0256174e-05], 0, 0.9698770046234131, 1650614069.080757], "version": 0.2, "tvm_version": "0.8.0"}
{"input": ["cuda -keys=cuda,gpu -max_num_threads=1024 -thread_warp_size=32", "batch_matmul_tensorcore_q_k.cuda", [["TENSOR", [12, 384, 64], "float16"], ["TENSOR", [12, 384, 64], "float16"]], {}], "config": {"index": 7440, "code_hash": null, "entity": [["block_row_warps", "ot", 1], ["warp_row_tiles", "ot", 4], ["warp_col_tiles", "ot", 2], ["chunk", "ot", 2], ["offset", "ot", 8], ["offsetCS", "ot", 0], ["vec", "ot", 4], ["wmma_m", "ot", 8]]}, "result": [[4.2199088e-05], 0, 1.1017706394195557, 1650614069.773891], "version": 0.2, "tvm_version": "0.8.0"}
{"input": ["cuda -keys=cuda,gpu -max_num_threads=1024 -thread_warp_size=32", "batch_matmul_tensorcore_q_k.cuda", [["TENSOR", [12, 384, 64], "float16"], ["TENSOR", [12, 384, 64], "float16"]], {}], "config": {"index": 3072, "code_hash": null, "entity": [["block_row_warps", "ot", 1], ["warp_row_tiles", "ot", 2], ["warp_col_tiles", "ot", 2], ["chunk", "ot", 1], ["offset", "ot", 8], ["offsetCS", "ot", 0], ["vec", "ot", 1], ["wmma_m", "ot", 16]]}, "result": [[5.7404574e-05], 0, 1.1637680530548096, 1650614070.542801], "version": 0.2, "tvm_version": "0.8.0"}
{"input": ["cuda -keys=cuda,gpu -max_num_threads=1024 -thread_warp_size=32", "batch_matmul_tensorcore_q_k.cuda", [["TENSOR", [12, 384, 64], "float16"], ["TENSOR", [12, 384, 64], "float16"]], {}], "config": {"index": 3432, "code_hash": null, "entity": [["block_row_warps", "ot", 1], ["warp_row_tiles", "ot", 2], ["warp_col_tiles", "ot", 2], ["chunk", "ot", 1], ["offset", "ot", 8], ["offsetCS", "ot", 8], ["vec", "ot", 1], ["wmma_m", "ot", 16]]}, "result": [[3.5797220000000005e-05], 0, 0.9251148700714111, 1650614071.5859377], "version": 0.2, "tvm_version": "0.8.0"}
{"input": ["cuda -keys=cuda,gpu -max_num_threads=1024 -thread_warp_size=32", "batch_matmul_tensorcore_q_k.cuda", [["TENSOR", [12, 384, 64], "float16"], ["TENSOR", [12, 384, 64], "float16"]], {}], "config": {"index": 7212, "code_hash": null, "entity": [["block_row_warps", "ot", 1], ["warp_row_tiles", "ot", 2], ["warp_col_tiles", "ot", 2], ["chunk", "ot", 1], ["offset", "ot", 0], ["offsetCS", "ot", 0], ["vec", "ot", 4], ["wmma_m", "ot", 8]]}, "result": [[5.4805957999999995e-05], 0, 1.0473144054412842, 1650614072.736737], "version": 0.2, "tvm_version": "0.8.0"}
{"input": ["cuda -keys=cuda,gpu -max_num_threads=1024 -thread_warp_size=32", "batch_matmul_tensorcore_q_k.cuda", [["TENSOR", [12, 384, 64], "float16"], ["TENSOR", [12, 384, 64], "float16"]], {}], "config": {"index": 7572, "code_hash": null, "entity": [["block_row_warps", "ot", 1], ["warp_row_tiles", "ot", 2], ["warp_col_tiles", "ot", 2], ["chunk", "ot", 1], ["offset", "ot", 0], ["offsetCS", "ot", 8], ["vec", "ot", 4], ["wmma_m", "ot", 8]]}, "result": [[4.5907522e-05], 0, 1.205073356628418, 1650614073.4984608], "version": 0.2, "tvm_version": "0.8.0"}
{"input": ["cuda -keys=cuda,gpu -max_num_threads=1024 -thread_warp_size=32", "batch_matmul_tensorcore_q_k.cuda", [["TENSOR", [12, 384, 64], "float16"], ["TENSOR", [12, 384, 64], "float16"]], {}], "config": {"index": 198, "code_hash": null, "entity": [["block_row_warps", "ot", 1], ["warp_row_tiles", "ot", 1], ["warp_col_tiles", "ot", 4], ["chunk", "ot", 1], ["offset", "ot", 8], ["offsetCS", "ot", 0], ["vec", "ot", 1], ["wmma_m", "ot", 32]]}, "result": [[5.5417064e-05], 0, 1.0884175300598145, 1650614074.6737328], "version": 0.2, "tvm_version": "0.8.0"}
{"input": ["cuda -keys=cuda,gpu -max_num_threads=1024 -thread_warp_size=32", "batch_matmul_tensorcore_q_k.cuda", [["TENSOR", [12, 384, 64], "float16"], ["TENSOR", [12, 384, 64], "float16"]], {}], "config": {"index": 558, "code_hash": null, "entity": [["block_row_warps", "ot", 1], ["warp_row_tiles", "ot", 1], ["warp_col_tiles", "ot", 4], ["chunk", "ot", 1], ["offset", "ot", 8], ["offsetCS", "ot", 8], ["vec", "ot", 1], ["wmma_m", "ot", 32]]}, "result": [[3.3529662e-05], 0, 1.045189619064331, 1650614075.3389754], "version": 0.2, "tvm_version": "0.8.0"}
{"input": ["cuda -keys=cuda,gpu -max_num_threads=1024 -thread_warp_size=32", "batch_matmul_tensorcore_q_k.cuda", [["TENSOR", [12, 384, 64], "float16"], ["TENSOR", [12, 384, 64], "float16"]], {}], "config": {"index": 8484, "code_hash": null, "entity": [["block_row_warps", "ot", 1], ["warp_row_tiles", "ot", 4], ["warp_col_tiles", "ot", 4], ["chunk", "ot", 1], ["offset", "ot", 8], ["offsetCS", "ot", 8], ["vec", "ot", 8], ["wmma_m", "ot", 8]]}, "result": [[3.9795896e-05], 0, 1.1853055953979492, 1650614076.0956786], "version": 0.2, "tvm_version": "0.8.0"}
{"input": ["cuda -keys=cuda,gpu -max_num_threads=1024 -thread_warp_size=32", "batch_matmul_tensorcore_q_k.cuda", [["TENSOR", [12, 384, 64], "float16"], ["TENSOR", [12, 384, 64], "float16"]], {}], "config": {"index": 8304, "code_hash": null, "entity": [["block_row_warps", "ot", 1], ["warp_row_tiles", "ot", 4], ["warp_col_tiles", "ot", 4], ["chunk", "ot", 1], ["offset", "ot", 0], ["offsetCS", "ot", 8], ["vec", "ot", 8], ["wmma_m", "ot", 8]]}, "result": [[4.2383957e-05], 0, 1.1462445259094238, 1650614077.2851217], "version": 0.2, "tvm_version": "0.8.0"}
{"input": ["cuda -keys=cuda,gpu -max_num_threads=1024 -thread_warp_size=32", "batch_matmul_tensorcore_q_k.cuda", [["TENSOR", [12, 384, 64], "float16"], ["TENSOR", [12, 384, 64], "float16"]], {}], "config": {"index": 8124, "code_hash": null, "entity": [["block_row_warps", "ot", 1], ["warp_row_tiles", "ot", 4], ["warp_col_tiles", "ot", 4], ["chunk", "ot", 1], ["offset", "ot", 8], ["offsetCS", "ot", 0], ["vec", "ot", 8], ["wmma_m", "ot", 8]]}, "result": [[4.7334944999999996e-05], 0, 1.134490728378296, 1650614078.4509182], "version": 0.2, "tvm_version": "0.8.0"}
{"input": ["cuda -keys=cuda,gpu -max_num_threads=1024 -thread_warp_size=32", "batch_matmul_tensorcore_q_k.cuda", [["TENSOR", [12, 384, 64], "float16"], ["TENSOR", [12, 384, 64], "float16"]], {}], "config": {"index": 6531, "code_hash": null, "entity": [["block_row_warps", "ot", 1], ["warp_row_tiles", "ot", 4], ["warp_col_tiles", "ot", 1], ["chunk", "ot", 2], ["offset", "ot", 0], ["offsetCS", "ot", 0], ["vec", "ot", 2], ["wmma_m", "ot", 8]]}, "result": [[0.000101658866], 0, 1.2484157085418701, 1650614079.3503752], "version": 0.2, "tvm_version": "0.8.0"}
{"input": ["cuda -keys=cuda,gpu -max_num_threads=1024 -thread_warp_size=32", "batch_matmul_tensorcore_q_k.cuda", [["TENSOR", [12, 384, 64], "float16"], ["TENSOR", [12, 384, 64], "float16"]], {}], "config": {"index": 6891, "code_hash": null, "entity": [["block_row_warps", "ot", 1], ["warp_row_tiles", "ot", 4], ["warp_col_tiles", "ot", 1], ["chunk", "ot", 2], ["offset", "ot", 0], ["offsetCS", "ot", 8], ["vec", "ot", 2], ["wmma_m", "ot", 8]]}, "result": [[7.973131799999999e-05], 0, 1.1441683769226074, 1650614080.1259902], "version": 0.2, "tvm_version": "0.8.0"}
{"input": ["cuda -keys=cuda,gpu -max_num_threads=1024 -thread_warp_size=32", "batch_matmul_tensorcore_q_k.cuda", [["TENSOR", [12, 384, 64], "float16"], ["TENSOR", [12, 384, 64], "float16"]], {}], "config": {"index": 7764, "code_hash": null, "entity": [["block_row_warps", "ot", 1], ["warp_row_tiles", "ot", 4], ["warp_col_tiles", "ot", 4], ["chunk", "ot", 1], ["offset", "ot", 8], ["offsetCS", "ot", 8], ["vec", "ot", 4], ["wmma_m", "ot", 8]]}, "result": [[3.7803153e-05], 0, 1.054248571395874, 1650614081.2286136], "version": 0.2, "tvm_version": "0.8.0"}
{"input": ["cuda -keys=cuda,gpu -max_num_threads=1024 -thread_warp_size=32", "batch_matmul_tensorcore_q_k.cuda", [["TENSOR", [12, 384, 64], "float16"], ["TENSOR", [12, 384, 64], "float16"]], {}], "config": {"index": 7404, "code_hash": null, "entity": [["block_row_warps", "ot", 1], ["warp_row_tiles", "ot", 4], ["warp_col_tiles", "ot", 4], ["chunk", "ot", 1], ["offset", "ot", 8], ["offsetCS", "ot", 0], ["vec", "ot", 4], ["wmma_m", "ot", 8]]}, "result": [[4.5506859e-05], 0, 1.1802444458007812, 1650614081.9852898], "version": 0.2, "tvm_version": "0.8.0"}
{"input": ["cuda -keys=cuda,gpu -max_num_threads=1024 -thread_warp_size=32", "batch_matmul_tensorcore_q_k.cuda", [["TENSOR", [12, 384, 64], "float16"], ["TENSOR", [12, 384, 64], "float16"]], {}], "config": {"index": 6079, "code_hash": null, "entity": [["block_row_warps", "ot", 2], ["warp_row_tiles", "ot", 2], ["warp_col_tiles", "ot", 1], ["chunk", "ot", 8], ["offset", "ot", 8], ["offsetCS", "ot", 0], ["vec", "ot", 1], ["wmma_m", "ot", 8]]}, "result": [[0.000117449664], 0, 1.1949069499969482, 1650614083.3188493], "version": 0.2, "tvm_version": "0.8.0"}
{"input": ["cuda -keys=cuda,gpu -max_num_threads=1024 -thread_warp_size=32", "batch_matmul_tensorcore_q_k.cuda", [["TENSOR", [12, 384, 64], "float16"], ["TENSOR", [12, 384, 64], "float16"]], {}], "config": {"index": 6439, "code_hash": null, "entity": [["block_row_warps", "ot", 2], ["warp_row_tiles", "ot", 2], ["warp_col_tiles", "ot", 1], ["chunk", "ot", 8], ["offset", "ot", 8], ["offsetCS", "ot", 8], ["vec", "ot", 1], ["wmma_m", "ot", 8]]}, "result": [[7.2988989e-05], 0, 1.1271321773529053, 1650614084.0859437], "version": 0.2, "tvm_version": "0.8.0"}
{"input": ["cuda -keys=cuda,gpu -max_num_threads=1024 -thread_warp_size=32", "batch_matmul_tensorcore_q_k.cuda", [["TENSOR", [12, 384, 64], "float16"], ["TENSOR", [12, 384, 64], "float16"]], {}], "config": {"index": 6537, "code_hash": null, "entity": [["block_row_warps", "ot", 1], ["warp_row_tiles", "ot", 2], ["warp_col_tiles", "ot", 2], ["chunk", "ot", 2], ["offset", "ot", 0], ["offsetCS", "ot", 0], ["vec", "ot", 2], ["wmma_m", "ot", 8]]}, "result": [[5.1432212999999994e-05], 0, 1.167858600616455, 1650614084.8596618], "version": 0.2, "tvm_version": "0.8.0"}
{"input": ["cuda -keys=cuda,gpu -max_num_threads=1024 -thread_warp_size=32", "batch_matmul_tensorcore_q_k.cuda", [["TENSOR", [12, 384, 64], "float16"], ["TENSOR", [12, 384, 64], "float16"]], {}], "config": {"index": 6897, "code_hash": null, "entity": [["block_row_warps", "ot", 1], ["warp_row_tiles", "ot", 2], ["warp_col_tiles", "ot", 2], ["chunk", "ot", 2], ["offset", "ot", 0], ["offsetCS", "ot", 8], ["vec", "ot", 2], ["wmma_m", "ot", 8]]}, "result": [[4.2890403e-05], 0, 1.0148799419403076, 1650614085.9718828], "version": 0.2, "tvm_version": "0.8.0"}
{"input": ["cuda -keys=cuda,gpu -max_num_threads=1024 -thread_warp_size=32", "batch_matmul_tensorcore_q_k.cuda", [["TENSOR", [12, 384, 64], "float16"], ["TENSOR", [12, 384, 64], "float16"]], {}], "config": {"index": 5766, "code_hash": null, "entity": [["block_row_warps", "ot", 1], ["warp_row_tiles", "ot", 4], ["warp_col_tiles", "ot", 1], ["chunk", "ot", 1], ["offset", "ot", 0], ["offsetCS", "ot", 0], ["vec", "ot", 1], ["wmma_m", "ot", 8]]}, "result": [[7.9518532e-05], 0, 1.1920881271362305, 1650614087.272674], "version": 0.2, "tvm_version": "0.8.0"}
{"input": ["cuda -keys=cuda,gpu -max_num_threads=1024 -thread_warp_size=32", "batch_matmul_tensorcore_q_k.cuda", [["TENSOR", [12, 384, 64], "float16"], ["TENSOR", [12, 384, 64], "float16"]], {}], "config": {"index": 6126, "code_hash": null, "entity": [["block_row_warps", "ot", 1], ["warp_row_tiles", "ot", 4], ["warp_col_tiles", "ot", 1], ["chunk", "ot", 1], ["offset", "ot", 0], ["offsetCS", "ot", 8], ["vec", "ot", 1], ["wmma_m", "ot", 8]]}, "result": [[4.8564675000000004e-05], 0, 1.1875481605529785, 1650614088.0294955], "version": 0.2, "tvm_version": "0.8.0"}
{"input": ["cuda -keys=cuda,gpu -max_num_threads=1024 -thread_warp_size=32", "batch_matmul_tensorcore_q_k.cuda", [["TENSOR", [12, 384, 64], "float16"], ["TENSOR", [12, 384, 64], "float16"]], {}], "config": {"index": 7395, "code_hash": null, "entity": [["block_row_warps", "ot", 1], ["warp_row_tiles", "ot", 4], ["warp_col_tiles", "ot", 2], ["chunk", "ot", 1], ["offset", "ot", 8], ["offsetCS", "ot", 0], ["vec", "ot", 4], ["wmma_m", "ot", 8]]}, "result": [[4.5540163999999996e-05], 0, 1.0821702480316162, 1650614089.210154], "version": 0.2, "tvm_version": "0.8.0"}
{"input": ["cuda -keys=cuda,gpu -max_num_threads=1024 -thread_warp_size=32", "batch_matmul_tensorcore_q_k.cuda", [["TENSOR", [12, 384, 64], "float16"], ["TENSOR", [12, 384, 64], "float16"]], {}], "config": {"index": 7755, "code_hash": null, "entity": [["block_row_warps", "ot", 1], ["warp_row_tiles", "ot", 4], ["warp_col_tiles", "ot", 2], ["chunk", "ot", 1], ["offset", "ot", 8], ["offsetCS", "ot", 8], ["vec", "ot", 4], ["wmma_m", "ot", 8]]}, "result": [[5.012058e-05], 0, 1.0508253574371338, 1650614090.3699265], "version": 0.2, "tvm_version": "0.8.0"}
{"input": ["cuda -keys=cuda,gpu -max_num_threads=1024 -thread_warp_size=32", "batch_matmul_tensorcore_q_k.cuda", [["TENSOR", [12, 384, 64], "float16"], ["TENSOR", [12, 384, 64], "float16"]], {}], "config": {"index": 3924, "code_hash": null, "entity": [["block_row_warps", "ot", 1], ["warp_row_tiles", "ot", 1], ["warp_col_tiles", "ot", 2], ["chunk", "ot", 8], ["offset", "ot", 8], ["offsetCS", "ot", 0], ["vec", "ot", 2], ["wmma_m", "ot", 16]]}, "result": [[5.2264221e-05], 0, 1.1817748546600342, 1650614091.1338391], "version": 0.2, "tvm_version": "0.8.0"}
{"input": ["cuda -keys=cuda,gpu -max_num_threads=1024 -thread_warp_size=32", "batch_matmul_tensorcore_q_k.cuda", [["TENSOR", [12, 384, 64], "float16"], ["TENSOR", [12, 384, 64], "float16"]], {}], "config": {"index": 8121, "code_hash": null, "entity": [["block_row_warps", "ot", 1], ["warp_row_tiles", "ot", 2], ["warp_col_tiles", "ot", 4], ["chunk", "ot", 1], ["offset", "ot", 8], ["offsetCS", "ot", 0], ["vec", "ot", 8], ["wmma_m", "ot", 8]]}, "result": [[5.7130886e-05], 0, 1.076728343963623, 1650614092.3004992], "version": 0.2, "tvm_version": "0.8.0"}
{"input": ["cuda -keys=cuda,gpu -max_num_threads=1024 -thread_warp_size=32", "batch_matmul_tensorcore_q_k.cuda", [["TENSOR", [12, 384, 64], "float16"], ["TENSOR", [12, 384, 64], "float16"]], {}], "config": {"index": 7941, "code_hash": null, "entity": [["block_row_warps", "ot", 1], ["warp_row_tiles", "ot", 2], ["warp_col_tiles", "ot", 4], ["chunk", "ot", 1], ["offset", "ot", 0], ["offsetCS", "ot", 0], ["vec", "ot", 8], ["wmma_m", "ot", 8]]}, "result": [[5.457077000000001e-05], 0, 1.1119444370269775, 1650614093.487935], "version": 0.2, "tvm_version": "0.8.0"}
{"input": ["cuda -keys=cuda,gpu -max_num_threads=1024 -thread_warp_size=32", "batch_matmul_tensorcore_q_k.cuda", [["TENSOR", [12, 384, 64], "float16"], ["TENSOR", [12, 384, 64], "float16"]], {}], "config": {"index": 8481, "code_hash": null, "entity": [["block_row_warps", "ot", 1], ["warp_row_tiles", "ot", 2], ["warp_col_tiles", "ot", 4], ["chunk", "ot", 1], ["offset", "ot", 8], ["offsetCS", "ot", 8], ["vec", "ot", 8], ["wmma_m", "ot", 8]]}, "result": [[5.2936186999999994e-05], 0, 1.201934576034546, 1650614094.2657614], "version": 0.2, "tvm_version": "0.8.0"}
{"input": ["cuda -keys=cuda,gpu -max_num_threads=1024 -thread_warp_size=32", "batch_matmul_tensorcore_q_k.cuda", [["TENSOR", [12, 384, 64], "float16"], ["TENSOR", [12, 384, 64], "float16"]], {}], "config": {"index": 8301, "code_hash": null, "entity": [["block_row_warps", "ot", 1], ["warp_row_tiles", "ot", 2], ["warp_col_tiles", "ot", 4], ["chunk", "ot", 1], ["offset", "ot", 0], ["offsetCS", "ot", 8], ["vec", "ot", 8], ["wmma_m", "ot", 8]]}, "result": [[4.9982355e-05], 0, 1.1196322441101074, 1650614095.4389832], "version": 0.2, "tvm_version": "0.8.0"}
{"input": ["cuda -keys=cuda,gpu -max_num_threads=1024 -thread_warp_size=32", "batch_matmul_tensorcore_q_k.cuda", [["TENSOR", [12, 384, 64], "float16"], ["TENSOR", [12, 384, 64], "float16"]], {}], "config": {"index": 6679, "code_hash": null, "entity": [["block_row_warps", "ot", 2], ["warp_row_tiles", "ot", 1], ["warp_col_tiles", "ot", 4], ["chunk", "ot", 1], ["offset", "ot", 8], ["offsetCS", "ot", 0], ["vec", "ot", 2], ["wmma_m", "ot", 8]]}, "result": [[5.2764381999999997e-05], 0, 1.0848228931427002, 1650614096.1485875], "version": 0.2, "tvm_version": "0.8.0"}
{"input": ["cuda -keys=cuda,gpu -max_num_threads=1024 -thread_warp_size=32", "batch_matmul_tensorcore_q_k.cuda", [["TENSOR", [12, 384, 64], "float16"], ["TENSOR", [12, 384, 64], "float16"]], {}], "config": {"index": 7039, "code_hash": null, "entity": [["block_row_warps", "ot", 2], ["warp_row_tiles", "ot", 1], ["warp_col_tiles", "ot", 4], ["chunk", "ot", 1], ["offset", "ot", 8], ["offsetCS", "ot", 8], ["vec", "ot", 2], ["wmma_m", "ot", 8]]}, "result": [[4.4143704e-05], 0, 1.0358045101165771, 1650614097.2699142], "version": 0.2, "tvm_version": "0.8.0"}
{"input": ["cuda -keys=cuda,gpu -max_num_threads=1024 -thread_warp_size=32", "batch_matmul_tensorcore_q_k.cuda", [["TENSOR", [12, 384, 64], "float16"], ["TENSOR", [12, 384, 64], "float16"]], {}], "config": {"index": 7620, "code_hash": null, "entity": [["block_row_warps", "ot", 1], ["warp_row_tiles", "ot", 4], ["warp_col_tiles", "ot", 2], ["chunk", "ot", 2], ["offset", "ot", 0], ["offsetCS", "ot", 8], ["vec", "ot", 4], ["wmma_m", "ot", 8]]}, "result": [[4.3365696999999996e-05], 0, 1.0609791278839111, 1650614097.9546993], "version": 0.2, "tvm_version": "0.8.0"}
{"input": ["cuda -keys=cuda,gpu -max_num_threads=1024 -thread_warp_size=32", "batch_matmul_tensorcore_q_k.cuda", [["TENSOR", [12, 384, 64], "float16"], ["TENSOR", [12, 384, 64], "float16"]], {}], "config": {"index": 7260, "code_hash": null, "entity": [["block_row_warps", "ot", 1], ["warp_row_tiles", "ot", 4], ["warp_col_tiles", "ot", 2], ["chunk", "ot", 2], ["offset", "ot", 0], ["offsetCS", "ot", 0], ["vec", "ot", 4], ["wmma_m", "ot", 8]]}, "result": [[5.5309955e-05], 0, 1.0808732509613037, 1650614099.120962], "version": 0.2, "tvm_version": "0.8.0"}
{"input": ["cuda -keys=cuda,gpu -max_num_threads=1024 -thread_warp_size=32", "batch_matmul_tensorcore_q_k.cuda", [["TENSOR", [12, 384, 64], "float16"], ["TENSOR", [12, 384, 64], "float16"]], {}], "config": {"index": 6675, "code_hash": null, "entity": [["block_row_warps", "ot", 1], ["warp_row_tiles", "ot", 4], ["warp_col_tiles", "ot", 2], ["chunk", "ot", 1], ["offset", "ot", 8], ["offsetCS", "ot", 0], ["vec", "ot", 2], ["wmma_m", "ot", 8]]}, "result": [[4.3925190000000004e-05], 0, 1.0677905082702637, 1650614100.2452586], "version": 0.2, "tvm_version": "0.8.0"}
{"input": ["cuda -keys=cuda,gpu -max_num_threads=1024 -thread_warp_size=32", "batch_matmul_tensorcore_q_k.cuda", [["TENSOR", [12, 384, 64], "float16"], ["TENSOR", [12, 384, 64], "float16"]], {}], "config": {"index": 7035, "code_hash": null, "entity": [["block_row_warps", "ot", 1], ["warp_row_tiles", "ot", 4], ["warp_col_tiles", "ot", 2], ["chunk", "ot", 1], ["offset", "ot", 8], ["offsetCS", "ot", 8], ["vec", "ot", 2], ["wmma_m", "ot", 8]]}, "result": [[3.1378757e-05], 0, 0.9799902439117432, 1650614100.8450525], "version": 0.2, "tvm_version": "0.8.0"}
{"input": ["cuda -keys=cuda,gpu -max_num_threads=1024 -thread_warp_size=32", "batch_matmul_tensorcore_q_k.cuda", [["TENSOR", [12, 384, 64], "float16"], ["TENSOR", [12, 384, 64], "float16"]], {}], "config": {"index": 8118, "code_hash": null, "entity": [["block_row_warps", "ot", 1], ["warp_row_tiles", "ot", 1], ["warp_col_tiles", "ot", 4], ["chunk", "ot", 1], ["offset", "ot", 8], ["offsetCS", "ot", 0], ["vec", "ot", 8], ["wmma_m", "ot", 8]]}, "result": [[9.4858803e-05], 0, 1.2276418209075928, 1650614101.6809034], "version": 0.2, "tvm_version": "0.8.0"}
{"input": ["cuda -keys=cuda,gpu -max_num_threads=1024 -thread_warp_size=32", "batch_matmul_tensorcore_q_k.cuda", [["TENSOR", [12, 384, 64], "float16"], ["TENSOR", [12, 384, 64], "float16"]], {}], "config": {"index": 7938, "code_hash": null, "entity": [["block_row_warps", "ot", 1], ["warp_row_tiles", "ot", 1], ["warp_col_tiles", "ot", 4], ["chunk", "ot", 1], ["offset", "ot", 0], ["offsetCS", "ot", 0], ["vec", "ot", 8], ["wmma_m", "ot", 8]]}, "result": [[9.369363900000001e-05], 0, 1.327467441558838, 1650614102.6195734], "version": 0.2, "tvm_version": "0.8.0"}
{"input": ["cuda -keys=cuda,gpu -max_num_threads=1024 -thread_warp_size=32", "batch_matmul_tensorcore_q_k.cuda", [["TENSOR", [12, 384, 64], "float16"], ["TENSOR", [12, 384, 64], "float16"]], {}], "config": {"index": 8478, "code_hash": null, "entity": [["block_row_warps", "ot", 1], ["warp_row_tiles", "ot", 1], ["warp_col_tiles", "ot", 4], ["chunk", "ot", 1], ["offset", "ot", 8], ["offsetCS", "ot", 8], ["vec", "ot", 8], ["wmma_m", "ot", 8]]}, "result": [[9.062100499999999e-05], 0, 1.1552302837371826, 1650614103.8666337], "version": 0.2, "tvm_version": "0.8.0"}
{"input": ["cuda -keys=cuda,gpu -max_num_threads=1024 -thread_warp_size=32", "batch_matmul_tensorcore_q_k.cuda", [["TENSOR", [12, 384, 64], "float16"], ["TENSOR", [12, 384, 64], "float16"]], {}], "config": {"index": 8298, "code_hash": null, "entity": [["block_row_warps", "ot", 1], ["warp_row_tiles", "ot", 1], ["warp_col_tiles", "ot", 4], ["chunk", "ot", 1], ["offset", "ot", 0], ["offsetCS", "ot", 8], ["vec", "ot", 8], ["wmma_m", "ot", 8]]}, "result": [[8.9039052e-05], 0, 1.2327308654785156, 1650614104.7336452], "version": 0.2, "tvm_version": "0.8.0"}
{"input": ["cuda -keys=cuda,gpu -max_num_threads=1024 -thread_warp_size=32", "batch_matmul_tensorcore_q_k.cuda", [["TENSOR", [12, 384, 64], "float16"], ["TENSOR", [12, 384, 64], "float16"]], {}], "config": {"index": 6034, "code_hash": null, "entity": [["block_row_warps", "ot", 2], ["warp_row_tiles", "ot", 2], ["warp_col_tiles", "ot", 1], ["chunk", "ot", 4], ["offset", "ot", 8], ["offsetCS", "ot", 0], ["vec", "ot", 1], ["wmma_m", "ot", 8]]}, "result": [[0.00011725124099999999], 0, 1.2896974086761475, 1650614105.7076244], "version": 0.2, "tvm_version": "0.8.0"}
{"input": ["cuda -keys=cuda,gpu -max_num_threads=1024 -thread_warp_size=32", "batch_matmul_tensorcore_q_k.cuda", [["TENSOR", [12, 384, 64], "float16"], ["TENSOR", [12, 384, 64], "float16"]], {}], "config": {"index": 5899, "code_hash": null, "entity": [["block_row_warps", "ot", 2], ["warp_row_tiles", "ot", 2], ["warp_col_tiles", "ot", 1], ["chunk", "ot", 8], ["offset", "ot", 0], ["offsetCS", "ot", 0], ["vec", "ot", 1], ["wmma_m", "ot", 8]]}, "result": [[0.000392169414], 0, 2.0159339904785156, 1650614107.8629968], "version": 0.2, "tvm_version": "0.8.0"}
{"input": ["cuda -keys=cuda,gpu -max_num_threads=1024 -thread_warp_size=32", "batch_matmul_tensorcore_q_k.cuda", [["TENSOR", [12, 384, 64], "float16"], ["TENSOR", [12, 384, 64], "float16"]], {}], "config": {"index": 3790, "code_hash": null, "entity": [["block_row_warps", "ot", 2], ["warp_row_tiles", "ot", 1], ["warp_col_tiles", "ot", 2], ["chunk", "ot", 1], ["offset", "ot", 8], ["offsetCS", "ot", 0], ["vec", "ot", 2], ["wmma_m", "ot", 16]]}, "result": [[0.000152445001], 0, 1.3836374282836914, 1650614109.9143717], "version": 0.2, "tvm_version": "0.8.0"}
{"input": ["cuda -keys=cuda,gpu -max_num_threads=1024 -thread_warp_size=32", "batch_matmul_tensorcore_q_k.cuda", [["TENSOR", [12, 384, 64], "float16"], ["TENSOR", [12, 384, 64], "float16"]], {}], "config": {"index": 4278, "code_hash": null, "entity": [["block_row_warps", "ot", 1], ["warp_row_tiles", "ot", 2], ["warp_col_tiles", "ot", 1], ["chunk", "ot", 8], ["offset", "ot", 8], ["offsetCS", "ot", 8], ["vec", "ot", 2], ["wmma_m", "ot", 16]]}, "result": [[8.331768e-05], 0, 1.0671179294586182, 1650614112.170163], "version": 0.2, "tvm_version": "0.8.0"}
{"input": ["cuda -keys=cuda,gpu -max_num_threads=1024 -thread_warp_size=32", "batch_matmul_tensorcore_q_k.cuda", [["TENSOR", [12, 384, 64], "float16"], ["TENSOR", [12, 384, 64], "float16"]], {}], "config": {"index": 6546, "code_hash": null, "entity": [["block_row_warps", "ot", 1], ["warp_row_tiles", "ot", 2], ["warp_col_tiles", "ot", 4], ["chunk", "ot", 2], ["offset", "ot", 0], ["offsetCS", "ot", 0], ["vec", "ot", 2], ["wmma_m", "ot", 8]]}, "result": [[3.7795067e-05], 0, 0.9735352993011475, 1650614113.8047504], "version": 0.2, "tvm_version": "0.8.0"}
{"input": ["cuda -keys=cuda,gpu -max_num_threads=1024 -thread_warp_size=32", "batch_matmul_tensorcore_q_k.cuda", [["TENSOR", [12, 384, 64], "float16"], ["TENSOR", [12, 384, 64], "float16"]], {}], "config": {"index": 4770, "code_hash": null, "entity": [["block_row_warps", "ot", 1], ["warp_row_tiles", "ot", 1], ["warp_col_tiles", "ot", 1], ["chunk", "ot", 4], ["offset", "ot", 0], ["offsetCS", "ot", 8], ["vec", "ot", 4], ["wmma_m", "ot", 16]]}, "result": [[0.000345952998], 0, 1.839414119720459, 1650614115.8498964], "version": 0.2, "tvm_version": "0.8.0"}
{"input": ["cuda -keys=cuda,gpu -max_num_threads=1024 -thread_warp_size=32", "batch_matmul_tensorcore_q_k.cuda", [["TENSOR", [12, 384, 64], "float16"], ["TENSOR", [12, 384, 64], "float16"]], {}], "config": {"index": 4158, "code_hash": null, "entity": [["block_row_warps", "ot", 1], ["warp_row_tiles", "ot", 1], ["warp_col_tiles", "ot", 4], ["chunk", "ot", 1], ["offset", "ot", 8], ["offsetCS", "ot", 8], ["vec", "ot", 2], ["wmma_m", "ot", 16]]}, "result": [[4.0285662e-05], 0, 1.0484118461608887, 1650614138.8630698], "version": 0.2, "tvm_version": "0.8.0"}
{"input": ["cuda -keys=cuda,gpu -max_num_threads=1024 -thread_warp_size=32", "batch_matmul_tensorcore_q_k.cuda", [["TENSOR", [12, 384, 64], "float16"], ["TENSOR", [12, 384, 64], "float16"]], {}], "config": {"index": 6312, "code_hash": null, "entity": [["block_row_warps", "ot", 1], ["warp_row_tiles", "ot", 2], ["warp_col_tiles", "ot", 2], ["chunk", "ot", 1], ["offset", "ot", 8], ["offsetCS", "ot", 8], ["vec", "ot", 1], ["wmma_m", "ot", 8]]}, "result": [[2.7064184e-05], 0, 1.0899415016174316, 1650614139.5263212], "version": 0.2, "tvm_version": "0.8.0"}
{"input": ["cuda -keys=cuda,gpu -max_num_threads=1024 -thread_warp_size=32", "batch_matmul_tensorcore_q_k.cuda", [["TENSOR", [12, 384, 64], "float16"], ["TENSOR", [12, 384, 64], "float16"]], {}], "config": {"index": 4161, "code_hash": null, "entity": [["block_row_warps", "ot", 1], ["warp_row_tiles", "ot", 2], ["warp_col_tiles", "ot", 4], ["chunk", "ot", 1], ["offset", "ot", 8], ["offsetCS", "ot", 8], ["vec", "ot", 2], ["wmma_m", "ot", 16]]}, "result": [[3.3675215e-05], 0, 1.0054166316986084, 1650614140.1206431], "version": 0.2, "tvm_version": "0.8.0"}
{"input": ["cuda -keys=cuda,gpu -max_num_threads=1024 -thread_warp_size=32", "batch_matmul_tensorcore_q_k.cuda", [["TENSOR", [12, 384, 64], "float16"], ["TENSOR", [12, 384, 64], "float16"]], {}], "config": {"index": 6315, "code_hash": null, "entity": [["block_row_warps", "ot", 1], ["warp_row_tiles", "ot", 4], ["warp_col_tiles", "ot", 2], ["chunk", "ot", 1], ["offset", "ot", 8], ["offsetCS", "ot", 8], ["vec", "ot", 1], ["wmma_m", "ot", 8]]}, "result": [[3.7540488000000005e-05], 0, 1.0405261516571045, 1650614140.7468748], "version": 0.2, "tvm_version": "0.8.0"}
{"input": ["cuda -keys=cuda,gpu -max_num_threads=1024 -thread_warp_size=32", "batch_matmul_tensorcore_q_k.cuda", [["TENSOR", [12, 384, 64], "float16"], ["TENSOR", [12, 384, 64], "float16"]], {}], "config": {"index": 3441, "code_hash": null, "entity": [["block_row_warps", "ot", 1], ["warp_row_tiles", "ot", 2], ["warp_col_tiles", "ot", 4], ["chunk", "ot", 1], ["offset", "ot", 8], ["offsetCS", "ot", 8], ["vec", "ot", 1], ["wmma_m", "ot", 16]]}, "result": [[3.2530771e-05], 0, 1.1105663776397705, 1650614141.4629903], "version": 0.2, "tvm_version": "0.8.0"}
{"input": ["cuda -keys=cuda,gpu -max_num_threads=1024 -thread_warp_size=32", "batch_matmul_tensorcore_q_k.cuda", [["TENSOR", [12, 384, 64], "float16"], ["TENSOR", [12, 384, 64], "float16"]], {}], "config": {"index": 7041, "code_hash": null, "entity": [["block_row_warps", "ot", 1], ["warp_row_tiles", "ot", 2], ["warp_col_tiles", "ot", 4], ["chunk", "ot", 1], ["offset", "ot", 8], ["offsetCS", "ot", 8], ["vec", "ot", 2], ["wmma_m", "ot", 8]]}, "result": [[4.4088007e-05], 0, 1.0773186683654785, 1650614142.1201138], "version": 0.2, "tvm_version": "0.8.0"}
{"input": ["cuda -keys=cuda,gpu -max_num_threads=1024 -thread_warp_size=32", "batch_matmul_tensorcore_q_k.cuda", [["TENSOR", [12, 384, 64], "float16"], ["TENSOR", [12, 384, 64], "float16"]], {}], "config": {"index": 4887, "code_hash": null, "entity": [["block_row_warps", "ot", 1], ["warp_row_tiles", "ot", 1], ["warp_col_tiles", "ot", 8], ["chunk", "ot", 1], ["offset", "ot", 8], ["offsetCS", "ot", 8], ["vec", "ot", 4], ["wmma_m", "ot", 16]]}, "result": [[3.2132391e-05], 0, 1.062666893005371, 1650614142.776211], "version": 0.2, "tvm_version": "0.8.0"}
{"input": ["cuda -keys=cuda,gpu -max_num_threads=1024 -thread_warp_size=32", "batch_matmul_tensorcore_q_k.cuda", [["TENSOR", [12, 384, 64], "float16"], ["TENSOR", [12, 384, 64], "float16"]], {}], "config": {"index": 6321, "code_hash": null, "entity": [["block_row_warps", "ot", 1], ["warp_row_tiles", "ot", 2], ["warp_col_tiles", "ot", 4], ["chunk", "ot", 1], ["offset", "ot", 8], ["offsetCS", "ot", 8], ["vec", "ot", 1], ["wmma_m", "ot", 8]]}, "result": [[6.4869992e-05], 0, 1.226691484451294, 1650614143.6233213], "version": 0.2, "tvm_version": "0.8.0"}
{"input": ["cuda -keys=cuda,gpu -max_num_threads=1024 -thread_warp_size=32", "batch_matmul_tensorcore_q_k.cuda", [["TENSOR", [12, 384, 64], "float16"], ["TENSOR", [12, 384, 64], "float16"]], {}], "config": {"index": 3978, "code_hash": null, "entity": [["block_row_warps", "ot", 1], ["warp_row_tiles", "ot", 1], ["warp_col_tiles", "ot", 4], ["chunk", "ot", 1], ["offset", "ot", 0], ["offsetCS", "ot", 8], ["vec", "ot", 2], ["wmma_m", "ot", 16]]}, "result": [[3.1017497e-05], 0, 1.029958724975586, 1650614144.2745538], "version": 0.2, "tvm_version": "0.8.0"}
{"input": ["cuda -keys=cuda,gpu -max_num_threads=1024 -thread_warp_size=32", "batch_matmul_tensorcore_q_k.cuda", [["TENSOR", [12, 384, 64], "float16"], ["TENSOR", [12, 384, 64], "float16"]], {}], "config": {"index": 3438, "code_hash": null, "entity": [["block_row_warps", "ot", 1], ["warp_row_tiles", "ot", 1], ["warp_col_tiles", "ot", 4], ["chunk", "ot", 1], ["offset", "ot", 8], ["offsetCS", "ot", 8], ["vec", "ot", 1], ["wmma_m", "ot", 16]]}, "result": [[2.3424521e-05], 0, 0.9537577629089355, 1650614144.8513546], "version": 0.2, "tvm_version": "0.8.0"}
{"input": ["cuda -keys=cuda,gpu -max_num_threads=1024 -thread_warp_size=32", "batch_matmul_tensorcore_q_k.cuda", [["TENSOR", [12, 384, 64], "float16"], ["TENSOR", [12, 384, 64], "float16"]], {}], "config": {"index": 7044, "code_hash": null, "entity": [["block_row_warps", "ot", 1], ["warp_row_tiles", "ot", 4], ["warp_col_tiles", "ot", 4], ["chunk", "ot", 1], ["offset", "ot", 8], ["offsetCS", "ot", 8], ["vec", "ot", 2], ["wmma_m", "ot", 8]]}, "result": [[4.0824558e-05], 0, 1.074207067489624, 1650614145.5386457], "version": 0.2, "tvm_version": "0.8.0"}
{"input": ["cuda -keys=cuda,gpu -max_num_threads=1024 -thread_warp_size=32", "batch_matmul_tensorcore_q_k.cuda", [["TENSOR", [12, 384, 64], "float16"], ["TENSOR", [12, 384, 64], "float16"]], {}], "config": {"index": 3798, "code_hash": null, "entity": [["block_row_warps", "ot", 1], ["warp_row_tiles", "ot", 1], ["warp_col_tiles", "ot", 4], ["chunk", "ot", 1], ["offset", "ot", 8], ["offsetCS", "ot", 0], ["vec", "ot", 2], ["wmma_m", "ot", 16]]}, "result": [[3.4973611000000004e-05], 0, 0.9946086406707764, 1650614146.1745427], "version": 0.2, "tvm_version": "0.8.0"}
{"input": ["cuda -keys=cuda,gpu -max_num_threads=1024 -thread_warp_size=32", "batch_matmul_tensorcore_q_k.cuda", [["TENSOR", [12, 384, 64], "float16"], ["TENSOR", [12, 384, 64], "float16"]], {}], "config": {"index": 6681, "code_hash": null, "entity": [["block_row_warps", "ot", 1], ["warp_row_tiles", "ot", 2], ["warp_col_tiles", "ot", 4], ["chunk", "ot", 1], ["offset", "ot", 8], ["offsetCS", "ot", 0], ["vec", "ot", 2], ["wmma_m", "ot", 8]]}, "result": [[4.353921600000001e-05], 0, 1.0522689819335938, 1650614146.8401177], "version": 0.2, "tvm_version": "0.8.0"}
{"input": ["cuda -keys=cuda,gpu -max_num_threads=1024 -thread_warp_size=32", "batch_matmul_tensorcore_q_k.cuda", [["TENSOR", [12, 384, 64], "float16"], ["TENSOR", [12, 384, 64], "float16"]], {}], "config": {"index": 7485, "code_hash": null, "entity": [["block_row_warps", "ot", 1], ["warp_row_tiles", "ot", 4], ["warp_col_tiles", "ot", 2], ["chunk", "ot", 4], ["offset", "ot", 8], ["offsetCS", "ot", 0], ["vec", "ot", 4], ["wmma_m", "ot", 8]]}, "result": [[3.8595115e-05], 0, 1.1715538501739502, 1650614147.5830636], "version": 0.2, "tvm_version": "0.8.0"}
{"input": ["cuda -keys=cuda,gpu -max_num_threads=1024 -thread_warp_size=32", "batch_matmul_tensorcore_q_k.cuda", [["TENSOR", [12, 384, 64], "float16"], ["TENSOR", [12, 384, 64], "float16"]], {}], "config": {"index": 7845, "code_hash": null, "entity": [["block_row_warps", "ot", 1], ["warp_row_tiles", "ot", 4], ["warp_col_tiles", "ot", 2], ["chunk", "ot", 4], ["offset", "ot", 8], ["offsetCS", "ot", 8], ["vec", "ot", 4], ["wmma_m", "ot", 8]]}, "result": [[2.7382368e-05], 0, 1.0143852233886719, 1650614148.1821876], "version": 0.2, "tvm_version": "0.8.0"}
{"input": ["cuda -keys=cuda,gpu -max_num_threads=1024 -thread_warp_size=32", "batch_matmul_tensorcore_q_k.cuda", [["TENSOR", [12, 384, 64], "float16"], ["TENSOR", [12, 384, 64], "float16"]], {}], "config": {"index": 5955, "code_hash": null, "entity": [["block_row_warps", "ot", 1], ["warp_row_tiles", "ot", 4], ["warp_col_tiles", "ot", 2], ["chunk", "ot", 1], ["offset", "ot", 8], ["offsetCS", "ot", 0], ["vec", "ot", 1], ["wmma_m", "ot", 8]]}, "result": [[4.6251025e-05], 0, 1.0822291374206543, 1650614148.8698895], "version": 0.2, "tvm_version": "0.8.0"}
{"input": ["cuda -keys=cuda,gpu -max_num_threads=1024 -thread_warp_size=32", "batch_matmul_tensorcore_q_k.cuda", [["TENSOR", [12, 384, 64], "float16"], ["TENSOR", [12, 384, 64], "float16"]], {}], "config": {"index": 7086, "code_hash": null, "entity": [["block_row_warps", "ot", 1], ["warp_row_tiles", "ot", 2], ["warp_col_tiles", "ot", 4], ["chunk", "ot", 2], ["offset", "ot", 8], ["offsetCS", "ot", 8], ["vec", "ot", 2], ["wmma_m", "ot", 8]]}, "result": [[2.6599786e-05], 0, 1.0069572925567627, 1650614149.5088096], "version": 0.2, "tvm_version": "0.8.0"}
{"input": ["cuda -keys=cuda,gpu -max_num_threads=1024 -thread_warp_size=32", "batch_matmul_tensorcore_q_k.cuda", [["TENSOR", [12, 384, 64], "float16"], ["TENSOR", [12, 384, 64], "float16"]], {}], "config": {"index": 7077, "code_hash": null, "entity": [["block_row_warps", "ot", 1], ["warp_row_tiles", "ot", 2], ["warp_col_tiles", "ot", 2], ["chunk", "ot", 2], ["offset", "ot", 8], ["offsetCS", "ot", 8], ["vec", "ot", 2], ["wmma_m", "ot", 8]]}, "result": [[2.5866506e-05], 0, 0.9524221420288086, 1650614150.0920212], "version": 0.2, "tvm_version": "0.8.0"}
{"input": ["cuda -keys=cuda,gpu -max_num_threads=1024 -thread_warp_size=32", "batch_matmul_tensorcore_q_k.cuda", [["TENSOR", [12, 384, 64], "float16"], ["TENSOR", [12, 384, 64], "float16"]], {}], "config": {"index": 6684, "code_hash": null, "entity": [["block_row_warps", "ot", 1], ["warp_row_tiles", "ot", 4], ["warp_col_tiles", "ot", 4], ["chunk", "ot", 1], ["offset", "ot", 8], ["offsetCS", "ot", 0], ["vec", "ot", 2], ["wmma_m", "ot", 8]]}, "result": [[4.6659044e-05], 0, 1.1903774738311768, 1650614150.8165545], "version": 0.2, "tvm_version": "0.8.0"}
{"input": ["cuda -keys=cuda,gpu -max_num_threads=1024 -thread_warp_size=32", "batch_matmul_tensorcore_q_k.cuda", [["TENSOR", [12, 384, 64], "float16"], ["TENSOR", [12, 384, 64], "float16"]], {}], "config": {"index": 5952, "code_hash": null, "entity": [["block_row_warps", "ot", 1], ["warp_row_tiles", "ot", 2], ["warp_col_tiles", "ot", 2], ["chunk", "ot", 1], ["offset", "ot", 8], ["offsetCS", "ot", 0], ["vec", "ot", 1], ["wmma_m", "ot", 8]]}, "result": [[3.254838e-05], 0, 1.0705382823944092, 1650614151.5278535], "version": 0.2, "tvm_version": "0.8.0"}
{"input": ["cuda -keys=cuda,gpu -max_num_threads=1024 -thread_warp_size=32", "batch_matmul_tensorcore_q_k.cuda", [["TENSOR", [12, 384, 64], "float16"], ["TENSOR", [12, 384, 64], "float16"]], {}], "config": {"index": 6861, "code_hash": null, "entity": [["block_row_warps", "ot", 1], ["warp_row_tiles", "ot", 2], ["warp_col_tiles", "ot", 4], ["chunk", "ot", 1], ["offset", "ot", 0], ["offsetCS", "ot", 8], ["vec", "ot", 2], ["wmma_m", "ot", 8]]}, "result": [[4.1442524e-05], 0, 1.0787205696105957, 1650614152.2199028], "version": 0.2, "tvm_version": "0.8.0"}
{"input": ["cuda -keys=cuda,gpu -max_num_threads=1024 -thread_warp_size=32", "batch_matmul_tensorcore_q_k.cuda", [["TENSOR", [12, 384, 64], "float16"], ["TENSOR", [12, 384, 64], "float16"]], {}], "config": {"index": 1287, "code_hash": null, "entity": [["block_row_warps", "ot", 1], ["warp_row_tiles", "ot", 1], ["warp_col_tiles", "ot", 8], ["chunk", "ot", 1], ["offset", "ot", 8], ["offsetCS", "ot", 8], ["vec", "ot", 2], ["wmma_m", "ot", 32]]}, "result": [[2.7943331000000002e-05], 0, 0.9859623908996582, 1650614152.8081665], "version": 0.2, "tvm_version": "0.8.0"}
{"input": ["cuda -keys=cuda,gpu -max_num_threads=1024 -thread_warp_size=32", "batch_matmul_tensorcore_q_k.cuda", [["TENSOR", [12, 384, 64], "float16"], ["TENSOR", [12, 384, 64], "float16"]], {}], "config": {"index": 7167, "code_hash": null, "entity": [["block_row_warps", "ot", 1], ["warp_row_tiles", "ot", 2], ["warp_col_tiles", "ot", 2], ["chunk", "ot", 8], ["offset", "ot", 8], ["offsetCS", "ot", 8], ["vec", "ot", 2], ["wmma_m", "ot", 8]]}, "result": [[3.7412087999999994e-05], 0, 1.0268950462341309, 1650614153.473686], "version": 0.2, "tvm_version": "0.8.0"}
{"input": ["cuda -keys=cuda,gpu -max_num_threads=1024 -thread_warp_size=32", "batch_matmul_tensorcore_q_k.cuda", [["TENSOR", [12, 384, 64], "float16"], ["TENSOR", [12, 384, 64], "float16"]], {}], "config": {"index": 7581, "code_hash": null, "entity": [["block_row_warps", "ot", 1], ["warp_row_tiles", "ot", 2], ["warp_col_tiles", "ot", 4], ["chunk", "ot", 1], ["offset", "ot", 0], ["offsetCS", "ot", 8], ["vec", "ot", 4], ["wmma_m", "ot", 8]]}, "result": [[3.8511763000000005e-05], 0, 1.1493520736694336, 1650614154.20956], "version": 0.2, "tvm_version": "0.8.0"}
{"input": ["cuda -keys=cuda,gpu -max_num_threads=1024 -thread_warp_size=32", "batch_matmul_tensorcore_q_k.cuda", [["TENSOR", [12, 384, 64], "float16"], ["TENSOR", [12, 384, 64], "float16"]], {}], "config": {"index": 6855, "code_hash": null, "entity": [["block_row_warps", "ot", 1], ["warp_row_tiles", "ot", 4], ["warp_col_tiles", "ot", 2], ["chunk", "ot", 1], ["offset", "ot", 0], ["offsetCS", "ot", 8], ["vec", "ot", 2], ["wmma_m", "ot", 8]]}, "result": [[3.5477659e-05], 0, 1.1016087532043457, 1650614154.8902833], "version": 0.2, "tvm_version": "0.8.0"}
{"input": ["cuda -keys=cuda,gpu -max_num_threads=1024 -thread_warp_size=32", "batch_matmul_tensorcore_q_k.cuda", [["TENSOR", [12, 384, 64], "float16"], ["TENSOR", [12, 384, 64], "float16"]], {}], "config": {"index": 4170, "code_hash": null, "entity": [["block_row_warps", "ot", 1], ["warp_row_tiles", "ot", 2], ["warp_col_tiles", "ot", 8], ["chunk", "ot", 1], ["offset", "ot", 8], ["offsetCS", "ot", 8], ["vec", "ot", 2], ["wmma_m", "ot", 16]]}, "result": [[4.0289870999999996e-05], 0, 1.0654640197753906, 1650614155.5598502], "version": 0.2, "tvm_version": "0.8.0"}
{"input": ["cuda -keys=cuda,gpu -max_num_threads=1024 -thread_warp_size=32", "batch_matmul_tensorcore_q_k.cuda", [["TENSOR", [12, 384, 64], "float16"], ["TENSOR", [12, 384, 64], "float16"]], {}], "config": {"index": 3081, "code_hash": null, "entity": [["block_row_warps", "ot", 1], ["warp_row_tiles", "ot", 2], ["warp_col_tiles", "ot", 4], ["chunk", "ot", 1], ["offset", "ot", 8], ["offsetCS", "ot", 0], ["vec", "ot", 1], ["wmma_m", "ot", 16]]}, "result": [[3.3226531e-05], 0, 1.012624740600586, 1650614156.1435213], "version": 0.2, "tvm_version": "0.8.0"}
{"input": ["cuda -keys=cuda,gpu -max_num_threads=1024 -thread_warp_size=32", "batch_matmul_tensorcore_q_k.cuda", [["TENSOR", [12, 384, 64], "float16"], ["TENSOR", [12, 384, 64], "float16"]], {}], "config": {"index": 3981, "code_hash": null, "entity": [["block_row_warps", "ot", 1], ["warp_row_tiles", "ot", 2], ["warp_col_tiles", "ot", 4], ["chunk", "ot", 1], ["offset", "ot", 0], ["offsetCS", "ot", 8], ["vec", "ot", 2], ["wmma_m", "ot", 16]]}, "result": [[3.157533e-05], 0, 1.0306003093719482, 1650614156.7820623], "version": 0.2, "tvm_version": "0.8.0"}
{"input": ["cuda -keys=cuda,gpu -max_num_threads=1024 -thread_warp_size=32", "batch_matmul_tensorcore_q_k.cuda", [["TENSOR", [12, 384, 64], "float16"], ["TENSOR", [12, 384, 64], "float16"]], {}], "config": {"index": 3429, "code_hash": null, "entity": [["block_row_warps", "ot", 1], ["warp_row_tiles", "ot", 1], ["warp_col_tiles", "ot", 2], ["chunk", "ot", 1], ["offset", "ot", 8], ["offsetCS", "ot", 8], ["vec", "ot", 1], ["wmma_m", "ot", 16]]}, "result": [[3.8136755e-05], 0, 1.01650071144104, 1650614157.4435625], "version": 0.2, "tvm_version": "0.8.0"}
{"input": ["cuda -keys=cuda,gpu -max_num_threads=1024 -thread_warp_size=32", "batch_matmul_tensorcore_q_k.cuda", [["TENSOR", [12, 384, 64], "float16"], ["TENSOR", [12, 384, 64], "float16"]], {}], "config": {"index": 6726, "code_hash": null, "entity": [["block_row_warps", "ot", 1], ["warp_row_tiles", "ot", 2], ["warp_col_tiles", "ot", 4], ["chunk", "ot", 2], ["offset", "ot", 8], ["offsetCS", "ot", 0], ["vec", "ot", 2], ["wmma_m", "ot", 8]]}, "result": [[3.1029434e-05], 0, 1.0137856006622314, 1650614158.025664], "version": 0.2, "tvm_version": "0.8.0"}
{"input": ["cuda -keys=cuda,gpu -max_num_threads=1024 -thread_warp_size=32", "batch_matmul_tensorcore_q_k.cuda", [["TENSOR", [12, 384, 64], "float16"], ["TENSOR", [12, 384, 64], "float16"]], {}], "config": {"index": 6807, "code_hash": null, "entity": [["block_row_warps", "ot", 1], ["warp_row_tiles", "ot", 2], ["warp_col_tiles", "ot", 2], ["chunk", "ot", 8], ["offset", "ot", 8], ["offsetCS", "ot", 0], ["vec", "ot", 2], ["wmma_m", "ot", 8]]}, "result": [[3.4177103e-05], 0, 1.0180463790893555, 1650614158.6412032], "version": 0.2, "tvm_version": "0.8.0"}
{"input": ["cuda -keys=cuda,gpu -max_num_threads=1024 -thread_warp_size=32", "batch_matmul_tensorcore_q_k.cuda", [["TENSOR", [12, 384, 64], "float16"], ["TENSOR", [12, 384, 64], "float16"]], {}], "config": {"index": 4167, "code_hash": null, "entity": [["block_row_warps", "ot", 1], ["warp_row_tiles", "ot", 1], ["warp_col_tiles", "ot", 8], ["chunk", "ot", 1], ["offset", "ot", 8], ["offsetCS", "ot", 8], ["vec", "ot", 2], ["wmma_m", "ot", 16]]}, "result": [[5.7480073e-05], 0, 1.1682469844818115, 1650614159.4200537], "version": 0.2, "tvm_version": "0.8.0"}
