python/models/resnext/kernel_configs/resnext_imagenet_50_fused_conv1x1_conv1x1_1_56_56_64_256_256.log
{"i": [["[\"fused_conv1x1_conv1x1\", 1, 56, 56, 64, 256, 256]", "cuda -keys=cuda,gpu -max_num_threads=1024 -model=unknown -thread_warp_size=32", [-1, 16, 64, 49152, 2147483647, 1024, 8, 32], "", 0, []], [[], [["CHW", 2, "local"], ["SP", 2, 0, 1, [1, 1, 1, 1], 1], ["SP", 2, 5, 2, [1, 1, 1, 1], 1], ["SP", 2, 10, 56, [4, 1, 1, 1], 1], ["SP", 2, 15, 56, [1, 2, 2, 1], 1], ["SP", 2, 20, 256, [1, 32, 2, 1], 1], ["SP", 2, 25, 256, [4, 2], 1], ["RE", 2, [0, 5, 10, 15, 20, 1, 6, 11, 16, 21, 2, 7, 12, 17, 22, 25, 26, 3, 8, 13, 18, 23, 27, 4, 9, 14, 19, 24]], ["FSP", 3, 0, 1, 3], ["FSP", 3, 4, 2, 3], ["FSP", 3, 8, 3, 3], ["FSP", 3, 12, 4, 3], ["FSP", 3, 16, 5, 3], ["RE", 3, [0, 4, 8, 12, 16, 1, 5, 9, 13, 17, 2, 6, 10, 14, 18, 3, 7, 11, 15, 19]], ["CA", 2, 3, 14], ["CHR", 1, "shared", [2]], ["CA", 2, 3, 15], ["CHR", 0, "shared", [3]], ["CA", 1, 4, 15], ["FU", 5, [0, 1, 2, 3, 4]], ["AN", 5, 0, 5], ["FU", 5, [1, 2, 3, 4, 5]], ["AN", 5, 1, 4], ["FU", 5, [2, 3, 4, 5, 6]], ["AN", 5, 2, 6], ["FU", 3, [0, 1]], ["SP", 3, 0, 288, [1], 1], ["AN", 3, 1, 2], ["FFSP", 3, 0, [5, 4, 3, 2, 1], 1, 1], ["AN", 3, 1, 6], ["FU", 1, [0, 1, 2, 3]], ["SP", 1, 0, 144, [3], 1], ["AN", 1, 1, 2], ["FFSP", 1, 0, [5, 4, 3, 2, 1], 1, 1], ["AN", 1, 1, 6], ["PR", 4, 0, "auto_unroll_max_step$16"]]]], "r": [[0.00058754, 0.000587618, 0.000587508, 0.000587767, 0.000587574, 0.000587589, 0.000587609, 0.000587495, 0.000587645, 0.000587557], 0, 6.11444, 1649994305], "v": "v0.6"}
{"i": [["[\"fused_conv1x1_conv1x1\", 1, 56, 56, 64, 256, 256]", "cuda -keys=cuda,gpu -max_num_threads=1024 -model=unknown -thread_warp_size=32", [-1, 16, 64, 49152, 2147483647, 1024, 8, 32], "", 0, []], [[], [["CHW", 2, "local"], ["SP", 2, 0, 1, [1, 1, 1, 1], 1], ["SP", 2, 5, 2, [1, 1, 2, 1], 1], ["SP", 2, 10, 56, [1, 14, 1, 1], 1], ["SP", 2, 15, 56, [1, 2, 1, 2], 1], ["SP", 2, 20, 256, [2, 4, 1, 2], 1], ["SP", 2, 25, 256, [1, 4], 1], ["RE", 2, [0, 5, 10, 15, 20, 1, 6, 11, 16, 21, 2, 7, 12, 17, 22, 25, 26, 3, 8, 13, 18, 23, 27, 4, 9, 14, 19, 24]], ["FSP", 3, 0, 1, 3], ["FSP", 3, 4, 2, 3], ["FSP", 3, 8, 3, 3], ["FSP", 3, 12, 4, 3], ["FSP", 3, 16, 5, 3], ["RE", 3, [0, 4, 8, 12, 16, 1, 5, 9, 13, 17, 2, 6, 10, 14, 18, 3, 7, 11, 15, 19]], ["CA", 2, 3, 14], ["CHR", 1, "shared", [2]], ["CA", 2, 3, 15], ["CHR", 0, "shared", [3]], ["CA", 1, 4, 15], ["FU", 5, [0, 1, 2, 3, 4]], ["AN", 5, 0, 5], ["FU", 5, [1, 2, 3, 4, 5]], ["AN", 5, 1, 4], ["FU", 5, [2, 3, 4, 5, 6]], ["AN", 5, 2, 6], ["FU", 3, [0, 1]], ["SP", 3, 0, 136, [1], 1], ["AN", 3, 1, 2], ["FFSP", 3, 0, [5, 4, 3, 2, 1], 1, 1], ["AN", 3, 1, 6], ["FU", 1, [0, 1, 2, 3]], ["SP", 1, 0, 272, [1], 1], ["AN", 1, 1, 2], ["FFSP", 1, 0, [5, 4, 3, 2, 1], 1, 1], ["AN", 1, 1, 6], ["PR", 4, 0, "auto_unroll_max_step$512"]]]], "r": [[0.000420146, 0.000420364, 0.000420831, 0.000420909, 0.000420832, 0.000421825, 0.000421025, 0.000421649, 0.000421142, 0.000422049], 0, 12.0615, 1649994311], "v": "v0.6"}
