python/models/resnext/kernel_configs/resnext_imagenet_50_conv1x1_bn_relu_1_56_56_512_8_2.log
{"i": [["[\"conv1x1_bn_relu\", 1, 56, 56, 512, 8, 2]", "cuda -keys=cuda,gpu -max_num_threads=1024 -model=unknown -thread_warp_size=32", [-1, 16, 64, 49152, 2147483647, 1024, 8, 32], "", 0, []], [[], [["CI", 6], ["CI", 4], ["SP", 2, 0, 1, [1, 1, 1, 1], 1], ["SP", 2, 5, 28, [1, 7, 1, 4], 1], ["SP", 2, 10, 28, [1, 1, 7, 2], 1], ["SP", 2, 15, 8, [1, 1, 1, 8], 1], ["SP", 2, 20, 512, [1, 1], 1], ["RE", 2, [0, 5, 10, 15, 1, 6, 11, 16, 2, 7, 12, 17, 20, 21, 3, 8, 13, 18, 22, 4, 9, 14, 19]], ["FSP", 7, 0, 2, 3], ["FSP", 7, 4, 3, 3], ["FSP", 7, 8, 4, 3], ["FSP", 7, 12, 5, 3], ["RE", 7, [0, 4, 8, 12, 1, 5, 9, 13, 2, 6, 10, 14, 3, 7, 11, 15]], ["CA", 2, 7, 11], ["CHR", 1, "shared", [2]], ["CA", 2, 3, 12], ["CHR", 0, "shared", [3]], ["CA", 1, 4, 12], ["FU", 9, [0, 1, 2, 3]], ["AN", 9, 0, 5], ["FU", 9, [1, 2, 3, 4]], ["AN", 9, 1, 4], ["FU", 9, [2, 3, 4, 5]], ["AN", 9, 2, 6], ["FU", 3, [0, 1]], ["SP", 3, 0, 1, [1], 1], ["AN", 3, 1, 2], ["FFSP", 3, 0, [5, 4, 3, 2], 1, 1], ["AN", 3, 1, 6], ["FU", 1, [0, 1, 2, 3]], ["SP", 1, 0, 189, [3], 1], ["AN", 1, 1, 2], ["FFSP", 1, 0, [5, 4, 3, 2], 1, 1], ["AN", 1, 1, 6], ["PR", 4, 0, "auto_unroll_max_step$1024"]]]], "r": [[0.0128108, 0.0127858, 0.0127941], 0, 3.33527, 1662092677], "v": "v0.6"}
{"i": [["[\"conv1x1_bn_relu\", 1, 56, 56, 512, 8, 2]", "cuda -keys=cuda,gpu -max_num_threads=1024 -model=unknown -thread_warp_size=32", [-1, 16, 64, 49152, 2147483647, 1024, 8, 32], "", 0, []], [[], [["CI", 6], ["CI", 4], ["SP", 2, 0, 1, [1, 1, 1, 1], 1], ["SP", 2, 5, 28, [1, 28, 1, 1], 1], ["SP", 2, 10, 28, [2, 2, 1, 7], 1], ["SP", 2, 15, 8, [1, 4, 2, 1], 1], ["SP", 2, 20, 512, [1, 2], 1], ["RE", 2, [0, 5, 10, 15, 1, 6, 11, 16, 2, 7, 12, 17, 20, 21, 3, 8, 13, 18, 22, 4, 9, 14, 19]], ["FSP", 7, 0, 2, 3], ["FSP", 7, 4, 3, 3], ["FSP", 7, 8, 4, 3], ["FSP", 7, 12, 5, 3], ["RE", 7, [0, 4, 8, 12, 1, 5, 9, 13, 2, 6, 10, 14, 3, 7, 11, 15]], ["CA", 2, 7, 11], ["CHR", 1, "shared", [2]], ["CA", 2, 3, 12], ["CHR", 0, "shared", [3]], ["CA", 1, 4, 12], ["FU", 9, [0, 1, 2, 3]], ["AN", 9, 0, 5], ["FU", 9, [1, 2, 3, 4]], ["AN", 9, 1, 4], ["FU", 9, [2, 3, 4, 5]], ["AN", 9, 2, 6], ["FU", 3, [0, 1]], ["SP", 3, 0, 8, [1], 1], ["AN", 3, 1, 2], ["FFSP", 3, 0, [5, 4, 3, 2], 1, 1], ["AN", 3, 1, 6], ["FU", 1, [0, 1, 2, 3]], ["SP", 1, 0, 26, [1], 1], ["AN", 1, 1, 2], ["FFSP", 1, 0, [5, 4, 3, 2], 1, 1], ["AN", 1, 1, 6], ["PR", 4, 0, "auto_unroll_max_step$64"]]]], "r": [[0.000715827, 0.000715373, 0.000715531], 0, 5.18297, 1662092681], "v": "v0.6"}
{"i": [["[\"conv1x1_bn_relu\", 1, 56, 56, 512, 8, 2]", "cuda -keys=cuda,gpu -max_num_threads=1024 -model=unknown -thread_warp_size=32", [-1, 16, 64, 49152, 2147483647, 1024, 8, 32], "", 0, []], [[], [["CI", 6], ["CI", 4], ["SP", 2, 0, 1, [1, 1, 1, 1], 1], ["SP", 2, 5, 28, [1, 2, 1, 7], 1], ["SP", 2, 10, 28, [2, 2, 1, 1], 1], ["SP", 2, 15, 8, [1, 8, 1, 1], 1], ["SP", 2, 20, 512, [32, 1], 1], ["RE", 2, [0, 5, 10, 15, 1, 6, 11, 16, 2, 7, 12, 17, 20, 21, 3, 8, 13, 18, 22, 4, 9, 14, 19]], ["FSP", 7, 0, 2, 3], ["FSP", 7, 4, 3, 3], ["FSP", 7, 8, 4, 3], ["FSP", 7, 12, 5, 3], ["RE", 7, [0, 4, 8, 12, 1, 5, 9, 13, 2, 6, 10, 14, 3, 7, 11, 15]], ["CA", 2, 7, 11], ["CHR", 1, "shared", [2]], ["CA", 2, 3, 12], ["CHR", 0, "shared", [3]], ["CA", 1, 4, 12], ["FU", 9, [0, 1, 2, 3]], ["AN", 9, 0, 5], ["FU", 9, [1, 2, 3, 4]], ["AN", 9, 1, 4], ["FU", 9, [2, 3, 4, 5]], ["AN", 9, 2, 6], ["FU", 3, [0, 1]], ["SP", 3, 0, 32, [4], 1], ["AN", 3, 1, 2], ["FFSP", 3, 0, [5, 4, 3, 2], 1, 1], ["AN", 3, 1, 6], ["FU", 1, [0, 1, 2, 3]], ["SP", 1, 0, 416, [1], 1], ["AN", 1, 1, 2], ["FFSP", 1, 0, [5, 4, 3, 2], 1, 1], ["AN", 1, 1, 6], ["PR", 4, 0, "auto_unroll_max_step$1024"]]]], "r": [[4.54327e-05, 4.54337e-05, 4.54308e-05], 0, 4.62849, 1662092680], "v": "v0.6"}
{"i": [["[\"conv1x1_bn_relu\", 1, 56, 56, 512, 8, 2]", "cuda -keys=cuda,gpu -max_num_threads=1024 -model=unknown -thread_warp_size=32", [-1, 16, 64, 49152, 2147483647, 1024, 8, 32], "", 0, []], [[], [["CI", 6], ["CI", 4], ["SP", 2, 0, 1, [1, 1, 1, 1], 1], ["SP", 2, 5, 28, [1, 1, 1, 28], 1], ["SP", 2, 10, 28, [1, 4, 1, 1], 1], ["SP", 2, 15, 8, [1, 4, 1, 2], 1], ["SP", 2, 20, 512, [8, 1], 1], ["RE", 2, [0, 5, 10, 15, 1, 6, 11, 16, 2, 7, 12, 17, 20, 21, 3, 8, 13, 18, 22, 4, 9, 14, 19]], ["FSP", 7, 0, 2, 3], ["FSP", 7, 4, 3, 3], ["FSP", 7, 8, 4, 3], ["FSP", 7, 12, 5, 3], ["RE", 7, [0, 4, 8, 12, 1, 5, 9, 13, 2, 6, 10, 14, 3, 7, 11, 15]], ["CA", 2, 7, 11], ["CHR", 1, "shared", [2]], ["CA", 2, 3, 12], ["CHR", 0, "shared", [3]], ["CA", 1, 4, 12], ["FU", 9, [0, 1, 2, 3]], ["AN", 9, 0, 5], ["FU", 9, [1, 2, 3, 4]], ["AN", 9, 1, 4], ["FU", 9, [2, 3, 4, 5]], ["AN", 9, 2, 6], ["FU", 3, [0, 1]], ["SP", 3, 0, 16, [1], 1], ["AN", 3, 1, 2], ["FFSP", 3, 0, [5, 4, 3, 2], 1, 1], ["AN", 3, 1, 6], ["FU", 1, [0, 1, 2, 3]], ["SP", 1, 0, 8, [1], 1], ["AN", 1, 1, 2], ["FFSP", 1, 0, [5, 4, 3, 2], 1, 1], ["AN", 1, 1, 6], ["PR", 4, 0, "auto_unroll_max_step$64"]]]], "r": [[0.00177623, 0.00177614, 0.00177609], 0, 2.53823, 1662092678], "v": "v0.6"}
{"i": [["[\"conv1x1_bn_relu\", 1, 56, 56, 512, 8, 2]", "cuda -keys=cuda,gpu -max_num_threads=1024 -model=unknown -thread_warp_size=32", [-1, 16, 64, 49152, 2147483647, 1024, 8, 32], "", 0, []], [[], [["CI", 6], ["CI", 4], ["SP", 2, 0, 1, [1, 1, 1, 1], 1], ["SP", 2, 5, 28, [1, 2, 2, 1], 1], ["SP", 2, 10, 28, [1, 2, 1, 7], 1], ["SP", 2, 15, 8, [1, 8, 1, 1], 1], ["SP", 2, 20, 512, [1, 2], 1], ["RE", 2, [0, 5, 10, 15, 1, 6, 11, 16, 2, 7, 12, 17, 20, 21, 3, 8, 13, 18, 22, 4, 9, 14, 19]], ["FSP", 7, 0, 2, 3], ["FSP", 7, 4, 3, 3], ["FSP", 7, 8, 4, 3], ["FSP", 7, 12, 5, 3], ["RE", 7, [0, 4, 8, 12, 1, 5, 9, 13, 2, 6, 10, 14, 3, 7, 11, 15]], ["CA", 2, 7, 11], ["CHR", 1, "shared", [2]], ["CA", 2, 3, 12], ["CHR", 0, "shared", [3]], ["CA", 1, 4, 12], ["FU", 9, [0, 1, 2, 3]], ["AN", 9, 0, 5], ["FU", 9, [1, 2, 3, 4]], ["AN", 9, 1, 4], ["FU", 9, [2, 3, 4, 5]], ["AN", 9, 2, 6], ["FU", 3, [0, 1]], ["SP", 3, 0, 2, [2], 1], ["AN", 3, 1, 2], ["FFSP", 3, 0, [5, 4, 3, 2], 1, 1], ["AN", 3, 1, 6], ["FU", 1, [0, 1, 2, 3]], ["SP", 1, 0, 78, [1], 1], ["AN", 1, 1, 2], ["FFSP", 1, 0, [5, 4, 3, 2], 1, 1], ["AN", 1, 1, 6], ["PR", 4, 0, "auto_unroll_max_step$64"]]]], "r": [[0.000146002, 0.000146019, 0.000146019], 0, 3.01451, 1662092679], "v": "v0.6"}
{"i": [["[\"conv1x1_bn_relu\", 1, 56, 56, 512, 8, 2]", "cuda -keys=cuda,gpu -max_num_threads=1024 -model=unknown -thread_warp_size=32", [-1, 16, 64, 49152, 2147483647, 1024, 8, 32], "", 0, []], [[], [["CI", 6], ["CI", 4], ["SP", 2, 0, 1, [1, 1, 1, 1], 1], ["SP", 2, 5, 28, [1, 28, 1, 1], 1], ["SP", 2, 10, 28, [1, 1, 2, 1], 1], ["SP", 2, 15, 8, [1, 4, 2, 1], 1], ["SP", 2, 20, 512, [1, 1], 1], ["RE", 2, [0, 5, 10, 15, 1, 6, 11, 16, 2, 7, 12, 17, 20, 21, 3, 8, 13, 18, 22, 4, 9, 14, 19]], ["FSP", 7, 0, 2, 3], ["FSP", 7, 4, 3, 3], ["FSP", 7, 8, 4, 3], ["FSP", 7, 12, 5, 3], ["RE", 7, [0, 4, 8, 12, 1, 5, 9, 13, 2, 6, 10, 14, 3, 7, 11, 15]], ["CA", 2, 7, 11], ["CHR", 1, "shared", [2]], ["CA", 2, 3, 12], ["CHR", 0, "shared", [3]], ["CA", 1, 4, 12], ["FU", 9, [0, 1, 2, 3]], ["AN", 9, 0, 5], ["FU", 9, [1, 2, 3, 4]], ["AN", 9, 1, 4], ["FU", 9, [2, 3, 4, 5]], ["AN", 9, 2, 6], ["FU", 3, [0, 1]], ["SP", 3, 0, 1, [1], 1], ["AN", 3, 1, 2], ["FFSP", 3, 0, [5, 4, 3, 2], 1, 1], ["AN", 3, 1, 6], ["FU", 1, [0, 1, 2, 3]], ["SP", 1, 0, 9, [1], 1], ["AN", 1, 1, 2], ["FFSP", 1, 0, [5, 4, 3, 2], 1, 1], ["AN", 1, 1, 6], ["PR", 4, 0, "auto_unroll_max_step$512"]]]], "r": [[0.000109113, 0.000109104, 0.000109108], 0, 4.10441, 1662092680], "v": "v0.6"}
{"i": [["[\"conv1x1_bn_relu\", 1, 56, 56, 512, 8, 2]", "cuda -keys=cuda,gpu -max_num_threads=1024 -model=unknown -thread_warp_size=32", [-1, 16, 64, 49152, 2147483647, 1024, 8, 32], "", 0, []], [[], [["CI", 6], ["CI", 4], ["SP", 2, 0, 1, [1, 1, 1, 1], 1], ["SP", 2, 5, 28, [2, 7, 1, 2], 1], ["SP", 2, 10, 28, [2, 7, 1, 1], 1], ["SP", 2, 15, 8, [2, 4, 1, 1], 1], ["SP", 2, 20, 512, [4, 1], 1], ["RE", 2, [0, 5, 10, 15, 1, 6, 11, 16, 2, 7, 12, 17, 20, 21, 3, 8, 13, 18, 22, 4, 9, 14, 19]], ["FSP", 7, 0, 2, 3], ["FSP", 7, 4, 3, 3], ["FSP", 7, 8, 4, 3], ["FSP", 7, 12, 5, 3], ["RE", 7, [0, 4, 8, 12, 1, 5, 9, 13, 2, 6, 10, 14, 3, 7, 11, 15]], ["CA", 2, 7, 11], ["CHR", 1, "shared", [2]], ["CA", 2, 3, 12], ["CHR", 0, "shared", [3]], ["CA", 1, 4, 12], ["FU", 9, [0, 1, 2, 3]], ["AN", 9, 0, 5], ["FU", 9, [1, 2, 3, 4]], ["AN", 9, 1, 4], ["FU", 9, [2, 3, 4, 5]], ["AN", 9, 2, 6], ["FU", 3, [0, 1]], ["SP", 3, 0, 4, [2], 1], ["AN", 3, 1, 2], ["FFSP", 3, 0, [5, 4, 3, 2], 1, 1], ["AN", 3, 1, 6], ["FU", 1, [0, 1, 2, 3]], ["SP", 1, 0, 12, [1], 1], ["AN", 1, 1, 2], ["FFSP", 1, 0, [5, 4, 3, 2], 1, 1], ["AN", 1, 1, 6], ["PR", 4, 0, "auto_unroll_max_step$64"]]]], "r": [[0.000226429, 0.000226351, 0.000226401], 0, 4.6851, 1662092681], "v": "v0.6"}
{"i": [["[\"conv1x1_bn_relu\", 1, 56, 56, 512, 8, 2]", "cuda -keys=cuda,gpu -max_num_threads=1024 -model=unknown -thread_warp_size=32", [-1, 16, 64, 49152, 2147483647, 1024, 8, 32], "", 0, []], [[], [["CI", 6], ["CI", 4], ["SP", 2, 0, 1, [1, 1, 1, 1], 1], ["SP", 2, 5, 28, [1, 7, 1, 1], 1], ["SP", 2, 10, 28, [2, 14, 1, 1], 1], ["SP", 2, 15, 8, [4, 1, 1, 1], 1], ["SP", 2, 20, 512, [1, 2], 1], ["RE", 2, [0, 5, 10, 15, 1, 6, 11, 16, 2, 7, 12, 17, 20, 21, 3, 8, 13, 18, 22, 4, 9, 14, 19]], ["FSP", 7, 0, 2, 3], ["FSP", 7, 4, 3, 3], ["FSP", 7, 8, 4, 3], ["FSP", 7, 12, 5, 3], ["RE", 7, [0, 4, 8, 12, 1, 5, 9, 13, 2, 6, 10, 14, 3, 7, 11, 15]], ["CA", 2, 7, 11], ["CHR", 1, "shared", [2]], ["CA", 2, 3, 12], ["CHR", 0, "shared", [3]], ["CA", 1, 4, 12], ["FU", 9, [0, 1, 2, 3]], ["AN", 9, 0, 5], ["FU", 9, [1, 2, 3, 4]], ["AN", 9, 1, 4], ["FU", 9, [2, 3, 4, 5]], ["AN", 9, 2, 6], ["FU", 3, [0, 1]], ["SP", 3, 0, 8, [8], 1], ["AN", 3, 1, 2], ["FFSP", 3, 0, [5, 4, 3, 2], 1, 1], ["AN", 3, 1, 6], ["FU", 1, [0, 1, 2, 3]], ["SP", 1, 0, 4, [1], 1], ["AN", 1, 1, 2], ["FFSP", 1, 0, [5, 4, 3, 2], 1, 1], ["AN", 1, 1, 6], ["PR", 4, 0, "auto_unroll_max_step$1024"]]]], "r": [[0.000233173, 0.000233158, 0.000233261], 0, 5.61831, 1662092682], "v": "v0.6"}
{"i": [["[\"conv1x1_bn_relu\", 1, 56, 56, 512, 8, 2]", "cuda -keys=cuda,gpu -max_num_threads=1024 -model=unknown -thread_warp_size=32", [-1, 16, 64, 49152, 2147483647, 1024, 8, 32], "", 0, []], [[], [["CI", 6], ["CI", 4], ["SP", 2, 0, 1, [1, 1, 1, 1], 1], ["SP", 2, 5, 28, [1, 14, 1, 2], 1], ["SP", 2, 10, 28, [1, 7, 4, 1], 1], ["SP", 2, 15, 8, [1, 1, 2, 1], 1], ["SP", 2, 20, 512, [2, 1], 1], ["RE", 2, [0, 5, 10, 15, 1, 6, 11, 16, 2, 7, 12, 17, 20, 21, 3, 8, 13, 18, 22, 4, 9, 14, 19]], ["FSP", 7, 0, 2, 3], ["FSP", 7, 4, 3, 3], ["FSP", 7, 8, 4, 3], ["FSP", 7, 12, 5, 3], ["RE", 7, [0, 4, 8, 12, 1, 5, 9, 13, 2, 6, 10, 14, 3, 7, 11, 15]], ["CA", 2, 7, 11], ["CHR", 1, "shared", [2]], ["CA", 2, 3, 12], ["CHR", 0, "shared", [3]], ["CA", 1, 4, 12], ["FU", 9, [0, 1, 2, 3]], ["AN", 9, 0, 5], ["FU", 9, [1, 2, 3, 4]], ["AN", 9, 1, 4], ["FU", 9, [2, 3, 4, 5]], ["AN", 9, 2, 6], ["FU", 3, [0, 1]], ["SP", 3, 0, 4, [1], 1], ["AN", 3, 1, 2], ["FFSP", 3, 0, [5, 4, 3, 2], 1, 1], ["AN", 3, 1, 6], ["FU", 1, [0, 1, 2, 3]], ["SP", 1, 0, 18, [1], 1], ["AN", 1, 1, 2], ["FFSP", 1, 0, [5, 4, 3, 2], 1, 1], ["AN", 1, 1, 6], ["PR", 4, 0, "auto_unroll_max_step$64"]]]], "r": [[0.000737091, 0.000737047, 0.000736738], 0, 6.74756, 1662092683], "v": "v0.6"}
{"i": [["[\"conv1x1_bn_relu\", 1, 56, 56, 512, 8, 2]", "cuda -keys=cuda,gpu -max_num_threads=1024 -model=unknown -thread_warp_size=32", [-1, 16, 64, 49152, 2147483647, 1024, 8, 32], "", 0, []], [[], [["CI", 6], ["CI", 4], ["SP", 2, 0, 1, [1, 1, 1, 1], 1], ["SP", 2, 5, 28, [1, 4, 7, 1], 1], ["SP", 2, 10, 28, [1, 7, 4, 1], 1], ["SP", 2, 15, 8, [2, 4, 1, 1], 1], ["SP", 2, 20, 512, [1, 1], 1], ["RE", 2, [0, 5, 10, 15, 1, 6, 11, 16, 2, 7, 12, 17, 20, 21, 3, 8, 13, 18, 22, 4, 9, 14, 19]], ["FSP", 7, 0, 2, 3], ["FSP", 7, 4, 3, 3], ["FSP", 7, 8, 4, 3], ["FSP", 7, 12, 5, 3], ["RE", 7, [0, 4, 8, 12, 1, 5, 9, 13, 2, 6, 10, 14, 3, 7, 11, 15]], ["CA", 2, 7, 11], ["CHR", 1, "shared", [2]], ["CA", 2, 3, 12], ["CHR", 0, "shared", [3]], ["CA", 1, 4, 12], ["FU", 9, [0, 1, 2, 3]], ["AN", 9, 0, 5], ["FU", 9, [1, 2, 3, 4]], ["AN", 9, 1, 4], ["FU", 9, [2, 3, 4, 5]], ["AN", 9, 2, 6], ["FU", 3, [0, 1]], ["SP", 3, 0, 2, [1], 1], ["AN", 3, 1, 2], ["FFSP", 3, 0, [5, 4, 3, 2], 1, 1], ["AN", 3, 1, 6], ["FU", 1, [0, 1, 2, 3]], ["SP", 1, 0, 26, [1], 1], ["AN", 1, 1, 2], ["FFSP", 1, 0, [5, 4, 3, 2], 1, 1], ["AN", 1, 1, 6], ["PR", 4, 0, "auto_unroll_max_step$512"]]]], "r": [[0.001702, 0.00170164, 0.00170159], 0, 10.0028, 1662092686], "v": "v0.6"}
{"i": [["[\"conv1x1_bn_relu\", 1, 56, 56, 512, 8, 2]", "cuda -keys=cuda,gpu -max_num_threads=1024 -model=unknown -thread_warp_size=32", [-1, 16, 64, 49152, 2147483647, 1024, 8, 32], "", 0, []], [[], [["CI", 6], ["CI", 4], ["SP", 2, 0, 1, [1, 1, 1, 1], 1], ["SP", 2, 5, 28, [1, 1, 1, 4], 1], ["SP", 2, 10, 28, [2, 1, 1, 1], 1], ["SP", 2, 15, 8, [1, 4, 1, 2], 1], ["SP", 2, 20, 512, [1, 16], 1], ["RE", 2, [0, 5, 10, 15, 1, 6, 11, 16, 2, 7, 12, 17, 20, 21, 3, 8, 13, 18, 22, 4, 9, 14, 19]], ["FSP", 7, 0, 2, 3], ["FSP", 7, 4, 3, 3], ["FSP", 7, 8, 4, 3], ["FSP", 7, 12, 5, 3], ["RE", 7, [0, 4, 8, 12, 1, 5, 9, 13, 2, 6, 10, 14, 3, 7, 11, 15]], ["CA", 2, 7, 11], ["CHR", 1, "shared", [2]], ["CA", 2, 3, 12], ["CHR", 0, "shared", [3]], ["CA", 1, 4, 12], ["FU", 9, [0, 1, 2, 3]], ["AN", 9, 0, 5], ["FU", 9, [1, 2, 3, 4]], ["AN", 9, 1, 4], ["FU", 9, [2, 3, 4, 5]], ["AN", 9, 2, 6], ["FU", 3, [0, 1]], ["SP", 3, 0, 32, [1], 1], ["AN", 3, 1, 2], ["FFSP", 3, 0, [5, 4, 3, 2], 1, 1], ["AN", 3, 1, 6], ["FU", 1, [0, 1, 2, 3]], ["SP", 1, 0, 208, [1], 1], ["AN", 1, 1, 2], ["FFSP", 1, 0, [5, 4, 3, 2], 1, 1], ["AN", 1, 1, 6], ["PR", 4, 0, "auto_unroll_max_step$0"]]]], "r": [[0.000136646, 0.000136643, 0.000136642], 0, 10.5035, 1662092687], "v": "v0.6"}
{"i": [["[\"conv1x1_bn_relu\", 1, 56, 56, 512, 8, 2]", "cuda -keys=cuda,gpu -max_num_threads=1024 -model=unknown -thread_warp_size=32", [-1, 16, 64, 49152, 2147483647, 1024, 8, 32], "", 0, []], [[], [["CI", 6], ["CI", 4], ["SP", 2, 0, 1, [1, 1, 1, 1], 1], ["SP", 2, 5, 28, [1, 1, 14, 1], 1], ["SP", 2, 10, 28, [2, 7, 2, 1], 1], ["SP", 2, 15, 8, [2, 4, 1, 1], 1], ["SP", 2, 20, 512, [1, 2], 1], ["RE", 2, [0, 5, 10, 15, 1, 6, 11, 16, 2, 7, 12, 17, 20, 21, 3, 8, 13, 18, 22, 4, 9, 14, 19]], ["FSP", 7, 0, 2, 3], ["FSP", 7, 4, 3, 3], ["FSP", 7, 8, 4, 3], ["FSP", 7, 12, 5, 3], ["RE", 7, [0, 4, 8, 12, 1, 5, 9, 13, 2, 6, 10, 14, 3, 7, 11, 15]], ["CA", 2, 7, 11], ["CHR", 1, "shared", [2]], ["CA", 2, 3, 12], ["CHR", 0, "shared", [3]], ["CA", 1, 4, 12], ["FU", 9, [0, 1, 2, 3]], ["AN", 9, 0, 5], ["FU", 9, [1, 2, 3, 4]], ["AN", 9, 1, 4], ["FU", 9, [2, 3, 4, 5]], ["AN", 9, 2, 6], ["FU", 3, [0, 1]], ["SP", 3, 0, 2, [1], 1], ["AN", 3, 1, 2], ["FFSP", 3, 0, [5, 4, 3, 2], 1, 1], ["AN", 3, 1, 6], ["FU", 1, [0, 1, 2, 3]], ["SP", 1, 0, 78, [2], 1], ["AN", 1, 1, 2], ["FFSP", 1, 0, [5, 4, 3, 2], 1, 1], ["AN", 1, 1, 6], ["PR", 4, 0, "auto_unroll_max_step$512"]]]], "r": [[0.000899496, 0.000939505, 0.00109617], 0, 9.31305, 1662092685], "v": "v0.6"}
{"i": [["[\"conv1x1_bn_relu\", 1, 56, 56, 512, 8, 2]", "cuda -keys=cuda,gpu -max_num_threads=1024 -model=unknown -thread_warp_size=32", [-1, 16, 64, 49152, 2147483647, 1024, 8, 32], "", 0, []], [[], [["CI", 6], ["CI", 4], ["SP", 2, 0, 1, [1, 1, 1, 1], 1], ["SP", 2, 5, 28, [2, 2, 1, 7], 1], ["SP", 2, 10, 28, [1, 4, 1, 7], 1], ["SP", 2, 15, 8, [1, 4, 1, 1], 1], ["SP", 2, 20, 512, [1, 2], 1], ["RE", 2, [0, 5, 10, 15, 1, 6, 11, 16, 2, 7, 12, 17, 20, 21, 3, 8, 13, 18, 22, 4, 9, 14, 19]], ["FSP", 7, 0, 2, 3], ["FSP", 7, 4, 3, 3], ["FSP", 7, 8, 4, 3], ["FSP", 7, 12, 5, 3], ["RE", 7, [0, 4, 8, 12, 1, 5, 9, 13, 2, 6, 10, 14, 3, 7, 11, 15]], ["CA", 2, 7, 11], ["CHR", 1, "shared", [2]], ["CA", 2, 3, 12], ["CHR", 0, "shared", [3]], ["CA", 1, 4, 12], ["FU", 9, [0, 1, 2, 3]], ["AN", 9, 0, 5], ["FU", 9, [1, 2, 3, 4]], ["AN", 9, 1, 4], ["FU", 9, [2, 3, 4, 5]], ["AN", 9, 2, 6], ["FU", 3, [0, 1]], ["SP", 3, 0, 2, [1], 1], ["AN", 3, 1, 2], ["FFSP", 3, 0, [5, 4, 3, 2], 1, 1], ["AN", 3, 1, 6], ["FU", 1, [0, 1, 2, 3]], ["SP", 1, 0, 338, [1], 1], ["AN", 1, 1, 2], ["FFSP", 1, 0, [5, 4, 3, 2], 1, 1], ["AN", 1, 1, 6], ["PR", 4, 0, "auto_unroll_max_step$512"]]]], "r": [[0.0022483, 0.00224859, 0.00224663], 0, 8.7844, 1662092684], "v": "v0.6"}
{"i": [["[\"conv1x1_bn_relu\", 1, 56, 56, 512, 8, 2]", "cuda -keys=cuda,gpu -max_num_threads=1024 -model=unknown -thread_warp_size=32", [-1, 16, 64, 49152, 2147483647, 1024, 8, 32], "", 0, []], [[], [["CI", 6], ["CI", 4], ["SP", 2, 0, 1, [1, 1, 1, 1], 1], ["SP", 2, 5, 28, [2, 1, 7, 1], 1], ["SP", 2, 10, 28, [1, 14, 2, 1], 1], ["SP", 2, 15, 8, [1, 8, 1, 1], 1], ["SP", 2, 20, 512, [1, 8], 1], ["RE", 2, [0, 5, 10, 15, 1, 6, 11, 16, 2, 7, 12, 17, 20, 21, 3, 8, 13, 18, 22, 4, 9, 14, 19]], ["FSP", 7, 0, 2, 3], ["FSP", 7, 4, 3, 3], ["FSP", 7, 8, 4, 3], ["FSP", 7, 12, 5, 3], ["RE", 7, [0, 4, 8, 12, 1, 5, 9, 13, 2, 6, 10, 14, 3, 7, 11, 15]], ["CA", 2, 7, 11], ["CHR", 1, "shared", [2]], ["CA", 2, 3, 12], ["CHR", 0, "shared", [3]], ["CA", 1, 4, 12], ["FU", 9, [0, 1, 2, 3]], ["AN", 9, 0, 5], ["FU", 9, [1, 2, 3, 4]], ["AN", 9, 1, 4], ["FU", 9, [2, 3, 4, 5]], ["AN", 9, 2, 6], ["FU", 3, [0, 1]], ["SP", 3, 0, 16, [1], 1], ["AN", 3, 1, 2], ["FFSP", 3, 0, [5, 4, 3, 2], 1, 1], ["AN", 3, 1, 6], ["FU", 1, [0, 1, 2, 3]], ["SP", 1, 0, 312, [1], 1], ["AN", 1, 1, 2], ["FFSP", 1, 0, [5, 4, 3, 2], 1, 1], ["AN", 1, 1, 6], ["PR", 4, 0, "auto_unroll_max_step$16"]]]], "r": [[0.0010145, 0.00101471, 0.00101475], 0, 2.14285, 1662092678], "v": "v0.6"}
{"i": [["[\"conv1x1_bn_relu\", 1, 56, 56, 512, 8, 2]", "cuda -keys=cuda,gpu -max_num_threads=1024 -model=unknown -thread_warp_size=32", [-1, 16, 64, 49152, 2147483647, 1024, 8, 32], "", 0, []], [[], [["CI", 6], ["CI", 4], ["SP", 2, 0, 1, [1, 1, 1, 1], 1], ["SP", 2, 5, 28, [1, 7, 1, 1], 1], ["SP", 2, 10, 28, [2, 7, 1, 1], 1], ["SP", 2, 15, 8, [2, 1, 1, 2], 1], ["SP", 2, 20, 512, [2, 2], 1], ["RE", 2, [0, 5, 10, 15, 1, 6, 11, 16, 2, 7, 12, 17, 20, 21, 3, 8, 13, 18, 22, 4, 9, 14, 19]], ["FSP", 7, 0, 2, 3], ["FSP", 7, 4, 3, 3], ["FSP", 7, 8, 4, 3], ["FSP", 7, 12, 5, 3], ["RE", 7, [0, 4, 8, 12, 1, 5, 9, 13, 2, 6, 10, 14, 3, 7, 11, 15]], ["CA", 2, 7, 11], ["CHR", 1, "shared", [2]], ["CA", 2, 3, 12], ["CHR", 0, "shared", [3]], ["CA", 1, 4, 12], ["FU", 9, [0, 1, 2, 3]], ["AN", 9, 0, 5], ["FU", 9, [1, 2, 3, 4]], ["AN", 9, 1, 4], ["FU", 9, [2, 3, 4, 5]], ["AN", 9, 2, 6], ["FU", 3, [0, 1]], ["SP", 3, 0, 8, [1], 1], ["AN", 3, 1, 2], ["FFSP", 3, 0, [5, 4, 3, 2], 1, 1], ["AN", 3, 1, 6], ["FU", 1, [0, 1, 2, 3]], ["SP", 1, 0, 4, [4], 1], ["AN", 1, 1, 2], ["FFSP", 1, 0, [5, 4, 3, 2], 1, 1], ["AN", 1, 1, 6], ["PR", 4, 0, "auto_unroll_max_step$1024"]]]], "r": [[0.000193054, 0.000193031, 0.00019304], 0, 6.10531, 1662092682], "v": "v0.6"}
{"i": [["[\"conv1x1_bn_relu\", 1, 56, 56, 512, 8, 2]", "cuda -keys=cuda,gpu -max_num_threads=1024 -model=unknown -thread_warp_size=32", [-1, 16, 64, 49152, 2147483647, 1024, 8, 32], "", 0, []], [[], [["CI", 6], ["CI", 4], ["SP", 2, 0, 1, [1, 1, 1, 1], 1], ["SP", 2, 5, 28, [2, 1, 1, 2], 1], ["SP", 2, 10, 28, [2, 7, 2, 1], 1], ["SP", 2, 15, 8, [1, 4, 1, 1], 1], ["SP", 2, 20, 512, [2, 4], 1], ["RE", 2, [0, 5, 10, 15, 1, 6, 11, 16, 2, 7, 12, 17, 20, 21, 3, 8, 13, 18, 22, 4, 9, 14, 19]], ["FSP", 7, 0, 2, 3], ["FSP", 7, 4, 3, 3], ["FSP", 7, 8, 4, 3], ["FSP", 7, 12, 5, 3], ["RE", 7, [0, 4, 8, 12, 1, 5, 9, 13, 2, 6, 10, 14, 3, 7, 11, 15]], ["CA", 2, 7, 11], ["CHR", 1, "shared", [2]], ["CA", 2, 3, 12], ["CHR", 0, "shared", [3]], ["CA", 1, 4, 12], ["FU", 9, [0, 1, 2, 3]], ["AN", 9, 0, 5], ["FU", 9, [1, 2, 3, 4]], ["AN", 9, 1, 4], ["FU", 9, [2, 3, 4, 5]], ["AN", 9, 2, 6], ["FU", 3, [0, 1]], ["SP", 3, 0, 8, [2], 1], ["AN", 3, 1, 2], ["FFSP", 3, 0, [5, 4, 3, 2], 1, 1], ["AN", 3, 1, 6], ["FU", 1, [0, 1, 2, 3]], ["SP", 1, 0, 24, [1], 1], ["AN", 1, 1, 2], ["FFSP", 1, 0, [5, 4, 3, 2], 1, 1], ["AN", 1, 1, 6], ["PR", 4, 0, "auto_unroll_max_step$0"]]]], "r": [[0.000235615, 0.000235603, 0.000235618], 0, 8.38041, 1662092684], "v": "v0.6"}
{"i": [["[\"conv1x1_bn_relu\", 1, 56, 56, 512, 8, 2]", "cuda -keys=cuda,gpu -max_num_threads=1024 -model=unknown -thread_warp_size=32", [-1, 16, 64, 49152, 2147483647, 1024, 8, 32], "", 0, []], [[], [["CI", 6], ["CI", 4], ["SP", 2, 0, 1, [1, 1, 1, 1], 1], ["SP", 2, 5, 28, [1, 14, 1, 1], 1], ["SP", 2, 10, 28, [1, 1, 2, 1], 1], ["SP", 2, 15, 8, [1, 4, 2, 1], 1], ["SP", 2, 20, 512, [4, 4], 1], ["RE", 2, [0, 5, 10, 15, 1, 6, 11, 16, 2, 7, 12, 17, 20, 21, 3, 8, 13, 18, 22, 4, 9, 14, 19]], ["FSP", 7, 0, 2, 3], ["FSP", 7, 4, 3, 3], ["FSP", 7, 8, 4, 3], ["FSP", 7, 12, 5, 3], ["RE", 7, [0, 4, 8, 12, 1, 5, 9, 13, 2, 6, 10, 14, 3, 7, 11, 15]], ["CA", 2, 7, 11], ["CHR", 1, "shared", [2]], ["CA", 2, 3, 12], ["CHR", 0, "shared", [3]], ["CA", 1, 4, 12], ["FU", 9, [0, 1, 2, 3]], ["AN", 9, 0, 5], ["FU", 9, [1, 2, 3, 4]], ["AN", 9, 1, 4], ["FU", 9, [2, 3, 4, 5]], ["AN", 9, 2, 6], ["FU", 3, [0, 1]], ["SP", 3, 0, 32, [1], 1], ["AN", 3, 1, 2], ["FFSP", 3, 0, [5, 4, 3, 2], 1, 1], ["AN", 3, 1, 6], ["FU", 1, [0, 1, 2, 3]], ["SP", 1, 0, 48, [16], 1], ["AN", 1, 1, 2], ["FFSP", 1, 0, [5, 4, 3, 2], 1, 1], ["AN", 1, 1, 6], ["PR", 4, 0, "auto_unroll_max_step$1024"]]]], "r": [[5.50919e-05, 5.50914e-05, 5.50801e-05], 0, 7.12586, 1662092683], "v": "v0.6"}
{"i": [["[\"conv1x1_bn_relu\", 1, 56, 56, 512, 8, 2]", "cuda -keys=cuda,gpu -max_num_threads=1024 -model=unknown -thread_warp_size=32", [-1, 16, 64, 49152, 2147483647, 1024, 8, 32], "", 0, []], [[], [["CI", 6], ["CI", 4], ["SP", 2, 0, 1, [1, 1, 1, 1], 1], ["SP", 2, 5, 28, [1, 14, 1, 2], 1], ["SP", 2, 10, 28, [1, 1, 2, 1], 1], ["SP", 2, 15, 8, [2, 1, 1, 2], 1], ["SP", 2, 20, 512, [1, 1], 1], ["RE", 2, [0, 5, 10, 15, 1, 6, 11, 16, 2, 7, 12, 17, 20, 21, 3, 8, 13, 18, 22, 4, 9, 14, 19]], ["FSP", 7, 0, 2, 3], ["FSP", 7, 4, 3, 3], ["FSP", 7, 8, 4, 3], ["FSP", 7, 12, 5, 3], ["RE", 7, [0, 4, 8, 12, 1, 5, 9, 13, 2, 6, 10, 14, 3, 7, 11, 15]], ["CA", 2, 7, 11], ["CHR", 1, "shared", [2]], ["CA", 2, 3, 12], ["CHR", 0, "shared", [3]], ["CA", 1, 4, 12], ["FU", 9, [0, 1, 2, 3]], ["AN", 9, 0, 5], ["FU", 9, [1, 2, 3, 4]], ["AN", 9, 1, 4], ["FU", 9, [2, 3, 4, 5]], ["AN", 9, 2, 6], ["FU", 3, [0, 1]], ["SP", 3, 0, 1, [1], 1], ["AN", 3, 1, 2], ["FFSP", 3, 0, [5, 4, 3, 2], 1, 1], ["AN", 3, 1, 6], ["FU", 1, [0, 1, 2, 3]], ["SP", 1, 0, 9, [1], 1], ["AN", 1, 1, 2], ["FFSP", 1, 0, [5, 4, 3, 2], 1, 1], ["AN", 1, 1, 6], ["PR", 4, 0, "auto_unroll_max_step$1024"]]]], "r": [[0.000319185, 0.000319215, 0.000319217], 0, 9.37109, 1662092685], "v": "v0.6"}
{"i": [["[\"conv1x1_bn_relu\", 1, 56, 56, 512, 8, 2]", "cuda -keys=cuda,gpu -max_num_threads=1024 -model=unknown -thread_warp_size=32", [-1, 16, 64, 49152, 2147483647, 1024, 8, 32], "", 0, []], [[], [["CI", 6], ["CI", 4], ["SP", 2, 0, 1, [1, 1, 1, 1], 1], ["SP", 2, 5, 28, [4, 7, 1, 1], 1], ["SP", 2, 10, 28, [1, 7, 2, 2], 1], ["SP", 2, 15, 8, [1, 2, 2, 1], 1], ["SP", 2, 20, 512, [2, 1], 1], ["RE", 2, [0, 5, 10, 15, 1, 6, 11, 16, 2, 7, 12, 17, 20, 21, 3, 8, 13, 18, 22, 4, 9, 14, 19]], ["FSP", 7, 0, 2, 3], ["FSP", 7, 4, 3, 3], ["FSP", 7, 8, 4, 3], ["FSP", 7, 12, 5, 3], ["RE", 7, [0, 4, 8, 12, 1, 5, 9, 13, 2, 6, 10, 14, 3, 7, 11, 15]], ["CA", 2, 7, 11], ["CHR", 1, "shared", [2]], ["CA", 2, 3, 12], ["CHR", 0, "shared", [3]], ["CA", 1, 4, 12], ["FU", 9, [0, 1, 2, 3]], ["AN", 9, 0, 5], ["FU", 9, [1, 2, 3, 4]], ["AN", 9, 1, 4], ["FU", 9, [2, 3, 4, 5]], ["AN", 9, 2, 6], ["FU", 3, [0, 1]], ["SP", 3, 0, 4, [1], 1], ["AN", 3, 1, 2], ["FFSP", 3, 0, [5, 4, 3, 2], 1, 1], ["AN", 3, 1, 6], ["FU", 1, [0, 1, 2, 3]], ["SP", 1, 0, 14, [1], 1], ["AN", 1, 1, 2], ["FFSP", 1, 0, [5, 4, 3, 2], 1, 1], ["AN", 1, 1, 6], ["PR", 4, 0, "auto_unroll_max_step$64"]]]], "r": [[0.000738213, 0.000738371, 0.000737813], 0, 11.1, 1662092687], "v": "v0.6"}
{"i": [["[\"conv1x1_bn_relu\", 1, 56, 56, 512, 8, 2]", "cuda -keys=cuda,gpu -max_num_threads=1024 -model=unknown -thread_warp_size=32", [-1, 16, 64, 49152, 2147483647, 1024, 8, 32], "", 0, []], [[], [["CI", 6], ["CI", 4], ["SP", 2, 0, 1, [1, 1, 1, 1], 1], ["SP", 2, 5, 28, [1, 1, 1, 2], 1], ["SP", 2, 10, 28, [1, 4, 1, 1], 1], ["SP", 2, 15, 8, [1, 8, 1, 1], 1], ["SP", 2, 20, 512, [64, 1], 1], ["RE", 2, [0, 5, 10, 15, 1, 6, 11, 16, 2, 7, 12, 17, 20, 21, 3, 8, 13, 18, 22, 4, 9, 14, 19]], ["FSP", 7, 0, 2, 3], ["FSP", 7, 4, 3, 3], ["FSP", 7, 8, 4, 3], ["FSP", 7, 12, 5, 3], ["RE", 7, [0, 4, 8, 12, 1, 5, 9, 13, 2, 6, 10, 14, 3, 7, 11, 15]], ["CA", 2, 7, 11], ["CHR", 1, "shared", [2]], ["CA", 2, 3, 12], ["CHR", 0, "shared", [3]], ["CA", 1, 4, 12], ["FU", 9, [0, 1, 2, 3]], ["AN", 9, 0, 5], ["FU", 9, [1, 2, 3, 4]], ["AN", 9, 1, 4], ["FU", 9, [2, 3, 4, 5]], ["AN", 9, 2, 6], ["FU", 3, [0, 1]], ["SP", 3, 0, 64, [1], 1], ["AN", 3, 1, 2], ["FFSP", 3, 0, [5, 4, 3, 2], 1, 1], ["AN", 3, 1, 6], ["FU", 1, [0, 1, 2, 3]], ["SP", 1, 0, 192, [1], 1], ["AN", 1, 1, 2], ["FFSP", 1, 0, [5, 4, 3, 2], 1, 1], ["AN", 1, 1, 6], ["PR", 4, 0, "auto_unroll_max_step$64"]]]], "r": [[1.28834e-05, 1.28644e-05, 1.288e-05], 0, 11.5462, 1662092688], "v": "v0.6"}
{"i": [["[\"conv1x1_bn_relu\", 1, 56, 56, 512, 8, 2]", "cuda -keys=cuda,gpu -max_num_threads=1024 -model=unknown -thread_warp_size=32", [-1, 16, 64, 49152, 2147483647, 1024, 8, 32], "", 0, []], [[], [["CI", 6], ["CI", 4], ["SP", 2, 0, 1, [1, 1, 1, 1], 1], ["SP", 2, 5, 28, [1, 7, 2, 1], 1], ["SP", 2, 10, 28, [1, 14, 1, 1], 1], ["SP", 2, 15, 8, [4, 1, 1, 1], 1], ["SP", 2, 20, 512, [4, 1], 1], ["RE", 2, [0, 5, 10, 15, 1, 6, 11, 16, 2, 7, 12, 17, 20, 21, 3, 8, 13, 18, 22, 4, 9, 14, 19]], ["FSP", 7, 0, 2, 3], ["FSP", 7, 4, 3, 3], ["FSP", 7, 8, 4, 3], ["FSP", 7, 12, 5, 3], ["RE", 7, [0, 4, 8, 12, 1, 5, 9, 13, 2, 6, 10, 14, 3, 7, 11, 15]], ["CA", 2, 7, 11], ["CHR", 1, "shared", [2]], ["CA", 2, 3, 12], ["CHR", 0, "shared", [3]], ["CA", 1, 4, 12], ["FU", 9, [0, 1, 2, 3]], ["AN", 9, 0, 5], ["FU", 9, [1, 2, 3, 4]], ["AN", 9, 1, 4], ["FU", 9, [2, 3, 4, 5]], ["AN", 9, 2, 6], ["FU", 3, [0, 1]], ["SP", 3, 0, 4, [1], 1], ["AN", 3, 1, 2], ["FFSP", 3, 0, [5, 4, 3, 2], 1, 1], ["AN", 3, 1, 6], ["FU", 1, [0, 1, 2, 3]], ["SP", 1, 0, 12, [6], 1], ["AN", 1, 1, 2], ["FFSP", 1, 0, [5, 4, 3, 2], 1, 1], ["AN", 1, 1, 6], ["PR", 4, 0, "auto_unroll_max_step$16"]]]], "r": [[0.000566772, 0.000566791, 0.000566678], 0, 5.5013, 1662097584], "v": "v0.6"}
{"i": [["[\"conv1x1_bn_relu\", 1, 56, 56, 512, 8, 2]", "cuda -keys=cuda,gpu -max_num_threads=1024 -model=unknown -thread_warp_size=32", [-1, 16, 64, 49152, 2147483647, 1024, 8, 32], "", 0, []], [[], [["CI", 6], ["CI", 4], ["SP", 2, 0, 1, [1, 1, 1, 1], 1], ["SP", 2, 5, 28, [1, 1, 1, 1], 1], ["SP", 2, 10, 28, [1, 28, 1, 1], 1], ["SP", 2, 15, 8, [2, 4, 1, 1], 1], ["SP", 2, 20, 512, [1, 4], 1], ["RE", 2, [0, 5, 10, 15, 1, 6, 11, 16, 2, 7, 12, 17, 20, 21, 3, 8, 13, 18, 22, 4, 9, 14, 19]], ["FSP", 7, 0, 2, 3], ["FSP", 7, 4, 3, 3], ["FSP", 7, 8, 4, 3], ["FSP", 7, 12, 5, 3], ["RE", 7, [0, 4, 8, 12, 1, 5, 9, 13, 2, 6, 10, 14, 3, 7, 11, 15]], ["CA", 2, 7, 11], ["CHR", 1, "shared", [2]], ["CA", 2, 3, 12], ["CHR", 0, "shared", [3]], ["CA", 1, 4, 12], ["FU", 9, [0, 1, 2, 3]], ["AN", 9, 0, 5], ["FU", 9, [1, 2, 3, 4]], ["AN", 9, 1, 4], ["FU", 9, [2, 3, 4, 5]], ["AN", 9, 2, 6], ["FU", 3, [0, 1]], ["SP", 3, 0, 4, [1], 1], ["AN", 3, 1, 2], ["FFSP", 3, 0, [5, 4, 3, 2], 1, 1], ["AN", 3, 1, 6], ["FU", 1, [0, 1, 2, 3]], ["SP", 1, 0, 12, [1], 1], ["AN", 1, 1, 2], ["FFSP", 1, 0, [5, 4, 3, 2], 1, 1], ["AN", 1, 1, 6], ["PR", 4, 0, "auto_unroll_max_step$64"]]]], "r": [[2.71016e-05, 2.70999e-05, 2.70948e-05], 0, 4.42946, 1662097583], "v": "v0.6"}
{"i": [["[\"conv1x1_bn_relu\", 1, 56, 56, 512, 8, 2]", "cuda -keys=cuda,gpu -max_num_threads=1024 -model=unknown -thread_warp_size=32", [-1, 16, 64, 49152, 2147483647, 1024, 8, 32], "", 0, []], [[], [["CI", 6], ["CI", 4], ["SP", 2, 0, 1, [1, 1, 1, 1], 1], ["SP", 2, 5, 28, [2, 1, 1, 1], 1], ["SP", 2, 10, 28, [1, 7, 1, 2], 1], ["SP", 2, 15, 8, [1, 1, 1, 1], 1], ["SP", 2, 20, 512, [1, 4], 1], ["RE", 2, [0, 5, 10, 15, 1, 6, 11, 16, 2, 7, 12, 17, 20, 21, 3, 8, 13, 18, 22, 4, 9, 14, 19]], ["FSP", 7, 0, 2, 3], ["FSP", 7, 4, 3, 3], ["FSP", 7, 8, 4, 3], ["FSP", 7, 12, 5, 3], ["RE", 7, [0, 4, 8, 12, 1, 5, 9, 13, 2, 6, 10, 14, 3, 7, 11, 15]], ["CA", 2, 7, 11], ["CHR", 1, "shared", [2]], ["CA", 2, 3, 12], ["CHR", 0, "shared", [3]], ["CA", 1, 4, 12], ["FU", 9, [0, 1, 2, 3]], ["AN", 9, 0, 5], ["FU", 9, [1, 2, 3, 4]], ["AN", 9, 1, 4], ["FU", 9, [2, 3, 4, 5]], ["AN", 9, 2, 6], ["FU", 3, [0, 1]], ["SP", 3, 0, 4, [4], 1], ["AN", 3, 1, 2], ["FFSP", 3, 0, [5, 4, 3, 2], 1, 1], ["AN", 3, 1, 6], ["FU", 1, [0, 1, 2, 3]], ["SP", 1, 0, 12, [1], 1], ["AN", 1, 1, 2], ["FFSP", 1, 0, [5, 4, 3, 2], 1, 1], ["AN", 1, 1, 6], ["PR", 4, 0, "auto_unroll_max_step$16"]]]], "r": [[0.000593169, 0.000593251, 0.000593308], 0, 3.35953, 1662097582], "v": "v0.6"}
{"i": [["[\"conv1x1_bn_relu\", 1, 56, 56, 512, 8, 2]", "cuda -keys=cuda,gpu -max_num_threads=1024 -model=unknown -thread_warp_size=32", [-1, 16, 64, 49152, 2147483647, 1024, 8, 32], "", 0, []], [[], [["CI", 6], ["CI", 4], ["SP", 2, 0, 1, [1, 1, 1, 1], 1], ["SP", 2, 5, 28, [1, 2, 1, 7], 1], ["SP", 2, 10, 28, [1, 14, 1, 1], 1], ["SP", 2, 15, 8, [1, 4, 2, 1], 1], ["SP", 2, 20, 512, [1, 4], 1], ["RE", 2, [0, 5, 10, 15, 1, 6, 11, 16, 2, 7, 12, 17, 20, 21, 3, 8, 13, 18, 22, 4, 9, 14, 19]], ["FSP", 7, 0, 2, 3], ["FSP", 7, 4, 3, 3], ["FSP", 7, 8, 4, 3], ["FSP", 7, 12, 5, 3], ["RE", 7, [0, 4, 8, 12, 1, 5, 9, 13, 2, 6, 10, 14, 3, 7, 11, 15]], ["CA", 2, 7, 11], ["CHR", 1, "shared", [2]], ["CA", 2, 3, 12], ["CHR", 0, "shared", [3]], ["CA", 1, 4, 12], ["FU", 9, [0, 1, 2, 3]], ["AN", 9, 0, 5], ["FU", 9, [1, 2, 3, 4]], ["AN", 9, 1, 4], ["FU", 9, [2, 3, 4, 5]], ["AN", 9, 2, 6], ["FU", 3, [0, 1]], ["SP", 3, 0, 8, [1], 1], ["AN", 3, 1, 2], ["FFSP", 3, 0, [5, 4, 3, 2], 1, 1], ["AN", 3, 1, 6], ["FU", 1, [0, 1, 2, 3]], ["SP", 1, 0, 52, [1], 1], ["AN", 1, 1, 2], ["FFSP", 1, 0, [5, 4, 3, 2], 1, 1], ["AN", 1, 1, 6], ["PR", 4, 0, "auto_unroll_max_step$64"]]]], "r": [[0.000278953, 0.000229393, 0.000210576], 0, 2.39114, 1662097580], "v": "v0.6"}
{"i": [["[\"conv1x1_bn_relu\", 1, 56, 56, 512, 8, 2]", "cuda -keys=cuda,gpu -max_num_threads=1024 -model=unknown -thread_warp_size=32", [-1, 16, 64, 49152, 2147483647, 1024, 8, 32], "", 0, []], [[], [["CI", 6], ["CI", 4], ["SP", 2, 0, 1, [1, 1, 1, 1], 1], ["SP", 2, 5, 28, [4, 7, 1, 1], 1], ["SP", 2, 10, 28, [1, 2, 2, 1], 1], ["SP", 2, 15, 8, [1, 8, 1, 1], 1], ["SP", 2, 20, 512, [1, 4], 1], ["RE", 2, [0, 5, 10, 15, 1, 6, 11, 16, 2, 7, 12, 17, 20, 21, 3, 8, 13, 18, 22, 4, 9, 14, 19]], ["FSP", 7, 0, 2, 3], ["FSP", 7, 4, 3, 3], ["FSP", 7, 8, 4, 3], ["FSP", 7, 12, 5, 3], ["RE", 7, [0, 4, 8, 12, 1, 5, 9, 13, 2, 6, 10, 14, 3, 7, 11, 15]], ["CA", 2, 7, 11], ["CHR", 1, "shared", [2]], ["CA", 2, 3, 12], ["CHR", 0, "shared", [3]], ["CA", 1, 4, 12], ["FU", 9, [0, 1, 2, 3]], ["AN", 9, 0, 5], ["FU", 9, [1, 2, 3, 4]], ["AN", 9, 1, 4], ["FU", 9, [2, 3, 4, 5]], ["AN", 9, 2, 6], ["FU", 3, [0, 1]], ["SP", 3, 0, 8, [4], 1], ["AN", 3, 1, 2], ["FFSP", 3, 0, [5, 4, 3, 2], 1, 1], ["AN", 3, 1, 6], ["FU", 1, [0, 1, 2, 3]], ["SP", 1, 0, 24, [2], 1], ["AN", 1, 1, 2], ["FFSP", 1, 0, [5, 4, 3, 2], 1, 1], ["AN", 1, 1, 6], ["PR", 4, 0, "auto_unroll_max_step$64"]]]], "r": [[0.000125344, 0.000125341, 0.000125342], 0, 3.81141, 1662097582], "v": "v0.6"}
{"i": [["[\"conv1x1_bn_relu\", 1, 56, 56, 512, 8, 2]", "cuda -keys=cuda,gpu -max_num_threads=1024 -model=unknown -thread_warp_size=32", [-1, 16, 64, 49152, 2147483647, 1024, 8, 32], "", 0, []], [[], [["CI", 6], ["CI", 4], ["SP", 2, 0, 1, [1, 1, 1, 1], 1], ["SP", 2, 5, 28, [1, 14, 2, 1], 1], ["SP", 2, 10, 28, [1, 1, 7, 4], 1], ["SP", 2, 15, 8, [1, 4, 1, 2], 1], ["SP", 2, 20, 512, [2, 2], 1], ["RE", 2, [0, 5, 10, 15, 1, 6, 11, 16, 2, 7, 12, 17, 20, 21, 3, 8, 13, 18, 22, 4, 9, 14, 19]], ["FSP", 7, 0, 2, 3], ["FSP", 7, 4, 3, 3], ["FSP", 7, 8, 4, 3], ["FSP", 7, 12, 5, 3], ["RE", 7, [0, 4, 8, 12, 1, 5, 9, 13, 2, 6, 10, 14, 3, 7, 11, 15]], ["CA", 2, 7, 11], ["CHR", 1, "shared", [2]], ["CA", 2, 3, 12], ["CHR", 0, "shared", [3]], ["CA", 1, 4, 12], ["FU", 9, [0, 1, 2, 3]], ["AN", 9, 0, 5], ["FU", 9, [1, 2, 3, 4]], ["AN", 9, 1, 4], ["FU", 9, [2, 3, 4, 5]], ["AN", 9, 2, 6], ["FU", 3, [0, 1]], ["SP", 3, 0, 8, [1], 1], ["AN", 3, 1, 2], ["FFSP", 3, 0, [5, 4, 3, 2], 1, 1], ["AN", 3, 1, 6], ["FU", 1, [0, 1, 2, 3]], ["SP", 1, 0, 324, [1], 1], ["AN", 1, 1, 2], ["FFSP", 1, 0, [5, 4, 3, 2], 1, 1], ["AN", 1, 1, 6], ["PR", 4, 0, "auto_unroll_max_step$1024"]]]], "r": [[0.00174559, 0.00174535, 0.00174508], 0, 10.3895, 1662097587], "v": "v0.6"}
{"i": [["[\"conv1x1_bn_relu\", 1, 56, 56, 512, 8, 2]", "cuda -keys=cuda,gpu -max_num_threads=1024 -model=unknown -thread_warp_size=32", [-1, 16, 64, 49152, 2147483647, 1024, 8, 32], "", 0, []], [[], [["CI", 6], ["CI", 4], ["SP", 2, 0, 1, [1, 1, 1, 1], 1], ["SP", 2, 5, 28, [1, 14, 1, 1], 1], ["SP", 2, 10, 28, [1, 14, 1, 1], 1], ["SP", 2, 15, 8, [1, 1, 8, 1], 1], ["SP", 2, 20, 512, [16, 1], 1], ["RE", 2, [0, 5, 10, 15, 1, 6, 11, 16, 2, 7, 12, 17, 20, 21, 3, 8, 13, 18, 22, 4, 9, 14, 19]], ["FSP", 7, 0, 2, 3], ["FSP", 7, 4, 3, 3], ["FSP", 7, 8, 4, 3], ["FSP", 7, 12, 5, 3], ["RE", 7, [0, 4, 8, 12, 1, 5, 9, 13, 2, 6, 10, 14, 3, 7, 11, 15]], ["CA", 2, 7, 11], ["CHR", 1, "shared", [2]], ["CA", 2, 3, 12], ["CHR", 0, "shared", [3]], ["CA", 1, 4, 12], ["FU", 9, [0, 1, 2, 3]], ["AN", 9, 0, 5], ["FU", 9, [1, 2, 3, 4]], ["AN", 9, 1, 4], ["FU", 9, [2, 3, 4, 5]], ["AN", 9, 2, 6], ["FU", 3, [0, 1]], ["SP", 3, 0, 128, [1], 1], ["AN", 3, 1, 2], ["FFSP", 3, 0, [5, 4, 3, 2], 1, 1], ["AN", 3, 1, 6], ["FU", 1, [0, 1, 2, 3]], ["SP", 1, 0, 16, [1], 1], ["AN", 1, 1, 2], ["FFSP", 1, 0, [5, 4, 3, 2], 1, 1], ["AN", 1, 1, 6], ["PR", 4, 0, "auto_unroll_max_step$0"]]]], "r": [[0.000177939, 0.000177946, 0.000177909], 0, 6.15279, 1662097585], "v": "v0.6"}
{"i": [["[\"conv1x1_bn_relu\", 1, 56, 56, 512, 8, 2]", "cuda -keys=cuda,gpu -max_num_threads=1024 -model=unknown -thread_warp_size=32", [-1, 16, 64, 49152, 2147483647, 1024, 8, 32], "", 0, []], [[], [["CI", 6], ["CI", 4], ["SP", 2, 0, 1, [1, 1, 1, 1], 1], ["SP", 2, 5, 28, [1, 14, 1, 2], 1], ["SP", 2, 10, 28, [2, 7, 1, 1], 1], ["SP", 2, 15, 8, [1, 8, 1, 1], 1], ["SP", 2, 20, 512, [1, 8], 1], ["RE", 2, [0, 5, 10, 15, 1, 6, 11, 16, 2, 7, 12, 17, 20, 21, 3, 8, 13, 18, 22, 4, 9, 14, 19]], ["FSP", 7, 0, 2, 3], ["FSP", 7, 4, 3, 3], ["FSP", 7, 8, 4, 3], ["FSP", 7, 12, 5, 3], ["RE", 7, [0, 4, 8, 12, 1, 5, 9, 13, 2, 6, 10, 14, 3, 7, 11, 15]], ["CA", 2, 7, 11], ["CHR", 1, "shared", [2]], ["CA", 2, 3, 12], ["CHR", 0, "shared", [3]], ["CA", 1, 4, 12], ["FU", 9, [0, 1, 2, 3]], ["AN", 9, 0, 5], ["FU", 9, [1, 2, 3, 4]], ["AN", 9, 1, 4], ["FU", 9, [2, 3, 4, 5]], ["AN", 9, 2, 6], ["FU", 3, [0, 1]], ["SP", 3, 0, 8, [1], 1], ["AN", 3, 1, 2], ["FFSP", 3, 0, [5, 4, 3, 2], 1, 1], ["AN", 3, 1, 6], ["FU", 1, [0, 1, 2, 3]], ["SP", 1, 0, 8, [1], 1], ["AN", 1, 1, 2], ["FFSP", 1, 0, [5, 4, 3, 2], 1, 1], ["AN", 1, 1, 6], ["PR", 4, 0, "auto_unroll_max_step$512"]]]], "r": [[0.000242066, 0.00024208, 0.000242124], 0, 2.96308, 1662097581], "v": "v0.6"}
{"i": [["[\"conv1x1_bn_relu\", 1, 56, 56, 512, 8, 2]", "cuda -keys=cuda,gpu -max_num_threads=1024 -model=unknown -thread_warp_size=32", [-1, 16, 64, 49152, 2147483647, 1024, 8, 32], "", 0, []], [[], [["CI", 6], ["CI", 4], ["SP", 2, 0, 1, [1, 1, 1, 1], 1], ["SP", 2, 5, 28, [1, 4, 1, 1], 1], ["SP", 2, 10, 28, [1, 14, 1, 1], 1], ["SP", 2, 15, 8, [1, 4, 1, 1], 1], ["SP", 2, 20, 512, [32, 1], 1], ["RE", 2, [0, 5, 10, 15, 1, 6, 11, 16, 2, 7, 12, 17, 20, 21, 3, 8, 13, 18, 22, 4, 9, 14, 19]], ["FSP", 7, 0, 2, 3], ["FSP", 7, 4, 3, 3], ["FSP", 7, 8, 4, 3], ["FSP", 7, 12, 5, 3], ["RE", 7, [0, 4, 8, 12, 1, 5, 9, 13, 2, 6, 10, 14, 3, 7, 11, 15]], ["CA", 2, 7, 11], ["CHR", 1, "shared", [2]], ["CA", 2, 3, 12], ["CHR", 0, "shared", [3]], ["CA", 1, 4, 12], ["FU", 9, [0, 1, 2, 3]], ["AN", 9, 0, 5], ["FU", 9, [1, 2, 3, 4]], ["AN", 9, 1, 4], ["FU", 9, [2, 3, 4, 5]], ["AN", 9, 2, 6], ["FU", 3, [0, 1]], ["SP", 3, 0, 32, [4], 1], ["AN", 3, 1, 2], ["FFSP", 3, 0, [5, 4, 3, 2], 1, 1], ["AN", 3, 1, 6], ["FU", 1, [0, 1, 2, 3]], ["SP", 1, 0, 32, [1], 1], ["AN", 1, 1, 2], ["FFSP", 1, 0, [5, 4, 3, 2], 1, 1], ["AN", 1, 1, 6], ["PR", 4, 0, "auto_unroll_max_step$0"]]]], "r": [[2.83899e-05, 2.8391e-05, 2.83887e-05], 0, 4.95573, 1662097583], "v": "v0.6"}
{"i": [["[\"conv1x1_bn_relu\", 1, 56, 56, 512, 8, 2]", "cuda -keys=cuda,gpu -max_num_threads=1024 -model=unknown -thread_warp_size=32", [-1, 16, 64, 49152, 2147483647, 1024, 8, 32], "", 0, []], [[], [["CI", 6], ["CI", 4], ["SP", 2, 0, 1, [1, 1, 1, 1], 1], ["SP", 2, 5, 28, [2, 14, 1, 1], 1], ["SP", 2, 10, 28, [2, 1, 14, 1], 1], ["SP", 2, 15, 8, [1, 4, 1, 1], 1], ["SP", 2, 20, 512, [1, 4], 1], ["RE", 2, [0, 5, 10, 15, 1, 6, 11, 16, 2, 7, 12, 17, 20, 21, 3, 8, 13, 18, 22, 4, 9, 14, 19]], ["FSP", 7, 0, 2, 3], ["FSP", 7, 4, 3, 3], ["FSP", 7, 8, 4, 3], ["FSP", 7, 12, 5, 3], ["RE", 7, [0, 4, 8, 12, 1, 5, 9, 13, 2, 6, 10, 14, 3, 7, 11, 15]], ["CA", 2, 7, 11], ["CHR", 1, "shared", [2]], ["CA", 2, 3, 12], ["CHR", 0, "shared", [3]], ["CA", 1, 4, 12], ["FU", 9, [0, 1, 2, 3]], ["AN", 9, 0, 5], ["FU", 9, [1, 2, 3, 4]], ["AN", 9, 1, 4], ["FU", 9, [2, 3, 4, 5]], ["AN", 9, 2, 6], ["FU", 3, [0, 1]], ["SP", 3, 0, 4, [1], 1], ["AN", 3, 1, 2], ["FFSP", 3, 0, [5, 4, 3, 2], 1, 1], ["AN", 3, 1, 6], ["FU", 1, [0, 1, 2, 3]], ["SP", 1, 0, 108, [9], 1], ["AN", 1, 1, 2], ["FFSP", 1, 0, [5, 4, 3, 2], 1, 1], ["AN", 1, 1, 6], ["PR", 4, 0, "auto_unroll_max_step$16"]]]], "r": [[0.00190676, 0.00190667, 0.00190674], 0, 6.7248, 1662097585], "v": "v0.6"}
{"i": [["[\"conv1x1_bn_relu\", 1, 56, 56, 512, 8, 2]", "cuda -keys=cuda,gpu -max_num_threads=1024 -model=unknown -thread_warp_size=32", [-1, 16, 64, 49152, 2147483647, 1024, 8, 32], "", 0, []], [[], [["CI", 6], ["CI", 4], ["SP", 2, 0, 1, [1, 1, 1, 1], 1], ["SP", 2, 5, 28, [1, 14, 2, 1], 1], ["SP", 2, 10, 28, [1, 1, 1, 2], 1], ["SP", 2, 15, 8, [1, 4, 1, 2], 1], ["SP", 2, 20, 512, [2, 32], 1], ["RE", 2, [0, 5, 10, 15, 1, 6, 11, 16, 2, 7, 12, 17, 20, 21, 3, 8, 13, 18, 22, 4, 9, 14, 19]], ["FSP", 7, 0, 2, 3], ["FSP", 7, 4, 3, 3], ["FSP", 7, 8, 4, 3], ["FSP", 7, 12, 5, 3], ["RE", 7, [0, 4, 8, 12, 1, 5, 9, 13, 2, 6, 10, 14, 3, 7, 11, 15]], ["CA", 2, 7, 11], ["CHR", 1, "shared", [2]], ["CA", 2, 3, 12], ["CHR", 0, "shared", [3]], ["CA", 1, 4, 12], ["FU", 9, [0, 1, 2, 3]], ["AN", 9, 0, 5], ["FU", 9, [1, 2, 3, 4]], ["AN", 9, 1, 4], ["FU", 9, [2, 3, 4, 5]], ["AN", 9, 2, 6], ["FU", 3, [0, 1]], ["SP", 3, 0, 128, [32], 1], ["AN", 3, 1, 2], ["FFSP", 3, 0, [5, 4, 3, 2], 1, 1], ["AN", 3, 1, 6], ["FU", 1, [0, 1, 2, 3]], ["SP", 1, 0, 576, [1], 1], ["AN", 1, 1, 2], ["FFSP", 1, 0, [5, 4, 3, 2], 1, 1], ["AN", 1, 1, 6], ["PR", 4, 0, "auto_unroll_max_step$512"]]]], "r": [[4.54259e-05, 4.54232e-05, 4.54484e-05], 0, 10.9157, 1662097588], "v": "v0.6"}
{"i": [["[\"conv1x1_bn_relu\", 1, 56, 56, 512, 8, 2]", "cuda -keys=cuda,gpu -max_num_threads=1024 -model=unknown -thread_warp_size=32", [-1, 16, 64, 49152, 2147483647, 1024, 8, 32], "", 0, []], [[], [["CI", 6], ["CI", 4], ["SP", 2, 0, 1, [1, 1, 1, 1], 1], ["SP", 2, 5, 28, [1, 28, 1, 1], 1], ["SP", 2, 10, 28, [1, 7, 2, 1], 1], ["SP", 2, 15, 8, [1, 2, 1, 2], 1], ["SP", 2, 20, 512, [2, 2], 1], ["RE", 2, [0, 5, 10, 15, 1, 6, 11, 16, 2, 7, 12, 17, 20, 21, 3, 8, 13, 18, 22, 4, 9, 14, 19]], ["FSP", 7, 0, 2, 3], ["FSP", 7, 4, 3, 3], ["FSP", 7, 8, 4, 3], ["FSP", 7, 12, 5, 3], ["RE", 7, [0, 4, 8, 12, 1, 5, 9, 13, 2, 6, 10, 14, 3, 7, 11, 15]], ["CA", 2, 7, 11], ["CHR", 1, "shared", [2]], ["CA", 2, 3, 12], ["CHR", 0, "shared", [3]], ["CA", 1, 4, 12], ["FU", 9, [0, 1, 2, 3]], ["AN", 9, 0, 5], ["FU", 9, [1, 2, 3, 4]], ["AN", 9, 1, 4], ["FU", 9, [2, 3, 4, 5]], ["AN", 9, 2, 6], ["FU", 3, [0, 1]], ["SP", 3, 0, 8, [2], 1], ["AN", 3, 1, 2], ["FFSP", 3, 0, [5, 4, 3, 2], 1, 1], ["AN", 3, 1, 6], ["FU", 1, [0, 1, 2, 3]], ["SP", 1, 0, 12, [1], 1], ["AN", 1, 1, 2], ["FFSP", 1, 0, [5, 4, 3, 2], 1, 1], ["AN", 1, 1, 6], ["PR", 4, 0, "auto_unroll_max_step$0"]]]], "r": [[0.000224805, 0.000224792, 0.000224796], 0, 10.5633, 1662097589], "v": "v0.6"}
{"i": [["[\"conv1x1_bn_relu\", 1, 56, 56, 512, 8, 2]", "cuda -keys=cuda,gpu -max_num_threads=1024 -model=unknown -thread_warp_size=32", [-1, 16, 64, 49152, 2147483647, 1024, 8, 32], "", 0, []], [[], [["CI", 6], ["CI", 4], ["SP", 2, 0, 1, [1, 1, 1, 1], 1], ["SP", 2, 5, 28, [4, 7, 1, 1], 1], ["SP", 2, 10, 28, [2, 7, 1, 1], 1], ["SP", 2, 15, 8, [1, 2, 1, 1], 1], ["SP", 2, 20, 512, [1, 8], 1], ["RE", 2, [0, 5, 10, 15, 1, 6, 11, 16, 2, 7, 12, 17, 20, 21, 3, 8, 13, 18, 22, 4, 9, 14, 19]], ["FSP", 7, 0, 2, 3], ["FSP", 7, 4, 3, 3], ["FSP", 7, 8, 4, 3], ["FSP", 7, 12, 5, 3], ["RE", 7, [0, 4, 8, 12, 1, 5, 9, 13, 2, 6, 10, 14, 3, 7, 11, 15]], ["CA", 2, 7, 11], ["CHR", 1, "shared", [2]], ["CA", 2, 3, 12], ["CHR", 0, "shared", [3]], ["CA", 1, 4, 12], ["FU", 9, [0, 1, 2, 3]], ["AN", 9, 0, 5], ["FU", 9, [1, 2, 3, 4]], ["AN", 9, 1, 4], ["FU", 9, [2, 3, 4, 5]], ["AN", 9, 2, 6], ["FU", 3, [0, 1]], ["SP", 3, 0, 8, [2], 1], ["AN", 3, 1, 2], ["FFSP", 3, 0, [5, 4, 3, 2], 1, 1], ["AN", 3, 1, 6], ["FU", 1, [0, 1, 2, 3]], ["SP", 1, 0, 56, [1], 1], ["AN", 1, 1, 2], ["FFSP", 1, 0, [5, 4, 3, 2], 1, 1], ["AN", 1, 1, 6], ["PR", 4, 0, "auto_unroll_max_step$512"]]]], "r": [[0.000236065, 0.000236079, 0.000236062], 0, 10.7444, 1662097589], "v": "v0.6"}
{"i": [["[\"conv1x1_bn_relu\", 1, 56, 56, 512, 8, 2]", "cuda -keys=cuda,gpu -max_num_threads=1024 -model=unknown -thread_warp_size=32", [-1, 16, 64, 49152, 2147483647, 1024, 8, 32], "", 0, []], [[], [["CI", 6], ["CI", 4], ["SP", 2, 0, 1, [1, 1, 1, 1], 1], ["SP", 2, 5, 28, [1, 1, 1, 1], 1], ["SP", 2, 10, 28, [1, 14, 1, 1], 1], ["SP", 2, 15, 8, [4, 1, 1, 1], 1], ["SP", 2, 20, 512, [8, 1], 1], ["RE", 2, [0, 5, 10, 15, 1, 6, 11, 16, 2, 7, 12, 17, 20, 21, 3, 8, 13, 18, 22, 4, 9, 14, 19]], ["FSP", 7, 0, 2, 3], ["FSP", 7, 4, 3, 3], ["FSP", 7, 8, 4, 3], ["FSP", 7, 12, 5, 3], ["RE", 7, [0, 4, 8, 12, 1, 5, 9, 13, 2, 6, 10, 14, 3, 7, 11, 15]], ["CA", 2, 7, 11], ["CHR", 1, "shared", [2]], ["CA", 2, 3, 12], ["CHR", 0, "shared", [3]], ["CA", 1, 4, 12], ["FU", 9, [0, 1, 2, 3]], ["AN", 9, 0, 5], ["FU", 9, [1, 2, 3, 4]], ["AN", 9, 1, 4], ["FU", 9, [2, 3, 4, 5]], ["AN", 9, 2, 6], ["FU", 3, [0, 1]], ["SP", 3, 0, 32, [16], 1], ["AN", 3, 1, 2], ["FFSP", 3, 0, [5, 4, 3, 2], 1, 1], ["AN", 3, 1, 6], ["FU", 1, [0, 1, 2, 3]], ["SP", 1, 0, 32, [1], 1], ["AN", 1, 1, 2], ["FFSP", 1, 0, [5, 4, 3, 2], 1, 1], ["AN", 1, 1, 6], ["PR", 4, 0, "auto_unroll_max_step$16"]]]], "r": [[3.33611e-05, 3.33537e-05, 3.33536e-05], 0, 7.44292, 1662097586], "v": "v0.6"}
{"i": [["[\"conv1x1_bn_relu\", 1, 56, 56, 512, 8, 2]", "cuda -keys=cuda,gpu -max_num_threads=1024 -model=unknown -thread_warp_size=32", [-1, 16, 64, 49152, 2147483647, 1024, 8, 32], "", 0, []], [[], [["CI", 6], ["CI", 4], ["SP", 2, 0, 1, [1, 1, 1, 1], 1], ["SP", 2, 5, 28, [2, 1, 7, 1], 1], ["SP", 2, 10, 28, [2, 7, 2, 1], 1], ["SP", 2, 15, 8, [1, 8, 1, 1], 1], ["SP", 2, 20, 512, [2, 2], 1], ["RE", 2, [0, 5, 10, 15, 1, 6, 11, 16, 2, 7, 12, 17, 20, 21, 3, 8, 13, 18, 22, 4, 9, 14, 19]], ["FSP", 7, 0, 2, 3], ["FSP", 7, 4, 3, 3], ["FSP", 7, 8, 4, 3], ["FSP", 7, 12, 5, 3], ["RE", 7, [0, 4, 8, 12, 1, 5, 9, 13, 2, 6, 10, 14, 3, 7, 11, 15]], ["CA", 2, 7, 11], ["CHR", 1, "shared", [2]], ["CA", 2, 3, 12], ["CHR", 0, "shared", [3]], ["CA", 1, 4, 12], ["FU", 9, [0, 1, 2, 3]], ["AN", 9, 0, 5], ["FU", 9, [1, 2, 3, 4]], ["AN", 9, 1, 4], ["FU", 9, [2, 3, 4, 5]], ["AN", 9, 2, 6], ["FU", 3, [0, 1]], ["SP", 3, 0, 4, [1], 1], ["AN", 3, 1, 2], ["FFSP", 3, 0, [5, 4, 3, 2], 1, 1], ["AN", 3, 1, 6], ["FU", 1, [0, 1, 2, 3]], ["SP", 1, 0, 324, [1], 1], ["AN", 1, 1, 2], ["FFSP", 1, 0, [5, 4, 3, 2], 1, 1], ["AN", 1, 1, 6], ["PR", 4, 0, "auto_unroll_max_step$64"]]]], "r": [[0.00162864, 0.00162871, 0.00162877], 0, 12.7095, 1662097592], "v": "v0.6"}
{"i": [["[\"conv1x1_bn_relu\", 1, 56, 56, 512, 8, 2]", "cuda -keys=cuda,gpu -max_num_threads=1024 -model=unknown -thread_warp_size=32", [-1, 16, 64, 49152, 2147483647, 1024, 8, 32], "", 0, []], [[], [["CI", 6], ["CI", 4], ["SP", 2, 0, 1, [1, 1, 1, 1], 1], ["SP", 2, 5, 28, [2, 2, 7, 1], 1], ["SP", 2, 10, 28, [1, 2, 1, 2], 1], ["SP", 2, 15, 8, [1, 1, 1, 1], 1], ["SP", 2, 20, 512, [4, 2], 1], ["RE", 2, [0, 5, 10, 15, 1, 6, 11, 16, 2, 7, 12, 17, 20, 21, 3, 8, 13, 18, 22, 4, 9, 14, 19]], ["FSP", 7, 0, 2, 3], ["FSP", 7, 4, 3, 3], ["FSP", 7, 8, 4, 3], ["FSP", 7, 12, 5, 3], ["RE", 7, [0, 4, 8, 12, 1, 5, 9, 13, 2, 6, 10, 14, 3, 7, 11, 15]], ["CA", 2, 7, 11], ["CHR", 1, "shared", [2]], ["CA", 2, 3, 12], ["CHR", 0, "shared", [3]], ["CA", 1, 4, 12], ["FU", 9, [0, 1, 2, 3]], ["AN", 9, 0, 5], ["FU", 9, [1, 2, 3, 4]], ["AN", 9, 1, 4], ["FU", 9, [2, 3, 4, 5]], ["AN", 9, 2, 6], ["FU", 3, [0, 1]], ["SP", 3, 0, 8, [1], 1], ["AN", 3, 1, 2], ["FFSP", 3, 0, [5, 4, 3, 2], 1, 1], ["AN", 3, 1, 6], ["FU", 1, [0, 1, 2, 3]], ["SP", 1, 0, 312, [1], 1], ["AN", 1, 1, 2], ["FFSP", 1, 0, [5, 4, 3, 2], 1, 1], ["AN", 1, 1, 6], ["PR", 4, 0, "auto_unroll_max_step$64"]]]], "r": [[0.00136328, 0.00136325, 0.00136331], 0, 6.98155, 1662097586], "v": "v0.6"}
{"i": [["[\"conv1x1_bn_relu\", 1, 56, 56, 512, 8, 2]", "cuda -keys=cuda,gpu -max_num_threads=1024 -model=unknown -thread_warp_size=32", [-1, 16, 64, 49152, 2147483647, 1024, 8, 32], "", 0, []], [[], [["CI", 6], ["CI", 4], ["SP", 2, 0, 1, [1, 1, 1, 1], 1], ["SP", 2, 5, 28, [1, 14, 1, 1], 1], ["SP", 2, 10, 28, [1, 7, 1, 1], 1], ["SP", 2, 15, 8, [1, 1, 4, 2], 1], ["SP", 2, 20, 512, [1, 4], 1], ["RE", 2, [0, 5, 10, 15, 1, 6, 11, 16, 2, 7, 12, 17, 20, 21, 3, 8, 13, 18, 22, 4, 9, 14, 19]], ["FSP", 7, 0, 2, 3], ["FSP", 7, 4, 3, 3], ["FSP", 7, 8, 4, 3], ["FSP", 7, 12, 5, 3], ["RE", 7, [0, 4, 8, 12, 1, 5, 9, 13, 2, 6, 10, 14, 3, 7, 11, 15]], ["CA", 2, 7, 11], ["CHR", 1, "shared", [2]], ["CA", 2, 3, 12], ["CHR", 0, "shared", [3]], ["CA", 1, 4, 12], ["FU", 9, [0, 1, 2, 3]], ["AN", 9, 0, 5], ["FU", 9, [1, 2, 3, 4]], ["AN", 9, 1, 4], ["FU", 9, [2, 3, 4, 5]], ["AN", 9, 2, 6], ["FU", 3, [0, 1]], ["SP", 3, 0, 16, [1], 1], ["AN", 3, 1, 2], ["FFSP", 3, 0, [5, 4, 3, 2], 1, 1], ["AN", 3, 1, 6], ["FU", 1, [0, 1, 2, 3]], ["SP", 1, 0, 4, [1], 1], ["AN", 1, 1, 2], ["FFSP", 1, 0, [5, 4, 3, 2], 1, 1], ["AN", 1, 1, 6], ["PR", 4, 0, "auto_unroll_max_step$0"]]]], "r": [[8.82119e-05, 8.82137e-05, 8.82294e-05], 0, 11.0589, 1662097590], "v": "v0.6"}
{"i": [["[\"conv1x1_bn_relu\", 1, 56, 56, 512, 8, 2]", "cuda -keys=cuda,gpu -max_num_threads=1024 -model=unknown -thread_warp_size=32", [-1, 16, 64, 49152, 2147483647, 1024, 8, 32], "", 0, []], [[], [["CI", 6], ["CI", 4], ["SP", 2, 0, 1, [1, 1, 1, 1], 1], ["SP", 2, 5, 28, [1, 7, 1, 1], 1], ["SP", 2, 10, 28, [2, 7, 2, 1], 1], ["SP", 2, 15, 8, [1, 8, 1, 1], 1], ["SP", 2, 20, 512, [2, 2], 1], ["RE", 2, [0, 5, 10, 15, 1, 6, 11, 16, 2, 7, 12, 17, 20, 21, 3, 8, 13, 18, 22, 4, 9, 14, 19]], ["FSP", 7, 0, 2, 3], ["FSP", 7, 4, 3, 3], ["FSP", 7, 8, 4, 3], ["FSP", 7, 12, 5, 3], ["RE", 7, [0, 4, 8, 12, 1, 5, 9, 13, 2, 6, 10, 14, 3, 7, 11, 15]], ["CA", 2, 7, 11], ["CHR", 1, "shared", [2]], ["CA", 2, 3, 12], ["CHR", 0, "shared", [3]], ["CA", 1, 4, 12], ["FU", 9, [0, 1, 2, 3]], ["AN", 9, 0, 5], ["FU", 9, [1, 2, 3, 4]], ["AN", 9, 1, 4], ["FU", 9, [2, 3, 4, 5]], ["AN", 9, 2, 6], ["FU", 3, [0, 1]], ["SP", 3, 0, 4, [1], 1], ["AN", 3, 1, 2], ["FFSP", 3, 0, [5, 4, 3, 2], 1, 1], ["AN", 3, 1, 6], ["FU", 1, [0, 1, 2, 3]], ["SP", 1, 0, 12, [1], 1], ["AN", 1, 1, 2], ["FFSP", 1, 0, [5, 4, 3, 2], 1, 1], ["AN", 1, 1, 6], ["PR", 4, 0, "auto_unroll_max_step$64"]]]], "r": [[0.000131578, 0.000131576, 0.000131566], 0, 11.3353, 1662097591], "v": "v0.6"}
{"i": [["[\"conv1x1_bn_relu\", 1, 56, 56, 512, 8, 2]", "cuda -keys=cuda,gpu -max_num_threads=1024 -model=unknown -thread_warp_size=32", [-1, 16, 64, 49152, 2147483647, 1024, 8, 32], "", 0, []], [[], [["CI", 6], ["CI", 4], ["SP", 2, 0, 1, [1, 1, 1, 1], 1], ["SP", 2, 5, 28, [1, 14, 2, 1], 1], ["SP", 2, 10, 28, [1, 2, 7, 1], 1], ["SP", 2, 15, 8, [1, 4, 1, 1], 1], ["SP", 2, 20, 512, [4, 2], 1], ["RE", 2, [0, 5, 10, 15, 1, 6, 11, 16, 2, 7, 12, 17, 20, 21, 3, 8, 13, 18, 22, 4, 9, 14, 19]], ["FSP", 7, 0, 2, 3], ["FSP", 7, 4, 3, 3], ["FSP", 7, 8, 4, 3], ["FSP", 7, 12, 5, 3], ["RE", 7, [0, 4, 8, 12, 1, 5, 9, 13, 2, 6, 10, 14, 3, 7, 11, 15]], ["CA", 2, 7, 11], ["CHR", 1, "shared", [2]], ["CA", 2, 3, 12], ["CHR", 0, "shared", [3]], ["CA", 1, 4, 12], ["FU", 9, [0, 1, 2, 3]], ["AN", 9, 0, 5], ["FU", 9, [1, 2, 3, 4]], ["AN", 9, 1, 4], ["FU", 9, [2, 3, 4, 5]], ["AN", 9, 2, 6], ["FU", 3, [0, 1]], ["SP", 3, 0, 8, [1], 1], ["AN", 3, 1, 2], ["FFSP", 3, 0, [5, 4, 3, 2], 1, 1], ["AN", 3, 1, 6], ["FU", 1, [0, 1, 2, 3]], ["SP", 1, 0, 312, [8], 1], ["AN", 1, 1, 2], ["FFSP", 1, 0, [5, 4, 3, 2], 1, 1], ["AN", 1, 1, 6], ["PR", 4, 0, "auto_unroll_max_step$0"]]]], "r": [[0.000770803, 0.000771365, 0.000771161], 0, 14.0401, 1662097594], "v": "v0.6"}
{"i": [["[\"conv1x1_bn_relu\", 1, 56, 56, 512, 8, 2]", "cuda -keys=cuda,gpu -max_num_threads=1024 -model=unknown -thread_warp_size=32", [-1, 16, 64, 49152, 2147483647, 1024, 8, 32], "", 0, []], [[], [["CI", 6], ["CI", 4], ["SP", 2, 0, 1, [1, 1, 1, 1], 1], ["SP", 2, 5, 28, [1, 28, 1, 1], 1], ["SP", 2, 10, 28, [1, 1, 4, 1], 1], ["SP", 2, 15, 8, [1, 1, 2, 4], 1], ["SP", 2, 20, 512, [4, 1], 1], ["RE", 2, [0, 5, 10, 15, 1, 6, 11, 16, 2, 7, 12, 17, 20, 21, 3, 8, 13, 18, 22, 4, 9, 14, 19]], ["FSP", 7, 0, 2, 3], ["FSP", 7, 4, 3, 3], ["FSP", 7, 8, 4, 3], ["FSP", 7, 12, 5, 3], ["RE", 7, [0, 4, 8, 12, 1, 5, 9, 13, 2, 6, 10, 14, 3, 7, 11, 15]], ["CA", 2, 7, 11], ["CHR", 1, "shared", [2]], ["CA", 2, 3, 12], ["CHR", 0, "shared", [3]], ["CA", 1, 4, 12], ["FU", 9, [0, 1, 2, 3]], ["AN", 9, 0, 5], ["FU", 9, [1, 2, 3, 4]], ["AN", 9, 1, 4], ["FU", 9, [2, 3, 4, 5]], ["AN", 9, 2, 6], ["FU", 3, [0, 1]], ["SP", 3, 0, 32, [1], 1], ["AN", 3, 1, 2], ["FFSP", 3, 0, [5, 4, 3, 2], 1, 1], ["AN", 3, 1, 6], ["FU", 1, [0, 1, 2, 3]], ["SP", 1, 0, 4, [1], 1], ["AN", 1, 1, 2], ["FFSP", 1, 0, [5, 4, 3, 2], 1, 1], ["AN", 1, 1, 6], ["PR", 4, 0, "auto_unroll_max_step$1024"]]]], "r": [[0.000142744, 0.000142744, 0.00014274], 0, 14.8626, 1662097594], "v": "v0.6"}
{"i": [["[\"conv1x1_bn_relu\", 1, 56, 56, 512, 8, 2]", "cuda -keys=cuda,gpu -max_num_threads=1024 -model=unknown -thread_warp_size=32", [-1, 16, 64, 49152, 2147483647, 1024, 8, 32], "", 0, []], [[], [["CI", 6], ["CI", 4], ["SP", 2, 0, 1, [1, 1, 1, 1], 1], ["SP", 2, 5, 28, [1, 14, 1, 1], 1], ["SP", 2, 10, 28, [1, 4, 1, 1], 1], ["SP", 2, 15, 8, [2, 1, 4, 1], 1], ["SP", 2, 20, 512, [8, 1], 1], ["RE", 2, [0, 5, 10, 15, 1, 6, 11, 16, 2, 7, 12, 17, 20, 21, 3, 8, 13, 18, 22, 4, 9, 14, 19]], ["FSP", 7, 0, 2, 3], ["FSP", 7, 4, 3, 3], ["FSP", 7, 8, 4, 3], ["FSP", 7, 12, 5, 3], ["RE", 7, [0, 4, 8, 12, 1, 5, 9, 13, 2, 6, 10, 14, 3, 7, 11, 15]], ["CA", 2, 7, 11], ["CHR", 1, "shared", [2]], ["CA", 2, 3, 12], ["CHR", 0, "shared", [3]], ["CA", 1, 4, 12], ["FU", 9, [0, 1, 2, 3]], ["AN", 9, 0, 5], ["FU", 9, [1, 2, 3, 4]], ["AN", 9, 1, 4], ["FU", 9, [2, 3, 4, 5]], ["AN", 9, 2, 6], ["FU", 3, [0, 1]], ["SP", 3, 0, 64, [1], 1], ["AN", 3, 1, 2], ["FFSP", 3, 0, [5, 4, 3, 2], 1, 1], ["AN", 3, 1, 6], ["FU", 1, [0, 1, 2, 3]], ["SP", 1, 0, 16, [2], 1], ["AN", 1, 1, 2], ["FFSP", 1, 0, [5, 4, 3, 2], 1, 1], ["AN", 1, 1, 6], ["PR", 4, 0, "auto_unroll_max_step$16"]]]], "r": [[0.000222992, 0.000223022, 0.000223026], 0, 12.8772, 1662097592], "v": "v0.6"}
{"i": [["[\"conv1x1_bn_relu\", 1, 56, 56, 512, 8, 2]", "cuda -keys=cuda,gpu -max_num_threads=1024 -model=unknown -thread_warp_size=32", [-1, 16, 64, 49152, 2147483647, 1024, 8, 32], "", 0, []], [[], [["CI", 6], ["CI", 4], ["SP", 2, 0, 1, [1, 1, 1, 1], 1], ["SP", 2, 5, 28, [1, 7, 1, 2], 1], ["SP", 2, 10, 28, [1, 1, 4, 7], 1], ["SP", 2, 15, 8, [1, 4, 1, 2], 1], ["SP", 2, 20, 512, [2, 1], 1], ["RE", 2, [0, 5, 10, 15, 1, 6, 11, 16, 2, 7, 12, 17, 20, 21, 3, 8, 13, 18, 22, 4, 9, 14, 19]], ["FSP", 7, 0, 2, 3], ["FSP", 7, 4, 3, 3], ["FSP", 7, 8, 4, 3], ["FSP", 7, 12, 5, 3], ["RE", 7, [0, 4, 8, 12, 1, 5, 9, 13, 2, 6, 10, 14, 3, 7, 11, 15]], ["CA", 2, 7, 11], ["CHR", 1, "shared", [2]], ["CA", 2, 3, 12], ["CHR", 0, "shared", [3]], ["CA", 1, 4, 12], ["FU", 9, [0, 1, 2, 3]], ["AN", 9, 0, 5], ["FU", 9, [1, 2, 3, 4]], ["AN", 9, 1, 4], ["FU", 9, [2, 3, 4, 5]], ["AN", 9, 2, 6], ["FU", 3, [0, 1]], ["SP", 3, 0, 8, [1], 1], ["AN", 3, 1, 2], ["FFSP", 3, 0, [5, 4, 3, 2], 1, 1], ["AN", 3, 1, 6], ["FU", 1, [0, 1, 2, 3]], ["SP", 1, 0, 324, [1], 1], ["AN", 1, 1, 2], ["FFSP", 1, 0, [5, 4, 3, 2], 1, 1], ["AN", 1, 1, 6], ["PR", 4, 0, "auto_unroll_max_step$0"]]]], "r": [[0.00643958, 0.00643961, 0.00643967], 0, 16.5716, 1662097596], "v": "v0.6"}
{"i": [["[\"conv1x1_bn_relu\", 1, 56, 56, 512, 8, 2]", "cuda -keys=cuda,gpu -max_num_threads=1024 -model=unknown -thread_warp_size=32", [-1, 16, 64, 49152, 2147483647, 1024, 8, 32], "", 0, []], [[], [["CI", 6], ["CI", 4], ["SP", 2, 0, 1, [1, 1, 1, 1], 1], ["SP", 2, 5, 28, [1, 1, 1, 2], 1], ["SP", 2, 10, 28, [1, 28, 1, 1], 1], ["SP", 2, 15, 8, [8, 1, 1, 1], 1], ["SP", 2, 20, 512, [1, 8], 1], ["RE", 2, [0, 5, 10, 15, 1, 6, 11, 16, 2, 7, 12, 17, 20, 21, 3, 8, 13, 18, 22, 4, 9, 14, 19]], ["FSP", 7, 0, 2, 3], ["FSP", 7, 4, 3, 3], ["FSP", 7, 8, 4, 3], ["FSP", 7, 12, 5, 3], ["RE", 7, [0, 4, 8, 12, 1, 5, 9, 13, 2, 6, 10, 14, 3, 7, 11, 15]], ["CA", 2, 7, 11], ["CHR", 1, "shared", [2]], ["CA", 2, 3, 12], ["CHR", 0, "shared", [3]], ["CA", 1, 4, 12], ["FU", 9, [0, 1, 2, 3]], ["AN", 9, 0, 5], ["FU", 9, [1, 2, 3, 4]], ["AN", 9, 1, 4], ["FU", 9, [2, 3, 4, 5]], ["AN", 9, 2, 6], ["FU", 3, [0, 1]], ["SP", 3, 0, 4, [1], 1], ["AN", 3, 1, 2], ["FFSP", 3, 0, [5, 4, 3, 2], 1, 1], ["AN", 3, 1, 6], ["FU", 1, [0, 1, 2, 3]], ["SP", 1, 0, 12, [3], 1], ["AN", 1, 1, 2], ["FFSP", 1, 0, [5, 4, 3, 2], 1, 1], ["AN", 1, 1, 6], ["PR", 4, 0, "auto_unroll_max_step$1024"]]]], "r": [[7.88422e-05, 7.88189e-05, 7.88439e-05], 0, 13.6614, 1662097593], "v": "v0.6"}
{"i": [["[\"conv1x1_bn_relu\", 1, 56, 56, 512, 8, 2]", "cuda -keys=cuda,gpu -max_num_threads=1024 -model=unknown -thread_warp_size=32", [-1, 16, 64, 49152, 2147483647, 1024, 8, 32], "", 0, []], [[], [["CI", 6], ["CI", 4], ["SP", 2, 0, 1, [1, 1, 1, 1], 1], ["SP", 2, 5, 28, [1, 7, 1, 1], 1], ["SP", 2, 10, 28, [2, 1, 2, 1], 1], ["SP", 2, 15, 8, [1, 8, 1, 1], 1], ["SP", 2, 20, 512, [2, 2], 1], ["RE", 2, [0, 5, 10, 15, 1, 6, 11, 16, 2, 7, 12, 17, 20, 21, 3, 8, 13, 18, 22, 4, 9, 14, 19]], ["FSP", 7, 0, 2, 3], ["FSP", 7, 4, 3, 3], ["FSP", 7, 8, 4, 3], ["FSP", 7, 12, 5, 3], ["RE", 7, [0, 4, 8, 12, 1, 5, 9, 13, 2, 6, 10, 14, 3, 7, 11, 15]], ["CA", 2, 7, 11], ["CHR", 1, "shared", [2]], ["CA", 2, 3, 12], ["CHR", 0, "shared", [3]], ["CA", 1, 4, 12], ["FU", 9, [0, 1, 2, 3]], ["AN", 9, 0, 5], ["FU", 9, [1, 2, 3, 4]], ["AN", 9, 1, 4], ["FU", 9, [2, 3, 4, 5]], ["AN", 9, 2, 6], ["FU", 3, [0, 1]], ["SP", 3, 0, 4, [1], 1], ["AN", 3, 1, 2], ["FFSP", 3, 0, [5, 4, 3, 2], 1, 1], ["AN", 3, 1, 6], ["FU", 1, [0, 1, 2, 3]], ["SP", 1, 0, 12, [2], 1], ["AN", 1, 1, 2], ["FFSP", 1, 0, [5, 4, 3, 2], 1, 1], ["AN", 1, 1, 6], ["PR", 4, 0, "auto_unroll_max_step$64"]]]], "r": [[5.76046e-05, 5.7609e-05, 5.76022e-05], 0, 11.8502, 1662097591], "v": "v0.6"}
{"i": [["[\"conv1x1_bn_relu\", 1, 56, 56, 512, 8, 2]", "cuda -keys=cuda,gpu -max_num_threads=1024 -model=unknown -thread_warp_size=32", [-1, 16, 64, 49152, 2147483647, 1024, 8, 32], "", 0, []], [[], [["CI", 6], ["CI", 4], ["SP", 2, 0, 1, [1, 1, 1, 1], 1], ["SP", 2, 5, 28, [7, 4, 1, 1], 1], ["SP", 2, 10, 28, [2, 14, 1, 1], 1], ["SP", 2, 15, 8, [1, 2, 1, 4], 1], ["SP", 2, 20, 512, [2, 2], 1], ["RE", 2, [0, 5, 10, 15, 1, 6, 11, 16, 2, 7, 12, 17, 20, 21, 3, 8, 13, 18, 22, 4, 9, 14, 19]], ["FSP", 7, 0, 2, 3], ["FSP", 7, 4, 3, 3], ["FSP", 7, 8, 4, 3], ["FSP", 7, 12, 5, 3], ["RE", 7, [0, 4, 8, 12, 1, 5, 9, 13, 2, 6, 10, 14, 3, 7, 11, 15]], ["CA", 2, 7, 11], ["CHR", 1, "shared", [2]], ["CA", 2, 3, 12], ["CHR", 0, "shared", [3]], ["CA", 1, 4, 12], ["FU", 9, [0, 1, 2, 3]], ["AN", 9, 0, 5], ["FU", 9, [1, 2, 3, 4]], ["AN", 9, 1, 4], ["FU", 9, [2, 3, 4, 5]], ["AN", 9, 2, 6], ["FU", 3, [0, 1]], ["SP", 3, 0, 16, [1], 1], ["AN", 3, 1, 2], ["FFSP", 3, 0, [5, 4, 3, 2], 1, 1], ["AN", 3, 1, 6], ["FU", 1, [0, 1, 2, 3]], ["SP", 1, 0, 12, [1], 1], ["AN", 1, 1, 2], ["FFSP", 1, 0, [5, 4, 3, 2], 1, 1], ["AN", 1, 1, 6], ["PR", 4, 0, "auto_unroll_max_step$64"]]]], "r": [[0.00225026, 0.00229217, 0.00249544], 0, 19.8278, 1662097599], "v": "v0.6"}
{"i": [["[\"conv1x1_bn_relu\", 1, 56, 56, 512, 8, 2]", "cuda -keys=cuda,gpu -max_num_threads=1024 -model=unknown -thread_warp_size=32", [-1, 16, 64, 49152, 2147483647, 1024, 8, 32], "", 0, []], [[], [["CI", 6], ["CI", 4], ["SP", 2, 0, 1, [1, 1, 1, 1], 1], ["SP", 2, 5, 28, [1, 7, 1, 4], 1], ["SP", 2, 10, 28, [2, 7, 1, 1], 1], ["SP", 2, 15, 8, [1, 2, 1, 1], 1], ["SP", 2, 20, 512, [1, 8], 1], ["RE", 2, [0, 5, 10, 15, 1, 6, 11, 16, 2, 7, 12, 17, 20, 21, 3, 8, 13, 18, 22, 4, 9, 14, 19]], ["FSP", 7, 0, 2, 3], ["FSP", 7, 4, 3, 3], ["FSP", 7, 8, 4, 3], ["FSP", 7, 12, 5, 3], ["RE", 7, [0, 4, 8, 12, 1, 5, 9, 13, 2, 6, 10, 14, 3, 7, 11, 15]], ["CA", 2, 7, 11], ["CHR", 1, "shared", [2]], ["CA", 2, 3, 12], ["CHR", 0, "shared", [3]], ["CA", 1, 4, 12], ["FU", 9, [0, 1, 2, 3]], ["AN", 9, 0, 5], ["FU", 9, [1, 2, 3, 4]], ["AN", 9, 1, 4], ["FU", 9, [2, 3, 4, 5]], ["AN", 9, 2, 6], ["FU", 3, [0, 1]], ["SP", 3, 0, 8, [2], 1], ["AN", 3, 1, 2], ["FFSP", 3, 0, [5, 4, 3, 2], 1, 1], ["AN", 3, 1, 6], ["FU", 1, [0, 1, 2, 3]], ["SP", 1, 0, 56, [14], 1], ["AN", 1, 1, 2], ["FFSP", 1, 0, [5, 4, 3, 2], 1, 1], ["AN", 1, 1, 6], ["PR", 4, 0, "auto_unroll_max_step$0"]]]], "r": [[0.000547, 0.000546963, 0.000546937], 0, 15.1645, 1662097595], "v": "v0.6"}
{"i": [["[\"conv1x1_bn_relu\", 1, 56, 56, 512, 8, 2]", "cuda -keys=cuda,gpu -max_num_threads=1024 -model=unknown -thread_warp_size=32", [-1, 16, 64, 49152, 2147483647, 1024, 8, 32], "", 0, []], [[], [["CI", 6], ["CI", 4], ["SP", 2, 0, 1, [1, 1, 1, 1], 1], ["SP", 2, 5, 28, [1, 14, 1, 2], 1], ["SP", 2, 10, 28, [1, 7, 4, 1], 1], ["SP", 2, 15, 8, [1, 2, 1, 4], 1], ["SP", 2, 20, 512, [1, 4], 1], ["RE", 2, [0, 5, 10, 15, 1, 6, 11, 16, 2, 7, 12, 17, 20, 21, 3, 8, 13, 18, 22, 4, 9, 14, 19]], ["FSP", 7, 0, 2, 3], ["FSP", 7, 4, 3, 3], ["FSP", 7, 8, 4, 3], ["FSP", 7, 12, 5, 3], ["RE", 7, [0, 4, 8, 12, 1, 5, 9, 13, 2, 6, 10, 14, 3, 7, 11, 15]], ["CA", 2, 7, 11], ["CHR", 1, "shared", [2]], ["CA", 2, 3, 12], ["CHR", 0, "shared", [3]], ["CA", 1, 4, 12], ["FU", 9, [0, 1, 2, 3]], ["AN", 9, 0, 5], ["FU", 9, [1, 2, 3, 4]], ["AN", 9, 1, 4], ["FU", 9, [2, 3, 4, 5]], ["AN", 9, 2, 6], ["FU", 3, [0, 1]], ["SP", 3, 0, 16, [1], 1], ["AN", 3, 1, 2], ["FFSP", 3, 0, [5, 4, 3, 2], 1, 1], ["AN", 3, 1, 6], ["FU", 1, [0, 1, 2, 3]], ["SP", 1, 0, 84, [7], 1], ["AN", 1, 1, 2], ["FFSP", 1, 0, [5, 4, 3, 2], 1, 1], ["AN", 1, 1, 6], ["PR", 4, 0, "auto_unroll_max_step$64"]]]], "r": [[0.000727123, 0.000727042, 0.000727133], 0, 19.5456, 1662097599], "v": "v0.6"}
{"i": [["[\"conv1x1_bn_relu\", 1, 56, 56, 512, 8, 2]", "cuda -keys=cuda,gpu -max_num_threads=1024 -model=unknown -thread_warp_size=32", [-1, 16, 64, 49152, 2147483647, 1024, 8, 32], "", 0, []], [[], [["CI", 6], ["CI", 4], ["SP", 2, 0, 1, [1, 1, 1, 1], 1], ["SP", 2, 5, 28, [2, 2, 1, 7], 1], ["SP", 2, 10, 28, [1, 28, 1, 1], 1], ["SP", 2, 15, 8, [1, 4, 1, 2], 1], ["SP", 2, 20, 512, [1, 4], 1], ["RE", 2, [0, 5, 10, 15, 1, 6, 11, 16, 2, 7, 12, 17, 20, 21, 3, 8, 13, 18, 22, 4, 9, 14, 19]], ["FSP", 7, 0, 2, 3], ["FSP", 7, 4, 3, 3], ["FSP", 7, 8, 4, 3], ["FSP", 7, 12, 5, 3], ["RE", 7, [0, 4, 8, 12, 1, 5, 9, 13, 2, 6, 10, 14, 3, 7, 11, 15]], ["CA", 2, 7, 11], ["CHR", 1, "shared", [2]], ["CA", 2, 3, 12], ["CHR", 0, "shared", [3]], ["CA", 1, 4, 12], ["FU", 9, [0, 1, 2, 3]], ["AN", 9, 0, 5], ["FU", 9, [1, 2, 3, 4]], ["AN", 9, 1, 4], ["FU", 9, [2, 3, 4, 5]], ["AN", 9, 2, 6], ["FU", 3, [0, 1]], ["SP", 3, 0, 8, [4], 1], ["AN", 3, 1, 2], ["FFSP", 3, 0, [5, 4, 3, 2], 1, 1], ["AN", 3, 1, 6], ["FU", 1, [0, 1, 2, 3]], ["SP", 1, 0, 52, [1], 1], ["AN", 1, 1, 2], ["FFSP", 1, 0, [5, 4, 3, 2], 1, 1], ["AN", 1, 1, 6], ["PR", 4, 0, "auto_unroll_max_step$64"]]]], "r": [[0.000400116, 0.000400179, 0.000400094], 0, 17.0767, 1662097597], "v": "v0.6"}
{"i": [["[\"conv1x1_bn_relu\", 1, 56, 56, 512, 8, 2]", "cuda -keys=cuda,gpu -max_num_threads=1024 -model=unknown -thread_warp_size=32", [-1, 16, 64, 49152, 2147483647, 1024, 8, 32], "", 0, []], [[], [["CI", 6], ["CI", 4], ["SP", 2, 0, 1, [1, 1, 1, 1], 1], ["SP", 2, 5, 28, [2, 7, 2, 1], 1], ["SP", 2, 10, 28, [1, 28, 1, 1], 1], ["SP", 2, 15, 8, [4, 2, 1, 1], 1], ["SP", 2, 20, 512, [4, 1], 1], ["RE", 2, [0, 5, 10, 15, 1, 6, 11, 16, 2, 7, 12, 17, 20, 21, 3, 8, 13, 18, 22, 4, 9, 14, 19]], ["FSP", 7, 0, 2, 3], ["FSP", 7, 4, 3, 3], ["FSP", 7, 8, 4, 3], ["FSP", 7, 12, 5, 3], ["RE", 7, [0, 4, 8, 12, 1, 5, 9, 13, 2, 6, 10, 14, 3, 7, 11, 15]], ["CA", 2, 7, 11], ["CHR", 1, "shared", [2]], ["CA", 2, 3, 12], ["CHR", 0, "shared", [3]], ["CA", 1, 4, 12], ["FU", 9, [0, 1, 2, 3]], ["AN", 9, 0, 5], ["FU", 9, [1, 2, 3, 4]], ["AN", 9, 1, 4], ["FU", 9, [2, 3, 4, 5]], ["AN", 9, 2, 6], ["FU", 3, [0, 1]], ["SP", 3, 0, 4, [1], 1], ["AN", 3, 1, 2], ["FFSP", 3, 0, [5, 4, 3, 2], 1, 1], ["AN", 3, 1, 6], ["FU", 1, [0, 1, 2, 3]], ["SP", 1, 0, 36, [1], 1], ["AN", 1, 1, 2], ["FFSP", 1, 0, [5, 4, 3, 2], 1, 1], ["AN", 1, 1, 6], ["PR", 4, 0, "auto_unroll_max_step$0"]]]], "r": [[0.000903607, 0.00090338, 0.000903354], 0, 20.2791, 1662097600], "v": "v0.6"}
{"i": [["[\"conv1x1_bn_relu\", 1, 56, 56, 512, 8, 2]", "cuda -keys=cuda,gpu -max_num_threads=1024 -model=unknown -thread_warp_size=32", [-1, 16, 64, 49152, 2147483647, 1024, 8, 32], "", 0, []], [[], [["CI", 6], ["CI", 4], ["SP", 2, 0, 1, [1, 1, 1, 1], 1], ["SP", 2, 5, 28, [1, 14, 1, 1], 1], ["SP", 2, 10, 28, [2, 7, 1, 1], 1], ["SP", 2, 15, 8, [1, 1, 1, 8], 1], ["SP", 2, 20, 512, [1, 8], 1], ["RE", 2, [0, 5, 10, 15, 1, 6, 11, 16, 2, 7, 12, 17, 20, 21, 3, 8, 13, 18, 22, 4, 9, 14, 19]], ["FSP", 7, 0, 2, 3], ["FSP", 7, 4, 3, 3], ["FSP", 7, 8, 4, 3], ["FSP", 7, 12, 5, 3], ["RE", 7, [0, 4, 8, 12, 1, 5, 9, 13, 2, 6, 10, 14, 3, 7, 11, 15]], ["CA", 2, 7, 11], ["CHR", 1, "shared", [2]], ["CA", 2, 3, 12], ["CHR", 0, "shared", [3]], ["CA", 1, 4, 12], ["FU", 9, [0, 1, 2, 3]], ["AN", 9, 0, 5], ["FU", 9, [1, 2, 3, 4]], ["AN", 9, 1, 4], ["FU", 9, [2, 3, 4, 5]], ["AN", 9, 2, 6], ["FU", 3, [0, 1]], ["SP", 3, 0, 8, [1], 1], ["AN", 3, 1, 2], ["FFSP", 3, 0, [5, 4, 3, 2], 1, 1], ["AN", 3, 1, 6], ["FU", 1, [0, 1, 2, 3]], ["SP", 1, 0, 8, [1], 1], ["AN", 1, 1, 2], ["FFSP", 1, 0, [5, 4, 3, 2], 1, 1], ["AN", 1, 1, 6], ["PR", 4, 0, "auto_unroll_max_step$512"]]]], "r": [[9.25871e-05, 9.25857e-05, 9.25766e-05], 0, 17.8992, 1662097597], "v": "v0.6"}
{"i": [["[\"conv1x1_bn_relu\", 1, 56, 56, 512, 8, 2]", "cuda -keys=cuda,gpu -max_num_threads=1024 -model=unknown -thread_warp_size=32", [-1, 16, 64, 49152, 2147483647, 1024, 8, 32], "", 0, []], [[], [["CI", 6], ["CI", 4], ["SP", 2, 0, 1, [1, 1, 1, 1], 1], ["SP", 2, 5, 28, [1, 2, 7, 2], 1], ["SP", 2, 10, 28, [1, 7, 2, 2], 1], ["SP", 2, 15, 8, [2, 4, 1, 1], 1], ["SP", 2, 20, 512, [1, 4], 1], ["RE", 2, [0, 5, 10, 15, 1, 6, 11, 16, 2, 7, 12, 17, 20, 21, 3, 8, 13, 18, 22, 4, 9, 14, 19]], ["FSP", 7, 0, 2, 3], ["FSP", 7, 4, 3, 3], ["FSP", 7, 8, 4, 3], ["FSP", 7, 12, 5, 3], ["RE", 7, [0, 4, 8, 12, 1, 5, 9, 13, 2, 6, 10, 14, 3, 7, 11, 15]], ["CA", 2, 7, 11], ["CHR", 1, "shared", [2]], ["CA", 2, 3, 12], ["CHR", 0, "shared", [3]], ["CA", 1, 4, 12], ["FU", 9, [0, 1, 2, 3]], ["AN", 9, 0, 5], ["FU", 9, [1, 2, 3, 4]], ["AN", 9, 1, 4], ["FU", 9, [2, 3, 4, 5]], ["AN", 9, 2, 6], ["FU", 3, [0, 1]], ["SP", 3, 0, 4, [1], 1], ["AN", 3, 1, 2], ["FFSP", 3, 0, [5, 4, 3, 2], 1, 1], ["AN", 3, 1, 6], ["FU", 1, [0, 1, 2, 3]], ["SP", 1, 0, 364, [1], 1], ["AN", 1, 1, 2], ["FFSP", 1, 0, [5, 4, 3, 2], 1, 1], ["AN", 1, 1, 6], ["PR", 4, 0, "auto_unroll_max_step$16"]]]], "r": [[0.00346787, 0.00346806, 0.00346816], 0, 18.663, 1662097598], "v": "v0.6"}
