python/models/resnext/kernel_configs/resnext_imagenet_50_conv1x1_1_7_7_2048_2048.log
{"i": [["[\"conv1x1\", 1, 7, 7, 2048, 2048]", "cuda -keys=cuda,gpu -max_num_threads=1024 -model=unknown -thread_warp_size=32", [-1, 16, 64, 49152, 2147483647, 1024, 8, 32], "", 0, []], [[], [["CHW", 2, "local"], ["SP", 2, 0, 1, [1, 1, 1, 1], 1], ["SP", 2, 5, 7, [1, 7, 1, 1], 1], ["SP", 2, 10, 7, [1, 1, 7, 1], 1], ["SP", 2, 15, 2048, [4, 8, 32, 1], 1], ["SP", 2, 20, 2048, [2, 1], 1], ["RE", 2, [0, 5, 10, 15, 1, 6, 11, 16, 2, 7, 12, 17, 20, 21, 3, 8, 13, 18, 22, 4, 9, 14, 19]], ["FSP", 3, 0, 1, 3], ["FSP", 3, 4, 2, 3], ["FSP", 3, 8, 3, 3], ["FSP", 3, 12, 4, 3], ["RE", 3, [0, 4, 8, 12, 1, 5, 9, 13, 2, 6, 10, 14, 3, 7, 11, 15]], ["CA", 2, 3, 11], ["CHR", 1, "shared", [2]], ["CA", 2, 3, 12], ["CHR", 0, "shared", [3]], ["CA", 1, 4, 12], ["FU", 5, [0, 1, 2, 3]], ["AN", 5, 0, 5], ["FU", 5, [1, 2, 3, 4]], ["AN", 5, 1, 4], ["FU", 5, [2, 3, 4, 5]], ["AN", 5, 2, 6], ["FU", 3, [0, 1]], ["SP", 3, 0, 64, [1], 1], ["AN", 3, 1, 2], ["FFSP", 3, 0, [4, 3, 2, 1], 1, 1], ["AN", 3, 1, 6], ["FU", 1, [0, 1, 2, 3]], ["SP", 1, 0, 14, [1], 1], ["AN", 1, 1, 2], ["FFSP", 1, 0, [4, 3, 2, 1], 1, 1], ["AN", 1, 1, 6], ["PR", 4, 0, "auto_unroll_max_step$64"]]]], "r": [[0.0250409, 0.0250465, 0.0250428, 0.0250468, 0.025048, 0.0250488, 0.0250405, 0.0250499, 0.0250432, 0.0250524], 0, 7.21817, 1650253695], "v": "v0.6"}
{"i": [["[\"conv1x1\", 1, 7, 7, 2048, 2048]", "cuda -keys=cuda,gpu -max_num_threads=1024 -model=unknown -thread_warp_size=32", [-1, 16, 64, 49152, 2147483647, 1024, 8, 32], "", 0, []], [[], [["CHW", 2, "local"], ["SP", 2, 0, 1, [1, 1, 1, 1], 1], ["SP", 2, 5, 7, [1, 1, 1, 7], 1], ["SP", 2, 10, 7, [1, 1, 1, 7], 1], ["SP", 2, 15, 2048, [2, 1024, 1, 1], 1], ["SP", 2, 20, 2048, [1, 1], 1], ["RE", 2, [0, 5, 10, 15, 1, 6, 11, 16, 2, 7, 12, 17, 20, 21, 3, 8, 13, 18, 22, 4, 9, 14, 19]], ["FSP", 3, 0, 1, 3], ["FSP", 3, 4, 2, 3], ["FSP", 3, 8, 3, 3], ["FSP", 3, 12, 4, 3], ["RE", 3, [0, 4, 8, 12, 1, 5, 9, 13, 2, 6, 10, 14, 3, 7, 11, 15]], ["CA", 2, 3, 11], ["CHR", 1, "shared", [2]], ["CA", 2, 3, 12], ["CHR", 0, "shared", [3]], ["CA", 1, 4, 12], ["FU", 5, [0, 1, 2, 3]], ["AN", 5, 0, 5], ["FU", 5, [1, 2, 3, 4]], ["AN", 5, 1, 4], ["FU", 5, [2, 3, 4, 5]], ["AN", 5, 2, 6], ["FU", 3, [0, 1]], ["SP", 3, 0, 1, [1], 1], ["AN", 3, 1, 2], ["FFSP", 3, 0, [4, 3, 2, 1], 1, 1], ["AN", 3, 1, 6], ["FU", 1, [0, 1, 2, 3]], ["SP", 1, 0, 1, [1], 1], ["AN", 1, 1, 2], ["FFSP", 1, 0, [4, 3, 2, 1], 1, 1], ["AN", 1, 1, 6], ["PR", 4, 0, "auto_unroll_max_step$16"]]]], "r": [[0.0219618, 0.0219632, 0.0219625, 0.021963, 0.0219636, 0.0219623, 0.0219623, 0.0219598, 0.0219622, 0.0219633], 0, 10.7344, 1650253700], "v": "v0.6"}
{"i": [["[\"conv1x1\", 1, 7, 7, 2048, 2048]", "cuda -keys=cuda,gpu -max_num_threads=1024 -model=unknown -thread_warp_size=32", [-1, 16, 64, 49152, 2147483647, 1024, 8, 32], "", 0, []], [[], [["CHW", 2, "local"], ["SP", 2, 0, 1, [1, 1, 1, 1], 1], ["SP", 2, 5, 7, [1, 1, 1, 7], 1], ["SP", 2, 10, 7, [1, 1, 1, 7], 1], ["SP", 2, 15, 2048, [2, 32, 2, 1], 1], ["SP", 2, 20, 2048, [64, 1], 1], ["RE", 2, [0, 5, 10, 15, 1, 6, 11, 16, 2, 7, 12, 17, 20, 21, 3, 8, 13, 18, 22, 4, 9, 14, 19]], ["FSP", 3, 0, 1, 3], ["FSP", 3, 4, 2, 3], ["FSP", 3, 8, 3, 3], ["FSP", 3, 12, 4, 3], ["RE", 3, [0, 4, 8, 12, 1, 5, 9, 13, 2, 6, 10, 14, 3, 7, 11, 15]], ["CA", 2, 3, 11], ["CHR", 1, "shared", [2]], ["CA", 2, 3, 12], ["CHR", 0, "shared", [3]], ["CA", 1, 4, 12], ["FU", 5, [0, 1, 2, 3]], ["AN", 5, 0, 5], ["FU", 5, [1, 2, 3, 4]], ["AN", 5, 1, 4], ["FU", 5, [2, 3, 4, 5]], ["AN", 5, 2, 6], ["FU", 3, [0, 1]], ["SP", 3, 0, 128, [1], 1], ["AN", 3, 1, 2], ["FFSP", 3, 0, [4, 3, 2, 1], 1, 1], ["AN", 3, 1, 6], ["FU", 1, [0, 1, 2, 3]], ["SP", 1, 0, 3136, [1], 1], ["AN", 1, 1, 2], ["FFSP", 1, 0, [4, 3, 2, 1], 1, 1], ["AN", 1, 1, 6], ["PR", 4, 0, "auto_unroll_max_step$1024"]]]], "r": [[0.000830199, 0.000830183, 0.000830189, 0.000830183, 0.000830172, 0.000830183, 0.000830161, 0.000830379, 0.000830522, 0.000830092], 0, 15.1581, 1650253703], "v": "v0.6"}
{"i": [["[\"conv1x1\", 1, 7, 7, 2048, 2048]", "cuda -keys=cuda,gpu -max_num_threads=1024 -model=unknown -thread_warp_size=32", [-1, 16, 64, 49152, 2147483647, 1024, 8, 32], "", 0, []], [[], [["CHW", 2, "local"], ["SP", 2, 0, 1, [1, 1, 1, 1], 1], ["SP", 2, 5, 7, [1, 1, 1, 1], 1], ["SP", 2, 10, 7, [1, 1, 7, 1], 1], ["SP", 2, 15, 2048, [2, 4, 8, 1], 1], ["SP", 2, 20, 2048, [4, 8], 1], ["RE", 2, [0, 5, 10, 15, 1, 6, 11, 16, 2, 7, 12, 17, 20, 21, 3, 8, 13, 18, 22, 4, 9, 14, 19]], ["FSP", 3, 0, 1, 3], ["FSP", 3, 4, 2, 3], ["FSP", 3, 8, 3, 3], ["FSP", 3, 12, 4, 3], ["RE", 3, [0, 4, 8, 12, 1, 5, 9, 13, 2, 6, 10, 14, 3, 7, 11, 15]], ["CA", 2, 3, 11], ["CHR", 1, "shared", [2]], ["CA", 2, 3, 12], ["CHR", 0, "shared", [3]], ["CA", 1, 4, 12], ["FU", 5, [0, 1, 2, 3]], ["AN", 5, 0, 5], ["FU", 5, [1, 2, 3, 4]], ["AN", 5, 1, 4], ["FU", 5, [2, 3, 4, 5]], ["AN", 5, 2, 6], ["FU", 3, [0, 1]], ["SP", 3, 0, 32, [1], 1], ["AN", 3, 1, 2], ["FFSP", 3, 0, [4, 3, 2, 1], 1, 1], ["AN", 3, 1, 6], ["FU", 1, [0, 1, 2, 3]], ["SP", 1, 0, 32, [1], 1], ["AN", 1, 1, 2], ["FFSP", 1, 0, [4, 3, 2, 1], 1, 1], ["AN", 1, 1, 6], ["PR", 4, 0, "auto_unroll_max_step$512"]]]], "r": [[0.000897832, 0.000897673, 0.000897535, 0.000897383, 0.000897314, 0.000897648, 0.000897351, 0.000897414, 0.000897511, 0.000897918], 0, 13.0199, 1650253697], "v": "v0.6"}
{"i": [["[\"conv1x1\", 1, 7, 7, 2048, 2048]", "cuda -keys=cuda,gpu -max_num_threads=1024 -model=unknown -thread_warp_size=32", [-1, 16, 64, 49152, 2147483647, 1024, 8, 32], "", 0, []], [[], [["CHW", 2, "local"], ["SP", 2, 0, 1, [1, 1, 1, 1], 1], ["SP", 2, 5, 7, [7, 1, 1, 1], 1], ["SP", 2, 10, 7, [1, 1, 7, 1], 1], ["SP", 2, 15, 2048, [1, 256, 1, 1], 1], ["SP", 2, 20, 2048, [1, 1], 1], ["RE", 2, [0, 5, 10, 15, 1, 6, 11, 16, 2, 7, 12, 17, 20, 21, 3, 8, 13, 18, 22, 4, 9, 14, 19]], ["FSP", 3, 0, 1, 3], ["FSP", 3, 4, 2, 3], ["FSP", 3, 8, 3, 3], ["FSP", 3, 12, 4, 3], ["RE", 3, [0, 4, 8, 12, 1, 5, 9, 13, 2, 6, 10, 14, 3, 7, 11, 15]], ["CA", 2, 3, 11], ["CHR", 1, "shared", [2]], ["CA", 2, 3, 12], ["CHR", 0, "shared", [3]], ["CA", 1, 4, 12], ["FU", 5, [0, 1, 2, 3]], ["AN", 5, 0, 5], ["FU", 5, [1, 2, 3, 4]], ["AN", 5, 1, 4], ["FU", 5, [2, 3, 4, 5]], ["AN", 5, 2, 6], ["FU", 3, [0, 1]], ["SP", 3, 0, 2, [1], 1], ["AN", 3, 1, 2], ["FFSP", 3, 0, [4, 3, 2, 1], 1, 1], ["AN", 3, 1, 6], ["FU", 1, [0, 1, 2, 3]], ["SP", 1, 0, 7, [1], 1], ["AN", 1, 1, 2], ["FFSP", 1, 0, [4, 3, 2, 1], 1, 1], ["AN", 1, 1, 6], ["PR", 4, 0, "auto_unroll_max_step$0"]]]], "r": [[0.000789029, 0.000789108, 0.000789028, 0.000789172, 0.000789259, 0.000789058, 0.000789171, 0.000789266, 0.000789146, 0.000789183], 0, 4.10381, 1650253694], "v": "v0.6"}
{"i": [["[\"conv1x1\", 1, 7, 7, 2048, 2048]", "cuda -keys=cuda,gpu -max_num_threads=1024 -model=unknown -thread_warp_size=32", [-1, 16, 64, 49152, 2147483647, 1024, 8, 32], "", 0, []], [[], [["CHW", 2, "local"], ["SP", 2, 0, 1, [1, 1, 1, 1], 1], ["SP", 2, 5, 7, [1, 7, 1, 1], 1], ["SP", 2, 10, 7, [7, 1, 1, 1], 1], ["SP", 2, 15, 2048, [1, 8, 2, 8], 1], ["SP", 2, 20, 2048, [1, 32], 1], ["RE", 2, [0, 5, 10, 15, 1, 6, 11, 16, 2, 7, 12, 17, 20, 21, 3, 8, 13, 18, 22, 4, 9, 14, 19]], ["FSP", 3, 0, 1, 3], ["FSP", 3, 4, 2, 3], ["FSP", 3, 8, 3, 3], ["FSP", 3, 12, 4, 3], ["RE", 3, [0, 4, 8, 12, 1, 5, 9, 13, 2, 6, 10, 14, 3, 7, 11, 15]], ["CA", 2, 3, 11], ["CHR", 1, "shared", [2]], ["CA", 2, 3, 12], ["CHR", 0, "shared", [3]], ["CA", 1, 4, 12], ["FU", 5, [0, 1, 2, 3]], ["AN", 5, 0, 5], ["FU", 5, [1, 2, 3, 4]], ["AN", 5, 1, 4], ["FU", 5, [2, 3, 4, 5]], ["AN", 5, 2, 6], ["FU", 3, [0, 1]], ["SP", 3, 0, 32, [1], 1], ["AN", 3, 1, 2], ["FFSP", 3, 0, [4, 3, 2, 1], 1, 1], ["AN", 3, 1, 6], ["FU", 1, [0, 1, 2, 3]], ["SP", 1, 0, 2, [1], 1], ["AN", 1, 1, 2], ["FFSP", 1, 0, [4, 3, 2, 1], 1, 1], ["AN", 1, 1, 6], ["PR", 4, 0, "auto_unroll_max_step$0"]]]], "r": [[0.00136947, 0.00136945, 0.00136947, 0.00136944, 0.00136943, 0.00136943, 0.00136946, 0.00136947, 0.0013696, 0.00136966], 0, 2.90982, 1650253692], "v": "v0.6"}
{"i": [["[\"conv1x1\", 1, 7, 7, 2048, 2048]", "cuda -keys=cuda,gpu -max_num_threads=1024 -model=unknown -thread_warp_size=32", [-1, 16, 64, 49152, 2147483647, 1024, 8, 32], "", 0, []], [[], [["CHW", 2, "local"], ["SP", 2, 0, 1, [1, 1, 1, 1], 1], ["SP", 2, 5, 7, [1, 1, 7, 1], 1], ["SP", 2, 10, 7, [1, 1, 1, 1], 1], ["SP", 2, 15, 2048, [2, 1024, 1, 1], 1], ["SP", 2, 20, 2048, [1, 4], 1], ["RE", 2, [0, 5, 10, 15, 1, 6, 11, 16, 2, 7, 12, 17, 20, 21, 3, 8, 13, 18, 22, 4, 9, 14, 19]], ["FSP", 3, 0, 1, 3], ["FSP", 3, 4, 2, 3], ["FSP", 3, 8, 3, 3], ["FSP", 3, 12, 4, 3], ["RE", 3, [0, 4, 8, 12, 1, 5, 9, 13, 2, 6, 10, 14, 3, 7, 11, 15]], ["CA", 2, 3, 11], ["CHR", 1, "shared", [2]], ["CA", 2, 3, 12], ["CHR", 0, "shared", [3]], ["CA", 1, 4, 12], ["FU", 5, [0, 1, 2, 3]], ["AN", 5, 0, 5], ["FU", 5, [1, 2, 3, 4]], ["AN", 5, 1, 4], ["FU", 5, [2, 3, 4, 5]], ["AN", 5, 2, 6], ["FU", 3, [0, 1]], ["SP", 3, 0, 1, [1], 1], ["AN", 3, 1, 2], ["FFSP", 3, 0, [4, 3, 2, 1], 1, 1], ["AN", 3, 1, 6], ["FU", 1, [0, 1, 2, 3]], ["SP", 1, 0, 1, [1], 1], ["AN", 1, 1, 2], ["FFSP", 1, 0, [4, 3, 2, 1], 1, 1], ["AN", 1, 1, 6], ["PR", 4, 0, "auto_unroll_max_step$16"]]]], "r": [[0.000844448, 0.000844204, 0.000844333, 0.000844271, 0.000844307, 0.000844335, 0.000844248, 0.000844221, 0.000844283, 0.000844223], 0, 9.09118, 1650253699], "v": "v0.6"}
{"i": [["[\"conv1x1\", 1, 7, 7, 2048, 2048]", "cuda -keys=cuda,gpu -max_num_threads=1024 -model=unknown -thread_warp_size=32", [-1, 16, 64, 49152, 2147483647, 1024, 8, 32], "", 0, []], [[], [["CHW", 2, "local"], ["SP", 2, 0, 1, [1, 1, 1, 1], 1], ["SP", 2, 5, 7, [1, 7, 1, 1], 1], ["SP", 2, 10, 7, [1, 1, 1, 1], 1], ["SP", 2, 15, 2048, [2, 8, 2, 2], 1], ["SP", 2, 20, 2048, [8, 4], 1], ["RE", 2, [0, 5, 10, 15, 1, 6, 11, 16, 2, 7, 12, 17, 20, 21, 3, 8, 13, 18, 22, 4, 9, 14, 19]], ["FSP", 3, 0, 1, 3], ["FSP", 3, 4, 2, 3], ["FSP", 3, 8, 3, 3], ["FSP", 3, 12, 4, 3], ["RE", 3, [0, 4, 8, 12, 1, 5, 9, 13, 2, 6, 10, 14, 3, 7, 11, 15]], ["CA", 2, 3, 11], ["CHR", 1, "shared", [2]], ["CA", 2, 3, 12], ["CHR", 0, "shared", [3]], ["CA", 1, 4, 12], ["FU", 5, [0, 1, 2, 3]], ["AN", 5, 0, 5], ["FU", 5, [1, 2, 3, 4]], ["AN", 5, 1, 4], ["FU", 5, [2, 3, 4, 5]], ["AN", 5, 2, 6], ["FU", 3, [0, 1]], ["SP", 3, 0, 512, [1], 1], ["AN", 3, 1, 2], ["FFSP", 3, 0, [4, 3, 2, 1], 1, 1], ["AN", 3, 1, 6], ["FU", 1, [0, 1, 2, 3]], ["SP", 1, 0, 64, [1], 1], ["AN", 1, 1, 2], ["FFSP", 1, 0, [4, 3, 2, 1], 1, 1], ["AN", 1, 1, 6], ["PR", 4, 0, "auto_unroll_max_step$64"]]]], "r": [[0.000140947, 0.000140981, 0.000140955, 0.00014091, 0.000140953, 0.000140904, 0.000140915, 0.000140928, 0.000140922, 0.000140971], 0, 21.1089, 1650253711], "v": "v0.6"}
{"i": [["[\"conv1x1\", 1, 7, 7, 2048, 2048]", "cuda -keys=cuda,gpu -max_num_threads=1024 -model=unknown -thread_warp_size=32", [-1, 16, 64, 49152, 2147483647, 1024, 8, 32], "", 0, []], [[], [["CHW", 2, "local"], ["SP", 2, 0, 1, [1, 1, 1, 1], 1], ["SP", 2, 5, 7, [1, 7, 1, 1], 1], ["SP", 2, 10, 7, [1, 1, 1, 1], 1], ["SP", 2, 15, 2048, [2, 8, 1, 32], 1], ["SP", 2, 20, 2048, [8, 1], 1], ["RE", 2, [0, 5, 10, 15, 1, 6, 11, 16, 2, 7, 12, 17, 20, 21, 3, 8, 13, 18, 22, 4, 9, 14, 19]], ["FSP", 3, 0, 1, 3], ["FSP", 3, 4, 2, 3], ["FSP", 3, 8, 3, 3], ["FSP", 3, 12, 4, 3], ["RE", 3, [0, 4, 8, 12, 1, 5, 9, 13, 2, 6, 10, 14, 3, 7, 11, 15]], ["CA", 2, 3, 11], ["CHR", 1, "shared", [2]], ["CA", 2, 3, 12], ["CHR", 0, "shared", [3]], ["CA", 1, 4, 12], ["FU", 5, [0, 1, 2, 3]], ["AN", 5, 0, 5], ["FU", 5, [1, 2, 3, 4]], ["AN", 5, 1, 4], ["FU", 5, [2, 3, 4, 5]], ["AN", 5, 2, 6], ["FU", 3, [0, 1]], ["SP", 3, 0, 256, [1], 1], ["AN", 3, 1, 2], ["FFSP", 3, 0, [4, 3, 2, 1], 1, 1], ["AN", 3, 1, 6], ["FU", 1, [0, 1, 2, 3]], ["SP", 1, 0, 8, [1], 1], ["AN", 1, 1, 2], ["FFSP", 1, 0, [4, 3, 2, 1], 1, 1], ["AN", 1, 1, 6], ["PR", 4, 0, "auto_unroll_max_step$16"]]]], "r": [[0.00376811, 0.00376907, 0.00376956, 0.00376928, 0.00376842, 0.00376841, 0.0037709, 0.0037726, 0.00376841, 0.00376853], 0, 17.1153, 1650253707], "v": "v0.6"}
{"i": [["[\"conv1x1\", 1, 7, 7, 2048, 2048]", "cuda -keys=cuda,gpu -max_num_threads=1024 -model=unknown -thread_warp_size=32", [-1, 16, 64, 49152, 2147483647, 1024, 8, 32], "", 0, []], [[], [["CHW", 2, "local"], ["SP", 2, 0, 1, [1, 1, 1, 1], 1], ["SP", 2, 5, 7, [1, 7, 1, 1], 1], ["SP", 2, 10, 7, [1, 1, 1, 1], 1], ["SP", 2, 15, 2048, [1, 2, 2, 32], 1], ["SP", 2, 20, 2048, [4, 4], 1], ["RE", 2, [0, 5, 10, 15, 1, 6, 11, 16, 2, 7, 12, 17, 20, 21, 3, 8, 13, 18, 22, 4, 9, 14, 19]], ["FSP", 3, 0, 1, 3], ["FSP", 3, 4, 2, 3], ["FSP", 3, 8, 3, 3], ["FSP", 3, 12, 4, 3], ["RE", 3, [0, 4, 8, 12, 1, 5, 9, 13, 2, 6, 10, 14, 3, 7, 11, 15]], ["CA", 2, 3, 11], ["CHR", 1, "shared", [2]], ["CA", 2, 3, 12], ["CHR", 0, "shared", [3]], ["CA", 1, 4, 12], ["FU", 5, [0, 1, 2, 3]], ["AN", 5, 0, 5], ["FU", 5, [1, 2, 3, 4]], ["AN", 5, 1, 4], ["FU", 5, [2, 3, 4, 5]], ["AN", 5, 2, 6], ["FU", 3, [0, 1]], ["SP", 3, 0, 1024, [1], 1], ["AN", 3, 1, 2], ["FFSP", 3, 0, [4, 3, 2, 1], 1, 1], ["AN", 3, 1, 6], ["FU", 1, [0, 1, 2, 3]], ["SP", 1, 0, 16, [1], 1], ["AN", 1, 1, 2], ["FFSP", 1, 0, [4, 3, 2, 1], 1, 1], ["AN", 1, 1, 6], ["PR", 4, 0, "auto_unroll_max_step$1024"]]]], "r": [[0.000865112, 0.000865049, 0.000865151, 0.000865358, 0.000865284, 0.000865281, 0.000865366, 0.000865444, 0.000865478, 0.000865549], 0, 22.7196, 1650253709], "v": "v0.6"}
{"i": [["[\"conv1x1\", 1, 7, 7, 2048, 2048]", "cuda -keys=cuda,gpu -max_num_threads=1024 -model=unknown -thread_warp_size=32", [-1, 16, 64, 49152, 2147483647, 1024, 8, 32], "", 0, []], [[], [["CHW", 2, "local"], ["SP", 2, 0, 1, [1, 1, 1, 1], 1], ["SP", 2, 5, 7, [1, 1, 1, 7], 1], ["SP", 2, 10, 7, [1, 1, 1, 7], 1], ["SP", 2, 15, 2048, [2, 32, 1, 2], 1], ["SP", 2, 20, 2048, [4, 2], 1], ["RE", 2, [0, 5, 10, 15, 1, 6, 11, 16, 2, 7, 12, 17, 20, 21, 3, 8, 13, 18, 22, 4, 9, 14, 19]], ["FSP", 3, 0, 1, 3], ["FSP", 3, 4, 2, 3], ["FSP", 3, 8, 3, 3], ["FSP", 3, 12, 4, 3], ["RE", 3, [0, 4, 8, 12, 1, 5, 9, 13, 2, 6, 10, 14, 3, 7, 11, 15]], ["CA", 2, 3, 11], ["CHR", 1, "shared", [2]], ["CA", 2, 3, 12], ["CHR", 0, "shared", [3]], ["CA", 1, 4, 12], ["FU", 5, [0, 1, 2, 3]], ["AN", 5, 0, 5], ["FU", 5, [1, 2, 3, 4]], ["AN", 5, 1, 4], ["FU", 5, [2, 3, 4, 5]], ["AN", 5, 2, 6], ["FU", 3, [0, 1]], ["SP", 3, 0, 8, [1], 1], ["AN", 3, 1, 2], ["FFSP", 3, 0, [4, 3, 2, 1], 1, 1], ["AN", 3, 1, 6], ["FU", 1, [0, 1, 2, 3]], ["SP", 1, 0, 392, [1], 1], ["AN", 1, 1, 2], ["FFSP", 1, 0, [4, 3, 2, 1], 1, 1], ["AN", 1, 1, 6], ["PR", 4, 0, "auto_unroll_max_step$64"]]]], "r": [[0.00142011, 0.00142012, 0.00142015, 0.00142005, 0.00142017, 0.00142014, 0.00142015, 0.00142033, 0.00142013, 0.00142014], 0, 25.546, 1650253715], "v": "v0.6"}
{"i": [["[\"conv1x1\", 1, 7, 7, 2048, 2048]", "cuda -keys=cuda,gpu -max_num_threads=1024 -model=unknown -thread_warp_size=32", [-1, 16, 64, 49152, 2147483647, 1024, 8, 32], "", 0, []], [[], [["CHW", 2, "local"], ["SP", 2, 0, 1, [1, 1, 1, 1], 1], ["SP", 2, 5, 7, [1, 7, 1, 1], 1], ["SP", 2, 10, 7, [1, 1, 1, 1], 1], ["SP", 2, 15, 2048, [2, 32, 1, 2], 1], ["SP", 2, 20, 2048, [4, 1], 1], ["RE", 2, [0, 5, 10, 15, 1, 6, 11, 16, 2, 7, 12, 17, 20, 21, 3, 8, 13, 18, 22, 4, 9, 14, 19]], ["FSP", 3, 0, 1, 3], ["FSP", 3, 4, 2, 3], ["FSP", 3, 8, 3, 3], ["FSP", 3, 12, 4, 3], ["RE", 3, [0, 4, 8, 12, 1, 5, 9, 13, 2, 6, 10, 14, 3, 7, 11, 15]], ["CA", 2, 3, 11], ["CHR", 1, "shared", [2]], ["CA", 2, 3, 12], ["CHR", 0, "shared", [3]], ["CA", 1, 4, 12], ["FU", 5, [0, 1, 2, 3]], ["AN", 5, 0, 5], ["FU", 5, [1, 2, 3, 4]], ["AN", 5, 1, 4], ["FU", 5, [2, 3, 4, 5]], ["AN", 5, 2, 6], ["FU", 3, [0, 1]], ["SP", 3, 0, 8, [1], 1], ["AN", 3, 1, 2], ["FFSP", 3, 0, [4, 3, 2, 1], 1, 1], ["AN", 3, 1, 6], ["FU", 1, [0, 1, 2, 3]], ["SP", 1, 0, 4, [2], 1], ["AN", 1, 1, 2], ["FFSP", 1, 0, [4, 3, 2, 1], 1, 1], ["AN", 1, 1, 6], ["PR", 4, 0, "auto_unroll_max_step$64"]]]], "r": [[0.000486174, 0.000487361, 0.000488187, 0.000487382, 0.00048782, 0.000488185, 0.000487077, 0.000487593, 0.000487661, 0.000209109], 0, 33.4554, 1650253723], "v": "v0.6"}
{"i": [["[\"conv1x1\", 1, 7, 7, 2048, 2048]", "cuda -keys=cuda,gpu -max_num_threads=1024 -model=unknown -thread_warp_size=32", [-1, 16, 64, 49152, 2147483647, 1024, 8, 32], "", 0, []], [[], [["CHW", 2, "local"], ["SP", 2, 0, 1, [1, 1, 1, 1], 1], ["SP", 2, 5, 7, [1, 7, 1, 1], 1], ["SP", 2, 10, 7, [1, 1, 1, 1], 1], ["SP", 2, 15, 2048, [2, 4, 1, 32], 1], ["SP", 2, 20, 2048, [32, 1], 1], ["RE", 2, [0, 5, 10, 15, 1, 6, 11, 16, 2, 7, 12, 17, 20, 21, 3, 8, 13, 18, 22, 4, 9, 14, 19]], ["FSP", 3, 0, 1, 3], ["FSP", 3, 4, 2, 3], ["FSP", 3, 8, 3, 3], ["FSP", 3, 12, 4, 3], ["RE", 3, [0, 4, 8, 12, 1, 5, 9, 13, 2, 6, 10, 14, 3, 7, 11, 15]], ["CA", 2, 3, 11], ["CHR", 1, "shared", [2]], ["CA", 2, 3, 12], ["CHR", 0, "shared", [3]], ["CA", 1, 4, 12], ["FU", 5, [0, 1, 2, 3]], ["AN", 5, 0, 5], ["FU", 5, [1, 2, 3, 4]], ["AN", 5, 1, 4], ["FU", 5, [2, 3, 4, 5]], ["AN", 5, 2, 6], ["FU", 3, [0, 1]], ["SP", 3, 0, 1024, [1], 1], ["AN", 3, 1, 2], ["FFSP", 3, 0, [4, 3, 2, 1], 1, 1], ["AN", 3, 1, 6], ["FU", 1, [0, 1, 2, 3]], ["SP", 1, 0, 32, [1], 1], ["AN", 1, 1, 2], ["FFSP", 1, 0, [4, 3, 2, 1], 1, 1], ["AN", 1, 1, 6], ["PR", 4, 0, "auto_unroll_max_step$512"]]]], "r": [[0.00111868, 0.00111869, 0.00111854, 0.00111856, 0.00111868, 0.00111896, 0.00111886, 0.00111884, 0.00111898, 0.00111902], 0, 29.2568, 1650253717], "v": "v0.6"}
{"i": [["[\"conv1x1\", 1, 7, 7, 2048, 2048]", "cuda -keys=cuda,gpu -max_num_threads=1024 -model=unknown -thread_warp_size=32", [-1, 16, 64, 49152, 2147483647, 1024, 8, 32], "", 0, []], [[], [["CHW", 2, "local"], ["SP", 2, 0, 1, [1, 1, 1, 1], 1], ["SP", 2, 5, 7, [1, 7, 1, 1], 1], ["SP", 2, 10, 7, [1, 7, 1, 1], 1], ["SP", 2, 15, 2048, [1, 2, 16, 1], 1], ["SP", 2, 20, 2048, [16, 2], 1], ["RE", 2, [0, 5, 10, 15, 1, 6, 11, 16, 2, 7, 12, 17, 20, 21, 3, 8, 13, 18, 22, 4, 9, 14, 19]], ["FSP", 3, 0, 1, 3], ["FSP", 3, 4, 2, 3], ["FSP", 3, 8, 3, 3], ["FSP", 3, 12, 4, 3], ["RE", 3, [0, 4, 8, 12, 1, 5, 9, 13, 2, 6, 10, 14, 3, 7, 11, 15]], ["CA", 2, 3, 11], ["CHR", 1, "shared", [2]], ["CA", 2, 3, 12], ["CHR", 0, "shared", [3]], ["CA", 1, 4, 12], ["FU", 5, [0, 1, 2, 3]], ["AN", 5, 0, 5], ["FU", 5, [1, 2, 3, 4]], ["AN", 5, 1, 4], ["FU", 5, [2, 3, 4, 5]], ["AN", 5, 2, 6], ["FU", 3, [0, 1]], ["SP", 3, 0, 512, [4], 1], ["AN", 3, 1, 2], ["FFSP", 3, 0, [4, 3, 2, 1], 1, 1], ["AN", 3, 1, 6], ["FU", 1, [0, 1, 2, 3]], ["SP", 1, 0, 32, [2], 1], ["AN", 1, 1, 2], ["FFSP", 1, 0, [4, 3, 2, 1], 1, 1], ["AN", 1, 1, 6], ["PR", 4, 0, "auto_unroll_max_step$1024"]]]], "r": [[0.000282665, 0.000282543, 0.000280892, 0.000282381, 0.000277558, 0.000277231, 0.000277259, 0.000277507, 0.000277235, 0.000277375], 0, 30.1283, 1650253719], "v": "v0.6"}
{"i": [["[\"conv1x1\", 1, 7, 7, 2048, 2048]", "cuda -keys=cuda,gpu -max_num_threads=1024 -model=unknown -thread_warp_size=32", [-1, 16, 64, 49152, 2147483647, 1024, 8, 32], "", 0, []], [[], [["CHW", 2, "local"], ["SP", 2, 0, 1, [1, 1, 1, 1], 1], ["SP", 2, 5, 7, [1, 7, 1, 1], 1], ["SP", 2, 10, 7, [1, 1, 1, 1], 1], ["SP", 2, 15, 2048, [1, 8, 32, 1], 1], ["SP", 2, 20, 2048, [1, 4], 1], ["RE", 2, [0, 5, 10, 15, 1, 6, 11, 16, 2, 7, 12, 17, 20, 21, 3, 8, 13, 18, 22, 4, 9, 14, 19]], ["FSP", 3, 0, 1, 3], ["FSP", 3, 4, 2, 3], ["FSP", 3, 8, 3, 3], ["FSP", 3, 12, 4, 3], ["RE", 3, [0, 4, 8, 12, 1, 5, 9, 13, 2, 6, 10, 14, 3, 7, 11, 15]], ["CA", 2, 3, 11], ["CHR", 1, "shared", [2]], ["CA", 2, 3, 12], ["CHR", 0, "shared", [3]], ["CA", 1, 4, 12], ["FU", 5, [0, 1, 2, 3]], ["AN", 5, 0, 5], ["FU", 5, [1, 2, 3, 4]], ["AN", 5, 1, 4], ["FU", 5, [2, 3, 4, 5]], ["AN", 5, 2, 6], ["FU", 3, [0, 1]], ["SP", 3, 0, 128, [32], 1], ["AN", 3, 1, 2], ["FFSP", 3, 0, [4, 3, 2, 1], 1, 1], ["AN", 3, 1, 6], ["FU", 1, [0, 1, 2, 3]], ["SP", 1, 0, 4, [1], 1], ["AN", 1, 1, 2], ["FFSP", 1, 0, [4, 3, 2, 1], 1, 1], ["AN", 1, 1, 6], ["PR", 4, 0, "auto_unroll_max_step$64"]]]], "r": [[0.00235769, 0.00352676, 0.00353794, 0.00351621, 0.00351514, 0.00353943, 0.0035151, 0.00264502, 0.00160504, 0.00163761], 0, 31.5222, 1650253721], "v": "v0.6"}
{"i": [["[\"conv1x1\", 1, 7, 7, 2048, 2048]", "cuda -keys=cuda,gpu -max_num_threads=1024 -model=unknown -thread_warp_size=32", [-1, 16, 64, 49152, 2147483647, 1024, 8, 32], "", 0, []], [[], [["CHW", 2, "local"], ["SP", 2, 0, 1, [1, 1, 1, 1], 1], ["SP", 2, 5, 7, [7, 1, 1, 1], 1], ["SP", 2, 10, 7, [1, 1, 1, 1], 1], ["SP", 2, 15, 2048, [1, 128, 2, 4], 1], ["SP", 2, 20, 2048, [4, 1], 1], ["RE", 2, [0, 5, 10, 15, 1, 6, 11, 16, 2, 7, 12, 17, 20, 21, 3, 8, 13, 18, 22, 4, 9, 14, 19]], ["FSP", 3, 0, 1, 3], ["FSP", 3, 4, 2, 3], ["FSP", 3, 8, 3, 3], ["FSP", 3, 12, 4, 3], ["RE", 3, [0, 4, 8, 12, 1, 5, 9, 13, 2, 6, 10, 14, 3, 7, 11, 15]], ["CA", 2, 3, 11], ["CHR", 1, "shared", [2]], ["CA", 2, 3, 12], ["CHR", 0, "shared", [3]], ["CA", 1, 4, 12], ["FU", 5, [0, 1, 2, 3]], ["AN", 5, 0, 5], ["FU", 5, [1, 2, 3, 4]], ["AN", 5, 1, 4], ["FU", 5, [2, 3, 4, 5]], ["AN", 5, 2, 6], ["FU", 3, [0, 1]], ["SP", 3, 0, 8, [1], 1], ["AN", 3, 1, 2], ["FFSP", 3, 0, [4, 3, 2, 1], 1, 1], ["AN", 3, 1, 6], ["FU", 1, [0, 1, 2, 3]], ["SP", 1, 0, 4, [1], 1], ["AN", 1, 1, 2], ["FFSP", 1, 0, [4, 3, 2, 1], 1, 1], ["AN", 1, 1, 6], ["PR", 4, 0, "auto_unroll_max_step$16"]]]], "r": [[0.000537684, 0.000537715, 0.000537681, 0.000537686, 0.00053767, 0.000537664, 0.000537674, 0.000537679, 0.000537676, 0.000537708], 0, 15.5782, 1650253705], "v": "v0.6"}
{"i": [["[\"conv1x1\", 1, 7, 7, 2048, 2048]", "cuda -keys=cuda,gpu -max_num_threads=1024 -model=unknown -thread_warp_size=32", [-1, 16, 64, 49152, 2147483647, 1024, 8, 32], "", 0, []], [[], [["CHW", 2, "local"], ["SP", 2, 0, 1, [1, 1, 1, 1], 1], ["SP", 2, 5, 7, [7, 1, 1, 1], 1], ["SP", 2, 10, 7, [1, 7, 1, 1], 1], ["SP", 2, 15, 2048, [1, 16, 64, 2], 1], ["SP", 2, 20, 2048, [1, 2], 1], ["RE", 2, [0, 5, 10, 15, 1, 6, 11, 16, 2, 7, 12, 17, 20, 21, 3, 8, 13, 18, 22, 4, 9, 14, 19]], ["FSP", 3, 0, 1, 3], ["FSP", 3, 4, 2, 3], ["FSP", 3, 8, 3, 3], ["FSP", 3, 12, 4, 3], ["RE", 3, [0, 4, 8, 12, 1, 5, 9, 13, 2, 6, 10, 14, 3, 7, 11, 15]], ["CA", 2, 3, 11], ["CHR", 1, "shared", [2]], ["CA", 2, 3, 12], ["CHR", 0, "shared", [3]], ["CA", 1, 4, 12], ["FU", 5, [0, 1, 2, 3]], ["AN", 5, 0, 5], ["FU", 5, [1, 2, 3, 4]], ["AN", 5, 1, 4], ["FU", 5, [2, 3, 4, 5]], ["AN", 5, 2, 6], ["FU", 3, [0, 1]], ["SP", 3, 0, 256, [2], 1], ["AN", 3, 1, 2], ["FFSP", 3, 0, [4, 3, 2, 1], 1, 1], ["AN", 3, 1, 6], ["FU", 1, [0, 1, 2, 3]], ["SP", 1, 0, 2, [1], 1], ["AN", 1, 1, 2], ["FFSP", 1, 0, [4, 3, 2, 1], 1, 1], ["AN", 1, 1, 6], ["PR", 4, 0, "auto_unroll_max_step$1024"]]]], "r": [[0.0464592, 0.0463644, 0.0464607, 0.0463573, 0.0463484, 0.0464788, 0.0463449, 0.0463612, 0.0464706, 0.022571], 0, 46.9561, 1650253736], "v": "v0.6"}
{"i": [["[\"conv1x1\", 1, 7, 7, 2048, 2048]", "cuda -keys=cuda,gpu -max_num_threads=1024 -model=unknown -thread_warp_size=32", [-1, 16, 64, 49152, 2147483647, 1024, 8, 32], "", 0, []], [[], [["CHW", 2, "local"], ["SP", 2, 0, 1, [1, 1, 1, 1], 1], ["SP", 2, 5, 7, [1, 1, 7, 1], 1], ["SP", 2, 10, 7, [1, 1, 7, 1], 1], ["SP", 2, 15, 2048, [2, 1024, 1, 1], 1], ["SP", 2, 20, 2048, [1, 1], 1], ["RE", 2, [0, 5, 10, 15, 1, 6, 11, 16, 2, 7, 12, 17, 20, 21, 3, 8, 13, 18, 22, 4, 9, 14, 19]], ["FSP", 3, 0, 1, 3], ["FSP", 3, 4, 2, 3], ["FSP", 3, 8, 3, 3], ["FSP", 3, 12, 4, 3], ["RE", 3, [0, 4, 8, 12, 1, 5, 9, 13, 2, 6, 10, 14, 3, 7, 11, 15]], ["CA", 2, 3, 11], ["CHR", 1, "shared", [2]], ["CA", 2, 3, 12], ["CHR", 0, "shared", [3]], ["CA", 1, 4, 12], ["FU", 5, [0, 1, 2, 3]], ["AN", 5, 0, 5], ["FU", 5, [1, 2, 3, 4]], ["AN", 5, 1, 4], ["FU", 5, [2, 3, 4, 5]], ["AN", 5, 2, 6], ["FU", 3, [0, 1]], ["SP", 3, 0, 1, [1], 1], ["AN", 3, 1, 2], ["FFSP", 3, 0, [4, 3, 2, 1], 1, 1], ["AN", 3, 1, 6], ["FU", 1, [0, 1, 2, 3]], ["SP", 1, 0, 1, [1], 1], ["AN", 1, 1, 2], ["FFSP", 1, 0, [4, 3, 2, 1], 1, 1], ["AN", 1, 1, 6], ["PR", 4, 0, "auto_unroll_max_step$64"]]]], "r": [[0.0491338, 0.0485082, 0.0491486, 0.0485065, 0.0485033, 0.0491556, 0.0485104, 0.0428402, 0.0228327, 0.0235043], 0, 43.825, 1650253734], "v": "v0.6"}
{"i": [["[\"conv1x1\", 1, 7, 7, 2048, 2048]", "cuda -keys=cuda,gpu -max_num_threads=1024 -model=unknown -thread_warp_size=32", [-1, 16, 64, 49152, 2147483647, 1024, 8, 32], "", 0, []], [[], [["CHW", 2, "local"], ["SP", 2, 0, 1, [1, 1, 1, 1], 1], ["SP", 2, 5, 7, [1, 7, 1, 1], 1], ["SP", 2, 10, 7, [1, 1, 1, 1], 1], ["SP", 2, 15, 2048, [4, 8, 4, 4], 1], ["SP", 2, 20, 2048, [2, 4], 1], ["RE", 2, [0, 5, 10, 15, 1, 6, 11, 16, 2, 7, 12, 17, 20, 21, 3, 8, 13, 18, 22, 4, 9, 14, 19]], ["FSP", 3, 0, 1, 3], ["FSP", 3, 4, 2, 3], ["FSP", 3, 8, 3, 3], ["FSP", 3, 12, 4, 3], ["RE", 3, [0, 4, 8, 12, 1, 5, 9, 13, 2, 6, 10, 14, 3, 7, 11, 15]], ["CA", 2, 3, 11], ["CHR", 1, "shared", [2]], ["CA", 2, 3, 12], ["CHR", 0, "shared", [3]], ["CA", 1, 4, 12], ["FU", 5, [0, 1, 2, 3]], ["AN", 5, 0, 5], ["FU", 5, [1, 2, 3, 4]], ["AN", 5, 1, 4], ["FU", 5, [2, 3, 4, 5]], ["AN", 5, 2, 6], ["FU", 3, [0, 1]], ["SP", 3, 0, 128, [1], 1], ["AN", 3, 1, 2], ["FFSP", 3, 0, [4, 3, 2, 1], 1, 1], ["AN", 3, 1, 6], ["FU", 1, [0, 1, 2, 3]], ["SP", 1, 0, 8, [1], 1], ["AN", 1, 1, 2], ["FFSP", 1, 0, [4, 3, 2, 1], 1, 1], ["AN", 1, 1, 6], ["PR", 4, 0, "auto_unroll_max_step$64"]]]], "r": [[0.0106595, 0.0104765, 0.0106551, 0.0105, 0.0106581, 0.0105032, 0.0106598, 0.0104985, 0.0106565, 0.0105018], 0, 35.7393, 1650253725], "v": "v0.6"}
{"i": [["[\"conv1x1\", 1, 7, 7, 2048, 2048]", "cuda -keys=cuda,gpu -max_num_threads=1024 -model=unknown -thread_warp_size=32", [-1, 16, 64, 49152, 2147483647, 1024, 8, 32], "", 0, []], [[], [["CHW", 2, "local"], ["SP", 2, 0, 1, [1, 1, 1, 1], 1], ["SP", 2, 5, 7, [7, 1, 1, 1], 1], ["SP", 2, 10, 7, [1, 1, 1, 1], 1], ["SP", 2, 15, 2048, [1, 32, 4, 1], 1], ["SP", 2, 20, 2048, [1, 2], 1], ["RE", 2, [0, 5, 10, 15, 1, 6, 11, 16, 2, 7, 12, 17, 20, 21, 3, 8, 13, 18, 22, 4, 9, 14, 19]], ["FSP", 3, 0, 1, 3], ["FSP", 3, 4, 2, 3], ["FSP", 3, 8, 3, 3], ["FSP", 3, 12, 4, 3], ["RE", 3, [0, 4, 8, 12, 1, 5, 9, 13, 2, 6, 10, 14, 3, 7, 11, 15]], ["CA", 2, 3, 11], ["CHR", 1, "shared", [2]], ["CA", 2, 3, 12], ["CHR", 0, "shared", [3]], ["CA", 1, 4, 12], ["FU", 5, [0, 1, 2, 3]], ["AN", 5, 0, 5], ["FU", 5, [1, 2, 3, 4]], ["AN", 5, 1, 4], ["FU", 5, [2, 3, 4, 5]], ["AN", 5, 2, 6], ["FU", 3, [0, 1]], ["SP", 3, 0, 8, [1], 1], ["AN", 3, 1, 2], ["FFSP", 3, 0, [4, 3, 2, 1], 1, 1], ["AN", 3, 1, 6], ["FU", 1, [0, 1, 2, 3]], ["SP", 1, 0, 14, [1], 1], ["AN", 1, 1, 2], ["FFSP", 1, 0, [4, 3, 2, 1], 1, 1], ["AN", 1, 1, 6], ["PR", 4, 0, "auto_unroll_max_step$1024"]]]], "r": [[0.000357311, 0.000357324, 0.000357336, 0.000357371, 0.000357464, 0.000357318, 0.000357311, 0.000357312, 0.000357331, 0.000357289], 0, 23.1315, 1650253713], "v": "v0.6"}
{"i": [["[\"conv1x1\", 1, 7, 7, 2048, 2048]", "cuda -keys=cuda,gpu -max_num_threads=1024 -model=unknown -thread_warp_size=32", [-1, 16, 64, 49152, 2147483647, 1024, 8, 32], "", 0, []], [[], [["CHW", 2, "local"], ["SP", 2, 0, 1, [1, 1, 1, 1], 1], ["SP", 2, 5, 7, [1, 7, 1, 1], 1], ["SP", 2, 10, 7, [1, 7, 1, 1], 1], ["SP", 2, 15, 2048, [1, 2, 16, 1], 1], ["SP", 2, 20, 2048, [16, 2], 1], ["RE", 2, [0, 5, 10, 15, 1, 6, 11, 16, 2, 7, 12, 17, 20, 21, 3, 8, 13, 18, 22, 4, 9, 14, 19]], ["FSP", 3, 0, 1, 3], ["FSP", 3, 4, 2, 3], ["FSP", 3, 8, 3, 3], ["FSP", 3, 12, 4, 3], ["RE", 3, [0, 4, 8, 12, 1, 5, 9, 13, 2, 6, 10, 14, 3, 7, 11, 15]], ["CA", 2, 3, 11], ["CHR", 1, "shared", [2]], ["CA", 2, 3, 12], ["CHR", 0, "shared", [3]], ["CA", 1, 4, 12], ["FU", 5, [0, 1, 2, 3]], ["AN", 5, 0, 5], ["FU", 5, [1, 2, 3, 4]], ["AN", 5, 1, 4], ["FU", 5, [2, 3, 4, 5]], ["AN", 5, 2, 6], ["FU", 3, [0, 1]], ["SP", 3, 0, 512, [8], 1], ["AN", 3, 1, 2], ["FFSP", 3, 0, [4, 3, 2, 1], 1, 1], ["AN", 3, 1, 6], ["FU", 1, [0, 1, 2, 3]], ["SP", 1, 0, 32, [1], 1], ["AN", 1, 1, 2], ["FFSP", 1, 0, [4, 3, 2, 1], 1, 1], ["AN", 1, 1, 6], ["PR", 4, 0, "auto_unroll_max_step$64"]]]], "r": [[0.000325827, 0.000564088, 0.000567288, 0.000565448, 0.00056509, 0.000567269, 0.000565427, 0.000333477, 0.00027011, 0.000429736], 0, 41.9219, 1650253732], "v": "v0.6"}
{"i": [["[\"conv1x1\", 1, 7, 7, 2048, 2048]", "cuda -keys=cuda,gpu -max_num_threads=1024 -model=unknown -thread_warp_size=32", [-1, 16, 64, 49152, 2147483647, 1024, 8, 32], "", 0, []], [[], [["CHW", 2, "local"], ["SP", 2, 0, 1, [1, 1, 1, 1], 1], ["SP", 2, 5, 7, [1, 7, 1, 1], 1], ["SP", 2, 10, 7, [1, 1, 1, 7], 1], ["SP", 2, 15, 2048, [4, 16, 1, 1], 1], ["SP", 2, 20, 2048, [2, 16], 1], ["RE", 2, [0, 5, 10, 15, 1, 6, 11, 16, 2, 7, 12, 17, 20, 21, 3, 8, 13, 18, 22, 4, 9, 14, 19]], ["FSP", 3, 0, 1, 3], ["FSP", 3, 4, 2, 3], ["FSP", 3, 8, 3, 3], ["FSP", 3, 12, 4, 3], ["RE", 3, [0, 4, 8, 12, 1, 5, 9, 13, 2, 6, 10, 14, 3, 7, 11, 15]], ["CA", 2, 3, 11], ["CHR", 1, "shared", [2]], ["CA", 2, 3, 12], ["CHR", 0, "shared", [3]], ["CA", 1, 4, 12], ["FU", 5, [0, 1, 2, 3]], ["AN", 5, 0, 5], ["FU", 5, [1, 2, 3, 4]], ["AN", 5, 1, 4], ["FU", 5, [2, 3, 4, 5]], ["AN", 5, 2, 6], ["FU", 3, [0, 1]], ["SP", 3, 0, 32, [1], 1], ["AN", 3, 1, 2], ["FFSP", 3, 0, [4, 3, 2, 1], 1, 1], ["AN", 3, 1, 6], ["FU", 1, [0, 1, 2, 3]], ["SP", 1, 0, 224, [1], 1], ["AN", 1, 1, 2], ["FFSP", 1, 0, [4, 3, 2, 1], 1, 1], ["AN", 1, 1, 6], ["PR", 4, 0, "auto_unroll_max_step$16"]]]], "r": [[0.000229935, 0.000240099, 0.000295117, 0.000500489, 0.000501375, 0.000503558, 0.000501506, 0.000501224, 0.000503625, 0.000277076], 0, 37.4741, 1650253727], "v": "v0.6"}
{"i": [["[\"conv1x1\", 1, 7, 7, 2048, 2048]", "cuda -keys=cuda,gpu -max_num_threads=1024 -model=unknown -thread_warp_size=32", [-1, 16, 64, 49152, 2147483647, 1024, 8, 32], "", 0, []], [[], [["CHW", 2, "local"], ["SP", 2, 0, 1, [1, 1, 1, 1], 1], ["SP", 2, 5, 7, [1, 7, 1, 1], 1], ["SP", 2, 10, 7, [1, 1, 1, 7], 1], ["SP", 2, 15, 2048, [2, 16, 2, 1], 1], ["SP", 2, 20, 2048, [1, 16], 1], ["RE", 2, [0, 5, 10, 15, 1, 6, 11, 16, 2, 7, 12, 17, 20, 21, 3, 8, 13, 18, 22, 4, 9, 14, 19]], ["FSP", 3, 0, 1, 3], ["FSP", 3, 4, 2, 3], ["FSP", 3, 8, 3, 3], ["FSP", 3, 12, 4, 3], ["RE", 3, [0, 4, 8, 12, 1, 5, 9, 13, 2, 6, 10, 14, 3, 7, 11, 15]], ["CA", 2, 3, 11], ["CHR", 1, "shared", [2]], ["CA", 2, 3, 12], ["CHR", 0, "shared", [3]], ["CA", 1, 4, 12], ["FU", 5, [0, 1, 2, 3]], ["AN", 5, 0, 5], ["FU", 5, [1, 2, 3, 4]], ["AN", 5, 1, 4], ["FU", 5, [2, 3, 4, 5]], ["AN", 5, 2, 6], ["FU", 3, [0, 1]], ["SP", 3, 0, 32, [8], 1], ["AN", 3, 1, 2], ["FFSP", 3, 0, [4, 3, 2, 1], 1, 1], ["AN", 3, 1, 6], ["FU", 1, [0, 1, 2, 3]], ["SP", 1, 0, 112, [8], 1], ["AN", 1, 1, 2], ["FFSP", 1, 0, [4, 3, 2, 1], 1, 1], ["AN", 1, 1, 6], ["PR", 4, 0, "auto_unroll_max_step$512"]]]], "r": [[0.000476682, 0.000470221, 0.000476611, 0.000475992, 0.000476649, 0.000475956, 0.000476249, 0.00047637, 0.000475946, 0.000476484], 0, 52.8498, 1650253742], "v": "v0.6"}
{"i": [["[\"conv1x1\", 1, 7, 7, 2048, 2048]", "cuda -keys=cuda,gpu -max_num_threads=1024 -model=unknown -thread_warp_size=32", [-1, 16, 64, 49152, 2147483647, 1024, 8, 32], "", 0, []], [[], [["CHW", 2, "local"], ["SP", 2, 0, 1, [1, 1, 1, 1], 1], ["SP", 2, 5, 7, [1, 7, 1, 1], 1], ["SP", 2, 10, 7, [7, 1, 1, 1], 1], ["SP", 2, 15, 2048, [1, 32, 4, 4], 1], ["SP", 2, 20, 2048, [1, 2], 1], ["RE", 2, [0, 5, 10, 15, 1, 6, 11, 16, 2, 7, 12, 17, 20, 21, 3, 8, 13, 18, 22, 4, 9, 14, 19]], ["FSP", 3, 0, 1, 3], ["FSP", 3, 4, 2, 3], ["FSP", 3, 8, 3, 3], ["FSP", 3, 12, 4, 3], ["RE", 3, [0, 4, 8, 12, 1, 5, 9, 13, 2, 6, 10, 14, 3, 7, 11, 15]], ["CA", 2, 3, 11], ["CHR", 1, "shared", [2]], ["CA", 2, 3, 12], ["CHR", 0, "shared", [3]], ["CA", 1, 4, 12], ["FU", 5, [0, 1, 2, 3]], ["AN", 5, 0, 5], ["FU", 5, [1, 2, 3, 4]], ["AN", 5, 1, 4], ["FU", 5, [2, 3, 4, 5]], ["AN", 5, 2, 6], ["FU", 3, [0, 1]], ["SP", 3, 0, 128, [1], 1], ["AN", 3, 1, 2], ["FFSP", 3, 0, [4, 3, 2, 1], 1, 1], ["AN", 3, 1, 6], ["FU", 1, [0, 1, 2, 3]], ["SP", 1, 0, 8, [1], 1], ["AN", 1, 1, 2], ["FFSP", 1, 0, [4, 3, 2, 1], 1, 1], ["AN", 1, 1, 6], ["PR", 4, 0, "auto_unroll_max_step$16"]]]], "r": [[0.00322004, 0.00321216, 0.00323139, 0.00321259, 0.00323152, 0.00321321, 0.0032313, 0.00321318, 0.00321277, 0.00323148], 0, 39.3781, 1650253729], "v": "v0.6"}
{"i": [["[\"conv1x1\", 1, 7, 7, 2048, 2048]", "cuda -keys=cuda,gpu -max_num_threads=1024 -model=unknown -thread_warp_size=32", [-1, 16, 64, 49152, 2147483647, 1024, 8, 32], "", 0, []], [[], [["CHW", 2, "local"], ["SP", 2, 0, 1, [1, 1, 1, 1], 1], ["SP", 2, 5, 7, [1, 1, 1, 1], 1], ["SP", 2, 10, 7, [1, 1, 7, 1], 1], ["SP", 2, 15, 2048, [1, 16, 1, 64], 1], ["SP", 2, 20, 2048, [4, 2], 1], ["RE", 2, [0, 5, 10, 15, 1, 6, 11, 16, 2, 7, 12, 17, 20, 21, 3, 8, 13, 18, 22, 4, 9, 14, 19]], ["FSP", 3, 0, 1, 3], ["FSP", 3, 4, 2, 3], ["FSP", 3, 8, 3, 3], ["FSP", 3, 12, 4, 3], ["RE", 3, [0, 4, 8, 12, 1, 5, 9, 13, 2, 6, 10, 14, 3, 7, 11, 15]], ["CA", 2, 3, 11], ["CHR", 1, "shared", [2]], ["CA", 2, 3, 12], ["CHR", 0, "shared", [3]], ["CA", 1, 4, 12], ["FU", 5, [0, 1, 2, 3]], ["AN", 5, 0, 5], ["FU", 5, [1, 2, 3, 4]], ["AN", 5, 1, 4], ["FU", 5, [2, 3, 4, 5]], ["AN", 5, 2, 6], ["FU", 3, [0, 1]], ["SP", 3, 0, 256, [1], 1], ["AN", 3, 1, 2], ["FFSP", 3, 0, [4, 3, 2, 1], 1, 1], ["AN", 3, 1, 6], ["FU", 1, [0, 1, 2, 3]], ["SP", 1, 0, 8, [1], 1], ["AN", 1, 1, 2], ["FFSP", 1, 0, [4, 3, 2, 1], 1, 1], ["AN", 1, 1, 6], ["PR", 4, 0, "auto_unroll_max_step$512"]]]], "r": [[0.0139073, 0.0138962, 0.0139617, 0.0138989, 0.0138957, 0.013964, 0.0138935, 0.010338, 0.00614344, 0.00686864], 0, 59.8678, 1650253745], "v": "v0.6"}
{"i": [["[\"conv1x1\", 1, 7, 7, 2048, 2048]", "cuda -keys=cuda,gpu -max_num_threads=1024 -model=unknown -thread_warp_size=32", [-1, 16, 64, 49152, 2147483647, 1024, 8, 32], "", 0, []], [[], [["CHW", 2, "local"], ["SP", 2, 0, 1, [1, 1, 1, 1], 1], ["SP", 2, 5, 7, [1, 7, 1, 1], 1], ["SP", 2, 10, 7, [1, 1, 1, 1], 1], ["SP", 2, 15, 2048, [1, 8, 32, 1], 1], ["SP", 2, 20, 2048, [4, 1], 1], ["RE", 2, [0, 5, 10, 15, 1, 6, 11, 16, 2, 7, 12, 17, 20, 21, 3, 8, 13, 18, 22, 4, 9, 14, 19]], ["FSP", 3, 0, 1, 3], ["FSP", 3, 4, 2, 3], ["FSP", 3, 8, 3, 3], ["FSP", 3, 12, 4, 3], ["RE", 3, [0, 4, 8, 12, 1, 5, 9, 13, 2, 6, 10, 14, 3, 7, 11, 15]], ["CA", 2, 3, 11], ["CHR", 1, "shared", [2]], ["CA", 2, 3, 12], ["CHR", 0, "shared", [3]], ["CA", 1, 4, 12], ["FU", 5, [0, 1, 2, 3]], ["AN", 5, 0, 5], ["FU", 5, [1, 2, 3, 4]], ["AN", 5, 1, 4], ["FU", 5, [2, 3, 4, 5]], ["AN", 5, 2, 6], ["FU", 3, [0, 1]], ["SP", 3, 0, 128, [32], 1], ["AN", 3, 1, 2], ["FFSP", 3, 0, [4, 3, 2, 1], 1, 1], ["AN", 3, 1, 6], ["FU", 1, [0, 1, 2, 3]], ["SP", 1, 0, 4, [1], 1], ["AN", 1, 1, 2], ["FFSP", 1, 0, [4, 3, 2, 1], 1, 1], ["AN", 1, 1, 6], ["PR", 4, 0, "auto_unroll_max_step$64"]]]], "r": [[0.0041333, 0.00413305, 0.00412573, 0.00413406, 0.00413112, 0.00413344, 0.00413248, 0.00413309, 0.00413202, 0.00413404], 0, 47.5917, 1650253737], "v": "v0.6"}
{"i": [["[\"conv1x1\", 1, 7, 7, 2048, 2048]", "cuda -keys=cuda,gpu -max_num_threads=1024 -model=unknown -thread_warp_size=32", [-1, 16, 64, 49152, 2147483647, 1024, 8, 32], "", 0, []], [[], [["CHW", 2, "local"], ["SP", 2, 0, 1, [1, 1, 1, 1], 1], ["SP", 2, 5, 7, [1, 1, 1, 7], 1], ["SP", 2, 10, 7, [1, 1, 7, 1], 1], ["SP", 2, 15, 2048, [2, 16, 4, 2], 1], ["SP", 2, 20, 2048, [8, 2], 1], ["RE", 2, [0, 5, 10, 15, 1, 6, 11, 16, 2, 7, 12, 17, 20, 21, 3, 8, 13, 18, 22, 4, 9, 14, 19]], ["FSP", 3, 0, 1, 3], ["FSP", 3, 4, 2, 3], ["FSP", 3, 8, 3, 3], ["FSP", 3, 12, 4, 3], ["RE", 3, [0, 4, 8, 12, 1, 5, 9, 13, 2, 6, 10, 14, 3, 7, 11, 15]], ["CA", 2, 3, 11], ["CHR", 1, "shared", [2]], ["CA", 2, 3, 12], ["CHR", 0, "shared", [3]], ["CA", 1, 4, 12], ["FU", 5, [0, 1, 2, 3]], ["AN", 5, 0, 5], ["FU", 5, [1, 2, 3, 4]], ["AN", 5, 1, 4], ["FU", 5, [2, 3, 4, 5]], ["AN", 5, 2, 6], ["FU", 3, [0, 1]], ["SP", 3, 0, 128, [1], 1], ["AN", 3, 1, 2], ["FFSP", 3, 0, [4, 3, 2, 1], 1, 1], ["AN", 3, 1, 6], ["FU", 1, [0, 1, 2, 3]], ["SP", 1, 0, 16, [4], 1], ["AN", 1, 1, 2], ["FFSP", 1, 0, [4, 3, 2, 1], 1, 1], ["AN", 1, 1, 6], ["PR", 4, 0, "auto_unroll_max_step$16"]]]], "r": [[0.0160167, 0.016963, 0.0169661, 0.0169626, 0.0169651, 0.0109444, 0.00739511, 0.00812134, 0.00729285, 0.00728872], 0, 59.5923, 1650253749], "v": "v0.6"}
{"i": [["[\"conv1x1\", 1, 7, 7, 2048, 2048]", "cuda -keys=cuda,gpu -max_num_threads=1024 -model=unknown -thread_warp_size=32", [-1, 16, 64, 49152, 2147483647, 1024, 8, 32], "", 0, []], [[], [["CHW", 2, "local"], ["SP", 2, 0, 1, [1, 1, 1, 1], 1], ["SP", 2, 5, 7, [1, 1, 7, 1], 1], ["SP", 2, 10, 7, [7, 1, 1, 1], 1], ["SP", 2, 15, 2048, [2, 4, 1, 1], 1], ["SP", 2, 20, 2048, [2, 1], 1], ["RE", 2, [0, 5, 10, 15, 1, 6, 11, 16, 2, 7, 12, 17, 20, 21, 3, 8, 13, 18, 22, 4, 9, 14, 19]], ["FSP", 3, 0, 1, 3], ["FSP", 3, 4, 2, 3], ["FSP", 3, 8, 3, 3], ["FSP", 3, 12, 4, 3], ["RE", 3, [0, 4, 8, 12, 1, 5, 9, 13, 2, 6, 10, 14, 3, 7, 11, 15]], ["CA", 2, 3, 11], ["CHR", 1, "shared", [2]], ["CA", 2, 3, 12], ["CHR", 0, "shared", [3]], ["CA", 1, 4, 12], ["FU", 5, [0, 1, 2, 3]], ["AN", 5, 0, 5], ["FU", 5, [1, 2, 3, 4]], ["AN", 5, 1, 4], ["FU", 5, [2, 3, 4, 5]], ["AN", 5, 2, 6], ["FU", 3, [0, 1]], ["SP", 3, 0, 2, [1], 1], ["AN", 3, 1, 2], ["FFSP", 3, 0, [4, 3, 2, 1], 1, 1], ["AN", 3, 1, 6], ["FU", 1, [0, 1, 2, 3]], ["SP", 1, 0, 98, [1], 1], ["AN", 1, 1, 2], ["FFSP", 1, 0, [4, 3, 2, 1], 1, 1], ["AN", 1, 1, 6], ["PR", 4, 0, "auto_unroll_max_step$1024"]]]], "r": [[0.00266112, 0.00265864, 0.00266186, 0.00266179, 0.00263343, 0.00266136, 0.00266208, 0.00263308, 0.00266149, 0.00263538], 0, 71.7481, 1650253761], "v": "v0.6"}
{"i": [["[\"conv1x1\", 1, 7, 7, 2048, 2048]", "cuda -keys=cuda,gpu -max_num_threads=1024 -model=unknown -thread_warp_size=32", [-1, 16, 64, 49152, 2147483647, 1024, 8, 32], "", 0, []], [[], [["CHW", 2, "local"], ["SP", 2, 0, 1, [1, 1, 1, 1], 1], ["SP", 2, 5, 7, [1, 1, 1, 7], 1], ["SP", 2, 10, 7, [1, 1, 1, 7], 1], ["SP", 2, 15, 2048, [2, 32, 2, 1], 1], ["SP", 2, 20, 2048, [64, 1], 1], ["RE", 2, [0, 5, 10, 15, 1, 6, 11, 16, 2, 7, 12, 17, 20, 21, 3, 8, 13, 18, 22, 4, 9, 14, 19]], ["FSP", 3, 0, 1, 3], ["FSP", 3, 4, 2, 3], ["FSP", 3, 8, 3, 3], ["FSP", 3, 12, 4, 3], ["RE", 3, [0, 4, 8, 12, 1, 5, 9, 13, 2, 6, 10, 14, 3, 7, 11, 15]], ["CA", 2, 3, 11], ["CHR", 1, "shared", [2]], ["CA", 2, 3, 12], ["CHR", 0, "shared", [3]], ["CA", 1, 4, 12], ["FU", 5, [0, 1, 2, 3]], ["AN", 5, 0, 5], ["FU", 5, [1, 2, 3, 4]], ["AN", 5, 1, 4], ["FU", 5, [2, 3, 4, 5]], ["AN", 5, 2, 6], ["FU", 3, [0, 1]], ["SP", 3, 0, 128, [1], 1], ["AN", 3, 1, 2], ["FFSP", 3, 0, [4, 3, 2, 1], 1, 1], ["AN", 3, 1, 6], ["FU", 1, [0, 1, 2, 3]], ["SP", 1, 0, 3136, [2], 1], ["AN", 1, 1, 2], ["FFSP", 1, 0, [4, 3, 2, 1], 1, 1], ["AN", 1, 1, 6], ["PR", 4, 0, "auto_unroll_max_step$1024"]]]], "r": [[0.000955454, 0.000955467, 0.00095548, 0.00126929, 0.00215173, 0.00214883, 0.00214937, 0.00215012, 0.00200826, 0.0010778], 0, 64.6368, 1650253753], "v": "v0.6"}
{"i": [["[\"conv1x1\", 1, 7, 7, 2048, 2048]", "cuda -keys=cuda,gpu -max_num_threads=1024 -model=unknown -thread_warp_size=32", [-1, 16, 64, 49152, 2147483647, 1024, 8, 32], "", 0, []], [[], [["CHW", 2, "local"], ["SP", 2, 0, 1, [1, 1, 1, 1], 1], ["SP", 2, 5, 7, [1, 7, 1, 1], 1], ["SP", 2, 10, 7, [1, 7, 1, 1], 1], ["SP", 2, 15, 2048, [4, 8, 4, 1], 1], ["SP", 2, 20, 2048, [8, 2], 1], ["RE", 2, [0, 5, 10, 15, 1, 6, 11, 16, 2, 7, 12, 17, 20, 21, 3, 8, 13, 18, 22, 4, 9, 14, 19]], ["FSP", 3, 0, 1, 3], ["FSP", 3, 4, 2, 3], ["FSP", 3, 8, 3, 3], ["FSP", 3, 12, 4, 3], ["RE", 3, [0, 4, 8, 12, 1, 5, 9, 13, 2, 6, 10, 14, 3, 7, 11, 15]], ["CA", 2, 3, 11], ["CHR", 1, "shared", [2]], ["CA", 2, 3, 12], ["CHR", 0, "shared", [3]], ["CA", 1, 4, 12], ["FU", 5, [0, 1, 2, 3]], ["AN", 5, 0, 5], ["FU", 5, [1, 2, 3, 4]], ["AN", 5, 1, 4], ["FU", 5, [2, 3, 4, 5]], ["AN", 5, 2, 6], ["FU", 3, [0, 1]], ["SP", 3, 0, 64, [1], 1], ["AN", 3, 1, 2], ["FFSP", 3, 0, [4, 3, 2, 1], 1, 1], ["AN", 3, 1, 6], ["FU", 1, [0, 1, 2, 3]], ["SP", 1, 0, 112, [1], 1], ["AN", 1, 1, 2], ["FFSP", 1, 0, [4, 3, 2, 1], 1, 1], ["AN", 1, 1, 6], ["PR", 4, 0, "auto_unroll_max_step$0"]]]], "r": [[0.000492466, 0.000778773, 0.000991376, 0.000989945, 0.000990363, 0.00099056, 0.000991321, 0.000861879, 0.000478749, 0.000910795], 0, 50.0761, 1650253740], "v": "v0.6"}
{"i": [["[\"conv1x1\", 1, 7, 7, 2048, 2048]", "cuda -keys=cuda,gpu -max_num_threads=1024 -model=unknown -thread_warp_size=32", [-1, 16, 64, 49152, 2147483647, 1024, 8, 32], "", 0, []], [[], [["CHW", 2, "local"], ["SP", 2, 0, 1, [1, 1, 1, 1], 1], ["SP", 2, 5, 7, [1, 7, 1, 1], 1], ["SP", 2, 10, 7, [7, 1, 1, 1], 1], ["SP", 2, 15, 2048, [2, 32, 1, 2], 1], ["SP", 2, 20, 2048, [16, 1], 1], ["RE", 2, [0, 5, 10, 15, 1, 6, 11, 16, 2, 7, 12, 17, 20, 21, 3, 8, 13, 18, 22, 4, 9, 14, 19]], ["FSP", 3, 0, 1, 3], ["FSP", 3, 4, 2, 3], ["FSP", 3, 8, 3, 3], ["FSP", 3, 12, 4, 3], ["RE", 3, [0, 4, 8, 12, 1, 5, 9, 13, 2, 6, 10, 14, 3, 7, 11, 15]], ["CA", 2, 3, 11], ["CHR", 1, "shared", [2]], ["CA", 2, 3, 12], ["CHR", 0, "shared", [3]], ["CA", 1, 4, 12], ["FU", 5, [0, 1, 2, 3]], ["AN", 5, 0, 5], ["FU", 5, [1, 2, 3, 4]], ["AN", 5, 1, 4], ["FU", 5, [2, 3, 4, 5]], ["AN", 5, 2, 6], ["FU", 3, [0, 1]], ["SP", 3, 0, 128, [1], 1], ["AN", 3, 1, 2], ["FFSP", 3, 0, [4, 3, 2, 1], 1, 1], ["AN", 3, 1, 6], ["FU", 1, [0, 1, 2, 3]], ["SP", 1, 0, 16, [1], 1], ["AN", 1, 1, 2], ["FFSP", 1, 0, [4, 3, 2, 1], 1, 1], ["AN", 1, 1, 6], ["PR", 4, 0, "auto_unroll_max_step$512"]]]], "r": [[0.000515698, 0.000521637, 0.000512084, 0.00052161, 0.000511963, 0.000521863, 0.000511731, 0.000521879, 0.000521878, 0.000512095], 0, 56.9721, 1650253746], "v": "v0.6"}
{"i": [["[\"conv1x1\", 1, 7, 7, 2048, 2048]", "cuda -keys=cuda,gpu -max_num_threads=1024 -model=unknown -thread_warp_size=32", [-1, 16, 64, 49152, 2147483647, 1024, 8, 32], "", 0, []], [[], [["CHW", 2, "local"], ["SP", 2, 0, 1, [1, 1, 1, 1], 1], ["SP", 2, 5, 7, [7, 1, 1, 1], 1], ["SP", 2, 10, 7, [1, 1, 1, 1], 1], ["SP", 2, 15, 2048, [1, 512, 2, 1], 1], ["SP", 2, 20, 2048, [4, 1], 1], ["RE", 2, [0, 5, 10, 15, 1, 6, 11, 16, 2, 7, 12, 17, 20, 21, 3, 8, 13, 18, 22, 4, 9, 14, 19]], ["FSP", 3, 0, 1, 3], ["FSP", 3, 4, 2, 3], ["FSP", 3, 8, 3, 3], ["FSP", 3, 12, 4, 3], ["RE", 3, [0, 4, 8, 12, 1, 5, 9, 13, 2, 6, 10, 14, 3, 7, 11, 15]], ["CA", 2, 3, 11], ["CHR", 1, "shared", [2]], ["CA", 2, 3, 12], ["CHR", 0, "shared", [3]], ["CA", 1, 4, 12], ["FU", 5, [0, 1, 2, 3]], ["AN", 5, 0, 5], ["FU", 5, [1, 2, 3, 4]], ["AN", 5, 1, 4], ["FU", 5, [2, 3, 4, 5]], ["AN", 5, 2, 6], ["FU", 3, [0, 1]], ["SP", 3, 0, 8, [2], 1], ["AN", 3, 1, 2], ["FFSP", 3, 0, [4, 3, 2, 1], 1, 1], ["AN", 3, 1, 6], ["FU", 1, [0, 1, 2, 3]], ["SP", 1, 0, 4, [2], 1], ["AN", 1, 1, 2], ["FFSP", 1, 0, [4, 3, 2, 1], 1, 1], ["AN", 1, 1, 6], ["PR", 4, 0, "auto_unroll_max_step$64"]]]], "r": [[0.001018, 0.00100904, 0.00100893, 0.00101811, 0.00100887, 0.00101754, 0.00100885, 0.00100905, 0.001018, 0.00100834], 0, 84.9098, 1650253775], "v": "v0.6"}
{"i": [["[\"conv1x1\", 1, 7, 7, 2048, 2048]", "cuda -keys=cuda,gpu -max_num_threads=1024 -model=unknown -thread_warp_size=32", [-1, 16, 64, 49152, 2147483647, 1024, 8, 32], "", 0, []], [[], [["CHW", 2, "local"], ["SP", 2, 0, 1, [1, 1, 1, 1], 1], ["SP", 2, 5, 7, [1, 1, 1, 7], 1], ["SP", 2, 10, 7, [1, 7, 1, 1], 1], ["SP", 2, 15, 2048, [1, 128, 1, 1], 1], ["SP", 2, 20, 2048, [2, 2], 1], ["RE", 2, [0, 5, 10, 15, 1, 6, 11, 16, 2, 7, 12, 17, 20, 21, 3, 8, 13, 18, 22, 4, 9, 14, 19]], ["FSP", 3, 0, 1, 3], ["FSP", 3, 4, 2, 3], ["FSP", 3, 8, 3, 3], ["FSP", 3, 12, 4, 3], ["RE", 3, [0, 4, 8, 12, 1, 5, 9, 13, 2, 6, 10, 14, 3, 7, 11, 15]], ["CA", 2, 3, 11], ["CHR", 1, "shared", [2]], ["CA", 2, 3, 12], ["CHR", 0, "shared", [3]], ["CA", 1, 4, 12], ["FU", 5, [0, 1, 2, 3]], ["AN", 5, 0, 5], ["FU", 5, [1, 2, 3, 4]], ["AN", 5, 1, 4], ["FU", 5, [2, 3, 4, 5]], ["AN", 5, 2, 6], ["FU", 3, [0, 1]], ["SP", 3, 0, 16, [4], 1], ["AN", 3, 1, 2], ["FFSP", 3, 0, [4, 3, 2, 1], 1, 1], ["AN", 3, 1, 6], ["FU", 1, [0, 1, 2, 3]], ["SP", 1, 0, 196, [2], 1], ["AN", 1, 1, 2], ["FFSP", 1, 0, [4, 3, 2, 1], 1, 1], ["AN", 1, 1, 6], ["PR", 4, 0, "auto_unroll_max_step$1024"]]]], "r": [[0.000571848, 0.00124489, 0.00125944, 0.00125786, 0.00125913, 0.0010431, 0.000553369, 0.000585564, 0.00054832, 0.00106258], 0, 67.6721, 1650253758], "v": "v0.6"}
{"i": [["[\"conv1x1\", 1, 7, 7, 2048, 2048]", "cuda -keys=cuda,gpu -max_num_threads=1024 -model=unknown -thread_warp_size=32", [-1, 16, 64, 49152, 2147483647, 1024, 8, 32], "", 0, []], [[], [["CHW", 2, "local"], ["SP", 2, 0, 1, [1, 1, 1, 1], 1], ["SP", 2, 5, 7, [1, 7, 1, 1], 1], ["SP", 2, 10, 7, [1, 1, 1, 1], 1], ["SP", 2, 15, 2048, [8, 2, 1, 32], 1], ["SP", 2, 20, 2048, [1, 8], 1], ["RE", 2, [0, 5, 10, 15, 1, 6, 11, 16, 2, 7, 12, 17, 20, 21, 3, 8, 13, 18, 22, 4, 9, 14, 19]], ["FSP", 3, 0, 1, 3], ["FSP", 3, 4, 2, 3], ["FSP", 3, 8, 3, 3], ["FSP", 3, 12, 4, 3], ["RE", 3, [0, 4, 8, 12, 1, 5, 9, 13, 2, 6, 10, 14, 3, 7, 11, 15]], ["CA", 2, 3, 11], ["CHR", 1, "shared", [2]], ["CA", 2, 3, 12], ["CHR", 0, "shared", [3]], ["CA", 1, 4, 12], ["FU", 5, [0, 1, 2, 3]], ["AN", 5, 0, 5], ["FU", 5, [1, 2, 3, 4]], ["AN", 5, 1, 4], ["FU", 5, [2, 3, 4, 5]], ["AN", 5, 2, 6], ["FU", 3, [0, 1]], ["SP", 3, 0, 256, [64], 1], ["AN", 3, 1, 2], ["FFSP", 3, 0, [4, 3, 2, 1], 1, 1], ["AN", 3, 1, 6], ["FU", 1, [0, 1, 2, 3]], ["SP", 1, 0, 8, [2], 1], ["AN", 1, 1, 2], ["FFSP", 1, 0, [4, 3, 2, 1], 1, 1], ["AN", 1, 1, 6], ["PR", 4, 0, "auto_unroll_max_step$0"]]]], "r": [[0.0157747, 0.0160508, 0.0158327, 0.0160538, 0.0158242, 0.0160503, 0.0158291, 0.0160514, 0.0158265, 0.0160551], 0, 65.3761, 1650253754], "v": "v0.6"}
{"i": [["[\"conv1x1\", 1, 7, 7, 2048, 2048]", "cuda -keys=cuda,gpu -max_num_threads=1024 -model=unknown -thread_warp_size=32", [-1, 16, 64, 49152, 2147483647, 1024, 8, 32], "", 0, []], [[], [["CHW", 2, "local"], ["SP", 2, 0, 1, [1, 1, 1, 1], 1], ["SP", 2, 5, 7, [1, 7, 1, 1], 1], ["SP", 2, 10, 7, [1, 1, 7, 1], 1], ["SP", 2, 15, 2048, [1, 8, 32, 2], 1], ["SP", 2, 20, 2048, [1, 4], 1], ["RE", 2, [0, 5, 10, 15, 1, 6, 11, 16, 2, 7, 12, 17, 20, 21, 3, 8, 13, 18, 22, 4, 9, 14, 19]], ["FSP", 3, 0, 1, 3], ["FSP", 3, 4, 2, 3], ["FSP", 3, 8, 3, 3], ["FSP", 3, 12, 4, 3], ["RE", 3, [0, 4, 8, 12, 1, 5, 9, 13, 2, 6, 10, 14, 3, 7, 11, 15]], ["CA", 2, 3, 11], ["CHR", 1, "shared", [2]], ["CA", 2, 3, 12], ["CHR", 0, "shared", [3]], ["CA", 1, 4, 12], ["FU", 5, [0, 1, 2, 3]], ["AN", 5, 0, 5], ["FU", 5, [1, 2, 3, 4]], ["AN", 5, 1, 4], ["FU", 5, [2, 3, 4, 5]], ["AN", 5, 2, 6], ["FU", 3, [0, 1]], ["SP", 3, 0, 512, [1], 1], ["AN", 3, 1, 2], ["FFSP", 3, 0, [4, 3, 2, 1], 1, 1], ["AN", 3, 1, 6], ["FU", 1, [0, 1, 2, 3]], ["SP", 1, 0, 56, [1], 1], ["AN", 1, 1, 2], ["FFSP", 1, 0, [4, 3, 2, 1], 1, 1], ["AN", 1, 1, 6], ["PR", 4, 0, "auto_unroll_max_step$512"]]]], "r": [[0.0159242, 0.0156517, 0.0159339, 0.0156123, 0.0159234, 0.0156216, 0.015934, 0.0156206, 0.015921, 0.0149263], 0, 70.4925, 1650253759], "v": "v0.6"}
{"i": [["[\"conv1x1\", 1, 7, 7, 2048, 2048]", "cuda -keys=cuda,gpu -max_num_threads=1024 -model=unknown -thread_warp_size=32", [-1, 16, 64, 49152, 2147483647, 1024, 8, 32], "", 0, []], [[], [["CHW", 2, "local"], ["SP", 2, 0, 1, [1, 1, 1, 1], 1], ["SP", 2, 5, 7, [1, 1, 1, 7], 1], ["SP", 2, 10, 7, [1, 7, 1, 1], 1], ["SP", 2, 15, 2048, [4, 1, 4, 1], 1], ["SP", 2, 20, 2048, [2, 2], 1], ["RE", 2, [0, 5, 10, 15, 1, 6, 11, 16, 2, 7, 12, 17, 20, 21, 3, 8, 13, 18, 22, 4, 9, 14, 19]], ["FSP", 3, 0, 1, 3], ["FSP", 3, 4, 2, 3], ["FSP", 3, 8, 3, 3], ["FSP", 3, 12, 4, 3], ["RE", 3, [0, 4, 8, 12, 1, 5, 9, 13, 2, 6, 10, 14, 3, 7, 11, 15]], ["CA", 2, 3, 11], ["CHR", 1, "shared", [2]], ["CA", 2, 3, 12], ["CHR", 0, "shared", [3]], ["CA", 1, 4, 12], ["FU", 5, [0, 1, 2, 3]], ["AN", 5, 0, 5], ["FU", 5, [1, 2, 3, 4]], ["AN", 5, 1, 4], ["FU", 5, [2, 3, 4, 5]], ["AN", 5, 2, 6], ["FU", 3, [0, 1]], ["SP", 3, 0, 16, [8], 1], ["AN", 3, 1, 2], ["FFSP", 3, 0, [4, 3, 2, 1], 1, 1], ["AN", 3, 1, 6], ["FU", 1, [0, 1, 2, 3]], ["SP", 1, 0, 4, [1], 1], ["AN", 1, 1, 2], ["FFSP", 1, 0, [4, 3, 2, 1], 1, 1], ["AN", 1, 1, 6], ["PR", 4, 0, "auto_unroll_max_step$1024"]]]], "r": [[0.0016789, 0.0016973, 0.00169297, 0.00169675, 0.00169289, 0.00169774, 0.00169382, 0.0016976, 0.00169227, 0.00169627], 0, 60.9888, 1650253750], "v": "v0.6"}
{"i": [["[\"conv1x1\", 1, 7, 7, 2048, 2048]", "cuda -keys=cuda,gpu -max_num_threads=1024 -model=unknown -thread_warp_size=32", [-1, 16, 64, 49152, 2147483647, 1024, 8, 32], "", 0, []], [[], [["CHW", 2, "local"], ["SP", 2, 0, 1, [1, 1, 1, 1], 1], ["SP", 2, 5, 7, [1, 7, 1, 1], 1], ["SP", 2, 10, 7, [1, 7, 1, 1], 1], ["SP", 2, 15, 2048, [2, 8, 2, 4], 1], ["SP", 2, 20, 2048, [8, 2], 1], ["RE", 2, [0, 5, 10, 15, 1, 6, 11, 16, 2, 7, 12, 17, 20, 21, 3, 8, 13, 18, 22, 4, 9, 14, 19]], ["FSP", 3, 0, 1, 3], ["FSP", 3, 4, 2, 3], ["FSP", 3, 8, 3, 3], ["FSP", 3, 12, 4, 3], ["RE", 3, [0, 4, 8, 12, 1, 5, 9, 13, 2, 6, 10, 14, 3, 7, 11, 15]], ["CA", 2, 3, 11], ["CHR", 1, "shared", [2]], ["CA", 2, 3, 12], ["CHR", 0, "shared", [3]], ["CA", 1, 4, 12], ["FU", 5, [0, 1, 2, 3]], ["AN", 5, 0, 5], ["FU", 5, [1, 2, 3, 4]], ["AN", 5, 1, 4], ["FU", 5, [2, 3, 4, 5]], ["AN", 5, 2, 6], ["FU", 3, [0, 1]], ["SP", 3, 0, 128, [8], 1], ["AN", 3, 1, 2], ["FFSP", 3, 0, [4, 3, 2, 1], 1, 1], ["AN", 3, 1, 6], ["FU", 1, [0, 1, 2, 3]], ["SP", 1, 0, 112, [2], 1], ["AN", 1, 1, 2], ["FFSP", 1, 0, [4, 3, 2, 1], 1, 1], ["AN", 1, 1, 6], ["PR", 4, 0, "auto_unroll_max_step$16"]]]], "r": [[0.000842389, 0.00163889, 0.00162015, 0.00163386, 0.00163391, 0.00162, 0.00163427, 0.00161994, 0.00140251, 0.000747855], 0, 83.0601, 1650253773], "v": "v0.6"}
{"i": [["[\"conv1x1\", 1, 7, 7, 2048, 2048]", "cuda -keys=cuda,gpu -max_num_threads=1024 -model=unknown -thread_warp_size=32", [-1, 16, 64, 49152, 2147483647, 1024, 8, 32], "", 0, []], [[], [["CHW", 2, "local"], ["SP", 2, 0, 1, [1, 1, 1, 1], 1], ["SP", 2, 5, 7, [1, 1, 1, 7], 1], ["SP", 2, 10, 7, [1, 7, 1, 1], 1], ["SP", 2, 15, 2048, [2, 4, 256, 1], 1], ["SP", 2, 20, 2048, [2, 1], 1], ["RE", 2, [0, 5, 10, 15, 1, 6, 11, 16, 2, 7, 12, 17, 20, 21, 3, 8, 13, 18, 22, 4, 9, 14, 19]], ["FSP", 3, 0, 1, 3], ["FSP", 3, 4, 2, 3], ["FSP", 3, 8, 3, 3], ["FSP", 3, 12, 4, 3], ["RE", 3, [0, 4, 8, 12, 1, 5, 9, 13, 2, 6, 10, 14, 3, 7, 11, 15]], ["CA", 2, 3, 11], ["CHR", 1, "shared", [2]], ["CA", 2, 3, 12], ["CHR", 0, "shared", [3]], ["CA", 1, 4, 12], ["FU", 5, [0, 1, 2, 3]], ["AN", 5, 0, 5], ["FU", 5, [1, 2, 3, 4]], ["AN", 5, 1, 4], ["FU", 5, [2, 3, 4, 5]], ["AN", 5, 2, 6], ["FU", 3, [0, 1]], ["SP", 3, 0, 8, [1], 1], ["AN", 3, 1, 2], ["FFSP", 3, 0, [4, 3, 2, 1], 1, 1], ["AN", 3, 1, 6], ["FU", 1, [0, 1, 2, 3]], ["SP", 1, 0, 98, [1], 1], ["AN", 1, 1, 2], ["FFSP", 1, 0, [4, 3, 2, 1], 1, 1], ["AN", 1, 1, 6], ["PR", 4, 0, "auto_unroll_max_step$16"]]]], "r": [[0.224474, 0.224596, 0.224354, 0.117093, 0.171211, 0.221566, 0.165664, 0.101927, 0.0910686, 0.132523], 0, 79.4255, 1650253769], "v": "v0.6"}
{"i": [["[\"conv1x1\", 1, 7, 7, 2048, 2048]", "cuda -keys=cuda,gpu -max_num_threads=1024 -model=unknown -thread_warp_size=32", [-1, 16, 64, 49152, 2147483647, 1024, 8, 32], "", 0, []], [[], [["CHW", 2, "local"], ["SP", 2, 0, 1, [1, 1, 1, 1], 1], ["SP", 2, 5, 7, [7, 1, 1, 1], 1], ["SP", 2, 10, 7, [1, 7, 1, 1], 1], ["SP", 2, 15, 2048, [1, 16, 16, 2], 1], ["SP", 2, 20, 2048, [1, 2], 1], ["RE", 2, [0, 5, 10, 15, 1, 6, 11, 16, 2, 7, 12, 17, 20, 21, 3, 8, 13, 18, 22, 4, 9, 14, 19]], ["FSP", 3, 0, 1, 3], ["FSP", 3, 4, 2, 3], ["FSP", 3, 8, 3, 3], ["FSP", 3, 12, 4, 3], ["RE", 3, [0, 4, 8, 12, 1, 5, 9, 13, 2, 6, 10, 14, 3, 7, 11, 15]], ["CA", 2, 3, 11], ["CHR", 1, "shared", [2]], ["CA", 2, 3, 12], ["CHR", 0, "shared", [3]], ["CA", 1, 4, 12], ["FU", 5, [0, 1, 2, 3]], ["AN", 5, 0, 5], ["FU", 5, [1, 2, 3, 4]], ["AN", 5, 1, 4], ["FU", 5, [2, 3, 4, 5]], ["AN", 5, 2, 6], ["FU", 3, [0, 1]], ["SP", 3, 0, 256, [1], 1], ["AN", 3, 1, 2], ["FFSP", 3, 0, [4, 3, 2, 1], 1, 1], ["AN", 3, 1, 6], ["FU", 1, [0, 1, 2, 3]], ["SP", 1, 0, 2, [1], 1], ["AN", 1, 1, 2], ["FFSP", 1, 0, [4, 3, 2, 1], 1, 1], ["AN", 1, 1, 6], ["PR", 4, 0, "auto_unroll_max_step$0"]]]], "r": [[0.0172859, 0.0172844, 0.0170374, 0.0172809, 0.0172882, 0.0172822, 0.0170385, 0.0172813, 0.0172889, 0.00765431], 0, 73.5654, 1650253763], "v": "v0.6"}
{"i": [["[\"conv1x1\", 1, 7, 7, 2048, 2048]", "cuda -keys=cuda,gpu -max_num_threads=1024 -model=unknown -thread_warp_size=32", [-1, 16, 64, 49152, 2147483647, 1024, 8, 32], "", 0, []], [[], [["CHW", 2, "local"], ["SP", 2, 0, 1, [1, 1, 1, 1], 1], ["SP", 2, 5, 7, [1, 1, 1, 1], 1], ["SP", 2, 10, 7, [1, 1, 1, 1], 1], ["SP", 2, 15, 2048, [2, 1024, 1, 1], 1], ["SP", 2, 20, 2048, [1, 1], 1], ["RE", 2, [0, 5, 10, 15, 1, 6, 11, 16, 2, 7, 12, 17, 20, 21, 3, 8, 13, 18, 22, 4, 9, 14, 19]], ["FSP", 3, 0, 1, 3], ["FSP", 3, 4, 2, 3], ["FSP", 3, 8, 3, 3], ["FSP", 3, 12, 4, 3], ["RE", 3, [0, 4, 8, 12, 1, 5, 9, 13, 2, 6, 10, 14, 3, 7, 11, 15]], ["CA", 2, 3, 11], ["CHR", 1, "shared", [2]], ["CA", 2, 3, 12], ["CHR", 0, "shared", [3]], ["CA", 1, 4, 12], ["FU", 5, [0, 1, 2, 3]], ["AN", 5, 0, 5], ["FU", 5, [1, 2, 3, 4]], ["AN", 5, 1, 4], ["FU", 5, [2, 3, 4, 5]], ["AN", 5, 2, 6], ["FU", 3, [0, 1]], ["SP", 3, 0, 1, [1], 1], ["AN", 3, 1, 2], ["FFSP", 3, 0, [4, 3, 2, 1], 1, 1], ["AN", 3, 1, 6], ["FU", 1, [0, 1, 2, 3]], ["SP", 1, 0, 1, [1], 1], ["AN", 1, 1, 2], ["FFSP", 1, 0, [4, 3, 2, 1], 1, 1], ["AN", 1, 1, 6], ["PR", 4, 0, "auto_unroll_max_step$512"]]]], "r": [[0.00152174, 0.0015317, 0.00150161, 0.00153211, 0.0015021, 0.00153186, 0.00153206, 0.00153174, 0.00150209, 0.00153192], 0, 80.6184, 1650253771], "v": "v0.6"}
{"i": [["[\"conv1x1\", 1, 7, 7, 2048, 2048]", "cuda -keys=cuda,gpu -max_num_threads=1024 -model=unknown -thread_warp_size=32", [-1, 16, 64, 49152, 2147483647, 1024, 8, 32], "", 0, []], [[], [["CHW", 2, "local"], ["SP", 2, 0, 1, [1, 1, 1, 1], 1], ["SP", 2, 5, 7, [1, 1, 7, 1], 1], ["SP", 2, 10, 7, [1, 1, 7, 1], 1], ["SP", 2, 15, 2048, [1, 8, 32, 2], 1], ["SP", 2, 20, 2048, [1, 4], 1], ["RE", 2, [0, 5, 10, 15, 1, 6, 11, 16, 2, 7, 12, 17, 20, 21, 3, 8, 13, 18, 22, 4, 9, 14, 19]], ["FSP", 3, 0, 1, 3], ["FSP", 3, 4, 2, 3], ["FSP", 3, 8, 3, 3], ["FSP", 3, 12, 4, 3], ["RE", 3, [0, 4, 8, 12, 1, 5, 9, 13, 2, 6, 10, 14, 3, 7, 11, 15]], ["CA", 2, 3, 11], ["CHR", 1, "shared", [2]], ["CA", 2, 3, 12], ["CHR", 0, "shared", [3]], ["CA", 1, 4, 12], ["FU", 5, [0, 1, 2, 3]], ["AN", 5, 0, 5], ["FU", 5, [1, 2, 3, 4]], ["AN", 5, 1, 4], ["FU", 5, [2, 3, 4, 5]], ["AN", 5, 2, 6], ["FU", 3, [0, 1]], ["SP", 3, 0, 512, [1], 1], ["AN", 3, 1, 2], ["FFSP", 3, 0, [4, 3, 2, 1], 1, 1], ["AN", 3, 1, 6], ["FU", 1, [0, 1, 2, 3]], ["SP", 1, 0, 56, [1], 1], ["AN", 1, 1, 2], ["FFSP", 1, 0, [4, 3, 2, 1], 1, 1], ["AN", 1, 1, 6], ["PR", 4, 0, "auto_unroll_max_step$512"]]]], "r": [[0.105027, 0.105173, 0.105229, 0.105236, 0.105232, 0.0580601, 0.0517305, 0.0754606, 0.107052, 0.106892], 0, 89.6183, 1650253779], "v": "v0.6"}
{"i": [["[\"conv1x1\", 1, 7, 7, 2048, 2048]", "cuda -keys=cuda,gpu -max_num_threads=1024 -model=unknown -thread_warp_size=32", [-1, 16, 64, 49152, 2147483647, 1024, 8, 32], "", 0, []], [[], [["CHW", 2, "local"], ["SP", 2, 0, 1, [1, 1, 1, 1], 1], ["SP", 2, 5, 7, [1, 1, 7, 1], 1], ["SP", 2, 10, 7, [1, 1, 1, 7], 1], ["SP", 2, 15, 2048, [1, 32, 1, 1], 1], ["SP", 2, 20, 2048, [1, 2], 1], ["RE", 2, [0, 5, 10, 15, 1, 6, 11, 16, 2, 7, 12, 17, 20, 21, 3, 8, 13, 18, 22, 4, 9, 14, 19]], ["FSP", 3, 0, 1, 3], ["FSP", 3, 4, 2, 3], ["FSP", 3, 8, 3, 3], ["FSP", 3, 12, 4, 3], ["RE", 3, [0, 4, 8, 12, 1, 5, 9, 13, 2, 6, 10, 14, 3, 7, 11, 15]], ["CA", 2, 3, 11], ["CHR", 1, "shared", [2]], ["CA", 2, 3, 12], ["CHR", 0, "shared", [3]], ["CA", 1, 4, 12], ["FU", 5, [0, 1, 2, 3]], ["AN", 5, 0, 5], ["FU", 5, [1, 2, 3, 4]], ["AN", 5, 1, 4], ["FU", 5, [2, 3, 4, 5]], ["AN", 5, 2, 6], ["FU", 3, [0, 1]], ["SP", 3, 0, 8, [1], 1], ["AN", 3, 1, 2], ["FFSP", 3, 0, [4, 3, 2, 1], 1, 1], ["AN", 3, 1, 6], ["FU", 1, [0, 1, 2, 3]], ["SP", 1, 0, 392, [49], 1], ["AN", 1, 1, 2], ["FFSP", 1, 0, [4, 3, 2, 1], 1, 1], ["AN", 1, 1, 6], ["PR", 4, 0, "auto_unroll_max_step$0"]]]], "r": [[0.00935713, 0.00928774, 0.00935608, 0.00935236, 0.00357928, 0.0046066, 0.00724148, 0.0072568, 0.00725593, 0.00389343], 0, 88.3292, 1650253781], "v": "v0.6"}
{"i": [["[\"conv1x1\", 1, 7, 7, 2048, 2048]", "cuda -keys=cuda,gpu -max_num_threads=1024 -model=unknown -thread_warp_size=32", [-1, 16, 64, 49152, 2147483647, 1024, 8, 32], "", 0, []], [[], [["CHW", 2, "local"], ["SP", 2, 0, 1, [1, 1, 1, 1], 1], ["SP", 2, 5, 7, [7, 1, 1, 1], 1], ["SP", 2, 10, 7, [1, 1, 1, 1], 1], ["SP", 2, 15, 2048, [1, 64, 2, 4], 1], ["SP", 2, 20, 2048, [1, 2], 1], ["RE", 2, [0, 5, 10, 15, 1, 6, 11, 16, 2, 7, 12, 17, 20, 21, 3, 8, 13, 18, 22, 4, 9, 14, 19]], ["FSP", 3, 0, 1, 3], ["FSP", 3, 4, 2, 3], ["FSP", 3, 8, 3, 3], ["FSP", 3, 12, 4, 3], ["RE", 3, [0, 4, 8, 12, 1, 5, 9, 13, 2, 6, 10, 14, 3, 7, 11, 15]], ["CA", 2, 3, 11], ["CHR", 1, "shared", [2]], ["CA", 2, 3, 12], ["CHR", 0, "shared", [3]], ["CA", 1, 4, 12], ["FU", 5, [0, 1, 2, 3]], ["AN", 5, 0, 5], ["FU", 5, [1, 2, 3, 4]], ["AN", 5, 1, 4], ["FU", 5, [2, 3, 4, 5]], ["AN", 5, 2, 6], ["FU", 3, [0, 1]], ["SP", 3, 0, 16, [1], 1], ["AN", 3, 1, 2], ["FFSP", 3, 0, [4, 3, 2, 1], 1, 1], ["AN", 3, 1, 6], ["FU", 1, [0, 1, 2, 3]], ["SP", 1, 0, 2, [2], 1], ["AN", 1, 1, 2], ["FFSP", 1, 0, [4, 3, 2, 1], 1, 1], ["AN", 1, 1, 6], ["PR", 4, 0, "auto_unroll_max_step$512"]]]], "r": [[0.00124818, 0.00125996, 0.0012488, 0.0012476, 0.00124761, 0.00124837, 0.00126081, 0.00124779, 0.00124757, 0.00124893], 0, 88.7946, 1650253783], "v": "v0.6"}
{"i": [["[\"conv1x1\", 1, 7, 7, 2048, 2048]", "cuda -keys=cuda,gpu -max_num_threads=1024 -model=unknown -thread_warp_size=32", [-1, 16, 64, 49152, 2147483647, 1024, 8, 32], "", 0, []], [[], [["CHW", 2, "local"], ["SP", 2, 0, 1, [1, 1, 1, 1], 1], ["SP", 2, 5, 7, [1, 1, 1, 7], 1], ["SP", 2, 10, 7, [1, 1, 7, 1], 1], ["SP", 2, 15, 2048, [2, 32, 1, 32], 1], ["SP", 2, 20, 2048, [1, 1], 1], ["RE", 2, [0, 5, 10, 15, 1, 6, 11, 16, 2, 7, 12, 17, 20, 21, 3, 8, 13, 18, 22, 4, 9, 14, 19]], ["FSP", 3, 0, 1, 3], ["FSP", 3, 4, 2, 3], ["FSP", 3, 8, 3, 3], ["FSP", 3, 12, 4, 3], ["RE", 3, [0, 4, 8, 12, 1, 5, 9, 13, 2, 6, 10, 14, 3, 7, 11, 15]], ["CA", 2, 3, 11], ["CHR", 1, "shared", [2]], ["CA", 2, 3, 12], ["CHR", 0, "shared", [3]], ["CA", 1, 4, 12], ["FU", 5, [0, 1, 2, 3]], ["AN", 5, 0, 5], ["FU", 5, [1, 2, 3, 4]], ["AN", 5, 1, 4], ["FU", 5, [2, 3, 4, 5]], ["AN", 5, 2, 6], ["FU", 3, [0, 1]], ["SP", 3, 0, 64, [1], 1], ["AN", 3, 1, 2], ["FFSP", 3, 0, [4, 3, 2, 1], 1, 1], ["AN", 3, 1, 6], ["FU", 1, [0, 1, 2, 3]], ["SP", 1, 0, 7, [1], 1], ["AN", 1, 1, 2], ["FFSP", 1, 0, [4, 3, 2, 1], 1, 1], ["AN", 1, 1, 6], ["PR", 4, 0, "auto_unroll_max_step$512"]]]], "r": [[0.0731389, 0.0732234, 0.137401, 0.158868, 0.157929, 0.159387, 0.078042, 0.0773633, 0.148179, 0.157694], 0, 93.6902, 1650253788], "v": "v0.6"}
{"i": [["[\"conv1x1\", 1, 7, 7, 2048, 2048]", "cuda -keys=cuda,gpu -max_num_threads=1024 -model=unknown -thread_warp_size=32", [-1, 16, 64, 49152, 2147483647, 1024, 8, 32], "", 0, []], [[], [["CHW", 2, "local"], ["SP", 2, 0, 1, [1, 1, 1, 1], 1], ["SP", 2, 5, 7, [1, 7, 1, 1], 1], ["SP", 2, 10, 7, [1, 1, 1, 1], 1], ["SP", 2, 15, 2048, [2, 2, 16, 2], 1], ["SP", 2, 20, 2048, [4, 1], 1], ["RE", 2, [0, 5, 10, 15, 1, 6, 11, 16, 2, 7, 12, 17, 20, 21, 3, 8, 13, 18, 22, 4, 9, 14, 19]], ["FSP", 3, 0, 1, 3], ["FSP", 3, 4, 2, 3], ["FSP", 3, 8, 3, 3], ["FSP", 3, 12, 4, 3], ["RE", 3, [0, 4, 8, 12, 1, 5, 9, 13, 2, 6, 10, 14, 3, 7, 11, 15]], ["CA", 2, 3, 11], ["CHR", 1, "shared", [2]], ["CA", 2, 3, 12], ["CHR", 0, "shared", [3]], ["CA", 1, 4, 12], ["FU", 5, [0, 1, 2, 3]], ["AN", 5, 0, 5], ["FU", 5, [1, 2, 3, 4]], ["AN", 5, 1, 4], ["FU", 5, [2, 3, 4, 5]], ["AN", 5, 2, 6], ["FU", 3, [0, 1]], ["SP", 3, 0, 8, [4], 1], ["AN", 3, 1, 2], ["FFSP", 3, 0, [4, 3, 2, 1], 1, 1], ["AN", 3, 1, 6], ["FU", 1, [0, 1, 2, 3]], ["SP", 1, 0, 4, [1], 1], ["AN", 1, 1, 2], ["FFSP", 1, 0, [4, 3, 2, 1], 1, 1], ["AN", 1, 1, 6], ["PR", 4, 0, "auto_unroll_max_step$64"]]]], "r": [[0.00195958, 0.000878905, 0.000796289, 0.00188439, 0.00192634, 0.00192681, 0.0016543, 0.000801155, 0.00087246, 0.00184663], 0, 92.7718, 1650253791], "v": "v0.6"}
{"i": [["[\"conv1x1\", 1, 7, 7, 2048, 2048]", "cuda -keys=cuda,gpu -max_num_threads=1024 -model=unknown -thread_warp_size=32", [-1, 16, 64, 49152, 2147483647, 1024, 8, 32], "", 0, []], [[], [["CHW", 2, "local"], ["SP", 2, 0, 1, [1, 1, 1, 1], 1], ["SP", 2, 5, 7, [1, 1, 1, 1], 1], ["SP", 2, 10, 7, [1, 1, 1, 1], 1], ["SP", 2, 15, 2048, [1, 128, 1, 2], 1], ["SP", 2, 20, 2048, [2, 1], 1], ["RE", 2, [0, 5, 10, 15, 1, 6, 11, 16, 2, 7, 12, 17, 20, 21, 3, 8, 13, 18, 22, 4, 9, 14, 19]], ["FSP", 3, 0, 1, 3], ["FSP", 3, 4, 2, 3], ["FSP", 3, 8, 3, 3], ["FSP", 3, 12, 4, 3], ["RE", 3, [0, 4, 8, 12, 1, 5, 9, 13, 2, 6, 10, 14, 3, 7, 11, 15]], ["CA", 2, 3, 11], ["CHR", 1, "shared", [2]], ["CA", 2, 3, 12], ["CHR", 0, "shared", [3]], ["CA", 1, 4, 12], ["FU", 5, [0, 1, 2, 3]], ["AN", 5, 0, 5], ["FU", 5, [1, 2, 3, 4]], ["AN", 5, 1, 4], ["FU", 5, [2, 3, 4, 5]], ["AN", 5, 2, 6], ["FU", 3, [0, 1]], ["SP", 3, 0, 4, [2], 1], ["AN", 3, 1, 2], ["FFSP", 3, 0, [4, 3, 2, 1], 1, 1], ["AN", 3, 1, 6], ["FU", 1, [0, 1, 2, 3]], ["SP", 1, 0, 14, [1], 1], ["AN", 1, 1, 2], ["FFSP", 1, 0, [4, 3, 2, 1], 1, 1], ["AN", 1, 1, 6], ["PR", 4, 0, "auto_unroll_max_step$1024"]]]], "r": [[0.000557182, 0.00055655, 0.000557631, 0.000555999, 0.0005571, 0.000556699, 0.000557405, 0.000556624, 0.000557196, 0.000557318], 0, 93.0103, 1650253793], "v": "v0.6"}
{"i": [["[\"conv1x1\", 1, 7, 7, 2048, 2048]", "cuda -keys=cuda,gpu -max_num_threads=1024 -model=unknown -thread_warp_size=32", [-1, 16, 64, 49152, 2147483647, 1024, 8, 32], "", 0, []], [[], [["CHW", 2, "local"], ["SP", 2, 0, 1, [1, 1, 1, 1], 1], ["SP", 2, 5, 7, [1, 7, 1, 1], 1], ["SP", 2, 10, 7, [1, 7, 1, 1], 1], ["SP", 2, 15, 2048, [1, 2, 2, 32], 1], ["SP", 2, 20, 2048, [4, 4], 1], ["RE", 2, [0, 5, 10, 15, 1, 6, 11, 16, 2, 7, 12, 17, 20, 21, 3, 8, 13, 18, 22, 4, 9, 14, 19]], ["FSP", 3, 0, 1, 3], ["FSP", 3, 4, 2, 3], ["FSP", 3, 8, 3, 3], ["FSP", 3, 12, 4, 3], ["RE", 3, [0, 4, 8, 12, 1, 5, 9, 13, 2, 6, 10, 14, 3, 7, 11, 15]], ["CA", 2, 3, 11], ["CHR", 1, "shared", [2]], ["CA", 2, 3, 12], ["CHR", 0, "shared", [3]], ["CA", 1, 4, 12], ["FU", 5, [0, 1, 2, 3]], ["AN", 5, 0, 5], ["FU", 5, [1, 2, 3, 4]], ["AN", 5, 1, 4], ["FU", 5, [2, 3, 4, 5]], ["AN", 5, 2, 6], ["FU", 3, [0, 1]], ["SP", 3, 0, 1024, [32], 1], ["AN", 3, 1, 2], ["FFSP", 3, 0, [4, 3, 2, 1], 1, 1], ["AN", 3, 1, 6], ["FU", 1, [0, 1, 2, 3]], ["SP", 1, 0, 16, [1], 1], ["AN", 1, 1, 2], ["FFSP", 1, 0, [4, 3, 2, 1], 1, 1], ["AN", 1, 1, 6], ["PR", 4, 0, "auto_unroll_max_step$1024"]]]], "r": [[0.00156695, 0.00187198, 0.00185825, 0.00187358, 0.00187284, 0.00185878, 0.00187332, 0.00169392, 0.000817063, 0.000865469], 0, 96.0987, 1650253795], "v": "v0.6"}
{"i": [["[\"conv1x1\", 1, 7, 7, 2048, 2048]", "cuda -keys=cuda,gpu -max_num_threads=1024 -model=unknown -thread_warp_size=32", [-1, 16, 64, 49152, 2147483647, 1024, 8, 32], "", 0, []], [[], [["CHW", 2, "local"], ["SP", 2, 0, 1, [1, 1, 1, 1], 1], ["SP", 2, 5, 7, [1, 7, 1, 1], 1], ["SP", 2, 10, 7, [1, 1, 1, 1], 1], ["SP", 2, 15, 2048, [2, 2, 16, 2], 1], ["SP", 2, 20, 2048, [4, 1], 1], ["RE", 2, [0, 5, 10, 15, 1, 6, 11, 16, 2, 7, 12, 17, 20, 21, 3, 8, 13, 18, 22, 4, 9, 14, 19]], ["FSP", 3, 0, 1, 3], ["FSP", 3, 4, 2, 3], ["FSP", 3, 8, 3, 3], ["FSP", 3, 12, 4, 3], ["RE", 3, [0, 4, 8, 12, 1, 5, 9, 13, 2, 6, 10, 14, 3, 7, 11, 15]], ["CA", 2, 3, 11], ["CHR", 1, "shared", [2]], ["CA", 2, 3, 12], ["CHR", 0, "shared", [3]], ["CA", 1, 4, 12], ["FU", 5, [0, 1, 2, 3]], ["AN", 5, 0, 5], ["FU", 5, [1, 2, 3, 4]], ["AN", 5, 1, 4], ["FU", 5, [2, 3, 4, 5]], ["AN", 5, 2, 6], ["FU", 3, [0, 1]], ["SP", 3, 0, 8, [4], 1], ["AN", 3, 1, 2], ["FFSP", 3, 0, [4, 3, 2, 1], 1, 1], ["AN", 3, 1, 6], ["FU", 1, [0, 1, 2, 3]], ["SP", 1, 0, 4, [2], 1], ["AN", 1, 1, 2], ["FFSP", 1, 0, [4, 3, 2, 1], 1, 1], ["AN", 1, 1, 6], ["PR", 4, 0, "auto_unroll_max_step$64"]]]], "r": [[0.00214814, 0.00212081, 0.00214849, 0.00215149, 0.00213132, 0.00214634, 0.00214562, 0.00212794, 0.0021481, 0.0021282], 0, 92.9408, 1650253797], "v": "v0.6"}
