python/models/resnext/kernel_configs/resnext_101_imagenet_autotvm.log
{"input": ["cuda -keys=cuda,gpu -max_num_threads=1024 -model=unknown -thread_warp_size=32", "dense_small_batch.gpu", [["TENSOR", [1, 2048], "float32"], ["TENSOR", [1000, 2048], "float32"], null, "float32"], {}], "config": {"index": 7, "code_hash": null, "entity": [["tile_k", "sp", [-1, 128]]]}, "result": [[5.549486108727103e-06], 0, 1.4287347793579102, 1662997052.943026], "version": 0.2, "tvm_version": "0.8.0"}
{"input": ["cuda -keys=cuda,gpu -max_num_threads=1024 -model=unknown -thread_warp_size=32", "conv2d_nchw.cuda", [["TENSOR", [1, 2048, 7, 7], "float32"], ["TENSOR", [32, 2048, 1, 1], "float32"], [1, 1], [0, 0, 0, 0], [1, 1], "float32"], {}], "config": {"index": 50635, "code_hash": null, "entity": [["tile_f", "sp", [-1, 1, 4, 1]], ["tile_y", "sp", [-1, 1, 1, 1]], ["tile_x", "sp", [-1, 1, 7, 1]], ["tile_rc", "sp", [-1, 256]], ["tile_ry", "sp", [-1, 1]], ["tile_rx", "sp", [-1, 1]], ["auto_unroll_max_step", "ot", 512], ["unroll_explicit", "ot", 1]]}, "result": [[2.705007465730146e-05], 0, 2.732234239578247, 1662997495.9784777], "version": 0.2, "tvm_version": "0.8.0"}
{"input": ["cuda -keys=cuda,gpu -max_num_threads=1024 -model=unknown -thread_warp_size=32", "conv2d_nchw.cuda", [["TENSOR", [1, 2048, 7, 7], "float32"], ["TENSOR", [2048, 2048, 1, 1], "float32"], [1, 1], [0, 0, 0, 0], [1, 1], "float32"], {}], "config": {"index": 370652, "code_hash": null, "entity": [["tile_f", "sp", [-1, 2, 4, 2]], ["tile_y", "sp", [-1, 1, 7, 1]], ["tile_x", "sp", [-1, 1, 7, 1]], ["tile_rc", "sp", [-1, 8]], ["tile_ry", "sp", [-1, 1]], ["tile_rx", "sp", [-1, 1]], ["auto_unroll_max_step", "ot", 1500], ["unroll_explicit", "ot", 1]]}, "result": [[0.00012738961465471796], 0, 1.7161664962768555, 1662998923.364421], "version": 0.2, "tvm_version": "0.8.0"}
{"input": ["cuda -keys=cuda,gpu -max_num_threads=1024 -model=unknown -thread_warp_size=32", "conv2d_nchw.cuda", [["TENSOR", [1, 1024, 14, 14], "float32"], ["TENSOR", [2048, 1024, 1, 1], "float32"], [2, 2], [0, 0, 0, 0], [1, 1], "float32"], {}], "config": {"index": 282499, "code_hash": null, "entity": [["tile_f", "sp", [-1, 4, 8, 1]], ["tile_y", "sp", [-1, 1, 1, 1]], ["tile_x", "sp", [-1, 1, 7, 1]], ["tile_rc", "sp", [-1, 16]], ["tile_ry", "sp", [-1, 1]], ["tile_rx", "sp", [-1, 1]], ["auto_unroll_max_step", "ot", 512], ["unroll_explicit", "ot", 1]]}, "result": [[9.484584518664047e-05], 0, 1.6095712184906006, 1663000940.688931], "version": 0.2, "tvm_version": "0.8.0"}
{"input": ["cuda -keys=cuda,gpu -max_num_threads=1024 -model=unknown -thread_warp_size=32", "conv2d_nchw_winograd.cuda", [["TENSOR", [1, 32, 7, 7], "float32"], ["TENSOR", [32, 32, 3, 3], "float32"], [1, 1], [1, 1, 1, 1], [1, 1], "float32"], {}], "config": {"index": 32159, "code_hash": null, "entity": [["tile_b", "sp", [-1, 1, 1, 1]], ["tile_y", "sp", [-1, 1, 8, 1]], ["tile_x", "sp", [-1, 1, 16, 1]], ["tile_rc", "sp", [-1, 16]], ["auto_unroll_max_step", "ot", 1500], ["unroll_explicit", "ot", 0]]}, "result": [[1.1993287571421083e-05], 0, 1.9432330131530762, 1663002767.8858902], "version": 0.2, "tvm_version": "0.8.0"}
{"input": ["cuda -keys=cuda,gpu -max_num_threads=1024 -model=unknown -thread_warp_size=32", "conv2d_nchw.cuda", [["TENSOR", [1, 32, 7, 7], "float32"], ["TENSOR", [32, 32, 3, 3], "float32"], [1, 1], [1, 1, 1, 1], [1, 1], "float32"], {}], "config": {"index": 100482, "code_hash": null, "entity": [["tile_f", "sp", [-1, 1, 16, 1]], ["tile_y", "sp", [-1, 1, 7, 1]], ["tile_x", "sp", [-1, 1, 1, 1]], ["tile_rc", "sp", [-1, 16]], ["tile_ry", "sp", [-1, 1]], ["tile_rx", "sp", [-1, 3]], ["auto_unroll_max_step", "ot", 512], ["unroll_explicit", "ot", 1]]}, "result": [[6.331810133378546e-06], 0, 2.0924694538116455, 1663004544.7076337], "version": 0.2, "tvm_version": "0.8.0"}
{"input": ["cuda -keys=cuda,gpu -max_num_threads=1024 -model=unknown -thread_warp_size=32", "conv2d_nchw.cuda", [["TENSOR", [1, 1024, 14, 14], "float32"], ["TENSOR", [32, 1024, 1, 1], "float32"], [2, 2], [0, 0, 0, 0], [1, 1], "float32"], {}], "config": {"index": 47055, "code_hash": null, "entity": [["tile_f", "sp", [-1, 1, 8, 1]], ["tile_y", "sp", [-1, 1, 1, 1]], ["tile_x", "sp", [-1, 1, 7, 1]], ["tile_rc", "sp", [-1, 256]], ["tile_ry", "sp", [-1, 1]], ["tile_rx", "sp", [-1, 1]], ["auto_unroll_max_step", "ot", 512], ["unroll_explicit", "ot", 1]]}, "result": [[1.7364701957033548e-05], 0, 2.518862009048462, 1663006923.7127068], "version": 0.2, "tvm_version": "0.8.0"}
{"input": ["cuda -keys=cuda,gpu -max_num_threads=1024 -model=unknown -thread_warp_size=32", "conv2d_nchw.cuda", [["TENSOR", [1, 1024, 14, 14], "float32"], ["TENSOR", [16, 1024, 1, 1], "float32"], [1, 1], [0, 0, 0, 0], [1, 1], "float32"], {}], "config": {"index": 244312, "code_hash": null, "entity": [["tile_f", "sp", [-1, 1, 8, 1]], ["tile_y", "sp", [-1, 1, 2, 1]], ["tile_x", "sp", [-1, 1, 2, 1]], ["tile_rc", "sp", [-1, 32]], ["tile_ry", "sp", [-1, 1]], ["tile_rx", "sp", [-1, 1]], ["auto_unroll_max_step", "ot", 1500], ["unroll_explicit", "ot", 0]]}, "result": [[1.2314508562367865e-05], 0, 2.9021506309509277, 1663008182.1963735], "version": 0.2, "tvm_version": "0.8.0"}
{"input": ["cuda -keys=cuda,gpu -max_num_threads=1024 -model=unknown -thread_warp_size=32", "conv2d_nchw.cuda", [["TENSOR", [1, 1024, 14, 14], "float32"], ["TENSOR", [1024, 1024, 1, 1], "float32"], [1, 1], [0, 0, 0, 0], [1, 1], "float32"], {}], "config": {"index": 2745918, "code_hash": null, "entity": [["tile_f", "sp", [-1, 4, 8, 1]], ["tile_y", "sp", [-1, 2, 1, 1]], ["tile_x", "sp", [-1, 1, 14, 1]], ["tile_rc", "sp", [-1, 16]], ["tile_ry", "sp", [-1, 1]], ["tile_rx", "sp", [-1, 1]], ["auto_unroll_max_step", "ot", 0], ["unroll_explicit", "ot", 1]]}, "result": [[7.821547745702237e-05], 0, 1.6142630577087402, 1663011465.9726138], "version": 0.2, "tvm_version": "0.8.0"}
{"input": ["cuda -keys=cuda,gpu -max_num_threads=1024 -model=unknown -thread_warp_size=32", "conv2d_nchw.cuda", [["TENSOR", [1, 512, 28, 28], "float32"], ["TENSOR", [1024, 512, 1, 1], "float32"], [2, 2], [0, 0, 0, 0], [1, 1], "float32"], {}], "config": {"index": 329512, "code_hash": null, "entity": [["tile_f", "sp", [-1, 4, 16, 1]], ["tile_y", "sp", [-1, 1, 1, 1]], ["tile_x", "sp", [-1, 1, 14, 1]], ["tile_rc", "sp", [-1, 16]], ["tile_ry", "sp", [-1, 1]], ["tile_rx", "sp", [-1, 1]], ["auto_unroll_max_step", "ot", 0], ["unroll_explicit", "ot", 0]]}, "result": [[5.2814780509218617e-05], 0, 1.6253654956817627, 1663014952.559093], "version": 0.2, "tvm_version": "0.8.0"}
{"input": ["cuda -keys=cuda,gpu -max_num_threads=1024 -model=unknown -thread_warp_size=32", "conv2d_nchw_winograd.cuda", [["TENSOR", [1, 16, 14, 14], "float32"], ["TENSOR", [16, 16, 3, 3], "float32"], [1, 1], [1, 1, 1, 1], [1, 1], "float32"], {}], "config": {"index": 3341, "code_hash": null, "entity": [["tile_b", "sp", [-1, 1, 1, 1]], ["tile_y", "sp", [-1, 2, 1, 2]], ["tile_x", "sp", [-1, 1, 49, 1]], ["tile_rc", "sp", [-1, 16]], ["auto_unroll_max_step", "ot", 128], ["unroll_explicit", "ot", 0]]}, "result": [[1.24497772589053e-05], 0, 2.039036273956299, 1663016729.534683], "version": 0.2, "tvm_version": "0.8.0"}
{"input": ["cuda -keys=cuda,gpu -max_num_threads=1024 -model=unknown -thread_warp_size=32", "conv2d_nchw.cuda", [["TENSOR", [1, 16, 14, 14], "float32"], ["TENSOR", [16, 16, 3, 3], "float32"], [1, 1], [1, 1, 1, 1], [1, 1], "float32"], {}], "config": {"index": 342872, "code_hash": null, "entity": [["tile_f", "sp", [-1, 1, 8, 1]], ["tile_y", "sp", [-1, 1, 2, 1]], ["tile_x", "sp", [-1, 1, 2, 1]], ["tile_rc", "sp", [-1, 8]], ["tile_ry", "sp", [-1, 3]], ["tile_rx", "sp", [-1, 3]], ["auto_unroll_max_step", "ot", 512], ["unroll_explicit", "ot", 0]]}, "result": [[3.896467336774427e-06], 0, 2.049015998840332, 1663018692.9812012], "version": 0.2, "tvm_version": "0.8.0"}
{"input": ["cuda -keys=cuda,gpu -max_num_threads=1024 -model=unknown -thread_warp_size=32", "conv2d_nchw.cuda", [["TENSOR", [1, 512, 28, 28], "float32"], ["TENSOR", [16, 512, 1, 1], "float32"], [2, 2], [0, 0, 0, 0], [1, 1], "float32"], {}], "config": {"index": 495192, "code_hash": null, "entity": [["tile_f", "sp", [-1, 1, 8, 1]], ["tile_y", "sp", [-1, 1, 2, 1]], ["tile_x", "sp", [-1, 1, 2, 1]], ["tile_rc", "sp", [-1, 32]], ["tile_ry", "sp", [-1, 1]], ["tile_rx", "sp", [-1, 1]], ["auto_unroll_max_step", "ot", 1500], ["unroll_explicit", "ot", 1]]}, "result": [[8.971427572543993e-06], 0, 2.773719310760498, 1663020206.2586741], "version": 0.2, "tvm_version": "0.8.0"}
{"input": ["cuda -keys=cuda,gpu -max_num_threads=1024 -model=unknown -thread_warp_size=32", "conv2d_nchw.cuda", [["TENSOR", [1, 512, 28, 28], "float32"], ["TENSOR", [8, 512, 1, 1], "float32"], [1, 1], [0, 0, 0, 0], [1, 1], "float32"], {}], "config": {"index": 1736009, "code_hash": null, "entity": [["tile_f", "sp", [-1, 1, 8, 1]], ["tile_y", "sp", [-1, 1, 1, 1]], ["tile_x", "sp", [-1, 1, 4, 1]], ["tile_rc", "sp", [-1, 16]], ["tile_ry", "sp", [-1, 1]], ["tile_rx", "sp", [-1, 1]], ["auto_unroll_max_step", "ot", 1500], ["unroll_explicit", "ot", 1]]}, "result": [[8.248167239570142e-06], 0, 2.425957679748535, 1663021855.1190016], "version": 0.2, "tvm_version": "0.8.0"}
{"input": ["cuda -keys=cuda,gpu -max_num_threads=1024 -model=unknown -thread_warp_size=32", "conv2d_nchw.cuda", [["TENSOR", [1, 512, 28, 28], "float32"], ["TENSOR", [512, 512, 1, 1], "float32"], [1, 1], [0, 0, 0, 0], [1, 1], "float32"], {}], "config": {"index": 8328840, "code_hash": null, "entity": [["tile_f", "sp", [-1, 2, 8, 2]], ["tile_y", "sp", [-1, 1, 1, 2]], ["tile_x", "sp", [-1, 1, 14, 2]], ["tile_rc", "sp", [-1, 8]], ["tile_ry", "sp", [-1, 1]], ["tile_rx", "sp", [-1, 1]], ["auto_unroll_max_step", "ot", 1500], ["unroll_explicit", "ot", 0]]}, "result": [[6.150373449068164e-05], 0, 1.660574197769165, 1663026392.197584], "version": 0.2, "tvm_version": "0.8.0"}
{"input": ["cuda -keys=cuda,gpu -max_num_threads=1024 -model=unknown -thread_warp_size=32", "conv2d_nchw.cuda", [["TENSOR", [1, 256, 56, 56], "float32"], ["TENSOR", [512, 256, 1, 1], "float32"], [2, 2], [0, 0, 0, 0], [1, 1], "float32"], {}], "config": {"index": 14220836, "code_hash": null, "entity": [["tile_f", "sp", [-1, 4, 16, 1]], ["tile_y", "sp", [-1, 1, 1, 1]], ["tile_x", "sp", [-1, 2, 14, 1]], ["tile_rc", "sp", [-1, 16]], ["tile_ry", "sp", [-1, 1]], ["tile_rx", "sp", [-1, 1]], ["auto_unroll_max_step", "ot", 512], ["unroll_explicit", "ot", 1]]}, "result": [[3.836176592e-05], 0, 1.602649450302124, 1663029395.0590212], "version": 0.2, "tvm_version": "0.8.0"}
{"input": ["cuda -keys=cuda,gpu -max_num_threads=1024 -model=unknown -thread_warp_size=32", "conv2d_nchw_winograd.cuda", [["TENSOR", [1, 8, 28, 28], "float32"], ["TENSOR", [8, 8, 3, 3], "float32"], [1, 1], [1, 1, 1, 1], [1, 1], "float32"], {}], "config": {"index": 22678, "code_hash": null, "entity": [["tile_b", "sp", [-1, 1, 1, 1]], ["tile_y", "sp", [-1, 1, 2, 4]], ["tile_x", "sp", [-1, 1, 98, 1]], ["tile_rc", "sp", [-1, 8]], ["auto_unroll_max_step", "ot", 1500], ["unroll_explicit", "ot", 0]]}, "result": [[1.1928373351874742e-05], 0, 2.2652251720428467, 1663031653.9591594], "version": 0.2, "tvm_version": "0.8.0"}
{"input": ["cuda -keys=cuda,gpu -max_num_threads=1024 -model=unknown -thread_warp_size=32", "conv2d_nchw.cuda", [["TENSOR", [1, 8, 28, 28], "float32"], ["TENSOR", [8, 8, 3, 3], "float32"], [1, 1], [1, 1, 1, 1], [1, 1], "float32"], {}], "config": {"index": 2929809, "code_hash": null, "entity": [["tile_f", "sp", [-1, 1, 8, 1]], ["tile_y", "sp", [-1, 1, 4, 1]], ["tile_x", "sp", [-1, 1, 2, 2]], ["tile_rc", "sp", [-1, 8]], ["tile_ry", "sp", [-1, 1]], ["tile_rx", "sp", [-1, 3]], ["auto_unroll_max_step", "ot", 1500], ["unroll_explicit", "ot", 1]]}, "result": [[3.5045534583821807e-06], 0, 1.6979660987854004, 1663033861.2400904], "version": 0.2, "tvm_version": "0.8.0"}
{"input": ["cuda -keys=cuda,gpu -max_num_threads=1024 -model=unknown -thread_warp_size=32", "conv2d_nchw.cuda", [["TENSOR", [1, 256, 56, 56], "float32"], ["TENSOR", [8, 256, 1, 1], "float32"], [2, 2], [0, 0, 0, 0], [1, 1], "float32"], {}], "config": {"index": 712009, "code_hash": null, "entity": [["tile_f", "sp", [-1, 1, 8, 1]], ["tile_y", "sp", [-1, 1, 1, 1]], ["tile_x", "sp", [-1, 1, 4, 1]], ["tile_rc", "sp", [-1, 16]], ["tile_ry", "sp", [-1, 1]], ["tile_rx", "sp", [-1, 1]], ["auto_unroll_max_step", "ot", 1500], ["unroll_explicit", "ot", 0]]}, "result": [[6.333709788856953e-06], 0, 1.7823700904846191, 1663036060.5594497], "version": 0.2, "tvm_version": "0.8.0"}
{"input": ["cuda -keys=cuda,gpu -max_num_threads=1024 -model=unknown -thread_warp_size=32", "conv2d_nchw.cuda", [["TENSOR", [1, 256, 56, 56], "float32"], ["TENSOR", [4, 256, 1, 1], "float32"], [1, 1], [0, 0, 0, 0], [1, 1], "float32"], {}], "config": {"index": 3089688, "code_hash": null, "entity": [["tile_f", "sp", [-1, 1, 2, 2]], ["tile_y", "sp", [-1, 1, 2, 1]], ["tile_x", "sp", [-1, 1, 8, 1]], ["tile_rc", "sp", [-1, 8]], ["tile_ry", "sp", [-1, 1]], ["tile_rx", "sp", [-1, 1]], ["auto_unroll_max_step", "ot", 1500], ["unroll_explicit", "ot", 1]]}, "result": [[7.286830582242569e-06], 0, 2.256434917449951, 1663038523.826172], "version": 0.2, "tvm_version": "0.8.0"}
{"input": ["cuda -keys=cuda,gpu -max_num_threads=1024 -model=unknown -thread_warp_size=32", "conv2d_nchw.cuda", [["TENSOR", [1, 256, 56, 56], "float32"], ["TENSOR", [256, 256, 1, 1], "float32"], [1, 1], [0, 0, 0, 0], [1, 1], "float32"], {}], "config": {"index": 11912608, "code_hash": null, "entity": [["tile_f", "sp", [-1, 1, 16, 4]], ["tile_y", "sp", [-1, 2, 2, 2]], ["tile_x", "sp", [-1, 1, 8, 1]], ["tile_rc", "sp", [-1, 4]], ["tile_ry", "sp", [-1, 1]], ["tile_rx", "sp", [-1, 1]], ["auto_unroll_max_step", "ot", 512], ["unroll_explicit", "ot", 0]]}, "result": [[3.9809202040144785e-05], 0, 1.8825149536132812, 1663044040.6429722], "version": 0.2, "tvm_version": "0.8.0"}
{"input": ["cuda -keys=cuda,gpu -max_num_threads=1024 -model=unknown -thread_warp_size=32", "conv2d_nchw.cuda", [["TENSOR", [1, 64, 56, 56], "float32"], ["TENSOR", [256, 64, 1, 1], "float32"], [1, 1], [0, 0, 0, 0], [1, 1], "float32"], {}], "config": {"index": 39368537, "code_hash": null, "entity": [["tile_f", "sp", [-1, 4, 16, 1]], ["tile_y", "sp", [-1, 2, 2, 2]], ["tile_x", "sp", [-1, 1, 8, 1]], ["tile_rc", "sp", [-1, 4]], ["tile_ry", "sp", [-1, 1]], ["tile_rx", "sp", [-1, 1]], ["auto_unroll_max_step", "ot", 1500], ["unroll_explicit", "ot", 1]]}, "result": [[1.2179818909923028e-05], 0, 2.8704569339752197, 1663046334.4018033], "version": 0.2, "tvm_version": "0.8.0"}
{"input": ["cuda -keys=cuda,gpu -max_num_threads=1024 -model=unknown -thread_warp_size=32", "conv2d_nchw_winograd.cuda", [["TENSOR", [1, 4, 56, 56], "float32"], ["TENSOR", [4, 4, 3, 3], "float32"], [1, 1], [1, 1, 1, 1], [1, 1], "float32"], {}], "config": {"index": 17348, "code_hash": null, "entity": [["tile_b", "sp", [-1, 1, 1, 1]], ["tile_y", "sp", [-1, 1, 2, 2]], ["tile_x", "sp", [-1, 2, 98, 1]], ["tile_rc", "sp", [-1, 4]], ["auto_unroll_max_step", "ot", 1500], ["unroll_explicit", "ot", 1]]}, "result": [[1.883235810541424e-05], 0, 5.66089940071106, 1663048478.7552924], "version": 0.2, "tvm_version": "0.8.0"}
{"input": ["cuda -keys=cuda,gpu -max_num_threads=1024 -model=unknown -thread_warp_size=32", "conv2d_nchw.cuda", [["TENSOR", [1, 4, 56, 56], "float32"], ["TENSOR", [4, 4, 3, 3], "float32"], [1, 1], [1, 1, 1, 1], [1, 1], "float32"], {}], "config": {"index": 2827428, "code_hash": null, "entity": [["tile_f", "sp", [-1, 1, 2, 2]], ["tile_y", "sp", [-1, 1, 8, 1]], ["tile_x", "sp", [-1, 1, 4, 1]], ["tile_rc", "sp", [-1, 4]], ["tile_ry", "sp", [-1, 1]], ["tile_rx", "sp", [-1, 3]], ["auto_unroll_max_step", "ot", 0], ["unroll_explicit", "ot", 1]]}, "result": [[3.399621974924677e-06], 0, 1.6819896697998047, 1663052458.0629582], "version": 0.2, "tvm_version": "0.8.0"}
{"input": ["cuda -keys=cuda,gpu -max_num_threads=1024 -model=unknown -thread_warp_size=32", "conv2d_nchw.cuda", [["TENSOR", [1, 64, 56, 56], "float32"], ["TENSOR", [4, 64, 1, 1], "float32"], [1, 1], [0, 0, 0, 0], [1, 1], "float32"], {}], "config": {"index": 1111205, "code_hash": null, "entity": [["tile_f", "sp", [-1, 1, 4, 1]], ["tile_y", "sp", [-1, 1, 1, 1]], ["tile_x", "sp", [-1, 1, 56, 1]], ["tile_rc", "sp", [-1, 8]], ["tile_ry", "sp", [-1, 1]], ["tile_rx", "sp", [-1, 1]], ["auto_unroll_max_step", "ot", 1500], ["unroll_explicit", "ot", 0]]}, "result": [[4.087260469153975e-06], 0, 1.7351601123809814, 1663055520.7085671], "version": 0.2, "tvm_version": "0.8.0"}
{"input": ["cuda -keys=cuda,gpu -max_num_threads=1024 -model=unknown -thread_warp_size=32", "conv2d_nchw.cuda", [["TENSOR", [1, 3, 230, 230], "float32"], ["TENSOR", [64, 3, 7, 7], "float32"], [2, 2], [0, 0, 0, 0], [1, 1], "float32"], {}], "config": {"index": 33369965, "code_hash": null, "entity": [["tile_f", "sp", [-1, 4, 4, 2]], ["tile_y", "sp", [-1, 1, 2, 4]], ["tile_x", "sp", [-1, 1, 16, 1]], ["tile_rc", "sp", [-1, 1]], ["tile_ry", "sp", [-1, 1]], ["tile_rx", "sp", [-1, 7]], ["auto_unroll_max_step", "ot", 1500], ["unroll_explicit", "ot", 0]]}, "result": [[2.1928006474886688e-05], 0, 1.8430211544036865, 1663058501.9431667], "version": 0.2, "tvm_version": "0.8.0"}
