python/models/resnext/kernel_configs/resnext_imagenet_50_fused_conv1x1_bn_relu_1_28_28_1024_16_64_s2.log
{"i": [["[\"fused_conv1x1_bn_relu_stride\", 1, 28, 28, 1024, 16, 64, 2]", "cuda -keys=cuda,gpu -max_num_threads=1024 -model=unknown -thread_warp_size=32", [-1, 16, 64, 49152, 2147483647, 1024, 8, 32], "", 0, []], [[], [["CI", 6], ["CI", 4], ["CHW", 2, "local"], ["SP", 2, 0, 1, [1, 1, 1, 1], 1], ["SP", 2, 5, 64, [1, 4, 1, 2], 1], ["SP", 2, 10, 14, [1, 2, 1, 7], 1], ["SP", 2, 15, 14, [7, 1, 2, 1], 1], ["SP", 2, 20, 16, [1, 4, 1, 1], 1], ["SP", 2, 25, 1024, [2, 8], 1], ["RE", 2, [0, 5, 10, 15, 20, 1, 6, 11, 16, 21, 2, 7, 12, 17, 22, 25, 26, 3, 8, 13, 18, 23, 27, 4, 9, 14, 19, 24]], ["FSP", 3, 0, 3, 3], ["FSP", 3, 4, 4, 3], ["FSP", 3, 8, 5, 3], ["FSP", 3, 12, 6, 3], ["FSP", 3, 16, 7, 3], ["RE", 3, [0, 4, 8, 12, 16, 1, 5, 9, 13, 17, 2, 6, 10, 14, 18, 3, 7, 11, 15, 19]], ["CA", 2, 3, 14], ["CHR", 1, "shared", [2]], ["CA", 2, 3, 15], ["CHR", 0, "shared", [3]], ["CA", 1, 4, 15], ["FU", 10, [0, 1, 2, 3, 4]], ["SP", 10, 0, 802816, [2], 1], ["AN", 10, 0, 5], ["AN", 10, 1, 6], ["FU", 5, [0, 1, 2, 3, 4]], ["AN", 5, 0, 5], ["FU", 5, [1, 2, 3, 4, 5]], ["AN", 5, 1, 4], ["FU", 5, [2, 3, 4, 5, 6]], ["AN", 5, 2, 6], ["FU", 3, [0, 1, 2]], ["SP", 3, 0, 32, [32], 1], ["AN", 3, 1, 2], ["FFSP", 3, 0, [7, 6, 5, 4, 3], 1, 1], ["AN", 3, 1, 6], ["FU", 1, [0, 1, 2, 3]], ["SP", 1, 0, 624, [1], 1], ["AN", 1, 1, 2], ["FFSP", 1, 0, [7, 6, 5, 4, 3], 1, 1], ["AN", 1, 1, 6], ["PR", 4, 0, "auto_unroll_max_step$512"]]]], "r": [[0.00229787, 0.00229795, 0.00229805, 0.0022983, 0.00229769, 0.00229811, 0.00229765, 0.00229755, 0.0022974, 0.00229749], 0, 7.59688, 1649992296], "v": "v0.6"}
{"i": [["[\"fused_conv1x1_bn_relu_stride\", 1, 28, 28, 1024, 16, 64, 2]", "cuda -keys=cuda,gpu -max_num_threads=1024 -model=unknown -thread_warp_size=32", [-1, 16, 64, 49152, 2147483647, 1024, 8, 32], "", 0, []], [[], [["CI", 6], ["CI", 4], ["CHW", 2, "local"], ["SP", 2, 0, 1, [1, 1, 1, 1], 1], ["SP", 2, 5, 64, [1, 32, 1, 2], 1], ["SP", 2, 10, 14, [1, 1, 7, 2], 1], ["SP", 2, 15, 14, [1, 1, 2, 1], 1], ["SP", 2, 20, 16, [2, 4, 1, 1], 1], ["SP", 2, 25, 1024, [1, 16], 1], ["RE", 2, [0, 5, 10, 15, 20, 1, 6, 11, 16, 21, 2, 7, 12, 17, 22, 25, 26, 3, 8, 13, 18, 23, 27, 4, 9, 14, 19, 24]], ["FSP", 3, 0, 3, 3], ["FSP", 3, 4, 4, 3], ["FSP", 3, 8, 5, 3], ["FSP", 3, 12, 6, 3], ["FSP", 3, 16, 7, 3], ["RE", 3, [0, 4, 8, 12, 16, 1, 5, 9, 13, 17, 2, 6, 10, 14, 18, 3, 7, 11, 15, 19]], ["CA", 2, 3, 14], ["CHR", 1, "shared", [2]], ["CA", 2, 3, 15], ["CHR", 0, "shared", [3]], ["CA", 1, 4, 15], ["FU", 10, [0, 1, 2, 3, 4]], ["SP", 10, 0, 802816, [32], 1], ["AN", 10, 0, 5], ["AN", 10, 1, 6], ["FU", 5, [0, 1, 2, 3, 4]], ["AN", 5, 0, 5], ["FU", 5, [1, 2, 3, 4, 5]], ["AN", 5, 1, 4], ["FU", 5, [2, 3, 4, 5, 6]], ["AN", 5, 2, 6], ["FU", 3, [0, 1, 2]], ["SP", 3, 0, 32, [1], 1], ["AN", 3, 1, 2], ["FFSP", 3, 0, [7, 6, 5, 4, 3], 1, 1], ["AN", 3, 1, 6], ["FU", 1, [0, 1, 2, 3]], ["SP", 1, 0, 1296, [1], 1], ["AN", 1, 1, 2], ["FFSP", 1, 0, [7, 6, 5, 4, 3], 1, 1], ["AN", 1, 1, 6], ["PR", 4, 0, "auto_unroll_max_step$64"]]]], "r": [[0.00154649, 0.0015462, 0.00154589, 0.00154656, 0.0015465, 0.00154632, 0.00154526, 0.00154485, 0.00154536, 0.00154532], 0, 10.4997, 1649992302], "v": "v0.6"}
