python/models/resnext/kernel_configs/resnext_imagenet_50_fused_conv1x1_bn_relu_1_28_28_512_16_64_s2.log
{"i": [["[\"fused_conv1x1_bn_relu_stride\", 1, 28, 28, 512, 16, 64, 2]", "cuda -keys=cuda,gpu -max_num_threads=1024 -model=unknown -thread_warp_size=32", [-1, 16, 64, 49152, 2147483647, 1024, 8, 32], "", 0, []], [[], [["CI", 6], ["CI", 4], ["CHW", 2, "local"], ["SP", 2, 0, 1, [1, 1, 1, 1], 1], ["SP", 2, 5, 64, [1, 8, 2, 1], 1], ["SP", 2, 10, 14, [1, 1, 1, 1], 1], ["SP", 2, 15, 14, [1, 7, 1, 1], 1], ["SP", 2, 20, 16, [1, 2, 2, 1], 1], ["SP", 2, 25, 512, [16, 1], 1], ["RE", 2, [0, 5, 10, 15, 20, 1, 6, 11, 16, 21, 2, 7, 12, 17, 22, 25, 26, 3, 8, 13, 18, 23, 27, 4, 9, 14, 19, 24]], ["FSP", 3, 0, 3, 3], ["FSP", 3, 4, 4, 3], ["FSP", 3, 8, 5, 3], ["FSP", 3, 12, 6, 3], ["FSP", 3, 16, 7, 3], ["RE", 3, [0, 4, 8, 12, 16, 1, 5, 9, 13, 17, 2, 6, 10, 14, 18, 3, 7, 11, 15, 19]], ["CA", 2, 3, 14], ["CHR", 1, "shared", [2]], ["CA", 2, 3, 15], ["CHR", 0, "shared", [3]], ["CA", 1, 4, 15], ["FU", 10, [0, 1, 2, 3, 4]], ["SP", 10, 0, 802816, [64], 1], ["AN", 10, 0, 5], ["AN", 10, 1, 6], ["FU", 5, [0, 1, 2, 3, 4]], ["AN", 5, 0, 5], ["FU", 5, [1, 2, 3, 4, 5]], ["AN", 5, 1, 4], ["FU", 5, [2, 3, 4, 5, 6]], ["AN", 5, 2, 6], ["FU", 3, [0, 1, 2]], ["SP", 3, 0, 64, [1], 1], ["AN", 3, 1, 2], ["FFSP", 3, 0, [7, 6, 5, 4, 3], 1, 1], ["AN", 3, 1, 6], ["FU", 1, [0, 1, 2, 3]], ["SP", 1, 0, 16, [2], 1], ["AN", 1, 1, 2], ["FFSP", 1, 0, [7, 6, 5, 4, 3], 1, 1], ["AN", 1, 1, 6], ["PR", 4, 0, "auto_unroll_max_step$1024"]]]], "r": [[0.00011931, 0.000119309, 0.000119314, 0.000119252, 0.000119274, 0.000119269, 0.000119267, 0.000119263, 0.000119266, 0.000119275], 0, 10.026, 1654004797], "v": "v0.6"}
{"i": [["[\"fused_conv1x1_bn_relu_stride\", 1, 28, 28, 512, 16, 64, 2]", "cuda -keys=cuda,gpu -max_num_threads=1024 -model=unknown -thread_warp_size=32", [-1, 16, 64, 49152, 2147483647, 1024, 8, 32], "", 0, []], [[], [["CI", 6], ["CI", 4], ["CHW", 2, "local"], ["SP", 2, 0, 1, [1, 1, 1, 1], 1], ["SP", 2, 5, 64, [4, 2, 8, 1], 1], ["SP", 2, 10, 14, [2, 7, 1, 1], 1], ["SP", 2, 15, 14, [1, 14, 1, 1], 1], ["SP", 2, 20, 16, [1, 2, 2, 1], 1], ["SP", 2, 25, 512, [8, 1], 1], ["RE", 2, [0, 5, 10, 15, 20, 1, 6, 11, 16, 21, 2, 7, 12, 17, 22, 25, 26, 3, 8, 13, 18, 23, 27, 4, 9, 14, 19, 24]], ["FSP", 3, 0, 3, 3], ["FSP", 3, 4, 4, 3], ["FSP", 3, 8, 5, 3], ["FSP", 3, 12, 6, 3], ["FSP", 3, 16, 7, 3], ["RE", 3, [0, 4, 8, 12, 16, 1, 5, 9, 13, 17, 2, 6, 10, 14, 18, 3, 7, 11, 15, 19]], ["CA", 2, 3, 14], ["CHR", 1, "shared", [2]], ["CA", 2, 3, 15], ["CHR", 0, "shared", [3]], ["CA", 1, 4, 15], ["FU", 10, [0, 1, 2, 3, 4]], ["SP", 10, 0, 802816, [32], 1], ["AN", 10, 0, 5], ["AN", 10, 1, 6], ["FU", 5, [0, 1, 2, 3, 4]], ["AN", 5, 0, 5], ["FU", 5, [1, 2, 3, 4, 5]], ["AN", 5, 1, 4], ["FU", 5, [2, 3, 4, 5, 6]], ["AN", 5, 2, 6], ["FU", 3, [0, 1, 2]], ["SP", 3, 0, 128, [1], 1], ["AN", 3, 1, 2], ["FFSP", 3, 0, [7, 6, 5, 4, 3], 1, 1], ["AN", 3, 1, 6], ["FU", 1, [0, 1, 2, 3]], ["SP", 1, 0, 8, [1], 1], ["AN", 1, 1, 2], ["FFSP", 1, 0, [7, 6, 5, 4, 3], 1, 1], ["AN", 1, 1, 6], ["PR", 4, 0, "auto_unroll_max_step$0"]]]], "r": [[0.000923007, 0.00092302, 0.000922984, 0.000923018, 0.000923046, 0.000923113, 0.000922928, 0.000923006, 0.000922995, 0.000922983], 0, 4.54229, 1654004791], "v": "v0.6"}
{"i": [["[\"fused_conv1x1_bn_relu_stride\", 1, 28, 28, 512, 16, 64, 2]", "cuda -keys=cuda,gpu -max_num_threads=1024 -model=unknown -thread_warp_size=32", [-1, 16, 64, 49152, 2147483647, 1024, 8, 32], "", 0, []], [[], [["CI", 6], ["CI", 4], ["CHW", 2, "local"], ["SP", 2, 0, 1, [1, 1, 1, 1], 1], ["SP", 2, 5, 64, [1, 4, 2, 1], 1], ["SP", 2, 10, 14, [1, 2, 1, 1], 1], ["SP", 2, 15, 14, [1, 2, 1, 7], 1], ["SP", 2, 20, 16, [1, 4, 2, 1], 1], ["SP", 2, 25, 512, [16, 1], 1], ["RE", 2, [0, 5, 10, 15, 20, 1, 6, 11, 16, 21, 2, 7, 12, 17, 22, 25, 26, 3, 8, 13, 18, 23, 27, 4, 9, 14, 19, 24]], ["FSP", 3, 0, 3, 3], ["FSP", 3, 4, 4, 3], ["FSP", 3, 8, 5, 3], ["FSP", 3, 12, 6, 3], ["FSP", 3, 16, 7, 3], ["RE", 3, [0, 4, 8, 12, 16, 1, 5, 9, 13, 17, 2, 6, 10, 14, 18, 3, 7, 11, 15, 19]], ["CA", 2, 3, 14], ["CHR", 1, "shared", [2]], ["CA", 2, 3, 15], ["CHR", 0, "shared", [3]], ["CA", 1, 4, 15], ["FU", 10, [0, 1, 2, 3, 4]], ["SP", 10, 0, 802816, [32], 1], ["AN", 10, 0, 5], ["AN", 10, 1, 6], ["FU", 5, [0, 1, 2, 3, 4]], ["AN", 5, 0, 5], ["FU", 5, [1, 2, 3, 4, 5]], ["AN", 5, 1, 4], ["FU", 5, [2, 3, 4, 5, 6]], ["AN", 5, 2, 6], ["FU", 3, [0, 1, 2]], ["SP", 3, 0, 64, [1], 1], ["AN", 3, 1, 2], ["FFSP", 3, 0, [7, 6, 5, 4, 3], 1, 1], ["AN", 3, 1, 6], ["FU", 1, [0, 1, 2, 3]], ["SP", 1, 0, 208, [1], 1], ["AN", 1, 1, 2], ["FFSP", 1, 0, [7, 6, 5, 4, 3], 1, 1], ["AN", 1, 1, 6], ["PR", 4, 0, "auto_unroll_max_step$64"]]]], "r": [[0.000108793, 0.000108803, 0.000108807, 0.000108813, 0.000108798, 0.000108799, 0.000108832, 0.000108812, 0.000108816, 0.00010881], 0, 13.8192, 1654017845], "v": "v0.6"}
{"i": [["[\"fused_conv1x1_bn_relu_stride\", 1, 28, 28, 512, 16, 64, 2]", "cuda -keys=cuda,gpu -max_num_threads=1024 -model=unknown -thread_warp_size=32", [-1, 16, 64, 49152, 2147483647, 1024, 8, 32], "", 0, []], [[], [["CI", 6], ["CI", 4], ["CHW", 2, "local"], ["SP", 2, 0, 1, [1, 1, 1, 1], 1], ["SP", 2, 5, 64, [1, 32, 1, 1], 1], ["SP", 2, 10, 14, [1, 1, 1, 1], 1], ["SP", 2, 15, 14, [1, 2, 1, 7], 1], ["SP", 2, 20, 16, [1, 1, 16, 1], 1], ["SP", 2, 25, 512, [1, 4], 1], ["RE", 2, [0, 5, 10, 15, 20, 1, 6, 11, 16, 21, 2, 7, 12, 17, 22, 25, 26, 3, 8, 13, 18, 23, 27, 4, 9, 14, 19, 24]], ["FSP", 3, 0, 3, 3], ["FSP", 3, 4, 4, 3], ["FSP", 3, 8, 5, 3], ["FSP", 3, 12, 6, 3], ["FSP", 3, 16, 7, 3], ["RE", 3, [0, 4, 8, 12, 16, 1, 5, 9, 13, 17, 2, 6, 10, 14, 18, 3, 7, 11, 15, 19]], ["CA", 2, 3, 14], ["CHR", 1, "shared", [2]], ["CA", 2, 3, 15], ["CHR", 0, "shared", [3]], ["CA", 1, 4, 15], ["FU", 10, [0, 1, 2, 3, 4]], ["SP", 10, 0, 802816, [32], 1], ["AN", 10, 0, 5], ["AN", 10, 1, 6], ["FU", 5, [0, 1, 2, 3, 4]], ["AN", 5, 0, 5], ["FU", 5, [1, 2, 3, 4, 5]], ["AN", 5, 1, 4], ["FU", 5, [2, 3, 4, 5, 6]], ["AN", 5, 2, 6], ["FU", 3, [0, 1, 2]], ["SP", 3, 0, 64, [1], 1], ["AN", 3, 1, 2], ["FFSP", 3, 0, [7, 6, 5, 4, 3], 1, 1], ["AN", 3, 1, 6], ["FU", 1, [0, 1, 2, 3]], ["SP", 1, 0, 52, [1], 1], ["AN", 1, 1, 2], ["FFSP", 1, 0, [7, 6, 5, 4, 3], 1, 1], ["AN", 1, 1, 6], ["PR", 4, 0, "auto_unroll_max_step$64"]]]], "r": [[0.000184984, 0.00018497, 0.000184981, 0.000184974, 0.000184967, 0.000184965, 0.00018497, 0.000184971, 0.000184978, 0.000184983], 0, 27.5729, 1654017859], "v": "v0.6"}
{"i": [["[\"fused_conv1x1_bn_relu_stride\", 1, 28, 28, 512, 16, 64, 2]", "cuda -keys=cuda,gpu -max_num_threads=1024 -model=unknown -thread_warp_size=32", [-1, 16, 64, 49152, 2147483647, 1024, 8, 32], "", 0, []], [[], [["CI", 6], ["CI", 4], ["CHW", 2, "local"], ["SP", 2, 0, 1, [1, 1, 1, 1], 1], ["SP", 2, 5, 64, [1, 32, 1, 2], 1], ["SP", 2, 10, 14, [1, 7, 2, 1], 1], ["SP", 2, 15, 14, [1, 1, 14, 1], 1], ["SP", 2, 20, 16, [4, 4, 1, 1], 1], ["SP", 2, 25, 512, [2, 1], 1], ["RE", 2, [0, 5, 10, 15, 20, 1, 6, 11, 16, 21, 2, 7, 12, 17, 22, 25, 26, 3, 8, 13, 18, 23, 27, 4, 9, 14, 19, 24]], ["FSP", 3, 0, 3, 3], ["FSP", 3, 4, 4, 3], ["FSP", 3, 8, 5, 3], ["FSP", 3, 12, 6, 3], ["FSP", 3, 16, 7, 3], ["RE", 3, [0, 4, 8, 12, 16, 1, 5, 9, 13, 17, 2, 6, 10, 14, 18, 3, 7, 11, 15, 19]], ["CA", 2, 3, 14], ["CHR", 1, "shared", [2]], ["CA", 2, 3, 15], ["CHR", 0, "shared", [3]], ["CA", 1, 4, 15], ["FU", 10, [0, 1, 2, 3, 4]], ["SP", 10, 0, 802816, [32], 1], ["AN", 10, 0, 5], ["AN", 10, 1, 6], ["FU", 5, [0, 1, 2, 3, 4]], ["AN", 5, 0, 5], ["FU", 5, [1, 2, 3, 4, 5]], ["AN", 5, 1, 4], ["FU", 5, [2, 3, 4, 5, 6]], ["AN", 5, 2, 6], ["FU", 3, [0, 1, 2]], ["SP", 3, 0, 4, [1], 1], ["AN", 3, 1, 2], ["FFSP", 3, 0, [7, 6, 5, 4, 3], 1, 1], ["AN", 3, 1, 6], ["FU", 1, [0, 1, 2, 3]], ["SP", 1, 0, 162, [1], 1], ["AN", 1, 1, 2], ["FFSP", 1, 0, [7, 6, 5, 4, 3], 1, 1], ["AN", 1, 1, 6], ["PR", 4, 0, "auto_unroll_max_step$0"]]]], "r": [[0.012235, 0.012235, 0.0122352, 0.012235, 0.0122349, 0.0122353, 0.0122361, 0.012235, 0.0122351, 0.012235], 0, 8.39948, 1654017840], "v": "v0.6"}
{"i": [["[\"fused_conv1x1_bn_relu_stride\", 1, 28, 28, 512, 16, 64, 2]", "cuda -keys=cuda,gpu -max_num_threads=1024 -model=unknown -thread_warp_size=32", [-1, 16, 64, 49152, 2147483647, 1024, 8, 32], "", 0, []], [[], [["CI", 6], ["CI", 4], ["CHW", 2, "local"], ["SP", 2, 0, 1, [1, 1, 1, 1], 1], ["SP", 2, 5, 64, [1, 8, 8, 1], 1], ["SP", 2, 10, 14, [1, 1, 1, 2], 1], ["SP", 2, 15, 14, [1, 7, 1, 2], 1], ["SP", 2, 20, 16, [1, 8, 1, 2], 1], ["SP", 2, 25, 512, [2, 4], 1], ["RE", 2, [0, 5, 10, 15, 20, 1, 6, 11, 16, 21, 2, 7, 12, 17, 22, 25, 26, 3, 8, 13, 18, 23, 27, 4, 9, 14, 19, 24]], ["FSP", 3, 0, 3, 3], ["FSP", 3, 4, 4, 3], ["FSP", 3, 8, 5, 3], ["FSP", 3, 12, 6, 3], ["FSP", 3, 16, 7, 3], ["RE", 3, [0, 4, 8, 12, 16, 1, 5, 9, 13, 17, 2, 6, 10, 14, 18, 3, 7, 11, 15, 19]], ["CA", 2, 3, 14], ["CHR", 1, "shared", [2]], ["CA", 2, 3, 15], ["CHR", 0, "shared", [3]], ["CA", 1, 4, 15], ["FU", 10, [0, 1, 2, 3, 4]], ["SP", 10, 0, 802816, [32], 1], ["AN", 10, 0, 5], ["AN", 10, 1, 6], ["FU", 5, [0, 1, 2, 3, 4]], ["AN", 5, 0, 5], ["FU", 5, [1, 2, 3, 4, 5]], ["AN", 5, 1, 4], ["FU", 5, [2, 3, 4, 5, 6]], ["AN", 5, 2, 6], ["FU", 3, [0, 1, 2]], ["SP", 3, 0, 128, [1], 1], ["AN", 3, 1, 2], ["FFSP", 3, 0, [7, 6, 5, 4, 3], 1, 1], ["AN", 3, 1, 6], ["FU", 1, [0, 1, 2, 3]], ["SP", 1, 0, 72, [36], 1], ["AN", 1, 1, 2], ["FFSP", 1, 0, [7, 6, 5, 4, 3], 1, 1], ["AN", 1, 1, 6], ["PR", 4, 0, "auto_unroll_max_step$1024"]]]], "r": [[0.000342546, 0.000342551, 0.000342554, 0.000342574, 0.000342602, 0.000342536, 0.000342552, 0.000342535, 0.000342538, 0.000342533], 0, 5.59215, 1654017836], "v": "v0.6"}
{"i": [["[\"fused_conv1x1_bn_relu_stride\", 1, 28, 28, 512, 16, 64, 2]", "cuda -keys=cuda,gpu -max_num_threads=1024 -model=unknown -thread_warp_size=32", [-1, 16, 64, 49152, 2147483647, 1024, 8, 32], "", 0, []], [[], [["CI", 6], ["CI", 4], ["CHW", 2, "local"], ["SP", 2, 0, 1, [1, 1, 1, 1], 1], ["SP", 2, 5, 64, [1, 4, 1, 2], 1], ["SP", 2, 10, 14, [1, 1, 1, 1], 1], ["SP", 2, 15, 14, [1, 7, 1, 1], 1], ["SP", 2, 20, 16, [4, 2, 2, 1], 1], ["SP", 2, 25, 512, [4, 4], 1], ["RE", 2, [0, 5, 10, 15, 20, 1, 6, 11, 16, 21, 2, 7, 12, 17, 22, 25, 26, 3, 8, 13, 18, 23, 27, 4, 9, 14, 19, 24]], ["FSP", 3, 0, 3, 3], ["FSP", 3, 4, 4, 3], ["FSP", 3, 8, 5, 3], ["FSP", 3, 12, 6, 3], ["FSP", 3, 16, 7, 3], ["RE", 3, [0, 4, 8, 12, 16, 1, 5, 9, 13, 17, 2, 6, 10, 14, 18, 3, 7, 11, 15, 19]], ["CA", 2, 3, 14], ["CHR", 1, "shared", [2]], ["CA", 2, 3, 15], ["CHR", 0, "shared", [3]], ["CA", 1, 4, 15], ["FU", 10, [0, 1, 2, 3, 4]], ["SP", 10, 0, 802816, [64], 1], ["AN", 10, 0, 5], ["AN", 10, 1, 6], ["FU", 5, [0, 1, 2, 3, 4]], ["AN", 5, 0, 5], ["FU", 5, [1, 2, 3, 4, 5]], ["AN", 5, 1, 4], ["FU", 5, [2, 3, 4, 5, 6]], ["AN", 5, 2, 6], ["FU", 3, [0, 1, 2]], ["SP", 3, 0, 64, [1], 1], ["AN", 3, 1, 2], ["FFSP", 3, 0, [7, 6, 5, 4, 3], 1, 1], ["AN", 3, 1, 6], ["FU", 1, [0, 1, 2, 3]], ["SP", 1, 0, 16, [1], 1], ["AN", 1, 1, 2], ["FFSP", 1, 0, [7, 6, 5, 4, 3], 1, 1], ["AN", 1, 1, 6], ["PR", 4, 0, "auto_unroll_max_step$64"]]]], "r": [[0.000108876, 0.000108877, 0.000108868, 0.000108883, 0.000108877, 0.000108884, 0.000108887, 0.000108896, 0.000108894, 0.000108891], 0, 50.1105, 1654017882], "v": "v0.6"}
{"i": [["[\"fused_conv1x1_bn_relu_stride\", 1, 28, 28, 512, 16, 64, 2]", "cuda -keys=cuda,gpu -max_num_threads=1024 -model=unknown -thread_warp_size=32", [-1, 16, 64, 49152, 2147483647, 1024, 8, 32], "", 0, []], [[], [["CI", 6], ["CI", 4], ["CHW", 2, "local"], ["SP", 2, 0, 1, [1, 1, 1, 1], 1], ["SP", 2, 5, 64, [2, 2, 1, 16], 1], ["SP", 2, 10, 14, [1, 7, 1, 2], 1], ["SP", 2, 15, 14, [1, 7, 1, 1], 1], ["SP", 2, 20, 16, [1, 1, 1, 2], 1], ["SP", 2, 25, 512, [8, 1], 1], ["RE", 2, [0, 5, 10, 15, 20, 1, 6, 11, 16, 21, 2, 7, 12, 17, 22, 25, 26, 3, 8, 13, 18, 23, 27, 4, 9, 14, 19, 24]], ["FSP", 3, 0, 3, 3], ["FSP", 3, 4, 4, 3], ["FSP", 3, 8, 5, 3], ["FSP", 3, 12, 6, 3], ["FSP", 3, 16, 7, 3], ["RE", 3, [0, 4, 8, 12, 16, 1, 5, 9, 13, 17, 2, 6, 10, 14, 18, 3, 7, 11, 15, 19]], ["CA", 2, 3, 14], ["CHR", 1, "shared", [2]], ["CA", 2, 3, 15], ["CHR", 0, "shared", [3]], ["CA", 1, 4, 15], ["FU", 10, [0, 1, 2, 3, 4]], ["SP", 10, 0, 802816, [32], 1], ["AN", 10, 0, 5], ["AN", 10, 1, 6], ["FU", 5, [0, 1, 2, 3, 4]], ["AN", 5, 0, 5], ["FU", 5, [1, 2, 3, 4, 5]], ["AN", 5, 1, 4], ["FU", 5, [2, 3, 4, 5, 6]], ["AN", 5, 2, 6], ["FU", 3, [0, 1, 2]], ["SP", 3, 0, 512, [1], 1], ["AN", 3, 1, 2], ["FFSP", 3, 0, [7, 6, 5, 4, 3], 1, 1], ["AN", 3, 1, 6], ["FU", 1, [0, 1, 2, 3]], ["SP", 1, 0, 48, [1], 1], ["AN", 1, 1, 2], ["FFSP", 1, 0, [7, 6, 5, 4, 3], 1, 1], ["AN", 1, 1, 6], ["PR", 4, 0, "auto_unroll_max_step$0"]]]], "r": [[0.00076581, 0.000765821, 0.000765844, 0.000765901, 0.000765828, 0.000765814, 0.000765821, 0.000765823, 0.000765809, 0.000765819], 0, 33.1255, 1654017865], "v": "v0.6"}
{"i": [["[\"fused_conv1x1_bn_relu_stride\", 1, 28, 28, 512, 16, 64, 2]", "cuda -keys=cuda,gpu -max_num_threads=1024 -model=unknown -thread_warp_size=32", [-1, 16, 64, 49152, 2147483647, 1024, 8, 32], "", 0, []], [[], [["CI", 6], ["CI", 4], ["CHW", 2, "local"], ["SP", 2, 0, 1, [1, 1, 1, 1], 1], ["SP", 2, 5, 64, [2, 4, 2, 1], 1], ["SP", 2, 10, 14, [2, 1, 1, 1], 1], ["SP", 2, 15, 14, [1, 1, 1, 1], 1], ["SP", 2, 20, 16, [1, 4, 2, 1], 1], ["SP", 2, 25, 512, [8, 4], 1], ["RE", 2, [0, 5, 10, 15, 20, 1, 6, 11, 16, 21, 2, 7, 12, 17, 22, 25, 26, 3, 8, 13, 18, 23, 27, 4, 9, 14, 19, 24]], ["FSP", 3, 0, 3, 3], ["FSP", 3, 4, 4, 3], ["FSP", 3, 8, 5, 3], ["FSP", 3, 12, 6, 3], ["FSP", 3, 16, 7, 3], ["RE", 3, [0, 4, 8, 12, 16, 1, 5, 9, 13, 17, 2, 6, 10, 14, 18, 3, 7, 11, 15, 19]], ["CA", 2, 3, 14], ["CHR", 1, "shared", [2]], ["CA", 2, 3, 15], ["CHR", 0, "shared", [3]], ["CA", 1, 4, 15], ["FU", 10, [0, 1, 2, 3, 4]], ["SP", 10, 0, 802816, [32], 1], ["AN", 10, 0, 5], ["AN", 10, 1, 6], ["FU", 5, [0, 1, 2, 3, 4]], ["AN", 5, 0, 5], ["FU", 5, [1, 2, 3, 4, 5]], ["AN", 5, 1, 4], ["FU", 5, [2, 3, 4, 5, 6]], ["AN", 5, 2, 6], ["FU", 3, [0, 1, 2]], ["SP", 3, 0, 128, [1], 1], ["AN", 3, 1, 2], ["FFSP", 3, 0, [7, 6, 5, 4, 3], 1, 1], ["AN", 3, 1, 6], ["FU", 1, [0, 1, 2, 3]], ["SP", 1, 0, 32, [1], 1], ["AN", 1, 1, 2], ["FFSP", 1, 0, [7, 6, 5, 4, 3], 1, 1], ["AN", 1, 1, 6], ["PR", 4, 0, "auto_unroll_max_step$64"]]]], "r": [[0.000214297, 0.000214323, 0.000214393, 0.000214425, 0.000214388, 0.00021435, 0.00021435, 0.000214416, 0.000214478, 0.000214428], 0, 44.2378, 1654017876], "v": "v0.6"}
{"i": [["[\"fused_conv1x1_bn_relu_stride\", 1, 28, 28, 512, 16, 64, 2]", "cuda -keys=cuda,gpu -max_num_threads=1024 -model=unknown -thread_warp_size=32", [-1, 16, 64, 49152, 2147483647, 1024, 8, 32], "", 0, []], [[], [["CI", 6], ["CI", 4], ["CHW", 2, "local"], ["SP", 2, 0, 1, [1, 1, 1, 1], 1], ["SP", 2, 5, 64, [2, 4, 2, 4], 1], ["SP", 2, 10, 14, [2, 7, 1, 1], 1], ["SP", 2, 15, 14, [1, 7, 1, 1], 1], ["SP", 2, 20, 16, [2, 1, 4, 2], 1], ["SP", 2, 25, 512, [2, 4], 1], ["RE", 2, [0, 5, 10, 15, 20, 1, 6, 11, 16, 21, 2, 7, 12, 17, 22, 25, 26, 3, 8, 13, 18, 23, 27, 4, 9, 14, 19, 24]], ["FSP", 3, 0, 3, 3], ["FSP", 3, 4, 4, 3], ["FSP", 3, 8, 5, 3], ["FSP", 3, 12, 6, 3], ["FSP", 3, 16, 7, 3], ["RE", 3, [0, 4, 8, 12, 16, 1, 5, 9, 13, 17, 2, 6, 10, 14, 18, 3, 7, 11, 15, 19]], ["CA", 2, 3, 14], ["CHR", 1, "shared", [2]], ["CA", 2, 3, 15], ["CHR", 0, "shared", [3]], ["CA", 1, 4, 15], ["FU", 10, [0, 1, 2, 3, 4]], ["SP", 10, 0, 802816, [64], 1], ["AN", 10, 0, 5], ["AN", 10, 1, 6], ["FU", 5, [0, 1, 2, 3, 4]], ["AN", 5, 0, 5], ["FU", 5, [1, 2, 3, 4, 5]], ["AN", 5, 1, 4], ["FU", 5, [2, 3, 4, 5, 6]], ["AN", 5, 2, 6], ["FU", 3, [0, 1, 2]], ["SP", 3, 0, 512, [32], 1], ["AN", 3, 1, 2], ["FFSP", 3, 0, [7, 6, 5, 4, 3], 1, 1], ["AN", 3, 1, 6], ["FU", 1, [0, 1, 2, 3]], ["SP", 1, 0, 24, [1], 1], ["AN", 1, 1, 2], ["FFSP", 1, 0, [7, 6, 5, 4, 3], 1, 1], ["AN", 1, 1, 6], ["PR", 4, 0, "auto_unroll_max_step$16"]]]], "r": [[0.00260884, 0.00260885, 0.00260887, 0.0026087, 0.00260899, 0.00260885, 0.00260872, 0.00260871, 0.00260885, 0.00260888], 0, 18.8909, 1654017849], "v": "v0.6"}
{"i": [["[\"fused_conv1x1_bn_relu_stride\", 1, 28, 28, 512, 16, 64, 2]", "cuda -keys=cuda,gpu -max_num_threads=1024 -model=unknown -thread_warp_size=32", [-1, 16, 64, 49152, 2147483647, 1024, 8, 32], "", 0, []], [[], [["CI", 6], ["CI", 4], ["CHW", 2, "local"], ["SP", 2, 0, 1, [1, 1, 1, 1], 1], ["SP", 2, 5, 64, [1, 8, 1, 2], 1], ["SP", 2, 10, 14, [1, 7, 2, 1], 1], ["SP", 2, 15, 14, [2, 1, 1, 1], 1], ["SP", 2, 20, 16, [1, 8, 2, 1], 1], ["SP", 2, 25, 512, [1, 8], 1], ["RE", 2, [0, 5, 10, 15, 20, 1, 6, 11, 16, 21, 2, 7, 12, 17, 22, 25, 26, 3, 8, 13, 18, 23, 27, 4, 9, 14, 19, 24]], ["FSP", 3, 0, 3, 3], ["FSP", 3, 4, 4, 3], ["FSP", 3, 8, 5, 3], ["FSP", 3, 12, 6, 3], ["FSP", 3, 16, 7, 3], ["RE", 3, [0, 4, 8, 12, 16, 1, 5, 9, 13, 17, 2, 6, 10, 14, 18, 3, 7, 11, 15, 19]], ["CA", 2, 3, 14], ["CHR", 1, "shared", [2]], ["CA", 2, 3, 15], ["CHR", 0, "shared", [3]], ["CA", 1, 4, 15], ["FU", 10, [0, 1, 2, 3, 4]], ["SP", 10, 0, 802816, [32], 1], ["AN", 10, 0, 5], ["AN", 10, 1, 6], ["FU", 5, [0, 1, 2, 3, 4]], ["AN", 5, 0, 5], ["FU", 5, [1, 2, 3, 4, 5]], ["AN", 5, 1, 4], ["FU", 5, [2, 3, 4, 5, 6]], ["AN", 5, 2, 6], ["FU", 3, [0, 1, 2]], ["SP", 3, 0, 32, [8], 1], ["AN", 3, 1, 2], ["FFSP", 3, 0, [7, 6, 5, 4, 3], 1, 1], ["AN", 3, 1, 6], ["FU", 1, [0, 1, 2, 3]], ["SP", 1, 0, 24, [1], 1], ["AN", 1, 1, 2], ["FFSP", 1, 0, [7, 6, 5, 4, 3], 1, 1], ["AN", 1, 1, 6], ["PR", 4, 0, "auto_unroll_max_step$16"]]]], "r": [[0.000151041, 0.000151029, 0.000151047, 0.000151052, 0.000151037, 0.000151044, 0.000151043, 0.000151054, 0.000151038, 0.000151042], 0, 55.3656, 1654017887], "v": "v0.6"}
{"i": [["[\"fused_conv1x1_bn_relu_stride\", 1, 28, 28, 512, 16, 64, 2]", "cuda -keys=cuda,gpu -max_num_threads=1024 -model=unknown -thread_warp_size=32", [-1, 16, 64, 49152, 2147483647, 1024, 8, 32], "", 0, []], [[], [["CI", 6], ["CI", 4], ["CHW", 2, "local"], ["SP", 2, 0, 1, [1, 1, 1, 1], 1], ["SP", 2, 5, 64, [1, 16, 1, 1], 1], ["SP", 2, 10, 14, [7, 1, 2, 1], 1], ["SP", 2, 15, 14, [1, 7, 1, 1], 1], ["SP", 2, 20, 16, [1, 1, 1, 16], 1], ["SP", 2, 25, 512, [2, 2], 1], ["RE", 2, [0, 5, 10, 15, 20, 1, 6, 11, 16, 21, 2, 7, 12, 17, 22, 25, 26, 3, 8, 13, 18, 23, 27, 4, 9, 14, 19, 24]], ["FSP", 3, 0, 3, 3], ["FSP", 3, 4, 4, 3], ["FSP", 3, 8, 5, 3], ["FSP", 3, 12, 6, 3], ["FSP", 3, 16, 7, 3], ["RE", 3, [0, 4, 8, 12, 16, 1, 5, 9, 13, 17, 2, 6, 10, 14, 18, 3, 7, 11, 15, 19]], ["CA", 2, 3, 14], ["CHR", 1, "shared", [2]], ["CA", 2, 3, 15], ["CHR", 0, "shared", [3]], ["CA", 1, 4, 15], ["FU", 10, [0, 1, 2, 3, 4]], ["SP", 10, 0, 802816, [32], 1], ["AN", 10, 0, 5], ["AN", 10, 1, 6], ["FU", 5, [0, 1, 2, 3, 4]], ["AN", 5, 0, 5], ["FU", 5, [1, 2, 3, 4, 5]], ["AN", 5, 1, 4], ["FU", 5, [2, 3, 4, 5, 6]], ["AN", 5, 2, 6], ["FU", 3, [0, 1, 2]], ["SP", 3, 0, 64, [1], 1], ["AN", 3, 1, 2], ["FFSP", 3, 0, [7, 6, 5, 4, 3], 1, 1], ["AN", 3, 1, 6], ["FU", 1, [0, 1, 2, 3]], ["SP", 1, 0, 12, [2], 1], ["AN", 1, 1, 2], ["FFSP", 1, 0, [7, 6, 5, 4, 3], 1, 1], ["AN", 1, 1, 6], ["PR", 4, 0, "auto_unroll_max_step$512"]]]], "r": [[0.000451826, 0.000451861, 0.00045186, 0.000451873, 0.000451844, 0.000451852, 0.000451828, 0.000451834, 0.000451821, 0.000451798], 0, 39.8352, 1654017870], "v": "v0.6"}
{"i": [["[\"fused_conv1x1_bn_relu_stride\", 1, 28, 28, 512, 16, 64, 2]", "cuda -keys=cuda,gpu -max_num_threads=1024 -model=unknown -thread_warp_size=32", [-1, 16, 64, 49152, 2147483647, 1024, 8, 32], "", 0, []], [[], [["CI", 6], ["CI", 4], ["CHW", 2, "local"], ["SP", 2, 0, 1, [1, 1, 1, 1], 1], ["SP", 2, 5, 64, [2, 4, 2, 2], 1], ["SP", 2, 10, 14, [1, 7, 1, 1], 1], ["SP", 2, 15, 14, [1, 14, 1, 1], 1], ["SP", 2, 20, 16, [1, 2, 2, 4], 1], ["SP", 2, 25, 512, [4, 2], 1], ["RE", 2, [0, 5, 10, 15, 20, 1, 6, 11, 16, 21, 2, 7, 12, 17, 22, 25, 26, 3, 8, 13, 18, 23, 27, 4, 9, 14, 19, 24]], ["FSP", 3, 0, 3, 3], ["FSP", 3, 4, 4, 3], ["FSP", 3, 8, 5, 3], ["FSP", 3, 12, 6, 3], ["FSP", 3, 16, 7, 3], ["RE", 3, [0, 4, 8, 12, 16, 1, 5, 9, 13, 17, 2, 6, 10, 14, 18, 3, 7, 11, 15, 19]], ["CA", 2, 3, 14], ["CHR", 1, "shared", [2]], ["CA", 2, 3, 15], ["CHR", 0, "shared", [3]], ["CA", 1, 4, 15], ["FU", 10, [0, 1, 2, 3, 4]], ["SP", 10, 0, 802816, [32], 1], ["AN", 10, 0, 5], ["AN", 10, 1, 6], ["FU", 5, [0, 1, 2, 3, 4]], ["AN", 5, 0, 5], ["FU", 5, [1, 2, 3, 4, 5]], ["AN", 5, 1, 4], ["FU", 5, [2, 3, 4, 5, 6]], ["AN", 5, 2, 6], ["FU", 3, [0, 1, 2]], ["SP", 3, 0, 256, [1], 1], ["AN", 3, 1, 2], ["FFSP", 3, 0, [7, 6, 5, 4, 3], 1, 1], ["AN", 3, 1, 6], ["FU", 1, [0, 1, 2, 3]], ["SP", 1, 0, 8, [1], 1], ["AN", 1, 1, 2], ["FFSP", 1, 0, [7, 6, 5, 4, 3], 1, 1], ["AN", 1, 1, 6], ["PR", 4, 0, "auto_unroll_max_step$512"]]]], "r": [[0.00127747, 0.00127754, 0.0012775, 0.00127751, 0.00127756, 0.00127753, 0.00127758, 0.00127749, 0.00127747, 0.00127749], 0, 60.9668, 1654017891], "v": "v0.6"}
{"i": [["[\"fused_conv1x1_bn_relu_stride\", 1, 28, 28, 512, 16, 64, 2]", "cuda -keys=cuda,gpu -max_num_threads=1024 -model=unknown -thread_warp_size=32", [-1, 16, 64, 49152, 2147483647, 1024, 8, 32], "", 0, []], [[], [["CI", 6], ["CI", 4], ["CHW", 2, "local"], ["SP", 2, 0, 1, [1, 1, 1, 1], 1], ["SP", 2, 5, 64, [1, 2, 2, 8], 1], ["SP", 2, 10, 14, [1, 7, 2, 1], 1], ["SP", 2, 15, 14, [1, 1, 1, 7], 1], ["SP", 2, 20, 16, [4, 1, 1, 1], 1], ["SP", 2, 25, 512, [1, 4], 1], ["RE", 2, [0, 5, 10, 15, 20, 1, 6, 11, 16, 21, 2, 7, 12, 17, 22, 25, 26, 3, 8, 13, 18, 23, 27, 4, 9, 14, 19, 24]], ["FSP", 3, 0, 3, 3], ["FSP", 3, 4, 4, 3], ["FSP", 3, 8, 5, 3], ["FSP", 3, 12, 6, 3], ["FSP", 3, 16, 7, 3], ["RE", 3, [0, 4, 8, 12, 16, 1, 5, 9, 13, 17, 2, 6, 10, 14, 18, 3, 7, 11, 15, 19]], ["CA", 2, 3, 14], ["CHR", 1, "shared", [2]], ["CA", 2, 3, 15], ["CHR", 0, "shared", [3]], ["CA", 1, 4, 15], ["FU", 10, [0, 1, 2, 3, 4]], ["SP", 10, 0, 802816, [32], 1], ["AN", 10, 0, 5], ["AN", 10, 1, 6], ["FU", 5, [0, 1, 2, 3, 4]], ["AN", 5, 0, 5], ["FU", 5, [1, 2, 3, 4, 5]], ["AN", 5, 1, 4], ["FU", 5, [2, 3, 4, 5, 6]], ["AN", 5, 2, 6], ["FU", 3, [0, 1, 2]], ["SP", 3, 0, 256, [1], 1], ["AN", 3, 1, 2], ["FFSP", 3, 0, [7, 6, 5, 4, 3], 1, 1], ["AN", 3, 1, 6], ["FU", 1, [0, 1, 2, 3]], ["SP", 1, 0, 624, [1], 1], ["AN", 1, 1, 2], ["FFSP", 1, 0, [7, 6, 5, 4, 3], 1, 1], ["AN", 1, 1, 6], ["PR", 4, 0, "auto_unroll_max_step$512"]]]], "r": [[0.00216187, 0.00216124, 0.00216163, 0.00216184, 0.00216221, 0.00216227, 0.00216217, 0.00216194, 0.00216193, 0.00216226], 0, 24.8106, 1654017853], "v": "v0.6"}
{"i": [["[\"fused_conv1x1_bn_relu_stride\", 1, 28, 28, 512, 16, 64, 2]", "cuda -keys=cuda,gpu -max_num_threads=1024 -model=unknown -thread_warp_size=32", [-1, 16, 64, 49152, 2147483647, 1024, 8, 32], "", 0, []], [[], [["CI", 6], ["CI", 4], ["CHW", 2, "local"], ["SP", 2, 0, 1, [1, 1, 1, 1], 1], ["SP", 2, 5, 64, [1, 16, 2, 1], 1], ["SP", 2, 10, 14, [1, 1, 1, 14], 1], ["SP", 2, 15, 14, [1, 7, 1, 1], 1], ["SP", 2, 20, 16, [4, 2, 1, 1], 1], ["SP", 2, 25, 512, [2, 4], 1], ["RE", 2, [0, 5, 10, 15, 20, 1, 6, 11, 16, 21, 2, 7, 12, 17, 22, 25, 26, 3, 8, 13, 18, 23, 27, 4, 9, 14, 19, 24]], ["FSP", 3, 0, 3, 3], ["FSP", 3, 4, 4, 3], ["FSP", 3, 8, 5, 3], ["FSP", 3, 12, 6, 3], ["FSP", 3, 16, 7, 3], ["RE", 3, [0, 4, 8, 12, 16, 1, 5, 9, 13, 17, 2, 6, 10, 14, 18, 3, 7, 11, 15, 19]], ["CA", 2, 3, 14], ["CHR", 1, "shared", [2]], ["CA", 2, 3, 15], ["CHR", 0, "shared", [3]], ["CA", 1, 4, 15], ["FU", 10, [0, 1, 2, 3, 4]], ["SP", 10, 0, 802816, [32], 1], ["AN", 10, 0, 5], ["AN", 10, 1, 6], ["FU", 5, [0, 1, 2, 3, 4]], ["AN", 5, 0, 5], ["FU", 5, [1, 2, 3, 4, 5]], ["AN", 5, 1, 4], ["FU", 5, [2, 3, 4, 5, 6]], ["AN", 5, 2, 6], ["FU", 3, [0, 1, 2]], ["SP", 3, 0, 8, [1], 1], ["AN", 3, 1, 2], ["FFSP", 3, 0, [7, 6, 5, 4, 3], 1, 1], ["AN", 3, 1, 6], ["FU", 1, [0, 1, 2, 3]], ["SP", 1, 0, 648, [1], 1], ["AN", 1, 1, 2], ["FFSP", 1, 0, [7, 6, 5, 4, 3], 1, 1], ["AN", 1, 1, 6], ["PR", 4, 0, "auto_unroll_max_step$1024"]]]], "r": [[0.000281233, 0.000281242, 0.00028123, 0.000281239, 0.00028123, 0.000281234, 0.00028124, 0.000281226, 0.000281235, 0.000281237], 0, 66.5239, 1654017896], "v": "v0.6"}
{"i": [["[\"fused_conv1x1_bn_relu_stride\", 1, 28, 28, 512, 16, 64, 2]", "cuda -keys=cuda,gpu -max_num_threads=1024 -model=unknown -thread_warp_size=32", [-1, 16, 64, 49152, 2147483647, 1024, 8, 32], "", 0, []], [[], [["CI", 6], ["CI", 4], ["CHW", 2, "local"], ["SP", 2, 0, 1, [1, 1, 1, 1], 1], ["SP", 2, 5, 64, [1, 1, 1, 8], 1], ["SP", 2, 10, 14, [1, 1, 2, 7], 1], ["SP", 2, 15, 14, [1, 14, 1, 1], 1], ["SP", 2, 20, 16, [2, 8, 1, 1], 1], ["SP", 2, 25, 512, [8, 1], 1], ["RE", 2, [0, 5, 10, 15, 20, 1, 6, 11, 16, 21, 2, 7, 12, 17, 22, 25, 26, 3, 8, 13, 18, 23, 27, 4, 9, 14, 19, 24]], ["FSP", 3, 0, 3, 3], ["FSP", 3, 4, 4, 3], ["FSP", 3, 8, 5, 3], ["FSP", 3, 12, 6, 3], ["FSP", 3, 16, 7, 3], ["RE", 3, [0, 4, 8, 12, 16, 1, 5, 9, 13, 17, 2, 6, 10, 14, 18, 3, 7, 11, 15, 19]], ["CA", 2, 3, 14], ["CHR", 1, "shared", [2]], ["CA", 2, 3, 15], ["CHR", 0, "shared", [3]], ["CA", 1, 4, 15], ["FU", 10, [0, 1, 2, 3, 4]], ["SP", 10, 0, 802816, [32], 1], ["AN", 10, 0, 5], ["AN", 10, 1, 6], ["FU", 5, [0, 1, 2, 3, 4]], ["AN", 5, 0, 5], ["FU", 5, [1, 2, 3, 4, 5]], ["AN", 5, 1, 4], ["FU", 5, [2, 3, 4, 5, 6]], ["AN", 5, 2, 6], ["FU", 3, [0, 1, 2]], ["SP", 3, 0, 64, [1], 1], ["AN", 3, 1, 2], ["FFSP", 3, 0, [7, 6, 5, 4, 3], 1, 1], ["AN", 3, 1, 6], ["FU", 1, [0, 1, 2, 3]], ["SP", 1, 0, 216, [1], 1], ["AN", 1, 1, 2], ["FFSP", 1, 0, [7, 6, 5, 4, 3], 1, 1], ["AN", 1, 1, 6], ["PR", 4, 0, "auto_unroll_max_step$1024"]]]], "r": [[0.000358404, 0.000358408, 0.000358399, 0.00035843, 0.000358406, 0.000358413, 0.000358388, 0.000358397, 0.0003584, 0.000358397], 0, 71.205, 1654017902], "v": "v0.6"}
{"i": [["[\"fused_conv1x1_bn_relu_stride\", 1, 28, 28, 512, 16, 64, 2]", "cuda -keys=cuda,gpu -max_num_threads=1024 -model=unknown -thread_warp_size=32", [-1, 16, 64, 49152, 2147483647, 1024, 8, 32], "", 0, []], [[], [["CI", 6], ["CI", 4], ["CHW", 2, "local"], ["SP", 2, 0, 1, [1, 1, 1, 1], 1], ["SP", 2, 5, 64, [1, 8, 1, 8], 1], ["SP", 2, 10, 14, [1, 7, 2, 1], 1], ["SP", 2, 15, 14, [1, 1, 14, 1], 1], ["SP", 2, 20, 16, [4, 4, 1, 1], 1], ["SP", 2, 25, 512, [2, 1], 1], ["RE", 2, [0, 5, 10, 15, 20, 1, 6, 11, 16, 21, 2, 7, 12, 17, 22, 25, 26, 3, 8, 13, 18, 23, 27, 4, 9, 14, 19, 24]], ["FSP", 3, 0, 3, 3], ["FSP", 3, 4, 4, 3], ["FSP", 3, 8, 5, 3], ["FSP", 3, 12, 6, 3], ["FSP", 3, 16, 7, 3], ["RE", 3, [0, 4, 8, 12, 16, 1, 5, 9, 13, 17, 2, 6, 10, 14, 18, 3, 7, 11, 15, 19]], ["CA", 2, 3, 14], ["CHR", 1, "shared", [2]], ["CA", 2, 3, 15], ["CHR", 0, "shared", [3]], ["CA", 1, 4, 15], ["FU", 10, [0, 1, 2, 3, 4]], ["SP", 10, 0, 802816, [8], 1], ["AN", 10, 0, 5], ["AN", 10, 1, 6], ["FU", 5, [0, 1, 2, 3, 4]], ["AN", 5, 0, 5], ["FU", 5, [1, 2, 3, 4, 5]], ["AN", 5, 1, 4], ["FU", 5, [2, 3, 4, 5, 6]], ["AN", 5, 2, 6], ["FU", 3, [0, 1, 2]], ["SP", 3, 0, 4, [1], 1], ["AN", 3, 1, 2], ["FFSP", 3, 0, [7, 6, 5, 4, 3], 1, 1], ["AN", 3, 1, 6], ["FU", 1, [0, 1, 2, 3]], ["SP", 1, 0, 162, [1], 1], ["AN", 1, 1, 2], ["FFSP", 1, 0, [7, 6, 5, 4, 3], 1, 1], ["AN", 1, 1, 6], ["PR", 4, 0, "auto_unroll_max_step$512"]]]], "r": [[0.0122122, 0.0122132, 0.0122132, 0.012213, 0.0122133, 0.0122144, 0.0122135, 0.0122124, 0.0122115, 0.0122131], 0, 77.6166, 1654017906], "v": "v0.6"}
{"i": [["[\"fused_conv1x1_bn_relu_stride\", 1, 28, 28, 512, 16, 64, 2]", "cuda -keys=cuda,gpu -max_num_threads=1024 -model=unknown -thread_warp_size=32", [-1, 16, 64, 49152, 2147483647, 1024, 8, 32], "", 0, []], [[], [["CI", 6], ["CI", 4], ["CHW", 2, "local"], ["SP", 2, 0, 1, [1, 1, 1, 1], 1], ["SP", 2, 5, 64, [1, 1, 1, 8], 1], ["SP", 2, 10, 14, [1, 1, 2, 7], 1], ["SP", 2, 15, 14, [1, 14, 1, 1], 1], ["SP", 2, 20, 16, [1, 8, 2, 1], 1], ["SP", 2, 25, 512, [1, 2], 1], ["RE", 2, [0, 5, 10, 15, 20, 1, 6, 11, 16, 21, 2, 7, 12, 17, 22, 25, 26, 3, 8, 13, 18, 23, 27, 4, 9, 14, 19, 24]], ["FSP", 3, 0, 3, 3], ["FSP", 3, 4, 4, 3], ["FSP", 3, 8, 5, 3], ["FSP", 3, 12, 6, 3], ["FSP", 3, 16, 7, 3], ["RE", 3, [0, 4, 8, 12, 16, 1, 5, 9, 13, 17, 2, 6, 10, 14, 18, 3, 7, 11, 15, 19]], ["CA", 2, 3, 14], ["CHR", 1, "shared", [2]], ["CA", 2, 3, 15], ["CHR", 0, "shared", [3]], ["CA", 1, 4, 15], ["FU", 10, [0, 1, 2, 3, 4]], ["SP", 10, 0, 802816, [32], 1], ["AN", 10, 0, 5], ["AN", 10, 1, 6], ["FU", 5, [0, 1, 2, 3, 4]], ["AN", 5, 0, 5], ["FU", 5, [1, 2, 3, 4, 5]], ["AN", 5, 1, 4], ["FU", 5, [2, 3, 4, 5, 6]], ["AN", 5, 2, 6], ["FU", 3, [0, 1, 2]], ["SP", 3, 0, 64, [1], 1], ["AN", 3, 1, 2], ["FFSP", 3, 0, [7, 6, 5, 4, 3], 1, 1], ["AN", 3, 1, 6], ["FU", 1, [0, 1, 2, 3]], ["SP", 1, 0, 216, [1], 1], ["AN", 1, 1, 2], ["FFSP", 1, 0, [7, 6, 5, 4, 3], 1, 1], ["AN", 1, 1, 6], ["PR", 4, 0, "auto_unroll_max_step$1024"]]]], "r": [[0.000470496, 0.000470515, 0.000470521, 0.000470567, 0.000470494, 0.000470501, 0.000470496, 0.000470516, 0.00047051, 0.000470485], 0, 80.7315, 1654017912], "v": "v0.6"}
{"i": [["[\"fused_conv1x1_bn_relu_stride\", 1, 28, 28, 512, 16, 64, 2]", "cuda -keys=cuda,gpu -max_num_threads=1024 -model=unknown -thread_warp_size=32", [-1, 16, 64, 49152, 2147483647, 1024, 8, 32], "", 0, []], [[], [["CI", 6], ["CI", 4], ["CHW", 2, "local"], ["SP", 2, 0, 1, [1, 1, 1, 1], 1], ["SP", 2, 5, 64, [1, 4, 1, 1], 1], ["SP", 2, 10, 14, [1, 1, 14, 1], 1], ["SP", 2, 15, 14, [1, 1, 1, 1], 1], ["SP", 2, 20, 16, [1, 2, 2, 2], 1], ["SP", 2, 25, 512, [4, 4], 1], ["RE", 2, [0, 5, 10, 15, 20, 1, 6, 11, 16, 21, 2, 7, 12, 17, 22, 25, 26, 3, 8, 13, 18, 23, 27, 4, 9, 14, 19, 24]], ["FSP", 3, 0, 3, 3], ["FSP", 3, 4, 4, 3], ["FSP", 3, 8, 5, 3], ["FSP", 3, 12, 6, 3], ["FSP", 3, 16, 7, 3], ["RE", 3, [0, 4, 8, 12, 16, 1, 5, 9, 13, 17, 2, 6, 10, 14, 18, 3, 7, 11, 15, 19]], ["CA", 2, 3, 14], ["CHR", 1, "shared", [2]], ["CA", 2, 3, 15], ["CHR", 0, "shared", [3]], ["CA", 1, 4, 15], ["FU", 10, [0, 1, 2, 3, 4]], ["SP", 10, 0, 802816, [32], 1], ["AN", 10, 0, 5], ["AN", 10, 1, 6], ["FU", 5, [0, 1, 2, 3, 4]], ["AN", 5, 0, 5], ["FU", 5, [1, 2, 3, 4, 5]], ["AN", 5, 1, 4], ["FU", 5, [2, 3, 4, 5, 6]], ["AN", 5, 2, 6], ["FU", 3, [0, 1, 2]], ["SP", 3, 0, 64, [1], 1], ["AN", 3, 1, 2], ["FFSP", 3, 0, [7, 6, 5, 4, 3], 1, 1], ["AN", 3, 1, 6], ["FU", 1, [0, 1, 2, 3]], ["SP", 1, 0, 48, [1], 1], ["AN", 1, 1, 2], ["FFSP", 1, 0, [7, 6, 5, 4, 3], 1, 1], ["AN", 1, 1, 6], ["PR", 4, 0, "auto_unroll_max_step$16"]]]], "r": [[0.000157614, 0.000157615, 0.000157613, 0.000157613, 0.000157619, 0.00015761, 0.000157611, 0.000157616, 0.000157629, 0.000157625], 0, 101.059, 1654017933], "v": "v0.6"}
{"i": [["[\"fused_conv1x1_bn_relu_stride\", 1, 28, 28, 512, 16, 64, 2]", "cuda -keys=cuda,gpu -max_num_threads=1024 -model=unknown -thread_warp_size=32", [-1, 16, 64, 49152, 2147483647, 1024, 8, 32], "", 0, []], [[], [["CI", 6], ["CI", 4], ["CHW", 2, "local"], ["SP", 2, 0, 1, [1, 1, 1, 1], 1], ["SP", 2, 5, 64, [1, 1, 32, 2], 1], ["SP", 2, 10, 14, [14, 1, 1, 1], 1], ["SP", 2, 15, 14, [1, 7, 1, 1], 1], ["SP", 2, 20, 16, [1, 1, 2, 4], 1], ["SP", 2, 25, 512, [2, 4], 1], ["RE", 2, [0, 5, 10, 15, 20, 1, 6, 11, 16, 21, 2, 7, 12, 17, 22, 25, 26, 3, 8, 13, 18, 23, 27, 4, 9, 14, 19, 24]], ["FSP", 3, 0, 3, 3], ["FSP", 3, 4, 4, 3], ["FSP", 3, 8, 5, 3], ["FSP", 3, 12, 6, 3], ["FSP", 3, 16, 7, 3], ["RE", 3, [0, 4, 8, 12, 16, 1, 5, 9, 13, 17, 2, 6, 10, 14, 18, 3, 7, 11, 15, 19]], ["CA", 2, 3, 14], ["CHR", 1, "shared", [2]], ["CA", 2, 3, 15], ["CHR", 0, "shared", [3]], ["CA", 1, 4, 15], ["FU", 10, [0, 1, 2, 3, 4]], ["SP", 10, 0, 802816, [32], 1], ["AN", 10, 0, 5], ["AN", 10, 1, 6], ["FU", 5, [0, 1, 2, 3, 4]], ["AN", 5, 0, 5], ["FU", 5, [1, 2, 3, 4, 5]], ["AN", 5, 1, 4], ["FU", 5, [2, 3, 4, 5, 6]], ["AN", 5, 2, 6], ["FU", 3, [0, 1, 2]], ["SP", 3, 0, 4096, [4], 1], ["AN", 3, 1, 2], ["FFSP", 3, 0, [7, 6, 5, 4, 3], 1, 1], ["AN", 3, 1, 6], ["FU", 1, [0, 1, 2, 3]], ["SP", 1, 0, 8, [1], 1], ["AN", 1, 1, 2], ["FFSP", 1, 0, [7, 6, 5, 4, 3], 1, 1], ["AN", 1, 1, 6], ["PR", 4, 0, "auto_unroll_max_step$512"]]]], "r": [[0.0132521, 0.0132722, 0.0132681, 0.013245, 0.0132658, 0.0132612, 0.0132521, 0.01325, 0.0132547, 0.0132711], 0, 94.9833, 1654017922], "v": "v0.6"}
{"i": [["[\"fused_conv1x1_bn_relu_stride\", 1, 28, 28, 512, 16, 64, 2]", "cuda -keys=cuda,gpu -max_num_threads=1024 -model=unknown -thread_warp_size=32", [-1, 16, 64, 49152, 2147483647, 1024, 8, 32], "", 0, []], [[], [["CI", 6], ["CI", 4], ["CHW", 2, "local"], ["SP", 2, 0, 1, [1, 1, 1, 1], 1], ["SP", 2, 5, 64, [1, 4, 1, 2], 1], ["SP", 2, 10, 14, [1, 2, 1, 1], 1], ["SP", 2, 15, 14, [1, 1, 1, 2], 1], ["SP", 2, 20, 16, [1, 8, 2, 1], 1], ["SP", 2, 25, 512, [16, 2], 1], ["RE", 2, [0, 5, 10, 15, 20, 1, 6, 11, 16, 21, 2, 7, 12, 17, 22, 25, 26, 3, 8, 13, 18, 23, 27, 4, 9, 14, 19, 24]], ["FSP", 3, 0, 3, 3], ["FSP", 3, 4, 4, 3], ["FSP", 3, 8, 5, 3], ["FSP", 3, 12, 6, 3], ["FSP", 3, 16, 7, 3], ["RE", 3, [0, 4, 8, 12, 16, 1, 5, 9, 13, 17, 2, 6, 10, 14, 18, 3, 7, 11, 15, 19]], ["CA", 2, 3, 14], ["CHR", 1, "shared", [2]], ["CA", 2, 3, 15], ["CHR", 0, "shared", [3]], ["CA", 1, 4, 15], ["FU", 10, [0, 1, 2, 3, 4]], ["SP", 10, 0, 802816, [32], 1], ["AN", 10, 0, 5], ["AN", 10, 1, 6], ["FU", 5, [0, 1, 2, 3, 4]], ["AN", 5, 0, 5], ["FU", 5, [1, 2, 3, 4, 5]], ["AN", 5, 1, 4], ["FU", 5, [2, 3, 4, 5, 6]], ["AN", 5, 2, 6], ["FU", 3, [0, 1, 2]], ["SP", 3, 0, 128, [2], 1], ["AN", 3, 1, 2], ["FFSP", 3, 0, [7, 6, 5, 4, 3], 1, 1], ["AN", 3, 1, 6], ["FU", 1, [0, 1, 2, 3]], ["SP", 1, 0, 288, [1], 1], ["AN", 1, 1, 2], ["FFSP", 1, 0, [7, 6, 5, 4, 3], 1, 1], ["AN", 1, 1, 6], ["PR", 4, 0, "auto_unroll_max_step$1024"]]]], "r": [[7.17274e-05, 7.17211e-05, 7.17268e-05, 7.17256e-05, 7.17218e-05, 7.17261e-05, 7.17275e-05, 7.17254e-05, 7.17281e-05, 7.17223e-05], 0, 85.8493, 1654017917], "v": "v0.6"}
{"i": [["[\"fused_conv1x1_bn_relu_stride\", 1, 28, 28, 512, 16, 64, 2]", "cuda -keys=cuda,gpu -max_num_threads=1024 -model=unknown -thread_warp_size=32", [-1, 16, 64, 49152, 2147483647, 1024, 8, 32], "", 0, []], [[], [["CI", 6], ["CI", 4], ["CHW", 2, "local"], ["SP", 2, 0, 1, [1, 1, 1, 1], 1], ["SP", 2, 5, 64, [1, 16, 1, 1], 1], ["SP", 2, 10, 14, [1, 7, 2, 1], 1], ["SP", 2, 15, 14, [1, 7, 2, 1], 1], ["SP", 2, 20, 16, [1, 1, 2, 1], 1], ["SP", 2, 25, 512, [4, 4], 1], ["RE", 2, [0, 5, 10, 15, 20, 1, 6, 11, 16, 21, 2, 7, 12, 17, 22, 25, 26, 3, 8, 13, 18, 23, 27, 4, 9, 14, 19, 24]], ["FSP", 3, 0, 3, 3], ["FSP", 3, 4, 4, 3], ["FSP", 3, 8, 5, 3], ["FSP", 3, 12, 6, 3], ["FSP", 3, 16, 7, 3], ["RE", 3, [0, 4, 8, 12, 16, 1, 5, 9, 13, 17, 2, 6, 10, 14, 18, 3, 7, 11, 15, 19]], ["CA", 2, 3, 14], ["CHR", 1, "shared", [2]], ["CA", 2, 3, 15], ["CHR", 0, "shared", [3]], ["CA", 1, 4, 15], ["FU", 10, [0, 1, 2, 3, 4]], ["SP", 10, 0, 802816, [32], 1], ["AN", 10, 0, 5], ["AN", 10, 1, 6], ["FU", 5, [0, 1, 2, 3, 4]], ["AN", 5, 0, 5], ["FU", 5, [1, 2, 3, 4, 5]], ["AN", 5, 1, 4], ["FU", 5, [2, 3, 4, 5, 6]], ["AN", 5, 2, 6], ["FU", 3, [0, 1, 2]], ["SP", 3, 0, 32, [8], 1], ["AN", 3, 1, 2], ["FFSP", 3, 0, [7, 6, 5, 4, 3], 1, 1], ["AN", 3, 1, 6], ["FU", 1, [0, 1, 2, 3]], ["SP", 1, 0, 144, [1], 1], ["AN", 1, 1, 2], ["FFSP", 1, 0, [7, 6, 5, 4, 3], 1, 1], ["AN", 1, 1, 6], ["PR", 4, 0, "auto_unroll_max_step$0"]]]], "r": [[0.000440256, 0.000440271, 0.000440248, 0.000440273, 0.00044025, 0.000440249, 0.000440221, 0.00044022, 0.000440264, 0.000440223], 0, 95.2833, 1654017927], "v": "v0.6"}
{"i": [["[\"fused_conv1x1_bn_relu_stride\", 1, 28, 28, 512, 16, 64, 2]", "cuda -keys=cuda,gpu -max_num_threads=1024 -model=unknown -thread_warp_size=32", [-1, 16, 64, 49152, 2147483647, 1024, 8, 32], "", 0, []], [[], [["CI", 6], ["CI", 4], ["CHW", 2, "local"], ["SP", 2, 0, 1, [1, 1, 1, 1], 1], ["SP", 2, 5, 64, [1, 32, 1, 1], 1], ["SP", 2, 10, 14, [1, 1, 2, 1], 1], ["SP", 2, 15, 14, [1, 1, 1, 14], 1], ["SP", 2, 20, 16, [1, 8, 2, 1], 1], ["SP", 2, 25, 512, [16, 1], 1], ["RE", 2, [0, 5, 10, 15, 20, 1, 6, 11, 16, 21, 2, 7, 12, 17, 22, 25, 26, 3, 8, 13, 18, 23, 27, 4, 9, 14, 19, 24]], ["FSP", 3, 0, 3, 3], ["FSP", 3, 4, 4, 3], ["FSP", 3, 8, 5, 3], ["FSP", 3, 12, 6, 3], ["FSP", 3, 16, 7, 3], ["RE", 3, [0, 4, 8, 12, 16, 1, 5, 9, 13, 17, 2, 6, 10, 14, 18, 3, 7, 11, 15, 19]], ["CA", 2, 3, 14], ["CHR", 1, "shared", [2]], ["CA", 2, 3, 15], ["CHR", 0, "shared", [3]], ["CA", 1, 4, 15], ["FU", 10, [0, 1, 2, 3, 4]], ["SP", 10, 0, 802816, [32], 1], ["AN", 10, 0, 5], ["AN", 10, 1, 6], ["FU", 5, [0, 1, 2, 3, 4]], ["AN", 5, 0, 5], ["FU", 5, [1, 2, 3, 4, 5]], ["AN", 5, 1, 4], ["FU", 5, [2, 3, 4, 5, 6]], ["AN", 5, 2, 6], ["FU", 3, [0, 1, 2]], ["SP", 3, 0, 32, [1], 1], ["AN", 3, 1, 2], ["FFSP", 3, 0, [7, 6, 5, 4, 3], 1, 1], ["AN", 3, 1, 6], ["FU", 1, [0, 1, 2, 3]], ["SP", 1, 0, 1296, [1], 1], ["AN", 1, 1, 2], ["FFSP", 1, 0, [7, 6, 5, 4, 3], 1, 1], ["AN", 1, 1, 6], ["PR", 4, 0, "auto_unroll_max_step$512"]]]], "r": [[0.000227806, 0.000227814, 0.000227832, 0.000227846, 0.000227814, 0.000227808, 0.000227813, 0.000227817, 0.000227809, 0.000227807], 0, 132.78, 1654017965], "v": "v0.6"}
{"i": [["[\"fused_conv1x1_bn_relu_stride\", 1, 28, 28, 512, 16, 64, 2]", "cuda -keys=cuda,gpu -max_num_threads=1024 -model=unknown -thread_warp_size=32", [-1, 16, 64, 49152, 2147483647, 1024, 8, 32], "", 0, []], [[], [["CI", 6], ["CI", 4], ["CHW", 2, "local"], ["SP", 2, 0, 1, [1, 1, 1, 1], 1], ["SP", 2, 5, 64, [1, 8, 2, 4], 1], ["SP", 2, 10, 14, [1, 14, 1, 1], 1], ["SP", 2, 15, 14, [7, 1, 1, 2], 1], ["SP", 2, 20, 16, [1, 1, 16, 1], 1], ["SP", 2, 25, 512, [1, 2], 1], ["RE", 2, [0, 5, 10, 15, 20, 1, 6, 11, 16, 21, 2, 7, 12, 17, 22, 25, 26, 3, 8, 13, 18, 23, 27, 4, 9, 14, 19, 24]], ["FSP", 3, 0, 3, 3], ["FSP", 3, 4, 4, 3], ["FSP", 3, 8, 5, 3], ["FSP", 3, 12, 6, 3], ["FSP", 3, 16, 7, 3], ["RE", 3, [0, 4, 8, 12, 16, 1, 5, 9, 13, 17, 2, 6, 10, 14, 18, 3, 7, 11, 15, 19]], ["CA", 2, 3, 14], ["CHR", 1, "shared", [2]], ["CA", 2, 3, 15], ["CHR", 0, "shared", [3]], ["CA", 1, 4, 15], ["FU", 10, [0, 1, 2, 3, 4]], ["SP", 10, 0, 802816, [32], 1], ["AN", 10, 0, 5], ["AN", 10, 1, 6], ["FU", 5, [0, 1, 2, 3, 4]], ["AN", 5, 0, 5], ["FU", 5, [1, 2, 3, 4, 5]], ["AN", 5, 1, 4], ["FU", 5, [2, 3, 4, 5, 6]], ["AN", 5, 2, 6], ["FU", 3, [0, 1, 2]], ["SP", 3, 0, 128, [1], 1], ["AN", 3, 1, 2], ["FFSP", 3, 0, [7, 6, 5, 4, 3], 1, 1], ["AN", 3, 1, 6], ["FU", 1, [0, 1, 2, 3]], ["SP", 1, 0, 6, [1], 1], ["AN", 1, 1, 2], ["FFSP", 1, 0, [7, 6, 5, 4, 3], 1, 1], ["AN", 1, 1, 6], ["PR", 4, 0, "auto_unroll_max_step$1024"]]]], "r": [[0.0195242, 0.0195184, 0.019523, 0.0195201, 0.0195273, 0.0195247, 0.0195219, 0.0195239, 0.0195303, 0.0195177], 0, 120.236, 1654017948], "v": "v0.6"}
{"i": [["[\"fused_conv1x1_bn_relu_stride\", 1, 28, 28, 512, 16, 64, 2]", "cuda -keys=cuda,gpu -max_num_threads=1024 -model=unknown -thread_warp_size=32", [-1, 16, 64, 49152, 2147483647, 1024, 8, 32], "", 0, []], [[], [["CI", 6], ["CI", 4], ["CHW", 2, "local"], ["SP", 2, 0, 1, [1, 1, 1, 1], 1], ["SP", 2, 5, 64, [1, 32, 1, 1], 1], ["SP", 2, 10, 14, [1, 1, 2, 1], 1], ["SP", 2, 15, 14, [1, 1, 1, 14], 1], ["SP", 2, 20, 16, [1, 8, 2, 1], 1], ["SP", 2, 25, 512, [8, 2], 1], ["RE", 2, [0, 5, 10, 15, 20, 1, 6, 11, 16, 21, 2, 7, 12, 17, 22, 25, 26, 3, 8, 13, 18, 23, 27, 4, 9, 14, 19, 24]], ["FSP", 3, 0, 3, 3], ["FSP", 3, 4, 4, 3], ["FSP", 3, 8, 5, 3], ["FSP", 3, 12, 6, 3], ["FSP", 3, 16, 7, 3], ["RE", 3, [0, 4, 8, 12, 16, 1, 5, 9, 13, 17, 2, 6, 10, 14, 18, 3, 7, 11, 15, 19]], ["CA", 2, 3, 14], ["CHR", 1, "shared", [2]], ["CA", 2, 3, 15], ["CHR", 0, "shared", [3]], ["CA", 1, 4, 15], ["FU", 10, [0, 1, 2, 3, 4]], ["SP", 10, 0, 802816, [64], 1], ["AN", 10, 0, 5], ["AN", 10, 1, 6], ["FU", 5, [0, 1, 2, 3, 4]], ["AN", 5, 0, 5], ["FU", 5, [1, 2, 3, 4, 5]], ["AN", 5, 1, 4], ["FU", 5, [2, 3, 4, 5, 6]], ["AN", 5, 2, 6], ["FU", 3, [0, 1, 2]], ["SP", 3, 0, 32, [2], 1], ["AN", 3, 1, 2], ["FFSP", 3, 0, [7, 6, 5, 4, 3], 1, 1], ["AN", 3, 1, 6], ["FU", 1, [0, 1, 2, 3]], ["SP", 1, 0, 1296, [1], 1], ["AN", 1, 1, 2], ["FFSP", 1, 0, [7, 6, 5, 4, 3], 1, 1], ["AN", 1, 1, 6], ["PR", 4, 0, "auto_unroll_max_step$512"]]]], "r": [[0.000146513, 0.000146514, 0.000146528, 0.000146529, 0.00014652, 0.000146515, 0.000146509, 0.00014651, 0.000146526, 0.000146514], 0, 121.674, 1654017954], "v": "v0.6"}
{"i": [["[\"fused_conv1x1_bn_relu_stride\", 1, 28, 28, 512, 16, 64, 2]", "cuda -keys=cuda,gpu -max_num_threads=1024 -model=unknown -thread_warp_size=32", [-1, 16, 64, 49152, 2147483647, 1024, 8, 32], "", 0, []], [[], [["CI", 6], ["CI", 4], ["CHW", 2, "local"], ["SP", 2, 0, 1, [1, 1, 1, 1], 1], ["SP", 2, 5, 64, [1, 8, 1, 2], 1], ["SP", 2, 10, 14, [1, 1, 1, 1], 1], ["SP", 2, 15, 14, [1, 2, 1, 1], 1], ["SP", 2, 20, 16, [1, 8, 2, 1], 1], ["SP", 2, 25, 512, [2, 2], 1], ["RE", 2, [0, 5, 10, 15, 20, 1, 6, 11, 16, 21, 2, 7, 12, 17, 22, 25, 26, 3, 8, 13, 18, 23, 27, 4, 9, 14, 19, 24]], ["FSP", 3, 0, 3, 3], ["FSP", 3, 4, 4, 3], ["FSP", 3, 8, 5, 3], ["FSP", 3, 12, 6, 3], ["FSP", 3, 16, 7, 3], ["RE", 3, [0, 4, 8, 12, 16, 1, 5, 9, 13, 17, 2, 6, 10, 14, 18, 3, 7, 11, 15, 19]], ["CA", 2, 3, 14], ["CHR", 1, "shared", [2]], ["CA", 2, 3, 15], ["CHR", 0, "shared", [3]], ["CA", 1, 4, 15], ["FU", 10, [0, 1, 2, 3, 4]], ["SP", 10, 0, 802816, [32], 1], ["AN", 10, 0, 5], ["AN", 10, 1, 6], ["FU", 5, [0, 1, 2, 3, 4]], ["AN", 5, 0, 5], ["FU", 5, [1, 2, 3, 4, 5]], ["AN", 5, 1, 4], ["FU", 5, [2, 3, 4, 5, 6]], ["AN", 5, 2, 6], ["FU", 3, [0, 1, 2]], ["SP", 3, 0, 128, [1], 1], ["AN", 3, 1, 2], ["FFSP", 3, 0, [7, 6, 5, 4, 3], 1, 1], ["AN", 3, 1, 6], ["FU", 1, [0, 1, 2, 3]], ["SP", 1, 0, 288, [1], 1], ["AN", 1, 1, 2], ["FFSP", 1, 0, [7, 6, 5, 4, 3], 1, 1], ["AN", 1, 1, 6], ["PR", 4, 0, "auto_unroll_max_step$64"]]]], "r": [[9.39429e-05, 9.39413e-05, 9.39545e-05, 9.3959e-05, 9.39492e-05, 9.39466e-05, 9.39433e-05, 9.39353e-05, 9.39398e-05, 9.39297e-05], 0, 106.29, 1654017938], "v": "v0.6"}
{"i": [["[\"fused_conv1x1_bn_relu_stride\", 1, 28, 28, 512, 16, 64, 2]", "cuda -keys=cuda,gpu -max_num_threads=1024 -model=unknown -thread_warp_size=32", [-1, 16, 64, 49152, 2147483647, 1024, 8, 32], "", 0, []], [[], [["CI", 6], ["CI", 4], ["CHW", 2, "local"], ["SP", 2, 0, 1, [1, 1, 1, 1], 1], ["SP", 2, 5, 64, [2, 8, 1, 4], 1], ["SP", 2, 10, 14, [1, 7, 1, 2], 1], ["SP", 2, 15, 14, [1, 7, 1, 1], 1], ["SP", 2, 20, 16, [2, 1, 1, 2], 1], ["SP", 2, 25, 512, [16, 1], 1], ["RE", 2, [0, 5, 10, 15, 20, 1, 6, 11, 16, 21, 2, 7, 12, 17, 22, 25, 26, 3, 8, 13, 18, 23, 27, 4, 9, 14, 19, 24]], ["FSP", 3, 0, 3, 3], ["FSP", 3, 4, 4, 3], ["FSP", 3, 8, 5, 3], ["FSP", 3, 12, 6, 3], ["FSP", 3, 16, 7, 3], ["RE", 3, [0, 4, 8, 12, 16, 1, 5, 9, 13, 17, 2, 6, 10, 14, 18, 3, 7, 11, 15, 19]], ["CA", 2, 3, 14], ["CHR", 1, "shared", [2]], ["CA", 2, 3, 15], ["CHR", 0, "shared", [3]], ["CA", 1, 4, 15], ["FU", 10, [0, 1, 2, 3, 4]], ["SP", 10, 0, 802816, [16], 1], ["AN", 10, 0, 5], ["AN", 10, 1, 6], ["FU", 5, [0, 1, 2, 3, 4]], ["AN", 5, 0, 5], ["FU", 5, [1, 2, 3, 4, 5]], ["AN", 5, 1, 4], ["FU", 5, [2, 3, 4, 5, 6]], ["AN", 5, 2, 6], ["FU", 3, [0, 1, 2]], ["SP", 3, 0, 512, [1], 1], ["AN", 3, 1, 2], ["FFSP", 3, 0, [7, 6, 5, 4, 3], 1, 1], ["AN", 3, 1, 6], ["FU", 1, [0, 1, 2, 3]], ["SP", 1, 0, 48, [1], 1], ["AN", 1, 1, 2], ["FFSP", 1, 0, [7, 6, 5, 4, 3], 1, 1], ["AN", 1, 1, 6], ["PR", 4, 0, "auto_unroll_max_step$0"]]]], "r": [[0.000557358, 0.000557392, 0.000557392, 0.000557395, 0.000557406, 0.000557393, 0.0005574, 0.000557388, 0.000557386, 0.000557359], 0, 112.116, 1654017944], "v": "v0.6"}
{"i": [["[\"fused_conv1x1_bn_relu_stride\", 1, 28, 28, 512, 16, 64, 2]", "cuda -keys=cuda,gpu -max_num_threads=1024 -model=unknown -thread_warp_size=32", [-1, 16, 64, 49152, 2147483647, 1024, 8, 32], "", 0, []], [[], [["CI", 6], ["CI", 4], ["CHW", 2, "local"], ["SP", 2, 0, 1, [1, 1, 1, 1], 1], ["SP", 2, 5, 64, [1, 32, 1, 2], 1], ["SP", 2, 10, 14, [1, 1, 1, 2], 1], ["SP", 2, 15, 14, [1, 7, 1, 2], 1], ["SP", 2, 20, 16, [1, 2, 2, 4], 1], ["SP", 2, 25, 512, [8, 1], 1], ["RE", 2, [0, 5, 10, 15, 20, 1, 6, 11, 16, 21, 2, 7, 12, 17, 22, 25, 26, 3, 8, 13, 18, 23, 27, 4, 9, 14, 19, 24]], ["FSP", 3, 0, 3, 3], ["FSP", 3, 4, 4, 3], ["FSP", 3, 8, 5, 3], ["FSP", 3, 12, 6, 3], ["FSP", 3, 16, 7, 3], ["RE", 3, [0, 4, 8, 12, 16, 1, 5, 9, 13, 17, 2, 6, 10, 14, 18, 3, 7, 11, 15, 19]], ["CA", 2, 3, 14], ["CHR", 1, "shared", [2]], ["CA", 2, 3, 15], ["CHR", 0, "shared", [3]], ["CA", 1, 4, 15], ["FU", 10, [0, 1, 2, 3, 4]], ["SP", 10, 0, 802816, [64], 1], ["AN", 10, 0, 5], ["AN", 10, 1, 6], ["FU", 5, [0, 1, 2, 3, 4]], ["AN", 5, 0, 5], ["FU", 5, [1, 2, 3, 4, 5]], ["AN", 5, 1, 4], ["FU", 5, [2, 3, 4, 5, 6]], ["AN", 5, 2, 6], ["FU", 3, [0, 1, 2]], ["SP", 3, 0, 128, [1], 1], ["AN", 3, 1, 2], ["FFSP", 3, 0, [7, 6, 5, 4, 3], 1, 1], ["AN", 3, 1, 6], ["FU", 1, [0, 1, 2, 3]], ["SP", 1, 0, 24, [12], 1], ["AN", 1, 1, 2], ["FFSP", 1, 0, [7, 6, 5, 4, 3], 1, 1], ["AN", 1, 1, 6], ["PR", 4, 0, "auto_unroll_max_step$64"]]]], "r": [[0.000414369, 0.000414365, 0.000414367, 0.000414401, 0.00041436, 0.000414377, 0.000414355, 0.000414356, 0.00041437, 0.000414361], 0, 127.28, 1654017959], "v": "v0.6"}
{"i": [["[\"fused_conv1x1_bn_relu_stride\", 1, 28, 28, 512, 16, 64, 2]", "cuda -keys=cuda,gpu -max_num_threads=1024 -model=unknown -thread_warp_size=32", [-1, 16, 64, 49152, 2147483647, 1024, 8, 32], "", 0, []], [[], [["CI", 6], ["CI", 4], ["CHW", 2, "local"], ["SP", 2, 0, 1, [1, 1, 1, 1], 1], ["SP", 2, 5, 64, [1, 2, 8, 1], 1], ["SP", 2, 10, 14, [1, 7, 1, 1], 1], ["SP", 2, 15, 14, [2, 7, 1, 1], 1], ["SP", 2, 20, 16, [1, 1, 2, 1], 1], ["SP", 2, 25, 512, [2, 2], 1], ["RE", 2, [0, 5, 10, 15, 20, 1, 6, 11, 16, 21, 2, 7, 12, 17, 22, 25, 26, 3, 8, 13, 18, 23, 27, 4, 9, 14, 19, 24]], ["FSP", 3, 0, 3, 3], ["FSP", 3, 4, 4, 3], ["FSP", 3, 8, 5, 3], ["FSP", 3, 12, 6, 3], ["FSP", 3, 16, 7, 3], ["RE", 3, [0, 4, 8, 12, 16, 1, 5, 9, 13, 17, 2, 6, 10, 14, 18, 3, 7, 11, 15, 19]], ["CA", 2, 3, 14], ["CHR", 1, "shared", [2]], ["CA", 2, 3, 15], ["CHR", 0, "shared", [3]], ["CA", 1, 4, 15], ["FU", 10, [0, 1, 2, 3, 4]], ["SP", 10, 0, 802816, [32], 1], ["AN", 10, 0, 5], ["AN", 10, 1, 6], ["FU", 5, [0, 1, 2, 3, 4]], ["AN", 5, 0, 5], ["FU", 5, [1, 2, 3, 4, 5]], ["AN", 5, 1, 4], ["FU", 5, [2, 3, 4, 5, 6]], ["AN", 5, 2, 6], ["FU", 3, [0, 1, 2]], ["SP", 3, 0, 8, [2], 1], ["AN", 3, 1, 2], ["FFSP", 3, 0, [7, 6, 5, 4, 3], 1, 1], ["AN", 3, 1, 6], ["FU", 1, [0, 1, 2, 3]], ["SP", 1, 0, 4, [1], 1], ["AN", 1, 1, 2], ["FFSP", 1, 0, [7, 6, 5, 4, 3], 1, 1], ["AN", 1, 1, 6], ["PR", 4, 0, "auto_unroll_max_step$0"]]]], "r": [[0.00017916, 0.000179159, 0.000179159, 0.000179175, 0.000179137, 0.000179143, 0.000179137, 0.000179139, 0.00017915, 0.00017913], 0, 143.825, 1654017976], "v": "v0.6"}
{"i": [["[\"fused_conv1x1_bn_relu_stride\", 1, 28, 28, 512, 16, 64, 2]", "cuda -keys=cuda,gpu -max_num_threads=1024 -model=unknown -thread_warp_size=32", [-1, 16, 64, 49152, 2147483647, 1024, 8, 32], "", 0, []], [[], [["CI", 6], ["CI", 4], ["CHW", 2, "local"], ["SP", 2, 0, 1, [1, 1, 1, 1], 1], ["SP", 2, 5, 64, [1, 2, 1, 2], 1], ["SP", 2, 10, 14, [1, 2, 1, 7], 1], ["SP", 2, 15, 14, [1, 2, 1, 1], 1], ["SP", 2, 20, 16, [1, 8, 1, 2], 1], ["SP", 2, 25, 512, [16, 4], 1], ["RE", 2, [0, 5, 10, 15, 20, 1, 6, 11, 16, 21, 2, 7, 12, 17, 22, 25, 26, 3, 8, 13, 18, 23, 27, 4, 9, 14, 19, 24]], ["FSP", 3, 0, 3, 3], ["FSP", 3, 4, 4, 3], ["FSP", 3, 8, 5, 3], ["FSP", 3, 12, 6, 3], ["FSP", 3, 16, 7, 3], ["RE", 3, [0, 4, 8, 12, 16, 1, 5, 9, 13, 17, 2, 6, 10, 14, 18, 3, 7, 11, 15, 19]], ["CA", 2, 3, 14], ["CHR", 1, "shared", [2]], ["CA", 2, 3, 15], ["CHR", 0, "shared", [3]], ["CA", 1, 4, 15], ["FU", 10, [0, 1, 2, 3, 4]], ["SP", 10, 0, 802816, [32], 1], ["AN", 10, 0, 5], ["AN", 10, 1, 6], ["FU", 5, [0, 1, 2, 3, 4]], ["AN", 5, 0, 5], ["FU", 5, [1, 2, 3, 4, 5]], ["AN", 5, 1, 4], ["FU", 5, [2, 3, 4, 5, 6]], ["AN", 5, 2, 6], ["FU", 3, [0, 1, 2]], ["SP", 3, 0, 256, [1], 1], ["AN", 3, 1, 2], ["FFSP", 3, 0, [7, 6, 5, 4, 3], 1, 1], ["AN", 3, 1, 6], ["FU", 1, [0, 1, 2, 3]], ["SP", 1, 0, 832, [1], 1], ["AN", 1, 1, 2], ["FFSP", 1, 0, [7, 6, 5, 4, 3], 1, 1], ["AN", 1, 1, 6], ["PR", 4, 0, "auto_unroll_max_step$1024"]]]], "r": [[8.29289e-05, 8.29467e-05, 8.28229e-05, 8.29341e-05, 8.28645e-05, 8.27884e-05, 8.29149e-05, 8.29265e-05, 8.28806e-05, 8.2882e-05], 0, 138.778, 1654017970], "v": "v0.6"}
{"i": [["[\"fused_conv1x1_bn_relu_stride\", 1, 28, 28, 512, 16, 64, 2]", "cuda -keys=cuda,gpu -max_num_threads=1024 -model=unknown -thread_warp_size=32", [-1, 16, 64, 49152, 2147483647, 1024, 8, 32], "", 0, []], [[], [["CI", 6], ["CI", 4], ["CHW", 2, "local"], ["SP", 2, 0, 1, [1, 1, 1, 1], 1], ["SP", 2, 5, 64, [1, 4, 1, 2], 1], ["SP", 2, 10, 14, [2, 1, 1, 1], 1], ["SP", 2, 15, 14, [1, 7, 1, 2], 1], ["SP", 2, 20, 16, [1, 4, 2, 2], 1], ["SP", 2, 25, 512, [1, 16], 1], ["RE", 2, [0, 5, 10, 15, 20, 1, 6, 11, 16, 21, 2, 7, 12, 17, 22, 25, 26, 3, 8, 13, 18, 23, 27, 4, 9, 14, 19, 24]], ["FSP", 3, 0, 3, 3], ["FSP", 3, 4, 4, 3], ["FSP", 3, 8, 5, 3], ["FSP", 3, 12, 6, 3], ["FSP", 3, 16, 7, 3], ["RE", 3, [0, 4, 8, 12, 16, 1, 5, 9, 13, 17, 2, 6, 10, 14, 18, 3, 7, 11, 15, 19]], ["CA", 2, 3, 14], ["CHR", 1, "shared", [2]], ["CA", 2, 3, 15], ["CHR", 0, "shared", [3]], ["CA", 1, 4, 15], ["FU", 10, [0, 1, 2, 3, 4]], ["SP", 10, 0, 802816, [32], 1], ["AN", 10, 0, 5], ["AN", 10, 1, 6], ["FU", 5, [0, 1, 2, 3, 4]], ["AN", 5, 0, 5], ["FU", 5, [1, 2, 3, 4, 5]], ["AN", 5, 1, 4], ["FU", 5, [2, 3, 4, 5, 6]], ["AN", 5, 2, 6], ["FU", 3, [0, 1, 2]], ["SP", 3, 0, 128, [16], 1], ["AN", 3, 1, 2], ["FFSP", 3, 0, [7, 6, 5, 4, 3], 1, 1], ["AN", 3, 1, 6], ["FU", 1, [0, 1, 2, 3]], ["SP", 1, 0, 48, [24], 1], ["AN", 1, 1, 2], ["FFSP", 1, 0, [7, 6, 5, 4, 3], 1, 1], ["AN", 1, 1, 6], ["PR", 4, 0, "auto_unroll_max_step$1024"]]]], "r": [[0.000120206, 0.000120202, 0.000120194, 0.000120216, 0.000120199, 0.000120195, 0.000120189, 0.000120205, 0.000120194, 0.000120215], 0, 159.67, 1654017991], "v": "v0.6"}
{"i": [["[\"fused_conv1x1_bn_relu_stride\", 1, 28, 28, 512, 16, 64, 2]", "cuda -keys=cuda,gpu -max_num_threads=1024 -model=unknown -thread_warp_size=32", [-1, 16, 64, 49152, 2147483647, 1024, 8, 32], "", 0, []], [[], [["CI", 6], ["CI", 4], ["CHW", 2, "local"], ["SP", 2, 0, 1, [1, 1, 1, 1], 1], ["SP", 2, 5, 64, [2, 1, 8, 2], 1], ["SP", 2, 10, 14, [1, 7, 1, 2], 1], ["SP", 2, 15, 14, [1, 2, 1, 1], 1], ["SP", 2, 20, 16, [2, 2, 1, 1], 1], ["SP", 2, 25, 512, [4, 8], 1], ["RE", 2, [0, 5, 10, 15, 20, 1, 6, 11, 16, 21, 2, 7, 12, 17, 22, 25, 26, 3, 8, 13, 18, 23, 27, 4, 9, 14, 19, 24]], ["FSP", 3, 0, 3, 3], ["FSP", 3, 4, 4, 3], ["FSP", 3, 8, 5, 3], ["FSP", 3, 12, 6, 3], ["FSP", 3, 16, 7, 3], ["RE", 3, [0, 4, 8, 12, 16, 1, 5, 9, 13, 17, 2, 6, 10, 14, 18, 3, 7, 11, 15, 19]], ["CA", 2, 3, 14], ["CHR", 1, "shared", [2]], ["CA", 2, 3, 15], ["CHR", 0, "shared", [3]], ["CA", 1, 4, 15], ["FU", 10, [0, 1, 2, 3, 4]], ["SP", 10, 0, 802816, [32], 1], ["AN", 10, 0, 5], ["AN", 10, 1, 6], ["FU", 5, [0, 1, 2, 3, 4]], ["AN", 5, 0, 5], ["FU", 5, [1, 2, 3, 4, 5]], ["AN", 5, 1, 4], ["FU", 5, [2, 3, 4, 5, 6]], ["AN", 5, 2, 6], ["FU", 3, [0, 1, 2]], ["SP", 3, 0, 512, [64], 1], ["AN", 3, 1, 2], ["FFSP", 3, 0, [7, 6, 5, 4, 3], 1, 1], ["AN", 3, 1, 6], ["FU", 1, [0, 1, 2, 3]], ["SP", 1, 0, 32, [32], 1], ["AN", 1, 1, 2], ["FFSP", 1, 0, [7, 6, 5, 4, 3], 1, 1], ["AN", 1, 1, 6], ["PR", 4, 0, "auto_unroll_max_step$1024"]]]], "r": [[0.00025398, 0.000253962, 0.000253986, 0.000253978, 0.000253972, 0.000253969, 0.000253977, 0.000253986, 0.000253988, 0.000253987], 0, 153.499, 1654017982], "v": "v0.6"}
{"i": [["[\"fused_conv1x1_bn_relu_stride\", 1, 28, 28, 512, 16, 64, 2]", "cuda -keys=cuda,gpu -max_num_threads=1024 -model=unknown -thread_warp_size=32", [-1, 16, 64, 49152, 2147483647, 1024, 8, 32], "", 0, []], [[], [["CI", 6], ["CI", 4], ["CHW", 2, "local"], ["SP", 2, 0, 1, [1, 1, 1, 1], 1], ["SP", 2, 5, 64, [2, 1, 1, 1], 1], ["SP", 2, 10, 14, [1, 7, 2, 1], 1], ["SP", 2, 15, 14, [1, 2, 1, 7], 1], ["SP", 2, 20, 16, [1, 16, 1, 1], 1], ["SP", 2, 25, 512, [2, 1], 1], ["RE", 2, [0, 5, 10, 15, 20, 1, 6, 11, 16, 21, 2, 7, 12, 17, 22, 25, 26, 3, 8, 13, 18, 23, 27, 4, 9, 14, 19, 24]], ["FSP", 3, 0, 3, 3], ["FSP", 3, 4, 4, 3], ["FSP", 3, 8, 5, 3], ["FSP", 3, 12, 6, 3], ["FSP", 3, 16, 7, 3], ["RE", 3, [0, 4, 8, 12, 16, 1, 5, 9, 13, 17, 2, 6, 10, 14, 18, 3, 7, 11, 15, 19]], ["CA", 2, 3, 14], ["CHR", 1, "shared", [2]], ["CA", 2, 3, 15], ["CHR", 0, "shared", [3]], ["CA", 1, 4, 15], ["FU", 10, [0, 1, 2, 3, 4]], ["SP", 10, 0, 802816, [32], 1], ["AN", 10, 0, 5], ["AN", 10, 1, 6], ["FU", 5, [0, 1, 2, 3, 4]], ["AN", 5, 0, 5], ["FU", 5, [1, 2, 3, 4, 5]], ["AN", 5, 1, 4], ["FU", 5, [2, 3, 4, 5, 6]], ["AN", 5, 2, 6], ["FU", 3, [0, 1, 2]], ["SP", 3, 0, 16, [1], 1], ["AN", 3, 1, 2], ["FFSP", 3, 0, [7, 6, 5, 4, 3], 1, 1], ["AN", 3, 1, 6], ["FU", 1, [0, 1, 2, 3]], ["SP", 1, 0, 624, [12], 1], ["AN", 1, 1, 2], ["FFSP", 1, 0, [7, 6, 5, 4, 3], 1, 1], ["AN", 1, 1, 6], ["PR", 4, 0, "auto_unroll_max_step$512"]]]], "r": [[0.000420538, 0.000420537, 0.000420548, 0.000420589, 0.000420544, 0.000420528, 0.000420515, 0.000420545, 0.000420543, 0.000420535], 0, 170.065, 1654018002], "v": "v0.6"}
{"i": [["[\"fused_conv1x1_bn_relu_stride\", 1, 28, 28, 512, 16, 64, 2]", "cuda -keys=cuda,gpu -max_num_threads=1024 -model=unknown -thread_warp_size=32", [-1, 16, 64, 49152, 2147483647, 1024, 8, 32], "", 0, []], [[], [["CI", 6], ["CI", 4], ["CHW", 2, "local"], ["SP", 2, 0, 1, [1, 1, 1, 1], 1], ["SP", 2, 5, 64, [1, 2, 1, 1], 1], ["SP", 2, 10, 14, [2, 7, 1, 1], 1], ["SP", 2, 15, 14, [2, 7, 1, 1], 1], ["SP", 2, 20, 16, [1, 1, 2, 1], 1], ["SP", 2, 25, 512, [2, 2], 1], ["RE", 2, [0, 5, 10, 15, 20, 1, 6, 11, 16, 21, 2, 7, 12, 17, 22, 25, 26, 3, 8, 13, 18, 23, 27, 4, 9, 14, 19, 24]], ["FSP", 3, 0, 3, 3], ["FSP", 3, 4, 4, 3], ["FSP", 3, 8, 5, 3], ["FSP", 3, 12, 6, 3], ["FSP", 3, 16, 7, 3], ["RE", 3, [0, 4, 8, 12, 16, 1, 5, 9, 13, 17, 2, 6, 10, 14, 18, 3, 7, 11, 15, 19]], ["CA", 2, 3, 14], ["CHR", 1, "shared", [2]], ["CA", 2, 3, 15], ["CHR", 0, "shared", [3]], ["CA", 1, 4, 15], ["FU", 10, [0, 1, 2, 3, 4]], ["SP", 10, 0, 802816, [32], 1], ["AN", 10, 0, 5], ["AN", 10, 1, 6], ["FU", 5, [0, 1, 2, 3, 4]], ["AN", 5, 0, 5], ["FU", 5, [1, 2, 3, 4, 5]], ["AN", 5, 1, 4], ["FU", 5, [2, 3, 4, 5, 6]], ["AN", 5, 2, 6], ["FU", 3, [0, 1, 2]], ["SP", 3, 0, 8, [1], 1], ["AN", 3, 1, 2], ["FFSP", 3, 0, [7, 6, 5, 4, 3], 1, 1], ["AN", 3, 1, 6], ["FU", 1, [0, 1, 2, 3]], ["SP", 1, 0, 4, [1], 1], ["AN", 1, 1, 2], ["FFSP", 1, 0, [7, 6, 5, 4, 3], 1, 1], ["AN", 1, 1, 6], ["PR", 4, 0, "auto_unroll_max_step$1024"]]]], "r": [[0.000326266, 0.000326284, 0.000326269, 0.000326303, 0.000326261, 0.000326246, 0.000326255, 0.000326282, 0.000326254, 0.000326281], 0, 164.489, 1654017997], "v": "v0.6"}
{"i": [["[\"fused_conv1x1_bn_relu_stride\", 1, 28, 28, 512, 16, 64, 2]", "cuda -keys=cuda,gpu -max_num_threads=1024 -model=unknown -thread_warp_size=32", [-1, 16, 64, 49152, 2147483647, 1024, 8, 32], "", 0, []], [[], [["CI", 6], ["CI", 4], ["CHW", 2, "local"], ["SP", 2, 0, 1, [1, 1, 1, 1], 1], ["SP", 2, 5, 64, [4, 1, 2, 2], 1], ["SP", 2, 10, 14, [1, 1, 7, 1], 1], ["SP", 2, 15, 14, [1, 14, 1, 1], 1], ["SP", 2, 20, 16, [2, 8, 1, 1], 1], ["SP", 2, 25, 512, [1, 2], 1], ["RE", 2, [0, 5, 10, 15, 20, 1, 6, 11, 16, 21, 2, 7, 12, 17, 22, 25, 26, 3, 8, 13, 18, 23, 27, 4, 9, 14, 19, 24]], ["FSP", 3, 0, 3, 3], ["FSP", 3, 4, 4, 3], ["FSP", 3, 8, 5, 3], ["FSP", 3, 12, 6, 3], ["FSP", 3, 16, 7, 3], ["RE", 3, [0, 4, 8, 12, 16, 1, 5, 9, 13, 17, 2, 6, 10, 14, 18, 3, 7, 11, 15, 19]], ["CA", 2, 3, 14], ["CHR", 1, "shared", [2]], ["CA", 2, 3, 15], ["CHR", 0, "shared", [3]], ["CA", 1, 4, 15], ["FU", 10, [0, 1, 2, 3, 4]], ["SP", 10, 0, 802816, [32], 1], ["AN", 10, 0, 5], ["AN", 10, 1, 6], ["FU", 5, [0, 1, 2, 3, 4]], ["AN", 5, 0, 5], ["FU", 5, [1, 2, 3, 4, 5]], ["AN", 5, 1, 4], ["FU", 5, [2, 3, 4, 5, 6]], ["AN", 5, 2, 6], ["FU", 3, [0, 1, 2]], ["SP", 3, 0, 16, [1], 1], ["AN", 3, 1, 2], ["FFSP", 3, 0, [7, 6, 5, 4, 3], 1, 1], ["AN", 3, 1, 6], ["FU", 1, [0, 1, 2, 3]], ["SP", 1, 0, 26, [2], 1], ["AN", 1, 1, 2], ["FFSP", 1, 0, [7, 6, 5, 4, 3], 1, 1], ["AN", 1, 1, 6], ["PR", 4, 0, "auto_unroll_max_step$16"]]]], "r": [[0.00205984, 0.00206013, 0.00206022, 0.00205991, 0.00206018, 0.00205999, 0.00206016, 0.00205983, 0.0020599, 0.00206011], 0, 153.997, 1654017986], "v": "v0.6"}
{"i": [["[\"fused_conv1x1_bn_relu_stride\", 1, 28, 28, 512, 16, 64, 2]", "cuda -keys=cuda,gpu -max_num_threads=1024 -model=unknown -thread_warp_size=32", [-1, 16, 64, 49152, 2147483647, 1024, 8, 32], "", 0, []], [[], [["CI", 6], ["CI", 4], ["CHW", 2, "local"], ["SP", 2, 0, 1, [1, 1, 1, 1], 1], ["SP", 2, 5, 64, [1, 1, 1, 2], 1], ["SP", 2, 10, 14, [1, 1, 1, 1], 1], ["SP", 2, 15, 14, [7, 2, 1, 1], 1], ["SP", 2, 20, 16, [1, 2, 4, 1], 1], ["SP", 2, 25, 512, [2, 2], 1], ["RE", 2, [0, 5, 10, 15, 20, 1, 6, 11, 16, 21, 2, 7, 12, 17, 22, 25, 26, 3, 8, 13, 18, 23, 27, 4, 9, 14, 19, 24]], ["FSP", 3, 0, 3, 3], ["FSP", 3, 4, 4, 3], ["FSP", 3, 8, 5, 3], ["FSP", 3, 12, 6, 3], ["FSP", 3, 16, 7, 3], ["RE", 3, [0, 4, 8, 12, 16, 1, 5, 9, 13, 17, 2, 6, 10, 14, 18, 3, 7, 11, 15, 19]], ["CA", 2, 3, 14], ["CHR", 1, "shared", [2]], ["CA", 2, 3, 15], ["CHR", 0, "shared", [3]], ["CA", 1, 4, 15], ["FU", 10, [0, 1, 2, 3, 4]], ["SP", 10, 0, 802816, [32], 1], ["AN", 10, 0, 5], ["AN", 10, 1, 6], ["FU", 5, [0, 1, 2, 3, 4]], ["AN", 5, 0, 5], ["FU", 5, [1, 2, 3, 4, 5]], ["AN", 5, 1, 4], ["FU", 5, [2, 3, 4, 5, 6]], ["AN", 5, 2, 6], ["FU", 3, [0, 1, 2]], ["SP", 3, 0, 32, [1], 1], ["AN", 3, 1, 2], ["FFSP", 3, 0, [7, 6, 5, 4, 3], 1, 1], ["AN", 3, 1, 6], ["FU", 1, [0, 1, 2, 3]], ["SP", 1, 0, 52, [52], 1], ["AN", 1, 1, 2], ["FFSP", 1, 0, [7, 6, 5, 4, 3], 1, 1], ["AN", 1, 1, 6], ["PR", 4, 0, "auto_unroll_max_step$64"]]]], "r": [[0.000290197, 0.000289915, 0.000289962, 0.00028984, 0.00028973, 0.00028969, 0.000289698, 0.000289705, 0.000289639, 0.000289696], 0, 180.015, 1654018012], "v": "v0.6"}
{"i": [["[\"fused_conv1x1_bn_relu_stride\", 1, 28, 28, 512, 16, 64, 2]", "cuda -keys=cuda,gpu -max_num_threads=1024 -model=unknown -thread_warp_size=32", [-1, 16, 64, 49152, 2147483647, 1024, 8, 32], "", 0, []], [[], [["CI", 6], ["CI", 4], ["CHW", 2, "local"], ["SP", 2, 0, 1, [1, 1, 1, 1], 1], ["SP", 2, 5, 64, [1, 1, 8, 4], 1], ["SP", 2, 10, 14, [1, 7, 2, 1], 1], ["SP", 2, 15, 14, [1, 7, 2, 1], 1], ["SP", 2, 20, 16, [2, 2, 2, 1], 1], ["SP", 2, 25, 512, [2, 1], 1], ["RE", 2, [0, 5, 10, 15, 20, 1, 6, 11, 16, 21, 2, 7, 12, 17, 22, 25, 26, 3, 8, 13, 18, 23, 27, 4, 9, 14, 19, 24]], ["FSP", 3, 0, 3, 3], ["FSP", 3, 4, 4, 3], ["FSP", 3, 8, 5, 3], ["FSP", 3, 12, 6, 3], ["FSP", 3, 16, 7, 3], ["RE", 3, [0, 4, 8, 12, 16, 1, 5, 9, 13, 17, 2, 6, 10, 14, 18, 3, 7, 11, 15, 19]], ["CA", 2, 3, 14], ["CHR", 1, "shared", [2]], ["CA", 2, 3, 15], ["CHR", 0, "shared", [3]], ["CA", 1, 4, 15], ["FU", 10, [0, 1, 2, 3, 4]], ["SP", 10, 0, 802816, [32], 1], ["AN", 10, 0, 5], ["AN", 10, 1, 6], ["FU", 5, [0, 1, 2, 3, 4]], ["AN", 5, 0, 5], ["FU", 5, [1, 2, 3, 4, 5]], ["AN", 5, 1, 4], ["FU", 5, [2, 3, 4, 5, 6]], ["AN", 5, 2, 6], ["FU", 3, [0, 1, 2]], ["SP", 3, 0, 64, [1], 1], ["AN", 3, 1, 2], ["FFSP", 3, 0, [7, 6, 5, 4, 3], 1, 1], ["AN", 3, 1, 6], ["FU", 1, [0, 1, 2, 3]], ["SP", 1, 0, 6, [1], 1], ["AN", 1, 1, 2], ["FFSP", 1, 0, [7, 6, 5, 4, 3], 1, 1], ["AN", 1, 1, 6], ["PR", 4, 0, "auto_unroll_max_step$1024"]]]], "r": [[0.0114491, 0.0114496, 0.01145, 0.0114526, 0.0114493, 0.0114532, 0.0114512, 0.0114473, 0.0114474, 0.0114476], 0, 177.999, 1654018007], "v": "v0.6"}
{"i": [["[\"fused_conv1x1_bn_relu_stride\", 1, 28, 28, 512, 16, 64, 2]", "cuda -keys=cuda,gpu -max_num_threads=1024 -model=unknown -thread_warp_size=32", [-1, 16, 64, 49152, 2147483647, 1024, 8, 32], "", 0, []], [[], [["CI", 6], ["CI", 4], ["CHW", 2, "local"], ["SP", 2, 0, 1, [1, 1, 1, 1], 1], ["SP", 2, 5, 64, [2, 1, 8, 2], 1], ["SP", 2, 10, 14, [1, 14, 1, 1], 1], ["SP", 2, 15, 14, [1, 2, 1, 1], 1], ["SP", 2, 20, 16, [2, 2, 1, 1], 1], ["SP", 2, 25, 512, [4, 8], 1], ["RE", 2, [0, 5, 10, 15, 20, 1, 6, 11, 16, 21, 2, 7, 12, 17, 22, 25, 26, 3, 8, 13, 18, 23, 27, 4, 9, 14, 19, 24]], ["FSP", 3, 0, 3, 3], ["FSP", 3, 4, 4, 3], ["FSP", 3, 8, 5, 3], ["FSP", 3, 12, 6, 3], ["FSP", 3, 16, 7, 3], ["RE", 3, [0, 4, 8, 12, 16, 1, 5, 9, 13, 17, 2, 6, 10, 14, 18, 3, 7, 11, 15, 19]], ["CA", 2, 3, 14], ["CHR", 1, "shared", [2]], ["CA", 2, 3, 15], ["CHR", 0, "shared", [3]], ["CA", 1, 4, 15], ["FU", 10, [0, 1, 2, 3, 4]], ["SP", 10, 0, 802816, [32], 1], ["AN", 10, 0, 5], ["AN", 10, 1, 6], ["FU", 5, [0, 1, 2, 3, 4]], ["AN", 5, 0, 5], ["FU", 5, [1, 2, 3, 4, 5]], ["AN", 5, 1, 4], ["FU", 5, [2, 3, 4, 5, 6]], ["AN", 5, 2, 6], ["FU", 3, [0, 1, 2]], ["SP", 3, 0, 512, [1], 1], ["AN", 3, 1, 2], ["FFSP", 3, 0, [7, 6, 5, 4, 3], 1, 1], ["AN", 3, 1, 6], ["FU", 1, [0, 1, 2, 3]], ["SP", 1, 0, 32, [1], 1], ["AN", 1, 1, 2], ["FFSP", 1, 0, [7, 6, 5, 4, 3], 1, 1], ["AN", 1, 1, 6], ["PR", 4, 0, "auto_unroll_max_step$1024"]]]], "r": [[0.000164975, 0.000165018, 0.000165259, 0.000164978, 0.000165065, 0.000165065, 0.000165059, 0.000165127, 0.000165409, 0.000165237], 0, 199.172, 1654018029], "v": "v0.6"}
{"i": [["[\"fused_conv1x1_bn_relu_stride\", 1, 28, 28, 512, 16, 64, 2]", "cuda -keys=cuda,gpu -max_num_threads=1024 -model=unknown -thread_warp_size=32", [-1, 16, 64, 49152, 2147483647, 1024, 8, 32], "", 0, []], [[], [["CI", 6], ["CI", 4], ["CHW", 2, "local"], ["SP", 2, 0, 1, [1, 1, 1, 1], 1], ["SP", 2, 5, 64, [1, 16, 1, 1], 1], ["SP", 2, 10, 14, [1, 7, 2, 1], 1], ["SP", 2, 15, 14, [1, 1, 1, 1], 1], ["SP", 2, 20, 16, [1, 2, 4, 2], 1], ["SP", 2, 25, 512, [4, 4], 1], ["RE", 2, [0, 5, 10, 15, 20, 1, 6, 11, 16, 21, 2, 7, 12, 17, 22, 25, 26, 3, 8, 13, 18, 23, 27, 4, 9, 14, 19, 24]], ["FSP", 3, 0, 3, 3], ["FSP", 3, 4, 4, 3], ["FSP", 3, 8, 5, 3], ["FSP", 3, 12, 6, 3], ["FSP", 3, 16, 7, 3], ["RE", 3, [0, 4, 8, 12, 16, 1, 5, 9, 13, 17, 2, 6, 10, 14, 18, 3, 7, 11, 15, 19]], ["CA", 2, 3, 14], ["CHR", 1, "shared", [2]], ["CA", 2, 3, 15], ["CHR", 0, "shared", [3]], ["CA", 1, 4, 15], ["FU", 10, [0, 1, 2, 3, 4]], ["SP", 10, 0, 802816, [32], 1], ["AN", 10, 0, 5], ["AN", 10, 1, 6], ["FU", 5, [0, 1, 2, 3, 4]], ["AN", 5, 0, 5], ["FU", 5, [1, 2, 3, 4, 5]], ["AN", 5, 1, 4], ["FU", 5, [2, 3, 4, 5, 6]], ["AN", 5, 2, 6], ["FU", 3, [0, 1, 2]], ["SP", 3, 0, 64, [1], 1], ["AN", 3, 1, 2], ["FFSP", 3, 0, [7, 6, 5, 4, 3], 1, 1], ["AN", 3, 1, 6], ["FU", 1, [0, 1, 2, 3]], ["SP", 1, 0, 48, [1], 1], ["AN", 1, 1, 2], ["FFSP", 1, 0, [7, 6, 5, 4, 3], 1, 1], ["AN", 1, 1, 6], ["PR", 4, 0, "auto_unroll_max_step$16"]]]], "r": [[0.00012535, 0.00012536, 0.000125346, 0.000125358, 0.000125356, 0.000125354, 0.000125354, 0.000125345, 0.000125371, 0.000125354], 0, 190.957, 1654018024], "v": "v0.6"}
{"i": [["[\"fused_conv1x1_bn_relu_stride\", 1, 28, 28, 512, 16, 64, 2]", "cuda -keys=cuda,gpu -max_num_threads=1024 -model=unknown -thread_warp_size=32", [-1, 16, 64, 49152, 2147483647, 1024, 8, 32], "", 0, []], [[], [["CI", 6], ["CI", 4], ["CHW", 2, "local"], ["SP", 2, 0, 1, [1, 1, 1, 1], 1], ["SP", 2, 5, 64, [1, 8, 2, 1], 1], ["SP", 2, 10, 14, [7, 1, 1, 2], 1], ["SP", 2, 15, 14, [2, 1, 1, 1], 1], ["SP", 2, 20, 16, [1, 2, 1, 1], 1], ["SP", 2, 25, 512, [2, 2], 1], ["RE", 2, [0, 5, 10, 15, 20, 1, 6, 11, 16, 21, 2, 7, 12, 17, 22, 25, 26, 3, 8, 13, 18, 23, 27, 4, 9, 14, 19, 24]], ["FSP", 3, 0, 3, 3], ["FSP", 3, 4, 4, 3], ["FSP", 3, 8, 5, 3], ["FSP", 3, 12, 6, 3], ["FSP", 3, 16, 7, 3], ["RE", 3, [0, 4, 8, 12, 16, 1, 5, 9, 13, 17, 2, 6, 10, 14, 18, 3, 7, 11, 15, 19]], ["CA", 2, 3, 14], ["CHR", 1, "shared", [2]], ["CA", 2, 3, 15], ["CHR", 0, "shared", [3]], ["CA", 1, 4, 15], ["FU", 10, [0, 1, 2, 3, 4]], ["SP", 10, 0, 802816, [32], 1], ["AN", 10, 0, 5], ["AN", 10, 1, 6], ["FU", 5, [0, 1, 2, 3, 4]], ["AN", 5, 0, 5], ["FU", 5, [1, 2, 3, 4, 5]], ["AN", 5, 1, 4], ["FU", 5, [2, 3, 4, 5, 6]], ["AN", 5, 2, 6], ["FU", 3, [0, 1, 2]], ["SP", 3, 0, 256, [1], 1], ["AN", 3, 1, 2], ["FFSP", 3, 0, [7, 6, 5, 4, 3], 1, 1], ["AN", 3, 1, 6], ["FU", 1, [0, 1, 2, 3]], ["SP", 1, 0, 12, [1], 1], ["AN", 1, 1, 2], ["FFSP", 1, 0, [7, 6, 5, 4, 3], 1, 1], ["AN", 1, 1, 6], ["PR", 4, 0, "auto_unroll_max_step$16"]]]], "r": [[0.000348813, 0.000348837, 0.000348852, 0.000348865, 0.00034883, 0.000348807, 0.000348789, 0.000348846, 0.000348836, 0.000348859], 0, 185.493, 1654018018], "v": "v0.6"}
