python/models/resnext/kernel_configs/resnext_imagenet_50_fused_conv3x3_4_28_28_8_8_3.log
{"i": [["[\"fused_conv3x3\", 4, 28, 28, 8, 8, 3, 3, 64]", "cuda -keys=cuda,gpu -max_num_threads=1024 -model=unknown -thread_warp_size=32", [-1, 16, 64, 49152, 2147483647, 1024, 8, 32], "", 0, []], [[], [["CHW", 3, "local"], ["SP", 3, 0, 4, [1, 1, 2, 1], 1], ["SP", 3, 5, 64, [4, 1, 2, 1], 1], ["SP", 3, 10, 28, [2, 1, 14, 1], 1], ["SP", 3, 15, 28, [1, 2, 1, 1], 1], ["SP", 3, 20, 8, [1, 4, 1, 1], 1], ["SP", 3, 25, 8, [1, 1], 1], ["SP", 3, 28, 3, [3, 1], 1], ["SP", 3, 31, 3, [1, 3], 1], ["RE", 3, [0, 5, 10, 15, 20, 1, 6, 11, 16, 21, 2, 7, 12, 17, 22, 25, 28, 31, 26, 29, 32, 3, 8, 13, 18, 23, 27, 30, 33, 4, 9, 14, 19, 24]], ["FSP", 4, 0, 1, 3], ["FSP", 4, 4, 2, 3], ["FSP", 4, 8, 3, 3], ["FSP", 4, 12, 4, 3], ["FSP", 4, 16, 5, 3], ["RE", 4, [0, 4, 8, 12, 16, 1, 5, 9, 13, 17, 2, 6, 10, 14, 18, 3, 7, 11, 15, 19]], ["CA", 3, 4, 14], ["CHR", 2, "shared", [3]], ["CA", 3, 4, 17], ["CHR", 1, "shared", [4]], ["CA", 2, 5, 17], ["CI", 1], ["FU", 6, [0, 1, 2, 3, 4]], ["AN", 6, 0, 5], ["FU", 6, [1, 2, 3, 4, 5]], ["AN", 6, 1, 4], ["FU", 6, [2, 3, 4, 5, 6]], ["AN", 6, 2, 6], ["FU", 4, [0, 1, 2, 3, 4]], ["SP", 4, 0, 18, [1], 1], ["AN", 4, 1, 2], ["FFSP", 4, 0, [5, 4, 3, 2, 1], 1, 1], ["AN", 4, 1, 6], ["FU", 2, [0, 1, 2, 3, 4]], ["SP", 2, 0, 192, [1], 1], ["AN", 2, 1, 2], ["FFSP", 2, 0, [5, 4, 3, 2, 1], 1, 1], ["AN", 2, 1, 6], ["PR", 5, 0, "auto_unroll_max_step$0"]]]], "r": [[0.000598629, 0.000598657, 0.000598354], 0, 3.67393, 1661891309], "v": "v0.6"}
{"i": [["[\"fused_conv3x3\", 4, 28, 28, 8, 8, 3, 3, 64]", "cuda -keys=cuda,gpu -max_num_threads=1024 -model=unknown -thread_warp_size=32", [-1, 16, 64, 49152, 2147483647, 1024, 8, 32], "", 0, []], [[], [["CHW", 3, "local"], ["SP", 3, 0, 4, [1, 1, 1, 2], 1], ["SP", 3, 5, 64, [1, 8, 2, 1], 1], ["SP", 3, 10, 28, [1, 7, 1, 1], 1], ["SP", 3, 15, 28, [1, 2, 2, 1], 1], ["SP", 3, 20, 8, [4, 1, 1, 1], 1], ["SP", 3, 25, 8, [8, 1], 1], ["SP", 3, 28, 3, [1, 1], 1], ["SP", 3, 31, 3, [1, 1], 1], ["RE", 3, [0, 5, 10, 15, 20, 1, 6, 11, 16, 21, 2, 7, 12, 17, 22, 25, 28, 31, 26, 29, 32, 3, 8, 13, 18, 23, 27, 30, 33, 4, 9, 14, 19, 24]], ["FSP", 4, 0, 1, 3], ["FSP", 4, 4, 2, 3], ["FSP", 4, 8, 3, 3], ["FSP", 4, 12, 4, 3], ["FSP", 4, 16, 5, 3], ["RE", 4, [0, 4, 8, 12, 16, 1, 5, 9, 13, 17, 2, 6, 10, 14, 18, 3, 7, 11, 15, 19]], ["CA", 3, 4, 14], ["CHR", 2, "shared", [3]], ["CA", 3, 4, 17], ["CHR", 1, "shared", [4]], ["CA", 2, 5, 17], ["CI", 1], ["FU", 6, [0, 1, 2, 3, 4]], ["AN", 6, 0, 5], ["FU", 6, [1, 2, 3, 4, 5]], ["AN", 6, 1, 4], ["FU", 6, [2, 3, 4, 5, 6]], ["AN", 6, 2, 6], ["FU", 4, [0, 1, 2, 3, 4]], ["SP", 4, 0, 16, [1], 1], ["AN", 4, 1, 2], ["FFSP", 4, 0, [5, 4, 3, 2, 1], 1, 1], ["AN", 4, 1, 6], ["FU", 2, [0, 1, 2, 3, 4]], ["SP", 2, 0, 64, [2], 1], ["AN", 2, 1, 2], ["FFSP", 2, 0, [5, 4, 3, 2, 1], 1, 1], ["AN", 2, 1, 6], ["PR", 5, 0, "auto_unroll_max_step$64"]]]], "r": [[0.000105136, 0.000104859, 0.000104551], 0, 8.42872, 1661891311], "v": "v0.6"}
{"i": [["[\"fused_conv3x3\", 4, 28, 28, 8, 8, 3, 3, 64]", "cuda -keys=cuda,gpu -max_num_threads=1024 -model=unknown -thread_warp_size=32", [-1, 16, 64, 49152, 2147483647, 1024, 8, 32], "", 0, []], [[], [["CHW", 3, "local"], ["SP", 3, 0, 4, [1, 2, 1, 1], 1], ["SP", 3, 5, 64, [2, 1, 1, 1], 1], ["SP", 3, 10, 28, [2, 1, 1, 2], 1], ["SP", 3, 15, 28, [2, 14, 1, 1], 1], ["SP", 3, 20, 8, [1, 1, 2, 2], 1], ["SP", 3, 25, 8, [1, 2], 1], ["SP", 3, 28, 3, [3, 1], 1], ["SP", 3, 31, 3, [1, 3], 1], ["RE", 3, [0, 5, 10, 15, 20, 1, 6, 11, 16, 21, 2, 7, 12, 17, 22, 25, 28, 31, 26, 29, 32, 3, 8, 13, 18, 23, 27, 30, 33, 4, 9, 14, 19, 24]], ["FSP", 4, 0, 1, 3], ["FSP", 4, 4, 2, 3], ["FSP", 4, 8, 3, 3], ["FSP", 4, 12, 4, 3], ["FSP", 4, 16, 5, 3], ["RE", 4, [0, 4, 8, 12, 16, 1, 5, 9, 13, 17, 2, 6, 10, 14, 18, 3, 7, 11, 15, 19]], ["CA", 3, 4, 14], ["CHR", 2, "shared", [3]], ["CA", 3, 4, 17], ["CHR", 1, "shared", [4]], ["CA", 2, 5, 17], ["CI", 1], ["FU", 6, [0, 1, 2, 3, 4]], ["AN", 6, 0, 5], ["FU", 6, [1, 2, 3, 4, 5]], ["AN", 6, 1, 4], ["FU", 6, [2, 3, 4, 5, 6]], ["AN", 6, 2, 6], ["FU", 4, [0, 1, 2, 3, 4]], ["SP", 4, 0, 36, [1], 1], ["AN", 4, 1, 2], ["FFSP", 4, 0, [5, 4, 3, 2, 1], 1, 1], ["AN", 4, 1, 6], ["FU", 2, [0, 1, 2, 3, 4]], ["SP", 2, 0, 24, [1], 1], ["AN", 2, 1, 2], ["FFSP", 2, 0, [5, 4, 3, 2, 1], 1, 1], ["AN", 2, 1, 6], ["PR", 5, 0, "auto_unroll_max_step$64"]]]], "r": [[6.02506e-05, 6.02873e-05, 6.03653e-05], 0, 5.19164, 1661891310], "v": "v0.6"}
{"i": [["[\"fused_conv3x3\", 4, 28, 28, 8, 8, 3, 3, 64]", "cuda -keys=cuda,gpu -max_num_threads=1024 -model=unknown -thread_warp_size=32", [-1, 16, 64, 49152, 2147483647, 1024, 8, 32], "", 0, []], [[], [["CHW", 3, "local"], ["SP", 3, 0, 4, [1, 2, 2, 1], 1], ["SP", 3, 5, 64, [8, 1, 1, 1], 1], ["SP", 3, 10, 28, [1, 2, 14, 1], 1], ["SP", 3, 15, 28, [1, 1, 1, 1], 1], ["SP", 3, 20, 8, [1, 8, 1, 1], 1], ["SP", 3, 25, 8, [1, 1], 1], ["SP", 3, 28, 3, [3, 1], 1], ["SP", 3, 31, 3, [1, 3], 1], ["RE", 3, [0, 5, 10, 15, 20, 1, 6, 11, 16, 21, 2, 7, 12, 17, 22, 25, 28, 31, 26, 29, 32, 3, 8, 13, 18, 23, 27, 30, 33, 4, 9, 14, 19, 24]], ["FSP", 4, 0, 1, 3], ["FSP", 4, 4, 2, 3], ["FSP", 4, 8, 3, 3], ["FSP", 4, 12, 4, 3], ["FSP", 4, 16, 5, 3], ["RE", 4, [0, 4, 8, 12, 16, 1, 5, 9, 13, 17, 2, 6, 10, 14, 18, 3, 7, 11, 15, 19]], ["CA", 3, 4, 14], ["CHR", 2, "shared", [3]], ["CA", 3, 4, 17], ["CHR", 1, "shared", [4]], ["CA", 2, 5, 17], ["CI", 1], ["FU", 6, [0, 1, 2, 3, 4]], ["AN", 6, 0, 5], ["FU", 6, [1, 2, 3, 4, 5]], ["AN", 6, 1, 4], ["FU", 6, [2, 3, 4, 5, 6]], ["AN", 6, 2, 6], ["FU", 4, [0, 1, 2, 3, 4]], ["SP", 4, 0, 18, [2], 1], ["AN", 4, 1, 2], ["FFSP", 4, 0, [5, 4, 3, 2, 1], 1, 1], ["AN", 4, 1, 6], ["FU", 2, [0, 1, 2, 3, 4]], ["SP", 2, 0, 192, [1], 1], ["AN", 2, 1, 2], ["FFSP", 2, 0, [5, 4, 3, 2, 1], 1, 1], ["AN", 2, 1, 6], ["PR", 5, 0, "auto_unroll_max_step$0"]]]], "r": [[0.000367166, 0.000367025, 0.000366928], 0, 6.37776, 1661891312], "v": "v0.6"}
{"i": [["[\"fused_conv3x3\", 4, 28, 28, 8, 8, 3, 3, 64]", "cuda -keys=cuda,gpu -max_num_threads=1024 -model=unknown -thread_warp_size=32", [-1, 16, 64, 49152, 2147483647, 1024, 8, 32], "", 0, []], [[], [["CHW", 3, "local"], ["SP", 3, 0, 4, [1, 1, 1, 2], 1], ["SP", 3, 5, 64, [1, 8, 1, 4], 1], ["SP", 3, 10, 28, [2, 2, 1, 1], 1], ["SP", 3, 15, 28, [1, 1, 2, 1], 1], ["SP", 3, 20, 8, [2, 4, 1, 1], 1], ["SP", 3, 25, 8, [1, 2], 1], ["SP", 3, 28, 3, [1, 3], 1], ["SP", 3, 31, 3, [3, 1], 1], ["RE", 3, [0, 5, 10, 15, 20, 1, 6, 11, 16, 21, 2, 7, 12, 17, 22, 25, 28, 31, 26, 29, 32, 3, 8, 13, 18, 23, 27, 30, 33, 4, 9, 14, 19, 24]], ["FSP", 4, 0, 1, 3], ["FSP", 4, 4, 2, 3], ["FSP", 4, 8, 3, 3], ["FSP", 4, 12, 4, 3], ["FSP", 4, 16, 5, 3], ["RE", 4, [0, 4, 8, 12, 16, 1, 5, 9, 13, 17, 2, 6, 10, 14, 18, 3, 7, 11, 15, 19]], ["CA", 3, 4, 14], ["CHR", 2, "shared", [3]], ["CA", 3, 4, 17], ["CHR", 1, "shared", [4]], ["CA", 2, 5, 17], ["CI", 1], ["FU", 6, [0, 1, 2, 3, 4]], ["AN", 6, 0, 5], ["FU", 6, [1, 2, 3, 4, 5]], ["AN", 6, 1, 4], ["FU", 6, [2, 3, 4, 5, 6]], ["AN", 6, 2, 6], ["FU", 4, [0, 1, 2, 3, 4]], ["SP", 4, 0, 72, [1], 1], ["AN", 4, 1, 2], ["FFSP", 4, 0, [5, 4, 3, 2, 1], 1, 1], ["AN", 4, 1, 6], ["FU", 2, [0, 1, 2, 3, 4]], ["SP", 2, 0, 192, [1], 1], ["AN", 2, 1, 2], ["FFSP", 2, 0, [5, 4, 3, 2, 1], 1, 1], ["AN", 2, 1, 6], ["PR", 5, 0, "auto_unroll_max_step$1024"]]]], "r": [[5.46864e-05, 5.45364e-05, 5.44593e-05], 0, 9.20826, 1661891311], "v": "v0.6"}
{"i": [["[\"fused_conv3x3\", 4, 28, 28, 8, 8, 3, 3, 64]", "cuda -keys=cuda,gpu -max_num_threads=1024 -model=unknown -thread_warp_size=32", [-1, 16, 64, 49152, 2147483647, 1024, 8, 32], "", 0, []], [[], [["CHW", 3, "local"], ["SP", 3, 0, 4, [1, 1, 1, 1], 1], ["SP", 3, 5, 64, [2, 4, 1, 1], 1], ["SP", 3, 10, 28, [2, 1, 1, 14], 1], ["SP", 3, 15, 28, [1, 7, 1, 1], 1], ["SP", 3, 20, 8, [1, 1, 1, 8], 1], ["SP", 3, 25, 8, [1, 1], 1], ["SP", 3, 28, 3, [1, 3], 1], ["SP", 3, 31, 3, [3, 1], 1], ["RE", 3, [0, 5, 10, 15, 20, 1, 6, 11, 16, 21, 2, 7, 12, 17, 22, 25, 28, 31, 26, 29, 32, 3, 8, 13, 18, 23, 27, 30, 33, 4, 9, 14, 19, 24]], ["FSP", 4, 0, 1, 3], ["FSP", 4, 4, 2, 3], ["FSP", 4, 8, 3, 3], ["FSP", 4, 12, 4, 3], ["FSP", 4, 16, 5, 3], ["RE", 4, [0, 4, 8, 12, 16, 1, 5, 9, 13, 17, 2, 6, 10, 14, 18, 3, 7, 11, 15, 19]], ["CA", 3, 4, 14], ["CHR", 2, "shared", [3]], ["CA", 3, 4, 17], ["CHR", 1, "shared", [4]], ["CA", 2, 5, 17], ["CI", 1], ["FU", 6, [0, 1, 2, 3, 4]], ["AN", 6, 0, 5], ["FU", 6, [1, 2, 3, 4, 5]], ["AN", 6, 1, 4], ["FU", 6, [2, 3, 4, 5, 6]], ["AN", 6, 2, 6], ["FU", 4, [0, 1, 2, 3, 4]], ["SP", 4, 0, 9, [1], 1], ["AN", 4, 1, 2], ["FFSP", 4, 0, [5, 4, 3, 2, 1], 1, 1], ["AN", 4, 1, 6], ["FU", 2, [0, 1, 2, 3, 4]], ["SP", 2, 0, 48, [1], 1], ["AN", 2, 1, 2], ["FFSP", 2, 0, [5, 4, 3, 2, 1], 1, 1], ["AN", 2, 1, 6], ["PR", 5, 0, "auto_unroll_max_step$1024"]]]], "r": [[0.000882161, 0.000880943, 0.000878841], 0, 12.5164, 1661891315], "v": "v0.6"}
{"i": [["[\"fused_conv3x3\", 4, 28, 28, 8, 8, 3, 3, 64]", "cuda -keys=cuda,gpu -max_num_threads=1024 -model=unknown -thread_warp_size=32", [-1, 16, 64, 49152, 2147483647, 1024, 8, 32], "", 0, []], [[], [["CHW", 3, "local"], ["SP", 3, 0, 4, [1, 1, 1, 2], 1], ["SP", 3, 5, 64, [1, 8, 1, 4], 1], ["SP", 3, 10, 28, [2, 2, 1, 1], 1], ["SP", 3, 15, 28, [1, 1, 1, 2], 1], ["SP", 3, 20, 8, [1, 8, 1, 1], 1], ["SP", 3, 25, 8, [1, 2], 1], ["SP", 3, 28, 3, [1, 1], 1], ["SP", 3, 31, 3, [3, 1], 1], ["RE", 3, [0, 5, 10, 15, 20, 1, 6, 11, 16, 21, 2, 7, 12, 17, 22, 25, 28, 31, 26, 29, 32, 3, 8, 13, 18, 23, 27, 30, 33, 4, 9, 14, 19, 24]], ["FSP", 4, 0, 1, 3], ["FSP", 4, 4, 2, 3], ["FSP", 4, 8, 3, 3], ["FSP", 4, 12, 4, 3], ["FSP", 4, 16, 5, 3], ["RE", 4, [0, 4, 8, 12, 16, 1, 5, 9, 13, 17, 2, 6, 10, 14, 18, 3, 7, 11, 15, 19]], ["CA", 3, 4, 14], ["CHR", 2, "shared", [3]], ["CA", 3, 4, 17], ["CHR", 1, "shared", [4]], ["CA", 2, 5, 17], ["CI", 1], ["FU", 6, [0, 1, 2, 3, 4]], ["AN", 6, 0, 5], ["FU", 6, [1, 2, 3, 4, 5]], ["AN", 6, 1, 4], ["FU", 6, [2, 3, 4, 5, 6]], ["AN", 6, 2, 6], ["FU", 4, [0, 1, 2, 3, 4]], ["SP", 4, 0, 72, [1], 1], ["AN", 4, 1, 2], ["FFSP", 4, 0, [5, 4, 3, 2, 1], 1, 1], ["AN", 4, 1, 6], ["FU", 2, [0, 1, 2, 3, 4]], ["SP", 2, 0, 192, [1], 1], ["AN", 2, 1, 2], ["FFSP", 2, 0, [5, 4, 3, 2, 1], 1, 1], ["AN", 2, 1, 6], ["PR", 5, 0, "auto_unroll_max_step$512"]]]], "r": [[3.71815e-05, 3.76724e-05, 3.77888e-05], 0, 7.03463, 1661891313], "v": "v0.6"}
{"i": [["[\"fused_conv3x3\", 4, 28, 28, 8, 8, 3, 3, 64]", "cuda -keys=cuda,gpu -max_num_threads=1024 -model=unknown -thread_warp_size=32", [-1, 16, 64, 49152, 2147483647, 1024, 8, 32], "", 0, []], [[], [["CHW", 3, "local"], ["SP", 3, 0, 4, [1, 2, 1, 1], 1], ["SP", 3, 5, 64, [2, 2, 1, 1], 1], ["SP", 3, 10, 28, [1, 1, 1, 2], 1], ["SP", 3, 15, 28, [1, 14, 1, 1], 1], ["SP", 3, 20, 8, [2, 1, 2, 1], 1], ["SP", 3, 25, 8, [2, 2], 1], ["SP", 3, 28, 3, [3, 1], 1], ["SP", 3, 31, 3, [1, 3], 1], ["RE", 3, [0, 5, 10, 15, 20, 1, 6, 11, 16, 21, 2, 7, 12, 17, 22, 25, 28, 31, 26, 29, 32, 3, 8, 13, 18, 23, 27, 30, 33, 4, 9, 14, 19, 24]], ["FSP", 4, 0, 1, 3], ["FSP", 4, 4, 2, 3], ["FSP", 4, 8, 3, 3], ["FSP", 4, 12, 4, 3], ["FSP", 4, 16, 5, 3], ["RE", 4, [0, 4, 8, 12, 16, 1, 5, 9, 13, 17, 2, 6, 10, 14, 18, 3, 7, 11, 15, 19]], ["CA", 3, 4, 14], ["CHR", 2, "shared", [3]], ["CA", 3, 4, 17], ["CHR", 1, "shared", [4]], ["CA", 2, 5, 17], ["CI", 1], ["FU", 6, [0, 1, 2, 3, 4]], ["AN", 6, 0, 5], ["FU", 6, [1, 2, 3, 4, 5]], ["AN", 6, 1, 4], ["FU", 6, [2, 3, 4, 5, 6]], ["AN", 6, 2, 6], ["FU", 4, [0, 1, 2, 3, 4]], ["SP", 4, 0, 24, [1], 1], ["AN", 4, 1, 2], ["FFSP", 4, 0, [5, 4, 3, 2, 1], 1, 1], ["AN", 4, 1, 6], ["FU", 2, [0, 1, 2, 3, 4]], ["SP", 2, 0, 48, [48], 1], ["AN", 2, 1, 2], ["FFSP", 2, 0, [5, 4, 3, 2, 1], 1, 1], ["AN", 2, 1, 6], ["PR", 5, 0, "auto_unroll_max_step$16"]]]], "r": [[0.000124829, 0.000124411, 0.000124234], 0, 7.06656, 1661891314], "v": "v0.6"}
{"i": [["[\"fused_conv3x3\", 4, 28, 28, 8, 8, 3, 3, 64]", "cuda -keys=cuda,gpu -max_num_threads=1024 -model=unknown -thread_warp_size=32", [-1, 16, 64, 49152, 2147483647, 1024, 8, 32], "", 0, []], [[], [["CHW", 3, "local"], ["SP", 3, 0, 4, [1, 2, 1, 1], 1], ["SP", 3, 5, 64, [1, 8, 1, 1], 1], ["SP", 3, 10, 28, [1, 2, 7, 2], 1], ["SP", 3, 15, 28, [1, 1, 1, 2], 1], ["SP", 3, 20, 8, [1, 2, 1, 1], 1], ["SP", 3, 25, 8, [4, 2], 1], ["SP", 3, 28, 3, [1, 1], 1], ["SP", 3, 31, 3, [3, 1], 1], ["RE", 3, [0, 5, 10, 15, 20, 1, 6, 11, 16, 21, 2, 7, 12, 17, 22, 25, 28, 31, 26, 29, 32, 3, 8, 13, 18, 23, 27, 30, 33, 4, 9, 14, 19, 24]], ["FSP", 4, 0, 1, 3], ["FSP", 4, 4, 2, 3], ["FSP", 4, 8, 3, 3], ["FSP", 4, 12, 4, 3], ["FSP", 4, 16, 5, 3], ["RE", 4, [0, 4, 8, 12, 16, 1, 5, 9, 13, 17, 2, 6, 10, 14, 18, 3, 7, 11, 15, 19]], ["CA", 3, 4, 14], ["CHR", 2, "shared", [3]], ["CA", 3, 4, 17], ["CHR", 1, "shared", [4]], ["CA", 2, 5, 17], ["CI", 1], ["FU", 6, [0, 1, 2, 3, 4]], ["AN", 6, 0, 5], ["FU", 6, [1, 2, 3, 4, 5]], ["AN", 6, 1, 4], ["FU", 6, [2, 3, 4, 5, 6]], ["AN", 6, 2, 6], ["FU", 4, [0, 1, 2, 3, 4]], ["SP", 4, 0, 24, [1], 1], ["AN", 4, 1, 2], ["FFSP", 4, 0, [5, 4, 3, 2, 1], 1, 1], ["AN", 4, 1, 6], ["FU", 2, [0, 1, 2, 3, 4]], ["SP", 2, 0, 112, [1], 1], ["AN", 2, 1, 2], ["FFSP", 2, 0, [5, 4, 3, 2, 1], 1, 1], ["AN", 2, 1, 6], ["PR", 5, 0, "auto_unroll_max_step$64"]]]], "r": [[0.00012593, 0.000125917, 0.000125869], 0, 8.89278, 1661891316], "v": "v0.6"}
{"i": [["[\"fused_conv3x3\", 4, 28, 28, 8, 8, 3, 3, 64]", "cuda -keys=cuda,gpu -max_num_threads=1024 -model=unknown -thread_warp_size=32", [-1, 16, 64, 49152, 2147483647, 1024, 8, 32], "", 0, []], [[], [["CHW", 3, "local"], ["SP", 3, 0, 4, [1, 2, 1, 1], 1], ["SP", 3, 5, 64, [2, 2, 2, 2], 1], ["SP", 3, 10, 28, [1, 1, 2, 2], 1], ["SP", 3, 15, 28, [1, 4, 1, 7], 1], ["SP", 3, 20, 8, [1, 2, 1, 4], 1], ["SP", 3, 25, 8, [1, 1], 1], ["SP", 3, 28, 3, [1, 1], 1], ["SP", 3, 31, 3, [3, 1], 1], ["RE", 3, [0, 5, 10, 15, 20, 1, 6, 11, 16, 21, 2, 7, 12, 17, 22, 25, 28, 31, 26, 29, 32, 3, 8, 13, 18, 23, 27, 30, 33, 4, 9, 14, 19, 24]], ["FSP", 4, 0, 1, 3], ["FSP", 4, 4, 2, 3], ["FSP", 4, 8, 3, 3], ["FSP", 4, 12, 4, 3], ["FSP", 4, 16, 5, 3], ["RE", 4, [0, 4, 8, 12, 16, 1, 5, 9, 13, 17, 2, 6, 10, 14, 18, 3, 7, 11, 15, 19]], ["CA", 3, 4, 14], ["CHR", 2, "shared", [3]], ["CA", 3, 4, 17], ["CHR", 1, "shared", [4]], ["CA", 2, 5, 17], ["CI", 1], ["FU", 6, [0, 1, 2, 3, 4]], ["AN", 6, 0, 5], ["FU", 6, [1, 2, 3, 4, 5]], ["AN", 6, 1, 4], ["FU", 6, [2, 3, 4, 5, 6]], ["AN", 6, 2, 6], ["FU", 4, [0, 1, 2, 3, 4]], ["SP", 4, 0, 96, [1], 1], ["AN", 4, 1, 2], ["FFSP", 4, 0, [5, 4, 3, 2, 1], 1, 1], ["AN", 4, 1, 6], ["FU", 2, [0, 1, 2, 3, 4]], ["SP", 2, 0, 224, [1], 1], ["AN", 2, 1, 2], ["FFSP", 2, 0, [5, 4, 3, 2, 1], 1, 1], ["AN", 2, 1, 6], ["PR", 5, 0, "auto_unroll_max_step$1024"]]]], "r": [[0.00166823, 0.00165516, 0.00165864], 0, 22.6717, 1661891319], "v": "v0.6"}
{"i": [["[\"fused_conv3x3\", 4, 28, 28, 8, 8, 3, 3, 64]", "cuda -keys=cuda,gpu -max_num_threads=1024 -model=unknown -thread_warp_size=32", [-1, 16, 64, 49152, 2147483647, 1024, 8, 32], "", 0, []], [[], [["CHW", 3, "local"], ["SP", 3, 0, 4, [1, 2, 1, 1], 1], ["SP", 3, 5, 64, [1, 2, 1, 8], 1], ["SP", 3, 10, 28, [1, 1, 1, 7], 1], ["SP", 3, 15, 28, [1, 7, 1, 1], 1], ["SP", 3, 20, 8, [1, 2, 1, 2], 1], ["SP", 3, 25, 8, [1, 1], 1], ["SP", 3, 28, 3, [3, 1], 1], ["SP", 3, 31, 3, [1, 1], 1], ["RE", 3, [0, 5, 10, 15, 20, 1, 6, 11, 16, 21, 2, 7, 12, 17, 22, 25, 28, 31, 26, 29, 32, 3, 8, 13, 18, 23, 27, 30, 33, 4, 9, 14, 19, 24]], ["FSP", 4, 0, 1, 3], ["FSP", 4, 4, 2, 3], ["FSP", 4, 8, 3, 3], ["FSP", 4, 12, 4, 3], ["FSP", 4, 16, 5, 3], ["RE", 4, [0, 4, 8, 12, 16, 1, 5, 9, 13, 17, 2, 6, 10, 14, 18, 3, 7, 11, 15, 19]], ["CA", 3, 4, 14], ["CHR", 2, "shared", [3]], ["CA", 3, 4, 17], ["CHR", 1, "shared", [4]], ["CA", 2, 5, 17], ["CI", 1], ["FU", 6, [0, 1, 2, 3, 4]], ["AN", 6, 0, 5], ["FU", 6, [1, 2, 3, 4, 5]], ["AN", 6, 1, 4], ["FU", 6, [2, 3, 4, 5, 6]], ["AN", 6, 2, 6], ["FU", 4, [0, 1, 2, 3, 4]], ["SP", 4, 0, 2, [1], 1], ["AN", 4, 1, 2], ["FFSP", 4, 0, [5, 4, 3, 2, 1], 1, 1], ["AN", 4, 1, 6], ["FU", 2, [0, 1, 2, 3, 4]], ["SP", 2, 0, 7, [1], 1], ["AN", 2, 1, 2], ["FFSP", 2, 0, [5, 4, 3, 2, 1], 1, 1], ["AN", 2, 1, 6], ["PR", 5, 0, "auto_unroll_max_step$0"]]]], "r": [[0.000426149, 0.000426014, 0.000425547], 0, 9.66166, 1661891316], "v": "v0.6"}
{"i": [["[\"fused_conv3x3\", 4, 28, 28, 8, 8, 3, 3, 64]", "cuda -keys=cuda,gpu -max_num_threads=1024 -model=unknown -thread_warp_size=32", [-1, 16, 64, 49152, 2147483647, 1024, 8, 32], "", 0, []], [[], [["CHW", 3, "local"], ["SP", 3, 0, 4, [1, 2, 1, 2], 1], ["SP", 3, 5, 64, [1, 64, 1, 1], 1], ["SP", 3, 10, 28, [1, 2, 1, 1], 1], ["SP", 3, 15, 28, [1, 2, 1, 2], 1], ["SP", 3, 20, 8, [4, 1, 1, 1], 1], ["SP", 3, 25, 8, [1, 1], 1], ["SP", 3, 28, 3, [3, 1], 1], ["SP", 3, 31, 3, [1, 1], 1], ["RE", 3, [0, 5, 10, 15, 20, 1, 6, 11, 16, 21, 2, 7, 12, 17, 22, 25, 28, 31, 26, 29, 32, 3, 8, 13, 18, 23, 27, 30, 33, 4, 9, 14, 19, 24]], ["FSP", 4, 0, 1, 3], ["FSP", 4, 4, 2, 3], ["FSP", 4, 8, 3, 3], ["FSP", 4, 12, 4, 3], ["FSP", 4, 16, 5, 3], ["RE", 4, [0, 4, 8, 12, 16, 1, 5, 9, 13, 17, 2, 6, 10, 14, 18, 3, 7, 11, 15, 19]], ["CA", 3, 4, 14], ["CHR", 2, "shared", [3]], ["CA", 3, 4, 17], ["CHR", 1, "shared", [4]], ["CA", 2, 5, 17], ["CI", 1], ["FU", 6, [0, 1, 2, 3, 4]], ["AN", 6, 0, 5], ["FU", 6, [1, 2, 3, 4, 5]], ["AN", 6, 1, 4], ["FU", 6, [2, 3, 4, 5, 6]], ["AN", 6, 2, 6], ["FU", 4, [0, 1, 2, 3, 4]], ["SP", 4, 0, 3, [1], 1], ["AN", 4, 1, 2], ["FFSP", 4, 0, [5, 4, 3, 2, 1], 1, 1], ["AN", 4, 1, 6], ["FU", 2, [0, 1, 2, 3, 4]], ["SP", 2, 0, 48, [1], 1], ["AN", 2, 1, 2], ["FFSP", 2, 0, [5, 4, 3, 2, 1], 1, 1], ["AN", 2, 1, 6], ["PR", 5, 0, "auto_unroll_max_step$16"]]]], "r": [[0.000214331, 0.000214243, 0.000213579], 0, 10.813, 1661891317], "v": "v0.6"}
{"i": [["[\"fused_conv3x3\", 4, 28, 28, 8, 8, 3, 3, 64]", "cuda -keys=cuda,gpu -max_num_threads=1024 -model=unknown -thread_warp_size=32", [-1, 16, 64, 49152, 2147483647, 1024, 8, 32], "", 0, []], [[], [["CHW", 3, "local"], ["SP", 3, 0, 4, [1, 2, 2, 1], 1], ["SP", 3, 5, 64, [1, 1, 2, 1], 1], ["SP", 3, 10, 28, [1, 2, 14, 1], 1], ["SP", 3, 15, 28, [1, 2, 1, 1], 1], ["SP", 3, 20, 8, [1, 4, 1, 1], 1], ["SP", 3, 25, 8, [1, 1], 1], ["SP", 3, 28, 3, [3, 1], 1], ["SP", 3, 31, 3, [1, 3], 1], ["RE", 3, [0, 5, 10, 15, 20, 1, 6, 11, 16, 21, 2, 7, 12, 17, 22, 25, 28, 31, 26, 29, 32, 3, 8, 13, 18, 23, 27, 30, 33, 4, 9, 14, 19, 24]], ["FSP", 4, 0, 1, 3], ["FSP", 4, 4, 2, 3], ["FSP", 4, 8, 3, 3], ["FSP", 4, 12, 4, 3], ["FSP", 4, 16, 5, 3], ["RE", 4, [0, 4, 8, 12, 16, 1, 5, 9, 13, 17, 2, 6, 10, 14, 18, 3, 7, 11, 15, 19]], ["CA", 3, 4, 14], ["CHR", 2, "shared", [3]], ["CA", 3, 4, 17], ["CHR", 1, "shared", [4]], ["CA", 2, 5, 17], ["CI", 1], ["FU", 6, [0, 1, 2, 3, 4]], ["AN", 6, 0, 5], ["FU", 6, [1, 2, 3, 4, 5]], ["AN", 6, 1, 4], ["FU", 6, [2, 3, 4, 5, 6]], ["AN", 6, 2, 6], ["FU", 4, [0, 1, 2, 3, 4]], ["SP", 4, 0, 18, [1], 1], ["AN", 4, 1, 2], ["FFSP", 4, 0, [5, 4, 3, 2, 1], 1, 1], ["AN", 4, 1, 6], ["FU", 2, [0, 1, 2, 3, 4]], ["SP", 2, 0, 192, [1], 1], ["AN", 2, 1, 2], ["FFSP", 2, 0, [5, 4, 3, 2, 1], 1, 1], ["AN", 2, 1, 6], ["PR", 5, 0, "auto_unroll_max_step$0"]]]], "r": [[7.34229e-05, 7.34038e-05, 7.33742e-05], 0, 10.6211, 1661891318], "v": "v0.6"}
{"i": [["[\"fused_conv3x3\", 4, 28, 28, 8, 8, 3, 3, 64]", "cuda -keys=cuda,gpu -max_num_threads=1024 -model=unknown -thread_warp_size=32", [-1, 16, 64, 49152, 2147483647, 1024, 8, 32], "", 0, []], [[], [["CHW", 3, "local"], ["SP", 3, 0, 4, [1, 1, 1, 1], 1], ["SP", 3, 5, 64, [1, 4, 4, 1], 1], ["SP", 3, 10, 28, [2, 7, 2, 1], 1], ["SP", 3, 15, 28, [1, 1, 14, 1], 1], ["SP", 3, 20, 8, [1, 2, 2, 2], 1], ["SP", 3, 25, 8, [1, 1], 1], ["SP", 3, 28, 3, [1, 1], 1], ["SP", 3, 31, 3, [3, 1], 1], ["RE", 3, [0, 5, 10, 15, 20, 1, 6, 11, 16, 21, 2, 7, 12, 17, 22, 25, 28, 31, 26, 29, 32, 3, 8, 13, 18, 23, 27, 30, 33, 4, 9, 14, 19, 24]], ["FSP", 4, 0, 1, 3], ["FSP", 4, 4, 2, 3], ["FSP", 4, 8, 3, 3], ["FSP", 4, 12, 4, 3], ["FSP", 4, 16, 5, 3], ["RE", 4, [0, 4, 8, 12, 16, 1, 5, 9, 13, 17, 2, 6, 10, 14, 18, 3, 7, 11, 15, 19]], ["CA", 3, 4, 14], ["CHR", 2, "shared", [3]], ["CA", 3, 4, 17], ["CHR", 1, "shared", [4]], ["CA", 2, 5, 17], ["CI", 1], ["FU", 6, [0, 1, 2, 3, 4]], ["AN", 6, 0, 5], ["FU", 6, [1, 2, 3, 4, 5]], ["AN", 6, 1, 4], ["FU", 6, [2, 3, 4, 5, 6]], ["AN", 6, 2, 6], ["FU", 4, [0, 1, 2, 3, 4]], ["SP", 4, 0, 48, [1], 1], ["AN", 4, 1, 2], ["FFSP", 4, 0, [5, 4, 3, 2, 1], 1, 1], ["AN", 4, 1, 6], ["FU", 2, [0, 1, 2, 3, 4]], ["SP", 2, 0, 112, [1], 1], ["AN", 2, 1, 2], ["FFSP", 2, 0, [5, 4, 3, 2, 1], 1, 1], ["AN", 2, 1, 6], ["PR", 5, 0, "auto_unroll_max_step$16"]]]], "r": [[0.000684878, 0.000683913, 0.000683617], 0, 14.4923, 1661891320], "v": "v0.6"}
{"i": [["[\"fused_conv3x3\", 4, 28, 28, 8, 8, 3, 3, 64]", "cuda -keys=cuda,gpu -max_num_threads=1024 -model=unknown -thread_warp_size=32", [-1, 16, 64, 49152, 2147483647, 1024, 8, 32], "", 0, []], [[], [["CHW", 3, "local"], ["SP", 3, 0, 4, [1, 4, 1, 1], 1], ["SP", 3, 5, 64, [1, 32, 1, 1], 1], ["SP", 3, 10, 28, [1, 1, 2, 2], 1], ["SP", 3, 15, 28, [2, 1, 2, 1], 1], ["SP", 3, 20, 8, [1, 1, 1, 2], 1], ["SP", 3, 25, 8, [2, 1], 1], ["SP", 3, 28, 3, [1, 3], 1], ["SP", 3, 31, 3, [3, 1], 1], ["RE", 3, [0, 5, 10, 15, 20, 1, 6, 11, 16, 21, 2, 7, 12, 17, 22, 25, 28, 31, 26, 29, 32, 3, 8, 13, 18, 23, 27, 30, 33, 4, 9, 14, 19, 24]], ["FSP", 4, 0, 1, 3], ["FSP", 4, 4, 2, 3], ["FSP", 4, 8, 3, 3], ["FSP", 4, 12, 4, 3], ["FSP", 4, 16, 5, 3], ["RE", 4, [0, 4, 8, 12, 16, 1, 5, 9, 13, 17, 2, 6, 10, 14, 18, 3, 7, 11, 15, 19]], ["CA", 3, 4, 14], ["CHR", 2, "shared", [3]], ["CA", 3, 4, 17], ["CHR", 1, "shared", [4]], ["CA", 2, 5, 17], ["CI", 1], ["FU", 6, [0, 1, 2, 3, 4]], ["AN", 6, 0, 5], ["FU", 6, [1, 2, 3, 4, 5]], ["AN", 6, 1, 4], ["FU", 6, [2, 3, 4, 5, 6]], ["AN", 6, 2, 6], ["FU", 4, [0, 1, 2, 3, 4]], ["SP", 4, 0, 12, [4], 1], ["AN", 4, 1, 2], ["FFSP", 4, 0, [5, 4, 3, 2, 1], 1, 1], ["AN", 4, 1, 6], ["FU", 2, [0, 1, 2, 3, 4]], ["SP", 2, 0, 16, [1], 1], ["AN", 2, 1, 2], ["FFSP", 2, 0, [5, 4, 3, 2, 1], 1, 1], ["AN", 2, 1, 6], ["PR", 5, 0, "auto_unroll_max_step$16"]]]], "r": [[0.000234381, 0.000233082, 0.000233], 0, 14.5778, 1661891322], "v": "v0.6"}
{"i": [["[\"fused_conv3x3\", 4, 28, 28, 8, 8, 3, 3, 64]", "cuda -keys=cuda,gpu -max_num_threads=1024 -model=unknown -thread_warp_size=32", [-1, 16, 64, 49152, 2147483647, 1024, 8, 32], "", 0, []], [[], [["CHW", 3, "local"], ["SP", 3, 0, 4, [1, 2, 1, 1], 1], ["SP", 3, 5, 64, [1, 8, 8, 1], 1], ["SP", 3, 10, 28, [1, 2, 1, 2], 1], ["SP", 3, 15, 28, [1, 1, 1, 4], 1], ["SP", 3, 20, 8, [1, 2, 2, 2], 1], ["SP", 3, 25, 8, [1, 1], 1], ["SP", 3, 28, 3, [1, 3], 1], ["SP", 3, 31, 3, [1, 3], 1], ["RE", 3, [0, 5, 10, 15, 20, 1, 6, 11, 16, 21, 2, 7, 12, 17, 22, 25, 28, 31, 26, 29, 32, 3, 8, 13, 18, 23, 27, 30, 33, 4, 9, 14, 19, 24]], ["FSP", 4, 0, 1, 3], ["FSP", 4, 4, 2, 3], ["FSP", 4, 8, 3, 3], ["FSP", 4, 12, 4, 3], ["FSP", 4, 16, 5, 3], ["RE", 4, [0, 4, 8, 12, 16, 1, 5, 9, 13, 17, 2, 6, 10, 14, 18, 3, 7, 11, 15, 19]], ["CA", 3, 4, 14], ["CHR", 2, "shared", [3]], ["CA", 3, 4, 17], ["CHR", 1, "shared", [4]], ["CA", 2, 5, 17], ["CI", 1], ["FU", 6, [0, 1, 2, 3, 4]], ["AN", 6, 0, 5], ["FU", 6, [1, 2, 3, 4, 5]], ["AN", 6, 1, 4], ["FU", 6, [2, 3, 4, 5, 6]], ["AN", 6, 2, 6], ["FU", 4, [0, 1, 2, 3, 4]], ["SP", 4, 0, 32, [1], 1], ["AN", 4, 1, 2], ["FFSP", 4, 0, [5, 4, 3, 2, 1], 1, 1], ["AN", 4, 1, 6], ["FU", 2, [0, 1, 2, 3, 4]], ["SP", 2, 0, 32, [1], 1], ["AN", 2, 1, 2], ["FFSP", 2, 0, [5, 4, 3, 2, 1], 1, 1], ["AN", 2, 1, 6], ["PR", 5, 0, "auto_unroll_max_step$512"]]]], "r": [[0.000114127, 0.000113829, 0.000113509], 0, 20.5821, 1661891323], "v": "v0.6"}
{"i": [["[\"fused_conv3x3\", 4, 28, 28, 8, 8, 3, 3, 64]", "cuda -keys=cuda,gpu -max_num_threads=1024 -model=unknown -thread_warp_size=32", [-1, 16, 64, 49152, 2147483647, 1024, 8, 32], "", 0, []], [[], [["CHW", 3, "local"], ["SP", 3, 0, 4, [1, 4, 1, 1], 1], ["SP", 3, 5, 64, [2, 4, 1, 1], 1], ["SP", 3, 10, 28, [2, 1, 1, 14], 1], ["SP", 3, 15, 28, [1, 7, 1, 1], 1], ["SP", 3, 20, 8, [1, 1, 1, 1], 1], ["SP", 3, 25, 8, [1, 1], 1], ["SP", 3, 28, 3, [1, 3], 1], ["SP", 3, 31, 3, [3, 1], 1], ["RE", 3, [0, 5, 10, 15, 20, 1, 6, 11, 16, 21, 2, 7, 12, 17, 22, 25, 28, 31, 26, 29, 32, 3, 8, 13, 18, 23, 27, 30, 33, 4, 9, 14, 19, 24]], ["FSP", 4, 0, 1, 3], ["FSP", 4, 4, 2, 3], ["FSP", 4, 8, 3, 3], ["FSP", 4, 12, 4, 3], ["FSP", 4, 16, 5, 3], ["RE", 4, [0, 4, 8, 12, 16, 1, 5, 9, 13, 17, 2, 6, 10, 14, 18, 3, 7, 11, 15, 19]], ["CA", 3, 4, 14], ["CHR", 2, "shared", [3]], ["CA", 3, 4, 17], ["CHR", 1, "shared", [4]], ["CA", 2, 5, 17], ["CI", 1], ["FU", 6, [0, 1, 2, 3, 4]], ["AN", 6, 0, 5], ["FU", 6, [1, 2, 3, 4, 5]], ["AN", 6, 1, 4], ["FU", 6, [2, 3, 4, 5, 6]], ["AN", 6, 2, 6], ["FU", 4, [0, 1, 2, 3, 4]], ["SP", 4, 0, 9, [1], 1], ["AN", 4, 1, 2], ["FFSP", 4, 0, [5, 4, 3, 2, 1], 1, 1], ["AN", 4, 1, 6], ["FU", 2, [0, 1, 2, 3, 4]], ["SP", 2, 0, 48, [1], 1], ["AN", 2, 1, 2], ["FFSP", 2, 0, [5, 4, 3, 2, 1], 1, 1], ["AN", 2, 1, 6], ["PR", 5, 0, "auto_unroll_max_step$1024"]]]], "r": [[0.000157494, 0.000157514, 0.00015732], 0, 21.6487, 1661891325], "v": "v0.6"}
{"i": [["[\"fused_conv3x3\", 4, 28, 28, 8, 8, 3, 3, 64]", "cuda -keys=cuda,gpu -max_num_threads=1024 -model=unknown -thread_warp_size=32", [-1, 16, 64, 49152, 2147483647, 1024, 8, 32], "", 0, []], [[], [["CHW", 3, "local"], ["SP", 3, 0, 4, [1, 2, 1, 1], 1], ["SP", 3, 5, 64, [1, 4, 2, 2], 1], ["SP", 3, 10, 28, [1, 7, 1, 1], 1], ["SP", 3, 15, 28, [1, 2, 1, 2], 1], ["SP", 3, 20, 8, [2, 1, 2, 2], 1], ["SP", 3, 25, 8, [4, 2], 1], ["SP", 3, 28, 3, [1, 1], 1], ["SP", 3, 31, 3, [1, 3], 1], ["RE", 3, [0, 5, 10, 15, 20, 1, 6, 11, 16, 21, 2, 7, 12, 17, 22, 25, 28, 31, 26, 29, 32, 3, 8, 13, 18, 23, 27, 30, 33, 4, 9, 14, 19, 24]], ["FSP", 4, 0, 1, 3], ["FSP", 4, 4, 2, 3], ["FSP", 4, 8, 3, 3], ["FSP", 4, 12, 4, 3], ["FSP", 4, 16, 5, 3], ["RE", 4, [0, 4, 8, 12, 16, 1, 5, 9, 13, 17, 2, 6, 10, 14, 18, 3, 7, 11, 15, 19]], ["CA", 3, 4, 14], ["CHR", 2, "shared", [3]], ["CA", 3, 4, 17], ["CHR", 1, "shared", [4]], ["CA", 2, 5, 17], ["CI", 1], ["FU", 6, [0, 1, 2, 3, 4]], ["AN", 6, 0, 5], ["FU", 6, [1, 2, 3, 4, 5]], ["AN", 6, 1, 4], ["FU", 6, [2, 3, 4, 5, 6]], ["AN", 6, 2, 6], ["FU", 4, [0, 1, 2, 3, 4]], ["SP", 4, 0, 384, [1], 1], ["AN", 4, 1, 2], ["FFSP", 4, 0, [5, 4, 3, 2, 1], 1, 1], ["AN", 4, 1, 6], ["FU", 2, [0, 1, 2, 3, 4]], ["SP", 2, 0, 64, [32], 1], ["AN", 2, 1, 2], ["FFSP", 2, 0, [5, 4, 3, 2, 1], 1, 1], ["AN", 2, 1, 6], ["PR", 5, 0, "auto_unroll_max_step$1024"]]]], "r": [[0.000143814, 0.000143759, 0.000143723], 0, 23.6652, 1661891328], "v": "v0.6"}
{"i": [["[\"fused_conv3x3\", 4, 28, 28, 8, 8, 3, 3, 64]", "cuda -keys=cuda,gpu -max_num_threads=1024 -model=unknown -thread_warp_size=32", [-1, 16, 64, 49152, 2147483647, 1024, 8, 32], "", 0, []], [[], [["CHW", 3, "local"], ["SP", 3, 0, 4, [1, 1, 2, 2], 1], ["SP", 3, 5, 64, [8, 2, 2, 1], 1], ["SP", 3, 10, 28, [1, 4, 1, 1], 1], ["SP", 3, 15, 28, [1, 2, 1, 2], 1], ["SP", 3, 20, 8, [1, 2, 1, 2], 1], ["SP", 3, 25, 8, [2, 1], 1], ["SP", 3, 28, 3, [1, 3], 1], ["SP", 3, 31, 3, [3, 1], 1], ["RE", 3, [0, 5, 10, 15, 20, 1, 6, 11, 16, 21, 2, 7, 12, 17, 22, 25, 28, 31, 26, 29, 32, 3, 8, 13, 18, 23, 27, 30, 33, 4, 9, 14, 19, 24]], ["FSP", 4, 0, 1, 3], ["FSP", 4, 4, 2, 3], ["FSP", 4, 8, 3, 3], ["FSP", 4, 12, 4, 3], ["FSP", 4, 16, 5, 3], ["RE", 4, [0, 4, 8, 12, 16, 1, 5, 9, 13, 17, 2, 6, 10, 14, 18, 3, 7, 11, 15, 19]], ["CA", 3, 4, 14], ["CHR", 2, "shared", [3]], ["CA", 3, 4, 17], ["CHR", 1, "shared", [4]], ["CA", 2, 5, 17], ["CI", 1], ["FU", 6, [0, 1, 2, 3, 4]], ["AN", 6, 0, 5], ["FU", 6, [1, 2, 3, 4, 5]], ["AN", 6, 1, 4], ["FU", 6, [2, 3, 4, 5, 6]], ["AN", 6, 2, 6], ["FU", 4, [0, 1, 2, 3, 4]], ["SP", 4, 0, 72, [1], 1], ["AN", 4, 1, 2], ["FFSP", 4, 0, [5, 4, 3, 2, 1], 1, 1], ["AN", 4, 1, 6], ["FU", 2, [0, 1, 2, 3, 4]], ["SP", 2, 0, 192, [1], 1], ["AN", 2, 1, 2], ["FFSP", 2, 0, [5, 4, 3, 2, 1], 1, 1], ["AN", 2, 1, 6], ["PR", 5, 0, "auto_unroll_max_step$0"]]]], "r": [[0.000429325, 0.000429069, 0.000428154], 0, 17.2507, 1661891324], "v": "v0.6"}
{"i": [["[\"fused_conv3x3\", 4, 28, 28, 8, 8, 3, 3, 64]", "cuda -keys=cuda,gpu -max_num_threads=1024 -model=unknown -thread_warp_size=32", [-1, 16, 64, 49152, 2147483647, 1024, 8, 32], "", 0, []], [[], [["CHW", 3, "local"], ["SP", 3, 0, 4, [1, 1, 1, 1], 1], ["SP", 3, 5, 64, [2, 1, 4, 1], 1], ["SP", 3, 10, 28, [2, 2, 1, 7], 1], ["SP", 3, 15, 28, [1, 1, 1, 1], 1], ["SP", 3, 20, 8, [1, 4, 1, 1], 1], ["SP", 3, 25, 8, [2, 1], 1], ["SP", 3, 28, 3, [1, 3], 1], ["SP", 3, 31, 3, [1, 3], 1], ["RE", 3, [0, 5, 10, 15, 20, 1, 6, 11, 16, 21, 2, 7, 12, 17, 22, 25, 28, 31, 26, 29, 32, 3, 8, 13, 18, 23, 27, 30, 33, 4, 9, 14, 19, 24]], ["FSP", 4, 0, 1, 3], ["FSP", 4, 4, 2, 3], ["FSP", 4, 8, 3, 3], ["FSP", 4, 12, 4, 3], ["FSP", 4, 16, 5, 3], ["RE", 4, [0, 4, 8, 12, 16, 1, 5, 9, 13, 17, 2, 6, 10, 14, 18, 3, 7, 11, 15, 19]], ["CA", 3, 4, 14], ["CHR", 2, "shared", [3]], ["CA", 3, 4, 17], ["CHR", 1, "shared", [4]], ["CA", 2, 5, 17], ["CI", 1], ["FU", 6, [0, 1, 2, 3, 4]], ["AN", 6, 0, 5], ["FU", 6, [1, 2, 3, 4, 5]], ["AN", 6, 1, 4], ["FU", 6, [2, 3, 4, 5, 6]], ["AN", 6, 2, 6], ["FU", 4, [0, 1, 2, 3, 4]], ["SP", 4, 0, 18, [1], 1], ["AN", 4, 1, 2], ["FFSP", 4, 0, [5, 4, 3, 2, 1], 1, 1], ["AN", 4, 1, 6], ["FU", 2, [0, 1, 2, 3, 4]], ["SP", 2, 0, 162, [1], 1], ["AN", 2, 1, 2], ["FFSP", 2, 0, [5, 4, 3, 2, 1], 1, 1], ["AN", 2, 1, 6], ["PR", 5, 0, "auto_unroll_max_step$16"]]]], "r": [[0.000399593, 0.000399533, 0.000398877], 0, 14.1532, 1661891321], "v": "v0.6"}
{"i": [["[\"fused_conv3x3\", 4, 28, 28, 8, 8, 3, 3, 64]", "cuda -keys=cuda,gpu -max_num_threads=1024 -model=unknown -thread_warp_size=32", [-1, 16, 64, 49152, 2147483647, 1024, 8, 32], "", 0, []], [[], [["CHW", 3, "local"], ["SP", 3, 0, 4, [1, 1, 1, 1], 1], ["SP", 3, 5, 64, [1, 16, 1, 2], 1], ["SP", 3, 10, 28, [1, 2, 1, 2], 1], ["SP", 3, 15, 28, [2, 2, 1, 1], 1], ["SP", 3, 20, 8, [1, 4, 1, 1], 1], ["SP", 3, 25, 8, [2, 2], 1], ["SP", 3, 28, 3, [1, 3], 1], ["SP", 3, 31, 3, [1, 3], 1], ["RE", 3, [0, 5, 10, 15, 20, 1, 6, 11, 16, 21, 2, 7, 12, 17, 22, 25, 28, 31, 26, 29, 32, 3, 8, 13, 18, 23, 27, 30, 33, 4, 9, 14, 19, 24]], ["FSP", 4, 0, 1, 3], ["FSP", 4, 4, 2, 3], ["FSP", 4, 8, 3, 3], ["FSP", 4, 12, 4, 3], ["FSP", 4, 16, 5, 3], ["RE", 4, [0, 4, 8, 12, 16, 1, 5, 9, 13, 17, 2, 6, 10, 14, 18, 3, 7, 11, 15, 19]], ["CA", 3, 4, 14], ["CHR", 2, "shared", [3]], ["CA", 3, 4, 17], ["CHR", 1, "shared", [4]], ["CA", 2, 5, 17], ["CI", 1], ["FU", 6, [0, 1, 2, 3, 4]], ["AN", 6, 0, 5], ["FU", 6, [1, 2, 3, 4, 5]], ["AN", 6, 1, 4], ["FU", 6, [2, 3, 4, 5, 6]], ["AN", 6, 2, 6], ["FU", 4, [0, 1, 2, 3, 4]], ["SP", 4, 0, 24, [1], 1], ["AN", 4, 1, 2], ["FFSP", 4, 0, [5, 4, 3, 2, 1], 1, 1], ["AN", 4, 1, 6], ["FU", 2, [0, 1, 2, 3, 4]], ["SP", 2, 0, 96, [1], 1], ["AN", 2, 1, 2], ["FFSP", 2, 0, [5, 4, 3, 2, 1], 1, 1], ["AN", 2, 1, 6], ["PR", 5, 0, "auto_unroll_max_step$1024"]]]], "r": [[7.39007e-05, 7.38805e-05, 7.36951e-05], 0, 22.597, 1661891326], "v": "v0.6"}
{"i": [["[\"fused_conv3x3\", 4, 28, 28, 8, 8, 3, 3, 64]", "cuda -keys=cuda,gpu -max_num_threads=1024 -model=unknown -thread_warp_size=32", [-1, 16, 64, 49152, 2147483647, 1024, 8, 32], "", 0, []], [[], [["CHW", 3, "local"], ["SP", 3, 0, 4, [1, 2, 1, 1], 1], ["SP", 3, 5, 64, [1, 8, 1, 1], 1], ["SP", 3, 10, 28, [1, 2, 7, 1], 1], ["SP", 3, 15, 28, [1, 1, 1, 2], 1], ["SP", 3, 20, 8, [1, 2, 1, 1], 1], ["SP", 3, 25, 8, [4, 2], 1], ["SP", 3, 28, 3, [1, 1], 1], ["SP", 3, 31, 3, [3, 1], 1], ["RE", 3, [0, 5, 10, 15, 20, 1, 6, 11, 16, 21, 2, 7, 12, 17, 22, 25, 28, 31, 26, 29, 32, 3, 8, 13, 18, 23, 27, 30, 33, 4, 9, 14, 19, 24]], ["FSP", 4, 0, 1, 3], ["FSP", 4, 4, 2, 3], ["FSP", 4, 8, 3, 3], ["FSP", 4, 12, 4, 3], ["FSP", 4, 16, 5, 3], ["RE", 4, [0, 4, 8, 12, 16, 1, 5, 9, 13, 17, 2, 6, 10, 14, 18, 3, 7, 11, 15, 19]], ["CA", 3, 4, 14], ["CHR", 2, "shared", [3]], ["CA", 3, 4, 17], ["CHR", 1, "shared", [4]], ["CA", 2, 5, 17], ["CI", 1], ["FU", 6, [0, 1, 2, 3, 4]], ["AN", 6, 0, 5], ["FU", 6, [1, 2, 3, 4, 5]], ["AN", 6, 1, 4], ["FU", 6, [2, 3, 4, 5, 6]], ["AN", 6, 2, 6], ["FU", 4, [0, 1, 2, 3, 4]], ["SP", 4, 0, 24, [1], 1], ["AN", 4, 1, 2], ["FFSP", 4, 0, [5, 4, 3, 2, 1], 1, 1], ["AN", 4, 1, 6], ["FU", 2, [0, 1, 2, 3, 4]], ["SP", 2, 0, 112, [1], 1], ["AN", 2, 1, 2], ["FFSP", 2, 0, [5, 4, 3, 2, 1], 1, 1], ["AN", 2, 1, 6], ["PR", 5, 0, "auto_unroll_max_step$1024"]]]], "r": [[6.25449e-05, 6.24515e-05, 6.24798e-05], 0, 24.0539, 1661891329], "v": "v0.6"}
{"i": [["[\"fused_conv3x3\", 4, 28, 28, 8, 8, 3, 3, 64]", "cuda -keys=cuda,gpu -max_num_threads=1024 -model=unknown -thread_warp_size=32", [-1, 16, 64, 49152, 2147483647, 1024, 8, 32], "", 0, []], [[], [["CHW", 3, "local"], ["SP", 3, 0, 4, [1, 2, 2, 1], 1], ["SP", 3, 5, 64, [1, 2, 2, 4], 1], ["SP", 3, 10, 28, [1, 1, 1, 4], 1], ["SP", 3, 15, 28, [1, 7, 1, 1], 1], ["SP", 3, 20, 8, [2, 2, 1, 2], 1], ["SP", 3, 25, 8, [2, 2], 1], ["SP", 3, 28, 3, [1, 1], 1], ["SP", 3, 31, 3, [1, 3], 1], ["RE", 3, [0, 5, 10, 15, 20, 1, 6, 11, 16, 21, 2, 7, 12, 17, 22, 25, 28, 31, 26, 29, 32, 3, 8, 13, 18, 23, 27, 30, 33, 4, 9, 14, 19, 24]], ["FSP", 4, 0, 1, 3], ["FSP", 4, 4, 2, 3], ["FSP", 4, 8, 3, 3], ["FSP", 4, 12, 4, 3], ["FSP", 4, 16, 5, 3], ["RE", 4, [0, 4, 8, 12, 16, 1, 5, 9, 13, 17, 2, 6, 10, 14, 18, 3, 7, 11, 15, 19]], ["CA", 3, 4, 14], ["CHR", 2, "shared", [3]], ["CA", 3, 4, 17], ["CHR", 1, "shared", [4]], ["CA", 2, 5, 17], ["CI", 1], ["FU", 6, [0, 1, 2, 3, 4]], ["AN", 6, 0, 5], ["FU", 6, [1, 2, 3, 4, 5]], ["AN", 6, 1, 4], ["FU", 6, [2, 3, 4, 5, 6]], ["AN", 6, 2, 6], ["FU", 4, [0, 1, 2, 3, 4]], ["SP", 4, 0, 192, [1], 1], ["AN", 4, 1, 2], ["FFSP", 4, 0, [5, 4, 3, 2, 1], 1, 1], ["AN", 4, 1, 6], ["FU", 2, [0, 1, 2, 3, 4]], ["SP", 2, 0, 128, [2], 1], ["AN", 2, 1, 2], ["FFSP", 2, 0, [5, 4, 3, 2, 1], 1, 1], ["AN", 2, 1, 6], ["PR", 5, 0, "auto_unroll_max_step$64"]]]], "r": [[0.000186657, 0.000186727, 0.000186041], 0, 19.1829, 1661891325], "v": "v0.6"}
{"i": [["[\"fused_conv3x3\", 4, 28, 28, 8, 8, 3, 3, 64]", "cuda -keys=cuda,gpu -max_num_threads=1024 -model=unknown -thread_warp_size=32", [-1, 16, 64, 49152, 2147483647, 1024, 8, 32], "", 0, []], [[], [["CHW", 3, "local"], ["SP", 3, 0, 4, [1, 1, 1, 2], 1], ["SP", 3, 5, 64, [1, 16, 1, 2], 1], ["SP", 3, 10, 28, [2, 2, 1, 1], 1], ["SP", 3, 15, 28, [1, 1, 2, 1], 1], ["SP", 3, 20, 8, [2, 4, 1, 1], 1], ["SP", 3, 25, 8, [1, 2], 1], ["SP", 3, 28, 3, [1, 3], 1], ["SP", 3, 31, 3, [3, 1], 1], ["RE", 3, [0, 5, 10, 15, 20, 1, 6, 11, 16, 21, 2, 7, 12, 17, 22, 25, 28, 31, 26, 29, 32, 3, 8, 13, 18, 23, 27, 30, 33, 4, 9, 14, 19, 24]], ["FSP", 4, 0, 1, 3], ["FSP", 4, 4, 2, 3], ["FSP", 4, 8, 3, 3], ["FSP", 4, 12, 4, 3], ["FSP", 4, 16, 5, 3], ["RE", 4, [0, 4, 8, 12, 16, 1, 5, 9, 13, 17, 2, 6, 10, 14, 18, 3, 7, 11, 15, 19]], ["CA", 3, 4, 14], ["CHR", 2, "shared", [3]], ["CA", 3, 4, 17], ["CHR", 1, "shared", [4]], ["CA", 2, 5, 17], ["CI", 1], ["FU", 6, [0, 1, 2, 3, 4]], ["AN", 6, 0, 5], ["FU", 6, [1, 2, 3, 4, 5]], ["AN", 6, 1, 4], ["FU", 6, [2, 3, 4, 5, 6]], ["AN", 6, 2, 6], ["FU", 4, [0, 1, 2, 3, 4]], ["SP", 4, 0, 72, [1], 1], ["AN", 4, 1, 2], ["FFSP", 4, 0, [5, 4, 3, 2, 1], 1, 1], ["AN", 4, 1, 6], ["FU", 2, [0, 1, 2, 3, 4]], ["SP", 2, 0, 192, [1], 1], ["AN", 2, 1, 2], ["FFSP", 2, 0, [5, 4, 3, 2, 1], 1, 1], ["AN", 2, 1, 6], ["PR", 5, 0, "auto_unroll_max_step$1024"]]]], "r": [[4.32983e-05, 4.32831e-05, 4.33119e-05], 0, 22.1291, 1661891327], "v": "v0.6"}
{"i": [["[\"fused_conv3x3\", 4, 28, 28, 8, 8, 3, 3, 64]", "cuda -keys=cuda,gpu -max_num_threads=1024 -model=unknown -thread_warp_size=32", [-1, 16, 64, 49152, 2147483647, 1024, 8, 32], "", 0, []], [[], [["CHW", 3, "local"], ["SP", 3, 0, 4, [2, 1, 1, 1], 1], ["SP", 3, 5, 64, [1, 8, 1, 8], 1], ["SP", 3, 10, 28, [1, 2, 1, 2], 1], ["SP", 3, 15, 28, [2, 1, 7, 1], 1], ["SP", 3, 20, 8, [2, 1, 1, 4], 1], ["SP", 3, 25, 8, [1, 1], 1], ["SP", 3, 28, 3, [1, 1], 1], ["SP", 3, 31, 3, [1, 3], 1], ["RE", 3, [0, 5, 10, 15, 20, 1, 6, 11, 16, 21, 2, 7, 12, 17, 22, 25, 28, 31, 26, 29, 32, 3, 8, 13, 18, 23, 27, 30, 33, 4, 9, 14, 19, 24]], ["FSP", 4, 0, 1, 3], ["FSP", 4, 4, 2, 3], ["FSP", 4, 8, 3, 3], ["FSP", 4, 12, 4, 3], ["FSP", 4, 16, 5, 3], ["RE", 4, [0, 4, 8, 12, 16, 1, 5, 9, 13, 17, 2, 6, 10, 14, 18, 3, 7, 11, 15, 19]], ["CA", 3, 4, 14], ["CHR", 2, "shared", [3]], ["CA", 3, 4, 17], ["CHR", 1, "shared", [4]], ["CA", 2, 5, 17], ["CI", 1], ["FU", 6, [0, 1, 2, 3, 4]], ["AN", 6, 0, 5], ["FU", 6, [1, 2, 3, 4, 5]], ["AN", 6, 1, 4], ["FU", 6, [2, 3, 4, 5, 6]], ["AN", 6, 2, 6], ["FU", 4, [0, 1, 2, 3, 4]], ["SP", 4, 0, 6, [1], 1], ["AN", 4, 1, 2], ["FFSP", 4, 0, [5, 4, 3, 2, 1], 1, 1], ["AN", 4, 1, 6], ["FU", 2, [0, 1, 2, 3, 4]], ["SP", 2, 0, 28, [1], 1], ["AN", 2, 1, 2], ["FFSP", 2, 0, [5, 4, 3, 2, 1], 1, 1], ["AN", 2, 1, 6], ["PR", 5, 0, "auto_unroll_max_step$0"]]]], "r": [[0.00494901, 0.00496037, 0.00494826], 0, 23.1888, 1661891329], "v": "v0.6"}
{"i": [["[\"fused_conv3x3\", 4, 28, 28, 8, 8, 3, 3, 64]", "cuda -keys=cuda,gpu -max_num_threads=1024 -model=unknown -thread_warp_size=32", [-1, 16, 64, 49152, 2147483647, 1024, 8, 32], "", 0, []], [[], [["CHW", 3, "local"], ["SP", 3, 0, 4, [1, 2, 1, 1], 1], ["SP", 3, 5, 64, [1, 2, 1, 2], 1], ["SP", 3, 10, 28, [1, 4, 1, 1], 1], ["SP", 3, 15, 28, [7, 4, 1, 1], 1], ["SP", 3, 20, 8, [1, 1, 2, 1], 1], ["SP", 3, 25, 8, [1, 8], 1], ["SP", 3, 28, 3, [1, 1], 1], ["SP", 3, 31, 3, [1, 1], 1], ["RE", 3, [0, 5, 10, 15, 20, 1, 6, 11, 16, 21, 2, 7, 12, 17, 22, 25, 28, 31, 26, 29, 32, 3, 8, 13, 18, 23, 27, 30, 33, 4, 9, 14, 19, 24]], ["FSP", 4, 0, 1, 3], ["FSP", 4, 4, 2, 3], ["FSP", 4, 8, 3, 3], ["FSP", 4, 12, 4, 3], ["FSP", 4, 16, 5, 3], ["RE", 4, [0, 4, 8, 12, 16, 1, 5, 9, 13, 17, 2, 6, 10, 14, 18, 3, 7, 11, 15, 19]], ["CA", 3, 4, 14], ["CHR", 2, "shared", [3]], ["CA", 3, 4, 17], ["CHR", 1, "shared", [4]], ["CA", 2, 5, 17], ["CI", 1], ["FU", 6, [0, 1, 2, 3, 4]], ["AN", 6, 0, 5], ["FU", 6, [1, 2, 3, 4, 5]], ["AN", 6, 1, 4], ["FU", 6, [2, 3, 4, 5, 6]], ["AN", 6, 2, 6], ["FU", 4, [0, 1, 2, 3, 4]], ["SP", 4, 0, 16, [1], 1], ["AN", 4, 1, 2], ["FFSP", 4, 0, [5, 4, 3, 2, 1], 1, 1], ["AN", 4, 1, 6], ["FU", 2, [0, 1, 2, 3, 4]], ["SP", 2, 0, 8, [1], 1], ["AN", 2, 1, 2], ["FFSP", 2, 0, [5, 4, 3, 2, 1], 1, 1], ["AN", 2, 1, 6], ["PR", 5, 0, "auto_unroll_max_step$512"]]]], "r": [[9.59893e-05, 9.58618e-05, 9.59172e-05], 0, 29.3484, 1661891333], "v": "v0.6"}
{"i": [["[\"fused_conv3x3\", 4, 28, 28, 8, 8, 3, 3, 64]", "cuda -keys=cuda,gpu -max_num_threads=1024 -model=unknown -thread_warp_size=32", [-1, 16, 64, 49152, 2147483647, 1024, 8, 32], "", 0, []], [[], [["CHW", 3, "local"], ["SP", 3, 0, 4, [1, 2, 1, 1], 1], ["SP", 3, 5, 64, [1, 8, 1, 1], 1], ["SP", 3, 10, 28, [1, 2, 7, 1], 1], ["SP", 3, 15, 28, [1, 1, 1, 2], 1], ["SP", 3, 20, 8, [1, 2, 1, 1], 1], ["SP", 3, 25, 8, [1, 2], 1], ["SP", 3, 28, 3, [1, 1], 1], ["SP", 3, 31, 3, [1, 3], 1], ["RE", 3, [0, 5, 10, 15, 20, 1, 6, 11, 16, 21, 2, 7, 12, 17, 22, 25, 28, 31, 26, 29, 32, 3, 8, 13, 18, 23, 27, 30, 33, 4, 9, 14, 19, 24]], ["FSP", 4, 0, 1, 3], ["FSP", 4, 4, 2, 3], ["FSP", 4, 8, 3, 3], ["FSP", 4, 12, 4, 3], ["FSP", 4, 16, 5, 3], ["RE", 4, [0, 4, 8, 12, 16, 1, 5, 9, 13, 17, 2, 6, 10, 14, 18, 3, 7, 11, 15, 19]], ["CA", 3, 4, 14], ["CHR", 2, "shared", [3]], ["CA", 3, 4, 17], ["CHR", 1, "shared", [4]], ["CA", 2, 5, 17], ["CI", 1], ["FU", 6, [0, 1, 2, 3, 4]], ["AN", 6, 0, 5], ["FU", 6, [1, 2, 3, 4, 5]], ["AN", 6, 1, 4], ["FU", 6, [2, 3, 4, 5, 6]], ["AN", 6, 2, 6], ["FU", 4, [0, 1, 2, 3, 4]], ["SP", 4, 0, 24, [1], 1], ["AN", 4, 1, 2], ["FFSP", 4, 0, [5, 4, 3, 2, 1], 1, 1], ["AN", 4, 1, 6], ["FU", 2, [0, 1, 2, 3, 4]], ["SP", 2, 0, 112, [1], 1], ["AN", 2, 1, 2], ["FFSP", 2, 0, [5, 4, 3, 2, 1], 1, 1], ["AN", 2, 1, 6], ["PR", 5, 0, "auto_unroll_max_step$1024"]]]], "r": [[7.9047e-05, 8.06718e-05, 8.15777e-05], 0, 24.6574, 1661891331], "v": "v0.6"}
{"i": [["[\"fused_conv3x3\", 4, 28, 28, 8, 8, 3, 3, 64]", "cuda -keys=cuda,gpu -max_num_threads=1024 -model=unknown -thread_warp_size=32", [-1, 16, 64, 49152, 2147483647, 1024, 8, 32], "", 0, []], [[], [["CHW", 3, "local"], ["SP", 3, 0, 4, [2, 1, 1, 1], 1], ["SP", 3, 5, 64, [2, 1, 8, 1], 1], ["SP", 3, 10, 28, [1, 1, 2, 1], 1], ["SP", 3, 15, 28, [1, 2, 7, 1], 1], ["SP", 3, 20, 8, [2, 2, 2, 1], 1], ["SP", 3, 25, 8, [1, 1], 1], ["SP", 3, 28, 3, [1, 1], 1], ["SP", 3, 31, 3, [1, 1], 1], ["RE", 3, [0, 5, 10, 15, 20, 1, 6, 11, 16, 21, 2, 7, 12, 17, 22, 25, 28, 31, 26, 29, 32, 3, 8, 13, 18, 23, 27, 30, 33, 4, 9, 14, 19, 24]], ["FSP", 4, 0, 1, 3], ["FSP", 4, 4, 2, 3], ["FSP", 4, 8, 3, 3], ["FSP", 4, 12, 4, 3], ["FSP", 4, 16, 5, 3], ["RE", 4, [0, 4, 8, 12, 16, 1, 5, 9, 13, 17, 2, 6, 10, 14, 18, 3, 7, 11, 15, 19]], ["CA", 3, 4, 14], ["CHR", 2, "shared", [3]], ["CA", 3, 4, 17], ["CHR", 1, "shared", [4]], ["CA", 2, 5, 17], ["CI", 1], ["FU", 6, [0, 1, 2, 3, 4]], ["AN", 6, 0, 5], ["FU", 6, [1, 2, 3, 4, 5]], ["AN", 6, 1, 4], ["FU", 6, [2, 3, 4, 5, 6]], ["AN", 6, 2, 6], ["FU", 4, [0, 1, 2, 3, 4]], ["SP", 4, 0, 16, [1], 1], ["AN", 4, 1, 2], ["FFSP", 4, 0, [5, 4, 3, 2, 1], 1, 1], ["AN", 4, 1, 6], ["FU", 2, [0, 1, 2, 3, 4]], ["SP", 2, 0, 56, [2], 1], ["AN", 2, 1, 2], ["FFSP", 2, 0, [5, 4, 3, 2, 1], 1, 1], ["AN", 2, 1, 6], ["PR", 5, 0, "auto_unroll_max_step$64"]]]], "r": [[0.0133008, 0.0132908, 0.0133004], 0, 27.5926, 1661891334], "v": "v0.6"}
{"i": [["[\"fused_conv3x3\", 4, 28, 28, 8, 8, 3, 3, 64]", "cuda -keys=cuda,gpu -max_num_threads=1024 -model=unknown -thread_warp_size=32", [-1, 16, 64, 49152, 2147483647, 1024, 8, 32], "", 0, []], [[], [["CHW", 3, "local"], ["SP", 3, 0, 4, [1, 1, 1, 1], 1], ["SP", 3, 5, 64, [1, 16, 1, 2], 1], ["SP", 3, 10, 28, [1, 1, 1, 4], 1], ["SP", 3, 15, 28, [2, 2, 1, 1], 1], ["SP", 3, 20, 8, [1, 4, 1, 1], 1], ["SP", 3, 25, 8, [2, 2], 1], ["SP", 3, 28, 3, [1, 3], 1], ["SP", 3, 31, 3, [1, 1], 1], ["RE", 3, [0, 5, 10, 15, 20, 1, 6, 11, 16, 21, 2, 7, 12, 17, 22, 25, 28, 31, 26, 29, 32, 3, 8, 13, 18, 23, 27, 30, 33, 4, 9, 14, 19, 24]], ["FSP", 4, 0, 1, 3], ["FSP", 4, 4, 2, 3], ["FSP", 4, 8, 3, 3], ["FSP", 4, 12, 4, 3], ["FSP", 4, 16, 5, 3], ["RE", 4, [0, 4, 8, 12, 16, 1, 5, 9, 13, 17, 2, 6, 10, 14, 18, 3, 7, 11, 15, 19]], ["CA", 3, 4, 14], ["CHR", 2, "shared", [3]], ["CA", 3, 4, 17], ["CHR", 1, "shared", [4]], ["CA", 2, 5, 17], ["CI", 1], ["FU", 6, [0, 1, 2, 3, 4]], ["AN", 6, 0, 5], ["FU", 6, [1, 2, 3, 4, 5]], ["AN", 6, 1, 4], ["FU", 6, [2, 3, 4, 5, 6]], ["AN", 6, 2, 6], ["FU", 4, [0, 1, 2, 3, 4]], ["SP", 4, 0, 24, [1], 1], ["AN", 4, 1, 2], ["FFSP", 4, 0, [5, 4, 3, 2, 1], 1, 1], ["AN", 4, 1, 6], ["FU", 2, [0, 1, 2, 3, 4]], ["SP", 2, 0, 96, [1], 1], ["AN", 2, 1, 2], ["FFSP", 2, 0, [5, 4, 3, 2, 1], 1, 1], ["AN", 2, 1, 6], ["PR", 5, 0, "auto_unroll_max_step$1024"]]]], "r": [[8.36911e-05, 8.32578e-05, 8.32299e-05], 0, 31.991, 1661891332], "v": "v0.6"}
{"i": [["[\"fused_conv3x3\", 4, 28, 28, 8, 8, 3, 3, 64]", "cuda -keys=cuda,gpu -max_num_threads=1024 -model=unknown -thread_warp_size=32", [-1, 16, 64, 49152, 2147483647, 1024, 8, 32], "", 0, []], [[], [["CHW", 3, "local"], ["SP", 3, 0, 4, [1, 4, 1, 1], 1], ["SP", 3, 5, 64, [1, 2, 1, 2], 1], ["SP", 3, 10, 28, [2, 2, 1, 1], 1], ["SP", 3, 15, 28, [1, 1, 14, 1], 1], ["SP", 3, 20, 8, [1, 4, 2, 1], 1], ["SP", 3, 25, 8, [1, 2], 1], ["SP", 3, 28, 3, [1, 1], 1], ["SP", 3, 31, 3, [1, 3], 1], ["RE", 3, [0, 5, 10, 15, 20, 1, 6, 11, 16, 21, 2, 7, 12, 17, 22, 25, 28, 31, 26, 29, 32, 3, 8, 13, 18, 23, 27, 30, 33, 4, 9, 14, 19, 24]], ["FSP", 4, 0, 1, 3], ["FSP", 4, 4, 2, 3], ["FSP", 4, 8, 3, 3], ["FSP", 4, 12, 4, 3], ["FSP", 4, 16, 5, 3], ["RE", 4, [0, 4, 8, 12, 16, 1, 5, 9, 13, 17, 2, 6, 10, 14, 18, 3, 7, 11, 15, 19]], ["CA", 3, 4, 14], ["CHR", 2, "shared", [3]], ["CA", 3, 4, 17], ["CHR", 1, "shared", [4]], ["CA", 2, 5, 17], ["CI", 1], ["FU", 6, [0, 1, 2, 3, 4]], ["AN", 6, 0, 5], ["FU", 6, [1, 2, 3, 4, 5]], ["AN", 6, 1, 4], ["FU", 6, [2, 3, 4, 5, 6]], ["AN", 6, 2, 6], ["FU", 4, [0, 1, 2, 3, 4]], ["SP", 4, 0, 8, [1], 1], ["AN", 4, 1, 2], ["FFSP", 4, 0, [5, 4, 3, 2, 1], 1, 1], ["AN", 4, 1, 6], ["FU", 2, [0, 1, 2, 3, 4]], ["SP", 2, 0, 56, [1], 1], ["AN", 2, 1, 2], ["FFSP", 2, 0, [5, 4, 3, 2, 1], 1, 1], ["AN", 2, 1, 6], ["PR", 5, 0, "auto_unroll_max_step$1024"]]]], "r": [[4.96022e-05, 4.95619e-05, 4.95533e-05], 0, 25.9204, 1661891330], "v": "v0.6"}
{"i": [["[\"fused_conv3x3\", 4, 28, 28, 8, 8, 3, 3, 64]", "cuda -keys=cuda,gpu -max_num_threads=1024 -model=unknown -thread_warp_size=32", [-1, 16, 64, 49152, 2147483647, 1024, 8, 32], "", 0, []], [[], [["CHW", 3, "local"], ["SP", 3, 0, 4, [1, 2, 1, 2], 1], ["SP", 3, 5, 64, [1, 2, 1, 16], 1], ["SP", 3, 10, 28, [1, 1, 1, 1], 1], ["SP", 3, 15, 28, [1, 1, 2, 2], 1], ["SP", 3, 20, 8, [1, 8, 1, 1], 1], ["SP", 3, 25, 8, [1, 2], 1], ["SP", 3, 28, 3, [1, 1], 1], ["SP", 3, 31, 3, [1, 3], 1], ["RE", 3, [0, 5, 10, 15, 20, 1, 6, 11, 16, 21, 2, 7, 12, 17, 22, 25, 28, 31, 26, 29, 32, 3, 8, 13, 18, 23, 27, 30, 33, 4, 9, 14, 19, 24]], ["FSP", 4, 0, 1, 3], ["FSP", 4, 4, 2, 3], ["FSP", 4, 8, 3, 3], ["FSP", 4, 12, 4, 3], ["FSP", 4, 16, 5, 3], ["RE", 4, [0, 4, 8, 12, 16, 1, 5, 9, 13, 17, 2, 6, 10, 14, 18, 3, 7, 11, 15, 19]], ["CA", 3, 4, 14], ["CHR", 2, "shared", [3]], ["CA", 3, 4, 17], ["CHR", 1, "shared", [4]], ["CA", 2, 5, 17], ["CI", 1], ["FU", 6, [0, 1, 2, 3, 4]], ["AN", 6, 0, 5], ["FU", 6, [1, 2, 3, 4, 5]], ["AN", 6, 1, 4], ["FU", 6, [2, 3, 4, 5, 6]], ["AN", 6, 2, 6], ["FU", 4, [0, 1, 2, 3, 4]], ["SP", 4, 0, 96, [1], 1], ["AN", 4, 1, 2], ["FFSP", 4, 0, [5, 4, 3, 2, 1], 1, 1], ["AN", 4, 1, 6], ["FU", 2, [0, 1, 2, 3, 4]], ["SP", 2, 0, 256, [1], 1], ["AN", 2, 1, 2], ["FFSP", 2, 0, [5, 4, 3, 2, 1], 1, 1], ["AN", 2, 1, 6], ["PR", 5, 0, "auto_unroll_max_step$512"]]]], "r": [[7.81678e-05, 7.80971e-05, 7.80571e-05], 0, 31.5964, 1661891336], "v": "v0.6"}
{"i": [["[\"fused_conv3x3\", 4, 28, 28, 8, 8, 3, 3, 64]", "cuda -keys=cuda,gpu -max_num_threads=1024 -model=unknown -thread_warp_size=32", [-1, 16, 64, 49152, 2147483647, 1024, 8, 32], "", 0, []], [[], [["CHW", 3, "local"], ["SP", 3, 0, 4, [1, 2, 2, 1], 1], ["SP", 3, 5, 64, [1, 4, 1, 1], 1], ["SP", 3, 10, 28, [1, 1, 2, 2], 1], ["SP", 3, 15, 28, [1, 1, 14, 1], 1], ["SP", 3, 20, 8, [1, 8, 1, 1], 1], ["SP", 3, 25, 8, [4, 1], 1], ["SP", 3, 28, 3, [1, 1], 1], ["SP", 3, 31, 3, [1, 1], 1], ["RE", 3, [0, 5, 10, 15, 20, 1, 6, 11, 16, 21, 2, 7, 12, 17, 22, 25, 28, 31, 26, 29, 32, 3, 8, 13, 18, 23, 27, 30, 33, 4, 9, 14, 19, 24]], ["FSP", 4, 0, 1, 3], ["FSP", 4, 4, 2, 3], ["FSP", 4, 8, 3, 3], ["FSP", 4, 12, 4, 3], ["FSP", 4, 16, 5, 3], ["RE", 4, [0, 4, 8, 12, 16, 1, 5, 9, 13, 17, 2, 6, 10, 14, 18, 3, 7, 11, 15, 19]], ["CA", 3, 4, 14], ["CHR", 2, "shared", [3]], ["CA", 3, 4, 17], ["CHR", 1, "shared", [4]], ["CA", 2, 5, 17], ["CI", 1], ["FU", 6, [0, 1, 2, 3, 4]], ["AN", 6, 0, 5], ["FU", 6, [1, 2, 3, 4, 5]], ["AN", 6, 1, 4], ["FU", 6, [2, 3, 4, 5, 6]], ["AN", 6, 2, 6], ["FU", 4, [0, 1, 2, 3, 4]], ["SP", 4, 0, 12, [1], 1], ["AN", 4, 1, 2], ["FFSP", 4, 0, [5, 4, 3, 2, 1], 1, 1], ["AN", 4, 1, 6], ["FU", 2, [0, 1, 2, 3, 4]], ["SP", 2, 0, 768, [1], 1], ["AN", 2, 1, 2], ["FFSP", 2, 0, [5, 4, 3, 2, 1], 1, 1], ["AN", 2, 1, 6], ["PR", 5, 0, "auto_unroll_max_step$64"]]]], "r": [[0.000220677, 0.000220652, 0.000220573], 0, 31.1832, 1661891335], "v": "v0.6"}
{"i": [["[\"fused_conv3x3\", 4, 28, 28, 8, 8, 3, 3, 64]", "cuda -keys=cuda,gpu -max_num_threads=1024 -model=unknown -thread_warp_size=32", [-1, 16, 64, 49152, 2147483647, 1024, 8, 32], "", 0, []], [[], [["CHW", 3, "local"], ["SP", 3, 0, 4, [1, 1, 1, 1], 1], ["SP", 3, 5, 64, [4, 2, 2, 2], 1], ["SP", 3, 10, 28, [1, 1, 4, 1], 1], ["SP", 3, 15, 28, [1, 7, 2, 2], 1], ["SP", 3, 20, 8, [1, 4, 1, 1], 1], ["SP", 3, 25, 8, [2, 1], 1], ["SP", 3, 28, 3, [1, 1], 1], ["SP", 3, 31, 3, [1, 1], 1], ["RE", 3, [0, 5, 10, 15, 20, 1, 6, 11, 16, 21, 2, 7, 12, 17, 22, 25, 28, 31, 26, 29, 32, 3, 8, 13, 18, 23, 27, 30, 33, 4, 9, 14, 19, 24]], ["FSP", 4, 0, 1, 3], ["FSP", 4, 4, 2, 3], ["FSP", 4, 8, 3, 3], ["FSP", 4, 12, 4, 3], ["FSP", 4, 16, 5, 3], ["RE", 4, [0, 4, 8, 12, 16, 1, 5, 9, 13, 17, 2, 6, 10, 14, 18, 3, 7, 11, 15, 19]], ["CA", 3, 4, 14], ["CHR", 2, "shared", [3]], ["CA", 3, 4, 17], ["CHR", 1, "shared", [4]], ["CA", 2, 5, 17], ["CI", 1], ["FU", 6, [0, 1, 2, 3, 4]], ["AN", 6, 0, 5], ["FU", 6, [1, 2, 3, 4, 5]], ["AN", 6, 1, 4], ["FU", 6, [2, 3, 4, 5, 6]], ["AN", 6, 2, 6], ["FU", 4, [0, 1, 2, 3, 4]], ["SP", 4, 0, 8, [1], 1], ["AN", 4, 1, 2], ["FFSP", 4, 0, [5, 4, 3, 2, 1], 1, 1], ["AN", 4, 1, 6], ["FU", 2, [0, 1, 2, 3, 4]], ["SP", 2, 0, 128, [1], 1], ["AN", 2, 1, 2], ["FFSP", 2, 0, [5, 4, 3, 2, 1], 1, 1], ["AN", 2, 1, 6], ["PR", 5, 0, "auto_unroll_max_step$16"]]]], "r": [[0.000696495, 0.000696038, 0.000696119], 0, 31.6412, 1661891338], "v": "v0.6"}
{"i": [["[\"fused_conv3x3\", 4, 28, 28, 8, 8, 3, 3, 64]", "cuda -keys=cuda,gpu -max_num_threads=1024 -model=unknown -thread_warp_size=32", [-1, 16, 64, 49152, 2147483647, 1024, 8, 32], "", 0, []], [[], [["CHW", 3, "local"], ["SP", 3, 0, 4, [1, 2, 1, 1], 1], ["SP", 3, 5, 64, [4, 4, 1, 1], 1], ["SP", 3, 10, 28, [1, 7, 2, 1], 1], ["SP", 3, 15, 28, [1, 2, 1, 2], 1], ["SP", 3, 20, 8, [1, 1, 4, 2], 1], ["SP", 3, 25, 8, [2, 1], 1], ["SP", 3, 28, 3, [3, 1], 1], ["SP", 3, 31, 3, [3, 1], 1], ["RE", 3, [0, 5, 10, 15, 20, 1, 6, 11, 16, 21, 2, 7, 12, 17, 22, 25, 28, 31, 26, 29, 32, 3, 8, 13, 18, 23, 27, 30, 33, 4, 9, 14, 19, 24]], ["FSP", 4, 0, 1, 3], ["FSP", 4, 4, 2, 3], ["FSP", 4, 8, 3, 3], ["FSP", 4, 12, 4, 3], ["FSP", 4, 16, 5, 3], ["RE", 4, [0, 4, 8, 12, 16, 1, 5, 9, 13, 17, 2, 6, 10, 14, 18, 3, 7, 11, 15, 19]], ["CA", 3, 4, 14], ["CHR", 2, "shared", [3]], ["CA", 3, 4, 17], ["CHR", 1, "shared", [4]], ["CA", 2, 5, 17], ["CI", 1], ["FU", 6, [0, 1, 2, 3, 4]], ["AN", 6, 0, 5], ["FU", 6, [1, 2, 3, 4, 5]], ["AN", 6, 1, 4], ["FU", 6, [2, 3, 4, 5, 6]], ["AN", 6, 2, 6], ["FU", 4, [0, 1, 2, 3, 4]], ["SP", 4, 0, 144, [1], 1], ["AN", 4, 1, 2], ["FFSP", 4, 0, [5, 4, 3, 2, 1], 1, 1], ["AN", 4, 1, 6], ["FU", 2, [0, 1, 2, 3, 4]], ["SP", 2, 0, 24, [1], 1], ["AN", 2, 1, 2], ["FFSP", 2, 0, [5, 4, 3, 2, 1], 1, 1], ["AN", 2, 1, 6], ["PR", 5, 0, "auto_unroll_max_step$512"]]]], "r": [[8.31138e-05, 8.30843e-05, 8.2937e-05], 0, 31.4057, 1661891335], "v": "v0.6"}
{"i": [["[\"fused_conv3x3\", 4, 28, 28, 8, 8, 3, 3, 64]", "cuda -keys=cuda,gpu -max_num_threads=1024 -model=unknown -thread_warp_size=32", [-1, 16, 64, 49152, 2147483647, 1024, 8, 32], "", 0, []], [[], [["CHW", 3, "local"], ["SP", 3, 0, 4, [1, 1, 1, 1], 1], ["SP", 3, 5, 64, [1, 8, 2, 2], 1], ["SP", 3, 10, 28, [1, 1, 2, 1], 1], ["SP", 3, 15, 28, [4, 1, 7, 1], 1], ["SP", 3, 20, 8, [2, 4, 1, 1], 1], ["SP", 3, 25, 8, [1, 2], 1], ["SP", 3, 28, 3, [1, 1], 1], ["SP", 3, 31, 3, [1, 1], 1], ["RE", 3, [0, 5, 10, 15, 20, 1, 6, 11, 16, 21, 2, 7, 12, 17, 22, 25, 28, 31, 26, 29, 32, 3, 8, 13, 18, 23, 27, 30, 33, 4, 9, 14, 19, 24]], ["FSP", 4, 0, 1, 3], ["FSP", 4, 4, 2, 3], ["FSP", 4, 8, 3, 3], ["FSP", 4, 12, 4, 3], ["FSP", 4, 16, 5, 3], ["RE", 4, [0, 4, 8, 12, 16, 1, 5, 9, 13, 17, 2, 6, 10, 14, 18, 3, 7, 11, 15, 19]], ["CA", 3, 4, 14], ["CHR", 2, "shared", [3]], ["CA", 3, 4, 17], ["CHR", 1, "shared", [4]], ["CA", 2, 5, 17], ["CI", 1], ["FU", 6, [0, 1, 2, 3, 4]], ["AN", 6, 0, 5], ["FU", 6, [1, 2, 3, 4, 5]], ["AN", 6, 1, 4], ["FU", 6, [2, 3, 4, 5, 6]], ["AN", 6, 2, 6], ["FU", 4, [0, 1, 2, 3, 4]], ["SP", 4, 0, 24, [1], 1], ["AN", 4, 1, 2], ["FFSP", 4, 0, [5, 4, 3, 2, 1], 1, 1], ["AN", 4, 1, 6], ["FU", 2, [0, 1, 2, 3, 4]], ["SP", 2, 0, 112, [1], 1], ["AN", 2, 1, 2], ["FFSP", 2, 0, [5, 4, 3, 2, 1], 1, 1], ["AN", 2, 1, 6], ["PR", 5, 0, "auto_unroll_max_step$1024"]]]], "r": [[0.000769675, 0.000766089, 0.000770333], 0, 38.6589, 1661891338], "v": "v0.6"}
{"i": [["[\"fused_conv3x3\", 4, 28, 28, 8, 8, 3, 3, 64]", "cuda -keys=cuda,gpu -max_num_threads=1024 -model=unknown -thread_warp_size=32", [-1, 16, 64, 49152, 2147483647, 1024, 8, 32], "", 0, []], [[], [["CHW", 3, "local"], ["SP", 3, 0, 4, [1, 1, 1, 2], 1], ["SP", 3, 5, 64, [1, 2, 1, 8], 1], ["SP", 3, 10, 28, [1, 1, 1, 1], 1], ["SP", 3, 15, 28, [1, 4, 1, 7], 1], ["SP", 3, 20, 8, [1, 4, 1, 2], 1], ["SP", 3, 25, 8, [4, 2], 1], ["SP", 3, 28, 3, [1, 1], 1], ["SP", 3, 31, 3, [1, 3], 1], ["RE", 3, [0, 5, 10, 15, 20, 1, 6, 11, 16, 21, 2, 7, 12, 17, 22, 25, 28, 31, 26, 29, 32, 3, 8, 13, 18, 23, 27, 30, 33, 4, 9, 14, 19, 24]], ["FSP", 4, 0, 1, 3], ["FSP", 4, 4, 2, 3], ["FSP", 4, 8, 3, 3], ["FSP", 4, 12, 4, 3], ["FSP", 4, 16, 5, 3], ["RE", 4, [0, 4, 8, 12, 16, 1, 5, 9, 13, 17, 2, 6, 10, 14, 18, 3, 7, 11, 15, 19]], ["CA", 3, 4, 14], ["CHR", 2, "shared", [3]], ["CA", 3, 4, 17], ["CHR", 1, "shared", [4]], ["CA", 2, 5, 17], ["CI", 1], ["FU", 6, [0, 1, 2, 3, 4]], ["AN", 6, 0, 5], ["FU", 6, [1, 2, 3, 4, 5]], ["AN", 6, 1, 4], ["FU", 6, [2, 3, 4, 5, 6]], ["AN", 6, 2, 6], ["FU", 4, [0, 1, 2, 3, 4]], ["SP", 4, 0, 384, [1], 1], ["AN", 4, 1, 2], ["FFSP", 4, 0, [5, 4, 3, 2, 1], 1, 1], ["AN", 4, 1, 6], ["FU", 2, [0, 1, 2, 3, 4]], ["SP", 2, 0, 64, [1], 1], ["AN", 2, 1, 2], ["FFSP", 2, 0, [5, 4, 3, 2, 1], 1, 1], ["AN", 2, 1, 6], ["PR", 5, 0, "auto_unroll_max_step$512"]]]], "r": [[0.000102059, 0.000101912, 0.00010195], 0, 39.9154, 1661891341], "v": "v0.6"}
{"i": [["[\"fused_conv3x3\", 4, 28, 28, 8, 8, 3, 3, 64]", "cuda -keys=cuda,gpu -max_num_threads=1024 -model=unknown -thread_warp_size=32", [-1, 16, 64, 49152, 2147483647, 1024, 8, 32], "", 0, []], [[], [["CHW", 3, "local"], ["SP", 3, 0, 4, [2, 2, 1, 1], 1], ["SP", 3, 5, 64, [1, 8, 1, 2], 1], ["SP", 3, 10, 28, [2, 2, 1, 1], 1], ["SP", 3, 15, 28, [1, 1, 14, 1], 1], ["SP", 3, 20, 8, [1, 2, 1, 4], 1], ["SP", 3, 25, 8, [1, 2], 1], ["SP", 3, 28, 3, [1, 1], 1], ["SP", 3, 31, 3, [1, 1], 1], ["RE", 3, [0, 5, 10, 15, 20, 1, 6, 11, 16, 21, 2, 7, 12, 17, 22, 25, 28, 31, 26, 29, 32, 3, 8, 13, 18, 23, 27, 30, 33, 4, 9, 14, 19, 24]], ["FSP", 4, 0, 1, 3], ["FSP", 4, 4, 2, 3], ["FSP", 4, 8, 3, 3], ["FSP", 4, 12, 4, 3], ["FSP", 4, 16, 5, 3], ["RE", 4, [0, 4, 8, 12, 16, 1, 5, 9, 13, 17, 2, 6, 10, 14, 18, 3, 7, 11, 15, 19]], ["CA", 3, 4, 14], ["CHR", 2, "shared", [3]], ["CA", 3, 4, 17], ["CHR", 1, "shared", [4]], ["CA", 2, 5, 17], ["CI", 1], ["FU", 6, [0, 1, 2, 3, 4]], ["AN", 6, 0, 5], ["FU", 6, [1, 2, 3, 4, 5]], ["AN", 6, 1, 4], ["FU", 6, [2, 3, 4, 5, 6]], ["AN", 6, 2, 6], ["FU", 4, [0, 1, 2, 3, 4]], ["SP", 4, 0, 8, [1], 1], ["AN", 4, 1, 2], ["FFSP", 4, 0, [5, 4, 3, 2, 1], 1, 1], ["AN", 4, 1, 6], ["FU", 2, [0, 1, 2, 3, 4]], ["SP", 2, 0, 56, [1], 1], ["AN", 2, 1, 2], ["FFSP", 2, 0, [5, 4, 3, 2, 1], 1, 1], ["AN", 2, 1, 6], ["PR", 5, 0, "auto_unroll_max_step$1024"]]]], "r": [[0.000877419, 0.000872414, 0.000878196], 0, 47.1831, 1661891344], "v": "v0.6"}
{"i": [["[\"fused_conv3x3\", 4, 28, 28, 8, 8, 3, 3, 64]", "cuda -keys=cuda,gpu -max_num_threads=1024 -model=unknown -thread_warp_size=32", [-1, 16, 64, 49152, 2147483647, 1024, 8, 32], "", 0, []], [[], [["CHW", 3, "local"], ["SP", 3, 0, 4, [1, 2, 1, 1], 1], ["SP", 3, 5, 64, [4, 1, 1, 4], 1], ["SP", 3, 10, 28, [1, 7, 1, 1], 1], ["SP", 3, 15, 28, [1, 2, 2, 1], 1], ["SP", 3, 20, 8, [1, 4, 2, 1], 1], ["SP", 3, 25, 8, [1, 1], 1], ["SP", 3, 28, 3, [1, 3], 1], ["SP", 3, 31, 3, [1, 1], 1], ["RE", 3, [0, 5, 10, 15, 20, 1, 6, 11, 16, 21, 2, 7, 12, 17, 22, 25, 28, 31, 26, 29, 32, 3, 8, 13, 18, 23, 27, 30, 33, 4, 9, 14, 19, 24]], ["FSP", 4, 0, 1, 3], ["FSP", 4, 4, 2, 3], ["FSP", 4, 8, 3, 3], ["FSP", 4, 12, 4, 3], ["FSP", 4, 16, 5, 3], ["RE", 4, [0, 4, 8, 12, 16, 1, 5, 9, 13, 17, 2, 6, 10, 14, 18, 3, 7, 11, 15, 19]], ["CA", 3, 4, 14], ["CHR", 2, "shared", [3]], ["CA", 3, 4, 17], ["CHR", 1, "shared", [4]], ["CA", 2, 5, 17], ["CI", 1], ["FU", 6, [0, 1, 2, 3, 4]], ["AN", 6, 0, 5], ["FU", 6, [1, 2, 3, 4, 5]], ["AN", 6, 1, 4], ["FU", 6, [2, 3, 4, 5, 6]], ["AN", 6, 2, 6], ["FU", 4, [0, 1, 2, 3, 4]], ["SP", 4, 0, 72, [1], 1], ["AN", 4, 1, 2], ["FFSP", 4, 0, [5, 4, 3, 2, 1], 1, 1], ["AN", 4, 1, 6], ["FU", 2, [0, 1, 2, 3, 4]], ["SP", 2, 0, 48, [1], 1], ["AN", 2, 1, 2], ["FFSP", 2, 0, [5, 4, 3, 2, 1], 1, 1], ["AN", 2, 1, 6], ["PR", 5, 0, "auto_unroll_max_step$0"]]]], "r": [[0.000200506, 0.000200379, 0.000200152], 0, 33.9848, 1661891342], "v": "v0.6"}
{"i": [["[\"fused_conv3x3\", 4, 28, 28, 8, 8, 3, 3, 64]", "cuda -keys=cuda,gpu -max_num_threads=1024 -model=unknown -thread_warp_size=32", [-1, 16, 64, 49152, 2147483647, 1024, 8, 32], "", 0, []], [[], [["CHW", 3, "local"], ["SP", 3, 0, 4, [1, 1, 1, 2], 1], ["SP", 3, 5, 64, [1, 8, 2, 1], 1], ["SP", 3, 10, 28, [1, 7, 1, 1], 1], ["SP", 3, 15, 28, [1, 2, 2, 1], 1], ["SP", 3, 20, 8, [1, 1, 1, 1], 1], ["SP", 3, 25, 8, [8, 1], 1], ["SP", 3, 28, 3, [1, 1], 1], ["SP", 3, 31, 3, [1, 3], 1], ["RE", 3, [0, 5, 10, 15, 20, 1, 6, 11, 16, 21, 2, 7, 12, 17, 22, 25, 28, 31, 26, 29, 32, 3, 8, 13, 18, 23, 27, 30, 33, 4, 9, 14, 19, 24]], ["FSP", 4, 0, 1, 3], ["FSP", 4, 4, 2, 3], ["FSP", 4, 8, 3, 3], ["FSP", 4, 12, 4, 3], ["FSP", 4, 16, 5, 3], ["RE", 4, [0, 4, 8, 12, 16, 1, 5, 9, 13, 17, 2, 6, 10, 14, 18, 3, 7, 11, 15, 19]], ["CA", 3, 4, 14], ["CHR", 2, "shared", [3]], ["CA", 3, 4, 17], ["CHR", 1, "shared", [4]], ["CA", 2, 5, 17], ["CI", 1], ["FU", 6, [0, 1, 2, 3, 4]], ["AN", 6, 0, 5], ["FU", 6, [1, 2, 3, 4, 5]], ["AN", 6, 1, 4], ["FU", 6, [2, 3, 4, 5, 6]], ["AN", 6, 2, 6], ["FU", 4, [0, 1, 2, 3, 4]], ["SP", 4, 0, 16, [1], 1], ["AN", 4, 1, 2], ["FFSP", 4, 0, [5, 4, 3, 2, 1], 1, 1], ["AN", 4, 1, 6], ["FU", 2, [0, 1, 2, 3, 4]], ["SP", 2, 0, 64, [1], 1], ["AN", 2, 1, 2], ["FFSP", 2, 0, [5, 4, 3, 2, 1], 1, 1], ["AN", 2, 1, 6], ["PR", 5, 0, "auto_unroll_max_step$512"]]]], "r": [[0.000102206, 0.000101941, 0.000101998], 0, 40.2081, 1661891345], "v": "v0.6"}
{"i": [["[\"fused_conv3x3\", 4, 28, 28, 8, 8, 3, 3, 64]", "cuda -keys=cuda,gpu -max_num_threads=1024 -model=unknown -thread_warp_size=32", [-1, 16, 64, 49152, 2147483647, 1024, 8, 32], "", 0, []], [[], [["CHW", 3, "local"], ["SP", 3, 0, 4, [1, 4, 1, 1], 1], ["SP", 3, 5, 64, [1, 8, 1, 2], 1], ["SP", 3, 10, 28, [2, 2, 1, 1], 1], ["SP", 3, 15, 28, [1, 2, 7, 1], 1], ["SP", 3, 20, 8, [1, 4, 2, 1], 1], ["SP", 3, 25, 8, [1, 2], 1], ["SP", 3, 28, 3, [1, 1], 1], ["SP", 3, 31, 3, [1, 1], 1], ["RE", 3, [0, 5, 10, 15, 20, 1, 6, 11, 16, 21, 2, 7, 12, 17, 22, 25, 28, 31, 26, 29, 32, 3, 8, 13, 18, 23, 27, 30, 33, 4, 9, 14, 19, 24]], ["FSP", 4, 0, 1, 3], ["FSP", 4, 4, 2, 3], ["FSP", 4, 8, 3, 3], ["FSP", 4, 12, 4, 3], ["FSP", 4, 16, 5, 3], ["RE", 4, [0, 4, 8, 12, 16, 1, 5, 9, 13, 17, 2, 6, 10, 14, 18, 3, 7, 11, 15, 19]], ["CA", 3, 4, 14], ["CHR", 2, "shared", [3]], ["CA", 3, 4, 17], ["CHR", 1, "shared", [4]], ["CA", 2, 5, 17], ["CI", 1], ["FU", 6, [0, 1, 2, 3, 4]], ["AN", 6, 0, 5], ["FU", 6, [1, 2, 3, 4, 5]], ["AN", 6, 1, 4], ["FU", 6, [2, 3, 4, 5, 6]], ["AN", 6, 2, 6], ["FU", 4, [0, 1, 2, 3, 4]], ["SP", 4, 0, 8, [1], 1], ["AN", 4, 1, 2], ["FFSP", 4, 0, [5, 4, 3, 2, 1], 1, 1], ["AN", 4, 1, 6], ["FU", 2, [0, 1, 2, 3, 4]], ["SP", 2, 0, 56, [14], 1], ["AN", 2, 1, 2], ["FFSP", 2, 0, [5, 4, 3, 2, 1], 1, 1], ["AN", 2, 1, 6], ["PR", 5, 0, "auto_unroll_max_step$1024"]]]], "r": [[0.00017125, 0.000171203, 0.000171136], 0, 35.0958, 1661891339], "v": "v0.6"}
{"i": [["[\"fused_conv3x3\", 4, 28, 28, 8, 8, 3, 3, 64]", "cuda -keys=cuda,gpu -max_num_threads=1024 -model=unknown -thread_warp_size=32", [-1, 16, 64, 49152, 2147483647, 1024, 8, 32], "", 0, []], [[], [["CHW", 3, "local"], ["SP", 3, 0, 4, [1, 1, 2, 1], 1], ["SP", 3, 5, 64, [1, 32, 1, 2], 1], ["SP", 3, 10, 28, [1, 2, 1, 1], 1], ["SP", 3, 15, 28, [7, 1, 2, 1], 1], ["SP", 3, 20, 8, [1, 2, 2, 1], 1], ["SP", 3, 25, 8, [1, 1], 1], ["SP", 3, 28, 3, [1, 1], 1], ["SP", 3, 31, 3, [1, 1], 1], ["RE", 3, [0, 5, 10, 15, 20, 1, 6, 11, 16, 21, 2, 7, 12, 17, 22, 25, 28, 31, 26, 29, 32, 3, 8, 13, 18, 23, 27, 30, 33, 4, 9, 14, 19, 24]], ["FSP", 4, 0, 1, 3], ["FSP", 4, 4, 2, 3], ["FSP", 4, 8, 3, 3], ["FSP", 4, 12, 4, 3], ["FSP", 4, 16, 5, 3], ["RE", 4, [0, 4, 8, 12, 16, 1, 5, 9, 13, 17, 2, 6, 10, 14, 18, 3, 7, 11, 15, 19]], ["CA", 3, 4, 14], ["CHR", 2, "shared", [3]], ["CA", 3, 4, 17], ["CHR", 1, "shared", [4]], ["CA", 2, 5, 17], ["CI", 1], ["FU", 6, [0, 1, 2, 3, 4]], ["AN", 6, 0, 5], ["FU", 6, [1, 2, 3, 4, 5]], ["AN", 6, 1, 4], ["FU", 6, [2, 3, 4, 5, 6]], ["AN", 6, 2, 6], ["FU", 4, [0, 1, 2, 3, 4]], ["SP", 4, 0, 4, [1], 1], ["AN", 4, 1, 2], ["FFSP", 4, 0, [5, 4, 3, 2, 1], 1, 1], ["AN", 4, 1, 6], ["FU", 2, [0, 1, 2, 3, 4]], ["SP", 2, 0, 8, [1], 1], ["AN", 2, 1, 2], ["FFSP", 2, 0, [5, 4, 3, 2, 1], 1, 1], ["AN", 2, 1, 6], ["PR", 5, 0, "auto_unroll_max_step$16"]]]], "r": [[0.00021276, 0.000212686, 0.000211988], 0, 37.5544, 1661891345], "v": "v0.6"}
{"i": [["[\"fused_conv3x3\", 4, 28, 28, 8, 8, 3, 3, 64]", "cuda -keys=cuda,gpu -max_num_threads=1024 -model=unknown -thread_warp_size=32", [-1, 16, 64, 49152, 2147483647, 1024, 8, 32], "", 0, []], [[], [["CHW", 3, "local"], ["SP", 3, 0, 4, [1, 4, 1, 1], 1], ["SP", 3, 5, 64, [1, 8, 1, 8], 1], ["SP", 3, 10, 28, [7, 2, 2, 1], 1], ["SP", 3, 15, 28, [1, 1, 1, 1], 1], ["SP", 3, 20, 8, [1, 8, 1, 1], 1], ["SP", 3, 25, 8, [1, 1], 1], ["SP", 3, 28, 3, [1, 1], 1], ["SP", 3, 31, 3, [1, 1], 1], ["RE", 3, [0, 5, 10, 15, 20, 1, 6, 11, 16, 21, 2, 7, 12, 17, 22, 25, 28, 31, 26, 29, 32, 3, 8, 13, 18, 23, 27, 30, 33, 4, 9, 14, 19, 24]], ["FSP", 4, 0, 1, 3], ["FSP", 4, 4, 2, 3], ["FSP", 4, 8, 3, 3], ["FSP", 4, 12, 4, 3], ["FSP", 4, 16, 5, 3], ["RE", 4, [0, 4, 8, 12, 16, 1, 5, 9, 13, 17, 2, 6, 10, 14, 18, 3, 7, 11, 15, 19]], ["CA", 3, 4, 14], ["CHR", 2, "shared", [3]], ["CA", 3, 4, 17], ["CHR", 1, "shared", [4]], ["CA", 2, 5, 17], ["CI", 1], ["FU", 6, [0, 1, 2, 3, 4]], ["AN", 6, 0, 5], ["FU", 6, [1, 2, 3, 4, 5]], ["AN", 6, 1, 4], ["FU", 6, [2, 3, 4, 5, 6]], ["AN", 6, 2, 6], ["FU", 4, [0, 1, 2, 3, 4]], ["SP", 4, 0, 64, [1], 1], ["AN", 4, 1, 2], ["FFSP", 4, 0, [5, 4, 3, 2, 1], 1, 1], ["AN", 4, 1, 6], ["FU", 2, [0, 1, 2, 3, 4]], ["SP", 2, 0, 112, [1], 1], ["AN", 2, 1, 2], ["FFSP", 2, 0, [5, 4, 3, 2, 1], 1, 1], ["AN", 2, 1, 6], ["PR", 5, 0, "auto_unroll_max_step$0"]]]], "r": [[0.000725897, 0.000725715, 0.00072556], 0, 37.0371, 1661891346], "v": "v0.6"}
{"i": [["[\"fused_conv3x3\", 4, 28, 28, 8, 8, 3, 3, 64]", "cuda -keys=cuda,gpu -max_num_threads=1024 -model=unknown -thread_warp_size=32", [-1, 16, 64, 49152, 2147483647, 1024, 8, 32], "", 0, []], [[], [["CHW", 3, "local"], ["SP", 3, 0, 4, [1, 1, 1, 1], 1], ["SP", 3, 5, 64, [1, 16, 1, 2], 1], ["SP", 3, 10, 28, [1, 2, 1, 2], 1], ["SP", 3, 15, 28, [2, 2, 1, 1], 1], ["SP", 3, 20, 8, [1, 4, 1, 1], 1], ["SP", 3, 25, 8, [2, 2], 1], ["SP", 3, 28, 3, [1, 3], 1], ["SP", 3, 31, 3, [3, 1], 1], ["RE", 3, [0, 5, 10, 15, 20, 1, 6, 11, 16, 21, 2, 7, 12, 17, 22, 25, 28, 31, 26, 29, 32, 3, 8, 13, 18, 23, 27, 30, 33, 4, 9, 14, 19, 24]], ["FSP", 4, 0, 1, 3], ["FSP", 4, 4, 2, 3], ["FSP", 4, 8, 3, 3], ["FSP", 4, 12, 4, 3], ["FSP", 4, 16, 5, 3], ["RE", 4, [0, 4, 8, 12, 16, 1, 5, 9, 13, 17, 2, 6, 10, 14, 18, 3, 7, 11, 15, 19]], ["CA", 3, 4, 14], ["CHR", 2, "shared", [3]], ["CA", 3, 4, 17], ["CHR", 1, "shared", [4]], ["CA", 2, 5, 17], ["CI", 1], ["FU", 6, [0, 1, 2, 3, 4]], ["AN", 6, 0, 5], ["FU", 6, [1, 2, 3, 4, 5]], ["AN", 6, 1, 4], ["FU", 6, [2, 3, 4, 5, 6]], ["AN", 6, 2, 6], ["FU", 4, [0, 1, 2, 3, 4]], ["SP", 4, 0, 24, [1], 1], ["AN", 4, 1, 2], ["FFSP", 4, 0, [5, 4, 3, 2, 1], 1, 1], ["AN", 4, 1, 6], ["FU", 2, [0, 1, 2, 3, 4]], ["SP", 2, 0, 96, [1], 1], ["AN", 2, 1, 2], ["FFSP", 2, 0, [5, 4, 3, 2, 1], 1, 1], ["AN", 2, 1, 6], ["PR", 5, 0, "auto_unroll_max_step$1024"]]]], "r": [[0.000104469, 0.000104434, 0.000104403], 0, 41.0556, 1661891347], "v": "v0.6"}
{"i": [["[\"fused_conv3x3\", 4, 28, 28, 8, 8, 3, 3, 64]", "cuda -keys=cuda,gpu -max_num_threads=1024 -model=unknown -thread_warp_size=32", [-1, 16, 64, 49152, 2147483647, 1024, 8, 32], "", 0, []], [[], [["CHW", 3, "local"], ["SP", 3, 0, 4, [1, 1, 1, 2], 1], ["SP", 3, 5, 64, [1, 8, 1, 4], 1], ["SP", 3, 10, 28, [2, 2, 1, 1], 1], ["SP", 3, 15, 28, [1, 1, 1, 2], 1], ["SP", 3, 20, 8, [2, 4, 1, 1], 1], ["SP", 3, 25, 8, [1, 2], 1], ["SP", 3, 28, 3, [1, 1], 1], ["SP", 3, 31, 3, [3, 1], 1], ["RE", 3, [0, 5, 10, 15, 20, 1, 6, 11, 16, 21, 2, 7, 12, 17, 22, 25, 28, 31, 26, 29, 32, 3, 8, 13, 18, 23, 27, 30, 33, 4, 9, 14, 19, 24]], ["FSP", 4, 0, 1, 3], ["FSP", 4, 4, 2, 3], ["FSP", 4, 8, 3, 3], ["FSP", 4, 12, 4, 3], ["FSP", 4, 16, 5, 3], ["RE", 4, [0, 4, 8, 12, 16, 1, 5, 9, 13, 17, 2, 6, 10, 14, 18, 3, 7, 11, 15, 19]], ["CA", 3, 4, 14], ["CHR", 2, "shared", [3]], ["CA", 3, 4, 17], ["CHR", 1, "shared", [4]], ["CA", 2, 5, 17], ["CI", 1], ["FU", 6, [0, 1, 2, 3, 4]], ["AN", 6, 0, 5], ["FU", 6, [1, 2, 3, 4, 5]], ["AN", 6, 1, 4], ["FU", 6, [2, 3, 4, 5, 6]], ["AN", 6, 2, 6], ["FU", 4, [0, 1, 2, 3, 4]], ["SP", 4, 0, 72, [1], 1], ["AN", 4, 1, 2], ["FFSP", 4, 0, [5, 4, 3, 2, 1], 1, 1], ["AN", 4, 1, 6], ["FU", 2, [0, 1, 2, 3, 4]], ["SP", 2, 0, 192, [1], 1], ["AN", 2, 1, 2], ["FFSP", 2, 0, [5, 4, 3, 2, 1], 1, 1], ["AN", 2, 1, 6], ["PR", 5, 0, "auto_unroll_max_step$1024"]]]], "r": [[4.53153e-05, 4.52982e-05, 4.52846e-05], 0, 38.8067, 1661891348], "v": "v0.6"}
