python/models/resnext/kernel_configs/resnext_imagenet_50_fused_conv1x1_bn_relu_1_56_56_512_8_64_s2.log
{"i": [["[\"fused_conv1x1_bn_relu_stride\", 1, 56, 56, 512, 8, 64, 2]", "cuda -keys=cuda,gpu -max_num_threads=1024 -model=unknown -thread_warp_size=32", [-1, 16, 64, 49152, 2147483647, 1024, 8, 32], "", 0, []], [[], [["CI", 6], ["CI", 4], ["CHW", 2, "local"], ["SP", 2, 0, 1, [1, 1, 1, 1], 1], ["SP", 2, 5, 64, [2, 4, 2, 2], 1], ["SP", 2, 10, 28, [1, 14, 2, 1], 1], ["SP", 2, 15, 28, [1, 4, 1, 1], 1], ["SP", 2, 20, 8, [2, 1, 2, 2], 1], ["SP", 2, 25, 512, [16, 1], 1], ["RE", 2, [0, 5, 10, 15, 20, 1, 6, 11, 16, 21, 2, 7, 12, 17, 22, 25, 26, 3, 8, 13, 18, 23, 27, 4, 9, 14, 19, 24]], ["FSP", 3, 0, 3, 3], ["FSP", 3, 4, 4, 3], ["FSP", 3, 8, 5, 3], ["FSP", 3, 12, 6, 3], ["FSP", 3, 16, 7, 3], ["RE", 3, [0, 4, 8, 12, 16, 1, 5, 9, 13, 17, 2, 6, 10, 14, 18, 3, 7, 11, 15, 19]], ["CA", 2, 3, 14], ["CHR", 1, "shared", [2]], ["CA", 2, 3, 15], ["CHR", 0, "shared", [3]], ["CA", 1, 4, 15], ["FU", 10, [0, 1, 2, 3, 4]], ["SP", 10, 0, 1605632, [32], 1], ["AN", 10, 0, 5], ["AN", 10, 1, 6], ["FU", 5, [0, 1, 2, 3, 4]], ["AN", 5, 0, 5], ["FU", 5, [1, 2, 3, 4, 5]], ["AN", 5, 1, 4], ["FU", 5, [2, 3, 4, 5, 6]], ["AN", 5, 2, 6], ["FU", 3, [0, 1, 2]], ["SP", 3, 0, 256, [8], 1], ["AN", 3, 1, 2], ["FFSP", 3, 0, [7, 6, 5, 4, 3], 1, 1], ["AN", 3, 1, 6], ["FU", 1, [0, 1, 2, 3]], ["SP", 1, 0, 48, [1], 1], ["AN", 1, 1, 2], ["FFSP", 1, 0, [7, 6, 5, 4, 3], 1, 1], ["AN", 1, 1, 6], ["PR", 4, 0, "auto_unroll_max_step$16"]]]], "r": [[0.000444916, 0.000444702, 0.000444684, 0.000444793, 0.000444841, 0.000444764, 0.000444792, 0.000444695, 0.000444741, 0.000444718], 0, 7.68783, 1649992234], "v": "v0.6"}
{"i": [["[\"fused_conv1x1_bn_relu_stride\", 1, 56, 56, 512, 8, 64, 2]", "cuda -keys=cuda,gpu -max_num_threads=1024 -model=unknown -thread_warp_size=32", [-1, 16, 64, 49152, 2147483647, 1024, 8, 32], "", 0, []], [[], [["CI", 6], ["CI", 4], ["CHW", 2, "local"], ["SP", 2, 0, 1, [1, 1, 1, 1], 1], ["SP", 2, 5, 64, [1, 2, 4, 2], 1], ["SP", 2, 10, 28, [1, 2, 7, 2], 1], ["SP", 2, 15, 28, [1, 14, 1, 1], 1], ["SP", 2, 20, 8, [1, 2, 1, 2], 1], ["SP", 2, 25, 512, [1, 1], 1], ["RE", 2, [0, 5, 10, 15, 20, 1, 6, 11, 16, 21, 2, 7, 12, 17, 22, 25, 26, 3, 8, 13, 18, 23, 27, 4, 9, 14, 19, 24]], ["FSP", 3, 0, 3, 3], ["FSP", 3, 4, 4, 3], ["FSP", 3, 8, 5, 3], ["FSP", 3, 12, 6, 3], ["FSP", 3, 16, 7, 3], ["RE", 3, [0, 4, 8, 12, 16, 1, 5, 9, 13, 17, 2, 6, 10, 14, 18, 3, 7, 11, 15, 19]], ["CA", 2, 3, 14], ["CHR", 1, "shared", [2]], ["CA", 2, 3, 15], ["CHR", 0, "shared", [3]], ["CA", 1, 4, 15], ["FU", 10, [0, 1, 2, 3, 4]], ["SP", 10, 0, 1605632, [32], 1], ["AN", 10, 0, 5], ["AN", 10, 1, 6], ["FU", 5, [0, 1, 2, 3, 4]], ["AN", 5, 0, 5], ["FU", 5, [1, 2, 3, 4, 5]], ["AN", 5, 1, 4], ["FU", 5, [2, 3, 4, 5, 6]], ["AN", 5, 2, 6], ["FU", 3, [0, 1, 2]], ["SP", 3, 0, 64, [1], 1], ["AN", 3, 1, 2], ["FFSP", 3, 0, [7, 6, 5, 4, 3], 1, 1], ["AN", 3, 1, 6], ["FU", 1, [0, 1, 2, 3]], ["SP", 1, 0, 108, [1], 1], ["AN", 1, 1, 2], ["FFSP", 1, 0, [7, 6, 5, 4, 3], 1, 1], ["AN", 1, 1, 6], ["PR", 4, 0, "auto_unroll_max_step$16"]]]], "r": [[0.00114574, 0.00114618, 0.00114616, 0.00114588, 0.00114602, 0.00114584, 0.00114604, 0.00114599, 0.00114597, 0.0011465], 0, 13.5346, 1649992240], "v": "v0.6"}
