python/models/resnext/kernel_configs/resnext_imagenet_50_fused_conv3x3_4_14_14_32_32_3.log
{"i": [["[\"fused_conv3x3\", 4, 14, 14, 32, 32, 3, 3, 64]", "cuda -keys=cuda,gpu -max_num_threads=1024 -model=unknown -thread_warp_size=32", [-1, 16, 64, 49152, 2147483647, 1024, 8, 32], "", 0, []], [[], [["CHW", 3, "local"], ["SP", 3, 0, 4, [1, 2, 1, 1], 1], ["SP", 3, 5, 64, [1, 4, 1, 2], 1], ["SP", 3, 10, 14, [1, 1, 1, 1], 1], ["SP", 3, 15, 14, [1, 1, 1, 7], 1], ["SP", 3, 20, 32, [1, 4, 2, 1], 1], ["SP", 3, 25, 32, [1, 1], 1], ["SP", 3, 28, 3, [1, 3], 1], ["SP", 3, 31, 3, [1, 3], 1], ["RE", 3, [0, 5, 10, 15, 20, 1, 6, 11, 16, 21, 2, 7, 12, 17, 22, 25, 28, 31, 26, 29, 32, 3, 8, 13, 18, 23, 27, 30, 33, 4, 9, 14, 19, 24]], ["FSP", 4, 0, 1, 3], ["FSP", 4, 4, 2, 3], ["FSP", 4, 8, 3, 3], ["FSP", 4, 12, 4, 3], ["FSP", 4, 16, 5, 3], ["RE", 4, [0, 4, 8, 12, 16, 1, 5, 9, 13, 17, 2, 6, 10, 14, 18, 3, 7, 11, 15, 19]], ["CA", 3, 4, 14], ["CHR", 2, "shared", [3]], ["CA", 3, 4, 17], ["CHR", 1, "shared", [4]], ["CA", 2, 5, 17], ["CI", 1], ["FU", 6, [0, 1, 2, 3, 4]], ["AN", 6, 0, 5], ["FU", 6, [1, 2, 3, 4, 5]], ["AN", 6, 1, 4], ["FU", 6, [2, 3, 4, 5, 6]], ["AN", 6, 2, 6], ["FU", 4, [0, 1, 2, 3, 4]], ["SP", 4, 0, 18, [1], 1], ["AN", 4, 1, 2], ["FFSP", 4, 0, [5, 4, 3, 2, 1], 1, 1], ["AN", 4, 1, 6], ["FU", 2, [0, 1, 2, 3, 4]], ["SP", 2, 0, 54, [27], 1], ["AN", 2, 1, 2], ["FFSP", 2, 0, [5, 4, 3, 2, 1], 1, 1], ["AN", 2, 1, 6], ["PR", 5, 0, "auto_unroll_max_step$16"]]]], "r": [[0.00031389, 0.000313346, 0.000314297], 0, 4.99064, 1661898235], "v": "v0.6"}
{"i": [["[\"fused_conv3x3\", 4, 14, 14, 32, 32, 3, 3, 64]", "cuda -keys=cuda,gpu -max_num_threads=1024 -model=unknown -thread_warp_size=32", [-1, 16, 64, 49152, 2147483647, 1024, 8, 32], "", 0, []], [[], [["CHW", 3, "local"], ["SP", 3, 0, 4, [1, 1, 1, 1], 1], ["SP", 3, 5, 64, [2, 4, 1, 1], 1], ["SP", 3, 10, 14, [1, 2, 1, 1], 1], ["SP", 3, 15, 14, [1, 1, 1, 14], 1], ["SP", 3, 20, 32, [4, 1, 1, 8], 1], ["SP", 3, 25, 32, [2, 2], 1], ["SP", 3, 28, 3, [1, 1], 1], ["SP", 3, 31, 3, [1, 1], 1], ["RE", 3, [0, 5, 10, 15, 20, 1, 6, 11, 16, 21, 2, 7, 12, 17, 22, 25, 28, 31, 26, 29, 32, 3, 8, 13, 18, 23, 27, 30, 33, 4, 9, 14, 19, 24]], ["FSP", 4, 0, 1, 3], ["FSP", 4, 4, 2, 3], ["FSP", 4, 8, 3, 3], ["FSP", 4, 12, 4, 3], ["FSP", 4, 16, 5, 3], ["RE", 4, [0, 4, 8, 12, 16, 1, 5, 9, 13, 17, 2, 6, 10, 14, 18, 3, 7, 11, 15, 19]], ["CA", 3, 4, 14], ["CHR", 2, "shared", [3]], ["CA", 3, 4, 17], ["CHR", 1, "shared", [4]], ["CA", 2, 5, 17], ["CI", 1], ["FU", 6, [0, 1, 2, 3, 4]], ["AN", 6, 0, 5], ["FU", 6, [1, 2, 3, 4, 5]], ["AN", 6, 1, 4], ["FU", 6, [2, 3, 4, 5, 6]], ["AN", 6, 2, 6], ["FU", 4, [0, 1, 2, 3, 4]], ["SP", 4, 0, 24, [1], 1], ["AN", 4, 1, 2], ["FFSP", 4, 0, [5, 4, 3, 2, 1], 1, 1], ["AN", 4, 1, 6], ["FU", 2, [0, 1, 2, 3, 4]], ["SP", 2, 0, 192, [1], 1], ["AN", 2, 1, 2], ["FFSP", 2, 0, [5, 4, 3, 2, 1], 1, 1], ["AN", 2, 1, 6], ["PR", 5, 0, "auto_unroll_max_step$0"]]]], "r": [[0.00939913, 0.00948689, 0.00931308], 0, 6.6142, 1661898236], "v": "v0.6"}
{"i": [["[\"fused_conv3x3\", 4, 14, 14, 32, 32, 3, 3, 64]", "cuda -keys=cuda,gpu -max_num_threads=1024 -model=unknown -thread_warp_size=32", [-1, 16, 64, 49152, 2147483647, 1024, 8, 32], "", 0, []], [[], [["CHW", 3, "local"], ["SP", 3, 0, 4, [1, 1, 1, 4], 1], ["SP", 3, 5, 64, [1, 4, 1, 1], 1], ["SP", 3, 10, 14, [2, 7, 1, 1], 1], ["SP", 3, 15, 14, [1, 1, 1, 1], 1], ["SP", 3, 20, 32, [2, 4, 1, 1], 1], ["SP", 3, 25, 32, [4, 2], 1], ["SP", 3, 28, 3, [3, 1], 1], ["SP", 3, 31, 3, [1, 1], 1], ["RE", 3, [0, 5, 10, 15, 20, 1, 6, 11, 16, 21, 2, 7, 12, 17, 22, 25, 28, 31, 26, 29, 32, 3, 8, 13, 18, 23, 27, 30, 33, 4, 9, 14, 19, 24]], ["FSP", 4, 0, 1, 3], ["FSP", 4, 4, 2, 3], ["FSP", 4, 8, 3, 3], ["FSP", 4, 12, 4, 3], ["FSP", 4, 16, 5, 3], ["RE", 4, [0, 4, 8, 12, 16, 1, 5, 9, 13, 17, 2, 6, 10, 14, 18, 3, 7, 11, 15, 19]], ["CA", 3, 4, 14], ["CHR", 2, "shared", [3]], ["CA", 3, 4, 17], ["CHR", 1, "shared", [4]], ["CA", 2, 5, 17], ["CI", 1], ["FU", 6, [0, 1, 2, 3, 4]], ["AN", 6, 0, 5], ["FU", 6, [1, 2, 3, 4, 5]], ["AN", 6, 1, 4], ["FU", 6, [2, 3, 4, 5, 6]], ["AN", 6, 2, 6], ["FU", 4, [0, 1, 2, 3, 4]], ["SP", 4, 0, 72, [1], 1], ["AN", 4, 1, 2], ["FFSP", 4, 0, [5, 4, 3, 2, 1], 1, 1], ["AN", 4, 1, 6], ["FU", 2, [0, 1, 2, 3, 4]], ["SP", 2, 0, 72, [1], 1], ["AN", 2, 1, 2], ["FFSP", 2, 0, [5, 4, 3, 2, 1], 1, 1], ["AN", 2, 1, 6], ["PR", 5, 0, "auto_unroll_max_step$0"]]]], "r": [[0.000506493, 0.000506233, 0.000506081], 0, 3.4687, 1661898234], "v": "v0.6"}
{"i": [["[\"fused_conv3x3\", 4, 14, 14, 32, 32, 3, 3, 64]", "cuda -keys=cuda,gpu -max_num_threads=1024 -model=unknown -thread_warp_size=32", [-1, 16, 64, 49152, 2147483647, 1024, 8, 32], "", 0, []], [[], [["CHW", 3, "local"], ["SP", 3, 0, 4, [1, 2, 1, 1], 1], ["SP", 3, 5, 64, [4, 4, 1, 1], 1], ["SP", 3, 10, 14, [1, 7, 1, 2], 1], ["SP", 3, 15, 14, [1, 1, 2, 1], 1], ["SP", 3, 20, 32, [1, 4, 2, 2], 1], ["SP", 3, 25, 32, [8, 1], 1], ["SP", 3, 28, 3, [1, 1], 1], ["SP", 3, 31, 3, [1, 1], 1], ["RE", 3, [0, 5, 10, 15, 20, 1, 6, 11, 16, 21, 2, 7, 12, 17, 22, 25, 28, 31, 26, 29, 32, 3, 8, 13, 18, 23, 27, 30, 33, 4, 9, 14, 19, 24]], ["FSP", 4, 0, 1, 3], ["FSP", 4, 4, 2, 3], ["FSP", 4, 8, 3, 3], ["FSP", 4, 12, 4, 3], ["FSP", 4, 16, 5, 3], ["RE", 4, [0, 4, 8, 12, 16, 1, 5, 9, 13, 17, 2, 6, 10, 14, 18, 3, 7, 11, 15, 19]], ["CA", 3, 4, 14], ["CHR", 2, "shared", [3]], ["CA", 3, 4, 17], ["CHR", 1, "shared", [4]], ["CA", 2, 5, 17], ["CI", 1], ["FU", 6, [0, 1, 2, 3, 4]], ["AN", 6, 0, 5], ["FU", 6, [1, 2, 3, 4, 5]], ["AN", 6, 1, 4], ["FU", 6, [2, 3, 4, 5, 6]], ["AN", 6, 2, 6], ["FU", 4, [0, 1, 2, 3, 4]], ["SP", 4, 0, 32, [1], 1], ["AN", 4, 1, 2], ["FFSP", 4, 0, [5, 4, 3, 2, 1], 1, 1], ["AN", 4, 1, 6], ["FU", 2, [0, 1, 2, 3, 4]], ["SP", 2, 0, 224, [1], 1], ["AN", 2, 1, 2], ["FFSP", 2, 0, [5, 4, 3, 2, 1], 1, 1], ["AN", 2, 1, 6], ["PR", 5, 0, "auto_unroll_max_step$1024"]]]], "r": [[0.000250206, 0.000250141, 0.000250099], 0, 6.16271, 1661898233], "v": "v0.6"}
{"i": [["[\"fused_conv3x3\", 4, 14, 14, 32, 32, 3, 3, 64]", "cuda -keys=cuda,gpu -max_num_threads=1024 -model=unknown -thread_warp_size=32", [-1, 16, 64, 49152, 2147483647, 1024, 8, 32], "", 0, []], [[], [["CHW", 3, "local"], ["SP", 3, 0, 4, [2, 2, 1, 1], 1], ["SP", 3, 5, 64, [1, 1, 1, 1], 1], ["SP", 3, 10, 14, [1, 7, 2, 1], 1], ["SP", 3, 15, 14, [1, 7, 1, 1], 1], ["SP", 3, 20, 32, [1, 1, 4, 4], 1], ["SP", 3, 25, 32, [1, 2], 1], ["SP", 3, 28, 3, [1, 1], 1], ["SP", 3, 31, 3, [1, 3], 1], ["RE", 3, [0, 5, 10, 15, 20, 1, 6, 11, 16, 21, 2, 7, 12, 17, 22, 25, 28, 31, 26, 29, 32, 3, 8, 13, 18, 23, 27, 30, 33, 4, 9, 14, 19, 24]], ["FSP", 4, 0, 1, 3], ["FSP", 4, 4, 2, 3], ["FSP", 4, 8, 3, 3], ["FSP", 4, 12, 4, 3], ["FSP", 4, 16, 5, 3], ["RE", 4, [0, 4, 8, 12, 16, 1, 5, 9, 13, 17, 2, 6, 10, 14, 18, 3, 7, 11, 15, 19]], ["CA", 3, 4, 14], ["CHR", 2, "shared", [3]], ["CA", 3, 4, 17], ["CHR", 1, "shared", [4]], ["CA", 2, 5, 17], ["CI", 1], ["FU", 6, [0, 1, 2, 3, 4]], ["AN", 6, 0, 5], ["FU", 6, [1, 2, 3, 4, 5]], ["AN", 6, 1, 4], ["FU", 6, [2, 3, 4, 5, 6]], ["AN", 6, 2, 6], ["FU", 4, [0, 1, 2, 3, 4]], ["SP", 4, 0, 384, [1], 1], ["AN", 4, 1, 2], ["FFSP", 4, 0, [5, 4, 3, 2, 1], 1, 1], ["AN", 4, 1, 6], ["FU", 2, [0, 1, 2, 3, 4]], ["SP", 2, 0, 16, [1], 1], ["AN", 2, 1, 2], ["FFSP", 2, 0, [5, 4, 3, 2, 1], 1, 1], ["AN", 2, 1, 6], ["PR", 5, 0, "auto_unroll_max_step$512"]]]], "r": [[0.000153116, 0.000152624, 0.000152469], 0, 7.83576, 1661898237], "v": "v0.6"}
{"i": [["[\"fused_conv3x3\", 4, 14, 14, 32, 32, 3, 3, 64]", "cuda -keys=cuda,gpu -max_num_threads=1024 -model=unknown -thread_warp_size=32", [-1, 16, 64, 49152, 2147483647, 1024, 8, 32], "", 0, []], [[], [["CHW", 3, "local"], ["SP", 3, 0, 4, [1, 2, 1, 1], 1], ["SP", 3, 5, 64, [4, 1, 2, 1], 1], ["SP", 3, 10, 14, [1, 14, 1, 1], 1], ["SP", 3, 15, 14, [1, 1, 2, 1], 1], ["SP", 3, 20, 32, [1, 2, 1, 16], 1], ["SP", 3, 25, 32, [1, 16], 1], ["SP", 3, 28, 3, [1, 1], 1], ["SP", 3, 31, 3, [1, 1], 1], ["RE", 3, [0, 5, 10, 15, 20, 1, 6, 11, 16, 21, 2, 7, 12, 17, 22, 25, 28, 31, 26, 29, 32, 3, 8, 13, 18, 23, 27, 30, 33, 4, 9, 14, 19, 24]], ["FSP", 4, 0, 1, 3], ["FSP", 4, 4, 2, 3], ["FSP", 4, 8, 3, 3], ["FSP", 4, 12, 4, 3], ["FSP", 4, 16, 5, 3], ["RE", 4, [0, 4, 8, 12, 16, 1, 5, 9, 13, 17, 2, 6, 10, 14, 18, 3, 7, 11, 15, 19]], ["CA", 3, 4, 14], ["CHR", 2, "shared", [3]], ["CA", 3, 4, 17], ["CHR", 1, "shared", [4]], ["CA", 2, 5, 17], ["CI", 1], ["FU", 6, [0, 1, 2, 3, 4]], ["AN", 6, 0, 5], ["FU", 6, [1, 2, 3, 4, 5]], ["AN", 6, 1, 4], ["FU", 6, [2, 3, 4, 5, 6]], ["AN", 6, 2, 6], ["FU", 4, [0, 1, 2, 3, 4]], ["SP", 4, 0, 512, [1], 1], ["AN", 4, 1, 2], ["FFSP", 4, 0, [5, 4, 3, 2, 1], 1, 1], ["AN", 4, 1, 6], ["FU", 2, [0, 1, 2, 3, 4]], ["SP", 2, 0, 64, [1], 1], ["AN", 2, 1, 2], ["FFSP", 2, 0, [5, 4, 3, 2, 1], 1, 1], ["AN", 2, 1, 6], ["PR", 5, 0, "auto_unroll_max_step$512"]]]], "r": [[0.00108559, 0.00108562, 0.00108515], 0, 16.2846, 1661898240], "v": "v0.6"}
{"i": [["[\"fused_conv3x3\", 4, 14, 14, 32, 32, 3, 3, 64]", "cuda -keys=cuda,gpu -max_num_threads=1024 -model=unknown -thread_warp_size=32", [-1, 16, 64, 49152, 2147483647, 1024, 8, 32], "", 0, []], [[], [["CHW", 3, "local"], ["SP", 3, 0, 4, [1, 2, 1, 2], 1], ["SP", 3, 5, 64, [2, 4, 1, 1], 1], ["SP", 3, 10, 14, [1, 1, 1, 1], 1], ["SP", 3, 15, 14, [1, 1, 1, 7], 1], ["SP", 3, 20, 32, [1, 4, 2, 1], 1], ["SP", 3, 25, 32, [1, 1], 1], ["SP", 3, 28, 3, [1, 3], 1], ["SP", 3, 31, 3, [1, 3], 1], ["RE", 3, [0, 5, 10, 15, 20, 1, 6, 11, 16, 21, 2, 7, 12, 17, 22, 25, 28, 31, 26, 29, 32, 3, 8, 13, 18, 23, 27, 30, 33, 4, 9, 14, 19, 24]], ["FSP", 4, 0, 1, 3], ["FSP", 4, 4, 2, 3], ["FSP", 4, 8, 3, 3], ["FSP", 4, 12, 4, 3], ["FSP", 4, 16, 5, 3], ["RE", 4, [0, 4, 8, 12, 16, 1, 5, 9, 13, 17, 2, 6, 10, 14, 18, 3, 7, 11, 15, 19]], ["CA", 3, 4, 14], ["CHR", 2, "shared", [3]], ["CA", 3, 4, 17], ["CHR", 1, "shared", [4]], ["CA", 2, 5, 17], ["CI", 1], ["FU", 6, [0, 1, 2, 3, 4]], ["AN", 6, 0, 5], ["FU", 6, [1, 2, 3, 4, 5]], ["AN", 6, 1, 4], ["FU", 6, [2, 3, 4, 5, 6]], ["AN", 6, 2, 6], ["FU", 4, [0, 1, 2, 3, 4]], ["SP", 4, 0, 18, [1], 1], ["AN", 4, 1, 2], ["FFSP", 4, 0, [5, 4, 3, 2, 1], 1, 1], ["AN", 4, 1, 6], ["FU", 2, [0, 1, 2, 3, 4]], ["SP", 2, 0, 54, [1], 1], ["AN", 2, 1, 2], ["FFSP", 2, 0, [5, 4, 3, 2, 1], 1, 1], ["AN", 2, 1, 6], ["PR", 5, 0, "auto_unroll_max_step$512"]]]], "r": [[0.000294801, 0.000295706, 0.000293521], 0, 13.9018, 1661898241], "v": "v0.6"}
{"i": [["[\"fused_conv3x3\", 4, 14, 14, 32, 32, 3, 3, 64]", "cuda -keys=cuda,gpu -max_num_threads=1024 -model=unknown -thread_warp_size=32", [-1, 16, 64, 49152, 2147483647, 1024, 8, 32], "", 0, []], [[], [["CHW", 3, "local"], ["SP", 3, 0, 4, [2, 1, 1, 2], 1], ["SP", 3, 5, 64, [1, 1, 4, 1], 1], ["SP", 3, 10, 14, [1, 7, 1, 1], 1], ["SP", 3, 15, 14, [1, 2, 1, 1], 1], ["SP", 3, 20, 32, [1, 32, 1, 1], 1], ["SP", 3, 25, 32, [2, 4], 1], ["SP", 3, 28, 3, [1, 1], 1], ["SP", 3, 31, 3, [1, 1], 1], ["RE", 3, [0, 5, 10, 15, 20, 1, 6, 11, 16, 21, 2, 7, 12, 17, 22, 25, 28, 31, 26, 29, 32, 3, 8, 13, 18, 23, 27, 30, 33, 4, 9, 14, 19, 24]], ["FSP", 4, 0, 1, 3], ["FSP", 4, 4, 2, 3], ["FSP", 4, 8, 3, 3], ["FSP", 4, 12, 4, 3], ["FSP", 4, 16, 5, 3], ["RE", 4, [0, 4, 8, 12, 16, 1, 5, 9, 13, 17, 2, 6, 10, 14, 18, 3, 7, 11, 15, 19]], ["CA", 3, 4, 14], ["CHR", 2, "shared", [3]], ["CA", 3, 4, 17], ["CHR", 1, "shared", [4]], ["CA", 2, 5, 17], ["CI", 1], ["FU", 6, [0, 1, 2, 3, 4]], ["AN", 6, 0, 5], ["FU", 6, [1, 2, 3, 4, 5]], ["AN", 6, 1, 4], ["FU", 6, [2, 3, 4, 5, 6]], ["AN", 6, 2, 6], ["FU", 4, [0, 1, 2, 3, 4]], ["SP", 4, 0, 96, [1], 1], ["AN", 4, 1, 2], ["FFSP", 4, 0, [5, 4, 3, 2, 1], 1, 1], ["AN", 4, 1, 6], ["FU", 2, [0, 1, 2, 3, 4]], ["SP", 2, 0, 576, [3], 1], ["AN", 2, 1, 2], ["FFSP", 2, 0, [5, 4, 3, 2, 1], 1, 1], ["AN", 2, 1, 6], ["PR", 5, 0, "auto_unroll_max_step$1024"]]]], "r": [[0.000155342, 0.000155303, 0.000154817], 0, 6.35541, 1661898234], "v": "v0.6"}
{"i": [["[\"fused_conv3x3\", 4, 14, 14, 32, 32, 3, 3, 64]", "cuda -keys=cuda,gpu -max_num_threads=1024 -model=unknown -thread_warp_size=32", [-1, 16, 64, 49152, 2147483647, 1024, 8, 32], "", 0, []], [[], [["CHW", 3, "local"], ["SP", 3, 0, 4, [4, 1, 1, 1], 1], ["SP", 3, 5, 64, [2, 4, 2, 1], 1], ["SP", 3, 10, 14, [1, 1, 2, 1], 1], ["SP", 3, 15, 14, [1, 1, 1, 2], 1], ["SP", 3, 20, 32, [1, 8, 2, 1], 1], ["SP", 3, 25, 32, [1, 16], 1], ["SP", 3, 28, 3, [1, 1], 1], ["SP", 3, 31, 3, [1, 1], 1], ["RE", 3, [0, 5, 10, 15, 20, 1, 6, 11, 16, 21, 2, 7, 12, 17, 22, 25, 28, 31, 26, 29, 32, 3, 8, 13, 18, 23, 27, 30, 33, 4, 9, 14, 19, 24]], ["FSP", 4, 0, 1, 3], ["FSP", 4, 4, 2, 3], ["FSP", 4, 8, 3, 3], ["FSP", 4, 12, 4, 3], ["FSP", 4, 16, 5, 3], ["RE", 4, [0, 4, 8, 12, 16, 1, 5, 9, 13, 17, 2, 6, 10, 14, 18, 3, 7, 11, 15, 19]], ["CA", 3, 4, 14], ["CHR", 2, "shared", [3]], ["CA", 3, 4, 17], ["CHR", 1, "shared", [4]], ["CA", 2, 5, 17], ["CI", 1], ["FU", 6, [0, 1, 2, 3, 4]], ["AN", 6, 0, 5], ["FU", 6, [1, 2, 3, 4, 5]], ["AN", 6, 1, 4], ["FU", 6, [2, 3, 4, 5, 6]], ["AN", 6, 2, 6], ["FU", 4, [0, 1, 2, 3, 4]], ["SP", 4, 0, 64, [4], 1], ["AN", 4, 1, 2], ["FFSP", 4, 0, [5, 4, 3, 2, 1], 1, 1], ["AN", 4, 1, 6], ["FU", 2, [0, 1, 2, 3, 4]], ["SP", 2, 0, 128, [1], 1], ["AN", 2, 1, 2], ["FFSP", 2, 0, [5, 4, 3, 2, 1], 1, 1], ["AN", 2, 1, 6], ["PR", 5, 0, "auto_unroll_max_step$16"]]]], "r": [[0.000546078, 0.000546356, 0.000546481], 0, 9.05312, 1661898239], "v": "v0.6"}
{"i": [["[\"fused_conv3x3\", 4, 14, 14, 32, 32, 3, 3, 64]", "cuda -keys=cuda,gpu -max_num_threads=1024 -model=unknown -thread_warp_size=32", [-1, 16, 64, 49152, 2147483647, 1024, 8, 32], "", 0, []], [[], [["CHW", 3, "local"], ["SP", 3, 0, 4, [1, 2, 1, 1], 1], ["SP", 3, 5, 64, [4, 4, 1, 4], 1], ["SP", 3, 10, 14, [1, 1, 1, 1], 1], ["SP", 3, 15, 14, [1, 1, 7, 2], 1], ["SP", 3, 20, 32, [1, 16, 1, 2], 1], ["SP", 3, 25, 32, [2, 1], 1], ["SP", 3, 28, 3, [1, 1], 1], ["SP", 3, 31, 3, [1, 1], 1], ["RE", 3, [0, 5, 10, 15, 20, 1, 6, 11, 16, 21, 2, 7, 12, 17, 22, 25, 28, 31, 26, 29, 32, 3, 8, 13, 18, 23, 27, 30, 33, 4, 9, 14, 19, 24]], ["FSP", 4, 0, 1, 3], ["FSP", 4, 4, 2, 3], ["FSP", 4, 8, 3, 3], ["FSP", 4, 12, 4, 3], ["FSP", 4, 16, 5, 3], ["RE", 4, [0, 4, 8, 12, 16, 1, 5, 9, 13, 17, 2, 6, 10, 14, 18, 3, 7, 11, 15, 19]], ["CA", 3, 4, 14], ["CHR", 2, "shared", [3]], ["CA", 3, 4, 17], ["CHR", 1, "shared", [4]], ["CA", 2, 5, 17], ["CI", 1], ["FU", 6, [0, 1, 2, 3, 4]], ["AN", 6, 0, 5], ["FU", 6, [1, 2, 3, 4, 5]], ["AN", 6, 1, 4], ["FU", 6, [2, 3, 4, 5, 6]], ["AN", 6, 2, 6], ["FU", 4, [0, 1, 2, 3, 4]], ["SP", 4, 0, 16, [1], 1], ["AN", 4, 1, 2], ["FFSP", 4, 0, [5, 4, 3, 2, 1], 1, 1], ["AN", 4, 1, 6], ["FU", 2, [0, 1, 2, 3, 4]], ["SP", 2, 0, 112, [1], 1], ["AN", 2, 1, 2], ["FFSP", 2, 0, [5, 4, 3, 2, 1], 1, 1], ["AN", 2, 1, 6], ["PR", 5, 0, "auto_unroll_max_step$16"]]]], "r": [[0.00239461, 0.00239284, 0.00239263], 0, 2.92477, 1661898232], "v": "v0.6"}
{"i": [["[\"fused_conv3x3\", 4, 14, 14, 32, 32, 3, 3, 64]", "cuda -keys=cuda,gpu -max_num_threads=1024 -model=unknown -thread_warp_size=32", [-1, 16, 64, 49152, 2147483647, 1024, 8, 32], "", 0, []], [[], [["CHW", 3, "local"], ["SP", 3, 0, 4, [1, 2, 1, 1], 1], ["SP", 3, 5, 64, [1, 2, 1, 2], 1], ["SP", 3, 10, 14, [2, 7, 1, 1], 1], ["SP", 3, 15, 14, [1, 2, 7, 1], 1], ["SP", 3, 20, 32, [1, 1, 16, 1], 1], ["SP", 3, 25, 32, [1, 4], 1], ["SP", 3, 28, 3, [1, 1], 1], ["SP", 3, 31, 3, [3, 1], 1], ["RE", 3, [0, 5, 10, 15, 20, 1, 6, 11, 16, 21, 2, 7, 12, 17, 22, 25, 28, 31, 26, 29, 32, 3, 8, 13, 18, 23, 27, 30, 33, 4, 9, 14, 19, 24]], ["FSP", 4, 0, 1, 3], ["FSP", 4, 4, 2, 3], ["FSP", 4, 8, 3, 3], ["FSP", 4, 12, 4, 3], ["FSP", 4, 16, 5, 3], ["RE", 4, [0, 4, 8, 12, 16, 1, 5, 9, 13, 17, 2, 6, 10, 14, 18, 3, 7, 11, 15, 19]], ["CA", 3, 4, 14], ["CHR", 2, "shared", [3]], ["CA", 3, 4, 17], ["CHR", 1, "shared", [4]], ["CA", 2, 5, 17], ["CI", 1], ["FU", 6, [0, 1, 2, 3, 4]], ["AN", 6, 0, 5], ["FU", 6, [1, 2, 3, 4, 5]], ["AN", 6, 1, 4], ["FU", 6, [2, 3, 4, 5, 6]], ["AN", 6, 2, 6], ["FU", 4, [0, 1, 2, 3, 4]], ["SP", 4, 0, 96, [1], 1], ["AN", 4, 1, 2], ["FFSP", 4, 0, [5, 4, 3, 2, 1], 1, 1], ["AN", 4, 1, 6], ["FU", 2, [0, 1, 2, 3, 4]], ["SP", 2, 0, 56, [1], 1], ["AN", 2, 1, 2], ["FFSP", 2, 0, [5, 4, 3, 2, 1], 1, 1], ["AN", 2, 1, 6], ["PR", 5, 0, "auto_unroll_max_step$512"]]]], "r": [[0.000809923, 0.000808618, 0.000808973], 0, 11.0648, 1661898237], "v": "v0.6"}
{"i": [["[\"fused_conv3x3\", 4, 14, 14, 32, 32, 3, 3, 64]", "cuda -keys=cuda,gpu -max_num_threads=1024 -model=unknown -thread_warp_size=32", [-1, 16, 64, 49152, 2147483647, 1024, 8, 32], "", 0, []], [[], [["CHW", 3, "local"], ["SP", 3, 0, 4, [2, 2, 1, 1], 1], ["SP", 3, 5, 64, [2, 4, 1, 1], 1], ["SP", 3, 10, 14, [1, 2, 1, 1], 1], ["SP", 3, 15, 14, [1, 1, 7, 1], 1], ["SP", 3, 20, 32, [1, 4, 4, 1], 1], ["SP", 3, 25, 32, [2, 2], 1], ["SP", 3, 28, 3, [1, 3], 1], ["SP", 3, 31, 3, [1, 3], 1], ["RE", 3, [0, 5, 10, 15, 20, 1, 6, 11, 16, 21, 2, 7, 12, 17, 22, 25, 28, 31, 26, 29, 32, 3, 8, 13, 18, 23, 27, 30, 33, 4, 9, 14, 19, 24]], ["FSP", 4, 0, 1, 3], ["FSP", 4, 4, 2, 3], ["FSP", 4, 8, 3, 3], ["FSP", 4, 12, 4, 3], ["FSP", 4, 16, 5, 3], ["RE", 4, [0, 4, 8, 12, 16, 1, 5, 9, 13, 17, 2, 6, 10, 14, 18, 3, 7, 11, 15, 19]], ["CA", 3, 4, 14], ["CHR", 2, "shared", [3]], ["CA", 3, 4, 17], ["CHR", 1, "shared", [4]], ["CA", 2, 5, 17], ["CI", 1], ["FU", 6, [0, 1, 2, 3, 4]], ["AN", 6, 0, 5], ["FU", 6, [1, 2, 3, 4, 5]], ["AN", 6, 1, 4], ["FU", 6, [2, 3, 4, 5, 6]], ["AN", 6, 2, 6], ["FU", 4, [0, 1, 2, 3, 4]], ["SP", 4, 0, 288, [1], 1], ["AN", 4, 1, 2], ["FFSP", 4, 0, [5, 4, 3, 2, 1], 1, 1], ["AN", 4, 1, 6], ["FU", 2, [0, 1, 2, 3, 4]], ["SP", 2, 0, 216, [1], 1], ["AN", 2, 1, 2], ["FFSP", 2, 0, [5, 4, 3, 2, 1], 1, 1], ["AN", 2, 1, 6], ["PR", 5, 0, "auto_unroll_max_step$0"]]]], "r": [[0.000301159, 0.000300664, 0.000300127], 0, 8.62574, 1661898238], "v": "v0.6"}
{"i": [["[\"fused_conv3x3\", 4, 14, 14, 32, 32, 3, 3, 64]", "cuda -keys=cuda,gpu -max_num_threads=1024 -model=unknown -thread_warp_size=32", [-1, 16, 64, 49152, 2147483647, 1024, 8, 32], "", 0, []], [[], [["CHW", 3, "local"], ["SP", 3, 0, 4, [1, 2, 1, 1], 1], ["SP", 3, 5, 64, [1, 8, 2, 2], 1], ["SP", 3, 10, 14, [1, 1, 1, 1], 1], ["SP", 3, 15, 14, [1, 1, 7, 1], 1], ["SP", 3, 20, 32, [1, 4, 1, 4], 1], ["SP", 3, 25, 32, [2, 1], 1], ["SP", 3, 28, 3, [1, 1], 1], ["SP", 3, 31, 3, [1, 1], 1], ["RE", 3, [0, 5, 10, 15, 20, 1, 6, 11, 16, 21, 2, 7, 12, 17, 22, 25, 28, 31, 26, 29, 32, 3, 8, 13, 18, 23, 27, 30, 33, 4, 9, 14, 19, 24]], ["FSP", 4, 0, 1, 3], ["FSP", 4, 4, 2, 3], ["FSP", 4, 8, 3, 3], ["FSP", 4, 12, 4, 3], ["FSP", 4, 16, 5, 3], ["RE", 4, [0, 4, 8, 12, 16, 1, 5, 9, 13, 17, 2, 6, 10, 14, 18, 3, 7, 11, 15, 19]], ["CA", 3, 4, 14], ["CHR", 2, "shared", [3]], ["CA", 3, 4, 17], ["CHR", 1, "shared", [4]], ["CA", 2, 5, 17], ["CI", 1], ["FU", 6, [0, 1, 2, 3, 4]], ["AN", 6, 0, 5], ["FU", 6, [1, 2, 3, 4, 5]], ["AN", 6, 1, 4], ["FU", 6, [2, 3, 4, 5, 6]], ["AN", 6, 2, 6], ["FU", 4, [0, 1, 2, 3, 4]], ["SP", 4, 0, 32, [1], 1], ["AN", 4, 1, 2], ["FFSP", 4, 0, [5, 4, 3, 2, 1], 1, 1], ["AN", 4, 1, 6], ["FU", 2, [0, 1, 2, 3, 4]], ["SP", 2, 0, 56, [1], 1], ["AN", 2, 1, 2], ["FFSP", 2, 0, [5, 4, 3, 2, 1], 1, 1], ["AN", 2, 1, 6], ["PR", 5, 0, "auto_unroll_max_step$16"]]]], "r": [[0.000235576, 0.000235369, 0.000234247], 0, 13.0123, 1661898242], "v": "v0.6"}
{"i": [["[\"fused_conv3x3\", 4, 14, 14, 32, 32, 3, 3, 64]", "cuda -keys=cuda,gpu -max_num_threads=1024 -model=unknown -thread_warp_size=32", [-1, 16, 64, 49152, 2147483647, 1024, 8, 32], "", 0, []], [[], [["CHW", 3, "local"], ["SP", 3, 0, 4, [1, 1, 1, 2], 1], ["SP", 3, 5, 64, [1, 16, 1, 1], 1], ["SP", 3, 10, 14, [1, 1, 7, 1], 1], ["SP", 3, 15, 14, [1, 2, 1, 7], 1], ["SP", 3, 20, 32, [4, 1, 4, 1], 1], ["SP", 3, 25, 32, [1, 1], 1], ["SP", 3, 28, 3, [1, 3], 1], ["SP", 3, 31, 3, [1, 1], 1], ["RE", 3, [0, 5, 10, 15, 20, 1, 6, 11, 16, 21, 2, 7, 12, 17, 22, 25, 28, 31, 26, 29, 32, 3, 8, 13, 18, 23, 27, 30, 33, 4, 9, 14, 19, 24]], ["FSP", 4, 0, 1, 3], ["FSP", 4, 4, 2, 3], ["FSP", 4, 8, 3, 3], ["FSP", 4, 12, 4, 3], ["FSP", 4, 16, 5, 3], ["RE", 4, [0, 4, 8, 12, 16, 1, 5, 9, 13, 17, 2, 6, 10, 14, 18, 3, 7, 11, 15, 19]], ["CA", 3, 4, 14], ["CHR", 2, "shared", [3]], ["CA", 3, 4, 17], ["CHR", 1, "shared", [4]], ["CA", 2, 5, 17], ["CI", 1], ["FU", 6, [0, 1, 2, 3, 4]], ["AN", 6, 0, 5], ["FU", 6, [1, 2, 3, 4, 5]], ["AN", 6, 1, 4], ["FU", 6, [2, 3, 4, 5, 6]], ["AN", 6, 2, 6], ["FU", 4, [0, 1, 2, 3, 4]], ["SP", 4, 0, 24, [1], 1], ["AN", 4, 1, 2], ["FFSP", 4, 0, [5, 4, 3, 2, 1], 1, 1], ["AN", 4, 1, 6], ["FU", 2, [0, 1, 2, 3, 4]], ["SP", 2, 0, 324, [1], 1], ["AN", 2, 1, 2], ["FFSP", 2, 0, [5, 4, 3, 2, 1], 1, 1], ["AN", 2, 1, 6], ["PR", 5, 0, "auto_unroll_max_step$16"]]]], "r": [[0.00681351, 0.00693539, 0.00683463], 0, 13.4509, 1661898243], "v": "v0.6"}
{"i": [["[\"fused_conv3x3\", 4, 14, 14, 32, 32, 3, 3, 64]", "cuda -keys=cuda,gpu -max_num_threads=1024 -model=unknown -thread_warp_size=32", [-1, 16, 64, 49152, 2147483647, 1024, 8, 32], "", 0, []], [[], [["CHW", 3, "local"], ["SP", 3, 0, 4, [2, 1, 2, 1], 1], ["SP", 3, 5, 64, [1, 8, 1, 1], 1], ["SP", 3, 10, 14, [1, 2, 7, 1], 1], ["SP", 3, 15, 14, [1, 1, 1, 1], 1], ["SP", 3, 20, 32, [1, 8, 2, 1], 1], ["SP", 3, 25, 32, [2, 1], 1], ["SP", 3, 28, 3, [1, 3], 1], ["SP", 3, 31, 3, [1, 3], 1], ["RE", 3, [0, 5, 10, 15, 20, 1, 6, 11, 16, 21, 2, 7, 12, 17, 22, 25, 28, 31, 26, 29, 32, 3, 8, 13, 18, 23, 27, 30, 33, 4, 9, 14, 19, 24]], ["FSP", 4, 0, 1, 3], ["FSP", 4, 4, 2, 3], ["FSP", 4, 8, 3, 3], ["FSP", 4, 12, 4, 3], ["FSP", 4, 16, 5, 3], ["RE", 4, [0, 4, 8, 12, 16, 1, 5, 9, 13, 17, 2, 6, 10, 14, 18, 3, 7, 11, 15, 19]], ["CA", 3, 4, 14], ["CHR", 2, "shared", [3]], ["CA", 3, 4, 17], ["CHR", 1, "shared", [4]], ["CA", 2, 5, 17], ["CI", 1], ["FU", 6, [0, 1, 2, 3, 4]], ["AN", 6, 0, 5], ["FU", 6, [1, 2, 3, 4, 5]], ["AN", 6, 1, 4], ["FU", 6, [2, 3, 4, 5, 6]], ["AN", 6, 2, 6], ["FU", 4, [0, 1, 2, 3, 4]], ["SP", 4, 0, 72, [1], 1], ["AN", 4, 1, 2], ["FFSP", 4, 0, [5, 4, 3, 2, 1], 1, 1], ["AN", 4, 1, 6], ["FU", 2, [0, 1, 2, 3, 4]], ["SP", 2, 0, 216, [36], 1], ["AN", 2, 1, 2], ["FFSP", 2, 0, [5, 4, 3, 2, 1], 1, 1], ["AN", 2, 1, 6], ["PR", 5, 0, "auto_unroll_max_step$512"]]]], "r": [[0.000188116, 0.000188083, 0.000187988], 0, 13.9403, 1661898241], "v": "v0.6"}
{"i": [["[\"fused_conv3x3\", 4, 14, 14, 32, 32, 3, 3, 64]", "cuda -keys=cuda,gpu -max_num_threads=1024 -model=unknown -thread_warp_size=32", [-1, 16, 64, 49152, 2147483647, 1024, 8, 32], "", 0, []], [[], [["CHW", 3, "local"], ["SP", 3, 0, 4, [1, 2, 1, 1], 1], ["SP", 3, 5, 64, [1, 1, 4, 4], 1], ["SP", 3, 10, 14, [1, 2, 1, 1], 1], ["SP", 3, 15, 14, [1, 14, 1, 1], 1], ["SP", 3, 20, 32, [1, 2, 16, 1], 1], ["SP", 3, 25, 32, [2, 1], 1], ["SP", 3, 28, 3, [1, 3], 1], ["SP", 3, 31, 3, [1, 1], 1], ["RE", 3, [0, 5, 10, 15, 20, 1, 6, 11, 16, 21, 2, 7, 12, 17, 22, 25, 28, 31, 26, 29, 32, 3, 8, 13, 18, 23, 27, 30, 33, 4, 9, 14, 19, 24]], ["FSP", 4, 0, 1, 3], ["FSP", 4, 4, 2, 3], ["FSP", 4, 8, 3, 3], ["FSP", 4, 12, 4, 3], ["FSP", 4, 16, 5, 3], ["RE", 4, [0, 4, 8, 12, 16, 1, 5, 9, 13, 17, 2, 6, 10, 14, 18, 3, 7, 11, 15, 19]], ["CA", 3, 4, 14], ["CHR", 2, "shared", [3]], ["CA", 3, 4, 17], ["CHR", 1, "shared", [4]], ["CA", 2, 5, 17], ["CI", 1], ["FU", 6, [0, 1, 2, 3, 4]], ["AN", 6, 0, 5], ["FU", 6, [1, 2, 3, 4, 5]], ["AN", 6, 1, 4], ["FU", 6, [2, 3, 4, 5, 6]], ["AN", 6, 2, 6], ["FU", 4, [0, 1, 2, 3, 4]], ["SP", 4, 0, 1536, [1], 1], ["AN", 4, 1, 2], ["FFSP", 4, 0, [5, 4, 3, 2, 1], 1, 1], ["AN", 4, 1, 6], ["FU", 2, [0, 1, 2, 3, 4]], ["SP", 2, 0, 288, [8], 1], ["AN", 2, 1, 2], ["FFSP", 2, 0, [5, 4, 3, 2, 1], 1, 1], ["AN", 2, 1, 6], ["PR", 5, 0, "auto_unroll_max_step$0"]]]], "r": [[0.0012053, 0.00120283, 0.00120397], 0, 16.828, 1661898246], "v": "v0.6"}
{"i": [["[\"fused_conv3x3\", 4, 14, 14, 32, 32, 3, 3, 64]", "cuda -keys=cuda,gpu -max_num_threads=1024 -model=unknown -thread_warp_size=32", [-1, 16, 64, 49152, 2147483647, 1024, 8, 32], "", 0, []], [[], [["CHW", 3, "local"], ["SP", 3, 0, 4, [1, 2, 1, 1], 1], ["SP", 3, 5, 64, [1, 1, 4, 4], 1], ["SP", 3, 10, 14, [1, 2, 1, 1], 1], ["SP", 3, 15, 14, [1, 7, 1, 1], 1], ["SP", 3, 20, 32, [1, 2, 16, 1], 1], ["SP", 3, 25, 32, [2, 1], 1], ["SP", 3, 28, 3, [1, 1], 1], ["SP", 3, 31, 3, [1, 1], 1], ["RE", 3, [0, 5, 10, 15, 20, 1, 6, 11, 16, 21, 2, 7, 12, 17, 22, 25, 28, 31, 26, 29, 32, 3, 8, 13, 18, 23, 27, 30, 33, 4, 9, 14, 19, 24]], ["FSP", 4, 0, 1, 3], ["FSP", 4, 4, 2, 3], ["FSP", 4, 8, 3, 3], ["FSP", 4, 12, 4, 3], ["FSP", 4, 16, 5, 3], ["RE", 4, [0, 4, 8, 12, 16, 1, 5, 9, 13, 17, 2, 6, 10, 14, 18, 3, 7, 11, 15, 19]], ["CA", 3, 4, 14], ["CHR", 2, "shared", [3]], ["CA", 3, 4, 17], ["CHR", 1, "shared", [4]], ["CA", 2, 5, 17], ["CI", 1], ["FU", 6, [0, 1, 2, 3, 4]], ["AN", 6, 0, 5], ["FU", 6, [1, 2, 3, 4, 5]], ["AN", 6, 1, 4], ["FU", 6, [2, 3, 4, 5, 6]], ["AN", 6, 2, 6], ["FU", 4, [0, 1, 2, 3, 4]], ["SP", 4, 0, 1536, [1], 1], ["AN", 4, 1, 2], ["FFSP", 4, 0, [5, 4, 3, 2, 1], 1, 1], ["AN", 4, 1, 6], ["FU", 2, [0, 1, 2, 3, 4]], ["SP", 2, 0, 288, [1], 1], ["AN", 2, 1, 2], ["FFSP", 2, 0, [5, 4, 3, 2, 1], 1, 1], ["AN", 2, 1, 6], ["PR", 5, 0, "auto_unroll_max_step$1024"]]]], "r": [[0.0028146, 0.00281478, 0.00281804], 0, 16.7032, 1661898244], "v": "v0.6"}
{"i": [["[\"fused_conv3x3\", 4, 14, 14, 32, 32, 3, 3, 64]", "cuda -keys=cuda,gpu -max_num_threads=1024 -model=unknown -thread_warp_size=32", [-1, 16, 64, 49152, 2147483647, 1024, 8, 32], "", 0, []], [[], [["CHW", 3, "local"], ["SP", 3, 0, 4, [2, 2, 1, 1], 1], ["SP", 3, 5, 64, [1, 1, 16, 1], 1], ["SP", 3, 10, 14, [1, 14, 1, 1], 1], ["SP", 3, 15, 14, [1, 1, 1, 1], 1], ["SP", 3, 20, 32, [1, 8, 1, 2], 1], ["SP", 3, 25, 32, [2, 2], 1], ["SP", 3, 28, 3, [1, 1], 1], ["SP", 3, 31, 3, [1, 3], 1], ["RE", 3, [0, 5, 10, 15, 20, 1, 6, 11, 16, 21, 2, 7, 12, 17, 22, 25, 28, 31, 26, 29, 32, 3, 8, 13, 18, 23, 27, 30, 33, 4, 9, 14, 19, 24]], ["FSP", 4, 0, 1, 3], ["FSP", 4, 4, 2, 3], ["FSP", 4, 8, 3, 3], ["FSP", 4, 12, 4, 3], ["FSP", 4, 16, 5, 3], ["RE", 4, [0, 4, 8, 12, 16, 1, 5, 9, 13, 17, 2, 6, 10, 14, 18, 3, 7, 11, 15, 19]], ["CA", 3, 4, 14], ["CHR", 2, "shared", [3]], ["CA", 3, 4, 17], ["CHR", 1, "shared", [4]], ["CA", 2, 5, 17], ["CI", 1], ["FU", 6, [0, 1, 2, 3, 4]], ["AN", 6, 0, 5], ["FU", 6, [1, 2, 3, 4, 5]], ["AN", 6, 1, 4], ["FU", 6, [2, 3, 4, 5, 6]], ["AN", 6, 2, 6], ["FU", 4, [0, 1, 2, 3, 4]], ["SP", 4, 0, 192, [1], 1], ["AN", 4, 1, 2], ["FFSP", 4, 0, [5, 4, 3, 2, 1], 1, 1], ["AN", 4, 1, 6], ["FU", 2, [0, 1, 2, 3, 4]], ["SP", 2, 0, 64, [1], 1], ["AN", 2, 1, 2], ["FFSP", 2, 0, [5, 4, 3, 2, 1], 1, 1], ["AN", 2, 1, 6], ["PR", 5, 0, "auto_unroll_max_step$1024"]]]], "r": [[0.000180473, 0.000180397, 0.000180424], 0, 17.7852, 1661898245], "v": "v0.6"}
{"i": [["[\"fused_conv3x3\", 4, 14, 14, 32, 32, 3, 3, 64]", "cuda -keys=cuda,gpu -max_num_threads=1024 -model=unknown -thread_warp_size=32", [-1, 16, 64, 49152, 2147483647, 1024, 8, 32], "", 0, []], [[], [["CHW", 3, "local"], ["SP", 3, 0, 4, [1, 2, 1, 2], 1], ["SP", 3, 5, 64, [1, 1, 1, 8], 1], ["SP", 3, 10, 14, [1, 7, 2, 1], 1], ["SP", 3, 15, 14, [2, 1, 1, 1], 1], ["SP", 3, 20, 32, [2, 4, 1, 4], 1], ["SP", 3, 25, 32, [2, 1], 1], ["SP", 3, 28, 3, [1, 1], 1], ["SP", 3, 31, 3, [3, 1], 1], ["RE", 3, [0, 5, 10, 15, 20, 1, 6, 11, 16, 21, 2, 7, 12, 17, 22, 25, 28, 31, 26, 29, 32, 3, 8, 13, 18, 23, 27, 30, 33, 4, 9, 14, 19, 24]], ["FSP", 4, 0, 1, 3], ["FSP", 4, 4, 2, 3], ["FSP", 4, 8, 3, 3], ["FSP", 4, 12, 4, 3], ["FSP", 4, 16, 5, 3], ["RE", 4, [0, 4, 8, 12, 16, 1, 5, 9, 13, 17, 2, 6, 10, 14, 18, 3, 7, 11, 15, 19]], ["CA", 3, 4, 14], ["CHR", 2, "shared", [3]], ["CA", 3, 4, 17], ["CHR", 1, "shared", [4]], ["CA", 2, 5, 17], ["CI", 1], ["FU", 6, [0, 1, 2, 3, 4]], ["AN", 6, 0, 5], ["FU", 6, [1, 2, 3, 4, 5]], ["AN", 6, 1, 4], ["FU", 6, [2, 3, 4, 5, 6]], ["AN", 6, 2, 6], ["FU", 4, [0, 1, 2, 3, 4]], ["SP", 4, 0, 576, [2], 1], ["AN", 4, 1, 2], ["FFSP", 4, 0, [5, 4, 3, 2, 1], 1, 1], ["AN", 4, 1, 6], ["FU", 2, [0, 1, 2, 3, 4]], ["SP", 2, 0, 384, [1], 1], ["AN", 2, 1, 2], ["FFSP", 2, 0, [5, 4, 3, 2, 1], 1, 1], ["AN", 2, 1, 6], ["PR", 5, 0, "auto_unroll_max_step$0"]]]], "r": [[0.00170563, 0.00170378, 0.00170321], 0, 17.8655, 1661898247], "v": "v0.6"}
{"i": [["[\"fused_conv3x3\", 4, 14, 14, 32, 32, 3, 3, 64]", "cuda -keys=cuda,gpu -max_num_threads=1024 -model=unknown -thread_warp_size=32", [-1, 16, 64, 49152, 2147483647, 1024, 8, 32], "", 0, []], [[], [["CHW", 3, "local"], ["SP", 3, 0, 4, [1, 4, 1, 1], 1], ["SP", 3, 5, 64, [1, 2, 1, 8], 1], ["SP", 3, 10, 14, [1, 1, 1, 1], 1], ["SP", 3, 15, 14, [1, 7, 1, 1], 1], ["SP", 3, 20, 32, [1, 1, 1, 16], 1], ["SP", 3, 25, 32, [2, 1], 1], ["SP", 3, 28, 3, [1, 3], 1], ["SP", 3, 31, 3, [3, 1], 1], ["RE", 3, [0, 5, 10, 15, 20, 1, 6, 11, 16, 21, 2, 7, 12, 17, 22, 25, 28, 31, 26, 29, 32, 3, 8, 13, 18, 23, 27, 30, 33, 4, 9, 14, 19, 24]], ["FSP", 4, 0, 1, 3], ["FSP", 4, 4, 2, 3], ["FSP", 4, 8, 3, 3], ["FSP", 4, 12, 4, 3], ["FSP", 4, 16, 5, 3], ["RE", 4, [0, 4, 8, 12, 16, 1, 5, 9, 13, 17, 2, 6, 10, 14, 18, 3, 7, 11, 15, 19]], ["CA", 3, 4, 14], ["CHR", 2, "shared", [3]], ["CA", 3, 4, 17], ["CHR", 1, "shared", [4]], ["CA", 2, 5, 17], ["CI", 1], ["FU", 6, [0, 1, 2, 3, 4]], ["AN", 6, 0, 5], ["FU", 6, [1, 2, 3, 4, 5]], ["AN", 6, 1, 4], ["FU", 6, [2, 3, 4, 5, 6]], ["AN", 6, 2, 6], ["FU", 4, [0, 1, 2, 3, 4]], ["SP", 4, 0, 2304, [18], 1], ["AN", 4, 1, 2], ["FFSP", 4, 0, [5, 4, 3, 2, 1], 1, 1], ["AN", 4, 1, 6], ["FU", 2, [0, 1, 2, 3, 4]], ["SP", 2, 0, 144, [1], 1], ["AN", 2, 1, 2], ["FFSP", 2, 0, [5, 4, 3, 2, 1], 1, 1], ["AN", 2, 1, 6], ["PR", 5, 0, "auto_unroll_max_step$512"]]]], "r": [[0.000455301, 0.000454665, 0.000454769], 0, 23.8065, 1661898248], "v": "v0.6"}
{"i": [["[\"fused_conv3x3\", 4, 14, 14, 32, 32, 3, 3, 64]", "cuda -keys=cuda,gpu -max_num_threads=1024 -model=unknown -thread_warp_size=32", [-1, 16, 64, 49152, 2147483647, 1024, 8, 32], "", 0, []], [[], [["CHW", 3, "local"], ["SP", 3, 0, 4, [2, 1, 2, 1], 1], ["SP", 3, 5, 64, [2, 2, 4, 1], 1], ["SP", 3, 10, 14, [1, 2, 7, 1], 1], ["SP", 3, 15, 14, [1, 2, 1, 1], 1], ["SP", 3, 20, 32, [1, 8, 1, 4], 1], ["SP", 3, 25, 32, [2, 1], 1], ["SP", 3, 28, 3, [1, 1], 1], ["SP", 3, 31, 3, [1, 1], 1], ["RE", 3, [0, 5, 10, 15, 20, 1, 6, 11, 16, 21, 2, 7, 12, 17, 22, 25, 28, 31, 26, 29, 32, 3, 8, 13, 18, 23, 27, 30, 33, 4, 9, 14, 19, 24]], ["FSP", 4, 0, 1, 3], ["FSP", 4, 4, 2, 3], ["FSP", 4, 8, 3, 3], ["FSP", 4, 12, 4, 3], ["FSP", 4, 16, 5, 3], ["RE", 4, [0, 4, 8, 12, 16, 1, 5, 9, 13, 17, 2, 6, 10, 14, 18, 3, 7, 11, 15, 19]], ["CA", 3, 4, 14], ["CHR", 2, "shared", [3]], ["CA", 3, 4, 17], ["CHR", 1, "shared", [4]], ["CA", 2, 5, 17], ["CI", 1], ["FU", 6, [0, 1, 2, 3, 4]], ["AN", 6, 0, 5], ["FU", 6, [1, 2, 3, 4, 5]], ["AN", 6, 1, 4], ["FU", 6, [2, 3, 4, 5, 6]], ["AN", 6, 2, 6], ["FU", 4, [0, 1, 2, 3, 4]], ["SP", 4, 0, 32, [1], 1], ["AN", 4, 1, 2], ["FFSP", 4, 0, [5, 4, 3, 2, 1], 1, 1], ["AN", 4, 1, 6], ["FU", 2, [0, 1, 2, 3, 4]], ["SP", 2, 0, 224, [1], 1], ["AN", 2, 1, 2], ["FFSP", 2, 0, [5, 4, 3, 2, 1], 1, 1], ["AN", 2, 1, 6], ["PR", 5, 0, "auto_unroll_max_step$16"]]]], "r": [[0.00288914, 0.00288164, 0.00288642], 0, 21.066, 1661898250], "v": "v0.6"}
{"i": [["[\"fused_conv3x3\", 4, 14, 14, 32, 32, 3, 3, 64]", "cuda -keys=cuda,gpu -max_num_threads=1024 -model=unknown -thread_warp_size=32", [-1, 16, 64, 49152, 2147483647, 1024, 8, 32], "", 0, []], [[], [["CHW", 3, "local"], ["SP", 3, 0, 4, [1, 1, 1, 1], 1], ["SP", 3, 5, 64, [1, 1, 2, 8], 1], ["SP", 3, 10, 14, [1, 7, 1, 1], 1], ["SP", 3, 15, 14, [1, 7, 1, 1], 1], ["SP", 3, 20, 32, [4, 1, 2, 1], 1], ["SP", 3, 25, 32, [1, 1], 1], ["SP", 3, 28, 3, [3, 1], 1], ["SP", 3, 31, 3, [3, 1], 1], ["RE", 3, [0, 5, 10, 15, 20, 1, 6, 11, 16, 21, 2, 7, 12, 17, 22, 25, 28, 31, 26, 29, 32, 3, 8, 13, 18, 23, 27, 30, 33, 4, 9, 14, 19, 24]], ["FSP", 4, 0, 1, 3], ["FSP", 4, 4, 2, 3], ["FSP", 4, 8, 3, 3], ["FSP", 4, 12, 4, 3], ["FSP", 4, 16, 5, 3], ["RE", 4, [0, 4, 8, 12, 16, 1, 5, 9, 13, 17, 2, 6, 10, 14, 18, 3, 7, 11, 15, 19]], ["CA", 3, 4, 14], ["CHR", 2, "shared", [3]], ["CA", 3, 4, 17], ["CHR", 1, "shared", [4]], ["CA", 2, 5, 17], ["CI", 1], ["FU", 6, [0, 1, 2, 3, 4]], ["AN", 6, 0, 5], ["FU", 6, [1, 2, 3, 4, 5]], ["AN", 6, 1, 4], ["FU", 6, [2, 3, 4, 5, 6]], ["AN", 6, 2, 6], ["FU", 4, [0, 1, 2, 3, 4]], ["SP", 4, 0, 288, [1], 1], ["AN", 4, 1, 2], ["FFSP", 4, 0, [5, 4, 3, 2, 1], 1, 1], ["AN", 4, 1, 6], ["FU", 2, [0, 1, 2, 3, 4]], ["SP", 2, 0, 144, [1], 1], ["AN", 2, 1, 2], ["FFSP", 2, 0, [5, 4, 3, 2, 1], 1, 1], ["AN", 2, 1, 6], ["PR", 5, 0, "auto_unroll_max_step$1024"]]]], "r": [[0.000246498, 0.000246605, 0.000246552], 0, 21.6432, 1661898249], "v": "v0.6"}
{"i": [["[\"fused_conv3x3\", 4, 14, 14, 32, 32, 3, 3, 64]", "cuda -keys=cuda,gpu -max_num_threads=1024 -model=unknown -thread_warp_size=32", [-1, 16, 64, 49152, 2147483647, 1024, 8, 32], "", 0, []], [[], [["CHW", 3, "local"], ["SP", 3, 0, 4, [1, 2, 1, 1], 1], ["SP", 3, 5, 64, [1, 1, 1, 4], 1], ["SP", 3, 10, 14, [7, 2, 1, 1], 1], ["SP", 3, 15, 14, [1, 7, 1, 1], 1], ["SP", 3, 20, 32, [1, 2, 1, 16], 1], ["SP", 3, 25, 32, [1, 4], 1], ["SP", 3, 28, 3, [3, 1], 1], ["SP", 3, 31, 3, [3, 1], 1], ["RE", 3, [0, 5, 10, 15, 20, 1, 6, 11, 16, 21, 2, 7, 12, 17, 22, 25, 28, 31, 26, 29, 32, 3, 8, 13, 18, 23, 27, 30, 33, 4, 9, 14, 19, 24]], ["FSP", 4, 0, 1, 3], ["FSP", 4, 4, 2, 3], ["FSP", 4, 8, 3, 3], ["FSP", 4, 12, 4, 3], ["FSP", 4, 16, 5, 3], ["RE", 4, [0, 4, 8, 12, 16, 1, 5, 9, 13, 17, 2, 6, 10, 14, 18, 3, 7, 11, 15, 19]], ["CA", 3, 4, 14], ["CHR", 2, "shared", [3]], ["CA", 3, 4, 17], ["CHR", 1, "shared", [4]], ["CA", 2, 5, 17], ["CI", 1], ["FU", 6, [0, 1, 2, 3, 4]], ["AN", 6, 0, 5], ["FU", 6, [1, 2, 3, 4, 5]], ["AN", 6, 1, 4], ["FU", 6, [2, 3, 4, 5, 6]], ["AN", 6, 2, 6], ["FU", 4, [0, 1, 2, 3, 4]], ["SP", 4, 0, 2304, [1], 1], ["AN", 4, 1, 2], ["FFSP", 4, 0, [5, 4, 3, 2, 1], 1, 1], ["AN", 4, 1, 6], ["FU", 2, [0, 1, 2, 3, 4]], ["SP", 2, 0, 144, [1], 1], ["AN", 2, 1, 2], ["FFSP", 2, 0, [5, 4, 3, 2, 1], 1, 1], ["AN", 2, 1, 6], ["PR", 5, 0, "auto_unroll_max_step$16"]]]], "r": [[0.00150069, 0.00149888, 0.00149944], 0, 22.1544, 1661898252], "v": "v0.6"}
{"i": [["[\"fused_conv3x3\", 4, 14, 14, 32, 32, 3, 3, 64]", "cuda -keys=cuda,gpu -max_num_threads=1024 -model=unknown -thread_warp_size=32", [-1, 16, 64, 49152, 2147483647, 1024, 8, 32], "", 0, []], [[], [["CHW", 3, "local"], ["SP", 3, 0, 4, [1, 1, 1, 1], 1], ["SP", 3, 5, 64, [1, 4, 8, 1], 1], ["SP", 3, 10, 14, [1, 1, 2, 1], 1], ["SP", 3, 15, 14, [1, 2, 1, 7], 1], ["SP", 3, 20, 32, [2, 16, 1, 1], 1], ["SP", 3, 25, 32, [1, 1], 1], ["SP", 3, 28, 3, [1, 3], 1], ["SP", 3, 31, 3, [1, 3], 1], ["RE", 3, [0, 5, 10, 15, 20, 1, 6, 11, 16, 21, 2, 7, 12, 17, 22, 25, 28, 31, 26, 29, 32, 3, 8, 13, 18, 23, 27, 30, 33, 4, 9, 14, 19, 24]], ["FSP", 4, 0, 1, 3], ["FSP", 4, 4, 2, 3], ["FSP", 4, 8, 3, 3], ["FSP", 4, 12, 4, 3], ["FSP", 4, 16, 5, 3], ["RE", 4, [0, 4, 8, 12, 16, 1, 5, 9, 13, 17, 2, 6, 10, 14, 18, 3, 7, 11, 15, 19]], ["CA", 3, 4, 14], ["CHR", 2, "shared", [3]], ["CA", 3, 4, 17], ["CHR", 1, "shared", [4]], ["CA", 2, 5, 17], ["CI", 1], ["FU", 6, [0, 1, 2, 3, 4]], ["AN", 6, 0, 5], ["FU", 6, [1, 2, 3, 4, 5]], ["AN", 6, 1, 4], ["FU", 6, [2, 3, 4, 5, 6]], ["AN", 6, 2, 6], ["FU", 4, [0, 1, 2, 3, 4]], ["SP", 4, 0, 72, [1], 1], ["AN", 4, 1, 2], ["FFSP", 4, 0, [5, 4, 3, 2, 1], 1, 1], ["AN", 4, 1, 6], ["FU", 2, [0, 1, 2, 3, 4]], ["SP", 2, 0, 288, [1], 1], ["AN", 2, 1, 2], ["FFSP", 2, 0, [5, 4, 3, 2, 1], 1, 1], ["AN", 2, 1, 6], ["PR", 5, 0, "auto_unroll_max_step$16"]]]], "r": [[0.000395423, 0.000395556, 0.0003953], 0, 22.6355, 1661898252], "v": "v0.6"}
{"i": [["[\"fused_conv3x3\", 4, 14, 14, 32, 32, 3, 3, 64]", "cuda -keys=cuda,gpu -max_num_threads=1024 -model=unknown -thread_warp_size=32", [-1, 16, 64, 49152, 2147483647, 1024, 8, 32], "", 0, []], [[], [["CHW", 3, "local"], ["SP", 3, 0, 4, [4, 1, 1, 1], 1], ["SP", 3, 5, 64, [1, 2, 1, 1], 1], ["SP", 3, 10, 14, [1, 1, 7, 1], 1], ["SP", 3, 15, 14, [1, 7, 2, 1], 1], ["SP", 3, 20, 32, [1, 16, 2, 1], 1], ["SP", 3, 25, 32, [1, 2], 1], ["SP", 3, 28, 3, [3, 1], 1], ["SP", 3, 31, 3, [1, 3], 1], ["RE", 3, [0, 5, 10, 15, 20, 1, 6, 11, 16, 21, 2, 7, 12, 17, 22, 25, 28, 31, 26, 29, 32, 3, 8, 13, 18, 23, 27, 30, 33, 4, 9, 14, 19, 24]], ["FSP", 4, 0, 1, 3], ["FSP", 4, 4, 2, 3], ["FSP", 4, 8, 3, 3], ["FSP", 4, 12, 4, 3], ["FSP", 4, 16, 5, 3], ["RE", 4, [0, 4, 8, 12, 16, 1, 5, 9, 13, 17, 2, 6, 10, 14, 18, 3, 7, 11, 15, 19]], ["CA", 3, 4, 14], ["CHR", 2, "shared", [3]], ["CA", 3, 4, 17], ["CHR", 1, "shared", [4]], ["CA", 2, 5, 17], ["CI", 1], ["FU", 6, [0, 1, 2, 3, 4]], ["AN", 6, 0, 5], ["FU", 6, [1, 2, 3, 4, 5]], ["AN", 6, 1, 4], ["FU", 6, [2, 3, 4, 5, 6]], ["AN", 6, 2, 6], ["FU", 4, [0, 1, 2, 3, 4]], ["SP", 4, 0, 24, [1], 1], ["AN", 4, 1, 2], ["FFSP", 4, 0, [5, 4, 3, 2, 1], 1, 1], ["AN", 4, 1, 6], ["FU", 2, [0, 1, 2, 3, 4]], ["SP", 2, 0, 24, [1], 1], ["AN", 2, 1, 2], ["FFSP", 2, 0, [5, 4, 3, 2, 1], 1, 1], ["AN", 2, 1, 6], ["PR", 5, 0, "auto_unroll_max_step$0"]]]], "r": [[0.00034196, 0.000341556, 0.00034128], 0, 20.329, 1661898251], "v": "v0.6"}
{"i": [["[\"fused_conv3x3\", 4, 14, 14, 32, 32, 3, 3, 64]", "cuda -keys=cuda,gpu -max_num_threads=1024 -model=unknown -thread_warp_size=32", [-1, 16, 64, 49152, 2147483647, 1024, 8, 32], "", 0, []], [[], [["CHW", 3, "local"], ["SP", 3, 0, 4, [1, 1, 1, 1], 1], ["SP", 3, 5, 64, [1, 4, 1, 1], 1], ["SP", 3, 10, 14, [1, 7, 2, 1], 1], ["SP", 3, 15, 14, [1, 1, 1, 1], 1], ["SP", 3, 20, 32, [2, 4, 1, 1], 1], ["SP", 3, 25, 32, [4, 2], 1], ["SP", 3, 28, 3, [3, 1], 1], ["SP", 3, 31, 3, [3, 1], 1], ["RE", 3, [0, 5, 10, 15, 20, 1, 6, 11, 16, 21, 2, 7, 12, 17, 22, 25, 28, 31, 26, 29, 32, 3, 8, 13, 18, 23, 27, 30, 33, 4, 9, 14, 19, 24]], ["FSP", 4, 0, 1, 3], ["FSP", 4, 4, 2, 3], ["FSP", 4, 8, 3, 3], ["FSP", 4, 12, 4, 3], ["FSP", 4, 16, 5, 3], ["RE", 4, [0, 4, 8, 12, 16, 1, 5, 9, 13, 17, 2, 6, 10, 14, 18, 3, 7, 11, 15, 19]], ["CA", 3, 4, 14], ["CHR", 2, "shared", [3]], ["CA", 3, 4, 17], ["CHR", 1, "shared", [4]], ["CA", 2, 5, 17], ["CI", 1], ["FU", 6, [0, 1, 2, 3, 4]], ["AN", 6, 0, 5], ["FU", 6, [1, 2, 3, 4, 5]], ["AN", 6, 1, 4], ["FU", 6, [2, 3, 4, 5, 6]], ["AN", 6, 2, 6], ["FU", 4, [0, 1, 2, 3, 4]], ["SP", 4, 0, 72, [1], 1], ["AN", 4, 1, 2], ["FFSP", 4, 0, [5, 4, 3, 2, 1], 1, 1], ["AN", 4, 1, 6], ["FU", 2, [0, 1, 2, 3, 4]], ["SP", 2, 0, 72, [24], 1], ["AN", 2, 1, 2], ["FFSP", 2, 0, [5, 4, 3, 2, 1], 1, 1], ["AN", 2, 1, 6], ["PR", 5, 0, "auto_unroll_max_step$0"]]]], "r": [[0.000367028, 0.000365706, 0.000365145], 0, 22.405, 1661898253], "v": "v0.6"}
{"i": [["[\"fused_conv3x3\", 4, 14, 14, 32, 32, 3, 3, 64]", "cuda -keys=cuda,gpu -max_num_threads=1024 -model=unknown -thread_warp_size=32", [-1, 16, 64, 49152, 2147483647, 1024, 8, 32], "", 0, []], [[], [["CHW", 3, "local"], ["SP", 3, 0, 4, [4, 1, 1, 1], 1], ["SP", 3, 5, 64, [2, 4, 2, 1], 1], ["SP", 3, 10, 14, [1, 1, 2, 1], 1], ["SP", 3, 15, 14, [1, 7, 1, 2], 1], ["SP", 3, 20, 32, [1, 8, 2, 1], 1], ["SP", 3, 25, 32, [1, 1], 1], ["SP", 3, 28, 3, [3, 1], 1], ["SP", 3, 31, 3, [1, 1], 1], ["RE", 3, [0, 5, 10, 15, 20, 1, 6, 11, 16, 21, 2, 7, 12, 17, 22, 25, 28, 31, 26, 29, 32, 3, 8, 13, 18, 23, 27, 30, 33, 4, 9, 14, 19, 24]], ["FSP", 4, 0, 1, 3], ["FSP", 4, 4, 2, 3], ["FSP", 4, 8, 3, 3], ["FSP", 4, 12, 4, 3], ["FSP", 4, 16, 5, 3], ["RE", 4, [0, 4, 8, 12, 16, 1, 5, 9, 13, 17, 2, 6, 10, 14, 18, 3, 7, 11, 15, 19]], ["CA", 3, 4, 14], ["CHR", 2, "shared", [3]], ["CA", 3, 4, 17], ["CHR", 1, "shared", [4]], ["CA", 2, 5, 17], ["CI", 1], ["FU", 6, [0, 1, 2, 3, 4]], ["AN", 6, 0, 5], ["FU", 6, [1, 2, 3, 4, 5]], ["AN", 6, 1, 4], ["FU", 6, [2, 3, 4, 5, 6]], ["AN", 6, 2, 6], ["FU", 4, [0, 1, 2, 3, 4]], ["SP", 4, 0, 64, [1], 1], ["AN", 4, 1, 2], ["FFSP", 4, 0, [5, 4, 3, 2, 1], 1, 1], ["AN", 4, 1, 6], ["FU", 2, [0, 1, 2, 3, 4]], ["SP", 2, 0, 128, [1], 1], ["AN", 2, 1, 2], ["FFSP", 2, 0, [5, 4, 3, 2, 1], 1, 1], ["AN", 2, 1, 6], ["PR", 5, 0, "auto_unroll_max_step$16"]]]], "r": [[0.000730765, 0.000730783, 0.000730857], 0, 23.1545, 1661898254], "v": "v0.6"}
{"i": [["[\"fused_conv3x3\", 4, 14, 14, 32, 32, 3, 3, 64]", "cuda -keys=cuda,gpu -max_num_threads=1024 -model=unknown -thread_warp_size=32", [-1, 16, 64, 49152, 2147483647, 1024, 8, 32], "", 0, []], [[], [["CHW", 3, "local"], ["SP", 3, 0, 4, [1, 1, 1, 1], 1], ["SP", 3, 5, 64, [4, 2, 1, 1], 1], ["SP", 3, 10, 14, [1, 2, 1, 1], 1], ["SP", 3, 15, 14, [1, 1, 7, 2], 1], ["SP", 3, 20, 32, [1, 16, 2, 1], 1], ["SP", 3, 25, 32, [1, 2], 1], ["SP", 3, 28, 3, [1, 1], 1], ["SP", 3, 31, 3, [1, 3], 1], ["RE", 3, [0, 5, 10, 15, 20, 1, 6, 11, 16, 21, 2, 7, 12, 17, 22, 25, 28, 31, 26, 29, 32, 3, 8, 13, 18, 23, 27, 30, 33, 4, 9, 14, 19, 24]], ["FSP", 4, 0, 1, 3], ["FSP", 4, 4, 2, 3], ["FSP", 4, 8, 3, 3], ["FSP", 4, 12, 4, 3], ["FSP", 4, 16, 5, 3], ["RE", 4, [0, 4, 8, 12, 16, 1, 5, 9, 13, 17, 2, 6, 10, 14, 18, 3, 7, 11, 15, 19]], ["CA", 3, 4, 14], ["CHR", 2, "shared", [3]], ["CA", 3, 4, 17], ["CHR", 1, "shared", [4]], ["CA", 2, 5, 17], ["CI", 1], ["FU", 6, [0, 1, 2, 3, 4]], ["AN", 6, 0, 5], ["FU", 6, [1, 2, 3, 4, 5]], ["AN", 6, 1, 4], ["FU", 6, [2, 3, 4, 5, 6]], ["AN", 6, 2, 6], ["FU", 4, [0, 1, 2, 3, 4]], ["SP", 4, 0, 12, [3], 1], ["AN", 4, 1, 2], ["FFSP", 4, 0, [5, 4, 3, 2, 1], 1, 1], ["AN", 4, 1, 6], ["FU", 2, [0, 1, 2, 3, 4]], ["SP", 2, 0, 28, [7], 1], ["AN", 2, 1, 2], ["FFSP", 2, 0, [5, 4, 3, 2, 1], 1, 1], ["AN", 2, 1, 6], ["PR", 5, 0, "auto_unroll_max_step$512"]]]], "r": [[0.000241236, 0.000241347, 0.000240693], 0, 25.6117, 1661898255], "v": "v0.6"}
{"i": [["[\"fused_conv3x3\", 4, 14, 14, 32, 32, 3, 3, 64]", "cuda -keys=cuda,gpu -max_num_threads=1024 -model=unknown -thread_warp_size=32", [-1, 16, 64, 49152, 2147483647, 1024, 8, 32], "", 0, []], [[], [["CHW", 3, "local"], ["SP", 3, 0, 4, [4, 1, 1, 1], 1], ["SP", 3, 5, 64, [1, 1, 2, 1], 1], ["SP", 3, 10, 14, [1, 1, 7, 2], 1], ["SP", 3, 15, 14, [1, 1, 1, 7], 1], ["SP", 3, 20, 32, [2, 16, 1, 1], 1], ["SP", 3, 25, 32, [1, 8], 1], ["SP", 3, 28, 3, [1, 1], 1], ["SP", 3, 31, 3, [3, 1], 1], ["RE", 3, [0, 5, 10, 15, 20, 1, 6, 11, 16, 21, 2, 7, 12, 17, 22, 25, 28, 31, 26, 29, 32, 3, 8, 13, 18, 23, 27, 30, 33, 4, 9, 14, 19, 24]], ["FSP", 4, 0, 1, 3], ["FSP", 4, 4, 2, 3], ["FSP", 4, 8, 3, 3], ["FSP", 4, 12, 4, 3], ["FSP", 4, 16, 5, 3], ["RE", 4, [0, 4, 8, 12, 16, 1, 5, 9, 13, 17, 2, 6, 10, 14, 18, 3, 7, 11, 15, 19]], ["CA", 3, 4, 14], ["CHR", 2, "shared", [3]], ["CA", 3, 4, 17], ["CHR", 1, "shared", [4]], ["CA", 2, 5, 17], ["CI", 1], ["FU", 6, [0, 1, 2, 3, 4]], ["AN", 6, 0, 5], ["FU", 6, [1, 2, 3, 4, 5]], ["AN", 6, 1, 4], ["FU", 6, [2, 3, 4, 5, 6]], ["AN", 6, 2, 6], ["FU", 4, [0, 1, 2, 3, 4]], ["SP", 4, 0, 16, [1], 1], ["AN", 4, 1, 2], ["FFSP", 4, 0, [5, 4, 3, 2, 1], 1, 1], ["AN", 4, 1, 6], ["FU", 2, [0, 1, 2, 3, 4]], ["SP", 2, 0, 224, [2], 1], ["AN", 2, 1, 2], ["FFSP", 2, 0, [5, 4, 3, 2, 1], 1, 1], ["AN", 2, 1, 6], ["PR", 5, 0, "auto_unroll_max_step$0"]]]], "r": [[0.00200946, 0.0020002, 0.00199929], 0, 27.4723, 1661898256], "v": "v0.6"}
{"i": [["[\"fused_conv3x3\", 4, 14, 14, 32, 32, 3, 3, 64]", "cuda -keys=cuda,gpu -max_num_threads=1024 -model=unknown -thread_warp_size=32", [-1, 16, 64, 49152, 2147483647, 1024, 8, 32], "", 0, []], [[], [["CHW", 3, "local"], ["SP", 3, 0, 4, [4, 1, 1, 1], 1], ["SP", 3, 5, 64, [2, 1, 1, 1], 1], ["SP", 3, 10, 14, [1, 2, 7, 1], 1], ["SP", 3, 15, 14, [1, 14, 1, 1], 1], ["SP", 3, 20, 32, [1, 4, 8, 1], 1], ["SP", 3, 25, 32, [4, 1], 1], ["SP", 3, 28, 3, [1, 1], 1], ["SP", 3, 31, 3, [3, 1], 1], ["RE", 3, [0, 5, 10, 15, 20, 1, 6, 11, 16, 21, 2, 7, 12, 17, 22, 25, 28, 31, 26, 29, 32, 3, 8, 13, 18, 23, 27, 30, 33, 4, 9, 14, 19, 24]], ["FSP", 4, 0, 1, 3], ["FSP", 4, 4, 2, 3], ["FSP", 4, 8, 3, 3], ["FSP", 4, 12, 4, 3], ["FSP", 4, 16, 5, 3], ["RE", 4, [0, 4, 8, 12, 16, 1, 5, 9, 13, 17, 2, 6, 10, 14, 18, 3, 7, 11, 15, 19]], ["CA", 3, 4, 14], ["CHR", 2, "shared", [3]], ["CA", 3, 4, 17], ["CHR", 1, "shared", [4]], ["CA", 2, 5, 17], ["CI", 1], ["FU", 6, [0, 1, 2, 3, 4]], ["AN", 6, 0, 5], ["FU", 6, [1, 2, 3, 4, 5]], ["AN", 6, 1, 4], ["FU", 6, [2, 3, 4, 5, 6]], ["AN", 6, 2, 6], ["FU", 4, [0, 1, 2, 3, 4]], ["SP", 4, 0, 288, [1], 1], ["AN", 4, 1, 2], ["FFSP", 4, 0, [5, 4, 3, 2, 1], 1, 1], ["AN", 4, 1, 6], ["FU", 2, [0, 1, 2, 3, 4]], ["SP", 2, 0, 108, [18], 1], ["AN", 2, 1, 2], ["FFSP", 2, 0, [5, 4, 3, 2, 1], 1, 1], ["AN", 2, 1, 6], ["PR", 5, 0, "auto_unroll_max_step$64"]]]], "r": [[0.002523, 0.00252227, 0.00252155], 0, 25.5971, 1661898254], "v": "v0.6"}
{"i": [["[\"fused_conv3x3\", 4, 14, 14, 32, 32, 3, 3, 64]", "cuda -keys=cuda,gpu -max_num_threads=1024 -model=unknown -thread_warp_size=32", [-1, 16, 64, 49152, 2147483647, 1024, 8, 32], "", 0, []], [[], [["CHW", 3, "local"], ["SP", 3, 0, 4, [1, 4, 1, 1], 1], ["SP", 3, 5, 64, [1, 1, 1, 2], 1], ["SP", 3, 10, 14, [1, 14, 1, 1], 1], ["SP", 3, 15, 14, [2, 1, 7, 1], 1], ["SP", 3, 20, 32, [1, 4, 2, 4], 1], ["SP", 3, 25, 32, [2, 1], 1], ["SP", 3, 28, 3, [3, 1], 1], ["SP", 3, 31, 3, [1, 1], 1], ["RE", 3, [0, 5, 10, 15, 20, 1, 6, 11, 16, 21, 2, 7, 12, 17, 22, 25, 28, 31, 26, 29, 32, 3, 8, 13, 18, 23, 27, 30, 33, 4, 9, 14, 19, 24]], ["FSP", 4, 0, 1, 3], ["FSP", 4, 4, 2, 3], ["FSP", 4, 8, 3, 3], ["FSP", 4, 12, 4, 3], ["FSP", 4, 16, 5, 3], ["RE", 4, [0, 4, 8, 12, 16, 1, 5, 9, 13, 17, 2, 6, 10, 14, 18, 3, 7, 11, 15, 19]], ["CA", 3, 4, 14], ["CHR", 2, "shared", [3]], ["CA", 3, 4, 17], ["CHR", 1, "shared", [4]], ["CA", 2, 5, 17], ["CI", 1], ["FU", 6, [0, 1, 2, 3, 4]], ["AN", 6, 0, 5], ["FU", 6, [1, 2, 3, 4, 5]], ["AN", 6, 1, 4], ["FU", 6, [2, 3, 4, 5, 6]], ["AN", 6, 2, 6], ["FU", 4, [0, 1, 2, 3, 4]], ["SP", 4, 0, 192, [3], 1], ["AN", 4, 1, 2], ["FFSP", 4, 0, [5, 4, 3, 2, 1], 1, 1], ["AN", 4, 1, 6], ["FU", 2, [0, 1, 2, 3, 4]], ["SP", 2, 0, 216, [12], 1], ["AN", 2, 1, 2], ["FFSP", 2, 0, [5, 4, 3, 2, 1], 1, 1], ["AN", 2, 1, 6], ["PR", 5, 0, "auto_unroll_max_step$0"]]]], "r": [[0.000862234, 0.00086249, 0.000862168], 0, 27.3479, 1661898258], "v": "v0.6"}
{"i": [["[\"fused_conv3x3\", 4, 14, 14, 32, 32, 3, 3, 64]", "cuda -keys=cuda,gpu -max_num_threads=1024 -model=unknown -thread_warp_size=32", [-1, 16, 64, 49152, 2147483647, 1024, 8, 32], "", 0, []], [[], [["CHW", 3, "local"], ["SP", 3, 0, 4, [1, 1, 1, 1], 1], ["SP", 3, 5, 64, [1, 4, 4, 2], 1], ["SP", 3, 10, 14, [7, 1, 1, 2], 1], ["SP", 3, 15, 14, [1, 2, 1, 1], 1], ["SP", 3, 20, 32, [1, 4, 2, 1], 1], ["SP", 3, 25, 32, [1, 1], 1], ["SP", 3, 28, 3, [3, 1], 1], ["SP", 3, 31, 3, [3, 1], 1], ["RE", 3, [0, 5, 10, 15, 20, 1, 6, 11, 16, 21, 2, 7, 12, 17, 22, 25, 28, 31, 26, 29, 32, 3, 8, 13, 18, 23, 27, 30, 33, 4, 9, 14, 19, 24]], ["FSP", 4, 0, 1, 3], ["FSP", 4, 4, 2, 3], ["FSP", 4, 8, 3, 3], ["FSP", 4, 12, 4, 3], ["FSP", 4, 16, 5, 3], ["RE", 4, [0, 4, 8, 12, 16, 1, 5, 9, 13, 17, 2, 6, 10, 14, 18, 3, 7, 11, 15, 19]], ["CA", 3, 4, 14], ["CHR", 2, "shared", [3]], ["CA", 3, 4, 17], ["CHR", 1, "shared", [4]], ["CA", 2, 5, 17], ["CI", 1], ["FU", 6, [0, 1, 2, 3, 4]], ["AN", 6, 0, 5], ["FU", 6, [1, 2, 3, 4, 5]], ["AN", 6, 1, 4], ["FU", 6, [2, 3, 4, 5, 6]], ["AN", 6, 2, 6], ["FU", 4, [0, 1, 2, 3, 4]], ["SP", 4, 0, 144, [1], 1], ["AN", 4, 1, 2], ["FFSP", 4, 0, [5, 4, 3, 2, 1], 1, 1], ["AN", 4, 1, 6], ["FU", 2, [0, 1, 2, 3, 4]], ["SP", 2, 0, 72, [1], 1], ["AN", 2, 1, 2], ["FFSP", 2, 0, [5, 4, 3, 2, 1], 1, 1], ["AN", 2, 1, 6], ["PR", 5, 0, "auto_unroll_max_step$64"]]]], "r": [[0.000551941, 0.000549434, 0.000548424], 0, 28.6497, 1661898257], "v": "v0.6"}
{"i": [["[\"fused_conv3x3\", 4, 14, 14, 32, 32, 3, 3, 64]", "cuda -keys=cuda,gpu -max_num_threads=1024 -model=unknown -thread_warp_size=32", [-1, 16, 64, 49152, 2147483647, 1024, 8, 32], "", 0, []], [[], [["CHW", 3, "local"], ["SP", 3, 0, 4, [1, 2, 1, 1], 1], ["SP", 3, 5, 64, [1, 8, 2, 2], 1], ["SP", 3, 10, 14, [1, 1, 1, 1], 1], ["SP", 3, 15, 14, [1, 1, 7, 1], 1], ["SP", 3, 20, 32, [1, 2, 1, 8], 1], ["SP", 3, 25, 32, [2, 1], 1], ["SP", 3, 28, 3, [1, 1], 1], ["SP", 3, 31, 3, [1, 1], 1], ["RE", 3, [0, 5, 10, 15, 20, 1, 6, 11, 16, 21, 2, 7, 12, 17, 22, 25, 28, 31, 26, 29, 32, 3, 8, 13, 18, 23, 27, 30, 33, 4, 9, 14, 19, 24]], ["FSP", 4, 0, 1, 3], ["FSP", 4, 4, 2, 3], ["FSP", 4, 8, 3, 3], ["FSP", 4, 12, 4, 3], ["FSP", 4, 16, 5, 3], ["RE", 4, [0, 4, 8, 12, 16, 1, 5, 9, 13, 17, 2, 6, 10, 14, 18, 3, 7, 11, 15, 19]], ["CA", 3, 4, 14], ["CHR", 2, "shared", [3]], ["CA", 3, 4, 17], ["CHR", 1, "shared", [4]], ["CA", 2, 5, 17], ["CI", 1], ["FU", 6, [0, 1, 2, 3, 4]], ["AN", 6, 0, 5], ["FU", 6, [1, 2, 3, 4, 5]], ["AN", 6, 1, 4], ["FU", 6, [2, 3, 4, 5, 6]], ["AN", 6, 2, 6], ["FU", 4, [0, 1, 2, 3, 4]], ["SP", 4, 0, 32, [1], 1], ["AN", 4, 1, 2], ["FFSP", 4, 0, [5, 4, 3, 2, 1], 1, 1], ["AN", 4, 1, 6], ["FU", 2, [0, 1, 2, 3, 4]], ["SP", 2, 0, 56, [1], 1], ["AN", 2, 1, 2], ["FFSP", 2, 0, [5, 4, 3, 2, 1], 1, 1], ["AN", 2, 1, 6], ["PR", 5, 0, "auto_unroll_max_step$1024"]]]], "r": [[0.000649085, 0.000647531, 0.000648357], 0, 30.6998, 1661898259], "v": "v0.6"}
{"i": [["[\"fused_conv3x3\", 4, 14, 14, 32, 32, 3, 3, 64]", "cuda -keys=cuda,gpu -max_num_threads=1024 -model=unknown -thread_warp_size=32", [-1, 16, 64, 49152, 2147483647, 1024, 8, 32], "", 0, []], [[], [["CHW", 3, "local"], ["SP", 3, 0, 4, [2, 2, 1, 1], 1], ["SP", 3, 5, 64, [1, 1, 4, 2], 1], ["SP", 3, 10, 14, [2, 1, 7, 1], 1], ["SP", 3, 15, 14, [1, 1, 1, 2], 1], ["SP", 3, 20, 32, [1, 32, 1, 1], 1], ["SP", 3, 25, 32, [2, 2], 1], ["SP", 3, 28, 3, [1, 1], 1], ["SP", 3, 31, 3, [1, 1], 1], ["RE", 3, [0, 5, 10, 15, 20, 1, 6, 11, 16, 21, 2, 7, 12, 17, 22, 25, 28, 31, 26, 29, 32, 3, 8, 13, 18, 23, 27, 30, 33, 4, 9, 14, 19, 24]], ["FSP", 4, 0, 1, 3], ["FSP", 4, 4, 2, 3], ["FSP", 4, 8, 3, 3], ["FSP", 4, 12, 4, 3], ["FSP", 4, 16, 5, 3], ["RE", 4, [0, 4, 8, 12, 16, 1, 5, 9, 13, 17, 2, 6, 10, 14, 18, 3, 7, 11, 15, 19]], ["CA", 3, 4, 14], ["CHR", 2, "shared", [3]], ["CA", 3, 4, 17], ["CHR", 1, "shared", [4]], ["CA", 2, 5, 17], ["CI", 1], ["FU", 6, [0, 1, 2, 3, 4]], ["AN", 6, 0, 5], ["FU", 6, [1, 2, 3, 4, 5]], ["AN", 6, 1, 4], ["FU", 6, [2, 3, 4, 5, 6]], ["AN", 6, 2, 6], ["FU", 4, [0, 1, 2, 3, 4]], ["SP", 4, 0, 96, [1], 1], ["AN", 4, 1, 2], ["FFSP", 4, 0, [5, 4, 3, 2, 1], 1, 1], ["AN", 4, 1, 6], ["FU", 2, [0, 1, 2, 3, 4]], ["SP", 2, 0, 448, [1], 1], ["AN", 2, 1, 2], ["FFSP", 2, 0, [5, 4, 3, 2, 1], 1, 1], ["AN", 2, 1, 6], ["PR", 5, 0, "auto_unroll_max_step$0"]]]], "r": [[0.00101385, 0.00101135, 0.00101109], 0, 29.3474, 1661898260], "v": "v0.6"}
{"i": [["[\"fused_conv3x3\", 4, 14, 14, 32, 32, 3, 3, 64]", "cuda -keys=cuda,gpu -max_num_threads=1024 -model=unknown -thread_warp_size=32", [-1, 16, 64, 49152, 2147483647, 1024, 8, 32], "", 0, []], [[], [["CHW", 3, "local"], ["SP", 3, 0, 4, [4, 1, 1, 1], 1], ["SP", 3, 5, 64, [1, 2, 1, 1], 1], ["SP", 3, 10, 14, [1, 1, 7, 1], 1], ["SP", 3, 15, 14, [1, 7, 2, 1], 1], ["SP", 3, 20, 32, [1, 8, 4, 1], 1], ["SP", 3, 25, 32, [1, 4], 1], ["SP", 3, 28, 3, [3, 1], 1], ["SP", 3, 31, 3, [1, 1], 1], ["RE", 3, [0, 5, 10, 15, 20, 1, 6, 11, 16, 21, 2, 7, 12, 17, 22, 25, 28, 31, 26, 29, 32, 3, 8, 13, 18, 23, 27, 30, 33, 4, 9, 14, 19, 24]], ["FSP", 4, 0, 1, 3], ["FSP", 4, 4, 2, 3], ["FSP", 4, 8, 3, 3], ["FSP", 4, 12, 4, 3], ["FSP", 4, 16, 5, 3], ["RE", 4, [0, 4, 8, 12, 16, 1, 5, 9, 13, 17, 2, 6, 10, 14, 18, 3, 7, 11, 15, 19]], ["CA", 3, 4, 14], ["CHR", 2, "shared", [3]], ["CA", 3, 4, 17], ["CHR", 1, "shared", [4]], ["CA", 2, 5, 17], ["CI", 1], ["FU", 6, [0, 1, 2, 3, 4]], ["AN", 6, 0, 5], ["FU", 6, [1, 2, 3, 4, 5]], ["AN", 6, 1, 4], ["FU", 6, [2, 3, 4, 5, 6]], ["AN", 6, 2, 6], ["FU", 4, [0, 1, 2, 3, 4]], ["SP", 4, 0, 24, [1], 1], ["AN", 4, 1, 2], ["FFSP", 4, 0, [5, 4, 3, 2, 1], 1, 1], ["AN", 4, 1, 6], ["FU", 2, [0, 1, 2, 3, 4]], ["SP", 2, 0, 24, [1], 1], ["AN", 2, 1, 2], ["FFSP", 2, 0, [5, 4, 3, 2, 1], 1, 1], ["AN", 2, 1, 6], ["PR", 5, 0, "auto_unroll_max_step$0"]]]], "r": [[0.000491068, 0.00049055, 0.00049054], 0, 29.4995, 1661898260], "v": "v0.6"}
{"i": [["[\"fused_conv3x3\", 4, 14, 14, 32, 32, 3, 3, 64]", "cuda -keys=cuda,gpu -max_num_threads=1024 -model=unknown -thread_warp_size=32", [-1, 16, 64, 49152, 2147483647, 1024, 8, 32], "", 0, []], [[], [["CHW", 3, "local"], ["SP", 3, 0, 4, [1, 1, 1, 1], 1], ["SP", 3, 5, 64, [1, 1, 2, 2], 1], ["SP", 3, 10, 14, [1, 7, 2, 1], 1], ["SP", 3, 15, 14, [1, 1, 14, 1], 1], ["SP", 3, 20, 32, [1, 2, 8, 2], 1], ["SP", 3, 25, 32, [2, 1], 1], ["SP", 3, 28, 3, [1, 1], 1], ["SP", 3, 31, 3, [1, 1], 1], ["RE", 3, [0, 5, 10, 15, 20, 1, 6, 11, 16, 21, 2, 7, 12, 17, 22, 25, 28, 31, 26, 29, 32, 3, 8, 13, 18, 23, 27, 30, 33, 4, 9, 14, 19, 24]], ["FSP", 4, 0, 1, 3], ["FSP", 4, 4, 2, 3], ["FSP", 4, 8, 3, 3], ["FSP", 4, 12, 4, 3], ["FSP", 4, 16, 5, 3], ["RE", 4, [0, 4, 8, 12, 16, 1, 5, 9, 13, 17, 2, 6, 10, 14, 18, 3, 7, 11, 15, 19]], ["CA", 3, 4, 14], ["CHR", 2, "shared", [3]], ["CA", 3, 4, 17], ["CHR", 1, "shared", [4]], ["CA", 2, 5, 17], ["CI", 1], ["FU", 6, [0, 1, 2, 3, 4]], ["AN", 6, 0, 5], ["FU", 6, [1, 2, 3, 4, 5]], ["AN", 6, 1, 4], ["FU", 6, [2, 3, 4, 5, 6]], ["AN", 6, 2, 6], ["FU", 4, [0, 1, 2, 3, 4]], ["SP", 4, 0, 128, [1], 1], ["AN", 4, 1, 2], ["FFSP", 4, 0, [5, 4, 3, 2, 1], 1, 1], ["AN", 4, 1, 6], ["FU", 2, [0, 1, 2, 3, 4]], ["SP", 2, 0, 224, [14], 1], ["AN", 2, 1, 2], ["FFSP", 2, 0, [5, 4, 3, 2, 1], 1, 1], ["AN", 2, 1, 6], ["PR", 5, 0, "auto_unroll_max_step$16"]]]], "r": [[0.0142803, 0.0147865, 0.0150652], 0, 32.3497, 1661898261], "v": "v0.6"}
{"i": [["[\"fused_conv3x3\", 4, 14, 14, 32, 32, 3, 3, 64]", "cuda -keys=cuda,gpu -max_num_threads=1024 -model=unknown -thread_warp_size=32", [-1, 16, 64, 49152, 2147483647, 1024, 8, 32], "", 0, []], [[], [["CHW", 3, "local"], ["SP", 3, 0, 4, [1, 2, 1, 2], 1], ["SP", 3, 5, 64, [2, 8, 1, 1], 1], ["SP", 3, 10, 14, [1, 1, 1, 1], 1], ["SP", 3, 15, 14, [1, 1, 1, 7], 1], ["SP", 3, 20, 32, [1, 4, 2, 2], 1], ["SP", 3, 25, 32, [1, 1], 1], ["SP", 3, 28, 3, [3, 1], 1], ["SP", 3, 31, 3, [1, 3], 1], ["RE", 3, [0, 5, 10, 15, 20, 1, 6, 11, 16, 21, 2, 7, 12, 17, 22, 25, 28, 31, 26, 29, 32, 3, 8, 13, 18, 23, 27, 30, 33, 4, 9, 14, 19, 24]], ["FSP", 4, 0, 1, 3], ["FSP", 4, 4, 2, 3], ["FSP", 4, 8, 3, 3], ["FSP", 4, 12, 4, 3], ["FSP", 4, 16, 5, 3], ["RE", 4, [0, 4, 8, 12, 16, 1, 5, 9, 13, 17, 2, 6, 10, 14, 18, 3, 7, 11, 15, 19]], ["CA", 3, 4, 14], ["CHR", 2, "shared", [3]], ["CA", 3, 4, 17], ["CHR", 1, "shared", [4]], ["CA", 2, 5, 17], ["CI", 1], ["FU", 6, [0, 1, 2, 3, 4]], ["AN", 6, 0, 5], ["FU", 6, [1, 2, 3, 4, 5]], ["AN", 6, 1, 4], ["FU", 6, [2, 3, 4, 5, 6]], ["AN", 6, 2, 6], ["FU", 4, [0, 1, 2, 3, 4]], ["SP", 4, 0, 18, [1], 1], ["AN", 4, 1, 2], ["FFSP", 4, 0, [5, 4, 3, 2, 1], 1, 1], ["AN", 4, 1, 6], ["FU", 2, [0, 1, 2, 3, 4]], ["SP", 2, 0, 54, [1], 1], ["AN", 2, 1, 2], ["FFSP", 2, 0, [5, 4, 3, 2, 1], 1, 1], ["AN", 2, 1, 6], ["PR", 5, 0, "auto_unroll_max_step$16"]]]], "r": [[0.000401505, 0.000401343, 0.000401116], 0, 31.8605, 1661898263], "v": "v0.6"}
{"i": [["[\"fused_conv3x3\", 4, 14, 14, 32, 32, 3, 3, 64]", "cuda -keys=cuda,gpu -max_num_threads=1024 -model=unknown -thread_warp_size=32", [-1, 16, 64, 49152, 2147483647, 1024, 8, 32], "", 0, []], [[], [["CHW", 3, "local"], ["SP", 3, 0, 4, [1, 2, 1, 1], 1], ["SP", 3, 5, 64, [2, 2, 1, 4], 1], ["SP", 3, 10, 14, [2, 1, 1, 1], 1], ["SP", 3, 15, 14, [1, 1, 14, 1], 1], ["SP", 3, 20, 32, [1, 16, 1, 2], 1], ["SP", 3, 25, 32, [1, 1], 1], ["SP", 3, 28, 3, [3, 1], 1], ["SP", 3, 31, 3, [1, 1], 1], ["RE", 3, [0, 5, 10, 15, 20, 1, 6, 11, 16, 21, 2, 7, 12, 17, 22, 25, 28, 31, 26, 29, 32, 3, 8, 13, 18, 23, 27, 30, 33, 4, 9, 14, 19, 24]], ["FSP", 4, 0, 1, 3], ["FSP", 4, 4, 2, 3], ["FSP", 4, 8, 3, 3], ["FSP", 4, 12, 4, 3], ["FSP", 4, 16, 5, 3], ["RE", 4, [0, 4, 8, 12, 16, 1, 5, 9, 13, 17, 2, 6, 10, 14, 18, 3, 7, 11, 15, 19]], ["CA", 3, 4, 14], ["CHR", 2, "shared", [3]], ["CA", 3, 4, 17], ["CHR", 1, "shared", [4]], ["CA", 2, 5, 17], ["CI", 1], ["FU", 6, [0, 1, 2, 3, 4]], ["AN", 6, 0, 5], ["FU", 6, [1, 2, 3, 4, 5]], ["AN", 6, 1, 4], ["FU", 6, [2, 3, 4, 5, 6]], ["AN", 6, 2, 6], ["FU", 4, [0, 1, 2, 3, 4]], ["SP", 4, 0, 24, [1], 1], ["AN", 4, 1, 2], ["FFSP", 4, 0, [5, 4, 3, 2, 1], 1, 1], ["AN", 4, 1, 6], ["FU", 2, [0, 1, 2, 3, 4]], ["SP", 2, 0, 192, [1], 1], ["AN", 2, 1, 2], ["FFSP", 2, 0, [5, 4, 3, 2, 1], 1, 1], ["AN", 2, 1, 6], ["PR", 5, 0, "auto_unroll_max_step$64"]]]], "r": [[0.00268986, 0.00268637, 0.00268433], 0, 36.2016, 1661898266], "v": "v0.6"}
{"i": [["[\"fused_conv3x3\", 4, 14, 14, 32, 32, 3, 3, 64]", "cuda -keys=cuda,gpu -max_num_threads=1024 -model=unknown -thread_warp_size=32", [-1, 16, 64, 49152, 2147483647, 1024, 8, 32], "", 0, []], [[], [["CHW", 3, "local"], ["SP", 3, 0, 4, [2, 1, 2, 1], 1], ["SP", 3, 5, 64, [1, 2, 32, 1], 1], ["SP", 3, 10, 14, [1, 1, 7, 1], 1], ["SP", 3, 15, 14, [1, 2, 1, 1], 1], ["SP", 3, 20, 32, [2, 4, 1, 1], 1], ["SP", 3, 25, 32, [1, 1], 1], ["SP", 3, 28, 3, [1, 1], 1], ["SP", 3, 31, 3, [1, 1], 1], ["RE", 3, [0, 5, 10, 15, 20, 1, 6, 11, 16, 21, 2, 7, 12, 17, 22, 25, 28, 31, 26, 29, 32, 3, 8, 13, 18, 23, 27, 30, 33, 4, 9, 14, 19, 24]], ["FSP", 4, 0, 1, 3], ["FSP", 4, 4, 2, 3], ["FSP", 4, 8, 3, 3], ["FSP", 4, 12, 4, 3], ["FSP", 4, 16, 5, 3], ["RE", 4, [0, 4, 8, 12, 16, 1, 5, 9, 13, 17, 2, 6, 10, 14, 18, 3, 7, 11, 15, 19]], ["CA", 3, 4, 14], ["CHR", 2, "shared", [3]], ["CA", 3, 4, 17], ["CHR", 1, "shared", [4]], ["CA", 2, 5, 17], ["CI", 1], ["FU", 6, [0, 1, 2, 3, 4]], ["AN", 6, 0, 5], ["FU", 6, [1, 2, 3, 4, 5]], ["AN", 6, 1, 4], ["FU", 6, [2, 3, 4, 5, 6]], ["AN", 6, 2, 6], ["FU", 4, [0, 1, 2, 3, 4]], ["SP", 4, 0, 96, [1], 1], ["AN", 4, 1, 2], ["FFSP", 4, 0, [5, 4, 3, 2, 1], 1, 1], ["AN", 4, 1, 6], ["FU", 2, [0, 1, 2, 3, 4]], ["SP", 2, 0, 896, [1], 1], ["AN", 2, 1, 2], ["FFSP", 2, 0, [5, 4, 3, 2, 1], 1, 1], ["AN", 2, 1, 6], ["PR", 5, 0, "auto_unroll_max_step$64"]]]], "r": [[0.0173803, 0.0182445, 0.0180734], 0, 35.9838, 1661898267], "v": "v0.6"}
{"i": [["[\"fused_conv3x3\", 4, 14, 14, 32, 32, 3, 3, 64]", "cuda -keys=cuda,gpu -max_num_threads=1024 -model=unknown -thread_warp_size=32", [-1, 16, 64, 49152, 2147483647, 1024, 8, 32], "", 0, []], [[], [["CHW", 3, "local"], ["SP", 3, 0, 4, [1, 2, 1, 1], 1], ["SP", 3, 5, 64, [1, 4, 4, 1], 1], ["SP", 3, 10, 14, [1, 2, 1, 1], 1], ["SP", 3, 15, 14, [1, 14, 1, 1], 1], ["SP", 3, 20, 32, [1, 2, 16, 1], 1], ["SP", 3, 25, 32, [2, 1], 1], ["SP", 3, 28, 3, [1, 3], 1], ["SP", 3, 31, 3, [1, 1], 1], ["RE", 3, [0, 5, 10, 15, 20, 1, 6, 11, 16, 21, 2, 7, 12, 17, 22, 25, 28, 31, 26, 29, 32, 3, 8, 13, 18, 23, 27, 30, 33, 4, 9, 14, 19, 24]], ["FSP", 4, 0, 1, 3], ["FSP", 4, 4, 2, 3], ["FSP", 4, 8, 3, 3], ["FSP", 4, 12, 4, 3], ["FSP", 4, 16, 5, 3], ["RE", 4, [0, 4, 8, 12, 16, 1, 5, 9, 13, 17, 2, 6, 10, 14, 18, 3, 7, 11, 15, 19]], ["CA", 3, 4, 14], ["CHR", 2, "shared", [3]], ["CA", 3, 4, 17], ["CHR", 1, "shared", [4]], ["CA", 2, 5, 17], ["CI", 1], ["FU", 6, [0, 1, 2, 3, 4]], ["AN", 6, 0, 5], ["FU", 6, [1, 2, 3, 4, 5]], ["AN", 6, 1, 4], ["FU", 6, [2, 3, 4, 5, 6]], ["AN", 6, 2, 6], ["FU", 4, [0, 1, 2, 3, 4]], ["SP", 4, 0, 1536, [16], 1], ["AN", 4, 1, 2], ["FFSP", 4, 0, [5, 4, 3, 2, 1], 1, 1], ["AN", 4, 1, 6], ["FU", 2, [0, 1, 2, 3, 4]], ["SP", 2, 0, 288, [1], 1], ["AN", 2, 1, 2], ["FFSP", 2, 0, [5, 4, 3, 2, 1], 1, 1], ["AN", 2, 1, 6], ["PR", 5, 0, "auto_unroll_max_step$1024"]]]], "r": [[0.00038666, 0.000386291, 0.000386295], 0, 32.7347, 1661898262], "v": "v0.6"}
{"i": [["[\"fused_conv3x3\", 4, 14, 14, 32, 32, 3, 3, 64]", "cuda -keys=cuda,gpu -max_num_threads=1024 -model=unknown -thread_warp_size=32", [-1, 16, 64, 49152, 2147483647, 1024, 8, 32], "", 0, []], [[], [["CHW", 3, "local"], ["SP", 3, 0, 4, [1, 2, 1, 2], 1], ["SP", 3, 5, 64, [1, 1, 2, 2], 1], ["SP", 3, 10, 14, [2, 1, 7, 1], 1], ["SP", 3, 15, 14, [1, 2, 1, 7], 1], ["SP", 3, 20, 32, [1, 8, 4, 1], 1], ["SP", 3, 25, 32, [2, 1], 1], ["SP", 3, 28, 3, [1, 3], 1], ["SP", 3, 31, 3, [1, 1], 1], ["RE", 3, [0, 5, 10, 15, 20, 1, 6, 11, 16, 21, 2, 7, 12, 17, 22, 25, 28, 31, 26, 29, 32, 3, 8, 13, 18, 23, 27, 30, 33, 4, 9, 14, 19, 24]], ["FSP", 4, 0, 1, 3], ["FSP", 4, 4, 2, 3], ["FSP", 4, 8, 3, 3], ["FSP", 4, 12, 4, 3], ["FSP", 4, 16, 5, 3], ["RE", 4, [0, 4, 8, 12, 16, 1, 5, 9, 13, 17, 2, 6, 10, 14, 18, 3, 7, 11, 15, 19]], ["CA", 3, 4, 14], ["CHR", 2, "shared", [3]], ["CA", 3, 4, 17], ["CHR", 1, "shared", [4]], ["CA", 2, 5, 17], ["CI", 1], ["FU", 6, [0, 1, 2, 3, 4]], ["AN", 6, 0, 5], ["FU", 6, [1, 2, 3, 4, 5]], ["AN", 6, 1, 4], ["FU", 6, [2, 3, 4, 5, 6]], ["AN", 6, 2, 6], ["FU", 4, [0, 1, 2, 3, 4]], ["SP", 4, 0, 96, [1], 1], ["AN", 4, 1, 2], ["FFSP", 4, 0, [5, 4, 3, 2, 1], 1, 1], ["AN", 4, 1, 6], ["FU", 2, [0, 1, 2, 3, 4]], ["SP", 2, 0, 2304, [1], 1], ["AN", 2, 1, 2], ["FFSP", 2, 0, [5, 4, 3, 2, 1], 1, 1], ["AN", 2, 1, 6], ["PR", 5, 0, "auto_unroll_max_step$64"]]]], "r": [[0.00611863, 0.00611955, 0.00611962], 0, 36.9595, 1661898267], "v": "v0.6"}
{"i": [["[\"fused_conv3x3\", 4, 14, 14, 32, 32, 3, 3, 64]", "cuda -keys=cuda,gpu -max_num_threads=1024 -model=unknown -thread_warp_size=32", [-1, 16, 64, 49152, 2147483647, 1024, 8, 32], "", 0, []], [[], [["CHW", 3, "local"], ["SP", 3, 0, 4, [1, 1, 4, 1], 1], ["SP", 3, 5, 64, [1, 4, 1, 1], 1], ["SP", 3, 10, 14, [1, 1, 1, 2], 1], ["SP", 3, 15, 14, [2, 1, 1, 7], 1], ["SP", 3, 20, 32, [4, 4, 1, 1], 1], ["SP", 3, 25, 32, [4, 1], 1], ["SP", 3, 28, 3, [3, 1], 1], ["SP", 3, 31, 3, [3, 1], 1], ["RE", 3, [0, 5, 10, 15, 20, 1, 6, 11, 16, 21, 2, 7, 12, 17, 22, 25, 28, 31, 26, 29, 32, 3, 8, 13, 18, 23, 27, 30, 33, 4, 9, 14, 19, 24]], ["FSP", 4, 0, 1, 3], ["FSP", 4, 4, 2, 3], ["FSP", 4, 8, 3, 3], ["FSP", 4, 12, 4, 3], ["FSP", 4, 16, 5, 3], ["RE", 4, [0, 4, 8, 12, 16, 1, 5, 9, 13, 17, 2, 6, 10, 14, 18, 3, 7, 11, 15, 19]], ["CA", 3, 4, 14], ["CHR", 2, "shared", [3]], ["CA", 3, 4, 17], ["CHR", 1, "shared", [4]], ["CA", 2, 5, 17], ["CI", 1], ["FU", 6, [0, 1, 2, 3, 4]], ["AN", 6, 0, 5], ["FU", 6, [1, 2, 3, 4, 5]], ["AN", 6, 1, 4], ["FU", 6, [2, 3, 4, 5, 6]], ["AN", 6, 2, 6], ["FU", 4, [0, 1, 2, 3, 4]], ["SP", 4, 0, 36, [1], 1], ["AN", 4, 1, 2], ["FFSP", 4, 0, [5, 4, 3, 2, 1], 1, 1], ["AN", 4, 1, 6], ["FU", 2, [0, 1, 2, 3, 4]], ["SP", 2, 0, 192, [16], 1], ["AN", 2, 1, 2], ["FFSP", 2, 0, [5, 4, 3, 2, 1], 1, 1], ["AN", 2, 1, 6], ["PR", 5, 0, "auto_unroll_max_step$0"]]]], "r": [[0.00149212, 0.00148733, 0.00148745], 0, 36.5519, 1661898268], "v": "v0.6"}
{"i": [["[\"fused_conv3x3\", 4, 14, 14, 32, 32, 3, 3, 64]", "cuda -keys=cuda,gpu -max_num_threads=1024 -model=unknown -thread_warp_size=32", [-1, 16, 64, 49152, 2147483647, 1024, 8, 32], "", 0, []], [[], [["CHW", 3, "local"], ["SP", 3, 0, 4, [4, 1, 1, 1], 1], ["SP", 3, 5, 64, [1, 1, 1, 4], 1], ["SP", 3, 10, 14, [1, 7, 2, 1], 1], ["SP", 3, 15, 14, [1, 7, 1, 1], 1], ["SP", 3, 20, 32, [1, 1, 4, 4], 1], ["SP", 3, 25, 32, [1, 2], 1], ["SP", 3, 28, 3, [1, 3], 1], ["SP", 3, 31, 3, [1, 3], 1], ["RE", 3, [0, 5, 10, 15, 20, 1, 6, 11, 16, 21, 2, 7, 12, 17, 22, 25, 28, 31, 26, 29, 32, 3, 8, 13, 18, 23, 27, 30, 33, 4, 9, 14, 19, 24]], ["FSP", 4, 0, 1, 3], ["FSP", 4, 4, 2, 3], ["FSP", 4, 8, 3, 3], ["FSP", 4, 12, 4, 3], ["FSP", 4, 16, 5, 3], ["RE", 4, [0, 4, 8, 12, 16, 1, 5, 9, 13, 17, 2, 6, 10, 14, 18, 3, 7, 11, 15, 19]], ["CA", 3, 4, 14], ["CHR", 2, "shared", [3]], ["CA", 3, 4, 17], ["CHR", 1, "shared", [4]], ["CA", 2, 5, 17], ["CI", 1], ["FU", 6, [0, 1, 2, 3, 4]], ["AN", 6, 0, 5], ["FU", 6, [1, 2, 3, 4, 5]], ["AN", 6, 1, 4], ["FU", 6, [2, 3, 4, 5, 6]], ["AN", 6, 2, 6], ["FU", 4, [0, 1, 2, 3, 4]], ["SP", 4, 0, 384, [1], 1], ["AN", 4, 1, 2], ["FFSP", 4, 0, [5, 4, 3, 2, 1], 1, 1], ["AN", 4, 1, 6], ["FU", 2, [0, 1, 2, 3, 4]], ["SP", 2, 0, 16, [1], 1], ["AN", 2, 1, 2], ["FFSP", 2, 0, [5, 4, 3, 2, 1], 1, 1], ["AN", 2, 1, 6], ["PR", 5, 0, "auto_unroll_max_step$512"]]]], "r": [[0.000422825, 0.000422686, 0.000422596], 0, 40.5163, 1661898269], "v": "v0.6"}
