python/models/resnext/kernel_configs/resnext_imagenet_50_fused_conv1x1_bn_relu_no_share_input_1_56_56_64_4_64.log
{"i": [["[\"fused_conv1x1_bn_relu_no_share_input\", 1, 56, 56, 64, 4, 64]", "cuda -keys=cuda,gpu -max_num_threads=1024 -model=unknown -thread_warp_size=32", [-1, 16, 64, 49152, 2147483647, 1024, 8, 32], "", 0, []], [[], [["CI", 6], ["CI", 4], ["SP", 2, 0, 1, [1, 1, 1, 1], 1], ["SP", 2, 5, 64, [2, 16, 1, 1], 1], ["SP", 2, 10, 56, [1, 1, 2, 1], 1], ["SP", 2, 15, 56, [1, 1, 1, 1], 1], ["SP", 2, 20, 4, [1, 1, 1, 4], 1], ["SP", 2, 25, 64, [2, 4], 1], ["RE", 2, [0, 5, 10, 15, 20, 1, 6, 11, 16, 21, 2, 7, 12, 17, 22, 25, 26, 3, 8, 13, 18, 23, 27, 4, 9, 14, 19, 24]], ["FSP", 7, 0, 2, 3], ["FSP", 7, 4, 3, 3], ["FSP", 7, 8, 4, 3], ["FSP", 7, 12, 5, 3], ["FSP", 7, 16, 6, 3], ["RE", 7, [0, 4, 8, 12, 16, 1, 5, 9, 13, 17, 2, 6, 10, 14, 18, 3, 7, 11, 15, 19]], ["CA", 2, 7, 14], ["CHR", 1, "shared", [2]], ["CA", 2, 3, 15], ["CHR", 0, "shared", [3]], ["CA", 1, 4, 15], ["FU", 9, [0, 1, 2, 3, 4]], ["AN", 9, 0, 5], ["FU", 9, [1, 2, 3, 4, 5]], ["AN", 9, 1, 4], ["FU", 9, [2, 3, 4, 5, 6]], ["AN", 9, 2, 6], ["FU", 3, [0, 1, 2]], ["SP", 3, 0, 16, [1], 1], ["AN", 3, 1, 2], ["FFSP", 3, 0, [6, 5, 4, 3, 2], 1, 1], ["AN", 3, 1, 6], ["FU", 1, [0, 1, 2, 3, 4]], ["SP", 1, 0, 32, [1], 1], ["AN", 1, 1, 2], ["FFSP", 1, 0, [6, 5, 4, 3, 2], 1, 1], ["AN", 1, 1, 6], ["PR", 4, 0, "auto_unroll_max_step$512"]]]], "r": [[0.000139941, 0.000139851, 0.000140092], 0, 18.8657, 1681221148], "v": "v0.6"}
{"i": [["[\"fused_conv1x1_bn_relu_no_share_input\", 1, 56, 56, 64, 4, 64]", "cuda -keys=cuda,gpu -max_num_threads=1024 -model=unknown -thread_warp_size=32", [-1, 16, 64, 49152, 2147483647, 1024, 8, 32], "", 0, []], [[], [["CI", 6], ["CI", 4], ["SP", 2, 0, 1, [1, 1, 1, 1], 1], ["SP", 2, 5, 64, [2, 2, 1, 1], 1], ["SP", 2, 10, 56, [1, 4, 1, 2], 1], ["SP", 2, 15, 56, [2, 7, 1, 1], 1], ["SP", 2, 20, 4, [1, 2, 1, 1], 1], ["SP", 2, 25, 64, [2, 8], 1], ["RE", 2, [0, 5, 10, 15, 20, 1, 6, 11, 16, 21, 2, 7, 12, 17, 22, 25, 26, 3, 8, 13, 18, 23, 27, 4, 9, 14, 19, 24]], ["FSP", 7, 0, 2, 3], ["FSP", 7, 4, 3, 3], ["FSP", 7, 8, 4, 3], ["FSP", 7, 12, 5, 3], ["FSP", 7, 16, 6, 3], ["RE", 7, [0, 4, 8, 12, 16, 1, 5, 9, 13, 17, 2, 6, 10, 14, 18, 3, 7, 11, 15, 19]], ["CA", 2, 7, 14], ["CHR", 1, "shared", [2]], ["CA", 2, 3, 15], ["CHR", 0, "shared", [3]], ["CA", 1, 4, 15], ["FU", 9, [0, 1, 2, 3, 4]], ["AN", 9, 0, 5], ["FU", 9, [1, 2, 3, 4, 5]], ["AN", 9, 1, 4], ["FU", 9, [2, 3, 4, 5, 6]], ["AN", 9, 2, 6], ["FU", 3, [0, 1, 2]], ["SP", 3, 0, 16, [4], 1], ["AN", 3, 1, 2], ["FFSP", 3, 0, [6, 5, 4, 3, 2], 1, 1], ["AN", 3, 1, 6], ["FU", 1, [0, 1, 2, 3, 4]], ["SP", 1, 0, 32, [1], 1], ["AN", 1, 1, 2], ["FFSP", 1, 0, [6, 5, 4, 3, 2], 1, 1], ["AN", 1, 1, 6], ["PR", 4, 0, "auto_unroll_max_step$1024"]]]], "r": [[0.000101111, 0.000101132, 0.000101108], 0, 9.42318, 1681221137], "v": "v0.6"}
{"i": [["[\"fused_conv1x1_bn_relu_no_share_input\", 1, 56, 56, 64, 4, 64]", "cuda -keys=cuda,gpu -max_num_threads=1024 -model=unknown -thread_warp_size=32", [-1, 16, 64, 49152, 2147483647, 1024, 8, 32], "", 0, []], [[], [["CI", 6], ["CI", 4], ["SP", 2, 0, 1, [1, 1, 1, 1], 1], ["SP", 2, 5, 64, [1, 16, 2, 1], 1], ["SP", 2, 10, 56, [2, 1, 1, 1], 1], ["SP", 2, 15, 56, [1, 7, 1, 2], 1], ["SP", 2, 20, 4, [4, 1, 1, 1], 1], ["SP", 2, 25, 64, [2, 2], 1], ["RE", 2, [0, 5, 10, 15, 20, 1, 6, 11, 16, 21, 2, 7, 12, 17, 22, 25, 26, 3, 8, 13, 18, 23, 27, 4, 9, 14, 19, 24]], ["FSP", 7, 0, 2, 3], ["FSP", 7, 4, 3, 3], ["FSP", 7, 8, 4, 3], ["FSP", 7, 12, 5, 3], ["FSP", 7, 16, 6, 3], ["RE", 7, [0, 4, 8, 12, 16, 1, 5, 9, 13, 17, 2, 6, 10, 14, 18, 3, 7, 11, 15, 19]], ["CA", 2, 7, 14], ["CHR", 1, "shared", [2]], ["CA", 2, 3, 15], ["CHR", 0, "shared", [3]], ["CA", 1, 4, 15], ["FU", 9, [0, 1, 2, 3, 4]], ["AN", 9, 0, 5], ["FU", 9, [1, 2, 3, 4, 5]], ["AN", 9, 1, 4], ["FU", 9, [2, 3, 4, 5, 6]], ["AN", 9, 2, 6], ["FU", 3, [0, 1, 2]], ["SP", 3, 0, 8, [1], 1], ["AN", 3, 1, 2], ["FFSP", 3, 0, [6, 5, 4, 3, 2], 1, 1], ["AN", 3, 1, 6], ["FU", 1, [0, 1, 2, 3, 4]], ["SP", 1, 0, 16, [4], 1], ["AN", 1, 1, 2], ["FFSP", 1, 0, [6, 5, 4, 3, 2], 1, 1], ["AN", 1, 1, 6], ["PR", 4, 0, "auto_unroll_max_step$64"]]]], "r": [[9.56904e-05, 9.57796e-05, 9.56303e-05], 0, 15.5497, 1681221146], "v": "v0.6"}
{"i": [["[\"fused_conv1x1_bn_relu_no_share_input\", 1, 56, 56, 64, 4, 64]", "cuda -keys=cuda,gpu -max_num_threads=1024 -model=unknown -thread_warp_size=32", [-1, 16, 64, 49152, 2147483647, 1024, 8, 32], "", 0, []], [[], [["CI", 6], ["CI", 4], ["SP", 2, 0, 1, [1, 1, 1, 1], 1], ["SP", 2, 5, 64, [1, 4, 2, 2], 1], ["SP", 2, 10, 56, [2, 4, 1, 1], 1], ["SP", 2, 15, 56, [1, 7, 2, 1], 1], ["SP", 2, 20, 4, [2, 1, 1, 2], 1], ["SP", 2, 25, 64, [1, 2], 1], ["RE", 2, [0, 5, 10, 15, 20, 1, 6, 11, 16, 21, 2, 7, 12, 17, 22, 25, 26, 3, 8, 13, 18, 23, 27, 4, 9, 14, 19, 24]], ["FSP", 7, 0, 2, 3], ["FSP", 7, 4, 3, 3], ["FSP", 7, 8, 4, 3], ["FSP", 7, 12, 5, 3], ["FSP", 7, 16, 6, 3], ["RE", 7, [0, 4, 8, 12, 16, 1, 5, 9, 13, 17, 2, 6, 10, 14, 18, 3, 7, 11, 15, 19]], ["CA", 2, 7, 14], ["CHR", 1, "shared", [2]], ["CA", 2, 3, 15], ["CHR", 0, "shared", [3]], ["CA", 1, 4, 15], ["FU", 9, [0, 1, 2, 3, 4]], ["AN", 9, 0, 5], ["FU", 9, [1, 2, 3, 4, 5]], ["AN", 9, 1, 4], ["FU", 9, [2, 3, 4, 5, 6]], ["AN", 9, 2, 6], ["FU", 3, [0, 1, 2]], ["SP", 3, 0, 64, [1], 1], ["AN", 3, 1, 2], ["FFSP", 3, 0, [6, 5, 4, 3, 2], 1, 1], ["AN", 3, 1, 6], ["FU", 1, [0, 1, 2, 3, 4]], ["SP", 1, 0, 32, [1], 1], ["AN", 1, 1, 2], ["FFSP", 1, 0, [6, 5, 4, 3, 2], 1, 1], ["AN", 1, 1, 6], ["PR", 4, 0, "auto_unroll_max_step$512"]]]], "r": [[0.000152707, 0.000152646, 0.000152343], 0, 17.3172, 1681221147], "v": "v0.6"}
{"i": [["[\"fused_conv1x1_bn_relu_no_share_input\", 1, 56, 56, 64, 4, 64]", "cuda -keys=cuda,gpu -max_num_threads=1024 -model=unknown -thread_warp_size=32", [-1, 16, 64, 49152, 2147483647, 1024, 8, 32], "", 0, []], [[], [["CI", 6], ["CI", 4], ["SP", 2, 0, 1, [1, 1, 1, 1], 1], ["SP", 2, 5, 64, [1, 2, 1, 4], 1], ["SP", 2, 10, 56, [1, 14, 2, 1], 1], ["SP", 2, 15, 56, [1, 1, 1, 2], 1], ["SP", 2, 20, 4, [2, 2, 1, 1], 1], ["SP", 2, 25, 64, [1, 2], 1], ["RE", 2, [0, 5, 10, 15, 20, 1, 6, 11, 16, 21, 2, 7, 12, 17, 22, 25, 26, 3, 8, 13, 18, 23, 27, 4, 9, 14, 19, 24]], ["FSP", 7, 0, 2, 3], ["FSP", 7, 4, 3, 3], ["FSP", 7, 8, 4, 3], ["FSP", 7, 12, 5, 3], ["FSP", 7, 16, 6, 3], ["RE", 7, [0, 4, 8, 12, 16, 1, 5, 9, 13, 17, 2, 6, 10, 14, 18, 3, 7, 11, 15, 19]], ["CA", 2, 7, 14], ["CHR", 1, "shared", [2]], ["CA", 2, 3, 15], ["CHR", 0, "shared", [3]], ["CA", 1, 4, 15], ["FU", 9, [0, 1, 2, 3, 4]], ["AN", 9, 0, 5], ["FU", 9, [1, 2, 3, 4, 5]], ["AN", 9, 1, 4], ["FU", 9, [2, 3, 4, 5, 6]], ["AN", 9, 2, 6], ["FU", 3, [0, 1, 2]], ["SP", 3, 0, 8, [1], 1], ["AN", 3, 1, 2], ["FFSP", 3, 0, [6, 5, 4, 3, 2], 1, 1], ["AN", 3, 1, 6], ["FU", 1, [0, 1, 2, 3, 4]], ["SP", 1, 0, 32, [2], 1], ["AN", 1, 1, 2], ["FFSP", 1, 0, [6, 5, 4, 3, 2], 1, 1], ["AN", 1, 1, 6], ["PR", 4, 0, "auto_unroll_max_step$16"]]]], "r": [[0.00011539, 0.000115319, 0.000115323], 0, 8.56028, 1681221139], "v": "v0.6"}
{"i": [["[\"fused_conv1x1_bn_relu_no_share_input\", 1, 56, 56, 64, 4, 64]", "cuda -keys=cuda,gpu -max_num_threads=1024 -model=unknown -thread_warp_size=32", [-1, 16, 64, 49152, 2147483647, 1024, 8, 32], "", 0, []], [[], [["CI", 6], ["CI", 4], ["SP", 2, 0, 1, [1, 1, 1, 1], 1], ["SP", 2, 5, 64, [1, 4, 4, 2], 1], ["SP", 2, 10, 56, [2, 4, 1, 1], 1], ["SP", 2, 15, 56, [1, 7, 2, 1], 1], ["SP", 2, 20, 4, [1, 1, 1, 1], 1], ["SP", 2, 25, 64, [1, 2], 1], ["RE", 2, [0, 5, 10, 15, 20, 1, 6, 11, 16, 21, 2, 7, 12, 17, 22, 25, 26, 3, 8, 13, 18, 23, 27, 4, 9, 14, 19, 24]], ["FSP", 7, 0, 2, 3], ["FSP", 7, 4, 3, 3], ["FSP", 7, 8, 4, 3], ["FSP", 7, 12, 5, 3], ["FSP", 7, 16, 6, 3], ["RE", 7, [0, 4, 8, 12, 16, 1, 5, 9, 13, 17, 2, 6, 10, 14, 18, 3, 7, 11, 15, 19]], ["CA", 2, 7, 14], ["CHR", 1, "shared", [2]], ["CA", 2, 3, 15], ["CHR", 0, "shared", [3]], ["CA", 1, 4, 15], ["FU", 9, [0, 1, 2, 3, 4]], ["AN", 9, 0, 5], ["FU", 9, [1, 2, 3, 4, 5]], ["AN", 9, 1, 4], ["FU", 9, [2, 3, 4, 5, 6]], ["AN", 9, 2, 6], ["FU", 3, [0, 1, 2]], ["SP", 3, 0, 64, [16], 1], ["AN", 3, 1, 2], ["FFSP", 3, 0, [6, 5, 4, 3, 2], 1, 1], ["AN", 3, 1, 6], ["FU", 1, [0, 1, 2, 3, 4]], ["SP", 1, 0, 32, [1], 1], ["AN", 1, 1, 2], ["FFSP", 1, 0, [6, 5, 4, 3, 2], 1, 1], ["AN", 1, 1, 6], ["PR", 4, 0, "auto_unroll_max_step$512"]]]], "r": [[0.000519135, 0.000519331, 0.000519354], 0, 4.88158, 1681221134], "v": "v0.6"}
{"i": [["[\"fused_conv1x1_bn_relu_no_share_input\", 1, 56, 56, 64, 4, 64]", "cuda -keys=cuda,gpu -max_num_threads=1024 -model=unknown -thread_warp_size=32", [-1, 16, 64, 49152, 2147483647, 1024, 8, 32], "", 0, []], [[], [["CI", 6], ["CI", 4], ["SP", 2, 0, 1, [1, 1, 1, 1], 1], ["SP", 2, 5, 64, [2, 1, 1, 1], 1], ["SP", 2, 10, 56, [1, 7, 1, 4], 1], ["SP", 2, 15, 56, [1, 14, 4, 1], 1], ["SP", 2, 20, 4, [2, 1, 1, 1], 1], ["SP", 2, 25, 64, [2, 1], 1], ["RE", 2, [0, 5, 10, 15, 20, 1, 6, 11, 16, 21, 2, 7, 12, 17, 22, 25, 26, 3, 8, 13, 18, 23, 27, 4, 9, 14, 19, 24]], ["FSP", 7, 0, 2, 3], ["FSP", 7, 4, 3, 3], ["FSP", 7, 8, 4, 3], ["FSP", 7, 12, 5, 3], ["FSP", 7, 16, 6, 3], ["RE", 7, [0, 4, 8, 12, 16, 1, 5, 9, 13, 17, 2, 6, 10, 14, 18, 3, 7, 11, 15, 19]], ["CA", 2, 7, 14], ["CHR", 1, "shared", [2]], ["CA", 2, 3, 15], ["CHR", 0, "shared", [3]], ["CA", 1, 4, 15], ["FU", 9, [0, 1, 2, 3, 4]], ["AN", 9, 0, 5], ["FU", 9, [1, 2, 3, 4, 5]], ["AN", 9, 1, 4], ["FU", 9, [2, 3, 4, 5, 6]], ["AN", 9, 2, 6], ["FU", 3, [0, 1, 2]], ["SP", 3, 0, 4, [1], 1], ["AN", 3, 1, 2], ["FFSP", 3, 0, [6, 5, 4, 3, 2], 1, 1], ["AN", 3, 1, 6], ["FU", 1, [0, 1, 2, 3, 4]], ["SP", 1, 0, 32, [1], 1], ["AN", 1, 1, 2], ["FFSP", 1, 0, [6, 5, 4, 3, 2], 1, 1], ["AN", 1, 1, 6], ["PR", 4, 0, "auto_unroll_max_step$1024"]]]], "r": [[0.000252828, 0.000252936, 0.00025288], 0, 19.6956, 1681221150], "v": "v0.6"}
{"i": [["[\"fused_conv1x1_bn_relu_no_share_input\", 1, 56, 56, 64, 4, 64]", "cuda -keys=cuda,gpu -max_num_threads=1024 -model=unknown -thread_warp_size=32", [-1, 16, 64, 49152, 2147483647, 1024, 8, 32], "", 0, []], [[], [["CI", 6], ["CI", 4], ["SP", 2, 0, 1, [1, 1, 1, 1], 1], ["SP", 2, 5, 64, [1, 16, 2, 1], 1], ["SP", 2, 10, 56, [2, 1, 1, 1], 1], ["SP", 2, 15, 56, [1, 7, 1, 2], 1], ["SP", 2, 20, 4, [4, 1, 1, 1], 1], ["SP", 2, 25, 64, [1, 2], 1], ["RE", 2, [0, 5, 10, 15, 20, 1, 6, 11, 16, 21, 2, 7, 12, 17, 22, 25, 26, 3, 8, 13, 18, 23, 27, 4, 9, 14, 19, 24]], ["FSP", 7, 0, 2, 3], ["FSP", 7, 4, 3, 3], ["FSP", 7, 8, 4, 3], ["FSP", 7, 12, 5, 3], ["FSP", 7, 16, 6, 3], ["RE", 7, [0, 4, 8, 12, 16, 1, 5, 9, 13, 17, 2, 6, 10, 14, 18, 3, 7, 11, 15, 19]], ["CA", 2, 7, 14], ["CHR", 1, "shared", [2]], ["CA", 2, 3, 15], ["CHR", 0, "shared", [3]], ["CA", 1, 4, 15], ["FU", 9, [0, 1, 2, 3, 4]], ["AN", 9, 0, 5], ["FU", 9, [1, 2, 3, 4, 5]], ["AN", 9, 1, 4], ["FU", 9, [2, 3, 4, 5, 6]], ["AN", 9, 2, 6], ["FU", 3, [0, 1, 2]], ["SP", 3, 0, 8, [2], 1], ["AN", 3, 1, 2], ["FFSP", 3, 0, [6, 5, 4, 3, 2], 1, 1], ["AN", 3, 1, 6], ["FU", 1, [0, 1, 2, 3, 4]], ["SP", 1, 0, 16, [1], 1], ["AN", 1, 1, 2], ["FFSP", 1, 0, [6, 5, 4, 3, 2], 1, 1], ["AN", 1, 1, 6], ["PR", 4, 0, "auto_unroll_max_step$1024"]]]], "r": [[0.000136897, 0.0001369, 0.000136692], 0, 9.93636, 1681221140], "v": "v0.6"}
{"i": [["[\"fused_conv1x1_bn_relu_no_share_input\", 1, 56, 56, 64, 4, 64]", "cuda -keys=cuda,gpu -max_num_threads=1024 -model=unknown -thread_warp_size=32", [-1, 16, 64, 49152, 2147483647, 1024, 8, 32], "", 0, []], [[], [["CI", 6], ["CI", 4], ["SP", 2, 0, 1, [1, 1, 1, 1], 1], ["SP", 2, 5, 64, [2, 16, 2, 1], 1], ["SP", 2, 10, 56, [1, 1, 2, 1], 1], ["SP", 2, 15, 56, [1, 7, 1, 2], 1], ["SP", 2, 20, 4, [4, 1, 1, 1], 1], ["SP", 2, 25, 64, [2, 2], 1], ["RE", 2, [0, 5, 10, 15, 20, 1, 6, 11, 16, 21, 2, 7, 12, 17, 22, 25, 26, 3, 8, 13, 18, 23, 27, 4, 9, 14, 19, 24]], ["FSP", 7, 0, 2, 3], ["FSP", 7, 4, 3, 3], ["FSP", 7, 8, 4, 3], ["FSP", 7, 12, 5, 3], ["FSP", 7, 16, 6, 3], ["RE", 7, [0, 4, 8, 12, 16, 1, 5, 9, 13, 17, 2, 6, 10, 14, 18, 3, 7, 11, 15, 19]], ["CA", 2, 7, 14], ["CHR", 1, "shared", [2]], ["CA", 2, 3, 15], ["CHR", 0, "shared", [3]], ["CA", 1, 4, 15], ["FU", 9, [0, 1, 2, 3, 4]], ["AN", 9, 0, 5], ["FU", 9, [1, 2, 3, 4, 5]], ["AN", 9, 1, 4], ["FU", 9, [2, 3, 4, 5, 6]], ["AN", 9, 2, 6], ["FU", 3, [0, 1, 2]], ["SP", 3, 0, 8, [1], 1], ["AN", 3, 1, 2], ["FFSP", 3, 0, [6, 5, 4, 3, 2], 1, 1], ["AN", 3, 1, 6], ["FU", 1, [0, 1, 2, 3, 4]], ["SP", 1, 0, 16, [1], 1], ["AN", 1, 1, 2], ["FFSP", 1, 0, [6, 5, 4, 3, 2], 1, 1], ["AN", 1, 1, 6], ["PR", 4, 0, "auto_unroll_max_step$16"]]]], "r": [[0.000159093, 0.000158458, 0.000158687], 0, 3.57755, 1681221133], "v": "v0.6"}
{"i": [["[\"fused_conv1x1_bn_relu_no_share_input\", 1, 56, 56, 64, 4, 64]", "cuda -keys=cuda,gpu -max_num_threads=1024 -model=unknown -thread_warp_size=32", [-1, 16, 64, 49152, 2147483647, 1024, 8, 32], "", 0, []], [[], [["CI", 6], ["CI", 4], ["SP", 2, 0, 1, [1, 1, 1, 1], 1], ["SP", 2, 5, 64, [1, 4, 4, 2], 1], ["SP", 2, 10, 56, [2, 1, 4, 1], 1], ["SP", 2, 15, 56, [1, 1, 14, 1], 1], ["SP", 2, 20, 4, [4, 1, 1, 1], 1], ["SP", 2, 25, 64, [1, 2], 1], ["RE", 2, [0, 5, 10, 15, 20, 1, 6, 11, 16, 21, 2, 7, 12, 17, 22, 25, 26, 3, 8, 13, 18, 23, 27, 4, 9, 14, 19, 24]], ["FSP", 7, 0, 2, 3], ["FSP", 7, 4, 3, 3], ["FSP", 7, 8, 4, 3], ["FSP", 7, 12, 5, 3], ["FSP", 7, 16, 6, 3], ["RE", 7, [0, 4, 8, 12, 16, 1, 5, 9, 13, 17, 2, 6, 10, 14, 18, 3, 7, 11, 15, 19]], ["CA", 2, 7, 14], ["CHR", 1, "shared", [2]], ["CA", 2, 3, 15], ["CHR", 0, "shared", [3]], ["CA", 1, 4, 15], ["FU", 9, [0, 1, 2, 3, 4]], ["AN", 9, 0, 5], ["FU", 9, [1, 2, 3, 4, 5]], ["AN", 9, 1, 4], ["FU", 9, [2, 3, 4, 5, 6]], ["AN", 9, 2, 6], ["FU", 3, [0, 1, 2]], ["SP", 3, 0, 64, [1], 1], ["AN", 3, 1, 2], ["FFSP", 3, 0, [6, 5, 4, 3, 2], 1, 1], ["AN", 3, 1, 6], ["FU", 1, [0, 1, 2, 3, 4]], ["SP", 1, 0, 32, [1], 1], ["AN", 1, 1, 2], ["FFSP", 1, 0, [6, 5, 4, 3, 2], 1, 1], ["AN", 1, 1, 6], ["PR", 4, 0, "auto_unroll_max_step$16"]]]], "r": [[0.013792, 0.0137876, 0.0137799], 0, 12.8418, 1681221143], "v": "v0.6"}
{"i": [["[\"fused_conv1x1_bn_relu_no_share_input\", 1, 56, 56, 64, 4, 64]", "cuda -keys=cuda,gpu -max_num_threads=1024 -model=unknown -thread_warp_size=32", [-1, 16, 64, 49152, 2147483647, 1024, 8, 32], "", 0, []], [[], [["CI", 6], ["CI", 4], ["SP", 2, 0, 1, [1, 1, 1, 1], 1], ["SP", 2, 5, 64, [1, 8, 1, 4], 1], ["SP", 2, 10, 56, [1, 2, 4, 1], 1], ["SP", 2, 15, 56, [1, 2, 2, 1], 1], ["SP", 2, 20, 4, [4, 1, 1, 1], 1], ["SP", 2, 25, 64, [1, 4], 1], ["RE", 2, [0, 5, 10, 15, 20, 1, 6, 11, 16, 21, 2, 7, 12, 17, 22, 25, 26, 3, 8, 13, 18, 23, 27, 4, 9, 14, 19, 24]], ["FSP", 7, 0, 2, 3], ["FSP", 7, 4, 3, 3], ["FSP", 7, 8, 4, 3], ["FSP", 7, 12, 5, 3], ["FSP", 7, 16, 6, 3], ["RE", 7, [0, 4, 8, 12, 16, 1, 5, 9, 13, 17, 2, 6, 10, 14, 18, 3, 7, 11, 15, 19]], ["CA", 2, 7, 14], ["CHR", 1, "shared", [2]], ["CA", 2, 3, 15], ["CHR", 0, "shared", [3]], ["CA", 1, 4, 15], ["FU", 9, [0, 1, 2, 3, 4]], ["AN", 9, 0, 5], ["FU", 9, [1, 2, 3, 4, 5]], ["AN", 9, 1, 4], ["FU", 9, [2, 3, 4, 5, 6]], ["AN", 9, 2, 6], ["FU", 3, [0, 1, 2]], ["SP", 3, 0, 32, [1], 1], ["AN", 3, 1, 2], ["FFSP", 3, 0, [6, 5, 4, 3, 2], 1, 1], ["AN", 3, 1, 6], ["FU", 1, [0, 1, 2, 3, 4]], ["SP", 1, 0, 128, [1], 1], ["AN", 1, 1, 2], ["FFSP", 1, 0, [6, 5, 4, 3, 2], 1, 1], ["AN", 1, 1, 6], ["PR", 4, 0, "auto_unroll_max_step$0"]]]], "r": [[0.000269035, 0.00026882, 0.000268893], 0, 21.1168, 1681221151], "v": "v0.6"}
{"i": [["[\"fused_conv1x1_bn_relu_no_share_input\", 1, 56, 56, 64, 4, 64]", "cuda -keys=cuda,gpu -max_num_threads=1024 -model=unknown -thread_warp_size=32", [-1, 16, 64, 49152, 2147483647, 1024, 8, 32], "", 0, []], [[], [["CI", 6], ["CI", 4], ["SP", 2, 0, 1, [1, 1, 1, 1], 1], ["SP", 2, 5, 64, [4, 4, 1, 2], 1], ["SP", 2, 10, 56, [1, 8, 1, 1], 1], ["SP", 2, 15, 56, [1, 1, 2, 1], 1], ["SP", 2, 20, 4, [1, 1, 1, 4], 1], ["SP", 2, 25, 64, [1, 2], 1], ["RE", 2, [0, 5, 10, 15, 20, 1, 6, 11, 16, 21, 2, 7, 12, 17, 22, 25, 26, 3, 8, 13, 18, 23, 27, 4, 9, 14, 19, 24]], ["FSP", 7, 0, 2, 3], ["FSP", 7, 4, 3, 3], ["FSP", 7, 8, 4, 3], ["FSP", 7, 12, 5, 3], ["FSP", 7, 16, 6, 3], ["RE", 7, [0, 4, 8, 12, 16, 1, 5, 9, 13, 17, 2, 6, 10, 14, 18, 3, 7, 11, 15, 19]], ["CA", 2, 7, 14], ["CHR", 1, "shared", [2]], ["CA", 2, 3, 15], ["CHR", 0, "shared", [3]], ["CA", 1, 4, 15], ["FU", 9, [0, 1, 2, 3, 4]], ["AN", 9, 0, 5], ["FU", 9, [1, 2, 3, 4, 5]], ["AN", 9, 1, 4], ["FU", 9, [2, 3, 4, 5, 6]], ["AN", 9, 2, 6], ["FU", 3, [0, 1, 2]], ["SP", 3, 0, 64, [1], 1], ["AN", 3, 1, 2], ["FFSP", 3, 0, [6, 5, 4, 3, 2], 1, 1], ["AN", 3, 1, 6], ["FU", 1, [0, 1, 2, 3, 4]], ["SP", 1, 0, 32, [2], 1], ["AN", 1, 1, 2], ["FFSP", 1, 0, [6, 5, 4, 3, 2], 1, 1], ["AN", 1, 1, 6], ["PR", 4, 0, "auto_unroll_max_step$512"]]]], "r": [[0.000121779, 0.000121873, 0.000121777], 0, 6.28361, 1681221136], "v": "v0.6"}
{"i": [["[\"fused_conv1x1_bn_relu_no_share_input\", 1, 56, 56, 64, 4, 64]", "cuda -keys=cuda,gpu -max_num_threads=1024 -model=unknown -thread_warp_size=32", [-1, 16, 64, 49152, 2147483647, 1024, 8, 32], "", 0, []], [[], [["CI", 6], ["CI", 4], ["SP", 2, 0, 1, [1, 1, 1, 1], 1], ["SP", 2, 5, 64, [1, 2, 2, 1], 1], ["SP", 2, 10, 56, [1, 1, 1, 1], 1], ["SP", 2, 15, 56, [1, 8, 1, 1], 1], ["SP", 2, 20, 4, [1, 2, 2, 1], 1], ["SP", 2, 25, 64, [2, 1], 1], ["RE", 2, [0, 5, 10, 15, 20, 1, 6, 11, 16, 21, 2, 7, 12, 17, 22, 25, 26, 3, 8, 13, 18, 23, 27, 4, 9, 14, 19, 24]], ["FSP", 7, 0, 2, 3], ["FSP", 7, 4, 3, 3], ["FSP", 7, 8, 4, 3], ["FSP", 7, 12, 5, 3], ["FSP", 7, 16, 6, 3], ["RE", 7, [0, 4, 8, 12, 16, 1, 5, 9, 13, 17, 2, 6, 10, 14, 18, 3, 7, 11, 15, 19]], ["CA", 2, 7, 14], ["CHR", 1, "shared", [2]], ["CA", 2, 3, 15], ["CHR", 0, "shared", [3]], ["CA", 1, 4, 15], ["FU", 9, [0, 1, 2, 3, 4]], ["AN", 9, 0, 5], ["FU", 9, [1, 2, 3, 4, 5]], ["AN", 9, 1, 4], ["FU", 9, [2, 3, 4, 5, 6]], ["AN", 9, 2, 6], ["FU", 3, [0, 1, 2]], ["SP", 3, 0, 8, [1], 1], ["AN", 3, 1, 2], ["FFSP", 3, 0, [6, 5, 4, 3, 2], 1, 1], ["AN", 3, 1, 6], ["FU", 1, [0, 1, 2, 3, 4]], ["SP", 1, 0, 4, [1], 1], ["AN", 1, 1, 2], ["FFSP", 1, 0, [6, 5, 4, 3, 2], 1, 1], ["AN", 1, 1, 6], ["PR", 4, 0, "auto_unroll_max_step$0"]]]], "r": [[9.81985e-05, 9.8153e-05, 9.83014e-05], 0, 11.0387, 1681221141], "v": "v0.6"}
{"i": [["[\"fused_conv1x1_bn_relu_no_share_input\", 1, 56, 56, 64, 4, 64]", "cuda -keys=cuda,gpu -max_num_threads=1024 -model=unknown -thread_warp_size=32", [-1, 16, 64, 49152, 2147483647, 1024, 8, 32], "", 0, []], [[], [["CI", 6], ["CI", 4], ["SP", 2, 0, 1, [1, 1, 1, 1], 1], ["SP", 2, 5, 64, [2, 1, 1, 2], 1], ["SP", 2, 10, 56, [1, 14, 1, 2], 1], ["SP", 2, 15, 56, [1, 1, 1, 8], 1], ["SP", 2, 20, 4, [2, 2, 1, 1], 1], ["SP", 2, 25, 64, [2, 4], 1], ["RE", 2, [0, 5, 10, 15, 20, 1, 6, 11, 16, 21, 2, 7, 12, 17, 22, 25, 26, 3, 8, 13, 18, 23, 27, 4, 9, 14, 19, 24]], ["FSP", 7, 0, 2, 3], ["FSP", 7, 4, 3, 3], ["FSP", 7, 8, 4, 3], ["FSP", 7, 12, 5, 3], ["FSP", 7, 16, 6, 3], ["RE", 7, [0, 4, 8, 12, 16, 1, 5, 9, 13, 17, 2, 6, 10, 14, 18, 3, 7, 11, 15, 19]], ["CA", 2, 7, 14], ["CHR", 1, "shared", [2]], ["CA", 2, 3, 15], ["CHR", 0, "shared", [3]], ["CA", 1, 4, 15], ["FU", 9, [0, 1, 2, 3, 4]], ["AN", 9, 0, 5], ["FU", 9, [1, 2, 3, 4, 5]], ["AN", 9, 1, 4], ["FU", 9, [2, 3, 4, 5, 6]], ["AN", 9, 2, 6], ["FU", 3, [0, 1, 2]], ["SP", 3, 0, 16, [4], 1], ["AN", 3, 1, 2], ["FFSP", 3, 0, [6, 5, 4, 3, 2], 1, 1], ["AN", 3, 1, 6], ["FU", 1, [0, 1, 2, 3, 4]], ["SP", 1, 0, 64, [1], 1], ["AN", 1, 1, 2], ["FFSP", 1, 0, [6, 5, 4, 3, 2], 1, 1], ["AN", 1, 1, 6], ["PR", 4, 0, "auto_unroll_max_step$16"]]]], "r": [[0.000330665, 0.000330994, 0.000330583], 0, 29.2719, 1681221159], "v": "v0.6"}
{"i": [["[\"fused_conv1x1_bn_relu_no_share_input\", 1, 56, 56, 64, 4, 64]", "cuda -keys=cuda,gpu -max_num_threads=1024 -model=unknown -thread_warp_size=32", [-1, 16, 64, 49152, 2147483647, 1024, 8, 32], "", 0, []], [[], [["CI", 6], ["CI", 4], ["SP", 2, 0, 1, [1, 1, 1, 1], 1], ["SP", 2, 5, 64, [2, 16, 2, 1], 1], ["SP", 2, 10, 56, [1, 14, 1, 2], 1], ["SP", 2, 15, 56, [1, 1, 1, 2], 1], ["SP", 2, 20, 4, [1, 1, 4, 1], 1], ["SP", 2, 25, 64, [1, 2], 1], ["RE", 2, [0, 5, 10, 15, 20, 1, 6, 11, 16, 21, 2, 7, 12, 17, 22, 25, 26, 3, 8, 13, 18, 23, 27, 4, 9, 14, 19, 24]], ["FSP", 7, 0, 2, 3], ["FSP", 7, 4, 3, 3], ["FSP", 7, 8, 4, 3], ["FSP", 7, 12, 5, 3], ["FSP", 7, 16, 6, 3], ["RE", 7, [0, 4, 8, 12, 16, 1, 5, 9, 13, 17, 2, 6, 10, 14, 18, 3, 7, 11, 15, 19]], ["CA", 2, 7, 14], ["CHR", 1, "shared", [2]], ["CA", 2, 3, 15], ["CHR", 0, "shared", [3]], ["CA", 1, 4, 15], ["FU", 9, [0, 1, 2, 3, 4]], ["AN", 9, 0, 5], ["FU", 9, [1, 2, 3, 4, 5]], ["AN", 9, 1, 4], ["FU", 9, [2, 3, 4, 5, 6]], ["AN", 9, 2, 6], ["FU", 3, [0, 1, 2]], ["SP", 3, 0, 16, [1], 1], ["AN", 3, 1, 2], ["FFSP", 3, 0, [6, 5, 4, 3, 2], 1, 1], ["AN", 3, 1, 6], ["FU", 1, [0, 1, 2, 3, 4]], ["SP", 1, 0, 16, [1], 1], ["AN", 1, 1, 2], ["FFSP", 1, 0, [6, 5, 4, 3, 2], 1, 1], ["AN", 1, 1, 6], ["PR", 4, 0, "auto_unroll_max_step$512"]]]], "r": [[0.000179939, 0.000179852, 0.000179838], 0, 14.2049, 1681221144], "v": "v0.6"}
{"i": [["[\"fused_conv1x1_bn_relu_no_share_input\", 1, 56, 56, 64, 4, 64]", "cuda -keys=cuda,gpu -max_num_threads=1024 -model=unknown -thread_warp_size=32", [-1, 16, 64, 49152, 2147483647, 1024, 8, 32], "", 0, []], [[], [["CI", 6], ["CI", 4], ["SP", 2, 0, 1, [1, 1, 1, 1], 1], ["SP", 2, 5, 64, [1, 2, 1, 4], 1], ["SP", 2, 10, 56, [1, 1, 1, 2], 1], ["SP", 2, 15, 56, [2, 14, 1, 1], 1], ["SP", 2, 20, 4, [1, 1, 2, 1], 1], ["SP", 2, 25, 64, [1, 2], 1], ["RE", 2, [0, 5, 10, 15, 20, 1, 6, 11, 16, 21, 2, 7, 12, 17, 22, 25, 26, 3, 8, 13, 18, 23, 27, 4, 9, 14, 19, 24]], ["FSP", 7, 0, 2, 3], ["FSP", 7, 4, 3, 3], ["FSP", 7, 8, 4, 3], ["FSP", 7, 12, 5, 3], ["FSP", 7, 16, 6, 3], ["RE", 7, [0, 4, 8, 12, 16, 1, 5, 9, 13, 17, 2, 6, 10, 14, 18, 3, 7, 11, 15, 19]], ["CA", 2, 7, 14], ["CHR", 1, "shared", [2]], ["CA", 2, 3, 15], ["CHR", 0, "shared", [3]], ["CA", 1, 4, 15], ["FU", 9, [0, 1, 2, 3, 4]], ["AN", 9, 0, 5], ["FU", 9, [1, 2, 3, 4, 5]], ["AN", 9, 1, 4], ["FU", 9, [2, 3, 4, 5, 6]], ["AN", 9, 2, 6], ["FU", 3, [0, 1, 2]], ["SP", 3, 0, 16, [1], 1], ["AN", 3, 1, 2], ["FFSP", 3, 0, [6, 5, 4, 3, 2], 1, 1], ["AN", 3, 1, 6], ["FU", 1, [0, 1, 2, 3, 4]], ["SP", 1, 0, 16, [1], 1], ["AN", 1, 1, 2], ["FFSP", 1, 0, [6, 5, 4, 3, 2], 1, 1], ["AN", 1, 1, 6], ["PR", 4, 0, "auto_unroll_max_step$1024"]]]], "r": [[0.00015112, 0.000151071, 0.000151137], 0, 22.1585, 1681221152], "v": "v0.6"}
{"i": [["[\"fused_conv1x1_bn_relu_no_share_input\", 1, 56, 56, 64, 4, 64]", "cuda -keys=cuda,gpu -max_num_threads=1024 -model=unknown -thread_warp_size=32", [-1, 16, 64, 49152, 2147483647, 1024, 8, 32], "", 0, []], [[], [["CI", 6], ["CI", 4], ["SP", 2, 0, 1, [1, 1, 1, 1], 1], ["SP", 2, 5, 64, [1, 8, 1, 4], 1], ["SP", 2, 10, 56, [1, 8, 1, 1], 1], ["SP", 2, 15, 56, [1, 2, 2, 1], 1], ["SP", 2, 20, 4, [2, 1, 1, 2], 1], ["SP", 2, 25, 64, [1, 4], 1], ["RE", 2, [0, 5, 10, 15, 20, 1, 6, 11, 16, 21, 2, 7, 12, 17, 22, 25, 26, 3, 8, 13, 18, 23, 27, 4, 9, 14, 19, 24]], ["FSP", 7, 0, 2, 3], ["FSP", 7, 4, 3, 3], ["FSP", 7, 8, 4, 3], ["FSP", 7, 12, 5, 3], ["FSP", 7, 16, 6, 3], ["RE", 7, [0, 4, 8, 12, 16, 1, 5, 9, 13, 17, 2, 6, 10, 14, 18, 3, 7, 11, 15, 19]], ["CA", 2, 7, 14], ["CHR", 1, "shared", [2]], ["CA", 2, 3, 15], ["CHR", 0, "shared", [3]], ["CA", 1, 4, 15], ["FU", 9, [0, 1, 2, 3, 4]], ["AN", 9, 0, 5], ["FU", 9, [1, 2, 3, 4, 5]], ["AN", 9, 1, 4], ["FU", 9, [2, 3, 4, 5, 6]], ["AN", 9, 2, 6], ["FU", 3, [0, 1, 2]], ["SP", 3, 0, 32, [4], 1], ["AN", 3, 1, 2], ["FFSP", 3, 0, [6, 5, 4, 3, 2], 1, 1], ["AN", 3, 1, 6], ["FU", 1, [0, 1, 2, 3, 4]], ["SP", 1, 0, 128, [1], 1], ["AN", 1, 1, 2], ["FFSP", 1, 0, [6, 5, 4, 3, 2], 1, 1], ["AN", 1, 1, 6], ["PR", 4, 0, "auto_unroll_max_step$0"]]]], "r": [[7.90595e-05, 7.90445e-05, 7.89824e-05], 0, 37.1685, 1681221167], "v": "v0.6"}
{"i": [["[\"fused_conv1x1_bn_relu_no_share_input\", 1, 56, 56, 64, 4, 64]", "cuda -keys=cuda,gpu -max_num_threads=1024 -model=unknown -thread_warp_size=32", [-1, 16, 64, 49152, 2147483647, 1024, 8, 32], "", 0, []], [[], [["CI", 6], ["CI", 4], ["SP", 2, 0, 1, [1, 1, 1, 1], 1], ["SP", 2, 5, 64, [2, 1, 2, 1], 1], ["SP", 2, 10, 56, [1, 14, 1, 2], 1], ["SP", 2, 15, 56, [1, 1, 1, 8], 1], ["SP", 2, 20, 4, [1, 2, 1, 2], 1], ["SP", 2, 25, 64, [2, 4], 1], ["RE", 2, [0, 5, 10, 15, 20, 1, 6, 11, 16, 21, 2, 7, 12, 17, 22, 25, 26, 3, 8, 13, 18, 23, 27, 4, 9, 14, 19, 24]], ["FSP", 7, 0, 2, 3], ["FSP", 7, 4, 3, 3], ["FSP", 7, 8, 4, 3], ["FSP", 7, 12, 5, 3], ["FSP", 7, 16, 6, 3], ["RE", 7, [0, 4, 8, 12, 16, 1, 5, 9, 13, 17, 2, 6, 10, 14, 18, 3, 7, 11, 15, 19]], ["CA", 2, 7, 14], ["CHR", 1, "shared", [2]], ["CA", 2, 3, 15], ["CHR", 0, "shared", [3]], ["CA", 1, 4, 15], ["FU", 9, [0, 1, 2, 3, 4]], ["AN", 9, 0, 5], ["FU", 9, [1, 2, 3, 4, 5]], ["AN", 9, 1, 4], ["FU", 9, [2, 3, 4, 5, 6]], ["AN", 9, 2, 6], ["FU", 3, [0, 1, 2]], ["SP", 3, 0, 16, [4], 1], ["AN", 3, 1, 2], ["FFSP", 3, 0, [6, 5, 4, 3, 2], 1, 1], ["AN", 3, 1, 6], ["FU", 1, [0, 1, 2, 3, 4]], ["SP", 1, 0, 64, [1], 1], ["AN", 1, 1, 2], ["FFSP", 1, 0, [6, 5, 4, 3, 2], 1, 1], ["AN", 1, 1, 6], ["PR", 4, 0, "auto_unroll_max_step$16"]]]], "r": [[0.000301349, 0.000301065, 0.000301259], 0, 23.4621, 1681221154], "v": "v0.6"}
{"i": [["[\"fused_conv1x1_bn_relu_no_share_input\", 1, 56, 56, 64, 4, 64]", "cuda -keys=cuda,gpu -max_num_threads=1024 -model=unknown -thread_warp_size=32", [-1, 16, 64, 49152, 2147483647, 1024, 8, 32], "", 0, []], [[], [["CI", 6], ["CI", 4], ["SP", 2, 0, 1, [1, 1, 1, 1], 1], ["SP", 2, 5, 64, [2, 8, 2, 1], 1], ["SP", 2, 10, 56, [1, 1, 2, 1], 1], ["SP", 2, 15, 56, [1, 14, 1, 1], 1], ["SP", 2, 20, 4, [1, 4, 1, 1], 1], ["SP", 2, 25, 64, [1, 2], 1], ["RE", 2, [0, 5, 10, 15, 20, 1, 6, 11, 16, 21, 2, 7, 12, 17, 22, 25, 26, 3, 8, 13, 18, 23, 27, 4, 9, 14, 19, 24]], ["FSP", 7, 0, 2, 3], ["FSP", 7, 4, 3, 3], ["FSP", 7, 8, 4, 3], ["FSP", 7, 12, 5, 3], ["FSP", 7, 16, 6, 3], ["RE", 7, [0, 4, 8, 12, 16, 1, 5, 9, 13, 17, 2, 6, 10, 14, 18, 3, 7, 11, 15, 19]], ["CA", 2, 7, 14], ["CHR", 1, "shared", [2]], ["CA", 2, 3, 15], ["CHR", 0, "shared", [3]], ["CA", 1, 4, 15], ["FU", 9, [0, 1, 2, 3, 4]], ["AN", 9, 0, 5], ["FU", 9, [1, 2, 3, 4, 5]], ["AN", 9, 1, 4], ["FU", 9, [2, 3, 4, 5, 6]], ["AN", 9, 2, 6], ["FU", 3, [0, 1, 2]], ["SP", 3, 0, 4, [1], 1], ["AN", 3, 1, 2], ["FFSP", 3, 0, [6, 5, 4, 3, 2], 1, 1], ["AN", 3, 1, 6], ["FU", 1, [0, 1, 2, 3, 4]], ["SP", 1, 0, 56, [1], 1], ["AN", 1, 1, 2], ["FFSP", 1, 0, [6, 5, 4, 3, 2], 1, 1], ["AN", 1, 1, 6], ["PR", 4, 0, "auto_unroll_max_step$16"]]]], "r": [[0.000113216, 0.000113154, 0.000113084], 0, 24.8081, 1681221155], "v": "v0.6"}
{"i": [["[\"fused_conv1x1_bn_relu_no_share_input\", 1, 56, 56, 64, 4, 64]", "cuda -keys=cuda,gpu -max_num_threads=1024 -model=unknown -thread_warp_size=32", [-1, 16, 64, 49152, 2147483647, 1024, 8, 32], "", 0, []], [[], [["CI", 6], ["CI", 4], ["SP", 2, 0, 1, [1, 1, 1, 1], 1], ["SP", 2, 5, 64, [1, 16, 2, 1], 1], ["SP", 2, 10, 56, [4, 1, 7, 1], 1], ["SP", 2, 15, 56, [1, 2, 1, 1], 1], ["SP", 2, 20, 4, [1, 1, 4, 1], 1], ["SP", 2, 25, 64, [1, 1], 1], ["RE", 2, [0, 5, 10, 15, 20, 1, 6, 11, 16, 21, 2, 7, 12, 17, 22, 25, 26, 3, 8, 13, 18, 23, 27, 4, 9, 14, 19, 24]], ["FSP", 7, 0, 2, 3], ["FSP", 7, 4, 3, 3], ["FSP", 7, 8, 4, 3], ["FSP", 7, 12, 5, 3], ["FSP", 7, 16, 6, 3], ["RE", 7, [0, 4, 8, 12, 16, 1, 5, 9, 13, 17, 2, 6, 10, 14, 18, 3, 7, 11, 15, 19]], ["CA", 2, 7, 14], ["CHR", 1, "shared", [2]], ["CA", 2, 3, 15], ["CHR", 0, "shared", [3]], ["CA", 1, 4, 15], ["FU", 9, [0, 1, 2, 3, 4]], ["AN", 9, 0, 5], ["FU", 9, [1, 2, 3, 4, 5]], ["AN", 9, 1, 4], ["FU", 9, [2, 3, 4, 5, 6]], ["AN", 9, 2, 6], ["FU", 3, [0, 1, 2]], ["SP", 3, 0, 8, [8], 1], ["AN", 3, 1, 2], ["FFSP", 3, 0, [6, 5, 4, 3, 2], 1, 1], ["AN", 3, 1, 6], ["FU", 1, [0, 1, 2, 3, 4]], ["SP", 1, 0, 56, [1], 1], ["AN", 1, 1, 2], ["FFSP", 1, 0, [6, 5, 4, 3, 2], 1, 1], ["AN", 1, 1, 6], ["PR", 4, 0, "auto_unroll_max_step$16"]]]], "r": [[0.000418079, 0.000418392, 0.000418365], 0, 26.0555, 1681221156], "v": "v0.6"}
{"i": [["[\"fused_conv1x1_bn_relu_no_share_input\", 1, 56, 56, 64, 4, 64]", "cuda -keys=cuda,gpu -max_num_threads=1024 -model=unknown -thread_warp_size=32", [-1, 16, 64, 49152, 2147483647, 1024, 8, 32], "", 0, []], [[], [["CI", 6], ["CI", 4], ["SP", 2, 0, 1, [1, 1, 1, 1], 1], ["SP", 2, 5, 64, [1, 8, 1, 1], 1], ["SP", 2, 10, 56, [1, 1, 1, 1], 1], ["SP", 2, 15, 56, [1, 2, 7, 2], 1], ["SP", 2, 20, 4, [2, 1, 1, 1], 1], ["SP", 2, 25, 64, [8, 1], 1], ["RE", 2, [0, 5, 10, 15, 20, 1, 6, 11, 16, 21, 2, 7, 12, 17, 22, 25, 26, 3, 8, 13, 18, 23, 27, 4, 9, 14, 19, 24]], ["FSP", 7, 0, 2, 3], ["FSP", 7, 4, 3, 3], ["FSP", 7, 8, 4, 3], ["FSP", 7, 12, 5, 3], ["FSP", 7, 16, 6, 3], ["RE", 7, [0, 4, 8, 12, 16, 1, 5, 9, 13, 17, 2, 6, 10, 14, 18, 3, 7, 11, 15, 19]], ["CA", 2, 7, 14], ["CHR", 1, "shared", [2]], ["CA", 2, 3, 15], ["CHR", 0, "shared", [3]], ["CA", 1, 4, 15], ["FU", 9, [0, 1, 2, 3, 4]], ["AN", 9, 0, 5], ["FU", 9, [1, 2, 3, 4, 5]], ["AN", 9, 1, 4], ["FU", 9, [2, 3, 4, 5, 6]], ["AN", 9, 2, 6], ["FU", 3, [0, 1, 2]], ["SP", 3, 0, 8, [2], 1], ["AN", 3, 1, 2], ["FFSP", 3, 0, [6, 5, 4, 3, 2], 1, 1], ["AN", 3, 1, 6], ["FU", 1, [0, 1, 2, 3, 4]], ["SP", 1, 0, 112, [1], 1], ["AN", 1, 1, 2], ["FFSP", 1, 0, [6, 5, 4, 3, 2], 1, 1], ["AN", 1, 1, 6], ["PR", 4, 0, "auto_unroll_max_step$0"]]]], "r": [[0.000120099, 0.000120122, 0.000120095], 0, 30.1382, 1681221161], "v": "v0.6"}
{"i": [["[\"fused_conv1x1_bn_relu_no_share_input\", 1, 56, 56, 64, 4, 64]", "cuda -keys=cuda,gpu -max_num_threads=1024 -model=unknown -thread_warp_size=32", [-1, 16, 64, 49152, 2147483647, 1024, 8, 32], "", 0, []], [[], [["CI", 6], ["CI", 4], ["SP", 2, 0, 1, [1, 1, 1, 1], 1], ["SP", 2, 5, 64, [2, 8, 2, 1], 1], ["SP", 2, 10, 56, [1, 1, 2, 1], 1], ["SP", 2, 15, 56, [1, 2, 1, 7], 1], ["SP", 2, 20, 4, [1, 4, 1, 1], 1], ["SP", 2, 25, 64, [1, 2], 1], ["RE", 2, [0, 5, 10, 15, 20, 1, 6, 11, 16, 21, 2, 7, 12, 17, 22, 25, 26, 3, 8, 13, 18, 23, 27, 4, 9, 14, 19, 24]], ["FSP", 7, 0, 2, 3], ["FSP", 7, 4, 3, 3], ["FSP", 7, 8, 4, 3], ["FSP", 7, 12, 5, 3], ["FSP", 7, 16, 6, 3], ["RE", 7, [0, 4, 8, 12, 16, 1, 5, 9, 13, 17, 2, 6, 10, 14, 18, 3, 7, 11, 15, 19]], ["CA", 2, 7, 14], ["CHR", 1, "shared", [2]], ["CA", 2, 3, 15], ["CHR", 0, "shared", [3]], ["CA", 1, 4, 15], ["FU", 9, [0, 1, 2, 3, 4]], ["AN", 9, 0, 5], ["FU", 9, [1, 2, 3, 4, 5]], ["AN", 9, 1, 4], ["FU", 9, [2, 3, 4, 5, 6]], ["AN", 9, 2, 6], ["FU", 3, [0, 1, 2]], ["SP", 3, 0, 4, [4], 1], ["AN", 3, 1, 2], ["FFSP", 3, 0, [6, 5, 4, 3, 2], 1, 1], ["AN", 3, 1, 6], ["FU", 1, [0, 1, 2, 3, 4]], ["SP", 1, 0, 56, [1], 1], ["AN", 1, 1, 2], ["FFSP", 1, 0, [6, 5, 4, 3, 2], 1, 1], ["AN", 1, 1, 6], ["PR", 4, 0, "auto_unroll_max_step$0"]]]], "r": [[0.000127174, 0.000127095, 0.000126565], 0, 32.7462, 1681221163], "v": "v0.6"}
{"i": [["[\"fused_conv1x1_bn_relu_no_share_input\", 1, 56, 56, 64, 4, 64]", "cuda -keys=cuda,gpu -max_num_threads=1024 -model=unknown -thread_warp_size=32", [-1, 16, 64, 49152, 2147483647, 1024, 8, 32], "", 0, []], [[], [["CI", 6], ["CI", 4], ["SP", 2, 0, 1, [1, 1, 1, 1], 1], ["SP", 2, 5, 64, [1, 2, 8, 1], 1], ["SP", 2, 10, 56, [4, 1, 2, 1], 1], ["SP", 2, 15, 56, [1, 4, 1, 1], 1], ["SP", 2, 20, 4, [1, 2, 1, 2], 1], ["SP", 2, 25, 64, [1, 2], 1], ["RE", 2, [0, 5, 10, 15, 20, 1, 6, 11, 16, 21, 2, 7, 12, 17, 22, 25, 26, 3, 8, 13, 18, 23, 27, 4, 9, 14, 19, 24]], ["FSP", 7, 0, 2, 3], ["FSP", 7, 4, 3, 3], ["FSP", 7, 8, 4, 3], ["FSP", 7, 12, 5, 3], ["FSP", 7, 16, 6, 3], ["RE", 7, [0, 4, 8, 12, 16, 1, 5, 9, 13, 17, 2, 6, 10, 14, 18, 3, 7, 11, 15, 19]], ["CA", 2, 7, 14], ["CHR", 1, "shared", [2]], ["CA", 2, 3, 15], ["CHR", 0, "shared", [3]], ["CA", 1, 4, 15], ["FU", 9, [0, 1, 2, 3, 4]], ["AN", 9, 0, 5], ["FU", 9, [1, 2, 3, 4, 5]], ["AN", 9, 1, 4], ["FU", 9, [2, 3, 4, 5, 6]], ["AN", 9, 2, 6], ["FU", 3, [0, 1, 2]], ["SP", 3, 0, 64, [1], 1], ["AN", 3, 1, 2], ["FFSP", 3, 0, [6, 5, 4, 3, 2], 1, 1], ["AN", 3, 1, 6], ["FU", 1, [0, 1, 2, 3, 4]], ["SP", 1, 0, 32, [1], 1], ["AN", 1, 1, 2], ["FFSP", 1, 0, [6, 5, 4, 3, 2], 1, 1], ["AN", 1, 1, 6], ["PR", 4, 0, "auto_unroll_max_step$16"]]]], "r": [[0.000129637, 0.000129591, 0.000129374], 0, 31.6363, 1681221162], "v": "v0.6"}
{"i": [["[\"fused_conv1x1_bn_relu_no_share_input\", 1, 56, 56, 64, 4, 64]", "cuda -keys=cuda,gpu -max_num_threads=1024 -model=unknown -thread_warp_size=32", [-1, 16, 64, 49152, 2147483647, 1024, 8, 32], "", 0, []], [[], [["CI", 6], ["CI", 4], ["SP", 2, 0, 1, [1, 1, 1, 1], 1], ["SP", 2, 5, 64, [1, 2, 2, 1], 1], ["SP", 2, 10, 56, [1, 2, 1, 1], 1], ["SP", 2, 15, 56, [1, 2, 1, 4], 1], ["SP", 2, 20, 4, [1, 2, 2, 1], 1], ["SP", 2, 25, 64, [2, 1], 1], ["RE", 2, [0, 5, 10, 15, 20, 1, 6, 11, 16, 21, 2, 7, 12, 17, 22, 25, 26, 3, 8, 13, 18, 23, 27, 4, 9, 14, 19, 24]], ["FSP", 7, 0, 2, 3], ["FSP", 7, 4, 3, 3], ["FSP", 7, 8, 4, 3], ["FSP", 7, 12, 5, 3], ["FSP", 7, 16, 6, 3], ["RE", 7, [0, 4, 8, 12, 16, 1, 5, 9, 13, 17, 2, 6, 10, 14, 18, 3, 7, 11, 15, 19]], ["CA", 2, 7, 14], ["CHR", 1, "shared", [2]], ["CA", 2, 3, 15], ["CHR", 0, "shared", [3]], ["CA", 1, 4, 15], ["FU", 9, [0, 1, 2, 3, 4]], ["AN", 9, 0, 5], ["FU", 9, [1, 2, 3, 4, 5]], ["AN", 9, 1, 4], ["FU", 9, [2, 3, 4, 5, 6]], ["AN", 9, 2, 6], ["FU", 3, [0, 1, 2]], ["SP", 3, 0, 8, [1], 1], ["AN", 3, 1, 2], ["FFSP", 3, 0, [6, 5, 4, 3, 2], 1, 1], ["AN", 3, 1, 6], ["FU", 1, [0, 1, 2, 3, 4]], ["SP", 1, 0, 4, [2], 1], ["AN", 1, 1, 2], ["FFSP", 1, 0, [6, 5, 4, 3, 2], 1, 1], ["AN", 1, 1, 6], ["PR", 4, 0, "auto_unroll_max_step$512"]]]], "r": [[9.96629e-05, 9.94342e-05, 9.96812e-05], 0, 35.2943, 1681221166], "v": "v0.6"}
{"i": [["[\"fused_conv1x1_bn_relu_no_share_input\", 1, 56, 56, 64, 4, 64]", "cuda -keys=cuda,gpu -max_num_threads=1024 -model=unknown -thread_warp_size=32", [-1, 16, 64, 49152, 2147483647, 1024, 8, 32], "", 0, []], [[], [["CI", 6], ["CI", 4], ["SP", 2, 0, 1, [1, 1, 1, 1], 1], ["SP", 2, 5, 64, [1, 4, 4, 2], 1], ["SP", 2, 10, 56, [8, 1, 1, 1], 1], ["SP", 2, 15, 56, [1, 7, 2, 1], 1], ["SP", 2, 20, 4, [1, 1, 1, 4], 1], ["SP", 2, 25, 64, [2, 1], 1], ["RE", 2, [0, 5, 10, 15, 20, 1, 6, 11, 16, 21, 2, 7, 12, 17, 22, 25, 26, 3, 8, 13, 18, 23, 27, 4, 9, 14, 19, 24]], ["FSP", 7, 0, 2, 3], ["FSP", 7, 4, 3, 3], ["FSP", 7, 8, 4, 3], ["FSP", 7, 12, 5, 3], ["FSP", 7, 16, 6, 3], ["RE", 7, [0, 4, 8, 12, 16, 1, 5, 9, 13, 17, 2, 6, 10, 14, 18, 3, 7, 11, 15, 19]], ["CA", 2, 7, 14], ["CHR", 1, "shared", [2]], ["CA", 2, 3, 15], ["CHR", 0, "shared", [3]], ["CA", 1, 4, 15], ["FU", 9, [0, 1, 2, 3, 4]], ["AN", 9, 0, 5], ["FU", 9, [1, 2, 3, 4, 5]], ["AN", 9, 1, 4], ["FU", 9, [2, 3, 4, 5, 6]], ["AN", 9, 2, 6], ["FU", 3, [0, 1, 2]], ["SP", 3, 0, 64, [16], 1], ["AN", 3, 1, 2], ["FFSP", 3, 0, [6, 5, 4, 3, 2], 1, 1], ["AN", 3, 1, 6], ["FU", 1, [0, 1, 2, 3, 4]], ["SP", 1, 0, 32, [1], 1], ["AN", 1, 1, 2], ["FFSP", 1, 0, [6, 5, 4, 3, 2], 1, 1], ["AN", 1, 1, 6], ["PR", 4, 0, "auto_unroll_max_step$1024"]]]], "r": [[0.00110339, 0.00110184, 0.00110308], 0, 31.4789, 1681221158], "v": "v0.6"}
{"i": [["[\"fused_conv1x1_bn_relu_no_share_input\", 1, 56, 56, 64, 4, 64]", "cuda -keys=cuda,gpu -max_num_threads=1024 -model=unknown -thread_warp_size=32", [-1, 16, 64, 49152, 2147483647, 1024, 8, 32], "", 0, []], [[], [["CI", 6], ["CI", 4], ["SP", 2, 0, 1, [1, 1, 1, 1], 1], ["SP", 2, 5, 64, [1, 1, 1, 2], 1], ["SP", 2, 10, 56, [1, 7, 1, 4], 1], ["SP", 2, 15, 56, [1, 14, 4, 1], 1], ["SP", 2, 20, 4, [1, 2, 1, 2], 1], ["SP", 2, 25, 64, [2, 1], 1], ["RE", 2, [0, 5, 10, 15, 20, 1, 6, 11, 16, 21, 2, 7, 12, 17, 22, 25, 26, 3, 8, 13, 18, 23, 27, 4, 9, 14, 19, 24]], ["FSP", 7, 0, 2, 3], ["FSP", 7, 4, 3, 3], ["FSP", 7, 8, 4, 3], ["FSP", 7, 12, 5, 3], ["FSP", 7, 16, 6, 3], ["RE", 7, [0, 4, 8, 12, 16, 1, 5, 9, 13, 17, 2, 6, 10, 14, 18, 3, 7, 11, 15, 19]], ["CA", 2, 7, 14], ["CHR", 1, "shared", [2]], ["CA", 2, 3, 15], ["CHR", 0, "shared", [3]], ["CA", 1, 4, 15], ["FU", 9, [0, 1, 2, 3, 4]], ["AN", 9, 0, 5], ["FU", 9, [1, 2, 3, 4, 5]], ["AN", 9, 1, 4], ["FU", 9, [2, 3, 4, 5, 6]], ["AN", 9, 2, 6], ["FU", 3, [0, 1, 2]], ["SP", 3, 0, 4, [1], 1], ["AN", 3, 1, 2], ["FFSP", 3, 0, [6, 5, 4, 3, 2], 1, 1], ["AN", 3, 1, 6], ["FU", 1, [0, 1, 2, 3, 4]], ["SP", 1, 0, 32, [1], 1], ["AN", 1, 1, 2], ["FFSP", 1, 0, [6, 5, 4, 3, 2], 1, 1], ["AN", 1, 1, 6], ["PR", 4, 0, "auto_unroll_max_step$1024"]]]], "r": [[0.00014266, 0.00014261, 0.000142672], 0, 43.5851, 1681221174], "v": "v0.6"}
{"i": [["[\"fused_conv1x1_bn_relu_no_share_input\", 1, 56, 56, 64, 4, 64]", "cuda -keys=cuda,gpu -max_num_threads=1024 -model=unknown -thread_warp_size=32", [-1, 16, 64, 49152, 2147483647, 1024, 8, 32], "", 0, []], [[], [["CI", 6], ["CI", 4], ["SP", 2, 0, 1, [1, 1, 1, 1], 1], ["SP", 2, 5, 64, [1, 1, 2, 1], 1], ["SP", 2, 10, 56, [1, 4, 1, 1], 1], ["SP", 2, 15, 56, [2, 14, 1, 2], 1], ["SP", 2, 20, 4, [1, 1, 1, 4], 1], ["SP", 2, 25, 64, [1, 4], 1], ["RE", 2, [0, 5, 10, 15, 20, 1, 6, 11, 16, 21, 2, 7, 12, 17, 22, 25, 26, 3, 8, 13, 18, 23, 27, 4, 9, 14, 19, 24]], ["FSP", 7, 0, 2, 3], ["FSP", 7, 4, 3, 3], ["FSP", 7, 8, 4, 3], ["FSP", 7, 12, 5, 3], ["FSP", 7, 16, 6, 3], ["RE", 7, [0, 4, 8, 12, 16, 1, 5, 9, 13, 17, 2, 6, 10, 14, 18, 3, 7, 11, 15, 19]], ["CA", 2, 7, 14], ["CHR", 1, "shared", [2]], ["CA", 2, 3, 15], ["CHR", 0, "shared", [3]], ["CA", 1, 4, 15], ["FU", 9, [0, 1, 2, 3, 4]], ["AN", 9, 0, 5], ["FU", 9, [1, 2, 3, 4, 5]], ["AN", 9, 1, 4], ["FU", 9, [2, 3, 4, 5, 6]], ["AN", 9, 2, 6], ["FU", 3, [0, 1, 2]], ["SP", 3, 0, 64, [1], 1], ["AN", 3, 1, 2], ["FFSP", 3, 0, [6, 5, 4, 3, 2], 1, 1], ["AN", 3, 1, 6], ["FU", 1, [0, 1, 2, 3, 4]], ["SP", 1, 0, 32, [2], 1], ["AN", 1, 1, 2], ["FFSP", 1, 0, [6, 5, 4, 3, 2], 1, 1], ["AN", 1, 1, 6], ["PR", 4, 0, "auto_unroll_max_step$1024"]]]], "r": [[6.87569e-05, 6.87642e-05, 6.86551e-05], 0, 44.7522, 1681221176], "v": "v0.6"}
{"i": [["[\"fused_conv1x1_bn_relu_no_share_input\", 1, 56, 56, 64, 4, 64]", "cuda -keys=cuda,gpu -max_num_threads=1024 -model=unknown -thread_warp_size=32", [-1, 16, 64, 49152, 2147483647, 1024, 8, 32], "", 0, []], [[], [["CI", 6], ["CI", 4], ["SP", 2, 0, 1, [1, 1, 1, 1], 1], ["SP", 2, 5, 64, [2, 16, 1, 1], 1], ["SP", 2, 10, 56, [4, 1, 2, 1], 1], ["SP", 2, 15, 56, [1, 1, 2, 1], 1], ["SP", 2, 20, 4, [1, 2, 1, 2], 1], ["SP", 2, 25, 64, [2, 4], 1], ["RE", 2, [0, 5, 10, 15, 20, 1, 6, 11, 16, 21, 2, 7, 12, 17, 22, 25, 26, 3, 8, 13, 18, 23, 27, 4, 9, 14, 19, 24]], ["FSP", 7, 0, 2, 3], ["FSP", 7, 4, 3, 3], ["FSP", 7, 8, 4, 3], ["FSP", 7, 12, 5, 3], ["FSP", 7, 16, 6, 3], ["RE", 7, [0, 4, 8, 12, 16, 1, 5, 9, 13, 17, 2, 6, 10, 14, 18, 3, 7, 11, 15, 19]], ["CA", 2, 7, 14], ["CHR", 1, "shared", [2]], ["CA", 2, 3, 15], ["CHR", 0, "shared", [3]], ["CA", 1, 4, 15], ["FU", 9, [0, 1, 2, 3, 4]], ["AN", 9, 0, 5], ["FU", 9, [1, 2, 3, 4, 5]], ["AN", 9, 1, 4], ["FU", 9, [2, 3, 4, 5, 6]], ["AN", 9, 2, 6], ["FU", 3, [0, 1, 2]], ["SP", 3, 0, 16, [1], 1], ["AN", 3, 1, 2], ["FFSP", 3, 0, [6, 5, 4, 3, 2], 1, 1], ["AN", 3, 1, 6], ["FU", 1, [0, 1, 2, 3, 4]], ["SP", 1, 0, 32, [1], 1], ["AN", 1, 1, 2], ["FFSP", 1, 0, [6, 5, 4, 3, 2], 1, 1], ["AN", 1, 1, 6], ["PR", 4, 0, "auto_unroll_max_step$1024"]]]], "r": [[0.000138338, 0.000138375, 0.000138354], 0, 43.1758, 1681221173], "v": "v0.6"}
{"i": [["[\"fused_conv1x1_bn_relu_no_share_input\", 1, 56, 56, 64, 4, 64]", "cuda -keys=cuda,gpu -max_num_threads=1024 -model=unknown -thread_warp_size=32", [-1, 16, 64, 49152, 2147483647, 1024, 8, 32], "", 0, []], [[], [["CI", 6], ["CI", 4], ["SP", 2, 0, 1, [1, 1, 1, 1], 1], ["SP", 2, 5, 64, [2, 1, 1, 2], 1], ["SP", 2, 10, 56, [1, 14, 1, 2], 1], ["SP", 2, 15, 56, [1, 4, 1, 2], 1], ["SP", 2, 20, 4, [2, 1, 1, 1], 1], ["SP", 2, 25, 64, [2, 4], 1], ["RE", 2, [0, 5, 10, 15, 20, 1, 6, 11, 16, 21, 2, 7, 12, 17, 22, 25, 26, 3, 8, 13, 18, 23, 27, 4, 9, 14, 19, 24]], ["FSP", 7, 0, 2, 3], ["FSP", 7, 4, 3, 3], ["FSP", 7, 8, 4, 3], ["FSP", 7, 12, 5, 3], ["FSP", 7, 16, 6, 3], ["RE", 7, [0, 4, 8, 12, 16, 1, 5, 9, 13, 17, 2, 6, 10, 14, 18, 3, 7, 11, 15, 19]], ["CA", 2, 7, 14], ["CHR", 1, "shared", [2]], ["CA", 2, 3, 15], ["CHR", 0, "shared", [3]], ["CA", 1, 4, 15], ["FU", 9, [0, 1, 2, 3, 4]], ["AN", 9, 0, 5], ["FU", 9, [1, 2, 3, 4, 5]], ["AN", 9, 1, 4], ["FU", 9, [2, 3, 4, 5, 6]], ["AN", 9, 2, 6], ["FU", 3, [0, 1, 2]], ["SP", 3, 0, 16, [4], 1], ["AN", 3, 1, 2], ["FFSP", 3, 0, [6, 5, 4, 3, 2], 1, 1], ["AN", 3, 1, 6], ["FU", 1, [0, 1, 2, 3, 4]], ["SP", 1, 0, 64, [1], 1], ["AN", 1, 1, 2], ["FFSP", 1, 0, [6, 5, 4, 3, 2], 1, 1], ["AN", 1, 1, 6], ["PR", 4, 0, "auto_unroll_max_step$16"]]]], "r": [[0.000191221, 0.000191264, 0.000191206], 0, 40.5958, 1681221171], "v": "v0.6"}
{"i": [["[\"fused_conv1x1_bn_relu_no_share_input\", 1, 56, 56, 64, 4, 64]", "cuda -keys=cuda,gpu -max_num_threads=1024 -model=unknown -thread_warp_size=32", [-1, 16, 64, 49152, 2147483647, 1024, 8, 32], "", 0, []], [[], [["CI", 6], ["CI", 4], ["SP", 2, 0, 1, [1, 1, 1, 1], 1], ["SP", 2, 5, 64, [8, 2, 1, 4], 1], ["SP", 2, 10, 56, [1, 8, 1, 1], 1], ["SP", 2, 15, 56, [1, 1, 2, 1], 1], ["SP", 2, 20, 4, [1, 1, 4, 1], 1], ["SP", 2, 25, 64, [1, 1], 1], ["RE", 2, [0, 5, 10, 15, 20, 1, 6, 11, 16, 21, 2, 7, 12, 17, 22, 25, 26, 3, 8, 13, 18, 23, 27, 4, 9, 14, 19, 24]], ["FSP", 7, 0, 2, 3], ["FSP", 7, 4, 3, 3], ["FSP", 7, 8, 4, 3], ["FSP", 7, 12, 5, 3], ["FSP", 7, 16, 6, 3], ["RE", 7, [0, 4, 8, 12, 16, 1, 5, 9, 13, 17, 2, 6, 10, 14, 18, 3, 7, 11, 15, 19]], ["CA", 2, 7, 14], ["CHR", 1, "shared", [2]], ["CA", 2, 3, 15], ["CHR", 0, "shared", [3]], ["CA", 1, 4, 15], ["FU", 9, [0, 1, 2, 3, 4]], ["AN", 9, 0, 5], ["FU", 9, [1, 2, 3, 4, 5]], ["AN", 9, 1, 4], ["FU", 9, [2, 3, 4, 5, 6]], ["AN", 9, 2, 6], ["FU", 3, [0, 1, 2]], ["SP", 3, 0, 8, [1], 1], ["AN", 3, 1, 2], ["FFSP", 3, 0, [6, 5, 4, 3, 2], 1, 1], ["AN", 3, 1, 6], ["FU", 1, [0, 1, 2, 3, 4]], ["SP", 1, 0, 56, [1], 1], ["AN", 1, 1, 2], ["FFSP", 1, 0, [6, 5, 4, 3, 2], 1, 1], ["AN", 1, 1, 6], ["PR", 4, 0, "auto_unroll_max_step$1024"]]]], "r": [[0.00189868, 0.00190289, 0.00190027], 0, 39.9842, 1681221170], "v": "v0.6"}
{"i": [["[\"fused_conv1x1_bn_relu_no_share_input\", 1, 56, 56, 64, 4, 64]", "cuda -keys=cuda,gpu -max_num_threads=1024 -model=unknown -thread_warp_size=32", [-1, 16, 64, 49152, 2147483647, 1024, 8, 32], "", 0, []], [[], [["CI", 6], ["CI", 4], ["SP", 2, 0, 1, [1, 1, 1, 1], 1], ["SP", 2, 5, 64, [1, 8, 1, 4], 1], ["SP", 2, 10, 56, [1, 2, 14, 1], 1], ["SP", 2, 15, 56, [1, 1, 1, 2], 1], ["SP", 2, 20, 4, [2, 2, 1, 1], 1], ["SP", 2, 25, 64, [1, 2], 1], ["RE", 2, [0, 5, 10, 15, 20, 1, 6, 11, 16, 21, 2, 7, 12, 17, 22, 25, 26, 3, 8, 13, 18, 23, 27, 4, 9, 14, 19, 24]], ["FSP", 7, 0, 2, 3], ["FSP", 7, 4, 3, 3], ["FSP", 7, 8, 4, 3], ["FSP", 7, 12, 5, 3], ["FSP", 7, 16, 6, 3], ["RE", 7, [0, 4, 8, 12, 16, 1, 5, 9, 13, 17, 2, 6, 10, 14, 18, 3, 7, 11, 15, 19]], ["CA", 2, 7, 14], ["CHR", 1, "shared", [2]], ["CA", 2, 3, 15], ["CHR", 0, "shared", [3]], ["CA", 1, 4, 15], ["FU", 9, [0, 1, 2, 3, 4]], ["AN", 9, 0, 5], ["FU", 9, [1, 2, 3, 4, 5]], ["AN", 9, 1, 4], ["FU", 9, [2, 3, 4, 5, 6]], ["AN", 9, 2, 6], ["FU", 3, [0, 1, 2]], ["SP", 3, 0, 8, [4], 1], ["AN", 3, 1, 2], ["FFSP", 3, 0, [6, 5, 4, 3, 2], 1, 1], ["AN", 3, 1, 6], ["FU", 1, [0, 1, 2, 3, 4]], ["SP", 1, 0, 32, [1], 1], ["AN", 1, 1, 2], ["FFSP", 1, 0, [6, 5, 4, 3, 2], 1, 1], ["AN", 1, 1, 6], ["PR", 4, 0, "auto_unroll_max_step$16"]]]], "r": [[0.000647065, 0.000646661, 0.000645991], 0, 34.3265, 1681221165], "v": "v0.6"}
{"i": [["[\"fused_conv1x1_bn_relu_no_share_input\", 1, 56, 56, 64, 4, 64]", "cuda -keys=cuda,gpu -max_num_threads=1024 -model=unknown -thread_warp_size=32", [-1, 16, 64, 49152, 2147483647, 1024, 8, 32], "", 0, []], [[], [["CI", 6], ["CI", 4], ["SP", 2, 0, 1, [1, 1, 1, 1], 1], ["SP", 2, 5, 64, [1, 2, 1, 2], 1], ["SP", 2, 10, 56, [1, 1, 2, 7], 1], ["SP", 2, 15, 56, [1, 56, 1, 1], 1], ["SP", 2, 20, 4, [1, 2, 1, 1], 1], ["SP", 2, 25, 64, [1, 1], 1], ["RE", 2, [0, 5, 10, 15, 20, 1, 6, 11, 16, 21, 2, 7, 12, 17, 22, 25, 26, 3, 8, 13, 18, 23, 27, 4, 9, 14, 19, 24]], ["FSP", 7, 0, 2, 3], ["FSP", 7, 4, 3, 3], ["FSP", 7, 8, 4, 3], ["FSP", 7, 12, 5, 3], ["FSP", 7, 16, 6, 3], ["RE", 7, [0, 4, 8, 12, 16, 1, 5, 9, 13, 17, 2, 6, 10, 14, 18, 3, 7, 11, 15, 19]], ["CA", 2, 7, 14], ["CHR", 1, "shared", [2]], ["CA", 2, 3, 15], ["CHR", 0, "shared", [3]], ["CA", 1, 4, 15], ["FU", 9, [0, 1, 2, 3, 4]], ["AN", 9, 0, 5], ["FU", 9, [1, 2, 3, 4, 5]], ["AN", 9, 1, 4], ["FU", 9, [2, 3, 4, 5, 6]], ["AN", 9, 2, 6], ["FU", 3, [0, 1, 2]], ["SP", 3, 0, 2, [1], 1], ["AN", 3, 1, 2], ["FFSP", 3, 0, [6, 5, 4, 3, 2], 1, 1], ["AN", 3, 1, 6], ["FU", 1, [0, 1, 2, 3, 4]], ["SP", 1, 0, 28, [28], 1], ["AN", 1, 1, 2], ["FFSP", 1, 0, [6, 5, 4, 3, 2], 1, 1], ["AN", 1, 1, 6], ["PR", 4, 0, "auto_unroll_max_step$0"]]]], "r": [[0.000731755, 0.000731539, 0.000731746], 0, 37.8342, 1681221169], "v": "v0.6"}
{"i": [["[\"fused_conv1x1_bn_relu_no_share_input\", 1, 56, 56, 64, 4, 64]", "cuda -keys=cuda,gpu -max_num_threads=1024 -model=unknown -thread_warp_size=32", [-1, 16, 64, 49152, 2147483647, 1024, 8, 32], "", 0, []], [[], [["CI", 6], ["CI", 4], ["SP", 2, 0, 1, [1, 1, 1, 1], 1], ["SP", 2, 5, 64, [4, 2, 1, 1], 1], ["SP", 2, 10, 56, [1, 56, 1, 1], 1], ["SP", 2, 15, 56, [1, 2, 2, 1], 1], ["SP", 2, 20, 4, [2, 1, 1, 2], 1], ["SP", 2, 25, 64, [2, 1], 1], ["RE", 2, [0, 5, 10, 15, 20, 1, 6, 11, 16, 21, 2, 7, 12, 17, 22, 25, 26, 3, 8, 13, 18, 23, 27, 4, 9, 14, 19, 24]], ["FSP", 7, 0, 2, 3], ["FSP", 7, 4, 3, 3], ["FSP", 7, 8, 4, 3], ["FSP", 7, 12, 5, 3], ["FSP", 7, 16, 6, 3], ["RE", 7, [0, 4, 8, 12, 16, 1, 5, 9, 13, 17, 2, 6, 10, 14, 18, 3, 7, 11, 15, 19]], ["CA", 2, 7, 14], ["CHR", 1, "shared", [2]], ["CA", 2, 3, 15], ["CHR", 0, "shared", [3]], ["CA", 1, 4, 15], ["FU", 9, [0, 1, 2, 3, 4]], ["AN", 9, 0, 5], ["FU", 9, [1, 2, 3, 4, 5]], ["AN", 9, 1, 4], ["FU", 9, [2, 3, 4, 5, 6]], ["AN", 9, 2, 6], ["FU", 3, [0, 1, 2]], ["SP", 3, 0, 4, [2], 1], ["AN", 3, 1, 2], ["FFSP", 3, 0, [6, 5, 4, 3, 2], 1, 1], ["AN", 3, 1, 6], ["FU", 1, [0, 1, 2, 3, 4]], ["SP", 1, 0, 4, [1], 1], ["AN", 1, 1, 2], ["FFSP", 1, 0, [6, 5, 4, 3, 2], 1, 1], ["AN", 1, 1, 6], ["PR", 4, 0, "auto_unroll_max_step$512"]]]], "r": [[0.000151424, 0.000151718, 0.000151512], 0, 48.7314, 1681221179], "v": "v0.6"}
{"i": [["[\"fused_conv1x1_bn_relu_no_share_input\", 1, 56, 56, 64, 4, 64]", "cuda -keys=cuda,gpu -max_num_threads=1024 -model=unknown -thread_warp_size=32", [-1, 16, 64, 49152, 2147483647, 1024, 8, 32], "", 0, []], [[], [["CI", 6], ["CI", 4], ["SP", 2, 0, 1, [1, 1, 1, 1], 1], ["SP", 2, 5, 64, [8, 4, 1, 1], 1], ["SP", 2, 10, 56, [1, 1, 2, 1], 1], ["SP", 2, 15, 56, [1, 4, 1, 14], 1], ["SP", 2, 20, 4, [1, 2, 1, 2], 1], ["SP", 2, 25, 64, [1, 1], 1], ["RE", 2, [0, 5, 10, 15, 20, 1, 6, 11, 16, 21, 2, 7, 12, 17, 22, 25, 26, 3, 8, 13, 18, 23, 27, 4, 9, 14, 19, 24]], ["FSP", 7, 0, 2, 3], ["FSP", 7, 4, 3, 3], ["FSP", 7, 8, 4, 3], ["FSP", 7, 12, 5, 3], ["FSP", 7, 16, 6, 3], ["RE", 7, [0, 4, 8, 12, 16, 1, 5, 9, 13, 17, 2, 6, 10, 14, 18, 3, 7, 11, 15, 19]], ["CA", 2, 7, 14], ["CHR", 1, "shared", [2]], ["CA", 2, 3, 15], ["CHR", 0, "shared", [3]], ["CA", 1, 4, 15], ["FU", 9, [0, 1, 2, 3, 4]], ["AN", 9, 0, 5], ["FU", 9, [1, 2, 3, 4, 5]], ["AN", 9, 1, 4], ["FU", 9, [2, 3, 4, 5, 6]], ["AN", 9, 2, 6], ["FU", 3, [0, 1, 2]], ["SP", 3, 0, 2, [1], 1], ["AN", 3, 1, 2], ["FFSP", 3, 0, [6, 5, 4, 3, 2], 1, 1], ["AN", 3, 1, 6], ["FU", 1, [0, 1, 2, 3, 4]], ["SP", 1, 0, 28, [4], 1], ["AN", 1, 1, 2], ["FFSP", 1, 0, [6, 5, 4, 3, 2], 1, 1], ["AN", 1, 1, 6], ["PR", 4, 0, "auto_unroll_max_step$0"]]]], "r": [[0.000978472, 0.000978392, 0.000977724], 0, 51.8238, 1681221182], "v": "v0.6"}
{"i": [["[\"fused_conv1x1_bn_relu_no_share_input\", 1, 56, 56, 64, 4, 64]", "cuda -keys=cuda,gpu -max_num_threads=1024 -model=unknown -thread_warp_size=32", [-1, 16, 64, 49152, 2147483647, 1024, 8, 32], "", 0, []], [[], [["CI", 6], ["CI", 4], ["SP", 2, 0, 1, [1, 1, 1, 1], 1], ["SP", 2, 5, 64, [1, 2, 4, 1], 1], ["SP", 2, 10, 56, [1, 4, 1, 1], 1], ["SP", 2, 15, 56, [1, 8, 1, 1], 1], ["SP", 2, 20, 4, [1, 2, 2, 1], 1], ["SP", 2, 25, 64, [2, 1], 1], ["RE", 2, [0, 5, 10, 15, 20, 1, 6, 11, 16, 21, 2, 7, 12, 17, 22, 25, 26, 3, 8, 13, 18, 23, 27, 4, 9, 14, 19, 24]], ["FSP", 7, 0, 2, 3], ["FSP", 7, 4, 3, 3], ["FSP", 7, 8, 4, 3], ["FSP", 7, 12, 5, 3], ["FSP", 7, 16, 6, 3], ["RE", 7, [0, 4, 8, 12, 16, 1, 5, 9, 13, 17, 2, 6, 10, 14, 18, 3, 7, 11, 15, 19]], ["CA", 2, 7, 14], ["CHR", 1, "shared", [2]], ["CA", 2, 3, 15], ["CHR", 0, "shared", [3]], ["CA", 1, 4, 15], ["FU", 9, [0, 1, 2, 3, 4]], ["AN", 9, 0, 5], ["FU", 9, [1, 2, 3, 4, 5]], ["AN", 9, 1, 4], ["FU", 9, [2, 3, 4, 5, 6]], ["AN", 9, 2, 6], ["FU", 3, [0, 1, 2]], ["SP", 3, 0, 8, [1], 1], ["AN", 3, 1, 2], ["FFSP", 3, 0, [6, 5, 4, 3, 2], 1, 1], ["AN", 3, 1, 6], ["FU", 1, [0, 1, 2, 3, 4]], ["SP", 1, 0, 4, [1], 1], ["AN", 1, 1, 2], ["FFSP", 1, 0, [6, 5, 4, 3, 2], 1, 1], ["AN", 1, 1, 6], ["PR", 4, 0, "auto_unroll_max_step$512"]]]], "r": [[9.68357e-05, 9.66138e-05, 9.66157e-05], 0, 47.2731, 1681221178], "v": "v0.6"}
{"i": [["[\"fused_conv1x1_bn_relu_no_share_input\", 1, 56, 56, 64, 4, 64]", "cuda -keys=cuda,gpu -max_num_threads=1024 -model=unknown -thread_warp_size=32", [-1, 16, 64, 49152, 2147483647, 1024, 8, 32], "", 0, []], [[], [["CI", 6], ["CI", 4], ["SP", 2, 0, 1, [1, 1, 1, 1], 1], ["SP", 2, 5, 64, [1, 8, 2, 4], 1], ["SP", 2, 10, 56, [7, 1, 2, 1], 1], ["SP", 2, 15, 56, [1, 2, 1, 1], 1], ["SP", 2, 20, 4, [2, 1, 2, 1], 1], ["SP", 2, 25, 64, [1, 1], 1], ["RE", 2, [0, 5, 10, 15, 20, 1, 6, 11, 16, 21, 2, 7, 12, 17, 22, 25, 26, 3, 8, 13, 18, 23, 27, 4, 9, 14, 19, 24]], ["FSP", 7, 0, 2, 3], ["FSP", 7, 4, 3, 3], ["FSP", 7, 8, 4, 3], ["FSP", 7, 12, 5, 3], ["FSP", 7, 16, 6, 3], ["RE", 7, [0, 4, 8, 12, 16, 1, 5, 9, 13, 17, 2, 6, 10, 14, 18, 3, 7, 11, 15, 19]], ["CA", 2, 7, 14], ["CHR", 1, "shared", [2]], ["CA", 2, 3, 15], ["CHR", 0, "shared", [3]], ["CA", 1, 4, 15], ["FU", 9, [0, 1, 2, 3, 4]], ["AN", 9, 0, 5], ["FU", 9, [1, 2, 3, 4, 5]], ["AN", 9, 1, 4], ["FU", 9, [2, 3, 4, 5, 6]], ["AN", 9, 2, 6], ["FU", 3, [0, 1, 2]], ["SP", 3, 0, 16, [4], 1], ["AN", 3, 1, 2], ["FFSP", 3, 0, [6, 5, 4, 3, 2], 1, 1], ["AN", 3, 1, 6], ["FU", 1, [0, 1, 2, 3, 4]], ["SP", 1, 0, 16, [1], 1], ["AN", 1, 1, 2], ["FFSP", 1, 0, [6, 5, 4, 3, 2], 1, 1], ["AN", 1, 1, 6], ["PR", 4, 0, "auto_unroll_max_step$16"]]]], "r": [[0.00162913, 0.00163042, 0.00163045], 0, 50.5284, 1681221181], "v": "v0.6"}
{"i": [["[\"fused_conv1x1_bn_relu_no_share_input\", 1, 56, 56, 64, 4, 64]", "cuda -keys=cuda,gpu -max_num_threads=1024 -model=unknown -thread_warp_size=32", [-1, 16, 64, 49152, 2147483647, 1024, 8, 32], "", 0, []], [[], [["CI", 6], ["CI", 4], ["SP", 2, 0, 1, [1, 1, 1, 1], 1], ["SP", 2, 5, 64, [4, 2, 1, 1], 1], ["SP", 2, 10, 56, [1, 8, 7, 1], 1], ["SP", 2, 15, 56, [1, 2, 1, 2], 1], ["SP", 2, 20, 4, [2, 1, 1, 2], 1], ["SP", 2, 25, 64, [2, 1], 1], ["RE", 2, [0, 5, 10, 15, 20, 1, 6, 11, 16, 21, 2, 7, 12, 17, 22, 25, 26, 3, 8, 13, 18, 23, 27, 4, 9, 14, 19, 24]], ["FSP", 7, 0, 2, 3], ["FSP", 7, 4, 3, 3], ["FSP", 7, 8, 4, 3], ["FSP", 7, 12, 5, 3], ["FSP", 7, 16, 6, 3], ["RE", 7, [0, 4, 8, 12, 16, 1, 5, 9, 13, 17, 2, 6, 10, 14, 18, 3, 7, 11, 15, 19]], ["CA", 2, 7, 14], ["CHR", 1, "shared", [2]], ["CA", 2, 3, 15], ["CHR", 0, "shared", [3]], ["CA", 1, 4, 15], ["FU", 9, [0, 1, 2, 3, 4]], ["AN", 9, 0, 5], ["FU", 9, [1, 2, 3, 4, 5]], ["AN", 9, 1, 4], ["FU", 9, [2, 3, 4, 5, 6]], ["AN", 9, 2, 6], ["FU", 3, [0, 1, 2]], ["SP", 3, 0, 4, [1], 1], ["AN", 3, 1, 2], ["FFSP", 3, 0, [6, 5, 4, 3, 2], 1, 1], ["AN", 3, 1, 6], ["FU", 1, [0, 1, 2, 3, 4]], ["SP", 1, 0, 4, [1], 1], ["AN", 1, 1, 2], ["FFSP", 1, 0, [6, 5, 4, 3, 2], 1, 1], ["AN", 1, 1, 6], ["PR", 4, 0, "auto_unroll_max_step$0"]]]], "r": [[0.000213057, 0.000212941, 0.000212938], 0, 46.2187, 1681221177], "v": "v0.6"}
{"i": [["[\"fused_conv1x1_bn_relu_no_share_input\", 1, 56, 56, 64, 4, 64]", "cuda -keys=cuda,gpu -max_num_threads=1024 -model=unknown -thread_warp_size=32", [-1, 16, 64, 49152, 2147483647, 1024, 8, 32], "", 0, []], [[], [["CI", 6], ["CI", 4], ["SP", 2, 0, 1, [1, 1, 1, 1], 1], ["SP", 2, 5, 64, [1, 8, 1, 1], 1], ["SP", 2, 10, 56, [2, 14, 1, 2], 1], ["SP", 2, 15, 56, [1, 1, 2, 7], 1], ["SP", 2, 20, 4, [2, 1, 1, 2], 1], ["SP", 2, 25, 64, [1, 1], 1], ["RE", 2, [0, 5, 10, 15, 20, 1, 6, 11, 16, 21, 2, 7, 12, 17, 22, 25, 26, 3, 8, 13, 18, 23, 27, 4, 9, 14, 19, 24]], ["FSP", 7, 0, 2, 3], ["FSP", 7, 4, 3, 3], ["FSP", 7, 8, 4, 3], ["FSP", 7, 12, 5, 3], ["FSP", 7, 16, 6, 3], ["RE", 7, [0, 4, 8, 12, 16, 1, 5, 9, 13, 17, 2, 6, 10, 14, 18, 3, 7, 11, 15, 19]], ["CA", 2, 7, 14], ["CHR", 1, "shared", [2]], ["CA", 2, 3, 15], ["CHR", 0, "shared", [3]], ["CA", 1, 4, 15], ["FU", 9, [0, 1, 2, 3, 4]], ["AN", 9, 0, 5], ["FU", 9, [1, 2, 3, 4, 5]], ["AN", 9, 1, 4], ["FU", 9, [2, 3, 4, 5, 6]], ["AN", 9, 2, 6], ["FU", 3, [0, 1, 2]], ["SP", 3, 0, 2, [2], 1], ["AN", 3, 1, 2], ["FFSP", 3, 0, [6, 5, 4, 3, 2], 1, 1], ["AN", 3, 1, 6], ["FU", 1, [0, 1, 2, 3, 4]], ["SP", 1, 0, 28, [2], 1], ["AN", 1, 1, 2], ["FFSP", 1, 0, [6, 5, 4, 3, 2], 1, 1], ["AN", 1, 1, 6], ["PR", 4, 0, "auto_unroll_max_step$512"]]]], "r": [[0.000538989, 0.000530942, 0.000530268], 0, 53.2682, 1681221184], "v": "v0.6"}
{"i": [["[\"fused_conv1x1_bn_relu_no_share_input\", 1, 56, 56, 64, 4, 64]", "cuda -keys=cuda,gpu -max_num_threads=1024 -model=unknown -thread_warp_size=32", [-1, 16, 64, 49152, 2147483647, 1024, 8, 32], "", 0, []], [[], [["CI", 6], ["CI", 4], ["SP", 2, 0, 1, [1, 1, 1, 1], 1], ["SP", 2, 5, 64, [1, 4, 1, 2], 1], ["SP", 2, 10, 56, [2, 7, 2, 1], 1], ["SP", 2, 15, 56, [1, 8, 1, 1], 1], ["SP", 2, 20, 4, [1, 1, 1, 4], 1], ["SP", 2, 25, 64, [1, 4], 1], ["RE", 2, [0, 5, 10, 15, 20, 1, 6, 11, 16, 21, 2, 7, 12, 17, 22, 25, 26, 3, 8, 13, 18, 23, 27, 4, 9, 14, 19, 24]], ["FSP", 7, 0, 2, 3], ["FSP", 7, 4, 3, 3], ["FSP", 7, 8, 4, 3], ["FSP", 7, 12, 5, 3], ["FSP", 7, 16, 6, 3], ["RE", 7, [0, 4, 8, 12, 16, 1, 5, 9, 13, 17, 2, 6, 10, 14, 18, 3, 7, 11, 15, 19]], ["CA", 2, 7, 14], ["CHR", 1, "shared", [2]], ["CA", 2, 3, 15], ["CHR", 0, "shared", [3]], ["CA", 1, 4, 15], ["FU", 9, [0, 1, 2, 3, 4]], ["AN", 9, 0, 5], ["FU", 9, [1, 2, 3, 4, 5]], ["AN", 9, 1, 4], ["FU", 9, [2, 3, 4, 5, 6]], ["AN", 9, 2, 6], ["FU", 3, [0, 1, 2]], ["SP", 3, 0, 16, [1], 1], ["AN", 3, 1, 2], ["FFSP", 3, 0, [6, 5, 4, 3, 2], 1, 1], ["AN", 3, 1, 6], ["FU", 1, [0, 1, 2, 3, 4]], ["SP", 1, 0, 8, [1], 1], ["AN", 1, 1, 2], ["FFSP", 1, 0, [6, 5, 4, 3, 2], 1, 1], ["AN", 1, 1, 6], ["PR", 4, 0, "auto_unroll_max_step$512"]]]], "r": [[9.04505e-05, 9.05186e-05, 9.05334e-05], 0, 55.5874, 1681221186], "v": "v0.6"}
{"i": [["[\"fused_conv1x1_bn_relu_no_share_input\", 1, 56, 56, 64, 4, 64]", "cuda -keys=cuda,gpu -max_num_threads=1024 -model=unknown -thread_warp_size=32", [-1, 16, 64, 49152, 2147483647, 1024, 8, 32], "", 0, []], [[], [["CI", 6], ["CI", 4], ["SP", 2, 0, 1, [1, 1, 1, 1], 1], ["SP", 2, 5, 64, [1, 4, 4, 2], 1], ["SP", 2, 10, 56, [2, 1, 4, 1], 1], ["SP", 2, 15, 56, [1, 1, 14, 1], 1], ["SP", 2, 20, 4, [1, 1, 1, 4], 1], ["SP", 2, 25, 64, [1, 2], 1], ["RE", 2, [0, 5, 10, 15, 20, 1, 6, 11, 16, 21, 2, 7, 12, 17, 22, 25, 26, 3, 8, 13, 18, 23, 27, 4, 9, 14, 19, 24]], ["FSP", 7, 0, 2, 3], ["FSP", 7, 4, 3, 3], ["FSP", 7, 8, 4, 3], ["FSP", 7, 12, 5, 3], ["FSP", 7, 16, 6, 3], ["RE", 7, [0, 4, 8, 12, 16, 1, 5, 9, 13, 17, 2, 6, 10, 14, 18, 3, 7, 11, 15, 19]], ["CA", 2, 7, 14], ["CHR", 1, "shared", [2]], ["CA", 2, 3, 15], ["CHR", 0, "shared", [3]], ["CA", 1, 4, 15], ["FU", 9, [0, 1, 2, 3, 4]], ["AN", 9, 0, 5], ["FU", 9, [1, 2, 3, 4, 5]], ["AN", 9, 1, 4], ["FU", 9, [2, 3, 4, 5, 6]], ["AN", 9, 2, 6], ["FU", 3, [0, 1, 2]], ["SP", 3, 0, 64, [1], 1], ["AN", 3, 1, 2], ["FFSP", 3, 0, [6, 5, 4, 3, 2], 1, 1], ["AN", 3, 1, 6], ["FU", 1, [0, 1, 2, 3, 4]], ["SP", 1, 0, 32, [1], 1], ["AN", 1, 1, 2], ["FFSP", 1, 0, [6, 5, 4, 3, 2], 1, 1], ["AN", 1, 1, 6], ["PR", 4, 0, "auto_unroll_max_step$16"]]]], "r": [[0.0125598, 0.0125619, 0.0125632], 0, 54.8082, 1681221185], "v": "v0.6"}
{"i": [["[\"fused_conv1x1_bn_relu_no_share_input\", 1, 56, 56, 64, 4, 64]", "cuda -keys=cuda,gpu -max_num_threads=1024 -model=unknown -thread_warp_size=32", [-1, 16, 64, 49152, 2147483647, 1024, 8, 32], "", 0, []], [[], [["CI", 6], ["CI", 4], ["SP", 2, 0, 1, [1, 1, 1, 1], 1], ["SP", 2, 5, 64, [1, 2, 1, 2], 1], ["SP", 2, 10, 56, [1, 7, 1, 1], 1], ["SP", 2, 15, 56, [2, 1, 1, 4], 1], ["SP", 2, 20, 4, [1, 4, 1, 1], 1], ["SP", 2, 25, 64, [1, 4], 1], ["RE", 2, [0, 5, 10, 15, 20, 1, 6, 11, 16, 21, 2, 7, 12, 17, 22, 25, 26, 3, 8, 13, 18, 23, 27, 4, 9, 14, 19, 24]], ["FSP", 7, 0, 2, 3], ["FSP", 7, 4, 3, 3], ["FSP", 7, 8, 4, 3], ["FSP", 7, 12, 5, 3], ["FSP", 7, 16, 6, 3], ["RE", 7, [0, 4, 8, 12, 16, 1, 5, 9, 13, 17, 2, 6, 10, 14, 18, 3, 7, 11, 15, 19]], ["CA", 2, 7, 14], ["CHR", 1, "shared", [2]], ["CA", 2, 3, 15], ["CHR", 0, "shared", [3]], ["CA", 1, 4, 15], ["FU", 9, [0, 1, 2, 3, 4]], ["AN", 9, 0, 5], ["FU", 9, [1, 2, 3, 4, 5]], ["AN", 9, 1, 4], ["FU", 9, [2, 3, 4, 5, 6]], ["AN", 9, 2, 6], ["FU", 3, [0, 1, 2]], ["SP", 3, 0, 16, [4], 1], ["AN", 3, 1, 2], ["FFSP", 3, 0, [6, 5, 4, 3, 2], 1, 1], ["AN", 3, 1, 6], ["FU", 1, [0, 1, 2, 3, 4]], ["SP", 1, 0, 64, [1], 1], ["AN", 1, 1, 2], ["FFSP", 1, 0, [6, 5, 4, 3, 2], 1, 1], ["AN", 1, 1, 6], ["PR", 4, 0, "auto_unroll_max_step$1024"]]]], "r": [[7.29934e-05, 7.30398e-05, 7.30203e-05], 0, 56.0005, 1681221188], "v": "v0.6"}
{"i": [["[\"fused_conv1x1_bn_relu_no_share_input\", 1, 56, 56, 64, 4, 64]", "cuda -keys=cuda,gpu -max_num_threads=1024 -model=unknown -thread_warp_size=32", [-1, 16, 64, 49152, 2147483647, 1024, 8, 32], "", 0, []], [[], [["CI", 6], ["CI", 4], ["SP", 2, 0, 1, [1, 1, 1, 1], 1], ["SP", 2, 5, 64, [1, 2, 1, 8], 1], ["SP", 2, 10, 56, [1, 1, 1, 1], 1], ["SP", 2, 15, 56, [1, 14, 1, 4], 1], ["SP", 2, 20, 4, [1, 2, 2, 1], 1], ["SP", 2, 25, 64, [2, 1], 1], ["RE", 2, [0, 5, 10, 15, 20, 1, 6, 11, 16, 21, 2, 7, 12, 17, 22, 25, 26, 3, 8, 13, 18, 23, 27, 4, 9, 14, 19, 24]], ["FSP", 7, 0, 2, 3], ["FSP", 7, 4, 3, 3], ["FSP", 7, 8, 4, 3], ["FSP", 7, 12, 5, 3], ["FSP", 7, 16, 6, 3], ["RE", 7, [0, 4, 8, 12, 16, 1, 5, 9, 13, 17, 2, 6, 10, 14, 18, 3, 7, 11, 15, 19]], ["CA", 2, 7, 14], ["CHR", 1, "shared", [2]], ["CA", 2, 3, 15], ["CHR", 0, "shared", [3]], ["CA", 1, 4, 15], ["FU", 9, [0, 1, 2, 3, 4]], ["AN", 9, 0, 5], ["FU", 9, [1, 2, 3, 4, 5]], ["AN", 9, 1, 4], ["FU", 9, [2, 3, 4, 5, 6]], ["AN", 9, 2, 6], ["FU", 3, [0, 1, 2]], ["SP", 3, 0, 64, [1], 1], ["AN", 3, 1, 2], ["FFSP", 3, 0, [6, 5, 4, 3, 2], 1, 1], ["AN", 3, 1, 6], ["FU", 1, [0, 1, 2, 3, 4]], ["SP", 1, 0, 32, [1], 1], ["AN", 1, 1, 2], ["FFSP", 1, 0, [6, 5, 4, 3, 2], 1, 1], ["AN", 1, 1, 6], ["PR", 4, 0, "auto_unroll_max_step$512"]]]], "r": [[0.000114096, 0.000114157, 0.000114243], 0, 55.8948, 1681221189], "v": "v0.6"}
{"i": [["[\"fused_conv1x1_bn_relu_no_share_input\", 1, 56, 56, 64, 4, 64]", "cuda -keys=cuda,gpu -max_num_threads=1024 -model=unknown -thread_warp_size=32", [-1, 16, 64, 49152, 2147483647, 1024, 8, 32], "", 0, []], [[], [["CI", 6], ["CI", 4], ["SP", 2, 0, 1, [1, 1, 1, 1], 1], ["SP", 2, 5, 64, [2, 2, 1, 1], 1], ["SP", 2, 10, 56, [1, 2, 1, 2], 1], ["SP", 2, 15, 56, [1, 14, 1, 1], 1], ["SP", 2, 20, 4, [1, 1, 1, 1], 1], ["SP", 2, 25, 64, [2, 8], 1], ["RE", 2, [0, 5, 10, 15, 20, 1, 6, 11, 16, 21, 2, 7, 12, 17, 22, 25, 26, 3, 8, 13, 18, 23, 27, 4, 9, 14, 19, 24]], ["FSP", 7, 0, 2, 3], ["FSP", 7, 4, 3, 3], ["FSP", 7, 8, 4, 3], ["FSP", 7, 12, 5, 3], ["FSP", 7, 16, 6, 3], ["RE", 7, [0, 4, 8, 12, 16, 1, 5, 9, 13, 17, 2, 6, 10, 14, 18, 3, 7, 11, 15, 19]], ["CA", 2, 7, 14], ["CHR", 1, "shared", [2]], ["CA", 2, 3, 15], ["CHR", 0, "shared", [3]], ["CA", 1, 4, 15], ["FU", 9, [0, 1, 2, 3, 4]], ["AN", 9, 0, 5], ["FU", 9, [1, 2, 3, 4, 5]], ["AN", 9, 1, 4], ["FU", 9, [2, 3, 4, 5, 6]], ["AN", 9, 2, 6], ["FU", 3, [0, 1, 2]], ["SP", 3, 0, 16, [1], 1], ["AN", 3, 1, 2], ["FFSP", 3, 0, [6, 5, 4, 3, 2], 1, 1], ["AN", 3, 1, 6], ["FU", 1, [0, 1, 2, 3, 4]], ["SP", 1, 0, 32, [1], 1], ["AN", 1, 1, 2], ["FFSP", 1, 0, [6, 5, 4, 3, 2], 1, 1], ["AN", 1, 1, 6], ["PR", 4, 0, "auto_unroll_max_step$0"]]]], "r": [[0.000196486, 0.000196339, 0.000196419], 0, 55.8071, 1681221190], "v": "v0.6"}
{"i": [["[\"fused_conv1x1_bn_relu_no_share_input\", 1, 56, 56, 64, 4, 64]", "cuda -keys=cuda,gpu -max_num_threads=1024 -model=unknown -thread_warp_size=32", [-1, 16, 64, 49152, 2147483647, 1024, 8, 32], "", 0, []], [[], [["CI", 6], ["CI", 4], ["SP", 2, 0, 1, [1, 1, 1, 1], 1], ["SP", 2, 5, 64, [1, 2, 8, 1], 1], ["SP", 2, 10, 56, [4, 1, 1, 1], 1], ["SP", 2, 15, 56, [1, 28, 1, 1], 1], ["SP", 2, 20, 4, [1, 1, 4, 1], 1], ["SP", 2, 25, 64, [1, 2], 1], ["RE", 2, [0, 5, 10, 15, 20, 1, 6, 11, 16, 21, 2, 7, 12, 17, 22, 25, 26, 3, 8, 13, 18, 23, 27, 4, 9, 14, 19, 24]], ["FSP", 7, 0, 2, 3], ["FSP", 7, 4, 3, 3], ["FSP", 7, 8, 4, 3], ["FSP", 7, 12, 5, 3], ["FSP", 7, 16, 6, 3], ["RE", 7, [0, 4, 8, 12, 16, 1, 5, 9, 13, 17, 2, 6, 10, 14, 18, 3, 7, 11, 15, 19]], ["CA", 2, 7, 14], ["CHR", 1, "shared", [2]], ["CA", 2, 3, 15], ["CHR", 0, "shared", [3]], ["CA", 1, 4, 15], ["FU", 9, [0, 1, 2, 3, 4]], ["AN", 9, 0, 5], ["FU", 9, [1, 2, 3, 4, 5]], ["AN", 9, 1, 4], ["FU", 9, [2, 3, 4, 5, 6]], ["AN", 9, 2, 6], ["FU", 3, [0, 1, 2]], ["SP", 3, 0, 64, [32], 1], ["AN", 3, 1, 2], ["FFSP", 3, 0, [6, 5, 4, 3, 2], 1, 1], ["AN", 3, 1, 6], ["FU", 1, [0, 1, 2, 3, 4]], ["SP", 1, 0, 32, [1], 1], ["AN", 1, 1, 2], ["FFSP", 1, 0, [6, 5, 4, 3, 2], 1, 1], ["AN", 1, 1, 6], ["PR", 4, 0, "auto_unroll_max_step$16"]]]], "r": [[0.000250079, 0.000249704, 0.000249879], 0, 56.0217, 1681221192], "v": "v0.6"}
{"i": [["[\"fused_conv1x1_bn_relu_no_share_input\", 1, 56, 56, 64, 4, 64]", "cuda -keys=cuda,gpu -max_num_threads=1024 -model=unknown -thread_warp_size=32", [-1, 16, 64, 49152, 2147483647, 1024, 8, 32], "", 0, []], [[], [["CI", 6], ["CI", 4], ["SP", 2, 0, 1, [1, 1, 1, 1], 1], ["SP", 2, 5, 64, [2, 16, 1, 1], 1], ["SP", 2, 10, 56, [1, 1, 2, 1], 1], ["SP", 2, 15, 56, [1, 1, 2, 1], 1], ["SP", 2, 20, 4, [1, 1, 1, 4], 1], ["SP", 2, 25, 64, [2, 4], 1], ["RE", 2, [0, 5, 10, 15, 20, 1, 6, 11, 16, 21, 2, 7, 12, 17, 22, 25, 26, 3, 8, 13, 18, 23, 27, 4, 9, 14, 19, 24]], ["FSP", 7, 0, 2, 3], ["FSP", 7, 4, 3, 3], ["FSP", 7, 8, 4, 3], ["FSP", 7, 12, 5, 3], ["FSP", 7, 16, 6, 3], ["RE", 7, [0, 4, 8, 12, 16, 1, 5, 9, 13, 17, 2, 6, 10, 14, 18, 3, 7, 11, 15, 19]], ["CA", 2, 7, 14], ["CHR", 1, "shared", [2]], ["CA", 2, 3, 15], ["CHR", 0, "shared", [3]], ["CA", 1, 4, 15], ["FU", 9, [0, 1, 2, 3, 4]], ["AN", 9, 0, 5], ["FU", 9, [1, 2, 3, 4, 5]], ["AN", 9, 1, 4], ["FU", 9, [2, 3, 4, 5, 6]], ["AN", 9, 2, 6], ["FU", 3, [0, 1, 2]], ["SP", 3, 0, 16, [1], 1], ["AN", 3, 1, 2], ["FFSP", 3, 0, [6, 5, 4, 3, 2], 1, 1], ["AN", 3, 1, 6], ["FU", 1, [0, 1, 2, 3, 4]], ["SP", 1, 0, 32, [1], 1], ["AN", 1, 1, 2], ["FFSP", 1, 0, [6, 5, 4, 3, 2], 1, 1], ["AN", 1, 1, 6], ["PR", 4, 0, "auto_unroll_max_step$1024"]]]], "r": [[0.000111676, 0.00011168, 0.00011165], 0, 56.3712, 1681221193], "v": "v0.6"}
{"i": [["[\"fused_conv1x1_bn_relu_no_share_input\", 1, 56, 56, 64, 4, 64]", "cuda -keys=cuda,gpu -max_num_threads=1024 -model=unknown -thread_warp_size=32", [-1, 16, 64, 49152, 2147483647, 1024, 8, 32], "", 0, []], [[], [["CI", 6], ["CI", 4], ["SP", 2, 0, 1, [1, 1, 1, 1], 1], ["SP", 2, 5, 64, [2, 8, 1, 1], 1], ["SP", 2, 10, 56, [1, 1, 1, 1], 1], ["SP", 2, 15, 56, [2, 7, 2, 1], 1], ["SP", 2, 20, 4, [2, 1, 2, 1], 1], ["SP", 2, 25, 64, [8, 1], 1], ["RE", 2, [0, 5, 10, 15, 20, 1, 6, 11, 16, 21, 2, 7, 12, 17, 22, 25, 26, 3, 8, 13, 18, 23, 27, 4, 9, 14, 19, 24]], ["FSP", 7, 0, 2, 3], ["FSP", 7, 4, 3, 3], ["FSP", 7, 8, 4, 3], ["FSP", 7, 12, 5, 3], ["FSP", 7, 16, 6, 3], ["RE", 7, [0, 4, 8, 12, 16, 1, 5, 9, 13, 17, 2, 6, 10, 14, 18, 3, 7, 11, 15, 19]], ["CA", 2, 7, 14], ["CHR", 1, "shared", [2]], ["CA", 2, 3, 15], ["CHR", 0, "shared", [3]], ["CA", 1, 4, 15], ["FU", 9, [0, 1, 2, 3, 4]], ["AN", 9, 0, 5], ["FU", 9, [1, 2, 3, 4, 5]], ["AN", 9, 1, 4], ["FU", 9, [2, 3, 4, 5, 6]], ["AN", 9, 2, 6], ["FU", 3, [0, 1, 2]], ["SP", 3, 0, 64, [8], 1], ["AN", 3, 1, 2], ["FFSP", 3, 0, [6, 5, 4, 3, 2], 1, 1], ["AN", 3, 1, 6], ["FU", 1, [0, 1, 2, 3, 4]], ["SP", 1, 0, 32, [1], 1], ["AN", 1, 1, 2], ["FFSP", 1, 0, [6, 5, 4, 3, 2], 1, 1], ["AN", 1, 1, 6], ["PR", 4, 0, "auto_unroll_max_step$0"]]]], "r": [[9.13315e-05, 9.14051e-05, 9.13826e-05], 0, 55.6607, 1681221194], "v": "v0.6"}
