python/models/resnext/kernel_configs/resnext_imagenet_50_fused_conv1x1_1_14_14_1024_16_64.log
{"i": [["[\"fused_conv1x1\", 1, 14, 14, 1024, 16, 64]", "cuda -keys=cuda,gpu -max_num_threads=1024 -model=unknown -thread_warp_size=32", [-1, 16, 64, 49152, 2147483647, 1024, 8, 32], "", 0, []], [[], [["CHW", 2, "local"], ["SP", 2, 0, 1, [1, 1, 1, 1], 1], ["SP", 2, 5, 64, [1, 4, 2, 1], 1], ["SP", 2, 10, 14, [1, 2, 1, 1], 1], ["SP", 2, 15, 14, [1, 1, 1, 1], 1], ["SP", 2, 20, 16, [2, 4, 2, 1], 1], ["SP", 2, 25, 1024, [4, 2], 1], ["RE", 2, [0, 5, 10, 15, 20, 1, 6, 11, 16, 21, 2, 7, 12, 17, 22, 25, 26, 3, 8, 13, 18, 23, 27, 4, 9, 14, 19, 24]], ["FSP", 3, 0, 1, 3], ["FSP", 3, 4, 2, 3], ["FSP", 3, 8, 3, 3], ["FSP", 3, 12, 4, 3], ["FSP", 3, 16, 5, 3], ["RE", 3, [0, 4, 8, 12, 16, 1, 5, 9, 13, 17, 2, 6, 10, 14, 18, 3, 7, 11, 15, 19]], ["CA", 2, 3, 14], ["CHR", 1, "shared", [2]], ["CA", 2, 3, 15], ["CHR", 0, "shared", [3]], ["CA", 1, 4, 15], ["FU", 5, [0, 1, 2, 3, 4]], ["AN", 5, 0, 5], ["FU", 5, [1, 2, 3, 4, 5]], ["AN", 5, 1, 4], ["FU", 5, [2, 3, 4, 5, 6]], ["AN", 5, 2, 6], ["FU", 3, [0, 1, 2]], ["SP", 3, 0, 32, [1], 1], ["AN", 3, 1, 2], ["FFSP", 3, 0, [5, 4, 3, 2, 1], 1, 1], ["AN", 3, 1, 6], ["FU", 1, [0, 1, 2, 3]], ["SP", 1, 0, 8, [1], 1], ["AN", 1, 1, 2], ["FFSP", 1, 0, [5, 4, 3, 2, 1], 1, 1], ["AN", 1, 1, 6], ["PR", 4, 0, "auto_unroll_max_step$1024"]]]], "r": [[0.000170702, 0.000170815, 0.000170606, 0.000171111, 0.000171021, 0.00017101, 0.000170968, 0.000170976, 0.000170969, 0.000170941], 0, 50.262, 1649549130], "v": "v0.6"}
{"i": [["[\"fused_conv1x1\", 1, 14, 14, 1024, 16, 64]", "cuda -keys=cuda,gpu -max_num_threads=1024 -model=unknown -thread_warp_size=32", [-1, 16, 64, 49152, 2147483647, 1024, 8, 32], "", 0, []], [[], [["CHW", 2, "local"], ["SP", 2, 0, 1, [1, 1, 1, 1], 1], ["SP", 2, 5, 64, [4, 16, 1, 1], 1], ["SP", 2, 10, 14, [2, 1, 1, 7], 1], ["SP", 2, 15, 14, [1, 14, 1, 1], 1], ["SP", 2, 20, 16, [1, 1, 1, 2], 1], ["SP", 2, 25, 1024, [1, 4], 1], ["RE", 2, [0, 5, 10, 15, 20, 1, 6, 11, 16, 21, 2, 7, 12, 17, 22, 25, 26, 3, 8, 13, 18, 23, 27, 4, 9, 14, 19, 24]], ["FSP", 3, 0, 1, 3], ["FSP", 3, 4, 2, 3], ["FSP", 3, 8, 3, 3], ["FSP", 3, 12, 4, 3], ["FSP", 3, 16, 5, 3], ["RE", 3, [0, 4, 8, 12, 16, 1, 5, 9, 13, 17, 2, 6, 10, 14, 18, 3, 7, 11, 15, 19]], ["CA", 2, 3, 14], ["CHR", 1, "shared", [2]], ["CA", 2, 3, 15], ["CHR", 0, "shared", [3]], ["CA", 1, 4, 15], ["FU", 5, [0, 1, 2, 3, 4]], ["AN", 5, 0, 5], ["FU", 5, [1, 2, 3, 4, 5]], ["AN", 5, 1, 4], ["FU", 5, [2, 3, 4, 5, 6]], ["AN", 5, 2, 6], ["FU", 3, [0, 1, 2]], ["SP", 3, 0, 8, [1], 1], ["AN", 3, 1, 2], ["FFSP", 3, 0, [5, 4, 3, 2, 1], 1, 1], ["AN", 3, 1, 6], ["FU", 1, [0, 1, 2, 3]], ["SP", 1, 0, 28, [1], 1], ["AN", 1, 1, 2], ["FFSP", 1, 0, [5, 4, 3, 2, 1], 1, 1], ["AN", 1, 1, 6], ["PR", 4, 0, "auto_unroll_max_step$16"]]]], "r": [[0.00051888, 0.000519736, 0.000519662, 0.000520131, 0.000520459, 0.000521251, 0.000521286, 0.000521451, 0.000521707, 0.000521943], 0, 6.22088, 1649549086], "v": "v0.6"}
{"i": [["[\"fused_conv1x1\", 1, 14, 14, 1024, 16, 64]", "cuda -keys=cuda,gpu -max_num_threads=1024 -model=unknown -thread_warp_size=32", [-1, 16, 64, 49152, 2147483647, 1024, 8, 32], "", 0, []], [[], [["CHW", 2, "local"], ["SP", 2, 0, 1, [1, 1, 1, 1], 1], ["SP", 2, 5, 64, [4, 8, 2, 1], 1], ["SP", 2, 10, 14, [1, 1, 1, 14], 1], ["SP", 2, 15, 14, [1, 2, 1, 7], 1], ["SP", 2, 20, 16, [2, 2, 1, 4], 1], ["SP", 2, 25, 1024, [2, 2], 1], ["RE", 2, [0, 5, 10, 15, 20, 1, 6, 11, 16, 21, 2, 7, 12, 17, 22, 25, 26, 3, 8, 13, 18, 23, 27, 4, 9, 14, 19, 24]], ["FSP", 3, 0, 1, 3], ["FSP", 3, 4, 2, 3], ["FSP", 3, 8, 3, 3], ["FSP", 3, 12, 4, 3], ["FSP", 3, 16, 5, 3], ["RE", 3, [0, 4, 8, 12, 16, 1, 5, 9, 13, 17, 2, 6, 10, 14, 18, 3, 7, 11, 15, 19]], ["CA", 2, 3, 14], ["CHR", 1, "shared", [2]], ["CA", 2, 3, 15], ["CHR", 0, "shared", [3]], ["CA", 1, 4, 15], ["FU", 5, [0, 1, 2, 3, 4]], ["AN", 5, 0, 5], ["FU", 5, [1, 2, 3, 4, 5]], ["AN", 5, 1, 4], ["FU", 5, [2, 3, 4, 5, 6]], ["AN", 5, 2, 6], ["FU", 3, [0, 1, 2]], ["SP", 3, 0, 32, [2], 1], ["AN", 3, 1, 2], ["FFSP", 3, 0, [5, 4, 3, 2, 1], 1, 1], ["AN", 3, 1, 6], ["FU", 1, [0, 1, 2, 3]], ["SP", 1, 0, 392, [1], 1], ["AN", 1, 1, 2], ["FFSP", 1, 0, [5, 4, 3, 2, 1], 1, 1], ["AN", 1, 1, 6], ["PR", 4, 0, "auto_unroll_max_step$64"]]]], "r": [[0.0420751, 0.0420644, 0.0420231, 0.0420195, 0.0420293, 0.0419966, 0.0419912, 0.0419927, 0.0419631, 0.0419632], 0, 42.0578, 1649549120], "v": "v0.6"}
{"i": [["[\"fused_conv1x1\", 1, 14, 14, 1024, 16, 64]", "cuda -keys=cuda,gpu -max_num_threads=1024 -model=unknown -thread_warp_size=32", [-1, 16, 64, 49152, 2147483647, 1024, 8, 32], "", 0, []], [[], [["CHW", 2, "local"], ["SP", 2, 0, 1, [1, 1, 1, 1], 1], ["SP", 2, 5, 64, [1, 8, 2, 2], 1], ["SP", 2, 10, 14, [1, 2, 7, 1], 1], ["SP", 2, 15, 14, [1, 1, 1, 14], 1], ["SP", 2, 20, 16, [1, 1, 1, 16], 1], ["SP", 2, 25, 1024, [4, 2], 1], ["RE", 2, [0, 5, 10, 15, 20, 1, 6, 11, 16, 21, 2, 7, 12, 17, 22, 25, 26, 3, 8, 13, 18, 23, 27, 4, 9, 14, 19, 24]], ["FSP", 3, 0, 1, 3], ["FSP", 3, 4, 2, 3], ["FSP", 3, 8, 3, 3], ["FSP", 3, 12, 4, 3], ["FSP", 3, 16, 5, 3], ["RE", 3, [0, 4, 8, 12, 16, 1, 5, 9, 13, 17, 2, 6, 10, 14, 18, 3, 7, 11, 15, 19]], ["CA", 2, 3, 14], ["CHR", 1, "shared", [2]], ["CA", 2, 3, 15], ["CHR", 0, "shared", [3]], ["CA", 1, 4, 15], ["FU", 5, [0, 1, 2, 3, 4]], ["AN", 5, 0, 5], ["FU", 5, [1, 2, 3, 4, 5]], ["AN", 5, 1, 4], ["FU", 5, [2, 3, 4, 5, 6]], ["AN", 5, 2, 6], ["FU", 3, [0, 1, 2]], ["SP", 3, 0, 512, [1], 1], ["AN", 3, 1, 2], ["FFSP", 3, 0, [5, 4, 3, 2, 1], 1, 1], ["AN", 3, 1, 6], ["FU", 1, [0, 1, 2, 3]], ["SP", 1, 0, 112, [1], 1], ["AN", 1, 1, 2], ["FFSP", 1, 0, [5, 4, 3, 2, 1], 1, 1], ["AN", 1, 1, 6], ["PR", 4, 0, "auto_unroll_max_step$512"]]]], "r": [[0.0501169, 0.0501106, 0.0500184, 0.0500492, 0.0500213, 0.0499218, 0.0499465, 0.0499125, 0.0498762, 0.0498158], 0, 41.2333, 1649549116], "v": "v0.6"}
{"i": [["[\"fused_conv1x1\", 1, 14, 14, 1024, 16, 64]", "cuda -keys=cuda,gpu -max_num_threads=1024 -model=unknown -thread_warp_size=32", [-1, 16, 64, 49152, 2147483647, 1024, 8, 32], "", 0, []], [[], [["CHW", 2, "local"], ["SP", 2, 0, 1, [1, 1, 1, 1], 1], ["SP", 2, 5, 64, [2, 1, 32, 1], 1], ["SP", 2, 10, 14, [1, 14, 1, 1], 1], ["SP", 2, 15, 14, [2, 1, 1, 7], 1], ["SP", 2, 20, 16, [1, 4, 2, 1], 1], ["SP", 2, 25, 1024, [2, 2], 1], ["RE", 2, [0, 5, 10, 15, 20, 1, 6, 11, 16, 21, 2, 7, 12, 17, 22, 25, 26, 3, 8, 13, 18, 23, 27, 4, 9, 14, 19, 24]], ["FSP", 3, 0, 1, 3], ["FSP", 3, 4, 2, 3], ["FSP", 3, 8, 3, 3], ["FSP", 3, 12, 4, 3], ["FSP", 3, 16, 5, 3], ["RE", 3, [0, 4, 8, 12, 16, 1, 5, 9, 13, 17, 2, 6, 10, 14, 18, 3, 7, 11, 15, 19]], ["CA", 2, 3, 14], ["CHR", 1, "shared", [2]], ["CA", 2, 3, 15], ["CHR", 0, "shared", [3]], ["CA", 1, 4, 15], ["FU", 5, [0, 1, 2, 3, 4]], ["AN", 5, 0, 5], ["FU", 5, [1, 2, 3, 4, 5]], ["AN", 5, 1, 4], ["FU", 5, [2, 3, 4, 5, 6]], ["AN", 5, 2, 6], ["FU", 3, [0, 1, 2]], ["SP", 3, 0, 256, [4], 1], ["AN", 3, 1, 2], ["FFSP", 3, 0, [5, 4, 3, 2, 1], 1, 1], ["AN", 3, 1, 6], ["FU", 1, [0, 1, 2, 3]], ["SP", 1, 0, 4, [1], 1], ["AN", 1, 1, 2], ["FFSP", 1, 0, [5, 4, 3, 2, 1], 1, 1], ["AN", 1, 1, 6], ["PR", 4, 0, "auto_unroll_max_step$1024"]]]], "r": [[0.0156547, 0.0156682, 0.0156672, 0.0156685, 0.0156667, 0.0156684, 0.0156658, 0.015662, 0.0156652, 0.0156654], 0, 54.5632, 1649549133], "v": "v0.6"}
{"i": [["[\"fused_conv1x1\", 1, 14, 14, 1024, 16, 64]", "cuda -keys=cuda,gpu -max_num_threads=1024 -model=unknown -thread_warp_size=32", [-1, 16, 64, 49152, 2147483647, 1024, 8, 32], "", 0, []], [[], [["CHW", 2, "local"], ["SP", 2, 0, 1, [1, 1, 1, 1], 1], ["SP", 2, 5, 64, [2, 1, 1, 1], 1], ["SP", 2, 10, 14, [1, 7, 2, 1], 1], ["SP", 2, 15, 14, [1, 1, 1, 1], 1], ["SP", 2, 20, 16, [1, 1, 1, 2], 1], ["SP", 2, 25, 1024, [4, 2], 1], ["RE", 2, [0, 5, 10, 15, 20, 1, 6, 11, 16, 21, 2, 7, 12, 17, 22, 25, 26, 3, 8, 13, 18, 23, 27, 4, 9, 14, 19, 24]], ["FSP", 3, 0, 1, 3], ["FSP", 3, 4, 2, 3], ["FSP", 3, 8, 3, 3], ["FSP", 3, 12, 4, 3], ["FSP", 3, 16, 5, 3], ["RE", 3, [0, 4, 8, 12, 16, 1, 5, 9, 13, 17, 2, 6, 10, 14, 18, 3, 7, 11, 15, 19]], ["CA", 2, 3, 14], ["CHR", 1, "shared", [2]], ["CA", 2, 3, 15], ["CHR", 0, "shared", [3]], ["CA", 1, 4, 15], ["FU", 5, [0, 1, 2, 3, 4]], ["AN", 5, 0, 5], ["FU", 5, [1, 2, 3, 4, 5]], ["AN", 5, 1, 4], ["FU", 5, [2, 3, 4, 5, 6]], ["AN", 5, 2, 6], ["FU", 3, [0, 1, 2]], ["SP", 3, 0, 16, [1], 1], ["AN", 3, 1, 2], ["FFSP", 3, 0, [5, 4, 3, 2, 1], 1, 1], ["AN", 3, 1, 6], ["FU", 1, [0, 1, 2, 3]], ["SP", 1, 0, 16, [4], 1], ["AN", 1, 1, 2], ["FFSP", 1, 0, [5, 4, 3, 2, 1], 1, 1], ["AN", 1, 1, 6], ["PR", 4, 0, "auto_unroll_max_step$0"]]]], "r": [[0.000253847, 0.000253279, 0.000253053, 0.00025178, 0.000252233, 0.000251365, 0.000251365, 0.000250781, 0.000250692, 0.0002502], 0, 31.3202, 1649549111], "v": "v0.6"}
{"i": [["[\"fused_conv1x1\", 1, 14, 14, 1024, 16, 64]", "cuda -keys=cuda,gpu -max_num_threads=1024 -model=unknown -thread_warp_size=32", [-1, 16, 64, 49152, 2147483647, 1024, 8, 32], "", 0, []], [[], [["CHW", 2, "local"], ["SP", 2, 0, 1, [1, 1, 1, 1], 1], ["SP", 2, 5, 64, [1, 4, 4, 4], 1], ["SP", 2, 10, 14, [1, 7, 1, 1], 1], ["SP", 2, 15, 14, [1, 1, 1, 2], 1], ["SP", 2, 20, 16, [2, 4, 2, 1], 1], ["SP", 2, 25, 1024, [1, 1], 1], ["RE", 2, [0, 5, 10, 15, 20, 1, 6, 11, 16, 21, 2, 7, 12, 17, 22, 25, 26, 3, 8, 13, 18, 23, 27, 4, 9, 14, 19, 24]], ["FSP", 3, 0, 1, 3], ["FSP", 3, 4, 2, 3], ["FSP", 3, 8, 3, 3], ["FSP", 3, 12, 4, 3], ["FSP", 3, 16, 5, 3], ["RE", 3, [0, 4, 8, 12, 16, 1, 5, 9, 13, 17, 2, 6, 10, 14, 18, 3, 7, 11, 15, 19]], ["CA", 2, 3, 14], ["CHR", 1, "shared", [2]], ["CA", 2, 3, 15], ["CHR", 0, "shared", [3]], ["CA", 1, 4, 15], ["FU", 5, [0, 1, 2, 3, 4]], ["AN", 5, 0, 5], ["FU", 5, [1, 2, 3, 4, 5]], ["AN", 5, 1, 4], ["FU", 5, [2, 3, 4, 5, 6]], ["AN", 5, 2, 6], ["FU", 3, [0, 1, 2]], ["SP", 3, 0, 16, [1], 1], ["AN", 3, 1, 2], ["FFSP", 3, 0, [5, 4, 3, 2, 1], 1, 1], ["AN", 3, 1, 6], ["FU", 1, [0, 1, 2, 3]], ["SP", 1, 0, 4, [1], 1], ["AN", 1, 1, 2], ["FFSP", 1, 0, [5, 4, 3, 2, 1], 1, 1], ["AN", 1, 1, 6], ["PR", 4, 0, "auto_unroll_max_step$16"]]]], "r": [[0.000559386, 0.000559252, 0.000559561, 0.000559657, 0.000559936, 0.000560151, 0.000560436, 0.000560562, 0.000560692, 0.000560788], 0, 11.9521, 1649549091], "v": "v0.6"}
{"i": [["[\"fused_conv1x1\", 1, 14, 14, 1024, 16, 64]", "cuda -keys=cuda,gpu -max_num_threads=1024 -model=unknown -thread_warp_size=32", [-1, 16, 64, 49152, 2147483647, 1024, 8, 32], "", 0, []], [[], [["CHW", 2, "local"], ["SP", 2, 0, 1, [1, 1, 1, 1], 1], ["SP", 2, 5, 64, [2, 2, 1, 2], 1], ["SP", 2, 10, 14, [1, 1, 2, 1], 1], ["SP", 2, 15, 14, [1, 1, 1, 14], 1], ["SP", 2, 20, 16, [1, 2, 2, 4], 1], ["SP", 2, 25, 1024, [2, 16], 1], ["RE", 2, [0, 5, 10, 15, 20, 1, 6, 11, 16, 21, 2, 7, 12, 17, 22, 25, 26, 3, 8, 13, 18, 23, 27, 4, 9, 14, 19, 24]], ["FSP", 3, 0, 1, 3], ["FSP", 3, 4, 2, 3], ["FSP", 3, 8, 3, 3], ["FSP", 3, 12, 4, 3], ["FSP", 3, 16, 5, 3], ["RE", 3, [0, 4, 8, 12, 16, 1, 5, 9, 13, 17, 2, 6, 10, 14, 18, 3, 7, 11, 15, 19]], ["CA", 2, 3, 14], ["CHR", 1, "shared", [2]], ["CA", 2, 3, 15], ["CHR", 0, "shared", [3]], ["CA", 1, 4, 15], ["FU", 5, [0, 1, 2, 3, 4]], ["AN", 5, 0, 5], ["FU", 5, [1, 2, 3, 4, 5]], ["AN", 5, 1, 4], ["FU", 5, [2, 3, 4, 5, 6]], ["AN", 5, 2, 6], ["FU", 3, [0, 1, 2]], ["SP", 3, 0, 512, [1], 1], ["AN", 3, 1, 2], ["FFSP", 3, 0, [5, 4, 3, 2, 1], 1, 1], ["AN", 3, 1, 6], ["FU", 1, [0, 1, 2, 3]], ["SP", 1, 0, 128, [1], 1], ["AN", 1, 1, 2], ["FFSP", 1, 0, [5, 4, 3, 2, 1], 1, 1], ["AN", 1, 1, 6], ["PR", 4, 0, "auto_unroll_max_step$64"]]]], "r": [[0.00298311, 0.00298357, 0.00298364, 0.00298321, 0.00298373, 0.0029839, 0.00298364, 0.00298418, 0.00298458, 0.00298487], 0, 23.2481, 1649549101], "v": "v0.6"}
{"i": [["[\"fused_conv1x1\", 1, 14, 14, 1024, 16, 64]", "cuda -keys=cuda,gpu -max_num_threads=1024 -model=unknown -thread_warp_size=32", [-1, 16, 64, 49152, 2147483647, 1024, 8, 32], "", 0, []], [[], [["CHW", 2, "local"], ["SP", 2, 0, 1, [1, 1, 1, 1], 1], ["SP", 2, 5, 64, [2, 1, 1, 32], 1], ["SP", 2, 10, 14, [1, 14, 1, 1], 1], ["SP", 2, 15, 14, [2, 7, 1, 1], 1], ["SP", 2, 20, 16, [1, 4, 2, 1], 1], ["SP", 2, 25, 1024, [1, 4], 1], ["RE", 2, [0, 5, 10, 15, 20, 1, 6, 11, 16, 21, 2, 7, 12, 17, 22, 25, 26, 3, 8, 13, 18, 23, 27, 4, 9, 14, 19, 24]], ["FSP", 3, 0, 1, 3], ["FSP", 3, 4, 2, 3], ["FSP", 3, 8, 3, 3], ["FSP", 3, 12, 4, 3], ["FSP", 3, 16, 5, 3], ["RE", 3, [0, 4, 8, 12, 16, 1, 5, 9, 13, 17, 2, 6, 10, 14, 18, 3, 7, 11, 15, 19]], ["CA", 2, 3, 14], ["CHR", 1, "shared", [2]], ["CA", 2, 3, 15], ["CHR", 0, "shared", [3]], ["CA", 1, 4, 15], ["FU", 5, [0, 1, 2, 3, 4]], ["AN", 5, 0, 5], ["FU", 5, [1, 2, 3, 4, 5]], ["AN", 5, 1, 4], ["FU", 5, [2, 3, 4, 5, 6]], ["AN", 5, 2, 6], ["FU", 3, [0, 1, 2]], ["SP", 3, 0, 256, [1], 1], ["AN", 3, 1, 2], ["FFSP", 3, 0, [5, 4, 3, 2, 1], 1, 1], ["AN", 3, 1, 6], ["FU", 1, [0, 1, 2, 3]], ["SP", 1, 0, 4, [1], 1], ["AN", 1, 1, 2], ["FFSP", 1, 0, [5, 4, 3, 2, 1], 1, 1], ["AN", 1, 1, 6], ["PR", 4, 0, "auto_unroll_max_step$1024"]]]], "r": [[0.0121384, 0.0121292, 0.0121277, 0.012127, 0.0121276, 0.0121196, 0.0121177, 0.012119, 0.0121141, 0.0121075], 0, 47.5427, 1649549124], "v": "v0.6"}
{"i": [["[\"fused_conv1x1\", 1, 14, 14, 1024, 16, 64]", "cuda -keys=cuda,gpu -max_num_threads=1024 -model=unknown -thread_warp_size=32", [-1, 16, 64, 49152, 2147483647, 1024, 8, 32], "", 0, []], [[], [["CHW", 2, "local"], ["SP", 2, 0, 1, [1, 1, 1, 1], 1], ["SP", 2, 5, 64, [2, 2, 4, 4], 1], ["SP", 2, 10, 14, [1, 14, 1, 1], 1], ["SP", 2, 15, 14, [1, 2, 1, 7], 1], ["SP", 2, 20, 16, [1, 1, 4, 2], 1], ["SP", 2, 25, 1024, [1, 1], 1], ["RE", 2, [0, 5, 10, 15, 20, 1, 6, 11, 16, 21, 2, 7, 12, 17, 22, 25, 26, 3, 8, 13, 18, 23, 27, 4, 9, 14, 19, 24]], ["FSP", 3, 0, 1, 3], ["FSP", 3, 4, 2, 3], ["FSP", 3, 8, 3, 3], ["FSP", 3, 12, 4, 3], ["FSP", 3, 16, 5, 3], ["RE", 3, [0, 4, 8, 12, 16, 1, 5, 9, 13, 17, 2, 6, 10, 14, 18, 3, 7, 11, 15, 19]], ["CA", 2, 3, 14], ["CHR", 1, "shared", [2]], ["CA", 2, 3, 15], ["CHR", 0, "shared", [3]], ["CA", 1, 4, 15], ["FU", 5, [0, 1, 2, 3, 4]], ["AN", 5, 0, 5], ["FU", 5, [1, 2, 3, 4, 5]], ["AN", 5, 1, 4], ["FU", 5, [2, 3, 4, 5, 6]], ["AN", 5, 2, 6], ["FU", 3, [0, 1, 2]], ["SP", 3, 0, 128, [1], 1], ["AN", 3, 1, 2], ["FFSP", 3, 0, [5, 4, 3, 2, 1], 1, 1], ["AN", 3, 1, 6], ["FU", 1, [0, 1, 2, 3]], ["SP", 1, 0, 1, [1], 1], ["AN", 1, 1, 2], ["FFSP", 1, 0, [5, 4, 3, 2, 1], 1, 1], ["AN", 1, 1, 6], ["PR", 4, 0, "auto_unroll_max_step$16"]]]], "r": [[0.0561614, 0.0561753, 0.0561802, 0.0561746, 0.0561813, 0.0562109, 0.0562306, 0.0569687, 0.0583807, 0.0584009], 0, 26.8315, 1649549105], "v": "v0.6"}
{"i": [["[\"fused_conv1x1\", 1, 14, 14, 1024, 16, 64]", "cuda -keys=cuda,gpu -max_num_threads=1024 -model=unknown -thread_warp_size=32", [-1, 16, 64, 49152, 2147483647, 1024, 8, 32], "", 0, []], [[], [["CHW", 2, "local"], ["SP", 2, 0, 1, [1, 1, 1, 1], 1], ["SP", 2, 5, 64, [2, 8, 2, 2], 1], ["SP", 2, 10, 14, [1, 7, 2, 1], 1], ["SP", 2, 15, 14, [1, 1, 1, 14], 1], ["SP", 2, 20, 16, [1, 1, 1, 16], 1], ["SP", 2, 25, 1024, [4, 2], 1], ["RE", 2, [0, 5, 10, 15, 20, 1, 6, 11, 16, 21, 2, 7, 12, 17, 22, 25, 26, 3, 8, 13, 18, 23, 27, 4, 9, 14, 19, 24]], ["FSP", 3, 0, 1, 3], ["FSP", 3, 4, 2, 3], ["FSP", 3, 8, 3, 3], ["FSP", 3, 12, 4, 3], ["FSP", 3, 16, 5, 3], ["RE", 3, [0, 4, 8, 12, 16, 1, 5, 9, 13, 17, 2, 6, 10, 14, 18, 3, 7, 11, 15, 19]], ["CA", 2, 3, 14], ["CHR", 1, "shared", [2]], ["CA", 2, 3, 15], ["CHR", 0, "shared", [3]], ["CA", 1, 4, 15], ["FU", 5, [0, 1, 2, 3, 4]], ["AN", 5, 0, 5], ["FU", 5, [1, 2, 3, 4, 5]], ["AN", 5, 1, 4], ["FU", 5, [2, 3, 4, 5, 6]], ["AN", 5, 2, 6], ["FU", 3, [0, 1, 2]], ["SP", 3, 0, 512, [1], 1], ["AN", 3, 1, 2], ["FFSP", 3, 0, [5, 4, 3, 2, 1], 1, 1], ["AN", 3, 1, 6], ["FU", 1, [0, 1, 2, 3]], ["SP", 1, 0, 112, [1], 1], ["AN", 1, 1, 2], ["FFSP", 1, 0, [5, 4, 3, 2, 1], 1, 1], ["AN", 1, 1, 6], ["PR", 4, 0, "auto_unroll_max_step$0"]]]], "r": [[0.0365232, 0.0365344, 0.0365256, 0.036525, 0.0365447, 0.0365491, 0.0365371, 0.0365441, 0.0365587, 0.0365574], 0, 17.6157, 1649549095], "v": "v0.6"}
{"i": [["[\"fused_conv1x1\", 1, 14, 14, 1024, 16, 64]", "cuda -keys=cuda,gpu -max_num_threads=1024 -model=unknown -thread_warp_size=32", [-1, 16, 64, 49152, 2147483647, 1024, 8, 32], "", 0, []], [[], [["CHW", 2, "local"], ["SP", 2, 0, 1, [1, 1, 1, 1], 1], ["SP", 2, 5, 64, [4, 4, 4, 1], 1], ["SP", 2, 10, 14, [1, 7, 1, 1], 1], ["SP", 2, 15, 14, [1, 2, 7, 1], 1], ["SP", 2, 20, 16, [1, 8, 2, 1], 1], ["SP", 2, 25, 1024, [2, 1], 1], ["RE", 2, [0, 5, 10, 15, 20, 1, 6, 11, 16, 21, 2, 7, 12, 17, 22, 25, 26, 3, 8, 13, 18, 23, 27, 4, 9, 14, 19, 24]], ["FSP", 3, 0, 1, 3], ["FSP", 3, 4, 2, 3], ["FSP", 3, 8, 3, 3], ["FSP", 3, 12, 4, 3], ["FSP", 3, 16, 5, 3], ["RE", 3, [0, 4, 8, 12, 16, 1, 5, 9, 13, 17, 2, 6, 10, 14, 18, 3, 7, 11, 15, 19]], ["CA", 2, 3, 14], ["CHR", 1, "shared", [2]], ["CA", 2, 3, 15], ["CHR", 0, "shared", [3]], ["CA", 1, 4, 15], ["FU", 5, [0, 1, 2, 3, 4]], ["AN", 5, 0, 5], ["FU", 5, [1, 2, 3, 4, 5]], ["AN", 5, 1, 4], ["FU", 5, [2, 3, 4, 5, 6]], ["AN", 5, 2, 6], ["FU", 3, [0, 1, 2]], ["SP", 3, 0, 4, [1], 1], ["AN", 3, 1, 2], ["FFSP", 3, 0, [5, 4, 3, 2, 1], 1, 1], ["AN", 3, 1, 6], ["FU", 1, [0, 1, 2, 3]], ["SP", 1, 0, 56, [1], 1], ["AN", 1, 1, 2], ["FFSP", 1, 0, [5, 4, 3, 2, 1], 1, 1], ["AN", 1, 1, 6], ["PR", 4, 0, "auto_unroll_max_step$512"]]]], "r": [[0.0127799, 0.0127783, 0.0127799, 0.0127824, 0.0127775, 0.0127866, 0.0127827, 0.0127884, 0.0127919, 0.0127886], 0, 58.6648, 1649549137], "v": "v0.6"}
{"i": [["[\"fused_conv1x1\", 1, 14, 14, 1024, 16, 64]", "cuda -keys=cuda,gpu -max_num_threads=1024 -model=unknown -thread_warp_size=32", [-1, 16, 64, 49152, 2147483647, 1024, 8, 32], "", 0, []], [[], [["CHW", 2, "local"], ["SP", 2, 0, 1, [1, 1, 1, 1], 1], ["SP", 2, 5, 64, [1, 32, 1, 2], 1], ["SP", 2, 10, 14, [1, 1, 14, 1], 1], ["SP", 2, 15, 14, [1, 2, 1, 1], 1], ["SP", 2, 20, 16, [1, 1, 1, 1], 1], ["SP", 2, 25, 1024, [4, 4], 1], ["RE", 2, [0, 5, 10, 15, 20, 1, 6, 11, 16, 21, 2, 7, 12, 17, 22, 25, 26, 3, 8, 13, 18, 23, 27, 4, 9, 14, 19, 24]], ["FSP", 3, 0, 1, 3], ["FSP", 3, 4, 2, 3], ["FSP", 3, 8, 3, 3], ["FSP", 3, 12, 4, 3], ["FSP", 3, 16, 5, 3], ["RE", 3, [0, 4, 8, 12, 16, 1, 5, 9, 13, 17, 2, 6, 10, 14, 18, 3, 7, 11, 15, 19]], ["CA", 2, 3, 14], ["CHR", 1, "shared", [2]], ["CA", 2, 3, 15], ["CHR", 0, "shared", [3]], ["CA", 1, 4, 15], ["FU", 5, [0, 1, 2, 3, 4]], ["AN", 5, 0, 5], ["FU", 5, [1, 2, 3, 4, 5]], ["AN", 5, 1, 4], ["FU", 5, [2, 3, 4, 5, 6]], ["AN", 5, 2, 6], ["FU", 3, [0, 1, 2]], ["SP", 3, 0, 32, [1], 1], ["AN", 3, 1, 2], ["FFSP", 3, 0, [5, 4, 3, 2, 1], 1, 1], ["AN", 3, 1, 6], ["FU", 1, [0, 1, 2, 3]], ["SP", 1, 0, 112, [1], 1], ["AN", 1, 1, 2], ["FFSP", 1, 0, [5, 4, 3, 2, 1], 1, 1], ["AN", 1, 1, 6], ["PR", 4, 0, "auto_unroll_max_step$1024"]]]], "r": [[0.000158061, 0.000158092, 0.000158058, 0.000158074, 0.000158036, 0.000158075, 0.000158055, 0.0001581, 0.000158053, 0.000158057], 0, 67.679, 1649549146], "v": "v0.6"}
{"i": [["[\"fused_conv1x1\", 1, 14, 14, 1024, 16, 64]", "cuda -keys=cuda,gpu -max_num_threads=1024 -model=unknown -thread_warp_size=32", [-1, 16, 64, 49152, 2147483647, 1024, 8, 32], "", 0, []], [[], [["CHW", 2, "local"], ["SP", 2, 0, 1, [1, 1, 1, 1], 1], ["SP", 2, 5, 64, [1, 8, 8, 1], 1], ["SP", 2, 10, 14, [1, 7, 1, 2], 1], ["SP", 2, 15, 14, [1, 2, 1, 7], 1], ["SP", 2, 20, 16, [1, 8, 1, 1], 1], ["SP", 2, 25, 1024, [2, 8], 1], ["RE", 2, [0, 5, 10, 15, 20, 1, 6, 11, 16, 21, 2, 7, 12, 17, 22, 25, 26, 3, 8, 13, 18, 23, 27, 4, 9, 14, 19, 24]], ["FSP", 3, 0, 1, 3], ["FSP", 3, 4, 2, 3], ["FSP", 3, 8, 3, 3], ["FSP", 3, 12, 4, 3], ["FSP", 3, 16, 5, 3], ["RE", 3, [0, 4, 8, 12, 16, 1, 5, 9, 13, 17, 2, 6, 10, 14, 18, 3, 7, 11, 15, 19]], ["CA", 2, 3, 14], ["CHR", 1, "shared", [2]], ["CA", 2, 3, 15], ["CHR", 0, "shared", [3]], ["CA", 1, 4, 15], ["FU", 5, [0, 1, 2, 3, 4]], ["AN", 5, 0, 5], ["FU", 5, [1, 2, 3, 4, 5]], ["AN", 5, 1, 4], ["FU", 5, [2, 3, 4, 5, 6]], ["AN", 5, 2, 6], ["FU", 3, [0, 1, 2]], ["SP", 3, 0, 128, [1], 1], ["AN", 3, 1, 2], ["FFSP", 3, 0, [5, 4, 3, 2, 1], 1, 1], ["AN", 3, 1, 6], ["FU", 1, [0, 1, 2, 3]], ["SP", 1, 0, 224, [1], 1], ["AN", 1, 1, 2], ["FFSP", 1, 0, [5, 4, 3, 2, 1], 1, 1], ["AN", 1, 1, 6], ["PR", 4, 0, "auto_unroll_max_step$16"]]]], "r": [[0.00640657, 0.00640275, 0.006406, 0.00640782, 0.00640607, 0.0064068, 0.00640496, 0.00640698, 0.00640898, 0.00640566], 0, 61.3608, 1649549141], "v": "v0.6"}
{"i": [["[\"fused_conv1x1\", 1, 14, 14, 1024, 16, 64]", "cuda -keys=cuda,gpu -max_num_threads=1024 -model=unknown -thread_warp_size=32", [-1, 16, 64, 49152, 2147483647, 1024, 8, 32], "", 0, []], [[], [["CHW", 2, "local"], ["SP", 2, 0, 1, [1, 1, 1, 1], 1], ["SP", 2, 5, 64, [2, 1, 1, 32], 1], ["SP", 2, 10, 14, [1, 14, 1, 1], 1], ["SP", 2, 15, 14, [1, 7, 1, 1], 1], ["SP", 2, 20, 16, [1, 4, 2, 1], 1], ["SP", 2, 25, 1024, [2, 2], 1], ["RE", 2, [0, 5, 10, 15, 20, 1, 6, 11, 16, 21, 2, 7, 12, 17, 22, 25, 26, 3, 8, 13, 18, 23, 27, 4, 9, 14, 19, 24]], ["FSP", 3, 0, 1, 3], ["FSP", 3, 4, 2, 3], ["FSP", 3, 8, 3, 3], ["FSP", 3, 12, 4, 3], ["FSP", 3, 16, 5, 3], ["RE", 3, [0, 4, 8, 12, 16, 1, 5, 9, 13, 17, 2, 6, 10, 14, 18, 3, 7, 11, 15, 19]], ["CA", 2, 3, 14], ["CHR", 1, "shared", [2]], ["CA", 2, 3, 15], ["CHR", 0, "shared", [3]], ["CA", 1, 4, 15], ["FU", 5, [0, 1, 2, 3, 4]], ["AN", 5, 0, 5], ["FU", 5, [1, 2, 3, 4, 5]], ["AN", 5, 1, 4], ["FU", 5, [2, 3, 4, 5, 6]], ["AN", 5, 2, 6], ["FU", 3, [0, 1, 2]], ["SP", 3, 0, 256, [1], 1], ["AN", 3, 1, 2], ["FFSP", 3, 0, [5, 4, 3, 2, 1], 1, 1], ["AN", 3, 1, 6], ["FU", 1, [0, 1, 2, 3]], ["SP", 1, 0, 4, [1], 1], ["AN", 1, 1, 2], ["FFSP", 1, 0, [5, 4, 3, 2, 1], 1, 1], ["AN", 1, 1, 6], ["PR", 4, 0, "auto_unroll_max_step$1024"]]]], "r": [[0.00706581, 0.00706119, 0.0070625, 0.00706191, 0.00706203, 0.0070615, 0.00706379, 0.00706211, 0.00706573, 0.00706445], 0, 71.9444, 1649549150], "v": "v0.6"}
{"i": [["[\"fused_conv1x1\", 1, 14, 14, 1024, 16, 64]", "cuda -keys=cuda,gpu -max_num_threads=1024 -model=unknown -thread_warp_size=32", [-1, 16, 64, 49152, 2147483647, 1024, 8, 32], "", 0, []], [[], [["CHW", 2, "local"], ["SP", 2, 0, 1, [1, 1, 1, 1], 1], ["SP", 2, 5, 64, [1, 1, 1, 64], 1], ["SP", 2, 10, 14, [2, 7, 1, 1], 1], ["SP", 2, 15, 14, [1, 1, 14, 1], 1], ["SP", 2, 20, 16, [1, 4, 1, 1], 1], ["SP", 2, 25, 1024, [1, 2], 1], ["RE", 2, [0, 5, 10, 15, 20, 1, 6, 11, 16, 21, 2, 7, 12, 17, 22, 25, 26, 3, 8, 13, 18, 23, 27, 4, 9, 14, 19, 24]], ["FSP", 3, 0, 1, 3], ["FSP", 3, 4, 2, 3], ["FSP", 3, 8, 3, 3], ["FSP", 3, 12, 4, 3], ["FSP", 3, 16, 5, 3], ["RE", 3, [0, 4, 8, 12, 16, 1, 5, 9, 13, 17, 2, 6, 10, 14, 18, 3, 7, 11, 15, 19]], ["CA", 2, 3, 14], ["CHR", 1, "shared", [2]], ["CA", 2, 3, 15], ["CHR", 0, "shared", [3]], ["CA", 1, 4, 15], ["FU", 5, [0, 1, 2, 3, 4]], ["AN", 5, 0, 5], ["FU", 5, [1, 2, 3, 4, 5]], ["AN", 5, 1, 4], ["FU", 5, [2, 3, 4, 5, 6]], ["AN", 5, 2, 6], ["FU", 3, [0, 1, 2]], ["SP", 3, 0, 512, [1], 1], ["AN", 3, 1, 2], ["FFSP", 3, 0, [5, 4, 3, 2, 1], 1, 1], ["AN", 3, 1, 6], ["FU", 1, [0, 1, 2, 3]], ["SP", 1, 0, 28, [1], 1], ["AN", 1, 1, 2], ["FFSP", 1, 0, [5, 4, 3, 2, 1], 1, 1], ["AN", 1, 1, 6], ["PR", 4, 0, "auto_unroll_max_step$16"]]]], "r": [[0.00860416, 0.00860397, 0.00860371, 0.00860251, 0.0086035, 0.0086036, 0.00860263, 0.00860356, 0.00860232, 0.00860194], 0, 74.3911, 1649549154], "v": "v0.6"}
{"i": [["[\"fused_conv1x1\", 1, 14, 14, 1024, 16, 64]", "cuda -keys=cuda,gpu -max_num_threads=1024 -model=unknown -thread_warp_size=32", [-1, 16, 64, 49152, 2147483647, 1024, 8, 32], "", 0, []], [[], [["CHW", 2, "local"], ["SP", 2, 0, 1, [1, 1, 1, 1], 1], ["SP", 2, 5, 64, [1, 4, 2, 1], 1], ["SP", 2, 10, 14, [1, 1, 1, 1], 1], ["SP", 2, 15, 14, [1, 2, 7, 1], 1], ["SP", 2, 20, 16, [1, 1, 4, 4], 1], ["SP", 2, 25, 1024, [2, 8], 1], ["RE", 2, [0, 5, 10, 15, 20, 1, 6, 11, 16, 21, 2, 7, 12, 17, 22, 25, 26, 3, 8, 13, 18, 23, 27, 4, 9, 14, 19, 24]], ["FSP", 3, 0, 1, 3], ["FSP", 3, 4, 2, 3], ["FSP", 3, 8, 3, 3], ["FSP", 3, 12, 4, 3], ["FSP", 3, 16, 5, 3], ["RE", 3, [0, 4, 8, 12, 16, 1, 5, 9, 13, 17, 2, 6, 10, 14, 18, 3, 7, 11, 15, 19]], ["CA", 2, 3, 14], ["CHR", 1, "shared", [2]], ["CA", 2, 3, 15], ["CHR", 0, "shared", [3]], ["CA", 1, 4, 15], ["FU", 5, [0, 1, 2, 3, 4]], ["AN", 5, 0, 5], ["FU", 5, [1, 2, 3, 4, 5]], ["AN", 5, 1, 4], ["FU", 5, [2, 3, 4, 5, 6]], ["AN", 5, 2, 6], ["FU", 3, [0, 1, 2]], ["SP", 3, 0, 128, [1], 1], ["AN", 3, 1, 2], ["FFSP", 3, 0, [5, 4, 3, 2, 1], 1, 1], ["AN", 3, 1, 6], ["FU", 1, [0, 1, 2, 3]], ["SP", 1, 0, 112, [1], 1], ["AN", 1, 1, 2], ["FFSP", 1, 0, [5, 4, 3, 2, 1], 1, 1], ["AN", 1, 1, 6], ["PR", 4, 0, "auto_unroll_max_step$1024"]]]], "r": [[0.0010028, 0.00100259, 0.00100304, 0.00100279, 0.00100269, 0.00100257, 0.00100255, 0.00100251, 0.00100263, 0.0010026], 0, 95.7861, 1649549171], "v": "v0.6"}
{"i": [["[\"fused_conv1x1\", 1, 14, 14, 1024, 16, 64]", "cuda -keys=cuda,gpu -max_num_threads=1024 -model=unknown -thread_warp_size=32", [-1, 16, 64, 49152, 2147483647, 1024, 8, 32], "", 0, []], [[], [["CHW", 2, "local"], ["SP", 2, 0, 1, [1, 1, 1, 1], 1], ["SP", 2, 5, 64, [4, 4, 2, 1], 1], ["SP", 2, 10, 14, [1, 2, 1, 1], 1], ["SP", 2, 15, 14, [1, 14, 1, 1], 1], ["SP", 2, 20, 16, [2, 4, 2, 1], 1], ["SP", 2, 25, 1024, [4, 2], 1], ["RE", 2, [0, 5, 10, 15, 20, 1, 6, 11, 16, 21, 2, 7, 12, 17, 22, 25, 26, 3, 8, 13, 18, 23, 27, 4, 9, 14, 19, 24]], ["FSP", 3, 0, 1, 3], ["FSP", 3, 4, 2, 3], ["FSP", 3, 8, 3, 3], ["FSP", 3, 12, 4, 3], ["FSP", 3, 16, 5, 3], ["RE", 3, [0, 4, 8, 12, 16, 1, 5, 9, 13, 17, 2, 6, 10, 14, 18, 3, 7, 11, 15, 19]], ["CA", 2, 3, 14], ["CHR", 1, "shared", [2]], ["CA", 2, 3, 15], ["CHR", 0, "shared", [3]], ["CA", 1, 4, 15], ["FU", 5, [0, 1, 2, 3, 4]], ["AN", 5, 0, 5], ["FU", 5, [1, 2, 3, 4, 5]], ["AN", 5, 1, 4], ["FU", 5, [2, 3, 4, 5, 6]], ["AN", 5, 2, 6], ["FU", 3, [0, 1, 2]], ["SP", 3, 0, 32, [2], 1], ["AN", 3, 1, 2], ["FFSP", 3, 0, [5, 4, 3, 2, 1], 1, 1], ["AN", 3, 1, 6], ["FU", 1, [0, 1, 2, 3]], ["SP", 1, 0, 8, [1], 1], ["AN", 1, 1, 2], ["FFSP", 1, 0, [5, 4, 3, 2, 1], 1, 1], ["AN", 1, 1, 6], ["PR", 4, 0, "auto_unroll_max_step$1024"]]]], "r": [[0.000434431, 0.000434573, 0.000434515, 0.000434464, 0.000434451, 0.000434538, 0.000434508, 0.000434487, 0.0004345, 0.000434453], 0, 80.0273, 1649549159], "v": "v0.6"}
{"i": [["[\"fused_conv1x1\", 1, 14, 14, 1024, 16, 64]", "cuda -keys=cuda,gpu -max_num_threads=1024 -model=unknown -thread_warp_size=32", [-1, 16, 64, 49152, 2147483647, 1024, 8, 32], "", 0, []], [[], [["CHW", 2, "local"], ["SP", 2, 0, 1, [1, 1, 1, 1], 1], ["SP", 2, 5, 64, [1, 2, 1, 1], 1], ["SP", 2, 10, 14, [1, 2, 1, 7], 1], ["SP", 2, 15, 14, [1, 2, 7, 1], 1], ["SP", 2, 20, 16, [4, 4, 1, 1], 1], ["SP", 2, 25, 1024, [16, 2], 1], ["RE", 2, [0, 5, 10, 15, 20, 1, 6, 11, 16, 21, 2, 7, 12, 17, 22, 25, 26, 3, 8, 13, 18, 23, 27, 4, 9, 14, 19, 24]], ["FSP", 3, 0, 1, 3], ["FSP", 3, 4, 2, 3], ["FSP", 3, 8, 3, 3], ["FSP", 3, 12, 4, 3], ["FSP", 3, 16, 5, 3], ["RE", 3, [0, 4, 8, 12, 16, 1, 5, 9, 13, 17, 2, 6, 10, 14, 18, 3, 7, 11, 15, 19]], ["CA", 2, 3, 14], ["CHR", 1, "shared", [2]], ["CA", 2, 3, 15], ["CHR", 0, "shared", [3]], ["CA", 1, 4, 15], ["FU", 5, [0, 1, 2, 3, 4]], ["AN", 5, 0, 5], ["FU", 5, [1, 2, 3, 4, 5]], ["AN", 5, 1, 4], ["FU", 5, [2, 3, 4, 5, 6]], ["AN", 5, 2, 6], ["FU", 3, [0, 1, 2]], ["SP", 3, 0, 32, [1], 1], ["AN", 3, 1, 2], ["FFSP", 3, 0, [5, 4, 3, 2, 1], 1, 1], ["AN", 3, 1, 6], ["FU", 1, [0, 1, 2, 3]], ["SP", 1, 0, 1568, [1], 1], ["AN", 1, 1, 2], ["FFSP", 1, 0, [5, 4, 3, 2, 1], 1, 1], ["AN", 1, 1, 6], ["PR", 4, 0, "auto_unroll_max_step$0"]]]], "r": [[0.00101078, 0.00101097, 0.00101102, 0.00101111, 0.00101091, 0.00101131, 0.00101152, 0.00101123, 0.00101117, 0.00101116], 0, 97.7514, 1649549177], "v": "v0.6"}
{"i": [["[\"fused_conv1x1\", 1, 14, 14, 1024, 16, 64]", "cuda -keys=cuda,gpu -max_num_threads=1024 -model=unknown -thread_warp_size=32", [-1, 16, 64, 49152, 2147483647, 1024, 8, 32], "", 0, []], [[], [["CHW", 2, "local"], ["SP", 2, 0, 1, [1, 1, 1, 1], 1], ["SP", 2, 5, 64, [2, 4, 1, 1], 1], ["SP", 2, 10, 14, [1, 1, 1, 1], 1], ["SP", 2, 15, 14, [1, 7, 2, 1], 1], ["SP", 2, 20, 16, [1, 1, 2, 8], 1], ["SP", 2, 25, 1024, [2, 2], 1], ["RE", 2, [0, 5, 10, 15, 20, 1, 6, 11, 16, 21, 2, 7, 12, 17, 22, 25, 26, 3, 8, 13, 18, 23, 27, 4, 9, 14, 19, 24]], ["FSP", 3, 0, 1, 3], ["FSP", 3, 4, 2, 3], ["FSP", 3, 8, 3, 3], ["FSP", 3, 12, 4, 3], ["FSP", 3, 16, 5, 3], ["RE", 3, [0, 4, 8, 12, 16, 1, 5, 9, 13, 17, 2, 6, 10, 14, 18, 3, 7, 11, 15, 19]], ["CA", 2, 3, 14], ["CHR", 1, "shared", [2]], ["CA", 2, 3, 15], ["CHR", 0, "shared", [3]], ["CA", 1, 4, 15], ["FU", 5, [0, 1, 2, 3, 4]], ["AN", 5, 0, 5], ["FU", 5, [1, 2, 3, 4, 5]], ["AN", 5, 1, 4], ["FU", 5, [2, 3, 4, 5, 6]], ["AN", 5, 2, 6], ["FU", 3, [0, 1, 2]], ["SP", 3, 0, 256, [1], 1], ["AN", 3, 1, 2], ["FFSP", 3, 0, [5, 4, 3, 2, 1], 1, 1], ["AN", 3, 1, 6], ["FU", 1, [0, 1, 2, 3]], ["SP", 1, 0, 4, [1], 1], ["AN", 1, 1, 2], ["FFSP", 1, 0, [5, 4, 3, 2, 1], 1, 1], ["AN", 1, 1, 6], ["PR", 4, 0, "auto_unroll_max_step$512"]]]], "r": [[0.000213905, 0.000213962, 0.000213922, 0.000213934, 0.000213901, 0.000213945, 0.000213926, 0.000213919, 0.00021396, 0.00021395], 0, 103.277, 1649549183], "v": "v0.6"}
{"i": [["[\"fused_conv1x1\", 1, 14, 14, 1024, 16, 64]", "cuda -keys=cuda,gpu -max_num_threads=1024 -model=unknown -thread_warp_size=32", [-1, 16, 64, 49152, 2147483647, 1024, 8, 32], "", 0, []], [[], [["CHW", 2, "local"], ["SP", 2, 0, 1, [1, 1, 1, 1], 1], ["SP", 2, 5, 64, [1, 16, 1, 4], 1], ["SP", 2, 10, 14, [1, 7, 1, 1], 1], ["SP", 2, 15, 14, [1, 1, 1, 2], 1], ["SP", 2, 20, 16, [1, 4, 4, 1], 1], ["SP", 2, 25, 1024, [1, 2], 1], ["RE", 2, [0, 5, 10, 15, 20, 1, 6, 11, 16, 21, 2, 7, 12, 17, 22, 25, 26, 3, 8, 13, 18, 23, 27, 4, 9, 14, 19, 24]], ["FSP", 3, 0, 1, 3], ["FSP", 3, 4, 2, 3], ["FSP", 3, 8, 3, 3], ["FSP", 3, 12, 4, 3], ["FSP", 3, 16, 5, 3], ["RE", 3, [0, 4, 8, 12, 16, 1, 5, 9, 13, 17, 2, 6, 10, 14, 18, 3, 7, 11, 15, 19]], ["CA", 2, 3, 14], ["CHR", 1, "shared", [2]], ["CA", 2, 3, 15], ["CHR", 0, "shared", [3]], ["CA", 1, 4, 15], ["FU", 5, [0, 1, 2, 3, 4]], ["AN", 5, 0, 5], ["FU", 5, [1, 2, 3, 4, 5]], ["AN", 5, 1, 4], ["FU", 5, [2, 3, 4, 5, 6]], ["AN", 5, 2, 6], ["FU", 3, [0, 1, 2]], ["SP", 3, 0, 16, [1], 1], ["AN", 3, 1, 2], ["FFSP", 3, 0, [5, 4, 3, 2, 1], 1, 1], ["AN", 3, 1, 6], ["FU", 1, [0, 1, 2, 3]], ["SP", 1, 0, 4, [1], 1], ["AN", 1, 1, 2], ["FFSP", 1, 0, [5, 4, 3, 2, 1], 1, 1], ["AN", 1, 1, 6], ["PR", 4, 0, "auto_unroll_max_step$16"]]]], "r": [[0.000446279, 0.000446428, 0.000446593, 0.000446521, 0.000446519, 0.000446558, 0.00044635, 0.000446361, 0.000446259, 0.000446329], 0, 84.9633, 1649549165], "v": "v0.6"}
{"i": [["[\"fused_conv1x1\", 1, 14, 14, 1024, 16, 64]", "cuda -keys=cuda,gpu -max_num_threads=1024 -model=unknown -thread_warp_size=32", [-1, 16, 64, 49152, 2147483647, 1024, 8, 32], "", 0, []], [[], [["CHW", 2, "local"], ["SP", 2, 0, 1, [1, 1, 1, 1], 1], ["SP", 2, 5, 64, [2, 4, 1, 1], 1], ["SP", 2, 10, 14, [1, 1, 14, 1], 1], ["SP", 2, 15, 14, [1, 7, 2, 1], 1], ["SP", 2, 20, 16, [1, 2, 2, 4], 1], ["SP", 2, 25, 1024, [2, 2], 1], ["RE", 2, [0, 5, 10, 15, 20, 1, 6, 11, 16, 21, 2, 7, 12, 17, 22, 25, 26, 3, 8, 13, 18, 23, 27, 4, 9, 14, 19, 24]], ["FSP", 3, 0, 1, 3], ["FSP", 3, 4, 2, 3], ["FSP", 3, 8, 3, 3], ["FSP", 3, 12, 4, 3], ["FSP", 3, 16, 5, 3], ["RE", 3, [0, 4, 8, 12, 16, 1, 5, 9, 13, 17, 2, 6, 10, 14, 18, 3, 7, 11, 15, 19]], ["CA", 2, 3, 14], ["CHR", 1, "shared", [2]], ["CA", 2, 3, 15], ["CHR", 0, "shared", [3]], ["CA", 1, 4, 15], ["FU", 5, [0, 1, 2, 3, 4]], ["AN", 5, 0, 5], ["FU", 5, [1, 2, 3, 4, 5]], ["AN", 5, 1, 4], ["FU", 5, [2, 3, 4, 5, 6]], ["AN", 5, 2, 6], ["FU", 3, [0, 1, 2]], ["SP", 3, 0, 256, [1], 1], ["AN", 3, 1, 2], ["FFSP", 3, 0, [5, 4, 3, 2, 1], 1, 1], ["AN", 3, 1, 6], ["FU", 1, [0, 1, 2, 3]], ["SP", 1, 0, 4, [1], 1], ["AN", 1, 1, 2], ["FFSP", 1, 0, [5, 4, 3, 2, 1], 1, 1], ["AN", 1, 1, 6], ["PR", 4, 0, "auto_unroll_max_step$512"]]]], "r": [[0.00478848, 0.00478731, 0.00478655, 0.00478829, 0.00478865, 0.00478688, 0.00478645, 0.00478701, 0.00478843, 0.00478704], 0, 112.651, 1649549192], "v": "v0.6"}
{"i": [["[\"fused_conv1x1\", 1, 14, 14, 1024, 16, 64]", "cuda -keys=cuda,gpu -max_num_threads=1024 -model=unknown -thread_warp_size=32", [-1, 16, 64, 49152, 2147483647, 1024, 8, 32], "", 0, []], [[], [["CHW", 2, "local"], ["SP", 2, 0, 1, [1, 1, 1, 1], 1], ["SP", 2, 5, 64, [2, 16, 1, 2], 1], ["SP", 2, 10, 14, [1, 1, 1, 2], 1], ["SP", 2, 15, 14, [1, 7, 1, 1], 1], ["SP", 2, 20, 16, [4, 1, 1, 2], 1], ["SP", 2, 25, 1024, [4, 2], 1], ["RE", 2, [0, 5, 10, 15, 20, 1, 6, 11, 16, 21, 2, 7, 12, 17, 22, 25, 26, 3, 8, 13, 18, 23, 27, 4, 9, 14, 19, 24]], ["FSP", 3, 0, 1, 3], ["FSP", 3, 4, 2, 3], ["FSP", 3, 8, 3, 3], ["FSP", 3, 12, 4, 3], ["FSP", 3, 16, 5, 3], ["RE", 3, [0, 4, 8, 12, 16, 1, 5, 9, 13, 17, 2, 6, 10, 14, 18, 3, 7, 11, 15, 19]], ["CA", 2, 3, 14], ["CHR", 1, "shared", [2]], ["CA", 2, 3, 15], ["CHR", 0, "shared", [3]], ["CA", 1, 4, 15], ["FU", 5, [0, 1, 2, 3, 4]], ["AN", 5, 0, 5], ["FU", 5, [1, 2, 3, 4, 5]], ["AN", 5, 1, 4], ["FU", 5, [2, 3, 4, 5, 6]], ["AN", 5, 2, 6], ["FU", 3, [0, 1, 2]], ["SP", 3, 0, 32, [1], 1], ["AN", 3, 1, 2], ["FFSP", 3, 0, [5, 4, 3, 2, 1], 1, 1], ["AN", 3, 1, 6], ["FU", 1, [0, 1, 2, 3]], ["SP", 1, 0, 32, [1], 1], ["AN", 1, 1, 2], ["FFSP", 1, 0, [5, 4, 3, 2, 1], 1, 1], ["AN", 1, 1, 6], ["PR", 4, 0, "auto_unroll_max_step$512"]]]], "r": [[0.000309727, 0.000309743, 0.000309929, 0.000309962, 0.000309792, 0.000309757, 0.000309716, 0.000309741, 0.000309649, 0.00030955], 0, 119.007, 1649549198], "v": "v0.6"}
{"i": [["[\"fused_conv1x1\", 1, 14, 14, 1024, 16, 64]", "cuda -keys=cuda,gpu -max_num_threads=1024 -model=unknown -thread_warp_size=32", [-1, 16, 64, 49152, 2147483647, 1024, 8, 32], "", 0, []], [[], [["CHW", 2, "local"], ["SP", 2, 0, 1, [1, 1, 1, 1], 1], ["SP", 2, 5, 64, [2, 2, 1, 2], 1], ["SP", 2, 10, 14, [1, 7, 2, 1], 1], ["SP", 2, 15, 14, [1, 7, 1, 2], 1], ["SP", 2, 20, 16, [4, 1, 2, 1], 1], ["SP", 2, 25, 1024, [2, 16], 1], ["RE", 2, [0, 5, 10, 15, 20, 1, 6, 11, 16, 21, 2, 7, 12, 17, 22, 25, 26, 3, 8, 13, 18, 23, 27, 4, 9, 14, 19, 24]], ["FSP", 3, 0, 1, 3], ["FSP", 3, 4, 2, 3], ["FSP", 3, 8, 3, 3], ["FSP", 3, 12, 4, 3], ["FSP", 3, 16, 5, 3], ["RE", 3, [0, 4, 8, 12, 16, 1, 5, 9, 13, 17, 2, 6, 10, 14, 18, 3, 7, 11, 15, 19]], ["CA", 2, 3, 14], ["CHR", 1, "shared", [2]], ["CA", 2, 3, 15], ["CHR", 0, "shared", [3]], ["CA", 1, 4, 15], ["FU", 5, [0, 1, 2, 3, 4]], ["AN", 5, 0, 5], ["FU", 5, [1, 2, 3, 4, 5]], ["AN", 5, 1, 4], ["FU", 5, [2, 3, 4, 5, 6]], ["AN", 5, 2, 6], ["FU", 3, [0, 1, 2]], ["SP", 3, 0, 512, [1], 1], ["AN", 3, 1, 2], ["FFSP", 3, 0, [5, 4, 3, 2, 1], 1, 1], ["AN", 3, 1, 6], ["FU", 1, [0, 1, 2, 3]], ["SP", 1, 0, 128, [1], 1], ["AN", 1, 1, 2], ["FFSP", 1, 0, [5, 4, 3, 2, 1], 1, 1], ["AN", 1, 1, 6], ["PR", 4, 0, "auto_unroll_max_step$64"]]]], "r": [[0.0011321, 0.00113214, 0.00113227, 0.00113234, 0.00113201, 0.00113176, 0.00113175, 0.00113183, 0.00113162, 0.00113161], 0, 129.224, 1649549208], "v": "v0.6"}
{"i": [["[\"fused_conv1x1\", 1, 14, 14, 1024, 16, 64]", "cuda -keys=cuda,gpu -max_num_threads=1024 -model=unknown -thread_warp_size=32", [-1, 16, 64, 49152, 2147483647, 1024, 8, 32], "", 0, []], [[], [["CHW", 2, "local"], ["SP", 2, 0, 1, [1, 1, 1, 1], 1], ["SP", 2, 5, 64, [1, 1, 1, 1], 1], ["SP", 2, 10, 14, [1, 7, 1, 2], 1], ["SP", 2, 15, 14, [1, 7, 1, 1], 1], ["SP", 2, 20, 16, [2, 1, 8, 1], 1], ["SP", 2, 25, 1024, [64, 1], 1], ["RE", 2, [0, 5, 10, 15, 20, 1, 6, 11, 16, 21, 2, 7, 12, 17, 22, 25, 26, 3, 8, 13, 18, 23, 27, 4, 9, 14, 19, 24]], ["FSP", 3, 0, 1, 3], ["FSP", 3, 4, 2, 3], ["FSP", 3, 8, 3, 3], ["FSP", 3, 12, 4, 3], ["FSP", 3, 16, 5, 3], ["RE", 3, [0, 4, 8, 12, 16, 1, 5, 9, 13, 17, 2, 6, 10, 14, 18, 3, 7, 11, 15, 19]], ["CA", 2, 3, 14], ["CHR", 1, "shared", [2]], ["CA", 2, 3, 15], ["CHR", 0, "shared", [3]], ["CA", 1, 4, 15], ["FU", 5, [0, 1, 2, 3, 4]], ["AN", 5, 0, 5], ["FU", 5, [1, 2, 3, 4, 5]], ["AN", 5, 1, 4], ["FU", 5, [2, 3, 4, 5, 6]], ["AN", 5, 2, 6], ["FU", 3, [0, 1, 2]], ["SP", 3, 0, 128, [1], 1], ["AN", 3, 1, 2], ["FFSP", 3, 0, [5, 4, 3, 2, 1], 1, 1], ["AN", 3, 1, 6], ["FU", 1, [0, 1, 2, 3]], ["SP", 1, 0, 128, [1], 1], ["AN", 1, 1, 2], ["FFSP", 1, 0, [5, 4, 3, 2, 1], 1, 1], ["AN", 1, 1, 6], ["PR", 4, 0, "auto_unroll_max_step$0"]]]], "r": [[0.000179664, 0.000179461, 0.000179675, 0.000179686, 0.00017967, 0.00017968, 0.000179661, 0.000179661, 0.000179534, 0.000179521], 0, 123.493, 1649549203], "v": "v0.6"}
{"i": [["[\"fused_conv1x1\", 1, 14, 14, 1024, 16, 64]", "cuda -keys=cuda,gpu -max_num_threads=1024 -model=unknown -thread_warp_size=32", [-1, 16, 64, 49152, 2147483647, 1024, 8, 32], "", 0, []], [[], [["CHW", 2, "local"], ["SP", 2, 0, 1, [1, 1, 1, 1], 1], ["SP", 2, 5, 64, [1, 4, 2, 1], 1], ["SP", 2, 10, 14, [2, 1, 7, 1], 1], ["SP", 2, 15, 14, [1, 7, 2, 1], 1], ["SP", 2, 20, 16, [2, 1, 4, 2], 1], ["SP", 2, 25, 1024, [1, 2], 1], ["RE", 2, [0, 5, 10, 15, 20, 1, 6, 11, 16, 21, 2, 7, 12, 17, 22, 25, 26, 3, 8, 13, 18, 23, 27, 4, 9, 14, 19, 24]], ["FSP", 3, 0, 1, 3], ["FSP", 3, 4, 2, 3], ["FSP", 3, 8, 3, 3], ["FSP", 3, 12, 4, 3], ["FSP", 3, 16, 5, 3], ["RE", 3, [0, 4, 8, 12, 16, 1, 5, 9, 13, 17, 2, 6, 10, 14, 18, 3, 7, 11, 15, 19]], ["CA", 2, 3, 14], ["CHR", 1, "shared", [2]], ["CA", 2, 3, 15], ["CHR", 0, "shared", [3]], ["CA", 1, 4, 15], ["FU", 5, [0, 1, 2, 3, 4]], ["AN", 5, 0, 5], ["FU", 5, [1, 2, 3, 4, 5]], ["AN", 5, 1, 4], ["FU", 5, [2, 3, 4, 5, 6]], ["AN", 5, 2, 6], ["FU", 3, [0, 1, 2]], ["SP", 3, 0, 32, [1], 1], ["AN", 3, 1, 2], ["FFSP", 3, 0, [5, 4, 3, 2, 1], 1, 1], ["AN", 3, 1, 6], ["FU", 1, [0, 1, 2, 3]], ["SP", 1, 0, 28, [1], 1], ["AN", 1, 1, 2], ["FFSP", 1, 0, [5, 4, 3, 2, 1], 1, 1], ["AN", 1, 1, 6], ["PR", 4, 0, "auto_unroll_max_step$1024"]]]], "r": [[0.00611382, 0.00611334, 0.00611427, 0.00611317, 0.00611426, 0.00611328, 0.00611365, 0.00611296, 0.00611547, 0.00611363], 0, 112.752, 1649549189], "v": "v0.6"}
{"i": [["[\"fused_conv1x1\", 1, 14, 14, 1024, 16, 64]", "cuda -keys=cuda,gpu -max_num_threads=1024 -model=unknown -thread_warp_size=32", [-1, 16, 64, 49152, 2147483647, 1024, 8, 32], "", 0, []], [[], [["CHW", 2, "local"], ["SP", 2, 0, 1, [1, 1, 1, 1], 1], ["SP", 2, 5, 64, [2, 2, 2, 2], 1], ["SP", 2, 10, 14, [2, 7, 1, 1], 1], ["SP", 2, 15, 14, [1, 7, 1, 1], 1], ["SP", 2, 20, 16, [1, 1, 4, 4], 1], ["SP", 2, 25, 1024, [4, 1], 1], ["RE", 2, [0, 5, 10, 15, 20, 1, 6, 11, 16, 21, 2, 7, 12, 17, 22, 25, 26, 3, 8, 13, 18, 23, 27, 4, 9, 14, 19, 24]], ["FSP", 3, 0, 1, 3], ["FSP", 3, 4, 2, 3], ["FSP", 3, 8, 3, 3], ["FSP", 3, 12, 4, 3], ["FSP", 3, 16, 5, 3], ["RE", 3, [0, 4, 8, 12, 16, 1, 5, 9, 13, 17, 2, 6, 10, 14, 18, 3, 7, 11, 15, 19]], ["CA", 2, 3, 14], ["CHR", 1, "shared", [2]], ["CA", 2, 3, 15], ["CHR", 0, "shared", [3]], ["CA", 1, 4, 15], ["FU", 5, [0, 1, 2, 3, 4]], ["AN", 5, 0, 5], ["FU", 5, [1, 2, 3, 4, 5]], ["AN", 5, 1, 4], ["FU", 5, [2, 3, 4, 5, 6]], ["AN", 5, 2, 6], ["FU", 3, [0, 1, 2]], ["SP", 3, 0, 256, [8], 1], ["AN", 3, 1, 2], ["FFSP", 3, 0, [5, 4, 3, 2, 1], 1, 1], ["AN", 3, 1, 6], ["FU", 1, [0, 1, 2, 3]], ["SP", 1, 0, 4, [1], 1], ["AN", 1, 1, 2], ["FFSP", 1, 0, [5, 4, 3, 2, 1], 1, 1], ["AN", 1, 1, 6], ["PR", 4, 0, "auto_unroll_max_step$1024"]]]], "r": [[0.00165199, 0.00165165, 0.00165253, 0.00165186, 0.00165135, 0.00165119, 0.00165094, 0.00165133, 0.00165138, 0.00165135], 0, 164.694, 1649549242], "v": "v0.6"}
{"i": [["[\"fused_conv1x1\", 1, 14, 14, 1024, 16, 64]", "cuda -keys=cuda,gpu -max_num_threads=1024 -model=unknown -thread_warp_size=32", [-1, 16, 64, 49152, 2147483647, 1024, 8, 32], "", 0, []], [[], [["CHW", 2, "local"], ["SP", 2, 0, 1, [1, 1, 1, 1], 1], ["SP", 2, 5, 64, [2, 8, 2, 2], 1], ["SP", 2, 10, 14, [1, 1, 2, 1], 1], ["SP", 2, 15, 14, [1, 7, 1, 1], 1], ["SP", 2, 20, 16, [1, 8, 1, 2], 1], ["SP", 2, 25, 1024, [8, 1], 1], ["RE", 2, [0, 5, 10, 15, 20, 1, 6, 11, 16, 21, 2, 7, 12, 17, 22, 25, 26, 3, 8, 13, 18, 23, 27, 4, 9, 14, 19, 24]], ["FSP", 3, 0, 1, 3], ["FSP", 3, 4, 2, 3], ["FSP", 3, 8, 3, 3], ["FSP", 3, 12, 4, 3], ["FSP", 3, 16, 5, 3], ["RE", 3, [0, 4, 8, 12, 16, 1, 5, 9, 13, 17, 2, 6, 10, 14, 18, 3, 7, 11, 15, 19]], ["CA", 2, 3, 14], ["CHR", 1, "shared", [2]], ["CA", 2, 3, 15], ["CHR", 0, "shared", [3]], ["CA", 1, 4, 15], ["FU", 5, [0, 1, 2, 3, 4]], ["AN", 5, 0, 5], ["FU", 5, [1, 2, 3, 4, 5]], ["AN", 5, 1, 4], ["FU", 5, [2, 3, 4, 5, 6]], ["AN", 5, 2, 6], ["FU", 3, [0, 1, 2]], ["SP", 3, 0, 64, [1], 1], ["AN", 3, 1, 2], ["FFSP", 3, 0, [5, 4, 3, 2, 1], 1, 1], ["AN", 3, 1, 6], ["FU", 1, [0, 1, 2, 3]], ["SP", 1, 0, 16, [1], 1], ["AN", 1, 1, 2], ["FFSP", 1, 0, [5, 4, 3, 2, 1], 1, 1], ["AN", 1, 1, 6], ["PR", 4, 0, "auto_unroll_max_step$16"]]]], "r": [[0.000441805, 0.000441796, 0.000441839, 0.000441734, 0.00044177, 0.000441748, 0.000441813, 0.000441841, 0.000441963, 0.000442006], 0, 134.164, 1649549214], "v": "v0.6"}
{"i": [["[\"fused_conv1x1\", 1, 14, 14, 1024, 16, 64]", "cuda -keys=cuda,gpu -max_num_threads=1024 -model=unknown -thread_warp_size=32", [-1, 16, 64, 49152, 2147483647, 1024, 8, 32], "", 0, []], [[], [["CHW", 2, "local"], ["SP", 2, 0, 1, [1, 1, 1, 1], 1], ["SP", 2, 5, 64, [2, 8, 1, 1], 1], ["SP", 2, 10, 14, [1, 7, 1, 2], 1], ["SP", 2, 15, 14, [1, 7, 2, 1], 1], ["SP", 2, 20, 16, [1, 1, 4, 1], 1], ["SP", 2, 25, 1024, [1, 1], 1], ["RE", 2, [0, 5, 10, 15, 20, 1, 6, 11, 16, 21, 2, 7, 12, 17, 22, 25, 26, 3, 8, 13, 18, 23, 27, 4, 9, 14, 19, 24]], ["FSP", 3, 0, 1, 3], ["FSP", 3, 4, 2, 3], ["FSP", 3, 8, 3, 3], ["FSP", 3, 12, 4, 3], ["FSP", 3, 16, 5, 3], ["RE", 3, [0, 4, 8, 12, 16, 1, 5, 9, 13, 17, 2, 6, 10, 14, 18, 3, 7, 11, 15, 19]], ["CA", 2, 3, 14], ["CHR", 1, "shared", [2]], ["CA", 2, 3, 15], ["CHR", 0, "shared", [3]], ["CA", 1, 4, 15], ["FU", 5, [0, 1, 2, 3, 4]], ["AN", 5, 0, 5], ["FU", 5, [1, 2, 3, 4, 5]], ["AN", 5, 1, 4], ["FU", 5, [2, 3, 4, 5, 6]], ["AN", 5, 2, 6], ["FU", 3, [0, 1, 2]], ["SP", 3, 0, 8, [1], 1], ["AN", 3, 1, 2], ["FFSP", 3, 0, [5, 4, 3, 2, 1], 1, 1], ["AN", 3, 1, 6], ["FU", 1, [0, 1, 2, 3]], ["SP", 1, 0, 8, [1], 1], ["AN", 1, 1, 2], ["FFSP", 1, 0, [5, 4, 3, 2, 1], 1, 1], ["AN", 1, 1, 6], ["PR", 4, 0, "auto_unroll_max_step$512"]]]], "r": [[0.000658914, 0.000658936, 0.000658925, 0.000658948, 0.000658948, 0.000658934, 0.000658945, 0.000658905, 0.000658943, 0.000658967], 0, 154.817, 1649549235], "v": "v0.6"}
{"i": [["[\"fused_conv1x1\", 1, 14, 14, 1024, 16, 64]", "cuda -keys=cuda,gpu -max_num_threads=1024 -model=unknown -thread_warp_size=32", [-1, 16, 64, 49152, 2147483647, 1024, 8, 32], "", 0, []], [[], [["CHW", 2, "local"], ["SP", 2, 0, 1, [1, 1, 1, 1], 1], ["SP", 2, 5, 64, [1, 8, 4, 2], 1], ["SP", 2, 10, 14, [1, 14, 1, 1], 1], ["SP", 2, 15, 14, [7, 1, 1, 1], 1], ["SP", 2, 20, 16, [1, 2, 2, 1], 1], ["SP", 2, 25, 1024, [16, 2], 1], ["RE", 2, [0, 5, 10, 15, 20, 1, 6, 11, 16, 21, 2, 7, 12, 17, 22, 25, 26, 3, 8, 13, 18, 23, 27, 4, 9, 14, 19, 24]], ["FSP", 3, 0, 1, 3], ["FSP", 3, 4, 2, 3], ["FSP", 3, 8, 3, 3], ["FSP", 3, 12, 4, 3], ["FSP", 3, 16, 5, 3], ["RE", 3, [0, 4, 8, 12, 16, 1, 5, 9, 13, 17, 2, 6, 10, 14, 18, 3, 7, 11, 15, 19]], ["CA", 2, 3, 14], ["CHR", 1, "shared", [2]], ["CA", 2, 3, 15], ["CHR", 0, "shared", [3]], ["CA", 1, 4, 15], ["FU", 5, [0, 1, 2, 3, 4]], ["AN", 5, 0, 5], ["FU", 5, [1, 2, 3, 4, 5]], ["AN", 5, 1, 4], ["FU", 5, [2, 3, 4, 5, 6]], ["AN", 5, 2, 6], ["FU", 3, [0, 1, 2]], ["SP", 3, 0, 512, [1], 1], ["AN", 3, 1, 2], ["FFSP", 3, 0, [5, 4, 3, 2, 1], 1, 1], ["AN", 3, 1, 6], ["FU", 1, [0, 1, 2, 3]], ["SP", 1, 0, 64, [1], 1], ["AN", 1, 1, 2], ["FFSP", 1, 0, [5, 4, 3, 2, 1], 1, 1], ["AN", 1, 1, 6], ["PR", 4, 0, "auto_unroll_max_step$1024"]]]], "r": [[0.000547094, 0.00054713, 0.000547003, 0.000546946, 0.000546977, 0.000547119, 0.000547159, 0.000546856, 0.000546949, 0.000546883], 0, 140.669, 1649549220], "v": "v0.6"}
{"i": [["[\"fused_conv1x1\", 1, 14, 14, 1024, 16, 64]", "cuda -keys=cuda,gpu -max_num_threads=1024 -model=unknown -thread_warp_size=32", [-1, 16, 64, 49152, 2147483647, 1024, 8, 32], "", 0, []], [[], [["CHW", 2, "local"], ["SP", 2, 0, 1, [1, 1, 1, 1], 1], ["SP", 2, 5, 64, [1, 4, 2, 1], 1], ["SP", 2, 10, 14, [1, 1, 1, 1], 1], ["SP", 2, 15, 14, [1, 1, 1, 7], 1], ["SP", 2, 20, 16, [1, 4, 1, 4], 1], ["SP", 2, 25, 1024, [2, 8], 1], ["RE", 2, [0, 5, 10, 15, 20, 1, 6, 11, 16, 21, 2, 7, 12, 17, 22, 25, 26, 3, 8, 13, 18, 23, 27, 4, 9, 14, 19, 24]], ["FSP", 3, 0, 1, 3], ["FSP", 3, 4, 2, 3], ["FSP", 3, 8, 3, 3], ["FSP", 3, 12, 4, 3], ["FSP", 3, 16, 5, 3], ["RE", 3, [0, 4, 8, 12, 16, 1, 5, 9, 13, 17, 2, 6, 10, 14, 18, 3, 7, 11, 15, 19]], ["CA", 2, 3, 14], ["CHR", 1, "shared", [2]], ["CA", 2, 3, 15], ["CHR", 0, "shared", [3]], ["CA", 1, 4, 15], ["FU", 5, [0, 1, 2, 3, 4]], ["AN", 5, 0, 5], ["FU", 5, [1, 2, 3, 4, 5]], ["AN", 5, 1, 4], ["FU", 5, [2, 3, 4, 5, 6]], ["AN", 5, 2, 6], ["FU", 3, [0, 1, 2]], ["SP", 3, 0, 128, [1], 1], ["AN", 3, 1, 2], ["FFSP", 3, 0, [5, 4, 3, 2, 1], 1, 1], ["AN", 3, 1, 6], ["FU", 1, [0, 1, 2, 3]], ["SP", 1, 0, 112, [1], 1], ["AN", 1, 1, 2], ["FFSP", 1, 0, [5, 4, 3, 2, 1], 1, 1], ["AN", 1, 1, 6], ["PR", 4, 0, "auto_unroll_max_step$1024"]]]], "r": [[0.000161065, 0.000161089, 0.000161103, 0.000161089, 0.000161093, 0.000161075, 0.000161074, 0.00016102, 0.000161041, 0.000161112], 0, 150.958, 1649549229], "v": "v0.6"}
{"i": [["[\"fused_conv1x1\", 1, 14, 14, 1024, 16, 64]", "cuda -keys=cuda,gpu -max_num_threads=1024 -model=unknown -thread_warp_size=32", [-1, 16, 64, 49152, 2147483647, 1024, 8, 32], "", 0, []], [[], [["CHW", 2, "local"], ["SP", 2, 0, 1, [1, 1, 1, 1], 1], ["SP", 2, 5, 64, [2, 1, 1, 32], 1], ["SP", 2, 10, 14, [1, 14, 1, 1], 1], ["SP", 2, 15, 14, [2, 7, 1, 1], 1], ["SP", 2, 20, 16, [1, 4, 2, 1], 1], ["SP", 2, 25, 1024, [2, 2], 1], ["RE", 2, [0, 5, 10, 15, 20, 1, 6, 11, 16, 21, 2, 7, 12, 17, 22, 25, 26, 3, 8, 13, 18, 23, 27, 4, 9, 14, 19, 24]], ["FSP", 3, 0, 1, 3], ["FSP", 3, 4, 2, 3], ["FSP", 3, 8, 3, 3], ["FSP", 3, 12, 4, 3], ["FSP", 3, 16, 5, 3], ["RE", 3, [0, 4, 8, 12, 16, 1, 5, 9, 13, 17, 2, 6, 10, 14, 18, 3, 7, 11, 15, 19]], ["CA", 2, 3, 14], ["CHR", 1, "shared", [2]], ["CA", 2, 3, 15], ["CHR", 0, "shared", [3]], ["CA", 1, 4, 15], ["FU", 5, [0, 1, 2, 3, 4]], ["AN", 5, 0, 5], ["FU", 5, [1, 2, 3, 4, 5]], ["AN", 5, 1, 4], ["FU", 5, [2, 3, 4, 5, 6]], ["AN", 5, 2, 6], ["FU", 3, [0, 1, 2]], ["SP", 3, 0, 256, [4], 1], ["AN", 3, 1, 2], ["FFSP", 3, 0, [5, 4, 3, 2, 1], 1, 1], ["AN", 3, 1, 6], ["FU", 1, [0, 1, 2, 3]], ["SP", 1, 0, 4, [1], 1], ["AN", 1, 1, 2], ["FFSP", 1, 0, [5, 4, 3, 2, 1], 1, 1], ["AN", 1, 1, 6], ["PR", 4, 0, "auto_unroll_max_step$1024"]]]], "r": [[0.0125921, 0.0125891, 0.0125861, 0.01259, 0.0125904, 0.0125925, 0.0125884, 0.0125888, 0.0125867, 0.0125861], 0, 146.171, 1649549224], "v": "v0.6"}
{"i": [["[\"fused_conv1x1\", 1, 14, 14, 1024, 16, 64]", "cuda -keys=cuda,gpu -max_num_threads=1024 -model=unknown -thread_warp_size=32", [-1, 16, 64, 49152, 2147483647, 1024, 8, 32], "", 0, []], [[], [["CHW", 2, "local"], ["SP", 2, 0, 1, [1, 1, 1, 1], 1], ["SP", 2, 5, 64, [1, 4, 8, 1], 1], ["SP", 2, 10, 14, [1, 7, 2, 1], 1], ["SP", 2, 15, 14, [1, 2, 1, 7], 1], ["SP", 2, 20, 16, [1, 1, 2, 4], 1], ["SP", 2, 25, 1024, [4, 1], 1], ["RE", 2, [0, 5, 10, 15, 20, 1, 6, 11, 16, 21, 2, 7, 12, 17, 22, 25, 26, 3, 8, 13, 18, 23, 27, 4, 9, 14, 19, 24]], ["FSP", 3, 0, 1, 3], ["FSP", 3, 4, 2, 3], ["FSP", 3, 8, 3, 3], ["FSP", 3, 12, 4, 3], ["FSP", 3, 16, 5, 3], ["RE", 3, [0, 4, 8, 12, 16, 1, 5, 9, 13, 17, 2, 6, 10, 14, 18, 3, 7, 11, 15, 19]], ["CA", 2, 3, 14], ["CHR", 1, "shared", [2]], ["CA", 2, 3, 15], ["CHR", 0, "shared", [3]], ["CA", 1, 4, 15], ["FU", 5, [0, 1, 2, 3, 4]], ["AN", 5, 0, 5], ["FU", 5, [1, 2, 3, 4, 5]], ["AN", 5, 1, 4], ["FU", 5, [2, 3, 4, 5, 6]], ["AN", 5, 2, 6], ["FU", 3, [0, 1, 2]], ["SP", 3, 0, 256, [1], 1], ["AN", 3, 1, 2], ["FFSP", 3, 0, [5, 4, 3, 2, 1], 1, 1], ["AN", 3, 1, 6], ["FU", 1, [0, 1, 2, 3]], ["SP", 1, 0, 8, [1], 1], ["AN", 1, 1, 2], ["FFSP", 1, 0, [5, 4, 3, 2, 1], 1, 1], ["AN", 1, 1, 6], ["PR", 4, 0, "auto_unroll_max_step$16"]]]], "r": [[0.0157469, 0.0157452, 0.0157458, 0.0157475, 0.0157473, 0.0157443, 0.0157432, 0.0157471, 0.0157435, 0.015746], 0, 159.213, 1649549239], "v": "v0.6"}
{"i": [["[\"fused_conv1x1\", 1, 14, 14, 1024, 16, 64]", "cuda -keys=cuda,gpu -max_num_threads=1024 -model=unknown -thread_warp_size=32", [-1, 16, 64, 49152, 2147483647, 1024, 8, 32], "", 0, []], [[], [["CHW", 2, "local"], ["SP", 2, 0, 1, [1, 1, 1, 1], 1], ["SP", 2, 5, 64, [1, 4, 2, 1], 1], ["SP", 2, 10, 14, [1, 2, 7, 1], 1], ["SP", 2, 15, 14, [1, 1, 2, 7], 1], ["SP", 2, 20, 16, [2, 1, 4, 2], 1], ["SP", 2, 25, 1024, [1, 1], 1], ["RE", 2, [0, 5, 10, 15, 20, 1, 6, 11, 16, 21, 2, 7, 12, 17, 22, 25, 26, 3, 8, 13, 18, 23, 27, 4, 9, 14, 19, 24]], ["FSP", 3, 0, 1, 3], ["FSP", 3, 4, 2, 3], ["FSP", 3, 8, 3, 3], ["FSP", 3, 12, 4, 3], ["FSP", 3, 16, 5, 3], ["RE", 3, [0, 4, 8, 12, 16, 1, 5, 9, 13, 17, 2, 6, 10, 14, 18, 3, 7, 11, 15, 19]], ["CA", 2, 3, 14], ["CHR", 1, "shared", [2]], ["CA", 2, 3, 15], ["CHR", 0, "shared", [3]], ["CA", 1, 4, 15], ["FU", 5, [0, 1, 2, 3, 4]], ["AN", 5, 0, 5], ["FU", 5, [1, 2, 3, 4, 5]], ["AN", 5, 1, 4], ["FU", 5, [2, 3, 4, 5, 6]], ["AN", 5, 2, 6], ["FU", 3, [0, 1, 2]], ["SP", 3, 0, 32, [1], 1], ["AN", 3, 1, 2], ["FFSP", 3, 0, [5, 4, 3, 2, 1], 1, 1], ["AN", 3, 1, 6], ["FU", 1, [0, 1, 2, 3]], ["SP", 1, 0, 28, [1], 1], ["AN", 1, 1, 2], ["FFSP", 1, 0, [5, 4, 3, 2, 1], 1, 1], ["AN", 1, 1, 6], ["PR", 4, 0, "auto_unroll_max_step$512"]]]], "r": [[0.0305028, 0.0305162, 0.0305039, 0.0305184, 0.0305051, 0.0305202, 0.030503, 0.0305179, 0.0305032, 0.0305168], 0, 184.918, 1649549263], "v": "v0.6"}
{"i": [["[\"fused_conv1x1\", 1, 14, 14, 1024, 16, 64]", "cuda -keys=cuda,gpu -max_num_threads=1024 -model=unknown -thread_warp_size=32", [-1, 16, 64, 49152, 2147483647, 1024, 8, 32], "", 0, []], [[], [["CHW", 2, "local"], ["SP", 2, 0, 1, [1, 1, 1, 1], 1], ["SP", 2, 5, 64, [4, 4, 4, 1], 1], ["SP", 2, 10, 14, [1, 2, 1, 1], 1], ["SP", 2, 15, 14, [1, 7, 1, 1], 1], ["SP", 2, 20, 16, [1, 1, 1, 8], 1], ["SP", 2, 25, 1024, [4, 1], 1], ["RE", 2, [0, 5, 10, 15, 20, 1, 6, 11, 16, 21, 2, 7, 12, 17, 22, 25, 26, 3, 8, 13, 18, 23, 27, 4, 9, 14, 19, 24]], ["FSP", 3, 0, 1, 3], ["FSP", 3, 4, 2, 3], ["FSP", 3, 8, 3, 3], ["FSP", 3, 12, 4, 3], ["FSP", 3, 16, 5, 3], ["RE", 3, [0, 4, 8, 12, 16, 1, 5, 9, 13, 17, 2, 6, 10, 14, 18, 3, 7, 11, 15, 19]], ["CA", 2, 3, 14], ["CHR", 1, "shared", [2]], ["CA", 2, 3, 15], ["CHR", 0, "shared", [3]], ["CA", 1, 4, 15], ["FU", 5, [0, 1, 2, 3, 4]], ["AN", 5, 0, 5], ["FU", 5, [1, 2, 3, 4, 5]], ["AN", 5, 1, 4], ["FU", 5, [2, 3, 4, 5, 6]], ["AN", 5, 2, 6], ["FU", 3, [0, 1, 2]], ["SP", 3, 0, 256, [1], 1], ["AN", 3, 1, 2], ["FFSP", 3, 0, [5, 4, 3, 2, 1], 1, 1], ["AN", 3, 1, 6], ["FU", 1, [0, 1, 2, 3]], ["SP", 1, 0, 16, [1], 1], ["AN", 1, 1, 2], ["FFSP", 1, 0, [5, 4, 3, 2, 1], 1, 1], ["AN", 1, 1, 6], ["PR", 4, 0, "auto_unroll_max_step$512"]]]], "r": [[0.00043385, 0.000433806, 0.000433883, 0.000433881, 0.000433782, 0.000433844, 0.000434085, 0.000433792, 0.0004337, 0.000433763], 0, 169.282, 1649549248], "v": "v0.6"}
{"i": [["[\"fused_conv1x1\", 1, 14, 14, 1024, 16, 64]", "cuda -keys=cuda,gpu -max_num_threads=1024 -model=unknown -thread_warp_size=32", [-1, 16, 64, 49152, 2147483647, 1024, 8, 32], "", 0, []], [[], [["CHW", 2, "local"], ["SP", 2, 0, 1, [1, 1, 1, 1], 1], ["SP", 2, 5, 64, [4, 4, 1, 1], 1], ["SP", 2, 10, 14, [1, 7, 1, 2], 1], ["SP", 2, 15, 14, [1, 1, 14, 1], 1], ["SP", 2, 20, 16, [1, 8, 2, 1], 1], ["SP", 2, 25, 1024, [2, 1], 1], ["RE", 2, [0, 5, 10, 15, 20, 1, 6, 11, 16, 21, 2, 7, 12, 17, 22, 25, 26, 3, 8, 13, 18, 23, 27, 4, 9, 14, 19, 24]], ["FSP", 3, 0, 1, 3], ["FSP", 3, 4, 2, 3], ["FSP", 3, 8, 3, 3], ["FSP", 3, 12, 4, 3], ["FSP", 3, 16, 5, 3], ["RE", 3, [0, 4, 8, 12, 16, 1, 5, 9, 13, 17, 2, 6, 10, 14, 18, 3, 7, 11, 15, 19]], ["CA", 2, 3, 14], ["CHR", 1, "shared", [2]], ["CA", 2, 3, 15], ["CHR", 0, "shared", [3]], ["CA", 1, 4, 15], ["FU", 5, [0, 1, 2, 3, 4]], ["AN", 5, 0, 5], ["FU", 5, [1, 2, 3, 4, 5]], ["AN", 5, 1, 4], ["FU", 5, [2, 3, 4, 5, 6]], ["AN", 5, 2, 6], ["FU", 3, [0, 1, 2]], ["SP", 3, 0, 4, [2], 1], ["AN", 3, 1, 2], ["FFSP", 3, 0, [5, 4, 3, 2, 1], 1, 1], ["AN", 3, 1, 6], ["FU", 1, [0, 1, 2, 3]], ["SP", 1, 0, 56, [1], 1], ["AN", 1, 1, 2], ["FFSP", 1, 0, [5, 4, 3, 2, 1], 1, 1], ["AN", 1, 1, 6], ["PR", 4, 0, "auto_unroll_max_step$1024"]]]], "r": [[0.00096948, 0.000969269, 0.000969051, 0.000969309, 0.000968946, 0.000969122, 0.000968878, 0.000968726, 0.000969337, 0.000968887], 0, 174.683, 1649549254], "v": "v0.6"}
{"i": [["[\"fused_conv1x1\", 1, 14, 14, 1024, 16, 64]", "cuda -keys=cuda,gpu -max_num_threads=1024 -model=unknown -thread_warp_size=32", [-1, 16, 64, 49152, 2147483647, 1024, 8, 32], "", 0, []], [[], [["CHW", 2, "local"], ["SP", 2, 0, 1, [1, 1, 1, 1], 1], ["SP", 2, 5, 64, [1, 4, 8, 1], 1], ["SP", 2, 10, 14, [2, 7, 1, 1], 1], ["SP", 2, 15, 14, [1, 2, 1, 1], 1], ["SP", 2, 20, 16, [1, 1, 2, 4], 1], ["SP", 2, 25, 1024, [4, 1], 1], ["RE", 2, [0, 5, 10, 15, 20, 1, 6, 11, 16, 21, 2, 7, 12, 17, 22, 25, 26, 3, 8, 13, 18, 23, 27, 4, 9, 14, 19, 24]], ["FSP", 3, 0, 1, 3], ["FSP", 3, 4, 2, 3], ["FSP", 3, 8, 3, 3], ["FSP", 3, 12, 4, 3], ["FSP", 3, 16, 5, 3], ["RE", 3, [0, 4, 8, 12, 16, 1, 5, 9, 13, 17, 2, 6, 10, 14, 18, 3, 7, 11, 15, 19]], ["CA", 2, 3, 14], ["CHR", 1, "shared", [2]], ["CA", 2, 3, 15], ["CHR", 0, "shared", [3]], ["CA", 1, 4, 15], ["FU", 5, [0, 1, 2, 3, 4]], ["AN", 5, 0, 5], ["FU", 5, [1, 2, 3, 4, 5]], ["AN", 5, 1, 4], ["FU", 5, [2, 3, 4, 5, 6]], ["AN", 5, 2, 6], ["FU", 3, [0, 1, 2]], ["SP", 3, 0, 256, [1], 1], ["AN", 3, 1, 2], ["FFSP", 3, 0, [5, 4, 3, 2, 1], 1, 1], ["AN", 3, 1, 6], ["FU", 1, [0, 1, 2, 3]], ["SP", 1, 0, 8, [1], 1], ["AN", 1, 1, 2], ["FFSP", 1, 0, [5, 4, 3, 2, 1], 1, 1], ["AN", 1, 1, 6], ["PR", 4, 0, "auto_unroll_max_step$16"]]]], "r": [[0.000440663, 0.00044041, 0.000440485, 0.000440543, 0.000440741, 0.000440812, 0.000440815, 0.000440567, 0.00044099, 0.000440699], 0, 179.341, 1649549259], "v": "v0.6"}
{"i": [["[\"fused_conv1x1\", 1, 14, 14, 1024, 16, 64]", "cuda -keys=cuda,gpu -max_num_threads=1024 -model=unknown -thread_warp_size=32", [-1, 16, 64, 49152, 2147483647, 1024, 8, 32], "", 0, []], [[], [["CHW", 2, "local"], ["SP", 2, 0, 1, [1, 1, 1, 1], 1], ["SP", 2, 5, 64, [2, 8, 1, 1], 1], ["SP", 2, 10, 14, [2, 1, 1, 1], 1], ["SP", 2, 15, 14, [1, 7, 2, 1], 1], ["SP", 2, 20, 16, [1, 1, 1, 16], 1], ["SP", 2, 25, 1024, [4, 8], 1], ["RE", 2, [0, 5, 10, 15, 20, 1, 6, 11, 16, 21, 2, 7, 12, 17, 22, 25, 26, 3, 8, 13, 18, 23, 27, 4, 9, 14, 19, 24]], ["FSP", 3, 0, 1, 3], ["FSP", 3, 4, 2, 3], ["FSP", 3, 8, 3, 3], ["FSP", 3, 12, 4, 3], ["FSP", 3, 16, 5, 3], ["RE", 3, [0, 4, 8, 12, 16, 1, 5, 9, 13, 17, 2, 6, 10, 14, 18, 3, 7, 11, 15, 19]], ["CA", 2, 3, 14], ["CHR", 1, "shared", [2]], ["CA", 2, 3, 15], ["CHR", 0, "shared", [3]], ["CA", 1, 4, 15], ["FU", 5, [0, 1, 2, 3, 4]], ["AN", 5, 0, 5], ["FU", 5, [1, 2, 3, 4, 5]], ["AN", 5, 1, 4], ["FU", 5, [2, 3, 4, 5, 6]], ["AN", 5, 2, 6], ["FU", 3, [0, 1, 2]], ["SP", 3, 0, 512, [4], 1], ["AN", 3, 1, 2], ["FFSP", 3, 0, [5, 4, 3, 2, 1], 1, 1], ["AN", 3, 1, 6], ["FU", 1, [0, 1, 2, 3]], ["SP", 1, 0, 64, [1], 1], ["AN", 1, 1, 2], ["FFSP", 1, 0, [5, 4, 3, 2, 1], 1, 1], ["AN", 1, 1, 6], ["PR", 4, 0, "auto_unroll_max_step$512"]]]], "r": [[0.000386228, 0.000386362, 0.000386439, 0.000386563, 0.000386332, 0.000386353, 0.000386321, 0.000386371, 0.000386442, 0.000386369], 0, 195.42, 1649549273], "v": "v0.6"}
{"i": [["[\"fused_conv1x1\", 1, 14, 14, 1024, 16, 64]", "cuda -keys=cuda,gpu -max_num_threads=1024 -model=unknown -thread_warp_size=32", [-1, 16, 64, 49152, 2147483647, 1024, 8, 32], "", 0, []], [[], [["CHW", 2, "local"], ["SP", 2, 0, 1, [1, 1, 1, 1], 1], ["SP", 2, 5, 64, [2, 2, 1, 2], 1], ["SP", 2, 10, 14, [1, 7, 2, 1], 1], ["SP", 2, 15, 14, [1, 1, 1, 14], 1], ["SP", 2, 20, 16, [1, 2, 2, 4], 1], ["SP", 2, 25, 1024, [2, 16], 1], ["RE", 2, [0, 5, 10, 15, 20, 1, 6, 11, 16, 21, 2, 7, 12, 17, 22, 25, 26, 3, 8, 13, 18, 23, 27, 4, 9, 14, 19, 24]], ["FSP", 3, 0, 1, 3], ["FSP", 3, 4, 2, 3], ["FSP", 3, 8, 3, 3], ["FSP", 3, 12, 4, 3], ["FSP", 3, 16, 5, 3], ["RE", 3, [0, 4, 8, 12, 16, 1, 5, 9, 13, 17, 2, 6, 10, 14, 18, 3, 7, 11, 15, 19]], ["CA", 2, 3, 14], ["CHR", 1, "shared", [2]], ["CA", 2, 3, 15], ["CHR", 0, "shared", [3]], ["CA", 1, 4, 15], ["FU", 5, [0, 1, 2, 3, 4]], ["AN", 5, 0, 5], ["FU", 5, [1, 2, 3, 4, 5]], ["AN", 5, 1, 4], ["FU", 5, [2, 3, 4, 5, 6]], ["AN", 5, 2, 6], ["FU", 3, [0, 1, 2]], ["SP", 3, 0, 512, [1], 1], ["AN", 3, 1, 2], ["FFSP", 3, 0, [5, 4, 3, 2, 1], 1, 1], ["AN", 3, 1, 6], ["FU", 1, [0, 1, 2, 3]], ["SP", 1, 0, 128, [1], 1], ["AN", 1, 1, 2], ["FFSP", 1, 0, [5, 4, 3, 2, 1], 1, 1], ["AN", 1, 1, 6], ["PR", 4, 0, "auto_unroll_max_step$64"]]]], "r": [[0.00286155, 0.00286157, 0.00286157, 0.00286155, 0.00286162, 0.00286171, 0.00286177, 0.00286168, 0.00286168, 0.00286154], 0, 197.642, 1649549276], "v": "v0.6"}
{"i": [["[\"fused_conv1x1\", 1, 14, 14, 1024, 16, 64]", "cuda -keys=cuda,gpu -max_num_threads=1024 -model=unknown -thread_warp_size=32", [-1, 16, 64, 49152, 2147483647, 1024, 8, 32], "", 0, []], [[], [["CHW", 2, "local"], ["SP", 2, 0, 1, [1, 1, 1, 1], 1], ["SP", 2, 5, 64, [4, 4, 1, 2], 1], ["SP", 2, 10, 14, [1, 1, 14, 1], 1], ["SP", 2, 15, 14, [1, 1, 1, 14], 1], ["SP", 2, 20, 16, [1, 1, 1, 2], 1], ["SP", 2, 25, 1024, [16, 1], 1], ["RE", 2, [0, 5, 10, 15, 20, 1, 6, 11, 16, 21, 2, 7, 12, 17, 22, 25, 26, 3, 8, 13, 18, 23, 27, 4, 9, 14, 19, 24]], ["FSP", 3, 0, 1, 3], ["FSP", 3, 4, 2, 3], ["FSP", 3, 8, 3, 3], ["FSP", 3, 12, 4, 3], ["FSP", 3, 16, 5, 3], ["RE", 3, [0, 4, 8, 12, 16, 1, 5, 9, 13, 17, 2, 6, 10, 14, 18, 3, 7, 11, 15, 19]], ["CA", 2, 3, 14], ["CHR", 1, "shared", [2]], ["CA", 2, 3, 15], ["CHR", 0, "shared", [3]], ["CA", 1, 4, 15], ["FU", 5, [0, 1, 2, 3, 4]], ["AN", 5, 0, 5], ["FU", 5, [1, 2, 3, 4, 5]], ["AN", 5, 1, 4], ["FU", 5, [2, 3, 4, 5, 6]], ["AN", 5, 2, 6], ["FU", 3, [0, 1, 2]], ["SP", 3, 0, 64, [1], 1], ["AN", 3, 1, 2], ["FFSP", 3, 0, [5, 4, 3, 2, 1], 1, 1], ["AN", 3, 1, 6], ["FU", 1, [0, 1, 2, 3]], ["SP", 1, 0, 224, [1], 1], ["AN", 1, 1, 2], ["FFSP", 1, 0, [5, 4, 3, 2, 1], 1, 1], ["AN", 1, 1, 6], ["PR", 4, 0, "auto_unroll_max_step$64"]]]], "r": [[0.0201389, 0.0201363, 0.0201329, 0.0201305, 0.0201299, 0.0201371, 0.0201417, 0.0201217, 0.0201319, 0.0201368], 0, 187.667, 1649549267], "v": "v0.6"}
{"i": [["[\"fused_conv1x1\", 1, 14, 14, 1024, 16, 64]", "cuda -keys=cuda,gpu -max_num_threads=1024 -model=unknown -thread_warp_size=32", [-1, 16, 64, 49152, 2147483647, 1024, 8, 32], "", 0, []], [[], [["CHW", 2, "local"], ["SP", 2, 0, 1, [1, 1, 1, 1], 1], ["SP", 2, 5, 64, [1, 8, 1, 1], 1], ["SP", 2, 10, 14, [1, 2, 7, 1], 1], ["SP", 2, 15, 14, [1, 7, 2, 1], 1], ["SP", 2, 20, 16, [2, 1, 4, 2], 1], ["SP", 2, 25, 1024, [1, 2], 1], ["RE", 2, [0, 5, 10, 15, 20, 1, 6, 11, 16, 21, 2, 7, 12, 17, 22, 25, 26, 3, 8, 13, 18, 23, 27, 4, 9, 14, 19, 24]], ["FSP", 3, 0, 1, 3], ["FSP", 3, 4, 2, 3], ["FSP", 3, 8, 3, 3], ["FSP", 3, 12, 4, 3], ["FSP", 3, 16, 5, 3], ["RE", 3, [0, 4, 8, 12, 16, 1, 5, 9, 13, 17, 2, 6, 10, 14, 18, 3, 7, 11, 15, 19]], ["CA", 2, 3, 14], ["CHR", 1, "shared", [2]], ["CA", 2, 3, 15], ["CHR", 0, "shared", [3]], ["CA", 1, 4, 15], ["FU", 5, [0, 1, 2, 3, 4]], ["AN", 5, 0, 5], ["FU", 5, [1, 2, 3, 4, 5]], ["AN", 5, 1, 4], ["FU", 5, [2, 3, 4, 5, 6]], ["AN", 5, 2, 6], ["FU", 3, [0, 1, 2]], ["SP", 3, 0, 32, [1], 1], ["AN", 3, 1, 2], ["FFSP", 3, 0, [5, 4, 3, 2, 1], 1, 1], ["AN", 3, 1, 6], ["FU", 1, [0, 1, 2, 3]], ["SP", 1, 0, 28, [1], 1], ["AN", 1, 1, 2], ["FFSP", 1, 0, [5, 4, 3, 2, 1], 1, 1], ["AN", 1, 1, 6], ["PR", 4, 0, "auto_unroll_max_step$1024"]]]], "r": [[0.000694765, 0.000694852, 0.000694727, 0.0006949, 0.000694818, 0.000694881, 0.00069506, 0.000695033, 0.000694965, 0.000694969], 0, 198.262, 1649549282], "v": "v0.6"}
{"i": [["[\"fused_conv1x1\", 1, 14, 14, 1024, 16, 64]", "cuda -keys=cuda,gpu -max_num_threads=1024 -model=unknown -thread_warp_size=32", [-1, 16, 64, 49152, 2147483647, 1024, 8, 32], "", 0, []], [[], [["CHW", 2, "local"], ["SP", 2, 0, 1, [1, 1, 1, 1], 1], ["SP", 2, 5, 64, [1, 8, 4, 2], 1], ["SP", 2, 10, 14, [1, 14, 1, 1], 1], ["SP", 2, 15, 14, [1, 1, 2, 7], 1], ["SP", 2, 20, 16, [1, 8, 2, 1], 1], ["SP", 2, 25, 1024, [4, 1], 1], ["RE", 2, [0, 5, 10, 15, 20, 1, 6, 11, 16, 21, 2, 7, 12, 17, 22, 25, 26, 3, 8, 13, 18, 23, 27, 4, 9, 14, 19, 24]], ["FSP", 3, 0, 1, 3], ["FSP", 3, 4, 2, 3], ["FSP", 3, 8, 3, 3], ["FSP", 3, 12, 4, 3], ["FSP", 3, 16, 5, 3], ["RE", 3, [0, 4, 8, 12, 16, 1, 5, 9, 13, 17, 2, 6, 10, 14, 18, 3, 7, 11, 15, 19]], ["CA", 2, 3, 14], ["CHR", 1, "shared", [2]], ["CA", 2, 3, 15], ["CHR", 0, "shared", [3]], ["CA", 1, 4, 15], ["FU", 5, [0, 1, 2, 3, 4]], ["AN", 5, 0, 5], ["FU", 5, [1, 2, 3, 4, 5]], ["AN", 5, 1, 4], ["FU", 5, [2, 3, 4, 5, 6]], ["AN", 5, 2, 6], ["FU", 3, [0, 1, 2]], ["SP", 3, 0, 64, [1], 1], ["AN", 3, 1, 2], ["FFSP", 3, 0, [5, 4, 3, 2, 1], 1, 1], ["AN", 3, 1, 6], ["FU", 1, [0, 1, 2, 3]], ["SP", 1, 0, 56, [1], 1], ["AN", 1, 1, 2], ["FFSP", 1, 0, [5, 4, 3, 2, 1], 1, 1], ["AN", 1, 1, 6], ["PR", 4, 0, "auto_unroll_max_step$512"]]]], "r": [[0.0193744, 0.0193745, 0.0193747, 0.019374, 0.0193749, 0.0193755, 0.0193759, 0.0193745, 0.0193742, 0.0193752], 0, 195.654, 1649549286], "v": "v0.6"}
{"i": [["[\"fused_conv1x1\", 1, 14, 14, 1024, 16, 64]", "cuda -keys=cuda,gpu -max_num_threads=1024 -model=unknown -thread_warp_size=32", [-1, 16, 64, 49152, 2147483647, 1024, 8, 32], "", 0, []], [[], [["CHW", 2, "local"], ["SP", 2, 0, 1, [1, 1, 1, 1], 1], ["SP", 2, 5, 64, [2, 4, 1, 8], 1], ["SP", 2, 10, 14, [1, 1, 1, 1], 1], ["SP", 2, 15, 14, [1, 7, 1, 1], 1], ["SP", 2, 20, 16, [1, 2, 2, 4], 1], ["SP", 2, 25, 1024, [2, 2], 1], ["RE", 2, [0, 5, 10, 15, 20, 1, 6, 11, 16, 21, 2, 7, 12, 17, 22, 25, 26, 3, 8, 13, 18, 23, 27, 4, 9, 14, 19, 24]], ["FSP", 3, 0, 1, 3], ["FSP", 3, 4, 2, 3], ["FSP", 3, 8, 3, 3], ["FSP", 3, 12, 4, 3], ["FSP", 3, 16, 5, 3], ["RE", 3, [0, 4, 8, 12, 16, 1, 5, 9, 13, 17, 2, 6, 10, 14, 18, 3, 7, 11, 15, 19]], ["CA", 2, 3, 14], ["CHR", 1, "shared", [2]], ["CA", 2, 3, 15], ["CHR", 0, "shared", [3]], ["CA", 1, 4, 15], ["FU", 5, [0, 1, 2, 3, 4]], ["AN", 5, 0, 5], ["FU", 5, [1, 2, 3, 4, 5]], ["AN", 5, 1, 4], ["FU", 5, [2, 3, 4, 5, 6]], ["AN", 5, 2, 6], ["FU", 3, [0, 1, 2]], ["SP", 3, 0, 256, [4], 1], ["AN", 3, 1, 2], ["FFSP", 3, 0, [5, 4, 3, 2, 1], 1, 1], ["AN", 3, 1, 6], ["FU", 1, [0, 1, 2, 3]], ["SP", 1, 0, 4, [2], 1], ["AN", 1, 1, 2], ["FFSP", 1, 0, [5, 4, 3, 2, 1], 1, 1], ["AN", 1, 1, 6], ["PR", 4, 0, "auto_unroll_max_step$512"]]]], "r": [[0.000613598, 0.000613563, 0.000613755, 0.000613684, 0.000613854, 0.000613627, 0.000613537, 0.000613648, 0.00061357, 0.000613608], 0, 198.686, 1649549292], "v": "v0.6"}
{"i": [["[\"fused_conv1x1\", 1, 14, 14, 1024, 16, 64]", "cuda -keys=cuda,gpu -max_num_threads=1024 -model=unknown -thread_warp_size=32", [-1, 16, 64, 49152, 2147483647, 1024, 8, 32], "", 0, []], [[], [["CHW", 2, "local"], ["SP", 2, 0, 1, [1, 1, 1, 1], 1], ["SP", 2, 5, 64, [1, 64, 1, 1], 1], ["SP", 2, 10, 14, [1, 1, 2, 1], 1], ["SP", 2, 15, 14, [1, 1, 1, 14], 1], ["SP", 2, 20, 16, [2, 1, 1, 4], 1], ["SP", 2, 25, 1024, [1, 4], 1], ["RE", 2, [0, 5, 10, 15, 20, 1, 6, 11, 16, 21, 2, 7, 12, 17, 22, 25, 26, 3, 8, 13, 18, 23, 27, 4, 9, 14, 19, 24]], ["FSP", 3, 0, 1, 3], ["FSP", 3, 4, 2, 3], ["FSP", 3, 8, 3, 3], ["FSP", 3, 12, 4, 3], ["FSP", 3, 16, 5, 3], ["RE", 3, [0, 4, 8, 12, 16, 1, 5, 9, 13, 17, 2, 6, 10, 14, 18, 3, 7, 11, 15, 19]], ["CA", 2, 3, 14], ["CHR", 1, "shared", [2]], ["CA", 2, 3, 15], ["CHR", 0, "shared", [3]], ["CA", 1, 4, 15], ["FU", 5, [0, 1, 2, 3, 4]], ["AN", 5, 0, 5], ["FU", 5, [1, 2, 3, 4, 5]], ["AN", 5, 1, 4], ["FU", 5, [2, 3, 4, 5, 6]], ["AN", 5, 2, 6], ["FU", 3, [0, 1, 2]], ["SP", 3, 0, 16, [1], 1], ["AN", 3, 1, 2], ["FFSP", 3, 0, [5, 4, 3, 2, 1], 1, 1], ["AN", 3, 1, 6], ["FU", 1, [0, 1, 2, 3]], ["SP", 1, 0, 8, [1], 1], ["AN", 1, 1, 2], ["FFSP", 1, 0, [5, 4, 3, 2, 1], 1, 1], ["AN", 1, 1, 6], ["PR", 4, 0, "auto_unroll_max_step$512"]]]], "r": [[0.000706301, 0.000705968, 0.000706167, 0.000706202, 0.000706393, 0.000706105, 0.000706291, 0.000706086, 0.000705762, 0.00070581], 0, 197.955, 1649549297], "v": "v0.6"}
