python/models/resnext/kernel_configs/resnext_imagenet_50_fused_conv3x3_1_56_56_8_8_3.log
{"i": [["[\"fused_conv3x3\", 1, 56, 56, 8, 8, 3, 3, 64]", "cuda -keys=cuda,gpu -max_num_threads=1024 -model=unknown -thread_warp_size=32", [-1, 16, 64, 49152, 2147483647, 1024, 8, 32], "", 0, []], [[], [["CHW", 3, "local"], ["SP", 3, 0, 1, [1, 1, 1, 1], 1], ["SP", 3, 5, 64, [2, 2, 1, 4], 1], ["SP", 3, 10, 56, [1, 1, 1, 56], 1], ["SP", 3, 15, 56, [1, 2, 2, 1], 1], ["SP", 3, 20, 8, [1, 1, 8, 1], 1], ["SP", 3, 25, 8, [1, 1], 1], ["SP", 3, 28, 3, [3, 1], 1], ["SP", 3, 31, 3, [1, 1], 1], ["RE", 3, [0, 5, 10, 15, 20, 1, 6, 11, 16, 21, 2, 7, 12, 17, 22, 25, 28, 31, 26, 29, 32, 3, 8, 13, 18, 23, 27, 30, 33, 4, 9, 14, 19, 24]], ["FSP", 4, 0, 1, 3], ["FSP", 4, 4, 2, 3], ["FSP", 4, 8, 3, 3], ["FSP", 4, 12, 4, 3], ["FSP", 4, 16, 5, 3], ["RE", 4, [0, 4, 8, 12, 16, 1, 5, 9, 13, 17, 2, 6, 10, 14, 18, 3, 7, 11, 15, 19]], ["CA", 3, 4, 14], ["CHR", 2, "shared", [3]], ["CA", 3, 4, 17], ["CHR", 1, "shared", [4]], ["CA", 2, 5, 17], ["CI", 1], ["FU", 6, [0, 1, 2, 3, 4]], ["AN", 6, 0, 5], ["FU", 6, [1, 2, 3, 4, 5]], ["AN", 6, 1, 4], ["FU", 6, [2, 3, 4, 5, 6]], ["AN", 6, 2, 6], ["FU", 4, [0, 1, 2, 3, 4]], ["SP", 4, 0, 24, [1], 1], ["AN", 4, 1, 2], ["FFSP", 4, 0, [5, 4, 3, 2, 1], 1, 1], ["AN", 4, 1, 6], ["FU", 2, [0, 1, 2, 3, 4]], ["SP", 2, 0, 480, [1], 1], ["AN", 2, 1, 2], ["FFSP", 2, 0, [5, 4, 3, 2, 1], 1, 1], ["AN", 2, 1, 6], ["PR", 5, 0, "auto_unroll_max_step$0"]]]], "r": [[0.0249567, 0.0249565, 0.0249714, 0.0249635, 0.0249671, 0.024966, 0.0249622, 0.0249576, 0.0249694, 0.024969], 0, 28.7525, 1657017459], "v": "v0.6"}
{"i": [["[\"fused_conv3x3\", 1, 56, 56, 8, 8, 3, 3, 64]", "cuda -keys=cuda,gpu -max_num_threads=1024 -model=unknown -thread_warp_size=32", [-1, 16, 64, 49152, 2147483647, 1024, 8, 32], "", 0, []], [[], [["CHW", 3, "local"], ["SP", 3, 0, 1, [1, 1, 1, 1], 1], ["SP", 3, 5, 64, [1, 1, 4, 2], 1], ["SP", 3, 10, 56, [2, 14, 1, 1], 1], ["SP", 3, 15, 56, [1, 4, 2, 1], 1], ["SP", 3, 20, 8, [4, 1, 2, 1], 1], ["SP", 3, 25, 8, [1, 2], 1], ["SP", 3, 28, 3, [1, 3], 1], ["SP", 3, 31, 3, [1, 1], 1], ["RE", 3, [0, 5, 10, 15, 20, 1, 6, 11, 16, 21, 2, 7, 12, 17, 22, 25, 28, 31, 26, 29, 32, 3, 8, 13, 18, 23, 27, 30, 33, 4, 9, 14, 19, 24]], ["FSP", 4, 0, 1, 3], ["FSP", 4, 4, 2, 3], ["FSP", 4, 8, 3, 3], ["FSP", 4, 12, 4, 3], ["FSP", 4, 16, 5, 3], ["RE", 4, [0, 4, 8, 12, 16, 1, 5, 9, 13, 17, 2, 6, 10, 14, 18, 3, 7, 11, 15, 19]], ["CA", 3, 4, 14], ["CHR", 2, "shared", [3]], ["CA", 3, 4, 17], ["CHR", 1, "shared", [4]], ["CA", 2, 5, 17], ["CI", 1], ["FU", 6, [0, 1, 2, 3, 4]], ["AN", 6, 0, 5], ["FU", 6, [1, 2, 3, 4, 5]], ["AN", 6, 1, 4], ["FU", 6, [2, 3, 4, 5, 6]], ["AN", 6, 2, 6], ["FU", 4, [0, 1, 2, 3, 4]], ["SP", 4, 0, 192, [1], 1], ["AN", 4, 1, 2], ["FFSP", 4, 0, [5, 4, 3, 2, 1], 1, 1], ["AN", 4, 1, 6], ["FU", 2, [0, 1, 2, 3, 4]], ["SP", 2, 0, 256, [1], 1], ["AN", 2, 1, 2], ["FFSP", 2, 0, [5, 4, 3, 2, 1], 1, 1], ["AN", 2, 1, 6], ["PR", 5, 0, "auto_unroll_max_step$16"]]]], "r": [[0.000365589, 0.000365615, 0.000365585, 0.000365653, 0.000365642, 0.000365607, 0.00036558, 0.000365613, 0.000365611, 0.000365602], 0, 73.2373, 1657017504], "v": "v0.6"}
{"i": [["[\"fused_conv3x3\", 1, 56, 56, 8, 8, 3, 3, 64]", "cuda -keys=cuda,gpu -max_num_threads=1024 -model=unknown -thread_warp_size=32", [-1, 16, 64, 49152, 2147483647, 1024, 8, 32], "", 0, []], [[], [["CHW", 3, "local"], ["SP", 3, 0, 1, [1, 1, 1, 1], 1], ["SP", 3, 5, 64, [1, 4, 2, 1], 1], ["SP", 3, 10, 56, [1, 8, 1, 1], 1], ["SP", 3, 15, 56, [1, 2, 7, 4], 1], ["SP", 3, 20, 8, [1, 2, 2, 2], 1], ["SP", 3, 25, 8, [1, 2], 1], ["SP", 3, 28, 3, [1, 3], 1], ["SP", 3, 31, 3, [3, 1], 1], ["RE", 3, [0, 5, 10, 15, 20, 1, 6, 11, 16, 21, 2, 7, 12, 17, 22, 25, 28, 31, 26, 29, 32, 3, 8, 13, 18, 23, 27, 30, 33, 4, 9, 14, 19, 24]], ["FSP", 4, 0, 1, 3], ["FSP", 4, 4, 2, 3], ["FSP", 4, 8, 3, 3], ["FSP", 4, 12, 4, 3], ["FSP", 4, 16, 5, 3], ["RE", 4, [0, 4, 8, 12, 16, 1, 5, 9, 13, 17, 2, 6, 10, 14, 18, 3, 7, 11, 15, 19]], ["CA", 3, 4, 14], ["CHR", 2, "shared", [3]], ["CA", 3, 4, 17], ["CHR", 1, "shared", [4]], ["CA", 2, 5, 17], ["CI", 1], ["FU", 6, [0, 1, 2, 3, 4]], ["AN", 6, 0, 5], ["FU", 6, [1, 2, 3, 4, 5]], ["AN", 6, 1, 4], ["FU", 6, [2, 3, 4, 5, 6]], ["AN", 6, 2, 6], ["FU", 4, [0, 1, 2, 3, 4]], ["SP", 4, 0, 144, [1], 1], ["AN", 4, 1, 2], ["FFSP", 4, 0, [5, 4, 3, 2, 1], 1, 1], ["AN", 4, 1, 6], ["FU", 2, [0, 1, 2, 3, 4]], ["SP", 2, 0, 360, [15], 1], ["AN", 2, 1, 2], ["FFSP", 2, 0, [5, 4, 3, 2, 1], 1, 1], ["AN", 2, 1, 6], ["PR", 5, 0, "auto_unroll_max_step$16"]]]], "r": [[0.000173626, 0.000173627, 0.000173638, 0.00017365, 0.000173636, 0.00017364, 0.000173631, 0.000173636, 0.000173627, 0.000173641], 0, 96.0455, 1657017527], "v": "v0.6"}
{"i": [["[\"fused_conv3x3\", 1, 56, 56, 8, 8, 3, 3, 64]", "cuda -keys=cuda,gpu -max_num_threads=1024 -model=unknown -thread_warp_size=32", [-1, 16, 64, 49152, 2147483647, 1024, 8, 32], "", 0, []], [[], [["CHW", 3, "local"], ["SP", 3, 0, 1, [1, 1, 1, 1], 1], ["SP", 3, 5, 64, [2, 2, 1, 1], 1], ["SP", 3, 10, 56, [1, 7, 2, 1], 1], ["SP", 3, 15, 56, [1, 14, 2, 1], 1], ["SP", 3, 20, 8, [1, 1, 1, 1], 1], ["SP", 3, 25, 8, [1, 1], 1], ["SP", 3, 28, 3, [1, 1], 1], ["SP", 3, 31, 3, [1, 1], 1], ["RE", 3, [0, 5, 10, 15, 20, 1, 6, 11, 16, 21, 2, 7, 12, 17, 22, 25, 28, 31, 26, 29, 32, 3, 8, 13, 18, 23, 27, 30, 33, 4, 9, 14, 19, 24]], ["FSP", 4, 0, 1, 3], ["FSP", 4, 4, 2, 3], ["FSP", 4, 8, 3, 3], ["FSP", 4, 12, 4, 3], ["FSP", 4, 16, 5, 3], ["RE", 4, [0, 4, 8, 12, 16, 1, 5, 9, 13, 17, 2, 6, 10, 14, 18, 3, 7, 11, 15, 19]], ["CA", 3, 4, 14], ["CHR", 2, "shared", [3]], ["CA", 3, 4, 17], ["CHR", 1, "shared", [4]], ["CA", 2, 5, 17], ["CI", 1], ["FU", 6, [0, 1, 2, 3, 4]], ["AN", 6, 0, 5], ["FU", 6, [1, 2, 3, 4, 5]], ["AN", 6, 1, 4], ["FU", 6, [2, 3, 4, 5, 6]], ["AN", 6, 2, 6], ["FU", 4, [0, 1, 2, 3, 4]], ["SP", 4, 0, 1, [1], 1], ["AN", 4, 1, 2], ["FFSP", 4, 0, [5, 4, 3, 2, 1], 1, 1], ["AN", 4, 1, 6], ["FU", 2, [0, 1, 2, 3, 4]], ["SP", 2, 0, 4, [4], 1], ["AN", 2, 1, 2], ["FFSP", 2, 0, [5, 4, 3, 2, 1], 1, 1], ["AN", 2, 1, 6], ["PR", 5, 0, "auto_unroll_max_step$0"]]]], "r": [[0.000998718, 0.000998503, 0.000998253, 0.000998634, 0.000998663, 0.000999034, 0.000999243, 0.000998756, 0.000998554, 0.000998577], 0, 11.9081, 1657017444], "v": "v0.6"}
{"i": [["[\"fused_conv3x3\", 1, 56, 56, 8, 8, 3, 3, 64]", "cuda -keys=cuda,gpu -max_num_threads=1024 -model=unknown -thread_warp_size=32", [-1, 16, 64, 49152, 2147483647, 1024, 8, 32], "", 0, []], [[], [["CHW", 3, "local"], ["SP", 3, 0, 1, [1, 1, 1, 1], 1], ["SP", 3, 5, 64, [1, 4, 2, 1], 1], ["SP", 3, 10, 56, [1, 28, 1, 1], 1], ["SP", 3, 15, 56, [1, 1, 1, 1], 1], ["SP", 3, 20, 8, [1, 1, 8, 1], 1], ["SP", 3, 25, 8, [4, 2], 1], ["SP", 3, 28, 3, [1, 3], 1], ["SP", 3, 31, 3, [3, 1], 1], ["RE", 3, [0, 5, 10, 15, 20, 1, 6, 11, 16, 21, 2, 7, 12, 17, 22, 25, 28, 31, 26, 29, 32, 3, 8, 13, 18, 23, 27, 30, 33, 4, 9, 14, 19, 24]], ["FSP", 4, 0, 1, 3], ["FSP", 4, 4, 2, 3], ["FSP", 4, 8, 3, 3], ["FSP", 4, 12, 4, 3], ["FSP", 4, 16, 5, 3], ["RE", 4, [0, 4, 8, 12, 16, 1, 5, 9, 13, 17, 2, 6, 10, 14, 18, 3, 7, 11, 15, 19]], ["CA", 3, 4, 14], ["CHR", 2, "shared", [3]], ["CA", 3, 4, 17], ["CHR", 1, "shared", [4]], ["CA", 2, 5, 17], ["CI", 1], ["FU", 6, [0, 1, 2, 3, 4]], ["AN", 6, 0, 5], ["FU", 6, [1, 2, 3, 4, 5]], ["AN", 6, 1, 4], ["FU", 6, [2, 3, 4, 5, 6]], ["AN", 6, 2, 6], ["FU", 4, [0, 1, 2, 3, 4]], ["SP", 4, 0, 576, [1], 1], ["AN", 4, 1, 2], ["FFSP", 4, 0, [5, 4, 3, 2, 1], 1, 1], ["AN", 4, 1, 6], ["FU", 2, [0, 1, 2, 3, 4]], ["SP", 2, 0, 144, [1], 1], ["AN", 2, 1, 2], ["FFSP", 2, 0, [5, 4, 3, 2, 1], 1, 1], ["AN", 2, 1, 6], ["PR", 5, 0, "auto_unroll_max_step$512"]]]], "r": [[6.3826e-05, 6.38247e-05, 6.38552e-05, 6.39031e-05, 6.38194e-05, 6.38246e-05, 6.38179e-05, 6.38464e-05, 6.38322e-05, 6.3827e-05], 0, 8.14342, 1657017438], "v": "v0.6"}
{"i": [["[\"fused_conv3x3\", 1, 56, 56, 8, 8, 3, 3, 64]", "cuda -keys=cuda,gpu -max_num_threads=1024 -model=unknown -thread_warp_size=32", [-1, 16, 64, 49152, 2147483647, 1024, 8, 32], "", 0, []], [[], [["CHW", 3, "local"], ["SP", 3, 0, 1, [1, 1, 1, 1], 1], ["SP", 3, 5, 64, [1, 1, 4, 1], 1], ["SP", 3, 10, 56, [1, 28, 1, 1], 1], ["SP", 3, 15, 56, [1, 1, 1, 7], 1], ["SP", 3, 20, 8, [1, 4, 2, 1], 1], ["SP", 3, 25, 8, [1, 2], 1], ["SP", 3, 28, 3, [3, 1], 1], ["SP", 3, 31, 3, [3, 1], 1], ["RE", 3, [0, 5, 10, 15, 20, 1, 6, 11, 16, 21, 2, 7, 12, 17, 22, 25, 28, 31, 26, 29, 32, 3, 8, 13, 18, 23, 27, 30, 33, 4, 9, 14, 19, 24]], ["FSP", 4, 0, 1, 3], ["FSP", 4, 4, 2, 3], ["FSP", 4, 8, 3, 3], ["FSP", 4, 12, 4, 3], ["FSP", 4, 16, 5, 3], ["RE", 4, [0, 4, 8, 12, 16, 1, 5, 9, 13, 17, 2, 6, 10, 14, 18, 3, 7, 11, 15, 19]], ["CA", 3, 4, 14], ["CHR", 2, "shared", [3]], ["CA", 3, 4, 17], ["CHR", 1, "shared", [4]], ["CA", 2, 5, 17], ["CI", 1], ["FU", 6, [0, 1, 2, 3, 4]], ["AN", 6, 0, 5], ["FU", 6, [1, 2, 3, 4, 5]], ["AN", 6, 1, 4], ["FU", 6, [2, 3, 4, 5, 6]], ["AN", 6, 2, 6], ["FU", 4, [0, 1, 2, 3, 4]], ["SP", 4, 0, 72, [1], 1], ["AN", 4, 1, 2], ["FFSP", 4, 0, [5, 4, 3, 2, 1], 1, 1], ["AN", 4, 1, 6], ["FU", 2, [0, 1, 2, 3, 4]], ["SP", 2, 0, 96, [1], 1], ["AN", 2, 1, 2], ["FFSP", 2, 0, [5, 4, 3, 2, 1], 1, 1], ["AN", 2, 1, 6], ["PR", 5, 0, "auto_unroll_max_step$512"]]]], "r": [[3.45408e-05, 3.45388e-05, 3.454e-05, 3.45357e-05, 3.45346e-05, 3.45366e-05, 3.45392e-05, 3.45331e-05, 3.45367e-05, 3.45359e-05], 0, 17.7585, 1657017449], "v": "v0.6"}
{"i": [["[\"fused_conv3x3\", 1, 56, 56, 8, 8, 3, 3, 64]", "cuda -keys=cuda,gpu -max_num_threads=1024 -model=unknown -thread_warp_size=32", [-1, 16, 64, 49152, 2147483647, 1024, 8, 32], "", 0, []], [[], [["CHW", 3, "local"], ["SP", 3, 0, 1, [1, 1, 1, 1], 1], ["SP", 3, 5, 64, [1, 4, 2, 1], 1], ["SP", 3, 10, 56, [1, 8, 1, 1], 1], ["SP", 3, 15, 56, [1, 2, 7, 4], 1], ["SP", 3, 20, 8, [1, 2, 2, 2], 1], ["SP", 3, 25, 8, [1, 2], 1], ["SP", 3, 28, 3, [1, 3], 1], ["SP", 3, 31, 3, [3, 1], 1], ["RE", 3, [0, 5, 10, 15, 20, 1, 6, 11, 16, 21, 2, 7, 12, 17, 22, 25, 28, 31, 26, 29, 32, 3, 8, 13, 18, 23, 27, 30, 33, 4, 9, 14, 19, 24]], ["FSP", 4, 0, 1, 3], ["FSP", 4, 4, 2, 3], ["FSP", 4, 8, 3, 3], ["FSP", 4, 12, 4, 3], ["FSP", 4, 16, 5, 3], ["RE", 4, [0, 4, 8, 12, 16, 1, 5, 9, 13, 17, 2, 6, 10, 14, 18, 3, 7, 11, 15, 19]], ["CA", 3, 4, 14], ["CHR", 2, "shared", [3]], ["CA", 3, 4, 17], ["CHR", 1, "shared", [4]], ["CA", 2, 5, 17], ["CI", 1], ["FU", 6, [0, 1, 2, 3, 4]], ["AN", 6, 0, 5], ["FU", 6, [1, 2, 3, 4, 5]], ["AN", 6, 1, 4], ["FU", 6, [2, 3, 4, 5, 6]], ["AN", 6, 2, 6], ["FU", 4, [0, 1, 2, 3, 4]], ["SP", 4, 0, 144, [1], 1], ["AN", 4, 1, 2], ["FFSP", 4, 0, [5, 4, 3, 2, 1], 1, 1], ["AN", 4, 1, 6], ["FU", 2, [0, 1, 2, 3, 4]], ["SP", 2, 0, 360, [24], 1], ["AN", 2, 1, 2], ["FFSP", 2, 0, [5, 4, 3, 2, 1], 1, 1], ["AN", 2, 1, 6], ["PR", 5, 0, "auto_unroll_max_step$1024"]]]], "r": [[0.000103157, 0.000103157, 0.000103153, 0.000103145, 0.000103156, 0.00010315, 0.000103145, 0.00010314, 0.00010315, 0.000103141], 0, 53.7369, 1657017482], "v": "v0.6"}
{"i": [["[\"fused_conv3x3\", 1, 56, 56, 8, 8, 3, 3, 64]", "cuda -keys=cuda,gpu -max_num_threads=1024 -model=unknown -thread_warp_size=32", [-1, 16, 64, 49152, 2147483647, 1024, 8, 32], "", 0, []], [[], [["CHW", 3, "local"], ["SP", 3, 0, 1, [1, 1, 1, 1], 1], ["SP", 3, 5, 64, [1, 1, 1, 2], 1], ["SP", 3, 10, 56, [1, 56, 1, 1], 1], ["SP", 3, 15, 56, [1, 1, 8, 1], 1], ["SP", 3, 20, 8, [4, 1, 1, 2], 1], ["SP", 3, 25, 8, [1, 1], 1], ["SP", 3, 28, 3, [1, 1], 1], ["SP", 3, 31, 3, [1, 3], 1], ["RE", 3, [0, 5, 10, 15, 20, 1, 6, 11, 16, 21, 2, 7, 12, 17, 22, 25, 28, 31, 26, 29, 32, 3, 8, 13, 18, 23, 27, 30, 33, 4, 9, 14, 19, 24]], ["FSP", 4, 0, 1, 3], ["FSP", 4, 4, 2, 3], ["FSP", 4, 8, 3, 3], ["FSP", 4, 12, 4, 3], ["FSP", 4, 16, 5, 3], ["RE", 4, [0, 4, 8, 12, 16, 1, 5, 9, 13, 17, 2, 6, 10, 14, 18, 3, 7, 11, 15, 19]], ["CA", 3, 4, 14], ["CHR", 2, "shared", [3]], ["CA", 3, 4, 17], ["CHR", 1, "shared", [4]], ["CA", 2, 5, 17], ["CI", 1], ["FU", 6, [0, 1, 2, 3, 4]], ["AN", 6, 0, 5], ["FU", 6, [1, 2, 3, 4, 5]], ["AN", 6, 1, 4], ["FU", 6, [2, 3, 4, 5, 6]], ["AN", 6, 2, 6], ["FU", 4, [0, 1, 2, 3, 4]], ["SP", 4, 0, 96, [48], 1], ["AN", 4, 1, 2], ["FFSP", 4, 0, [5, 4, 3, 2, 1], 1, 1], ["AN", 4, 1, 6], ["FU", 2, [0, 1, 2, 3, 4]], ["SP", 2, 0, 480, [1], 1], ["AN", 2, 1, 2], ["FFSP", 2, 0, [5, 4, 3, 2, 1], 1, 1], ["AN", 2, 1, 6], ["PR", 5, 0, "auto_unroll_max_step$64"]]]], "r": [[9.52129e-05, 9.52192e-05, 9.52065e-05, 9.52142e-05, 9.52074e-05, 9.52214e-05, 9.52107e-05, 9.5217e-05, 9.52133e-05, 9.52137e-05], 0, 23.1745, 1657017454], "v": "v0.6"}
{"i": [["[\"fused_conv3x3\", 1, 56, 56, 8, 8, 3, 3, 64]", "cuda -keys=cuda,gpu -max_num_threads=1024 -model=unknown -thread_warp_size=32", [-1, 16, 64, 49152, 2147483647, 1024, 8, 32], "", 0, []], [[], [["CHW", 3, "local"], ["SP", 3, 0, 1, [1, 1, 1, 1], 1], ["SP", 3, 5, 64, [1, 2, 2, 1], 1], ["SP", 3, 10, 56, [1, 1, 4, 2], 1], ["SP", 3, 15, 56, [1, 7, 1, 1], 1], ["SP", 3, 20, 8, [1, 1, 2, 1], 1], ["SP", 3, 25, 8, [2, 1], 1], ["SP", 3, 28, 3, [3, 1], 1], ["SP", 3, 31, 3, [3, 1], 1], ["RE", 3, [0, 5, 10, 15, 20, 1, 6, 11, 16, 21, 2, 7, 12, 17, 22, 25, 28, 31, 26, 29, 32, 3, 8, 13, 18, 23, 27, 30, 33, 4, 9, 14, 19, 24]], ["FSP", 4, 0, 1, 3], ["FSP", 4, 4, 2, 3], ["FSP", 4, 8, 3, 3], ["FSP", 4, 12, 4, 3], ["FSP", 4, 16, 5, 3], ["RE", 4, [0, 4, 8, 12, 16, 1, 5, 9, 13, 17, 2, 6, 10, 14, 18, 3, 7, 11, 15, 19]], ["CA", 3, 4, 14], ["CHR", 2, "shared", [3]], ["CA", 3, 4, 17], ["CHR", 1, "shared", [4]], ["CA", 2, 5, 17], ["CI", 1], ["FU", 6, [0, 1, 2, 3, 4]], ["AN", 6, 0, 5], ["FU", 6, [1, 2, 3, 4, 5]], ["AN", 6, 1, 4], ["FU", 6, [2, 3, 4, 5, 6]], ["AN", 6, 2, 6], ["FU", 4, [0, 1, 2, 3, 4]], ["SP", 4, 0, 36, [9], 1], ["AN", 4, 1, 2], ["FFSP", 4, 0, [5, 4, 3, 2, 1], 1, 1], ["AN", 4, 1, 6], ["FU", 2, [0, 1, 2, 3, 4]], ["SP", 2, 0, 120, [1], 1], ["AN", 2, 1, 2], ["FFSP", 2, 0, [5, 4, 3, 2, 1], 1, 1], ["AN", 2, 1, 6], ["PR", 5, 0, "auto_unroll_max_step$0"]]]], "r": [[0.000186401, 0.000186428, 0.000186445, 0.000186435, 0.000186471, 0.00018645, 0.000186374, 0.000186394, 0.000186441, 0.000186485], 0, 55.7332, 1657017487], "v": "v0.6"}
{"i": [["[\"fused_conv3x3\", 1, 56, 56, 8, 8, 3, 3, 64]", "cuda -keys=cuda,gpu -max_num_threads=1024 -model=unknown -thread_warp_size=32", [-1, 16, 64, 49152, 2147483647, 1024, 8, 32], "", 0, []], [[], [["CHW", 3, "local"], ["SP", 3, 0, 1, [1, 1, 1, 1], 1], ["SP", 3, 5, 64, [1, 4, 4, 1], 1], ["SP", 3, 10, 56, [1, 1, 2, 1], 1], ["SP", 3, 15, 56, [1, 28, 1, 2], 1], ["SP", 3, 20, 8, [4, 1, 1, 1], 1], ["SP", 3, 25, 8, [2, 1], 1], ["SP", 3, 28, 3, [1, 3], 1], ["SP", 3, 31, 3, [1, 1], 1], ["RE", 3, [0, 5, 10, 15, 20, 1, 6, 11, 16, 21, 2, 7, 12, 17, 22, 25, 28, 31, 26, 29, 32, 3, 8, 13, 18, 23, 27, 30, 33, 4, 9, 14, 19, 24]], ["FSP", 4, 0, 1, 3], ["FSP", 4, 4, 2, 3], ["FSP", 4, 8, 3, 3], ["FSP", 4, 12, 4, 3], ["FSP", 4, 16, 5, 3], ["RE", 4, [0, 4, 8, 12, 16, 1, 5, 9, 13, 17, 2, 6, 10, 14, 18, 3, 7, 11, 15, 19]], ["CA", 3, 4, 14], ["CHR", 2, "shared", [3]], ["CA", 3, 4, 17], ["CHR", 1, "shared", [4]], ["CA", 2, 5, 17], ["CI", 1], ["FU", 6, [0, 1, 2, 3, 4]], ["AN", 6, 0, 5], ["FU", 6, [1, 2, 3, 4, 5]], ["AN", 6, 1, 4], ["FU", 6, [2, 3, 4, 5, 6]], ["AN", 6, 2, 6], ["FU", 4, [0, 1, 2, 3, 4]], ["SP", 4, 0, 24, [1], 1], ["AN", 4, 1, 2], ["FFSP", 4, 0, [5, 4, 3, 2, 1], 1, 1], ["AN", 4, 1, 6], ["FU", 2, [0, 1, 2, 3, 4]], ["SP", 2, 0, 128, [1], 1], ["AN", 2, 1, 2], ["FFSP", 2, 0, [5, 4, 3, 2, 1], 1, 1], ["AN", 2, 1, 6], ["PR", 5, 0, "auto_unroll_max_step$1024"]]]], "r": [[0.000116838, 0.000116847, 0.000116848, 0.000116838, 0.000116856, 0.000116845, 0.000116833, 0.000116833, 0.000116835, 0.000116834], 0, 45.8193, 1657017476], "v": "v0.6"}
{"i": [["[\"fused_conv3x3\", 1, 56, 56, 8, 8, 3, 3, 64]", "cuda -keys=cuda,gpu -max_num_threads=1024 -model=unknown -thread_warp_size=32", [-1, 16, 64, 49152, 2147483647, 1024, 8, 32], "", 0, []], [[], [["CHW", 3, "local"], ["SP", 3, 0, 1, [1, 1, 1, 1], 1], ["SP", 3, 5, 64, [1, 1, 4, 2], 1], ["SP", 3, 10, 56, [1, 1, 28, 1], 1], ["SP", 3, 15, 56, [1, 4, 2, 1], 1], ["SP", 3, 20, 8, [1, 2, 1, 4], 1], ["SP", 3, 25, 8, [1, 2], 1], ["SP", 3, 28, 3, [1, 3], 1], ["SP", 3, 31, 3, [1, 1], 1], ["RE", 3, [0, 5, 10, 15, 20, 1, 6, 11, 16, 21, 2, 7, 12, 17, 22, 25, 28, 31, 26, 29, 32, 3, 8, 13, 18, 23, 27, 30, 33, 4, 9, 14, 19, 24]], ["FSP", 4, 0, 1, 3], ["FSP", 4, 4, 2, 3], ["FSP", 4, 8, 3, 3], ["FSP", 4, 12, 4, 3], ["FSP", 4, 16, 5, 3], ["RE", 4, [0, 4, 8, 12, 16, 1, 5, 9, 13, 17, 2, 6, 10, 14, 18, 3, 7, 11, 15, 19]], ["CA", 3, 4, 14], ["CHR", 2, "shared", [3]], ["CA", 3, 4, 17], ["CHR", 1, "shared", [4]], ["CA", 2, 5, 17], ["CI", 1], ["FU", 6, [0, 1, 2, 3, 4]], ["AN", 6, 0, 5], ["FU", 6, [1, 2, 3, 4, 5]], ["AN", 6, 1, 4], ["FU", 6, [2, 3, 4, 5, 6]], ["AN", 6, 2, 6], ["FU", 4, [0, 1, 2, 3, 4]], ["SP", 4, 0, 192, [1], 1], ["AN", 4, 1, 2], ["FFSP", 4, 0, [5, 4, 3, 2, 1], 1, 1], ["AN", 4, 1, 6], ["FU", 2, [0, 1, 2, 3, 4]], ["SP", 2, 0, 256, [1], 1], ["AN", 2, 1, 2], ["FFSP", 2, 0, [5, 4, 3, 2, 1], 1, 1], ["AN", 2, 1, 6], ["PR", 5, 0, "auto_unroll_max_step$16"]]]], "r": [[0.00382815, 0.00382752, 0.00382755, 0.00382675, 0.00382854, 0.00382762, 0.00382853, 0.00382761, 0.00382883, 0.00382699], 0, 110.804, 1657017541], "v": "v0.6"}
{"i": [["[\"fused_conv3x3\", 1, 56, 56, 8, 8, 3, 3, 64]", "cuda -keys=cuda,gpu -max_num_threads=1024 -model=unknown -thread_warp_size=32", [-1, 16, 64, 49152, 2147483647, 1024, 8, 32], "", 0, []], [[], [["CHW", 3, "local"], ["SP", 3, 0, 1, [1, 1, 1, 1], 1], ["SP", 3, 5, 64, [1, 2, 4, 1], 1], ["SP", 3, 10, 56, [1, 14, 1, 1], 1], ["SP", 3, 15, 56, [1, 1, 2, 1], 1], ["SP", 3, 20, 8, [1, 2, 1, 4], 1], ["SP", 3, 25, 8, [4, 1], 1], ["SP", 3, 28, 3, [1, 3], 1], ["SP", 3, 31, 3, [1, 3], 1], ["RE", 3, [0, 5, 10, 15, 20, 1, 6, 11, 16, 21, 2, 7, 12, 17, 22, 25, 28, 31, 26, 29, 32, 3, 8, 13, 18, 23, 27, 30, 33, 4, 9, 14, 19, 24]], ["FSP", 4, 0, 1, 3], ["FSP", 4, 4, 2, 3], ["FSP", 4, 8, 3, 3], ["FSP", 4, 12, 4, 3], ["FSP", 4, 16, 5, 3], ["RE", 4, [0, 4, 8, 12, 16, 1, 5, 9, 13, 17, 2, 6, 10, 14, 18, 3, 7, 11, 15, 19]], ["CA", 3, 4, 14], ["CHR", 2, "shared", [3]], ["CA", 3, 4, 17], ["CHR", 1, "shared", [4]], ["CA", 2, 5, 17], ["CI", 1], ["FU", 6, [0, 1, 2, 3, 4]], ["AN", 6, 0, 5], ["FU", 6, [1, 2, 3, 4, 5]], ["AN", 6, 1, 4], ["FU", 6, [2, 3, 4, 5, 6]], ["AN", 6, 2, 6], ["FU", 4, [0, 1, 2, 3, 4]], ["SP", 4, 0, 576, [1], 1], ["AN", 4, 1, 2], ["FFSP", 4, 0, [5, 4, 3, 2, 1], 1, 1], ["AN", 4, 1, 6], ["FU", 2, [0, 1, 2, 3, 4]], ["SP", 2, 0, 192, [8], 1], ["AN", 2, 1, 2], ["FFSP", 2, 0, [5, 4, 3, 2, 1], 1, 1], ["AN", 2, 1, 6], ["PR", 5, 0, "auto_unroll_max_step$16"]]]], "r": [[7.13755e-05, 7.16654e-05, 7.15384e-05, 7.17214e-05, 7.16111e-05, 7.18232e-05, 7.16911e-05, 7.1784e-05, 7.17253e-05, 7.18388e-05], 0, 107.038, 1657017538], "v": "v0.6"}
{"i": [["[\"fused_conv3x3\", 1, 56, 56, 8, 8, 3, 3, 64]", "cuda -keys=cuda,gpu -max_num_threads=1024 -model=unknown -thread_warp_size=32", [-1, 16, 64, 49152, 2147483647, 1024, 8, 32], "", 0, []], [[], [["CHW", 3, "local"], ["SP", 3, 0, 1, [1, 1, 1, 1], 1], ["SP", 3, 5, 64, [1, 1, 1, 1], 1], ["SP", 3, 10, 56, [1, 7, 4, 1], 1], ["SP", 3, 15, 56, [1, 7, 2, 1], 1], ["SP", 3, 20, 8, [4, 1, 1, 2], 1], ["SP", 3, 25, 8, [2, 2], 1], ["SP", 3, 28, 3, [3, 1], 1], ["SP", 3, 31, 3, [1, 3], 1], ["RE", 3, [0, 5, 10, 15, 20, 1, 6, 11, 16, 21, 2, 7, 12, 17, 22, 25, 28, 31, 26, 29, 32, 3, 8, 13, 18, 23, 27, 30, 33, 4, 9, 14, 19, 24]], ["FSP", 4, 0, 1, 3], ["FSP", 4, 4, 2, 3], ["FSP", 4, 8, 3, 3], ["FSP", 4, 12, 4, 3], ["FSP", 4, 16, 5, 3], ["RE", 4, [0, 4, 8, 12, 16, 1, 5, 9, 13, 17, 2, 6, 10, 14, 18, 3, 7, 11, 15, 19]], ["CA", 3, 4, 14], ["CHR", 2, "shared", [3]], ["CA", 3, 4, 17], ["CHR", 1, "shared", [4]], ["CA", 2, 5, 17], ["CI", 1], ["FU", 6, [0, 1, 2, 3, 4]], ["AN", 6, 0, 5], ["FU", 6, [1, 2, 3, 4, 5]], ["AN", 6, 1, 4], ["FU", 6, [2, 3, 4, 5, 6]], ["AN", 6, 2, 6], ["FU", 4, [0, 1, 2, 3, 4]], ["SP", 4, 0, 72, [18], 1], ["AN", 4, 1, 2], ["FFSP", 4, 0, [5, 4, 3, 2, 1], 1, 1], ["AN", 4, 1, 6], ["FU", 2, [0, 1, 2, 3, 4]], ["SP", 2, 0, 96, [24], 1], ["AN", 2, 1, 2], ["FFSP", 2, 0, [5, 4, 3, 2, 1], 1, 1], ["AN", 2, 1, 6], ["PR", 5, 0, "auto_unroll_max_step$64"]]]], "r": [[6.29592e-05, 6.29442e-05, 6.29483e-05, 6.29605e-05, 6.2983e-05, 6.29899e-05, 6.2976e-05, 6.2974e-05, 6.29603e-05, 6.29731e-05], 0, 115.681, 1657017547], "v": "v0.6"}
{"i": [["[\"fused_conv3x3\", 1, 56, 56, 8, 8, 3, 3, 64]", "cuda -keys=cuda,gpu -max_num_threads=1024 -model=unknown -thread_warp_size=32", [-1, 16, 64, 49152, 2147483647, 1024, 8, 32], "", 0, []], [[], [["CHW", 3, "local"], ["SP", 3, 0, 1, [1, 1, 1, 1], 1], ["SP", 3, 5, 64, [8, 4, 1, 2], 1], ["SP", 3, 10, 56, [1, 2, 7, 1], 1], ["SP", 3, 15, 56, [1, 2, 1, 2], 1], ["SP", 3, 20, 8, [1, 8, 1, 1], 1], ["SP", 3, 25, 8, [1, 2], 1], ["SP", 3, 28, 3, [1, 1], 1], ["SP", 3, 31, 3, [1, 3], 1], ["RE", 3, [0, 5, 10, 15, 20, 1, 6, 11, 16, 21, 2, 7, 12, 17, 22, 25, 28, 31, 26, 29, 32, 3, 8, 13, 18, 23, 27, 30, 33, 4, 9, 14, 19, 24]], ["FSP", 4, 0, 1, 3], ["FSP", 4, 4, 2, 3], ["FSP", 4, 8, 3, 3], ["FSP", 4, 12, 4, 3], ["FSP", 4, 16, 5, 3], ["RE", 4, [0, 4, 8, 12, 16, 1, 5, 9, 13, 17, 2, 6, 10, 14, 18, 3, 7, 11, 15, 19]], ["CA", 3, 4, 14], ["CHR", 2, "shared", [3]], ["CA", 3, 4, 17], ["CHR", 1, "shared", [4]], ["CA", 2, 5, 17], ["CI", 1], ["FU", 6, [0, 1, 2, 3, 4]], ["AN", 6, 0, 5], ["FU", 6, [1, 2, 3, 4, 5]], ["AN", 6, 1, 4], ["FU", 6, [2, 3, 4, 5, 6]], ["AN", 6, 2, 6], ["FU", 4, [0, 1, 2, 3, 4]], ["SP", 4, 0, 12, [1], 1], ["AN", 4, 1, 2], ["FFSP", 4, 0, [5, 4, 3, 2, 1], 1, 1], ["AN", 4, 1, 6], ["FU", 2, [0, 1, 2, 3, 4]], ["SP", 2, 0, 28, [28], 1], ["AN", 2, 1, 2], ["FFSP", 2, 0, [5, 4, 3, 2, 1], 1, 1], ["AN", 2, 1, 6], ["PR", 5, 0, "auto_unroll_max_step$0"]]]], "r": [[0.000132899, 0.000132891, 0.000132905, 0.000132913, 0.000132888, 0.000132873, 0.000132859, 0.000132896, 0.000132885, 0.000132881], 0, 79.4361, 1657017510], "v": "v0.6"}
{"i": [["[\"fused_conv3x3\", 1, 56, 56, 8, 8, 3, 3, 64]", "cuda -keys=cuda,gpu -max_num_threads=1024 -model=unknown -thread_warp_size=32", [-1, 16, 64, 49152, 2147483647, 1024, 8, 32], "", 0, []], [[], [["CHW", 3, "local"], ["SP", 3, 0, 1, [1, 1, 1, 1], 1], ["SP", 3, 5, 64, [1, 2, 2, 1], 1], ["SP", 3, 10, 56, [8, 1, 1, 1], 1], ["SP", 3, 15, 56, [1, 14, 2, 1], 1], ["SP", 3, 20, 8, [1, 4, 1, 1], 1], ["SP", 3, 25, 8, [1, 1], 1], ["SP", 3, 28, 3, [3, 1], 1], ["SP", 3, 31, 3, [1, 1], 1], ["RE", 3, [0, 5, 10, 15, 20, 1, 6, 11, 16, 21, 2, 7, 12, 17, 22, 25, 28, 31, 26, 29, 32, 3, 8, 13, 18, 23, 27, 30, 33, 4, 9, 14, 19, 24]], ["FSP", 4, 0, 1, 3], ["FSP", 4, 4, 2, 3], ["FSP", 4, 8, 3, 3], ["FSP", 4, 12, 4, 3], ["FSP", 4, 16, 5, 3], ["RE", 4, [0, 4, 8, 12, 16, 1, 5, 9, 13, 17, 2, 6, 10, 14, 18, 3, 7, 11, 15, 19]], ["CA", 3, 4, 14], ["CHR", 2, "shared", [3]], ["CA", 3, 4, 17], ["CHR", 1, "shared", [4]], ["CA", 2, 5, 17], ["CI", 1], ["FU", 6, [0, 1, 2, 3, 4]], ["AN", 6, 0, 5], ["FU", 6, [1, 2, 3, 4, 5]], ["AN", 6, 1, 4], ["FU", 6, [2, 3, 4, 5, 6]], ["AN", 6, 2, 6], ["FU", 4, [0, 1, 2, 3, 4]], ["SP", 4, 0, 6, [1], 1], ["AN", 4, 1, 2], ["FFSP", 4, 0, [5, 4, 3, 2, 1], 1, 1], ["AN", 4, 1, 6], ["FU", 2, [0, 1, 2, 3, 4]], ["SP", 2, 0, 24, [1], 1], ["AN", 2, 1, 2], ["FFSP", 2, 0, [5, 4, 3, 2, 1], 1, 1], ["AN", 2, 1, 6], ["PR", 5, 0, "auto_unroll_max_step$1024"]]]], "r": [[6.71674e-05, 6.7157e-05, 6.7162e-05, 6.71652e-05, 6.71517e-05, 6.7145e-05, 6.71539e-05, 6.71496e-05, 6.71484e-05, 6.71544e-05], 0, 90.2153, 1657017521], "v": "v0.6"}
{"i": [["[\"fused_conv3x3\", 1, 56, 56, 8, 8, 3, 3, 64]", "cuda -keys=cuda,gpu -max_num_threads=1024 -model=unknown -thread_warp_size=32", [-1, 16, 64, 49152, 2147483647, 1024, 8, 32], "", 0, []], [[], [["CHW", 3, "local"], ["SP", 3, 0, 1, [1, 1, 1, 1], 1], ["SP", 3, 5, 64, [1, 4, 1, 4], 1], ["SP", 3, 10, 56, [4, 1, 1, 1], 1], ["SP", 3, 15, 56, [2, 1, 2, 1], 1], ["SP", 3, 20, 8, [1, 8, 1, 1], 1], ["SP", 3, 25, 8, [1, 1], 1], ["SP", 3, 28, 3, [1, 3], 1], ["SP", 3, 31, 3, [3, 1], 1], ["RE", 3, [0, 5, 10, 15, 20, 1, 6, 11, 16, 21, 2, 7, 12, 17, 22, 25, 28, 31, 26, 29, 32, 3, 8, 13, 18, 23, 27, 30, 33, 4, 9, 14, 19, 24]], ["FSP", 4, 0, 1, 3], ["FSP", 4, 4, 2, 3], ["FSP", 4, 8, 3, 3], ["FSP", 4, 12, 4, 3], ["FSP", 4, 16, 5, 3], ["RE", 4, [0, 4, 8, 12, 16, 1, 5, 9, 13, 17, 2, 6, 10, 14, 18, 3, 7, 11, 15, 19]], ["CA", 3, 4, 14], ["CHR", 2, "shared", [3]], ["CA", 3, 4, 17], ["CHR", 1, "shared", [4]], ["CA", 2, 5, 17], ["CI", 1], ["FU", 6, [0, 1, 2, 3, 4]], ["AN", 6, 0, 5], ["FU", 6, [1, 2, 3, 4, 5]], ["AN", 6, 1, 4], ["FU", 6, [2, 3, 4, 5, 6]], ["AN", 6, 2, 6], ["FU", 4, [0, 1, 2, 3, 4]], ["SP", 4, 0, 72, [1], 1], ["AN", 4, 1, 2], ["FFSP", 4, 0, [5, 4, 3, 2, 1], 1, 1], ["AN", 4, 1, 6], ["FU", 2, [0, 1, 2, 3, 4]], ["SP", 2, 0, 96, [1], 1], ["AN", 2, 1, 2], ["FFSP", 2, 0, [5, 4, 3, 2, 1], 1, 1], ["AN", 2, 1, 6], ["PR", 5, 0, "auto_unroll_max_step$1024"]]]], "r": [[4.21797e-05, 4.23497e-05, 4.23275e-05, 4.23686e-05, 4.23577e-05, 4.24183e-05, 4.24295e-05, 4.24372e-05, 4.24705e-05, 4.2531e-05], 0, 62.1974, 1657017493], "v": "v0.6"}
{"i": [["[\"fused_conv3x3\", 1, 56, 56, 8, 8, 3, 3, 64]", "cuda -keys=cuda,gpu -max_num_threads=1024 -model=unknown -thread_warp_size=32", [-1, 16, 64, 49152, 2147483647, 1024, 8, 32], "", 0, []], [[], [["CHW", 3, "local"], ["SP", 3, 0, 1, [1, 1, 1, 1], 1], ["SP", 3, 5, 64, [1, 1, 1, 8], 1], ["SP", 3, 10, 56, [1, 8, 1, 1], 1], ["SP", 3, 15, 56, [1, 1, 1, 8], 1], ["SP", 3, 20, 8, [1, 4, 1, 1], 1], ["SP", 3, 25, 8, [1, 1], 1], ["SP", 3, 28, 3, [3, 1], 1], ["SP", 3, 31, 3, [1, 3], 1], ["RE", 3, [0, 5, 10, 15, 20, 1, 6, 11, 16, 21, 2, 7, 12, 17, 22, 25, 28, 31, 26, 29, 32, 3, 8, 13, 18, 23, 27, 30, 33, 4, 9, 14, 19, 24]], ["FSP", 4, 0, 1, 3], ["FSP", 4, 4, 2, 3], ["FSP", 4, 8, 3, 3], ["FSP", 4, 12, 4, 3], ["FSP", 4, 16, 5, 3], ["RE", 4, [0, 4, 8, 12, 16, 1, 5, 9, 13, 17, 2, 6, 10, 14, 18, 3, 7, 11, 15, 19]], ["CA", 3, 4, 14], ["CHR", 2, "shared", [3]], ["CA", 3, 4, 17], ["CHR", 1, "shared", [4]], ["CA", 2, 5, 17], ["CI", 1], ["FU", 6, [0, 1, 2, 3, 4]], ["AN", 6, 0, 5], ["FU", 6, [1, 2, 3, 4, 5]], ["AN", 6, 1, 4], ["FU", 6, [2, 3, 4, 5, 6]], ["AN", 6, 2, 6], ["FU", 4, [0, 1, 2, 3, 4]], ["SP", 4, 0, 72, [1], 1], ["AN", 4, 1, 2], ["FFSP", 4, 0, [5, 4, 3, 2, 1], 1, 1], ["AN", 4, 1, 6], ["FU", 2, [0, 1, 2, 3, 4]], ["SP", 2, 0, 240, [1], 1], ["AN", 2, 1, 2], ["FFSP", 2, 0, [5, 4, 3, 2, 1], 1, 1], ["AN", 2, 1, 6], ["PR", 5, 0, "auto_unroll_max_step$0"]]]], "r": [[8.62493e-05, 8.62096e-05, 8.6203e-05, 8.61909e-05, 8.61925e-05, 8.61934e-05, 8.61977e-05, 8.61852e-05, 8.61915e-05, 8.62127e-05], 0, 38.945, 1657017470], "v": "v0.6"}
{"i": [["[\"fused_conv3x3\", 1, 56, 56, 8, 8, 3, 3, 64]", "cuda -keys=cuda,gpu -max_num_threads=1024 -model=unknown -thread_warp_size=32", [-1, 16, 64, 49152, 2147483647, 1024, 8, 32], "", 0, []], [[], [["CHW", 3, "local"], ["SP", 3, 0, 1, [1, 1, 1, 1], 1], ["SP", 3, 5, 64, [1, 4, 1, 1], 1], ["SP", 3, 10, 56, [1, 8, 1, 1], 1], ["SP", 3, 15, 56, [2, 1, 2, 7], 1], ["SP", 3, 20, 8, [1, 4, 1, 1], 1], ["SP", 3, 25, 8, [4, 1], 1], ["SP", 3, 28, 3, [1, 1], 1], ["SP", 3, 31, 3, [3, 1], 1], ["RE", 3, [0, 5, 10, 15, 20, 1, 6, 11, 16, 21, 2, 7, 12, 17, 22, 25, 28, 31, 26, 29, 32, 3, 8, 13, 18, 23, 27, 30, 33, 4, 9, 14, 19, 24]], ["FSP", 4, 0, 1, 3], ["FSP", 4, 4, 2, 3], ["FSP", 4, 8, 3, 3], ["FSP", 4, 12, 4, 3], ["FSP", 4, 16, 5, 3], ["RE", 4, [0, 4, 8, 12, 16, 1, 5, 9, 13, 17, 2, 6, 10, 14, 18, 3, 7, 11, 15, 19]], ["CA", 3, 4, 14], ["CHR", 2, "shared", [3]], ["CA", 3, 4, 17], ["CHR", 1, "shared", [4]], ["CA", 2, 5, 17], ["CI", 1], ["FU", 6, [0, 1, 2, 3, 4]], ["AN", 6, 0, 5], ["FU", 6, [1, 2, 3, 4, 5]], ["AN", 6, 1, 4], ["FU", 6, [2, 3, 4, 5, 6]], ["AN", 6, 2, 6], ["FU", 4, [0, 1, 2, 3, 4]], ["SP", 4, 0, 12, [1], 1], ["AN", 4, 1, 2], ["FFSP", 4, 0, [5, 4, 3, 2, 1], 1, 1], ["AN", 4, 1, 6], ["FU", 2, [0, 1, 2, 3, 4]], ["SP", 2, 0, 56, [1], 1], ["AN", 2, 1, 2], ["FFSP", 2, 0, [5, 4, 3, 2, 1], 1, 1], ["AN", 2, 1, 6], ["PR", 5, 0, "auto_unroll_max_step$512"]]]], "r": [[3.62426e-05, 3.63547e-05, 3.63521e-05, 3.6356e-05, 3.63518e-05, 3.63534e-05, 3.63518e-05, 3.63572e-05, 3.63588e-05, 3.63597e-05], 0, 101.191, 1657017532], "v": "v0.6"}
{"i": [["[\"fused_conv3x3\", 1, 56, 56, 8, 8, 3, 3, 64]", "cuda -keys=cuda,gpu -max_num_threads=1024 -model=unknown -thread_warp_size=32", [-1, 16, 64, 49152, 2147483647, 1024, 8, 32], "", 0, []], [[], [["CHW", 3, "local"], ["SP", 3, 0, 1, [1, 1, 1, 1], 1], ["SP", 3, 5, 64, [1, 1, 1, 2], 1], ["SP", 3, 10, 56, [1, 8, 1, 1], 1], ["SP", 3, 15, 56, [1, 2, 7, 4], 1], ["SP", 3, 20, 8, [1, 2, 2, 2], 1], ["SP", 3, 25, 8, [1, 2], 1], ["SP", 3, 28, 3, [3, 1], 1], ["SP", 3, 31, 3, [3, 1], 1], ["RE", 3, [0, 5, 10, 15, 20, 1, 6, 11, 16, 21, 2, 7, 12, 17, 22, 25, 28, 31, 26, 29, 32, 3, 8, 13, 18, 23, 27, 30, 33, 4, 9, 14, 19, 24]], ["FSP", 4, 0, 1, 3], ["FSP", 4, 4, 2, 3], ["FSP", 4, 8, 3, 3], ["FSP", 4, 12, 4, 3], ["FSP", 4, 16, 5, 3], ["RE", 4, [0, 4, 8, 12, 16, 1, 5, 9, 13, 17, 2, 6, 10, 14, 18, 3, 7, 11, 15, 19]], ["CA", 3, 4, 14], ["CHR", 2, "shared", [3]], ["CA", 3, 4, 17], ["CHR", 1, "shared", [4]], ["CA", 2, 5, 17], ["CI", 1], ["FU", 6, [0, 1, 2, 3, 4]], ["AN", 6, 0, 5], ["FU", 6, [1, 2, 3, 4, 5]], ["AN", 6, 1, 4], ["FU", 6, [2, 3, 4, 5, 6]], ["AN", 6, 2, 6], ["FU", 4, [0, 1, 2, 3, 4]], ["SP", 4, 0, 144, [1], 1], ["AN", 4, 1, 2], ["FFSP", 4, 0, [5, 4, 3, 2, 1], 1, 1], ["AN", 4, 1, 6], ["FU", 2, [0, 1, 2, 3, 4]], ["SP", 2, 0, 360, [1], 1], ["AN", 2, 1, 2], ["FFSP", 2, 0, [5, 4, 3, 2, 1], 1, 1], ["AN", 2, 1, 6], ["PR", 5, 0, "auto_unroll_max_step$1024"]]]], "r": [[0.000176593, 0.000176572, 0.000176585, 0.000176552, 0.000176524, 0.000176555, 0.000176568, 0.000176501, 0.000176595, 0.00017653], 0, 144.988, 1657017575], "v": "v0.6"}
{"i": [["[\"fused_conv3x3\", 1, 56, 56, 8, 8, 3, 3, 64]", "cuda -keys=cuda,gpu -max_num_threads=1024 -model=unknown -thread_warp_size=32", [-1, 16, 64, 49152, 2147483647, 1024, 8, 32], "", 0, []], [[], [["CHW", 3, "local"], ["SP", 3, 0, 1, [1, 1, 1, 1], 1], ["SP", 3, 5, 64, [2, 4, 8, 1], 1], ["SP", 3, 10, 56, [1, 8, 1, 1], 1], ["SP", 3, 15, 56, [1, 1, 1, 2], 1], ["SP", 3, 20, 8, [1, 2, 1, 1], 1], ["SP", 3, 25, 8, [2, 1], 1], ["SP", 3, 28, 3, [3, 1], 1], ["SP", 3, 31, 3, [1, 3], 1], ["RE", 3, [0, 5, 10, 15, 20, 1, 6, 11, 16, 21, 2, 7, 12, 17, 22, 25, 28, 31, 26, 29, 32, 3, 8, 13, 18, 23, 27, 30, 33, 4, 9, 14, 19, 24]], ["FSP", 4, 0, 1, 3], ["FSP", 4, 4, 2, 3], ["FSP", 4, 8, 3, 3], ["FSP", 4, 12, 4, 3], ["FSP", 4, 16, 5, 3], ["RE", 4, [0, 4, 8, 12, 16, 1, 5, 9, 13, 17, 2, 6, 10, 14, 18, 3, 7, 11, 15, 19]], ["CA", 3, 4, 14], ["CHR", 2, "shared", [3]], ["CA", 3, 4, 17], ["CHR", 1, "shared", [4]], ["CA", 2, 5, 17], ["CI", 1], ["FU", 6, [0, 1, 2, 3, 4]], ["AN", 6, 0, 5], ["FU", 6, [1, 2, 3, 4, 5]], ["AN", 6, 1, 4], ["FU", 6, [2, 3, 4, 5, 6]], ["AN", 6, 2, 6], ["FU", 4, [0, 1, 2, 3, 4]], ["SP", 4, 0, 144, [1], 1], ["AN", 4, 1, 2], ["FFSP", 4, 0, [5, 4, 3, 2, 1], 1, 1], ["AN", 4, 1, 6], ["FU", 2, [0, 1, 2, 3, 4]], ["SP", 2, 0, 288, [1], 1], ["AN", 2, 1, 2], ["FFSP", 2, 0, [5, 4, 3, 2, 1], 1, 1], ["AN", 2, 1, 6], ["PR", 5, 0, "auto_unroll_max_step$512"]]]], "r": [[0.000137838, 0.000137799, 0.000137827, 0.000137827, 0.000137846, 0.000137845, 0.00013783, 0.000137834, 0.000137846, 0.00013786], 0, 68.442, 1657017499], "v": "v0.6"}
{"i": [["[\"fused_conv3x3\", 1, 56, 56, 8, 8, 3, 3, 64]", "cuda -keys=cuda,gpu -max_num_threads=1024 -model=unknown -thread_warp_size=32", [-1, 16, 64, 49152, 2147483647, 1024, 8, 32], "", 0, []], [[], [["CHW", 3, "local"], ["SP", 3, 0, 1, [1, 1, 1, 1], 1], ["SP", 3, 5, 64, [2, 4, 8, 1], 1], ["SP", 3, 10, 56, [1, 8, 1, 1], 1], ["SP", 3, 15, 56, [1, 1, 1, 1], 1], ["SP", 3, 20, 8, [1, 2, 1, 1], 1], ["SP", 3, 25, 8, [2, 1], 1], ["SP", 3, 28, 3, [3, 1], 1], ["SP", 3, 31, 3, [1, 3], 1], ["RE", 3, [0, 5, 10, 15, 20, 1, 6, 11, 16, 21, 2, 7, 12, 17, 22, 25, 28, 31, 26, 29, 32, 3, 8, 13, 18, 23, 27, 30, 33, 4, 9, 14, 19, 24]], ["FSP", 4, 0, 1, 3], ["FSP", 4, 4, 2, 3], ["FSP", 4, 8, 3, 3], ["FSP", 4, 12, 4, 3], ["FSP", 4, 16, 5, 3], ["RE", 4, [0, 4, 8, 12, 16, 1, 5, 9, 13, 17, 2, 6, 10, 14, 18, 3, 7, 11, 15, 19]], ["CA", 3, 4, 14], ["CHR", 2, "shared", [3]], ["CA", 3, 4, 17], ["CHR", 1, "shared", [4]], ["CA", 2, 5, 17], ["CI", 1], ["FU", 6, [0, 1, 2, 3, 4]], ["AN", 6, 0, 5], ["FU", 6, [1, 2, 3, 4, 5]], ["AN", 6, 1, 4], ["FU", 6, [2, 3, 4, 5, 6]], ["AN", 6, 2, 6], ["FU", 4, [0, 1, 2, 3, 4]], ["SP", 4, 0, 144, [1], 1], ["AN", 4, 1, 2], ["FFSP", 4, 0, [5, 4, 3, 2, 1], 1, 1], ["AN", 4, 1, 6], ["FU", 2, [0, 1, 2, 3, 4]], ["SP", 2, 0, 288, [1], 1], ["AN", 2, 1, 2], ["FFSP", 2, 0, [5, 4, 3, 2, 1], 1, 1], ["AN", 2, 1, 6], ["PR", 5, 0, "auto_unroll_max_step$512"]]]], "r": [[0.000162852, 0.000164559, 0.000165178, 0.000165531, 0.00016459, 0.000164965, 0.000165943, 0.000164575, 0.000165282, 0.000166224], 0, 199.292, 1657017629], "v": "v0.6"}
{"i": [["[\"fused_conv3x3\", 1, 56, 56, 8, 8, 3, 3, 64]", "cuda -keys=cuda,gpu -max_num_threads=1024 -model=unknown -thread_warp_size=32", [-1, 16, 64, 49152, 2147483647, 1024, 8, 32], "", 0, []], [[], [["CHW", 3, "local"], ["SP", 3, 0, 1, [1, 1, 1, 1], 1], ["SP", 3, 5, 64, [1, 2, 8, 1], 1], ["SP", 3, 10, 56, [1, 4, 1, 1], 1], ["SP", 3, 15, 56, [2, 4, 1, 1], 1], ["SP", 3, 20, 8, [1, 2, 4, 1], 1], ["SP", 3, 25, 8, [4, 2], 1], ["SP", 3, 28, 3, [1, 3], 1], ["SP", 3, 31, 3, [1, 1], 1], ["RE", 3, [0, 5, 10, 15, 20, 1, 6, 11, 16, 21, 2, 7, 12, 17, 22, 25, 28, 31, 26, 29, 32, 3, 8, 13, 18, 23, 27, 30, 33, 4, 9, 14, 19, 24]], ["FSP", 4, 0, 1, 3], ["FSP", 4, 4, 2, 3], ["FSP", 4, 8, 3, 3], ["FSP", 4, 12, 4, 3], ["FSP", 4, 16, 5, 3], ["RE", 4, [0, 4, 8, 12, 16, 1, 5, 9, 13, 17, 2, 6, 10, 14, 18, 3, 7, 11, 15, 19]], ["CA", 3, 4, 14], ["CHR", 2, "shared", [3]], ["CA", 3, 4, 17], ["CHR", 1, "shared", [4]], ["CA", 2, 5, 17], ["CI", 1], ["FU", 6, [0, 1, 2, 3, 4]], ["AN", 6, 0, 5], ["FU", 6, [1, 2, 3, 4, 5]], ["AN", 6, 1, 4], ["FU", 6, [2, 3, 4, 5, 6]], ["AN", 6, 2, 6], ["FU", 4, [0, 1, 2, 3, 4]], ["SP", 4, 0, 384, [1], 1], ["AN", 4, 1, 2], ["FFSP", 4, 0, [5, 4, 3, 2, 1], 1, 1], ["AN", 4, 1, 6], ["FU", 2, [0, 1, 2, 3, 4]], ["SP", 2, 0, 288, [1], 1], ["AN", 2, 1, 2], ["FFSP", 2, 0, [5, 4, 3, 2, 1], 1, 1], ["AN", 2, 1, 6], ["PR", 5, 0, "auto_unroll_max_step$1024"]]]], "r": [[3.77877e-05, 3.79219e-05, 3.78893e-05, 3.79665e-05, 3.79808e-05, 3.81551e-05, 3.81416e-05, 3.81824e-05, 3.81862e-05, 3.81811e-05], 0, 124.085, 1657017552], "v": "v0.6"}
{"i": [["[\"fused_conv3x3\", 1, 56, 56, 8, 8, 3, 3, 64]", "cuda -keys=cuda,gpu -max_num_threads=1024 -model=unknown -thread_warp_size=32", [-1, 16, 64, 49152, 2147483647, 1024, 8, 32], "", 0, []], [[], [["CHW", 3, "local"], ["SP", 3, 0, 1, [1, 1, 1, 1], 1], ["SP", 3, 5, 64, [1, 2, 4, 1], 1], ["SP", 3, 10, 56, [1, 14, 1, 1], 1], ["SP", 3, 15, 56, [2, 1, 2, 1], 1], ["SP", 3, 20, 8, [1, 1, 1, 4], 1], ["SP", 3, 25, 8, [4, 1], 1], ["SP", 3, 28, 3, [1, 3], 1], ["SP", 3, 31, 3, [1, 3], 1], ["RE", 3, [0, 5, 10, 15, 20, 1, 6, 11, 16, 21, 2, 7, 12, 17, 22, 25, 28, 31, 26, 29, 32, 3, 8, 13, 18, 23, 27, 30, 33, 4, 9, 14, 19, 24]], ["FSP", 4, 0, 1, 3], ["FSP", 4, 4, 2, 3], ["FSP", 4, 8, 3, 3], ["FSP", 4, 12, 4, 3], ["FSP", 4, 16, 5, 3], ["RE", 4, [0, 4, 8, 12, 16, 1, 5, 9, 13, 17, 2, 6, 10, 14, 18, 3, 7, 11, 15, 19]], ["CA", 3, 4, 14], ["CHR", 2, "shared", [3]], ["CA", 3, 4, 17], ["CHR", 1, "shared", [4]], ["CA", 2, 5, 17], ["CI", 1], ["FU", 6, [0, 1, 2, 3, 4]], ["AN", 6, 0, 5], ["FU", 6, [1, 2, 3, 4, 5]], ["AN", 6, 1, 4], ["FU", 6, [2, 3, 4, 5, 6]], ["AN", 6, 2, 6], ["FU", 4, [0, 1, 2, 3, 4]], ["SP", 4, 0, 576, [1], 1], ["AN", 4, 1, 2], ["FFSP", 4, 0, [5, 4, 3, 2, 1], 1, 1], ["AN", 4, 1, 6], ["FU", 2, [0, 1, 2, 3, 4]], ["SP", 2, 0, 192, [1], 1], ["AN", 2, 1, 2], ["FFSP", 2, 0, [5, 4, 3, 2, 1], 1, 1], ["AN", 2, 1, 6], ["PR", 5, 0, "auto_unroll_max_step$1024"]]]], "r": [[8.63385e-05, 8.6355e-05, 8.63386e-05, 8.63593e-05, 8.63458e-05, 8.63379e-05, 8.63547e-05, 8.63664e-05, 8.63519e-05, 8.63571e-05], 0, 167.291, 1657017596], "v": "v0.6"}
{"i": [["[\"fused_conv3x3\", 1, 56, 56, 8, 8, 3, 3, 64]", "cuda -keys=cuda,gpu -max_num_threads=1024 -model=unknown -thread_warp_size=32", [-1, 16, 64, 49152, 2147483647, 1024, 8, 32], "", 0, []], [[], [["CHW", 3, "local"], ["SP", 3, 0, 1, [1, 1, 1, 1], 1], ["SP", 3, 5, 64, [2, 2, 1, 1], 1], ["SP", 3, 10, 56, [1, 7, 2, 1], 1], ["SP", 3, 15, 56, [1, 14, 2, 1], 1], ["SP", 3, 20, 8, [1, 1, 1, 1], 1], ["SP", 3, 25, 8, [1, 1], 1], ["SP", 3, 28, 3, [3, 1], 1], ["SP", 3, 31, 3, [1, 1], 1], ["RE", 3, [0, 5, 10, 15, 20, 1, 6, 11, 16, 21, 2, 7, 12, 17, 22, 25, 28, 31, 26, 29, 32, 3, 8, 13, 18, 23, 27, 30, 33, 4, 9, 14, 19, 24]], ["FSP", 4, 0, 1, 3], ["FSP", 4, 4, 2, 3], ["FSP", 4, 8, 3, 3], ["FSP", 4, 12, 4, 3], ["FSP", 4, 16, 5, 3], ["RE", 4, [0, 4, 8, 12, 16, 1, 5, 9, 13, 17, 2, 6, 10, 14, 18, 3, 7, 11, 15, 19]], ["CA", 3, 4, 14], ["CHR", 2, "shared", [3]], ["CA", 3, 4, 17], ["CHR", 1, "shared", [4]], ["CA", 2, 5, 17], ["CI", 1], ["FU", 6, [0, 1, 2, 3, 4]], ["AN", 6, 0, 5], ["FU", 6, [1, 2, 3, 4, 5]], ["AN", 6, 1, 4], ["FU", 6, [2, 3, 4, 5, 6]], ["AN", 6, 2, 6], ["FU", 4, [0, 1, 2, 3, 4]], ["SP", 4, 0, 1, [1], 1], ["AN", 4, 1, 2], ["FFSP", 4, 0, [5, 4, 3, 2, 1], 1, 1], ["AN", 4, 1, 6], ["FU", 2, [0, 1, 2, 3, 4]], ["SP", 2, 0, 4, [1], 1], ["AN", 2, 1, 2], ["FFSP", 2, 0, [5, 4, 3, 2, 1], 1, 1], ["AN", 2, 1, 6], ["PR", 5, 0, "auto_unroll_max_step$0"]]]], "r": [[0.000256142, 0.000256179, 0.00025609, 0.0002561, 0.000256272, 0.000256405, 0.000256091, 0.000256299, 0.000256209, 0.000256222], 0, 84.0079, 1657017515], "v": "v0.6"}
{"i": [["[\"fused_conv3x3\", 1, 56, 56, 8, 8, 3, 3, 64]", "cuda -keys=cuda,gpu -max_num_threads=1024 -model=unknown -thread_warp_size=32", [-1, 16, 64, 49152, 2147483647, 1024, 8, 32], "", 0, []], [[], [["CHW", 3, "local"], ["SP", 3, 0, 1, [1, 1, 1, 1], 1], ["SP", 3, 5, 64, [1, 1, 1, 4], 1], ["SP", 3, 10, 56, [1, 8, 1, 1], 1], ["SP", 3, 15, 56, [2, 1, 14, 1], 1], ["SP", 3, 20, 8, [2, 4, 1, 1], 1], ["SP", 3, 25, 8, [2, 4], 1], ["SP", 3, 28, 3, [1, 3], 1], ["SP", 3, 31, 3, [1, 3], 1], ["RE", 3, [0, 5, 10, 15, 20, 1, 6, 11, 16, 21, 2, 7, 12, 17, 22, 25, 28, 31, 26, 29, 32, 3, 8, 13, 18, 23, 27, 30, 33, 4, 9, 14, 19, 24]], ["FSP", 4, 0, 1, 3], ["FSP", 4, 4, 2, 3], ["FSP", 4, 8, 3, 3], ["FSP", 4, 12, 4, 3], ["FSP", 4, 16, 5, 3], ["RE", 4, [0, 4, 8, 12, 16, 1, 5, 9, 13, 17, 2, 6, 10, 14, 18, 3, 7, 11, 15, 19]], ["CA", 3, 4, 14], ["CHR", 2, "shared", [3]], ["CA", 3, 4, 17], ["CHR", 1, "shared", [4]], ["CA", 2, 5, 17], ["CI", 1], ["FU", 6, [0, 1, 2, 3, 4]], ["AN", 6, 0, 5], ["FU", 6, [1, 2, 3, 4, 5]], ["AN", 6, 1, 4], ["FU", 6, [2, 3, 4, 5, 6]], ["AN", 6, 2, 6], ["FU", 4, [0, 1, 2, 3, 4]], ["SP", 4, 0, 288, [1], 1], ["AN", 4, 1, 2], ["FFSP", 4, 0, [5, 4, 3, 2, 1], 1, 1], ["AN", 4, 1, 6], ["FU", 2, [0, 1, 2, 3, 4]], ["SP", 2, 0, 1536, [1], 1], ["AN", 2, 1, 2], ["FFSP", 2, 0, [5, 4, 3, 2, 1], 1, 1], ["AN", 2, 1, 6], ["PR", 5, 0, "auto_unroll_max_step$16"]]]], "r": [[0.000179346, 0.000179324, 0.000179208, 0.000179153, 0.000179109, 0.000179123, 0.000179131, 0.000179183, 0.000179107, 0.000179119], 0, 138.004, 1657017569], "v": "v0.6"}
{"i": [["[\"fused_conv3x3\", 1, 56, 56, 8, 8, 3, 3, 64]", "cuda -keys=cuda,gpu -max_num_threads=1024 -model=unknown -thread_warp_size=32", [-1, 16, 64, 49152, 2147483647, 1024, 8, 32], "", 0, []], [[], [["CHW", 3, "local"], ["SP", 3, 0, 1, [1, 1, 1, 1], 1], ["SP", 3, 5, 64, [1, 2, 2, 1], 1], ["SP", 3, 10, 56, [8, 1, 1, 1], 1], ["SP", 3, 15, 56, [1, 14, 2, 1], 1], ["SP", 3, 20, 8, [1, 4, 1, 1], 1], ["SP", 3, 25, 8, [1, 1], 1], ["SP", 3, 28, 3, [1, 3], 1], ["SP", 3, 31, 3, [1, 1], 1], ["RE", 3, [0, 5, 10, 15, 20, 1, 6, 11, 16, 21, 2, 7, 12, 17, 22, 25, 28, 31, 26, 29, 32, 3, 8, 13, 18, 23, 27, 30, 33, 4, 9, 14, 19, 24]], ["FSP", 4, 0, 1, 3], ["FSP", 4, 4, 2, 3], ["FSP", 4, 8, 3, 3], ["FSP", 4, 12, 4, 3], ["FSP", 4, 16, 5, 3], ["RE", 4, [0, 4, 8, 12, 16, 1, 5, 9, 13, 17, 2, 6, 10, 14, 18, 3, 7, 11, 15, 19]], ["CA", 3, 4, 14], ["CHR", 2, "shared", [3]], ["CA", 3, 4, 17], ["CHR", 1, "shared", [4]], ["CA", 2, 5, 17], ["CI", 1], ["FU", 6, [0, 1, 2, 3, 4]], ["AN", 6, 0, 5], ["FU", 6, [1, 2, 3, 4, 5]], ["AN", 6, 1, 4], ["FU", 6, [2, 3, 4, 5, 6]], ["AN", 6, 2, 6], ["FU", 4, [0, 1, 2, 3, 4]], ["SP", 4, 0, 6, [1], 1], ["AN", 4, 1, 2], ["FFSP", 4, 0, [5, 4, 3, 2, 1], 1, 1], ["AN", 4, 1, 6], ["FU", 2, [0, 1, 2, 3, 4]], ["SP", 2, 0, 24, [1], 1], ["AN", 2, 1, 2], ["FFSP", 2, 0, [5, 4, 3, 2, 1], 1, 1], ["AN", 2, 1, 6], ["PR", 5, 0, "auto_unroll_max_step$512"]]]], "r": [[6.66609e-05, 6.66702e-05, 6.66547e-05, 6.66535e-05, 6.66437e-05, 6.66414e-05, 6.66323e-05, 6.66273e-05, 6.66385e-05, 6.66412e-05], 0, 155.879, 1657017587], "v": "v0.6"}
{"i": [["[\"fused_conv3x3\", 1, 56, 56, 8, 8, 3, 3, 64]", "cuda -keys=cuda,gpu -max_num_threads=1024 -model=unknown -thread_warp_size=32", [-1, 16, 64, 49152, 2147483647, 1024, 8, 32], "", 0, []], [[], [["CHW", 3, "local"], ["SP", 3, 0, 1, [1, 1, 1, 1], 1], ["SP", 3, 5, 64, [1, 4, 2, 1], 1], ["SP", 3, 10, 56, [1, 28, 1, 1], 1], ["SP", 3, 15, 56, [1, 1, 1, 1], 1], ["SP", 3, 20, 8, [1, 1, 4, 1], 1], ["SP", 3, 25, 8, [4, 2], 1], ["SP", 3, 28, 3, [1, 3], 1], ["SP", 3, 31, 3, [3, 1], 1], ["RE", 3, [0, 5, 10, 15, 20, 1, 6, 11, 16, 21, 2, 7, 12, 17, 22, 25, 28, 31, 26, 29, 32, 3, 8, 13, 18, 23, 27, 30, 33, 4, 9, 14, 19, 24]], ["FSP", 4, 0, 1, 3], ["FSP", 4, 4, 2, 3], ["FSP", 4, 8, 3, 3], ["FSP", 4, 12, 4, 3], ["FSP", 4, 16, 5, 3], ["RE", 4, [0, 4, 8, 12, 16, 1, 5, 9, 13, 17, 2, 6, 10, 14, 18, 3, 7, 11, 15, 19]], ["CA", 3, 4, 14], ["CHR", 2, "shared", [3]], ["CA", 3, 4, 17], ["CHR", 1, "shared", [4]], ["CA", 2, 5, 17], ["CI", 1], ["FU", 6, [0, 1, 2, 3, 4]], ["AN", 6, 0, 5], ["FU", 6, [1, 2, 3, 4, 5]], ["AN", 6, 1, 4], ["FU", 6, [2, 3, 4, 5, 6]], ["AN", 6, 2, 6], ["FU", 4, [0, 1, 2, 3, 4]], ["SP", 4, 0, 576, [1], 1], ["AN", 4, 1, 2], ["FFSP", 4, 0, [5, 4, 3, 2, 1], 1, 1], ["AN", 4, 1, 6], ["FU", 2, [0, 1, 2, 3, 4]], ["SP", 2, 0, 144, [1], 1], ["AN", 2, 1, 2], ["FFSP", 2, 0, [5, 4, 3, 2, 1], 1, 1], ["AN", 2, 1, 6], ["PR", 5, 0, "auto_unroll_max_step$512"]]]], "r": [[7.56771e-05, 7.6328e-05, 7.78568e-05, 7.75313e-05, 7.70881e-05, 7.70997e-05, 7.70899e-05, 7.70996e-05, 7.7093e-05, 7.70961e-05], 0, 159.65, 1657017590], "v": "v0.6"}
{"i": [["[\"fused_conv3x3\", 1, 56, 56, 8, 8, 3, 3, 64]", "cuda -keys=cuda,gpu -max_num_threads=1024 -model=unknown -thread_warp_size=32", [-1, 16, 64, 49152, 2147483647, 1024, 8, 32], "", 0, []], [[], [["CHW", 3, "local"], ["SP", 3, 0, 1, [1, 1, 1, 1], 1], ["SP", 3, 5, 64, [1, 1, 1, 1], 1], ["SP", 3, 10, 56, [1, 14, 2, 1], 1], ["SP", 3, 15, 56, [1, 7, 2, 1], 1], ["SP", 3, 20, 8, [4, 1, 1, 1], 1], ["SP", 3, 25, 8, [2, 2], 1], ["SP", 3, 28, 3, [1, 1], 1], ["SP", 3, 31, 3, [3, 1], 1], ["RE", 3, [0, 5, 10, 15, 20, 1, 6, 11, 16, 21, 2, 7, 12, 17, 22, 25, 28, 31, 26, 29, 32, 3, 8, 13, 18, 23, 27, 30, 33, 4, 9, 14, 19, 24]], ["FSP", 4, 0, 1, 3], ["FSP", 4, 4, 2, 3], ["FSP", 4, 8, 3, 3], ["FSP", 4, 12, 4, 3], ["FSP", 4, 16, 5, 3], ["RE", 4, [0, 4, 8, 12, 16, 1, 5, 9, 13, 17, 2, 6, 10, 14, 18, 3, 7, 11, 15, 19]], ["CA", 3, 4, 14], ["CHR", 2, "shared", [3]], ["CA", 3, 4, 17], ["CHR", 1, "shared", [4]], ["CA", 2, 5, 17], ["CI", 1], ["FU", 6, [0, 1, 2, 3, 4]], ["AN", 6, 0, 5], ["FU", 6, [1, 2, 3, 4, 5]], ["AN", 6, 1, 4], ["FU", 6, [2, 3, 4, 5, 6]], ["AN", 6, 2, 6], ["FU", 4, [0, 1, 2, 3, 4]], ["SP", 4, 0, 72, [1], 1], ["AN", 4, 1, 2], ["FFSP", 4, 0, [5, 4, 3, 2, 1], 1, 1], ["AN", 4, 1, 6], ["FU", 2, [0, 1, 2, 3, 4]], ["SP", 2, 0, 96, [1], 1], ["AN", 2, 1, 2], ["FFSP", 2, 0, [5, 4, 3, 2, 1], 1, 1], ["AN", 2, 1, 6], ["PR", 5, 0, "auto_unroll_max_step$512"]]]], "r": [[4.99597e-05, 5.01054e-05, 4.99457e-05, 5.01744e-05, 5.00063e-05, 5.02752e-05, 4.99941e-05, 5.0304e-05, 5.00556e-05, 5.02826e-05], 0, 215.42, 1657017647], "v": "v0.6"}
{"i": [["[\"fused_conv3x3\", 1, 56, 56, 8, 8, 3, 3, 64]", "cuda -keys=cuda,gpu -max_num_threads=1024 -model=unknown -thread_warp_size=32", [-1, 16, 64, 49152, 2147483647, 1024, 8, 32], "", 0, []], [[], [["CHW", 3, "local"], ["SP", 3, 0, 1, [1, 1, 1, 1], 1], ["SP", 3, 5, 64, [1, 1, 1, 8], 1], ["SP", 3, 10, 56, [4, 14, 1, 1], 1], ["SP", 3, 15, 56, [1, 1, 2, 1], 1], ["SP", 3, 20, 8, [1, 1, 2, 4], 1], ["SP", 3, 25, 8, [2, 1], 1], ["SP", 3, 28, 3, [1, 3], 1], ["SP", 3, 31, 3, [1, 1], 1], ["RE", 3, [0, 5, 10, 15, 20, 1, 6, 11, 16, 21, 2, 7, 12, 17, 22, 25, 28, 31, 26, 29, 32, 3, 8, 13, 18, 23, 27, 30, 33, 4, 9, 14, 19, 24]], ["FSP", 4, 0, 1, 3], ["FSP", 4, 4, 2, 3], ["FSP", 4, 8, 3, 3], ["FSP", 4, 12, 4, 3], ["FSP", 4, 16, 5, 3], ["RE", 4, [0, 4, 8, 12, 16, 1, 5, 9, 13, 17, 2, 6, 10, 14, 18, 3, 7, 11, 15, 19]], ["CA", 3, 4, 14], ["CHR", 2, "shared", [3]], ["CA", 3, 4, 17], ["CHR", 1, "shared", [4]], ["CA", 2, 5, 17], ["CI", 1], ["FU", 6, [0, 1, 2, 3, 4]], ["AN", 6, 0, 5], ["FU", 6, [1, 2, 3, 4, 5]], ["AN", 6, 1, 4], ["FU", 6, [2, 3, 4, 5, 6]], ["AN", 6, 2, 6], ["FU", 4, [0, 1, 2, 3, 4]], ["SP", 4, 0, 256, [1], 1], ["AN", 4, 1, 2], ["FFSP", 4, 0, [5, 4, 3, 2, 1], 1, 1], ["AN", 4, 1, 6], ["FU", 2, [0, 1, 2, 3, 4]], ["SP", 2, 0, 64, [1], 1], ["AN", 2, 1, 2], ["FFSP", 2, 0, [5, 4, 3, 2, 1], 1, 1], ["AN", 2, 1, 6], ["PR", 5, 0, "auto_unroll_max_step$64"]]]], "r": [[0.00142142, 0.00142204, 0.00142169, 0.00142192, 0.00142165, 0.00142227, 0.00142162, 0.00142276, 0.00142176, 0.00142274], 0, 195.623, 1657017626], "v": "v0.6"}
{"i": [["[\"fused_conv3x3\", 1, 56, 56, 8, 8, 3, 3, 64]", "cuda -keys=cuda,gpu -max_num_threads=1024 -model=unknown -thread_warp_size=32", [-1, 16, 64, 49152, 2147483647, 1024, 8, 32], "", 0, []], [[], [["CHW", 3, "local"], ["SP", 3, 0, 1, [1, 1, 1, 1], 1], ["SP", 3, 5, 64, [4, 8, 1, 2], 1], ["SP", 3, 10, 56, [2, 1, 1, 1], 1], ["SP", 3, 15, 56, [1, 1, 2, 1], 1], ["SP", 3, 20, 8, [1, 2, 1, 1], 1], ["SP", 3, 25, 8, [2, 2], 1], ["SP", 3, 28, 3, [1, 1], 1], ["SP", 3, 31, 3, [1, 1], 1], ["RE", 3, [0, 5, 10, 15, 20, 1, 6, 11, 16, 21, 2, 7, 12, 17, 22, 25, 28, 31, 26, 29, 32, 3, 8, 13, 18, 23, 27, 30, 33, 4, 9, 14, 19, 24]], ["FSP", 4, 0, 1, 3], ["FSP", 4, 4, 2, 3], ["FSP", 4, 8, 3, 3], ["FSP", 4, 12, 4, 3], ["FSP", 4, 16, 5, 3], ["RE", 4, [0, 4, 8, 12, 16, 1, 5, 9, 13, 17, 2, 6, 10, 14, 18, 3, 7, 11, 15, 19]], ["CA", 3, 4, 14], ["CHR", 2, "shared", [3]], ["CA", 3, 4, 17], ["CHR", 1, "shared", [4]], ["CA", 2, 5, 17], ["CI", 1], ["FU", 6, [0, 1, 2, 3, 4]], ["AN", 6, 0, 5], ["FU", 6, [1, 2, 3, 4, 5]], ["AN", 6, 1, 4], ["FU", 6, [2, 3, 4, 5, 6]], ["AN", 6, 2, 6], ["FU", 4, [0, 1, 2, 3, 4]], ["SP", 4, 0, 24, [1], 1], ["AN", 4, 1, 2], ["FFSP", 4, 0, [5, 4, 3, 2, 1], 1, 1], ["AN", 4, 1, 6], ["FU", 2, [0, 1, 2, 3, 4]], ["SP", 2, 0, 96, [1], 1], ["AN", 2, 1, 2], ["FFSP", 2, 0, [5, 4, 3, 2, 1], 1, 1], ["AN", 2, 1, 6], ["PR", 5, 0, "auto_unroll_max_step$1024"]]]], "r": [[0.000303452, 0.000304243, 0.000305049, 0.000310225, 0.000304316, 0.00030512, 0.000310146, 0.000305633, 0.000307214, 0.000306669], 0, 190.999, 1657017620], "v": "v0.6"}
{"i": [["[\"fused_conv3x3\", 1, 56, 56, 8, 8, 3, 3, 64]", "cuda -keys=cuda,gpu -max_num_threads=1024 -model=unknown -thread_warp_size=32", [-1, 16, 64, 49152, 2147483647, 1024, 8, 32], "", 0, []], [[], [["CHW", 3, "local"], ["SP", 3, 0, 1, [1, 1, 1, 1], 1], ["SP", 3, 5, 64, [1, 2, 8, 1], 1], ["SP", 3, 10, 56, [1, 4, 1, 1], 1], ["SP", 3, 15, 56, [2, 4, 1, 1], 1], ["SP", 3, 20, 8, [1, 4, 2, 1], 1], ["SP", 3, 25, 8, [8, 1], 1], ["SP", 3, 28, 3, [1, 1], 1], ["SP", 3, 31, 3, [1, 1], 1], ["RE", 3, [0, 5, 10, 15, 20, 1, 6, 11, 16, 21, 2, 7, 12, 17, 22, 25, 28, 31, 26, 29, 32, 3, 8, 13, 18, 23, 27, 30, 33, 4, 9, 14, 19, 24]], ["FSP", 4, 0, 1, 3], ["FSP", 4, 4, 2, 3], ["FSP", 4, 8, 3, 3], ["FSP", 4, 12, 4, 3], ["FSP", 4, 16, 5, 3], ["RE", 4, [0, 4, 8, 12, 16, 1, 5, 9, 13, 17, 2, 6, 10, 14, 18, 3, 7, 11, 15, 19]], ["CA", 3, 4, 14], ["CHR", 2, "shared", [3]], ["CA", 3, 4, 17], ["CHR", 1, "shared", [4]], ["CA", 2, 5, 17], ["CI", 1], ["FU", 6, [0, 1, 2, 3, 4]], ["AN", 6, 0, 5], ["FU", 6, [1, 2, 3, 4, 5]], ["AN", 6, 1, 4], ["FU", 6, [2, 3, 4, 5, 6]], ["AN", 6, 2, 6], ["FU", 4, [0, 1, 2, 3, 4]], ["SP", 4, 0, 384, [1], 1], ["AN", 4, 1, 2], ["FFSP", 4, 0, [5, 4, 3, 2, 1], 1, 1], ["AN", 4, 1, 6], ["FU", 2, [0, 1, 2, 3, 4]], ["SP", 2, 0, 288, [1], 1], ["AN", 2, 1, 2], ["FFSP", 2, 0, [5, 4, 3, 2, 1], 1, 1], ["AN", 2, 1, 6], ["PR", 5, 0, "auto_unroll_max_step$1024"]]]], "r": [[3.74759e-05, 3.75643e-05, 3.74925e-05, 3.76145e-05, 3.74926e-05, 3.76893e-05, 3.74939e-05, 3.77218e-05, 3.75134e-05, 3.77503e-05], 0, 172.316, 1657017602], "v": "v0.6"}
{"i": [["[\"fused_conv3x3\", 1, 56, 56, 8, 8, 3, 3, 64]", "cuda -keys=cuda,gpu -max_num_threads=1024 -model=unknown -thread_warp_size=32", [-1, 16, 64, 49152, 2147483647, 1024, 8, 32], "", 0, []], [[], [["CHW", 3, "local"], ["SP", 3, 0, 1, [1, 1, 1, 1], 1], ["SP", 3, 5, 64, [1, 2, 4, 2], 1], ["SP", 3, 10, 56, [1, 4, 1, 2], 1], ["SP", 3, 15, 56, [1, 28, 1, 2], 1], ["SP", 3, 20, 8, [1, 1, 2, 2], 1], ["SP", 3, 25, 8, [1, 1], 1], ["SP", 3, 28, 3, [1, 1], 1], ["SP", 3, 31, 3, [1, 1], 1], ["RE", 3, [0, 5, 10, 15, 20, 1, 6, 11, 16, 21, 2, 7, 12, 17, 22, 25, 28, 31, 26, 29, 32, 3, 8, 13, 18, 23, 27, 30, 33, 4, 9, 14, 19, 24]], ["FSP", 4, 0, 1, 3], ["FSP", 4, 4, 2, 3], ["FSP", 4, 8, 3, 3], ["FSP", 4, 12, 4, 3], ["FSP", 4, 16, 5, 3], ["RE", 4, [0, 4, 8, 12, 16, 1, 5, 9, 13, 17, 2, 6, 10, 14, 18, 3, 7, 11, 15, 19]], ["CA", 3, 4, 14], ["CHR", 2, "shared", [3]], ["CA", 3, 4, 17], ["CHR", 1, "shared", [4]], ["CA", 2, 5, 17], ["CI", 1], ["FU", 6, [0, 1, 2, 3, 4]], ["AN", 6, 0, 5], ["FU", 6, [1, 2, 3, 4, 5]], ["AN", 6, 1, 4], ["FU", 6, [2, 3, 4, 5, 6]], ["AN", 6, 2, 6], ["FU", 4, [0, 1, 2, 3, 4]], ["SP", 4, 0, 32, [1], 1], ["AN", 4, 1, 2], ["FFSP", 4, 0, [5, 4, 3, 2, 1], 1, 1], ["AN", 4, 1, 6], ["FU", 2, [0, 1, 2, 3, 4]], ["SP", 2, 0, 32, [4], 1], ["AN", 2, 1, 2], ["FFSP", 2, 0, [5, 4, 3, 2, 1], 1, 1], ["AN", 2, 1, 6], ["PR", 5, 0, "auto_unroll_max_step$1024"]]]], "r": [[0.000500006, 0.000500026, 0.000500034, 0.000500032, 0.000500028, 0.000500017, 0.000500043, 0.000500031, 0.00050006, 0.000500027], 0, 210.987, 1657017641], "v": "v0.6"}
{"i": [["[\"fused_conv3x3\", 1, 56, 56, 8, 8, 3, 3, 64]", "cuda -keys=cuda,gpu -max_num_threads=1024 -model=unknown -thread_warp_size=32", [-1, 16, 64, 49152, 2147483647, 1024, 8, 32], "", 0, []], [[], [["CHW", 3, "local"], ["SP", 3, 0, 1, [1, 1, 1, 1], 1], ["SP", 3, 5, 64, [1, 32, 2, 1], 1], ["SP", 3, 10, 56, [1, 1, 4, 2], 1], ["SP", 3, 15, 56, [1, 1, 1, 8], 1], ["SP", 3, 20, 8, [1, 1, 1, 2], 1], ["SP", 3, 25, 8, [1, 2], 1], ["SP", 3, 28, 3, [1, 1], 1], ["SP", 3, 31, 3, [1, 3], 1], ["RE", 3, [0, 5, 10, 15, 20, 1, 6, 11, 16, 21, 2, 7, 12, 17, 22, 25, 28, 31, 26, 29, 32, 3, 8, 13, 18, 23, 27, 30, 33, 4, 9, 14, 19, 24]], ["FSP", 4, 0, 1, 3], ["FSP", 4, 4, 2, 3], ["FSP", 4, 8, 3, 3], ["FSP", 4, 12, 4, 3], ["FSP", 4, 16, 5, 3], ["RE", 4, [0, 4, 8, 12, 16, 1, 5, 9, 13, 17, 2, 6, 10, 14, 18, 3, 7, 11, 15, 19]], ["CA", 3, 4, 14], ["CHR", 2, "shared", [3]], ["CA", 3, 4, 17], ["CHR", 1, "shared", [4]], ["CA", 2, 5, 17], ["CI", 1], ["FU", 6, [0, 1, 2, 3, 4]], ["AN", 6, 0, 5], ["FU", 6, [1, 2, 3, 4, 5]], ["AN", 6, 1, 4], ["FU", 6, [2, 3, 4, 5, 6]], ["AN", 6, 2, 6], ["FU", 4, [0, 1, 2, 3, 4]], ["SP", 4, 0, 24, [1], 1], ["AN", 4, 1, 2], ["FFSP", 4, 0, [5, 4, 3, 2, 1], 1, 1], ["AN", 4, 1, 6], ["FU", 2, [0, 1, 2, 3, 4]], ["SP", 2, 0, 256, [64], 1], ["AN", 2, 1, 2], ["FFSP", 2, 0, [5, 4, 3, 2, 1], 1, 1], ["AN", 2, 1, 6], ["PR", 5, 0, "auto_unroll_max_step$0"]]]], "r": [[0.00068098, 0.000680921, 0.000681035, 0.000681598, 0.000681619, 0.000681597, 0.000681706, 0.000681633, 0.000681636, 0.000681616], 0, 181.942, 1657017613], "v": "v0.6"}
{"i": [["[\"fused_conv3x3\", 1, 56, 56, 8, 8, 3, 3, 64]", "cuda -keys=cuda,gpu -max_num_threads=1024 -model=unknown -thread_warp_size=32", [-1, 16, 64, 49152, 2147483647, 1024, 8, 32], "", 0, []], [[], [["CHW", 3, "local"], ["SP", 3, 0, 1, [1, 1, 1, 1], 1], ["SP", 3, 5, 64, [1, 16, 1, 1], 1], ["SP", 3, 10, 56, [1, 2, 7, 4], 1], ["SP", 3, 15, 56, [1, 2, 1, 2], 1], ["SP", 3, 20, 8, [1, 2, 1, 1], 1], ["SP", 3, 25, 8, [1, 1], 1], ["SP", 3, 28, 3, [1, 3], 1], ["SP", 3, 31, 3, [3, 1], 1], ["RE", 3, [0, 5, 10, 15, 20, 1, 6, 11, 16, 21, 2, 7, 12, 17, 22, 25, 28, 31, 26, 29, 32, 3, 8, 13, 18, 23, 27, 30, 33, 4, 9, 14, 19, 24]], ["FSP", 4, 0, 1, 3], ["FSP", 4, 4, 2, 3], ["FSP", 4, 8, 3, 3], ["FSP", 4, 12, 4, 3], ["FSP", 4, 16, 5, 3], ["RE", 4, [0, 4, 8, 12, 16, 1, 5, 9, 13, 17, 2, 6, 10, 14, 18, 3, 7, 11, 15, 19]], ["CA", 3, 4, 14], ["CHR", 2, "shared", [3]], ["CA", 3, 4, 17], ["CHR", 1, "shared", [4]], ["CA", 2, 5, 17], ["CI", 1], ["FU", 6, [0, 1, 2, 3, 4]], ["AN", 6, 0, 5], ["FU", 6, [1, 2, 3, 4, 5]], ["AN", 6, 1, 4], ["FU", 6, [2, 3, 4, 5, 6]], ["AN", 6, 2, 6], ["FU", 4, [0, 1, 2, 3, 4]], ["SP", 4, 0, 9, [1], 1], ["AN", 4, 1, 2], ["FFSP", 4, 0, [5, 4, 3, 2, 1], 1, 1], ["AN", 4, 1, 6], ["FU", 2, [0, 1, 2, 3, 4]], ["SP", 2, 0, 120, [30], 1], ["AN", 2, 1, 2], ["FFSP", 2, 0, [5, 4, 3, 2, 1], 1, 1], ["AN", 2, 1, 6], ["PR", 5, 0, "auto_unroll_max_step$0"]]]], "r": [[0.000292097, 0.000292132, 0.000292141, 0.000292132, 0.000292089, 0.000292119, 0.000292132, 0.000292147, 0.000292139, 0.000292118], 0, 126.309, 1657017558], "v": "v0.6"}
{"i": [["[\"fused_conv3x3\", 1, 56, 56, 8, 8, 3, 3, 64]", "cuda -keys=cuda,gpu -max_num_threads=1024 -model=unknown -thread_warp_size=32", [-1, 16, 64, 49152, 2147483647, 1024, 8, 32], "", 0, []], [[], [["CHW", 3, "local"], ["SP", 3, 0, 1, [1, 1, 1, 1], 1], ["SP", 3, 5, 64, [2, 2, 2, 1], 1], ["SP", 3, 10, 56, [1, 1, 1, 14], 1], ["SP", 3, 15, 56, [1, 14, 1, 1], 1], ["SP", 3, 20, 8, [1, 2, 1, 4], 1], ["SP", 3, 25, 8, [1, 2], 1], ["SP", 3, 28, 3, [1, 3], 1], ["SP", 3, 31, 3, [1, 3], 1], ["RE", 3, [0, 5, 10, 15, 20, 1, 6, 11, 16, 21, 2, 7, 12, 17, 22, 25, 28, 31, 26, 29, 32, 3, 8, 13, 18, 23, 27, 30, 33, 4, 9, 14, 19, 24]], ["FSP", 4, 0, 1, 3], ["FSP", 4, 4, 2, 3], ["FSP", 4, 8, 3, 3], ["FSP", 4, 12, 4, 3], ["FSP", 4, 16, 5, 3], ["RE", 4, [0, 4, 8, 12, 16, 1, 5, 9, 13, 17, 2, 6, 10, 14, 18, 3, 7, 11, 15, 19]], ["CA", 3, 4, 14], ["CHR", 2, "shared", [3]], ["CA", 3, 4, 17], ["CHR", 1, "shared", [4]], ["CA", 2, 5, 17], ["CI", 1], ["FU", 6, [0, 1, 2, 3, 4]], ["AN", 6, 0, 5], ["FU", 6, [1, 2, 3, 4, 5]], ["AN", 6, 1, 4], ["FU", 6, [2, 3, 4, 5, 6]], ["AN", 6, 2, 6], ["FU", 4, [0, 1, 2, 3, 4]], ["SP", 4, 0, 12, [1], 1], ["AN", 4, 1, 2], ["FFSP", 4, 0, [5, 4, 3, 2, 1], 1, 1], ["AN", 4, 1, 6], ["FU", 2, [0, 1, 2, 3, 4]], ["SP", 2, 0, 28, [1], 1], ["AN", 2, 1, 2], ["FFSP", 2, 0, [5, 4, 3, 2, 1], 1, 1], ["AN", 2, 1, 6], ["PR", 5, 0, "auto_unroll_max_step$64"]]]], "r": [[0.000151871, 0.000151905, 0.000151873, 0.000151892, 0.000151907, 0.000151873, 0.000151868, 0.000151888, 0.000151889, 0.000151857], 0, 132.523, 1657017564], "v": "v0.6"}
{"i": [["[\"fused_conv3x3\", 1, 56, 56, 8, 8, 3, 3, 64]", "cuda -keys=cuda,gpu -max_num_threads=1024 -model=unknown -thread_warp_size=32", [-1, 16, 64, 49152, 2147483647, 1024, 8, 32], "", 0, []], [[], [["CHW", 3, "local"], ["SP", 3, 0, 1, [1, 1, 1, 1], 1], ["SP", 3, 5, 64, [8, 4, 1, 2], 1], ["SP", 3, 10, 56, [1, 2, 7, 1], 1], ["SP", 3, 15, 56, [1, 1, 1, 1], 1], ["SP", 3, 20, 8, [1, 2, 1, 1], 1], ["SP", 3, 25, 8, [2, 1], 1], ["SP", 3, 28, 3, [1, 1], 1], ["SP", 3, 31, 3, [1, 3], 1], ["RE", 3, [0, 5, 10, 15, 20, 1, 6, 11, 16, 21, 2, 7, 12, 17, 22, 25, 28, 31, 26, 29, 32, 3, 8, 13, 18, 23, 27, 30, 33, 4, 9, 14, 19, 24]], ["FSP", 4, 0, 1, 3], ["FSP", 4, 4, 2, 3], ["FSP", 4, 8, 3, 3], ["FSP", 4, 12, 4, 3], ["FSP", 4, 16, 5, 3], ["RE", 4, [0, 4, 8, 12, 16, 1, 5, 9, 13, 17, 2, 6, 10, 14, 18, 3, 7, 11, 15, 19]], ["CA", 3, 4, 14], ["CHR", 2, "shared", [3]], ["CA", 3, 4, 17], ["CHR", 1, "shared", [4]], ["CA", 2, 5, 17], ["CI", 1], ["FU", 6, [0, 1, 2, 3, 4]], ["AN", 6, 0, 5], ["FU", 6, [1, 2, 3, 4, 5]], ["AN", 6, 1, 4], ["FU", 6, [2, 3, 4, 5, 6]], ["AN", 6, 2, 6], ["FU", 4, [0, 1, 2, 3, 4]], ["SP", 4, 0, 12, [1], 1], ["AN", 4, 1, 2], ["FFSP", 4, 0, [5, 4, 3, 2, 1], 1, 1], ["AN", 4, 1, 6], ["FU", 2, [0, 1, 2, 3, 4]], ["SP", 2, 0, 28, [1], 1], ["AN", 2, 1, 2], ["FFSP", 2, 0, [5, 4, 3, 2, 1], 1, 1], ["AN", 2, 1, 6], ["PR", 5, 0, "auto_unroll_max_step$0"]]]], "r": [[0.000344659, 0.000348136, 0.000349068, 0.000350496, 0.000348701, 0.000348611, 0.000350429, 0.000348951, 0.000348561, 0.00035086], 0, 185.398, 1657017617], "v": "v0.6"}
{"i": [["[\"fused_conv3x3\", 1, 56, 56, 8, 8, 3, 3, 64]", "cuda -keys=cuda,gpu -max_num_threads=1024 -model=unknown -thread_warp_size=32", [-1, 16, 64, 49152, 2147483647, 1024, 8, 32], "", 0, []], [[], [["CHW", 3, "local"], ["SP", 3, 0, 1, [1, 1, 1, 1], 1], ["SP", 3, 5, 64, [1, 4, 4, 1], 1], ["SP", 3, 10, 56, [1, 1, 1, 2], 1], ["SP", 3, 15, 56, [1, 28, 1, 2], 1], ["SP", 3, 20, 8, [4, 1, 1, 2], 1], ["SP", 3, 25, 8, [2, 1], 1], ["SP", 3, 28, 3, [1, 3], 1], ["SP", 3, 31, 3, [1, 1], 1], ["RE", 3, [0, 5, 10, 15, 20, 1, 6, 11, 16, 21, 2, 7, 12, 17, 22, 25, 28, 31, 26, 29, 32, 3, 8, 13, 18, 23, 27, 30, 33, 4, 9, 14, 19, 24]], ["FSP", 4, 0, 1, 3], ["FSP", 4, 4, 2, 3], ["FSP", 4, 8, 3, 3], ["FSP", 4, 12, 4, 3], ["FSP", 4, 16, 5, 3], ["RE", 4, [0, 4, 8, 12, 16, 1, 5, 9, 13, 17, 2, 6, 10, 14, 18, 3, 7, 11, 15, 19]], ["CA", 3, 4, 14], ["CHR", 2, "shared", [3]], ["CA", 3, 4, 17], ["CHR", 1, "shared", [4]], ["CA", 2, 5, 17], ["CI", 1], ["FU", 6, [0, 1, 2, 3, 4]], ["AN", 6, 0, 5], ["FU", 6, [1, 2, 3, 4, 5]], ["AN", 6, 1, 4], ["FU", 6, [2, 3, 4, 5, 6]], ["AN", 6, 2, 6], ["FU", 4, [0, 1, 2, 3, 4]], ["SP", 4, 0, 24, [1], 1], ["AN", 4, 1, 2], ["FFSP", 4, 0, [5, 4, 3, 2, 1], 1, 1], ["AN", 4, 1, 6], ["FU", 2, [0, 1, 2, 3, 4]], ["SP", 2, 0, 128, [1], 1], ["AN", 2, 1, 2], ["FFSP", 2, 0, [5, 4, 3, 2, 1], 1, 1], ["AN", 2, 1, 6], ["PR", 5, 0, "auto_unroll_max_step$1024"]]]], "r": [[0.000106755, 0.000106783, 0.000106767, 0.000106775, 0.000106788, 0.000106758, 0.000106745, 0.000106719, 0.000106696, 0.000106712], 0, 152.053, 1657017581], "v": "v0.6"}
{"i": [["[\"fused_conv3x3\", 1, 56, 56, 8, 8, 3, 3, 64]", "cuda -keys=cuda,gpu -max_num_threads=1024 -model=unknown -thread_warp_size=32", [-1, 16, 64, 49152, 2147483647, 1024, 8, 32], "", 0, []], [[], [["CHW", 3, "local"], ["SP", 3, 0, 1, [1, 1, 1, 1], 1], ["SP", 3, 5, 64, [1, 4, 2, 1], 1], ["SP", 3, 10, 56, [1, 28, 1, 1], 1], ["SP", 3, 15, 56, [1, 1, 1, 1], 1], ["SP", 3, 20, 8, [1, 1, 4, 1], 1], ["SP", 3, 25, 8, [4, 2], 1], ["SP", 3, 28, 3, [1, 3], 1], ["SP", 3, 31, 3, [3, 1], 1], ["RE", 3, [0, 5, 10, 15, 20, 1, 6, 11, 16, 21, 2, 7, 12, 17, 22, 25, 28, 31, 26, 29, 32, 3, 8, 13, 18, 23, 27, 30, 33, 4, 9, 14, 19, 24]], ["FSP", 4, 0, 1, 3], ["FSP", 4, 4, 2, 3], ["FSP", 4, 8, 3, 3], ["FSP", 4, 12, 4, 3], ["FSP", 4, 16, 5, 3], ["RE", 4, [0, 4, 8, 12, 16, 1, 5, 9, 13, 17, 2, 6, 10, 14, 18, 3, 7, 11, 15, 19]], ["CA", 3, 4, 14], ["CHR", 2, "shared", [3]], ["CA", 3, 4, 17], ["CHR", 1, "shared", [4]], ["CA", 2, 5, 17], ["CI", 1], ["FU", 6, [0, 1, 2, 3, 4]], ["AN", 6, 0, 5], ["FU", 6, [1, 2, 3, 4, 5]], ["AN", 6, 1, 4], ["FU", 6, [2, 3, 4, 5, 6]], ["AN", 6, 2, 6], ["FU", 4, [0, 1, 2, 3, 4]], ["SP", 4, 0, 576, [1], 1], ["AN", 4, 1, 2], ["FFSP", 4, 0, [5, 4, 3, 2, 1], 1, 1], ["AN", 4, 1, 6], ["FU", 2, [0, 1, 2, 3, 4]], ["SP", 2, 0, 144, [12], 1], ["AN", 2, 1, 2], ["FFSP", 2, 0, [5, 4, 3, 2, 1], 1, 1], ["AN", 2, 1, 6], ["PR", 5, 0, "auto_unroll_max_step$512"]]]], "r": [[0.000135797, 0.000136511, 0.000136052, 0.000136653, 0.000136136, 0.00013682, 0.000136229, 0.000137256, 0.000137229, 0.000137245], 0, 34.2103, 1657017465], "v": "v0.6"}
{"i": [["[\"fused_conv3x3\", 1, 56, 56, 8, 8, 3, 3, 64]", "cuda -keys=cuda,gpu -max_num_threads=1024 -model=unknown -thread_warp_size=32", [-1, 16, 64, 49152, 2147483647, 1024, 8, 32], "", 0, []], [[], [["CHW", 3, "local"], ["SP", 3, 0, 1, [1, 1, 1, 1], 1], ["SP", 3, 5, 64, [1, 2, 1, 4], 1], ["SP", 3, 10, 56, [2, 14, 1, 1], 1], ["SP", 3, 15, 56, [2, 7, 2, 1], 1], ["SP", 3, 20, 8, [2, 1, 4, 1], 1], ["SP", 3, 25, 8, [1, 1], 1], ["SP", 3, 28, 3, [1, 1], 1], ["SP", 3, 31, 3, [1, 3], 1], ["RE", 3, [0, 5, 10, 15, 20, 1, 6, 11, 16, 21, 2, 7, 12, 17, 22, 25, 28, 31, 26, 29, 32, 3, 8, 13, 18, 23, 27, 30, 33, 4, 9, 14, 19, 24]], ["FSP", 4, 0, 1, 3], ["FSP", 4, 4, 2, 3], ["FSP", 4, 8, 3, 3], ["FSP", 4, 12, 4, 3], ["FSP", 4, 16, 5, 3], ["RE", 4, [0, 4, 8, 12, 16, 1, 5, 9, 13, 17, 2, 6, 10, 14, 18, 3, 7, 11, 15, 19]], ["CA", 3, 4, 14], ["CHR", 2, "shared", [3]], ["CA", 3, 4, 17], ["CHR", 1, "shared", [4]], ["CA", 2, 5, 17], ["CI", 1], ["FU", 6, [0, 1, 2, 3, 4]], ["AN", 6, 0, 5], ["FU", 6, [1, 2, 3, 4, 5]], ["AN", 6, 1, 4], ["FU", 6, [2, 3, 4, 5, 6]], ["AN", 6, 2, 6], ["FU", 4, [0, 1, 2, 3, 4]], ["SP", 4, 0, 96, [1], 1], ["AN", 4, 1, 2], ["FFSP", 4, 0, [5, 4, 3, 2, 1], 1, 1], ["AN", 4, 1, 6], ["FU", 2, [0, 1, 2, 3, 4]], ["SP", 2, 0, 8, [1], 1], ["AN", 2, 1, 2], ["FFSP", 2, 0, [5, 4, 3, 2, 1], 1, 1], ["AN", 2, 1, 6], ["PR", 5, 0, "auto_unroll_max_step$16"]]]], "r": [[0.000316152, 0.000316095, 0.000316087, 0.000316163, 0.000316168, 0.000316106, 0.00031615, 0.000316134, 0.000316133, 0.000316131], 0, 176.294, 1657017607], "v": "v0.6"}
{"i": [["[\"fused_conv3x3\", 1, 56, 56, 8, 8, 3, 3, 64]", "cuda -keys=cuda,gpu -max_num_threads=1024 -model=unknown -thread_warp_size=32", [-1, 16, 64, 49152, 2147483647, 1024, 8, 32], "", 0, []], [[], [["CHW", 3, "local"], ["SP", 3, 0, 1, [1, 1, 1, 1], 1], ["SP", 3, 5, 64, [1, 32, 1, 1], 1], ["SP", 3, 10, 56, [2, 1, 1, 1], 1], ["SP", 3, 15, 56, [1, 1, 8, 1], 1], ["SP", 3, 20, 8, [2, 2, 2, 1], 1], ["SP", 3, 25, 8, [1, 4], 1], ["SP", 3, 28, 3, [1, 1], 1], ["SP", 3, 31, 3, [1, 3], 1], ["RE", 3, [0, 5, 10, 15, 20, 1, 6, 11, 16, 21, 2, 7, 12, 17, 22, 25, 28, 31, 26, 29, 32, 3, 8, 13, 18, 23, 27, 30, 33, 4, 9, 14, 19, 24]], ["FSP", 4, 0, 1, 3], ["FSP", 4, 4, 2, 3], ["FSP", 4, 8, 3, 3], ["FSP", 4, 12, 4, 3], ["FSP", 4, 16, 5, 3], ["RE", 4, [0, 4, 8, 12, 16, 1, 5, 9, 13, 17, 2, 6, 10, 14, 18, 3, 7, 11, 15, 19]], ["CA", 3, 4, 14], ["CHR", 2, "shared", [3]], ["CA", 3, 4, 17], ["CHR", 1, "shared", [4]], ["CA", 2, 5, 17], ["CI", 1], ["FU", 6, [0, 1, 2, 3, 4]], ["AN", 6, 0, 5], ["FU", 6, [1, 2, 3, 4, 5]], ["AN", 6, 1, 4], ["FU", 6, [2, 3, 4, 5, 6]], ["AN", 6, 2, 6], ["FU", 4, [0, 1, 2, 3, 4]], ["SP", 4, 0, 48, [1], 1], ["AN", 4, 1, 2], ["FFSP", 4, 0, [5, 4, 3, 2, 1], 1, 1], ["AN", 4, 1, 6], ["FU", 2, [0, 1, 2, 3, 4]], ["SP", 2, 0, 64, [2], 1], ["AN", 2, 1, 2], ["FFSP", 2, 0, [5, 4, 3, 2, 1], 1, 1], ["AN", 2, 1, 6], ["PR", 5, 0, "auto_unroll_max_step$1024"]]]], "r": [[5.42212e-05, 5.4767e-05, 5.42868e-05, 5.47986e-05, 5.43031e-05, 5.47806e-05, 5.43572e-05, 5.47889e-05, 5.44034e-05, 5.47918e-05], 0, 205.505, 1657017635], "v": "v0.6"}
{"i": [["[\"fused_conv3x3\", 1, 56, 56, 8, 8, 3, 3, 64]", "cuda -keys=cuda,gpu -max_num_threads=1024 -model=unknown -thread_warp_size=32", [-1, 16, 64, 49152, 2147483647, 1024, 8, 32], "", 0, []], [[], [["CHW", 3, "local"], ["SP", 3, 0, 1, [1, 1, 1, 1], 1], ["SP", 3, 5, 64, [1, 4, 8, 1], 1], ["SP", 3, 10, 56, [1, 7, 1, 4], 1], ["SP", 3, 15, 56, [1, 1, 4, 1], 1], ["SP", 3, 20, 8, [1, 2, 1, 4], 1], ["SP", 3, 25, 8, [1, 1], 1], ["SP", 3, 28, 3, [1, 3], 1], ["SP", 3, 31, 3, [1, 1], 1], ["RE", 3, [0, 5, 10, 15, 20, 1, 6, 11, 16, 21, 2, 7, 12, 17, 22, 25, 28, 31, 26, 29, 32, 3, 8, 13, 18, 23, 27, 30, 33, 4, 9, 14, 19, 24]], ["FSP", 4, 0, 1, 3], ["FSP", 4, 4, 2, 3], ["FSP", 4, 8, 3, 3], ["FSP", 4, 12, 4, 3], ["FSP", 4, 16, 5, 3], ["RE", 4, [0, 4, 8, 12, 16, 1, 5, 9, 13, 17, 2, 6, 10, 14, 18, 3, 7, 11, 15, 19]], ["CA", 3, 4, 14], ["CHR", 2, "shared", [3]], ["CA", 3, 4, 17], ["CHR", 1, "shared", [4]], ["CA", 2, 5, 17], ["CI", 1], ["FU", 6, [0, 1, 2, 3, 4]], ["AN", 6, 0, 5], ["FU", 6, [1, 2, 3, 4, 5]], ["AN", 6, 1, 4], ["FU", 6, [2, 3, 4, 5, 6]], ["AN", 6, 2, 6], ["FU", 4, [0, 1, 2, 3, 4]], ["SP", 4, 0, 96, [1], 1], ["AN", 4, 1, 2], ["FFSP", 4, 0, [5, 4, 3, 2, 1], 1, 1], ["AN", 4, 1, 6], ["FU", 2, [0, 1, 2, 3, 4]], ["SP", 2, 0, 480, [1], 1], ["AN", 2, 1, 2], ["FFSP", 2, 0, [5, 4, 3, 2, 1], 1, 1], ["AN", 2, 1, 6], ["PR", 5, 0, "auto_unroll_max_step$1024"]]]], "r": [[0.000344988, 0.000345039, 0.000344937, 0.000345105, 0.000345077, 0.00034502, 0.000345016, 0.000344939, 0.000344979, 0.000345031], 0, 217.226, 1657017653], "v": "v0.6"}
