python/models/resnext/kernel_configs/resnext_imagenet_50_fused_conv7x7_1_224_224_3_64_7_7.log
{"i": [["[\"fused_conv7x7_s2_bn_relu\", 1, 224, 224, 3, 64, 7, 7]", "cuda -keys=cuda,gpu -max_num_threads=1024 -model=unknown -thread_warp_size=32", [-1, 16, 64, 49152, 2147483647, 1024, 8, 32], "", 0, []], [[], [["CI", 7], ["CI", 5], ["SP", 3, 0, 1, [1, 1, 1, 1], 1], ["SP", 3, 5, 112, [1, 1, 4, 4], 1], ["SP", 3, 10, 112, [1, 56, 1, 1], 1], ["SP", 3, 15, 64, [1, 8, 2, 4], 1], ["SP", 3, 20, 3, [3, 1], 1], ["SP", 3, 23, 7, [1, 1], 1], ["SP", 3, 26, 7, [1, 1], 1], ["RE", 3, [0, 5, 10, 15, 1, 6, 11, 16, 2, 7, 12, 17, 20, 23, 26, 21, 24, 27, 3, 8, 13, 18, 22, 25, 28, 4, 9, 14, 19]], ["FSP", 8, 0, 2, 3], ["FSP", 8, 4, 3, 3], ["FSP", 8, 8, 4, 3], ["FSP", 8, 12, 5, 3], ["RE", 8, [0, 4, 8, 12, 1, 5, 9, 13, 2, 6, 10, 14, 3, 7, 11, 15]], ["CA", 3, 8, 11], ["CHR", 2, "shared", [3]], ["CA", 3, 4, 14], ["CHR", 1, "shared", [4]], ["CA", 2, 5, 14], ["CI", 1], ["FU", 10, [0, 1, 2, 3]], ["AN", 10, 0, 5], ["FU", 10, [1, 2, 3, 4]], ["AN", 10, 1, 4], ["FU", 10, [2, 3, 4, 5]], ["AN", 10, 2, 6], ["FU", 4, [0, 1, 2, 3]], ["SP", 4, 0, 24, [1], 1], ["AN", 4, 1, 2], ["FFSP", 4, 0, [5, 4, 3, 2], 1, 1], ["AN", 4, 1, 6], ["FU", 2, [0, 1, 2, 3]], ["SP", 2, 0, 93, [3], 1], ["AN", 2, 1, 2], ["FFSP", 2, 0, [5, 4, 3, 2], 1, 1], ["AN", 2, 1, 6], ["PR", 5, 0, "auto_unroll_max_step$0"]]]], "r": [[0.000456317, 0.000456398, 0.000456362, 0.000456384, 0.000456346, 0.000456307, 0.000456331, 0.000456338, 0.000456369, 0.000456325], 0, 46.7756, 1653986453], "v": "v0.6"}
{"i": [["[\"fused_conv7x7_s2_bn_relu\", 1, 224, 224, 3, 64, 7, 7]", "cuda -keys=cuda,gpu -max_num_threads=1024 -model=unknown -thread_warp_size=32", [-1, 16, 64, 49152, 2147483647, 1024, 8, 32], "", 0, []], [[], [["CI", 7], ["CI", 5], ["SP", 3, 0, 1, [1, 1, 1, 1], 1], ["SP", 3, 5, 112, [1, 2, 4, 1], 1], ["SP", 3, 10, 112, [2, 7, 1, 1], 1], ["SP", 3, 15, 64, [2, 32, 1, 1], 1], ["SP", 3, 20, 3, [1, 3], 1], ["SP", 3, 23, 7, [7, 1], 1], ["SP", 3, 26, 7, [1, 7], 1], ["RE", 3, [0, 5, 10, 15, 1, 6, 11, 16, 2, 7, 12, 17, 20, 23, 26, 21, 24, 27, 3, 8, 13, 18, 22, 25, 28, 4, 9, 14, 19]], ["FSP", 8, 0, 2, 3], ["FSP", 8, 4, 3, 3], ["FSP", 8, 8, 4, 3], ["FSP", 8, 12, 5, 3], ["RE", 8, [0, 4, 8, 12, 1, 5, 9, 13, 2, 6, 10, 14, 3, 7, 11, 15]], ["CA", 3, 8, 11], ["CHR", 2, "shared", [3]], ["CA", 3, 4, 14], ["CHR", 1, "shared", [4]], ["CA", 2, 5, 14], ["CI", 1], ["FU", 10, [0, 1, 2, 3]], ["AN", 10, 0, 5], ["FU", 10, [1, 2, 3, 4]], ["AN", 10, 1, 4], ["FU", 10, [2, 3, 4, 5]], ["AN", 10, 2, 6], ["FU", 4, [0, 1, 2, 3]], ["SP", 4, 0, 294, [1], 1], ["AN", 4, 1, 2], ["FFSP", 4, 0, [5, 4, 3, 2], 1, 1], ["AN", 4, 1, 6], ["FU", 2, [0, 1, 2, 3]], ["SP", 2, 0, 273, [1], 1], ["AN", 2, 1, 2], ["FFSP", 2, 0, [5, 4, 3, 2], 1, 1], ["AN", 2, 1, 6], ["PR", 5, 0, "auto_unroll_max_step$1024"]]]], "r": [[3.10813e-05, 3.10858e-05, 3.10832e-05, 3.10853e-05, 3.10715e-05, 3.10652e-05, 3.10651e-05, 3.10648e-05, 3.10652e-05, 3.10643e-05], 0, 26.7342, 1653986433], "v": "v0.6"}
{"i": [["[\"fused_conv7x7_s2_bn_relu\", 1, 224, 224, 3, 64, 7, 7]", "cuda -keys=cuda,gpu -max_num_threads=1024 -model=unknown -thread_warp_size=32", [-1, 16, 64, 49152, 2147483647, 1024, 8, 32], "", 0, []], [[], [["CI", 7], ["CI", 5], ["SP", 3, 0, 1, [1, 1, 1, 1], 1], ["SP", 3, 5, 112, [1, 4, 1, 7], 1], ["SP", 3, 10, 112, [7, 1, 1, 2], 1], ["SP", 3, 15, 64, [1, 2, 2, 1], 1], ["SP", 3, 20, 3, [1, 3], 1], ["SP", 3, 23, 7, [1, 1], 1], ["SP", 3, 26, 7, [1, 7], 1], ["RE", 3, [0, 5, 10, 15, 1, 6, 11, 16, 2, 7, 12, 17, 20, 23, 26, 21, 24, 27, 3, 8, 13, 18, 22, 25, 28, 4, 9, 14, 19]], ["FSP", 8, 0, 2, 3], ["FSP", 8, 4, 3, 3], ["FSP", 8, 8, 4, 3], ["FSP", 8, 12, 5, 3], ["RE", 8, [0, 4, 8, 12, 1, 5, 9, 13, 2, 6, 10, 14, 3, 7, 11, 15]], ["CA", 3, 8, 11], ["CHR", 2, "shared", [3]], ["CA", 3, 4, 14], ["CHR", 1, "shared", [4]], ["CA", 2, 5, 14], ["CI", 1], ["FU", 10, [0, 1, 2, 3]], ["AN", 10, 0, 5], ["FU", 10, [1, 2, 3, 4]], ["AN", 10, 1, 4], ["FU", 10, [2, 3, 4, 5]], ["AN", 10, 2, 6], ["FU", 4, [0, 1, 2, 3]], ["SP", 4, 0, 42, [1], 1], ["AN", 4, 1, 2], ["FFSP", 4, 0, [5, 4, 3, 2], 1, 1], ["AN", 4, 1, 6], ["FU", 2, [0, 1, 2, 3]], ["SP", 2, 0, 117, [1], 1], ["AN", 2, 1, 2], ["FFSP", 2, 0, [5, 4, 3, 2], 1, 1], ["AN", 2, 1, 6], ["PR", 5, 0, "auto_unroll_max_step$0"]]]], "r": [[0.00146882, 0.00146886, 0.00146899, 0.00146909, 0.00146879, 0.00146877, 0.00146882, 0.00146891, 0.00146887, 0.00146908], 0, 7.25208, 1653986413], "v": "v0.6"}
{"i": [["[\"fused_conv7x7_s2_bn_relu\", 1, 224, 224, 3, 64, 7, 7]", "cuda -keys=cuda,gpu -max_num_threads=1024 -model=unknown -thread_warp_size=32", [-1, 16, 64, 49152, 2147483647, 1024, 8, 32], "", 0, []], [[], [["CI", 7], ["CI", 5], ["SP", 3, 0, 1, [1, 1, 1, 1], 1], ["SP", 3, 5, 112, [1, 1, 2, 1], 1], ["SP", 3, 10, 112, [1, 7, 8, 2], 1], ["SP", 3, 15, 64, [1, 16, 4, 1], 1], ["SP", 3, 20, 3, [1, 3], 1], ["SP", 3, 23, 7, [1, 1], 1], ["SP", 3, 26, 7, [1, 7], 1], ["RE", 3, [0, 5, 10, 15, 1, 6, 11, 16, 2, 7, 12, 17, 20, 23, 26, 21, 24, 27, 3, 8, 13, 18, 22, 25, 28, 4, 9, 14, 19]], ["FSP", 8, 0, 2, 3], ["FSP", 8, 4, 3, 3], ["FSP", 8, 8, 4, 3], ["FSP", 8, 12, 5, 3], ["RE", 8, [0, 4, 8, 12, 1, 5, 9, 13, 2, 6, 10, 14, 3, 7, 11, 15]], ["CA", 3, 8, 11], ["CHR", 2, "shared", [3]], ["CA", 3, 4, 14], ["CHR", 1, "shared", [4]], ["CA", 2, 5, 14], ["CI", 1], ["FU", 10, [0, 1, 2, 3]], ["AN", 10, 0, 5], ["FU", 10, [1, 2, 3, 4]], ["AN", 10, 1, 4], ["FU", 10, [2, 3, 4, 5]], ["AN", 10, 2, 6], ["FU", 4, [0, 1, 2, 3]], ["SP", 4, 0, 84, [1], 1], ["AN", 4, 1, 2], ["FFSP", 4, 0, [5, 4, 3, 2], 1, 1], ["AN", 4, 1, 6], ["FU", 2, [0, 1, 2, 3]], ["SP", 2, 0, 279, [1], 1], ["AN", 2, 1, 2], ["FFSP", 2, 0, [5, 4, 3, 2], 1, 1], ["AN", 2, 1, 6], ["PR", 5, 0, "auto_unroll_max_step$1024"]]]], "r": [[5.89579e-05, 5.89832e-05, 5.8979e-05, 5.8972e-05, 5.89653e-05, 5.89846e-05, 5.8978e-05, 5.89545e-05, 5.89656e-05, 5.89726e-05], 0, 37.6871, 1653986444], "v": "v0.6"}
{"i": [["[\"fused_conv7x7_s2_bn_relu\", 1, 224, 224, 3, 64, 7, 7]", "cuda -keys=cuda,gpu -max_num_threads=1024 -model=unknown -thread_warp_size=32", [-1, 16, 64, 49152, 2147483647, 1024, 8, 32], "", 0, []], [[], [["CI", 7], ["CI", 5], ["SP", 3, 0, 1, [1, 1, 1, 1], 1], ["SP", 3, 5, 112, [4, 1, 2, 1], 1], ["SP", 3, 10, 112, [2, 2, 7, 4], 1], ["SP", 3, 15, 64, [1, 16, 2, 1], 1], ["SP", 3, 20, 3, [1, 1], 1], ["SP", 3, 23, 7, [7, 1], 1], ["SP", 3, 26, 7, [7, 1], 1], ["RE", 3, [0, 5, 10, 15, 1, 6, 11, 16, 2, 7, 12, 17, 20, 23, 26, 21, 24, 27, 3, 8, 13, 18, 22, 25, 28, 4, 9, 14, 19]], ["FSP", 8, 0, 2, 3], ["FSP", 8, 4, 3, 3], ["FSP", 8, 8, 4, 3], ["FSP", 8, 12, 5, 3], ["RE", 8, [0, 4, 8, 12, 1, 5, 9, 13, 2, 6, 10, 14, 3, 7, 11, 15]], ["CA", 3, 8, 11], ["CHR", 2, "shared", [3]], ["CA", 3, 4, 14], ["CHR", 1, "shared", [4]], ["CA", 2, 5, 14], ["CI", 1], ["FU", 10, [0, 1, 2, 3]], ["AN", 10, 0, 5], ["FU", 10, [1, 2, 3, 4]], ["AN", 10, 1, 4], ["FU", 10, [2, 3, 4, 5]], ["AN", 10, 2, 6], ["FU", 4, [0, 1, 2, 3]], ["SP", 4, 0, 98, [1], 1], ["AN", 4, 1, 2], ["FFSP", 4, 0, [5, 4, 3, 2], 1, 1], ["AN", 4, 1, 6], ["FU", 2, [0, 1, 2, 3]], ["SP", 2, 0, 549, [1], 1], ["AN", 2, 1, 2], ["FFSP", 2, 0, [5, 4, 3, 2], 1, 1], ["AN", 2, 1, 6], ["PR", 5, 0, "auto_unroll_max_step$64"]]]], "r": [[0.00128649, 0.00128657, 0.00128651, 0.00128662, 0.00128657, 0.00128656, 0.00128654, 0.00128651, 0.00128649, 0.00128649], 0, 13.2314, 1653986419], "v": "v0.6"}
{"i": [["[\"fused_conv7x7_s2_bn_relu\", 1, 224, 224, 3, 64, 7, 7]", "cuda -keys=cuda,gpu -max_num_threads=1024 -model=unknown -thread_warp_size=32", [-1, 16, 64, 49152, 2147483647, 1024, 8, 32], "", 0, []], [[], [["CI", 7], ["CI", 5], ["SP", 3, 0, 1, [1, 1, 1, 1], 1], ["SP", 3, 5, 112, [1, 1, 4, 4], 1], ["SP", 3, 10, 112, [2, 1, 2, 1], 1], ["SP", 3, 15, 64, [1, 16, 1, 4], 1], ["SP", 3, 20, 3, [1, 1], 1], ["SP", 3, 23, 7, [1, 1], 1], ["SP", 3, 26, 7, [1, 7], 1], ["RE", 3, [0, 5, 10, 15, 1, 6, 11, 16, 2, 7, 12, 17, 20, 23, 26, 21, 24, 27, 3, 8, 13, 18, 22, 25, 28, 4, 9, 14, 19]], ["FSP", 8, 0, 2, 3], ["FSP", 8, 4, 3, 3], ["FSP", 8, 8, 4, 3], ["FSP", 8, 12, 5, 3], ["RE", 8, [0, 4, 8, 12, 1, 5, 9, 13, 2, 6, 10, 14, 3, 7, 11, 15]], ["CA", 3, 8, 11], ["CHR", 2, "shared", [3]], ["CA", 3, 4, 14], ["CHR", 1, "shared", [4]], ["CA", 2, 5, 14], ["CI", 1], ["FU", 10, [0, 1, 2, 3]], ["AN", 10, 0, 5], ["FU", 10, [1, 2, 3, 4]], ["AN", 10, 1, 4], ["FU", 10, [2, 3, 4, 5]], ["AN", 10, 2, 6], ["FU", 4, [0, 1, 2, 3]], ["SP", 4, 0, 4, [1], 1], ["AN", 4, 1, 2], ["FFSP", 4, 0, [5, 4, 3, 2], 1, 1], ["AN", 4, 1, 6], ["FU", 2, [0, 1, 2, 3]], ["SP", 2, 0, 45, [1], 1], ["AN", 2, 1, 2], ["FFSP", 2, 0, [5, 4, 3, 2], 1, 1], ["AN", 2, 1, 6], ["PR", 5, 0, "auto_unroll_max_step$16"]]]], "r": [[0.000217514, 0.000217716, 0.000217846, 0.000217539, 0.000217547, 0.000217338, 0.000217645, 0.000217591, 0.000217473, 0.000217766], 0, 41.2476, 1653986448], "v": "v0.6"}
{"i": [["[\"fused_conv7x7_s2_bn_relu\", 1, 224, 224, 3, 64, 7, 7]", "cuda -keys=cuda,gpu -max_num_threads=1024 -model=unknown -thread_warp_size=32", [-1, 16, 64, 49152, 2147483647, 1024, 8, 32], "", 0, []], [[], [["CI", 7], ["CI", 5], ["SP", 3, 0, 1, [1, 1, 1, 1], 1], ["SP", 3, 5, 112, [1, 1, 7, 1], 1], ["SP", 3, 10, 112, [1, 1, 2, 4], 1], ["SP", 3, 15, 64, [1, 32, 1, 1], 1], ["SP", 3, 20, 3, [1, 1], 1], ["SP", 3, 23, 7, [1, 1], 1], ["SP", 3, 26, 7, [7, 1], 1], ["RE", 3, [0, 5, 10, 15, 1, 6, 11, 16, 2, 7, 12, 17, 20, 23, 26, 21, 24, 27, 3, 8, 13, 18, 22, 25, 28, 4, 9, 14, 19]], ["FSP", 8, 0, 2, 3], ["FSP", 8, 4, 3, 3], ["FSP", 8, 8, 4, 3], ["FSP", 8, 12, 5, 3], ["RE", 8, [0, 4, 8, 12, 1, 5, 9, 13, 2, 6, 10, 14, 3, 7, 11, 15]], ["CA", 3, 8, 11], ["CHR", 2, "shared", [3]], ["CA", 3, 4, 14], ["CHR", 1, "shared", [4]], ["CA", 2, 5, 14], ["CI", 1], ["FU", 10, [0, 1, 2, 3]], ["AN", 10, 0, 5], ["FU", 10, [1, 2, 3, 4]], ["AN", 10, 1, 4], ["FU", 10, [2, 3, 4, 5]], ["AN", 10, 2, 6], ["FU", 4, [0, 1, 2, 3]], ["SP", 4, 0, 7, [1], 1], ["AN", 4, 1, 2], ["FFSP", 4, 0, [5, 4, 3, 2], 1, 1], ["AN", 4, 1, 6], ["FU", 2, [0, 1, 2, 3]], ["SP", 2, 0, 15, [1], 1], ["AN", 2, 1, 2], ["FFSP", 2, 0, [5, 4, 3, 2], 1, 1], ["AN", 2, 1, 6], ["PR", 5, 0, "auto_unroll_max_step$1024"]]]], "r": [[3.51365e-05, 3.5137e-05, 3.51375e-05, 3.51407e-05, 3.51378e-05, 3.51404e-05, 3.51374e-05, 3.51377e-05, 3.51396e-05, 3.51391e-05], 0, 32.1766, 1653986439], "v": "v0.6"}
{"i": [["[\"fused_conv7x7_s2_bn_relu\", 1, 224, 224, 3, 64, 7, 7]", "cuda -keys=cuda,gpu -max_num_threads=1024 -model=unknown -thread_warp_size=32", [-1, 16, 64, 49152, 2147483647, 1024, 8, 32], "", 0, []], [[], [["CI", 7], ["CI", 5], ["SP", 3, 0, 1, [1, 1, 1, 1], 1], ["SP", 3, 5, 112, [2, 2, 7, 4], 1], ["SP", 3, 10, 112, [1, 8, 1, 1], 1], ["SP", 3, 15, 64, [1, 16, 1, 4], 1], ["SP", 3, 20, 3, [3, 1], 1], ["SP", 3, 23, 7, [1, 1], 1], ["SP", 3, 26, 7, [1, 7], 1], ["RE", 3, [0, 5, 10, 15, 1, 6, 11, 16, 2, 7, 12, 17, 20, 23, 26, 21, 24, 27, 3, 8, 13, 18, 22, 25, 28, 4, 9, 14, 19]], ["FSP", 8, 0, 2, 3], ["FSP", 8, 4, 3, 3], ["FSP", 8, 8, 4, 3], ["FSP", 8, 12, 5, 3], ["RE", 8, [0, 4, 8, 12, 1, 5, 9, 13, 2, 6, 10, 14, 3, 7, 11, 15]], ["CA", 3, 8, 11], ["CHR", 2, "shared", [3]], ["CA", 3, 4, 14], ["CHR", 1, "shared", [4]], ["CA", 2, 5, 14], ["CI", 1], ["FU", 10, [0, 1, 2, 3]], ["AN", 10, 0, 5], ["FU", 10, [1, 2, 3, 4]], ["AN", 10, 1, 4], ["FU", 10, [2, 3, 4, 5]], ["AN", 10, 2, 6], ["FU", 4, [0, 1, 2, 3]], ["SP", 4, 0, 84, [1], 1], ["AN", 4, 1, 2], ["FFSP", 4, 0, [5, 4, 3, 2], 1, 1], ["AN", 4, 1, 6], ["FU", 2, [0, 1, 2, 3]], ["SP", 2, 0, 165, [1], 1], ["AN", 2, 1, 2], ["FFSP", 2, 0, [5, 4, 3, 2], 1, 1], ["AN", 2, 1, 6], ["PR", 5, 0, "auto_unroll_max_step$16"]]]], "r": [[0.000246414, 0.000246465, 0.000246476, 0.000246484, 0.000246535, 0.000246522, 0.000246501, 0.000246514, 0.000246538, 0.000246524], 0, 17.8723, 1653986424], "v": "v0.6"}
{"i": [["[\"fused_conv7x7_s2_bn_relu\", 1, 224, 224, 3, 64, 7, 7]", "cuda -keys=cuda,gpu -max_num_threads=1024 -model=unknown -thread_warp_size=32", [-1, 16, 64, 49152, 2147483647, 1024, 8, 32], "", 0, []], [[], [["CI", 7], ["CI", 5], ["SP", 3, 0, 1, [1, 1, 1, 1], 1], ["SP", 3, 5, 112, [1, 56, 1, 2], 1], ["SP", 3, 10, 112, [2, 1, 1, 7], 1], ["SP", 3, 15, 64, [2, 2, 4, 2], 1], ["SP", 3, 20, 3, [1, 1], 1], ["SP", 3, 23, 7, [7, 1], 1], ["SP", 3, 26, 7, [1, 1], 1], ["RE", 3, [0, 5, 10, 15, 1, 6, 11, 16, 2, 7, 12, 17, 20, 23, 26, 21, 24, 27, 3, 8, 13, 18, 22, 25, 28, 4, 9, 14, 19]], ["FSP", 8, 0, 2, 3], ["FSP", 8, 4, 3, 3], ["FSP", 8, 8, 4, 3], ["FSP", 8, 12, 5, 3], ["RE", 8, [0, 4, 8, 12, 1, 5, 9, 13, 2, 6, 10, 14, 3, 7, 11, 15]], ["CA", 3, 8, 11], ["CHR", 2, "shared", [3]], ["CA", 3, 4, 14], ["CHR", 1, "shared", [4]], ["CA", 2, 5, 14], ["CI", 1], ["FU", 10, [0, 1, 2, 3]], ["AN", 10, 0, 5], ["FU", 10, [1, 2, 3, 4]], ["AN", 10, 1, 4], ["FU", 10, [2, 3, 4, 5]], ["AN", 10, 2, 6], ["FU", 4, [0, 1, 2, 3]], ["SP", 4, 0, 8, [1], 1], ["AN", 4, 1, 2], ["FFSP", 4, 0, [5, 4, 3, 2], 1, 1], ["AN", 4, 1, 6], ["FU", 2, [0, 1, 2, 3]], ["SP", 2, 0, 39, [3], 1], ["AN", 2, 1, 2], ["FFSP", 2, 0, [5, 4, 3, 2], 1, 1], ["AN", 2, 1, 6], ["PR", 5, 0, "auto_unroll_max_step$64"]]]], "r": [[0.00135999, 0.00136003, 0.00136, 0.00135993, 0.00135978, 0.00136006, 0.00136017, 0.00135998, 0.00135991, 0.00136006], 0, 21.8234, 1653986428], "v": "v0.6"}
{"i": [["[\"fused_conv7x7_s2_bn_relu\", 1, 224, 224, 3, 64, 7, 7]", "cuda -keys=cuda,gpu -max_num_threads=1024 -model=unknown -thread_warp_size=32", [-1, 16, 64, 49152, 2147483647, 1024, 8, 32], "", 0, []], [[], [["CI", 7], ["CI", 5], ["SP", 3, 0, 1, [1, 1, 1, 1], 1], ["SP", 3, 5, 112, [1, 4, 1, 4], 1], ["SP", 3, 10, 112, [1, 4, 14, 1], 1], ["SP", 3, 15, 64, [2, 2, 2, 1], 1], ["SP", 3, 20, 3, [1, 1], 1], ["SP", 3, 23, 7, [1, 1], 1], ["SP", 3, 26, 7, [7, 1], 1], ["RE", 3, [0, 5, 10, 15, 1, 6, 11, 16, 2, 7, 12, 17, 20, 23, 26, 21, 24, 27, 3, 8, 13, 18, 22, 25, 28, 4, 9, 14, 19]], ["FSP", 8, 0, 2, 3], ["FSP", 8, 4, 3, 3], ["FSP", 8, 8, 4, 3], ["FSP", 8, 12, 5, 3], ["RE", 8, [0, 4, 8, 12, 1, 5, 9, 13, 2, 6, 10, 14, 3, 7, 11, 15]], ["CA", 3, 8, 11], ["CHR", 2, "shared", [3]], ["CA", 3, 4, 14], ["CHR", 1, "shared", [4]], ["CA", 2, 5, 14], ["CI", 1], ["FU", 10, [0, 1, 2, 3]], ["AN", 10, 0, 5], ["FU", 10, [1, 2, 3, 4]], ["AN", 10, 1, 4], ["FU", 10, [2, 3, 4, 5]], ["AN", 10, 2, 6], ["FU", 4, [0, 1, 2, 3]], ["SP", 4, 0, 42, [21], 1], ["AN", 4, 1, 2], ["FFSP", 4, 0, [5, 4, 3, 2], 1, 1], ["AN", 4, 1, 6], ["FU", 2, [0, 1, 2, 3]], ["SP", 2, 0, 567, [9], 1], ["AN", 2, 1, 2], ["FFSP", 2, 0, [5, 4, 3, 2], 1, 1], ["AN", 2, 1, 6], ["PR", 5, 0, "auto_unroll_max_step$512"]]]], "r": [[0.000523318, 0.000523294, 0.000523343, 0.000523251, 0.000523294, 0.000523247, 0.000523331, 0.000523297, 0.000523288, 0.000523287], 0, 82.5542, 1653986489], "v": "v0.6"}
{"i": [["[\"fused_conv7x7_s2_bn_relu\", 1, 224, 224, 3, 64, 7, 7]", "cuda -keys=cuda,gpu -max_num_threads=1024 -model=unknown -thread_warp_size=32", [-1, 16, 64, 49152, 2147483647, 1024, 8, 32], "", 0, []], [[], [["CI", 7], ["CI", 5], ["SP", 3, 0, 1, [1, 1, 1, 1], 1], ["SP", 3, 5, 112, [1, 2, 4, 7], 1], ["SP", 3, 10, 112, [2, 2, 1, 2], 1], ["SP", 3, 15, 64, [1, 16, 2, 2], 1], ["SP", 3, 20, 3, [1, 1], 1], ["SP", 3, 23, 7, [1, 7], 1], ["SP", 3, 26, 7, [1, 1], 1], ["RE", 3, [0, 5, 10, 15, 1, 6, 11, 16, 2, 7, 12, 17, 20, 23, 26, 21, 24, 27, 3, 8, 13, 18, 22, 25, 28, 4, 9, 14, 19]], ["FSP", 8, 0, 2, 3], ["FSP", 8, 4, 3, 3], ["FSP", 8, 8, 4, 3], ["FSP", 8, 12, 5, 3], ["RE", 8, [0, 4, 8, 12, 1, 5, 9, 13, 2, 6, 10, 14, 3, 7, 11, 15]], ["CA", 3, 8, 11], ["CHR", 2, "shared", [3]], ["CA", 3, 4, 14], ["CHR", 1, "shared", [4]], ["CA", 2, 5, 14], ["CI", 1], ["FU", 10, [0, 1, 2, 3]], ["AN", 10, 0, 5], ["FU", 10, [1, 2, 3, 4]], ["AN", 10, 1, 4], ["FU", 10, [2, 3, 4, 5]], ["AN", 10, 2, 6], ["FU", 4, [0, 1, 2, 3]], ["SP", 4, 0, 28, [1], 1], ["AN", 4, 1, 2], ["FFSP", 4, 0, [5, 4, 3, 2], 1, 1], ["AN", 4, 1, 6], ["FU", 2, [0, 1, 2, 3]], ["SP", 2, 0, 549, [1], 1], ["AN", 2, 1, 2], ["FFSP", 2, 0, [5, 4, 3, 2], 1, 1], ["AN", 2, 1, 6], ["PR", 5, 0, "auto_unroll_max_step$1024"]]]], "r": [[0.000169686, 0.00016968, 0.000169652, 0.000169665, 0.000169671, 0.00016965, 0.000169667, 0.000169708, 0.000169673, 0.000169714], 0, 71.6977, 1653986477], "v": "v0.6"}
{"i": [["[\"fused_conv7x7_s2_bn_relu\", 1, 224, 224, 3, 64, 7, 7]", "cuda -keys=cuda,gpu -max_num_threads=1024 -model=unknown -thread_warp_size=32", [-1, 16, 64, 49152, 2147483647, 1024, 8, 32], "", 0, []], [[], [["CI", 7], ["CI", 5], ["SP", 3, 0, 1, [1, 1, 1, 1], 1], ["SP", 3, 5, 112, [1, 14, 1, 2], 1], ["SP", 3, 10, 112, [1, 2, 1, 4], 1], ["SP", 3, 15, 64, [1, 2, 2, 2], 1], ["SP", 3, 20, 3, [1, 3], 1], ["SP", 3, 23, 7, [1, 7], 1], ["SP", 3, 26, 7, [7, 1], 1], ["RE", 3, [0, 5, 10, 15, 1, 6, 11, 16, 2, 7, 12, 17, 20, 23, 26, 21, 24, 27, 3, 8, 13, 18, 22, 25, 28, 4, 9, 14, 19]], ["FSP", 8, 0, 2, 3], ["FSP", 8, 4, 3, 3], ["FSP", 8, 8, 4, 3], ["FSP", 8, 12, 5, 3], ["RE", 8, [0, 4, 8, 12, 1, 5, 9, 13, 2, 6, 10, 14, 3, 7, 11, 15]], ["CA", 3, 8, 11], ["CHR", 2, "shared", [3]], ["CA", 3, 4, 14], ["CHR", 1, "shared", [4]], ["CA", 2, 5, 14], ["CI", 1], ["FU", 10, [0, 1, 2, 3]], ["AN", 10, 0, 5], ["FU", 10, [1, 2, 3, 4]], ["AN", 10, 1, 4], ["FU", 10, [2, 3, 4, 5]], ["AN", 10, 2, 6], ["FU", 4, [0, 1, 2, 3]], ["SP", 4, 0, 588, [1], 1], ["AN", 4, 1, 2], ["FFSP", 4, 0, [5, 4, 3, 2], 1, 1], ["AN", 4, 1, 6], ["FU", 2, [0, 1, 2, 3]], ["SP", 2, 0, 351, [9], 1], ["AN", 2, 1, 2], ["FFSP", 2, 0, [5, 4, 3, 2], 1, 1], ["AN", 2, 1, 6], ["PR", 5, 0, "auto_unroll_max_step$64"]]]], "r": [[5.37231e-05, 5.37271e-05, 5.37301e-05, 5.37232e-05, 5.37243e-05, 5.37304e-05, 5.37245e-05, 5.37278e-05, 5.37242e-05, 5.37303e-05], 0, 98.0891, 1653986505], "v": "v0.6"}
{"i": [["[\"fused_conv7x7_s2_bn_relu\", 1, 224, 224, 3, 64, 7, 7]", "cuda -keys=cuda,gpu -max_num_threads=1024 -model=unknown -thread_warp_size=32", [-1, 16, 64, 49152, 2147483647, 1024, 8, 32], "", 0, []], [[], [["CI", 7], ["CI", 5], ["SP", 3, 0, 1, [1, 1, 1, 1], 1], ["SP", 3, 5, 112, [1, 4, 4, 1], 1], ["SP", 3, 10, 112, [1, 28, 2, 1], 1], ["SP", 3, 15, 64, [4, 4, 4, 1], 1], ["SP", 3, 20, 3, [1, 1], 1], ["SP", 3, 23, 7, [7, 1], 1], ["SP", 3, 26, 7, [1, 1], 1], ["RE", 3, [0, 5, 10, 15, 1, 6, 11, 16, 2, 7, 12, 17, 20, 23, 26, 21, 24, 27, 3, 8, 13, 18, 22, 25, 28, 4, 9, 14, 19]], ["FSP", 8, 0, 2, 3], ["FSP", 8, 4, 3, 3], ["FSP", 8, 8, 4, 3], ["FSP", 8, 12, 5, 3], ["RE", 8, [0, 4, 8, 12, 1, 5, 9, 13, 2, 6, 10, 14, 3, 7, 11, 15]], ["CA", 3, 8, 11], ["CHR", 2, "shared", [3]], ["CA", 3, 4, 14], ["CHR", 1, "shared", [4]], ["CA", 2, 5, 14], ["CI", 1], ["FU", 10, [0, 1, 2, 3]], ["AN", 10, 0, 5], ["FU", 10, [1, 2, 3, 4]], ["AN", 10, 1, 4], ["FU", 10, [2, 3, 4, 5]], ["AN", 10, 2, 6], ["FU", 4, [0, 1, 2, 3]], ["SP", 4, 0, 196, [1], 1], ["AN", 4, 1, 2], ["FFSP", 4, 0, [5, 4, 3, 2], 1, 1], ["AN", 4, 1, 6], ["FU", 2, [0, 1, 2, 3]], ["SP", 2, 0, 117, [3], 1], ["AN", 2, 1, 2], ["FFSP", 2, 0, [5, 4, 3, 2], 1, 1], ["AN", 2, 1, 6], ["PR", 5, 0, "auto_unroll_max_step$64"]]]], "r": [[0.000288786, 0.000288783, 0.000288776, 0.000288837, 0.0002888, 0.00028879, 0.000288782, 0.000288792, 0.000288788, 0.000288756], 0, 92.546, 1653986500], "v": "v0.6"}
{"i": [["[\"fused_conv7x7_s2_bn_relu\", 1, 224, 224, 3, 64, 7, 7]", "cuda -keys=cuda,gpu -max_num_threads=1024 -model=unknown -thread_warp_size=32", [-1, 16, 64, 49152, 2147483647, 1024, 8, 32], "", 0, []], [[], [["CI", 7], ["CI", 5], ["SP", 3, 0, 1, [1, 1, 1, 1], 1], ["SP", 3, 5, 112, [1, 14, 1, 1], 1], ["SP", 3, 10, 112, [1, 4, 14, 1], 1], ["SP", 3, 15, 64, [1, 2, 1, 1], 1], ["SP", 3, 20, 3, [3, 1], 1], ["SP", 3, 23, 7, [7, 1], 1], ["SP", 3, 26, 7, [1, 7], 1], ["RE", 3, [0, 5, 10, 15, 1, 6, 11, 16, 2, 7, 12, 17, 20, 23, 26, 21, 24, 27, 3, 8, 13, 18, 22, 25, 28, 4, 9, 14, 19]], ["FSP", 8, 0, 2, 3], ["FSP", 8, 4, 3, 3], ["FSP", 8, 8, 4, 3], ["FSP", 8, 12, 5, 3], ["RE", 8, [0, 4, 8, 12, 1, 5, 9, 13, 2, 6, 10, 14, 3, 7, 11, 15]], ["CA", 3, 8, 11], ["CHR", 2, "shared", [3]], ["CA", 3, 4, 14], ["CHR", 1, "shared", [4]], ["CA", 2, 5, 14], ["CI", 1], ["FU", 10, [0, 1, 2, 3]], ["AN", 10, 0, 5], ["FU", 10, [1, 2, 3, 4]], ["AN", 10, 1, 4], ["FU", 10, [2, 3, 4, 5]], ["AN", 10, 2, 6], ["FU", 4, [0, 1, 2, 3]], ["SP", 4, 0, 147, [21], 1], ["AN", 4, 1, 2], ["FFSP", 4, 0, [5, 4, 3, 2], 1, 1], ["AN", 4, 1, 6], ["FU", 2, [0, 1, 2, 3]], ["SP", 2, 0, 693, [1], 1], ["AN", 2, 1, 2], ["FFSP", 2, 0, [5, 4, 3, 2], 1, 1], ["AN", 2, 1, 6], ["PR", 5, 0, "auto_unroll_max_step$64"]]]], "r": [[7.55719e-05, 7.55879e-05, 7.56011e-05, 7.56107e-05, 7.56006e-05, 7.55977e-05, 7.56027e-05, 7.56051e-05, 7.56072e-05, 7.55992e-05], 0, 86.9685, 1653986494], "v": "v0.6"}
{"i": [["[\"fused_conv7x7_s2_bn_relu\", 1, 224, 224, 3, 64, 7, 7]", "cuda -keys=cuda,gpu -max_num_threads=1024 -model=unknown -thread_warp_size=32", [-1, 16, 64, 49152, 2147483647, 1024, 8, 32], "", 0, []], [[], [["CI", 7], ["CI", 5], ["SP", 3, 0, 1, [1, 1, 1, 1], 1], ["SP", 3, 5, 112, [1, 4, 1, 4], 1], ["SP", 3, 10, 112, [1, 4, 14, 1], 1], ["SP", 3, 15, 64, [2, 2, 1, 2], 1], ["SP", 3, 20, 3, [3, 1], 1], ["SP", 3, 23, 7, [1, 1], 1], ["SP", 3, 26, 7, [1, 7], 1], ["RE", 3, [0, 5, 10, 15, 1, 6, 11, 16, 2, 7, 12, 17, 20, 23, 26, 21, 24, 27, 3, 8, 13, 18, 22, 25, 28, 4, 9, 14, 19]], ["FSP", 8, 0, 2, 3], ["FSP", 8, 4, 3, 3], ["FSP", 8, 8, 4, 3], ["FSP", 8, 12, 5, 3], ["RE", 8, [0, 4, 8, 12, 1, 5, 9, 13, 2, 6, 10, 14, 3, 7, 11, 15]], ["CA", 3, 8, 11], ["CHR", 2, "shared", [3]], ["CA", 3, 4, 14], ["CHR", 1, "shared", [4]], ["CA", 2, 5, 14], ["CI", 1], ["FU", 10, [0, 1, 2, 3]], ["AN", 10, 0, 5], ["FU", 10, [1, 2, 3, 4]], ["AN", 10, 1, 4], ["FU", 10, [2, 3, 4, 5]], ["AN", 10, 2, 6], ["FU", 4, [0, 1, 2, 3]], ["SP", 4, 0, 42, [1], 1], ["AN", 4, 1, 2], ["FFSP", 4, 0, [5, 4, 3, 2], 1, 1], ["AN", 4, 1, 6], ["FU", 2, [0, 1, 2, 3]], ["SP", 2, 0, 567, [1], 1], ["AN", 2, 1, 2], ["FFSP", 2, 0, [5, 4, 3, 2], 1, 1], ["AN", 2, 1, 6], ["PR", 5, 0, "auto_unroll_max_step$512"]]]], "r": [[0.000246235, 0.000246275, 0.000246244, 0.000246242, 0.000246261, 0.000246242, 0.000246255, 0.000246248, 0.000246222, 0.000246258], 0, 55.1737, 1653986460], "v": "v0.6"}
{"i": [["[\"fused_conv7x7_s2_bn_relu\", 1, 224, 224, 3, 64, 7, 7]", "cuda -keys=cuda,gpu -max_num_threads=1024 -model=unknown -thread_warp_size=32", [-1, 16, 64, 49152, 2147483647, 1024, 8, 32], "", 0, []], [[], [["CI", 7], ["CI", 5], ["SP", 3, 0, 1, [1, 1, 1, 1], 1], ["SP", 3, 5, 112, [1, 7, 8, 1], 1], ["SP", 3, 10, 112, [1, 7, 1, 1], 1], ["SP", 3, 15, 64, [1, 4, 8, 2], 1], ["SP", 3, 20, 3, [1, 3], 1], ["SP", 3, 23, 7, [7, 1], 1], ["SP", 3, 26, 7, [1, 1], 1], ["RE", 3, [0, 5, 10, 15, 1, 6, 11, 16, 2, 7, 12, 17, 20, 23, 26, 21, 24, 27, 3, 8, 13, 18, 22, 25, 28, 4, 9, 14, 19]], ["FSP", 8, 0, 2, 3], ["FSP", 8, 4, 3, 3], ["FSP", 8, 8, 4, 3], ["FSP", 8, 12, 5, 3], ["RE", 8, [0, 4, 8, 12, 1, 5, 9, 13, 2, 6, 10, 14, 3, 7, 11, 15]], ["CA", 3, 8, 11], ["CHR", 2, "shared", [3]], ["CA", 3, 4, 14], ["CHR", 1, "shared", [4]], ["CA", 2, 5, 14], ["CI", 1], ["FU", 10, [0, 1, 2, 3]], ["AN", 10, 0, 5], ["FU", 10, [1, 2, 3, 4]], ["AN", 10, 1, 4], ["FU", 10, [2, 3, 4, 5]], ["AN", 10, 2, 6], ["FU", 4, [0, 1, 2, 3]], ["SP", 4, 0, 336, [16], 1], ["AN", 4, 1, 2], ["FFSP", 4, 0, [5, 4, 3, 2], 1, 1], ["AN", 4, 1, 6], ["FU", 2, [0, 1, 2, 3]], ["SP", 2, 0, 441, [1], 1], ["AN", 2, 1, 2], ["FFSP", 2, 0, [5, 4, 3, 2], 1, 1], ["AN", 2, 1, 6], ["PR", 5, 0, "auto_unroll_max_step$1024"]]]], "r": [[9.56601e-05, 9.5673e-05, 9.5697e-05, 9.56573e-05, 9.56157e-05, 9.56211e-05, 9.56273e-05, 9.56328e-05, 9.56273e-05, 9.56421e-05], 0, 58.9216, 1653986466], "v": "v0.6"}
{"i": [["[\"fused_conv7x7_s2_bn_relu\", 1, 224, 224, 3, 64, 7, 7]", "cuda -keys=cuda,gpu -max_num_threads=1024 -model=unknown -thread_warp_size=32", [-1, 16, 64, 49152, 2147483647, 1024, 8, 32], "", 0, []], [[], [["CI", 7], ["CI", 5], ["SP", 3, 0, 1, [1, 1, 1, 1], 1], ["SP", 3, 5, 112, [1, 2, 56, 1], 1], ["SP", 3, 10, 112, [1, 7, 1, 1], 1], ["SP", 3, 15, 64, [8, 8, 1, 1], 1], ["SP", 3, 20, 3, [3, 1], 1], ["SP", 3, 23, 7, [1, 1], 1], ["SP", 3, 26, 7, [1, 7], 1], ["RE", 3, [0, 5, 10, 15, 1, 6, 11, 16, 2, 7, 12, 17, 20, 23, 26, 21, 24, 27, 3, 8, 13, 18, 22, 25, 28, 4, 9, 14, 19]], ["FSP", 8, 0, 2, 3], ["FSP", 8, 4, 3, 3], ["FSP", 8, 8, 4, 3], ["FSP", 8, 12, 5, 3], ["RE", 8, [0, 4, 8, 12, 1, 5, 9, 13, 2, 6, 10, 14, 3, 7, 11, 15]], ["CA", 3, 8, 11], ["CHR", 2, "shared", [3]], ["CA", 3, 4, 14], ["CHR", 1, "shared", [4]], ["CA", 2, 5, 14], ["CI", 1], ["FU", 10, [0, 1, 2, 3]], ["AN", 10, 0, 5], ["FU", 10, [1, 2, 3, 4]], ["AN", 10, 1, 4], ["FU", 10, [2, 3, 4, 5]], ["AN", 10, 2, 6], ["FU", 4, [0, 1, 2, 3]], ["SP", 4, 0, 21, [1], 1], ["AN", 4, 1, 2], ["FFSP", 4, 0, [5, 4, 3, 2], 1, 1], ["AN", 4, 1, 6], ["FU", 2, [0, 1, 2, 3]], ["SP", 2, 0, 333, [1], 1], ["AN", 2, 1, 2], ["FFSP", 2, 0, [5, 4, 3, 2], 1, 1], ["AN", 2, 1, 6], ["PR", 5, 0, "auto_unroll_max_step$16"]]]], "r": [[0.000591659, 0.00059165, 0.000591661, 0.000591702, 0.000591637, 0.000591655, 0.000591652, 0.000591654, 0.000591659, 0.00059164], 0, 63.9948, 1653986471], "v": "v0.6"}
{"i": [["[\"fused_conv7x7_s2_bn_relu\", 1, 224, 224, 3, 64, 7, 7]", "cuda -keys=cuda,gpu -max_num_threads=1024 -model=unknown -thread_warp_size=32", [-1, 16, 64, 49152, 2147483647, 1024, 8, 32], "", 0, []], [[], [["CI", 7], ["CI", 5], ["SP", 3, 0, 1, [1, 1, 1, 1], 1], ["SP", 3, 5, 112, [1, 1, 1, 1], 1], ["SP", 3, 10, 112, [1, 1, 28, 2], 1], ["SP", 3, 15, 64, [1, 32, 1, 2], 1], ["SP", 3, 20, 3, [1, 1], 1], ["SP", 3, 23, 7, [1, 7], 1], ["SP", 3, 26, 7, [1, 1], 1], ["RE", 3, [0, 5, 10, 15, 1, 6, 11, 16, 2, 7, 12, 17, 20, 23, 26, 21, 24, 27, 3, 8, 13, 18, 22, 25, 28, 4, 9, 14, 19]], ["FSP", 8, 0, 2, 3], ["FSP", 8, 4, 3, 3], ["FSP", 8, 8, 4, 3], ["FSP", 8, 12, 5, 3], ["RE", 8, [0, 4, 8, 12, 1, 5, 9, 13, 2, 6, 10, 14, 3, 7, 11, 15]], ["CA", 3, 8, 11], ["CHR", 2, "shared", [3]], ["CA", 3, 4, 14], ["CHR", 1, "shared", [4]], ["CA", 2, 5, 14], ["CI", 1], ["FU", 10, [0, 1, 2, 3]], ["AN", 10, 0, 5], ["FU", 10, [1, 2, 3, 4]], ["AN", 10, 1, 4], ["FU", 10, [2, 3, 4, 5]], ["AN", 10, 2, 6], ["FU", 4, [0, 1, 2, 3]], ["SP", 4, 0, 98, [1], 1], ["AN", 4, 1, 2], ["FFSP", 4, 0, [5, 4, 3, 2], 1, 1], ["AN", 4, 1, 6], ["FU", 2, [0, 1, 2, 3]], ["SP", 2, 0, 819, [1], 1], ["AN", 2, 1, 2], ["FFSP", 2, 0, [5, 4, 3, 2], 1, 1], ["AN", 2, 1, 6], ["PR", 5, 0, "auto_unroll_max_step$1024"]]]], "r": [[6.27339e-05, 6.27338e-05, 6.2726e-05, 6.27204e-05, 6.27196e-05, 6.27174e-05, 6.27246e-05, 6.27244e-05, 6.27219e-05, 6.27211e-05], 0, 104.539, 1653986511], "v": "v0.6"}
{"i": [["[\"fused_conv7x7_s2_bn_relu\", 1, 224, 224, 3, 64, 7, 7]", "cuda -keys=cuda,gpu -max_num_threads=1024 -model=unknown -thread_warp_size=32", [-1, 16, 64, 49152, 2147483647, 1024, 8, 32], "", 0, []], [[], [["CI", 7], ["CI", 5], ["SP", 3, 0, 1, [1, 1, 1, 1], 1], ["SP", 3, 5, 112, [1, 7, 2, 2], 1], ["SP", 3, 10, 112, [1, 7, 2, 1], 1], ["SP", 3, 15, 64, [1, 1, 4, 1], 1], ["SP", 3, 20, 3, [1, 1], 1], ["SP", 3, 23, 7, [7, 1], 1], ["SP", 3, 26, 7, [1, 1], 1], ["RE", 3, [0, 5, 10, 15, 1, 6, 11, 16, 2, 7, 12, 17, 20, 23, 26, 21, 24, 27, 3, 8, 13, 18, 22, 25, 28, 4, 9, 14, 19]], ["FSP", 8, 0, 2, 3], ["FSP", 8, 4, 3, 3], ["FSP", 8, 8, 4, 3], ["FSP", 8, 12, 5, 3], ["RE", 8, [0, 4, 8, 12, 1, 5, 9, 13, 2, 6, 10, 14, 3, 7, 11, 15]], ["CA", 3, 8, 11], ["CHR", 2, "shared", [3]], ["CA", 3, 4, 14], ["CHR", 1, "shared", [4]], ["CA", 2, 5, 14], ["CI", 1], ["FU", 10, [0, 1, 2, 3]], ["AN", 10, 0, 5], ["FU", 10, [1, 2, 3, 4]], ["AN", 10, 1, 4], ["FU", 10, [2, 3, 4, 5]], ["AN", 10, 2, 6], ["FU", 4, [0, 1, 2, 3]], ["SP", 4, 0, 28, [1], 1], ["AN", 4, 1, 2], ["FFSP", 4, 0, [5, 4, 3, 2], 1, 1], ["AN", 4, 1, 6], ["FU", 2, [0, 1, 2, 3]], ["SP", 2, 0, 117, [1], 1], ["AN", 2, 1, 2], ["FFSP", 2, 0, [5, 4, 3, 2], 1, 1], ["AN", 2, 1, 6], ["PR", 5, 0, "auto_unroll_max_step$0"]]]], "r": [[0.000279746, 0.000279758, 0.000279774, 0.000279772, 0.000279769, 0.000279755, 0.00027977, 0.000279759, 0.000279749, 0.000279758], 0, 75.2036, 1653986482], "v": "v0.6"}
{"i": [["[\"fused_conv7x7_s2_bn_relu\", 1, 224, 224, 3, 64, 7, 7]", "cuda -keys=cuda,gpu -max_num_threads=1024 -model=unknown -thread_warp_size=32", [-1, 16, 64, 49152, 2147483647, 1024, 8, 32], "", 0, []], [[], [["CI", 7], ["CI", 5], ["SP", 3, 0, 1, [1, 1, 1, 1], 1], ["SP", 3, 5, 112, [2, 2, 1, 2], 1], ["SP", 3, 10, 112, [1, 2, 4, 7], 1], ["SP", 3, 15, 64, [1, 16, 4, 1], 1], ["SP", 3, 20, 3, [1, 1], 1], ["SP", 3, 23, 7, [1, 7], 1], ["SP", 3, 26, 7, [7, 1], 1], ["RE", 3, [0, 5, 10, 15, 1, 6, 11, 16, 2, 7, 12, 17, 20, 23, 26, 21, 24, 27, 3, 8, 13, 18, 22, 25, 28, 4, 9, 14, 19]], ["FSP", 8, 0, 2, 3], ["FSP", 8, 4, 3, 3], ["FSP", 8, 8, 4, 3], ["FSP", 8, 12, 5, 3], ["RE", 8, [0, 4, 8, 12, 1, 5, 9, 13, 2, 6, 10, 14, 3, 7, 11, 15]], ["CA", 3, 8, 11], ["CHR", 2, "shared", [3]], ["CA", 3, 4, 14], ["CHR", 1, "shared", [4]], ["CA", 2, 5, 14], ["CI", 1], ["FU", 10, [0, 1, 2, 3]], ["AN", 10, 0, 5], ["FU", 10, [1, 2, 3, 4]], ["AN", 10, 1, 4], ["FU", 10, [2, 3, 4, 5]], ["AN", 10, 2, 6], ["FU", 4, [0, 1, 2, 3]], ["SP", 4, 0, 196, [1], 1], ["AN", 4, 1, 2], ["FFSP", 4, 0, [5, 4, 3, 2], 1, 1], ["AN", 4, 1, 6], ["FU", 2, [0, 1, 2, 3]], ["SP", 2, 0, 549, [1], 1], ["AN", 2, 1, 2], ["FFSP", 2, 0, [5, 4, 3, 2], 1, 1], ["AN", 2, 1, 6], ["PR", 5, 0, "auto_unroll_max_step$16"]]]], "r": [[0.00035418, 0.000354134, 0.00035427, 0.000354251, 0.000354273, 0.000354205, 0.000354212, 0.000354229, 0.00035413, 0.000354093], 0, 29.6275, 1653987623], "v": "v0.6"}
{"i": [["[\"fused_conv7x7_s2_bn_relu\", 1, 224, 224, 3, 64, 7, 7]", "cuda -keys=cuda,gpu -max_num_threads=1024 -model=unknown -thread_warp_size=32", [-1, 16, 64, 49152, 2147483647, 1024, 8, 32], "", 0, []], [[], [["CI", 7], ["CI", 5], ["SP", 3, 0, 1, [1, 1, 1, 1], 1], ["SP", 3, 5, 112, [2, 8, 1, 1], 1], ["SP", 3, 10, 112, [2, 2, 4, 1], 1], ["SP", 3, 15, 64, [1, 4, 1, 8], 1], ["SP", 3, 20, 3, [1, 1], 1], ["SP", 3, 23, 7, [1, 7], 1], ["SP", 3, 26, 7, [1, 7], 1], ["RE", 3, [0, 5, 10, 15, 1, 6, 11, 16, 2, 7, 12, 17, 20, 23, 26, 21, 24, 27, 3, 8, 13, 18, 22, 25, 28, 4, 9, 14, 19]], ["FSP", 8, 0, 2, 3], ["FSP", 8, 4, 3, 3], ["FSP", 8, 8, 4, 3], ["FSP", 8, 12, 5, 3], ["RE", 8, [0, 4, 8, 12, 1, 5, 9, 13, 2, 6, 10, 14, 3, 7, 11, 15]], ["CA", 3, 8, 11], ["CHR", 2, "shared", [3]], ["CA", 3, 4, 14], ["CHR", 1, "shared", [4]], ["CA", 2, 5, 14], ["CI", 1], ["FU", 10, [0, 1, 2, 3]], ["AN", 10, 0, 5], ["FU", 10, [1, 2, 3, 4]], ["AN", 10, 1, 4], ["FU", 10, [2, 3, 4, 5]], ["AN", 10, 2, 6], ["FU", 4, [0, 1, 2, 3]], ["SP", 4, 0, 784, [1], 1], ["AN", 4, 1, 2], ["FFSP", 4, 0, [5, 4, 3, 2], 1, 1], ["AN", 4, 1, 6], ["FU", 2, [0, 1, 2, 3]], ["SP", 2, 0, 91, [13], 1], ["AN", 2, 1, 2], ["FFSP", 2, 0, [5, 4, 3, 2], 1, 1], ["AN", 2, 1, 6], ["PR", 5, 0, "auto_unroll_max_step$16"]]]], "r": [[7.6074e-05, 7.61254e-05, 7.61295e-05, 7.61344e-05, 7.61323e-05, 7.61324e-05, 7.61288e-05, 7.61339e-05, 7.61323e-05, 7.61294e-05], 0, 46.2451, 1653987640], "v": "v0.6"}
{"i": [["[\"fused_conv7x7_s2_bn_relu\", 1, 224, 224, 3, 64, 7, 7]", "cuda -keys=cuda,gpu -max_num_threads=1024 -model=unknown -thread_warp_size=32", [-1, 16, 64, 49152, 2147483647, 1024, 8, 32], "", 0, []], [[], [["CI", 7], ["CI", 5], ["SP", 3, 0, 1, [1, 1, 1, 1], 1], ["SP", 3, 5, 112, [2, 2, 2, 7], 1], ["SP", 3, 10, 112, [1, 4, 1, 1], 1], ["SP", 3, 15, 64, [1, 4, 1, 4], 1], ["SP", 3, 20, 3, [3, 1], 1], ["SP", 3, 23, 7, [1, 7], 1], ["SP", 3, 26, 7, [7, 1], 1], ["RE", 3, [0, 5, 10, 15, 1, 6, 11, 16, 2, 7, 12, 17, 20, 23, 26, 21, 24, 27, 3, 8, 13, 18, 22, 25, 28, 4, 9, 14, 19]], ["FSP", 8, 0, 2, 3], ["FSP", 8, 4, 3, 3], ["FSP", 8, 8, 4, 3], ["FSP", 8, 12, 5, 3], ["RE", 8, [0, 4, 8, 12, 1, 5, 9, 13, 2, 6, 10, 14, 3, 7, 11, 15]], ["CA", 3, 8, 11], ["CHR", 2, "shared", [3]], ["CA", 3, 4, 14], ["CHR", 1, "shared", [4]], ["CA", 2, 5, 14], ["CI", 1], ["FU", 10, [0, 1, 2, 3]], ["AN", 10, 0, 5], ["FU", 10, [1, 2, 3, 4]], ["AN", 10, 1, 4], ["FU", 10, [2, 3, 4, 5]], ["AN", 10, 2, 6], ["FU", 4, [0, 1, 2, 3]], ["SP", 4, 0, 588, [1], 1], ["AN", 4, 1, 2], ["FFSP", 4, 0, [5, 4, 3, 2], 1, 1], ["AN", 4, 1, 6], ["FU", 2, [0, 1, 2, 3]], ["SP", 2, 0, 693, [1], 1], ["AN", 2, 1, 2], ["FFSP", 2, 0, [5, 4, 3, 2], 1, 1], ["AN", 2, 1, 6], ["PR", 5, 0, "auto_unroll_max_step$0"]]]], "r": [[8.59146e-05, 8.59161e-05, 8.59136e-05, 8.59217e-05, 8.59184e-05, 8.59288e-05, 8.59305e-05, 8.59197e-05, 8.59191e-05, 8.59199e-05], 0, 23.6007, 1653987618], "v": "v0.6"}
{"i": [["[\"fused_conv7x7_s2_bn_relu\", 1, 224, 224, 3, 64, 7, 7]", "cuda -keys=cuda,gpu -max_num_threads=1024 -model=unknown -thread_warp_size=32", [-1, 16, 64, 49152, 2147483647, 1024, 8, 32], "", 0, []], [[], [["CI", 7], ["CI", 5], ["SP", 3, 0, 1, [1, 1, 1, 1], 1], ["SP", 3, 5, 112, [4, 1, 4, 1], 1], ["SP", 3, 10, 112, [1, 1, 1, 2], 1], ["SP", 3, 15, 64, [1, 32, 1, 1], 1], ["SP", 3, 20, 3, [1, 3], 1], ["SP", 3, 23, 7, [1, 1], 1], ["SP", 3, 26, 7, [1, 1], 1], ["RE", 3, [0, 5, 10, 15, 1, 6, 11, 16, 2, 7, 12, 17, 20, 23, 26, 21, 24, 27, 3, 8, 13, 18, 22, 25, 28, 4, 9, 14, 19]], ["FSP", 8, 0, 2, 3], ["FSP", 8, 4, 3, 3], ["FSP", 8, 8, 4, 3], ["FSP", 8, 12, 5, 3], ["RE", 8, [0, 4, 8, 12, 1, 5, 9, 13, 2, 6, 10, 14, 3, 7, 11, 15]], ["CA", 3, 8, 11], ["CHR", 2, "shared", [3]], ["CA", 3, 4, 14], ["CHR", 1, "shared", [4]], ["CA", 2, 5, 14], ["CI", 1], ["FU", 10, [0, 1, 2, 3]], ["AN", 10, 0, 5], ["FU", 10, [1, 2, 3, 4]], ["AN", 10, 1, 4], ["FU", 10, [2, 3, 4, 5]], ["AN", 10, 2, 6], ["FU", 4, [0, 1, 2, 3]], ["SP", 4, 0, 3, [1], 1], ["AN", 4, 1, 2], ["FFSP", 4, 0, [5, 4, 3, 2], 1, 1], ["AN", 4, 1, 6], ["FU", 2, [0, 1, 2, 3]], ["SP", 2, 0, 567, [1], 1], ["AN", 2, 1, 2], ["FFSP", 2, 0, [5, 4, 3, 2], 1, 1], ["AN", 2, 1, 6], ["PR", 5, 0, "auto_unroll_max_step$0"]]]], "r": [[9.8628e-05, 9.8787e-05, 9.88193e-05, 9.88572e-05, 9.88211e-05, 9.89546e-05, 9.89667e-05, 9.91192e-05, 9.90059e-05, 9.91756e-05], 0, 5.80412, 1653987600], "v": "v0.6"}
{"i": [["[\"fused_conv7x7_s2_bn_relu\", 1, 224, 224, 3, 64, 7, 7]", "cuda -keys=cuda,gpu -max_num_threads=1024 -model=unknown -thread_warp_size=32", [-1, 16, 64, 49152, 2147483647, 1024, 8, 32], "", 0, []], [[], [["CI", 7], ["CI", 5], ["SP", 3, 0, 1, [1, 1, 1, 1], 1], ["SP", 3, 5, 112, [1, 4, 1, 2], 1], ["SP", 3, 10, 112, [2, 2, 1, 1], 1], ["SP", 3, 15, 64, [1, 4, 2, 1], 1], ["SP", 3, 20, 3, [3, 1], 1], ["SP", 3, 23, 7, [1, 1], 1], ["SP", 3, 26, 7, [1, 1], 1], ["RE", 3, [0, 5, 10, 15, 1, 6, 11, 16, 2, 7, 12, 17, 20, 23, 26, 21, 24, 27, 3, 8, 13, 18, 22, 25, 28, 4, 9, 14, 19]], ["FSP", 8, 0, 2, 3], ["FSP", 8, 4, 3, 3], ["FSP", 8, 8, 4, 3], ["FSP", 8, 12, 5, 3], ["RE", 8, [0, 4, 8, 12, 1, 5, 9, 13, 2, 6, 10, 14, 3, 7, 11, 15]], ["CA", 3, 8, 11], ["CHR", 2, "shared", [3]], ["CA", 3, 4, 14], ["CHR", 1, "shared", [4]], ["CA", 2, 5, 14], ["CI", 1], ["FU", 10, [0, 1, 2, 3]], ["AN", 10, 0, 5], ["FU", 10, [1, 2, 3, 4]], ["AN", 10, 1, 4], ["FU", 10, [2, 3, 4, 5]], ["AN", 10, 2, 6], ["FU", 4, [0, 1, 2, 3]], ["SP", 4, 0, 6, [1], 1], ["AN", 4, 1, 2], ["FFSP", 4, 0, [5, 4, 3, 2], 1, 1], ["AN", 4, 1, 6], ["FU", 2, [0, 1, 2, 3]], ["SP", 2, 0, 9, [1], 1], ["AN", 2, 1, 2], ["FFSP", 2, 0, [5, 4, 3, 2], 1, 1], ["AN", 2, 1, 6], ["PR", 5, 0, "auto_unroll_max_step$1024"]]]], "r": [[8.06367e-05, 8.07083e-05, 8.07178e-05, 8.07132e-05, 8.06982e-05, 8.06669e-05, 8.06764e-05, 8.06624e-05, 8.06743e-05, 8.06648e-05], 0, 35.2459, 1653987629], "v": "v0.6"}
{"i": [["[\"fused_conv7x7_s2_bn_relu\", 1, 224, 224, 3, 64, 7, 7]", "cuda -keys=cuda,gpu -max_num_threads=1024 -model=unknown -thread_warp_size=32", [-1, 16, 64, 49152, 2147483647, 1024, 8, 32], "", 0, []], [[], [["CI", 7], ["CI", 5], ["SP", 3, 0, 1, [1, 1, 1, 1], 1], ["SP", 3, 5, 112, [1, 16, 1, 1], 1], ["SP", 3, 10, 112, [1, 4, 2, 2], 1], ["SP", 3, 15, 64, [2, 4, 8, 1], 1], ["SP", 3, 20, 3, [1, 1], 1], ["SP", 3, 23, 7, [1, 1], 1], ["SP", 3, 26, 7, [1, 7], 1], ["RE", 3, [0, 5, 10, 15, 1, 6, 11, 16, 2, 7, 12, 17, 20, 23, 26, 21, 24, 27, 3, 8, 13, 18, 22, 25, 28, 4, 9, 14, 19]], ["FSP", 8, 0, 2, 3], ["FSP", 8, 4, 3, 3], ["FSP", 8, 8, 4, 3], ["FSP", 8, 12, 5, 3], ["RE", 8, [0, 4, 8, 12, 1, 5, 9, 13, 2, 6, 10, 14, 3, 7, 11, 15]], ["CA", 3, 8, 11], ["CHR", 2, "shared", [3]], ["CA", 3, 4, 14], ["CHR", 1, "shared", [4]], ["CA", 2, 5, 14], ["CI", 1], ["FU", 10, [0, 1, 2, 3]], ["AN", 10, 0, 5], ["FU", 10, [1, 2, 3, 4]], ["AN", 10, 1, 4], ["FU", 10, [2, 3, 4, 5]], ["AN", 10, 2, 6], ["FU", 4, [0, 1, 2, 3]], ["SP", 4, 0, 28, [7], 1], ["AN", 4, 1, 2], ["FFSP", 4, 0, [5, 4, 3, 2], 1, 1], ["AN", 4, 1, 6], ["FU", 2, [0, 1, 2, 3]], ["SP", 2, 0, 7, [1], 1], ["AN", 2, 1, 2], ["FFSP", 2, 0, [5, 4, 3, 2], 1, 1], ["AN", 2, 1, 6], ["PR", 5, 0, "auto_unroll_max_step$64"]]]], "r": [[6.53988e-05, 6.53923e-05, 6.53851e-05, 6.53875e-05, 6.54071e-05, 6.53921e-05, 6.53979e-05, 6.53952e-05, 6.5399e-05, 6.54e-05], 0, 11.4514, 1653987606], "v": "v0.6"}
{"i": [["[\"fused_conv7x7_s2_bn_relu\", 1, 224, 224, 3, 64, 7, 7]", "cuda -keys=cuda,gpu -max_num_threads=1024 -model=unknown -thread_warp_size=32", [-1, 16, 64, 49152, 2147483647, 1024, 8, 32], "", 0, []], [[], [["CI", 7], ["CI", 5], ["SP", 3, 0, 1, [1, 1, 1, 1], 1], ["SP", 3, 5, 112, [1, 1, 2, 4], 1], ["SP", 3, 10, 112, [2, 14, 2, 2], 1], ["SP", 3, 15, 64, [1, 4, 16, 1], 1], ["SP", 3, 20, 3, [3, 1], 1], ["SP", 3, 23, 7, [1, 1], 1], ["SP", 3, 26, 7, [7, 1], 1], ["RE", 3, [0, 5, 10, 15, 1, 6, 11, 16, 2, 7, 12, 17, 20, 23, 26, 21, 24, 27, 3, 8, 13, 18, 22, 25, 28, 4, 9, 14, 19]], ["FSP", 8, 0, 2, 3], ["FSP", 8, 4, 3, 3], ["FSP", 8, 8, 4, 3], ["FSP", 8, 12, 5, 3], ["RE", 8, [0, 4, 8, 12, 1, 5, 9, 13, 2, 6, 10, 14, 3, 7, 11, 15]], ["CA", 3, 8, 11], ["CHR", 2, "shared", [3]], ["CA", 3, 4, 14], ["CHR", 1, "shared", [4]], ["CA", 2, 5, 14], ["CI", 1], ["FU", 10, [0, 1, 2, 3]], ["AN", 10, 0, 5], ["FU", 10, [1, 2, 3, 4]], ["AN", 10, 1, 4], ["FU", 10, [2, 3, 4, 5]], ["AN", 10, 2, 6], ["FU", 4, [0, 1, 2, 3]], ["SP", 4, 0, 336, [1], 1], ["AN", 4, 1, 2], ["FFSP", 4, 0, [5, 4, 3, 2], 1, 1], ["AN", 4, 1, 6], ["FU", 2, [0, 1, 2, 3]], ["SP", 2, 0, 315, [1], 1], ["AN", 2, 1, 2], ["FFSP", 2, 0, [5, 4, 3, 2], 1, 1], ["AN", 2, 1, 6], ["PR", 5, 0, "auto_unroll_max_step$1024"]]]], "r": [[0.0025742, 0.00257395, 0.00257408, 0.00257384, 0.00257404, 0.00257377, 0.00257392, 0.0025739, 0.00257407, 0.0025741], 0, 24.584, 1653987612], "v": "v0.6"}
{"i": [["[\"fused_conv7x7_s2_bn_relu\", 1, 224, 224, 3, 64, 7, 7]", "cuda -keys=cuda,gpu -max_num_threads=1024 -model=unknown -thread_warp_size=32", [-1, 16, 64, 49152, 2147483647, 1024, 8, 32], "", 0, []], [[], [["CI", 7], ["CI", 5], ["SP", 3, 0, 1, [1, 1, 1, 1], 1], ["SP", 3, 5, 112, [14, 2, 2, 1], 1], ["SP", 3, 10, 112, [1, 4, 1, 1], 1], ["SP", 3, 15, 64, [1, 4, 1, 4], 1], ["SP", 3, 20, 3, [3, 1], 1], ["SP", 3, 23, 7, [7, 1], 1], ["SP", 3, 26, 7, [7, 1], 1], ["RE", 3, [0, 5, 10, 15, 1, 6, 11, 16, 2, 7, 12, 17, 20, 23, 26, 21, 24, 27, 3, 8, 13, 18, 22, 25, 28, 4, 9, 14, 19]], ["FSP", 8, 0, 2, 3], ["FSP", 8, 4, 3, 3], ["FSP", 8, 8, 4, 3], ["FSP", 8, 12, 5, 3], ["RE", 8, [0, 4, 8, 12, 1, 5, 9, 13, 2, 6, 10, 14, 3, 7, 11, 15]], ["CA", 3, 8, 11], ["CHR", 2, "shared", [3]], ["CA", 3, 4, 14], ["CHR", 1, "shared", [4]], ["CA", 2, 5, 14], ["CI", 1], ["FU", 10, [0, 1, 2, 3]], ["AN", 10, 0, 5], ["FU", 10, [1, 2, 3, 4]], ["AN", 10, 1, 4], ["FU", 10, [2, 3, 4, 5]], ["AN", 10, 2, 6], ["FU", 4, [0, 1, 2, 3]], ["SP", 4, 0, 588, [1], 1], ["AN", 4, 1, 2], ["FFSP", 4, 0, [5, 4, 3, 2], 1, 1], ["AN", 4, 1, 6], ["FU", 2, [0, 1, 2, 3]], ["SP", 2, 0, 693, [1], 1], ["AN", 2, 1, 2], ["FFSP", 2, 0, [5, 4, 3, 2], 1, 1], ["AN", 2, 1, 6], ["PR", 5, 0, "auto_unroll_max_step$512"]]]], "r": [[4.33606e-05, 4.33736e-05, 4.33765e-05, 4.33829e-05, 4.33848e-05, 4.33876e-05, 4.33831e-05, 4.33824e-05, 4.33782e-05, 4.33798e-05], 0, 59.164, 1653987653], "v": "v0.6"}
{"i": [["[\"fused_conv7x7_s2_bn_relu\", 1, 224, 224, 3, 64, 7, 7]", "cuda -keys=cuda,gpu -max_num_threads=1024 -model=unknown -thread_warp_size=32", [-1, 16, 64, 49152, 2147483647, 1024, 8, 32], "", 0, []], [[], [["CI", 7], ["CI", 5], ["SP", 3, 0, 1, [1, 1, 1, 1], 1], ["SP", 3, 5, 112, [1, 8, 1, 7], 1], ["SP", 3, 10, 112, [4, 1, 2, 1], 1], ["SP", 3, 15, 64, [2, 4, 2, 2], 1], ["SP", 3, 20, 3, [3, 1], 1], ["SP", 3, 23, 7, [7, 1], 1], ["SP", 3, 26, 7, [1, 1], 1], ["RE", 3, [0, 5, 10, 15, 1, 6, 11, 16, 2, 7, 12, 17, 20, 23, 26, 21, 24, 27, 3, 8, 13, 18, 22, 25, 28, 4, 9, 14, 19]], ["FSP", 8, 0, 2, 3], ["FSP", 8, 4, 3, 3], ["FSP", 8, 8, 4, 3], ["FSP", 8, 12, 5, 3], ["RE", 8, [0, 4, 8, 12, 1, 5, 9, 13, 2, 6, 10, 14, 3, 7, 11, 15]], ["CA", 3, 8, 11], ["CHR", 2, "shared", [3]], ["CA", 3, 4, 14], ["CHR", 1, "shared", [4]], ["CA", 2, 5, 14], ["CI", 1], ["FU", 10, [0, 1, 2, 3]], ["AN", 10, 0, 5], ["FU", 10, [1, 2, 3, 4]], ["AN", 10, 1, 4], ["FU", 10, [2, 3, 4, 5]], ["AN", 10, 2, 6], ["FU", 4, [0, 1, 2, 3]], ["SP", 4, 0, 84, [1], 1], ["AN", 4, 1, 2], ["FFSP", 4, 0, [5, 4, 3, 2], 1, 1], ["AN", 4, 1, 6], ["FU", 2, [0, 1, 2, 3]], ["SP", 2, 0, 513, [1], 1], ["AN", 2, 1, 2], ["FFSP", 2, 0, [5, 4, 3, 2], 1, 1], ["AN", 2, 1, 6], ["PR", 5, 0, "auto_unroll_max_step$1024"]]]], "r": [[0.000702943, 0.00069806, 0.000697998, 0.000697994, 0.000698037, 0.000698052, 0.000698069, 0.000697998, 0.00069796, 0.000698035], 0, 56.9475, 1653987647], "v": "v0.6"}
{"i": [["[\"fused_conv7x7_s2_bn_relu\", 1, 224, 224, 3, 64, 7, 7]", "cuda -keys=cuda,gpu -max_num_threads=1024 -model=unknown -thread_warp_size=32", [-1, 16, 64, 49152, 2147483647, 1024, 8, 32], "", 0, []], [[], [["CI", 7], ["CI", 5], ["SP", 3, 0, 1, [1, 1, 1, 1], 1], ["SP", 3, 5, 112, [1, 8, 1, 2], 1], ["SP", 3, 10, 112, [1, 28, 1, 1], 1], ["SP", 3, 15, 64, [1, 1, 32, 2], 1], ["SP", 3, 20, 3, [1, 1], 1], ["SP", 3, 23, 7, [7, 1], 1], ["SP", 3, 26, 7, [7, 1], 1], ["RE", 3, [0, 5, 10, 15, 1, 6, 11, 16, 2, 7, 12, 17, 20, 23, 26, 21, 24, 27, 3, 8, 13, 18, 22, 25, 28, 4, 9, 14, 19]], ["FSP", 8, 0, 2, 3], ["FSP", 8, 4, 3, 3], ["FSP", 8, 8, 4, 3], ["FSP", 8, 12, 5, 3], ["RE", 8, [0, 4, 8, 12, 1, 5, 9, 13, 2, 6, 10, 14, 3, 7, 11, 15]], ["CA", 3, 8, 11], ["CHR", 2, "shared", [3]], ["CA", 3, 4, 14], ["CHR", 1, "shared", [4]], ["CA", 2, 5, 14], ["CI", 1], ["FU", 10, [0, 1, 2, 3]], ["AN", 10, 0, 5], ["FU", 10, [1, 2, 3, 4]], ["AN", 10, 1, 4], ["FU", 10, [2, 3, 4, 5]], ["AN", 10, 2, 6], ["FU", 4, [0, 1, 2, 3]], ["SP", 4, 0, 3136, [1], 1], ["AN", 4, 1, 2], ["FFSP", 4, 0, [5, 4, 3, 2], 1, 1], ["AN", 4, 1, 6], ["FU", 2, [0, 1, 2, 3]], ["SP", 2, 0, 63, [1], 1], ["AN", 2, 1, 2], ["FFSP", 2, 0, [5, 4, 3, 2], 1, 1], ["AN", 2, 1, 6], ["PR", 5, 0, "auto_unroll_max_step$16"]]]], "r": [[0.000105008, 0.000104999, 0.000105028, 0.000105035, 0.000105003, 0.000104994, 0.000105006, 0.000105006, 0.000105022, 0.000104993], 0, 40.6874, 1653987635], "v": "v0.6"}
{"i": [["[\"fused_conv7x7_s2_bn_relu\", 1, 224, 224, 3, 64, 7, 7]", "cuda -keys=cuda,gpu -max_num_threads=1024 -model=unknown -thread_warp_size=32", [-1, 16, 64, 49152, 2147483647, 1024, 8, 32], "", 0, []], [[], [["CI", 7], ["CI", 5], ["SP", 3, 0, 1, [1, 1, 1, 1], 1], ["SP", 3, 5, 112, [1, 2, 2, 7], 1], ["SP", 3, 10, 112, [1, 2, 8, 1], 1], ["SP", 3, 15, 64, [1, 8, 1, 2], 1], ["SP", 3, 20, 3, [1, 1], 1], ["SP", 3, 23, 7, [1, 7], 1], ["SP", 3, 26, 7, [7, 1], 1], ["RE", 3, [0, 5, 10, 15, 1, 6, 11, 16, 2, 7, 12, 17, 20, 23, 26, 21, 24, 27, 3, 8, 13, 18, 22, 25, 28, 4, 9, 14, 19]], ["FSP", 8, 0, 2, 3], ["FSP", 8, 4, 3, 3], ["FSP", 8, 8, 4, 3], ["FSP", 8, 12, 5, 3], ["RE", 8, [0, 4, 8, 12, 1, 5, 9, 13, 2, 6, 10, 14, 3, 7, 11, 15]], ["CA", 3, 8, 11], ["CHR", 2, "shared", [3]], ["CA", 3, 4, 14], ["CHR", 1, "shared", [4]], ["CA", 2, 5, 14], ["CI", 1], ["FU", 10, [0, 1, 2, 3]], ["AN", 10, 0, 5], ["FU", 10, [1, 2, 3, 4]], ["AN", 10, 1, 4], ["FU", 10, [2, 3, 4, 5]], ["AN", 10, 2, 6], ["FU", 4, [0, 1, 2, 3]], ["SP", 4, 0, 98, [1], 1], ["AN", 4, 1, 2], ["FFSP", 4, 0, [5, 4, 3, 2], 1, 1], ["AN", 4, 1, 6], ["FU", 2, [0, 1, 2, 3]], ["SP", 2, 0, 693, [1], 1], ["AN", 2, 1, 2], ["FFSP", 2, 0, [5, 4, 3, 2], 1, 1], ["AN", 2, 1, 6], ["PR", 5, 0, "auto_unroll_max_step$1024"]]]], "r": [[8.22515e-05, 8.22587e-05, 8.22579e-05, 8.22504e-05, 8.22515e-05, 8.22472e-05, 8.22308e-05, 8.22408e-05, 8.22437e-05, 8.22427e-05], 0, 66.3306, 1653987658], "v": "v0.6"}
{"i": [["[\"fused_conv7x7_s2_bn_relu\", 1, 224, 224, 3, 64, 7, 7]", "cuda -keys=cuda,gpu -max_num_threads=1024 -model=unknown -thread_warp_size=32", [-1, 16, 64, 49152, 2147483647, 1024, 8, 32], "", 0, []], [[], [["CI", 7], ["CI", 5], ["SP", 3, 0, 1, [1, 1, 1, 1], 1], ["SP", 3, 5, 112, [1, 7, 8, 1], 1], ["SP", 3, 10, 112, [1, 7, 1, 4], 1], ["SP", 3, 15, 64, [1, 2, 32, 1], 1], ["SP", 3, 20, 3, [1, 1], 1], ["SP", 3, 23, 7, [1, 1], 1], ["SP", 3, 26, 7, [7, 1], 1], ["RE", 3, [0, 5, 10, 15, 1, 6, 11, 16, 2, 7, 12, 17, 20, 23, 26, 21, 24, 27, 3, 8, 13, 18, 22, 25, 28, 4, 9, 14, 19]], ["FSP", 8, 0, 2, 3], ["FSP", 8, 4, 3, 3], ["FSP", 8, 8, 4, 3], ["FSP", 8, 12, 5, 3], ["RE", 8, [0, 4, 8, 12, 1, 5, 9, 13, 2, 6, 10, 14, 3, 7, 11, 15]], ["CA", 3, 8, 11], ["CHR", 2, "shared", [3]], ["CA", 3, 4, 14], ["CHR", 1, "shared", [4]], ["CA", 2, 5, 14], ["CI", 1], ["FU", 10, [0, 1, 2, 3]], ["AN", 10, 0, 5], ["FU", 10, [1, 2, 3, 4]], ["AN", 10, 1, 4], ["FU", 10, [2, 3, 4, 5]], ["AN", 10, 2, 6], ["FU", 4, [0, 1, 2, 3]], ["SP", 4, 0, 224, [1], 1], ["AN", 4, 1, 2], ["FFSP", 4, 0, [5, 4, 3, 2], 1, 1], ["AN", 4, 1, 6], ["FU", 2, [0, 1, 2, 3]], ["SP", 2, 0, 105, [1], 1], ["AN", 2, 1, 2], ["FFSP", 2, 0, [5, 4, 3, 2], 1, 1], ["AN", 2, 1, 6], ["PR", 5, 0, "auto_unroll_max_step$512"]]]], "r": [[0.00225932, 0.00225914, 0.00225933, 0.00225937, 0.00225967, 0.00225965, 0.00225961, 0.00225942, 0.00225948, 0.00225943], 0, 74.4578, 1653987668], "v": "v0.6"}
{"i": [["[\"fused_conv7x7_s2_bn_relu\", 1, 224, 224, 3, 64, 7, 7]", "cuda -keys=cuda,gpu -max_num_threads=1024 -model=unknown -thread_warp_size=32", [-1, 16, 64, 49152, 2147483647, 1024, 8, 32], "", 0, []], [[], [["CI", 7], ["CI", 5], ["SP", 3, 0, 1, [1, 1, 1, 1], 1], ["SP", 3, 5, 112, [7, 4, 1, 2], 1], ["SP", 3, 10, 112, [1, 2, 8, 1], 1], ["SP", 3, 15, 64, [1, 16, 1, 4], 1], ["SP", 3, 20, 3, [1, 1], 1], ["SP", 3, 23, 7, [7, 1], 1], ["SP", 3, 26, 7, [1, 7], 1], ["RE", 3, [0, 5, 10, 15, 1, 6, 11, 16, 2, 7, 12, 17, 20, 23, 26, 21, 24, 27, 3, 8, 13, 18, 22, 25, 28, 4, 9, 14, 19]], ["FSP", 8, 0, 2, 3], ["FSP", 8, 4, 3, 3], ["FSP", 8, 8, 4, 3], ["FSP", 8, 12, 5, 3], ["RE", 8, [0, 4, 8, 12, 1, 5, 9, 13, 2, 6, 10, 14, 3, 7, 11, 15]], ["CA", 3, 8, 11], ["CHR", 2, "shared", [3]], ["CA", 3, 4, 14], ["CHR", 1, "shared", [4]], ["CA", 2, 5, 14], ["CI", 1], ["FU", 10, [0, 1, 2, 3]], ["AN", 10, 0, 5], ["FU", 10, [1, 2, 3, 4]], ["AN", 10, 1, 4], ["FU", 10, [2, 3, 4, 5]], ["AN", 10, 2, 6], ["FU", 4, [0, 1, 2, 3]], ["SP", 4, 0, 196, [1], 1], ["AN", 4, 1, 2], ["FFSP", 4, 0, [5, 4, 3, 2], 1, 1], ["AN", 4, 1, 6], ["FU", 2, [0, 1, 2, 3]], ["SP", 2, 0, 189, [1], 1], ["AN", 2, 1, 2], ["FFSP", 2, 0, [5, 4, 3, 2], 1, 1], ["AN", 2, 1, 6], ["PR", 5, 0, "auto_unroll_max_step$512"]]]], "r": [[0.000210736, 0.000210735, 0.000210765, 0.000210751, 0.00021074, 0.00021077, 0.000210755, 0.000210754, 0.00021076, 0.000210748], 0, 91.6504, 1653987685], "v": "v0.6"}
{"i": [["[\"fused_conv7x7_s2_bn_relu\", 1, 224, 224, 3, 64, 7, 7]", "cuda -keys=cuda,gpu -max_num_threads=1024 -model=unknown -thread_warp_size=32", [-1, 16, 64, 49152, 2147483647, 1024, 8, 32], "", 0, []], [[], [["CI", 7], ["CI", 5], ["SP", 3, 0, 1, [1, 1, 1, 1], 1], ["SP", 3, 5, 112, [1, 2, 1, 1], 1], ["SP", 3, 10, 112, [1, 1, 28, 1], 1], ["SP", 3, 15, 64, [1, 32, 1, 1], 1], ["SP", 3, 20, 3, [1, 3], 1], ["SP", 3, 23, 7, [1, 7], 1], ["SP", 3, 26, 7, [7, 1], 1], ["RE", 3, [0, 5, 10, 15, 1, 6, 11, 16, 2, 7, 12, 17, 20, 23, 26, 21, 24, 27, 3, 8, 13, 18, 22, 25, 28, 4, 9, 14, 19]], ["FSP", 8, 0, 2, 3], ["FSP", 8, 4, 3, 3], ["FSP", 8, 8, 4, 3], ["FSP", 8, 12, 5, 3], ["RE", 8, [0, 4, 8, 12, 1, 5, 9, 13, 2, 6, 10, 14, 3, 7, 11, 15]], ["CA", 3, 8, 11], ["CHR", 2, "shared", [3]], ["CA", 3, 4, 14], ["CHR", 1, "shared", [4]], ["CA", 2, 5, 14], ["CI", 1], ["FU", 10, [0, 1, 2, 3]], ["AN", 10, 0, 5], ["FU", 10, [1, 2, 3, 4]], ["AN", 10, 1, 4], ["FU", 10, [2, 3, 4, 5]], ["AN", 10, 2, 6], ["FU", 4, [0, 1, 2, 3]], ["SP", 4, 0, 147, [21], 1], ["AN", 4, 1, 2], ["FFSP", 4, 0, [5, 4, 3, 2], 1, 1], ["AN", 4, 1, 6], ["FU", 2, [0, 1, 2, 3]], ["SP", 2, 0, 1281, [1], 1], ["AN", 2, 1, 2], ["FFSP", 2, 0, [5, 4, 3, 2], 1, 1], ["AN", 2, 1, 6], ["PR", 5, 0, "auto_unroll_max_step$512"]]]], "r": [[5.67312e-05, 5.67368e-05, 5.67338e-05, 5.67341e-05, 5.67377e-05, 5.67354e-05, 5.6737e-05, 5.67364e-05, 5.67328e-05, 5.67293e-05], 0, 69.8055, 1653987664], "v": "v0.6"}
{"i": [["[\"fused_conv7x7_s2_bn_relu\", 1, 224, 224, 3, 64, 7, 7]", "cuda -keys=cuda,gpu -max_num_threads=1024 -model=unknown -thread_warp_size=32", [-1, 16, 64, 49152, 2147483647, 1024, 8, 32], "", 0, []], [[], [["CI", 7], ["CI", 5], ["SP", 3, 0, 1, [1, 1, 1, 1], 1], ["SP", 3, 5, 112, [4, 7, 1, 1], 1], ["SP", 3, 10, 112, [1, 2, 2, 4], 1], ["SP", 3, 15, 64, [1, 32, 1, 2], 1], ["SP", 3, 20, 3, [1, 3], 1], ["SP", 3, 23, 7, [1, 1], 1], ["SP", 3, 26, 7, [7, 1], 1], ["RE", 3, [0, 5, 10, 15, 1, 6, 11, 16, 2, 7, 12, 17, 20, 23, 26, 21, 24, 27, 3, 8, 13, 18, 22, 25, 28, 4, 9, 14, 19]], ["FSP", 8, 0, 2, 3], ["FSP", 8, 4, 3, 3], ["FSP", 8, 8, 4, 3], ["FSP", 8, 12, 5, 3], ["RE", 8, [0, 4, 8, 12, 1, 5, 9, 13, 2, 6, 10, 14, 3, 7, 11, 15]], ["CA", 3, 8, 11], ["CHR", 2, "shared", [3]], ["CA", 3, 4, 14], ["CHR", 1, "shared", [4]], ["CA", 2, 5, 14], ["CI", 1], ["FU", 10, [0, 1, 2, 3]], ["AN", 10, 0, 5], ["FU", 10, [1, 2, 3, 4]], ["AN", 10, 1, 4], ["FU", 10, [2, 3, 4, 5]], ["AN", 10, 2, 6], ["FU", 4, [0, 1, 2, 3]], ["SP", 4, 0, 42, [1], 1], ["AN", 4, 1, 2], ["FFSP", 4, 0, [5, 4, 3, 2], 1, 1], ["AN", 4, 1, 6], ["FU", 2, [0, 1, 2, 3]], ["SP", 2, 0, 45, [5], 1], ["AN", 2, 1, 2], ["FFSP", 2, 0, [5, 4, 3, 2], 1, 1], ["AN", 2, 1, 6], ["PR", 5, 0, "auto_unroll_max_step$512"]]]], "r": [[0.00114919, 0.00114899, 0.00114898, 0.0011489, 0.00114898, 0.00114908, 0.0011491, 0.00114916, 0.00114919, 0.0011489], 0, 99.94, 1653987694], "v": "v0.6"}
{"i": [["[\"fused_conv7x7_s2_bn_relu\", 1, 224, 224, 3, 64, 7, 7]", "cuda -keys=cuda,gpu -max_num_threads=1024 -model=unknown -thread_warp_size=32", [-1, 16, 64, 49152, 2147483647, 1024, 8, 32], "", 0, []], [[], [["CI", 7], ["CI", 5], ["SP", 3, 0, 1, [1, 1, 1, 1], 1], ["SP", 3, 5, 112, [1, 4, 1, 2], 1], ["SP", 3, 10, 112, [2, 2, 1, 1], 1], ["SP", 3, 15, 64, [1, 4, 2, 1], 1], ["SP", 3, 20, 3, [3, 1], 1], ["SP", 3, 23, 7, [7, 1], 1], ["SP", 3, 26, 7, [7, 1], 1], ["RE", 3, [0, 5, 10, 15, 1, 6, 11, 16, 2, 7, 12, 17, 20, 23, 26, 21, 24, 27, 3, 8, 13, 18, 22, 25, 28, 4, 9, 14, 19]], ["FSP", 8, 0, 2, 3], ["FSP", 8, 4, 3, 3], ["FSP", 8, 8, 4, 3], ["FSP", 8, 12, 5, 3], ["RE", 8, [0, 4, 8, 12, 1, 5, 9, 13, 2, 6, 10, 14, 3, 7, 11, 15]], ["CA", 3, 8, 11], ["CHR", 2, "shared", [3]], ["CA", 3, 4, 14], ["CHR", 1, "shared", [4]], ["CA", 2, 5, 14], ["CI", 1], ["FU", 10, [0, 1, 2, 3]], ["AN", 10, 0, 5], ["FU", 10, [1, 2, 3, 4]], ["AN", 10, 1, 4], ["FU", 10, [2, 3, 4, 5]], ["AN", 10, 2, 6], ["FU", 4, [0, 1, 2, 3]], ["SP", 4, 0, 6, [1], 1], ["AN", 4, 1, 2], ["FFSP", 4, 0, [5, 4, 3, 2], 1, 1], ["AN", 4, 1, 6], ["FU", 2, [0, 1, 2, 3]], ["SP", 2, 0, 9, [1], 1], ["AN", 2, 1, 2], ["FFSP", 2, 0, [5, 4, 3, 2], 1, 1], ["AN", 2, 1, 6], ["PR", 5, 0, "auto_unroll_max_step$64"]]]], "r": [[3.0657e-05, 3.10499e-05, 3.0711e-05, 3.09686e-05, 3.09401e-05, 3.08617e-05, 3.08709e-05, 3.09016e-05, 3.09205e-05, 3.0918e-05], 0, 84.79, 1653987679], "v": "v0.6"}
{"i": [["[\"fused_conv7x7_s2_bn_relu\", 1, 224, 224, 3, 64, 7, 7]", "cuda -keys=cuda,gpu -max_num_threads=1024 -model=unknown -thread_warp_size=32", [-1, 16, 64, 49152, 2147483647, 1024, 8, 32], "", 0, []], [[], [["CI", 7], ["CI", 5], ["SP", 3, 0, 1, [1, 1, 1, 1], 1], ["SP", 3, 5, 112, [1, 8, 1, 7], 1], ["SP", 3, 10, 112, [4, 1, 1, 2], 1], ["SP", 3, 15, 64, [2, 4, 2, 2], 1], ["SP", 3, 20, 3, [3, 1], 1], ["SP", 3, 23, 7, [7, 1], 1], ["SP", 3, 26, 7, [7, 1], 1], ["RE", 3, [0, 5, 10, 15, 1, 6, 11, 16, 2, 7, 12, 17, 20, 23, 26, 21, 24, 27, 3, 8, 13, 18, 22, 25, 28, 4, 9, 14, 19]], ["FSP", 8, 0, 2, 3], ["FSP", 8, 4, 3, 3], ["FSP", 8, 8, 4, 3], ["FSP", 8, 12, 5, 3], ["RE", 8, [0, 4, 8, 12, 1, 5, 9, 13, 2, 6, 10, 14, 3, 7, 11, 15]], ["CA", 3, 8, 11], ["CHR", 2, "shared", [3]], ["CA", 3, 4, 14], ["CHR", 1, "shared", [4]], ["CA", 2, 5, 14], ["CI", 1], ["FU", 10, [0, 1, 2, 3]], ["AN", 10, 0, 5], ["FU", 10, [1, 2, 3, 4]], ["AN", 10, 1, 4], ["FU", 10, [2, 3, 4, 5]], ["AN", 10, 2, 6], ["FU", 4, [0, 1, 2, 3]], ["SP", 4, 0, 84, [3], 1], ["AN", 4, 1, 2], ["FFSP", 4, 0, [5, 4, 3, 2], 1, 1], ["AN", 4, 1, 6], ["FU", 2, [0, 1, 2, 3]], ["SP", 2, 0, 513, [1], 1], ["AN", 2, 1, 2], ["FFSP", 2, 0, [5, 4, 3, 2], 1, 1], ["AN", 2, 1, 6], ["PR", 5, 0, "auto_unroll_max_step$1024"]]]], "r": [[0.000761786, 0.000761873, 0.000761903, 0.0007618, 0.000761739, 0.000761907, 0.00076185, 0.000761934, 0.00076173, 0.000762047], 0, 83.2197, 1653987674], "v": "v0.6"}
{"i": [["[\"fused_conv7x7_s2_bn_relu\", 1, 224, 224, 3, 64, 7, 7]", "cuda -keys=cuda,gpu -max_num_threads=1024 -model=unknown -thread_warp_size=32", [-1, 16, 64, 49152, 2147483647, 1024, 8, 32], "", 0, []], [[], [["CI", 7], ["CI", 5], ["SP", 3, 0, 1, [1, 1, 1, 1], 1], ["SP", 3, 5, 112, [1, 7, 1, 1], 1], ["SP", 3, 10, 112, [1, 2, 4, 1], 1], ["SP", 3, 15, 64, [2, 16, 1, 2], 1], ["SP", 3, 20, 3, [1, 3], 1], ["SP", 3, 23, 7, [7, 1], 1], ["SP", 3, 26, 7, [7, 1], 1], ["RE", 3, [0, 5, 10, 15, 1, 6, 11, 16, 2, 7, 12, 17, 20, 23, 26, 21, 24, 27, 3, 8, 13, 18, 22, 25, 28, 4, 9, 14, 19]], ["FSP", 8, 0, 2, 3], ["FSP", 8, 4, 3, 3], ["FSP", 8, 8, 4, 3], ["FSP", 8, 12, 5, 3], ["RE", 8, [0, 4, 8, 12, 1, 5, 9, 13, 2, 6, 10, 14, 3, 7, 11, 15]], ["CA", 3, 8, 11], ["CHR", 2, "shared", [3]], ["CA", 3, 4, 14], ["CHR", 1, "shared", [4]], ["CA", 2, 5, 14], ["CI", 1], ["FU", 10, [0, 1, 2, 3]], ["AN", 10, 0, 5], ["FU", 10, [1, 2, 3, 4]], ["AN", 10, 1, 4], ["FU", 10, [2, 3, 4, 5]], ["AN", 10, 2, 6], ["FU", 4, [0, 1, 2, 3]], ["SP", 4, 0, 42, [1], 1], ["AN", 4, 1, 2], ["FFSP", 4, 0, [5, 4, 3, 2], 1, 1], ["AN", 4, 1, 6], ["FU", 2, [0, 1, 2, 3]], ["SP", 2, 0, 441, [7], 1], ["AN", 2, 1, 2], ["FFSP", 2, 0, [5, 4, 3, 2], 1, 1], ["AN", 2, 1, 6], ["PR", 5, 0, "auto_unroll_max_step$1024"]]]], "r": [[2.84922e-05, 2.84659e-05, 2.84623e-05, 2.84618e-05, 2.84623e-05, 2.84624e-05, 2.84615e-05, 2.84653e-05, 2.84655e-05, 2.84625e-05], 0, 105.123, 1653987699], "v": "v0.6"}
{"i": [["[\"fused_conv7x7_s2_bn_relu\", 1, 224, 224, 3, 64, 7, 7]", "cuda -keys=cuda,gpu -max_num_threads=1024 -model=unknown -thread_warp_size=32", [-1, 16, 64, 49152, 2147483647, 1024, 8, 32], "", 0, []], [[], [["CI", 7], ["CI", 5], ["SP", 3, 0, 1, [1, 1, 1, 1], 1], ["SP", 3, 5, 112, [1, 7, 8, 1], 1], ["SP", 3, 10, 112, [1, 7, 1, 4], 1], ["SP", 3, 15, 64, [1, 2, 32, 1], 1], ["SP", 3, 20, 3, [1, 1], 1], ["SP", 3, 23, 7, [1, 1], 1], ["SP", 3, 26, 7, [7, 1], 1], ["RE", 3, [0, 5, 10, 15, 1, 6, 11, 16, 2, 7, 12, 17, 20, 23, 26, 21, 24, 27, 3, 8, 13, 18, 22, 25, 28, 4, 9, 14, 19]], ["FSP", 8, 0, 2, 3], ["FSP", 8, 4, 3, 3], ["FSP", 8, 8, 4, 3], ["FSP", 8, 12, 5, 3], ["RE", 8, [0, 4, 8, 12, 1, 5, 9, 13, 2, 6, 10, 14, 3, 7, 11, 15]], ["CA", 3, 8, 11], ["CHR", 2, "shared", [3]], ["CA", 3, 4, 14], ["CHR", 1, "shared", [4]], ["CA", 2, 5, 14], ["CI", 1], ["FU", 10, [0, 1, 2, 3]], ["AN", 10, 0, 5], ["FU", 10, [1, 2, 3, 4]], ["AN", 10, 1, 4], ["FU", 10, [2, 3, 4, 5]], ["AN", 10, 2, 6], ["FU", 4, [0, 1, 2, 3]], ["SP", 4, 0, 224, [1], 1], ["AN", 4, 1, 2], ["FFSP", 4, 0, [5, 4, 3, 2], 1, 1], ["AN", 4, 1, 6], ["FU", 2, [0, 1, 2, 3]], ["SP", 2, 0, 105, [1], 1], ["AN", 2, 1, 2], ["FFSP", 2, 0, [5, 4, 3, 2], 1, 1], ["AN", 2, 1, 6], ["PR", 5, 0, "auto_unroll_max_step$16"]]]], "r": [[0.00253392, 0.00253386, 0.00253399, 0.00253385, 0.0025338, 0.00253396, 0.00253384, 0.00253392, 0.00253384, 0.00253384], 0, 94.5804, 1653987688], "v": "v0.6"}
{"i": [["[\"fused_conv7x7_s2_bn_relu\", 1, 224, 224, 3, 64, 7, 7]", "cuda -keys=cuda,gpu -max_num_threads=1024 -model=unknown -thread_warp_size=32", [-1, 16, 64, 49152, 2147483647, 1024, 8, 32], "", 0, []], [[], [["CI", 7], ["CI", 5], ["SP", 3, 0, 1, [1, 1, 1, 1], 1], ["SP", 3, 5, 112, [1, 7, 2, 2], 1], ["SP", 3, 10, 112, [2, 14, 1, 1], 1], ["SP", 3, 15, 64, [4, 2, 4, 1], 1], ["SP", 3, 20, 3, [1, 3], 1], ["SP", 3, 23, 7, [1, 7], 1], ["SP", 3, 26, 7, [1, 1], 1], ["RE", 3, [0, 5, 10, 15, 1, 6, 11, 16, 2, 7, 12, 17, 20, 23, 26, 21, 24, 27, 3, 8, 13, 18, 22, 25, 28, 4, 9, 14, 19]], ["FSP", 8, 0, 2, 3], ["FSP", 8, 4, 3, 3], ["FSP", 8, 8, 4, 3], ["FSP", 8, 12, 5, 3], ["RE", 8, [0, 4, 8, 12, 1, 5, 9, 13, 2, 6, 10, 14, 3, 7, 11, 15]], ["CA", 3, 8, 11], ["CHR", 2, "shared", [3]], ["CA", 3, 4, 14], ["CHR", 1, "shared", [4]], ["CA", 2, 5, 14], ["CI", 1], ["FU", 10, [0, 1, 2, 3]], ["AN", 10, 0, 5], ["FU", 10, [1, 2, 3, 4]], ["AN", 10, 1, 4], ["FU", 10, [2, 3, 4, 5]], ["AN", 10, 2, 6], ["FU", 4, [0, 1, 2, 3]], ["SP", 4, 0, 84, [1], 1], ["AN", 4, 1, 2], ["FFSP", 4, 0, [5, 4, 3, 2], 1, 1], ["AN", 4, 1, 6], ["FU", 2, [0, 1, 2, 3]], ["SP", 2, 0, 273, [1], 1], ["AN", 2, 1, 2], ["FFSP", 2, 0, [5, 4, 3, 2], 1, 1], ["AN", 2, 1, 6], ["PR", 5, 0, "auto_unroll_max_step$16"]]]], "r": [[0.000160102, 0.0001601, 0.000160103, 0.000160126, 0.00016012, 0.000160099, 0.000160106, 0.000160113, 0.000160101, 0.000160087], 0, 35.216, 1653988104], "v": "v0.6"}
{"i": [["[\"fused_conv7x7_s2_bn_relu\", 1, 224, 224, 3, 64, 7, 7]", "cuda -keys=cuda,gpu -max_num_threads=1024 -model=unknown -thread_warp_size=32", [-1, 16, 64, 49152, 2147483647, 1024, 8, 32], "", 0, []], [[], [["CI", 7], ["CI", 5], ["SP", 3, 0, 1, [1, 1, 1, 1], 1], ["SP", 3, 5, 112, [7, 1, 1, 1], 1], ["SP", 3, 10, 112, [1, 28, 1, 4], 1], ["SP", 3, 15, 64, [2, 4, 8, 1], 1], ["SP", 3, 20, 3, [3, 1], 1], ["SP", 3, 23, 7, [1, 1], 1], ["SP", 3, 26, 7, [7, 1], 1], ["RE", 3, [0, 5, 10, 15, 1, 6, 11, 16, 2, 7, 12, 17, 20, 23, 26, 21, 24, 27, 3, 8, 13, 18, 22, 25, 28, 4, 9, 14, 19]], ["FSP", 8, 0, 2, 3], ["FSP", 8, 4, 3, 3], ["FSP", 8, 8, 4, 3], ["FSP", 8, 12, 5, 3], ["RE", 8, [0, 4, 8, 12, 1, 5, 9, 13, 2, 6, 10, 14, 3, 7, 11, 15]], ["CA", 3, 8, 11], ["CHR", 2, "shared", [3]], ["CA", 3, 4, 14], ["CHR", 1, "shared", [4]], ["CA", 2, 5, 14], ["CI", 1], ["FU", 10, [0, 1, 2, 3]], ["AN", 10, 0, 5], ["FU", 10, [1, 2, 3, 4]], ["AN", 10, 1, 4], ["FU", 10, [2, 3, 4, 5]], ["AN", 10, 2, 6], ["FU", 4, [0, 1, 2, 3]], ["SP", 4, 0, 168, [3], 1], ["AN", 4, 1, 2], ["FFSP", 4, 0, [5, 4, 3, 2], 1, 1], ["AN", 4, 1, 6], ["FU", 2, [0, 1, 2, 3]], ["SP", 2, 0, 273, [13], 1], ["AN", 2, 1, 2], ["FFSP", 2, 0, [5, 4, 3, 2], 1, 1], ["AN", 2, 1, 6], ["PR", 5, 0, "auto_unroll_max_step$0"]]]], "r": [[0.00144117, 0.0014406, 0.00144031, 0.00144068, 0.00144028, 0.00144019, 0.00144084, 0.00144014, 0.00143991, 0.00144022], 0, 53.0384, 1653988121], "v": "v0.6"}
{"i": [["[\"fused_conv7x7_s2_bn_relu\", 1, 224, 224, 3, 64, 7, 7]", "cuda -keys=cuda,gpu -max_num_threads=1024 -model=unknown -thread_warp_size=32", [-1, 16, 64, 49152, 2147483647, 1024, 8, 32], "", 0, []], [[], [["CI", 7], ["CI", 5], ["SP", 3, 0, 1, [1, 1, 1, 1], 1], ["SP", 3, 5, 112, [2, 4, 2, 1], 1], ["SP", 3, 10, 112, [1, 8, 1, 2], 1], ["SP", 3, 15, 64, [1, 1, 8, 1], 1], ["SP", 3, 20, 3, [3, 1], 1], ["SP", 3, 23, 7, [1, 1], 1], ["SP", 3, 26, 7, [1, 1], 1], ["RE", 3, [0, 5, 10, 15, 1, 6, 11, 16, 2, 7, 12, 17, 20, 23, 26, 21, 24, 27, 3, 8, 13, 18, 22, 25, 28, 4, 9, 14, 19]], ["FSP", 8, 0, 2, 3], ["FSP", 8, 4, 3, 3], ["FSP", 8, 8, 4, 3], ["FSP", 8, 12, 5, 3], ["RE", 8, [0, 4, 8, 12, 1, 5, 9, 13, 2, 6, 10, 14, 3, 7, 11, 15]], ["CA", 3, 8, 11], ["CHR", 2, "shared", [3]], ["CA", 3, 4, 14], ["CHR", 1, "shared", [4]], ["CA", 2, 5, 14], ["CI", 1], ["FU", 10, [0, 1, 2, 3]], ["AN", 10, 0, 5], ["FU", 10, [1, 2, 3, 4]], ["AN", 10, 1, 4], ["FU", 10, [2, 3, 4, 5]], ["AN", 10, 2, 6], ["FU", 4, [0, 1, 2, 3]], ["SP", 4, 0, 1176, [1], 1], ["AN", 4, 1, 2], ["FFSP", 4, 0, [5, 4, 3, 2], 1, 1], ["AN", 4, 1, 6], ["FU", 2, [0, 1, 2, 3]], ["SP", 2, 0, 243, [1], 1], ["AN", 2, 1, 2], ["FFSP", 2, 0, [5, 4, 3, 2], 1, 1], ["AN", 2, 1, 6], ["PR", 5, 0, "auto_unroll_max_step$0"]]]], "r": [[0.00118492, 0.00118495, 0.00118495, 0.00118508, 0.00118503, 0.00118504, 0.00118504, 0.00118504, 0.00118501, 0.00118499], 0, 23.3667, 1653988093], "v": "v0.6"}
{"i": [["[\"fused_conv7x7_s2_bn_relu\", 1, 224, 224, 3, 64, 7, 7]", "cuda -keys=cuda,gpu -max_num_threads=1024 -model=unknown -thread_warp_size=32", [-1, 16, 64, 49152, 2147483647, 1024, 8, 32], "", 0, []], [[], [["CI", 7], ["CI", 5], ["SP", 3, 0, 1, [1, 1, 1, 1], 1], ["SP", 3, 5, 112, [2, 7, 4, 1], 1], ["SP", 3, 10, 112, [1, 2, 8, 1], 1], ["SP", 3, 15, 64, [1, 16, 4, 1], 1], ["SP", 3, 20, 3, [3, 1], 1], ["SP", 3, 23, 7, [1, 1], 1], ["SP", 3, 26, 7, [1, 1], 1], ["RE", 3, [0, 5, 10, 15, 1, 6, 11, 16, 2, 7, 12, 17, 20, 23, 26, 21, 24, 27, 3, 8, 13, 18, 22, 25, 28, 4, 9, 14, 19]], ["FSP", 8, 0, 2, 3], ["FSP", 8, 4, 3, 3], ["FSP", 8, 8, 4, 3], ["FSP", 8, 12, 5, 3], ["RE", 8, [0, 4, 8, 12, 1, 5, 9, 13, 2, 6, 10, 14, 3, 7, 11, 15]], ["CA", 3, 8, 11], ["CHR", 2, "shared", [3]], ["CA", 3, 4, 14], ["CHR", 1, "shared", [4]], ["CA", 2, 5, 14], ["CI", 1], ["FU", 10, [0, 1, 2, 3]], ["AN", 10, 0, 5], ["FU", 10, [1, 2, 3, 4]], ["AN", 10, 1, 4], ["FU", 10, [2, 3, 4, 5]], ["AN", 10, 2, 6], ["FU", 4, [0, 1, 2, 3]], ["SP", 4, 0, 12, [3], 1], ["AN", 4, 1, 2], ["FFSP", 4, 0, [5, 4, 3, 2], 1, 1], ["AN", 4, 1, 6], ["FU", 2, [0, 1, 2, 3]], ["SP", 2, 0, 315, [1], 1], ["AN", 2, 1, 2], ["FFSP", 2, 0, [5, 4, 3, 2], 1, 1], ["AN", 2, 1, 6], ["PR", 5, 0, "auto_unroll_max_step$512"]]]], "r": [[0.000425463, 0.000425481, 0.000425468, 0.00042552, 0.000425477, 0.000425497, 0.000425483, 0.000425504, 0.000425461, 0.000425495], 0, 48.0827, 1653988115], "v": "v0.6"}
{"i": [["[\"fused_conv7x7_s2_bn_relu\", 1, 224, 224, 3, 64, 7, 7]", "cuda -keys=cuda,gpu -max_num_threads=1024 -model=unknown -thread_warp_size=32", [-1, 16, 64, 49152, 2147483647, 1024, 8, 32], "", 0, []], [[], [["CI", 7], ["CI", 5], ["SP", 3, 0, 1, [1, 1, 1, 1], 1], ["SP", 3, 5, 112, [2, 4, 7, 2], 1], ["SP", 3, 10, 112, [1, 7, 1, 1], 1], ["SP", 3, 15, 64, [1, 4, 1, 16], 1], ["SP", 3, 20, 3, [1, 3], 1], ["SP", 3, 23, 7, [1, 1], 1], ["SP", 3, 26, 7, [1, 7], 1], ["RE", 3, [0, 5, 10, 15, 1, 6, 11, 16, 2, 7, 12, 17, 20, 23, 26, 21, 24, 27, 3, 8, 13, 18, 22, 25, 28, 4, 9, 14, 19]], ["FSP", 8, 0, 2, 3], ["FSP", 8, 4, 3, 3], ["FSP", 8, 8, 4, 3], ["FSP", 8, 12, 5, 3], ["RE", 8, [0, 4, 8, 12, 1, 5, 9, 13, 2, 6, 10, 14, 3, 7, 11, 15]], ["CA", 3, 8, 11], ["CHR", 2, "shared", [3]], ["CA", 3, 4, 14], ["CHR", 1, "shared", [4]], ["CA", 2, 5, 14], ["CI", 1], ["FU", 10, [0, 1, 2, 3]], ["AN", 10, 0, 5], ["FU", 10, [1, 2, 3, 4]], ["AN", 10, 1, 4], ["FU", 10, [2, 3, 4, 5]], ["AN", 10, 2, 6], ["FU", 4, [0, 1, 2, 3]], ["SP", 4, 0, 336, [1], 1], ["AN", 4, 1, 2], ["FFSP", 4, 0, [5, 4, 3, 2], 1, 1], ["AN", 4, 1, 6], ["FU", 2, [0, 1, 2, 3]], ["SP", 2, 0, 81, [1], 1], ["AN", 2, 1, 2], ["FFSP", 2, 0, [5, 4, 3, 2], 1, 1], ["AN", 2, 1, 6], ["PR", 5, 0, "auto_unroll_max_step$16"]]]], "r": [[0.000722855, 0.000722825, 0.000722811, 0.000722871, 0.000722842, 0.000722953, 0.000722904, 0.000722951, 0.000722916, 0.000722953], 0, 58.0589, 1653988127], "v": "v0.6"}
{"i": [["[\"fused_conv7x7_s2_bn_relu\", 1, 224, 224, 3, 64, 7, 7]", "cuda -keys=cuda,gpu -max_num_threads=1024 -model=unknown -thread_warp_size=32", [-1, 16, 64, 49152, 2147483647, 1024, 8, 32], "", 0, []], [[], [["CI", 7], ["CI", 5], ["SP", 3, 0, 1, [1, 1, 1, 1], 1], ["SP", 3, 5, 112, [2, 2, 7, 1], 1], ["SP", 3, 10, 112, [1, 28, 1, 1], 1], ["SP", 3, 15, 64, [1, 1, 1, 32], 1], ["SP", 3, 20, 3, [1, 1], 1], ["SP", 3, 23, 7, [1, 7], 1], ["SP", 3, 26, 7, [1, 1], 1], ["RE", 3, [0, 5, 10, 15, 1, 6, 11, 16, 2, 7, 12, 17, 20, 23, 26, 21, 24, 27, 3, 8, 13, 18, 22, 25, 28, 4, 9, 14, 19]], ["FSP", 8, 0, 2, 3], ["FSP", 8, 4, 3, 3], ["FSP", 8, 8, 4, 3], ["FSP", 8, 12, 5, 3], ["RE", 8, [0, 4, 8, 12, 1, 5, 9, 13, 2, 6, 10, 14, 3, 7, 11, 15]], ["CA", 3, 8, 11], ["CHR", 2, "shared", [3]], ["CA", 3, 4, 14], ["CHR", 1, "shared", [4]], ["CA", 2, 5, 14], ["CI", 1], ["FU", 10, [0, 1, 2, 3]], ["AN", 10, 0, 5], ["FU", 10, [1, 2, 3, 4]], ["AN", 10, 1, 4], ["FU", 10, [2, 3, 4, 5]], ["AN", 10, 2, 6], ["FU", 4, [0, 1, 2, 3]], ["SP", 4, 0, 224, [1], 1], ["AN", 4, 1, 2], ["FFSP", 4, 0, [5, 4, 3, 2], 1, 1], ["AN", 4, 1, 6], ["FU", 2, [0, 1, 2, 3]], ["SP", 2, 0, 171, [1], 1], ["AN", 2, 1, 2], ["FFSP", 2, 0, [5, 4, 3, 2], 1, 1], ["AN", 2, 1, 6], ["PR", 5, 0, "auto_unroll_max_step$512"]]]], "r": [[0.000467036, 0.000467056, 0.000467057, 0.000467085, 0.000467094, 0.000467085, 0.00046706, 0.000467064, 0.00046708, 0.000467118], 0, 31.6138, 1653988098], "v": "v0.6"}
