python/models/resnext/kernel_configs/resnext_imagenet_50_fused_conv1x1_bn_relu_no_share_input_1_56_56_256_4_64.log
{"i": [["[\"fused_conv1x1_bn_relu_no_share_input\", 1, 56, 56, 256, 4, 64]", "cuda -keys=cuda,gpu -max_num_threads=1024 -model=unknown -thread_warp_size=32", [-1, 16, 64, 49152, 2147483647, 1024, 8, 32], "", 0, []], [[], [["CI", 6], ["CI", 4], ["SP", 2, 0, 1, [1, 1, 1, 1], 1], ["SP", 2, 5, 64, [1, 2, 2, 1], 1], ["SP", 2, 10, 56, [2, 14, 1, 2], 1], ["SP", 2, 15, 56, [1, 1, 1, 1], 1], ["SP", 2, 20, 4, [1, 4, 1, 1], 1], ["SP", 2, 25, 256, [1, 8], 1], ["RE", 2, [0, 5, 10, 15, 20, 1, 6, 11, 16, 21, 2, 7, 12, 17, 22, 25, 26, 3, 8, 13, 18, 23, 27, 4, 9, 14, 19, 24]], ["FSP", 7, 0, 2, 3], ["FSP", 7, 4, 3, 3], ["FSP", 7, 8, 4, 3], ["FSP", 7, 12, 5, 3], ["FSP", 7, 16, 6, 3], ["RE", 7, [0, 4, 8, 12, 16, 1, 5, 9, 13, 17, 2, 6, 10, 14, 18, 3, 7, 11, 15, 19]], ["CA", 2, 7, 14], ["CHR", 1, "shared", [2]], ["CA", 2, 3, 15], ["CHR", 0, "shared", [3]], ["CA", 1, 4, 15], ["FU", 9, [0, 1, 2, 3, 4]], ["AN", 9, 0, 5], ["FU", 9, [1, 2, 3, 4, 5]], ["AN", 9, 1, 4], ["FU", 9, [2, 3, 4, 5, 6]], ["AN", 9, 2, 6], ["FU", 3, [0, 1, 2]], ["SP", 3, 0, 64, [2], 1], ["AN", 3, 1, 2], ["FFSP", 3, 0, [6, 5, 4, 3, 2], 1, 1], ["AN", 3, 1, 6], ["FU", 1, [0, 1, 2, 3, 4]], ["SP", 1, 0, 128, [2], 1], ["AN", 1, 1, 2], ["FFSP", 1, 0, [6, 5, 4, 3, 2], 1, 1], ["AN", 1, 1, 6], ["PR", 4, 0, "auto_unroll_max_step$16"]]]], "r": [[0.000236376, 0.000237055, 0.000237373], 0, 50.0858, 1681223353], "v": "v0.6"}
{"i": [["[\"fused_conv1x1_bn_relu_no_share_input\", 1, 56, 56, 256, 4, 64]", "cuda -keys=cuda,gpu -max_num_threads=1024 -model=unknown -thread_warp_size=32", [-1, 16, 64, 49152, 2147483647, 1024, 8, 32], "", 0, []], [[], [["CI", 6], ["CI", 4], ["SP", 2, 0, 1, [1, 1, 1, 1], 1], ["SP", 2, 5, 64, [2, 4, 2, 1], 1], ["SP", 2, 10, 56, [1, 1, 2, 1], 1], ["SP", 2, 15, 56, [1, 7, 1, 4], 1], ["SP", 2, 20, 4, [1, 1, 1, 4], 1], ["SP", 2, 25, 256, [4, 1], 1], ["RE", 2, [0, 5, 10, 15, 20, 1, 6, 11, 16, 21, 2, 7, 12, 17, 22, 25, 26, 3, 8, 13, 18, 23, 27, 4, 9, 14, 19, 24]], ["FSP", 7, 0, 2, 3], ["FSP", 7, 4, 3, 3], ["FSP", 7, 8, 4, 3], ["FSP", 7, 12, 5, 3], ["FSP", 7, 16, 6, 3], ["RE", 7, [0, 4, 8, 12, 16, 1, 5, 9, 13, 17, 2, 6, 10, 14, 18, 3, 7, 11, 15, 19]], ["CA", 2, 7, 14], ["CHR", 1, "shared", [2]], ["CA", 2, 3, 15], ["CHR", 0, "shared", [3]], ["CA", 1, 4, 15], ["FU", 9, [0, 1, 2, 3, 4]], ["AN", 9, 0, 5], ["FU", 9, [1, 2, 3, 4, 5]], ["AN", 9, 1, 4], ["FU", 9, [2, 3, 4, 5, 6]], ["AN", 9, 2, 6], ["FU", 3, [0, 1, 2]], ["SP", 3, 0, 64, [1], 1], ["AN", 3, 1, 2], ["FFSP", 3, 0, [6, 5, 4, 3, 2], 1, 1], ["AN", 3, 1, 6], ["FU", 1, [0, 1, 2, 3, 4]], ["SP", 1, 0, 64, [1], 1], ["AN", 1, 1, 2], ["FFSP", 1, 0, [6, 5, 4, 3, 2], 1, 1], ["AN", 1, 1, 6], ["PR", 4, 0, "auto_unroll_max_step$1024"]]]], "r": [[0.00120993, 0.00121429, 0.00121098], 0, 15.3355, 1681223316], "v": "v0.6"}
{"i": [["[\"fused_conv1x1_bn_relu_no_share_input\", 1, 56, 56, 256, 4, 64]", "cuda -keys=cuda,gpu -max_num_threads=1024 -model=unknown -thread_warp_size=32", [-1, 16, 64, 49152, 2147483647, 1024, 8, 32], "", 0, []], [[], [["CI", 6], ["CI", 4], ["SP", 2, 0, 1, [1, 1, 1, 1], 1], ["SP", 2, 5, 64, [1, 8, 2, 1], 1], ["SP", 2, 10, 56, [2, 2, 7, 2], 1], ["SP", 2, 15, 56, [1, 2, 1, 1], 1], ["SP", 2, 20, 4, [1, 2, 1, 1], 1], ["SP", 2, 25, 256, [4, 1], 1], ["RE", 2, [0, 5, 10, 15, 20, 1, 6, 11, 16, 21, 2, 7, 12, 17, 22, 25, 26, 3, 8, 13, 18, 23, 27, 4, 9, 14, 19, 24]], ["FSP", 7, 0, 2, 3], ["FSP", 7, 4, 3, 3], ["FSP", 7, 8, 4, 3], ["FSP", 7, 12, 5, 3], ["FSP", 7, 16, 6, 3], ["RE", 7, [0, 4, 8, 12, 16, 1, 5, 9, 13, 17, 2, 6, 10, 14, 18, 3, 7, 11, 15, 19]], ["CA", 2, 7, 14], ["CHR", 1, "shared", [2]], ["CA", 2, 3, 15], ["CHR", 0, "shared", [3]], ["CA", 1, 4, 15], ["FU", 9, [0, 1, 2, 3, 4]], ["AN", 9, 0, 5], ["FU", 9, [1, 2, 3, 4, 5]], ["AN", 9, 1, 4], ["FU", 9, [2, 3, 4, 5, 6]], ["AN", 9, 2, 6], ["FU", 3, [0, 1, 2]], ["SP", 3, 0, 8, [1], 1], ["AN", 3, 1, 2], ["FFSP", 3, 0, [6, 5, 4, 3, 2], 1, 1], ["AN", 3, 1, 6], ["FU", 1, [0, 1, 2, 3, 4]], ["SP", 1, 0, 56, [1], 1], ["AN", 1, 1, 2], ["FFSP", 1, 0, [6, 5, 4, 3, 2], 1, 1], ["AN", 1, 1, 6], ["PR", 4, 0, "auto_unroll_max_step$16"]]]], "r": [[0.00106118, 0.0010641, 0.00106473], 0, 24.2816, 1681223327], "v": "v0.6"}
{"i": [["[\"fused_conv1x1_bn_relu_no_share_input\", 1, 56, 56, 256, 4, 64]", "cuda -keys=cuda,gpu -max_num_threads=1024 -model=unknown -thread_warp_size=32", [-1, 16, 64, 49152, 2147483647, 1024, 8, 32], "", 0, []], [[], [["CI", 6], ["CI", 4], ["SP", 2, 0, 1, [1, 1, 1, 1], 1], ["SP", 2, 5, 64, [1, 8, 2, 4], 1], ["SP", 2, 10, 56, [1, 1, 1, 4], 1], ["SP", 2, 15, 56, [1, 7, 1, 1], 1], ["SP", 2, 20, 4, [2, 2, 1, 1], 1], ["SP", 2, 25, 256, [1, 2], 1], ["RE", 2, [0, 5, 10, 15, 20, 1, 6, 11, 16, 21, 2, 7, 12, 17, 22, 25, 26, 3, 8, 13, 18, 23, 27, 4, 9, 14, 19, 24]], ["FSP", 7, 0, 2, 3], ["FSP", 7, 4, 3, 3], ["FSP", 7, 8, 4, 3], ["FSP", 7, 12, 5, 3], ["FSP", 7, 16, 6, 3], ["RE", 7, [0, 4, 8, 12, 16, 1, 5, 9, 13, 17, 2, 6, 10, 14, 18, 3, 7, 11, 15, 19]], ["CA", 2, 7, 14], ["CHR", 1, "shared", [2]], ["CA", 2, 3, 15], ["CHR", 0, "shared", [3]], ["CA", 1, 4, 15], ["FU", 9, [0, 1, 2, 3, 4]], ["AN", 9, 0, 5], ["FU", 9, [1, 2, 3, 4, 5]], ["AN", 9, 1, 4], ["FU", 9, [2, 3, 4, 5, 6]], ["AN", 9, 2, 6], ["FU", 3, [0, 1, 2]], ["SP", 3, 0, 16, [1], 1], ["AN", 3, 1, 2], ["FFSP", 3, 0, [6, 5, 4, 3, 2], 1, 1], ["AN", 3, 1, 6], ["FU", 1, [0, 1, 2, 3, 4]], ["SP", 1, 0, 128, [1], 1], ["AN", 1, 1, 2], ["FFSP", 1, 0, [6, 5, 4, 3, 2], 1, 1], ["AN", 1, 1, 6], ["PR", 4, 0, "auto_unroll_max_step$1024"]]]], "r": [[0.000762261, 0.000761397, 0.000762327], 0, 39.4921, 1681223341], "v": "v0.6"}
{"i": [["[\"fused_conv1x1_bn_relu_no_share_input\", 1, 56, 56, 256, 4, 64]", "cuda -keys=cuda,gpu -max_num_threads=1024 -model=unknown -thread_warp_size=32", [-1, 16, 64, 49152, 2147483647, 1024, 8, 32], "", 0, []], [[], [["CI", 6], ["CI", 4], ["SP", 2, 0, 1, [1, 1, 1, 1], 1], ["SP", 2, 5, 64, [1, 4, 2, 2], 1], ["SP", 2, 10, 56, [1, 2, 1, 1], 1], ["SP", 2, 15, 56, [1, 7, 1, 4], 1], ["SP", 2, 20, 4, [1, 1, 1, 4], 1], ["SP", 2, 25, 256, [4, 1], 1], ["RE", 2, [0, 5, 10, 15, 20, 1, 6, 11, 16, 21, 2, 7, 12, 17, 22, 25, 26, 3, 8, 13, 18, 23, 27, 4, 9, 14, 19, 24]], ["FSP", 7, 0, 2, 3], ["FSP", 7, 4, 3, 3], ["FSP", 7, 8, 4, 3], ["FSP", 7, 12, 5, 3], ["FSP", 7, 16, 6, 3], ["RE", 7, [0, 4, 8, 12, 16, 1, 5, 9, 13, 17, 2, 6, 10, 14, 18, 3, 7, 11, 15, 19]], ["CA", 2, 7, 14], ["CHR", 1, "shared", [2]], ["CA", 2, 3, 15], ["CHR", 0, "shared", [3]], ["CA", 1, 4, 15], ["FU", 9, [0, 1, 2, 3, 4]], ["AN", 9, 0, 5], ["FU", 9, [1, 2, 3, 4, 5]], ["AN", 9, 1, 4], ["FU", 9, [2, 3, 4, 5, 6]], ["AN", 9, 2, 6], ["FU", 3, [0, 1, 2]], ["SP", 3, 0, 64, [1], 1], ["AN", 3, 1, 2], ["FFSP", 3, 0, [6, 5, 4, 3, 2], 1, 1], ["AN", 3, 1, 6], ["FU", 1, [0, 1, 2, 3, 4]], ["SP", 1, 0, 64, [1], 1], ["AN", 1, 1, 2], ["FFSP", 1, 0, [6, 5, 4, 3, 2], 1, 1], ["AN", 1, 1, 6], ["PR", 4, 0, "auto_unroll_max_step$512"]]]], "r": [[0.000406674, 0.000406595, 0.000406903], 0, 28.8515, 1681223330], "v": "v0.6"}
{"i": [["[\"fused_conv1x1_bn_relu_no_share_input\", 1, 56, 56, 256, 4, 64]", "cuda -keys=cuda,gpu -max_num_threads=1024 -model=unknown -thread_warp_size=32", [-1, 16, 64, 49152, 2147483647, 1024, 8, 32], "", 0, []], [[], [["CI", 6], ["CI", 4], ["SP", 2, 0, 1, [1, 1, 1, 1], 1], ["SP", 2, 5, 64, [1, 1, 4, 2], 1], ["SP", 2, 10, 56, [1, 4, 1, 2], 1], ["SP", 2, 15, 56, [1, 1, 1, 1], 1], ["SP", 2, 20, 4, [1, 1, 1, 1], 1], ["SP", 2, 25, 256, [1, 16], 1], ["RE", 2, [0, 5, 10, 15, 20, 1, 6, 11, 16, 21, 2, 7, 12, 17, 22, 25, 26, 3, 8, 13, 18, 23, 27, 4, 9, 14, 19, 24]], ["FSP", 7, 0, 2, 3], ["FSP", 7, 4, 3, 3], ["FSP", 7, 8, 4, 3], ["FSP", 7, 12, 5, 3], ["FSP", 7, 16, 6, 3], ["RE", 7, [0, 4, 8, 12, 16, 1, 5, 9, 13, 17, 2, 6, 10, 14, 18, 3, 7, 11, 15, 19]], ["CA", 2, 7, 14], ["CHR", 1, "shared", [2]], ["CA", 2, 3, 15], ["CHR", 0, "shared", [3]], ["CA", 1, 4, 15], ["FU", 9, [0, 1, 2, 3, 4]], ["AN", 9, 0, 5], ["FU", 9, [1, 2, 3, 4, 5]], ["AN", 9, 1, 4], ["FU", 9, [2, 3, 4, 5, 6]], ["AN", 9, 2, 6], ["FU", 3, [0, 1, 2]], ["SP", 3, 0, 128, [4], 1], ["AN", 3, 1, 2], ["FFSP", 3, 0, [6, 5, 4, 3, 2], 1, 1], ["AN", 3, 1, 6], ["FU", 1, [0, 1, 2, 3, 4]], ["SP", 1, 0, 256, [1], 1], ["AN", 1, 1, 2], ["FFSP", 1, 0, [6, 5, 4, 3, 2], 1, 1], ["AN", 1, 1, 6], ["PR", 4, 0, "auto_unroll_max_step$64"]]]], "r": [[0.00151213, 0.0015122, 0.00151127], 0, 20.8794, 1681223323], "v": "v0.6"}
{"i": [["[\"fused_conv1x1_bn_relu_no_share_input\", 1, 56, 56, 256, 4, 64]", "cuda -keys=cuda,gpu -max_num_threads=1024 -model=unknown -thread_warp_size=32", [-1, 16, 64, 49152, 2147483647, 1024, 8, 32], "", 0, []], [[], [["CI", 6], ["CI", 4], ["SP", 2, 0, 1, [1, 1, 1, 1], 1], ["SP", 2, 5, 64, [1, 2, 4, 1], 1], ["SP", 2, 10, 56, [1, 4, 1, 2], 1], ["SP", 2, 15, 56, [1, 1, 7, 1], 1], ["SP", 2, 20, 4, [1, 4, 1, 1], 1], ["SP", 2, 25, 256, [1, 16], 1], ["RE", 2, [0, 5, 10, 15, 20, 1, 6, 11, 16, 21, 2, 7, 12, 17, 22, 25, 26, 3, 8, 13, 18, 23, 27, 4, 9, 14, 19, 24]], ["FSP", 7, 0, 2, 3], ["FSP", 7, 4, 3, 3], ["FSP", 7, 8, 4, 3], ["FSP", 7, 12, 5, 3], ["FSP", 7, 16, 6, 3], ["RE", 7, [0, 4, 8, 12, 16, 1, 5, 9, 13, 17, 2, 6, 10, 14, 18, 3, 7, 11, 15, 19]], ["CA", 2, 7, 14], ["CHR", 1, "shared", [2]], ["CA", 2, 3, 15], ["CHR", 0, "shared", [3]], ["CA", 1, 4, 15], ["FU", 9, [0, 1, 2, 3, 4]], ["AN", 9, 0, 5], ["FU", 9, [1, 2, 3, 4, 5]], ["AN", 9, 1, 4], ["FU", 9, [2, 3, 4, 5, 6]], ["AN", 9, 2, 6], ["FU", 3, [0, 1, 2]], ["SP", 3, 0, 128, [2], 1], ["AN", 3, 1, 2], ["FFSP", 3, 0, [6, 5, 4, 3, 2], 1, 1], ["AN", 3, 1, 6], ["FU", 1, [0, 1, 2, 3, 4]], ["SP", 1, 0, 256, [1], 1], ["AN", 1, 1, 2], ["FFSP", 1, 0, [6, 5, 4, 3, 2], 1, 1], ["AN", 1, 1, 6], ["PR", 4, 0, "auto_unroll_max_step$64"]]]], "r": [[0.000782409, 0.000782886, 0.000782471], 0, 32.0419, 1681223334], "v": "v0.6"}
{"i": [["[\"fused_conv1x1_bn_relu_no_share_input\", 1, 56, 56, 256, 4, 64]", "cuda -keys=cuda,gpu -max_num_threads=1024 -model=unknown -thread_warp_size=32", [-1, 16, 64, 49152, 2147483647, 1024, 8, 32], "", 0, []], [[], [["CI", 6], ["CI", 4], ["SP", 2, 0, 1, [1, 1, 1, 1], 1], ["SP", 2, 5, 64, [1, 1, 4, 2], 1], ["SP", 2, 10, 56, [1, 8, 1, 1], 1], ["SP", 2, 15, 56, [1, 7, 1, 1], 1], ["SP", 2, 20, 4, [1, 2, 1, 1], 1], ["SP", 2, 25, 256, [1, 16], 1], ["RE", 2, [0, 5, 10, 15, 20, 1, 6, 11, 16, 21, 2, 7, 12, 17, 22, 25, 26, 3, 8, 13, 18, 23, 27, 4, 9, 14, 19, 24]], ["FSP", 7, 0, 2, 3], ["FSP", 7, 4, 3, 3], ["FSP", 7, 8, 4, 3], ["FSP", 7, 12, 5, 3], ["FSP", 7, 16, 6, 3], ["RE", 7, [0, 4, 8, 12, 16, 1, 5, 9, 13, 17, 2, 6, 10, 14, 18, 3, 7, 11, 15, 19]], ["CA", 2, 7, 14], ["CHR", 1, "shared", [2]], ["CA", 2, 3, 15], ["CHR", 0, "shared", [3]], ["CA", 1, 4, 15], ["FU", 9, [0, 1, 2, 3, 4]], ["AN", 9, 0, 5], ["FU", 9, [1, 2, 3, 4, 5]], ["AN", 9, 1, 4], ["FU", 9, [2, 3, 4, 5, 6]], ["AN", 9, 2, 6], ["FU", 3, [0, 1, 2]], ["SP", 3, 0, 128, [1], 1], ["AN", 3, 1, 2], ["FFSP", 3, 0, [6, 5, 4, 3, 2], 1, 1], ["AN", 3, 1, 6], ["FU", 1, [0, 1, 2, 3, 4]], ["SP", 1, 0, 256, [1], 1], ["AN", 1, 1, 2], ["FFSP", 1, 0, [6, 5, 4, 3, 2], 1, 1], ["AN", 1, 1, 6], ["PR", 4, 0, "auto_unroll_max_step$64"]]]], "r": [[0.00038449, 0.000384727, 0.000383502], 0, 9.67634, 1681223312], "v": "v0.6"}
{"i": [["[\"fused_conv1x1_bn_relu_no_share_input\", 1, 56, 56, 256, 4, 64]", "cuda -keys=cuda,gpu -max_num_threads=1024 -model=unknown -thread_warp_size=32", [-1, 16, 64, 49152, 2147483647, 1024, 8, 32], "", 0, []], [[], [["CI", 6], ["CI", 4], ["SP", 2, 0, 1, [1, 1, 1, 1], 1], ["SP", 2, 5, 64, [1, 4, 1, 1], 1], ["SP", 2, 10, 56, [1, 7, 8, 1], 1], ["SP", 2, 15, 56, [1, 2, 7, 1], 1], ["SP", 2, 20, 4, [1, 1, 1, 2], 1], ["SP", 2, 25, 256, [1, 2], 1], ["RE", 2, [0, 5, 10, 15, 20, 1, 6, 11, 16, 21, 2, 7, 12, 17, 22, 25, 26, 3, 8, 13, 18, 23, 27, 4, 9, 14, 19, 24]], ["FSP", 7, 0, 2, 3], ["FSP", 7, 4, 3, 3], ["FSP", 7, 8, 4, 3], ["FSP", 7, 12, 5, 3], ["FSP", 7, 16, 6, 3], ["RE", 7, [0, 4, 8, 12, 16, 1, 5, 9, 13, 17, 2, 6, 10, 14, 18, 3, 7, 11, 15, 19]], ["CA", 2, 7, 14], ["CHR", 1, "shared", [2]], ["CA", 2, 3, 15], ["CHR", 0, "shared", [3]], ["CA", 1, 4, 15], ["FU", 9, [0, 1, 2, 3, 4]], ["AN", 9, 0, 5], ["FU", 9, [1, 2, 3, 4, 5]], ["AN", 9, 1, 4], ["FU", 9, [2, 3, 4, 5, 6]], ["AN", 9, 2, 6], ["FU", 3, [0, 1, 2]], ["SP", 3, 0, 4, [1], 1], ["AN", 3, 1, 2], ["FFSP", 3, 0, [6, 5, 4, 3, 2], 1, 1], ["AN", 3, 1, 6], ["FU", 1, [0, 1, 2, 3, 4]], ["SP", 1, 0, 14, [1], 1], ["AN", 1, 1, 2], ["FFSP", 1, 0, [6, 5, 4, 3, 2], 1, 1], ["AN", 1, 1, 6], ["PR", 4, 0, "auto_unroll_max_step$1024"]]]], "r": [[0.00201405, 0.00201188, 0.00201392], 0, 36.2081, 1681223338], "v": "v0.6"}
{"i": [["[\"fused_conv1x1_bn_relu_no_share_input\", 1, 56, 56, 256, 4, 64]", "cuda -keys=cuda,gpu -max_num_threads=1024 -model=unknown -thread_warp_size=32", [-1, 16, 64, 49152, 2147483647, 1024, 8, 32], "", 0, []], [[], [["CI", 6], ["CI", 4], ["SP", 2, 0, 1, [1, 1, 1, 1], 1], ["SP", 2, 5, 64, [1, 4, 1, 1], 1], ["SP", 2, 10, 56, [1, 7, 1, 1], 1], ["SP", 2, 15, 56, [1, 2, 7, 1], 1], ["SP", 2, 20, 4, [1, 1, 1, 2], 1], ["SP", 2, 25, 256, [1, 4], 1], ["RE", 2, [0, 5, 10, 15, 20, 1, 6, 11, 16, 21, 2, 7, 12, 17, 22, 25, 26, 3, 8, 13, 18, 23, 27, 4, 9, 14, 19, 24]], ["FSP", 7, 0, 2, 3], ["FSP", 7, 4, 3, 3], ["FSP", 7, 8, 4, 3], ["FSP", 7, 12, 5, 3], ["FSP", 7, 16, 6, 3], ["RE", 7, [0, 4, 8, 12, 16, 1, 5, 9, 13, 17, 2, 6, 10, 14, 18, 3, 7, 11, 15, 19]], ["CA", 2, 7, 14], ["CHR", 1, "shared", [2]], ["CA", 2, 3, 15], ["CHR", 0, "shared", [3]], ["CA", 1, 4, 15], ["FU", 9, [0, 1, 2, 3, 4]], ["AN", 9, 0, 5], ["FU", 9, [1, 2, 3, 4, 5]], ["AN", 9, 1, 4], ["FU", 9, [2, 3, 4, 5, 6]], ["AN", 9, 2, 6], ["FU", 3, [0, 1, 2]], ["SP", 3, 0, 4, [1], 1], ["AN", 3, 1, 2], ["FFSP", 3, 0, [6, 5, 4, 3, 2], 1, 1], ["AN", 3, 1, 6], ["FU", 1, [0, 1, 2, 3, 4]], ["SP", 1, 0, 14, [1], 1], ["AN", 1, 1, 2], ["FFSP", 1, 0, [6, 5, 4, 3, 2], 1, 1], ["AN", 1, 1, 6], ["PR", 4, 0, "auto_unroll_max_step$1024"]]]], "r": [[0.000435071, 0.000434623, 0.000433963], 0, 17.0703, 1681223319], "v": "v0.6"}
{"i": [["[\"fused_conv1x1_bn_relu_no_share_input\", 1, 56, 56, 256, 4, 64]", "cuda -keys=cuda,gpu -max_num_threads=1024 -model=unknown -thread_warp_size=32", [-1, 16, 64, 49152, 2147483647, 1024, 8, 32], "", 0, []], [[], [["CI", 6], ["CI", 4], ["SP", 2, 0, 1, [1, 1, 1, 1], 1], ["SP", 2, 5, 64, [1, 1, 2, 8], 1], ["SP", 2, 10, 56, [1, 2, 2, 1], 1], ["SP", 2, 15, 56, [4, 14, 1, 1], 1], ["SP", 2, 20, 4, [2, 1, 1, 1], 1], ["SP", 2, 25, 256, [2, 1], 1], ["RE", 2, [0, 5, 10, 15, 20, 1, 6, 11, 16, 21, 2, 7, 12, 17, 22, 25, 26, 3, 8, 13, 18, 23, 27, 4, 9, 14, 19, 24]], ["FSP", 7, 0, 2, 3], ["FSP", 7, 4, 3, 3], ["FSP", 7, 8, 4, 3], ["FSP", 7, 12, 5, 3], ["FSP", 7, 16, 6, 3], ["RE", 7, [0, 4, 8, 12, 16, 1, 5, 9, 13, 17, 2, 6, 10, 14, 18, 3, 7, 11, 15, 19]], ["CA", 2, 7, 14], ["CHR", 1, "shared", [2]], ["CA", 2, 3, 15], ["CHR", 0, "shared", [3]], ["CA", 1, 4, 15], ["FU", 9, [0, 1, 2, 3, 4]], ["AN", 9, 0, 5], ["FU", 9, [1, 2, 3, 4, 5]], ["AN", 9, 1, 4], ["FU", 9, [2, 3, 4, 5, 6]], ["AN", 9, 2, 6], ["FU", 3, [0, 1, 2]], ["SP", 3, 0, 32, [1], 1], ["AN", 3, 1, 2], ["FFSP", 3, 0, [6, 5, 4, 3, 2], 1, 1], ["AN", 3, 1, 6], ["FU", 1, [0, 1, 2, 3, 4]], ["SP", 1, 0, 64, [1], 1], ["AN", 1, 1, 2], ["FFSP", 1, 0, [6, 5, 4, 3, 2], 1, 1], ["AN", 1, 1, 6], ["PR", 4, 0, "auto_unroll_max_step$1024"]]]], "r": [[0.00481235, 0.00480663, 0.00480739], 0, 8.52257, 1681223308], "v": "v0.6"}
{"i": [["[\"fused_conv1x1_bn_relu_no_share_input\", 1, 56, 56, 256, 4, 64]", "cuda -keys=cuda,gpu -max_num_threads=1024 -model=unknown -thread_warp_size=32", [-1, 16, 64, 49152, 2147483647, 1024, 8, 32], "", 0, []], [[], [["CI", 6], ["CI", 4], ["SP", 2, 0, 1, [1, 1, 1, 1], 1], ["SP", 2, 5, 64, [1, 32, 1, 2], 1], ["SP", 2, 10, 56, [1, 1, 7, 1], 1], ["SP", 2, 15, 56, [1, 4, 1, 1], 1], ["SP", 2, 20, 4, [1, 1, 1, 4], 1], ["SP", 2, 25, 256, [1, 4], 1], ["RE", 2, [0, 5, 10, 15, 20, 1, 6, 11, 16, 21, 2, 7, 12, 17, 22, 25, 26, 3, 8, 13, 18, 23, 27, 4, 9, 14, 19, 24]], ["FSP", 7, 0, 2, 3], ["FSP", 7, 4, 3, 3], ["FSP", 7, 8, 4, 3], ["FSP", 7, 12, 5, 3], ["FSP", 7, 16, 6, 3], ["RE", 7, [0, 4, 8, 12, 16, 1, 5, 9, 13, 17, 2, 6, 10, 14, 18, 3, 7, 11, 15, 19]], ["CA", 2, 7, 14], ["CHR", 1, "shared", [2]], ["CA", 2, 3, 15], ["CHR", 0, "shared", [3]], ["CA", 1, 4, 15], ["FU", 9, [0, 1, 2, 3, 4]], ["AN", 9, 0, 5], ["FU", 9, [1, 2, 3, 4, 5]], ["AN", 9, 1, 4], ["FU", 9, [2, 3, 4, 5, 6]], ["AN", 9, 2, 6], ["FU", 3, [0, 1, 2]], ["SP", 3, 0, 8, [4], 1], ["AN", 3, 1, 2], ["FFSP", 3, 0, [6, 5, 4, 3, 2], 1, 1], ["AN", 3, 1, 6], ["FU", 1, [0, 1, 2, 3, 4]], ["SP", 1, 0, 56, [1], 1], ["AN", 1, 1, 2], ["FFSP", 1, 0, [6, 5, 4, 3, 2], 1, 1], ["AN", 1, 1, 6], ["PR", 4, 0, "auto_unroll_max_step$512"]]]], "r": [[0.000441075, 0.000441662, 0.000441966], 0, 43.1761, 1681223345], "v": "v0.6"}
{"i": [["[\"fused_conv1x1_bn_relu_no_share_input\", 1, 56, 56, 256, 4, 64]", "cuda -keys=cuda,gpu -max_num_threads=1024 -model=unknown -thread_warp_size=32", [-1, 16, 64, 49152, 2147483647, 1024, 8, 32], "", 0, []], [[], [["CI", 6], ["CI", 4], ["SP", 2, 0, 1, [1, 1, 1, 1], 1], ["SP", 2, 5, 64, [8, 2, 2, 1], 1], ["SP", 2, 10, 56, [1, 4, 1, 1], 1], ["SP", 2, 15, 56, [1, 2, 1, 7], 1], ["SP", 2, 20, 4, [1, 2, 1, 1], 1], ["SP", 2, 25, 256, [2, 1], 1], ["RE", 2, [0, 5, 10, 15, 20, 1, 6, 11, 16, 21, 2, 7, 12, 17, 22, 25, 26, 3, 8, 13, 18, 23, 27, 4, 9, 14, 19, 24]], ["FSP", 7, 0, 2, 3], ["FSP", 7, 4, 3, 3], ["FSP", 7, 8, 4, 3], ["FSP", 7, 12, 5, 3], ["FSP", 7, 16, 6, 3], ["RE", 7, [0, 4, 8, 12, 16, 1, 5, 9, 13, 17, 2, 6, 10, 14, 18, 3, 7, 11, 15, 19]], ["CA", 2, 7, 14], ["CHR", 1, "shared", [2]], ["CA", 2, 3, 15], ["CHR", 0, "shared", [3]], ["CA", 1, 4, 15], ["FU", 9, [0, 1, 2, 3, 4]], ["AN", 9, 0, 5], ["FU", 9, [1, 2, 3, 4, 5]], ["AN", 9, 1, 4], ["FU", 9, [2, 3, 4, 5, 6]], ["AN", 9, 2, 6], ["FU", 3, [0, 1, 2]], ["SP", 3, 0, 4, [4], 1], ["AN", 3, 1, 2], ["FFSP", 3, 0, [6, 5, 4, 3, 2], 1, 1], ["AN", 3, 1, 6], ["FU", 1, [0, 1, 2, 3, 4]], ["SP", 1, 0, 56, [1], 1], ["AN", 1, 1, 2], ["FFSP", 1, 0, [6, 5, 4, 3, 2], 1, 1], ["AN", 1, 1, 6], ["PR", 4, 0, "auto_unroll_max_step$512"]]]], "r": [[0.00125112, 0.00124762, 0.00124978], 0, 47.9923, 1681223349], "v": "v0.6"}
{"i": [["[\"fused_conv1x1_bn_relu_no_share_input\", 1, 56, 56, 256, 4, 64]", "cuda -keys=cuda,gpu -max_num_threads=1024 -model=unknown -thread_warp_size=32", [-1, 16, 64, 49152, 2147483647, 1024, 8, 32], "", 0, []], [[], [["CI", 6], ["CI", 4], ["SP", 2, 0, 1, [1, 1, 1, 1], 1], ["SP", 2, 5, 64, [1, 2, 2, 4], 1], ["SP", 2, 10, 56, [1, 1, 1, 1], 1], ["SP", 2, 15, 56, [1, 56, 1, 1], 1], ["SP", 2, 20, 4, [1, 2, 2, 1], 1], ["SP", 2, 25, 256, [1, 1], 1], ["RE", 2, [0, 5, 10, 15, 20, 1, 6, 11, 16, 21, 2, 7, 12, 17, 22, 25, 26, 3, 8, 13, 18, 23, 27, 4, 9, 14, 19, 24]], ["FSP", 7, 0, 2, 3], ["FSP", 7, 4, 3, 3], ["FSP", 7, 8, 4, 3], ["FSP", 7, 12, 5, 3], ["FSP", 7, 16, 6, 3], ["RE", 7, [0, 4, 8, 12, 16, 1, 5, 9, 13, 17, 2, 6, 10, 14, 18, 3, 7, 11, 15, 19]], ["CA", 2, 7, 14], ["CHR", 1, "shared", [2]], ["CA", 2, 3, 15], ["CHR", 0, "shared", [3]], ["CA", 1, 4, 15], ["FU", 9, [0, 1, 2, 3, 4]], ["AN", 9, 0, 5], ["FU", 9, [1, 2, 3, 4, 5]], ["AN", 9, 1, 4], ["FU", 9, [2, 3, 4, 5, 6]], ["AN", 9, 2, 6], ["FU", 3, [0, 1, 2]], ["SP", 3, 0, 8, [2], 1], ["AN", 3, 1, 2], ["FFSP", 3, 0, [6, 5, 4, 3, 2], 1, 1], ["AN", 3, 1, 6], ["FU", 1, [0, 1, 2, 3, 4]], ["SP", 1, 0, 16, [1], 1], ["AN", 1, 1, 2], ["FFSP", 1, 0, [6, 5, 4, 3, 2], 1, 1], ["AN", 1, 1, 6], ["PR", 4, 0, "auto_unroll_max_step$16"]]]], "r": [[0.000917737, 0.000915697, 0.000914777], 0, 53.4756, 1681223356], "v": "v0.6"}
{"i": [["[\"fused_conv1x1_bn_relu_no_share_input\", 1, 56, 56, 256, 4, 64]", "cuda -keys=cuda,gpu -max_num_threads=1024 -model=unknown -thread_warp_size=32", [-1, 16, 64, 49152, 2147483647, 1024, 8, 32], "", 0, []], [[], [["CI", 6], ["CI", 4], ["SP", 2, 0, 1, [1, 1, 1, 1], 1], ["SP", 2, 5, 64, [1, 16, 1, 4], 1], ["SP", 2, 10, 56, [1, 1, 8, 1], 1], ["SP", 2, 15, 56, [1, 7, 1, 1], 1], ["SP", 2, 20, 4, [1, 2, 1, 1], 1], ["SP", 2, 25, 256, [1, 2], 1], ["RE", 2, [0, 5, 10, 15, 20, 1, 6, 11, 16, 21, 2, 7, 12, 17, 22, 25, 26, 3, 8, 13, 18, 23, 27, 4, 9, 14, 19, 24]], ["FSP", 7, 0, 2, 3], ["FSP", 7, 4, 3, 3], ["FSP", 7, 8, 4, 3], ["FSP", 7, 12, 5, 3], ["FSP", 7, 16, 6, 3], ["RE", 7, [0, 4, 8, 12, 16, 1, 5, 9, 13, 17, 2, 6, 10, 14, 18, 3, 7, 11, 15, 19]], ["CA", 2, 7, 14], ["CHR", 1, "shared", [2]], ["CA", 2, 3, 15], ["CHR", 0, "shared", [3]], ["CA", 1, 4, 15], ["FU", 9, [0, 1, 2, 3, 4]], ["AN", 9, 0, 5], ["FU", 9, [1, 2, 3, 4, 5]], ["AN", 9, 1, 4], ["FU", 9, [2, 3, 4, 5, 6]], ["AN", 9, 2, 6], ["FU", 3, [0, 1, 2]], ["SP", 3, 0, 16, [1], 1], ["AN", 3, 1, 2], ["FFSP", 3, 0, [6, 5, 4, 3, 2], 1, 1], ["AN", 3, 1, 6], ["FU", 1, [0, 1, 2, 3, 4]], ["SP", 1, 0, 128, [1], 1], ["AN", 1, 1, 2], ["FFSP", 1, 0, [6, 5, 4, 3, 2], 1, 1], ["AN", 1, 1, 6], ["PR", 4, 0, "auto_unroll_max_step$1024"]]]], "r": [[0.00147763, 0.00147585, 0.00148151], 0, 61.1878, 1681223363], "v": "v0.6"}
{"i": [["[\"fused_conv1x1_bn_relu_no_share_input\", 1, 56, 56, 256, 4, 64]", "cuda -keys=cuda,gpu -max_num_threads=1024 -model=unknown -thread_warp_size=32", [-1, 16, 64, 49152, 2147483647, 1024, 8, 32], "", 0, []], [[], [["CI", 6], ["CI", 4], ["SP", 2, 0, 1, [1, 1, 1, 1], 1], ["SP", 2, 5, 64, [1, 4, 2, 1], 1], ["SP", 2, 10, 56, [1, 14, 1, 2], 1], ["SP", 2, 15, 56, [1, 1, 2, 1], 1], ["SP", 2, 20, 4, [1, 1, 1, 4], 1], ["SP", 2, 25, 256, [4, 4], 1], ["RE", 2, [0, 5, 10, 15, 20, 1, 6, 11, 16, 21, 2, 7, 12, 17, 22, 25, 26, 3, 8, 13, 18, 23, 27, 4, 9, 14, 19, 24]], ["FSP", 7, 0, 2, 3], ["FSP", 7, 4, 3, 3], ["FSP", 7, 8, 4, 3], ["FSP", 7, 12, 5, 3], ["FSP", 7, 16, 6, 3], ["RE", 7, [0, 4, 8, 12, 16, 1, 5, 9, 13, 17, 2, 6, 10, 14, 18, 3, 7, 11, 15, 19]], ["CA", 2, 7, 14], ["CHR", 1, "shared", [2]], ["CA", 2, 3, 15], ["CHR", 0, "shared", [3]], ["CA", 1, 4, 15], ["FU", 9, [0, 1, 2, 3, 4]], ["AN", 9, 0, 5], ["FU", 9, [1, 2, 3, 4, 5]], ["AN", 9, 1, 4], ["FU", 9, [2, 3, 4, 5, 6]], ["AN", 9, 2, 6], ["FU", 3, [0, 1, 2]], ["SP", 3, 0, 128, [2], 1], ["AN", 3, 1, 2], ["FFSP", 3, 0, [6, 5, 4, 3, 2], 1, 1], ["AN", 3, 1, 6], ["FU", 1, [0, 1, 2, 3, 4]], ["SP", 1, 0, 128, [1], 1], ["AN", 1, 1, 2], ["FFSP", 1, 0, [6, 5, 4, 3, 2], 1, 1], ["AN", 1, 1, 6], ["PR", 4, 0, "auto_unroll_max_step$64"]]]], "r": [[0.000473185, 0.000473752, 0.000473045], 0, 57.4225, 1681223360], "v": "v0.6"}
{"i": [["[\"fused_conv1x1_bn_relu_no_share_input\", 1, 56, 56, 256, 4, 64]", "cuda -keys=cuda,gpu -max_num_threads=1024 -model=unknown -thread_warp_size=32", [-1, 16, 64, 49152, 2147483647, 1024, 8, 32], "", 0, []], [[], [["CI", 6], ["CI", 4], ["SP", 2, 0, 1, [1, 1, 1, 1], 1], ["SP", 2, 5, 64, [2, 8, 1, 1], 1], ["SP", 2, 10, 56, [1, 1, 2, 1], 1], ["SP", 2, 15, 56, [1, 2, 1, 1], 1], ["SP", 2, 20, 4, [2, 2, 1, 1], 1], ["SP", 2, 25, 256, [2, 4], 1], ["RE", 2, [0, 5, 10, 15, 20, 1, 6, 11, 16, 21, 2, 7, 12, 17, 22, 25, 26, 3, 8, 13, 18, 23, 27, 4, 9, 14, 19, 24]], ["FSP", 7, 0, 2, 3], ["FSP", 7, 4, 3, 3], ["FSP", 7, 8, 4, 3], ["FSP", 7, 12, 5, 3], ["FSP", 7, 16, 6, 3], ["RE", 7, [0, 4, 8, 12, 16, 1, 5, 9, 13, 17, 2, 6, 10, 14, 18, 3, 7, 11, 15, 19]], ["CA", 2, 7, 14], ["CHR", 1, "shared", [2]], ["CA", 2, 3, 15], ["CHR", 0, "shared", [3]], ["CA", 1, 4, 15], ["FU", 9, [0, 1, 2, 3, 4]], ["AN", 9, 0, 5], ["FU", 9, [1, 2, 3, 4, 5]], ["AN", 9, 1, 4], ["FU", 9, [2, 3, 4, 5, 6]], ["AN", 9, 2, 6], ["FU", 3, [0, 1, 2]], ["SP", 3, 0, 8, [4], 1], ["AN", 3, 1, 2], ["FFSP", 3, 0, [6, 5, 4, 3, 2], 1, 1], ["AN", 3, 1, 6], ["FU", 1, [0, 1, 2, 3, 4]], ["SP", 1, 0, 32, [1], 1], ["AN", 1, 1, 2], ["FFSP", 1, 0, [6, 5, 4, 3, 2], 1, 1], ["AN", 1, 1, 6], ["PR", 4, 0, "auto_unroll_max_step$64"]]]], "r": [[0.000359853, 0.00036012, 0.000360499], 0, 68.2273, 1681223371], "v": "v0.6"}
{"i": [["[\"fused_conv1x1_bn_relu_no_share_input\", 1, 56, 56, 256, 4, 64]", "cuda -keys=cuda,gpu -max_num_threads=1024 -model=unknown -thread_warp_size=32", [-1, 16, 64, 49152, 2147483647, 1024, 8, 32], "", 0, []], [[], [["CI", 6], ["CI", 4], ["SP", 2, 0, 1, [1, 1, 1, 1], 1], ["SP", 2, 5, 64, [1, 4, 1, 1], 1], ["SP", 2, 10, 56, [1, 7, 1, 1], 1], ["SP", 2, 15, 56, [1, 8, 7, 1], 1], ["SP", 2, 20, 4, [1, 1, 1, 4], 1], ["SP", 2, 25, 256, [1, 2], 1], ["RE", 2, [0, 5, 10, 15, 20, 1, 6, 11, 16, 21, 2, 7, 12, 17, 22, 25, 26, 3, 8, 13, 18, 23, 27, 4, 9, 14, 19, 24]], ["FSP", 7, 0, 2, 3], ["FSP", 7, 4, 3, 3], ["FSP", 7, 8, 4, 3], ["FSP", 7, 12, 5, 3], ["FSP", 7, 16, 6, 3], ["RE", 7, [0, 4, 8, 12, 16, 1, 5, 9, 13, 17, 2, 6, 10, 14, 18, 3, 7, 11, 15, 19]], ["CA", 2, 7, 14], ["CHR", 1, "shared", [2]], ["CA", 2, 3, 15], ["CHR", 0, "shared", [3]], ["CA", 1, 4, 15], ["FU", 9, [0, 1, 2, 3, 4]], ["AN", 9, 0, 5], ["FU", 9, [1, 2, 3, 4, 5]], ["AN", 9, 1, 4], ["FU", 9, [2, 3, 4, 5, 6]], ["AN", 9, 2, 6], ["FU", 3, [0, 1, 2]], ["SP", 3, 0, 4, [1], 1], ["AN", 3, 1, 2], ["FFSP", 3, 0, [6, 5, 4, 3, 2], 1, 1], ["AN", 3, 1, 6], ["FU", 1, [0, 1, 2, 3, 4]], ["SP", 1, 0, 14, [1], 1], ["AN", 1, 1, 2], ["FFSP", 1, 0, [6, 5, 4, 3, 2], 1, 1], ["AN", 1, 1, 6], ["PR", 4, 0, "auto_unroll_max_step$1024"]]]], "r": [[0.000563847, 0.000563, 0.000563478], 0, 64.5062, 1681223367], "v": "v0.6"}
{"i": [["[\"fused_conv1x1_bn_relu_no_share_input\", 1, 56, 56, 256, 4, 64]", "cuda -keys=cuda,gpu -max_num_threads=1024 -model=unknown -thread_warp_size=32", [-1, 16, 64, 49152, 2147483647, 1024, 8, 32], "", 0, []], [[], [["CI", 6], ["CI", 4], ["SP", 2, 0, 1, [1, 1, 1, 1], 1], ["SP", 2, 5, 64, [8, 1, 1, 1], 1], ["SP", 2, 10, 56, [1, 14, 1, 4], 1], ["SP", 2, 15, 56, [1, 1, 1, 1], 1], ["SP", 2, 20, 4, [1, 1, 4, 1], 1], ["SP", 2, 25, 256, [8, 2], 1], ["RE", 2, [0, 5, 10, 15, 20, 1, 6, 11, 16, 21, 2, 7, 12, 17, 22, 25, 26, 3, 8, 13, 18, 23, 27, 4, 9, 14, 19, 24]], ["FSP", 7, 0, 2, 3], ["FSP", 7, 4, 3, 3], ["FSP", 7, 8, 4, 3], ["FSP", 7, 12, 5, 3], ["FSP", 7, 16, 6, 3], ["RE", 7, [0, 4, 8, 12, 16, 1, 5, 9, 13, 17, 2, 6, 10, 14, 18, 3, 7, 11, 15, 19]], ["CA", 2, 7, 14], ["CHR", 1, "shared", [2]], ["CA", 2, 3, 15], ["CHR", 0, "shared", [3]], ["CA", 1, 4, 15], ["FU", 9, [0, 1, 2, 3, 4]], ["AN", 9, 0, 5], ["FU", 9, [1, 2, 3, 4, 5]], ["AN", 9, 1, 4], ["FU", 9, [2, 3, 4, 5, 6]], ["AN", 9, 2, 6], ["FU", 3, [0, 1, 2]], ["SP", 3, 0, 16, [1], 1], ["AN", 3, 1, 2], ["FFSP", 3, 0, [6, 5, 4, 3, 2], 1, 1], ["AN", 3, 1, 6], ["FU", 1, [0, 1, 2, 3, 4]], ["SP", 1, 0, 32, [1], 1], ["AN", 1, 1, 2], ["FFSP", 1, 0, [6, 5, 4, 3, 2], 1, 1], ["AN", 1, 1, 6], ["PR", 4, 0, "auto_unroll_max_step$64"]]]], "r": [[0.000906902, 0.000907175, 0.000907203], 0, 75.9752, 1681223378], "v": "v0.6"}
{"i": [["[\"fused_conv1x1_bn_relu_no_share_input\", 1, 56, 56, 256, 4, 64]", "cuda -keys=cuda,gpu -max_num_threads=1024 -model=unknown -thread_warp_size=32", [-1, 16, 64, 49152, 2147483647, 1024, 8, 32], "", 0, []], [[], [["CI", 6], ["CI", 4], ["SP", 2, 0, 1, [1, 1, 1, 1], 1], ["SP", 2, 5, 64, [2, 16, 1, 2], 1], ["SP", 2, 10, 56, [2, 1, 2, 1], 1], ["SP", 2, 15, 56, [1, 1, 1, 1], 1], ["SP", 2, 20, 4, [1, 2, 1, 1], 1], ["SP", 2, 25, 256, [8, 2], 1], ["RE", 2, [0, 5, 10, 15, 20, 1, 6, 11, 16, 21, 2, 7, 12, 17, 22, 25, 26, 3, 8, 13, 18, 23, 27, 4, 9, 14, 19, 24]], ["FSP", 7, 0, 2, 3], ["FSP", 7, 4, 3, 3], ["FSP", 7, 8, 4, 3], ["FSP", 7, 12, 5, 3], ["FSP", 7, 16, 6, 3], ["RE", 7, [0, 4, 8, 12, 16, 1, 5, 9, 13, 17, 2, 6, 10, 14, 18, 3, 7, 11, 15, 19]], ["CA", 2, 7, 14], ["CHR", 1, "shared", [2]], ["CA", 2, 3, 15], ["CHR", 0, "shared", [3]], ["CA", 1, 4, 15], ["FU", 9, [0, 1, 2, 3, 4]], ["AN", 9, 0, 5], ["FU", 9, [1, 2, 3, 4, 5]], ["AN", 9, 1, 4], ["FU", 9, [2, 3, 4, 5, 6]], ["AN", 9, 2, 6], ["FU", 3, [0, 1, 2]], ["SP", 3, 0, 32, [1], 1], ["AN", 3, 1, 2], ["FFSP", 3, 0, [6, 5, 4, 3, 2], 1, 1], ["AN", 3, 1, 6], ["FU", 1, [0, 1, 2, 3, 4]], ["SP", 1, 0, 64, [4], 1], ["AN", 1, 1, 2], ["FFSP", 1, 0, [6, 5, 4, 3, 2], 1, 1], ["AN", 1, 1, 6], ["PR", 4, 0, "auto_unroll_max_step$512"]]]], "r": [[0.000591968, 0.000593598, 0.000591982], 0, 79.9494, 1681223382], "v": "v0.6"}
{"i": [["[\"fused_conv1x1_bn_relu_no_share_input\", 1, 56, 56, 256, 4, 64]", "cuda -keys=cuda,gpu -max_num_threads=1024 -model=unknown -thread_warp_size=32", [-1, 16, 64, 49152, 2147483647, 1024, 8, 32], "", 0, []], [[], [["CI", 6], ["CI", 4], ["SP", 2, 0, 1, [1, 1, 1, 1], 1], ["SP", 2, 5, 64, [1, 1, 2, 8], 1], ["SP", 2, 10, 56, [1, 2, 2, 1], 1], ["SP", 2, 15, 56, [4, 14, 1, 1], 1], ["SP", 2, 20, 4, [2, 2, 1, 1], 1], ["SP", 2, 25, 256, [2, 1], 1], ["RE", 2, [0, 5, 10, 15, 20, 1, 6, 11, 16, 21, 2, 7, 12, 17, 22, 25, 26, 3, 8, 13, 18, 23, 27, 4, 9, 14, 19, 24]], ["FSP", 7, 0, 2, 3], ["FSP", 7, 4, 3, 3], ["FSP", 7, 8, 4, 3], ["FSP", 7, 12, 5, 3], ["FSP", 7, 16, 6, 3], ["RE", 7, [0, 4, 8, 12, 16, 1, 5, 9, 13, 17, 2, 6, 10, 14, 18, 3, 7, 11, 15, 19]], ["CA", 2, 7, 14], ["CHR", 1, "shared", [2]], ["CA", 2, 3, 15], ["CHR", 0, "shared", [3]], ["CA", 1, 4, 15], ["FU", 9, [0, 1, 2, 3, 4]], ["AN", 9, 0, 5], ["FU", 9, [1, 2, 3, 4, 5]], ["AN", 9, 1, 4], ["FU", 9, [2, 3, 4, 5, 6]], ["AN", 9, 2, 6], ["FU", 3, [0, 1, 2]], ["SP", 3, 0, 32, [1], 1], ["AN", 3, 1, 2], ["FFSP", 3, 0, [6, 5, 4, 3, 2], 1, 1], ["AN", 3, 1, 6], ["FU", 1, [0, 1, 2, 3, 4]], ["SP", 1, 0, 64, [2], 1], ["AN", 1, 1, 2], ["FFSP", 1, 0, [6, 5, 4, 3, 2], 1, 1], ["AN", 1, 1, 6], ["PR", 4, 0, "auto_unroll_max_step$0"]]]], "r": [[0.0030736, 0.00307319, 0.00307306], 0, 72.4618, 1681223375], "v": "v0.6"}
{"i": [["[\"fused_conv1x1_bn_relu_no_share_input\", 1, 56, 56, 256, 4, 64]", "cuda -keys=cuda,gpu -max_num_threads=1024 -model=unknown -thread_warp_size=32", [-1, 16, 64, 49152, 2147483647, 1024, 8, 32], "", 0, []], [[], [["CI", 6], ["CI", 4], ["SP", 2, 0, 1, [1, 1, 1, 1], 1], ["SP", 2, 5, 64, [1, 8, 2, 4], 1], ["SP", 2, 10, 56, [1, 1, 1, 4], 1], ["SP", 2, 15, 56, [1, 7, 1, 1], 1], ["SP", 2, 20, 4, [2, 2, 1, 1], 1], ["SP", 2, 25, 256, [1, 2], 1], ["RE", 2, [0, 5, 10, 15, 20, 1, 6, 11, 16, 21, 2, 7, 12, 17, 22, 25, 26, 3, 8, 13, 18, 23, 27, 4, 9, 14, 19, 24]], ["FSP", 7, 0, 2, 3], ["FSP", 7, 4, 3, 3], ["FSP", 7, 8, 4, 3], ["FSP", 7, 12, 5, 3], ["FSP", 7, 16, 6, 3], ["RE", 7, [0, 4, 8, 12, 16, 1, 5, 9, 13, 17, 2, 6, 10, 14, 18, 3, 7, 11, 15, 19]], ["CA", 2, 7, 14], ["CHR", 1, "shared", [2]], ["CA", 2, 3, 15], ["CHR", 0, "shared", [3]], ["CA", 1, 4, 15], ["FU", 9, [0, 1, 2, 3, 4]], ["AN", 9, 0, 5], ["FU", 9, [1, 2, 3, 4, 5]], ["AN", 9, 1, 4], ["FU", 9, [2, 3, 4, 5, 6]], ["AN", 9, 2, 6], ["FU", 3, [0, 1, 2]], ["SP", 3, 0, 16, [2], 1], ["AN", 3, 1, 2], ["FFSP", 3, 0, [6, 5, 4, 3, 2], 1, 1], ["AN", 3, 1, 6], ["FU", 1, [0, 1, 2, 3, 4]], ["SP", 1, 0, 128, [1], 1], ["AN", 1, 1, 2], ["FFSP", 1, 0, [6, 5, 4, 3, 2], 1, 1], ["AN", 1, 1, 6], ["PR", 4, 0, "auto_unroll_max_step$1024"]]]], "r": [[0.00075185, 0.000753408, 0.000751734], 0, 86.6539, 1681223389], "v": "v0.6"}
{"i": [["[\"fused_conv1x1_bn_relu_no_share_input\", 1, 56, 56, 256, 4, 64]", "cuda -keys=cuda,gpu -max_num_threads=1024 -model=unknown -thread_warp_size=32", [-1, 16, 64, 49152, 2147483647, 1024, 8, 32], "", 0, []], [[], [["CI", 6], ["CI", 4], ["SP", 2, 0, 1, [1, 1, 1, 1], 1], ["SP", 2, 5, 64, [1, 4, 1, 2], 1], ["SP", 2, 10, 56, [1, 2, 1, 1], 1], ["SP", 2, 15, 56, [1, 7, 1, 4], 1], ["SP", 2, 20, 4, [4, 1, 1, 1], 1], ["SP", 2, 25, 256, [4, 1], 1], ["RE", 2, [0, 5, 10, 15, 20, 1, 6, 11, 16, 21, 2, 7, 12, 17, 22, 25, 26, 3, 8, 13, 18, 23, 27, 4, 9, 14, 19, 24]], ["FSP", 7, 0, 2, 3], ["FSP", 7, 4, 3, 3], ["FSP", 7, 8, 4, 3], ["FSP", 7, 12, 5, 3], ["FSP", 7, 16, 6, 3], ["RE", 7, [0, 4, 8, 12, 16, 1, 5, 9, 13, 17, 2, 6, 10, 14, 18, 3, 7, 11, 15, 19]], ["CA", 2, 7, 14], ["CHR", 1, "shared", [2]], ["CA", 2, 3, 15], ["CHR", 0, "shared", [3]], ["CA", 1, 4, 15], ["FU", 9, [0, 1, 2, 3, 4]], ["AN", 9, 0, 5], ["FU", 9, [1, 2, 3, 4, 5]], ["AN", 9, 1, 4], ["FU", 9, [2, 3, 4, 5, 6]], ["AN", 9, 2, 6], ["FU", 3, [0, 1, 2]], ["SP", 3, 0, 64, [1], 1], ["AN", 3, 1, 2], ["FFSP", 3, 0, [6, 5, 4, 3, 2], 1, 1], ["AN", 3, 1, 6], ["FU", 1, [0, 1, 2, 3, 4]], ["SP", 1, 0, 64, [1], 1], ["AN", 1, 1, 2], ["FFSP", 1, 0, [6, 5, 4, 3, 2], 1, 1], ["AN", 1, 1, 6], ["PR", 4, 0, "auto_unroll_max_step$1024"]]]], "r": [[0.000366567, 0.000368136, 0.000366836], 0, 83.108, 1681223386], "v": "v0.6"}
{"i": [["[\"fused_conv1x1_bn_relu_no_share_input\", 1, 56, 56, 256, 4, 64]", "cuda -keys=cuda,gpu -max_num_threads=1024 -model=unknown -thread_warp_size=32", [-1, 16, 64, 49152, 2147483647, 1024, 8, 32], "", 0, []], [[], [["CI", 6], ["CI", 4], ["SP", 2, 0, 1, [1, 1, 1, 1], 1], ["SP", 2, 5, 64, [1, 8, 2, 4], 1], ["SP", 2, 10, 56, [1, 1, 2, 1], 1], ["SP", 2, 15, 56, [1, 4, 14, 1], 1], ["SP", 2, 20, 4, [1, 1, 1, 4], 1], ["SP", 2, 25, 256, [1, 1], 1], ["RE", 2, [0, 5, 10, 15, 20, 1, 6, 11, 16, 21, 2, 7, 12, 17, 22, 25, 26, 3, 8, 13, 18, 23, 27, 4, 9, 14, 19, 24]], ["FSP", 7, 0, 2, 3], ["FSP", 7, 4, 3, 3], ["FSP", 7, 8, 4, 3], ["FSP", 7, 12, 5, 3], ["FSP", 7, 16, 6, 3], ["RE", 7, [0, 4, 8, 12, 16, 1, 5, 9, 13, 17, 2, 6, 10, 14, 18, 3, 7, 11, 15, 19]], ["CA", 2, 7, 14], ["CHR", 1, "shared", [2]], ["CA", 2, 3, 15], ["CHR", 0, "shared", [3]], ["CA", 1, 4, 15], ["FU", 9, [0, 1, 2, 3, 4]], ["AN", 9, 0, 5], ["FU", 9, [1, 2, 3, 4, 5]], ["AN", 9, 1, 4], ["FU", 9, [2, 3, 4, 5, 6]], ["AN", 9, 2, 6], ["FU", 3, [0, 1, 2]], ["SP", 3, 0, 16, [1], 1], ["AN", 3, 1, 2], ["FFSP", 3, 0, [6, 5, 4, 3, 2], 1, 1], ["AN", 3, 1, 6], ["FU", 1, [0, 1, 2, 3, 4]], ["SP", 1, 0, 112, [1], 1], ["AN", 1, 1, 2], ["FFSP", 1, 0, [6, 5, 4, 3, 2], 1, 1], ["AN", 1, 1, 6], ["PR", 4, 0, "auto_unroll_max_step$64"]]]], "r": [[0.0113524, 0.0113406, 0.011338], 0, 94.968, 1681223397], "v": "v0.6"}
{"i": [["[\"fused_conv1x1_bn_relu_no_share_input\", 1, 56, 56, 256, 4, 64]", "cuda -keys=cuda,gpu -max_num_threads=1024 -model=unknown -thread_warp_size=32", [-1, 16, 64, 49152, 2147483647, 1024, 8, 32], "", 0, []], [[], [["CI", 6], ["CI", 4], ["SP", 2, 0, 1, [1, 1, 1, 1], 1], ["SP", 2, 5, 64, [1, 4, 1, 1], 1], ["SP", 2, 10, 56, [8, 7, 1, 1], 1], ["SP", 2, 15, 56, [1, 14, 1, 1], 1], ["SP", 2, 20, 4, [1, 1, 1, 2], 1], ["SP", 2, 25, 256, [1, 2], 1], ["RE", 2, [0, 5, 10, 15, 20, 1, 6, 11, 16, 21, 2, 7, 12, 17, 22, 25, 26, 3, 8, 13, 18, 23, 27, 4, 9, 14, 19, 24]], ["FSP", 7, 0, 2, 3], ["FSP", 7, 4, 3, 3], ["FSP", 7, 8, 4, 3], ["FSP", 7, 12, 5, 3], ["FSP", 7, 16, 6, 3], ["RE", 7, [0, 4, 8, 12, 16, 1, 5, 9, 13, 17, 2, 6, 10, 14, 18, 3, 7, 11, 15, 19]], ["CA", 2, 7, 14], ["CHR", 1, "shared", [2]], ["CA", 2, 3, 15], ["CHR", 0, "shared", [3]], ["CA", 1, 4, 15], ["FU", 9, [0, 1, 2, 3, 4]], ["AN", 9, 0, 5], ["FU", 9, [1, 2, 3, 4, 5]], ["AN", 9, 1, 4], ["FU", 9, [2, 3, 4, 5, 6]], ["AN", 9, 2, 6], ["FU", 3, [0, 1, 2]], ["SP", 3, 0, 4, [1], 1], ["AN", 3, 1, 2], ["FFSP", 3, 0, [6, 5, 4, 3, 2], 1, 1], ["AN", 3, 1, 6], ["FU", 1, [0, 1, 2, 3, 4]], ["SP", 1, 0, 14, [1], 1], ["AN", 1, 1, 2], ["FFSP", 1, 0, [6, 5, 4, 3, 2], 1, 1], ["AN", 1, 1, 6], ["PR", 4, 0, "auto_unroll_max_step$512"]]]], "r": [[0.00120834, 0.00120304, 0.00119904], 0, 101.952, 1681223405], "v": "v0.6"}
{"i": [["[\"fused_conv1x1_bn_relu_no_share_input\", 1, 56, 56, 256, 4, 64]", "cuda -keys=cuda,gpu -max_num_threads=1024 -model=unknown -thread_warp_size=32", [-1, 16, 64, 49152, 2147483647, 1024, 8, 32], "", 0, []], [[], [["CI", 6], ["CI", 4], ["SP", 2, 0, 1, [1, 1, 1, 1], 1], ["SP", 2, 5, 64, [1, 1, 1, 1], 1], ["SP", 2, 10, 56, [1, 14, 2, 2], 1], ["SP", 2, 15, 56, [1, 2, 1, 2], 1], ["SP", 2, 20, 4, [2, 1, 2, 1], 1], ["SP", 2, 25, 256, [16, 1], 1], ["RE", 2, [0, 5, 10, 15, 20, 1, 6, 11, 16, 21, 2, 7, 12, 17, 22, 25, 26, 3, 8, 13, 18, 23, 27, 4, 9, 14, 19, 24]], ["FSP", 7, 0, 2, 3], ["FSP", 7, 4, 3, 3], ["FSP", 7, 8, 4, 3], ["FSP", 7, 12, 5, 3], ["FSP", 7, 16, 6, 3], ["RE", 7, [0, 4, 8, 12, 16, 1, 5, 9, 13, 17, 2, 6, 10, 14, 18, 3, 7, 11, 15, 19]], ["CA", 2, 7, 14], ["CHR", 1, "shared", [2]], ["CA", 2, 3, 15], ["CHR", 0, "shared", [3]], ["CA", 1, 4, 15], ["FU", 9, [0, 1, 2, 3, 4]], ["AN", 9, 0, 5], ["FU", 9, [1, 2, 3, 4, 5]], ["AN", 9, 1, 4], ["FU", 9, [2, 3, 4, 5, 6]], ["AN", 9, 2, 6], ["FU", 3, [0, 1, 2]], ["SP", 3, 0, 32, [8], 1], ["AN", 3, 1, 2], ["FFSP", 3, 0, [6, 5, 4, 3, 2], 1, 1], ["AN", 3, 1, 6], ["FU", 1, [0, 1, 2, 3, 4]], ["SP", 1, 0, 64, [4], 1], ["AN", 1, 1, 2], ["FFSP", 1, 0, [6, 5, 4, 3, 2], 1, 1], ["AN", 1, 1, 6], ["PR", 4, 0, "auto_unroll_max_step$0"]]]], "r": [[0.000248726, 0.000248951, 0.000248865], 0, 89.9411, 1681223393], "v": "v0.6"}
{"i": [["[\"fused_conv1x1_bn_relu_no_share_input\", 1, 56, 56, 256, 4, 64]", "cuda -keys=cuda,gpu -max_num_threads=1024 -model=unknown -thread_warp_size=32", [-1, 16, 64, 49152, 2147483647, 1024, 8, 32], "", 0, []], [[], [["CI", 6], ["CI", 4], ["SP", 2, 0, 1, [1, 1, 1, 1], 1], ["SP", 2, 5, 64, [1, 1, 1, 16], 1], ["SP", 2, 10, 56, [1, 2, 7, 1], 1], ["SP", 2, 15, 56, [1, 28, 1, 1], 1], ["SP", 2, 20, 4, [1, 1, 2, 2], 1], ["SP", 2, 25, 256, [1, 1], 1], ["RE", 2, [0, 5, 10, 15, 20, 1, 6, 11, 16, 21, 2, 7, 12, 17, 22, 25, 26, 3, 8, 13, 18, 23, 27, 4, 9, 14, 19, 24]], ["FSP", 7, 0, 2, 3], ["FSP", 7, 4, 3, 3], ["FSP", 7, 8, 4, 3], ["FSP", 7, 12, 5, 3], ["FSP", 7, 16, 6, 3], ["RE", 7, [0, 4, 8, 12, 16, 1, 5, 9, 13, 17, 2, 6, 10, 14, 18, 3, 7, 11, 15, 19]], ["CA", 2, 7, 14], ["CHR", 1, "shared", [2]], ["CA", 2, 3, 15], ["CHR", 0, "shared", [3]], ["CA", 1, 4, 15], ["FU", 9, [0, 1, 2, 3, 4]], ["AN", 9, 0, 5], ["FU", 9, [1, 2, 3, 4, 5]], ["AN", 9, 1, 4], ["FU", 9, [2, 3, 4, 5, 6]], ["AN", 9, 2, 6], ["FU", 3, [0, 1, 2]], ["SP", 3, 0, 32, [1], 1], ["AN", 3, 1, 2], ["FFSP", 3, 0, [6, 5, 4, 3, 2], 1, 1], ["AN", 3, 1, 6], ["FU", 1, [0, 1, 2, 3, 4]], ["SP", 1, 0, 112, [1], 1], ["AN", 1, 1, 2], ["FFSP", 1, 0, [6, 5, 4, 3, 2], 1, 1], ["AN", 1, 1, 6], ["PR", 4, 0, "auto_unroll_max_step$16"]]]], "r": [[0.00714369, 0.00712954, 0.00714946], 0, 105.72, 1681223409], "v": "v0.6"}
{"i": [["[\"fused_conv1x1_bn_relu_no_share_input\", 1, 56, 56, 256, 4, 64]", "cuda -keys=cuda,gpu -max_num_threads=1024 -model=unknown -thread_warp_size=32", [-1, 16, 64, 49152, 2147483647, 1024, 8, 32], "", 0, []], [[], [["CI", 6], ["CI", 4], ["SP", 2, 0, 1, [1, 1, 1, 1], 1], ["SP", 2, 5, 64, [1, 1, 1, 1], 1], ["SP", 2, 10, 56, [1, 1, 1, 8], 1], ["SP", 2, 15, 56, [1, 1, 1, 56], 1], ["SP", 2, 20, 4, [2, 2, 1, 1], 1], ["SP", 2, 25, 256, [8, 1], 1], ["RE", 2, [0, 5, 10, 15, 20, 1, 6, 11, 16, 21, 2, 7, 12, 17, 22, 25, 26, 3, 8, 13, 18, 23, 27, 4, 9, 14, 19, 24]], ["FSP", 7, 0, 2, 3], ["FSP", 7, 4, 3, 3], ["FSP", 7, 8, 4, 3], ["FSP", 7, 12, 5, 3], ["FSP", 7, 16, 6, 3], ["RE", 7, [0, 4, 8, 12, 16, 1, 5, 9, 13, 17, 2, 6, 10, 14, 18, 3, 7, 11, 15, 19]], ["CA", 2, 7, 14], ["CHR", 1, "shared", [2]], ["CA", 2, 3, 15], ["CHR", 0, "shared", [3]], ["CA", 1, 4, 15], ["FU", 9, [0, 1, 2, 3, 4]], ["AN", 9, 0, 5], ["FU", 9, [1, 2, 3, 4, 5]], ["AN", 9, 1, 4], ["FU", 9, [2, 3, 4, 5, 6]], ["AN", 9, 2, 6], ["FU", 3, [0, 1, 2]], ["SP", 3, 0, 8, [4], 1], ["AN", 3, 1, 2], ["FFSP", 3, 0, [6, 5, 4, 3, 2], 1, 1], ["AN", 3, 1, 6], ["FU", 1, [0, 1, 2, 3, 4]], ["SP", 1, 0, 64, [1], 1], ["AN", 1, 1, 2], ["FFSP", 1, 0, [6, 5, 4, 3, 2], 1, 1], ["AN", 1, 1, 6], ["PR", 4, 0, "auto_unroll_max_step$1024"]]]], "r": [[0.0207706, 0.0208005, 0.0208386], 0, 102.171, 1681223401], "v": "v0.6"}
{"i": [["[\"fused_conv1x1_bn_relu_no_share_input\", 1, 56, 56, 256, 4, 64]", "cuda -keys=cuda,gpu -max_num_threads=1024 -model=unknown -thread_warp_size=32", [-1, 16, 64, 49152, 2147483647, 1024, 8, 32], "", 0, []], [[], [["CI", 6], ["CI", 4], ["SP", 2, 0, 1, [1, 1, 1, 1], 1], ["SP", 2, 5, 64, [2, 8, 1, 4], 1], ["SP", 2, 10, 56, [1, 1, 1, 1], 1], ["SP", 2, 15, 56, [1, 4, 1, 1], 1], ["SP", 2, 20, 4, [1, 1, 2, 2], 1], ["SP", 2, 25, 256, [4, 4], 1], ["RE", 2, [0, 5, 10, 15, 20, 1, 6, 11, 16, 21, 2, 7, 12, 17, 22, 25, 26, 3, 8, 13, 18, 23, 27, 4, 9, 14, 19, 24]], ["FSP", 7, 0, 2, 3], ["FSP", 7, 4, 3, 3], ["FSP", 7, 8, 4, 3], ["FSP", 7, 12, 5, 3], ["FSP", 7, 16, 6, 3], ["RE", 7, [0, 4, 8, 12, 16, 1, 5, 9, 13, 17, 2, 6, 10, 14, 18, 3, 7, 11, 15, 19]], ["CA", 2, 7, 14], ["CHR", 1, "shared", [2]], ["CA", 2, 3, 15], ["CHR", 0, "shared", [3]], ["CA", 1, 4, 15], ["FU", 9, [0, 1, 2, 3, 4]], ["AN", 9, 0, 5], ["FU", 9, [1, 2, 3, 4, 5]], ["AN", 9, 1, 4], ["FU", 9, [2, 3, 4, 5, 6]], ["AN", 9, 2, 6], ["FU", 3, [0, 1, 2]], ["SP", 3, 0, 256, [1], 1], ["AN", 3, 1, 2], ["FFSP", 3, 0, [6, 5, 4, 3, 2], 1, 1], ["AN", 3, 1, 6], ["FU", 1, [0, 1, 2, 3, 4]], ["SP", 1, 0, 64, [1], 1], ["AN", 1, 1, 2], ["FFSP", 1, 0, [6, 5, 4, 3, 2], 1, 1], ["AN", 1, 1, 6], ["PR", 4, 0, "auto_unroll_max_step$16"]]]], "r": [[0.000745703, 0.000745542, 0.000745265], 0, 109.118, 1681223412], "v": "v0.6"}
{"i": [["[\"fused_conv1x1_bn_relu_no_share_input\", 1, 56, 56, 256, 4, 64]", "cuda -keys=cuda,gpu -max_num_threads=1024 -model=unknown -thread_warp_size=32", [-1, 16, 64, 49152, 2147483647, 1024, 8, 32], "", 0, []], [[], [["CI", 6], ["CI", 4], ["SP", 2, 0, 1, [1, 1, 1, 1], 1], ["SP", 2, 5, 64, [2, 1, 4, 1], 1], ["SP", 2, 10, 56, [2, 1, 2, 2], 1], ["SP", 2, 15, 56, [1, 56, 1, 1], 1], ["SP", 2, 20, 4, [2, 1, 1, 2], 1], ["SP", 2, 25, 256, [1, 2], 1], ["RE", 2, [0, 5, 10, 15, 20, 1, 6, 11, 16, 21, 2, 7, 12, 17, 22, 25, 26, 3, 8, 13, 18, 23, 27, 4, 9, 14, 19, 24]], ["FSP", 7, 0, 2, 3], ["FSP", 7, 4, 3, 3], ["FSP", 7, 8, 4, 3], ["FSP", 7, 12, 5, 3], ["FSP", 7, 16, 6, 3], ["RE", 7, [0, 4, 8, 12, 16, 1, 5, 9, 13, 17, 2, 6, 10, 14, 18, 3, 7, 11, 15, 19]], ["CA", 2, 7, 14], ["CHR", 1, "shared", [2]], ["CA", 2, 3, 15], ["CHR", 0, "shared", [3]], ["CA", 1, 4, 15], ["FU", 9, [0, 1, 2, 3, 4]], ["AN", 9, 0, 5], ["FU", 9, [1, 2, 3, 4, 5]], ["AN", 9, 1, 4], ["FU", 9, [2, 3, 4, 5, 6]], ["AN", 9, 2, 6], ["FU", 3, [0, 1, 2]], ["SP", 3, 0, 16, [1], 1], ["AN", 3, 1, 2], ["FFSP", 3, 0, [6, 5, 4, 3, 2], 1, 1], ["AN", 3, 1, 6], ["FU", 1, [0, 1, 2, 3, 4]], ["SP", 1, 0, 32, [1], 1], ["AN", 1, 1, 2], ["FFSP", 1, 0, [6, 5, 4, 3, 2], 1, 1], ["AN", 1, 1, 6], ["PR", 4, 0, "auto_unroll_max_step$64"]]]], "r": [[0.00252802, 0.00253014, 0.0025308], 0, 116.611, 1681223420], "v": "v0.6"}
{"i": [["[\"fused_conv1x1_bn_relu_no_share_input\", 1, 56, 56, 256, 4, 64]", "cuda -keys=cuda,gpu -max_num_threads=1024 -model=unknown -thread_warp_size=32", [-1, 16, 64, 49152, 2147483647, 1024, 8, 32], "", 0, []], [[], [["CI", 6], ["CI", 4], ["SP", 2, 0, 1, [1, 1, 1, 1], 1], ["SP", 2, 5, 64, [1, 4, 2, 2], 1], ["SP", 2, 10, 56, [1, 2, 1, 1], 1], ["SP", 2, 15, 56, [1, 7, 1, 4], 1], ["SP", 2, 20, 4, [1, 1, 1, 4], 1], ["SP", 2, 25, 256, [4, 1], 1], ["RE", 2, [0, 5, 10, 15, 20, 1, 6, 11, 16, 21, 2, 7, 12, 17, 22, 25, 26, 3, 8, 13, 18, 23, 27, 4, 9, 14, 19, 24]], ["FSP", 7, 0, 2, 3], ["FSP", 7, 4, 3, 3], ["FSP", 7, 8, 4, 3], ["FSP", 7, 12, 5, 3], ["FSP", 7, 16, 6, 3], ["RE", 7, [0, 4, 8, 12, 16, 1, 5, 9, 13, 17, 2, 6, 10, 14, 18, 3, 7, 11, 15, 19]], ["CA", 2, 7, 14], ["CHR", 1, "shared", [2]], ["CA", 2, 3, 15], ["CHR", 0, "shared", [3]], ["CA", 1, 4, 15], ["FU", 9, [0, 1, 2, 3, 4]], ["AN", 9, 0, 5], ["FU", 9, [1, 2, 3, 4, 5]], ["AN", 9, 1, 4], ["FU", 9, [2, 3, 4, 5, 6]], ["AN", 9, 2, 6], ["FU", 3, [0, 1, 2]], ["SP", 3, 0, 64, [1], 1], ["AN", 3, 1, 2], ["FFSP", 3, 0, [6, 5, 4, 3, 2], 1, 1], ["AN", 3, 1, 6], ["FU", 1, [0, 1, 2, 3, 4]], ["SP", 1, 0, 64, [1], 1], ["AN", 1, 1, 2], ["FFSP", 1, 0, [6, 5, 4, 3, 2], 1, 1], ["AN", 1, 1, 6], ["PR", 4, 0, "auto_unroll_max_step$1024"]]]], "r": [[0.000407489, 0.000407574, 0.000407313], 0, 113.382, 1681223416], "v": "v0.6"}
{"i": [["[\"fused_conv1x1_bn_relu_no_share_input\", 1, 56, 56, 256, 4, 64]", "cuda -keys=cuda,gpu -max_num_threads=1024 -model=unknown -thread_warp_size=32", [-1, 16, 64, 49152, 2147483647, 1024, 8, 32], "", 0, []], [[], [["CI", 6], ["CI", 4], ["SP", 2, 0, 1, [1, 1, 1, 1], 1], ["SP", 2, 5, 64, [2, 8, 1, 1], 1], ["SP", 2, 10, 56, [1, 1, 2, 1], 1], ["SP", 2, 15, 56, [1, 2, 2, 2], 1], ["SP", 2, 20, 4, [2, 2, 1, 1], 1], ["SP", 2, 25, 256, [2, 4], 1], ["RE", 2, [0, 5, 10, 15, 20, 1, 6, 11, 16, 21, 2, 7, 12, 17, 22, 25, 26, 3, 8, 13, 18, 23, 27, 4, 9, 14, 19, 24]], ["FSP", 7, 0, 2, 3], ["FSP", 7, 4, 3, 3], ["FSP", 7, 8, 4, 3], ["FSP", 7, 12, 5, 3], ["FSP", 7, 16, 6, 3], ["RE", 7, [0, 4, 8, 12, 16, 1, 5, 9, 13, 17, 2, 6, 10, 14, 18, 3, 7, 11, 15, 19]], ["CA", 2, 7, 14], ["CHR", 1, "shared", [2]], ["CA", 2, 3, 15], ["CHR", 0, "shared", [3]], ["CA", 1, 4, 15], ["FU", 9, [0, 1, 2, 3, 4]], ["AN", 9, 0, 5], ["FU", 9, [1, 2, 3, 4, 5]], ["AN", 9, 1, 4], ["FU", 9, [2, 3, 4, 5, 6]], ["AN", 9, 2, 6], ["FU", 3, [0, 1, 2]], ["SP", 3, 0, 8, [2], 1], ["AN", 3, 1, 2], ["FFSP", 3, 0, [6, 5, 4, 3, 2], 1, 1], ["AN", 3, 1, 6], ["FU", 1, [0, 1, 2, 3, 4]], ["SP", 1, 0, 32, [1], 1], ["AN", 1, 1, 2], ["FFSP", 1, 0, [6, 5, 4, 3, 2], 1, 1], ["AN", 1, 1, 6], ["PR", 4, 0, "auto_unroll_max_step$16"]]]], "r": [[0.000358007, 0.00035788, 0.000358053], 0, 123.556, 1681223427], "v": "v0.6"}
{"i": [["[\"fused_conv1x1_bn_relu_no_share_input\", 1, 56, 56, 256, 4, 64]", "cuda -keys=cuda,gpu -max_num_threads=1024 -model=unknown -thread_warp_size=32", [-1, 16, 64, 49152, 2147483647, 1024, 8, 32], "", 0, []], [[], [["CI", 6], ["CI", 4], ["SP", 2, 0, 1, [1, 1, 1, 1], 1], ["SP", 2, 5, 64, [1, 8, 1, 1], 1], ["SP", 2, 10, 56, [1, 7, 1, 2], 1], ["SP", 2, 15, 56, [1, 1, 1, 2], 1], ["SP", 2, 20, 4, [1, 2, 2, 1], 1], ["SP", 2, 25, 256, [4, 4], 1], ["RE", 2, [0, 5, 10, 15, 20, 1, 6, 11, 16, 21, 2, 7, 12, 17, 22, 25, 26, 3, 8, 13, 18, 23, 27, 4, 9, 14, 19, 24]], ["FSP", 7, 0, 2, 3], ["FSP", 7, 4, 3, 3], ["FSP", 7, 8, 4, 3], ["FSP", 7, 12, 5, 3], ["FSP", 7, 16, 6, 3], ["RE", 7, [0, 4, 8, 12, 16, 1, 5, 9, 13, 17, 2, 6, 10, 14, 18, 3, 7, 11, 15, 19]], ["CA", 2, 7, 14], ["CHR", 1, "shared", [2]], ["CA", 2, 3, 15], ["CHR", 0, "shared", [3]], ["CA", 1, 4, 15], ["FU", 9, [0, 1, 2, 3, 4]], ["AN", 9, 0, 5], ["FU", 9, [1, 2, 3, 4, 5]], ["AN", 9, 1, 4], ["FU", 9, [2, 3, 4, 5, 6]], ["AN", 9, 2, 6], ["FU", 3, [0, 1, 2]], ["SP", 3, 0, 64, [1], 1], ["AN", 3, 1, 2], ["FFSP", 3, 0, [6, 5, 4, 3, 2], 1, 1], ["AN", 3, 1, 6], ["FU", 1, [0, 1, 2, 3, 4]], ["SP", 1, 0, 128, [1], 1], ["AN", 1, 1, 2], ["FFSP", 1, 0, [6, 5, 4, 3, 2], 1, 1], ["AN", 1, 1, 6], ["PR", 4, 0, "auto_unroll_max_step$64"]]]], "r": [[0.000230602, 0.000231464, 0.000231241], 0, 119.848, 1681223423], "v": "v0.6"}
{"i": [["[\"fused_conv1x1_bn_relu_no_share_input\", 1, 56, 56, 256, 4, 64]", "cuda -keys=cuda,gpu -max_num_threads=1024 -model=unknown -thread_warp_size=32", [-1, 16, 64, 49152, 2147483647, 1024, 8, 32], "", 0, []], [[], [["CI", 6], ["CI", 4], ["SP", 2, 0, 1, [1, 1, 1, 1], 1], ["SP", 2, 5, 64, [2, 1, 1, 2], 1], ["SP", 2, 10, 56, [1, 14, 2, 2], 1], ["SP", 2, 15, 56, [2, 1, 2, 1], 1], ["SP", 2, 20, 4, [1, 4, 1, 1], 1], ["SP", 2, 25, 256, [4, 1], 1], ["RE", 2, [0, 5, 10, 15, 20, 1, 6, 11, 16, 21, 2, 7, 12, 17, 22, 25, 26, 3, 8, 13, 18, 23, 27, 4, 9, 14, 19, 24]], ["FSP", 7, 0, 2, 3], ["FSP", 7, 4, 3, 3], ["FSP", 7, 8, 4, 3], ["FSP", 7, 12, 5, 3], ["FSP", 7, 16, 6, 3], ["RE", 7, [0, 4, 8, 12, 16, 1, 5, 9, 13, 17, 2, 6, 10, 14, 18, 3, 7, 11, 15, 19]], ["CA", 2, 7, 14], ["CHR", 1, "shared", [2]], ["CA", 2, 3, 15], ["CHR", 0, "shared", [3]], ["CA", 1, 4, 15], ["FU", 9, [0, 1, 2, 3, 4]], ["AN", 9, 0, 5], ["FU", 9, [1, 2, 3, 4, 5]], ["AN", 9, 1, 4], ["FU", 9, [2, 3, 4, 5, 6]], ["AN", 9, 2, 6], ["FU", 3, [0, 1, 2]], ["SP", 3, 0, 8, [2], 1], ["AN", 3, 1, 2], ["FFSP", 3, 0, [6, 5, 4, 3, 2], 1, 1], ["AN", 3, 1, 6], ["FU", 1, [0, 1, 2, 3, 4]], ["SP", 1, 0, 64, [1], 1], ["AN", 1, 1, 2], ["FFSP", 1, 0, [6, 5, 4, 3, 2], 1, 1], ["AN", 1, 1, 6], ["PR", 4, 0, "auto_unroll_max_step$16"]]]], "r": [[0.00170685, 0.00169297, 0.00170503], 0, 138.315, 1681223442], "v": "v0.6"}
{"i": [["[\"fused_conv1x1_bn_relu_no_share_input\", 1, 56, 56, 256, 4, 64]", "cuda -keys=cuda,gpu -max_num_threads=1024 -model=unknown -thread_warp_size=32", [-1, 16, 64, 49152, 2147483647, 1024, 8, 32], "", 0, []], [[], [["CI", 6], ["CI", 4], ["SP", 2, 0, 1, [1, 1, 1, 1], 1], ["SP", 2, 5, 64, [1, 4, 1, 1], 1], ["SP", 2, 10, 56, [2, 1, 4, 1], 1], ["SP", 2, 15, 56, [1, 4, 2, 7], 1], ["SP", 2, 20, 4, [2, 2, 1, 1], 1], ["SP", 2, 25, 256, [1, 4], 1], ["RE", 2, [0, 5, 10, 15, 20, 1, 6, 11, 16, 21, 2, 7, 12, 17, 22, 25, 26, 3, 8, 13, 18, 23, 27, 4, 9, 14, 19, 24]], ["FSP", 7, 0, 2, 3], ["FSP", 7, 4, 3, 3], ["FSP", 7, 8, 4, 3], ["FSP", 7, 12, 5, 3], ["FSP", 7, 16, 6, 3], ["RE", 7, [0, 4, 8, 12, 16, 1, 5, 9, 13, 17, 2, 6, 10, 14, 18, 3, 7, 11, 15, 19]], ["CA", 2, 7, 14], ["CHR", 1, "shared", [2]], ["CA", 2, 3, 15], ["CHR", 0, "shared", [3]], ["CA", 1, 4, 15], ["FU", 9, [0, 1, 2, 3, 4]], ["AN", 9, 0, 5], ["FU", 9, [1, 2, 3, 4, 5]], ["AN", 9, 1, 4], ["FU", 9, [2, 3, 4, 5, 6]], ["AN", 9, 2, 6], ["FU", 3, [0, 1, 2]], ["SP", 3, 0, 4, [1], 1], ["AN", 3, 1, 2], ["FFSP", 3, 0, [6, 5, 4, 3, 2], 1, 1], ["AN", 3, 1, 6], ["FU", 1, [0, 1, 2, 3, 4]], ["SP", 1, 0, 448, [1], 1], ["AN", 1, 1, 2], ["FFSP", 1, 0, [6, 5, 4, 3, 2], 1, 1], ["AN", 1, 1, 6], ["PR", 4, 0, "auto_unroll_max_step$64"]]]], "r": [[0.0015541, 0.00155345, 0.00155394], 0, 127.459, 1681223431], "v": "v0.6"}
{"i": [["[\"fused_conv1x1_bn_relu_no_share_input\", 1, 56, 56, 256, 4, 64]", "cuda -keys=cuda,gpu -max_num_threads=1024 -model=unknown -thread_warp_size=32", [-1, 16, 64, 49152, 2147483647, 1024, 8, 32], "", 0, []], [[], [["CI", 6], ["CI", 4], ["SP", 2, 0, 1, [1, 1, 1, 1], 1], ["SP", 2, 5, 64, [1, 1, 2, 1], 1], ["SP", 2, 10, 56, [1, 14, 2, 2], 1], ["SP", 2, 15, 56, [1, 4, 1, 1], 1], ["SP", 2, 20, 4, [2, 1, 2, 1], 1], ["SP", 2, 25, 256, [8, 2], 1], ["RE", 2, [0, 5, 10, 15, 20, 1, 6, 11, 16, 21, 2, 7, 12, 17, 22, 25, 26, 3, 8, 13, 18, 23, 27, 4, 9, 14, 19, 24]], ["FSP", 7, 0, 2, 3], ["FSP", 7, 4, 3, 3], ["FSP", 7, 8, 4, 3], ["FSP", 7, 12, 5, 3], ["FSP", 7, 16, 6, 3], ["RE", 7, [0, 4, 8, 12, 16, 1, 5, 9, 13, 17, 2, 6, 10, 14, 18, 3, 7, 11, 15, 19]], ["CA", 2, 7, 14], ["CHR", 1, "shared", [2]], ["CA", 2, 3, 15], ["CHR", 0, "shared", [3]], ["CA", 1, 4, 15], ["FU", 9, [0, 1, 2, 3, 4]], ["AN", 9, 0, 5], ["FU", 9, [1, 2, 3, 4, 5]], ["AN", 9, 1, 4], ["FU", 9, [2, 3, 4, 5, 6]], ["AN", 9, 2, 6], ["FU", 3, [0, 1, 2]], ["SP", 3, 0, 32, [1], 1], ["AN", 3, 1, 2], ["FFSP", 3, 0, [6, 5, 4, 3, 2], 1, 1], ["AN", 3, 1, 6], ["FU", 1, [0, 1, 2, 3, 4]], ["SP", 1, 0, 64, [4], 1], ["AN", 1, 1, 2], ["FFSP", 1, 0, [6, 5, 4, 3, 2], 1, 1], ["AN", 1, 1, 6], ["PR", 4, 0, "auto_unroll_max_step$0"]]]], "r": [[0.000234869, 0.000235423, 0.000235464], 0, 134.669, 1681223438], "v": "v0.6"}
{"i": [["[\"fused_conv1x1_bn_relu_no_share_input\", 1, 56, 56, 256, 4, 64]", "cuda -keys=cuda,gpu -max_num_threads=1024 -model=unknown -thread_warp_size=32", [-1, 16, 64, 49152, 2147483647, 1024, 8, 32], "", 0, []], [[], [["CI", 6], ["CI", 4], ["SP", 2, 0, 1, [1, 1, 1, 1], 1], ["SP", 2, 5, 64, [1, 32, 1, 2], 1], ["SP", 2, 10, 56, [1, 1, 7, 1], 1], ["SP", 2, 15, 56, [1, 4, 1, 1], 1], ["SP", 2, 20, 4, [1, 1, 1, 1], 1], ["SP", 2, 25, 256, [1, 2], 1], ["RE", 2, [0, 5, 10, 15, 20, 1, 6, 11, 16, 21, 2, 7, 12, 17, 22, 25, 26, 3, 8, 13, 18, 23, 27, 4, 9, 14, 19, 24]], ["FSP", 7, 0, 2, 3], ["FSP", 7, 4, 3, 3], ["FSP", 7, 8, 4, 3], ["FSP", 7, 12, 5, 3], ["FSP", 7, 16, 6, 3], ["RE", 7, [0, 4, 8, 12, 16, 1, 5, 9, 13, 17, 2, 6, 10, 14, 18, 3, 7, 11, 15, 19]], ["CA", 2, 7, 14], ["CHR", 1, "shared", [2]], ["CA", 2, 3, 15], ["CHR", 0, "shared", [3]], ["CA", 1, 4, 15], ["FU", 9, [0, 1, 2, 3, 4]], ["AN", 9, 0, 5], ["FU", 9, [1, 2, 3, 4, 5]], ["AN", 9, 1, 4], ["FU", 9, [2, 3, 4, 5, 6]], ["AN", 9, 2, 6], ["FU", 3, [0, 1, 2]], ["SP", 3, 0, 8, [1], 1], ["AN", 3, 1, 2], ["FFSP", 3, 0, [6, 5, 4, 3, 2], 1, 1], ["AN", 3, 1, 6], ["FU", 1, [0, 1, 2, 3, 4]], ["SP", 1, 0, 56, [4], 1], ["AN", 1, 1, 2], ["FFSP", 1, 0, [6, 5, 4, 3, 2], 1, 1], ["AN", 1, 1, 6], ["PR", 4, 0, "auto_unroll_max_step$512"]]]], "r": [[0.00328043, 0.00328234, 0.00327265], 0, 142.733, 1681223445], "v": "v0.6"}
{"i": [["[\"fused_conv1x1_bn_relu_no_share_input\", 1, 56, 56, 256, 4, 64]", "cuda -keys=cuda,gpu -max_num_threads=1024 -model=unknown -thread_warp_size=32", [-1, 16, 64, 49152, 2147483647, 1024, 8, 32], "", 0, []], [[], [["CI", 6], ["CI", 4], ["SP", 2, 0, 1, [1, 1, 1, 1], 1], ["SP", 2, 5, 64, [1, 4, 2, 2], 1], ["SP", 2, 10, 56, [1, 4, 1, 2], 1], ["SP", 2, 15, 56, [4, 1, 2, 1], 1], ["SP", 2, 20, 4, [1, 2, 1, 1], 1], ["SP", 2, 25, 256, [8, 1], 1], ["RE", 2, [0, 5, 10, 15, 20, 1, 6, 11, 16, 21, 2, 7, 12, 17, 22, 25, 26, 3, 8, 13, 18, 23, 27, 4, 9, 14, 19, 24]], ["FSP", 7, 0, 2, 3], ["FSP", 7, 4, 3, 3], ["FSP", 7, 8, 4, 3], ["FSP", 7, 12, 5, 3], ["FSP", 7, 16, 6, 3], ["RE", 7, [0, 4, 8, 12, 16, 1, 5, 9, 13, 17, 2, 6, 10, 14, 18, 3, 7, 11, 15, 19]], ["CA", 2, 7, 14], ["CHR", 1, "shared", [2]], ["CA", 2, 3, 15], ["CHR", 0, "shared", [3]], ["CA", 1, 4, 15], ["FU", 9, [0, 1, 2, 3, 4]], ["AN", 9, 0, 5], ["FU", 9, [1, 2, 3, 4, 5]], ["AN", 9, 1, 4], ["FU", 9, [2, 3, 4, 5, 6]], ["AN", 9, 2, 6], ["FU", 3, [0, 1, 2]], ["SP", 3, 0, 32, [1], 1], ["AN", 3, 1, 2], ["FFSP", 3, 0, [6, 5, 4, 3, 2], 1, 1], ["AN", 3, 1, 6], ["FU", 1, [0, 1, 2, 3, 4]], ["SP", 1, 0, 128, [1], 1], ["AN", 1, 1, 2], ["FFSP", 1, 0, [6, 5, 4, 3, 2], 1, 1], ["AN", 1, 1, 6], ["PR", 4, 0, "auto_unroll_max_step$16"]]]], "r": [[0.00151143, 0.00151057, 0.00151156], 0, 130.927, 1681223434], "v": "v0.6"}
{"i": [["[\"fused_conv1x1_bn_relu_no_share_input\", 1, 56, 56, 256, 4, 64]", "cuda -keys=cuda,gpu -max_num_threads=1024 -model=unknown -thread_warp_size=32", [-1, 16, 64, 49152, 2147483647, 1024, 8, 32], "", 0, []], [[], [["CI", 6], ["CI", 4], ["SP", 2, 0, 1, [1, 1, 1, 1], 1], ["SP", 2, 5, 64, [1, 4, 8, 2], 1], ["SP", 2, 10, 56, [1, 1, 7, 1], 1], ["SP", 2, 15, 56, [1, 4, 1, 1], 1], ["SP", 2, 20, 4, [1, 2, 1, 2], 1], ["SP", 2, 25, 256, [1, 4], 1], ["RE", 2, [0, 5, 10, 15, 20, 1, 6, 11, 16, 21, 2, 7, 12, 17, 22, 25, 26, 3, 8, 13, 18, 23, 27, 4, 9, 14, 19, 24]], ["FSP", 7, 0, 2, 3], ["FSP", 7, 4, 3, 3], ["FSP", 7, 8, 4, 3], ["FSP", 7, 12, 5, 3], ["FSP", 7, 16, 6, 3], ["RE", 7, [0, 4, 8, 12, 16, 1, 5, 9, 13, 17, 2, 6, 10, 14, 18, 3, 7, 11, 15, 19]], ["CA", 2, 7, 14], ["CHR", 1, "shared", [2]], ["CA", 2, 3, 15], ["CHR", 0, "shared", [3]], ["CA", 1, 4, 15], ["FU", 9, [0, 1, 2, 3, 4]], ["AN", 9, 0, 5], ["FU", 9, [1, 2, 3, 4, 5]], ["AN", 9, 1, 4], ["FU", 9, [2, 3, 4, 5, 6]], ["AN", 9, 2, 6], ["FU", 3, [0, 1, 2]], ["SP", 3, 0, 8, [4], 1], ["AN", 3, 1, 2], ["FFSP", 3, 0, [6, 5, 4, 3, 2], 1, 1], ["AN", 3, 1, 6], ["FU", 1, [0, 1, 2, 3, 4]], ["SP", 1, 0, 56, [1], 1], ["AN", 1, 1, 2], ["FFSP", 1, 0, [6, 5, 4, 3, 2], 1, 1], ["AN", 1, 1, 6], ["PR", 4, 0, "auto_unroll_max_step$512"]]]], "r": [[0.00129978, 0.00130036, 0.00130227], 0, 147.297, 1681223449], "v": "v0.6"}
{"i": [["[\"fused_conv1x1_bn_relu_no_share_input\", 1, 56, 56, 256, 4, 64]", "cuda -keys=cuda,gpu -max_num_threads=1024 -model=unknown -thread_warp_size=32", [-1, 16, 64, 49152, 2147483647, 1024, 8, 32], "", 0, []], [[], [["CI", 6], ["CI", 4], ["SP", 2, 0, 1, [1, 1, 1, 1], 1], ["SP", 2, 5, 64, [1, 1, 2, 1], 1], ["SP", 2, 10, 56, [1, 2, 1, 2], 1], ["SP", 2, 15, 56, [1, 2, 1, 28], 1], ["SP", 2, 20, 4, [1, 1, 1, 1], 1], ["SP", 2, 25, 256, [16, 1], 1], ["RE", 2, [0, 5, 10, 15, 20, 1, 6, 11, 16, 21, 2, 7, 12, 17, 22, 25, 26, 3, 8, 13, 18, 23, 27, 4, 9, 14, 19, 24]], ["FSP", 7, 0, 2, 3], ["FSP", 7, 4, 3, 3], ["FSP", 7, 8, 4, 3], ["FSP", 7, 12, 5, 3], ["FSP", 7, 16, 6, 3], ["RE", 7, [0, 4, 8, 12, 16, 1, 5, 9, 13, 17, 2, 6, 10, 14, 18, 3, 7, 11, 15, 19]], ["CA", 2, 7, 14], ["CHR", 1, "shared", [2]], ["CA", 2, 3, 15], ["CHR", 0, "shared", [3]], ["CA", 1, 4, 15], ["FU", 9, [0, 1, 2, 3, 4]], ["AN", 9, 0, 5], ["FU", 9, [1, 2, 3, 4, 5]], ["AN", 9, 1, 4], ["FU", 9, [2, 3, 4, 5, 6]], ["AN", 9, 2, 6], ["FU", 3, [0, 1, 2]], ["SP", 3, 0, 32, [1], 1], ["AN", 3, 1, 2], ["FFSP", 3, 0, [6, 5, 4, 3, 2], 1, 1], ["AN", 3, 1, 6], ["FU", 1, [0, 1, 2, 3, 4]], ["SP", 1, 0, 128, [1], 1], ["AN", 1, 1, 2], ["FFSP", 1, 0, [6, 5, 4, 3, 2], 1, 1], ["AN", 1, 1, 6], ["PR", 4, 0, "auto_unroll_max_step$64"]]]], "r": [[0.00880227, 0.00879184, 0.00880554], 0, 149.644, 1681223453], "v": "v0.6"}
{"i": [["[\"fused_conv1x1_bn_relu_no_share_input\", 1, 56, 56, 256, 4, 64]", "cuda -keys=cuda,gpu -max_num_threads=1024 -model=unknown -thread_warp_size=32", [-1, 16, 64, 49152, 2147483647, 1024, 8, 32], "", 0, []], [[], [["CI", 6], ["CI", 4], ["SP", 2, 0, 1, [1, 1, 1, 1], 1], ["SP", 2, 5, 64, [2, 8, 1, 1], 1], ["SP", 2, 10, 56, [1, 4, 2, 7], 1], ["SP", 2, 15, 56, [1, 2, 1, 1], 1], ["SP", 2, 20, 4, [2, 2, 1, 1], 1], ["SP", 2, 25, 256, [2, 2], 1], ["RE", 2, [0, 5, 10, 15, 20, 1, 6, 11, 16, 21, 2, 7, 12, 17, 22, 25, 26, 3, 8, 13, 18, 23, 27, 4, 9, 14, 19, 24]], ["FSP", 7, 0, 2, 3], ["FSP", 7, 4, 3, 3], ["FSP", 7, 8, 4, 3], ["FSP", 7, 12, 5, 3], ["FSP", 7, 16, 6, 3], ["RE", 7, [0, 4, 8, 12, 16, 1, 5, 9, 13, 17, 2, 6, 10, 14, 18, 3, 7, 11, 15, 19]], ["CA", 2, 7, 14], ["CHR", 1, "shared", [2]], ["CA", 2, 3, 15], ["CHR", 0, "shared", [3]], ["CA", 1, 4, 15], ["FU", 9, [0, 1, 2, 3, 4]], ["AN", 9, 0, 5], ["FU", 9, [1, 2, 3, 4, 5]], ["AN", 9, 1, 4], ["FU", 9, [2, 3, 4, 5, 6]], ["AN", 9, 2, 6], ["FU", 3, [0, 1, 2]], ["SP", 3, 0, 4, [1], 1], ["AN", 3, 1, 2], ["FFSP", 3, 0, [6, 5, 4, 3, 2], 1, 1], ["AN", 3, 1, 6], ["FU", 1, [0, 1, 2, 3, 4]], ["SP", 1, 0, 56, [1], 1], ["AN", 1, 1, 2], ["FFSP", 1, 0, [6, 5, 4, 3, 2], 1, 1], ["AN", 1, 1, 6], ["PR", 4, 0, "auto_unroll_max_step$0"]]]], "r": [[0.000491921, 0.000491421, 0.00049102], 0, 149.723, 1681223457], "v": "v0.6"}
{"i": [["[\"fused_conv1x1_bn_relu_no_share_input\", 1, 56, 56, 256, 4, 64]", "cuda -keys=cuda,gpu -max_num_threads=1024 -model=unknown -thread_warp_size=32", [-1, 16, 64, 49152, 2147483647, 1024, 8, 32], "", 0, []], [[], [["CI", 6], ["CI", 4], ["SP", 2, 0, 1, [1, 1, 1, 1], 1], ["SP", 2, 5, 64, [2, 8, 1, 1], 1], ["SP", 2, 10, 56, [1, 2, 1, 1], 1], ["SP", 2, 15, 56, [1, 4, 2, 1], 1], ["SP", 2, 20, 4, [2, 1, 2, 1], 1], ["SP", 2, 25, 256, [1, 4], 1], ["RE", 2, [0, 5, 10, 15, 20, 1, 6, 11, 16, 21, 2, 7, 12, 17, 22, 25, 26, 3, 8, 13, 18, 23, 27, 4, 9, 14, 19, 24]], ["FSP", 7, 0, 2, 3], ["FSP", 7, 4, 3, 3], ["FSP", 7, 8, 4, 3], ["FSP", 7, 12, 5, 3], ["FSP", 7, 16, 6, 3], ["RE", 7, [0, 4, 8, 12, 16, 1, 5, 9, 13, 17, 2, 6, 10, 14, 18, 3, 7, 11, 15, 19]], ["CA", 2, 7, 14], ["CHR", 1, "shared", [2]], ["CA", 2, 3, 15], ["CHR", 0, "shared", [3]], ["CA", 1, 4, 15], ["FU", 9, [0, 1, 2, 3, 4]], ["AN", 9, 0, 5], ["FU", 9, [1, 2, 3, 4, 5]], ["AN", 9, 1, 4], ["FU", 9, [2, 3, 4, 5, 6]], ["AN", 9, 2, 6], ["FU", 3, [0, 1, 2]], ["SP", 3, 0, 8, [1], 1], ["AN", 3, 1, 2], ["FFSP", 3, 0, [6, 5, 4, 3, 2], 1, 1], ["AN", 3, 1, 6], ["FU", 1, [0, 1, 2, 3, 4]], ["SP", 1, 0, 32, [1], 1], ["AN", 1, 1, 2], ["FFSP", 1, 0, [6, 5, 4, 3, 2], 1, 1], ["AN", 1, 1, 6], ["PR", 4, 0, "auto_unroll_max_step$64"]]]], "r": [[0.000313924, 0.000314254, 0.00031406], 0, 149.736, 1681223461], "v": "v0.6"}
{"i": [["[\"fused_conv1x1_bn_relu_no_share_input\", 1, 56, 56, 256, 4, 64]", "cuda -keys=cuda,gpu -max_num_threads=1024 -model=unknown -thread_warp_size=32", [-1, 16, 64, 49152, 2147483647, 1024, 8, 32], "", 0, []], [[], [["CI", 6], ["CI", 4], ["SP", 2, 0, 1, [1, 1, 1, 1], 1], ["SP", 2, 5, 64, [2, 4, 2, 1], 1], ["SP", 2, 10, 56, [1, 2, 2, 1], 1], ["SP", 2, 15, 56, [1, 56, 1, 1], 1], ["SP", 2, 20, 4, [2, 2, 1, 1], 1], ["SP", 2, 25, 256, [2, 1], 1], ["RE", 2, [0, 5, 10, 15, 20, 1, 6, 11, 16, 21, 2, 7, 12, 17, 22, 25, 26, 3, 8, 13, 18, 23, 27, 4, 9, 14, 19, 24]], ["FSP", 7, 0, 2, 3], ["FSP", 7, 4, 3, 3], ["FSP", 7, 8, 4, 3], ["FSP", 7, 12, 5, 3], ["FSP", 7, 16, 6, 3], ["RE", 7, [0, 4, 8, 12, 16, 1, 5, 9, 13, 17, 2, 6, 10, 14, 18, 3, 7, 11, 15, 19]], ["CA", 2, 7, 14], ["CHR", 1, "shared", [2]], ["CA", 2, 3, 15], ["CHR", 0, "shared", [3]], ["CA", 1, 4, 15], ["FU", 9, [0, 1, 2, 3, 4]], ["AN", 9, 0, 5], ["FU", 9, [1, 2, 3, 4, 5]], ["AN", 9, 1, 4], ["FU", 9, [2, 3, 4, 5, 6]], ["AN", 9, 2, 6], ["FU", 3, [0, 1, 2]], ["SP", 3, 0, 4, [2], 1], ["AN", 3, 1, 2], ["FFSP", 3, 0, [6, 5, 4, 3, 2], 1, 1], ["AN", 3, 1, 6], ["FU", 1, [0, 1, 2, 3, 4]], ["SP", 1, 0, 8, [1], 1], ["AN", 1, 1, 2], ["FFSP", 1, 0, [6, 5, 4, 3, 2], 1, 1], ["AN", 1, 1, 6], ["PR", 4, 0, "auto_unroll_max_step$0"]]]], "r": [[0.000651975, 0.000651083, 0.00065199], 0, 149.233, 1681223464], "v": "v0.6"}
{"i": [["[\"fused_conv1x1_bn_relu_no_share_input\", 1, 56, 56, 256, 4, 64]", "cuda -keys=cuda,gpu -max_num_threads=1024 -model=unknown -thread_warp_size=32", [-1, 16, 64, 49152, 2147483647, 1024, 8, 32], "", 0, []], [[], [["CI", 6], ["CI", 4], ["SP", 2, 0, 1, [1, 1, 1, 1], 1], ["SP", 2, 5, 64, [2, 8, 1, 1], 1], ["SP", 2, 10, 56, [1, 1, 2, 1], 1], ["SP", 2, 15, 56, [1, 4, 2, 1], 1], ["SP", 2, 20, 4, [2, 2, 1, 1], 1], ["SP", 2, 25, 256, [1, 4], 1], ["RE", 2, [0, 5, 10, 15, 20, 1, 6, 11, 16, 21, 2, 7, 12, 17, 22, 25, 26, 3, 8, 13, 18, 23, 27, 4, 9, 14, 19, 24]], ["FSP", 7, 0, 2, 3], ["FSP", 7, 4, 3, 3], ["FSP", 7, 8, 4, 3], ["FSP", 7, 12, 5, 3], ["FSP", 7, 16, 6, 3], ["RE", 7, [0, 4, 8, 12, 16, 1, 5, 9, 13, 17, 2, 6, 10, 14, 18, 3, 7, 11, 15, 19]], ["CA", 2, 7, 14], ["CHR", 1, "shared", [2]], ["CA", 2, 3, 15], ["CHR", 0, "shared", [3]], ["CA", 1, 4, 15], ["FU", 9, [0, 1, 2, 3, 4]], ["AN", 9, 0, 5], ["FU", 9, [1, 2, 3, 4, 5]], ["AN", 9, 1, 4], ["FU", 9, [2, 3, 4, 5, 6]], ["AN", 9, 2, 6], ["FU", 3, [0, 1, 2]], ["SP", 3, 0, 8, [2], 1], ["AN", 3, 1, 2], ["FFSP", 3, 0, [6, 5, 4, 3, 2], 1, 1], ["AN", 3, 1, 6], ["FU", 1, [0, 1, 2, 3, 4]], ["SP", 1, 0, 32, [1], 1], ["AN", 1, 1, 2], ["FFSP", 1, 0, [6, 5, 4, 3, 2], 1, 1], ["AN", 1, 1, 6], ["PR", 4, 0, "auto_unroll_max_step$64"]]]], "r": [[0.000324315, 0.000324472, 0.000324572], 0, 149.544, 1681223468], "v": "v0.6"}
{"i": [["[\"fused_conv1x1_bn_relu_no_share_input\", 1, 56, 56, 256, 4, 64]", "cuda -keys=cuda,gpu -max_num_threads=1024 -model=unknown -thread_warp_size=32", [-1, 16, 64, 49152, 2147483647, 1024, 8, 32], "", 0, []], [[], [["CI", 6], ["CI", 4], ["SP", 2, 0, 1, [1, 1, 1, 1], 1], ["SP", 2, 5, 64, [1, 1, 2, 8], 1], ["SP", 2, 10, 56, [1, 2, 2, 1], 1], ["SP", 2, 15, 56, [4, 1, 1, 14], 1], ["SP", 2, 20, 4, [2, 2, 1, 1], 1], ["SP", 2, 25, 256, [1, 1], 1], ["RE", 2, [0, 5, 10, 15, 20, 1, 6, 11, 16, 21, 2, 7, 12, 17, 22, 25, 26, 3, 8, 13, 18, 23, 27, 4, 9, 14, 19, 24]], ["FSP", 7, 0, 2, 3], ["FSP", 7, 4, 3, 3], ["FSP", 7, 8, 4, 3], ["FSP", 7, 12, 5, 3], ["FSP", 7, 16, 6, 3], ["RE", 7, [0, 4, 8, 12, 16, 1, 5, 9, 13, 17, 2, 6, 10, 14, 18, 3, 7, 11, 15, 19]], ["CA", 2, 7, 14], ["CHR", 1, "shared", [2]], ["CA", 2, 3, 15], ["CHR", 0, "shared", [3]], ["CA", 1, 4, 15], ["FU", 9, [0, 1, 2, 3, 4]], ["AN", 9, 0, 5], ["FU", 9, [1, 2, 3, 4, 5]], ["AN", 9, 1, 4], ["FU", 9, [2, 3, 4, 5, 6]], ["AN", 9, 2, 6], ["FU", 3, [0, 1, 2]], ["SP", 3, 0, 32, [1], 1], ["AN", 3, 1, 2], ["FFSP", 3, 0, [6, 5, 4, 3, 2], 1, 1], ["AN", 3, 1, 6], ["FU", 1, [0, 1, 2, 3, 4]], ["SP", 1, 0, 64, [1], 1], ["AN", 1, 1, 2], ["FFSP", 1, 0, [6, 5, 4, 3, 2], 1, 1], ["AN", 1, 1, 6], ["PR", 4, 0, "auto_unroll_max_step$0"]]]], "r": [[0.0340715, 0.0340704, 0.0340608], 0, 150.974, 1681223472], "v": "v0.6"}
{"i": [["[\"fused_conv1x1_bn_relu_no_share_input\", 1, 56, 56, 256, 4, 64]", "cuda -keys=cuda,gpu -max_num_threads=1024 -model=unknown -thread_warp_size=32", [-1, 16, 64, 49152, 2147483647, 1024, 8, 32], "", 0, []], [[], [["CI", 6], ["CI", 4], ["SP", 2, 0, 1, [1, 1, 1, 1], 1], ["SP", 2, 5, 64, [1, 1, 1, 1], 1], ["SP", 2, 10, 56, [1, 14, 2, 2], 1], ["SP", 2, 15, 56, [1, 4, 1, 1], 1], ["SP", 2, 20, 4, [1, 4, 1, 1], 1], ["SP", 2, 25, 256, [16, 1], 1], ["RE", 2, [0, 5, 10, 15, 20, 1, 6, 11, 16, 21, 2, 7, 12, 17, 22, 25, 26, 3, 8, 13, 18, 23, 27, 4, 9, 14, 19, 24]], ["FSP", 7, 0, 2, 3], ["FSP", 7, 4, 3, 3], ["FSP", 7, 8, 4, 3], ["FSP", 7, 12, 5, 3], ["FSP", 7, 16, 6, 3], ["RE", 7, [0, 4, 8, 12, 16, 1, 5, 9, 13, 17, 2, 6, 10, 14, 18, 3, 7, 11, 15, 19]], ["CA", 2, 7, 14], ["CHR", 1, "shared", [2]], ["CA", 2, 3, 15], ["CHR", 0, "shared", [3]], ["CA", 1, 4, 15], ["FU", 9, [0, 1, 2, 3, 4]], ["AN", 9, 0, 5], ["FU", 9, [1, 2, 3, 4, 5]], ["AN", 9, 1, 4], ["FU", 9, [2, 3, 4, 5, 6]], ["AN", 9, 2, 6], ["FU", 3, [0, 1, 2]], ["SP", 3, 0, 32, [1], 1], ["AN", 3, 1, 2], ["FFSP", 3, 0, [6, 5, 4, 3, 2], 1, 1], ["AN", 3, 1, 6], ["FU", 1, [0, 1, 2, 3, 4]], ["SP", 1, 0, 64, [1], 1], ["AN", 1, 1, 2], ["FFSP", 1, 0, [6, 5, 4, 3, 2], 1, 1], ["AN", 1, 1, 6], ["PR", 4, 0, "auto_unroll_max_step$1024"]]]], "r": [[0.000208555, 0.000208444, 0.000209172], 0, 149.666, 1681223476], "v": "v0.6"}
