python/models/resnext/kernel_configs/resnext_imagenet_50_fused_conv1x1_bn_relu_4_56_56_256_8_64_s2.log
{"i": [["[\"fused_conv1x1_bn_relu_stride\", 4, 56, 56, 256, 8, 64, 2]", "cuda -keys=cuda,gpu -max_num_threads=1024 -model=unknown -thread_warp_size=32", [-1, 16, 64, 49152, 2147483647, 1024, 8, 32], "", 0, []], [[], [["CI", 6], ["CI", 4], ["CHW", 2, "local"], ["SP", 2, 0, 4, [1, 1, 1, 4], 1], ["SP", 2, 5, 64, [1, 8, 2, 4], 1], ["SP", 2, 10, 28, [1, 2, 1, 1], 1], ["SP", 2, 15, 28, [2, 2, 7, 1], 1], ["SP", 2, 20, 8, [2, 1, 1, 1], 1], ["SP", 2, 25, 256, [2, 1], 1], ["RE", 2, [0, 5, 10, 15, 20, 1, 6, 11, 16, 21, 2, 7, 12, 17, 22, 25, 26, 3, 8, 13, 18, 23, 27, 4, 9, 14, 19, 24]], ["FSP", 3, 0, 3, 3], ["FSP", 3, 4, 4, 3], ["FSP", 3, 8, 5, 3], ["FSP", 3, 12, 6, 3], ["FSP", 3, 16, 7, 3], ["RE", 3, [0, 4, 8, 12, 16, 1, 5, 9, 13, 17, 2, 6, 10, 14, 18, 3, 7, 11, 15, 19]], ["CA", 2, 3, 14], ["CHR", 1, "shared", [2]], ["CA", 2, 3, 15], ["CHR", 0, "shared", [3]], ["CA", 1, 4, 15], ["FU", 10, [0, 1, 2, 3, 4]], ["SP", 10, 0, 6422528, [32], 1], ["AN", 10, 0, 5], ["AN", 10, 1, 6], ["FU", 5, [0, 1, 2, 3, 4]], ["AN", 5, 0, 5], ["FU", 5, [1, 2, 3, 4, 5]], ["AN", 5, 1, 4], ["FU", 5, [2, 3, 4, 5, 6]], ["AN", 5, 2, 6], ["FU", 3, [0, 1, 2]], ["SP", 3, 0, 16, [1], 1], ["AN", 3, 1, 2], ["FFSP", 3, 0, [7, 6, 5, 4, 3], 1, 1], ["AN", 3, 1, 6], ["FU", 1, [0, 1, 2, 3]], ["SP", 1, 0, 104, [1], 1], ["AN", 1, 1, 2], ["FFSP", 1, 0, [7, 6, 5, 4, 3], 1, 1], ["AN", 1, 1, 6], ["PR", 4, 0, "auto_unroll_max_step$64"]]]], "r": [[0.00768352, 0.00767369, 0.00769054], 0, 12.6683, 1661923025], "v": "v0.6"}
{"i": [["[\"fused_conv1x1_bn_relu_stride\", 4, 56, 56, 256, 8, 64, 2]", "cuda -keys=cuda,gpu -max_num_threads=1024 -model=unknown -thread_warp_size=32", [-1, 16, 64, 49152, 2147483647, 1024, 8, 32], "", 0, []], [[], [["CI", 6], ["CI", 4], ["CHW", 2, "local"], ["SP", 2, 0, 4, [1, 1, 1, 4], 1], ["SP", 2, 5, 64, [2, 4, 1, 8], 1], ["SP", 2, 10, 28, [1, 14, 1, 1], 1], ["SP", 2, 15, 28, [1, 7, 4, 1], 1], ["SP", 2, 20, 8, [1, 1, 1, 4], 1], ["SP", 2, 25, 256, [1, 1], 1], ["RE", 2, [0, 5, 10, 15, 20, 1, 6, 11, 16, 21, 2, 7, 12, 17, 22, 25, 26, 3, 8, 13, 18, 23, 27, 4, 9, 14, 19, 24]], ["FSP", 3, 0, 3, 3], ["FSP", 3, 4, 4, 3], ["FSP", 3, 8, 5, 3], ["FSP", 3, 12, 6, 3], ["FSP", 3, 16, 7, 3], ["RE", 3, [0, 4, 8, 12, 16, 1, 5, 9, 13, 17, 2, 6, 10, 14, 18, 3, 7, 11, 15, 19]], ["CA", 2, 3, 14], ["CHR", 1, "shared", [2]], ["CA", 2, 3, 15], ["CHR", 0, "shared", [3]], ["CA", 1, 4, 15], ["FU", 10, [0, 1, 2, 3, 4]], ["SP", 10, 0, 6422528, [32], 1], ["AN", 10, 0, 5], ["AN", 10, 1, 6], ["FU", 5, [0, 1, 2, 3, 4]], ["AN", 5, 0, 5], ["FU", 5, [1, 2, 3, 4, 5]], ["AN", 5, 1, 4], ["FU", 5, [2, 3, 4, 5, 6]], ["AN", 5, 2, 6], ["FU", 3, [0, 1, 2]], ["SP", 3, 0, 32, [32], 1], ["AN", 3, 1, 2], ["FFSP", 3, 0, [7, 6, 5, 4, 3], 1, 1], ["AN", 3, 1, 6], ["FU", 1, [0, 1, 2, 3]], ["SP", 1, 0, 28, [1], 1], ["AN", 1, 1, 2], ["FFSP", 1, 0, [7, 6, 5, 4, 3], 1, 1], ["AN", 1, 1, 6], ["PR", 4, 0, "auto_unroll_max_step$0"]]]], "r": [[0.0146235, 0.0146175, 0.0146106], 0, 5.05247, 1661923018], "v": "v0.6"}
{"i": [["[\"fused_conv1x1_bn_relu_stride\", 4, 56, 56, 256, 8, 64, 2]", "cuda -keys=cuda,gpu -max_num_threads=1024 -model=unknown -thread_warp_size=32", [-1, 16, 64, 49152, 2147483647, 1024, 8, 32], "", 0, []], [[], [["CI", 6], ["CI", 4], ["CHW", 2, "local"], ["SP", 2, 0, 4, [1, 1, 1, 1], 1], ["SP", 2, 5, 64, [1, 2, 2, 1], 1], ["SP", 2, 10, 28, [1, 2, 1, 7], 1], ["SP", 2, 15, 28, [1, 1, 1, 14], 1], ["SP", 2, 20, 8, [1, 2, 2, 2], 1], ["SP", 2, 25, 256, [4, 1], 1], ["RE", 2, [0, 5, 10, 15, 20, 1, 6, 11, 16, 21, 2, 7, 12, 17, 22, 25, 26, 3, 8, 13, 18, 23, 27, 4, 9, 14, 19, 24]], ["FSP", 3, 0, 3, 3], ["FSP", 3, 4, 4, 3], ["FSP", 3, 8, 5, 3], ["FSP", 3, 12, 6, 3], ["FSP", 3, 16, 7, 3], ["RE", 3, [0, 4, 8, 12, 16, 1, 5, 9, 13, 17, 2, 6, 10, 14, 18, 3, 7, 11, 15, 19]], ["CA", 2, 3, 14], ["CHR", 1, "shared", [2]], ["CA", 2, 3, 15], ["CHR", 0, "shared", [3]], ["CA", 1, 4, 15], ["FU", 10, [0, 1, 2, 3, 4]], ["SP", 10, 0, 6422528, [32], 1], ["AN", 10, 0, 5], ["AN", 10, 1, 6], ["FU", 5, [0, 1, 2, 3, 4]], ["AN", 5, 0, 5], ["FU", 5, [1, 2, 3, 4, 5]], ["AN", 5, 1, 4], ["FU", 5, [2, 3, 4, 5, 6]], ["AN", 5, 2, 6], ["FU", 3, [0, 1, 2]], ["SP", 3, 0, 32, [1], 1], ["AN", 3, 1, 2], ["FFSP", 3, 0, [7, 6, 5, 4, 3], 1, 1], ["AN", 3, 1, 6], ["FU", 1, [0, 1, 2, 3]], ["SP", 1, 0, 156, [1], 1], ["AN", 1, 1, 2], ["FFSP", 1, 0, [7, 6, 5, 4, 3], 1, 1], ["AN", 1, 1, 6], ["PR", 4, 0, "auto_unroll_max_step$64"]]]], "r": [[0.0129072, 0.012833, 0.0130365], 0, 15.5469, 1661923029], "v": "v0.6"}
{"i": [["[\"fused_conv1x1_bn_relu_stride\", 4, 56, 56, 256, 8, 64, 2]", "cuda -keys=cuda,gpu -max_num_threads=1024 -model=unknown -thread_warp_size=32", [-1, 16, 64, 49152, 2147483647, 1024, 8, 32], "", 0, []], [[], [["CI", 6], ["CI", 4], ["CHW", 2, "local"], ["SP", 2, 0, 4, [1, 1, 4, 1], 1], ["SP", 2, 5, 64, [4, 8, 1, 1], 1], ["SP", 2, 10, 28, [1, 2, 7, 1], 1], ["SP", 2, 15, 28, [2, 7, 1, 2], 1], ["SP", 2, 20, 8, [1, 2, 2, 1], 1], ["SP", 2, 25, 256, [1, 1], 1], ["RE", 2, [0, 5, 10, 15, 20, 1, 6, 11, 16, 21, 2, 7, 12, 17, 22, 25, 26, 3, 8, 13, 18, 23, 27, 4, 9, 14, 19, 24]], ["FSP", 3, 0, 3, 3], ["FSP", 3, 4, 4, 3], ["FSP", 3, 8, 5, 3], ["FSP", 3, 12, 6, 3], ["FSP", 3, 16, 7, 3], ["RE", 3, [0, 4, 8, 12, 16, 1, 5, 9, 13, 17, 2, 6, 10, 14, 18, 3, 7, 11, 15, 19]], ["CA", 2, 3, 14], ["CHR", 1, "shared", [2]], ["CA", 2, 3, 15], ["CHR", 0, "shared", [3]], ["CA", 1, 4, 15], ["FU", 10, [0, 1, 2, 3, 4]], ["SP", 10, 0, 6422528, [64], 1], ["AN", 10, 0, 5], ["AN", 10, 1, 6], ["FU", 5, [0, 1, 2, 3, 4]], ["AN", 5, 0, 5], ["FU", 5, [1, 2, 3, 4, 5]], ["AN", 5, 1, 4], ["FU", 5, [2, 3, 4, 5, 6]], ["AN", 5, 2, 6], ["FU", 3, [0, 1, 2]], ["SP", 3, 0, 2, [1], 1], ["AN", 3, 1, 2], ["FFSP", 3, 0, [7, 6, 5, 4, 3], 1, 1], ["AN", 3, 1, 6], ["FU", 1, [0, 1, 2, 3]], ["SP", 1, 0, 156, [1], 1], ["AN", 1, 1, 2], ["FFSP", 1, 0, [7, 6, 5, 4, 3], 1, 1], ["AN", 1, 1, 6], ["PR", 4, 0, "auto_unroll_max_step$0"]]]], "r": [[0.00781255, 0.00781248, 0.00781196], 0, 6.14954, 1661923019], "v": "v0.6"}
{"i": [["[\"fused_conv1x1_bn_relu_stride\", 4, 56, 56, 256, 8, 64, 2]", "cuda -keys=cuda,gpu -max_num_threads=1024 -model=unknown -thread_warp_size=32", [-1, 16, 64, 49152, 2147483647, 1024, 8, 32], "", 0, []], [[], [["CI", 6], ["CI", 4], ["CHW", 2, "local"], ["SP", 2, 0, 4, [1, 1, 1, 1], 1], ["SP", 2, 5, 64, [1, 2, 2, 1], 1], ["SP", 2, 10, 28, [1, 2, 1, 7], 1], ["SP", 2, 15, 28, [1, 7, 1, 2], 1], ["SP", 2, 20, 8, [1, 2, 2, 2], 1], ["SP", 2, 25, 256, [1, 4], 1], ["RE", 2, [0, 5, 10, 15, 20, 1, 6, 11, 16, 21, 2, 7, 12, 17, 22, 25, 26, 3, 8, 13, 18, 23, 27, 4, 9, 14, 19, 24]], ["FSP", 3, 0, 3, 3], ["FSP", 3, 4, 4, 3], ["FSP", 3, 8, 5, 3], ["FSP", 3, 12, 6, 3], ["FSP", 3, 16, 7, 3], ["RE", 3, [0, 4, 8, 12, 16, 1, 5, 9, 13, 17, 2, 6, 10, 14, 18, 3, 7, 11, 15, 19]], ["CA", 2, 3, 14], ["CHR", 1, "shared", [2]], ["CA", 2, 3, 15], ["CHR", 0, "shared", [3]], ["CA", 1, 4, 15], ["FU", 10, [0, 1, 2, 3, 4]], ["SP", 10, 0, 6422528, [32], 1], ["AN", 10, 0, 5], ["AN", 10, 1, 6], ["FU", 5, [0, 1, 2, 3, 4]], ["AN", 5, 0, 5], ["FU", 5, [1, 2, 3, 4, 5]], ["AN", 5, 1, 4], ["FU", 5, [2, 3, 4, 5, 6]], ["AN", 5, 2, 6], ["FU", 3, [0, 1, 2]], ["SP", 3, 0, 32, [1], 1], ["AN", 3, 1, 2], ["FFSP", 3, 0, [7, 6, 5, 4, 3], 1, 1], ["AN", 3, 1, 6], ["FU", 1, [0, 1, 2, 3]], ["SP", 1, 0, 156, [1], 1], ["AN", 1, 1, 2], ["FFSP", 1, 0, [7, 6, 5, 4, 3], 1, 1], ["AN", 1, 1, 6], ["PR", 4, 0, "auto_unroll_max_step$64"]]]], "r": [[0.000349464, 0.000349351, 0.000349461], 0, 9.87251, 1661923024], "v": "v0.6"}
{"i": [["[\"fused_conv1x1_bn_relu_stride\", 4, 56, 56, 256, 8, 64, 2]", "cuda -keys=cuda,gpu -max_num_threads=1024 -model=unknown -thread_warp_size=32", [-1, 16, 64, 49152, 2147483647, 1024, 8, 32], "", 0, []], [[], [["CI", 6], ["CI", 4], ["CHW", 2, "local"], ["SP", 2, 0, 4, [2, 1, 2, 1], 1], ["SP", 2, 5, 64, [1, 32, 1, 2], 1], ["SP", 2, 10, 28, [1, 2, 1, 14], 1], ["SP", 2, 15, 28, [1, 1, 1, 1], 1], ["SP", 2, 20, 8, [2, 2, 1, 1], 1], ["SP", 2, 25, 256, [2, 8], 1], ["RE", 2, [0, 5, 10, 15, 20, 1, 6, 11, 16, 21, 2, 7, 12, 17, 22, 25, 26, 3, 8, 13, 18, 23, 27, 4, 9, 14, 19, 24]], ["FSP", 3, 0, 3, 3], ["FSP", 3, 4, 4, 3], ["FSP", 3, 8, 5, 3], ["FSP", 3, 12, 6, 3], ["FSP", 3, 16, 7, 3], ["RE", 3, [0, 4, 8, 12, 16, 1, 5, 9, 13, 17, 2, 6, 10, 14, 18, 3, 7, 11, 15, 19]], ["CA", 2, 3, 14], ["CHR", 1, "shared", [2]], ["CA", 2, 3, 15], ["CHR", 0, "shared", [3]], ["CA", 1, 4, 15], ["FU", 10, [0, 1, 2, 3, 4]], ["SP", 10, 0, 6422528, [1], 1], ["AN", 10, 0, 5], ["AN", 10, 1, 6], ["FU", 5, [0, 1, 2, 3, 4]], ["AN", 5, 0, 5], ["FU", 5, [1, 2, 3, 4, 5]], ["AN", 5, 1, 4], ["FU", 5, [2, 3, 4, 5, 6]], ["AN", 5, 2, 6], ["FU", 3, [0, 1, 2]], ["SP", 3, 0, 32, [1], 1], ["AN", 3, 1, 2], ["FFSP", 3, 0, [7, 6, 5, 4, 3], 1, 1], ["AN", 3, 1, 6], ["FU", 1, [0, 1, 2, 3]], ["SP", 1, 0, 864, [1], 1], ["AN", 1, 1, 2], ["FFSP", 1, 0, [7, 6, 5, 4, 3], 1, 1], ["AN", 1, 1, 6], ["PR", 4, 0, "auto_unroll_max_step$64"]]]], "r": [[0.00523118, 0.00523081, 0.00523084], 0, 8.76028, 1661923023], "v": "v0.6"}
{"i": [["[\"fused_conv1x1_bn_relu_stride\", 4, 56, 56, 256, 8, 64, 2]", "cuda -keys=cuda,gpu -max_num_threads=1024 -model=unknown -thread_warp_size=32", [-1, 16, 64, 49152, 2147483647, 1024, 8, 32], "", 0, []], [[], [["CI", 6], ["CI", 4], ["CHW", 2, "local"], ["SP", 2, 0, 4, [1, 1, 2, 1], 1], ["SP", 2, 5, 64, [1, 1, 16, 1], 1], ["SP", 2, 10, 28, [2, 1, 1, 1], 1], ["SP", 2, 15, 28, [1, 2, 1, 1], 1], ["SP", 2, 20, 8, [1, 2, 1, 2], 1], ["SP", 2, 25, 256, [4, 1], 1], ["RE", 2, [0, 5, 10, 15, 20, 1, 6, 11, 16, 21, 2, 7, 12, 17, 22, 25, 26, 3, 8, 13, 18, 23, 27, 4, 9, 14, 19, 24]], ["FSP", 3, 0, 3, 3], ["FSP", 3, 4, 4, 3], ["FSP", 3, 8, 5, 3], ["FSP", 3, 12, 6, 3], ["FSP", 3, 16, 7, 3], ["RE", 3, [0, 4, 8, 12, 16, 1, 5, 9, 13, 17, 2, 6, 10, 14, 18, 3, 7, 11, 15, 19]], ["CA", 2, 3, 14], ["CHR", 1, "shared", [2]], ["CA", 2, 3, 15], ["CHR", 0, "shared", [3]], ["CA", 1, 4, 15], ["FU", 10, [0, 1, 2, 3, 4]], ["SP", 10, 0, 6422528, [2], 1], ["AN", 10, 0, 5], ["AN", 10, 1, 6], ["FU", 5, [0, 1, 2, 3, 4]], ["AN", 5, 0, 5], ["FU", 5, [1, 2, 3, 4, 5]], ["AN", 5, 1, 4], ["FU", 5, [2, 3, 4, 5, 6]], ["AN", 5, 2, 6], ["FU", 3, [0, 1, 2]], ["SP", 3, 0, 16, [1], 1], ["AN", 3, 1, 2], ["FFSP", 3, 0, [7, 6, 5, 4, 3], 1, 1], ["AN", 3, 1, 6], ["FU", 1, [0, 1, 2, 3]], ["SP", 1, 0, 8, [1], 1], ["AN", 1, 1, 2], ["FFSP", 1, 0, [7, 6, 5, 4, 3], 1, 1], ["AN", 1, 1, 6], ["PR", 4, 0, "auto_unroll_max_step$0"]]]], "r": [[0.00308042, 0.00307524, 0.00306745], 0, 11.5928, 1661923027], "v": "v0.6"}
{"i": [["[\"fused_conv1x1_bn_relu_stride\", 4, 56, 56, 256, 8, 64, 2]", "cuda -keys=cuda,gpu -max_num_threads=1024 -model=unknown -thread_warp_size=32", [-1, 16, 64, 49152, 2147483647, 1024, 8, 32], "", 0, []], [[], [["CI", 6], ["CI", 4], ["CHW", 2, "local"], ["SP", 2, 0, 4, [2, 1, 1, 2], 1], ["SP", 2, 5, 64, [1, 4, 2, 8], 1], ["SP", 2, 10, 28, [1, 14, 1, 1], 1], ["SP", 2, 15, 28, [1, 7, 4, 1], 1], ["SP", 2, 20, 8, [1, 1, 1, 4], 1], ["SP", 2, 25, 256, [1, 1], 1], ["RE", 2, [0, 5, 10, 15, 20, 1, 6, 11, 16, 21, 2, 7, 12, 17, 22, 25, 26, 3, 8, 13, 18, 23, 27, 4, 9, 14, 19, 24]], ["FSP", 3, 0, 3, 3], ["FSP", 3, 4, 4, 3], ["FSP", 3, 8, 5, 3], ["FSP", 3, 12, 6, 3], ["FSP", 3, 16, 7, 3], ["RE", 3, [0, 4, 8, 12, 16, 1, 5, 9, 13, 17, 2, 6, 10, 14, 18, 3, 7, 11, 15, 19]], ["CA", 2, 3, 14], ["CHR", 1, "shared", [2]], ["CA", 2, 3, 15], ["CHR", 0, "shared", [3]], ["CA", 1, 4, 15], ["FU", 10, [0, 1, 2, 3, 4]], ["SP", 10, 0, 6422528, [32], 1], ["AN", 10, 0, 5], ["AN", 10, 1, 6], ["FU", 5, [0, 1, 2, 3, 4]], ["AN", 5, 0, 5], ["FU", 5, [1, 2, 3, 4, 5]], ["AN", 5, 1, 4], ["FU", 5, [2, 3, 4, 5, 6]], ["AN", 5, 2, 6], ["FU", 3, [0, 1, 2]], ["SP", 3, 0, 32, [1], 1], ["AN", 3, 1, 2], ["FFSP", 3, 0, [7, 6, 5, 4, 3], 1, 1], ["AN", 3, 1, 6], ["FU", 1, [0, 1, 2, 3]], ["SP", 1, 0, 28, [1], 1], ["AN", 1, 1, 2], ["FFSP", 1, 0, [7, 6, 5, 4, 3], 1, 1], ["AN", 1, 1, 6], ["PR", 4, 0, "auto_unroll_max_step$0"]]]], "r": [[0.0145371, 0.0145317, 0.0145317], 0, 8.46475, 1661923022], "v": "v0.6"}
{"i": [["[\"fused_conv1x1_bn_relu_stride\", 4, 56, 56, 256, 8, 64, 2]", "cuda -keys=cuda,gpu -max_num_threads=1024 -model=unknown -thread_warp_size=32", [-1, 16, 64, 49152, 2147483647, 1024, 8, 32], "", 0, []], [[], [["CI", 6], ["CI", 4], ["CHW", 2, "local"], ["SP", 2, 0, 4, [1, 1, 1, 1], 1], ["SP", 2, 5, 64, [2, 4, 1, 4], 1], ["SP", 2, 10, 28, [1, 2, 2, 1], 1], ["SP", 2, 15, 28, [2, 2, 1, 1], 1], ["SP", 2, 20, 8, [1, 1, 2, 4], 1], ["SP", 2, 25, 256, [2, 16], 1], ["RE", 2, [0, 5, 10, 15, 20, 1, 6, 11, 16, 21, 2, 7, 12, 17, 22, 25, 26, 3, 8, 13, 18, 23, 27, 4, 9, 14, 19, 24]], ["FSP", 3, 0, 3, 3], ["FSP", 3, 4, 4, 3], ["FSP", 3, 8, 5, 3], ["FSP", 3, 12, 6, 3], ["FSP", 3, 16, 7, 3], ["RE", 3, [0, 4, 8, 12, 16, 1, 5, 9, 13, 17, 2, 6, 10, 14, 18, 3, 7, 11, 15, 19]], ["CA", 2, 3, 14], ["CHR", 1, "shared", [2]], ["CA", 2, 3, 15], ["CHR", 0, "shared", [3]], ["CA", 1, 4, 15], ["FU", 10, [0, 1, 2, 3, 4]], ["SP", 10, 0, 6422528, [32], 1], ["AN", 10, 0, 5], ["AN", 10, 1, 6], ["FU", 5, [0, 1, 2, 3, 4]], ["AN", 5, 0, 5], ["FU", 5, [1, 2, 3, 4, 5]], ["AN", 5, 1, 4], ["FU", 5, [2, 3, 4, 5, 6]], ["AN", 5, 2, 6], ["FU", 3, [0, 1, 2]], ["SP", 3, 0, 512, [1], 1], ["AN", 3, 1, 2], ["FFSP", 3, 0, [7, 6, 5, 4, 3], 1, 1], ["AN", 3, 1, 6], ["FU", 1, [0, 1, 2, 3]], ["SP", 1, 0, 96, [1], 1], ["AN", 1, 1, 2], ["FFSP", 1, 0, [7, 6, 5, 4, 3], 1, 1], ["AN", 1, 1, 6], ["PR", 4, 0, "auto_unroll_max_step$0"]]]], "r": [[0.00101318, 0.00101318, 0.0010132], 0, 6.19336, 1661923021], "v": "v0.6"}
{"i": [["[\"fused_conv1x1_bn_relu_stride\", 4, 56, 56, 256, 8, 64, 2]", "cuda -keys=cuda,gpu -max_num_threads=1024 -model=unknown -thread_warp_size=32", [-1, 16, 64, 49152, 2147483647, 1024, 8, 32], "", 0, []], [[], [["CI", 6], ["CI", 4], ["CHW", 2, "local"], ["SP", 2, 0, 4, [1, 4, 1, 1], 1], ["SP", 2, 5, 64, [1, 4, 1, 16], 1], ["SP", 2, 10, 28, [1, 1, 2, 2], 1], ["SP", 2, 15, 28, [1, 1, 4, 1], 1], ["SP", 2, 20, 8, [2, 1, 2, 1], 1], ["SP", 2, 25, 256, [1, 2], 1], ["RE", 2, [0, 5, 10, 15, 20, 1, 6, 11, 16, 21, 2, 7, 12, 17, 22, 25, 26, 3, 8, 13, 18, 23, 27, 4, 9, 14, 19, 24]], ["FSP", 3, 0, 3, 3], ["FSP", 3, 4, 4, 3], ["FSP", 3, 8, 5, 3], ["FSP", 3, 12, 6, 3], ["FSP", 3, 16, 7, 3], ["RE", 3, [0, 4, 8, 12, 16, 1, 5, 9, 13, 17, 2, 6, 10, 14, 18, 3, 7, 11, 15, 19]], ["CA", 2, 3, 14], ["CHR", 1, "shared", [2]], ["CA", 2, 3, 15], ["CHR", 0, "shared", [3]], ["CA", 1, 4, 15], ["FU", 10, [0, 1, 2, 3, 4]], ["SP", 10, 0, 6422528, [1], 1], ["AN", 10, 0, 5], ["AN", 10, 1, 6], ["FU", 5, [0, 1, 2, 3, 4]], ["AN", 5, 0, 5], ["FU", 5, [1, 2, 3, 4, 5]], ["AN", 5, 1, 4], ["FU", 5, [2, 3, 4, 5, 6]], ["AN", 5, 2, 6], ["FU", 3, [0, 1, 2]], ["SP", 3, 0, 64, [1], 1], ["AN", 3, 1, 2], ["FFSP", 3, 0, [7, 6, 5, 4, 3], 1, 1], ["AN", 3, 1, 6], ["FU", 1, [0, 1, 2, 3]], ["SP", 1, 0, 98, [14], 1], ["AN", 1, 1, 2], ["FFSP", 1, 0, [7, 6, 5, 4, 3], 1, 1], ["AN", 1, 1, 6], ["PR", 4, 0, "auto_unroll_max_step$512"]]]], "r": [[0.00809175, 0.00825282, 0.00822043], 0, 5.27634, 1661923017], "v": "v0.6"}
{"i": [["[\"fused_conv1x1_bn_relu_stride\", 4, 56, 56, 256, 8, 64, 2]", "cuda -keys=cuda,gpu -max_num_threads=1024 -model=unknown -thread_warp_size=32", [-1, 16, 64, 49152, 2147483647, 1024, 8, 32], "", 0, []], [[], [["CI", 6], ["CI", 4], ["CHW", 2, "local"], ["SP", 2, 0, 4, [1, 1, 1, 1], 1], ["SP", 2, 5, 64, [1, 4, 1, 8], 1], ["SP", 2, 10, 28, [2, 2, 1, 1], 1], ["SP", 2, 15, 28, [2, 1, 2, 1], 1], ["SP", 2, 20, 8, [1, 2, 1, 4], 1], ["SP", 2, 25, 256, [2, 16], 1], ["RE", 2, [0, 5, 10, 15, 20, 1, 6, 11, 16, 21, 2, 7, 12, 17, 22, 25, 26, 3, 8, 13, 18, 23, 27, 4, 9, 14, 19, 24]], ["FSP", 3, 0, 3, 3], ["FSP", 3, 4, 4, 3], ["FSP", 3, 8, 5, 3], ["FSP", 3, 12, 6, 3], ["FSP", 3, 16, 7, 3], ["RE", 3, [0, 4, 8, 12, 16, 1, 5, 9, 13, 17, 2, 6, 10, 14, 18, 3, 7, 11, 15, 19]], ["CA", 2, 3, 14], ["CHR", 1, "shared", [2]], ["CA", 2, 3, 15], ["CHR", 0, "shared", [3]], ["CA", 1, 4, 15], ["FU", 10, [0, 1, 2, 3, 4]], ["SP", 10, 0, 6422528, [32], 1], ["AN", 10, 0, 5], ["AN", 10, 1, 6], ["FU", 5, [0, 1, 2, 3, 4]], ["AN", 5, 0, 5], ["FU", 5, [1, 2, 3, 4, 5]], ["AN", 5, 1, 4], ["FU", 5, [2, 3, 4, 5, 6]], ["AN", 5, 2, 6], ["FU", 3, [0, 1, 2]], ["SP", 3, 0, 512, [1], 1], ["AN", 3, 1, 2], ["FFSP", 3, 0, [7, 6, 5, 4, 3], 1, 1], ["AN", 3, 1, 6], ["FU", 1, [0, 1, 2, 3]], ["SP", 1, 0, 96, [1], 1], ["AN", 1, 1, 2], ["FFSP", 1, 0, [7, 6, 5, 4, 3], 1, 1], ["AN", 1, 1, 6], ["PR", 4, 0, "auto_unroll_max_step$64"]]]], "r": [[0.000923932, 0.000923792, 0.00092311], 0, 13.0215, 1661923028], "v": "v0.6"}
{"i": [["[\"fused_conv1x1_bn_relu_stride\", 4, 56, 56, 256, 8, 64, 2]", "cuda -keys=cuda,gpu -max_num_threads=1024 -model=unknown -thread_warp_size=32", [-1, 16, 64, 49152, 2147483647, 1024, 8, 32], "", 0, []], [[], [["CI", 6], ["CI", 4], ["CHW", 2, "local"], ["SP", 2, 0, 4, [1, 2, 1, 1], 1], ["SP", 2, 5, 64, [4, 4, 1, 4], 1], ["SP", 2, 10, 28, [1, 2, 7, 1], 1], ["SP", 2, 15, 28, [1, 2, 2, 1], 1], ["SP", 2, 20, 8, [1, 1, 1, 1], 1], ["SP", 2, 25, 256, [1, 16], 1], ["RE", 2, [0, 5, 10, 15, 20, 1, 6, 11, 16, 21, 2, 7, 12, 17, 22, 25, 26, 3, 8, 13, 18, 23, 27, 4, 9, 14, 19, 24]], ["FSP", 3, 0, 3, 3], ["FSP", 3, 4, 4, 3], ["FSP", 3, 8, 5, 3], ["FSP", 3, 12, 6, 3], ["FSP", 3, 16, 7, 3], ["RE", 3, [0, 4, 8, 12, 16, 1, 5, 9, 13, 17, 2, 6, 10, 14, 18, 3, 7, 11, 15, 19]], ["CA", 2, 3, 14], ["CHR", 1, "shared", [2]], ["CA", 2, 3, 15], ["CHR", 0, "shared", [3]], ["CA", 1, 4, 15], ["FU", 10, [0, 1, 2, 3, 4]], ["SP", 10, 0, 6422528, [1], 1], ["AN", 10, 0, 5], ["AN", 10, 1, 6], ["FU", 5, [0, 1, 2, 3, 4]], ["AN", 5, 0, 5], ["FU", 5, [1, 2, 3, 4, 5]], ["AN", 5, 1, 4], ["FU", 5, [2, 3, 4, 5, 6]], ["AN", 5, 2, 6], ["FU", 3, [0, 1, 2]], ["SP", 3, 0, 32, [1], 1], ["AN", 3, 1, 2], ["FFSP", 3, 0, [7, 6, 5, 4, 3], 1, 1], ["AN", 3, 1, 6], ["FU", 1, [0, 1, 2, 3]], ["SP", 1, 0, 156, [1], 1], ["AN", 1, 1, 2], ["FFSP", 1, 0, [7, 6, 5, 4, 3], 1, 1], ["AN", 1, 1, 6], ["PR", 4, 0, "auto_unroll_max_step$0"]]]], "r": [[0.00556811, 0.00556967, 0.00556738], 0, 15.9371, 1661923030], "v": "v0.6"}
{"i": [["[\"fused_conv1x1_bn_relu_stride\", 4, 56, 56, 256, 8, 64, 2]", "cuda -keys=cuda,gpu -max_num_threads=1024 -model=unknown -thread_warp_size=32", [-1, 16, 64, 49152, 2147483647, 1024, 8, 32], "", 0, []], [[], [["CI", 6], ["CI", 4], ["CHW", 2, "local"], ["SP", 2, 0, 4, [1, 1, 1, 1], 1], ["SP", 2, 5, 64, [2, 4, 8, 1], 1], ["SP", 2, 10, 28, [1, 7, 2, 1], 1], ["SP", 2, 15, 28, [1, 1, 1, 2], 1], ["SP", 2, 20, 8, [1, 2, 2, 1], 1], ["SP", 2, 25, 256, [4, 1], 1], ["RE", 2, [0, 5, 10, 15, 20, 1, 6, 11, 16, 21, 2, 7, 12, 17, 22, 25, 26, 3, 8, 13, 18, 23, 27, 4, 9, 14, 19, 24]], ["FSP", 3, 0, 3, 3], ["FSP", 3, 4, 4, 3], ["FSP", 3, 8, 5, 3], ["FSP", 3, 12, 6, 3], ["FSP", 3, 16, 7, 3], ["RE", 3, [0, 4, 8, 12, 16, 1, 5, 9, 13, 17, 2, 6, 10, 14, 18, 3, 7, 11, 15, 19]], ["CA", 2, 3, 14], ["CHR", 1, "shared", [2]], ["CA", 2, 3, 15], ["CHR", 0, "shared", [3]], ["CA", 1, 4, 15], ["FU", 10, [0, 1, 2, 3, 4]], ["SP", 10, 0, 6422528, [32], 1], ["AN", 10, 0, 5], ["AN", 10, 1, 6], ["FU", 5, [0, 1, 2, 3, 4]], ["AN", 5, 0, 5], ["FU", 5, [1, 2, 3, 4, 5]], ["AN", 5, 1, 4], ["FU", 5, [2, 3, 4, 5, 6]], ["AN", 5, 2, 6], ["FU", 3, [0, 1, 2]], ["SP", 3, 0, 64, [1], 1], ["AN", 3, 1, 2], ["FFSP", 3, 0, [7, 6, 5, 4, 3], 1, 1], ["AN", 3, 1, 6], ["FU", 1, [0, 1, 2, 3]], ["SP", 1, 0, 12, [1], 1], ["AN", 1, 1, 2], ["FFSP", 1, 0, [7, 6, 5, 4, 3], 1, 1], ["AN", 1, 1, 6], ["PR", 4, 0, "auto_unroll_max_step$1024"]]]], "r": [[0.000340291, 0.000339266, 0.000339706], 0, 17.8113, 1661923031], "v": "v0.6"}
{"i": [["[\"fused_conv1x1_bn_relu_stride\", 4, 56, 56, 256, 8, 64, 2]", "cuda -keys=cuda,gpu -max_num_threads=1024 -model=unknown -thread_warp_size=32", [-1, 16, 64, 49152, 2147483647, 1024, 8, 32], "", 0, []], [[], [["CI", 6], ["CI", 4], ["CHW", 2, "local"], ["SP", 2, 0, 4, [1, 2, 2, 1], 1], ["SP", 2, 5, 64, [2, 4, 1, 2], 1], ["SP", 2, 10, 28, [1, 1, 1, 14], 1], ["SP", 2, 15, 28, [2, 1, 1, 1], 1], ["SP", 2, 20, 8, [1, 2, 2, 1], 1], ["SP", 2, 25, 256, [2, 8], 1], ["RE", 2, [0, 5, 10, 15, 20, 1, 6, 11, 16, 21, 2, 7, 12, 17, 22, 25, 26, 3, 8, 13, 18, 23, 27, 4, 9, 14, 19, 24]], ["FSP", 3, 0, 3, 3], ["FSP", 3, 4, 4, 3], ["FSP", 3, 8, 5, 3], ["FSP", 3, 12, 6, 3], ["FSP", 3, 16, 7, 3], ["RE", 3, [0, 4, 8, 12, 16, 1, 5, 9, 13, 17, 2, 6, 10, 14, 18, 3, 7, 11, 15, 19]], ["CA", 2, 3, 14], ["CHR", 1, "shared", [2]], ["CA", 2, 3, 15], ["CHR", 0, "shared", [3]], ["CA", 1, 4, 15], ["FU", 10, [0, 1, 2, 3, 4]], ["SP", 10, 0, 6422528, [32], 1], ["AN", 10, 0, 5], ["AN", 10, 1, 6], ["FU", 5, [0, 1, 2, 3, 4]], ["AN", 5, 0, 5], ["FU", 5, [1, 2, 3, 4, 5]], ["AN", 5, 1, 4], ["FU", 5, [2, 3, 4, 5, 6]], ["AN", 5, 2, 6], ["FU", 3, [0, 1, 2]], ["SP", 3, 0, 64, [1], 1], ["AN", 3, 1, 2], ["FFSP", 3, 0, [7, 6, 5, 4, 3], 1, 1], ["AN", 3, 1, 6], ["FU", 1, [0, 1, 2, 3]], ["SP", 1, 0, 864, [32], 1], ["AN", 1, 1, 2], ["FFSP", 1, 0, [7, 6, 5, 4, 3], 1, 1], ["AN", 1, 1, 6], ["PR", 4, 0, "auto_unroll_max_step$1024"]]]], "r": [[0.00155071, 0.00154596, 0.00156378], 0, 24.2705, 1661923033], "v": "v0.6"}
{"i": [["[\"fused_conv1x1_bn_relu_stride\", 4, 56, 56, 256, 8, 64, 2]", "cuda -keys=cuda,gpu -max_num_threads=1024 -model=unknown -thread_warp_size=32", [-1, 16, 64, 49152, 2147483647, 1024, 8, 32], "", 0, []], [[], [["CI", 6], ["CI", 4], ["CHW", 2, "local"], ["SP", 2, 0, 4, [1, 2, 1, 1], 1], ["SP", 2, 5, 64, [4, 4, 1, 4], 1], ["SP", 2, 10, 28, [1, 2, 7, 1], 1], ["SP", 2, 15, 28, [1, 2, 2, 1], 1], ["SP", 2, 20, 8, [1, 1, 1, 1], 1], ["SP", 2, 25, 256, [1, 4], 1], ["RE", 2, [0, 5, 10, 15, 20, 1, 6, 11, 16, 21, 2, 7, 12, 17, 22, 25, 26, 3, 8, 13, 18, 23, 27, 4, 9, 14, 19, 24]], ["FSP", 3, 0, 3, 3], ["FSP", 3, 4, 4, 3], ["FSP", 3, 8, 5, 3], ["FSP", 3, 12, 6, 3], ["FSP", 3, 16, 7, 3], ["RE", 3, [0, 4, 8, 12, 16, 1, 5, 9, 13, 17, 2, 6, 10, 14, 18, 3, 7, 11, 15, 19]], ["CA", 2, 3, 14], ["CHR", 1, "shared", [2]], ["CA", 2, 3, 15], ["CHR", 0, "shared", [3]], ["CA", 1, 4, 15], ["FU", 10, [0, 1, 2, 3, 4]], ["SP", 10, 0, 6422528, [32], 1], ["AN", 10, 0, 5], ["AN", 10, 1, 6], ["FU", 5, [0, 1, 2, 3, 4]], ["AN", 5, 0, 5], ["FU", 5, [1, 2, 3, 4, 5]], ["AN", 5, 1, 4], ["FU", 5, [2, 3, 4, 5, 6]], ["AN", 5, 2, 6], ["FU", 3, [0, 1, 2]], ["SP", 3, 0, 32, [1], 1], ["AN", 3, 1, 2], ["FFSP", 3, 0, [7, 6, 5, 4, 3], 1, 1], ["AN", 3, 1, 6], ["FU", 1, [0, 1, 2, 3]], ["SP", 1, 0, 156, [1], 1], ["AN", 1, 1, 2], ["FFSP", 1, 0, [7, 6, 5, 4, 3], 1, 1], ["AN", 1, 1, 6], ["PR", 4, 0, "auto_unroll_max_step$0"]]]], "r": [[0.00112172, 0.00112412, 0.00112309], 0, 19.083, 1661923034], "v": "v0.6"}
{"i": [["[\"fused_conv1x1_bn_relu_stride\", 4, 56, 56, 256, 8, 64, 2]", "cuda -keys=cuda,gpu -max_num_threads=1024 -model=unknown -thread_warp_size=32", [-1, 16, 64, 49152, 2147483647, 1024, 8, 32], "", 0, []], [[], [["CI", 6], ["CI", 4], ["CHW", 2, "local"], ["SP", 2, 0, 4, [1, 4, 1, 1], 1], ["SP", 2, 5, 64, [4, 1, 1, 8], 1], ["SP", 2, 10, 28, [1, 1, 1, 7], 1], ["SP", 2, 15, 28, [2, 7, 1, 1], 1], ["SP", 2, 20, 8, [1, 2, 4, 1], 1], ["SP", 2, 25, 256, [2, 2], 1], ["RE", 2, [0, 5, 10, 15, 20, 1, 6, 11, 16, 21, 2, 7, 12, 17, 22, 25, 26, 3, 8, 13, 18, 23, 27, 4, 9, 14, 19, 24]], ["FSP", 3, 0, 3, 3], ["FSP", 3, 4, 4, 3], ["FSP", 3, 8, 5, 3], ["FSP", 3, 12, 6, 3], ["FSP", 3, 16, 7, 3], ["RE", 3, [0, 4, 8, 12, 16, 1, 5, 9, 13, 17, 2, 6, 10, 14, 18, 3, 7, 11, 15, 19]], ["CA", 2, 3, 14], ["CHR", 1, "shared", [2]], ["CA", 2, 3, 15], ["CHR", 0, "shared", [3]], ["CA", 1, 4, 15], ["FU", 10, [0, 1, 2, 3, 4]], ["SP", 10, 0, 6422528, [32], 1], ["AN", 10, 0, 5], ["AN", 10, 1, 6], ["FU", 5, [0, 1, 2, 3, 4]], ["AN", 5, 0, 5], ["FU", 5, [1, 2, 3, 4, 5]], ["AN", 5, 1, 4], ["FU", 5, [2, 3, 4, 5, 6]], ["AN", 5, 2, 6], ["FU", 3, [0, 1, 2]], ["SP", 3, 0, 16, [1], 1], ["AN", 3, 1, 2], ["FFSP", 3, 0, [7, 6, 5, 4, 3], 1, 1], ["AN", 3, 1, 6], ["FU", 1, [0, 1, 2, 3]], ["SP", 1, 0, 52, [1], 1], ["AN", 1, 1, 2], ["FFSP", 1, 0, [7, 6, 5, 4, 3], 1, 1], ["AN", 1, 1, 6], ["PR", 4, 0, "auto_unroll_max_step$1024"]]]], "r": [[0.00690425, 0.00687254, 0.00692787], 0, 27.1005, 1661923035], "v": "v0.6"}
{"i": [["[\"fused_conv1x1_bn_relu_stride\", 4, 56, 56, 256, 8, 64, 2]", "cuda -keys=cuda,gpu -max_num_threads=1024 -model=unknown -thread_warp_size=32", [-1, 16, 64, 49152, 2147483647, 1024, 8, 32], "", 0, []], [[], [["CI", 6], ["CI", 4], ["CHW", 2, "local"], ["SP", 2, 0, 4, [1, 2, 1, 1], 1], ["SP", 2, 5, 64, [2, 1, 16, 1], 1], ["SP", 2, 10, 28, [2, 7, 2, 1], 1], ["SP", 2, 15, 28, [1, 4, 1, 1], 1], ["SP", 2, 20, 8, [1, 2, 4, 1], 1], ["SP", 2, 25, 256, [2, 2], 1], ["RE", 2, [0, 5, 10, 15, 20, 1, 6, 11, 16, 21, 2, 7, 12, 17, 22, 25, 26, 3, 8, 13, 18, 23, 27, 4, 9, 14, 19, 24]], ["FSP", 3, 0, 3, 3], ["FSP", 3, 4, 4, 3], ["FSP", 3, 8, 5, 3], ["FSP", 3, 12, 6, 3], ["FSP", 3, 16, 7, 3], ["RE", 3, [0, 4, 8, 12, 16, 1, 5, 9, 13, 17, 2, 6, 10, 14, 18, 3, 7, 11, 15, 19]], ["CA", 2, 3, 14], ["CHR", 1, "shared", [2]], ["CA", 2, 3, 15], ["CHR", 0, "shared", [3]], ["CA", 1, 4, 15], ["FU", 10, [0, 1, 2, 3, 4]], ["SP", 10, 0, 6422528, [32], 1], ["AN", 10, 0, 5], ["AN", 10, 1, 6], ["FU", 5, [0, 1, 2, 3, 4]], ["AN", 5, 0, 5], ["FU", 5, [1, 2, 3, 4, 5]], ["AN", 5, 1, 4], ["FU", 5, [2, 3, 4, 5, 6]], ["AN", 5, 2, 6], ["FU", 3, [0, 1, 2]], ["SP", 3, 0, 256, [1], 1], ["AN", 3, 1, 2], ["FFSP", 3, 0, [7, 6, 5, 4, 3], 1, 1], ["AN", 3, 1, 6], ["FU", 1, [0, 1, 2, 3]], ["SP", 1, 0, 12, [1], 1], ["AN", 1, 1, 2], ["FFSP", 1, 0, [7, 6, 5, 4, 3], 1, 1], ["AN", 1, 1, 6], ["PR", 4, 0, "auto_unroll_max_step$16"]]]], "r": [[0.00176778, 0.0017707, 0.00177051], 0, 21.8325, 1661923037], "v": "v0.6"}
{"i": [["[\"fused_conv1x1_bn_relu_stride\", 4, 56, 56, 256, 8, 64, 2]", "cuda -keys=cuda,gpu -max_num_threads=1024 -model=unknown -thread_warp_size=32", [-1, 16, 64, 49152, 2147483647, 1024, 8, 32], "", 0, []], [[], [["CI", 6], ["CI", 4], ["CHW", 2, "local"], ["SP", 2, 0, 4, [2, 2, 1, 1], 1], ["SP", 2, 5, 64, [2, 8, 2, 1], 1], ["SP", 2, 10, 28, [1, 1, 1, 7], 1], ["SP", 2, 15, 28, [1, 2, 1, 1], 1], ["SP", 2, 20, 8, [2, 4, 1, 1], 1], ["SP", 2, 25, 256, [1, 2], 1], ["RE", 2, [0, 5, 10, 15, 20, 1, 6, 11, 16, 21, 2, 7, 12, 17, 22, 25, 26, 3, 8, 13, 18, 23, 27, 4, 9, 14, 19, 24]], ["FSP", 3, 0, 3, 3], ["FSP", 3, 4, 4, 3], ["FSP", 3, 8, 5, 3], ["FSP", 3, 12, 6, 3], ["FSP", 3, 16, 7, 3], ["RE", 3, [0, 4, 8, 12, 16, 1, 5, 9, 13, 17, 2, 6, 10, 14, 18, 3, 7, 11, 15, 19]], ["CA", 2, 3, 14], ["CHR", 1, "shared", [2]], ["CA", 2, 3, 15], ["CHR", 0, "shared", [3]], ["CA", 1, 4, 15], ["FU", 10, [0, 1, 2, 3, 4]], ["SP", 10, 0, 6422528, [64], 1], ["AN", 10, 0, 5], ["AN", 10, 1, 6], ["FU", 5, [0, 1, 2, 3, 4]], ["AN", 5, 0, 5], ["FU", 5, [1, 2, 3, 4, 5]], ["AN", 5, 1, 4], ["FU", 5, [2, 3, 4, 5, 6]], ["AN", 5, 2, 6], ["FU", 3, [0, 1, 2]], ["SP", 3, 0, 4, [2], 1], ["AN", 3, 1, 2], ["FFSP", 3, 0, [7, 6, 5, 4, 3], 1, 1], ["AN", 3, 1, 6], ["FU", 1, [0, 1, 2, 3]], ["SP", 1, 0, 26, [1], 1], ["AN", 1, 1, 2], ["FFSP", 1, 0, [7, 6, 5, 4, 3], 1, 1], ["AN", 1, 1, 6], ["PR", 4, 0, "auto_unroll_max_step$0"]]]], "r": [[0.000244662, 0.000244024, 0.000244223], 0, 22.5048, 1661923038], "v": "v0.6"}
{"i": [["[\"fused_conv1x1_bn_relu_stride\", 4, 56, 56, 256, 8, 64, 2]", "cuda -keys=cuda,gpu -max_num_threads=1024 -model=unknown -thread_warp_size=32", [-1, 16, 64, 49152, 2147483647, 1024, 8, 32], "", 0, []], [[], [["CI", 6], ["CI", 4], ["CHW", 2, "local"], ["SP", 2, 0, 4, [1, 1, 1, 4], 1], ["SP", 2, 5, 64, [2, 1, 4, 2], 1], ["SP", 2, 10, 28, [1, 2, 2, 1], 1], ["SP", 2, 15, 28, [1, 14, 2, 1], 1], ["SP", 2, 20, 8, [1, 2, 2, 1], 1], ["SP", 2, 25, 256, [1, 2], 1], ["RE", 2, [0, 5, 10, 15, 20, 1, 6, 11, 16, 21, 2, 7, 12, 17, 22, 25, 26, 3, 8, 13, 18, 23, 27, 4, 9, 14, 19, 24]], ["FSP", 3, 0, 3, 3], ["FSP", 3, 4, 4, 3], ["FSP", 3, 8, 5, 3], ["FSP", 3, 12, 6, 3], ["FSP", 3, 16, 7, 3], ["RE", 3, [0, 4, 8, 12, 16, 1, 5, 9, 13, 17, 2, 6, 10, 14, 18, 3, 7, 11, 15, 19]], ["CA", 2, 3, 14], ["CHR", 1, "shared", [2]], ["CA", 2, 3, 15], ["CHR", 0, "shared", [3]], ["CA", 1, 4, 15], ["FU", 10, [0, 1, 2, 3, 4]], ["SP", 10, 0, 6422528, [32], 1], ["AN", 10, 0, 5], ["AN", 10, 1, 6], ["FU", 5, [0, 1, 2, 3, 4]], ["AN", 5, 0, 5], ["FU", 5, [1, 2, 3, 4, 5]], ["AN", 5, 1, 4], ["FU", 5, [2, 3, 4, 5, 6]], ["AN", 5, 2, 6], ["FU", 3, [0, 1, 2]], ["SP", 3, 0, 32, [1], 1], ["AN", 3, 1, 2], ["FFSP", 3, 0, [7, 6, 5, 4, 3], 1, 1], ["AN", 3, 1, 6], ["FU", 1, [0, 1, 2, 3]], ["SP", 1, 0, 24, [4], 1], ["AN", 1, 1, 2], ["FFSP", 1, 0, [7, 6, 5, 4, 3], 1, 1], ["AN", 1, 1, 6], ["PR", 4, 0, "auto_unroll_max_step$1024"]]]], "r": [[0.00267819, 0.00265436, 0.00275515], 0, 28.641, 1661923040], "v": "v0.6"}
{"i": [["[\"fused_conv1x1_bn_relu_stride\", 4, 56, 56, 256, 8, 64, 2]", "cuda -keys=cuda,gpu -max_num_threads=1024 -model=unknown -thread_warp_size=32", [-1, 16, 64, 49152, 2147483647, 1024, 8, 32], "", 0, []], [[], [["CI", 6], ["CI", 4], ["CHW", 2, "local"], ["SP", 2, 0, 4, [2, 1, 2, 1], 1], ["SP", 2, 5, 64, [1, 8, 2, 2], 1], ["SP", 2, 10, 28, [1, 1, 1, 4], 1], ["SP", 2, 15, 28, [1, 2, 2, 1], 1], ["SP", 2, 20, 8, [1, 1, 8, 1], 1], ["SP", 2, 25, 256, [8, 1], 1], ["RE", 2, [0, 5, 10, 15, 20, 1, 6, 11, 16, 21, 2, 7, 12, 17, 22, 25, 26, 3, 8, 13, 18, 23, 27, 4, 9, 14, 19, 24]], ["FSP", 3, 0, 3, 3], ["FSP", 3, 4, 4, 3], ["FSP", 3, 8, 5, 3], ["FSP", 3, 12, 6, 3], ["FSP", 3, 16, 7, 3], ["RE", 3, [0, 4, 8, 12, 16, 1, 5, 9, 13, 17, 2, 6, 10, 14, 18, 3, 7, 11, 15, 19]], ["CA", 2, 3, 14], ["CHR", 1, "shared", [2]], ["CA", 2, 3, 15], ["CHR", 0, "shared", [3]], ["CA", 1, 4, 15], ["FU", 10, [0, 1, 2, 3, 4]], ["SP", 10, 0, 6422528, [8], 1], ["AN", 10, 0, 5], ["AN", 10, 1, 6], ["FU", 5, [0, 1, 2, 3, 4]], ["AN", 5, 0, 5], ["FU", 5, [1, 2, 3, 4, 5]], ["AN", 5, 1, 4], ["FU", 5, [2, 3, 4, 5, 6]], ["AN", 5, 2, 6], ["FU", 3, [0, 1, 2]], ["SP", 3, 0, 256, [1], 1], ["AN", 3, 1, 2], ["FFSP", 3, 0, [7, 6, 5, 4, 3], 1, 1], ["AN", 3, 1, 6], ["FU", 1, [0, 1, 2, 3]], ["SP", 1, 0, 168, [1], 1], ["AN", 1, 1, 2], ["FFSP", 1, 0, [7, 6, 5, 4, 3], 1, 1], ["AN", 1, 1, 6], ["PR", 4, 0, "auto_unroll_max_step$1024"]]]], "r": [[0.00552256, 0.00547212, 0.00568201], 0, 33.8662, 1661923042], "v": "v0.6"}
{"i": [["[\"fused_conv1x1_bn_relu_stride\", 4, 56, 56, 256, 8, 64, 2]", "cuda -keys=cuda,gpu -max_num_threads=1024 -model=unknown -thread_warp_size=32", [-1, 16, 64, 49152, 2147483647, 1024, 8, 32], "", 0, []], [[], [["CI", 6], ["CI", 4], ["CHW", 2, "local"], ["SP", 2, 0, 4, [1, 4, 1, 1], 1], ["SP", 2, 5, 64, [1, 16, 1, 1], 1], ["SP", 2, 10, 28, [1, 4, 1, 1], 1], ["SP", 2, 15, 28, [2, 1, 1, 14], 1], ["SP", 2, 20, 8, [4, 1, 2, 1], 1], ["SP", 2, 25, 256, [2, 1], 1], ["RE", 2, [0, 5, 10, 15, 20, 1, 6, 11, 16, 21, 2, 7, 12, 17, 22, 25, 26, 3, 8, 13, 18, 23, 27, 4, 9, 14, 19, 24]], ["FSP", 3, 0, 3, 3], ["FSP", 3, 4, 4, 3], ["FSP", 3, 8, 5, 3], ["FSP", 3, 12, 6, 3], ["FSP", 3, 16, 7, 3], ["RE", 3, [0, 4, 8, 12, 16, 1, 5, 9, 13, 17, 2, 6, 10, 14, 18, 3, 7, 11, 15, 19]], ["CA", 2, 3, 14], ["CHR", 1, "shared", [2]], ["CA", 2, 3, 15], ["CHR", 0, "shared", [3]], ["CA", 1, 4, 15], ["FU", 10, [0, 1, 2, 3, 4]], ["SP", 10, 0, 6422528, [32], 1], ["AN", 10, 0, 5], ["AN", 10, 1, 6], ["FU", 5, [0, 1, 2, 3, 4]], ["AN", 5, 0, 5], ["FU", 5, [1, 2, 3, 4, 5]], ["AN", 5, 1, 4], ["FU", 5, [2, 3, 4, 5, 6]], ["AN", 5, 2, 6], ["FU", 3, [0, 1, 2]], ["SP", 3, 0, 4, [1], 1], ["AN", 3, 1, 2], ["FFSP", 3, 0, [7, 6, 5, 4, 3], 1, 1], ["AN", 3, 1, 6], ["FU", 1, [0, 1, 2, 3]], ["SP", 1, 0, 54, [6], 1], ["AN", 1, 1, 2], ["FFSP", 1, 0, [7, 6, 5, 4, 3], 1, 1], ["AN", 1, 1, 6], ["PR", 4, 0, "auto_unroll_max_step$16"]]]], "r": [[0.00106053, 0.00106077, 0.00106074], 0, 23.9055, 1661923039], "v": "v0.6"}
{"i": [["[\"fused_conv1x1_bn_relu_stride\", 4, 56, 56, 256, 8, 64, 2]", "cuda -keys=cuda,gpu -max_num_threads=1024 -model=unknown -thread_warp_size=32", [-1, 16, 64, 49152, 2147483647, 1024, 8, 32], "", 0, []], [[], [["CI", 6], ["CI", 4], ["CHW", 2, "local"], ["SP", 2, 0, 4, [1, 1, 4, 1], 1], ["SP", 2, 5, 64, [1, 16, 4, 1], 1], ["SP", 2, 10, 28, [1, 1, 4, 7], 1], ["SP", 2, 15, 28, [1, 1, 4, 1], 1], ["SP", 2, 20, 8, [1, 2, 4, 1], 1], ["SP", 2, 25, 256, [2, 2], 1], ["RE", 2, [0, 5, 10, 15, 20, 1, 6, 11, 16, 21, 2, 7, 12, 17, 22, 25, 26, 3, 8, 13, 18, 23, 27, 4, 9, 14, 19, 24]], ["FSP", 3, 0, 3, 3], ["FSP", 3, 4, 4, 3], ["FSP", 3, 8, 5, 3], ["FSP", 3, 12, 6, 3], ["FSP", 3, 16, 7, 3], ["RE", 3, [0, 4, 8, 12, 16, 1, 5, 9, 13, 17, 2, 6, 10, 14, 18, 3, 7, 11, 15, 19]], ["CA", 2, 3, 14], ["CHR", 1, "shared", [2]], ["CA", 2, 3, 15], ["CHR", 0, "shared", [3]], ["CA", 1, 4, 15], ["FU", 10, [0, 1, 2, 3, 4]], ["SP", 10, 0, 6422528, [32], 1], ["AN", 10, 0, 5], ["AN", 10, 1, 6], ["FU", 5, [0, 1, 2, 3, 4]], ["AN", 5, 0, 5], ["FU", 5, [1, 2, 3, 4, 5]], ["AN", 5, 1, 4], ["FU", 5, [2, 3, 4, 5, 6]], ["AN", 5, 2, 6], ["FU", 3, [0, 1, 2]], ["SP", 3, 0, 64, [1], 1], ["AN", 3, 1, 2], ["FFSP", 3, 0, [7, 6, 5, 4, 3], 1, 1], ["AN", 3, 1, 6], ["FU", 1, [0, 1, 2, 3]], ["SP", 1, 0, 6160, [1], 1], ["AN", 1, 1, 2], ["FFSP", 1, 0, [7, 6, 5, 4, 3], 1, 1], ["AN", 1, 1, 6], ["PR", 4, 0, "auto_unroll_max_step$0"]]]], "r": [[0.0102446, 0.010239, 0.0102348], 0, 30.1855, 1661923044], "v": "v0.6"}
{"i": [["[\"fused_conv1x1_bn_relu_stride\", 4, 56, 56, 256, 8, 64, 2]", "cuda -keys=cuda,gpu -max_num_threads=1024 -model=unknown -thread_warp_size=32", [-1, 16, 64, 49152, 2147483647, 1024, 8, 32], "", 0, []], [[], [["CI", 6], ["CI", 4], ["CHW", 2, "local"], ["SP", 2, 0, 4, [1, 1, 1, 2], 1], ["SP", 2, 5, 64, [1, 8, 2, 2], 1], ["SP", 2, 10, 28, [1, 4, 1, 1], 1], ["SP", 2, 15, 28, [7, 4, 1, 1], 1], ["SP", 2, 20, 8, [1, 2, 1, 2], 1], ["SP", 2, 25, 256, [1, 1], 1], ["RE", 2, [0, 5, 10, 15, 20, 1, 6, 11, 16, 21, 2, 7, 12, 17, 22, 25, 26, 3, 8, 13, 18, 23, 27, 4, 9, 14, 19, 24]], ["FSP", 3, 0, 3, 3], ["FSP", 3, 4, 4, 3], ["FSP", 3, 8, 5, 3], ["FSP", 3, 12, 6, 3], ["FSP", 3, 16, 7, 3], ["RE", 3, [0, 4, 8, 12, 16, 1, 5, 9, 13, 17, 2, 6, 10, 14, 18, 3, 7, 11, 15, 19]], ["CA", 2, 3, 14], ["CHR", 1, "shared", [2]], ["CA", 2, 3, 15], ["CHR", 0, "shared", [3]], ["CA", 1, 4, 15], ["FU", 10, [0, 1, 2, 3, 4]], ["SP", 10, 0, 6422528, [32], 1], ["AN", 10, 0, 5], ["AN", 10, 1, 6], ["FU", 5, [0, 1, 2, 3, 4]], ["AN", 5, 0, 5], ["FU", 5, [1, 2, 3, 4, 5]], ["AN", 5, 1, 4], ["FU", 5, [2, 3, 4, 5, 6]], ["AN", 5, 2, 6], ["FU", 3, [0, 1, 2]], ["SP", 3, 0, 8, [1], 1], ["AN", 3, 1, 2], ["FFSP", 3, 0, [7, 6, 5, 4, 3], 1, 1], ["AN", 3, 1, 6], ["FU", 1, [0, 1, 2, 3]], ["SP", 1, 0, 26, [1], 1], ["AN", 1, 1, 2], ["FFSP", 1, 0, [7, 6, 5, 4, 3], 1, 1], ["AN", 1, 1, 6], ["PR", 4, 0, "auto_unroll_max_step$16"]]]], "r": [[0.000505444, 0.000505372, 0.000505163], 0, 29.7264, 1661923045], "v": "v0.6"}
{"i": [["[\"fused_conv1x1_bn_relu_stride\", 4, 56, 56, 256, 8, 64, 2]", "cuda -keys=cuda,gpu -max_num_threads=1024 -model=unknown -thread_warp_size=32", [-1, 16, 64, 49152, 2147483647, 1024, 8, 32], "", 0, []], [[], [["CI", 6], ["CI", 4], ["CHW", 2, "local"], ["SP", 2, 0, 4, [1, 1, 1, 2], 1], ["SP", 2, 5, 64, [2, 1, 4, 8], 1], ["SP", 2, 10, 28, [2, 14, 1, 1], 1], ["SP", 2, 15, 28, [1, 1, 2, 7], 1], ["SP", 2, 20, 8, [1, 2, 1, 4], 1], ["SP", 2, 25, 256, [1, 2], 1], ["RE", 2, [0, 5, 10, 15, 20, 1, 6, 11, 16, 21, 2, 7, 12, 17, 22, 25, 26, 3, 8, 13, 18, 23, 27, 4, 9, 14, 19, 24]], ["FSP", 3, 0, 3, 3], ["FSP", 3, 4, 4, 3], ["FSP", 3, 8, 5, 3], ["FSP", 3, 12, 6, 3], ["FSP", 3, 16, 7, 3], ["RE", 3, [0, 4, 8, 12, 16, 1, 5, 9, 13, 17, 2, 6, 10, 14, 18, 3, 7, 11, 15, 19]], ["CA", 2, 3, 14], ["CHR", 1, "shared", [2]], ["CA", 2, 3, 15], ["CHR", 0, "shared", [3]], ["CA", 1, 4, 15], ["FU", 10, [0, 1, 2, 3, 4]], ["SP", 10, 0, 6422528, [2], 1], ["AN", 10, 0, 5], ["AN", 10, 1, 6], ["FU", 5, [0, 1, 2, 3, 4]], ["AN", 5, 0, 5], ["FU", 5, [1, 2, 3, 4, 5]], ["AN", 5, 1, 4], ["FU", 5, [2, 3, 4, 5, 6]], ["AN", 5, 2, 6], ["FU", 3, [0, 1, 2]], ["SP", 3, 0, 128, [1], 1], ["AN", 3, 1, 2], ["FFSP", 3, 0, [7, 6, 5, 4, 3], 1, 1], ["AN", 3, 1, 6], ["FU", 1, [0, 1, 2, 3]], ["SP", 1, 0, 108, [18], 1], ["AN", 1, 1, 2], ["FFSP", 1, 0, [7, 6, 5, 4, 3], 1, 1], ["AN", 1, 1, 6], ["PR", 4, 0, "auto_unroll_max_step$512"]]]], "r": [[0.0324432, 0.0324344, 0.0324232], 0, 33.9793, 1661923047], "v": "v0.6"}
{"i": [["[\"fused_conv1x1_bn_relu_stride\", 4, 56, 56, 256, 8, 64, 2]", "cuda -keys=cuda,gpu -max_num_threads=1024 -model=unknown -thread_warp_size=32", [-1, 16, 64, 49152, 2147483647, 1024, 8, 32], "", 0, []], [[], [["CI", 6], ["CI", 4], ["CHW", 2, "local"], ["SP", 2, 0, 4, [1, 1, 1, 1], 1], ["SP", 2, 5, 64, [1, 16, 2, 2], 1], ["SP", 2, 10, 28, [1, 2, 2, 1], 1], ["SP", 2, 15, 28, [1, 1, 1, 4], 1], ["SP", 2, 20, 8, [1, 1, 1, 4], 1], ["SP", 2, 25, 256, [1, 16], 1], ["RE", 2, [0, 5, 10, 15, 20, 1, 6, 11, 16, 21, 2, 7, 12, 17, 22, 25, 26, 3, 8, 13, 18, 23, 27, 4, 9, 14, 19, 24]], ["FSP", 3, 0, 3, 3], ["FSP", 3, 4, 4, 3], ["FSP", 3, 8, 5, 3], ["FSP", 3, 12, 6, 3], ["FSP", 3, 16, 7, 3], ["RE", 3, [0, 4, 8, 12, 16, 1, 5, 9, 13, 17, 2, 6, 10, 14, 18, 3, 7, 11, 15, 19]], ["CA", 2, 3, 14], ["CHR", 1, "shared", [2]], ["CA", 2, 3, 15], ["CHR", 0, "shared", [3]], ["CA", 1, 4, 15], ["FU", 10, [0, 1, 2, 3, 4]], ["SP", 10, 0, 6422528, [32], 1], ["AN", 10, 0, 5], ["AN", 10, 1, 6], ["FU", 5, [0, 1, 2, 3, 4]], ["AN", 5, 0, 5], ["FU", 5, [1, 2, 3, 4, 5]], ["AN", 5, 1, 4], ["FU", 5, [2, 3, 4, 5, 6]], ["AN", 5, 2, 6], ["FU", 3, [0, 1, 2]], ["SP", 3, 0, 256, [1], 1], ["AN", 3, 1, 2], ["FFSP", 3, 0, [7, 6, 5, 4, 3], 1, 1], ["AN", 3, 1, 6], ["FU", 1, [0, 1, 2, 3]], ["SP", 1, 0, 336, [1], 1], ["AN", 1, 1, 2], ["FFSP", 1, 0, [7, 6, 5, 4, 3], 1, 1], ["AN", 1, 1, 6], ["PR", 4, 0, "auto_unroll_max_step$0"]]]], "r": [[0.000550495, 0.000550448, 0.000549974], 0, 32.342, 1661923048], "v": "v0.6"}
{"i": [["[\"fused_conv1x1_bn_relu_stride\", 4, 56, 56, 256, 8, 64, 2]", "cuda -keys=cuda,gpu -max_num_threads=1024 -model=unknown -thread_warp_size=32", [-1, 16, 64, 49152, 2147483647, 1024, 8, 32], "", 0, []], [[], [["CI", 6], ["CI", 4], ["CHW", 2, "local"], ["SP", 2, 0, 4, [1, 2, 1, 1], 1], ["SP", 2, 5, 64, [2, 8, 2, 1], 1], ["SP", 2, 10, 28, [1, 2, 14, 1], 1], ["SP", 2, 15, 28, [2, 2, 7, 1], 1], ["SP", 2, 20, 8, [2, 2, 1, 2], 1], ["SP", 2, 25, 256, [1, 1], 1], ["RE", 2, [0, 5, 10, 15, 20, 1, 6, 11, 16, 21, 2, 7, 12, 17, 22, 25, 26, 3, 8, 13, 18, 23, 27, 4, 9, 14, 19, 24]], ["FSP", 3, 0, 3, 3], ["FSP", 3, 4, 4, 3], ["FSP", 3, 8, 5, 3], ["FSP", 3, 12, 6, 3], ["FSP", 3, 16, 7, 3], ["RE", 3, [0, 4, 8, 12, 16, 1, 5, 9, 13, 17, 2, 6, 10, 14, 18, 3, 7, 11, 15, 19]], ["CA", 2, 3, 14], ["CHR", 1, "shared", [2]], ["CA", 2, 3, 15], ["CHR", 0, "shared", [3]], ["CA", 1, 4, 15], ["FU", 10, [0, 1, 2, 3, 4]], ["SP", 10, 0, 6422528, [64], 1], ["AN", 10, 0, 5], ["AN", 10, 1, 6], ["FU", 5, [0, 1, 2, 3, 4]], ["AN", 5, 0, 5], ["FU", 5, [1, 2, 3, 4, 5]], ["AN", 5, 1, 4], ["FU", 5, [2, 3, 4, 5, 6]], ["AN", 5, 2, 6], ["FU", 3, [0, 1, 2]], ["SP", 3, 0, 4, [1], 1], ["AN", 3, 1, 2], ["FFSP", 3, 0, [7, 6, 5, 4, 3], 1, 1], ["AN", 3, 1, 6], ["FU", 1, [0, 1, 2, 3]], ["SP", 1, 0, 169, [1], 1], ["AN", 1, 1, 2], ["FFSP", 1, 0, [7, 6, 5, 4, 3], 1, 1], ["AN", 1, 1, 6], ["PR", 4, 0, "auto_unroll_max_step$512"]]]], "r": [[0.0176332, 0.017634, 0.0176398], 0, 35.0744, 1661923049], "v": "v0.6"}
{"i": [["[\"fused_conv1x1_bn_relu_stride\", 4, 56, 56, 256, 8, 64, 2]", "cuda -keys=cuda,gpu -max_num_threads=1024 -model=unknown -thread_warp_size=32", [-1, 16, 64, 49152, 2147483647, 1024, 8, 32], "", 0, []], [[], [["CI", 6], ["CI", 4], ["CHW", 2, "local"], ["SP", 2, 0, 4, [1, 1, 1, 4], 1], ["SP", 2, 5, 64, [2, 4, 1, 4], 1], ["SP", 2, 10, 28, [1, 7, 1, 1], 1], ["SP", 2, 15, 28, [1, 4, 1, 1], 1], ["SP", 2, 20, 8, [1, 1, 1, 2], 1], ["SP", 2, 25, 256, [1, 4], 1], ["RE", 2, [0, 5, 10, 15, 20, 1, 6, 11, 16, 21, 2, 7, 12, 17, 22, 25, 26, 3, 8, 13, 18, 23, 27, 4, 9, 14, 19, 24]], ["FSP", 3, 0, 3, 3], ["FSP", 3, 4, 4, 3], ["FSP", 3, 8, 5, 3], ["FSP", 3, 12, 6, 3], ["FSP", 3, 16, 7, 3], ["RE", 3, [0, 4, 8, 12, 16, 1, 5, 9, 13, 17, 2, 6, 10, 14, 18, 3, 7, 11, 15, 19]], ["CA", 2, 3, 14], ["CHR", 1, "shared", [2]], ["CA", 2, 3, 15], ["CHR", 0, "shared", [3]], ["CA", 1, 4, 15], ["FU", 10, [0, 1, 2, 3, 4]], ["SP", 10, 0, 6422528, [32], 1], ["AN", 10, 0, 5], ["AN", 10, 1, 6], ["FU", 5, [0, 1, 2, 3, 4]], ["AN", 5, 0, 5], ["FU", 5, [1, 2, 3, 4, 5]], ["AN", 5, 1, 4], ["FU", 5, [2, 3, 4, 5, 6]], ["AN", 5, 2, 6], ["FU", 3, [0, 1, 2]], ["SP", 3, 0, 64, [1], 1], ["AN", 3, 1, 2], ["FFSP", 3, 0, [7, 6, 5, 4, 3], 1, 1], ["AN", 3, 1, 6], ["FU", 1, [0, 1, 2, 3]], ["SP", 1, 0, 16, [1], 1], ["AN", 1, 1, 2], ["FFSP", 1, 0, [7, 6, 5, 4, 3], 1, 1], ["AN", 1, 1, 6], ["PR", 4, 0, "auto_unroll_max_step$1024"]]]], "r": [[0.000318699, 0.000318817, 0.000318741], 0, 36.5104, 1661923052], "v": "v0.6"}
{"i": [["[\"fused_conv1x1_bn_relu_stride\", 4, 56, 56, 256, 8, 64, 2]", "cuda -keys=cuda,gpu -max_num_threads=1024 -model=unknown -thread_warp_size=32", [-1, 16, 64, 49152, 2147483647, 1024, 8, 32], "", 0, []], [[], [["CI", 6], ["CI", 4], ["CHW", 2, "local"], ["SP", 2, 0, 4, [1, 1, 1, 4], 1], ["SP", 2, 5, 64, [2, 4, 2, 4], 1], ["SP", 2, 10, 28, [1, 7, 1, 1], 1], ["SP", 2, 15, 28, [1, 4, 1, 1], 1], ["SP", 2, 20, 8, [1, 1, 1, 2], 1], ["SP", 2, 25, 256, [1, 4], 1], ["RE", 2, [0, 5, 10, 15, 20, 1, 6, 11, 16, 21, 2, 7, 12, 17, 22, 25, 26, 3, 8, 13, 18, 23, 27, 4, 9, 14, 19, 24]], ["FSP", 3, 0, 3, 3], ["FSP", 3, 4, 4, 3], ["FSP", 3, 8, 5, 3], ["FSP", 3, 12, 6, 3], ["FSP", 3, 16, 7, 3], ["RE", 3, [0, 4, 8, 12, 16, 1, 5, 9, 13, 17, 2, 6, 10, 14, 18, 3, 7, 11, 15, 19]], ["CA", 2, 3, 14], ["CHR", 1, "shared", [2]], ["CA", 2, 3, 15], ["CHR", 0, "shared", [3]], ["CA", 1, 4, 15], ["FU", 10, [0, 1, 2, 3, 4]], ["SP", 10, 0, 6422528, [32], 1], ["AN", 10, 0, 5], ["AN", 10, 1, 6], ["FU", 5, [0, 1, 2, 3, 4]], ["AN", 5, 0, 5], ["FU", 5, [1, 2, 3, 4, 5]], ["AN", 5, 1, 4], ["FU", 5, [2, 3, 4, 5, 6]], ["AN", 5, 2, 6], ["FU", 3, [0, 1, 2]], ["SP", 3, 0, 64, [1], 1], ["AN", 3, 1, 2], ["FFSP", 3, 0, [7, 6, 5, 4, 3], 1, 1], ["AN", 3, 1, 6], ["FU", 1, [0, 1, 2, 3]], ["SP", 1, 0, 16, [1], 1], ["AN", 1, 1, 2], ["FFSP", 1, 0, [7, 6, 5, 4, 3], 1, 1], ["AN", 1, 1, 6], ["PR", 4, 0, "auto_unroll_max_step$1024"]]]], "r": [[0.000358858, 0.000359159, 0.000358798], 0, 35.9814, 1661923050], "v": "v0.6"}
{"i": [["[\"fused_conv1x1_bn_relu_stride\", 4, 56, 56, 256, 8, 64, 2]", "cuda -keys=cuda,gpu -max_num_threads=1024 -model=unknown -thread_warp_size=32", [-1, 16, 64, 49152, 2147483647, 1024, 8, 32], "", 0, []], [[], [["CI", 6], ["CI", 4], ["CHW", 2, "local"], ["SP", 2, 0, 4, [1, 1, 2, 1], 1], ["SP", 2, 5, 64, [1, 16, 2, 1], 1], ["SP", 2, 10, 28, [1, 1, 28, 1], 1], ["SP", 2, 15, 28, [1, 2, 1, 1], 1], ["SP", 2, 20, 8, [2, 1, 2, 2], 1], ["SP", 2, 25, 256, [2, 4], 1], ["RE", 2, [0, 5, 10, 15, 20, 1, 6, 11, 16, 21, 2, 7, 12, 17, 22, 25, 26, 3, 8, 13, 18, 23, 27, 4, 9, 14, 19, 24]], ["FSP", 3, 0, 3, 3], ["FSP", 3, 4, 4, 3], ["FSP", 3, 8, 5, 3], ["FSP", 3, 12, 6, 3], ["FSP", 3, 16, 7, 3], ["RE", 3, [0, 4, 8, 12, 16, 1, 5, 9, 13, 17, 2, 6, 10, 14, 18, 3, 7, 11, 15, 19]], ["CA", 2, 3, 14], ["CHR", 1, "shared", [2]], ["CA", 2, 3, 15], ["CHR", 0, "shared", [3]], ["CA", 1, 4, 15], ["FU", 10, [0, 1, 2, 3, 4]], ["SP", 10, 0, 6422528, [64], 1], ["AN", 10, 0, 5], ["AN", 10, 1, 6], ["FU", 5, [0, 1, 2, 3, 4]], ["AN", 5, 0, 5], ["FU", 5, [1, 2, 3, 4, 5]], ["AN", 5, 1, 4], ["FU", 5, [2, 3, 4, 5, 6]], ["AN", 5, 2, 6], ["FU", 3, [0, 1, 2]], ["SP", 3, 0, 64, [1], 1], ["AN", 3, 1, 2], ["FFSP", 3, 0, [7, 6, 5, 4, 3], 1, 1], ["AN", 3, 1, 6], ["FU", 1, [0, 1, 2, 3]], ["SP", 1, 0, 880, [1], 1], ["AN", 1, 1, 2], ["FFSP", 1, 0, [7, 6, 5, 4, 3], 1, 1], ["AN", 1, 1, 6], ["PR", 4, 0, "auto_unroll_max_step$512"]]]], "r": [[0.00201685, 0.00201667, 0.00203774], 0, 39.1995, 1661923053], "v": "v0.6"}
{"i": [["[\"fused_conv1x1_bn_relu_stride\", 4, 56, 56, 256, 8, 64, 2]", "cuda -keys=cuda,gpu -max_num_threads=1024 -model=unknown -thread_warp_size=32", [-1, 16, 64, 49152, 2147483647, 1024, 8, 32], "", 0, []], [[], [["CI", 6], ["CI", 4], ["CHW", 2, "local"], ["SP", 2, 0, 4, [2, 2, 1, 1], 1], ["SP", 2, 5, 64, [2, 8, 1, 2], 1], ["SP", 2, 10, 28, [1, 1, 1, 4], 1], ["SP", 2, 15, 28, [1, 2, 2, 1], 1], ["SP", 2, 20, 8, [1, 1, 8, 1], 1], ["SP", 2, 25, 256, [16, 1], 1], ["RE", 2, [0, 5, 10, 15, 20, 1, 6, 11, 16, 21, 2, 7, 12, 17, 22, 25, 26, 3, 8, 13, 18, 23, 27, 4, 9, 14, 19, 24]], ["FSP", 3, 0, 3, 3], ["FSP", 3, 4, 4, 3], ["FSP", 3, 8, 5, 3], ["FSP", 3, 12, 6, 3], ["FSP", 3, 16, 7, 3], ["RE", 3, [0, 4, 8, 12, 16, 1, 5, 9, 13, 17, 2, 6, 10, 14, 18, 3, 7, 11, 15, 19]], ["CA", 2, 3, 14], ["CHR", 1, "shared", [2]], ["CA", 2, 3, 15], ["CHR", 0, "shared", [3]], ["CA", 1, 4, 15], ["FU", 10, [0, 1, 2, 3, 4]], ["SP", 10, 0, 6422528, [32], 1], ["AN", 10, 0, 5], ["AN", 10, 1, 6], ["FU", 5, [0, 1, 2, 3, 4]], ["AN", 5, 0, 5], ["FU", 5, [1, 2, 3, 4, 5]], ["AN", 5, 1, 4], ["FU", 5, [2, 3, 4, 5, 6]], ["AN", 5, 2, 6], ["FU", 3, [0, 1, 2]], ["SP", 3, 0, 256, [1], 1], ["AN", 3, 1, 2], ["FFSP", 3, 0, [7, 6, 5, 4, 3], 1, 1], ["AN", 3, 1, 6], ["FU", 1, [0, 1, 2, 3]], ["SP", 1, 0, 168, [6], 1], ["AN", 1, 1, 2], ["FFSP", 1, 0, [7, 6, 5, 4, 3], 1, 1], ["AN", 1, 1, 6], ["PR", 4, 0, "auto_unroll_max_step$1024"]]]], "r": [[0.00194279, 0.00194185, 0.00194219], 0, 42.5784, 1661923055], "v": "v0.6"}
{"i": [["[\"fused_conv1x1_bn_relu_stride\", 4, 56, 56, 256, 8, 64, 2]", "cuda -keys=cuda,gpu -max_num_threads=1024 -model=unknown -thread_warp_size=32", [-1, 16, 64, 49152, 2147483647, 1024, 8, 32], "", 0, []], [[], [["CI", 6], ["CI", 4], ["CHW", 2, "local"], ["SP", 2, 0, 4, [1, 1, 1, 1], 1], ["SP", 2, 5, 64, [1, 2, 2, 8], 1], ["SP", 2, 10, 28, [1, 1, 4, 1], 1], ["SP", 2, 15, 28, [7, 1, 1, 1], 1], ["SP", 2, 20, 8, [1, 4, 1, 1], 1], ["SP", 2, 25, 256, [16, 1], 1], ["RE", 2, [0, 5, 10, 15, 20, 1, 6, 11, 16, 21, 2, 7, 12, 17, 22, 25, 26, 3, 8, 13, 18, 23, 27, 4, 9, 14, 19, 24]], ["FSP", 3, 0, 3, 3], ["FSP", 3, 4, 4, 3], ["FSP", 3, 8, 5, 3], ["FSP", 3, 12, 6, 3], ["FSP", 3, 16, 7, 3], ["RE", 3, [0, 4, 8, 12, 16, 1, 5, 9, 13, 17, 2, 6, 10, 14, 18, 3, 7, 11, 15, 19]], ["CA", 2, 3, 14], ["CHR", 1, "shared", [2]], ["CA", 2, 3, 15], ["CHR", 0, "shared", [3]], ["CA", 1, 4, 15], ["FU", 10, [0, 1, 2, 3, 4]], ["SP", 10, 0, 6422528, [32], 1], ["AN", 10, 0, 5], ["AN", 10, 1, 6], ["FU", 5, [0, 1, 2, 3, 4]], ["AN", 5, 0, 5], ["FU", 5, [1, 2, 3, 4, 5]], ["AN", 5, 1, 4], ["FU", 5, [2, 3, 4, 5, 6]], ["AN", 5, 2, 6], ["FU", 3, [0, 1, 2]], ["SP", 3, 0, 256, [1], 1], ["AN", 3, 1, 2], ["FFSP", 3, 0, [7, 6, 5, 4, 3], 1, 1], ["AN", 3, 1, 6], ["FU", 1, [0, 1, 2, 3]], ["SP", 1, 0, 112, [1], 1], ["AN", 1, 1, 2], ["FFSP", 1, 0, [7, 6, 5, 4, 3], 1, 1], ["AN", 1, 1, 6], ["PR", 4, 0, "auto_unroll_max_step$0"]]]], "r": [[0.00480631, 0.00480853, 0.00483592], 0, 42.1199, 1661923057], "v": "v0.6"}
{"i": [["[\"fused_conv1x1_bn_relu_stride\", 4, 56, 56, 256, 8, 64, 2]", "cuda -keys=cuda,gpu -max_num_threads=1024 -model=unknown -thread_warp_size=32", [-1, 16, 64, 49152, 2147483647, 1024, 8, 32], "", 0, []], [[], [["CI", 6], ["CI", 4], ["CHW", 2, "local"], ["SP", 2, 0, 4, [1, 1, 1, 1], 1], ["SP", 2, 5, 64, [1, 16, 1, 1], 1], ["SP", 2, 10, 28, [1, 2, 1, 2], 1], ["SP", 2, 15, 28, [2, 1, 1, 14], 1], ["SP", 2, 20, 8, [4, 1, 2, 1], 1], ["SP", 2, 25, 256, [2, 1], 1], ["RE", 2, [0, 5, 10, 15, 20, 1, 6, 11, 16, 21, 2, 7, 12, 17, 22, 25, 26, 3, 8, 13, 18, 23, 27, 4, 9, 14, 19, 24]], ["FSP", 3, 0, 3, 3], ["FSP", 3, 4, 4, 3], ["FSP", 3, 8, 5, 3], ["FSP", 3, 12, 6, 3], ["FSP", 3, 16, 7, 3], ["RE", 3, [0, 4, 8, 12, 16, 1, 5, 9, 13, 17, 2, 6, 10, 14, 18, 3, 7, 11, 15, 19]], ["CA", 2, 3, 14], ["CHR", 1, "shared", [2]], ["CA", 2, 3, 15], ["CHR", 0, "shared", [3]], ["CA", 1, 4, 15], ["FU", 10, [0, 1, 2, 3, 4]], ["SP", 10, 0, 6422528, [32], 1], ["AN", 10, 0, 5], ["AN", 10, 1, 6], ["FU", 5, [0, 1, 2, 3, 4]], ["AN", 5, 0, 5], ["FU", 5, [1, 2, 3, 4, 5]], ["AN", 5, 1, 4], ["FU", 5, [2, 3, 4, 5, 6]], ["AN", 5, 2, 6], ["FU", 3, [0, 1, 2]], ["SP", 3, 0, 4, [1], 1], ["AN", 3, 1, 2], ["FFSP", 3, 0, [7, 6, 5, 4, 3], 1, 1], ["AN", 3, 1, 6], ["FU", 1, [0, 1, 2, 3]], ["SP", 1, 0, 54, [18], 1], ["AN", 1, 1, 2], ["FFSP", 1, 0, [7, 6, 5, 4, 3], 1, 1], ["AN", 1, 1, 6], ["PR", 4, 0, "auto_unroll_max_step$0"]]]], "r": [[0.0135224, 0.0135536, 0.0135319], 0, 41.2247, 1661923056], "v": "v0.6"}
{"i": [["[\"fused_conv1x1_bn_relu_stride\", 4, 56, 56, 256, 8, 64, 2]", "cuda -keys=cuda,gpu -max_num_threads=1024 -model=unknown -thread_warp_size=32", [-1, 16, 64, 49152, 2147483647, 1024, 8, 32], "", 0, []], [[], [["CI", 6], ["CI", 4], ["CHW", 2, "local"], ["SP", 2, 0, 4, [1, 4, 1, 1], 1], ["SP", 2, 5, 64, [2, 2, 1, 16], 1], ["SP", 2, 10, 28, [1, 1, 4, 1], 1], ["SP", 2, 15, 28, [7, 1, 1, 1], 1], ["SP", 2, 20, 8, [1, 4, 1, 1], 1], ["SP", 2, 25, 256, [16, 1], 1], ["RE", 2, [0, 5, 10, 15, 20, 1, 6, 11, 16, 21, 2, 7, 12, 17, 22, 25, 26, 3, 8, 13, 18, 23, 27, 4, 9, 14, 19, 24]], ["FSP", 3, 0, 3, 3], ["FSP", 3, 4, 4, 3], ["FSP", 3, 8, 5, 3], ["FSP", 3, 12, 6, 3], ["FSP", 3, 16, 7, 3], ["RE", 3, [0, 4, 8, 12, 16, 1, 5, 9, 13, 17, 2, 6, 10, 14, 18, 3, 7, 11, 15, 19]], ["CA", 2, 3, 14], ["CHR", 1, "shared", [2]], ["CA", 2, 3, 15], ["CHR", 0, "shared", [3]], ["CA", 1, 4, 15], ["FU", 10, [0, 1, 2, 3, 4]], ["SP", 10, 0, 6422528, [32], 1], ["AN", 10, 0, 5], ["AN", 10, 1, 6], ["FU", 5, [0, 1, 2, 3, 4]], ["AN", 5, 0, 5], ["FU", 5, [1, 2, 3, 4, 5]], ["AN", 5, 1, 4], ["FU", 5, [2, 3, 4, 5, 6]], ["AN", 5, 2, 6], ["FU", 3, [0, 1, 2]], ["SP", 3, 0, 256, [1], 1], ["AN", 3, 1, 2], ["FFSP", 3, 0, [7, 6, 5, 4, 3], 1, 1], ["AN", 3, 1, 6], ["FU", 1, [0, 1, 2, 3]], ["SP", 1, 0, 112, [1], 1], ["AN", 1, 1, 2], ["FFSP", 1, 0, [7, 6, 5, 4, 3], 1, 1], ["AN", 1, 1, 6], ["PR", 4, 0, "auto_unroll_max_step$1024"]]]], "r": [[0.00369389, 0.00368437, 0.00368441], 0, 50.3786, 1661923059], "v": "v0.6"}
{"i": [["[\"fused_conv1x1_bn_relu_stride\", 4, 56, 56, 256, 8, 64, 2]", "cuda -keys=cuda,gpu -max_num_threads=1024 -model=unknown -thread_warp_size=32", [-1, 16, 64, 49152, 2147483647, 1024, 8, 32], "", 0, []], [[], [["CI", 6], ["CI", 4], ["CHW", 2, "local"], ["SP", 2, 0, 4, [1, 2, 2, 1], 1], ["SP", 2, 5, 64, [1, 32, 1, 2], 1], ["SP", 2, 10, 28, [1, 2, 1, 14], 1], ["SP", 2, 15, 28, [1, 1, 1, 1], 1], ["SP", 2, 20, 8, [2, 2, 1, 1], 1], ["SP", 2, 25, 256, [2, 8], 1], ["RE", 2, [0, 5, 10, 15, 20, 1, 6, 11, 16, 21, 2, 7, 12, 17, 22, 25, 26, 3, 8, 13, 18, 23, 27, 4, 9, 14, 19, 24]], ["FSP", 3, 0, 3, 3], ["FSP", 3, 4, 4, 3], ["FSP", 3, 8, 5, 3], ["FSP", 3, 12, 6, 3], ["FSP", 3, 16, 7, 3], ["RE", 3, [0, 4, 8, 12, 16, 1, 5, 9, 13, 17, 2, 6, 10, 14, 18, 3, 7, 11, 15, 19]], ["CA", 2, 3, 14], ["CHR", 1, "shared", [2]], ["CA", 2, 3, 15], ["CHR", 0, "shared", [3]], ["CA", 1, 4, 15], ["FU", 10, [0, 1, 2, 3, 4]], ["SP", 10, 0, 6422528, [32], 1], ["AN", 10, 0, 5], ["AN", 10, 1, 6], ["FU", 5, [0, 1, 2, 3, 4]], ["AN", 5, 0, 5], ["FU", 5, [1, 2, 3, 4, 5]], ["AN", 5, 1, 4], ["FU", 5, [2, 3, 4, 5, 6]], ["AN", 5, 2, 6], ["FU", 3, [0, 1, 2]], ["SP", 3, 0, 32, [1], 1], ["AN", 3, 1, 2], ["FFSP", 3, 0, [7, 6, 5, 4, 3], 1, 1], ["AN", 3, 1, 6], ["FU", 1, [0, 1, 2, 3]], ["SP", 1, 0, 864, [1], 1], ["AN", 1, 1, 2], ["FFSP", 1, 0, [7, 6, 5, 4, 3], 1, 1], ["AN", 1, 1, 6], ["PR", 4, 0, "auto_unroll_max_step$64"]]]], "r": [[0.000387573, 0.000387534, 0.000387452], 0, 44.9061, 1661923061], "v": "v0.6"}
{"i": [["[\"fused_conv1x1_bn_relu_stride\", 4, 56, 56, 256, 8, 64, 2]", "cuda -keys=cuda,gpu -max_num_threads=1024 -model=unknown -thread_warp_size=32", [-1, 16, 64, 49152, 2147483647, 1024, 8, 32], "", 0, []], [[], [["CI", 6], ["CI", 4], ["CHW", 2, "local"], ["SP", 2, 0, 4, [2, 2, 1, 1], 1], ["SP", 2, 5, 64, [4, 1, 8, 1], 1], ["SP", 2, 10, 28, [1, 28, 1, 1], 1], ["SP", 2, 15, 28, [1, 1, 1, 1], 1], ["SP", 2, 20, 8, [1, 8, 1, 1], 1], ["SP", 2, 25, 256, [1, 16], 1], ["RE", 2, [0, 5, 10, 15, 20, 1, 6, 11, 16, 21, 2, 7, 12, 17, 22, 25, 26, 3, 8, 13, 18, 23, 27, 4, 9, 14, 19, 24]], ["FSP", 3, 0, 3, 3], ["FSP", 3, 4, 4, 3], ["FSP", 3, 8, 5, 3], ["FSP", 3, 12, 6, 3], ["FSP", 3, 16, 7, 3], ["RE", 3, [0, 4, 8, 12, 16, 1, 5, 9, 13, 17, 2, 6, 10, 14, 18, 3, 7, 11, 15, 19]], ["CA", 2, 3, 14], ["CHR", 1, "shared", [2]], ["CA", 2, 3, 15], ["CHR", 0, "shared", [3]], ["CA", 1, 4, 15], ["FU", 10, [0, 1, 2, 3, 4]], ["SP", 10, 0, 6422528, [32], 1], ["AN", 10, 0, 5], ["AN", 10, 1, 6], ["FU", 5, [0, 1, 2, 3, 4]], ["AN", 5, 0, 5], ["FU", 5, [1, 2, 3, 4, 5]], ["AN", 5, 1, 4], ["FU", 5, [2, 3, 4, 5, 6]], ["AN", 5, 2, 6], ["FU", 3, [0, 1, 2]], ["SP", 3, 0, 512, [1], 1], ["AN", 3, 1, 2], ["FFSP", 3, 0, [7, 6, 5, 4, 3], 1, 1], ["AN", 3, 1, 6], ["FU", 1, [0, 1, 2, 3]], ["SP", 1, 0, 16, [4], 1], ["AN", 1, 1, 2], ["FFSP", 1, 0, [7, 6, 5, 4, 3], 1, 1], ["AN", 1, 1, 6], ["PR", 4, 0, "auto_unroll_max_step$64"]]]], "r": [[0.000300522, 0.00029999, 0.000299797], 0, 49.6614, 1661923066], "v": "v0.6"}
{"i": [["[\"fused_conv1x1_bn_relu_stride\", 4, 56, 56, 256, 8, 64, 2]", "cuda -keys=cuda,gpu -max_num_threads=1024 -model=unknown -thread_warp_size=32", [-1, 16, 64, 49152, 2147483647, 1024, 8, 32], "", 0, []], [[], [["CI", 6], ["CI", 4], ["CHW", 2, "local"], ["SP", 2, 0, 4, [1, 4, 1, 1], 1], ["SP", 2, 5, 64, [2, 1, 1, 32], 1], ["SP", 2, 10, 28, [1, 1, 2, 1], 1], ["SP", 2, 15, 28, [1, 7, 2, 2], 1], ["SP", 2, 20, 8, [2, 2, 1, 2], 1], ["SP", 2, 25, 256, [1, 4], 1], ["RE", 2, [0, 5, 10, 15, 20, 1, 6, 11, 16, 21, 2, 7, 12, 17, 22, 25, 26, 3, 8, 13, 18, 23, 27, 4, 9, 14, 19, 24]], ["FSP", 3, 0, 3, 3], ["FSP", 3, 4, 4, 3], ["FSP", 3, 8, 5, 3], ["FSP", 3, 12, 6, 3], ["FSP", 3, 16, 7, 3], ["RE", 3, [0, 4, 8, 12, 16, 1, 5, 9, 13, 17, 2, 6, 10, 14, 18, 3, 7, 11, 15, 19]], ["CA", 2, 3, 14], ["CHR", 1, "shared", [2]], ["CA", 2, 3, 15], ["CHR", 0, "shared", [3]], ["CA", 1, 4, 15], ["FU", 10, [0, 1, 2, 3, 4]], ["SP", 10, 0, 6422528, [32], 1], ["AN", 10, 0, 5], ["AN", 10, 1, 6], ["FU", 5, [0, 1, 2, 3, 4]], ["AN", 5, 0, 5], ["FU", 5, [1, 2, 3, 4, 5]], ["AN", 5, 1, 4], ["FU", 5, [2, 3, 4, 5, 6]], ["AN", 5, 2, 6], ["FU", 3, [0, 1, 2]], ["SP", 3, 0, 64, [1], 1], ["AN", 3, 1, 2], ["FFSP", 3, 0, [7, 6, 5, 4, 3], 1, 1], ["AN", 3, 1, 6], ["FU", 1, [0, 1, 2, 3]], ["SP", 1, 0, 84, [7], 1], ["AN", 1, 1, 2], ["FFSP", 1, 0, [7, 6, 5, 4, 3], 1, 1], ["AN", 1, 1, 6], ["PR", 4, 0, "auto_unroll_max_step$16"]]]], "r": [[0.0100087, 0.0100017, 0.0100132], 0, 46.8259, 1661923062], "v": "v0.6"}
{"i": [["[\"fused_conv1x1_bn_relu_stride\", 4, 56, 56, 256, 8, 64, 2]", "cuda -keys=cuda,gpu -max_num_threads=1024 -model=unknown -thread_warp_size=32", [-1, 16, 64, 49152, 2147483647, 1024, 8, 32], "", 0, []], [[], [["CI", 6], ["CI", 4], ["CHW", 2, "local"], ["SP", 2, 0, 4, [1, 4, 1, 1], 1], ["SP", 2, 5, 64, [1, 32, 1, 2], 1], ["SP", 2, 10, 28, [1, 2, 7, 2], 1], ["SP", 2, 15, 28, [1, 1, 4, 1], 1], ["SP", 2, 20, 8, [1, 1, 1, 4], 1], ["SP", 2, 25, 256, [2, 2], 1], ["RE", 2, [0, 5, 10, 15, 20, 1, 6, 11, 16, 21, 2, 7, 12, 17, 22, 25, 26, 3, 8, 13, 18, 23, 27, 4, 9, 14, 19, 24]], ["FSP", 3, 0, 3, 3], ["FSP", 3, 4, 4, 3], ["FSP", 3, 8, 5, 3], ["FSP", 3, 12, 6, 3], ["FSP", 3, 16, 7, 3], ["RE", 3, [0, 4, 8, 12, 16, 1, 5, 9, 13, 17, 2, 6, 10, 14, 18, 3, 7, 11, 15, 19]], ["CA", 2, 3, 14], ["CHR", 1, "shared", [2]], ["CA", 2, 3, 15], ["CHR", 0, "shared", [3]], ["CA", 1, 4, 15], ["FU", 10, [0, 1, 2, 3, 4]], ["SP", 10, 0, 6422528, [64], 1], ["AN", 10, 0, 5], ["AN", 10, 1, 6], ["FU", 5, [0, 1, 2, 3, 4]], ["AN", 5, 0, 5], ["FU", 5, [1, 2, 3, 4, 5]], ["AN", 5, 1, 4], ["FU", 5, [2, 3, 4, 5, 6]], ["AN", 5, 2, 6], ["FU", 3, [0, 1, 2]], ["SP", 3, 0, 64, [1], 1], ["AN", 3, 1, 2], ["FFSP", 3, 0, [7, 6, 5, 4, 3], 1, 1], ["AN", 3, 1, 6], ["FU", 1, [0, 1, 2, 3]], ["SP", 1, 0, 364, [26], 1], ["AN", 1, 1, 2], ["FFSP", 1, 0, [7, 6, 5, 4, 3], 1, 1], ["AN", 1, 1, 6], ["PR", 4, 0, "auto_unroll_max_step$16"]]]], "r": [[0.00254313, 0.00254403, 0.00254291], 0, 51.4477, 1661923067], "v": "v0.6"}
{"i": [["[\"fused_conv1x1_bn_relu_stride\", 4, 56, 56, 256, 8, 64, 2]", "cuda -keys=cuda,gpu -max_num_threads=1024 -model=unknown -thread_warp_size=32", [-1, 16, 64, 49152, 2147483647, 1024, 8, 32], "", 0, []], [[], [["CI", 6], ["CI", 4], ["CHW", 2, "local"], ["SP", 2, 0, 4, [2, 1, 2, 1], 1], ["SP", 2, 5, 64, [1, 32, 2, 1], 1], ["SP", 2, 10, 28, [1, 2, 1, 1], 1], ["SP", 2, 15, 28, [1, 4, 7, 1], 1], ["SP", 2, 20, 8, [1, 1, 8, 1], 1], ["SP", 2, 25, 256, [1, 1], 1], ["RE", 2, [0, 5, 10, 15, 20, 1, 6, 11, 16, 21, 2, 7, 12, 17, 22, 25, 26, 3, 8, 13, 18, 23, 27, 4, 9, 14, 19, 24]], ["FSP", 3, 0, 3, 3], ["FSP", 3, 4, 4, 3], ["FSP", 3, 8, 5, 3], ["FSP", 3, 12, 6, 3], ["FSP", 3, 16, 7, 3], ["RE", 3, [0, 4, 8, 12, 16, 1, 5, 9, 13, 17, 2, 6, 10, 14, 18, 3, 7, 11, 15, 19]], ["CA", 2, 3, 14], ["CHR", 1, "shared", [2]], ["CA", 2, 3, 15], ["CHR", 0, "shared", [3]], ["CA", 1, 4, 15], ["FU", 10, [0, 1, 2, 3, 4]], ["SP", 10, 0, 6422528, [2], 1], ["AN", 10, 0, 5], ["AN", 10, 1, 6], ["FU", 5, [0, 1, 2, 3, 4]], ["AN", 5, 0, 5], ["FU", 5, [1, 2, 3, 4, 5]], ["AN", 5, 1, 4], ["FU", 5, [2, 3, 4, 5, 6]], ["AN", 5, 2, 6], ["FU", 3, [0, 1, 2]], ["SP", 3, 0, 64, [1], 1], ["AN", 3, 1, 2], ["FFSP", 3, 0, [7, 6, 5, 4, 3], 1, 1], ["AN", 3, 1, 6], ["FU", 1, [0, 1, 2, 3]], ["SP", 1, 0, 104, [1], 1], ["AN", 1, 1, 2], ["FFSP", 1, 0, [7, 6, 5, 4, 3], 1, 1], ["AN", 1, 1, 6], ["PR", 4, 0, "auto_unroll_max_step$512"]]]], "r": [[0.00768209, 0.00767545, 0.00768091], 0, 49.7492, 1661923064], "v": "v0.6"}
{"i": [["[\"fused_conv1x1_bn_relu_stride\", 4, 56, 56, 256, 8, 64, 2]", "cuda -keys=cuda,gpu -max_num_threads=1024 -model=unknown -thread_warp_size=32", [-1, 16, 64, 49152, 2147483647, 1024, 8, 32], "", 0, []], [[], [["CI", 6], ["CI", 4], ["CHW", 2, "local"], ["SP", 2, 0, 4, [1, 1, 1, 2], 1], ["SP", 2, 5, 64, [2, 8, 2, 1], 1], ["SP", 2, 10, 28, [1, 1, 7, 1], 1], ["SP", 2, 15, 28, [2, 2, 7, 1], 1], ["SP", 2, 20, 8, [2, 2, 1, 2], 1], ["SP", 2, 25, 256, [1, 1], 1], ["RE", 2, [0, 5, 10, 15, 20, 1, 6, 11, 16, 21, 2, 7, 12, 17, 22, 25, 26, 3, 8, 13, 18, 23, 27, 4, 9, 14, 19, 24]], ["FSP", 3, 0, 3, 3], ["FSP", 3, 4, 4, 3], ["FSP", 3, 8, 5, 3], ["FSP", 3, 12, 6, 3], ["FSP", 3, 16, 7, 3], ["RE", 3, [0, 4, 8, 12, 16, 1, 5, 9, 13, 17, 2, 6, 10, 14, 18, 3, 7, 11, 15, 19]], ["CA", 2, 3, 14], ["CHR", 1, "shared", [2]], ["CA", 2, 3, 15], ["CHR", 0, "shared", [3]], ["CA", 1, 4, 15], ["FU", 10, [0, 1, 2, 3, 4]], ["SP", 10, 0, 6422528, [32], 1], ["AN", 10, 0, 5], ["AN", 10, 1, 6], ["FU", 5, [0, 1, 2, 3, 4]], ["AN", 5, 0, 5], ["FU", 5, [1, 2, 3, 4, 5]], ["AN", 5, 1, 4], ["FU", 5, [2, 3, 4, 5, 6]], ["AN", 5, 2, 6], ["FU", 3, [0, 1, 2]], ["SP", 3, 0, 4, [1], 1], ["AN", 3, 1, 2], ["FFSP", 3, 0, [7, 6, 5, 4, 3], 1, 1], ["AN", 3, 1, 6], ["FU", 1, [0, 1, 2, 3]], ["SP", 1, 0, 169, [1], 1], ["AN", 1, 1, 2], ["FFSP", 1, 0, [7, 6, 5, 4, 3], 1, 1], ["AN", 1, 1, 6], ["PR", 4, 0, "auto_unroll_max_step$512"]]]], "r": [[0.0132583, 0.0132488, 0.0132569], 0, 55.0477, 1661923069], "v": "v0.6"}
{"i": [["[\"fused_conv1x1_bn_relu_stride\", 4, 56, 56, 256, 8, 64, 2]", "cuda -keys=cuda,gpu -max_num_threads=1024 -model=unknown -thread_warp_size=32", [-1, 16, 64, 49152, 2147483647, 1024, 8, 32], "", 0, []], [[], [["CI", 6], ["CI", 4], ["CHW", 2, "local"], ["SP", 2, 0, 4, [1, 2, 1, 1], 1], ["SP", 2, 5, 64, [2, 8, 2, 1], 1], ["SP", 2, 10, 28, [1, 2, 7, 1], 1], ["SP", 2, 15, 28, [2, 2, 7, 1], 1], ["SP", 2, 20, 8, [2, 2, 1, 2], 1], ["SP", 2, 25, 256, [1, 1], 1], ["RE", 2, [0, 5, 10, 15, 20, 1, 6, 11, 16, 21, 2, 7, 12, 17, 22, 25, 26, 3, 8, 13, 18, 23, 27, 4, 9, 14, 19, 24]], ["FSP", 3, 0, 3, 3], ["FSP", 3, 4, 4, 3], ["FSP", 3, 8, 5, 3], ["FSP", 3, 12, 6, 3], ["FSP", 3, 16, 7, 3], ["RE", 3, [0, 4, 8, 12, 16, 1, 5, 9, 13, 17, 2, 6, 10, 14, 18, 3, 7, 11, 15, 19]], ["CA", 2, 3, 14], ["CHR", 1, "shared", [2]], ["CA", 2, 3, 15], ["CHR", 0, "shared", [3]], ["CA", 1, 4, 15], ["FU", 10, [0, 1, 2, 3, 4]], ["SP", 10, 0, 6422528, [32], 1], ["AN", 10, 0, 5], ["AN", 10, 1, 6], ["FU", 5, [0, 1, 2, 3, 4]], ["AN", 5, 0, 5], ["FU", 5, [1, 2, 3, 4, 5]], ["AN", 5, 1, 4], ["FU", 5, [2, 3, 4, 5, 6]], ["AN", 5, 2, 6], ["FU", 3, [0, 1, 2]], ["SP", 3, 0, 4, [1], 1], ["AN", 3, 1, 2], ["FFSP", 3, 0, [7, 6, 5, 4, 3], 1, 1], ["AN", 3, 1, 6], ["FU", 1, [0, 1, 2, 3]], ["SP", 1, 0, 169, [1], 1], ["AN", 1, 1, 2], ["FFSP", 1, 0, [7, 6, 5, 4, 3], 1, 1], ["AN", 1, 1, 6], ["PR", 4, 0, "auto_unroll_max_step$1024"]]]], "r": [[0.00754477, 0.00756069, 0.00754755], 0, 59.765, 1661923068], "v": "v0.6"}
{"i": [["[\"fused_conv1x1_bn_relu_stride\", 4, 56, 56, 256, 8, 64, 2]", "cuda -keys=cuda,gpu -max_num_threads=1024 -model=unknown -thread_warp_size=32", [-1, 16, 64, 49152, 2147483647, 1024, 8, 32], "", 0, []], [[], [["CI", 6], ["CI", 4], ["CHW", 2, "local"], ["SP", 2, 0, 4, [1, 4, 1, 1], 1], ["SP", 2, 5, 64, [1, 2, 2, 16], 1], ["SP", 2, 10, 28, [1, 1, 4, 1], 1], ["SP", 2, 15, 28, [7, 1, 1, 1], 1], ["SP", 2, 20, 8, [1, 4, 1, 1], 1], ["SP", 2, 25, 256, [16, 1], 1], ["RE", 2, [0, 5, 10, 15, 20, 1, 6, 11, 16, 21, 2, 7, 12, 17, 22, 25, 26, 3, 8, 13, 18, 23, 27, 4, 9, 14, 19, 24]], ["FSP", 3, 0, 3, 3], ["FSP", 3, 4, 4, 3], ["FSP", 3, 8, 5, 3], ["FSP", 3, 12, 6, 3], ["FSP", 3, 16, 7, 3], ["RE", 3, [0, 4, 8, 12, 16, 1, 5, 9, 13, 17, 2, 6, 10, 14, 18, 3, 7, 11, 15, 19]], ["CA", 2, 3, 14], ["CHR", 1, "shared", [2]], ["CA", 2, 3, 15], ["CHR", 0, "shared", [3]], ["CA", 1, 4, 15], ["FU", 10, [0, 1, 2, 3, 4]], ["SP", 10, 0, 6422528, [32], 1], ["AN", 10, 0, 5], ["AN", 10, 1, 6], ["FU", 5, [0, 1, 2, 3, 4]], ["AN", 5, 0, 5], ["FU", 5, [1, 2, 3, 4, 5]], ["AN", 5, 1, 4], ["FU", 5, [2, 3, 4, 5, 6]], ["AN", 5, 2, 6], ["FU", 3, [0, 1, 2]], ["SP", 3, 0, 256, [1], 1], ["AN", 3, 1, 2], ["FFSP", 3, 0, [7, 6, 5, 4, 3], 1, 1], ["AN", 3, 1, 6], ["FU", 1, [0, 1, 2, 3]], ["SP", 1, 0, 112, [1], 1], ["AN", 1, 1, 2], ["FFSP", 1, 0, [7, 6, 5, 4, 3], 1, 1], ["AN", 1, 1, 6], ["PR", 4, 0, "auto_unroll_max_step$0"]]]], "r": [[0.00252182, 0.00252558, 0.00251741], 0, 47.484, 1661923063], "v": "v0.6"}
{"i": [["[\"fused_conv1x1_bn_relu_stride\", 4, 56, 56, 256, 8, 64, 2]", "cuda -keys=cuda,gpu -max_num_threads=1024 -model=unknown -thread_warp_size=32", [-1, 16, 64, 49152, 2147483647, 1024, 8, 32], "", 0, []], [[], [["CI", 6], ["CI", 4], ["CHW", 2, "local"], ["SP", 2, 0, 4, [1, 1, 1, 4], 1], ["SP", 2, 5, 64, [2, 4, 2, 4], 1], ["SP", 2, 10, 28, [1, 7, 1, 1], 1], ["SP", 2, 15, 28, [1, 4, 1, 1], 1], ["SP", 2, 20, 8, [1, 1, 1, 1], 1], ["SP", 2, 25, 256, [1, 4], 1], ["RE", 2, [0, 5, 10, 15, 20, 1, 6, 11, 16, 21, 2, 7, 12, 17, 22, 25, 26, 3, 8, 13, 18, 23, 27, 4, 9, 14, 19, 24]], ["FSP", 3, 0, 3, 3], ["FSP", 3, 4, 4, 3], ["FSP", 3, 8, 5, 3], ["FSP", 3, 12, 6, 3], ["FSP", 3, 16, 7, 3], ["RE", 3, [0, 4, 8, 12, 16, 1, 5, 9, 13, 17, 2, 6, 10, 14, 18, 3, 7, 11, 15, 19]], ["CA", 2, 3, 14], ["CHR", 1, "shared", [2]], ["CA", 2, 3, 15], ["CHR", 0, "shared", [3]], ["CA", 1, 4, 15], ["FU", 10, [0, 1, 2, 3, 4]], ["SP", 10, 0, 6422528, [32], 1], ["AN", 10, 0, 5], ["AN", 10, 1, 6], ["FU", 5, [0, 1, 2, 3, 4]], ["AN", 5, 0, 5], ["FU", 5, [1, 2, 3, 4, 5]], ["AN", 5, 1, 4], ["FU", 5, [2, 3, 4, 5, 6]], ["AN", 5, 2, 6], ["FU", 3, [0, 1, 2]], ["SP", 3, 0, 64, [1], 1], ["AN", 3, 1, 2], ["FFSP", 3, 0, [7, 6, 5, 4, 3], 1, 1], ["AN", 3, 1, 6], ["FU", 1, [0, 1, 2, 3]], ["SP", 1, 0, 16, [1], 1], ["AN", 1, 1, 2], ["FFSP", 1, 0, [7, 6, 5, 4, 3], 1, 1], ["AN", 1, 1, 6], ["PR", 4, 0, "auto_unroll_max_step$1024"]]]], "r": [[0.000324935, 0.000325056, 0.000324959], 0, 53.31, 1661923070], "v": "v0.6"}
{"i": [["[\"fused_conv1x1_bn_relu_stride\", 4, 56, 56, 256, 8, 64, 2]", "cuda -keys=cuda,gpu -max_num_threads=1024 -model=unknown -thread_warp_size=32", [-1, 16, 64, 49152, 2147483647, 1024, 8, 32], "", 0, []], [[], [["CI", 6], ["CI", 4], ["CHW", 2, "local"], ["SP", 2, 0, 4, [1, 4, 1, 1], 1], ["SP", 2, 5, 64, [2, 1, 4, 2], 1], ["SP", 2, 10, 28, [1, 4, 1, 1], 1], ["SP", 2, 15, 28, [2, 14, 1, 1], 1], ["SP", 2, 20, 8, [1, 2, 2, 1], 1], ["SP", 2, 25, 256, [1, 2], 1], ["RE", 2, [0, 5, 10, 15, 20, 1, 6, 11, 16, 21, 2, 7, 12, 17, 22, 25, 26, 3, 8, 13, 18, 23, 27, 4, 9, 14, 19, 24]], ["FSP", 3, 0, 3, 3], ["FSP", 3, 4, 4, 3], ["FSP", 3, 8, 5, 3], ["FSP", 3, 12, 6, 3], ["FSP", 3, 16, 7, 3], ["RE", 3, [0, 4, 8, 12, 16, 1, 5, 9, 13, 17, 2, 6, 10, 14, 18, 3, 7, 11, 15, 19]], ["CA", 2, 3, 14], ["CHR", 1, "shared", [2]], ["CA", 2, 3, 15], ["CHR", 0, "shared", [3]], ["CA", 1, 4, 15], ["FU", 10, [0, 1, 2, 3, 4]], ["SP", 10, 0, 6422528, [32], 1], ["AN", 10, 0, 5], ["AN", 10, 1, 6], ["FU", 5, [0, 1, 2, 3, 4]], ["AN", 5, 0, 5], ["FU", 5, [1, 2, 3, 4, 5]], ["AN", 5, 1, 4], ["FU", 5, [2, 3, 4, 5, 6]], ["AN", 5, 2, 6], ["FU", 3, [0, 1, 2]], ["SP", 3, 0, 32, [1], 1], ["AN", 3, 1, 2], ["FFSP", 3, 0, [7, 6, 5, 4, 3], 1, 1], ["AN", 3, 1, 6], ["FU", 1, [0, 1, 2, 3]], ["SP", 1, 0, 24, [1], 1], ["AN", 1, 1, 2], ["FFSP", 1, 0, [7, 6, 5, 4, 3], 1, 1], ["AN", 1, 1, 6], ["PR", 4, 0, "auto_unroll_max_step$1024"]]]], "r": [[0.000504209, 0.000504157, 0.000503188], 0, 53.1587, 1661923072], "v": "v0.6"}
