python/models/mmoe/kernel_configs/MMoE_hfuse_relu_1_100_16_8_2
{"i": [["[\"hfuse_relu\", 1, 100, 16, 8, 2]", "cuda -keys=cuda,gpu -max_num_threads=1024 -model=unknown -thread_warp_size=32", [-1, 16, 64, 49152, 2147483647, 1024, 8, 32], "", 0, []], [[], [["FU", 1, [0, 1, 2]], ["SP", 1, 0, 128, [8], 1], ["AN", 1, 0, 5], ["AN", 1, 1, 6]]]], "r": [[2.57458e-06, 2.56625e-06, 2.56812e-06], 0, 1.11337, 1668099335], "v": "v0.6"}
{"i": [["[\"hfuse_relu\", 1, 100, 16, 8, 2]", "cuda -keys=cuda,gpu -max_num_threads=1024 -model=unknown -thread_warp_size=32", [-1, 16, 64, 49152, 2147483647, 1024, 8, 32], "", 0, []], [[], [["FU", 1, [0, 1, 2]], ["SP", 1, 0, 128, [4], 1], ["AN", 1, 0, 5], ["AN", 1, 1, 6]]]], "r": [[2.61938e-06, 2.61178e-06, 2.61331e-06], 0, 0.507748, 1668099335], "v": "v0.6"}
{"i": [["[\"hfuse_relu\", 1, 100, 16, 8, 2]", "cuda -keys=cuda,gpu -max_num_threads=1024 -model=unknown -thread_warp_size=32", [-1, 16, 64, 49152, 2147483647, 1024, 8, 32], "", 0, []], [[], [["FU", 1, [0, 1, 2]], ["SP", 1, 0, 128, [1], 1], ["AN", 1, 0, 5], ["AN", 1, 1, 6]]]], "r": [[2.7911e-06, 2.80273e-06, 2.80732e-06], 0, 0.806896, 1668099335], "v": "v0.6"}
{"i": [["[\"hfuse_relu\", 1, 100, 16, 8, 2]", "cuda -keys=cuda,gpu -max_num_threads=1024 -model=unknown -thread_warp_size=32", [-1, 16, 64, 49152, 2147483647, 1024, 8, 32], "", 0, []], [[], [["FU", 1, [0, 1, 2]], ["SP", 1, 0, 128, [16], 1], ["AN", 1, 0, 5], ["AN", 1, 1, 6]]]], "r": [[2.71342e-06, 2.73316e-06, 2.7194e-06], 0, 1.75446, 1668099336], "v": "v0.6"}
{"i": [["[\"hfuse_relu\", 1, 100, 16, 8, 2]", "cuda -keys=cuda,gpu -max_num_threads=1024 -model=unknown -thread_warp_size=32", [-1, 16, 64, 49152, 2147483647, 1024, 8, 32], "", 0, []], [[], [["FU", 1, [0, 1, 2]], ["SP", 1, 0, 128, [2], 1], ["AN", 1, 0, 5], ["AN", 1, 1, 6]]]], "r": [[2.61764e-06, 2.61073e-06, 2.61248e-06], 0, 1.45704, 1668099336], "v": "v0.6"}
{"i": [["[\"hfuse_relu\", 1, 100, 16, 8, 2]", "cuda -keys=cuda,gpu -max_num_threads=1024 -model=unknown -thread_warp_size=32", [-1, 16, 64, 49152, 2147483647, 1024, 8, 32], "", 0, []], [[], [["FU", 1, [0, 1, 2]], ["SP", 1, 0, 128, [64], 1], ["AN", 1, 0, 5], ["AN", 1, 1, 6]]]], "r": [[2.62261e-06, 2.61829e-06, 2.61694e-06], 0, 2.06392, 1668099336], "v": "v0.6"}
{"i": [["[\"hfuse_relu\", 1, 100, 16, 8, 2]", "cuda -keys=cuda,gpu -max_num_threads=1024 -model=unknown -thread_warp_size=32", [-1, 16, 64, 49152, 2147483647, 1024, 8, 32], "", 0, []], [[], [["FU", 1, [0, 1, 2]], ["SP", 1, 0, 128, [32], 1], ["AN", 1, 0, 5], ["AN", 1, 1, 6]]]], "r": [[2.48993e-06, 2.47918e-06, 2.48127e-06], 0, 2.40623, 1668099337], "v": "v0.6"}
{"i": [["[\"hfuse_relu\", 1, 100, 16, 8, 2]", "cuda -keys=cuda,gpu -max_num_threads=1024 -model=unknown -thread_warp_size=32", [-1, 16, 64, 49152, 2147483647, 1024, 8, 32], "", 0, []], [[], [["FU", 1, [0, 1, 2]], ["SP", 1, 0, 128, [32], 1], ["AN", 1, 0, 5], ["AN", 1, 1, 6]]]], "r": [[2.66711e-06, 2.67945e-06, 2.69172e-06], 0, 0.782594, 1668099757], "v": "v0.6"}
{"i": [["[\"hfuse_relu\", 1, 100, 16, 8, 2]", "cuda -keys=cuda,gpu -max_num_threads=1024 -model=unknown -thread_warp_size=32", [-1, 16, 64, 49152, 2147483647, 1024, 8, 32], "", 0, []], [[], [["FU", 1, [0, 1, 2]], ["SP", 1, 0, 128, [1], 1], ["AN", 1, 0, 5], ["AN", 1, 1, 6]]]], "r": [[2.86246e-06, 2.87214e-06, 2.88248e-06], 0, 0.487782, 1668099757], "v": "v0.6"}
{"i": [["[\"hfuse_relu\", 1, 100, 16, 8, 2]", "cuda -keys=cuda,gpu -max_num_threads=1024 -model=unknown -thread_warp_size=32", [-1, 16, 64, 49152, 2147483647, 1024, 8, 32], "", 0, []], [[], [["FU", 1, [0, 1, 2]], ["SP", 1, 0, 128, [64], 1], ["AN", 1, 0, 5], ["AN", 1, 1, 6]]]], "r": [[2.50822e-06, 2.50837e-06, 2.51016e-06], 0, 1.43482, 1668099758], "v": "v0.6"}
{"i": [["[\"hfuse_relu\", 1, 100, 16, 8, 2]", "cuda -keys=cuda,gpu -max_num_threads=1024 -model=unknown -thread_warp_size=32", [-1, 16, 64, 49152, 2147483647, 1024, 8, 32], "", 0, []], [[], [["FU", 1, [0, 1, 2]], ["SP", 1, 0, 128, [16], 1], ["AN", 1, 0, 5], ["AN", 1, 1, 6]]]], "r": [[2.47388e-06, 2.4626e-06, 2.46294e-06], 0, 1.07879, 1668099757], "v": "v0.6"}
{"i": [["[\"hfuse_relu\", 1, 100, 16, 8, 2]", "cuda -keys=cuda,gpu -max_num_threads=1024 -model=unknown -thread_warp_size=32", [-1, 16, 64, 49152, 2147483647, 1024, 8, 32], "", 0, []], [[], [["FU", 1, [0, 1, 2]], ["SP", 1, 0, 128, [4], 1], ["AN", 1, 0, 5], ["AN", 1, 1, 6]]]], "r": [[2.47176e-06, 2.46124e-06, 2.46468e-06], 0, 1.72702, 1668099758], "v": "v0.6"}
{"i": [["[\"hfuse_relu\", 1, 100, 16, 8, 2]", "cuda -keys=cuda,gpu -max_num_threads=1024 -model=unknown -thread_warp_size=32", [-1, 16, 64, 49152, 2147483647, 1024, 8, 32], "", 0, []], [[], [["FU", 1, [0, 1, 2]], ["SP", 1, 0, 128, [8], 1], ["AN", 1, 0, 5], ["AN", 1, 1, 6]]]], "r": [[2.52171e-06, 2.52323e-06, 2.52008e-06], 0, 2.36608, 1668099759], "v": "v0.6"}
{"i": [["[\"hfuse_relu\", 1, 100, 16, 8, 2]", "cuda -keys=cuda,gpu -max_num_threads=1024 -model=unknown -thread_warp_size=32", [-1, 16, 64, 49152, 2147483647, 1024, 8, 32], "", 0, []], [[], [["FU", 1, [0, 1, 2]], ["SP", 1, 0, 128, [2], 1], ["AN", 1, 0, 5], ["AN", 1, 1, 6]]]], "r": [[2.52086e-06, 2.52048e-06, 2.51943e-06], 0, 2.01612, 1668099758], "v": "v0.6"}
