python/models/mmoe/kernel_configs/MMoE_select_experts_1_100_16_8_2
{"i": [["[\"MMoE_select_experts\", 1, 16, 8, 2]", "cuda -keys=cuda,gpu -max_num_threads=1024 -model=unknown -thread_warp_size=32", [-1, 16, 64, 49152, 2147483647, 1024, 8, 32], "", 0, []], [[], [["CI", 2], ["FU", 3, [0, 1, 2]], ["AN", 3, 0, 6], ["PR", 3, 0, "auto_unroll_max_step$0"]]]], "r": [[3.26808e-06, 3.2753e-06, 3.26943e-06, 3.26347e-06, 3.2494e-06, 3.25586e-06, 3.27325e-06, 3.27473e-06, 3.2613e-06, 3.29904e-06], 0, 10.2262, 1649066231], "v": "v0.6"}
{"i": [["[\"MMoE_select_experts\", 1, 16, 8, 2]", "cuda -keys=cuda,gpu -max_num_threads=1024 -model=unknown -thread_warp_size=32", [-1, 16, 64, 49152, 2147483647, 1024, 8, 32], "", 0, []], [[], [["CI", 2], ["FU", 3, [0, 1, 2]], ["AN", 3, 0, 6], ["PR", 3, 0, "auto_unroll_max_step$512"]]]], "r": [[3.29466e-06, 3.27266e-06, 3.27306e-06, 3.25193e-06, 3.2622e-06, 3.25664e-06, 3.26047e-06, 3.25547e-06, 3.26526e-06, 3.2608e-06], 0, 21.5766, 1649066242], "v": "v0.6"}
{"i": [["[\"MMoE_select_experts\", 1, 16, 8, 2]", "cuda -keys=cuda,gpu -max_num_threads=1024 -model=unknown -thread_warp_size=32", [-1, 16, 64, 49152, 2147483647, 1024, 8, 32], "", 0, []], [[], [["CI", 2], ["FU", 3, [0, 1, 2]], ["AN", 3, 0, 6], ["PR", 3, 0, "auto_unroll_max_step$64"]]]], "r": [[3.24096e-06, 3.26654e-06, 3.26426e-06, 3.25306e-06, 3.25397e-06, 3.25145e-06, 3.25108e-06, 3.28191e-06, 3.25766e-06, 3.2386e-06], 0, 4.58811, 1649066225], "v": "v0.6"}
{"i": [["[\"MMoE_select_experts\", 1, 16, 8, 2]", "cuda -keys=cuda,gpu -max_num_threads=1024 -model=unknown -thread_warp_size=32", [-1, 16, 64, 49152, 2147483647, 1024, 8, 32], "", 0, []], [[], [["CI", 2], ["FU", 3, [0, 1, 2]], ["AN", 3, 0, 6], ["PR", 3, 0, "auto_unroll_max_step$1024"]]]], "r": [[3.27175e-06, 3.28161e-06, 3.27039e-06, 3.26478e-06, 3.25125e-06, 3.26826e-06, 3.26877e-06, 3.26157e-06, 3.26145e-06, 3.27037e-06], 0, 15.8883, 1649066236], "v": "v0.6"}
{"i": [["[\"MMoE_select_experts\", 1, 16, 8, 2]", "cuda -keys=cuda,gpu -max_num_threads=1024 -model=unknown -thread_warp_size=32", [-1, 16, 64, 49152, 2147483647, 1024, 8, 32], "", 0, []], [[], [["CI", 2], ["FU", 3, [0, 1, 2]], ["AN", 3, 0, 6], ["PR", 3, 0, "auto_unroll_max_step$16"]]]], "r": [[3.23347e-06, 3.25384e-06, 3.26333e-06, 3.27251e-06, 3.26351e-06, 3.26139e-06, 3.2559e-06, 3.26223e-06, 3.25158e-06, 3.25281e-06], 0, 27.2329, 1649066248], "v": "v0.6"}
{"i": [["[\"MMoE_select_experts\", 1, 16, 8, 2]", "cuda -keys=cuda,gpu -max_num_threads=1024 -model=unknown -thread_warp_size=32", [-1, 16, 64, 49152, 2147483647, 1024, 8, 32], "", 0, []], [[], [["CI", 2], ["FU", 3, [0, 1, 2]], ["AN", 3, 0, 6], ["PR", 3, 0, "auto_unroll_max_step$1024"]]]], "r": [[3.30852e-06, 3.30952e-06, 3.37241e-06, 3.46121e-06, 3.38658e-06, 3.90049e-06, 3.89474e-06, 3.8812e-06, 3.92077e-06, 3.86805e-06], 0, 10.8623, 1649089030], "v": "v0.6"}
{"i": [["[\"MMoE_select_experts\", 1, 16, 8, 2]", "cuda -keys=cuda,gpu -max_num_threads=1024 -model=unknown -thread_warp_size=32", [-1, 16, 64, 49152, 2147483647, 1024, 8, 32], "", 0, []], [[], [["CI", 2], ["FU", 3, [0, 1, 2]], ["AN", 3, 0, 6], ["PR", 3, 0, "auto_unroll_max_step$0"]]]], "r": [[3.42514e-06, 3.33126e-06, 3.33233e-06, 3.46262e-06, 3.3558e-06, 3.33759e-06, 3.33641e-06, 3.3309e-06, 3.35378e-06, 3.33739e-06], 0, 22.1463, 1649089042], "v": "v0.6"}
{"i": [["[\"MMoE_select_experts\", 1, 16, 8, 2]", "cuda -keys=cuda,gpu -max_num_threads=1024 -model=unknown -thread_warp_size=32", [-1, 16, 64, 49152, 2147483647, 1024, 8, 32], "", 0, []], [[], [["CI", 2], ["FU", 3, [0, 1, 2]], ["AN", 3, 0, 6], ["PR", 3, 0, "auto_unroll_max_step$512"]]]], "r": [[3.33761e-06, 3.32397e-06, 3.33857e-06, 3.41666e-06, 3.32535e-06, 3.33319e-06, 3.33157e-06, 3.34514e-06, 3.32753e-06, 3.43874e-06], 0, 27.7229, 1649089047], "v": "v0.6"}
{"i": [["[\"MMoE_select_experts\", 1, 16, 8, 2]", "cuda -keys=cuda,gpu -max_num_threads=1024 -model=unknown -thread_warp_size=32", [-1, 16, 64, 49152, 2147483647, 1024, 8, 32], "", 0, []], [[], [["CI", 2], ["FU", 3, [0, 1, 2]], ["AN", 3, 0, 6], ["PR", 3, 0, "auto_unroll_max_step$16"]]]], "r": [[3.331e-06, 3.43933e-06, 3.3301e-06, 3.44061e-06, 3.35055e-06, 3.35161e-06, 3.34573e-06, 3.32625e-06, 3.32714e-06, 3.33345e-06], 0, 16.5468, 1649089036], "v": "v0.6"}
{"i": [["[\"MMoE_select_experts\", 1, 16, 8, 2]", "cuda -keys=cuda,gpu -max_num_threads=1024 -model=unknown -thread_warp_size=32", [-1, 16, 64, 49152, 2147483647, 1024, 8, 32], "", 0, []], [[], [["CI", 2], ["FU", 3, [0, 1, 2]], ["AN", 3, 0, 6], ["PR", 3, 0, "auto_unroll_max_step$64"]]]], "r": [[3.27432e-06, 3.28577e-06, 3.39256e-06, 3.35909e-06, 3.34299e-06, 3.30608e-06, 3.28981e-06, 3.30071e-06, 3.28761e-06, 3.27672e-06], 0, 4.73188, 1649089024], "v": "v0.6"}
