python/models/mmoe/kernel_configs/MMoE_softmax_reduce_1_100_16_8_2
{"i": [["[\"softmax_reduce\", 1, 100, 16, 8, 2]", "cuda -keys=cuda,gpu -max_num_threads=1024 -model=unknown -thread_warp_size=32", [-1, 16, 64, 49152, 2147483647, 1024, 8, 32], "", 0, []], [[], [["AN", 1, 0, 6], ["PR", 1, 0, "auto_unroll_max_step$512"]]]], "r": [[2.35207e-06, 2.3514e-06, 2.36566e-06], 0, 0.514747, 1668097995], "v": "v0.6"}
{"i": [["[\"softmax_reduce\", 1, 100, 16, 8, 2]", "cuda -keys=cuda,gpu -max_num_threads=1024 -model=unknown -thread_warp_size=32", [-1, 16, 64, 49152, 2147483647, 1024, 8, 32], "", 0, []], [[], [["AN", 1, 0, 6], ["PR", 1, 0, "auto_unroll_max_step$0"]]]], "r": [[2.29602e-06, 2.2829e-06, 2.29597e-06], 0, 1.15919, 1668097995], "v": "v0.6"}
{"i": [["[\"softmax_reduce\", 1, 100, 16, 8, 2]", "cuda -keys=cuda,gpu -max_num_threads=1024 -model=unknown -thread_warp_size=32", [-1, 16, 64, 49152, 2147483647, 1024, 8, 32], "", 0, []], [[], [["AN", 1, 0, 6], ["PR", 1, 0, "auto_unroll_max_step$1024"]]]], "r": [[2.33055e-06, 2.32233e-06, 2.32666e-06], 0, 0.866728, 1668097995], "v": "v0.6"}
{"i": [["[\"softmax_reduce\", 1, 100, 16, 8, 2]", "cuda -keys=cuda,gpu -max_num_threads=1024 -model=unknown -thread_warp_size=32", [-1, 16, 64, 49152, 2147483647, 1024, 8, 32], "", 0, []], [[], [["AN", 1, 0, 6], ["PR", 1, 0, "auto_unroll_max_step$16"]]]], "r": [[2.34021e-06, 2.27634e-06, 2.26319e-06], 0, 1.80869, 1668097996], "v": "v0.6"}
{"i": [["[\"softmax_reduce\", 1, 100, 16, 8, 2]", "cuda -keys=cuda,gpu -max_num_threads=1024 -model=unknown -thread_warp_size=32", [-1, 16, 64, 49152, 2147483647, 1024, 8, 32], "", 0, []], [[], [["AN", 1, 0, 6], ["PR", 1, 0, "auto_unroll_max_step$64"]]]], "r": [[2.35151e-06, 2.37284e-06, 2.37524e-06], 0, 1.46745, 1668097996], "v": "v0.6"}
{"i": [["[\"softmax_reduce\", 1, 100, 16, 8, 2]", "cuda -keys=cuda,gpu -max_num_threads=1024 -model=unknown -thread_warp_size=32", [-1, 16, 64, 49152, 2147483647, 1024, 8, 32], "", 0, []], [[], [["AN", 1, 0, 6], ["PR", 1, 0, "auto_unroll_max_step$0"]]]], "r": [[2.4473e-06, 2.43201e-06, 2.432e-06], 0, 0.841619, 1668098222], "v": "v0.6"}
{"i": [["[\"softmax_reduce\", 1, 100, 16, 8, 2]", "cuda -keys=cuda,gpu -max_num_threads=1024 -model=unknown -thread_warp_size=32", [-1, 16, 64, 49152, 2147483647, 1024, 8, 32], "", 0, []], [[], [["AN", 1, 0, 6], ["PR", 1, 0, "auto_unroll_max_step$1024"]]]], "r": [[2.38065e-06, 2.34653e-06, 2.34505e-06], 0, 1.46334, 1668098222], "v": "v0.6"}
{"i": [["[\"softmax_reduce\", 1, 100, 16, 8, 2]", "cuda -keys=cuda,gpu -max_num_threads=1024 -model=unknown -thread_warp_size=32", [-1, 16, 64, 49152, 2147483647, 1024, 8, 32], "", 0, []], [[], [["AN", 1, 0, 6], ["PR", 1, 0, "auto_unroll_max_step$16"]]]], "r": [[2.32634e-06, 2.31166e-06, 2.31077e-06], 0, 1.81038, 1668098223], "v": "v0.6"}
{"i": [["[\"softmax_reduce\", 1, 100, 16, 8, 2]", "cuda -keys=cuda,gpu -max_num_threads=1024 -model=unknown -thread_warp_size=32", [-1, 16, 64, 49152, 2147483647, 1024, 8, 32], "", 0, []], [[], [["AN", 1, 0, 6], ["PR", 1, 0, "auto_unroll_max_step$512"]]]], "r": [[2.33649e-06, 2.3199e-06, 2.32428e-06], 0, 0.497523, 1668098221], "v": "v0.6"}
{"i": [["[\"softmax_reduce\", 1, 100, 16, 8, 2]", "cuda -keys=cuda,gpu -max_num_threads=1024 -model=unknown -thread_warp_size=32", [-1, 16, 64, 49152, 2147483647, 1024, 8, 32], "", 0, []], [[], [["AN", 1, 0, 6], ["PR", 1, 0, "auto_unroll_max_step$64"]]]], "r": [[2.4147e-06, 2.39575e-06, 2.38556e-06], 0, 1.14881, 1668098222], "v": "v0.6"}
{"i": [["[\"softmax_reduce\", 1, 100, 16, 8, 2]", "cuda -keys=cuda,gpu -max_num_threads=1024 -model=unknown -thread_warp_size=32", [-1, 16, 64, 49152, 2147483647, 1024, 8, 32], "", 0, []], [[], [["AN", 1, 0, 6], ["PR", 1, 0, "auto_unroll_max_step$512"]]]], "r": [[2.40364e-06, 2.37789e-06, 2.37651e-06], 0, 1.79334, 1668098419], "v": "v0.6"}
{"i": [["[\"softmax_reduce\", 1, 100, 16, 8, 2]", "cuda -keys=cuda,gpu -max_num_threads=1024 -model=unknown -thread_warp_size=32", [-1, 16, 64, 49152, 2147483647, 1024, 8, 32], "", 0, []], [[], [["AN", 1, 0, 6], ["PR", 1, 0, "auto_unroll_max_step$64"]]]], "r": [[2.45564e-06, 2.43751e-06, 2.43813e-06], 0, 1.44602, 1668098419], "v": "v0.6"}
{"i": [["[\"softmax_reduce\", 1, 100, 16, 8, 2]", "cuda -keys=cuda,gpu -max_num_threads=1024 -model=unknown -thread_warp_size=32", [-1, 16, 64, 49152, 2147483647, 1024, 8, 32], "", 0, []], [[], [["AN", 1, 0, 6], ["PR", 1, 0, "auto_unroll_max_step$0"]]]], "r": [[2.42804e-06, 2.4095e-06, 2.4032e-06], 0, 0.495735, 1668098418], "v": "v0.6"}
{"i": [["[\"softmax_reduce\", 1, 100, 16, 8, 2]", "cuda -keys=cuda,gpu -max_num_threads=1024 -model=unknown -thread_warp_size=32", [-1, 16, 64, 49152, 2147483647, 1024, 8, 32], "", 0, []], [[], [["AN", 1, 0, 6], ["PR", 1, 0, "auto_unroll_max_step$16"]]]], "r": [[2.43908e-06, 2.41869e-06, 2.41555e-06], 0, 0.845253, 1668098418], "v": "v0.6"}
{"i": [["[\"softmax_reduce\", 1, 100, 16, 8, 2]", "cuda -keys=cuda,gpu -max_num_threads=1024 -model=unknown -thread_warp_size=32", [-1, 16, 64, 49152, 2147483647, 1024, 8, 32], "", 0, []], [[], [["AN", 1, 0, 6], ["PR", 1, 0, "auto_unroll_max_step$1024"]]]], "r": [[2.40699e-06, 2.38645e-06, 2.38621e-06], 0, 1.14881, 1668098418], "v": "v0.6"}
{"i": [["[\"softmax_reduce\", 1, 100, 16, 8, 2]", "cuda -keys=cuda,gpu -max_num_threads=1024 -model=unknown -thread_warp_size=32", [-1, 16, 64, 49152, 2147483647, 1024, 8, 32], "", 0, []], [[], [["AN", 1, 0, 6], ["PR", 1, 0, "auto_unroll_max_step$16"]]]], "r": [[2.39355e-06, 2.36643e-06, 2.36363e-06], 0, 1.16244, 1668098445], "v": "v0.6"}
{"i": [["[\"softmax_reduce\", 1, 100, 16, 8, 2]", "cuda -keys=cuda,gpu -max_num_threads=1024 -model=unknown -thread_warp_size=32", [-1, 16, 64, 49152, 2147483647, 1024, 8, 32], "", 0, []], [[], [["AN", 1, 0, 6], ["PR", 1, 0, "auto_unroll_max_step$0"]]]], "r": [[2.39121e-06, 2.35595e-06, 2.35348e-06], 0, 0.497382, 1668098445], "v": "v0.6"}
{"i": [["[\"softmax_reduce\", 1, 100, 16, 8, 2]", "cuda -keys=cuda,gpu -max_num_threads=1024 -model=unknown -thread_warp_size=32", [-1, 16, 64, 49152, 2147483647, 1024, 8, 32], "", 0, []], [[], [["AN", 1, 0, 6], ["PR", 1, 0, "auto_unroll_max_step$64"]]]], "r": [[2.3206e-06, 2.31293e-06, 2.3116e-06], 0, 1.83973, 1668098446], "v": "v0.6"}
{"i": [["[\"softmax_reduce\", 1, 100, 16, 8, 2]", "cuda -keys=cuda,gpu -max_num_threads=1024 -model=unknown -thread_warp_size=32", [-1, 16, 64, 49152, 2147483647, 1024, 8, 32], "", 0, []], [[], [["AN", 1, 0, 6], ["PR", 1, 0, "auto_unroll_max_step$512"]]]], "r": [[2.38108e-06, 2.34474e-06, 2.3537e-06], 0, 0.851988, 1668098445], "v": "v0.6"}
{"i": [["[\"softmax_reduce\", 1, 100, 16, 8, 2]", "cuda -keys=cuda,gpu -max_num_threads=1024 -model=unknown -thread_warp_size=32", [-1, 16, 64, 49152, 2147483647, 1024, 8, 32], "", 0, []], [[], [["AN", 1, 0, 6], ["PR", 1, 0, "auto_unroll_max_step$1024"]]]], "r": [[2.35436e-06, 2.32945e-06, 2.32389e-06], 0, 1.46818, 1668098446], "v": "v0.6"}
