python/models/mmoe/kernel_configs/MMoE_gates_1_100_16_8_2
{"i": [["[\"MMoE_gates\", 1, 100, 8, 2]", "cuda -keys=cuda,gpu -max_num_threads=1024 -model=unknown -thread_warp_size=32", [-1, 16, 64, 49152, 2147483647, 1024, 8, 32], "", 0, []], [[], [["SP", 2, 0, 1, [1, 1, 1, 1], 1], ["SP", 2, 5, 8, [4, 1, 1, 1], 1], ["SP", 2, 10, 2, [1, 1, 2, 1], 1], ["SP", 2, 15, 100, [20, 5], 1], ["RE", 2, [0, 5, 10, 1, 6, 11, 2, 7, 12, 15, 16, 3, 8, 13, 17, 4, 9, 14]], ["FSP", 4, 0, 0, 3], ["FSP", 4, 4, 1, 3], ["FSP", 4, 8, 2, 3], ["RE", 4, [0, 4, 8, 1, 5, 9, 2, 6, 10, 3, 7, 11]], ["CA", 2, 4, 8], ["CHR", 1, "shared", [2]], ["CA", 2, 3, 9], ["CHR", 0, "shared", [3]], ["CA", 1, 4, 9], ["FU", 6, [0, 1, 2]], ["AN", 6, 0, 5], ["FU", 6, [1, 2, 3]], ["AN", 6, 1, 4], ["FU", 6, [2, 3, 4]], ["AN", 6, 2, 6], ["FU", 3, [0, 1, 2]], ["SP", 3, 0, 200, [1], 1], ["AN", 3, 1, 2], ["FFSP", 3, 0, [2, 1, 0], 1, 1], ["AN", 3, 1, 6], ["FU", 1, [0, 1]], ["SP", 1, 0, 100, [1], 1], ["AN", 1, 1, 2], ["FFSP", 1, 0, [2, 1, 0], 1, 1], ["AN", 1, 1, 6], ["PR", 4, 0, "auto_unroll_max_step$1024"]]]], "r": [[1.19538e-05, 1.1956e-05, 1.1956e-05, 1.19027e-05, 1.1885e-05, 1.18777e-05, 1.18767e-05, 1.18626e-05, 1.18724e-05, 1.18956e-05], 0, 76.8846, 1649065956], "v": "v0.6"}
{"i": [["[\"MMoE_gates\", 1, 100, 8, 2]", "cuda -keys=cuda,gpu -max_num_threads=1024 -model=unknown -thread_warp_size=32", [-1, 16, 64, 49152, 2147483647, 1024, 8, 32], "", 0, []], [[], [["SP", 2, 0, 1, [1, 1, 1, 1], 1], ["SP", 2, 5, 8, [1, 1, 4, 1], 1], ["SP", 2, 10, 2, [1, 1, 1, 1], 1], ["SP", 2, 15, 100, [2, 5], 1], ["RE", 2, [0, 5, 10, 1, 6, 11, 2, 7, 12, 15, 16, 3, 8, 13, 17, 4, 9, 14]], ["FSP", 4, 0, 0, 3], ["FSP", 4, 4, 1, 3], ["FSP", 4, 8, 2, 3], ["RE", 4, [0, 4, 8, 1, 5, 9, 2, 6, 10, 3, 7, 11]], ["CA", 2, 4, 8], ["CHR", 1, "shared", [2]], ["CA", 2, 3, 9], ["CHR", 0, "shared", [3]], ["CA", 1, 4, 9], ["FU", 6, [0, 1, 2]], ["AN", 6, 0, 5], ["FU", 6, [1, 2, 3]], ["AN", 6, 1, 4], ["FU", 6, [2, 3, 4]], ["AN", 6, 2, 6], ["FU", 3, [0, 1, 2]], ["SP", 3, 0, 40, [1], 1], ["AN", 3, 1, 2], ["FFSP", 3, 0, [2, 1, 0], 1, 1], ["AN", 3, 1, 6], ["FU", 1, [0, 1]], ["SP", 1, 0, 10, [1], 1], ["AN", 1, 1, 2], ["FFSP", 1, 0, [2, 1, 0], 1, 1], ["AN", 1, 1, 6], ["PR", 4, 0, "auto_unroll_max_step$64"]]]], "r": [[1.39074e-05, 1.39073e-05, 1.39071e-05, 1.39073e-05, 1.39073e-05, 1.39074e-05, 1.39073e-05, 1.39074e-05, 1.39072e-05, 1.39072e-05], 0, 14.0768, 1649065896], "v": "v0.6"}
{"i": [["[\"MMoE_gates\", 1, 100, 8, 2]", "cuda -keys=cuda,gpu -max_num_threads=1024 -model=unknown -thread_warp_size=32", [-1, 16, 64, 49152, 2147483647, 1024, 8, 32], "", 0, []], [[], [["SP", 2, 0, 1, [1, 1, 1, 1], 1], ["SP", 2, 5, 8, [2, 2, 1, 1], 1], ["SP", 2, 10, 2, [1, 2, 1, 1], 1], ["SP", 2, 15, 100, [10, 1], 1], ["RE", 2, [0, 5, 10, 1, 6, 11, 2, 7, 12, 15, 16, 3, 8, 13, 17, 4, 9, 14]], ["FSP", 4, 0, 0, 3], ["FSP", 4, 4, 1, 3], ["FSP", 4, 8, 2, 3], ["RE", 4, [0, 4, 8, 1, 5, 9, 2, 6, 10, 3, 7, 11]], ["CA", 2, 4, 8], ["CHR", 1, "shared", [2]], ["CA", 2, 3, 9], ["CHR", 0, "shared", [3]], ["CA", 1, 4, 9], ["FU", 6, [0, 1, 2]], ["AN", 6, 0, 5], ["FU", 6, [1, 2, 3]], ["AN", 6, 1, 4], ["FU", 6, [2, 3, 4]], ["AN", 6, 2, 6], ["FU", 3, [0, 1, 2]], ["SP", 3, 0, 4, [1], 1], ["AN", 3, 1, 2], ["FFSP", 3, 0, [2, 1, 0], 1, 1], ["AN", 3, 1, 6], ["FU", 1, [0, 1]], ["SP", 1, 0, 2, [1], 1], ["AN", 1, 1, 2], ["FFSP", 1, 0, [2, 1, 0], 1, 1], ["AN", 1, 1, 6], ["PR", 4, 0, "auto_unroll_max_step$1024"]]]], "r": [[5.58776e-06, 5.58769e-06, 5.58775e-06, 5.58771e-06, 5.58778e-06, 5.58786e-06, 5.5878e-06, 5.58778e-06, 5.58786e-06, 5.58772e-06], 0, 9.81874, 1649065891], "v": "v0.6"}
{"i": [["[\"MMoE_gates\", 1, 100, 8, 2]", "cuda -keys=cuda,gpu -max_num_threads=1024 -model=unknown -thread_warp_size=32", [-1, 16, 64, 49152, 2147483647, 1024, 8, 32], "", 0, []], [[], [["SP", 2, 0, 1, [1, 1, 1, 1], 1], ["SP", 2, 5, 8, [1, 2, 2, 1], 1], ["SP", 2, 10, 2, [1, 1, 2, 1], 1], ["SP", 2, 15, 100, [25, 2], 1], ["RE", 2, [0, 5, 10, 1, 6, 11, 2, 7, 12, 15, 16, 3, 8, 13, 17, 4, 9, 14]], ["FSP", 4, 0, 0, 3], ["FSP", 4, 4, 1, 3], ["FSP", 4, 8, 2, 3], ["RE", 4, [0, 4, 8, 1, 5, 9, 2, 6, 10, 3, 7, 11]], ["CA", 2, 4, 8], ["CHR", 1, "shared", [2]], ["CA", 2, 3, 9], ["CHR", 0, "shared", [3]], ["CA", 1, 4, 9], ["FU", 6, [0, 1, 2]], ["AN", 6, 0, 5], ["FU", 6, [1, 2, 3]], ["AN", 6, 1, 4], ["FU", 6, [2, 3, 4]], ["AN", 6, 2, 6], ["FU", 3, [0, 1, 2]], ["SP", 3, 0, 100, [1], 1], ["AN", 3, 1, 2], ["FFSP", 3, 0, [2, 1, 0], 1, 1], ["AN", 3, 1, 6], ["FU", 1, [0, 1]], ["SP", 1, 0, 50, [1], 1], ["AN", 1, 1, 2], ["FFSP", 1, 0, [2, 1, 0], 1, 1], ["AN", 1, 1, 6], ["PR", 4, 0, "auto_unroll_max_step$0"]]]], "r": [[7.45598e-06, 7.45769e-06, 7.46036e-06, 7.45702e-06, 7.45594e-06, 7.45601e-06, 7.45966e-06, 7.45869e-06, 7.45932e-06, 7.45967e-06], 0, 5.41755, 1649065887], "v": "v0.6"}
{"i": [["[\"MMoE_gates\", 1, 100, 8, 2]", "cuda -keys=cuda,gpu -max_num_threads=1024 -model=unknown -thread_warp_size=32", [-1, 16, 64, 49152, 2147483647, 1024, 8, 32], "", 0, []], [[], [["SP", 2, 0, 1, [1, 1, 1, 1], 1], ["SP", 2, 5, 8, [1, 2, 1, 1], 1], ["SP", 2, 10, 2, [1, 1, 2, 1], 1], ["SP", 2, 15, 100, [1, 2], 1], ["RE", 2, [0, 5, 10, 1, 6, 11, 2, 7, 12, 15, 16, 3, 8, 13, 17, 4, 9, 14]], ["FSP", 4, 0, 0, 3], ["FSP", 4, 4, 1, 3], ["FSP", 4, 8, 2, 3], ["RE", 4, [0, 4, 8, 1, 5, 9, 2, 6, 10, 3, 7, 11]], ["CA", 2, 4, 8], ["CHR", 1, "shared", [2]], ["CA", 2, 3, 9], ["CHR", 0, "shared", [3]], ["CA", 1, 4, 9], ["FU", 6, [0, 1, 2]], ["AN", 6, 0, 5], ["FU", 6, [1, 2, 3]], ["AN", 6, 1, 4], ["FU", 6, [2, 3, 4]], ["AN", 6, 2, 6], ["FU", 3, [0, 1, 2]], ["SP", 3, 0, 20, [10], 1], ["AN", 3, 1, 2], ["FFSP", 3, 0, [2, 1, 0], 1, 1], ["AN", 3, 1, 6], ["FU", 1, [0, 1]], ["SP", 1, 0, 10, [1], 1], ["AN", 1, 1, 2], ["FFSP", 1, 0, [2, 1, 0], 1, 1], ["AN", 1, 1, 6], ["PR", 4, 0, "auto_unroll_max_step$64"]]]], "r": [[1.02853e-05, 1.02855e-05, 1.02854e-05, 1.02859e-05, 1.02855e-05, 1.02866e-05, 1.02886e-05, 1.02887e-05, 1.02886e-05, 1.02897e-05], 0, 33.055, 1649065915], "v": "v0.6"}
{"i": [["[\"MMoE_gates\", 1, 100, 8, 2]", "cuda -keys=cuda,gpu -max_num_threads=1024 -model=unknown -thread_warp_size=32", [-1, 16, 64, 49152, 2147483647, 1024, 8, 32], "", 0, []], [[], [["SP", 2, 0, 1, [1, 1, 1, 1], 1], ["SP", 2, 5, 8, [1, 2, 4, 1], 1], ["SP", 2, 10, 2, [1, 1, 1, 2], 1], ["SP", 2, 15, 100, [5, 1], 1], ["RE", 2, [0, 5, 10, 1, 6, 11, 2, 7, 12, 15, 16, 3, 8, 13, 17, 4, 9, 14]], ["FSP", 4, 0, 0, 3], ["FSP", 4, 4, 1, 3], ["FSP", 4, 8, 2, 3], ["RE", 4, [0, 4, 8, 1, 5, 9, 2, 6, 10, 3, 7, 11]], ["CA", 2, 4, 8], ["CHR", 1, "shared", [2]], ["CA", 2, 3, 9], ["CHR", 0, "shared", [3]], ["CA", 1, 4, 9], ["FU", 6, [0, 1, 2]], ["AN", 6, 0, 5], ["FU", 6, [1, 2, 3]], ["AN", 6, 1, 4], ["FU", 6, [2, 3, 4]], ["AN", 6, 2, 6], ["FU", 3, [0, 1, 2]], ["SP", 3, 0, 320, [32], 1], ["AN", 3, 1, 2], ["FFSP", 3, 0, [2, 1, 0], 1, 1], ["AN", 3, 1, 6], ["FU", 1, [0, 1]], ["SP", 1, 0, 20, [1], 1], ["AN", 1, 1, 2], ["FFSP", 1, 0, [2, 1, 0], 1, 1], ["AN", 1, 1, 6], ["PR", 4, 0, "auto_unroll_max_step$0"]]]], "r": [[9.0851e-05, 9.0852e-05, 9.08548e-05, 9.08562e-05, 9.08473e-05, 9.08359e-05, 9.08383e-05, 9.08398e-05, 9.08468e-05, 9.08477e-05], 0, 19.4084, 1649065902], "v": "v0.6"}
{"i": [["[\"MMoE_gates\", 1, 100, 8, 2]", "cuda -keys=cuda,gpu -max_num_threads=1024 -model=unknown -thread_warp_size=32", [-1, 16, 64, 49152, 2147483647, 1024, 8, 32], "", 0, []], [[], [["SP", 2, 0, 1, [1, 1, 1, 1], 1], ["SP", 2, 5, 8, [1, 4, 1, 1], 1], ["SP", 2, 10, 2, [2, 1, 1, 1], 1], ["SP", 2, 15, 100, [25, 4], 1], ["RE", 2, [0, 5, 10, 1, 6, 11, 2, 7, 12, 15, 16, 3, 8, 13, 17, 4, 9, 14]], ["FSP", 4, 0, 0, 3], ["FSP", 4, 4, 1, 3], ["FSP", 4, 8, 2, 3], ["RE", 4, [0, 4, 8, 1, 5, 9, 2, 6, 10, 3, 7, 11]], ["CA", 2, 4, 8], ["CHR", 1, "shared", [2]], ["CA", 2, 3, 9], ["CHR", 0, "shared", [3]], ["CA", 1, 4, 9], ["FU", 6, [0, 1, 2]], ["AN", 6, 0, 5], ["FU", 6, [1, 2, 3]], ["AN", 6, 1, 4], ["FU", 6, [2, 3, 4]], ["AN", 6, 2, 6], ["FU", 3, [0, 1, 2]], ["SP", 3, 0, 100, [1], 1], ["AN", 3, 1, 2], ["FFSP", 3, 0, [2, 1, 0], 1, 1], ["AN", 3, 1, 6], ["FU", 1, [0, 1]], ["SP", 1, 0, 100, [2], 1], ["AN", 1, 1, 2], ["FFSP", 1, 0, [2, 1, 0], 1, 1], ["AN", 1, 1, 6], ["PR", 4, 0, "auto_unroll_max_step$64"]]]], "r": [[9.33489e-06, 9.33513e-06, 9.3347e-06, 9.33554e-06, 9.33495e-06, 9.33522e-06, 9.33584e-06, 9.33584e-06, 9.33593e-06, 9.33587e-06], 0, 28.5814, 1649065911], "v": "v0.6"}
{"i": [["[\"MMoE_gates\", 1, 100, 8, 2]", "cuda -keys=cuda,gpu -max_num_threads=1024 -model=unknown -thread_warp_size=32", [-1, 16, 64, 49152, 2147483647, 1024, 8, 32], "", 0, []], [[], [["SP", 2, 0, 1, [1, 1, 1, 1], 1], ["SP", 2, 5, 8, [4, 1, 1, 1], 1], ["SP", 2, 10, 2, [1, 1, 1, 2], 1], ["SP", 2, 15, 100, [20, 5], 1], ["RE", 2, [0, 5, 10, 1, 6, 11, 2, 7, 12, 15, 16, 3, 8, 13, 17, 4, 9, 14]], ["FSP", 4, 0, 0, 3], ["FSP", 4, 4, 1, 3], ["FSP", 4, 8, 2, 3], ["RE", 4, [0, 4, 8, 1, 5, 9, 2, 6, 10, 3, 7, 11]], ["CA", 2, 4, 8], ["CHR", 1, "shared", [2]], ["CA", 2, 3, 9], ["CHR", 0, "shared", [3]], ["CA", 1, 4, 9], ["FU", 6, [0, 1, 2]], ["AN", 6, 0, 5], ["FU", 6, [1, 2, 3]], ["AN", 6, 1, 4], ["FU", 6, [2, 3, 4]], ["AN", 6, 2, 6], ["FU", 3, [0, 1, 2]], ["SP", 3, 0, 200, [1], 1], ["AN", 3, 1, 2], ["FFSP", 3, 0, [2, 1, 0], 1, 1], ["AN", 3, 1, 6], ["FU", 1, [0, 1]], ["SP", 1, 0, 100, [1], 1], ["AN", 1, 1, 2], ["FFSP", 1, 0, [2, 1, 0], 1, 1], ["AN", 1, 1, 6], ["PR", 4, 0, "auto_unroll_max_step$512"]]]], "r": [[1.19482e-05, 1.19382e-05, 1.19481e-05, 1.19505e-05, 1.19516e-05, 1.19541e-05, 1.19539e-05, 1.19546e-05, 1.19523e-05, 1.19466e-05], 0, 24.2746, 1649065906], "v": "v0.6"}
{"i": [["[\"MMoE_gates\", 1, 100, 8, 2]", "cuda -keys=cuda,gpu -max_num_threads=1024 -model=unknown -thread_warp_size=32", [-1, 16, 64, 49152, 2147483647, 1024, 8, 32], "", 0, []], [[], [["SP", 2, 0, 1, [1, 1, 1, 1], 1], ["SP", 2, 5, 8, [2, 4, 1, 1], 1], ["SP", 2, 10, 2, [1, 1, 2, 1], 1], ["SP", 2, 15, 100, [1, 5], 1], ["RE", 2, [0, 5, 10, 1, 6, 11, 2, 7, 12, 15, 16, 3, 8, 13, 17, 4, 9, 14]], ["FSP", 4, 0, 0, 3], ["FSP", 4, 4, 1, 3], ["FSP", 4, 8, 2, 3], ["RE", 4, [0, 4, 8, 1, 5, 9, 2, 6, 10, 3, 7, 11]], ["CA", 2, 4, 8], ["CHR", 1, "shared", [2]], ["CA", 2, 3, 9], ["CHR", 0, "shared", [3]], ["CA", 1, 4, 9], ["FU", 6, [0, 1, 2]], ["AN", 6, 0, 5], ["FU", 6, [1, 2, 3]], ["AN", 6, 1, 4], ["FU", 6, [2, 3, 4]], ["AN", 6, 2, 6], ["FU", 3, [0, 1, 2]], ["SP", 3, 0, 40, [1], 1], ["AN", 3, 1, 2], ["FFSP", 3, 0, [2, 1, 0], 1, 1], ["AN", 3, 1, 6], ["FU", 1, [0, 1]], ["SP", 1, 0, 20, [1], 1], ["AN", 1, 1, 2], ["FFSP", 1, 0, [2, 1, 0], 1, 1], ["AN", 1, 1, 6], ["PR", 4, 0, "auto_unroll_max_step$64"]]]], "r": [[1.01078e-05, 1.0108e-05, 1.01078e-05, 1.0108e-05, 1.01087e-05, 1.01079e-05, 1.01081e-05, 1.0108e-05, 1.01078e-05, 1.01078e-05], 0, 37.5034, 1649065920], "v": "v0.6"}
{"i": [["[\"MMoE_gates\", 1, 100, 8, 2]", "cuda -keys=cuda,gpu -max_num_threads=1024 -model=unknown -thread_warp_size=32", [-1, 16, 64, 49152, 2147483647, 1024, 8, 32], "", 0, []], [[], [["SP", 2, 0, 1, [1, 1, 1, 1], 1], ["SP", 2, 5, 8, [1, 4, 2, 1], 1], ["SP", 2, 10, 2, [2, 1, 1, 1], 1], ["SP", 2, 15, 100, [10, 1], 1], ["RE", 2, [0, 5, 10, 1, 6, 11, 2, 7, 12, 15, 16, 3, 8, 13, 17, 4, 9, 14]], ["FSP", 4, 0, 0, 3], ["FSP", 4, 4, 1, 3], ["FSP", 4, 8, 2, 3], ["RE", 4, [0, 4, 8, 1, 5, 9, 2, 6, 10, 3, 7, 11]], ["CA", 2, 4, 8], ["CHR", 1, "shared", [2]], ["CA", 2, 3, 9], ["CHR", 0, "shared", [3]], ["CA", 1, 4, 9], ["FU", 6, [0, 1, 2]], ["AN", 6, 0, 5], ["FU", 6, [1, 2, 3]], ["AN", 6, 1, 4], ["FU", 6, [2, 3, 4]], ["AN", 6, 2, 6], ["FU", 3, [0, 1, 2]], ["SP", 3, 0, 100, [1], 1], ["AN", 3, 1, 2], ["FFSP", 3, 0, [2, 1, 0], 1, 1], ["AN", 3, 1, 6], ["FU", 1, [0, 1]], ["SP", 1, 0, 50, [1], 1], ["AN", 1, 1, 2], ["FFSP", 1, 0, [2, 1, 0], 1, 1], ["AN", 1, 1, 6], ["PR", 4, 0, "auto_unroll_max_step$0"]]]], "r": [[7.70996e-06, 7.7147e-06, 7.71423e-06, 7.71148e-06, 7.71529e-06, 7.71554e-06, 7.71328e-06, 7.71505e-06, 7.71489e-06, 7.71394e-06], 0, 55.8078, 1649065938], "v": "v0.6"}
{"i": [["[\"MMoE_gates\", 1, 100, 8, 2]", "cuda -keys=cuda,gpu -max_num_threads=1024 -model=unknown -thread_warp_size=32", [-1, 16, 64, 49152, 2147483647, 1024, 8, 32], "", 0, []], [[], [["SP", 2, 0, 1, [1, 1, 1, 1], 1], ["SP", 2, 5, 8, [1, 1, 2, 2], 1], ["SP", 2, 10, 2, [1, 1, 1, 1], 1], ["SP", 2, 15, 100, [100, 1], 1], ["RE", 2, [0, 5, 10, 1, 6, 11, 2, 7, 12, 15, 16, 3, 8, 13, 17, 4, 9, 14]], ["FSP", 4, 0, 0, 3], ["FSP", 4, 4, 1, 3], ["FSP", 4, 8, 2, 3], ["RE", 4, [0, 4, 8, 1, 5, 9, 2, 6, 10, 3, 7, 11]], ["CA", 2, 4, 8], ["CHR", 1, "shared", [2]], ["CA", 2, 3, 9], ["CHR", 0, "shared", [3]], ["CA", 1, 4, 9], ["FU", 6, [0, 1, 2]], ["AN", 6, 0, 5], ["FU", 6, [1, 2, 3]], ["AN", 6, 1, 4], ["FU", 6, [2, 3, 4]], ["AN", 6, 2, 6], ["FU", 3, [0, 1, 2]], ["SP", 3, 0, 40, [1], 1], ["AN", 3, 1, 2], ["FFSP", 3, 0, [2, 1, 0], 1, 1], ["AN", 3, 1, 6], ["FU", 1, [0, 1]], ["SP", 1, 0, 10, [1], 1], ["AN", 1, 1, 2], ["FFSP", 1, 0, [2, 1, 0], 1, 1], ["AN", 1, 1, 6], ["PR", 4, 0, "auto_unroll_max_step$16"]]]], "r": [[7.46088e-06, 7.46091e-06, 7.46106e-06, 7.4608e-06, 7.46072e-06, 7.46039e-06, 7.46024e-06, 7.46054e-06, 7.46039e-06, 7.46046e-06], 0, 60.0469, 1649065942], "v": "v0.6"}
{"i": [["[\"MMoE_gates\", 1, 100, 8, 2]", "cuda -keys=cuda,gpu -max_num_threads=1024 -model=unknown -thread_warp_size=32", [-1, 16, 64, 49152, 2147483647, 1024, 8, 32], "", 0, []], [[], [["SP", 2, 0, 1, [1, 1, 1, 1], 1], ["SP", 2, 5, 8, [2, 1, 4, 1], 1], ["SP", 2, 10, 2, [1, 1, 1, 1], 1], ["SP", 2, 15, 100, [5, 1], 1], ["RE", 2, [0, 5, 10, 1, 6, 11, 2, 7, 12, 15, 16, 3, 8, 13, 17, 4, 9, 14]], ["FSP", 4, 0, 0, 3], ["FSP", 4, 4, 1, 3], ["FSP", 4, 8, 2, 3], ["RE", 4, [0, 4, 8, 1, 5, 9, 2, 6, 10, 3, 7, 11]], ["CA", 2, 4, 8], ["CHR", 1, "shared", [2]], ["CA", 2, 3, 9], ["CHR", 0, "shared", [3]], ["CA", 1, 4, 9], ["FU", 6, [0, 1, 2]], ["AN", 6, 0, 5], ["FU", 6, [1, 2, 3]], ["AN", 6, 1, 4], ["FU", 6, [2, 3, 4]], ["AN", 6, 2, 6], ["FU", 3, [0, 1, 2]], ["SP", 3, 0, 20, [1], 1], ["AN", 3, 1, 2], ["FFSP", 3, 0, [2, 1, 0], 1, 1], ["AN", 3, 1, 6], ["FU", 1, [0, 1]], ["SP", 1, 0, 5, [1], 1], ["AN", 1, 1, 2], ["FFSP", 1, 0, [2, 1, 0], 1, 1], ["AN", 1, 1, 6], ["PR", 4, 0, "auto_unroll_max_step$1024"]]]], "r": [[2.05877e-05, 2.0588e-05, 2.05878e-05, 2.05884e-05, 2.05881e-05, 2.0588e-05, 2.05879e-05, 2.05887e-05, 2.05883e-05, 2.05884e-05], 0, 51.6139, 1649065934], "v": "v0.6"}
{"i": [["[\"MMoE_gates\", 1, 100, 8, 2]", "cuda -keys=cuda,gpu -max_num_threads=1024 -model=unknown -thread_warp_size=32", [-1, 16, 64, 49152, 2147483647, 1024, 8, 32], "", 0, []], [[], [["SP", 2, 0, 1, [1, 1, 1, 1], 1], ["SP", 2, 5, 8, [1, 8, 1, 1], 1], ["SP", 2, 10, 2, [1, 1, 1, 1], 1], ["SP", 2, 15, 100, [50, 1], 1], ["RE", 2, [0, 5, 10, 1, 6, 11, 2, 7, 12, 15, 16, 3, 8, 13, 17, 4, 9, 14]], ["FSP", 4, 0, 0, 3], ["FSP", 4, 4, 1, 3], ["FSP", 4, 8, 2, 3], ["RE", 4, [0, 4, 8, 1, 5, 9, 2, 6, 10, 3, 7, 11]], ["CA", 2, 4, 8], ["CHR", 1, "shared", [2]], ["CA", 2, 3, 9], ["CHR", 0, "shared", [3]], ["CA", 1, 4, 9], ["FU", 6, [0, 1, 2]], ["AN", 6, 0, 5], ["FU", 6, [1, 2, 3]], ["AN", 6, 1, 4], ["FU", 6, [2, 3, 4]], ["AN", 6, 2, 6], ["FU", 3, [0, 1, 2]], ["SP", 3, 0, 50, [1], 1], ["AN", 3, 1, 2], ["FFSP", 3, 0, [2, 1, 0], 1, 1], ["AN", 3, 1, 6], ["FU", 1, [0, 1]], ["SP", 1, 0, 50, [1], 1], ["AN", 1, 1, 2], ["FFSP", 1, 0, [2, 1, 0], 1, 1], ["AN", 1, 1, 6], ["PR", 4, 0, "auto_unroll_max_step$16"]]]], "r": [[3.87769e-06, 3.87761e-06, 3.87796e-06, 3.8783e-06, 3.87801e-06, 3.87904e-06, 3.87994e-06, 3.87949e-06, 3.88027e-06, 3.88008e-06], 0, 46.8513, 1649065929], "v": "v0.6"}
{"i": [["[\"MMoE_gates\", 1, 100, 8, 2]", "cuda -keys=cuda,gpu -max_num_threads=1024 -model=unknown -thread_warp_size=32", [-1, 16, 64, 49152, 2147483647, 1024, 8, 32], "", 0, []], [[], [["SP", 2, 0, 1, [1, 1, 1, 1], 1], ["SP", 2, 5, 8, [1, 4, 1, 2], 1], ["SP", 2, 10, 2, [1, 1, 2, 1], 1], ["SP", 2, 15, 100, [1, 2], 1], ["RE", 2, [0, 5, 10, 1, 6, 11, 2, 7, 12, 15, 16, 3, 8, 13, 17, 4, 9, 14]], ["FSP", 4, 0, 0, 3], ["FSP", 4, 4, 1, 3], ["FSP", 4, 8, 2, 3], ["RE", 4, [0, 4, 8, 1, 5, 9, 2, 6, 10, 3, 7, 11]], ["CA", 2, 4, 8], ["CHR", 1, "shared", [2]], ["CA", 2, 3, 9], ["CHR", 0, "shared", [3]], ["CA", 1, 4, 9], ["FU", 6, [0, 1, 2]], ["AN", 6, 0, 5], ["FU", 6, [1, 2, 3]], ["AN", 6, 1, 4], ["FU", 6, [2, 3, 4]], ["AN", 6, 2, 6], ["FU", 3, [0, 1, 2]], ["SP", 3, 0, 8, [1], 1], ["AN", 3, 1, 2], ["FFSP", 3, 0, [2, 1, 0], 1, 1], ["AN", 3, 1, 6], ["FU", 1, [0, 1]], ["SP", 1, 0, 2, [2], 1], ["AN", 1, 1, 2], ["FFSP", 1, 0, [2, 1, 0], 1, 1], ["AN", 1, 1, 6], ["PR", 4, 0, "auto_unroll_max_step$64"]]]], "r": [[1.12975e-05, 1.12969e-05, 1.12973e-05, 1.1297e-05, 1.12969e-05, 1.12969e-05, 1.12967e-05, 1.1296e-05, 1.12969e-05, 1.12967e-05], 0, 92.9853, 1649065975], "v": "v0.6"}
{"i": [["[\"MMoE_gates\", 1, 100, 8, 2]", "cuda -keys=cuda,gpu -max_num_threads=1024 -model=unknown -thread_warp_size=32", [-1, 16, 64, 49152, 2147483647, 1024, 8, 32], "", 0, []], [[], [["SP", 4, 2, 2, [1], 1], ["AN", 4, 3, 6], ["FSP", 2, 3, 0, 1], ["AN", 2, 4, 6], ["CA", 2, 4, 2], ["FU", 4, [0, 1, 2]], ["AN", 4, 0, 5], ["PR", 2, 0, "auto_unroll_max_step$1024"]]]], "r": [[4.59137e-06, 4.60827e-06, 4.60336e-06, 4.60419e-06, 4.62848e-06, 4.62031e-06, 4.60943e-06, 4.62079e-06, 4.62305e-06, 4.61585e-06], 0, 43.2524, 1649065925], "v": "v0.6"}
{"i": [["[\"MMoE_gates\", 1, 100, 8, 2]", "cuda -keys=cuda,gpu -max_num_threads=1024 -model=unknown -thread_warp_size=32", [-1, 16, 64, 49152, 2147483647, 1024, 8, 32], "", 0, []], [[], [["SP", 2, 0, 1, [1, 1, 1, 1], 1], ["SP", 2, 5, 8, [1, 1, 1, 1], 1], ["SP", 2, 10, 2, [2, 1, 1, 1], 1], ["SP", 2, 15, 100, [1, 25], 1], ["RE", 2, [0, 5, 10, 1, 6, 11, 2, 7, 12, 15, 16, 3, 8, 13, 17, 4, 9, 14]], ["FSP", 4, 0, 0, 3], ["FSP", 4, 4, 1, 3], ["FSP", 4, 8, 2, 3], ["RE", 4, [0, 4, 8, 1, 5, 9, 2, 6, 10, 3, 7, 11]], ["CA", 2, 4, 8], ["CHR", 1, "shared", [2]], ["CA", 2, 3, 9], ["CHR", 0, "shared", [3]], ["CA", 1, 4, 9], ["FU", 6, [0, 1, 2]], ["AN", 6, 0, 5], ["FU", 6, [1, 2, 3]], ["AN", 6, 1, 4], ["FU", 6, [2, 3, 4]], ["AN", 6, 2, 6], ["FU", 3, [0, 1, 2]], ["SP", 3, 0, 50, [1], 1], ["AN", 3, 1, 2], ["FFSP", 3, 0, [2, 1, 0], 1, 1], ["AN", 3, 1, 6], ["FU", 1, [0, 1]], ["SP", 1, 0, 25, [1], 1], ["AN", 1, 1, 2], ["FFSP", 1, 0, [2, 1, 0], 1, 1], ["AN", 1, 1, 6], ["PR", 4, 0, "auto_unroll_max_step$16"]]]], "r": [[9.2136e-06, 9.21251e-06, 9.20973e-06, 9.21485e-06, 9.21419e-06, 9.2174e-06, 9.2224e-06, 9.22912e-06, 9.27926e-06, 9.30124e-06], 0, 64.4874, 1649065947], "v": "v0.6"}
{"i": [["[\"MMoE_gates\", 1, 100, 8, 2]", "cuda -keys=cuda,gpu -max_num_threads=1024 -model=unknown -thread_warp_size=32", [-1, 16, 64, 49152, 2147483647, 1024, 8, 32], "", 0, []], [[], [["SP", 2, 0, 1, [1, 1, 1, 1], 1], ["SP", 2, 5, 8, [1, 1, 1, 8], 1], ["SP", 2, 10, 2, [1, 1, 1, 1], 1], ["SP", 2, 15, 100, [2, 1], 1], ["RE", 2, [0, 5, 10, 1, 6, 11, 2, 7, 12, 15, 16, 3, 8, 13, 17, 4, 9, 14]], ["FSP", 4, 0, 0, 3], ["FSP", 4, 4, 1, 3], ["FSP", 4, 8, 2, 3], ["RE", 4, [0, 4, 8, 1, 5, 9, 2, 6, 10, 3, 7, 11]], ["CA", 2, 4, 8], ["CHR", 1, "shared", [2]], ["CA", 2, 3, 9], ["CHR", 0, "shared", [3]], ["CA", 1, 4, 9], ["FU", 6, [0, 1, 2]], ["AN", 6, 0, 5], ["FU", 6, [1, 2, 3]], ["AN", 6, 1, 4], ["FU", 6, [2, 3, 4]], ["AN", 6, 2, 6], ["FU", 3, [0, 1, 2]], ["SP", 3, 0, 16, [1], 1], ["AN", 3, 1, 2], ["FFSP", 3, 0, [2, 1, 0], 1, 1], ["AN", 3, 1, 6], ["FU", 1, [0, 1]], ["SP", 1, 0, 2, [1], 1], ["AN", 1, 1, 2], ["FFSP", 1, 0, [2, 1, 0], 1, 1], ["AN", 1, 1, 6], ["PR", 4, 0, "auto_unroll_max_step$512"]]]], "r": [[1.57762e-05, 1.57708e-05, 1.57714e-05, 1.57721e-05, 1.57868e-05, 1.58033e-05, 1.57761e-05, 1.5769e-05, 1.57701e-05, 1.57749e-05], 0, 69.266, 1649065951], "v": "v0.6"}
{"i": [["[\"MMoE_gates\", 1, 100, 8, 2]", "cuda -keys=cuda,gpu -max_num_threads=1024 -model=unknown -thread_warp_size=32", [-1, 16, 64, 49152, 2147483647, 1024, 8, 32], "", 0, []], [[], [["SP", 2, 0, 1, [1, 1, 1, 1], 1], ["SP", 2, 5, 8, [1, 1, 1, 2], 1], ["SP", 2, 10, 2, [1, 1, 1, 1], 1], ["SP", 2, 15, 100, [25, 2], 1], ["RE", 2, [0, 5, 10, 1, 6, 11, 2, 7, 12, 15, 16, 3, 8, 13, 17, 4, 9, 14]], ["FSP", 4, 0, 0, 3], ["FSP", 4, 4, 1, 3], ["FSP", 4, 8, 2, 3], ["RE", 4, [0, 4, 8, 1, 5, 9, 2, 6, 10, 3, 7, 11]], ["CA", 2, 4, 8], ["CHR", 1, "shared", [2]], ["CA", 2, 3, 9], ["CHR", 0, "shared", [3]], ["CA", 1, 4, 9], ["FU", 6, [0, 1, 2]], ["AN", 6, 0, 5], ["FU", 6, [1, 2, 3]], ["AN", 6, 1, 4], ["FU", 6, [2, 3, 4]], ["AN", 6, 2, 6], ["FU", 3, [0, 1, 2]], ["SP", 3, 0, 200, [1], 1], ["AN", 3, 1, 2], ["FFSP", 3, 0, [2, 1, 0], 1, 1], ["AN", 3, 1, 6], ["FU", 1, [0, 1]], ["SP", 1, 0, 50, [1], 1], ["AN", 1, 1, 2], ["FFSP", 1, 0, [2, 1, 0], 1, 1], ["AN", 1, 1, 6], ["PR", 4, 0, "auto_unroll_max_step$1024"]]]], "r": [[7.94824e-06, 7.94788e-06, 7.94762e-06, 7.94806e-06, 7.94787e-06, 7.94792e-06, 7.94765e-06, 7.9474e-06, 7.94762e-06, 7.9475e-06], 0, 88.842, 1649065971], "v": "v0.6"}
{"i": [["[\"MMoE_gates\", 1, 100, 8, 2]", "cuda -keys=cuda,gpu -max_num_threads=1024 -model=unknown -thread_warp_size=32", [-1, 16, 64, 49152, 2147483647, 1024, 8, 32], "", 0, []], [[], [["SP", 2, 0, 1, [1, 1, 1, 1], 1], ["SP", 2, 5, 8, [2, 1, 2, 2], 1], ["SP", 2, 10, 2, [1, 1, 1, 2], 1], ["SP", 2, 15, 100, [50, 2], 1], ["RE", 2, [0, 5, 10, 1, 6, 11, 2, 7, 12, 15, 16, 3, 8, 13, 17, 4, 9, 14]], ["FSP", 4, 0, 0, 3], ["FSP", 4, 4, 1, 3], ["FSP", 4, 8, 2, 3], ["RE", 4, [0, 4, 8, 1, 5, 9, 2, 6, 10, 3, 7, 11]], ["CA", 2, 4, 8], ["CHR", 1, "shared", [2]], ["CA", 2, 3, 9], ["CHR", 0, "shared", [3]], ["CA", 1, 4, 9], ["FU", 6, [0, 1, 2]], ["AN", 6, 0, 5], ["FU", 6, [1, 2, 3]], ["AN", 6, 1, 4], ["FU", 6, [2, 3, 4]], ["AN", 6, 2, 6], ["FU", 3, [0, 1, 2]], ["SP", 3, 0, 800, [1], 1], ["AN", 3, 1, 2], ["FFSP", 3, 0, [2, 1, 0], 1, 1], ["AN", 3, 1, 6], ["FU", 1, [0, 1]], ["SP", 1, 0, 100, [1], 1], ["AN", 1, 1, 2], ["FFSP", 1, 0, [2, 1, 0], 1, 1], ["AN", 1, 1, 6], ["PR", 4, 0, "auto_unroll_max_step$64"]]]], "r": [[1.92872e-05, 1.92861e-05, 1.92863e-05, 1.9287e-05, 1.92871e-05, 1.92857e-05, 1.92862e-05, 1.92861e-05, 1.9287e-05, 1.92915e-05], 0, 84.208, 1649065966], "v": "v0.6"}
{"i": [["[\"MMoE_gates\", 1, 100, 8, 2]", "cuda -keys=cuda,gpu -max_num_threads=1024 -model=unknown -thread_warp_size=32", [-1, 16, 64, 49152, 2147483647, 1024, 8, 32], "", 0, []], [[], [["SP", 2, 0, 1, [1, 1, 1, 1], 1], ["SP", 2, 5, 8, [1, 2, 2, 2], 1], ["SP", 2, 10, 2, [1, 1, 2, 1], 1], ["SP", 2, 15, 100, [25, 2], 1], ["RE", 2, [0, 5, 10, 1, 6, 11, 2, 7, 12, 15, 16, 3, 8, 13, 17, 4, 9, 14]], ["FSP", 4, 0, 0, 3], ["FSP", 4, 4, 1, 3], ["FSP", 4, 8, 2, 3], ["RE", 4, [0, 4, 8, 1, 5, 9, 2, 6, 10, 3, 7, 11]], ["CA", 2, 4, 8], ["CHR", 1, "shared", [2]], ["CA", 2, 3, 9], ["CHR", 0, "shared", [3]], ["CA", 1, 4, 9], ["FU", 6, [0, 1, 2]], ["AN", 6, 0, 5], ["FU", 6, [1, 2, 3]], ["AN", 6, 1, 4], ["FU", 6, [2, 3, 4]], ["AN", 6, 2, 6], ["FU", 3, [0, 1, 2]], ["SP", 3, 0, 400, [1], 1], ["AN", 3, 1, 2], ["FFSP", 3, 0, [2, 1, 0], 1, 1], ["AN", 3, 1, 6], ["FU", 1, [0, 1]], ["SP", 1, 0, 50, [1], 1], ["AN", 1, 1, 2], ["FFSP", 1, 0, [2, 1, 0], 1, 1], ["AN", 1, 1, 6], ["PR", 4, 0, "auto_unroll_max_step$512"]]]], "r": [[1.12157e-05, 1.12133e-05, 1.12139e-05, 1.12171e-05, 1.12174e-05, 1.12159e-05, 1.12169e-05, 1.12161e-05, 1.12187e-05, 1.12176e-05], 0, 80.0828, 1649065961], "v": "v0.6"}
{"i": [["[\"MMoE_gates\", 1, 100, 8, 2]", "cuda -keys=cuda,gpu -max_num_threads=1024 -model=unknown -thread_warp_size=32", [-1, 16, 64, 49152, 2147483647, 1024, 8, 32], "", 0, []], [[], [["SP", 2, 0, 1, [1, 1, 1, 1], 1], ["SP", 2, 5, 8, [1, 1, 1, 4], 1], ["SP", 2, 10, 2, [1, 1, 1, 1], 1], ["SP", 2, 15, 100, [10, 1], 1], ["RE", 2, [0, 5, 10, 1, 6, 11, 2, 7, 12, 15, 16, 3, 8, 13, 17, 4, 9, 14]], ["FSP", 4, 0, 0, 3], ["FSP", 4, 4, 1, 3], ["FSP", 4, 8, 2, 3], ["RE", 4, [0, 4, 8, 1, 5, 9, 2, 6, 10, 3, 7, 11]], ["CA", 2, 4, 8], ["CHR", 1, "shared", [2]], ["CA", 2, 3, 9], ["CHR", 0, "shared", [3]], ["CA", 1, 4, 9], ["FU", 6, [0, 1, 2]], ["AN", 6, 0, 5], ["FU", 6, [1, 2, 3]], ["AN", 6, 1, 4], ["FU", 6, [2, 3, 4]], ["AN", 6, 2, 6], ["FU", 3, [0, 1, 2]], ["SP", 3, 0, 400, [2], 1], ["AN", 3, 1, 2], ["FFSP", 3, 0, [2, 1, 0], 1, 1], ["AN", 3, 1, 6], ["FU", 1, [0, 1]], ["SP", 1, 0, 50, [1], 1], ["AN", 1, 1, 2], ["FFSP", 1, 0, [2, 1, 0], 1, 1], ["AN", 1, 1, 6], ["PR", 4, 0, "auto_unroll_max_step$512"]]]], "r": [[1.39587e-05, 1.39585e-05, 1.39587e-05, 1.3959e-05, 1.39586e-05, 1.39589e-05, 1.39588e-05, 1.39584e-05, 1.39588e-05, 1.39586e-05], 0, 33.7263, 1649077760], "v": "v0.6"}
{"i": [["[\"MMoE_gates\", 1, 100, 8, 2]", "cuda -keys=cuda,gpu -max_num_threads=1024 -model=unknown -thread_warp_size=32", [-1, 16, 64, 49152, 2147483647, 1024, 8, 32], "", 0, []], [[], [["SP", 2, 0, 1, [1, 1, 1, 1], 1], ["SP", 2, 5, 8, [1, 1, 1, 1], 1], ["SP", 2, 10, 2, [1, 1, 1, 1], 1], ["SP", 2, 15, 100, [4, 1], 1], ["RE", 2, [0, 5, 10, 1, 6, 11, 2, 7, 12, 15, 16, 3, 8, 13, 17, 4, 9, 14]], ["FSP", 4, 0, 0, 3], ["FSP", 4, 4, 1, 3], ["FSP", 4, 8, 2, 3], ["RE", 4, [0, 4, 8, 1, 5, 9, 2, 6, 10, 3, 7, 11]], ["CA", 2, 4, 8], ["CHR", 1, "shared", [2]], ["CA", 2, 3, 9], ["CHR", 0, "shared", [3]], ["CA", 1, 4, 9], ["FU", 6, [0, 1, 2]], ["AN", 6, 0, 5], ["FU", 6, [1, 2, 3]], ["AN", 6, 1, 4], ["FU", 6, [2, 3, 4]], ["AN", 6, 2, 6], ["FU", 3, [0, 1, 2]], ["SP", 3, 0, 4, [1], 1], ["AN", 3, 1, 2], ["FFSP", 3, 0, [2, 1, 0], 1, 1], ["AN", 3, 1, 6], ["FU", 1, [0, 1]], ["SP", 1, 0, 4, [1], 1], ["AN", 1, 1, 2], ["FFSP", 1, 0, [2, 1, 0], 1, 1], ["AN", 1, 1, 6], ["PR", 4, 0, "auto_unroll_max_step$1024"]]]], "r": [[6.50044e-06, 6.50015e-06, 6.50014e-06, 6.50016e-06, 6.50022e-06, 6.50021e-06, 6.50011e-06, 6.50036e-06, 6.50024e-06, 6.5004e-06], 0, 25.2437, 1649077751], "v": "v0.6"}
{"i": [["[\"MMoE_gates\", 1, 100, 8, 2]", "cuda -keys=cuda,gpu -max_num_threads=1024 -model=unknown -thread_warp_size=32", [-1, 16, 64, 49152, 2147483647, 1024, 8, 32], "", 0, []], [[], [["SP", 2, 0, 1, [1, 1, 1, 1], 1], ["SP", 2, 5, 8, [4, 1, 1, 1], 1], ["SP", 2, 10, 2, [1, 2, 1, 1], 1], ["SP", 2, 15, 100, [1, 50], 1], ["RE", 2, [0, 5, 10, 1, 6, 11, 2, 7, 12, 15, 16, 3, 8, 13, 17, 4, 9, 14]], ["FSP", 4, 0, 0, 3], ["FSP", 4, 4, 1, 3], ["FSP", 4, 8, 2, 3], ["RE", 4, [0, 4, 8, 1, 5, 9, 2, 6, 10, 3, 7, 11]], ["CA", 2, 4, 8], ["CHR", 1, "shared", [2]], ["CA", 2, 3, 9], ["CHR", 0, "shared", [3]], ["CA", 1, 4, 9], ["FU", 6, [0, 1, 2]], ["AN", 6, 0, 5], ["FU", 6, [1, 2, 3]], ["AN", 6, 1, 4], ["FU", 6, [2, 3, 4]], ["AN", 6, 2, 6], ["FU", 3, [0, 1, 2]], ["SP", 3, 0, 2, [2], 1], ["AN", 3, 1, 2], ["FFSP", 3, 0, [2, 1, 0], 1, 1], ["AN", 3, 1, 6], ["FU", 1, [0, 1]], ["SP", 1, 0, 2, [1], 1], ["AN", 1, 1, 2], ["FFSP", 1, 0, [2, 1, 0], 1, 1], ["AN", 1, 1, 6], ["PR", 4, 0, "auto_unroll_max_step$16"]]]], "r": [[8.49074e-06, 8.4908e-06, 8.49077e-06, 8.49077e-06, 8.49076e-06, 8.49063e-06, 8.49069e-06, 8.49074e-06, 8.49083e-06, 8.49061e-06], 0, 15.8157, 1649077742], "v": "v0.6"}
{"i": [["[\"MMoE_gates\", 1, 100, 8, 2]", "cuda -keys=cuda,gpu -max_num_threads=1024 -model=unknown -thread_warp_size=32", [-1, 16, 64, 49152, 2147483647, 1024, 8, 32], "", 0, []], [[], [["SP", 2, 0, 1, [1, 1, 1, 1], 1], ["SP", 2, 5, 8, [4, 1, 1, 1], 1], ["SP", 2, 10, 2, [1, 1, 1, 2], 1], ["SP", 2, 15, 100, [100, 1], 1], ["RE", 2, [0, 5, 10, 1, 6, 11, 2, 7, 12, 15, 16, 3, 8, 13, 17, 4, 9, 14]], ["FSP", 4, 0, 0, 3], ["FSP", 4, 4, 1, 3], ["FSP", 4, 8, 2, 3], ["RE", 4, [0, 4, 8, 1, 5, 9, 2, 6, 10, 3, 7, 11]], ["CA", 2, 4, 8], ["CHR", 1, "shared", [2]], ["CA", 2, 3, 9], ["CHR", 0, "shared", [3]], ["CA", 1, 4, 9], ["FU", 6, [0, 1, 2]], ["AN", 6, 0, 5], ["FU", 6, [1, 2, 3]], ["AN", 6, 1, 4], ["FU", 6, [2, 3, 4]], ["AN", 6, 2, 6], ["FU", 3, [0, 1, 2]], ["SP", 3, 0, 200, [1], 1], ["AN", 3, 1, 2], ["FFSP", 3, 0, [2, 1, 0], 1, 1], ["AN", 3, 1, 6], ["FU", 1, [0, 1]], ["SP", 1, 0, 100, [1], 1], ["AN", 1, 1, 2], ["FFSP", 1, 0, [2, 1, 0], 1, 1], ["AN", 1, 1, 6], ["PR", 4, 0, "auto_unroll_max_step$1024"]]]], "r": [[1.19913e-05, 1.19921e-05, 1.19918e-05, 1.19915e-05, 1.19915e-05, 1.19916e-05, 1.19932e-05, 1.19973e-05, 1.1997e-05, 1.19968e-05], 0, 9.87601, 1649077733], "v": "v0.6"}
{"i": [["[\"MMoE_gates\", 1, 100, 8, 2]", "cuda -keys=cuda,gpu -max_num_threads=1024 -model=unknown -thread_warp_size=32", [-1, 16, 64, 49152, 2147483647, 1024, 8, 32], "", 0, []], [[], [["SP", 2, 0, 1, [1, 1, 1, 1], 1], ["SP", 2, 5, 8, [1, 2, 1, 2], 1], ["SP", 2, 10, 2, [1, 2, 1, 1], 1], ["SP", 2, 15, 100, [5, 20], 1], ["RE", 2, [0, 5, 10, 1, 6, 11, 2, 7, 12, 15, 16, 3, 8, 13, 17, 4, 9, 14]], ["FSP", 4, 0, 0, 3], ["FSP", 4, 4, 1, 3], ["FSP", 4, 8, 2, 3], ["RE", 4, [0, 4, 8, 1, 5, 9, 2, 6, 10, 3, 7, 11]], ["CA", 2, 4, 8], ["CHR", 1, "shared", [2]], ["CA", 2, 3, 9], ["CHR", 0, "shared", [3]], ["CA", 1, 4, 9], ["FU", 6, [0, 1, 2]], ["AN", 6, 0, 5], ["FU", 6, [1, 2, 3]], ["AN", 6, 1, 4], ["FU", 6, [2, 3, 4]], ["AN", 6, 2, 6], ["FU", 3, [0, 1, 2]], ["SP", 3, 0, 200, [1], 1], ["AN", 3, 1, 2], ["FFSP", 3, 0, [2, 1, 0], 1, 1], ["AN", 3, 1, 6], ["FU", 1, [0, 1]], ["SP", 1, 0, 100, [1], 1], ["AN", 1, 1, 2], ["FFSP", 1, 0, [2, 1, 0], 1, 1], ["AN", 1, 1, 6], ["PR", 4, 0, "auto_unroll_max_step$512"]]]], "r": [[5.19748e-06, 5.19775e-06, 5.19712e-06, 5.19713e-06, 5.19781e-06, 5.198e-06, 5.19817e-06, 5.19842e-06, 5.1977e-06, 5.19738e-06], 0, 48.5563, 1649077774], "v": "v0.6"}
{"i": [["[\"MMoE_gates\", 1, 100, 8, 2]", "cuda -keys=cuda,gpu -max_num_threads=1024 -model=unknown -thread_warp_size=32", [-1, 16, 64, 49152, 2147483647, 1024, 8, 32], "", 0, []], [[], [["SP", 2, 0, 1, [1, 1, 1, 1], 1], ["SP", 2, 5, 8, [4, 2, 1, 1], 1], ["SP", 2, 10, 2, [2, 1, 1, 1], 1], ["SP", 2, 15, 100, [2, 1], 1], ["RE", 2, [0, 5, 10, 1, 6, 11, 2, 7, 12, 15, 16, 3, 8, 13, 17, 4, 9, 14]], ["FSP", 4, 0, 0, 3], ["FSP", 4, 4, 1, 3], ["FSP", 4, 8, 2, 3], ["RE", 4, [0, 4, 8, 1, 5, 9, 2, 6, 10, 3, 7, 11]], ["CA", 2, 4, 8], ["CHR", 1, "shared", [2]], ["CA", 2, 3, 9], ["CHR", 0, "shared", [3]], ["CA", 1, 4, 9], ["FU", 6, [0, 1, 2]], ["AN", 6, 0, 5], ["FU", 6, [1, 2, 3]], ["AN", 6, 1, 4], ["FU", 6, [2, 3, 4]], ["AN", 6, 2, 6], ["FU", 3, [0, 1, 2]], ["SP", 3, 0, 2, [1], 1], ["AN", 3, 1, 2], ["FFSP", 3, 0, [2, 1, 0], 1, 1], ["AN", 3, 1, 6], ["FU", 1, [0, 1]], ["SP", 1, 0, 2, [1], 1], ["AN", 1, 1, 2], ["FFSP", 1, 0, [2, 1, 0], 1, 1], ["AN", 1, 1, 6], ["PR", 4, 0, "auto_unroll_max_step$1024"]]]], "r": [[1.8203e-05, 1.81871e-05, 1.81788e-05, 1.81671e-05, 1.81693e-05, 1.81668e-05, 1.818e-05, 1.81847e-05, 1.81706e-05, 1.81694e-05], 0, 38.4145, 1649077765], "v": "v0.6"}
{"i": [["[\"MMoE_gates\", 1, 100, 8, 2]", "cuda -keys=cuda,gpu -max_num_threads=1024 -model=unknown -thread_warp_size=32", [-1, 16, 64, 49152, 2147483647, 1024, 8, 32], "", 0, []], [[], [["SP", 2, 0, 1, [1, 1, 1, 1], 1], ["SP", 2, 5, 8, [1, 1, 4, 2], 1], ["SP", 2, 10, 2, [1, 1, 1, 1], 1], ["SP", 2, 15, 100, [10, 2], 1], ["RE", 2, [0, 5, 10, 1, 6, 11, 2, 7, 12, 15, 16, 3, 8, 13, 17, 4, 9, 14]], ["FSP", 4, 0, 0, 3], ["FSP", 4, 4, 1, 3], ["FSP", 4, 8, 2, 3], ["RE", 4, [0, 4, 8, 1, 5, 9, 2, 6, 10, 3, 7, 11]], ["CA", 2, 4, 8], ["CHR", 1, "shared", [2]], ["CA", 2, 3, 9], ["CHR", 0, "shared", [3]], ["CA", 1, 4, 9], ["FU", 6, [0, 1, 2]], ["AN", 6, 0, 5], ["FU", 6, [1, 2, 3]], ["AN", 6, 1, 4], ["FU", 6, [2, 3, 4]], ["AN", 6, 2, 6], ["FU", 3, [0, 1, 2]], ["SP", 3, 0, 64, [1], 1], ["AN", 3, 1, 2], ["FFSP", 3, 0, [2, 1, 0], 1, 1], ["AN", 3, 1, 6], ["FU", 1, [0, 1]], ["SP", 1, 0, 4, [1], 1], ["AN", 1, 1, 2], ["FFSP", 1, 0, [2, 1, 0], 1, 1], ["AN", 1, 1, 6], ["PR", 4, 0, "auto_unroll_max_step$512"]]]], "r": [[1.46089e-05, 1.46089e-05, 1.46087e-05, 1.46087e-05, 1.46087e-05, 1.46087e-05, 1.46087e-05, 1.46088e-05, 1.46088e-05, 1.46088e-05], 0, 12.1433, 1649077738], "v": "v0.6"}
{"i": [["[\"MMoE_gates\", 1, 100, 8, 2]", "cuda -keys=cuda,gpu -max_num_threads=1024 -model=unknown -thread_warp_size=32", [-1, 16, 64, 49152, 2147483647, 1024, 8, 32], "", 0, []], [[], [["SP", 2, 0, 1, [1, 1, 1, 1], 1], ["SP", 2, 5, 8, [2, 1, 4, 1], 1], ["SP", 2, 10, 2, [1, 1, 2, 1], 1], ["SP", 2, 15, 100, [1, 5], 1], ["RE", 2, [0, 5, 10, 1, 6, 11, 2, 7, 12, 15, 16, 3, 8, 13, 17, 4, 9, 14]], ["FSP", 4, 0, 0, 3], ["FSP", 4, 4, 1, 3], ["FSP", 4, 8, 2, 3], ["RE", 4, [0, 4, 8, 1, 5, 9, 2, 6, 10, 3, 7, 11]], ["CA", 2, 4, 8], ["CHR", 1, "shared", [2]], ["CA", 2, 3, 9], ["CHR", 0, "shared", [3]], ["CA", 1, 4, 9], ["FU", 6, [0, 1, 2]], ["AN", 6, 0, 5], ["FU", 6, [1, 2, 3]], ["AN", 6, 1, 4], ["FU", 6, [2, 3, 4]], ["AN", 6, 2, 6], ["FU", 3, [0, 1, 2]], ["SP", 3, 0, 20, [2], 1], ["AN", 3, 1, 2], ["FFSP", 3, 0, [2, 1, 0], 1, 1], ["AN", 3, 1, 6], ["FU", 1, [0, 1]], ["SP", 1, 0, 5, [1], 1], ["AN", 1, 1, 2], ["FFSP", 1, 0, [2, 1, 0], 1, 1], ["AN", 1, 1, 6], ["PR", 4, 0, "auto_unroll_max_step$16"]]]], "r": [[2.21867e-05, 2.2195e-05, 2.21987e-05, 2.21979e-05, 2.21977e-05, 2.21911e-05, 2.21929e-05, 2.21826e-05, 2.21826e-05, 2.21724e-05], 0, 43.4218, 1649077770], "v": "v0.6"}
{"i": [["[\"MMoE_gates\", 1, 100, 8, 2]", "cuda -keys=cuda,gpu -max_num_threads=1024 -model=unknown -thread_warp_size=32", [-1, 16, 64, 49152, 2147483647, 1024, 8, 32], "", 0, []], [[], [["SP", 2, 0, 1, [1, 1, 1, 1], 1], ["SP", 2, 5, 8, [1, 1, 4, 2], 1], ["SP", 2, 10, 2, [2, 1, 1, 1], 1], ["SP", 2, 15, 100, [2, 1], 1], ["RE", 2, [0, 5, 10, 1, 6, 11, 2, 7, 12, 15, 16, 3, 8, 13, 17, 4, 9, 14]], ["FSP", 4, 0, 0, 3], ["FSP", 4, 4, 1, 3], ["FSP", 4, 8, 2, 3], ["RE", 4, [0, 4, 8, 1, 5, 9, 2, 6, 10, 3, 7, 11]], ["CA", 2, 4, 8], ["CHR", 1, "shared", [2]], ["CA", 2, 3, 9], ["CHR", 0, "shared", [3]], ["CA", 1, 4, 9], ["FU", 6, [0, 1, 2]], ["AN", 6, 0, 5], ["FU", 6, [1, 2, 3]], ["AN", 6, 1, 4], ["FU", 6, [2, 3, 4]], ["AN", 6, 2, 6], ["FU", 3, [0, 1, 2]], ["SP", 3, 0, 8, [1], 1], ["AN", 3, 1, 2], ["FFSP", 3, 0, [2, 1, 0], 1, 1], ["AN", 3, 1, 6], ["FU", 1, [0, 1]], ["SP", 1, 0, 1, [1], 1], ["AN", 1, 1, 2], ["FFSP", 1, 0, [2, 1, 0], 1, 1], ["AN", 1, 1, 6], ["PR", 4, 0, "auto_unroll_max_step$64"]]]], "r": [[3.46736e-05, 3.46749e-05, 3.46745e-05, 3.46765e-05, 3.46742e-05, 3.46742e-05, 3.46745e-05, 3.4674e-05, 3.46737e-05, 3.46738e-05], 0, 65.6032, 1649077792], "v": "v0.6"}
{"i": [["[\"MMoE_gates\", 1, 100, 8, 2]", "cuda -keys=cuda,gpu -max_num_threads=1024 -model=unknown -thread_warp_size=32", [-1, 16, 64, 49152, 2147483647, 1024, 8, 32], "", 0, []], [[], [["SP", 2, 0, 1, [1, 1, 1, 1], 1], ["SP", 2, 5, 8, [2, 1, 4, 1], 1], ["SP", 2, 10, 2, [2, 1, 1, 1], 1], ["SP", 2, 15, 100, [2, 2], 1], ["RE", 2, [0, 5, 10, 1, 6, 11, 2, 7, 12, 15, 16, 3, 8, 13, 17, 4, 9, 14]], ["FSP", 4, 0, 0, 3], ["FSP", 4, 4, 1, 3], ["FSP", 4, 8, 2, 3], ["RE", 4, [0, 4, 8, 1, 5, 9, 2, 6, 10, 3, 7, 11]], ["CA", 2, 4, 8], ["CHR", 1, "shared", [2]], ["CA", 2, 3, 9], ["CHR", 0, "shared", [3]], ["CA", 1, 4, 9], ["FU", 6, [0, 1, 2]], ["AN", 6, 0, 5], ["FU", 6, [1, 2, 3]], ["AN", 6, 1, 4], ["FU", 6, [2, 3, 4]], ["AN", 6, 2, 6], ["FU", 3, [0, 1, 2]], ["SP", 3, 0, 16, [1], 1], ["AN", 3, 1, 2], ["FFSP", 3, 0, [2, 1, 0], 1, 1], ["AN", 3, 1, 6], ["FU", 1, [0, 1]], ["SP", 1, 0, 4, [1], 1], ["AN", 1, 1, 2], ["FFSP", 1, 0, [2, 1, 0], 1, 1], ["AN", 1, 1, 6], ["PR", 4, 0, "auto_unroll_max_step$512"]]]], "r": [[2.27872e-05, 2.27826e-05, 2.27795e-05, 2.27812e-05, 2.27819e-05, 2.27804e-05, 2.27855e-05, 2.27849e-05, 2.27793e-05, 2.27775e-05], 0, 20.8364, 1649077747], "v": "v0.6"}
{"i": [["[\"MMoE_gates\", 1, 100, 8, 2]", "cuda -keys=cuda,gpu -max_num_threads=1024 -model=unknown -thread_warp_size=32", [-1, 16, 64, 49152, 2147483647, 1024, 8, 32], "", 0, []], [[], [["SP", 2, 0, 1, [1, 1, 1, 1], 1], ["SP", 2, 5, 8, [1, 2, 1, 2], 1], ["SP", 2, 10, 2, [1, 1, 2, 1], 1], ["SP", 2, 15, 100, [25, 2], 1], ["RE", 2, [0, 5, 10, 1, 6, 11, 2, 7, 12, 15, 16, 3, 8, 13, 17, 4, 9, 14]], ["FSP", 4, 0, 0, 3], ["FSP", 4, 4, 1, 3], ["FSP", 4, 8, 2, 3], ["RE", 4, [0, 4, 8, 1, 5, 9, 2, 6, 10, 3, 7, 11]], ["CA", 2, 4, 8], ["CHR", 1, "shared", [2]], ["CA", 2, 3, 9], ["CHR", 0, "shared", [3]], ["CA", 1, 4, 9], ["FU", 6, [0, 1, 2]], ["AN", 6, 0, 5], ["FU", 6, [1, 2, 3]], ["AN", 6, 1, 4], ["FU", 6, [2, 3, 4]], ["AN", 6, 2, 6], ["FU", 3, [0, 1, 2]], ["SP", 3, 0, 400, [1], 1], ["AN", 3, 1, 2], ["FFSP", 3, 0, [2, 1, 0], 1, 1], ["AN", 3, 1, 6], ["FU", 1, [0, 1]], ["SP", 1, 0, 50, [1], 1], ["AN", 1, 1, 2], ["FFSP", 1, 0, [2, 1, 0], 1, 1], ["AN", 1, 1, 6], ["PR", 4, 0, "auto_unroll_max_step$16"]]]], "r": [[7.44928e-06, 7.4479e-06, 7.44875e-06, 7.44745e-06, 7.44976e-06, 7.44892e-06, 7.45176e-06, 7.44758e-06, 7.4518e-06, 7.44969e-06], 0, 51.2318, 1649077778], "v": "v0.6"}
{"i": [["[\"MMoE_gates\", 1, 100, 8, 2]", "cuda -keys=cuda,gpu -max_num_threads=1024 -model=unknown -thread_warp_size=32", [-1, 16, 64, 49152, 2147483647, 1024, 8, 32], "", 0, []], [[], [["SP", 2, 0, 1, [1, 1, 1, 1], 1], ["SP", 2, 5, 8, [1, 4, 2, 1], 1], ["SP", 2, 10, 2, [1, 1, 1, 1], 1], ["SP", 2, 15, 100, [1, 1], 1], ["RE", 2, [0, 5, 10, 1, 6, 11, 2, 7, 12, 15, 16, 3, 8, 13, 17, 4, 9, 14]], ["FSP", 4, 0, 0, 3], ["FSP", 4, 4, 1, 3], ["FSP", 4, 8, 2, 3], ["RE", 4, [0, 4, 8, 1, 5, 9, 2, 6, 10, 3, 7, 11]], ["CA", 2, 4, 8], ["CHR", 1, "shared", [2]], ["CA", 2, 3, 9], ["CHR", 0, "shared", [3]], ["CA", 1, 4, 9], ["FU", 6, [0, 1, 2]], ["AN", 6, 0, 5], ["FU", 6, [1, 2, 3]], ["AN", 6, 1, 4], ["FU", 6, [2, 3, 4]], ["AN", 6, 2, 6], ["FU", 3, [0, 1, 2]], ["SP", 3, 0, 20, [1], 1], ["AN", 3, 1, 2], ["FFSP", 3, 0, [2, 1, 0], 1, 1], ["AN", 3, 1, 6], ["FU", 1, [0, 1]], ["SP", 1, 0, 5, [1], 1], ["AN", 1, 1, 2], ["FFSP", 1, 0, [2, 1, 0], 1, 1], ["AN", 1, 1, 6], ["PR", 4, 0, "auto_unroll_max_step$512"]]]], "r": [[8.57571e-06, 8.56642e-06, 8.55958e-06, 8.56394e-06, 8.55584e-06, 8.56376e-06, 8.54949e-06, 8.55238e-06, 8.55544e-06, 8.56176e-06], 0, 104.941, 1649077831], "v": "v0.6"}
{"i": [["[\"MMoE_gates\", 1, 100, 8, 2]", "cuda -keys=cuda,gpu -max_num_threads=1024 -model=unknown -thread_warp_size=32", [-1, 16, 64, 49152, 2147483647, 1024, 8, 32], "", 0, []], [[], [["SP", 2, 0, 1, [1, 1, 1, 1], 1], ["SP", 2, 5, 8, [1, 1, 1, 4], 1], ["SP", 2, 10, 2, [1, 2, 1, 1], 1], ["SP", 2, 15, 100, [4, 5], 1], ["RE", 2, [0, 5, 10, 1, 6, 11, 2, 7, 12, 15, 16, 3, 8, 13, 17, 4, 9, 14]], ["FSP", 4, 0, 0, 3], ["FSP", 4, 4, 1, 3], ["FSP", 4, 8, 2, 3], ["RE", 4, [0, 4, 8, 1, 5, 9, 2, 6, 10, 3, 7, 11]], ["CA", 2, 4, 8], ["CHR", 1, "shared", [2]], ["CA", 2, 3, 9], ["CHR", 0, "shared", [3]], ["CA", 1, 4, 9], ["FU", 6, [0, 1, 2]], ["AN", 6, 0, 5], ["FU", 6, [1, 2, 3]], ["AN", 6, 1, 4], ["FU", 6, [2, 3, 4]], ["AN", 6, 2, 6], ["FU", 3, [0, 1, 2]], ["SP", 3, 0, 80, [1], 1], ["AN", 3, 1, 2], ["FFSP", 3, 0, [2, 1, 0], 1, 1], ["AN", 3, 1, 6], ["FU", 1, [0, 1]], ["SP", 1, 0, 20, [1], 1], ["AN", 1, 1, 2], ["FFSP", 1, 0, [2, 1, 0], 1, 1], ["AN", 1, 1, 6], ["PR", 4, 0, "auto_unroll_max_step$16"]]]], "r": [[8.14819e-06, 8.14157e-06, 8.13854e-06, 8.13455e-06, 8.12611e-06, 8.10659e-06, 8.10685e-06, 8.12637e-06, 8.11094e-06, 8.11119e-06], 0, 29.0536, 1649077755], "v": "v0.6"}
{"i": [["[\"MMoE_gates\", 1, 100, 8, 2]", "cuda -keys=cuda,gpu -max_num_threads=1024 -model=unknown -thread_warp_size=32", [-1, 16, 64, 49152, 2147483647, 1024, 8, 32], "", 0, []], [[], [["SP", 2, 0, 1, [1, 1, 1, 1], 1], ["SP", 2, 5, 8, [8, 1, 1, 1], 1], ["SP", 2, 10, 2, [1, 1, 1, 2], 1], ["SP", 2, 15, 100, [4, 1], 1], ["RE", 2, [0, 5, 10, 1, 6, 11, 2, 7, 12, 15, 16, 3, 8, 13, 17, 4, 9, 14]], ["FSP", 4, 0, 0, 3], ["FSP", 4, 4, 1, 3], ["FSP", 4, 8, 2, 3], ["RE", 4, [0, 4, 8, 1, 5, 9, 2, 6, 10, 3, 7, 11]], ["CA", 2, 4, 8], ["CHR", 1, "shared", [2]], ["CA", 2, 3, 9], ["CHR", 0, "shared", [3]], ["CA", 1, 4, 9], ["FU", 6, [0, 1, 2]], ["AN", 6, 0, 5], ["FU", 6, [1, 2, 3]], ["AN", 6, 1, 4], ["FU", 6, [2, 3, 4]], ["AN", 6, 2, 6], ["FU", 3, [0, 1, 2]], ["SP", 3, 0, 4, [4], 1], ["AN", 3, 1, 2], ["FFSP", 3, 0, [2, 1, 0], 1, 1], ["AN", 3, 1, 6], ["FU", 1, [0, 1]], ["SP", 1, 0, 4, [2], 1], ["AN", 1, 1, 2], ["FFSP", 1, 0, [2, 1, 0], 1, 1], ["AN", 1, 1, 6], ["PR", 4, 0, "auto_unroll_max_step$512"]]]], "r": [[2.25142e-05, 2.24868e-05, 2.24857e-05, 2.24833e-05, 2.24886e-05, 2.25278e-05, 2.25325e-05, 2.25291e-05, 2.25331e-05, 2.25331e-05], 0, 60.4798, 1649077787], "v": "v0.6"}
{"i": [["[\"MMoE_gates\", 1, 100, 8, 2]", "cuda -keys=cuda,gpu -max_num_threads=1024 -model=unknown -thread_warp_size=32", [-1, 16, 64, 49152, 2147483647, 1024, 8, 32], "", 0, []], [[], [["SP", 2, 0, 1, [1, 1, 1, 1], 1], ["SP", 2, 5, 8, [1, 1, 8, 1], 1], ["SP", 2, 10, 2, [1, 1, 1, 2], 1], ["SP", 2, 15, 100, [2, 5], 1], ["RE", 2, [0, 5, 10, 1, 6, 11, 2, 7, 12, 15, 16, 3, 8, 13, 17, 4, 9, 14]], ["FSP", 4, 0, 0, 3], ["FSP", 4, 4, 1, 3], ["FSP", 4, 8, 2, 3], ["RE", 4, [0, 4, 8, 1, 5, 9, 2, 6, 10, 3, 7, 11]], ["CA", 2, 4, 8], ["CHR", 1, "shared", [2]], ["CA", 2, 3, 9], ["CHR", 0, "shared", [3]], ["CA", 1, 4, 9], ["FU", 6, [0, 1, 2]], ["AN", 6, 0, 5], ["FU", 6, [1, 2, 3]], ["AN", 6, 1, 4], ["FU", 6, [2, 3, 4]], ["AN", 6, 2, 6], ["FU", 3, [0, 1, 2]], ["SP", 3, 0, 80, [2], 1], ["AN", 3, 1, 2], ["FFSP", 3, 0, [2, 1, 0], 1, 1], ["AN", 3, 1, 6], ["FU", 1, [0, 1]], ["SP", 1, 0, 10, [1], 1], ["AN", 1, 1, 2], ["FFSP", 1, 0, [2, 1, 0], 1, 1], ["AN", 1, 1, 6], ["PR", 4, 0, "auto_unroll_max_step$0"]]]], "r": [[2.51486e-05, 2.51483e-05, 2.51491e-05, 2.51487e-05, 2.5149e-05, 2.51484e-05, 2.51471e-05, 2.51423e-05, 2.51436e-05, 2.51409e-05], 0, 81.2784, 1649077808], "v": "v0.6"}
{"i": [["[\"MMoE_gates\", 1, 100, 8, 2]", "cuda -keys=cuda,gpu -max_num_threads=1024 -model=unknown -thread_warp_size=32", [-1, 16, 64, 49152, 2147483647, 1024, 8, 32], "", 0, []], [[], [["SP", 2, 0, 1, [1, 1, 1, 1], 1], ["SP", 2, 5, 8, [2, 1, 2, 2], 1], ["SP", 2, 10, 2, [2, 1, 1, 1], 1], ["SP", 2, 15, 100, [1, 20], 1], ["RE", 2, [0, 5, 10, 1, 6, 11, 2, 7, 12, 15, 16, 3, 8, 13, 17, 4, 9, 14]], ["FSP", 4, 0, 0, 3], ["FSP", 4, 4, 1, 3], ["FSP", 4, 8, 2, 3], ["RE", 4, [0, 4, 8, 1, 5, 9, 2, 6, 10, 3, 7, 11]], ["CA", 2, 4, 8], ["CHR", 1, "shared", [2]], ["CA", 2, 3, 9], ["CHR", 0, "shared", [3]], ["CA", 1, 4, 9], ["FU", 6, [0, 1, 2]], ["AN", 6, 0, 5], ["FU", 6, [1, 2, 3]], ["AN", 6, 1, 4], ["FU", 6, [2, 3, 4]], ["AN", 6, 2, 6], ["FU", 3, [0, 1, 2]], ["SP", 3, 0, 40, [1], 1], ["AN", 3, 1, 2], ["FFSP", 3, 0, [2, 1, 0], 1, 1], ["AN", 3, 1, 6], ["FU", 1, [0, 1]], ["SP", 1, 0, 20, [1], 1], ["AN", 1, 1, 2], ["FFSP", 1, 0, [2, 1, 0], 1, 1], ["AN", 1, 1, 6], ["PR", 4, 0, "auto_unroll_max_step$512"]]]], "r": [[4.162e-05, 4.16253e-05, 4.16232e-05, 4.16334e-05, 4.16296e-05, 4.16219e-05, 4.16281e-05, 4.16218e-05, 4.16265e-05, 4.16286e-05], 0, 96.0266, 1649077822], "v": "v0.6"}
{"i": [["[\"MMoE_gates\", 1, 100, 8, 2]", "cuda -keys=cuda,gpu -max_num_threads=1024 -model=unknown -thread_warp_size=32", [-1, 16, 64, 49152, 2147483647, 1024, 8, 32], "", 0, []], [[], [["SP", 2, 0, 1, [1, 1, 1, 1], 1], ["SP", 2, 5, 8, [1, 1, 1, 8], 1], ["SP", 2, 10, 2, [1, 1, 1, 1], 1], ["SP", 2, 15, 100, [2, 10], 1], ["RE", 2, [0, 5, 10, 1, 6, 11, 2, 7, 12, 15, 16, 3, 8, 13, 17, 4, 9, 14]], ["FSP", 4, 0, 0, 3], ["FSP", 4, 4, 1, 3], ["FSP", 4, 8, 2, 3], ["RE", 4, [0, 4, 8, 1, 5, 9, 2, 6, 10, 3, 7, 11]], ["CA", 2, 4, 8], ["CHR", 1, "shared", [2]], ["CA", 2, 3, 9], ["CHR", 0, "shared", [3]], ["CA", 1, 4, 9], ["FU", 6, [0, 1, 2]], ["AN", 6, 0, 5], ["FU", 6, [1, 2, 3]], ["AN", 6, 1, 4], ["FU", 6, [2, 3, 4]], ["AN", 6, 2, 6], ["FU", 3, [0, 1, 2]], ["SP", 3, 0, 40, [1], 1], ["AN", 3, 1, 2], ["FFSP", 3, 0, [2, 1, 0], 1, 1], ["AN", 3, 1, 6], ["FU", 1, [0, 1]], ["SP", 1, 0, 20, [1], 1], ["AN", 1, 1, 2], ["FFSP", 1, 0, [2, 1, 0], 1, 1], ["AN", 1, 1, 6], ["PR", 4, 0, "auto_unroll_max_step$64"]]]], "r": [[2.41977e-05, 2.41977e-05, 2.41976e-05, 2.41978e-05, 2.41977e-05, 2.41976e-05, 2.41976e-05, 2.41976e-05, 2.41975e-05, 2.41978e-05], 0, 70.8086, 1649077797], "v": "v0.6"}
{"i": [["[\"MMoE_gates\", 1, 100, 8, 2]", "cuda -keys=cuda,gpu -max_num_threads=1024 -model=unknown -thread_warp_size=32", [-1, 16, 64, 49152, 2147483647, 1024, 8, 32], "", 0, []], [[], [["SP", 2, 0, 1, [1, 1, 1, 1], 1], ["SP", 2, 5, 8, [1, 1, 1, 1], 1], ["SP", 2, 10, 2, [1, 1, 1, 1], 1], ["SP", 2, 15, 100, [2, 25], 1], ["RE", 2, [0, 5, 10, 1, 6, 11, 2, 7, 12, 15, 16, 3, 8, 13, 17, 4, 9, 14]], ["FSP", 4, 0, 0, 3], ["FSP", 4, 4, 1, 3], ["FSP", 4, 8, 2, 3], ["RE", 4, [0, 4, 8, 1, 5, 9, 2, 6, 10, 3, 7, 11]], ["CA", 2, 4, 8], ["CHR", 1, "shared", [2]], ["CA", 2, 3, 9], ["CHR", 0, "shared", [3]], ["CA", 1, 4, 9], ["FU", 6, [0, 1, 2]], ["AN", 6, 0, 5], ["FU", 6, [1, 2, 3]], ["AN", 6, 1, 4], ["FU", 6, [2, 3, 4]], ["AN", 6, 2, 6], ["FU", 3, [0, 1, 2]], ["SP", 3, 0, 50, [1], 1], ["AN", 3, 1, 2], ["FFSP", 3, 0, [2, 1, 0], 1, 1], ["AN", 3, 1, 6], ["FU", 1, [0, 1]], ["SP", 1, 0, 50, [1], 1], ["AN", 1, 1, 2], ["FFSP", 1, 0, [2, 1, 0], 1, 1], ["AN", 1, 1, 6], ["PR", 4, 0, "auto_unroll_max_step$64"]]]], "r": [[5.75983e-06, 5.75986e-06, 5.75988e-06, 5.75994e-06, 5.75986e-06, 5.75979e-06, 5.75987e-06, 5.75983e-06, 5.75977e-06, 5.75979e-06], 0, 90.1554, 1649077817], "v": "v0.6"}
{"i": [["[\"MMoE_gates\", 1, 100, 8, 2]", "cuda -keys=cuda,gpu -max_num_threads=1024 -model=unknown -thread_warp_size=32", [-1, 16, 64, 49152, 2147483647, 1024, 8, 32], "", 0, []], [[], [["SP", 2, 0, 1, [1, 1, 1, 1], 1], ["SP", 2, 5, 8, [2, 1, 1, 4], 1], ["SP", 2, 10, 2, [1, 1, 1, 1], 1], ["SP", 2, 15, 100, [10, 1], 1], ["RE", 2, [0, 5, 10, 1, 6, 11, 2, 7, 12, 15, 16, 3, 8, 13, 17, 4, 9, 14]], ["FSP", 4, 0, 0, 3], ["FSP", 4, 4, 1, 3], ["FSP", 4, 8, 2, 3], ["RE", 4, [0, 4, 8, 1, 5, 9, 2, 6, 10, 3, 7, 11]], ["CA", 2, 4, 8], ["CHR", 1, "shared", [2]], ["CA", 2, 3, 9], ["CHR", 0, "shared", [3]], ["CA", 1, 4, 9], ["FU", 6, [0, 1, 2]], ["AN", 6, 0, 5], ["FU", 6, [1, 2, 3]], ["AN", 6, 1, 4], ["FU", 6, [2, 3, 4]], ["AN", 6, 2, 6], ["FU", 3, [0, 1, 2]], ["SP", 3, 0, 80, [1], 1], ["AN", 3, 1, 2], ["FFSP", 3, 0, [2, 1, 0], 1, 1], ["AN", 3, 1, 6], ["FU", 1, [0, 1]], ["SP", 1, 0, 10, [1], 1], ["AN", 1, 1, 2], ["FFSP", 1, 0, [2, 1, 0], 1, 1], ["AN", 1, 1, 6], ["PR", 4, 0, "auto_unroll_max_step$0"]]]], "r": [[2.4154e-05, 2.4154e-05, 2.41541e-05, 2.41542e-05, 2.41542e-05, 2.41542e-05, 2.41539e-05, 2.4154e-05, 2.4154e-05, 2.4154e-05], 0, 75.8803, 1649077803], "v": "v0.6"}
{"i": [["[\"MMoE_gates\", 1, 100, 8, 2]", "cuda -keys=cuda,gpu -max_num_threads=1024 -model=unknown -thread_warp_size=32", [-1, 16, 64, 49152, 2147483647, 1024, 8, 32], "", 0, []], [[], [["SP", 2, 0, 1, [1, 1, 1, 1], 1], ["SP", 2, 5, 8, [1, 2, 4, 1], 1], ["SP", 2, 10, 2, [1, 2, 1, 1], 1], ["SP", 2, 15, 100, [4, 25], 1], ["RE", 2, [0, 5, 10, 1, 6, 11, 2, 7, 12, 15, 16, 3, 8, 13, 17, 4, 9, 14]], ["FSP", 4, 0, 0, 3], ["FSP", 4, 4, 1, 3], ["FSP", 4, 8, 2, 3], ["RE", 4, [0, 4, 8, 1, 5, 9, 2, 6, 10, 3, 7, 11]], ["CA", 2, 4, 8], ["CHR", 1, "shared", [2]], ["CA", 2, 3, 9], ["CHR", 0, "shared", [3]], ["CA", 1, 4, 9], ["FU", 6, [0, 1, 2]], ["AN", 6, 0, 5], ["FU", 6, [1, 2, 3]], ["AN", 6, 1, 4], ["FU", 6, [2, 3, 4]], ["AN", 6, 2, 6], ["FU", 3, [0, 1, 2]], ["SP", 3, 0, 400, [1], 1], ["AN", 3, 1, 2], ["FFSP", 3, 0, [2, 1, 0], 1, 1], ["AN", 3, 1, 6], ["FU", 1, [0, 1]], ["SP", 1, 0, 100, [2], 1], ["AN", 1, 1, 2], ["FFSP", 1, 0, [2, 1, 0], 1, 1], ["AN", 1, 1, 6], ["PR", 4, 0, "auto_unroll_max_step$64"]]]], "r": [[8.05045e-06, 8.0483e-06, 8.04834e-06, 8.04783e-06, 8.05069e-06, 8.04779e-06, 8.04388e-06, 8.04856e-06, 8.04761e-06, 8.0477e-06], 0, 55.6139, 1649077782], "v": "v0.6"}
{"i": [["[\"MMoE_gates\", 1, 100, 8, 2]", "cuda -keys=cuda,gpu -max_num_threads=1024 -model=unknown -thread_warp_size=32", [-1, 16, 64, 49152, 2147483647, 1024, 8, 32], "", 0, []], [[], [["SP", 2, 0, 1, [1, 1, 1, 1], 1], ["SP", 2, 5, 8, [1, 2, 1, 1], 1], ["SP", 2, 10, 2, [1, 1, 2, 1], 1], ["SP", 2, 15, 100, [5, 20], 1], ["RE", 2, [0, 5, 10, 1, 6, 11, 2, 7, 12, 15, 16, 3, 8, 13, 17, 4, 9, 14]], ["FSP", 4, 0, 0, 3], ["FSP", 4, 4, 1, 3], ["FSP", 4, 8, 2, 3], ["RE", 4, [0, 4, 8, 1, 5, 9, 2, 6, 10, 3, 7, 11]], ["CA", 2, 4, 8], ["CHR", 1, "shared", [2]], ["CA", 2, 3, 9], ["CHR", 0, "shared", [3]], ["CA", 1, 4, 9], ["FU", 6, [0, 1, 2]], ["AN", 6, 0, 5], ["FU", 6, [1, 2, 3]], ["AN", 6, 1, 4], ["FU", 6, [2, 3, 4]], ["AN", 6, 2, 6], ["FU", 3, [0, 1, 2]], ["SP", 3, 0, 100, [1], 1], ["AN", 3, 1, 2], ["FFSP", 3, 0, [2, 1, 0], 1, 1], ["AN", 3, 1, 6], ["FU", 1, [0, 1]], ["SP", 1, 0, 100, [1], 1], ["AN", 1, 1, 2], ["FFSP", 1, 0, [2, 1, 0], 1, 1], ["AN", 1, 1, 6], ["PR", 4, 0, "auto_unroll_max_step$512"]]]], "r": [[4.87316e-06, 4.8731e-06, 4.87309e-06, 4.8731e-06, 4.87324e-06, 4.87312e-06, 4.87319e-06, 4.87313e-06, 4.8731e-06, 4.87321e-06], 0, 108.261, 1649077835], "v": "v0.6"}
{"i": [["[\"MMoE_gates\", 1, 100, 8, 2]", "cuda -keys=cuda,gpu -max_num_threads=1024 -model=unknown -thread_warp_size=32", [-1, 16, 64, 49152, 2147483647, 1024, 8, 32], "", 0, []], [[], [["SP", 2, 0, 1, [1, 1, 1, 1], 1], ["SP", 2, 5, 8, [1, 4, 1, 1], 1], ["SP", 2, 10, 2, [2, 1, 1, 1], 1], ["SP", 2, 15, 100, [1, 2], 1], ["RE", 2, [0, 5, 10, 1, 6, 11, 2, 7, 12, 15, 16, 3, 8, 13, 17, 4, 9, 14]], ["FSP", 4, 0, 0, 3], ["FSP", 4, 4, 1, 3], ["FSP", 4, 8, 2, 3], ["RE", 4, [0, 4, 8, 1, 5, 9, 2, 6, 10, 3, 7, 11]], ["CA", 2, 4, 8], ["CHR", 1, "shared", [2]], ["CA", 2, 3, 9], ["CHR", 0, "shared", [3]], ["CA", 1, 4, 9], ["FU", 6, [0, 1, 2]], ["AN", 6, 0, 5], ["FU", 6, [1, 2, 3]], ["AN", 6, 1, 4], ["FU", 6, [2, 3, 4]], ["AN", 6, 2, 6], ["FU", 3, [0, 1, 2]], ["SP", 3, 0, 4, [1], 1], ["AN", 3, 1, 2], ["FFSP", 3, 0, [2, 1, 0], 1, 1], ["AN", 3, 1, 6], ["FU", 1, [0, 1]], ["SP", 1, 0, 2, [1], 1], ["AN", 1, 1, 2], ["FFSP", 1, 0, [2, 1, 0], 1, 1], ["AN", 1, 1, 6], ["PR", 4, 0, "auto_unroll_max_step$0"]]]], "r": [[9.61363e-06, 9.60348e-06, 9.60089e-06, 9.60086e-06, 9.60089e-06, 9.60088e-06, 9.60089e-06, 9.60369e-06, 9.60086e-06, 9.60081e-06], 0, 112.043, 1649077839], "v": "v0.6"}
{"i": [["[\"MMoE_gates\", 1, 100, 8, 2]", "cuda -keys=cuda,gpu -max_num_threads=1024 -model=unknown -thread_warp_size=32", [-1, 16, 64, 49152, 2147483647, 1024, 8, 32], "", 0, []], [[], [["SP", 2, 0, 1, [1, 1, 1, 1], 1], ["SP", 2, 5, 8, [2, 1, 1, 1], 1], ["SP", 2, 10, 2, [1, 1, 1, 2], 1], ["SP", 2, 15, 100, [50, 2], 1], ["RE", 2, [0, 5, 10, 1, 6, 11, 2, 7, 12, 15, 16, 3, 8, 13, 17, 4, 9, 14]], ["FSP", 4, 0, 0, 3], ["FSP", 4, 4, 1, 3], ["FSP", 4, 8, 2, 3], ["RE", 4, [0, 4, 8, 1, 5, 9, 2, 6, 10, 3, 7, 11]], ["CA", 2, 4, 8], ["CHR", 1, "shared", [2]], ["CA", 2, 3, 9], ["CHR", 0, "shared", [3]], ["CA", 1, 4, 9], ["FU", 6, [0, 1, 2]], ["AN", 6, 0, 5], ["FU", 6, [1, 2, 3]], ["AN", 6, 1, 4], ["FU", 6, [2, 3, 4]], ["AN", 6, 2, 6], ["FU", 3, [0, 1, 2]], ["SP", 3, 0, 200, [1], 1], ["AN", 3, 1, 2], ["FFSP", 3, 0, [2, 1, 0], 1, 1], ["AN", 3, 1, 6], ["FU", 1, [0, 1]], ["SP", 1, 0, 100, [1], 1], ["AN", 1, 1, 2], ["FFSP", 1, 0, [2, 1, 0], 1, 1], ["AN", 1, 1, 6], ["PR", 4, 0, "auto_unroll_max_step$512"]]]], "r": [[7.63896e-06, 7.64148e-06, 7.64115e-06, 7.64337e-06, 7.64143e-06, 7.64045e-06, 7.63922e-06, 7.64257e-06, 7.64313e-06, 7.64277e-06], 0, 122.005, 1649077848], "v": "v0.6"}
{"i": [["[\"MMoE_gates\", 1, 100, 8, 2]", "cuda -keys=cuda,gpu -max_num_threads=1024 -model=unknown -thread_warp_size=32", [-1, 16, 64, 49152, 2147483647, 1024, 8, 32], "", 0, []], [[], [["SP", 2, 0, 1, [1, 1, 1, 1], 1], ["SP", 2, 5, 8, [2, 1, 1, 2], 1], ["SP", 2, 10, 2, [1, 1, 1, 2], 1], ["SP", 2, 15, 100, [1, 20], 1], ["RE", 2, [0, 5, 10, 1, 6, 11, 2, 7, 12, 15, 16, 3, 8, 13, 17, 4, 9, 14]], ["FSP", 4, 0, 0, 3], ["FSP", 4, 4, 1, 3], ["FSP", 4, 8, 2, 3], ["RE", 4, [0, 4, 8, 1, 5, 9, 2, 6, 10, 3, 7, 11]], ["CA", 2, 4, 8], ["CHR", 1, "shared", [2]], ["CA", 2, 3, 9], ["CHR", 0, "shared", [3]], ["CA", 1, 4, 9], ["FU", 6, [0, 1, 2]], ["AN", 6, 0, 5], ["FU", 6, [1, 2, 3]], ["AN", 6, 1, 4], ["FU", 6, [2, 3, 4]], ["AN", 6, 2, 6], ["FU", 3, [0, 1, 2]], ["SP", 3, 0, 40, [1], 1], ["AN", 3, 1, 2], ["FFSP", 3, 0, [2, 1, 0], 1, 1], ["AN", 3, 1, 6], ["FU", 1, [0, 1]], ["SP", 1, 0, 20, [1], 1], ["AN", 1, 1, 2], ["FFSP", 1, 0, [2, 1, 0], 1, 1], ["AN", 1, 1, 6], ["PR", 4, 0, "auto_unroll_max_step$64"]]]], "r": [[2.07893e-05, 2.07902e-05, 2.07723e-05, 2.07712e-05, 2.07799e-05, 2.07839e-05, 2.07861e-05, 2.0783e-05, 2.07792e-05, 2.07766e-05], 0, 86.1748, 1649077813], "v": "v0.6"}
{"i": [["[\"MMoE_gates\", 1, 100, 8, 2]", "cuda -keys=cuda,gpu -max_num_threads=1024 -model=unknown -thread_warp_size=32", [-1, 16, 64, 49152, 2147483647, 1024, 8, 32], "", 0, []], [[], [["SP", 2, 0, 1, [1, 1, 1, 1], 1], ["SP", 2, 5, 8, [1, 1, 1, 8], 1], ["SP", 2, 10, 2, [1, 1, 1, 2], 1], ["SP", 2, 15, 100, [100, 1], 1], ["RE", 2, [0, 5, 10, 1, 6, 11, 2, 7, 12, 15, 16, 3, 8, 13, 17, 4, 9, 14]], ["FSP", 4, 0, 0, 3], ["FSP", 4, 4, 1, 3], ["FSP", 4, 8, 2, 3], ["RE", 4, [0, 4, 8, 1, 5, 9, 2, 6, 10, 3, 7, 11]], ["CA", 2, 4, 8], ["CHR", 1, "shared", [2]], ["CA", 2, 3, 9], ["CHR", 0, "shared", [3]], ["CA", 1, 4, 9], ["FU", 6, [0, 1, 2]], ["AN", 6, 0, 5], ["FU", 6, [1, 2, 3]], ["AN", 6, 1, 4], ["FU", 6, [2, 3, 4]], ["AN", 6, 2, 6], ["FU", 3, [0, 1, 2]], ["SP", 3, 0, 100, [1], 1], ["AN", 3, 1, 2], ["FFSP", 3, 0, [2, 1, 0], 1, 1], ["AN", 3, 1, 6], ["FU", 1, [0, 1]], ["SP", 1, 0, 25, [1], 1], ["AN", 1, 1, 2], ["FFSP", 1, 0, [2, 1, 0], 1, 1], ["AN", 1, 1, 6], ["PR", 4, 0, "auto_unroll_max_step$512"]]]], "r": [[1.92614e-05, 1.92463e-05, 1.92687e-05, 1.92792e-05, 1.92862e-05, 1.92879e-05, 1.92882e-05, 1.92924e-05, 1.92873e-05, 1.92849e-05], 0, 131.076, 1649077858], "v": "v0.6"}
{"i": [["[\"MMoE_gates\", 1, 100, 8, 2]", "cuda -keys=cuda,gpu -max_num_threads=1024 -model=unknown -thread_warp_size=32", [-1, 16, 64, 49152, 2147483647, 1024, 8, 32], "", 0, []], [[], [["SP", 2, 0, 1, [1, 1, 1, 1], 1], ["SP", 2, 5, 8, [2, 1, 1, 2], 1], ["SP", 2, 10, 2, [1, 1, 1, 1], 1], ["SP", 2, 15, 100, [1, 2], 1], ["RE", 2, [0, 5, 10, 1, 6, 11, 2, 7, 12, 15, 16, 3, 8, 13, 17, 4, 9, 14]], ["FSP", 4, 0, 0, 3], ["FSP", 4, 4, 1, 3], ["FSP", 4, 8, 2, 3], ["RE", 4, [0, 4, 8, 1, 5, 9, 2, 6, 10, 3, 7, 11]], ["CA", 2, 4, 8], ["CHR", 1, "shared", [2]], ["CA", 2, 3, 9], ["CHR", 0, "shared", [3]], ["CA", 1, 4, 9], ["FU", 6, [0, 1, 2]], ["AN", 6, 0, 5], ["FU", 6, [1, 2, 3]], ["AN", 6, 1, 4], ["FU", 6, [2, 3, 4]], ["AN", 6, 2, 6], ["FU", 3, [0, 1, 2]], ["SP", 3, 0, 20, [2], 1], ["AN", 3, 1, 2], ["FFSP", 3, 0, [2, 1, 0], 1, 1], ["AN", 3, 1, 6], ["FU", 1, [0, 1]], ["SP", 1, 0, 10, [1], 1], ["AN", 1, 1, 2], ["FFSP", 1, 0, [2, 1, 0], 1, 1], ["AN", 1, 1, 6], ["PR", 4, 0, "auto_unroll_max_step$512"]]]], "r": [[9.69343e-06, 9.71658e-06, 9.72371e-06, 9.73e-06, 9.72809e-06, 9.73264e-06, 9.73341e-06, 9.7374e-06, 9.68967e-06, 9.66588e-06], 0, 99.53, 1649077827], "v": "v0.6"}
{"i": [["[\"MMoE_gates\", 1, 100, 8, 2]", "cuda -keys=cuda,gpu -max_num_threads=1024 -model=unknown -thread_warp_size=32", [-1, 16, 64, 49152, 2147483647, 1024, 8, 32], "", 0, []], [[], [["SP", 2, 0, 1, [1, 1, 1, 1], 1], ["SP", 2, 5, 8, [2, 2, 2, 1], 1], ["SP", 2, 10, 2, [1, 1, 1, 2], 1], ["SP", 2, 15, 100, [1, 2], 1], ["RE", 2, [0, 5, 10, 1, 6, 11, 2, 7, 12, 15, 16, 3, 8, 13, 17, 4, 9, 14]], ["FSP", 4, 0, 0, 3], ["FSP", 4, 4, 1, 3], ["FSP", 4, 8, 2, 3], ["RE", 4, [0, 4, 8, 1, 5, 9, 2, 6, 10, 3, 7, 11]], ["CA", 2, 4, 8], ["CHR", 1, "shared", [2]], ["CA", 2, 3, 9], ["CHR", 0, "shared", [3]], ["CA", 1, 4, 9], ["FU", 6, [0, 1, 2]], ["AN", 6, 0, 5], ["FU", 6, [1, 2, 3]], ["AN", 6, 1, 4], ["FU", 6, [2, 3, 4]], ["AN", 6, 2, 6], ["FU", 3, [0, 1, 2]], ["SP", 3, 0, 16, [1], 1], ["AN", 3, 1, 2], ["FFSP", 3, 0, [2, 1, 0], 1, 1], ["AN", 3, 1, 6], ["FU", 1, [0, 1]], ["SP", 1, 0, 4, [4], 1], ["AN", 1, 1, 2], ["FFSP", 1, 0, [2, 1, 0], 1, 1], ["AN", 1, 1, 6], ["PR", 4, 0, "auto_unroll_max_step$64"]]]], "r": [[1.71567e-05, 1.73194e-05, 1.73631e-05, 1.73672e-05, 1.73791e-05, 1.72804e-05, 1.73229e-05, 1.73386e-05, 1.73706e-05, 1.72877e-05], 0, 116.763, 1649077844], "v": "v0.6"}
{"i": [["[\"MMoE_gates\", 1, 100, 8, 2]", "cuda -keys=cuda,gpu -max_num_threads=1024 -model=unknown -thread_warp_size=32", [-1, 16, 64, 49152, 2147483647, 1024, 8, 32], "", 0, []], [[], [["SP", 2, 0, 1, [1, 1, 1, 1], 1], ["SP", 2, 5, 8, [2, 1, 2, 1], 1], ["SP", 2, 10, 2, [1, 1, 1, 2], 1], ["SP", 2, 15, 100, [1, 5], 1], ["RE", 2, [0, 5, 10, 1, 6, 11, 2, 7, 12, 15, 16, 3, 8, 13, 17, 4, 9, 14]], ["FSP", 4, 0, 0, 3], ["FSP", 4, 4, 1, 3], ["FSP", 4, 8, 2, 3], ["RE", 4, [0, 4, 8, 1, 5, 9, 2, 6, 10, 3, 7, 11]], ["CA", 2, 4, 8], ["CHR", 1, "shared", [2]], ["CA", 2, 3, 9], ["CHR", 0, "shared", [3]], ["CA", 1, 4, 9], ["FU", 6, [0, 1, 2]], ["AN", 6, 0, 5], ["FU", 6, [1, 2, 3]], ["AN", 6, 1, 4], ["FU", 6, [2, 3, 4]], ["AN", 6, 2, 6], ["FU", 3, [0, 1, 2]], ["SP", 3, 0, 80, [1], 1], ["AN", 3, 1, 2], ["FFSP", 3, 0, [2, 1, 0], 1, 1], ["AN", 3, 1, 6], ["FU", 1, [0, 1]], ["SP", 1, 0, 10, [1], 1], ["AN", 1, 1, 2], ["FFSP", 1, 0, [2, 1, 0], 1, 1], ["AN", 1, 1, 6], ["PR", 4, 0, "auto_unroll_max_step$64"]]]], "r": [[1.91074e-05, 1.91073e-05, 1.91073e-05, 1.91075e-05, 1.91078e-05, 1.91076e-05, 1.91078e-05, 1.91076e-05, 1.91074e-05, 1.91075e-05], 0, 158.644, 1649077886], "v": "v0.6"}
{"i": [["[\"MMoE_gates\", 1, 100, 8, 2]", "cuda -keys=cuda,gpu -max_num_threads=1024 -model=unknown -thread_warp_size=32", [-1, 16, 64, 49152, 2147483647, 1024, 8, 32], "", 0, []], [[], [["SP", 2, 0, 1, [1, 1, 1, 1], 1], ["SP", 2, 5, 8, [1, 4, 1, 1], 1], ["SP", 2, 10, 2, [2, 1, 1, 1], 1], ["SP", 2, 15, 100, [20, 5], 1], ["RE", 2, [0, 5, 10, 1, 6, 11, 2, 7, 12, 15, 16, 3, 8, 13, 17, 4, 9, 14]], ["FSP", 4, 0, 0, 3], ["FSP", 4, 4, 1, 3], ["FSP", 4, 8, 2, 3], ["RE", 4, [0, 4, 8, 1, 5, 9, 2, 6, 10, 3, 7, 11]], ["CA", 2, 4, 8], ["CHR", 1, "shared", [2]], ["CA", 2, 3, 9], ["CHR", 0, "shared", [3]], ["CA", 1, 4, 9], ["FU", 6, [0, 1, 2]], ["AN", 6, 0, 5], ["FU", 6, [1, 2, 3]], ["AN", 6, 1, 4], ["FU", 6, [2, 3, 4]], ["AN", 6, 2, 6], ["FU", 3, [0, 1, 2]], ["SP", 3, 0, 100, [1], 1], ["AN", 3, 1, 2], ["FFSP", 3, 0, [2, 1, 0], 1, 1], ["AN", 3, 1, 6], ["FU", 1, [0, 1]], ["SP", 1, 0, 100, [1], 1], ["AN", 1, 1, 2], ["FFSP", 1, 0, [2, 1, 0], 1, 1], ["AN", 1, 1, 6], ["PR", 4, 0, "auto_unroll_max_step$1024"]]]], "r": [[5.00132e-06, 5.00162e-06, 5.0015e-06, 5.00143e-06, 5.00149e-06, 5.00141e-06, 5.00147e-06, 5.00144e-06, 5.00149e-06, 5.00145e-06], 0, 148.37, 1649077875], "v": "v0.6"}
{"i": [["[\"MMoE_gates\", 1, 100, 8, 2]", "cuda -keys=cuda,gpu -max_num_threads=1024 -model=unknown -thread_warp_size=32", [-1, 16, 64, 49152, 2147483647, 1024, 8, 32], "", 0, []], [[], [["SP", 2, 0, 1, [1, 1, 1, 1], 1], ["SP", 2, 5, 8, [1, 4, 1, 2], 1], ["SP", 2, 10, 2, [1, 1, 2, 1], 1], ["SP", 2, 15, 100, [1, 4], 1], ["RE", 2, [0, 5, 10, 1, 6, 11, 2, 7, 12, 15, 16, 3, 8, 13, 17, 4, 9, 14]], ["FSP", 4, 0, 0, 3], ["FSP", 4, 4, 1, 3], ["FSP", 4, 8, 2, 3], ["RE", 4, [0, 4, 8, 1, 5, 9, 2, 6, 10, 3, 7, 11]], ["CA", 2, 4, 8], ["CHR", 1, "shared", [2]], ["CA", 2, 3, 9], ["CHR", 0, "shared", [3]], ["CA", 1, 4, 9], ["FU", 6, [0, 1, 2]], ["AN", 6, 0, 5], ["FU", 6, [1, 2, 3]], ["AN", 6, 1, 4], ["FU", 6, [2, 3, 4]], ["AN", 6, 2, 6], ["FU", 3, [0, 1, 2]], ["SP", 3, 0, 16, [1], 1], ["AN", 3, 1, 2], ["FFSP", 3, 0, [2, 1, 0], 1, 1], ["AN", 3, 1, 6], ["FU", 1, [0, 1]], ["SP", 1, 0, 4, [1], 1], ["AN", 1, 1, 2], ["FFSP", 1, 0, [2, 1, 0], 1, 1], ["AN", 1, 1, 6], ["PR", 4, 0, "auto_unroll_max_step$512"]]]], "r": [[1.04285e-05, 1.04423e-05, 1.0459e-05, 1.0434e-05, 1.04336e-05, 1.04308e-05, 1.04164e-05, 1.04575e-05, 1.04122e-05, 1.04209e-05], 0, 144.025, 1649077871], "v": "v0.6"}
{"i": [["[\"MMoE_gates\", 1, 100, 8, 2]", "cuda -keys=cuda,gpu -max_num_threads=1024 -model=unknown -thread_warp_size=32", [-1, 16, 64, 49152, 2147483647, 1024, 8, 32], "", 0, []], [[], [["SP", 2, 0, 1, [1, 1, 1, 1], 1], ["SP", 2, 5, 8, [1, 1, 1, 2], 1], ["SP", 2, 10, 2, [1, 1, 1, 2], 1], ["SP", 2, 15, 100, [5, 5], 1], ["RE", 2, [0, 5, 10, 1, 6, 11, 2, 7, 12, 15, 16, 3, 8, 13, 17, 4, 9, 14]], ["FSP", 4, 0, 0, 3], ["FSP", 4, 4, 1, 3], ["FSP", 4, 8, 2, 3], ["RE", 4, [0, 4, 8, 1, 5, 9, 2, 6, 10, 3, 7, 11]], ["CA", 2, 4, 8], ["CHR", 1, "shared", [2]], ["CA", 2, 3, 9], ["CHR", 0, "shared", [3]], ["CA", 1, 4, 9], ["FU", 6, [0, 1, 2]], ["AN", 6, 0, 5], ["FU", 6, [1, 2, 3]], ["AN", 6, 1, 4], ["FU", 6, [2, 3, 4]], ["AN", 6, 2, 6], ["FU", 3, [0, 1, 2]], ["SP", 3, 0, 25, [1], 1], ["AN", 3, 1, 2], ["FFSP", 3, 0, [2, 1, 0], 1, 1], ["AN", 3, 1, 6], ["FU", 1, [0, 1]], ["SP", 1, 0, 25, [1], 1], ["AN", 1, 1, 2], ["FFSP", 1, 0, [2, 1, 0], 1, 1], ["AN", 1, 1, 6], ["PR", 4, 0, "auto_unroll_max_step$0"]]]], "r": [[1.27471e-05, 1.27489e-05, 1.27574e-05, 1.27636e-05, 1.27408e-05, 1.27388e-05, 1.27591e-05, 1.27514e-05, 1.2762e-05, 1.27444e-05], 0, 139.633, 1649077867], "v": "v0.6"}
{"i": [["[\"MMoE_gates\", 1, 100, 8, 2]", "cuda -keys=cuda,gpu -max_num_threads=1024 -model=unknown -thread_warp_size=32", [-1, 16, 64, 49152, 2147483647, 1024, 8, 32], "", 0, []], [[], [["SP", 2, 0, 1, [1, 1, 1, 1], 1], ["SP", 2, 5, 8, [1, 4, 1, 2], 1], ["SP", 2, 10, 2, [1, 2, 1, 1], 1], ["SP", 2, 15, 100, [1, 50], 1], ["RE", 2, [0, 5, 10, 1, 6, 11, 2, 7, 12, 15, 16, 3, 8, 13, 17, 4, 9, 14]], ["FSP", 4, 0, 0, 3], ["FSP", 4, 4, 1, 3], ["FSP", 4, 8, 2, 3], ["RE", 4, [0, 4, 8, 1, 5, 9, 2, 6, 10, 3, 7, 11]], ["CA", 2, 4, 8], ["CHR", 1, "shared", [2]], ["CA", 2, 3, 9], ["CHR", 0, "shared", [3]], ["CA", 1, 4, 9], ["FU", 6, [0, 1, 2]], ["AN", 6, 0, 5], ["FU", 6, [1, 2, 3]], ["AN", 6, 1, 4], ["FU", 6, [2, 3, 4]], ["AN", 6, 2, 6], ["FU", 3, [0, 1, 2]], ["SP", 3, 0, 100, [1], 1], ["AN", 3, 1, 2], ["FFSP", 3, 0, [2, 1, 0], 1, 1], ["AN", 3, 1, 6], ["FU", 1, [0, 1]], ["SP", 1, 0, 50, [1], 1], ["AN", 1, 1, 2], ["FFSP", 1, 0, [2, 1, 0], 1, 1], ["AN", 1, 1, 6], ["PR", 4, 0, "auto_unroll_max_step$1024"]]]], "r": [[4.68009e-06, 4.69101e-06, 4.67847e-06, 4.66923e-06, 4.67707e-06, 4.69106e-06, 4.68425e-06, 4.67718e-06, 4.69684e-06, 4.71214e-06], 0, 154.157, 1649077881], "v": "v0.6"}
{"i": [["[\"MMoE_gates\", 1, 100, 8, 2]", "cuda -keys=cuda,gpu -max_num_threads=1024 -model=unknown -thread_warp_size=32", [-1, 16, 64, 49152, 2147483647, 1024, 8, 32], "", 0, []], [[], [["SP", 2, 0, 1, [1, 1, 1, 1], 1], ["SP", 2, 5, 8, [4, 1, 2, 1], 1], ["SP", 2, 10, 2, [1, 2, 1, 1], 1], ["SP", 2, 15, 100, [4, 1], 1], ["RE", 2, [0, 5, 10, 1, 6, 11, 2, 7, 12, 15, 16, 3, 8, 13, 17, 4, 9, 14]], ["FSP", 4, 0, 0, 3], ["FSP", 4, 4, 1, 3], ["FSP", 4, 8, 2, 3], ["RE", 4, [0, 4, 8, 1, 5, 9, 2, 6, 10, 3, 7, 11]], ["CA", 2, 4, 8], ["CHR", 1, "shared", [2]], ["CA", 2, 3, 9], ["CHR", 0, "shared", [3]], ["CA", 1, 4, 9], ["FU", 6, [0, 1, 2]], ["AN", 6, 0, 5], ["FU", 6, [1, 2, 3]], ["AN", 6, 1, 4], ["FU", 6, [2, 3, 4]], ["AN", 6, 2, 6], ["FU", 3, [0, 1, 2]], ["SP", 3, 0, 8, [1], 1], ["AN", 3, 1, 2], ["FFSP", 3, 0, [2, 1, 0], 1, 1], ["AN", 3, 1, 6], ["FU", 1, [0, 1]], ["SP", 1, 0, 4, [1], 1], ["AN", 1, 1, 2], ["FFSP", 1, 0, [2, 1, 0], 1, 1], ["AN", 1, 1, 6], ["PR", 4, 0, "auto_unroll_max_step$1024"]]]], "r": [[1.46278e-05, 1.46343e-05, 1.46384e-05, 1.46328e-05, 1.46317e-05, 1.46326e-05, 1.46342e-05, 1.46304e-05, 1.46317e-05, 1.46301e-05], 0, 125.718, 1649077853], "v": "v0.6"}
{"i": [["[\"MMoE_gates\", 1, 100, 8, 2]", "cuda -keys=cuda,gpu -max_num_threads=1024 -model=unknown -thread_warp_size=32", [-1, 16, 64, 49152, 2147483647, 1024, 8, 32], "", 0, []], [[], [["SP", 2, 0, 1, [1, 1, 1, 1], 1], ["SP", 2, 5, 8, [1, 4, 2, 1], 1], ["SP", 2, 10, 2, [1, 1, 1, 1], 1], ["SP", 2, 15, 100, [2, 2], 1], ["RE", 2, [0, 5, 10, 1, 6, 11, 2, 7, 12, 15, 16, 3, 8, 13, 17, 4, 9, 14]], ["FSP", 4, 0, 0, 3], ["FSP", 4, 4, 1, 3], ["FSP", 4, 8, 2, 3], ["RE", 4, [0, 4, 8, 1, 5, 9, 2, 6, 10, 3, 7, 11]], ["CA", 2, 4, 8], ["CHR", 1, "shared", [2]], ["CA", 2, 3, 9], ["CHR", 0, "shared", [3]], ["CA", 1, 4, 9], ["FU", 6, [0, 1, 2]], ["AN", 6, 0, 5], ["FU", 6, [1, 2, 3]], ["AN", 6, 1, 4], ["FU", 6, [2, 3, 4]], ["AN", 6, 2, 6], ["FU", 3, [0, 1, 2]], ["SP", 3, 0, 16, [1], 1], ["AN", 3, 1, 2], ["FFSP", 3, 0, [2, 1, 0], 1, 1], ["AN", 3, 1, 6], ["FU", 1, [0, 1]], ["SP", 1, 0, 4, [4], 1], ["AN", 1, 1, 2], ["FFSP", 1, 0, [2, 1, 0], 1, 1], ["AN", 1, 1, 6], ["PR", 4, 0, "auto_unroll_max_step$1024"]]]], "r": [[5.34007e-06, 5.34009e-06, 5.34003e-06, 5.34006e-06, 5.34015e-06, 5.3402e-06, 5.34021e-06, 5.34007e-06, 5.33996e-06, 5.34001e-06], 0, 135.291, 1649077862], "v": "v0.6"}
