python/models/mmoe/kernel_configs/MMoE_hfuse_softmax_reduce_1_100_16_8_2
{"i": [["[\"hfuse_softmax_reduce\", 1, 100, 16, 8, 2]", "cuda -keys=cuda,gpu -max_num_threads=1024 -model=unknown -thread_warp_size=32", [-1, 16, 64, 49152, 2147483647, 1024, 8, 32], "", 0, []], [[], [["FU", 1, [0, 1]], ["AN", 1, 0, 6], ["PR", 1, 0, "auto_unroll_max_step$16"]]]], "r": [[2.34344e-06, 2.31562e-06, 2.32212e-06], 0, 1.12141, 1668099364], "v": "v0.6"}
{"i": [["[\"hfuse_softmax_reduce\", 1, 100, 16, 8, 2]", "cuda -keys=cuda,gpu -max_num_threads=1024 -model=unknown -thread_warp_size=32", [-1, 16, 64, 49152, 2147483647, 1024, 8, 32], "", 0, []], [[], [["FU", 1, [0, 1]], ["AN", 1, 0, 6], ["PR", 1, 0, "auto_unroll_max_step$512"]]]], "r": [[2.30924e-06, 2.28048e-06, 2.27105e-06], 0, 0.519459, 1668099364], "v": "v0.6"}
{"i": [["[\"hfuse_softmax_reduce\", 1, 100, 16, 8, 2]", "cuda -keys=cuda,gpu -max_num_threads=1024 -model=unknown -thread_warp_size=32", [-1, 16, 64, 49152, 2147483647, 1024, 8, 32], "", 0, []], [[], [["FU", 1, [0, 1]], ["AN", 1, 0, 6], ["PR", 1, 0, "auto_unroll_max_step$0"]]]], "r": [[2.42151e-06, 2.43256e-06, 2.43479e-06], 0, 0.82311, 1668099364], "v": "v0.6"}
{"i": [["[\"hfuse_softmax_reduce\", 1, 100, 16, 8, 2]", "cuda -keys=cuda,gpu -max_num_threads=1024 -model=unknown -thread_warp_size=32", [-1, 16, 64, 49152, 2147483647, 1024, 8, 32], "", 0, []], [[], [["FU", 1, [0, 1]], ["AN", 1, 0, 6], ["PR", 1, 0, "auto_unroll_max_step$64"]]]], "r": [[2.35882e-06, 2.37958e-06, 2.37981e-06], 0, 1.47044, 1668099365], "v": "v0.6"}
{"i": [["[\"hfuse_softmax_reduce\", 1, 100, 16, 8, 2]", "cuda -keys=cuda,gpu -max_num_threads=1024 -model=unknown -thread_warp_size=32", [-1, 16, 64, 49152, 2147483647, 1024, 8, 32], "", 0, []], [[], [["FU", 1, [0, 1]], ["AN", 1, 0, 6], ["PR", 1, 0, "auto_unroll_max_step$1024"]]]], "r": [[2.35133e-06, 2.37051e-06, 2.37026e-06], 0, 1.78017, 1668099365], "v": "v0.6"}
{"i": [["[\"hfuse_softmax_reduce\", 1, 100, 16, 8, 2]", "cuda -keys=cuda,gpu -max_num_threads=1024 -model=unknown -thread_warp_size=32", [-1, 16, 64, 49152, 2147483647, 1024, 8, 32], "", 0, []], [[], [["FU", 1, [0, 1]], ["AN", 1, 0, 6], ["PR", 1, 0, "auto_unroll_max_step$16"]]]], "r": [[2.41598e-06, 2.38388e-06, 2.38073e-06], 0, 0.819925, 1668099849], "v": "v0.6"}
{"i": [["[\"hfuse_softmax_reduce\", 1, 100, 16, 8, 2]", "cuda -keys=cuda,gpu -max_num_threads=1024 -model=unknown -thread_warp_size=32", [-1, 16, 64, 49152, 2147483647, 1024, 8, 32], "", 0, []], [[], [["FU", 1, [0, 1]], ["AN", 1, 0, 6], ["PR", 1, 0, "auto_unroll_max_step$0"]]]], "r": [[2.39361e-06, 2.36703e-06, 2.36555e-06], 0, 0.497758, 1668099848], "v": "v0.6"}
{"i": [["[\"hfuse_softmax_reduce\", 1, 100, 16, 8, 2]", "cuda -keys=cuda,gpu -max_num_threads=1024 -model=unknown -thread_warp_size=32", [-1, 16, 64, 49152, 2147483647, 1024, 8, 32], "", 0, []], [[], [["FU", 1, [0, 1]], ["AN", 1, 0, 6], ["PR", 1, 0, "auto_unroll_max_step$512"]]]], "r": [[2.35622e-06, 2.33954e-06, 2.34867e-06], 0, 1.45658, 1668099849], "v": "v0.6"}
{"i": [["[\"hfuse_softmax_reduce\", 1, 100, 16, 8, 2]", "cuda -keys=cuda,gpu -max_num_threads=1024 -model=unknown -thread_warp_size=32", [-1, 16, 64, 49152, 2147483647, 1024, 8, 32], "", 0, []], [[], [["FU", 1, [0, 1]], ["AN", 1, 0, 6], ["PR", 1, 0, "auto_unroll_max_step$1024"]]]], "r": [[2.34583e-06, 2.33602e-06, 2.33075e-06], 0, 1.76504, 1668099850], "v": "v0.6"}
{"i": [["[\"hfuse_softmax_reduce\", 1, 100, 16, 8, 2]", "cuda -keys=cuda,gpu -max_num_threads=1024 -model=unknown -thread_warp_size=32", [-1, 16, 64, 49152, 2147483647, 1024, 8, 32], "", 0, []], [[], [["FU", 1, [0, 1]], ["AN", 1, 0, 6], ["PR", 1, 0, "auto_unroll_max_step$64"]]]], "r": [[2.37266e-06, 2.34932e-06, 2.35665e-06], 0, 1.10151, 1668099849], "v": "v0.6"}
