python/models/mmoe/kernel_configs/MMoE_hfuse_gate_dot_1_100_16_8_2
{"i": [["[\"hfuse_gate_dot\", 1, 100, 16, 8, 2]", "cuda -keys=cuda,gpu -max_num_threads=1024 -model=unknown -thread_warp_size=32", [-1, 16, 64, 49152, 2147483647, 1024, 8, 32], "", 0, []], [[], [["SP", 2, 0, 1, [1, 1, 1, 1], 1], ["SP", 2, 5, 8, [1, 1, 2, 4], 1], ["SP", 2, 10, 2, [2, 1, 1, 1], 1], ["SP", 2, 15, 100, [4, 1], 1], ["RE", 2, [0, 5, 10, 1, 6, 11, 2, 7, 12, 15, 16, 3, 8, 13, 17, 4, 9, 14]], ["FSP", 4, 0, 0, 3], ["FSP", 4, 4, 1, 3], ["FSP", 4, 8, 2, 3], ["RE", 4, [0, 4, 8, 1, 5, 9, 2, 6, 10, 3, 7, 11]], ["CA", 2, 4, 8], ["CHR", 1, "shared", [2]], ["CA", 2, 3, 9], ["CHR", 0, "shared", [3]], ["CA", 1, 4, 9], ["FU", 6, [0, 1, 2]], ["AN", 6, 0, 5], ["FU", 6, [1, 2, 3]], ["AN", 6, 1, 4], ["FU", 6, [2, 3, 4]], ["AN", 6, 2, 6], ["FU", 3, [0, 1, 2]], ["SP", 3, 0, 32, [1], 1], ["AN", 3, 1, 2], ["FFSP", 3, 0, [2, 1, 0], 1, 1], ["AN", 3, 1, 6], ["FU", 1, [0, 1]], ["SP", 1, 0, 4, [1], 1], ["AN", 1, 1, 2], ["FFSP", 1, 0, [2, 1, 0], 1, 1], ["AN", 1, 1, 6], ["PR", 4, 0, "auto_unroll_max_step$16"]]]], "r": [[2.23189e-05, 2.23263e-05, 2.23203e-05], 0, 0.974203, 1668099348], "v": "v0.6"}
{"i": [["[\"hfuse_gate_dot\", 1, 100, 16, 8, 2]", "cuda -keys=cuda,gpu -max_num_threads=1024 -model=unknown -thread_warp_size=32", [-1, 16, 64, 49152, 2147483647, 1024, 8, 32], "", 0, []], [[], [["SP", 2, 0, 1, [1, 1, 1, 1], 1], ["SP", 2, 5, 8, [1, 1, 4, 1], 1], ["SP", 2, 10, 2, [1, 1, 1, 1], 1], ["SP", 2, 15, 100, [4, 5], 1], ["RE", 2, [0, 5, 10, 1, 6, 11, 2, 7, 12, 15, 16, 3, 8, 13, 17, 4, 9, 14]], ["FSP", 4, 0, 0, 3], ["FSP", 4, 4, 1, 3], ["FSP", 4, 8, 2, 3], ["RE", 4, [0, 4, 8, 1, 5, 9, 2, 6, 10, 3, 7, 11]], ["CA", 2, 4, 8], ["CHR", 1, "shared", [2]], ["CA", 2, 3, 9], ["CHR", 0, "shared", [3]], ["CA", 1, 4, 9], ["FU", 6, [0, 1, 2]], ["AN", 6, 0, 5], ["FU", 6, [1, 2, 3]], ["AN", 6, 1, 4], ["FU", 6, [2, 3, 4]], ["AN", 6, 2, 6], ["FU", 3, [0, 1, 2]], ["SP", 3, 0, 160, [1], 1], ["AN", 3, 1, 2], ["FFSP", 3, 0, [2, 1, 0], 1, 1], ["AN", 3, 1, 6], ["FU", 1, [0, 1]], ["SP", 1, 0, 20, [1], 1], ["AN", 1, 1, 2], ["FFSP", 1, 0, [2, 1, 0], 1, 1], ["AN", 1, 1, 6], ["PR", 4, 0, "auto_unroll_max_step$16"]]]], "r": [[1.37324e-05, 1.37272e-05, 1.37251e-05], 0, 2.14411, 1668099349], "v": "v0.6"}
{"i": [["[\"hfuse_gate_dot\", 1, 100, 16, 8, 2]", "cuda -keys=cuda,gpu -max_num_threads=1024 -model=unknown -thread_warp_size=32", [-1, 16, 64, 49152, 2147483647, 1024, 8, 32], "", 0, []], [[], [["SP", 2, 0, 1, [1, 1, 1, 1], 1], ["SP", 2, 5, 8, [1, 2, 2, 2], 1], ["SP", 2, 10, 2, [1, 2, 1, 1], 1], ["SP", 2, 15, 100, [4, 25], 1], ["RE", 2, [0, 5, 10, 1, 6, 11, 2, 7, 12, 15, 16, 3, 8, 13, 17, 4, 9, 14]], ["FSP", 4, 0, 0, 3], ["FSP", 4, 4, 1, 3], ["FSP", 4, 8, 2, 3], ["RE", 4, [0, 4, 8, 1, 5, 9, 2, 6, 10, 3, 7, 11]], ["CA", 2, 4, 8], ["CHR", 1, "shared", [2]], ["CA", 2, 3, 9], ["CHR", 0, "shared", [3]], ["CA", 1, 4, 9], ["FU", 6, [0, 1, 2]], ["AN", 6, 0, 5], ["FU", 6, [1, 2, 3]], ["AN", 6, 1, 4], ["FU", 6, [2, 3, 4]], ["AN", 6, 2, 6], ["FU", 3, [0, 1, 2]], ["SP", 3, 0, 200, [1], 1], ["AN", 3, 1, 2], ["FFSP", 3, 0, [2, 1, 0], 1, 1], ["AN", 3, 1, 6], ["FU", 1, [0, 1]], ["SP", 1, 0, 100, [1], 1], ["AN", 1, 1, 2], ["FFSP", 1, 0, [2, 1, 0], 1, 1], ["AN", 1, 1, 6], ["PR", 4, 0, "auto_unroll_max_step$1024"]]]], "r": [[6.33109e-06, 6.32765e-06, 6.33457e-06], 0, 4.31221, 1668099350], "v": "v0.6"}
{"i": [["[\"hfuse_gate_dot\", 1, 100, 16, 8, 2]", "cuda -keys=cuda,gpu -max_num_threads=1024 -model=unknown -thread_warp_size=32", [-1, 16, 64, 49152, 2147483647, 1024, 8, 32], "", 0, []], [[], [["SP", 2, 0, 1, [1, 1, 1, 1], 1], ["SP", 2, 5, 8, [1, 1, 4, 1], 1], ["SP", 2, 10, 2, [1, 2, 1, 1], 1], ["SP", 2, 15, 100, [1, 25], 1], ["RE", 2, [0, 5, 10, 1, 6, 11, 2, 7, 12, 15, 16, 3, 8, 13, 17, 4, 9, 14]], ["FSP", 4, 0, 0, 3], ["FSP", 4, 4, 1, 3], ["FSP", 4, 8, 2, 3], ["RE", 4, [0, 4, 8, 1, 5, 9, 2, 6, 10, 3, 7, 11]], ["CA", 2, 4, 8], ["CHR", 1, "shared", [2]], ["CA", 2, 3, 9], ["CHR", 0, "shared", [3]], ["CA", 1, 4, 9], ["FU", 6, [0, 1, 2]], ["AN", 6, 0, 5], ["FU", 6, [1, 2, 3]], ["AN", 6, 1, 4], ["FU", 6, [2, 3, 4]], ["AN", 6, 2, 6], ["FU", 3, [0, 1, 2]], ["SP", 3, 0, 200, [1], 1], ["AN", 3, 1, 2], ["FFSP", 3, 0, [2, 1, 0], 1, 1], ["AN", 3, 1, 6], ["FU", 1, [0, 1]], ["SP", 1, 0, 25, [5], 1], ["AN", 1, 1, 2], ["FFSP", 1, 0, [2, 1, 0], 1, 1], ["AN", 1, 1, 6], ["PR", 4, 0, "auto_unroll_max_step$0"]]]], "r": [[8.31312e-06, 8.31314e-06, 8.29766e-06], 0, 1.77952, 1668099349], "v": "v0.6"}
{"i": [["[\"hfuse_gate_dot\", 1, 100, 16, 8, 2]", "cuda -keys=cuda,gpu -max_num_threads=1024 -model=unknown -thread_warp_size=32", [-1, 16, 64, 49152, 2147483647, 1024, 8, 32], "", 0, []], [[], [["SP", 2, 0, 1, [1, 1, 1, 1], 1], ["SP", 2, 5, 8, [4, 1, 1, 1], 1], ["SP", 2, 10, 2, [2, 1, 1, 1], 1], ["SP", 2, 15, 100, [2, 1], 1], ["RE", 2, [0, 5, 10, 1, 6, 11, 2, 7, 12, 15, 16, 3, 8, 13, 17, 4, 9, 14]], ["FSP", 4, 0, 0, 3], ["FSP", 4, 4, 1, 3], ["FSP", 4, 8, 2, 3], ["RE", 4, [0, 4, 8, 1, 5, 9, 2, 6, 10, 3, 7, 11]], ["CA", 2, 4, 8], ["CHR", 1, "shared", [2]], ["CA", 2, 3, 9], ["CHR", 0, "shared", [3]], ["CA", 1, 4, 9], ["FU", 6, [0, 1, 2]], ["AN", 6, 0, 5], ["FU", 6, [1, 2, 3]], ["AN", 6, 1, 4], ["FU", 6, [2, 3, 4]], ["AN", 6, 2, 6], ["FU", 3, [0, 1, 2]], ["SP", 3, 0, 200, [1], 1], ["AN", 3, 1, 2], ["FFSP", 3, 0, [2, 1, 0], 1, 1], ["AN", 3, 1, 6], ["FU", 1, [0, 1]], ["SP", 1, 0, 100, [1], 1], ["AN", 1, 1, 2], ["FFSP", 1, 0, [2, 1, 0], 1, 1], ["AN", 1, 1, 6], ["PR", 4, 0, "auto_unroll_max_step$512"]]]], "r": [[1.54199e-05, 1.54769e-05, 1.54662e-05], 0, 0.603601, 1668099348], "v": "v0.6"}
{"i": [["[\"hfuse_gate_dot\", 1, 100, 16, 8, 2]", "cuda -keys=cuda,gpu -max_num_threads=1024 -model=unknown -thread_warp_size=32", [-1, 16, 64, 49152, 2147483647, 1024, 8, 32], "", 0, []], [[], [["SP", 2, 0, 1, [1, 1, 1, 1], 1], ["SP", 2, 5, 8, [1, 1, 2, 2], 1], ["SP", 2, 10, 2, [1, 1, 1, 1], 1], ["SP", 2, 15, 100, [1, 1], 1], ["RE", 2, [0, 5, 10, 1, 6, 11, 2, 7, 12, 15, 16, 3, 8, 13, 17, 4, 9, 14]], ["FSP", 4, 0, 0, 3], ["FSP", 4, 4, 1, 3], ["FSP", 4, 8, 2, 3], ["RE", 4, [0, 4, 8, 1, 5, 9, 2, 6, 10, 3, 7, 11]], ["CA", 2, 4, 8], ["CHR", 1, "shared", [2]], ["CA", 2, 3, 9], ["CHR", 0, "shared", [3]], ["CA", 1, 4, 9], ["FU", 6, [0, 1, 2]], ["AN", 6, 0, 5], ["FU", 6, [1, 2, 3]], ["AN", 6, 1, 4], ["FU", 6, [2, 3, 4]], ["AN", 6, 2, 6], ["FU", 3, [0, 1, 2]], ["SP", 3, 0, 8, [4], 1], ["AN", 3, 1, 2], ["FFSP", 3, 0, [2, 1, 0], 1, 1], ["AN", 3, 1, 6], ["FU", 1, [0, 1]], ["SP", 1, 0, 1, [1], 1], ["AN", 1, 1, 2], ["FFSP", 1, 0, [2, 1, 0], 1, 1], ["AN", 1, 1, 6], ["PR", 4, 0, "auto_unroll_max_step$512"]]]], "r": [[1.80587e-05, 1.80596e-05, 1.80581e-05], 0, 1.37946, 1668099348], "v": "v0.6"}
{"i": [["[\"hfuse_gate_dot\", 1, 100, 16, 8, 2]", "cuda -keys=cuda,gpu -max_num_threads=1024 -model=unknown -thread_warp_size=32", [-1, 16, 64, 49152, 2147483647, 1024, 8, 32], "", 0, []], [[], [["SP", 2, 0, 1, [1, 1, 1, 1], 1], ["SP", 2, 5, 8, [1, 1, 2, 1], 1], ["SP", 2, 10, 2, [1, 2, 1, 1], 1], ["SP", 2, 15, 100, [10, 10], 1], ["RE", 2, [0, 5, 10, 1, 6, 11, 2, 7, 12, 15, 16, 3, 8, 13, 17, 4, 9, 14]], ["FSP", 4, 0, 0, 3], ["FSP", 4, 4, 1, 3], ["FSP", 4, 8, 2, 3], ["RE", 4, [0, 4, 8, 1, 5, 9, 2, 6, 10, 3, 7, 11]], ["CA", 2, 4, 8], ["CHR", 1, "shared", [2]], ["CA", 2, 3, 9], ["CHR", 0, "shared", [3]], ["CA", 1, 4, 9], ["FU", 6, [0, 1, 2]], ["AN", 6, 0, 5], ["FU", 6, [1, 2, 3]], ["AN", 6, 1, 4], ["FU", 6, [2, 3, 4]], ["AN", 6, 2, 6], ["FU", 3, [0, 1, 2]], ["SP", 3, 0, 200, [2], 1], ["AN", 3, 1, 2], ["FFSP", 3, 0, [2, 1, 0], 1, 1], ["AN", 3, 1, 6], ["FU", 1, [0, 1]], ["SP", 1, 0, 100, [1], 1], ["AN", 1, 1, 2], ["FFSP", 1, 0, [2, 1, 0], 1, 1], ["AN", 1, 1, 6], ["PR", 4, 0, "auto_unroll_max_step$0"]]]], "r": [[5.32621e-06, 5.32171e-06, 5.3227e-06], 0, 2.53268, 1668099349], "v": "v0.6"}
{"i": [["[\"hfuse_gate_dot\", 1, 100, 16, 8, 2]", "cuda -keys=cuda,gpu -max_num_threads=1024 -model=unknown -thread_warp_size=32", [-1, 16, 64, 49152, 2147483647, 1024, 8, 32], "", 0, []], [[], [["SP", 2, 0, 1, [1, 1, 1, 1], 1], ["SP", 2, 5, 8, [2, 4, 1, 1], 1], ["SP", 2, 10, 2, [1, 1, 2, 1], 1], ["SP", 2, 15, 100, [5, 20], 1], ["RE", 2, [0, 5, 10, 1, 6, 11, 2, 7, 12, 15, 16, 3, 8, 13, 17, 4, 9, 14]], ["FSP", 4, 0, 0, 3], ["FSP", 4, 4, 1, 3], ["FSP", 4, 8, 2, 3], ["RE", 4, [0, 4, 8, 1, 5, 9, 2, 6, 10, 3, 7, 11]], ["CA", 2, 4, 8], ["CHR", 1, "shared", [2]], ["CA", 2, 3, 9], ["CHR", 0, "shared", [3]], ["CA", 1, 4, 9], ["FU", 6, [0, 1, 2]], ["AN", 6, 0, 5], ["FU", 6, [1, 2, 3]], ["AN", 6, 1, 4], ["FU", 6, [2, 3, 4]], ["AN", 6, 2, 6], ["FU", 3, [0, 1, 2]], ["SP", 3, 0, 100, [1], 1], ["AN", 3, 1, 2], ["FFSP", 3, 0, [2, 1, 0], 1, 1], ["AN", 3, 1, 6], ["FU", 1, [0, 1]], ["SP", 1, 0, 100, [1], 1], ["AN", 1, 1, 2], ["FFSP", 1, 0, [2, 1, 0], 1, 1], ["AN", 1, 1, 6], ["PR", 4, 0, "auto_unroll_max_step$64"]]]], "r": [[6.96876e-06, 6.96717e-06, 6.9687e-06], 0, 3.80828, 1668099351], "v": "v0.6"}
{"i": [["[\"hfuse_gate_dot\", 1, 100, 16, 8, 2]", "cuda -keys=cuda,gpu -max_num_threads=1024 -model=unknown -thread_warp_size=32", [-1, 16, 64, 49152, 2147483647, 1024, 8, 32], "", 0, []], [[], [["SP", 2, 0, 1, [1, 1, 1, 1], 1], ["SP", 2, 5, 8, [2, 1, 1, 2], 1], ["SP", 2, 10, 2, [1, 1, 1, 1], 1], ["SP", 2, 15, 100, [10, 1], 1], ["RE", 2, [0, 5, 10, 1, 6, 11, 2, 7, 12, 15, 16, 3, 8, 13, 17, 4, 9, 14]], ["FSP", 4, 0, 0, 3], ["FSP", 4, 4, 1, 3], ["FSP", 4, 8, 2, 3], ["RE", 4, [0, 4, 8, 1, 5, 9, 2, 6, 10, 3, 7, 11]], ["CA", 2, 4, 8], ["CHR", 1, "shared", [2]], ["CA", 2, 3, 9], ["CHR", 0, "shared", [3]], ["CA", 1, 4, 9], ["FU", 6, [0, 1, 2]], ["AN", 6, 0, 5], ["FU", 6, [1, 2, 3]], ["AN", 6, 1, 4], ["FU", 6, [2, 3, 4]], ["AN", 6, 2, 6], ["FU", 3, [0, 1, 2]], ["SP", 3, 0, 20, [2], 1], ["AN", 3, 1, 2], ["FFSP", 3, 0, [2, 1, 0], 1, 1], ["AN", 3, 1, 6], ["FU", 1, [0, 1]], ["SP", 1, 0, 10, [1], 1], ["AN", 1, 1, 2], ["FFSP", 1, 0, [2, 1, 0], 1, 1], ["AN", 1, 1, 6], ["PR", 4, 0, "auto_unroll_max_step$0"]]]], "r": [[1.35927e-05, 1.35828e-05, 1.35822e-05], 0, 2.92087, 1668099350], "v": "v0.6"}
{"i": [["[\"hfuse_gate_dot\", 1, 100, 16, 8, 2]", "cuda -keys=cuda,gpu -max_num_threads=1024 -model=unknown -thread_warp_size=32", [-1, 16, 64, 49152, 2147483647, 1024, 8, 32], "", 0, []], [[], [["SP", 2, 0, 1, [1, 1, 1, 1], 1], ["SP", 2, 5, 8, [2, 1, 1, 4], 1], ["SP", 2, 10, 2, [2, 1, 1, 1], 1], ["SP", 2, 15, 100, [4, 25], 1], ["RE", 2, [0, 5, 10, 1, 6, 11, 2, 7, 12, 15, 16, 3, 8, 13, 17, 4, 9, 14]], ["FSP", 4, 0, 0, 3], ["FSP", 4, 4, 1, 3], ["FSP", 4, 8, 2, 3], ["RE", 4, [0, 4, 8, 1, 5, 9, 2, 6, 10, 3, 7, 11]], ["CA", 2, 4, 8], ["CHR", 1, "shared", [2]], ["CA", 2, 3, 9], ["CHR", 0, "shared", [3]], ["CA", 1, 4, 9], ["FU", 6, [0, 1, 2]], ["AN", 6, 0, 5], ["FU", 6, [1, 2, 3]], ["AN", 6, 1, 4], ["FU", 6, [2, 3, 4]], ["AN", 6, 2, 6], ["FU", 3, [0, 1, 2]], ["SP", 3, 0, 400, [1], 1], ["AN", 3, 1, 2], ["FFSP", 3, 0, [2, 1, 0], 1, 1], ["AN", 3, 1, 6], ["FU", 1, [0, 1]], ["SP", 1, 0, 100, [1], 1], ["AN", 1, 1, 2], ["FFSP", 1, 0, [2, 1, 0], 1, 1], ["AN", 1, 1, 6], ["PR", 4, 0, "auto_unroll_max_step$16"]]]], "r": [[1.89471e-05, 1.89442e-05, 1.89432e-05], 0, 5.41379, 1668099352], "v": "v0.6"}
{"i": [["[\"hfuse_gate_dot\", 1, 100, 16, 8, 2]", "cuda -keys=cuda,gpu -max_num_threads=1024 -model=unknown -thread_warp_size=32", [-1, 16, 64, 49152, 2147483647, 1024, 8, 32], "", 0, []], [[], [["SP", 2, 0, 1, [1, 1, 1, 1], 1], ["SP", 2, 5, 8, [1, 1, 1, 4], 1], ["SP", 2, 10, 2, [1, 1, 1, 2], 1], ["SP", 2, 15, 100, [2, 50], 1], ["RE", 2, [0, 5, 10, 1, 6, 11, 2, 7, 12, 15, 16, 3, 8, 13, 17, 4, 9, 14]], ["FSP", 4, 0, 0, 3], ["FSP", 4, 4, 1, 3], ["FSP", 4, 8, 2, 3], ["RE", 4, [0, 4, 8, 1, 5, 9, 2, 6, 10, 3, 7, 11]], ["CA", 2, 4, 8], ["CHR", 1, "shared", [2]], ["CA", 2, 3, 9], ["CHR", 0, "shared", [3]], ["CA", 1, 4, 9], ["FU", 6, [0, 1, 2]], ["AN", 6, 0, 5], ["FU", 6, [1, 2, 3]], ["AN", 6, 1, 4], ["FU", 6, [2, 3, 4]], ["AN", 6, 2, 6], ["FU", 3, [0, 1, 2]], ["SP", 3, 0, 800, [1], 1], ["AN", 3, 1, 2], ["FFSP", 3, 0, [2, 1, 0], 1, 1], ["AN", 3, 1, 6], ["FU", 1, [0, 1]], ["SP", 1, 0, 100, [1], 1], ["AN", 1, 1, 2], ["FFSP", 1, 0, [2, 1, 0], 1, 1], ["AN", 1, 1, 6], ["PR", 4, 0, "auto_unroll_max_step$64"]]]], "r": [[1.21622e-05, 1.21671e-05, 1.21692e-05], 0, 5.9544, 1668099353], "v": "v0.6"}
{"i": [["[\"hfuse_gate_dot\", 1, 100, 16, 8, 2]", "cuda -keys=cuda,gpu -max_num_threads=1024 -model=unknown -thread_warp_size=32", [-1, 16, 64, 49152, 2147483647, 1024, 8, 32], "", 0, []], [[], [["SP", 2, 0, 1, [1, 1, 1, 1], 1], ["SP", 2, 5, 8, [2, 1, 4, 1], 1], ["SP", 2, 10, 2, [1, 2, 1, 1], 1], ["SP", 2, 15, 100, [1, 4], 1], ["RE", 2, [0, 5, 10, 1, 6, 11, 2, 7, 12, 15, 16, 3, 8, 13, 17, 4, 9, 14]], ["FSP", 4, 0, 0, 3], ["FSP", 4, 4, 1, 3], ["FSP", 4, 8, 2, 3], ["RE", 4, [0, 4, 8, 1, 5, 9, 2, 6, 10, 3, 7, 11]], ["CA", 2, 4, 8], ["CHR", 1, "shared", [2]], ["CA", 2, 3, 9], ["CHR", 0, "shared", [3]], ["CA", 1, 4, 9], ["FU", 6, [0, 1, 2]], ["AN", 6, 0, 5], ["FU", 6, [1, 2, 3]], ["AN", 6, 1, 4], ["FU", 6, [2, 3, 4]], ["AN", 6, 2, 6], ["FU", 3, [0, 1, 2]], ["SP", 3, 0, 8, [1], 1], ["AN", 3, 1, 2], ["FFSP", 3, 0, [2, 1, 0], 1, 1], ["AN", 3, 1, 6], ["FU", 1, [0, 1]], ["SP", 1, 0, 4, [4], 1], ["AN", 1, 1, 2], ["FFSP", 1, 0, [2, 1, 0], 1, 1], ["AN", 1, 1, 6], ["PR", 4, 0, "auto_unroll_max_step$0"]]]], "r": [[1.44348e-05, 1.44303e-05, 1.44296e-05], 0, 4.05905, 1668099351], "v": "v0.6"}
{"i": [["[\"hfuse_gate_dot\", 1, 100, 16, 8, 2]", "cuda -keys=cuda,gpu -max_num_threads=1024 -model=unknown -thread_warp_size=32", [-1, 16, 64, 49152, 2147483647, 1024, 8, 32], "", 0, []], [[], [["SP", 2, 0, 1, [1, 1, 1, 1], 1], ["SP", 2, 5, 8, [1, 1, 1, 1], 1], ["SP", 2, 10, 2, [1, 1, 2, 1], 1], ["SP", 2, 15, 100, [2, 25], 1], ["RE", 2, [0, 5, 10, 1, 6, 11, 2, 7, 12, 15, 16, 3, 8, 13, 17, 4, 9, 14]], ["FSP", 4, 0, 0, 3], ["FSP", 4, 4, 1, 3], ["FSP", 4, 8, 2, 3], ["RE", 4, [0, 4, 8, 1, 5, 9, 2, 6, 10, 3, 7, 11]], ["CA", 2, 4, 8], ["CHR", 1, "shared", [2]], ["CA", 2, 3, 9], ["CHR", 0, "shared", [3]], ["CA", 1, 4, 9], ["FU", 6, [0, 1, 2]], ["AN", 6, 0, 5], ["FU", 6, [1, 2, 3]], ["AN", 6, 1, 4], ["FU", 6, [2, 3, 4]], ["AN", 6, 2, 6], ["FU", 3, [0, 1, 2]], ["SP", 3, 0, 100, [2], 1], ["AN", 3, 1, 2], ["FFSP", 3, 0, [2, 1, 0], 1, 1], ["AN", 3, 1, 6], ["FU", 1, [0, 1]], ["SP", 1, 0, 50, [1], 1], ["AN", 1, 1, 2], ["FFSP", 1, 0, [2, 1, 0], 1, 1], ["AN", 1, 1, 6], ["PR", 4, 0, "auto_unroll_max_step$512"]]]], "r": [[5.32118e-06, 5.32068e-06, 5.32756e-06], 0, 6.95736, 1668099354], "v": "v0.6"}
{"i": [["[\"hfuse_gate_dot\", 1, 100, 16, 8, 2]", "cuda -keys=cuda,gpu -max_num_threads=1024 -model=unknown -thread_warp_size=32", [-1, 16, 64, 49152, 2147483647, 1024, 8, 32], "", 0, []], [[], [["SP", 2, 0, 1, [1, 1, 1, 1], 1], ["SP", 2, 5, 8, [4, 1, 1, 1], 1], ["SP", 2, 10, 2, [1, 1, 2, 1], 1], ["SP", 2, 15, 100, [50, 1], 1], ["RE", 2, [0, 5, 10, 1, 6, 11, 2, 7, 12, 15, 16, 3, 8, 13, 17, 4, 9, 14]], ["FSP", 4, 0, 0, 3], ["FSP", 4, 4, 1, 3], ["FSP", 4, 8, 2, 3], ["RE", 4, [0, 4, 8, 1, 5, 9, 2, 6, 10, 3, 7, 11]], ["CA", 2, 4, 8], ["CHR", 1, "shared", [2]], ["CA", 2, 3, 9], ["CHR", 0, "shared", [3]], ["CA", 1, 4, 9], ["FU", 6, [0, 1, 2]], ["AN", 6, 0, 5], ["FU", 6, [1, 2, 3]], ["AN", 6, 1, 4], ["FU", 6, [2, 3, 4]], ["AN", 6, 2, 6], ["FU", 3, [0, 1, 2]], ["SP", 3, 0, 100, [1], 1], ["AN", 3, 1, 2], ["FFSP", 3, 0, [2, 1, 0], 1, 1], ["AN", 3, 1, 6], ["FU", 1, [0, 1]], ["SP", 1, 0, 50, [1], 1], ["AN", 1, 1, 2], ["FFSP", 1, 0, [2, 1, 0], 1, 1], ["AN", 1, 1, 6], ["PR", 4, 0, "auto_unroll_max_step$1024"]]]], "r": [[1.82188e-05, 1.82184e-05, 1.8221e-05], 0, 9.33629, 1668099355], "v": "v0.6"}
{"i": [["[\"hfuse_gate_dot\", 1, 100, 16, 8, 2]", "cuda -keys=cuda,gpu -max_num_threads=1024 -model=unknown -thread_warp_size=32", [-1, 16, 64, 49152, 2147483647, 1024, 8, 32], "", 0, []], [[], [["SP", 2, 0, 1, [1, 1, 1, 1], 1], ["SP", 2, 5, 8, [2, 1, 1, 1], 1], ["SP", 2, 10, 2, [1, 2, 1, 1], 1], ["SP", 2, 15, 100, [10, 10], 1], ["RE", 2, [0, 5, 10, 1, 6, 11, 2, 7, 12, 15, 16, 3, 8, 13, 17, 4, 9, 14]], ["FSP", 4, 0, 0, 3], ["FSP", 4, 4, 1, 3], ["FSP", 4, 8, 2, 3], ["RE", 4, [0, 4, 8, 1, 5, 9, 2, 6, 10, 3, 7, 11]], ["CA", 2, 4, 8], ["CHR", 1, "shared", [2]], ["CA", 2, 3, 9], ["CHR", 0, "shared", [3]], ["CA", 1, 4, 9], ["FU", 6, [0, 1, 2]], ["AN", 6, 0, 5], ["FU", 6, [1, 2, 3]], ["AN", 6, 1, 4], ["FU", 6, [2, 3, 4]], ["AN", 6, 2, 6], ["FU", 3, [0, 1, 2]], ["SP", 3, 0, 40, [1], 1], ["AN", 3, 1, 2], ["FFSP", 3, 0, [2, 1, 0], 1, 1], ["AN", 3, 1, 6], ["FU", 1, [0, 1]], ["SP", 1, 0, 20, [1], 1], ["AN", 1, 1, 2], ["FFSP", 1, 0, [2, 1, 0], 1, 1], ["AN", 1, 1, 6], ["PR", 4, 0, "auto_unroll_max_step$512"]]]], "r": [[5.18344e-06, 5.18337e-06, 5.18504e-06], 0, 9.18524, 1668099356], "v": "v0.6"}
{"i": [["[\"hfuse_gate_dot\", 1, 100, 16, 8, 2]", "cuda -keys=cuda,gpu -max_num_threads=1024 -model=unknown -thread_warp_size=32", [-1, 16, 64, 49152, 2147483647, 1024, 8, 32], "", 0, []], [[], [["SP", 2, 0, 1, [1, 1, 1, 1], 1], ["SP", 2, 5, 8, [1, 2, 1, 4], 1], ["SP", 2, 10, 2, [1, 1, 1, 1], 1], ["SP", 2, 15, 100, [5, 10], 1], ["RE", 2, [0, 5, 10, 1, 6, 11, 2, 7, 12, 15, 16, 3, 8, 13, 17, 4, 9, 14]], ["FSP", 4, 0, 0, 3], ["FSP", 4, 4, 1, 3], ["FSP", 4, 8, 2, 3], ["RE", 4, [0, 4, 8, 1, 5, 9, 2, 6, 10, 3, 7, 11]], ["CA", 2, 4, 8], ["CHR", 1, "shared", [2]], ["CA", 2, 3, 9], ["CHR", 0, "shared", [3]], ["CA", 1, 4, 9], ["FU", 6, [0, 1, 2]], ["AN", 6, 0, 5], ["FU", 6, [1, 2, 3]], ["AN", 6, 1, 4], ["FU", 6, [2, 3, 4]], ["AN", 6, 2, 6], ["FU", 3, [0, 1, 2]], ["SP", 3, 0, 200, [1], 1], ["AN", 3, 1, 2], ["FFSP", 3, 0, [2, 1, 0], 1, 1], ["AN", 3, 1, 6], ["FU", 1, [0, 1]], ["SP", 1, 0, 50, [1], 1], ["AN", 1, 1, 2], ["FFSP", 1, 0, [2, 1, 0], 1, 1], ["AN", 1, 1, 6], ["PR", 4, 0, "auto_unroll_max_step$512"]]]], "r": [[8.00046e-06, 8.00133e-06, 8.00057e-06], 0, 4.88512, 1668099351], "v": "v0.6"}
{"i": [["[\"hfuse_gate_dot\", 1, 100, 16, 8, 2]", "cuda -keys=cuda,gpu -max_num_threads=1024 -model=unknown -thread_warp_size=32", [-1, 16, 64, 49152, 2147483647, 1024, 8, 32], "", 0, []], [[], [["SP", 2, 0, 1, [1, 1, 1, 1], 1], ["SP", 2, 5, 8, [1, 4, 1, 1], 1], ["SP", 2, 10, 2, [1, 2, 1, 1], 1], ["SP", 2, 15, 100, [10, 2], 1], ["RE", 2, [0, 5, 10, 1, 6, 11, 2, 7, 12, 15, 16, 3, 8, 13, 17, 4, 9, 14]], ["FSP", 4, 0, 0, 3], ["FSP", 4, 4, 1, 3], ["FSP", 4, 8, 2, 3], ["RE", 4, [0, 4, 8, 1, 5, 9, 2, 6, 10, 3, 7, 11]], ["CA", 2, 4, 8], ["CHR", 1, "shared", [2]], ["CA", 2, 3, 9], ["CHR", 0, "shared", [3]], ["CA", 1, 4, 9], ["FU", 6, [0, 1, 2]], ["AN", 6, 0, 5], ["FU", 6, [1, 2, 3]], ["AN", 6, 1, 4], ["FU", 6, [2, 3, 4]], ["AN", 6, 2, 6], ["FU", 3, [0, 1, 2]], ["SP", 3, 0, 100, [1], 1], ["AN", 3, 1, 2], ["FFSP", 3, 0, [2, 1, 0], 1, 1], ["AN", 3, 1, 6], ["FU", 1, [0, 1]], ["SP", 1, 0, 100, [1], 1], ["AN", 1, 1, 2], ["FFSP", 1, 0, [2, 1, 0], 1, 1], ["AN", 1, 1, 6], ["PR", 4, 0, "auto_unroll_max_step$0"]]]], "r": [[3.80659e-06, 3.8047e-06, 3.80564e-06], 0, 6.27321, 1668099353], "v": "v0.6"}
{"i": [["[\"hfuse_gate_dot\", 1, 100, 16, 8, 2]", "cuda -keys=cuda,gpu -max_num_threads=1024 -model=unknown -thread_warp_size=32", [-1, 16, 64, 49152, 2147483647, 1024, 8, 32], "", 0, []], [[], [["SP", 2, 0, 1, [1, 1, 1, 1], 1], ["SP", 2, 5, 8, [1, 1, 1, 2], 1], ["SP", 2, 10, 2, [1, 1, 2, 1], 1], ["SP", 2, 15, 100, [25, 1], 1], ["RE", 2, [0, 5, 10, 1, 6, 11, 2, 7, 12, 15, 16, 3, 8, 13, 17, 4, 9, 14]], ["FSP", 4, 0, 0, 3], ["FSP", 4, 4, 1, 3], ["FSP", 4, 8, 2, 3], ["RE", 4, [0, 4, 8, 1, 5, 9, 2, 6, 10, 3, 7, 11]], ["CA", 2, 4, 8], ["CHR", 1, "shared", [2]], ["CA", 2, 3, 9], ["CHR", 0, "shared", [3]], ["CA", 1, 4, 9], ["FU", 6, [0, 1, 2]], ["AN", 6, 0, 5], ["FU", 6, [1, 2, 3]], ["AN", 6, 1, 4], ["FU", 6, [2, 3, 4]], ["AN", 6, 2, 6], ["FU", 3, [0, 1, 2]], ["SP", 3, 0, 50, [1], 1], ["AN", 3, 1, 2], ["FFSP", 3, 0, [2, 1, 0], 1, 1], ["AN", 3, 1, 6], ["FU", 1, [0, 1]], ["SP", 1, 0, 25, [1], 1], ["AN", 1, 1, 2], ["FFSP", 1, 0, [2, 1, 0], 1, 1], ["AN", 1, 1, 6], ["PR", 4, 0, "auto_unroll_max_step$16"]]]], "r": [[1.24379e-05, 1.24376e-05, 1.24325e-05], 0, 7.90432, 1668099355], "v": "v0.6"}
{"i": [["[\"hfuse_gate_dot\", 1, 100, 16, 8, 2]", "cuda -keys=cuda,gpu -max_num_threads=1024 -model=unknown -thread_warp_size=32", [-1, 16, 64, 49152, 2147483647, 1024, 8, 32], "", 0, []], [[], [["SP", 2, 0, 1, [1, 1, 1, 1], 1], ["SP", 2, 5, 8, [2, 1, 2, 2], 1], ["SP", 2, 10, 2, [1, 1, 1, 2], 1], ["SP", 2, 15, 100, [1, 20], 1], ["RE", 2, [0, 5, 10, 1, 6, 11, 2, 7, 12, 15, 16, 3, 8, 13, 17, 4, 9, 14]], ["FSP", 4, 0, 0, 3], ["FSP", 4, 4, 1, 3], ["FSP", 4, 8, 2, 3], ["RE", 4, [0, 4, 8, 1, 5, 9, 2, 6, 10, 3, 7, 11]], ["CA", 2, 4, 8], ["CHR", 1, "shared", [2]], ["CA", 2, 3, 9], ["CHR", 0, "shared", [3]], ["CA", 1, 4, 9], ["FU", 6, [0, 1, 2]], ["AN", 6, 0, 5], ["FU", 6, [1, 2, 3]], ["AN", 6, 1, 4], ["FU", 6, [2, 3, 4]], ["AN", 6, 2, 6], ["FU", 3, [0, 1, 2]], ["SP", 3, 0, 80, [1], 1], ["AN", 3, 1, 2], ["FFSP", 3, 0, [2, 1, 0], 1, 1], ["AN", 3, 1, 6], ["FU", 1, [0, 1]], ["SP", 1, 0, 20, [4], 1], ["AN", 1, 1, 2], ["FFSP", 1, 0, [2, 1, 0], 1, 1], ["AN", 1, 1, 6], ["PR", 4, 0, "auto_unroll_max_step$512"]]]], "r": [[2.58887e-05, 2.59505e-05, 2.59374e-05], 0, 8.06473, 1668099355], "v": "v0.6"}
{"i": [["[\"hfuse_gate_dot\", 1, 100, 16, 8, 2]", "cuda -keys=cuda,gpu -max_num_threads=1024 -model=unknown -thread_warp_size=32", [-1, 16, 64, 49152, 2147483647, 1024, 8, 32], "", 0, []], [[], [["SP", 2, 0, 1, [1, 1, 1, 1], 1], ["SP", 2, 5, 8, [1, 1, 2, 1], 1], ["SP", 2, 10, 2, [1, 1, 1, 2], 1], ["SP", 2, 15, 100, [5, 10], 1], ["RE", 2, [0, 5, 10, 1, 6, 11, 2, 7, 12, 15, 16, 3, 8, 13, 17, 4, 9, 14]], ["FSP", 4, 0, 0, 3], ["FSP", 4, 4, 1, 3], ["FSP", 4, 8, 2, 3], ["RE", 4, [0, 4, 8, 1, 5, 9, 2, 6, 10, 3, 7, 11]], ["CA", 2, 4, 8], ["CHR", 1, "shared", [2]], ["CA", 2, 3, 9], ["CHR", 0, "shared", [3]], ["CA", 1, 4, 9], ["FU", 6, [0, 1, 2]], ["AN", 6, 0, 5], ["FU", 6, [1, 2, 3]], ["AN", 6, 1, 4], ["FU", 6, [2, 3, 4]], ["AN", 6, 2, 6], ["FU", 3, [0, 1, 2]], ["SP", 3, 0, 200, [1], 1], ["AN", 3, 1, 2], ["FFSP", 3, 0, [2, 1, 0], 1, 1], ["AN", 3, 1, 6], ["FU", 1, [0, 1]], ["SP", 1, 0, 50, [1], 1], ["AN", 1, 1, 2], ["FFSP", 1, 0, [2, 1, 0], 1, 1], ["AN", 1, 1, 6], ["PR", 4, 0, "auto_unroll_max_step$16"]]]], "r": [[1.19873e-05, 1.19734e-05, 1.19729e-05], 0, 7.08345, 1668099354], "v": "v0.6"}
{"i": [["[\"hfuse_gate_dot\", 1, 100, 16, 8, 2]", "cuda -keys=cuda,gpu -max_num_threads=1024 -model=unknown -thread_warp_size=32", [-1, 16, 64, 49152, 2147483647, 1024, 8, 32], "", 0, []], [[], [["SP", 2, 0, 1, [1, 1, 1, 1], 1], ["SP", 2, 5, 8, [1, 1, 4, 2], 1], ["SP", 2, 10, 2, [1, 1, 1, 1], 1], ["SP", 2, 15, 100, [1, 10], 1], ["RE", 2, [0, 5, 10, 1, 6, 11, 2, 7, 12, 15, 16, 3, 8, 13, 17, 4, 9, 14]], ["FSP", 4, 0, 0, 3], ["FSP", 4, 4, 1, 3], ["FSP", 4, 8, 2, 3], ["RE", 4, [0, 4, 8, 1, 5, 9, 2, 6, 10, 3, 7, 11]], ["CA", 2, 4, 8], ["CHR", 1, "shared", [2]], ["CA", 2, 3, 9], ["CHR", 0, "shared", [3]], ["CA", 1, 4, 9], ["FU", 6, [0, 1, 2]], ["AN", 6, 0, 5], ["FU", 6, [1, 2, 3]], ["AN", 6, 1, 4], ["FU", 6, [2, 3, 4]], ["AN", 6, 2, 6], ["FU", 3, [0, 1, 2]], ["SP", 3, 0, 40, [1], 1], ["AN", 3, 1, 2], ["FFSP", 3, 0, [2, 1, 0], 1, 1], ["AN", 3, 1, 6], ["FU", 1, [0, 1]], ["SP", 1, 0, 10, [1], 1], ["AN", 1, 1, 2], ["FFSP", 1, 0, [2, 1, 0], 1, 1], ["AN", 1, 1, 6], ["PR", 4, 0, "auto_unroll_max_step$1024"]]]], "r": [[1.65334e-05, 1.65327e-05, 1.6533e-05], 0, 5.56838, 1668099777], "v": "v0.6"}
{"i": [["[\"hfuse_gate_dot\", 1, 100, 16, 8, 2]", "cuda -keys=cuda,gpu -max_num_threads=1024 -model=unknown -thread_warp_size=32", [-1, 16, 64, 49152, 2147483647, 1024, 8, 32], "", 0, []], [[], [["SP", 2, 0, 1, [1, 1, 1, 1], 1], ["SP", 2, 5, 8, [8, 1, 1, 1], 1], ["SP", 2, 10, 2, [1, 1, 1, 2], 1], ["SP", 2, 15, 100, [1, 5], 1], ["RE", 2, [0, 5, 10, 1, 6, 11, 2, 7, 12, 15, 16, 3, 8, 13, 17, 4, 9, 14]], ["FSP", 4, 0, 0, 3], ["FSP", 4, 4, 1, 3], ["FSP", 4, 8, 2, 3], ["RE", 4, [0, 4, 8, 1, 5, 9, 2, 6, 10, 3, 7, 11]], ["CA", 2, 4, 8], ["CHR", 1, "shared", [2]], ["CA", 2, 3, 9], ["CHR", 0, "shared", [3]], ["CA", 1, 4, 9], ["FU", 6, [0, 1, 2]], ["AN", 6, 0, 5], ["FU", 6, [1, 2, 3]], ["AN", 6, 1, 4], ["FU", 6, [2, 3, 4]], ["AN", 6, 2, 6], ["FU", 3, [0, 1, 2]], ["SP", 3, 0, 40, [1], 1], ["AN", 3, 1, 2], ["FFSP", 3, 0, [2, 1, 0], 1, 1], ["AN", 3, 1, 6], ["FU", 1, [0, 1]], ["SP", 1, 0, 20, [1], 1], ["AN", 1, 1, 2], ["FFSP", 1, 0, [2, 1, 0], 1, 1], ["AN", 1, 1, 6], ["PR", 4, 0, "auto_unroll_max_step$64"]]]], "r": [[3.77422e-05, 3.77399e-05, 3.77372e-05], 0, 3.0697, 1668099774], "v": "v0.6"}
{"i": [["[\"hfuse_gate_dot\", 1, 100, 16, 8, 2]", "cuda -keys=cuda,gpu -max_num_threads=1024 -model=unknown -thread_warp_size=32", [-1, 16, 64, 49152, 2147483647, 1024, 8, 32], "", 0, []], [[], [["SP", 2, 0, 1, [1, 1, 1, 1], 1], ["SP", 2, 5, 8, [2, 1, 1, 4], 1], ["SP", 2, 10, 2, [1, 1, 2, 1], 1], ["SP", 2, 15, 100, [10, 10], 1], ["RE", 2, [0, 5, 10, 1, 6, 11, 2, 7, 12, 15, 16, 3, 8, 13, 17, 4, 9, 14]], ["FSP", 4, 0, 0, 3], ["FSP", 4, 4, 1, 3], ["FSP", 4, 8, 2, 3], ["RE", 4, [0, 4, 8, 1, 5, 9, 2, 6, 10, 3, 7, 11]], ["CA", 2, 4, 8], ["CHR", 1, "shared", [2]], ["CA", 2, 3, 9], ["CHR", 0, "shared", [3]], ["CA", 1, 4, 9], ["FU", 6, [0, 1, 2]], ["AN", 6, 0, 5], ["FU", 6, [1, 2, 3]], ["AN", 6, 1, 4], ["FU", 6, [2, 3, 4]], ["AN", 6, 2, 6], ["FU", 3, [0, 1, 2]], ["SP", 3, 0, 800, [1], 1], ["AN", 3, 1, 2], ["FFSP", 3, 0, [2, 1, 0], 1, 1], ["AN", 3, 1, 6], ["FU", 1, [0, 1]], ["SP", 1, 0, 100, [1], 1], ["AN", 1, 1, 2], ["FFSP", 1, 0, [2, 1, 0], 1, 1], ["AN", 1, 1, 6], ["PR", 4, 0, "auto_unroll_max_step$16"]]]], "r": [[1.64152e-05, 1.64178e-05, 1.64151e-05], 0, 4.38639, 1668099776], "v": "v0.6"}
{"i": [["[\"hfuse_gate_dot\", 1, 100, 16, 8, 2]", "cuda -keys=cuda,gpu -max_num_threads=1024 -model=unknown -thread_warp_size=32", [-1, 16, 64, 49152, 2147483647, 1024, 8, 32], "", 0, []], [[], [["SP", 2, 0, 1, [1, 1, 1, 1], 1], ["SP", 2, 5, 8, [4, 2, 1, 1], 1], ["SP", 2, 10, 2, [1, 2, 1, 1], 1], ["SP", 2, 15, 100, [5, 2], 1], ["RE", 2, [0, 5, 10, 1, 6, 11, 2, 7, 12, 15, 16, 3, 8, 13, 17, 4, 9, 14]], ["FSP", 4, 0, 0, 3], ["FSP", 4, 4, 1, 3], ["FSP", 4, 8, 2, 3], ["RE", 4, [0, 4, 8, 1, 5, 9, 2, 6, 10, 3, 7, 11]], ["CA", 2, 4, 8], ["CHR", 1, "shared", [2]], ["CA", 2, 3, 9], ["CHR", 0, "shared", [3]], ["CA", 1, 4, 9], ["FU", 6, [0, 1, 2]], ["AN", 6, 0, 5], ["FU", 6, [1, 2, 3]], ["AN", 6, 1, 4], ["FU", 6, [2, 3, 4]], ["AN", 6, 2, 6], ["FU", 3, [0, 1, 2]], ["SP", 3, 0, 10, [1], 1], ["AN", 3, 1, 2], ["FFSP", 3, 0, [2, 1, 0], 1, 1], ["AN", 3, 1, 6], ["FU", 1, [0, 1]], ["SP", 1, 0, 10, [1], 1], ["AN", 1, 1, 2], ["FFSP", 1, 0, [2, 1, 0], 1, 1], ["AN", 1, 1, 6], ["PR", 4, 0, "auto_unroll_max_step$16"]]]], "r": [[8.41352e-06, 8.41496e-06, 8.41107e-06], 0, 3.42069, 1668099775], "v": "v0.6"}
{"i": [["[\"hfuse_gate_dot\", 1, 100, 16, 8, 2]", "cuda -keys=cuda,gpu -max_num_threads=1024 -model=unknown -thread_warp_size=32", [-1, 16, 64, 49152, 2147483647, 1024, 8, 32], "", 0, []], [[], [["SP", 2, 0, 1, [1, 1, 1, 1], 1], ["SP", 2, 5, 8, [1, 1, 8, 1], 1], ["SP", 2, 10, 2, [1, 1, 1, 1], 1], ["SP", 2, 15, 100, [20, 1], 1], ["RE", 2, [0, 5, 10, 1, 6, 11, 2, 7, 12, 15, 16, 3, 8, 13, 17, 4, 9, 14]], ["FSP", 4, 0, 0, 3], ["FSP", 4, 4, 1, 3], ["FSP", 4, 8, 2, 3], ["RE", 4, [0, 4, 8, 1, 5, 9, 2, 6, 10, 3, 7, 11]], ["CA", 2, 4, 8], ["CHR", 1, "shared", [2]], ["CA", 2, 3, 9], ["CHR", 0, "shared", [3]], ["CA", 1, 4, 9], ["FU", 6, [0, 1, 2]], ["AN", 6, 0, 5], ["FU", 6, [1, 2, 3]], ["AN", 6, 1, 4], ["FU", 6, [2, 3, 4]], ["AN", 6, 2, 6], ["FU", 3, [0, 1, 2]], ["SP", 3, 0, 1600, [1], 1], ["AN", 3, 1, 2], ["FFSP", 3, 0, [2, 1, 0], 1, 1], ["AN", 3, 1, 6], ["FU", 1, [0, 1]], ["SP", 1, 0, 100, [1], 1], ["AN", 1, 1, 2], ["FFSP", 1, 0, [2, 1, 0], 1, 1], ["AN", 1, 1, 6], ["PR", 4, 0, "auto_unroll_max_step$16"]]]], "r": [[2.41521e-05, 2.41557e-05, 2.41396e-05], 0, 2.39336, 1668099774], "v": "v0.6"}
{"i": [["[\"hfuse_gate_dot\", 1, 100, 16, 8, 2]", "cuda -keys=cuda,gpu -max_num_threads=1024 -model=unknown -thread_warp_size=32", [-1, 16, 64, 49152, 2147483647, 1024, 8, 32], "", 0, []], [[], [["SP", 2, 0, 1, [1, 1, 1, 1], 1], ["SP", 2, 5, 8, [4, 1, 2, 1], 1], ["SP", 2, 10, 2, [1, 1, 1, 1], 1], ["SP", 2, 15, 100, [100, 1], 1], ["RE", 2, [0, 5, 10, 1, 6, 11, 2, 7, 12, 15, 16, 3, 8, 13, 17, 4, 9, 14]], ["FSP", 4, 0, 0, 3], ["FSP", 4, 4, 1, 3], ["FSP", 4, 8, 2, 3], ["RE", 4, [0, 4, 8, 1, 5, 9, 2, 6, 10, 3, 7, 11]], ["CA", 2, 4, 8], ["CHR", 1, "shared", [2]], ["CA", 2, 3, 9], ["CHR", 0, "shared", [3]], ["CA", 1, 4, 9], ["FU", 6, [0, 1, 2]], ["AN", 6, 0, 5], ["FU", 6, [1, 2, 3]], ["AN", 6, 1, 4], ["FU", 6, [2, 3, 4]], ["AN", 6, 2, 6], ["FU", 3, [0, 1, 2]], ["SP", 3, 0, 8, [1], 1], ["AN", 3, 1, 2], ["FFSP", 3, 0, [2, 1, 0], 1, 1], ["AN", 3, 1, 6], ["FU", 1, [0, 1]], ["SP", 1, 0, 4, [2], 1], ["AN", 1, 1, 2], ["FFSP", 1, 0, [2, 1, 0], 1, 1], ["AN", 1, 1, 6], ["PR", 4, 0, "auto_unroll_max_step$16"]]]], "r": [[1.18174e-05, 1.18157e-05, 1.1818e-05], 0, 1.8614, 1668099773], "v": "v0.6"}
{"i": [["[\"hfuse_gate_dot\", 1, 100, 16, 8, 2]", "cuda -keys=cuda,gpu -max_num_threads=1024 -model=unknown -thread_warp_size=32", [-1, 16, 64, 49152, 2147483647, 1024, 8, 32], "", 0, []], [[], [["SP", 2, 0, 1, [1, 1, 1, 1], 1], ["SP", 2, 5, 8, [1, 1, 1, 1], 1], ["SP", 2, 10, 2, [1, 1, 1, 2], 1], ["SP", 2, 15, 100, [1, 25], 1], ["RE", 2, [0, 5, 10, 1, 6, 11, 2, 7, 12, 15, 16, 3, 8, 13, 17, 4, 9, 14]], ["FSP", 4, 0, 0, 3], ["FSP", 4, 4, 1, 3], ["FSP", 4, 8, 2, 3], ["RE", 4, [0, 4, 8, 1, 5, 9, 2, 6, 10, 3, 7, 11]], ["CA", 2, 4, 8], ["CHR", 1, "shared", [2]], ["CA", 2, 3, 9], ["CHR", 0, "shared", [3]], ["CA", 1, 4, 9], ["FU", 6, [0, 1, 2]], ["AN", 6, 0, 5], ["FU", 6, [1, 2, 3]], ["AN", 6, 1, 4], ["FU", 6, [2, 3, 4]], ["AN", 6, 2, 6], ["FU", 3, [0, 1, 2]], ["SP", 3, 0, 50, [1], 1], ["AN", 3, 1, 2], ["FFSP", 3, 0, [2, 1, 0], 1, 1], ["AN", 3, 1, 6], ["FU", 1, [0, 1]], ["SP", 1, 0, 25, [1], 1], ["AN", 1, 1, 2], ["FFSP", 1, 0, [2, 1, 0], 1, 1], ["AN", 1, 1, 6], ["PR", 4, 0, "auto_unroll_max_step$64"]]]], "r": [[8.81527e-06, 8.8174e-06, 8.81589e-06], 0, 1.64044, 1668099772], "v": "v0.6"}
{"i": [["[\"hfuse_gate_dot\", 1, 100, 16, 8, 2]", "cuda -keys=cuda,gpu -max_num_threads=1024 -model=unknown -thread_warp_size=32", [-1, 16, 64, 49152, 2147483647, 1024, 8, 32], "", 0, []], [[], [["SP", 2, 0, 1, [1, 1, 1, 1], 1], ["SP", 2, 5, 8, [1, 2, 2, 1], 1], ["SP", 2, 10, 2, [1, 1, 2, 1], 1], ["SP", 2, 15, 100, [4, 1], 1], ["RE", 2, [0, 5, 10, 1, 6, 11, 2, 7, 12, 15, 16, 3, 8, 13, 17, 4, 9, 14]], ["FSP", 4, 0, 0, 3], ["FSP", 4, 4, 1, 3], ["FSP", 4, 8, 2, 3], ["RE", 4, [0, 4, 8, 1, 5, 9, 2, 6, 10, 3, 7, 11]], ["CA", 2, 4, 8], ["CHR", 1, "shared", [2]], ["CA", 2, 3, 9], ["CHR", 0, "shared", [3]], ["CA", 1, 4, 9], ["FU", 6, [0, 1, 2]], ["AN", 6, 0, 5], ["FU", 6, [1, 2, 3]], ["AN", 6, 1, 4], ["FU", 6, [2, 3, 4]], ["AN", 6, 2, 6], ["FU", 3, [0, 1, 2]], ["SP", 3, 0, 16, [1], 1], ["AN", 3, 1, 2], ["FFSP", 3, 0, [2, 1, 0], 1, 1], ["AN", 3, 1, 6], ["FU", 1, [0, 1]], ["SP", 1, 0, 4, [1], 1], ["AN", 1, 1, 2], ["FFSP", 1, 0, [2, 1, 0], 1, 1], ["AN", 1, 1, 6], ["PR", 4, 0, "auto_unroll_max_step$64"]]]], "r": [[1.00892e-05, 1.00879e-05, 1.00862e-05], 0, 6.61888, 1668099778], "v": "v0.6"}
{"i": [["[\"hfuse_gate_dot\", 1, 100, 16, 8, 2]", "cuda -keys=cuda,gpu -max_num_threads=1024 -model=unknown -thread_warp_size=32", [-1, 16, 64, 49152, 2147483647, 1024, 8, 32], "", 0, []], [[], [["SP", 2, 0, 1, [1, 1, 1, 1], 1], ["SP", 2, 5, 8, [8, 1, 1, 1], 1], ["SP", 2, 10, 2, [1, 1, 1, 1], 1], ["SP", 2, 15, 100, [25, 4], 1], ["RE", 2, [0, 5, 10, 1, 6, 11, 2, 7, 12, 15, 16, 3, 8, 13, 17, 4, 9, 14]], ["FSP", 4, 0, 0, 3], ["FSP", 4, 4, 1, 3], ["FSP", 4, 8, 2, 3], ["RE", 4, [0, 4, 8, 1, 5, 9, 2, 6, 10, 3, 7, 11]], ["CA", 2, 4, 8], ["CHR", 1, "shared", [2]], ["CA", 2, 3, 9], ["CHR", 0, "shared", [3]], ["CA", 1, 4, 9], ["FU", 6, [0, 1, 2]], ["AN", 6, 0, 5], ["FU", 6, [1, 2, 3]], ["AN", 6, 1, 4], ["FU", 6, [2, 3, 4]], ["AN", 6, 2, 6], ["FU", 3, [0, 1, 2]], ["SP", 3, 0, 200, [1], 1], ["AN", 3, 1, 2], ["FFSP", 3, 0, [2, 1, 0], 1, 1], ["AN", 3, 1, 6], ["FU", 1, [0, 1]], ["SP", 1, 0, 100, [1], 1], ["AN", 1, 1, 2], ["FFSP", 1, 0, [2, 1, 0], 1, 1], ["AN", 1, 1, 6], ["PR", 4, 0, "auto_unroll_max_step$64"]]]], "r": [[1.20524e-05, 1.20496e-05, 1.20479e-05], 0, 5.13474, 1668099777], "v": "v0.6"}
{"i": [["[\"hfuse_gate_dot\", 1, 100, 16, 8, 2]", "cuda -keys=cuda,gpu -max_num_threads=1024 -model=unknown -thread_warp_size=32", [-1, 16, 64, 49152, 2147483647, 1024, 8, 32], "", 0, []], [[], [["SP", 2, 0, 1, [1, 1, 1, 1], 1], ["SP", 2, 5, 8, [1, 2, 1, 1], 1], ["SP", 2, 10, 2, [1, 1, 1, 1], 1], ["SP", 2, 15, 100, [20, 1], 1], ["RE", 2, [0, 5, 10, 1, 6, 11, 2, 7, 12, 15, 16, 3, 8, 13, 17, 4, 9, 14]], ["FSP", 4, 0, 0, 3], ["FSP", 4, 4, 1, 3], ["FSP", 4, 8, 2, 3], ["RE", 4, [0, 4, 8, 1, 5, 9, 2, 6, 10, 3, 7, 11]], ["CA", 2, 4, 8], ["CHR", 1, "shared", [2]], ["CA", 2, 3, 9], ["CHR", 0, "shared", [3]], ["CA", 1, 4, 9], ["FU", 6, [0, 1, 2]], ["AN", 6, 0, 5], ["FU", 6, [1, 2, 3]], ["AN", 6, 1, 4], ["FU", 6, [2, 3, 4]], ["AN", 6, 2, 6], ["FU", 3, [0, 1, 2]], ["SP", 3, 0, 16, [4], 1], ["AN", 3, 1, 2], ["FFSP", 3, 0, [2, 1, 0], 1, 1], ["AN", 3, 1, 6], ["FU", 1, [0, 1]], ["SP", 1, 0, 4, [1], 1], ["AN", 1, 1, 2], ["FFSP", 1, 0, [2, 1, 0], 1, 1], ["AN", 1, 1, 6], ["PR", 4, 0, "auto_unroll_max_step$0"]]]], "r": [[3.84139e-06, 3.83959e-06, 3.84199e-06], 0, 4.54069, 1668099776], "v": "v0.6"}
{"i": [["[\"hfuse_gate_dot\", 1, 100, 16, 8, 2]", "cuda -keys=cuda,gpu -max_num_threads=1024 -model=unknown -thread_warp_size=32", [-1, 16, 64, 49152, 2147483647, 1024, 8, 32], "", 0, []], [[], [["SP", 2, 0, 1, [1, 1, 1, 1], 1], ["SP", 2, 5, 8, [1, 1, 8, 1], 1], ["SP", 2, 10, 2, [1, 1, 1, 1], 1], ["SP", 2, 15, 100, [2, 5], 1], ["RE", 2, [0, 5, 10, 1, 6, 11, 2, 7, 12, 15, 16, 3, 8, 13, 17, 4, 9, 14]], ["FSP", 4, 0, 0, 3], ["FSP", 4, 4, 1, 3], ["FSP", 4, 8, 2, 3], ["RE", 4, [0, 4, 8, 1, 5, 9, 2, 6, 10, 3, 7, 11]], ["CA", 2, 4, 8], ["CHR", 1, "shared", [2]], ["CA", 2, 3, 9], ["CHR", 0, "shared", [3]], ["CA", 1, 4, 9], ["FU", 6, [0, 1, 2]], ["AN", 6, 0, 5], ["FU", 6, [1, 2, 3]], ["AN", 6, 1, 4], ["FU", 6, [2, 3, 4]], ["AN", 6, 2, 6], ["FU", 3, [0, 1, 2]], ["SP", 3, 0, 800, [1], 1], ["AN", 3, 1, 2], ["FFSP", 3, 0, [2, 1, 0], 1, 1], ["AN", 3, 1, 6], ["FU", 1, [0, 1]], ["SP", 1, 0, 50, [1], 1], ["AN", 1, 1, 2], ["FFSP", 1, 0, [2, 1, 0], 1, 1], ["AN", 1, 1, 6], ["PR", 4, 0, "auto_unroll_max_step$1024"]]]], "r": [[1.65674e-05, 1.65661e-05, 1.65664e-05], 0, 10.4854, 1668099782], "v": "v0.6"}
{"i": [["[\"hfuse_gate_dot\", 1, 100, 16, 8, 2]", "cuda -keys=cuda,gpu -max_num_threads=1024 -model=unknown -thread_warp_size=32", [-1, 16, 64, 49152, 2147483647, 1024, 8, 32], "", 0, []], [[], [["SP", 2, 0, 1, [1, 1, 1, 1], 1], ["SP", 2, 5, 8, [1, 2, 4, 1], 1], ["SP", 2, 10, 2, [2, 1, 1, 1], 1], ["SP", 2, 15, 100, [1, 1], 1], ["RE", 2, [0, 5, 10, 1, 6, 11, 2, 7, 12, 15, 16, 3, 8, 13, 17, 4, 9, 14]], ["FSP", 4, 0, 0, 3], ["FSP", 4, 4, 1, 3], ["FSP", 4, 8, 2, 3], ["RE", 4, [0, 4, 8, 1, 5, 9, 2, 6, 10, 3, 7, 11]], ["CA", 2, 4, 8], ["CHR", 1, "shared", [2]], ["CA", 2, 3, 9], ["CHR", 0, "shared", [3]], ["CA", 1, 4, 9], ["FU", 6, [0, 1, 2]], ["AN", 6, 0, 5], ["FU", 6, [1, 2, 3]], ["AN", 6, 1, 4], ["FU", 6, [2, 3, 4]], ["AN", 6, 2, 6], ["FU", 3, [0, 1, 2]], ["SP", 3, 0, 40, [1], 1], ["AN", 3, 1, 2], ["FFSP", 3, 0, [2, 1, 0], 1, 1], ["AN", 3, 1, 6], ["FU", 1, [0, 1]], ["SP", 1, 0, 10, [1], 1], ["AN", 1, 1, 2], ["FFSP", 1, 0, [2, 1, 0], 1, 1], ["AN", 1, 1, 6], ["PR", 4, 0, "auto_unroll_max_step$1024"]]]], "r": [[2.01567e-05, 2.01556e-05, 2.01577e-05], 0, 6.11371, 1668099778], "v": "v0.6"}
{"i": [["[\"hfuse_gate_dot\", 1, 100, 16, 8, 2]", "cuda -keys=cuda,gpu -max_num_threads=1024 -model=unknown -thread_warp_size=32", [-1, 16, 64, 49152, 2147483647, 1024, 8, 32], "", 0, []], [[], [["SP", 2, 0, 1, [1, 1, 1, 1], 1], ["SP", 2, 5, 8, [1, 4, 2, 1], 1], ["SP", 2, 10, 2, [1, 2, 1, 1], 1], ["SP", 2, 15, 100, [10, 1], 1], ["RE", 2, [0, 5, 10, 1, 6, 11, 2, 7, 12, 15, 16, 3, 8, 13, 17, 4, 9, 14]], ["FSP", 4, 0, 0, 3], ["FSP", 4, 4, 1, 3], ["FSP", 4, 8, 2, 3], ["RE", 4, [0, 4, 8, 1, 5, 9, 2, 6, 10, 3, 7, 11]], ["CA", 2, 4, 8], ["CHR", 1, "shared", [2]], ["CA", 2, 3, 9], ["CHR", 0, "shared", [3]], ["CA", 1, 4, 9], ["FU", 6, [0, 1, 2]], ["AN", 6, 0, 5], ["FU", 6, [1, 2, 3]], ["AN", 6, 1, 4], ["FU", 6, [2, 3, 4]], ["AN", 6, 2, 6], ["FU", 3, [0, 1, 2]], ["SP", 3, 0, 8, [1], 1], ["AN", 3, 1, 2], ["FFSP", 3, 0, [2, 1, 0], 1, 1], ["AN", 3, 1, 6], ["FU", 1, [0, 1]], ["SP", 1, 0, 2, [1], 1], ["AN", 1, 1, 2], ["FFSP", 1, 0, [2, 1, 0], 1, 1], ["AN", 1, 1, 6], ["PR", 4, 0, "auto_unroll_max_step$1024"]]]], "r": [[5.01098e-06, 5.00894e-06, 5.00864e-06], 0, 13.9241, 1668099785], "v": "v0.6"}
{"i": [["[\"hfuse_gate_dot\", 1, 100, 16, 8, 2]", "cuda -keys=cuda,gpu -max_num_threads=1024 -model=unknown -thread_warp_size=32", [-1, 16, 64, 49152, 2147483647, 1024, 8, 32], "", 0, []], [[], [["SP", 2, 0, 1, [1, 1, 1, 1], 1], ["SP", 2, 5, 8, [1, 2, 1, 2], 1], ["SP", 2, 10, 2, [1, 2, 1, 1], 1], ["SP", 2, 15, 100, [25, 2], 1], ["RE", 2, [0, 5, 10, 1, 6, 11, 2, 7, 12, 15, 16, 3, 8, 13, 17, 4, 9, 14]], ["FSP", 4, 0, 0, 3], ["FSP", 4, 4, 1, 3], ["FSP", 4, 8, 2, 3], ["RE", 4, [0, 4, 8, 1, 5, 9, 2, 6, 10, 3, 7, 11]], ["CA", 2, 4, 8], ["CHR", 1, "shared", [2]], ["CA", 2, 3, 9], ["CHR", 0, "shared", [3]], ["CA", 1, 4, 9], ["FU", 6, [0, 1, 2]], ["AN", 6, 0, 5], ["FU", 6, [1, 2, 3]], ["AN", 6, 1, 4], ["FU", 6, [2, 3, 4]], ["AN", 6, 2, 6], ["FU", 3, [0, 1, 2]], ["SP", 3, 0, 50, [2], 1], ["AN", 3, 1, 2], ["FFSP", 3, 0, [2, 1, 0], 1, 1], ["AN", 3, 1, 6], ["FU", 1, [0, 1]], ["SP", 1, 0, 50, [5], 1], ["AN", 1, 1, 2], ["FFSP", 1, 0, [2, 1, 0], 1, 1], ["AN", 1, 1, 6], ["PR", 4, 0, "auto_unroll_max_step$0"]]]], "r": [[5.24166e-06, 5.24066e-06, 5.24285e-06], 0, 5.93232, 1668099777], "v": "v0.6"}
{"i": [["[\"hfuse_gate_dot\", 1, 100, 16, 8, 2]", "cuda -keys=cuda,gpu -max_num_threads=1024 -model=unknown -thread_warp_size=32", [-1, 16, 64, 49152, 2147483647, 1024, 8, 32], "", 0, []], [[], [["SP", 2, 0, 1, [1, 1, 1, 1], 1], ["SP", 2, 5, 8, [1, 4, 1, 2], 1], ["SP", 2, 10, 2, [2, 1, 1, 1], 1], ["SP", 2, 15, 100, [5, 10], 1], ["RE", 2, [0, 5, 10, 1, 6, 11, 2, 7, 12, 15, 16, 3, 8, 13, 17, 4, 9, 14]], ["FSP", 4, 0, 0, 3], ["FSP", 4, 4, 1, 3], ["FSP", 4, 8, 2, 3], ["RE", 4, [0, 4, 8, 1, 5, 9, 2, 6, 10, 3, 7, 11]], ["CA", 2, 4, 8], ["CHR", 1, "shared", [2]], ["CA", 2, 3, 9], ["CHR", 0, "shared", [3]], ["CA", 1, 4, 9], ["FU", 6, [0, 1, 2]], ["AN", 6, 0, 5], ["FU", 6, [1, 2, 3]], ["AN", 6, 1, 4], ["FU", 6, [2, 3, 4]], ["AN", 6, 2, 6], ["FU", 3, [0, 1, 2]], ["SP", 3, 0, 100, [1], 1], ["AN", 3, 1, 2], ["FFSP", 3, 0, [2, 1, 0], 1, 1], ["AN", 3, 1, 6], ["FU", 1, [0, 1]], ["SP", 1, 0, 50, [1], 1], ["AN", 1, 1, 2], ["FFSP", 1, 0, [2, 1, 0], 1, 1], ["AN", 1, 1, 6], ["PR", 4, 0, "auto_unroll_max_step$64"]]]], "r": [[6.96621e-06, 6.9659e-06, 6.96906e-06], 0, 9.12458, 1668099781], "v": "v0.6"}
{"i": [["[\"hfuse_gate_dot\", 1, 100, 16, 8, 2]", "cuda -keys=cuda,gpu -max_num_threads=1024 -model=unknown -thread_warp_size=32", [-1, 16, 64, 49152, 2147483647, 1024, 8, 32], "", 0, []], [[], [["SP", 2, 0, 1, [1, 1, 1, 1], 1], ["SP", 2, 5, 8, [1, 1, 1, 1], 1], ["SP", 2, 10, 2, [1, 1, 2, 1], 1], ["SP", 2, 15, 100, [1, 20], 1], ["RE", 2, [0, 5, 10, 1, 6, 11, 2, 7, 12, 15, 16, 3, 8, 13, 17, 4, 9, 14]], ["FSP", 4, 0, 0, 3], ["FSP", 4, 4, 1, 3], ["FSP", 4, 8, 2, 3], ["RE", 4, [0, 4, 8, 1, 5, 9, 2, 6, 10, 3, 7, 11]], ["CA", 2, 4, 8], ["CHR", 1, "shared", [2]], ["CA", 2, 3, 9], ["CHR", 0, "shared", [3]], ["CA", 1, 4, 9], ["FU", 6, [0, 1, 2]], ["AN", 6, 0, 5], ["FU", 6, [1, 2, 3]], ["AN", 6, 1, 4], ["FU", 6, [2, 3, 4]], ["AN", 6, 2, 6], ["FU", 3, [0, 1, 2]], ["SP", 3, 0, 20, [2], 1], ["AN", 3, 1, 2], ["FFSP", 3, 0, [2, 1, 0], 1, 1], ["AN", 3, 1, 6], ["FU", 1, [0, 1]], ["SP", 1, 0, 20, [1], 1], ["AN", 1, 1, 2], ["FFSP", 1, 0, [2, 1, 0], 1, 1], ["AN", 1, 1, 6], ["PR", 4, 0, "auto_unroll_max_step$16"]]]], "r": [[7.02068e-06, 7.02033e-06, 7.02142e-06], 0, 8.1927, 1668099780], "v": "v0.6"}
{"i": [["[\"hfuse_gate_dot\", 1, 100, 16, 8, 2]", "cuda -keys=cuda,gpu -max_num_threads=1024 -model=unknown -thread_warp_size=32", [-1, 16, 64, 49152, 2147483647, 1024, 8, 32], "", 0, []], [[], [["SP", 2, 0, 1, [1, 1, 1, 1], 1], ["SP", 2, 5, 8, [8, 1, 1, 1], 1], ["SP", 2, 10, 2, [1, 1, 2, 1], 1], ["SP", 2, 15, 100, [25, 4], 1], ["RE", 2, [0, 5, 10, 1, 6, 11, 2, 7, 12, 15, 16, 3, 8, 13, 17, 4, 9, 14]], ["FSP", 4, 0, 0, 3], ["FSP", 4, 4, 1, 3], ["FSP", 4, 8, 2, 3], ["RE", 4, [0, 4, 8, 1, 5, 9, 2, 6, 10, 3, 7, 11]], ["CA", 2, 4, 8], ["CHR", 1, "shared", [2]], ["CA", 2, 3, 9], ["CHR", 0, "shared", [3]], ["CA", 1, 4, 9], ["FU", 6, [0, 1, 2]], ["AN", 6, 0, 5], ["FU", 6, [1, 2, 3]], ["AN", 6, 1, 4], ["FU", 6, [2, 3, 4]], ["AN", 6, 2, 6], ["FU", 3, [0, 1, 2]], ["SP", 3, 0, 400, [1], 1], ["AN", 3, 1, 2], ["FFSP", 3, 0, [2, 1, 0], 1, 1], ["AN", 3, 1, 6], ["FU", 1, [0, 1]], ["SP", 1, 0, 100, [1], 1], ["AN", 1, 1, 2], ["FFSP", 1, 0, [2, 1, 0], 1, 1], ["AN", 1, 1, 6], ["PR", 4, 0, "auto_unroll_max_step$64"]]]], "r": [[1.80564e-05, 1.80556e-05, 1.80647e-05], 0, 7.9155, 1668099779], "v": "v0.6"}
{"i": [["[\"hfuse_gate_dot\", 1, 100, 16, 8, 2]", "cuda -keys=cuda,gpu -max_num_threads=1024 -model=unknown -thread_warp_size=32", [-1, 16, 64, 49152, 2147483647, 1024, 8, 32], "", 0, []], [[], [["SP", 2, 0, 1, [1, 1, 1, 1], 1], ["SP", 2, 5, 8, [1, 8, 1, 1], 1], ["SP", 2, 10, 2, [2, 1, 1, 1], 1], ["SP", 2, 15, 100, [1, 1], 1], ["RE", 2, [0, 5, 10, 1, 6, 11, 2, 7, 12, 15, 16, 3, 8, 13, 17, 4, 9, 14]], ["FSP", 4, 0, 0, 3], ["FSP", 4, 4, 1, 3], ["FSP", 4, 8, 2, 3], ["RE", 4, [0, 4, 8, 1, 5, 9, 2, 6, 10, 3, 7, 11]], ["CA", 2, 4, 8], ["CHR", 1, "shared", [2]], ["CA", 2, 3, 9], ["CHR", 0, "shared", [3]], ["CA", 1, 4, 9], ["FU", 6, [0, 1, 2]], ["AN", 6, 0, 5], ["FU", 6, [1, 2, 3]], ["AN", 6, 1, 4], ["FU", 6, [2, 3, 4]], ["AN", 6, 2, 6], ["FU", 3, [0, 1, 2]], ["SP", 3, 0, 2, [1], 1], ["AN", 3, 1, 2], ["FFSP", 3, 0, [2, 1, 0], 1, 1], ["AN", 3, 1, 6], ["FU", 1, [0, 1]], ["SP", 1, 0, 2, [1], 1], ["AN", 1, 1, 2], ["FFSP", 1, 0, [2, 1, 0], 1, 1], ["AN", 1, 1, 6], ["PR", 4, 0, "auto_unroll_max_step$64"]]]], "r": [[1.13709e-05, 1.137e-05, 1.137e-05], 0, 8.67688, 1668099780], "v": "v0.6"}
{"i": [["[\"hfuse_gate_dot\", 1, 100, 16, 8, 2]", "cuda -keys=cuda,gpu -max_num_threads=1024 -model=unknown -thread_warp_size=32", [-1, 16, 64, 49152, 2147483647, 1024, 8, 32], "", 0, []], [[], [["SP", 2, 0, 1, [1, 1, 1, 1], 1], ["SP", 2, 5, 8, [1, 4, 1, 2], 1], ["SP", 2, 10, 2, [1, 2, 1, 1], 1], ["SP", 2, 15, 100, [1, 1], 1], ["RE", 2, [0, 5, 10, 1, 6, 11, 2, 7, 12, 15, 16, 3, 8, 13, 17, 4, 9, 14]], ["FSP", 4, 0, 0, 3], ["FSP", 4, 4, 1, 3], ["FSP", 4, 8, 2, 3], ["RE", 4, [0, 4, 8, 1, 5, 9, 2, 6, 10, 3, 7, 11]], ["CA", 2, 4, 8], ["CHR", 1, "shared", [2]], ["CA", 2, 3, 9], ["CHR", 0, "shared", [3]], ["CA", 1, 4, 9], ["FU", 6, [0, 1, 2]], ["AN", 6, 0, 5], ["FU", 6, [1, 2, 3]], ["AN", 6, 1, 4], ["FU", 6, [2, 3, 4]], ["AN", 6, 2, 6], ["FU", 3, [0, 1, 2]], ["SP", 3, 0, 2, [1], 1], ["AN", 3, 1, 2], ["FFSP", 3, 0, [2, 1, 0], 1, 1], ["AN", 3, 1, 6], ["FU", 1, [0, 1]], ["SP", 1, 0, 1, [1], 1], ["AN", 1, 1, 2], ["FFSP", 1, 0, [2, 1, 0], 1, 1], ["AN", 1, 1, 6], ["PR", 4, 0, "auto_unroll_max_step$0"]]]], "r": [[1.11092e-05, 1.11085e-05, 1.11067e-05], 0, 6.9695, 1668099778], "v": "v0.6"}
{"i": [["[\"hfuse_gate_dot\", 1, 100, 16, 8, 2]", "cuda -keys=cuda,gpu -max_num_threads=1024 -model=unknown -thread_warp_size=32", [-1, 16, 64, 49152, 2147483647, 1024, 8, 32], "", 0, []], [[], [["SP", 2, 0, 1, [1, 1, 1, 1], 1], ["SP", 2, 5, 8, [1, 1, 2, 2], 1], ["SP", 2, 10, 2, [1, 1, 1, 1], 1], ["SP", 2, 15, 100, [25, 2], 1], ["RE", 2, [0, 5, 10, 1, 6, 11, 2, 7, 12, 15, 16, 3, 8, 13, 17, 4, 9, 14]], ["FSP", 4, 0, 0, 3], ["FSP", 4, 4, 1, 3], ["FSP", 4, 8, 2, 3], ["RE", 4, [0, 4, 8, 1, 5, 9, 2, 6, 10, 3, 7, 11]], ["CA", 2, 4, 8], ["CHR", 1, "shared", [2]], ["CA", 2, 3, 9], ["CHR", 0, "shared", [3]], ["CA", 1, 4, 9], ["FU", 6, [0, 1, 2]], ["AN", 6, 0, 5], ["FU", 6, [1, 2, 3]], ["AN", 6, 1, 4], ["FU", 6, [2, 3, 4]], ["AN", 6, 2, 6], ["FU", 3, [0, 1, 2]], ["SP", 3, 0, 400, [1], 1], ["AN", 3, 1, 2], ["FFSP", 3, 0, [2, 1, 0], 1, 1], ["AN", 3, 1, 6], ["FU", 1, [0, 1]], ["SP", 1, 0, 50, [1], 1], ["AN", 1, 1, 2], ["FFSP", 1, 0, [2, 1, 0], 1, 1], ["AN", 1, 1, 6], ["PR", 4, 0, "auto_unroll_max_step$64"]]]], "r": [[1.18345e-05, 1.18332e-05, 1.18319e-05], 0, 9.77253, 1668099781], "v": "v0.6"}
{"i": [["[\"hfuse_gate_dot\", 1, 100, 16, 8, 2]", "cuda -keys=cuda,gpu -max_num_threads=1024 -model=unknown -thread_warp_size=32", [-1, 16, 64, 49152, 2147483647, 1024, 8, 32], "", 0, []], [[], [["SP", 2, 0, 1, [1, 1, 1, 1], 1], ["SP", 2, 5, 8, [1, 8, 1, 1], 1], ["SP", 2, 10, 2, [1, 1, 1, 2], 1], ["SP", 2, 15, 100, [5, 20], 1], ["RE", 2, [0, 5, 10, 1, 6, 11, 2, 7, 12, 15, 16, 3, 8, 13, 17, 4, 9, 14]], ["FSP", 4, 0, 0, 3], ["FSP", 4, 4, 1, 3], ["FSP", 4, 8, 2, 3], ["RE", 4, [0, 4, 8, 1, 5, 9, 2, 6, 10, 3, 7, 11]], ["CA", 2, 4, 8], ["CHR", 1, "shared", [2]], ["CA", 2, 3, 9], ["CHR", 0, "shared", [3]], ["CA", 1, 4, 9], ["FU", 6, [0, 1, 2]], ["AN", 6, 0, 5], ["FU", 6, [1, 2, 3]], ["AN", 6, 1, 4], ["FU", 6, [2, 3, 4]], ["AN", 6, 2, 6], ["FU", 3, [0, 1, 2]], ["SP", 3, 0, 200, [1], 1], ["AN", 3, 1, 2], ["FFSP", 3, 0, [2, 1, 0], 1, 1], ["AN", 3, 1, 6], ["FU", 1, [0, 1]], ["SP", 1, 0, 100, [5], 1], ["AN", 1, 1, 2], ["FFSP", 1, 0, [2, 1, 0], 1, 1], ["AN", 1, 1, 6], ["PR", 4, 0, "auto_unroll_max_step$1024"]]]], "r": [[4.23076e-06, 4.23115e-06, 4.22739e-06], 0, 11.4233, 1668099783], "v": "v0.6"}
{"i": [["[\"hfuse_gate_dot\", 1, 100, 16, 8, 2]", "cuda -keys=cuda,gpu -max_num_threads=1024 -model=unknown -thread_warp_size=32", [-1, 16, 64, 49152, 2147483647, 1024, 8, 32], "", 0, []], [[], [["SP", 2, 0, 1, [1, 1, 1, 1], 1], ["SP", 2, 5, 8, [1, 1, 2, 2], 1], ["SP", 2, 10, 2, [1, 2, 1, 1], 1], ["SP", 2, 15, 100, [5, 20], 1], ["RE", 2, [0, 5, 10, 1, 6, 11, 2, 7, 12, 15, 16, 3, 8, 13, 17, 4, 9, 14]], ["FSP", 4, 0, 0, 3], ["FSP", 4, 4, 1, 3], ["FSP", 4, 8, 2, 3], ["RE", 4, [0, 4, 8, 1, 5, 9, 2, 6, 10, 3, 7, 11]], ["CA", 2, 4, 8], ["CHR", 1, "shared", [2]], ["CA", 2, 3, 9], ["CHR", 0, "shared", [3]], ["CA", 1, 4, 9], ["FU", 6, [0, 1, 2]], ["AN", 6, 0, 5], ["FU", 6, [1, 2, 3]], ["AN", 6, 1, 4], ["FU", 6, [2, 3, 4]], ["AN", 6, 2, 6], ["FU", 3, [0, 1, 2]], ["SP", 3, 0, 200, [1], 1], ["AN", 3, 1, 2], ["FFSP", 3, 0, [2, 1, 0], 1, 1], ["AN", 3, 1, 6], ["FU", 1, [0, 1]], ["SP", 1, 0, 100, [1], 1], ["AN", 1, 1, 2], ["FFSP", 1, 0, [2, 1, 0], 1, 1], ["AN", 1, 1, 6], ["PR", 4, 0, "auto_unroll_max_step$512"]]]], "r": [[7.49169e-06, 7.49317e-06, 7.49462e-06], 0, 11.1253, 1668099782], "v": "v0.6"}
{"i": [["[\"hfuse_gate_dot\", 1, 100, 16, 8, 2]", "cuda -keys=cuda,gpu -max_num_threads=1024 -model=unknown -thread_warp_size=32", [-1, 16, 64, 49152, 2147483647, 1024, 8, 32], "", 0, []], [[], [["SP", 2, 0, 1, [1, 1, 1, 1], 1], ["SP", 2, 5, 8, [1, 1, 1, 4], 1], ["SP", 2, 10, 2, [1, 2, 1, 1], 1], ["SP", 2, 15, 100, [2, 5], 1], ["RE", 2, [0, 5, 10, 1, 6, 11, 2, 7, 12, 15, 16, 3, 8, 13, 17, 4, 9, 14]], ["FSP", 4, 0, 0, 3], ["FSP", 4, 4, 1, 3], ["FSP", 4, 8, 2, 3], ["RE", 4, [0, 4, 8, 1, 5, 9, 2, 6, 10, 3, 7, 11]], ["CA", 2, 4, 8], ["CHR", 1, "shared", [2]], ["CA", 2, 3, 9], ["CHR", 0, "shared", [3]], ["CA", 1, 4, 9], ["FU", 6, [0, 1, 2]], ["AN", 6, 0, 5], ["FU", 6, [1, 2, 3]], ["AN", 6, 1, 4], ["FU", 6, [2, 3, 4]], ["AN", 6, 2, 6], ["FU", 3, [0, 1, 2]], ["SP", 3, 0, 40, [1], 1], ["AN", 3, 1, 2], ["FFSP", 3, 0, [2, 1, 0], 1, 1], ["AN", 3, 1, 6], ["FU", 1, [0, 1]], ["SP", 1, 0, 10, [1], 1], ["AN", 1, 1, 2], ["FFSP", 1, 0, [2, 1, 0], 1, 1], ["AN", 1, 1, 6], ["PR", 4, 0, "auto_unroll_max_step$0"]]]], "r": [[8.5562e-06, 8.60182e-06, 8.58878e-06], 0, 12.0287, 1668099784], "v": "v0.6"}
{"i": [["[\"hfuse_gate_dot\", 1, 100, 16, 8, 2]", "cuda -keys=cuda,gpu -max_num_threads=1024 -model=unknown -thread_warp_size=32", [-1, 16, 64, 49152, 2147483647, 1024, 8, 32], "", 0, []], [[], [["SP", 2, 0, 1, [1, 1, 1, 1], 1], ["SP", 2, 5, 8, [1, 4, 1, 1], 1], ["SP", 2, 10, 2, [1, 1, 1, 1], 1], ["SP", 2, 15, 100, [4, 5], 1], ["RE", 2, [0, 5, 10, 1, 6, 11, 2, 7, 12, 15, 16, 3, 8, 13, 17, 4, 9, 14]], ["FSP", 4, 0, 0, 3], ["FSP", 4, 4, 1, 3], ["FSP", 4, 8, 2, 3], ["RE", 4, [0, 4, 8, 1, 5, 9, 2, 6, 10, 3, 7, 11]], ["CA", 2, 4, 8], ["CHR", 1, "shared", [2]], ["CA", 2, 3, 9], ["CHR", 0, "shared", [3]], ["CA", 1, 4, 9], ["FU", 6, [0, 1, 2]], ["AN", 6, 0, 5], ["FU", 6, [1, 2, 3]], ["AN", 6, 1, 4], ["FU", 6, [2, 3, 4]], ["AN", 6, 2, 6], ["FU", 3, [0, 1, 2]], ["SP", 3, 0, 20, [1], 1], ["AN", 3, 1, 2], ["FFSP", 3, 0, [2, 1, 0], 1, 1], ["AN", 3, 1, 6], ["FU", 1, [0, 1]], ["SP", 1, 0, 20, [1], 1], ["AN", 1, 1, 2], ["FFSP", 1, 0, [2, 1, 0], 1, 1], ["AN", 1, 1, 6], ["PR", 4, 0, "auto_unroll_max_step$64"]]]], "r": [[3.79363e-06, 3.7919e-06, 3.79189e-06], 0, 11.5562, 1668099783], "v": "v0.6"}
{"i": [["[\"hfuse_gate_dot\", 1, 100, 16, 8, 2]", "cuda -keys=cuda,gpu -max_num_threads=1024 -model=unknown -thread_warp_size=32", [-1, 16, 64, 49152, 2147483647, 1024, 8, 32], "", 0, []], [[], [["SP", 2, 0, 1, [1, 1, 1, 1], 1], ["SP", 2, 5, 8, [1, 4, 1, 2], 1], ["SP", 2, 10, 2, [1, 2, 1, 1], 1], ["SP", 2, 15, 100, [50, 1], 1], ["RE", 2, [0, 5, 10, 1, 6, 11, 2, 7, 12, 15, 16, 3, 8, 13, 17, 4, 9, 14]], ["FSP", 4, 0, 0, 3], ["FSP", 4, 4, 1, 3], ["FSP", 4, 8, 2, 3], ["RE", 4, [0, 4, 8, 1, 5, 9, 2, 6, 10, 3, 7, 11]], ["CA", 2, 4, 8], ["CHR", 1, "shared", [2]], ["CA", 2, 3, 9], ["CHR", 0, "shared", [3]], ["CA", 1, 4, 9], ["FU", 6, [0, 1, 2]], ["AN", 6, 0, 5], ["FU", 6, [1, 2, 3]], ["AN", 6, 1, 4], ["FU", 6, [2, 3, 4]], ["AN", 6, 2, 6], ["FU", 3, [0, 1, 2]], ["SP", 3, 0, 100, [1], 1], ["AN", 3, 1, 2], ["FFSP", 3, 0, [2, 1, 0], 1, 1], ["AN", 3, 1, 6], ["FU", 1, [0, 1]], ["SP", 1, 0, 50, [1], 1], ["AN", 1, 1, 2], ["FFSP", 1, 0, [2, 1, 0], 1, 1], ["AN", 1, 1, 6], ["PR", 4, 0, "auto_unroll_max_step$64"]]]], "r": [[4.92455e-06, 4.92458e-06, 4.9242e-06], 0, 12.4133, 1668099784], "v": "v0.6"}
{"i": [["[\"hfuse_gate_dot\", 1, 100, 16, 8, 2]", "cuda -keys=cuda,gpu -max_num_threads=1024 -model=unknown -thread_warp_size=32", [-1, 16, 64, 49152, 2147483647, 1024, 8, 32], "", 0, []], [[], [["SP", 2, 0, 1, [1, 1, 1, 1], 1], ["SP", 2, 5, 8, [1, 8, 1, 1], 1], ["SP", 2, 10, 2, [1, 1, 1, 2], 1], ["SP", 2, 15, 100, [25, 2], 1], ["RE", 2, [0, 5, 10, 1, 6, 11, 2, 7, 12, 15, 16, 3, 8, 13, 17, 4, 9, 14]], ["FSP", 4, 0, 0, 3], ["FSP", 4, 4, 1, 3], ["FSP", 4, 8, 2, 3], ["RE", 4, [0, 4, 8, 1, 5, 9, 2, 6, 10, 3, 7, 11]], ["CA", 2, 4, 8], ["CHR", 1, "shared", [2]], ["CA", 2, 3, 9], ["CHR", 0, "shared", [3]], ["CA", 1, 4, 9], ["FU", 6, [0, 1, 2]], ["AN", 6, 0, 5], ["FU", 6, [1, 2, 3]], ["AN", 6, 1, 4], ["FU", 6, [2, 3, 4]], ["AN", 6, 2, 6], ["FU", 3, [0, 1, 2]], ["SP", 3, 0, 100, [1], 1], ["AN", 3, 1, 2], ["FFSP", 3, 0, [2, 1, 0], 1, 1], ["AN", 3, 1, 6], ["FU", 1, [0, 1]], ["SP", 1, 0, 50, [1], 1], ["AN", 1, 1, 2], ["FFSP", 1, 0, [2, 1, 0], 1, 1], ["AN", 1, 1, 6], ["PR", 4, 0, "auto_unroll_max_step$512"]]]], "r": [[4.69826e-06, 4.69809e-06, 4.69774e-06], 0, 14.9926, 1668099786], "v": "v0.6"}
{"i": [["[\"hfuse_gate_dot\", 1, 100, 16, 8, 2]", "cuda -keys=cuda,gpu -max_num_threads=1024 -model=unknown -thread_warp_size=32", [-1, 16, 64, 49152, 2147483647, 1024, 8, 32], "", 0, []], [[], [["SP", 2, 0, 1, [1, 1, 1, 1], 1], ["SP", 2, 5, 8, [1, 2, 1, 1], 1], ["SP", 2, 10, 2, [1, 2, 1, 1], 1], ["SP", 2, 15, 100, [5, 1], 1], ["RE", 2, [0, 5, 10, 1, 6, 11, 2, 7, 12, 15, 16, 3, 8, 13, 17, 4, 9, 14]], ["FSP", 4, 0, 0, 3], ["FSP", 4, 4, 1, 3], ["FSP", 4, 8, 2, 3], ["RE", 4, [0, 4, 8, 1, 5, 9, 2, 6, 10, 3, 7, 11]], ["CA", 2, 4, 8], ["CHR", 1, "shared", [2]], ["CA", 2, 3, 9], ["CHR", 0, "shared", [3]], ["CA", 1, 4, 9], ["FU", 6, [0, 1, 2]], ["AN", 6, 0, 5], ["FU", 6, [1, 2, 3]], ["AN", 6, 1, 4], ["FU", 6, [2, 3, 4]], ["AN", 6, 2, 6], ["FU", 3, [0, 1, 2]], ["SP", 3, 0, 5, [1], 1], ["AN", 3, 1, 2], ["FFSP", 3, 0, [2, 1, 0], 1, 1], ["AN", 3, 1, 6], ["FU", 1, [0, 1]], ["SP", 1, 0, 5, [1], 1], ["AN", 1, 1, 2], ["FFSP", 1, 0, [2, 1, 0], 1, 1], ["AN", 1, 1, 6], ["PR", 4, 0, "auto_unroll_max_step$512"]]]], "r": [[4.44997e-06, 4.45009e-06, 4.45214e-06], 0, 14.2465, 1668099786], "v": "v0.6"}
{"i": [["[\"hfuse_gate_dot\", 1, 100, 16, 8, 2]", "cuda -keys=cuda,gpu -max_num_threads=1024 -model=unknown -thread_warp_size=32", [-1, 16, 64, 49152, 2147483647, 1024, 8, 32], "", 0, []], [[], [["SP", 2, 0, 1, [1, 1, 1, 1], 1], ["SP", 2, 5, 8, [1, 8, 1, 1], 1], ["SP", 2, 10, 2, [1, 2, 1, 1], 1], ["SP", 2, 15, 100, [4, 1], 1], ["RE", 2, [0, 5, 10, 1, 6, 11, 2, 7, 12, 15, 16, 3, 8, 13, 17, 4, 9, 14]], ["FSP", 4, 0, 0, 3], ["FSP", 4, 4, 1, 3], ["FSP", 4, 8, 2, 3], ["RE", 4, [0, 4, 8, 1, 5, 9, 2, 6, 10, 3, 7, 11]], ["CA", 2, 4, 8], ["CHR", 1, "shared", [2]], ["CA", 2, 3, 9], ["CHR", 0, "shared", [3]], ["CA", 1, 4, 9], ["FU", 6, [0, 1, 2]], ["AN", 6, 0, 5], ["FU", 6, [1, 2, 3]], ["AN", 6, 1, 4], ["FU", 6, [2, 3, 4]], ["AN", 6, 2, 6], ["FU", 3, [0, 1, 2]], ["SP", 3, 0, 4, [2], 1], ["AN", 3, 1, 2], ["FFSP", 3, 0, [2, 1, 0], 1, 1], ["AN", 3, 1, 6], ["FU", 1, [0, 1]], ["SP", 1, 0, 4, [1], 1], ["AN", 1, 1, 2], ["FFSP", 1, 0, [2, 1, 0], 1, 1], ["AN", 1, 1, 6], ["PR", 4, 0, "auto_unroll_max_step$512"]]]], "r": [[4.17662e-06, 4.17775e-06, 4.17733e-06], 0, 9.46784, 1668099781], "v": "v0.6"}
{"i": [["[\"hfuse_gate_dot\", 1, 100, 16, 8, 2]", "cuda -keys=cuda,gpu -max_num_threads=1024 -model=unknown -thread_warp_size=32", [-1, 16, 64, 49152, 2147483647, 1024, 8, 32], "", 0, []], [[], [["SP", 2, 0, 1, [1, 1, 1, 1], 1], ["SP", 2, 5, 8, [1, 2, 1, 4], 1], ["SP", 2, 10, 2, [1, 2, 1, 1], 1], ["SP", 2, 15, 100, [100, 1], 1], ["RE", 2, [0, 5, 10, 1, 6, 11, 2, 7, 12, 15, 16, 3, 8, 13, 17, 4, 9, 14]], ["FSP", 4, 0, 0, 3], ["FSP", 4, 4, 1, 3], ["FSP", 4, 8, 2, 3], ["RE", 4, [0, 4, 8, 1, 5, 9, 2, 6, 10, 3, 7, 11]], ["CA", 2, 4, 8], ["CHR", 1, "shared", [2]], ["CA", 2, 3, 9], ["CHR", 0, "shared", [3]], ["CA", 1, 4, 9], ["FU", 6, [0, 1, 2]], ["AN", 6, 0, 5], ["FU", 6, [1, 2, 3]], ["AN", 6, 1, 4], ["FU", 6, [2, 3, 4]], ["AN", 6, 2, 6], ["FU", 3, [0, 1, 2]], ["SP", 3, 0, 64, [4], 1], ["AN", 3, 1, 2], ["FFSP", 3, 0, [2, 1, 0], 1, 1], ["AN", 3, 1, 6], ["FU", 1, [0, 1]], ["SP", 1, 0, 4, [1], 1], ["AN", 1, 1, 2], ["FFSP", 1, 0, [2, 1, 0], 1, 1], ["AN", 1, 1, 6], ["PR", 4, 0, "auto_unroll_max_step$1024"]]]], "r": [[5.33656e-06, 5.33643e-06, 5.33607e-06], 0, 16.9042, 1668099788], "v": "v0.6"}
{"i": [["[\"hfuse_gate_dot\", 1, 100, 16, 8, 2]", "cuda -keys=cuda,gpu -max_num_threads=1024 -model=unknown -thread_warp_size=32", [-1, 16, 64, 49152, 2147483647, 1024, 8, 32], "", 0, []], [[], [["SP", 2, 0, 1, [1, 1, 1, 1], 1], ["SP", 2, 5, 8, [2, 1, 1, 2], 1], ["SP", 2, 10, 2, [2, 1, 1, 1], 1], ["SP", 2, 15, 100, [4, 5], 1], ["RE", 2, [0, 5, 10, 1, 6, 11, 2, 7, 12, 15, 16, 3, 8, 13, 17, 4, 9, 14]], ["FSP", 4, 0, 0, 3], ["FSP", 4, 4, 1, 3], ["FSP", 4, 8, 2, 3], ["RE", 4, [0, 4, 8, 1, 5, 9, 2, 6, 10, 3, 7, 11]], ["CA", 2, 4, 8], ["CHR", 1, "shared", [2]], ["CA", 2, 3, 9], ["CHR", 0, "shared", [3]], ["CA", 1, 4, 9], ["FU", 6, [0, 1, 2]], ["AN", 6, 0, 5], ["FU", 6, [1, 2, 3]], ["AN", 6, 1, 4], ["FU", 6, [2, 3, 4]], ["AN", 6, 2, 6], ["FU", 3, [0, 1, 2]], ["SP", 3, 0, 40, [1], 1], ["AN", 3, 1, 2], ["FFSP", 3, 0, [2, 1, 0], 1, 1], ["AN", 3, 1, 6], ["FU", 1, [0, 1]], ["SP", 1, 0, 20, [4], 1], ["AN", 1, 1, 2], ["FFSP", 1, 0, [2, 1, 0], 1, 1], ["AN", 1, 1, 6], ["PR", 4, 0, "auto_unroll_max_step$0"]]]], "r": [[1.41271e-05, 1.41264e-05, 1.41294e-05], 0, 15.9175, 1668099787], "v": "v0.6"}
{"i": [["[\"hfuse_gate_dot\", 1, 100, 16, 8, 2]", "cuda -keys=cuda,gpu -max_num_threads=1024 -model=unknown -thread_warp_size=32", [-1, 16, 64, 49152, 2147483647, 1024, 8, 32], "", 0, []], [[], [["SP", 2, 0, 1, [1, 1, 1, 1], 1], ["SP", 2, 5, 8, [1, 4, 1, 1], 1], ["SP", 2, 10, 2, [1, 1, 1, 1], 1], ["SP", 2, 15, 100, [5, 2], 1], ["RE", 2, [0, 5, 10, 1, 6, 11, 2, 7, 12, 15, 16, 3, 8, 13, 17, 4, 9, 14]], ["FSP", 4, 0, 0, 3], ["FSP", 4, 4, 1, 3], ["FSP", 4, 8, 2, 3], ["RE", 4, [0, 4, 8, 1, 5, 9, 2, 6, 10, 3, 7, 11]], ["CA", 2, 4, 8], ["CHR", 1, "shared", [2]], ["CA", 2, 3, 9], ["CHR", 0, "shared", [3]], ["CA", 1, 4, 9], ["FU", 6, [0, 1, 2]], ["AN", 6, 0, 5], ["FU", 6, [1, 2, 3]], ["AN", 6, 1, 4], ["FU", 6, [2, 3, 4]], ["AN", 6, 2, 6], ["FU", 3, [0, 1, 2]], ["SP", 3, 0, 20, [1], 1], ["AN", 3, 1, 2], ["FFSP", 3, 0, [2, 1, 0], 1, 1], ["AN", 3, 1, 6], ["FU", 1, [0, 1]], ["SP", 1, 0, 10, [2], 1], ["AN", 1, 1, 2], ["FFSP", 1, 0, [2, 1, 0], 1, 1], ["AN", 1, 1, 6], ["PR", 4, 0, "auto_unroll_max_step$16"]]]], "r": [[4.26156e-06, 4.2616e-06, 4.26374e-06], 0, 11.3986, 1668099783], "v": "v0.6"}
{"i": [["[\"hfuse_gate_dot\", 1, 100, 16, 8, 2]", "cuda -keys=cuda,gpu -max_num_threads=1024 -model=unknown -thread_warp_size=32", [-1, 16, 64, 49152, 2147483647, 1024, 8, 32], "", 0, []], [[], [["SP", 2, 0, 1, [1, 1, 1, 1], 1], ["SP", 2, 5, 8, [8, 1, 1, 1], 1], ["SP", 2, 10, 2, [1, 1, 1, 1], 1], ["SP", 2, 15, 100, [1, 1], 1], ["RE", 2, [0, 5, 10, 1, 6, 11, 2, 7, 12, 15, 16, 3, 8, 13, 17, 4, 9, 14]], ["FSP", 4, 0, 0, 3], ["FSP", 4, 4, 1, 3], ["FSP", 4, 8, 2, 3], ["RE", 4, [0, 4, 8, 1, 5, 9, 2, 6, 10, 3, 7, 11]], ["CA", 2, 4, 8], ["CHR", 1, "shared", [2]], ["CA", 2, 3, 9], ["CHR", 0, "shared", [3]], ["CA", 1, 4, 9], ["FU", 6, [0, 1, 2]], ["AN", 6, 0, 5], ["FU", 6, [1, 2, 3]], ["AN", 6, 1, 4], ["FU", 6, [2, 3, 4]], ["AN", 6, 2, 6], ["FU", 3, [0, 1, 2]], ["SP", 3, 0, 1, [1], 1], ["AN", 3, 1, 2], ["FFSP", 3, 0, [2, 1, 0], 1, 1], ["AN", 3, 1, 6], ["FU", 1, [0, 1]], ["SP", 1, 0, 1, [1], 1], ["AN", 1, 1, 2], ["FFSP", 1, 0, [2, 1, 0], 1, 1], ["AN", 1, 1, 6], ["PR", 4, 0, "auto_unroll_max_step$512"]]]], "r": [[1.95525e-05, 1.95871e-05, 1.95418e-05], 0, 12.7121, 1668099784], "v": "v0.6"}
{"i": [["[\"hfuse_gate_dot\", 1, 100, 16, 8, 2]", "cuda -keys=cuda,gpu -max_num_threads=1024 -model=unknown -thread_warp_size=32", [-1, 16, 64, 49152, 2147483647, 1024, 8, 32], "", 0, []], [[], [["SP", 2, 0, 1, [1, 1, 1, 1], 1], ["SP", 2, 5, 8, [1, 4, 1, 1], 1], ["SP", 2, 10, 2, [2, 1, 1, 1], 1], ["SP", 2, 15, 100, [5, 4], 1], ["RE", 2, [0, 5, 10, 1, 6, 11, 2, 7, 12, 15, 16, 3, 8, 13, 17, 4, 9, 14]], ["FSP", 4, 0, 0, 3], ["FSP", 4, 4, 1, 3], ["FSP", 4, 8, 2, 3], ["RE", 4, [0, 4, 8, 1, 5, 9, 2, 6, 10, 3, 7, 11]], ["CA", 2, 4, 8], ["CHR", 1, "shared", [2]], ["CA", 2, 3, 9], ["CHR", 0, "shared", [3]], ["CA", 1, 4, 9], ["FU", 6, [0, 1, 2]], ["AN", 6, 0, 5], ["FU", 6, [1, 2, 3]], ["AN", 6, 1, 4], ["FU", 6, [2, 3, 4]], ["AN", 6, 2, 6], ["FU", 3, [0, 1, 2]], ["SP", 3, 0, 40, [1], 1], ["AN", 3, 1, 2], ["FFSP", 3, 0, [2, 1, 0], 1, 1], ["AN", 3, 1, 6], ["FU", 1, [0, 1]], ["SP", 1, 0, 20, [1], 1], ["AN", 1, 1, 2], ["FFSP", 1, 0, [2, 1, 0], 1, 1], ["AN", 1, 1, 6], ["PR", 4, 0, "auto_unroll_max_step$16"]]]], "r": [[9.62158e-06, 9.61844e-06, 9.62142e-06], 0, 16.7193, 1668099788], "v": "v0.6"}
{"i": [["[\"hfuse_gate_dot\", 1, 100, 16, 8, 2]", "cuda -keys=cuda,gpu -max_num_threads=1024 -model=unknown -thread_warp_size=32", [-1, 16, 64, 49152, 2147483647, 1024, 8, 32], "", 0, []], [[], [["SP", 2, 0, 1, [1, 1, 1, 1], 1], ["SP", 2, 5, 8, [1, 4, 1, 2], 1], ["SP", 2, 10, 2, [1, 2, 1, 1], 1], ["SP", 2, 15, 100, [25, 4], 1], ["RE", 2, [0, 5, 10, 1, 6, 11, 2, 7, 12, 15, 16, 3, 8, 13, 17, 4, 9, 14]], ["FSP", 4, 0, 0, 3], ["FSP", 4, 4, 1, 3], ["FSP", 4, 8, 2, 3], ["RE", 4, [0, 4, 8, 1, 5, 9, 2, 6, 10, 3, 7, 11]], ["CA", 2, 4, 8], ["CHR", 1, "shared", [2]], ["CA", 2, 3, 9], ["CHR", 0, "shared", [3]], ["CA", 1, 4, 9], ["FU", 6, [0, 1, 2]], ["AN", 6, 0, 5], ["FU", 6, [1, 2, 3]], ["AN", 6, 1, 4], ["FU", 6, [2, 3, 4]], ["AN", 6, 2, 6], ["FU", 3, [0, 1, 2]], ["SP", 3, 0, 200, [4], 1], ["AN", 3, 1, 2], ["FFSP", 3, 0, [2, 1, 0], 1, 1], ["AN", 3, 1, 6], ["FU", 1, [0, 1]], ["SP", 1, 0, 100, [1], 1], ["AN", 1, 1, 2], ["FFSP", 1, 0, [2, 1, 0], 1, 1], ["AN", 1, 1, 6], ["PR", 4, 0, "auto_unroll_max_step$1024"]]]], "r": [[3.9185e-06, 3.91595e-06, 3.91882e-06], 0, 17.0641, 1668099789], "v": "v0.6"}
{"i": [["[\"hfuse_gate_dot\", 1, 100, 16, 8, 2]", "cuda -keys=cuda,gpu -max_num_threads=1024 -model=unknown -thread_warp_size=32", [-1, 16, 64, 49152, 2147483647, 1024, 8, 32], "", 0, []], [[], [["SP", 2, 0, 1, [1, 1, 1, 1], 1], ["SP", 2, 5, 8, [1, 2, 1, 1], 1], ["SP", 2, 10, 2, [2, 1, 1, 1], 1], ["SP", 2, 15, 100, [25, 2], 1], ["RE", 2, [0, 5, 10, 1, 6, 11, 2, 7, 12, 15, 16, 3, 8, 13, 17, 4, 9, 14]], ["FSP", 4, 0, 0, 3], ["FSP", 4, 4, 1, 3], ["FSP", 4, 8, 2, 3], ["RE", 4, [0, 4, 8, 1, 5, 9, 2, 6, 10, 3, 7, 11]], ["CA", 2, 4, 8], ["CHR", 1, "shared", [2]], ["CA", 2, 3, 9], ["CHR", 0, "shared", [3]], ["CA", 1, 4, 9], ["FU", 6, [0, 1, 2]], ["AN", 6, 0, 5], ["FU", 6, [1, 2, 3]], ["AN", 6, 1, 4], ["FU", 6, [2, 3, 4]], ["AN", 6, 2, 6], ["FU", 3, [0, 1, 2]], ["SP", 3, 0, 50, [1], 1], ["AN", 3, 1, 2], ["FFSP", 3, 0, [2, 1, 0], 1, 1], ["AN", 3, 1, 6], ["FU", 1, [0, 1]], ["SP", 1, 0, 50, [1], 1], ["AN", 1, 1, 2], ["FFSP", 1, 0, [2, 1, 0], 1, 1], ["AN", 1, 1, 6], ["PR", 4, 0, "auto_unroll_max_step$64"]]]], "r": [[8.60838e-06, 8.60745e-06, 8.60616e-06], 0, 14.4314, 1668099786], "v": "v0.6"}
{"i": [["[\"hfuse_gate_dot\", 1, 100, 16, 8, 2]", "cuda -keys=cuda,gpu -max_num_threads=1024 -model=unknown -thread_warp_size=32", [-1, 16, 64, 49152, 2147483647, 1024, 8, 32], "", 0, []], [[], [["SP", 2, 0, 1, [1, 1, 1, 1], 1], ["SP", 2, 5, 8, [1, 1, 1, 2], 1], ["SP", 2, 10, 2, [1, 1, 1, 2], 1], ["SP", 2, 15, 100, [5, 5], 1], ["RE", 2, [0, 5, 10, 1, 6, 11, 2, 7, 12, 15, 16, 3, 8, 13, 17, 4, 9, 14]], ["FSP", 4, 0, 0, 3], ["FSP", 4, 4, 1, 3], ["FSP", 4, 8, 2, 3], ["RE", 4, [0, 4, 8, 1, 5, 9, 2, 6, 10, 3, 7, 11]], ["CA", 2, 4, 8], ["CHR", 1, "shared", [2]], ["CA", 2, 3, 9], ["CHR", 0, "shared", [3]], ["CA", 1, 4, 9], ["FU", 6, [0, 1, 2]], ["AN", 6, 0, 5], ["FU", 6, [1, 2, 3]], ["AN", 6, 1, 4], ["FU", 6, [2, 3, 4]], ["AN", 6, 2, 6], ["FU", 3, [0, 1, 2]], ["SP", 3, 0, 50, [1], 1], ["AN", 3, 1, 2], ["FFSP", 3, 0, [2, 1, 0], 1, 1], ["AN", 3, 1, 6], ["FU", 1, [0, 1]], ["SP", 1, 0, 25, [1], 1], ["AN", 1, 1, 2], ["FFSP", 1, 0, [2, 1, 0], 1, 1], ["AN", 1, 1, 6], ["PR", 4, 0, "auto_unroll_max_step$64"]]]], "r": [[1.27151e-05, 1.27161e-05, 1.27168e-05], 0, 13.2269, 1668099785], "v": "v0.6"}
{"i": [["[\"hfuse_gate_dot\", 1, 100, 16, 8, 2]", "cuda -keys=cuda,gpu -max_num_threads=1024 -model=unknown -thread_warp_size=32", [-1, 16, 64, 49152, 2147483647, 1024, 8, 32], "", 0, []], [[], [["SP", 2, 0, 1, [1, 1, 1, 1], 1], ["SP", 2, 5, 8, [1, 1, 8, 1], 1], ["SP", 2, 10, 2, [1, 1, 1, 1], 1], ["SP", 2, 15, 100, [10, 5], 1], ["RE", 2, [0, 5, 10, 1, 6, 11, 2, 7, 12, 15, 16, 3, 8, 13, 17, 4, 9, 14]], ["FSP", 4, 0, 0, 3], ["FSP", 4, 4, 1, 3], ["FSP", 4, 8, 2, 3], ["RE", 4, [0, 4, 8, 1, 5, 9, 2, 6, 10, 3, 7, 11]], ["CA", 2, 4, 8], ["CHR", 1, "shared", [2]], ["CA", 2, 3, 9], ["CHR", 0, "shared", [3]], ["CA", 1, 4, 9], ["FU", 6, [0, 1, 2]], ["AN", 6, 0, 5], ["FU", 6, [1, 2, 3]], ["AN", 6, 1, 4], ["FU", 6, [2, 3, 4]], ["AN", 6, 2, 6], ["FU", 3, [0, 1, 2]], ["SP", 3, 0, 800, [1], 1], ["AN", 3, 1, 2], ["FFSP", 3, 0, [2, 1, 0], 1, 1], ["AN", 3, 1, 6], ["FU", 1, [0, 1]], ["SP", 1, 0, 50, [1], 1], ["AN", 1, 1, 2], ["FFSP", 1, 0, [2, 1, 0], 1, 1], ["AN", 1, 1, 6], ["PR", 4, 0, "auto_unroll_max_step$1024"]]]], "r": [[1.98006e-05, 1.98049e-05, 1.98014e-05], 0, 16.062, 1668099787], "v": "v0.6"}
{"i": [["[\"hfuse_gate_dot\", 1, 100, 16, 8, 2]", "cuda -keys=cuda,gpu -max_num_threads=1024 -model=unknown -thread_warp_size=32", [-1, 16, 64, 49152, 2147483647, 1024, 8, 32], "", 0, []], [[], [["SP", 2, 0, 1, [1, 1, 1, 1], 1], ["SP", 2, 5, 8, [1, 2, 2, 2], 1], ["SP", 2, 10, 2, [1, 2, 1, 1], 1], ["SP", 2, 15, 100, [5, 4], 1], ["RE", 2, [0, 5, 10, 1, 6, 11, 2, 7, 12, 15, 16, 3, 8, 13, 17, 4, 9, 14]], ["FSP", 4, 0, 0, 3], ["FSP", 4, 4, 1, 3], ["FSP", 4, 8, 2, 3], ["RE", 4, [0, 4, 8, 1, 5, 9, 2, 6, 10, 3, 7, 11]], ["CA", 2, 4, 8], ["CHR", 1, "shared", [2]], ["CA", 2, 3, 9], ["CHR", 0, "shared", [3]], ["CA", 1, 4, 9], ["FU", 6, [0, 1, 2]], ["AN", 6, 0, 5], ["FU", 6, [1, 2, 3]], ["AN", 6, 1, 4], ["FU", 6, [2, 3, 4]], ["AN", 6, 2, 6], ["FU", 3, [0, 1, 2]], ["SP", 3, 0, 400, [2], 1], ["AN", 3, 1, 2], ["FFSP", 3, 0, [2, 1, 0], 1, 1], ["AN", 3, 1, 6], ["FU", 1, [0, 1]], ["SP", 1, 0, 100, [1], 1], ["AN", 1, 1, 2], ["FFSP", 1, 0, [2, 1, 0], 1, 1], ["AN", 1, 1, 6], ["PR", 4, 0, "auto_unroll_max_step$512"]]]], "r": [[6.75239e-06, 6.75196e-06, 6.75231e-06], 0, 17.3863, 1668099789], "v": "v0.6"}
