python/models/mmoe/kernel_configs/MMoE_select_expert_1_100_16_8_2
{"i": [["[\"select_expert\", 1, 100, 16, 8, 2]", "cuda -keys=cuda,gpu -max_num_threads=1024 -model=unknown -thread_warp_size=32", [-1, 16, 64, 49152, 2147483647, 1024, 8, 32], "", 0, []], [[], [["FU", 1, [0, 1, 2]], ["AN", 1, 0, 6], ["PR", 1, 0, "auto_unroll_max_step$512"]]]], "r": [[2.36095e-06, 2.35926e-06, 2.35859e-06], 0, 1.47345, 1668098259], "v": "v0.6"}
{"i": [["[\"select_expert\", 1, 100, 16, 8, 2]", "cuda -keys=cuda,gpu -max_num_threads=1024 -model=unknown -thread_warp_size=32", [-1, 16, 64, 49152, 2147483647, 1024, 8, 32], "", 0, []], [[], [["FU", 1, [0, 1, 2]], ["AN", 1, 0, 6], ["PR", 1, 0, "auto_unroll_max_step$1024"]]]], "r": [[2.38852e-06, 2.40997e-06, 2.40554e-06], 0, 1.12845, 1668098259], "v": "v0.6"}
{"i": [["[\"select_expert\", 1, 100, 16, 8, 2]", "cuda -keys=cuda,gpu -max_num_threads=1024 -model=unknown -thread_warp_size=32", [-1, 16, 64, 49152, 2147483647, 1024, 8, 32], "", 0, []], [[], [["FU", 1, [0, 1, 2]], ["AN", 1, 0, 6], ["PR", 1, 0, "auto_unroll_max_step$16"]]]], "r": [[2.35985e-06, 2.34849e-06, 2.35112e-06], 0, 0.533719, 1668098258], "v": "v0.6"}
{"i": [["[\"select_expert\", 1, 100, 16, 8, 2]", "cuda -keys=cuda,gpu -max_num_threads=1024 -model=unknown -thread_warp_size=32", [-1, 16, 64, 49152, 2147483647, 1024, 8, 32], "", 0, []], [[], [["FU", 1, [0, 1, 2]], ["AN", 1, 0, 6], ["PR", 1, 0, "auto_unroll_max_step$0"]]]], "r": [[2.39913e-06, 2.41133e-06, 2.41921e-06], 0, 0.821119, 1668098258], "v": "v0.6"}
{"i": [["[\"select_expert\", 1, 100, 16, 8, 2]", "cuda -keys=cuda,gpu -max_num_threads=1024 -model=unknown -thread_warp_size=32", [-1, 16, 64, 49152, 2147483647, 1024, 8, 32], "", 0, []], [[], [["FU", 1, [0, 1, 2]], ["AN", 1, 0, 6], ["PR", 1, 0, "auto_unroll_max_step$64"]]]], "r": [[2.35765e-06, 2.37924e-06, 2.38118e-06], 0, 1.78863, 1668098259], "v": "v0.6"}
{"i": [["[\"select_expert\", 1, 100, 16, 8, 2]", "cuda -keys=cuda,gpu -max_num_threads=1024 -model=unknown -thread_warp_size=32", [-1, 16, 64, 49152, 2147483647, 1024, 8, 32], "", 0, []], [[], [["FU", 1, [0, 1, 2]], ["AN", 1, 0, 6], ["PR", 1, 0, "auto_unroll_max_step$512"]]]], "r": [[2.33462e-06, 2.31834e-06, 2.31809e-06], 0, 0.806047, 1668098481], "v": "v0.6"}
{"i": [["[\"select_expert\", 1, 100, 16, 8, 2]", "cuda -keys=cuda,gpu -max_num_threads=1024 -model=unknown -thread_warp_size=32", [-1, 16, 64, 49152, 2147483647, 1024, 8, 32], "", 0, []], [[], [["FU", 1, [0, 1, 2]], ["AN", 1, 0, 6], ["PR", 1, 0, "auto_unroll_max_step$64"]]]], "r": [[2.36579e-06, 2.37327e-06, 2.38746e-06], 0, 1.75938, 1668098482], "v": "v0.6"}
{"i": [["[\"select_expert\", 1, 100, 16, 8, 2]", "cuda -keys=cuda,gpu -max_num_threads=1024 -model=unknown -thread_warp_size=32", [-1, 16, 64, 49152, 2147483647, 1024, 8, 32], "", 0, []], [[], [["FU", 1, [0, 1, 2]], ["AN", 1, 0, 6], ["PR", 1, 0, "auto_unroll_max_step$0"]]]], "r": [[2.34553e-06, 2.3364e-06, 2.33604e-06], 0, 1.11699, 1668098482], "v": "v0.6"}
{"i": [["[\"select_expert\", 1, 100, 16, 8, 2]", "cuda -keys=cuda,gpu -max_num_threads=1024 -model=unknown -thread_warp_size=32", [-1, 16, 64, 49152, 2147483647, 1024, 8, 32], "", 0, []], [[], [["FU", 1, [0, 1, 2]], ["AN", 1, 0, 6], ["PR", 1, 0, "auto_unroll_max_step$1024"]]]], "r": [[2.35772e-06, 2.29714e-06, 2.30353e-06], 0, 1.46456, 1668098482], "v": "v0.6"}
{"i": [["[\"select_expert\", 1, 100, 16, 8, 2]", "cuda -keys=cuda,gpu -max_num_threads=1024 -model=unknown -thread_warp_size=32", [-1, 16, 64, 49152, 2147483647, 1024, 8, 32], "", 0, []], [[], [["FU", 1, [0, 1, 2]], ["AN", 1, 0, 6], ["PR", 1, 0, "auto_unroll_max_step$16"]]]], "r": [[2.35249e-06, 2.32335e-06, 2.33811e-06], 0, 0.492548, 1668098481], "v": "v0.6"}
{"i": [["[\"select_expert\", 1, 100, 16, 8, 2]", "cuda -keys=cuda,gpu -max_num_threads=1024 -model=unknown -thread_warp_size=32", [-1, 16, 64, 49152, 2147483647, 1024, 8, 32], "", 0, []], [[], [["FU", 1, [0, 1, 2]], ["AN", 1, 0, 6], ["PR", 1, 0, "auto_unroll_max_step$64"]]]], "r": [[2.37519e-06, 2.29953e-06, 2.30693e-06], 0, 0.497149, 1668099385], "v": "v0.6"}
{"i": [["[\"select_expert\", 1, 100, 16, 8, 2]", "cuda -keys=cuda,gpu -max_num_threads=1024 -model=unknown -thread_warp_size=32", [-1, 16, 64, 49152, 2147483647, 1024, 8, 32], "", 0, []], [[], [["FU", 1, [0, 1, 2]], ["AN", 1, 0, 6], ["PR", 1, 0, "auto_unroll_max_step$1024"]]]], "r": [[2.34694e-06, 2.29192e-06, 2.31344e-06], 0, 0.802814, 1668099385], "v": "v0.6"}
{"i": [["[\"select_expert\", 1, 100, 16, 8, 2]", "cuda -keys=cuda,gpu -max_num_threads=1024 -model=unknown -thread_warp_size=32", [-1, 16, 64, 49152, 2147483647, 1024, 8, 32], "", 0, []], [[], [["FU", 1, [0, 1, 2]], ["AN", 1, 0, 6], ["PR", 1, 0, "auto_unroll_max_step$16"]]]], "r": [[2.37543e-06, 2.39998e-06, 2.4039e-06], 0, 1.4631, 1668099386], "v": "v0.6"}
{"i": [["[\"select_expert\", 1, 100, 16, 8, 2]", "cuda -keys=cuda,gpu -max_num_threads=1024 -model=unknown -thread_warp_size=32", [-1, 16, 64, 49152, 2147483647, 1024, 8, 32], "", 0, []], [[], [["FU", 1, [0, 1, 2]], ["AN", 1, 0, 6], ["PR", 1, 0, "auto_unroll_max_step$0"]]]], "r": [[2.37347e-06, 2.40955e-06, 2.40128e-06], 0, 1.10712, 1668099385], "v": "v0.6"}
{"i": [["[\"select_expert\", 1, 100, 16, 8, 2]", "cuda -keys=cuda,gpu -max_num_threads=1024 -model=unknown -thread_warp_size=32", [-1, 16, 64, 49152, 2147483647, 1024, 8, 32], "", 0, []], [[], [["FU", 1, [0, 1, 2]], ["AN", 1, 0, 6], ["PR", 1, 0, "auto_unroll_max_step$512"]]]], "r": [[2.38445e-06, 2.29712e-06, 2.29609e-06], 0, 1.76112, 1668099386], "v": "v0.6"}
{"i": [["[\"select_expert\", 1, 100, 16, 8, 2]", "cuda -keys=cuda,gpu -max_num_threads=1024 -model=unknown -thread_warp_size=32", [-1, 16, 64, 49152, 2147483647, 1024, 8, 32], "", 0, []], [[], [["FU", 1, [0, 1, 2]], ["AN", 1, 0, 6], ["PR", 1, 0, "auto_unroll_max_step$0"]]]], "r": [[2.33965e-06, 2.32214e-06, 2.30043e-06], 0, 1.13158, 1668099887], "v": "v0.6"}
{"i": [["[\"select_expert\", 1, 100, 16, 8, 2]", "cuda -keys=cuda,gpu -max_num_threads=1024 -model=unknown -thread_warp_size=32", [-1, 16, 64, 49152, 2147483647, 1024, 8, 32], "", 0, []], [[], [["FU", 1, [0, 1, 2]], ["AN", 1, 0, 6], ["PR", 1, 0, "auto_unroll_max_step$1024"]]]], "r": [[2.37648e-06, 2.39333e-06, 2.38232e-06], 0, 0.510979, 1668099886], "v": "v0.6"}
{"i": [["[\"select_expert\", 1, 100, 16, 8, 2]", "cuda -keys=cuda,gpu -max_num_threads=1024 -model=unknown -thread_warp_size=32", [-1, 16, 64, 49152, 2147483647, 1024, 8, 32], "", 0, []], [[], [["FU", 1, [0, 1, 2]], ["AN", 1, 0, 6], ["PR", 1, 0, "auto_unroll_max_step$64"]]]], "r": [[2.39194e-06, 2.35778e-06, 2.35094e-06], 0, 0.819376, 1668099887], "v": "v0.6"}
{"i": [["[\"select_expert\", 1, 100, 16, 8, 2]", "cuda -keys=cuda,gpu -max_num_threads=1024 -model=unknown -thread_warp_size=32", [-1, 16, 64, 49152, 2147483647, 1024, 8, 32], "", 0, []], [[], [["FU", 1, [0, 1, 2]], ["AN", 1, 0, 6], ["PR", 1, 0, "auto_unroll_max_step$512"]]]], "r": [[2.34873e-06, 2.30971e-06, 2.29767e-06], 0, 1.47702, 1668099887], "v": "v0.6"}
{"i": [["[\"select_expert\", 1, 100, 16, 8, 2]", "cuda -keys=cuda,gpu -max_num_threads=1024 -model=unknown -thread_warp_size=32", [-1, 16, 64, 49152, 2147483647, 1024, 8, 32], "", 0, []], [[], [["FU", 1, [0, 1, 2]], ["AN", 1, 0, 6], ["PR", 1, 0, "auto_unroll_max_step$16"]]]], "r": [[2.39826e-06, 2.43388e-06, 2.42976e-06], 0, 1.78474, 1668099888], "v": "v0.6"}
