python/models/mmoe/kernel_configs/MMoE_gates_activation_1_100_16_8_2
{"i": [["[\"MMoE_gates_activation\", 1, 8, 2]", "cuda -keys=cuda,gpu -max_num_threads=1024 -model=unknown -thread_warp_size=32", [-1, 16, 64, 49152, 2147483647, 1024, 8, 32], "", 0, []], [[], [["FU", 2, [0, 1, 2]], ["AN", 2, 0, 6]]]], "r": [[4.78592e-06, 4.76213e-06, 4.78344e-06, 4.74538e-06, 4.7701e-06, 4.76074e-06, 4.77742e-06, 4.77305e-06, 4.8331e-06, 4.7385e-06], 0, 5.84318, 1649065996], "v": "v0.6"}
{"i": [["[\"MMoE_gates_activation\", 1, 8, 2]", "cuda -keys=cuda,gpu -max_num_threads=1024 -model=unknown -thread_warp_size=32", [-1, 16, 64, 49152, 2147483647, 1024, 8, 32], "", 0, []], [[], [["FU", 2, [0, 1, 2]], ["AN", 2, 0, 6]]]], "r": [[3.31894e-06, 3.32113e-06, 3.32076e-06, 3.33115e-06, 3.37431e-06, 3.3132e-06, 3.3169e-06, 3.34806e-06, 3.31063e-06, 3.31927e-06], 0, 4.57848, 1649088955], "v": "v0.6"}
