python/models/mmoe/kernel_configs/mmoe_synthetic_task_tmp.log
{"input": ["cuda -keys=cuda,gpu -max_num_threads=1024 -model=unknown -thread_warp_size=32", "dense_small_batch.gpu", [["TENSOR", [1, 100], "float32"], ["TENSOR", [8, 100], "float32"], null, "float32"], {}], "config": {"index": 3, "code_hash": null, "entity": [["tile_k", "sp", [-1, 5]]]}, "result": [[2.862072219651396e-06], 0, 1.22255539894104, 1662976831.7232614], "version": 0.2, "tvm_version": "0.8.0"}
{"input": ["cuda -keys=cuda,gpu -max_num_threads=1024 -model=unknown -thread_warp_size=32", "dense_small_batch.gpu", [["TENSOR", [1, 100], "float32"], ["TENSOR", [8, 100], "float32"], null, "float32"], {}], "config": {"index": 7, "code_hash": null, "entity": [["tile_k", "sp", [-1, 50]]]}, "result": [[2.7947547941596526e-06], 0, 1.3211560249328613, 1662976832.8788865], "version": 0.2, "tvm_version": "0.8.0"}
{"input": ["cuda -keys=cuda,gpu -max_num_threads=1024 -model=unknown -thread_warp_size=32", "dense_small_batch.gpu", [["TENSOR", [1, 100], "float32"], ["TENSOR", [8, 100], "float32"], null, "float32"], {}], "config": {"index": 5, "code_hash": null, "entity": [["tile_k", "sp", [-1, 20]]]}, "result": [[2.7274652255383865e-06], 0, 1.2579290866851807, 1662976834.4424646], "version": 0.2, "tvm_version": "0.8.0"}
{"input": ["cuda -keys=cuda,gpu -max_num_threads=1024 -model=unknown -thread_warp_size=32", "dense_small_batch.gpu", [["TENSOR", [1, 100], "float32"], ["TENSOR", [8, 100], "float32"], null, "float32"], {}], "config": {"index": 2, "code_hash": null, "entity": [["tile_k", "sp", [-1, 4]]]}, "result": [[2.8364103693757954e-06], 0, 1.2445199489593506, 1662976836.0121543], "version": 0.2, "tvm_version": "0.8.0"}
{"input": ["cuda -keys=cuda,gpu -max_num_threads=1024 -model=unknown -thread_warp_size=32", "dense_small_batch.gpu", [["TENSOR", [1, 100], "float32"], ["TENSOR", [8, 100], "float32"], null, "float32"], {}], "config": {"index": 0, "code_hash": null, "entity": [["tile_k", "sp", [-1, 1]]]}, "result": [[4.3891575136639576e-06], 0, 1.2959201335906982, 1662976837.6327252], "version": 0.2, "tvm_version": "0.8.0"}
{"input": ["cuda -keys=cuda,gpu -max_num_threads=1024 -model=unknown -thread_warp_size=32", "dense_small_batch.gpu", [["TENSOR", [1, 100], "float32"], ["TENSOR", [8, 100], "float32"], null, "float32"], {}], "config": {"index": 8, "code_hash": null, "entity": [["tile_k", "sp", [-1, 100]]]}, "result": [[2.8654185720618306e-06], 0, 1.322737455368042, 1662976838.8220546], "version": 0.2, "tvm_version": "0.8.0"}
{"input": ["cuda -keys=cuda,gpu -max_num_threads=1024 -model=unknown -thread_warp_size=32", "dense_small_batch.gpu", [["TENSOR", [1, 100], "float32"], ["TENSOR", [8, 100], "float32"], null, "float32"], {}], "config": {"index": 1, "code_hash": null, "entity": [["tile_k", "sp", [-1, 2]]]}, "result": [[3.0979576112665603e-06], 0, 1.2391588687896729, 1662976840.3979676], "version": 0.2, "tvm_version": "0.8.0"}
{"input": ["cuda -keys=cuda,gpu -max_num_threads=1024 -model=unknown -thread_warp_size=32", "dense_small_batch.gpu", [["TENSOR", [1, 100], "float32"], ["TENSOR", [8, 100], "float32"], null, "float32"], {}], "config": {"index": 4, "code_hash": null, "entity": [["tile_k", "sp", [-1, 10]]]}, "result": [[2.9819238000989607e-06], 0, 1.2695329189300537, 1662976841.999933], "version": 0.2, "tvm_version": "0.8.0"}
{"input": ["cuda -keys=cuda,gpu -max_num_threads=1024 -model=unknown -thread_warp_size=32", "dense_small_batch.gpu", [["TENSOR", [1, 100], "float32"], ["TENSOR", [8, 100], "float32"], null, "float32"], {}], "config": {"index": 6, "code_hash": null, "entity": [["tile_k", "sp", [-1, 25]]]}, "result": [[2.703280818085166e-06], 0, 1.2015049457550049, 1662976843.536224], "version": 0.2, "tvm_version": "0.8.0"}
{"input": ["cuda -keys=cuda,gpu -max_num_threads=1024 -model=unknown -thread_warp_size=32", "dense_small_batch.gpu", [["TENSOR", [1, 100], "float32"], ["TENSOR", [128, 100], "float32"], null, "float32"], {}], "config": {"index": 2, "code_hash": null, "entity": [["tile_k", "sp", [-1, 4]]]}, "result": [[3.347687939401481e-06], 0, 1.2250065803527832, 1662976846.0394487], "version": 0.2, "tvm_version": "0.8.0"}
{"input": ["cuda -keys=cuda,gpu -max_num_threads=1024 -model=unknown -thread_warp_size=32", "dense_small_batch.gpu", [["TENSOR", [1, 100], "float32"], ["TENSOR", [128, 100], "float32"], null, "float32"], {}], "config": {"index": 5, "code_hash": null, "entity": [["tile_k", "sp", [-1, 20]]]}, "result": [[3.1982088259910216e-06], 0, 1.3400208950042725, 1662976847.1863077], "version": 0.2, "tvm_version": "0.8.0"}
{"input": ["cuda -keys=cuda,gpu -max_num_threads=1024 -model=unknown -thread_warp_size=32", "dense_small_batch.gpu", [["TENSOR", [1, 100], "float32"], ["TENSOR", [128, 100], "float32"], null, "float32"], {}], "config": {"index": 0, "code_hash": null, "entity": [["tile_k", "sp", [-1, 1]]]}, "result": [[4.703264382703154e-06], 0, 1.4351520538330078, 1662976848.4298844], "version": 0.2, "tvm_version": "0.8.0"}
{"input": ["cuda -keys=cuda,gpu -max_num_threads=1024 -model=unknown -thread_warp_size=32", "dense_small_batch.gpu", [["TENSOR", [1, 100], "float32"], ["TENSOR", [128, 100], "float32"], null, "float32"], {}], "config": {"index": 3, "code_hash": null, "entity": [["tile_k", "sp", [-1, 5]]]}, "result": [[3.347444261684564e-06], 0, 1.3000776767730713, 1662976850.0076327], "version": 0.2, "tvm_version": "0.8.0"}
{"input": ["cuda -keys=cuda,gpu -max_num_threads=1024 -model=unknown -thread_warp_size=32", "dense_small_batch.gpu", [["TENSOR", [1, 100], "float32"], ["TENSOR", [128, 100], "float32"], null, "float32"], {}], "config": {"index": 4, "code_hash": null, "entity": [["tile_k", "sp", [-1, 10]]]}, "result": [[3.1907098807213875e-06], 0, 1.2301528453826904, 1662976851.5738337], "version": 0.2, "tvm_version": "0.8.0"}
{"input": ["cuda -keys=cuda,gpu -max_num_threads=1024 -model=unknown -thread_warp_size=32", "dense_small_batch.gpu", [["TENSOR", [1, 100], "float32"], ["TENSOR", [128, 100], "float32"], null, "float32"], {}], "config": {"index": 1, "code_hash": null, "entity": [["tile_k", "sp", [-1, 2]]]}, "result": [[3.6930681340852336e-06], 0, 1.3295514583587646, 1662976853.1821082], "version": 0.2, "tvm_version": "0.8.0"}
{"input": ["cuda -keys=cuda,gpu -max_num_threads=1024 -model=unknown -thread_warp_size=32", "dense_small_batch.gpu", [["TENSOR", [1, 100], "float32"], ["TENSOR", [128, 100], "float32"], null, "float32"], {}], "config": {"index": 6, "code_hash": null, "entity": [["tile_k", "sp", [-1, 25]]]}, "result": [[3.2003277042719935e-06], 0, 1.345322608947754, 1662976854.3359587], "version": 0.2, "tvm_version": "0.8.0"}
{"input": ["cuda -keys=cuda,gpu -max_num_threads=1024 -model=unknown -thread_warp_size=32", "dense_small_batch.gpu", [["TENSOR", [1, 100], "float32"], ["TENSOR", [128, 100], "float32"], null, "float32"], {}], "config": {"index": 7, "code_hash": null, "entity": [["tile_k", "sp", [-1, 50]]]}, "result": [[3.4246341578220136e-06], 0, 1.2750294208526611, 1662976855.950661], "version": 0.2, "tvm_version": "0.8.0"}
{"input": ["cuda -keys=cuda,gpu -max_num_threads=1024 -model=unknown -thread_warp_size=32", "dense_small_batch.gpu", [["TENSOR", [1, 100], "float32"], ["TENSOR", [128, 100], "float32"], null, "float32"], {}], "config": {"index": 8, "code_hash": null, "entity": [["tile_k", "sp", [-1, 100]]]}, "result": [[3.3437973130317955e-06], 0, 1.2636938095092773, 1662976857.5524967], "version": 0.2, "tvm_version": "0.8.0"}
