python/models/lstm/kernel_configs/hori_fused_solve_8_1_256.log
{"i": [["[\"hori_verti_fused_solve\", 8, 1, 256]", "cuda -keys=cuda,gpu -max_num_threads=1024 -model=unknown -thread_warp_size=32", [-1, 16, 64, 49152, 2147483647, 1024, 8, 32], "", 0, []], [[], [["CI", 7], ["FU", 10, [0, 1, 2]], ["SP", 10, 0, 2048, [1], 1], ["AN", 10, 0, 5], ["AN", 10, 1, 6]]]], "r": [[6.81793e-06, 6.82116e-06, 6.83473e-06], 0, 1.46867, 1696452000], "v": "v0.6"}
{"i": [["[\"hori_verti_fused_solve\", 8, 1, 256]", "cuda -keys=cuda,gpu -max_num_threads=1024 -model=unknown -thread_warp_size=32", [-1, 16, 64, 49152, 2147483647, 1024, 8, 32], "", 0, []], [[], [["CI", 7], ["FU", 10, [0, 1, 2]], ["SP", 10, 0, 2048, [8], 1], ["AN", 10, 0, 5], ["AN", 10, 1, 6]]]], "r": [[5.28485e-06, 5.28985e-06, 5.30128e-06], 0, 2.26687, 1696452001], "v": "v0.6"}
{"i": [["[\"hori_verti_fused_solve\", 8, 1, 256]", "cuda -keys=cuda,gpu -max_num_threads=1024 -model=unknown -thread_warp_size=32", [-1, 16, 64, 49152, 2147483647, 1024, 8, 32], "", 0, []], [[], [["CI", 7], ["FU", 10, [0, 1, 2]], ["SP", 10, 0, 2048, [4], 1], ["AN", 10, 0, 5], ["AN", 10, 1, 6]]]], "r": [[5.56787e-06, 5.57547e-06, 5.57498e-06], 0, 0.705392, 1696451999], "v": "v0.6"}
{"i": [["[\"hori_verti_fused_solve\", 8, 1, 256]", "cuda -keys=cuda,gpu -max_num_threads=1024 -model=unknown -thread_warp_size=32", [-1, 16, 64, 49152, 2147483647, 1024, 8, 32], "", 0, []], [[], [["CI", 7], ["FU", 10, [0, 1, 2]], ["SP", 10, 0, 2048, [32], 1], ["AN", 10, 0, 5], ["AN", 10, 1, 6]]]], "r": [[4.80897e-06, 4.81383e-06, 4.81499e-06], 0, 1.8626, 1696452000], "v": "v0.6"}
{"i": [["[\"hori_verti_fused_solve\", 8, 1, 256]", "cuda -keys=cuda,gpu -max_num_threads=1024 -model=unknown -thread_warp_size=32", [-1, 16, 64, 49152, 2147483647, 1024, 8, 32], "", 0, []], [[], [["CI", 7], ["FU", 10, [0, 1, 2]], ["SP", 10, 0, 2048, [2], 1], ["AN", 10, 0, 5], ["AN", 10, 1, 6]]]], "r": [[5.9668e-06, 5.97133e-06, 5.98567e-06], 0, 3.02813, 1696452001], "v": "v0.6"}
{"i": [["[\"hori_verti_fused_solve\", 8, 1, 256]", "cuda -keys=cuda,gpu -max_num_threads=1024 -model=unknown -thread_warp_size=32", [-1, 16, 64, 49152, 2147483647, 1024, 8, 32], "", 0, []], [[], [["CI", 7], ["FU", 10, [0, 1, 2]], ["SP", 10, 0, 2048, [16], 1], ["AN", 10, 0, 5], ["AN", 10, 1, 6]]]], "r": [[4.88371e-06, 4.90874e-06, 4.91113e-06], 0, 1.12891, 1696451999], "v": "v0.6"}
{"i": [["[\"hori_verti_fused_solve\", 8, 1, 256]", "cuda -keys=cuda,gpu -max_num_threads=1024 -model=unknown -thread_warp_size=32", [-1, 16, 64, 49152, 2147483647, 1024, 8, 32], "", 0, []], [[], [["CI", 7], ["FU", 10, [0, 1, 2]], ["SP", 10, 0, 2048, [64], 1], ["AN", 10, 0, 5], ["AN", 10, 1, 6]]]], "r": [[4.87653e-06, 4.88027e-06, 4.88132e-06], 0, 2.66107, 1696452001], "v": "v0.6"}
