python/models/lstm/kernel_configs/hori_fused_solve_10_1_256.log
{"i": [["[\"hori_fused_solve\", 10, 1, 256]", "cuda -keys=cuda,gpu -max_num_threads=1024 -model=unknown -thread_warp_size=32", [-1, 16, 64, 49152, 2147483647, 1024, 8, 32], "", 0, []], [[], [["CI", 7], ["FU", 10, [0, 1, 2]], ["SP", 10, 0, 2560, [4], 1], ["AN", 10, 0, 5], ["AN", 10, 1, 6]]]], "r": [[2.82509e-06, 2.82537e-06, 2.82528e-06], 0, 1.31915, 1694769207], "v": "v0.6"}
{"i": [["[\"hori_fused_solve\", 10, 1, 256]", "cuda -keys=cuda,gpu -max_num_threads=1024 -model=unknown -thread_warp_size=32", [-1, 16, 64, 49152, 2147483647, 1024, 8, 32], "", 0, []], [[], [["CI", 7], ["FU", 10, [0, 1, 2]], ["SP", 10, 0, 2560, [8], 1], ["AN", 10, 0, 5], ["AN", 10, 1, 6]]]], "r": [[2.56279e-06, 2.56239e-06, 2.56318e-06], 0, 1.05076, 1694769206], "v": "v0.6"}
{"i": [["[\"hori_fused_solve\", 10, 1, 256]", "cuda -keys=cuda,gpu -max_num_threads=1024 -model=unknown -thread_warp_size=32", [-1, 16, 64, 49152, 2147483647, 1024, 8, 32], "", 0, []], [[], [["CI", 7], ["FU", 10, [0, 1, 2]], ["SP", 10, 0, 2560, [10], 1], ["AN", 10, 0, 5], ["AN", 10, 1, 6]]]], "r": [[2.72316e-06, 2.72008e-06, 2.72799e-06], 0, 1.90699, 1694769207], "v": "v0.6"}
{"i": [["[\"hori_fused_solve\", 10, 1, 256]", "cuda -keys=cuda,gpu -max_num_threads=1024 -model=unknown -thread_warp_size=32", [-1, 16, 64, 49152, 2147483647, 1024, 8, 32], "", 0, []], [[], [["CI", 7], ["FU", 10, [0, 1, 2]], ["SP", 10, 0, 2560, [5], 1], ["AN", 10, 0, 5], ["AN", 10, 1, 6]]]], "r": [[2.76015e-06, 2.76549e-06, 2.75607e-06], 0, 1.5993, 1694769207], "v": "v0.6"}
{"i": [["[\"hori_fused_solve\", 10, 1, 256]", "cuda -keys=cuda,gpu -max_num_threads=1024 -model=unknown -thread_warp_size=32", [-1, 16, 64, 49152, 2147483647, 1024, 8, 32], "", 0, []], [[], [["CI", 7], ["FU", 10, [0, 1, 2]], ["SP", 10, 0, 2560, [64], 1], ["AN", 10, 0, 5], ["AN", 10, 1, 6]]]], "r": [[2.5017e-06, 2.50154e-06, 2.5006e-06], 0, 2.17465, 1694769207], "v": "v0.6"}
{"i": [["[\"hori_fused_solve\", 10, 1, 256]", "cuda -keys=cuda,gpu -max_num_threads=1024 -model=unknown -thread_warp_size=32", [-1, 16, 64, 49152, 2147483647, 1024, 8, 32], "", 0, []], [[], [["CI", 7], ["FU", 10, [0, 1, 2]], ["SP", 10, 0, 2560, [1], 1], ["AN", 10, 0, 5], ["AN", 10, 1, 6]]]], "r": [[4.37262e-06, 4.3735e-06, 4.37331e-06], 0, 0.774727, 1694769206], "v": "v0.6"}
{"i": [["[\"hori_fused_solve\", 10, 1, 256]", "cuda -keys=cuda,gpu -max_num_threads=1024 -model=unknown -thread_warp_size=32", [-1, 16, 64, 49152, 2147483647, 1024, 8, 32], "", 0, []], [[], [["CI", 7], ["FU", 10, [0, 1, 2]], ["SP", 10, 0, 2560, [20], 1], ["AN", 10, 0, 5], ["AN", 10, 1, 6]]]], "r": [[2.5009e-06, 2.50177e-06, 2.50116e-06], 0, 2.52101, 1694769208], "v": "v0.6"}
{"i": [["[\"hori_fused_solve\", 10, 1, 256]", "cuda -keys=cuda,gpu -max_num_threads=1024 -model=unknown -thread_warp_size=32", [-1, 16, 64, 49152, 2147483647, 1024, 8, 32], "", 0, []], [[], [["CI", 7], ["FU", 10, [0, 1, 2]], ["SP", 10, 0, 2560, [32], 1], ["AN", 10, 0, 5], ["AN", 10, 1, 6]]]], "r": [[2.44845e-06, 2.44753e-06, 2.44685e-06], 0, 3.47113, 1694769209], "v": "v0.6"}
{"i": [["[\"hori_fused_solve\", 10, 1, 256]", "cuda -keys=cuda,gpu -max_num_threads=1024 -model=unknown -thread_warp_size=32", [-1, 16, 64, 49152, 2147483647, 1024, 8, 32], "", 0, []], [[], [["CI", 7], ["FU", 10, [0, 1, 2]], ["SP", 10, 0, 2560, [16], 1], ["AN", 10, 0, 5], ["AN", 10, 1, 6]]]], "r": [[2.58598e-06, 2.51665e-06, 2.51752e-06], 0, 2.81448, 1694769208], "v": "v0.6"}
{"i": [["[\"hori_fused_solve\", 10, 1, 256]", "cuda -keys=cuda,gpu -max_num_threads=1024 -model=unknown -thread_warp_size=32", [-1, 16, 64, 49152, 2147483647, 1024, 8, 32], "", 0, []], [[], [["CI", 7], ["FU", 10, [0, 1, 2]], ["SP", 10, 0, 2560, [40], 1], ["AN", 10, 0, 5], ["AN", 10, 1, 6]]]], "r": [[2.51888e-06, 2.51849e-06, 2.51127e-06], 0, 3.17475, 1694769208], "v": "v0.6"}
{"i": [["[\"hori_fused_solve\", 10, 1, 256]", "cuda -keys=cuda,gpu -max_num_threads=1024 -model=unknown -thread_warp_size=32", [-1, 16, 64, 49152, 2147483647, 1024, 8, 32], "", 0, []], [[], [["CI", 7], ["FU", 10, [0, 1, 2]], ["SP", 10, 0, 2560, [2], 1], ["AN", 10, 0, 5], ["AN", 10, 1, 6]]]], "r": [[3.23442e-06, 3.23465e-06, 3.23463e-06], 0, 3.6632, 1694769209], "v": "v0.6"}
{"i": [["[\"hori_fused_solve\", 10, 1, 256]", "cuda -keys=cuda,gpu -max_num_threads=1024 -model=unknown -thread_warp_size=32", [-1, 16, 64, 49152, 2147483647, 1024, 8, 32], "", 0, []], [[], [["CI", 7], ["FU", 10, [0, 1, 2]], ["SP", 10, 0, 2560, [1], 1], ["AN", 10, 0, 5], ["AN", 10, 1, 6]]]], "r": [[7.59336e-06, 7.59281e-06, 7.60085e-06], 0, 3.00347, 1694795778], "v": "v0.6"}
{"i": [["[\"hori_fused_solve\", 10, 1, 256]", "cuda -keys=cuda,gpu -max_num_threads=1024 -model=unknown -thread_warp_size=32", [-1, 16, 64, 49152, 2147483647, 1024, 8, 32], "", 0, []], [[], [["CI", 7], ["FU", 10, [0, 1, 2]], ["SP", 10, 0, 2560, [16], 1], ["AN", 10, 0, 5], ["AN", 10, 1, 6]]]], "r": [[5.18367e-06, 5.18262e-06, 5.18134e-06], 0, 1.24027, 1694795776], "v": "v0.6"}
{"i": [["[\"hori_fused_solve\", 10, 1, 256]", "cuda -keys=cuda,gpu -max_num_threads=1024 -model=unknown -thread_warp_size=32", [-1, 16, 64, 49152, 2147483647, 1024, 8, 32], "", 0, []], [[], [["CI", 7], ["FU", 10, [0, 1, 2]], ["SP", 10, 0, 2560, [20], 1], ["AN", 10, 0, 5], ["AN", 10, 1, 6]]]], "r": [[4.83557e-06, 4.82274e-06, 4.82859e-06], 0, 2.58317, 1694795778], "v": "v0.6"}
{"i": [["[\"hori_fused_solve\", 10, 1, 256]", "cuda -keys=cuda,gpu -max_num_threads=1024 -model=unknown -thread_warp_size=32", [-1, 16, 64, 49152, 2147483647, 1024, 8, 32], "", 0, []], [[], [["CI", 7], ["FU", 10, [0, 1, 2]], ["SP", 10, 0, 2560, [8], 1], ["AN", 10, 0, 5], ["AN", 10, 1, 6]]]], "r": [[4.97442e-06, 4.97309e-06, 4.97373e-06], 0, 3.30342, 1694795779], "v": "v0.6"}
{"i": [["[\"hori_fused_solve\", 10, 1, 256]", "cuda -keys=cuda,gpu -max_num_threads=1024 -model=unknown -thread_warp_size=32", [-1, 16, 64, 49152, 2147483647, 1024, 8, 32], "", 0, []], [[], [["CI", 7], ["FU", 10, [0, 1, 2]], ["SP", 10, 0, 2560, [5], 1], ["AN", 10, 0, 5], ["AN", 10, 1, 6]]]], "r": [[5.50385e-06, 5.50498e-06, 5.50448e-06], 0, 0.842599, 1694795776], "v": "v0.6"}
{"i": [["[\"hori_fused_solve\", 10, 1, 256]", "cuda -keys=cuda,gpu -max_num_threads=1024 -model=unknown -thread_warp_size=32", [-1, 16, 64, 49152, 2147483647, 1024, 8, 32], "", 0, []], [[], [["CI", 7], ["FU", 10, [0, 1, 2]], ["SP", 10, 0, 2560, [32], 1], ["AN", 10, 0, 5], ["AN", 10, 1, 6]]]], "r": [[5.08657e-06, 5.09758e-06, 5.09785e-06], 0, 2.08004, 1694795777], "v": "v0.6"}
{"i": [["[\"hori_fused_solve\", 10, 1, 256]", "cuda -keys=cuda,gpu -max_num_threads=1024 -model=unknown -thread_warp_size=32", [-1, 16, 64, 49152, 2147483647, 1024, 8, 32], "", 0, []], [[], [["CI", 7], ["FU", 10, [0, 1, 2]], ["SP", 10, 0, 2560, [64], 1], ["AN", 10, 0, 5], ["AN", 10, 1, 6]]]], "r": [[4.84873e-06, 4.84898e-06, 4.8494e-06], 0, 1.79667, 1694795777], "v": "v0.6"}
{"i": [["[\"hori_fused_solve\", 10, 1, 256]", "cuda -keys=cuda,gpu -max_num_threads=1024 -model=unknown -thread_warp_size=32", [-1, 16, 64, 49152, 2147483647, 1024, 8, 32], "", 0, []], [[], [["CI", 7], ["FU", 10, [0, 1, 2]], ["SP", 10, 0, 2560, [10], 1], ["AN", 10, 0, 5], ["AN", 10, 1, 6]]]], "r": [[5.05731e-06, 5.056e-06, 5.05692e-06], 0, 1.3142, 1694795777], "v": "v0.6"}
{"i": [["[\"hori_fused_solve\", 10, 1, 256]", "cuda -keys=cuda,gpu -max_num_threads=1024 -model=unknown -thread_warp_size=32", [-1, 16, 64, 49152, 2147483647, 1024, 8, 32], "", 0, []], [[], [["CI", 7], ["FU", 10, [0, 1, 2]], ["SP", 10, 0, 2560, [40], 1], ["AN", 10, 0, 5], ["AN", 10, 1, 6]]]], "r": [[4.86063e-06, 4.86176e-06, 4.85992e-06], 0, 4.15294, 1694795780], "v": "v0.6"}
{"i": [["[\"hori_fused_solve\", 10, 1, 256]", "cuda -keys=cuda,gpu -max_num_threads=1024 -model=unknown -thread_warp_size=32", [-1, 16, 64, 49152, 2147483647, 1024, 8, 32], "", 0, []], [[], [["CI", 7], ["FU", 10, [0, 1, 2]], ["SP", 10, 0, 2560, [4], 1], ["AN", 10, 0, 5], ["AN", 10, 1, 6]]]], "r": [[5.47788e-06, 5.47816e-06, 5.4779e-06], 0, 4.54233, 1694795780], "v": "v0.6"}
{"i": [["[\"hori_fused_solve\", 10, 1, 256]", "cuda -keys=cuda,gpu -max_num_threads=1024 -model=unknown -thread_warp_size=32", [-1, 16, 64, 49152, 2147483647, 1024, 8, 32], "", 0, []], [[], [["CI", 7], ["FU", 10, [0, 1, 2]], ["SP", 10, 0, 2560, [2], 1], ["AN", 10, 0, 5], ["AN", 10, 1, 6]]]], "r": [[6.22071e-06, 6.23003e-06, 6.22692e-06], 0, 3.70134, 1694795779], "v": "v0.6"}
