python/models/lstm/kernel_configs/hori_fused_solve_output_10_1_256.log
{"i": [["[\"hori_fused_solve_output\", 10, 1, 256]", "cuda -keys=cuda,gpu -max_num_threads=1024 -model=unknown -thread_warp_size=32", [-1, 16, 64, 49152, 2147483647, 1024, 8, 32], "", 0, []], [[], [["FU", 3, [0, 1, 2]], ["SP", 3, 0, 2560, [8], 1], ["AN", 3, 0, 5], ["AN", 3, 1, 6]]]], "r": [[3.90047e-06, 3.92998e-06, 3.92771e-06], 0, 0.608945, 1694815472], "v": "v0.6"}
{"i": [["[\"hori_fused_solve_output\", 10, 1, 256]", "cuda -keys=cuda,gpu -max_num_threads=1024 -model=unknown -thread_warp_size=32", [-1, 16, 64, 49152, 2147483647, 1024, 8, 32], "", 0, []], [[], [["FU", 3, [0, 1, 2]], ["SP", 3, 0, 2560, [10], 1], ["AN", 3, 0, 5], ["AN", 3, 1, 6]]]], "r": [[3.88321e-06, 3.88423e-06, 3.88273e-06], 0, 1.05833, 1694815473], "v": "v0.6"}
{"i": [["[\"hori_fused_solve_output\", 10, 1, 256]", "cuda -keys=cuda,gpu -max_num_threads=1024 -model=unknown -thread_warp_size=32", [-1, 16, 64, 49152, 2147483647, 1024, 8, 32], "", 0, []], [[], [["FU", 3, [0, 1, 2]], ["SP", 3, 0, 2560, [16], 1], ["AN", 3, 0, 5], ["AN", 3, 1, 6]]]], "r": [[3.58477e-06, 3.58465e-06, 3.58504e-06], 0, 1.88254, 1694815474], "v": "v0.6"}
{"i": [["[\"hori_fused_solve_output\", 10, 1, 256]", "cuda -keys=cuda,gpu -max_num_threads=1024 -model=unknown -thread_warp_size=32", [-1, 16, 64, 49152, 2147483647, 1024, 8, 32], "", 0, []], [[], [["FU", 3, [0, 1, 2]], ["SP", 3, 0, 2560, [1], 1], ["AN", 3, 0, 5], ["AN", 3, 1, 6]]]], "r": [[6.07781e-06, 6.0853e-06, 6.08549e-06], 0, 1.4757, 1694815473], "v": "v0.6"}
{"i": [["[\"hori_fused_solve_output\", 10, 1, 256]", "cuda -keys=cuda,gpu -max_num_threads=1024 -model=unknown -thread_warp_size=32", [-1, 16, 64, 49152, 2147483647, 1024, 8, 32], "", 0, []], [[], [["FU", 3, [0, 1, 2]], ["SP", 3, 0, 2560, [40], 1], ["AN", 3, 0, 5], ["AN", 3, 1, 6]]]], "r": [[3.84412e-06, 3.85826e-06, 3.85693e-06], 0, 3.05503, 1694815475], "v": "v0.6"}
{"i": [["[\"hori_fused_solve_output\", 10, 1, 256]", "cuda -keys=cuda,gpu -max_num_threads=1024 -model=unknown -thread_warp_size=32", [-1, 16, 64, 49152, 2147483647, 1024, 8, 32], "", 0, []], [[], [["FU", 3, [0, 1, 2]], ["SP", 3, 0, 2560, [64], 1], ["AN", 3, 0, 5], ["AN", 3, 1, 6]]]], "r": [[3.85855e-06, 3.85603e-06, 3.85233e-06], 0, 2.29776, 1694815474], "v": "v0.6"}
{"i": [["[\"hori_fused_solve_output\", 10, 1, 256]", "cuda -keys=cuda,gpu -max_num_threads=1024 -model=unknown -thread_warp_size=32", [-1, 16, 64, 49152, 2147483647, 1024, 8, 32], "", 0, []], [[], [["FU", 3, [0, 1, 2]], ["SP", 3, 0, 2560, [20], 1], ["AN", 3, 0, 5], ["AN", 3, 1, 6]]]], "r": [[3.70775e-06, 3.7074e-06, 3.70848e-06], 0, 2.68367, 1694815475], "v": "v0.6"}
{"i": [["[\"hori_fused_solve_output\", 10, 1, 256]", "cuda -keys=cuda,gpu -max_num_threads=1024 -model=unknown -thread_warp_size=32", [-1, 16, 64, 49152, 2147483647, 1024, 8, 32], "", 0, []], [[], [["FU", 3, [0, 1, 2]], ["SP", 3, 0, 2560, [5], 1], ["AN", 3, 0, 5], ["AN", 3, 1, 6]]]], "r": [[4.07078e-06, 4.07136e-06, 4.06975e-06], 0, 3.50602, 1694815475], "v": "v0.6"}
{"i": [["[\"hori_fused_solve_output\", 10, 1, 256]", "cuda -keys=cuda,gpu -max_num_threads=1024 -model=unknown -thread_warp_size=32", [-1, 16, 64, 49152, 2147483647, 1024, 8, 32], "", 0, []], [[], [["FU", 3, [0, 1, 2]], ["SP", 3, 0, 2560, [32], 1], ["AN", 3, 0, 5], ["AN", 3, 1, 6]]]], "r": [[3.78358e-06, 3.78306e-06, 3.78292e-06], 0, 4.34281, 1694815476], "v": "v0.6"}
{"i": [["[\"hori_fused_solve_output\", 10, 1, 256]", "cuda -keys=cuda,gpu -max_num_threads=1024 -model=unknown -thread_warp_size=32", [-1, 16, 64, 49152, 2147483647, 1024, 8, 32], "", 0, []], [[], [["FU", 3, [0, 1, 2]], ["SP", 3, 0, 2560, [4], 1], ["AN", 3, 0, 5], ["AN", 3, 1, 6]]]], "r": [[4.20117e-06, 4.20214e-06, 4.20133e-06], 0, 4.80387, 1694815477], "v": "v0.6"}
{"i": [["[\"hori_fused_solve_output\", 10, 1, 256]", "cuda -keys=cuda,gpu -max_num_threads=1024 -model=unknown -thread_warp_size=32", [-1, 16, 64, 49152, 2147483647, 1024, 8, 32], "", 0, []], [[], [["FU", 3, [0, 1, 2]], ["SP", 3, 0, 2560, [2], 1], ["AN", 3, 0, 5], ["AN", 3, 1, 6]]]], "r": [[4.84763e-06, 4.84657e-06, 4.84844e-06], 0, 3.9366, 1694815476], "v": "v0.6"}
{"i": [["[\"hori_fused_solve_output\", 10, 1, 256]", "cuda -keys=cuda,gpu -max_num_threads=1024 -model=unknown -thread_warp_size=32", [-1, 16, 64, 49152, 2147483647, 1024, 8, 32], "", 0, []], [[], [["FU", 3, [0, 1, 2]], ["SP", 3, 0, 2560, [8], 1], ["AN", 3, 0, 5], ["AN", 3, 1, 6]]]], "r": [[3.81626e-06, 3.81338e-06, 3.81591e-06], 0, 1.36175, 1694859298], "v": "v0.6"}
{"i": [["[\"hori_fused_solve_output\", 10, 1, 256]", "cuda -keys=cuda,gpu -max_num_threads=1024 -model=unknown -thread_warp_size=32", [-1, 16, 64, 49152, 2147483647, 1024, 8, 32], "", 0, []], [[], [["FU", 3, [0, 1, 2]], ["SP", 3, 0, 2560, [10], 1], ["AN", 3, 0, 5], ["AN", 3, 1, 6]]]], "r": [[3.78453e-06, 3.78545e-06, 3.78562e-06], 0, 1.01293, 1694859297], "v": "v0.6"}
{"i": [["[\"hori_fused_solve_output\", 10, 1, 256]", "cuda -keys=cuda,gpu -max_num_threads=1024 -model=unknown -thread_warp_size=32", [-1, 16, 64, 49152, 2147483647, 1024, 8, 32], "", 0, []], [[], [["FU", 3, [0, 1, 2]], ["SP", 3, 0, 2560, [5], 1], ["AN", 3, 0, 5], ["AN", 3, 1, 6]]]], "r": [[4.14491e-06, 4.14595e-06, 4.14533e-06], 0, 0.62311, 1694859297], "v": "v0.6"}
{"i": [["[\"hori_fused_solve_output\", 10, 1, 256]", "cuda -keys=cuda,gpu -max_num_threads=1024 -model=unknown -thread_warp_size=32", [-1, 16, 64, 49152, 2147483647, 1024, 8, 32], "", 0, []], [[], [["FU", 3, [0, 1, 2]], ["SP", 3, 0, 2560, [16], 1], ["AN", 3, 0, 5], ["AN", 3, 1, 6]]]], "r": [[3.90063e-06, 3.90955e-06, 3.90824e-06], 0, 1.72693, 1694859298], "v": "v0.6"}
{"i": [["[\"hori_fused_solve_output\", 10, 1, 256]", "cuda -keys=cuda,gpu -max_num_threads=1024 -model=unknown -thread_warp_size=32", [-1, 16, 64, 49152, 2147483647, 1024, 8, 32], "", 0, []], [[], [["FU", 3, [0, 1, 2]], ["SP", 3, 0, 2560, [32], 1], ["AN", 3, 0, 5], ["AN", 3, 1, 6]]]], "r": [[3.53556e-06, 3.53661e-06, 3.536e-06], 0, 3.51991, 1694859300], "v": "v0.6"}
{"i": [["[\"hori_fused_solve_output\", 10, 1, 256]", "cuda -keys=cuda,gpu -max_num_threads=1024 -model=unknown -thread_warp_size=32", [-1, 16, 64, 49152, 2147483647, 1024, 8, 32], "", 0, []], [[], [["FU", 3, [0, 1, 2]], ["SP", 3, 0, 2560, [40], 1], ["AN", 3, 0, 5], ["AN", 3, 1, 6]]]], "r": [[3.90189e-06, 3.91718e-06, 3.91783e-06], 0, 2.082, 1694859298], "v": "v0.6"}
{"i": [["[\"hori_fused_solve_output\", 10, 1, 256]", "cuda -keys=cuda,gpu -max_num_threads=1024 -model=unknown -thread_warp_size=32", [-1, 16, 64, 49152, 2147483647, 1024, 8, 32], "", 0, []], [[], [["FU", 3, [0, 1, 2]], ["SP", 3, 0, 2560, [2], 1], ["AN", 3, 0, 5], ["AN", 3, 1, 6]]]], "r": [[4.98707e-06, 4.99936e-06, 5.00055e-06], 0, 3.15014, 1694859299], "v": "v0.6"}
{"i": [["[\"hori_fused_solve_output\", 10, 1, 256]", "cuda -keys=cuda,gpu -max_num_threads=1024 -model=unknown -thread_warp_size=32", [-1, 16, 64, 49152, 2147483647, 1024, 8, 32], "", 0, []], [[], [["FU", 3, [0, 1, 2]], ["SP", 3, 0, 2560, [64], 1], ["AN", 3, 0, 5], ["AN", 3, 1, 6]]]], "r": [[3.58988e-06, 3.59046e-06, 3.59109e-06], 0, 3.88458, 1694859300], "v": "v0.6"}
{"i": [["[\"hori_fused_solve_output\", 10, 1, 256]", "cuda -keys=cuda,gpu -max_num_threads=1024 -model=unknown -thread_warp_size=32", [-1, 16, 64, 49152, 2147483647, 1024, 8, 32], "", 0, []], [[], [["FU", 3, [0, 1, 2]], ["SP", 3, 0, 2560, [20], 1], ["AN", 3, 0, 5], ["AN", 3, 1, 6]]]], "r": [[3.96971e-06, 3.98134e-06, 3.98071e-06], 0, 2.4391, 1694859299], "v": "v0.6"}
{"i": [["[\"hori_fused_solve_output\", 10, 1, 256]", "cuda -keys=cuda,gpu -max_num_threads=1024 -model=unknown -thread_warp_size=32", [-1, 16, 64, 49152, 2147483647, 1024, 8, 32], "", 0, []], [[], [["FU", 3, [0, 1, 2]], ["SP", 3, 0, 2560, [1], 1], ["AN", 3, 0, 5], ["AN", 3, 1, 6]]]], "r": [[6.29568e-06, 6.30294e-06, 6.30117e-06], 0, 2.77277, 1694859299], "v": "v0.6"}
{"i": [["[\"hori_fused_solve_output\", 10, 1, 256]", "cuda -keys=cuda,gpu -max_num_threads=1024 -model=unknown -thread_warp_size=32", [-1, 16, 64, 49152, 2147483647, 1024, 8, 32], "", 0, []], [[], [["FU", 3, [0, 1, 2]], ["SP", 3, 0, 2560, [4], 1], ["AN", 3, 0, 5], ["AN", 3, 1, 6]]]], "r": [[4.1345e-06, 4.13561e-06, 4.13577e-06], 0, 4.26723, 1694859301], "v": "v0.6"}
