python/models/lstm/kernel_configs/hori_fused_solve_hidden_9_1_256.log
{"i": [["[\"hori_fused_solve_hidden\", 9, 1, 256]", "cuda -keys=cuda,gpu -max_num_threads=1024 -model=unknown -thread_warp_size=32", [-1, 16, 64, 49152, 2147483647, 1024, 8, 32], "", 0, []], [[], [["FU", 7, [0, 1, 2]], ["SP", 7, 0, 2304, [8], 1], ["AN", 7, 0, 5], ["AN", 7, 1, 6]]]], "r": [[4.77092e-06, 4.77264e-06, 4.76722e-06], 0, 1.40738, 1694816045], "v": "v0.6"}
{"i": [["[\"hori_fused_solve_hidden\", 9, 1, 256]", "cuda -keys=cuda,gpu -max_num_threads=1024 -model=unknown -thread_warp_size=32", [-1, 16, 64, 49152, 2147483647, 1024, 8, 32], "", 0, []], [[], [["FU", 7, [0, 1, 2]], ["SP", 7, 0, 2304, [2], 1], ["AN", 7, 0, 5], ["AN", 7, 1, 6]]]], "r": [[5.30951e-06, 5.31656e-06, 5.31658e-06], 0, 1.0192, 1694816044], "v": "v0.6"}
{"i": [["[\"hori_fused_solve_hidden\", 9, 1, 256]", "cuda -keys=cuda,gpu -max_num_threads=1024 -model=unknown -thread_warp_size=32", [-1, 16, 64, 49152, 2147483647, 1024, 8, 32], "", 0, []], [[], [["FU", 7, [0, 1, 2]], ["SP", 7, 0, 2304, [48], 1], ["AN", 7, 0, 5], ["AN", 7, 1, 6]]]], "r": [[4.66519e-06, 4.67931e-06, 4.67886e-06], 0, 2.58186, 1694816046], "v": "v0.6"}
{"i": [["[\"hori_fused_solve_hidden\", 9, 1, 256]", "cuda -keys=cuda,gpu -max_num_threads=1024 -model=unknown -thread_warp_size=32", [-1, 16, 64, 49152, 2147483647, 1024, 8, 32], "", 0, []], [[], [["FU", 7, [0, 1, 2]], ["SP", 7, 0, 2304, [1], 1], ["AN", 7, 0, 5], ["AN", 7, 1, 6]]]], "r": [[6.91801e-06, 6.92673e-06, 6.92543e-06], 0, 1.8153, 1694816045], "v": "v0.6"}
{"i": [["[\"hori_fused_solve_hidden\", 9, 1, 256]", "cuda -keys=cuda,gpu -max_num_threads=1024 -model=unknown -thread_warp_size=32", [-1, 16, 64, 49152, 2147483647, 1024, 8, 32], "", 0, []], [[], [["FU", 7, [0, 1, 2]], ["SP", 7, 0, 2304, [64], 1], ["AN", 7, 0, 5], ["AN", 7, 1, 6]]]], "r": [[4.24924e-06, 4.25017e-06, 4.24976e-06], 0, 2.21893, 1694816046], "v": "v0.6"}
{"i": [["[\"hori_fused_solve_hidden\", 9, 1, 256]", "cuda -keys=cuda,gpu -max_num_threads=1024 -model=unknown -thread_warp_size=32", [-1, 16, 64, 49152, 2147483647, 1024, 8, 32], "", 0, []], [[], [["FU", 7, [0, 1, 2]], ["SP", 7, 0, 2304, [36], 1], ["AN", 7, 0, 5], ["AN", 7, 1, 6]]]], "r": [[4.47289e-06, 4.48511e-06, 4.48281e-06], 0, 2.91889, 1694816046], "v": "v0.6"}
{"i": [["[\"hori_fused_solve_hidden\", 9, 1, 256]", "cuda -keys=cuda,gpu -max_num_threads=1024 -model=unknown -thread_warp_size=32", [-1, 16, 64, 49152, 2147483647, 1024, 8, 32], "", 0, []], [[], [["FU", 7, [0, 1, 2]], ["SP", 7, 0, 2304, [4], 1], ["AN", 7, 0, 5], ["AN", 7, 1, 6]]]], "r": [[5.0847e-06, 5.08584e-06, 5.08759e-06], 0, 4.8279, 1694816048], "v": "v0.6"}
{"i": [["[\"hori_fused_solve_hidden\", 9, 1, 256]", "cuda -keys=cuda,gpu -max_num_threads=1024 -model=unknown -thread_warp_size=32", [-1, 16, 64, 49152, 2147483647, 1024, 8, 32], "", 0, []], [[], [["FU", 7, [0, 1, 2]], ["SP", 7, 0, 2304, [32], 1], ["AN", 7, 0, 5], ["AN", 7, 1, 6]]]], "r": [[4.52618e-06, 4.52433e-06, 4.52311e-06], 0, 5.25145, 1694816049], "v": "v0.6"}
{"i": [["[\"hori_fused_solve_hidden\", 9, 1, 256]", "cuda -keys=cuda,gpu -max_num_threads=1024 -model=unknown -thread_warp_size=32", [-1, 16, 64, 49152, 2147483647, 1024, 8, 32], "", 0, []], [[], [["FU", 7, [0, 1, 2]], ["SP", 7, 0, 2304, [12], 1], ["AN", 7, 0, 5], ["AN", 7, 1, 6]]]], "r": [[4.69145e-06, 4.70002e-06, 4.69993e-06], 0, 4.12355, 1694816047], "v": "v0.6"}
{"i": [["[\"hori_fused_solve_hidden\", 9, 1, 256]", "cuda -keys=cuda,gpu -max_num_threads=1024 -model=unknown -thread_warp_size=32", [-1, 16, 64, 49152, 2147483647, 1024, 8, 32], "", 0, []], [[], [["FU", 7, [0, 1, 2]], ["SP", 7, 0, 2304, [6], 1], ["AN", 7, 0, 5], ["AN", 7, 1, 6]]]], "r": [[4.88337e-06, 4.88998e-06, 4.88858e-06], 0, 3.71244, 1694816047], "v": "v0.6"}
{"i": [["[\"hori_fused_solve_hidden\", 9, 1, 256]", "cuda -keys=cuda,gpu -max_num_threads=1024 -model=unknown -thread_warp_size=32", [-1, 16, 64, 49152, 2147483647, 1024, 8, 32], "", 0, []], [[], [["FU", 7, [0, 1, 2]], ["SP", 7, 0, 2304, [24], 1], ["AN", 7, 0, 5], ["AN", 7, 1, 6]]]], "r": [[4.40565e-06, 4.40442e-06, 4.40395e-06], 0, 4.48744, 1694816048], "v": "v0.6"}
{"i": [["[\"hori_fused_solve_hidden\", 9, 1, 256]", "cuda -keys=cuda,gpu -max_num_threads=1024 -model=unknown -thread_warp_size=32", [-1, 16, 64, 49152, 2147483647, 1024, 8, 32], "", 0, []], [[], [["FU", 7, [0, 1, 2]], ["SP", 7, 0, 2304, [18], 1], ["AN", 7, 0, 5], ["AN", 7, 1, 6]]]], "r": [[4.66751e-06, 4.67621e-06, 4.67703e-06], 0, 0.702241, 1694816044], "v": "v0.6"}
{"i": [["[\"hori_fused_solve_hidden\", 9, 1, 256]", "cuda -keys=cuda,gpu -max_num_threads=1024 -model=unknown -thread_warp_size=32", [-1, 16, 64, 49152, 2147483647, 1024, 8, 32], "", 0, []], [[], [["FU", 7, [0, 1, 2]], ["SP", 7, 0, 2304, [9], 1], ["AN", 7, 0, 5], ["AN", 7, 1, 6]]]], "r": [[4.54625e-06, 4.54631e-06, 4.54567e-06], 0, 5.62564, 1694816049], "v": "v0.6"}
{"i": [["[\"hori_fused_solve_hidden\", 9, 1, 256]", "cuda -keys=cuda,gpu -max_num_threads=1024 -model=unknown -thread_warp_size=32", [-1, 16, 64, 49152, 2147483647, 1024, 8, 32], "", 0, []], [[], [["FU", 7, [0, 1, 2]], ["SP", 7, 0, 2304, [3], 1], ["AN", 7, 0, 5], ["AN", 7, 1, 6]]]], "r": [[5.21287e-06, 5.24083e-06, 5.2394e-06], 0, 6.01134, 1694816049], "v": "v0.6"}
{"i": [["[\"hori_fused_solve_hidden\", 9, 1, 256]", "cuda -keys=cuda,gpu -max_num_threads=1024 -model=unknown -thread_warp_size=32", [-1, 16, 64, 49152, 2147483647, 1024, 8, 32], "", 0, []], [[], [["FU", 7, [0, 1, 2]], ["SP", 7, 0, 2304, [16], 1], ["AN", 7, 0, 5], ["AN", 7, 1, 6]]]], "r": [[4.49096e-06, 4.50096e-06, 4.49302e-06], 0, 3.2975, 1694816047], "v": "v0.6"}
{"i": [["[\"hori_fused_solve_hidden\", 9, 1, 256]", "cuda -keys=cuda,gpu -max_num_threads=1024 -model=unknown -thread_warp_size=32", [-1, 16, 64, 49152, 2147483647, 1024, 8, 32], "", 0, []], [[], [["FU", 7, [0, 1, 2]], ["SP", 7, 0, 2304, [12], 1], ["AN", 7, 0, 5], ["AN", 7, 1, 6]]]], "r": [[4.48762e-06, 4.48728e-06, 4.48705e-06], 0, 2.14999, 1694859866], "v": "v0.6"}
{"i": [["[\"hori_fused_solve_hidden\", 9, 1, 256]", "cuda -keys=cuda,gpu -max_num_threads=1024 -model=unknown -thread_warp_size=32", [-1, 16, 64, 49152, 2147483647, 1024, 8, 32], "", 0, []], [[], [["FU", 7, [0, 1, 2]], ["SP", 7, 0, 2304, [64], 1], ["AN", 7, 0, 5], ["AN", 7, 1, 6]]]], "r": [[4.54645e-06, 4.55489e-06, 4.55445e-06], 0, 0.64785, 1694859864], "v": "v0.6"}
{"i": [["[\"hori_fused_solve_hidden\", 9, 1, 256]", "cuda -keys=cuda,gpu -max_num_threads=1024 -model=unknown -thread_warp_size=32", [-1, 16, 64, 49152, 2147483647, 1024, 8, 32], "", 0, []], [[], [["FU", 7, [0, 1, 2]], ["SP", 7, 0, 2304, [18], 1], ["AN", 7, 0, 5], ["AN", 7, 1, 6]]]], "r": [[4.42958e-06, 4.42836e-06, 4.43069e-06], 0, 3.62725, 1694859867], "v": "v0.6"}
{"i": [["[\"hori_fused_solve_hidden\", 9, 1, 256]", "cuda -keys=cuda,gpu -max_num_threads=1024 -model=unknown -thread_warp_size=32", [-1, 16, 64, 49152, 2147483647, 1024, 8, 32], "", 0, []], [[], [["FU", 7, [0, 1, 2]], ["SP", 7, 0, 2304, [24], 1], ["AN", 7, 0, 5], ["AN", 7, 1, 6]]]], "r": [[4.36288e-06, 4.36245e-06, 4.36309e-06], 0, 1.04193, 1694859865], "v": "v0.6"}
{"i": [["[\"hori_fused_solve_hidden\", 9, 1, 256]", "cuda -keys=cuda,gpu -max_num_threads=1024 -model=unknown -thread_warp_size=32", [-1, 16, 64, 49152, 2147483647, 1024, 8, 32], "", 0, []], [[], [["FU", 7, [0, 1, 2]], ["SP", 7, 0, 2304, [48], 1], ["AN", 7, 0, 5], ["AN", 7, 1, 6]]]], "r": [[4.57295e-06, 4.58183e-06, 4.58067e-06], 0, 1.73135, 1694859866], "v": "v0.6"}
{"i": [["[\"hori_fused_solve_hidden\", 9, 1, 256]", "cuda -keys=cuda,gpu -max_num_threads=1024 -model=unknown -thread_warp_size=32", [-1, 16, 64, 49152, 2147483647, 1024, 8, 32], "", 0, []], [[], [["FU", 7, [0, 1, 2]], ["SP", 7, 0, 2304, [32], 1], ["AN", 7, 0, 5], ["AN", 7, 1, 6]]]], "r": [[4.43131e-06, 4.43179e-06, 4.4311e-06], 0, 2.88511, 1694859867], "v": "v0.6"}
{"i": [["[\"hori_fused_solve_hidden\", 9, 1, 256]", "cuda -keys=cuda,gpu -max_num_threads=1024 -model=unknown -thread_warp_size=32", [-1, 16, 64, 49152, 2147483647, 1024, 8, 32], "", 0, []], [[], [["FU", 7, [0, 1, 2]], ["SP", 7, 0, 2304, [9], 1], ["AN", 7, 0, 5], ["AN", 7, 1, 6]]]], "r": [[4.53326e-06, 4.53264e-06, 4.53222e-06], 0, 1.41344, 1694859865], "v": "v0.6"}
{"i": [["[\"hori_fused_solve_hidden\", 9, 1, 256]", "cuda -keys=cuda,gpu -max_num_threads=1024 -model=unknown -thread_warp_size=32", [-1, 16, 64, 49152, 2147483647, 1024, 8, 32], "", 0, []], [[], [["FU", 7, [0, 1, 2]], ["SP", 7, 0, 2304, [8], 1], ["AN", 7, 0, 5], ["AN", 7, 1, 6]]]], "r": [[4.81531e-06, 4.82362e-06, 4.82359e-06], 0, 3.19026, 1694859867], "v": "v0.6"}
{"i": [["[\"hori_fused_solve_hidden\", 9, 1, 256]", "cuda -keys=cuda,gpu -max_num_threads=1024 -model=unknown -thread_warp_size=32", [-1, 16, 64, 49152, 2147483647, 1024, 8, 32], "", 0, []], [[], [["FU", 7, [0, 1, 2]], ["SP", 7, 0, 2304, [3], 1], ["AN", 7, 0, 5], ["AN", 7, 1, 6]]]], "r": [[5.13597e-06, 5.14397e-06, 5.14304e-06], 0, 2.51864, 1694859866], "v": "v0.6"}
{"i": [["[\"hori_fused_solve_hidden\", 9, 1, 256]", "cuda -keys=cuda,gpu -max_num_threads=1024 -model=unknown -thread_warp_size=32", [-1, 16, 64, 49152, 2147483647, 1024, 8, 32], "", 0, []], [[], [["FU", 7, [0, 1, 2]], ["SP", 7, 0, 2304, [2], 1], ["AN", 7, 0, 5], ["AN", 7, 1, 6]]]], "r": [[5.47309e-06, 5.47964e-06, 5.48029e-06], 0, 5.79208, 1694859870], "v": "v0.6"}
{"i": [["[\"hori_fused_solve_hidden\", 9, 1, 256]", "cuda -keys=cuda,gpu -max_num_threads=1024 -model=unknown -thread_warp_size=32", [-1, 16, 64, 49152, 2147483647, 1024, 8, 32], "", 0, []], [[], [["FU", 7, [0, 1, 2]], ["SP", 7, 0, 2304, [1], 1], ["AN", 7, 0, 5], ["AN", 7, 1, 6]]]], "r": [[6.93949e-06, 6.94671e-06, 6.9459e-06], 0, 4.30316, 1694859868], "v": "v0.6"}
{"i": [["[\"hori_fused_solve_hidden\", 9, 1, 256]", "cuda -keys=cuda,gpu -max_num_threads=1024 -model=unknown -thread_warp_size=32", [-1, 16, 64, 49152, 2147483647, 1024, 8, 32], "", 0, []], [[], [["FU", 7, [0, 1, 2]], ["SP", 7, 0, 2304, [36], 1], ["AN", 7, 0, 5], ["AN", 7, 1, 6]]]], "r": [[4.43114e-06, 4.45262e-06, 4.45143e-06], 0, 5.05151, 1694859869], "v": "v0.6"}
{"i": [["[\"hori_fused_solve_hidden\", 9, 1, 256]", "cuda -keys=cuda,gpu -max_num_threads=1024 -model=unknown -thread_warp_size=32", [-1, 16, 64, 49152, 2147483647, 1024, 8, 32], "", 0, []], [[], [["FU", 7, [0, 1, 2]], ["SP", 7, 0, 2304, [16], 1], ["AN", 7, 0, 5], ["AN", 7, 1, 6]]]], "r": [[4.44499e-06, 4.44531e-06, 4.44468e-06], 0, 4.78458, 1694859869], "v": "v0.6"}
{"i": [["[\"hori_fused_solve_hidden\", 9, 1, 256]", "cuda -keys=cuda,gpu -max_num_threads=1024 -model=unknown -thread_warp_size=32", [-1, 16, 64, 49152, 2147483647, 1024, 8, 32], "", 0, []], [[], [["FU", 7, [0, 1, 2]], ["SP", 7, 0, 2304, [4], 1], ["AN", 7, 0, 5], ["AN", 7, 1, 6]]]], "r": [[5.00365e-06, 5.00712e-06, 5.00659e-06], 0, 3.97545, 1694859868], "v": "v0.6"}
{"i": [["[\"hori_fused_solve_hidden\", 9, 1, 256]", "cuda -keys=cuda,gpu -max_num_threads=1024 -model=unknown -thread_warp_size=32", [-1, 16, 64, 49152, 2147483647, 1024, 8, 32], "", 0, []], [[], [["FU", 7, [0, 1, 2]], ["SP", 7, 0, 2304, [6], 1], ["AN", 7, 0, 5], ["AN", 7, 1, 6]]]], "r": [[4.99663e-06, 5.00329e-06, 5.00451e-06], 0, 5.45037, 1694859869], "v": "v0.6"}
