python/models/lstm/kernel_configs/hori_fused_solve_4_1_256.log
{"i": [["[\"hori_fused_solve\", 4, 1, 256]", "cuda -keys=cuda,gpu -max_num_threads=1024 -model=unknown -thread_warp_size=32", [-1, 16, 64, 49152, 2147483647, 1024, 8, 32], "", 0, []], [[], [["CI", 7], ["FU", 10, [0, 1, 2]], ["SP", 10, 0, 1024, [32], 1], ["AN", 10, 0, 5], ["AN", 10, 1, 6]]]], "r": [[4.15573e-06, 4.12764e-06, 4.16689e-06], 0, 0.882037, 1694769315], "v": "v0.6"}
{"i": [["[\"hori_fused_solve\", 4, 1, 256]", "cuda -keys=cuda,gpu -max_num_threads=1024 -model=unknown -thread_warp_size=32", [-1, 16, 64, 49152, 2147483647, 1024, 8, 32], "", 0, []], [[], [["CI", 7], ["FU", 10, [0, 1, 2]], ["SP", 10, 0, 1024, [16], 1], ["AN", 10, 0, 5], ["AN", 10, 1, 6]]]], "r": [[3.76941e-06, 3.78869e-06, 3.79846e-06], 0, 1.53623, 1694769316], "v": "v0.6"}
{"i": [["[\"hori_fused_solve\", 4, 1, 256]", "cuda -keys=cuda,gpu -max_num_threads=1024 -model=unknown -thread_warp_size=32", [-1, 16, 64, 49152, 2147483647, 1024, 8, 32], "", 0, []], [[], [["CI", 7], ["FU", 10, [0, 1, 2]], ["SP", 10, 0, 1024, [2], 1], ["AN", 10, 0, 5], ["AN", 10, 1, 6]]]], "r": [[4.07158e-06, 4.06963e-06, 4.06058e-06], 0, 2.04124, 1694769316], "v": "v0.6"}
{"i": [["[\"hori_fused_solve\", 4, 1, 256]", "cuda -keys=cuda,gpu -max_num_threads=1024 -model=unknown -thread_warp_size=32", [-1, 16, 64, 49152, 2147483647, 1024, 8, 32], "", 0, []], [[], [["CI", 7], ["FU", 10, [0, 1, 2]], ["SP", 10, 0, 1024, [1], 1], ["AN", 10, 0, 5], ["AN", 10, 1, 6]]]], "r": [[3.88566e-06, 3.86518e-06, 3.85989e-06], 0, 1.31428, 1694769315], "v": "v0.6"}
{"i": [["[\"hori_fused_solve\", 4, 1, 256]", "cuda -keys=cuda,gpu -max_num_threads=1024 -model=unknown -thread_warp_size=32", [-1, 16, 64, 49152, 2147483647, 1024, 8, 32], "", 0, []], [[], [["CI", 7], ["FU", 10, [0, 1, 2]], ["SP", 10, 0, 1024, [4], 1], ["AN", 10, 0, 5], ["AN", 10, 1, 6]]]], "r": [[2.52569e-06, 2.52438e-06, 2.52405e-06], 0, 1.07394, 1694769315], "v": "v0.6"}
{"i": [["[\"hori_fused_solve\", 4, 1, 256]", "cuda -keys=cuda,gpu -max_num_threads=1024 -model=unknown -thread_warp_size=32", [-1, 16, 64, 49152, 2147483647, 1024, 8, 32], "", 0, []], [[], [["CI", 7], ["FU", 10, [0, 1, 2]], ["SP", 10, 0, 1024, [64], 1], ["AN", 10, 0, 5], ["AN", 10, 1, 6]]]], "r": [[4.09502e-06, 4.10774e-06, 4.09668e-06], 0, 1.80369, 1694769316], "v": "v0.6"}
{"i": [["[\"hori_fused_solve\", 4, 1, 256]", "cuda -keys=cuda,gpu -max_num_threads=1024 -model=unknown -thread_warp_size=32", [-1, 16, 64, 49152, 2147483647, 1024, 8, 32], "", 0, []], [[], [["CI", 7], ["FU", 10, [0, 1, 2]], ["SP", 10, 0, 1024, [8], 1], ["AN", 10, 0, 5], ["AN", 10, 1, 6]]]], "r": [[4.11402e-06, 4.13111e-06, 4.07043e-06], 0, 2.25252, 1694769316], "v": "v0.6"}
{"i": [["[\"hori_fused_solve\", 4, 1, 256]", "cuda -keys=cuda,gpu -max_num_threads=1024 -model=unknown -thread_warp_size=32", [-1, 16, 64, 49152, 2147483647, 1024, 8, 32], "", 0, []], [[], [["CI", 7], ["FU", 10, [0, 1, 2]], ["SP", 10, 0, 1024, [4], 1], ["AN", 10, 0, 5], ["AN", 10, 1, 6]]]], "r": [[5.05588e-06, 5.05628e-06, 5.05629e-06], 0, 1.44575, 1694795893], "v": "v0.6"}
{"i": [["[\"hori_fused_solve\", 4, 1, 256]", "cuda -keys=cuda,gpu -max_num_threads=1024 -model=unknown -thread_warp_size=32", [-1, 16, 64, 49152, 2147483647, 1024, 8, 32], "", 0, []], [[], [["CI", 7], ["FU", 10, [0, 1, 2]], ["SP", 10, 0, 1024, [32], 1], ["AN", 10, 0, 5], ["AN", 10, 1, 6]]]], "r": [[4.68724e-06, 4.68762e-06, 4.68662e-06], 0, 0.668047, 1694795892], "v": "v0.6"}
{"i": [["[\"hori_fused_solve\", 4, 1, 256]", "cuda -keys=cuda,gpu -max_num_threads=1024 -model=unknown -thread_warp_size=32", [-1, 16, 64, 49152, 2147483647, 1024, 8, 32], "", 0, []], [[], [["CI", 7], ["FU", 10, [0, 1, 2]], ["SP", 10, 0, 1024, [2], 1], ["AN", 10, 0, 5], ["AN", 10, 1, 6]]]], "r": [[5.63405e-06, 5.65115e-06, 5.65237e-06], 0, 1.09905, 1694795892], "v": "v0.6"}
{"i": [["[\"hori_fused_solve\", 4, 1, 256]", "cuda -keys=cuda,gpu -max_num_threads=1024 -model=unknown -thread_warp_size=32", [-1, 16, 64, 49152, 2147483647, 1024, 8, 32], "", 0, []], [[], [["CI", 7], ["FU", 10, [0, 1, 2]], ["SP", 10, 0, 1024, [8], 1], ["AN", 10, 0, 5], ["AN", 10, 1, 6]]]], "r": [[5.14199e-06, 5.15429e-06, 5.16963e-06], 0, 1.77815, 1694795893], "v": "v0.6"}
{"i": [["[\"hori_fused_solve\", 4, 1, 256]", "cuda -keys=cuda,gpu -max_num_threads=1024 -model=unknown -thread_warp_size=32", [-1, 16, 64, 49152, 2147483647, 1024, 8, 32], "", 0, []], [[], [["CI", 7], ["FU", 10, [0, 1, 2]], ["SP", 10, 0, 1024, [16], 1], ["AN", 10, 0, 5], ["AN", 10, 1, 6]]]], "r": [[4.82002e-06, 4.81606e-06, 4.81643e-06], 0, 2.19872, 1694795894], "v": "v0.6"}
{"i": [["[\"hori_fused_solve\", 4, 1, 256]", "cuda -keys=cuda,gpu -max_num_threads=1024 -model=unknown -thread_warp_size=32", [-1, 16, 64, 49152, 2147483647, 1024, 8, 32], "", 0, []], [[], [["CI", 7], ["FU", 10, [0, 1, 2]], ["SP", 10, 0, 1024, [64], 1], ["AN", 10, 0, 5], ["AN", 10, 1, 6]]]], "r": [[4.80556e-06, 4.8069e-06, 4.80603e-06], 0, 2.4939, 1694795894], "v": "v0.6"}
{"i": [["[\"hori_fused_solve\", 4, 1, 256]", "cuda -keys=cuda,gpu -max_num_threads=1024 -model=unknown -thread_warp_size=32", [-1, 16, 64, 49152, 2147483647, 1024, 8, 32], "", 0, []], [[], [["CI", 7], ["FU", 10, [0, 1, 2]], ["SP", 10, 0, 1024, [1], 1], ["AN", 10, 0, 5], ["AN", 10, 1, 6]]]], "r": [[5.96782e-06, 5.98865e-06, 5.98829e-06], 0, 2.80731, 1694795894], "v": "v0.6"}
