python/models/lstm/kernel_configs/hori_fused_solve_output_2_1_256.log
{"i": [["[\"hori_fused_solve_output\", 2, 1, 256]", "cuda -keys=cuda,gpu -max_num_threads=1024 -model=unknown -thread_warp_size=32", [-1, 16, 64, 49152, 2147483647, 1024, 8, 32], "", 0, []], [[], [["FU", 3, [0, 1, 2]], ["SP", 3, 0, 512, [16], 1], ["AN", 3, 0, 5], ["AN", 3, 1, 6]]]], "r": [[3.51958e-06, 3.52055e-06, 3.51933e-06], 0, 0.596981, 1694815526], "v": "v0.6"}
{"i": [["[\"hori_fused_solve_output\", 2, 1, 256]", "cuda -keys=cuda,gpu -max_num_threads=1024 -model=unknown -thread_warp_size=32", [-1, 16, 64, 49152, 2147483647, 1024, 8, 32], "", 0, []], [[], [["FU", 3, [0, 1, 2]], ["SP", 3, 0, 512, [2], 1], ["AN", 3, 0, 5], ["AN", 3, 1, 6]]]], "r": [[4.08455e-06, 4.09853e-06, 4.0969e-06], 0, 1.35397, 1694815527], "v": "v0.6"}
{"i": [["[\"hori_fused_solve_output\", 2, 1, 256]", "cuda -keys=cuda,gpu -max_num_threads=1024 -model=unknown -thread_warp_size=32", [-1, 16, 64, 49152, 2147483647, 1024, 8, 32], "", 0, []], [[], [["FU", 3, [0, 1, 2]], ["SP", 3, 0, 512, [1], 1], ["AN", 3, 0, 5], ["AN", 3, 1, 6]]]], "r": [[4.14015e-06, 4.1348e-06, 4.13667e-06], 0, 0.955878, 1694815526], "v": "v0.6"}
{"i": [["[\"hori_fused_solve_output\", 2, 1, 256]", "cuda -keys=cuda,gpu -max_num_threads=1024 -model=unknown -thread_warp_size=32", [-1, 16, 64, 49152, 2147483647, 1024, 8, 32], "", 0, []], [[], [["FU", 3, [0, 1, 2]], ["SP", 3, 0, 512, [64], 1], ["AN", 3, 0, 5], ["AN", 3, 1, 6]]]], "r": [[3.57443e-06, 3.57434e-06, 3.57792e-06], 0, 2.50055, 1694815528], "v": "v0.6"}
{"i": [["[\"hori_fused_solve_output\", 2, 1, 256]", "cuda -keys=cuda,gpu -max_num_threads=1024 -model=unknown -thread_warp_size=32", [-1, 16, 64, 49152, 2147483647, 1024, 8, 32], "", 0, []], [[], [["FU", 3, [0, 1, 2]], ["SP", 3, 0, 512, [4], 1], ["AN", 3, 0, 5], ["AN", 3, 1, 6]]]], "r": [[3.91741e-06, 3.92461e-06, 3.92401e-06], 0, 1.71081, 1694815527], "v": "v0.6"}
{"i": [["[\"hori_fused_solve_output\", 2, 1, 256]", "cuda -keys=cuda,gpu -max_num_threads=1024 -model=unknown -thread_warp_size=32", [-1, 16, 64, 49152, 2147483647, 1024, 8, 32], "", 0, []], [[], [["FU", 3, [0, 1, 2]], ["SP", 3, 0, 512, [8], 1], ["AN", 3, 0, 5], ["AN", 3, 1, 6]]]], "r": [[3.71806e-06, 3.72746e-06, 3.72743e-06], 0, 2.86143, 1694815528], "v": "v0.6"}
{"i": [["[\"hori_fused_solve_output\", 2, 1, 256]", "cuda -keys=cuda,gpu -max_num_threads=1024 -model=unknown -thread_warp_size=32", [-1, 16, 64, 49152, 2147483647, 1024, 8, 32], "", 0, []], [[], [["FU", 3, [0, 1, 2]], ["SP", 3, 0, 512, [32], 1], ["AN", 3, 0, 5], ["AN", 3, 1, 6]]]], "r": [[3.47095e-06, 3.47158e-06, 3.47084e-06], 0, 2.10447, 1694815527], "v": "v0.6"}
{"i": [["[\"hori_fused_solve_output\", 2, 1, 256]", "cuda -keys=cuda,gpu -max_num_threads=1024 -model=unknown -thread_warp_size=32", [-1, 16, 64, 49152, 2147483647, 1024, 8, 32], "", 0, []], [[], [["FU", 3, [0, 1, 2]], ["SP", 3, 0, 512, [8], 1], ["AN", 3, 0, 5], ["AN", 3, 1, 6]]]], "r": [[3.5853e-06, 3.58725e-06, 3.58901e-06], 0, 2.02227, 1694859354], "v": "v0.6"}
{"i": [["[\"hori_fused_solve_output\", 2, 1, 256]", "cuda -keys=cuda,gpu -max_num_threads=1024 -model=unknown -thread_warp_size=32", [-1, 16, 64, 49152, 2147483647, 1024, 8, 32], "", 0, []], [[], [["FU", 3, [0, 1, 2]], ["SP", 3, 0, 512, [16], 1], ["AN", 3, 0, 5], ["AN", 3, 1, 6]]]], "r": [[3.75532e-06, 3.76559e-06, 3.76813e-06], 0, 1.2642, 1694859353], "v": "v0.6"}
{"i": [["[\"hori_fused_solve_output\", 2, 1, 256]", "cuda -keys=cuda,gpu -max_num_threads=1024 -model=unknown -thread_warp_size=32", [-1, 16, 64, 49152, 2147483647, 1024, 8, 32], "", 0, []], [[], [["FU", 3, [0, 1, 2]], ["SP", 3, 0, 512, [4], 1], ["AN", 3, 0, 5], ["AN", 3, 1, 6]]]], "r": [[3.58479e-06, 3.58498e-06, 3.58476e-06], 0, 0.578171, 1694859352], "v": "v0.6"}
{"i": [["[\"hori_fused_solve_output\", 2, 1, 256]", "cuda -keys=cuda,gpu -max_num_threads=1024 -model=unknown -thread_warp_size=32", [-1, 16, 64, 49152, 2147483647, 1024, 8, 32], "", 0, []], [[], [["FU", 3, [0, 1, 2]], ["SP", 3, 0, 512, [2], 1], ["AN", 3, 0, 5], ["AN", 3, 1, 6]]]], "r": [[3.88189e-06, 3.88256e-06, 3.88166e-06], 0, 0.871959, 1694859353], "v": "v0.6"}
{"i": [["[\"hori_fused_solve_output\", 2, 1, 256]", "cuda -keys=cuda,gpu -max_num_threads=1024 -model=unknown -thread_warp_size=32", [-1, 16, 64, 49152, 2147483647, 1024, 8, 32], "", 0, []], [[], [["FU", 3, [0, 1, 2]], ["SP", 3, 0, 512, [32], 1], ["AN", 3, 0, 5], ["AN", 3, 1, 6]]]], "r": [[3.50185e-06, 3.53845e-06, 3.53752e-06], 0, 2.73841, 1694859355], "v": "v0.6"}
{"i": [["[\"hori_fused_solve_output\", 2, 1, 256]", "cuda -keys=cuda,gpu -max_num_threads=1024 -model=unknown -thread_warp_size=32", [-1, 16, 64, 49152, 2147483647, 1024, 8, 32], "", 0, []], [[], [["FU", 3, [0, 1, 2]], ["SP", 3, 0, 512, [1], 1], ["AN", 3, 0, 5], ["AN", 3, 1, 6]]]], "r": [[4.16702e-06, 4.16697e-06, 4.16659e-06], 0, 1.64288, 1694859353], "v": "v0.6"}
{"i": [["[\"hori_fused_solve_output\", 2, 1, 256]", "cuda -keys=cuda,gpu -max_num_threads=1024 -model=unknown -thread_warp_size=32", [-1, 16, 64, 49152, 2147483647, 1024, 8, 32], "", 0, []], [[], [["FU", 3, [0, 1, 2]], ["SP", 3, 0, 512, [64], 1], ["AN", 3, 0, 5], ["AN", 3, 1, 6]]]], "r": [[3.59383e-06, 3.60017e-06, 3.59321e-06], 0, 2.3994, 1694859354], "v": "v0.6"}
