python/models/lstm/kernel_configs/hori_fused_solve_hidden_5_1_256.log
{"i": [["[\"hori_fused_solve_hidden\", 5, 1, 256]", "cuda -keys=cuda,gpu -max_num_threads=1024 -model=unknown -thread_warp_size=32", [-1, 16, 64, 49152, 2147483647, 1024, 8, 32], "", 0, []], [[], [["FU", 7, [0, 1, 2]], ["SP", 7, 0, 1280, [40], 1], ["AN", 7, 0, 5], ["AN", 7, 1, 6]]]], "r": [[4.30732e-06, 4.30701e-06, 4.30729e-06], 0, 1.684, 1694815916], "v": "v0.6"}
{"i": [["[\"hori_fused_solve_hidden\", 5, 1, 256]", "cuda -keys=cuda,gpu -max_num_threads=1024 -model=unknown -thread_warp_size=32", [-1, 16, 64, 49152, 2147483647, 1024, 8, 32], "", 0, []], [[], [["FU", 7, [0, 1, 2]], ["SP", 7, 0, 1280, [4], 1], ["AN", 7, 0, 5], ["AN", 7, 1, 6]]]], "r": [[4.66421e-06, 4.66481e-06, 4.6648e-06], 0, 2.08396, 1694815916], "v": "v0.6"}
{"i": [["[\"hori_fused_solve_hidden\", 5, 1, 256]", "cuda -keys=cuda,gpu -max_num_threads=1024 -model=unknown -thread_warp_size=32", [-1, 16, 64, 49152, 2147483647, 1024, 8, 32], "", 0, []], [[], [["FU", 7, [0, 1, 2]], ["SP", 7, 0, 1280, [20], 1], ["AN", 7, 0, 5], ["AN", 7, 1, 6]]]], "r": [[4.61047e-06, 4.62154e-06, 4.62175e-06], 0, 0.728706, 1694815915], "v": "v0.6"}
{"i": [["[\"hori_fused_solve_hidden\", 5, 1, 256]", "cuda -keys=cuda,gpu -max_num_threads=1024 -model=unknown -thread_warp_size=32", [-1, 16, 64, 49152, 2147483647, 1024, 8, 32], "", 0, []], [[], [["FU", 7, [0, 1, 2]], ["SP", 7, 0, 1280, [5], 1], ["AN", 7, 0, 5], ["AN", 7, 1, 6]]]], "r": [[4.66761e-06, 4.667e-06, 4.66638e-06], 0, 0.994453, 1694815915], "v": "v0.6"}
{"i": [["[\"hori_fused_solve_hidden\", 5, 1, 256]", "cuda -keys=cuda,gpu -max_num_threads=1024 -model=unknown -thread_warp_size=32", [-1, 16, 64, 49152, 2147483647, 1024, 8, 32], "", 0, []], [[], [["FU", 7, [0, 1, 2]], ["SP", 7, 0, 1280, [1], 1], ["AN", 7, 0, 5], ["AN", 7, 1, 6]]]], "r": [[5.52363e-06, 5.52488e-06, 5.52497e-06], 0, 2.8431, 1694815917], "v": "v0.6"}
{"i": [["[\"hori_fused_solve_hidden\", 5, 1, 256]", "cuda -keys=cuda,gpu -max_num_threads=1024 -model=unknown -thread_warp_size=32", [-1, 16, 64, 49152, 2147483647, 1024, 8, 32], "", 0, []], [[], [["FU", 7, [0, 1, 2]], ["SP", 7, 0, 1280, [32], 1], ["AN", 7, 0, 5], ["AN", 7, 1, 6]]]], "r": [[4.59887e-06, 4.59841e-06, 4.60275e-06], 0, 1.30246, 1694815916], "v": "v0.6"}
{"i": [["[\"hori_fused_solve_hidden\", 5, 1, 256]", "cuda -keys=cuda,gpu -max_num_threads=1024 -model=unknown -thread_warp_size=32", [-1, 16, 64, 49152, 2147483647, 1024, 8, 32], "", 0, []], [[], [["FU", 7, [0, 1, 2]], ["SP", 7, 0, 1280, [64], 1], ["AN", 7, 0, 5], ["AN", 7, 1, 6]]]], "r": [[4.52251e-06, 4.53236e-06, 4.53385e-06], 0, 3.20389, 1694815917], "v": "v0.6"}
{"i": [["[\"hori_fused_solve_hidden\", 5, 1, 256]", "cuda -keys=cuda,gpu -max_num_threads=1024 -model=unknown -thread_warp_size=32", [-1, 16, 64, 49152, 2147483647, 1024, 8, 32], "", 0, []], [[], [["FU", 7, [0, 1, 2]], ["SP", 7, 0, 1280, [8], 1], ["AN", 7, 0, 5], ["AN", 7, 1, 6]]]], "r": [[4.42424e-06, 4.4226e-06, 4.42437e-06], 0, 2.45742, 1694815917], "v": "v0.6"}
{"i": [["[\"hori_fused_solve_hidden\", 5, 1, 256]", "cuda -keys=cuda,gpu -max_num_threads=1024 -model=unknown -thread_warp_size=32", [-1, 16, 64, 49152, 2147483647, 1024, 8, 32], "", 0, []], [[], [["FU", 7, [0, 1, 2]], ["SP", 7, 0, 1280, [10], 1], ["AN", 7, 0, 5], ["AN", 7, 1, 6]]]], "r": [[4.62786e-06, 4.63961e-06, 4.63928e-06], 0, 4.29437, 1694815919], "v": "v0.6"}
{"i": [["[\"hori_fused_solve_hidden\", 5, 1, 256]", "cuda -keys=cuda,gpu -max_num_threads=1024 -model=unknown -thread_warp_size=32", [-1, 16, 64, 49152, 2147483647, 1024, 8, 32], "", 0, []], [[], [["FU", 7, [0, 1, 2]], ["SP", 7, 0, 1280, [16], 1], ["AN", 7, 0, 5], ["AN", 7, 1, 6]]]], "r": [[4.37631e-06, 4.37601e-06, 4.37702e-06], 0, 3.97094, 1694815918], "v": "v0.6"}
{"i": [["[\"hori_fused_solve_hidden\", 5, 1, 256]", "cuda -keys=cuda,gpu -max_num_threads=1024 -model=unknown -thread_warp_size=32", [-1, 16, 64, 49152, 2147483647, 1024, 8, 32], "", 0, []], [[], [["FU", 7, [0, 1, 2]], ["SP", 7, 0, 1280, [2], 1], ["AN", 7, 0, 5], ["AN", 7, 1, 6]]]], "r": [[5.052e-06, 5.06196e-06, 5.06396e-06], 0, 3.52757, 1694815918], "v": "v0.6"}
{"i": [["[\"hori_fused_solve_hidden\", 5, 1, 256]", "cuda -keys=cuda,gpu -max_num_threads=1024 -model=unknown -thread_warp_size=32", [-1, 16, 64, 49152, 2147483647, 1024, 8, 32], "", 0, []], [[], [["FU", 7, [0, 1, 2]], ["SP", 7, 0, 1280, [4], 1], ["AN", 7, 0, 5], ["AN", 7, 1, 6]]]], "r": [[5.00281e-06, 5.01399e-06, 5.01454e-06], 0, 0.601892, 1694859736], "v": "v0.6"}
{"i": [["[\"hori_fused_solve_hidden\", 5, 1, 256]", "cuda -keys=cuda,gpu -max_num_threads=1024 -model=unknown -thread_warp_size=32", [-1, 16, 64, 49152, 2147483647, 1024, 8, 32], "", 0, []], [[], [["FU", 7, [0, 1, 2]], ["SP", 7, 0, 1280, [2], 1], ["AN", 7, 0, 5], ["AN", 7, 1, 6]]]], "r": [[5.3696e-06, 5.38074e-06, 5.37768e-06], 0, 2.1065, 1694859737], "v": "v0.6"}
{"i": [["[\"hori_fused_solve_hidden\", 5, 1, 256]", "cuda -keys=cuda,gpu -max_num_threads=1024 -model=unknown -thread_warp_size=32", [-1, 16, 64, 49152, 2147483647, 1024, 8, 32], "", 0, []], [[], [["FU", 7, [0, 1, 2]], ["SP", 7, 0, 1280, [64], 1], ["AN", 7, 0, 5], ["AN", 7, 1, 6]]]], "r": [[4.52517e-06, 4.53402e-06, 4.53448e-06], 0, 1.303, 1694859737], "v": "v0.6"}
{"i": [["[\"hori_fused_solve_hidden\", 5, 1, 256]", "cuda -keys=cuda,gpu -max_num_threads=1024 -model=unknown -thread_warp_size=32", [-1, 16, 64, 49152, 2147483647, 1024, 8, 32], "", 0, []], [[], [["FU", 7, [0, 1, 2]], ["SP", 7, 0, 1280, [5], 1], ["AN", 7, 0, 5], ["AN", 7, 1, 6]]]], "r": [[4.85922e-06, 4.8687e-06, 4.8677e-06], 0, 2.39908, 1694859738], "v": "v0.6"}
{"i": [["[\"hori_fused_solve_hidden\", 5, 1, 256]", "cuda -keys=cuda,gpu -max_num_threads=1024 -model=unknown -thread_warp_size=32", [-1, 16, 64, 49152, 2147483647, 1024, 8, 32], "", 0, []], [[], [["FU", 7, [0, 1, 2]], ["SP", 7, 0, 1280, [1], 1], ["AN", 7, 0, 5], ["AN", 7, 1, 6]]]], "r": [[5.80422e-06, 5.81274e-06, 5.81193e-06], 0, 1.00864, 1694859736], "v": "v0.6"}
{"i": [["[\"hori_fused_solve_hidden\", 5, 1, 256]", "cuda -keys=cuda,gpu -max_num_threads=1024 -model=unknown -thread_warp_size=32", [-1, 16, 64, 49152, 2147483647, 1024, 8, 32], "", 0, []], [[], [["FU", 7, [0, 1, 2]], ["SP", 7, 0, 1280, [20], 1], ["AN", 7, 0, 5], ["AN", 7, 1, 6]]]], "r": [[4.53905e-06, 4.53912e-06, 4.53813e-06], 0, 1.76278, 1694859737], "v": "v0.6"}
{"i": [["[\"hori_fused_solve_hidden\", 5, 1, 256]", "cuda -keys=cuda,gpu -max_num_threads=1024 -model=unknown -thread_warp_size=32", [-1, 16, 64, 49152, 2147483647, 1024, 8, 32], "", 0, []], [[], [["FU", 7, [0, 1, 2]], ["SP", 7, 0, 1280, [16], 1], ["AN", 7, 0, 5], ["AN", 7, 1, 6]]]], "r": [[4.46733e-06, 4.48374e-06, 4.48482e-06], 0, 2.80201, 1694859738], "v": "v0.6"}
{"i": [["[\"hori_fused_solve_hidden\", 5, 1, 256]", "cuda -keys=cuda,gpu -max_num_threads=1024 -model=unknown -thread_warp_size=32", [-1, 16, 64, 49152, 2147483647, 1024, 8, 32], "", 0, []], [[], [["FU", 7, [0, 1, 2]], ["SP", 7, 0, 1280, [40], 1], ["AN", 7, 0, 5], ["AN", 7, 1, 6]]]], "r": [[4.39368e-06, 4.39288e-06, 4.39372e-06], 0, 3.20312, 1694859738], "v": "v0.6"}
{"i": [["[\"hori_fused_solve_hidden\", 5, 1, 256]", "cuda -keys=cuda,gpu -max_num_threads=1024 -model=unknown -thread_warp_size=32", [-1, 16, 64, 49152, 2147483647, 1024, 8, 32], "", 0, []], [[], [["FU", 7, [0, 1, 2]], ["SP", 7, 0, 1280, [8], 1], ["AN", 7, 0, 5], ["AN", 7, 1, 6]]]], "r": [[4.75448e-06, 4.76558e-06, 4.76475e-06], 0, 3.54863, 1694859739], "v": "v0.6"}
{"i": [["[\"hori_fused_solve_hidden\", 5, 1, 256]", "cuda -keys=cuda,gpu -max_num_threads=1024 -model=unknown -thread_warp_size=32", [-1, 16, 64, 49152, 2147483647, 1024, 8, 32], "", 0, []], [[], [["FU", 7, [0, 1, 2]], ["SP", 7, 0, 1280, [10], 1], ["AN", 7, 0, 5], ["AN", 7, 1, 6]]]], "r": [[4.53469e-06, 4.5342e-06, 4.53467e-06], 0, 4.34063, 1694859740], "v": "v0.6"}
{"i": [["[\"hori_fused_solve_hidden\", 5, 1, 256]", "cuda -keys=cuda,gpu -max_num_threads=1024 -model=unknown -thread_warp_size=32", [-1, 16, 64, 49152, 2147483647, 1024, 8, 32], "", 0, []], [[], [["FU", 7, [0, 1, 2]], ["SP", 7, 0, 1280, [32], 1], ["AN", 7, 0, 5], ["AN", 7, 1, 6]]]], "r": [[4.47535e-06, 4.47788e-06, 4.47261e-06], 0, 3.91052, 1694859739], "v": "v0.6"}
