python/models/lstm/kernel_configs/hori_fused_solve_output_7_1_256.log
{"i": [["[\"hori_fused_solve_output\", 7, 1, 256]", "cuda -keys=cuda,gpu -max_num_threads=1024 -model=unknown -thread_warp_size=32", [-1, 16, 64, 49152, 2147483647, 1024, 8, 32], "", 0, []], [[], [["FU", 3, [0, 1, 2]], ["SP", 3, 0, 1792, [28], 1], ["AN", 3, 0, 5], ["AN", 3, 1, 6]]]], "r": [[3.86239e-06, 3.873e-06, 3.87445e-06], 0, 1.2833, 1694815671], "v": "v0.6"}
{"i": [["[\"hori_fused_solve_output\", 7, 1, 256]", "cuda -keys=cuda,gpu -max_num_threads=1024 -model=unknown -thread_warp_size=32", [-1, 16, 64, 49152, 2147483647, 1024, 8, 32], "", 0, []], [[], [["FU", 3, [0, 1, 2]], ["SP", 3, 0, 1792, [14], 1], ["AN", 3, 0, 5], ["AN", 3, 1, 6]]]], "r": [[3.58494e-06, 3.58455e-06, 3.58479e-06], 0, 2.04956, 1694815672], "v": "v0.6"}
{"i": [["[\"hori_fused_solve_output\", 7, 1, 256]", "cuda -keys=cuda,gpu -max_num_threads=1024 -model=unknown -thread_warp_size=32", [-1, 16, 64, 49152, 2147483647, 1024, 8, 32], "", 0, []], [[], [["FU", 3, [0, 1, 2]], ["SP", 3, 0, 1792, [64], 1], ["AN", 3, 0, 5], ["AN", 3, 1, 6]]]], "r": [[3.83017e-06, 3.8416e-06, 3.84399e-06], 0, 1.66391, 1694815672], "v": "v0.6"}
{"i": [["[\"hori_fused_solve_output\", 7, 1, 256]", "cuda -keys=cuda,gpu -max_num_threads=1024 -model=unknown -thread_warp_size=32", [-1, 16, 64, 49152, 2147483647, 1024, 8, 32], "", 0, []], [[], [["FU", 3, [0, 1, 2]], ["SP", 3, 0, 1792, [16], 1], ["AN", 3, 0, 5], ["AN", 3, 1, 6]]]], "r": [[3.78407e-06, 3.78339e-06, 3.78473e-06], 0, 2.46237, 1694815673], "v": "v0.6"}
{"i": [["[\"hori_fused_solve_output\", 7, 1, 256]", "cuda -keys=cuda,gpu -max_num_threads=1024 -model=unknown -thread_warp_size=32", [-1, 16, 64, 49152, 2147483647, 1024, 8, 32], "", 0, []], [[], [["FU", 3, [0, 1, 2]], ["SP", 3, 0, 1792, [32], 1], ["AN", 3, 0, 5], ["AN", 3, 1, 6]]]], "r": [[3.58507e-06, 3.60111e-06, 3.60578e-06], 0, 2.86552, 1694815673], "v": "v0.6"}
{"i": [["[\"hori_fused_solve_output\", 7, 1, 256]", "cuda -keys=cuda,gpu -max_num_threads=1024 -model=unknown -thread_warp_size=32", [-1, 16, 64, 49152, 2147483647, 1024, 8, 32], "", 0, []], [[], [["FU", 3, [0, 1, 2]], ["SP", 3, 0, 1792, [2], 1], ["AN", 3, 0, 5], ["AN", 3, 1, 6]]]], "r": [[4.38385e-06, 4.38278e-06, 4.38287e-06], 0, 0.739123, 1694815671], "v": "v0.6"}
{"i": [["[\"hori_fused_solve_output\", 7, 1, 256]", "cuda -keys=cuda,gpu -max_num_threads=1024 -model=unknown -thread_warp_size=32", [-1, 16, 64, 49152, 2147483647, 1024, 8, 32], "", 0, []], [[], [["FU", 3, [0, 1, 2]], ["SP", 3, 0, 1792, [1], 1], ["AN", 3, 0, 5], ["AN", 3, 1, 6]]]], "r": [[5.5243e-06, 5.53641e-06, 5.53752e-06], 0, 0.889859, 1694815671], "v": "v0.6"}
{"i": [["[\"hori_fused_solve_output\", 7, 1, 256]", "cuda -keys=cuda,gpu -max_num_threads=1024 -model=unknown -thread_warp_size=32", [-1, 16, 64, 49152, 2147483647, 1024, 8, 32], "", 0, []], [[], [["FU", 3, [0, 1, 2]], ["SP", 3, 0, 1792, [4], 1], ["AN", 3, 0, 5], ["AN", 3, 1, 6]]]], "r": [[3.99229e-06, 3.9921e-06, 3.99224e-06], 0, 3.22486, 1694815673], "v": "v0.6"}
{"i": [["[\"hori_fused_solve_output\", 7, 1, 256]", "cuda -keys=cuda,gpu -max_num_threads=1024 -model=unknown -thread_warp_size=32", [-1, 16, 64, 49152, 2147483647, 1024, 8, 32], "", 0, []], [[], [["FU", 3, [0, 1, 2]], ["SP", 3, 0, 1792, [56], 1], ["AN", 3, 0, 5], ["AN", 3, 1, 6]]]], "r": [[3.52712e-06, 3.52826e-06, 3.52643e-06], 0, 3.70497, 1694815674], "v": "v0.6"}
{"i": [["[\"hori_fused_solve_output\", 7, 1, 256]", "cuda -keys=cuda,gpu -max_num_threads=1024 -model=unknown -thread_warp_size=32", [-1, 16, 64, 49152, 2147483647, 1024, 8, 32], "", 0, []], [[], [["FU", 3, [0, 1, 2]], ["SP", 3, 0, 1792, [8], 1], ["AN", 3, 0, 5], ["AN", 3, 1, 6]]]], "r": [[3.79762e-06, 3.79733e-06, 3.7968e-06], 0, 4.0177, 1694815674], "v": "v0.6"}
{"i": [["[\"hori_fused_solve_output\", 7, 1, 256]", "cuda -keys=cuda,gpu -max_num_threads=1024 -model=unknown -thread_warp_size=32", [-1, 16, 64, 49152, 2147483647, 1024, 8, 32], "", 0, []], [[], [["FU", 3, [0, 1, 2]], ["SP", 3, 0, 1792, [7], 1], ["AN", 3, 0, 5], ["AN", 3, 1, 6]]]], "r": [[3.9224e-06, 3.92234e-06, 3.92045e-06], 0, 4.45885, 1694815675], "v": "v0.6"}
{"i": [["[\"hori_fused_solve_output\", 7, 1, 256]", "cuda -keys=cuda,gpu -max_num_threads=1024 -model=unknown -thread_warp_size=32", [-1, 16, 64, 49152, 2147483647, 1024, 8, 32], "", 0, []], [[], [["FU", 3, [0, 1, 2]], ["SP", 3, 0, 1792, [16], 1], ["AN", 3, 0, 5], ["AN", 3, 1, 6]]]], "r": [[3.90813e-06, 3.91771e-06, 3.91674e-06], 0, 1.89363, 1694859478], "v": "v0.6"}
{"i": [["[\"hori_fused_solve_output\", 7, 1, 256]", "cuda -keys=cuda,gpu -max_num_threads=1024 -model=unknown -thread_warp_size=32", [-1, 16, 64, 49152, 2147483647, 1024, 8, 32], "", 0, []], [[], [["FU", 3, [0, 1, 2]], ["SP", 3, 0, 1792, [2], 1], ["AN", 3, 0, 5], ["AN", 3, 1, 6]]]], "r": [[4.42679e-06, 4.42627e-06, 4.42697e-06], 0, 2.6658, 1694859479], "v": "v0.6"}
{"i": [["[\"hori_fused_solve_output\", 7, 1, 256]", "cuda -keys=cuda,gpu -max_num_threads=1024 -model=unknown -thread_warp_size=32", [-1, 16, 64, 49152, 2147483647, 1024, 8, 32], "", 0, []], [[], [["FU", 3, [0, 1, 2]], ["SP", 3, 0, 1792, [64], 1], ["AN", 3, 0, 5], ["AN", 3, 1, 6]]]], "r": [[3.87932e-06, 3.89393e-06, 3.89451e-06], 0, 0.718036, 1694859477], "v": "v0.6"}
{"i": [["[\"hori_fused_solve_output\", 7, 1, 256]", "cuda -keys=cuda,gpu -max_num_threads=1024 -model=unknown -thread_warp_size=32", [-1, 16, 64, 49152, 2147483647, 1024, 8, 32], "", 0, []], [[], [["FU", 3, [0, 1, 2]], ["SP", 3, 0, 1792, [7], 1], ["AN", 3, 0, 5], ["AN", 3, 1, 6]]]], "r": [[3.76059e-06, 3.76003e-06, 3.76086e-06], 0, 1.20646, 1694859478], "v": "v0.6"}
{"i": [["[\"hori_fused_solve_output\", 7, 1, 256]", "cuda -keys=cuda,gpu -max_num_threads=1024 -model=unknown -thread_warp_size=32", [-1, 16, 64, 49152, 2147483647, 1024, 8, 32], "", 0, []], [[], [["FU", 3, [0, 1, 2]], ["SP", 3, 0, 1792, [32], 1], ["AN", 3, 0, 5], ["AN", 3, 1, 6]]]], "r": [[3.64529e-06, 3.6409e-06, 3.63781e-06], 0, 0.797493, 1694859477], "v": "v0.6"}
{"i": [["[\"hori_fused_solve_output\", 7, 1, 256]", "cuda -keys=cuda,gpu -max_num_threads=1024 -model=unknown -thread_warp_size=32", [-1, 16, 64, 49152, 2147483647, 1024, 8, 32], "", 0, []], [[], [["FU", 3, [0, 1, 2]], ["SP", 3, 0, 1792, [8], 1], ["AN", 3, 0, 5], ["AN", 3, 1, 6]]]], "r": [[3.75445e-06, 3.75197e-06, 3.75145e-06], 0, 2.28585, 1694859479], "v": "v0.6"}
{"i": [["[\"hori_fused_solve_output\", 7, 1, 256]", "cuda -keys=cuda,gpu -max_num_threads=1024 -model=unknown -thread_warp_size=32", [-1, 16, 64, 49152, 2147483647, 1024, 8, 32], "", 0, []], [[], [["FU", 3, [0, 1, 2]], ["SP", 3, 0, 1792, [1], 1], ["AN", 3, 0, 5], ["AN", 3, 1, 6]]]], "r": [[5.28378e-06, 5.29093e-06, 5.29232e-06], 0, 1.56885, 1694859478], "v": "v0.6"}
{"i": [["[\"hori_fused_solve_output\", 7, 1, 256]", "cuda -keys=cuda,gpu -max_num_threads=1024 -model=unknown -thread_warp_size=32", [-1, 16, 64, 49152, 2147483647, 1024, 8, 32], "", 0, []], [[], [["FU", 3, [0, 1, 2]], ["SP", 3, 0, 1792, [56], 1], ["AN", 3, 0, 5], ["AN", 3, 1, 6]]]], "r": [[3.6005e-06, 3.59779e-06, 3.60056e-06], 0, 3.04396, 1694859479], "v": "v0.6"}
{"i": [["[\"hori_fused_solve_output\", 7, 1, 256]", "cuda -keys=cuda,gpu -max_num_threads=1024 -model=unknown -thread_warp_size=32", [-1, 16, 64, 49152, 2147483647, 1024, 8, 32], "", 0, []], [[], [["FU", 3, [0, 1, 2]], ["SP", 3, 0, 1792, [14], 1], ["AN", 3, 0, 5], ["AN", 3, 1, 6]]]], "r": [[3.93917e-06, 3.95078e-06, 3.95107e-06], 0, 3.76027, 1694859480], "v": "v0.6"}
{"i": [["[\"hori_fused_solve_output\", 7, 1, 256]", "cuda -keys=cuda,gpu -max_num_threads=1024 -model=unknown -thread_warp_size=32", [-1, 16, 64, 49152, 2147483647, 1024, 8, 32], "", 0, []], [[], [["FU", 3, [0, 1, 2]], ["SP", 3, 0, 1792, [28], 1], ["AN", 3, 0, 5], ["AN", 3, 1, 6]]]], "r": [[3.73416e-06, 3.73026e-06, 3.73224e-06], 0, 4.13834, 1694859481], "v": "v0.6"}
{"i": [["[\"hori_fused_solve_output\", 7, 1, 256]", "cuda -keys=cuda,gpu -max_num_threads=1024 -model=unknown -thread_warp_size=32", [-1, 16, 64, 49152, 2147483647, 1024, 8, 32], "", 0, []], [[], [["FU", 3, [0, 1, 2]], ["SP", 3, 0, 1792, [4], 1], ["AN", 3, 0, 5], ["AN", 3, 1, 6]]]], "r": [[4.00332e-06, 3.99435e-06, 3.99711e-06], 0, 3.45297, 1694859480], "v": "v0.6"}
