python/models/lstm/kernel_configs/hori_fused_solve_hidden_10_1_256.log
{"i": [["[\"hori_fused_solve_hidden\", 10, 1, 256]", "cuda -keys=cuda,gpu -max_num_threads=1024 -model=unknown -thread_warp_size=32", [-1, 16, 64, 49152, 2147483647, 1024, 8, 32], "", 0, []], [[], [["FU", 7, [0, 1, 2]], ["SP", 7, 0, 2560, [40], 1], ["AN", 7, 0, 5], ["AN", 7, 1, 6]]]], "r": [[4.4894e-06, 4.49466e-06, 4.49564e-06], 0, 1.42602, 1694815767], "v": "v0.6"}
{"i": [["[\"hori_fused_solve_hidden\", 10, 1, 256]", "cuda -keys=cuda,gpu -max_num_threads=1024 -model=unknown -thread_warp_size=32", [-1, 16, 64, 49152, 2147483647, 1024, 8, 32], "", 0, []], [[], [["FU", 7, [0, 1, 2]], ["SP", 7, 0, 2560, [4], 1], ["AN", 7, 0, 5], ["AN", 7, 1, 6]]]], "r": [[4.95852e-06, 4.95809e-06, 4.95831e-06], 0, 2.247, 1694815768], "v": "v0.6"}
{"i": [["[\"hori_fused_solve_hidden\", 10, 1, 256]", "cuda -keys=cuda,gpu -max_num_threads=1024 -model=unknown -thread_warp_size=32", [-1, 16, 64, 49152, 2147483647, 1024, 8, 32], "", 0, []], [[], [["FU", 7, [0, 1, 2]], ["SP", 7, 0, 2560, [64], 1], ["AN", 7, 0, 5], ["AN", 7, 1, 6]]]], "r": [[4.3938e-06, 4.39328e-06, 4.39299e-06], 0, 2.66329, 1694815768], "v": "v0.6"}
{"i": [["[\"hori_fused_solve_hidden\", 10, 1, 256]", "cuda -keys=cuda,gpu -max_num_threads=1024 -model=unknown -thread_warp_size=32", [-1, 16, 64, 49152, 2147483647, 1024, 8, 32], "", 0, []], [[], [["FU", 7, [0, 1, 2]], ["SP", 7, 0, 2560, [1], 1], ["AN", 7, 0, 5], ["AN", 7, 1, 6]]]], "r": [[7.12445e-06, 7.12478e-06, 7.12889e-06], 0, 1.88678, 1694815768], "v": "v0.6"}
{"i": [["[\"hori_fused_solve_hidden\", 10, 1, 256]", "cuda -keys=cuda,gpu -max_num_threads=1024 -model=unknown -thread_warp_size=32", [-1, 16, 64, 49152, 2147483647, 1024, 8, 32], "", 0, []], [[], [["FU", 7, [0, 1, 2]], ["SP", 7, 0, 2560, [8], 1], ["AN", 7, 0, 5], ["AN", 7, 1, 6]]]], "r": [[4.6236e-06, 4.62491e-06, 4.62191e-06], 0, 3.59467, 1694815769], "v": "v0.6"}
{"i": [["[\"hori_fused_solve_hidden\", 10, 1, 256]", "cuda -keys=cuda,gpu -max_num_threads=1024 -model=unknown -thread_warp_size=32", [-1, 16, 64, 49152, 2147483647, 1024, 8, 32], "", 0, []], [[], [["FU", 7, [0, 1, 2]], ["SP", 7, 0, 2560, [20], 1], ["AN", 7, 0, 5], ["AN", 7, 1, 6]]]], "r": [[4.45904e-06, 4.46493e-06, 4.46434e-06], 0, 1.11089, 1694815767], "v": "v0.6"}
{"i": [["[\"hori_fused_solve_hidden\", 10, 1, 256]", "cuda -keys=cuda,gpu -max_num_threads=1024 -model=unknown -thread_warp_size=32", [-1, 16, 64, 49152, 2147483647, 1024, 8, 32], "", 0, []], [[], [["FU", 7, [0, 1, 2]], ["SP", 7, 0, 2560, [16], 1], ["AN", 7, 0, 5], ["AN", 7, 1, 6]]]], "r": [[4.65875e-06, 4.65776e-06, 4.65798e-06], 0, 4.03017, 1694815770], "v": "v0.6"}
{"i": [["[\"hori_fused_solve_hidden\", 10, 1, 256]", "cuda -keys=cuda,gpu -max_num_threads=1024 -model=unknown -thread_warp_size=32", [-1, 16, 64, 49152, 2147483647, 1024, 8, 32], "", 0, []], [[], [["FU", 7, [0, 1, 2]], ["SP", 7, 0, 2560, [2], 1], ["AN", 7, 0, 5], ["AN", 7, 1, 6]]]], "r": [[5.60857e-06, 5.60808e-06, 5.60847e-06], 0, 3.1522, 1694815769], "v": "v0.6"}
{"i": [["[\"hori_fused_solve_hidden\", 10, 1, 256]", "cuda -keys=cuda,gpu -max_num_threads=1024 -model=unknown -thread_warp_size=32", [-1, 16, 64, 49152, 2147483647, 1024, 8, 32], "", 0, []], [[], [["FU", 7, [0, 1, 2]], ["SP", 7, 0, 2560, [10], 1], ["AN", 7, 0, 5], ["AN", 7, 1, 6]]]], "r": [[4.86819e-06, 4.84982e-06, 4.84171e-06], 0, 0.792109, 1694815766], "v": "v0.6"}
{"i": [["[\"hori_fused_solve_hidden\", 10, 1, 256]", "cuda -keys=cuda,gpu -max_num_threads=1024 -model=unknown -thread_warp_size=32", [-1, 16, 64, 49152, 2147483647, 1024, 8, 32], "", 0, []], [[], [["FU", 7, [0, 1, 2]], ["SP", 7, 0, 2560, [32], 1], ["AN", 7, 0, 5], ["AN", 7, 1, 6]]]], "r": [[4.42687e-06, 4.42709e-06, 4.42757e-06], 0, 4.41917, 1694815770], "v": "v0.6"}
{"i": [["[\"hori_fused_solve_hidden\", 10, 1, 256]", "cuda -keys=cuda,gpu -max_num_threads=1024 -model=unknown -thread_warp_size=32", [-1, 16, 64, 49152, 2147483647, 1024, 8, 32], "", 0, []], [[], [["FU", 7, [0, 1, 2]], ["SP", 7, 0, 2560, [5], 1], ["AN", 7, 0, 5], ["AN", 7, 1, 6]]]], "r": [[4.91574e-06, 4.91579e-06, 4.91568e-06], 0, 4.80741, 1694815771], "v": "v0.6"}
{"i": [["[\"hori_fused_solve_hidden\", 10, 1, 256]", "cuda -keys=cuda,gpu -max_num_threads=1024 -model=unknown -thread_warp_size=32", [-1, 16, 64, 49152, 2147483647, 1024, 8, 32], "", 0, []], [[], [["FU", 7, [0, 1, 2]], ["SP", 7, 0, 2560, [2], 1], ["AN", 7, 0, 5], ["AN", 7, 1, 6]]]], "r": [[5.66069e-06, 5.67058e-06, 5.66761e-06], 0, 2.80217, 1694859564], "v": "v0.6"}
{"i": [["[\"hori_fused_solve_hidden\", 10, 1, 256]", "cuda -keys=cuda,gpu -max_num_threads=1024 -model=unknown -thread_warp_size=32", [-1, 16, 64, 49152, 2147483647, 1024, 8, 32], "", 0, []], [[], [["FU", 7, [0, 1, 2]], ["SP", 7, 0, 2560, [20], 1], ["AN", 7, 0, 5], ["AN", 7, 1, 6]]]], "r": [[4.44285e-06, 4.44304e-06, 4.44281e-06], 0, 0.941888, 1694859562], "v": "v0.6"}
{"i": [["[\"hori_fused_solve_hidden\", 10, 1, 256]", "cuda -keys=cuda,gpu -max_num_threads=1024 -model=unknown -thread_warp_size=32", [-1, 16, 64, 49152, 2147483647, 1024, 8, 32], "", 0, []], [[], [["FU", 7, [0, 1, 2]], ["SP", 7, 0, 2560, [16], 1], ["AN", 7, 0, 5], ["AN", 7, 1, 6]]]], "r": [[4.51091e-06, 4.53054e-06, 4.52633e-06], 0, 1.28398, 1694859562], "v": "v0.6"}
{"i": [["[\"hori_fused_solve_hidden\", 10, 1, 256]", "cuda -keys=cuda,gpu -max_num_threads=1024 -model=unknown -thread_warp_size=32", [-1, 16, 64, 49152, 2147483647, 1024, 8, 32], "", 0, []], [[], [["FU", 7, [0, 1, 2]], ["SP", 7, 0, 2560, [64], 1], ["AN", 7, 0, 5], ["AN", 7, 1, 6]]]], "r": [[4.44255e-06, 4.44096e-06, 4.44362e-06], 0, 1.71142, 1694859563], "v": "v0.6"}
{"i": [["[\"hori_fused_solve_hidden\", 10, 1, 256]", "cuda -keys=cuda,gpu -max_num_threads=1024 -model=unknown -thread_warp_size=32", [-1, 16, 64, 49152, 2147483647, 1024, 8, 32], "", 0, []], [[], [["FU", 7, [0, 1, 2]], ["SP", 7, 0, 2560, [5], 1], ["AN", 7, 0, 5], ["AN", 7, 1, 6]]]], "r": [[4.90725e-06, 4.90773e-06, 4.90747e-06], 0, 2.47167, 1694859564], "v": "v0.6"}
{"i": [["[\"hori_fused_solve_hidden\", 10, 1, 256]", "cuda -keys=cuda,gpu -max_num_threads=1024 -model=unknown -thread_warp_size=32", [-1, 16, 64, 49152, 2147483647, 1024, 8, 32], "", 0, []], [[], [["FU", 7, [0, 1, 2]], ["SP", 7, 0, 2560, [10], 1], ["AN", 7, 0, 5], ["AN", 7, 1, 6]]]], "r": [[4.51757e-06, 4.51685e-06, 4.51743e-06], 0, 3.56403, 1694859565], "v": "v0.6"}
{"i": [["[\"hori_fused_solve_hidden\", 10, 1, 256]", "cuda -keys=cuda,gpu -max_num_threads=1024 -model=unknown -thread_warp_size=32", [-1, 16, 64, 49152, 2147483647, 1024, 8, 32], "", 0, []], [[], [["FU", 7, [0, 1, 2]], ["SP", 7, 0, 2560, [8], 1], ["AN", 7, 0, 5], ["AN", 7, 1, 6]]]], "r": [[4.51818e-06, 4.51819e-06, 4.51848e-06], 0, 3.97723, 1694859565], "v": "v0.6"}
{"i": [["[\"hori_fused_solve_hidden\", 10, 1, 256]", "cuda -keys=cuda,gpu -max_num_threads=1024 -model=unknown -thread_warp_size=32", [-1, 16, 64, 49152, 2147483647, 1024, 8, 32], "", 0, []], [[], [["FU", 7, [0, 1, 2]], ["SP", 7, 0, 2560, [40], 1], ["AN", 7, 0, 5], ["AN", 7, 1, 6]]]], "r": [[4.56571e-06, 4.57322e-06, 4.57344e-06], 0, 0.67047, 1694859562], "v": "v0.6"}
{"i": [["[\"hori_fused_solve_hidden\", 10, 1, 256]", "cuda -keys=cuda,gpu -max_num_threads=1024 -model=unknown -thread_warp_size=32", [-1, 16, 64, 49152, 2147483647, 1024, 8, 32], "", 0, []], [[], [["FU", 7, [0, 1, 2]], ["SP", 7, 0, 2560, [4], 1], ["AN", 7, 0, 5], ["AN", 7, 1, 6]]]], "r": [[5.18169e-06, 5.1939e-06, 5.19536e-06], 0, 2.0547, 1694859563], "v": "v0.6"}
{"i": [["[\"hori_fused_solve_hidden\", 10, 1, 256]", "cuda -keys=cuda,gpu -max_num_threads=1024 -model=unknown -thread_warp_size=32", [-1, 16, 64, 49152, 2147483647, 1024, 8, 32], "", 0, []], [[], [["FU", 7, [0, 1, 2]], ["SP", 7, 0, 2560, [1], 1], ["AN", 7, 0, 5], ["AN", 7, 1, 6]]]], "r": [[7.07233e-06, 7.07828e-06, 7.07928e-06], 0, 4.35071, 1694859566], "v": "v0.6"}
{"i": [["[\"hori_fused_solve_hidden\", 10, 1, 256]", "cuda -keys=cuda,gpu -max_num_threads=1024 -model=unknown -thread_warp_size=32", [-1, 16, 64, 49152, 2147483647, 1024, 8, 32], "", 0, []], [[], [["FU", 7, [0, 1, 2]], ["SP", 7, 0, 2560, [32], 1], ["AN", 7, 0, 5], ["AN", 7, 1, 6]]]], "r": [[4.32141e-06, 4.3205e-06, 4.32069e-06], 0, 3.17081, 1694859564], "v": "v0.6"}
