python/models/lstm/kernel_configs/hori_fused_solve_9_1_256.log
{"i": [["[\"hori_verti_fused_solve\", 9, 1, 256]", "cuda -keys=cuda,gpu -max_num_threads=1024 -model=unknown -thread_warp_size=32", [-1, 16, 64, 49152, 2147483647, 1024, 8, 32], "", 0, []], [[], [["CI", 7], ["FU", 10, [0, 1, 2]], ["SP", 10, 0, 2304, [64], 1], ["AN", 10, 0, 5], ["AN", 10, 1, 6]]]], "r": [[4.80573e-06, 4.81013e-06, 4.81061e-06], 0, 2.41376, 1696452034], "v": "v0.6"}
{"i": [["[\"hori_verti_fused_solve\", 9, 1, 256]", "cuda -keys=cuda,gpu -max_num_threads=1024 -model=unknown -thread_warp_size=32", [-1, 16, 64, 49152, 2147483647, 1024, 8, 32], "", 0, []], [[], [["CI", 7], ["FU", 10, [0, 1, 2]], ["SP", 10, 0, 2304, [18], 1], ["AN", 10, 0, 5], ["AN", 10, 1, 6]]]], "r": [[4.87866e-06, 4.88254e-06, 4.88281e-06], 0, 3.36133, 1696452035], "v": "v0.6"}
{"i": [["[\"hori_verti_fused_solve\", 9, 1, 256]", "cuda -keys=cuda,gpu -max_num_threads=1024 -model=unknown -thread_warp_size=32", [-1, 16, 64, 49152, 2147483647, 1024, 8, 32], "", 0, []], [[], [["CI", 7], ["FU", 10, [0, 1, 2]], ["SP", 10, 0, 2304, [9], 1], ["AN", 10, 0, 5], ["AN", 10, 1, 6]]]], "r": [[5.18286e-06, 5.18787e-06, 5.18681e-06], 0, 0.84024, 1696452032], "v": "v0.6"}
{"i": [["[\"hori_verti_fused_solve\", 9, 1, 256]", "cuda -keys=cuda,gpu -max_num_threads=1024 -model=unknown -thread_warp_size=32", [-1, 16, 64, 49152, 2147483647, 1024, 8, 32], "", 0, []], [[], [["CI", 7], ["FU", 10, [0, 1, 2]], ["SP", 10, 0, 2304, [32], 1], ["AN", 10, 0, 5], ["AN", 10, 1, 6]]]], "r": [[4.83974e-06, 4.89909e-06, 4.90408e-06], 0, 1.24755, 1696452033], "v": "v0.6"}
{"i": [["[\"hori_verti_fused_solve\", 9, 1, 256]", "cuda -keys=cuda,gpu -max_num_threads=1024 -model=unknown -thread_warp_size=32", [-1, 16, 64, 49152, 2147483647, 1024, 8, 32], "", 0, []], [[], [["CI", 7], ["FU", 10, [0, 1, 2]], ["SP", 10, 0, 2304, [16], 1], ["AN", 10, 0, 5], ["AN", 10, 1, 6]]]], "r": [[5.11532e-06, 5.12057e-06, 5.12056e-06], 0, 1.55725, 1696452033], "v": "v0.6"}
{"i": [["[\"hori_verti_fused_solve\", 9, 1, 256]", "cuda -keys=cuda,gpu -max_num_threads=1024 -model=unknown -thread_warp_size=32", [-1, 16, 64, 49152, 2147483647, 1024, 8, 32], "", 0, []], [[], [["CI", 7], ["FU", 10, [0, 1, 2]], ["SP", 10, 0, 2304, [8], 1], ["AN", 10, 0, 5], ["AN", 10, 1, 6]]]], "r": [[5.03522e-06, 5.04074e-06, 5.04076e-06], 0, 2.02024, 1696452034], "v": "v0.6"}
{"i": [["[\"hori_verti_fused_solve\", 9, 1, 256]", "cuda -keys=cuda,gpu -max_num_threads=1024 -model=unknown -thread_warp_size=32", [-1, 16, 64, 49152, 2147483647, 1024, 8, 32], "", 0, []], [[], [["CI", 7], ["FU", 10, [0, 1, 2]], ["SP", 10, 0, 2304, [36], 1], ["AN", 10, 0, 5], ["AN", 10, 1, 6]]]], "r": [[4.74546e-06, 4.75073e-06, 4.75163e-06], 0, 2.8959, 1696452035], "v": "v0.6"}
{"i": [["[\"hori_verti_fused_solve\", 9, 1, 256]", "cuda -keys=cuda,gpu -max_num_threads=1024 -model=unknown -thread_warp_size=32", [-1, 16, 64, 49152, 2147483647, 1024, 8, 32], "", 0, []], [[], [["CI", 7], ["FU", 10, [0, 1, 2]], ["SP", 10, 0, 2304, [2], 1], ["AN", 10, 0, 5], ["AN", 10, 1, 6]]]], "r": [[5.81794e-06, 5.81897e-06, 5.83168e-06], 0, 4.14154, 1696452036], "v": "v0.6"}
{"i": [["[\"hori_verti_fused_solve\", 9, 1, 256]", "cuda -keys=cuda,gpu -max_num_threads=1024 -model=unknown -thread_warp_size=32", [-1, 16, 64, 49152, 2147483647, 1024, 8, 32], "", 0, []], [[], [["CI", 7], ["FU", 10, [0, 1, 2]], ["SP", 10, 0, 2304, [4], 1], ["AN", 10, 0, 5], ["AN", 10, 1, 6]]]], "r": [[5.62491e-06, 5.62908e-06, 5.64073e-06], 0, 5.27207, 1696452037], "v": "v0.6"}
{"i": [["[\"hori_verti_fused_solve\", 9, 1, 256]", "cuda -keys=cuda,gpu -max_num_threads=1024 -model=unknown -thread_warp_size=32", [-1, 16, 64, 49152, 2147483647, 1024, 8, 32], "", 0, []], [[], [["CI", 7], ["FU", 10, [0, 1, 2]], ["SP", 10, 0, 2304, [24], 1], ["AN", 10, 0, 5], ["AN", 10, 1, 6]]]], "r": [[4.81565e-06, 4.82243e-06, 4.82137e-06], 0, 4.51885, 1696452036], "v": "v0.6"}
{"i": [["[\"hori_verti_fused_solve\", 9, 1, 256]", "cuda -keys=cuda,gpu -max_num_threads=1024 -model=unknown -thread_warp_size=32", [-1, 16, 64, 49152, 2147483647, 1024, 8, 32], "", 0, []], [[], [["CI", 7], ["FU", 10, [0, 1, 2]], ["SP", 10, 0, 2304, [1], 1], ["AN", 10, 0, 5], ["AN", 10, 1, 6]]]], "r": [[7.00161e-06, 7.00261e-06, 7.01469e-06], 0, 4.89331, 1696452037], "v": "v0.6"}
{"i": [["[\"hori_verti_fused_solve\", 9, 1, 256]", "cuda -keys=cuda,gpu -max_num_threads=1024 -model=unknown -thread_warp_size=32", [-1, 16, 64, 49152, 2147483647, 1024, 8, 32], "", 0, []], [[], [["CI", 7], ["FU", 10, [0, 1, 2]], ["SP", 10, 0, 2304, [12], 1], ["AN", 10, 0, 5], ["AN", 10, 1, 6]]]], "r": [[5.26418e-06, 5.27406e-06, 5.28719e-06], 0, 6.52237, 1696452038], "v": "v0.6"}
{"i": [["[\"hori_verti_fused_solve\", 9, 1, 256]", "cuda -keys=cuda,gpu -max_num_threads=1024 -model=unknown -thread_warp_size=32", [-1, 16, 64, 49152, 2147483647, 1024, 8, 32], "", 0, []], [[], [["CI", 7], ["FU", 10, [0, 1, 2]], ["SP", 10, 0, 2304, [3], 1], ["AN", 10, 0, 5], ["AN", 10, 1, 6]]]], "r": [[5.734e-06, 5.73453e-06, 5.74619e-06], 0, 5.70826, 1696452038], "v": "v0.6"}
{"i": [["[\"hori_verti_fused_solve\", 9, 1, 256]", "cuda -keys=cuda,gpu -max_num_threads=1024 -model=unknown -thread_warp_size=32", [-1, 16, 64, 49152, 2147483647, 1024, 8, 32], "", 0, []], [[], [["CI", 7], ["FU", 10, [0, 1, 2]], ["SP", 10, 0, 2304, [48], 1], ["AN", 10, 0, 5], ["AN", 10, 1, 6]]]], "r": [[4.85323e-06, 4.8858e-06, 4.88729e-06], 0, 3.71714, 1696452036], "v": "v0.6"}
{"i": [["[\"hori_verti_fused_solve\", 9, 1, 256]", "cuda -keys=cuda,gpu -max_num_threads=1024 -model=unknown -thread_warp_size=32", [-1, 16, 64, 49152, 2147483647, 1024, 8, 32], "", 0, []], [[], [["CI", 7], ["FU", 10, [0, 1, 2]], ["SP", 10, 0, 2304, [6], 1], ["AN", 10, 0, 5], ["AN", 10, 1, 6]]]], "r": [[5.25727e-06, 5.25932e-06, 5.26323e-06], 0, 6.074, 1696452038], "v": "v0.6"}
