python/models/lstm/kernel_configs/hori_fused_solve_output_5_1_256.log
{"i": [["[\"hori_fused_solve_output\", 5, 1, 256]", "cuda -keys=cuda,gpu -max_num_threads=1024 -model=unknown -thread_warp_size=32", [-1, 16, 64, 49152, 2147483647, 1024, 8, 32], "", 0, []], [[], [["FU", 3, [0, 1, 2]], ["SP", 3, 0, 1280, [64], 1], ["AN", 3, 0, 5], ["AN", 3, 1, 6]]]], "r": [[3.82394e-06, 3.834e-06, 3.83554e-06], 0, 1.67876, 1694815608], "v": "v0.6"}
{"i": [["[\"hori_fused_solve_output\", 5, 1, 256]", "cuda -keys=cuda,gpu -max_num_threads=1024 -model=unknown -thread_warp_size=32", [-1, 16, 64, 49152, 2147483647, 1024, 8, 32], "", 0, []], [[], [["FU", 3, [0, 1, 2]], ["SP", 3, 0, 1280, [4], 1], ["AN", 3, 0, 5], ["AN", 3, 1, 6]]]], "r": [[3.8506e-06, 3.85106e-06, 3.85041e-06], 0, 2.50128, 1694815609], "v": "v0.6"}
{"i": [["[\"hori_fused_solve_output\", 5, 1, 256]", "cuda -keys=cuda,gpu -max_num_threads=1024 -model=unknown -thread_warp_size=32", [-1, 16, 64, 49152, 2147483647, 1024, 8, 32], "", 0, []], [[], [["FU", 3, [0, 1, 2]], ["SP", 3, 0, 1280, [40], 1], ["AN", 3, 0, 5], ["AN", 3, 1, 6]]]], "r": [[3.79891e-06, 3.80886e-06, 3.81101e-06], 0, 0.596524, 1694815607], "v": "v0.6"}
{"i": [["[\"hori_fused_solve_output\", 5, 1, 256]", "cuda -keys=cuda,gpu -max_num_threads=1024 -model=unknown -thread_warp_size=32", [-1, 16, 64, 49152, 2147483647, 1024, 8, 32], "", 0, []], [[], [["FU", 3, [0, 1, 2]], ["SP", 3, 0, 1280, [20], 1], ["AN", 3, 0, 5], ["AN", 3, 1, 6]]]], "r": [[3.67037e-06, 3.67502e-06, 3.67824e-06], 0, 2.10456, 1694815609], "v": "v0.6"}
{"i": [["[\"hori_fused_solve_output\", 5, 1, 256]", "cuda -keys=cuda,gpu -max_num_threads=1024 -model=unknown -thread_warp_size=32", [-1, 16, 64, 49152, 2147483647, 1024, 8, 32], "", 0, []], [[], [["FU", 3, [0, 1, 2]], ["SP", 3, 0, 1280, [8], 1], ["AN", 3, 0, 5], ["AN", 3, 1, 6]]]], "r": [[3.71128e-06, 3.71105e-06, 3.70926e-06], 0, 3.2583, 1694815610], "v": "v0.6"}
{"i": [["[\"hori_fused_solve_output\", 5, 1, 256]", "cuda -keys=cuda,gpu -max_num_threads=1024 -model=unknown -thread_warp_size=32", [-1, 16, 64, 49152, 2147483647, 1024, 8, 32], "", 0, []], [[], [["FU", 3, [0, 1, 2]], ["SP", 3, 0, 1280, [10], 1], ["AN", 3, 0, 5], ["AN", 3, 1, 6]]]], "r": [[3.88853e-06, 3.89381e-06, 3.89563e-06], 0, 1.32409, 1694815608], "v": "v0.6"}
{"i": [["[\"hori_fused_solve_output\", 5, 1, 256]", "cuda -keys=cuda,gpu -max_num_threads=1024 -model=unknown -thread_warp_size=32", [-1, 16, 64, 49152, 2147483647, 1024, 8, 32], "", 0, []], [[], [["FU", 3, [0, 1, 2]], ["SP", 3, 0, 1280, [1], 1], ["AN", 3, 0, 5], ["AN", 3, 1, 6]]]], "r": [[4.95035e-06, 4.96044e-06, 4.9617e-06], 0, 0.92057, 1694815607], "v": "v0.6"}
{"i": [["[\"hori_fused_solve_output\", 5, 1, 256]", "cuda -keys=cuda,gpu -max_num_threads=1024 -model=unknown -thread_warp_size=32", [-1, 16, 64, 49152, 2147483647, 1024, 8, 32], "", 0, []], [[], [["FU", 3, [0, 1, 2]], ["SP", 3, 0, 1280, [5], 1], ["AN", 3, 0, 5], ["AN", 3, 1, 6]]]], "r": [[3.99644e-06, 3.99279e-06, 3.9935e-06], 0, 2.87844, 1694815609], "v": "v0.6"}
{"i": [["[\"hori_fused_solve_output\", 5, 1, 256]", "cuda -keys=cuda,gpu -max_num_threads=1024 -model=unknown -thread_warp_size=32", [-1, 16, 64, 49152, 2147483647, 1024, 8, 32], "", 0, []], [[], [["FU", 3, [0, 1, 2]], ["SP", 3, 0, 1280, [16], 1], ["AN", 3, 0, 5], ["AN", 3, 1, 6]]]], "r": [[3.86225e-06, 3.86424e-06, 3.86354e-06], 0, 3.68424, 1694815610], "v": "v0.6"}
{"i": [["[\"hori_fused_solve_output\", 5, 1, 256]", "cuda -keys=cuda,gpu -max_num_threads=1024 -model=unknown -thread_warp_size=32", [-1, 16, 64, 49152, 2147483647, 1024, 8, 32], "", 0, []], [[], [["FU", 3, [0, 1, 2]], ["SP", 3, 0, 1280, [32], 1], ["AN", 3, 0, 5], ["AN", 3, 1, 6]]]], "r": [[3.77013e-06, 3.78235e-06, 3.78236e-06], 0, 4.04485, 1694815611], "v": "v0.6"}
{"i": [["[\"hori_fused_solve_output\", 5, 1, 256]", "cuda -keys=cuda,gpu -max_num_threads=1024 -model=unknown -thread_warp_size=32", [-1, 16, 64, 49152, 2147483647, 1024, 8, 32], "", 0, []], [[], [["FU", 3, [0, 1, 2]], ["SP", 3, 0, 1280, [2], 1], ["AN", 3, 0, 5], ["AN", 3, 1, 6]]]], "r": [[4.52982e-06, 4.53763e-06, 4.53894e-06], 0, 4.36057, 1694815611], "v": "v0.6"}
{"i": [["[\"hori_fused_solve_output\", 5, 1, 256]", "cuda -keys=cuda,gpu -max_num_threads=1024 -model=unknown -thread_warp_size=32", [-1, 16, 64, 49152, 2147483647, 1024, 8, 32], "", 0, []], [[], [["FU", 3, [0, 1, 2]], ["SP", 3, 0, 1280, [40], 1], ["AN", 3, 0, 5], ["AN", 3, 1, 6]]]], "r": [[3.75637e-06, 3.76343e-06, 3.76709e-06], 0, 1.25387, 1694859421], "v": "v0.6"}
{"i": [["[\"hori_fused_solve_output\", 5, 1, 256]", "cuda -keys=cuda,gpu -max_num_threads=1024 -model=unknown -thread_warp_size=32", [-1, 16, 64, 49152, 2147483647, 1024, 8, 32], "", 0, []], [[], [["FU", 3, [0, 1, 2]], ["SP", 3, 0, 1280, [4], 1], ["AN", 3, 0, 5], ["AN", 3, 1, 6]]]], "r": [[4.05203e-06, 4.05097e-06, 4.04631e-06], 0, 0.896713, 1694859421], "v": "v0.6"}
{"i": [["[\"hori_fused_solve_output\", 5, 1, 256]", "cuda -keys=cuda,gpu -max_num_threads=1024 -model=unknown -thread_warp_size=32", [-1, 16, 64, 49152, 2147483647, 1024, 8, 32], "", 0, []], [[], [["FU", 3, [0, 1, 2]], ["SP", 3, 0, 1280, [1], 1], ["AN", 3, 0, 5], ["AN", 3, 1, 6]]]], "r": [[4.74729e-06, 4.74822e-06, 4.74748e-06], 0, 0.697376, 1694859421], "v": "v0.6"}
{"i": [["[\"hori_fused_solve_output\", 5, 1, 256]", "cuda -keys=cuda,gpu -max_num_threads=1024 -model=unknown -thread_warp_size=32", [-1, 16, 64, 49152, 2147483647, 1024, 8, 32], "", 0, []], [[], [["FU", 3, [0, 1, 2]], ["SP", 3, 0, 1280, [64], 1], ["AN", 3, 0, 5], ["AN", 3, 1, 6]]]], "r": [[3.52604e-06, 3.52546e-06, 3.52454e-06], 0, 1.63639, 1694859422], "v": "v0.6"}
{"i": [["[\"hori_fused_solve_output\", 5, 1, 256]", "cuda -keys=cuda,gpu -max_num_threads=1024 -model=unknown -thread_warp_size=32", [-1, 16, 64, 49152, 2147483647, 1024, 8, 32], "", 0, []], [[], [["FU", 3, [0, 1, 2]], ["SP", 3, 0, 1280, [2], 1], ["AN", 3, 0, 5], ["AN", 3, 1, 6]]]], "r": [[4.20323e-06, 4.20307e-06, 4.20265e-06], 0, 1.99077, 1694859422], "v": "v0.6"}
{"i": [["[\"hori_fused_solve_output\", 5, 1, 256]", "cuda -keys=cuda,gpu -max_num_threads=1024 -model=unknown -thread_warp_size=32", [-1, 16, 64, 49152, 2147483647, 1024, 8, 32], "", 0, []], [[], [["FU", 3, [0, 1, 2]], ["SP", 3, 0, 1280, [5], 1], ["AN", 3, 0, 5], ["AN", 3, 1, 6]]]], "r": [[3.94235e-06, 3.95125e-06, 3.95051e-06], 0, 3.1019, 1694859423], "v": "v0.6"}
{"i": [["[\"hori_fused_solve_output\", 5, 1, 256]", "cuda -keys=cuda,gpu -max_num_threads=1024 -model=unknown -thread_warp_size=32", [-1, 16, 64, 49152, 2147483647, 1024, 8, 32], "", 0, []], [[], [["FU", 3, [0, 1, 2]], ["SP", 3, 0, 1280, [10], 1], ["AN", 3, 0, 5], ["AN", 3, 1, 6]]]], "r": [[3.97242e-06, 3.98181e-06, 3.98203e-06], 0, 2.75527, 1694859423], "v": "v0.6"}
{"i": [["[\"hori_fused_solve_output\", 5, 1, 256]", "cuda -keys=cuda,gpu -max_num_threads=1024 -model=unknown -thread_warp_size=32", [-1, 16, 64, 49152, 2147483647, 1024, 8, 32], "", 0, []], [[], [["FU", 3, [0, 1, 2]], ["SP", 3, 0, 1280, [20], 1], ["AN", 3, 0, 5], ["AN", 3, 1, 6]]]], "r": [[3.58348e-06, 3.58504e-06, 3.58455e-06], 0, 2.4401, 1694859423], "v": "v0.6"}
{"i": [["[\"hori_fused_solve_output\", 5, 1, 256]", "cuda -keys=cuda,gpu -max_num_threads=1024 -model=unknown -thread_warp_size=32", [-1, 16, 64, 49152, 2147483647, 1024, 8, 32], "", 0, []], [[], [["FU", 3, [0, 1, 2]], ["SP", 3, 0, 1280, [16], 1], ["AN", 3, 0, 5], ["AN", 3, 1, 6]]]], "r": [[3.93494e-06, 3.94585e-06, 3.94592e-06], 0, 3.85101, 1694859424], "v": "v0.6"}
{"i": [["[\"hori_fused_solve_output\", 5, 1, 256]", "cuda -keys=cuda,gpu -max_num_threads=1024 -model=unknown -thread_warp_size=32", [-1, 16, 64, 49152, 2147483647, 1024, 8, 32], "", 0, []], [[], [["FU", 3, [0, 1, 2]], ["SP", 3, 0, 1280, [32], 1], ["AN", 3, 0, 5], ["AN", 3, 1, 6]]]], "r": [[3.58588e-06, 3.58211e-06, 3.58845e-06], 0, 3.50683, 1694859424], "v": "v0.6"}
{"i": [["[\"hori_fused_solve_output\", 5, 1, 256]", "cuda -keys=cuda,gpu -max_num_threads=1024 -model=unknown -thread_warp_size=32", [-1, 16, 64, 49152, 2147483647, 1024, 8, 32], "", 0, []], [[], [["FU", 3, [0, 1, 2]], ["SP", 3, 0, 1280, [8], 1], ["AN", 3, 0, 5], ["AN", 3, 1, 6]]]], "r": [[3.84216e-06, 3.85492e-06, 3.855e-06], 0, 4.19146, 1694859425], "v": "v0.6"}
