python/models/lstm/kernel_configs/hori_fused_solve_hidden_1_1_256.log
{"i": [["[\"hori_fused_solve_hidden\", 1, 1, 256]", "cuda -keys=cuda,gpu -max_num_threads=1024 -model=unknown -thread_warp_size=32", [-1, 16, 64, 49152, 2147483647, 1024, 8, 32], "", 0, []], [[], [["FU", 7, [0, 1, 2]], ["SP", 7, 0, 256, [8], 1], ["AN", 7, 0, 5], ["AN", 7, 1, 6]]]], "r": [[4.2466e-06, 4.25037e-06, 4.25551e-06], 0, 0.652416, 1694815800], "v": "v0.6"}
{"i": [["[\"hori_fused_solve_hidden\", 1, 1, 256]", "cuda -keys=cuda,gpu -max_num_threads=1024 -model=unknown -thread_warp_size=32", [-1, 16, 64, 49152, 2147483647, 1024, 8, 32], "", 0, []], [[], [["FU", 7, [0, 1, 2]], ["SP", 7, 0, 256, [4], 1], ["AN", 7, 0, 5], ["AN", 7, 1, 6]]]], "r": [[4.3667e-06, 4.36594e-06, 4.36616e-06], 0, 1.77296, 1694815801], "v": "v0.6"}
{"i": [["[\"hori_fused_solve_hidden\", 1, 1, 256]", "cuda -keys=cuda,gpu -max_num_threads=1024 -model=unknown -thread_warp_size=32", [-1, 16, 64, 49152, 2147483647, 1024, 8, 32], "", 0, []], [[], [["FU", 7, [0, 1, 2]], ["SP", 7, 0, 256, [2], 1], ["AN", 7, 0, 5], ["AN", 7, 1, 6]]]], "r": [[4.77778e-06, 4.79204e-06, 4.791e-06], 0, 0.981837, 1694815800], "v": "v0.6"}
{"i": [["[\"hori_fused_solve_hidden\", 1, 1, 256]", "cuda -keys=cuda,gpu -max_num_threads=1024 -model=unknown -thread_warp_size=32", [-1, 16, 64, 49152, 2147483647, 1024, 8, 32], "", 0, []], [[], [["FU", 7, [0, 1, 2]], ["SP", 7, 0, 256, [1], 1], ["AN", 7, 0, 5], ["AN", 7, 1, 6]]]], "r": [[4.55009e-06, 4.54677e-06, 4.54776e-06], 0, 2.18236, 1694815801], "v": "v0.6"}
{"i": [["[\"hori_fused_solve_hidden\", 1, 1, 256]", "cuda -keys=cuda,gpu -max_num_threads=1024 -model=unknown -thread_warp_size=32", [-1, 16, 64, 49152, 2147483647, 1024, 8, 32], "", 0, []], [[], [["FU", 7, [0, 1, 2]], ["SP", 7, 0, 256, [32], 1], ["AN", 7, 0, 5], ["AN", 7, 1, 6]]]], "r": [[4.18936e-06, 4.18933e-06, 4.1906e-06], 0, 1.37084, 1694815801], "v": "v0.6"}
{"i": [["[\"hori_fused_solve_hidden\", 1, 1, 256]", "cuda -keys=cuda,gpu -max_num_threads=1024 -model=unknown -thread_warp_size=32", [-1, 16, 64, 49152, 2147483647, 1024, 8, 32], "", 0, []], [[], [["FU", 7, [0, 1, 2]], ["SP", 7, 0, 256, [16], 1], ["AN", 7, 0, 5], ["AN", 7, 1, 6]]]], "r": [[4.52618e-06, 4.5388e-06, 4.53942e-06], 0, 2.50396, 1694815802], "v": "v0.6"}
{"i": [["[\"hori_fused_solve_hidden\", 1, 1, 256]", "cuda -keys=cuda,gpu -max_num_threads=1024 -model=unknown -thread_warp_size=32", [-1, 16, 64, 49152, 2147483647, 1024, 8, 32], "", 0, []], [[], [["FU", 7, [0, 1, 2]], ["SP", 7, 0, 256, [64], 1], ["AN", 7, 0, 5], ["AN", 7, 1, 6]]]], "r": [[4.15842e-06, 4.15929e-06, 4.15874e-06], 0, 2.92785, 1694815802], "v": "v0.6"}
{"i": [["[\"hori_fused_solve_hidden\", 1, 1, 256]", "cuda -keys=cuda,gpu -max_num_threads=1024 -model=unknown -thread_warp_size=32", [-1, 16, 64, 49152, 2147483647, 1024, 8, 32], "", 0, []], [[], [["FU", 7, [0, 1, 2]], ["SP", 7, 0, 256, [32], 1], ["AN", 7, 0, 5], ["AN", 7, 1, 6]]]], "r": [[4.15433e-06, 4.15432e-06, 4.15367e-06], 0, 1.3525, 1694859596], "v": "v0.6"}
{"i": [["[\"hori_fused_solve_hidden\", 1, 1, 256]", "cuda -keys=cuda,gpu -max_num_threads=1024 -model=unknown -thread_warp_size=32", [-1, 16, 64, 49152, 2147483647, 1024, 8, 32], "", 0, []], [[], [["FU", 7, [0, 1, 2]], ["SP", 7, 0, 256, [16], 1], ["AN", 7, 0, 5], ["AN", 7, 1, 6]]]], "r": [[4.55129e-06, 4.56308e-06, 4.56568e-06], 0, 0.995305, 1694859596], "v": "v0.6"}
{"i": [["[\"hori_fused_solve_hidden\", 1, 1, 256]", "cuda -keys=cuda,gpu -max_num_threads=1024 -model=unknown -thread_warp_size=32", [-1, 16, 64, 49152, 2147483647, 1024, 8, 32], "", 0, []], [[], [["FU", 7, [0, 1, 2]], ["SP", 7, 0, 256, [8], 1], ["AN", 7, 0, 5], ["AN", 7, 1, 6]]]], "r": [[4.25007e-06, 4.24872e-06, 4.24875e-06], 0, 0.624969, 1694859596], "v": "v0.6"}
{"i": [["[\"hori_fused_solve_hidden\", 1, 1, 256]", "cuda -keys=cuda,gpu -max_num_threads=1024 -model=unknown -thread_warp_size=32", [-1, 16, 64, 49152, 2147483647, 1024, 8, 32], "", 0, []], [[], [["FU", 7, [0, 1, 2]], ["SP", 7, 0, 256, [64], 1], ["AN", 7, 0, 5], ["AN", 7, 1, 6]]]], "r": [[4.46531e-06, 4.47119e-06, 4.47159e-06], 0, 2.10427, 1694859597], "v": "v0.6"}
{"i": [["[\"hori_fused_solve_hidden\", 1, 1, 256]", "cuda -keys=cuda,gpu -max_num_threads=1024 -model=unknown -thread_warp_size=32", [-1, 16, 64, 49152, 2147483647, 1024, 8, 32], "", 0, []], [[], [["FU", 7, [0, 1, 2]], ["SP", 7, 0, 256, [4], 1], ["AN", 7, 0, 5], ["AN", 7, 1, 6]]]], "r": [[4.27935e-06, 4.27909e-06, 4.27926e-06], 0, 1.75102, 1694859597], "v": "v0.6"}
{"i": [["[\"hori_fused_solve_hidden\", 1, 1, 256]", "cuda -keys=cuda,gpu -max_num_threads=1024 -model=unknown -thread_warp_size=32", [-1, 16, 64, 49152, 2147483647, 1024, 8, 32], "", 0, []], [[], [["FU", 7, [0, 1, 2]], ["SP", 7, 0, 256, [2], 1], ["AN", 7, 0, 5], ["AN", 7, 1, 6]]]], "r": [[4.3996e-06, 4.39958e-06, 4.40015e-06], 0, 2.47198, 1694859598], "v": "v0.6"}
{"i": [["[\"hori_fused_solve_hidden\", 1, 1, 256]", "cuda -keys=cuda,gpu -max_num_threads=1024 -model=unknown -thread_warp_size=32", [-1, 16, 64, 49152, 2147483647, 1024, 8, 32], "", 0, []], [[], [["FU", 7, [0, 1, 2]], ["SP", 7, 0, 256, [1], 1], ["AN", 7, 0, 5], ["AN", 7, 1, 6]]]], "r": [[4.55153e-06, 4.55161e-06, 4.55107e-06], 0, 2.87177, 1694859598], "v": "v0.6"}
