python/models/lstm/kernel_configs/hori_fused_solve_8_1_256.log
{"i": [["[\"hori_fused_solve\", 8, 1, 256]", "cuda -keys=cuda,gpu -max_num_threads=1024 -model=unknown -thread_warp_size=32", [-1, 16, 64, 49152, 2147483647, 1024, 8, 32], "", 0, []], [[], [["CI", 7], ["FU", 10, [0, 1, 2]], ["SP", 10, 0, 2048, [32], 1], ["AN", 10, 0, 5], ["AN", 10, 1, 6]]]], "r": [[3.2378e-06, 3.25462e-06, 2.97418e-06], 0, 0.638759, 1694769457], "v": "v0.6"}
{"i": [["[\"hori_fused_solve\", 8, 1, 256]", "cuda -keys=cuda,gpu -max_num_threads=1024 -model=unknown -thread_warp_size=32", [-1, 16, 64, 49152, 2147483647, 1024, 8, 32], "", 0, []], [[], [["CI", 7], ["FU", 10, [0, 1, 2]], ["SP", 10, 0, 2048, [1], 1], ["AN", 10, 0, 5], ["AN", 10, 1, 6]]]], "r": [[4.0047e-06, 4.00696e-06, 4.00958e-06], 0, 0.60844, 1694769457], "v": "v0.6"}
{"i": [["[\"hori_fused_solve\", 8, 1, 256]", "cuda -keys=cuda,gpu -max_num_threads=1024 -model=unknown -thread_warp_size=32", [-1, 16, 64, 49152, 2147483647, 1024, 8, 32], "", 0, []], [[], [["CI", 7], ["FU", 10, [0, 1, 2]], ["SP", 10, 0, 2048, [16], 1], ["AN", 10, 0, 5], ["AN", 10, 1, 6]]]], "r": [[3.39188e-06, 3.37325e-06, 3.42154e-06], 0, 1.22953, 1694769458], "v": "v0.6"}
{"i": [["[\"hori_fused_solve\", 8, 1, 256]", "cuda -keys=cuda,gpu -max_num_threads=1024 -model=unknown -thread_warp_size=32", [-1, 16, 64, 49152, 2147483647, 1024, 8, 32], "", 0, []], [[], [["CI", 7], ["FU", 10, [0, 1, 2]], ["SP", 10, 0, 2048, [8], 1], ["AN", 10, 0, 5], ["AN", 10, 1, 6]]]], "r": [[3.51992e-06, 3.39968e-06, 3.41663e-06], 0, 1.69675, 1694769458], "v": "v0.6"}
{"i": [["[\"hori_fused_solve\", 8, 1, 256]", "cuda -keys=cuda,gpu -max_num_threads=1024 -model=unknown -thread_warp_size=32", [-1, 16, 64, 49152, 2147483647, 1024, 8, 32], "", 0, []], [[], [["CI", 7], ["FU", 10, [0, 1, 2]], ["SP", 10, 0, 2048, [64], 1], ["AN", 10, 0, 5], ["AN", 10, 1, 6]]]], "r": [[2.91418e-06, 3.36656e-06, 3.37239e-06], 0, 0.835753, 1694769457], "v": "v0.6"}
{"i": [["[\"hori_fused_solve\", 8, 1, 256]", "cuda -keys=cuda,gpu -max_num_threads=1024 -model=unknown -thread_warp_size=32", [-1, 16, 64, 49152, 2147483647, 1024, 8, 32], "", 0, []], [[], [["CI", 7], ["FU", 10, [0, 1, 2]], ["SP", 10, 0, 2048, [2], 1], ["AN", 10, 0, 5], ["AN", 10, 1, 6]]]], "r": [[3.11266e-06, 3.11342e-06, 3.11351e-06], 0, 1.05081, 1694769458], "v": "v0.6"}
{"i": [["[\"hori_fused_solve\", 8, 1, 256]", "cuda -keys=cuda,gpu -max_num_threads=1024 -model=unknown -thread_warp_size=32", [-1, 16, 64, 49152, 2147483647, 1024, 8, 32], "", 0, []], [[], [["CI", 7], ["FU", 10, [0, 1, 2]], ["SP", 10, 0, 2048, [4], 1], ["AN", 10, 0, 5], ["AN", 10, 1, 6]]]], "r": [[4.93063e-06, 5.92125e-06, 4.01338e-06], 0, 1.45703, 1694769458], "v": "v0.6"}
{"i": [["[\"hori_fused_solve\", 8, 1, 256]", "cuda -keys=cuda,gpu -max_num_threads=1024 -model=unknown -thread_warp_size=32", [-1, 16, 64, 49152, 2147483647, 1024, 8, 32], "", 0, []], [[], [["CI", 7], ["FU", 10, [0, 1, 2]], ["SP", 10, 0, 2048, [4], 1], ["AN", 10, 0, 5], ["AN", 10, 1, 6]]]], "r": [[5.59253e-06, 5.59265e-06, 5.59322e-06], 0, 1.73817, 1694796038], "v": "v0.6"}
{"i": [["[\"hori_fused_solve\", 8, 1, 256]", "cuda -keys=cuda,gpu -max_num_threads=1024 -model=unknown -thread_warp_size=32", [-1, 16, 64, 49152, 2147483647, 1024, 8, 32], "", 0, []], [[], [["CI", 7], ["FU", 10, [0, 1, 2]], ["SP", 10, 0, 2048, [8], 1], ["AN", 10, 0, 5], ["AN", 10, 1, 6]]]], "r": [[5.20661e-06, 5.20483e-06, 5.20473e-06], 0, 1.3716, 1694796037], "v": "v0.6"}
{"i": [["[\"hori_fused_solve\", 8, 1, 256]", "cuda -keys=cuda,gpu -max_num_threads=1024 -model=unknown -thread_warp_size=32", [-1, 16, 64, 49152, 2147483647, 1024, 8, 32], "", 0, []], [[], [["CI", 7], ["FU", 10, [0, 1, 2]], ["SP", 10, 0, 2048, [2], 1], ["AN", 10, 0, 5], ["AN", 10, 1, 6]]]], "r": [[5.97662e-06, 5.99509e-06, 5.99468e-06], 0, 1.00971, 1694796037], "v": "v0.6"}
{"i": [["[\"hori_fused_solve\", 8, 1, 256]", "cuda -keys=cuda,gpu -max_num_threads=1024 -model=unknown -thread_warp_size=32", [-1, 16, 64, 49152, 2147483647, 1024, 8, 32], "", 0, []], [[], [["CI", 7], ["FU", 10, [0, 1, 2]], ["SP", 10, 0, 2048, [64], 1], ["AN", 10, 0, 5], ["AN", 10, 1, 6]]]], "r": [[5.00685e-06, 5.02562e-06, 5.0272e-06], 0, 0.621362, 1694796036], "v": "v0.6"}
{"i": [["[\"hori_fused_solve\", 8, 1, 256]", "cuda -keys=cuda,gpu -max_num_threads=1024 -model=unknown -thread_warp_size=32", [-1, 16, 64, 49152, 2147483647, 1024, 8, 32], "", 0, []], [[], [["CI", 7], ["FU", 10, [0, 1, 2]], ["SP", 10, 0, 2048, [1], 1], ["AN", 10, 0, 5], ["AN", 10, 1, 6]]]], "r": [[6.81871e-06, 6.88767e-06, 6.88461e-06], 0, 2.80655, 1694796039], "v": "v0.6"}
{"i": [["[\"hori_fused_solve\", 8, 1, 256]", "cuda -keys=cuda,gpu -max_num_threads=1024 -model=unknown -thread_warp_size=32", [-1, 16, 64, 49152, 2147483647, 1024, 8, 32], "", 0, []], [[], [["CI", 7], ["FU", 10, [0, 1, 2]], ["SP", 10, 0, 2048, [32], 1], ["AN", 10, 0, 5], ["AN", 10, 1, 6]]]], "r": [[4.80599e-06, 4.80557e-06, 4.80503e-06], 0, 2.1103, 1694796038], "v": "v0.6"}
{"i": [["[\"hori_fused_solve\", 8, 1, 256]", "cuda -keys=cuda,gpu -max_num_threads=1024 -model=unknown -thread_warp_size=32", [-1, 16, 64, 49152, 2147483647, 1024, 8, 32], "", 0, []], [[], [["CI", 7], ["FU", 10, [0, 1, 2]], ["SP", 10, 0, 2048, [16], 1], ["AN", 10, 0, 5], ["AN", 10, 1, 6]]]], "r": [[4.84219e-06, 4.84332e-06, 4.84372e-06], 0, 2.45261, 1694796038], "v": "v0.6"}
