python/models/lstm/kernel_configs/hori_fused_solve_hidden_3_1_256.log
{"i": [["[\"hori_fused_solve_hidden\", 3, 1, 256]", "cuda -keys=cuda,gpu -max_num_threads=1024 -model=unknown -thread_warp_size=32", [-1, 16, 64, 49152, 2147483647, 1024, 8, 32], "", 0, []], [[], [["FU", 7, [0, 1, 2]], ["SP", 7, 0, 768, [1], 1], ["AN", 7, 0, 5], ["AN", 7, 1, 6]]]], "r": [[5.05538e-06, 5.05385e-06, 5.05426e-06], 0, 2.20217, 1694815859], "v": "v0.6"}
{"i": [["[\"hori_fused_solve_hidden\", 3, 1, 256]", "cuda -keys=cuda,gpu -max_num_threads=1024 -model=unknown -thread_warp_size=32", [-1, 16, 64, 49152, 2147483647, 1024, 8, 32], "", 0, []], [[], [["FU", 7, [0, 1, 2]], ["SP", 7, 0, 768, [24], 1], ["AN", 7, 0, 5], ["AN", 7, 1, 6]]]], "r": [[4.35498e-06, 4.35498e-06, 4.35533e-06], 0, 0.797307, 1694815857], "v": "v0.6"}
{"i": [["[\"hori_fused_solve_hidden\", 3, 1, 256]", "cuda -keys=cuda,gpu -max_num_threads=1024 -model=unknown -thread_warp_size=32", [-1, 16, 64, 49152, 2147483647, 1024, 8, 32], "", 0, []], [[], [["FU", 7, [0, 1, 2]], ["SP", 7, 0, 768, [64], 1], ["AN", 7, 0, 5], ["AN", 7, 1, 6]]]], "r": [[4.19221e-06, 4.18956e-06, 4.19187e-06], 0, 0.990082, 1694815858], "v": "v0.6"}
{"i": [["[\"hori_fused_solve_hidden\", 3, 1, 256]", "cuda -keys=cuda,gpu -max_num_threads=1024 -model=unknown -thread_warp_size=32", [-1, 16, 64, 49152, 2147483647, 1024, 8, 32], "", 0, []], [[], [["FU", 7, [0, 1, 2]], ["SP", 7, 0, 768, [4], 1], ["AN", 7, 0, 5], ["AN", 7, 1, 6]]]], "r": [[4.60978e-06, 4.61266e-06, 4.61236e-06], 0, 1.37646, 1694815858], "v": "v0.6"}
{"i": [["[\"hori_fused_solve_hidden\", 3, 1, 256]", "cuda -keys=cuda,gpu -max_num_threads=1024 -model=unknown -thread_warp_size=32", [-1, 16, 64, 49152, 2147483647, 1024, 8, 32], "", 0, []], [[], [["FU", 7, [0, 1, 2]], ["SP", 7, 0, 768, [16], 1], ["AN", 7, 0, 5], ["AN", 7, 1, 6]]]], "r": [[4.4064e-06, 4.41432e-06, 4.41186e-06], 0, 1.78534, 1694815859], "v": "v0.6"}
{"i": [["[\"hori_fused_solve_hidden\", 3, 1, 256]", "cuda -keys=cuda,gpu -max_num_threads=1024 -model=unknown -thread_warp_size=32", [-1, 16, 64, 49152, 2147483647, 1024, 8, 32], "", 0, []], [[], [["FU", 7, [0, 1, 2]], ["SP", 7, 0, 768, [6], 1], ["AN", 7, 0, 5], ["AN", 7, 1, 6]]]], "r": [[4.53414e-06, 4.53404e-06, 4.53361e-06], 0, 3.04221, 1694815860], "v": "v0.6"}
{"i": [["[\"hori_fused_solve_hidden\", 3, 1, 256]", "cuda -keys=cuda,gpu -max_num_threads=1024 -model=unknown -thread_warp_size=32", [-1, 16, 64, 49152, 2147483647, 1024, 8, 32], "", 0, []], [[], [["FU", 7, [0, 1, 2]], ["SP", 7, 0, 768, [8], 1], ["AN", 7, 0, 5], ["AN", 7, 1, 6]]]], "r": [[4.3599e-06, 4.36092e-06, 4.35997e-06], 0, 2.56128, 1694815859], "v": "v0.6"}
{"i": [["[\"hori_fused_solve_hidden\", 3, 1, 256]", "cuda -keys=cuda,gpu -max_num_threads=1024 -model=unknown -thread_warp_size=32", [-1, 16, 64, 49152, 2147483647, 1024, 8, 32], "", 0, []], [[], [["FU", 7, [0, 1, 2]], ["SP", 7, 0, 768, [12], 1], ["AN", 7, 0, 5], ["AN", 7, 1, 6]]]], "r": [[4.52795e-06, 4.52814e-06, 4.52704e-06], 0, 3.44667, 1694815860], "v": "v0.6"}
{"i": [["[\"hori_fused_solve_hidden\", 3, 1, 256]", "cuda -keys=cuda,gpu -max_num_threads=1024 -model=unknown -thread_warp_size=32", [-1, 16, 64, 49152, 2147483647, 1024, 8, 32], "", 0, []], [[], [["FU", 7, [0, 1, 2]], ["SP", 7, 0, 768, [3], 1], ["AN", 7, 0, 5], ["AN", 7, 1, 6]]]], "r": [[4.91922e-06, 4.92806e-06, 4.92531e-06], 0, 4.68277, 1694815861], "v": "v0.6"}
{"i": [["[\"hori_fused_solve_hidden\", 3, 1, 256]", "cuda -keys=cuda,gpu -max_num_threads=1024 -model=unknown -thread_warp_size=32", [-1, 16, 64, 49152, 2147483647, 1024, 8, 32], "", 0, []], [[], [["FU", 7, [0, 1, 2]], ["SP", 7, 0, 768, [32], 1], ["AN", 7, 0, 5], ["AN", 7, 1, 6]]]], "r": [[4.3072e-06, 4.31145e-06, 4.30893e-06], 0, 4.24896, 1694815861], "v": "v0.6"}
{"i": [["[\"hori_fused_solve_hidden\", 3, 1, 256]", "cuda -keys=cuda,gpu -max_num_threads=1024 -model=unknown -thread_warp_size=32", [-1, 16, 64, 49152, 2147483647, 1024, 8, 32], "", 0, []], [[], [["FU", 7, [0, 1, 2]], ["SP", 7, 0, 768, [48], 1], ["AN", 7, 0, 5], ["AN", 7, 1, 6]]]], "r": [[4.44818e-06, 4.44913e-06, 4.44959e-06], 0, 5.04107, 1694815862], "v": "v0.6"}
{"i": [["[\"hori_fused_solve_hidden\", 3, 1, 256]", "cuda -keys=cuda,gpu -max_num_threads=1024 -model=unknown -thread_warp_size=32", [-1, 16, 64, 49152, 2147483647, 1024, 8, 32], "", 0, []], [[], [["FU", 7, [0, 1, 2]], ["SP", 7, 0, 768, [2], 1], ["AN", 7, 0, 5], ["AN", 7, 1, 6]]]], "r": [[4.91381e-06, 4.91116e-06, 4.91156e-06], 0, 3.8435, 1694815861], "v": "v0.6"}
{"i": [["[\"hori_fused_solve_hidden\", 3, 1, 256]", "cuda -keys=cuda,gpu -max_num_threads=1024 -model=unknown -thread_warp_size=32", [-1, 16, 64, 49152, 2147483647, 1024, 8, 32], "", 0, []], [[], [["FU", 7, [0, 1, 2]], ["SP", 7, 0, 768, [32], 1], ["AN", 7, 0, 5], ["AN", 7, 1, 6]]]], "r": [[4.24996e-06, 4.25068e-06, 4.25012e-06], 0, 1.36452, 1694859659], "v": "v0.6"}
{"i": [["[\"hori_fused_solve_hidden\", 3, 1, 256]", "cuda -keys=cuda,gpu -max_num_threads=1024 -model=unknown -thread_warp_size=32", [-1, 16, 64, 49152, 2147483647, 1024, 8, 32], "", 0, []], [[], [["FU", 7, [0, 1, 2]], ["SP", 7, 0, 768, [2], 1], ["AN", 7, 0, 5], ["AN", 7, 1, 6]]]], "r": [[4.92954e-06, 4.92874e-06, 4.9305e-06], 0, 3.1859, 1694859661], "v": "v0.6"}
{"i": [["[\"hori_fused_solve_hidden\", 3, 1, 256]", "cuda -keys=cuda,gpu -max_num_threads=1024 -model=unknown -thread_warp_size=32", [-1, 16, 64, 49152, 2147483647, 1024, 8, 32], "", 0, []], [[], [["FU", 7, [0, 1, 2]], ["SP", 7, 0, 768, [48], 1], ["AN", 7, 0, 5], ["AN", 7, 1, 6]]]], "r": [[4.22478e-06, 4.22501e-06, 4.22491e-06], 0, 1.73328, 1694859660], "v": "v0.6"}
{"i": [["[\"hori_fused_solve_hidden\", 3, 1, 256]", "cuda -keys=cuda,gpu -max_num_threads=1024 -model=unknown -thread_warp_size=32", [-1, 16, 64, 49152, 2147483647, 1024, 8, 32], "", 0, []], [[], [["FU", 7, [0, 1, 2]], ["SP", 7, 0, 768, [24], 1], ["AN", 7, 0, 5], ["AN", 7, 1, 6]]]], "r": [[4.58279e-06, 4.59185e-06, 4.59198e-06], 0, 2.05659, 1694859660], "v": "v0.6"}
{"i": [["[\"hori_fused_solve_hidden\", 3, 1, 256]", "cuda -keys=cuda,gpu -max_num_threads=1024 -model=unknown -thread_warp_size=32", [-1, 16, 64, 49152, 2147483647, 1024, 8, 32], "", 0, []], [[], [["FU", 7, [0, 1, 2]], ["SP", 7, 0, 768, [4], 1], ["AN", 7, 0, 5], ["AN", 7, 1, 6]]]], "r": [[4.53205e-06, 4.53291e-06, 4.53241e-06], 0, 2.81147, 1694859661], "v": "v0.6"}
{"i": [["[\"hori_fused_solve_hidden\", 3, 1, 256]", "cuda -keys=cuda,gpu -max_num_threads=1024 -model=unknown -thread_warp_size=32", [-1, 16, 64, 49152, 2147483647, 1024, 8, 32], "", 0, []], [[], [["FU", 7, [0, 1, 2]], ["SP", 7, 0, 768, [64], 1], ["AN", 7, 0, 5], ["AN", 7, 1, 6]]]], "r": [[4.30331e-06, 4.30143e-06, 4.30175e-06], 0, 3.59143, 1694859662], "v": "v0.6"}
{"i": [["[\"hori_fused_solve_hidden\", 3, 1, 256]", "cuda -keys=cuda,gpu -max_num_threads=1024 -model=unknown -thread_warp_size=32", [-1, 16, 64, 49152, 2147483647, 1024, 8, 32], "", 0, []], [[], [["FU", 7, [0, 1, 2]], ["SP", 7, 0, 768, [8], 1], ["AN", 7, 0, 5], ["AN", 7, 1, 6]]]], "r": [[4.51497e-06, 4.51364e-06, 4.51513e-06], 0, 0.945264, 1694859659], "v": "v0.6"}
{"i": [["[\"hori_fused_solve_hidden\", 3, 1, 256]", "cuda -keys=cuda,gpu -max_num_threads=1024 -model=unknown -thread_warp_size=32", [-1, 16, 64, 49152, 2147483647, 1024, 8, 32], "", 0, []], [[], [["FU", 7, [0, 1, 2]], ["SP", 7, 0, 768, [1], 1], ["AN", 7, 0, 5], ["AN", 7, 1, 6]]]], "r": [[5.09232e-06, 5.1241e-06, 5.12532e-06], 0, 2.41121, 1694859660], "v": "v0.6"}
{"i": [["[\"hori_fused_solve_hidden\", 3, 1, 256]", "cuda -keys=cuda,gpu -max_num_threads=1024 -model=unknown -thread_warp_size=32", [-1, 16, 64, 49152, 2147483647, 1024, 8, 32], "", 0, []], [[], [["FU", 7, [0, 1, 2]], ["SP", 7, 0, 768, [16], 1], ["AN", 7, 0, 5], ["AN", 7, 1, 6]]]], "r": [[4.5331e-06, 4.54332e-06, 4.54419e-06], 0, 3.96396, 1694859662], "v": "v0.6"}
{"i": [["[\"hori_fused_solve_hidden\", 3, 1, 256]", "cuda -keys=cuda,gpu -max_num_threads=1024 -model=unknown -thread_warp_size=32", [-1, 16, 64, 49152, 2147483647, 1024, 8, 32], "", 0, []], [[], [["FU", 7, [0, 1, 2]], ["SP", 7, 0, 768, [6], 1], ["AN", 7, 0, 5], ["AN", 7, 1, 6]]]], "r": [[4.79415e-06, 4.79792e-06, 4.79624e-06], 0, 0.78356, 1694859659], "v": "v0.6"}
{"i": [["[\"hori_fused_solve_hidden\", 3, 1, 256]", "cuda -keys=cuda,gpu -max_num_threads=1024 -model=unknown -thread_warp_size=32", [-1, 16, 64, 49152, 2147483647, 1024, 8, 32], "", 0, []], [[], [["FU", 7, [0, 1, 2]], ["SP", 7, 0, 768, [3], 1], ["AN", 7, 0, 5], ["AN", 7, 1, 6]]]], "r": [[4.90669e-06, 4.91852e-06, 4.91854e-06], 0, 4.25811, 1694859662], "v": "v0.6"}
{"i": [["[\"hori_fused_solve_hidden\", 3, 1, 256]", "cuda -keys=cuda,gpu -max_num_threads=1024 -model=unknown -thread_warp_size=32", [-1, 16, 64, 49152, 2147483647, 1024, 8, 32], "", 0, []], [[], [["FU", 7, [0, 1, 2]], ["SP", 7, 0, 768, [12], 1], ["AN", 7, 0, 5], ["AN", 7, 1, 6]]]], "r": [[4.51997e-06, 4.53255e-06, 4.53093e-06], 0, 4.6609, 1694859663], "v": "v0.6"}
