python/models/lstm/kernel_configs/hori_fused_solve_output_3_1_256.log
{"i": [["[\"hori_fused_solve_output\", 3, 1, 256]", "cuda -keys=cuda,gpu -max_num_threads=1024 -model=unknown -thread_warp_size=32", [-1, 16, 64, 49152, 2147483647, 1024, 8, 32], "", 0, []], [[], [["FU", 3, [0, 1, 2]], ["SP", 3, 0, 768, [3], 1], ["AN", 3, 0, 5], ["AN", 3, 1, 6]]]], "r": [[3.82697e-06, 3.82585e-06, 3.82679e-06], 0, 0.885546, 1694815550], "v": "v0.6"}
{"i": [["[\"hori_fused_solve_output\", 3, 1, 256]", "cuda -keys=cuda,gpu -max_num_threads=1024 -model=unknown -thread_warp_size=32", [-1, 16, 64, 49152, 2147483647, 1024, 8, 32], "", 0, []], [[], [["FU", 3, [0, 1, 2]], ["SP", 3, 0, 768, [16], 1], ["AN", 3, 0, 5], ["AN", 3, 1, 6]]]], "r": [[3.48143e-06, 3.4834e-06, 3.4809e-06], 0, 1.0596, 1694815550], "v": "v0.6"}
{"i": [["[\"hori_fused_solve_output\", 3, 1, 256]", "cuda -keys=cuda,gpu -max_num_threads=1024 -model=unknown -thread_warp_size=32", [-1, 16, 64, 49152, 2147483647, 1024, 8, 32], "", 0, []], [[], [["FU", 3, [0, 1, 2]], ["SP", 3, 0, 768, [64], 1], ["AN", 3, 0, 5], ["AN", 3, 1, 6]]]], "r": [[3.59969e-06, 3.60039e-06, 3.60028e-06], 0, 1.35312, 1694815551], "v": "v0.6"}
{"i": [["[\"hori_fused_solve_output\", 3, 1, 256]", "cuda -keys=cuda,gpu -max_num_threads=1024 -model=unknown -thread_warp_size=32", [-1, 16, 64, 49152, 2147483647, 1024, 8, 32], "", 0, []], [[], [["FU", 3, [0, 1, 2]], ["SP", 3, 0, 768, [2], 1], ["AN", 3, 0, 5], ["AN", 3, 1, 6]]]], "r": [[4.29177e-06, 4.30294e-06, 4.3042e-06], 0, 1.67438, 1694815551], "v": "v0.6"}
{"i": [["[\"hori_fused_solve_output\", 3, 1, 256]", "cuda -keys=cuda,gpu -max_num_threads=1024 -model=unknown -thread_warp_size=32", [-1, 16, 64, 49152, 2147483647, 1024, 8, 32], "", 0, []], [[], [["FU", 3, [0, 1, 2]], ["SP", 3, 0, 768, [6], 1], ["AN", 3, 0, 5], ["AN", 3, 1, 6]]]], "r": [[3.87164e-06, 3.88049e-06, 3.88074e-06], 0, 2.07289, 1694815551], "v": "v0.6"}
{"i": [["[\"hori_fused_solve_output\", 3, 1, 256]", "cuda -keys=cuda,gpu -max_num_threads=1024 -model=unknown -thread_warp_size=32", [-1, 16, 64, 49152, 2147483647, 1024, 8, 32], "", 0, []], [[], [["FU", 3, [0, 1, 2]], ["SP", 3, 0, 768, [32], 1], ["AN", 3, 0, 5], ["AN", 3, 1, 6]]]], "r": [[3.55813e-06, 3.5652e-06, 3.56982e-06], 0, 2.88562, 1694815552], "v": "v0.6"}
{"i": [["[\"hori_fused_solve_output\", 3, 1, 256]", "cuda -keys=cuda,gpu -max_num_threads=1024 -model=unknown -thread_warp_size=32", [-1, 16, 64, 49152, 2147483647, 1024, 8, 32], "", 0, []], [[], [["FU", 3, [0, 1, 2]], ["SP", 3, 0, 768, [1], 1], ["AN", 3, 0, 5], ["AN", 3, 1, 6]]]], "r": [[4.50866e-06, 4.51914e-06, 4.51838e-06], 0, 3.2276, 1694815553], "v": "v0.6"}
{"i": [["[\"hori_fused_solve_output\", 3, 1, 256]", "cuda -keys=cuda,gpu -max_num_threads=1024 -model=unknown -thread_warp_size=32", [-1, 16, 64, 49152, 2147483647, 1024, 8, 32], "", 0, []], [[], [["FU", 3, [0, 1, 2]], ["SP", 3, 0, 768, [12], 1], ["AN", 3, 0, 5], ["AN", 3, 1, 6]]]], "r": [[3.65449e-06, 3.66034e-06, 3.65008e-06], 0, 2.53169, 1694815552], "v": "v0.6"}
{"i": [["[\"hori_fused_solve_output\", 3, 1, 256]", "cuda -keys=cuda,gpu -max_num_threads=1024 -model=unknown -thread_warp_size=32", [-1, 16, 64, 49152, 2147483647, 1024, 8, 32], "", 0, []], [[], [["FU", 3, [0, 1, 2]], ["SP", 3, 0, 768, [48], 1], ["AN", 3, 0, 5], ["AN", 3, 1, 6]]]], "r": [[3.54807e-06, 3.55056e-06, 3.55117e-06], 0, 3.71179, 1694815553], "v": "v0.6"}
{"i": [["[\"hori_fused_solve_output\", 3, 1, 256]", "cuda -keys=cuda,gpu -max_num_threads=1024 -model=unknown -thread_warp_size=32", [-1, 16, 64, 49152, 2147483647, 1024, 8, 32], "", 0, []], [[], [["FU", 3, [0, 1, 2]], ["SP", 3, 0, 768, [8], 1], ["AN", 3, 0, 5], ["AN", 3, 1, 6]]]], "r": [[3.8613e-06, 3.86091e-06, 3.86409e-06], 0, 4.09089, 1694815553], "v": "v0.6"}
{"i": [["[\"hori_fused_solve_output\", 3, 1, 256]", "cuda -keys=cuda,gpu -max_num_threads=1024 -model=unknown -thread_warp_size=32", [-1, 16, 64, 49152, 2147483647, 1024, 8, 32], "", 0, []], [[], [["FU", 3, [0, 1, 2]], ["SP", 3, 0, 768, [4], 1], ["AN", 3, 0, 5], ["AN", 3, 1, 6]]]], "r": [[3.77274e-06, 3.77416e-06, 3.77124e-06], 0, 4.4568, 1694815554], "v": "v0.6"}
{"i": [["[\"hori_fused_solve_output\", 3, 1, 256]", "cuda -keys=cuda,gpu -max_num_threads=1024 -model=unknown -thread_warp_size=32", [-1, 16, 64, 49152, 2147483647, 1024, 8, 32], "", 0, []], [[], [["FU", 3, [0, 1, 2]], ["SP", 3, 0, 768, [24], 1], ["AN", 3, 0, 5], ["AN", 3, 1, 6]]]], "r": [[3.64544e-06, 3.64401e-06, 3.64632e-06], 0, 4.92845, 1694815554], "v": "v0.6"}
{"i": [["[\"hori_fused_solve_output\", 3, 1, 256]", "cuda -keys=cuda,gpu -max_num_threads=1024 -model=unknown -thread_warp_size=32", [-1, 16, 64, 49152, 2147483647, 1024, 8, 32], "", 0, []], [[], [["FU", 3, [0, 1, 2]], ["SP", 3, 0, 768, [6], 1], ["AN", 3, 0, 5], ["AN", 3, 1, 6]]]], "r": [[3.57282e-06, 3.57205e-06, 3.57258e-06], 0, 0.88298, 1694859372], "v": "v0.6"}
{"i": [["[\"hori_fused_solve_output\", 3, 1, 256]", "cuda -keys=cuda,gpu -max_num_threads=1024 -model=unknown -thread_warp_size=32", [-1, 16, 64, 49152, 2147483647, 1024, 8, 32], "", 0, []], [[], [["FU", 3, [0, 1, 2]], ["SP", 3, 0, 768, [4], 1], ["AN", 3, 0, 5], ["AN", 3, 1, 6]]]], "r": [[3.93087e-06, 3.93835e-06, 3.93795e-06], 0, 2.32118, 1694859374], "v": "v0.6"}
{"i": [["[\"hori_fused_solve_output\", 3, 1, 256]", "cuda -keys=cuda,gpu -max_num_threads=1024 -model=unknown -thread_warp_size=32", [-1, 16, 64, 49152, 2147483647, 1024, 8, 32], "", 0, []], [[], [["FU", 3, [0, 1, 2]], ["SP", 3, 0, 768, [16], 1], ["AN", 3, 0, 5], ["AN", 3, 1, 6]]]], "r": [[3.44809e-06, 3.44877e-06, 3.4483e-06], 0, 1.65389, 1694859373], "v": "v0.6"}
{"i": [["[\"hori_fused_solve_output\", 3, 1, 256]", "cuda -keys=cuda,gpu -max_num_threads=1024 -model=unknown -thread_warp_size=32", [-1, 16, 64, 49152, 2147483647, 1024, 8, 32], "", 0, []], [[], [["FU", 3, [0, 1, 2]], ["SP", 3, 0, 768, [24], 1], ["AN", 3, 0, 5], ["AN", 3, 1, 6]]]], "r": [[3.59385e-06, 3.64964e-06, 3.64647e-06], 0, 1.95134, 1694859374], "v": "v0.6"}
{"i": [["[\"hori_fused_solve_output\", 3, 1, 256]", "cuda -keys=cuda,gpu -max_num_threads=1024 -model=unknown -thread_warp_size=32", [-1, 16, 64, 49152, 2147483647, 1024, 8, 32], "", 0, []], [[], [["FU", 3, [0, 1, 2]], ["SP", 3, 0, 768, [48], 1], ["AN", 3, 0, 5], ["AN", 3, 1, 6]]]], "r": [[3.75512e-06, 3.75186e-06, 3.75489e-06], 0, 1.27404, 1694859373], "v": "v0.6"}
{"i": [["[\"hori_fused_solve_output\", 3, 1, 256]", "cuda -keys=cuda,gpu -max_num_threads=1024 -model=unknown -thread_warp_size=32", [-1, 16, 64, 49152, 2147483647, 1024, 8, 32], "", 0, []], [[], [["FU", 3, [0, 1, 2]], ["SP", 3, 0, 768, [3], 1], ["AN", 3, 0, 5], ["AN", 3, 1, 6]]]], "r": [[3.87656e-06, 3.87773e-06, 3.87907e-06], 0, 0.850462, 1694859372], "v": "v0.6"}
{"i": [["[\"hori_fused_solve_output\", 3, 1, 256]", "cuda -keys=cuda,gpu -max_num_threads=1024 -model=unknown -thread_warp_size=32", [-1, 16, 64, 49152, 2147483647, 1024, 8, 32], "", 0, []], [[], [["FU", 3, [0, 1, 2]], ["SP", 3, 0, 768, [8], 1], ["AN", 3, 0, 5], ["AN", 3, 1, 6]]]], "r": [[3.6915e-06, 3.69285e-06, 3.69706e-06], 0, 3.82901, 1694859375], "v": "v0.6"}
{"i": [["[\"hori_fused_solve_output\", 3, 1, 256]", "cuda -keys=cuda,gpu -max_num_threads=1024 -model=unknown -thread_warp_size=32", [-1, 16, 64, 49152, 2147483647, 1024, 8, 32], "", 0, []], [[], [["FU", 3, [0, 1, 2]], ["SP", 3, 0, 768, [1], 1], ["AN", 3, 0, 5], ["AN", 3, 1, 6]]]], "r": [[4.53111e-06, 4.53202e-06, 4.53242e-06], 0, 3.11837, 1694859375], "v": "v0.6"}
{"i": [["[\"hori_fused_solve_output\", 3, 1, 256]", "cuda -keys=cuda,gpu -max_num_threads=1024 -model=unknown -thread_warp_size=32", [-1, 16, 64, 49152, 2147483647, 1024, 8, 32], "", 0, []], [[], [["FU", 3, [0, 1, 2]], ["SP", 3, 0, 768, [2], 1], ["AN", 3, 0, 5], ["AN", 3, 1, 6]]]], "r": [[4.23714e-06, 4.24761e-06, 4.24769e-06], 0, 4.5544, 1694859376], "v": "v0.6"}
{"i": [["[\"hori_fused_solve_output\", 3, 1, 256]", "cuda -keys=cuda,gpu -max_num_threads=1024 -model=unknown -thread_warp_size=32", [-1, 16, 64, 49152, 2147483647, 1024, 8, 32], "", 0, []], [[], [["FU", 3, [0, 1, 2]], ["SP", 3, 0, 768, [12], 1], ["AN", 3, 0, 5], ["AN", 3, 1, 6]]]], "r": [[3.54954e-06, 3.55424e-06, 3.55193e-06], 0, 4.19907, 1694859376], "v": "v0.6"}
{"i": [["[\"hori_fused_solve_output\", 3, 1, 256]", "cuda -keys=cuda,gpu -max_num_threads=1024 -model=unknown -thread_warp_size=32", [-1, 16, 64, 49152, 2147483647, 1024, 8, 32], "", 0, []], [[], [["FU", 3, [0, 1, 2]], ["SP", 3, 0, 768, [64], 1], ["AN", 3, 0, 5], ["AN", 3, 1, 6]]]], "r": [[3.75941e-06, 3.76979e-06, 3.76962e-06], 0, 3.49366, 1694859375], "v": "v0.6"}
{"i": [["[\"hori_fused_solve_output\", 3, 1, 256]", "cuda -keys=cuda,gpu -max_num_threads=1024 -model=unknown -thread_warp_size=32", [-1, 16, 64, 49152, 2147483647, 1024, 8, 32], "", 0, []], [[], [["FU", 3, [0, 1, 2]], ["SP", 3, 0, 768, [32], 1], ["AN", 3, 0, 5], ["AN", 3, 1, 6]]]], "r": [[3.86326e-06, 3.87481e-06, 3.87553e-06], 0, 2.69656, 1694859374], "v": "v0.6"}
