python/models/lstm/kernel_configs/hori_fused_solve_output_8_1_256.log
{"i": [["[\"hori_fused_solve_output\", 8, 1, 256]", "cuda -keys=cuda,gpu -max_num_threads=1024 -model=unknown -thread_warp_size=32", [-1, 16, 64, 49152, 2147483647, 1024, 8, 32], "", 0, []], [[], [["FU", 3, [0, 1, 2]], ["SP", 3, 0, 2048, [8], 1], ["AN", 3, 0, 5], ["AN", 3, 1, 6]]]], "r": [[3.77537e-06, 3.77545e-06, 3.77531e-06], 0, 1.70637, 1694815701], "v": "v0.6"}
{"i": [["[\"hori_fused_solve_output\", 8, 1, 256]", "cuda -keys=cuda,gpu -max_num_threads=1024 -model=unknown -thread_warp_size=32", [-1, 16, 64, 49152, 2147483647, 1024, 8, 32], "", 0, []], [[], [["FU", 3, [0, 1, 2]], ["SP", 3, 0, 2048, [32], 1], ["AN", 3, 0, 5], ["AN", 3, 1, 6]]]], "r": [[3.71811e-06, 3.71154e-06, 3.70729e-06], 0, 0.605802, 1694815699], "v": "v0.6"}
{"i": [["[\"hori_fused_solve_output\", 8, 1, 256]", "cuda -keys=cuda,gpu -max_num_threads=1024 -model=unknown -thread_warp_size=32", [-1, 16, 64, 49152, 2147483647, 1024, 8, 32], "", 0, []], [[], [["FU", 3, [0, 1, 2]], ["SP", 3, 0, 2048, [4], 1], ["AN", 3, 0, 5], ["AN", 3, 1, 6]]]], "r": [[4.27917e-06, 4.28943e-06, 4.28547e-06], 0, 0.958243, 1694815700], "v": "v0.6"}
{"i": [["[\"hori_fused_solve_output\", 8, 1, 256]", "cuda -keys=cuda,gpu -max_num_threads=1024 -model=unknown -thread_warp_size=32", [-1, 16, 64, 49152, 2147483647, 1024, 8, 32], "", 0, []], [[], [["FU", 3, [0, 1, 2]], ["SP", 3, 0, 2048, [16], 1], ["AN", 3, 0, 5], ["AN", 3, 1, 6]]]], "r": [[3.58623e-06, 3.58678e-06, 3.58675e-06], 0, 2.08729, 1694815701], "v": "v0.6"}
{"i": [["[\"hori_fused_solve_output\", 8, 1, 256]", "cuda -keys=cuda,gpu -max_num_threads=1024 -model=unknown -thread_warp_size=32", [-1, 16, 64, 49152, 2147483647, 1024, 8, 32], "", 0, []], [[], [["FU", 3, [0, 1, 2]], ["SP", 3, 0, 2048, [64], 1], ["AN", 3, 0, 5], ["AN", 3, 1, 6]]]], "r": [[3.66985e-06, 3.669e-06, 3.67292e-06], 0, 2.87893, 1694815702], "v": "v0.6"}
{"i": [["[\"hori_fused_solve_output\", 8, 1, 256]", "cuda -keys=cuda,gpu -max_num_threads=1024 -model=unknown -thread_warp_size=32", [-1, 16, 64, 49152, 2147483647, 1024, 8, 32], "", 0, []], [[], [["FU", 3, [0, 1, 2]], ["SP", 3, 0, 2048, [2], 1], ["AN", 3, 0, 5], ["AN", 3, 1, 6]]]], "r": [[4.56984e-06, 4.57092e-06, 4.57064e-06], 0, 2.51801, 1694815701], "v": "v0.6"}
{"i": [["[\"hori_fused_solve_output\", 8, 1, 256]", "cuda -keys=cuda,gpu -max_num_threads=1024 -model=unknown -thread_warp_size=32", [-1, 16, 64, 49152, 2147483647, 1024, 8, 32], "", 0, []], [[], [["FU", 3, [0, 1, 2]], ["SP", 3, 0, 2048, [1], 1], ["AN", 3, 0, 5], ["AN", 3, 1, 6]]]], "r": [[5.67371e-06, 5.67825e-06, 5.68205e-06], 0, 1.31335, 1694815700], "v": "v0.6"}
{"i": [["[\"hori_fused_solve_output\", 8, 1, 256]", "cuda -keys=cuda,gpu -max_num_threads=1024 -model=unknown -thread_warp_size=32", [-1, 16, 64, 49152, 2147483647, 1024, 8, 32], "", 0, []], [[], [["FU", 3, [0, 1, 2]], ["SP", 3, 0, 2048, [8], 1], ["AN", 3, 0, 5], ["AN", 3, 1, 6]]]], "r": [[3.74031e-06, 3.74126e-06, 3.74113e-06], 0, 2.05884, 1694859504], "v": "v0.6"}
{"i": [["[\"hori_fused_solve_output\", 8, 1, 256]", "cuda -keys=cuda,gpu -max_num_threads=1024 -model=unknown -thread_warp_size=32", [-1, 16, 64, 49152, 2147483647, 1024, 8, 32], "", 0, []], [[], [["FU", 3, [0, 1, 2]], ["SP", 3, 0, 2048, [4], 1], ["AN", 3, 0, 5], ["AN", 3, 1, 6]]]], "r": [[4.30267e-06, 4.31373e-06, 4.31222e-06], 0, 1.31354, 1694859503], "v": "v0.6"}
{"i": [["[\"hori_fused_solve_output\", 8, 1, 256]", "cuda -keys=cuda,gpu -max_num_threads=1024 -model=unknown -thread_warp_size=32", [-1, 16, 64, 49152, 2147483647, 1024, 8, 32], "", 0, []], [[], [["FU", 3, [0, 1, 2]], ["SP", 3, 0, 2048, [1], 1], ["AN", 3, 0, 5], ["AN", 3, 1, 6]]]], "r": [[5.71942e-06, 5.72772e-06, 5.72719e-06], 0, 0.923034, 1694859503], "v": "v0.6"}
{"i": [["[\"hori_fused_solve_output\", 8, 1, 256]", "cuda -keys=cuda,gpu -max_num_threads=1024 -model=unknown -thread_warp_size=32", [-1, 16, 64, 49152, 2147483647, 1024, 8, 32], "", 0, []], [[], [["FU", 3, [0, 1, 2]], ["SP", 3, 0, 2048, [16], 1], ["AN", 3, 0, 5], ["AN", 3, 1, 6]]]], "r": [[3.53734e-06, 3.53714e-06, 3.53687e-06], 0, 0.584824, 1694859502], "v": "v0.6"}
{"i": [["[\"hori_fused_solve_output\", 8, 1, 256]", "cuda -keys=cuda,gpu -max_num_threads=1024 -model=unknown -thread_warp_size=32", [-1, 16, 64, 49152, 2147483647, 1024, 8, 32], "", 0, []], [[], [["FU", 3, [0, 1, 2]], ["SP", 3, 0, 2048, [32], 1], ["AN", 3, 0, 5], ["AN", 3, 1, 6]]]], "r": [[3.84716e-06, 3.85518e-06, 3.8556e-06], 0, 2.80432, 1694859505], "v": "v0.6"}
{"i": [["[\"hori_fused_solve_output\", 8, 1, 256]", "cuda -keys=cuda,gpu -max_num_threads=1024 -model=unknown -thread_warp_size=32", [-1, 16, 64, 49152, 2147483647, 1024, 8, 32], "", 0, []], [[], [["FU", 3, [0, 1, 2]], ["SP", 3, 0, 2048, [2], 1], ["AN", 3, 0, 5], ["AN", 3, 1, 6]]]], "r": [[4.45739e-06, 4.45693e-06, 4.4567e-06], 0, 1.67111, 1694859503], "v": "v0.6"}
{"i": [["[\"hori_fused_solve_output\", 8, 1, 256]", "cuda -keys=cuda,gpu -max_num_threads=1024 -model=unknown -thread_warp_size=32", [-1, 16, 64, 49152, 2147483647, 1024, 8, 32], "", 0, []], [[], [["FU", 3, [0, 1, 2]], ["SP", 3, 0, 2048, [64], 1], ["AN", 3, 0, 5], ["AN", 3, 1, 6]]]], "r": [[3.57082e-06, 3.57069e-06, 3.57129e-06], 0, 2.45378, 1694859504], "v": "v0.6"}
