python/models/lstm/kernel_configs/hori_fused_solve_7_1_256.log
{"i": [["[\"hori_verti_fused_solve\", 7, 1, 256]", "cuda -keys=cuda,gpu -max_num_threads=1024 -model=unknown -thread_warp_size=32", [-1, 16, 64, 49152, 2147483647, 1024, 8, 32], "", 0, []], [[], [["CI", 7], ["FU", 10, [0, 1, 2]], ["SP", 10, 0, 1792, [64], 1], ["AN", 10, 0, 5], ["AN", 10, 1, 6]]]], "r": [[4.86696e-06, 4.89495e-06, 4.89661e-06], 0, 2.49968, 1696451963], "v": "v0.6"}
{"i": [["[\"hori_verti_fused_solve\", 7, 1, 256]", "cuda -keys=cuda,gpu -max_num_threads=1024 -model=unknown -thread_warp_size=32", [-1, 16, 64, 49152, 2147483647, 1024, 8, 32], "", 0, []], [[], [["CI", 7], ["FU", 10, [0, 1, 2]], ["SP", 10, 0, 1792, [7], 1], ["AN", 10, 0, 5], ["AN", 10, 1, 6]]]], "r": [[5.00914e-06, 5.01415e-06, 5.0143e-06], 0, 2.09458, 1696451962], "v": "v0.6"}
{"i": [["[\"hori_verti_fused_solve\", 7, 1, 256]", "cuda -keys=cuda,gpu -max_num_threads=1024 -model=unknown -thread_warp_size=32", [-1, 16, 64, 49152, 2147483647, 1024, 8, 32], "", 0, []], [[], [["CI", 7], ["FU", 10, [0, 1, 2]], ["SP", 10, 0, 1792, [14], 1], ["AN", 10, 0, 5], ["AN", 10, 1, 6]]]], "r": [[4.93805e-06, 4.95122e-06, 4.95214e-06], 0, 1.58392, 1696451962], "v": "v0.6"}
{"i": [["[\"hori_verti_fused_solve\", 7, 1, 256]", "cuda -keys=cuda,gpu -max_num_threads=1024 -model=unknown -thread_warp_size=32", [-1, 16, 64, 49152, 2147483647, 1024, 8, 32], "", 0, []], [[], [["CI", 7], ["FU", 10, [0, 1, 2]], ["SP", 10, 0, 1792, [16], 1], ["AN", 10, 0, 5], ["AN", 10, 1, 6]]]], "r": [[5.08974e-06, 5.09784e-06, 5.09723e-06], 0, 4.13878, 1696451964], "v": "v0.6"}
{"i": [["[\"hori_verti_fused_solve\", 7, 1, 256]", "cuda -keys=cuda,gpu -max_num_threads=1024 -model=unknown -thread_warp_size=32", [-1, 16, 64, 49152, 2147483647, 1024, 8, 32], "", 0, []], [[], [["CI", 7], ["FU", 10, [0, 1, 2]], ["SP", 10, 0, 1792, [32], 1], ["AN", 10, 0, 5], ["AN", 10, 1, 6]]]], "r": [[4.83413e-06, 4.84112e-06, 4.84371e-06], 0, 2.89022, 1696451963], "v": "v0.6"}
{"i": [["[\"hori_verti_fused_solve\", 7, 1, 256]", "cuda -keys=cuda,gpu -max_num_threads=1024 -model=unknown -thread_warp_size=32", [-1, 16, 64, 49152, 2147483647, 1024, 8, 32], "", 0, []], [[], [["CI", 7], ["FU", 10, [0, 1, 2]], ["SP", 10, 0, 1792, [56], 1], ["AN", 10, 0, 5], ["AN", 10, 1, 6]]]], "r": [[4.76212e-06, 4.76747e-06, 4.76765e-06], 0, 3.75985, 1696451964], "v": "v0.6"}
{"i": [["[\"hori_verti_fused_solve\", 7, 1, 256]", "cuda -keys=cuda,gpu -max_num_threads=1024 -model=unknown -thread_warp_size=32", [-1, 16, 64, 49152, 2147483647, 1024, 8, 32], "", 0, []], [[], [["CI", 7], ["FU", 10, [0, 1, 2]], ["SP", 10, 0, 1792, [8], 1], ["AN", 10, 0, 5], ["AN", 10, 1, 6]]]], "r": [[5.28243e-06, 5.28862e-06, 5.2961e-06], 0, 3.28907, 1696451963], "v": "v0.6"}
{"i": [["[\"hori_verti_fused_solve\", 7, 1, 256]", "cuda -keys=cuda,gpu -max_num_threads=1024 -model=unknown -thread_warp_size=32", [-1, 16, 64, 49152, 2147483647, 1024, 8, 32], "", 0, []], [[], [["CI", 7], ["FU", 10, [0, 1, 2]], ["SP", 10, 0, 1792, [2], 1], ["AN", 10, 0, 5], ["AN", 10, 1, 6]]]], "r": [[5.70538e-06, 5.69933e-06, 5.70099e-06], 0, 0.73848, 1696451961], "v": "v0.6"}
{"i": [["[\"hori_verti_fused_solve\", 7, 1, 256]", "cuda -keys=cuda,gpu -max_num_threads=1024 -model=unknown -thread_warp_size=32", [-1, 16, 64, 49152, 2147483647, 1024, 8, 32], "", 0, []], [[], [["CI", 7], ["FU", 10, [0, 1, 2]], ["SP", 10, 0, 1792, [1], 1], ["AN", 10, 0, 5], ["AN", 10, 1, 6]]]], "r": [[6.55296e-06, 6.55285e-06, 6.56794e-06], 0, 4.56058, 1696451965], "v": "v0.6"}
{"i": [["[\"hori_verti_fused_solve\", 7, 1, 256]", "cuda -keys=cuda,gpu -max_num_threads=1024 -model=unknown -thread_warp_size=32", [-1, 16, 64, 49152, 2147483647, 1024, 8, 32], "", 0, []], [[], [["CI", 7], ["FU", 10, [0, 1, 2]], ["SP", 10, 0, 1792, [28], 1], ["AN", 10, 0, 5], ["AN", 10, 1, 6]]]], "r": [[4.92936e-06, 4.93692e-06, 4.93445e-06], 0, 1.14845, 1696451961], "v": "v0.6"}
{"i": [["[\"hori_verti_fused_solve\", 7, 1, 256]", "cuda -keys=cuda,gpu -max_num_threads=1024 -model=unknown -thread_warp_size=32", [-1, 16, 64, 49152, 2147483647, 1024, 8, 32], "", 0, []], [[], [["CI", 7], ["FU", 10, [0, 1, 2]], ["SP", 10, 0, 1792, [4], 1], ["AN", 10, 0, 5], ["AN", 10, 1, 6]]]], "r": [[5.36823e-06, 5.38259e-06, 5.38101e-06], 0, 4.95915, 1696451965], "v": "v0.6"}
