python/models/lstm/kernel_configs/hori_fused_solve_output_6_1_256.log
{"i": [["[\"hori_fused_solve_output\", 6, 1, 256]", "cuda -keys=cuda,gpu -max_num_threads=1024 -model=unknown -thread_warp_size=32", [-1, 16, 64, 49152, 2147483647, 1024, 8, 32], "", 0, []], [[], [["FU", 3, [0, 1, 2]], ["SP", 3, 0, 1536, [3], 1], ["AN", 3, 0, 5], ["AN", 3, 1, 6]]]], "r": [[4.13677e-06, 4.16567e-06, 4.16838e-06], 0, 2.82043, 1694815642], "v": "v0.6"}
{"i": [["[\"hori_fused_solve_output\", 6, 1, 256]", "cuda -keys=cuda,gpu -max_num_threads=1024 -model=unknown -thread_warp_size=32", [-1, 16, 64, 49152, 2147483647, 1024, 8, 32], "", 0, []], [[], [["FU", 3, [0, 1, 2]], ["SP", 3, 0, 1536, [48], 1], ["AN", 3, 0, 5], ["AN", 3, 1, 6]]]], "r": [[3.56865e-06, 3.56759e-06, 3.56472e-06], 0, 0.649901, 1694815639], "v": "v0.6"}
{"i": [["[\"hori_fused_solve_output\", 6, 1, 256]", "cuda -keys=cuda,gpu -max_num_threads=1024 -model=unknown -thread_warp_size=32", [-1, 16, 64, 49152, 2147483647, 1024, 8, 32], "", 0, []], [[], [["FU", 3, [0, 1, 2]], ["SP", 3, 0, 1536, [12], 1], ["AN", 3, 0, 5], ["AN", 3, 1, 6]]]], "r": [[3.74211e-06, 3.739e-06, 3.73889e-06], 0, 2.44359, 1694815641], "v": "v0.6"}
{"i": [["[\"hori_fused_solve_output\", 6, 1, 256]", "cuda -keys=cuda,gpu -max_num_threads=1024 -model=unknown -thread_warp_size=32", [-1, 16, 64, 49152, 2147483647, 1024, 8, 32], "", 0, []], [[], [["FU", 3, [0, 1, 2]], ["SP", 3, 0, 1536, [2], 1], ["AN", 3, 0, 5], ["AN", 3, 1, 6]]]], "r": [[4.41227e-06, 4.40461e-06, 4.39705e-06], 0, 3.63393, 1694815643], "v": "v0.6"}
{"i": [["[\"hori_fused_solve_output\", 6, 1, 256]", "cuda -keys=cuda,gpu -max_num_threads=1024 -model=unknown -thread_warp_size=32", [-1, 16, 64, 49152, 2147483647, 1024, 8, 32], "", 0, []], [[], [["FU", 3, [0, 1, 2]], ["SP", 3, 0, 1536, [8], 1], ["AN", 3, 0, 5], ["AN", 3, 1, 6]]]], "r": [[3.62138e-06, 3.62137e-06, 3.6209e-06], 0, 1.69932, 1694815641], "v": "v0.6"}
{"i": [["[\"hori_fused_solve_output\", 6, 1, 256]", "cuda -keys=cuda,gpu -max_num_threads=1024 -model=unknown -thread_warp_size=32", [-1, 16, 64, 49152, 2147483647, 1024, 8, 32], "", 0, []], [[], [["FU", 3, [0, 1, 2]], ["SP", 3, 0, 1536, [64], 1], ["AN", 3, 0, 5], ["AN", 3, 1, 6]]]], "r": [[3.57102e-06, 3.57063e-06, 3.57122e-06], 0, 1.01011, 1694815640], "v": "v0.6"}
{"i": [["[\"hori_fused_solve_output\", 6, 1, 256]", "cuda -keys=cuda,gpu -max_num_threads=1024 -model=unknown -thread_warp_size=32", [-1, 16, 64, 49152, 2147483647, 1024, 8, 32], "", 0, []], [[], [["FU", 3, [0, 1, 2]], ["SP", 3, 0, 1536, [32], 1], ["AN", 3, 0, 5], ["AN", 3, 1, 6]]]], "r": [[3.58007e-06, 3.60509e-06, 3.61185e-06], 0, 2.02476, 1694815641], "v": "v0.6"}
{"i": [["[\"hori_fused_solve_output\", 6, 1, 256]", "cuda -keys=cuda,gpu -max_num_threads=1024 -model=unknown -thread_warp_size=32", [-1, 16, 64, 49152, 2147483647, 1024, 8, 32], "", 0, []], [[], [["FU", 3, [0, 1, 2]], ["SP", 3, 0, 1536, [16], 1], ["AN", 3, 0, 5], ["AN", 3, 1, 6]]]], "r": [[3.85408e-06, 3.86521e-06, 3.86394e-06], 0, 1.31756, 1694815640], "v": "v0.6"}
{"i": [["[\"hori_fused_solve_output\", 6, 1, 256]", "cuda -keys=cuda,gpu -max_num_threads=1024 -model=unknown -thread_warp_size=32", [-1, 16, 64, 49152, 2147483647, 1024, 8, 32], "", 0, []], [[], [["FU", 3, [0, 1, 2]], ["SP", 3, 0, 1536, [1], 1], ["AN", 3, 0, 5], ["AN", 3, 1, 6]]]], "r": [[4.9692e-06, 4.96977e-06, 4.96813e-06], 0, 3.18483, 1694815642], "v": "v0.6"}
{"i": [["[\"hori_fused_solve_output\", 6, 1, 256]", "cuda -keys=cuda,gpu -max_num_threads=1024 -model=unknown -thread_warp_size=32", [-1, 16, 64, 49152, 2147483647, 1024, 8, 32], "", 0, []], [[], [["FU", 3, [0, 1, 2]], ["SP", 3, 0, 1536, [24], 1], ["AN", 3, 0, 5], ["AN", 3, 1, 6]]]], "r": [[3.58091e-06, 3.57732e-06, 3.58069e-06], 0, 3.96636, 1694815643], "v": "v0.6"}
{"i": [["[\"hori_fused_solve_output\", 6, 1, 256]", "cuda -keys=cuda,gpu -max_num_threads=1024 -model=unknown -thread_warp_size=32", [-1, 16, 64, 49152, 2147483647, 1024, 8, 32], "", 0, []], [[], [["FU", 3, [0, 1, 2]], ["SP", 3, 0, 1536, [4], 1], ["AN", 3, 0, 5], ["AN", 3, 1, 6]]]], "r": [[4.19484e-06, 4.2026e-06, 4.20191e-06], 0, 4.34623, 1694815643], "v": "v0.6"}
{"i": [["[\"hori_fused_solve_output\", 6, 1, 256]", "cuda -keys=cuda,gpu -max_num_threads=1024 -model=unknown -thread_warp_size=32", [-1, 16, 64, 49152, 2147483647, 1024, 8, 32], "", 0, []], [[], [["FU", 3, [0, 1, 2]], ["SP", 3, 0, 1536, [6], 1], ["AN", 3, 0, 5], ["AN", 3, 1, 6]]]], "r": [[4.08186e-06, 4.09469e-06, 4.09482e-06], 0, 4.70734, 1694815644], "v": "v0.6"}
{"i": [["[\"hori_fused_solve_output\", 6, 1, 256]", "cuda -keys=cuda,gpu -max_num_threads=1024 -model=unknown -thread_warp_size=32", [-1, 16, 64, 49152, 2147483647, 1024, 8, 32], "", 0, []], [[], [["FU", 3, [0, 1, 2]], ["SP", 3, 0, 1536, [8], 1], ["AN", 3, 0, 5], ["AN", 3, 1, 6]]]], "r": [[3.93863e-06, 3.9382e-06, 3.93614e-06], 0, 0.769084, 1694859446], "v": "v0.6"}
{"i": [["[\"hori_fused_solve_output\", 6, 1, 256]", "cuda -keys=cuda,gpu -max_num_threads=1024 -model=unknown -thread_warp_size=32", [-1, 16, 64, 49152, 2147483647, 1024, 8, 32], "", 0, []], [[], [["FU", 3, [0, 1, 2]], ["SP", 3, 0, 1536, [24], 1], ["AN", 3, 0, 5], ["AN", 3, 1, 6]]]], "r": [[3.58296e-06, 3.58304e-06, 3.58396e-06], 0, 1.62671, 1694859447], "v": "v0.6"}
{"i": [["[\"hori_fused_solve_output\", 6, 1, 256]", "cuda -keys=cuda,gpu -max_num_threads=1024 -model=unknown -thread_warp_size=32", [-1, 16, 64, 49152, 2147483647, 1024, 8, 32], "", 0, []], [[], [["FU", 3, [0, 1, 2]], ["SP", 3, 0, 1536, [64], 1], ["AN", 3, 0, 5], ["AN", 3, 1, 6]]]], "r": [[3.82521e-06, 3.83354e-06, 3.83427e-06], 0, 1.25049, 1694859447], "v": "v0.6"}
{"i": [["[\"hori_fused_solve_output\", 6, 1, 256]", "cuda -keys=cuda,gpu -max_num_threads=1024 -model=unknown -thread_warp_size=32", [-1, 16, 64, 49152, 2147483647, 1024, 8, 32], "", 0, []], [[], [["FU", 3, [0, 1, 2]], ["SP", 3, 0, 1536, [12], 1], ["AN", 3, 0, 5], ["AN", 3, 1, 6]]]], "r": [[3.85359e-06, 3.853e-06, 3.85276e-06], 0, 2.41358, 1694859448], "v": "v0.6"}
{"i": [["[\"hori_fused_solve_output\", 6, 1, 256]", "cuda -keys=cuda,gpu -max_num_threads=1024 -model=unknown -thread_warp_size=32", [-1, 16, 64, 49152, 2147483647, 1024, 8, 32], "", 0, []], [[], [["FU", 3, [0, 1, 2]], ["SP", 3, 0, 1536, [3], 1], ["AN", 3, 0, 5], ["AN", 3, 1, 6]]]], "r": [[4.28349e-06, 4.28315e-06, 4.28332e-06], 0, 0.949495, 1694859447], "v": "v0.6"}
{"i": [["[\"hori_fused_solve_output\", 6, 1, 256]", "cuda -keys=cuda,gpu -max_num_threads=1024 -model=unknown -thread_warp_size=32", [-1, 16, 64, 49152, 2147483647, 1024, 8, 32], "", 0, []], [[], [["FU", 3, [0, 1, 2]], ["SP", 3, 0, 1536, [16], 1], ["AN", 3, 0, 5], ["AN", 3, 1, 6]]]], "r": [[3.90492e-06, 3.91615e-06, 3.91726e-06], 0, 3.07809, 1694859449], "v": "v0.6"}
{"i": [["[\"hori_fused_solve_output\", 6, 1, 256]", "cuda -keys=cuda,gpu -max_num_threads=1024 -model=unknown -thread_warp_size=32", [-1, 16, 64, 49152, 2147483647, 1024, 8, 32], "", 0, []], [[], [["FU", 3, [0, 1, 2]], ["SP", 3, 0, 1536, [2], 1], ["AN", 3, 0, 5], ["AN", 3, 1, 6]]]], "r": [[4.56583e-06, 4.56627e-06, 4.56579e-06], 0, 2.0085, 1694859448], "v": "v0.6"}
{"i": [["[\"hori_fused_solve_output\", 6, 1, 256]", "cuda -keys=cuda,gpu -max_num_threads=1024 -model=unknown -thread_warp_size=32", [-1, 16, 64, 49152, 2147483647, 1024, 8, 32], "", 0, []], [[], [["FU", 3, [0, 1, 2]], ["SP", 3, 0, 1536, [4], 1], ["AN", 3, 0, 5], ["AN", 3, 1, 6]]]], "r": [[3.83486e-06, 3.83479e-06, 3.83471e-06], 0, 3.48558, 1694859449], "v": "v0.6"}
{"i": [["[\"hori_fused_solve_output\", 6, 1, 256]", "cuda -keys=cuda,gpu -max_num_threads=1024 -model=unknown -thread_warp_size=32", [-1, 16, 64, 49152, 2147483647, 1024, 8, 32], "", 0, []], [[], [["FU", 3, [0, 1, 2]], ["SP", 3, 0, 1536, [1], 1], ["AN", 3, 0, 5], ["AN", 3, 1, 6]]]], "r": [[5.00647e-06, 5.00513e-06, 5.00984e-06], 0, 2.7532, 1694859448], "v": "v0.6"}
{"i": [["[\"hori_fused_solve_output\", 6, 1, 256]", "cuda -keys=cuda,gpu -max_num_threads=1024 -model=unknown -thread_warp_size=32", [-1, 16, 64, 49152, 2147483647, 1024, 8, 32], "", 0, []], [[], [["FU", 3, [0, 1, 2]], ["SP", 3, 0, 1536, [32], 1], ["AN", 3, 0, 5], ["AN", 3, 1, 6]]]], "r": [[3.59108e-06, 3.59007e-06, 3.59066e-06], 0, 4.65356, 1694859450], "v": "v0.6"}
{"i": [["[\"hori_fused_solve_output\", 6, 1, 256]", "cuda -keys=cuda,gpu -max_num_threads=1024 -model=unknown -thread_warp_size=32", [-1, 16, 64, 49152, 2147483647, 1024, 8, 32], "", 0, []], [[], [["FU", 3, [0, 1, 2]], ["SP", 3, 0, 1536, [48], 1], ["AN", 3, 0, 5], ["AN", 3, 1, 6]]]], "r": [[3.88741e-06, 3.89647e-06, 3.89469e-06], 0, 3.81206, 1694859450], "v": "v0.6"}
{"i": [["[\"hori_fused_solve_output\", 6, 1, 256]", "cuda -keys=cuda,gpu -max_num_threads=1024 -model=unknown -thread_warp_size=32", [-1, 16, 64, 49152, 2147483647, 1024, 8, 32], "", 0, []], [[], [["FU", 3, [0, 1, 2]], ["SP", 3, 0, 1536, [6], 1], ["AN", 3, 0, 5], ["AN", 3, 1, 6]]]], "r": [[3.84981e-06, 3.84909e-06, 3.84885e-06], 0, 4.18852, 1694859450], "v": "v0.6"}
