python/models/lstm/kernel_configs/hori_fused_solve_5_1_256.log
{"i": [["[\"hori_fused_solve\", 5, 1, 256]", "cuda -keys=cuda,gpu -max_num_threads=1024 -model=unknown -thread_warp_size=32", [-1, 16, 64, 49152, 2147483647, 1024, 8, 32], "", 0, []], [[], [["CI", 7], ["FU", 10, [0, 1, 2]], ["SP", 10, 0, 1280, [2], 1], ["AN", 10, 0, 5], ["AN", 10, 1, 6]]]], "r": [[3.08963e-06, 2.8194e-06, 2.81679e-06], 0, 1.14468, 1694769354], "v": "v0.6"}
{"i": [["[\"hori_fused_solve\", 5, 1, 256]", "cuda -keys=cuda,gpu -max_num_threads=1024 -model=unknown -thread_warp_size=32", [-1, 16, 64, 49152, 2147483647, 1024, 8, 32], "", 0, []], [[], [["CI", 7], ["FU", 10, [0, 1, 2]], ["SP", 10, 0, 1280, [1], 1], ["AN", 10, 0, 5], ["AN", 10, 1, 6]]]], "r": [[3.21504e-06, 3.22811e-06, 3.23076e-06], 0, 0.682681, 1694769354], "v": "v0.6"}
{"i": [["[\"hori_fused_solve\", 5, 1, 256]", "cuda -keys=cuda,gpu -max_num_threads=1024 -model=unknown -thread_warp_size=32", [-1, 16, 64, 49152, 2147483647, 1024, 8, 32], "", 0, []], [[], [["CI", 7], ["FU", 10, [0, 1, 2]], ["SP", 10, 0, 1280, [32], 1], ["AN", 10, 0, 5], ["AN", 10, 1, 6]]]], "r": [[2.45751e-06, 2.46404e-06, 2.46752e-06], 0, 1.3593, 1694769354], "v": "v0.6"}
{"i": [["[\"hori_fused_solve\", 5, 1, 256]", "cuda -keys=cuda,gpu -max_num_threads=1024 -model=unknown -thread_warp_size=32", [-1, 16, 64, 49152, 2147483647, 1024, 8, 32], "", 0, []], [[], [["CI", 7], ["FU", 10, [0, 1, 2]], ["SP", 10, 0, 1280, [4], 1], ["AN", 10, 0, 5], ["AN", 10, 1, 6]]]], "r": [[3.84927e-06, 3.24522e-06, 2.59015e-06], 0, 0.964622, 1694769354], "v": "v0.6"}
{"i": [["[\"hori_fused_solve\", 5, 1, 256]", "cuda -keys=cuda,gpu -max_num_threads=1024 -model=unknown -thread_warp_size=32", [-1, 16, 64, 49152, 2147483647, 1024, 8, 32], "", 0, []], [[], [["CI", 7], ["FU", 10, [0, 1, 2]], ["SP", 10, 0, 1280, [10], 1], ["AN", 10, 0, 5], ["AN", 10, 1, 6]]]], "r": [[2.65413e-06, 2.50584e-06, 2.50544e-06], 0, 1.86891, 1694769355], "v": "v0.6"}
{"i": [["[\"hori_fused_solve\", 5, 1, 256]", "cuda -keys=cuda,gpu -max_num_threads=1024 -model=unknown -thread_warp_size=32", [-1, 16, 64, 49152, 2147483647, 1024, 8, 32], "", 0, []], [[], [["CI", 7], ["FU", 10, [0, 1, 2]], ["SP", 10, 0, 1280, [8], 1], ["AN", 10, 0, 5], ["AN", 10, 1, 6]]]], "r": [[2.78286e-06, 2.47048e-06, 2.46994e-06], 0, 2.08139, 1694769355], "v": "v0.6"}
{"i": [["[\"hori_fused_solve\", 5, 1, 256]", "cuda -keys=cuda,gpu -max_num_threads=1024 -model=unknown -thread_warp_size=32", [-1, 16, 64, 49152, 2147483647, 1024, 8, 32], "", 0, []], [[], [["CI", 7], ["FU", 10, [0, 1, 2]], ["SP", 10, 0, 1280, [40], 1], ["AN", 10, 0, 5], ["AN", 10, 1, 6]]]], "r": [[2.47927e-06, 2.47539e-06, 2.47679e-06], 0, 1.74402, 1694769355], "v": "v0.6"}
{"i": [["[\"hori_fused_solve\", 5, 1, 256]", "cuda -keys=cuda,gpu -max_num_threads=1024 -model=unknown -thread_warp_size=32", [-1, 16, 64, 49152, 2147483647, 1024, 8, 32], "", 0, []], [[], [["CI", 7], ["FU", 10, [0, 1, 2]], ["SP", 10, 0, 1280, [5], 1], ["AN", 10, 0, 5], ["AN", 10, 1, 6]]]], "r": [[3.85755e-06, 3.91786e-06, 3.91676e-06], 0, 2.42728, 1694769355], "v": "v0.6"}
{"i": [["[\"hori_fused_solve\", 5, 1, 256]", "cuda -keys=cuda,gpu -max_num_threads=1024 -model=unknown -thread_warp_size=32", [-1, 16, 64, 49152, 2147483647, 1024, 8, 32], "", 0, []], [[], [["CI", 7], ["FU", 10, [0, 1, 2]], ["SP", 10, 0, 1280, [16], 1], ["AN", 10, 0, 5], ["AN", 10, 1, 6]]]], "r": [[4.5929e-06, 3.94218e-06, 3.93155e-06], 0, 2.69778, 1694769356], "v": "v0.6"}
{"i": [["[\"hori_fused_solve\", 5, 1, 256]", "cuda -keys=cuda,gpu -max_num_threads=1024 -model=unknown -thread_warp_size=32", [-1, 16, 64, 49152, 2147483647, 1024, 8, 32], "", 0, []], [[], [["CI", 7], ["FU", 10, [0, 1, 2]], ["SP", 10, 0, 1280, [64], 1], ["AN", 10, 0, 5], ["AN", 10, 1, 6]]]], "r": [[3.09539e-06, 2.46596e-06, 2.46352e-06], 0, 2.88754, 1694769356], "v": "v0.6"}
{"i": [["[\"hori_fused_solve\", 5, 1, 256]", "cuda -keys=cuda,gpu -max_num_threads=1024 -model=unknown -thread_warp_size=32", [-1, 16, 64, 49152, 2147483647, 1024, 8, 32], "", 0, []], [[], [["CI", 7], ["FU", 10, [0, 1, 2]], ["SP", 10, 0, 1280, [20], 1], ["AN", 10, 0, 5], ["AN", 10, 1, 6]]]], "r": [[3.00849e-06, 2.47108e-06, 3.25313e-06], 0, 2.48499, 1694769356], "v": "v0.6"}
{"i": [["[\"hori_fused_solve\", 5, 1, 256]", "cuda -keys=cuda,gpu -max_num_threads=1024 -model=unknown -thread_warp_size=32", [-1, 16, 64, 49152, 2147483647, 1024, 8, 32], "", 0, []], [[], [["CI", 7], ["FU", 10, [0, 1, 2]], ["SP", 10, 0, 1280, [5], 1], ["AN", 10, 0, 5], ["AN", 10, 1, 6]]]], "r": [[5.00204e-06, 5.00175e-06, 5.00264e-06], 0, 2.62362, 1694795931], "v": "v0.6"}
{"i": [["[\"hori_fused_solve\", 5, 1, 256]", "cuda -keys=cuda,gpu -max_num_threads=1024 -model=unknown -thread_warp_size=32", [-1, 16, 64, 49152, 2147483647, 1024, 8, 32], "", 0, []], [[], [["CI", 7], ["FU", 10, [0, 1, 2]], ["SP", 10, 0, 1280, [8], 1], ["AN", 10, 0, 5], ["AN", 10, 1, 6]]]], "r": [[5.14106e-06, 5.15719e-06, 5.15726e-06], 0, 1.44017, 1694795929], "v": "v0.6"}
{"i": [["[\"hori_fused_solve\", 5, 1, 256]", "cuda -keys=cuda,gpu -max_num_threads=1024 -model=unknown -thread_warp_size=32", [-1, 16, 64, 49152, 2147483647, 1024, 8, 32], "", 0, []], [[], [["CI", 7], ["FU", 10, [0, 1, 2]], ["SP", 10, 0, 1280, [2], 1], ["AN", 10, 0, 5], ["AN", 10, 1, 6]]]], "r": [[5.50821e-06, 5.59521e-06, 5.5982e-06], 0, 0.876925, 1694795929], "v": "v0.6"}
{"i": [["[\"hori_fused_solve\", 5, 1, 256]", "cuda -keys=cuda,gpu -max_num_threads=1024 -model=unknown -thread_warp_size=32", [-1, 16, 64, 49152, 2147483647, 1024, 8, 32], "", 0, []], [[], [["CI", 7], ["FU", 10, [0, 1, 2]], ["SP", 10, 0, 1280, [4], 1], ["AN", 10, 0, 5], ["AN", 10, 1, 6]]]], "r": [[5.05841e-06, 5.05851e-06, 5.05866e-06], 0, 1.57027, 1694795929], "v": "v0.6"}
{"i": [["[\"hori_fused_solve\", 5, 1, 256]", "cuda -keys=cuda,gpu -max_num_threads=1024 -model=unknown -thread_warp_size=32", [-1, 16, 64, 49152, 2147483647, 1024, 8, 32], "", 0, []], [[], [["CI", 7], ["FU", 10, [0, 1, 2]], ["SP", 10, 0, 1280, [16], 1], ["AN", 10, 0, 5], ["AN", 10, 1, 6]]]], "r": [[4.86327e-06, 4.86093e-06, 4.86422e-06], 0, 2.13822, 1694795930], "v": "v0.6"}
{"i": [["[\"hori_fused_solve\", 5, 1, 256]", "cuda -keys=cuda,gpu -max_num_threads=1024 -model=unknown -thread_warp_size=32", [-1, 16, 64, 49152, 2147483647, 1024, 8, 32], "", 0, []], [[], [["CI", 7], ["FU", 10, [0, 1, 2]], ["SP", 10, 0, 1280, [32], 1], ["AN", 10, 0, 5], ["AN", 10, 1, 6]]]], "r": [[4.68549e-06, 4.6851e-06, 4.68526e-06], 0, 3.00836, 1694795931], "v": "v0.6"}
{"i": [["[\"hori_fused_solve\", 5, 1, 256]", "cuda -keys=cuda,gpu -max_num_threads=1024 -model=unknown -thread_warp_size=32", [-1, 16, 64, 49152, 2147483647, 1024, 8, 32], "", 0, []], [[], [["CI", 7], ["FU", 10, [0, 1, 2]], ["SP", 10, 0, 1280, [40], 1], ["AN", 10, 0, 5], ["AN", 10, 1, 6]]]], "r": [[4.9292e-06, 4.92913e-06, 4.93003e-06], 0, 1.83302, 1694795930], "v": "v0.6"}
{"i": [["[\"hori_fused_solve\", 5, 1, 256]", "cuda -keys=cuda,gpu -max_num_threads=1024 -model=unknown -thread_warp_size=32", [-1, 16, 64, 49152, 2147483647, 1024, 8, 32], "", 0, []], [[], [["CI", 7], ["FU", 10, [0, 1, 2]], ["SP", 10, 0, 1280, [1], 1], ["AN", 10, 0, 5], ["AN", 10, 1, 6]]]], "r": [[6.29024e-06, 6.30906e-06, 6.30788e-06], 0, 3.15635, 1694795931], "v": "v0.6"}
{"i": [["[\"hori_fused_solve\", 5, 1, 256]", "cuda -keys=cuda,gpu -max_num_threads=1024 -model=unknown -thread_warp_size=32", [-1, 16, 64, 49152, 2147483647, 1024, 8, 32], "", 0, []], [[], [["CI", 7], ["FU", 10, [0, 1, 2]], ["SP", 10, 0, 1280, [64], 1], ["AN", 10, 0, 5], ["AN", 10, 1, 6]]]], "r": [[4.7666e-06, 4.76698e-06, 4.76708e-06], 0, 3.60092, 1694795932], "v": "v0.6"}
{"i": [["[\"hori_fused_solve\", 5, 1, 256]", "cuda -keys=cuda,gpu -max_num_threads=1024 -model=unknown -thread_warp_size=32", [-1, 16, 64, 49152, 2147483647, 1024, 8, 32], "", 0, []], [[], [["CI", 7], ["FU", 10, [0, 1, 2]], ["SP", 10, 0, 1280, [20], 1], ["AN", 10, 0, 5], ["AN", 10, 1, 6]]]], "r": [[4.83328e-06, 4.8329e-06, 4.83233e-06], 0, 3.91208, 1694795932], "v": "v0.6"}
{"i": [["[\"hori_fused_solve\", 5, 1, 256]", "cuda -keys=cuda,gpu -max_num_threads=1024 -model=unknown -thread_warp_size=32", [-1, 16, 64, 49152, 2147483647, 1024, 8, 32], "", 0, []], [[], [["CI", 7], ["FU", 10, [0, 1, 2]], ["SP", 10, 0, 1280, [10], 1], ["AN", 10, 0, 5], ["AN", 10, 1, 6]]]], "r": [[5.0553e-06, 5.07282e-06, 5.07286e-06], 0, 4.30097, 1694795932], "v": "v0.6"}
